{
  "date": "2025-06-24",
  "date_of_scrape": "2025-06-25T04:18:01.822Z",
  "tool_version": "0.2.0",
  "number_of_announcements": 166,
  "announcements": [
    {
      "date": "2025-06-24",
      "id": "113080",
      "original_text": "Registerbekanntmachung nach dem Umwandlungsgesetz\nBayern Amtsgericht Landshut HRB 9109\nPichlmayr GmbH & Co. KGaA – Eggenfelden",
      "type": "Registerbekanntmachung nach dem Umwandlungsgesetz",
      "state": "Bayern",
      "amtsgericht": "Amtsgericht Landshut",
      "registernummer": "HRB 9109",
      "registerart": "HRB",
      "company_name": "Pichlmayr GmbH & Co. KGaA",
      "company_seat": "Eggenfelden",
      "details": "24.06.2025 (Bekanntmachungsdatum)\n\nBayern Amtsgericht Landshut HRB 9109\nRegisterbekanntmachung nach dem Umwandlungsgesetz 18.06.2025 (Eintragungsdatum)\n\nPichlmayr GmbH & Co. KGaA\nKommanditgesellschaft auf Aktien\nEggenfelden\n\nDem Amtsgericht Landshut -Registergericht- ist der Entwurf eines Verschmelzungsvertrages zwischen der FJ Finanzen GmbH, Eggenfelden (Amtsgericht Landshut HRB 13306) und der Gesellschaft als übertragendem Rechtsträger zur Einsichtnahme eingereicht worden."
    },
    {
      "date": "2025-06-24",
      "id": "113081",
      "original_text": "Registerbekanntmachung nach dem Umwandlungsgesetz\nBayern Amtsgericht München HRB 216630\nCHECK24 Vergleichsportal Autoteile GmbH – München",
      "type": "Registerbekanntmachung nach dem Umwandlungsgesetz",
      "state": "Bayern",
      "amtsgericht": "Amtsgericht München",
      "registernummer": "HRB 216630",
      "registerart": "HRB",
      "company_name": "CHECK24 Vergleichsportal Autoteile GmbH",
      "company_seat": "München",
      "details": "24.06.2025 (Bekanntmachungsdatum)\n\nBayern Amtsgericht München HRB 216630\nRegisterbekanntmachung nach dem Umwandlungsgesetz 22.06.2025 (Eintragungsdatum)\n\nCHECK24 Vergleichsportal Autoteile GmbH\nGesellschaft mit beschränkter Haftung\nMünchen\n\nDen Gläubigern der an der Spaltung beteiligten Rechtsträger ist, wenn sie binnen sechs Monaten nach dem Tag, an dem die Eintragung der Spaltung in das Register des Sitzes desjenigen Rechtsträgers, dessen Gläubiger sie sind, nach §§ 125, 19 Abs. 3 UmwG als bekannt gemacht gilt, ihren Anspruch nach Grund und Höhe in Textform anmelden, Sicherheit zu leisten, soweit sie nicht Befriedigung verlangen können. Dieses Recht steht den Gläubigern jedoch nur zu, wenn sie glaubhaft machen, dass durch die Spaltung die Erfüllung ihrer Forderung gefährdet wird."
    },
    {
      "date": "2025-06-24",
      "id": "113082",
      "original_text": "Löschungsankündigung\nBayern Amtsgericht Traunstein HRB 30005\nRRE Rico Reinigungs & Express UG (haftungsbeschränkt) – Rosenheim",
      "type": "Löschungsankündigung",
      "state": "Bayern",
      "amtsgericht": "Amtsgericht Traunstein",
      "registernummer": "HRB 30005",
      "registerart": "HRB",
      "company_name": "RRE Rico Reinigungs & Express UG (haftungsbeschränkt)",
      "company_seat": "Rosenheim",
      "details": "24.06.2025 (Bekanntmachungsdatum)\n\nBayern Amtsgericht Traunstein HRB 30005\nLöschungsankündigung\n\nRRE Rico Reinigungs & Express UG (haftungsbeschränkt)\nGesellschaft mit beschränkter Haftung\nRosenheim\n\nDas Registergericht beabsichtigt, die im Handelsregister eingetragene Gesellschaft wegen Vermögenslosigkeit von Amts wegen nach § 394 FamFG zu löschen. Die Frist zur Erhebung eines Widerspruchs ist auf drei Monate festgesetzt."
    },
    {
      "date": "2025-06-24",
      "id": "113083",
      "original_text": "Registerbekanntmachung nach dem Umwandlungsgesetz\nBayern Amtsgericht München HRB 186241\nTerra Canis GmbH – Garching b.München",
      "type": "Registerbekanntmachung nach dem Umwandlungsgesetz",
      "state": "Bayern",
      "amtsgericht": "Amtsgericht München",
      "registernummer": "HRB 186241",
      "registerart": "HRB",
      "company_name": "Terra Canis GmbH",
      "company_seat": "Garching b.München",
      "details": "24.06.2025 (Bekanntmachungsdatum)\n\nBayern Amtsgericht München HRB 186241\nRegisterbekanntmachung nach dem Umwandlungsgesetz 23.06.2025 (Eintragungsdatum)\n\nTerra Canis GmbH\nGesellschaft mit beschränkter Haftung\nGarching b.München\n\nDen Gläubigern der an der Verschmelzung beteiligten Rechtsträger ist, wenn sie binnen sechs Monaten nach dem Tag, an dem die Eintragung der Verschmelzung in das Register des Sitzes desjenigen Rechtsträgers, dessen Gläubiger sie sind, nach § 19 Abs. 3 UmwG als bekannt gemacht gilt, ihren Anspruch nach Grund und Höhe in Textform anmelden, Sicherheit zu leisten, soweit sie nicht Befriedigung verlangen können. Dieses Recht steht den Gläubigern jedoch nur zu, wenn sie glaubhaft machen, dass durch die Verschmelzung die Erfüllung ihrer Forderung gefährdet wird."
    },
    {
      "date": "2025-06-24",
      "id": "113084",
      "original_text": "Registerbekanntmachung nach dem Umwandlungsgesetz\nBayern Amtsgericht Kempten (Allgäu) HRB 4008\nPCK IT Solutions GmbH – Kempten (Allgäu)",
      "type": "Registerbekanntmachung nach dem Umwandlungsgesetz",
      "state": "Bayern",
      "amtsgericht": "Amtsgericht Kempten (Allgäu)",
      "registernummer": "HRB 4008",
      "registerart": "HRB",
      "company_name": "PCK IT Solutions GmbH",
      "company_seat": "Kempten (Allgäu)",
      "details": "24.06.2025 (Bekanntmachungsdatum)\n\nBayern Amtsgericht Kempten (Allgäu) HRB 4008\nRegisterbekanntmachung nach dem Umwandlungsgesetz 21.06.2025 (Eintragungsdatum)\n\nPCK IT Solutions GmbH\nGesellschaft mit beschränkter Haftung\nKempten (Allgäu)\n\nDen Gläubigern der an der Verschmelzung beteiligten Rechtsträger ist, wenn sie binnen sechs Monaten nach dem Tag, an dem die Eintragung der Verschmelzung in das Register des Sitzes desjenigen Rechtsträgers, dessen Gläubiger sie sind, nach § 19 Abs. 3 UmwG als bekannt gemacht gilt, ihren Anspruch nach Grund und Höhe in Textform anmelden, Sicherheit zu leisten, soweit sie nicht Befriedigung verlangen können. Dieses Recht steht den Gläubigern jedoch nur zu, wenn sie glaubhaft machen, dass durch die Verschmelzung die Erfüllung ihrer Forderung gefährdet wird."
    },
    {
      "date": "2025-06-24",
      "id": "113085",
      "original_text": "Einreichung neuer Dokumente\nBayern Amtsgericht München HRB 300475\nYouco M-D25178 Vorrats-SE – München",
      "type": "Einreichung neuer Dokumente",
      "state": "Bayern",
      "amtsgericht": "Amtsgericht München",
      "registernummer": "HRB 300475",
      "registerart": "HRB",
      "company_name": "Youco M-D25178 Vorrats-SE",
      "company_seat": "München",
      "details": "24.06.2025 (Bekanntmachungsdatum)\n\nBayern Amtsgericht München HRB 300475\nEinreichung neuer Dokumente 23.06.2025 (Eintragungsdatum)\n\nYouco M-D25178 Vorrats-SE\nEuropäische Aktiengesellschaft (SE)\nMünchen\n\nDem Amtsgericht München -Registergericht- ist eine Liste der Mitglieder des Aufsichtsrats eingereicht worden, Art. 9 Abs. 1 Buchst. c (ii) SE-VO i.V.m. § 106 AktG."
    },
    {
      "date": "2025-06-24",
      "id": "113086",
      "original_text": "Löschungsankündigung\nBayern Amtsgericht München HRB 253819\nCL5 GmbH – München",
      "type": "Löschungsankündigung",
      "state": "Bayern",
      "amtsgericht": "Amtsgericht München",
      "registernummer": "HRB 253819",
      "registerart": "HRB",
      "company_name": "CL5 GmbH",
      "company_seat": "München",
      "details": "24.06.2025 (Bekanntmachungsdatum)\n\nBayern Amtsgericht München HRB 253819\nLöschungsankündigung 23.06.2025 (Eintragungsdatum)\n\nCL5 GmbH\nGesellschaft mit beschränkter Haftung\nMünchen\n\nDas Registergericht beabsichtigt, die im Handelsregister eingetragene Gesellschaft wegen Vermögenslosigkeit von Amts wegen nach § 394 FamFG zu löschen. Die Frist zur Erhebung eines Widerspruchs ist auf drei Monate festgesetzt."
    },
    {
      "date": "2025-06-24",
      "id": "113087",
      "original_text": "Registerbekanntmachung nach dem Umwandlungsgesetz\nBayern Amtsgericht Schweinfurt HRA 10694\nPawlitzki Versicherungsmakler GmbH & Co. KG – Poppenhausen",
      "type": "Registerbekanntmachung nach dem Umwandlungsgesetz",
      "state": "Bayern",
      "amtsgericht": "Amtsgericht Schweinfurt",
      "registernummer": "HRA 10694",
      "registerart": "HRA",
      "company_name": "Pawlitzki Versicherungsmakler GmbH & Co. KG",
      "company_seat": "Poppenhausen",
      "details": "24.06.2025 (Bekanntmachungsdatum)\n\nBayern Amtsgericht Schweinfurt HRA 10694\nRegisterbekanntmachung nach dem Umwandlungsgesetz 23.06.2025 (Eintragungsdatum)\n\nPawlitzki Versicherungsmakler GmbH & Co. KG\nKommanditgesellschaft\nPoppenhausen\n\nDen Gläubigern der an der Ausgliederung beteiligten Rechtsträger ist, wenn sie binnen sechs Monaten nach dem Tag, an dem die Eintragung der Ausgliederung in das Register des Sitzes desjenigen Rechtsträgers, dessen Gläubiger sie sind, nach §§ 125, 19 Abs. 3 UmwG als bekannt gemacht gilt, ihren Anspruch nach Grund und Höhe in Textform anmelden, Sicherheit zu leisten, soweit sie nicht Befriedigung verlangen können. Dieses Recht steht den Gläubigern jedoch nur zu, wenn sie glaubhaft machen, dass durch die Ausgliederung die Erfüllung ihrer Forderung gefährdet wird."
    },
    {
      "date": "2025-06-24",
      "id": "113088",
      "original_text": "Registerbekanntmachung nach dem Umwandlungsgesetz\nBayern Amtsgericht München HRB 236984\nCheck MK Holding GmbH – München",
      "type": "Registerbekanntmachung nach dem Umwandlungsgesetz",
      "state": "Bayern",
      "amtsgericht": "Amtsgericht München",
      "registernummer": "HRB 236984",
      "registerart": "HRB",
      "company_name": "Check MK Holding GmbH",
      "company_seat": "München",
      "details": "24.06.2025 (Bekanntmachungsdatum)\n\nBayern Amtsgericht München HRB 236984\nRegisterbekanntmachung nach dem Umwandlungsgesetz 18.06.2025 (Eintragungsdatum)\n\nCheck MK Holding GmbH\nGesellschaft mit beschränkter Haftung\nMünchen\n\nDen Gläubigern der an der Verschmelzung beteiligten Rechtsträger ist, wenn sie binnen sechs Monaten nach dem Tag, an dem die Eintragung der Verschmelzung in das Register des Sitzes desjenigen Rechtsträgers, dessen Gläubiger sie sind, nach § 19 Abs. 3 UmwG als bekannt gemacht gilt, ihren Anspruch nach Grund und Höhe in Textform anmelden, Sicherheit zu leisten, soweit sie nicht Befriedigung verlangen können. Dieses Recht steht den Gläubigern jedoch nur zu, wenn sie glaubhaft machen, dass durch die Verschmelzung die Erfüllung ihrer Forderung gefährdet wird."
    },
    {
      "date": "2025-06-24",
      "id": "113089",
      "original_text": "Löschungsankündigung\nBayern Amtsgericht Kempten (Allgäu) HRB 14953\nDanisman Transport & Logistik GmbH – Kempten (Allgäu)",
      "type": "Löschungsankündigung",
      "state": "Bayern",
      "amtsgericht": "Amtsgericht Kempten (Allgäu)",
      "registernummer": "HRB 14953",
      "registerart": "HRB",
      "company_name": "Danisman Transport & Logistik GmbH",
      "company_seat": "Kempten (Allgäu)",
      "details": "24.06.2025 (Bekanntmachungsdatum)\n\nBayern Amtsgericht Kempten (Allgäu) HRB 14953\nLöschungsankündigung\n\nDanisman Transport & Logistik GmbH\nGesellschaft mit beschränkter Haftung\nKempten (Allgäu)\n\nDas Registergericht beabsichtigt, die im Handelsregister eingetragene Gesellschaft wegen Vermögenslosigkeit von Amts wegen nach § 394 FamFG zu löschen. Die Frist zur Erhebung eines Widerspruchs ist auf einen Monat festgesetzt."
    },
    {
      "date": "2025-06-24",
      "id": "113090",
      "original_text": "Registerbekanntmachung nach dem Umwandlungsgesetz\nBayern Amtsgericht München HRB 138131\ns-Karten-Service-Management GmbH - Saarbrücken-München – München",
      "type": "Registerbekanntmachung nach dem Umwandlungsgesetz",
      "state": "Bayern",
      "amtsgericht": "Amtsgericht München",
      "registernummer": "HRB 138131",
      "registerart": "HRB",
      "company_name": "s-Karten-Service-Management GmbH - Saarbrücken-München",
      "company_seat": "München",
      "details": "24.06.2025 (Bekanntmachungsdatum)\n\nBayern Amtsgericht München HRB 138131\nRegisterbekanntmachung nach dem Umwandlungsgesetz 23.06.2025 (Eintragungsdatum)\n\ns-Karten-Service-Management GmbH - Saarbrücken-München\nGesellschaft mit beschränkter Haftung\nMünchen\n\nDen Gläubigern der an der Verschmelzung beteiligten Rechtsträger ist, wenn sie binnen sechs Monaten nach dem Tag, an dem die Eintragung der Verschmelzung in das Register des Sitzes desjenigen Rechtsträgers, dessen Gläubiger sie sind, nach § 19 Abs. 3 UmwG als bekannt gemacht gilt, ihren Anspruch nach Grund und Höhe in Textform anmelden, Sicherheit zu leisten, soweit sie nicht Befriedigung verlangen können. Dieses Recht steht den Gläubigern jedoch nur zu, wenn sie glaubhaft machen, dass durch die Verschmelzung die Erfüllung ihrer Forderung gefährdet wird."
    },
    {
      "date": "2025-06-24",
      "id": "113091",
      "original_text": "Registerbekanntmachung nach dem Umwandlungsgesetz\nBayern Amtsgericht München HRB 283440\nLuitpold Labs GmbH – München",
      "type": "Registerbekanntmachung nach dem Umwandlungsgesetz",
      "state": "Bayern",
      "amtsgericht": "Amtsgericht München",
      "registernummer": "HRB 283440",
      "registerart": "HRB",
      "company_name": "Luitpold Labs GmbH",
      "company_seat": "München",
      "details": "24.06.2025 (Bekanntmachungsdatum)\n\nBayern Amtsgericht München HRB 283440\nRegisterbekanntmachung nach dem Umwandlungsgesetz 23.06.2025 (Eintragungsdatum)\n\nLuitpold Labs GmbH\nGesellschaft mit beschränkter Haftung\nMünchen\n\nDen Gläubigern der an der Verschmelzung beteiligten Rechtsträger ist, wenn sie binnen sechs Monaten nach dem Tag, an dem die Eintragung der Verschmelzung in das Register des Sitzes desjenigen Rechtsträgers, dessen Gläubiger sie sind, nach § 19 Abs. 3 UmwG als bekannt gemacht gilt, ihren Anspruch nach Grund und Höhe in Textform anmelden, Sicherheit zu leisten, soweit sie nicht Befriedigung verlangen können. Dieses Recht steht den Gläubigern jedoch nur zu, wenn sie glaubhaft machen, dass durch die Verschmelzung die Erfüllung ihrer Forderung gefährdet wird."
    },
    {
      "date": "2025-06-24",
      "id": "113092",
      "original_text": "Registerbekanntmachung nach dem Umwandlungsgesetz\nBayern Amtsgericht München HRB 125363\nFranz Goßler Versicherungsvermittlung GmbH – Oberhaching",
      "type": "Registerbekanntmachung nach dem Umwandlungsgesetz",
      "state": "Bayern",
      "amtsgericht": "Amtsgericht München",
      "registernummer": "HRB 125363",
      "registerart": "HRB",
      "company_name": "Franz Goßler Versicherungsvermittlung GmbH",
      "company_seat": "Oberhaching",
      "details": "24.06.2025 (Bekanntmachungsdatum)\n\nBayern Amtsgericht München HRB 125363\nRegisterbekanntmachung nach dem Umwandlungsgesetz 23.06.2025 (Eintragungsdatum)\n\nFranz Goßler Versicherungsvermittlung GmbH\nGesellschaft mit beschränkter Haftung\nOberhaching\n\nDen Gläubigern der an der Verschmelzung beteiligten Rechtsträger ist, wenn sie binnen sechs Monaten nach dem Tag, an dem die Eintragung der Verschmelzung in das Register des Sitzes desjenigen Rechtsträgers, dessen Gläubiger sie sind, nach § 19 Abs. 3 UmwG als bekannt gemacht gilt, ihren Anspruch nach Grund und Höhe in Textform anmelden, Sicherheit zu leisten, soweit sie nicht Befriedigung verlangen können. Dieses Recht steht den Gläubigern jedoch nur zu, wenn sie glaubhaft machen, dass durch die Verschmelzung die Erfüllung ihrer Forderung gefährdet wird."
    },
    {
      "date": "2025-06-24",
      "id": "113093",
      "original_text": "Registerbekanntmachung nach dem Umwandlungsgesetz\nBayern Amtsgericht München HRB 278621\nmobileX GmbH – München",
      "type": "Registerbekanntmachung nach dem Umwandlungsgesetz",
      "state": "Bayern",
      "amtsgericht": "Amtsgericht München",
      "registernummer": "HRB 278621",
      "registerart": "HRB",
      "company_name": "mobileX GmbH",
      "company_seat": "München",
      "details": "24.06.2025 (Bekanntmachungsdatum)\n\nBayern Amtsgericht München HRB 278621\nRegisterbekanntmachung nach dem Umwandlungsgesetz 23.06.2025 (Eintragungsdatum)\n\nmobileX GmbH\nGesellschaft mit beschränkter Haftung\nMünchen\n\nDen Gläubigern der an der Verschmelzung beteiligten Rechtsträger ist, wenn sie binnen sechs Monaten nach dem Tag, an dem die Eintragung der Verschmelzung in das Register des Sitzes desjenigen Rechtsträgers, dessen Gläubiger sie sind, nach § 19 Abs. 3 UmwG als bekannt gemacht gilt, ihren Anspruch nach Grund und Höhe in Textform anmelden, Sicherheit zu leisten, soweit sie nicht Befriedigung verlangen können. Dieses Recht steht den Gläubigern jedoch nur zu, wenn sie glaubhaft machen, dass durch die Verschmelzung die Erfüllung ihrer Forderung gefährdet wird."
    },
    {
      "date": "2025-06-24",
      "id": "113094",
      "original_text": "Registerbekanntmachung nach dem Umwandlungsgesetz\nBayern Amtsgericht München HRB 285026\nTECVIA Media GmbH – München",
      "type": "Registerbekanntmachung nach dem Umwandlungsgesetz",
      "state": "Bayern",
      "amtsgericht": "Amtsgericht München",
      "registernummer": "HRB 285026",
      "registerart": "HRB",
      "company_name": "TECVIA Media GmbH",
      "company_seat": "München",
      "details": "24.06.2025 (Bekanntmachungsdatum)\n\nBayern Amtsgericht München HRB 285026\nRegisterbekanntmachung nach dem Umwandlungsgesetz 23.06.2025 (Eintragungsdatum)\n\nTECVIA Media GmbH\nGesellschaft mit beschränkter Haftung\nMünchen\n\nDen Gläubigern der an der Spaltung beteiligten Rechtsträger ist, wenn sie binnen sechs Monaten nach dem Tag, an dem die Eintragung der Spaltung in das Register des Sitzes desjenigen Rechtsträgers, dessen Gläubiger sie sind, nach §§ 125, 19 Abs. 3 UmwG als bekannt gemacht gilt, ihren Anspruch nach Grund und Höhe in Textform anmelden, Sicherheit zu leisten, soweit sie nicht Befriedigung verlangen können. Dieses Recht steht den Gläubigern jedoch nur zu, wenn sie glaubhaft machen, dass durch die Spaltung die Erfüllung ihrer Forderung gefährdet wird."
    },
    {
      "date": "2025-06-24",
      "id": "113095",
      "original_text": "Registerbekanntmachung nach dem Umwandlungsgesetz\nBayern Amtsgericht Regensburg PR 174\nOsterwinter PartG mbB Steuerberatungsgesellschaft – Regensburg",
      "type": "Registerbekanntmachung nach dem Umwandlungsgesetz",
      "state": "Bayern",
      "amtsgericht": "Amtsgericht Regensburg",
      "registernummer": "PR 174",
      "registerart": "PR",
      "company_name": "Osterwinter PartG mbB Steuerberatungsgesellschaft",
      "company_seat": "Regensburg",
      "details": "24.06.2025 (Bekanntmachungsdatum)\n\nBayern Amtsgericht Regensburg PR 174\nRegisterbekanntmachung nach dem Umwandlungsgesetz 23.06.2025 (Eintragungsdatum)\n\nOsterwinter PartG mbB Steuerberatungsgesellschaft\nPartnerschaftsgesellschaft\nRegensburg\n\nDen Gläubigern der an der Verschmelzung beteiligten Rechtsträger ist, wenn sie binnen sechs Monaten nach dem Tag, an dem die Eintragung der Verschmelzung in das Register des Sitzes desjenigen Rechtsträgers, dessen Gläubiger sie sind, nach § 19 Abs. 3 UmwG als bekannt gemacht gilt, ihren Anspruch nach Grund und Höhe in Textform anmelden, Sicherheit zu leisten, soweit sie nicht Befriedigung verlangen können. Dieses Recht steht den Gläubigern jedoch nur zu, wenn sie glaubhaft machen, dass durch die Verschmelzung die Erfüllung ihrer Forderung gefährdet wird."
    },
    {
      "date": "2025-06-24",
      "id": "113096",
      "original_text": "Löschungsankündigung\nBayern Amtsgericht München HRB 222637\nFitbounds UG (haftungsbeschränkt) – München",
      "type": "Löschungsankündigung",
      "state": "Bayern",
      "amtsgericht": "Amtsgericht München",
      "registernummer": "HRB 222637",
      "registerart": "HRB",
      "company_name": "Fitbounds UG (haftungsbeschränkt)",
      "company_seat": "München",
      "details": "24.06.2025 (Bekanntmachungsdatum)\n\nBayern Amtsgericht München HRB 222637\nLöschungsankündigung 18.06.2025 (Eintragungsdatum)\n\nFitbounds UG (haftungsbeschränkt)\nGesellschaft mit beschränkter Haftung\nMünchen\n\nDas Registergericht beabsichtigt, die im Handelsregister eingetragene Gesellschaft wegen Vermögenslosigkeit von Amts wegen nach § 394 FamFG zu löschen. Die Frist zur Erhebung eines Widerspruchs ist auf drei Monate festgesetzt."
    },
    {
      "date": "2025-06-24",
      "id": "113097",
      "original_text": "Registerbekanntmachung nach dem Umwandlungsgesetz\nBayern Amtsgericht Memmingen HRB 4409\nKrumbach Online GmbH – Krumbach",
      "type": "Registerbekanntmachung nach dem Umwandlungsgesetz",
      "state": "Bayern",
      "amtsgericht": "Amtsgericht Memmingen",
      "registernummer": "HRB 4409",
      "registerart": "HRB",
      "company_name": "Krumbach Online GmbH",
      "company_seat": "Krumbach",
      "details": "24.06.2025 (Bekanntmachungsdatum)\n\nBayern Amtsgericht Memmingen HRB 4409\nRegisterbekanntmachung nach dem Umwandlungsgesetz 23.06.2025 (Eintragungsdatum)\n\nKrumbach Online GmbH\nGesellschaft mit beschränkter Haftung\nKrumbach\n\nDen Gläubigern der an der Verschmelzung beteiligten Rechtsträger ist, wenn sie binnen sechs Monaten nach dem Tag, an dem die Eintragung der Verschmelzung in das Register des Sitzes desjenigen Rechtsträgers, dessen Gläubiger sie sind, nach § 19 Abs. 3 UmwG als bekannt gemacht gilt, ihren Anspruch nach Grund und Höhe in Textform anmelden, Sicherheit zu leisten, soweit sie nicht Befriedigung verlangen können. Dieses Recht steht den Gläubigern jedoch nur zu, wenn sie glaubhaft machen, dass durch die Verschmelzung die Erfüllung ihrer Forderung gefährdet wird."
    },
    {
      "date": "2025-06-24",
      "id": "113098",
      "original_text": "Registerbekanntmachung nach dem Umwandlungsgesetz\nBayern Amtsgericht Regensburg HRB 16630\nKarin Osterwinter Steuerberatungsgesellschaft mbH – Regensburg",
      "type": "Registerbekanntmachung nach dem Umwandlungsgesetz",
      "state": "Bayern",
      "amtsgericht": "Amtsgericht Regensburg",
      "registernummer": "HRB 16630",
      "registerart": "HRB",
      "company_name": "Karin Osterwinter Steuerberatungsgesellschaft mbH",
      "company_seat": "Regensburg",
      "details": "24.06.2025 (Bekanntmachungsdatum)\n\nBayern Amtsgericht Regensburg HRB 16630\nRegisterbekanntmachung nach dem Umwandlungsgesetz 23.06.2025 (Eintragungsdatum)\n\nKarin Osterwinter Steuerberatungsgesellschaft mbH\nGesellschaft mit beschränkter Haftung\nRegensburg\n\nDen Gläubigern der an der Verschmelzung beteiligten Rechtsträger ist, wenn sie binnen sechs Monaten nach dem Tag, an dem die Eintragung der Verschmelzung in das Register des Sitzes desjenigen Rechtsträgers, dessen Gläubiger sie sind, nach § 19 Abs. 3 UmwG als bekannt gemacht gilt, ihren Anspruch nach Grund und Höhe in Textform anmelden, Sicherheit zu leisten, soweit sie nicht Befriedigung verlangen können. Dieses Recht steht den Gläubigern jedoch nur zu, wenn sie glaubhaft machen, dass durch die Verschmelzung die Erfüllung ihrer Forderung gefährdet wird."
    },
    {
      "date": "2025-06-24",
      "id": "113099",
      "original_text": "Registerbekanntmachung nach dem Umwandlungsgesetz\nBayern Amtsgericht Hof HRB 5904\nAqua Control Diagnosticum GmbH – Hof",
      "type": "Registerbekanntmachung nach dem Umwandlungsgesetz",
      "state": "Bayern",
      "amtsgericht": "Amtsgericht Hof",
      "registernummer": "HRB 5904",
      "registerart": "HRB",
      "company_name": "Aqua Control Diagnosticum GmbH",
      "company_seat": "Hof",
      "details": "24.06.2025 (Bekanntmachungsdatum)\n\nBayern Amtsgericht Hof HRB 5904\nRegisterbekanntmachung nach dem Umwandlungsgesetz 23.06.2025 (Eintragungsdatum)\n\nAqua Control Diagnosticum GmbH\nGesellschaft mit beschränkter Haftung\nHof\n\nDen Gläubigern der an der Verschmelzung beteiligten Rechtsträger ist, wenn sie binnen sechs Monaten nach dem Tag, an dem die Eintragung der Verschmelzung in das Register des Sitzes desjenigen Rechtsträgers, dessen Gläubiger sie sind, nach § 19 Abs. 3 UmwG als bekannt gemacht gilt, ihren Anspruch nach Grund und Höhe in Textform anmelden, Sicherheit zu leisten, soweit sie nicht Befriedigung verlangen können. Dieses Recht steht den Gläubigern jedoch nur zu, wenn sie glaubhaft machen, dass durch die Verschmelzung die Erfüllung ihrer Forderung gefährdet wird."
    },
    {
      "date": "2025-06-24",
      "id": "113100",
      "original_text": "Registerbekanntmachung nach dem Umwandlungsgesetz\nBayern Amtsgericht München GsR 250\nWennberg Immobilien eGbR – Oberhaching",
      "type": "Registerbekanntmachung nach dem Umwandlungsgesetz",
      "state": "Bayern",
      "amtsgericht": "Amtsgericht München",
      "registernummer": "GsR 250",
      "registerart": "GsR",
      "company_name": "Wennberg Immobilien eGbR",
      "company_seat": "Oberhaching",
      "details": "24.06.2025 (Bekanntmachungsdatum)\n\nBayern Amtsgericht München GsR 250\nRegisterbekanntmachung nach dem Umwandlungsgesetz 23.06.2025 (Eintragungsdatum)\n\nWennberg Immobilien eGbR\nGesellschaft bürgerlichen Rechts\nOberhaching\n\nDen Gläubigern der an der Verschmelzung beteiligten Rechtsträger ist, wenn sie binnen sechs Monaten nach dem Tag, an dem die Eintragung der Verschmelzung in das Register des Sitzes desjenigen Rechtsträgers, dessen Gläubiger sie sind, nach § 19 Abs. 3 UmwG als bekannt gemacht gilt, ihren Anspruch nach Grund und Höhe in Textform anmelden, Sicherheit zu leisten, soweit sie nicht Befriedigung verlangen können. Dieses Recht steht den Gläubigern jedoch nur zu, wenn sie glaubhaft machen, dass durch die Verschmelzung die Erfüllung ihrer Forderung gefährdet wird."
    },
    {
      "date": "2025-06-24",
      "id": "113101",
      "original_text": "Einreichung neuer Dokumente\nBayern Amtsgericht Traunstein HRB 8592\nBauer Beteiligungs-GmbH – Wasserburg a.Inn",
      "type": "Einreichung neuer Dokumente",
      "state": "Bayern",
      "amtsgericht": "Amtsgericht Traunstein",
      "registernummer": "HRB 8592",
      "registerart": "HRB",
      "company_name": "Bauer Beteiligungs-GmbH",
      "company_seat": "Wasserburg a.Inn",
      "details": "24.06.2025 (Bekanntmachungsdatum)\n\nBayern Amtsgericht Traunstein HRB 8592\nEinreichung neuer Dokumente\n\nBauer Beteiligungs-GmbH\nGesellschaft mit beschränkter Haftung\nWasserburg a.Inn\n\nDem Amtsgericht Traunstein -Registergericht- ist eine Liste der Mitglieder des Aufsichtsrats eingereicht worden, § 52 Abs. 3 S. 2 GmbHG."
    },
    {
      "date": "2025-06-24",
      "id": "113102",
      "original_text": "Registerbekanntmachung nach dem Umwandlungsgesetz\nBayern Amtsgericht München HRB 184523\nGrit 61. Vermögensverwaltungs GmbH – München",
      "type": "Registerbekanntmachung nach dem Umwandlungsgesetz",
      "state": "Bayern",
      "amtsgericht": "Amtsgericht München",
      "registernummer": "HRB 184523",
      "registerart": "HRB",
      "company_name": "Grit 61. Vermögensverwaltungs GmbH",
      "company_seat": "München",
      "details": "24.06.2025 (Bekanntmachungsdatum)\n\nBayern Amtsgericht München HRB 184523\nRegisterbekanntmachung nach dem Umwandlungsgesetz 23.06.2025 (Eintragungsdatum)\n\nGrit 61. Vermögensverwaltungs GmbH\nGesellschaft mit beschränkter Haftung\nMünchen\n\nDen Gläubigern der an der Verschmelzung beteiligten Rechtsträger ist, wenn sie binnen sechs Monaten nach dem Tag, an dem die Eintragung der Verschmelzung in das Register des Sitzes desjenigen Rechtsträgers, dessen Gläubiger sie sind, nach § 19 Abs. 3 UmwG als bekannt gemacht gilt, ihren Anspruch nach Grund und Höhe in Textform anmelden, Sicherheit zu leisten, soweit sie nicht Befriedigung verlangen können. Dieses Recht steht den Gläubigern jedoch nur zu, wenn sie glaubhaft machen, dass durch die Verschmelzung die Erfüllung ihrer Forderung gefährdet wird."
    },
    {
      "date": "2025-06-24",
      "id": "113103",
      "original_text": "Löschungsankündigung\nBayern Amtsgericht Ansbach HRB 6418\nPROHCON Kaufmännische Beratung UG (haftungsbeschränkt) – Ansbach",
      "type": "Löschungsankündigung",
      "state": "Bayern",
      "amtsgericht": "Amtsgericht Ansbach",
      "registernummer": "HRB 6418",
      "registerart": "HRB",
      "company_name": "PROHCON Kaufmännische Beratung UG (haftungsbeschränkt)",
      "company_seat": "Ansbach",
      "details": "24.06.2025 (Bekanntmachungsdatum)\n\nBayern Amtsgericht Ansbach HRB 6418\nLöschungsankündigung\n\nPROHCON Kaufmännische Beratung UG (haftungsbeschränkt)\nGesellschaft mit beschränkter Haftung\nAnsbach\n\nDas Registergericht beabsichtigt, die im Handelsregister eingetragene Gesellschaft wegen Vermögenslosigkeit von Amts wegen nach § 394 FamFG zu löschen. Die Frist zur Erhebung eines Widerspruchs ist auf sechs Wochen festgesetzt."
    },
    {
      "date": "2025-06-24",
      "id": "113104",
      "original_text": "Einreichung neuer Dokumente\nBayern Amtsgericht München HRB 258262\nLR Health & Beauty SE – München",
      "type": "Einreichung neuer Dokumente",
      "state": "Bayern",
      "amtsgericht": "Amtsgericht München",
      "registernummer": "HRB 258262",
      "registerart": "HRB",
      "company_name": "LR Health & Beauty SE",
      "company_seat": "München",
      "details": "24.06.2025 (Bekanntmachungsdatum)\n\nBayern Amtsgericht München HRB 258262\nEinreichung neuer Dokumente 23.06.2025 (Eintragungsdatum)\n\nLR Health & Beauty SE\nEuropäische Aktiengesellschaft (SE)\nMünchen\n\nDem Amtsgericht München -Registergericht- ist eine Liste der Mitglieder des Aufsichtsrats eingereicht worden, Art. 9 Abs. 1 Buchst. c (ii) SE-VO i.V.m. § 106 AktG."
    },
    {
      "date": "2025-06-24",
      "id": "113105",
      "original_text": "Registerbekanntmachung nach dem Umwandlungsgesetz\nBayern Amtsgericht München HRB 193327\nAT Aero Verwaltungs GmbH – München",
      "type": "Registerbekanntmachung nach dem Umwandlungsgesetz",
      "state": "Bayern",
      "amtsgericht": "Amtsgericht München",
      "registernummer": "HRB 193327",
      "registerart": "HRB",
      "company_name": "AT Aero Verwaltungs GmbH",
      "company_seat": "München",
      "details": "24.06.2025 (Bekanntmachungsdatum)\n\nBayern Amtsgericht München HRB 193327\nRegisterbekanntmachung nach dem Umwandlungsgesetz 23.06.2025 (Eintragungsdatum)\n\nAT Aero Verwaltungs GmbH\nGesellschaft mit beschränkter Haftung\nMünchen\n\nDen Gläubigern der an der Verschmelzung beteiligten Rechtsträger ist, wenn sie binnen sechs Monaten nach dem Tag, an dem die Eintragung der Verschmelzung in das Register des Sitzes desjenigen Rechtsträgers, dessen Gläubiger sie sind, nach § 19 Abs. 3 UmwG als bekannt gemacht gilt, ihren Anspruch nach Grund und Höhe in Textform anmelden, Sicherheit zu leisten, soweit sie nicht Befriedigung verlangen können. Dieses Recht steht den Gläubigern jedoch nur zu, wenn sie glaubhaft machen, dass durch die Verschmelzung die Erfüllung ihrer Forderung gefährdet wird."
    },
    {
      "date": "2025-06-24",
      "id": "113106",
      "original_text": "Registerbekanntmachung nach dem Umwandlungsgesetz\nBayern Amtsgericht München HRA 121060\nJankovic mobiler Pflegedienst e.K. – Hohenfurch",
      "type": "Registerbekanntmachung nach dem Umwandlungsgesetz",
      "state": "Bayern",
      "amtsgericht": "Amtsgericht München",
      "registernummer": "HRA 121060",
      "registerart": "HRA",
      "company_name": "Jankovic mobiler Pflegedienst e.K.",
      "company_seat": "Hohenfurch",
      "details": "24.06.2025 (Bekanntmachungsdatum)\n\nBayern Amtsgericht München HRA 121060\nRegisterbekanntmachung nach dem Umwandlungsgesetz 23.06.2025 (Eintragungsdatum)\n\nJankovic mobiler Pflegedienst e.K.\nEinzelkaufmann / Einzelkauffrau\nHohenfurch\n\nDen Gläubigern der an der Ausgliederung beteiligten Rechtsträger ist, wenn sie binnen sechs Monaten nach dem Tag, an dem die Eintragung der Ausgliederung in das Register des Sitzes desjenigen Rechtsträgers, dessen Gläubiger sie sind, nach §§ 125, 19 Abs. 3 UmwG als bekannt gemacht gilt, ihren Anspruch nach Grund und Höhe in Textform anmelden, Sicherheit zu leisten, soweit sie nicht Befriedigung verlangen können. Dieses Recht steht den Gläubigern jedoch nur zu, wenn sie glaubhaft machen, dass durch die Ausgliederung die Erfüllung ihrer Forderung gefährdet wird."
    },
    {
      "date": "2025-06-24",
      "id": "113107",
      "original_text": "Registerbekanntmachung nach dem Umwandlungsgesetz\nBayern Amtsgericht München HRB 303327\nMGB Handels GmbH – Rudelzhausen",
      "type": "Registerbekanntmachung nach dem Umwandlungsgesetz",
      "state": "Bayern",
      "amtsgericht": "Amtsgericht München",
      "registernummer": "HRB 303327",
      "registerart": "HRB",
      "company_name": "MGB Handels GmbH",
      "company_seat": "Rudelzhausen",
      "details": "24.06.2025 (Bekanntmachungsdatum)\n\nBayern Amtsgericht München HRB 303327\nRegisterbekanntmachung nach dem Umwandlungsgesetz 23.06.2025 (Eintragungsdatum)\n\nMGB Handels GmbH\nGesellschaft mit beschränkter Haftung\nRudelzhausen\n\nDen Gläubigern der an der Ausgliederung beteiligten Rechtsträger ist, wenn sie binnen sechs Monaten nach dem Tag, an dem die Eintragung der Ausgliederung in das Register des Sitzes desjenigen Rechtsträgers, dessen Gläubiger sie sind, nach §§ 125, 19 Abs. 3 UmwG als bekannt gemacht gilt, ihren Anspruch nach Grund und Höhe in Textform anmelden, Sicherheit zu leisten, soweit sie nicht Befriedigung verlangen können. Dieses Recht steht den Gläubigern jedoch nur zu, wenn sie glaubhaft machen, dass durch die Ausgliederung die Erfüllung ihrer Forderung gefährdet wird."
    },
    {
      "date": "2025-06-24",
      "id": "113108",
      "original_text": "Löschungsankündigung\nBayern Amtsgericht München HRB 242939\nMALPE GmbH – Dachau",
      "type": "Löschungsankündigung",
      "state": "Bayern",
      "amtsgericht": "Amtsgericht München",
      "registernummer": "HRB 242939",
      "registerart": "HRB",
      "company_name": "MALPE GmbH",
      "company_seat": "Dachau",
      "details": "24.06.2025 (Bekanntmachungsdatum)\n\nBayern Amtsgericht München HRB 242939\nLöschungsankündigung 18.06.2025 (Eintragungsdatum)\n\nMALPE GmbH\nGesellschaft mit beschränkter Haftung\nDachau\n\nDas Registergericht beabsichtigt, die im Handelsregister eingetragene Gesellschaft wegen Vermögenslosigkeit von Amts wegen nach § 394 FamFG zu löschen. Die Frist zur Erhebung eines Widerspruchs ist auf drei Monate festgesetzt."
    },
    {
      "date": "2025-06-24",
      "id": "113109",
      "original_text": "Sonstige Registerbekanntmachung\nBayern Amtsgericht München HRB 295017\nTalend Germany GmbH – München",
      "type": "Sonstige Registerbekanntmachung",
      "state": "Bayern",
      "amtsgericht": "Amtsgericht München",
      "registernummer": "HRB 295017",
      "registerart": "HRB",
      "company_name": "Talend Germany GmbH",
      "company_seat": "München",
      "details": "24.06.2025 (Bekanntmachungsdatum)\n\nBayern Amtsgericht München HRB 295017\nSonstige Registerbekanntmachung 23.06.2025 (Eintragungsdatum)\n\nTalend Germany GmbH\nGesellschaft mit beschränkter Haftung\nMünchen\n\nDen Gläubigern der an der Verschmelzung beteiligten Rechtsträger ist, wenn sie binnen sechs Monaten nach dem Tag, an dem die Eintragung der Verschmelzung in das Register des Sitzes desjenigen Rechtsträgers, dessen Gläubiger sie sind, nach § 19 Abs. 3 UmwG als bekannt gemacht gilt, ihren Anspruch nach Grund und Höhe in Textform anmelden, Sicherheit zu leisten, soweit sie nicht Befriedigung verlangen können. Dieses Recht steht den Gläubigern jedoch nur zu, wenn sie glaubhaft machen, dass durch die Verschmelzung die Erfüllung ihrer Forderung gefährdet wird."
    },
    {
      "date": "2025-06-24",
      "id": "113110",
      "original_text": "Registerbekanntmachung nach dem Umwandlungsgesetz\nBayern Amtsgericht München HRB 252686\nCadSoft Computer GmbH – München",
      "type": "Registerbekanntmachung nach dem Umwandlungsgesetz",
      "state": "Bayern",
      "amtsgericht": "Amtsgericht München",
      "registernummer": "HRB 252686",
      "registerart": "HRB",
      "company_name": "CadSoft Computer GmbH",
      "company_seat": "München",
      "details": "24.06.2025 (Bekanntmachungsdatum)\n\nBayern Amtsgericht München HRB 252686\nRegisterbekanntmachung nach dem Umwandlungsgesetz 23.06.2025 (Eintragungsdatum)\n\nCadSoft Computer GmbH\nGesellschaft mit beschränkter Haftung\nMünchen\n\nDen Gläubigern der an der Verschmelzung beteiligten Rechtsträger ist, wenn sie binnen sechs Monaten nach dem Tag, an dem die Eintragung der Verschmelzung in das Register des Sitzes desjenigen Rechtsträgers, dessen Gläubiger sie sind, nach § 19 Abs. 3 UmwG als bekannt gemacht gilt, ihren Anspruch nach Grund und Höhe in Textform anmelden, Sicherheit zu leisten, soweit sie nicht Befriedigung verlangen können. Dieses Recht steht den Gläubigern jedoch nur zu, wenn sie glaubhaft machen, dass durch die Verschmelzung die Erfüllung ihrer Forderung gefährdet wird."
    },
    {
      "date": "2025-06-24",
      "id": "113111",
      "original_text": "Registerbekanntmachung nach dem Umwandlungsgesetz\nBayern Amtsgericht Nürnberg HRB 3293\nBKM Präzisionswerkzeuge, Stanz- und Biegeteile GmbH – Schwabach",
      "type": "Registerbekanntmachung nach dem Umwandlungsgesetz",
      "state": "Bayern",
      "amtsgericht": "Amtsgericht Nürnberg",
      "registernummer": "HRB 3293",
      "registerart": "HRB",
      "company_name": "BKM Präzisionswerkzeuge, Stanz- und Biegeteile GmbH",
      "company_seat": "Schwabach",
      "details": "24.06.2025 (Bekanntmachungsdatum)\n\nBayern Amtsgericht Nürnberg HRB 3293\nRegisterbekanntmachung nach dem Umwandlungsgesetz 23.06.2025 (Eintragungsdatum)\n\nBKM Präzisionswerkzeuge, Stanz- und Biegeteile GmbH\nGesellschaft mit beschränkter Haftung\nSchwabach\n\nDen Gläubigern der an der Verschmelzung beteiligten Rechtsträger ist, wenn sie binnen sechs Monaten nach dem Tag, an dem die Eintragung der Verschmelzung in das Register des Sitzes desjenigen Rechtsträgers, dessen Gläubiger sie sind, nach § 19 Abs. 3 UmwG als bekannt gemacht gilt, ihren Anspruch nach Grund und Höhe in Textform anmelden, Sicherheit zu leisten, soweit sie nicht Befriedigung verlangen können. Dieses Recht steht den Gläubigern jedoch nur zu, wenn sie glaubhaft machen, dass durch die Verschmelzung die Erfüllung ihrer Forderung gefährdet wird."
    },
    {
      "date": "2025-06-24",
      "id": "113112",
      "original_text": "Registerbekanntmachung nach dem Umwandlungsgesetz\nBayern Amtsgericht Nürnberg HRB 41344\nDistel Präzision GmbH – Nürnberg",
      "type": "Registerbekanntmachung nach dem Umwandlungsgesetz",
      "state": "Bayern",
      "amtsgericht": "Amtsgericht Nürnberg",
      "registernummer": "HRB 41344",
      "registerart": "HRB",
      "company_name": "Distel Präzision GmbH",
      "company_seat": "Nürnberg",
      "details": "24.06.2025 (Bekanntmachungsdatum)\n\nBayern Amtsgericht Nürnberg HRB 41344\nRegisterbekanntmachung nach dem Umwandlungsgesetz 23.06.2025 (Eintragungsdatum)\n\nDistel Präzision GmbH\nGesellschaft mit beschränkter Haftung\nNürnberg\n\nDen Gläubigern der an der Verschmelzung beteiligten Rechtsträger ist, wenn sie binnen sechs Monaten nach dem Tag, an dem die Eintragung der Verschmelzung in das Register des Sitzes desjenigen Rechtsträgers, dessen Gläubiger sie sind, nach § 19 Abs. 3 UmwG als bekannt gemacht gilt, ihren Anspruch nach Grund und Höhe in Textform anmelden, Sicherheit zu leisten, soweit sie nicht Befriedigung verlangen können. Dieses Recht steht den Gläubigern jedoch nur zu, wenn sie glaubhaft machen, dass durch die Verschmelzung die Erfüllung ihrer Forderung gefährdet wird."
    },
    {
      "date": "2025-06-24",
      "id": "113113",
      "original_text": "Löschungsankündigung\nBayern Amtsgericht Traunstein HRB 24755\nKurt Trans & Security Ltd – Gars a. Inn",
      "type": "Löschungsankündigung",
      "state": "Bayern",
      "amtsgericht": "Amtsgericht Traunstein",
      "registernummer": "HRB 24755",
      "registerart": "HRB",
      "company_name": "Kurt Trans & Security Ltd",
      "company_seat": "Gars a. Inn",
      "details": "24.06.2025 (Bekanntmachungsdatum)\n\nBayern Amtsgericht Traunstein HRB 24755\nLöschungsankündigung\n\nKurt Trans & Security Ltd\nRechtsform ausländischen Rechts HRB\nGars a. Inn\n\nDas Registergericht beabsichtigt, die im Handelsregister eingetragene Gesellschaft von Amts wegen nach § 395 FamFG zu löschen. Die Frist zur Erhebung eines Widerspruchs ist auf 4 Wochen festgesetzt."
    },
    {
      "date": "2025-06-24",
      "id": "113114",
      "original_text": "Registerbekanntmachung nach dem Umwandlungsgesetz\nBayern Amtsgericht Schweinfurt HRA 10603\nThomas Pawlitzki e. K. – Poppenhausen",
      "type": "Registerbekanntmachung nach dem Umwandlungsgesetz",
      "state": "Bayern",
      "amtsgericht": "Amtsgericht Schweinfurt",
      "registernummer": "HRA 10603",
      "registerart": "HRA",
      "company_name": "Thomas Pawlitzki e. K.",
      "company_seat": "Poppenhausen",
      "details": "24.06.2025 (Bekanntmachungsdatum)\n\nBayern Amtsgericht Schweinfurt HRA 10603\nRegisterbekanntmachung nach dem Umwandlungsgesetz 23.06.2025 (Eintragungsdatum)\n\nThomas Pawlitzki e. K.\nEinzelkaufmann / Einzelkauffrau\nPoppenhausen\n\nDen Gläubigern der an der Ausgliederung beteiligten Rechtsträger ist, wenn sie binnen sechs Monaten nach dem Tag, an dem die Eintragung der Ausgliederung in das Register des Sitzes desjenigen Rechtsträgers, dessen Gläubiger sie sind, nach §§ 125, 19 Abs. 3 UmwG als bekannt gemacht gilt, ihren Anspruch nach Grund und Höhe in Textform anmelden, Sicherheit zu leisten, soweit sie nicht Befriedigung verlangen können. Dieses Recht steht den Gläubigern jedoch nur zu, wenn sie glaubhaft machen, dass durch die Ausgliederung die Erfüllung ihrer Forderung gefährdet wird."
    },
    {
      "date": "2025-06-24",
      "id": "113115",
      "original_text": "Registerbekanntmachung nach dem Umwandlungsgesetz\nBayern Amtsgericht München HRB 271405\nPark Immobilien Projekt Verwaltungs III GmbH – Grünwald",
      "type": "Registerbekanntmachung nach dem Umwandlungsgesetz",
      "state": "Bayern",
      "amtsgericht": "Amtsgericht München",
      "registernummer": "HRB 271405",
      "registerart": "HRB",
      "company_name": "Park Immobilien Projekt Verwaltungs III GmbH",
      "company_seat": "Grünwald",
      "details": "24.06.2025 (Bekanntmachungsdatum)\n\nBayern Amtsgericht München HRB 271405\nRegisterbekanntmachung nach dem Umwandlungsgesetz 23.06.2025 (Eintragungsdatum)\n\nPark Immobilien Projekt Verwaltungs III GmbH\nGesellschaft mit beschränkter Haftung\nGrünwald\n\nDen Gläubigern der an der Verschmelzung beteiligten Rechtsträger ist, wenn sie binnen sechs Monaten nach dem Tag, an dem die Eintragung der Verschmelzung in das Register des Sitzes desjenigen Rechtsträgers, dessen Gläubiger sie sind, nach § 19 Abs. 3 UmwG als bekannt gemacht gilt, ihren Anspruch nach Grund und Höhe in Textform anmelden, Sicherheit zu leisten, soweit sie nicht Befriedigung verlangen können. Dieses Recht steht den Gläubigern jedoch nur zu, wenn sie glaubhaft machen, dass durch die Verschmelzung die Erfüllung ihrer Forderung gefährdet wird."
    },
    {
      "date": "2025-06-24",
      "id": "113116",
      "original_text": "Sonstige Registerbekanntmachung\nBerlin Amtsgericht Berlin (Charlottenburg) HRB 260878\nSKD SE – Berlin",
      "type": "Sonstige Registerbekanntmachung",
      "state": "Berlin",
      "amtsgericht": "Amtsgericht Berlin (Charlottenburg)",
      "registernummer": "HRB 260878",
      "registerart": "HRB",
      "company_name": "SKD SE",
      "company_seat": "Berlin",
      "details": "24.06.2025 (Bekanntmachungsdatum)\n\nBerlin Amtsgericht Berlin (Charlottenburg) HRB 260878\nSonstige Registerbekanntmachung\n\nSKD SE\nEuropäische Aktiengesellschaft (SE)\nBerlin\n\nAls nicht eingetragen wird veröffentlicht:Es wurde eine neue Liste der Aufsichtsratsmitglieder eingereicht (§52 GmbHG)."
    },
    {
      "date": "2025-06-24",
      "id": "113117",
      "original_text": "Löschungsankündigung\nSchleswig-Holstein Amtsgericht Lübeck HRB 13406\nME Abbruch GmbH – Köthel, Kr Stormarn",
      "type": "Löschungsankündigung",
      "state": "Schleswig-Holstein",
      "amtsgericht": "Amtsgericht Lübeck",
      "registernummer": "HRB 13406",
      "registerart": "HRB",
      "company_name": "ME Abbruch GmbH",
      "company_seat": "Köthel, Kr Stormarn",
      "details": "24.06.2025 (Bekanntmachungsdatum)\n\nSchleswig-Holstein Amtsgericht Lübeck HRB 13406\nLöschungsankündigung\n\nME Abbruch GmbH\nGesellschaft mit beschränkter Haftung\nKöthel, Kr Stormarn\n\nEs ist die Löschung der nachstehenden Gesellschaft wegen Vermögenslosigkeit gemäß § 394 FamFG beabsichtigt."
    },
    {
      "date": "2025-06-24",
      "id": "113118",
      "original_text": "Registerbekanntmachung nach dem Umwandlungsgesetz\nBaden-Württemberg Amtsgericht Stuttgart HRA 742382\nAB Grundstücks-Verwaltungs GmbH & Co. KG – Ilshofen",
      "type": "Registerbekanntmachung nach dem Umwandlungsgesetz",
      "state": "Baden-Württemberg",
      "amtsgericht": "Amtsgericht Stuttgart",
      "registernummer": "HRA 742382",
      "registerart": "HRA",
      "company_name": "AB Grundstücks-Verwaltungs GmbH & Co. KG",
      "company_seat": "Ilshofen",
      "details": "24.06.2025 (Bekanntmachungsdatum)\n\nBaden-Württemberg Amtsgericht Stuttgart HRA 742382\nRegisterbekanntmachung nach dem Umwandlungsgesetz 20.06.2025 (Eintragungsdatum)\n\nAB Grundstücks-Verwaltungs GmbH & Co. KG\nKommanditgesellschaft\nIlshofen\n\nAls nicht eingetragen wird bekanntgemacht:\nDen Gläubigern der an der Ausgliederung beteiligten Rechtsträger ist, wenn sie binnen sechs Monaten nach dem Tag, an dem die Eintragung der Ausgliederung in das Register des Sitzes desjenigen Rechtsträgers, dessen Gläubiger sie sind, nach § 19 Abs. 3 UmwG als bekanntgemacht gilt, ihren Anspruch nach Grund und Höhe schriftlich anmelden, Sicherheit zu leisten, soweit sie nicht Befriedigung verlangen können. Dieses Recht steht den Gläubigern jedoch nur zu, wenn sie glaubhaft machen, dass durch die Ausgliederung die Erfüllung ihrer Forderung gefährdet wird."
    },
    {
      "date": "2025-06-24",
      "id": "113119",
      "original_text": "Registerbekanntmachung nach dem Umwandlungsgesetz\nBerlin Amtsgericht Berlin (Charlottenburg) HRB 208517\nVierte Paris Beteiligungsgesellschaft mbH – Berlin",
      "type": "Registerbekanntmachung nach dem Umwandlungsgesetz",
      "state": "Berlin",
      "amtsgericht": "Amtsgericht Berlin (Charlottenburg)",
      "registernummer": "HRB 208517",
      "registerart": "HRB",
      "company_name": "Vierte Paris Beteiligungsgesellschaft mbH",
      "company_seat": "Berlin",
      "details": "24.06.2025 (Bekanntmachungsdatum)\n\nBerlin Amtsgericht Berlin (Charlottenburg) HRB 208517\nRegisterbekanntmachung nach dem Umwandlungsgesetz 23.06.2025 (Eintragungsdatum)\n\nVierte Paris Beteiligungsgesellschaft mbH\nGesellschaft mit beschränkter Haftung\nBerlin\n\nZu Eintragungsnummer 7 vom 23.06.2025 wird als nicht eingetrageDen Gläubigern der an der Verschmelzung beteiligten Rechtsträger ist, wenn sie binnen sechs Monaten nach dem Tag, an dem die Eintragung der Verschmelzung in das Register des Sitzes desjenigen Rechtsträgers, dessen Gläubiger sie sind, als bekannt gemacht gilt, ihren Anspruch nach Grund und Höhe schriftlich anmelden, Sicherheit zu leisten, soweit sie nicht Befriedigung verlangen können. Dieses Recht steht den Gläubigern jedoch nur zu, wenn sie glaubhaft machen, dass durch die Verschmelzung die Erfüllung ihrer Forderung gefährdet wird. Das Recht, Sicherheitsleistung zu verlangen, steht Gläubigern nicht zu, die im Falle der Insolvenz ein Recht auf vorzugsweise Befriedigung aus einer Deckungsmasse haben, die nach gesetzlicher Vorschrift zu ihrem Schutz errichtet und staatlich überwacht ist.n veröffentlicht:"
    },
    {
      "date": "2025-06-24",
      "id": "113120",
      "original_text": "Registerbekanntmachung nach dem Umwandlungsgesetz\nBerlin Amtsgericht Berlin (Charlottenburg) HRB 211032\nErste Paris Beteiligungsgesellschaft mbH – Berlin",
      "type": "Registerbekanntmachung nach dem Umwandlungsgesetz",
      "state": "Berlin",
      "amtsgericht": "Amtsgericht Berlin (Charlottenburg)",
      "registernummer": "HRB 211032",
      "registerart": "HRB",
      "company_name": "Erste Paris Beteiligungsgesellschaft mbH",
      "company_seat": "Berlin",
      "details": "24.06.2025 (Bekanntmachungsdatum)\n\nBerlin Amtsgericht Berlin (Charlottenburg) HRB 211032\nRegisterbekanntmachung nach dem Umwandlungsgesetz 23.06.2025 (Eintragungsdatum)\n\nErste Paris Beteiligungsgesellschaft mbH\nGesellschaft mit beschränkter Haftung\nBerlin\n\nZu Eintragungsnummer 5 vom 23.06.2025 wird als nicht eingetragen veröffentlicht:Den Gläubigern der an der Verschmelzung beteiligten Rechtsträger ist, wenn sie binnen sechs Monaten nach dem Tag, an dem die Eintragung der Verschmelzung in das Register des Sitzes desjenigen Rechtsträgers, dessen Gläubiger sie sind, als bekannt gemacht gilt, ihren Anspruch nach Grund und Höhe schriftlich anmelden, Sicherheit zu leisten, soweit sie nicht Befriedigung verlangen können. Dieses Recht steht den Gläubigern jedoch nur zu, wenn sie glaubhaft machen, dass durch die Verschmelzung die Erfüllung ihrer Forderung gefährdet wird. Das Recht, Sicherheitsleistung zu verlangen, steht Gläubigern nicht zu, die im Falle der Insolvenz ein Recht auf vorzugsweise Befriedigung aus einer Deckungsmasse haben, die nach gesetzlicher Vorschrift zu ihrem Schutz errichtet und staatlich überwacht ist."
    },
    {
      "date": "2025-06-24",
      "id": "113121",
      "original_text": "Löschungsankündigung\nBrandenburg Amtsgericht Potsdam HRB 4955\nAutoland Fohrde J. Frank GmbH – Fohrde",
      "type": "Löschungsankündigung",
      "state": "Brandenburg",
      "amtsgericht": "Amtsgericht Potsdam",
      "registernummer": "HRB 4955",
      "registerart": "HRB",
      "company_name": "Autoland Fohrde J. Frank GmbH",
      "company_seat": "Fohrde",
      "details": "24.06.2025 (Bekanntmachungsdatum)\n\nBrandenburg Amtsgericht Potsdam HRB 4955\nLöschungsankündigung\n\nAutoland Fohrde J. Frank GmbH\nGesellschaft mit beschränkter Haftung\nFohrde\n\nBei der nachstehenden Gesellschaft wird das Amtslöschungsverfahren gemäß § 394 FamFG eingeleitet."
    },
    {
      "date": "2025-06-24",
      "id": "113122",
      "original_text": "Registerbekanntmachung nach dem Umwandlungsgesetz\nBaden-Württemberg Amtsgericht Freiburg VR 410368\nVerein für Rasensport Bad Bellingen e.V. – Bad Bellingen",
      "type": "Registerbekanntmachung nach dem Umwandlungsgesetz",
      "state": "Baden-Württemberg",
      "amtsgericht": "Amtsgericht Freiburg",
      "registernummer": "VR 410368",
      "registerart": "VR",
      "company_name": "Verein für Rasensport Bad Bellingen e.V.",
      "company_seat": "Bad Bellingen",
      "details": "24.06.2025 (Bekanntmachungsdatum)\n\nBaden-Württemberg Amtsgericht Freiburg VR 410368\nRegisterbekanntmachung nach dem Umwandlungsgesetz 24.06.2025 (Eintragungsdatum)\n\nVerein für Rasensport Bad Bellingen e.V.\neingetragener Verein\nBad Bellingen\n\nAls nicht eingetragen wird bekanntgemacht:\nDen Gläubigern der an der Verschmelzung beteiligten Rechtsträger ist, wenn sie binnen sechs Monaten nach dem Tag, an dem die Eintragung der Verschmelzung in das Register des Sitzes desjenigen Rechtsträgers, dessen Gläubiger sie sind, nach § 19 Abs. 3 UmwG als bekanntgemacht gilt, ihren Anspruch nach Grund und Höhe schriftlich anmelden, Sicherheit zu leisten, soweit sie nicht Befriedigung verlangen können. Dieses Recht steht den Gläubigern jedoch nur zu, wenn sie glaubhaft machen, dass durch die Verschmelzung die Erfüllung ihrer Forderung gefährdet wird."
    },
    {
      "date": "2025-06-24",
      "id": "113123",
      "original_text": "Registerbekanntmachung nach dem Umwandlungsgesetz\nBerlin Amtsgericht Berlin (Charlottenburg) HRB 175330\nHeimatTBWA Berlin GmbH – Berlin",
      "type": "Registerbekanntmachung nach dem Umwandlungsgesetz",
      "state": "Berlin",
      "amtsgericht": "Amtsgericht Berlin (Charlottenburg)",
      "registernummer": "HRB 175330",
      "registerart": "HRB",
      "company_name": "HeimatTBWA Berlin GmbH",
      "company_seat": "Berlin",
      "details": "24.06.2025 (Bekanntmachungsdatum)\n\nBerlin Amtsgericht Berlin (Charlottenburg) HRB 175330\nRegisterbekanntmachung nach dem Umwandlungsgesetz 23.06.2025 (Eintragungsdatum)\n\nHeimatTBWA Berlin GmbH\nGesellschaft mit beschränkter Haftung\nBerlin\n\nZu Eintragungsnummer 17 vom 23.06.2025 wird als nicht eingetragen veröffentlicht: Den Gläubigern der an der Verschmelzung beteiligten Rechtsträger ist, wenn sie binnen sechs Monaten nach dem Tag, an dem die Eintragung der Verschmelzung in das Register des Sitzes desjenigen Rechtsträgers, dessen Gläubiger sie sind, als bekannt gemacht gilt, ihren Anspruch nach Grund und Höhe schriftlich anmelden, Sicherheit zu leisten, soweit sie nicht Befriedigung verlangen können. Dieses Recht steht den Gläubigern jedoch nur zu, wenn sie glaubhaft machen, dass durch die Verschmelzung die Erfüllung ihrer Forderung gefährdet wird. Das Recht, Sicherheitsleistung zu verlangen, steht Gläubigern nicht zu, die im Falle der Insolvenz ein Recht auf vorzugsweise Befriedigung aus einer Deckungsmasse haben, die nach gesetzlicher Vorschrift zu ihrem Schutz errichtet und staatlich überwacht ist."
    },
    {
      "date": "2025-06-24",
      "id": "113124",
      "original_text": "Löschungsankündigung\nSaarland Amtsgericht Saarbrücken HRB 109318\nD & G Tiefbau UG (haftungsbeschränkt) – Marpingen",
      "type": "Löschungsankündigung",
      "state": "Saarland",
      "amtsgericht": "Amtsgericht Saarbrücken",
      "registernummer": "HRB 109318",
      "registerart": "HRB",
      "company_name": "D & G Tiefbau UG (haftungsbeschränkt)",
      "company_seat": "Marpingen",
      "details": "24.06.2025 (Bekanntmachungsdatum)\n\nSaarland Amtsgericht Saarbrücken HRB 109318\nLöschungsankündigung\n\nD & G Tiefbau UG (haftungsbeschränkt)\nGesellschaft mit beschränkter Haftung\nMarpingen\n\nEs ist beabsichtigt, die Gesellschaft von Amts wegen gemäß § 394 FamFG wegen Vermögenslosigkeit zu löschen.\nGegen die Löschung von Amts wegen ist das Rechtsmittel des Widerspruchs statthaft. Der Widerspruch ist binnen einer Frist drei Monaten beginnend mit dem Tag dieser Veröffentlichung durch Einreichen eines Widerspruchsschreibens -schriftlich oder zur Niederschrift der Geschäftsstelle beim Amtsgericht Saarbrücken, -zentrales Handelsregister-, Mainzerstr.178, 66121 Saarbrücken einzulegen.\nDer Widerspruch muss die Bezeichnung der angefochtenen Löschungsankündigung enthalten sowie die Erklärung, dass Widerspruch eingelegt wird. Er ist vom Widerspruchsführer oder seinem Bevollmächtigten zu unterzeichnen.\nDas Widerspruchsschreiben kann auch in der Form eines elektronischen Dokumentes eingereicht werden, das mit einer qualifizierten elektronischen Signatur nach dem Signaturgesetz versehen sein muss (§§ 14 Abs. 2 FamFG, 130a, 298 ZPO)."
    },
    {
      "date": "2025-06-24",
      "id": "113125",
      "original_text": "Registerbekanntmachung nach dem Umwandlungsgesetz\nSchleswig-Holstein Amtsgericht Kiel HRA 5919\nBio Power Service GmbH & Co.KG – Bordesholm",
      "type": "Registerbekanntmachung nach dem Umwandlungsgesetz",
      "state": "Schleswig-Holstein",
      "amtsgericht": "Amtsgericht Kiel",
      "registernummer": "HRA 5919",
      "registerart": "HRA",
      "company_name": "Bio Power Service GmbH & Co.KG",
      "company_seat": "Bordesholm",
      "details": "24.06.2025 (Bekanntmachungsdatum)\n\nSchleswig-Holstein Amtsgericht Kiel HRA 5919\nRegisterbekanntmachung nach dem Umwandlungsgesetz 23.06.2025 (Eintragungsdatum)\n\nBio Power Service GmbH & Co.KG\nKommanditgesellschaft\nBordesholm\n\nZu Eintragungsnummer 9 vom 23.06.2025 wird als nicht eingetragen veröffentlicht: Den Gläubigern ist, wenn sie binnen sechs Monaten nach dem Tag, an dem die Eintragung der Umwandlung bekannt gemacht worden ist, ihren Anspruch nach Grund und Höhe schriftlich anmelden, Sicherheit zu leisten, soweit sie nicht Befriedigung verlangen können. Dieses Recht steht den Gläubigern jedoch nur zu, wenn sie glaubhaft machen, dass durch die Umwandlung die Erfüllung ihrer Forderung gefährdet wird."
    },
    {
      "date": "2025-06-24",
      "id": "113126",
      "original_text": "Registerbekanntmachung nach dem Umwandlungsgesetz\nBaden-Württemberg Amtsgericht Mannheim HRA 712630\nDina Schmitt Moro Gastro Service e.K. – Wiernsheim",
      "type": "Registerbekanntmachung nach dem Umwandlungsgesetz",
      "state": "Baden-Württemberg",
      "amtsgericht": "Amtsgericht Mannheim",
      "registernummer": "HRA 712630",
      "registerart": "HRA",
      "company_name": "Dina Schmitt Moro Gastro Service e.K.",
      "company_seat": "Wiernsheim",
      "details": "24.06.2025 (Bekanntmachungsdatum)\n\nBaden-Württemberg Amtsgericht Mannheim HRA 712630\nRegisterbekanntmachung nach dem Umwandlungsgesetz 24.06.2025 (Eintragungsdatum)\n\nDina Schmitt Moro Gastro Service e.K.\nEinzelkaufmann / Einzelkauffrau\nWiernsheim\n\nDen Gläubigern der an der grenzüberschreitenden Ausgliederung beteiligten übernehmenden Rechtsträger ist, wenn sie binnen sechs Monaten nach dem Tag, an dem die Eintragung der Spaltung in das Register des Sitzes desjenigen Rechtsträgers, dessen Gläubiger sie sind, nach § 19 Absatz 3 UmwG als bekanntgemacht gilt, ihren Anspruch nach Grund und Höhe schriftlich anmelden, Sicherheit zu leisten, soweit sie nicht Befriedigung verlangen können.\nDieses Recht steht den Gläubigern jedoch nur zu, wenn sie glaubhaft machen, dass durch die Spaltung die Erfüllung ihrer Forderung gefährdet wird."
    },
    {
      "date": "2025-06-24",
      "id": "113127",
      "original_text": "Registerbekanntmachung nach dem Umwandlungsgesetz\nBaden-Württemberg Amtsgericht Mannheim HRB 703312\nHotline Verwaltungs GmbH – Mannheim",
      "type": "Registerbekanntmachung nach dem Umwandlungsgesetz",
      "state": "Baden-Württemberg",
      "amtsgericht": "Amtsgericht Mannheim",
      "registernummer": "HRB 703312",
      "registerart": "HRB",
      "company_name": "Hotline Verwaltungs GmbH",
      "company_seat": "Mannheim",
      "details": "24.06.2025 (Bekanntmachungsdatum)\n\nBaden-Württemberg Amtsgericht Mannheim HRB 703312\nRegisterbekanntmachung nach dem Umwandlungsgesetz 24.06.2025 (Eintragungsdatum)\n\nHotline Verwaltungs GmbH\nGesellschaft mit beschränkter Haftung\nMannheim\n\nDen Gläubigern der an der Verschmelzung beteiligten Rechtsträger ist, wenn sie binnen sechs Monaten nach dem Tag, an dem die Eintragung der Verschmelzung in das Register des Sitzes desjenigen Rechtsträgers, dessen Gläubiger sie sind, nach § 19 Abs. 3 UmwG als bekanntgemacht gilt, ihren Anspruch nach Grund und Höhe schriftlich anmelden, Sicherheit zu leisten, soweit sie nicht Befriedigung verlangen können. Dieses Recht steht den Gläubigern jedoch nur zu, wenn sie glaubhaft machen, dass durch die Verschmelzung die Erfüllung ihrer Forderung gefährdet wird."
    },
    {
      "date": "2025-06-24",
      "id": "113128",
      "original_text": "Registerbekanntmachung nach dem Umwandlungsgesetz\nHamburg Amtsgericht Hamburg HRB 120328\nPlantaCorp GmbH – Hamburg",
      "type": "Registerbekanntmachung nach dem Umwandlungsgesetz",
      "state": "Hamburg",
      "amtsgericht": "Amtsgericht Hamburg",
      "registernummer": "HRB 120328",
      "registerart": "HRB",
      "company_name": "PlantaCorp GmbH",
      "company_seat": "Hamburg",
      "details": "24.06.2025 (Bekanntmachungsdatum)\n\nHamburg Amtsgericht Hamburg HRB 120328\nRegisterbekanntmachung nach dem Umwandlungsgesetz 24.06.2025 (Eintragungsdatum)\n\nPlantaCorp GmbH\nGesellschaft mit beschränkter Haftung\nHamburg\n\nAls nicht eingetragen wird bekannt gemacht:\nDen Gläubigern der an der Verschmelzung beteiligten Gesellschaften ist, wenn sie binnen sechs Monaten nach dem Tag, an dem die Eintragung der Verschmelzung in das Register des Sitzes desjenigen Rechtsträgers, dessen Gläubiger sie sind, nach § 19 Absatz 3 UmwG als bekannt gemacht gilt, ihren Anspruch nach Grund und Höhe schriftlich anmelden, Sicherheit zu leisten, soweit sie nicht Befriedigung verlangen können. Dieses Recht steht den Gläubigern jedoch nur zu, wenn sie glaubhaft machen, dass durch die Verschmelzung die Erfüllung ihrer Forderung gefährdet wird."
    },
    {
      "date": "2025-06-24",
      "id": "113129",
      "original_text": "Registerbekanntmachung nach dem Umwandlungsgesetz\nHamburg Amtsgericht Hamburg HRB 190624\nWellma BidCo Hamburg GmbH – Hamburg",
      "type": "Registerbekanntmachung nach dem Umwandlungsgesetz",
      "state": "Hamburg",
      "amtsgericht": "Amtsgericht Hamburg",
      "registernummer": "HRB 190624",
      "registerart": "HRB",
      "company_name": "Wellma BidCo Hamburg GmbH",
      "company_seat": "Hamburg",
      "details": "24.06.2025 (Bekanntmachungsdatum)\n\nHamburg Amtsgericht Hamburg HRB 190624\nRegisterbekanntmachung nach dem Umwandlungsgesetz 24.06.2025 (Eintragungsdatum)\n\nWellma BidCo Hamburg GmbH\nGesellschaft mit beschränkter Haftung\nHamburg\n\nAls nicht eingetragen wird bekannt gemacht:\nDen Gläubigern der an der Verschmelzung beteiligten Gesellschaften ist, wenn sie binnen sechs Monaten nach dem Tag, an dem die Eintragung der Verschmelzung in das Register des Sitzes desjenigen Rechtsträgers, dessen Gläubiger sie sind, nach § 19 Absatz 3 UmwG als bekannt gemacht gilt, ihren Anspruch nach Grund und Höhe schriftlich anmelden, Sicherheit zu leisten, soweit sie nicht Befriedigung verlangen können. Dieses Recht steht den Gläubigern jedoch nur zu, wenn sie glaubhaft machen, dass durch die Verschmelzung die Erfüllung ihrer Forderung gefährdet wird."
    },
    {
      "date": "2025-06-24",
      "id": "113130",
      "original_text": "Registerbekanntmachung nach dem Umwandlungsgesetz\nBaden-Württemberg Amtsgericht Stuttgart HRB 744449\nSopra Financial Software GmbH – Leinfelden-Echterdingen",
      "type": "Registerbekanntmachung nach dem Umwandlungsgesetz",
      "state": "Baden-Württemberg",
      "amtsgericht": "Amtsgericht Stuttgart",
      "registernummer": "HRB 744449",
      "registerart": "HRB",
      "company_name": "Sopra Financial Software GmbH",
      "company_seat": "Leinfelden-Echterdingen",
      "details": "24.06.2025 (Bekanntmachungsdatum)\n\nBaden-Württemberg Amtsgericht Stuttgart HRB 744449\nRegisterbekanntmachung nach dem Umwandlungsgesetz 24.06.2025 (Eintragungsdatum)\n\nSopra Financial Software GmbH\nGesellschaft mit beschränkter Haftung\nLeinfelden-Echterdingen\n\nAls nicht eingetragen wird bekanntgemacht:\nDen Gläubigern der an der Verschmelzung beteiligten Rechtsträger ist, wenn sie binnen sechs Monaten nach dem Tag, an dem die Eintragung der Verschmelzung in das Register des Sitzes desjenigen Rechtsträgers, dessen Gläubiger sie sind, nach § 19 Abs. 3 UmwG als bekanntgemacht gilt, ihren Anspruch nach Grund und Höhe schriftlich anmelden, Sicherheit zu leisten, soweit sie nicht Befriedigung verlangen können. Dieses Recht steht den Gläubigern jedoch nur zu, wenn sie glaubhaft machen, dass durch die Verschmelzung die Erfüllung ihrer Forderung gefährdet wird."
    },
    {
      "date": "2025-06-24",
      "id": "113131",
      "original_text": "Löschungsankündigung\nBerlin Amtsgericht Berlin (Charlottenburg) HRB 70114\nDEMARA Immobiliengesellschaft mbH – Berlin",
      "type": "Löschungsankündigung",
      "state": "Berlin",
      "amtsgericht": "Amtsgericht Berlin (Charlottenburg)",
      "registernummer": "HRB 70114",
      "registerart": "HRB",
      "company_name": "DEMARA Immobiliengesellschaft mbH",
      "company_seat": "Berlin",
      "details": "24.06.2025 (Bekanntmachungsdatum)\n\nBerlin Amtsgericht Berlin (Charlottenburg) HRB 70114\nLöschungsankündigung\n\nDEMARA Immobiliengesellschaft mbH\nGesellschaft mit beschränkter Haftung\nBerlin\n\nBei der nachstehenden Gesellschaft wird das Amtslöschungsverfahren gemäß § 394 FamFG eingeleitet. Widerspruchsfrist 6 Wochen"
    },
    {
      "date": "2025-06-24",
      "id": "113132",
      "original_text": "Löschungsankündigung\nBerlin Amtsgericht Berlin (Charlottenburg) HRB 184114\nIRO GmbH – Berlin",
      "type": "Löschungsankündigung",
      "state": "Berlin",
      "amtsgericht": "Amtsgericht Berlin (Charlottenburg)",
      "registernummer": "HRB 184114",
      "registerart": "HRB",
      "company_name": "IRO GmbH",
      "company_seat": "Berlin",
      "details": "24.06.2025 (Bekanntmachungsdatum)\n\nBerlin Amtsgericht Berlin (Charlottenburg) HRB 184114\nLöschungsankündigung\n\nIRO GmbH\nGesellschaft mit beschränkter Haftung\nBerlin\n\nBei der nachstehenden Gesellschaft wird das Amtslöschungsverfahren gemäß § 394 FamFG eingeleitet. Widerspruchsfrist 6 Wochen"
    },
    {
      "date": "2025-06-24",
      "id": "113133",
      "original_text": "Registerbekanntmachung nach dem Umwandlungsgesetz\nBaden-Württemberg Amtsgericht Mannheim HRB 711128\nCafé bolands GmbH – Mannheim",
      "type": "Registerbekanntmachung nach dem Umwandlungsgesetz",
      "state": "Baden-Württemberg",
      "amtsgericht": "Amtsgericht Mannheim",
      "registernummer": "HRB 711128",
      "registerart": "HRB",
      "company_name": "Café bolands GmbH",
      "company_seat": "Mannheim",
      "details": "24.06.2025 (Bekanntmachungsdatum)\n\nBaden-Württemberg Amtsgericht Mannheim HRB 711128\nRegisterbekanntmachung nach dem Umwandlungsgesetz 24.06.2025 (Eintragungsdatum)\n\nCafé bolands GmbH\nGesellschaft mit beschränkter Haftung\nMannheim\n\nDen Gläubigern der an der Verschmelzung beteiligten Rechtsträger ist, wenn sie binnen sechs Monaten nach dem Tag, an dem die Eintragung der Verschmelzung in das Register des Sitzes desjenigen Rechtsträgers, dessen Gläubiger sie sind, nach § 19 Abs. 3 UmwG als bekanntgemacht gilt, ihren Anspruch nach Grund und Höhe schriftlich anmelden, Sicherheit zu leisten, soweit sie nicht Befriedigung verlangen können. Dieses Recht steht den Gläubigern jedoch nur zu, wenn sie glaubhaft machen, dass durch die Verschmelzung die Erfüllung ihrer Forderung gefährdet wird."
    },
    {
      "date": "2025-06-24",
      "id": "113134",
      "original_text": "Registerbekanntmachung nach dem Umwandlungsgesetz\nSaarland Amtsgericht Saarbrücken HRB 102465\nLORCA GmbH – Saarbrücken",
      "type": "Registerbekanntmachung nach dem Umwandlungsgesetz",
      "state": "Saarland",
      "amtsgericht": "Amtsgericht Saarbrücken",
      "registernummer": "HRB 102465",
      "registerart": "HRB",
      "company_name": "LORCA GmbH",
      "company_seat": "Saarbrücken",
      "details": "24.06.2025 (Bekanntmachungsdatum)\n\nSaarland Amtsgericht Saarbrücken HRB 102465\nRegisterbekanntmachung nach dem Umwandlungsgesetz\n\nLORCA GmbH\nGesellschaft mit beschränkter Haftung\nSaarbrücken\n\nDie Gesellschaft hat den Entwurf eines Verschmelzungsplans beim Handelsregister eingereicht. An der grenzüberschreitenden Verschmelzung sind beteiligt:\nLORCA GmbH, eine Gesellschaft mit beschränkter Haftung nach deutschem Recht mit dem Sitz in Saarbrücken, HRB 102465 als übertragende Gesellschaft\nFINANCIERE LORCA S.A.S.eine vereinfachte Aktiengesellschaft nach französischem Recht (societe par actions simplifiees) mit dem Sitz in Lemud, Frankreich,mit Geschäftsanschrift Route de Metz 57580 Lemud, Frankreich, eingetragen im Handels- und Gesellschaftsregister von Metz unter der Nummer 390376168, als übernehmende Gesellschaft.\na) Bis spätestens fünf Arbeitstage vor dem Tag der Beurkundung des Verschmelzungsplans können die Anteilsinhaber und die Gläubiger der an der Verschmelzung beteiligten Gesellschaften Bemerkungen zum Verschmelzungsplan übermitteln.\nb) Der Gläubiger einer übertragenden Gesellschaft kann verlangen, dass ihm Sicherheit geleistet wird für eine Forderung, die vor der Bekanntmachung des Verschmelzungsplans noch nicht fällig geworden ist und deren Erfülllung durch die Verschmelzung gefährdet wird. Die Voraussetzungen des vorstehenden Anspruchs sind gegenüber dem zuständigen Gericht glaubhaft zu machen. Der Anspruch auf Sicherheitsleistung erlischt, wenn er nicht innerhalb von drei Monaten ab Bekanntmachung des Verschmelzungsplans gerichtlich geltend gemacht wird. Geleistete Sicherheiten sind freizugeben, wenn das Verschmelzungsverfahren gescheitert ist. Das ist insbesondere der Fall, wenn die Entscheidung des Gerichts über die Ablehnung der Eintragung der Verschmelzung im Register der übernehmenden Gesellschaft nicht mehr angefochten werden kann oder das Verfahren auf Eintragung gemäß § 316 Abs. 1 UmwG oder nach dieser Eintragung das Verfahren auf Eintragung der Verschmelzung im Register der übernehmenden oder neuen Gesellschaft auf andere Weise endgültig beendet worden ist.\nDer Tag der Beurkundung des Verschmelzungsplans ist der 22.04.2025, so dass die Frist nach Abs a) am 11.04.2025 abläuft.\nBemerkungen können schriftlich oder elektronisch unter folgender gemeinsamer Adresse der beteiligten Gesellschaften eingereicht werden:\nLorca GmbH, Lebacher Straße 4, 66113 Saarbrücken\nDie in Absatz a)  genannten Personen können sich ferner kostenlos über ihre Rechte und die Modaliäten deren Ausübung informieren, indem sie sich an die obige Adresse wenden."
    },
    {
      "date": "2025-06-24",
      "id": "113135",
      "original_text": "Registerbekanntmachung nach dem Umwandlungsgesetz\nBaden-Württemberg Amtsgericht Mannheim HRB 754833\nMoro Food GmbH – Wiernsheim",
      "type": "Registerbekanntmachung nach dem Umwandlungsgesetz",
      "state": "Baden-Württemberg",
      "amtsgericht": "Amtsgericht Mannheim",
      "registernummer": "HRB 754833",
      "registerart": "HRB",
      "company_name": "Moro Food GmbH",
      "company_seat": "Wiernsheim",
      "details": "24.06.2025 (Bekanntmachungsdatum)\n\nBaden-Württemberg Amtsgericht Mannheim HRB 754833\nRegisterbekanntmachung nach dem Umwandlungsgesetz 24.06.2025 (Eintragungsdatum)\n\nMoro Food GmbH\nGesellschaft mit beschränkter Haftung\nWiernsheim\n\nDen Gläubigern der an der Ausgliederung beteiligten Rechtsträger ist, wenn sie binnen sechs Monaten nach dem Tag, an dem die Eintragung der Ausgliederung in das Register des Sitzes desjenigen Rechtsträgers, dessen Gläubiger sie sind, nach § 19 Abs. 3 UmwG als bekanntgemacht gilt, ihren Anspruch nach Grund und Höhe schriftlich anmelden, Sicherheit zu leisten, soweit sie nicht Befriedigung verlangen können. Dieses Recht steht den Gläubigern jedoch nur zu, wenn sie glaubhaft machen, dass durch die Ausgliederung die Erfüllung ihrer Forderung gefährdet wird."
    },
    {
      "date": "2025-06-24",
      "id": "113136",
      "original_text": "Registerbekanntmachung nach dem Umwandlungsgesetz\nBerlin Amtsgericht Berlin (Charlottenburg) HRB 218098\nFOV GmbH – Berlin",
      "type": "Registerbekanntmachung nach dem Umwandlungsgesetz",
      "state": "Berlin",
      "amtsgericht": "Amtsgericht Berlin (Charlottenburg)",
      "registernummer": "HRB 218098",
      "registerart": "HRB",
      "company_name": "FOV GmbH",
      "company_seat": "Berlin",
      "details": "24.06.2025 (Bekanntmachungsdatum)\n\nBerlin Amtsgericht Berlin (Charlottenburg) HRB 218098\nRegisterbekanntmachung nach dem Umwandlungsgesetz 23.06.2025 (Eintragungsdatum)\n\nFOV GmbH\nGesellschaft mit beschränkter Haftung\nBerlin\n\nZu Eintragungsnummer 6 vom 23.06.2025 wird als nicht eingetragen veröffentlicht: Den Gläubigern der an der Verschmelzung beteiligten Rechtsträger ist, wenn sie binnen sechs Monaten nach dem Tag, an dem die Eintragung der Verschmelzung in das Register des Sitzes desjenigen Rechtsträgers, dessen Gläubiger sie sind, als bekannt gemacht gilt, ihren Anspruch nach Grund und Höhe schriftlich anmelden, Sicherheit zu leisten, soweit sie nicht Befriedigung verlangen können. Dieses Recht steht den Gläubigern jedoch nur zu, wenn sie glaubhaft machen, dass durch die Verschmelzung die Erfüllung ihrer Forderung gefährdet wird. Das Recht, Sicherheitsleistung zu verlangen, steht Gläubigern nicht zu, die im Falle der Insolvenz ein Recht auf vorzugsweise Befriedigung aus einer Deckungsmasse haben, die nach gesetzlicher Vorschrift zu ihrem Schutz errichtet und staatlich überwacht ist."
    },
    {
      "date": "2025-06-24",
      "id": "113137",
      "original_text": "Registerbekanntmachung nach dem Umwandlungsgesetz\nBaden-Württemberg Amtsgericht Freiburg HRB 702427\nknoll. gmbh Rohrleitungs- und Anlagenbau – Willstätt",
      "type": "Registerbekanntmachung nach dem Umwandlungsgesetz",
      "state": "Baden-Württemberg",
      "amtsgericht": "Amtsgericht Freiburg",
      "registernummer": "HRB 702427",
      "registerart": "HRB",
      "company_name": "knoll. gmbh Rohrleitungs- und Anlagenbau",
      "company_seat": "Willstätt",
      "details": "24.06.2025 (Bekanntmachungsdatum)\n\nBaden-Württemberg Amtsgericht Freiburg HRB 702427\nRegisterbekanntmachung nach dem Umwandlungsgesetz 24.06.2025 (Eintragungsdatum)\n\nknoll. gmbh Rohrleitungs- und Anlagenbau\nGesellschaft mit beschränkter Haftung\nWillstätt\n\nAls nicht eingetragen wird bekanntgemacht:\nDen Gläubigern der an der Verschmelzung beteiligten Rechtsträger ist, wenn sie binnen sechs Monaten nach dem Tag, an dem die Eintragung der Verschmelzung in das Register des Sitzes desjenigen Rechtsträgers, dessen Gläubiger sie sind, nach § 19 Abs. 3 UmwG als bekanntgemacht gilt, ihren Anspruch nach Grund und Höhe schriftlich anmelden, Sicherheit zu leisten, soweit sie nicht Befriedigung verlangen können. Dieses Recht steht den Gläubigern jedoch nur zu, wenn sie glaubhaft machen, dass durch die Verschmelzung die Erfüllung ihrer Forderung gefährdet wird."
    },
    {
      "date": "2025-06-24",
      "id": "113138",
      "original_text": "Registerbekanntmachung nach dem Umwandlungsgesetz\nBaden-Württemberg Amtsgericht Freiburg HRB 731650\nFelix Knoll Projekt 1 UG (haftungsbeschränkt) – Willstätt",
      "type": "Registerbekanntmachung nach dem Umwandlungsgesetz",
      "state": "Baden-Württemberg",
      "amtsgericht": "Amtsgericht Freiburg",
      "registernummer": "HRB 731650",
      "registerart": "HRB",
      "company_name": "Felix Knoll Projekt 1 UG (haftungsbeschränkt)",
      "company_seat": "Willstätt",
      "details": "24.06.2025 (Bekanntmachungsdatum)\n\nBaden-Württemberg Amtsgericht Freiburg HRB 731650\nRegisterbekanntmachung nach dem Umwandlungsgesetz 24.06.2025 (Eintragungsdatum)\n\nFelix Knoll Projekt 1 UG (haftungsbeschränkt)\nGesellschaft mit beschränkter Haftung\nWillstätt\n\nDen Gläubigern der an der Verschmelzung beteiligten Rechtsträger ist, wenn sie binnen sechs Monaten nach dem Tag, an dem die Eintragung der Verschmelzung in das Register des Sitzes desjenigen Rechtsträgers, dessen Gläubiger sie sind, nach § 19 Abs. 3 UmwG als bekanntgemacht gilt, ihren Anspruch nach Grund und Höhe schriftlich anmelden, Sicherheit zu leisten, soweit sie nicht Befriedigung verlangen können. Dieses Recht steht den Gläubigern jedoch nur zu, wenn sie glaubhaft machen, dass durch die Verschmelzung die Erfüllung ihrer Forderung gefährdet wird."
    },
    {
      "date": "2025-06-24",
      "id": "113139",
      "original_text": "Sonstige Registerbekanntmachung\nHamburg Amtsgericht Hamburg HRB 151739\nNovum Hospitality GmbH – Hamburg",
      "type": "Sonstige Registerbekanntmachung",
      "state": "Hamburg",
      "amtsgericht": "Amtsgericht Hamburg",
      "registernummer": "HRB 151739",
      "registerart": "HRB",
      "company_name": "Novum Hospitality GmbH",
      "company_seat": "Hamburg",
      "details": "24.06.2025 (Bekanntmachungsdatum)\n\nHamburg Amtsgericht Hamburg HRB 151739\nSonstige Registerbekanntmachung\n\nNovum Hospitality GmbH\nGesellschaft mit beschränkter Haftung\nHamburg\n\nAls nicht eingetragen wird bekannt gemacht: Liste des Aufsichtsrats wurde eingereicht."
    },
    {
      "date": "2025-06-24",
      "id": "113140",
      "original_text": "Löschungsankündigung\nBaden-Württemberg Amtsgericht Stuttgart HRA 726579\nCitySolutions GmbH & Co.KG – Bisingen",
      "type": "Löschungsankündigung",
      "state": "Baden-Württemberg",
      "amtsgericht": "Amtsgericht Stuttgart",
      "registernummer": "HRA 726579",
      "registerart": "HRA",
      "company_name": "CitySolutions GmbH & Co.KG",
      "company_seat": "Bisingen",
      "details": "24.06.2025 (Bekanntmachungsdatum)\n\nBaden-Württemberg Amtsgericht Stuttgart HRA 726579\nLöschungsankündigung\n\nCitySolutions GmbH & Co.KG\nKommanditgesellschaft\nBisingen\n\nAls nicht eingetragen wird bekanntgemacht:\nDas Gericht beabsichtigt, die Gesellschaft wegen Vermögenslosigkeit im Handelsregister von Amts wegen nach § 394 FamFG zu löschen. Die Frist zur Geltendmachung eines Widerspruchs gegen die beabsichtigte Löschung ist auf zwei Monate ab Veröffentlichung bestimmt."
    },
    {
      "date": "2025-06-24",
      "id": "113141",
      "original_text": "Einreichung neuer Dokumente\nThüringen Amtsgericht Jena HRB 206000\nSeniorenwohnanlage Neumühle/Elster GmbH – Greiz",
      "type": "Einreichung neuer Dokumente",
      "state": "Thüringen",
      "amtsgericht": "Amtsgericht Jena",
      "registernummer": "HRB 206000",
      "registerart": "HRB",
      "company_name": "Seniorenwohnanlage Neumühle/Elster GmbH",
      "company_seat": "Greiz",
      "details": "24.06.2025 (Bekanntmachungsdatum)\n\nThüringen Amtsgericht Jena HRB 206000\nEinreichung neuer Dokumente 15.05.2025 (Eintragungsdatum)\n\nSeniorenwohnanlage Neumühle/Elster GmbH\nGesellschaft mit beschränkter Haftung\nGreiz\n\nBekanntmachung gem. § 52 Abs. 3 Satz 2 GmbHG: Aufgrund einer Veränderung in den Personen der Aufsichtsratsmitglieder ist durch die Geschäftsführer eine neue Liste zum Handelsregister eingereicht worden."
    },
    {
      "date": "2025-06-24",
      "id": "113142",
      "original_text": "Löschungsankündigung\nBerlin Amtsgericht Berlin (Charlottenburg) HRB 231867\nKLARA WINTER GHK gemeinnützige UG (haftungsbeschränkt) – Berlin",
      "type": "Löschungsankündigung",
      "state": "Berlin",
      "amtsgericht": "Amtsgericht Berlin (Charlottenburg)",
      "registernummer": "HRB 231867",
      "registerart": "HRB",
      "company_name": "KLARA WINTER GHK gemeinnützige UG (haftungsbeschränkt)",
      "company_seat": "Berlin",
      "details": "24.06.2025 (Bekanntmachungsdatum)\n\nBerlin Amtsgericht Berlin (Charlottenburg) HRB 231867\nLöschungsankündigung\n\nKLARA WINTER GHK gemeinnützige UG (haftungsbeschränkt)\nGesellschaft mit beschränkter Haftung\nBerlin\n\nBei der nachstehenden Gesellschaft wird das Amtslöschungsverfahren gemäß § 394 FamFG eingeleitet. Widerspruchsfrist 6 Wochen"
    },
    {
      "date": "2025-06-24",
      "id": "113143",
      "original_text": "Löschungsankündigung\nBerlin Amtsgericht Berlin (Charlottenburg) HRB 243868\nB.H.S. Berliner Hotelreinigung Service UG (haftungsbeschränkt) – Berlin",
      "type": "Löschungsankündigung",
      "state": "Berlin",
      "amtsgericht": "Amtsgericht Berlin (Charlottenburg)",
      "registernummer": "HRB 243868",
      "registerart": "HRB",
      "company_name": "B.H.S. Berliner Hotelreinigung Service UG (haftungsbeschränkt)",
      "company_seat": "Berlin",
      "details": "24.06.2025 (Bekanntmachungsdatum)\n\nBerlin Amtsgericht Berlin (Charlottenburg) HRB 243868\nLöschungsankündigung\n\nB.H.S. Berliner Hotelreinigung Service UG (haftungsbeschränkt)\nGesellschaft mit beschränkter Haftung\nBerlin\n\nBei der nachstehenden Gesellschaft wird das Amtslöschungsverfahren gemäß § 394 FamFG eingeleitet. Widerspruchsfrist 6 Wochen"
    },
    {
      "date": "2025-06-24",
      "id": "113144",
      "original_text": "Löschungsankündigung\nBerlin Amtsgericht Berlin (Charlottenburg) HRB 220393\nEkvator UG (haftungsbeschränkt) – Berlin",
      "type": "Löschungsankündigung",
      "state": "Berlin",
      "amtsgericht": "Amtsgericht Berlin (Charlottenburg)",
      "registernummer": "HRB 220393",
      "registerart": "HRB",
      "company_name": "Ekvator UG (haftungsbeschränkt)",
      "company_seat": "Berlin",
      "details": "24.06.2025 (Bekanntmachungsdatum)\n\nBerlin Amtsgericht Berlin (Charlottenburg) HRB 220393\nLöschungsankündigung\n\nEkvator UG (haftungsbeschränkt)\nGesellschaft mit beschränkter Haftung\nBerlin\n\nBei der nachstehenden Gesellschaft wird das Amtslöschungsverfahren gemäß § 394 FamFG eingeleitet. Widerspruchsfrist 6 Wochen"
    },
    {
      "date": "2025-06-24",
      "id": "113145",
      "original_text": "Einreichung neuer Dokumente\nBrandenburg Amtsgericht Potsdam HRB 35820\nCareTaker AG – Potsdam",
      "type": "Einreichung neuer Dokumente",
      "state": "Brandenburg",
      "amtsgericht": "Amtsgericht Potsdam",
      "registernummer": "HRB 35820",
      "registerart": "HRB",
      "company_name": "CareTaker AG",
      "company_seat": "Potsdam",
      "details": "24.06.2025 (Bekanntmachungsdatum)\n\nBrandenburg Amtsgericht Potsdam HRB 35820\nEinreichung neuer Dokumente\n\nCareTaker AG\nAktiengesellschaft\nPotsdam\n\nAls nicht eingetragen wird bekanntgemacht : Eine Liste der Mitglieder des Aufsichtsrates wurde zum Handelsregister eingereicht."
    },
    {
      "date": "2025-06-24",
      "id": "113146",
      "original_text": "Löschungsankündigung\nBerlin Amtsgericht Berlin (Charlottenburg) HRB 176068\nAsteria B GmbH – Berlin",
      "type": "Löschungsankündigung",
      "state": "Berlin",
      "amtsgericht": "Amtsgericht Berlin (Charlottenburg)",
      "registernummer": "HRB 176068",
      "registerart": "HRB",
      "company_name": "Asteria B GmbH",
      "company_seat": "Berlin",
      "details": "24.06.2025 (Bekanntmachungsdatum)\n\nBerlin Amtsgericht Berlin (Charlottenburg) HRB 176068\nLöschungsankündigung\n\nAsteria B GmbH\nGesellschaft mit beschränkter Haftung\nBerlin\n\nBei der nachstehenden Gesellschaft wird das Amtslöschungsverfahren gemäß § 394 FamFG eingeleitet. Widerspruchsfrist 6 Wochen"
    },
    {
      "date": "2025-06-24",
      "id": "113147",
      "original_text": "Löschungsankündigung\nBaden-Württemberg Amtsgericht Mannheim HRB 332494\nJoho GmbH – Edingen-Neckarhausen",
      "type": "Löschungsankündigung",
      "state": "Baden-Württemberg",
      "amtsgericht": "Amtsgericht Mannheim",
      "registernummer": "HRB 332494",
      "registerart": "HRB",
      "company_name": "Joho GmbH",
      "company_seat": "Edingen-Neckarhausen",
      "details": "24.06.2025 (Bekanntmachungsdatum)\n\nBaden-Württemberg Amtsgericht Mannheim HRB 332494\nLöschungsankündigung\n\nJoho GmbH\nGesellschaft mit beschränkter Haftung\nEdingen-Neckarhausen\n\nDas Gericht beabsichtigt, die Gesellschaft wegen Vermögenslosigkeit im Handelsregister von Amts wegen nach § 394 FamFG zu löschen. Die Frist zur Geltendmachung eines Widerspruchs gegen die beabsichtigte Löschung ist auf einen Monat ab Veröffentlichung bestimmt."
    },
    {
      "date": "2025-06-24",
      "id": "113148",
      "original_text": "Löschungsankündigung\nSaarland Amtsgericht Saarbrücken HRB 109152\nVKS Verwaltungs-Kontor-Sulzbach UG (haftungsbeschränkt) – Sulzbach",
      "type": "Löschungsankündigung",
      "state": "Saarland",
      "amtsgericht": "Amtsgericht Saarbrücken",
      "registernummer": "HRB 109152",
      "registerart": "HRB",
      "company_name": "VKS Verwaltungs-Kontor-Sulzbach UG (haftungsbeschränkt)",
      "company_seat": "Sulzbach",
      "details": "24.06.2025 (Bekanntmachungsdatum)\n\nSaarland Amtsgericht Saarbrücken HRB 109152\nLöschungsankündigung\n\nVKS Verwaltungs-Kontor-Sulzbach UG (haftungsbeschränkt)\nGesellschaft mit beschränkter Haftung\nSulzbach\n\nEs ist beabsichtigt, die Gesellschaft von Amts wegen gemäß § 394 FamFG wegen Vermögenslosigkeit zu löschen.\nGegen die Löschung von Amts wegen ist das Rechtsmittel des Widerspruchs statthaft. Der Widerspruch ist binnen einer Frist zwei Monaten beginnend mit dem Tag dieser Veröffentlichung durch Einreichen eines Widerspruchsschreibens -schriftlich oder zur Niederschrift der Geschäftsstelle beim Amtsgericht Saarbrücken, -zentrales Handelsregister-, Mainzerstr.178, 66121 Saarbrücken einzulegen.\nDer Widerspruch muss die Bezeichnung der angefochtenen Löschungsankündigung enthalten sowie die Erklärung, dass Widerspruch eingelegt wird. Er ist vom Widerspruchsführer oder seinem Bevollmächtigten zu unterzeichnen.\nDas Widerspruchsschreiben kann auch in der Form eines elektronischen Dokumentes eingereicht werden, das mit einer qualifizierten elektronischen Signatur nach dem Signaturgesetz versehen sein muss (§§ 14 Abs. 2 FamFG, 130a, 298 ZPO)."
    },
    {
      "date": "2025-06-24",
      "id": "113149",
      "original_text": "Registerbekanntmachung nach dem Umwandlungsgesetz\nHamburg Amtsgericht Hamburg HRA 83758\nRMS Radio Marketing Service GmbH & Co KG – Hamburg",
      "type": "Registerbekanntmachung nach dem Umwandlungsgesetz",
      "state": "Hamburg",
      "amtsgericht": "Amtsgericht Hamburg",
      "registernummer": "HRA 83758",
      "registerart": "HRA",
      "company_name": "RMS Radio Marketing Service GmbH & Co KG",
      "company_seat": "Hamburg",
      "details": "24.06.2025 (Bekanntmachungsdatum)\n\nHamburg Amtsgericht Hamburg HRA 83758\nRegisterbekanntmachung nach dem Umwandlungsgesetz 24.06.2025 (Eintragungsdatum)\n\nRMS Radio Marketing Service GmbH & Co KG\nKommanditgesellschaft\nHamburg\n\nAls nicht eingetragen wird bekannt gemacht:\nDen Gläubigern der an der Verschmelzung beteiligten Gesellschaften ist, wenn sie binnen sechs Monaten nach dem Tag, an dem die Eintragung der Verschmelzung in das Register des Sitzes desjenigen Rechtsträgers, dessen Gläubiger sie sind, nach § 19 Absatz 3 UmwG als bekannt gemacht gilt, ihren Anspruch nach Grund und Höhe schriftlich anmelden, Sicherheit zu leisten, soweit sie nicht Befriedigung verlangen können. Dieses Recht steht den Gläubigern jedoch nur zu, wenn sie glaubhaft machen, dass durch die Verschmelzung die Erfüllung ihrer Forderung gefährdet wird."
    },
    {
      "date": "2025-06-24",
      "id": "113150",
      "original_text": "Registerbekanntmachung nach dem Umwandlungsgesetz\nHamburg Amtsgericht Hamburg HRB 70442\nRMN Radio Media Nord GmbH – Hamburg",
      "type": "Registerbekanntmachung nach dem Umwandlungsgesetz",
      "state": "Hamburg",
      "amtsgericht": "Amtsgericht Hamburg",
      "registernummer": "HRB 70442",
      "registerart": "HRB",
      "company_name": "RMN Radio Media Nord GmbH",
      "company_seat": "Hamburg",
      "details": "24.06.2025 (Bekanntmachungsdatum)\n\nHamburg Amtsgericht Hamburg HRB 70442\nRegisterbekanntmachung nach dem Umwandlungsgesetz 24.06.2025 (Eintragungsdatum)\n\nRMN Radio Media Nord GmbH\nGesellschaft mit beschränkter Haftung\nHamburg\n\nAls nicht eingetragen wird bekannt gemacht:\nDen Gläubigern der an der Verschmelzung beteiligten Gesellschaften ist, wenn sie binnen sechs Monaten nach dem Tag, an dem die Eintragung der Verschmelzung in das Register des Sitzes desjenigen Rechtsträgers, dessen Gläubiger sie sind, nach § 19 Absatz 3 UmwG als bekannt gemacht gilt, ihren Anspruch nach Grund und Höhe schriftlich anmelden, Sicherheit zu leisten, soweit sie nicht Befriedigung verlangen können. Dieses Recht steht den Gläubigern jedoch nur zu, wenn sie glaubhaft machen, dass durch die Verschmelzung die Erfüllung ihrer Forderung gefährdet wird."
    },
    {
      "date": "2025-06-24",
      "id": "113151",
      "original_text": "Einreichung neuer Dokumente\nBerlin Amtsgericht Berlin (Charlottenburg) HRB 182671\nELEMENT Insurance AG – Berlin",
      "type": "Einreichung neuer Dokumente",
      "state": "Berlin",
      "amtsgericht": "Amtsgericht Berlin (Charlottenburg)",
      "registernummer": "HRB 182671",
      "registerart": "HRB",
      "company_name": "ELEMENT Insurance AG",
      "company_seat": "Berlin",
      "details": "24.06.2025 (Bekanntmachungsdatum)\n\nBerlin Amtsgericht Berlin (Charlottenburg) HRB 182671\nEinreichung neuer Dokumente\n\nELEMENT Insurance AG\nAktiengesellschaft\nBerlin\n\nAls nicht eingetragen wird veröffentlicht: Es wurde eine neue Liste der Aufsichtsratsmitglieder eingereicht (§ 106 AktG)."
    },
    {
      "date": "2025-06-24",
      "id": "113152",
      "original_text": "Löschungsankündigung\nBerlin Amtsgericht Berlin (Charlottenburg) HRB 103420\nAUTOMANIA AUTOMOBILE Ltd. – Berlin",
      "type": "Löschungsankündigung",
      "state": "Berlin",
      "amtsgericht": "Amtsgericht Berlin (Charlottenburg)",
      "registernummer": "HRB 103420",
      "registerart": "HRB",
      "company_name": "AUTOMANIA AUTOMOBILE Ltd.",
      "company_seat": "Berlin",
      "details": "24.06.2025 (Bekanntmachungsdatum)\n\nBerlin Amtsgericht Berlin (Charlottenburg) HRB 103420\nLöschungsankündigung\n\nAUTOMANIA AUTOMOBILE Ltd.\nRechtsform ausländischen Rechts HRB\nBerlin\n\nEs ist beabsichtigt, die Eintragung wegen Mangels einer wesentlichen Voraussetzung gemäß § 395 FamFG von Amts wegen zu löschen. (Die ausländische Hauptniederlassung besteht nicht mehr.) Widerspruchsfrist 6 Wochen"
    },
    {
      "date": "2025-06-24",
      "id": "113153",
      "original_text": "Löschungsankündigung\nSchleswig-Holstein Amtsgericht Pinneberg HRB 17733\nBauunternehmen Vanadzor GmbH – Pinneberg",
      "type": "Löschungsankündigung",
      "state": "Schleswig-Holstein",
      "amtsgericht": "Amtsgericht Pinneberg",
      "registernummer": "HRB 17733",
      "registerart": "HRB",
      "company_name": "Bauunternehmen Vanadzor GmbH",
      "company_seat": "Pinneberg",
      "details": "24.06.2025 (Bekanntmachungsdatum)\n\nSchleswig-Holstein Amtsgericht Pinneberg HRB 17733\nLöschungsankündigung\n\nBauunternehmen Vanadzor GmbH\nGesellschaft mit beschränkter Haftung\nPinneberg\n\nEs ist die Löschung der nachstehenden Gesellschaft wegen Vermögenslosigkeit gemäß § 394 FamFG beabsichtigt. Widerspruchsfrist: 2 Monate."
    },
    {
      "date": "2025-06-24",
      "id": "113154",
      "original_text": "Registerbekanntmachung nach dem Umwandlungsgesetz\nSchleswig-Holstein Amtsgericht Pinneberg HRA 9885\nPiepenhagen Bau- & Heimwerkermarkt & Tischlerei e.K. – Barmstedt",
      "type": "Registerbekanntmachung nach dem Umwandlungsgesetz",
      "state": "Schleswig-Holstein",
      "amtsgericht": "Amtsgericht Pinneberg",
      "registernummer": "HRA 9885",
      "registerart": "HRA",
      "company_name": "Piepenhagen Bau- & Heimwerkermarkt & Tischlerei e.K.",
      "company_seat": "Barmstedt",
      "details": "24.06.2025 (Bekanntmachungsdatum)\n\nSchleswig-Holstein Amtsgericht Pinneberg HRA 9885\nRegisterbekanntmachung nach dem Umwandlungsgesetz 20.06.2025 (Eintragungsdatum)\n\nPiepenhagen Bau- & Heimwerkermarkt & Tischlerei e.K.\nEinzelkaufmann / Einzelkauffrau\nBarmstedt\n\nZu Eintragungsnummer 2 vom 20.06.2025 wird als nicht eingetragen veröffentlicht:  Als nicht eingetragen wird veröffentlicht: Den Gläubigern ist, wenn sie binnen sechs Monaten nach dem Tag, an dem die Eintragung der Umwandlung als bekannt gemacht gilt, ihren Anspruch nach Grund und Höhe schriftlich anmelden, Sicherheit zu leisten, soweit sie nicht Befriedigung verlangen können. Dieses Recht steht den Gläubigern jedoch nur zu, wenn sie glaubhaft machen, dass durch die Umwandlung die Erfüllung ihrer Forderung gefährdet wird. Das Recht, Sicherheitsleistung zu verlangen, steht Gläubigern nicht zu, die im Falle der Insolvenz ein Recht auf vorzugsweise Befriedigung aus einer Deckungsmasse haben, die nach gesetzlicher Vorschrift zu ihrem Schutz errichtet und staatlich überwacht ist."
    },
    {
      "date": "2025-06-24",
      "id": "113155",
      "original_text": "Registerbekanntmachung nach dem Umwandlungsgesetz\nSchleswig-Holstein Amtsgericht Pinneberg HRB 11454\nBuddecke und Schwertfeger Verwaltungs-GmbH – Elmshorn",
      "type": "Registerbekanntmachung nach dem Umwandlungsgesetz",
      "state": "Schleswig-Holstein",
      "amtsgericht": "Amtsgericht Pinneberg",
      "registernummer": "HRB 11454",
      "registerart": "HRB",
      "company_name": "Buddecke und Schwertfeger Verwaltungs-GmbH",
      "company_seat": "Elmshorn",
      "details": "24.06.2025 (Bekanntmachungsdatum)\n\nSchleswig-Holstein Amtsgericht Pinneberg HRB 11454\nRegisterbekanntmachung nach dem Umwandlungsgesetz 17.06.2025 (Eintragungsdatum)\n\nBuddecke und Schwertfeger Verwaltungs-GmbH\nGesellschaft mit beschränkter Haftung\nElmshorn\n\nZu Eintragungsnummer 5 vom 17.06.2025 wird als nicht eingetragen veröffentlicht: Den Gläubigern der an der Verschmelzung beteiligten Rechtsträger ist, wenn sie binnen sechs Monaten nach dem Tag, an dem die Eintragung der Verschmelzung in das Register des Sitzes desjenigen Rechtsträgers, dessen Gläubiger sie sind, als bekannt gemacht gilt, ihren Anspruch nach Grund und Höhe schriftlich anmelden, Sicherheit zu leisten, soweit sie nicht Befriedigung verlangen können. Dieses Recht steht den Gläubigern jedoch nur zu, wenn sie glaubhaft machen, dass durch die Verschmelzung die Erfüllung ihrer Forderung gefährdet wird. Das Recht, Sicherheitsleistung zu verlangen, steht Gläubigern nicht zu, die im Falle der Insolvenz ein Recht auf vorzugsweise Befriedigung aus einer Deckungsmasse haben, die nach gesetzlicher Vorschrift zu ihrem Schutz errichtet und staatlich überwacht ist."
    },
    {
      "date": "2025-06-24",
      "id": "113156",
      "original_text": "Registerbekanntmachung nach dem Umwandlungsgesetz\nSchleswig-Holstein Amtsgericht Kiel HRA 12698\nLeonardo Töpsch e.K. – Kronshagen",
      "type": "Registerbekanntmachung nach dem Umwandlungsgesetz",
      "state": "Schleswig-Holstein",
      "amtsgericht": "Amtsgericht Kiel",
      "registernummer": "HRA 12698",
      "registerart": "HRA",
      "company_name": "Leonardo Töpsch e.K.",
      "company_seat": "Kronshagen",
      "details": "24.06.2025 (Bekanntmachungsdatum)\n\nSchleswig-Holstein Amtsgericht Kiel HRA 12698\nRegisterbekanntmachung nach dem Umwandlungsgesetz 24.06.2025 (Eintragungsdatum)\n\nLeonardo Töpsch e.K.\nEinzelkaufmann / Einzelkauffrau\nKronshagen\n\nZu Eintragungsnummer 2 vom 24.06.2025 wird als nicht eingetragen veröffentlicht: Als nicht eingetragen wird veröffentlicht: Den Gläubigern der an der Spaltung beteiligten Rechtsträger ist, wenn sie binnen sechs Monaten nach dem Tag, an dem die Eintragung der Spaltung in das Register des Sitzes desjenigen Rechtsträgers, dessen Gläubiger sie sind,  bekannt gemacht worden ist, ihren Anspruch nach Grund und Höhe schriftlich anmelden, Sicherheit zu leisten, soweit sie nicht Befriedigung verlangen können. Dieses Recht steht den Gläubigern jedoch nur zu, wenn sie glaubhaft machen, dass durch die Spaltung die Erfüllung ihrer Forderung gefährdet wird."
    },
    {
      "date": "2025-06-24",
      "id": "113157",
      "original_text": "Sonstige Registerbekanntmachung\nBerlin Amtsgericht Berlin (Charlottenburg) HRB 211155\nDigital Charging Solutions GmbH – Berlin",
      "type": "Sonstige Registerbekanntmachung",
      "state": "Berlin",
      "amtsgericht": "Amtsgericht Berlin (Charlottenburg)",
      "registernummer": "HRB 211155",
      "registerart": "HRB",
      "company_name": "Digital Charging Solutions GmbH",
      "company_seat": "Berlin",
      "details": "24.06.2025 (Bekanntmachungsdatum)\n\nBerlin Amtsgericht Berlin (Charlottenburg) HRB 211155\nSonstige Registerbekanntmachung\n\nDigital Charging Solutions GmbH\nGesellschaft mit beschränkter Haftung\nBerlin\n\nAls nicht eingetragen wird veröffentlicht: Es wurde eine neue Liste der Aufsichtsratsmitglieder eingereicht (§52 GmbHG)."
    },
    {
      "date": "2025-06-24",
      "id": "113158",
      "original_text": "Registerbekanntmachung nach dem Umwandlungsgesetz\nBaden-Württemberg Amtsgericht Stuttgart HRB 742259\nBuck Industries GmbH – Herrenberg",
      "type": "Registerbekanntmachung nach dem Umwandlungsgesetz",
      "state": "Baden-Württemberg",
      "amtsgericht": "Amtsgericht Stuttgart",
      "registernummer": "HRB 742259",
      "registerart": "HRB",
      "company_name": "Buck Industries GmbH",
      "company_seat": "Herrenberg",
      "details": "24.06.2025 (Bekanntmachungsdatum)\n\nBaden-Württemberg Amtsgericht Stuttgart HRB 742259\nRegisterbekanntmachung nach dem Umwandlungsgesetz 24.06.2025 (Eintragungsdatum)\n\nBuck Industries GmbH\nGesellschaft mit beschränkter Haftung\nHerrenberg\n\nAls nicht eingetragen wird bekanntgemacht:\nDen Gläubigern der an der Verschmelzung beteiligten Rechtsträger ist, wenn sie binnen sechs Monaten nach dem Tag, an dem die Eintragung der Verschmelzung in das Register des Sitzes desjenigen Rechtsträgers, dessen Gläubiger sie sind, nach § 19 Abs. 3 UmwG als bekanntgemacht gilt, ihren Anspruch nach Grund und Höhe schriftlich anmelden, Sicherheit zu leisten, soweit sie nicht Befriedigung verlangen können. Dieses Recht steht den Gläubigern jedoch nur zu, wenn sie glaubhaft machen, dass durch die Verschmelzung die Erfüllung ihrer Forderung gefährdet wird."
    },
    {
      "date": "2025-06-24",
      "id": "113159",
      "original_text": "Registerbekanntmachung nach dem Umwandlungsgesetz\nBaden-Württemberg Amtsgericht Stuttgart HRB 20291\nHS Immobilien und Consulting GmbH – Stuttgart",
      "type": "Registerbekanntmachung nach dem Umwandlungsgesetz",
      "state": "Baden-Württemberg",
      "amtsgericht": "Amtsgericht Stuttgart",
      "registernummer": "HRB 20291",
      "registerart": "HRB",
      "company_name": "HS Immobilien und Consulting GmbH",
      "company_seat": "Stuttgart",
      "details": "24.06.2025 (Bekanntmachungsdatum)\n\nBaden-Württemberg Amtsgericht Stuttgart HRB 20291\nRegisterbekanntmachung nach dem Umwandlungsgesetz 24.06.2025 (Eintragungsdatum)\n\nHS Immobilien und Consulting GmbH\nGesellschaft mit beschränkter Haftung\nStuttgart\n\nAls nicht eingetragen wird bekanntgemacht:\nDen Gläubigern der an der Verschmelzung beteiligten Rechtsträger ist, wenn sie binnen sechs Monaten nach dem Tag, an dem die Eintragung der Verschmelzung in das Register des Sitzes desjenigen Rechtsträgers, dessen Gläubiger sie sind, nach § 19 Abs. 3 UmwG als bekanntgemacht gilt, ihren Anspruch nach Grund und Höhe schriftlich anmelden, Sicherheit zu leisten, soweit sie nicht Befriedigung verlangen können. Dieses Recht steht den Gläubigern jedoch nur zu, wenn sie glaubhaft machen, dass durch die Verschmelzung die Erfüllung ihrer Forderung gefährdet wird."
    },
    {
      "date": "2025-06-24",
      "id": "113160",
      "original_text": "Registerbekanntmachung nach dem Umwandlungsgesetz\nNordrhein-Westfalen Amtsgericht Coesfeld HRB 16929\nFlender GmbH – Bocholt",
      "type": "Registerbekanntmachung nach dem Umwandlungsgesetz",
      "state": "Nordrhein-Westfalen",
      "amtsgericht": "Amtsgericht Coesfeld",
      "registernummer": "HRB 16929",
      "registerart": "HRB",
      "company_name": "Flender GmbH",
      "company_seat": "Bocholt",
      "details": "24.06.2025 (Bekanntmachungsdatum)\n\nNordrhein-Westfalen Amtsgericht Coesfeld HRB 16929\nRegisterbekanntmachung nach dem Umwandlungsgesetz 24.06.2025 (Eintragungsdatum)\n\nFlender GmbH\nGesellschaft mit beschränkter Haftung\nBocholt\n\nDen Gläubigern der an der Ausgliederung beteiligten Rechtsträger ist, wenn sie binnen sechs Monaten nach dem Tag, an dem die Eintragung der Ausgliederung in das Register des Sitzes desjenigen Rechtsträgers, dessen Gläubiger sie sind, nach § 19 Absatz 3 UmwG als bekanntgemacht gilt, ihren Anspruch nach Grund und Höhe schriftlich anmelden, Sicherheit zu leisten, soweit sie nicht Befriedigung verlangen können. Dieses Recht steht den Gläubigern jedoch nur zu, wenn sie glaubhaft machen, dass durch die Ausgliederung die Erfüllung ihrer Forderung gefährdet wird."
    },
    {
      "date": "2025-06-24",
      "id": "113161",
      "original_text": "Löschungsankündigung\nSachsen Amtsgericht Dresden HRB 35537\nSKG DRESDEN GMBH – Dresden",
      "type": "Löschungsankündigung",
      "state": "Sachsen",
      "amtsgericht": "Amtsgericht Dresden",
      "registernummer": "HRB 35537",
      "registerart": "HRB",
      "company_name": "SKG DRESDEN GMBH",
      "company_seat": "Dresden",
      "details": "24.06.2025 (Bekanntmachungsdatum)\n\nSachsen Amtsgericht Dresden HRB 35537\nLöschungsankündigung\n\nSKG DRESDEN GMBH\nGesellschaft mit beschränkter Haftung\nDresden\n\nDas Registergericht beabsichtigt, die im Handelsregister eingetragene Gesellschaft von Amts wegen nach § 394 FamFG zu löschen. Die Frist zu Erhebung eines Widerspruchs gegen die beabsichtigte Löschung wird auf einen Monat festgesetzt."
    },
    {
      "date": "2025-06-24",
      "id": "113162",
      "original_text": "Registerbekanntmachung nach dem Umwandlungsgesetz\nSachsen Amtsgericht Leipzig HRB 34761\nLE Quartier 15 GmbH – Leipzig",
      "type": "Registerbekanntmachung nach dem Umwandlungsgesetz",
      "state": "Sachsen",
      "amtsgericht": "Amtsgericht Leipzig",
      "registernummer": "HRB 34761",
      "registerart": "HRB",
      "company_name": "LE Quartier 15 GmbH",
      "company_seat": "Leipzig",
      "details": "24.06.2025 (Bekanntmachungsdatum)\n\nSachsen Amtsgericht Leipzig HRB 34761\nRegisterbekanntmachung nach dem Umwandlungsgesetz 24.06.2025 (Eintragungsdatum)\n\nLE Quartier 15 GmbH\nGesellschaft mit beschränkter Haftung\nLeipzig\n\nDen Gläubigern der an der Verschmelzung beteiligten Rechtsträger ist, wenn sie binnen sechs Monaten nach dem Tag, an dem die Eintragung der Verschmelzung in das Register des Sitzes desjenigen Rechtsträgers, dessen Gläubiger sie sind, nach § 19 Abs. 3 UmwG als bekannt gemacht gilt, ihren Anspruch nach Grund und Höhe in Textform anmelden, Sicherheit zu leisten, soweit sie nicht Befriedigung verlangen können. Dieses Recht steht den Gläubigern jedoch nur zu, wenn sie glaubhaft machen, dass durch die Verschmelzung die Erfüllung der Forderung gefährdet wird."
    },
    {
      "date": "2025-06-24",
      "id": "113163",
      "original_text": "Registerbekanntmachung nach dem Umwandlungsgesetz\nSachsen Amtsgericht Leipzig HRB 36102\nMenageriehöfe Dresden GmbH – Leipzig",
      "type": "Registerbekanntmachung nach dem Umwandlungsgesetz",
      "state": "Sachsen",
      "amtsgericht": "Amtsgericht Leipzig",
      "registernummer": "HRB 36102",
      "registerart": "HRB",
      "company_name": "Menageriehöfe Dresden GmbH",
      "company_seat": "Leipzig",
      "details": "24.06.2025 (Bekanntmachungsdatum)\n\nSachsen Amtsgericht Leipzig HRB 36102\nRegisterbekanntmachung nach dem Umwandlungsgesetz 24.06.2025 (Eintragungsdatum)\n\nMenageriehöfe Dresden GmbH\nGesellschaft mit beschränkter Haftung\nLeipzig\n\nDen Gläubigern der an der Verschmelzung beteiligten Rechtsträger ist, wenn sie binnen sechs Monaten nach dem Tag, an dem die Eintragung der Verschmelzung in das Register des Sitzes desjenigen Rechtsträgers, dessen Gläubiger sie sind, nach § 19 Abs. 3 UmwG als bekannt gemacht gilt, ihren Anspruch nach Grund und Höhe in Textform anmelden, Sicherheit zu leisten, soweit sie nicht Befriedigung verlangen können. Dieses Recht steht den Gläubigern jedoch nur zu, wenn sie glaubhaft machen, dass durch die Verschmelzung die Erfüllung der Forderung gefährdet wird."
    },
    {
      "date": "2025-06-24",
      "id": "113164",
      "original_text": "Registerbekanntmachung nach dem Umwandlungsgesetz\nSachsen Amtsgericht Chemnitz HRB 6215\nATS Verwaltungsgesellschaft mbH – Chemnitz",
      "type": "Registerbekanntmachung nach dem Umwandlungsgesetz",
      "state": "Sachsen",
      "amtsgericht": "Amtsgericht Chemnitz",
      "registernummer": "HRB 6215",
      "registerart": "HRB",
      "company_name": "ATS Verwaltungsgesellschaft mbH",
      "company_seat": "Chemnitz",
      "details": "24.06.2025 (Bekanntmachungsdatum)\n\nSachsen Amtsgericht Chemnitz HRB 6215\nRegisterbekanntmachung nach dem Umwandlungsgesetz 24.06.2025 (Eintragungsdatum)\n\nATS Verwaltungsgesellschaft mbH\nGesellschaft mit beschränkter Haftung\nChemnitz\n\nDen Gläubigern der an der Verschmelzung beteiligten Rechtsträger ist, wenn sie binnen sechs Monaten nach dem Tag, an dem die Eintragung der Verschmelzung in das Register des Sitzes desjenigen Rechtsträgers, dessen Gläubiger sie sind, nach § 19 Abs. 3 UmwG als bekannt gemacht gilt, ihren Anspruch nach Grund und Höhe in Textform anmelden, Sicherheit zu leisten, soweit sie nicht Befriedigung verlangen können. Dieses Recht steht den Gläubigern jedoch nur zu, wenn sie glaubhaft machen, dass durch die Verschmelzung die Erfüllung der Forderung gefährdet wird."
    },
    {
      "date": "2025-06-24",
      "id": "113165",
      "original_text": "Registerbekanntmachung nach dem Umwandlungsgesetz\nSachsen Amtsgericht Leipzig HRB 36102\nMenageriehöfe Dresden GmbH – Leipzig",
      "type": "Registerbekanntmachung nach dem Umwandlungsgesetz",
      "state": "Sachsen",
      "amtsgericht": "Amtsgericht Leipzig",
      "registernummer": "HRB 36102",
      "registerart": "HRB",
      "company_name": "Menageriehöfe Dresden GmbH",
      "company_seat": "Leipzig",
      "details": "24.06.2025 (Bekanntmachungsdatum)\n\nSachsen Amtsgericht Leipzig HRB 36102\nRegisterbekanntmachung nach dem Umwandlungsgesetz 24.06.2025 (Eintragungsdatum)\n\nMenageriehöfe Dresden GmbH\nGesellschaft mit beschränkter Haftung\nLeipzig\n\nDen Gläubigern der an der Verschmelzung beteiligten Rechtsträger ist, wenn sie binnen sechs Monaten nach dem Tag, an dem die Eintragung der Verschmelzung in das Register des Sitzes desjenigen Rechtsträgers, dessen Gläubiger sie sind, nach § 19 Abs. 3 UmwG als bekannt gemacht gilt, ihren Anspruch nach Grund und Höhe in Textform anmelden, Sicherheit zu leisten, soweit sie nicht Befriedigung verlangen können. Dieses Recht steht den Gläubigern jedoch nur zu, wenn sie glaubhaft machen, dass durch die Verschmelzung die Erfüllung der Forderung gefährdet wird."
    },
    {
      "date": "2025-06-24",
      "id": "113166",
      "original_text": "Registerbekanntmachung nach dem Umwandlungsgesetz\nSachsen Amtsgericht Leipzig HRB 38884\nQUARTERBACK Projekt 21 GmbH – Leipzig",
      "type": "Registerbekanntmachung nach dem Umwandlungsgesetz",
      "state": "Sachsen",
      "amtsgericht": "Amtsgericht Leipzig",
      "registernummer": "HRB 38884",
      "registerart": "HRB",
      "company_name": "QUARTERBACK Projekt 21 GmbH",
      "company_seat": "Leipzig",
      "details": "24.06.2025 (Bekanntmachungsdatum)\n\nSachsen Amtsgericht Leipzig HRB 38884\nRegisterbekanntmachung nach dem Umwandlungsgesetz 24.06.2025 (Eintragungsdatum)\n\nQUARTERBACK Projekt 21 GmbH\nGesellschaft mit beschränkter Haftung\nLeipzig\n\nDen Gläubigern der an der Verschmelzung beteiligten Rechtsträger ist, wenn sie binnen sechs Monaten nach dem Tag, an dem die Eintragung der Verschmelzung in das Register des Sitzes desjenigen Rechtsträgers, dessen Gläubiger sie sind, nach § 19 Abs. 3 UmwG als bekannt gemacht gilt, ihren Anspruch nach Grund und Höhe in Textform anmelden, Sicherheit zu leisten, soweit sie nicht Befriedigung verlangen können. Dieses Recht steht den Gläubigern jedoch nur zu, wenn sie glaubhaft machen, dass durch die Verschmelzung die Erfüllung der Forderung gefährdet wird."
    },
    {
      "date": "2025-06-24",
      "id": "113167",
      "original_text": "Registerbekanntmachung nach dem Umwandlungsgesetz\nSachsen Amtsgericht Leipzig HRB 36102\nMenageriehöfe Dresden GmbH – Leipzig",
      "type": "Registerbekanntmachung nach dem Umwandlungsgesetz",
      "state": "Sachsen",
      "amtsgericht": "Amtsgericht Leipzig",
      "registernummer": "HRB 36102",
      "registerart": "HRB",
      "company_name": "Menageriehöfe Dresden GmbH",
      "company_seat": "Leipzig",
      "details": "24.06.2025 (Bekanntmachungsdatum)\n\nSachsen Amtsgericht Leipzig HRB 36102\nRegisterbekanntmachung nach dem Umwandlungsgesetz 24.06.2025 (Eintragungsdatum)\n\nMenageriehöfe Dresden GmbH\nGesellschaft mit beschränkter Haftung\nLeipzig\n\nDen Gläubigern der an der Verschmelzung beteiligten Rechtsträger ist, wenn sie binnen sechs Monaten nach dem Tag, an dem die Eintragung der Verschmelzung in das Register des Sitzes desjenigen Rechtsträgers, dessen Gläubiger sie sind, nach § 19 Abs. 3 UmwG als bekannt gemacht gilt, ihren Anspruch nach Grund und Höhe in Textform anmelden, Sicherheit zu leisten, soweit sie nicht Befriedigung verlangen können. Dieses Recht steht den Gläubigern jedoch nur zu, wenn sie glaubhaft machen, dass durch die Verschmelzung die Erfüllung der Forderung gefährdet wird."
    },
    {
      "date": "2025-06-24",
      "id": "113168",
      "original_text": "Registerbekanntmachung nach dem Umwandlungsgesetz\nSachsen Amtsgericht Leipzig HRB 38116\nQUARTERBACK Premium 15 GmbH – Leipzig",
      "type": "Registerbekanntmachung nach dem Umwandlungsgesetz",
      "state": "Sachsen",
      "amtsgericht": "Amtsgericht Leipzig",
      "registernummer": "HRB 38116",
      "registerart": "HRB",
      "company_name": "QUARTERBACK Premium 15 GmbH",
      "company_seat": "Leipzig",
      "details": "24.06.2025 (Bekanntmachungsdatum)\n\nSachsen Amtsgericht Leipzig HRB 38116\nRegisterbekanntmachung nach dem Umwandlungsgesetz 24.06.2025 (Eintragungsdatum)\n\nQUARTERBACK Premium 15 GmbH\nGesellschaft mit beschränkter Haftung\nLeipzig\n\nDen Gläubigern der an der Verschmelzung beteiligten Rechtsträger ist, wenn sie binnen sechs Monaten nach dem Tag, an dem die Eintragung der Verschmelzung in das Register des Sitzes desjenigen Rechtsträgers, dessen Gläubiger sie sind, nach § 19 Abs. 3 UmwG als bekannt gemacht gilt, ihren Anspruch nach Grund und Höhe in Textform anmelden, Sicherheit zu leisten, soweit sie nicht Befriedigung verlangen können. Dieses Recht steht den Gläubigern jedoch nur zu, wenn sie glaubhaft machen, dass durch die Verschmelzung die Erfüllung der Forderung gefährdet wird."
    },
    {
      "date": "2025-06-24",
      "id": "113169",
      "original_text": "Löschungsankündigung\nSachsen Amtsgericht Leipzig HRA 15756\nIBG Innovations- und Beteiligungsgesellschaft mbH & Co. KG – Oschatz",
      "type": "Löschungsankündigung",
      "state": "Sachsen",
      "amtsgericht": "Amtsgericht Leipzig",
      "registernummer": "HRA 15756",
      "registerart": "HRA",
      "company_name": "IBG Innovations- und Beteiligungsgesellschaft mbH & Co. KG",
      "company_seat": "Oschatz",
      "details": "24.06.2025 (Bekanntmachungsdatum)\n\nSachsen Amtsgericht Leipzig HRA 15756\nLöschungsankündigung\n\nIBG Innovations- und Beteiligungsgesellschaft mbH & Co. KG\nKommanditgesellschaft\nOschatz\n\nDas Registergericht beabsichtigt, die im Handelsregister eingetragene Gesellschaft von Amts wegen nach § 394 FamFG zu löschen. Die Frist zu Erhebung eines Widerspruchs gegen die beabsichtigte Löschung wird auf einen Monat festgesetzt."
    },
    {
      "date": "2025-06-24",
      "id": "113170",
      "original_text": "Registerbekanntmachung nach dem Umwandlungsgesetz\nSachsen Amtsgericht Chemnitz HRB 2765\nGEWI Anhängerbauteile GmbH – Chemnitz",
      "type": "Registerbekanntmachung nach dem Umwandlungsgesetz",
      "state": "Sachsen",
      "amtsgericht": "Amtsgericht Chemnitz",
      "registernummer": "HRB 2765",
      "registerart": "HRB",
      "company_name": "GEWI Anhängerbauteile GmbH",
      "company_seat": "Chemnitz",
      "details": "24.06.2025 (Bekanntmachungsdatum)\n\nSachsen Amtsgericht Chemnitz HRB 2765\nRegisterbekanntmachung nach dem Umwandlungsgesetz 24.06.2025 (Eintragungsdatum)\n\nGEWI Anhängerbauteile GmbH\nGesellschaft mit beschränkter Haftung\nChemnitz\n\nDen Gläubigern der an der Verschmelzung beteiligten Rechtsträger ist, wenn sie binnen sechs Monaten nach dem Tag, an dem die Eintragung der Verschmelzung in das Register des Sitzes desjenigen Rechtsträgers, dessen Gläubiger sie sind, nach § 19 Abs. 3 UmwG als bekannt gemacht gilt, ihren Anspruch nach Grund und Höhe in Textform anmelden, Sicherheit zu leisten, soweit sie nicht Befriedigung verlangen können. Dieses Recht steht den Gläubigern jedoch nur zu, wenn sie glaubhaft machen, dass durch die Verschmelzung die Erfüllung der Forderung gefährdet wird."
    },
    {
      "date": "2025-06-24",
      "id": "113171",
      "original_text": "Löschungsankündigung\nSachsen Amtsgericht Leipzig HRA 17260\nPHV - Pflege mit Herz und Verstand GmbH & Co. KG – Leipzig",
      "type": "Löschungsankündigung",
      "state": "Sachsen",
      "amtsgericht": "Amtsgericht Leipzig",
      "registernummer": "HRA 17260",
      "registerart": "HRA",
      "company_name": "PHV - Pflege mit Herz und Verstand GmbH & Co. KG",
      "company_seat": "Leipzig",
      "details": "24.06.2025 (Bekanntmachungsdatum)\n\nSachsen Amtsgericht Leipzig HRA 17260\nLöschungsankündigung\n\nPHV - Pflege mit Herz und Verstand GmbH & Co. KG\nKommanditgesellschaft\nLeipzig\n\nDas Registergericht beabsichtigt, die im Handelsregister eingetragene Firma von Amts wegen nach § 31 Abs. 2 HGB, 393 FamFG zu löschen. Die Frist zur Erhebung eines Widerspruchs gegen die beabsichtigte Löschung wird auf einen Monat festgesetzt."
    },
    {
      "date": "2025-06-24",
      "id": "113172",
      "original_text": "Registerbekanntmachung nach dem Umwandlungsgesetz\nSachsen Amtsgericht Leipzig HRB 34763\nLE Quartier 16 GmbH – Leipzig",
      "type": "Registerbekanntmachung nach dem Umwandlungsgesetz",
      "state": "Sachsen",
      "amtsgericht": "Amtsgericht Leipzig",
      "registernummer": "HRB 34763",
      "registerart": "HRB",
      "company_name": "LE Quartier 16 GmbH",
      "company_seat": "Leipzig",
      "details": "24.06.2025 (Bekanntmachungsdatum)\n\nSachsen Amtsgericht Leipzig HRB 34763\nRegisterbekanntmachung nach dem Umwandlungsgesetz 24.06.2025 (Eintragungsdatum)\n\nLE Quartier 16 GmbH\nGesellschaft mit beschränkter Haftung\nLeipzig\n\nDen Gläubigern der an der Verschmelzung beteiligten Rechtsträger ist, wenn sie binnen sechs Monaten nach dem Tag, an dem die Eintragung der Verschmelzung in das Register des Sitzes desjenigen Rechtsträgers, dessen Gläubiger sie sind, nach § 19 Abs. 3 UmwG als bekannt gemacht gilt, ihren Anspruch nach Grund und Höhe in Textform anmelden, Sicherheit zu leisten, soweit sie nicht Befriedigung verlangen können. Dieses Recht steht den Gläubigern jedoch nur zu, wenn sie glaubhaft machen, dass durch die Verschmelzung die Erfüllung der Forderung gefährdet wird."
    },
    {
      "date": "2025-06-24",
      "id": "113173",
      "original_text": "Einreichung neuer Dokumente\nSachsen Amtsgericht Dresden HRB 37117\nRobert Bosch Semiconductor Manufacturing Dresden GmbH – Dresden",
      "type": "Einreichung neuer Dokumente",
      "state": "Sachsen",
      "amtsgericht": "Amtsgericht Dresden",
      "registernummer": "HRB 37117",
      "registerart": "HRB",
      "company_name": "Robert Bosch Semiconductor Manufacturing Dresden GmbH",
      "company_seat": "Dresden",
      "details": "24.06.2025 (Bekanntmachungsdatum)\n\nSachsen Amtsgericht Dresden HRB 37117\nEinreichung neuer Dokumente\n\nRobert Bosch Semiconductor Manufacturing Dresden GmbH\nGesellschaft mit beschränkter Haftung\nDresden\n\nAm 23.06.2025 wurde beim Handelsregister des Amtsgerichts Dresden die Liste der Mitglieder des Aufsichtsrats gemäß § 52 GmbHG eingereicht."
    },
    {
      "date": "2025-06-24",
      "id": "113174",
      "original_text": "Registerbekanntmachung nach dem Umwandlungsgesetz\nSachsen Amtsgericht Leipzig HRB 36102\nMenageriehöfe Dresden GmbH – Leipzig",
      "type": "Registerbekanntmachung nach dem Umwandlungsgesetz",
      "state": "Sachsen",
      "amtsgericht": "Amtsgericht Leipzig",
      "registernummer": "HRB 36102",
      "registerart": "HRB",
      "company_name": "Menageriehöfe Dresden GmbH",
      "company_seat": "Leipzig",
      "details": "24.06.2025 (Bekanntmachungsdatum)\n\nSachsen Amtsgericht Leipzig HRB 36102\nRegisterbekanntmachung nach dem Umwandlungsgesetz 24.06.2025 (Eintragungsdatum)\n\nMenageriehöfe Dresden GmbH\nGesellschaft mit beschränkter Haftung\nLeipzig\n\nDen Gläubigern der an der Verschmelzung beteiligten Rechtsträger ist, wenn sie binnen sechs Monaten nach dem Tag, an dem die Eintragung der Verschmelzung in das Register des Sitzes desjenigen Rechtsträgers, dessen Gläubiger sie sind, nach § 19 Abs. 3 UmwG als bekannt gemacht gilt, ihren Anspruch nach Grund und Höhe in Textform anmelden, Sicherheit zu leisten, soweit sie nicht Befriedigung verlangen können. Dieses Recht steht den Gläubigern jedoch nur zu, wenn sie glaubhaft machen, dass durch die Verschmelzung die Erfüllung der Forderung gefährdet wird."
    },
    {
      "date": "2025-06-24",
      "id": "113175",
      "original_text": "Registerbekanntmachung nach dem Umwandlungsgesetz\nSachsen Amtsgericht Leipzig HRB 36102\nMenageriehöfe Dresden GmbH – Leipzig",
      "type": "Registerbekanntmachung nach dem Umwandlungsgesetz",
      "state": "Sachsen",
      "amtsgericht": "Amtsgericht Leipzig",
      "registernummer": "HRB 36102",
      "registerart": "HRB",
      "company_name": "Menageriehöfe Dresden GmbH",
      "company_seat": "Leipzig",
      "details": "24.06.2025 (Bekanntmachungsdatum)\n\nSachsen Amtsgericht Leipzig HRB 36102\nRegisterbekanntmachung nach dem Umwandlungsgesetz 24.06.2025 (Eintragungsdatum)\n\nMenageriehöfe Dresden GmbH\nGesellschaft mit beschränkter Haftung\nLeipzig\n\nDen Gläubigern der an der Verschmelzung beteiligten Rechtsträger ist, wenn sie binnen sechs Monaten nach dem Tag, an dem die Eintragung der Verschmelzung in das Register des Sitzes desjenigen Rechtsträgers, dessen Gläubiger sie sind, nach § 19 Abs. 3 UmwG als bekannt gemacht gilt, ihren Anspruch nach Grund und Höhe in Textform anmelden, Sicherheit zu leisten, soweit sie nicht Befriedigung verlangen können. Dieses Recht steht den Gläubigern jedoch nur zu, wenn sie glaubhaft machen, dass durch die Verschmelzung die Erfüllung der Forderung gefährdet wird."
    },
    {
      "date": "2025-06-24",
      "id": "113176",
      "original_text": "Registerbekanntmachung nach dem Umwandlungsgesetz\nSachsen Amtsgericht Leipzig HRB 38510\nQUARTERBACK Projekt 13 GmbH – Leipzig",
      "type": "Registerbekanntmachung nach dem Umwandlungsgesetz",
      "state": "Sachsen",
      "amtsgericht": "Amtsgericht Leipzig",
      "registernummer": "HRB 38510",
      "registerart": "HRB",
      "company_name": "QUARTERBACK Projekt 13 GmbH",
      "company_seat": "Leipzig",
      "details": "24.06.2025 (Bekanntmachungsdatum)\n\nSachsen Amtsgericht Leipzig HRB 38510\nRegisterbekanntmachung nach dem Umwandlungsgesetz 24.06.2025 (Eintragungsdatum)\n\nQUARTERBACK Projekt 13 GmbH\nGesellschaft mit beschränkter Haftung\nLeipzig\n\nDen Gläubigern der an der Verschmelzung beteiligten Rechtsträger ist, wenn sie binnen sechs Monaten nach dem Tag, an dem die Eintragung der Verschmelzung in das Register des Sitzes desjenigen Rechtsträgers, dessen Gläubiger sie sind, nach § 19 Abs. 3 UmwG als bekannt gemacht gilt, ihren Anspruch nach Grund und Höhe in Textform anmelden, Sicherheit zu leisten, soweit sie nicht Befriedigung verlangen können. Dieses Recht steht den Gläubigern jedoch nur zu, wenn sie glaubhaft machen, dass durch die Verschmelzung die Erfüllung der Forderung gefährdet wird."
    },
    {
      "date": "2025-06-24",
      "id": "113177",
      "original_text": "Registerbekanntmachung nach dem Umwandlungsgesetz\nSachsen Amtsgericht Leipzig HRB 36102\nMenageriehöfe Dresden GmbH – Leipzig",
      "type": "Registerbekanntmachung nach dem Umwandlungsgesetz",
      "state": "Sachsen",
      "amtsgericht": "Amtsgericht Leipzig",
      "registernummer": "HRB 36102",
      "registerart": "HRB",
      "company_name": "Menageriehöfe Dresden GmbH",
      "company_seat": "Leipzig",
      "details": "24.06.2025 (Bekanntmachungsdatum)\n\nSachsen Amtsgericht Leipzig HRB 36102\nRegisterbekanntmachung nach dem Umwandlungsgesetz 24.06.2025 (Eintragungsdatum)\n\nMenageriehöfe Dresden GmbH\nGesellschaft mit beschränkter Haftung\nLeipzig\n\nDen Gläubigern der an der Verschmelzung beteiligten Rechtsträger ist, wenn sie binnen sechs Monaten nach dem Tag, an dem die Eintragung der Verschmelzung in das Register des Sitzes desjenigen Rechtsträgers, dessen Gläubiger sie sind, nach § 19 Abs. 3 UmwG als bekannt gemacht gilt, ihren Anspruch nach Grund und Höhe in Textform anmelden, Sicherheit zu leisten, soweit sie nicht Befriedigung verlangen können. Dieses Recht steht den Gläubigern jedoch nur zu, wenn sie glaubhaft machen, dass durch die Verschmelzung die Erfüllung der Forderung gefährdet wird."
    },
    {
      "date": "2025-06-24",
      "id": "113178",
      "original_text": "Registerbekanntmachung nach dem Umwandlungsgesetz\nSachsen Amtsgericht Leipzig HRB 30018\nAbfall- und Servicegesellschaft des Landkreises Nordsachsen mbH ASG mbH – Delitzsch",
      "type": "Registerbekanntmachung nach dem Umwandlungsgesetz",
      "state": "Sachsen",
      "amtsgericht": "Amtsgericht Leipzig",
      "registernummer": "HRB 30018",
      "registerart": "HRB",
      "company_name": "Abfall- und Servicegesellschaft des Landkreises Nordsachsen mbH ASG mbH",
      "company_seat": "Delitzsch",
      "details": "24.06.2025 (Bekanntmachungsdatum)\n\nSachsen Amtsgericht Leipzig HRB 30018\nRegisterbekanntmachung nach dem Umwandlungsgesetz 24.06.2025 (Eintragungsdatum)\n\nAbfall- und Servicegesellschaft des Landkreises Nordsachsen mbH ASG mbH\nGesellschaft mit beschränkter Haftung\nDelitzsch\n\nDen Gläubigern der an der Spaltung beteiligten Rechtsträger ist, wenn sie binnen sechs Monaten nach dem Tag, an dem die Eintragung der Spaltung in das Register des Sitzes desjenigen Rechtsträgers, dessen Gläubiger sie sind, nach § 19 Abs. 3 UmwG als bekannt gemacht gilt, ihren Anspruch nach Grund und Höhe in Textform anmelden, Sicherheit zu leisten, soweit sie nicht Befriedigung verlangen können. Dieses Recht steht den Gläubigern jedoch nur zu, wenn sie glaubhaft machen, dass durch die Spaltung die Erfüllung der Forderung gefährdet wird."
    },
    {
      "date": "2025-06-24",
      "id": "113179",
      "original_text": "Registerbekanntmachung nach dem Umwandlungsgesetz\nSachsen Amtsgericht Leipzig HRB 38509\nQUARTERBACK Projekt 12 GmbH – Leipzig",
      "type": "Registerbekanntmachung nach dem Umwandlungsgesetz",
      "state": "Sachsen",
      "amtsgericht": "Amtsgericht Leipzig",
      "registernummer": "HRB 38509",
      "registerart": "HRB",
      "company_name": "QUARTERBACK Projekt 12 GmbH",
      "company_seat": "Leipzig",
      "details": "24.06.2025 (Bekanntmachungsdatum)\n\nSachsen Amtsgericht Leipzig HRB 38509\nRegisterbekanntmachung nach dem Umwandlungsgesetz 24.06.2025 (Eintragungsdatum)\n\nQUARTERBACK Projekt 12 GmbH\nGesellschaft mit beschränkter Haftung\nLeipzig\n\nDen Gläubigern der an der Verschmelzung beteiligten Rechtsträger ist, wenn sie binnen sechs Monaten nach dem Tag, an dem die Eintragung der Verschmelzung in das Register des Sitzes desjenigen Rechtsträgers, dessen Gläubiger sie sind, nach § 19 Abs. 3 UmwG als bekannt gemacht gilt, ihren Anspruch nach Grund und Höhe in Textform anmelden, Sicherheit zu leisten, soweit sie nicht Befriedigung verlangen können. Dieses Recht steht den Gläubigern jedoch nur zu, wenn sie glaubhaft machen, dass durch die Verschmelzung die Erfüllung der Forderung gefährdet wird."
    },
    {
      "date": "2025-06-24",
      "id": "113180",
      "original_text": "Registerbekanntmachung nach dem Umwandlungsgesetz\nSachsen Amtsgericht Chemnitz HRB 23703\nATS Chemnitz GmbH – Chemnitz",
      "type": "Registerbekanntmachung nach dem Umwandlungsgesetz",
      "state": "Sachsen",
      "amtsgericht": "Amtsgericht Chemnitz",
      "registernummer": "HRB 23703",
      "registerart": "HRB",
      "company_name": "ATS Chemnitz GmbH",
      "company_seat": "Chemnitz",
      "details": "24.06.2025 (Bekanntmachungsdatum)\n\nSachsen Amtsgericht Chemnitz HRB 23703\nRegisterbekanntmachung nach dem Umwandlungsgesetz 24.06.2025 (Eintragungsdatum)\n\nATS Chemnitz GmbH\nGesellschaft mit beschränkter Haftung\nChemnitz\n\nDen Gläubigern der an der Verschmelzung beteiligten Rechtsträger ist, wenn sie binnen sechs Monaten nach dem Tag, an dem die Eintragung der Verschmelzung in das Register des Sitzes desjenigen Rechtsträgers, dessen Gläubiger sie sind, nach § 19 Abs. 3 UmwG als bekannt gemacht gilt, ihren Anspruch nach Grund und Höhe in Textform anmelden, Sicherheit zu leisten, soweit sie nicht Befriedigung verlangen können. Dieses Recht steht den Gläubigern jedoch nur zu, wenn sie glaubhaft machen, dass durch die Verschmelzung die Erfüllung der Forderung gefährdet wird."
    },
    {
      "date": "2025-06-24",
      "id": "113181",
      "original_text": "Registerbekanntmachung nach dem Umwandlungsgesetz\nSachsen Amtsgericht Leipzig HRB 36102\nMenageriehöfe Dresden GmbH – Leipzig",
      "type": "Registerbekanntmachung nach dem Umwandlungsgesetz",
      "state": "Sachsen",
      "amtsgericht": "Amtsgericht Leipzig",
      "registernummer": "HRB 36102",
      "registerart": "HRB",
      "company_name": "Menageriehöfe Dresden GmbH",
      "company_seat": "Leipzig",
      "details": "24.06.2025 (Bekanntmachungsdatum)\n\nSachsen Amtsgericht Leipzig HRB 36102\nRegisterbekanntmachung nach dem Umwandlungsgesetz 24.06.2025 (Eintragungsdatum)\n\nMenageriehöfe Dresden GmbH\nGesellschaft mit beschränkter Haftung\nLeipzig\n\nDen Gläubigern der an der Verschmelzung beteiligten Rechtsträger ist, wenn sie binnen sechs Monaten nach dem Tag, an dem die Eintragung der Verschmelzung in das Register des Sitzes desjenigen Rechtsträgers, dessen Gläubiger sie sind, nach § 19 Abs. 3 UmwG als bekannt gemacht gilt, ihren Anspruch nach Grund und Höhe in Textform anmelden, Sicherheit zu leisten, soweit sie nicht Befriedigung verlangen können. Dieses Recht steht den Gläubigern jedoch nur zu, wenn sie glaubhaft machen, dass durch die Verschmelzung die Erfüllung der Forderung gefährdet wird."
    },
    {
      "date": "2025-06-24",
      "id": "113182",
      "original_text": "Registerbekanntmachung nach dem Umwandlungsgesetz\nSachsen Amtsgericht Leipzig HRB 38579\nQUARTERBACK Projekt 20 GmbH – Leipzig",
      "type": "Registerbekanntmachung nach dem Umwandlungsgesetz",
      "state": "Sachsen",
      "amtsgericht": "Amtsgericht Leipzig",
      "registernummer": "HRB 38579",
      "registerart": "HRB",
      "company_name": "QUARTERBACK Projekt 20 GmbH",
      "company_seat": "Leipzig",
      "details": "24.06.2025 (Bekanntmachungsdatum)\n\nSachsen Amtsgericht Leipzig HRB 38579\nRegisterbekanntmachung nach dem Umwandlungsgesetz 24.06.2025 (Eintragungsdatum)\n\nQUARTERBACK Projekt 20 GmbH\nGesellschaft mit beschränkter Haftung\nLeipzig\n\nDen Gläubigern der an der Verschmelzung beteiligten Rechtsträger ist, wenn sie binnen sechs Monaten nach dem Tag, an dem die Eintragung der Verschmelzung in das Register des Sitzes desjenigen Rechtsträgers, dessen Gläubiger sie sind, nach § 19 Abs. 3 UmwG als bekannt gemacht gilt, ihren Anspruch nach Grund und Höhe in Textform anmelden, Sicherheit zu leisten, soweit sie nicht Befriedigung verlangen können. Dieses Recht steht den Gläubigern jedoch nur zu, wenn sie glaubhaft machen, dass durch die Verschmelzung die Erfüllung der Forderung gefährdet wird."
    },
    {
      "date": "2025-06-24",
      "id": "113183",
      "original_text": "Registerbekanntmachung nach dem Umwandlungsgesetz\nSachsen Amtsgericht Leipzig HRB 2966\nKreiswerke Delitzsch GmbH – Delitzsch",
      "type": "Registerbekanntmachung nach dem Umwandlungsgesetz",
      "state": "Sachsen",
      "amtsgericht": "Amtsgericht Leipzig",
      "registernummer": "HRB 2966",
      "registerart": "HRB",
      "company_name": "Kreiswerke Delitzsch GmbH",
      "company_seat": "Delitzsch",
      "details": "24.06.2025 (Bekanntmachungsdatum)\n\nSachsen Amtsgericht Leipzig HRB 2966\nRegisterbekanntmachung nach dem Umwandlungsgesetz 24.06.2025 (Eintragungsdatum)\n\nKreiswerke Delitzsch GmbH\nGesellschaft mit beschränkter Haftung\nDelitzsch\n\nDen Gläubigern der an der Spaltung beteiligten Rechtsträger ist, wenn sie binnen sechs Monaten nach dem Tag, an dem die Eintragung der Spaltung in das Register des Sitzes desjenigen Rechtsträgers, dessen Gläubiger sie sind, nach § 19 Abs. 3 UmwG als bekannt gemacht gilt, ihren Anspruch nach Grund und Höhe in Textform anmelden, Sicherheit zu leisten, soweit sie nicht Befriedigung verlangen können. Dieses Recht steht den Gläubigern jedoch nur zu, wenn sie glaubhaft machen, dass durch die Spaltung die Erfüllung der Forderung gefährdet wird."
    },
    {
      "date": "2025-06-24",
      "id": "113184",
      "original_text": "Registerbekanntmachung nach dem Umwandlungsgesetz\nNiedersachsen Amtsgericht Hannover HRA 205255\nFeise Immobilienverwaltungs- GmbH & Co. KG – Garbsen",
      "type": "Registerbekanntmachung nach dem Umwandlungsgesetz",
      "state": "Niedersachsen",
      "amtsgericht": "Amtsgericht Hannover",
      "registernummer": "HRA 205255",
      "registerart": "HRA",
      "company_name": "Feise Immobilienverwaltungs- GmbH & Co. KG",
      "company_seat": "Garbsen",
      "details": "24.06.2025 (Bekanntmachungsdatum)\n\nNiedersachsen Amtsgericht Hannover HRA 205255\nRegisterbekanntmachung nach dem Umwandlungsgesetz 24.06.2025 (Eintragungsdatum)\n\nFeise Immobilienverwaltungs- GmbH & Co. KG\nKommanditgesellschaft\nGarbsen\n\nDen Gläubigern der an der Ausgliederung beteiligten Rechtsträger ist, wenn sie binnen sechs Monaten nach dem Tag, an dem die Eintragung der Spaltung in das Register des Sitzes desjenigen Rechtsträgers, dessen Gläubiger sie sind, nach § 19 Abs. 3 UmwG als bekannt gemacht gilt, ihren Anspruch nach Grund und Höhe schriftlich anmelden, Sicherheit zu leisten, soweit sie nicht Befriedigung verlangen können. Dieses Recht steht den Gläubigern jedoch nur zu, wenn sie glaubhaft machen, dass durch die Ausgliederung die Erfüllung der Forderung gefährdet wird."
    },
    {
      "date": "2025-06-24",
      "id": "113185",
      "original_text": "Registerbekanntmachung nach dem Umwandlungsgesetz\nNiedersachsen Amtsgericht Oldenburg (Oldenburg) HRB 222342\nAtrium 251. Europäische VV SE – Damme",
      "type": "Registerbekanntmachung nach dem Umwandlungsgesetz",
      "state": "Niedersachsen",
      "amtsgericht": "Amtsgericht Oldenburg (Oldenburg)",
      "registernummer": "HRB 222342",
      "registerart": "HRB",
      "company_name": "Atrium 251. Europäische VV SE",
      "company_seat": "Damme",
      "details": "24.06.2025 (Bekanntmachungsdatum)\n\nNiedersachsen Amtsgericht Oldenburg (Oldenburg) HRB 222342\nRegisterbekanntmachung nach dem Umwandlungsgesetz\n\nAtrium 251. Europäische VV SE\nEuropäische Aktiengesellschaft (SE)\nDamme\n\nBeim Handelsregister ist am 24.04.2025 der Entwurf eines Verschmelzungsvertrages eingereicht worden. Danach soll die Grimme Landmaschinenfabrik Beteiligungs GmbH mit Sitz in Damme (Amtsgericht Oldenburg (Oldenburg) HRB 111458) als übertragende Gesellschaft mit der Atrium 251. Europäische VV SE (Amtsgericht Oldenburg (Oldenburg) HRB 222342) als übernehmende Gesellschaft verschmolzen werden."
    },
    {
      "date": "2025-06-24",
      "id": "113186",
      "original_text": "Löschungsankündigung\nNiedersachsen Amtsgericht Hildesheim HRB 35184\nL. Reisen Abwicklungsgesellschaft mbH – Lehrte",
      "type": "Löschungsankündigung",
      "state": "Niedersachsen",
      "amtsgericht": "Amtsgericht Hildesheim",
      "registernummer": "HRB 35184",
      "registerart": "HRB",
      "company_name": "L. Reisen Abwicklungsgesellschaft mbH",
      "company_seat": "Lehrte",
      "details": "24.06.2025 (Bekanntmachungsdatum)\n\nNiedersachsen Amtsgericht Hildesheim HRB 35184\nLöschungsankündigung\n\nL. Reisen Abwicklungsgesellschaft mbH\nGesellschaft mit beschränkter Haftung\nLehrte\n\nDas Registergericht beabsichtigt, die Gesellschaft von Amts wegen nach § 394 FamFG zu löschen. Die Frist zur Erhebung eines Widerspruchs ist auf 1 Monat ab dieser Registerbekanntmachung festgesetzt."
    },
    {
      "date": "2025-06-24",
      "id": "113187",
      "original_text": "Löschungsankündigung\nNiedersachsen Amtsgericht Oldenburg (Oldenburg) HRB 152134 früher Amtsgericht Cloppenburg\nRohe Agrar GmbH – Löningen",
      "type": "Löschungsankündigung",
      "state": "Niedersachsen",
      "amtsgericht": "Amtsgericht Oldenburg (Oldenburg)",
      "registernummer": "HRB 152134",
      "registerart": "HRB",
      "company_name": "Rohe Agrar GmbH",
      "company_seat": "Löningen",
      "former_amtsgericht": "Cloppenburg",
      "details": "24.06.2025 (Bekanntmachungsdatum)\n\nNiedersachsen Amtsgericht Oldenburg (Oldenburg) HRB 152134 früher Amtsgericht Cloppenburg\nLöschungsankündigung\n\nRohe Agrar GmbH\nGesellschaft mit beschränkter Haftung\nLöningen\n\nDas Registergericht beabsichtigt, die Gesellschaft von Amts wegen nach § 394 FamFG zu löschen. Die Frist zur Erhebung eines Widerspruchs ist auf 1 Monat ab dieser Registerbekanntmachung festgesetzt."
    },
    {
      "date": "2025-06-24",
      "id": "113188",
      "original_text": "Löschungsankündigung\nNiedersachsen Amtsgericht Lüneburg HRB 206359\nL-DORADO funarea GmbH – Uelzen",
      "type": "Löschungsankündigung",
      "state": "Niedersachsen",
      "amtsgericht": "Amtsgericht Lüneburg",
      "registernummer": "HRB 206359",
      "registerart": "HRB",
      "company_name": "L-DORADO funarea GmbH",
      "company_seat": "Uelzen",
      "details": "24.06.2025 (Bekanntmachungsdatum)\n\nNiedersachsen Amtsgericht Lüneburg HRB 206359\nLöschungsankündigung\n\nL-DORADO funarea GmbH\nGesellschaft mit beschränkter Haftung\nUelzen\n\nDas Registergericht beabsichtigt, die Gesellschaft von Amts wegen nach § 394 FamFG zu löschen. Die Frist zur Erhebung eines Widerspruchs ist auf 1 Monat ab dieser Registerbekanntmachung festgesetzt."
    },
    {
      "date": "2025-06-24",
      "id": "113189",
      "original_text": "Löschungsankündigung\nNiedersachsen Amtsgericht Aurich HRA 100550 früher Amtsgericht Emden\nMS \"Frisian Pioneer\" Schiffahrts GmbH & Co. KG – Emden",
      "type": "Löschungsankündigung",
      "state": "Niedersachsen",
      "amtsgericht": "Amtsgericht Aurich",
      "registernummer": "HRA 100550",
      "registerart": "HRA",
      "company_name": "MS \"Frisian Pioneer\" Schiffahrts GmbH & Co. KG",
      "company_seat": "Emden",
      "former_amtsgericht": "Emden",
      "details": "24.06.2025 (Bekanntmachungsdatum)\n\nNiedersachsen Amtsgericht Aurich HRA 100550 früher Amtsgericht Emden\nLöschungsankündigung\n\nMS \"Frisian Pioneer\" Schiffahrts GmbH & Co. KG\nKommanditgesellschaft\nEmden\n\nDas Registergericht beabsichtigt, die Firma von Amts wegen nach § 394 FamFG zu löschen. Die Frist zur Erhebung eines Widerspruchs ist auf 1 Monat ab dieser Registerbekanntmachung festgesetzt."
    },
    {
      "date": "2025-06-24",
      "id": "113190",
      "original_text": "Löschungsankündigung\nNiedersachsen Amtsgericht Hildesheim HRB 35188\nVerlagsvertretung Wolfgang Koehler Gesellschaft mit beschränkter Haftung – Lehrte - Ahlten",
      "type": "Löschungsankündigung",
      "state": "Niedersachsen",
      "amtsgericht": "Amtsgericht Hildesheim",
      "registernummer": "HRB 35188",
      "registerart": "HRB",
      "company_name": "Verlagsvertretung Wolfgang Koehler Gesellschaft mit beschränkter Haftung",
      "company_seat": "Lehrte - Ahlten",
      "details": "24.06.2025 (Bekanntmachungsdatum)\n\nNiedersachsen Amtsgericht Hildesheim HRB 35188\nLöschungsankündigung\n\nVerlagsvertretung Wolfgang Koehler Gesellschaft mit beschränkter Haftung\nGesellschaft mit beschränkter Haftung\nLehrte - Ahlten\n\nDas Registergericht beabsichtigt, die Gesellschaft von Amts wegen nach § 394 FamFG zu löschen. Die Frist zur Erhebung eines Widerspruchs ist auf 1 Monat ab dieser Registerbekanntmachung festgesetzt."
    },
    {
      "date": "2025-06-24",
      "id": "113191",
      "original_text": "Registerbekanntmachung nach dem Umwandlungsgesetz\nNiedersachsen Amtsgericht Osnabrück HRB 131286 früher Amtsgericht Nordhorn\npro tec Service GmbH – Nordhorn",
      "type": "Registerbekanntmachung nach dem Umwandlungsgesetz",
      "state": "Niedersachsen",
      "amtsgericht": "Amtsgericht Osnabrück",
      "registernummer": "HRB 131286",
      "registerart": "HRB",
      "company_name": "pro tec Service GmbH",
      "company_seat": "Nordhorn",
      "former_amtsgericht": "Nordhorn",
      "details": "24.06.2025 (Bekanntmachungsdatum)\n\nNiedersachsen Amtsgericht Osnabrück HRB 131286 früher Amtsgericht Nordhorn\nRegisterbekanntmachung nach dem Umwandlungsgesetz 24.06.2025 (Eintragungsdatum)\n\npro tec Service GmbH\nGesellschaft mit beschränkter Haftung\nNordhorn\n\nDen Gläubigern der an der Verschmelzung beteiligten Rechtsträger ist, wenn sie binnen sechs Monaten nach dem Tag, an dem die Eintragung der Verschmelzung in das Register des Sitzes desjenigen Rechtsträgers, dessen Gläubiger sie sind, nach § 19  Abs.  3 UmwG als bekannt gemacht gilt, ihren Anspruch nach Grund und Höhe schriftlich anmelden, Sicherheit zu leisten, soweit sie nicht Befriedigung verlangen können. Dieses Recht steht den Gläubigern jedoch nur zu, wenn sie glaubhaft machen, dass durch die Verschmelzung die Erfüllung der Forderung gefährdet wird."
    },
    {
      "date": "2025-06-24",
      "id": "113192",
      "original_text": "Einreichung neuer Dokumente\nNiedersachsen Amtsgericht Braunschweig HRB 100484 früher Amtsgericht Wolfsburg\nVOLKSWAGEN AKTIENGESELLSCHAFT – Wolfsburg",
      "type": "Einreichung neuer Dokumente",
      "state": "Niedersachsen",
      "amtsgericht": "Amtsgericht Braunschweig",
      "registernummer": "HRB 100484",
      "registerart": "HRB",
      "company_name": "VOLKSWAGEN AKTIENGESELLSCHAFT",
      "company_seat": "Wolfsburg",
      "former_amtsgericht": "Wolfsburg",
      "details": "24.06.2025 (Bekanntmachungsdatum)\n\nNiedersachsen Amtsgericht Braunschweig HRB 100484 früher Amtsgericht Wolfsburg\nEinreichung neuer Dokumente\n\nVOLKSWAGEN AKTIENGESELLSCHAFT\nAktiengesellschaft\nWolfsburg\n\nDie Liste der Mitglieder des Aufsichtsrats wurde beim Registergericht eingereicht."
    },
    {
      "date": "2025-06-24",
      "id": "113193",
      "original_text": "Registerbekanntmachung nach dem Umwandlungsgesetz\nNiedersachsen Amtsgericht Walsrode HRB 212413\n2-Rad Dreher GmbH – Achim",
      "type": "Registerbekanntmachung nach dem Umwandlungsgesetz",
      "state": "Niedersachsen",
      "amtsgericht": "Amtsgericht Walsrode",
      "registernummer": "HRB 212413",
      "registerart": "HRB",
      "company_name": "2-Rad Dreher GmbH",
      "company_seat": "Achim",
      "details": "24.06.2025 (Bekanntmachungsdatum)\n\nNiedersachsen Amtsgericht Walsrode HRB 212413\nRegisterbekanntmachung nach dem Umwandlungsgesetz 24.06.2025 (Eintragungsdatum)\n\n2-Rad Dreher GmbH\nGesellschaft mit beschränkter Haftung\nAchim\n\nDen Gläubigern der an der Ausgliederung beteiligten Rechtsträger ist, wenn sie binnen sechs Monaten nach dem Tag, an dem die Eintragung der Ausgliederung in das Register des Sitzes desjenigen Rechtsträgers, dessen Gläubiger sie sind, nach § 19 Abs. 3 UmwG als bekannt gemacht gilt, ihren Anspruch nach Grund und Höhe schriftlich anmelden, Sicherheit zu leisten, soweit sie nicht Befriedigung verlangen können. Dieses Recht steht den Gläubigern jedoch nur zu, wenn sie glaubhaft machen, dass durch die Ausgliederung die Erfüllung der Forderung gefährdet wird."
    },
    {
      "date": "2025-06-24",
      "id": "113194",
      "original_text": "Registerbekanntmachung nach dem Umwandlungsgesetz\nNiedersachsen Amtsgericht Walsrode HRA 205403\nRalf Dreher Fahrradreparaturen und -handel e. K. – Achim",
      "type": "Registerbekanntmachung nach dem Umwandlungsgesetz",
      "state": "Niedersachsen",
      "amtsgericht": "Amtsgericht Walsrode",
      "registernummer": "HRA 205403",
      "registerart": "HRA",
      "company_name": "Ralf Dreher Fahrradreparaturen und -handel e. K.",
      "company_seat": "Achim",
      "details": "24.06.2025 (Bekanntmachungsdatum)\n\nNiedersachsen Amtsgericht Walsrode HRA 205403\nRegisterbekanntmachung nach dem Umwandlungsgesetz\n\nRalf Dreher Fahrradreparaturen und -handel e. K.\nEinzelkaufmann / Einzelkauffrau\nAchim\n\nDen Gläubigern der an der Ausgliederung beteiligten Rechtsträger ist, wenn sie binnen sechs Monaten nach dem Tag, an dem die Eintragung der Ausgliederung in das Register des Sitzes desjenigen Rechtsträgers, dessen Gläubiger sie sind, nach § 19 Abs. 3 UmwG als bekannt gemacht gilt, ihren Anspruch nach Grund und Höhe schriftlich anmelden, Sicherheit zu leisten, soweit sie nicht Befriedigung verlangen können. Dieses Recht steht den Gläubigern jedoch nur zu, wenn sie glaubhaft machen, dass durch die Ausgliederung die Erfüllung der Forderung gefährdet wird."
    },
    {
      "date": "2025-06-24",
      "id": "113195",
      "original_text": "Registerbekanntmachung nach dem Umwandlungsgesetz\nNiedersachsen Amtsgericht Osnabrück HRB 206834\npro tec Service GmbH Lingen – Lingen",
      "type": "Registerbekanntmachung nach dem Umwandlungsgesetz",
      "state": "Niedersachsen",
      "amtsgericht": "Amtsgericht Osnabrück",
      "registernummer": "HRB 206834",
      "registerart": "HRB",
      "company_name": "pro tec Service GmbH Lingen",
      "company_seat": "Lingen",
      "details": "24.06.2025 (Bekanntmachungsdatum)\n\nNiedersachsen Amtsgericht Osnabrück HRB 206834\nRegisterbekanntmachung nach dem Umwandlungsgesetz 24.06.2025 (Eintragungsdatum)\n\npro tec Service GmbH Lingen\nGesellschaft mit beschränkter Haftung\nLingen\n\nDen Gläubigern der an der Verschmelzung beteiligten Rechtsträger ist, wenn sie binnen sechs Monaten nach dem Tag, an dem die Eintragung der Verschmelzung in das Register des Sitzes desjenigen Rechtsträgers, dessen Gläubiger sie sind, nach § 19  Abs.  3 UmwG als bekannt gemacht gilt, ihren Anspruch nach Grund und Höhe schriftlich anmelden, Sicherheit zu leisten, soweit sie nicht Befriedigung verlangen können. Dieses Recht steht den Gläubigern jedoch nur zu, wenn sie glaubhaft machen, dass durch die Verschmelzung die Erfüllung der Forderung gefährdet wird."
    },
    {
      "date": "2025-06-24",
      "id": "113196",
      "original_text": "Löschungsankündigung\nNiedersachsen Amtsgericht Osnabrück VR 130619\nNordhorner Tierschutzverein e.V. – Nordhorn",
      "type": "Löschungsankündigung",
      "state": "Niedersachsen",
      "amtsgericht": "Amtsgericht Osnabrück",
      "registernummer": "VR 130619",
      "registerart": "VR",
      "company_name": "Nordhorner Tierschutzverein e.V.",
      "company_seat": "Nordhorn",
      "details": "24.06.2025 (Bekanntmachungsdatum)\n\nNiedersachsen Amtsgericht Osnabrück VR 130619\nLöschungsankündigung\n\nNordhorner Tierschutzverein e.V.\neingetragener Verein\nNordhorn\n\nDas Registergericht beabsichtigt, den Verein infolge Wegfalls aller Mitglieder von Amts wegen nach § 395 FamFG zu löschen. Die Frist zur Erhebung eines Widerspruchs ist auf 1 Monat ab dieser Registerbekanntmachung festgesetzt."
    },
    {
      "date": "2025-06-24",
      "id": "113197",
      "original_text": "Löschungsankündigung\nNiedersachsen Amtsgericht Walsrode HRB 210312\nHanse SHK GmbH – Rehburg-Loccum",
      "type": "Löschungsankündigung",
      "state": "Niedersachsen",
      "amtsgericht": "Amtsgericht Walsrode",
      "registernummer": "HRB 210312",
      "registerart": "HRB",
      "company_name": "Hanse SHK GmbH",
      "company_seat": "Rehburg-Loccum",
      "details": "24.06.2025 (Bekanntmachungsdatum)\n\nNiedersachsen Amtsgericht Walsrode HRB 210312\nLöschungsankündigung\n\nHanse SHK GmbH\nGesellschaft mit beschränkter Haftung\nRehburg-Loccum\n\nEs ist beabsichtigt, die Gesellschaft wegen Vermögenslosigkeit von Amts wegen im Handelsregister zu löschen (§ 394 FamFG).\nBis zum 15.07.2025 können Sie beim Amtsgericht Walsrode gegen die angekündigte Löschung schriftlich oder zu Protokoll der Geschäftsstelle Widerspruch unter Angabe von Gründen erheben."
    },
    {
      "date": "2025-06-24",
      "id": "113198",
      "original_text": "Löschungsankündigung\nNiedersachsen Amtsgericht Aurich HRB 203950\nSIGMAWORK UG (haftungsbeschränkt) – Rhauderfehn",
      "type": "Löschungsankündigung",
      "state": "Niedersachsen",
      "amtsgericht": "Amtsgericht Aurich",
      "registernummer": "HRB 203950",
      "registerart": "HRB",
      "company_name": "SIGMAWORK UG (haftungsbeschränkt)",
      "company_seat": "Rhauderfehn",
      "details": "24.06.2025 (Bekanntmachungsdatum)\n\nNiedersachsen Amtsgericht Aurich HRB 203950\nLöschungsankündigung\n\nSIGMAWORK UG (haftungsbeschränkt)\nGesellschaft mit beschränkter Haftung\nRhauderfehn\n\nDas Registergericht beabsichtigt, die Gesellschaft von Amts wegen nach § 394 FamFG zu löschen. Die Frist zur Erhebung eines Widerspruchs ist auf 1 Monat ab dieser Registerbekanntmachung festgesetzt."
    },
    {
      "date": "2025-06-24",
      "id": "113199",
      "original_text": "Registerbekanntmachung nach dem Umwandlungsgesetz\nBremen Amtsgericht Bremen HRB 25567\nZECH Transport GmbH – Bremen",
      "type": "Registerbekanntmachung nach dem Umwandlungsgesetz",
      "state": "Bremen",
      "amtsgericht": "Amtsgericht Bremen",
      "registernummer": "HRB 25567",
      "registerart": "HRB",
      "company_name": "ZECH Transport GmbH",
      "company_seat": "Bremen",
      "details": "24.06.2025 (Bekanntmachungsdatum)\n\nBremen Amtsgericht Bremen HRB 25567\nRegisterbekanntmachung nach dem Umwandlungsgesetz 17.06.2025 (Eintragungsdatum)\n\nZECH Transport GmbH\nGesellschaft mit beschränkter Haftung\nBremen\n\nZu Eintragungsnummer 15 vom 17.06.2025 wird als nicht eingetragen veröffentlicht: Den Gläubigern der an der Verschmelzung beteiligten Rechtsträger ist, wenn sie binnen sechs Monaten nach dem Tag, an dem die Eintragung der Verschmelzung in das Register des Sitzes desjenigen Rechtsträgers, dessen Gläubiger sie sind, als bekannt gemacht gilt, ihren Anspruch nach Grund und Höhe schriftlich anmelden, Sicherheit zu leisten, soweit sie nicht Befriedigung verlangen können. Dieses Recht steht den Gläubigern jedoch nur zu, wenn sie glaubhaft machen, dass durch die Verschmelzung die Erfüllung ihrer Forderung gefährdet wird. Das Recht, Sicherheitsleistung zu verlangen, steht Gläubigern nicht zu, die im Falle der Insolvenz ein Recht auf vorzugsweise Befriedigung aus einer Deckungsmasse haben, die nach gesetzlicher Vorschrift zu ihrem Schutz errichtet und staatlich überwacht ist."
    },
    {
      "date": "2025-06-24",
      "id": "113200",
      "original_text": "Registerbekanntmachung nach dem Umwandlungsgesetz\nBremen Amtsgericht Bremen HRB 34662\nZECH Umwelt GmbH – Bremen",
      "type": "Registerbekanntmachung nach dem Umwandlungsgesetz",
      "state": "Bremen",
      "amtsgericht": "Amtsgericht Bremen",
      "registernummer": "HRB 34662",
      "registerart": "HRB",
      "company_name": "ZECH Umwelt GmbH",
      "company_seat": "Bremen",
      "details": "24.06.2025 (Bekanntmachungsdatum)\n\nBremen Amtsgericht Bremen HRB 34662\nRegisterbekanntmachung nach dem Umwandlungsgesetz 17.06.2025 (Eintragungsdatum)\n\nZECH Umwelt GmbH\nGesellschaft mit beschränkter Haftung\nBremen\n\nZu Eintragungsnummer 46 vom 17.06.2025 wird als nicht eingetragen veröffentlicht: Den Gläubigern der an der Verschmelzung beteiligten Rechtsträger ist, wenn sie binnen sechs Monaten nach dem Tag, an dem die Eintragung der Verschmelzung in das Register des Sitzes desjenigen Rechtsträgers, dessen Gläubiger sie sind, als bekannt gemacht gilt, ihren Anspruch nach Grund und Höhe schriftlich anmelden, Sicherheit zu leisten, soweit sie nicht Befriedigung verlangen können. Dieses Recht steht den Gläubigern jedoch nur zu, wenn sie glaubhaft machen, dass durch die Verschmelzung die Erfüllung ihrer Forderung gefährdet wird. Das Recht, Sicherheitsleistung zu verlangen, steht Gläubigern nicht zu, die im Falle der Insolvenz ein Recht auf vorzugsweise Befriedigung aus einer Deckungsmasse haben, die nach gesetzlicher Vorschrift zu ihrem Schutz errichtet und staatlich überwacht ist."
    },
    {
      "date": "2025-06-24",
      "id": "113201",
      "original_text": "Registerbekanntmachung nach dem Umwandlungsgesetz\nBremen Amtsgericht Bremen HRB 34400\nConvivo Abwicklungs GmbH – Bremen",
      "type": "Registerbekanntmachung nach dem Umwandlungsgesetz",
      "state": "Bremen",
      "amtsgericht": "Amtsgericht Bremen",
      "registernummer": "HRB 34400",
      "registerart": "HRB",
      "company_name": "Convivo Abwicklungs GmbH",
      "company_seat": "Bremen",
      "details": "24.06.2025 (Bekanntmachungsdatum)\n\nBremen Amtsgericht Bremen HRB 34400\nRegisterbekanntmachung nach dem Umwandlungsgesetz 18.06.2025 (Eintragungsdatum)\n\nConvivo Abwicklungs GmbH\nGesellschaft mit beschränkter Haftung\nBremen\n\nZu Eintragungsnummer 6 vom 18.06.2025 wird als nicht eingetragen veröffentlicht: Als nicht eingetragen wird veröffentlicht: Den Gläubigern der an der Verschmelzung beteiligten Rechtsträger ist, wenn sie binnen sechs Monaten nach dem Tag, an dem die Eintragung der Verschmelzung in das Register des Sitzes desjenigen Rechtsträgers, dessen Gläubiger sie sind, als bekannt gemacht gilt, ihren Anspruch nach Grund und Höhe schriftlich anmelden, Sicherheit zu leisten, soweit sie nicht Befriedigung verlangen können. Dieses Recht steht den Gläubigern jedoch nur zu, wenn sie glaubhaft machen, dass durch die Verschmelzung die Erfüllung ihrer Forderung gefährdet wird. Das Recht, Sicherheitsleistung zu verlangen, steht Gläubigern nicht zu, die im Falle der Insolvenz ein Recht auf vorzugsweise Befriedigung aus einer Deckungsmasse haben, die nach gesetzlicher Vorschrift zu ihrem Schutz errichtet und staatlich überwacht ist."
    },
    {
      "date": "2025-06-24",
      "id": "113202",
      "original_text": "Registerbekanntmachung nach dem Umwandlungsgesetz\nBremen Amtsgericht Bremen HRB 33218\nPacific Treasury Management UG (haftungsbeschränkt) – Bremen",
      "type": "Registerbekanntmachung nach dem Umwandlungsgesetz",
      "state": "Bremen",
      "amtsgericht": "Amtsgericht Bremen",
      "registernummer": "HRB 33218",
      "registerart": "HRB",
      "company_name": "Pacific Treasury Management UG (haftungsbeschränkt)",
      "company_seat": "Bremen",
      "details": "24.06.2025 (Bekanntmachungsdatum)\n\nBremen Amtsgericht Bremen HRB 33218\nRegisterbekanntmachung nach dem Umwandlungsgesetz 19.06.2025 (Eintragungsdatum)\n\nPacific Treasury Management UG (haftungsbeschränkt)\nGesellschaft mit beschränkter Haftung\nBremen\n\nAls nicht eingetragen wird veröffentlicht: Den Gläubigern der an der Verschmelzung beteiligten Rechtsträger ist, wenn sie binnen sechs Monaten nach dem Tag, an dem die Eintragung der Verschmelzung in das Register des Sitzes desjenigen Rechtsträgers, dessen Gläubiger sie sind, als bekannt gemacht gilt, ihren Anspruch nach Grund und Höhe schriftlich anmelden, Sicherheit zu leisten, soweit sie nicht Befriedigung verlangen können. Dieses Recht steht den Gläubigern jedoch nur zu, wenn sie glaubhaft machen, dass durch die Verschmelzung die Erfüllung ihrer Forderung gefährdet wird. Das Recht, Sicherheitsleistung zu verlangen, steht Gläubigern nicht zu, die im Falle der Insolvenz ein Recht auf vorzugsweise Befriedigung aus einer Deckungsmasse haben, die nach gesetzlicher Vorschrift zu ihrem Schutz errichtet und staatlich überwacht ist."
    },
    {
      "date": "2025-06-24",
      "id": "113203",
      "original_text": "Löschungsankündigung\nBremen Amtsgericht Bremen HRB 34355\nDawson Verwaltungsgesellschaft mbH – Bremen",
      "type": "Löschungsankündigung",
      "state": "Bremen",
      "amtsgericht": "Amtsgericht Bremen",
      "registernummer": "HRB 34355",
      "registerart": "HRB",
      "company_name": "Dawson Verwaltungsgesellschaft mbH",
      "company_seat": "Bremen",
      "details": "24.06.2025 (Bekanntmachungsdatum)\n\nBremen Amtsgericht Bremen HRB 34355\nLöschungsankündigung\n\nDawson Verwaltungsgesellschaft mbH\nGesellschaft mit beschränkter Haftung\nBremen\n\nEs ist beabsichtigt die im Handelsregister eingetragene Gesellschaft von Amts wegen gemäß § 394 FamFG zu löschen. Gegen die Löschung kann beim AG Bremen schriftlich oder zu Protokoll der Geschäftsstelle Widerspruch eingelegt werden. Widerspruchsfrist 4 Wochen."
    },
    {
      "date": "2025-06-24",
      "id": "113204",
      "original_text": "Löschungsankündigung\nRheinland-Pfalz Amtsgericht Koblenz HRA 13065\nAqua - Project Wasseraufbereitung e.K. – Kempenich",
      "type": "Löschungsankündigung",
      "state": "Rheinland-Pfalz",
      "amtsgericht": "Amtsgericht Koblenz",
      "registernummer": "HRA 13065",
      "registerart": "HRA",
      "company_name": "Aqua - Project Wasseraufbereitung e.K.",
      "company_seat": "Kempenich",
      "details": "24.06.2025 (Bekanntmachungsdatum)\n\nRheinland-Pfalz Amtsgericht Koblenz HRA 13065\nLöschungsankündigung\n\nAqua - Project Wasseraufbereitung e.K.\nEinzelkaufmann / Einzelkauffrau\nKempenich\n\nDas Registergericht beabsichtigt die Firma von Amts wegen nach § 31 Abs. 2 HGB, § 393 FamFG zu löschen. Die Frist zur Erhebung eines Widerspruchs ist auf  einen Monat festgesetzt."
    },
    {
      "date": "2025-06-24",
      "id": "113205",
      "original_text": "Einreichung neuer Dokumente\nRheinland-Pfalz Amtsgericht Koblenz HRB 227\nKoblenzer Wohnungsbaugesellschaft mbH – Koblenz",
      "type": "Einreichung neuer Dokumente",
      "state": "Rheinland-Pfalz",
      "amtsgericht": "Amtsgericht Koblenz",
      "registernummer": "HRB 227",
      "registerart": "HRB",
      "company_name": "Koblenzer Wohnungsbaugesellschaft mbH",
      "company_seat": "Koblenz",
      "details": "24.06.2025 (Bekanntmachungsdatum)\n\nRheinland-Pfalz Amtsgericht Koblenz HRB 227\nEinreichung neuer Dokumente\n\nKoblenzer Wohnungsbaugesellschaft mbH\nGesellschaft mit beschränkter Haftung\nKoblenz\n\nDem Registergericht ist eine Liste der Mitglieder des Aufsichtsrates eingereicht worden."
    },
    {
      "date": "2025-06-24",
      "id": "113206",
      "original_text": "Löschungsankündigung\nRheinland-Pfalz Amtsgericht Montabaur HRB 22616\nDie Portalmacher UG (haftungsbeschränkt) – Großmaischeid",
      "type": "Löschungsankündigung",
      "state": "Rheinland-Pfalz",
      "amtsgericht": "Amtsgericht Montabaur",
      "registernummer": "HRB 22616",
      "registerart": "HRB",
      "company_name": "Die Portalmacher UG (haftungsbeschränkt)",
      "company_seat": "Großmaischeid",
      "details": "24.06.2025 (Bekanntmachungsdatum)\n\nRheinland-Pfalz Amtsgericht Montabaur HRB 22616\nLöschungsankündigung 24.06.2025 (Eintragungsdatum)\n\nDie Portalmacher UG (haftungsbeschränkt)\nGesellschaft mit beschränkter Haftung\nGroßmaischeid\n\nDas Registergericht beabsichtigt die Gesellschaft von Amts wegen nach § 394 FamFG zu löschen. Die Frist zur Erhebung eines Widerspruchs ist auf 1 Monat festgesetzt."
    },
    {
      "date": "2025-06-24",
      "id": "113207",
      "original_text": "Registerbekanntmachung nach dem Umwandlungsgesetz\nNordrhein-Westfalen Amtsgericht Düsseldorf HRB 102555\nEarthwise.Capital GmbH. – Düsseldorf",
      "type": "Registerbekanntmachung nach dem Umwandlungsgesetz",
      "state": "Nordrhein-Westfalen",
      "amtsgericht": "Amtsgericht Düsseldorf",
      "registernummer": "HRB 102555",
      "registerart": "HRB",
      "company_name": "Earthwise.Capital GmbH.",
      "company_seat": "Düsseldorf",
      "details": "24.06.2025 (Bekanntmachungsdatum)\n\nNordrhein-Westfalen Amtsgericht Düsseldorf HRB 102555\nRegisterbekanntmachung nach dem Umwandlungsgesetz 24.06.2025 (Eintragungsdatum)\n\nEarthwise.Capital GmbH.\nGesellschaft mit beschränkter Haftung\nDüsseldorf\n\nDen Gläubigern der an der Verschmelzung beteiligten Rechtsträger ist, wenn sie binnen sechs Monaten nach dem Tag, an dem die Eintragung der Verschmelzung in das Register des Sitzes desjenigen Rechtsträgers, dessen Gläubiger sie sind, nach § 19 Absatz 3 UmwG als bekanntgemacht gilt, ihren Anspruch nach Grund und Höhe schriftlich anmelden, Sicherheit zu leisten, soweit sie nicht Befriedigung verlangen können. Dieses Recht steht den Gläubigern jedoch nur zu, wenn sie glaubhaft machen, dass durch die Verschmelzung die Erfüllung ihrer Forderung gefährdet wird."
    },
    {
      "date": "2025-06-24",
      "id": "113208",
      "original_text": "Registerbekanntmachung nach dem Umwandlungsgesetz\nNordrhein-Westfalen Amtsgericht Bochum HRB 22462\nBerendes & Wilberg GmbH – Bochum",
      "type": "Registerbekanntmachung nach dem Umwandlungsgesetz",
      "state": "Nordrhein-Westfalen",
      "amtsgericht": "Amtsgericht Bochum",
      "registernummer": "HRB 22462",
      "registerart": "HRB",
      "company_name": "Berendes & Wilberg GmbH",
      "company_seat": "Bochum",
      "details": "24.06.2025 (Bekanntmachungsdatum)\n\nNordrhein-Westfalen Amtsgericht Bochum HRB 22462\nRegisterbekanntmachung nach dem Umwandlungsgesetz 23.06.2025 (Eintragungsdatum)\n\nBerendes & Wilberg GmbH\nGesellschaft mit beschränkter Haftung\nBochum\n\nDen Gläubigern der an der formwechselnden Umwandlung beteiligten Rechtsträger ist, wenn sie binnen sechs Monaten nach dem Tag, an dem die Eintragung der formwechselnden Umwandlung in das Register des Sitzes derjenigen Rechtsträger deren Gläubiger sie sind, nach § 19 Absatz 3 UmwG als bekanntgemacht gilt, ihren Anspruch nach Grund und Höhe schriftlich anmelden, Sicherheit zu leisten, soweit sie nicht Befriedigung verlangen können. Dieses Recht steht den Gläubigern jedoch nur zu, wenn sie glaubhaft machen, dass durch die formwechselnden Umwandlung die Erfüllung ihrer Forderung gefährdet wird."
    },
    {
      "date": "2025-06-24",
      "id": "113209",
      "original_text": "Löschungsankündigung\nNordrhein-Westfalen Amtsgericht Düsseldorf HRB 84674\nLEON ADL GmbH – Düsseldorf",
      "type": "Löschungsankündigung",
      "state": "Nordrhein-Westfalen",
      "amtsgericht": "Amtsgericht Düsseldorf",
      "registernummer": "HRB 84674",
      "registerart": "HRB",
      "company_name": "LEON ADL GmbH",
      "company_seat": "Düsseldorf",
      "details": "24.06.2025 (Bekanntmachungsdatum)\n\nNordrhein-Westfalen Amtsgericht Düsseldorf HRB 84674\nLöschungsankündigung\n\nLEON ADL GmbH\nGesellschaft mit beschränkter Haftung\nDüsseldorf\n\nDas Registergericht beabsichtigt die Gesellschaft von Amts wegen nach § 394 FamFG zu löschen. Die Frist zur Erhebung eines Widerspruchs ist auf 3 Wochen festgesetzt.\n\nRechtsbehelfsbelehrung:\nDas Widerspruchsrecht steht jedem zu, der an der Unterlassung der Löschung ein berechtigtes Interesse hat. Der Widerspruch ist bei dem Amtsgericht Düsseldorf -Registergericht-, Werdener Straße 1, 40227 Düsseldorf schriftlich in deutscher Sprache oder zur Niederschrift der Geschäftsstelle einzulegen. Der Widerspruch kann auch zur Niederschrift der Geschäftsstelle eines jeden Amtsgerichtes abgegeben werden. Die Einlegung ist auch durch Übertragung eines elektronischen Dokuments an die elektronische Poststelle des Gerichts möglich. Das elektronische Dokument muss für die Bearbeitung durch das Gericht geeignet und mit einer qualifizierten elektronischen Signatur der verantwortenden Person versehen sein oder von der verantwortenden Person signiert und auf einem sicheren Übermittlungsweg gemäß § 130a ZPO nach näherer Maßgabe der Verordnung über die technischen Rahmenbedingungen des elektronischen Rechtsverkehrs und über das besondere elektronische Behördenpostfach (BGBl. I, S.3803) eingereicht werden. Weitere Informationen erhalten Sie auf der Internetseite www.justiz.de.\nDer Widerspruch muss spätestens innerhalb der gesetzten Frist nach dem Datum der Bekanntmachung der Löschungsankündigung bei dem Amtsgericht - Registergericht - Düsseldorf eingegangen sein.  Dies gilt auch dann, wenn der Widerspruch zur Niederschrift der Geschäftsstelle eines anderen Amtsgerichtes abgegeben wurde. Die Frist beginnt mit dem Tage der Bekanntmachung der Löschungsankündigung in dem für die Bekanntmachung der Eintragungen in das Handelsregister bestimmten elektronischen Informations- und Kommunikationssystem nach § 10 des Handelsgesetzbuches. Fällt das Ende der Frist auf einen Sonntag, einen allgemeinen Feiertag oder Sonnabend, so endet die Frist mit Ablauf des nächsten Werktages.\nDer Widerspruch muss die Bezeichnung der angefochtenen Löschungsankündigung sowie die Erklärung enthalten, dass Widerspruch gegen diese Löschungsankündigung eingelegt wird. Er ist zu unterzeichnen und soll begründet werden."
    },
    {
      "date": "2025-06-24",
      "id": "113210",
      "original_text": "Sonstige Registerbekanntmachung\nNordrhein-Westfalen Amtsgericht Bonn HRB 5919\nTelekom Deutschland GmbH – Bonn",
      "type": "Sonstige Registerbekanntmachung",
      "state": "Nordrhein-Westfalen",
      "amtsgericht": "Amtsgericht Bonn",
      "registernummer": "HRB 5919",
      "registerart": "HRB",
      "company_name": "Telekom Deutschland GmbH",
      "company_seat": "Bonn",
      "details": "24.06.2025 (Bekanntmachungsdatum)\n\nNordrhein-Westfalen Amtsgericht Bonn HRB 5919\nSonstige Registerbekanntmachung\n\nTelekom Deutschland GmbH\nGesellschaft mit beschränkter Haftung\nBonn\n\nDem Registergericht ist eine neue Liste der Mitglieder des Aufsichtsrates eingereicht worden."
    },
    {
      "date": "2025-06-24",
      "id": "113211",
      "original_text": "Löschungsankündigung\nNordrhein-Westfalen Amtsgericht Bad Oeynhausen HRB 14215\nMBT Metallbautechnik mit Format UG (haftungsbeschränkt) – Bünde",
      "type": "Löschungsankündigung",
      "state": "Nordrhein-Westfalen",
      "amtsgericht": "Amtsgericht Bad Oeynhausen",
      "registernummer": "HRB 14215",
      "registerart": "HRB",
      "company_name": "MBT Metallbautechnik mit Format UG (haftungsbeschränkt)",
      "company_seat": "Bünde",
      "details": "24.06.2025 (Bekanntmachungsdatum)\n\nNordrhein-Westfalen Amtsgericht Bad Oeynhausen HRB 14215\nLöschungsankündigung\n\nMBT Metallbautechnik mit Format UG (haftungsbeschränkt)\nGesellschaft mit beschränkter Haftung\nBünde\n\nDas Registergericht beabsichtigt die Gesellschaft von Amts wegen nach § 394 FamFG zu löschen. Die Frist zur Erhebung eines Widerspruchs ist auf zwei Monate festgesetzt."
    },
    {
      "date": "2025-06-24",
      "id": "113212",
      "original_text": "Löschungsankündigung\nNordrhein-Westfalen Amtsgericht Kleve HRB 17454\nLasBau GmbH – Moers",
      "type": "Löschungsankündigung",
      "state": "Nordrhein-Westfalen",
      "amtsgericht": "Amtsgericht Kleve",
      "registernummer": "HRB 17454",
      "registerart": "HRB",
      "company_name": "LasBau GmbH",
      "company_seat": "Moers",
      "details": "24.06.2025 (Bekanntmachungsdatum)\n\nNordrhein-Westfalen Amtsgericht Kleve HRB 17454\nLöschungsankündigung\n\nLasBau GmbH\nGesellschaft mit beschränkter Haftung\nMoers\n\nDas Registergericht beabsichtigt die Gesellschaft von Amts wegen nach § 394 FamFG zu löschen. Die Frist zur Erhebung eines Widerspruchs ist auf einen Monat festgesetzt."
    },
    {
      "date": "2025-06-24",
      "id": "113213",
      "original_text": "Einreichung neuer Dokumente\nNordrhein-Westfalen Amtsgericht Köln HRB 36041\nDEVK Pensionsfonds Aktiengesellschaft – Köln",
      "type": "Einreichung neuer Dokumente",
      "state": "Nordrhein-Westfalen",
      "amtsgericht": "Amtsgericht Köln",
      "registernummer": "HRB 36041",
      "registerart": "HRB",
      "company_name": "DEVK Pensionsfonds Aktiengesellschaft",
      "company_seat": "Köln",
      "details": "24.06.2025 (Bekanntmachungsdatum)\n\nNordrhein-Westfalen Amtsgericht Köln HRB 36041\nEinreichung neuer Dokumente\n\nDEVK Pensionsfonds Aktiengesellschaft\nAktiengesellschaft\nKöln\n\nDem Registergericht ist eine Liste der Mitglieder des Aufsichtsrates eingereicht worden."
    },
    {
      "date": "2025-06-24",
      "id": "113214",
      "original_text": "Löschungsankündigung\nNordrhein-Westfalen Amtsgericht Hamm HRB 9106\nRETSNEF Verwaltungs-GmbH – Unna",
      "type": "Löschungsankündigung",
      "state": "Nordrhein-Westfalen",
      "amtsgericht": "Amtsgericht Hamm",
      "registernummer": "HRB 9106",
      "registerart": "HRB",
      "company_name": "RETSNEF Verwaltungs-GmbH",
      "company_seat": "Unna",
      "details": "24.06.2025 (Bekanntmachungsdatum)\n\nNordrhein-Westfalen Amtsgericht Hamm HRB 9106\nLöschungsankündigung\n\nRETSNEF Verwaltungs-GmbH\nGesellschaft mit beschränkter Haftung\nUnna\n\nDas Registergericht beabsichtigt die Gesellschaft von Amts wegen nach § 394 FamFG zu löschen. Die Frist zur Erhebung eines Widerspruchs ist auf #DV.Fr(Text=\"Bitte wählen Sie die Widerspruchsfrist aus!\",Eingabe=\"einen Monat\",\"zwei Monate\",\"drei Monate\",\"#insert(Text=\"Freitext\")\"|\"freier Text\") festgesetzt."
    },
    {
      "date": "2025-06-24",
      "id": "113215",
      "original_text": "Registerbekanntmachung nach dem Umwandlungsgesetz\nNordrhein-Westfalen Amtsgericht Steinfurt HRA 2635\nVAM Immobilien GmbH & Co. KG – Greven",
      "type": "Registerbekanntmachung nach dem Umwandlungsgesetz",
      "state": "Nordrhein-Westfalen",
      "amtsgericht": "Amtsgericht Steinfurt",
      "registernummer": "HRA 2635",
      "registerart": "HRA",
      "company_name": "VAM Immobilien GmbH & Co. KG",
      "company_seat": "Greven",
      "details": "24.06.2025 (Bekanntmachungsdatum)\n\nNordrhein-Westfalen Amtsgericht Steinfurt HRA 2635\nRegisterbekanntmachung nach dem Umwandlungsgesetz 24.06.2025 (Eintragungsdatum)\n\nVAM Immobilien GmbH & Co. KG\nKommanditgesellschaft\nGreven\n\nDen Gläubigern der an der formwechselnden Umwandlung beteiligten Rechtsträger ist, wenn sie binnen sechs Monaten nach dem Tag, an dem die Eintragung der formwechselnden Umwandlung in das Register des Sitzes desjenigen Rechtsträgers, dessen Gläubiger sie sind, nach § 19 Absatz 3 UmwG als bekanntgemacht gilt, ihren Anspruch nach Grund und Höhe schriftlich anmelden, Sicherheit zu leisten, soweit sie nicht Befriedigung verlangen können. Dieses Recht steht den Gläubigern jedoch nur zu, wenn sie glaubhaft machen, dass durch die formwechselnden Umwandlung die Erfüllung ihrer Forderung gefährdet wird."
    },
    {
      "date": "2025-06-24",
      "id": "113216",
      "original_text": "Löschungsankündigung\nNordrhein-Westfalen Amtsgericht Gütersloh HRB 10240\nHausmanufaktur hoch zwei Verwaltungsgesellschaft mbH – Gütersloh",
      "type": "Löschungsankündigung",
      "state": "Nordrhein-Westfalen",
      "amtsgericht": "Amtsgericht Gütersloh",
      "registernummer": "HRB 10240",
      "registerart": "HRB",
      "company_name": "Hausmanufaktur hoch zwei Verwaltungsgesellschaft mbH",
      "company_seat": "Gütersloh",
      "details": "24.06.2025 (Bekanntmachungsdatum)\n\nNordrhein-Westfalen Amtsgericht Gütersloh HRB 10240\nLöschungsankündigung 24.06.2025 (Eintragungsdatum)\n\nHausmanufaktur hoch zwei Verwaltungsgesellschaft mbH\nGesellschaft mit beschränkter Haftung\nGütersloh\n\nDas Registergericht beabsichtigt die Gesellschaft von Amts wegen nach § 394 FamFG zu löschen. Die Frist zur Erhebung eines Widerspruchs ist auf einen Monat festgesetzt."
    },
    {
      "date": "2025-06-24",
      "id": "113217",
      "original_text": "Registerbekanntmachung nach dem Umwandlungsgesetz\nNordrhein-Westfalen Amtsgericht Düsseldorf HRB 103882\nEarthwise.Capital GmbH – Düsseldorf",
      "type": "Registerbekanntmachung nach dem Umwandlungsgesetz",
      "state": "Nordrhein-Westfalen",
      "amtsgericht": "Amtsgericht Düsseldorf",
      "registernummer": "HRB 103882",
      "registerart": "HRB",
      "company_name": "Earthwise.Capital GmbH",
      "company_seat": "Düsseldorf",
      "details": "24.06.2025 (Bekanntmachungsdatum)\n\nNordrhein-Westfalen Amtsgericht Düsseldorf HRB 103882\nRegisterbekanntmachung nach dem Umwandlungsgesetz 24.06.2025 (Eintragungsdatum)\n\nEarthwise.Capital GmbH\nGesellschaft mit beschränkter Haftung\nDüsseldorf\n\nDen Gläubigern der an der Verschmelzung beteiligten Rechtsträger ist, wenn sie binnen sechs Monaten nach dem Tag, an dem die Eintragung der Verschmelzung in das Register des Sitzes desjenigen Rechtsträgers, dessen Gläubiger sie sind, nach § 19 Absatz 3 UmwG als bekanntgemacht gilt, ihren Anspruch nach Grund und Höhe schriftlich anmelden, Sicherheit zu leisten, soweit sie nicht Befriedigung verlangen können. Dieses Recht steht den Gläubigern jedoch nur zu, wenn sie glaubhaft machen, dass durch die Verschmelzung die Erfüllung ihrer Forderung gefährdet wird."
    },
    {
      "date": "2025-06-24",
      "id": "113218",
      "original_text": "Einreichung neuer Dokumente\nNordrhein-Westfalen Amtsgericht Köln HRB 60471\nCsecure Aktiengesellschaft – Köln",
      "type": "Einreichung neuer Dokumente",
      "state": "Nordrhein-Westfalen",
      "amtsgericht": "Amtsgericht Köln",
      "registernummer": "HRB 60471",
      "registerart": "HRB",
      "company_name": "Csecure Aktiengesellschaft",
      "company_seat": "Köln",
      "details": "24.06.2025 (Bekanntmachungsdatum)\n\nNordrhein-Westfalen Amtsgericht Köln HRB 60471\nEinreichung neuer Dokumente 24.06.2025 (Eintragungsdatum)\n\nCsecure Aktiengesellschaft\nAktiengesellschaft\nKöln\n\nDem Registergericht ist eine neue Liste der Mitglieder des Aufsichtsrates eingereicht worden."
    },
    {
      "date": "2025-06-24",
      "id": "113219",
      "original_text": "Registerbekanntmachung nach dem Umwandlungsgesetz\nNordrhein-Westfalen Amtsgericht Siegburg HRB 7316\nJohannes Blesgen GmbH Schreinerwerkstätte – Eitorf",
      "type": "Registerbekanntmachung nach dem Umwandlungsgesetz",
      "state": "Nordrhein-Westfalen",
      "amtsgericht": "Amtsgericht Siegburg",
      "registernummer": "HRB 7316",
      "registerart": "HRB",
      "company_name": "Johannes Blesgen GmbH Schreinerwerkstätte",
      "company_seat": "Eitorf",
      "details": "24.06.2025 (Bekanntmachungsdatum)\n\nNordrhein-Westfalen Amtsgericht Siegburg HRB 7316\nRegisterbekanntmachung nach dem Umwandlungsgesetz 24.06.2025 (Eintragungsdatum)\n\nJohannes Blesgen GmbH Schreinerwerkstätte\nGesellschaft mit beschränkter Haftung\nEitorf\n\nDen Gläubigern der an der Verschmelzung beteiligten Rechtsträger ist, wenn sie binnen sechs Monaten nach dem Tag, an dem die Eintragung der Verschmelzung in das Register des Sitzes desjenigen Rechtsträgers, dessen Gläubiger sie sind, nach § 19 Absatz 3 UmwG als bekanntgemacht gilt, ihren Anspruch nach Grund und Höhe schriftlich anmelden, Sicherheit zu leisten, soweit sie nicht Befriedigung verlangen können. Dieses Recht steht den Gläubigern jedoch nur zu, wenn sie glaubhaft machen, dass durch die Verschmelzung die Erfüllung ihrer Forderung gefährdet wird."
    },
    {
      "date": "2025-06-24",
      "id": "113220",
      "original_text": "Registerbekanntmachung nach dem Umwandlungsgesetz\nNordrhein-Westfalen Amtsgericht Duisburg HRA 12494\nRhenus Ports GmbH & Co. KG – Duisburg",
      "type": "Registerbekanntmachung nach dem Umwandlungsgesetz",
      "state": "Nordrhein-Westfalen",
      "amtsgericht": "Amtsgericht Duisburg",
      "registernummer": "HRA 12494",
      "registerart": "HRA",
      "company_name": "Rhenus Ports GmbH & Co. KG",
      "company_seat": "Duisburg",
      "details": "24.06.2025 (Bekanntmachungsdatum)\n\nNordrhein-Westfalen Amtsgericht Duisburg HRA 12494\nRegisterbekanntmachung nach dem Umwandlungsgesetz 24.06.2025 (Eintragungsdatum)\n\nRhenus Ports GmbH & Co. KG\nKommanditgesellschaft\nDuisburg\n\nDen Gläubigern der an der Verschmelzung beteiligten Rechtsträger ist, wenn sie binnen sechs Monaten nach dem Tag, an dem die Eintragung der Verschmelzung in das Register des Sitzes desjenigen Rechtsträgers, dessen Gläubiger sie sind, nach § 19 Absatz 3 UmwG als bekanntgemacht gilt, ihren Anspruch nach Grund und Höhe schriftlich anmelden, Sicherheit zu leisten, soweit sie nicht Befriedigung verlangen können. Dieses Recht steht den Gläubigern jedoch nur zu, wenn sie glaubhaft machen, dass durch die Verschmelzung die Erfüllung ihrer Forderung gefährdet wird."
    },
    {
      "date": "2025-06-24",
      "id": "113221",
      "original_text": "Registerbekanntmachung nach dem Umwandlungsgesetz\nNordrhein-Westfalen Amtsgericht Dortmund VR 11090 früher Amtsgericht Castrop-Rauxel\nSportclub \"Armina\" Ickern e. V. – Castrop-Rauxel",
      "type": "Registerbekanntmachung nach dem Umwandlungsgesetz",
      "state": "Nordrhein-Westfalen",
      "amtsgericht": "Amtsgericht Dortmund",
      "registernummer": "VR 11090",
      "registerart": "VR",
      "company_name": "Sportclub \"Armina\" Ickern e. V.",
      "company_seat": "Castrop-Rauxel",
      "former_amtsgericht": "Castrop-Rauxel",
      "details": "24.06.2025 (Bekanntmachungsdatum)\n\nNordrhein-Westfalen Amtsgericht Dortmund VR 11090 früher Amtsgericht Castrop-Rauxel\nRegisterbekanntmachung nach dem Umwandlungsgesetz 24.06.2025 (Eintragungsdatum)\n\nSportclub \"Armina\" Ickern e. V.\neingetragener Verein\nCastrop-Rauxel\n\nDen Gläubigern der an der Verschmelzung beteiligten Rechtsträger ist, wenn sie binnen sechs Monaten nach dem Tag, an dem die Eintragung der Verschmelzung in das Register des Sitzes desjenigen Rechtsträgers, dessen Gläubiger sie sind, nach § 19 Absatz 3 UmwG als bekanntgemacht gilt, ihren Anspruch nach Grund und Höhe schriftlich anmelden, Sicherheit zu leisten, soweit sie nicht Befriedigung verlangen können. Dieses Recht steht den Gläubigern jedoch nur zu, wenn sie glaubhaft machen, dass durch die Verschmelzung die Erfüllung ihrer Forderung gefährdet wird."
    },
    {
      "date": "2025-06-24",
      "id": "113222",
      "original_text": "Registerbekanntmachung nach dem Umwandlungsgesetz\nNordrhein-Westfalen Amtsgericht Münster HRA 8768\nPROCOM Technologie GmbH & Co. KG – Münster",
      "type": "Registerbekanntmachung nach dem Umwandlungsgesetz",
      "state": "Nordrhein-Westfalen",
      "amtsgericht": "Amtsgericht Münster",
      "registernummer": "HRA 8768",
      "registerart": "HRA",
      "company_name": "PROCOM Technologie GmbH & Co. KG",
      "company_seat": "Münster",
      "details": "24.06.2025 (Bekanntmachungsdatum)\n\nNordrhein-Westfalen Amtsgericht Münster HRA 8768\nRegisterbekanntmachung nach dem Umwandlungsgesetz 23.06.2025 (Eintragungsdatum)\n\nPROCOM Technologie GmbH & Co. KG\nKommanditgesellschaft\nMünster\n\nDen Gläubigern der an der #DV.UmF(Text=\"Bitte wählen Sie die zutreffende Art nach UmwG aus!\",Eingabe=\"Verschmelzung\",\"Aufspaltung\",\"Abspaltung\",\"Ausgliederung\",\"Vermögensübertragung\",\"formwechselnden Umwandlung\") beteiligten Rechtsträger ist, wenn sie binnen sechs Monaten nach dem Tag, an dem die Eintragung der #DV.UmF in das Register des Sitzes #DV.RTr(Text=\"Bitte wählen Sie aus, ob ein oder mehrere andere Rechtsträger betroffen sind!\",Eingabe=\"desjenigen Rechtsträgers, dessen Gläubiger\",\"derjenigen Rechtsträger deren Gläubiger\") sie sind, nach § 19 Absatz 3 UmwG als bekanntgemacht gilt, ihren Anspruch nach Grund und Höhe schriftlich anmelden, Sicherheit zu leisten, soweit sie nicht Befriedigung verlangen können. Dieses Recht steht den Gläubigern jedoch nur zu, wenn sie glaubhaft machen, dass durch die #DV.UmF die Erfüllung ihrer Forderung gefährdet wird."
    },
    {
      "date": "2025-06-24",
      "id": "113223",
      "original_text": "Registerbekanntmachung nach dem Umwandlungsgesetz\nNordrhein-Westfalen Amtsgericht Essen HRB 6223\nopta data IT Solutions GmbH – Essen",
      "type": "Registerbekanntmachung nach dem Umwandlungsgesetz",
      "state": "Nordrhein-Westfalen",
      "amtsgericht": "Amtsgericht Essen",
      "registernummer": "HRB 6223",
      "registerart": "HRB",
      "company_name": "opta data IT Solutions GmbH",
      "company_seat": "Essen",
      "details": "24.06.2025 (Bekanntmachungsdatum)\n\nNordrhein-Westfalen Amtsgericht Essen HRB 6223\nRegisterbekanntmachung nach dem Umwandlungsgesetz 24.06.2025 (Eintragungsdatum)\n\nopta data IT Solutions GmbH\nGesellschaft mit beschränkter Haftung\nEssen\n\nDen Gläubigern der an der Abspaltung beteiligten Rechtsträger ist, wenn sie binnen sechs Monaten nach dem Tag, an dem die Eintragung der Abspaltung in das Register des Sitzes derjenigen Rechtsträger deren Gläubiger sie sind, nach § 19 Absatz 3 UmwG als bekanntgemacht gilt, ihren Anspruch nach Grund und Höhe schriftlich anmelden, Sicherheit zu leisten, soweit sie nicht Befriedigung verlangen können. Dieses Recht steht den Gläubigern jedoch nur zu, wenn sie glaubhaft machen, dass durch die Abspaltung die Erfüllung ihrer Forderung gefährdet wird."
    },
    {
      "date": "2025-06-24",
      "id": "113224",
      "original_text": "Löschungsankündigung\nNordrhein-Westfalen Amtsgericht Bad Oeynhausen HRA 10104\nMedical Base Minden GmbH & Co. KG – Minden",
      "type": "Löschungsankündigung",
      "state": "Nordrhein-Westfalen",
      "amtsgericht": "Amtsgericht Bad Oeynhausen",
      "registernummer": "HRA 10104",
      "registerart": "HRA",
      "company_name": "Medical Base Minden GmbH & Co. KG",
      "company_seat": "Minden",
      "details": "24.06.2025 (Bekanntmachungsdatum)\n\nNordrhein-Westfalen Amtsgericht Bad Oeynhausen HRA 10104\nLöschungsankündigung\n\nMedical Base Minden GmbH & Co. KG\nKommanditgesellschaft\nMinden\n\nDas Registergericht beabsichtigt die Firma von Amts wegen nach §§ 6, 31 Abs. 2 HGB, § 393 FamFG zu löschen. Die Frist zur Erhebung eines Widerspruchs ist auf einen Monat festgesetzt."
    },
    {
      "date": "2025-06-24",
      "id": "113225",
      "original_text": "Registerbekanntmachung nach dem Umwandlungsgesetz\nNordrhein-Westfalen Amtsgericht Duisburg HRA 7173\nRhenus Port Logistics Services GmbH & Co. KG – Duisburg",
      "type": "Registerbekanntmachung nach dem Umwandlungsgesetz",
      "state": "Nordrhein-Westfalen",
      "amtsgericht": "Amtsgericht Duisburg",
      "registernummer": "HRA 7173",
      "registerart": "HRA",
      "company_name": "Rhenus Port Logistics Services GmbH & Co. KG",
      "company_seat": "Duisburg",
      "details": "24.06.2025 (Bekanntmachungsdatum)\n\nNordrhein-Westfalen Amtsgericht Duisburg HRA 7173\nRegisterbekanntmachung nach dem Umwandlungsgesetz 24.06.2025 (Eintragungsdatum)\n\nRhenus Port Logistics Services GmbH & Co. KG\nKommanditgesellschaft\nDuisburg\n\nDen Gläubigern der an der Verschmelzung beteiligten Rechtsträger ist, wenn sie binnen sechs Monaten nach dem Tag, an dem die Eintragung der Verschmelzung in das Register des Sitzes desjenigen Rechtsträgers, dessen Gläubiger sie sind, nach § 19 Absatz 3 UmwG als bekanntgemacht gilt, ihren Anspruch nach Grund und Höhe schriftlich anmelden, Sicherheit zu leisten, soweit sie nicht Befriedigung verlangen können. Dieses Recht steht den Gläubigern jedoch nur zu, wenn sie glaubhaft machen, dass durch die Verschmelzung die Erfüllung ihrer Forderung gefährdet wird."
    },
    {
      "date": "2025-06-24",
      "id": "113226",
      "original_text": "Registerbekanntmachung nach dem Umwandlungsgesetz\nNordrhein-Westfalen Amtsgericht Köln HRB 38260\nH.H. Voss GmbH – Wipperfürth",
      "type": "Registerbekanntmachung nach dem Umwandlungsgesetz",
      "state": "Nordrhein-Westfalen",
      "amtsgericht": "Amtsgericht Köln",
      "registernummer": "HRB 38260",
      "registerart": "HRB",
      "company_name": "H.H. Voss GmbH",
      "company_seat": "Wipperfürth",
      "details": "24.06.2025 (Bekanntmachungsdatum)\n\nNordrhein-Westfalen Amtsgericht Köln HRB 38260\nRegisterbekanntmachung nach dem Umwandlungsgesetz 24.06.2025 (Eintragungsdatum)\n\nH.H. Voss GmbH\nGesellschaft mit beschränkter Haftung\nWipperfürth\n\nDen Gläubigern der an der formwechselnden Umwandlung beteiligten Rechtsträger ist, wenn sie binnen sechs Monaten nach dem Tag, an dem die Eintragung der formwechselnden Umwandlung in das Register des Sitzes desjenigen Rechtsträgers, dessen Gläubiger sie sind, nach § 19 Absatz 3 UmwG als bekanntgemacht gilt, ihren Anspruch nach Grund und Höhe schriftlich anmelden, Sicherheit zu leisten, soweit sie nicht Befriedigung verlangen können. Dieses Recht steht den Gläubigern jedoch nur zu, wenn sie glaubhaft machen, dass durch die formwechselnden Umwandlung die Erfüllung ihrer Forderung gefährdet wird."
    },
    {
      "date": "2025-06-24",
      "id": "113227",
      "original_text": "Registerbekanntmachung nach dem Umwandlungsgesetz\nNordrhein-Westfalen Amtsgericht Dortmund VR 11186 früher Amtsgericht Castrop-Rauxel\nVictoria Habinghorst e. V. – Castrop-Rauxel",
      "type": "Registerbekanntmachung nach dem Umwandlungsgesetz",
      "state": "Nordrhein-Westfalen",
      "amtsgericht": "Amtsgericht Dortmund",
      "registernummer": "VR 11186",
      "registerart": "VR",
      "company_name": "Victoria Habinghorst e. V.",
      "company_seat": "Castrop-Rauxel",
      "former_amtsgericht": "Castrop-Rauxel",
      "details": "24.06.2025 (Bekanntmachungsdatum)\n\nNordrhein-Westfalen Amtsgericht Dortmund VR 11186 früher Amtsgericht Castrop-Rauxel\nRegisterbekanntmachung nach dem Umwandlungsgesetz 24.06.2025 (Eintragungsdatum)\n\nVictoria Habinghorst e. V.\neingetragener Verein\nCastrop-Rauxel\n\nDen Gläubigern der an der Verschmelzung beteiligten Rechtsträger ist, wenn sie binnen sechs Monaten nach dem Tag, an dem die Eintragung der Verschmelzung in das Register des Sitzes desjenigen Rechtsträgers, dessen Gläubiger sie sind, nach § 19 Absatz 3 UmwG als bekanntgemacht gilt, ihren Anspruch nach Grund und Höhe schriftlich anmelden, Sicherheit zu leisten, soweit sie nicht Befriedigung verlangen können. Dieses Recht steht den Gläubigern jedoch nur zu, wenn sie glaubhaft machen, dass durch die Verschmelzung die Erfüllung ihrer Forderung gefährdet wird."
    },
    {
      "date": "2025-06-24",
      "id": "113228",
      "original_text": "Löschungsankündigung\nThüringen Amtsgericht Jena HRB 507627\nEAS Germany GmbH – Nordhausen",
      "type": "Löschungsankündigung",
      "state": "Thüringen",
      "amtsgericht": "Amtsgericht Jena",
      "registernummer": "HRB 507627",
      "registerart": "HRB",
      "company_name": "EAS Germany GmbH",
      "company_seat": "Nordhausen",
      "details": "24.06.2025 (Bekanntmachungsdatum)\n\nThüringen Amtsgericht Jena HRB 507627\nLöschungsankündigung\n\nEAS Germany GmbH\nGesellschaft mit beschränkter Haftung\nNordhausen\n\nDas Registergericht beabsichtigt, die im Handelsregister eingetragene Gesellschaft wegen Vermögenslosigkeit nach § 394 FamFG von Amts wegen zu löschen. Die Frist zur Erhebung eines Widerspruchs gegen die beabsichtigte Löschung wird auf 6 Wochen festgesetzt."
    },
    {
      "date": "2025-06-24",
      "id": "113229",
      "original_text": "Einreichung neuer Dokumente\nHessen Amtsgericht Wiesbaden HRB 10344\nWITCOM Wiesbadener Informations- und Telekommunikationsgesellschaft mit beschränkter Haftung – Wiesbaden",
      "type": "Einreichung neuer Dokumente",
      "state": "Hessen",
      "amtsgericht": "Amtsgericht Wiesbaden",
      "registernummer": "HRB 10344",
      "registerart": "HRB",
      "company_name": "WITCOM Wiesbadener Informations- und Telekommunikationsgesellschaft mit beschränkter Haftung",
      "company_seat": "Wiesbaden",
      "details": "24.06.2025 (Bekanntmachungsdatum)\n\nHessen Amtsgericht Wiesbaden HRB 10344\nEinreichung neuer Dokumente 24.06.2025 (Eintragungsdatum)\n\nWITCOM Wiesbadener Informations- und Telekommunikationsgesellschaft mit beschränkter Haftung\nGesellschaft mit beschränkter Haftung\nWiesbaden\n\nDurch eine Änderung in den Personen der Aufsichtsratsmitglieder ist eine Liste der Mitglieder des Aufsichtsrates zum Handelsregister eingereicht worden."
    },
    {
      "date": "2025-06-24",
      "id": "113230",
      "original_text": "Löschungsankündigung\nHessen Amtsgericht Hanau HRB 5234\nbkb aktiengesellschaft für beratung und betreuung kommunaler und gewerblicher bauvorhaben – Bruchköbel",
      "type": "Löschungsankündigung",
      "state": "Hessen",
      "amtsgericht": "Amtsgericht Hanau",
      "registernummer": "HRB 5234",
      "registerart": "HRB",
      "company_name": "bkb aktiengesellschaft für beratung und betreuung kommunaler und gewerblicher bauvorhaben",
      "company_seat": "Bruchköbel",
      "details": "24.06.2025 (Bekanntmachungsdatum)\n\nHessen Amtsgericht Hanau HRB 5234\nLöschungsankündigung\n\nbkb aktiengesellschaft für beratung und betreuung kommunaler und gewerblicher bauvorhaben\nAktiengesellschaft\nBruchköbel\n\nDas Registergericht beabsichtigt die im Handelsregister eingetragene Gesellschaft von Amts wegen nach § 394 FamFG zu löschen. Die Frist zur Erhebung eines Widerspruchs gegen die beabsichtigte Löschung wird auf 3 Monate festgesetzt."
    },
    {
      "date": "2025-06-24",
      "id": "113231",
      "original_text": "Registerbekanntmachung nach dem Umwandlungsgesetz\nHessen Amtsgericht Frankfurt am Main HRA 54189\nCosmo Properties 5 (EST7) B.V. & Co. KG – Frankfurt am Main",
      "type": "Registerbekanntmachung nach dem Umwandlungsgesetz",
      "state": "Hessen",
      "amtsgericht": "Amtsgericht Frankfurt am Main",
      "registernummer": "HRA 54189",
      "registerart": "HRA",
      "company_name": "Cosmo Properties 5 (EST7) B.V. & Co. KG",
      "company_seat": "Frankfurt am Main",
      "details": "24.06.2025 (Bekanntmachungsdatum)\n\nHessen Amtsgericht Frankfurt am Main HRA 54189\nRegisterbekanntmachung nach dem Umwandlungsgesetz 24.06.2025 (Eintragungsdatum)\n\nCosmo Properties 5 (EST7) B.V. & Co. KG\nKommanditgesellschaft\nFrankfurt am Main\n\nDen Gläubigern der an der Ausgliederung beteiligten Rechtsträger ist, wenn sie binnen sechs Monaten nach dem Tag, an dem die Eintragung der Ausgliederung in das Register des Sitzes derjenigen Rechtsträger deren Gläubiger sie sind, nach §§ 125, 19 Absatz 3 UmwG bekannt gemacht worden ist, ihren Anspruch nach Grund und Höhe schriftlich anmelden, Sicherheit zu leisten, soweit sie nicht Befriedigung verlangen können. Dieses Recht steht den Gläubigern jedoch nur zu, wenn sie glaubhaft machen, dass durch die Ausgliederung die Erfüllung ihrer Forderung gefährdet wird."
    },
    {
      "date": "2025-06-24",
      "id": "113232",
      "original_text": "Löschungsankündigung\nHessen Amtsgericht Königstein HRB 108380 früher Amtsgericht Bad Homburg v.d.H.\nEL-REC GmbH Elektronik-Recycling – Weilrod",
      "type": "Löschungsankündigung",
      "state": "Hessen",
      "amtsgericht": "Amtsgericht Königstein",
      "registernummer": "HRB 108380",
      "registerart": "HRB",
      "company_name": "EL-REC GmbH Elektronik-Recycling",
      "company_seat": "Weilrod",
      "former_amtsgericht": "Bad Homburg v.d.H.",
      "details": "24.06.2025 (Bekanntmachungsdatum)\n\nHessen Amtsgericht Königstein HRB 108380 früher Amtsgericht Bad Homburg v.d.H.\nLöschungsankündigung\n\nEL-REC GmbH Elektronik-Recycling\nGesellschaft mit beschränkter Haftung\nWeilrod\n\nDas Registergericht beabsichtigt die im Handelsregister eingetragene Gesellschaft von Amts wegen nach § 394 FamFG zu löschen. Die Frist zur Erhebung eines Widerspruchs gegen die beabsichtigte Löschung wird auf 3 Monate festgesetzt."
    },
    {
      "date": "2025-06-24",
      "id": "113233",
      "original_text": "Registerbekanntmachung nach dem Umwandlungsgesetz\nHessen Amtsgericht Wiesbaden HRB 35710\nB&B Hotels Bochum GmbH – Hochheim am Main",
      "type": "Registerbekanntmachung nach dem Umwandlungsgesetz",
      "state": "Hessen",
      "amtsgericht": "Amtsgericht Wiesbaden",
      "registernummer": "HRB 35710",
      "registerart": "HRB",
      "company_name": "B&B Hotels Bochum GmbH",
      "company_seat": "Hochheim am Main",
      "details": "24.06.2025 (Bekanntmachungsdatum)\n\nHessen Amtsgericht Wiesbaden HRB 35710\nRegisterbekanntmachung nach dem Umwandlungsgesetz 24.06.2025 (Eintragungsdatum)\n\nB&B Hotels Bochum GmbH\nGesellschaft mit beschränkter Haftung\nHochheim am Main\n\nDen Gläubigern der an der Verschmelzung beteiligten Rechtsträger ist, wenn sie binnen sechs Monaten nach dem Tag, an dem die Eintragung der Verschmelzung in das Register des Sitzes desjenigen Rechtsträgers, dessen Gläubiger sie sind, nach § 19 Absatz 3 UmwG bekannt gemacht worden ist, ihren Anspruch nach Grund und Höhe schriftlich anmelden, Sicherheit zu leisten, soweit sie nicht Befriedigung verlangen können. Dieses Recht steht den Gläubigern jedoch nur zu, wenn sie glaubhaft machen, dass durch die Verschmelzung die Erfüllung ihrer Forderung gefährdet wird."
    },
    {
      "date": "2025-06-24",
      "id": "113234",
      "original_text": "Registerbekanntmachung nach dem Umwandlungsgesetz\nHessen Amtsgericht Frankfurt am Main HRA 54015\nJan Bertisch e.K. – Frankfurt am Main",
      "type": "Registerbekanntmachung nach dem Umwandlungsgesetz",
      "state": "Hessen",
      "amtsgericht": "Amtsgericht Frankfurt am Main",
      "registernummer": "HRA 54015",
      "registerart": "HRA",
      "company_name": "Jan Bertisch e.K.",
      "company_seat": "Frankfurt am Main",
      "details": "24.06.2025 (Bekanntmachungsdatum)\n\nHessen Amtsgericht Frankfurt am Main HRA 54015\nRegisterbekanntmachung nach dem Umwandlungsgesetz 24.06.2025 (Eintragungsdatum)\n\nJan Bertisch e.K.\nEinzelkaufmann / Einzelkauffrau\nFrankfurt am Main\n\nDen Gläubigern der an der Ausgliederung beteiligten Rechtsträger ist, wenn sie binnen sechs Monaten nach dem Tag, an dem die Eintragung der Ausgliederung in das Register des Sitzes desjenigen Rechtsträgers, dessen Gläubiger sie sind, nach §§ 125, 19 Absatz 3 UmwG bekannt gemacht worden ist, ihren Anspruch nach Grund und Höhe schriftlich anmelden, Sicherheit zu leisten, soweit sie nicht Befriedigung verlangen können. Dieses Recht steht den Gläubigern jedoch nur zu, wenn sie glaubhaft machen, dass durch die Ausgliederung die Erfüllung ihrer Forderung gefährdet wird."
    },
    {
      "date": "2025-06-24",
      "id": "113235",
      "original_text": "Löschungsankündigung\nHessen Amtsgericht Frankfurt am Main HRB 83753\nKwabo Extrusion GmbH – Hattersheim am Main",
      "type": "Löschungsankündigung",
      "state": "Hessen",
      "amtsgericht": "Amtsgericht Frankfurt am Main",
      "registernummer": "HRB 83753",
      "registerart": "HRB",
      "company_name": "Kwabo Extrusion GmbH",
      "company_seat": "Hattersheim am Main",
      "details": "24.06.2025 (Bekanntmachungsdatum)\n\nHessen Amtsgericht Frankfurt am Main HRB 83753\nLöschungsankündigung\n\nKwabo Extrusion GmbH\nGesellschaft mit beschränkter Haftung\nHattersheim am Main\n\nDas Registergericht beabsichtigt die im Handelsregister eingetragene Gesellschaft von Amts wegen nach § 394 FamFG zu löschen. Die Frist zur Erhebung eines Widerspruchs gegen die beabsichtigte Löschung wird auf 1 Monat festgesetzt."
    },
    {
      "date": "2025-06-24",
      "id": "113236",
      "original_text": "Registerbekanntmachung nach dem Umwandlungsgesetz\nHessen Amtsgericht Frankfurt am Main HRB 113813\nFraport Brasil Holding GmbH – Frankfurt am Main",
      "type": "Registerbekanntmachung nach dem Umwandlungsgesetz",
      "state": "Hessen",
      "amtsgericht": "Amtsgericht Frankfurt am Main",
      "registernummer": "HRB 113813",
      "registerart": "HRB",
      "company_name": "Fraport Brasil Holding GmbH",
      "company_seat": "Frankfurt am Main",
      "details": "24.06.2025 (Bekanntmachungsdatum)\n\nHessen Amtsgericht Frankfurt am Main HRB 113813\nRegisterbekanntmachung nach dem Umwandlungsgesetz 24.06.2025 (Eintragungsdatum)\n\nFraport Brasil Holding GmbH\nGesellschaft mit beschränkter Haftung\nFrankfurt am Main\n\nDen Gläubigern der an der Verschmelzung beteiligten Rechtsträger ist, wenn sie binnen sechs Monaten nach dem Tag, an dem die Eintragung der Verschmelzung in das Register des Sitzes desjenigen Rechtsträgers, dessen Gläubiger sie sind, nach § 19 Absatz 3 UmwG bekannt gemacht worden ist, ihren Anspruch nach Grund und Höhe schriftlich anmelden, Sicherheit zu leisten, soweit sie nicht Befriedigung verlangen können. Dieses Recht steht den Gläubigern jedoch nur zu, wenn sie glaubhaft machen, dass durch die Verschmelzung die Erfüllung ihrer Forderung gefährdet wird."
    },
    {
      "date": "2025-06-24",
      "id": "113237",
      "original_text": "Löschungsankündigung\nHessen Amtsgericht Offenbach am Main HRB 57549\nGF Global Fleischhandels GmbH – Dietzenbach",
      "type": "Löschungsankündigung",
      "state": "Hessen",
      "amtsgericht": "Amtsgericht Offenbach am Main",
      "registernummer": "HRB 57549",
      "registerart": "HRB",
      "company_name": "GF Global Fleischhandels GmbH",
      "company_seat": "Dietzenbach",
      "details": "24.06.2025 (Bekanntmachungsdatum)\n\nHessen Amtsgericht Offenbach am Main HRB 57549\nLöschungsankündigung\n\nGF Global Fleischhandels GmbH\nGesellschaft mit beschränkter Haftung\nDietzenbach\n\nDas Registergericht beabsichtigt, den Geschäftsführer Mehmet Zülfü Baydemir von Amts wegen im Handelsregister zu löschen nachdem seine Eignung gemäß § 6 Abs. 2 Ziffer 3 GmbHG aufgrund rechtskräftigen Urteil des Landgerichts Dresden nicht bestanden hat.\nWer an der Unterlassung der Löschung ein berechtigtes Interesse hat, kann innerhalb eines Montas ab Bekanntmachung Widerspruch beim Amtsgericht Offenbach am Main einlegen."
    },
    {
      "date": "2025-06-24",
      "id": "113238",
      "original_text": "Registerbekanntmachung nach dem Umwandlungsgesetz\nHessen Amtsgericht Frankfurt am Main HRB 137490\nFilmhafen GmbH – Frankfurt am Main",
      "type": "Registerbekanntmachung nach dem Umwandlungsgesetz",
      "state": "Hessen",
      "amtsgericht": "Amtsgericht Frankfurt am Main",
      "registernummer": "HRB 137490",
      "registerart": "HRB",
      "company_name": "Filmhafen GmbH",
      "company_seat": "Frankfurt am Main",
      "details": "24.06.2025 (Bekanntmachungsdatum)\n\nHessen Amtsgericht Frankfurt am Main HRB 137490\nRegisterbekanntmachung nach dem Umwandlungsgesetz 24.06.2025 (Eintragungsdatum)\n\nFilmhafen GmbH\nGesellschaft mit beschränkter Haftung\nFrankfurt am Main\n\nDen Gläubigern der an der Ausgliederung beteiligten Rechtsträger ist, wenn sie binnen sechs Monaten nach dem Tag, an dem die Eintragung der Ausgliederung in das Register des Sitzes desjenigen Rechtsträgers, dessen Gläubiger sie sind, nach §§ 125, 19 Absatz 3 UmwG bekannt gemacht worden ist, ihren Anspruch nach Grund und Höhe schriftlich anmelden, Sicherheit zu leisten, soweit sie nicht Befriedigung verlangen können. Dieses Recht steht den Gläubigern jedoch nur zu, wenn sie glaubhaft machen, dass durch die Ausgliederung die Erfüllung ihrer Forderung gefährdet wird."
    },
    {
      "date": "2025-06-24",
      "id": "113239",
      "original_text": "Registerbekanntmachung nach dem Umwandlungsgesetz\nHessen Amtsgericht Frankfurt am Main HRB 28469\nInvesco Asset Management Deutschland GmbH – Frankfurt am Main",
      "type": "Registerbekanntmachung nach dem Umwandlungsgesetz",
      "state": "Hessen",
      "amtsgericht": "Amtsgericht Frankfurt am Main",
      "registernummer": "HRB 28469",
      "registerart": "HRB",
      "company_name": "Invesco Asset Management Deutschland GmbH",
      "company_seat": "Frankfurt am Main",
      "details": "24.06.2025 (Bekanntmachungsdatum)\n\nHessen Amtsgericht Frankfurt am Main HRB 28469\nRegisterbekanntmachung nach dem Umwandlungsgesetz 24.06.2025 (Eintragungsdatum)\n\nInvesco Asset Management Deutschland GmbH\nGesellschaft mit beschränkter Haftung\nFrankfurt am Main\n\nDen Gläubigern der an der Verschmelzung beteiligten Rechtsträger ist, wenn sie binnen sechs Monaten nach dem Tag, an dem die Eintragung der Verschmelzung in das Register des Sitzes desjenigen Rechtsträgers, dessen Gläubiger sie sind, nach §§ 122a Absatz 2, 19 Absatz 3 UmwG bekannt gemacht worden ist, ihren Anspruch nach Grund und Höhe schriftlich anmelden, Sicherheit zu leisten, soweit sie nicht Befriedigung verlangen können. Dieses Recht steht den Gläubigern jedoch nur zu, wenn sie glaubhaft machen, dass durch die Verschmelzung die Erfüllung ihrer Forderung gefährdet wird."
    },
    {
      "date": "2025-06-24",
      "id": "113240",
      "original_text": "Einreichung neuer Dokumente\nHessen Amtsgericht Frankfurt am Main HRB 42452\ntraffiQ Lokale Nahverkehrsgesellschaft Frankfurt am Main mbH – Frankfurt am Main",
      "type": "Einreichung neuer Dokumente",
      "state": "Hessen",
      "amtsgericht": "Amtsgericht Frankfurt am Main",
      "registernummer": "HRB 42452",
      "registerart": "HRB",
      "company_name": "traffiQ Lokale Nahverkehrsgesellschaft Frankfurt am Main mbH",
      "company_seat": "Frankfurt am Main",
      "details": "24.06.2025 (Bekanntmachungsdatum)\n\nHessen Amtsgericht Frankfurt am Main HRB 42452\nEinreichung neuer Dokumente\n\ntraffiQ Lokale Nahverkehrsgesellschaft Frankfurt am Main mbH\nGesellschaft mit beschränkter Haftung\nFrankfurt am Main\n\nDurch eine Änderung in den Personen der Aufsichtsratsmitglieder ist eine Liste der Mitglieder des Aufsichtsrates zum Handelsregister eingereicht worden."
    },
    {
      "date": "2025-06-24",
      "id": "113241",
      "original_text": "Einreichung neuer Dokumente\nHessen Amtsgericht Hanau HRB 93093\nHanau Wirtschaftsförderung GmbH – Hanau",
      "type": "Einreichung neuer Dokumente",
      "state": "Hessen",
      "amtsgericht": "Amtsgericht Hanau",
      "registernummer": "HRB 93093",
      "registerart": "HRB",
      "company_name": "Hanau Wirtschaftsförderung GmbH",
      "company_seat": "Hanau",
      "details": "24.06.2025 (Bekanntmachungsdatum)\n\nHessen Amtsgericht Hanau HRB 93093\nEinreichung neuer Dokumente\n\nHanau Wirtschaftsförderung GmbH\nGesellschaft mit beschränkter Haftung\nHanau\n\nDurch eine Änderung in den Personen der Aufsichtsratsmitglieder ist eine Liste der Mitglieder des Aufsichtsrates zum Handelsregister eingereicht worden."
    },
    {
      "date": "2025-06-24",
      "id": "113242",
      "original_text": "Einreichung neuer Dokumente\nHessen Amtsgericht Darmstadt HRB 25198\nGSK Immobilien Entwicklung und Vermarktung Aktiengesellschaft – Bensheim",
      "type": "Einreichung neuer Dokumente",
      "state": "Hessen",
      "amtsgericht": "Amtsgericht Darmstadt",
      "registernummer": "HRB 25198",
      "registerart": "HRB",
      "company_name": "GSK Immobilien Entwicklung und Vermarktung Aktiengesellschaft",
      "company_seat": "Bensheim",
      "details": "24.06.2025 (Bekanntmachungsdatum)\n\nHessen Amtsgericht Darmstadt HRB 25198\nEinreichung neuer Dokumente\n\nGSK Immobilien Entwicklung und Vermarktung Aktiengesellschaft\nAktiengesellschaft\nBensheim\n\nDurch eine Änderung in den Personen der Aufsichtsratsmitglieder ist eine Liste der Mitglieder des Aufsichtsrates zum Handelsregister eingereicht worden."
    },
    {
      "date": "2025-06-24",
      "id": "113243",
      "original_text": "Löschungsankündigung\nHessen Amtsgericht Frankfurt am Main HRB 98734\nConesa Hoch & Ingenieurbau GmbH – Eschborn",
      "type": "Löschungsankündigung",
      "state": "Hessen",
      "amtsgericht": "Amtsgericht Frankfurt am Main",
      "registernummer": "HRB 98734",
      "registerart": "HRB",
      "company_name": "Conesa Hoch & Ingenieurbau GmbH",
      "company_seat": "Eschborn",
      "details": "24.06.2025 (Bekanntmachungsdatum)\n\nHessen Amtsgericht Frankfurt am Main HRB 98734\nLöschungsankündigung 24.06.2025 (Eintragungsdatum)\n\nConesa Hoch & Ingenieurbau GmbH\nGesellschaft mit beschränkter Haftung\nEschborn\n\nDas Registergericht beabsichtigt die im Handelsregister eingetragene Gesellschaft von Amts wegen nach § 394 FamFG zu löschen. Die Frist zur Erhebung eines Widerspruchs gegen die beabsichtigte Löschung wird auf1 Monat festgesetzt."
    },
    {
      "date": "2025-06-24",
      "id": "113244",
      "original_text": "Löschungsankündigung\nHessen Amtsgericht Fulda HRB 7068\nbauservice okay GmbH – Fulda",
      "type": "Löschungsankündigung",
      "state": "Hessen",
      "amtsgericht": "Amtsgericht Fulda",
      "registernummer": "HRB 7068",
      "registerart": "HRB",
      "company_name": "bauservice okay GmbH",
      "company_seat": "Fulda",
      "details": "24.06.2025 (Bekanntmachungsdatum)\n\nHessen Amtsgericht Fulda HRB 7068\nLöschungsankündigung 24.06.2025 (Eintragungsdatum)\n\nbauservice okay GmbH\nGesellschaft mit beschränkter Haftung\nFulda\n\nDas Registergericht beabsichtigt die im Handelsregister eingetragene Gesellschaft von Amts wegen nach § 394 FamFG zu löschen. Die Frist zur Erhebung eines Widerspruchs gegen die beabsichtigte Löschung wird auf 2 Monate festgesetzt."
    },
    {
      "date": "2025-06-24",
      "id": "113245",
      "original_text": "Löschungsankündigung\nHessen Amtsgericht Frankfurt am Main HRB 128385\nB & E Facility Solutions GmbH – Frankfurt am Main",
      "type": "Löschungsankündigung",
      "state": "Hessen",
      "amtsgericht": "Amtsgericht Frankfurt am Main",
      "registernummer": "HRB 128385",
      "registerart": "HRB",
      "company_name": "B & E Facility Solutions GmbH",
      "company_seat": "Frankfurt am Main",
      "details": "24.06.2025 (Bekanntmachungsdatum)\n\nHessen Amtsgericht Frankfurt am Main HRB 128385\nLöschungsankündigung\n\nB & E Facility Solutions GmbH\nGesellschaft mit beschränkter Haftung\nFrankfurt am Main\n\nes ist beabsichtigt,einen Teil des Unternehmensgegenstandes gemäß § 395 FamFG von Amts wegen im Handelsregister zu löschen, da die Erlaubnis gemäß § 49 Abs. 2 Nr. 3 HVwFfG entzogen wurde. Hiergegen kann innerhalb eines Monats nach dieser Veröffentlichung Widerspruch bei dem Amtsgericht Frankfurt am Main eingelegt werden."
    }
  ]
}