{
  "date": "2025-06-06",
  "date_of_scrape": "2025-06-13T08:28:04.574Z",
  "tool_version": "0.2.0",
  "number_of_announcements": 181,
  "announcements": [
    {
      "date": "2025-06-06",
      "id": "111417",
      "original_text": "Einreichung neuer Dokumente\nBayern Amtsgericht Augsburg HRB 81\nWashTec AG – Augsburg",
      "type": "Einreichung neuer Dokumente",
      "state": "Bayern",
      "amtsgericht": "Amtsgericht Augsburg",
      "registernummer": "HRB 81",
      "registerart": "HRB",
      "company_name": "WashTec AG",
      "company_seat": "Augsburg",
      "details": "06.06.2025 (Bekanntmachungsdatum)\n\nBayern Amtsgericht Augsburg HRB 81\nEinreichung neuer Dokumente 05.06.2025 (Eintragungsdatum)\n\nWashTec AG\nAktiengesellschaft\nAugsburg\n\nDem Amtsgericht Augsburg -Registergericht- ist eine Liste der Mitglieder des Aufsichtsrats eingereicht worden, § 106 AktG."
    },
    {
      "date": "2025-06-06",
      "id": "111418",
      "original_text": "Löschungsankündigung\nBayern Amtsgericht Würzburg HRB 15649\nNORINVER Germany GmbH – Würzburg",
      "type": "Löschungsankündigung",
      "state": "Bayern",
      "amtsgericht": "Amtsgericht Würzburg",
      "registernummer": "HRB 15649",
      "registerart": "HRB",
      "company_name": "NORINVER Germany GmbH",
      "company_seat": "Würzburg",
      "details": "06.06.2025 (Bekanntmachungsdatum)\n\nBayern Amtsgericht Würzburg HRB 15649\nLöschungsankündigung\n\nNORINVER Germany GmbH\nGesellschaft mit beschränkter Haftung\nWürzburg\n\nDas Registergericht beabsichtigt, die im Handelsregister eingetragene Gesellschaft wegen Vermögenslosigkeit von Amts wegen nach § 394 FamFG zu löschen. Die Frist zur Erhebung eines Widerspruchs ist auf drei Monate festgesetzt."
    },
    {
      "date": "2025-06-06",
      "id": "111419",
      "original_text": "Registerbekanntmachung nach dem Umwandlungsgesetz\nBayern Amtsgericht Kempten (Allgäu) HRA 11680\nJürgen Weiher e.K. – Oy-Mittelberg",
      "type": "Registerbekanntmachung nach dem Umwandlungsgesetz",
      "state": "Bayern",
      "amtsgericht": "Amtsgericht Kempten (Allgäu)",
      "registernummer": "HRA 11680",
      "registerart": "HRA",
      "company_name": "Jürgen Weiher e.K.",
      "company_seat": "Oy-Mittelberg",
      "details": "06.06.2025 (Bekanntmachungsdatum)\n\nBayern Amtsgericht Kempten (Allgäu) HRA 11680\nRegisterbekanntmachung nach dem Umwandlungsgesetz 05.06.2025 (Eintragungsdatum)\n\nJürgen Weiher e.K.\nEinzelkaufmann / Einzelkauffrau\nOy-Mittelberg\n\nDen Gläubigern der an der Ausgliederung beteiligten Rechtsträger ist, wenn sie binnen sechs Monaten nach dem Tag, an dem die Eintragung der Ausgliederung in das Register des Sitzes desjenigen Rechtsträgers, dessen Gläubiger sie sind, nach §§ 125, 19 Abs. 3 UmwG als bekannt gemacht gilt, ihren Anspruch nach Grund und Höhe in Textform anmelden, Sicherheit zu leisten, soweit sie nicht Befriedigung verlangen können. Dieses Recht steht den Gläubigern jedoch nur zu, wenn sie glaubhaft machen, dass durch die Ausgliederung die Erfüllung ihrer Forderung gefährdet wird."
    },
    {
      "date": "2025-06-06",
      "id": "111420",
      "original_text": "Registerbekanntmachung nach dem Umwandlungsgesetz\nBayern Amtsgericht Bayreuth VR 435\nVerein der Aquarienfreunde Pegnitz und Umgebung e.V. – Pegnitz",
      "type": "Registerbekanntmachung nach dem Umwandlungsgesetz",
      "state": "Bayern",
      "amtsgericht": "Amtsgericht Bayreuth",
      "registernummer": "VR 435",
      "registerart": "VR",
      "company_name": "Verein der Aquarienfreunde Pegnitz und Umgebung e.V.",
      "company_seat": "Pegnitz",
      "details": "06.06.2025 (Bekanntmachungsdatum)\n\nBayern Amtsgericht Bayreuth VR 435\nRegisterbekanntmachung nach dem Umwandlungsgesetz 05.06.2025 (Eintragungsdatum)\n\nVerein der Aquarienfreunde Pegnitz und Umgebung e.V.\neingetragener Verein\nPegnitz\n\nDen Gläubigern der an der Verschmelzung beteiligten Rechtsträger ist, wenn sie binnen sechs Monaten nach dem Tag, an dem die Eintragung der Verschmelzung in das Register des Sitzes desjenigen Rechtsträgers, dessen Gläubiger sie sind, nach § 19 Abs. 3 UmwG als bekannt gemacht gilt, ihren Anspruch nach Grund und Höhe in Textform anmelden, Sicherheit zu leisten, soweit sie nicht Befriedigung verlangen können. Dieses Recht steht den Gläubigern jedoch nur zu, wenn sie glaubhaft machen, dass durch die Verschmelzung die Erfüllung ihrer Forderung gefährdet wird."
    },
    {
      "date": "2025-06-06",
      "id": "111421",
      "original_text": "Registerbekanntmachung nach dem Umwandlungsgesetz\nBayern Amtsgericht Nürnberg HRB 28544\nMBO Wind GmbH – Sengenthal",
      "type": "Registerbekanntmachung nach dem Umwandlungsgesetz",
      "state": "Bayern",
      "amtsgericht": "Amtsgericht Nürnberg",
      "registernummer": "HRB 28544",
      "registerart": "HRB",
      "company_name": "MBO Wind GmbH",
      "company_seat": "Sengenthal",
      "details": "06.06.2025 (Bekanntmachungsdatum)\n\nBayern Amtsgericht Nürnberg HRB 28544\nRegisterbekanntmachung nach dem Umwandlungsgesetz 05.06.2025 (Eintragungsdatum)\n\nMBO Wind GmbH\nGesellschaft mit beschränkter Haftung\nSengenthal\n\nDen Gläubigern der an der Verschmelzung beteiligten Rechtsträger ist, wenn sie binnen sechs Monaten nach dem Tag, an dem die Eintragung der Verschmelzung in das Register des Sitzes desjenigen Rechtsträgers, dessen Gläubiger sie sind, nach § 19 Abs. 3 UmwG als bekannt gemacht gilt, ihren Anspruch nach Grund und Höhe in Textform anmelden, Sicherheit zu leisten, soweit sie nicht Befriedigung verlangen können. Dieses Recht steht den Gläubigern jedoch nur zu, wenn sie glaubhaft machen, dass durch die Verschmelzung die Erfüllung ihrer Forderung gefährdet wird."
    },
    {
      "date": "2025-06-06",
      "id": "111422",
      "original_text": "Registerbekanntmachung nach dem Umwandlungsgesetz\nBayern Amtsgericht Traunstein HRB 34007\nBeG Buddy GmbH – Mühldorf a. Inn",
      "type": "Registerbekanntmachung nach dem Umwandlungsgesetz",
      "state": "Bayern",
      "amtsgericht": "Amtsgericht Traunstein",
      "registernummer": "HRB 34007",
      "registerart": "HRB",
      "company_name": "BeG Buddy GmbH",
      "company_seat": "Mühldorf a. Inn",
      "details": "06.06.2025 (Bekanntmachungsdatum)\n\nBayern Amtsgericht Traunstein HRB 34007\nRegisterbekanntmachung nach dem Umwandlungsgesetz 05.06.2025 (Eintragungsdatum)\n\nBeG Buddy GmbH\nGesellschaft mit beschränkter Haftung\nMühldorf a. Inn\n\nDen Gläubigern der an der Verschmelzung beteiligten Rechtsträger ist, wenn sie binnen sechs Monaten nach dem Tag, an dem die Eintragung der Verschmelzung in das Register des Sitzes desjenigen Rechtsträgers, dessen Gläubiger sie sind, nach § 19 Abs. 3 UmwG als bekannt gemacht gilt, ihren Anspruch nach Grund und Höhe in Textform anmelden, Sicherheit zu leisten, soweit sie nicht Befriedigung verlangen können. Dieses Recht steht den Gläubigern jedoch nur zu, wenn sie glaubhaft machen, dass durch die Verschmelzung die Erfüllung ihrer Forderung gefährdet wird."
    },
    {
      "date": "2025-06-06",
      "id": "111423",
      "original_text": "Löschungsankündigung\nBayern Amtsgericht Nürnberg HRB 35047\nBETA-BAU.UG (haftungsbeschränkt) – Nürnberg",
      "type": "Löschungsankündigung",
      "state": "Bayern",
      "amtsgericht": "Amtsgericht Nürnberg",
      "registernummer": "HRB 35047",
      "registerart": "HRB",
      "company_name": "BETA-BAU.UG (haftungsbeschränkt)",
      "company_seat": "Nürnberg",
      "details": "06.06.2025 (Bekanntmachungsdatum)\n\nBayern Amtsgericht Nürnberg HRB 35047\nLöschungsankündigung\n\nBETA-BAU.UG (haftungsbeschränkt)\nGesellschaft mit beschränkter Haftung\nNürnberg\n\nDas Registergericht beabsichtigt, die im Handelsregister eingetragene Gesellschaft wegen Vermögenslosigkeit von Amts wegen nach § 394 FamFG zu löschen. Die Frist zur Erhebung eines Widerspruchs ist auf einen Monat festgesetzt."
    },
    {
      "date": "2025-06-06",
      "id": "111424",
      "original_text": "Registerbekanntmachung nach dem Umwandlungsgesetz\nBayern Amtsgericht Augsburg HRB 13201\nMEA Metal Applications GmbH – Aichach",
      "type": "Registerbekanntmachung nach dem Umwandlungsgesetz",
      "state": "Bayern",
      "amtsgericht": "Amtsgericht Augsburg",
      "registernummer": "HRB 13201",
      "registerart": "HRB",
      "company_name": "MEA Metal Applications GmbH",
      "company_seat": "Aichach",
      "details": "06.06.2025 (Bekanntmachungsdatum)\n\nBayern Amtsgericht Augsburg HRB 13201\nRegisterbekanntmachung nach dem Umwandlungsgesetz 05.06.2025 (Eintragungsdatum)\n\nMEA Metal Applications GmbH\nGesellschaft mit beschränkter Haftung\nAichach\n\nDen Gläubigern der an der Verschmelzung beteiligten Rechtsträger ist, wenn sie binnen sechs Monaten nach dem Tag, an dem die Eintragung der Verschmelzung in das Register des Sitzes desjenigen Rechtsträgers, dessen Gläubiger sie sind, nach § 19 Abs. 3 UmwG als bekannt gemacht gilt, ihren Anspruch nach Grund und Höhe in Textform anmelden, Sicherheit zu leisten, soweit sie nicht Befriedigung verlangen können. Dieses Recht steht den Gläubigern jedoch nur zu, wenn sie glaubhaft machen, dass durch die Verschmelzung die Erfüllung ihrer Forderung gefährdet wird."
    },
    {
      "date": "2025-06-06",
      "id": "111425",
      "original_text": "Registerbekanntmachung nach dem Umwandlungsgesetz\nBayern Amtsgericht Nürnberg HRB 19842\nMax Bögl Beteiligungs GmbH – Sengenthal",
      "type": "Registerbekanntmachung nach dem Umwandlungsgesetz",
      "state": "Bayern",
      "amtsgericht": "Amtsgericht Nürnberg",
      "registernummer": "HRB 19842",
      "registerart": "HRB",
      "company_name": "Max Bögl Beteiligungs GmbH",
      "company_seat": "Sengenthal",
      "details": "06.06.2025 (Bekanntmachungsdatum)\n\nBayern Amtsgericht Nürnberg HRB 19842\nRegisterbekanntmachung nach dem Umwandlungsgesetz 05.06.2025 (Eintragungsdatum)\n\nMax Bögl Beteiligungs GmbH\nGesellschaft mit beschränkter Haftung\nSengenthal\n\nDen Gläubigern der an der Verschmelzung beteiligten Rechtsträger ist, wenn sie binnen sechs Monaten nach dem Tag, an dem die Eintragung der Verschmelzung in das Register des Sitzes desjenigen Rechtsträgers, dessen Gläubiger sie sind, nach § 19 Abs. 3 UmwG als bekannt gemacht gilt, ihren Anspruch nach Grund und Höhe in Textform anmelden, Sicherheit zu leisten, soweit sie nicht Befriedigung verlangen können. Dieses Recht steht den Gläubigern jedoch nur zu, wenn sie glaubhaft machen, dass durch die Verschmelzung die Erfüllung ihrer Forderung gefährdet wird.Den Gläubigern der an der Verschmelzung beteiligten Rechtsträger ist, wenn sie binnen sechs Monaten nach dem Tag, an dem die Eintragung der Verschmelzung in das Register des Sitzes desjenigen Rechtsträgers, dessen Gläubiger sie sind, nach § 19 Abs. 3 UmwG als bekannt gemacht gilt, ihren Anspruch nach Grund und Höhe in Textform anmelden, Sicherheit zu leisten, soweit sie nicht Befriedigung verlangen können. Dieses Recht steht den Gläubigern jedoch nur zu, wenn sie glaubhaft machen, dass durch die Verschmelzung die Erfüllung ihrer Forderung gefährdet wird."
    },
    {
      "date": "2025-06-06",
      "id": "111426",
      "original_text": "Einreichung neuer Dokumente\nBayern Amtsgericht Ingolstadt HRB 10456\nBAUER Resources GmbH – Schrobenhausen",
      "type": "Einreichung neuer Dokumente",
      "state": "Bayern",
      "amtsgericht": "Amtsgericht Ingolstadt",
      "registernummer": "HRB 10456",
      "registerart": "HRB",
      "company_name": "BAUER Resources GmbH",
      "company_seat": "Schrobenhausen",
      "details": "06.06.2025 (Bekanntmachungsdatum)\n\nBayern Amtsgericht Ingolstadt HRB 10456\nEinreichung neuer Dokumente\n\nBAUER Resources GmbH\nGesellschaft mit beschränkter Haftung\nSchrobenhausen\n\nDem Amtsgericht Ingolstadt -Registergericht- ist eine Liste der Mitglieder des Aufsichtsrats eingereicht worden, § 52 Abs. 3 S. 2 GmbHG."
    },
    {
      "date": "2025-06-06",
      "id": "111427",
      "original_text": "Registerbekanntmachung nach dem Umwandlungsgesetz\nBayern Amtsgericht Kempten (Allgäu) HRB 18244\nIT-WEIHER GmbH – Oy-Mittelberg",
      "type": "Registerbekanntmachung nach dem Umwandlungsgesetz",
      "state": "Bayern",
      "amtsgericht": "Amtsgericht Kempten (Allgäu)",
      "registernummer": "HRB 18244",
      "registerart": "HRB",
      "company_name": "IT-WEIHER GmbH",
      "company_seat": "Oy-Mittelberg",
      "details": "06.06.2025 (Bekanntmachungsdatum)\n\nBayern Amtsgericht Kempten (Allgäu) HRB 18244\nRegisterbekanntmachung nach dem Umwandlungsgesetz 05.06.2025 (Eintragungsdatum)\n\nIT-WEIHER GmbH\nGesellschaft mit beschränkter Haftung\nOy-Mittelberg\n\nDen Gläubigern der an der Ausgliederung beteiligten Rechtsträger ist, wenn sie binnen sechs Monaten nach dem Tag, an dem die Eintragung der Ausgliederung in das Register des Sitzes desjenigen Rechtsträgers, dessen Gläubiger sie sind, nach §§ 125, 19 Abs. 3 UmwG als bekannt gemacht gilt, ihren Anspruch nach Grund und Höhe in Textform anmelden, Sicherheit zu leisten, soweit sie nicht Befriedigung verlangen können. Dieses Recht steht den Gläubigern jedoch nur zu, wenn sie glaubhaft machen, dass durch die Ausgliederung die Erfüllung ihrer Forderung gefährdet wird."
    },
    {
      "date": "2025-06-06",
      "id": "111428",
      "original_text": "Registerbekanntmachung nach dem Umwandlungsgesetz\nBayern Amtsgericht Memmingen HRA 14283\nUdo Bosch eK – Markt Rettenbach",
      "type": "Registerbekanntmachung nach dem Umwandlungsgesetz",
      "state": "Bayern",
      "amtsgericht": "Amtsgericht Memmingen",
      "registernummer": "HRA 14283",
      "registerart": "HRA",
      "company_name": "Udo Bosch eK",
      "company_seat": "Markt Rettenbach",
      "details": "06.06.2025 (Bekanntmachungsdatum)\n\nBayern Amtsgericht Memmingen HRA 14283\nRegisterbekanntmachung nach dem Umwandlungsgesetz 05.06.2025 (Eintragungsdatum)\n\nUdo Bosch eK\nEinzelkaufmann / Einzelkauffrau\nMarkt Rettenbach\n\nDen Gläubigern der an der Ausgliederung beteiligten Rechtsträger ist, wenn sie binnen sechs Monaten nach dem Tag, an dem die Eintragung der Ausgliederung in das Register des Sitzes desjenigen Rechtsträgers, dessen Gläubiger sie sind, nach §§ 125, 19 Abs. 3 UmwG als bekannt gemacht gilt, ihren Anspruch nach Grund und Höhe in Textform anmelden, Sicherheit zu leisten, soweit sie nicht Befriedigung verlangen können. Dieses Recht steht den Gläubigern jedoch nur zu, wenn sie glaubhaft machen, dass durch die Ausgliederung die Erfüllung ihrer Forderung gefährdet wird."
    },
    {
      "date": "2025-06-06",
      "id": "111429",
      "original_text": "Löschungsankündigung\nBayern Amtsgericht Würzburg HRA 6669\nde Goede shoes GmbH & Co. KG – Höchberg",
      "type": "Löschungsankündigung",
      "state": "Bayern",
      "amtsgericht": "Amtsgericht Würzburg",
      "registernummer": "HRA 6669",
      "registerart": "HRA",
      "company_name": "de Goede shoes GmbH & Co. KG",
      "company_seat": "Höchberg",
      "details": "06.06.2025 (Bekanntmachungsdatum)\n\nBayern Amtsgericht Würzburg HRA 6669\nLöschungsankündigung\n\nde Goede shoes GmbH & Co. KG\nKommanditgesellschaft\nHöchberg\n\nDas Registergericht beabsichtigt, die im Handelsregister eingetragene Firma von Amts wegen nach § 31 Abs. 2 HGB zu löschen. Die Frist zur Erhebung eines Widerspruchs ist auf einen Monat festgesetzt."
    },
    {
      "date": "2025-06-06",
      "id": "111430",
      "original_text": "Registerbekanntmachung nach dem Umwandlungsgesetz\nBayern Amtsgericht Augsburg HRB 39474\nEcoLar AG – Donauwörth",
      "type": "Registerbekanntmachung nach dem Umwandlungsgesetz",
      "state": "Bayern",
      "amtsgericht": "Amtsgericht Augsburg",
      "registernummer": "HRB 39474",
      "registerart": "HRB",
      "company_name": "EcoLar AG",
      "company_seat": "Donauwörth",
      "details": "06.06.2025 (Bekanntmachungsdatum)\n\nBayern Amtsgericht Augsburg HRB 39474\nRegisterbekanntmachung nach dem Umwandlungsgesetz 05.06.2025 (Eintragungsdatum)\n\nEcoLar AG\nAktiengesellschaft\nDonauwörth\n\nDen Gläubigern des formwechselnden Rechtsträgers ist, wenn sie binnen sechs Monaten nach dem Tag, an dem die Eintragung des Formwechsels nach § 201 UmwG als bekannt gemacht gilt, ihren Anspruch nach Grund und Höhe in Textform anmelden, Sicherheit zu leisten, soweit sie nicht Befriedigung verlangen können. Dieses Recht steht den Gläubigern jedoch nur zu, wenn sie glaubhaft machen, dass durch den Formwechsel die Erfüllung ihrer Forderung gefährdet wird."
    },
    {
      "date": "2025-06-06",
      "id": "111431",
      "original_text": "Registerbekanntmachung nach dem Umwandlungsgesetz\nBayern Amtsgericht Augsburg HRB 150\nL-S Verwaltungs GmbH – Augsburg",
      "type": "Registerbekanntmachung nach dem Umwandlungsgesetz",
      "state": "Bayern",
      "amtsgericht": "Amtsgericht Augsburg",
      "registernummer": "HRB 150",
      "registerart": "HRB",
      "company_name": "L-S Verwaltungs GmbH",
      "company_seat": "Augsburg",
      "details": "06.06.2025 (Bekanntmachungsdatum)\n\nBayern Amtsgericht Augsburg HRB 150\nRegisterbekanntmachung nach dem Umwandlungsgesetz 05.06.2025 (Eintragungsdatum)\n\nL-S Verwaltungs GmbH\nGesellschaft mit beschränkter Haftung\nAugsburg\n\nDen Gläubigern der an der Verschmelzung beteiligten Rechtsträger ist, wenn sie binnen sechs Monaten nach dem Tag, an dem die Eintragung der Verschmelzung in das Register des Sitzes desjenigen Rechtsträgers, dessen Gläubiger sie sind, nach § 19 Abs. 3 UmwG als bekannt gemacht gilt, ihren Anspruch nach Grund und Höhe in Textform anmelden, Sicherheit zu leisten, soweit sie nicht Befriedigung verlangen können. Dieses Recht steht den Gläubigern jedoch nur zu, wenn sie glaubhaft machen, dass durch die Verschmelzung die Erfüllung ihrer Forderung gefährdet wird."
    },
    {
      "date": "2025-06-06",
      "id": "111432",
      "original_text": "Registerbekanntmachung nach dem Umwandlungsgesetz\nBayern Amtsgericht Deggendorf HRB 5648\nDVV Immobilien GmbH – Deggendorf",
      "type": "Registerbekanntmachung nach dem Umwandlungsgesetz",
      "state": "Bayern",
      "amtsgericht": "Amtsgericht Deggendorf",
      "registernummer": "HRB 5648",
      "registerart": "HRB",
      "company_name": "DVV Immobilien GmbH",
      "company_seat": "Deggendorf",
      "details": "06.06.2025 (Bekanntmachungsdatum)\n\nBayern Amtsgericht Deggendorf HRB 5648\nRegisterbekanntmachung nach dem Umwandlungsgesetz 12.04.2025 (Eintragungsdatum)\n\nDVV Immobilien GmbH\nGesellschaft mit beschränkter Haftung\nDeggendorf\n\nDen Gläubigern der an der Verschmelzung beteiligten Rechtsträger ist, wenn sie binnen sechs Monaten nach dem Tag, an dem die Eintragung der Verschmelzung in das Register des Sitzes desjenigen Rechtsträgers, dessen Gläubiger sie sind, nach § 19 Abs. 3 UmwG als bekannt gemacht gilt, ihren Anspruch nach Grund und Höhe in Textform anmelden, Sicherheit zu leisten, soweit sie nicht Befriedigung verlangen können. Dieses Recht steht den Gläubigern jedoch nur zu, wenn sie glaubhaft machen, dass durch die Verschmelzung die Erfüllung ihrer Forderung gefährdet wird."
    },
    {
      "date": "2025-06-06",
      "id": "111433",
      "original_text": "Löschungsankündigung\nBayern Amtsgericht München HRB 259676\nFirst Runway UG (haftungsbeschränkt) – Starnberg",
      "type": "Löschungsankündigung",
      "state": "Bayern",
      "amtsgericht": "Amtsgericht München",
      "registernummer": "HRB 259676",
      "registerart": "HRB",
      "company_name": "First Runway UG (haftungsbeschränkt)",
      "company_seat": "Starnberg",
      "details": "06.06.2025 (Bekanntmachungsdatum)\n\nBayern Amtsgericht München HRB 259676\nLöschungsankündigung\n\nFirst Runway UG (haftungsbeschränkt)\nGesellschaft mit beschränkter Haftung\nStarnberg\n\nDas Registergericht beabsichtigt, die im Handelsregister eingetragene Gesellschaft wegen Vermögenslosigkeit von Amts wegen nach § 394 FamFG zu löschen. Die Frist zur Erhebung eines Widerspruchs ist auf drei Monate festgesetzt."
    },
    {
      "date": "2025-06-06",
      "id": "111434",
      "original_text": "Löschungsankündigung\nBayern Amtsgericht Bamberg HRB 8857\nFS Verwaltungs GmbH – Bamberg",
      "type": "Löschungsankündigung",
      "state": "Bayern",
      "amtsgericht": "Amtsgericht Bamberg",
      "registernummer": "HRB 8857",
      "registerart": "HRB",
      "company_name": "FS Verwaltungs GmbH",
      "company_seat": "Bamberg",
      "details": "06.06.2025 (Bekanntmachungsdatum)\n\nBayern Amtsgericht Bamberg HRB 8857\nLöschungsankündigung\n\nFS Verwaltungs GmbH\nGesellschaft mit beschränkter Haftung\nBamberg\n\nDas Registergericht beabsichtigt, die im Handelsregister eingetragene Gesellschaft wegen Vermögenslosigkeit von Amts wegen nach § 394 FamFG zu löschen. Die Frist zur Erhebung eines Widerspruchs ist auf einen Monat festgesetzt."
    },
    {
      "date": "2025-06-06",
      "id": "111435",
      "original_text": "Einreichung neuer Dokumente\nBayern Amtsgericht Fürth HRB 3868\nadidas AG – Herzogenaurach",
      "type": "Einreichung neuer Dokumente",
      "state": "Bayern",
      "amtsgericht": "Amtsgericht Fürth",
      "registernummer": "HRB 3868",
      "registerart": "HRB",
      "company_name": "adidas AG",
      "company_seat": "Herzogenaurach",
      "details": "06.06.2025 (Bekanntmachungsdatum)\n\nBayern Amtsgericht Fürth HRB 3868\nEinreichung neuer Dokumente 05.06.2025 (Eintragungsdatum)\n\nadidas AG\nAktiengesellschaft\nHerzogenaurach\n\nDem Amtsgericht Fürth -Registergericht- ist eine Liste der Mitglieder des Aufsichtsrats eingereicht worden, § 106 AktG."
    },
    {
      "date": "2025-06-06",
      "id": "111436",
      "original_text": "Löschungsankündigung\nBayern Amtsgericht Nürnberg HRB 20948\nH.L. Maschinenleasing GmbH – Nürnberg",
      "type": "Löschungsankündigung",
      "state": "Bayern",
      "amtsgericht": "Amtsgericht Nürnberg",
      "registernummer": "HRB 20948",
      "registerart": "HRB",
      "company_name": "H.L. Maschinenleasing GmbH",
      "company_seat": "Nürnberg",
      "details": "06.06.2025 (Bekanntmachungsdatum)\n\nBayern Amtsgericht Nürnberg HRB 20948\nLöschungsankündigung\n\nH.L. Maschinenleasing GmbH\nGesellschaft mit beschränkter Haftung\nNürnberg\n\nDas Registergericht beabsichtigt, die im Handelsregister eingetragene Gesellschaft wegen Vermögenslosigkeit von Amts wegen nach § 394 FamFG zu löschen. Die Frist zur Erhebung eines Widerspruchs ist auf einen Monat festgesetzt."
    },
    {
      "date": "2025-06-06",
      "id": "111437",
      "original_text": "Registerbekanntmachung nach dem Umwandlungsgesetz\nBayern Amtsgericht München HRB 160079\nRadio Media Süd GmbH – München",
      "type": "Registerbekanntmachung nach dem Umwandlungsgesetz",
      "state": "Bayern",
      "amtsgericht": "Amtsgericht München",
      "registernummer": "HRB 160079",
      "registerart": "HRB",
      "company_name": "Radio Media Süd GmbH",
      "company_seat": "München",
      "details": "06.06.2025 (Bekanntmachungsdatum)\n\nBayern Amtsgericht München HRB 160079\nRegisterbekanntmachung nach dem Umwandlungsgesetz 05.06.2025 (Eintragungsdatum)\n\nRadio Media Süd GmbH\nGesellschaft mit beschränkter Haftung\nMünchen\n\nDen Gläubigern der an der Verschmelzung beteiligten Rechtsträger ist, wenn sie binnen sechs Monaten nach dem Tag, an dem die Eintragung der Verschmelzung in das Register des Sitzes desjenigen Rechtsträgers, dessen Gläubiger sie sind, nach § 19 Abs. 3 UmwG als bekannt gemacht gilt, ihren Anspruch nach Grund und Höhe in Textform anmelden, Sicherheit zu leisten, soweit sie nicht Befriedigung verlangen können. Dieses Recht steht den Gläubigern jedoch nur zu, wenn sie glaubhaft machen, dass durch die Verschmelzung die Erfüllung ihrer Forderung gefährdet wird."
    },
    {
      "date": "2025-06-06",
      "id": "111438",
      "original_text": "Sonstige Registerbekanntmachung\nBayern Amtsgericht Aschaffenburg HRB 13112\nI.WE.C.A (Innovative WEiterbildungs-Consult Akademie) GmbH – Großwallstadt",
      "type": "Sonstige Registerbekanntmachung",
      "state": "Bayern",
      "amtsgericht": "Amtsgericht Aschaffenburg",
      "registernummer": "HRB 13112",
      "registerart": "HRB",
      "company_name": "I.WE.C.A (Innovative WEiterbildungs-Consult Akademie) GmbH",
      "company_seat": "Großwallstadt",
      "details": "06.06.2025 (Bekanntmachungsdatum)\n\nBayern Amtsgericht Aschaffenburg HRB 13112\nSonstige Registerbekanntmachung 05.06.2025 (Eintragungsdatum)\n\nI.WE.C.A (Innovative WEiterbildungs-Consult Akademie) GmbH\nGesellschaft mit beschränkter Haftung\nGroßwallstadt\n\nDen Gläubigern der Gesellschaft, deren Forderungen begründet worden sind, bevor die Eintragung der Beendigung des Gewinnabführungsvertrages in das Handelsregister nach § 10 des Handelsgesetzbuches als bekanntgemacht gilt, hat der andere Vertragsteil Sicherheit zu leisten, wenn sie sich binnen sechs Monaten nach der Bekanntmachung der Eintragung zu diesem Zweck bei ihm melden."
    },
    {
      "date": "2025-06-06",
      "id": "111439",
      "original_text": "Löschungsankündigung\nBayern Amtsgericht Bayreuth VR 10369\nFörderverein des TSV Melkendorf e. V. – Kulmbach",
      "type": "Löschungsankündigung",
      "state": "Bayern",
      "amtsgericht": "Amtsgericht Bayreuth",
      "registernummer": "VR 10369",
      "registerart": "VR",
      "company_name": "Förderverein des TSV Melkendorf e. V.",
      "company_seat": "Kulmbach",
      "details": "06.06.2025 (Bekanntmachungsdatum)\n\nBayern Amtsgericht Bayreuth VR 10369\nLöschungsankündigung\n\nFörderverein des TSV Melkendorf e. V.\neingetragener Verein\nKulmbach\n\nDas Registergericht beabsichtigt, den im Vereinsregister eingetragenen Verein von Amts wegen nach § 395 FamFG wegen Wegfalls aller Mitglieder zu löschen. Die Frist zur Erhebung eines Widerspruchs ist auf sechs Wochen festgesetzt."
    },
    {
      "date": "2025-06-06",
      "id": "111440",
      "original_text": "Löschungsankündigung\nBayern Amtsgericht München HRB 281555\nLazarus Handel UG (haftungsbeschränkt) – München",
      "type": "Löschungsankündigung",
      "state": "Bayern",
      "amtsgericht": "Amtsgericht München",
      "registernummer": "HRB 281555",
      "registerart": "HRB",
      "company_name": "Lazarus Handel UG (haftungsbeschränkt)",
      "company_seat": "München",
      "details": "06.06.2025 (Bekanntmachungsdatum)\n\nBayern Amtsgericht München HRB 281555\nLöschungsankündigung 05.06.2025 (Eintragungsdatum)\n\nLazarus Handel UG (haftungsbeschränkt)\nGesellschaft mit beschränkter Haftung\nMünchen\n\nDas Registergericht beabsichtigt, die im Handelsregister eingetragene Gesellschaft wegen Vermögenslosigkeit von Amts wegen nach § 394 FamFG zu löschen. Die Frist zur Erhebung eines Widerspruchs ist auf drei Monate festgesetzt."
    },
    {
      "date": "2025-06-06",
      "id": "111441",
      "original_text": "Registerbekanntmachung nach dem Umwandlungsgesetz\nBayern Amtsgericht München HRB 198465\nTerra Canis Grundstücksverwaltungs GmbH – Petershausen",
      "type": "Registerbekanntmachung nach dem Umwandlungsgesetz",
      "state": "Bayern",
      "amtsgericht": "Amtsgericht München",
      "registernummer": "HRB 198465",
      "registerart": "HRB",
      "company_name": "Terra Canis Grundstücksverwaltungs GmbH",
      "company_seat": "Petershausen",
      "details": "06.06.2025 (Bekanntmachungsdatum)\n\nBayern Amtsgericht München HRB 198465\nRegisterbekanntmachung nach dem Umwandlungsgesetz 05.06.2025 (Eintragungsdatum)\n\nTerra Canis Grundstücksverwaltungs GmbH\nGesellschaft mit beschränkter Haftung\nPetershausen\n\nDen Gläubigern der an der Verschmelzung beteiligten Rechtsträger ist, wenn sie binnen sechs Monaten nach dem Tag, an dem die Eintragung der Verschmelzung in das Register des Sitzes desjenigen Rechtsträgers, dessen Gläubiger sie sind, nach § 19 Abs. 3 UmwG als bekannt gemacht gilt, ihren Anspruch nach Grund und Höhe in Textform anmelden, Sicherheit zu leisten, soweit sie nicht Befriedigung verlangen können. Dieses Recht steht den Gläubigern jedoch nur zu, wenn sie glaubhaft machen, dass durch die Verschmelzung die Erfüllung ihrer Forderung gefährdet wird."
    },
    {
      "date": "2025-06-06",
      "id": "111442",
      "original_text": "Registerbekanntmachung nach dem Umwandlungsgesetz\nBayern Amtsgericht Deggendorf HRB 5247\nDVV Beteiligungen GmbH – Deggendorf",
      "type": "Registerbekanntmachung nach dem Umwandlungsgesetz",
      "state": "Bayern",
      "amtsgericht": "Amtsgericht Deggendorf",
      "registernummer": "HRB 5247",
      "registerart": "HRB",
      "company_name": "DVV Beteiligungen GmbH",
      "company_seat": "Deggendorf",
      "details": "06.06.2025 (Bekanntmachungsdatum)\n\nBayern Amtsgericht Deggendorf HRB 5247\nRegisterbekanntmachung nach dem Umwandlungsgesetz 12.04.2025 (Eintragungsdatum)\n\nDVV Beteiligungen GmbH\nGesellschaft mit beschränkter Haftung\nDeggendorf\n\nDen Gläubigern der an der Verschmelzung beteiligten Rechtsträger ist, wenn sie binnen sechs Monaten nach dem Tag, an dem die Eintragung der Verschmelzung in das Register des Sitzes desjenigen Rechtsträgers, dessen Gläubiger sie sind, nach § 19 Abs. 3 UmwG als bekannt gemacht gilt, ihren Anspruch nach Grund und Höhe in Textform anmelden, Sicherheit zu leisten, soweit sie nicht Befriedigung verlangen können. Dieses Recht steht den Gläubigern jedoch nur zu, wenn sie glaubhaft machen, dass durch die Verschmelzung die Erfüllung ihrer Forderung gefährdet wird."
    },
    {
      "date": "2025-06-06",
      "id": "111443",
      "original_text": "Sonstige Registerbekanntmachung\nBayern Amtsgericht München HRB 173995\nPartnerFonds AG – Planegg",
      "type": "Sonstige Registerbekanntmachung",
      "state": "Bayern",
      "amtsgericht": "Amtsgericht München",
      "registernummer": "HRB 173995",
      "registerart": "HRB",
      "company_name": "PartnerFonds AG",
      "company_seat": "Planegg",
      "details": "06.06.2025 (Bekanntmachungsdatum)\n\nBayern Amtsgericht München HRB 173995\nSonstige Registerbekanntmachung 05.06.2025 (Eintragungsdatum)\n\nPartnerFonds AG\nAktiengesellschaft\nPlanegg\n\nDen Gläubigern der Gesellschaft, deren Forderungen begründet worden sind, bevor die Eintragung des Beschlusses bekanntgemacht worden ist, ist, wenn sie sich binnen sechs Monaten nach der Bekanntmachung zu diesem Zweck melden, Sicherheit zu leisten, soweit sie nicht Befriedigung verlangen können. Das Recht, Sicherheitsleistung zu verlangen, steht Gläubigern nicht zu, die im Fall des Insolvenzverfahrens ein Recht auf vorzugsweise Befriedigung aus einer Deckungsmasse haben, die nach gesetzlicher Vorschrift zu ihrem Schutz errichtet und staatlich überwacht ist."
    },
    {
      "date": "2025-06-06",
      "id": "111444",
      "original_text": "Registerbekanntmachung nach dem Umwandlungsgesetz\nBayern Amtsgericht München HRB 289040\nAccelerate Bidco GmbH – München",
      "type": "Registerbekanntmachung nach dem Umwandlungsgesetz",
      "state": "Bayern",
      "amtsgericht": "Amtsgericht München",
      "registernummer": "HRB 289040",
      "registerart": "HRB",
      "company_name": "Accelerate Bidco GmbH",
      "company_seat": "München",
      "details": "06.06.2025 (Bekanntmachungsdatum)\n\nBayern Amtsgericht München HRB 289040\nRegisterbekanntmachung nach dem Umwandlungsgesetz\n\nAccelerate Bidco GmbH\nGesellschaft mit beschränkter Haftung\nMünchen\n\nEs wird darauf hingewiesen, dass ein Verschmelzungsplan oder sein Entwurf über eine grenzüberschreitende Verschmelzung zur Aufnahme mit der Accelerate Holdco S.á r.l. mit Sitz in Luxemburg/Luxemburg (Registre de commerce et des sociétés de Luxembourg B279083) (société à responsabilité limitée - Gesellschaft mit beschränkter Haftung  nach luxemburgischem Recht) Accelerate Bidco  GmbH mit Sitz in München/Bundesrepublik Deutschland (Amtsgericht München HRB 289040) (Gesellschaft mit beschränkter Haftung) beim Handelsregister eingereicht worden ist.\nDie Anteilsinhaber, die Gläubiger sowie die zuständigen Betriebsräte der an der grenzüberschreitenden Verschmelzung beteiligten Gesellschaften oder, soweit es keinen Betriebsrat gibt, die Arbeitnehmer der an der grenzüberschreitenden Verschmelzung beteiligten Gesellschaften, können der jeweiligen Gesellschaft spätestens fünf Arbeitstage vor dem Tag der Gesellschafterversammlung Bemerkungen zum Verschmelzungsplan übermitteln."
    },
    {
      "date": "2025-06-06",
      "id": "111445",
      "original_text": "Registerbekanntmachung nach dem Umwandlungsgesetz\nBayern Amtsgericht München HRB 297907\nSnke Holding SE – München",
      "type": "Registerbekanntmachung nach dem Umwandlungsgesetz",
      "state": "Bayern",
      "amtsgericht": "Amtsgericht München",
      "registernummer": "HRB 297907",
      "registerart": "HRB",
      "company_name": "Snke Holding SE",
      "company_seat": "München",
      "details": "06.06.2025 (Bekanntmachungsdatum)\n\nBayern Amtsgericht München HRB 297907\nRegisterbekanntmachung nach dem Umwandlungsgesetz 05.06.2025 (Eintragungsdatum)\n\nSnke Holding SE\nEuropäische Aktiengesellschaft (SE)\nMünchen\n\nDen Gläubigern der an der Spaltung beteiligten Rechtsträger ist, wenn sie binnen sechs Monaten nach dem Tag, an dem die Eintragung der Spaltung in das Register des Sitzes desjenigen Rechtsträgers, dessen Gläubiger sie sind, nach §§ 125, 19 Abs. 3 UmwG als bekannt gemacht gilt, ihren Anspruch nach Grund und Höhe in Textform anmelden, Sicherheit zu leisten, soweit sie nicht Befriedigung verlangen können. Dieses Recht steht den Gläubigern jedoch nur zu, wenn sie glaubhaft machen, dass durch die Spaltung die Erfüllung ihrer Forderung gefährdet wird."
    },
    {
      "date": "2025-06-06",
      "id": "111446",
      "original_text": "Registerbekanntmachung nach dem Umwandlungsgesetz\nBerlin Amtsgericht Berlin (Charlottenburg) HRB 38874\nBeta Systems Software Aktiengesellschaft – Berlin",
      "type": "Registerbekanntmachung nach dem Umwandlungsgesetz",
      "state": "Berlin",
      "amtsgericht": "Amtsgericht Berlin (Charlottenburg)",
      "registernummer": "HRB 38874",
      "registerart": "HRB",
      "company_name": "Beta Systems Software Aktiengesellschaft",
      "company_seat": "Berlin",
      "details": "06.06.2025 (Bekanntmachungsdatum)\n\nBerlin Amtsgericht Berlin (Charlottenburg) HRB 38874\nRegisterbekanntmachung nach dem Umwandlungsgesetz 05.06.2025 (Eintragungsdatum)\n\nBeta Systems Software Aktiengesellschaft\nAktiengesellschaft\nBerlin\n\nZu Eintragungsnummer 73 vom 05.06.2025 wird als nicht eingetragen veröffentlicht: Den Gläubigern der an der Verschmelzung beteiligten Rechtsträger ist, wenn sie binnen sechs Monaten nach dem Tag, an dem die Eintragung der Verschmelzung in das Register des Sitzes desjenigen Rechtsträgers, dessen Gläubiger sie sind, als bekannt gemacht gilt, ihren Anspruch nach Grund und Höhe schriftlich anmelden, Sicherheit zu leisten, soweit sie nicht Befriedigung verlangen können. Dieses Recht steht den Gläubigern jedoch nur zu, wenn sie glaubhaft machen, dass durch die Verschmelzung die Erfüllung ihrer Forderung gefährdet wird. Das Recht, Sicherheitsleistung zu verlangen, steht Gläubigern nicht zu, die im Falle der Insolvenz ein Recht auf vorzugsweise Befriedigung aus einer Deckungsmasse haben, die nach gesetzlicher Vorschrift zu ihrem Schutz errichtet und staatlich überwacht ist."
    },
    {
      "date": "2025-06-06",
      "id": "111447",
      "original_text": "Registerbekanntmachung nach dem Umwandlungsgesetz\nMecklenburg-Vorpommern Amtsgericht Rostock HRB 3914\nVerlag für Telekommunikation Nord GmbH – Rostock",
      "type": "Registerbekanntmachung nach dem Umwandlungsgesetz",
      "state": "Mecklenburg-Vorpommern",
      "amtsgericht": "Amtsgericht Rostock",
      "registernummer": "HRB 3914",
      "registerart": "HRB",
      "company_name": "Verlag für Telekommunikation Nord GmbH",
      "company_seat": "Rostock",
      "details": "06.06.2025 (Bekanntmachungsdatum)\n\nMecklenburg-Vorpommern Amtsgericht Rostock HRB 3914\nRegisterbekanntmachung nach dem Umwandlungsgesetz 05.06.2025 (Eintragungsdatum)\n\nVerlag für Telekommunikation Nord GmbH\nGesellschaft mit beschränkter Haftung\nRostock\n\nAls nicht eingetragen wird veröffentlicht: Den Gläubigern der an der Verschmelzung beteiligten Rechtsträger ist, wenn sie binnen sechs Monaten nach dem Tag, an dem die Eintragung der Verschmelzung in das Register des Sitzes desjenigen Rechtsträgers, dessen Gläubiger sie sind, nach § 19 Abs. 3 UmwG als bekannt gemacht gilt,\nihren Anspruch nach Grund und Höhe in Textform anmelden, Sicherheit zu leisten, soweit sie nicht Befriedigung verlangen können. Dieses Recht steht den Gläubigern jedoch nur zu, wenn sie glaubhaft machen, dass durch die Verschmelzung die Erfüllung der Forderung gefährdet wird."
    },
    {
      "date": "2025-06-06",
      "id": "111448",
      "original_text": "Registerbekanntmachung nach dem Umwandlungsgesetz\nMecklenburg-Vorpommern Amtsgericht Rostock HRB 14167\nTelefonbuch-Verlag Neubrandenburg Gesellschaft mit beschränkter Haftung – Rostock",
      "type": "Registerbekanntmachung nach dem Umwandlungsgesetz",
      "state": "Mecklenburg-Vorpommern",
      "amtsgericht": "Amtsgericht Rostock",
      "registernummer": "HRB 14167",
      "registerart": "HRB",
      "company_name": "Telefonbuch-Verlag Neubrandenburg Gesellschaft mit beschränkter Haftung",
      "company_seat": "Rostock",
      "details": "06.06.2025 (Bekanntmachungsdatum)\n\nMecklenburg-Vorpommern Amtsgericht Rostock HRB 14167\nRegisterbekanntmachung nach dem Umwandlungsgesetz 05.06.2025 (Eintragungsdatum)\n\nTelefonbuch-Verlag Neubrandenburg Gesellschaft mit beschränkter Haftung\nGesellschaft mit beschränkter Haftung\nRostock\n\nAls nicht eingetragen wird veröffentlicht: Den Gläubigern der an der Verschmelzung beteiligten Rechtsträger ist, wenn sie binnen sechs Monaten nach dem Tag, an dem die Eintragung der Verschmelzung in das Register des Sitzes desjenigen Rechtsträgers, dessen Gläubiger sie sind, nach § 19 Abs. 3 UmwG als bekannt gemacht gilt,\nihren Anspruch nach Grund und Höhe in Textform anmelden, Sicherheit zu leisten, soweit sie nicht Befriedigung verlangen können. Dieses Recht steht den Gläubigern jedoch nur zu, wenn sie glaubhaft machen, dass durch die Verschmelzung die Erfüllung der Forderung gefährdet wird."
    },
    {
      "date": "2025-06-06",
      "id": "111449",
      "original_text": "Löschungsankündigung\nSaarland Amtsgericht Saarbrücken HRB 9747\nI M G - Immobiliengesellschaft mit beschränkter Haftung – Saarbrücken",
      "type": "Löschungsankündigung",
      "state": "Saarland",
      "amtsgericht": "Amtsgericht Saarbrücken",
      "registernummer": "HRB 9747",
      "registerart": "HRB",
      "company_name": "I M G - Immobiliengesellschaft mit beschränkter Haftung",
      "company_seat": "Saarbrücken",
      "details": "06.06.2025 (Bekanntmachungsdatum)\n\nSaarland Amtsgericht Saarbrücken HRB 9747\nLöschungsankündigung\n\nI M G - Immobiliengesellschaft mit beschränkter Haftung\nGesellschaft mit beschränkter Haftung\nSaarbrücken\n\nEs ist beabsichtigt, die Gesellschaft von Amts wegen gemäß § 394 FamFG wegen Vermögenslosigkeit zu löschen.\nGegen die Löschung von Amts wegen ist das Rechtsmittel des Widerspruchs statthaft. Der Widerspruch ist binnen einer Frist zwei Monaten beginnend mit dem Tag dieser Veröffentlichung durch Einreichen eines Widerspruchsschreibens -schriftlich oder zur Niederschrift der Geschäftsstelle beim Amtsgericht Saarbrücken, -zentrales Handelsregister-, Mainzerstr.178, 66121 Saarbrücken einzulegen.\nDer Widerspruch muss die Bezeichnung der angefochtenen Löschungsankündigung enthalten sowie die Erklärung, dass Widerspruch eingelegt wird. Er ist vom Widerspruchsführer oder seinem Bevollmächtigten zu unterzeichnen.\nDas Widerspruchsschreiben kann auch in der Form eines elektronischen Dokumentes eingereicht werden, das mit einer qualifizierten elektronischen Signatur nach dem Signaturgesetz versehen sein muss (§§ 14 Abs. 2 FamFG, 130a, 298 ZPO)."
    },
    {
      "date": "2025-06-06",
      "id": "111450",
      "original_text": "Einreichung neuer Dokumente\nSaarland Amtsgericht Saarbrücken HRB 16045\nDN Nephrologie-Service GmbH – Neunkirchen",
      "type": "Einreichung neuer Dokumente",
      "state": "Saarland",
      "amtsgericht": "Amtsgericht Saarbrücken",
      "registernummer": "HRB 16045",
      "registerart": "HRB",
      "company_name": "DN Nephrologie-Service GmbH",
      "company_seat": "Neunkirchen",
      "details": "06.06.2025 (Bekanntmachungsdatum)\n\nSaarland Amtsgericht Saarbrücken HRB 16045\nEinreichung neuer Dokumente\n\nDN Nephrologie-Service GmbH\nGesellschaft mit beschränkter Haftung\nNeunkirchen\n\nDie Geschäftsführung der Gesellschaft hat eine Liste der Mitglieder des Aufsichtsrats zum Handelsregister eingereicht (§ 52 Abs. 3 Satz 2 GmbHG)."
    },
    {
      "date": "2025-06-06",
      "id": "111451",
      "original_text": "Registerbekanntmachung nach dem Umwandlungsgesetz\nBaden-Württemberg Amtsgericht Ulm HRB 726649\nBESSERSO GmbH – Ostrach",
      "type": "Registerbekanntmachung nach dem Umwandlungsgesetz",
      "state": "Baden-Württemberg",
      "amtsgericht": "Amtsgericht Ulm",
      "registernummer": "HRB 726649",
      "registerart": "HRB",
      "company_name": "BESSERSO GmbH",
      "company_seat": "Ostrach",
      "details": "06.06.2025 (Bekanntmachungsdatum)\n\nBaden-Württemberg Amtsgericht Ulm HRB 726649\nRegisterbekanntmachung nach dem Umwandlungsgesetz 06.06.2025 (Eintragungsdatum)\n\nBESSERSO GmbH\nGesellschaft mit beschränkter Haftung\nOstrach\n\nAls nicht eingetragen wird bekanntgemacht:\nDen Gläubigern der an der Verschmelzung beteiligten Rechtsträger ist, wenn sie binnen sechs Monaten nach dem Tag, an dem die Eintragung der Verschmelzung in das Register des Sitzes desjenigen Rechtsträgers, dessen Gläubiger sie sind, nach § 19 Abs. 3 UmwG als bekanntgemacht gilt, ihren Anspruch nach Grund und Höhe schriftlich anmelden, Sicherheit zu leisten, soweit sie nicht Befriedigung verlangen können. Dieses Recht steht den Gläubigern jedoch nur zu, wenn sie glaubhaft machen, dass durch die Verschmelzung die Erfüllung ihrer Forderung gefährdet wird."
    },
    {
      "date": "2025-06-06",
      "id": "111452",
      "original_text": "Löschungsankündigung\nSchleswig-Holstein Amtsgericht Lübeck HRB 23057\nHenry Invest GmbH – Wentorf bei Hamburg",
      "type": "Löschungsankündigung",
      "state": "Schleswig-Holstein",
      "amtsgericht": "Amtsgericht Lübeck",
      "registernummer": "HRB 23057",
      "registerart": "HRB",
      "company_name": "Henry Invest GmbH",
      "company_seat": "Wentorf bei Hamburg",
      "details": "06.06.2025 (Bekanntmachungsdatum)\n\nSchleswig-Holstein Amtsgericht Lübeck HRB 23057\nLöschungsankündigung\n\nHenry Invest GmbH\nGesellschaft mit beschränkter Haftung\nWentorf bei Hamburg\n\nEs ist die Löschung der nachstehenden Gesellschaft wegen Vermögenslosigkeit gemäß § 394 FamFG beabsichtigt."
    },
    {
      "date": "2025-06-06",
      "id": "111453",
      "original_text": "Sonstige Registerbekanntmachung\nBaden-Württemberg Amtsgericht Ulm HRB 728059\nVARTA AKTIENGESELLSCHAFT – Ellwangen Jagst",
      "type": "Sonstige Registerbekanntmachung",
      "state": "Baden-Württemberg",
      "amtsgericht": "Amtsgericht Ulm",
      "registernummer": "HRB 728059",
      "registerart": "HRB",
      "company_name": "VARTA AKTIENGESELLSCHAFT",
      "company_seat": "Ellwangen Jagst",
      "details": "06.06.2025 (Bekanntmachungsdatum)\n\nBaden-Württemberg Amtsgericht Ulm HRB 728059\nSonstige Registerbekanntmachung\n\nVARTA AKTIENGESELLSCHAFT\nAktiengesellschaft\nEllwangen Jagst\n\nDie Gesellschaft hat am 05.06.2025 die Liste über die Zusammensetzung des Aufsichtsrats zum Handelsregister eingereicht."
    },
    {
      "date": "2025-06-06",
      "id": "111454",
      "original_text": "Registerbekanntmachung nach dem Umwandlungsgesetz\nBaden-Württemberg Amtsgericht Ulm HRB 729766\nTalis Management Holding GmbH – Heidenheim an der Brenz",
      "type": "Registerbekanntmachung nach dem Umwandlungsgesetz",
      "state": "Baden-Württemberg",
      "amtsgericht": "Amtsgericht Ulm",
      "registernummer": "HRB 729766",
      "registerart": "HRB",
      "company_name": "Talis Management Holding GmbH",
      "company_seat": "Heidenheim an der Brenz",
      "details": "06.06.2025 (Bekanntmachungsdatum)\n\nBaden-Württemberg Amtsgericht Ulm HRB 729766\nRegisterbekanntmachung nach dem Umwandlungsgesetz 06.06.2025 (Eintragungsdatum)\n\nTalis Management Holding GmbH\nGesellschaft mit beschränkter Haftung\nHeidenheim an der Brenz\n\nAls nicht eingetragen wird bekanntgemacht:\nDen Gläubigern der an der Verschmelzung beteiligten Rechtsträger ist, wenn sie binnen sechs Monaten nach dem Tag, an dem die Eintragung der Verschmelzung in das Register des Sitzes desjenigen Rechtsträgers, dessen Gläubiger sie sind, nach § 19 Abs. 3 UmwG als bekanntgemacht gilt, ihren Anspruch nach Grund und Höhe schriftlich anmelden, Sicherheit zu leisten, soweit sie nicht Befriedigung verlangen können. Dieses Recht steht den Gläubigern jedoch nur zu, wenn sie glaubhaft machen, dass durch die Verschmelzung die Erfüllung ihrer Forderung gefährdet wird."
    },
    {
      "date": "2025-06-06",
      "id": "111455",
      "original_text": "Registerbekanntmachung nach dem Umwandlungsgesetz\nBaden-Württemberg Amtsgericht Ulm HRB 725962\nTalis International Holding GmbH – Heidenheim an der Brenz",
      "type": "Registerbekanntmachung nach dem Umwandlungsgesetz",
      "state": "Baden-Württemberg",
      "amtsgericht": "Amtsgericht Ulm",
      "registernummer": "HRB 725962",
      "registerart": "HRB",
      "company_name": "Talis International Holding GmbH",
      "company_seat": "Heidenheim an der Brenz",
      "details": "06.06.2025 (Bekanntmachungsdatum)\n\nBaden-Württemberg Amtsgericht Ulm HRB 725962\nRegisterbekanntmachung nach dem Umwandlungsgesetz 06.06.2025 (Eintragungsdatum)\n\nTalis International Holding GmbH\nGesellschaft mit beschränkter Haftung\nHeidenheim an der Brenz\n\nAls nicht eingetragen wird bekanntgemacht:\nDen Gläubigern der an der Verschmelzung beteiligten Rechtsträger ist, wenn sie binnen sechs Monaten nach dem Tag, an dem die Eintragung der Verschmelzung in das Register des Sitzes desjenigen Rechtsträgers, dessen Gläubiger sie sind, nach § 19 Abs. 3 UmwG als bekanntgemacht gilt, ihren Anspruch nach Grund und Höhe schriftlich anmelden, Sicherheit zu leisten, soweit sie nicht Befriedigung verlangen können. Dieses Recht steht den Gläubigern jedoch nur zu, wenn sie glaubhaft machen, dass durch die Verschmelzung die Erfüllung ihrer Forderung gefährdet wird."
    },
    {
      "date": "2025-06-06",
      "id": "111456",
      "original_text": "Löschungsankündigung\nBerlin Amtsgericht Berlin (Charlottenburg) HRB 111437\nReimann-Teamwork GmbH – Berlin",
      "type": "Löschungsankündigung",
      "state": "Berlin",
      "amtsgericht": "Amtsgericht Berlin (Charlottenburg)",
      "registernummer": "HRB 111437",
      "registerart": "HRB",
      "company_name": "Reimann-Teamwork GmbH",
      "company_seat": "Berlin",
      "details": "06.06.2025 (Bekanntmachungsdatum)\n\nBerlin Amtsgericht Berlin (Charlottenburg) HRB 111437\nLöschungsankündigung\n\nReimann-Teamwork GmbH\nGesellschaft mit beschränkter Haftung\nBerlin\n\nBei der nachstehenden Gesellschaft wird das Amtslöschungsverfahren gemäß § 394 FamFG eingeleitet. Widerspruchsfrist 6 Wochen"
    },
    {
      "date": "2025-06-06",
      "id": "111457",
      "original_text": "Löschungsankündigung\nBaden-Württemberg Amtsgericht Mannheim HRB 713591\nPF Vertrieb Germany UG (haftungsbeschränkt) – Karlsruhe",
      "type": "Löschungsankündigung",
      "state": "Baden-Württemberg",
      "amtsgericht": "Amtsgericht Mannheim",
      "registernummer": "HRB 713591",
      "registerart": "HRB",
      "company_name": "PF Vertrieb Germany UG (haftungsbeschränkt)",
      "company_seat": "Karlsruhe",
      "details": "06.06.2025 (Bekanntmachungsdatum)\n\nBaden-Württemberg Amtsgericht Mannheim HRB 713591\nLöschungsankündigung\n\nPF Vertrieb Germany UG (haftungsbeschränkt)\nGesellschaft mit beschränkter Haftung\nKarlsruhe\n\nAls nicht eingetragen wird bekanntgemacht:\nDas Gericht beabsichtigt, die Gesellschaft wegen Vermögenslosigkeit im Handelsregister von Amts wegen nach § 394 FamFG zu löschen. Die Frist zur Geltendmachung eines Widerspruchs gegen die beabsichtigte Löschung ist auf einen Monat ab Veröffentlichung bestimmt."
    },
    {
      "date": "2025-06-06",
      "id": "111458",
      "original_text": "Registerbekanntmachung nach dem Umwandlungsgesetz\nHamburg Amtsgericht Hamburg VR 4254\nNorddeutscher Bankenverband e.V. – Hamburg",
      "type": "Registerbekanntmachung nach dem Umwandlungsgesetz",
      "state": "Hamburg",
      "amtsgericht": "Amtsgericht Hamburg",
      "registernummer": "VR 4254",
      "registerart": "VR",
      "company_name": "Norddeutscher Bankenverband e.V.",
      "company_seat": "Hamburg",
      "details": "06.06.2025 (Bekanntmachungsdatum)\n\nHamburg Amtsgericht Hamburg VR 4254\nRegisterbekanntmachung nach dem Umwandlungsgesetz 04.06.2025 (Eintragungsdatum)\n\nNorddeutscher Bankenverband e.V.\neingetragener Verein\nHamburg\n\nAls nicht eingetragen wird bekannt gemacht:\nDen Gläubigern der an der Verschmelzung beteiligten Gesellschaften ist, wenn sie binnen sechs Monaten nach dem Tag, an dem die Eintragung der Verschmelzung in das Register des Sitzes desjenigen Rechtsträgers, dessen Gläubiger sie sind, nach § 19 Absatz 3 UmwG als bekannt gemacht gilt, ihren Anspruch nach Grund und Höhe schriftlich anmelden, Sicherheit zu leisten, soweit sie nicht Befriedigung verlangen können. Dieses Recht steht den Gläubigern jedoch nur zu, wenn sie glaubhaft machen, dass durch die Verschmelzung die Erfüllung ihrer Forderung gefährdet wird."
    },
    {
      "date": "2025-06-06",
      "id": "111459",
      "original_text": "Registerbekanntmachung nach dem Umwandlungsgesetz\nBaden-Württemberg Amtsgericht Stuttgart HRB 752963\nEpple Consulting GmbH – Kornwestheim",
      "type": "Registerbekanntmachung nach dem Umwandlungsgesetz",
      "state": "Baden-Württemberg",
      "amtsgericht": "Amtsgericht Stuttgart",
      "registernummer": "HRB 752963",
      "registerart": "HRB",
      "company_name": "Epple Consulting GmbH",
      "company_seat": "Kornwestheim",
      "details": "06.06.2025 (Bekanntmachungsdatum)\n\nBaden-Württemberg Amtsgericht Stuttgart HRB 752963\nRegisterbekanntmachung nach dem Umwandlungsgesetz 06.06.2025 (Eintragungsdatum)\n\nEpple Consulting GmbH\nGesellschaft mit beschränkter Haftung\nKornwestheim\n\nDen Gläubigern der an der Verschmelzung beteiligten Rechtsträger ist, wenn sie binnen sechs Monaten nach dem Tag, an dem die Eintragung der Verschmelzung in das Register des Sitzes desjenigen Rechtsträgers, dessen Gläubiger sie sind, nach § 19 Abs. 3 UmwG als bekanntgemacht gilt, ihren Anspruch nach Grund und Höhe schriftlich anmelden, Sicherheit zu leisten, soweit sie nicht Befriedigung verlangen können. Dieses Recht steht den Gläubigern jedoch nur zu, wenn sie glaubhaft machen, dass durch die Verschmelzung die Erfüllung ihrer Forderung gefährdet wird."
    },
    {
      "date": "2025-06-06",
      "id": "111460",
      "original_text": "Einreichung neuer Dokumente\nHamburg Amtsgericht Hamburg HRB 151938\nHSP7 Alstertal GmbH – Hamburg",
      "type": "Einreichung neuer Dokumente",
      "state": "Hamburg",
      "amtsgericht": "Amtsgericht Hamburg",
      "registernummer": "HRB 151938",
      "registerart": "HRB",
      "company_name": "HSP7 Alstertal GmbH",
      "company_seat": "Hamburg",
      "details": "06.06.2025 (Bekanntmachungsdatum)\n\nHamburg Amtsgericht Hamburg HRB 151938\nEinreichung neuer Dokumente 06.06.2025 (Eintragungsdatum)\n\nHSP7 Alstertal GmbH\nGesellschaft mit beschränkter Haftung\nHamburg\n\nAls nicht eingetragen wird bekannt gemacht:\nDen Gläubigern der an der Verschmelzung beteiligten Gesellschaften ist, wenn sie binnen sechs Monaten nach dem Tag, an dem die Eintragung der Verschmelzung in das Register des Sitzes desjenigen Rechtsträgers, dessen Gläubiger sie sind, nach § 19 Absatz 3 UmwG als bekannt gemacht gilt, ihren Anspruch nach Grund und Höhe schriftlich anmelden, Sicherheit zu leisten, soweit sie nicht Befriedigung verlangen können. Dieses Recht steht den Gläubigern jedoch nur zu, wenn sie glaubhaft machen, dass durch die Verschmelzung die Erfüllung ihrer Forderung gefährdet wird."
    },
    {
      "date": "2025-06-06",
      "id": "111461",
      "original_text": "Registerbekanntmachung nach dem Umwandlungsgesetz\nHamburg Amtsgericht Hamburg HRB 155402\nHSP7 Development GmbH – Hamburg",
      "type": "Registerbekanntmachung nach dem Umwandlungsgesetz",
      "state": "Hamburg",
      "amtsgericht": "Amtsgericht Hamburg",
      "registernummer": "HRB 155402",
      "registerart": "HRB",
      "company_name": "HSP7 Development GmbH",
      "company_seat": "Hamburg",
      "details": "06.06.2025 (Bekanntmachungsdatum)\n\nHamburg Amtsgericht Hamburg HRB 155402\nRegisterbekanntmachung nach dem Umwandlungsgesetz 06.06.2025 (Eintragungsdatum)\n\nHSP7 Development GmbH\nGesellschaft mit beschränkter Haftung\nHamburg\n\nAls nicht eingetragen wird bekannt gemacht:\nDen Gläubigern der an der Verschmelzung beteiligten Gesellschaften ist, wenn sie binnen sechs Monaten nach dem Tag, an dem die Eintragung der Verschmelzung in das Register des Sitzes desjenigen Rechtsträgers, dessen Gläubiger sie sind, nach § 19 Absatz 3 UmwG als bekannt gemacht gilt, ihren Anspruch nach Grund und Höhe schriftlich anmelden, Sicherheit zu leisten, soweit sie nicht Befriedigung verlangen können. Dieses Recht steht den Gläubigern jedoch nur zu, wenn sie glaubhaft machen, dass durch die Verschmelzung die Erfüllung ihrer Forderung gefährdet wird."
    },
    {
      "date": "2025-06-06",
      "id": "111462",
      "original_text": "Registerbekanntmachung nach dem Umwandlungsgesetz\nHamburg Amtsgericht Hamburg HRB 151235\nHSP7 Heerweg GmbH – Hamburg",
      "type": "Registerbekanntmachung nach dem Umwandlungsgesetz",
      "state": "Hamburg",
      "amtsgericht": "Amtsgericht Hamburg",
      "registernummer": "HRB 151235",
      "registerart": "HRB",
      "company_name": "HSP7 Heerweg GmbH",
      "company_seat": "Hamburg",
      "details": "06.06.2025 (Bekanntmachungsdatum)\n\nHamburg Amtsgericht Hamburg HRB 151235\nRegisterbekanntmachung nach dem Umwandlungsgesetz 06.06.2025 (Eintragungsdatum)\n\nHSP7 Heerweg GmbH\nGesellschaft mit beschränkter Haftung\nHamburg\n\nAls nicht eingetragen wird bekannt gemacht:\nDen Gläubigern der an der Verschmelzung beteiligten Gesellschaften ist, wenn sie binnen sechs Monaten nach dem Tag, an dem die Eintragung der Verschmelzung in das Register des Sitzes desjenigen Rechtsträgers, dessen Gläubiger sie sind, nach § 19 Absatz 3 UmwG als bekannt gemacht gilt, ihren Anspruch nach Grund und Höhe schriftlich anmelden, Sicherheit zu leisten, soweit sie nicht Befriedigung verlangen können. Dieses Recht steht den Gläubigern jedoch nur zu, wenn sie glaubhaft machen, dass durch die Verschmelzung die Erfüllung ihrer Forderung gefährdet wird."
    },
    {
      "date": "2025-06-06",
      "id": "111463",
      "original_text": "Einreichung neuer Dokumente\nBaden-Württemberg Amtsgericht Mannheim HRB 3962\nRoche Diagnostics GmbH – Mannheim",
      "type": "Einreichung neuer Dokumente",
      "state": "Baden-Württemberg",
      "amtsgericht": "Amtsgericht Mannheim",
      "registernummer": "HRB 3962",
      "registerart": "HRB",
      "company_name": "Roche Diagnostics GmbH",
      "company_seat": "Mannheim",
      "details": "06.06.2025 (Bekanntmachungsdatum)\n\nBaden-Württemberg Amtsgericht Mannheim HRB 3962\nEinreichung neuer Dokumente\n\nRoche Diagnostics GmbH\nGesellschaft mit beschränkter Haftung\nMannheim\n\nDie Gesellschaft hat am 17.04.2025 die Liste über die Zusammensetzung des Aufsichtsrats zum Handelsregister eingereicht."
    },
    {
      "date": "2025-06-06",
      "id": "111464",
      "original_text": "Registerbekanntmachung nach dem Umwandlungsgesetz\nBaden-Württemberg Amtsgericht Stuttgart HRB 752963\nEpple Consulting GmbH – Kornwestheim",
      "type": "Registerbekanntmachung nach dem Umwandlungsgesetz",
      "state": "Baden-Württemberg",
      "amtsgericht": "Amtsgericht Stuttgart",
      "registernummer": "HRB 752963",
      "registerart": "HRB",
      "company_name": "Epple Consulting GmbH",
      "company_seat": "Kornwestheim",
      "details": "06.06.2025 (Bekanntmachungsdatum)\n\nBaden-Württemberg Amtsgericht Stuttgart HRB 752963\nRegisterbekanntmachung nach dem Umwandlungsgesetz 06.06.2025 (Eintragungsdatum)\n\nEpple Consulting GmbH\nGesellschaft mit beschränkter Haftung\nKornwestheim\n\nDen Gläubigern der an der Verschmelzung beteiligten Rechtsträger ist, wenn sie binnen sechs Monaten nach dem Tag, an dem die Eintragung der Verschmelzung in das Register des Sitzes desjenigen Rechtsträgers, dessen Gläubiger sie sind, nach § 19 Abs. 3 UmwG als bekanntgemacht gilt, ihren Anspruch nach Grund und Höhe schriftlich anmelden, Sicherheit zu leisten, soweit sie nicht Befriedigung verlangen können. Dieses Recht steht den Gläubigern jedoch nur zu, wenn sie glaubhaft machen, dass durch die Verschmelzung die Erfüllung ihrer Forderung gefährdet wird."
    },
    {
      "date": "2025-06-06",
      "id": "111465",
      "original_text": "Registerbekanntmachung nach dem Umwandlungsgesetz\nBaden-Württemberg Amtsgericht Freiburg GsR 1266\nLerabell eGbR – Bodman-Ludwigshafen",
      "type": "Registerbekanntmachung nach dem Umwandlungsgesetz",
      "state": "Baden-Württemberg",
      "amtsgericht": "Amtsgericht Freiburg",
      "registernummer": "GsR 1266",
      "registerart": "GsR",
      "company_name": "Lerabell eGbR",
      "company_seat": "Bodman-Ludwigshafen",
      "details": "06.06.2025 (Bekanntmachungsdatum)\n\nBaden-Württemberg Amtsgericht Freiburg GsR 1266\nRegisterbekanntmachung nach dem Umwandlungsgesetz 06.06.2025 (Eintragungsdatum)\n\nLerabell eGbR\nGesellschaft bürgerlichen Rechts\nBodman-Ludwigshafen\n\nAls nicht eingetragen wird bekanntgemacht:\nDen Gläubigern des an dem Formwechsel beteiligten Rechtsträgers ist, wenn sie binnen sechs Monaten nach dem Tag, an dem die Eintragung des Formwechsels in das Register des Sitzes desjenigen Rechtsträgers, dessen Gläubiger sie sind, nach § 19 Abs. 3 UmwG als bekanntgemacht gilt, ihren Anspruch nach Grund und Höhe schriftlich anmelden, Sicherheit zu leisten, soweit sie nicht Befriedigung verlangen können. Dieses Recht steht den Gläubigern jedoch nur zu, wenn sie glaubhaft machen, dass durch den Formwechsel die Erfüllung ihrer Forderung gefährdet wird."
    },
    {
      "date": "2025-06-06",
      "id": "111466",
      "original_text": "Löschungsankündigung\nBrandenburg Amtsgericht Potsdam HRB 8915\nAgrar GmbH Buschow – Buschow",
      "type": "Löschungsankündigung",
      "state": "Brandenburg",
      "amtsgericht": "Amtsgericht Potsdam",
      "registernummer": "HRB 8915",
      "registerart": "HRB",
      "company_name": "Agrar GmbH Buschow",
      "company_seat": "Buschow",
      "details": "06.06.2025 (Bekanntmachungsdatum)\n\nBrandenburg Amtsgericht Potsdam HRB 8915\nLöschungsankündigung\n\nAgrar GmbH Buschow\nGesellschaft mit beschränkter Haftung\nBuschow\n\nBei der nachstehenden Gesellschaft wird das Amtslöschungsverfahren gemäß § 394 FamFG eingeleitet."
    },
    {
      "date": "2025-06-06",
      "id": "111467",
      "original_text": "Registerbekanntmachung nach dem Umwandlungsgesetz\nBaden-Württemberg Amtsgericht Freiburg HRB 727112\nLerabell GmbH – Bodmann-Ludwigshafen",
      "type": "Registerbekanntmachung nach dem Umwandlungsgesetz",
      "state": "Baden-Württemberg",
      "amtsgericht": "Amtsgericht Freiburg",
      "registernummer": "HRB 727112",
      "registerart": "HRB",
      "company_name": "Lerabell GmbH",
      "company_seat": "Bodmann-Ludwigshafen",
      "details": "06.06.2025 (Bekanntmachungsdatum)\n\nBaden-Württemberg Amtsgericht Freiburg HRB 727112\nRegisterbekanntmachung nach dem Umwandlungsgesetz 06.06.2025 (Eintragungsdatum)\n\nLerabell GmbH\nGesellschaft mit beschränkter Haftung\nBodmann-Ludwigshafen\n\nAls nicht eingetragen wird bekanntgemacht:\nDen Gläubigern des an dem Formwechsel beteiligten Rechtsträgers ist, wenn sie binnen sechs Monaten nach dem Tag, an dem die Eintragung des Formwechsels in das Register des Sitzes desjenigen Rechtsträgers, dessen Gläubiger sie sind, nach § 19 Abs. 3 UmwG als bekanntgemacht gilt, ihren Anspruch nach Grund und Höhe schriftlich anmelden, Sicherheit zu leisten, soweit sie nicht Befriedigung verlangen können. Dieses Recht steht den Gläubigern jedoch nur zu, wenn sie glaubhaft machen, dass durch den Formwechsel die Erfüllung ihrer Forderung gefährdet wird."
    },
    {
      "date": "2025-06-06",
      "id": "111468",
      "original_text": "Löschungsankündigung\nBaden-Württemberg Amtsgericht Mannheim HRB 232633\nLAMELLA GmbH Lamellenvorhänge – Kraichtal",
      "type": "Löschungsankündigung",
      "state": "Baden-Württemberg",
      "amtsgericht": "Amtsgericht Mannheim",
      "registernummer": "HRB 232633",
      "registerart": "HRB",
      "company_name": "LAMELLA GmbH Lamellenvorhänge",
      "company_seat": "Kraichtal",
      "details": "06.06.2025 (Bekanntmachungsdatum)\n\nBaden-Württemberg Amtsgericht Mannheim HRB 232633\nLöschungsankündigung 06.06.2025 (Eintragungsdatum)\n\nLAMELLA GmbH Lamellenvorhänge\nGesellschaft mit beschränkter Haftung\nKraichtal\n\nAls nicht eingetragen wird bekanntgemacht:\nDas Gericht beabsichtigt, die Gesellschaft wegen Vermögenslosigkeit im Handelsregister von Amts wegen nach § 394 FamFG zu löschen. Die Frist zur Geltendmachung eines Widerspruchs gegen die beabsichtigte Löschung ist auf einen Monat ab Veröffentlichung bestimmt."
    },
    {
      "date": "2025-06-06",
      "id": "111469",
      "original_text": "Löschungsankündigung\nBerlin Amtsgericht Berlin (Charlottenburg) HRB 156352\nzenAud.io GmbH – Berlin",
      "type": "Löschungsankündigung",
      "state": "Berlin",
      "amtsgericht": "Amtsgericht Berlin (Charlottenburg)",
      "registernummer": "HRB 156352",
      "registerart": "HRB",
      "company_name": "zenAud.io GmbH",
      "company_seat": "Berlin",
      "details": "06.06.2025 (Bekanntmachungsdatum)\n\nBerlin Amtsgericht Berlin (Charlottenburg) HRB 156352\nLöschungsankündigung\n\nzenAud.io GmbH\nGesellschaft mit beschränkter Haftung\nBerlin\n\nBei der nachstehenden Gesellschaft wird das Amtslöschungsverfahren gemäß § 394 FamFG eingeleitet. Widerspruchsfrist 6 Wochen"
    },
    {
      "date": "2025-06-06",
      "id": "111470",
      "original_text": "Registerbekanntmachung nach dem Umwandlungsgesetz\nHamburg Amtsgericht Hamburg HRB 124668\nBAV Borgfelder Allee Verwaltung GmbH – Hamburg",
      "type": "Registerbekanntmachung nach dem Umwandlungsgesetz",
      "state": "Hamburg",
      "amtsgericht": "Amtsgericht Hamburg",
      "registernummer": "HRB 124668",
      "registerart": "HRB",
      "company_name": "BAV Borgfelder Allee Verwaltung GmbH",
      "company_seat": "Hamburg",
      "details": "06.06.2025 (Bekanntmachungsdatum)\n\nHamburg Amtsgericht Hamburg HRB 124668\nRegisterbekanntmachung nach dem Umwandlungsgesetz 06.06.2025 (Eintragungsdatum)\n\nBAV Borgfelder Allee Verwaltung GmbH\nGesellschaft mit beschränkter Haftung\nHamburg\n\nAls nicht eingetragen wird bekannt gemacht:\nDen Gläubigern der an der Verschmelzung beteiligten Gesellschaften ist, wenn sie binnen sechs Monaten nach dem Tag, an dem die Eintragung der Verschmelzung in das Register des Sitzes desjenigen Rechtsträgers, dessen Gläubiger sie sind, nach § 19 Absatz 3 UmwG als bekannt gemacht gilt, ihren Anspruch nach Grund und Höhe schriftlich anmelden, Sicherheit zu leisten, soweit sie nicht Befriedigung verlangen können. Dieses Recht steht den Gläubigern jedoch nur zu, wenn sie glaubhaft machen, dass durch die Verschmelzung die Erfüllung ihrer Forderung gefährdet wird."
    },
    {
      "date": "2025-06-06",
      "id": "111471",
      "original_text": "Einreichung neuer Dokumente\nHamburg Amtsgericht Hamburg HRB 164684\nIngenios Technologies AG – Hamburg",
      "type": "Einreichung neuer Dokumente",
      "state": "Hamburg",
      "amtsgericht": "Amtsgericht Hamburg",
      "registernummer": "HRB 164684",
      "registerart": "HRB",
      "company_name": "Ingenios Technologies AG",
      "company_seat": "Hamburg",
      "details": "06.06.2025 (Bekanntmachungsdatum)\n\nHamburg Amtsgericht Hamburg HRB 164684\nEinreichung neuer Dokumente 03.06.2025 (Eintragungsdatum)\n\nIngenios Technologies AG\nAktiengesellschaft\nHamburg\n\nAls nicht eingetragen wird bekannt gemacht: Liste des Aufsichtsrats wurde eingereicht."
    },
    {
      "date": "2025-06-06",
      "id": "111472",
      "original_text": "Einreichung neuer Dokumente\nHamburg Amtsgericht Hamburg HRB 182549\nLindenstone AG – Hamburg",
      "type": "Einreichung neuer Dokumente",
      "state": "Hamburg",
      "amtsgericht": "Amtsgericht Hamburg",
      "registernummer": "HRB 182549",
      "registerart": "HRB",
      "company_name": "Lindenstone AG",
      "company_seat": "Hamburg",
      "details": "06.06.2025 (Bekanntmachungsdatum)\n\nHamburg Amtsgericht Hamburg HRB 182549\nEinreichung neuer Dokumente 04.06.2025 (Eintragungsdatum)\n\nLindenstone AG\nAktiengesellschaft\nHamburg\n\nAls nicht eingetragen wird bekannt gemacht: Liste des Aufsichtsrats wurde eingereicht."
    },
    {
      "date": "2025-06-06",
      "id": "111473",
      "original_text": "Einreichung neuer Dokumente\nHamburg Amtsgericht Hamburg HRB 185204\nLBS Landesbausparkasse NordOst AG – Potsdam und Hamburg",
      "type": "Einreichung neuer Dokumente",
      "state": "Hamburg",
      "amtsgericht": "Amtsgericht Hamburg",
      "registernummer": "HRB 185204",
      "registerart": "HRB",
      "company_name": "LBS Landesbausparkasse NordOst AG",
      "company_seat": "Potsdam und Hamburg",
      "details": "06.06.2025 (Bekanntmachungsdatum)\n\nHamburg Amtsgericht Hamburg HRB 185204\nEinreichung neuer Dokumente 04.06.2025 (Eintragungsdatum)\n\nLBS Landesbausparkasse NordOst AG\nAktiengesellschaft\nPotsdam und Hamburg\n\nAls nicht eingetragen wird bekannt gemacht: Liste des Aufsichtsrats wurde eingereicht."
    },
    {
      "date": "2025-06-06",
      "id": "111474",
      "original_text": "Einreichung neuer Dokumente\nHamburg Amtsgericht Hamburg HRB 58961\nKörber AG – Hamburg",
      "type": "Einreichung neuer Dokumente",
      "state": "Hamburg",
      "amtsgericht": "Amtsgericht Hamburg",
      "registernummer": "HRB 58961",
      "registerart": "HRB",
      "company_name": "Körber AG",
      "company_seat": "Hamburg",
      "details": "06.06.2025 (Bekanntmachungsdatum)\n\nHamburg Amtsgericht Hamburg HRB 58961\nEinreichung neuer Dokumente 03.06.2025 (Eintragungsdatum)\n\nKörber AG\nAktiengesellschaft\nHamburg\n\nAls nicht eingetragen wird bekannt gemacht: Liste des Aufsichtsrats wurde eingereicht."
    },
    {
      "date": "2025-06-06",
      "id": "111475",
      "original_text": "Löschungsankündigung\nBaden-Württemberg Amtsgericht Stuttgart HRB 770682\nGM Automobiles GmbH – Stuttgart",
      "type": "Löschungsankündigung",
      "state": "Baden-Württemberg",
      "amtsgericht": "Amtsgericht Stuttgart",
      "registernummer": "HRB 770682",
      "registerart": "HRB",
      "company_name": "GM Automobiles GmbH",
      "company_seat": "Stuttgart",
      "details": "06.06.2025 (Bekanntmachungsdatum)\n\nBaden-Württemberg Amtsgericht Stuttgart HRB 770682\nLöschungsankündigung\n\nGM Automobiles GmbH\nGesellschaft mit beschränkter Haftung\nStuttgart\n\nAls nicht eingetragen wird bekanntgemacht:\nDas Gericht beabsichtigt, die Gesellschaft wegen Vermögenslosigkeit im Handelsregister von Amts wegen nach § 394 FamFG zu löschen. Die Frist zur Geltendmachung eines Widerspruchs gegen die beabsichtigte Löschung ist auf zwei Monate ab Veröffentlichung bestimmt."
    },
    {
      "date": "2025-06-06",
      "id": "111476",
      "original_text": "Einreichung neuer Dokumente\nBerlin Amtsgericht Berlin (Charlottenburg) HRB 209352\nFORTIS Real Estate Investment AG – Berlin",
      "type": "Einreichung neuer Dokumente",
      "state": "Berlin",
      "amtsgericht": "Amtsgericht Berlin (Charlottenburg)",
      "registernummer": "HRB 209352",
      "registerart": "HRB",
      "company_name": "FORTIS Real Estate Investment AG",
      "company_seat": "Berlin",
      "details": "06.06.2025 (Bekanntmachungsdatum)\n\nBerlin Amtsgericht Berlin (Charlottenburg) HRB 209352\nEinreichung neuer Dokumente\n\nFORTIS Real Estate Investment AG\nAktiengesellschaft\nBerlin\n\nAls nicht eingetragen wird veröffentlicht:Es wurde eine neue Liste der Aufsichtsratsmitglieder eingereicht (§ 106 AktG)."
    },
    {
      "date": "2025-06-06",
      "id": "111477",
      "original_text": "Sonstige Registerbekanntmachung\nHamburg Amtsgericht Hamburg HRB 162626\nSCHNIGGE Capital Markets SE – Hamburg",
      "type": "Sonstige Registerbekanntmachung",
      "state": "Hamburg",
      "amtsgericht": "Amtsgericht Hamburg",
      "registernummer": "HRB 162626",
      "registerart": "HRB",
      "company_name": "SCHNIGGE Capital Markets SE",
      "company_seat": "Hamburg",
      "details": "06.06.2025 (Bekanntmachungsdatum)\n\nHamburg Amtsgericht Hamburg HRB 162626\nSonstige Registerbekanntmachung 06.06.2025 (Eintragungsdatum)\n\nSCHNIGGE Capital Markets SE\nEuropäische Aktiengesellschaft (SE)\nHamburg\n\nAls nicht eingetragen wird bekannt gemacht: Liste der Verwaltungsratsmitglieder wurde eingereicht."
    },
    {
      "date": "2025-06-06",
      "id": "111478",
      "original_text": "Löschungsankündigung\nBaden-Württemberg Amtsgericht Mannheim HRB 703816\nWoerner Sealing Technology GmbH – Wertheim",
      "type": "Löschungsankündigung",
      "state": "Baden-Württemberg",
      "amtsgericht": "Amtsgericht Mannheim",
      "registernummer": "HRB 703816",
      "registerart": "HRB",
      "company_name": "Woerner Sealing Technology GmbH",
      "company_seat": "Wertheim",
      "details": "06.06.2025 (Bekanntmachungsdatum)\n\nBaden-Württemberg Amtsgericht Mannheim HRB 703816\nLöschungsankündigung 06.06.2025 (Eintragungsdatum)\n\nWoerner Sealing Technology GmbH\nGesellschaft mit beschränkter Haftung\nWertheim\n\nDas Gericht beabsichtigt, die Gesellschaft wegen Vermögenslosigkeit im Handelsregister von Amts wegen nach § 394 FamFG zu löschen. Die Frist zur Geltendmachung eines Widerspruchs gegen die beabsichtigte Löschung ist auf einen Monat ab Veröffentlichung bestimmt."
    },
    {
      "date": "2025-06-06",
      "id": "111479",
      "original_text": "Registerbekanntmachung nach dem Umwandlungsgesetz\nSchleswig-Holstein Amtsgericht Lübeck HRB 24946\nPartyhelden GmbH – Geesthacht",
      "type": "Registerbekanntmachung nach dem Umwandlungsgesetz",
      "state": "Schleswig-Holstein",
      "amtsgericht": "Amtsgericht Lübeck",
      "registernummer": "HRB 24946",
      "registerart": "HRB",
      "company_name": "Partyhelden GmbH",
      "company_seat": "Geesthacht",
      "details": "06.06.2025 (Bekanntmachungsdatum)\n\nSchleswig-Holstein Amtsgericht Lübeck HRB 24946\nRegisterbekanntmachung nach dem Umwandlungsgesetz 05.06.2025 (Eintragungsdatum)\n\nPartyhelden GmbH\nGesellschaft mit beschränkter Haftung\nGeesthacht\n\nZu Eintragungsnummer 5 vom 05.06.2025 wird als nicht eingetragen veröffentlicht: Den Gläubigern der an der Verschmelzung beteiligten Rechtsträger ist, wenn sie binnen sechs Monaten nach dem Tag, an dem die Eintragung der Verschmelzung in das Register des Sitzes desjenigen Rechtsträgers, dessen Gläubiger sie sind, als bekannt gemacht gilt, ihren Anspruch nach Grund und Höhe schriftlich anmelden, Sicherheit zu leisten, soweit sie nicht Befriedigung verlangen können. Dieses Recht steht den Gläubigern jedoch nur zu, wenn sie glaubhaft machen, dass durch die Verschmelzung die Erfüllung ihrer Forderung gefährdet wird."
    },
    {
      "date": "2025-06-06",
      "id": "111480",
      "original_text": "Registerbekanntmachung nach dem Umwandlungsgesetz\nBerlin Amtsgericht Berlin (Charlottenburg) HRB 275597\nNoibau GmbH – Berlin",
      "type": "Registerbekanntmachung nach dem Umwandlungsgesetz",
      "state": "Berlin",
      "amtsgericht": "Amtsgericht Berlin (Charlottenburg)",
      "registernummer": "HRB 275597",
      "registerart": "HRB",
      "company_name": "Noibau GmbH",
      "company_seat": "Berlin",
      "details": "06.06.2025 (Bekanntmachungsdatum)\n\nBerlin Amtsgericht Berlin (Charlottenburg) HRB 275597\nRegisterbekanntmachung nach dem Umwandlungsgesetz 30.05.2025 (Eintragungsdatum)\n\nNoibau GmbH\nGesellschaft mit beschränkter Haftung\nBerlin\n\nZu Eintragungsnummer 1 vom 30.05.2025 wird als nicht eingetragen veröffentlicht: Den Gläubigern ist, wenn sie binnen sechs Monaten nach dem Tag, an dem die Eintragung der Umwandlung als bekannt gemacht gilt, ihren Anspruch nach Grund und Höhe schriftlich anmelden, Sicherheit zu leisten, soweit sie nicht Befriedigung verlangen können. Dieses Recht steht den Gläubigern jedoch nur zu, wenn sie glaubhaft machen, dass durch die Umwandlung die Erfüllung ihrer Forderung gefährdet wird. Das Recht, Sicherheitsleistung zu verlangen, steht Gläubigern nicht zu, die im Falle der Insolvenz ein Recht auf vorzugsweise Befriedigung aus einer Deckungsmasse haben, die nach gesetzlicher Vorschrift zu ihrem Schutz errichtet und staatlich überwacht ist."
    },
    {
      "date": "2025-06-06",
      "id": "111481",
      "original_text": "Registerbekanntmachung nach dem Umwandlungsgesetz\nBerlin Amtsgericht Berlin (Charlottenburg) GsR 1315\nNoibau eGbR – Berlin",
      "type": "Registerbekanntmachung nach dem Umwandlungsgesetz",
      "state": "Berlin",
      "amtsgericht": "Amtsgericht Berlin (Charlottenburg)",
      "registernummer": "GsR 1315",
      "registerart": "GsR",
      "company_name": "Noibau eGbR",
      "company_seat": "Berlin",
      "details": "06.06.2025 (Bekanntmachungsdatum)\n\nBerlin Amtsgericht Berlin (Charlottenburg) GsR 1315\nRegisterbekanntmachung nach dem Umwandlungsgesetz 30.05.2025 (Eintragungsdatum)\n\nNoibau eGbR\nGesellschaft bürgerlichen Rechts\nBerlin\n\nZu Eintragungsnummer 2 vom 30.05.2025 wird als nicht eingetragen veröffentlicht: Den Gläubigern ist, wenn sie binnen sechs Monaten nach dem Tag, an dem die Eintragung der Umwandlung als bekannt gemacht gilt, ihren Anspruch nach Grund und Höhe schriftlich anmelden, Sicherheit zu leisten, soweit sie nicht Befriedigung verlangen können. Dieses Recht steht den Gläubigern jedoch nur zu, wenn sie glaubhaft machen, dass durch die Umwandlung die Erfüllung ihrer Forderung gefährdet wird. Das Recht, Sicherheitsleistung zu verlangen, steht Gläubigern nicht zu, die im Falle der Insolvenz ein Recht auf vorzugsweise Befriedigung aus einer Deckungsmasse haben, die nach gesetzlicher Vorschrift zu ihrem Schutz errichtet und staatlich überwacht ist."
    },
    {
      "date": "2025-06-06",
      "id": "111482",
      "original_text": "Registerbekanntmachung nach dem Umwandlungsgesetz\nBaden-Württemberg Amtsgericht Mannheim HRB 737819\nCast One GmbH – St. Leon-Rot",
      "type": "Registerbekanntmachung nach dem Umwandlungsgesetz",
      "state": "Baden-Württemberg",
      "amtsgericht": "Amtsgericht Mannheim",
      "registernummer": "HRB 737819",
      "registerart": "HRB",
      "company_name": "Cast One GmbH",
      "company_seat": "St. Leon-Rot",
      "details": "06.06.2025 (Bekanntmachungsdatum)\n\nBaden-Württemberg Amtsgericht Mannheim HRB 737819\nRegisterbekanntmachung nach dem Umwandlungsgesetz 06.06.2025 (Eintragungsdatum)\n\nCast One GmbH\nGesellschaft mit beschränkter Haftung\nSt. Leon-Rot\n\nAls nicht eingetragen wird bekanntgemacht: Den Gläubigern der an der Verschmelzung beteiligten Rechtsträger ist, wenn sie binnen sechs Monaten nach dem Tag, an dem die Eintragung der Verschmelzung in das Register des Sitzes desjenigen Rechtsträgers, dessen Gläubiger sie sind, nach § 19 Abs. 3 UmwG als bekanntgemacht gilt, ihren Anspruch nach Grund und Höhe schriftlich anmelden, Sicherheit zu leisten, soweit sie nicht Befriedigung verlangen können. Dieses Recht steht den Gläubigern jedoch nur zu, wenn sie glaubhaft machen, dass durch die Verschmelzung die Erfüllung ihrer Forderung gefährdet wird."
    },
    {
      "date": "2025-06-06",
      "id": "111483",
      "original_text": "Registerbekanntmachung nach dem Umwandlungsgesetz\nSaarland Amtsgericht Saarbrücken HRB 33057\nOpus Holding GmbH – St.Ingbert",
      "type": "Registerbekanntmachung nach dem Umwandlungsgesetz",
      "state": "Saarland",
      "amtsgericht": "Amtsgericht Saarbrücken",
      "registernummer": "HRB 33057",
      "registerart": "HRB",
      "company_name": "Opus Holding GmbH",
      "company_seat": "St.Ingbert",
      "details": "06.06.2025 (Bekanntmachungsdatum)\n\nSaarland Amtsgericht Saarbrücken HRB 33057\nRegisterbekanntmachung nach dem Umwandlungsgesetz 06.06.2025 (Eintragungsdatum)\n\nOpus Holding GmbH\nGesellschaft mit beschränkter Haftung\nSt.Ingbert\n\nAls nicht eingetragen wird bekannt gemacht: Den Gläubigern der an der Ausgliederung beteiligten Gesellschaften ist, wenn sie binnen sechs Monaten nach dem Tag, an dem die Eintragung der Ausgliederung in das Register des Sitzes desjenigen Rechtsträgers, dessen Gläubiger sie sind, nach § 19 Absatz 3 UmwG bekannt gemacht worden ist, ihren Anspruch nach Grund und Höhe schriftlich anmelden, Sicherheit zu leisten, soweit sie nicht Befriedigung verlangen können. Dieses Recht steht den Gläubigern jedoch nur zu, wenn sie glaubhaft machen, dass durch die Verschmelzung die Erfüllung ihrer Forderung gefährdet wird."
    },
    {
      "date": "2025-06-06",
      "id": "111484",
      "original_text": "Registerbekanntmachung nach dem Umwandlungsgesetz\nSaarland Amtsgericht Saarbrücken HRA 13674\nSascha Klesen Facility Management e.K. – Eppelborn",
      "type": "Registerbekanntmachung nach dem Umwandlungsgesetz",
      "state": "Saarland",
      "amtsgericht": "Amtsgericht Saarbrücken",
      "registernummer": "HRA 13674",
      "registerart": "HRA",
      "company_name": "Sascha Klesen Facility Management e.K.",
      "company_seat": "Eppelborn",
      "details": "06.06.2025 (Bekanntmachungsdatum)\n\nSaarland Amtsgericht Saarbrücken HRA 13674\nRegisterbekanntmachung nach dem Umwandlungsgesetz 06.06.2025 (Eintragungsdatum)\n\nSascha Klesen Facility Management e.K.\nEinzelkaufmann / Einzelkauffrau\nEppelborn\n\nAls nicht eingetragen wird bekannt gemacht: Den Gläubigern der an der Ausgliederung beteiligten Gesellschaften ist, wenn sie binnen sechs Monaten nach dem Tag, an dem die Eintragung der Ausgliederung in das Register des Sitzes desjenigen Rechtsträgers, dessen Gläubiger sie sind, nach § 19 Absatz 3 UmwG bekannt gemacht worden ist, ihren Anspruch nach Grund und Höhe schriftlich anmelden, Sicherheit zu leisten, soweit sie nicht Befriedigung verlangen können. Dieses Recht steht den Gläubigern jedoch nur zu, wenn sie glaubhaft machen, dass durch die Ausgliederung die Erfüllung ihrer Forderung gefährdet wird."
    },
    {
      "date": "2025-06-06",
      "id": "111485",
      "original_text": "Registerbekanntmachung nach dem Umwandlungsgesetz\nHamburg Amtsgericht Hamburg HRB 130889\nMehari UG (haftungsbeschränkt) – Hamburg",
      "type": "Registerbekanntmachung nach dem Umwandlungsgesetz",
      "state": "Hamburg",
      "amtsgericht": "Amtsgericht Hamburg",
      "registernummer": "HRB 130889",
      "registerart": "HRB",
      "company_name": "Mehari UG (haftungsbeschränkt)",
      "company_seat": "Hamburg",
      "details": "06.06.2025 (Bekanntmachungsdatum)\n\nHamburg Amtsgericht Hamburg HRB 130889\nRegisterbekanntmachung nach dem Umwandlungsgesetz 06.06.2025 (Eintragungsdatum)\n\nMehari UG (haftungsbeschränkt)\nGesellschaft mit beschränkter Haftung\nHamburg\n\nAls nicht eingetragen wird bekannt gemacht:\nDen Gläubigern der an der Verschmelzung beteiligten Gesellschaften ist, wenn sie binnen sechs Monaten nach dem Tag, an dem die Eintragung der Verschmelzung in das Register des Sitzes desjenigen Rechtsträgers, dessen Gläubiger sie sind, nach § 19 Absatz 3 UmwG als bekannt gemacht gilt, ihren Anspruch nach Grund und Höhe schriftlich anmelden, Sicherheit zu leisten, soweit sie nicht Befriedigung verlangen können. Dieses Recht steht den Gläubigern jedoch nur zu, wenn sie glaubhaft machen, dass durch die Verschmelzung die Erfüllung ihrer Forderung gefährdet wird."
    },
    {
      "date": "2025-06-06",
      "id": "111486",
      "original_text": "Registerbekanntmachung nach dem Umwandlungsgesetz\nHamburg Amtsgericht Hamburg HRB 76966\ndasein DESIGN GmbH – Hamburg",
      "type": "Registerbekanntmachung nach dem Umwandlungsgesetz",
      "state": "Hamburg",
      "amtsgericht": "Amtsgericht Hamburg",
      "registernummer": "HRB 76966",
      "registerart": "HRB",
      "company_name": "dasein DESIGN GmbH",
      "company_seat": "Hamburg",
      "details": "06.06.2025 (Bekanntmachungsdatum)\n\nHamburg Amtsgericht Hamburg HRB 76966\nRegisterbekanntmachung nach dem Umwandlungsgesetz 06.06.2025 (Eintragungsdatum)\n\ndasein DESIGN GmbH\nGesellschaft mit beschränkter Haftung\nHamburg\n\nAls nicht eingetragen wird bekannt gemacht:\nDen Gläubigern der an der Verschmelzung beteiligten Gesellschaften ist, wenn sie binnen sechs Monaten nach dem Tag, an dem die Eintragung der Verschmelzung in das Register des Sitzes desjenigen Rechtsträgers, dessen Gläubiger sie sind, nach § 19 Absatz 3 UmwG als bekannt gemacht gilt, ihren Anspruch nach Grund und Höhe schriftlich anmelden, Sicherheit zu leisten, soweit sie nicht Befriedigung verlangen können. Dieses Recht steht den Gläubigern jedoch nur zu, wenn sie glaubhaft machen, dass durch die Verschmelzung die Erfüllung ihrer Forderung gefährdet wird."
    },
    {
      "date": "2025-06-06",
      "id": "111487",
      "original_text": "Einreichung neuer Dokumente\nBerlin Amtsgericht Berlin (Charlottenburg) HRB 275658\ninnovate! lab gGmbH – Berlin",
      "type": "Einreichung neuer Dokumente",
      "state": "Berlin",
      "amtsgericht": "Amtsgericht Berlin (Charlottenburg)",
      "registernummer": "HRB 275658",
      "registerart": "HRB",
      "company_name": "innovate! lab gGmbH",
      "company_seat": "Berlin",
      "details": "06.06.2025 (Bekanntmachungsdatum)\n\nBerlin Amtsgericht Berlin (Charlottenburg) HRB 275658\nEinreichung neuer Dokumente\n\ninnovate! lab gGmbH\nGesellschaft mit beschränkter Haftung\nBerlin\n\nAls nicht eingetragen wird veröffentlicht: Es wurde eine neue Liste der Aufsichtsratsmitglieder eingereicht (§52 GmbHG)."
    },
    {
      "date": "2025-06-06",
      "id": "111488",
      "original_text": "Einreichung neuer Dokumente\nBrandenburg Amtsgericht Neuruppin HRB 2420\nUckermärkische GeWo GmbH Wohnungsgesellschaft – Gerswalde",
      "type": "Einreichung neuer Dokumente",
      "state": "Brandenburg",
      "amtsgericht": "Amtsgericht Neuruppin",
      "registernummer": "HRB 2420",
      "registerart": "HRB",
      "company_name": "Uckermärkische GeWo GmbH Wohnungsgesellschaft",
      "company_seat": "Gerswalde",
      "details": "06.06.2025 (Bekanntmachungsdatum)\n\nBrandenburg Amtsgericht Neuruppin HRB 2420\nEinreichung neuer Dokumente\n\nUckermärkische GeWo GmbH Wohnungsgesellschaft\nGesellschaft mit beschränkter Haftung\nGerswalde\n\nAls nicht eingetragen wird veröffentlicht: Eine Liste der Mitglieder des Aufsichtsrates wurde zum Handelsregister eingereicht."
    },
    {
      "date": "2025-06-06",
      "id": "111489",
      "original_text": "Löschungsankündigung\nBaden-Württemberg Amtsgericht Stuttgart HRB 772934\nThirteen Holding GmbH – Stuttgart",
      "type": "Löschungsankündigung",
      "state": "Baden-Württemberg",
      "amtsgericht": "Amtsgericht Stuttgart",
      "registernummer": "HRB 772934",
      "registerart": "HRB",
      "company_name": "Thirteen Holding GmbH",
      "company_seat": "Stuttgart",
      "details": "06.06.2025 (Bekanntmachungsdatum)\n\nBaden-Württemberg Amtsgericht Stuttgart HRB 772934\nLöschungsankündigung\n\nThirteen Holding GmbH\nGesellschaft mit beschränkter Haftung\nStuttgart\n\nAls nicht eingetragen wird bekanntgemacht:\nDas Gericht beabsichtigt, die Gesellschaft wegen Vermögenslosigkeit im Handelsregister von Amts wegen nach § 394 FamFG zu löschen. Die Frist zur Geltendmachung eines Widerspruchs gegen die beabsichtigte Löschung ist auf zwei Monate ab Veröffentlichung bestimmt."
    },
    {
      "date": "2025-06-06",
      "id": "111490",
      "original_text": "Einreichung neuer Dokumente\nSaarland Amtsgericht Saarbrücken HRB 16897\nCQLT SaarGummi Deutschland GmbH – Wadern",
      "type": "Einreichung neuer Dokumente",
      "state": "Saarland",
      "amtsgericht": "Amtsgericht Saarbrücken",
      "registernummer": "HRB 16897",
      "registerart": "HRB",
      "company_name": "CQLT SaarGummi Deutschland GmbH",
      "company_seat": "Wadern",
      "details": "06.06.2025 (Bekanntmachungsdatum)\n\nSaarland Amtsgericht Saarbrücken HRB 16897\nEinreichung neuer Dokumente\n\nCQLT SaarGummi Deutschland GmbH\nGesellschaft mit beschränkter Haftung\nWadern\n\nDie Geschäftsführung der Gesellschaft hat eine Liste der Mitglieder des Aufsichtsrats zum Handelsregister eingereicht (§ 52 Abs. 3 Satz 2 GmbHG)."
    },
    {
      "date": "2025-06-06",
      "id": "111491",
      "original_text": "Löschungsankündigung\nBaden-Württemberg Amtsgericht Stuttgart HRB 245336\nTLT TECHDOK GmbH Gesellschaft für technische Dokumentation – Stuttgart",
      "type": "Löschungsankündigung",
      "state": "Baden-Württemberg",
      "amtsgericht": "Amtsgericht Stuttgart",
      "registernummer": "HRB 245336",
      "registerart": "HRB",
      "company_name": "TLT TECHDOK GmbH Gesellschaft für technische Dokumentation",
      "company_seat": "Stuttgart",
      "details": "06.06.2025 (Bekanntmachungsdatum)\n\nBaden-Württemberg Amtsgericht Stuttgart HRB 245336\nLöschungsankündigung\n\nTLT TECHDOK GmbH Gesellschaft für technische Dokumentation\nGesellschaft mit beschränkter Haftung\nStuttgart\n\nAls nicht eingetragen wird bekanntgemacht:\nDas Gericht beabsichtigt, die Gesellschaft wegen Vermögenslosigkeit im Handelsregister von Amts wegen nach § 394 FamFG zu löschen. Die Frist zur Geltendmachung eines Widerspruchs gegen die beabsichtigte Löschung ist auf zwei Monate ab Veröffentlichung bestimmt."
    },
    {
      "date": "2025-06-06",
      "id": "111492",
      "original_text": "Löschungsankündigung\nHamburg Amtsgericht Hamburg HRB 118946\nEurosole GmbH – Hamburg",
      "type": "Löschungsankündigung",
      "state": "Hamburg",
      "amtsgericht": "Amtsgericht Hamburg",
      "registernummer": "HRB 118946",
      "registerart": "HRB",
      "company_name": "Eurosole GmbH",
      "company_seat": "Hamburg",
      "details": "06.06.2025 (Bekanntmachungsdatum)\n\nHamburg Amtsgericht Hamburg HRB 118946\nLöschungsankündigung\n\nEurosole GmbH\nGesellschaft mit beschränkter Haftung\nHamburg\n\nDas Registergericht beabsichtigt, die im Handelsregister eingetragene Gesellschaft von Amts wegen nach § 394 FamFG zu löschen. Die Frist zur Erhebung eines Widerspruchs gegen die beabsichtigte Löschung wird auf 3 Monate festgesetzt."
    },
    {
      "date": "2025-06-06",
      "id": "111493",
      "original_text": "Löschungsankündigung\nHamburg Amtsgericht Hamburg HRB 121919\nYUTEX GmbH – Hamburg",
      "type": "Löschungsankündigung",
      "state": "Hamburg",
      "amtsgericht": "Amtsgericht Hamburg",
      "registernummer": "HRB 121919",
      "registerart": "HRB",
      "company_name": "YUTEX GmbH",
      "company_seat": "Hamburg",
      "details": "06.06.2025 (Bekanntmachungsdatum)\n\nHamburg Amtsgericht Hamburg HRB 121919\nLöschungsankündigung\n\nYUTEX GmbH\nGesellschaft mit beschränkter Haftung\nHamburg\n\nDas Registergericht beabsichtigt, die im Handelsregister eingetragene Gesellschaft von Amts wegen nach § 394 FamFG zu löschen. Die Frist zur Erhebung eines Widerspruchs gegen die beabsichtigte Löschung wird auf 3 Monate festgesetzt."
    },
    {
      "date": "2025-06-06",
      "id": "111494",
      "original_text": "Sonstige Registerbekanntmachung\nHamburg Amtsgericht Hamburg HRB 166040\nENERPARC Solar Invest 212 GmbH – Hamburg",
      "type": "Sonstige Registerbekanntmachung",
      "state": "Hamburg",
      "amtsgericht": "Amtsgericht Hamburg",
      "registernummer": "HRB 166040",
      "registerart": "HRB",
      "company_name": "ENERPARC Solar Invest 212 GmbH",
      "company_seat": "Hamburg",
      "details": "06.06.2025 (Bekanntmachungsdatum)\n\nHamburg Amtsgericht Hamburg HRB 166040\nSonstige Registerbekanntmachung 06.06.2025 (Eintragungsdatum)\n\nENERPARC Solar Invest 212 GmbH\nGesellschaft mit beschränkter Haftung\nHamburg\n\nAls nicht eingetragen wird bekannt gemacht:  Den Gläubigern der Gesellschaft, deren Forderungen begründet worden sind, bevor die Eintragung der Vertragsbeendigung in das Handelsregister nach § 10 HGB als bekannt gemacht gilt, ist vom anderen Vertragsteil Sicherheit zu leisten, wenn sie sich binnen 6 Monaten nach Bekanntmachung der Eintragung zu diesem Zweck bei ihm melden."
    },
    {
      "date": "2025-06-06",
      "id": "111495",
      "original_text": "Löschungsankündigung\nHamburg Amtsgericht Hamburg HRB 141008\nELLKOR UG (haftungsbeschränkt) – Hamburg",
      "type": "Löschungsankündigung",
      "state": "Hamburg",
      "amtsgericht": "Amtsgericht Hamburg",
      "registernummer": "HRB 141008",
      "registerart": "HRB",
      "company_name": "ELLKOR UG (haftungsbeschränkt)",
      "company_seat": "Hamburg",
      "details": "06.06.2025 (Bekanntmachungsdatum)\n\nHamburg Amtsgericht Hamburg HRB 141008\nLöschungsankündigung\n\nELLKOR UG (haftungsbeschränkt)\nGesellschaft mit beschränkter Haftung\nHamburg\n\nDas Registergericht beabsichtigt, die im Handelsregister eingetragene Gesellschaft von Amts wegen nach § 394 FamFG zu löschen. Die Frist zur Erhebung eines Widerspruchs gegen die beabsichtigte Löschung wird auf 3 Monate festgesetzt."
    },
    {
      "date": "2025-06-06",
      "id": "111496",
      "original_text": "Löschungsankündigung\nHamburg Amtsgericht Hamburg HRB 151500\nSalternas GmbH – Hamburg",
      "type": "Löschungsankündigung",
      "state": "Hamburg",
      "amtsgericht": "Amtsgericht Hamburg",
      "registernummer": "HRB 151500",
      "registerart": "HRB",
      "company_name": "Salternas GmbH",
      "company_seat": "Hamburg",
      "details": "06.06.2025 (Bekanntmachungsdatum)\n\nHamburg Amtsgericht Hamburg HRB 151500\nLöschungsankündigung\n\nSalternas GmbH\nGesellschaft mit beschränkter Haftung\nHamburg\n\nDas Registergericht beabsichtigt, die im Handelsregister eingetragene Gesellschaft von Amts wegen nach § 394 FamFG zu löschen. Die Frist zur Erhebung eines Widerspruchs gegen die beabsichtigte Löschung wird auf 3 Monate festgesetzt."
    },
    {
      "date": "2025-06-06",
      "id": "111497",
      "original_text": "Löschungsankündigung\nHamburg Amtsgericht Hamburg HRB 157836\nLuckaBox Logistics GmbH – Hamburg",
      "type": "Löschungsankündigung",
      "state": "Hamburg",
      "amtsgericht": "Amtsgericht Hamburg",
      "registernummer": "HRB 157836",
      "registerart": "HRB",
      "company_name": "LuckaBox Logistics GmbH",
      "company_seat": "Hamburg",
      "details": "06.06.2025 (Bekanntmachungsdatum)\n\nHamburg Amtsgericht Hamburg HRB 157836\nLöschungsankündigung\n\nLuckaBox Logistics GmbH\nGesellschaft mit beschränkter Haftung\nHamburg\n\nDas Registergericht beabsichtigt, die im Handelsregister eingetragene Gesellschaft von Amts wegen nach § 394 FamFG zu löschen. Die Frist zur Erhebung eines Widerspruchs gegen die beabsichtigte Löschung wird auf 3 Monate festgesetzt."
    },
    {
      "date": "2025-06-06",
      "id": "111498",
      "original_text": "Löschungsankündigung\nHamburg Amtsgericht Hamburg HRB 121845\nTotal Wind GmbH – Hamburg",
      "type": "Löschungsankündigung",
      "state": "Hamburg",
      "amtsgericht": "Amtsgericht Hamburg",
      "registernummer": "HRB 121845",
      "registerart": "HRB",
      "company_name": "Total Wind GmbH",
      "company_seat": "Hamburg",
      "details": "06.06.2025 (Bekanntmachungsdatum)\n\nHamburg Amtsgericht Hamburg HRB 121845\nLöschungsankündigung\n\nTotal Wind GmbH\nGesellschaft mit beschränkter Haftung\nHamburg\n\nDas Registergericht beabsichtigt, die im Handelsregister eingetragene Gesellschaft von Amts wegen nach § 394 FamFG zu löschen. Die Frist zur Erhebung eines Widerspruchs gegen die beabsichtigte Löschung wird auf 3 Monate festgesetzt."
    },
    {
      "date": "2025-06-06",
      "id": "111499",
      "original_text": "Löschungsankündigung\nHamburg Amtsgericht Hamburg HRB 131511\nSDH Hamburg GmbH – Hamburg",
      "type": "Löschungsankündigung",
      "state": "Hamburg",
      "amtsgericht": "Amtsgericht Hamburg",
      "registernummer": "HRB 131511",
      "registerart": "HRB",
      "company_name": "SDH Hamburg GmbH",
      "company_seat": "Hamburg",
      "details": "06.06.2025 (Bekanntmachungsdatum)\n\nHamburg Amtsgericht Hamburg HRB 131511\nLöschungsankündigung\n\nSDH Hamburg GmbH\nGesellschaft mit beschränkter Haftung\nHamburg\n\nDas Registergericht beabsichtigt, die im Handelsregister eingetragene Gesellschaft von Amts wegen nach § 394 FamFG zu löschen. Die Frist zur Erhebung eines Widerspruchs gegen die beabsichtigte Löschung wird auf 3 Monate festgesetzt."
    },
    {
      "date": "2025-06-06",
      "id": "111500",
      "original_text": "Löschungsankündigung\nHamburg Amtsgericht Hamburg HRB 151080\nShahnazi Dienstleistung GmbH – Hamburg",
      "type": "Löschungsankündigung",
      "state": "Hamburg",
      "amtsgericht": "Amtsgericht Hamburg",
      "registernummer": "HRB 151080",
      "registerart": "HRB",
      "company_name": "Shahnazi Dienstleistung GmbH",
      "company_seat": "Hamburg",
      "details": "06.06.2025 (Bekanntmachungsdatum)\n\nHamburg Amtsgericht Hamburg HRB 151080\nLöschungsankündigung\n\nShahnazi Dienstleistung GmbH\nGesellschaft mit beschränkter Haftung\nHamburg\n\nDas Registergericht beabsichtigt, die im Handelsregister eingetragene Gesellschaft von Amts wegen nach § 394 FamFG zu löschen. Die Frist zur Erhebung eines Widerspruchs gegen die beabsichtigte Löschung wird auf 3 Monate festgesetzt."
    },
    {
      "date": "2025-06-06",
      "id": "111501",
      "original_text": "Löschungsankündigung\nHamburg Amtsgericht Hamburg HRB 154505\nOurTribe GmbH – Hamburg",
      "type": "Löschungsankündigung",
      "state": "Hamburg",
      "amtsgericht": "Amtsgericht Hamburg",
      "registernummer": "HRB 154505",
      "registerart": "HRB",
      "company_name": "OurTribe GmbH",
      "company_seat": "Hamburg",
      "details": "06.06.2025 (Bekanntmachungsdatum)\n\nHamburg Amtsgericht Hamburg HRB 154505\nLöschungsankündigung\n\nOurTribe GmbH\nGesellschaft mit beschränkter Haftung\nHamburg\n\nDas Registergericht beabsichtigt, die im Handelsregister eingetragene Gesellschaft von Amts wegen nach § 394 FamFG zu löschen. Die Frist zur Erhebung eines Widerspruchs gegen die beabsichtigte Löschung wird auf 3 Monate festgesetzt."
    },
    {
      "date": "2025-06-06",
      "id": "111502",
      "original_text": "Löschungsankündigung\nThüringen Amtsgericht Jena HRB 506609\nBG AVest GmbH – Ebeleben",
      "type": "Löschungsankündigung",
      "state": "Thüringen",
      "amtsgericht": "Amtsgericht Jena",
      "registernummer": "HRB 506609",
      "registerart": "HRB",
      "company_name": "BG AVest GmbH",
      "company_seat": "Ebeleben",
      "details": "06.06.2025 (Bekanntmachungsdatum)\n\nThüringen Amtsgericht Jena HRB 506609\nLöschungsankündigung\n\nBG AVest GmbH\nGesellschaft mit beschränkter Haftung\nEbeleben\n\nDas Registergericht beabsichtigt, die im Handelsregister eingetragene Gesellschaft wegen Vermögenslosigkeit nach § 394 FamFG von Amts wegen zu löschen. Die Frist zur Erhebung eines Widerspruchs gegen die beabsichtigte Löschung wird auf 6 Wochen festgesetzt."
    },
    {
      "date": "2025-06-06",
      "id": "111503",
      "original_text": "Löschungsankündigung\nThüringen Amtsgericht Jena HRB 508355\nWolf-Brot GmbH – Bad Klosterlausnitz",
      "type": "Löschungsankündigung",
      "state": "Thüringen",
      "amtsgericht": "Amtsgericht Jena",
      "registernummer": "HRB 508355",
      "registerart": "HRB",
      "company_name": "Wolf-Brot GmbH",
      "company_seat": "Bad Klosterlausnitz",
      "details": "06.06.2025 (Bekanntmachungsdatum)\n\nThüringen Amtsgericht Jena HRB 508355\nLöschungsankündigung\n\nWolf-Brot GmbH\nGesellschaft mit beschränkter Haftung\nBad Klosterlausnitz\n\nDas Registergericht beabsichtigt, die im Handelsregister eingetragene Gesellschaft wegen Vermögenslosigkeit nach § 394 FamFG von Amts wegen zu löschen. Die Frist zur Erhebung eines Widerspruchs gegen die beabsichtigte Löschung wird auf 6 Wochen festgesetzt."
    },
    {
      "date": "2025-06-06",
      "id": "111504",
      "original_text": "Registerbekanntmachung nach dem Umwandlungsgesetz\nBaden-Württemberg Amtsgericht Stuttgart HRB 746616\ncf Fitness Esslingen GmbH – Esslingen",
      "type": "Registerbekanntmachung nach dem Umwandlungsgesetz",
      "state": "Baden-Württemberg",
      "amtsgericht": "Amtsgericht Stuttgart",
      "registernummer": "HRB 746616",
      "registerart": "HRB",
      "company_name": "cf Fitness Esslingen GmbH",
      "company_seat": "Esslingen",
      "details": "06.06.2025 (Bekanntmachungsdatum)\n\nBaden-Württemberg Amtsgericht Stuttgart HRB 746616\nRegisterbekanntmachung nach dem Umwandlungsgesetz 06.06.2025 (Eintragungsdatum)\n\ncf Fitness Esslingen GmbH\nGesellschaft mit beschränkter Haftung\nEsslingen\n\nAls nicht eingetragen wird bekanntgemacht:\nDen Gläubigern der an der Verschmelzung beteiligten Rechtsträger ist, wenn sie binnen sechs Monaten nach dem Tag, an dem die Eintragung der Verschmelzung in das Register des Sitzes desjenigen Rechtsträgers, dessen Gläubiger sie sind, nach § 19 Abs. 3 UmwG als bekanntgemacht gilt, ihren Anspruch nach Grund und Höhe schriftlich anmelden, Sicherheit zu leisten, soweit sie nicht Befriedigung verlangen können. Dieses Recht steht den Gläubigern jedoch nur zu, wenn sie glaubhaft machen, dass durch die Verschmelzung die Erfüllung ihrer Forderung gefährdet wird."
    },
    {
      "date": "2025-06-06",
      "id": "111505",
      "original_text": "Löschungsankündigung\nHamburg Amtsgericht Hamburg HRB 162678\nSMF Bau UG (haftungsbeschränkt) – Hamburg",
      "type": "Löschungsankündigung",
      "state": "Hamburg",
      "amtsgericht": "Amtsgericht Hamburg",
      "registernummer": "HRB 162678",
      "registerart": "HRB",
      "company_name": "SMF Bau UG (haftungsbeschränkt)",
      "company_seat": "Hamburg",
      "details": "06.06.2025 (Bekanntmachungsdatum)\n\nHamburg Amtsgericht Hamburg HRB 162678\nLöschungsankündigung\n\nSMF Bau UG (haftungsbeschränkt)\nGesellschaft mit beschränkter Haftung\nHamburg\n\nDas Registergericht beabsichtigt, die im Handelsregister eingetragene Gesellschaft von Amts wegen nach § 394 FamFG zu löschen. Die Frist zur Erhebung eines Widerspruchs gegen die beabsichtigte Löschung wird auf 3 Monate festgesetzt."
    },
    {
      "date": "2025-06-06",
      "id": "111506",
      "original_text": "Löschungsankündigung\nHamburg Amtsgericht Hamburg HRB 166529\nUNITED-POWER Personal GmbH – Hamburg",
      "type": "Löschungsankündigung",
      "state": "Hamburg",
      "amtsgericht": "Amtsgericht Hamburg",
      "registernummer": "HRB 166529",
      "registerart": "HRB",
      "company_name": "UNITED-POWER Personal GmbH",
      "company_seat": "Hamburg",
      "details": "06.06.2025 (Bekanntmachungsdatum)\n\nHamburg Amtsgericht Hamburg HRB 166529\nLöschungsankündigung\n\nUNITED-POWER Personal GmbH\nGesellschaft mit beschränkter Haftung\nHamburg\n\nDas Registergericht beabsichtigt, die im Handelsregister eingetragene Gesellschaft von Amts wegen nach § 394 FamFG zu löschen. Die Frist zur Erhebung eines Widerspruchs gegen die beabsichtigte Löschung wird auf 3 Monate festgesetzt."
    },
    {
      "date": "2025-06-06",
      "id": "111507",
      "original_text": "Löschungsankündigung\nHamburg Amtsgericht Hamburg HRB 177186\nW - Mann Dienstleistung GmbH – Hamburg",
      "type": "Löschungsankündigung",
      "state": "Hamburg",
      "amtsgericht": "Amtsgericht Hamburg",
      "registernummer": "HRB 177186",
      "registerart": "HRB",
      "company_name": "W - Mann Dienstleistung GmbH",
      "company_seat": "Hamburg",
      "details": "06.06.2025 (Bekanntmachungsdatum)\n\nHamburg Amtsgericht Hamburg HRB 177186\nLöschungsankündigung\n\nW - Mann Dienstleistung GmbH\nGesellschaft mit beschränkter Haftung\nHamburg\n\nDas Registergericht beabsichtigt, die im Handelsregister eingetragene Gesellschaft von Amts wegen nach § 394 FamFG zu löschen. Die Frist zur Erhebung eines Widerspruchs gegen die beabsichtigte Löschung wird auf 3 Monate festgesetzt."
    },
    {
      "date": "2025-06-06",
      "id": "111508",
      "original_text": "Löschungsankündigung\nHamburg Amtsgericht Hamburg HRB 165545\nNordic-Automobile cnr GmbH – Hamburg",
      "type": "Löschungsankündigung",
      "state": "Hamburg",
      "amtsgericht": "Amtsgericht Hamburg",
      "registernummer": "HRB 165545",
      "registerart": "HRB",
      "company_name": "Nordic-Automobile cnr GmbH",
      "company_seat": "Hamburg",
      "details": "06.06.2025 (Bekanntmachungsdatum)\n\nHamburg Amtsgericht Hamburg HRB 165545\nLöschungsankündigung\n\nNordic-Automobile cnr GmbH\nGesellschaft mit beschränkter Haftung\nHamburg\n\nDas Registergericht beabsichtigt, die im Handelsregister eingetragene Gesellschaft von Amts wegen nach § 394 FamFG zu löschen. Die Frist zur Erhebung eines Widerspruchs gegen die beabsichtigte Löschung wird auf 3 Monate festgesetzt."
    },
    {
      "date": "2025-06-06",
      "id": "111509",
      "original_text": "Löschungsankündigung\nHamburg Amtsgericht Hamburg HRB 169842\nVy Gastro UG (haftungsbeschränkt) – Hamburg",
      "type": "Löschungsankündigung",
      "state": "Hamburg",
      "amtsgericht": "Amtsgericht Hamburg",
      "registernummer": "HRB 169842",
      "registerart": "HRB",
      "company_name": "Vy Gastro UG (haftungsbeschränkt)",
      "company_seat": "Hamburg",
      "details": "06.06.2025 (Bekanntmachungsdatum)\n\nHamburg Amtsgericht Hamburg HRB 169842\nLöschungsankündigung\n\nVy Gastro UG (haftungsbeschränkt)\nGesellschaft mit beschränkter Haftung\nHamburg\n\nDas Registergericht beabsichtigt, die im Handelsregister eingetragene Gesellschaft von Amts wegen nach § 394 FamFG zu löschen. Die Frist zur Erhebung eines Widerspruchs gegen die beabsichtigte Löschung wird auf 3 Monate festgesetzt."
    },
    {
      "date": "2025-06-06",
      "id": "111510",
      "original_text": "Löschungsankündigung\nHamburg Amtsgericht Hamburg HRB 182385\nRT Invest 2 GmbH – Hamburg",
      "type": "Löschungsankündigung",
      "state": "Hamburg",
      "amtsgericht": "Amtsgericht Hamburg",
      "registernummer": "HRB 182385",
      "registerart": "HRB",
      "company_name": "RT Invest 2 GmbH",
      "company_seat": "Hamburg",
      "details": "06.06.2025 (Bekanntmachungsdatum)\n\nHamburg Amtsgericht Hamburg HRB 182385\nLöschungsankündigung\n\nRT Invest 2 GmbH\nGesellschaft mit beschränkter Haftung\nHamburg\n\nDas Registergericht beabsichtigt, die im Handelsregister eingetragene Gesellschaft von Amts wegen nach § 394 FamFG zu löschen. Die Frist zur Erhebung eines Widerspruchs gegen die beabsichtigte Löschung wird auf 3 Monate festgesetzt."
    },
    {
      "date": "2025-06-06",
      "id": "111511",
      "original_text": "Löschungsankündigung\nHamburg Amtsgericht Hamburg HRB 184787\nVC Gebäudereinigung GmbH – Hamburg",
      "type": "Löschungsankündigung",
      "state": "Hamburg",
      "amtsgericht": "Amtsgericht Hamburg",
      "registernummer": "HRB 184787",
      "registerart": "HRB",
      "company_name": "VC Gebäudereinigung GmbH",
      "company_seat": "Hamburg",
      "details": "06.06.2025 (Bekanntmachungsdatum)\n\nHamburg Amtsgericht Hamburg HRB 184787\nLöschungsankündigung\n\nVC Gebäudereinigung GmbH\nGesellschaft mit beschränkter Haftung\nHamburg\n\nDas Registergericht beabsichtigt, die im Handelsregister eingetragene Gesellschaft von Amts wegen nach § 394 FamFG zu löschen. Die Frist zur Erhebung eines Widerspruchs gegen die beabsichtigte Löschung wird auf 3 Monate festgesetzt."
    },
    {
      "date": "2025-06-06",
      "id": "111512",
      "original_text": "Sonstige Registerbekanntmachung\nBaden-Württemberg Amtsgericht Ulm HRB 739938\nTechnical Concept GmbH – Bad Saulgau",
      "type": "Sonstige Registerbekanntmachung",
      "state": "Baden-Württemberg",
      "amtsgericht": "Amtsgericht Ulm",
      "registernummer": "HRB 739938",
      "registerart": "HRB",
      "company_name": "Technical Concept GmbH",
      "company_seat": "Bad Saulgau",
      "details": "06.06.2025 (Bekanntmachungsdatum)\n\nBaden-Württemberg Amtsgericht Ulm HRB 739938\nSonstige Registerbekanntmachung 06.06.2025 (Eintragungsdatum)\n\nTechnical Concept GmbH\nGesellschaft mit beschränkter Haftung\nBad Saulgau\n\nAls nicht eingetragen wird bekanntgemacht:\nDen Gläubigern der Gesellschaft, deren Forderungen begründet worden sind, bevor die Eintragung der Beendigung des Vertrages in das Handelsregister nach § 10 HGB als bekanntgemacht gilt, ist vom anderen Vertragsteil Sicherheit zu leisten, wenn sie sich binnen sechs Monaten nach der Bekanntmachung zu diesem Zweck bei ihm melden."
    },
    {
      "date": "2025-06-06",
      "id": "111513",
      "original_text": "Löschungsankündigung\nHamburg Amtsgericht Hamburg HRA 122279\nWendlohstr. 141 Hamburg GmbH & Co. KG – Hamburg",
      "type": "Löschungsankündigung",
      "state": "Hamburg",
      "amtsgericht": "Amtsgericht Hamburg",
      "registernummer": "HRA 122279",
      "registerart": "HRA",
      "company_name": "Wendlohstr. 141 Hamburg GmbH & Co. KG",
      "company_seat": "Hamburg",
      "details": "06.06.2025 (Bekanntmachungsdatum)\n\nHamburg Amtsgericht Hamburg HRA 122279\nLöschungsankündigung\n\nWendlohstr. 141 Hamburg GmbH & Co. KG\nKommanditgesellschaft\nHamburg\n\nDas Registergericht beabsichtigt, die im Handelsregister eingetragene Gesellschaft von Amts wegen nach § 394 FamFG zu löschen. Die Frist zur Erhebung eines Widerspruchs gegen die beabsichtigte Löschung wird auf 3 Monate festgesetzt."
    },
    {
      "date": "2025-06-06",
      "id": "111514",
      "original_text": "Löschungsankündigung\nHamburg Amtsgericht Hamburg HRA 115330\nLa Grande Maison de Maxine GmbH & Co. KG – Hamburg",
      "type": "Löschungsankündigung",
      "state": "Hamburg",
      "amtsgericht": "Amtsgericht Hamburg",
      "registernummer": "HRA 115330",
      "registerart": "HRA",
      "company_name": "La Grande Maison de Maxine GmbH & Co. KG",
      "company_seat": "Hamburg",
      "details": "06.06.2025 (Bekanntmachungsdatum)\n\nHamburg Amtsgericht Hamburg HRA 115330\nLöschungsankündigung\n\nLa Grande Maison de Maxine GmbH & Co. KG\nKommanditgesellschaft\nHamburg\n\nDas Registergericht beabsichtigt, die im Handelsregister eingetragene Gesellschaft von Amts wegen nach § 394 FamFG zu löschen. Die Frist zur Erhebung eines Widerspruchs gegen die beabsichtigte Löschung wird auf 3 Monate festgesetzt."
    },
    {
      "date": "2025-06-06",
      "id": "111515",
      "original_text": "Löschungsankündigung\nHamburg Amtsgericht Hamburg VR 17790\nDeutscher Bildungs- und Fortbildungsring e.V. – Hamburg",
      "type": "Löschungsankündigung",
      "state": "Hamburg",
      "amtsgericht": "Amtsgericht Hamburg",
      "registernummer": "VR 17790",
      "registerart": "VR",
      "company_name": "Deutscher Bildungs- und Fortbildungsring e.V.",
      "company_seat": "Hamburg",
      "details": "06.06.2025 (Bekanntmachungsdatum)\n\nHamburg Amtsgericht Hamburg VR 17790\nLöschungsankündigung\n\nDeutscher Bildungs- und Fortbildungsring e.V.\neingetragener Verein\nHamburg\n\nDas Registergericht beabsichtigt, den im Vereinsregister eingetragenen Verein von Amts wegen nach § 395 FamFG zu löschen, da nach den angestellten  Ermittlungen dieser Verein offenbar nicht mehr besteht. Die Frist zur Erhebung eines Widerspruchs gegen die beabsichtigte Löschung wird auf 3 Monate festgesetzt."
    },
    {
      "date": "2025-06-06",
      "id": "111516",
      "original_text": "Registerbekanntmachung nach dem Umwandlungsgesetz\nBerlin Amtsgericht Berlin (Charlottenburg) HRB 107173\nMHMI Immobilien-Verwaltungen GmbH – Berlin",
      "type": "Registerbekanntmachung nach dem Umwandlungsgesetz",
      "state": "Berlin",
      "amtsgericht": "Amtsgericht Berlin (Charlottenburg)",
      "registernummer": "HRB 107173",
      "registerart": "HRB",
      "company_name": "MHMI Immobilien-Verwaltungen GmbH",
      "company_seat": "Berlin",
      "details": "06.06.2025 (Bekanntmachungsdatum)\n\nBerlin Amtsgericht Berlin (Charlottenburg) HRB 107173\nRegisterbekanntmachung nach dem Umwandlungsgesetz 05.06.2025 (Eintragungsdatum)\n\nMHMI Immobilien-Verwaltungen GmbH\nGesellschaft mit beschränkter Haftung\nBerlin\n\nZu Eintragungsnummer 5 vom 05.06.2025 wird als nicht eingetragen veröffentlicht: Den Gläubigern der an der Verschmelzung beteiligten Rechtsträger ist, wenn sie binnen sechs Monaten nach dem Tag, an dem die Eintragung der Verschmelzung in das Register des Sitzes desjenigen Rechtsträgers, dessen Gläubiger sie sind, als bekannt gemacht gilt, ihren Anspruch nach Grund und Höhe schriftlich anmelden, Sicherheit zu leisten, soweit sie nicht Befriedigung verlangen können. Dieses Recht steht den Gläubigern jedoch nur zu, wenn sie glaubhaft machen, dass durch die Verschmelzung die Erfüllung ihrer Forderung gefährdet wird. Das Recht, Sicherheitsleistung zu verlangen, steht Gläubigern nicht zu, die im Falle der Insolvenz ein Recht auf vorzugsweise Befriedigung aus einer Deckungsmasse haben, die nach gesetzlicher Vorschrift zu ihrem Schutz errichtet und staatlich überwacht ist."
    },
    {
      "date": "2025-06-06",
      "id": "111517",
      "original_text": "Registerbekanntmachung nach dem Umwandlungsgesetz\nBrandenburg Amtsgericht Neuruppin HRA 3922\nTorsten Affeldt Wind Güstow GmbH & Co. KG – Prenzlau",
      "type": "Registerbekanntmachung nach dem Umwandlungsgesetz",
      "state": "Brandenburg",
      "amtsgericht": "Amtsgericht Neuruppin",
      "registernummer": "HRA 3922",
      "registerart": "HRA",
      "company_name": "Torsten Affeldt Wind Güstow GmbH & Co. KG",
      "company_seat": "Prenzlau",
      "details": "06.06.2025 (Bekanntmachungsdatum)\n\nBrandenburg Amtsgericht Neuruppin HRA 3922\nRegisterbekanntmachung nach dem Umwandlungsgesetz 05.06.2025 (Eintragungsdatum)\n\nTorsten Affeldt Wind Güstow GmbH & Co. KG\nKommanditgesellschaft\nPrenzlau\n\nZu Eintragungsnummer 2 vom 05.06.2025 wird als nicht eingetragen veröffentlicht:\nDen Gläubigern der an der Umwandlung beteiligten Rechtsträger ist, wenn sie binnen sechs Monaten nach dem Tag, an dem die Eintragung der Umwandlung in das Register des Sitzes desjenigen Rechtsträgers, dessen Gläubiger sie sind, als bekannt gemacht gilt, ihren Anspruch nach Grund und Höhe schriftlich anmelden, Sicherheit zu leisten, soweit sie nicht Befriedigung verlangen können. Dieses Recht steht den Gläubigern jedoch nur zu, wenn sie glaubhaft machen, dass durch die Umwandlung die Erfüllung ihrer Forderung gefährdet wird"
    },
    {
      "date": "2025-06-06",
      "id": "111518",
      "original_text": "Registerbekanntmachung nach dem Umwandlungsgesetz\nBerlin Amtsgericht Berlin (Charlottenburg) HRB 206465\nS + P Planen und Bauen GmbH – Berlin",
      "type": "Registerbekanntmachung nach dem Umwandlungsgesetz",
      "state": "Berlin",
      "amtsgericht": "Amtsgericht Berlin (Charlottenburg)",
      "registernummer": "HRB 206465",
      "registerart": "HRB",
      "company_name": "S + P Planen und Bauen GmbH",
      "company_seat": "Berlin",
      "details": "06.06.2025 (Bekanntmachungsdatum)\n\nBerlin Amtsgericht Berlin (Charlottenburg) HRB 206465\nRegisterbekanntmachung nach dem Umwandlungsgesetz 05.06.2025 (Eintragungsdatum)\n\nS + P Planen und Bauen GmbH\nGesellschaft mit beschränkter Haftung\nBerlin\n\nZu Eintragungsnummer 5 vom 05.06.2025 wird als nicht eingetragen veröffentlicht: Den Gläubigern der an der Verschmelzung beteiligten Rechtsträger ist, wenn sie binnen sechs Monaten nach dem Tag, an dem die Eintragung der Verschmelzung in das Register des Sitzes desjenigen Rechtsträgers, dessen Gläubiger sie sind, als bekannt gemacht gilt, ihren Anspruch nach Grund und Höhe schriftlich anmelden, Sicherheit zu leisten, soweit sie nicht Befriedigung verlangen können. Dieses Recht steht den Gläubigern jedoch nur zu, wenn sie glaubhaft machen, dass durch die Verschmelzung die Erfüllung ihrer Forderung gefährdet wird. Das Recht, Sicherheitsleistung zu verlangen, steht Gläubigern nicht zu, die im Falle der Insolvenz ein Recht auf vorzugsweise Befriedigung aus einer Deckungsmasse haben, die nach gesetzlicher Vorschrift zu ihrem Schutz errichtet und staatlich überwacht ist."
    },
    {
      "date": "2025-06-06",
      "id": "111519",
      "original_text": "Registerbekanntmachung nach dem Umwandlungsgesetz\nBerlin Amtsgericht Berlin (Charlottenburg) PR 315\nvon Arps-Aubert + Partner Steuerberatungsgesellschaft mbB – Berlin",
      "type": "Registerbekanntmachung nach dem Umwandlungsgesetz",
      "state": "Berlin",
      "amtsgericht": "Amtsgericht Berlin (Charlottenburg)",
      "registernummer": "PR 315",
      "registerart": "PR",
      "company_name": "von Arps-Aubert + Partner Steuerberatungsgesellschaft mbB",
      "company_seat": "Berlin",
      "details": "06.06.2025 (Bekanntmachungsdatum)\n\nBerlin Amtsgericht Berlin (Charlottenburg) PR 315\nRegisterbekanntmachung nach dem Umwandlungsgesetz 05.06.2025 (Eintragungsdatum)\n\nvon Arps-Aubert + Partner Steuerberatungsgesellschaft mbB\nPartnerschaftsgesellschaft\nBerlin\n\nZu Eintragungsnummer 6 vom 05.06.2025 wird als nicht eingetragen veröffentlicht: Den Gläubigern ist, wenn sie binnen sechs Monaten nach dem Tag, an dem die Eintragung der Umwandlung als bekannt gemacht gilt, ihren Anspruch nach Grund und Höhe schriftlich anmelden, Sicherheit zu leisten, soweit sie nicht Befriedigung verlangen können. Dieses Recht steht den Gläubigern jedoch nur zu, wenn sie glaubhaft machen, dass durch die Umwandlung die Erfüllung ihrer Forderung gefährdet wird. Das Recht, Sicherheitsleistung zu verlangen, steht Gläubigern nicht zu, die im Falle der Insolvenz ein Recht auf vorzugsweise Befriedigung aus einer Deckungsmasse haben, die nach gesetzlicher Vorschrift zu ihrem Schutz errichtet und staatlich überwacht ist."
    },
    {
      "date": "2025-06-06",
      "id": "111520",
      "original_text": "Registerbekanntmachung nach dem Umwandlungsgesetz\nBerlin Amtsgericht Berlin (Charlottenburg) HRB 275801\nvon Arps-Aubert Steuerberatung GmbH – Berlin",
      "type": "Registerbekanntmachung nach dem Umwandlungsgesetz",
      "state": "Berlin",
      "amtsgericht": "Amtsgericht Berlin (Charlottenburg)",
      "registernummer": "HRB 275801",
      "registerart": "HRB",
      "company_name": "von Arps-Aubert Steuerberatung GmbH",
      "company_seat": "Berlin",
      "details": "06.06.2025 (Bekanntmachungsdatum)\n\nBerlin Amtsgericht Berlin (Charlottenburg) HRB 275801\nRegisterbekanntmachung nach dem Umwandlungsgesetz 05.06.2025 (Eintragungsdatum)\n\nvon Arps-Aubert Steuerberatung GmbH\nGesellschaft mit beschränkter Haftung\nBerlin\n\nZu Eintragungsnummer 1 vom 05.06.2025 wird als nicht eingetragen veröffentlicht: Den Gläubigern ist, wenn sie binnen sechs Monaten nach dem Tag, an dem die Eintragung der Umwandlung als bekannt gemacht gilt, ihren Anspruch nach Grund und Höhe schriftlich anmelden, Sicherheit zu leisten, soweit sie nicht Befriedigung verlangen können. Dieses Recht steht den Gläubigern jedoch nur zu, wenn sie glaubhaft machen, dass durch die Umwandlung die Erfüllung ihrer Forderung gefährdet wird. Das Recht, Sicherheitsleistung zu verlangen, steht Gläubigern nicht zu, die im Falle der Insolvenz ein Recht auf vorzugsweise Befriedigung aus einer Deckungsmasse haben, die nach gesetzlicher Vorschrift zu ihrem Schutz errichtet und staatlich überwacht ist."
    },
    {
      "date": "2025-06-06",
      "id": "111521",
      "original_text": "Registerbekanntmachung nach dem Umwandlungsgesetz\nBerlin Amtsgericht Berlin (Charlottenburg) HRB 151680\nMirans Technologie GmbH – Berlin",
      "type": "Registerbekanntmachung nach dem Umwandlungsgesetz",
      "state": "Berlin",
      "amtsgericht": "Amtsgericht Berlin (Charlottenburg)",
      "registernummer": "HRB 151680",
      "registerart": "HRB",
      "company_name": "Mirans Technologie GmbH",
      "company_seat": "Berlin",
      "details": "06.06.2025 (Bekanntmachungsdatum)\n\nBerlin Amtsgericht Berlin (Charlottenburg) HRB 151680\nRegisterbekanntmachung nach dem Umwandlungsgesetz 05.06.2025 (Eintragungsdatum)\n\nMirans Technologie GmbH\nGesellschaft mit beschränkter Haftung\nBerlin\n\nZu Eintragungsnummer 5 vom 05.06.2025 wird als nicht eingetragen veröffentlicht:\nDen Gläubigern ist, wenn sie binnen sechs Monaten nach dem Tag, an dem die Eintragung der Umwandlung als bekannt gemacht gilt, ihren Anspruch nach Grund und Höhe schriftlich anmelden, Sicherheit zu leisten, soweit sie nicht Befriedigung verlangen können. Dieses Recht steht den Gläubigern jedoch nur zu, wenn sie glaubhaft machen, dass durch die Umwandlung die Erfüllung ihrer Forderung gefährdet wird. Das Recht, Sicherheitsleistung zu verlangen, steht Gläubigern nicht zu, die im Falle der Insolvenz ein Recht auf vorzugsweise Befriedigung aus einer Deckungsmasse haben, die nach gesetzlicher Vorschrift zu ihrem Schutz errichtet und staatlich überwacht ist."
    },
    {
      "date": "2025-06-06",
      "id": "111522",
      "original_text": "Registerbekanntmachung nach dem Umwandlungsgesetz\nBrandenburg Amtsgericht Cottbus HRA 2424\nSascha Kaden e.K. – Königs Wusterhausen",
      "type": "Registerbekanntmachung nach dem Umwandlungsgesetz",
      "state": "Brandenburg",
      "amtsgericht": "Amtsgericht Cottbus",
      "registernummer": "HRA 2424",
      "registerart": "HRA",
      "company_name": "Sascha Kaden e.K.",
      "company_seat": "Königs Wusterhausen",
      "details": "06.06.2025 (Bekanntmachungsdatum)\n\nBrandenburg Amtsgericht Cottbus HRA 2424\nRegisterbekanntmachung nach dem Umwandlungsgesetz 05.06.2025 (Eintragungsdatum)\n\nSascha Kaden e.K.\nEinzelkaufmann / Einzelkauffrau\nKönigs Wusterhausen\n\nAls nicht eingetragen wird veröffentlicht:\nDen Gläubigern der an der Spaltung beteiligten Rechtsträger ist, wenn sie binnen sechs Monaten nach dem Tag, an dem die Eintragung der Spaltung in das Register des Sitzes desjenigen Rechtsträgers, dessen Gläubiger sie sind, als bekannt gemacht gilt, ihren Anspruch nach Grund und Höhe schriftlich anmelden, Sicherheit zu leisten, soweit sie nicht Befriedigung verlangen können. Dieses Recht steht den Gläubigern jedoch nur zu, wenn sie glaubhaft machen, dass durch die Spaltung die Erfüllung ihrer Forderung gefährdet wird"
    },
    {
      "date": "2025-06-06",
      "id": "111523",
      "original_text": "Registerbekanntmachung nach dem Umwandlungsgesetz\nBerlin Amtsgericht Berlin (Charlottenburg) HRA 64335\nMirans Technologie GmbH & Co. KG – Berlin",
      "type": "Registerbekanntmachung nach dem Umwandlungsgesetz",
      "state": "Berlin",
      "amtsgericht": "Amtsgericht Berlin (Charlottenburg)",
      "registernummer": "HRA 64335",
      "registerart": "HRA",
      "company_name": "Mirans Technologie GmbH & Co. KG",
      "company_seat": "Berlin",
      "details": "06.06.2025 (Bekanntmachungsdatum)\n\nBerlin Amtsgericht Berlin (Charlottenburg) HRA 64335\nRegisterbekanntmachung nach dem Umwandlungsgesetz 05.06.2025 (Eintragungsdatum)\n\nMirans Technologie GmbH & Co. KG\nKommanditgesellschaft\nBerlin\n\nZu Eintragungsnummer 1 vom 05.06.2025 wird als nicht eingetragen veröffentlicht:\nDen Gläubigern ist, wenn sie binnen sechs Monaten nach dem Tag, an dem die Eintragung der Umwandlung als bekannt gemacht gilt, ihren Anspruch nach Grund und Höhe schriftlich anmelden, Sicherheit zu leisten, soweit sie nicht Befriedigung verlangen können. Dieses Recht steht den Gläubigern jedoch nur zu, wenn sie glaubhaft machen, dass durch die Umwandlung die Erfüllung ihrer Forderung gefährdet wird. Das Recht, Sicherheitsleistung zu verlangen, steht Gläubigern nicht zu, die im Falle der Insolvenz ein Recht auf vorzugsweise Befriedigung aus einer Deckungsmasse haben, die nach gesetzlicher Vorschrift zu ihrem Schutz errichtet und staatlich überwacht ist."
    },
    {
      "date": "2025-06-06",
      "id": "111524",
      "original_text": "Registerbekanntmachung nach dem Umwandlungsgesetz\nBerlin Amtsgericht Berlin (Charlottenburg) HRB 217766\nMHMI Vehlefanz GmbH – Berlin",
      "type": "Registerbekanntmachung nach dem Umwandlungsgesetz",
      "state": "Berlin",
      "amtsgericht": "Amtsgericht Berlin (Charlottenburg)",
      "registernummer": "HRB 217766",
      "registerart": "HRB",
      "company_name": "MHMI Vehlefanz GmbH",
      "company_seat": "Berlin",
      "details": "06.06.2025 (Bekanntmachungsdatum)\n\nBerlin Amtsgericht Berlin (Charlottenburg) HRB 217766\nRegisterbekanntmachung nach dem Umwandlungsgesetz 05.06.2025 (Eintragungsdatum)\n\nMHMI Vehlefanz GmbH\nGesellschaft mit beschränkter Haftung\nBerlin\n\nZu Eintragungsnummer 2 vom 05.06.2025 wird als nicht eingetragen veröffentlicht: Den Gläubigern der an der Verschmelzung beteiligten Rechtsträger ist, wenn sie binnen sechs Monaten nach dem Tag, an dem die Eintragung der Verschmelzung in das Register des Sitzes desjenigen Rechtsträgers, dessen Gläubiger sie sind, als bekannt gemacht gilt, ihren Anspruch nach Grund und Höhe schriftlich anmelden, Sicherheit zu leisten, soweit sie nicht Befriedigung verlangen können. Dieses Recht steht den Gläubigern jedoch nur zu, wenn sie glaubhaft machen, dass durch die Verschmelzung die Erfüllung ihrer Forderung gefährdet wird. Das Recht, Sicherheitsleistung zu verlangen, steht Gläubigern nicht zu, die im Falle der Insolvenz ein Recht auf vorzugsweise Befriedigung aus einer Deckungsmasse haben, die nach gesetzlicher Vorschrift zu ihrem Schutz errichtet und staatlich überwacht ist."
    },
    {
      "date": "2025-06-06",
      "id": "111525",
      "original_text": "Registerbekanntmachung nach dem Umwandlungsgesetz\nSchleswig-Holstein Amtsgericht Pinneberg HRB 6187\nLandgard Nord Obst & Gemüse GmbH – Kronprinzenkoog",
      "type": "Registerbekanntmachung nach dem Umwandlungsgesetz",
      "state": "Schleswig-Holstein",
      "amtsgericht": "Amtsgericht Pinneberg",
      "registernummer": "HRB 6187",
      "registerart": "HRB",
      "company_name": "Landgard Nord Obst & Gemüse GmbH",
      "company_seat": "Kronprinzenkoog",
      "details": "06.06.2025 (Bekanntmachungsdatum)\n\nSchleswig-Holstein Amtsgericht Pinneberg HRB 6187\nRegisterbekanntmachung nach dem Umwandlungsgesetz 03.06.2025 (Eintragungsdatum)\n\nLandgard Nord Obst & Gemüse GmbH\nGesellschaft mit beschränkter Haftung\nKronprinzenkoog\n\nZu Eintragungsnummer 23 vom 03.06.2025 wird als nicht eingetragen veröffentlicht:  Als nicht eingetragen wird veröffentlicht: Den Gläubigern der an der Verschmelzung beteiligten Rechtsträger ist, wenn sie binnen sechs Monaten nach dem Tag, an dem die Eintragung der Verschmelzung in das Register des Sitzes desjenigen Rechtsträgers, dessen Gläubiger sie sind, als bekannt gemacht gilt, ihren Anspruch nach Grund und Höhe schriftlich anmelden, Sicherheit zu leisten, soweit sie nicht Befriedigung verlangen können. Dieses Recht steht den Gläubigern jedoch nur zu, wenn sie glaubhaft machen, dass durch die Verschmelzung die Erfüllung ihrer Forderung gefährdet wird. Das Recht, Sicherheitsleistung zu verlangen, steht Gläubigern nicht zu, die im Falle der Insolvenz ein Recht auf vorzugsweise Befriedigung aus einer Deckungsmasse haben, die nach gesetzlicher Vorschrift zu ihrem Schutz errichtet und staatlich überwacht ist."
    },
    {
      "date": "2025-06-06",
      "id": "111526",
      "original_text": "Löschungsankündigung\nBerlin Amtsgericht Berlin (Charlottenburg) HRB 211999\njme bau berlin GmbH – Berlin",
      "type": "Löschungsankündigung",
      "state": "Berlin",
      "amtsgericht": "Amtsgericht Berlin (Charlottenburg)",
      "registernummer": "HRB 211999",
      "registerart": "HRB",
      "company_name": "jme bau berlin GmbH",
      "company_seat": "Berlin",
      "details": "06.06.2025 (Bekanntmachungsdatum)\n\nBerlin Amtsgericht Berlin (Charlottenburg) HRB 211999\nLöschungsankündigung\n\njme bau berlin GmbH\nGesellschaft mit beschränkter Haftung\nBerlin\n\nBei der nachstehenden Gesellschaft wird das Amtslöschungsverfahren gemäß § 394 FamFG eingeleitet. Widerspruchsfrist 6 Wochen"
    },
    {
      "date": "2025-06-06",
      "id": "111527",
      "original_text": "Löschungsankündigung\nHamburg Amtsgericht Hamburg HRA 7282\nWolff & Olsen GmbH & Co. KG – Hamburg",
      "type": "Löschungsankündigung",
      "state": "Hamburg",
      "amtsgericht": "Amtsgericht Hamburg",
      "registernummer": "HRA 7282",
      "registerart": "HRA",
      "company_name": "Wolff & Olsen GmbH & Co. KG",
      "company_seat": "Hamburg",
      "details": "06.06.2025 (Bekanntmachungsdatum)\n\nHamburg Amtsgericht Hamburg HRA 7282\nLöschungsankündigung\n\nWolff & Olsen GmbH & Co. KG\nKommanditgesellschaft\nHamburg\n\nDas Registergericht beabsichtigt, die im Handelsregister eingetragene Firma von Amts wegen nach § 31 Abs. 2 HBG zu löschen. Die Frist zur Erhebung eines Widerspruchs gegen die beabsichtigte Löschung wird auf 3 Monate festgesetzt."
    },
    {
      "date": "2025-06-06",
      "id": "111528",
      "original_text": "Einreichung neuer Dokumente\nBerlin Amtsgericht Berlin (Charlottenburg) HRB 221404\nPeriskop Partners AG – Berlin",
      "type": "Einreichung neuer Dokumente",
      "state": "Berlin",
      "amtsgericht": "Amtsgericht Berlin (Charlottenburg)",
      "registernummer": "HRB 221404",
      "registerart": "HRB",
      "company_name": "Periskop Partners AG",
      "company_seat": "Berlin",
      "details": "06.06.2025 (Bekanntmachungsdatum)\n\nBerlin Amtsgericht Berlin (Charlottenburg) HRB 221404\nEinreichung neuer Dokumente\n\nPeriskop Partners AG\nAktiengesellschaft\nBerlin\n\nAls nicht eingetragen wird veröffentlicht:Es wurde eine neue Liste der Aufsichtsratsmitglieder eingereicht (§ 106 AktG)."
    },
    {
      "date": "2025-06-06",
      "id": "111529",
      "original_text": "Löschungsankündigung\nHamburg Amtsgericht Hamburg HRB 84823\nNexusNova GmbH – Hamburg",
      "type": "Löschungsankündigung",
      "state": "Hamburg",
      "amtsgericht": "Amtsgericht Hamburg",
      "registernummer": "HRB 84823",
      "registerart": "HRB",
      "company_name": "NexusNova GmbH",
      "company_seat": "Hamburg",
      "details": "06.06.2025 (Bekanntmachungsdatum)\n\nHamburg Amtsgericht Hamburg HRB 84823\nLöschungsankündigung\n\nNexusNova GmbH\nGesellschaft mit beschränkter Haftung\nHamburg\n\nDas Registergericht beabsichtigt, die im Handelsregister eingetragene Gesellschaft von Amts wegen nach § 394 FamFG zu löschen. Die Frist zur Erhebung eines Widerspruchs gegen die beabsichtigte Löschung wird auf 3 Monate festgesetzt."
    },
    {
      "date": "2025-06-06",
      "id": "111530",
      "original_text": "Löschungsankündigung\nHamburg Amtsgericht Hamburg HRB 158231\nSino-European Design GmbH – Hamburg",
      "type": "Löschungsankündigung",
      "state": "Hamburg",
      "amtsgericht": "Amtsgericht Hamburg",
      "registernummer": "HRB 158231",
      "registerart": "HRB",
      "company_name": "Sino-European Design GmbH",
      "company_seat": "Hamburg",
      "details": "06.06.2025 (Bekanntmachungsdatum)\n\nHamburg Amtsgericht Hamburg HRB 158231\nLöschungsankündigung\n\nSino-European Design GmbH\nGesellschaft mit beschränkter Haftung\nHamburg\n\nDas Registergericht beabsichtigt, die im Handelsregister eingetragene Gesellschaft von Amts wegen nach § 394 FamFG zu löschen. Die Frist zur Erhebung eines Widerspruchs gegen die beabsichtigte Löschung wird auf 3 Monate festgesetzt."
    },
    {
      "date": "2025-06-06",
      "id": "111531",
      "original_text": "Löschungsankündigung\nHamburg Amtsgericht Hamburg HRB 170629\nKS Plankonzept GmbH – Hamburg",
      "type": "Löschungsankündigung",
      "state": "Hamburg",
      "amtsgericht": "Amtsgericht Hamburg",
      "registernummer": "HRB 170629",
      "registerart": "HRB",
      "company_name": "KS Plankonzept GmbH",
      "company_seat": "Hamburg",
      "details": "06.06.2025 (Bekanntmachungsdatum)\n\nHamburg Amtsgericht Hamburg HRB 170629\nLöschungsankündigung\n\nKS Plankonzept GmbH\nGesellschaft mit beschränkter Haftung\nHamburg\n\nDas Registergericht beabsichtigt, die im Handelsregister eingetragene Gesellschaft von Amts wegen nach § 394 FamFG zu löschen. Die Frist zur Erhebung eines Widerspruchs gegen die beabsichtigte Löschung wird auf 3 Monate festgesetzt."
    },
    {
      "date": "2025-06-06",
      "id": "111532",
      "original_text": "Löschungsankündigung\nHamburg Amtsgericht Hamburg HRB 123700\nPaule Ka Germany GmbH – Hamburg",
      "type": "Löschungsankündigung",
      "state": "Hamburg",
      "amtsgericht": "Amtsgericht Hamburg",
      "registernummer": "HRB 123700",
      "registerart": "HRB",
      "company_name": "Paule Ka Germany GmbH",
      "company_seat": "Hamburg",
      "details": "06.06.2025 (Bekanntmachungsdatum)\n\nHamburg Amtsgericht Hamburg HRB 123700\nLöschungsankündigung\n\nPaule Ka Germany GmbH\nGesellschaft mit beschränkter Haftung\nHamburg\n\nDas Registergericht beabsichtigt, die im Handelsregister eingetragene Gesellschaft von Amts wegen nach § 394 FamFG zu löschen. Die Frist zur Erhebung eines Widerspruchs gegen die beabsichtigte Löschung wird auf 3 Monate festgesetzt."
    },
    {
      "date": "2025-06-06",
      "id": "111533",
      "original_text": "Löschungsankündigung\nHamburg Amtsgericht Hamburg HRB 167015\nNord Light GmbH – Hamburg",
      "type": "Löschungsankündigung",
      "state": "Hamburg",
      "amtsgericht": "Amtsgericht Hamburg",
      "registernummer": "HRB 167015",
      "registerart": "HRB",
      "company_name": "Nord Light GmbH",
      "company_seat": "Hamburg",
      "details": "06.06.2025 (Bekanntmachungsdatum)\n\nHamburg Amtsgericht Hamburg HRB 167015\nLöschungsankündigung\n\nNord Light GmbH\nGesellschaft mit beschränkter Haftung\nHamburg\n\nDas Registergericht beabsichtigt, die im Handelsregister eingetragene Gesellschaft von Amts wegen nach § 394 FamFG zu löschen. Die Frist zur Erhebung eines Widerspruchs gegen die beabsichtigte Löschung wird auf 3 Monate festgesetzt."
    },
    {
      "date": "2025-06-06",
      "id": "111534",
      "original_text": "Löschungsankündigung\nHamburg Amtsgericht Hamburg HRB 178904\nNord INDEX GmbH – Hamburg",
      "type": "Löschungsankündigung",
      "state": "Hamburg",
      "amtsgericht": "Amtsgericht Hamburg",
      "registernummer": "HRB 178904",
      "registerart": "HRB",
      "company_name": "Nord INDEX GmbH",
      "company_seat": "Hamburg",
      "details": "06.06.2025 (Bekanntmachungsdatum)\n\nHamburg Amtsgericht Hamburg HRB 178904\nLöschungsankündigung\n\nNord INDEX GmbH\nGesellschaft mit beschränkter Haftung\nHamburg\n\nDas Registergericht beabsichtigt, die im Handelsregister eingetragene Gesellschaft von Amts wegen nach § 394 FamFG zu löschen. Die Frist zur Erhebung eines Widerspruchs gegen die beabsichtigte Löschung wird auf 3 Monate festgesetzt."
    },
    {
      "date": "2025-06-06",
      "id": "111535",
      "original_text": "Löschungsankündigung\nBerlin Amtsgericht Berlin (Charlottenburg) HRB 261297\nImmpulsbau GmbH – Berlin",
      "type": "Löschungsankündigung",
      "state": "Berlin",
      "amtsgericht": "Amtsgericht Berlin (Charlottenburg)",
      "registernummer": "HRB 261297",
      "registerart": "HRB",
      "company_name": "Immpulsbau GmbH",
      "company_seat": "Berlin",
      "details": "06.06.2025 (Bekanntmachungsdatum)\n\nBerlin Amtsgericht Berlin (Charlottenburg) HRB 261297\nLöschungsankündigung\n\nImmpulsbau GmbH\nGesellschaft mit beschränkter Haftung\nBerlin\n\nBei der nachstehenden Gesellschaft wird das Amtslöschungsverfahren gemäß § 394 FamFG eingeleitet. Widerspruchsfrist\n6 Wochen."
    },
    {
      "date": "2025-06-06",
      "id": "111536",
      "original_text": "Löschungsankündigung\nHamburg Amtsgericht Hamburg HRB 183035\nKC Page Services & IT GmbH – Hamburg",
      "type": "Löschungsankündigung",
      "state": "Hamburg",
      "amtsgericht": "Amtsgericht Hamburg",
      "registernummer": "HRB 183035",
      "registerart": "HRB",
      "company_name": "KC Page Services & IT GmbH",
      "company_seat": "Hamburg",
      "details": "06.06.2025 (Bekanntmachungsdatum)\n\nHamburg Amtsgericht Hamburg HRB 183035\nLöschungsankündigung\n\nKC Page Services & IT GmbH\nGesellschaft mit beschränkter Haftung\nHamburg\n\nDas Registergericht beabsichtigt, die im Handelsregister eingetragene Gesellschaft von Amts wegen nach § 394 FamFG zu löschen. Die Frist zur Erhebung eines Widerspruchs gegen die beabsichtigte Löschung wird auf 3 Monate festgesetzt."
    },
    {
      "date": "2025-06-06",
      "id": "111537",
      "original_text": "Registerbekanntmachung nach dem Umwandlungsgesetz\nHamburg Amtsgericht Hamburg HRB 168273\nRamboll Deutschland GmbH – Hamburg",
      "type": "Registerbekanntmachung nach dem Umwandlungsgesetz",
      "state": "Hamburg",
      "amtsgericht": "Amtsgericht Hamburg",
      "registernummer": "HRB 168273",
      "registerart": "HRB",
      "company_name": "Ramboll Deutschland GmbH",
      "company_seat": "Hamburg",
      "details": "06.06.2025 (Bekanntmachungsdatum)\n\nHamburg Amtsgericht Hamburg HRB 168273\nRegisterbekanntmachung nach dem Umwandlungsgesetz 06.06.2025 (Eintragungsdatum)\n\nRamboll Deutschland GmbH\nGesellschaft mit beschränkter Haftung\nHamburg\n\nAls nicht eingetragen wird bekannt gemacht:\nDen Gläubigern der an der Verschmelzung beteiligten Gesellschaften ist, wenn sie binnen sechs Monaten nach dem Tag, an dem die Eintragung der Verschmelzung in das Register des Sitzes desjenigen Rechtsträgers, dessen Gläubiger sie sind, nach § 19 Absatz 3 UmwG als bekannt gemacht gilt, ihren Anspruch nach Grund und Höhe schriftlich anmelden, Sicherheit zu leisten, soweit sie nicht Befriedigung verlangen können. Dieses Recht steht den Gläubigern jedoch nur zu, wenn sie glaubhaft machen, dass durch die Verschmelzung die Erfüllung ihrer Forderung gefährdet wird."
    },
    {
      "date": "2025-06-06",
      "id": "111538",
      "original_text": "Einreichung neuer Dokumente\nBaden-Württemberg Amtsgericht Stuttgart HRB 310155\nMercedes - AMG Gesellschaft mit beschränkter Haftung – Affalterbach",
      "type": "Einreichung neuer Dokumente",
      "state": "Baden-Württemberg",
      "amtsgericht": "Amtsgericht Stuttgart",
      "registernummer": "HRB 310155",
      "registerart": "HRB",
      "company_name": "Mercedes - AMG Gesellschaft mit beschränkter Haftung",
      "company_seat": "Affalterbach",
      "details": "06.06.2025 (Bekanntmachungsdatum)\n\nBaden-Württemberg Amtsgericht Stuttgart HRB 310155\nEinreichung neuer Dokumente\n\nMercedes - AMG Gesellschaft mit beschränkter Haftung\nGesellschaft mit beschränkter Haftung\nAffalterbach\n\nDie Gesellschaft hat am 06.06.2025 die Liste über die Zusammensetzung des Aufsichtsrats zum Handelsregister eingereicht."
    },
    {
      "date": "2025-06-06",
      "id": "111539",
      "original_text": "Registerbekanntmachung nach dem Umwandlungsgesetz\nHamburg Amtsgericht Hamburg HRB 127376\nPraemia REAM Germany GmbH – Hamburg",
      "type": "Registerbekanntmachung nach dem Umwandlungsgesetz",
      "state": "Hamburg",
      "amtsgericht": "Amtsgericht Hamburg",
      "registernummer": "HRB 127376",
      "registerart": "HRB",
      "company_name": "Praemia REAM Germany GmbH",
      "company_seat": "Hamburg",
      "details": "06.06.2025 (Bekanntmachungsdatum)\n\nHamburg Amtsgericht Hamburg HRB 127376\nRegisterbekanntmachung nach dem Umwandlungsgesetz 06.06.2025 (Eintragungsdatum)\n\nPraemia REAM Germany GmbH\nGesellschaft mit beschränkter Haftung\nHamburg\n\nAls nicht eingetragen wird bekannt gemacht:\nDen Gläubigern der an der Verschmelzung beteiligten Gesellschaften ist, wenn sie binnen sechs Monaten nach dem Tag, an dem die Eintragung der Verschmelzung in das Register des Sitzes desjenigen Rechtsträgers, dessen Gläubiger sie sind, nach § 19 Absatz 3 UmwG als bekannt gemacht gilt, ihren Anspruch nach Grund und Höhe schriftlich anmelden, Sicherheit zu leisten, soweit sie nicht Befriedigung verlangen können. Dieses Recht steht den Gläubigern jedoch nur zu, wenn sie glaubhaft machen, dass durch die Verschmelzung die Erfüllung ihrer Forderung gefährdet wird."
    },
    {
      "date": "2025-06-06",
      "id": "111540",
      "original_text": "Registerbekanntmachung nach dem Umwandlungsgesetz\nHamburg Amtsgericht Hamburg HRB 182692\nPraemia Healthcare-Real-Estate Germany GmbH – Hamburg",
      "type": "Registerbekanntmachung nach dem Umwandlungsgesetz",
      "state": "Hamburg",
      "amtsgericht": "Amtsgericht Hamburg",
      "registernummer": "HRB 182692",
      "registerart": "HRB",
      "company_name": "Praemia Healthcare-Real-Estate Germany GmbH",
      "company_seat": "Hamburg",
      "details": "06.06.2025 (Bekanntmachungsdatum)\n\nHamburg Amtsgericht Hamburg HRB 182692\nRegisterbekanntmachung nach dem Umwandlungsgesetz 06.06.2025 (Eintragungsdatum)\n\nPraemia Healthcare-Real-Estate Germany GmbH\nGesellschaft mit beschränkter Haftung\nHamburg\n\nAls nicht eingetragen wird bekannt gemacht:\nDen Gläubigern der an der Verschmelzung beteiligten Gesellschaften ist, wenn sie binnen sechs Monaten nach dem Tag, an dem die Eintragung der Verschmelzung in das Register des Sitzes desjenigen Rechtsträgers, dessen Gläubiger sie sind, nach § 19 Absatz 3 UmwG als bekannt gemacht gilt, ihren Anspruch nach Grund und Höhe schriftlich anmelden, Sicherheit zu leisten, soweit sie nicht Befriedigung verlangen können. Dieses Recht steht den Gläubigern jedoch nur zu, wenn sie glaubhaft machen, dass durch die Verschmelzung die Erfüllung ihrer Forderung gefährdet wird."
    },
    {
      "date": "2025-06-06",
      "id": "111541",
      "original_text": "Löschungsankündigung\nSachsen Amtsgericht Dresden HRB 27764\nMöbelmanufaktur Lehmann UG (haftungsbeschränkt) – Sohland",
      "type": "Löschungsankündigung",
      "state": "Sachsen",
      "amtsgericht": "Amtsgericht Dresden",
      "registernummer": "HRB 27764",
      "registerart": "HRB",
      "company_name": "Möbelmanufaktur Lehmann UG (haftungsbeschränkt)",
      "company_seat": "Sohland",
      "details": "06.06.2025 (Bekanntmachungsdatum)\n\nSachsen Amtsgericht Dresden HRB 27764\nLöschungsankündigung\n\nMöbelmanufaktur Lehmann UG (haftungsbeschränkt)\nGesellschaft mit beschränkter Haftung\nSohland\n\nDas Registergericht beabsichtigt, die im Handelsregister eingetragene Gesellschaft von Amts wegen nach § 394 FamFG zu löschen. Die Frist zu Erhebung eines Widerspruchs gegen die beabsichtigte Löschung wird auf einen Monat festgesetzt."
    },
    {
      "date": "2025-06-06",
      "id": "111542",
      "original_text": "Registerbekanntmachung nach dem Umwandlungsgesetz\nSachsen Amtsgericht Chemnitz HRB 28420\nWilde Kommunikation Sachsen GmbH – Thum",
      "type": "Registerbekanntmachung nach dem Umwandlungsgesetz",
      "state": "Sachsen",
      "amtsgericht": "Amtsgericht Chemnitz",
      "registernummer": "HRB 28420",
      "registerart": "HRB",
      "company_name": "Wilde Kommunikation Sachsen GmbH",
      "company_seat": "Thum",
      "details": "06.06.2025 (Bekanntmachungsdatum)\n\nSachsen Amtsgericht Chemnitz HRB 28420\nRegisterbekanntmachung nach dem Umwandlungsgesetz 06.06.2025 (Eintragungsdatum)\n\nWilde Kommunikation Sachsen GmbH\nGesellschaft mit beschränkter Haftung\nThum\n\nDen Gläubigern der an der Verschmelzung beteiligten Rechtsträger ist, wenn sie binnen sechs Monaten nach dem Tag, an dem die Eintragung der Verschmelzung in das Register des Sitzes desjenigen Rechtsträgers, dessen Gläubiger sie sind, nach § 19 Abs. 3 UmwG als bekannt gemacht gilt, ihren Anspruch nach Grund und Höhe in Textform anmelden, Sicherheit zu leisten, soweit sie nicht Befriedigung verlangen können. Dieses Recht steht den Gläubigern jedoch nur zu, wenn sie glaubhaft machen, dass durch die Verschmelzung die Erfüllung der Forderung gefährdet wird."
    },
    {
      "date": "2025-06-06",
      "id": "111543",
      "original_text": "Registerbekanntmachung nach dem Umwandlungsgesetz\nSachsen Amtsgericht Chemnitz HRB 1210\nRoland Zaumseil & Co. GmbH Räucherfischspezialitäten und Feinmarinaden – Weischlitz",
      "type": "Registerbekanntmachung nach dem Umwandlungsgesetz",
      "state": "Sachsen",
      "amtsgericht": "Amtsgericht Chemnitz",
      "registernummer": "HRB 1210",
      "registerart": "HRB",
      "company_name": "Roland Zaumseil & Co. GmbH Räucherfischspezialitäten und Feinmarinaden",
      "company_seat": "Weischlitz",
      "details": "06.06.2025 (Bekanntmachungsdatum)\n\nSachsen Amtsgericht Chemnitz HRB 1210\nRegisterbekanntmachung nach dem Umwandlungsgesetz 06.06.2025 (Eintragungsdatum)\n\nRoland Zaumseil & Co. GmbH Räucherfischspezialitäten und Feinmarinaden\nGesellschaft mit beschränkter Haftung\nWeischlitz\n\nDen Gläubigern der an der Verschmelzung beteiligten Rechtsträger ist, wenn sie binnen sechs Monaten nach dem Tag, an dem die Eintragung der Verschmelzung in das Register des Sitzes desjenigen Rechtsträgers, dessen Gläubiger sie sind, nach § 19 Abs. 3 UmwG als bekannt gemacht gilt, ihren Anspruch nach Grund und Höhe in Textform anmelden, Sicherheit zu leisten, soweit sie nicht Befriedigung verlangen können. Dieses Recht steht den Gläubigern jedoch nur zu, wenn sie glaubhaft machen, dass durch die Verschmelzung die Erfüllung der Forderung gefährdet wird."
    },
    {
      "date": "2025-06-06",
      "id": "111544",
      "original_text": "Registerbekanntmachung nach dem Umwandlungsgesetz\nSachsen Amtsgericht Chemnitz HRB 22910\nSchröter Feinkost GmbH – Plauen",
      "type": "Registerbekanntmachung nach dem Umwandlungsgesetz",
      "state": "Sachsen",
      "amtsgericht": "Amtsgericht Chemnitz",
      "registernummer": "HRB 22910",
      "registerart": "HRB",
      "company_name": "Schröter Feinkost GmbH",
      "company_seat": "Plauen",
      "details": "06.06.2025 (Bekanntmachungsdatum)\n\nSachsen Amtsgericht Chemnitz HRB 22910\nRegisterbekanntmachung nach dem Umwandlungsgesetz 06.06.2025 (Eintragungsdatum)\n\nSchröter Feinkost GmbH\nGesellschaft mit beschränkter Haftung\nPlauen\n\nDen Gläubigern der an der Verschmelzung beteiligten Rechtsträger ist, wenn sie binnen sechs Monaten nach dem Tag, an dem die Eintragung der Verschmelzung in das Register des Sitzes desjenigen Rechtsträgers, dessen Gläubiger sie sind, nach § 19 Abs. 3 UmwG als bekannt gemacht gilt, ihren Anspruch nach Grund und Höhe in Textform anmelden, Sicherheit zu leisten, soweit sie nicht Befriedigung verlangen können. Dieses Recht steht den Gläubigern jedoch nur zu, wenn sie glaubhaft machen, dass durch die Verschmelzung die Erfüllung der Forderung gefährdet wird."
    },
    {
      "date": "2025-06-06",
      "id": "111545",
      "original_text": "Registerbekanntmachung nach dem Umwandlungsgesetz\nNiedersachsen Amtsgericht Braunschweig HRB 200477\nLöwenstark Online-Marketing GmbH – Braunschweig",
      "type": "Registerbekanntmachung nach dem Umwandlungsgesetz",
      "state": "Niedersachsen",
      "amtsgericht": "Amtsgericht Braunschweig",
      "registernummer": "HRB 200477",
      "registerart": "HRB",
      "company_name": "Löwenstark Online-Marketing GmbH",
      "company_seat": "Braunschweig",
      "details": "06.06.2025 (Bekanntmachungsdatum)\n\nNiedersachsen Amtsgericht Braunschweig HRB 200477\nRegisterbekanntmachung nach dem Umwandlungsgesetz 06.06.2025 (Eintragungsdatum)\n\nLöwenstark Online-Marketing GmbH\nGesellschaft mit beschränkter Haftung\nBraunschweig\n\nDen Gläubigern der an der Verschmelzung beteiligten Rechtsträger ist, wenn sie binnen sechs Monaten nach dem Tag, an dem die Eintragung der Verschmelzung in das Register des Sitzes desjenigen Rechtsträgers, dessen Gläubiger sie sind, nach § 19  Abs.  3 UmwG als bekannt gemacht gilt, ihren Anspruch nach Grund und Höhe schriftlich anmelden, Sicherheit zu leisten, soweit sie nicht Befriedigung verlangen können. Dieses Recht steht den Gläubigern jedoch nur zu, wenn sie glaubhaft machen, dass durch die Verschmelzung die Erfüllung der Forderung gefährdet wird."
    },
    {
      "date": "2025-06-06",
      "id": "111546",
      "original_text": "Registerbekanntmachung nach dem Umwandlungsgesetz\nNiedersachsen Amtsgericht Braunschweig HRB 208696\nLöwenstark Brand Marketing GmbH – Braunschweig",
      "type": "Registerbekanntmachung nach dem Umwandlungsgesetz",
      "state": "Niedersachsen",
      "amtsgericht": "Amtsgericht Braunschweig",
      "registernummer": "HRB 208696",
      "registerart": "HRB",
      "company_name": "Löwenstark Brand Marketing GmbH",
      "company_seat": "Braunschweig",
      "details": "06.06.2025 (Bekanntmachungsdatum)\n\nNiedersachsen Amtsgericht Braunschweig HRB 208696\nRegisterbekanntmachung nach dem Umwandlungsgesetz 06.06.2025 (Eintragungsdatum)\n\nLöwenstark Brand Marketing GmbH\nGesellschaft mit beschränkter Haftung\nBraunschweig\n\nDen Gläubigern der an der Verschmelzung beteiligten Rechtsträger ist, wenn sie binnen sechs Monaten nach dem Tag, an dem die Eintragung der Verschmelzung in das Register des Sitzes desjenigen Rechtsträgers, dessen Gläubiger sie sind, nach § 19  Abs.  3 UmwG als bekannt gemacht gilt, ihren Anspruch nach Grund und Höhe schriftlich anmelden, Sicherheit zu leisten, soweit sie nicht Befriedigung verlangen können. Dieses Recht steht den Gläubigern jedoch nur zu, wenn sie glaubhaft machen, dass durch die Verschmelzung die Erfüllung der Forderung gefährdet wird."
    },
    {
      "date": "2025-06-06",
      "id": "111547",
      "original_text": "Registerbekanntmachung nach dem Umwandlungsgesetz\nNiedersachsen Amtsgericht Walsrode HRB 212552\nGM Growth GmbH – Achim",
      "type": "Registerbekanntmachung nach dem Umwandlungsgesetz",
      "state": "Niedersachsen",
      "amtsgericht": "Amtsgericht Walsrode",
      "registernummer": "HRB 212552",
      "registerart": "HRB",
      "company_name": "GM Growth GmbH",
      "company_seat": "Achim",
      "details": "06.06.2025 (Bekanntmachungsdatum)\n\nNiedersachsen Amtsgericht Walsrode HRB 212552\nRegisterbekanntmachung nach dem Umwandlungsgesetz 06.06.2025 (Eintragungsdatum)\n\nGM Growth GmbH\nGesellschaft mit beschränkter Haftung\nAchim\n\nDen Gläubigern der an der  Verschmelzung beteiligten Rechtsträger ist, wenn sie binnen sechs Monaten nach dem Tag, an dem die Eintragung der Verschmelzung in das Register des Sitzes desjenigen Rechtsträgers, dessen Gläubiger sie sind, nach § 19  Abs.  3 UmwG als bekannt gemacht gilt, ihren Anspruch nach Grund und Höhe schriftlich anmelden, Sicherheit zu leisten, soweit sie nicht Befriedigung verlangen können. Dieses Recht steht den Gläubigern jedoch nur zu, wenn sie glaubhaft machen, dass durch die Verschmelzung die Erfüllung der Forderung gefährdet wird.\"|\"Verschmelzung\",\"Abspaltung beteiligten Rechtsträger ist, wenn sie binnen sechs Monaten nach dem Tag, an dem die Eintragung der Abspaltung in das Register des Sitzes desjenigen Rechtsträgers, dessen Gläubiger sie sind, nach § 19 Abs. 3 UmwG als bekannt gemacht gilt, ihren Anspruch nach Grund und Höhe schriftlich anmelden, Sicherheit zu leisten, soweit sie nicht Befriedigung verlangen können. Dieses Recht steht den Gläubigern jedoch nur zu, wenn sie glaubhaft machen, dass durch die Abspaltung die Erfüllung der Forderung gefährdet wird.\"|\"Abspaltung\",\"Aufspaltung beteiligten Rechtsträger ist, wenn sie binnen sechs Monaten nach dem Tag, an dem die Eintragung der Aufspaltung in das Register des Sitzes desjenigen Rechtsträgers, dessen Gläubiger sie sind, nach § 19 Abs. 3 UmwG als bekannt gemacht gilt, ihren Anspruch nach Grund und Höhe schriftlich anmelden, Sicherheit zu leisten, soweit sie nicht Befriedigung verlangen können. Dieses Recht steht den Gläubigern jedoch nur zu, wenn sie glaubhaft machen, dass durch die Aufspaltung die Erfüllung der Forderung gefährdet wird.\"|\"Aufspaltung\",\"formwechselnden Umwandlung beteiligten Rechtsträger ist, wenn sie binnen sechs Monaten nach dem Tag, an dem die Eintragung der Umwandlung in das Register des Sitzes desjenigen Rechtsträgers, dessen Gläubiger sie sind, nach § 19 Abs. 3 UmwG als bekannt gemacht gilt, ihren Anspruch nach Grund und Höhe schriftlich anmelden, Sicherheit zu leisten, soweit sie nicht Befriedigung verlangen können. Dieses Recht steht den Gläubigern jedoch nur zu, wenn sie glaubhaft machen, dass durch die formwechselnde Umwandlung die Erfüllung der Forderung gefährdet wird.\"|\"formwechselnden Umwandlung\",\"Ausgliederung beteiligten Rechtsträger ist, wenn sie binnen sechs Monaten nach dem Tag, an dem die Eintragung der Ausgliederung in das Register des Sitzes desjenigen Rechtsträgers, dessen Gläubiger sie sind, nach § 19 Abs. 3 UmwG als bekannt gemacht gilt, ihren Anspruch nach Grund und Höhe schriftlich anmelden, Sicherheit zu leisten, soweit sie nicht Befriedigung verlangen können. Dieses Recht steht den Gläubigern jedoch nur zu, wenn sie glaubhaft machen, dass durch die Ausgliederung die Erfüllung der Forderung gefährdet wird.\"|\"Ausgliederung\",\"Vermögensübertragung beteiligten Rechtsträger ist, wenn sie binnen sechs Monaten nach dem Tag, an dem die Eintragung der Spaltung in das Register des Sitzes desjenigen Rechtsträgers, dessen Gläubiger sie sind, nach § 19 Abs. 3 UmwG als bekannt gemacht gilt, ihren Anspruch nach Grund und Höhe schriftlich anmelden, Sicherheit zu leisten, soweit sie nicht Befriedigung verlangen können. Dieses Recht steht den Gläubigern jedoch nur zu, wenn sie glaubhaft machen, dass durch die Spaltung die Erfüllung der Forderung gefährdet wird."
    },
    {
      "date": "2025-06-06",
      "id": "111548",
      "original_text": "Einreichung neuer Dokumente\nNiedersachsen Amtsgericht Hannover HRB 53571\nZoo Hannover gemeinnützige GmbH – Hannover",
      "type": "Einreichung neuer Dokumente",
      "state": "Niedersachsen",
      "amtsgericht": "Amtsgericht Hannover",
      "registernummer": "HRB 53571",
      "registerart": "HRB",
      "company_name": "Zoo Hannover gemeinnützige GmbH",
      "company_seat": "Hannover",
      "details": "06.06.2025 (Bekanntmachungsdatum)\n\nNiedersachsen Amtsgericht Hannover HRB 53571\nEinreichung neuer Dokumente\n\nZoo Hannover gemeinnützige GmbH\nGesellschaft mit beschränkter Haftung\nHannover\n\nDie Liste der Mitglieder des Aufsichtsrats wurde beim Registergericht eingereicht."
    },
    {
      "date": "2025-06-06",
      "id": "111549",
      "original_text": "Registerbekanntmachung nach dem Umwandlungsgesetz\nNiedersachsen Amtsgericht Braunschweig HRB 206662\nLöwenstark Digital Solutions GmbH – Braunschweig",
      "type": "Registerbekanntmachung nach dem Umwandlungsgesetz",
      "state": "Niedersachsen",
      "amtsgericht": "Amtsgericht Braunschweig",
      "registernummer": "HRB 206662",
      "registerart": "HRB",
      "company_name": "Löwenstark Digital Solutions GmbH",
      "company_seat": "Braunschweig",
      "details": "06.06.2025 (Bekanntmachungsdatum)\n\nNiedersachsen Amtsgericht Braunschweig HRB 206662\nRegisterbekanntmachung nach dem Umwandlungsgesetz 06.06.2025 (Eintragungsdatum)\n\nLöwenstark Digital Solutions GmbH\nGesellschaft mit beschränkter Haftung\nBraunschweig\n\nDen Gläubigern der an der Verschmelzung beteiligten Rechtsträger ist, wenn sie binnen sechs Monaten nach dem Tag, an dem die Eintragung der Verschmelzung in das Register des Sitzes desjenigen Rechtsträgers, dessen Gläubiger sie sind, nach § 19  Abs.  3 UmwG als bekannt gemacht gilt, ihren Anspruch nach Grund und Höhe schriftlich anmelden, Sicherheit zu leisten, soweit sie nicht Befriedigung verlangen können. Dieses Recht steht den Gläubigern jedoch nur zu, wenn sie glaubhaft machen, dass durch die Verschmelzung die Erfüllung der Forderung gefährdet wird."
    },
    {
      "date": "2025-06-06",
      "id": "111550",
      "original_text": "Einreichung neuer Dokumente\nNiedersachsen Amtsgericht Osnabrück HRB 16550\nWM SE – Osnabrück",
      "type": "Einreichung neuer Dokumente",
      "state": "Niedersachsen",
      "amtsgericht": "Amtsgericht Osnabrück",
      "registernummer": "HRB 16550",
      "registerart": "HRB",
      "company_name": "WM SE",
      "company_seat": "Osnabrück",
      "details": "06.06.2025 (Bekanntmachungsdatum)\n\nNiedersachsen Amtsgericht Osnabrück HRB 16550\nEinreichung neuer Dokumente\n\nWM SE\nEuropäische Aktiengesellschaft (SE)\nOsnabrück\n\nDie Liste der Mitglieder des Aufsichtsrats wurde beim Registergericht eingereicht."
    },
    {
      "date": "2025-06-06",
      "id": "111551",
      "original_text": "Registerbekanntmachung nach dem Umwandlungsgesetz\nNiedersachsen Amtsgericht Walsrode HRA 201937\nBecker Holding GmbH & Co. KG – Lilienthal",
      "type": "Registerbekanntmachung nach dem Umwandlungsgesetz",
      "state": "Niedersachsen",
      "amtsgericht": "Amtsgericht Walsrode",
      "registernummer": "HRA 201937",
      "registerart": "HRA",
      "company_name": "Becker Holding GmbH & Co. KG",
      "company_seat": "Lilienthal",
      "details": "06.06.2025 (Bekanntmachungsdatum)\n\nNiedersachsen Amtsgericht Walsrode HRA 201937\nRegisterbekanntmachung nach dem Umwandlungsgesetz 06.06.2025 (Eintragungsdatum)\n\nBecker Holding GmbH & Co. KG\nKommanditgesellschaft\nLilienthal\n\nDen Gläubigern der an der formwechselnden Umwandlung beteiligten Rechtsträger ist, wenn sie binnen sechs Monaten nach dem Tag, an dem die Eintragung der Umwandlung in das Register des Sitzes desjenigen Rechtsträgers, dessen Gläubiger sie sind, nach § 19 Abs. 3 UmwG als bekannt gemacht gilt, ihren Anspruch nach Grund und Höhe schriftlich anmelden, Sicherheit zu leisten, soweit sie nicht Befriedigung verlangen können. Dieses Recht steht den Gläubigern jedoch nur zu, wenn sie glaubhaft machen, dass durch die formwechselnde Umwandlung die Erfüllung der Forderung gefährdet wird."
    },
    {
      "date": "2025-06-06",
      "id": "111552",
      "original_text": "Registerbekanntmachung nach dem Umwandlungsgesetz\nNiedersachsen Amtsgericht Osnabrück GsR 1010\nS.H. Eier-Damme eGbR – Melle",
      "type": "Registerbekanntmachung nach dem Umwandlungsgesetz",
      "state": "Niedersachsen",
      "amtsgericht": "Amtsgericht Osnabrück",
      "registernummer": "GsR 1010",
      "registerart": "GsR",
      "company_name": "S.H. Eier-Damme eGbR",
      "company_seat": "Melle",
      "details": "06.06.2025 (Bekanntmachungsdatum)\n\nNiedersachsen Amtsgericht Osnabrück GsR 1010\nRegisterbekanntmachung nach dem Umwandlungsgesetz\n\nS.H. Eier-Damme eGbR\nGesellschaft bürgerlichen Rechts\nMelle\n\nDen Gläubigern der an der formwechselnden Umwandlung beteiligten Rechtsträger ist, wenn sie binnen sechs Monaten nach dem Tag, an dem die Eintragung der Umwandlung in das Register des Sitzes desjenigen Rechtsträgers, dessen Gläubiger sie sind, nach § 19 Abs. 3 UmwG als bekannt gemacht gilt, ihren Anspruch nach Grund und Höhe schriftlich anmelden, Sicherheit zu leisten, soweit sie nicht Befriedigung verlangen können. Dieses Recht steht den Gläubigern jedoch nur zu, wenn sie glaubhaft machen, dass durch die formwechselnde Umwandlung die Erfüllung der Forderung gefährdet wird."
    },
    {
      "date": "2025-06-06",
      "id": "111553",
      "original_text": "Registerbekanntmachung nach dem Umwandlungsgesetz\nNiedersachsen Amtsgericht Braunschweig HRB 200477\nLöwenstark Online-Marketing GmbH – Braunschweig",
      "type": "Registerbekanntmachung nach dem Umwandlungsgesetz",
      "state": "Niedersachsen",
      "amtsgericht": "Amtsgericht Braunschweig",
      "registernummer": "HRB 200477",
      "registerart": "HRB",
      "company_name": "Löwenstark Online-Marketing GmbH",
      "company_seat": "Braunschweig",
      "details": "06.06.2025 (Bekanntmachungsdatum)\n\nNiedersachsen Amtsgericht Braunschweig HRB 200477\nRegisterbekanntmachung nach dem Umwandlungsgesetz 06.06.2025 (Eintragungsdatum)\n\nLöwenstark Online-Marketing GmbH\nGesellschaft mit beschränkter Haftung\nBraunschweig\n\nDen Gläubigern der an der Verschmelzung beteiligten Rechtsträger ist, wenn sie binnen sechs Monaten nach dem Tag, an dem die Eintragung der Verschmelzung in das Register des Sitzes desjenigen Rechtsträgers, dessen Gläubiger sie sind, nach § 19  Abs.  3 UmwG als bekannt gemacht gilt, ihren Anspruch nach Grund und Höhe schriftlich anmelden, Sicherheit zu leisten, soweit sie nicht Befriedigung verlangen können. Dieses Recht steht den Gläubigern jedoch nur zu, wenn sie glaubhaft machen, dass durch die Verschmelzung die Erfüllung der Forderung gefährdet wird."
    },
    {
      "date": "2025-06-06",
      "id": "111554",
      "original_text": "Registerbekanntmachung nach dem Umwandlungsgesetz\nNiedersachsen Amtsgericht Braunschweig HRB 200477\nLöwenstark Online-Marketing GmbH – Braunschweig",
      "type": "Registerbekanntmachung nach dem Umwandlungsgesetz",
      "state": "Niedersachsen",
      "amtsgericht": "Amtsgericht Braunschweig",
      "registernummer": "HRB 200477",
      "registerart": "HRB",
      "company_name": "Löwenstark Online-Marketing GmbH",
      "company_seat": "Braunschweig",
      "details": "06.06.2025 (Bekanntmachungsdatum)\n\nNiedersachsen Amtsgericht Braunschweig HRB 200477\nRegisterbekanntmachung nach dem Umwandlungsgesetz 06.06.2025 (Eintragungsdatum)\n\nLöwenstark Online-Marketing GmbH\nGesellschaft mit beschränkter Haftung\nBraunschweig\n\nDen Gläubigern der an der Verschmelzung beteiligten Rechtsträger ist, wenn sie binnen sechs Monaten nach dem Tag, an dem die Eintragung der Verschmelzung in das Register des Sitzes desjenigen Rechtsträgers, dessen Gläubiger sie sind, nach § 19  Abs.  3 UmwG als bekannt gemacht gilt, ihren Anspruch nach Grund und Höhe schriftlich anmelden, Sicherheit zu leisten, soweit sie nicht Befriedigung verlangen können. Dieses Recht steht den Gläubigern jedoch nur zu, wenn sie glaubhaft machen, dass durch die Verschmelzung die Erfüllung der Forderung gefährdet wird."
    },
    {
      "date": "2025-06-06",
      "id": "111555",
      "original_text": "Registerbekanntmachung nach dem Umwandlungsgesetz\nNiedersachsen Amtsgericht Braunschweig HRB 205088\nLöwenstark Service GmbH – Braunschweig",
      "type": "Registerbekanntmachung nach dem Umwandlungsgesetz",
      "state": "Niedersachsen",
      "amtsgericht": "Amtsgericht Braunschweig",
      "registernummer": "HRB 205088",
      "registerart": "HRB",
      "company_name": "Löwenstark Service GmbH",
      "company_seat": "Braunschweig",
      "details": "06.06.2025 (Bekanntmachungsdatum)\n\nNiedersachsen Amtsgericht Braunschweig HRB 205088\nRegisterbekanntmachung nach dem Umwandlungsgesetz 06.06.2025 (Eintragungsdatum)\n\nLöwenstark Service GmbH\nGesellschaft mit beschränkter Haftung\nBraunschweig\n\nDen Gläubigern der an der Verschmelzung beteiligten Rechtsträger ist, wenn sie binnen sechs Monaten nach dem Tag, an dem die Eintragung der Verschmelzung in das Register des Sitzes desjenigen Rechtsträgers, dessen Gläubiger sie sind, nach § 19  Abs.  3 UmwG als bekannt gemacht gilt, ihren Anspruch nach Grund und Höhe schriftlich anmelden, Sicherheit zu leisten, soweit sie nicht Befriedigung verlangen können. Dieses Recht steht den Gläubigern jedoch nur zu, wenn sie glaubhaft machen, dass durch die Verschmelzung die Erfüllung der Forderung gefährdet wird."
    },
    {
      "date": "2025-06-06",
      "id": "111556",
      "original_text": "Registerbekanntmachung nach dem Umwandlungsgesetz\nNiedersachsen Amtsgericht Braunschweig HRB 206730\nKLICKHELDEN GmbH – Braunschweig",
      "type": "Registerbekanntmachung nach dem Umwandlungsgesetz",
      "state": "Niedersachsen",
      "amtsgericht": "Amtsgericht Braunschweig",
      "registernummer": "HRB 206730",
      "registerart": "HRB",
      "company_name": "KLICKHELDEN GmbH",
      "company_seat": "Braunschweig",
      "details": "06.06.2025 (Bekanntmachungsdatum)\n\nNiedersachsen Amtsgericht Braunschweig HRB 206730\nRegisterbekanntmachung nach dem Umwandlungsgesetz 06.06.2025 (Eintragungsdatum)\n\nKLICKHELDEN GmbH\nGesellschaft mit beschränkter Haftung\nBraunschweig\n\nDen Gläubigern der an der Verschmelzung beteiligten Rechtsträger ist, wenn sie binnen sechs Monaten nach dem Tag, an dem die Eintragung der Verschmelzung in das Register des Sitzes desjenigen Rechtsträgers, dessen Gläubiger sie sind, nach § 19  Abs.  3 UmwG als bekannt gemacht gilt, ihren Anspruch nach Grund und Höhe schriftlich anmelden, Sicherheit zu leisten, soweit sie nicht Befriedigung verlangen können. Dieses Recht steht den Gläubigern jedoch nur zu, wenn sie glaubhaft machen, dass durch die Verschmelzung die Erfüllung der Forderung gefährdet wird."
    },
    {
      "date": "2025-06-06",
      "id": "111557",
      "original_text": "Registerbekanntmachung nach dem Umwandlungsgesetz\nNiedersachsen Amtsgericht Walsrode HRB 212793\nBecker Holding GmbH – Lilienthal",
      "type": "Registerbekanntmachung nach dem Umwandlungsgesetz",
      "state": "Niedersachsen",
      "amtsgericht": "Amtsgericht Walsrode",
      "registernummer": "HRB 212793",
      "registerart": "HRB",
      "company_name": "Becker Holding GmbH",
      "company_seat": "Lilienthal",
      "details": "06.06.2025 (Bekanntmachungsdatum)\n\nNiedersachsen Amtsgericht Walsrode HRB 212793\nRegisterbekanntmachung nach dem Umwandlungsgesetz 06.06.2025 (Eintragungsdatum)\n\nBecker Holding GmbH\nGesellschaft mit beschränkter Haftung\nLilienthal\n\nDen Gläubigern der an der formwechselnden Umwandlung beteiligten Rechtsträger ist, wenn sie binnen sechs Monaten nach dem Tag, an dem die Eintragung der Umwandlung in das Register des Sitzes desjenigen Rechtsträgers, dessen Gläubiger sie sind, nach § 19 Abs. 3 UmwG als bekannt gemacht gilt, ihren Anspruch nach Grund und Höhe schriftlich anmelden, Sicherheit zu leisten, soweit sie nicht Befriedigung verlangen können. Dieses Recht steht den Gläubigern jedoch nur zu, wenn sie glaubhaft machen, dass durch die formwechselnde Umwandlung die Erfüllung der Forderung gefährdet wird."
    },
    {
      "date": "2025-06-06",
      "id": "111558",
      "original_text": "Registerbekanntmachung nach dem Umwandlungsgesetz\nNiedersachsen Amtsgericht Braunschweig HRB 200477\nLöwenstark Online-Marketing GmbH – Braunschweig",
      "type": "Registerbekanntmachung nach dem Umwandlungsgesetz",
      "state": "Niedersachsen",
      "amtsgericht": "Amtsgericht Braunschweig",
      "registernummer": "HRB 200477",
      "registerart": "HRB",
      "company_name": "Löwenstark Online-Marketing GmbH",
      "company_seat": "Braunschweig",
      "details": "06.06.2025 (Bekanntmachungsdatum)\n\nNiedersachsen Amtsgericht Braunschweig HRB 200477\nRegisterbekanntmachung nach dem Umwandlungsgesetz 06.06.2025 (Eintragungsdatum)\n\nLöwenstark Online-Marketing GmbH\nGesellschaft mit beschränkter Haftung\nBraunschweig\n\nDen Gläubigern der an der Verschmelzung beteiligten Rechtsträger ist, wenn sie binnen sechs Monaten nach dem Tag, an dem die Eintragung der Verschmelzung in das Register des Sitzes desjenigen Rechtsträgers, dessen Gläubiger sie sind, nach § 19  Abs.  3 UmwG als bekannt gemacht gilt, ihren Anspruch nach Grund und Höhe schriftlich anmelden, Sicherheit zu leisten, soweit sie nicht Befriedigung verlangen können. Dieses Recht steht den Gläubigern jedoch nur zu, wenn sie glaubhaft machen, dass durch die Verschmelzung die Erfüllung der Forderung gefährdet wird."
    },
    {
      "date": "2025-06-06",
      "id": "111559",
      "original_text": "Einreichung neuer Dokumente\nBremen Amtsgericht Bremen HRB 41187\nLONGEVITY SE – Bremen",
      "type": "Einreichung neuer Dokumente",
      "state": "Bremen",
      "amtsgericht": "Amtsgericht Bremen",
      "registernummer": "HRB 41187",
      "registerart": "HRB",
      "company_name": "LONGEVITY SE",
      "company_seat": "Bremen",
      "details": "06.06.2025 (Bekanntmachungsdatum)\n\nBremen Amtsgericht Bremen HRB 41187\nEinreichung neuer Dokumente\n\nLONGEVITY SE\nEuropäische Aktiengesellschaft (SE)\nBremen\n\nAls nicht eingetragen wird bekannt gemacht: Liste des Aufsichtsrats wurde eingereicht."
    },
    {
      "date": "2025-06-06",
      "id": "111560",
      "original_text": "Registerbekanntmachung nach dem Umwandlungsgesetz\nBremen Amtsgericht Bremen HRB 40588\nKonsultig UG (haftungsbeschränkt) – Bremen",
      "type": "Registerbekanntmachung nach dem Umwandlungsgesetz",
      "state": "Bremen",
      "amtsgericht": "Amtsgericht Bremen",
      "registernummer": "HRB 40588",
      "registerart": "HRB",
      "company_name": "Konsultig UG (haftungsbeschränkt)",
      "company_seat": "Bremen",
      "details": "06.06.2025 (Bekanntmachungsdatum)\n\nBremen Amtsgericht Bremen HRB 40588\nRegisterbekanntmachung nach dem Umwandlungsgesetz 05.06.2025 (Eintragungsdatum)\n\nKonsultig UG (haftungsbeschränkt)\nGesellschaft mit beschränkter Haftung\nBremen\n\nZu Eintragungsnummer 2 vom 05.06.2025 wird als nicht eingetragen veröffentlicht:\nDen Gläubigern der an der Verschmelzung beteiligten Rechtsträger ist, wenn sie binnen sechs Monaten nach dem Tag, an dem die Eintragung der Verschmelzung in das Register des Sitzes desjenigen Rechtsträgers, dessen Gläubiger sie sind, als bekannt gemacht gilt, ihren Anspruch nach Grund und Höhe schriftlich anmelden, Sicherheit zu leisten, soweit sie nicht Befriedigung verlangen können. Dieses Recht steht den Gläubigern jedoch nur zu, wenn sie glaubhaft machen, dass durch die Verschmelzung die Erfüllung ihrer Forderung gefährdet wird. Das Recht, Sicherheitsleistung zu verlangen, steht Gläubigern nicht zu, die im Falle der Insolvenz ein Recht auf vorzugsweise Befriedigung aus einer Deckungsmasse haben, die nach gesetzlicher Vorschrift zu ihrem Schutz errichtet und staatlich überwacht ist."
    },
    {
      "date": "2025-06-06",
      "id": "111561",
      "original_text": "Löschungsankündigung\nBremen Amtsgericht Bremen HRA 14142\nPretzsch & Sohn e.K. – Bremen",
      "type": "Löschungsankündigung",
      "state": "Bremen",
      "amtsgericht": "Amtsgericht Bremen",
      "registernummer": "HRA 14142",
      "registerart": "HRA",
      "company_name": "Pretzsch & Sohn e.K.",
      "company_seat": "Bremen",
      "details": "06.06.2025 (Bekanntmachungsdatum)\n\nBremen Amtsgericht Bremen HRA 14142\nLöschungsankündigung\n\nPretzsch & Sohn e.K.\nEinzelkaufmann / Einzelkauffrau\nBremen\n\nEs ist beabsichtigt die im Handelsregister eingetragene Firma von Amts wegen gemäß § 31 Abs.2 HGB zu löschen. Gegen die Löschung kann beim AG Bremen schriftlich oder zu Protokoll der Geschäftsstelle Widerspruch eingelegt werden. Widerspruchsfrist 4 Wochen."
    },
    {
      "date": "2025-06-06",
      "id": "111562",
      "original_text": "Einreichung neuer Dokumente\nRheinland-Pfalz Amtsgericht Mainz HRB 45020\nHeilig-Geist-Hospital Bingen gGmbH – Bingen",
      "type": "Einreichung neuer Dokumente",
      "state": "Rheinland-Pfalz",
      "amtsgericht": "Amtsgericht Mainz",
      "registernummer": "HRB 45020",
      "registerart": "HRB",
      "company_name": "Heilig-Geist-Hospital Bingen gGmbH",
      "company_seat": "Bingen",
      "details": "06.06.2025 (Bekanntmachungsdatum)\n\nRheinland-Pfalz Amtsgericht Mainz HRB 45020\nEinreichung neuer Dokumente\n\nHeilig-Geist-Hospital Bingen gGmbH\nGesellschaft mit beschränkter Haftung\nBingen\n\nDem Registergericht ist eine Liste der Mitglieder des Aufsichtsrates eingereicht worden."
    },
    {
      "date": "2025-06-06",
      "id": "111563",
      "original_text": "Einreichung neuer Dokumente\nRheinland-Pfalz Amtsgericht Zweibrücken HRB 23424\nneox Aktiengesellschaft für Informationstechnologie – Pirmasens",
      "type": "Einreichung neuer Dokumente",
      "state": "Rheinland-Pfalz",
      "amtsgericht": "Amtsgericht Zweibrücken",
      "registernummer": "HRB 23424",
      "registerart": "HRB",
      "company_name": "neox Aktiengesellschaft für Informationstechnologie",
      "company_seat": "Pirmasens",
      "details": "06.06.2025 (Bekanntmachungsdatum)\n\nRheinland-Pfalz Amtsgericht Zweibrücken HRB 23424\nEinreichung neuer Dokumente\n\nneox Aktiengesellschaft für Informationstechnologie\nAktiengesellschaft\nPirmasens\n\nDem Registergericht ist eine neue Liste der Mitglieder des Aufsichtsrates eingereicht worden."
    },
    {
      "date": "2025-06-06",
      "id": "111564",
      "original_text": "Einreichung neuer Dokumente\nNordrhein-Westfalen Amtsgericht Essen HRB 19649\nSTEAG GmbH – Essen",
      "type": "Einreichung neuer Dokumente",
      "state": "Nordrhein-Westfalen",
      "amtsgericht": "Amtsgericht Essen",
      "registernummer": "HRB 19649",
      "registerart": "HRB",
      "company_name": "STEAG GmbH",
      "company_seat": "Essen",
      "details": "06.06.2025 (Bekanntmachungsdatum)\n\nNordrhein-Westfalen Amtsgericht Essen HRB 19649\nEinreichung neuer Dokumente\n\nSTEAG GmbH\nGesellschaft mit beschränkter Haftung\nEssen\n\nDem Registergericht ist eine neue Liste der Mitglieder des Aufsichtsrates eingereicht worden."
    },
    {
      "date": "2025-06-06",
      "id": "111565",
      "original_text": "Registerbekanntmachung nach dem Umwandlungsgesetz\nNordrhein-Westfalen Amtsgericht Münster HRB 18625\nSolarBlick GmbH – Münster",
      "type": "Registerbekanntmachung nach dem Umwandlungsgesetz",
      "state": "Nordrhein-Westfalen",
      "amtsgericht": "Amtsgericht Münster",
      "registernummer": "HRB 18625",
      "registerart": "HRB",
      "company_name": "SolarBlick GmbH",
      "company_seat": "Münster",
      "details": "06.06.2025 (Bekanntmachungsdatum)\n\nNordrhein-Westfalen Amtsgericht Münster HRB 18625\nRegisterbekanntmachung nach dem Umwandlungsgesetz 06.06.2025 (Eintragungsdatum)\n\nSolarBlick GmbH\nGesellschaft mit beschränkter Haftung\nMünster\n\nDen Gläubigern der an der Verschmelzung beteiligten Rechtsträger ist, wenn sie binnen sechs Monaten nach dem Tag, an dem die Eintragung der Verschmelzung in das Register des Sitzes desjenigen Rechtsträgers, dessen Gläubiger sie sind, nach § 19 Absatz 3 UmwG als bekanntgemacht gilt, ihren Anspruch nach Grund und Höhe schriftlich anmelden, Sicherheit zu leisten, soweit sie nicht Befriedigung verlangen können. Dieses Recht steht den Gläubigern jedoch nur zu, wenn sie glaubhaft machen, dass durch die Verschmelzung die Erfüllung ihrer Forderung gefährdet wird."
    },
    {
      "date": "2025-06-06",
      "id": "111566",
      "original_text": "Registerbekanntmachung nach dem Umwandlungsgesetz\nNordrhein-Westfalen Amtsgericht Bonn HRB 6792\nDeutsche Post AG – Bonn",
      "type": "Registerbekanntmachung nach dem Umwandlungsgesetz",
      "state": "Nordrhein-Westfalen",
      "amtsgericht": "Amtsgericht Bonn",
      "registernummer": "HRB 6792",
      "registerart": "HRB",
      "company_name": "Deutsche Post AG",
      "company_seat": "Bonn",
      "details": "06.06.2025 (Bekanntmachungsdatum)\n\nNordrhein-Westfalen Amtsgericht Bonn HRB 6792\nRegisterbekanntmachung nach dem Umwandlungsgesetz 06.06.2025 (Eintragungsdatum)\n\nDeutsche Post AG\nAktiengesellschaft\nBonn\n\nDen Gläubigern der an der Verschmelzung beteiligten Rechtsträger ist, wenn sie binnen sechs Monaten nach dem Tag, an dem die Eintragung der Verschmelzung in das Register des Sitzes desjenigen Rechtsträgers, dessen Gläubiger sie sind, nach § 19 Absatz 3 UmwG als bekanntgemacht gilt, ihren Anspruch nach Grund und Höhe schriftlich anmelden, Sicherheit zu leisten, soweit sie nicht Befriedigung verlangen können. Dieses Recht steht den Gläubigern jedoch nur zu, wenn sie glaubhaft machen, dass durch die Verschmelzung die Erfüllung ihrer Forderung gefährdet wird."
    },
    {
      "date": "2025-06-06",
      "id": "111567",
      "original_text": "Löschungsankündigung\nNordrhein-Westfalen Amtsgericht Hamm HRB 7504\nParacelsus Verwaltungs GmbH – Hamm",
      "type": "Löschungsankündigung",
      "state": "Nordrhein-Westfalen",
      "amtsgericht": "Amtsgericht Hamm",
      "registernummer": "HRB 7504",
      "registerart": "HRB",
      "company_name": "Paracelsus Verwaltungs GmbH",
      "company_seat": "Hamm",
      "details": "06.06.2025 (Bekanntmachungsdatum)\n\nNordrhein-Westfalen Amtsgericht Hamm HRB 7504\nLöschungsankündigung\n\nParacelsus Verwaltungs GmbH\nGesellschaft mit beschränkter Haftung\nHamm\n\nDas Registergericht beabsichtigt die Gesellschaft von Amts wegen nach § 394 FamFG zu löschen. Die Frist zur Erhebung eines Widerspruchs ist auf drei Monate festgesetzt."
    },
    {
      "date": "2025-06-06",
      "id": "111568",
      "original_text": "Löschungsankündigung\nNordrhein-Westfalen Amtsgericht Düsseldorf HRB 89445\nGerman Secure Trading GST UG (haftungsbeschränkt) – Düsseldorf",
      "type": "Löschungsankündigung",
      "state": "Nordrhein-Westfalen",
      "amtsgericht": "Amtsgericht Düsseldorf",
      "registernummer": "HRB 89445",
      "registerart": "HRB",
      "company_name": "German Secure Trading GST UG (haftungsbeschränkt)",
      "company_seat": "Düsseldorf",
      "details": "06.06.2025 (Bekanntmachungsdatum)\n\nNordrhein-Westfalen Amtsgericht Düsseldorf HRB 89445\nLöschungsankündigung\n\nGerman Secure Trading GST UG (haftungsbeschränkt)\nGesellschaft mit beschränkter Haftung\nDüsseldorf\n\nDas Registergericht beabsichtigt die Gesellschaft von Amts wegen nach § 394 FamFG zu löschen. Die Frist zur Erhebung eines Widerspruchs ist auf 3 Wochen festgesetzt.\n\nRechtsbehelfsbelehrung:\nDas Widerspruchsrecht steht jedem zu, der an der Unterlassung der Löschung ein berechtigtes Interesse hat. Der Widerspruch ist bei dem Amtsgericht Düsseldorf -Registergericht-, Werdener Straße 1, 40227 Düsseldorf schriftlich in deutscher Sprache oder zur Niederschrift der Geschäftsstelle einzulegen. Der Widerspruch kann auch zur Niederschrift der Geschäftsstelle eines jeden Amtsgerichtes abgegeben werden. Die Einlegung ist auch durch Übertragung eines elektronischen Dokuments an die elektronische Poststelle des Gerichts möglich. Das elektronische Dokument muss für die Bearbeitung durch das Gericht geeignet und mit einer qualifizierten elektronischen Signatur der verantwortenden Person versehen sein oder von der verantwortenden Person signiert und auf einem sicheren Übermittlungsweg gemäß § 130a ZPO nach näherer Maßgabe der Verordnung über die technischen Rahmenbedingungen des elektronischen Rechtsverkehrs und über das besondere elektronische Behördenpostfach (BGBl. I, S.3803) eingereicht werden. Weitere Informationen erhalten Sie auf der Internetseite www.justiz.de.\nDer Widerspruch muss spätestens innerhalb der gesetzten Frist nach dem Datum der Bekanntmachung der Löschungsankündigung bei dem Amtsgericht - Registergericht - Düsseldorf eingegangen sein.  Dies gilt auch dann, wenn der Widerspruch zur Niederschrift der Geschäftsstelle eines anderen Amtsgerichtes abgegeben wurde. Die Frist beginnt mit dem Tage der Bekanntmachung der Löschungsankündigung in dem für die Bekanntmachung der Eintragungen in das Handelsregister bestimmten elektronischen Informations- und Kommunikationssystem nach § 10 des Handelsgesetzbuches. Fällt das Ende der Frist auf einen Sonntag, einen allgemeinen Feiertag oder Sonnabend, so endet die Frist mit Ablauf des nächsten Werktages.\nDer Widerspruch muss die Bezeichnung der angefochtenen Löschungsankündigung sowie die Erklärung enthalten, dass Widerspruch gegen diese Löschungsankündigung eingelegt wird. Er ist zu unterzeichnen und soll begründet werden."
    },
    {
      "date": "2025-06-06",
      "id": "111569",
      "original_text": "Einreichung neuer Dokumente\nNordrhein-Westfalen Amtsgericht Gütersloh HRB 3842\nStadtwerke Gütersloh GmbH – Gütersloh",
      "type": "Einreichung neuer Dokumente",
      "state": "Nordrhein-Westfalen",
      "amtsgericht": "Amtsgericht Gütersloh",
      "registernummer": "HRB 3842",
      "registerart": "HRB",
      "company_name": "Stadtwerke Gütersloh GmbH",
      "company_seat": "Gütersloh",
      "details": "06.06.2025 (Bekanntmachungsdatum)\n\nNordrhein-Westfalen Amtsgericht Gütersloh HRB 3842\nEinreichung neuer Dokumente 04.06.2025 (Eintragungsdatum)\n\nStadtwerke Gütersloh GmbH\nGesellschaft mit beschränkter Haftung\nGütersloh\n\nDem Registergericht ist eine neue Liste der Mitglieder des Aufsichtsrates eingereicht worden."
    },
    {
      "date": "2025-06-06",
      "id": "111570",
      "original_text": "Löschungsankündigung\nNordrhein-Westfalen Amtsgericht Hamm HRB 10700\nPOTT 13 Consulting UG (haftungsbeschränkt) – Bergkamen",
      "type": "Löschungsankündigung",
      "state": "Nordrhein-Westfalen",
      "amtsgericht": "Amtsgericht Hamm",
      "registernummer": "HRB 10700",
      "registerart": "HRB",
      "company_name": "POTT 13 Consulting UG (haftungsbeschränkt)",
      "company_seat": "Bergkamen",
      "details": "06.06.2025 (Bekanntmachungsdatum)\n\nNordrhein-Westfalen Amtsgericht Hamm HRB 10700\nLöschungsankündigung\n\nPOTT 13 Consulting UG (haftungsbeschränkt)\nGesellschaft mit beschränkter Haftung\nBergkamen\n\nDas Registergericht beabsichtigt die Gesellschaft von Amts wegen nach § 394 FamFG zu löschen. Die Frist zur Erhebung eines Widerspruchs ist auf drei Monate festgesetzt."
    },
    {
      "date": "2025-06-06",
      "id": "111571",
      "original_text": "Löschungsankündigung\nNordrhein-Westfalen Amtsgericht Düsseldorf HRB 93916\nPEDOLA Technologies GmbH – Düsseldorf",
      "type": "Löschungsankündigung",
      "state": "Nordrhein-Westfalen",
      "amtsgericht": "Amtsgericht Düsseldorf",
      "registernummer": "HRB 93916",
      "registerart": "HRB",
      "company_name": "PEDOLA Technologies GmbH",
      "company_seat": "Düsseldorf",
      "details": "06.06.2025 (Bekanntmachungsdatum)\n\nNordrhein-Westfalen Amtsgericht Düsseldorf HRB 93916\nLöschungsankündigung\n\nPEDOLA Technologies GmbH\nGesellschaft mit beschränkter Haftung\nDüsseldorf\n\nDas Registergericht beabsichtigt die Gesellschaft von Amts wegen nach § 394 Abs. 1 FamFG zu löschen. Die Frist zur Erhebung eines Widerspruchs ist auf einen Monat festgesetzt.\n\nRechtsbehelfsbelehrung:\nDas Widerspruchsrecht steht jedem zu, der an der Unterlassung der Löschung ein berechtigtes Interesse hat. Der Widerspruch ist bei dem Amtsgericht Düsseldorf -Registergericht-, Werdener Straße 1, 40227 Düsseldorf schriftlich in deutscher Sprache oder zur Niederschrift der Geschäftsstelle einzulegen. Der Widerspruch kann auch zur Niederschrift der Geschäftsstelle eines jeden Amtsgerichtes abgegeben werden. Die Einlegung ist auch durch Übertragung eines elektronischen Dokuments an die elektronische Poststelle des Gerichts möglich. Das elektronische Dokument muss für die Bearbeitung durch das Gericht geeignet und mit einer qualifizierten elektronischen Signatur der verantwortenden Person versehen sein oder von der verantwortenden Person signiert und auf einem sicheren Übermittlungsweg gemäß § 130a ZPO nach näherer Maßgabe der Verordnung über die technischen Rahmenbedingungen des elektronischen Rechtsverkehrs und über das besondere elektronische Behördenpostfach (BGBl. I, S.3803) eingereicht werden. Weitere Informationen erhalten Sie auf der Internetseite www.justiz.de.\nDer Widerspruch muss spätestens innerhalb der gesetzten Frist nach dem Datum der Bekanntmachung der Löschungsankündigung bei dem Amtsgericht - Registergericht - Düsseldorf eingegangen sein.  Dies gilt auch dann, wenn der Widerspruch zur Niederschrift der Geschäftsstelle eines anderen Amtsgerichtes abgegeben wurde. Die Frist beginnt mit dem Tage der Bekanntmachung der Löschungsankündigung in dem für die Bekanntmachung der Eintragungen in das Handelsregister bestimmten elektronischen Informations- und Kommunikationssystem nach § 10 des Handelsgesetzbuches. Fällt das Ende der Frist auf einen Sonntag, einen allgemeinen Feiertag oder Sonnabend, so endet die Frist mit Ablauf des nächsten Werktages.\nDer Widerspruch muss die Bezeichnung der angefochtenen Löschungsankündigung sowie die Erklärung enthalten, dass Widerspruch gegen diese Löschungsankündigung eingelegt wird. Er ist zu unterzeichnen und soll begründet werden."
    },
    {
      "date": "2025-06-06",
      "id": "111572",
      "original_text": "Registerbekanntmachung nach dem Umwandlungsgesetz\nNordrhein-Westfalen Amtsgericht Düsseldorf HRA 27507\nAugsburg Annastraße EBR Projektentwicklungs SARL & Co. KG – Düsseldorf",
      "type": "Registerbekanntmachung nach dem Umwandlungsgesetz",
      "state": "Nordrhein-Westfalen",
      "amtsgericht": "Amtsgericht Düsseldorf",
      "registernummer": "HRA 27507",
      "registerart": "HRA",
      "company_name": "Augsburg Annastraße EBR Projektentwicklungs SARL & Co. KG",
      "company_seat": "Düsseldorf",
      "details": "06.06.2025 (Bekanntmachungsdatum)\n\nNordrhein-Westfalen Amtsgericht Düsseldorf HRA 27507\nRegisterbekanntmachung nach dem Umwandlungsgesetz\n\nAugsburg Annastraße EBR Projektentwicklungs SARL & Co. KG\nKommanditgesellschaft\nDüsseldorf\n\nDem Registergericht ist ein Entwurf des Formwechselplans vom 16.05.2025 über einen grenzüberschreitenden vollständigen Formwechsel der bisher binationalen Kommanditgesellschaft Augsburg Annastraße EBR Projektentwicklungs SARL & Co. KG mit Sitz in Düsseldorf (Amtsgericht Düsseldorf, HRA 27507) in die Augsburg Annastraße EBR Projektentwicklungs SCS (société en commandite simple) mit Sitz in Luxemburg, Großherzogtum Luxemburg, (Registre de Commerce et des Sociétés de Luxembourg, B289939) eingereicht worden.\nDie Anteilsinhaber, die Gläubiger, sowie die zuständigen Betriebsräte der an dem grenzüberschreitenden Formwechsel beteiligten Gesellschaft oder, soweit es keinen Betriebsrat gibt, die Arbeitnehmer der an dem grenzüberschreitenden Formwechsel beteiligten Gesellschaft, können der Gesellschaft spätestens fünf Arbeitstage vor dem Tag der Gesellschafterversammlung Bemerkungen zum Formwechselplan übermitteln."
    },
    {
      "date": "2025-06-06",
      "id": "111573",
      "original_text": "Einreichung neuer Dokumente\nNordrhein-Westfalen Amtsgericht Bonn HRB 29259\nAFC Consulting Group AG – Bonn",
      "type": "Einreichung neuer Dokumente",
      "state": "Nordrhein-Westfalen",
      "amtsgericht": "Amtsgericht Bonn",
      "registernummer": "HRB 29259",
      "registerart": "HRB",
      "company_name": "AFC Consulting Group AG",
      "company_seat": "Bonn",
      "details": "06.06.2025 (Bekanntmachungsdatum)\n\nNordrhein-Westfalen Amtsgericht Bonn HRB 29259\nEinreichung neuer Dokumente\n\nAFC Consulting Group AG\nAktiengesellschaft\nBonn\n\nDem Registergericht ist eine neue Liste der Mitglieder des Aufsichtsrates eingereicht worden."
    },
    {
      "date": "2025-06-06",
      "id": "111574",
      "original_text": "Einreichung neuer Dokumente\nNordrhein-Westfalen Amtsgericht Köln HRB 59026\nCapdura AG – Leverkusen",
      "type": "Einreichung neuer Dokumente",
      "state": "Nordrhein-Westfalen",
      "amtsgericht": "Amtsgericht Köln",
      "registernummer": "HRB 59026",
      "registerart": "HRB",
      "company_name": "Capdura AG",
      "company_seat": "Leverkusen",
      "details": "06.06.2025 (Bekanntmachungsdatum)\n\nNordrhein-Westfalen Amtsgericht Köln HRB 59026\nEinreichung neuer Dokumente\n\nCapdura AG\nAktiengesellschaft\nLeverkusen\n\nDem Registergericht ist eine Liste der Mitglieder des Aufsichtsrates eingereicht worden."
    },
    {
      "date": "2025-06-06",
      "id": "111575",
      "original_text": "Registerbekanntmachung nach dem Umwandlungsgesetz\nNordrhein-Westfalen Amtsgericht Essen HRB 27724\nExperts & Talents Nord GmbH – Essen",
      "type": "Registerbekanntmachung nach dem Umwandlungsgesetz",
      "state": "Nordrhein-Westfalen",
      "amtsgericht": "Amtsgericht Essen",
      "registernummer": "HRB 27724",
      "registerart": "HRB",
      "company_name": "Experts & Talents Nord GmbH",
      "company_seat": "Essen",
      "details": "06.06.2025 (Bekanntmachungsdatum)\n\nNordrhein-Westfalen Amtsgericht Essen HRB 27724\nRegisterbekanntmachung nach dem Umwandlungsgesetz 06.06.2025 (Eintragungsdatum)\n\nExperts & Talents Nord GmbH\nGesellschaft mit beschränkter Haftung\nEssen\n\nDen Gläubigern der an der Verschmelzung beteiligten Rechtsträger ist, wenn sie binnen sechs Monaten nach dem Tag, an dem die Eintragung der Verschmelzung in das Register des Sitzes derjenigen Rechtsträger deren Gläubiger sie sind, nach § 19 Absatz 3 UmwG als bekanntgemacht gilt, ihren Anspruch nach Grund und Höhe schriftlich anmelden, Sicherheit zu leisten, soweit sie nicht Befriedigung verlangen können. Dieses Recht steht den Gläubigern jedoch nur zu, wenn sie glaubhaft machen, dass durch die Verschmelzung die Erfüllung ihrer Forderung gefährdet wird."
    },
    {
      "date": "2025-06-06",
      "id": "111576",
      "original_text": "Registerbekanntmachung nach dem Umwandlungsgesetz\nNordrhein-Westfalen Amtsgericht Aachen HRB 9495\nAS/point Software und Beratungsgesellschaft mbH – Würselen",
      "type": "Registerbekanntmachung nach dem Umwandlungsgesetz",
      "state": "Nordrhein-Westfalen",
      "amtsgericht": "Amtsgericht Aachen",
      "registernummer": "HRB 9495",
      "registerart": "HRB",
      "company_name": "AS/point Software und Beratungsgesellschaft mbH",
      "company_seat": "Würselen",
      "details": "06.06.2025 (Bekanntmachungsdatum)\n\nNordrhein-Westfalen Amtsgericht Aachen HRB 9495\nRegisterbekanntmachung nach dem Umwandlungsgesetz 06.06.2025 (Eintragungsdatum)\n\nAS/point Software und Beratungsgesellschaft mbH\nGesellschaft mit beschränkter Haftung\nWürselen\n\nDen Gläubigern der an der Verschmelzung beteiligten Rechtsträger ist, wenn sie binnen sechs Monaten nach dem Tag, an dem die Eintragung der Verschmelzung in das Register des Sitzes derjenigen Rechtsträger deren Gläubiger sie sind, nach § 19 Absatz 3 UmwG als bekanntgemacht gilt, ihren Anspruch nach Grund und Höhe schriftlich anmelden, Sicherheit zu leisten, soweit sie nicht Befriedigung verlangen können. Dieses Recht steht den Gläubigern jedoch nur zu, wenn sie glaubhaft machen, dass durch die Verschmelzung die Erfüllung ihrer Forderung gefährdet wird."
    },
    {
      "date": "2025-06-06",
      "id": "111577",
      "original_text": "Löschungsankündigung\nNordrhein-Westfalen Amtsgericht Kleve HRB 13417\nSchut Spedition GmbH – Kranenburg",
      "type": "Löschungsankündigung",
      "state": "Nordrhein-Westfalen",
      "amtsgericht": "Amtsgericht Kleve",
      "registernummer": "HRB 13417",
      "registerart": "HRB",
      "company_name": "Schut Spedition GmbH",
      "company_seat": "Kranenburg",
      "details": "06.06.2025 (Bekanntmachungsdatum)\n\nNordrhein-Westfalen Amtsgericht Kleve HRB 13417\nLöschungsankündigung\n\nSchut Spedition GmbH\nGesellschaft mit beschränkter Haftung\nKranenburg\n\nDas Registergericht beabsichtigt die Gesellschaft von Amts wegen nach § 394 FamFG zu löschen. Die Frist zur Erhebung eines Widerspruchs ist auf einen Monat festgesetzt."
    },
    {
      "date": "2025-06-06",
      "id": "111578",
      "original_text": "Registerbekanntmachung nach dem Umwandlungsgesetz\nNordrhein-Westfalen Amtsgericht Wuppertal HRB 14430\nDr. Pecher AG – Erkrath",
      "type": "Registerbekanntmachung nach dem Umwandlungsgesetz",
      "state": "Nordrhein-Westfalen",
      "amtsgericht": "Amtsgericht Wuppertal",
      "registernummer": "HRB 14430",
      "registerart": "HRB",
      "company_name": "Dr. Pecher AG",
      "company_seat": "Erkrath",
      "details": "06.06.2025 (Bekanntmachungsdatum)\n\nNordrhein-Westfalen Amtsgericht Wuppertal HRB 14430\nRegisterbekanntmachung nach dem Umwandlungsgesetz 06.06.2025 (Eintragungsdatum)\n\nDr. Pecher AG\nAktiengesellschaft\nErkrath\n\nDen Gläubigern der an der formwechselnden Umwandlung beteiligten Rechtsträger ist, wenn sie binnen sechs Monaten nach dem Tag, an dem die Eintragung der formwechselnden Umwandlung in das Register des Sitzes desjenigen Rechtsträgers, dessen Gläubiger sie sind, nach § 19 Absatz 3 UmwG als bekanntgemacht gilt, ihren Anspruch nach Grund und Höhe schriftlich anmelden, Sicherheit zu leisten, soweit sie nicht Befriedigung verlangen können. Dieses Recht steht den Gläubigern jedoch nur zu, wenn sie glaubhaft machen, dass durch die formwechselnden Umwandlung die Erfüllung ihrer Forderung gefährdet wird."
    },
    {
      "date": "2025-06-06",
      "id": "111579",
      "original_text": "Löschungsankündigung\nNordrhein-Westfalen Amtsgericht Wuppertal HRB 34087\nFix & Fertig Transport Montage Umzug GmbH – Remscheid",
      "type": "Löschungsankündigung",
      "state": "Nordrhein-Westfalen",
      "amtsgericht": "Amtsgericht Wuppertal",
      "registernummer": "HRB 34087",
      "registerart": "HRB",
      "company_name": "Fix & Fertig Transport Montage Umzug GmbH",
      "company_seat": "Remscheid",
      "details": "06.06.2025 (Bekanntmachungsdatum)\n\nNordrhein-Westfalen Amtsgericht Wuppertal HRB 34087\nLöschungsankündigung\n\nFix & Fertig Transport Montage Umzug GmbH\nGesellschaft mit beschränkter Haftung\nRemscheid\n\nDas Registergericht beabsichtigt die Gesellschaft von Amts wegen nach § 394 FamFG zu löschen. Die Frist zur Erhebung eines Widerspruchs ist auf einen Monat festgesetzt."
    },
    {
      "date": "2025-06-06",
      "id": "111580",
      "original_text": "Sonstige Registerbekanntmachung\nNordrhein-Westfalen Amtsgericht Wuppertal HRB 10029\nMichael Pintarelli Finanzdienstleistungen AG – Wuppertal",
      "type": "Sonstige Registerbekanntmachung",
      "state": "Nordrhein-Westfalen",
      "amtsgericht": "Amtsgericht Wuppertal",
      "registernummer": "HRB 10029",
      "registerart": "HRB",
      "company_name": "Michael Pintarelli Finanzdienstleistungen AG",
      "company_seat": "Wuppertal",
      "details": "06.06.2025 (Bekanntmachungsdatum)\n\nNordrhein-Westfalen Amtsgericht Wuppertal HRB 10029\nSonstige Registerbekanntmachung 06.06.2025 (Eintragungsdatum)\n\nMichael Pintarelli Finanzdienstleistungen AG\nAktiengesellschaft\nWuppertal\n\nDem Registergericht ist eine Liste der Mitglieder des Aufsichtsrates eingereicht worden."
    },
    {
      "date": "2025-06-06",
      "id": "111581",
      "original_text": "Registerbekanntmachung nach dem Umwandlungsgesetz\nNordrhein-Westfalen Amtsgericht Münster HRB 19005\nSolarBlick Zweite Betriebs UG (haftungsbeschränkt) – Münster",
      "type": "Registerbekanntmachung nach dem Umwandlungsgesetz",
      "state": "Nordrhein-Westfalen",
      "amtsgericht": "Amtsgericht Münster",
      "registernummer": "HRB 19005",
      "registerart": "HRB",
      "company_name": "SolarBlick Zweite Betriebs UG (haftungsbeschränkt)",
      "company_seat": "Münster",
      "details": "06.06.2025 (Bekanntmachungsdatum)\n\nNordrhein-Westfalen Amtsgericht Münster HRB 19005\nRegisterbekanntmachung nach dem Umwandlungsgesetz 06.06.2025 (Eintragungsdatum)\n\nSolarBlick Zweite Betriebs UG (haftungsbeschränkt)\nGesellschaft mit beschränkter Haftung\nMünster\n\nDen Gläubigern der an der Verschmelzung beteiligten Rechtsträger ist, wenn sie binnen sechs Monaten nach dem Tag, an dem die Eintragung der Verschmelzung in das Register des Sitzes desjenigen Rechtsträgers, dessen Gläubiger sie sind, nach § 19 Absatz 3 UmwG als bekanntgemacht gilt, ihren Anspruch nach Grund und Höhe schriftlich anmelden, Sicherheit zu leisten, soweit sie nicht Befriedigung verlangen können. Dieses Recht steht den Gläubigern jedoch nur zu, wenn sie glaubhaft machen, dass durch die Verschmelzung die Erfüllung ihrer Forderung gefährdet wird."
    },
    {
      "date": "2025-06-06",
      "id": "111582",
      "original_text": "Registerbekanntmachung nach dem Umwandlungsgesetz\nNordrhein-Westfalen Amtsgericht Köln HRB 96588\nHandelsvertretung Blömeling GmbH – Pulheim",
      "type": "Registerbekanntmachung nach dem Umwandlungsgesetz",
      "state": "Nordrhein-Westfalen",
      "amtsgericht": "Amtsgericht Köln",
      "registernummer": "HRB 96588",
      "registerart": "HRB",
      "company_name": "Handelsvertretung Blömeling GmbH",
      "company_seat": "Pulheim",
      "details": "06.06.2025 (Bekanntmachungsdatum)\n\nNordrhein-Westfalen Amtsgericht Köln HRB 96588\nRegisterbekanntmachung nach dem Umwandlungsgesetz\n\nHandelsvertretung Blömeling GmbH\nGesellschaft mit beschränkter Haftung\nPulheim\n\nDem Registergericht ist der Entwurf eines Verschmelzungsplanes über die geplante Verschmelzung der Handelsvertretung Blömeling GmbH mit Sitz in Pulheim (Amtsgericht Köln HRB 96588) mit der DETEC Marketing GmbH mit Sitz in Egg, Österreich (Firmenbuch des Landesgerichtes Feldkirch FN 220320 a) eingereicht worden.\n\n1. Beteiligte Gesellschaften und deren Register:\na) Die übertragende Gesellschaft: Handelsvertretung Blömeling GmbH mit dem Sitz in 50259 Pulheim, Alfred-Nobel-Straße 10, Amtsgericht Köln HRB 96588, ist eine Gesellschaft mit beschränkter Haftung nach dem Recht der Bundesrepublik Deutschland, hat ihren Sitz in Pulheim, Deutschland (DE) und ist eingetragen im Handelsregister des Amtsgerichts Köln unter HRB-Nr.: 96588.\nb) Die übernehmende Gesellschaft: DETEC Marketing GmbH mit dem Sitz in A-6863 Egg, Melisau 1039, Firmenbuch des Landesgerichtes Feldkirch FN 220320 a, ist eine Gesellschaft mit beschränkter Haftung nach dem Recht der Republik Österreich, hat ihren Sitz in Egg, Österreich (AT) und ist eingetragen im Firmenbuch der Republik Österreich unter FN 220320 a; zuständiges Gericht ist das Landesgericht Feldkirch.\n\n2. Hinweis auf die Modalitäten für die Ausübung der Rechte von Minderheitsgesellschaftern: Ein Hinweis auf die Modalitäten für die Ausübung der Rechte von Minderheitsgesellschaftern ist nicht bekannt zu machen,\na) da es sich um die Verschmelzung von zwei Schwestergesellschaften handelt, bei denen keine Minderheitsgesellschafter vorhanden sind, die bei einer entsprechenden Beschlussfassung überstimmt werden könnten; und auch\nb) da die übertragende Gesellschaft lediglich einen Gesellschafter hat und die übernehmende Gesellschaft ebenso lediglich einen Gesellschafter hat, so dass bei der übertragenden GmbH und der übernehmenden Gesellschaft keine Minderheitsgesellschafter vorhanden sind.\n\n3. Hinweis auf die Modalitäten für die Ausübung der Rechte von Gläubigern:\na) Die Rechte der Inhaber von Sonderrechten in der übertragenden Gesellschaft ergeben sich aus § 313 UmwG in Verbindung mit § 23 UmwG, woraus sich ergibt, dass den Inhabern von Sonderrechten in der übertragenden Gesellschaft gleichwertige Rechte in der übernehmenden Gesellschaft zu gewähren sind.\nb) Die Rechte der Gläubiger der übertragenden Gesellschaft ergeben sich aus § 314 UmwG. Danach ist den Gläubigern der übertragenden Gesellschaft, soweit sie nicht Befriedigung ihres Anspruchs verlangen können, Sicherheit zu leisten, wenn sie binnen drei Monaten nach dem Tag, an dem der Verschmelzungsplan gemäß § 308 UmwG in Verbindung mit § 10 HGB bekanntgemacht worden ist, ihren Anspruch nach Grund und Höhe schriftlich anmelden. Dieses Recht steht den Gläubigern jedoch nur zu, wenn sie glaubhaft machen, dass durch die Verschmelzung die Erfüllung ihrer Forderung gefährdet wird, und wenn die Forderung vor Bekanntmachung des Verschmelzungsplans entstanden ist, aber im Zeitpunkt der Bekanntmachung noch nicht fällig geworden ist.\nDer Anspruch ist unmittelbar gegenüber der übertragenden Gesellschaft: Handelsvertretung Blömeling GmbH unter deren Geschäftsanschrift: D-50259 Pulheim, Alfred-Nobel-Straße 10, geltend zu machen.\nc) Die Rechte der Inhaber von Schuldverschreibungen und Genussrechten in der übernehmenden Gesellschaft ergeben sich aus § 3 Abs. 2 österreichisches EU-Verschmelzungsgesetz in Verbindung mit § 226 Abs. 3 österreichisches AktG, woraus sich ergibt, dass diesen Inhabern von Schuldverschreibungen und Genussrechten gleichwertige Rechte zu gewähren sind oder die Änderung der Rechte oder das Recht selbst angemessen abzugelten sind.\nd) Die Rechte der Gläubiger der übernehmenden Gesellschaft ergeben sich\naa. entsprechend aus § 22 UmwG:\nDanach ist den Gläubigern der übernehmenden Gesellschaft Sicherheit zu leisten, wenn sie binnen sechs Monaten nach dem Tag, an dem die Eintragung der Verschmelzung in das Register des Sitzes der übertragenden Gesellschaft entsprechend § 19 Abs. 3 UmwG als bekannt gemacht gilt, ihren Anspruch nach Grund und Höhe schriftlich anmelden. Dieses Recht steht den Gläubigern jedoch nur zu, wenn sie glaubhaft machen, dass durch die Verschmelzung die Erfüllung ihrer Forderung gefährdet wird. Die Gläubiger sind in der Bekanntmachung der Eintragung der Verschmelzung bei der übertragenden Gesellschaft gemäß § 308 in Verbindung mit § 22 Abs. 1 Satz 3 UmwG auf dieses Recht hinzuweisen. Hinsichtlich des Anspruchs der Gläubiger ist unerheblich, ob dieser Anspruch auf Vertrag oder Gesetz beruht. Sicherheitsleistungen können aber nur Gläubiger eines sogenannten obligatorischen Anspruches erlangen. § 22 UmwG erfasst keine dinglichen Ansprüche; insoweit stellt bereits der Gegenstand des dinglichen Rechts die Sicherheit dar.\nbb. und aus § 226 Abs. 1 und 2 österreichisches AktG sowie aus § 96 österr. GmbHG: Danach ist den Gläubigern von übertragender und übernehmender Gesellschaft, wenn sie sich binnen sechs Monaten nach der Veröffentlichung der Eintragung der Verschmelzung zu diesem Zwecke melden, Sicherheit zu leisten, soweit sie nicht Befriedigung verlangen können; dieses Recht steht den Gläubigern jedoch nur zu, wenn sie glaubhaft machen, dass durch die Verschmelzung die Erfüllung ihrer Forderung gefährdet wird. Die Gläubiger sind in der Veröffentlichung der Eintragung auf dieses Recht hinzuweisen.\ncc. Das Recht, Sicherheitsleistungen zu verlangen, steht Gläubigern nicht zu, die im Falle der Insolvenz ein Recht auf vorzugsweise Befriedigung aus einer Deckungsmasse haben, die nach gesetzlicher Vorschrift zu ihrem Schutz errichtet und staatlich überwacht ist. Der Inhalt der Forderung ist nur insoweit von Bedeutung, als diese einen Vermögenswert darstellen muss. Der zu sichernde Anspruch muss deshalb nicht notwendig unmittelbar auf Geld gerichtet sein, vielmehr besteht etwa auch bei einem Anspruch auf Lieferung von Sach- oder sonstigen Leistungen ein Sicherheitsbedürfnis hinsichtlich eines eventuell später daraus resultierenden Schadensersatzanspruches.\nDer Anspruch ist unmittelbar gegenüber der übernehmenden Gesellschaft: DETEC Marketing GmbH unter deren Geschäftsanschrift: A-6863 Egg, Melisau 1039, geltend zu machen.\n\n4. Es ergeht gemäß § 308 Abs. 1 Satz 1 Nr. 4 der Hinweis an die Anteilsinhaber und Gläubiger der an der grenzüberschreitenden Verschmelzung beteiligten Gesellschaften sowie, nachdem es bei den an der grenzüberschreitenden Verschmelzung beteiligten Gesellschaften keinen Betriebsrat gibt, an die Arbeitnehmer der an der grenzüberschreitenden Verschmelzung beteiligten Gesellschaften, dass sie der jeweiligen Gesellschaft spätestens fünf Arbeitstage vor dem Tag der Gesellschafterversammlung Bemerkungen zum Verschmelzungsplan übermitteln können.\n\n5. Unter der Anschrift DETEC Marketing GmbH, A-6863 Egg, Melisau 1039, können im Übrigen vollständige Auskünfte über die Modalitäten für die Ausübung der Rechte der Gläubiger und der Minderheitsgesellschafter eingeholt werden."
    },
    {
      "date": "2025-06-06",
      "id": "111583",
      "original_text": "Registerbekanntmachung nach dem Umwandlungsgesetz\nNordrhein-Westfalen Amtsgericht Bonn HRB 29361\nDeutsche Post & Paket Beteiligungsgesellschaft 2 GmbH – Bonn",
      "type": "Registerbekanntmachung nach dem Umwandlungsgesetz",
      "state": "Nordrhein-Westfalen",
      "amtsgericht": "Amtsgericht Bonn",
      "registernummer": "HRB 29361",
      "registerart": "HRB",
      "company_name": "Deutsche Post & Paket Beteiligungsgesellschaft 2 GmbH",
      "company_seat": "Bonn",
      "details": "06.06.2025 (Bekanntmachungsdatum)\n\nNordrhein-Westfalen Amtsgericht Bonn HRB 29361\nRegisterbekanntmachung nach dem Umwandlungsgesetz 06.06.2025 (Eintragungsdatum)\n\nDeutsche Post & Paket Beteiligungsgesellschaft 2 GmbH\nGesellschaft mit beschränkter Haftung\nBonn\n\nDen Gläubigern der an der Verschmelzung beteiligten Rechtsträger ist, wenn sie binnen sechs Monaten nach dem Tag, an dem die Eintragung der Verschmelzung in das Register des Sitzes desjenigen Rechtsträgers, dessen Gläubiger sie sind, nach § 19 Absatz 3 UmwG als bekanntgemacht gilt, ihren Anspruch nach Grund und Höhe schriftlich anmelden, Sicherheit zu leisten, soweit sie nicht Befriedigung verlangen können. Dieses Recht steht den Gläubigern jedoch nur zu, wenn sie glaubhaft machen, dass durch die Verschmelzung die Erfüllung ihrer Forderung gefährdet wird."
    },
    {
      "date": "2025-06-06",
      "id": "111584",
      "original_text": "Einreichung neuer Dokumente\nNordrhein-Westfalen Amtsgericht Steinfurt HRB 10865\nKlein + Günther Beteiligungs SE – Lengerich",
      "type": "Einreichung neuer Dokumente",
      "state": "Nordrhein-Westfalen",
      "amtsgericht": "Amtsgericht Steinfurt",
      "registernummer": "HRB 10865",
      "registerart": "HRB",
      "company_name": "Klein + Günther Beteiligungs SE",
      "company_seat": "Lengerich",
      "details": "06.06.2025 (Bekanntmachungsdatum)\n\nNordrhein-Westfalen Amtsgericht Steinfurt HRB 10865\nEinreichung neuer Dokumente\n\nKlein + Günther Beteiligungs SE\nEuropäische Aktiengesellschaft (SE)\nLengerich\n\nDem Registergericht ist eine neue Liste der Mitglieder des Aufsichtsrates eingereicht worden."
    },
    {
      "date": "2025-06-06",
      "id": "111585",
      "original_text": "Einreichung neuer Dokumente\nNordrhein-Westfalen Amtsgericht Steinfurt HRB 10863\nBischof + Klein Holding Beteiligungs SE – Lengerich",
      "type": "Einreichung neuer Dokumente",
      "state": "Nordrhein-Westfalen",
      "amtsgericht": "Amtsgericht Steinfurt",
      "registernummer": "HRB 10863",
      "registerart": "HRB",
      "company_name": "Bischof + Klein Holding Beteiligungs SE",
      "company_seat": "Lengerich",
      "details": "06.06.2025 (Bekanntmachungsdatum)\n\nNordrhein-Westfalen Amtsgericht Steinfurt HRB 10863\nEinreichung neuer Dokumente 06.06.2025 (Eintragungsdatum)\n\nBischof + Klein Holding Beteiligungs SE\nEuropäische Aktiengesellschaft (SE)\nLengerich\n\nDem Registergericht ist eine neue Liste der Mitglieder des Aufsichtsrates eingereicht worden."
    },
    {
      "date": "2025-06-06",
      "id": "111586",
      "original_text": "Löschungsankündigung\nNordrhein-Westfalen Amtsgericht Hamm HRB 7890\nMediale Welt Effert UG (haftungsbeschränkt) – Hamm",
      "type": "Löschungsankündigung",
      "state": "Nordrhein-Westfalen",
      "amtsgericht": "Amtsgericht Hamm",
      "registernummer": "HRB 7890",
      "registerart": "HRB",
      "company_name": "Mediale Welt Effert UG (haftungsbeschränkt)",
      "company_seat": "Hamm",
      "details": "06.06.2025 (Bekanntmachungsdatum)\n\nNordrhein-Westfalen Amtsgericht Hamm HRB 7890\nLöschungsankündigung\n\nMediale Welt Effert UG (haftungsbeschränkt)\nGesellschaft mit beschränkter Haftung\nHamm\n\nDas Registergericht beabsichtigt die Gesellschaft von Amts wegen nach § 394 FamFG zu löschen. Die Frist zur Erhebung eines Widerspruchs ist auf drei Monate festgesetzt."
    },
    {
      "date": "2025-06-06",
      "id": "111587",
      "original_text": "Registerbekanntmachung nach dem Umwandlungsgesetz\nNordrhein-Westfalen Amtsgericht Aachen HRB 21340\nAries Mobile GmbH – Würselen",
      "type": "Registerbekanntmachung nach dem Umwandlungsgesetz",
      "state": "Nordrhein-Westfalen",
      "amtsgericht": "Amtsgericht Aachen",
      "registernummer": "HRB 21340",
      "registerart": "HRB",
      "company_name": "Aries Mobile GmbH",
      "company_seat": "Würselen",
      "details": "06.06.2025 (Bekanntmachungsdatum)\n\nNordrhein-Westfalen Amtsgericht Aachen HRB 21340\nRegisterbekanntmachung nach dem Umwandlungsgesetz 06.06.2025 (Eintragungsdatum)\n\nAries Mobile GmbH\nGesellschaft mit beschränkter Haftung\nWürselen\n\nDen Gläubigern der an der Verschmelzung beteiligten Rechtsträger ist, wenn sie binnen sechs Monaten nach dem Tag, an dem die Eintragung der Verschmelzung in das Register des Sitzes derjenigen Rechtsträger deren Gläubiger sie sind, nach § 19 Absatz 3 UmwG als bekanntgemacht gilt, ihren Anspruch nach Grund und Höhe schriftlich anmelden, Sicherheit zu leisten, soweit sie nicht Befriedigung verlangen können. Dieses Recht steht den Gläubigern jedoch nur zu, wenn sie glaubhaft machen, dass durch die Verschmelzung die Erfüllung ihrer Forderung gefährdet wird."
    },
    {
      "date": "2025-06-06",
      "id": "111588",
      "original_text": "Registerbekanntmachung nach dem Umwandlungsgesetz\nNordrhein-Westfalen Amtsgericht Düsseldorf HRB 84033\nSoftCert Holding GmbH – Düsseldorf",
      "type": "Registerbekanntmachung nach dem Umwandlungsgesetz",
      "state": "Nordrhein-Westfalen",
      "amtsgericht": "Amtsgericht Düsseldorf",
      "registernummer": "HRB 84033",
      "registerart": "HRB",
      "company_name": "SoftCert Holding GmbH",
      "company_seat": "Düsseldorf",
      "details": "06.06.2025 (Bekanntmachungsdatum)\n\nNordrhein-Westfalen Amtsgericht Düsseldorf HRB 84033\nRegisterbekanntmachung nach dem Umwandlungsgesetz\n\nSoftCert Holding GmbH\nGesellschaft mit beschränkter Haftung\nDüsseldorf\n\nEs wird darauf hingewiesen, dass der Entwurf eines Verschmelzungsplans beim Handelsregister am 28. Mai 2025 eingereicht worden ist.\n\nAn der Verschmelzung sind die SoftCert Holding GmbH, eine Gesellschaft mit beschränkter Haftung nach deutschem Recht mit Sitz in Düsseldorf als übertragende Gesellschaft und die Intact GmbH, eine Gesellschaft mit beschränkter Haftung nach österreichischem Recht mit Sitz in Graz, Österreich als übernehmende Gesellschaft beteiligt.\n\nDie übertragende Gesellschaft ist eingetragen im Handelsregister des Amtsgerichts Düsseldorf unter HRB 84033. Die übernehmende Gesellschaft ist eingetragen im Firmenbuch des Landesgerichts für Zivilrechtssachen Graz unter FN 218078 d. 4. Im Verschmelzungsplan werden den Gläubigern der übertragenden Gesellschaft keine Sicherheiten im Sinne des § 307 Abs. 2 Nr. 14 dUmwG, wie etwa Garantien oder Zusagen, angeboten. Die Rechte der Gläubiger der übertragenden deutschen SoftCert GmbH ergeben sich aus § 314 dUmwG. Danach können Gläubiger einer übertragenden Gesellschaft verlangen, dass ihnen angemessene Sicherheiten geleistet werden für eine Forderung, die (i) vor der Bekanntmachung des Verschmelzungsplans oder seines Entwurfs entstanden, aber im Zeitpunkt der Bekanntmachung noch nicht fällig geworden ist, und (ii) deren Erfüllung durch die Verschmelzung gefährdet wird, wenn sie ihren Anspruch auf Sicherheitsleistung innerhalb von drei Monaten ab Bekanntmachung des Verschmelzungsplans gerichtlich geltend machen. 1\n\nDen Gesellschaftern, Gläubigern und Arbeitnehmern der übertragenden Gesellschaft wird mitgeteilt, dass sie der übertragenden Gesellschaft bis spätestens fünf Arbeitstage vor dem Beschlussdatum, mithin bis zum 08. Juli 2025, Bemerkungen zum Verschmelzungsplan übermitteln können.\n\nJeder Gläubiger der übertragenden Gesellschaft ist berechtigt, von der über-tragenden Gesellschaft zu verlangen, dass ihm die Jahresabschlüsse der übertragenden und übernehmenden Gesellschaft jeweils für die letzten drei Geschäftsjahre und die Schlussbilanz, wenn sie bereits vorliegt, übersandt oder in elektronsicher Form zugänglich gemacht werden.\nDie Bemerkungen zum Verschmelzungsplan können schriftlich übermittelt werden an:\nSoftCert Holding GmbH Cheruskerstr. 93 40545 Düsseldorf\noder mit dem Betreff Bemerkung zum Verschmelzungsplan per E-Mail an:\noffice@intact-systems. com.\nEtwaige Bemerkungen der Gesellschafter, der Gläubiger und der Arbeitnehmer der übertragenden Gesellschaft zum Verschmelzungsplan werden gemäß § 315 Abs. 2 Nr. 1 dUmwG der Anmeldung zur Eintragung der Verschmelzung beim Handelsregister des Amtsgerichts Düsseldorf als zuständigen Handelsregister beigefügt."
    },
    {
      "date": "2025-06-06",
      "id": "111589",
      "original_text": "Einreichung neuer Dokumente\nNordrhein-Westfalen Amtsgericht Steinfurt HRB 10864\nBischof + Klein Beteiligungs SE – Lengerich",
      "type": "Einreichung neuer Dokumente",
      "state": "Nordrhein-Westfalen",
      "amtsgericht": "Amtsgericht Steinfurt",
      "registernummer": "HRB 10864",
      "registerart": "HRB",
      "company_name": "Bischof + Klein Beteiligungs SE",
      "company_seat": "Lengerich",
      "details": "06.06.2025 (Bekanntmachungsdatum)\n\nNordrhein-Westfalen Amtsgericht Steinfurt HRB 10864\nEinreichung neuer Dokumente 06.06.2025 (Eintragungsdatum)\n\nBischof + Klein Beteiligungs SE\nEuropäische Aktiengesellschaft (SE)\nLengerich\n\nDem Registergericht ist eine neue Liste der Mitglieder des Aufsichtsrates eingereicht worden."
    },
    {
      "date": "2025-06-06",
      "id": "111590",
      "original_text": "Löschungsankündigung\nThüringen Amtsgericht Jena HRB 109023\nKfz-Systeme Günther und Schäfer GmbH – Erfurt",
      "type": "Löschungsankündigung",
      "state": "Thüringen",
      "amtsgericht": "Amtsgericht Jena",
      "registernummer": "HRB 109023",
      "registerart": "HRB",
      "company_name": "Kfz-Systeme Günther und Schäfer GmbH",
      "company_seat": "Erfurt",
      "details": "06.06.2025 (Bekanntmachungsdatum)\n\nThüringen Amtsgericht Jena HRB 109023\nLöschungsankündigung\n\nKfz-Systeme Günther und Schäfer GmbH\nGesellschaft mit beschränkter Haftung\nErfurt\n\nDas Registergericht beabsichtigt, die im Handelsregister eingetragene Gesellschaft wegen Vermögenslosigkeit nach § 394 FamFG von Amts wegen zu löschen. Die Frist zur Erhebung eines Widerspruchs gegen die beabsichtigte Löschung wird auf 6 Wochen festgesetzt."
    },
    {
      "date": "2025-06-06",
      "id": "111591",
      "original_text": "Löschungsankündigung\nHessen Amtsgericht Frankfurt am Main HRB 94272\nKaiser Restaurant GmbH – Frankfurt am Main",
      "type": "Löschungsankündigung",
      "state": "Hessen",
      "amtsgericht": "Amtsgericht Frankfurt am Main",
      "registernummer": "HRB 94272",
      "registerart": "HRB",
      "company_name": "Kaiser Restaurant GmbH",
      "company_seat": "Frankfurt am Main",
      "details": "06.06.2025 (Bekanntmachungsdatum)\n\nHessen Amtsgericht Frankfurt am Main HRB 94272\nLöschungsankündigung\n\nKaiser Restaurant GmbH\nGesellschaft mit beschränkter Haftung\nFrankfurt am Main\n\nDas Registergericht beabsichtigt die im Handelsregister eingetragene Gesellschaft von Amts wegen nach § 394 FamFG zu löschen. Die Frist zur Erhebung eines Widerspruchs gegen die beabsichtigte Löschung wird auf 1 Monat festgesetzt."
    },
    {
      "date": "2025-06-06",
      "id": "111592",
      "original_text": "Einreichung neuer Dokumente\nHessen Amtsgericht Kassel HRB 2084\nRaiffeisen Waren GmbH – Kassel",
      "type": "Einreichung neuer Dokumente",
      "state": "Hessen",
      "amtsgericht": "Amtsgericht Kassel",
      "registernummer": "HRB 2084",
      "registerart": "HRB",
      "company_name": "Raiffeisen Waren GmbH",
      "company_seat": "Kassel",
      "details": "06.06.2025 (Bekanntmachungsdatum)\n\nHessen Amtsgericht Kassel HRB 2084\nEinreichung neuer Dokumente\n\nRaiffeisen Waren GmbH\nGesellschaft mit beschränkter Haftung\nKassel\n\nDurch eine Änderung in den Personen der Aufsichtsratsmitglieder ist eine Liste der Mitglieder des Aufsichtsrates zum Handelsregister eingereicht worden."
    },
    {
      "date": "2025-06-06",
      "id": "111593",
      "original_text": "Löschungsankündigung\nHessen Amtsgericht Frankfurt am Main HRB 112176\nHaosen Germany GmbH – Sulzbach",
      "type": "Löschungsankündigung",
      "state": "Hessen",
      "amtsgericht": "Amtsgericht Frankfurt am Main",
      "registernummer": "HRB 112176",
      "registerart": "HRB",
      "company_name": "Haosen Germany GmbH",
      "company_seat": "Sulzbach",
      "details": "06.06.2025 (Bekanntmachungsdatum)\n\nHessen Amtsgericht Frankfurt am Main HRB 112176\nLöschungsankündigung\n\nHaosen Germany GmbH\nGesellschaft mit beschränkter Haftung\nSulzbach\n\nDas Registergericht beabsichtigt die im Handelsregister eingetragene Gesellschaft von Amts wegen nach § 394 FamFG zu löschen. Die Frist zur Erhebung eines Widerspruchs gegen die beabsichtigte Löschung wird auf 3 Monate festgesetzt."
    },
    {
      "date": "2025-06-06",
      "id": "111594",
      "original_text": "Löschungsankündigung\nHessen Amtsgericht Darmstadt HRB 98163\nBRBO Consulting UG (haftungsbeschränkt) – Kelsterbach",
      "type": "Löschungsankündigung",
      "state": "Hessen",
      "amtsgericht": "Amtsgericht Darmstadt",
      "registernummer": "HRB 98163",
      "registerart": "HRB",
      "company_name": "BRBO Consulting UG (haftungsbeschränkt)",
      "company_seat": "Kelsterbach",
      "details": "06.06.2025 (Bekanntmachungsdatum)\n\nHessen Amtsgericht Darmstadt HRB 98163\nLöschungsankündigung\n\nBRBO Consulting UG (haftungsbeschränkt)\nGesellschaft mit beschränkter Haftung\nKelsterbach\n\nDas Registergericht beabsichtigt die im Handelsregister eingetragene Gesellschaft von Amts wegen nach § 394 FamFG zu löschen. Die Frist zur Erhebung eines Widerspruchs gegen die beabsichtigte Löschung wird auf 3 Monate festgesetzt."
    },
    {
      "date": "2025-06-06",
      "id": "111595",
      "original_text": "Einreichung neuer Dokumente\nHessen Amtsgericht Frankfurt am Main HRB 30000\nDEUTSCHE BANK AKTIENGESELLSCHAFT – Frankfurt am Main",
      "type": "Einreichung neuer Dokumente",
      "state": "Hessen",
      "amtsgericht": "Amtsgericht Frankfurt am Main",
      "registernummer": "HRB 30000",
      "registerart": "HRB",
      "company_name": "DEUTSCHE BANK AKTIENGESELLSCHAFT",
      "company_seat": "Frankfurt am Main",
      "details": "06.06.2025 (Bekanntmachungsdatum)\n\nHessen Amtsgericht Frankfurt am Main HRB 30000\nEinreichung neuer Dokumente 06.06.2025 (Eintragungsdatum)\n\nDEUTSCHE BANK AKTIENGESELLSCHAFT\nAktiengesellschaft\nFrankfurt am Main\n\nDurch eine Änderung in den Personen der Aufsichtsratsmitglieder ist eine Liste der Mitglieder des Aufsichtsrates zum Handelsregister eingereicht worden."
    },
    {
      "date": "2025-06-06",
      "id": "111596",
      "original_text": "Löschungsankündigung\nHessen Amtsgericht Frankfurt am Main HRB 120976\nMDTS EXPORT GmbH – Frankfurt am Main",
      "type": "Löschungsankündigung",
      "state": "Hessen",
      "amtsgericht": "Amtsgericht Frankfurt am Main",
      "registernummer": "HRB 120976",
      "registerart": "HRB",
      "company_name": "MDTS EXPORT GmbH",
      "company_seat": "Frankfurt am Main",
      "details": "06.06.2025 (Bekanntmachungsdatum)\n\nHessen Amtsgericht Frankfurt am Main HRB 120976\nLöschungsankündigung\n\nMDTS EXPORT GmbH\nGesellschaft mit beschränkter Haftung\nFrankfurt am Main\n\nDas Registergericht beabsichtigt die im Handelsregister eingetragene Gesellschaft von Amts wegen nach § 394 FamFG zu löschen. Die Frist zur Erhebung eines Widerspruchs gegen die beabsichtigte Löschung wird auf 1 Monate festgesetzt."
    },
    {
      "date": "2025-06-06",
      "id": "111597",
      "original_text": "Einreichung neuer Dokumente\nHessen Amtsgericht Wiesbaden HRB 12059\nInterRisk Lebensversicherungs-AG Vienna Insurance Group – Wiesbaden",
      "type": "Einreichung neuer Dokumente",
      "state": "Hessen",
      "amtsgericht": "Amtsgericht Wiesbaden",
      "registernummer": "HRB 12059",
      "registerart": "HRB",
      "company_name": "InterRisk Lebensversicherungs-AG Vienna Insurance Group",
      "company_seat": "Wiesbaden",
      "details": "06.06.2025 (Bekanntmachungsdatum)\n\nHessen Amtsgericht Wiesbaden HRB 12059\nEinreichung neuer Dokumente 06.06.2025 (Eintragungsdatum)\n\nInterRisk Lebensversicherungs-AG Vienna Insurance Group\nAktiengesellschaft\nWiesbaden\n\nDurch eine Änderung in den Personen der Aufsichtsratsmitglieder ist eine Liste der Mitglieder des Aufsichtsrates zum Handelsregister eingereicht worden."
    }
  ]
}