{
  "date": "2025-06-20",
  "date_of_scrape": "2025-06-21T04:12:13.908Z",
  "tool_version": "0.2.0",
  "number_of_announcements": 150,
  "announcements": [
    {
      "date": "2025-06-20",
      "id": "112779",
      "original_text": "Registerbekanntmachung nach dem Umwandlungsgesetz\nBayern Amtsgericht Augsburg HRB 22050\nCosmetic Gallery GmbH – Augsburg",
      "type": "Registerbekanntmachung nach dem Umwandlungsgesetz",
      "state": "Bayern",
      "amtsgericht": "Amtsgericht Augsburg",
      "registernummer": "HRB 22050",
      "registerart": "HRB",
      "company_name": "Cosmetic Gallery GmbH",
      "company_seat": "Augsburg",
      "details": "20.06.2025 (Bekanntmachungsdatum)\n\nBayern Amtsgericht Augsburg HRB 22050\nRegisterbekanntmachung nach dem Umwandlungsgesetz 19.06.2025 (Eintragungsdatum)\n\nCosmetic Gallery GmbH\nGesellschaft mit beschränkter Haftung\nAugsburg\n\nDen Gläubigern der an der Verschmelzung beteiligten Rechtsträger ist, wenn sie binnen sechs Monaten nach dem Tag, an dem die Eintragung der Verschmelzung in das Register des Sitzes desjenigen Rechtsträgers, dessen Gläubiger sie sind, nach § 19 Abs. 3 UmwG als bekannt gemacht gilt, ihren Anspruch nach Grund und Höhe in Textform anmelden, Sicherheit zu leisten, soweit sie nicht Befriedigung verlangen können. Dieses Recht steht den Gläubigern jedoch nur zu, wenn sie glaubhaft machen, dass durch die Verschmelzung die Erfüllung ihrer Forderung gefährdet wird."
    },
    {
      "date": "2025-06-20",
      "id": "112780",
      "original_text": "Löschungsankündigung\nBayern Amtsgericht Ingolstadt HRB 6682\nZ-Event & Gastro GmbH – Ingolstadt",
      "type": "Löschungsankündigung",
      "state": "Bayern",
      "amtsgericht": "Amtsgericht Ingolstadt",
      "registernummer": "HRB 6682",
      "registerart": "HRB",
      "company_name": "Z-Event & Gastro GmbH",
      "company_seat": "Ingolstadt",
      "details": "20.06.2025 (Bekanntmachungsdatum)\n\nBayern Amtsgericht Ingolstadt HRB 6682\nLöschungsankündigung\n\nZ-Event & Gastro GmbH\nGesellschaft mit beschränkter Haftung\nIngolstadt\n\nDas Registergericht beabsichtigt, die im Handelsregister eingetragene Gesellschaft wegen Vermögenslosigkeit von Amts wegen nach § 394 FamFG zu löschen. Die Frist zur Erhebung eines Widerspruchs ist auf einen Monat festgesetzt."
    },
    {
      "date": "2025-06-20",
      "id": "112781",
      "original_text": "Registerbekanntmachung nach dem Umwandlungsgesetz\nBayern Amtsgericht Augsburg HRB 6022\nDr. Grandel GmbH – Augsburg",
      "type": "Registerbekanntmachung nach dem Umwandlungsgesetz",
      "state": "Bayern",
      "amtsgericht": "Amtsgericht Augsburg",
      "registernummer": "HRB 6022",
      "registerart": "HRB",
      "company_name": "Dr. Grandel GmbH",
      "company_seat": "Augsburg",
      "details": "20.06.2025 (Bekanntmachungsdatum)\n\nBayern Amtsgericht Augsburg HRB 6022\nRegisterbekanntmachung nach dem Umwandlungsgesetz 19.06.2025 (Eintragungsdatum)\n\nDr. Grandel GmbH\nGesellschaft mit beschränkter Haftung\nAugsburg\n\nDen Gläubigern der an der Verschmelzung beteiligten Rechtsträger ist, wenn sie binnen sechs Monaten nach dem Tag, an dem die Eintragung der Verschmelzung in das Register des Sitzes desjenigen Rechtsträgers, dessen Gläubiger sie sind, nach § 19 Abs. 3 UmwG als bekannt gemacht gilt, ihren Anspruch nach Grund und Höhe in Textform anmelden, Sicherheit zu leisten, soweit sie nicht Befriedigung verlangen können. Dieses Recht steht den Gläubigern jedoch nur zu, wenn sie glaubhaft machen, dass durch die Verschmelzung die Erfüllung ihrer Forderung gefährdet wird."
    },
    {
      "date": "2025-06-20",
      "id": "112782",
      "original_text": "Registerbekanntmachung nach dem Umwandlungsgesetz\nHamburg Amtsgericht Hamburg HRB 163669\nKosmala & Traupe Ventures GmbH – Hamburg",
      "type": "Registerbekanntmachung nach dem Umwandlungsgesetz",
      "state": "Hamburg",
      "amtsgericht": "Amtsgericht Hamburg",
      "registernummer": "HRB 163669",
      "registerart": "HRB",
      "company_name": "Kosmala & Traupe Ventures GmbH",
      "company_seat": "Hamburg",
      "details": "20.06.2025 (Bekanntmachungsdatum)\n\nHamburg Amtsgericht Hamburg HRB 163669\nRegisterbekanntmachung nach dem Umwandlungsgesetz 20.06.2025 (Eintragungsdatum)\n\nKosmala & Traupe Ventures GmbH\nGesellschaft mit beschränkter Haftung\nHamburg\n\nAls nicht eingetragen wird bekannt gemacht:\nDen Gläubigern der an der Verschmelzung beteiligten Gesellschaften ist, wenn sie binnen sechs Monaten nach dem Tag, an dem die Eintragung der Verschmelzung in das Register des Sitzes desjenigen Rechtsträgers, dessen Gläubiger sie sind, nach § 19 Absatz 3 UmwG als bekannt gemacht gilt, ihren Anspruch nach Grund und Höhe schriftlich anmelden, Sicherheit zu leisten, soweit sie nicht Befriedigung verlangen können. Dieses Recht steht den Gläubigern jedoch nur zu, wenn sie glaubhaft machen, dass durch die Verschmelzung die Erfüllung ihrer Forderung gefährdet wird."
    },
    {
      "date": "2025-06-20",
      "id": "112783",
      "original_text": "Registerbekanntmachung nach dem Umwandlungsgesetz\nHamburg Amtsgericht Hamburg HRB 175127\nGeheimtipp Magazin GmbH – Hamburg",
      "type": "Registerbekanntmachung nach dem Umwandlungsgesetz",
      "state": "Hamburg",
      "amtsgericht": "Amtsgericht Hamburg",
      "registernummer": "HRB 175127",
      "registerart": "HRB",
      "company_name": "Geheimtipp Magazin GmbH",
      "company_seat": "Hamburg",
      "details": "20.06.2025 (Bekanntmachungsdatum)\n\nHamburg Amtsgericht Hamburg HRB 175127\nRegisterbekanntmachung nach dem Umwandlungsgesetz 20.06.2025 (Eintragungsdatum)\n\nGeheimtipp Magazin GmbH\nGesellschaft mit beschränkter Haftung\nHamburg\n\nAls nicht eingetragen wird bekannt gemacht:\nDen Gläubigern der an der Verschmelzung beteiligten Gesellschaften ist, wenn sie binnen sechs Monaten nach dem Tag, an dem die Eintragung der Verschmelzung in das Register des Sitzes desjenigen Rechtsträgers, dessen Gläubiger sie sind, nach § 19 Absatz 3 UmwG als bekannt gemacht gilt, ihren Anspruch nach Grund und Höhe schriftlich anmelden, Sicherheit zu leisten, soweit sie nicht Befriedigung verlangen können. Dieses Recht steht den Gläubigern jedoch nur zu, wenn sie glaubhaft machen, dass durch die Verschmelzung die Erfüllung ihrer Forderung gefährdet wird."
    },
    {
      "date": "2025-06-20",
      "id": "112784",
      "original_text": "Einreichung neuer Dokumente\nBrandenburg Amtsgericht Neuruppin HRB 4981\nKreiskrankenhaus Prignitz gemeinnützige GmbH – Perleberg",
      "type": "Einreichung neuer Dokumente",
      "state": "Brandenburg",
      "amtsgericht": "Amtsgericht Neuruppin",
      "registernummer": "HRB 4981",
      "registerart": "HRB",
      "company_name": "Kreiskrankenhaus Prignitz gemeinnützige GmbH",
      "company_seat": "Perleberg",
      "details": "20.06.2025 (Bekanntmachungsdatum)\n\nBrandenburg Amtsgericht Neuruppin HRB 4981\nEinreichung neuer Dokumente\n\nKreiskrankenhaus Prignitz gemeinnützige GmbH\nGesellschaft mit beschränkter Haftung\nPerleberg\n\nAls nicht eingetragen wird veröffentlicht: Eine Liste der Mitglieder des Aufsichtsrates wurde zum Handelsregister eingereicht."
    },
    {
      "date": "2025-06-20",
      "id": "112785",
      "original_text": "Registerbekanntmachung nach dem Umwandlungsgesetz\nBaden-Württemberg Amtsgericht Freiburg VR 410829\nSpielvereinigung Bamlach-Rheinweiler 1982 e.V. – Bad Bellingen",
      "type": "Registerbekanntmachung nach dem Umwandlungsgesetz",
      "state": "Baden-Württemberg",
      "amtsgericht": "Amtsgericht Freiburg",
      "registernummer": "VR 410829",
      "registerart": "VR",
      "company_name": "Spielvereinigung Bamlach-Rheinweiler 1982 e.V.",
      "company_seat": "Bad Bellingen",
      "details": "20.06.2025 (Bekanntmachungsdatum)\n\nBaden-Württemberg Amtsgericht Freiburg VR 410829\nRegisterbekanntmachung nach dem Umwandlungsgesetz 20.06.2025 (Eintragungsdatum)\n\nSpielvereinigung Bamlach-Rheinweiler 1982 e.V.\neingetragener Verein\nBad Bellingen\n\nAls nicht eingetragen wird bekanntgemacht:\nDen Gläubigern der an der Verschmelzung beteiligten Rechtsträger ist, wenn sie binnen sechs Monaten nach dem Tag, an dem die Eintragung der Verschmelzung in das Register des Sitzes desjenigen Rechtsträgers, dessen Gläubiger sie sind, nach § 19 Abs. 3 UmwG als bekanntgemacht gilt, ihren Anspruch nach Grund und Höhe schriftlich anmelden, Sicherheit zu leisten, soweit sie nicht Befriedigung verlangen können. Dieses Recht steht den Gläubigern jedoch nur zu, wenn sie glaubhaft machen, dass durch die Verschmelzung die Erfüllung ihrer Forderung gefährdet wird."
    },
    {
      "date": "2025-06-20",
      "id": "112786",
      "original_text": "Registerbekanntmachung nach dem Umwandlungsgesetz\nBaden-Württemberg Amtsgericht Stuttgart HRA 9277\nFICHTNER GmbH & Co.KG. – Stuttgart",
      "type": "Registerbekanntmachung nach dem Umwandlungsgesetz",
      "state": "Baden-Württemberg",
      "amtsgericht": "Amtsgericht Stuttgart",
      "registernummer": "HRA 9277",
      "registerart": "HRA",
      "company_name": "FICHTNER GmbH & Co.KG.",
      "company_seat": "Stuttgart",
      "details": "20.06.2025 (Bekanntmachungsdatum)\n\nBaden-Württemberg Amtsgericht Stuttgart HRA 9277\nRegisterbekanntmachung nach dem Umwandlungsgesetz 20.06.2025 (Eintragungsdatum)\n\nFICHTNER GmbH & Co.KG.\nKommanditgesellschaft\nStuttgart\n\nDen Gläubigern der an der Verschmelzung beteiligten Rechtsträger ist, wenn sie binnen sechs Monaten nach dem Tag, an dem die Eintragung der Verschmelzung in das Register des Sitzes desjenigen Rechtsträgers, dessen Gläubiger sie sind, nach § 19 Abs. 3 UmwG als bekanntgemacht gilt, ihren Anspruch nach Grund und Höhe schriftlich anmelden, Sicherheit zu leisten, soweit sie nicht Befriedigung verlangen können. Dieses Recht steht den Gläubigern jedoch nur zu, wenn sie glaubhaft machen, dass durch die Verschmelzung die Erfüllung ihrer Forderung gefährdet wird."
    },
    {
      "date": "2025-06-20",
      "id": "112787",
      "original_text": "Registerbekanntmachung nach dem Umwandlungsgesetz\nSchleswig-Holstein Amtsgericht Flensburg HRA 11559\nFest-Bau e.K. – Witzwort",
      "type": "Registerbekanntmachung nach dem Umwandlungsgesetz",
      "state": "Schleswig-Holstein",
      "amtsgericht": "Amtsgericht Flensburg",
      "registernummer": "HRA 11559",
      "registerart": "HRA",
      "company_name": "Fest-Bau e.K.",
      "company_seat": "Witzwort",
      "details": "20.06.2025 (Bekanntmachungsdatum)\n\nSchleswig-Holstein Amtsgericht Flensburg HRA 11559\nRegisterbekanntmachung nach dem Umwandlungsgesetz 19.06.2025 (Eintragungsdatum)\n\nFest-Bau e.K.\nEinzelkaufmann / Einzelkauffrau\nWitzwort\n\nZu Eintragungsnummer 1 vom 19.06.2025 wird als nicht eingetragen veröffentlicht:\nDen Gläubigern der an der Verschmelzung beteiligten Rechtsträger ist, wenn sie binnen sechs Monaten nach dem Tag, an dem die Eintragung der Verschmelzung in das Register des Sitzes desjenigen Rechtsträgers, dessen Gläubiger sie sind, als bekannt gemacht gilt, ihren Anspruch nach Grund und Höhe in Textform anmelden, Sicherheit zu leisten, soweit sie nicht Befriedigung verlangen können. Dieses Recht steht den Gläubigern jedoch nur zu, wenn sie glaubhaft machen, dass durch die Verschmelzung die Erfüllung ihrer Forderung gefährdet wird."
    },
    {
      "date": "2025-06-20",
      "id": "112788",
      "original_text": "Registerbekanntmachung nach dem Umwandlungsgesetz\nSchleswig-Holstein Amtsgericht Flensburg HRB 469 HU\nFest-Bau Gesellschaft mbH – Witzwort",
      "type": "Registerbekanntmachung nach dem Umwandlungsgesetz",
      "state": "Schleswig-Holstein",
      "amtsgericht": "Amtsgericht Flensburg",
      "registernummer": "HRB 469 HU",
      "registerart": "HRB",
      "company_name": "Fest-Bau Gesellschaft mbH",
      "company_seat": "Witzwort",
      "details": "20.06.2025 (Bekanntmachungsdatum)\n\nSchleswig-Holstein Amtsgericht Flensburg HRB 469 HU\nRegisterbekanntmachung nach dem Umwandlungsgesetz 19.06.2025 (Eintragungsdatum)\n\nFest-Bau Gesellschaft mbH\nGesellschaft mit beschränkter Haftung\nWitzwort\n\nZu Eintragungsnummer 4 vom 19.06.2025 wird als nicht eingetragen veröffentlicht:\nDen Gläubigern der an der Verschmelzung beteiligten Rechtsträger ist, wenn sie binnen sechs Monaten nach dem Tag, an dem die Eintragung der Verschmelzung in das Register des Sitzes desjenigen Rechtsträgers, dessen Gläubiger sie sind, als bekannt gemacht gilt, ihren Anspruch nach Grund und Höhe in Textform anmelden, Sicherheit zu leisten, soweit sie nicht Befriedigung verlangen können. Dieses Recht steht den Gläubigern jedoch nur zu, wenn sie glaubhaft machen, dass durch die Verschmelzung die Erfüllung ihrer Forderung gefährdet wird."
    },
    {
      "date": "2025-06-20",
      "id": "112789",
      "original_text": "Registerbekanntmachung nach dem Umwandlungsgesetz\nBaden-Württemberg Amtsgericht Stuttgart HRB 781291\nDER Reisebüro Südwest GmbH – Stuttgart",
      "type": "Registerbekanntmachung nach dem Umwandlungsgesetz",
      "state": "Baden-Württemberg",
      "amtsgericht": "Amtsgericht Stuttgart",
      "registernummer": "HRB 781291",
      "registerart": "HRB",
      "company_name": "DER Reisebüro Südwest GmbH",
      "company_seat": "Stuttgart",
      "details": "20.06.2025 (Bekanntmachungsdatum)\n\nBaden-Württemberg Amtsgericht Stuttgart HRB 781291\nRegisterbekanntmachung nach dem Umwandlungsgesetz 20.06.2025 (Eintragungsdatum)\n\nDER Reisebüro Südwest GmbH\nGesellschaft mit beschränkter Haftung\nStuttgart\n\nAls nicht eingetragen wird bekanntgemacht:\nDen Gläubigern der an der Verschmelzung beteiligten Rechtsträger ist, wenn sie binnen sechs Monaten nach dem Tag, an dem die Eintragung der Verschmelzung in das Register des Sitzes desjenigen Rechtsträgers, dessen Gläubiger sie sind, nach § 19 Abs. 3 UmwG als bekanntgemacht gilt, ihren Anspruch nach Grund und Höhe schriftlich anmelden, Sicherheit zu leisten, soweit sie nicht Befriedigung verlangen können. Dieses Recht steht den Gläubigern jedoch nur zu, wenn sie glaubhaft machen, dass durch die Verschmelzung die Erfüllung ihrer Forderung gefährdet wird."
    },
    {
      "date": "2025-06-20",
      "id": "112790",
      "original_text": "Einreichung neuer Dokumente\nBerlin Amtsgericht Berlin (Charlottenburg) HRB 224354\nMusic Creation Group Midco I GmbH – Berlin",
      "type": "Einreichung neuer Dokumente",
      "state": "Berlin",
      "amtsgericht": "Amtsgericht Berlin (Charlottenburg)",
      "registernummer": "HRB 224354",
      "registerart": "HRB",
      "company_name": "Music Creation Group Midco I GmbH",
      "company_seat": "Berlin",
      "details": "20.06.2025 (Bekanntmachungsdatum)\n\nBerlin Amtsgericht Berlin (Charlottenburg) HRB 224354\nEinreichung neuer Dokumente\n\nMusic Creation Group Midco I GmbH\nGesellschaft mit beschränkter Haftung\nBerlin\n\nAls nicht eingetragen wird veröffentlicht: Es wurde eine neue Liste der Aufsichtsratsmitglieder eingereicht (§52 GmbHG)."
    },
    {
      "date": "2025-06-20",
      "id": "112791",
      "original_text": "Löschungsankündigung\nBerlin Amtsgericht Berlin (Charlottenburg) HRB 237913\nRabii Schuttel GmbH – Berlin",
      "type": "Löschungsankündigung",
      "state": "Berlin",
      "amtsgericht": "Amtsgericht Berlin (Charlottenburg)",
      "registernummer": "HRB 237913",
      "registerart": "HRB",
      "company_name": "Rabii Schuttel GmbH",
      "company_seat": "Berlin",
      "details": "20.06.2025 (Bekanntmachungsdatum)\n\nBerlin Amtsgericht Berlin (Charlottenburg) HRB 237913\nLöschungsankündigung\n\nRabii Schuttel GmbH\nGesellschaft mit beschränkter Haftung\nBerlin\n\nBei der nachstehenden Gesellschaft wird das Amtslöschungsverfahren gemäß § 394 FamFG eingeleitet. Widerspruchsfrist 6 Wochen"
    },
    {
      "date": "2025-06-20",
      "id": "112792",
      "original_text": "Registerbekanntmachung nach dem Umwandlungsgesetz\nSachsen-Anhalt Amtsgericht Stendal HRB 18248\nDAH Service GmbH – Gommern",
      "type": "Registerbekanntmachung nach dem Umwandlungsgesetz",
      "state": "Sachsen-Anhalt",
      "amtsgericht": "Amtsgericht Stendal",
      "registernummer": "HRB 18248",
      "registerart": "HRB",
      "company_name": "DAH Service GmbH",
      "company_seat": "Gommern",
      "details": "20.06.2025 (Bekanntmachungsdatum)\n\nSachsen-Anhalt Amtsgericht Stendal HRB 18248\nRegisterbekanntmachung nach dem Umwandlungsgesetz 13.06.2025 (Eintragungsdatum)\n\nDAH Service GmbH\nGesellschaft mit beschränkter Haftung\nGommern\n\nDie Gesellschaft ist auf Grund des Verschmelzungsvertrages vom 18.03.2025 sowie der Beschlüsse der Gesellschafterversammlungen vom 04.06.2025 mit der IIP Neon GmbH mit dem Sitz in Oranienburg (Amtsgericht Neuruppin HRB 14584 NP) verschmolzen. Die Verschmelzung ist mit der Eintragung der Verschmelzung in das Handelsregister der übernehmenden Gesellschaft am 13.06.2025 wirksam geworden.Nicht eingetragen: Den Gläubigern der an der Verschmelzung beteiligten Rechtsträger ist, wenn sie binnen sechs Monaten nach dem Tag, an dem die Eintragung der Verschmelzung nach § 19 Abs. 3 UmwG als bekanntgemacht gilt, ihren Anspruch nach Grund und Höhe schriftlich anmelden, Sicherheit zu leisten, soweit sie nicht Befriedigung verlangen können. Dieses Recht steht ihnen jedoch nur zu, wenn sie glaubhaft machen, dass durch die Verschmelzung die Erfüllung ihrer Forderung gefährdet wird."
    },
    {
      "date": "2025-06-20",
      "id": "112793",
      "original_text": "Registerbekanntmachung nach dem Umwandlungsgesetz\nHamburg Amtsgericht Hamburg HRB 188022\nbp Netherlands GmbH – Hamburg",
      "type": "Registerbekanntmachung nach dem Umwandlungsgesetz",
      "state": "Hamburg",
      "amtsgericht": "Amtsgericht Hamburg",
      "registernummer": "HRB 188022",
      "registerart": "HRB",
      "company_name": "bp Netherlands GmbH",
      "company_seat": "Hamburg",
      "details": "20.06.2025 (Bekanntmachungsdatum)\n\nHamburg Amtsgericht Hamburg HRB 188022\nRegisterbekanntmachung nach dem Umwandlungsgesetz 20.06.2025 (Eintragungsdatum)\n\nbp Netherlands GmbH\nGesellschaft mit beschränkter Haftung\nHamburg\n\nDie Gesellschaft hat gemäß §§ 336, 308 Abs. 1 UmwG den Entwurf eines Formwechselplanes zum Handelsregister eingereicht.\n1. Es wird darauf hingewiesen, dass die bp Netherlands GmbH, eine Gesellschaft mit beschränkter Haftung nach dem Recht der Bundesrepublik Deutschland, mit satzungsmäßigem Sitz in Hamburg (Bundesrepublik Deutschland), eingetragen im Handelsregister des Amtsgerichts Hamburg unter HRB 188022 den Entwurf eines Formwechselplanes, über den Formwechsel durch grenzüberschreitende Verlegung des satzungsmäßigen Sitzes der bp Netherlands GmbH von Hamburg (Bundesrepublik Deutschland) nach Europoort Rotterdam (Niederlande), unter formwechselnder Aufgabe der Rechtsform einer nach dem Recht der Bundesrepublik Deutschland verfassten Gesellschaft mit beschränkter Haftung und Annahme der Rechtsform einer nach dem Recht der Niederlande verfassten Gesellschaft mit beschränkter Haftung (besloten vennootschap met beperkte aansprakelijkheid) beim Handelsregister des Amtsgerichts Hamburg eingereicht hat.\n\n2. Am Formwechsel ist ausschließlich die folgende Gesellschaft beteiligt:\nbp Netherlands GmbH mbH, mit Sitz in Hamburg, eingetragen im Handelsregister des Amtsgerichts Hamburg unter HRB 188022 (\"Gesellschaft\").\n\n3. Die Anteilsinhaber und Gläubiger der Gesellschaft sowie die zuständigen Betriebsräte der Gesellschaft können der Gesellschaft bis spätestens fünf Arbeitstage vor dem Tag der Gesellschafterversammlung am 23. Juli 2025, die über den Formwechsel beschließt, Bemerkungen zum Formwechselplan übermitteln.\nBemerkungen können an die Gesellschaft in Textform (§ 126b BGB) unter M&ALEGALUK@uk.bp.com oder postalisch an die folgende Anschrift übermittelt werden:\nbp Netherlands GmbH\nzu Händen: Cornelis Boot\nd’Arcyweg 76\n3198 NA Europoort Rotterdam\nNiederlande\n\nDie Gesellschaft hat folgende zuständige Betriebsräte über den Formwechsel durch Übersendung eines Formwechselberichts informiert:\n\n- Betriebsrat bp Netherlands GmbH /\nbp Retail Netherlands GmbH /\nCastrol Nederland B.V. (vormals BP\nEuropa SE - BP Nederland und\nCastrol Nederland B.V.)\n(Ondernemingsraad bp\nNetherlands GmbH / bp Retail\nNetherlands GmbH / Castrol\nNederland B.V. (vorheen BP\nEuropa SE - BP Nederland en\nCastrol Nederland B.V.));\n\n- Konzernbetriebsrat der BP Europa\nSE; und\n\n-  Europäischer Betriebsrat der BP\nEuropa SE.\n\nDiese Betriebsräte sind insbesondere berechtigt, Bemerkungen zum Entwurf des Formwechselplans zu übermitteln.\nAusschließlich die deutsche Fassung dieser Einreichung und Mitteilung ist maßgeblich."
    },
    {
      "date": "2025-06-20",
      "id": "112794",
      "original_text": "Einreichung neuer Dokumente\nSchleswig-Holstein Amtsgericht Kiel HRB 5467\ntiakis Biotech AG – Kiel",
      "type": "Einreichung neuer Dokumente",
      "state": "Schleswig-Holstein",
      "amtsgericht": "Amtsgericht Kiel",
      "registernummer": "HRB 5467",
      "registerart": "HRB",
      "company_name": "tiakis Biotech AG",
      "company_seat": "Kiel",
      "details": "20.06.2025 (Bekanntmachungsdatum)\n\nSchleswig-Holstein Amtsgericht Kiel HRB 5467\nEinreichung neuer Dokumente\n\ntiakis Biotech AG\nAktiengesellschaft\nKiel\n\nAls nicht eingetragen wird veröffentlicht: Eine neue Liste der Aufsichtsratsmitglieder ist eingereicht worden."
    },
    {
      "date": "2025-06-20",
      "id": "112795",
      "original_text": "Registerbekanntmachung nach dem Umwandlungsgesetz\nBaden-Württemberg Amtsgericht Freiburg HRB 732525\nLandimmobilien Südschwarzwald - Korhummel & Kempkes GmbH – Stühlingen",
      "type": "Registerbekanntmachung nach dem Umwandlungsgesetz",
      "state": "Baden-Württemberg",
      "amtsgericht": "Amtsgericht Freiburg",
      "registernummer": "HRB 732525",
      "registerart": "HRB",
      "company_name": "Landimmobilien Südschwarzwald - Korhummel & Kempkes GmbH",
      "company_seat": "Stühlingen",
      "details": "20.06.2025 (Bekanntmachungsdatum)\n\nBaden-Württemberg Amtsgericht Freiburg HRB 732525\nRegisterbekanntmachung nach dem Umwandlungsgesetz 20.06.2025 (Eintragungsdatum)\n\nLandimmobilien Südschwarzwald - Korhummel & Kempkes GmbH\nGesellschaft mit beschränkter Haftung\nStühlingen\n\nAls nicht eingetragen wird bekanntgemacht:\nDen Gläubigern der an der Ausgliederung beteiligten Rechtsträger ist, wenn sie binnen sechs Monaten nach dem Tag, an dem die Eintragung der Ausgliederung in das Register des Sitzes desjenigen Rechtsträgers, dessen Gläubiger sie sind, nach § 19 Abs. 3 UmwG als bekanntgemacht gilt, ihren Anspruch nach Grund und Höhe schriftlich anmelden, Sicherheit zu leisten, soweit sie nicht Befriedigung verlangen können. Dieses Recht steht den Gläubigern jedoch nur zu, wenn sie glaubhaft machen, dass durch die Ausgliederung die Erfüllung ihrer Forderung gefährdet wird."
    },
    {
      "date": "2025-06-20",
      "id": "112796",
      "original_text": "Löschungsankündigung\nBrandenburg Amtsgericht Potsdam HRB 38833\nSBM STADT BAU Management GmbH – Premnitz",
      "type": "Löschungsankündigung",
      "state": "Brandenburg",
      "amtsgericht": "Amtsgericht Potsdam",
      "registernummer": "HRB 38833",
      "registerart": "HRB",
      "company_name": "SBM STADT BAU Management GmbH",
      "company_seat": "Premnitz",
      "details": "20.06.2025 (Bekanntmachungsdatum)\n\nBrandenburg Amtsgericht Potsdam HRB 38833\nLöschungsankündigung\n\nSBM STADT BAU Management GmbH\nGesellschaft mit beschränkter Haftung\nPremnitz\n\nBei der nachstehenden Gesellschaft wird das Amtslöschungsverfahren gemäß § 394 FamFG eingeleitet."
    },
    {
      "date": "2025-06-20",
      "id": "112797",
      "original_text": "Sonstige Registerbekanntmachung\nBrandenburg Amtsgericht Cottbus HRB 14235\nSolarpark HR I GmbH – Welzow",
      "type": "Sonstige Registerbekanntmachung",
      "state": "Brandenburg",
      "amtsgericht": "Amtsgericht Cottbus",
      "registernummer": "HRB 14235",
      "registerart": "HRB",
      "company_name": "Solarpark HR I GmbH",
      "company_seat": "Welzow",
      "details": "20.06.2025 (Bekanntmachungsdatum)\n\nBrandenburg Amtsgericht Cottbus HRB 14235\nSonstige Registerbekanntmachung\n\nSolarpark HR I GmbH\nGesellschaft mit beschränkter Haftung\nWelzow\n\nAls nicht eingetragen wird veröffentlicht:\nDer andere Vertragsteil hat den Gläubigern dieses Rechtsträgers, dessen Forderungen begründet worden sind, bevor die Eintragung der Beendigung dieses Vertrages in das Handelsregister nach § 10 des Handelsgesetzbuches als bekannt gemacht gilt, Sicherheit zu leisten, wenn sie sich binnen sechs Monaten nach der Bekanntmachung der Eintragung zu diesem Zweck bei ihm melden"
    },
    {
      "date": "2025-06-20",
      "id": "112798",
      "original_text": "Löschungsankündigung\nBaden-Württemberg Amtsgericht Mannheim HRB 341355\nHAGA Warenvertriebs- und Vermittlungsgesellschaft mbH – Neckarbischofsheim",
      "type": "Löschungsankündigung",
      "state": "Baden-Württemberg",
      "amtsgericht": "Amtsgericht Mannheim",
      "registernummer": "HRB 341355",
      "registerart": "HRB",
      "company_name": "HAGA Warenvertriebs- und Vermittlungsgesellschaft mbH",
      "company_seat": "Neckarbischofsheim",
      "details": "20.06.2025 (Bekanntmachungsdatum)\n\nBaden-Württemberg Amtsgericht Mannheim HRB 341355\nLöschungsankündigung\n\nHAGA Warenvertriebs- und Vermittlungsgesellschaft mbH\nGesellschaft mit beschränkter Haftung\nNeckarbischofsheim\n\n#DV.Auswahl(Text=\"Bitte wählen Sie aus:\",\tEingabe=\n\"#insert(Text=\"VOE_Allgemein\")\"|\"Als nicht eingetragen wird bekanntgemacht:\",\n\"#insert(Text=\"VOE_BKM_Blätter\")\"|\"Bekanntmachungen der Gesellschaft erfolgen...\",\n\"#insert(Text=\"VOE_Aufsichtsrat\")\"|\"Mitglieder des ersten Aufsichtsrats\",\n\"#insert(Text=\"VOE_Sachgründung\")\"|\"Sachgründung\",\n\"#insert(Text=\"VOE_Sacherhöhung\")\"|\"Sacherhöhung\",\n\"#insert(Text=\"VOE_Aufhebung_UV\")\"|\"Aufhebung Unternehmensvertrag\",\n\"#insert(Text=\"VOE_Formwechsel\")\"|\"Formwechsel\",\n\"#insert(Text=\"VOE_Verschmelzung\")\"|\"Verschmelzung\",\n\"#insert(Text=\"VOE_Abspaltung\")\"|\"Abspaltung\",\n\"#insert(Text=\"VOE_Aufspaltung\")\"|\"Aufspaltung\",\n\"#insert(Text=\"VOE_Ausgliederung\")\"|\"Ausgliederung\",\n\"#insert(Text=\"VOE_Vermögensübertragung\")\"|\"Vermögensübertragung\",\n\"#insert(Text=\"Loeschungsankündigung_HR_394\")\"|\"Löschungsankündigung 394 FamFG\",\n\"#insert(Text=\"Loeschungsankündigung_HR_395\")\"|\"Löschungsankündigung 395 FamFG\",\n\"#insert(Text=\"Loeschungsankündigung_HR_397\")\"|\"Löschungsankündigung 397 FamFG\")"
    },
    {
      "date": "2025-06-20",
      "id": "112799",
      "original_text": "Löschungsankündigung\nBaden-Württemberg Amtsgericht Mannheim HRB 341355\nHAGA Warenvertriebs- und Vermittlungsgesellschaft mbH – Neckarbischofsheim",
      "type": "Löschungsankündigung",
      "state": "Baden-Württemberg",
      "amtsgericht": "Amtsgericht Mannheim",
      "registernummer": "HRB 341355",
      "registerart": "HRB",
      "company_name": "HAGA Warenvertriebs- und Vermittlungsgesellschaft mbH",
      "company_seat": "Neckarbischofsheim",
      "details": "20.06.2025 (Bekanntmachungsdatum)\n\nBaden-Württemberg Amtsgericht Mannheim HRB 341355\nLöschungsankündigung\n\nHAGA Warenvertriebs- und Vermittlungsgesellschaft mbH\nGesellschaft mit beschränkter Haftung\nNeckarbischofsheim\n\nDas Gericht beabsichtigt, die Gesellschaft wegen Vermögenslosigkeit im Handelsregister von Amts wegen nach § 394 FamFG zu löschen. Die Frist zur Geltendmachung eines Widerspruchs gegen die beabsichtigte Löschung ist auf einen Monat ab Veröffentlichung bestimmt."
    },
    {
      "date": "2025-06-20",
      "id": "112800",
      "original_text": "Sonstige Registerbekanntmachung\nBrandenburg Amtsgericht Cottbus HRB 18056\nLEAG Renewables GmbH – Cottbus",
      "type": "Sonstige Registerbekanntmachung",
      "state": "Brandenburg",
      "amtsgericht": "Amtsgericht Cottbus",
      "registernummer": "HRB 18056",
      "registerart": "HRB",
      "company_name": "LEAG Renewables GmbH",
      "company_seat": "Cottbus",
      "details": "20.06.2025 (Bekanntmachungsdatum)\n\nBrandenburg Amtsgericht Cottbus HRB 18056\nSonstige Registerbekanntmachung\n\nLEAG Renewables GmbH\nGesellschaft mit beschränkter Haftung\nCottbus\n\nAls nicht eingetragen wird veröffentlicht:\nDer andere Vertragsteil hat den Gläubigern dieses Rechtsträgers, dessen Forderungen begründet worden sind, bevor die Eintragung der Beendigung dieses Vertrages in das Handelsregister nach § 10 des Handelsgesetzbuches als bekannt gemacht gilt, Sicherheit zu leisten, wenn sie sich binnen sechs Monaten nach der Bekanntmachung der Eintragung zu diesem Zweck bei ihm melden"
    },
    {
      "date": "2025-06-20",
      "id": "112801",
      "original_text": "Registerbekanntmachung nach dem Umwandlungsgesetz\nBerlin Amtsgericht Berlin (Charlottenburg) HRB 147027\nGEHAG Vierte Beteiligung SE – Berlin",
      "type": "Registerbekanntmachung nach dem Umwandlungsgesetz",
      "state": "Berlin",
      "amtsgericht": "Amtsgericht Berlin (Charlottenburg)",
      "registernummer": "HRB 147027",
      "registerart": "HRB",
      "company_name": "GEHAG Vierte Beteiligung SE",
      "company_seat": "Berlin",
      "details": "20.06.2025 (Bekanntmachungsdatum)\n\nBerlin Amtsgericht Berlin (Charlottenburg) HRB 147027\nRegisterbekanntmachung nach dem Umwandlungsgesetz\n\nGEHAG Vierte Beteiligung SE\nEuropäische Aktiengesellschaft (SE)\nBerlin\n\nAls nicht eingetragen wird veröffentlicht:\nDem Registergericht ist ein Umwandlungsplan vom 13.06.2025 betreffend die formwechselnde Umwandlung der Gesellschaft in die Rechtsform der (deutschen) Aktiengesellschaft unter der Firma GEHAG Vierte Beteiligung AG eingereicht worden."
    },
    {
      "date": "2025-06-20",
      "id": "112802",
      "original_text": "Registerbekanntmachung nach dem Umwandlungsgesetz\nHamburg Amtsgericht Hamburg HRB 188058\nbp Retail Netherlands GmbH – Hamburg",
      "type": "Registerbekanntmachung nach dem Umwandlungsgesetz",
      "state": "Hamburg",
      "amtsgericht": "Amtsgericht Hamburg",
      "registernummer": "HRB 188058",
      "registerart": "HRB",
      "company_name": "bp Retail Netherlands GmbH",
      "company_seat": "Hamburg",
      "details": "20.06.2025 (Bekanntmachungsdatum)\n\nHamburg Amtsgericht Hamburg HRB 188058\nRegisterbekanntmachung nach dem Umwandlungsgesetz 20.06.2025 (Eintragungsdatum)\n\nbp Retail Netherlands GmbH\nGesellschaft mit beschränkter Haftung\nHamburg\n\nDie Gesellschaft hat gemäß §§ 336, 308 Abs. 1 UmwG den Entwurf eines Formwechselplanes zum Handelsregister eingereicht.\n\n1. Es wird darauf hingewiesen, dass die bp Retail Netherlands GmbH, eine Gesellschaft mit beschränkter Haftung nach dem Recht der Bundesrepublik Deutschland, mit satzungsmäßigem Sitz in Hamburg (Bundesrepublik Deutschland), eingetragen im Handelsregister des Amtsgerichts Hamburg unter HRB 188058 den Entwurf eines Formwechselplanes, über den Formwechsel durch grenzüberschreitende Verlegung des satzungsmäßigen Sitzes der bp Retail Netherlands GmbH von Hamburg (Bundesrepublik Deutschland) nach Europoort Rotterdam (Niederlande), unter formwechselnder Aufgabe der Rechtsform einer nach dem Recht der Bundesrepublik Deutschland verfassten Gesellschaft mit beschränkter Haftung und Annahme der Rechtsform einer nach dem Recht der Niederlande verfassten Gesellschaft mit beschränkter Haftung (besloten vennootschap met beperkte aansprakelijkheid) beim Handelsregister des Amtsgerichts Hamburg eingereicht hat.\n\n2. Am Formwechsel ist ausschließlich die folgende Gesellschaft beteiligt:\n\nbp Retail Netherlands GmbH mbH, mit Sitz in Hamburg, eingetragen im Handelsregister des Amtsgerichts Hamburg unter HRB 188058 (Gesellschaft).\n\n3. Die Anteilsinhaber und Gläubiger der Gesellschaft sowie die zuständigen Betriebsräte der Gesellschaft können der Gesellschaft bis spätestens fünf Arbeitstage vor dem Tag der Gesellschafterversammlung am 23. Juli 2025, die über den Formwechsel\nbeschließt, Bemerkungen zum Formwechselplan übermitteln.\nBemerkungen können an die Gesellschaft in Textform (§ 126b BGB) unter M&ALEGALUK@uk.bp.com oder postalisch an die folgende Anschrift übermittelt\nwerden:\n\nbp Retail Netherlands GmbH\nzu Händen: Sharif Mandour\nd'Arcyweg 76\n3198 NA Europoort Rotterdam\nNiederlande\n\nDie Gesellschaft hat folgende zuständige Betriebsräte über den Formwechsel durch Übersendung eines Formwechselberichts informiert:\n\n- Betriebsrat bp Netherlands GmbH / bp Retail Netherlands GmbH / Castrol Nederland B.V. (vormals BP Europa SE - BP Nederland und Castrol Nederland B.V.) (Ondernemingsraad bp Netherlands GmbH / bp Retail Netherlands GmbH / Castrol Nederland B.V. (vorheen BP Europa SE - BP Nederland en Castrol Nederland B.V.));\n\n- Konzernbetriebsrat der BP Europa SE; und\n\n- Europäischer Betriebsrat der BP Europa SE.\n\nDiese Betriebsräte sind insbesondere berechtigt, Bemerkungen zum Entwurf des Formwechselplans zu übermitteln.\nAusschließlich die deutsche Fassung dieser Einreichung und Mitteilung ist maßgeblich."
    },
    {
      "date": "2025-06-20",
      "id": "112803",
      "original_text": "Registerbekanntmachung nach dem Umwandlungsgesetz\nBaden-Württemberg Amtsgericht Mannheim HRB 8303\nAdHoc Entwicklung und Vertrieb GmbH – Mannheim",
      "type": "Registerbekanntmachung nach dem Umwandlungsgesetz",
      "state": "Baden-Württemberg",
      "amtsgericht": "Amtsgericht Mannheim",
      "registernummer": "HRB 8303",
      "registerart": "HRB",
      "company_name": "AdHoc Entwicklung und Vertrieb GmbH",
      "company_seat": "Mannheim",
      "details": "20.06.2025 (Bekanntmachungsdatum)\n\nBaden-Württemberg Amtsgericht Mannheim HRB 8303\nRegisterbekanntmachung nach dem Umwandlungsgesetz 20.06.2025 (Eintragungsdatum)\n\nAdHoc Entwicklung und Vertrieb GmbH\nGesellschaft mit beschränkter Haftung\nMannheim\n\nAls nicht eingetragen wird bekanntgemacht:\nDen Gläubigern der an der Verschmelzung beteiligten Rechtsträger ist, wenn sie binnen sechs Monaten nach dem Tag, an dem die Eintragung der Verschmelzung in das Register des Sitzes desjenigen Rechtsträgers, dessen Gläubiger sie sind, nach § 19 Abs. 3 UmwG als bekanntgemacht gilt, ihren Anspruch nach Grund und Höhe schriftlich anmelden, Sicherheit zu leisten, soweit sie nicht Befriedigung verlangen können. Dieses Recht steht den Gläubigern jedoch nur zu, wenn sie glaubhaft machen, dass durch die Verschmelzung die Erfüllung ihrer Forderung gefährdet wird."
    },
    {
      "date": "2025-06-20",
      "id": "112804",
      "original_text": "Sonstige Registerbekanntmachung\nBrandenburg Amtsgericht Cottbus HRB 17936\nLE Finance GmbH – Cottbus",
      "type": "Sonstige Registerbekanntmachung",
      "state": "Brandenburg",
      "amtsgericht": "Amtsgericht Cottbus",
      "registernummer": "HRB 17936",
      "registerart": "HRB",
      "company_name": "LE Finance GmbH",
      "company_seat": "Cottbus",
      "details": "20.06.2025 (Bekanntmachungsdatum)\n\nBrandenburg Amtsgericht Cottbus HRB 17936\nSonstige Registerbekanntmachung\n\nLE Finance GmbH\nGesellschaft mit beschränkter Haftung\nCottbus\n\nAls nicht eingetragen wird veröffentlicht:\nDer andere Vertragsteil hat den Gläubigern dieses Rechtsträgers, dessen Forderungen begründet worden sind, bevor die Eintragung der Beendigung dieses Vertrages in das Handelsregister nach § 10 des Handelsgesetzbuches als bekannt gemacht gilt, Sicherheit zu leisten, wenn sie sich binnen sechs Monaten nach der Bekanntmachung der Eintragung zu diesem Zweck bei ihm melden"
    },
    {
      "date": "2025-06-20",
      "id": "112805",
      "original_text": "Sonstige Registerbekanntmachung\nBrandenburg Amtsgericht Cottbus HRB 17639\nLEAG Clean Power GmbH – Cottbus",
      "type": "Sonstige Registerbekanntmachung",
      "state": "Brandenburg",
      "amtsgericht": "Amtsgericht Cottbus",
      "registernummer": "HRB 17639",
      "registerart": "HRB",
      "company_name": "LEAG Clean Power GmbH",
      "company_seat": "Cottbus",
      "details": "20.06.2025 (Bekanntmachungsdatum)\n\nBrandenburg Amtsgericht Cottbus HRB 17639\nSonstige Registerbekanntmachung\n\nLEAG Clean Power GmbH\nGesellschaft mit beschränkter Haftung\nCottbus\n\nAls nicht eingetragen wird veröffentlicht:\nDer andere Vertragsteil hat den Gläubigern dieses Rechtsträgers, dessen Forderungen begründet worden sind, bevor die Eintragung der Beendigung dieses Vertrages in das Handelsregister nach § 10 des Handelsgesetzbuches als bekannt gemacht gilt, Sicherheit zu leisten, wenn sie sich binnen sechs Monaten nach der Bekanntmachung der Eintragung zu diesem Zweck bei ihm melden"
    },
    {
      "date": "2025-06-20",
      "id": "112806",
      "original_text": "Registerbekanntmachung nach dem Umwandlungsgesetz\nHamburg Amtsgericht Hamburg HRB 189357\nRED-IO GmbH – Hamburg",
      "type": "Registerbekanntmachung nach dem Umwandlungsgesetz",
      "state": "Hamburg",
      "amtsgericht": "Amtsgericht Hamburg",
      "registernummer": "HRB 189357",
      "registerart": "HRB",
      "company_name": "RED-IO GmbH",
      "company_seat": "Hamburg",
      "details": "20.06.2025 (Bekanntmachungsdatum)\n\nHamburg Amtsgericht Hamburg HRB 189357\nRegisterbekanntmachung nach dem Umwandlungsgesetz 20.06.2025 (Eintragungsdatum)\n\nRED-IO GmbH\nGesellschaft mit beschränkter Haftung\nHamburg\n\nAls nicht eingetragen wird bekannt gemacht:\nDen Gläubigern der an der Ausgliederung beteiligten Gesellschaften ist, wenn sie binnen sechs Monaten nach dem Tag, an dem die Eintragung der Ausgliederung in das Register des Sitzes desjenigen Rechtsträgers, dessen Gläubiger sie sind, nach § 19 Absatz 3 UmwG als bekannt gemacht gilt, ihren Anspruch nach Grund und Höhe schriftlich anmelden, Sicherheit zu leisten, soweit sie nicht Befriedigung verlangen können. Dieses Recht steht den Gläubigern jedoch nur zu, wenn sie glaubhaft machen, dass durch die Ausgliederung die Erfüllung ihrer Forderung gefährdet wird."
    },
    {
      "date": "2025-06-20",
      "id": "112807",
      "original_text": "Registerbekanntmachung nach dem Umwandlungsgesetz\nHamburg Amtsgericht Hamburg HRA 132332\nBert Hildebrandt e.K. – Hamburg",
      "type": "Registerbekanntmachung nach dem Umwandlungsgesetz",
      "state": "Hamburg",
      "amtsgericht": "Amtsgericht Hamburg",
      "registernummer": "HRA 132332",
      "registerart": "HRA",
      "company_name": "Bert Hildebrandt e.K.",
      "company_seat": "Hamburg",
      "details": "20.06.2025 (Bekanntmachungsdatum)\n\nHamburg Amtsgericht Hamburg HRA 132332\nRegisterbekanntmachung nach dem Umwandlungsgesetz 20.06.2025 (Eintragungsdatum)\n\nBert Hildebrandt e.K.\nEinzelkaufmann\nHamburg\n\nAls nicht eingetragen wird bekannt gemacht:\nDen Gläubigern der an der Ausgliederung beteiligten Gesellschaften ist, wenn sie binnen sechs Monaten nach dem Tag, an dem die Eintragung der Ausgliederung in das Register des Sitzes desjenigen Rechtsträgers, dessen Gläubiger sie sind, nach § 19 Absatz 3 UmwG als bekannt gemacht gilt, ihren Anspruch nach Grund und Höhe schriftlich anmelden, Sicherheit zu leisten, soweit sie nicht Befriedigung verlangen können. Dieses Recht steht den Gläubigern jedoch nur zu, wenn sie glaubhaft machen, dass durch die Ausgliederung die Erfüllung ihrer Forderung gefährdet wird."
    },
    {
      "date": "2025-06-20",
      "id": "112808",
      "original_text": "Registerbekanntmachung nach dem Umwandlungsgesetz\nHamburg Amtsgericht Hamburg HRB 152632\nHHLA Sky GmbH – Hamburg",
      "type": "Registerbekanntmachung nach dem Umwandlungsgesetz",
      "state": "Hamburg",
      "amtsgericht": "Amtsgericht Hamburg",
      "registernummer": "HRB 152632",
      "registerart": "HRB",
      "company_name": "HHLA Sky GmbH",
      "company_seat": "Hamburg",
      "details": "20.06.2025 (Bekanntmachungsdatum)\n\nHamburg Amtsgericht Hamburg HRB 152632\nRegisterbekanntmachung nach dem Umwandlungsgesetz 20.06.2025 (Eintragungsdatum)\n\nHHLA Sky GmbH\nGesellschaft mit beschränkter Haftung\nHamburg\n\nAls nicht eingetragen wird bekannt gemacht:\nDen Gläubigern der an der Verschmelzung beteiligten Gesellschaften ist, wenn sie binnen sechs Monaten nach dem Tag, an dem die Eintragung der Verschmelzung in das Register des Sitzes desjenigen Rechtsträgers, dessen Gläubiger sie sind, nach § 19 Absatz 3 UmwG als bekannt gemacht gilt, ihren Anspruch nach Grund und Höhe schriftlich anmelden, Sicherheit zu leisten, soweit sie nicht Befriedigung verlangen können. Dieses Recht steht den Gläubigern jedoch nur zu, wenn sie glaubhaft machen, dass durch die Verschmelzung die Erfüllung ihrer Forderung gefährdet wird."
    },
    {
      "date": "2025-06-20",
      "id": "112809",
      "original_text": "Löschungsankündigung\nHamburg Amtsgericht Hamburg HRB 80953\nM-FORMATION Media GmbH – Hamburg",
      "type": "Löschungsankündigung",
      "state": "Hamburg",
      "amtsgericht": "Amtsgericht Hamburg",
      "registernummer": "HRB 80953",
      "registerart": "HRB",
      "company_name": "M-FORMATION Media GmbH",
      "company_seat": "Hamburg",
      "details": "20.06.2025 (Bekanntmachungsdatum)\n\nHamburg Amtsgericht Hamburg HRB 80953\nLöschungsankündigung\n\nM-FORMATION Media GmbH\nGesellschaft mit beschränkter Haftung\nHamburg\n\nDas Registergericht beabsichtigt, die im Handelsregister eingetragene Gesellschaft von Amts wegen nach § 394 FamFG zu löschen. Die Frist zur Erhebung eines Widerspruchs gegen die beabsichtigte Löschung wird auf 3 Monate festgesetzt."
    },
    {
      "date": "2025-06-20",
      "id": "112810",
      "original_text": "Löschungsankündigung\nHamburg Amtsgericht Hamburg HRB 127718\nNSK Gerüst- und Hochbau GmbH – Hamburg",
      "type": "Löschungsankündigung",
      "state": "Hamburg",
      "amtsgericht": "Amtsgericht Hamburg",
      "registernummer": "HRB 127718",
      "registerart": "HRB",
      "company_name": "NSK Gerüst- und Hochbau GmbH",
      "company_seat": "Hamburg",
      "details": "20.06.2025 (Bekanntmachungsdatum)\n\nHamburg Amtsgericht Hamburg HRB 127718\nLöschungsankündigung\n\nNSK Gerüst- und Hochbau GmbH\nGesellschaft mit beschränkter Haftung\nHamburg\n\nDas Registergericht beabsichtigt, die im Handelsregister eingetragene Gesellschaft von Amts wegen nach § 394 FamFG zu löschen. Die Frist zur Erhebung eines Widerspruchs gegen die beabsichtigte Löschung wird auf 3 Monate festgesetzt."
    },
    {
      "date": "2025-06-20",
      "id": "112811",
      "original_text": "Löschungsankündigung\nHamburg Amtsgericht Hamburg HRB 108699\nBUK Reinigungs- und Hauswart Service UG (haftungsbeschränkt) – Hamburg",
      "type": "Löschungsankündigung",
      "state": "Hamburg",
      "amtsgericht": "Amtsgericht Hamburg",
      "registernummer": "HRB 108699",
      "registerart": "HRB",
      "company_name": "BUK Reinigungs- und Hauswart Service UG (haftungsbeschränkt)",
      "company_seat": "Hamburg",
      "details": "20.06.2025 (Bekanntmachungsdatum)\n\nHamburg Amtsgericht Hamburg HRB 108699\nLöschungsankündigung\n\nBUK Reinigungs- und Hauswart Service UG (haftungsbeschränkt)\nGesellschaft mit beschränkter Haftung\nHamburg\n\nDas Registergericht beabsichtigt, die im Handelsregister eingetragene Gesellschaft von Amts wegen nach § 394 FamFG zu löschen. Die Frist zur Erhebung eines Widerspruchs gegen die beabsichtigte Löschung wird auf 3 Monate festgesetzt."
    },
    {
      "date": "2025-06-20",
      "id": "112812",
      "original_text": "Löschungsankündigung\nSaarland Amtsgericht Saarbrücken HRB 10494\nCheops Kolumbarien GmbH Vertrieb von Urnenpyramiden – Schmelz",
      "type": "Löschungsankündigung",
      "state": "Saarland",
      "amtsgericht": "Amtsgericht Saarbrücken",
      "registernummer": "HRB 10494",
      "registerart": "HRB",
      "company_name": "Cheops Kolumbarien GmbH Vertrieb von Urnenpyramiden",
      "company_seat": "Schmelz",
      "details": "20.06.2025 (Bekanntmachungsdatum)\n\nSaarland Amtsgericht Saarbrücken HRB 10494\nLöschungsankündigung\n\nCheops Kolumbarien GmbH Vertrieb von Urnenpyramiden\nGesellschaft mit beschränkter Haftung\nSchmelz\n\n.Es ist beabsichtigt, die Gesellschaft von Amts wegen gemäß § 394 FamFG wegen Vermögenslosigkeit zu löschen.\nGegen die Löschung von Amts wegen ist das Rechtsmittel des Widerspruchs statthaft. Der Widerspruch ist binnen einer Frist drei Monaten beginnend mit dem Tag dieser Veröffentlichung durch Einreichen eines Widerspruchsschreibens -schriftlich oder zur Niederschrift der Geschäftsstelle beim Amtsgericht Saarbrücken, -zentrales Handelsregister-, Mainzerstr.178, 66121 Saarbrücken einzulegen.\nDer Widerspruch muss die Bezeichnung der angefochtenen Löschungsankündigung enthalten sowie die Erklärung, dass Widerspruch eingelegt wird. Er ist vom Widerspruchsführer oder seinem Bevollmächtigten zu unterzeichnen.\nDas Widerspruchsschreiben kann auch in der Form eines elektronischen Dokumentes eingereicht werden, das mit einer qualifizierten elektronischen Signatur nach dem Signaturgesetz versehen sein muss (§§ 14 Abs. 2 FamFG, 130a, 298 ZPO)."
    },
    {
      "date": "2025-06-20",
      "id": "112813",
      "original_text": "Löschungsankündigung\nBerlin Amtsgericht Berlin (Charlottenburg) HRB 126828\nA-Z Trade Connection Technik GmbH – Berlin",
      "type": "Löschungsankündigung",
      "state": "Berlin",
      "amtsgericht": "Amtsgericht Berlin (Charlottenburg)",
      "registernummer": "HRB 126828",
      "registerart": "HRB",
      "company_name": "A-Z Trade Connection Technik GmbH",
      "company_seat": "Berlin",
      "details": "20.06.2025 (Bekanntmachungsdatum)\n\nBerlin Amtsgericht Berlin (Charlottenburg) HRB 126828\nLöschungsankündigung\n\nA-Z Trade Connection Technik GmbH\nGesellschaft mit beschränkter Haftung\nBerlin\n\nBei der nachstehenden Gesellschaft wird das Amtslöschungsverfahren gemäß § 394 FamFG eingeleitet. Widerspruchsfrist 6 Wochen"
    },
    {
      "date": "2025-06-20",
      "id": "112814",
      "original_text": "Registerbekanntmachung nach dem Umwandlungsgesetz\nBrandenburg Amtsgericht Cottbus HRB 714\nTeleco GmbH CottbusTelekommunikation – Cottbus",
      "type": "Registerbekanntmachung nach dem Umwandlungsgesetz",
      "state": "Brandenburg",
      "amtsgericht": "Amtsgericht Cottbus",
      "registernummer": "HRB 714",
      "registerart": "HRB",
      "company_name": "Teleco GmbH CottbusTelekommunikation",
      "company_seat": "Cottbus",
      "details": "20.06.2025 (Bekanntmachungsdatum)\n\nBrandenburg Amtsgericht Cottbus HRB 714\nRegisterbekanntmachung nach dem Umwandlungsgesetz 19.06.2025 (Eintragungsdatum)\n\nTeleco GmbH CottbusTelekommunikation\nGesellschaft mit beschränkter Haftung\nCottbus\n\nDen Gläubigern der an der Verschmelzung beteiligten Rechtsträger ist, wenn sie binnen sechs Monaten nach dem Tag, an dem die Eintragung der Verschmelzung in das Register des Sitzes desjenigen Rechtsträgers, dessen Gläubiger sie sind, als bekannt gemacht gilt, ihren Anspruch nach Grund und Höhe schriftlich anmelden, Sicherheit zu leisten, soweit sie nicht Befriedigung verlangen können. Dieses Recht steht den Gläubigern jedoch nur zu, wenn sie glaubhaft machen, dass durch die Verschmelzung die Erfüllung ihrer Forderung gefährdet wirdZu Eintragungsnummer 28 vom 19.06.2025 wird als nicht eingetragen veröffentlicht:"
    },
    {
      "date": "2025-06-20",
      "id": "112815",
      "original_text": "Löschungsankündigung\nHamburg Amtsgericht Hamburg HRB 130191\nAeki Märkte UG (haftungsbeschränkt) – Hamburg",
      "type": "Löschungsankündigung",
      "state": "Hamburg",
      "amtsgericht": "Amtsgericht Hamburg",
      "registernummer": "HRB 130191",
      "registerart": "HRB",
      "company_name": "Aeki Märkte UG (haftungsbeschränkt)",
      "company_seat": "Hamburg",
      "details": "20.06.2025 (Bekanntmachungsdatum)\n\nHamburg Amtsgericht Hamburg HRB 130191\nLöschungsankündigung\n\nAeki Märkte UG (haftungsbeschränkt)\nGesellschaft mit beschränkter Haftung\nHamburg\n\nDas Registergericht beabsichtigt, die im Handelsregister eingetragene Gesellschaft von Amts wegen nach § 394 FamFG zu löschen. Die Frist zur Erhebung eines Widerspruchs gegen die beabsichtigte Löschung wird auf 3 Monate festgesetzt."
    },
    {
      "date": "2025-06-20",
      "id": "112816",
      "original_text": "Löschungsankündigung\nHamburg Amtsgericht Hamburg HRB 138091\nGeneral Security Service GSS GmbH – Hamburg",
      "type": "Löschungsankündigung",
      "state": "Hamburg",
      "amtsgericht": "Amtsgericht Hamburg",
      "registernummer": "HRB 138091",
      "registerart": "HRB",
      "company_name": "General Security Service GSS GmbH",
      "company_seat": "Hamburg",
      "details": "20.06.2025 (Bekanntmachungsdatum)\n\nHamburg Amtsgericht Hamburg HRB 138091\nLöschungsankündigung\n\nGeneral Security Service GSS GmbH\nGesellschaft mit beschränkter Haftung\nHamburg\n\nDas Registergericht beabsichtigt, die im Handelsregister eingetragene Gesellschaft von Amts wegen nach § 394 FamFG zu löschen. Die Frist zur Erhebung eines Widerspruchs gegen die beabsichtigte Löschung wird auf 3 Monate festgesetzt."
    },
    {
      "date": "2025-06-20",
      "id": "112817",
      "original_text": "Löschungsankündigung\nHamburg Amtsgericht Hamburg HRB 128543\nalkawell Water Company GmbH – Hamburg",
      "type": "Löschungsankündigung",
      "state": "Hamburg",
      "amtsgericht": "Amtsgericht Hamburg",
      "registernummer": "HRB 128543",
      "registerart": "HRB",
      "company_name": "alkawell Water Company GmbH",
      "company_seat": "Hamburg",
      "details": "20.06.2025 (Bekanntmachungsdatum)\n\nHamburg Amtsgericht Hamburg HRB 128543\nLöschungsankündigung\n\nalkawell Water Company GmbH\nGesellschaft mit beschränkter Haftung\nHamburg\n\nDas Registergericht beabsichtigt, die im Handelsregister eingetragene Gesellschaft von Amts wegen nach § 394 FamFG zu löschen. Die Frist zur Erhebung eines Widerspruchs gegen die beabsichtigte Löschung wird auf 3 Monate festgesetzt."
    },
    {
      "date": "2025-06-20",
      "id": "112818",
      "original_text": "Löschungsankündigung\nHamburg Amtsgericht Hamburg HRB 132640\nCafé Morgenroth GmbH – Hamburg",
      "type": "Löschungsankündigung",
      "state": "Hamburg",
      "amtsgericht": "Amtsgericht Hamburg",
      "registernummer": "HRB 132640",
      "registerart": "HRB",
      "company_name": "Café Morgenroth GmbH",
      "company_seat": "Hamburg",
      "details": "20.06.2025 (Bekanntmachungsdatum)\n\nHamburg Amtsgericht Hamburg HRB 132640\nLöschungsankündigung\n\nCafé Morgenroth GmbH\nGesellschaft mit beschränkter Haftung\nHamburg\n\nDas Registergericht beabsichtigt, die im Handelsregister eingetragene Gesellschaft von Amts wegen nach § 394 FamFG zu löschen. Die Frist zur Erhebung eines Widerspruchs gegen die beabsichtigte Löschung wird auf 3 Monate festgesetzt."
    },
    {
      "date": "2025-06-20",
      "id": "112819",
      "original_text": "Löschungsankündigung\nHamburg Amtsgericht Hamburg HRB 151270\nHIB Historische Ingenieurbauwerke UG (haftungsbeschränkt) – Hamburg",
      "type": "Löschungsankündigung",
      "state": "Hamburg",
      "amtsgericht": "Amtsgericht Hamburg",
      "registernummer": "HRB 151270",
      "registerart": "HRB",
      "company_name": "HIB Historische Ingenieurbauwerke UG (haftungsbeschränkt)",
      "company_seat": "Hamburg",
      "details": "20.06.2025 (Bekanntmachungsdatum)\n\nHamburg Amtsgericht Hamburg HRB 151270\nLöschungsankündigung\n\nHIB Historische Ingenieurbauwerke UG (haftungsbeschränkt)\nGesellschaft mit beschränkter Haftung\nHamburg\n\nDas Registergericht beabsichtigt, die im Handelsregister eingetragene Gesellschaft von Amts wegen nach § 394 FamFG zu löschen. Die Frist zur Erhebung eines Widerspruchs gegen die beabsichtigte Löschung wird auf 3 Monate festgesetzt."
    },
    {
      "date": "2025-06-20",
      "id": "112820",
      "original_text": "Löschungsankündigung\nHamburg Amtsgericht Hamburg HRB 163714\nSaray Köz Hamburg GmbH – Hamburg",
      "type": "Löschungsankündigung",
      "state": "Hamburg",
      "amtsgericht": "Amtsgericht Hamburg",
      "registernummer": "HRB 163714",
      "registerart": "HRB",
      "company_name": "Saray Köz Hamburg GmbH",
      "company_seat": "Hamburg",
      "details": "20.06.2025 (Bekanntmachungsdatum)\n\nHamburg Amtsgericht Hamburg HRB 163714\nLöschungsankündigung\n\nSaray Köz Hamburg GmbH\nGesellschaft mit beschränkter Haftung\nHamburg\n\nDas Registergericht beabsichtigt, die im Handelsregister eingetragene Gesellschaft von Amts wegen nach § 394 FamFG zu löschen. Die Frist zur Erhebung eines Widerspruchs gegen die beabsichtigte Löschung wird auf 3 Monate festgesetzt."
    },
    {
      "date": "2025-06-20",
      "id": "112821",
      "original_text": "Löschungsankündigung\nHamburg Amtsgericht Hamburg HRB 145075\nTrocadera UG (haftungsbeschränkt) – Hamburg",
      "type": "Löschungsankündigung",
      "state": "Hamburg",
      "amtsgericht": "Amtsgericht Hamburg",
      "registernummer": "HRB 145075",
      "registerart": "HRB",
      "company_name": "Trocadera UG (haftungsbeschränkt)",
      "company_seat": "Hamburg",
      "details": "20.06.2025 (Bekanntmachungsdatum)\n\nHamburg Amtsgericht Hamburg HRB 145075\nLöschungsankündigung\n\nTrocadera UG (haftungsbeschränkt)\nGesellschaft mit beschränkter Haftung\nHamburg\n\nDas Registergericht beabsichtigt, die im Handelsregister eingetragene Gesellschaft von Amts wegen nach § 394 FamFG zu löschen. Die Frist zur Erhebung eines Widerspruchs gegen die beabsichtigte Löschung wird auf 3 Monate festgesetzt."
    },
    {
      "date": "2025-06-20",
      "id": "112822",
      "original_text": "Löschungsankündigung\nHamburg Amtsgericht Hamburg HRB 141528\nZweistein GmbH – Hamburg",
      "type": "Löschungsankündigung",
      "state": "Hamburg",
      "amtsgericht": "Amtsgericht Hamburg",
      "registernummer": "HRB 141528",
      "registerart": "HRB",
      "company_name": "Zweistein GmbH",
      "company_seat": "Hamburg",
      "details": "20.06.2025 (Bekanntmachungsdatum)\n\nHamburg Amtsgericht Hamburg HRB 141528\nLöschungsankündigung\n\nZweistein GmbH\nGesellschaft mit beschränkter Haftung\nHamburg\n\nDas Registergericht beabsichtigt, die im Handelsregister eingetragene Gesellschaft von Amts wegen nach § 394 FamFG zu löschen. Die Frist zur Erhebung eines Widerspruchs gegen die beabsichtigte Löschung wird auf 3 Monate festgesetzt."
    },
    {
      "date": "2025-06-20",
      "id": "112823",
      "original_text": "Löschungsankündigung\nHamburg Amtsgericht Hamburg HRB 145329\nNAB Gastro GmbH – Hamburg",
      "type": "Löschungsankündigung",
      "state": "Hamburg",
      "amtsgericht": "Amtsgericht Hamburg",
      "registernummer": "HRB 145329",
      "registerart": "HRB",
      "company_name": "NAB Gastro GmbH",
      "company_seat": "Hamburg",
      "details": "20.06.2025 (Bekanntmachungsdatum)\n\nHamburg Amtsgericht Hamburg HRB 145329\nLöschungsankündigung\n\nNAB Gastro GmbH\nGesellschaft mit beschränkter Haftung\nHamburg\n\nDas Registergericht beabsichtigt, die im Handelsregister eingetragene Gesellschaft von Amts wegen nach § 394 FamFG zu löschen. Die Frist zur Erhebung eines Widerspruchs gegen die beabsichtigte Löschung wird auf 3 Monate festgesetzt."
    },
    {
      "date": "2025-06-20",
      "id": "112824",
      "original_text": "Löschungsankündigung\nHamburg Amtsgericht Hamburg HRB 145870\nNoisette GmbH – Hamburg",
      "type": "Löschungsankündigung",
      "state": "Hamburg",
      "amtsgericht": "Amtsgericht Hamburg",
      "registernummer": "HRB 145870",
      "registerart": "HRB",
      "company_name": "Noisette GmbH",
      "company_seat": "Hamburg",
      "details": "20.06.2025 (Bekanntmachungsdatum)\n\nHamburg Amtsgericht Hamburg HRB 145870\nLöschungsankündigung\n\nNoisette GmbH\nGesellschaft mit beschränkter Haftung\nHamburg\n\nDas Registergericht beabsichtigt, die im Handelsregister eingetragene Gesellschaft von Amts wegen nach § 394 FamFG zu löschen. Die Frist zur Erhebung eines Widerspruchs gegen die beabsichtigte Löschung wird auf 3 Monate festgesetzt."
    },
    {
      "date": "2025-06-20",
      "id": "112825",
      "original_text": "Löschungsankündigung\nHamburg Amtsgericht Hamburg HRB 156932\nRBN Gastro & Hotelstätte GmbH – Hamburg",
      "type": "Löschungsankündigung",
      "state": "Hamburg",
      "amtsgericht": "Amtsgericht Hamburg",
      "registernummer": "HRB 156932",
      "registerart": "HRB",
      "company_name": "RBN Gastro & Hotelstätte GmbH",
      "company_seat": "Hamburg",
      "details": "20.06.2025 (Bekanntmachungsdatum)\n\nHamburg Amtsgericht Hamburg HRB 156932\nLöschungsankündigung\n\nRBN Gastro & Hotelstätte GmbH\nGesellschaft mit beschränkter Haftung\nHamburg\n\nDas Registergericht beabsichtigt, die im Handelsregister eingetragene Gesellschaft von Amts wegen nach § 394 FamFG zu löschen. Die Frist zur Erhebung eines Widerspruchs gegen die beabsichtigte Löschung wird auf 3 Monate festgesetzt."
    },
    {
      "date": "2025-06-20",
      "id": "112826",
      "original_text": "Löschungsankündigung\nHamburg Amtsgericht Hamburg HRB 164911\nPerfectBau Beteiligungs- und Verwaltungsgesellschaft mbH – Hamburg",
      "type": "Löschungsankündigung",
      "state": "Hamburg",
      "amtsgericht": "Amtsgericht Hamburg",
      "registernummer": "HRB 164911",
      "registerart": "HRB",
      "company_name": "PerfectBau Beteiligungs- und Verwaltungsgesellschaft mbH",
      "company_seat": "Hamburg",
      "details": "20.06.2025 (Bekanntmachungsdatum)\n\nHamburg Amtsgericht Hamburg HRB 164911\nLöschungsankündigung\n\nPerfectBau Beteiligungs- und Verwaltungsgesellschaft mbH\nGesellschaft mit beschränkter Haftung\nHamburg\n\nDas Registergericht beabsichtigt, die im Handelsregister eingetragene Gesellschaft von Amts wegen nach § 394 FamFG zu löschen. Die Frist zur Erhebung eines Widerspruchs gegen die beabsichtigte Löschung wird auf 3 Monate festgesetzt."
    },
    {
      "date": "2025-06-20",
      "id": "112827",
      "original_text": "Sonstige Registerbekanntmachung\nBerlin Amtsgericht Berlin (Charlottenburg) HRB 276207\nLadegrün! GmbH – Berlin",
      "type": "Sonstige Registerbekanntmachung",
      "state": "Berlin",
      "amtsgericht": "Amtsgericht Berlin (Charlottenburg)",
      "registernummer": "HRB 276207",
      "registerart": "HRB",
      "company_name": "Ladegrün! GmbH",
      "company_seat": "Berlin",
      "details": "20.06.2025 (Bekanntmachungsdatum)\n\nBerlin Amtsgericht Berlin (Charlottenburg) HRB 276207\nSonstige Registerbekanntmachung\n\nLadegrün! GmbH\nGesellschaft mit beschränkter Haftung\nBerlin\n\nAls nicht eingetragen wird veröffentlicht:Den Gläubigern ist, wenn sie binnen sechs Monaten nach dem Tag, an dem die Eintragung der Umwandlung als bekannt gemacht gilt, ihren Anspruch nach Grund und Höhe schriftlich anmelden, Sicherheit zu leisten, soweit sie nicht Befriedigung verlangen können. Dieses Recht steht den Gläubigern jedoch nur zu, wenn sie glaubhaft machen, dass durch die Umwandlung die Erfüllung ihrer Forderung gefährdet wird. Das Recht, Sicherheitsleistung zu verlangen, steht Gläubigern nicht zu, die im Falle der Insolvenz ein Recht auf vorzugsweise Befriedigung aus einer Deckungsmasse haben, die nach gesetzlicher Vorschrift zu ihrem Schutz errichtet und staatlich überwacht ist."
    },
    {
      "date": "2025-06-20",
      "id": "112828",
      "original_text": "Löschungsankündigung\nSchleswig-Holstein Amtsgericht Lübeck HRB 17370\nMizera Reinigungsdienstleistungen GmbH – Stockelsdorf",
      "type": "Löschungsankündigung",
      "state": "Schleswig-Holstein",
      "amtsgericht": "Amtsgericht Lübeck",
      "registernummer": "HRB 17370",
      "registerart": "HRB",
      "company_name": "Mizera Reinigungsdienstleistungen GmbH",
      "company_seat": "Stockelsdorf",
      "details": "20.06.2025 (Bekanntmachungsdatum)\n\nSchleswig-Holstein Amtsgericht Lübeck HRB 17370\nLöschungsankündigung\n\nMizera Reinigungsdienstleistungen GmbH\nGesellschaft mit beschränkter Haftung\nStockelsdorf\n\nEs ist die Löschung der nachstehenden Gesellschaft wegen Vermögenslosigkeit gemäß § 394 FamFG beabsichtigt.\nWiderspruchsfrist: 1 Monat."
    },
    {
      "date": "2025-06-20",
      "id": "112829",
      "original_text": "Löschungsankündigung\nHamburg Amtsgericht Hamburg HRB 179609\nCK Dienstleistungen GmbH – Hamburg",
      "type": "Löschungsankündigung",
      "state": "Hamburg",
      "amtsgericht": "Amtsgericht Hamburg",
      "registernummer": "HRB 179609",
      "registerart": "HRB",
      "company_name": "CK Dienstleistungen GmbH",
      "company_seat": "Hamburg",
      "details": "20.06.2025 (Bekanntmachungsdatum)\n\nHamburg Amtsgericht Hamburg HRB 179609\nLöschungsankündigung\n\nCK Dienstleistungen GmbH\nGesellschaft mit beschränkter Haftung\nHamburg\n\nDas Registergericht beabsichtigt, die im Handelsregister eingetragene Gesellschaft von Amts wegen nach § 394 FamFG zu löschen. Die Frist zur Erhebung eines Widerspruchs gegen die beabsichtigte Löschung wird auf 3 Monate festgesetzt."
    },
    {
      "date": "2025-06-20",
      "id": "112830",
      "original_text": "Löschungsankündigung\nHamburg Amtsgericht Hamburg HRB 187697\nAIS Gebäudemanagement und Service GmbH – Hamburg",
      "type": "Löschungsankündigung",
      "state": "Hamburg",
      "amtsgericht": "Amtsgericht Hamburg",
      "registernummer": "HRB 187697",
      "registerart": "HRB",
      "company_name": "AIS Gebäudemanagement und Service GmbH",
      "company_seat": "Hamburg",
      "details": "20.06.2025 (Bekanntmachungsdatum)\n\nHamburg Amtsgericht Hamburg HRB 187697\nLöschungsankündigung\n\nAIS Gebäudemanagement und Service GmbH\nGesellschaft mit beschränkter Haftung\nHamburg\n\nDas Registergericht beabsichtigt, die im Handelsregister eingetragene Gesellschaft von Amts wegen nach § 394 FamFG zu löschen. Die Frist zur Erhebung eines Widerspruchs gegen die beabsichtigte Löschung wird auf 3 Monate festgesetzt."
    },
    {
      "date": "2025-06-20",
      "id": "112831",
      "original_text": "Löschungsankündigung\nHamburg Amtsgericht Hamburg HRB 173517\nW & H Bauunternehmen GmbH – Hamburg",
      "type": "Löschungsankündigung",
      "state": "Hamburg",
      "amtsgericht": "Amtsgericht Hamburg",
      "registernummer": "HRB 173517",
      "registerart": "HRB",
      "company_name": "W & H Bauunternehmen GmbH",
      "company_seat": "Hamburg",
      "details": "20.06.2025 (Bekanntmachungsdatum)\n\nHamburg Amtsgericht Hamburg HRB 173517\nLöschungsankündigung\n\nW & H Bauunternehmen GmbH\nGesellschaft mit beschränkter Haftung\nHamburg\n\nDas Registergericht beabsichtigt, die im Handelsregister eingetragene Gesellschaft von Amts wegen nach § 394 FamFG zu löschen. Die Frist zur Erhebung eines Widerspruchs gegen die beabsichtigte Löschung wird auf 3 Monate festgesetzt."
    },
    {
      "date": "2025-06-20",
      "id": "112832",
      "original_text": "Registerbekanntmachung nach dem Umwandlungsgesetz\nHamburg Amtsgericht Hamburg HRB 118271\nTBWA \\ Hamburg GmbH – Hamburg",
      "type": "Registerbekanntmachung nach dem Umwandlungsgesetz",
      "state": "Hamburg",
      "amtsgericht": "Amtsgericht Hamburg",
      "registernummer": "HRB 118271",
      "registerart": "HRB",
      "company_name": "TBWA \\ Hamburg GmbH",
      "company_seat": "Hamburg",
      "details": "20.06.2025 (Bekanntmachungsdatum)\n\nHamburg Amtsgericht Hamburg HRB 118271\nRegisterbekanntmachung nach dem Umwandlungsgesetz 20.06.2025 (Eintragungsdatum)\n\nTBWA \\ Hamburg GmbH\nGesellschaft mit beschränkter Haftung\nHamburg\n\nAls nicht eingetragen wird bekannt gemacht:\nDen Gläubigern der an der Verschmelzung beteiligten Gesellschaften ist, wenn sie binnen sechs Monaten nach dem Tag, an dem die Eintragung der Verschmelzung in das Register des Sitzes desjenigen Rechtsträgers, dessen Gläubiger sie sind, nach § 19 Absatz 3 UmwG als bekannt gemacht gilt, ihren Anspruch nach Grund und Höhe schriftlich anmelden, Sicherheit zu leisten, soweit sie nicht Befriedigung verlangen können. Dieses Recht steht den Gläubigern jedoch nur zu, wenn sie glaubhaft machen, dass durch die Verschmelzung die Erfüllung ihrer Forderung gefährdet wird."
    },
    {
      "date": "2025-06-20",
      "id": "112833",
      "original_text": "Löschungsankündigung\nHamburg Amtsgericht Hamburg HRB 178617\nAccord GmbH – Hamburg",
      "type": "Löschungsankündigung",
      "state": "Hamburg",
      "amtsgericht": "Amtsgericht Hamburg",
      "registernummer": "HRB 178617",
      "registerart": "HRB",
      "company_name": "Accord GmbH",
      "company_seat": "Hamburg",
      "details": "20.06.2025 (Bekanntmachungsdatum)\n\nHamburg Amtsgericht Hamburg HRB 178617\nLöschungsankündigung\n\nAccord GmbH\nGesellschaft mit beschränkter Haftung\nHamburg\n\nDas Registergericht beabsichtigt, die im Handelsregister eingetragene Gesellschaft von Amts wegen nach § 394 FamFG zu löschen. Die Frist zur Erhebung eines Widerspruchs gegen die beabsichtigte Löschung wird auf 3 Monate festgesetzt."
    },
    {
      "date": "2025-06-20",
      "id": "112834",
      "original_text": "Löschungsankündigung\nHamburg Amtsgericht Hamburg HRB 179288\nF.F. Service und Handels GmbH – Hamburg",
      "type": "Löschungsankündigung",
      "state": "Hamburg",
      "amtsgericht": "Amtsgericht Hamburg",
      "registernummer": "HRB 179288",
      "registerart": "HRB",
      "company_name": "F.F. Service und Handels GmbH",
      "company_seat": "Hamburg",
      "details": "20.06.2025 (Bekanntmachungsdatum)\n\nHamburg Amtsgericht Hamburg HRB 179288\nLöschungsankündigung\n\nF.F. Service und Handels GmbH\nGesellschaft mit beschränkter Haftung\nHamburg\n\nDas Registergericht beabsichtigt, die im Handelsregister eingetragene Gesellschaft von Amts wegen nach § 394 FamFG zu löschen. Die Frist zur Erhebung eines Widerspruchs gegen die beabsichtigte Löschung wird auf 3 Monate festgesetzt."
    },
    {
      "date": "2025-06-20",
      "id": "112835",
      "original_text": "Löschungsankündigung\nHamburg Amtsgericht Hamburg HRB 186472\nSAM Solution GmbH – Hamburg",
      "type": "Löschungsankündigung",
      "state": "Hamburg",
      "amtsgericht": "Amtsgericht Hamburg",
      "registernummer": "HRB 186472",
      "registerart": "HRB",
      "company_name": "SAM Solution GmbH",
      "company_seat": "Hamburg",
      "details": "20.06.2025 (Bekanntmachungsdatum)\n\nHamburg Amtsgericht Hamburg HRB 186472\nLöschungsankündigung\n\nSAM Solution GmbH\nGesellschaft mit beschränkter Haftung\nHamburg\n\nDas Registergericht beabsichtigt, die im Handelsregister eingetragene Gesellschaft von Amts wegen nach § 394 FamFG zu löschen. Die Frist zur Erhebung eines Widerspruchs gegen die beabsichtigte Löschung wird auf 3 Monate festgesetzt."
    },
    {
      "date": "2025-06-20",
      "id": "112836",
      "original_text": "Löschungsankündigung\nHamburg Amtsgericht Hamburg HRB 170513\nAOS Backwaren GmbH – Hamburg",
      "type": "Löschungsankündigung",
      "state": "Hamburg",
      "amtsgericht": "Amtsgericht Hamburg",
      "registernummer": "HRB 170513",
      "registerart": "HRB",
      "company_name": "AOS Backwaren GmbH",
      "company_seat": "Hamburg",
      "details": "20.06.2025 (Bekanntmachungsdatum)\n\nHamburg Amtsgericht Hamburg HRB 170513\nLöschungsankündigung\n\nAOS Backwaren GmbH\nGesellschaft mit beschränkter Haftung\nHamburg\n\nDas Registergericht beabsichtigt, die im Handelsregister eingetragene Gesellschaft von Amts wegen nach § 394 FamFG zu löschen. Die Frist zur Erhebung eines Widerspruchs gegen die beabsichtigte Löschung wird auf 3 Monate festgesetzt."
    },
    {
      "date": "2025-06-20",
      "id": "112837",
      "original_text": "Löschungsankündigung\nHamburg Amtsgericht Hamburg HRB 171517\nHanse Fassadentechnik GmbH – Hamburg",
      "type": "Löschungsankündigung",
      "state": "Hamburg",
      "amtsgericht": "Amtsgericht Hamburg",
      "registernummer": "HRB 171517",
      "registerart": "HRB",
      "company_name": "Hanse Fassadentechnik GmbH",
      "company_seat": "Hamburg",
      "details": "20.06.2025 (Bekanntmachungsdatum)\n\nHamburg Amtsgericht Hamburg HRB 171517\nLöschungsankündigung\n\nHanse Fassadentechnik GmbH\nGesellschaft mit beschränkter Haftung\nHamburg\n\nDas Registergericht beabsichtigt, die im Handelsregister eingetragene Gesellschaft von Amts wegen nach § 394 FamFG zu löschen. Die Frist zur Erhebung eines Widerspruchs gegen die beabsichtigte Löschung wird auf 3 Monate festgesetzt."
    },
    {
      "date": "2025-06-20",
      "id": "112838",
      "original_text": "Löschungsankündigung\nHamburg Amtsgericht Hamburg HRB 170942\nST Beton- und Maurerbau GmbH – Hamburg",
      "type": "Löschungsankündigung",
      "state": "Hamburg",
      "amtsgericht": "Amtsgericht Hamburg",
      "registernummer": "HRB 170942",
      "registerart": "HRB",
      "company_name": "ST Beton- und Maurerbau GmbH",
      "company_seat": "Hamburg",
      "details": "20.06.2025 (Bekanntmachungsdatum)\n\nHamburg Amtsgericht Hamburg HRB 170942\nLöschungsankündigung\n\nST Beton- und Maurerbau GmbH\nGesellschaft mit beschränkter Haftung\nHamburg\n\nDas Registergericht beabsichtigt, die im Handelsregister eingetragene Gesellschaft von Amts wegen nach § 394 FamFG zu löschen. Die Frist zur Erhebung eines Widerspruchs gegen die beabsichtigte Löschung wird auf 3 Monate festgesetzt."
    },
    {
      "date": "2025-06-20",
      "id": "112839",
      "original_text": "Löschungsankündigung\nHamburg Amtsgericht Hamburg HRB 173252\nTV - Transport und Logistikdienstleistungen GmbH – Hamburg",
      "type": "Löschungsankündigung",
      "state": "Hamburg",
      "amtsgericht": "Amtsgericht Hamburg",
      "registernummer": "HRB 173252",
      "registerart": "HRB",
      "company_name": "TV - Transport und Logistikdienstleistungen GmbH",
      "company_seat": "Hamburg",
      "details": "20.06.2025 (Bekanntmachungsdatum)\n\nHamburg Amtsgericht Hamburg HRB 173252\nLöschungsankündigung\n\nTV - Transport und Logistikdienstleistungen GmbH\nGesellschaft mit beschränkter Haftung\nHamburg\n\nDas Registergericht beabsichtigt, die im Handelsregister eingetragene Gesellschaft von Amts wegen nach § 394 FamFG zu löschen. Die Frist zur Erhebung eines Widerspruchs gegen die beabsichtigte Löschung wird auf 3 Monate festgesetzt."
    },
    {
      "date": "2025-06-20",
      "id": "112840",
      "original_text": "Löschungsankündigung\nHamburg Amtsgericht Hamburg HRB 177631\nALIP Solution UG (haftungsbeschränkt) – Hamburg",
      "type": "Löschungsankündigung",
      "state": "Hamburg",
      "amtsgericht": "Amtsgericht Hamburg",
      "registernummer": "HRB 177631",
      "registerart": "HRB",
      "company_name": "ALIP Solution UG (haftungsbeschränkt)",
      "company_seat": "Hamburg",
      "details": "20.06.2025 (Bekanntmachungsdatum)\n\nHamburg Amtsgericht Hamburg HRB 177631\nLöschungsankündigung\n\nALIP Solution UG (haftungsbeschränkt)\nGesellschaft mit beschränkter Haftung\nHamburg\n\nDas Registergericht beabsichtigt, die im Handelsregister eingetragene Gesellschaft von Amts wegen nach § 394 FamFG zu löschen. Die Frist zur Erhebung eines Widerspruchs gegen die beabsichtigte Löschung wird auf 3 Monate festgesetzt."
    },
    {
      "date": "2025-06-20",
      "id": "112841",
      "original_text": "Löschungsankündigung\nHamburg Amtsgericht Hamburg HRB 178925\nSIVAK WORK UG (haftungsbeschränkt) – Hamburg",
      "type": "Löschungsankündigung",
      "state": "Hamburg",
      "amtsgericht": "Amtsgericht Hamburg",
      "registernummer": "HRB 178925",
      "registerart": "HRB",
      "company_name": "SIVAK WORK UG (haftungsbeschränkt)",
      "company_seat": "Hamburg",
      "details": "20.06.2025 (Bekanntmachungsdatum)\n\nHamburg Amtsgericht Hamburg HRB 178925\nLöschungsankündigung\n\nSIVAK WORK UG (haftungsbeschränkt)\nGesellschaft mit beschränkter Haftung\nHamburg\n\nDas Registergericht beabsichtigt, die im Handelsregister eingetragene Gesellschaft von Amts wegen nach § 394 FamFG zu löschen. Die Frist zur Erhebung eines Widerspruchs gegen die beabsichtigte Löschung wird auf 3 Monate festgesetzt."
    },
    {
      "date": "2025-06-20",
      "id": "112842",
      "original_text": "Registerbekanntmachung nach dem Umwandlungsgesetz\nBerlin Amtsgericht Berlin (Charlottenburg) HRA 64373\nIndigo Berlin e.K. – Berlin",
      "type": "Registerbekanntmachung nach dem Umwandlungsgesetz",
      "state": "Berlin",
      "amtsgericht": "Amtsgericht Berlin (Charlottenburg)",
      "registernummer": "HRA 64373",
      "registerart": "HRA",
      "company_name": "Indigo Berlin e.K.",
      "company_seat": "Berlin",
      "details": "20.06.2025 (Bekanntmachungsdatum)\n\nBerlin Amtsgericht Berlin (Charlottenburg) HRA 64373\nRegisterbekanntmachung nach dem Umwandlungsgesetz 18.06.2025 (Eintragungsdatum)\n\nIndigo Berlin e.K.\nEinzelkaufmann / Einzelkauffrau\nBerlin\n\nZu Eintragungsnummer 1 vom 18.06.2025 wird als nicht eingetragen veröffentlicht: Den Gläubigern der an der Verschmelzung beteiligten Rechtsträger ist, wenn sie binnen sechs Monaten nach dem Tag, an dem die Eintragung der Verschmelzung in das Register des Sitzes desjenigen Rechtsträgers, dessen Gläubiger sie sind, als bekannt gemacht gilt, ihren Anspruch nach Grund und Höhe schriftlich anmelden, Sicherheit zu leisten, soweit sie nicht Befriedigung verlangen können. Dieses Recht steht den Gläubigern jedoch nur zu, wenn sie glaubhaft machen, dass durch die Verschmelzung die Erfüllung ihrer Forderung gefährdet wird. Das Recht, Sicherheitsleistung zu verlangen, steht Gläubigern nicht zu, die im Falle der Insolvenz ein Recht auf vorzugsweise Befriedigung aus einer Deckungsmasse haben, die nach gesetzlicher Vorschrift zu ihrem Schutz errichtet und staatlich überwacht ist."
    },
    {
      "date": "2025-06-20",
      "id": "112843",
      "original_text": "Registerbekanntmachung nach dem Umwandlungsgesetz\nBrandenburg Amtsgericht Cottbus HRB 14458\n\"Mietho & Bär Kabelkom\" Kabelkommunikations-Betriebs GmbH – Cottbus",
      "type": "Registerbekanntmachung nach dem Umwandlungsgesetz",
      "state": "Brandenburg",
      "amtsgericht": "Amtsgericht Cottbus",
      "registernummer": "HRB 14458",
      "registerart": "HRB",
      "company_name": "\"Mietho & Bär Kabelkom\" Kabelkommunikations-Betriebs GmbH",
      "company_seat": "Cottbus",
      "details": "20.06.2025 (Bekanntmachungsdatum)\n\nBrandenburg Amtsgericht Cottbus HRB 14458\nRegisterbekanntmachung nach dem Umwandlungsgesetz 19.06.2025 (Eintragungsdatum)\n\n\"Mietho & Bär Kabelkom\" Kabelkommunikations-Betriebs GmbH\nGesellschaft mit beschränkter Haftung\nCottbus\n\nZu Eintragungsnummer 9 vom 19.06.2025 wird als nicht eingetragen veröffentlicht:\nDen Gläubigern der an der Verschmelzung beteiligten Rechtsträger ist, wenn sie binnen sechs Monaten nach dem Tag, an dem die Eintragung der Verschmelzung in das Register des Sitzes desjenigen Rechtsträgers, dessen Gläubiger sie sind, als bekannt gemacht gilt, ihren Anspruch nach Grund und Höhe schriftlich anmelden, Sicherheit zu leisten, soweit sie nicht Befriedigung verlangen können. Dieses Recht steht den Gläubigern jedoch nur zu, wenn sie glaubhaft machen, dass durch die Verschmelzung die Erfüllung ihrer Forderung gefährdet wird."
    },
    {
      "date": "2025-06-20",
      "id": "112844",
      "original_text": "Löschungsankündigung\nHamburg Amtsgericht Hamburg HRA 91140\nHANSEATICA Grundbesitz Investitionsgesellschaft Wohnpark Nauen mbH & Co. KG – Hamburg",
      "type": "Löschungsankündigung",
      "state": "Hamburg",
      "amtsgericht": "Amtsgericht Hamburg",
      "registernummer": "HRA 91140",
      "registerart": "HRA",
      "company_name": "HANSEATICA Grundbesitz Investitionsgesellschaft Wohnpark Nauen mbH & Co. KG",
      "company_seat": "Hamburg",
      "details": "20.06.2025 (Bekanntmachungsdatum)\n\nHamburg Amtsgericht Hamburg HRA 91140\nLöschungsankündigung\n\nHANSEATICA Grundbesitz Investitionsgesellschaft Wohnpark Nauen mbH & Co. KG\nKommanditgesellschaft\nHamburg\n\nDas Registergericht beabsichtigt, die im Handelsregister eingetragene Firma von Amts wegen nach § 31 Abs. 2 HBG zu löschen. Die Frist zur Erhebung eines Widerspruchs gegen die beabsichtigte Löschung wird auf 3 Monate festgesetzt."
    },
    {
      "date": "2025-06-20",
      "id": "112845",
      "original_text": "Löschungsankündigung\nHamburg Amtsgericht Hamburg HRA 113270\nMS \"Tasman Castle\" GmbH & Co. KG – Hamburg",
      "type": "Löschungsankündigung",
      "state": "Hamburg",
      "amtsgericht": "Amtsgericht Hamburg",
      "registernummer": "HRA 113270",
      "registerart": "HRA",
      "company_name": "MS \"Tasman Castle\" GmbH & Co. KG",
      "company_seat": "Hamburg",
      "details": "20.06.2025 (Bekanntmachungsdatum)\n\nHamburg Amtsgericht Hamburg HRA 113270\nLöschungsankündigung\n\nMS \"Tasman Castle\" GmbH & Co. KG\nKommanditgesellschaft\nHamburg\n\nDas Registergericht beabsichtigt, die im Handelsregister eingetragene Firma von Amts wegen nach § 31 Abs. 2 HBG zu löschen. Die Frist zur Erhebung eines Widerspruchs gegen die beabsichtigte Löschung wird auf 3 Monate festgesetzt."
    },
    {
      "date": "2025-06-20",
      "id": "112846",
      "original_text": "Löschungsankündigung\nHamburg Amtsgericht Hamburg HRA 118852\nHansa Heavy Lift UG (haftungsbeschränkt) & Co. KG MS \"HHL Richards Bay\" – Hamburg",
      "type": "Löschungsankündigung",
      "state": "Hamburg",
      "amtsgericht": "Amtsgericht Hamburg",
      "registernummer": "HRA 118852",
      "registerart": "HRA",
      "company_name": "Hansa Heavy Lift UG (haftungsbeschränkt) & Co. KG MS \"HHL Richards Bay\"",
      "company_seat": "Hamburg",
      "details": "20.06.2025 (Bekanntmachungsdatum)\n\nHamburg Amtsgericht Hamburg HRA 118852\nLöschungsankündigung\n\nHansa Heavy Lift UG (haftungsbeschränkt) & Co. KG MS \"HHL Richards Bay\"\nKommanditgesellschaft\nHamburg\n\nDas Registergericht beabsichtigt, die im Handelsregister eingetragene Firma von Amts wegen nach § 31 Abs. 2 HBG zu löschen. Die Frist zur Erhebung eines Widerspruchs gegen die beabsichtigte Löschung wird auf 3 Monate festgesetzt."
    },
    {
      "date": "2025-06-20",
      "id": "112847",
      "original_text": "Löschungsankündigung\nHamburg Amtsgericht Hamburg VR 25785\nHeimfelder e.V. – Hamburg",
      "type": "Löschungsankündigung",
      "state": "Hamburg",
      "amtsgericht": "Amtsgericht Hamburg",
      "registernummer": "VR 25785",
      "registerart": "VR",
      "company_name": "Heimfelder e.V.",
      "company_seat": "Hamburg",
      "details": "20.06.2025 (Bekanntmachungsdatum)\n\nHamburg Amtsgericht Hamburg VR 25785\nLöschungsankündigung\n\nHeimfelder e.V.\neingetragener Verein\nHamburg\n\nDas Registergericht beabsichtigt, den im Vereinsregister eingetragenen Verein von Amts wegen nach § 395 FamFG zu löschen, da nach den angestellten  Ermittlungen dieser Verein offenbar nicht mehr besteht. Die Frist zur Erhebung eines Widerspruchs gegen die beabsichtigte Löschung wird auf 3 Monate festgesetzt."
    },
    {
      "date": "2025-06-20",
      "id": "112848",
      "original_text": "Löschungsankündigung\nHamburg Amtsgericht Hamburg HRA 87658\nRK Gebäudereinigungs-Service GmbH & Co. KG – Hamburg",
      "type": "Löschungsankündigung",
      "state": "Hamburg",
      "amtsgericht": "Amtsgericht Hamburg",
      "registernummer": "HRA 87658",
      "registerart": "HRA",
      "company_name": "RK Gebäudereinigungs-Service GmbH & Co. KG",
      "company_seat": "Hamburg",
      "details": "20.06.2025 (Bekanntmachungsdatum)\n\nHamburg Amtsgericht Hamburg HRA 87658\nLöschungsankündigung\n\nRK Gebäudereinigungs-Service GmbH & Co. KG\nKommanditgesellschaft\nHamburg\n\nDas Registergericht beabsichtigt, die im Handelsregister eingetragene Firma von Amts wegen nach § 31 Abs. 2 HBG zu löschen. Die Frist zur Erhebung eines Widerspruchs gegen die beabsichtigte Löschung wird auf 3 Monate festgesetzt."
    },
    {
      "date": "2025-06-20",
      "id": "112849",
      "original_text": "Registerbekanntmachung nach dem Umwandlungsgesetz\nHamburg Amtsgericht Hamburg HRB 66178\nSusat GmbH Wirtschaftsprüfungsgesellschaft – Hamburg",
      "type": "Registerbekanntmachung nach dem Umwandlungsgesetz",
      "state": "Hamburg",
      "amtsgericht": "Amtsgericht Hamburg",
      "registernummer": "HRB 66178",
      "registerart": "HRB",
      "company_name": "Susat GmbH Wirtschaftsprüfungsgesellschaft",
      "company_seat": "Hamburg",
      "details": "20.06.2025 (Bekanntmachungsdatum)\n\nHamburg Amtsgericht Hamburg HRB 66178\nRegisterbekanntmachung nach dem Umwandlungsgesetz 20.06.2025 (Eintragungsdatum)\n\nSusat GmbH Wirtschaftsprüfungsgesellschaft\nGesellschaft mit beschränkter Haftung\nHamburg\n\nAls nicht eingetragen wird bekannt gemacht:\nDen Gläubigern der an der Verschmelzung beteiligten Gesellschaften ist, wenn sie binnen sechs Monaten nach dem Tag, an dem die Eintragung der Verschmelzung in das Register des Sitzes desjenigen Rechtsträgers, dessen Gläubiger sie sind, nach § 19 Absatz 3 UmwG als bekannt gemacht gilt, ihren Anspruch nach Grund und Höhe schriftlich anmelden, Sicherheit zu leisten, soweit sie nicht Befriedigung verlangen können. Dieses Recht steht den Gläubigern jedoch nur zu, wenn sie glaubhaft machen, dass durch die Verschmelzung die Erfüllung ihrer Forderung gefährdet wird."
    },
    {
      "date": "2025-06-20",
      "id": "112850",
      "original_text": "Löschungsankündigung\nHamburg Amtsgericht Hamburg HRA 115749\nSUPRASTADIO Lizenzgesellschaft mbH & Co. KG – Hamburg",
      "type": "Löschungsankündigung",
      "state": "Hamburg",
      "amtsgericht": "Amtsgericht Hamburg",
      "registernummer": "HRA 115749",
      "registerart": "HRA",
      "company_name": "SUPRASTADIO Lizenzgesellschaft mbH & Co. KG",
      "company_seat": "Hamburg",
      "details": "20.06.2025 (Bekanntmachungsdatum)\n\nHamburg Amtsgericht Hamburg HRA 115749\nLöschungsankündigung\n\nSUPRASTADIO Lizenzgesellschaft mbH & Co. KG\nKommanditgesellschaft\nHamburg\n\nDas Registergericht beabsichtigt, die im Handelsregister eingetragene Firma von Amts wegen nach § 31 Abs. 2 HBG zu löschen. Die Frist zur Erhebung eines Widerspruchs gegen die beabsichtigte Löschung wird auf 3 Monate festgesetzt."
    },
    {
      "date": "2025-06-20",
      "id": "112851",
      "original_text": "Löschungsankündigung\nHamburg Amtsgericht Hamburg HRA 118854\nHansa Heavy Lift UG (haftungsbeschränkt) & Co. KG MS \"HHL Lagos\" – Hamburg",
      "type": "Löschungsankündigung",
      "state": "Hamburg",
      "amtsgericht": "Amtsgericht Hamburg",
      "registernummer": "HRA 118854",
      "registerart": "HRA",
      "company_name": "Hansa Heavy Lift UG (haftungsbeschränkt) & Co. KG MS \"HHL Lagos\"",
      "company_seat": "Hamburg",
      "details": "20.06.2025 (Bekanntmachungsdatum)\n\nHamburg Amtsgericht Hamburg HRA 118854\nLöschungsankündigung\n\nHansa Heavy Lift UG (haftungsbeschränkt) & Co. KG MS \"HHL Lagos\"\nKommanditgesellschaft\nHamburg\n\nDas Registergericht beabsichtigt, die im Handelsregister eingetragene Firma von Amts wegen nach § 31 Abs. 2 HBG zu löschen. Die Frist zur Erhebung eines Widerspruchs gegen die beabsichtigte Löschung wird auf 3 Monate festgesetzt."
    },
    {
      "date": "2025-06-20",
      "id": "112852",
      "original_text": "Registerbekanntmachung nach dem Umwandlungsgesetz\nBerlin Amtsgericht Berlin (Charlottenburg) HRA 38840\nThe G Fünfte Immobilien GmbH & Co. KG – Berlin",
      "type": "Registerbekanntmachung nach dem Umwandlungsgesetz",
      "state": "Berlin",
      "amtsgericht": "Amtsgericht Berlin (Charlottenburg)",
      "registernummer": "HRA 38840",
      "registerart": "HRA",
      "company_name": "The G Fünfte Immobilien GmbH & Co. KG",
      "company_seat": "Berlin",
      "details": "20.06.2025 (Bekanntmachungsdatum)\n\nBerlin Amtsgericht Berlin (Charlottenburg) HRA 38840\nRegisterbekanntmachung nach dem Umwandlungsgesetz 18.06.2025 (Eintragungsdatum)\n\nThe G Fünfte Immobilien GmbH & Co. KG\nKommanditgesellschaft\nBerlin\n\nZu Eintragungsnummer 8 vom 18.06.2025 wird als nicht eingetragen veröffentlicht: Den Gläubigern ist, wenn sie binnen sechs Monaten nach dem Tag, an dem die Eintragung der Umwandlung als bekannt gemacht gilt, ihren Anspruch nach Grund und Höhe schriftlich anmelden, Sicherheit zu leisten, soweit sie nicht Befriedigung verlangen können. Dieses Recht steht den Gläubigern jedoch nur zu, wenn sie glaubhaft machen, dass durch die Umwandlung die Erfüllung ihrer Forderung gefährdet wird. Das Recht, Sicherheitsleistung zu verlangen, steht Gläubigern nicht zu, die im Falle der Insolvenz ein Recht auf vorzugsweise Befriedigung aus einer Deckungsmasse haben, die nach gesetzlicher Vorschrift zu ihrem Schutz errichtet und staatlich überwacht ist."
    },
    {
      "date": "2025-06-20",
      "id": "112853",
      "original_text": "Registerbekanntmachung nach dem Umwandlungsgesetz\nBaden-Württemberg Amtsgericht Stuttgart HRB 106282\nSchwandt GmbH, Fuhr- und Baggerbetrieb – Heilbronn",
      "type": "Registerbekanntmachung nach dem Umwandlungsgesetz",
      "state": "Baden-Württemberg",
      "amtsgericht": "Amtsgericht Stuttgart",
      "registernummer": "HRB 106282",
      "registerart": "HRB",
      "company_name": "Schwandt GmbH, Fuhr- und Baggerbetrieb",
      "company_seat": "Heilbronn",
      "details": "20.06.2025 (Bekanntmachungsdatum)\n\nBaden-Württemberg Amtsgericht Stuttgart HRB 106282\nRegisterbekanntmachung nach dem Umwandlungsgesetz 20.06.2025 (Eintragungsdatum)\n\nSchwandt GmbH, Fuhr- und Baggerbetrieb\nGesellschaft mit beschränkter Haftung\nHeilbronn\n\nAls nicht eingetragen wird bekanntgemacht:\nDen Gläubigern der an der Verschmelzung beteiligten Rechtsträger ist, wenn sie binnen sechs Monaten nach dem Tag, an dem die Eintragung der Verschmelzung in das Register des Sitzes desjenigen Rechtsträgers, dessen Gläubiger sie sind, nach § 19 Abs. 3 UmwG als bekanntgemacht gilt, ihren Anspruch nach Grund und Höhe schriftlich anmelden, Sicherheit zu leisten, soweit sie nicht Befriedigung verlangen können. Dieses Recht steht den Gläubigern jedoch nur zu, wenn sie glaubhaft machen, dass durch die Verschmelzung die Erfüllung ihrer Forderung gefährdet wird."
    },
    {
      "date": "2025-06-20",
      "id": "112854",
      "original_text": "Registerbekanntmachung nach dem Umwandlungsgesetz\nBaden-Württemberg Amtsgericht Stuttgart HRB 108553\nSchwandt Bau GmbH – Heilbronn",
      "type": "Registerbekanntmachung nach dem Umwandlungsgesetz",
      "state": "Baden-Württemberg",
      "amtsgericht": "Amtsgericht Stuttgart",
      "registernummer": "HRB 108553",
      "registerart": "HRB",
      "company_name": "Schwandt Bau GmbH",
      "company_seat": "Heilbronn",
      "details": "20.06.2025 (Bekanntmachungsdatum)\n\nBaden-Württemberg Amtsgericht Stuttgart HRB 108553\nRegisterbekanntmachung nach dem Umwandlungsgesetz 20.06.2025 (Eintragungsdatum)\n\nSchwandt Bau GmbH\nGesellschaft mit beschränkter Haftung\nHeilbronn\n\nAls nicht eingetragen wird bekanntgemacht:\nDen Gläubigern der an der Verschmelzung beteiligten Rechtsträger ist, wenn sie binnen sechs Monaten nach dem Tag, an dem die Eintragung der Verschmelzung in das Register des Sitzes desjenigen Rechtsträgers, dessen Gläubiger sie sind, nach § 19 Abs. 3 UmwG als bekanntgemacht gilt, ihren Anspruch nach Grund und Höhe schriftlich anmelden, Sicherheit zu leisten, soweit sie nicht Befriedigung verlangen können. Dieses Recht steht den Gläubigern jedoch nur zu, wenn sie glaubhaft machen, dass durch die Verschmelzung die Erfüllung ihrer Forderung gefährdet wird."
    },
    {
      "date": "2025-06-20",
      "id": "112855",
      "original_text": "Löschungsankündigung\nBerlin Amtsgericht Berlin (Charlottenburg) HRA 51834\nBrillant 2293. GmbH & Co. Verwaltungs KG – Berlin",
      "type": "Löschungsankündigung",
      "state": "Berlin",
      "amtsgericht": "Amtsgericht Berlin (Charlottenburg)",
      "registernummer": "HRA 51834",
      "registerart": "HRA",
      "company_name": "Brillant 2293. GmbH & Co. Verwaltungs KG",
      "company_seat": "Berlin",
      "details": "20.06.2025 (Bekanntmachungsdatum)\n\nBerlin Amtsgericht Berlin (Charlottenburg) HRA 51834\nLöschungsankündigung\n\nBrillant 2293. GmbH & Co. Verwaltungs KG\nKommanditgesellschaft\nBerlin\n\nBei dem nachstehenden Unternehmen / der nachstehenden Gesellschaft wird das Amtslöschungsverfahren gemäß § 31 Abs. 2 HGB eingeleitet. Widerspruchsfrist 1 Monat"
    },
    {
      "date": "2025-06-20",
      "id": "112856",
      "original_text": "Registerbekanntmachung nach dem Umwandlungsgesetz\nBerlin Amtsgericht Berlin (Charlottenburg) HRB 276225\nsozivio-Soziale Vision gGmbH – Berlin",
      "type": "Registerbekanntmachung nach dem Umwandlungsgesetz",
      "state": "Berlin",
      "amtsgericht": "Amtsgericht Berlin (Charlottenburg)",
      "registernummer": "HRB 276225",
      "registerart": "HRB",
      "company_name": "sozivio-Soziale Vision gGmbH",
      "company_seat": "Berlin",
      "details": "20.06.2025 (Bekanntmachungsdatum)\n\nBerlin Amtsgericht Berlin (Charlottenburg) HRB 276225\nRegisterbekanntmachung nach dem Umwandlungsgesetz 19.06.2025 (Eintragungsdatum)\n\nsozivio-Soziale Vision gGmbH\nGesellschaft mit beschränkter Haftung\nBerlin\n\nZu Eintragungsnummer 1 vom 19.06.2025 wird als nicht eingetragen veröffentlicht:\nDen Gläubigern ist, wenn sie binnen sechs Monaten nach dem Tag, an dem die Eintragung der Umwandlung als bekannt gemacht gilt, ihren Anspruch nach Grund und Höhe schriftlich anmelden, Sicherheit zu leisten, soweit sie nicht Befriedigung verlangen können. Dieses Recht steht den Gläubigern jedoch nur zu, wenn sie glaubhaft machen, dass durch die Umwandlung die Erfüllung ihrer Forderung gefährdet wird. Das Recht, Sicherheitsleistung zu verlangen, steht Gläubigern nicht zu, die im Falle der Insolvenz ein Recht auf vorzugsweise Befriedigung aus einer Deckungsmasse haben, die nach gesetzlicher Vorschrift zu ihrem Schutz errichtet und staatlich überwacht ist."
    },
    {
      "date": "2025-06-20",
      "id": "112857",
      "original_text": "Einreichung neuer Dokumente\nBrandenburg Amtsgericht Potsdam HRB 14297\ncommsult- Aktiengesellschaft – Potsdam",
      "type": "Einreichung neuer Dokumente",
      "state": "Brandenburg",
      "amtsgericht": "Amtsgericht Potsdam",
      "registernummer": "HRB 14297",
      "registerart": "HRB",
      "company_name": "commsult- Aktiengesellschaft",
      "company_seat": "Potsdam",
      "details": "20.06.2025 (Bekanntmachungsdatum)\n\nBrandenburg Amtsgericht Potsdam HRB 14297\nEinreichung neuer Dokumente\n\ncommsult- Aktiengesellschaft\nAktiengesellschaft\nPotsdam\n\nAls nicht eingetragen wird bekanntgemacht : Eine Liste der Mitglieder des Aufsichtsrates wurde zum Handelsregister eingereicht."
    },
    {
      "date": "2025-06-20",
      "id": "112858",
      "original_text": "Registerbekanntmachung nach dem Umwandlungsgesetz\nSchleswig-Holstein Amtsgericht Lübeck HRB 3382 AH\nxSuite Group GmbH – Ahrensburg",
      "type": "Registerbekanntmachung nach dem Umwandlungsgesetz",
      "state": "Schleswig-Holstein",
      "amtsgericht": "Amtsgericht Lübeck",
      "registernummer": "HRB 3382 AH",
      "registerart": "HRB",
      "company_name": "xSuite Group GmbH",
      "company_seat": "Ahrensburg",
      "details": "20.06.2025 (Bekanntmachungsdatum)\n\nSchleswig-Holstein Amtsgericht Lübeck HRB 3382 AH\nRegisterbekanntmachung nach dem Umwandlungsgesetz 19.06.2025 (Eintragungsdatum)\n\nxSuite Group GmbH\nGesellschaft mit beschränkter Haftung\nAhrensburg\n\nZu Eintragungsnummer 17 vom 19.06.2025 wird als nicht eingetragen veröffentlicht:  Als nicht eingetragen wird veröffentlicht: Den Gläubigern der an der Verschmelzung beteiligten Rechtsträger ist, wenn sie binnen sechs Monaten nach dem Tag, an dem die Eintragung der Verschmelzung in das Register des Sitzes desjenigen Rechtsträgers, dessen Gläubiger sie sind, als bekannt gemacht gilt, ihren Anspruch nach Grund und Höhe schriftlich anmelden, Sicherheit zu leisten, soweit sie nicht Befriedigung verlangen können. Dieses Recht steht den Gläubigern jedoch nur zu, wenn sie glaubhaft machen, dass durch die Verschmelzung die Erfüllung ihrer Forderung gefährdet wird."
    },
    {
      "date": "2025-06-20",
      "id": "112859",
      "original_text": "Löschungsankündigung\nBerlin Amtsgericht Berlin (Charlottenburg) HRA 47134\nPI Torstraße Projektentwicklungs GmbH & Co. KG – Berlin",
      "type": "Löschungsankündigung",
      "state": "Berlin",
      "amtsgericht": "Amtsgericht Berlin (Charlottenburg)",
      "registernummer": "HRA 47134",
      "registerart": "HRA",
      "company_name": "PI Torstraße Projektentwicklungs GmbH & Co. KG",
      "company_seat": "Berlin",
      "details": "20.06.2025 (Bekanntmachungsdatum)\n\nBerlin Amtsgericht Berlin (Charlottenburg) HRA 47134\nLöschungsankündigung\n\nPI Torstraße Projektentwicklungs GmbH & Co. KG\nKommanditgesellschaft\nBerlin\n\nBei dem nachstehenden Unternehmen / der nachstehenden Gesellschaft wird das Amtslöschungsverfahren gemäß § 31 Abs. 2 HGB eingeleitet. Widerspruchsfrist 1 Monat"
    },
    {
      "date": "2025-06-20",
      "id": "112860",
      "original_text": "Sonstige Registerbekanntmachung\nBrandenburg Amtsgericht Cottbus HRB 17378\nLEAG Biomass GmbH – Cottbus",
      "type": "Sonstige Registerbekanntmachung",
      "state": "Brandenburg",
      "amtsgericht": "Amtsgericht Cottbus",
      "registernummer": "HRB 17378",
      "registerart": "HRB",
      "company_name": "LEAG Biomass GmbH",
      "company_seat": "Cottbus",
      "details": "20.06.2025 (Bekanntmachungsdatum)\n\nBrandenburg Amtsgericht Cottbus HRB 17378\nSonstige Registerbekanntmachung\n\nLEAG Biomass GmbH\nGesellschaft mit beschränkter Haftung\nCottbus\n\nAls nicht eingetragen wird veröffentlicht:\nDer andere Vertragsteil hat den Gläubigern dieses Rechtsträgers, dessen Forderungen begründet worden sind, bevor die Eintragung der Beendigung dieses Vertrages in das Handelsregister nach § 10 des Handelsgesetzbuches als bekannt gemacht gilt, Sicherheit zu leisten, wenn sie sich binnen sechs Monaten nach der Bekanntmachung der Eintragung zu diesem Zweck bei ihm melden."
    },
    {
      "date": "2025-06-20",
      "id": "112861",
      "original_text": "Einreichung neuer Dokumente\nThüringen Amtsgericht Jena HRB 502044\nTEAG Thüringer Energie AG – Erfurt",
      "type": "Einreichung neuer Dokumente",
      "state": "Thüringen",
      "amtsgericht": "Amtsgericht Jena",
      "registernummer": "HRB 502044",
      "registerart": "HRB",
      "company_name": "TEAG Thüringer Energie AG",
      "company_seat": "Erfurt",
      "details": "20.06.2025 (Bekanntmachungsdatum)\n\nThüringen Amtsgericht Jena HRB 502044\nEinreichung neuer Dokumente 20.06.2025 (Eintragungsdatum)\n\nTEAG Thüringer Energie AG\nAktiengesellschaft\nErfurt\n\nBekanntmachung gem. § 106 AktG: Aufgrund einer Veränderung in den Personen der Aufsichtsratsmitglieder ist durch den Vorstand eine neue Liste zum Handelsregister eingereicht worden."
    },
    {
      "date": "2025-06-20",
      "id": "112862",
      "original_text": "Löschungsankündigung\nSchleswig-Holstein Amtsgericht Lübeck HRB 24256\nSH Service Hanse GmbH – Glinde",
      "type": "Löschungsankündigung",
      "state": "Schleswig-Holstein",
      "amtsgericht": "Amtsgericht Lübeck",
      "registernummer": "HRB 24256",
      "registerart": "HRB",
      "company_name": "SH Service Hanse GmbH",
      "company_seat": "Glinde",
      "details": "20.06.2025 (Bekanntmachungsdatum)\n\nSchleswig-Holstein Amtsgericht Lübeck HRB 24256\nLöschungsankündigung\n\nSH Service Hanse GmbH\nGesellschaft mit beschränkter Haftung\nGlinde\n\nEs ist die Löschung der nachstehenden Gesellschaft wegen Vermögenslosigkeit gemäß § 394 FamFG beabsichtigt. Widerspruchsfrist: 1 Monat."
    },
    {
      "date": "2025-06-20",
      "id": "112863",
      "original_text": "Sonstige Registerbekanntmachung\nSchleswig-Holstein Amtsgericht Lübeck HRB 24256\nSH Service Hanse GmbH – Glinde",
      "type": "Sonstige Registerbekanntmachung",
      "state": "Schleswig-Holstein",
      "amtsgericht": "Amtsgericht Lübeck",
      "registernummer": "HRB 24256",
      "registerart": "HRB",
      "company_name": "SH Service Hanse GmbH",
      "company_seat": "Glinde",
      "details": "20.06.2025 (Bekanntmachungsdatum)\n\nSchleswig-Holstein Amtsgericht Lübeck HRB 24256\nSonstige Registerbekanntmachung\n\nSH Service Hanse GmbH\nGesellschaft mit beschränkter Haftung\nGlinde\n\nAls nicht eingetragen wird veröffentlicht:\n\nAmtsgericht Lübeck, Am Burgfeld 7, 23568 Lübeck\n\nHerr\nMichal Dawid Cieslak\n\nzurzeit unbekannten Aufhenthaltes\n\nDatum: 19.06.2025\n\nSehr geehrte Damen und Herren,\n\nin der Handelsregistersache der\n\nSH Service Hanse GmbH\n\nergeben sich aus den mir vorliegenden Unterlagen Anhaltspunkte dafür, dass die Gesellschaft, als deren Geschäftsführer Sie noch eingetragen sind, vermögenslos ist:\n\nLöschungsantrag des Finanzamts Stormarn vom 12.03.2025\n\nIch beabsichtige daher, die Gesellschaft wegen Vermögenslosigkeit gemäß § 394 FamFG zu löschen.\n\nIch bestimme eine Frist von einem Monat zur Geltendmachung eines Widerspruchs gegen die Löschung, § 394 Abs. 2 S. 1 FamFG.\n\nWeiter bitte ich Sie, mir binnen derselben Frist mitzuteilen, ob die genannte Gesellschaft noch Vermögen hat, ggf. welche Vermögensgegenstände sie besitzt, ob die Gesellschaft noch Partei eines noch nicht rechtskräftig abgeschlossenen Rechtsstreits ist oder ob sonst noch eine Abwicklung stattfindet.\n\nNach Fristablauf ohne Widerspruch von Ihnen oder anderer Seite wird die Gesellschaft gelöscht.\n\nMit freundlichen Grüßen\n\nOstermann\nDipl.-Rechtspflegerin (FH)"
    },
    {
      "date": "2025-06-20",
      "id": "112864",
      "original_text": "Löschungsankündigung\nBerlin Amtsgericht Berlin (Charlottenburg) HRB 99268\nCapricornus Real Estate Trust GmbH – Berlin",
      "type": "Löschungsankündigung",
      "state": "Berlin",
      "amtsgericht": "Amtsgericht Berlin (Charlottenburg)",
      "registernummer": "HRB 99268",
      "registerart": "HRB",
      "company_name": "Capricornus Real Estate Trust GmbH",
      "company_seat": "Berlin",
      "details": "20.06.2025 (Bekanntmachungsdatum)\n\nBerlin Amtsgericht Berlin (Charlottenburg) HRB 99268\nLöschungsankündigung\n\nCapricornus Real Estate Trust GmbH\nGesellschaft mit beschränkter Haftung\nBerlin\n\nBei der nachstehenden Gesellschaft wird das Amtslöschungsverfahren gemäß § 394 FamFG eingeleitet. Widerspruchsfrist\n6 Wochen."
    },
    {
      "date": "2025-06-20",
      "id": "112865",
      "original_text": "Einreichung neuer Dokumente\nBerlin Amtsgericht Berlin (Charlottenburg) HRB 80876\nBREAG Berliner Real Estate AG – Berlin",
      "type": "Einreichung neuer Dokumente",
      "state": "Berlin",
      "amtsgericht": "Amtsgericht Berlin (Charlottenburg)",
      "registernummer": "HRB 80876",
      "registerart": "HRB",
      "company_name": "BREAG Berliner Real Estate AG",
      "company_seat": "Berlin",
      "details": "20.06.2025 (Bekanntmachungsdatum)\n\nBerlin Amtsgericht Berlin (Charlottenburg) HRB 80876\nEinreichung neuer Dokumente\n\nBREAG Berliner Real Estate AG\nAktiengesellschaft\nBerlin\n\nAls nicht eingetragen wird veröffentlicht:\n\nEs wurde eine neue Liste der Aufsichtsratsmitglieder eingereicht (§ 106 AktG)."
    },
    {
      "date": "2025-06-20",
      "id": "112866",
      "original_text": "Sonstige Registerbekanntmachung\nSchleswig-Holstein Amtsgericht Lübeck HRB 4097\nDräger Safety AG & Co. KGaA – Lübeck",
      "type": "Sonstige Registerbekanntmachung",
      "state": "Schleswig-Holstein",
      "amtsgericht": "Amtsgericht Lübeck",
      "registernummer": "HRB 4097",
      "registerart": "HRB",
      "company_name": "Dräger Safety AG & Co. KGaA",
      "company_seat": "Lübeck",
      "details": "20.06.2025 (Bekanntmachungsdatum)\n\nSchleswig-Holstein Amtsgericht Lübeck HRB 4097\nSonstige Registerbekanntmachung\n\nDräger Safety AG & Co. KGaA\nKommanditgesellschaft auf Aktien\nLübeck\n\nAls nicht eingetragen wird veröffentlicht:\nDräger Safety AG & Co. KGaA, Lübeck, Revalstraße 1, 23560 Lübeck. Die Gesellschaft hat den  Entwurf eines Verschmelzungsvertrages mit der Dräger MSI GmbH, Hagen, beim Handelsregister eingereicht."
    },
    {
      "date": "2025-06-20",
      "id": "112867",
      "original_text": "Sonstige Registerbekanntmachung\nBaden-Württemberg Amtsgericht Mannheim HRB 240414\nStadtwerke Bretten Gesellschaft mit beschränkter Haftung – Bretten",
      "type": "Sonstige Registerbekanntmachung",
      "state": "Baden-Württemberg",
      "amtsgericht": "Amtsgericht Mannheim",
      "registernummer": "HRB 240414",
      "registerart": "HRB",
      "company_name": "Stadtwerke Bretten Gesellschaft mit beschränkter Haftung",
      "company_seat": "Bretten",
      "details": "20.06.2025 (Bekanntmachungsdatum)\n\nBaden-Württemberg Amtsgericht Mannheim HRB 240414\nSonstige Registerbekanntmachung\n\nStadtwerke Bretten Gesellschaft mit beschränkter Haftung\nGesellschaft mit beschränkter Haftung\nBretten\n\nDie Gesellschaft hat am 18.06.2025 die Liste über die Zusammensetzung des Aufsichtsrats zum Handelsregister eingereicht."
    },
    {
      "date": "2025-06-20",
      "id": "112868",
      "original_text": "Registerbekanntmachung nach dem Umwandlungsgesetz\nBerlin Amtsgericht Berlin (Charlottenburg) HRB 80189\nTEMA Terrain Geschäftsführung GmbH – Berlin",
      "type": "Registerbekanntmachung nach dem Umwandlungsgesetz",
      "state": "Berlin",
      "amtsgericht": "Amtsgericht Berlin (Charlottenburg)",
      "registernummer": "HRB 80189",
      "registerart": "HRB",
      "company_name": "TEMA Terrain Geschäftsführung GmbH",
      "company_seat": "Berlin",
      "details": "20.06.2025 (Bekanntmachungsdatum)\n\nBerlin Amtsgericht Berlin (Charlottenburg) HRB 80189\nRegisterbekanntmachung nach dem Umwandlungsgesetz 19.06.2025 (Eintragungsdatum)\n\nTEMA Terrain Geschäftsführung GmbH\nGesellschaft mit beschränkter Haftung\nBerlin\n\nZu Eintragungsnummer 7 vom 19.06.2025 wird als nicht eingetragen veröffentlicht:Den Gläubigern der an der Verschmelzung beteiligten Rechtsträger ist, wenn sie binnen sechs Monaten nach dem Tag, an dem die Eintragung der Verschmelzung in das Register des Sitzes desjenigen Rechtsträgers, dessen Gläubiger sie sind, als bekannt gemacht gilt, ihren Anspruch nach Grund und Höhe schriftlich anmelden, Sicherheit zu leisten, soweit sie nicht Befriedigung verlangen können. Dieses Recht steht den Gläubigern jedoch nur zu, wenn sie glaubhaft machen, dass durch die Verschmelzung die Erfüllung ihrer Forderung gefährdet wird. Das Recht, Sicherheitsleistung zu verlangen, steht Gläubigern nicht zu, die im Falle der Insolvenz ein Recht auf vorzugsweise Befriedigung aus einer Deckungsmasse haben, die nach gesetzlicher Vorschrift zu ihrem Schutz errichtet und staatlich überwacht ist."
    },
    {
      "date": "2025-06-20",
      "id": "112869",
      "original_text": "Registerbekanntmachung nach dem Umwandlungsgesetz\nBerlin Amtsgericht Berlin (Charlottenburg) HRB 204691\nIndigo Berlin GmbH – Berlin",
      "type": "Registerbekanntmachung nach dem Umwandlungsgesetz",
      "state": "Berlin",
      "amtsgericht": "Amtsgericht Berlin (Charlottenburg)",
      "registernummer": "HRB 204691",
      "registerart": "HRB",
      "company_name": "Indigo Berlin GmbH",
      "company_seat": "Berlin",
      "details": "20.06.2025 (Bekanntmachungsdatum)\n\nBerlin Amtsgericht Berlin (Charlottenburg) HRB 204691\nRegisterbekanntmachung nach dem Umwandlungsgesetz 20.06.2025 (Eintragungsdatum)\n\nIndigo Berlin GmbH\nGesellschaft mit beschränkter Haftung\nBerlin\n\nZu Eintragungsnummer 7 vom 20.06.2025 wird als nicht eingetragen veröffentlicht: Den Gläubigern der an der Verschmelzung beteiligten Rechtsträger ist, wenn sie binnen sechs Monaten nach dem Tag, an dem die Eintragung der Verschmelzung in das Register des Sitzes desjenigen Rechtsträgers, dessen Gläubiger sie sind, als bekannt gemacht gilt, ihren Anspruch nach Grund und Höhe schriftlich anmelden, Sicherheit zu leisten, soweit sie nicht Befriedigung verlangen können. Dieses Recht steht den Gläubigern jedoch nur zu, wenn sie glaubhaft machen, dass durch die Verschmelzung die Erfüllung ihrer Forderung gefährdet wird. Das Recht, Sicherheitsleistung zu verlangen, steht Gläubigern nicht zu, die im Falle der Insolvenz ein Recht auf vorzugsweise Befriedigung aus einer Deckungsmasse haben, die nach gesetzlicher Vorschrift zu ihrem Schutz errichtet und staatlich überwacht ist."
    },
    {
      "date": "2025-06-20",
      "id": "112870",
      "original_text": "Registerbekanntmachung nach dem Umwandlungsgesetz\nBerlin Amtsgericht Berlin (Charlottenburg) HRB 207570\neolos GmbH – Berlin",
      "type": "Registerbekanntmachung nach dem Umwandlungsgesetz",
      "state": "Berlin",
      "amtsgericht": "Amtsgericht Berlin (Charlottenburg)",
      "registernummer": "HRB 207570",
      "registerart": "HRB",
      "company_name": "eolos GmbH",
      "company_seat": "Berlin",
      "details": "20.06.2025 (Bekanntmachungsdatum)\n\nBerlin Amtsgericht Berlin (Charlottenburg) HRB 207570\nRegisterbekanntmachung nach dem Umwandlungsgesetz\n\neolos GmbH\nGesellschaft mit beschränkter Haftung\nBerlin\n\nAls nicht eingetragen wird veröffentlicht:\n1. Die Gesellschaft hat den Entwurf eines notariell beurkundeten Verschmelzungsplans betreffend die Verschmelzung der Gesellschaft auf die Cohen Consulting IKE mit Sitz in Rethymno, Griechenland, gemäß §§ 305 ff. UmwG zum Handelsregister des Amtsgerichts Charlottenburg eingereicht.\n\n2. Die an der Verschmelzung beteiligten Gesellschaften haben folgende Rechtsform und sind eingetragen;\n- Eolos GmbH mit Sitz in Berlin, (Kapitalgesellschaft), eingetragen im Handelsregister von Berlin-Charlottenburg zu HRB 207570\n- Cohen Consulting IKE mit Sitz in Rethymno, (Private Kapitalgesellschaft) eingetragen im Handelsregister der Handelskammer Rethymno unter der Nummer 168011850000.\n\n3. Die an der Verschmelzung beteiligten Gesellschaften haben folgende Rechtsform und sind eingetragen;\n- Eolos GmbH mit Sitz in Berlin, (Kapitalgesellschaft), eingetragen im Handelsregister von Berlin-Charlottenburg zu HRB 207570\n- Cohen Consulting IKE mit Sitz in Rethymno, (Private Kapitalgesellschaft) eingetragen im Handelsregister der Handelskammer Rethymno unter der Nummer 168011850000.\n\n4. Die an der Verschmelzung beteiligten Gesellschaften haben folgende Rechtsform und sind eingetragen;\n- Eolos GmbH mit Sitz in Berlin, (Kapitalgesellschaft), eingetragen im Handelsregister von Berlin-Charlottenburg zu HRB 207570\n- Cohen Consulting IKE mit Sitz in Rethymno, (Private Kapitalgesellschaft) eingetragen im Handelsregister der Handelskammer Rethymno unter der Nummer 168011850000.\n\n5. Die Gesellschaft erteilt den Anteilseignern, Gläubigern und Arbeitnehmer nach Maßgabe des § 308 Abs. 1 Satz 2 Nr. 4\na) und b) UmwG den Hinweis, dass sie der jeweiligen Gesellschaft spätestens fünf Tage vor dem Tag der Gesellschafterversammlung Bemerkungen zum Verschmelzungsplan übermitteln können."
    },
    {
      "date": "2025-06-20",
      "id": "112871",
      "original_text": "Registerbekanntmachung nach dem Umwandlungsgesetz\nBerlin Amtsgericht Berlin (Charlottenburg) GnR 940\nLadegrün! eG – Berlin",
      "type": "Registerbekanntmachung nach dem Umwandlungsgesetz",
      "state": "Berlin",
      "amtsgericht": "Amtsgericht Berlin (Charlottenburg)",
      "registernummer": "GnR 940",
      "registerart": "GnR",
      "company_name": "Ladegrün! eG",
      "company_seat": "Berlin",
      "details": "20.06.2025 (Bekanntmachungsdatum)\n\nBerlin Amtsgericht Berlin (Charlottenburg) GnR 940\nRegisterbekanntmachung nach dem Umwandlungsgesetz 19.06.2025 (Eintragungsdatum)\n\nLadegrün! eG\neingetragene Genossenschaft\nBerlin\n\nZu Eintragungsnummer 3 vom 19.06.2025 wird als nicht eingetragen veröffentlicht:Den Gläubigern ist, wenn sie binnen sechs Monaten nach dem Tag, an dem die Eintragung der Umwandlung als bekannt gemacht gilt, ihren Anspruch nach Grund und Höhe schriftlich anmelden, Sicherheit zu leisten, soweit sie nicht Befriedigung verlangen können. Dieses Recht steht den Gläubigern jedoch nur zu, wenn sie glaubhaft machen, dass durch die Umwandlung die Erfüllung ihrer Forderung gefährdet wird. Das Recht, Sicherheitsleistung zu verlangen, steht Gläubigern nicht zu, die im Falle der Insolvenz ein Recht auf vorzugsweise Befriedigung aus einer Deckungsmasse haben, die nach gesetzlicher Vorschrift zu ihrem Schutz errichtet und staatlich überwacht ist."
    },
    {
      "date": "2025-06-20",
      "id": "112872",
      "original_text": "Löschungsankündigung\nBerlin Amtsgericht Berlin (Charlottenburg) HRA 41001\nmobiler Buchführungsservice MV e. K. - Inhaber Michael Vetter – Berlin",
      "type": "Löschungsankündigung",
      "state": "Berlin",
      "amtsgericht": "Amtsgericht Berlin (Charlottenburg)",
      "registernummer": "HRA 41001",
      "registerart": "HRA",
      "company_name": "mobiler Buchführungsservice MV e. K. - Inhaber Michael Vetter",
      "company_seat": "Berlin",
      "details": "20.06.2025 (Bekanntmachungsdatum)\n\nBerlin Amtsgericht Berlin (Charlottenburg) HRA 41001\nLöschungsankündigung\n\nmobiler Buchführungsservice MV e. K. - Inhaber Michael Vetter\nEinzelkaufmann / Einzelkauffrau\nBerlin\n\nBei dem nachstehenden Unternehmen / der nachstehenden Gesellschaft wird das Amtslöschungsverfahren gemäß § 31 Abs. 2 HGB eingeleitet. Widerspruchsfrist 1 Monat"
    },
    {
      "date": "2025-06-20",
      "id": "112873",
      "original_text": "Löschungsankündigung\nSchleswig-Holstein Amtsgericht Kiel HRB 15204\nGREEN'S Spielcenter GmbH – Bad Segeberg",
      "type": "Löschungsankündigung",
      "state": "Schleswig-Holstein",
      "amtsgericht": "Amtsgericht Kiel",
      "registernummer": "HRB 15204",
      "registerart": "HRB",
      "company_name": "GREEN'S Spielcenter GmbH",
      "company_seat": "Bad Segeberg",
      "details": "20.06.2025 (Bekanntmachungsdatum)\n\nSchleswig-Holstein Amtsgericht Kiel HRB 15204\nLöschungsankündigung\n\nGREEN'S Spielcenter GmbH\nGesellschaft mit beschränkter Haftung\nBad Segeberg\n\nEs ist die Löschung der nachstehenden Gesellschaft wegen Vermögenslosigkeit gemäß § 394 FamFG beabsichtigt. Widerspruchsfrist: 2 Monate."
    },
    {
      "date": "2025-06-20",
      "id": "112874",
      "original_text": "Löschungsankündigung\nBerlin Amtsgericht Berlin (Charlottenburg) HRA 40824\n2000-Immobilien GmbH & Co KG Beratung Bewertung Vermittlung – Berlin",
      "type": "Löschungsankündigung",
      "state": "Berlin",
      "amtsgericht": "Amtsgericht Berlin (Charlottenburg)",
      "registernummer": "HRA 40824",
      "registerart": "HRA",
      "company_name": "2000-Immobilien GmbH & Co KG Beratung Bewertung Vermittlung",
      "company_seat": "Berlin",
      "details": "20.06.2025 (Bekanntmachungsdatum)\n\nBerlin Amtsgericht Berlin (Charlottenburg) HRA 40824\nLöschungsankündigung\n\n2000-Immobilien GmbH & Co KG Beratung Bewertung Vermittlung\nKommanditgesellschaft\nBerlin\n\nBei dem nachstehenden Unternehmen / der nachstehenden Gesellschaft wird das Amtslöschungsverfahren gemäß § 31 Abs. 2 HGB eingeleitet. Widerspruchsfrist 1 Monat"
    },
    {
      "date": "2025-06-20",
      "id": "112875",
      "original_text": "Löschungsankündigung\nSachsen Amtsgericht Dresden HRB 42167\nALDOM-FIL UG (haftungsbeschränkt) – Görlitz",
      "type": "Löschungsankündigung",
      "state": "Sachsen",
      "amtsgericht": "Amtsgericht Dresden",
      "registernummer": "HRB 42167",
      "registerart": "HRB",
      "company_name": "ALDOM-FIL UG (haftungsbeschränkt)",
      "company_seat": "Görlitz",
      "details": "20.06.2025 (Bekanntmachungsdatum)\n\nSachsen Amtsgericht Dresden HRB 42167\nLöschungsankündigung\n\nALDOM-FIL UG (haftungsbeschränkt)\nGesellschaft mit beschränkter Haftung\nGörlitz\n\nDas Registergericht beabsichtigt, die im Handelsregister eingetragene Gesellschaft von Amts wegen nach § 394 FamFG zu löschen. Die Frist zu Erhebung eines Widerspruchs gegen die beabsichtigte Löschung wird auf einen Monat festgesetzt."
    },
    {
      "date": "2025-06-20",
      "id": "112876",
      "original_text": "Registerbekanntmachung nach dem Umwandlungsgesetz\nSachsen Amtsgericht Chemnitz HRA 5339\nLabor-Pilz, Labor- und Industriebedarf e.K. – Freiberg",
      "type": "Registerbekanntmachung nach dem Umwandlungsgesetz",
      "state": "Sachsen",
      "amtsgericht": "Amtsgericht Chemnitz",
      "registernummer": "HRA 5339",
      "registerart": "HRA",
      "company_name": "Labor-Pilz, Labor- und Industriebedarf e.K.",
      "company_seat": "Freiberg",
      "details": "20.06.2025 (Bekanntmachungsdatum)\n\nSachsen Amtsgericht Chemnitz HRA 5339\nRegisterbekanntmachung nach dem Umwandlungsgesetz 20.06.2025 (Eintragungsdatum)\n\nLabor-Pilz, Labor- und Industriebedarf e.K.\nEinzelkaufmann / Einzelkauffrau\nFreiberg\n\nDen Gläubigern der an der Ausgliederung beteiligten Rechtsträger ist, wenn sie binnen sechs Monaten nach dem Tag, an dem die Eintragung der Ausgliederung in das Register des Sitzes desjenigen Rechtsträgers, dessen Gläubiger sie sind, nach § 19 Abs. 3 UmwG als bekannt gemacht gilt, ihren Anspruch nach Grund und Höhe in Textform anmelden, Sicherheit zu leisten, soweit sie nicht Befriedigung verlangen können. Dieses Recht steht den Gläubigern jedoch nur zu, wenn sie glaubhaft machen, dass durch die Ausgliederung die Erfüllung der Forderung gefährdet wird."
    },
    {
      "date": "2025-06-20",
      "id": "112877",
      "original_text": "Registerbekanntmachung nach dem Umwandlungsgesetz\nSachsen Amtsgericht Leipzig HRA 18452\nWEP-Projektentwicklung-GmbH und Co. KG – Leipzig",
      "type": "Registerbekanntmachung nach dem Umwandlungsgesetz",
      "state": "Sachsen",
      "amtsgericht": "Amtsgericht Leipzig",
      "registernummer": "HRA 18452",
      "registerart": "HRA",
      "company_name": "WEP-Projektentwicklung-GmbH und Co. KG",
      "company_seat": "Leipzig",
      "details": "20.06.2025 (Bekanntmachungsdatum)\n\nSachsen Amtsgericht Leipzig HRA 18452\nRegisterbekanntmachung nach dem Umwandlungsgesetz 20.06.2025 (Eintragungsdatum)\n\nWEP-Projektentwicklung-GmbH und Co. KG\nKommanditgesellschaft\nLeipzig\n\nDen Gläubigern der an der Verschmelzung beteiligten Rechtsträger ist, wenn sie binnen sechs Monaten nach dem Tag, an dem die Eintragung der Verschmelzung in das Register des Sitzes desjenigen Rechtsträgers, dessen Gläubiger sie sind, nach § 19 Abs. 3 UmwG als bekannt gemacht gilt, ihren Anspruch nach Grund und Höhe in Textform anmelden, Sicherheit zu leisten, soweit sie nicht Befriedigung verlangen können. Dieses Recht steht den Gläubigern jedoch nur zu, wenn sie glaubhaft machen, dass durch die Verschmelzung die Erfüllung der Forderung gefährdet wird."
    },
    {
      "date": "2025-06-20",
      "id": "112878",
      "original_text": "Löschungsankündigung\nSachsen Amtsgericht Dresden HRB 31111\nGaststätte \"Astloch\" UG (haftungsbeschränkt) – Dresden",
      "type": "Löschungsankündigung",
      "state": "Sachsen",
      "amtsgericht": "Amtsgericht Dresden",
      "registernummer": "HRB 31111",
      "registerart": "HRB",
      "company_name": "Gaststätte \"Astloch\" UG (haftungsbeschränkt)",
      "company_seat": "Dresden",
      "details": "20.06.2025 (Bekanntmachungsdatum)\n\nSachsen Amtsgericht Dresden HRB 31111\nLöschungsankündigung\n\nGaststätte \"Astloch\" UG (haftungsbeschränkt)\nGesellschaft mit beschränkter Haftung\nDresden\n\nDas Registergericht beabsichtigt, die im Handelsregister eingetragene Gesellschaft von Amts wegen nach § 394 FamFG zu löschen. Die Frist zu Erhebung eines Widerspruchs gegen die beabsichtigte Löschung wird auf einen Monat festgesetzt."
    },
    {
      "date": "2025-06-20",
      "id": "112879",
      "original_text": "Registerbekanntmachung nach dem Umwandlungsgesetz\nSachsen Amtsgericht Chemnitz HRB 37478\nLabor-Pilz, Labor- und Industriebedarf GmbH – Freiberg",
      "type": "Registerbekanntmachung nach dem Umwandlungsgesetz",
      "state": "Sachsen",
      "amtsgericht": "Amtsgericht Chemnitz",
      "registernummer": "HRB 37478",
      "registerart": "HRB",
      "company_name": "Labor-Pilz, Labor- und Industriebedarf GmbH",
      "company_seat": "Freiberg",
      "details": "20.06.2025 (Bekanntmachungsdatum)\n\nSachsen Amtsgericht Chemnitz HRB 37478\nRegisterbekanntmachung nach dem Umwandlungsgesetz 20.06.2025 (Eintragungsdatum)\n\nLabor-Pilz, Labor- und Industriebedarf GmbH\nGesellschaft mit beschränkter Haftung\nFreiberg\n\nDen Gläubigern der an der Ausgliederung beteiligten Rechtsträger ist, wenn sie binnen sechs Monaten nach dem Tag, an dem die Eintragung der Ausgliederung in das Register des Sitzes desjenigen Rechtsträgers, dessen Gläubiger sie sind, nach § 19 Abs. 3 UmwG als bekannt gemacht gilt, ihren Anspruch nach Grund und Höhe in Textform anmelden, Sicherheit zu leisten, soweit sie nicht Befriedigung verlangen können. Dieses Recht steht den Gläubigern jedoch nur zu, wenn sie glaubhaft machen, dass durch die Ausgliederung die Erfüllung der Forderung gefährdet wird."
    },
    {
      "date": "2025-06-20",
      "id": "112880",
      "original_text": "Einreichung neuer Dokumente\nSachsen Amtsgericht Chemnitz HRB 18935\nSoziale Dienste Johanngeorgenstadt und Umgebung gemeinnützige GmbH – Johanngeorgenstadt",
      "type": "Einreichung neuer Dokumente",
      "state": "Sachsen",
      "amtsgericht": "Amtsgericht Chemnitz",
      "registernummer": "HRB 18935",
      "registerart": "HRB",
      "company_name": "Soziale Dienste Johanngeorgenstadt und Umgebung gemeinnützige GmbH",
      "company_seat": "Johanngeorgenstadt",
      "details": "20.06.2025 (Bekanntmachungsdatum)\n\nSachsen Amtsgericht Chemnitz HRB 18935\nEinreichung neuer Dokumente\n\nSoziale Dienste Johanngeorgenstadt und Umgebung gemeinnützige GmbH\nGesellschaft mit beschränkter Haftung\nJohanngeorgenstadt\n\nAm 16.06.2025 wurde beim Handelsregister des Amtsgerichts Chemnitz die Liste der Mitglieder des Aufsichtsrats gemäß § 52 GmbHG eingereicht."
    },
    {
      "date": "2025-06-20",
      "id": "112881",
      "original_text": "Löschungsankündigung\nSachsen Amtsgericht Dresden HRB 21514\nSaxonia Treuhand Immobilien AG – Dresden",
      "type": "Löschungsankündigung",
      "state": "Sachsen",
      "amtsgericht": "Amtsgericht Dresden",
      "registernummer": "HRB 21514",
      "registerart": "HRB",
      "company_name": "Saxonia Treuhand Immobilien AG",
      "company_seat": "Dresden",
      "details": "20.06.2025 (Bekanntmachungsdatum)\n\nSachsen Amtsgericht Dresden HRB 21514\nLöschungsankündigung\n\nSaxonia Treuhand Immobilien AG\nAktiengesellschaft\nDresden\n\nDas Registergericht beabsichtigt, die im Handelsregister eingetragene Gesellschaft von Amts wegen nach § 394 FamFG zu löschen. Die Frist zu Erhebung eines Widerspruchs gegen die beabsichtigte Löschung wird auf einen Monat festgesetzt."
    },
    {
      "date": "2025-06-20",
      "id": "112882",
      "original_text": "Registerbekanntmachung nach dem Umwandlungsgesetz\nSachsen Amtsgericht Leipzig HRB 29473\nPLATIN Verwaltung GmbH – Delitzsch",
      "type": "Registerbekanntmachung nach dem Umwandlungsgesetz",
      "state": "Sachsen",
      "amtsgericht": "Amtsgericht Leipzig",
      "registernummer": "HRB 29473",
      "registerart": "HRB",
      "company_name": "PLATIN Verwaltung GmbH",
      "company_seat": "Delitzsch",
      "details": "20.06.2025 (Bekanntmachungsdatum)\n\nSachsen Amtsgericht Leipzig HRB 29473\nRegisterbekanntmachung nach dem Umwandlungsgesetz 20.06.2025 (Eintragungsdatum)\n\nPLATIN Verwaltung GmbH\nGesellschaft mit beschränkter Haftung\nDelitzsch\n\nDen Gläubigern der an der Verschmelzung beteiligten Rechtsträger ist, wenn sie binnen sechs Monaten nach dem Tag, an dem die Eintragung der Verschmelzung in das Register des Sitzes desjenigen Rechtsträgers, dessen Gläubiger sie sind, nach § 19 Abs. 3 UmwG als bekannt gemacht gilt, ihren Anspruch nach Grund und Höhe in Textform anmelden, Sicherheit zu leisten, soweit sie nicht Befriedigung verlangen können. Dieses Recht steht den Gläubigern jedoch nur zu, wenn sie glaubhaft machen, dass durch die Verschmelzung die Erfüllung der Forderung gefährdet wird."
    },
    {
      "date": "2025-06-20",
      "id": "112883",
      "original_text": "Registerbekanntmachung nach dem Umwandlungsgesetz\nSachsen Amtsgericht Leipzig HRB 37714\nWEP Planung GmbH – Leipzig",
      "type": "Registerbekanntmachung nach dem Umwandlungsgesetz",
      "state": "Sachsen",
      "amtsgericht": "Amtsgericht Leipzig",
      "registernummer": "HRB 37714",
      "registerart": "HRB",
      "company_name": "WEP Planung GmbH",
      "company_seat": "Leipzig",
      "details": "20.06.2025 (Bekanntmachungsdatum)\n\nSachsen Amtsgericht Leipzig HRB 37714\nRegisterbekanntmachung nach dem Umwandlungsgesetz 20.06.2025 (Eintragungsdatum)\n\nWEP Planung GmbH\nGesellschaft mit beschränkter Haftung\nLeipzig\n\nDen Gläubigern der an der Verschmelzung beteiligten Rechtsträger ist, wenn sie binnen sechs Monaten nach dem Tag, an dem die Eintragung der Verschmelzung in das Register des Sitzes desjenigen Rechtsträgers, dessen Gläubiger sie sind, nach § 19 Abs. 3 UmwG als bekannt gemacht gilt, ihren Anspruch nach Grund und Höhe in Textform anmelden, Sicherheit zu leisten, soweit sie nicht Befriedigung verlangen können. Dieses Recht steht den Gläubigern jedoch nur zu, wenn sie glaubhaft machen, dass durch die Verschmelzung die Erfüllung der Forderung gefährdet wird."
    },
    {
      "date": "2025-06-20",
      "id": "112884",
      "original_text": "Löschungsankündigung\nNiedersachsen Amtsgericht Braunschweig HRB 208016\ndiemed GmbH – Braunschweig",
      "type": "Löschungsankündigung",
      "state": "Niedersachsen",
      "amtsgericht": "Amtsgericht Braunschweig",
      "registernummer": "HRB 208016",
      "registerart": "HRB",
      "company_name": "diemed GmbH",
      "company_seat": "Braunschweig",
      "details": "20.06.2025 (Bekanntmachungsdatum)\n\nNiedersachsen Amtsgericht Braunschweig HRB 208016\nLöschungsankündigung 20.06.2025 (Eintragungsdatum)\n\ndiemed GmbH\nGesellschaft mit beschränkter Haftung\nBraunschweig\n\nDas Registergericht beabsichtigt, die Geschäftsführerin Frau Rotmann von Amts wegen nach § 395 FamFG zu löschen. Die Frist zur Erhebung eines Widerspruchs ist auf 1 Monat ab dieser Registerbekanntmachung festgesetzt."
    },
    {
      "date": "2025-06-20",
      "id": "112885",
      "original_text": "Registerbekanntmachung nach dem Umwandlungsgesetz\nNiedersachsen Amtsgericht Walsrode HRB 202124\nPharmamedico GmbH – Twistringen",
      "type": "Registerbekanntmachung nach dem Umwandlungsgesetz",
      "state": "Niedersachsen",
      "amtsgericht": "Amtsgericht Walsrode",
      "registernummer": "HRB 202124",
      "registerart": "HRB",
      "company_name": "Pharmamedico GmbH",
      "company_seat": "Twistringen",
      "details": "20.06.2025 (Bekanntmachungsdatum)\n\nNiedersachsen Amtsgericht Walsrode HRB 202124\nRegisterbekanntmachung nach dem Umwandlungsgesetz 20.06.2025 (Eintragungsdatum)\n\nPharmamedico GmbH\nGesellschaft mit beschränkter Haftung\nTwistringen\n\nDen Gläubigern der an der Verschmelzung beteiligten Rechtsträger ist, wenn sie binnen sechs Monaten nach dem Tag, an dem die Eintragung der Verschmelzung in das Register des Sitzes desjenigen Rechtsträgers, dessen Gläubiger sie sind, nach § 19  Abs.  3 UmwG als bekannt gemacht gilt, ihren Anspruch nach Grund und Höhe schriftlich anmelden, Sicherheit zu leisten, soweit sie nicht Befriedigung verlangen können. Dieses Recht steht den Gläubigern jedoch nur zu, wenn sie glaubhaft machen, dass durch die Verschmelzung die Erfüllung der Forderung gefährdet wird."
    },
    {
      "date": "2025-06-20",
      "id": "112886",
      "original_text": "Löschungsankündigung\nNiedersachsen Amtsgericht Lüneburg HRB 110124 früher Amtsgericht Winsen\nReklov Werbung GmbH – Winsen/Luhe",
      "type": "Löschungsankündigung",
      "state": "Niedersachsen",
      "amtsgericht": "Amtsgericht Lüneburg",
      "registernummer": "HRB 110124",
      "registerart": "HRB",
      "company_name": "Reklov Werbung GmbH",
      "company_seat": "Winsen/Luhe",
      "former_amtsgericht": "Winsen",
      "details": "20.06.2025 (Bekanntmachungsdatum)\n\nNiedersachsen Amtsgericht Lüneburg HRB 110124 früher Amtsgericht Winsen\nLöschungsankündigung\n\nReklov Werbung GmbH\nGesellschaft mit beschränkter Haftung\nWinsen/Luhe\n\nDas Registergericht beabsichtigt, die Gesellschaft von Amts wegen nach § 394 FamFG zu löschen. Die Frist zur Erhebung eines Widerspruchs ist auf 1 Monat ab dieser Registerbekanntmachung festgesetzt."
    },
    {
      "date": "2025-06-20",
      "id": "112887",
      "original_text": "Löschungsankündigung\nNiedersachsen Amtsgericht Braunschweig HRB 207256\nImmoservice-Nord GmbH – Braunschweig",
      "type": "Löschungsankündigung",
      "state": "Niedersachsen",
      "amtsgericht": "Amtsgericht Braunschweig",
      "registernummer": "HRB 207256",
      "registerart": "HRB",
      "company_name": "Immoservice-Nord GmbH",
      "company_seat": "Braunschweig",
      "details": "20.06.2025 (Bekanntmachungsdatum)\n\nNiedersachsen Amtsgericht Braunschweig HRB 207256\nLöschungsankündigung 20.06.2025 (Eintragungsdatum)\n\nImmoservice-Nord GmbH\nGesellschaft mit beschränkter Haftung\nBraunschweig\n\nDas Registergericht beabsichtigt, die Gesellschaft von Amts wegen nach § 394 FamFG zu löschen. Die Frist zur Erhebung eines Widerspruchs ist auf 1 Monat ab dieser Registerbekanntmachung festgesetzt."
    },
    {
      "date": "2025-06-20",
      "id": "112888",
      "original_text": "Registerbekanntmachung nach dem Umwandlungsgesetz\nNiedersachsen Amtsgericht Osnabrück HRA 209295\n2CONCEPTS e.K. – Fürstenau",
      "type": "Registerbekanntmachung nach dem Umwandlungsgesetz",
      "state": "Niedersachsen",
      "amtsgericht": "Amtsgericht Osnabrück",
      "registernummer": "HRA 209295",
      "registerart": "HRA",
      "company_name": "2CONCEPTS e.K.",
      "company_seat": "Fürstenau",
      "details": "20.06.2025 (Bekanntmachungsdatum)\n\nNiedersachsen Amtsgericht Osnabrück HRA 209295\nRegisterbekanntmachung nach dem Umwandlungsgesetz 20.06.2025 (Eintragungsdatum)\n\n2CONCEPTS e.K.\nEinzelkaufmann / Einzelkauffrau\nFürstenau\n\nDen Gläubigern der an der Ausgliederung beteiligten Rechtsträger ist, wenn sie binnen sechs Monaten nach dem Tag, an dem die Eintragung der Ausgliederung in das Register des Sitzes desjenigen Rechtsträgers, dessen Gläubiger sie sind, nach § 19 Abs. 3 UmwG als bekannt gemacht gilt, ihren Anspruch nach Grund und Höhe schriftlich anmelden, Sicherheit zu leisten, soweit sie nicht Befriedigung verlangen können. Dieses Recht steht den Gläubigern jedoch nur zu, wenn sie glaubhaft machen, dass durch die Ausgliederung die Erfüllung der Forderung gefährdet wird."
    },
    {
      "date": "2025-06-20",
      "id": "112889",
      "original_text": "Löschungsankündigung\nNiedersachsen Amtsgericht Osnabrück HRB 210059\nYEMS UG (haftungsbeschränkt) – Beesten",
      "type": "Löschungsankündigung",
      "state": "Niedersachsen",
      "amtsgericht": "Amtsgericht Osnabrück",
      "registernummer": "HRB 210059",
      "registerart": "HRB",
      "company_name": "YEMS UG (haftungsbeschränkt)",
      "company_seat": "Beesten",
      "details": "20.06.2025 (Bekanntmachungsdatum)\n\nNiedersachsen Amtsgericht Osnabrück HRB 210059\nLöschungsankündigung\n\nYEMS UG (haftungsbeschränkt)\nGesellschaft mit beschränkter Haftung\nBeesten\n\nDas Registergericht beabsichtigt, die Gesellschaft von Amts wegen nach § 394 FamFG wegen Vermögenslosigkeit zu löschen. Die Frist zur Erhebung eines Widerspruchs ist auf 1 Monat ab dieser Registerbekanntmachung festgesetzt."
    },
    {
      "date": "2025-06-20",
      "id": "112890",
      "original_text": "Registerbekanntmachung nach dem Umwandlungsgesetz\nNiedersachsen Amtsgericht Walsrode HRB 110003\nSchmees GmbH – Twistringen",
      "type": "Registerbekanntmachung nach dem Umwandlungsgesetz",
      "state": "Niedersachsen",
      "amtsgericht": "Amtsgericht Walsrode",
      "registernummer": "HRB 110003",
      "registerart": "HRB",
      "company_name": "Schmees GmbH",
      "company_seat": "Twistringen",
      "details": "20.06.2025 (Bekanntmachungsdatum)\n\nNiedersachsen Amtsgericht Walsrode HRB 110003\nRegisterbekanntmachung nach dem Umwandlungsgesetz 20.06.2025 (Eintragungsdatum)\n\nSchmees GmbH\nGesellschaft mit beschränkter Haftung\nTwistringen\n\nDen Gläubigern der an der Verschmelzung beteiligten Rechtsträger ist, wenn sie binnen sechs Monaten nach dem Tag, an dem die Eintragung der Verschmelzung in das Register des Sitzes desjenigen Rechtsträgers, dessen Gläubiger sie sind, nach § 19  Abs.  3 UmwG als bekannt gemacht gilt, ihren Anspruch nach Grund und Höhe schriftlich anmelden, Sicherheit zu leisten, soweit sie nicht Befriedigung verlangen können. Dieses Recht steht den Gläubigern jedoch nur zu, wenn sie glaubhaft machen, dass durch die Verschmelzung die Erfüllung der Forderung gefährdet wird."
    },
    {
      "date": "2025-06-20",
      "id": "112891",
      "original_text": "Registerbekanntmachung nach dem Umwandlungsgesetz\nRheinland-Pfalz Amtsgericht Mainz HRB 50286\nPlattform hoch 2 GmbH – Mainz",
      "type": "Registerbekanntmachung nach dem Umwandlungsgesetz",
      "state": "Rheinland-Pfalz",
      "amtsgericht": "Amtsgericht Mainz",
      "registernummer": "HRB 50286",
      "registerart": "HRB",
      "company_name": "Plattform hoch 2 GmbH",
      "company_seat": "Mainz",
      "details": "20.06.2025 (Bekanntmachungsdatum)\n\nRheinland-Pfalz Amtsgericht Mainz HRB 50286\nRegisterbekanntmachung nach dem Umwandlungsgesetz 20.06.2025 (Eintragungsdatum)\n\nPlattform hoch 2 GmbH\nGesellschaft mit beschränkter Haftung\nMainz\n\nAls nicht eingetragen wird veröffentlicht: Den Gläubigern der an der Verschmelzung beteiligten Rechtsträger ist, wenn sie binnen sechs Monaten nach dem Tag, an dem die Eintragung der Verschmelzung in das Register des Sitzes desjenigen Rechtsträgers, dessen Gläubiger sie sind, nach § 19 Abs. 3 UmwG als bekannt gemacht gilt, ihren Anspruch nach Grund und Höhe schriftlich anmelden, Sicherheit zu leisten, soweit sie nicht Befriedigung verlangen können. Dieses Recht steht den Gläubigern jedoch nur zu, wenn sie glaubhaft machen, dass durch die Verschmelzung die Erfüllung der Forderung gefährdet wird."
    },
    {
      "date": "2025-06-20",
      "id": "112892",
      "original_text": "Registerbekanntmachung nach dem Umwandlungsgesetz\nRheinland-Pfalz Amtsgericht Mainz HRB 49396\nEMC hoch 2 Evolve Management Consult GmbH – Mainz",
      "type": "Registerbekanntmachung nach dem Umwandlungsgesetz",
      "state": "Rheinland-Pfalz",
      "amtsgericht": "Amtsgericht Mainz",
      "registernummer": "HRB 49396",
      "registerart": "HRB",
      "company_name": "EMC hoch 2 Evolve Management Consult GmbH",
      "company_seat": "Mainz",
      "details": "20.06.2025 (Bekanntmachungsdatum)\n\nRheinland-Pfalz Amtsgericht Mainz HRB 49396\nRegisterbekanntmachung nach dem Umwandlungsgesetz 20.06.2025 (Eintragungsdatum)\n\nEMC hoch 2 Evolve Management Consult GmbH\nGesellschaft mit beschränkter Haftung\nMainz\n\nAls nicht eingetragen wird veröffentlicht: Den Gläubigern der an der Verschmelzung beteiligten Rechtsträger ist, wenn sie binnen sechs Monaten nach dem Tag, an dem die Eintragung der Verschmelzung in das Register des Sitzes desjenigen Rechtsträgers, dessen Gläubiger sie sind, nach § 19 Abs. 3 UmwG als bekannt gemacht gilt, ihren Anspruch nach Grund und Höhe schriftlich anmelden, Sicherheit zu leisten, soweit sie nicht Befriedigung verlangen können. Dieses Recht steht den Gläubigern jedoch nur zu, wenn sie glaubhaft machen, dass durch die Verschmelzung die Erfüllung der Forderung gefährdet wird."
    },
    {
      "date": "2025-06-20",
      "id": "112893",
      "original_text": "Registerbekanntmachung nach dem Umwandlungsgesetz\nNordrhein-Westfalen Amtsgericht Bochum HRB 4266\nHRA Ingenieurgesellschaft mbH – Bochum",
      "type": "Registerbekanntmachung nach dem Umwandlungsgesetz",
      "state": "Nordrhein-Westfalen",
      "amtsgericht": "Amtsgericht Bochum",
      "registernummer": "HRB 4266",
      "registerart": "HRB",
      "company_name": "HRA Ingenieurgesellschaft mbH",
      "company_seat": "Bochum",
      "details": "20.06.2025 (Bekanntmachungsdatum)\n\nNordrhein-Westfalen Amtsgericht Bochum HRB 4266\nRegisterbekanntmachung nach dem Umwandlungsgesetz 18.06.2025 (Eintragungsdatum)\n\nHRA Ingenieurgesellschaft mbH\nGesellschaft mit beschränkter Haftung\nBochum\n\nDen Gläubigern der an der Verschmelzung beteiligten Rechtsträger ist, wenn sie binnen sechs Monaten nach dem Tag, an dem die Eintragung der Verschmelzung in das Register des Sitzes derjenigen Rechtsträger deren Gläubiger sie sind, nach § 19 Absatz 3 UmwG als bekanntgemacht gilt, ihren Anspruch nach Grund und Höhe schriftlich anmelden, Sicherheit zu leisten, soweit sie nicht Befriedigung verlangen können. Dieses Recht steht den Gläubigern jedoch nur zu, wenn sie glaubhaft machen, dass durch die Verschmelzung die Erfüllung ihrer Forderung gefährdet wird."
    },
    {
      "date": "2025-06-20",
      "id": "112894",
      "original_text": "Löschungsankündigung\nNordrhein-Westfalen Amtsgericht Krefeld HRB 17723\nVolker Reinshagen UG (haftungsbeschränkt) – Krefeld",
      "type": "Löschungsankündigung",
      "state": "Nordrhein-Westfalen",
      "amtsgericht": "Amtsgericht Krefeld",
      "registernummer": "HRB 17723",
      "registerart": "HRB",
      "company_name": "Volker Reinshagen UG (haftungsbeschränkt)",
      "company_seat": "Krefeld",
      "details": "20.06.2025 (Bekanntmachungsdatum)\n\nNordrhein-Westfalen Amtsgericht Krefeld HRB 17723\nLöschungsankündigung\n\nVolker Reinshagen UG (haftungsbeschränkt)\nGesellschaft mit beschränkter Haftung\nKrefeld\n\nDas Registergericht beabsichtigt die Gesellschaft von Amts wegen nach § 394 FamFG zu löschen. Die Frist zur Erhebung eines Widerspruchs ist auf einen Monat festgesetzt."
    },
    {
      "date": "2025-06-20",
      "id": "112895",
      "original_text": "Löschungsankündigung\nNordrhein-Westfalen Amtsgericht Bad Oeynhausen HRA 4830\nPeter Schwan GmbH & Co. – Bünde",
      "type": "Löschungsankündigung",
      "state": "Nordrhein-Westfalen",
      "amtsgericht": "Amtsgericht Bad Oeynhausen",
      "registernummer": "HRA 4830",
      "registerart": "HRA",
      "company_name": "Peter Schwan GmbH & Co.",
      "company_seat": "Bünde",
      "details": "20.06.2025 (Bekanntmachungsdatum)\n\nNordrhein-Westfalen Amtsgericht Bad Oeynhausen HRA 4830\nLöschungsankündigung\n\nPeter Schwan GmbH & Co.\nKommanditgesellschaft\nBünde\n\nDas Registergericht beabsichtigt die Firma von Amts wegen nach § 394 FamFG zu löschen. Die Frist zur Erhebung eines Widerspruchs ist auf einen Monat festgesetzt."
    },
    {
      "date": "2025-06-20",
      "id": "112896",
      "original_text": "Löschungsankündigung\nNordrhein-Westfalen Amtsgericht Düsseldorf HRB 90275\nKAM Auto Rent GmbH – Ratingen",
      "type": "Löschungsankündigung",
      "state": "Nordrhein-Westfalen",
      "amtsgericht": "Amtsgericht Düsseldorf",
      "registernummer": "HRB 90275",
      "registerart": "HRB",
      "company_name": "KAM Auto Rent GmbH",
      "company_seat": "Ratingen",
      "details": "20.06.2025 (Bekanntmachungsdatum)\n\nNordrhein-Westfalen Amtsgericht Düsseldorf HRB 90275\nLöschungsankündigung\n\nKAM Auto Rent GmbH\nGesellschaft mit beschränkter Haftung\nRatingen\n\nDas Registergericht beabsichtigt die Gesellschaft von Amts wegen nach § 394 FamFG zu löschen. Die Frist zur Erhebung eines Widerspruchs ist auf 3 Wochen festgesetzt.\n\nRechtsbehelfsbelehrung:\nDas Widerspruchsrecht steht jedem zu, der an der Unterlassung der Löschung ein berechtigtes Interesse hat. Der Widerspruch ist bei dem Amtsgericht Düsseldorf -Registergericht-, Werdener Straße 1, 40227 Düsseldorf schriftlich in deutscher Sprache oder zur Niederschrift der Geschäftsstelle einzulegen. Der Widerspruch kann auch zur Niederschrift der Geschäftsstelle eines jeden Amtsgerichtes abgegeben werden. Die Einlegung ist auch durch Übertragung eines elektronischen Dokuments an die elektronische Poststelle des Gerichts möglich. Das elektronische Dokument muss für die Bearbeitung durch das Gericht geeignet und mit einer qualifizierten elektronischen Signatur der verantwortenden Person versehen sein oder von der verantwortenden Person signiert und auf einem sicheren Übermittlungsweg gemäß § 130a ZPO nach näherer Maßgabe der Verordnung über die technischen Rahmenbedingungen des elektronischen Rechtsverkehrs und über das besondere elektronische Behördenpostfach (BGBl. I, S.3803) eingereicht werden. Weitere Informationen erhalten Sie auf der Internetseite www.justiz.de.\nDer Widerspruch muss spätestens innerhalb der gesetzten Frist nach dem Datum der Bekanntmachung der Löschungsankündigung bei dem Amtsgericht - Registergericht - Düsseldorf eingegangen sein.  Dies gilt auch dann, wenn der Widerspruch zur Niederschrift der Geschäftsstelle eines anderen Amtsgerichtes abgegeben wurde. Die Frist beginnt mit dem Tage der Bekanntmachung der Löschungsankündigung in dem für die Bekanntmachung der Eintragungen in das Handelsregister bestimmten elektronischen Informations- und Kommunikationssystem nach § 10 des Handelsgesetzbuches. Fällt das Ende der Frist auf einen Sonntag, einen allgemeinen Feiertag oder Sonnabend, so endet die Frist mit Ablauf des nächsten Werktages.\nDer Widerspruch muss die Bezeichnung der angefochtenen Löschungsankündigung sowie die Erklärung enthalten, dass Widerspruch gegen diese Löschungsankündigung eingelegt wird. Er ist zu unterzeichnen und soll begründet werden."
    },
    {
      "date": "2025-06-20",
      "id": "112897",
      "original_text": "Registerbekanntmachung nach dem Umwandlungsgesetz\nNordrhein-Westfalen Amtsgericht Köln HRB 107285\nD. Lindner Lichttechnische Großhandlung GmbH, Lampen - Leuchten - Strahler – Köln",
      "type": "Registerbekanntmachung nach dem Umwandlungsgesetz",
      "state": "Nordrhein-Westfalen",
      "amtsgericht": "Amtsgericht Köln",
      "registernummer": "HRB 107285",
      "registerart": "HRB",
      "company_name": "D. Lindner Lichttechnische Großhandlung GmbH, Lampen - Leuchten - Strahler",
      "company_seat": "Köln",
      "details": "20.06.2025 (Bekanntmachungsdatum)\n\nNordrhein-Westfalen Amtsgericht Köln HRB 107285\nRegisterbekanntmachung nach dem Umwandlungsgesetz 20.06.2025 (Eintragungsdatum)\n\nD. Lindner Lichttechnische Großhandlung GmbH, Lampen - Leuchten - Strahler\nGesellschaft mit beschränkter Haftung\nKöln\n\nDen Gläubigern der an der Verschmelzung beteiligten Rechtsträger ist, wenn sie binnen sechs Monaten nach dem Tag, an dem die Eintragung der Verschmelzung in das Register des Sitzes desjenigen Rechtsträgers, dessen Gläubiger sie sind, nach § 19 Absatz 3 UmwG als bekanntgemacht gilt, ihren Anspruch nach Grund und Höhe schriftlich anmelden, Sicherheit zu leisten, soweit sie nicht Befriedigung verlangen können. Dieses Recht steht den Gläubigern jedoch nur zu, wenn sie glaubhaft machen, dass durch die Verschmelzung die Erfüllung ihrer Forderung gefährdet wird."
    },
    {
      "date": "2025-06-20",
      "id": "112898",
      "original_text": "Löschungsankündigung\nNordrhein-Westfalen Amtsgericht Wuppertal HRB 18525\nHansa Immobilien GmbH – Velbert",
      "type": "Löschungsankündigung",
      "state": "Nordrhein-Westfalen",
      "amtsgericht": "Amtsgericht Wuppertal",
      "registernummer": "HRB 18525",
      "registerart": "HRB",
      "company_name": "Hansa Immobilien GmbH",
      "company_seat": "Velbert",
      "details": "20.06.2025 (Bekanntmachungsdatum)\n\nNordrhein-Westfalen Amtsgericht Wuppertal HRB 18525\nLöschungsankündigung\n\nHansa Immobilien GmbH\nGesellschaft mit beschränkter Haftung\nVelbert\n\nDas Registergericht beabsichtigt die Gesellschaft von Amts wegen nach § 394 FamFG zu löschen. Die Frist zur Erhebung eines Widerspruchs ist auf einen Monat festgesetzt."
    },
    {
      "date": "2025-06-20",
      "id": "112899",
      "original_text": "Löschungsankündigung\nNordrhein-Westfalen Amtsgericht Dortmund HRB 13443\nKörber Verwaltungs GmbH – Dortmund",
      "type": "Löschungsankündigung",
      "state": "Nordrhein-Westfalen",
      "amtsgericht": "Amtsgericht Dortmund",
      "registernummer": "HRB 13443",
      "registerart": "HRB",
      "company_name": "Körber Verwaltungs GmbH",
      "company_seat": "Dortmund",
      "details": "20.06.2025 (Bekanntmachungsdatum)\n\nNordrhein-Westfalen Amtsgericht Dortmund HRB 13443\nLöschungsankündigung\n\nKörber Verwaltungs GmbH\nGesellschaft mit beschränkter Haftung\nDortmund\n\nDas Registergericht beabsichtigt die Gesellschaft von Amts wegen nach § 394 FamFG zu löschen. Die Frist zur Erhebung eines Widerspruchs ist auf zwei Monate festgesetzt."
    },
    {
      "date": "2025-06-20",
      "id": "112900",
      "original_text": "Registerbekanntmachung nach dem Umwandlungsgesetz\nNordrhein-Westfalen Amtsgericht Hagen HRB 13309\nAMAKURA IT GmbH – Gevelsberg",
      "type": "Registerbekanntmachung nach dem Umwandlungsgesetz",
      "state": "Nordrhein-Westfalen",
      "amtsgericht": "Amtsgericht Hagen",
      "registernummer": "HRB 13309",
      "registerart": "HRB",
      "company_name": "AMAKURA IT GmbH",
      "company_seat": "Gevelsberg",
      "details": "20.06.2025 (Bekanntmachungsdatum)\n\nNordrhein-Westfalen Amtsgericht Hagen HRB 13309\nRegisterbekanntmachung nach dem Umwandlungsgesetz 18.06.2025 (Eintragungsdatum)\n\nAMAKURA IT GmbH\nGesellschaft mit beschränkter Haftung\nGevelsberg\n\nDie Gesellschaft hat Gläubigern, deren Forderungen vor dieser Bekanntmachung begründet worden sind, Sicherheit zu leisten, soweit sie nicht Befriedigung verlangen können, wenn sie sich binnen sechs Monaten zu diesem Zweck melden.Den Gläubigern der an der Verschmelzung beteiligten Rechtsträger ist, wenn sie binnen sechs Monaten nach dem Tag, an dem die Eintragung der Verschmelzung in das Register des Sitzes desjenigen Rechtsträgers, dessen Gläubiger sie sind, nach § 19 Absatz 3 UmwG als bekanntgemacht gilt, ihren Anspruch nach Grund und Höhe schriftlich anmelden, Sicherheit zu leisten, soweit sie nicht Befriedigung verlangen können. Dieses Recht steht den Gläubigern jedoch nur zu, wenn sie glaubhaft machen, dass durch die Verschmelzung die Erfüllung ihrer Forderung gefährdet wird."
    },
    {
      "date": "2025-06-20",
      "id": "112901",
      "original_text": "Registerbekanntmachung nach dem Umwandlungsgesetz\nNordrhein-Westfalen Amtsgericht Köln HRB 85306\nQuiply Technologies GmbH – Köln",
      "type": "Registerbekanntmachung nach dem Umwandlungsgesetz",
      "state": "Nordrhein-Westfalen",
      "amtsgericht": "Amtsgericht Köln",
      "registernummer": "HRB 85306",
      "registerart": "HRB",
      "company_name": "Quiply Technologies GmbH",
      "company_seat": "Köln",
      "details": "20.06.2025 (Bekanntmachungsdatum)\n\nNordrhein-Westfalen Amtsgericht Köln HRB 85306\nRegisterbekanntmachung nach dem Umwandlungsgesetz 20.06.2025 (Eintragungsdatum)\n\nQuiply Technologies GmbH\nGesellschaft mit beschränkter Haftung\nKöln\n\nDen Gläubigern der an der Verschmelzung beteiligten Rechtsträger ist, wenn sie binnen sechs Monaten nach dem Tag, an dem die Eintragung der Verschmelzung in das Register des Sitzes desjenigen Rechtsträgers, dessen Gläubiger sie sind, nach § 19 Absatz 3 UmwG als bekanntgemacht gilt, ihren Anspruch nach Grund und Höhe schriftlich anmelden, Sicherheit zu leisten, soweit sie nicht Befriedigung verlangen können. Dieses Recht steht den Gläubigern jedoch nur zu, wenn sie glaubhaft machen, dass durch die Verschmelzung die Erfüllung ihrer Forderung gefährdet wird."
    },
    {
      "date": "2025-06-20",
      "id": "112902",
      "original_text": "Registerbekanntmachung nach dem Umwandlungsgesetz\nNordrhein-Westfalen Amtsgericht Bad Oeynhausen HRA 7580\nFranke Mobilfunk GmbH & Co. KG – Löhne",
      "type": "Registerbekanntmachung nach dem Umwandlungsgesetz",
      "state": "Nordrhein-Westfalen",
      "amtsgericht": "Amtsgericht Bad Oeynhausen",
      "registernummer": "HRA 7580",
      "registerart": "HRA",
      "company_name": "Franke Mobilfunk GmbH & Co. KG",
      "company_seat": "Löhne",
      "details": "20.06.2025 (Bekanntmachungsdatum)\n\nNordrhein-Westfalen Amtsgericht Bad Oeynhausen HRA 7580\nRegisterbekanntmachung nach dem Umwandlungsgesetz 20.06.2025 (Eintragungsdatum)\n\nFranke Mobilfunk GmbH & Co. KG\nKommanditgesellschaft\nLöhne\n\nDen Gläubigern der an der Verschmelzung beteiligten Rechtsträger ist, wenn sie binnen sechs Monaten nach dem Tag, an dem die Eintragung der Verschmelzung in das Register des Sitzes desjenigen Rechtsträgers, dessen Gläubiger sie sind, nach § 19 Absatz 3 UmwG als bekanntgemacht gilt, ihren Anspruch nach Grund und Höhe schriftlich anmelden, Sicherheit zu leisten, soweit sie nicht Befriedigung verlangen können. Dieses Recht steht den Gläubigern jedoch nur zu, wenn sie glaubhaft machen, dass durch die Verschmelzung die Erfüllung ihrer Forderung gefährdet wird."
    },
    {
      "date": "2025-06-20",
      "id": "112903",
      "original_text": "Löschungsankündigung\nNordrhein-Westfalen Amtsgericht Bonn HRB 25177\nMfc Steakhome UG (haftungsbeschränkt) – Rheinbach",
      "type": "Löschungsankündigung",
      "state": "Nordrhein-Westfalen",
      "amtsgericht": "Amtsgericht Bonn",
      "registernummer": "HRB 25177",
      "registerart": "HRB",
      "company_name": "Mfc Steakhome UG (haftungsbeschränkt)",
      "company_seat": "Rheinbach",
      "details": "20.06.2025 (Bekanntmachungsdatum)\n\nNordrhein-Westfalen Amtsgericht Bonn HRB 25177\nLöschungsankündigung\n\nMfc Steakhome UG (haftungsbeschränkt)\nGesellschaft mit beschränkter Haftung\nRheinbach\n\nDas Registergericht beabsichtigt die Gesellschaft von Amts wegen nach § 394 FamFG zu löschen. Die Frist zur Erhebung eines Widerspruchs ist auf einen Monat festgesetzt."
    },
    {
      "date": "2025-06-20",
      "id": "112904",
      "original_text": "Löschungsankündigung\nNordrhein-Westfalen Amtsgericht Bad Oeynhausen HRA 6131\nTrendfashion Viktoria Handel GmbH & Co. KG – Lübbecke",
      "type": "Löschungsankündigung",
      "state": "Nordrhein-Westfalen",
      "amtsgericht": "Amtsgericht Bad Oeynhausen",
      "registernummer": "HRA 6131",
      "registerart": "HRA",
      "company_name": "Trendfashion Viktoria Handel GmbH & Co. KG",
      "company_seat": "Lübbecke",
      "details": "20.06.2025 (Bekanntmachungsdatum)\n\nNordrhein-Westfalen Amtsgericht Bad Oeynhausen HRA 6131\nLöschungsankündigung\n\nTrendfashion Viktoria Handel GmbH & Co. KG\nKommanditgesellschaft\nLübbecke\n\nDas Registergericht beabsichtigt die Firma von Amts wegen nach § 394 FamFG zu löschen. Die Frist zur Erhebung eines Widerspruchs ist auf einen Monat festgesetzt."
    },
    {
      "date": "2025-06-20",
      "id": "112905",
      "original_text": "Löschungsankündigung\nNordrhein-Westfalen Amtsgericht Bochum HRB 16534\nMein Fussgesundheitszentrum GmbH – Witten",
      "type": "Löschungsankündigung",
      "state": "Nordrhein-Westfalen",
      "amtsgericht": "Amtsgericht Bochum",
      "registernummer": "HRB 16534",
      "registerart": "HRB",
      "company_name": "Mein Fussgesundheitszentrum GmbH",
      "company_seat": "Witten",
      "details": "20.06.2025 (Bekanntmachungsdatum)\n\nNordrhein-Westfalen Amtsgericht Bochum HRB 16534\nLöschungsankündigung 23.06.2025 (Eintragungsdatum)\n\nMein Fussgesundheitszentrum GmbH\nGesellschaft mit beschränkter Haftung\nWitten\n\nDas Registergericht beabsichtigt die Gesellschaft von Amts wegen nach § 394 FamFG zu löschen. Die Frist zur Erhebung eines Widerspruchs ist auf drei Monate festgesetzt."
    },
    {
      "date": "2025-06-20",
      "id": "112906",
      "original_text": "Registerbekanntmachung nach dem Umwandlungsgesetz\nNordrhein-Westfalen Amtsgericht Köln HRB 104507\nITAB Lighting Germany GmbH – Köln",
      "type": "Registerbekanntmachung nach dem Umwandlungsgesetz",
      "state": "Nordrhein-Westfalen",
      "amtsgericht": "Amtsgericht Köln",
      "registernummer": "HRB 104507",
      "registerart": "HRB",
      "company_name": "ITAB Lighting Germany GmbH",
      "company_seat": "Köln",
      "details": "20.06.2025 (Bekanntmachungsdatum)\n\nNordrhein-Westfalen Amtsgericht Köln HRB 104507\nRegisterbekanntmachung nach dem Umwandlungsgesetz 20.06.2025 (Eintragungsdatum)\n\nITAB Lighting Germany GmbH\nGesellschaft mit beschränkter Haftung\nKöln\n\nDen Gläubigern der an der Verschmelzung beteiligten Rechtsträger ist, wenn sie binnen sechs Monaten nach dem Tag, an dem die Eintragung der Verschmelzung in das Register des Sitzes desjenigen Rechtsträgers, dessen Gläubiger sie sind, nach § 19 Absatz 3 UmwG als bekanntgemacht gilt, ihren Anspruch nach Grund und Höhe schriftlich anmelden, Sicherheit zu leisten, soweit sie nicht Befriedigung verlangen können. Dieses Recht steht den Gläubigern jedoch nur zu, wenn sie glaubhaft machen, dass durch die Verschmelzung die Erfüllung ihrer Forderung gefährdet wird."
    },
    {
      "date": "2025-06-20",
      "id": "112907",
      "original_text": "Sonstige Registerbekanntmachung\nNordrhein-Westfalen Amtsgericht Lemgo HRB 7119\nFINNOVA MAKLERPOOL Aktiengesellschaft – Lemgo",
      "type": "Sonstige Registerbekanntmachung",
      "state": "Nordrhein-Westfalen",
      "amtsgericht": "Amtsgericht Lemgo",
      "registernummer": "HRB 7119",
      "registerart": "HRB",
      "company_name": "FINNOVA MAKLERPOOL Aktiengesellschaft",
      "company_seat": "Lemgo",
      "details": "20.06.2025 (Bekanntmachungsdatum)\n\nNordrhein-Westfalen Amtsgericht Lemgo HRB 7119\nSonstige Registerbekanntmachung 18.06.2025 (Eintragungsdatum)\n\nFINNOVA MAKLERPOOL Aktiengesellschaft\nAktiengesellschaft\nLemgo\n\nDem Registergericht ist eine Liste der Mitglieder des Aufsichtsrates eingereicht worden."
    },
    {
      "date": "2025-06-20",
      "id": "112908",
      "original_text": "Registerbekanntmachung nach dem Umwandlungsgesetz\nNordrhein-Westfalen Amtsgericht Düsseldorf HRB 108075\nKK Software GmbH – Düsseldorf",
      "type": "Registerbekanntmachung nach dem Umwandlungsgesetz",
      "state": "Nordrhein-Westfalen",
      "amtsgericht": "Amtsgericht Düsseldorf",
      "registernummer": "HRB 108075",
      "registerart": "HRB",
      "company_name": "KK Software GmbH",
      "company_seat": "Düsseldorf",
      "details": "20.06.2025 (Bekanntmachungsdatum)\n\nNordrhein-Westfalen Amtsgericht Düsseldorf HRB 108075\nRegisterbekanntmachung nach dem Umwandlungsgesetz 20.06.2025 (Eintragungsdatum)\n\nKK Software GmbH\nGesellschaft mit beschränkter Haftung\nDüsseldorf\n\nDen Gläubigern der an der Verschmelzung beteiligten Rechtsträger ist, wenn sie binnen sechs Monaten nach dem Tag, an dem die Eintragung der Verschmelzung in das Register des Sitzes desjenigen Rechtsträgers, dessen Gläubiger sie sind, nach § 19 Absatz 3 UmwG als bekanntgemacht gilt, ihren Anspruch nach Grund und Höhe schriftlich anmelden, Sicherheit zu leisten, soweit sie nicht Befriedigung verlangen können. Dieses Recht steht den Gläubigern jedoch nur zu, wenn sie glaubhaft machen, dass durch die Verschmelzung die Erfüllung ihrer Forderung gefährdet wird."
    },
    {
      "date": "2025-06-20",
      "id": "112909",
      "original_text": "Löschungsankündigung\nNordrhein-Westfalen Amtsgericht Krefeld HRB 16972\nSonased Handel & Vertriebs GmbH – Krefeld",
      "type": "Löschungsankündigung",
      "state": "Nordrhein-Westfalen",
      "amtsgericht": "Amtsgericht Krefeld",
      "registernummer": "HRB 16972",
      "registerart": "HRB",
      "company_name": "Sonased Handel & Vertriebs GmbH",
      "company_seat": "Krefeld",
      "details": "20.06.2025 (Bekanntmachungsdatum)\n\nNordrhein-Westfalen Amtsgericht Krefeld HRB 16972\nLöschungsankündigung\n\nSonased Handel & Vertriebs GmbH\nGesellschaft mit beschränkter Haftung\nKrefeld\n\nDas Registergericht beabsichtigt die Gesellschaft von Amts wegen nach § 394 FamFG zu löschen. Die Frist zur Erhebung eines Widerspruchs ist auf einen Monat festgesetzt."
    },
    {
      "date": "2025-06-20",
      "id": "112910",
      "original_text": "Löschungsankündigung\nNordrhein-Westfalen Amtsgericht Wuppertal HRB 28453\nPintjet GmbH – Wuppertal",
      "type": "Löschungsankündigung",
      "state": "Nordrhein-Westfalen",
      "amtsgericht": "Amtsgericht Wuppertal",
      "registernummer": "HRB 28453",
      "registerart": "HRB",
      "company_name": "Pintjet GmbH",
      "company_seat": "Wuppertal",
      "details": "20.06.2025 (Bekanntmachungsdatum)\n\nNordrhein-Westfalen Amtsgericht Wuppertal HRB 28453\nLöschungsankündigung\n\nPintjet GmbH\nGesellschaft mit beschränkter Haftung\nWuppertal\n\nDas Registergericht beabsichtigt die Gesellschaft von Amts wegen nach § 394 FamFG zu löschen. Die Frist zur Erhebung eines Widerspruchs ist auf einen Monat festgesetzt."
    },
    {
      "date": "2025-06-20",
      "id": "112911",
      "original_text": "Sonstige Registerbekanntmachung\nNordrhein-Westfalen Amtsgericht Gelsenkirchen HRB 10869\nkibtex GmbH – Dorsten",
      "type": "Sonstige Registerbekanntmachung",
      "state": "Nordrhein-Westfalen",
      "amtsgericht": "Amtsgericht Gelsenkirchen",
      "registernummer": "HRB 10869",
      "registerart": "HRB",
      "company_name": "kibtex GmbH",
      "company_seat": "Dorsten",
      "details": "20.06.2025 (Bekanntmachungsdatum)\n\nNordrhein-Westfalen Amtsgericht Gelsenkirchen HRB 10869\nSonstige Registerbekanntmachung 20.06.2025 (Eintragungsdatum)\n\nkibtex GmbH\nGesellschaft mit beschränkter Haftung\nDorsten\n\nAls nicht eingetragen wird veröffentlicht: Den Gläubigern der Gesellschaft, deren Forderungen begründet worden sind bevor die Eintragung der Beendigung des Beherrschungs- und Gewinnabführungsvertrages in das Handelsregister nach § 10 des Handelsgesetzbuches als bekanntgemacht gilt, hat der andere Vertragsteil Sicherheit zu leisten, wenn sie sich binnen sechs Monaten nach der Bekanntmachung der Eintragung zu diesem Zweck bei ihm melden."
    },
    {
      "date": "2025-06-20",
      "id": "112912",
      "original_text": "Registerbekanntmachung nach dem Umwandlungsgesetz\nNordrhein-Westfalen Amtsgericht Düsseldorf HRB 107602\nKK Buchhaltung GmbH – Düsseldorf",
      "type": "Registerbekanntmachung nach dem Umwandlungsgesetz",
      "state": "Nordrhein-Westfalen",
      "amtsgericht": "Amtsgericht Düsseldorf",
      "registernummer": "HRB 107602",
      "registerart": "HRB",
      "company_name": "KK Buchhaltung GmbH",
      "company_seat": "Düsseldorf",
      "details": "20.06.2025 (Bekanntmachungsdatum)\n\nNordrhein-Westfalen Amtsgericht Düsseldorf HRB 107602\nRegisterbekanntmachung nach dem Umwandlungsgesetz 20.06.2025 (Eintragungsdatum)\n\nKK Buchhaltung GmbH\nGesellschaft mit beschränkter Haftung\nDüsseldorf\n\nDen Gläubigern der an der Verschmelzung beteiligten Rechtsträger ist, wenn sie binnen sechs Monaten nach dem Tag, an dem die Eintragung der Verschmelzung in das Register des Sitzes desjenigen Rechtsträgers, dessen Gläubiger sie sind, nach § 19 Absatz 3 UmwG als bekanntgemacht gilt, ihren Anspruch nach Grund und Höhe schriftlich anmelden, Sicherheit zu leisten, soweit sie nicht Befriedigung verlangen können. Dieses Recht steht den Gläubigern jedoch nur zu, wenn sie glaubhaft machen, dass durch die Verschmelzung die Erfüllung ihrer Forderung gefährdet wird."
    },
    {
      "date": "2025-06-20",
      "id": "112913",
      "original_text": "Registerbekanntmachung nach dem Umwandlungsgesetz\nNordrhein-Westfalen Amtsgericht Düsseldorf HRB 107798\nKK Marketing GmbH – Düsseldorf",
      "type": "Registerbekanntmachung nach dem Umwandlungsgesetz",
      "state": "Nordrhein-Westfalen",
      "amtsgericht": "Amtsgericht Düsseldorf",
      "registernummer": "HRB 107798",
      "registerart": "HRB",
      "company_name": "KK Marketing GmbH",
      "company_seat": "Düsseldorf",
      "details": "20.06.2025 (Bekanntmachungsdatum)\n\nNordrhein-Westfalen Amtsgericht Düsseldorf HRB 107798\nRegisterbekanntmachung nach dem Umwandlungsgesetz 20.06.2025 (Eintragungsdatum)\n\nKK Marketing GmbH\nGesellschaft mit beschränkter Haftung\nDüsseldorf\n\nDen Gläubigern der an der Verschmelzung beteiligten Rechtsträger ist, wenn sie binnen sechs Monaten nach dem Tag, an dem die Eintragung der Verschmelzung in das Register des Sitzes desjenigen Rechtsträgers, dessen Gläubiger sie sind, nach § 19 Absatz 3 UmwG als bekanntgemacht gilt, ihren Anspruch nach Grund und Höhe schriftlich anmelden, Sicherheit zu leisten, soweit sie nicht Befriedigung verlangen können. Dieses Recht steht den Gläubigern jedoch nur zu, wenn sie glaubhaft machen, dass durch die Verschmelzung die Erfüllung ihrer Forderung gefährdet wird."
    },
    {
      "date": "2025-06-20",
      "id": "112914",
      "original_text": "Löschungsankündigung\nNordrhein-Westfalen Amtsgericht Krefeld HRB 14415\nMOCCAS -Shoes & More- GmbH – Tönisvorst",
      "type": "Löschungsankündigung",
      "state": "Nordrhein-Westfalen",
      "amtsgericht": "Amtsgericht Krefeld",
      "registernummer": "HRB 14415",
      "registerart": "HRB",
      "company_name": "MOCCAS -Shoes & More- GmbH",
      "company_seat": "Tönisvorst",
      "details": "20.06.2025 (Bekanntmachungsdatum)\n\nNordrhein-Westfalen Amtsgericht Krefeld HRB 14415\nLöschungsankündigung\n\nMOCCAS -Shoes & More- GmbH\nGesellschaft mit beschränkter Haftung\nTönisvorst\n\nDas Registergericht beabsichtigt die Gesellschaft von Amts wegen nach § 394 FamFG zu löschen. Die Frist zur Erhebung eines Widerspruchs ist auf einen Monat festgesetzt."
    },
    {
      "date": "2025-06-20",
      "id": "112915",
      "original_text": "Sonstige Registerbekanntmachung\nHessen Amtsgericht Wiesbaden HRB 25738\nYou Logic Aktiengesellschaft – Wiesbaden",
      "type": "Sonstige Registerbekanntmachung",
      "state": "Hessen",
      "amtsgericht": "Amtsgericht Wiesbaden",
      "registernummer": "HRB 25738",
      "registerart": "HRB",
      "company_name": "You Logic Aktiengesellschaft",
      "company_seat": "Wiesbaden",
      "details": "20.06.2025 (Bekanntmachungsdatum)\n\nHessen Amtsgericht Wiesbaden HRB 25738\nSonstige Registerbekanntmachung\n\nYou Logic Aktiengesellschaft\nAktiengesellschaft\nWiesbaden\n\nDurch eine Änderung in den Personen der Aufsichtsratsmitglieder ist eine Liste der Mitglieder des Aufsichtsrates zum Handelsregister eingereicht worden."
    },
    {
      "date": "2025-06-20",
      "id": "112916",
      "original_text": "Registerbekanntmachung nach dem Umwandlungsgesetz\nHessen Amtsgericht Marburg HRB 5317\nMV II Beteiligungs AG – Battenberg",
      "type": "Registerbekanntmachung nach dem Umwandlungsgesetz",
      "state": "Hessen",
      "amtsgericht": "Amtsgericht Marburg",
      "registernummer": "HRB 5317",
      "registerart": "HRB",
      "company_name": "MV II Beteiligungs AG",
      "company_seat": "Battenberg",
      "details": "20.06.2025 (Bekanntmachungsdatum)\n\nHessen Amtsgericht Marburg HRB 5317\nRegisterbekanntmachung nach dem Umwandlungsgesetz 20.06.2025 (Eintragungsdatum)\n\nMV II Beteiligungs AG\nGesellschaft mit beschränkter Haftung\nBattenberg\n\nDen Gläubigern der an der formwechselnden Umwandlung beteiligten Rechtsträger ist, wenn sie binnen sechs Monaten nach dem Tag, an dem die Eintragung der formwechselnden Umwandlung in das Register des Sitzes desjenigen Rechtsträgers, dessen Gläubiger sie sind, nach § 201 UmwG bekannt gemacht worden ist, ihren Anspruch nach Grund und Höhe schriftlich anmelden, Sicherheit zu leisten, soweit sie nicht Befriedigung verlangen können. Dieses Recht steht den Gläubigern jedoch nur zu, wenn sie glaubhaft machen, dass durch die formwechselnden Umwandlung die Erfüllung ihrer Forderung gefährdet wird."
    },
    {
      "date": "2025-06-20",
      "id": "112917",
      "original_text": "Sonstige Registerbekanntmachung\nHessen Amtsgericht Wiesbaden HRB 9110\nP&I Personal & Informatik Aktiengesellschaft – Wiesbaden",
      "type": "Sonstige Registerbekanntmachung",
      "state": "Hessen",
      "amtsgericht": "Amtsgericht Wiesbaden",
      "registernummer": "HRB 9110",
      "registerart": "HRB",
      "company_name": "P&I Personal & Informatik Aktiengesellschaft",
      "company_seat": "Wiesbaden",
      "details": "20.06.2025 (Bekanntmachungsdatum)\n\nHessen Amtsgericht Wiesbaden HRB 9110\nSonstige Registerbekanntmachung\n\nP&I Personal & Informatik Aktiengesellschaft\nAktiengesellschaft\nWiesbaden\n\nDurch eine Änderung in den Personen der Aufsichtsratsmitglieder ist eine Liste der Mitglieder des Aufsichtsrates zum Handelsregister eingereicht worden."
    },
    {
      "date": "2025-06-20",
      "id": "112918",
      "original_text": "Sonstige Registerbekanntmachung\nHessen Amtsgericht Wetzlar VR 4563\nArabisch-Deutsches Evangeliums-Forum e. V. – Haiger",
      "type": "Sonstige Registerbekanntmachung",
      "state": "Hessen",
      "amtsgericht": "Amtsgericht Wetzlar",
      "registernummer": "VR 4563",
      "registerart": "VR",
      "company_name": "Arabisch-Deutsches Evangeliums-Forum e. V.",
      "company_seat": "Haiger",
      "details": "20.06.2025 (Bekanntmachungsdatum)\n\nHessen Amtsgericht Wetzlar VR 4563\nSonstige Registerbekanntmachung 20.06.2025 (Eintragungsdatum)\n\nArabisch-Deutsches Evangeliums-Forum e. V.\neingetragener Verein\nHaiger\n\nDer Verein ist aufgelöst."
    },
    {
      "date": "2025-06-20",
      "id": "112919",
      "original_text": "Löschungsankündigung\nHessen Amtsgericht Frankfurt am Main HRB 6532\nErnst F. Ambrosius & Sohn, gegründet 1872 Gesellschaft mit beschränkter Haftung – Frankfurt am Main",
      "type": "Löschungsankündigung",
      "state": "Hessen",
      "amtsgericht": "Amtsgericht Frankfurt am Main",
      "registernummer": "HRB 6532",
      "registerart": "HRB",
      "company_name": "Ernst F. Ambrosius & Sohn, gegründet 1872 Gesellschaft mit beschränkter Haftung",
      "company_seat": "Frankfurt am Main",
      "details": "20.06.2025 (Bekanntmachungsdatum)\n\nHessen Amtsgericht Frankfurt am Main HRB 6532\nLöschungsankündigung 20.06.2025 (Eintragungsdatum)\n\nErnst F. Ambrosius & Sohn, gegründet 1872 Gesellschaft mit beschränkter Haftung\nGesellschaft mit beschränkter Haftung\nFrankfurt am Main\n\nDas Registergericht beabsichtigt die im Handelsregister eingetragene Gesellschaft von Amts wegen nach § 394 FamFG zu löschen. Die Frist zur Erhebung eines Widerspruchs gegen die beabsichtigte Löschung wird auf 1 Monat festgesetzt."
    },
    {
      "date": "2025-06-20",
      "id": "112920",
      "original_text": "Löschungsankündigung\nHessen Amtsgericht Frankfurt am Main HRB 112800\nHerz-Impuls Elektrotechnik GmbH – Eschborn",
      "type": "Löschungsankündigung",
      "state": "Hessen",
      "amtsgericht": "Amtsgericht Frankfurt am Main",
      "registernummer": "HRB 112800",
      "registerart": "HRB",
      "company_name": "Herz-Impuls Elektrotechnik GmbH",
      "company_seat": "Eschborn",
      "details": "20.06.2025 (Bekanntmachungsdatum)\n\nHessen Amtsgericht Frankfurt am Main HRB 112800\nLöschungsankündigung\n\nHerz-Impuls Elektrotechnik GmbH\nGesellschaft mit beschränkter Haftung\nEschborn\n\nDas Registergericht beabsichtigt die im Handelsregister eingetragene Gesellschaft von Amts wegen nach § 394 FamFG zu löschen. Die Frist zur Erhebung eines Widerspruchs gegen die beabsichtigte Löschung wird auf 3 Monate festgesetzt."
    },
    {
      "date": "2025-06-20",
      "id": "112921",
      "original_text": "Registerbekanntmachung nach dem Umwandlungsgesetz\nHessen Amtsgericht Fulda HRB 7690\nBB Logistik GmbH – Fulda",
      "type": "Registerbekanntmachung nach dem Umwandlungsgesetz",
      "state": "Hessen",
      "amtsgericht": "Amtsgericht Fulda",
      "registernummer": "HRB 7690",
      "registerart": "HRB",
      "company_name": "BB Logistik GmbH",
      "company_seat": "Fulda",
      "details": "20.06.2025 (Bekanntmachungsdatum)\n\nHessen Amtsgericht Fulda HRB 7690\nRegisterbekanntmachung nach dem Umwandlungsgesetz 20.06.2025 (Eintragungsdatum)\n\nBB Logistik GmbH\nGesellschaft mit beschränkter Haftung\nFulda\n\nDen Gläubigern der an der Verschmelzung beteiligten Rechtsträger ist, wenn sie binnen sechs Monaten nach dem Tag, an dem die Eintragung der Verschmelzung in das Register des Sitzes desjenigen Rechtsträgers, dessen Gläubiger sie sind, nach § 19 Absatz 3 UmwG bekannt gemacht worden ist, ihren Anspruch nach Grund und Höhe schriftlich anmelden, Sicherheit zu leisten, soweit sie nicht Befriedigung verlangen können. Dieses Recht steht den Gläubigern jedoch nur zu, wenn sie glaubhaft machen, dass durch die Verschmelzung die Erfüllung ihrer Forderung gefährdet wird."
    },
    {
      "date": "2025-06-20",
      "id": "112922",
      "original_text": "Registerbekanntmachung nach dem Umwandlungsgesetz\nHessen Amtsgericht Marburg HRB 5328\nMXV II Beteiligungs GmbH – Battenberg/Eder",
      "type": "Registerbekanntmachung nach dem Umwandlungsgesetz",
      "state": "Hessen",
      "amtsgericht": "Amtsgericht Marburg",
      "registernummer": "HRB 5328",
      "registerart": "HRB",
      "company_name": "MXV II Beteiligungs GmbH",
      "company_seat": "Battenberg/Eder",
      "details": "20.06.2025 (Bekanntmachungsdatum)\n\nHessen Amtsgericht Marburg HRB 5328\nRegisterbekanntmachung nach dem Umwandlungsgesetz 20.06.2025 (Eintragungsdatum)\n\nMXV II Beteiligungs GmbH\nGesellschaft mit beschränkter Haftung\nBattenberg/Eder\n\nDen Gläubigern der an der formwechselnden Umwandlung beteiligten Rechtsträger ist, wenn sie binnen sechs Monaten nach dem Tag, an dem die Eintragung der formwechselnden Umwandlung in das Register des Sitzes desjenigen Rechtsträgers, dessen Gläubiger sie sind, nach § 201 UmwG bekannt gemacht worden ist, ihren Anspruch nach Grund und Höhe schriftlich anmelden, Sicherheit zu leisten, soweit sie nicht Befriedigung verlangen können. Dieses Recht steht den Gläubigern jedoch nur zu, wenn sie glaubhaft machen, dass durch die formwechselnden Umwandlung die Erfüllung ihrer Forderung gefährdet wird."
    },
    {
      "date": "2025-06-20",
      "id": "112923",
      "original_text": "Sonstige Registerbekanntmachung\nHessen Amtsgericht Wiesbaden HRB 35117\nABO Energy GmbH & Co. KGaA – Wiesbaden",
      "type": "Sonstige Registerbekanntmachung",
      "state": "Hessen",
      "amtsgericht": "Amtsgericht Wiesbaden",
      "registernummer": "HRB 35117",
      "registerart": "HRB",
      "company_name": "ABO Energy GmbH & Co. KGaA",
      "company_seat": "Wiesbaden",
      "details": "20.06.2025 (Bekanntmachungsdatum)\n\nHessen Amtsgericht Wiesbaden HRB 35117\nSonstige Registerbekanntmachung 20.06.2025 (Eintragungsdatum)\n\nABO Energy GmbH & Co. KGaA\nKommanditgesellschaft auf Aktien\nWiesbaden\n\nDurch eine Änderung in den Personen der Aufsichtsratsmitglieder ist eine Liste der Mitglieder des Aufsichtsrates zum Handelsregister eingereicht worden."
    },
    {
      "date": "2025-06-20",
      "id": "112924",
      "original_text": "Einreichung neuer Dokumente\nHessen Amtsgericht Bad Homburg v.d.H. HRB 11852\nFresenius SE & Co. KGaA – Bad Homburg v. d. Höhe",
      "type": "Einreichung neuer Dokumente",
      "state": "Hessen",
      "amtsgericht": "Amtsgericht Bad Homburg v.d.H.",
      "registernummer": "HRB 11852",
      "registerart": "HRB",
      "company_name": "Fresenius SE & Co. KGaA",
      "company_seat": "Bad Homburg v. d. Höhe",
      "details": "20.06.2025 (Bekanntmachungsdatum)\n\nHessen Amtsgericht Bad Homburg v.d.H. HRB 11852\nEinreichung neuer Dokumente\n\nFresenius SE & Co. KGaA\nKommanditgesellschaft auf Aktien\nBad Homburg v. d. Höhe\n\nDurch eine Änderung in den Personen der Aufsichtsratsmitglieder ist eine Liste der Mitglieder des Aufsichtsrates zum Handelsregister eingereicht worden."
    },
    {
      "date": "2025-06-20",
      "id": "112925",
      "original_text": "Registerbekanntmachung nach dem Umwandlungsgesetz\nHessen Amtsgericht Fulda HRB 8542\nRhönsonne GmbH – Eichenzell",
      "type": "Registerbekanntmachung nach dem Umwandlungsgesetz",
      "state": "Hessen",
      "amtsgericht": "Amtsgericht Fulda",
      "registernummer": "HRB 8542",
      "registerart": "HRB",
      "company_name": "Rhönsonne GmbH",
      "company_seat": "Eichenzell",
      "details": "20.06.2025 (Bekanntmachungsdatum)\n\nHessen Amtsgericht Fulda HRB 8542\nRegisterbekanntmachung nach dem Umwandlungsgesetz 20.06.2025 (Eintragungsdatum)\n\nRhönsonne GmbH\nGesellschaft mit beschränkter Haftung\nEichenzell\n\nDen Gläubigern der an der Verschmelzung beteiligten Rechtsträger ist, wenn sie binnen sechs Monaten nach dem Tag, an dem die Eintragung der Verschmelzung in das Register des Sitzes desjenigen Rechtsträgers, dessen Gläubiger sie sind, nach § 19 Absatz 3 UmwG bekannt gemacht worden ist, ihren Anspruch nach Grund und Höhe schriftlich anmelden, Sicherheit zu leisten, soweit sie nicht Befriedigung verlangen können. Dieses Recht steht den Gläubigern jedoch nur zu, wenn sie glaubhaft machen, dass durch die Verschmelzung die Erfüllung ihrer Forderung gefährdet wird."
    },
    {
      "date": "2025-06-20",
      "id": "112926",
      "original_text": "Löschungsankündigung\nHessen Amtsgericht Fulda HRB 5833\nMarian Müller Verwaltungs-GmbH – Fulda",
      "type": "Löschungsankündigung",
      "state": "Hessen",
      "amtsgericht": "Amtsgericht Fulda",
      "registernummer": "HRB 5833",
      "registerart": "HRB",
      "company_name": "Marian Müller Verwaltungs-GmbH",
      "company_seat": "Fulda",
      "details": "20.06.2025 (Bekanntmachungsdatum)\n\nHessen Amtsgericht Fulda HRB 5833\nLöschungsankündigung\n\nMarian Müller Verwaltungs-GmbH\nGesellschaft mit beschränkter Haftung\nFulda\n\nDas Registergericht beabsichtigt die im Handelsregister eingetragene Gesellschaft von Amts wegen nach § 394 FamFG zu löschen. Die Frist zur Erhebung eines Widerspruchs gegen die beabsichtigte Löschung wird auf 3 Monate festgesetzt."
    },
    {
      "date": "2025-06-20",
      "id": "112927",
      "original_text": "Sonstige Registerbekanntmachung\nHessen Amtsgericht Wiesbaden VR 7376\nKartina Club e.V. – Wiesbaden",
      "type": "Sonstige Registerbekanntmachung",
      "state": "Hessen",
      "amtsgericht": "Amtsgericht Wiesbaden",
      "registernummer": "VR 7376",
      "registerart": "VR",
      "company_name": "Kartina Club e.V.",
      "company_seat": "Wiesbaden",
      "details": "20.06.2025 (Bekanntmachungsdatum)\n\nHessen Amtsgericht Wiesbaden VR 7376\nSonstige Registerbekanntmachung 20.06.2025 (Eintragungsdatum)\n\nKartina Club e.V.\neingetragener Verein\nWiesbaden\n\nDer Verein ist aufgelöst."
    },
    {
      "date": "2025-06-20",
      "id": "112928",
      "original_text": "Registerbekanntmachung nach dem Umwandlungsgesetz\nHessen Amtsgericht Marburg HRB 5320\nMXV Beteiligungs GmbH – Battenberg",
      "type": "Registerbekanntmachung nach dem Umwandlungsgesetz",
      "state": "Hessen",
      "amtsgericht": "Amtsgericht Marburg",
      "registernummer": "HRB 5320",
      "registerart": "HRB",
      "company_name": "MXV Beteiligungs GmbH",
      "company_seat": "Battenberg",
      "details": "20.06.2025 (Bekanntmachungsdatum)\n\nHessen Amtsgericht Marburg HRB 5320\nRegisterbekanntmachung nach dem Umwandlungsgesetz 20.06.2025 (Eintragungsdatum)\n\nMXV Beteiligungs GmbH\nGesellschaft mit beschränkter Haftung\nBattenberg\n\nDen Gläubigern der an der formwechselnden Umwandlung beteiligten Rechtsträger ist, wenn sie binnen sechs Monaten nach dem Tag, an dem die Eintragung der formwechselnden Umwandlung in das Register des Sitzes desjenigen Rechtsträgers, dessen Gläubiger sie sind, nach § 201 UmwG bekannt gemacht worden ist, ihren Anspruch nach Grund und Höhe schriftlich anmelden, Sicherheit zu leisten, soweit sie nicht Befriedigung verlangen können. Dieses Recht steht den Gläubigern jedoch nur zu, wenn sie glaubhaft machen, dass durch die formwechselnden Umwandlung die Erfüllung ihrer Forderung gefährdet wird."
    }
  ]
}