{
  "date": "2025-06-12",
  "date_of_scrape": "2025-06-13T08:52:29.982Z",
  "tool_version": "0.2.0",
  "number_of_announcements": 160,
  "announcements": [
    {
      "date": "2025-06-12",
      "id": "111889",
      "original_text": "Registerbekanntmachung nach dem Umwandlungsgesetz\nBayern Amtsgericht München HRB 198212\nGoYellow GmbH – München",
      "type": "Registerbekanntmachung nach dem Umwandlungsgesetz",
      "state": "Bayern",
      "amtsgericht": "Amtsgericht München",
      "registernummer": "HRB 198212",
      "registerart": "HRB",
      "company_name": "GoYellow GmbH",
      "company_seat": "München",
      "details": "12.06.2025 (Bekanntmachungsdatum)\n\nBayern Amtsgericht München HRB 198212\nRegisterbekanntmachung nach dem Umwandlungsgesetz 11.06.2025 (Eintragungsdatum)\n\nGoYellow GmbH\nGesellschaft mit beschränkter Haftung\nMünchen\n\nDen Gläubigern der an der Verschmelzung beteiligten Rechtsträger ist, wenn sie binnen sechs Monaten nach dem Tag, an dem die Eintragung der Verschmelzung in das Register des Sitzes desjenigen Rechtsträgers, dessen Gläubiger sie sind, nach § 19 Abs. 3 UmwG als bekannt gemacht gilt, ihren Anspruch nach Grund und Höhe in Textform anmelden, Sicherheit zu leisten, soweit sie nicht Befriedigung verlangen können. Dieses Recht steht den Gläubigern jedoch nur zu, wenn sie glaubhaft machen, dass durch die Verschmelzung die Erfüllung ihrer Forderung gefährdet wird."
    },
    {
      "date": "2025-06-12",
      "id": "111890",
      "original_text": "Einreichung neuer Dokumente\nBayern Amtsgericht Memmingen HRB 18559\nWanzl GmbH & Co. KGaA – Leipheim",
      "type": "Einreichung neuer Dokumente",
      "state": "Bayern",
      "amtsgericht": "Amtsgericht Memmingen",
      "registernummer": "HRB 18559",
      "registerart": "HRB",
      "company_name": "Wanzl GmbH & Co. KGaA",
      "company_seat": "Leipheim",
      "details": "12.06.2025 (Bekanntmachungsdatum)\n\nBayern Amtsgericht Memmingen HRB 18559\nEinreichung neuer Dokumente\n\nWanzl GmbH & Co. KGaA\nKommanditgesellschaft auf Aktien\nLeipheim\n\nDem Amtsgericht Memmingen -Registergericht- ist eine Liste der Mitglieder des Aufsichtsrats eingereicht worden, §§ 278 Abs. 3, 106 AktG."
    },
    {
      "date": "2025-06-12",
      "id": "111891",
      "original_text": "Löschungsankündigung\nBayern Amtsgericht München HRB 288968\nMB-Dienstleistungen GmbH – Freising",
      "type": "Löschungsankündigung",
      "state": "Bayern",
      "amtsgericht": "Amtsgericht München",
      "registernummer": "HRB 288968",
      "registerart": "HRB",
      "company_name": "MB-Dienstleistungen GmbH",
      "company_seat": "Freising",
      "details": "12.06.2025 (Bekanntmachungsdatum)\n\nBayern Amtsgericht München HRB 288968\nLöschungsankündigung\n\nMB-Dienstleistungen GmbH\nGesellschaft mit beschränkter Haftung\nFreising\n\nDas Registergericht beabsichtigt, die im Handelsregister eingetragene Gesellschaft wegen Vermögenslosigkeit von Amts wegen nach § 394 FamFG zu löschen. Die Frist zur Erhebung eines Widerspruchs ist auf drei Monate festgesetzt."
    },
    {
      "date": "2025-06-12",
      "id": "111892",
      "original_text": "Löschungsankündigung\nBayern Amtsgericht München HRB 266467\nSDS DE Einunddreißig Management GmbH – München",
      "type": "Löschungsankündigung",
      "state": "Bayern",
      "amtsgericht": "Amtsgericht München",
      "registernummer": "HRB 266467",
      "registerart": "HRB",
      "company_name": "SDS DE Einunddreißig Management GmbH",
      "company_seat": "München",
      "details": "12.06.2025 (Bekanntmachungsdatum)\n\nBayern Amtsgericht München HRB 266467\nLöschungsankündigung\n\nSDS DE Einunddreißig Management GmbH\nGesellschaft mit beschränkter Haftung\nMünchen\n\nDas Registergericht beabsichtigt, die im Handelsregister eingetragene Gesellschaft wegen Vermögenslosigkeit von Amts wegen nach § 394 FamFG zu löschen. Die Frist zur Erhebung eines Widerspruchs ist auf drei Monate festgesetzt."
    },
    {
      "date": "2025-06-12",
      "id": "111893",
      "original_text": "Registerbekanntmachung nach dem Umwandlungsgesetz\nBayern Amtsgericht München HRB 259107\nMC 2 GmbH – Aschheim",
      "type": "Registerbekanntmachung nach dem Umwandlungsgesetz",
      "state": "Bayern",
      "amtsgericht": "Amtsgericht München",
      "registernummer": "HRB 259107",
      "registerart": "HRB",
      "company_name": "MC 2 GmbH",
      "company_seat": "Aschheim",
      "details": "12.06.2025 (Bekanntmachungsdatum)\n\nBayern Amtsgericht München HRB 259107\nRegisterbekanntmachung nach dem Umwandlungsgesetz 11.06.2025 (Eintragungsdatum)\n\nMC 2 GmbH\nGesellschaft mit beschränkter Haftung\nAschheim\n\nDen Gläubigern der an der Verschmelzung beteiligten Rechtsträger ist, wenn sie binnen sechs Monaten nach dem Tag, an dem die Eintragung der Verschmelzung in das Register des Sitzes desjenigen Rechtsträgers, dessen Gläubiger sie sind, nach § 19 Abs. 3 UmwG als bekannt gemacht gilt, ihren Anspruch nach Grund und Höhe in Textform anmelden, Sicherheit zu leisten, soweit sie nicht Befriedigung verlangen können. Dieses Recht steht den Gläubigern jedoch nur zu, wenn sie glaubhaft machen, dass durch die Verschmelzung die Erfüllung ihrer Forderung gefährdet wird."
    },
    {
      "date": "2025-06-12",
      "id": "111894",
      "original_text": "Löschungsankündigung\nBayern Amtsgericht Fürth HRA 6985\nStrocom Elektro- und Kommunikationstechnik e.K. – Diespeck",
      "type": "Löschungsankündigung",
      "state": "Bayern",
      "amtsgericht": "Amtsgericht Fürth",
      "registernummer": "HRA 6985",
      "registerart": "HRA",
      "company_name": "Strocom Elektro- und Kommunikationstechnik e.K.",
      "company_seat": "Diespeck",
      "details": "12.06.2025 (Bekanntmachungsdatum)\n\nBayern Amtsgericht Fürth HRA 6985\nLöschungsankündigung 11.06.2025 (Eintragungsdatum)\n\nStrocom Elektro- und Kommunikationstechnik e.K.\nEinzelkaufmann / Einzelkauffrau\nDiespeck\n\nDas Registergericht beabsichtigt, die im Handelsregister eingetragene Firma von Amts wegen nach § 31 Abs. 2 HGB zu löschen. Die Frist zur Erhebung eines Widerspruchs ist auf einen Monat festgesetzt."
    },
    {
      "date": "2025-06-12",
      "id": "111895",
      "original_text": "Registerbekanntmachung nach dem Umwandlungsgesetz\nBayern Amtsgericht München HRB 128648\nConstantin Film Distribution GmbH – München",
      "type": "Registerbekanntmachung nach dem Umwandlungsgesetz",
      "state": "Bayern",
      "amtsgericht": "Amtsgericht München",
      "registernummer": "HRB 128648",
      "registerart": "HRB",
      "company_name": "Constantin Film Distribution GmbH",
      "company_seat": "München",
      "details": "12.06.2025 (Bekanntmachungsdatum)\n\nBayern Amtsgericht München HRB 128648\nRegisterbekanntmachung nach dem Umwandlungsgesetz 11.06.2025 (Eintragungsdatum)\n\nConstantin Film Distribution GmbH\nGesellschaft mit beschränkter Haftung\nMünchen\n\nDen Gläubigern der an der Verschmelzung beteiligten Rechtsträger ist, wenn sie binnen sechs Monaten nach dem Tag, an dem die Eintragung der Verschmelzung in das Register des Sitzes desjenigen Rechtsträgers, dessen Gläubiger sie sind, nach § 19 Abs. 3 UmwG als bekannt gemacht gilt, ihren Anspruch nach Grund und Höhe in Textform anmelden, Sicherheit zu leisten, soweit sie nicht Befriedigung verlangen können. Dieses Recht steht den Gläubigern jedoch nur zu, wenn sie glaubhaft machen, dass durch die Verschmelzung die Erfüllung ihrer Forderung gefährdet wird."
    },
    {
      "date": "2025-06-12",
      "id": "111896",
      "original_text": "Registerbekanntmachung nach dem Umwandlungsgesetz\nBayern Amtsgericht Nürnberg HRB 40020\nDatenschutz Prinz GmbH – Schwabach",
      "type": "Registerbekanntmachung nach dem Umwandlungsgesetz",
      "state": "Bayern",
      "amtsgericht": "Amtsgericht Nürnberg",
      "registernummer": "HRB 40020",
      "registerart": "HRB",
      "company_name": "Datenschutz Prinz GmbH",
      "company_seat": "Schwabach",
      "details": "12.06.2025 (Bekanntmachungsdatum)\n\nBayern Amtsgericht Nürnberg HRB 40020\nRegisterbekanntmachung nach dem Umwandlungsgesetz 11.06.2025 (Eintragungsdatum)\n\nDatenschutz Prinz GmbH\nGesellschaft mit beschränkter Haftung\nSchwabach\n\nDen Gläubigern der an der Verschmelzung beteiligten Rechtsträger ist, wenn sie binnen sechs Monaten nach dem Tag, an dem die Eintragung der Verschmelzung in das Register des Sitzes desjenigen Rechtsträgers, dessen Gläubiger sie sind, nach § 19 Abs. 3 UmwG als bekannt gemacht gilt, ihren Anspruch nach Grund und Höhe in Textform anmelden, Sicherheit zu leisten, soweit sie nicht Befriedigung verlangen können. Dieses Recht steht den Gläubigern jedoch nur zu, wenn sie glaubhaft machen, dass durch die Verschmelzung die Erfüllung ihrer Forderung gefährdet wird."
    },
    {
      "date": "2025-06-12",
      "id": "111897",
      "original_text": "Registerbekanntmachung nach dem Umwandlungsgesetz\nBayern Amtsgericht München HRB 302153\nBlauWeiss Lechtal GmbH – Hohenfurch",
      "type": "Registerbekanntmachung nach dem Umwandlungsgesetz",
      "state": "Bayern",
      "amtsgericht": "Amtsgericht München",
      "registernummer": "HRB 302153",
      "registerart": "HRB",
      "company_name": "BlauWeiss Lechtal GmbH",
      "company_seat": "Hohenfurch",
      "details": "12.06.2025 (Bekanntmachungsdatum)\n\nBayern Amtsgericht München HRB 302153\nRegisterbekanntmachung nach dem Umwandlungsgesetz 11.06.2025 (Eintragungsdatum)\n\nBlauWeiss Lechtal GmbH\nGesellschaft mit beschränkter Haftung\nHohenfurch\n\nDen Gläubigern der an der Verschmelzung beteiligten Rechtsträger ist, wenn sie binnen sechs Monaten nach dem Tag, an dem die Eintragung der Verschmelzung in das Register des Sitzes desjenigen Rechtsträgers, dessen Gläubiger sie sind, nach § 19 Abs. 3 UmwG als bekannt gemacht gilt, ihren Anspruch nach Grund und Höhe in Textform anmelden, Sicherheit zu leisten, soweit sie nicht Befriedigung verlangen können. Dieses Recht steht den Gläubigern jedoch nur zu, wenn sie glaubhaft machen, dass durch die Verschmelzung die Erfüllung ihrer Forderung gefährdet wird."
    },
    {
      "date": "2025-06-12",
      "id": "111898",
      "original_text": "Löschungsankündigung\nBayern Amtsgericht Nürnberg HRB 25843\nHighlight GmbH – Nürnberg",
      "type": "Löschungsankündigung",
      "state": "Bayern",
      "amtsgericht": "Amtsgericht Nürnberg",
      "registernummer": "HRB 25843",
      "registerart": "HRB",
      "company_name": "Highlight GmbH",
      "company_seat": "Nürnberg",
      "details": "12.06.2025 (Bekanntmachungsdatum)\n\nBayern Amtsgericht Nürnberg HRB 25843\nLöschungsankündigung\n\nHighlight GmbH\nGesellschaft mit beschränkter Haftung\nNürnberg\n\nDas Registergericht beabsichtigt, die im Handelsregister eingetragene Gesellschaft wegen Vermögenslosigkeit von Amts wegen nach § 394 FamFG zu löschen. Die Frist zur Erhebung eines Widerspruchs ist auf einen Monat festgesetzt."
    },
    {
      "date": "2025-06-12",
      "id": "111899",
      "original_text": "Löschungsankündigung\nBayern Amtsgericht Coburg HRB 3589\nFliesen Kotschenreuther GmbH – Wilhelmsthal",
      "type": "Löschungsankündigung",
      "state": "Bayern",
      "amtsgericht": "Amtsgericht Coburg",
      "registernummer": "HRB 3589",
      "registerart": "HRB",
      "company_name": "Fliesen Kotschenreuther GmbH",
      "company_seat": "Wilhelmsthal",
      "details": "12.06.2025 (Bekanntmachungsdatum)\n\nBayern Amtsgericht Coburg HRB 3589\nLöschungsankündigung\n\nFliesen Kotschenreuther GmbH\nGesellschaft mit beschränkter Haftung\nWilhelmsthal\n\nDas Registergericht beabsichtigt, die im Handelsregister eingetragene Gesellschaft wegen Vermögenslosigkeit von Amts wegen nach § 394 FamFG zu löschen. Die Frist zur Erhebung eines Widerspruchs ist auf sechs Wochen festgesetzt."
    },
    {
      "date": "2025-06-12",
      "id": "111900",
      "original_text": "Löschungsankündigung\nBayern Amtsgericht Amberg HRA 3053\nGrundwert Immobilien Portfolio Köln GmbH & Co. KG – Schwandorf",
      "type": "Löschungsankündigung",
      "state": "Bayern",
      "amtsgericht": "Amtsgericht Amberg",
      "registernummer": "HRA 3053",
      "registerart": "HRA",
      "company_name": "Grundwert Immobilien Portfolio Köln GmbH & Co. KG",
      "company_seat": "Schwandorf",
      "details": "12.06.2025 (Bekanntmachungsdatum)\n\nBayern Amtsgericht Amberg HRA 3053\nLöschungsankündigung\n\nGrundwert Immobilien Portfolio Köln GmbH & Co. KG\nKommanditgesellschaft\nSchwandorf\n\nDas Registergericht beabsichtigt, die im Handelsregister eingetragene Gesellschaft wegen Vermögenslosigkeit von Amts wegen nach § 394 FamFG zu löschen. Die Frist zur Erhebung eines Widerspruchs ist auf zwei Monate festgesetzt."
    },
    {
      "date": "2025-06-12",
      "id": "111901",
      "original_text": "Löschungsankündigung\nBayern Amtsgericht Kempten (Allgäu) HRB 16139\nLebensTraum Store UG (haftungsbeschränkt) – Kaufbeuren",
      "type": "Löschungsankündigung",
      "state": "Bayern",
      "amtsgericht": "Amtsgericht Kempten (Allgäu)",
      "registernummer": "HRB 16139",
      "registerart": "HRB",
      "company_name": "LebensTraum Store UG (haftungsbeschränkt)",
      "company_seat": "Kaufbeuren",
      "details": "12.06.2025 (Bekanntmachungsdatum)\n\nBayern Amtsgericht Kempten (Allgäu) HRB 16139\nLöschungsankündigung\n\nLebensTraum Store UG (haftungsbeschränkt)\nGesellschaft mit beschränkter Haftung\nKaufbeuren\n\nDas Registergericht beabsichtigt, die im Handelsregister eingetragene Gesellschaft wegen Vermögenslosigkeit von Amts wegen nach § 394 FamFG zu löschen. Die Frist zur Erhebung eines Widerspruchs ist auf einen Monat festgesetzt."
    },
    {
      "date": "2025-06-12",
      "id": "111902",
      "original_text": "Löschungsankündigung\nBayern Amtsgericht Weiden i. d. OPf. VR 200286\n1. BC Mantel e.V. – Mantel",
      "type": "Löschungsankündigung",
      "state": "Bayern",
      "amtsgericht": "Amtsgericht Weiden i. d. OPf.",
      "registernummer": "VR 200286",
      "registerart": "VR",
      "company_name": "1. BC Mantel e.V.",
      "company_seat": "Mantel",
      "details": "12.06.2025 (Bekanntmachungsdatum)\n\nBayern Amtsgericht Weiden i. d. OPf. VR 200286\nLöschungsankündigung\n\n1. BC Mantel e.V.\neingetragener Verein\nMantel\n\nDas Registergericht beabsichtigt, den im Vereinsregister eingetragenen Verein von Amts wegen nach § 395 FamFG zu löschen. Die Frist zur Erhebung eines Widerspruchs ist auf einen Monat festgesetzt."
    },
    {
      "date": "2025-06-12",
      "id": "111903",
      "original_text": "Einreichung neuer Dokumente\nBayern Amtsgericht München HRB 95802\nAllianz Direct Versicherungs-AG – München",
      "type": "Einreichung neuer Dokumente",
      "state": "Bayern",
      "amtsgericht": "Amtsgericht München",
      "registernummer": "HRB 95802",
      "registerart": "HRB",
      "company_name": "Allianz Direct Versicherungs-AG",
      "company_seat": "München",
      "details": "12.06.2025 (Bekanntmachungsdatum)\n\nBayern Amtsgericht München HRB 95802\nEinreichung neuer Dokumente 11.06.2025 (Eintragungsdatum)\n\nAllianz Direct Versicherungs-AG\nAktiengesellschaft\nMünchen\n\nDem Amtsgericht München -Registergericht- ist eine Liste der Mitglieder des Aufsichtsrats eingereicht worden, § 106 AktG."
    },
    {
      "date": "2025-06-12",
      "id": "111904",
      "original_text": "Einreichung neuer Dokumente\nBayern Amtsgericht München HRB 283942\nRoland Berger Holding GmbH & Co. KGaA – München",
      "type": "Einreichung neuer Dokumente",
      "state": "Bayern",
      "amtsgericht": "Amtsgericht München",
      "registernummer": "HRB 283942",
      "registerart": "HRB",
      "company_name": "Roland Berger Holding GmbH & Co. KGaA",
      "company_seat": "München",
      "details": "12.06.2025 (Bekanntmachungsdatum)\n\nBayern Amtsgericht München HRB 283942\nEinreichung neuer Dokumente\n\nRoland Berger Holding GmbH & Co. KGaA\nKommanditgesellschaft auf Aktien\nMünchen\n\nDem Amtsgericht München -Registergericht- ist ein Ausgliederungs- und Übernahmevertrag zwischen der Roland Berger Service GmbH & Co. KGaA, München (Amtsgericht München HRB 297859) und der Gesellschaft als übertragendem Rechtsträger zur Einsichtnahme eingereicht worden."
    },
    {
      "date": "2025-06-12",
      "id": "111905",
      "original_text": "Registerbekanntmachung nach dem Umwandlungsgesetz\nBayern Amtsgericht Traunstein HRB 27821\nSiteco GmbH – Traunreut",
      "type": "Registerbekanntmachung nach dem Umwandlungsgesetz",
      "state": "Bayern",
      "amtsgericht": "Amtsgericht Traunstein",
      "registernummer": "HRB 27821",
      "registerart": "HRB",
      "company_name": "Siteco GmbH",
      "company_seat": "Traunreut",
      "details": "12.06.2025 (Bekanntmachungsdatum)\n\nBayern Amtsgericht Traunstein HRB 27821\nRegisterbekanntmachung nach dem Umwandlungsgesetz 11.06.2025 (Eintragungsdatum)\n\nSiteco GmbH\nGesellschaft mit beschränkter Haftung\nTraunreut\n\nDen Gläubigern der an der Spaltung beteiligten Rechtsträger ist, wenn sie binnen sechs Monaten nach dem Tag, an dem die Eintragung der Spaltung in das Register des Sitzes desjenigen Rechtsträgers, dessen Gläubiger sie sind, nach §§ 125, 19 Abs. 3 UmwG als bekannt gemacht gilt, ihren Anspruch nach Grund und Höhe in Textform anmelden, Sicherheit zu leisten, soweit sie nicht Befriedigung verlangen können. Dieses Recht steht den Gläubigern jedoch nur zu, wenn sie glaubhaft machen, dass durch die Spaltung die Erfüllung ihrer Forderung gefährdet wird."
    },
    {
      "date": "2025-06-12",
      "id": "111906",
      "original_text": "Registerbekanntmachung nach dem Umwandlungsgesetz\nBayern Amtsgericht Regensburg HRB 18630\nZentrum für Tiermedizin Kelheim GmbH – Kelheim",
      "type": "Registerbekanntmachung nach dem Umwandlungsgesetz",
      "state": "Bayern",
      "amtsgericht": "Amtsgericht Regensburg",
      "registernummer": "HRB 18630",
      "registerart": "HRB",
      "company_name": "Zentrum für Tiermedizin Kelheim GmbH",
      "company_seat": "Kelheim",
      "details": "12.06.2025 (Bekanntmachungsdatum)\n\nBayern Amtsgericht Regensburg HRB 18630\nRegisterbekanntmachung nach dem Umwandlungsgesetz 11.06.2025 (Eintragungsdatum)\n\nZentrum für Tiermedizin Kelheim GmbH\nGesellschaft mit beschränkter Haftung\nKelheim\n\nDen Gläubigern der an der Verschmelzung beteiligten Rechtsträger ist, wenn sie binnen sechs Monaten nach dem Tag, an dem die Eintragung der Verschmelzung in das Register des Sitzes desjenigen Rechtsträgers, dessen Gläubiger sie sind, nach § 19 Abs. 3 UmwG als bekannt gemacht gilt, ihren Anspruch nach Grund und Höhe in Textform anmelden, Sicherheit zu leisten, soweit sie nicht Befriedigung verlangen können. Dieses Recht steht den Gläubigern jedoch nur zu, wenn sie glaubhaft machen, dass durch die Verschmelzung die Erfüllung ihrer Forderung gefährdet wird."
    },
    {
      "date": "2025-06-12",
      "id": "111907",
      "original_text": "Registerbekanntmachung nach dem Umwandlungsgesetz\nBayern Amtsgericht Traunstein HRB 34153\nOptik Wiedenmann GmbH – Freilassing",
      "type": "Registerbekanntmachung nach dem Umwandlungsgesetz",
      "state": "Bayern",
      "amtsgericht": "Amtsgericht Traunstein",
      "registernummer": "HRB 34153",
      "registerart": "HRB",
      "company_name": "Optik Wiedenmann GmbH",
      "company_seat": "Freilassing",
      "details": "12.06.2025 (Bekanntmachungsdatum)\n\nBayern Amtsgericht Traunstein HRB 34153\nRegisterbekanntmachung nach dem Umwandlungsgesetz 11.06.2025 (Eintragungsdatum)\n\nOptik Wiedenmann GmbH\nGesellschaft mit beschränkter Haftung\nFreilassing\n\nDen Gläubigern der an der Ausgliederung beteiligten Rechtsträger ist, wenn sie binnen sechs Monaten nach dem Tag, an dem die Eintragung der Ausgliederung in das Register des Sitzes desjenigen Rechtsträgers, dessen Gläubiger sie sind, nach §§ 125, 19 Abs. 3 UmwG als bekannt gemacht gilt, ihren Anspruch nach Grund und Höhe in Textform anmelden, Sicherheit zu leisten, soweit sie nicht Befriedigung verlangen können. Dieses Recht steht den Gläubigern jedoch nur zu, wenn sie glaubhaft machen, dass durch die Ausgliederung die Erfüllung ihrer Forderung gefährdet wird."
    },
    {
      "date": "2025-06-12",
      "id": "111908",
      "original_text": "Registerbekanntmachung nach dem Umwandlungsgesetz\nBayern Amtsgericht München HRA 120943\nEvent-AgenTour Hofrichter GmbH & Co. KG – Wielenbach",
      "type": "Registerbekanntmachung nach dem Umwandlungsgesetz",
      "state": "Bayern",
      "amtsgericht": "Amtsgericht München",
      "registernummer": "HRA 120943",
      "registerart": "HRA",
      "company_name": "Event-AgenTour Hofrichter GmbH & Co. KG",
      "company_seat": "Wielenbach",
      "details": "12.06.2025 (Bekanntmachungsdatum)\n\nBayern Amtsgericht München HRA 120943\nRegisterbekanntmachung nach dem Umwandlungsgesetz 11.06.2025 (Eintragungsdatum)\n\nEvent-AgenTour Hofrichter GmbH & Co. KG\nKommanditgesellschaft\nWielenbach\n\nDen Gläubigern der an der Ausgliederung beteiligten Rechtsträger ist, wenn sie binnen sechs Monaten nach dem Tag, an dem die Eintragung der Ausgliederung in das Register des Sitzes desjenigen Rechtsträgers, dessen Gläubiger sie sind, nach §§ 125, 19 Abs. 3 UmwG als bekannt gemacht gilt, ihren Anspruch nach Grund und Höhe in Textform anmelden, Sicherheit zu leisten, soweit sie nicht Befriedigung verlangen können. Dieses Recht steht den Gläubigern jedoch nur zu, wenn sie glaubhaft machen, dass durch die Ausgliederung die Erfüllung ihrer Forderung gefährdet wird."
    },
    {
      "date": "2025-06-12",
      "id": "111909",
      "original_text": "Löschungsankündigung\nBayern Amtsgericht München HRA 106452\nPANNTUM Wohnbau Sonnenhof GmbH & Co. KG – Gräfelfing",
      "type": "Löschungsankündigung",
      "state": "Bayern",
      "amtsgericht": "Amtsgericht München",
      "registernummer": "HRA 106452",
      "registerart": "HRA",
      "company_name": "PANNTUM Wohnbau Sonnenhof GmbH & Co. KG",
      "company_seat": "Gräfelfing",
      "details": "12.06.2025 (Bekanntmachungsdatum)\n\nBayern Amtsgericht München HRA 106452\nLöschungsankündigung 11.06.2025 (Eintragungsdatum)\n\nPANNTUM Wohnbau Sonnenhof GmbH & Co. KG\nKommanditgesellschaft\nGräfelfing\n\nDas Registergericht beabsichtigt, die im Handelsregister eingetragene Firma wegen Vermögenslosigkeit von Amts wegen nach § 394 FamFG zu löschen. Die Frist zur Erhebung eines Widerspruchs ist auf drei Monate festgesetzt."
    },
    {
      "date": "2025-06-12",
      "id": "111910",
      "original_text": "Registerbekanntmachung nach dem Umwandlungsgesetz\nBayern Amtsgericht München HRB 285372\nLight Beteiligungs GmbH – München",
      "type": "Registerbekanntmachung nach dem Umwandlungsgesetz",
      "state": "Bayern",
      "amtsgericht": "Amtsgericht München",
      "registernummer": "HRB 285372",
      "registerart": "HRB",
      "company_name": "Light Beteiligungs GmbH",
      "company_seat": "München",
      "details": "12.06.2025 (Bekanntmachungsdatum)\n\nBayern Amtsgericht München HRB 285372\nRegisterbekanntmachung nach dem Umwandlungsgesetz 11.06.2025 (Eintragungsdatum)\n\nLight Beteiligungs GmbH\nGesellschaft mit beschränkter Haftung\nMünchen\n\nDen Gläubigern der an der Verschmelzung beteiligten Rechtsträger ist, wenn sie binnen sechs Monaten nach dem Tag, an dem die Eintragung der Verschmelzung in das Register des Sitzes desjenigen Rechtsträgers, dessen Gläubiger sie sind, nach § 19 Abs. 3 UmwG als bekannt gemacht gilt, ihren Anspruch nach Grund und Höhe in Textform anmelden, Sicherheit zu leisten, soweit sie nicht Befriedigung verlangen können. Dieses Recht steht den Gläubigern jedoch nur zu, wenn sie glaubhaft machen, dass durch die Verschmelzung die Erfüllung ihrer Forderung gefährdet wird."
    },
    {
      "date": "2025-06-12",
      "id": "111911",
      "original_text": "Registerbekanntmachung nach dem Umwandlungsgesetz\nBayern Amtsgericht München HRB 254053\nTierärzte IVC Evidensia GmbH – München",
      "type": "Registerbekanntmachung nach dem Umwandlungsgesetz",
      "state": "Bayern",
      "amtsgericht": "Amtsgericht München",
      "registernummer": "HRB 254053",
      "registerart": "HRB",
      "company_name": "Tierärzte IVC Evidensia GmbH",
      "company_seat": "München",
      "details": "12.06.2025 (Bekanntmachungsdatum)\n\nBayern Amtsgericht München HRB 254053\nRegisterbekanntmachung nach dem Umwandlungsgesetz 11.06.2025 (Eintragungsdatum)\n\nTierärzte IVC Evidensia GmbH\nGesellschaft mit beschränkter Haftung\nMünchen\n\nDen Gläubigern der an der Verschmelzung beteiligten Rechtsträger ist, wenn sie binnen sechs Monaten nach dem Tag, an dem die Eintragung der Verschmelzung in das Register des Sitzes desjenigen Rechtsträgers, dessen Gläubiger sie sind, nach § 19 Abs. 3 UmwG als bekannt gemacht gilt, ihren Anspruch nach Grund und Höhe in Textform anmelden, Sicherheit zu leisten, soweit sie nicht Befriedigung verlangen können. Dieses Recht steht den Gläubigern jedoch nur zu, wenn sie glaubhaft machen, dass durch die Verschmelzung die Erfüllung ihrer Forderung gefährdet wird."
    },
    {
      "date": "2025-06-12",
      "id": "111912",
      "original_text": "Registerbekanntmachung nach dem Umwandlungsgesetz\nBayern Amtsgericht Traunstein HRA 7085\nOptik Wiedenmann e.Kfm. – Freilassing",
      "type": "Registerbekanntmachung nach dem Umwandlungsgesetz",
      "state": "Bayern",
      "amtsgericht": "Amtsgericht Traunstein",
      "registernummer": "HRA 7085",
      "registerart": "HRA",
      "company_name": "Optik Wiedenmann e.Kfm.",
      "company_seat": "Freilassing",
      "details": "12.06.2025 (Bekanntmachungsdatum)\n\nBayern Amtsgericht Traunstein HRA 7085\nRegisterbekanntmachung nach dem Umwandlungsgesetz 11.06.2025 (Eintragungsdatum)\n\nOptik Wiedenmann e.Kfm.\nEinzelkaufmann / Einzelkauffrau\nFreilassing\n\nDen Gläubigern der an der Ausgliederung beteiligten Rechtsträger ist, wenn sie binnen sechs Monaten nach dem Tag, an dem die Eintragung der Ausgliederung in das Register des Sitzes desjenigen Rechtsträgers, dessen Gläubiger sie sind, nach §§ 125, 19 Abs. 3 UmwG als bekannt gemacht gilt, ihren Anspruch nach Grund und Höhe in Textform anmelden, Sicherheit zu leisten, soweit sie nicht Befriedigung verlangen können. Dieses Recht steht den Gläubigern jedoch nur zu, wenn sie glaubhaft machen, dass durch die Ausgliederung die Erfüllung ihrer Forderung gefährdet wird."
    },
    {
      "date": "2025-06-12",
      "id": "111913",
      "original_text": "Registerbekanntmachung nach dem Umwandlungsgesetz\nBayern Amtsgericht München HRB 254053\nTierärzte IVC Evidensia GmbH – München",
      "type": "Registerbekanntmachung nach dem Umwandlungsgesetz",
      "state": "Bayern",
      "amtsgericht": "Amtsgericht München",
      "registernummer": "HRB 254053",
      "registerart": "HRB",
      "company_name": "Tierärzte IVC Evidensia GmbH",
      "company_seat": "München",
      "details": "12.06.2025 (Bekanntmachungsdatum)\n\nBayern Amtsgericht München HRB 254053\nRegisterbekanntmachung nach dem Umwandlungsgesetz 11.06.2025 (Eintragungsdatum)\n\nTierärzte IVC Evidensia GmbH\nGesellschaft mit beschränkter Haftung\nMünchen\n\nDen Gläubigern der an der Verschmelzung beteiligten Rechtsträger ist, wenn sie binnen sechs Monaten nach dem Tag, an dem die Eintragung der Verschmelzung in das Register des Sitzes desjenigen Rechtsträgers, dessen Gläubiger sie sind, nach § 19 Abs. 3 UmwG als bekannt gemacht gilt, ihren Anspruch nach Grund und Höhe in Textform anmelden, Sicherheit zu leisten, soweit sie nicht Befriedigung verlangen können. Dieses Recht steht den Gläubigern jedoch nur zu, wenn sie glaubhaft machen, dass durch die Verschmelzung die Erfüllung ihrer Forderung gefährdet wird."
    },
    {
      "date": "2025-06-12",
      "id": "111914",
      "original_text": "Löschungsankündigung\nBayern Amtsgericht Nürnberg HRB 32139\nChrono Exklusiv GmbH – Nürnberg",
      "type": "Löschungsankündigung",
      "state": "Bayern",
      "amtsgericht": "Amtsgericht Nürnberg",
      "registernummer": "HRB 32139",
      "registerart": "HRB",
      "company_name": "Chrono Exklusiv GmbH",
      "company_seat": "Nürnberg",
      "details": "12.06.2025 (Bekanntmachungsdatum)\n\nBayern Amtsgericht Nürnberg HRB 32139\nLöschungsankündigung\n\nChrono Exklusiv GmbH\nGesellschaft mit beschränkter Haftung\nNürnberg\n\nDas Registergericht beabsichtigt, die im Handelsregister eingetragene Gesellschaft wegen Vermögenslosigkeit von Amts wegen nach § 394 FamFG zu löschen. Die Frist zur Erhebung eines Widerspruchs ist auf einen Monat festgesetzt."
    },
    {
      "date": "2025-06-12",
      "id": "111915",
      "original_text": "Löschungsankündigung\nBayern Amtsgericht Nürnberg HRB 40340\nMadeo Fußbodentechnik GmbH – Roth",
      "type": "Löschungsankündigung",
      "state": "Bayern",
      "amtsgericht": "Amtsgericht Nürnberg",
      "registernummer": "HRB 40340",
      "registerart": "HRB",
      "company_name": "Madeo Fußbodentechnik GmbH",
      "company_seat": "Roth",
      "details": "12.06.2025 (Bekanntmachungsdatum)\n\nBayern Amtsgericht Nürnberg HRB 40340\nLöschungsankündigung\n\nMadeo Fußbodentechnik GmbH\nGesellschaft mit beschränkter Haftung\nRoth\n\nDas Registergericht beabsichtigt, die im Handelsregister eingetragene Gesellschaft wegen Vermögenslosigkeit von Amts wegen nach § 394 FamFG zu löschen. Die Frist zur Erhebung eines Widerspruchs ist auf einen Monat festgesetzt."
    },
    {
      "date": "2025-06-12",
      "id": "111916",
      "original_text": "Registerbekanntmachung nach dem Umwandlungsgesetz\nBayern Amtsgericht München HRB 134694\nBIL Industriemetalle GmbH – Pullach i. Isartal",
      "type": "Registerbekanntmachung nach dem Umwandlungsgesetz",
      "state": "Bayern",
      "amtsgericht": "Amtsgericht München",
      "registernummer": "HRB 134694",
      "registerart": "HRB",
      "company_name": "BIL Industriemetalle GmbH",
      "company_seat": "Pullach i. Isartal",
      "details": "12.06.2025 (Bekanntmachungsdatum)\n\nBayern Amtsgericht München HRB 134694\nRegisterbekanntmachung nach dem Umwandlungsgesetz 11.06.2025 (Eintragungsdatum)\n\nBIL Industriemetalle GmbH\nGesellschaft mit beschränkter Haftung\nPullach i. Isartal\n\nDen Gläubigern der an der Verschmelzung beteiligten Rechtsträger ist, wenn sie binnen sechs Monaten nach dem Tag, an dem die Eintragung der Verschmelzung in das Register des Sitzes desjenigen Rechtsträgers, dessen Gläubiger sie sind, nach § 19 Abs. 3 UmwG als bekannt gemacht gilt, ihren Anspruch nach Grund und Höhe in Textform anmelden, Sicherheit zu leisten, soweit sie nicht Befriedigung verlangen können. Dieses Recht steht den Gläubigern jedoch nur zu, wenn sie glaubhaft machen, dass durch die Verschmelzung die Erfüllung ihrer Forderung gefährdet wird."
    },
    {
      "date": "2025-06-12",
      "id": "111917",
      "original_text": "Löschungsankündigung\nBaden-Württemberg Amtsgericht Mannheim HRB 220295\nFrüh Bauunternehmung GmbH – Achern",
      "type": "Löschungsankündigung",
      "state": "Baden-Württemberg",
      "amtsgericht": "Amtsgericht Mannheim",
      "registernummer": "HRB 220295",
      "registerart": "HRB",
      "company_name": "Früh Bauunternehmung GmbH",
      "company_seat": "Achern",
      "details": "12.06.2025 (Bekanntmachungsdatum)\n\nBaden-Württemberg Amtsgericht Mannheim HRB 220295\nLöschungsankündigung\n\nFrüh Bauunternehmung GmbH\nGesellschaft mit beschränkter Haftung\nAchern\n\nAls nicht eingetragen wird bekanntgemacht:\nDas Gericht beabsichtigt, die Gesellschaft wegen Vermögenslosigkeit im Handelsregister von Amts wegen nach § 394 FamFG zu löschen. Die Frist zur Geltendmachung eines Widerspruchs gegen die beabsichtigte Löschung ist auf einen Monat ab Veröffentlichung bestimmt."
    },
    {
      "date": "2025-06-12",
      "id": "111918",
      "original_text": "Registerbekanntmachung nach dem Umwandlungsgesetz\nBaden-Württemberg Amtsgericht Stuttgart HRA 741897\nRosenauer KG – Balingen",
      "type": "Registerbekanntmachung nach dem Umwandlungsgesetz",
      "state": "Baden-Württemberg",
      "amtsgericht": "Amtsgericht Stuttgart",
      "registernummer": "HRA 741897",
      "registerart": "HRA",
      "company_name": "Rosenauer KG",
      "company_seat": "Balingen",
      "details": "12.06.2025 (Bekanntmachungsdatum)\n\nBaden-Württemberg Amtsgericht Stuttgart HRA 741897\nRegisterbekanntmachung nach dem Umwandlungsgesetz 12.06.2025 (Eintragungsdatum)\n\nRosenauer KG\nKommanditgesellschaft\nBalingen\n\nAls nicht eingetragen wird bekanntgemacht:\nDen Gläubigern der an der Ausgliederung beteiligten Rechtsträger ist, wenn sie binnen sechs Monaten nach dem Tag, an dem die Eintragung der Ausgliederung in das Register des Sitzes desjenigen Rechtsträgers, dessen Gläubiger sie sind, nach § 19 Abs. 3 UmwG als bekanntgemacht gilt, ihren Anspruch nach Grund und Höhe schriftlich anmelden, Sicherheit zu leisten, soweit sie nicht Befriedigung verlangen können. Dieses Recht steht den Gläubigern jedoch nur zu, wenn sie glaubhaft machen, dass durch die Ausgliederung die Erfüllung ihrer Forderung gefährdet wird."
    },
    {
      "date": "2025-06-12",
      "id": "111919",
      "original_text": "Einreichung neuer Dokumente\nBerlin Amtsgericht Berlin (Charlottenburg) HRB 75484\nX Verleih AG, Gesellschaft zur Auswertung und Verbreitung audiovisueller Produkte – Berlin",
      "type": "Einreichung neuer Dokumente",
      "state": "Berlin",
      "amtsgericht": "Amtsgericht Berlin (Charlottenburg)",
      "registernummer": "HRB 75484",
      "registerart": "HRB",
      "company_name": "X Verleih AG, Gesellschaft zur Auswertung und Verbreitung audiovisueller Produkte",
      "company_seat": "Berlin",
      "details": "12.06.2025 (Bekanntmachungsdatum)\n\nBerlin Amtsgericht Berlin (Charlottenburg) HRB 75484\nEinreichung neuer Dokumente\n\nX Verleih AG, Gesellschaft zur Auswertung und Verbreitung audiovisueller Produkte\nAktiengesellschaft\nBerlin\n\nAls nicht eingetragen wird veröffentlicht: Es wurde eine neue Liste der Aufsichtsratsmitglieder eingereicht (§ 106 AktG)."
    },
    {
      "date": "2025-06-12",
      "id": "111920",
      "original_text": "Einreichung neuer Dokumente\nBaden-Württemberg Amtsgericht Stuttgart HRB 11771\nBaden-Württemberg International - Gesellschaft für internationale wirtschaftliche und wissenschaftliche Zusammenarbeit mbH – Stuttgart",
      "type": "Einreichung neuer Dokumente",
      "state": "Baden-Württemberg",
      "amtsgericht": "Amtsgericht Stuttgart",
      "registernummer": "HRB 11771",
      "registerart": "HRB",
      "company_name": "Baden-Württemberg International - Gesellschaft für internationale wirtschaftliche und wissenschaftliche Zusammenarbeit mbH",
      "company_seat": "Stuttgart",
      "details": "12.06.2025 (Bekanntmachungsdatum)\n\nBaden-Württemberg Amtsgericht Stuttgart HRB 11771\nEinreichung neuer Dokumente\n\nBaden-Württemberg International - Gesellschaft für internationale wirtschaftliche und wissenschaftliche Zusammenarbeit mbH\nGesellschaft mit beschränkter Haftung\nStuttgart\n\nDie Gesellschaft hat am 11.06.2025 die Liste über die Zusammensetzung des Aufsichtsrats zum Handelsregister eingereicht."
    },
    {
      "date": "2025-06-12",
      "id": "111921",
      "original_text": "Löschungsankündigung\nBaden-Württemberg Amtsgericht Mannheim HRB 9219\nKlimmer & Co. Planung + Bauleitung Gesellschaft mbH – Mannheim",
      "type": "Löschungsankündigung",
      "state": "Baden-Württemberg",
      "amtsgericht": "Amtsgericht Mannheim",
      "registernummer": "HRB 9219",
      "registerart": "HRB",
      "company_name": "Klimmer & Co. Planung + Bauleitung Gesellschaft mbH",
      "company_seat": "Mannheim",
      "details": "12.06.2025 (Bekanntmachungsdatum)\n\nBaden-Württemberg Amtsgericht Mannheim HRB 9219\nLöschungsankündigung\n\nKlimmer & Co. Planung + Bauleitung Gesellschaft mbH\nGesellschaft mit beschränkter Haftung\nMannheim\n\nDas Gericht beabsichtigt, die Gesellschaft wegen Vermögenslosigkeit im Handelsregister von Amts wegen nach § 394 FamFG zu löschen. Die Frist zur Geltendmachung eines Widerspruchs gegen die beabsichtigte Löschung ist auf einen Monat ab Veröffentlichung bestimmt."
    },
    {
      "date": "2025-06-12",
      "id": "111922",
      "original_text": "Löschungsankündigung\nBerlin Amtsgericht Berlin (Charlottenburg) HRB 214661\nHippocampus Berlin Holding GmbH – Berlin",
      "type": "Löschungsankündigung",
      "state": "Berlin",
      "amtsgericht": "Amtsgericht Berlin (Charlottenburg)",
      "registernummer": "HRB 214661",
      "registerart": "HRB",
      "company_name": "Hippocampus Berlin Holding GmbH",
      "company_seat": "Berlin",
      "details": "12.06.2025 (Bekanntmachungsdatum)\n\nBerlin Amtsgericht Berlin (Charlottenburg) HRB 214661\nLöschungsankündigung\n\nHippocampus Berlin Holding GmbH\nGesellschaft mit beschränkter Haftung\nBerlin\n\nBei der nachstehenden Gesellschaft wird das Amtslöschungsverfahren gemäß § 394 FamFG eingeleitet. Widerspruchsfrist 6 Wochen"
    },
    {
      "date": "2025-06-12",
      "id": "111923",
      "original_text": "Registerbekanntmachung nach dem Umwandlungsgesetz\nBaden-Württemberg Amtsgericht Stuttgart HRB 1103\nMulti Packaging Solutions Services GmbH – Obersulm",
      "type": "Registerbekanntmachung nach dem Umwandlungsgesetz",
      "state": "Baden-Württemberg",
      "amtsgericht": "Amtsgericht Stuttgart",
      "registernummer": "HRB 1103",
      "registerart": "HRB",
      "company_name": "Multi Packaging Solutions Services GmbH",
      "company_seat": "Obersulm",
      "details": "12.06.2025 (Bekanntmachungsdatum)\n\nBaden-Württemberg Amtsgericht Stuttgart HRB 1103\nRegisterbekanntmachung nach dem Umwandlungsgesetz 12.06.2025 (Eintragungsdatum)\n\nMulti Packaging Solutions Services GmbH\nGesellschaft mit beschränkter Haftung\nObersulm\n\nDen Gläubigern der an der Verschmelzung beteiligten Rechtsträger ist, wenn sie binnen sechs Monaten nach dem Tag, an dem die Eintragung der Verschmelzung in das Register des Sitzes desjenigen Rechtsträgers, dessen Gläubiger sie sind, nach § 19 Abs. 3 UmwG als bekanntgemacht gilt, ihren Anspruch nach Grund und Höhe schriftlich anmelden, Sicherheit zu leisten, soweit sie nicht Befriedigung verlangen können. Dieses Recht steht den Gläubigern jedoch nur zu, wenn sie glaubhaft machen, dass durch die Verschmelzung die Erfüllung ihrer Forderung gefährdet wird."
    },
    {
      "date": "2025-06-12",
      "id": "111924",
      "original_text": "Löschungsankündigung\nBerlin Amtsgericht Berlin (Charlottenburg) HRB 263206\nDragonpanda Internationale Spedition GmbH – Berlin",
      "type": "Löschungsankündigung",
      "state": "Berlin",
      "amtsgericht": "Amtsgericht Berlin (Charlottenburg)",
      "registernummer": "HRB 263206",
      "registerart": "HRB",
      "company_name": "Dragonpanda Internationale Spedition GmbH",
      "company_seat": "Berlin",
      "details": "12.06.2025 (Bekanntmachungsdatum)\n\nBerlin Amtsgericht Berlin (Charlottenburg) HRB 263206\nLöschungsankündigung\n\nDragonpanda Internationale Spedition GmbH\nGesellschaft mit beschränkter Haftung\nBerlin\n\nBei der nachstehenden Gesellschaft wird das Amtslöschungsverfahren gemäß § 394 FamFG eingeleitet. Widerspruchsfrist 6 Wochen"
    },
    {
      "date": "2025-06-12",
      "id": "111925",
      "original_text": "Löschungsankündigung\nBerlin Amtsgericht Berlin (Charlottenburg) HRB 157237\nBDG Bestattungsdienstleistungsgesellschaft mbH – Berlin",
      "type": "Löschungsankündigung",
      "state": "Berlin",
      "amtsgericht": "Amtsgericht Berlin (Charlottenburg)",
      "registernummer": "HRB 157237",
      "registerart": "HRB",
      "company_name": "BDG Bestattungsdienstleistungsgesellschaft mbH",
      "company_seat": "Berlin",
      "details": "12.06.2025 (Bekanntmachungsdatum)\n\nBerlin Amtsgericht Berlin (Charlottenburg) HRB 157237\nLöschungsankündigung\n\nBDG Bestattungsdienstleistungsgesellschaft mbH\nGesellschaft mit beschränkter Haftung\nBerlin\n\nBei der nachstehenden Gesellschaft wird das Amtslöschungsverfahren gemäß § 394 FamFG eingeleitet. Widerspruchsfrist 6 Wochen"
    },
    {
      "date": "2025-06-12",
      "id": "111926",
      "original_text": "Registerbekanntmachung nach dem Umwandlungsgesetz\nBaden-Württemberg Amtsgericht Ulm HRB 501572\nCarl Zeiss IQR GmbH – Oberkochen",
      "type": "Registerbekanntmachung nach dem Umwandlungsgesetz",
      "state": "Baden-Württemberg",
      "amtsgericht": "Amtsgericht Ulm",
      "registernummer": "HRB 501572",
      "registerart": "HRB",
      "company_name": "Carl Zeiss IQR GmbH",
      "company_seat": "Oberkochen",
      "details": "12.06.2025 (Bekanntmachungsdatum)\n\nBaden-Württemberg Amtsgericht Ulm HRB 501572\nRegisterbekanntmachung nach dem Umwandlungsgesetz 12.06.2025 (Eintragungsdatum)\n\nCarl Zeiss IQR GmbH\nGesellschaft mit beschränkter Haftung\nOberkochen\n\nAls nicht eingetragen wird bekanntgemacht:\nDen Gläubigern der an der Abspaltung beteiligten Rechtsträger ist, wenn sie binnen sechs Monaten nach dem Tag, an dem die Eintragung der Abspaltung in das Register des Sitzes desjenigen Rechtsträgers, dessen Gläubiger sie sind, nach § 19 Abs. 3 UmwG als bekanntgemacht gilt, ihren Anspruch nach Grund und Höhe schriftlich anmelden, Sicherheit zu leisten, soweit sie nicht Befriedigung verlangen können. Dieses Recht steht den Gläubigern jedoch nur zu, wenn sie glaubhaft machen, dass durch die Abspaltung die Erfüllung ihrer Forderung gefährdet wird."
    },
    {
      "date": "2025-06-12",
      "id": "111927",
      "original_text": "Registerbekanntmachung nach dem Umwandlungsgesetz\nBaden-Württemberg Amtsgericht Ulm HRB 501561\nCarl Zeiss Industrielle Messtechnik GmbH – Oberkochen",
      "type": "Registerbekanntmachung nach dem Umwandlungsgesetz",
      "state": "Baden-Württemberg",
      "amtsgericht": "Amtsgericht Ulm",
      "registernummer": "HRB 501561",
      "registerart": "HRB",
      "company_name": "Carl Zeiss Industrielle Messtechnik GmbH",
      "company_seat": "Oberkochen",
      "details": "12.06.2025 (Bekanntmachungsdatum)\n\nBaden-Württemberg Amtsgericht Ulm HRB 501561\nRegisterbekanntmachung nach dem Umwandlungsgesetz 12.06.2025 (Eintragungsdatum)\n\nCarl Zeiss Industrielle Messtechnik GmbH\nGesellschaft mit beschränkter Haftung\nOberkochen\n\nAls nicht eingetragen wird bekanntgemacht:\nDen Gläubigern der an der Abspaltung beteiligten Rechtsträger ist, wenn sie binnen sechs Monaten nach dem Tag, an dem die Eintragung der Abspaltung in das Register des Sitzes desjenigen Rechtsträgers, dessen Gläubiger sie sind, nach § 19 Abs. 3 UmwG als bekanntgemacht gilt, ihren Anspruch nach Grund und Höhe schriftlich anmelden, Sicherheit zu leisten, soweit sie nicht Befriedigung verlangen können. Dieses Recht steht den Gläubigern jedoch nur zu, wenn sie glaubhaft machen, dass durch die Abspaltung die Erfüllung ihrer Forderung gefährdet wird."
    },
    {
      "date": "2025-06-12",
      "id": "111928",
      "original_text": "Löschungsankündigung\nBaden-Württemberg Amtsgericht Mannheim HRB 728049\nBAK Investment GmbH – Lauda-Königshofen",
      "type": "Löschungsankündigung",
      "state": "Baden-Württemberg",
      "amtsgericht": "Amtsgericht Mannheim",
      "registernummer": "HRB 728049",
      "registerart": "HRB",
      "company_name": "BAK Investment GmbH",
      "company_seat": "Lauda-Königshofen",
      "details": "12.06.2025 (Bekanntmachungsdatum)\n\nBaden-Württemberg Amtsgericht Mannheim HRB 728049\nLöschungsankündigung\n\nBAK Investment GmbH\nGesellschaft mit beschränkter Haftung\nLauda-Königshofen\n\nDas Gericht beabsichtigt, die Eintragung der Geschäftsführerin Dominique Arnold Ernest Lang wegen des Mangels einer wesentlichen Voraussetzung von Amts wegen nach § 395 FamFG als unzulässig zu löschen. Die Frist zur Geltendmachung eines Widerspruchs gegen die beabsichtigte Löschung ist auf einen Monat ab Veröffentlichung bestimmt."
    },
    {
      "date": "2025-06-12",
      "id": "111929",
      "original_text": "Registerbekanntmachung nach dem Umwandlungsgesetz\nHamburg Amtsgericht Hamburg HRB 163070\nLKL Leichtbau Kompetenz Lausitz UG (haftungsbeschränkt) – Hamburg",
      "type": "Registerbekanntmachung nach dem Umwandlungsgesetz",
      "state": "Hamburg",
      "amtsgericht": "Amtsgericht Hamburg",
      "registernummer": "HRB 163070",
      "registerart": "HRB",
      "company_name": "LKL Leichtbau Kompetenz Lausitz UG (haftungsbeschränkt)",
      "company_seat": "Hamburg",
      "details": "12.06.2025 (Bekanntmachungsdatum)\n\nHamburg Amtsgericht Hamburg HRB 163070\nRegisterbekanntmachung nach dem Umwandlungsgesetz 12.06.2025 (Eintragungsdatum)\n\nLKL Leichtbau Kompetenz Lausitz UG (haftungsbeschränkt)\nGesellschaft mit beschränkter Haftung\nHamburg\n\nAls nicht eingetragen wird bekannt gemacht:\nDen Gläubigern der an der Verschmelzung beteiligten Gesellschaften ist, wenn sie binnen sechs Monaten nach dem Tag, an dem die Eintragung der Verschmelzung in das Register des Sitzes desjenigen Rechtsträgers, dessen Gläubiger sie sind, nach § 19 Absatz 3 UmwG als bekannt gemacht gilt, ihren Anspruch nach Grund und Höhe schriftlich anmelden, Sicherheit zu leisten, soweit sie nicht Befriedigung verlangen können. Dieses Recht steht den Gläubigern jedoch nur zu, wenn sie glaubhaft machen, dass durch die Verschmelzung die Erfüllung ihrer Forderung gefährdet wird."
    },
    {
      "date": "2025-06-12",
      "id": "111930",
      "original_text": "Registerbekanntmachung nach dem Umwandlungsgesetz\nBaden-Württemberg Amtsgericht Mannheim HRB 751225\nGK Versicherungsmakler GmbH – Waghäusel",
      "type": "Registerbekanntmachung nach dem Umwandlungsgesetz",
      "state": "Baden-Württemberg",
      "amtsgericht": "Amtsgericht Mannheim",
      "registernummer": "HRB 751225",
      "registerart": "HRB",
      "company_name": "GK Versicherungsmakler GmbH",
      "company_seat": "Waghäusel",
      "details": "12.06.2025 (Bekanntmachungsdatum)\n\nBaden-Württemberg Amtsgericht Mannheim HRB 751225\nRegisterbekanntmachung nach dem Umwandlungsgesetz 12.06.2025 (Eintragungsdatum)\n\nGK Versicherungsmakler GmbH\nGesellschaft mit beschränkter Haftung\nWaghäusel\n\nAls nicht eingetragen wird bekanntgemacht:\nDen Gläubigern der an der Verschmelzung beteiligten Rechtsträger ist, wenn sie binnen sechs Monaten nach dem Tag, an dem die Eintragung der Verschmelzung in das Register des Sitzes desjenigen Rechtsträgers, dessen Gläubiger sie sind, nach § 19 Abs. 3 UmwG als bekanntgemacht gilt, ihren Anspruch nach Grund und Höhe schriftlich anmelden, Sicherheit zu leisten, soweit sie nicht Befriedigung verlangen können. Dieses Recht steht den Gläubigern jedoch nur zu, wenn sie glaubhaft machen, dass durch die Verschmelzung die Erfüllung ihrer Forderung gefährdet wird."
    },
    {
      "date": "2025-06-12",
      "id": "111931",
      "original_text": "Sonstige Registerbekanntmachung\nSaarland Amtsgericht Saarbrücken HRB 103562\nTLP Wirtschaftsberatung GmbH – Saarbrücken",
      "type": "Sonstige Registerbekanntmachung",
      "state": "Saarland",
      "amtsgericht": "Amtsgericht Saarbrücken",
      "registernummer": "HRB 103562",
      "registerart": "HRB",
      "company_name": "TLP Wirtschaftsberatung GmbH",
      "company_seat": "Saarbrücken",
      "details": "12.06.2025 (Bekanntmachungsdatum)\n\nSaarland Amtsgericht Saarbrücken HRB 103562\nSonstige Registerbekanntmachung 12.06.2025 (Eintragungsdatum)\n\nTLP Wirtschaftsberatung GmbH\nGesellschaft mit beschränkter Haftung\nSaarbrücken\n\nAls nicht eingetragen wird bekannt gemacht: Den Gläubigern der an dem Aufhebungsvertrag beteiligten Gesellschaften ist, wenn sie binnen sechs Monaten nach dem Tag, an dem die Eintragung der Aufhebung in das Register des Sitzes desjenigen Rechtsträgers, dessen Gläubiger sie sind, bekannt gemacht worden ist, ihren Anspruch nach Grund und Höhe schriftlich anmelden, Sicherheit zu leisten, soweit sie nicht Befriedigung verlangen können. Dieses Recht steht den Gläubigern jedoch nur zu, wenn sie glaubhaft machen, dass durch die Aufhebung des Beherrschungs- und Gewinnabführungsvertrages die Erfüllung ihrer Forderung gefährdet wird."
    },
    {
      "date": "2025-06-12",
      "id": "111932",
      "original_text": "Einreichung neuer Dokumente\nBaden-Württemberg Amtsgericht Stuttgart HRB 203306\nAbfallverwertungsgesellschaft des Landkreises Ludwigsburg mbH – Ludwigsburg",
      "type": "Einreichung neuer Dokumente",
      "state": "Baden-Württemberg",
      "amtsgericht": "Amtsgericht Stuttgart",
      "registernummer": "HRB 203306",
      "registerart": "HRB",
      "company_name": "Abfallverwertungsgesellschaft des Landkreises Ludwigsburg mbH",
      "company_seat": "Ludwigsburg",
      "details": "12.06.2025 (Bekanntmachungsdatum)\n\nBaden-Württemberg Amtsgericht Stuttgart HRB 203306\nEinreichung neuer Dokumente 12.06.2025 (Eintragungsdatum)\n\nAbfallverwertungsgesellschaft des Landkreises Ludwigsburg mbH\nGesellschaft mit beschränkter Haftung\nLudwigsburg\n\nDie Gesellschaft hat am 11.06.2025 die Liste über die Zusammensetzung des Aufsichtsrats zum Handelsregister eingereicht."
    },
    {
      "date": "2025-06-12",
      "id": "111933",
      "original_text": "Registerbekanntmachung nach dem Umwandlungsgesetz\nBaden-Württemberg Amtsgericht Stuttgart HRB 778739\nDillinger Weg Projektentwicklungs- GmbH – Fellbach",
      "type": "Registerbekanntmachung nach dem Umwandlungsgesetz",
      "state": "Baden-Württemberg",
      "amtsgericht": "Amtsgericht Stuttgart",
      "registernummer": "HRB 778739",
      "registerart": "HRB",
      "company_name": "Dillinger Weg Projektentwicklungs- GmbH",
      "company_seat": "Fellbach",
      "details": "12.06.2025 (Bekanntmachungsdatum)\n\nBaden-Württemberg Amtsgericht Stuttgart HRB 778739\nRegisterbekanntmachung nach dem Umwandlungsgesetz 12.06.2025 (Eintragungsdatum)\n\nDillinger Weg Projektentwicklungs- GmbH\nGesellschaft mit beschränkter Haftung\nFellbach\n\nAls nicht eingetragen wird bekanntgemacht:\nDen Gläubigern der an der Verschmelzung beteiligten Rechtsträger ist, wenn sie binnen sechs Monaten nach dem Tag, an dem die Eintragung der Verschmelzung in das Register des Sitzes desjenigen Rechtsträgers, dessen Gläubiger sie sind, nach § 19 Abs. 3 UmwG als bekanntgemacht gilt, ihren Anspruch nach Grund und Höhe schriftlich anmelden, Sicherheit zu leisten, soweit sie nicht Befriedigung verlangen können. Dieses Recht steht den Gläubigern jedoch nur zu, wenn sie glaubhaft machen, dass durch die Verschmelzung die Erfüllung ihrer Forderung gefährdet wird."
    },
    {
      "date": "2025-06-12",
      "id": "111934",
      "original_text": "Registerbekanntmachung nach dem Umwandlungsgesetz\nBerlin Amtsgericht Berlin (Charlottenburg) HRB 275913\nThe G Erste Immobilien GmbH – Berlin",
      "type": "Registerbekanntmachung nach dem Umwandlungsgesetz",
      "state": "Berlin",
      "amtsgericht": "Amtsgericht Berlin (Charlottenburg)",
      "registernummer": "HRB 275913",
      "registerart": "HRB",
      "company_name": "The G Erste Immobilien GmbH",
      "company_seat": "Berlin",
      "details": "12.06.2025 (Bekanntmachungsdatum)\n\nBerlin Amtsgericht Berlin (Charlottenburg) HRB 275913\nRegisterbekanntmachung nach dem Umwandlungsgesetz 11.06.2025 (Eintragungsdatum)\n\nThe G Erste Immobilien GmbH\nGesellschaft mit beschränkter Haftung\nBerlin\n\nZu Eintragungsnummer 1 vom 11.06.2025 wird als nicht eingetragen veröffentlicht: Den Gläubigern ist, wenn sie binnen sechs Monaten nach dem Tag, an dem die Eintragung der Umwandlung als bekannt gemacht gilt, ihren Anspruch nach Grund und Höhe schriftlich anmelden, Sicherheit zu leisten, soweit sie nicht Befriedigung verlangen können. Dieses Recht steht den Gläubigern jedoch nur zu, wenn sie glaubhaft machen, dass durch die Umwandlung die Erfüllung ihrer Forderung gefährdet wird. Das Recht, Sicherheitsleistung zu verlangen, steht Gläubigern nicht zu, die im Falle der Insolvenz ein Recht auf vorzugsweise Befriedigung aus einer Deckungsmasse haben, die nach gesetzlicher Vorschrift zu ihrem Schutz errichtet und staatlich überwacht ist."
    },
    {
      "date": "2025-06-12",
      "id": "111935",
      "original_text": "Registerbekanntmachung nach dem Umwandlungsgesetz\nBaden-Württemberg Amtsgericht Freiburg HRB 716977\nFitnesspark Singen GmbH – Singen Hohentwiel",
      "type": "Registerbekanntmachung nach dem Umwandlungsgesetz",
      "state": "Baden-Württemberg",
      "amtsgericht": "Amtsgericht Freiburg",
      "registernummer": "HRB 716977",
      "registerart": "HRB",
      "company_name": "Fitnesspark Singen GmbH",
      "company_seat": "Singen Hohentwiel",
      "details": "12.06.2025 (Bekanntmachungsdatum)\n\nBaden-Württemberg Amtsgericht Freiburg HRB 716977\nRegisterbekanntmachung nach dem Umwandlungsgesetz 12.06.2025 (Eintragungsdatum)\n\nFitnesspark Singen GmbH\nGesellschaft mit beschränkter Haftung\nSingen Hohentwiel\n\nDen Gläubigern der an der Verschmelzung beteiligten Rechtsträger ist, wenn sie binnen sechs Monaten nach dem Tag, an dem die Eintragung der Verschmelzung in das Register des Sitzes desjenigen Rechtsträgers, dessen Gläubiger sie sind, nach § 19 Absatz 3 UmwG als bekanntgemacht gilt, ihren Anspruch nach Grund und Höhe schriftlich anmelden, Sicherheit zu leisten, soweit sie nicht Befriedigung verlangen können. Dieses Recht steht den Gläubigern jedoch nur zu, wenn sie glaubhaft machen, dass durch die Verschmelzung die Erfüllung ihrer Forderung gefährdet wird."
    },
    {
      "date": "2025-06-12",
      "id": "111936",
      "original_text": "Registerbekanntmachung nach dem Umwandlungsgesetz\nBerlin Amtsgericht Berlin (Charlottenburg) HRA 38844\nThe G Erste Immobilien GmbH & Co. KG – Berlin",
      "type": "Registerbekanntmachung nach dem Umwandlungsgesetz",
      "state": "Berlin",
      "amtsgericht": "Amtsgericht Berlin (Charlottenburg)",
      "registernummer": "HRA 38844",
      "registerart": "HRA",
      "company_name": "The G Erste Immobilien GmbH & Co. KG",
      "company_seat": "Berlin",
      "details": "12.06.2025 (Bekanntmachungsdatum)\n\nBerlin Amtsgericht Berlin (Charlottenburg) HRA 38844\nRegisterbekanntmachung nach dem Umwandlungsgesetz 11.06.2025 (Eintragungsdatum)\n\nThe G Erste Immobilien GmbH & Co. KG\nKommanditgesellschaft\nBerlin\n\nZu Eintragungsnummer 10 vom 11.06.2025 wird als nicht eingetragen veröffentlicht: Den Gläubigern ist, wenn sie binnen sechs Monaten nach dem Tag, an dem die Eintragung der Umwandlung als bekannt gemacht gilt, ihren Anspruch nach Grund und Höhe schriftlich anmelden, Sicherheit zu leisten, soweit sie nicht Befriedigung verlangen können. Dieses Recht steht den Gläubigern jedoch nur zu, wenn sie glaubhaft machen, dass durch die Umwandlung die Erfüllung ihrer Forderung gefährdet wird. Das Recht, Sicherheitsleistung zu verlangen, steht Gläubigern nicht zu, die im Falle der Insolvenz ein Recht auf vorzugsweise Befriedigung aus einer Deckungsmasse haben, die nach gesetzlicher Vorschrift zu ihrem Schutz errichtet und staatlich überwacht ist."
    },
    {
      "date": "2025-06-12",
      "id": "111937",
      "original_text": "Einreichung neuer Dokumente\nBaden-Württemberg Amtsgericht Mannheim HRB 240006\nStädtische Wohnungsbau GmbH Bretten – Bretten",
      "type": "Einreichung neuer Dokumente",
      "state": "Baden-Württemberg",
      "amtsgericht": "Amtsgericht Mannheim",
      "registernummer": "HRB 240006",
      "registerart": "HRB",
      "company_name": "Städtische Wohnungsbau GmbH Bretten",
      "company_seat": "Bretten",
      "details": "12.06.2025 (Bekanntmachungsdatum)\n\nBaden-Württemberg Amtsgericht Mannheim HRB 240006\nEinreichung neuer Dokumente 12.06.2025 (Eintragungsdatum)\n\nStädtische Wohnungsbau GmbH Bretten\nGesellschaft mit beschränkter Haftung\nBretten\n\nDie Gesellschaft hat am 11.06.2025 die Liste über die Zusammensetzung des Aufsichtsrats zum Handelsregister eingereicht."
    },
    {
      "date": "2025-06-12",
      "id": "111938",
      "original_text": "Löschungsankündigung\nBerlin Amtsgericht Berlin (Charlottenburg) HRB 210555\nSpeedDreams24 UG (haftungsbeschränkt) – Berlin",
      "type": "Löschungsankündigung",
      "state": "Berlin",
      "amtsgericht": "Amtsgericht Berlin (Charlottenburg)",
      "registernummer": "HRB 210555",
      "registerart": "HRB",
      "company_name": "SpeedDreams24 UG (haftungsbeschränkt)",
      "company_seat": "Berlin",
      "details": "12.06.2025 (Bekanntmachungsdatum)\n\nBerlin Amtsgericht Berlin (Charlottenburg) HRB 210555\nLöschungsankündigung\n\nSpeedDreams24 UG (haftungsbeschränkt)\nGesellschaft mit beschränkter Haftung\nBerlin\n\nBei der nachstehenden Gesellschaft wird das Amtslöschungsverfahren gemäß § 394 FamFG eingeleitet. Widerspruchsfrist 6 Wochen"
    },
    {
      "date": "2025-06-12",
      "id": "111939",
      "original_text": "Löschungsankündigung\nBerlin Amtsgericht Berlin (Charlottenburg) HRB 157612\nFeraru Handels GmbH – Berlin",
      "type": "Löschungsankündigung",
      "state": "Berlin",
      "amtsgericht": "Amtsgericht Berlin (Charlottenburg)",
      "registernummer": "HRB 157612",
      "registerart": "HRB",
      "company_name": "Feraru Handels GmbH",
      "company_seat": "Berlin",
      "details": "12.06.2025 (Bekanntmachungsdatum)\n\nBerlin Amtsgericht Berlin (Charlottenburg) HRB 157612\nLöschungsankündigung\n\nFeraru Handels GmbH\nGesellschaft mit beschränkter Haftung\nBerlin\n\nBei der nachstehenden Gesellschaft wird das Amtslöschungsverfahren gemäß § 394 FamFG eingeleitet. Widerspruchsfrist 6 Wochen"
    },
    {
      "date": "2025-06-12",
      "id": "111940",
      "original_text": "Löschungsankündigung\nBerlin Amtsgericht Berlin (Charlottenburg) HRB 169628\nniceRides Berlin Motorradhandel UG (haftungsbeschränkt) – Berlin",
      "type": "Löschungsankündigung",
      "state": "Berlin",
      "amtsgericht": "Amtsgericht Berlin (Charlottenburg)",
      "registernummer": "HRB 169628",
      "registerart": "HRB",
      "company_name": "niceRides Berlin Motorradhandel UG (haftungsbeschränkt)",
      "company_seat": "Berlin",
      "details": "12.06.2025 (Bekanntmachungsdatum)\n\nBerlin Amtsgericht Berlin (Charlottenburg) HRB 169628\nLöschungsankündigung\n\nniceRides Berlin Motorradhandel UG (haftungsbeschränkt)\nGesellschaft mit beschränkter Haftung\nBerlin\n\nBei der nachstehenden Gesellschaft wird das Amtslöschungsverfahren gemäß § 394 FamFG eingeleitet. Widerspruchsfrist 6 Wochen"
    },
    {
      "date": "2025-06-12",
      "id": "111941",
      "original_text": "Löschungsankündigung\nBaden-Württemberg Amtsgericht Mannheim HRB 713809\nPARKPLAN AG – Mannheim",
      "type": "Löschungsankündigung",
      "state": "Baden-Württemberg",
      "amtsgericht": "Amtsgericht Mannheim",
      "registernummer": "HRB 713809",
      "registerart": "HRB",
      "company_name": "PARKPLAN AG",
      "company_seat": "Mannheim",
      "details": "12.06.2025 (Bekanntmachungsdatum)\n\nBaden-Württemberg Amtsgericht Mannheim HRB 713809\nLöschungsankündigung\n\nPARKPLAN AG\nAktiengesellschaft\nMannheim\n\nDas Gericht beabsichtigt, die Gesellschaft wegen Vermögenslosigkeit im Handelsregister von Amts wegen nach § 394 FamFG zu löschen. Die Frist zur Geltendmachung eines Widerspruchs gegen die beabsichtigte Löschung ist auf einen Monat ab Veröffentlichung bestimmt."
    },
    {
      "date": "2025-06-12",
      "id": "111942",
      "original_text": "Löschungsankündigung\nBaden-Württemberg Amtsgericht Stuttgart HRB 778015\nPlakatservice T&CS UG (haftungsbeschränkt) – Bad Liebenzell",
      "type": "Löschungsankündigung",
      "state": "Baden-Württemberg",
      "amtsgericht": "Amtsgericht Stuttgart",
      "registernummer": "HRB 778015",
      "registerart": "HRB",
      "company_name": "Plakatservice T&CS UG (haftungsbeschränkt)",
      "company_seat": "Bad Liebenzell",
      "details": "12.06.2025 (Bekanntmachungsdatum)\n\nBaden-Württemberg Amtsgericht Stuttgart HRB 778015\nLöschungsankündigung 12.06.2025 (Eintragungsdatum)\n\nPlakatservice T&CS UG (haftungsbeschränkt)\nGesellschaft mit beschränkter Haftung\nBad Liebenzell\n\nDas Gericht beabsichtigt, die Gesellschaft wegen Vermögenslosigkeit im Handelsregister von Amts wegen nach § 394 FamFG zu löschen. Die Frist zur Geltendmachung eines Widerspruchs gegen die beabsichtigte Löschung ist auf zwei Monate ab Veröffentlichung bestimmt."
    },
    {
      "date": "2025-06-12",
      "id": "111943",
      "original_text": "Einreichung neuer Dokumente\nBerlin Amtsgericht Berlin (Charlottenburg) HRB 152599\nBD24 Berlin Direkt Versicherung AG – Berlin",
      "type": "Einreichung neuer Dokumente",
      "state": "Berlin",
      "amtsgericht": "Amtsgericht Berlin (Charlottenburg)",
      "registernummer": "HRB 152599",
      "registerart": "HRB",
      "company_name": "BD24 Berlin Direkt Versicherung AG",
      "company_seat": "Berlin",
      "details": "12.06.2025 (Bekanntmachungsdatum)\n\nBerlin Amtsgericht Berlin (Charlottenburg) HRB 152599\nEinreichung neuer Dokumente\n\nBD24 Berlin Direkt Versicherung AG\nAktiengesellschaft\nBerlin\n\nAls nicht eingetragen wird veröffentlicht: Es wurde eine neue Liste der Aufsichtsratsmitglieder eingereicht (§ 106 AktG)."
    },
    {
      "date": "2025-06-12",
      "id": "111944",
      "original_text": "Einreichung neuer Dokumente\nBerlin Amtsgericht Berlin (Charlottenburg) HRB 199611\nRA-MICRO Software AG – Berlin",
      "type": "Einreichung neuer Dokumente",
      "state": "Berlin",
      "amtsgericht": "Amtsgericht Berlin (Charlottenburg)",
      "registernummer": "HRB 199611",
      "registerart": "HRB",
      "company_name": "RA-MICRO Software AG",
      "company_seat": "Berlin",
      "details": "12.06.2025 (Bekanntmachungsdatum)\n\nBerlin Amtsgericht Berlin (Charlottenburg) HRB 199611\nEinreichung neuer Dokumente\n\nRA-MICRO Software AG\nAktiengesellschaft\nBerlin\n\nAls nicht eingetragen wird veröffentlicht: Es wurde eine neue Liste der Aufsichtsratsmitglieder eingereicht (§ 106 AktG)."
    },
    {
      "date": "2025-06-12",
      "id": "111945",
      "original_text": "Löschungsankündigung\nBaden-Württemberg Amtsgericht Stuttgart HRB 749615\npareton GmbH – Ingersheim",
      "type": "Löschungsankündigung",
      "state": "Baden-Württemberg",
      "amtsgericht": "Amtsgericht Stuttgart",
      "registernummer": "HRB 749615",
      "registerart": "HRB",
      "company_name": "pareton GmbH",
      "company_seat": "Ingersheim",
      "details": "12.06.2025 (Bekanntmachungsdatum)\n\nBaden-Württemberg Amtsgericht Stuttgart HRB 749615\nLöschungsankündigung 12.06.2025 (Eintragungsdatum)\n\npareton GmbH\nGesellschaft mit beschränkter Haftung\nIngersheim\n\nDas Gericht beabsichtigt, die Gesellschaft wegen Vermögenslosigkeit im Handelsregister von Amts wegen nach § 394 FamFG zu löschen. Die Frist zur Geltendmachung eines Widerspruchs gegen die beabsichtigte Löschung ist auf zwei Monate ab Veröffentlichung bestimmt."
    },
    {
      "date": "2025-06-12",
      "id": "111946",
      "original_text": "Registerbekanntmachung nach dem Umwandlungsgesetz\nBaden-Württemberg Amtsgericht Mannheim HRB 703016\nStadtwerk Külsheim GmbH – Külsheim",
      "type": "Registerbekanntmachung nach dem Umwandlungsgesetz",
      "state": "Baden-Württemberg",
      "amtsgericht": "Amtsgericht Mannheim",
      "registernummer": "HRB 703016",
      "registerart": "HRB",
      "company_name": "Stadtwerk Külsheim GmbH",
      "company_seat": "Külsheim",
      "details": "12.06.2025 (Bekanntmachungsdatum)\n\nBaden-Württemberg Amtsgericht Mannheim HRB 703016\nRegisterbekanntmachung nach dem Umwandlungsgesetz 12.06.2025 (Eintragungsdatum)\n\nStadtwerk Külsheim GmbH\nGesellschaft mit beschränkter Haftung\nKülsheim\n\n#DV.Auswahl(Text=\"Bitte wählen Sie aus:\",\tEingabe=\n\"#insert(Text=\"VOE_Allgemein\")\"|\"Als nicht eingetragen wird bekanntgemacht:\",\n\"#insert(Text=\"VOE_BKM_Blätter\")\"|\"Bekanntmachungen der Gesellschaft erfolgen...\",\n\"#insert(Text=\"VOE_Aufsichtsrat\")\"|\"Mitglieder des ersten Aufsichtsrats\",\n\"#insert(Text=\"VOE_Sachgründung\")\"|\"Sachgründung\",\n\"#insert(Text=\"VOE_Sacherhöhung\")\"|\"Sacherhöhung\",\n\"#insert(Text=\"VOE_Aufhebung_UV\")\"|\"Aufhebung Unternehmensvertrag\",\n\"#insert(Text=\"VOE_Formwechsel\")\"|\"Formwechsel\",\n\"#insert(Text=\"VOE_Verschmelzung\")\"|\"Verschmelzung\",\n\"#insert(Text=\"VOE_Abspaltung\")\"|\"Abspaltung\",\n\"#insert(Text=\"VOE_Aufspaltung\")\"|\"Aufspaltung\",\n\"#insert(Text=\"VOE_Ausgliederung\")\"|\"Ausgliederung\",\n\"#insert(Text=\"VOE_Vermögensübertragung\")\"|\"Vermögensübertragung\",\n\"#insert(Text=\"Loeschungsankündigung_HR_394\")\"|\"Löschungsankündigung 394 FamFG\",\n\"#insert(Text=\"Loeschungsankündigung_HR_395\")\"|\"Löschungsankündigung 395 FamFG\",\n\"#insert(Text=\"Loeschungsankündigung_HR_397\")\"|\"Löschungsankündigung 397 FamFG\")"
    },
    {
      "date": "2025-06-12",
      "id": "111947",
      "original_text": "Registerbekanntmachung nach dem Umwandlungsgesetz\nBaden-Württemberg Amtsgericht Mannheim HRB 703016\nStadtwerk Külsheim GmbH – Külsheim",
      "type": "Registerbekanntmachung nach dem Umwandlungsgesetz",
      "state": "Baden-Württemberg",
      "amtsgericht": "Amtsgericht Mannheim",
      "registernummer": "HRB 703016",
      "registerart": "HRB",
      "company_name": "Stadtwerk Külsheim GmbH",
      "company_seat": "Külsheim",
      "details": "12.06.2025 (Bekanntmachungsdatum)\n\nBaden-Württemberg Amtsgericht Mannheim HRB 703016\nRegisterbekanntmachung nach dem Umwandlungsgesetz 12.06.2025 (Eintragungsdatum)\n\nStadtwerk Külsheim GmbH\nGesellschaft mit beschränkter Haftung\nKülsheim\n\nAls nicht eingetragen wird bekanntgemacht:\nDen Gläubigern der an der Verschmelzung beteiligten Rechtsträger ist, wenn sie binnen sechs Monaten nach dem Tag, an dem die Eintragung der Verschmelzung in das Register des Sitzes desjenigen Rechtsträgers, dessen Gläubiger sie sind, nach § 19 Abs. 3 UmwG als bekanntgemacht gilt, ihren Anspruch nach Grund und Höhe schriftlich anmelden, Sicherheit zu leisten, soweit sie nicht Befriedigung verlangen können. Dieses Recht steht den Gläubigern jedoch nur zu, wenn sie glaubhaft machen, dass durch die Verschmelzung die Erfüllung ihrer Forderung gefährdet wird."
    },
    {
      "date": "2025-06-12",
      "id": "111948",
      "original_text": "Registerbekanntmachung nach dem Umwandlungsgesetz\nBerlin Amtsgericht Berlin (Charlottenburg) HRA 55654\nTangaroa GmbH & Co. KG – Berlin",
      "type": "Registerbekanntmachung nach dem Umwandlungsgesetz",
      "state": "Berlin",
      "amtsgericht": "Amtsgericht Berlin (Charlottenburg)",
      "registernummer": "HRA 55654",
      "registerart": "HRA",
      "company_name": "Tangaroa GmbH & Co. KG",
      "company_seat": "Berlin",
      "details": "12.06.2025 (Bekanntmachungsdatum)\n\nBerlin Amtsgericht Berlin (Charlottenburg) HRA 55654\nRegisterbekanntmachung nach dem Umwandlungsgesetz 11.06.2025 (Eintragungsdatum)\n\nTangaroa GmbH & Co. KG\nKommanditgesellschaft\nBerlin\n\nZu Eintragungsnummer 4 vom 11.06.2025 wird als nicht eingetragen veröffentlicht: Den Gläubigern der an der Spaltung beteiligten Rechtsträger ist, wenn sie binnen sechs Monaten nach dem Tag, an dem die Eintragung der Spaltung in das Register des Sitzes desjenigen Rechtsträgers, dessen Gläubiger sie sind, als bekannt gemacht gilt, ihren Anspruch nach Grund und Höhe schriftlich anmelden, Sicherheit zu leisten, soweit sie nicht Befriedigung verlangen können. Dieses Recht steht den Gläubigern jedoch nur zu, wenn sie glaubhaft machen, dass durch die Spaltung die Erfüllung ihrer Forderung gefährdet wird. Das Recht, Sicherheitsleistung zu verlangen, steht Gläubigern nicht zu, die im Falle der Insolvenz ein Recht auf vorzugsweise Befriedigung aus einer Deckungsmasse haben, die nach gesetzlicher Vorschrift zu ihrem Schutz errichtet und staatlich überwacht ist."
    },
    {
      "date": "2025-06-12",
      "id": "111949",
      "original_text": "Löschungsankündigung\nBerlin Amtsgericht Berlin (Charlottenburg) HRB 172391\nTwenga GmbH – Berlin",
      "type": "Löschungsankündigung",
      "state": "Berlin",
      "amtsgericht": "Amtsgericht Berlin (Charlottenburg)",
      "registernummer": "HRB 172391",
      "registerart": "HRB",
      "company_name": "Twenga GmbH",
      "company_seat": "Berlin",
      "details": "12.06.2025 (Bekanntmachungsdatum)\n\nBerlin Amtsgericht Berlin (Charlottenburg) HRB 172391\nLöschungsankündigung\n\nTwenga GmbH\nGesellschaft mit beschränkter Haftung\nBerlin\n\nBei der nachstehenden Gesellschaft wird das Amtslöschungsverfahren gemäß § 394 FamFG eingeleitet. Widerspruchsfrist 6 Wochen"
    },
    {
      "date": "2025-06-12",
      "id": "111950",
      "original_text": "Einreichung neuer Dokumente\nSachsen-Anhalt Amtsgericht Stendal HRB 10795\nEntwicklungs- und Wirtschaftsförderungsgesellschaft Anhalt-Bitterfeld mit beschränkter Haftung - \"EWG Anhalt-Bitterfeld\" – Bitterfeld-Wolfen",
      "type": "Einreichung neuer Dokumente",
      "state": "Sachsen-Anhalt",
      "amtsgericht": "Amtsgericht Stendal",
      "registernummer": "HRB 10795",
      "registerart": "HRB",
      "company_name": "Entwicklungs- und Wirtschaftsförderungsgesellschaft Anhalt-Bitterfeld mit beschränkter Haftung - \"EWG Anhalt-Bitterfeld\"",
      "company_seat": "Bitterfeld-Wolfen",
      "details": "12.06.2025 (Bekanntmachungsdatum)\n\nSachsen-Anhalt Amtsgericht Stendal HRB 10795\nEinreichung neuer Dokumente\n\nEntwicklungs- und Wirtschaftsförderungsgesellschaft Anhalt-Bitterfeld mit beschränkter Haftung - \"EWG Anhalt-Bitterfeld\"\nGesellschaft mit beschränkter Haftung\nBitterfeld-Wolfen\n\nEine Liste der Mitglieder des Aufsichtsrates wurde zum Handelsregister eingereicht."
    },
    {
      "date": "2025-06-12",
      "id": "111951",
      "original_text": "Registerbekanntmachung nach dem Umwandlungsgesetz\nSchleswig-Holstein Amtsgericht Lübeck HRB 9153\nWindkraft Presen-Burgstaaken GmbH – Fehmarn",
      "type": "Registerbekanntmachung nach dem Umwandlungsgesetz",
      "state": "Schleswig-Holstein",
      "amtsgericht": "Amtsgericht Lübeck",
      "registernummer": "HRB 9153",
      "registerart": "HRB",
      "company_name": "Windkraft Presen-Burgstaaken GmbH",
      "company_seat": "Fehmarn",
      "details": "12.06.2025 (Bekanntmachungsdatum)\n\nSchleswig-Holstein Amtsgericht Lübeck HRB 9153\nRegisterbekanntmachung nach dem Umwandlungsgesetz 11.06.2025 (Eintragungsdatum)\n\nWindkraft Presen-Burgstaaken GmbH\nGesellschaft mit beschränkter Haftung\nFehmarn\n\nZu Eintragungsnummer 3 vom 11.06.2025 wird als nicht eingetragen veröffentlicht:  Den Gläubigern ist, wenn sie binnen sechs Monaten nach dem Tag, an dem die Eintragung der Umwandlung als bekannt gemacht gilt, ihren Anspruch nach Grund und Höhe schriftlich anmelden, Sicherheit zu leisten, soweit sie nicht Befriedigung verlangen können. Dieses Recht steht den Gläubigern jedoch nur zu, wenn sie glaubhaft machen, dass durch die Umwandlung die Erfüllung ihrer Forderung gefährdet wird."
    },
    {
      "date": "2025-06-12",
      "id": "111952",
      "original_text": "Löschungsankündigung\nSaarland Amtsgericht Saarbrücken HRA 9348\nAuto Activ and more GmbH & Co. KG – Dillingen",
      "type": "Löschungsankündigung",
      "state": "Saarland",
      "amtsgericht": "Amtsgericht Saarbrücken",
      "registernummer": "HRA 9348",
      "registerart": "HRA",
      "company_name": "Auto Activ and more GmbH & Co. KG",
      "company_seat": "Dillingen",
      "details": "12.06.2025 (Bekanntmachungsdatum)\n\nSaarland Amtsgericht Saarbrücken HRA 9348\nLöschungsankündigung\n\nAuto Activ and more GmbH & Co. KG\nKommanditgesellschaft\nDillingen\n\nEs ist beabsichtigt, die Gesellschaft von Amts wegen gemäß § 394 FamFG wegen Vermögenslosigkeit zu löschen.\nGegen die Löschung von Amts wegen ist das Rechtsmittel des Widerspruchs statthaft. Der Widerspruch ist binnen einer Frist zwei Monaten beginnend mit dem Tag dieser Veröffentlichung durch Einreichen eines Widerspruchsschreibens -schriftlich oder zur Niederschrift der Geschäftsstelle beim Amtsgericht Saarbrücken, -zentrales Handelsregister-, Mainzerstr.178, 66121 Saarbrücken einzulegen.\nDer Widerspruch muss die Bezeichnung der angefochtenen Löschungsankündigung enthalten sowie die Erklärung, dass Widerspruch eingelegt wird. Er ist vom Widerspruchsführer oder seinem Bevollmächtigten zu unterzeichnen.\nDas Widerspruchsschreiben kann auch in der Form eines elektronischen Dokumentes eingereicht werden, das mit einer qualifizierten elektronischen Signatur nach dem Signaturgesetz versehen sein muss (§§ 14 Abs. 2 FamFG, 130a, 298 ZPO)."
    },
    {
      "date": "2025-06-12",
      "id": "111953",
      "original_text": "Registerbekanntmachung nach dem Umwandlungsgesetz\nHamburg Amtsgericht Hamburg HRA 132479\nFree Market 24/7-VitaDomus Projekte KG – Hamburg",
      "type": "Registerbekanntmachung nach dem Umwandlungsgesetz",
      "state": "Hamburg",
      "amtsgericht": "Amtsgericht Hamburg",
      "registernummer": "HRA 132479",
      "registerart": "HRA",
      "company_name": "Free Market 24/7-VitaDomus Projekte KG",
      "company_seat": "Hamburg",
      "details": "12.06.2025 (Bekanntmachungsdatum)\n\nHamburg Amtsgericht Hamburg HRA 132479\nRegisterbekanntmachung nach dem Umwandlungsgesetz 12.06.2025 (Eintragungsdatum)\n\nFree Market 24/7-VitaDomus Projekte KG\nKommanditgesellschaft\nHamburg\n\nAls nicht eingetragen wird bekannt gemacht:\nDen Gläubigern der an der formwechselnden Umwandlung beteiligten Gesellschaften ist, wenn sie binnen sechs Monaten nach dem Tag, an dem die Eintragung der formwechselnden Umwandlung in das Register des Sitzes desjenigen Rechtsträgers, dessen Gläubiger sie sind, nach § 19 Absatz 3 UmwG als bekannt gemacht gilt, ihren Anspruch nach Grund und Höhe schriftlich anmelden, Sicherheit zu leisten, soweit sie nicht Befriedigung verlangen können. Dieses Recht steht den Gläubigern jedoch nur zu, wenn sie glaubhaft machen, dass durch die formwechselnde Umwandlung die Erfüllung ihrer Forderung gefährdet wird."
    },
    {
      "date": "2025-06-12",
      "id": "111954",
      "original_text": "Registerbekanntmachung nach dem Umwandlungsgesetz\nHamburg Amtsgericht Hamburg HRB 123016\nFree Market 24/7-VitaDomus Projekte UG (haftungsbeschränkt) – Hamburg",
      "type": "Registerbekanntmachung nach dem Umwandlungsgesetz",
      "state": "Hamburg",
      "amtsgericht": "Amtsgericht Hamburg",
      "registernummer": "HRB 123016",
      "registerart": "HRB",
      "company_name": "Free Market 24/7-VitaDomus Projekte UG (haftungsbeschränkt)",
      "company_seat": "Hamburg",
      "details": "12.06.2025 (Bekanntmachungsdatum)\n\nHamburg Amtsgericht Hamburg HRB 123016\nRegisterbekanntmachung nach dem Umwandlungsgesetz 12.06.2025 (Eintragungsdatum)\n\nFree Market 24/7-VitaDomus Projekte UG (haftungsbeschränkt)\nGesellschaft mit beschränkter Haftung\nHamburg\n\nAls nicht eingetragen wird bekannt gemacht:\nDen Gläubigern der an der formwechselnden Umwandlung beteiligten Gesellschaften ist, wenn sie binnen sechs Monaten nach dem Tag, an dem die Eintragung der formwechselnden Umwandlung in das Register des Sitzes desjenigen Rechtsträgers, dessen Gläubiger sie sind, nach § 19 Absatz 3 UmwG als bekannt gemacht gilt, ihren Anspruch nach Grund und Höhe schriftlich anmelden, Sicherheit zu leisten, soweit sie nicht Befriedigung verlangen können. Dieses Recht steht den Gläubigern jedoch nur zu, wenn sie glaubhaft machen, dass durch die formwechselnde Umwandlung die Erfüllung ihrer Forderung gefährdet wird."
    },
    {
      "date": "2025-06-12",
      "id": "111955",
      "original_text": "Sonstige Registerbekanntmachung\nHamburg Amtsgericht Hamburg HRB 161461\nAutokraft GmbH – Hamburg",
      "type": "Sonstige Registerbekanntmachung",
      "state": "Hamburg",
      "amtsgericht": "Amtsgericht Hamburg",
      "registernummer": "HRB 161461",
      "registerart": "HRB",
      "company_name": "Autokraft GmbH",
      "company_seat": "Hamburg",
      "details": "12.06.2025 (Bekanntmachungsdatum)\n\nHamburg Amtsgericht Hamburg HRB 161461\nSonstige Registerbekanntmachung\n\nAutokraft GmbH\nGesellschaft mit beschränkter Haftung\nHamburg\n\nAls nicht eingetragen wird bekannt gemacht: Liste des Aufsichtsrats wurde eingereicht."
    },
    {
      "date": "2025-06-12",
      "id": "111956",
      "original_text": "Registerbekanntmachung nach dem Umwandlungsgesetz\nBaden-Württemberg Amtsgericht Freiburg HRB 731254\nEcho Security GmbH – Villingen-Schwenningen",
      "type": "Registerbekanntmachung nach dem Umwandlungsgesetz",
      "state": "Baden-Württemberg",
      "amtsgericht": "Amtsgericht Freiburg",
      "registernummer": "HRB 731254",
      "registerart": "HRB",
      "company_name": "Echo Security GmbH",
      "company_seat": "Villingen-Schwenningen",
      "details": "12.06.2025 (Bekanntmachungsdatum)\n\nBaden-Württemberg Amtsgericht Freiburg HRB 731254\nRegisterbekanntmachung nach dem Umwandlungsgesetz 12.06.2025 (Eintragungsdatum)\n\nEcho Security GmbH\nGesellschaft mit beschränkter Haftung\nVillingen-Schwenningen\n\nDen Gläubigern der an der Ausgliederung beteiligten Rechtsträger ist, wenn sie binnen sechs Monaten nach dem Tag, an dem die Eintragung der Ausgliederung in das Register des Sitzes desjenigen Rechtsträgers, dessen Gläubiger sie sind, nach § 19 Abs. 3 UmwG als bekanntgemacht gilt, ihren Anspruch nach Grund und Höhe schriftlich anmelden, Sicherheit zu leisten, soweit sie nicht Befriedigung verlangen können. Dieses Recht steht den Gläubigern jedoch nur zu, wenn sie glaubhaft machen, dass durch die Ausgliederung die Erfüllung ihrer Forderung gefährdet wird."
    },
    {
      "date": "2025-06-12",
      "id": "111957",
      "original_text": "Registerbekanntmachung nach dem Umwandlungsgesetz\nBaden-Württemberg Amtsgericht Freiburg HRA 708756\nEcho Security e. K. – Brigachtal",
      "type": "Registerbekanntmachung nach dem Umwandlungsgesetz",
      "state": "Baden-Württemberg",
      "amtsgericht": "Amtsgericht Freiburg",
      "registernummer": "HRA 708756",
      "registerart": "HRA",
      "company_name": "Echo Security e. K.",
      "company_seat": "Brigachtal",
      "details": "12.06.2025 (Bekanntmachungsdatum)\n\nBaden-Württemberg Amtsgericht Freiburg HRA 708756\nRegisterbekanntmachung nach dem Umwandlungsgesetz 12.06.2025 (Eintragungsdatum)\n\nEcho Security e. K.\nEinzelkaufmann / Einzelkauffrau\nBrigachtal\n\nDen Gläubigern der an der Ausgliederung beteiligten Rechtsträger ist, wenn sie binnen sechs Monaten nach dem Tag, an dem die Eintragung der Ausgliederung in das Register des Sitzes desjenigen Rechtsträgers, dessen Gläubiger sie sind, nach § 19 Abs. 3 UmwG als bekanntgemacht gilt, ihren Anspruch nach Grund und Höhe schriftlich anmelden, Sicherheit zu leisten, soweit sie nicht Befriedigung verlangen können. Dieses Recht steht den Gläubigern jedoch nur zu, wenn sie glaubhaft machen, dass durch die Ausgliederung die Erfüllung ihrer Forderung gefährdet wird."
    },
    {
      "date": "2025-06-12",
      "id": "111958",
      "original_text": "Registerbekanntmachung nach dem Umwandlungsgesetz\nBerlin Amtsgericht Berlin (Charlottenburg) HRA 64189\nTangaroa Holding GmbH & Co. KG – Berlin",
      "type": "Registerbekanntmachung nach dem Umwandlungsgesetz",
      "state": "Berlin",
      "amtsgericht": "Amtsgericht Berlin (Charlottenburg)",
      "registernummer": "HRA 64189",
      "registerart": "HRA",
      "company_name": "Tangaroa Holding GmbH & Co. KG",
      "company_seat": "Berlin",
      "details": "12.06.2025 (Bekanntmachungsdatum)\n\nBerlin Amtsgericht Berlin (Charlottenburg) HRA 64189\nRegisterbekanntmachung nach dem Umwandlungsgesetz 11.06.2025 (Eintragungsdatum)\n\nTangaroa Holding GmbH & Co. KG\nKommanditgesellschaft\nBerlin\n\nZu Eintragungsnummer 3 vom 11.06.2025 wird als nicht eingetragen veröffentlicht:\nDen Gläubigern der an der Spaltung beteiligten Rechtsträger ist, wenn sie binnen sechs Monaten nach dem Tag, an dem die Eintragung der Spaltung in das Register des Sitzes desjenigen Rechtsträgers, dessen Gläubiger sie sind, als bekannt gemacht gilt, ihren Anspruch nach Grund und Höhe schriftlich anmelden, Sicherheit zu leisten, soweit sie nicht Befriedigung verlangen können. Dieses Recht steht den Gläubigern jedoch nur zu, wenn sie glaubhaft machen, dass durch die Spaltung die Erfüllung ihrer Forderung gefährdet wird. Das Recht, Sicherheitsleistung zu verlangen, steht Gläubigern nicht zu, die im Falle der Insolvenz ein Recht auf vorzugsweise Befriedigung aus einer Deckungsmasse haben, die nach gesetzlicher Vorschrift zu ihrem Schutz errichtet und staatlich überwacht ist."
    },
    {
      "date": "2025-06-12",
      "id": "111959",
      "original_text": "Sonstige Registerbekanntmachung\nBerlin Amtsgericht Berlin (Charlottenburg) HRB 121803\nDeutsche Real Estate Aktiengesellschaft – Berlin",
      "type": "Sonstige Registerbekanntmachung",
      "state": "Berlin",
      "amtsgericht": "Amtsgericht Berlin (Charlottenburg)",
      "registernummer": "HRB 121803",
      "registerart": "HRB",
      "company_name": "Deutsche Real Estate Aktiengesellschaft",
      "company_seat": "Berlin",
      "details": "12.06.2025 (Bekanntmachungsdatum)\n\nBerlin Amtsgericht Berlin (Charlottenburg) HRB 121803\nSonstige Registerbekanntmachung\n\nDeutsche Real Estate Aktiengesellschaft\nAktiengesellschaft\nBerlin\n\nAls nicht eingetragen wird veröffentlicht: Es wurde eine neue Liste der Aufsichtsratsmitglieder eingereicht (§ 106 AktG)."
    },
    {
      "date": "2025-06-12",
      "id": "111960",
      "original_text": "Löschungsankündigung\nBrandenburg Amtsgericht Potsdam HRB 20565\nGreen 18. GmbH – Kloster Lehnin",
      "type": "Löschungsankündigung",
      "state": "Brandenburg",
      "amtsgericht": "Amtsgericht Potsdam",
      "registernummer": "HRB 20565",
      "registerart": "HRB",
      "company_name": "Green 18. GmbH",
      "company_seat": "Kloster Lehnin",
      "details": "12.06.2025 (Bekanntmachungsdatum)\n\nBrandenburg Amtsgericht Potsdam HRB 20565\nLöschungsankündigung\n\nGreen 18. GmbH\nGesellschaft mit beschränkter Haftung\nKloster Lehnin\n\nBei der nachstehenden Gesellschaft wird das Amtslöschungsverfahren gemäß § 394 FamFG eingeleitet."
    },
    {
      "date": "2025-06-12",
      "id": "111961",
      "original_text": "Registerbekanntmachung nach dem Umwandlungsgesetz\nBaden-Württemberg Amtsgericht Stuttgart HRB 799536\nInfoniqa Group Holding GmbH – Böblingen",
      "type": "Registerbekanntmachung nach dem Umwandlungsgesetz",
      "state": "Baden-Württemberg",
      "amtsgericht": "Amtsgericht Stuttgart",
      "registernummer": "HRB 799536",
      "registerart": "HRB",
      "company_name": "Infoniqa Group Holding GmbH",
      "company_seat": "Böblingen",
      "details": "12.06.2025 (Bekanntmachungsdatum)\n\nBaden-Württemberg Amtsgericht Stuttgart HRB 799536\nRegisterbekanntmachung nach dem Umwandlungsgesetz 12.06.2025 (Eintragungsdatum)\n\nInfoniqa Group Holding GmbH\nGesellschaft mit beschränkter Haftung\nBöblingen\n\nDen Gläubigern der an der Verschmelzung beteiligten Rechtsträger ist, wenn sie binnen sechs Monaten nach dem Tag, an dem die Eintragung der Verschmelzung in das Register des Sitzes desjenigen Rechtsträgers, dessen Gläubiger sie sind, nach § 19 Abs. 3 UmwG als bekanntgemacht gilt, ihren Anspruch nach Grund und Höhe schriftlich anmelden, Sicherheit zu leisten, soweit sie nicht Befriedigung verlangen können. Dieses Recht steht den Gläubigern jedoch nur zu, wenn sie glaubhaft machen, dass durch die Verschmelzung die Erfüllung ihrer Forderung gefährdet wird."
    },
    {
      "date": "2025-06-12",
      "id": "111962",
      "original_text": "Sonstige Registerbekanntmachung\nBaden-Württemberg Amtsgericht Ulm HRB 4276\nartiso AG – Blaustein",
      "type": "Sonstige Registerbekanntmachung",
      "state": "Baden-Württemberg",
      "amtsgericht": "Amtsgericht Ulm",
      "registernummer": "HRB 4276",
      "registerart": "HRB",
      "company_name": "artiso AG",
      "company_seat": "Blaustein",
      "details": "12.06.2025 (Bekanntmachungsdatum)\n\nBaden-Württemberg Amtsgericht Ulm HRB 4276\nSonstige Registerbekanntmachung\n\nartiso AG\nAktiengesellschaft\nBlaustein\n\nDie Gesellschaft hat am 11.06.2025 die Liste über die Zusammensetzung des Aufsichtsrats zum Handelsregister eingereicht."
    },
    {
      "date": "2025-06-12",
      "id": "111963",
      "original_text": "Registerbekanntmachung nach dem Umwandlungsgesetz\nSchleswig-Holstein Amtsgericht Lübeck HRA 11491\nWindkraft Presen-Burgstaaken GmbH & Co. KG – Fehmarn",
      "type": "Registerbekanntmachung nach dem Umwandlungsgesetz",
      "state": "Schleswig-Holstein",
      "amtsgericht": "Amtsgericht Lübeck",
      "registernummer": "HRA 11491",
      "registerart": "HRA",
      "company_name": "Windkraft Presen-Burgstaaken GmbH & Co. KG",
      "company_seat": "Fehmarn",
      "details": "12.06.2025 (Bekanntmachungsdatum)\n\nSchleswig-Holstein Amtsgericht Lübeck HRA 11491\nRegisterbekanntmachung nach dem Umwandlungsgesetz 11.06.2025 (Eintragungsdatum)\n\nWindkraft Presen-Burgstaaken GmbH & Co. KG\nKommanditgesellschaft\nFehmarn\n\nZu Eintragungsnummer 1 vom 11.06.2025 wird als nicht eingetragen veröffentlicht: Den Gläubigern ist, wenn sie binnen sechs Monaten nach dem Tag, an dem die Eintragung der Umwandlung als bekannt gemacht gilt, ihren Anspruch nach Grund und Höhe schriftlich anmelden, Sicherheit zu leisten, soweit sie nicht Befriedigung verlangen können. Dieses Recht steht den Gläubigern jedoch nur zu, wenn sie glaubhaft machen, dass durch die Umwandlung die Erfüllung ihrer Forderung gefährdet wird."
    },
    {
      "date": "2025-06-12",
      "id": "111964",
      "original_text": "Löschungsankündigung\nBerlin Amtsgericht Berlin (Charlottenburg) HRB 202744\nVitus Facility GmbH – Berlin",
      "type": "Löschungsankündigung",
      "state": "Berlin",
      "amtsgericht": "Amtsgericht Berlin (Charlottenburg)",
      "registernummer": "HRB 202744",
      "registerart": "HRB",
      "company_name": "Vitus Facility GmbH",
      "company_seat": "Berlin",
      "details": "12.06.2025 (Bekanntmachungsdatum)\n\nBerlin Amtsgericht Berlin (Charlottenburg) HRB 202744\nLöschungsankündigung\n\nVitus Facility GmbH\nGesellschaft mit beschränkter Haftung\nBerlin\n\nBei der nachstehenden Gesellschaft wird das Amtslöschungsverfahren gemäß § 394 FamFG eingeleitet. Widerspruchsfrist 6 Wochen"
    },
    {
      "date": "2025-06-12",
      "id": "111965",
      "original_text": "Löschungsankündigung\nBaden-Württemberg Amtsgericht Ulm HRB 733729\nBal GmbH – Ravensburg",
      "type": "Löschungsankündigung",
      "state": "Baden-Württemberg",
      "amtsgericht": "Amtsgericht Ulm",
      "registernummer": "HRB 733729",
      "registerart": "HRB",
      "company_name": "Bal GmbH",
      "company_seat": "Ravensburg",
      "details": "12.06.2025 (Bekanntmachungsdatum)\n\nBaden-Württemberg Amtsgericht Ulm HRB 733729\nLöschungsankündigung\n\nBal GmbH\nGesellschaft mit beschränkter Haftung\nRavensburg\n\nDas Gericht beabsichtigt, die Gesellschaft wegen Vermögenslosigkeit im Handelsregister von Amts wegen nach § 394 FamFG zu löschen. Die Frist zur Geltendmachung eines Widerspruchs gegen die beabsichtigte Löschung ist auf  einen Monat ab Veröffentlichung bestimmt."
    },
    {
      "date": "2025-06-12",
      "id": "111966",
      "original_text": "Registerbekanntmachung nach dem Umwandlungsgesetz\nSaarland Amtsgericht Saarbrücken HRA 9799\nMeprovision GmbH & Co. KG – Dillingen/Saar",
      "type": "Registerbekanntmachung nach dem Umwandlungsgesetz",
      "state": "Saarland",
      "amtsgericht": "Amtsgericht Saarbrücken",
      "registernummer": "HRA 9799",
      "registerart": "HRA",
      "company_name": "Meprovision GmbH & Co. KG",
      "company_seat": "Dillingen/Saar",
      "details": "12.06.2025 (Bekanntmachungsdatum)\n\nSaarland Amtsgericht Saarbrücken HRA 9799\nRegisterbekanntmachung nach dem Umwandlungsgesetz 12.06.2025 (Eintragungsdatum)\n\nMeprovision GmbH & Co. KG\nKommanditgesellschaft\nDillingen/Saar\n\nAls nicht eingetragen wird bekannt gemacht: Den Gläubigern der am Formwechsel beteiligten Gesellschaften ist, wenn sie binnen sechs Monaten nach dem Tag, an dem die Eintragung des Formwechsels in das Register des Sitzes desjenigen Rechtsträgers, dessen Gläubiger sie sind, nach § 19 Absatz 3 UmwG bekannt gemacht worden ist, ihren Anspruch nach Grund und Höhe schriftlich anmelden, Sicherheit zu leisten, soweit sie nicht Befriedigung verlangen können. Dieses Recht steht den Gläubigern jedoch nur zu, wenn sie glaubhaft machen, dass durch den Formwechsel die Erfüllung ihrer Forderung gefährdet wird."
    },
    {
      "date": "2025-06-12",
      "id": "111967",
      "original_text": "Registerbekanntmachung nach dem Umwandlungsgesetz\nBrandenburg Amtsgericht Frankfurt/Oder HRB 21577\nPutzteufel Nord GmbH – Ahrensfelde",
      "type": "Registerbekanntmachung nach dem Umwandlungsgesetz",
      "state": "Brandenburg",
      "amtsgericht": "Amtsgericht Frankfurt/Oder",
      "registernummer": "HRB 21577",
      "registerart": "HRB",
      "company_name": "Putzteufel Nord GmbH",
      "company_seat": "Ahrensfelde",
      "details": "12.06.2025 (Bekanntmachungsdatum)\n\nBrandenburg Amtsgericht Frankfurt/Oder HRB 21577\nRegisterbekanntmachung nach dem Umwandlungsgesetz 11.06.2025 (Eintragungsdatum)\n\nPutzteufel Nord GmbH\nGesellschaft mit beschränkter Haftung\nAhrensfelde\n\nZu Eintragungsnummer 1 vom 11.06.2025 wird als nicht eingetragen veröffentlicht:\nDen Gläubigern der an der Umwandlung beteiligten Rechtsträger ist, wenn sie binnen sechs Monaten nach dem Tag, an dem die Eintragung der Umwandlung in das Register des Sitzes desjenigen Rechtsträgers, dessen Gläubiger sie sind, als bekannt gemacht gilt, ihren Anspruch nach Grund und Höhe schriftlich anmelden, Sicherheit zu leisten, soweit sie nicht Befriedigung verlangen können. Dieses Recht steht den Gläubigern jedoch nur zu, wenn sie glaubhaft machen, dass durch die Umwandlung die Erfüllung ihrer Forderung gefährdet wird."
    },
    {
      "date": "2025-06-12",
      "id": "111968",
      "original_text": "Registerbekanntmachung nach dem Umwandlungsgesetz\nBrandenburg Amtsgericht Potsdam HRB 38780\ne-bike Potsdam BüTy GmbH – Potsdam",
      "type": "Registerbekanntmachung nach dem Umwandlungsgesetz",
      "state": "Brandenburg",
      "amtsgericht": "Amtsgericht Potsdam",
      "registernummer": "HRB 38780",
      "registerart": "HRB",
      "company_name": "e-bike Potsdam BüTy GmbH",
      "company_seat": "Potsdam",
      "details": "12.06.2025 (Bekanntmachungsdatum)\n\nBrandenburg Amtsgericht Potsdam HRB 38780\nRegisterbekanntmachung nach dem Umwandlungsgesetz 11.06.2025 (Eintragungsdatum)\n\ne-bike Potsdam BüTy GmbH\nGesellschaft mit beschränkter Haftung\nPotsdam\n\nZu Eintragungsnummer 3 vom 11.06.2025 wird als nicht eingetragen veröffentlicht: Den Gläubigern der an der Verschmelzung beteiligten Rechtsträger ist, wenn sie binnen sechs Monaten nach dem Tag, an dem die Eintragung der Verschmelzung in das Register des Sitzes desjenigen Rechtsträgers, dessen Gläubiger sie sind, als bekannt gemacht gilt, ihren Anspruch nach Grund und Höhe schriftlich anmelden, Sicherheit zu leisten, soweit sie nicht Befriedigung verlangen können. Dieses Recht steht den Gläubigern jedoch nur zu, wenn sie glaubhaft machen, dass durch die Verschmelzung die Erfüllung ihrer Forderung gefährdet wird"
    },
    {
      "date": "2025-06-12",
      "id": "111969",
      "original_text": "Registerbekanntmachung nach dem Umwandlungsgesetz\nBaden-Württemberg Amtsgericht Ulm HRB 501555\nCarl Zeiss AG – Oberkochen",
      "type": "Registerbekanntmachung nach dem Umwandlungsgesetz",
      "state": "Baden-Württemberg",
      "amtsgericht": "Amtsgericht Ulm",
      "registernummer": "HRB 501555",
      "registerart": "HRB",
      "company_name": "Carl Zeiss AG",
      "company_seat": "Oberkochen",
      "details": "12.06.2025 (Bekanntmachungsdatum)\n\nBaden-Württemberg Amtsgericht Ulm HRB 501555\nRegisterbekanntmachung nach dem Umwandlungsgesetz 12.06.2025 (Eintragungsdatum)\n\nCarl Zeiss AG\nAktiengesellschaft\nOberkochen\n\nAls nicht eingetragen wird bekanntgemacht:\nDen Gläubigern der an der Abspaltung beteiligten Rechtsträger ist, wenn sie binnen sechs Monaten nach dem Tag, an dem die Eintragung der Abspaltung in das Register des Sitzes desjenigen Rechtsträgers, dessen Gläubiger sie sind, nach § 19 Abs. 3 UmwG als bekanntgemacht gilt, ihren Anspruch nach Grund und Höhe schriftlich anmelden, Sicherheit zu leisten, soweit sie nicht Befriedigung verlangen können. Dieses Recht steht den Gläubigern jedoch nur zu, wenn sie glaubhaft machen, dass durch die Abspaltung die Erfüllung ihrer Forderung gefährdet wird."
    },
    {
      "date": "2025-06-12",
      "id": "111970",
      "original_text": "Registerbekanntmachung nach dem Umwandlungsgesetz\nBaden-Württemberg Amtsgericht Ulm HRB 501572\nCarl Zeiss IQR GmbH – Oberkochen",
      "type": "Registerbekanntmachung nach dem Umwandlungsgesetz",
      "state": "Baden-Württemberg",
      "amtsgericht": "Amtsgericht Ulm",
      "registernummer": "HRB 501572",
      "registerart": "HRB",
      "company_name": "Carl Zeiss IQR GmbH",
      "company_seat": "Oberkochen",
      "details": "12.06.2025 (Bekanntmachungsdatum)\n\nBaden-Württemberg Amtsgericht Ulm HRB 501572\nRegisterbekanntmachung nach dem Umwandlungsgesetz 12.06.2025 (Eintragungsdatum)\n\nCarl Zeiss IQR GmbH\nGesellschaft mit beschränkter Haftung\nOberkochen\n\nAls nicht eingetragen wird bekanntgemacht:\nDen Gläubigern der an der Abspaltung beteiligten Rechtsträger ist, wenn sie binnen sechs Monaten nach dem Tag, an dem die Eintragung der Abspaltung in das Register des Sitzes desjenigen Rechtsträgers, dessen Gläubiger sie sind, nach § 19 Abs. 3 UmwG als bekanntgemacht gilt, ihren Anspruch nach Grund und Höhe schriftlich anmelden, Sicherheit zu leisten, soweit sie nicht Befriedigung verlangen können. Dieses Recht steht den Gläubigern jedoch nur zu, wenn sie glaubhaft machen, dass durch die Abspaltung die Erfüllung ihrer Forderung gefährdet wird."
    },
    {
      "date": "2025-06-12",
      "id": "111971",
      "original_text": "Einreichung neuer Dokumente\nHamburg Amtsgericht Hamburg HRB 77668\nH L S Hamburger Logistik Service GmbH – Hamburg",
      "type": "Einreichung neuer Dokumente",
      "state": "Hamburg",
      "amtsgericht": "Amtsgericht Hamburg",
      "registernummer": "HRB 77668",
      "registerart": "HRB",
      "company_name": "H L S Hamburger Logistik Service GmbH",
      "company_seat": "Hamburg",
      "details": "12.06.2025 (Bekanntmachungsdatum)\n\nHamburg Amtsgericht Hamburg HRB 77668\nEinreichung neuer Dokumente\n\nH L S Hamburger Logistik Service GmbH\nGesellschaft mit beschränkter Haftung\nHamburg\n\nAls nicht eingetragen wird bekannt gemacht: Liste des Aufsichtsrats wurde eingereicht."
    },
    {
      "date": "2025-06-12",
      "id": "111972",
      "original_text": "Sonstige Registerbekanntmachung\nBrandenburg Amtsgericht Neuruppin GnR 28\nWohnungsgenossenschaft Prenzlau eG – Prenzlau",
      "type": "Sonstige Registerbekanntmachung",
      "state": "Brandenburg",
      "amtsgericht": "Amtsgericht Neuruppin",
      "registernummer": "GnR 28",
      "registerart": "GnR",
      "company_name": "Wohnungsgenossenschaft Prenzlau eG",
      "company_seat": "Prenzlau",
      "details": "12.06.2025 (Bekanntmachungsdatum)\n\nBrandenburg Amtsgericht Neuruppin GnR 28\nSonstige Registerbekanntmachung\n\nWohnungsgenossenschaft Prenzlau eG\neingetragene Genossenschaft\nPrenzlau\n\nAls nicht eingetragen wird veröffentlicht: Die Genossenschaft hat in der Mitgliederversammlung am 25.06.2024 die Änderung der Satzung u.a. des § 17 (1) wie folgt beschlossen: Der Geschäftsanteil beträgt 50,00 EUR. Gläubigern, deren Forderungen begründet worden sind, bevor die Eintragung des Beschlusses als nach § 10 des Handelsgesetzbuches bekannt gemacht gilt, ist, wenn sie sich binnen sechs Monaten nach der Bekanntmachung zu diesem Zweck melden, Sicherheit zu leisten, soweit sie nicht Befriedigung verlangen können. Dieses Recht steht den Gläubigern nicht zu, die im Fall des Insolvenzverfahrens ein Recht auf vorzugsweise Befriedigung aus der Deckungsmasse haben, die nach gesetzlicher Vorschrift zu ihrem Schutz errichtet und staatlich überwacht ist."
    },
    {
      "date": "2025-06-12",
      "id": "111973",
      "original_text": "Löschungsankündigung\nBaden-Württemberg Amtsgericht Stuttgart HRB 762487\nStrong Plus Technology GmbH – Stuttgart",
      "type": "Löschungsankündigung",
      "state": "Baden-Württemberg",
      "amtsgericht": "Amtsgericht Stuttgart",
      "registernummer": "HRB 762487",
      "registerart": "HRB",
      "company_name": "Strong Plus Technology GmbH",
      "company_seat": "Stuttgart",
      "details": "12.06.2025 (Bekanntmachungsdatum)\n\nBaden-Württemberg Amtsgericht Stuttgart HRB 762487\nLöschungsankündigung\n\nStrong Plus Technology GmbH\nGesellschaft mit beschränkter Haftung\nStuttgart\n\nDas Gericht beabsichtigt, die Gesellschaft wegen Vermögenslosigkeit im Handelsregister von Amts wegen nach § 394 FamFG zu löschen. Die Frist zur Geltendmachung eines Widerspruchs gegen die beabsichtigte Löschung ist auf zwei Monate ab Veröffentlichung bestimmt."
    },
    {
      "date": "2025-06-12",
      "id": "111974",
      "original_text": "Löschungsankündigung\nBrandenburg Amtsgericht Potsdam HRB 1362\nBio-Verwertungs GmbH Schwanebeck – Schwanebeck",
      "type": "Löschungsankündigung",
      "state": "Brandenburg",
      "amtsgericht": "Amtsgericht Potsdam",
      "registernummer": "HRB 1362",
      "registerart": "HRB",
      "company_name": "Bio-Verwertungs GmbH Schwanebeck",
      "company_seat": "Schwanebeck",
      "details": "12.06.2025 (Bekanntmachungsdatum)\n\nBrandenburg Amtsgericht Potsdam HRB 1362\nLöschungsankündigung\n\nBio-Verwertungs GmbH Schwanebeck\nGesellschaft mit beschränkter Haftung\nSchwanebeck\n\nBei der nachstehenden Gesellschaft wird das Amtslöschungsverfahren gemäß § 394 FamFG eingeleitet. Widerspruchsfrist: 8 Wochen"
    },
    {
      "date": "2025-06-12",
      "id": "111975",
      "original_text": "Löschungsankündigung\nBrandenburg Amtsgericht Potsdam HRB 25194\nBSK - der Mobile Computerservice Unternehmergesellschaft (haftungsbeschränkt) – Stahnsdorf",
      "type": "Löschungsankündigung",
      "state": "Brandenburg",
      "amtsgericht": "Amtsgericht Potsdam",
      "registernummer": "HRB 25194",
      "registerart": "HRB",
      "company_name": "BSK - der Mobile Computerservice Unternehmergesellschaft (haftungsbeschränkt)",
      "company_seat": "Stahnsdorf",
      "details": "12.06.2025 (Bekanntmachungsdatum)\n\nBrandenburg Amtsgericht Potsdam HRB 25194\nLöschungsankündigung\n\nBSK - der Mobile Computerservice Unternehmergesellschaft (haftungsbeschränkt)\nGesellschaft mit beschränkter Haftung\nStahnsdorf\n\nBei der nachstehenden Gesellschaft wird das Amtslöschungsverfahren gemäß § 394 FamFG eingeleitet."
    },
    {
      "date": "2025-06-12",
      "id": "111976",
      "original_text": "Einreichung neuer Dokumente\nBrandenburg Amtsgericht Potsdam HRB 3064\nLBS Landesbausparkasse NordOst AG – Potsdam und Hamburg",
      "type": "Einreichung neuer Dokumente",
      "state": "Brandenburg",
      "amtsgericht": "Amtsgericht Potsdam",
      "registernummer": "HRB 3064",
      "registerart": "HRB",
      "company_name": "LBS Landesbausparkasse NordOst AG",
      "company_seat": "Potsdam und Hamburg",
      "details": "12.06.2025 (Bekanntmachungsdatum)\n\nBrandenburg Amtsgericht Potsdam HRB 3064\nEinreichung neuer Dokumente\n\nLBS Landesbausparkasse NordOst AG\nAktiengesellschaft\nPotsdam und Hamburg\n\nAls nicht eingetragen wird veröffentlicht: Eine Liste der Mitglieder des Aufsichtsrates wurde zum Handelsregister eingereicht."
    },
    {
      "date": "2025-06-12",
      "id": "111977",
      "original_text": "Löschungsankündigung\nBrandenburg Amtsgericht Frankfurt/Oder HRB 14146\nAKM Althüttendorfer Kraft- und Maschinenfahrservice UG (haftungsbeschränkt) – Althüttendorf",
      "type": "Löschungsankündigung",
      "state": "Brandenburg",
      "amtsgericht": "Amtsgericht Frankfurt/Oder",
      "registernummer": "HRB 14146",
      "registerart": "HRB",
      "company_name": "AKM Althüttendorfer Kraft- und Maschinenfahrservice UG (haftungsbeschränkt)",
      "company_seat": "Althüttendorf",
      "details": "12.06.2025 (Bekanntmachungsdatum)\n\nBrandenburg Amtsgericht Frankfurt/Oder HRB 14146\nLöschungsankündigung\n\nAKM Althüttendorfer Kraft- und Maschinenfahrservice UG (haftungsbeschränkt)\nGesellschaft mit beschränkter Haftung\nAlthüttendorf\n\nBei der nachstehenden Gesellschaft wird das Amtslöschungsverfahren gemäß § 394 Abs. 1 FamFG eingeleitet."
    },
    {
      "date": "2025-06-12",
      "id": "111978",
      "original_text": "Registerbekanntmachung nach dem Umwandlungsgesetz\nSachsen Amtsgericht Dresden HRB 12966\nNeu & Reko Bau Glotz GmbH – Niesky",
      "type": "Registerbekanntmachung nach dem Umwandlungsgesetz",
      "state": "Sachsen",
      "amtsgericht": "Amtsgericht Dresden",
      "registernummer": "HRB 12966",
      "registerart": "HRB",
      "company_name": "Neu & Reko Bau Glotz GmbH",
      "company_seat": "Niesky",
      "details": "12.06.2025 (Bekanntmachungsdatum)\n\nSachsen Amtsgericht Dresden HRB 12966\nRegisterbekanntmachung nach dem Umwandlungsgesetz 12.06.2025 (Eintragungsdatum)\n\nNeu & Reko Bau Glotz GmbH\nGesellschaft mit beschränkter Haftung\nNiesky\n\nDen Gläubigern der an der Verschmelzung beteiligten Rechtsträger ist, wenn sie binnen sechs Monaten nach dem Tag, an dem die Eintragung der Verschmelzung in das Register des Sitzes desjenigen Rechtsträgers, dessen Gläubiger sie sind, nach § 19 Abs. 3 UmwG als bekannt gemacht gilt, ihren Anspruch nach Grund und Höhe in Textform anmelden, Sicherheit zu leisten, soweit sie nicht Befriedigung verlangen können. Dieses Recht steht den Gläubigern jedoch nur zu, wenn sie glaubhaft machen, dass durch die Verschmelzung die Erfüllung der Forderung gefährdet wird."
    },
    {
      "date": "2025-06-12",
      "id": "111979",
      "original_text": "Einreichung neuer Dokumente\nSachsen Amtsgericht Dresden HRB 2422\nTechnische Werke Dresden GmbH – Dresden",
      "type": "Einreichung neuer Dokumente",
      "state": "Sachsen",
      "amtsgericht": "Amtsgericht Dresden",
      "registernummer": "HRB 2422",
      "registerart": "HRB",
      "company_name": "Technische Werke Dresden GmbH",
      "company_seat": "Dresden",
      "details": "12.06.2025 (Bekanntmachungsdatum)\n\nSachsen Amtsgericht Dresden HRB 2422\nEinreichung neuer Dokumente\n\nTechnische Werke Dresden GmbH\nGesellschaft mit beschränkter Haftung\nDresden\n\nAm 11.06.2025 wurde beim Handelsregister des Amtsgerichts Dresden die Liste der Mitglieder des Aufsichtsrats gemäß § 52 GmbHG eingereicht."
    },
    {
      "date": "2025-06-12",
      "id": "111980",
      "original_text": "Einreichung neuer Dokumente\nSachsen Amtsgericht Dresden HRB 965\nSachsenEnergie AG – Dresden",
      "type": "Einreichung neuer Dokumente",
      "state": "Sachsen",
      "amtsgericht": "Amtsgericht Dresden",
      "registernummer": "HRB 965",
      "registerart": "HRB",
      "company_name": "SachsenEnergie AG",
      "company_seat": "Dresden",
      "details": "12.06.2025 (Bekanntmachungsdatum)\n\nSachsen Amtsgericht Dresden HRB 965\nEinreichung neuer Dokumente 12.06.2025 (Eintragungsdatum)\n\nSachsenEnergie AG\nAktiengesellschaft\nDresden\n\nAm 11.06.2025 wurde beim Handelsregister des Amtsgerichts Dresden die Liste der Mitglieder des Aufsichtsrats gemäß § 106 AktG eingereicht."
    },
    {
      "date": "2025-06-12",
      "id": "111981",
      "original_text": "Einreichung neuer Dokumente\nSachsen Amtsgericht Leipzig HRB 16377\nPorsche Leipzig GmbH – Leipzig",
      "type": "Einreichung neuer Dokumente",
      "state": "Sachsen",
      "amtsgericht": "Amtsgericht Leipzig",
      "registernummer": "HRB 16377",
      "registerart": "HRB",
      "company_name": "Porsche Leipzig GmbH",
      "company_seat": "Leipzig",
      "details": "12.06.2025 (Bekanntmachungsdatum)\n\nSachsen Amtsgericht Leipzig HRB 16377\nEinreichung neuer Dokumente\n\nPorsche Leipzig GmbH\nGesellschaft mit beschränkter Haftung\nLeipzig\n\nAm 10.06.2025 wurde beim Handelsregister des Amtsgerichts Leipzig die Liste der Mitglieder des Aufsichtsrats gemäß § 52 GmbHG eingereicht."
    },
    {
      "date": "2025-06-12",
      "id": "111982",
      "original_text": "Löschungsankündigung\nSachsen Amtsgericht Dresden HRB 31558\nSomlex Handels GmbH – Dresden",
      "type": "Löschungsankündigung",
      "state": "Sachsen",
      "amtsgericht": "Amtsgericht Dresden",
      "registernummer": "HRB 31558",
      "registerart": "HRB",
      "company_name": "Somlex Handels GmbH",
      "company_seat": "Dresden",
      "details": "12.06.2025 (Bekanntmachungsdatum)\n\nSachsen Amtsgericht Dresden HRB 31558\nLöschungsankündigung\n\nSomlex Handels GmbH\nGesellschaft mit beschränkter Haftung\nDresden\n\nDas Registergericht beabsichtigt, die im Handelsregister eingetragene Gesellschaft von Amts wegen nach § 394 FamFG zu löschen. Die Frist zu Erhebung eines Widerspruchs gegen die beabsichtigte Löschung wird auf einen Monat festgesetzt."
    },
    {
      "date": "2025-06-12",
      "id": "111983",
      "original_text": "Registerbekanntmachung nach dem Umwandlungsgesetz\nSachsen Amtsgericht Dresden HRB 21688\nNYLA Neu & Reko Bau Gesellschaft mbH – Niesky",
      "type": "Registerbekanntmachung nach dem Umwandlungsgesetz",
      "state": "Sachsen",
      "amtsgericht": "Amtsgericht Dresden",
      "registernummer": "HRB 21688",
      "registerart": "HRB",
      "company_name": "NYLA Neu & Reko Bau Gesellschaft mbH",
      "company_seat": "Niesky",
      "details": "12.06.2025 (Bekanntmachungsdatum)\n\nSachsen Amtsgericht Dresden HRB 21688\nRegisterbekanntmachung nach dem Umwandlungsgesetz 12.06.2025 (Eintragungsdatum)\n\nNYLA Neu & Reko Bau Gesellschaft mbH\nGesellschaft mit beschränkter Haftung\nNiesky\n\nDen Gläubigern der an der Verschmelzung beteiligten Rechtsträger ist, wenn sie binnen sechs Monaten nach dem Tag, an dem die Eintragung der Verschmelzung in das Register des Sitzes desjenigen Rechtsträgers, dessen Gläubiger sie sind, nach § 19 Abs. 3 UmwG als bekannt gemacht gilt, ihren Anspruch nach Grund und Höhe in Textform anmelden, Sicherheit zu leisten, soweit sie nicht Befriedigung verlangen können. Dieses Recht steht den Gläubigern jedoch nur zu, wenn sie glaubhaft machen, dass durch die Verschmelzung die Erfüllung der Forderung gefährdet wird."
    },
    {
      "date": "2025-06-12",
      "id": "111984",
      "original_text": "Registerbekanntmachung nach dem Umwandlungsgesetz\nSachsen Amtsgericht Dresden HRB 46669\nFrank Strobel GmbH – Dresden",
      "type": "Registerbekanntmachung nach dem Umwandlungsgesetz",
      "state": "Sachsen",
      "amtsgericht": "Amtsgericht Dresden",
      "registernummer": "HRB 46669",
      "registerart": "HRB",
      "company_name": "Frank Strobel GmbH",
      "company_seat": "Dresden",
      "details": "12.06.2025 (Bekanntmachungsdatum)\n\nSachsen Amtsgericht Dresden HRB 46669\nRegisterbekanntmachung nach dem Umwandlungsgesetz 12.06.2025 (Eintragungsdatum)\n\nFrank Strobel GmbH\nGesellschaft mit beschränkter Haftung\nDresden\n\nDen Gläubigern der an der Verschmelzung beteiligten Rechtsträger ist, wenn sie binnen sechs Monaten nach dem Tag, an dem die Eintragung der Verschmelzung in das Register des Sitzes desjenigen Rechtsträgers, dessen Gläubiger sie sind, nach § 19 Abs. 3 UmwG als bekannt gemacht gilt, ihren Anspruch nach Grund und Höhe in Textform anmelden, Sicherheit zu leisten, soweit sie nicht Befriedigung verlangen können. Dieses Recht steht den Gläubigern jedoch nur zu, wenn sie glaubhaft machen, dass durch die Verschmelzung die Erfüllung der Forderung gefährdet wird."
    },
    {
      "date": "2025-06-12",
      "id": "111985",
      "original_text": "Einreichung neuer Dokumente\nSachsen Amtsgericht Dresden HRB 28822\nEnergieVerbund Dresden GmbH – Dresden",
      "type": "Einreichung neuer Dokumente",
      "state": "Sachsen",
      "amtsgericht": "Amtsgericht Dresden",
      "registernummer": "HRB 28822",
      "registerart": "HRB",
      "company_name": "EnergieVerbund Dresden GmbH",
      "company_seat": "Dresden",
      "details": "12.06.2025 (Bekanntmachungsdatum)\n\nSachsen Amtsgericht Dresden HRB 28822\nEinreichung neuer Dokumente\n\nEnergieVerbund Dresden GmbH\nGesellschaft mit beschränkter Haftung\nDresden\n\nAm 11.06.2025 wurde beim Handelsregister des Amtsgerichts Dresden die Liste der Mitglieder des Aufsichtsrats gemäß § 52 GmbHG eingereicht."
    },
    {
      "date": "2025-06-12",
      "id": "111986",
      "original_text": "Registerbekanntmachung nach dem Umwandlungsgesetz\nSachsen Amtsgericht Dresden HRA 12141\nHV (Handelsvertretung) Frank Strobel e.K. – Dresden",
      "type": "Registerbekanntmachung nach dem Umwandlungsgesetz",
      "state": "Sachsen",
      "amtsgericht": "Amtsgericht Dresden",
      "registernummer": "HRA 12141",
      "registerart": "HRA",
      "company_name": "HV (Handelsvertretung) Frank Strobel e.K.",
      "company_seat": "Dresden",
      "details": "12.06.2025 (Bekanntmachungsdatum)\n\nSachsen Amtsgericht Dresden HRA 12141\nRegisterbekanntmachung nach dem Umwandlungsgesetz 12.06.2025 (Eintragungsdatum)\n\nHV (Handelsvertretung) Frank Strobel e.K.\nEinzelkaufmann / Einzelkauffrau\nDresden\n\nDen Gläubigern der an der Ausgliederung beteiligten Rechtsträger ist, wenn sie binnen sechs Monaten nach dem Tag, an dem die Eintragung der Ausgliederung in das Register des Sitzes desjenigen Rechtsträgers, dessen Gläubiger sie sind, nach § 19 Abs. 3 UmwG als bekannt gemacht gilt, ihren Anspruch nach Grund und Höhe in Textform anmelden, Sicherheit zu leisten, soweit sie nicht Befriedigung verlangen können. Dieses Recht steht den Gläubigern jedoch nur zu, wenn sie glaubhaft machen, dass durch die Ausgliederung die Erfüllung der Forderung gefährdet wird."
    },
    {
      "date": "2025-06-12",
      "id": "111987",
      "original_text": "Registerbekanntmachung nach dem Umwandlungsgesetz\nNiedersachsen Amtsgericht Hildesheim GsR 252\nEggers und Reichardt eGbR – Didderse",
      "type": "Registerbekanntmachung nach dem Umwandlungsgesetz",
      "state": "Niedersachsen",
      "amtsgericht": "Amtsgericht Hildesheim",
      "registernummer": "GsR 252",
      "registerart": "GsR",
      "company_name": "Eggers und Reichardt eGbR",
      "company_seat": "Didderse",
      "details": "12.06.2025 (Bekanntmachungsdatum)\n\nNiedersachsen Amtsgericht Hildesheim GsR 252\nRegisterbekanntmachung nach dem Umwandlungsgesetz 12.06.2025 (Eintragungsdatum)\n\nEggers und Reichardt eGbR\nGesellschaft bürgerlichen Rechts\nDidderse\n\nDen Gläubigern der an der formwechselnden Umwandlung beteiligten Rechtsträger ist, wenn sie binnen sechs Monaten nach dem Tag, an dem die Eintragung der Umwandlung in das Register des Sitzes desjenigen Rechtsträgers, dessen Gläubiger sie sind, nach § 19 Abs. 3 UmwG als bekannt gemacht gilt, ihren Anspruch nach Grund und Höhe schriftlich anmelden, Sicherheit zu leisten, soweit sie nicht Befriedigung verlangen können. Dieses Recht steht den Gläubigern jedoch nur zu, wenn sie glaubhaft machen, dass durch die formwechselnde Umwandlung die Erfüllung der Forderung gefährdet wird."
    },
    {
      "date": "2025-06-12",
      "id": "111988",
      "original_text": "Registerbekanntmachung nach dem Umwandlungsgesetz\nNiedersachsen Amtsgericht Hildesheim HRB 210112\nBricks & Stuff GmbH – Didderse",
      "type": "Registerbekanntmachung nach dem Umwandlungsgesetz",
      "state": "Niedersachsen",
      "amtsgericht": "Amtsgericht Hildesheim",
      "registernummer": "HRB 210112",
      "registerart": "HRB",
      "company_name": "Bricks & Stuff GmbH",
      "company_seat": "Didderse",
      "details": "12.06.2025 (Bekanntmachungsdatum)\n\nNiedersachsen Amtsgericht Hildesheim HRB 210112\nRegisterbekanntmachung nach dem Umwandlungsgesetz 12.06.2025 (Eintragungsdatum)\n\nBricks & Stuff GmbH\nGesellschaft mit beschränkter Haftung\nDidderse\n\nDen Gläubigern der an der formwechselnden Umwandlung beteiligten Rechtsträger ist, wenn sie binnen sechs Monaten nach dem Tag, an dem die Eintragung der Umwandlung in das Register des Sitzes desjenigen Rechtsträgers, dessen Gläubiger sie sind, nach § 19 Abs. 3 UmwG als bekannt gemacht gilt, ihren Anspruch nach Grund und Höhe schriftlich anmelden, Sicherheit zu leisten, soweit sie nicht Befriedigung verlangen können. Dieses Recht steht den Gläubigern jedoch nur zu, wenn sie glaubhaft machen, dass durch die formwechselnde Umwandlung die Erfüllung der Forderung gefährdet wird."
    },
    {
      "date": "2025-06-12",
      "id": "111989",
      "original_text": "Einreichung neuer Dokumente\nNiedersachsen Amtsgericht Oldenburg (Oldenburg) HRB 216654\nThornar AG – Ovelgönne",
      "type": "Einreichung neuer Dokumente",
      "state": "Niedersachsen",
      "amtsgericht": "Amtsgericht Oldenburg (Oldenburg)",
      "registernummer": "HRB 216654",
      "registerart": "HRB",
      "company_name": "Thornar AG",
      "company_seat": "Ovelgönne",
      "details": "12.06.2025 (Bekanntmachungsdatum)\n\nNiedersachsen Amtsgericht Oldenburg (Oldenburg) HRB 216654\nEinreichung neuer Dokumente\n\nThornar AG\nAktiengesellschaft\nOvelgönne\n\nDie Liste der Mitglieder des Aufsichtsrats wurde beim Registergericht eingereicht."
    },
    {
      "date": "2025-06-12",
      "id": "111990",
      "original_text": "Registerbekanntmachung nach dem Umwandlungsgesetz\nNiedersachsen Amtsgericht Göttingen HRB 102404\nEichsfelder Hausverwaltung Müller GmbH – Göttingen",
      "type": "Registerbekanntmachung nach dem Umwandlungsgesetz",
      "state": "Niedersachsen",
      "amtsgericht": "Amtsgericht Göttingen",
      "registernummer": "HRB 102404",
      "registerart": "HRB",
      "company_name": "Eichsfelder Hausverwaltung Müller GmbH",
      "company_seat": "Göttingen",
      "details": "12.06.2025 (Bekanntmachungsdatum)\n\nNiedersachsen Amtsgericht Göttingen HRB 102404\nRegisterbekanntmachung nach dem Umwandlungsgesetz 12.06.2025 (Eintragungsdatum)\n\nEichsfelder Hausverwaltung Müller GmbH\nGesellschaft mit beschränkter Haftung\nGöttingen\n\nDen Gläubigern der an der Verschmelzung beteiligten Rechtsträger ist, wenn sie binnen sechs Monaten nach dem Tag, an dem die Eintragung der Verschmelzung in das Register des Sitzes desjenigen Rechtsträgers, dessen Gläubiger sie sind, nach § 19  Abs.  3 UmwG als bekannt gemacht gilt, ihren Anspruch nach Grund und Höhe schriftlich anmelden, Sicherheit zu leisten, soweit sie nicht Befriedigung verlangen können. Dieses Recht steht den Gläubigern jedoch nur zu, wenn sie glaubhaft machen, dass durch die Verschmelzung die Erfüllung der Forderung gefährdet wird."
    },
    {
      "date": "2025-06-12",
      "id": "111991",
      "original_text": "Löschungsankündigung\nNiedersachsen Amtsgericht Osnabrück HRB 209305\nAutoreparaturen Götz GmbH – Osnabrück",
      "type": "Löschungsankündigung",
      "state": "Niedersachsen",
      "amtsgericht": "Amtsgericht Osnabrück",
      "registernummer": "HRB 209305",
      "registerart": "HRB",
      "company_name": "Autoreparaturen Götz GmbH",
      "company_seat": "Osnabrück",
      "details": "12.06.2025 (Bekanntmachungsdatum)\n\nNiedersachsen Amtsgericht Osnabrück HRB 209305\nLöschungsankündigung\n\nAutoreparaturen Götz GmbH\nGesellschaft mit beschränkter Haftung\nOsnabrück\n\nDas Registergericht beabsichtigt, die Gesellschaft von Amts wegen nach § 394 FamFG wegen Vermögenslosigkeit zu löschen. Die Frist zur Erhebung eines Widerspruchs ist auf 1 Monat ab dieser Registerbekanntmachung festgesetzt."
    },
    {
      "date": "2025-06-12",
      "id": "111992",
      "original_text": "Registerbekanntmachung nach dem Umwandlungsgesetz\nNiedersachsen Amtsgericht Osnabrück HRB 208782\nkfh Immobilien Management GmbH – Melle",
      "type": "Registerbekanntmachung nach dem Umwandlungsgesetz",
      "state": "Niedersachsen",
      "amtsgericht": "Amtsgericht Osnabrück",
      "registernummer": "HRB 208782",
      "registerart": "HRB",
      "company_name": "kfh Immobilien Management GmbH",
      "company_seat": "Melle",
      "details": "12.06.2025 (Bekanntmachungsdatum)\n\nNiedersachsen Amtsgericht Osnabrück HRB 208782\nRegisterbekanntmachung nach dem Umwandlungsgesetz 12.06.2025 (Eintragungsdatum)\n\nkfh Immobilien Management GmbH\nGesellschaft mit beschränkter Haftung\nMelle\n\nDen Gläubigern der an der Verschmelzung beteiligten Rechtsträger ist, wenn sie binnen sechs Monaten nach dem Tag, an dem die Eintragung der Verschmelzung in das Register des Sitzes desjenigen Rechtsträgers, dessen Gläubiger sie sind, nach § 19  Abs.  3 UmwG als bekannt gemacht gilt, ihren Anspruch nach Grund und Höhe schriftlich anmelden, Sicherheit zu leisten, soweit sie nicht Befriedigung verlangen können. Dieses Recht steht den Gläubigern jedoch nur zu, wenn sie glaubhaft machen, dass durch die Verschmelzung die Erfüllung der Forderung gefährdet wird."
    },
    {
      "date": "2025-06-12",
      "id": "111993",
      "original_text": "Löschungsankündigung\nNiedersachsen Amtsgericht Osnabrück HRB 215047\nAzol transport GmbH – Osnabrück",
      "type": "Löschungsankündigung",
      "state": "Niedersachsen",
      "amtsgericht": "Amtsgericht Osnabrück",
      "registernummer": "HRB 215047",
      "registerart": "HRB",
      "company_name": "Azol transport GmbH",
      "company_seat": "Osnabrück",
      "details": "12.06.2025 (Bekanntmachungsdatum)\n\nNiedersachsen Amtsgericht Osnabrück HRB 215047\nLöschungsankündigung\n\nAzol transport GmbH\nGesellschaft mit beschränkter Haftung\nOsnabrück\n\nDas Registergericht beabsichtigt, die Gesellschaft von Amts wegen nach § 394 FamFG wegen Vermögenslosigkeit zu löschen. Die Frist zur Erhebung eines Widerspruchs ist auf 1 Monat ab dieser Registerbekanntmachung festgesetzt."
    },
    {
      "date": "2025-06-12",
      "id": "111994",
      "original_text": "Registerbekanntmachung nach dem Umwandlungsgesetz\nBaden-Württemberg Amtsgericht Freiburg HRA 703697\nANELK Pharma GmbH & Co. KG – Radolfzell am Bodensee",
      "type": "Registerbekanntmachung nach dem Umwandlungsgesetz",
      "state": "Baden-Württemberg",
      "amtsgericht": "Amtsgericht Freiburg",
      "registernummer": "HRA 703697",
      "registerart": "HRA",
      "company_name": "ANELK Pharma GmbH & Co. KG",
      "company_seat": "Radolfzell am Bodensee",
      "details": "12.06.2025 (Bekanntmachungsdatum)\n\nBaden-Württemberg Amtsgericht Freiburg HRA 703697\nDie Registerbekanntmachung ist nachträglich am 12.06.2025 um 20:18 Uhr gelöscht worden.\nWegen der Einzelheiten und näherer Auskünfte wenden Sie sich bitte an das Amtsgericht Freiburg ."
    },
    {
      "date": "2025-06-12",
      "id": "111995",
      "original_text": "Löschungsankündigung\nRheinland-Pfalz Amtsgericht Mainz HRB 2288\nGästehaus zum Taunus Bewirtschaftungsgesellschaft mit beschränkter Haftung – Budenheim",
      "type": "Löschungsankündigung",
      "state": "Rheinland-Pfalz",
      "amtsgericht": "Amtsgericht Mainz",
      "registernummer": "HRB 2288",
      "registerart": "HRB",
      "company_name": "Gästehaus zum Taunus Bewirtschaftungsgesellschaft mit beschränkter Haftung",
      "company_seat": "Budenheim",
      "details": "12.06.2025 (Bekanntmachungsdatum)\n\nRheinland-Pfalz Amtsgericht Mainz HRB 2288\nLöschungsankündigung\n\nGästehaus zum Taunus Bewirtschaftungsgesellschaft mit beschränkter Haftung\nGesellschaft mit beschränkter Haftung\nBudenheim\n\nDas Registergericht beabsichtigt die Gesellschaft von Amts wegen nach § 394 FamFG zu löschen. Die Frist zur Erhebung eines Widerspruchs ist auf einen Monat festgesetzt."
    },
    {
      "date": "2025-06-12",
      "id": "111996",
      "original_text": "Registerbekanntmachung nach dem Umwandlungsgesetz\nRheinland-Pfalz Amtsgericht Koblenz HRA 21670\nSOL Kohlensäure GmbH & Co. KG – Burgbrohl",
      "type": "Registerbekanntmachung nach dem Umwandlungsgesetz",
      "state": "Rheinland-Pfalz",
      "amtsgericht": "Amtsgericht Koblenz",
      "registernummer": "HRA 21670",
      "registerart": "HRA",
      "company_name": "SOL Kohlensäure GmbH & Co. KG",
      "company_seat": "Burgbrohl",
      "details": "12.06.2025 (Bekanntmachungsdatum)\n\nRheinland-Pfalz Amtsgericht Koblenz HRA 21670\nRegisterbekanntmachung nach dem Umwandlungsgesetz 12.06.2025 (Eintragungsdatum)\n\nSOL Kohlensäure GmbH & Co. KG\nKommanditgesellschaft\nBurgbrohl\n\nAls nicht eingetragen wird veröffentlicht: Den Gläubigern der an der Verschmelzung beteiligten Rechtsträger ist, wenn sie binnen sechs Monaten nach dem Tag, an dem die Eintragung der Verschmelzung in das Register des Sitzes desjenigen Rechtsträgers,dessen Gläubiger sie sind, nach § 19 Abs. 3 UmwG als bekannt gemacht gilt, ihren Anspruch nach Grund und Höhe schriftlich anmelden, Sicherheit zu leisten, soweit sie nicht Befriedigung verlangen können. Dieses Recht steht den Gläubigern jedoch nur zu, wenn sie glaubhaft machen, dass durch die Verschmelzung die Erfüllung der Forderung gefährdet wird."
    },
    {
      "date": "2025-06-12",
      "id": "111997",
      "original_text": "Registerbekanntmachung nach dem Umwandlungsgesetz\nRheinland-Pfalz Amtsgericht Mainz HRA 44893\nDr. Umlauf Prevention e.K. – Mainz",
      "type": "Registerbekanntmachung nach dem Umwandlungsgesetz",
      "state": "Rheinland-Pfalz",
      "amtsgericht": "Amtsgericht Mainz",
      "registernummer": "HRA 44893",
      "registerart": "HRA",
      "company_name": "Dr. Umlauf Prevention e.K.",
      "company_seat": "Mainz",
      "details": "12.06.2025 (Bekanntmachungsdatum)\n\nRheinland-Pfalz Amtsgericht Mainz HRA 44893\nRegisterbekanntmachung nach dem Umwandlungsgesetz 12.06.2025 (Eintragungsdatum)\n\nDr. Umlauf Prevention e.K.\nEinzelkaufmann / Einzelkauffrau\nMainz\n\nAls nicht eingetragen wird veröffentlicht: Den Gläubigern der an der Verschmelzung beteiligten Rechtsträger ist, wenn sie binnen sechs Monaten nach dem Tag, an dem die Eintragung der Verschmelzung in das Register des Sitzes desjenigen Rechtsträgers, dessen Gläubiger sie sind, nach § 19 Abs. 3 UmwG als bekannt gemacht gilt, ihren Anspruch nach Grund und Höhe schriftlich anmelden, Sicherheit zu leisten, soweit sie nicht Befriedigung verlangen können. Dieses Recht steht den Gläubigern jedoch nur zu, wenn sie glaubhaft machen, dass durch die Verschmelzung die Erfüllung der Forderung gefährdet wird."
    },
    {
      "date": "2025-06-12",
      "id": "111998",
      "original_text": "Registerbekanntmachung nach dem Umwandlungsgesetz\nRheinland-Pfalz Amtsgericht Mainz HRB 52180\nDr. Umlauf Prevention AG – Mainz",
      "type": "Registerbekanntmachung nach dem Umwandlungsgesetz",
      "state": "Rheinland-Pfalz",
      "amtsgericht": "Amtsgericht Mainz",
      "registernummer": "HRB 52180",
      "registerart": "HRB",
      "company_name": "Dr. Umlauf Prevention AG",
      "company_seat": "Mainz",
      "details": "12.06.2025 (Bekanntmachungsdatum)\n\nRheinland-Pfalz Amtsgericht Mainz HRB 52180\nRegisterbekanntmachung nach dem Umwandlungsgesetz 12.06.2025 (Eintragungsdatum)\n\nDr. Umlauf Prevention AG\nAktiengesellschaft\nMainz\n\nAls nicht eingetragen wird veröffentlicht: Den Gläubigern der an der Verschmelzung beteiligten Rechtsträger ist, wenn sie binnen sechs Monaten nach dem Tag, an dem die Eintragung der Verschmelzung in das Register des Sitzes desjenigen Rechtsträgers, dessen Gläubiger sie sind, nach § 19 Abs. 3 UmwG als bekannt gemacht gilt, ihren Anspruch nach Grund und Höhe schriftlich anmelden, Sicherheit zu leisten, soweit sie nicht Befriedigung verlangen können. Dieses Recht steht den Gläubigern jedoch nur zu, wenn sie glaubhaft machen, dass durch die Verschmelzung die Erfüllung der Forderung gefährdet wird."
    },
    {
      "date": "2025-06-12",
      "id": "111999",
      "original_text": "Löschungsankündigung\nBremen Amtsgericht Bremen HRB 29596\nachim production Holding GmbH – Bremen",
      "type": "Löschungsankündigung",
      "state": "Bremen",
      "amtsgericht": "Amtsgericht Bremen",
      "registernummer": "HRB 29596",
      "registerart": "HRB",
      "company_name": "achim production Holding GmbH",
      "company_seat": "Bremen",
      "details": "12.06.2025 (Bekanntmachungsdatum)\n\nBremen Amtsgericht Bremen HRB 29596\nLöschungsankündigung\n\nachim production Holding GmbH\nGesellschaft mit beschränkter Haftung\nBremen\n\nEs ist beabsichtigt die im Handelsregister eingetragene Gesellschaft von Amts wegen gemäß § 394 FamFG zu löschen. Gegen die Löschung kann beim AG Bremen schriftlich oder zu Protokoll der Geschäftsstelle Widerspruch eingelegt werden. Widerspruchsfrist 4 Wochen."
    },
    {
      "date": "2025-06-12",
      "id": "112000",
      "original_text": "Sonstige Registerbekanntmachung\nNordrhein-Westfalen Amtsgericht Köln HRB 35881\nDEVK Vermögensvorsorge- und Beteiligungs-Aktiengesellschaft – Köln",
      "type": "Sonstige Registerbekanntmachung",
      "state": "Nordrhein-Westfalen",
      "amtsgericht": "Amtsgericht Köln",
      "registernummer": "HRB 35881",
      "registerart": "HRB",
      "company_name": "DEVK Vermögensvorsorge- und Beteiligungs-Aktiengesellschaft",
      "company_seat": "Köln",
      "details": "12.06.2025 (Bekanntmachungsdatum)\n\nNordrhein-Westfalen Amtsgericht Köln HRB 35881\nSonstige Registerbekanntmachung\n\nDEVK Vermögensvorsorge- und Beteiligungs-Aktiengesellschaft\nAktiengesellschaft\nKöln\n\nDem Registergericht ist eine Liste der Mitglieder des Aufsichtsrates eingereicht worden."
    },
    {
      "date": "2025-06-12",
      "id": "112001",
      "original_text": "Registerbekanntmachung nach dem Umwandlungsgesetz\nNordrhein-Westfalen Amtsgericht Münster HRB 14504\nAloco MPC Beteiligungs GmbH – Ahlen",
      "type": "Registerbekanntmachung nach dem Umwandlungsgesetz",
      "state": "Nordrhein-Westfalen",
      "amtsgericht": "Amtsgericht Münster",
      "registernummer": "HRB 14504",
      "registerart": "HRB",
      "company_name": "Aloco MPC Beteiligungs GmbH",
      "company_seat": "Ahlen",
      "details": "12.06.2025 (Bekanntmachungsdatum)\n\nNordrhein-Westfalen Amtsgericht Münster HRB 14504\nRegisterbekanntmachung nach dem Umwandlungsgesetz 12.06.2025 (Eintragungsdatum)\n\nAloco MPC Beteiligungs GmbH\nGesellschaft mit beschränkter Haftung\nAhlen\n\nDen Gläubigern der an der Verschmelzung beteiligten Rechtsträger ist, wenn sie binnen sechs Monaten nach dem Tag, an dem die Eintragung der Verschmelzung in das Register des Sitzes desjenigen Rechtsträgers, dessen Gläubiger sie sind, nach § 19 Absatz 3 UmwG als bekanntgemacht gilt, ihren Anspruch nach Grund und Höhe schriftlich anmelden, Sicherheit zu leisten, soweit sie nicht Befriedigung verlangen können. Dieses Recht steht den Gläubigern jedoch nur zu, wenn sie glaubhaft machen, dass durch die Verschmelzung die Erfüllung ihrer Forderung gefährdet wird."
    },
    {
      "date": "2025-06-12",
      "id": "112002",
      "original_text": "Einreichung neuer Dokumente\nNordrhein-Westfalen Amtsgericht Köln HRB 110121\nDISCO Pharmaceuticals GmbH – Köln",
      "type": "Einreichung neuer Dokumente",
      "state": "Nordrhein-Westfalen",
      "amtsgericht": "Amtsgericht Köln",
      "registernummer": "HRB 110121",
      "registerart": "HRB",
      "company_name": "DISCO Pharmaceuticals GmbH",
      "company_seat": "Köln",
      "details": "12.06.2025 (Bekanntmachungsdatum)\n\nNordrhein-Westfalen Amtsgericht Köln HRB 110121\nEinreichung neuer Dokumente 12.03.2025 (Eintragungsdatum)\n\nDISCO Pharmaceuticals GmbH\nGesellschaft mit beschränkter Haftung\nKöln\n\nDem Registergericht ist eine Liste der Mitglieder des Aufsichtsrates eingereicht worden."
    },
    {
      "date": "2025-06-12",
      "id": "112003",
      "original_text": "Registerbekanntmachung nach dem Umwandlungsgesetz\nNordrhein-Westfalen Amtsgericht Münster HRB 20844\nGeorg Möhle Elektrogroßhandel GmbH – Münster",
      "type": "Registerbekanntmachung nach dem Umwandlungsgesetz",
      "state": "Nordrhein-Westfalen",
      "amtsgericht": "Amtsgericht Münster",
      "registernummer": "HRB 20844",
      "registerart": "HRB",
      "company_name": "Georg Möhle Elektrogroßhandel GmbH",
      "company_seat": "Münster",
      "details": "12.06.2025 (Bekanntmachungsdatum)\n\nNordrhein-Westfalen Amtsgericht Münster HRB 20844\nRegisterbekanntmachung nach dem Umwandlungsgesetz 12.06.2025 (Eintragungsdatum)\n\nGeorg Möhle Elektrogroßhandel GmbH\nGesellschaft mit beschränkter Haftung\nMünster\n\nDen Gläubigern der an der Verschmelzung beteiligten Rechtsträger ist, wenn sie binnen sechs Monaten nach dem Tag, an dem die Eintragung der Verschmelzung in das Register des Sitzes desjenigen Rechtsträgers, dessen Gläubiger sie sind, nach § 19 Absatz 3 UmwG als bekanntgemacht gilt, ihren Anspruch nach Grund und Höhe schriftlich anmelden, Sicherheit zu leisten, soweit sie nicht Befriedigung verlangen können. Dieses Recht steht den Gläubigern jedoch nur zu, wenn sie glaubhaft machen, dass durch die Verschmelzung die Erfüllung ihrer Forderung gefährdet wird."
    },
    {
      "date": "2025-06-12",
      "id": "112004",
      "original_text": "Löschungsankündigung\nNordrhein-Westfalen Amtsgericht Gütersloh HRB 3786\nAydin Baumanagement GmbH – Gütersloh",
      "type": "Löschungsankündigung",
      "state": "Nordrhein-Westfalen",
      "amtsgericht": "Amtsgericht Gütersloh",
      "registernummer": "HRB 3786",
      "registerart": "HRB",
      "company_name": "Aydin Baumanagement GmbH",
      "company_seat": "Gütersloh",
      "details": "12.06.2025 (Bekanntmachungsdatum)\n\nNordrhein-Westfalen Amtsgericht Gütersloh HRB 3786\nLöschungsankündigung\n\nAydin Baumanagement GmbH\nGesellschaft mit beschränkter Haftung\nGütersloh\n\nDas Registergericht beabsichtigt die Gesellschaft von Amts wegen nach § 394 FamFG zu löschen. Die Frist zur Erhebung eines Widerspruchs ist auf einen Monat festgesetzt."
    },
    {
      "date": "2025-06-12",
      "id": "112005",
      "original_text": "Registerbekanntmachung nach dem Umwandlungsgesetz\nNordrhein-Westfalen Amtsgericht Steinfurt HRB 5078\nOASE FT GmbH – Hörstel",
      "type": "Registerbekanntmachung nach dem Umwandlungsgesetz",
      "state": "Nordrhein-Westfalen",
      "amtsgericht": "Amtsgericht Steinfurt",
      "registernummer": "HRB 5078",
      "registerart": "HRB",
      "company_name": "OASE FT GmbH",
      "company_seat": "Hörstel",
      "details": "12.06.2025 (Bekanntmachungsdatum)\n\nNordrhein-Westfalen Amtsgericht Steinfurt HRB 5078\nRegisterbekanntmachung nach dem Umwandlungsgesetz 12.06.2025 (Eintragungsdatum)\n\nOASE FT GmbH\nGesellschaft mit beschränkter Haftung\nHörstel\n\nDen Gläubigern der an der Verschmelzung beteiligten Rechtsträger ist, wenn sie binnen sechs Monaten nach dem Tag, an dem die Eintragung der Verschmelzung in das Register des Sitzes derjenigen Rechtsträger deren Gläubiger sie sind, nach § 19 Absatz 3 UmwG als bekanntgemacht gilt, ihren Anspruch nach Grund und Höhe schriftlich anmelden, Sicherheit zu leisten, soweit sie nicht Befriedigung verlangen können. Dieses Recht steht den Gläubigern jedoch nur zu, wenn sie glaubhaft machen, dass durch die Verschmelzung die Erfüllung ihrer Forderung gefährdet wird."
    },
    {
      "date": "2025-06-12",
      "id": "112006",
      "original_text": "Registerbekanntmachung nach dem Umwandlungsgesetz\nNordrhein-Westfalen Amtsgericht Köln HRB 45147\nKiesgrube SINDORF Verwaltungs GmbH – Wesseling",
      "type": "Registerbekanntmachung nach dem Umwandlungsgesetz",
      "state": "Nordrhein-Westfalen",
      "amtsgericht": "Amtsgericht Köln",
      "registernummer": "HRB 45147",
      "registerart": "HRB",
      "company_name": "Kiesgrube SINDORF Verwaltungs GmbH",
      "company_seat": "Wesseling",
      "details": "12.06.2025 (Bekanntmachungsdatum)\n\nNordrhein-Westfalen Amtsgericht Köln HRB 45147\nRegisterbekanntmachung nach dem Umwandlungsgesetz 12.06.2025 (Eintragungsdatum)\n\nKiesgrube SINDORF Verwaltungs GmbH\nGesellschaft mit beschränkter Haftung\nWesseling\n\nDen Gläubigern der an der Verschmelzung beteiligten Rechtsträger ist, wenn sie binnen sechs Monaten nach dem Tag, an dem die Eintragung der Verschmelzung in das Register des Sitzes desjenigen Rechtsträgers, dessen Gläubiger sie sind, nach § 19 Absatz 3 UmwG als bekanntgemacht gilt, ihren Anspruch nach Grund und Höhe schriftlich anmelden, Sicherheit zu leisten, soweit sie nicht Befriedigung verlangen können. Dieses Recht steht den Gläubigern jedoch nur zu, wenn sie glaubhaft machen, dass durch die Verschmelzung die Erfüllung ihrer Forderung gefährdet wird."
    },
    {
      "date": "2025-06-12",
      "id": "112007",
      "original_text": "Löschungsankündigung\nNordrhein-Westfalen Amtsgericht Neuss HRB 18852\nIBELLA GmbH – Neuss",
      "type": "Löschungsankündigung",
      "state": "Nordrhein-Westfalen",
      "amtsgericht": "Amtsgericht Neuss",
      "registernummer": "HRB 18852",
      "registerart": "HRB",
      "company_name": "IBELLA GmbH",
      "company_seat": "Neuss",
      "details": "12.06.2025 (Bekanntmachungsdatum)\n\nNordrhein-Westfalen Amtsgericht Neuss HRB 18852\nLöschungsankündigung\n\nIBELLA GmbH\nGesellschaft mit beschränkter Haftung\nNeuss\n\nEs ist beabsichtigt, die Gesellschaft wegen Vermögenslosigkeit aufgrund des § 394 Abs. 1 FamFG zu löschen. Frist zur Geltendmachung eines Widerspruchs: 1 Monat.\n\nRechtsbehelfsbelehrung:\nGegen diese Verfügung können Sie Widerspruch einlegen.\nDer Widerspruch ist bei dem Amtsgericht Neuss - Registergericht -, Breite Str. 48, 41460 Neuss schriftlich in deutscher Sprache oder zur Niederschrift der Geschäftsstelle einzulegen.\nDer Widerspruch kann auch zur Niederschrift der Geschäftsstelle eines jeden Amtsgerichtes abgegeben werden.\nDie Einlegung ist auch durch Übertragung eines elektronischen Dokuments an die elektronische Poststelle des Gerichts möglich. Das elektronische Dokument muss für die Bearbeitung durch das Gericht geeignet und mit einer qualifizierten elektronischen Signatur der verantwortenden Person versehen sein oder von der verantwortenden Person signiert und auf einem sicheren Übermittlungsweg gemäß § 130a ZPO nach näherer Maßgabe der Verordnung über die technischen Rahmenbedingungen des elektronischen Rechtsverkehrs und über das besondere elektronische Behördenpostfach (BGBl. I, S.3803) eingereicht werden. Weitere Informationen erhalten Sie auf der Internetseite www.justiz.de.\nDer Widerspruch muss spätestens innerhalb der gesetzten Frist nach der schriftlichen Bekanntgabe der Verfügung bei dem Amtsgericht - Registergericht - Neuss eingegangen sein. Dies gilt auch dann, wenn der Widerspruch zur Niederschrift der Geschäftsstelle eines anderen Amtsgerichtes abgegeben wurde. Die Frist beginnt mit der schriftlichen Bekanntgabe der Verfügung. Die Bekanntgabe ist entweder durch Zustellung oder am dritten Tage nach Aufgabe zur Post bewirkt. Fällt das Ende der Frist auf einen Sonntag, einen allgemeinen Feiertag oder Sonnabend, so endet die Frist mit Ablauf des nächsten Werktages.\n\nDer Widerspruch muss die Bezeichnung der angefochtenen Verfügung sowie die Erklärung enthalten, dass Widerspruch gegen diese Verfügung eingelegt wird. Er ist zu unterzeichnen und soll begründet werden."
    },
    {
      "date": "2025-06-12",
      "id": "112008",
      "original_text": "Löschungsankündigung\nNordrhein-Westfalen Amtsgericht Dortmund HRB 23606\nPast GmbH – Dortmund",
      "type": "Löschungsankündigung",
      "state": "Nordrhein-Westfalen",
      "amtsgericht": "Amtsgericht Dortmund",
      "registernummer": "HRB 23606",
      "registerart": "HRB",
      "company_name": "Past GmbH",
      "company_seat": "Dortmund",
      "details": "12.06.2025 (Bekanntmachungsdatum)\n\nNordrhein-Westfalen Amtsgericht Dortmund HRB 23606\nLöschungsankündigung\n\nPast GmbH\nGesellschaft mit beschränkter Haftung\nDortmund\n\nDas Registergericht beabsichtigt die Gesellschaft von Amts wegen nach § 394 FamFG zu löschen. Die Frist zur Erhebung eines Widerspruchs ist auf zwei Monate festgesetzt."
    },
    {
      "date": "2025-06-12",
      "id": "112009",
      "original_text": "Löschungsankündigung\nNordrhein-Westfalen Amtsgericht Dortmund HRA 13103\nDS-Rendite-Fonds Nr. 47 MS Cape Norman GmbH & Co. Containerschiff KG – Dortmund",
      "type": "Löschungsankündigung",
      "state": "Nordrhein-Westfalen",
      "amtsgericht": "Amtsgericht Dortmund",
      "registernummer": "HRA 13103",
      "registerart": "HRA",
      "company_name": "DS-Rendite-Fonds Nr. 47 MS Cape Norman GmbH & Co. Containerschiff KG",
      "company_seat": "Dortmund",
      "details": "12.06.2025 (Bekanntmachungsdatum)\n\nNordrhein-Westfalen Amtsgericht Dortmund HRA 13103\nLöschungsankündigung\n\nDS-Rendite-Fonds Nr. 47 MS Cape Norman GmbH & Co. Containerschiff KG\nKommanditgesellschaft\nDortmund\n\nDas Registergericht beabsichtigt die Firma von Amts wegen nach § 394 FamFG zu löschen. Die Frist zur Erhebung eines Widerspruchs ist auf drei Monate festgesetzt."
    },
    {
      "date": "2025-06-12",
      "id": "112010",
      "original_text": "Löschungsankündigung\nNordrhein-Westfalen Amtsgericht Aachen HRB 27475\nCreative entertainment GmbH – Aachen",
      "type": "Löschungsankündigung",
      "state": "Nordrhein-Westfalen",
      "amtsgericht": "Amtsgericht Aachen",
      "registernummer": "HRB 27475",
      "registerart": "HRB",
      "company_name": "Creative entertainment GmbH",
      "company_seat": "Aachen",
      "details": "12.06.2025 (Bekanntmachungsdatum)\n\nNordrhein-Westfalen Amtsgericht Aachen HRB 27475\nLöschungsankündigung\n\nCreative entertainment GmbH\nGesellschaft mit beschränkter Haftung\nAachen\n\nDas Registergericht beabsichtigt, von Amts wegen die Gesellschaft wegen Vermögenslosigkeit nach § 394 FamFG zu löschen, weil das Insolvenzverfahren Amtsgericht Aachen (Az.: 93 IN 5/25) beendet und Vermögen der Gesellschaft nicht mehr erkennbar ist.\n\nZur Geltendmachung des Widerspruchs gegen die beabsichtigte Löschung wird hiermit eine Frist von einem Monat ab Veröffentlichung dieser Ankündigung bestimmt.\n\nRechtsbehelfsbelehrung:\n\nGegen diese Verfügung kann Widerspruch eingelegt werden. Zum Widerspruch ist jeder berechtigt, der an der Unterlassung der Löschung ein berechtigtes Interesse hat.\n\nDer Widerspruch ist bei dem Amtsgericht Aachen, Adalbertsteinweg 92, 52070 Aachen schriftlich in deutscher Sprache oder zur Niederschrift der Geschäftsstelle einzulegen. Der Widerspruch kann auch zur Niederschrift der Geschäftsstelle eines jeden Amtsgerichtes abgegeben werden.\n\nDer Widerspruch muss spätestens innerhalb der gesetzten Frist nach der Bekanntgabe der Verfügung bei dem Amtsgericht Aachen eingegangen sein. Dies gilt auch dann, wenn der Widerspruch zur Niederschrift der Geschäftsstelle eines anderen Amtsgerichtes abgegeben wurde. Die Frist beginnt mit der Bekanntgabe der Verfügung durch Veröffentlichung. Fällt das Ende der Frist auf einen Sonntag, einen allgemeinen Feiertag oder Sonnabend, so endet die Frist mit Ablauf des nächsten Werktages.\n\nDer Widerspruch muss die Bezeichnung der angefochtenen Verfügung sowie die Erklärung enthalten, dass Widerspruch gegen diese Verfügung eingelegt wird. Er ist zu unterzeichnen und soll begründet werden.\n\nDie Einlegung ist auch durch Übertragung eines elektronischen Dokuments an die elektronische Poststelle des Gerichts möglich. Das elektronische Dokument muss für die Bearbeitung durch das Gericht geeignet und mit einer qualifizierten elektronischen Signatur der verantwortenden Person versehen sein oder von der verantwortenden Person signiert und auf einem sicheren Übermittlungsweg gemäß § 130 a ZPO nach näherer Maßgabe der Verordnung über die technischen Rahmenbedingungen des elektronischen Rechtsverkehrs und über das besondere elektronische Behördenpostfach (BGBl. I, S. 3803) eingereicht werden. Weitere Informationen erhalten Sie auf der Internetseite www.justiz.de."
    },
    {
      "date": "2025-06-12",
      "id": "112011",
      "original_text": "Löschungsankündigung\nNordrhein-Westfalen Amtsgericht Hamm HRB 9355\nBauprojekt West GmbH – Hamm",
      "type": "Löschungsankündigung",
      "state": "Nordrhein-Westfalen",
      "amtsgericht": "Amtsgericht Hamm",
      "registernummer": "HRB 9355",
      "registerart": "HRB",
      "company_name": "Bauprojekt West GmbH",
      "company_seat": "Hamm",
      "details": "12.06.2025 (Bekanntmachungsdatum)\n\nNordrhein-Westfalen Amtsgericht Hamm HRB 9355\nLöschungsankündigung\n\nBauprojekt West GmbH\nGesellschaft mit beschränkter Haftung\nHamm\n\nDas Registergericht beabsichtigt die Gesellschaft von Amts wegen nach § 394 FamFG zu löschen. Die Frist zur Erhebung eines Widerspruchs ist auf drei Monate festgesetzt."
    },
    {
      "date": "2025-06-12",
      "id": "112012",
      "original_text": "Registerbekanntmachung nach dem Umwandlungsgesetz\nNordrhein-Westfalen Amtsgericht Düsseldorf HRB 62734\nGrant Thornton AG Wirtschaftsprüfungsgesellschaft – Düsseldorf",
      "type": "Registerbekanntmachung nach dem Umwandlungsgesetz",
      "state": "Nordrhein-Westfalen",
      "amtsgericht": "Amtsgericht Düsseldorf",
      "registernummer": "HRB 62734",
      "registerart": "HRB",
      "company_name": "Grant Thornton AG Wirtschaftsprüfungsgesellschaft",
      "company_seat": "Düsseldorf",
      "details": "12.06.2025 (Bekanntmachungsdatum)\n\nNordrhein-Westfalen Amtsgericht Düsseldorf HRB 62734\nRegisterbekanntmachung nach dem Umwandlungsgesetz\n\nGrant Thornton AG Wirtschaftsprüfungsgesellschaft\nAktiengesellschaft\nDüsseldorf\n\nDem Registergericht ist der Entwurf eines Vertrages über die geplante Verschmelzung der ATS Allgemeine Treuhand GmbH Buchprüfungsgesellschaft Steuerberatungsgesellschaft mit Sitz in Düsseldorf (Amtsgericht Düsseldorf, HRB 13010) mit der Grant Thornton AG Wirtschaftsprüfungsgesellschaft mit Sitz in Düsseldorf (Amtsgericht Düsseldorf, HRB 62734) eingereicht worden."
    },
    {
      "date": "2025-06-12",
      "id": "112013",
      "original_text": "Registerbekanntmachung nach dem Umwandlungsgesetz\nNordrhein-Westfalen Amtsgericht Essen HRB 36918\nimmogolz GmbH – Essen",
      "type": "Registerbekanntmachung nach dem Umwandlungsgesetz",
      "state": "Nordrhein-Westfalen",
      "amtsgericht": "Amtsgericht Essen",
      "registernummer": "HRB 36918",
      "registerart": "HRB",
      "company_name": "immogolz GmbH",
      "company_seat": "Essen",
      "details": "12.06.2025 (Bekanntmachungsdatum)\n\nNordrhein-Westfalen Amtsgericht Essen HRB 36918\nRegisterbekanntmachung nach dem Umwandlungsgesetz 12.06.2025 (Eintragungsdatum)\n\nimmogolz GmbH\nGesellschaft mit beschränkter Haftung\nEssen\n\nDen Gläubigern der an der Ausgliederung beteiligten Rechtsträger ist, wenn sie binnen sechs Monaten nach dem Tag, an dem die Eintragung der Ausgliederung in das Register des Sitzes derjenigen Rechtsträger deren Gläubiger sie sind, nach § 19 Absatz 3 UmwG als bekanntgemacht gilt, ihren Anspruch nach Grund und Höhe schriftlich anmelden, Sicherheit zu leisten, soweit sie nicht Befriedigung verlangen können. Dieses Recht steht den Gläubigern jedoch nur zu, wenn sie glaubhaft machen, dass durch die Ausgliederung die Erfüllung ihrer Forderung gefährdet wird."
    },
    {
      "date": "2025-06-12",
      "id": "112014",
      "original_text": "Registerbekanntmachung nach dem Umwandlungsgesetz\nNordrhein-Westfalen Amtsgericht Dortmund HRB 25687\nNordic Lights GmbH – Lünen",
      "type": "Registerbekanntmachung nach dem Umwandlungsgesetz",
      "state": "Nordrhein-Westfalen",
      "amtsgericht": "Amtsgericht Dortmund",
      "registernummer": "HRB 25687",
      "registerart": "HRB",
      "company_name": "Nordic Lights GmbH",
      "company_seat": "Lünen",
      "details": "12.06.2025 (Bekanntmachungsdatum)\n\nNordrhein-Westfalen Amtsgericht Dortmund HRB 25687\nRegisterbekanntmachung nach dem Umwandlungsgesetz 12.06.2025 (Eintragungsdatum)\n\nNordic Lights GmbH\nGesellschaft mit beschränkter Haftung\nLünen\n\nDen Gläubigern der an der Verschmelzung beteiligten Rechtsträger ist, wenn sie binnen sechs Monaten nach dem Tag, an dem die Eintragung der Verschmelzung in das Register des Sitzes desjenigen Rechtsträgers, dessen Gläubiger sie sind, nach § 19 Absatz 3 UmwG als bekanntgemacht gilt, ihren Anspruch nach Grund und Höhe schriftlich anmelden, Sicherheit zu leisten, soweit sie nicht Befriedigung verlangen können. Dieses Recht steht den Gläubigern jedoch nur zu, wenn sie glaubhaft machen, dass durch die Verschmelzung die Erfüllung ihrer Forderung gefährdet wird."
    },
    {
      "date": "2025-06-12",
      "id": "112015",
      "original_text": "Registerbekanntmachung nach dem Umwandlungsgesetz\nNordrhein-Westfalen Amtsgericht Bochum HRB 17204\nVfL Bochum 1848 GmbH & Co. KGaA – Bochum",
      "type": "Registerbekanntmachung nach dem Umwandlungsgesetz",
      "state": "Nordrhein-Westfalen",
      "amtsgericht": "Amtsgericht Bochum",
      "registernummer": "HRB 17204",
      "registerart": "HRB",
      "company_name": "VfL Bochum 1848 GmbH & Co. KGaA",
      "company_seat": "Bochum",
      "details": "12.06.2025 (Bekanntmachungsdatum)\n\nNordrhein-Westfalen Amtsgericht Bochum HRB 17204\nRegisterbekanntmachung nach dem Umwandlungsgesetz 10.06.2025 (Eintragungsdatum)\n\nVfL Bochum 1848 GmbH & Co. KGaA\nKommanditgesellschaft auf Aktien\nBochum\n\nDen Gläubigern der an der Verschmelzung beteiligten Rechtsträger ist, wenn sie binnen sechs Monaten nach dem Tag, an dem die Eintragung der Verschmelzung in das Register des Sitzes derjenigen Rechtsträger deren Gläubiger sie sind, nach § 19 Absatz 3 UmwG als bekanntgemacht gilt, ihren Anspruch nach Grund und Höhe schriftlich anmelden, Sicherheit zu leisten, soweit sie nicht Befriedigung verlangen können. Dieses Recht steht den Gläubigern jedoch nur zu, wenn sie glaubhaft machen, dass durch die Verschmelzung die Erfüllung ihrer Forderung gefährdet wird."
    },
    {
      "date": "2025-06-12",
      "id": "112016",
      "original_text": "Registerbekanntmachung nach dem Umwandlungsgesetz\nNordrhein-Westfalen Amtsgericht Köln HRB 114092\nID Cologne F GmbH – Köln",
      "type": "Registerbekanntmachung nach dem Umwandlungsgesetz",
      "state": "Nordrhein-Westfalen",
      "amtsgericht": "Amtsgericht Köln",
      "registernummer": "HRB 114092",
      "registerart": "HRB",
      "company_name": "ID Cologne F GmbH",
      "company_seat": "Köln",
      "details": "12.06.2025 (Bekanntmachungsdatum)\n\nNordrhein-Westfalen Amtsgericht Köln HRB 114092\nRegisterbekanntmachung nach dem Umwandlungsgesetz 12.06.2025 (Eintragungsdatum)\n\nID Cologne F GmbH\nGesellschaft mit beschränkter Haftung\nKöln\n\nDen Gläubigern der an der Verschmelzung beteiligten Rechtsträger ist, wenn sie binnen sechs Monaten nach dem Tag, an dem die Eintragung der Verschmelzung in das Register des Sitzes desjenigen Rechtsträgers, dessen Gläubiger sie sind, nach § 19 Absatz 3 UmwG als bekanntgemacht gilt, ihren Anspruch nach Grund und Höhe schriftlich anmelden, Sicherheit zu leisten, soweit sie nicht Befriedigung verlangen können. Dieses Recht steht den Gläubigern jedoch nur zu, wenn sie glaubhaft machen, dass durch die Verschmelzung die Erfüllung ihrer Forderung gefährdet wird."
    },
    {
      "date": "2025-06-12",
      "id": "112017",
      "original_text": "Löschungsankündigung\nNordrhein-Westfalen Amtsgericht Lemgo HRA 2874\nKonditorei und Café - Betrieb Wortmann Hans-Peter Wortmann Nachfolger Kurt F. Buschmann jun. – Detmold",
      "type": "Löschungsankündigung",
      "state": "Nordrhein-Westfalen",
      "amtsgericht": "Amtsgericht Lemgo",
      "registernummer": "HRA 2874",
      "registerart": "HRA",
      "company_name": "Konditorei und Café - Betrieb Wortmann Hans-Peter Wortmann Nachfolger Kurt F. Buschmann jun.",
      "company_seat": "Detmold",
      "details": "12.06.2025 (Bekanntmachungsdatum)\n\nNordrhein-Westfalen Amtsgericht Lemgo HRA 2874\nLöschungsankündigung\n\nKonditorei und Café - Betrieb Wortmann Hans-Peter Wortmann Nachfolger Kurt F. Buschmann jun.\nEinzelkaufmann / Einzelkauffrau\nDetmold\n\nDas Registergericht beabsichtigt die Firma von Amts wegen nach § 31 Abs. 2 HGB, § 393 FamFG zu löschen. Die Frist zur Erhebung eines Widerspruchs ist auf einen Monat festgesetzt."
    },
    {
      "date": "2025-06-12",
      "id": "112018",
      "original_text": "Registerbekanntmachung nach dem Umwandlungsgesetz\nNordrhein-Westfalen Amtsgericht Köln HRB 36920\nSteuerlehrgänge Dr. Bannas GmbH – Köln",
      "type": "Registerbekanntmachung nach dem Umwandlungsgesetz",
      "state": "Nordrhein-Westfalen",
      "amtsgericht": "Amtsgericht Köln",
      "registernummer": "HRB 36920",
      "registerart": "HRB",
      "company_name": "Steuerlehrgänge Dr. Bannas GmbH",
      "company_seat": "Köln",
      "details": "12.06.2025 (Bekanntmachungsdatum)\n\nNordrhein-Westfalen Amtsgericht Köln HRB 36920\nRegisterbekanntmachung nach dem Umwandlungsgesetz 12.06.2025 (Eintragungsdatum)\n\nSteuerlehrgänge Dr. Bannas GmbH\nGesellschaft mit beschränkter Haftung\nKöln\n\nDen Gläubigern der an der Verschmelzung beteiligten Rechtsträger ist, wenn sie binnen sechs Monaten nach dem Tag, an dem die Eintragung der Verschmelzung in das Register des Sitzes derjenigen Rechtsträger deren Gläubiger sie sind, nach § 19 Absatz 3 UmwG als bekanntgemacht gilt, ihren Anspruch nach Grund und Höhe schriftlich anmelden, Sicherheit zu leisten, soweit sie nicht Befriedigung verlangen können. Dieses Recht steht den Gläubigern jedoch nur zu, wenn sie glaubhaft machen, dass durch die Verschmelzung die Erfüllung ihrer Forderung gefährdet wird."
    },
    {
      "date": "2025-06-12",
      "id": "112019",
      "original_text": "Löschungsankündigung\nNordrhein-Westfalen Amtsgericht Duisburg HRB 33928\nKurt-Industrierohrbau GmbH – Duisburg",
      "type": "Löschungsankündigung",
      "state": "Nordrhein-Westfalen",
      "amtsgericht": "Amtsgericht Duisburg",
      "registernummer": "HRB 33928",
      "registerart": "HRB",
      "company_name": "Kurt-Industrierohrbau GmbH",
      "company_seat": "Duisburg",
      "details": "12.06.2025 (Bekanntmachungsdatum)\n\nNordrhein-Westfalen Amtsgericht Duisburg HRB 33928\nLöschungsankündigung\n\nKurt-Industrierohrbau GmbH\nGesellschaft mit beschränkter Haftung\nDuisburg\n\nHRB 33928:\nKurt-Industrierohrbau GmbH,\nDuisburg,\nFriedrich-Ebert-Straße 432, 47178 Duisburg. Das Registergericht beabsichtigt, die im Handelsregister eingetragene Gesellschaft gemäß § 394 Absatz 1 FamFG wegen Vermögenslosigkeit von Amts wegen zu löschen. Gegen diese Verfügung kann Widerspruch eingelegt werden. Die Frist zur Erhebung eines Widerspruchs gegen die beabsichtigte Löschung von Amts wegen ist auf drei Monate festgesetzt. Rechtsbehelfsbelehrung Der Widerspruch ist bei dem Amtsgericht Duisburg, Kardinal-Galen-Str. 124-132, 47058 Duisburg schriftlich in deutscher Sprache oder zur Niederschrift der Geschäftsstelle einzulegen. Der Widerspruch kann auch zur Niederschrift der Geschäftsstelle eines jeden Amtsgerichtes abgegeben werden. Die Einlegung ist auch durch Übertragung eines elektronischen Dokuments an die elektronische Poststelle des Gerichts möglich. Das elektronische Dokument muss für die Bearbeitung durch das Gericht geeignet und mit einer qualifizierten elektronischen Signatur der verantwortenden Person versehen sein oder von der verantwortenden Person signiert und auf einem sicheren Übermittlungsweg gemäß § 130 a ZPO nach näherer Maßgabe der Verordnung über die technischen Rahmenbedingungen des elektronischen Rechtsverkehrs und über das besondere elektronische Behördenpostfach (BGBl. I, S. 3803) eingereicht werden. Weitere Informationen erhalten Sie auf der Internetseite www.justiz.de <http://www.justiz.de>. Der Widerspruch muss spätestens innerhalb der gesetzten Frist bei dem Amtsgericht Duisburg eingegangen sein. Dies gilt auch dann, wenn der Widerspruch zur Niederschrift der Geschäftsstelle eines anderen Amtsgerichtes abgegeben wurde. Die Frist beginnt mit der Veröffentlichung. Fällt das Ende der Frist auf einen Sonntag, einen allgemeinen Feiertag oder Sonnabend, so endet die Frist mit Ablauf des nächsten Werktages. Der Widerspruch muss die Bezeichnung der angefochtenen Verfügung sowie die Erklärung enthalten, dass Widerspruch gegen diese Verfügung eingelegt wird. Er ist zu unterzeichnen und soll begründet werden."
    },
    {
      "date": "2025-06-12",
      "id": "112020",
      "original_text": "Registerbekanntmachung nach dem Umwandlungsgesetz\nNordrhein-Westfalen Amtsgericht Steinfurt HRB 6781\nOASE GmbH – Hörstel",
      "type": "Registerbekanntmachung nach dem Umwandlungsgesetz",
      "state": "Nordrhein-Westfalen",
      "amtsgericht": "Amtsgericht Steinfurt",
      "registernummer": "HRB 6781",
      "registerart": "HRB",
      "company_name": "OASE GmbH",
      "company_seat": "Hörstel",
      "details": "12.06.2025 (Bekanntmachungsdatum)\n\nNordrhein-Westfalen Amtsgericht Steinfurt HRB 6781\nRegisterbekanntmachung nach dem Umwandlungsgesetz 12.06.2025 (Eintragungsdatum)\n\nOASE GmbH\nGesellschaft mit beschränkter Haftung\nHörstel\n\nDen Gläubigern der an der Verschmelzung beteiligten Rechtsträger ist, wenn sie binnen sechs Monaten nach dem Tag, an dem die Eintragung der Verschmelzung in das Register des Sitzes derjenigen Rechtsträger deren Gläubiger sie sind, nach § 19 Absatz 3 UmwG als bekanntgemacht gilt, ihren Anspruch nach Grund und Höhe schriftlich anmelden, Sicherheit zu leisten, soweit sie nicht Befriedigung verlangen können. Dieses Recht steht den Gläubigern jedoch nur zu, wenn sie glaubhaft machen, dass durch die Verschmelzung die Erfüllung ihrer Forderung gefährdet wird."
    },
    {
      "date": "2025-06-12",
      "id": "112021",
      "original_text": "Registerbekanntmachung nach dem Umwandlungsgesetz\nNordrhein-Westfalen Amtsgericht Arnsberg HRB 4254\nRe-Pak Folien-GmbH – Wickede",
      "type": "Registerbekanntmachung nach dem Umwandlungsgesetz",
      "state": "Nordrhein-Westfalen",
      "amtsgericht": "Amtsgericht Arnsberg",
      "registernummer": "HRB 4254",
      "registerart": "HRB",
      "company_name": "Re-Pak Folien-GmbH",
      "company_seat": "Wickede",
      "details": "12.06.2025 (Bekanntmachungsdatum)\n\nNordrhein-Westfalen Amtsgericht Arnsberg HRB 4254\nRegisterbekanntmachung nach dem Umwandlungsgesetz 17.04.2025 (Eintragungsdatum)\n\nRe-Pak Folien-GmbH\nGesellschaft mit beschränkter Haftung\nWickede\n\nDen Gläubigern der an der Verschmelzung beteiligten Rechtsträger ist, wenn sie binnen sechs Monaten nach dem Tag, an dem die Eintragung der Verschmelzung in das Register des Sitzes desjenigen Rechtsträgers, dessen Gläubiger sie sind, nach § 19 Absatz 3 UmwG als bekanntgemacht gilt, ihren Anspruch nach Grund und Höhe schriftlich anmelden, Sicherheit zu leisten, soweit sie nicht Befriedigung verlangen können. Dieses Recht steht den Gläubigern jedoch nur zu, wenn sie glaubhaft machen, dass durch die Verschmelzung die Erfüllung ihrer Forderung gefährdet wird."
    },
    {
      "date": "2025-06-12",
      "id": "112022",
      "original_text": "Registerbekanntmachung nach dem Umwandlungsgesetz\nNordrhein-Westfalen Amtsgericht Gütersloh HRB 12137\nDomU Kapital GmbH – Herzebrock-Clarholz",
      "type": "Registerbekanntmachung nach dem Umwandlungsgesetz",
      "state": "Nordrhein-Westfalen",
      "amtsgericht": "Amtsgericht Gütersloh",
      "registernummer": "HRB 12137",
      "registerart": "HRB",
      "company_name": "DomU Kapital GmbH",
      "company_seat": "Herzebrock-Clarholz",
      "details": "12.06.2025 (Bekanntmachungsdatum)\n\nNordrhein-Westfalen Amtsgericht Gütersloh HRB 12137\nRegisterbekanntmachung nach dem Umwandlungsgesetz 12.06.2025 (Eintragungsdatum)\n\nDomU Kapital GmbH\nGesellschaft mit beschränkter Haftung\nHerzebrock-Clarholz\n\nDen Gläubigern der an der Verschmelzung beteiligten Rechtsträger ist, wenn sie binnen sechs Monaten nach dem Tag, an dem die Eintragung der Verschmelzung in das Register des Sitzes desjenigen Rechtsträgers, dessen Gläubiger sie sind, nach § 19 Absatz 3 UmwG als bekanntgemacht gilt, ihren Anspruch nach Grund und Höhe schriftlich anmelden, Sicherheit zu leisten, soweit sie nicht Befriedigung verlangen können. Dieses Recht steht den Gläubigern jedoch nur zu, wenn sie glaubhaft machen, dass durch die Verschmelzung die Erfüllung ihrer Forderung gefährdet wird."
    },
    {
      "date": "2025-06-12",
      "id": "112023",
      "original_text": "Einreichung neuer Dokumente\nNordrhein-Westfalen Amtsgericht Essen HRB 35092\nconrizon AG – Essen",
      "type": "Einreichung neuer Dokumente",
      "state": "Nordrhein-Westfalen",
      "amtsgericht": "Amtsgericht Essen",
      "registernummer": "HRB 35092",
      "registerart": "HRB",
      "company_name": "conrizon AG",
      "company_seat": "Essen",
      "details": "12.06.2025 (Bekanntmachungsdatum)\n\nNordrhein-Westfalen Amtsgericht Essen HRB 35092\nEinreichung neuer Dokumente\n\nconrizon AG\nAktiengesellschaft\nEssen\n\nDem Registergericht ist eine neue Liste der Mitglieder des Aufsichtsrates eingereicht worden."
    },
    {
      "date": "2025-06-12",
      "id": "112024",
      "original_text": "Registerbekanntmachung nach dem Umwandlungsgesetz\nNordrhein-Westfalen Amtsgericht Köln HRB 93769\nSteuer-Lehrgänge Dr. Stitz GmbH – Köln",
      "type": "Registerbekanntmachung nach dem Umwandlungsgesetz",
      "state": "Nordrhein-Westfalen",
      "amtsgericht": "Amtsgericht Köln",
      "registernummer": "HRB 93769",
      "registerart": "HRB",
      "company_name": "Steuer-Lehrgänge Dr. Stitz GmbH",
      "company_seat": "Köln",
      "details": "12.06.2025 (Bekanntmachungsdatum)\n\nNordrhein-Westfalen Amtsgericht Köln HRB 93769\nRegisterbekanntmachung nach dem Umwandlungsgesetz 12.06.2025 (Eintragungsdatum)\n\nSteuer-Lehrgänge Dr. Stitz GmbH\nGesellschaft mit beschränkter Haftung\nKöln\n\nDen Gläubigern der an der Verschmelzung beteiligten Rechtsträger ist, wenn sie binnen sechs Monaten nach dem Tag, an dem die Eintragung der Verschmelzung in das Register des Sitzes derjenigen Rechtsträger deren Gläubiger sie sind, nach § 19 Absatz 3 UmwG als bekanntgemacht gilt, ihren Anspruch nach Grund und Höhe schriftlich anmelden, Sicherheit zu leisten, soweit sie nicht Befriedigung verlangen können. Dieses Recht steht den Gläubigern jedoch nur zu, wenn sie glaubhaft machen, dass durch die Verschmelzung die Erfüllung ihrer Forderung gefährdet wird."
    },
    {
      "date": "2025-06-12",
      "id": "112025",
      "original_text": "Registerbekanntmachung nach dem Umwandlungsgesetz\nNordrhein-Westfalen Amtsgericht Köln HRB 114123\nID Cologne B GmbH – Köln",
      "type": "Registerbekanntmachung nach dem Umwandlungsgesetz",
      "state": "Nordrhein-Westfalen",
      "amtsgericht": "Amtsgericht Köln",
      "registernummer": "HRB 114123",
      "registerart": "HRB",
      "company_name": "ID Cologne B GmbH",
      "company_seat": "Köln",
      "details": "12.06.2025 (Bekanntmachungsdatum)\n\nNordrhein-Westfalen Amtsgericht Köln HRB 114123\nRegisterbekanntmachung nach dem Umwandlungsgesetz 12.06.2025 (Eintragungsdatum)\n\nID Cologne B GmbH\nGesellschaft mit beschränkter Haftung\nKöln\n\nDen Gläubigern der an der Verschmelzung beteiligten Rechtsträger ist, wenn sie binnen sechs Monaten nach dem Tag, an dem die Eintragung der Verschmelzung in das Register des Sitzes desjenigen Rechtsträgers, dessen Gläubiger sie sind, nach § 19 Absatz 3 UmwG als bekanntgemacht gilt, ihren Anspruch nach Grund und Höhe schriftlich anmelden, Sicherheit zu leisten, soweit sie nicht Befriedigung verlangen können. Dieses Recht steht den Gläubigern jedoch nur zu, wenn sie glaubhaft machen, dass durch die Verschmelzung die Erfüllung ihrer Forderung gefährdet wird."
    },
    {
      "date": "2025-06-12",
      "id": "112026",
      "original_text": "Registerbekanntmachung nach dem Umwandlungsgesetz\nNordrhein-Westfalen Amtsgericht Köln HRA 18674\nKieswerk LORENZHOF Buhs und Schülgen GmbH & Co. Kommanditgesellschaft – Wesseling",
      "type": "Registerbekanntmachung nach dem Umwandlungsgesetz",
      "state": "Nordrhein-Westfalen",
      "amtsgericht": "Amtsgericht Köln",
      "registernummer": "HRA 18674",
      "registerart": "HRA",
      "company_name": "Kieswerk LORENZHOF Buhs und Schülgen GmbH & Co. Kommanditgesellschaft",
      "company_seat": "Wesseling",
      "details": "12.06.2025 (Bekanntmachungsdatum)\n\nNordrhein-Westfalen Amtsgericht Köln HRA 18674\nRegisterbekanntmachung nach dem Umwandlungsgesetz 12.06.2025 (Eintragungsdatum)\n\nKieswerk LORENZHOF Buhs und Schülgen GmbH & Co. Kommanditgesellschaft\nKommanditgesellschaft\nWesseling\n\nDen Gläubigern der an der Verschmelzung beteiligten Rechtsträger ist, wenn sie binnen sechs Monaten nach dem Tag, an dem die Eintragung der Verschmelzung in das Register des Sitzes desjenigen Rechtsträgers, dessen Gläubiger sie sind, nach § 19 Absatz 3 UmwG als bekanntgemacht gilt, ihren Anspruch nach Grund und Höhe schriftlich anmelden, Sicherheit zu leisten, soweit sie nicht Befriedigung verlangen können. Dieses Recht steht den Gläubigern jedoch nur zu, wenn sie glaubhaft machen, dass durch die Verschmelzung die Erfüllung ihrer Forderung gefährdet wird."
    },
    {
      "date": "2025-06-12",
      "id": "112027",
      "original_text": "Registerbekanntmachung nach dem Umwandlungsgesetz\nNordrhein-Westfalen Amtsgericht Münster HRB 12104\nCelona Münster Gastro GmbH – Münster",
      "type": "Registerbekanntmachung nach dem Umwandlungsgesetz",
      "state": "Nordrhein-Westfalen",
      "amtsgericht": "Amtsgericht Münster",
      "registernummer": "HRB 12104",
      "registerart": "HRB",
      "company_name": "Celona Münster Gastro GmbH",
      "company_seat": "Münster",
      "details": "12.06.2025 (Bekanntmachungsdatum)\n\nNordrhein-Westfalen Amtsgericht Münster HRB 12104\nRegisterbekanntmachung nach dem Umwandlungsgesetz 12.06.2025 (Eintragungsdatum)\n\nCelona Münster Gastro GmbH\nGesellschaft mit beschränkter Haftung\nMünster\n\nDen Gläubigern der an der Verschmelzung beteiligten Rechtsträger ist, wenn sie binnen sechs Monaten nach dem Tag, an dem die Eintragung der Verschmelzung in das Register des Sitzes desjenigen Rechtsträgers, dessen Gläubiger sie sind, nach § 19 Absatz 3 UmwG als bekanntgemacht gilt, ihren Anspruch nach Grund und Höhe schriftlich anmelden, Sicherheit zu leisten, soweit sie nicht Befriedigung verlangen können. Dieses Recht steht den Gläubigern jedoch nur zu, wenn sie glaubhaft machen, dass durch die Verschmelzung die Erfüllung ihrer Forderung gefährdet wird."
    },
    {
      "date": "2025-06-12",
      "id": "112028",
      "original_text": "Löschungsankündigung\nNordrhein-Westfalen Amtsgericht Köln HRB 75388\nSecure Sicherheitsdienst GmbH – Hürth",
      "type": "Löschungsankündigung",
      "state": "Nordrhein-Westfalen",
      "amtsgericht": "Amtsgericht Köln",
      "registernummer": "HRB 75388",
      "registerart": "HRB",
      "company_name": "Secure Sicherheitsdienst GmbH",
      "company_seat": "Hürth",
      "details": "12.06.2025 (Bekanntmachungsdatum)\n\nNordrhein-Westfalen Amtsgericht Köln HRB 75388\nLöschungsankündigung\n\nSecure Sicherheitsdienst GmbH\nGesellschaft mit beschränkter Haftung\nHürth\n\nDas Registergericht beabsichtigt die Gesellschaft von Amts wegen nach § 394 FamFG zu löschen. Die Frist zur Erhebung eines Widerspruchs ist auf einen Monat festgesetzt."
    },
    {
      "date": "2025-06-12",
      "id": "112029",
      "original_text": "Registerbekanntmachung nach dem Umwandlungsgesetz\nNordrhein-Westfalen Amtsgericht Essen HRB 19602\nTenova Deutschland Holding GmbH – Essen",
      "type": "Registerbekanntmachung nach dem Umwandlungsgesetz",
      "state": "Nordrhein-Westfalen",
      "amtsgericht": "Amtsgericht Essen",
      "registernummer": "HRB 19602",
      "registerart": "HRB",
      "company_name": "Tenova Deutschland Holding GmbH",
      "company_seat": "Essen",
      "details": "12.06.2025 (Bekanntmachungsdatum)\n\nNordrhein-Westfalen Amtsgericht Essen HRB 19602\nRegisterbekanntmachung nach dem Umwandlungsgesetz\n\nTenova Deutschland Holding GmbH\nGesellschaft mit beschränkter Haftung\nEssen\n\nEs wird darauf hingewiesen, dass ein Spaltungsplan der Tenova Deutschland Holding GmbH mit Sitz in Essen (Amtsgericht Essen HRB 19602) als übertragende Gesellschaft mit der TEITA S.R.L., eine Kapitalgesellschaft in der Rechtsform der società a responsabilità limitata, mit Sitz in Mailand (Unternehmensregister der Handelskammer von Milan Monza Brianza Lodi (Re. Imprese Milano) unter der Registernummer 13886790966.), Italien, als übernehmende Gesellschaft,  beim Handelsregister eingereicht worden ist.\n\nDie Anteilsinhaber, die Gläubiger sowie die zuständigen Betriebsräte der an der grenzüberschreitenden Spaltung beteiligten Gesellschaft oder, soweit es keinen Betriebsrat gibt, die Arbeitnehmer der an der grenzüberschreitenden Spaltung beteiligten Gesellschaft, können der Gesellschaft spätestens fünf Arbeitstage vor dem Tag der Gesellschafterversammlung Bemerkungen zum Spaltungsplan übermitteln. Entsprechende Bemerkungen können an folgende Anschrift gerichtet werden: Tenova Deutschland Holding GmbH, Geschäftsführung, Schifferstraße 80, 47059 Duisburg."
    },
    {
      "date": "2025-06-12",
      "id": "112030",
      "original_text": "Löschungsankündigung\nNordrhein-Westfalen Amtsgericht Siegburg HRB 14546\nTBH Sankt Augustin GmbH – Sankt Augustin",
      "type": "Löschungsankündigung",
      "state": "Nordrhein-Westfalen",
      "amtsgericht": "Amtsgericht Siegburg",
      "registernummer": "HRB 14546",
      "registerart": "HRB",
      "company_name": "TBH Sankt Augustin GmbH",
      "company_seat": "Sankt Augustin",
      "details": "12.06.2025 (Bekanntmachungsdatum)\n\nNordrhein-Westfalen Amtsgericht Siegburg HRB 14546\nLöschungsankündigung\n\nTBH Sankt Augustin GmbH\nGesellschaft mit beschränkter Haftung\nSankt Augustin\n\nDas Registergericht hat glaubhafte Kenntnis erlangt, dass die Gesellschaft vermögenslos geworden ist.\n\nEs ist daher beabsichtigt, die Gesellschaft nach § 394 FamFG im Handelsregister wegen Vermögenslosigkeit zu löschen.\nEinwände gegen die Löschung sind durch Widerspruch binnen einer Frist von 3 Monaten geltend zu machen, andernfalls die Löschung erfolgen wird.\n\nEinzulegen ist der Widerspruch bei dem Amtsgericht Siegburg, Neue Poststraße 16, 53721 Siegburg, und zwar entweder schriftlich in deutscher Sprache oder mündlich zur Niederschrift der Geschäftsstelle. Der Widerspruch kann auch zur Niederschrift der Geschäftsstelle eines jeden Amtsgerichts abgegeben werden. Der Widerspruch ist binnen der in der Verfügung bestimmten Frist einzulegen. Die Frist ist nur gewahrt, wenn der Widerspruch rechtzeitig bei dem Amtsgericht Siegburg eingeht, auch wenn der Widerspruch zur Niederschrift der Geschäftsstelle eines anderen Amtsgerichts abgegeben wurde. Die Frist beginnt jeweils mit der schriftlichen Bekanntgabe der Verfügung an die Beteiligten. Kann die schriftliche Bekanntgabe an einen Beteiligten nicht bewirkt werden, beginnt die Frist spätestens mit Ablauf von fünf Monaten nach Erlass der Verfügung. Die Bekanntgabe ist entweder durch Zustellung oder am dritten Tage nach Aufgabe zur Post bewirkt. Sofern die Löschung noch nicht erfolgt ist, kann der Widerspruch auch noch nach Ablauf der Frist eingelegt werden. Fällt das Ende der Frist auf einen Sonnabend, einen Sonntag oder einen allgemeinen Feiertag, endet die Frist mit Ablauf des nächsten Werktages. Der Widerspruch ist zu unterzeichnen. Eine Begründung des Widerspruchs ist nicht vorgeschrieben."
    },
    {
      "date": "2025-06-12",
      "id": "112031",
      "original_text": "Löschungsankündigung\nNordrhein-Westfalen Amtsgericht Köln HRB 81537\nVIVAO GmbH – Kerpen",
      "type": "Löschungsankündigung",
      "state": "Nordrhein-Westfalen",
      "amtsgericht": "Amtsgericht Köln",
      "registernummer": "HRB 81537",
      "registerart": "HRB",
      "company_name": "VIVAO GmbH",
      "company_seat": "Kerpen",
      "details": "12.06.2025 (Bekanntmachungsdatum)\n\nNordrhein-Westfalen Amtsgericht Köln HRB 81537\nLöschungsankündigung\n\nVIVAO GmbH\nGesellschaft mit beschränkter Haftung\nKerpen\n\nDas Registergericht beabsichtigt, die im Handelsregister eingetragene Gesellschaft gemäß § 394 Absatz 1 FamFG wegen Vermögenslosigkeit von Amts wegen zu löschen. Gegen diese Verfügung kann Widerspruch eingelegt werden. Die Frist zur Erhebung eines Widerspruchs gegen die beabsichtigte Löschung von Amts wegen ist auf einen Monat festgesetzt. Rechtsbehelfsbelehrung: Gegen diese Verfügung können Sie Widerspruch einlegen. Der Widerspruch ist bei dem Amtsgericht Köln, Reichenspergerplatz 1, 50670 Köln schriftlich in deutscher Sprache oder zur Niederschrift der Geschäftsstelle einzulegen. Der Widerspruch kann auch zur Niederschrift der Geschäftsstelle eines jeden Amtsgerichtes abgegeben werden. Die Einlegung ist auch durch Übertragung eines elektronischen Dokuments an die elektronische Poststelle des Gerichts möglich. Das elektronische Dokument muss für die Bearbeitung durch das Gericht geeignet und mit einer qualifizierten elektronischen Signatur der verantwortenden Person versehen sein oder von der verantwortenden Person signiert und auf einem sicheren Übermittlungsweg gemäß § 130a ZPO nach näherer Maßgabe der Verordnung über die technischen Rahmenbedingungen des elektronischen Rechtsverkehrs und über das besondere elektronische Behördenpostfach (BGBl. I, S.3803) eingereicht werden. Weitere Informationen erhalten Sie auf der Internetseite www.justiz.de.Der Widerspruch muss spätestens innerhalb der gesetzten Frist bei dem Amtsgericht Köln eingegangen sein. Dies gilt auch dann, wenn der Widerspruch zur Niederschrift der Geschäftsstelle eines anderen Amtsgerichtes abgegeben wurde. Die Frist beginnt mit der Veröffentlichung. Fällt das Ende der Frist auf einen Sonntag, einen allgemeinen Feiertag oder Sonnabend, so endet die Frist mit Ablauf des nächsten Werktages.\n\nDer Widerspruch muss die Bezeichnung der angefochtenen Verfügung sowie die Erklärung enthalten, dass Widerspruch gegen diese Verfügung eingelegt wird. Er ist zu unterzeichnen und soll begründet werden."
    },
    {
      "date": "2025-06-12",
      "id": "112032",
      "original_text": "Registerbekanntmachung nach dem Umwandlungsgesetz\nBaden-Württemberg Amtsgericht Freiburg HRA 703697\nANELK Pharma GmbH & Co. KG – Radolfzell am Bodensee",
      "type": "Registerbekanntmachung nach dem Umwandlungsgesetz",
      "state": "Baden-Württemberg",
      "amtsgericht": "Amtsgericht Freiburg",
      "registernummer": "HRA 703697",
      "registerart": "HRA",
      "company_name": "ANELK Pharma GmbH & Co. KG",
      "company_seat": "Radolfzell am Bodensee",
      "details": "12.06.2025 (Bekanntmachungsdatum)\n\nBaden-Württemberg Amtsgericht Freiburg HRA 703697\nRegisterbekanntmachung nach dem Umwandlungsgesetz 12.06.2025 (Eintragungsdatum)\n\nANELK Pharma GmbH & Co. KG\nKommanditgesellschaft\nRadolfzell am Bodensee\n\nDie Gesellschaft ist gemäß Beschluss vom 12.05.2025 in die \" ANELK Pharma GmbH“ mit Sitz in Engen (Amtsgericht Freiburg im Breisgau, HRB 733365) formwechselnd umgewandelt. Den Gläubigern des an dem Formwechsel beteiligten Rechtsträgers ist, wenn sie binnen sechs Monaten nach dem Tag, an dem die Eintragung des Formwechsels in das Register des Sitzes desjenigen Rechtsträgers, dessen Gläubiger sie sind, nach § 19 Abs. 3 UmwG als bekanntgemacht gilt, ihren Anspruch nach Grund und Höhe schriftlich anmelden, Sicherheit zu leisten, soweit sie nicht Befriedigung verlangen können. Dieses Recht steht den Gläubigern jedoch nur zu, wenn sie glaubhaft machen, dass durch den Formwechsel die Erfüllung ihrer Forderung gefährdet wird."
    },
    {
      "date": "2025-06-12",
      "id": "112033",
      "original_text": "Registerbekanntmachung nach dem Umwandlungsgesetz\nThüringen Amtsgericht Jena HRB 302768\nMOORGRUND Beteiligungs- Verarbeitungs- und Vermarktungs- GmbH Im Dienste der Agrarwirtschaft – Bad Salzungen",
      "type": "Registerbekanntmachung nach dem Umwandlungsgesetz",
      "state": "Thüringen",
      "amtsgericht": "Amtsgericht Jena",
      "registernummer": "HRB 302768",
      "registerart": "HRB",
      "company_name": "MOORGRUND Beteiligungs- Verarbeitungs- und Vermarktungs- GmbH Im Dienste der Agrarwirtschaft",
      "company_seat": "Bad Salzungen",
      "details": "12.06.2025 (Bekanntmachungsdatum)\n\nThüringen Amtsgericht Jena HRB 302768\nRegisterbekanntmachung nach dem Umwandlungsgesetz 12.06.2025 (Eintragungsdatum)\n\nMOORGRUND Beteiligungs- Verarbeitungs- und Vermarktungs- GmbH Im Dienste der Agrarwirtschaft\nGesellschaft mit beschränkter Haftung\nBad Salzungen\n\nNicht eingetragen: Den Gläubigern der an der Verschmelzung beteiligten Rechtsträger, ist wenn sie binnen sechs Monaten nach dem Tag, an dem die Eintragung der Verschmelzung in das Register des Sitzes desjenigen Rechtsträgers, dessen Gläubiger sie sind,  nach § 19 Abs. 3 UmwG als bekanntgemacht gilt, ihren Anspruch nach Grund und Höhe schriftlich anmelden, Sicherheit zu leisten, soweit sie nicht Befriedigung verlangen können. Dieses Recht steht ihnen jedoch nur zu, wenn sie glaubhaft machen, daß durch die Verschmelzung die Erfüllung ihrer Forderung gefährdet wird."
    },
    {
      "date": "2025-06-12",
      "id": "112034",
      "original_text": "Registerbekanntmachung nach dem Umwandlungsgesetz\nThüringen Amtsgericht Jena HRB 402470\nAgrarprodukte Ettenhausen GmbH – Bad Salzungen",
      "type": "Registerbekanntmachung nach dem Umwandlungsgesetz",
      "state": "Thüringen",
      "amtsgericht": "Amtsgericht Jena",
      "registernummer": "HRB 402470",
      "registerart": "HRB",
      "company_name": "Agrarprodukte Ettenhausen GmbH",
      "company_seat": "Bad Salzungen",
      "details": "12.06.2025 (Bekanntmachungsdatum)\n\nThüringen Amtsgericht Jena HRB 402470\nRegisterbekanntmachung nach dem Umwandlungsgesetz 12.06.2025 (Eintragungsdatum)\n\nAgrarprodukte Ettenhausen GmbH\nGesellschaft mit beschränkter Haftung\nBad Salzungen\n\nNicht eingetragen: Den Gläubigern der an der Verschmelzung beteiligten Rechtsträger, ist wenn sie binnen sechs Monaten nach dem Tag, an dem die Eintragung der Verschmelzung in das Register des Sitzes desjenigen Rechtsträgers, dessen Gläubiger sie sind,  nach § 19 Abs. 3 UmwG als bekanntgemacht gilt, ihren Anspruch nach Grund und Höhe schriftlich anmelden, Sicherheit zu leisten, soweit sie nicht Befriedigung verlangen können. Dieses Recht steht ihnen jedoch nur zu, wenn sie glaubhaft machen, daß durch die Verschmelzung die Erfüllung ihrer Forderung gefährdet wird."
    },
    {
      "date": "2025-06-12",
      "id": "112035",
      "original_text": "Sonstige Registerbekanntmachung\nHessen Amtsgericht Frankfurt am Main HRB 11439\nOFB Projektentwicklung GmbH – Frankfurt am Main",
      "type": "Sonstige Registerbekanntmachung",
      "state": "Hessen",
      "amtsgericht": "Amtsgericht Frankfurt am Main",
      "registernummer": "HRB 11439",
      "registerart": "HRB",
      "company_name": "OFB Projektentwicklung GmbH",
      "company_seat": "Frankfurt am Main",
      "details": "12.06.2025 (Bekanntmachungsdatum)\n\nHessen Amtsgericht Frankfurt am Main HRB 11439\nSonstige Registerbekanntmachung\n\nOFB Projektentwicklung GmbH\nGesellschaft mit beschränkter Haftung\nFrankfurt am Main\n\nDurch eine Änderung in den Personen der Aufsichtsratsmitglieder ist eine Liste der Mitglieder des Aufsichtsrates zum Handelsregister eingereicht worden."
    },
    {
      "date": "2025-06-12",
      "id": "112036",
      "original_text": "Registerbekanntmachung nach dem Umwandlungsgesetz\nHessen Amtsgericht Frankfurt am Main HRB 91000\nDLG Holding GmbH – Frankfurt am Main",
      "type": "Registerbekanntmachung nach dem Umwandlungsgesetz",
      "state": "Hessen",
      "amtsgericht": "Amtsgericht Frankfurt am Main",
      "registernummer": "HRB 91000",
      "registerart": "HRB",
      "company_name": "DLG Holding GmbH",
      "company_seat": "Frankfurt am Main",
      "details": "12.06.2025 (Bekanntmachungsdatum)\n\nHessen Amtsgericht Frankfurt am Main HRB 91000\nRegisterbekanntmachung nach dem Umwandlungsgesetz 12.06.2025 (Eintragungsdatum)\n\nDLG Holding GmbH\nGesellschaft mit beschränkter Haftung\nFrankfurt am Main\n\nDen Gläubigern der an der Verschmelzung beteiligten Rechtsträger ist, wenn sie binnen sechs Monaten nach dem Tag, an dem die Eintragung der Verschmelzung in das Register des Sitzes desjenigen Rechtsträgers, dessen Gläubiger sie sind, nach § 19 Absatz 3 UmwG bekannt gemacht worden ist, ihren Anspruch nach Grund und Höhe schriftlich anmelden, Sicherheit zu leisten, soweit sie nicht Befriedigung verlangen können. Dieses Recht steht den Gläubigern jedoch nur zu, wenn sie glaubhaft machen, dass durch die Verschmelzung die Erfüllung ihrer Forderung gefährdet wird."
    },
    {
      "date": "2025-06-12",
      "id": "112037",
      "original_text": "Registerbekanntmachung nach dem Umwandlungsgesetz\nHessen Amtsgericht Frankfurt am Main HRB 52338\nInvestors Marketing AG – Frankfurt am Main",
      "type": "Registerbekanntmachung nach dem Umwandlungsgesetz",
      "state": "Hessen",
      "amtsgericht": "Amtsgericht Frankfurt am Main",
      "registernummer": "HRB 52338",
      "registerart": "HRB",
      "company_name": "Investors Marketing AG",
      "company_seat": "Frankfurt am Main",
      "details": "12.06.2025 (Bekanntmachungsdatum)\n\nHessen Amtsgericht Frankfurt am Main HRB 52338\nRegisterbekanntmachung nach dem Umwandlungsgesetz\n\nInvestors Marketing AG\nAktiengesellschaft\nFrankfurt am Main\n\nDie Gesellschaft hat den Entwurf des Verschmelzungsvertrages zwischen ihr und der IM Digital Solutions GmbH, Frankfurt am Main (Amtsgericht Frankfurt am Main HRB 120851) beim Amtsgericht Frankfurt am Main (Registergericht) zur Einsichtnahme eingereicht."
    },
    {
      "date": "2025-06-12",
      "id": "112038",
      "original_text": "Registerbekanntmachung nach dem Umwandlungsgesetz\nHessen Amtsgericht Frankfurt am Main HRB 92469\nDLG Holding GmbH – Frankfurt am Main",
      "type": "Registerbekanntmachung nach dem Umwandlungsgesetz",
      "state": "Hessen",
      "amtsgericht": "Amtsgericht Frankfurt am Main",
      "registernummer": "HRB 92469",
      "registerart": "HRB",
      "company_name": "DLG Holding GmbH",
      "company_seat": "Frankfurt am Main",
      "details": "12.06.2025 (Bekanntmachungsdatum)\n\nHessen Amtsgericht Frankfurt am Main HRB 92469\nRegisterbekanntmachung nach dem Umwandlungsgesetz 12.06.2025 (Eintragungsdatum)\n\nDLG Holding GmbH\nGesellschaft mit beschränkter Haftung\nFrankfurt am Main\n\nDen Gläubigern der an der Verschmelzung beteiligten Rechtsträger ist, wenn sie binnen sechs Monaten nach dem Tag, an dem die Eintragung der Verschmelzung in das Register des Sitzes desjenigen Rechtsträgers, dessen Gläubiger sie sind, nach § 19 Absatz 3 UmwG bekannt gemacht worden ist, ihren Anspruch nach Grund und Höhe schriftlich anmelden, Sicherheit zu leisten, soweit sie nicht Befriedigung verlangen können. Dieses Recht steht den Gläubigern jedoch nur zu, wenn sie glaubhaft machen, dass durch die Verschmelzung die Erfüllung ihrer Forderung gefährdet wird."
    },
    {
      "date": "2025-06-12",
      "id": "112039",
      "original_text": "Einreichung neuer Dokumente\nHessen Amtsgericht Frankfurt am Main HRB 32000\nCOMMERZBANK Aktiengesellschaft – Frankfurt am Main",
      "type": "Einreichung neuer Dokumente",
      "state": "Hessen",
      "amtsgericht": "Amtsgericht Frankfurt am Main",
      "registernummer": "HRB 32000",
      "registerart": "HRB",
      "company_name": "COMMERZBANK Aktiengesellschaft",
      "company_seat": "Frankfurt am Main",
      "details": "12.06.2025 (Bekanntmachungsdatum)\n\nHessen Amtsgericht Frankfurt am Main HRB 32000\nEinreichung neuer Dokumente\n\nCOMMERZBANK Aktiengesellschaft\nAktiengesellschaft\nFrankfurt am Main\n\nDurch eine Änderung in den Personen der Aufsichtsratsmitglieder ist eine Liste der Mitglieder des Aufsichtsrates zum Handelsregister eingereicht worden."
    },
    {
      "date": "2025-06-12",
      "id": "112040",
      "original_text": "Sonstige Registerbekanntmachung\nHessen Amtsgericht Frankfurt am Main HRB 105687\nflatexDEGIRO Bank AG – Frankfurt am Main",
      "type": "Sonstige Registerbekanntmachung",
      "state": "Hessen",
      "amtsgericht": "Amtsgericht Frankfurt am Main",
      "registernummer": "HRB 105687",
      "registerart": "HRB",
      "company_name": "flatexDEGIRO Bank AG",
      "company_seat": "Frankfurt am Main",
      "details": "12.06.2025 (Bekanntmachungsdatum)\n\nHessen Amtsgericht Frankfurt am Main HRB 105687\nSonstige Registerbekanntmachung 12.06.2025 (Eintragungsdatum)\n\nflatexDEGIRO Bank AG\nAktiengesellschaft\nFrankfurt am Main\n\nDurch eine Änderung in den Personen der Aufsichtsratsmitglieder ist eine Liste der Mitglieder des Aufsichtsrates zum Handelsregister eingereicht worden."
    },
    {
      "date": "2025-06-12",
      "id": "112041",
      "original_text": "Löschungsankündigung\nHessen Amtsgericht Darmstadt HRB 100700\nFischweiher Automobile UG (haftungsbeschränkt) – Heppenheim",
      "type": "Löschungsankündigung",
      "state": "Hessen",
      "amtsgericht": "Amtsgericht Darmstadt",
      "registernummer": "HRB 100700",
      "registerart": "HRB",
      "company_name": "Fischweiher Automobile UG (haftungsbeschränkt)",
      "company_seat": "Heppenheim",
      "details": "12.06.2025 (Bekanntmachungsdatum)\n\nHessen Amtsgericht Darmstadt HRB 100700\nLöschungsankündigung\n\nFischweiher Automobile UG (haftungsbeschränkt)\nGesellschaft mit beschränkter Haftung\nHeppenheim\n\nDas Registergericht beabsichtigt die im Handelsregister eingetragene Gesellschaft von Amts wegen nach § 394 FamFG zu löschen. Die Frist zur Erhebung eines Widerspruchs gegen die beabsichtigte Löschung wird auf 3 Monate festgesetzt."
    },
    {
      "date": "2025-06-12",
      "id": "112042",
      "original_text": "Einreichung neuer Dokumente\nHessen Amtsgericht Hanau HRB 91109\nHanau Marketing GmbH – Hanau",
      "type": "Einreichung neuer Dokumente",
      "state": "Hessen",
      "amtsgericht": "Amtsgericht Hanau",
      "registernummer": "HRB 91109",
      "registerart": "HRB",
      "company_name": "Hanau Marketing GmbH",
      "company_seat": "Hanau",
      "details": "12.06.2025 (Bekanntmachungsdatum)\n\nHessen Amtsgericht Hanau HRB 91109\nEinreichung neuer Dokumente\n\nHanau Marketing GmbH\nGesellschaft mit beschränkter Haftung\nHanau\n\nDurch eine Änderung in den Personen der Aufsichtsratsmitglieder ist eine Liste der Mitglieder des Aufsichtsrates zum Handelsregister eingereicht worden."
    },
    {
      "date": "2025-06-12",
      "id": "112043",
      "original_text": "Löschungsankündigung\nHessen Amtsgericht Offenbach am Main HRB 43605\nDR Immobilien GmbH – Dreieich",
      "type": "Löschungsankündigung",
      "state": "Hessen",
      "amtsgericht": "Amtsgericht Offenbach am Main",
      "registernummer": "HRB 43605",
      "registerart": "HRB",
      "company_name": "DR Immobilien GmbH",
      "company_seat": "Dreieich",
      "details": "12.06.2025 (Bekanntmachungsdatum)\n\nHessen Amtsgericht Offenbach am Main HRB 43605\nLöschungsankündigung\n\nDR Immobilien GmbH\nGesellschaft mit beschränkter Haftung\nDreieich\n\nDas Registergericht beabsichtigt die im Handelsregister eingetragene Gesellschaft von Amts wegen nach § 394 FamFG zu löschen. Die Frist zur Erhebung eines Widerspruchs gegen die beabsichtigte Löschung wird auf 3 Monate festgesetzt."
    },
    {
      "date": "2025-06-12",
      "id": "112044",
      "original_text": "Löschungsankündigung\nHessen Amtsgericht Darmstadt HRB 99647\nHofmann Facility Services UG (haftungsbeschränkt) – Babenhausen",
      "type": "Löschungsankündigung",
      "state": "Hessen",
      "amtsgericht": "Amtsgericht Darmstadt",
      "registernummer": "HRB 99647",
      "registerart": "HRB",
      "company_name": "Hofmann Facility Services UG (haftungsbeschränkt)",
      "company_seat": "Babenhausen",
      "details": "12.06.2025 (Bekanntmachungsdatum)\n\nHessen Amtsgericht Darmstadt HRB 99647\nLöschungsankündigung\n\nHofmann Facility Services UG (haftungsbeschränkt)\nGesellschaft mit beschränkter Haftung\nBabenhausen\n\nDas Registergericht beabsichtigt die im Handelsregister eingetragene Gesellschaft von Amts wegen nach § 394 FamFG zu löschen. Die Frist zur Erhebung eines Widerspruchs gegen die beabsichtigte Löschung wird auf 3 Monate festgesetzt."
    },
    {
      "date": "2025-06-12",
      "id": "112045",
      "original_text": "Registerbekanntmachung nach dem Umwandlungsgesetz\nHessen Amtsgericht Darmstadt HRB 95234\ndeviceTRUST GmbH – Darmstadt",
      "type": "Registerbekanntmachung nach dem Umwandlungsgesetz",
      "state": "Hessen",
      "amtsgericht": "Amtsgericht Darmstadt",
      "registernummer": "HRB 95234",
      "registerart": "HRB",
      "company_name": "deviceTRUST GmbH",
      "company_seat": "Darmstadt",
      "details": "12.06.2025 (Bekanntmachungsdatum)\n\nHessen Amtsgericht Darmstadt HRB 95234\nRegisterbekanntmachung nach dem Umwandlungsgesetz 12.06.2025 (Eintragungsdatum)\n\ndeviceTRUST GmbH\nGesellschaft mit beschränkter Haftung\nDarmstadt\n\nDen Gläubigern der an der Verschmelzung beteiligten Rechtsträger ist, wenn sie binnen sechs Monaten nach dem Tag, an dem die Eintragung der Verschmelzung in das Register des Sitzes desjenigen Rechtsträgers, dessen Gläubiger sie sind, nach § 19 Absatz 3 UmwG bekannt gemacht worden ist, ihren Anspruch nach Grund und Höhe schriftlich anmelden, Sicherheit zu leisten, soweit sie nicht Befriedigung verlangen können. Dieses Recht steht den Gläubigern jedoch nur zu, wenn sie glaubhaft machen, dass durch die Verschmelzung die Erfüllung ihrer Forderung gefährdet wird."
    },
    {
      "date": "2025-06-12",
      "id": "112046",
      "original_text": "Löschungsankündigung\nHessen Amtsgericht Wiesbaden HRB 26820\nBest Clean UG (haftungsbeschränkt) – Wiesbaden",
      "type": "Löschungsankündigung",
      "state": "Hessen",
      "amtsgericht": "Amtsgericht Wiesbaden",
      "registernummer": "HRB 26820",
      "registerart": "HRB",
      "company_name": "Best Clean UG (haftungsbeschränkt)",
      "company_seat": "Wiesbaden",
      "details": "12.06.2025 (Bekanntmachungsdatum)\n\nHessen Amtsgericht Wiesbaden HRB 26820\nLöschungsankündigung\n\nBest Clean UG (haftungsbeschränkt)\nGesellschaft mit beschränkter Haftung\nWiesbaden\n\nDas Registergericht beabsichtigt die im Handelsregister eingetragene Gesellschaft von Amts wegen nach § 394 FamFG zu löschen. Die Frist zur Erhebung eines Widerspruchs gegen die beabsichtigte Löschung wird auf 3 Monate festgesetzt."
    },
    {
      "date": "2025-06-12",
      "id": "112047",
      "original_text": "Löschungsankündigung\nHessen Amtsgericht Offenbach am Main HRB 52205\nDynamictec GmbH – Dreieich",
      "type": "Löschungsankündigung",
      "state": "Hessen",
      "amtsgericht": "Amtsgericht Offenbach am Main",
      "registernummer": "HRB 52205",
      "registerart": "HRB",
      "company_name": "Dynamictec GmbH",
      "company_seat": "Dreieich",
      "details": "12.06.2025 (Bekanntmachungsdatum)\n\nHessen Amtsgericht Offenbach am Main HRB 52205\nLöschungsankündigung\n\nDynamictec GmbH\nGesellschaft mit beschränkter Haftung\nDreieich\n\nDas Registergericht beabsichtigt die im Handelsregister eingetragene Gesellschaft von Amts wegen nach § 394 FamFG zu löschen. Die Frist zur Erhebung eines Widerspruchs gegen die beabsichtigte Löschung wird auf 3 Monate festgesetzt."
    },
    {
      "date": "2025-06-12",
      "id": "112048",
      "original_text": "Sonstige Registerbekanntmachung\nHessen Amtsgericht Wiesbaden VR 1632\nGesellschaft zur Förderung der Forschung e.V. – Wiesbaden",
      "type": "Sonstige Registerbekanntmachung",
      "state": "Hessen",
      "amtsgericht": "Amtsgericht Wiesbaden",
      "registernummer": "VR 1632",
      "registerart": "VR",
      "company_name": "Gesellschaft zur Förderung der Forschung e.V.",
      "company_seat": "Wiesbaden",
      "details": "12.06.2025 (Bekanntmachungsdatum)\n\nHessen Amtsgericht Wiesbaden VR 1632\nSonstige Registerbekanntmachung 12.06.2025 (Eintragungsdatum)\n\nGesellschaft zur Förderung der Forschung e.V.\neingetragener Verein\nWiesbaden\n\nDer Verein ist aufgelöst."
    }
  ]
}