{
  "date": "2025-06-27",
  "date_of_scrape": "2025-06-28T04:12:16.514Z",
  "tool_version": "0.2.0",
  "number_of_announcements": 164,
  "announcements": [
    {
      "date": "2025-06-27",
      "id": "113620",
      "original_text": "Löschungsankündigung\nBayern Amtsgericht München HRB 238667\nAutomobile Josef UG (haftungsbeschränkt) – Gröbenzell",
      "type": "Löschungsankündigung",
      "state": "Bayern",
      "amtsgericht": "Amtsgericht München",
      "registernummer": "HRB 238667",
      "registerart": "HRB",
      "company_name": "Automobile Josef UG (haftungsbeschränkt)",
      "company_seat": "Gröbenzell",
      "details": "27.06.2025 (Bekanntmachungsdatum)\n\nBayern Amtsgericht München HRB 238667\nLöschungsankündigung\n\nAutomobile Josef UG (haftungsbeschränkt)\nGesellschaft mit beschränkter Haftung\nGröbenzell\n\nDas Registergericht beabsichtigt, die im Handelsregister eingetragene Gesellschaft wegen Vermögenslosigkeit von Amts wegen nach § 394 FamFG zu löschen. Die Frist zur Erhebung eines Widerspruchs ist auf drei Monate festgesetzt."
    },
    {
      "date": "2025-06-27",
      "id": "113621",
      "original_text": "Registerbekanntmachung nach dem Umwandlungsgesetz\nBayern Amtsgericht München HRB 203771\nU-Shin Deutschland Grundvermögen GmbH – Erdweg",
      "type": "Registerbekanntmachung nach dem Umwandlungsgesetz",
      "state": "Bayern",
      "amtsgericht": "Amtsgericht München",
      "registernummer": "HRB 203771",
      "registerart": "HRB",
      "company_name": "U-Shin Deutschland Grundvermögen GmbH",
      "company_seat": "Erdweg",
      "details": "27.06.2025 (Bekanntmachungsdatum)\n\nBayern Amtsgericht München HRB 203771\nRegisterbekanntmachung nach dem Umwandlungsgesetz 26.06.2025 (Eintragungsdatum)\n\nU-Shin Deutschland Grundvermögen GmbH\nGesellschaft mit beschränkter Haftung\nErdweg\n\nDen Gläubigern der an der Verschmelzung beteiligten Rechtsträger ist, wenn sie binnen sechs Monaten nach dem Tag, an dem die Eintragung der Verschmelzung in das Register des Sitzes desjenigen Rechtsträgers, dessen Gläubiger sie sind, nach § 19 Abs. 3 UmwG als bekannt gemacht gilt, ihren Anspruch nach Grund und Höhe in Textform anmelden, Sicherheit zu leisten, soweit sie nicht Befriedigung verlangen können. Dieses Recht steht den Gläubigern jedoch nur zu, wenn sie glaubhaft machen, dass durch die Verschmelzung die Erfüllung ihrer Forderung gefährdet wird."
    },
    {
      "date": "2025-06-27",
      "id": "113622",
      "original_text": "Einreichung neuer Dokumente\nBayern Amtsgericht Aschaffenburg HRB 12203\nLHY Powertrain Verwaltungs GmbH – Aschaffenburg",
      "type": "Einreichung neuer Dokumente",
      "state": "Bayern",
      "amtsgericht": "Amtsgericht Aschaffenburg",
      "registernummer": "HRB 12203",
      "registerart": "HRB",
      "company_name": "LHY Powertrain Verwaltungs GmbH",
      "company_seat": "Aschaffenburg",
      "details": "27.06.2025 (Bekanntmachungsdatum)\n\nBayern Amtsgericht Aschaffenburg HRB 12203\nEinreichung neuer Dokumente\n\nLHY Powertrain Verwaltungs GmbH\nGesellschaft mit beschränkter Haftung\nAschaffenburg\n\nDem Amtsgericht Aschaffenburg -Registergericht- ist eine Liste der Mitglieder des Aufsichtsrats eingereicht worden, § 52 Abs. 3 S. 2 GmbHG."
    },
    {
      "date": "2025-06-27",
      "id": "113623",
      "original_text": "Einreichung neuer Dokumente\nBayern Amtsgericht München HRB 289271\nFNZ Bank SE – Aschheim",
      "type": "Einreichung neuer Dokumente",
      "state": "Bayern",
      "amtsgericht": "Amtsgericht München",
      "registernummer": "HRB 289271",
      "registerart": "HRB",
      "company_name": "FNZ Bank SE",
      "company_seat": "Aschheim",
      "details": "27.06.2025 (Bekanntmachungsdatum)\n\nBayern Amtsgericht München HRB 289271\nEinreichung neuer Dokumente\n\nFNZ Bank SE\nEuropäische Aktiengesellschaft (SE)\nAschheim\n\nDem Amtsgericht München -Registergericht- ist eine Liste der Mitglieder des Aufsichtsrats eingereicht worden, Art. 9 Abs. 1 Buchst. c (ii) SE-VO i.V.m. § 106 AktG."
    },
    {
      "date": "2025-06-27",
      "id": "113624",
      "original_text": "Registerbekanntmachung nach dem Umwandlungsgesetz\nBayern Amtsgericht München HRA 120089\nPatrick Asanger e.K. – Hausham",
      "type": "Registerbekanntmachung nach dem Umwandlungsgesetz",
      "state": "Bayern",
      "amtsgericht": "Amtsgericht München",
      "registernummer": "HRA 120089",
      "registerart": "HRA",
      "company_name": "Patrick Asanger e.K.",
      "company_seat": "Hausham",
      "details": "27.06.2025 (Bekanntmachungsdatum)\n\nBayern Amtsgericht München HRA 120089\nRegisterbekanntmachung nach dem Umwandlungsgesetz 26.06.2025 (Eintragungsdatum)\n\nPatrick Asanger e.K.\nEinzelkaufmann / Einzelkauffrau\nHausham\n\nDen Gläubigern der an der Ausgliederung beteiligten Rechtsträger ist, wenn sie binnen sechs Monaten nach dem Tag, an dem die Eintragung der Ausgliederung in das Register des Sitzes desjenigen Rechtsträgers, dessen Gläubiger sie sind, nach §§ 125, 19 Abs. 3 UmwG als bekannt gemacht gilt, ihren Anspruch nach Grund und Höhe in Textform anmelden, Sicherheit zu leisten, soweit sie nicht Befriedigung verlangen können. Dieses Recht steht den Gläubigern jedoch nur zu, wenn sie glaubhaft machen, dass durch die Ausgliederung die Erfüllung ihrer Forderung gefährdet wird."
    },
    {
      "date": "2025-06-27",
      "id": "113625",
      "original_text": "Registerbekanntmachung nach dem Umwandlungsgesetz\nBayern Amtsgericht Landshut HRA 12807\nBeißmann GmbH & Co. KG – Pfarrkirchen",
      "type": "Registerbekanntmachung nach dem Umwandlungsgesetz",
      "state": "Bayern",
      "amtsgericht": "Amtsgericht Landshut",
      "registernummer": "HRA 12807",
      "registerart": "HRA",
      "company_name": "Beißmann GmbH & Co. KG",
      "company_seat": "Pfarrkirchen",
      "details": "27.06.2025 (Bekanntmachungsdatum)\n\nBayern Amtsgericht Landshut HRA 12807\nRegisterbekanntmachung nach dem Umwandlungsgesetz 26.06.2025 (Eintragungsdatum)\n\nBeißmann GmbH & Co. KG\nKommanditgesellschaft\nPfarrkirchen\n\nDen Gläubigern der an der Ausgliederung beteiligten Rechtsträger ist, wenn sie binnen sechs Monaten nach dem Tag, an dem die Eintragung der Ausgliederung in das Register des Sitzes desjenigen Rechtsträgers, dessen Gläubiger sie sind, nach §§ 125, 19 Abs. 3 UmwG als bekannt gemacht gilt, ihren Anspruch nach Grund und Höhe in Textform anmelden, Sicherheit zu leisten, soweit sie nicht Befriedigung verlangen können. Dieses Recht steht den Gläubigern jedoch nur zu, wenn sie glaubhaft machen, dass durch die Ausgliederung die Erfüllung ihrer Forderung gefährdet wird."
    },
    {
      "date": "2025-06-27",
      "id": "113626",
      "original_text": "Registerbekanntmachung nach dem Umwandlungsgesetz\nBayern Amtsgericht Ingolstadt HRB 10196\nbauwoimmo GmbH – Schrobenhausen",
      "type": "Registerbekanntmachung nach dem Umwandlungsgesetz",
      "state": "Bayern",
      "amtsgericht": "Amtsgericht Ingolstadt",
      "registernummer": "HRB 10196",
      "registerart": "HRB",
      "company_name": "bauwoimmo GmbH",
      "company_seat": "Schrobenhausen",
      "details": "27.06.2025 (Bekanntmachungsdatum)\n\nBayern Amtsgericht Ingolstadt HRB 10196\nRegisterbekanntmachung nach dem Umwandlungsgesetz 26.06.2025 (Eintragungsdatum)\n\nbauwoimmo GmbH\nGesellschaft mit beschränkter Haftung\nSchrobenhausen\n\nDen Gläubigern der an der Verschmelzung beteiligten Rechtsträger ist, wenn sie binnen sechs Monaten nach dem Tag, an dem die Eintragung der Verschmelzung in das Register des Sitzes desjenigen Rechtsträgers, dessen Gläubiger sie sind, nach § 19 Abs. 3 UmwG als bekannt gemacht gilt, ihren Anspruch nach Grund und Höhe in Textform anmelden, Sicherheit zu leisten, soweit sie nicht Befriedigung verlangen können. Dieses Recht steht den Gläubigern jedoch nur zu, wenn sie glaubhaft machen, dass durch die Verschmelzung die Erfüllung ihrer Forderung gefährdet wird."
    },
    {
      "date": "2025-06-27",
      "id": "113627",
      "original_text": "Registerbekanntmachung nach dem Umwandlungsgesetz\nBayern Amtsgericht Augsburg HRB 38260\nLS Verwaltungs GmbH – Friedberg",
      "type": "Registerbekanntmachung nach dem Umwandlungsgesetz",
      "state": "Bayern",
      "amtsgericht": "Amtsgericht Augsburg",
      "registernummer": "HRB 38260",
      "registerart": "HRB",
      "company_name": "LS Verwaltungs GmbH",
      "company_seat": "Friedberg",
      "details": "27.06.2025 (Bekanntmachungsdatum)\n\nBayern Amtsgericht Augsburg HRB 38260\nRegisterbekanntmachung nach dem Umwandlungsgesetz 26.06.2025 (Eintragungsdatum)\n\nLS Verwaltungs GmbH\nGesellschaft mit beschränkter Haftung\nFriedberg\n\nDen Gläubigern der an der Verschmelzung beteiligten Rechtsträger ist, wenn sie binnen sechs Monaten nach dem Tag, an dem die Eintragung der Verschmelzung in das Register des Sitzes desjenigen Rechtsträgers, dessen Gläubiger sie sind, nach § 19 Abs. 3 UmwG als bekannt gemacht gilt, ihren Anspruch nach Grund und Höhe in Textform anmelden, Sicherheit zu leisten, soweit sie nicht Befriedigung verlangen können. Dieses Recht steht den Gläubigern jedoch nur zu, wenn sie glaubhaft machen, dass durch die Verschmelzung die Erfüllung ihrer Forderung gefährdet wird."
    },
    {
      "date": "2025-06-27",
      "id": "113628",
      "original_text": "Registerbekanntmachung nach dem Umwandlungsgesetz\nBayern Amtsgericht München HRB 262470\ndreifive 360 GmbH – Poing",
      "type": "Registerbekanntmachung nach dem Umwandlungsgesetz",
      "state": "Bayern",
      "amtsgericht": "Amtsgericht München",
      "registernummer": "HRB 262470",
      "registerart": "HRB",
      "company_name": "dreifive 360 GmbH",
      "company_seat": "Poing",
      "details": "27.06.2025 (Bekanntmachungsdatum)\n\nBayern Amtsgericht München HRB 262470\nRegisterbekanntmachung nach dem Umwandlungsgesetz 26.06.2025 (Eintragungsdatum)\n\ndreifive 360 GmbH\nGesellschaft mit beschränkter Haftung\nPoing\n\nDen Gläubigern der an der Verschmelzung beteiligten Rechtsträger ist, wenn sie binnen sechs Monaten nach dem Tag, an dem die Eintragung der Verschmelzung in das Register des Sitzes desjenigen Rechtsträgers, dessen Gläubiger sie sind, nach § 19 Abs. 3 UmwG als bekannt gemacht gilt, ihren Anspruch nach Grund und Höhe in Textform anmelden, Sicherheit zu leisten, soweit sie nicht Befriedigung verlangen können. Dieses Recht steht den Gläubigern jedoch nur zu, wenn sie glaubhaft machen, dass durch die Verschmelzung die Erfüllung ihrer Forderung gefährdet wird."
    },
    {
      "date": "2025-06-27",
      "id": "113629",
      "original_text": "Einreichung neuer Dokumente\nBayern Amtsgericht Würzburg HRB 6101\nGeoinform Softwarevertrieb Aktiengesellschaft – Würzburg",
      "type": "Einreichung neuer Dokumente",
      "state": "Bayern",
      "amtsgericht": "Amtsgericht Würzburg",
      "registernummer": "HRB 6101",
      "registerart": "HRB",
      "company_name": "Geoinform Softwarevertrieb Aktiengesellschaft",
      "company_seat": "Würzburg",
      "details": "27.06.2025 (Bekanntmachungsdatum)\n\nBayern Amtsgericht Würzburg HRB 6101\nEinreichung neuer Dokumente 16.06.2025 (Eintragungsdatum)\n\nGeoinform Softwarevertrieb Aktiengesellschaft\nAktiengesellschaft\nWürzburg\n\nDem Amtsgericht Würzburg -Registergericht- ist eine Liste der Mitglieder des Aufsichtsrats eingereicht worden, § 106 AktG."
    },
    {
      "date": "2025-06-27",
      "id": "113630",
      "original_text": "Registerbekanntmachung nach dem Umwandlungsgesetz\nBayern Amtsgericht München HRB 231812\nOberanger 38 Management GmbH – München",
      "type": "Registerbekanntmachung nach dem Umwandlungsgesetz",
      "state": "Bayern",
      "amtsgericht": "Amtsgericht München",
      "registernummer": "HRB 231812",
      "registerart": "HRB",
      "company_name": "Oberanger 38 Management GmbH",
      "company_seat": "München",
      "details": "27.06.2025 (Bekanntmachungsdatum)\n\nBayern Amtsgericht München HRB 231812\nRegisterbekanntmachung nach dem Umwandlungsgesetz 26.06.2025 (Eintragungsdatum)\n\nOberanger 38 Management GmbH\nGesellschaft mit beschränkter Haftung\nMünchen\n\nDen Gläubigern der an der Verschmelzung beteiligten Rechtsträger ist, wenn sie binnen sechs Monaten nach dem Tag, an dem die Eintragung der Verschmelzung in das Register des Sitzes desjenigen Rechtsträgers, dessen Gläubiger sie sind, nach § 19 Abs. 3 UmwG als bekannt gemacht gilt, ihren Anspruch nach Grund und Höhe in Textform anmelden, Sicherheit zu leisten, soweit sie nicht Befriedigung verlangen können. Dieses Recht steht den Gläubigern jedoch nur zu, wenn sie glaubhaft machen, dass durch die Verschmelzung die Erfüllung ihrer Forderung gefährdet wird."
    },
    {
      "date": "2025-06-27",
      "id": "113631",
      "original_text": "Registerbekanntmachung nach dem Umwandlungsgesetz\nBayern Amtsgericht Landshut HRA 8719\nAutohaus-Beißmann e.K. – Pfarrkirchen",
      "type": "Registerbekanntmachung nach dem Umwandlungsgesetz",
      "state": "Bayern",
      "amtsgericht": "Amtsgericht Landshut",
      "registernummer": "HRA 8719",
      "registerart": "HRA",
      "company_name": "Autohaus-Beißmann e.K.",
      "company_seat": "Pfarrkirchen",
      "details": "27.06.2025 (Bekanntmachungsdatum)\n\nBayern Amtsgericht Landshut HRA 8719\nRegisterbekanntmachung nach dem Umwandlungsgesetz 26.06.2025 (Eintragungsdatum)\n\nAutohaus-Beißmann e.K.\nEinzelkaufmann / Einzelkauffrau\nPfarrkirchen\n\nDen Gläubigern der an der Ausgliederung beteiligten Rechtsträger ist, wenn sie binnen sechs Monaten nach dem Tag, an dem die Eintragung der Ausgliederung in das Register des Sitzes desjenigen Rechtsträgers, dessen Gläubiger sie sind, nach §§ 125, 19 Abs. 3 UmwG als bekannt gemacht gilt, ihren Anspruch nach Grund und Höhe in Textform anmelden, Sicherheit zu leisten, soweit sie nicht Befriedigung verlangen können. Dieses Recht steht den Gläubigern jedoch nur zu, wenn sie glaubhaft machen, dass durch die Ausgliederung die Erfüllung ihrer Forderung gefährdet wird."
    },
    {
      "date": "2025-06-27",
      "id": "113632",
      "original_text": "Löschungsankündigung\nBayern Amtsgericht Hof HRB 5668\nTrend Home Collection GmbH – Regnitzlosau",
      "type": "Löschungsankündigung",
      "state": "Bayern",
      "amtsgericht": "Amtsgericht Hof",
      "registernummer": "HRB 5668",
      "registerart": "HRB",
      "company_name": "Trend Home Collection GmbH",
      "company_seat": "Regnitzlosau",
      "details": "27.06.2025 (Bekanntmachungsdatum)\n\nBayern Amtsgericht Hof HRB 5668\nLöschungsankündigung\n\nTrend Home Collection GmbH\nGesellschaft mit beschränkter Haftung\nRegnitzlosau\n\nDas Registergericht beabsichtigt, die im Handelsregister eingetragene Gesellschaft wegen Vermögenslosigkeit von Amts wegen nach § 394 FamFG zu löschen. Die Frist zur Erhebung eines Widerspruchs ist auf sechs Wochen festgesetzt."
    },
    {
      "date": "2025-06-27",
      "id": "113633",
      "original_text": "Löschungsankündigung\nBayern Amtsgericht München HRA 106249\nLeisure Apps GmbH & Co. KG – München",
      "type": "Löschungsankündigung",
      "state": "Bayern",
      "amtsgericht": "Amtsgericht München",
      "registernummer": "HRA 106249",
      "registerart": "HRA",
      "company_name": "Leisure Apps GmbH & Co. KG",
      "company_seat": "München",
      "details": "27.06.2025 (Bekanntmachungsdatum)\n\nBayern Amtsgericht München HRA 106249\nLöschungsankündigung 26.06.2025 (Eintragungsdatum)\n\nLeisure Apps GmbH & Co. KG\nKommanditgesellschaft\nMünchen\n\nDas Registergericht beabsichtigt, die im Handelsregister eingetragene Firma wegen Vermögenslosigkeit von Amts wegen nach § 394 FamFG zu löschen. Die Frist zur Erhebung eines Widerspruchs ist auf drei Monate festgesetzt."
    },
    {
      "date": "2025-06-27",
      "id": "113634",
      "original_text": "Löschungsankündigung\nBayern Amtsgericht Nürnberg HRB 33326\nRavenKraft GmbH – Nürnberg",
      "type": "Löschungsankündigung",
      "state": "Bayern",
      "amtsgericht": "Amtsgericht Nürnberg",
      "registernummer": "HRB 33326",
      "registerart": "HRB",
      "company_name": "RavenKraft GmbH",
      "company_seat": "Nürnberg",
      "details": "27.06.2025 (Bekanntmachungsdatum)\n\nBayern Amtsgericht Nürnberg HRB 33326\nLöschungsankündigung\n\nRavenKraft GmbH\nGesellschaft mit beschränkter Haftung\nNürnberg\n\nDas Registergericht beabsichtigt, den im Handelsregister eingetragenen Geschäftsführer wegen fehlender Eignung nach § 395 FamFG zu löschen. Die Frist zur Erhebung eines Widerspruchs ist auf zwei Monaten festgesetzt."
    },
    {
      "date": "2025-06-27",
      "id": "113635",
      "original_text": "Registerbekanntmachung nach dem Umwandlungsgesetz\nBayern Amtsgericht München HRB 262745\nVeristate Project GmbH – Wessobrunn",
      "type": "Registerbekanntmachung nach dem Umwandlungsgesetz",
      "state": "Bayern",
      "amtsgericht": "Amtsgericht München",
      "registernummer": "HRB 262745",
      "registerart": "HRB",
      "company_name": "Veristate Project GmbH",
      "company_seat": "Wessobrunn",
      "details": "27.06.2025 (Bekanntmachungsdatum)\n\nBayern Amtsgericht München HRB 262745\nRegisterbekanntmachung nach dem Umwandlungsgesetz\n\nVeristate Project GmbH\nGesellschaft mit beschränkter Haftung\nWessobrunn\n\nDem Amtsgericht München -Registergericht- ist am 25.06.2025 der Entwurf eines Verschmelzungsplanes über die geplante Verschmelzung der Gesellschaft als übernehmendem Rechtsträger mit der Private Company Limited By Shares nach irischem Recht  unter Firma PRESS FINISH HOLDINGS LIMITED mit satzungsmäßigem Sitz in Limerick, V94 EHE6, Irland (Company No. 411372) eingereicht worden. Hinweis: Die Anteilsinhaber und Gläubiger der an der grenzüberschreitenden Verschmelzung beteiligten Gesellschaften können der jeweiligen Gesellschaft spätestens  fünf Arbeitstage vor dem Tag der Gesellschafterversammlung Bemerkungen zum Verschmelzungsplan übermitteln."
    },
    {
      "date": "2025-06-27",
      "id": "113636",
      "original_text": "Registerbekanntmachung nach dem Umwandlungsgesetz\nBayern Amtsgericht München HRB 226442\neMoments GmbH – München",
      "type": "Registerbekanntmachung nach dem Umwandlungsgesetz",
      "state": "Bayern",
      "amtsgericht": "Amtsgericht München",
      "registernummer": "HRB 226442",
      "registerart": "HRB",
      "company_name": "eMoments GmbH",
      "company_seat": "München",
      "details": "27.06.2025 (Bekanntmachungsdatum)\n\nBayern Amtsgericht München HRB 226442\nRegisterbekanntmachung nach dem Umwandlungsgesetz 26.06.2025 (Eintragungsdatum)\n\neMoments GmbH\nGesellschaft mit beschränkter Haftung\nMünchen\n\nDen Gläubigern der an der Verschmelzung beteiligten Rechtsträger ist, wenn sie binnen sechs Monaten nach dem Tag, an dem die Eintragung der Verschmelzung in das Register des Sitzes desjenigen Rechtsträgers, dessen Gläubiger sie sind, nach § 19 Abs. 3 UmwG als bekannt gemacht gilt, ihren Anspruch nach Grund und Höhe in Textform anmelden, Sicherheit zu leisten, soweit sie nicht Befriedigung verlangen können. Dieses Recht steht den Gläubigern jedoch nur zu, wenn sie glaubhaft machen, dass durch die Verschmelzung die Erfüllung ihrer Forderung gefährdet wird."
    },
    {
      "date": "2025-06-27",
      "id": "113637",
      "original_text": "Registerbekanntmachung nach dem Umwandlungsgesetz\nBayern Amtsgericht München HRB 253615\nGrowth360 GmbH – Poing",
      "type": "Registerbekanntmachung nach dem Umwandlungsgesetz",
      "state": "Bayern",
      "amtsgericht": "Amtsgericht München",
      "registernummer": "HRB 253615",
      "registerart": "HRB",
      "company_name": "Growth360 GmbH",
      "company_seat": "Poing",
      "details": "27.06.2025 (Bekanntmachungsdatum)\n\nBayern Amtsgericht München HRB 253615\nRegisterbekanntmachung nach dem Umwandlungsgesetz 26.06.2025 (Eintragungsdatum)\n\nGrowth360 GmbH\nGesellschaft mit beschränkter Haftung\nPoing\n\nDen Gläubigern der an der Verschmelzung beteiligten Rechtsträger ist, wenn sie binnen sechs Monaten nach dem Tag, an dem die Eintragung der Verschmelzung in das Register des Sitzes desjenigen Rechtsträgers, dessen Gläubiger sie sind, nach § 19 Abs. 3 UmwG als bekannt gemacht gilt, ihren Anspruch nach Grund und Höhe in Textform anmelden, Sicherheit zu leisten, soweit sie nicht Befriedigung verlangen können. Dieses Recht steht den Gläubigern jedoch nur zu, wenn sie glaubhaft machen, dass durch die Verschmelzung die Erfüllung ihrer Forderung gefährdet wird."
    },
    {
      "date": "2025-06-27",
      "id": "113638",
      "original_text": "Registerbekanntmachung nach dem Umwandlungsgesetz\nBayern Amtsgericht München HRB 228270\nWenning & Kollegen Steuerberatungsgesellschaft mbH – Rottach-Egern",
      "type": "Registerbekanntmachung nach dem Umwandlungsgesetz",
      "state": "Bayern",
      "amtsgericht": "Amtsgericht München",
      "registernummer": "HRB 228270",
      "registerart": "HRB",
      "company_name": "Wenning & Kollegen Steuerberatungsgesellschaft mbH",
      "company_seat": "Rottach-Egern",
      "details": "27.06.2025 (Bekanntmachungsdatum)\n\nBayern Amtsgericht München HRB 228270\nRegisterbekanntmachung nach dem Umwandlungsgesetz 26.06.2025 (Eintragungsdatum)\n\nWenning & Kollegen Steuerberatungsgesellschaft mbH\nGesellschaft mit beschränkter Haftung\nRottach-Egern\n\nDen Gläubigern der an der Verschmelzung beteiligten Rechtsträger ist, wenn sie binnen sechs Monaten nach dem Tag, an dem die Eintragung der Verschmelzung in das Register des Sitzes desjenigen Rechtsträgers, dessen Gläubiger sie sind, nach § 19 Abs. 3 UmwG als bekannt gemacht gilt, ihren Anspruch nach Grund und Höhe in Textform anmelden, Sicherheit zu leisten, soweit sie nicht Befriedigung verlangen können. Dieses Recht steht den Gläubigern jedoch nur zu, wenn sie glaubhaft machen, dass durch die Verschmelzung die Erfüllung ihrer Forderung gefährdet wird."
    },
    {
      "date": "2025-06-27",
      "id": "113639",
      "original_text": "Registerbekanntmachung nach dem Umwandlungsgesetz\nBayern Amtsgericht Würzburg HRA 8953\nZaman e.K. – Kitzingen",
      "type": "Registerbekanntmachung nach dem Umwandlungsgesetz",
      "state": "Bayern",
      "amtsgericht": "Amtsgericht Würzburg",
      "registernummer": "HRA 8953",
      "registerart": "HRA",
      "company_name": "Zaman e.K.",
      "company_seat": "Kitzingen",
      "details": "27.06.2025 (Bekanntmachungsdatum)\n\nBayern Amtsgericht Würzburg HRA 8953\nRegisterbekanntmachung nach dem Umwandlungsgesetz 26.06.2025 (Eintragungsdatum)\n\nZaman e.K.\nEinzelkaufmann / Einzelkauffrau\nKitzingen\n\nDen Gläubigern der an der Ausgliederung beteiligten Rechtsträger ist, wenn sie binnen sechs Monaten nach dem Tag, an dem die Eintragung der Ausgliederung in das Register des Sitzes desjenigen Rechtsträgers, dessen Gläubiger sie sind, nach §§ 125, 19 Abs. 3 UmwG als bekannt gemacht gilt, ihren Anspruch nach Grund und Höhe in Textform anmelden, Sicherheit zu leisten, soweit sie nicht Befriedigung verlangen können. Dieses Recht steht den Gläubigern jedoch nur zu, wenn sie glaubhaft machen, dass durch die Ausgliederung die Erfüllung ihrer Forderung gefährdet wird."
    },
    {
      "date": "2025-06-27",
      "id": "113640",
      "original_text": "Registerbekanntmachung nach dem Umwandlungsgesetz\nBayern Amtsgericht Augsburg HRA 21845\nGutschik Web Solutions e.K. – Landsberg am Lech",
      "type": "Registerbekanntmachung nach dem Umwandlungsgesetz",
      "state": "Bayern",
      "amtsgericht": "Amtsgericht Augsburg",
      "registernummer": "HRA 21845",
      "registerart": "HRA",
      "company_name": "Gutschik Web Solutions e.K.",
      "company_seat": "Landsberg am Lech",
      "details": "27.06.2025 (Bekanntmachungsdatum)\n\nBayern Amtsgericht Augsburg HRA 21845\nRegisterbekanntmachung nach dem Umwandlungsgesetz 26.06.2025 (Eintragungsdatum)\n\nGutschik Web Solutions e.K.\nEinzelkaufmann / Einzelkauffrau\nLandsberg am Lech\n\nDen Gläubigern der an der Ausgliederung beteiligten Rechtsträger ist, wenn sie binnen sechs Monaten nach dem Tag, an dem die Eintragung der Ausgliederung in das Register des Sitzes desjenigen Rechtsträgers, dessen Gläubiger sie sind, nach §§ 125, 19 Abs. 3 UmwG als bekannt gemacht gilt, ihren Anspruch nach Grund und Höhe in Textform anmelden, Sicherheit zu leisten, soweit sie nicht Befriedigung verlangen können. Dieses Recht steht den Gläubigern jedoch nur zu, wenn sie glaubhaft machen, dass durch die Ausgliederung die Erfüllung ihrer Forderung gefährdet wird."
    },
    {
      "date": "2025-06-27",
      "id": "113641",
      "original_text": "Registerbekanntmachung nach dem Umwandlungsgesetz\nBayern Amtsgericht Ingolstadt HRB 9292\nztnz GmbH – Schrobenhausen",
      "type": "Registerbekanntmachung nach dem Umwandlungsgesetz",
      "state": "Bayern",
      "amtsgericht": "Amtsgericht Ingolstadt",
      "registernummer": "HRB 9292",
      "registerart": "HRB",
      "company_name": "ztnz GmbH",
      "company_seat": "Schrobenhausen",
      "details": "27.06.2025 (Bekanntmachungsdatum)\n\nBayern Amtsgericht Ingolstadt HRB 9292\nRegisterbekanntmachung nach dem Umwandlungsgesetz 26.06.2025 (Eintragungsdatum)\n\nztnz GmbH\nGesellschaft mit beschränkter Haftung\nSchrobenhausen\n\nDen Gläubigern der an der Verschmelzung beteiligten Rechtsträger ist, wenn sie binnen sechs Monaten nach dem Tag, an dem die Eintragung der Verschmelzung in das Register des Sitzes desjenigen Rechtsträgers, dessen Gläubiger sie sind, nach § 19 Abs. 3 UmwG als bekannt gemacht gilt, ihren Anspruch nach Grund und Höhe in Textform anmelden, Sicherheit zu leisten, soweit sie nicht Befriedigung verlangen können. Dieses Recht steht den Gläubigern jedoch nur zu, wenn sie glaubhaft machen, dass durch die Verschmelzung die Erfüllung ihrer Forderung gefährdet wird."
    },
    {
      "date": "2025-06-27",
      "id": "113642",
      "original_text": "Löschungsankündigung\nBayern Amtsgericht Amberg HRB 7648\nHT-Trading UG (haftungsbeschränkt) – Schwandorf",
      "type": "Löschungsankündigung",
      "state": "Bayern",
      "amtsgericht": "Amtsgericht Amberg",
      "registernummer": "HRB 7648",
      "registerart": "HRB",
      "company_name": "HT-Trading UG (haftungsbeschränkt)",
      "company_seat": "Schwandorf",
      "details": "27.06.2025 (Bekanntmachungsdatum)\n\nBayern Amtsgericht Amberg HRB 7648\nLöschungsankündigung\n\nHT-Trading UG (haftungsbeschränkt)\nGesellschaft mit beschränkter Haftung\nSchwandorf\n\nDas Registergericht beabsichtigt, die im Handelsregister eingetragene Gesellschaft wegen Vermögenslosigkeit von Amts wegen nach § 394 FamFG zu löschen. Die Frist zur Erhebung eines Widerspruchs ist auf einen Monat festgesetzt."
    },
    {
      "date": "2025-06-27",
      "id": "113643",
      "original_text": "Einreichung neuer Dokumente\nBayern Amtsgericht München HRB 270215\nScout24 SE – München",
      "type": "Einreichung neuer Dokumente",
      "state": "Bayern",
      "amtsgericht": "Amtsgericht München",
      "registernummer": "HRB 270215",
      "registerart": "HRB",
      "company_name": "Scout24 SE",
      "company_seat": "München",
      "details": "27.06.2025 (Bekanntmachungsdatum)\n\nBayern Amtsgericht München HRB 270215\nEinreichung neuer Dokumente 26.06.2025 (Eintragungsdatum)\n\nScout24 SE\nEuropäische Aktiengesellschaft (SE)\nMünchen\n\nDem Amtsgericht München -Registergericht- ist eine Liste der Mitglieder des Aufsichtsrats eingereicht worden, Art. 9 Abs. 1 Buchst. c (ii) SE-VO i.V.m. § 106 AktG."
    },
    {
      "date": "2025-06-27",
      "id": "113644",
      "original_text": "Registerbekanntmachung nach dem Umwandlungsgesetz\nBayern Amtsgericht München HRB 294627\nKL Komplementär GmbH – München",
      "type": "Registerbekanntmachung nach dem Umwandlungsgesetz",
      "state": "Bayern",
      "amtsgericht": "Amtsgericht München",
      "registernummer": "HRB 294627",
      "registerart": "HRB",
      "company_name": "KL Komplementär GmbH",
      "company_seat": "München",
      "details": "27.06.2025 (Bekanntmachungsdatum)\n\nBayern Amtsgericht München HRB 294627\nRegisterbekanntmachung nach dem Umwandlungsgesetz 26.06.2025 (Eintragungsdatum)\n\nKL Komplementär GmbH\nGesellschaft mit beschränkter Haftung\nMünchen\n\nDen Gläubigern der an der Verschmelzung beteiligten Rechtsträger ist, wenn sie binnen sechs Monaten nach dem Tag, an dem die Eintragung der Verschmelzung in das Register des Sitzes desjenigen Rechtsträgers, dessen Gläubiger sie sind, nach § 19 Abs. 3 UmwG als bekannt gemacht gilt, ihren Anspruch nach Grund und Höhe in Textform anmelden, Sicherheit zu leisten, soweit sie nicht Befriedigung verlangen können. Dieses Recht steht den Gläubigern jedoch nur zu, wenn sie glaubhaft machen, dass durch die Verschmelzung die Erfüllung ihrer Forderung gefährdet wird."
    },
    {
      "date": "2025-06-27",
      "id": "113645",
      "original_text": "Einreichung neuer Dokumente\nBayern Amtsgericht München HRB 59294\nKS Versicherungs-Aktiengesellschaft – München",
      "type": "Einreichung neuer Dokumente",
      "state": "Bayern",
      "amtsgericht": "Amtsgericht München",
      "registernummer": "HRB 59294",
      "registerart": "HRB",
      "company_name": "KS Versicherungs-Aktiengesellschaft",
      "company_seat": "München",
      "details": "27.06.2025 (Bekanntmachungsdatum)\n\nBayern Amtsgericht München HRB 59294\nEinreichung neuer Dokumente\n\nKS Versicherungs-Aktiengesellschaft\nAktiengesellschaft\nMünchen\n\nDem #Re.Name ist eine Liste der Mitglieder des Aufsichtsrats eingereicht worden, § 106 AktG."
    },
    {
      "date": "2025-06-27",
      "id": "113646",
      "original_text": "Registerbekanntmachung nach dem Umwandlungsgesetz\nBayern Amtsgericht Ingolstadt HRB 9292\nztnz GmbH – Schrobenhausen",
      "type": "Registerbekanntmachung nach dem Umwandlungsgesetz",
      "state": "Bayern",
      "amtsgericht": "Amtsgericht Ingolstadt",
      "registernummer": "HRB 9292",
      "registerart": "HRB",
      "company_name": "ztnz GmbH",
      "company_seat": "Schrobenhausen",
      "details": "27.06.2025 (Bekanntmachungsdatum)\n\nBayern Amtsgericht Ingolstadt HRB 9292\nRegisterbekanntmachung nach dem Umwandlungsgesetz 26.06.2025 (Eintragungsdatum)\n\nztnz GmbH\nGesellschaft mit beschränkter Haftung\nSchrobenhausen\n\nDen Gläubigern der an der Verschmelzung beteiligten Rechtsträger ist, wenn sie binnen sechs Monaten nach dem Tag, an dem die Eintragung der Verschmelzung in das Register des Sitzes desjenigen Rechtsträgers, dessen Gläubiger sie sind, nach § 19 Abs. 3 UmwG als bekannt gemacht gilt, ihren Anspruch nach Grund und Höhe in Textform anmelden, Sicherheit zu leisten, soweit sie nicht Befriedigung verlangen können. Dieses Recht steht den Gläubigern jedoch nur zu, wenn sie glaubhaft machen, dass durch die Verschmelzung die Erfüllung ihrer Forderung gefährdet wird."
    },
    {
      "date": "2025-06-27",
      "id": "113647",
      "original_text": "Registerbekanntmachung nach dem Umwandlungsgesetz\nBayern Amtsgericht Ingolstadt HRB 11353\nreaidea GmbH – Schrobenhausen",
      "type": "Registerbekanntmachung nach dem Umwandlungsgesetz",
      "state": "Bayern",
      "amtsgericht": "Amtsgericht Ingolstadt",
      "registernummer": "HRB 11353",
      "registerart": "HRB",
      "company_name": "reaidea GmbH",
      "company_seat": "Schrobenhausen",
      "details": "27.06.2025 (Bekanntmachungsdatum)\n\nBayern Amtsgericht Ingolstadt HRB 11353\nRegisterbekanntmachung nach dem Umwandlungsgesetz 26.06.2025 (Eintragungsdatum)\n\nreaidea GmbH\nGesellschaft mit beschränkter Haftung\nSchrobenhausen\n\nDen Gläubigern der an der Verschmelzung beteiligten Rechtsträger ist, wenn sie binnen sechs Monaten nach dem Tag, an dem die Eintragung der Verschmelzung in das Register des Sitzes desjenigen Rechtsträgers, dessen Gläubiger sie sind, nach § 19 Abs. 3 UmwG als bekannt gemacht gilt, ihren Anspruch nach Grund und Höhe in Textform anmelden, Sicherheit zu leisten, soweit sie nicht Befriedigung verlangen können. Dieses Recht steht den Gläubigern jedoch nur zu, wenn sie glaubhaft machen, dass durch die Verschmelzung die Erfüllung ihrer Forderung gefährdet wird."
    },
    {
      "date": "2025-06-27",
      "id": "113648",
      "original_text": "Löschungsankündigung\nBayern Amtsgericht Nürnberg HRB 14206\ni-center Elektrogroßhandel Verwaltungs-GmbH – Nürnberg",
      "type": "Löschungsankündigung",
      "state": "Bayern",
      "amtsgericht": "Amtsgericht Nürnberg",
      "registernummer": "HRB 14206",
      "registerart": "HRB",
      "company_name": "i-center Elektrogroßhandel Verwaltungs-GmbH",
      "company_seat": "Nürnberg",
      "details": "27.06.2025 (Bekanntmachungsdatum)\n\nBayern Amtsgericht Nürnberg HRB 14206\nLöschungsankündigung\n\ni-center Elektrogroßhandel Verwaltungs-GmbH\nGesellschaft mit beschränkter Haftung\nNürnberg\n\nDas Registergericht beabsichtigt, die im Handelsregister eingetragene Gesellschaft wegen Vermögenslosigkeit von Amts wegen nach § 394 FamFG zu löschen. Die Frist zur Erhebung eines Widerspruchs ist auf einen Monat festgesetzt."
    },
    {
      "date": "2025-06-27",
      "id": "113649",
      "original_text": "Löschungsankündigung\nBayern Amtsgericht Nürnberg HRA 10097\nSchlögel Immobilien Inh. Jürgen Schlögel – Nürnberg",
      "type": "Löschungsankündigung",
      "state": "Bayern",
      "amtsgericht": "Amtsgericht Nürnberg",
      "registernummer": "HRA 10097",
      "registerart": "HRA",
      "company_name": "Schlögel Immobilien Inh. Jürgen Schlögel",
      "company_seat": "Nürnberg",
      "details": "27.06.2025 (Bekanntmachungsdatum)\n\nBayern Amtsgericht Nürnberg HRA 10097\nLöschungsankündigung\n\nSchlögel Immobilien Inh. Jürgen Schlögel\nEinzelkaufmann / Einzelkauffrau\nNürnberg\n\nDas Registergericht beabsichtigt, die im Handelsregister eingetragene Firma von Amts wegen nach § 31 Abs. 2 HGB zu löschen. Die Frist zur Erhebung eines Widerspruchs ist auf einen Monat festgesetzt."
    },
    {
      "date": "2025-06-27",
      "id": "113650",
      "original_text": "Registerbekanntmachung nach dem Umwandlungsgesetz\nBayern Amtsgericht München HRB 60008\nGromes Kraftfahrzeughandel GmbH – Wartenberg",
      "type": "Registerbekanntmachung nach dem Umwandlungsgesetz",
      "state": "Bayern",
      "amtsgericht": "Amtsgericht München",
      "registernummer": "HRB 60008",
      "registerart": "HRB",
      "company_name": "Gromes Kraftfahrzeughandel GmbH",
      "company_seat": "Wartenberg",
      "details": "27.06.2025 (Bekanntmachungsdatum)\n\nBayern Amtsgericht München HRB 60008\nRegisterbekanntmachung nach dem Umwandlungsgesetz 26.06.2025 (Eintragungsdatum)\n\nGromes Kraftfahrzeughandel GmbH\nGesellschaft mit beschränkter Haftung\nWartenberg\n\nDen Gläubigern der an der Verschmelzung beteiligten Rechtsträger ist, wenn sie binnen sechs Monaten nach dem Tag, an dem die Eintragung der Verschmelzung in das Register des Sitzes desjenigen Rechtsträgers, dessen Gläubiger sie sind, nach § 19 Abs. 3 UmwG als bekannt gemacht gilt, ihren Anspruch nach Grund und Höhe in Textform anmelden, Sicherheit zu leisten, soweit sie nicht Befriedigung verlangen können. Dieses Recht steht den Gläubigern jedoch nur zu, wenn sie glaubhaft machen, dass durch die Verschmelzung die Erfüllung ihrer Forderung gefährdet wird."
    },
    {
      "date": "2025-06-27",
      "id": "113651",
      "original_text": "Einreichung neuer Dokumente\nBayern Amtsgericht München HRB 83252\nExpleo Germany GmbH – München",
      "type": "Einreichung neuer Dokumente",
      "state": "Bayern",
      "amtsgericht": "Amtsgericht München",
      "registernummer": "HRB 83252",
      "registerart": "HRB",
      "company_name": "Expleo Germany GmbH",
      "company_seat": "München",
      "details": "27.06.2025 (Bekanntmachungsdatum)\n\nBayern Amtsgericht München HRB 83252\nEinreichung neuer Dokumente 26.06.2025 (Eintragungsdatum)\n\nExpleo Germany GmbH\nGesellschaft mit beschränkter Haftung\nMünchen\n\nDem Amtsgericht München -Registergericht- ist eine Liste der Mitglieder des Aufsichtsrats eingereicht worden, § 52 Abs. 3 S. 2 GmbHG."
    },
    {
      "date": "2025-06-27",
      "id": "113652",
      "original_text": "Löschungsankündigung\nBaden-Württemberg Amtsgericht Stuttgart HRA 13390\nHOC Company GmbH & Co. KG – Schorndorf",
      "type": "Löschungsankündigung",
      "state": "Baden-Württemberg",
      "amtsgericht": "Amtsgericht Stuttgart",
      "registernummer": "HRA 13390",
      "registerart": "HRA",
      "company_name": "HOC Company GmbH & Co. KG",
      "company_seat": "Schorndorf",
      "details": "27.06.2025 (Bekanntmachungsdatum)\n\nBaden-Württemberg Amtsgericht Stuttgart HRA 13390\nLöschungsankündigung\n\nHOC Company GmbH & Co. KG\nKommanditgesellschaft\nSchorndorf\n\nAls nicht eingetragen wird bekanntgemacht:\nDas Gericht beabsichtigt, die Gesellschaft wegen Vermögenslosigkeit im Handelsregister von Amts wegen nach § 394 FamFG zu löschen. Die Frist zur Geltendmachung eines Widerspruchs gegen die beabsichtigte Löschung ist auf zwei Monate ab Veröffentlichung bestimmt."
    },
    {
      "date": "2025-06-27",
      "id": "113653",
      "original_text": "Löschungsankündigung\nBerlin Amtsgericht Berlin (Charlottenburg) HRB 146576\nDUNIA GmbH – Berlin",
      "type": "Löschungsankündigung",
      "state": "Berlin",
      "amtsgericht": "Amtsgericht Berlin (Charlottenburg)",
      "registernummer": "HRB 146576",
      "registerart": "HRB",
      "company_name": "DUNIA GmbH",
      "company_seat": "Berlin",
      "details": "27.06.2025 (Bekanntmachungsdatum)\n\nBerlin Amtsgericht Berlin (Charlottenburg) HRB 146576\nLöschungsankündigung\n\nDUNIA GmbH\nGesellschaft mit beschränkter Haftung\nBerlin\n\nBei der nachstehenden Gesellschaft wird das Amtslöschungsverfahren gemäß § 394 FamFG eingeleitet. Widerspruchsfrist 6 Wochen"
    },
    {
      "date": "2025-06-27",
      "id": "113654",
      "original_text": "Löschungsankündigung\nBrandenburg Amtsgericht Potsdam HRB 31068\nFliesenBau Mäusel GmbH – Niedergörsdorf",
      "type": "Löschungsankündigung",
      "state": "Brandenburg",
      "amtsgericht": "Amtsgericht Potsdam",
      "registernummer": "HRB 31068",
      "registerart": "HRB",
      "company_name": "FliesenBau Mäusel GmbH",
      "company_seat": "Niedergörsdorf",
      "details": "27.06.2025 (Bekanntmachungsdatum)\n\nBrandenburg Amtsgericht Potsdam HRB 31068\nLöschungsankündigung\n\nFliesenBau Mäusel GmbH\nGesellschaft mit beschränkter Haftung\nNiedergörsdorf\n\nBei der nachstehenden Gesellschaft wird das Amtslöschungsverfahren gemäß § 394 FamFG eingeleitet. Widerspruchsfrist: 8 Wochen."
    },
    {
      "date": "2025-06-27",
      "id": "113655",
      "original_text": "Registerbekanntmachung nach dem Umwandlungsgesetz\nBaden-Württemberg Amtsgericht Stuttgart HRA 741897\nRosenauer KG – Balingen",
      "type": "Registerbekanntmachung nach dem Umwandlungsgesetz",
      "state": "Baden-Württemberg",
      "amtsgericht": "Amtsgericht Stuttgart",
      "registernummer": "HRA 741897",
      "registerart": "HRA",
      "company_name": "Rosenauer KG",
      "company_seat": "Balingen",
      "details": "27.06.2025 (Bekanntmachungsdatum)\n\nBaden-Württemberg Amtsgericht Stuttgart HRA 741897\nRegisterbekanntmachung nach dem Umwandlungsgesetz 27.06.2025 (Eintragungsdatum)\n\nRosenauer KG\nKommanditgesellschaft\nBalingen\n\nAls nicht eingetragen wird bekanntgemacht:\nDen Gläubigern der an der Ausgliederung beteiligten Rechtsträger ist, wenn sie binnen sechs Monaten nach dem Tag, an dem die Eintragung der Ausgliederung in das Register des Sitzes desjenigen Rechtsträgers, dessen Gläubiger sie sind, nach § 19 Abs. 3 UmwG als bekanntgemacht gilt, ihren Anspruch nach Grund und Höhe schriftlich anmelden, Sicherheit zu leisten, soweit sie nicht Befriedigung verlangen können. Dieses Recht steht den Gläubigern jedoch nur zu, wenn sie glaubhaft machen, dass durch die Ausgliederung die Erfüllung ihrer Forderung gefährdet wird."
    },
    {
      "date": "2025-06-27",
      "id": "113656",
      "original_text": "Löschungsankündigung\nSaarland Amtsgericht Saarbrücken HRB 16329\nInstrumentLease GmbH – Saarbrücken",
      "type": "Löschungsankündigung",
      "state": "Saarland",
      "amtsgericht": "Amtsgericht Saarbrücken",
      "registernummer": "HRB 16329",
      "registerart": "HRB",
      "company_name": "InstrumentLease GmbH",
      "company_seat": "Saarbrücken",
      "details": "27.06.2025 (Bekanntmachungsdatum)\n\nSaarland Amtsgericht Saarbrücken HRB 16329\nLöschungsankündigung\n\nInstrumentLease GmbH\nGesellschaft mit beschränkter Haftung\nSaarbrücken\n\nEs ist beabsichtigt, die Gesellschaft von Amts wegen gemäß § 394 FamFG wegen Vermögenslosigkeit zu löschen.\nGegen die Löschung von Amts wegen ist das Rechtsmittel des Widerspruchs statthaft. Der Widerspruch ist binnen einer Frist zwei Monaten beginnend mit dem Tag dieser Veröffentlichung durch Einreichen eines Widerspruchsschreibens -schriftlich oder zur Niederschrift der Geschäftsstelle beim Amtsgericht Saarbrücken, -zentrales Handelsregister-, Mainzerstr.178, 66121 Saarbrücken einzulegen.\nDer Widerspruch muss die Bezeichnung der angefochtenen Löschungsankündigung enthalten sowie die Erklärung, dass Widerspruch eingelegt wird. Er ist vom Widerspruchsführer oder seinem Bevollmächtigten zu unterzeichnen.\nDas Widerspruchsschreiben kann auch in der Form eines elektronischen Dokumentes eingereicht werden, das mit einer qualifizierten elektronischen Signatur nach dem Signaturgesetz versehen sein muss (§§ 14 Abs. 2 FamFG, 130a, 298 ZPO)."
    },
    {
      "date": "2025-06-27",
      "id": "113657",
      "original_text": "Löschungsankündigung\nBrandenburg Amtsgericht Potsdam HRB 39490\nExklusiveDrive GmbH – Nauen",
      "type": "Löschungsankündigung",
      "state": "Brandenburg",
      "amtsgericht": "Amtsgericht Potsdam",
      "registernummer": "HRB 39490",
      "registerart": "HRB",
      "company_name": "ExklusiveDrive GmbH",
      "company_seat": "Nauen",
      "details": "27.06.2025 (Bekanntmachungsdatum)\n\nBrandenburg Amtsgericht Potsdam HRB 39490\nLöschungsankündigung\n\nExklusiveDrive GmbH\nGesellschaft mit beschränkter Haftung\nNauen\n\nBei der nachstehenden Gesellschaft wird das Amtslöschungsverfahren gemäß § 394 FamFG eingeleitet. Widerspruchsfrist: 8 Wochen."
    },
    {
      "date": "2025-06-27",
      "id": "113658",
      "original_text": "Registerbekanntmachung nach dem Umwandlungsgesetz\nBaden-Württemberg Amtsgericht Freiburg HRA 709122\nHayat Sky Besitz eK, Inhaber Selahattin Özmat – Rust",
      "type": "Registerbekanntmachung nach dem Umwandlungsgesetz",
      "state": "Baden-Württemberg",
      "amtsgericht": "Amtsgericht Freiburg",
      "registernummer": "HRA 709122",
      "registerart": "HRA",
      "company_name": "Hayat Sky Besitz eK, Inhaber Selahattin Özmat",
      "company_seat": "Rust",
      "details": "27.06.2025 (Bekanntmachungsdatum)\n\nBaden-Württemberg Amtsgericht Freiburg HRA 709122\nRegisterbekanntmachung nach dem Umwandlungsgesetz 27.06.2025 (Eintragungsdatum)\n\nHayat Sky Besitz eK, Inhaber Selahattin Özmat\nEinzelkaufmann / Einzelkauffrau\nRust\n\nAls nicht eingetragen wird bekanntgemacht:\nDen Gläubigern der an der Ausgliederung beteiligten Rechtsträger ist, wenn sie binnen sechs Monaten nach dem Tag, an dem die Eintragung der Ausgliederung in das Register des Sitzes desjenigen Rechtsträgers, dessen Gläubiger sie sind, nach § 19 Abs. 3 UmwG als bekanntgemacht gilt, ihren Anspruch nach Grund und Höhe schriftlich anmelden, Sicherheit zu leisten, soweit sie nicht Befriedigung verlangen können. Dieses Recht steht den Gläubigern jedoch nur zu, wenn sie glaubhaft machen, dass durch die Ausgliederung die Erfüllung ihrer Forderung gefährdet wird."
    },
    {
      "date": "2025-06-27",
      "id": "113659",
      "original_text": "Registerbekanntmachung nach dem Umwandlungsgesetz\nBaden-Württemberg Amtsgericht Freiburg HRB 733442\nHayat Sky Besitz GmbH – Rust",
      "type": "Registerbekanntmachung nach dem Umwandlungsgesetz",
      "state": "Baden-Württemberg",
      "amtsgericht": "Amtsgericht Freiburg",
      "registernummer": "HRB 733442",
      "registerart": "HRB",
      "company_name": "Hayat Sky Besitz GmbH",
      "company_seat": "Rust",
      "details": "27.06.2025 (Bekanntmachungsdatum)\n\nBaden-Württemberg Amtsgericht Freiburg HRB 733442\nRegisterbekanntmachung nach dem Umwandlungsgesetz 27.06.2025 (Eintragungsdatum)\n\nHayat Sky Besitz GmbH\nGesellschaft mit beschränkter Haftung\nRust\n\nAls nicht eingetragen wird bekanntgemacht:\nDen Gläubigern der an der Ausgliederung beteiligten Rechtsträger ist, wenn sie binnen sechs Monaten nach dem Tag, an dem die Eintragung der Ausgliederung in das Register des Sitzes desjenigen Rechtsträgers, dessen Gläubiger sie sind, nach § 19 Abs. 3 UmwG als bekanntgemacht gilt, ihren Anspruch nach Grund und Höhe schriftlich anmelden, Sicherheit zu leisten, soweit sie nicht Befriedigung verlangen können. Dieses Recht steht den Gläubigern jedoch nur zu, wenn sie glaubhaft machen, dass durch die Ausgliederung die Erfüllung ihrer Forderung gefährdet wird."
    },
    {
      "date": "2025-06-27",
      "id": "113660",
      "original_text": "Einreichung neuer Dokumente\nBaden-Württemberg Amtsgericht Ulm HRB 630206\nZF Friedrichshafen AG – Friedrichshafen",
      "type": "Einreichung neuer Dokumente",
      "state": "Baden-Württemberg",
      "amtsgericht": "Amtsgericht Ulm",
      "registernummer": "HRB 630206",
      "registerart": "HRB",
      "company_name": "ZF Friedrichshafen AG",
      "company_seat": "Friedrichshafen",
      "details": "27.06.2025 (Bekanntmachungsdatum)\n\nBaden-Württemberg Amtsgericht Ulm HRB 630206\nEinreichung neuer Dokumente 27.06.2025 (Eintragungsdatum)\n\nZF Friedrichshafen AG\nAktiengesellschaft\nFriedrichshafen\n\nDie Gesellschaft hat am 21.03.2025 die Liste über die Zusammensetzung des Aufsichtsrats zum Handelsregister eingereicht."
    },
    {
      "date": "2025-06-27",
      "id": "113661",
      "original_text": "Registerbekanntmachung nach dem Umwandlungsgesetz\nBerlin Amtsgericht Berlin (Charlottenburg) HRB 144838\nFrankenstein Consult Projektsteuerung GmbH – Berlin",
      "type": "Registerbekanntmachung nach dem Umwandlungsgesetz",
      "state": "Berlin",
      "amtsgericht": "Amtsgericht Berlin (Charlottenburg)",
      "registernummer": "HRB 144838",
      "registerart": "HRB",
      "company_name": "Frankenstein Consult Projektsteuerung GmbH",
      "company_seat": "Berlin",
      "details": "27.06.2025 (Bekanntmachungsdatum)\n\nBerlin Amtsgericht Berlin (Charlottenburg) HRB 144838\nRegisterbekanntmachung nach dem Umwandlungsgesetz 26.06.2025 (Eintragungsdatum)\n\nFrankenstein Consult Projektsteuerung GmbH\nGesellschaft mit beschränkter Haftung\nBerlin\n\nZu Eintragungsnummer 2 vom 26.06.2025 wird als nicht eingetragen veröffentlicht: Den Gläubigern der an der Verschmelzung beteiligten Rechtsträger ist, wenn sie binnen sechs Monaten nach dem Tag, an dem die Eintragung der Verschmelzung in das Register des Sitzes desjenigen Rechtsträgers, dessen Gläubiger sie sind, als bekannt gemacht gilt, ihren Anspruch nach Grund und Höhe schriftlich anmelden, Sicherheit zu leisten, soweit sie nicht Befriedigung verlangen können. Dieses Recht steht den Gläubigern jedoch nur zu, wenn sie glaubhaft machen, dass durch die Verschmelzung die Erfüllung ihrer Forderung gefährdet wird. Das Recht, Sicherheitsleistung zu verlangen, steht Gläubigern nicht zu, die im Falle der Insolvenz ein Recht auf vorzugsweise Befriedigung aus einer Deckungsmasse haben, die nach gesetzlicher Vorschrift zu ihrem Schutz errichtet und staatlich überwacht ist."
    },
    {
      "date": "2025-06-27",
      "id": "113662",
      "original_text": "Löschungsankündigung\nSchleswig-Holstein Amtsgericht Kiel HRA 1297 PL\nCarl Wiese Tabakwarengroßvertrieb Inhaber: Carl-Heinrich Wiese e.K. – Lütjenburg",
      "type": "Löschungsankündigung",
      "state": "Schleswig-Holstein",
      "amtsgericht": "Amtsgericht Kiel",
      "registernummer": "HRA 1297 PL",
      "registerart": "HRA",
      "company_name": "Carl Wiese Tabakwarengroßvertrieb Inhaber: Carl-Heinrich Wiese e.K.",
      "company_seat": "Lütjenburg",
      "details": "27.06.2025 (Bekanntmachungsdatum)\n\nSchleswig-Holstein Amtsgericht Kiel HRA 1297 PL\nLöschungsankündigung\n\nCarl Wiese Tabakwarengroßvertrieb Inhaber: Carl-Heinrich Wiese e.K.\nEinzelkaufmann / Einzelkauffrau\nLütjenburg\n\nBei der nachstehenden Firma wird das Amtslöschungsverfahren gemäß § 31 Abs. 2 HGB eingeleitet. Widerspruchsfrist: 2 Monate."
    },
    {
      "date": "2025-06-27",
      "id": "113663",
      "original_text": "Löschungsankündigung\nSaarland Amtsgericht Saarbrücken HRB 103535\northoextra Pharmazeutische Vertriebsgesellschaft UG (haftungsbeschränkt) – St. Wendel",
      "type": "Löschungsankündigung",
      "state": "Saarland",
      "amtsgericht": "Amtsgericht Saarbrücken",
      "registernummer": "HRB 103535",
      "registerart": "HRB",
      "company_name": "orthoextra Pharmazeutische Vertriebsgesellschaft UG (haftungsbeschränkt)",
      "company_seat": "St. Wendel",
      "details": "27.06.2025 (Bekanntmachungsdatum)\n\nSaarland Amtsgericht Saarbrücken HRB 103535\nLöschungsankündigung\n\northoextra Pharmazeutische Vertriebsgesellschaft UG (haftungsbeschränkt)\nGesellschaft mit beschränkter Haftung\nSt. Wendel\n\nEs ist beabsichtigt, die Gesellschaft von Amts wegen gemäß § 394 FamFG wegen Vermögenslosigkeit zu löschen.\nGegen die Löschung von Amts wegen ist das Rechtsmittel des Widerspruchs statthaft. Der Widerspruch ist binnen einer Frist zwei Monaten beginnend mit dem Tag dieser Veröffentlichung durch Einreichen eines Widerspruchsschreibens -schriftlich oder zur Niederschrift der Geschäftsstelle beim Amtsgericht Saarbrücken, -zentrales Handelsregister-, Mainzerstr.178, 66121 Saarbrücken einzulegen.\nDer Widerspruch muss die Bezeichnung der angefochtenen Löschungsankündigung enthalten sowie die Erklärung, dass Widerspruch eingelegt wird. Er ist vom Widerspruchsführer oder seinem Bevollmächtigten zu unterzeichnen.\nDas Widerspruchsschreiben kann auch in der Form eines elektronischen Dokumentes eingereicht werden, das mit einer qualifizierten elektronischen Signatur nach dem Signaturgesetz versehen sein muss (§§ 14 Abs. 2 FamFG, 130a, 298 ZPO)."
    },
    {
      "date": "2025-06-27",
      "id": "113664",
      "original_text": "Registerbekanntmachung nach dem Umwandlungsgesetz\nBerlin Amtsgericht Berlin (Charlottenburg) HRB 87259\nFrankenstein Consult GmbH – Berlin",
      "type": "Registerbekanntmachung nach dem Umwandlungsgesetz",
      "state": "Berlin",
      "amtsgericht": "Amtsgericht Berlin (Charlottenburg)",
      "registernummer": "HRB 87259",
      "registerart": "HRB",
      "company_name": "Frankenstein Consult GmbH",
      "company_seat": "Berlin",
      "details": "27.06.2025 (Bekanntmachungsdatum)\n\nBerlin Amtsgericht Berlin (Charlottenburg) HRB 87259\nRegisterbekanntmachung nach dem Umwandlungsgesetz 26.06.2025 (Eintragungsdatum)\n\nFrankenstein Consult GmbH\nGesellschaft mit beschränkter Haftung\nBerlin\n\nZu Eintragungsnummer 4 vom 26.06.2025 wird als nicht eingetragen veröffentlicht: Den Gläubigern der an der Verschmelzung beteiligten Rechtsträger ist, wenn sie binnen sechs Monaten nach dem Tag, an dem die Eintragung der Verschmelzung in das Register des Sitzes desjenigen Rechtsträgers, dessen Gläubiger sie sind, als bekannt gemacht gilt, ihren Anspruch nach Grund und Höhe schriftlich anmelden, Sicherheit zu leisten, soweit sie nicht Befriedigung verlangen können. Dieses Recht steht den Gläubigern jedoch nur zu, wenn sie glaubhaft machen, dass durch die Verschmelzung die Erfüllung ihrer Forderung gefährdet wird. Das Recht, Sicherheitsleistung zu verlangen, steht Gläubigern nicht zu, die im Falle der Insolvenz ein Recht auf vorzugsweise Befriedigung aus einer Deckungsmasse haben, die nach gesetzlicher Vorschrift zu ihrem Schutz errichtet und staatlich überwacht ist."
    },
    {
      "date": "2025-06-27",
      "id": "113665",
      "original_text": "Löschungsankündigung\nBrandenburg Amtsgericht Potsdam HRB 37880\nATAN GmbH – Falkensee",
      "type": "Löschungsankündigung",
      "state": "Brandenburg",
      "amtsgericht": "Amtsgericht Potsdam",
      "registernummer": "HRB 37880",
      "registerart": "HRB",
      "company_name": "ATAN GmbH",
      "company_seat": "Falkensee",
      "details": "27.06.2025 (Bekanntmachungsdatum)\n\nBrandenburg Amtsgericht Potsdam HRB 37880\nLöschungsankündigung\n\nATAN GmbH\nGesellschaft mit beschränkter Haftung\nFalkensee\n\nBei der nachstehenden Gesellschaft wird das Amtslöschungsverfahren gemäß § 394 FamFG eingeleitet. Widerspruchsfrist: 8 Wochen."
    },
    {
      "date": "2025-06-27",
      "id": "113666",
      "original_text": "Löschungsankündigung\nBrandenburg Amtsgericht Potsdam HRB 35488\nDE-WG Fachhandel & Bautenschutz UG (haftungsbeschränkt) – Niedergörsdorf",
      "type": "Löschungsankündigung",
      "state": "Brandenburg",
      "amtsgericht": "Amtsgericht Potsdam",
      "registernummer": "HRB 35488",
      "registerart": "HRB",
      "company_name": "DE-WG Fachhandel & Bautenschutz UG (haftungsbeschränkt)",
      "company_seat": "Niedergörsdorf",
      "details": "27.06.2025 (Bekanntmachungsdatum)\n\nBrandenburg Amtsgericht Potsdam HRB 35488\nLöschungsankündigung\n\nDE-WG Fachhandel & Bautenschutz UG (haftungsbeschränkt)\nGesellschaft mit beschränkter Haftung\nNiedergörsdorf\n\nBei der nachstehenden Gesellschaft wird das Amtslöschungsverfahren gemäß § 394 FamFG eingeleitet. Widerspruchsfrist: 8 Wochen."
    },
    {
      "date": "2025-06-27",
      "id": "113667",
      "original_text": "Löschungsankündigung\nSchleswig-Holstein Amtsgericht Flensburg HRB 11026\nKjeir Gastrobetriebsgesellschaft mbH – Sylt",
      "type": "Löschungsankündigung",
      "state": "Schleswig-Holstein",
      "amtsgericht": "Amtsgericht Flensburg",
      "registernummer": "HRB 11026",
      "registerart": "HRB",
      "company_name": "Kjeir Gastrobetriebsgesellschaft mbH",
      "company_seat": "Sylt",
      "details": "27.06.2025 (Bekanntmachungsdatum)\n\nSchleswig-Holstein Amtsgericht Flensburg HRB 11026\nLöschungsankündigung\n\nKjeir Gastrobetriebsgesellschaft mbH\nGesellschaft mit beschränkter Haftung\nSylt\n\nEs ist die Löschung der nachstehenden Gesellschaft wegen Vermögenslosigkeit gemäß § 394 FamFG beabsichtigt.\nWiderspruchsfrist: 2 Monate"
    },
    {
      "date": "2025-06-27",
      "id": "113668",
      "original_text": "Registerbekanntmachung nach dem Umwandlungsgesetz\nBrandenburg Amtsgericht Cottbus HRB 17208\nWalkürenstraße Living GmbH – Schönefeld",
      "type": "Registerbekanntmachung nach dem Umwandlungsgesetz",
      "state": "Brandenburg",
      "amtsgericht": "Amtsgericht Cottbus",
      "registernummer": "HRB 17208",
      "registerart": "HRB",
      "company_name": "Walkürenstraße Living GmbH",
      "company_seat": "Schönefeld",
      "details": "27.06.2025 (Bekanntmachungsdatum)\n\nBrandenburg Amtsgericht Cottbus HRB 17208\nRegisterbekanntmachung nach dem Umwandlungsgesetz 23.06.2025 (Eintragungsdatum)\n\nWalkürenstraße Living GmbH\nGesellschaft mit beschränkter Haftung\nSchönefeld\n\nZu Eintragungsnummer 3 vom 23.06.2025 wird als nicht eingetragen veröffentlicht:\nDen Gläubigern der an der Ausgliederung beteiligten Rechtsträger ist, wenn sie binnen sechs Monaten nach dem Tag, an dem die Eintragung der Ausgliederung in das Register des Sitzes desjenigen Rechtsträgers, dessen Gläubiger sie sind, als bekannt gemacht gilt, ihren Anspruch nach Grund und Höhe schriftlich anmelden, Sicherheit zu leisten, soweit sie nicht Befriedigung verlangen können. Dieses Recht steht den Gläubigern jedoch nur zu, wenn sie glaubhaft machen, dass durch die Ausgliederung die Erfüllung ihrer Forderung gefährdet wird."
    },
    {
      "date": "2025-06-27",
      "id": "113669",
      "original_text": "Sonstige Registerbekanntmachung\nBerlin Amtsgericht Berlin (Charlottenburg) HRB 245047\nProductDock AG – Berlin",
      "type": "Sonstige Registerbekanntmachung",
      "state": "Berlin",
      "amtsgericht": "Amtsgericht Berlin (Charlottenburg)",
      "registernummer": "HRB 245047",
      "registerart": "HRB",
      "company_name": "ProductDock AG",
      "company_seat": "Berlin",
      "details": "27.06.2025 (Bekanntmachungsdatum)\n\nBerlin Amtsgericht Berlin (Charlottenburg) HRB 245047\nSonstige Registerbekanntmachung\n\nProductDock AG\nAktiengesellschaft\nBerlin\n\nEs wurde eine neue Liste der Aufsichtsratsmitglieder eingereicht (§ 106 AktG).Als nicht eingetragen wird veröffentlicht:"
    },
    {
      "date": "2025-06-27",
      "id": "113670",
      "original_text": "Einreichung neuer Dokumente\nBerlin Amtsgericht Berlin (Charlottenburg) HRB 98743\nTerraverde AG – Berlin",
      "type": "Einreichung neuer Dokumente",
      "state": "Berlin",
      "amtsgericht": "Amtsgericht Berlin (Charlottenburg)",
      "registernummer": "HRB 98743",
      "registerart": "HRB",
      "company_name": "Terraverde AG",
      "company_seat": "Berlin",
      "details": "27.06.2025 (Bekanntmachungsdatum)\n\nBerlin Amtsgericht Berlin (Charlottenburg) HRB 98743\nEinreichung neuer Dokumente\n\nTerraverde AG\nAktiengesellschaft\nBerlin\n\nAls nicht eingetragen wird veröffentlicht: Es wurde eine neue Liste der Aufsichtsratsmitglieder eingereicht (§ 106 AktG)."
    },
    {
      "date": "2025-06-27",
      "id": "113671",
      "original_text": "Registerbekanntmachung nach dem Umwandlungsgesetz\nBerlin Amtsgericht Berlin (Charlottenburg) HRB 207277\nO. G. Gear Bekleidungshandels- und Bauservice UG (haftungsbeschränkt) – Berlin",
      "type": "Registerbekanntmachung nach dem Umwandlungsgesetz",
      "state": "Berlin",
      "amtsgericht": "Amtsgericht Berlin (Charlottenburg)",
      "registernummer": "HRB 207277",
      "registerart": "HRB",
      "company_name": "O. G. Gear Bekleidungshandels- und Bauservice UG (haftungsbeschränkt)",
      "company_seat": "Berlin",
      "details": "27.06.2025 (Bekanntmachungsdatum)\n\nBerlin Amtsgericht Berlin (Charlottenburg) HRB 207277\nRegisterbekanntmachung nach dem Umwandlungsgesetz 26.06.2025 (Eintragungsdatum)\n\nO. G. Gear Bekleidungshandels- und Bauservice UG (haftungsbeschränkt)\nGesellschaft mit beschränkter Haftung\nBerlin\n\nZu Eintragungsnummer 4 vom 26.06.2025 wird als nicht eingetragen veröffentlicht: Den Gläubigern der an der Verschmelzung beteiligten Rechtsträger ist, wenn sie binnen sechs Monaten nach dem Tag, an dem die Eintragung der Verschmelzung in das Register des Sitzes desjenigen Rechtsträgers, dessen Gläubiger sie sind, als bekannt gemacht gilt, ihren Anspruch nach Grund und Höhe schriftlich anmelden, Sicherheit zu leisten, soweit sie nicht Befriedigung verlangen können. Dieses Recht steht den Gläubigern jedoch nur zu, wenn sie glaubhaft machen, dass durch die Verschmelzung die Erfüllung ihrer Forderung gefährdet wird. Das Recht, Sicherheitsleistung zu verlangen, steht Gläubigern nicht zu, die im Falle der Insolvenz ein Recht auf vorzugsweise Befriedigung aus einer Deckungsmasse haben, die nach gesetzlicher Vorschrift zu ihrem Schutz errichtet und staatlich überwacht ist."
    },
    {
      "date": "2025-06-27",
      "id": "113672",
      "original_text": "Löschungsankündigung\nHamburg Amtsgericht Hamburg VR 12442\n\"Hanseatischer Herrenclub\" e.V. – Hamburg",
      "type": "Löschungsankündigung",
      "state": "Hamburg",
      "amtsgericht": "Amtsgericht Hamburg",
      "registernummer": "VR 12442",
      "registerart": "VR",
      "company_name": "\"Hanseatischer Herrenclub\" e.V.",
      "company_seat": "Hamburg",
      "details": "27.06.2025 (Bekanntmachungsdatum)\n\nHamburg Amtsgericht Hamburg VR 12442\nLöschungsankündigung\n\n\"Hanseatischer Herrenclub\" e.V.\neingetragener Verein\nHamburg\n\nDas Registergericht beabsichtigt, den im Vereinsregister eingetragenen Verein von Amts wegen nach § 395 FamFG zu löschen, da nach den angestellten  Ermittlungen dieser Verein offenbar nicht mehr besteht. Die Frist zur Erhebung eines Widerspruchs gegen die beabsichtigte Löschung wird auf 3 Monate festgesetzt."
    },
    {
      "date": "2025-06-27",
      "id": "113673",
      "original_text": "Registerbekanntmachung nach dem Umwandlungsgesetz\nBrandenburg Amtsgericht Cottbus HRB 12199\nAnJu Organisations- und Transformationsgesellschaft UG (haftungsbeschränkt) – Königs Wusterhausen",
      "type": "Registerbekanntmachung nach dem Umwandlungsgesetz",
      "state": "Brandenburg",
      "amtsgericht": "Amtsgericht Cottbus",
      "registernummer": "HRB 12199",
      "registerart": "HRB",
      "company_name": "AnJu Organisations- und Transformationsgesellschaft UG (haftungsbeschränkt)",
      "company_seat": "Königs Wusterhausen",
      "details": "27.06.2025 (Bekanntmachungsdatum)\n\nBrandenburg Amtsgericht Cottbus HRB 12199\nRegisterbekanntmachung nach dem Umwandlungsgesetz 26.06.2025 (Eintragungsdatum)\n\nAnJu Organisations- und Transformationsgesellschaft UG (haftungsbeschränkt)\nGesellschaft mit beschränkter Haftung\nKönigs Wusterhausen\n\nAls nicht eingetragen wird veröffentlicht:\nDen Gläubigern der an der Verschmelzung beteiligten Rechtsträger ist, wenn sie binnen sechs Monaten nach dem Tag, an dem die Eintragung der Verschmelzung in das Register des Sitzes desjenigen Rechtsträgers, dessen Gläubiger sie sind, als bekannt gemacht gilt, ihren Anspruch nach Grund und Höhe schriftlich anmelden, Sicherheit zu leisten, soweit sie nicht Befriedigung verlangen können. Dieses Recht steht den Gläubigern jedoch nur zu, wenn sie glaubhaft machen, dass durch die Verschmelzung die Erfüllung ihrer Forderung gefährdet wird"
    },
    {
      "date": "2025-06-27",
      "id": "113674",
      "original_text": "Registerbekanntmachung nach dem Umwandlungsgesetz\nNordrhein-Westfalen Amtsgericht Coesfeld HRB 4903\nd.velop AG – Gescher",
      "type": "Registerbekanntmachung nach dem Umwandlungsgesetz",
      "state": "Nordrhein-Westfalen",
      "amtsgericht": "Amtsgericht Coesfeld",
      "registernummer": "HRB 4903",
      "registerart": "HRB",
      "company_name": "d.velop AG",
      "company_seat": "Gescher",
      "details": "27.06.2025 (Bekanntmachungsdatum)\n\nNordrhein-Westfalen Amtsgericht Coesfeld HRB 4903\nRegisterbekanntmachung nach dem Umwandlungsgesetz\n\nd.velop AG\nAktiengesellschaft\nGescher\n\nDer Entwurf eines Vertrages über die geplante Verschmelzung der hiesigen d.velop AG mit der Legal Analytics GmbH mit Sitz in Gescher ( Amtsgericht Coesfeld HRB 20627)  ist eingereicht worden."
    },
    {
      "date": "2025-06-27",
      "id": "113675",
      "original_text": "Löschungsankündigung\nBaden-Württemberg Amtsgericht Stuttgart HRB 745791\nA.E.R. Fresco Verwaltungs GmbH – Öhringen",
      "type": "Löschungsankündigung",
      "state": "Baden-Württemberg",
      "amtsgericht": "Amtsgericht Stuttgart",
      "registernummer": "HRB 745791",
      "registerart": "HRB",
      "company_name": "A.E.R. Fresco Verwaltungs GmbH",
      "company_seat": "Öhringen",
      "details": "27.06.2025 (Bekanntmachungsdatum)\n\nBaden-Württemberg Amtsgericht Stuttgart HRB 745791\nLöschungsankündigung\n\nA.E.R. Fresco Verwaltungs GmbH\nGesellschaft mit beschränkter Haftung\nÖhringen\n\nAls nicht eingetragen wird bekanntgemacht:\nDas Gericht beabsichtigt, die Gesellschaft wegen Vermögenslosigkeit im Handelsregister von Amts wegen nach § 394 FamFG zu löschen. Die Frist zur Geltendmachung eines Widerspruchs gegen die beabsichtigte Löschung ist auf zwei Monate ab Veröffentlichung bestimmt."
    },
    {
      "date": "2025-06-27",
      "id": "113676",
      "original_text": "Registerbekanntmachung nach dem Umwandlungsgesetz\nBaden-Württemberg Amtsgericht Freiburg HRB 411197\nVitra Production GmbH – Weil am Rhein",
      "type": "Registerbekanntmachung nach dem Umwandlungsgesetz",
      "state": "Baden-Württemberg",
      "amtsgericht": "Amtsgericht Freiburg",
      "registernummer": "HRB 411197",
      "registerart": "HRB",
      "company_name": "Vitra Production GmbH",
      "company_seat": "Weil am Rhein",
      "details": "27.06.2025 (Bekanntmachungsdatum)\n\nBaden-Württemberg Amtsgericht Freiburg HRB 411197\nRegisterbekanntmachung nach dem Umwandlungsgesetz 27.06.2025 (Eintragungsdatum)\n\nVitra Production GmbH\nGesellschaft mit beschränkter Haftung\nWeil am Rhein\n\nDen Gläubigern der an der Verschmelzung beteiligten Rechtsträger (\"Vitra Production GmbH\" bisher \"Modo GmbH\", Weil am Rhein, Amtsgericht Freiburg i. Br. HRB 411197 und \"Contura GmbH\", Weil am Rhein (Amtsgericht Freiburg i. Br. HRB 300402) ist, wenn sie binnen sechs Monaten nach dem Tag, an dem die Eintragung der Verschmelzung in das Register des Sitzes desjenigen Rechtsträgers, dessen Gläubiger sie sind, nach § 19 Abs. 3 UmwG als bekanntgemacht gilt, ihren Anspruch nach Grund und Höhe schriftlich anmelden, Sicherheit zu leisten, soweit sie nicht Befriedigung verlangen können. Dieses Recht steht den Gläubigern jedoch nur zu, wenn sie glaubhaft machen, dass durch die Verschmelzung die Erfüllung ihrer Forderung gefährdet wird."
    },
    {
      "date": "2025-06-27",
      "id": "113677",
      "original_text": "Registerbekanntmachung nach dem Umwandlungsgesetz\nBaden-Württemberg Amtsgericht Freiburg HRB 300402\nContura GmbH – Weil am Rhein",
      "type": "Registerbekanntmachung nach dem Umwandlungsgesetz",
      "state": "Baden-Württemberg",
      "amtsgericht": "Amtsgericht Freiburg",
      "registernummer": "HRB 300402",
      "registerart": "HRB",
      "company_name": "Contura GmbH",
      "company_seat": "Weil am Rhein",
      "details": "27.06.2025 (Bekanntmachungsdatum)\n\nBaden-Württemberg Amtsgericht Freiburg HRB 300402\nRegisterbekanntmachung nach dem Umwandlungsgesetz 27.06.2025 (Eintragungsdatum)\n\nContura GmbH\nGesellschaft mit beschränkter Haftung\nWeil am Rhein\n\nDen Gläubigern der an der Verschmelzung beteiligten Rechtsträger ist, wenn sie binnen sechs Monaten nach dem Tag, an dem die Eintragung der Verschmelzung in das Register des Sitzes desjenigen Rechtsträgers, dessen Gläubiger sie sind, nach § 19 Abs. 3 UmwG als bekanntgemacht gilt, ihren Anspruch nach Grund und Höhe schriftlich anmelden, Sicherheit zu leisten, soweit sie nicht Befriedigung verlangen können. Dieses Recht steht den Gläubigern jedoch nur zu, wenn sie glaubhaft machen, dass durch die Verschmelzung die Erfüllung ihrer Forderung gefährdet wird."
    },
    {
      "date": "2025-06-27",
      "id": "113678",
      "original_text": "Löschungsankündigung\nSaarland Amtsgericht Saarbrücken HRB 108664\nZOE Trade UG (haftungsbeschränkt) – Ottweiler",
      "type": "Löschungsankündigung",
      "state": "Saarland",
      "amtsgericht": "Amtsgericht Saarbrücken",
      "registernummer": "HRB 108664",
      "registerart": "HRB",
      "company_name": "ZOE Trade UG (haftungsbeschränkt)",
      "company_seat": "Ottweiler",
      "details": "27.06.2025 (Bekanntmachungsdatum)\n\nSaarland Amtsgericht Saarbrücken HRB 108664\nLöschungsankündigung\n\nZOE Trade UG (haftungsbeschränkt)\nGesellschaft mit beschränkter Haftung\nOttweiler\n\nEs ist beabsichtigt, die Gesellschaft von Amts wegen gemäß § 394 FamFG wegen Vermögenslosigkeit zu löschen.\nGegen die Löschung von Amts wegen ist das Rechtsmittel des Widerspruchs statthaft. Der Widerspruch ist binnen einer Frist drei Monaten beginnend mit dem Tag dieser Veröffentlichung durch Einreichen eines Widerspruchsschreibens -schriftlich oder zur Niederschrift der Geschäftsstelle beim Amtsgericht Saarbrücken, -zentrales Handelsregister-, Mainzerstr.178, 66121 Saarbrücken einzulegen.\nDer Widerspruch muss die Bezeichnung der angefochtenen Löschungsankündigung enthalten sowie die Erklärung, dass Widerspruch eingelegt wird. Er ist vom Widerspruchsführer oder seinem Bevollmächtigten zu unterzeichnen.\nDas Widerspruchsschreiben kann auch in der Form eines elektronischen Dokumentes eingereicht werden, das mit einer qualifizierten elektronischen Signatur nach dem Signaturgesetz versehen sein muss (§§ 14 Abs. 2 FamFG, 130a, 298 ZPO)."
    },
    {
      "date": "2025-06-27",
      "id": "113679",
      "original_text": "Registerbekanntmachung nach dem Umwandlungsgesetz\nSchleswig-Holstein Amtsgericht Kiel HRB 4072\nFLS GmbH – Heikendorf",
      "type": "Registerbekanntmachung nach dem Umwandlungsgesetz",
      "state": "Schleswig-Holstein",
      "amtsgericht": "Amtsgericht Kiel",
      "registernummer": "HRB 4072",
      "registerart": "HRB",
      "company_name": "FLS GmbH",
      "company_seat": "Heikendorf",
      "details": "27.06.2025 (Bekanntmachungsdatum)\n\nSchleswig-Holstein Amtsgericht Kiel HRB 4072\nRegisterbekanntmachung nach dem Umwandlungsgesetz 25.06.2025 (Eintragungsdatum)\n\nFLS GmbH\nGesellschaft mit beschränkter Haftung\nHeikendorf\n\nZu Eintragungsnummer 25 vom 25.06.2025 wird als nicht eingetragen veröffentlicht:\nDen Gläubigern der an der Verschmelzung beteiligten Rechtsträger ist, wenn sie binnen sechs Monaten nach dem Tag, an dem die Eintragung der Verschmelzung in das Register des Sitzes desjenigen Rechtsträgers, dessen Gläubiger sie sind, nach § 19 Abs. 3 UmwG bekannt gemacht worden ist, ihren Anspruch nach Grund und Höhe schriftlich anmelden, Sicherheit zu leisten, soweit sie nicht Befriedigung verlangen können. Dieses Recht steht den Gläubigern jedoch nur zu, wenn sie glaubhaft machen, dass durch die Verschmelzung die Erfüllung ihrer Forderung gefährdet wird."
    },
    {
      "date": "2025-06-27",
      "id": "113680",
      "original_text": "Registerbekanntmachung nach dem Umwandlungsgesetz\nNordrhein-Westfalen Amtsgericht Coesfeld HRB 10678\nBrink Climate Systems Deutschland GmbH – Ahaus",
      "type": "Registerbekanntmachung nach dem Umwandlungsgesetz",
      "state": "Nordrhein-Westfalen",
      "amtsgericht": "Amtsgericht Coesfeld",
      "registernummer": "HRB 10678",
      "registerart": "HRB",
      "company_name": "Brink Climate Systems Deutschland GmbH",
      "company_seat": "Ahaus",
      "details": "27.06.2025 (Bekanntmachungsdatum)\n\nNordrhein-Westfalen Amtsgericht Coesfeld HRB 10678\nRegisterbekanntmachung nach dem Umwandlungsgesetz 27.06.2025 (Eintragungsdatum)\n\nBrink Climate Systems Deutschland GmbH\nGesellschaft mit beschränkter Haftung\nAhaus\n\nDen Gläubigern der an der Verschmelzung beteiligten Rechtsträger ist, wenn sie binnen sechs Monaten nach dem Tag, an dem die Eintragung der Verschmelzung in das Register des Sitzes derjenigen Rechtsträger deren Gläubiger sie sind, nach § 19 Absatz 3 UmwG als bekanntgemacht gilt, ihren Anspruch nach Grund und Höhe schriftlich anmelden, Sicherheit zu leisten, soweit sie nicht Befriedigung verlangen können. Dieses Recht steht den Gläubigern jedoch nur zu, wenn sie glaubhaft machen, dass durch die Verschmelzung die Erfüllung ihrer Forderung gefährdet wird."
    },
    {
      "date": "2025-06-27",
      "id": "113681",
      "original_text": "Löschungsankündigung\nBaden-Württemberg Amtsgericht Stuttgart HRB 784474\nT&M Bau GmbH – Ludwigsburg",
      "type": "Löschungsankündigung",
      "state": "Baden-Württemberg",
      "amtsgericht": "Amtsgericht Stuttgart",
      "registernummer": "HRB 784474",
      "registerart": "HRB",
      "company_name": "T&M Bau GmbH",
      "company_seat": "Ludwigsburg",
      "details": "27.06.2025 (Bekanntmachungsdatum)\n\nBaden-Württemberg Amtsgericht Stuttgart HRB 784474\nLöschungsankündigung 27.06.2025 (Eintragungsdatum)\n\nT&M Bau GmbH\nGesellschaft mit beschränkter Haftung\nLudwigsburg\n\nAls nicht eingetragen wird bekanntgemacht:\nDas Gericht beabsichtigt, die Gesellschaft wegen Vermögenslosigkeit im Handelsregister von Amts wegen nach § 394 FamFG zu löschen. Die Frist zur Geltendmachung eines Widerspruchs gegen die beabsichtigte Löschung ist auf zwei Monate ab Veröffentlichung bestimmt."
    },
    {
      "date": "2025-06-27",
      "id": "113682",
      "original_text": "Einreichung neuer Dokumente\nMecklenburg-Vorpommern Amtsgericht Schwerin HRB 828\nBürgschaftsbank Mecklenburg-Vorpommern GmbH – Schwerin",
      "type": "Einreichung neuer Dokumente",
      "state": "Mecklenburg-Vorpommern",
      "amtsgericht": "Amtsgericht Schwerin",
      "registernummer": "HRB 828",
      "registerart": "HRB",
      "company_name": "Bürgschaftsbank Mecklenburg-Vorpommern GmbH",
      "company_seat": "Schwerin",
      "details": "27.06.2025 (Bekanntmachungsdatum)\n\nMecklenburg-Vorpommern Amtsgericht Schwerin HRB 828\nEinreichung neuer Dokumente 27.06.2025 (Eintragungsdatum)\n\nBürgschaftsbank Mecklenburg-Vorpommern GmbH\nGesellschaft mit beschränkter Haftung\nSchwerin\n\nEine Liste der Mitglieder des Verwaltungsrates/Aufsichtsrats ist zum Handelsregister eingereicht worden."
    },
    {
      "date": "2025-06-27",
      "id": "113683",
      "original_text": "Einreichung neuer Dokumente\nMecklenburg-Vorpommern Amtsgericht Stralsund HRB 484 früher Amtsgericht Rostock\nWVZ-Wärmeversorgung Zinnowitz GmbH – Karlshagen",
      "type": "Einreichung neuer Dokumente",
      "state": "Mecklenburg-Vorpommern",
      "amtsgericht": "Amtsgericht Stralsund",
      "registernummer": "HRB 484",
      "registerart": "HRB",
      "company_name": "WVZ-Wärmeversorgung Zinnowitz GmbH",
      "company_seat": "Karlshagen",
      "former_amtsgericht": "Rostock",
      "details": "27.06.2025 (Bekanntmachungsdatum)\n\nMecklenburg-Vorpommern Amtsgericht Stralsund HRB 484 früher Amtsgericht Rostock\nEinreichung neuer Dokumente\n\nWVZ-Wärmeversorgung Zinnowitz GmbH\nGesellschaft mit beschränkter Haftung\nKarlshagen\n\nEine Liste der Mitglieder des Aufsichtsrats ist zum Handelsregister eingereicht worden."
    },
    {
      "date": "2025-06-27",
      "id": "113684",
      "original_text": "Registerbekanntmachung nach dem Umwandlungsgesetz\nBaden-Württemberg Amtsgericht Mannheim HRB 750264\nSamuel Ochs Vermögensholding GmbH – Bruchsal",
      "type": "Registerbekanntmachung nach dem Umwandlungsgesetz",
      "state": "Baden-Württemberg",
      "amtsgericht": "Amtsgericht Mannheim",
      "registernummer": "HRB 750264",
      "registerart": "HRB",
      "company_name": "Samuel Ochs Vermögensholding GmbH",
      "company_seat": "Bruchsal",
      "details": "27.06.2025 (Bekanntmachungsdatum)\n\nBaden-Württemberg Amtsgericht Mannheim HRB 750264\nRegisterbekanntmachung nach dem Umwandlungsgesetz 27.06.2025 (Eintragungsdatum)\n\nSamuel Ochs Vermögensholding GmbH\nGesellschaft mit beschränkter Haftung\nBruchsal\n\nDen Gläubigern der an der Verschmelzung beteiligten Rechtsträger ist, wenn sie binnen sechs Monaten nach dem Tag, an dem die Eintragung der Verschmelzung in das Register des Sitzes desjenigen Rechtsträgers, dessen Gläubiger sie sind, nach § 19 Abs. 3 UmwG als bekanntgemacht gilt, ihren Anspruch nach Grund und Höhe schriftlich anmelden, Sicherheit zu leisten, soweit sie nicht Befriedigung verlangen können. Dieses Recht steht den Gläubigern jedoch nur zu, wenn sie glaubhaft machen, dass durch die Verschmelzung die Erfüllung ihrer Forderung gefährdet wird."
    },
    {
      "date": "2025-06-27",
      "id": "113685",
      "original_text": "Löschungsankündigung\nBrandenburg Amtsgericht Potsdam HRB 38886\nAMPR Construction GmbH – Rangsdorf",
      "type": "Löschungsankündigung",
      "state": "Brandenburg",
      "amtsgericht": "Amtsgericht Potsdam",
      "registernummer": "HRB 38886",
      "registerart": "HRB",
      "company_name": "AMPR Construction GmbH",
      "company_seat": "Rangsdorf",
      "details": "27.06.2025 (Bekanntmachungsdatum)\n\nBrandenburg Amtsgericht Potsdam HRB 38886\nLöschungsankündigung\n\nAMPR Construction GmbH\nGesellschaft mit beschränkter Haftung\nRangsdorf\n\nBei der nachstehenden Gesellschaft wird das Amtslöschungsverfahren gemäß § 394 FamFG eingeleitet. Widerspruchsfrist: 8  Wochen."
    },
    {
      "date": "2025-06-27",
      "id": "113686",
      "original_text": "Löschungsankündigung\nBerlin Amtsgericht Berlin (Charlottenburg) HRB 231567\nGasteiner Bau Berlin GmbH – Berlin",
      "type": "Löschungsankündigung",
      "state": "Berlin",
      "amtsgericht": "Amtsgericht Berlin (Charlottenburg)",
      "registernummer": "HRB 231567",
      "registerart": "HRB",
      "company_name": "Gasteiner Bau Berlin GmbH",
      "company_seat": "Berlin",
      "details": "27.06.2025 (Bekanntmachungsdatum)\n\nBerlin Amtsgericht Berlin (Charlottenburg) HRB 231567\nLöschungsankündigung\n\nGasteiner Bau Berlin GmbH\nGesellschaft mit beschränkter Haftung\nBerlin\n\nBei der nachstehenden Gesellschaft wird das Amtslöschungsverfahren gemäß § 394 FamFG eingeleitet. Widerspruchsfrist 6 Wochen"
    },
    {
      "date": "2025-06-27",
      "id": "113687",
      "original_text": "Registerbekanntmachung nach dem Umwandlungsgesetz\nBaden-Württemberg Amtsgericht Mannheim HRB 750580\nOCHS Bau- & Automatenservice UG (haftungsbeschränkt) – Bruchsal",
      "type": "Registerbekanntmachung nach dem Umwandlungsgesetz",
      "state": "Baden-Württemberg",
      "amtsgericht": "Amtsgericht Mannheim",
      "registernummer": "HRB 750580",
      "registerart": "HRB",
      "company_name": "OCHS Bau- & Automatenservice UG (haftungsbeschränkt)",
      "company_seat": "Bruchsal",
      "details": "27.06.2025 (Bekanntmachungsdatum)\n\nBaden-Württemberg Amtsgericht Mannheim HRB 750580\nRegisterbekanntmachung nach dem Umwandlungsgesetz 27.06.2025 (Eintragungsdatum)\n\nOCHS Bau- & Automatenservice UG (haftungsbeschränkt)\nGesellschaft mit beschränkter Haftung\nBruchsal\n\nDen Gläubigern der an der Verschmelzung beteiligten Rechtsträger ist, wenn sie binnen sechs Monaten nach dem Tag, an dem die Eintragung der Verschmelzung in das Register des Sitzes desjenigen Rechtsträgers, dessen Gläubiger sie sind, nach § 19 Abs. 3 UmwG als bekanntgemacht gilt, ihren Anspruch nach Grund und Höhe schriftlich anmelden, Sicherheit zu leisten, soweit sie nicht Befriedigung verlangen können. Dieses Recht steht den Gläubigern jedoch nur zu, wenn sie glaubhaft machen, dass durch die Verschmelzung die Erfüllung ihrer Forderung gefährdet wird."
    },
    {
      "date": "2025-06-27",
      "id": "113688",
      "original_text": "Löschungsankündigung\nThüringen Amtsgericht Jena HRB 516093\nFitness Health UG (haftungsbeschränkt) – Rastenberg",
      "type": "Löschungsankündigung",
      "state": "Thüringen",
      "amtsgericht": "Amtsgericht Jena",
      "registernummer": "HRB 516093",
      "registerart": "HRB",
      "company_name": "Fitness Health UG (haftungsbeschränkt)",
      "company_seat": "Rastenberg",
      "details": "27.06.2025 (Bekanntmachungsdatum)\n\nThüringen Amtsgericht Jena HRB 516093\nLöschungsankündigung\n\nFitness Health UG (haftungsbeschränkt)\nGesellschaft mit beschränkter Haftung\nRastenberg\n\nDas Registergericht beabsichtigt, die im Handelsregister eingetragene Gesellschaft wegen Vermögenslosigkeit nach § 394 FamFG von Amts wegen zu löschen. Die Frist zur Erhebung eines Widerspruchs gegen die beabsichtigte Löschung wird auf 6 Wochen festgesetzt."
    },
    {
      "date": "2025-06-27",
      "id": "113689",
      "original_text": "Registerbekanntmachung nach dem Umwandlungsgesetz\nBerlin Amtsgericht Berlin (Charlottenburg) HRB 172605\nBelle Époque Annenstraße 5 GmbH – Berlin",
      "type": "Registerbekanntmachung nach dem Umwandlungsgesetz",
      "state": "Berlin",
      "amtsgericht": "Amtsgericht Berlin (Charlottenburg)",
      "registernummer": "HRB 172605",
      "registerart": "HRB",
      "company_name": "Belle Époque Annenstraße 5 GmbH",
      "company_seat": "Berlin",
      "details": "27.06.2025 (Bekanntmachungsdatum)\n\nBerlin Amtsgericht Berlin (Charlottenburg) HRB 172605\nRegisterbekanntmachung nach dem Umwandlungsgesetz 26.06.2025 (Eintragungsdatum)\n\nBelle Époque Annenstraße 5 GmbH\nGesellschaft mit beschränkter Haftung\nBerlin\n\nZu Eintragungsnummer 6 vom 26.06.2025 wird als nicht eingetragen veröffentlicht: Den Gläubigern der an der Verschmelzung beteiligten Rechtsträger ist, wenn sie binnen sechs Monaten nach dem Tag, an dem die Eintragung der Verschmelzung in das Register des Sitzes desjenigen Rechtsträgers, dessen Gläubiger sie sind, als bekannt gemacht gilt, ihren Anspruch nach Grund und Höhe schriftlich anmelden, Sicherheit zu leisten, soweit sie nicht Befriedigung verlangen können. Dieses Recht steht den Gläubigern jedoch nur zu, wenn sie glaubhaft machen, dass durch die Verschmelzung die Erfüllung ihrer Forderung gefährdet wird. Das Recht, Sicherheitsleistung zu verlangen, steht Gläubigern nicht zu, die im Falle der Insolvenz ein Recht auf vorzugsweise Befriedigung aus einer Deckungsmasse haben, die nach gesetzlicher Vorschrift zu ihrem Schutz errichtet und staatlich überwacht ist."
    },
    {
      "date": "2025-06-27",
      "id": "113690",
      "original_text": "Registerbekanntmachung nach dem Umwandlungsgesetz\nBerlin Amtsgericht Berlin (Charlottenburg) HRA 63968\nUkry Trading UG (haftungsbeschränkt) & Co. KG – Berlin",
      "type": "Registerbekanntmachung nach dem Umwandlungsgesetz",
      "state": "Berlin",
      "amtsgericht": "Amtsgericht Berlin (Charlottenburg)",
      "registernummer": "HRA 63968",
      "registerart": "HRA",
      "company_name": "Ukry Trading UG (haftungsbeschränkt) & Co. KG",
      "company_seat": "Berlin",
      "details": "27.06.2025 (Bekanntmachungsdatum)\n\nBerlin Amtsgericht Berlin (Charlottenburg) HRA 63968\nRegisterbekanntmachung nach dem Umwandlungsgesetz 27.06.2025 (Eintragungsdatum)\n\nUkry Trading UG (haftungsbeschränkt) & Co. KG\nKommanditgesellschaft\nBerlin\n\nZu Eintragungsnummer 4 vom 27.06.2025 wird als nicht eingetragen veröffentlicht: Den Gläubigern der an der Verschmelzung beteiligten Rechtsträger ist, wenn sie binnen sechs Monaten nach dem Tag, an dem die Eintragung der Verschmelzung in das Register des Sitzes desjenigen Rechtsträgers, dessen Gläubiger sie sind, als bekannt gemacht gilt, ihren Anspruch nach Grund und Höhe schriftlich anmelden, Sicherheit zu leisten, soweit sie nicht Befriedigung verlangen können. Dieses Recht steht den Gläubigern jedoch nur zu, wenn sie glaubhaft machen, dass durch die Verschmelzung die Erfüllung ihrer Forderung gefährdet wird. Das Recht, Sicherheitsleistung zu verlangen, steht Gläubigern nicht zu, die im Falle der Insolvenz ein Recht auf vorzugsweise Befriedigung aus einer Deckungsmasse haben, die nach gesetzlicher Vorschrift zu ihrem Schutz errichtet und staatlich überwacht ist."
    },
    {
      "date": "2025-06-27",
      "id": "113691",
      "original_text": "Registerbekanntmachung nach dem Umwandlungsgesetz\nBaden-Württemberg Amtsgericht Stuttgart HRB 23635\nMercedes-Benz Tech Motion GmbH – Böblingen",
      "type": "Registerbekanntmachung nach dem Umwandlungsgesetz",
      "state": "Baden-Württemberg",
      "amtsgericht": "Amtsgericht Stuttgart",
      "registernummer": "HRB 23635",
      "registerart": "HRB",
      "company_name": "Mercedes-Benz Tech Motion GmbH",
      "company_seat": "Böblingen",
      "details": "27.06.2025 (Bekanntmachungsdatum)\n\nBaden-Württemberg Amtsgericht Stuttgart HRB 23635\nRegisterbekanntmachung nach dem Umwandlungsgesetz 27.06.2025 (Eintragungsdatum)\n\nMercedes-Benz Tech Motion GmbH\nGesellschaft mit beschränkter Haftung\nBöblingen\n\nDen Gläubigern der an der Verschmelzung beteiligten Rechtsträger ist, wenn sie binnen sechs Monaten nach dem Tag, an dem die Eintragung der Verschmelzung in das Register des Sitzes desjenigen Rechtsträgers, dessen Gläubiger sie sind, nach § 19 Abs. 3 UmwG als bekanntgemacht gilt, ihren Anspruch nach Grund und Höhe schriftlich anmelden, Sicherheit zu leisten, soweit sie nicht Befriedigung verlangen können. Dieses Recht steht den Gläubigern jedoch nur zu, wenn sie glaubhaft machen, dass durch die Verschmelzung die Erfüllung ihrer Forderung gefährdet wird."
    },
    {
      "date": "2025-06-27",
      "id": "113692",
      "original_text": "Registerbekanntmachung nach dem Umwandlungsgesetz\nBerlin Amtsgericht Berlin (Charlottenburg) HRA 64397\nStudio Anri Sala UG (haftungsbeschränkt) & Co. KG – Berlin",
      "type": "Registerbekanntmachung nach dem Umwandlungsgesetz",
      "state": "Berlin",
      "amtsgericht": "Amtsgericht Berlin (Charlottenburg)",
      "registernummer": "HRA 64397",
      "registerart": "HRA",
      "company_name": "Studio Anri Sala UG (haftungsbeschränkt) & Co. KG",
      "company_seat": "Berlin",
      "details": "27.06.2025 (Bekanntmachungsdatum)\n\nBerlin Amtsgericht Berlin (Charlottenburg) HRA 64397\nRegisterbekanntmachung nach dem Umwandlungsgesetz 26.06.2025 (Eintragungsdatum)\n\nStudio Anri Sala UG (haftungsbeschränkt) & Co. KG\nKommanditgesellschaft\nBerlin\n\nZu Eintragungsnummer 1 vom 26.06.2025 wird als nicht eingetragen veröffentlicht:\nDen Gläubigern ist, wenn sie binnen sechs Monaten nach dem Tag, an dem die Eintragung der Umwandlung als bekannt gemacht gilt, ihren Anspruch nach Grund und Höhe schriftlich anmelden, Sicherheit zu leisten, soweit sie nicht Befriedigung verlangen können. Dieses Recht steht den Gläubigern jedoch nur zu, wenn sie glaubhaft machen, dass durch die Umwandlung die Erfüllung ihrer Forderung gefährdet wird. Das Recht, Sicherheitsleistung zu verlangen, steht Gläubigern nicht zu, die im Falle der Insolvenz ein Recht auf vorzugsweise Befriedigung aus einer Deckungsmasse haben, die nach gesetzlicher Vorschrift zu ihrem Schutz errichtet und staatlich überwacht ist."
    },
    {
      "date": "2025-06-27",
      "id": "113693",
      "original_text": "Registerbekanntmachung nach dem Umwandlungsgesetz\nBerlin Amtsgericht Berlin (Charlottenburg) HRB 212815\nSlip of the Line UG (haftungsbeschränkt) – Berlin",
      "type": "Registerbekanntmachung nach dem Umwandlungsgesetz",
      "state": "Berlin",
      "amtsgericht": "Amtsgericht Berlin (Charlottenburg)",
      "registernummer": "HRB 212815",
      "registerart": "HRB",
      "company_name": "Slip of the Line UG (haftungsbeschränkt)",
      "company_seat": "Berlin",
      "details": "27.06.2025 (Bekanntmachungsdatum)\n\nBerlin Amtsgericht Berlin (Charlottenburg) HRB 212815\nRegisterbekanntmachung nach dem Umwandlungsgesetz 26.06.2025 (Eintragungsdatum)\n\nSlip of the Line UG (haftungsbeschränkt)\nGesellschaft mit beschränkter Haftung\nBerlin\n\nZu Eintragungsnummer 5 vom 26.06.2025 wird als nicht eingetragen veröffentlicht:\nDen Gläubigern ist, wenn sie binnen sechs Monaten nach dem Tag, an dem die Eintragung der Umwandlung als bekannt gemacht gilt, ihren Anspruch nach Grund und Höhe schriftlich anmelden, Sicherheit zu leisten, soweit sie nicht Befriedigung verlangen können. Dieses Recht steht den Gläubigern jedoch nur zu, wenn sie glaubhaft machen, dass durch die Umwandlung die Erfüllung ihrer Forderung gefährdet wird. Das Recht, Sicherheitsleistung zu verlangen, steht Gläubigern nicht zu, die im Falle der Insolvenz ein Recht auf vorzugsweise Befriedigung aus einer Deckungsmasse haben, die nach gesetzlicher Vorschrift zu ihrem Schutz errichtet und staatlich überwacht ist."
    },
    {
      "date": "2025-06-27",
      "id": "113694",
      "original_text": "Registerbekanntmachung nach dem Umwandlungsgesetz\nBaden-Württemberg Amtsgericht Mannheim HRB 735129\ncf Fitness Mannheim Sandhofen GmbH – Mannheim",
      "type": "Registerbekanntmachung nach dem Umwandlungsgesetz",
      "state": "Baden-Württemberg",
      "amtsgericht": "Amtsgericht Mannheim",
      "registernummer": "HRB 735129",
      "registerart": "HRB",
      "company_name": "cf Fitness Mannheim Sandhofen GmbH",
      "company_seat": "Mannheim",
      "details": "27.06.2025 (Bekanntmachungsdatum)\n\nBaden-Württemberg Amtsgericht Mannheim HRB 735129\nRegisterbekanntmachung nach dem Umwandlungsgesetz 27.06.2025 (Eintragungsdatum)\n\ncf Fitness Mannheim Sandhofen GmbH\nGesellschaft mit beschränkter Haftung\nMannheim\n\nAls nicht eingetragen wird bekanntgemacht: Den Gläubigern der an der Verschmelzung beteiligten Rechtsträger ist, wenn sie binnen sechs Monaten nach dem Tag, an dem die Eintragung der Verschmelzung in das Register des Sitzes desjenigen Rechtsträgers, dessen Gläubiger sie sind, nach § 19 Abs. 3 UmwG als bekanntgemacht gilt, ihren Anspruch nach Grund und Höhe schriftlich anmelden, Sicherheit zu leisten, soweit sie nicht Befriedigung verlangen können. Dieses Recht steht den Gläubigern jedoch nur zu, wenn sie glaubhaft machen, dass durch die Verschmelzung die Erfüllung ihrer Forderung gefährdet wird."
    },
    {
      "date": "2025-06-27",
      "id": "113695",
      "original_text": "Registerbekanntmachung nach dem Umwandlungsgesetz\nBerlin Amtsgericht Berlin (Charlottenburg) HRA 26287\nFriedrich-Aufzüge GmbH & Co. KG – Berlin",
      "type": "Registerbekanntmachung nach dem Umwandlungsgesetz",
      "state": "Berlin",
      "amtsgericht": "Amtsgericht Berlin (Charlottenburg)",
      "registernummer": "HRA 26287",
      "registerart": "HRA",
      "company_name": "Friedrich-Aufzüge GmbH & Co. KG",
      "company_seat": "Berlin",
      "details": "27.06.2025 (Bekanntmachungsdatum)\n\nBerlin Amtsgericht Berlin (Charlottenburg) HRA 26287\nRegisterbekanntmachung nach dem Umwandlungsgesetz 26.06.2025 (Eintragungsdatum)\n\nFriedrich-Aufzüge GmbH & Co. KG\nKommanditgesellschaft\nBerlin\n\nZu Eintragungsnummer 5 vom 26.06.2025 wird als nicht eingetragen veröffentlicht:\nDen Gläubigern der an der Verschmelzung beteiligten Rechtsträger ist, wenn sie binnen sechs Monaten nach dem Tag, an dem die Eintragung der Verschmelzung in das Register des Sitzes desjenigen Rechtsträgers, dessen Gläubiger sie sind, als bekannt gemacht gilt, ihren Anspruch nach Grund und Höhe schriftlich anmelden, Sicherheit zu leisten, soweit sie nicht Befriedigung verlangen können. Dieses Recht steht den Gläubigern jedoch nur zu, wenn sie glaubhaft machen, dass durch die Verschmelzung die Erfüllung ihrer Forderung gefährdet wird. Das Recht, Sicherheitsleistung zu verlangen, steht Gläubigern nicht zu, die im Falle der Insolvenz ein Recht auf vorzugsweise Befriedigung aus einer Deckungsmasse haben, die nach gesetzlicher Vorschrift zu ihrem Schutz errichtet und staatlich überwacht ist."
    },
    {
      "date": "2025-06-27",
      "id": "113696",
      "original_text": "Registerbekanntmachung nach dem Umwandlungsgesetz\nBaden-Württemberg Amtsgericht Ulm HRB 743938\nGutes Vakuum GmbH – Ulm",
      "type": "Registerbekanntmachung nach dem Umwandlungsgesetz",
      "state": "Baden-Württemberg",
      "amtsgericht": "Amtsgericht Ulm",
      "registernummer": "HRB 743938",
      "registerart": "HRB",
      "company_name": "Gutes Vakuum GmbH",
      "company_seat": "Ulm",
      "details": "27.06.2025 (Bekanntmachungsdatum)\n\nBaden-Württemberg Amtsgericht Ulm HRB 743938\nRegisterbekanntmachung nach dem Umwandlungsgesetz 27.06.2025 (Eintragungsdatum)\n\nGutes Vakuum GmbH\nGesellschaft mit beschränkter Haftung\nUlm\n\nAls nicht eingetragen wird bekanntgemacht:\nDen Gläubigern der an der Verschmelzung beteiligten Rechtsträger ist, wenn sie binnen sechs Monaten nach dem Tag, an dem die Eintragung der Verschmelzung in das Register des Sitzes desjenigen Rechtsträgers, dessen Gläubiger sie sind, nach § 19 Abs. 3 UmwG als bekanntgemacht gilt, ihren Anspruch nach Grund und Höhe schriftlich anmelden, Sicherheit zu leisten, soweit sie nicht Befriedigung verlangen können. Dieses Recht steht den Gläubigern jedoch nur zu, wenn sie glaubhaft machen, dass durch die Verschmelzung die Erfüllung ihrer Forderung gefährdet wird."
    },
    {
      "date": "2025-06-27",
      "id": "113697",
      "original_text": "Registerbekanntmachung nach dem Umwandlungsgesetz\nBaden-Württemberg Amtsgericht Ulm HRB 501645\nMAPAL Holding GmbH – Aalen",
      "type": "Registerbekanntmachung nach dem Umwandlungsgesetz",
      "state": "Baden-Württemberg",
      "amtsgericht": "Amtsgericht Ulm",
      "registernummer": "HRB 501645",
      "registerart": "HRB",
      "company_name": "MAPAL Holding GmbH",
      "company_seat": "Aalen",
      "details": "27.06.2025 (Bekanntmachungsdatum)\n\nBaden-Württemberg Amtsgericht Ulm HRB 501645\nRegisterbekanntmachung nach dem Umwandlungsgesetz 27.06.2025 (Eintragungsdatum)\n\nMAPAL Holding GmbH\nGesellschaft mit beschränkter Haftung\nAalen\n\nAls nicht eingetragen wird bekanntgemacht:\nDen Gläubigern der an der Verschmelzung beteiligten Rechtsträger ist, wenn sie binnen sechs Monaten nach dem Tag, an dem die Eintragung der Verschmelzung in das Register des Sitzes desjenigen Rechtsträgers, dessen Gläubiger sie sind, nach § 19 Abs. 3 UmwG als bekanntgemacht gilt, ihren Anspruch nach Grund und Höhe schriftlich anmelden, Sicherheit zu leisten, soweit sie nicht Befriedigung verlangen können. Dieses Recht steht den Gläubigern jedoch nur zu, wenn sie glaubhaft machen, dass durch die Verschmelzung die Erfüllung ihrer Forderung gefährdet wird."
    },
    {
      "date": "2025-06-27",
      "id": "113698",
      "original_text": "Registerbekanntmachung nach dem Umwandlungsgesetz\nBerlin Amtsgericht Berlin (Charlottenburg) HRB 120755\nDPF Real Estate Holding GmbH – Berlin",
      "type": "Registerbekanntmachung nach dem Umwandlungsgesetz",
      "state": "Berlin",
      "amtsgericht": "Amtsgericht Berlin (Charlottenburg)",
      "registernummer": "HRB 120755",
      "registerart": "HRB",
      "company_name": "DPF Real Estate Holding GmbH",
      "company_seat": "Berlin",
      "details": "27.06.2025 (Bekanntmachungsdatum)\n\nBerlin Amtsgericht Berlin (Charlottenburg) HRB 120755\nRegisterbekanntmachung nach dem Umwandlungsgesetz 27.06.2025 (Eintragungsdatum)\n\nDPF Real Estate Holding GmbH\nGesellschaft mit beschränkter Haftung\nBerlin\n\nZu Eintragungsnummer 12 vom 27.06.2025 wird als nicht eingetragen veröffentlicht: Den Gläubigern der an der Verschmelzung beteiligten Rechtsträger ist, wenn sie binnen sechs Monaten nach dem Tag, an dem die Eintragung der Verschmelzung in das Register des Sitzes desjenigen Rechtsträgers, dessen Gläubiger sie sind, als bekannt gemacht gilt, ihren Anspruch nach Grund und Höhe schriftlich anmelden, Sicherheit zu leisten, soweit sie nicht Befriedigung verlangen können. Dieses Recht steht den Gläubigern jedoch nur zu, wenn sie glaubhaft machen, dass durch die Verschmelzung die Erfüllung ihrer Forderung gefährdet wird. Das Recht, Sicherheitsleistung zu verlangen, steht Gläubigern nicht zu, die im Falle der Insolvenz ein Recht auf vorzugsweise Befriedigung aus einer Deckungsmasse haben, die nach gesetzlicher Vorschrift zu ihrem Schutz errichtet und staatlich überwacht ist."
    },
    {
      "date": "2025-06-27",
      "id": "113699",
      "original_text": "Registerbekanntmachung nach dem Umwandlungsgesetz\nBerlin Amtsgericht Berlin (Charlottenburg) HRB 213781\nBlackcurrant 2. Immobilien GmbH – Berlin",
      "type": "Registerbekanntmachung nach dem Umwandlungsgesetz",
      "state": "Berlin",
      "amtsgericht": "Amtsgericht Berlin (Charlottenburg)",
      "registernummer": "HRB 213781",
      "registerart": "HRB",
      "company_name": "Blackcurrant 2. Immobilien GmbH",
      "company_seat": "Berlin",
      "details": "27.06.2025 (Bekanntmachungsdatum)\n\nBerlin Amtsgericht Berlin (Charlottenburg) HRB 213781\nRegisterbekanntmachung nach dem Umwandlungsgesetz 27.06.2025 (Eintragungsdatum)\n\nBlackcurrant 2. Immobilien GmbH\nGesellschaft mit beschränkter Haftung\nBerlin\n\nZu Eintragungsnummer 4 vom 27.06.2025 wird als nicht eingetragen veröffentlicht: Den Gläubigern der an der Verschmelzung beteiligten Rechtsträger ist, wenn sie binnen sechs Monaten nach dem Tag, an dem die Eintragung der Verschmelzung in das Register des Sitzes desjenigen Rechtsträgers, dessen Gläubiger sie sind, als bekannt gemacht gilt, ihren Anspruch nach Grund und Höhe schriftlich anmelden, Sicherheit zu leisten, soweit sie nicht Befriedigung verlangen können. Dieses Recht steht den Gläubigern jedoch nur zu, wenn sie glaubhaft machen, dass durch die Verschmelzung die Erfüllung ihrer Forderung gefährdet wird. Das Recht, Sicherheitsleistung zu verlangen, steht Gläubigern nicht zu, die im Falle der Insolvenz ein Recht auf vorzugsweise Befriedigung aus einer Deckungsmasse haben, die nach gesetzlicher Vorschrift zu ihrem Schutz errichtet und staatlich überwacht ist."
    },
    {
      "date": "2025-06-27",
      "id": "113700",
      "original_text": "Löschungsankündigung\nSaarland Amtsgericht Saarbrücken HRB 108281\nDidimdol UG (haftungsbeschränkt) – Saarbrücken",
      "type": "Löschungsankündigung",
      "state": "Saarland",
      "amtsgericht": "Amtsgericht Saarbrücken",
      "registernummer": "HRB 108281",
      "registerart": "HRB",
      "company_name": "Didimdol UG (haftungsbeschränkt)",
      "company_seat": "Saarbrücken",
      "details": "27.06.2025 (Bekanntmachungsdatum)\n\nSaarland Amtsgericht Saarbrücken HRB 108281\nLöschungsankündigung\n\nDidimdol UG (haftungsbeschränkt)\nGesellschaft mit beschränkter Haftung\nSaarbrücken\n\nEs ist beabsichtigt, die Gesellschaft von Amts wegen gemäß § 394 FamFG wegen Vermögenslosigkeit zu löschen.\nGegen die Löschung von Amts wegen ist das Rechtsmittel des Widerspruchs statthaft. Der Widerspruch ist binnen einer Frist zwei Monaten beginnend mit dem Tag dieser Veröffentlichung durch Einreichen eines Widerspruchsschreibens -schriftlich oder zur Niederschrift der Geschäftsstelle beim Amtsgericht Saarbrücken, -zentrales Handelsregister-, Mainzerstr.178, 66121 Saarbrücken einzulegen.\nDer Widerspruch muss die Bezeichnung der angefochtenen Löschungsankündigung enthalten sowie die Erklärung, dass Widerspruch eingelegt wird. Er ist vom Widerspruchsführer oder seinem Bevollmächtigten zu unterzeichnen.\nDas Widerspruchsschreiben kann auch in der Form eines elektronischen Dokumentes eingereicht werden, das mit einer qualifizierten elektronischen Signatur nach dem Signaturgesetz versehen sein muss (§§ 14 Abs. 2 FamFG, 130a, 298 ZPO)."
    },
    {
      "date": "2025-06-27",
      "id": "113701",
      "original_text": "Sonstige Registerbekanntmachung\nSchleswig-Holstein Amtsgericht Flensburg HRB 17034\nteam agrar GmbH – Flensburg",
      "type": "Sonstige Registerbekanntmachung",
      "state": "Schleswig-Holstein",
      "amtsgericht": "Amtsgericht Flensburg",
      "registernummer": "HRB 17034",
      "registerart": "HRB",
      "company_name": "team agrar GmbH",
      "company_seat": "Flensburg",
      "details": "27.06.2025 (Bekanntmachungsdatum)\n\nSchleswig-Holstein Amtsgericht Flensburg HRB 17034\nSonstige Registerbekanntmachung\n\nteam agrar GmbH\nGesellschaft mit beschränkter Haftung\nFlensburg\n\nAls nicht eingetragen wird veröffentlicht: Neue Aufsichtsratsliste nach Änderung eingereicht am 27.06.2025"
    },
    {
      "date": "2025-06-27",
      "id": "113702",
      "original_text": "Einreichung neuer Dokumente\nBerlin Amtsgericht Berlin (Charlottenburg) HRB 142946\nAIOS Tax AG Steuerberatungsgesellschaft – Berlin",
      "type": "Einreichung neuer Dokumente",
      "state": "Berlin",
      "amtsgericht": "Amtsgericht Berlin (Charlottenburg)",
      "registernummer": "HRB 142946",
      "registerart": "HRB",
      "company_name": "AIOS Tax AG Steuerberatungsgesellschaft",
      "company_seat": "Berlin",
      "details": "27.06.2025 (Bekanntmachungsdatum)\n\nBerlin Amtsgericht Berlin (Charlottenburg) HRB 142946\nEinreichung neuer Dokumente\n\nAIOS Tax AG Steuerberatungsgesellschaft\nAktiengesellschaft\nBerlin\n\nAls nicht eingetragen wird veröffentlicht:\nEs wurde eine neue Liste der Aufsichtsratsmitglieder eingereicht (§ 106 AktG)."
    },
    {
      "date": "2025-06-27",
      "id": "113703",
      "original_text": "Löschungsankündigung\nBrandenburg Amtsgericht Potsdam HRB 35296\nB & B Phone GmbH – Potsdam",
      "type": "Löschungsankündigung",
      "state": "Brandenburg",
      "amtsgericht": "Amtsgericht Potsdam",
      "registernummer": "HRB 35296",
      "registerart": "HRB",
      "company_name": "B & B Phone GmbH",
      "company_seat": "Potsdam",
      "details": "27.06.2025 (Bekanntmachungsdatum)\n\nBrandenburg Amtsgericht Potsdam HRB 35296\nLöschungsankündigung\n\nB & B Phone GmbH\nGesellschaft mit beschränkter Haftung\nPotsdam\n\nBei der nachstehenden Gesellschaft wird das Amtslöschungsverfahren gemäß § 394 FamFG eingeleitet. Widerspruchsfrist: 8 Wochen."
    },
    {
      "date": "2025-06-27",
      "id": "113704",
      "original_text": "Registerbekanntmachung nach dem Umwandlungsgesetz\nSachsen Amtsgericht Chemnitz HRA 9738\nTom Thieme eK – Zwickau",
      "type": "Registerbekanntmachung nach dem Umwandlungsgesetz",
      "state": "Sachsen",
      "amtsgericht": "Amtsgericht Chemnitz",
      "registernummer": "HRA 9738",
      "registerart": "HRA",
      "company_name": "Tom Thieme eK",
      "company_seat": "Zwickau",
      "details": "27.06.2025 (Bekanntmachungsdatum)\n\nSachsen Amtsgericht Chemnitz HRA 9738\nRegisterbekanntmachung nach dem Umwandlungsgesetz 27.06.2025 (Eintragungsdatum)\n\nTom Thieme eK\nEinzelkaufmann / Einzelkauffrau\nZwickau\n\nDen Gläubigern der an der Ausgliederung beteiligten Rechtsträger ist, wenn sie binnen sechs Monaten nach dem Tag, an dem die Eintragung der Ausgliederung in das Register des Sitzes desjenigen Rechtsträgers, dessen Gläubiger sie sind, nach § 19 Abs. 3 UmwG als bekannt gemacht gilt, ihren Anspruch nach Grund und Höhe in Textform anmelden, Sicherheit zu leisten, soweit sie nicht Befriedigung verlangen können. Dieses Recht steht den Gläubigern jedoch nur zu, wenn sie glaubhaft machen, dass durch die Ausgliederung die Erfüllung der Forderung gefährdet wird."
    },
    {
      "date": "2025-06-27",
      "id": "113705",
      "original_text": "Registerbekanntmachung nach dem Umwandlungsgesetz\nSachsen Amtsgericht Chemnitz HRB 37503\nBestattungsinstitut Mühlig GmbH – Lößnitz",
      "type": "Registerbekanntmachung nach dem Umwandlungsgesetz",
      "state": "Sachsen",
      "amtsgericht": "Amtsgericht Chemnitz",
      "registernummer": "HRB 37503",
      "registerart": "HRB",
      "company_name": "Bestattungsinstitut Mühlig GmbH",
      "company_seat": "Lößnitz",
      "details": "27.06.2025 (Bekanntmachungsdatum)\n\nSachsen Amtsgericht Chemnitz HRB 37503\nRegisterbekanntmachung nach dem Umwandlungsgesetz 27.06.2025 (Eintragungsdatum)\n\nBestattungsinstitut Mühlig GmbH\nGesellschaft mit beschränkter Haftung\nLößnitz\n\nDen Gläubigern der an der Ausgliederung beteiligten Rechtsträger ist, wenn sie binnen sechs Monaten nach dem Tag, an dem die Eintragung der Ausgliederung in das Register des Sitzes desjenigen Rechtsträgers, dessen Gläubiger sie sind, nach § 19 Abs. 3 UmwG als bekannt gemacht gilt, ihren Anspruch nach Grund und Höhe in Textform anmelden, Sicherheit zu leisten, soweit sie nicht Befriedigung verlangen können. Dieses Recht steht den Gläubigern jedoch nur zu, wenn sie glaubhaft machen, dass durch die Ausgliederung die Erfüllung der Forderung gefährdet wird."
    },
    {
      "date": "2025-06-27",
      "id": "113706",
      "original_text": "Registerbekanntmachung nach dem Umwandlungsgesetz\nSachsen Amtsgericht Chemnitz HRB 31501\nGK Software SE – Schöneck/Vogtl.",
      "type": "Registerbekanntmachung nach dem Umwandlungsgesetz",
      "state": "Sachsen",
      "amtsgericht": "Amtsgericht Chemnitz",
      "registernummer": "HRB 31501",
      "registerart": "HRB",
      "company_name": "GK Software SE",
      "company_seat": "Schöneck/Vogtl.",
      "details": "27.06.2025 (Bekanntmachungsdatum)\n\nSachsen Amtsgericht Chemnitz HRB 31501\nRegisterbekanntmachung nach dem Umwandlungsgesetz 27.06.2025 (Eintragungsdatum)\n\nGK Software SE\nEuropäische Aktiengesellschaft (SE)\nSchöneck/Vogtl.\n\nDen Gläubigern der an der Verschmelzung beteiligten Rechtsträger ist, wenn sie binnen sechs Monaten nach dem Tag, an dem die Eintragung der Verschmelzung in das Register des Sitzes desjenigen Rechtsträgers, dessen Gläubiger sie sind, nach § 19 Abs. 3 UmwG als bekannt gemacht gilt, ihren Anspruch nach Grund und Höhe in Textform anmelden, Sicherheit zu leisten, soweit sie nicht Befriedigung verlangen können. Dieses Recht steht den Gläubigern jedoch nur zu, wenn sie glaubhaft machen, dass durch die Verschmelzung die Erfüllung der Forderung gefährdet wird."
    },
    {
      "date": "2025-06-27",
      "id": "113707",
      "original_text": "Löschungsankündigung\nSachsen Amtsgericht Chemnitz HRB 33037\nVita Sportwelt GmbH Zweigniederlassung Chemnitz – Chemnitz",
      "type": "Löschungsankündigung",
      "state": "Sachsen",
      "amtsgericht": "Amtsgericht Chemnitz",
      "registernummer": "HRB 33037",
      "registerart": "HRB",
      "company_name": "Vita Sportwelt GmbH Zweigniederlassung Chemnitz",
      "company_seat": "Chemnitz",
      "details": "27.06.2025 (Bekanntmachungsdatum)\n\nSachsen Amtsgericht Chemnitz HRB 33037\nLöschungsankündigung 27.06.2025 (Eintragungsdatum)\n\nVita Sportwelt GmbH Zweigniederlassung Chemnitz\nRechtsform ausländischen Rechts HRB\nChemnitz\n\nDas Registergericht beabsichtigt, die im Handelsregister eingetragene Vita Sportwelt GmbH Zweigniederlassung Chemnitz mit Sitz in Chemnitz als Zweigniederlassung der gelöschten Vita Sportwelt GmbH mit Sitz in St. Veit an der Glan/Österreich (Österreichisches Firmenbuch: 490925-000) von Amts wegen nach § 395 Absatz 1 FamFG zu löschen. Die Frist zu Erhebung eines Widerspruchs gegen die beabsichtigte Löschung wird auf einen Monat festgesetzt."
    },
    {
      "date": "2025-06-27",
      "id": "113708",
      "original_text": "Registerbekanntmachung nach dem Umwandlungsgesetz\nSachsen Amtsgericht Chemnitz HRA 9786\nTextilpflege Thieme GmbH & Co. KG – Zwickau",
      "type": "Registerbekanntmachung nach dem Umwandlungsgesetz",
      "state": "Sachsen",
      "amtsgericht": "Amtsgericht Chemnitz",
      "registernummer": "HRA 9786",
      "registerart": "HRA",
      "company_name": "Textilpflege Thieme GmbH & Co. KG",
      "company_seat": "Zwickau",
      "details": "27.06.2025 (Bekanntmachungsdatum)\n\nSachsen Amtsgericht Chemnitz HRA 9786\nRegisterbekanntmachung nach dem Umwandlungsgesetz 27.06.2025 (Eintragungsdatum)\n\nTextilpflege Thieme GmbH & Co. KG\nKommanditgesellschaft\nZwickau\n\nDen Gläubigern der an der Ausgliederung beteiligten Rechtsträger ist, wenn sie binnen sechs Monaten nach dem Tag, an dem die Eintragung der Ausgliederung in das Register des Sitzes desjenigen Rechtsträgers, dessen Gläubiger sie sind, nach § 19 Abs. 3 UmwG als bekannt gemacht gilt, ihren Anspruch nach Grund und Höhe in Textform anmelden, Sicherheit zu leisten, soweit sie nicht Befriedigung verlangen können. Dieses Recht steht den Gläubigern jedoch nur zu, wenn sie glaubhaft machen, dass durch die Ausgliederung die Erfüllung der Forderung gefährdet wird."
    },
    {
      "date": "2025-06-27",
      "id": "113709",
      "original_text": "Löschungsankündigung\nSachsen Amtsgericht Leipzig HRB 35249\nMCI Advice & Trade UG (haftungsbeschränkt) – Leipzig",
      "type": "Löschungsankündigung",
      "state": "Sachsen",
      "amtsgericht": "Amtsgericht Leipzig",
      "registernummer": "HRB 35249",
      "registerart": "HRB",
      "company_name": "MCI Advice & Trade UG (haftungsbeschränkt)",
      "company_seat": "Leipzig",
      "details": "27.06.2025 (Bekanntmachungsdatum)\n\nSachsen Amtsgericht Leipzig HRB 35249\nLöschungsankündigung\n\nMCI Advice & Trade UG (haftungsbeschränkt)\nGesellschaft mit beschränkter Haftung\nLeipzig\n\nDas Registergericht beabsichtigt, die im Handelsregister eingetragene Gesellschaft von Amts wegen nach § 394 FamFG zu löschen. Die Frist zu Erhebung eines Widerspruchs gegen die beabsichtigte Löschung wird auf einen Monat festgesetzt."
    },
    {
      "date": "2025-06-27",
      "id": "113710",
      "original_text": "Registerbekanntmachung nach dem Umwandlungsgesetz\nSachsen Amtsgericht Chemnitz HRB 36043\nMVZ diagnosticum GmbH – Neukirchen/Erzgeb.",
      "type": "Registerbekanntmachung nach dem Umwandlungsgesetz",
      "state": "Sachsen",
      "amtsgericht": "Amtsgericht Chemnitz",
      "registernummer": "HRB 36043",
      "registerart": "HRB",
      "company_name": "MVZ diagnosticum GmbH",
      "company_seat": "Neukirchen/Erzgeb.",
      "details": "27.06.2025 (Bekanntmachungsdatum)\n\nSachsen Amtsgericht Chemnitz HRB 36043\nRegisterbekanntmachung nach dem Umwandlungsgesetz 27.06.2025 (Eintragungsdatum)\n\nMVZ diagnosticum GmbH\nGesellschaft mit beschränkter Haftung\nNeukirchen/Erzgeb.\n\nDen Gläubigern der an der Verschmelzung beteiligten Rechtsträger ist, wenn sie binnen sechs Monaten nach dem Tag, an dem die Eintragung der Verschmelzung in das Register des Sitzes desjenigen Rechtsträgers, dessen Gläubiger sie sind, nach § 19 Abs. 3 UmwG als bekannt gemacht gilt, ihren Anspruch nach Grund und Höhe in Textform anmelden, Sicherheit zu leisten, soweit sie nicht Befriedigung verlangen können. Dieses Recht steht den Gläubigern jedoch nur zu, wenn sie glaubhaft machen, dass durch die Verschmelzung die Erfüllung der Forderung gefährdet wird."
    },
    {
      "date": "2025-06-27",
      "id": "113711",
      "original_text": "Löschungsankündigung\nSachsen Amtsgericht Chemnitz HRB 23760\nZindler GmbH – Kirchberg",
      "type": "Löschungsankündigung",
      "state": "Sachsen",
      "amtsgericht": "Amtsgericht Chemnitz",
      "registernummer": "HRB 23760",
      "registerart": "HRB",
      "company_name": "Zindler GmbH",
      "company_seat": "Kirchberg",
      "details": "27.06.2025 (Bekanntmachungsdatum)\n\nSachsen Amtsgericht Chemnitz HRB 23760\nLöschungsankündigung 27.06.2025 (Eintragungsdatum)\n\nZindler GmbH\nGesellschaft mit beschränkter Haftung\nKirchberg\n\nDas Registergericht beabsichtigt, die im Handelsregister eingetragene Gesellschaft von Amts wegen nach § 394 FamFG zu löschen. Die Frist zu Erhebung eines Widerspruchs gegen die beabsichtigte Löschung wird auf einen Monat festgesetzt."
    },
    {
      "date": "2025-06-27",
      "id": "113712",
      "original_text": "Registerbekanntmachung nach dem Umwandlungsgesetz\nSachsen Amtsgericht Chemnitz HRA 10238\nBestattungsinstitut Mühlig Inh. Marek Mühlig e.K. – Lößnitz",
      "type": "Registerbekanntmachung nach dem Umwandlungsgesetz",
      "state": "Sachsen",
      "amtsgericht": "Amtsgericht Chemnitz",
      "registernummer": "HRA 10238",
      "registerart": "HRA",
      "company_name": "Bestattungsinstitut Mühlig Inh. Marek Mühlig e.K.",
      "company_seat": "Lößnitz",
      "details": "27.06.2025 (Bekanntmachungsdatum)\n\nSachsen Amtsgericht Chemnitz HRA 10238\nRegisterbekanntmachung nach dem Umwandlungsgesetz 27.06.2025 (Eintragungsdatum)\n\nBestattungsinstitut Mühlig Inh. Marek Mühlig e.K.\nEinzelkaufmann / Einzelkauffrau\nLößnitz\n\nDen Gläubigern der an der Ausgliederung beteiligten Rechtsträger ist, wenn sie binnen sechs Monaten nach dem Tag, an dem die Eintragung der Ausgliederung in das Register des Sitzes desjenigen Rechtsträgers, dessen Gläubiger sie sind, nach § 19 Abs. 3 UmwG als bekannt gemacht gilt, ihren Anspruch nach Grund und Höhe in Textform anmelden, Sicherheit zu leisten, soweit sie nicht Befriedigung verlangen können. Dieses Recht steht den Gläubigern jedoch nur zu, wenn sie glaubhaft machen, dass durch die Ausgliederung die Erfüllung der Forderung gefährdet wird."
    },
    {
      "date": "2025-06-27",
      "id": "113713",
      "original_text": "Registerbekanntmachung nach dem Umwandlungsgesetz\nNiedersachsen Amtsgericht Hannover HRB 221618\nYUNIKO Immobilien GmbH – Hannover",
      "type": "Registerbekanntmachung nach dem Umwandlungsgesetz",
      "state": "Niedersachsen",
      "amtsgericht": "Amtsgericht Hannover",
      "registernummer": "HRB 221618",
      "registerart": "HRB",
      "company_name": "YUNIKO Immobilien GmbH",
      "company_seat": "Hannover",
      "details": "27.06.2025 (Bekanntmachungsdatum)\n\nNiedersachsen Amtsgericht Hannover HRB 221618\nRegisterbekanntmachung nach dem Umwandlungsgesetz 27.06.2025 (Eintragungsdatum)\n\nYUNIKO Immobilien GmbH\nGesellschaft mit beschränkter Haftung\nHannover\n\nDen Gläubigern der an der Ausgliederung beteiligten Rechtsträger ist, wenn sie binnen sechs Monaten nach dem Tag, an dem die Eintragung der Ausgliederung in das Register des Sitzes desjenigen Rechtsträgers, dessen Gläubiger sie sind, nach § 19 Abs. 3 UmwG als bekannt gemacht gilt, ihren Anspruch nach Grund und Höhe schriftlich anmelden, Sicherheit zu leisten, soweit sie nicht Befriedigung verlangen können. Dieses Recht steht den Gläubigern jedoch nur zu, wenn sie glaubhaft machen, dass durch die Ausgliederung die Erfüllung der Forderung gefährdet wird."
    },
    {
      "date": "2025-06-27",
      "id": "113714",
      "original_text": "Einreichung neuer Dokumente\nNiedersachsen Amtsgericht Osnabrück HRB 203034\nModularity AG – Osnabrück",
      "type": "Einreichung neuer Dokumente",
      "state": "Niedersachsen",
      "amtsgericht": "Amtsgericht Osnabrück",
      "registernummer": "HRB 203034",
      "registerart": "HRB",
      "company_name": "Modularity AG",
      "company_seat": "Osnabrück",
      "details": "27.06.2025 (Bekanntmachungsdatum)\n\nNiedersachsen Amtsgericht Osnabrück HRB 203034\nEinreichung neuer Dokumente\n\nModularity AG\nAktiengesellschaft\nOsnabrück\n\nDie Liste der Mitglieder des Aufsichtsrats wurde beim Registergericht eingereicht."
    },
    {
      "date": "2025-06-27",
      "id": "113715",
      "original_text": "Einreichung neuer Dokumente\nNiedersachsen Amtsgericht Aurich HRB 110929 früher Amtsgericht Leer (Ostfriesland) (Leer)\nORGADATA Software- Dienstleistungen Aktiengesellschaft – Leer",
      "type": "Einreichung neuer Dokumente",
      "state": "Niedersachsen",
      "amtsgericht": "Amtsgericht Aurich",
      "registernummer": "HRB 110929",
      "registerart": "HRB",
      "company_name": "ORGADATA Software- Dienstleistungen Aktiengesellschaft",
      "company_seat": "Leer",
      "former_amtsgericht": "Leer (Ostfriesland) (Leer)",
      "details": "27.06.2025 (Bekanntmachungsdatum)\n\nNiedersachsen Amtsgericht Aurich HRB 110929 früher Amtsgericht Leer (Ostfriesland) (Leer)\nEinreichung neuer Dokumente\n\nORGADATA Software- Dienstleistungen Aktiengesellschaft\nAktiengesellschaft\nLeer\n\nBeim Handelsregister ist der Entwurf eines Verschmelzungsvertrages eingereicht worden. Danach soll die Gesellschaft  - als übernehmende Gesellschaft - mit der Orgadata Datenservice GmbH, Sitz: Wuppertal, (Amtsgericht Wuppertal HRB 21012), verschmolzen werden."
    },
    {
      "date": "2025-06-27",
      "id": "113716",
      "original_text": "Einreichung neuer Dokumente\nNiedersachsen Amtsgericht Aurich HRB 110929 früher Amtsgericht Leer (Ostfriesland) (Leer)\nORGADATA Software- Dienstleistungen Aktiengesellschaft – Leer",
      "type": "Einreichung neuer Dokumente",
      "state": "Niedersachsen",
      "amtsgericht": "Amtsgericht Aurich",
      "registernummer": "HRB 110929",
      "registerart": "HRB",
      "company_name": "ORGADATA Software- Dienstleistungen Aktiengesellschaft",
      "company_seat": "Leer",
      "former_amtsgericht": "Leer (Ostfriesland) (Leer)",
      "details": "27.06.2025 (Bekanntmachungsdatum)\n\nNiedersachsen Amtsgericht Aurich HRB 110929 früher Amtsgericht Leer (Ostfriesland) (Leer)\nEinreichung neuer Dokumente\n\nORGADATA Software- Dienstleistungen Aktiengesellschaft\nAktiengesellschaft\nLeer\n\nBeim Handelsregister ist der Entwurf eines Verschmelzungsvertrages eingereicht worden. Danach soll die Gesellschaft  - als übernehmende Gesellschaft - mit der ORGADATA Automation GmbH, Sitz: Leer, (Amtsgericht Aurich, HRB 205635) verschmolzen werden."
    },
    {
      "date": "2025-06-27",
      "id": "113717",
      "original_text": "Registerbekanntmachung nach dem Umwandlungsgesetz\nNiedersachsen Amtsgericht Oldenburg (Oldenburg) HRB 111770 früher Amtsgericht Vechta\nBußmann GmbH – Damme",
      "type": "Registerbekanntmachung nach dem Umwandlungsgesetz",
      "state": "Niedersachsen",
      "amtsgericht": "Amtsgericht Oldenburg (Oldenburg)",
      "registernummer": "HRB 111770",
      "registerart": "HRB",
      "company_name": "Bußmann GmbH",
      "company_seat": "Damme",
      "former_amtsgericht": "Vechta",
      "details": "27.06.2025 (Bekanntmachungsdatum)\n\nNiedersachsen Amtsgericht Oldenburg (Oldenburg) HRB 111770 früher Amtsgericht Vechta\nRegisterbekanntmachung nach dem Umwandlungsgesetz 27.06.2025 (Eintragungsdatum)\n\nBußmann GmbH\nGesellschaft mit beschränkter Haftung\nDamme\n\nDen Gläubigern der an der Verschmelzung beteiligten Rechtsträger ist, wenn sie binnen sechs Monaten nach dem Tag, an dem die Eintragung der Verschmelzung in das Register des Sitzes desjenigen Rechtsträgers, dessen Gläubiger sie sind, nach § 19  Abs.  3 UmwG als bekannt gemacht gilt, ihren Anspruch nach Grund und Höhe schriftlich anmelden, Sicherheit zu leisten, soweit sie nicht Befriedigung verlangen können. Dieses Recht steht den Gläubigern jedoch nur zu, wenn sie glaubhaft machen, dass durch die Verschmelzung die Erfüllung der Forderung gefährdet wird."
    },
    {
      "date": "2025-06-27",
      "id": "113718",
      "original_text": "Registerbekanntmachung nach dem Umwandlungsgesetz\nNiedersachsen Amtsgericht Hannover HRA 206680\nPflegecampus Hannover GmbH & Co. KG – Hannover",
      "type": "Registerbekanntmachung nach dem Umwandlungsgesetz",
      "state": "Niedersachsen",
      "amtsgericht": "Amtsgericht Hannover",
      "registernummer": "HRA 206680",
      "registerart": "HRA",
      "company_name": "Pflegecampus Hannover GmbH & Co. KG",
      "company_seat": "Hannover",
      "details": "27.06.2025 (Bekanntmachungsdatum)\n\nNiedersachsen Amtsgericht Hannover HRA 206680\nRegisterbekanntmachung nach dem Umwandlungsgesetz 27.06.2025 (Eintragungsdatum)\n\nPflegecampus Hannover GmbH & Co. KG\nKommanditgesellschaft\nHannover\n\nDen Gläubigern der an der Ausgliederung beteiligten Rechtsträger ist, wenn sie binnen sechs Monaten nach dem Tag, an dem die Eintragung der Ausgliederung in das Register des Sitzes desjenigen Rechtsträgers, dessen Gläubiger sie sind, nach § 19 Abs. 3 UmwG als bekannt gemacht gilt, ihren Anspruch nach Grund und Höhe schriftlich anmelden, Sicherheit zu leisten, soweit sie nicht Befriedigung verlangen können. Dieses Recht steht den Gläubigern jedoch nur zu, wenn sie glaubhaft machen, dass durch die Ausgliederung die Erfüllung der Forderung gefährdet wird."
    },
    {
      "date": "2025-06-27",
      "id": "113719",
      "original_text": "Einreichung neuer Dokumente\nNiedersachsen Amtsgericht Hannover HRB 226570\nWohnRaum Niedersachsen GmbH – Hannover",
      "type": "Einreichung neuer Dokumente",
      "state": "Niedersachsen",
      "amtsgericht": "Amtsgericht Hannover",
      "registernummer": "HRB 226570",
      "registerart": "HRB",
      "company_name": "WohnRaum Niedersachsen GmbH",
      "company_seat": "Hannover",
      "details": "27.06.2025 (Bekanntmachungsdatum)\n\nNiedersachsen Amtsgericht Hannover HRB 226570\nEinreichung neuer Dokumente\n\nWohnRaum Niedersachsen GmbH\nGesellschaft mit beschränkter Haftung\nHannover\n\nDie Liste der Mitglieder des Aufsichtsrats wurde beim Registergericht eingereicht."
    },
    {
      "date": "2025-06-27",
      "id": "113720",
      "original_text": "Registerbekanntmachung nach dem Umwandlungsgesetz\nNiedersachsen Amtsgericht Hannover HRA 206568\nJudith Menkens e.K. – Hannover",
      "type": "Registerbekanntmachung nach dem Umwandlungsgesetz",
      "state": "Niedersachsen",
      "amtsgericht": "Amtsgericht Hannover",
      "registernummer": "HRA 206568",
      "registerart": "HRA",
      "company_name": "Judith Menkens e.K.",
      "company_seat": "Hannover",
      "details": "27.06.2025 (Bekanntmachungsdatum)\n\nNiedersachsen Amtsgericht Hannover HRA 206568\nRegisterbekanntmachung nach dem Umwandlungsgesetz 27.06.2025 (Eintragungsdatum)\n\nJudith Menkens e.K.\nEinzelkaufmann / Einzelkauffrau\nHannover\n\nDen Gläubigern der an der Ausgliederung beteiligten Rechtsträger ist, wenn sie binnen sechs Monaten nach dem Tag, an dem die Eintragung der Ausgliederung in das Register des Sitzes desjenigen Rechtsträgers, dessen Gläubiger sie sind, nach § 19 Abs. 3 UmwG als bekannt gemacht gilt, ihren Anspruch nach Grund und Höhe schriftlich anmelden, Sicherheit zu leisten, soweit sie nicht Befriedigung verlangen können. Dieses Recht steht den Gläubigern jedoch nur zu, wenn sie glaubhaft machen, dass durch die Ausgliederung die Erfüllung der Forderung gefährdet wird."
    },
    {
      "date": "2025-06-27",
      "id": "113721",
      "original_text": "Löschungsankündigung\nBremen Amtsgericht Bremen HRB 34388\nZEABORN Ship Management Verwaltungs GmbH – Bremen",
      "type": "Löschungsankündigung",
      "state": "Bremen",
      "amtsgericht": "Amtsgericht Bremen",
      "registernummer": "HRB 34388",
      "registerart": "HRB",
      "company_name": "ZEABORN Ship Management Verwaltungs GmbH",
      "company_seat": "Bremen",
      "details": "27.06.2025 (Bekanntmachungsdatum)\n\nBremen Amtsgericht Bremen HRB 34388\nLöschungsankündigung\n\nZEABORN Ship Management Verwaltungs GmbH\nGesellschaft mit beschränkter Haftung\nBremen\n\nEs ist beabsichtigt die im Handelsregister eingetragene Gesellschaft von Amts wegen gemäß § 394 FamFG zu löschen. Gegen die Löschung kann beim AG Bremen schriftlich oder zu Protokoll der Geschäftsstelle Widerspruch eingelegt werden. Widerspruchsfrist 4 Wochen."
    },
    {
      "date": "2025-06-27",
      "id": "113722",
      "original_text": "Registerbekanntmachung nach dem Umwandlungsgesetz\nRheinland-Pfalz Amtsgericht Ludwigshafen a.Rhein (Ludwigshafen) HRA 62381\nMartin Volk e.K. – Schifferstadt",
      "type": "Registerbekanntmachung nach dem Umwandlungsgesetz",
      "state": "Rheinland-Pfalz",
      "amtsgericht": "Amtsgericht Ludwigshafen a.Rhein (Ludwigshafen)",
      "registernummer": "HRA 62381",
      "registerart": "HRA",
      "company_name": "Martin Volk e.K.",
      "company_seat": "Schifferstadt",
      "details": "27.06.2025 (Bekanntmachungsdatum)\n\nRheinland-Pfalz Amtsgericht Ludwigshafen a.Rhein (Ludwigshafen) HRA 62381\nRegisterbekanntmachung nach dem Umwandlungsgesetz 27.06.2025 (Eintragungsdatum)\n\nMartin Volk e.K.\nEinzelkaufmann / Einzelkauffrau\nSchifferstadt\n\nAls nicht eingetragen wird veröffentlicht: Den Gläubigern der an der Ausgliederung beteiligten Rechtsträger ist, wenn sie binnen sechs Monaten nach dem Tag, an dem die Eintragung der Ausgliederung in das Register des Sitzes desjenigen Rechtsträgers,dessen Gläubiger sie sind, nach § 19 Abs. 3 UmwG als bekannt gemacht gilt, ihren Anspruch nach Grund und Höhe schriftlich anmelden, Sicherheit zu leisten, soweit sie nicht Befriedigung verlangen können. Dieses Recht steht den Gläubigern jedoch nur zu, wenn sie glaubhaft machen, dass durch die Ausgliederung die Erfüllung der Forderung gefährdet wird."
    },
    {
      "date": "2025-06-27",
      "id": "113723",
      "original_text": "Einreichung neuer Dokumente\nRheinland-Pfalz Amtsgericht Wittlich HRB 3970\nTrägergesellschaft Bistum Trier TBT m.b.H. – Trier",
      "type": "Einreichung neuer Dokumente",
      "state": "Rheinland-Pfalz",
      "amtsgericht": "Amtsgericht Wittlich",
      "registernummer": "HRB 3970",
      "registerart": "HRB",
      "company_name": "Trägergesellschaft Bistum Trier TBT m.b.H.",
      "company_seat": "Trier",
      "details": "27.06.2025 (Bekanntmachungsdatum)\n\nRheinland-Pfalz Amtsgericht Wittlich HRB 3970\nEinreichung neuer Dokumente 27.06.2025 (Eintragungsdatum)\n\nTrägergesellschaft Bistum Trier TBT m.b.H.\nGesellschaft mit beschränkter Haftung\nTrier\n\nDem Registergericht ist eine neue Liste der Mitglieder des Aufsichtsrates eingereicht worden."
    },
    {
      "date": "2025-06-27",
      "id": "113724",
      "original_text": "Registerbekanntmachung nach dem Umwandlungsgesetz\nRheinland-Pfalz Amtsgericht Mainz HRB 48720\nBioNTech SE – Mainz",
      "type": "Registerbekanntmachung nach dem Umwandlungsgesetz",
      "state": "Rheinland-Pfalz",
      "amtsgericht": "Amtsgericht Mainz",
      "registernummer": "HRB 48720",
      "registerart": "HRB",
      "company_name": "BioNTech SE",
      "company_seat": "Mainz",
      "details": "27.06.2025 (Bekanntmachungsdatum)\n\nRheinland-Pfalz Amtsgericht Mainz HRB 48720\nRegisterbekanntmachung nach dem Umwandlungsgesetz\n\nBioNTech SE\nEuropäische Aktiengesellschaft (SE)\nMainz\n\nDem Registergericht ist ein Vertrag über die geplante Verschmelzung der BioNTech Individualized mRNA Manufacturing GmbH, Mainz, Amtsgericht Mainz HRB 51925, mit der BioNTech SE, Mainz, Amtsgericht Mainz HRB 48720, eingereicht worden."
    },
    {
      "date": "2025-06-27",
      "id": "113725",
      "original_text": "Registerbekanntmachung nach dem Umwandlungsgesetz\nRheinland-Pfalz Amtsgericht Ludwigshafen a.Rhein (Ludwigshafen) HRB 70166\nIMMOMESS GmbH – Schifferstadt",
      "type": "Registerbekanntmachung nach dem Umwandlungsgesetz",
      "state": "Rheinland-Pfalz",
      "amtsgericht": "Amtsgericht Ludwigshafen a.Rhein (Ludwigshafen)",
      "registernummer": "HRB 70166",
      "registerart": "HRB",
      "company_name": "IMMOMESS GmbH",
      "company_seat": "Schifferstadt",
      "details": "27.06.2025 (Bekanntmachungsdatum)\n\nRheinland-Pfalz Amtsgericht Ludwigshafen a.Rhein (Ludwigshafen) HRB 70166\nRegisterbekanntmachung nach dem Umwandlungsgesetz 27.06.2025 (Eintragungsdatum)\n\nIMMOMESS GmbH\nGesellschaft mit beschränkter Haftung\nSchifferstadt\n\nAls nicht eingetragen wird veröffentlicht: Den Gläubigern der an der Ausgliederung beteiligten Rechtsträger ist, wenn sie binnen sechs Monaten nach dem Tag, an dem die Eintragung der Ausgliederung in das Register des Sitzes desjenigen Rechtsträgers, dessen Gläubiger sie sind, nach § 19 Abs. 3 UmwG als bekannt gemacht gilt, ihren Anspruch nach Grund und Höhe schriftlich anmelden, Sicherheit zu leisten, soweit sie nicht Befriedigung verlangen können. Dieses Recht steht den Gläubigern jedoch nur zu, wenn sie glaubhaft machen, dass durch die Ausgliederung die Erfüllung der Forderung gefährdet wird."
    },
    {
      "date": "2025-06-27",
      "id": "113726",
      "original_text": "Einreichung neuer Dokumente\nNordrhein-Westfalen Amtsgericht Arnsberg HRB 2366\nburgbad Aktiengesellschaft – Schmallenberg",
      "type": "Einreichung neuer Dokumente",
      "state": "Nordrhein-Westfalen",
      "amtsgericht": "Amtsgericht Arnsberg",
      "registernummer": "HRB 2366",
      "registerart": "HRB",
      "company_name": "burgbad Aktiengesellschaft",
      "company_seat": "Schmallenberg",
      "details": "27.06.2025 (Bekanntmachungsdatum)\n\nNordrhein-Westfalen Amtsgericht Arnsberg HRB 2366\nEinreichung neuer Dokumente 27.06.2025 (Eintragungsdatum)\n\nburgbad Aktiengesellschaft\nAktiengesellschaft\nSchmallenberg\n\nDem Registergericht ist eine neue Liste der Mitglieder des Aufsichtsrates eingereicht worden."
    },
    {
      "date": "2025-06-27",
      "id": "113727",
      "original_text": "Löschungsankündigung\nNordrhein-Westfalen Amtsgericht Düren HRA 3543\nPing Rong e.Kfr. – Düren",
      "type": "Löschungsankündigung",
      "state": "Nordrhein-Westfalen",
      "amtsgericht": "Amtsgericht Düren",
      "registernummer": "HRA 3543",
      "registerart": "HRA",
      "company_name": "Ping Rong e.Kfr.",
      "company_seat": "Düren",
      "details": "27.06.2025 (Bekanntmachungsdatum)\n\nNordrhein-Westfalen Amtsgericht Düren HRA 3543\nLöschungsankündigung 27.06.2025 (Eintragungsdatum)\n\nPing Rong e.Kfr.\nEinzelkaufmann / Einzelkauffrau\nDüren\n\nDas Registergericht beabsichtigt die Firma von Amts wegen nach § 31 Abs. 2 HGB, § 393 FamFG zu löschen. Die Frist zur Erhebung eines Widerspruchs ist auf einen Monat festgesetzt."
    },
    {
      "date": "2025-06-27",
      "id": "113728",
      "original_text": "Registerbekanntmachung nach dem Umwandlungsgesetz\nNordrhein-Westfalen Amtsgericht Köln HRB 103731\nAlpha Industrial Equipment GmbH – Bergheim",
      "type": "Registerbekanntmachung nach dem Umwandlungsgesetz",
      "state": "Nordrhein-Westfalen",
      "amtsgericht": "Amtsgericht Köln",
      "registernummer": "HRB 103731",
      "registerart": "HRB",
      "company_name": "Alpha Industrial Equipment GmbH",
      "company_seat": "Bergheim",
      "details": "27.06.2025 (Bekanntmachungsdatum)\n\nNordrhein-Westfalen Amtsgericht Köln HRB 103731\nRegisterbekanntmachung nach dem Umwandlungsgesetz 27.06.2025 (Eintragungsdatum)\n\nAlpha Industrial Equipment GmbH\nGesellschaft mit beschränkter Haftung\nBergheim\n\nDen Gläubigern der an der Verschmelzung beteiligten Rechtsträger ist, wenn sie binnen sechs Monaten nach dem Tag, an dem die Eintragung der Verschmelzung in das Register des Sitzes desjenigen Rechtsträgers, dessen Gläubiger sie sind, nach § 19 Absatz 3 UmwG als bekanntgemacht gilt, ihren Anspruch nach Grund und Höhe schriftlich anmelden, Sicherheit zu leisten, soweit sie nicht Befriedigung verlangen können. Dieses Recht steht den Gläubigern jedoch nur zu, wenn sie glaubhaft machen, dass durch die Verschmelzung die Erfüllung ihrer Forderung gefährdet wird."
    },
    {
      "date": "2025-06-27",
      "id": "113729",
      "original_text": "Registerbekanntmachung nach dem Umwandlungsgesetz\nNordrhein-Westfalen Amtsgericht Paderborn HRB 10533\nSIL System Integration Laboratory GmbH – Paderborn",
      "type": "Registerbekanntmachung nach dem Umwandlungsgesetz",
      "state": "Nordrhein-Westfalen",
      "amtsgericht": "Amtsgericht Paderborn",
      "registernummer": "HRB 10533",
      "registerart": "HRB",
      "company_name": "SIL System Integration Laboratory GmbH",
      "company_seat": "Paderborn",
      "details": "27.06.2025 (Bekanntmachungsdatum)\n\nNordrhein-Westfalen Amtsgericht Paderborn HRB 10533\nRegisterbekanntmachung nach dem Umwandlungsgesetz 27.06.2025 (Eintragungsdatum)\n\nSIL System Integration Laboratory GmbH\nGesellschaft mit beschränkter Haftung\nPaderborn\n\nDen Gläubigern der an der Verschmelzung beteiligten Rechtsträger ist, wenn sie binnen sechs Monaten nach dem Tag, an dem die Eintragung der Verschmelzung in das Register des Sitzes desjenigen Rechtsträgers, dessen Gläubiger sie sind, nach § 19 Absatz 3 UmwG als bekanntgemacht gilt, ihren Anspruch nach Grund und Höhe schriftlich anmelden, Sicherheit zu leisten, soweit sie nicht Befriedigung verlangen können. Dieses Recht steht den Gläubigern jedoch nur zu, wenn sie glaubhaft machen, dass durch die Verschmelzung die Erfüllung ihrer Forderung gefährdet wird."
    },
    {
      "date": "2025-06-27",
      "id": "113730",
      "original_text": "Löschungsankündigung\nNordrhein-Westfalen Amtsgericht Bonn HRB 21453\nPohl Service GmbH – Bonn",
      "type": "Löschungsankündigung",
      "state": "Nordrhein-Westfalen",
      "amtsgericht": "Amtsgericht Bonn",
      "registernummer": "HRB 21453",
      "registerart": "HRB",
      "company_name": "Pohl Service GmbH",
      "company_seat": "Bonn",
      "details": "27.06.2025 (Bekanntmachungsdatum)\n\nNordrhein-Westfalen Amtsgericht Bonn HRB 21453\nLöschungsankündigung\n\nPohl Service GmbH\nGesellschaft mit beschränkter Haftung\nBonn\n\nDas Registergericht beabsichtigt die Gesellschaft von Amts wegen nach § 394 FamFG zu löschen. Die Frist zur Erhebung eines Widerspruchs ist auf einen Monat festgesetzt."
    },
    {
      "date": "2025-06-27",
      "id": "113731",
      "original_text": "Löschungsankündigung\nNordrhein-Westfalen Amtsgericht Wuppertal HRB 23920\nBR. Mannesmann System + Service GmbH – Remscheid",
      "type": "Löschungsankündigung",
      "state": "Nordrhein-Westfalen",
      "amtsgericht": "Amtsgericht Wuppertal",
      "registernummer": "HRB 23920",
      "registerart": "HRB",
      "company_name": "BR. Mannesmann System + Service GmbH",
      "company_seat": "Remscheid",
      "details": "27.06.2025 (Bekanntmachungsdatum)\n\nNordrhein-Westfalen Amtsgericht Wuppertal HRB 23920\nLöschungsankündigung\n\nBR. Mannesmann System + Service GmbH\nGesellschaft mit beschränkter Haftung\nRemscheid\n\nDas Registergericht beabsichtigt die Gesellschaft von Amts wegen nach § 394 FamFG zu löschen. Die Frist zur Erhebung eines Widerspruchs ist auf einen Monat festgesetzt."
    },
    {
      "date": "2025-06-27",
      "id": "113732",
      "original_text": "Registerbekanntmachung nach dem Umwandlungsgesetz\nNordrhein-Westfalen Amtsgericht Mönchengladbach HRB 6281\nMONKDATA GmbH – Wegberg",
      "type": "Registerbekanntmachung nach dem Umwandlungsgesetz",
      "state": "Nordrhein-Westfalen",
      "amtsgericht": "Amtsgericht Mönchengladbach",
      "registernummer": "HRB 6281",
      "registerart": "HRB",
      "company_name": "MONKDATA GmbH",
      "company_seat": "Wegberg",
      "details": "27.06.2025 (Bekanntmachungsdatum)\n\nNordrhein-Westfalen Amtsgericht Mönchengladbach HRB 6281\nRegisterbekanntmachung nach dem Umwandlungsgesetz 27.06.2025 (Eintragungsdatum)\n\nMONKDATA GmbH\nGesellschaft mit beschränkter Haftung\nWegberg\n\nDen Gläubigern der an der Verschmelzung beteiligten Rechtsträger ist, wenn sie binnen sechs Monaten nach dem Tag, an dem die Eintragung der Verschmelzung in das Register des Sitzes desjenigen Rechtsträgers, dessen Gläubiger sie sind, nach § 19 Absatz 3 UmwG als bekanntgemacht gilt, ihren Anspruch nach Grund und Höhe schriftlich anmelden, Sicherheit zu leisten, soweit sie nicht Befriedigung verlangen können. Dieses Recht steht den Gläubigern jedoch nur zu, wenn sie glaubhaft machen, dass durch die Verschmelzung die Erfüllung ihrer Forderung gefährdet wird."
    },
    {
      "date": "2025-06-27",
      "id": "113733",
      "original_text": "Registerbekanntmachung nach dem Umwandlungsgesetz\nNordrhein-Westfalen Amtsgericht Mönchengladbach HRB 15816\nStesys System Consulting GmbH – Wegberg",
      "type": "Registerbekanntmachung nach dem Umwandlungsgesetz",
      "state": "Nordrhein-Westfalen",
      "amtsgericht": "Amtsgericht Mönchengladbach",
      "registernummer": "HRB 15816",
      "registerart": "HRB",
      "company_name": "Stesys System Consulting GmbH",
      "company_seat": "Wegberg",
      "details": "27.06.2025 (Bekanntmachungsdatum)\n\nNordrhein-Westfalen Amtsgericht Mönchengladbach HRB 15816\nRegisterbekanntmachung nach dem Umwandlungsgesetz 27.06.2025 (Eintragungsdatum)\n\nStesys System Consulting GmbH\nGesellschaft mit beschränkter Haftung\nWegberg\n\nDen Gläubigern der an der Verschmelzung beteiligten Rechtsträger ist, wenn sie binnen sechs Monaten nach dem Tag, an dem die Eintragung der Verschmelzung in das Register des Sitzes desjenigen Rechtsträgers, dessen Gläubiger sie sind, nach § 19 Absatz 3 UmwG als bekanntgemacht gilt, ihren Anspruch nach Grund und Höhe schriftlich anmelden, Sicherheit zu leisten, soweit sie nicht Befriedigung verlangen können. Dieses Recht steht den Gläubigern jedoch nur zu, wenn sie glaubhaft machen, dass durch die Verschmelzung die Erfüllung ihrer Forderung gefährdet wird."
    },
    {
      "date": "2025-06-27",
      "id": "113734",
      "original_text": "Löschungsankündigung\nNordrhein-Westfalen Amtsgericht Dortmund HRB 32168\nCPM - Construction & Project Management UG (haftungsbeschränkt) – Dortmund",
      "type": "Löschungsankündigung",
      "state": "Nordrhein-Westfalen",
      "amtsgericht": "Amtsgericht Dortmund",
      "registernummer": "HRB 32168",
      "registerart": "HRB",
      "company_name": "CPM - Construction & Project Management UG (haftungsbeschränkt)",
      "company_seat": "Dortmund",
      "details": "27.06.2025 (Bekanntmachungsdatum)\n\nNordrhein-Westfalen Amtsgericht Dortmund HRB 32168\nLöschungsankündigung 27.06.2025 (Eintragungsdatum)\n\nCPM - Construction & Project Management UG (haftungsbeschränkt)\nGesellschaft mit beschränkter Haftung\nDortmund"
    },
    {
      "date": "2025-06-27",
      "id": "113735",
      "original_text": "Registerbekanntmachung nach dem Umwandlungsgesetz\nNordrhein-Westfalen Amtsgericht Bad Oeynhausen HRB 15477\nHISB Betreuungsdienst Halle Herford GmbH – Herford",
      "type": "Registerbekanntmachung nach dem Umwandlungsgesetz",
      "state": "Nordrhein-Westfalen",
      "amtsgericht": "Amtsgericht Bad Oeynhausen",
      "registernummer": "HRB 15477",
      "registerart": "HRB",
      "company_name": "HISB Betreuungsdienst Halle Herford GmbH",
      "company_seat": "Herford",
      "details": "27.06.2025 (Bekanntmachungsdatum)\n\nNordrhein-Westfalen Amtsgericht Bad Oeynhausen HRB 15477\nRegisterbekanntmachung nach dem Umwandlungsgesetz 27.06.2025 (Eintragungsdatum)\n\nHISB Betreuungsdienst Halle Herford GmbH\nGesellschaft mit beschränkter Haftung\nHerford\n\nDen Gläubigern der an der Verschmelzung beteiligten Rechtsträger ist, wenn sie binnen sechs Monaten nach dem Tag, an dem die Eintragung der Verschmelzung in das Register des Sitzes desjenigen Rechtsträgers, dessen Gläubiger sie sind, nach § 19 Absatz 3 UmwG als bekanntgemacht gilt, ihren Anspruch nach Grund und Höhe schriftlich anmelden, Sicherheit zu leisten, soweit sie nicht Befriedigung verlangen können. Dieses Recht steht den Gläubigern jedoch nur zu, wenn sie glaubhaft machen, dass durch die Verschmelzung die Erfüllung ihrer Forderung gefährdet wird."
    },
    {
      "date": "2025-06-27",
      "id": "113736",
      "original_text": "Registerbekanntmachung nach dem Umwandlungsgesetz\nNordrhein-Westfalen Amtsgericht Köln HRB 37013\nBechtle GmbH – Köln",
      "type": "Registerbekanntmachung nach dem Umwandlungsgesetz",
      "state": "Nordrhein-Westfalen",
      "amtsgericht": "Amtsgericht Köln",
      "registernummer": "HRB 37013",
      "registerart": "HRB",
      "company_name": "Bechtle GmbH",
      "company_seat": "Köln",
      "details": "27.06.2025 (Bekanntmachungsdatum)\n\nNordrhein-Westfalen Amtsgericht Köln HRB 37013\nRegisterbekanntmachung nach dem Umwandlungsgesetz 27.06.2025 (Eintragungsdatum)\n\nBechtle GmbH\nGesellschaft mit beschränkter Haftung\nKöln\n\nDen Gläubigern der an der Verschmelzung beteiligten Rechtsträger ist, wenn sie binnen sechs Monaten nach dem Tag, an dem die Eintragung der Verschmelzung in das Register des Sitzes desjenigen Rechtsträgers, dessen Gläubiger sie sind, nach § 19 Absatz 3 UmwG als bekanntgemacht gilt, ihren Anspruch nach Grund und Höhe schriftlich anmelden, Sicherheit zu leisten, soweit sie nicht Befriedigung verlangen können. Dieses Recht steht den Gläubigern jedoch nur zu, wenn sie glaubhaft machen, dass durch die Verschmelzung die Erfüllung ihrer Forderung gefährdet wird."
    },
    {
      "date": "2025-06-27",
      "id": "113737",
      "original_text": "Registerbekanntmachung nach dem Umwandlungsgesetz\nNordrhein-Westfalen Amtsgericht Bielefeld HRB 40772\nMIG Management GmbH – Schloß Holte-Stukenbrock",
      "type": "Registerbekanntmachung nach dem Umwandlungsgesetz",
      "state": "Nordrhein-Westfalen",
      "amtsgericht": "Amtsgericht Bielefeld",
      "registernummer": "HRB 40772",
      "registerart": "HRB",
      "company_name": "MIG Management GmbH",
      "company_seat": "Schloß Holte-Stukenbrock",
      "details": "27.06.2025 (Bekanntmachungsdatum)\n\nNordrhein-Westfalen Amtsgericht Bielefeld HRB 40772\nRegisterbekanntmachung nach dem Umwandlungsgesetz 27.06.2025 (Eintragungsdatum)\n\nMIG Management GmbH\nGesellschaft mit beschränkter Haftung\nSchloß Holte-Stukenbrock\n\nDen Gläubigern der an der Verschmelzung beteiligten Rechtsträger ist, wenn sie binnen sechs Monaten nach dem Tag, an dem die Eintragung der Verschmelzung in das Register des Sitzes desjenigen Rechtsträgers, dessen Gläubiger sie sind, nach § 19 Absatz 3 UmwG als bekanntgemacht gilt, ihren Anspruch nach Grund und Höhe schriftlich anmelden, Sicherheit zu leisten, soweit sie nicht Befriedigung verlangen können. Dieses Recht steht den Gläubigern jedoch nur zu, wenn sie glaubhaft machen, dass durch die Verschmelzung die Erfüllung ihrer Forderung gefährdet wird."
    },
    {
      "date": "2025-06-27",
      "id": "113738",
      "original_text": "Einreichung neuer Dokumente\nNordrhein-Westfalen Amtsgericht Essen HRB 33988\nMemoro AG – Essen",
      "type": "Einreichung neuer Dokumente",
      "state": "Nordrhein-Westfalen",
      "amtsgericht": "Amtsgericht Essen",
      "registernummer": "HRB 33988",
      "registerart": "HRB",
      "company_name": "Memoro AG",
      "company_seat": "Essen",
      "details": "27.06.2025 (Bekanntmachungsdatum)\n\nNordrhein-Westfalen Amtsgericht Essen HRB 33988\nEinreichung neuer Dokumente\n\nMemoro AG\nAktiengesellschaft\nEssen\n\nDem Registergericht ist eine neue Liste der Mitglieder des Aufsichtsrates eingereicht worden."
    },
    {
      "date": "2025-06-27",
      "id": "113739",
      "original_text": "Registerbekanntmachung nach dem Umwandlungsgesetz\nNordrhein-Westfalen Amtsgericht Gütersloh HRB 3302\nAutohaus Markötter GmbH – Gütersloh",
      "type": "Registerbekanntmachung nach dem Umwandlungsgesetz",
      "state": "Nordrhein-Westfalen",
      "amtsgericht": "Amtsgericht Gütersloh",
      "registernummer": "HRB 3302",
      "registerart": "HRB",
      "company_name": "Autohaus Markötter GmbH",
      "company_seat": "Gütersloh",
      "details": "27.06.2025 (Bekanntmachungsdatum)\n\nNordrhein-Westfalen Amtsgericht Gütersloh HRB 3302\nRegisterbekanntmachung nach dem Umwandlungsgesetz 27.06.2025 (Eintragungsdatum)\n\nAutohaus Markötter GmbH\nGesellschaft mit beschränkter Haftung\nGütersloh\n\nDen Gläubigern der an der Verschmelzung beteiligten Rechtsträger ist, wenn sie binnen sechs Monaten nach dem Tag, an dem die Eintragung der Verschmelzung in das Register des Sitzes desjenigen Rechtsträgers, dessen Gläubiger sie sind, nach § 19 Absatz 3 UmwG als bekanntgemacht gilt, ihren Anspruch nach Grund und Höhe schriftlich anmelden, Sicherheit zu leisten, soweit sie nicht Befriedigung verlangen können. Dieses Recht steht den Gläubigern jedoch nur zu, wenn sie glaubhaft machen, dass durch die Verschmelzung die Erfüllung ihrer Forderung gefährdet wird."
    },
    {
      "date": "2025-06-27",
      "id": "113740",
      "original_text": "Löschungsankündigung\nNordrhein-Westfalen Amtsgericht Mönchengladbach HRA 7363\nLockhütter KG – Viersen",
      "type": "Löschungsankündigung",
      "state": "Nordrhein-Westfalen",
      "amtsgericht": "Amtsgericht Mönchengladbach",
      "registernummer": "HRA 7363",
      "registerart": "HRA",
      "company_name": "Lockhütter KG",
      "company_seat": "Viersen",
      "details": "27.06.2025 (Bekanntmachungsdatum)\n\nNordrhein-Westfalen Amtsgericht Mönchengladbach HRA 7363\nLöschungsankündigung\n\nLockhütter KG\nKommanditgesellschaft\nViersen\n\nIn der Handelsregistersache Lockhütter KG, Viersen (Amtsgericht Mönchengladbach, HRA 7363) beabsichtigt das Registergericht, die Gesellschaft von Amts wegen aus dem Handelsregister zu löschen, da keine Anhaltspunkte vorhanden sind, dass die Gesellschaft nach dem Ende des Insolvenzverfahrens kein Vermögen mehr hat, § 394 Abs. 1, 3 FamFG. .\nEs wird hiermit eine Frist von 3 Monaten eingeräumt, um einen Widerspruch gegen die beabsichtigte Löschung geltend zu machen."
    },
    {
      "date": "2025-06-27",
      "id": "113741",
      "original_text": "Löschungsankündigung\nNordrhein-Westfalen Amtsgericht Lemgo HRB 3539\nReker Packaging Systems GmbH – Lage",
      "type": "Löschungsankündigung",
      "state": "Nordrhein-Westfalen",
      "amtsgericht": "Amtsgericht Lemgo",
      "registernummer": "HRB 3539",
      "registerart": "HRB",
      "company_name": "Reker Packaging Systems GmbH",
      "company_seat": "Lage",
      "details": "27.06.2025 (Bekanntmachungsdatum)\n\nNordrhein-Westfalen Amtsgericht Lemgo HRB 3539\nLöschungsankündigung 27.06.2025 (Eintragungsdatum)\n\nReker Packaging Systems GmbH\nGesellschaft mit beschränkter Haftung\nLage\n\nEs ist beabsichtigt, die Eintragung des Geschäftsführers gemäß § 395 Abs. 1 FamFG zu löschen. Hiergegen kann binnen 3 Monaten nach Veröffentlichung dieser Bekanntmachung Widerspruch beim Amtsgericht Lemgo eingelegt werden."
    },
    {
      "date": "2025-06-27",
      "id": "113742",
      "original_text": "Löschungsankündigung\nNordrhein-Westfalen Amtsgericht Dortmund HRB 33581\nGERMAN FINANCIAL HOLDING INC. – Dortmund",
      "type": "Löschungsankündigung",
      "state": "Nordrhein-Westfalen",
      "amtsgericht": "Amtsgericht Dortmund",
      "registernummer": "HRB 33581",
      "registerart": "HRB",
      "company_name": "GERMAN FINANCIAL HOLDING INC.",
      "company_seat": "Dortmund",
      "details": "27.06.2025 (Bekanntmachungsdatum)\n\nNordrhein-Westfalen Amtsgericht Dortmund HRB 33581\nLöschungsankündigung\n\nGERMAN FINANCIAL HOLDING INC.\nRechtsform ausländischen Rechts HRB\nDortmund\n\nDas Registergericht beabsichtigt die Zweigniederlassung nach § 395 FamFG zu löschen, weil eine Zweigniederlassung unter der eingetragenen Geschäftsanschrift nicht mehr unterhalten wird. Die Frist zur Erhebung eines Widerspruchs ist auf zwei Monate festgesetzt."
    },
    {
      "date": "2025-06-27",
      "id": "113743",
      "original_text": "Registerbekanntmachung nach dem Umwandlungsgesetz\nNordrhein-Westfalen Amtsgericht Aachen HRB 20156\nBetreuung & Alltagsbegleitung AT GmbH – Heinsberg",
      "type": "Registerbekanntmachung nach dem Umwandlungsgesetz",
      "state": "Nordrhein-Westfalen",
      "amtsgericht": "Amtsgericht Aachen",
      "registernummer": "HRB 20156",
      "registerart": "HRB",
      "company_name": "Betreuung & Alltagsbegleitung AT GmbH",
      "company_seat": "Heinsberg",
      "details": "27.06.2025 (Bekanntmachungsdatum)\n\nNordrhein-Westfalen Amtsgericht Aachen HRB 20156\nRegisterbekanntmachung nach dem Umwandlungsgesetz 27.06.2025 (Eintragungsdatum)\n\nBetreuung & Alltagsbegleitung AT GmbH\nGesellschaft mit beschränkter Haftung\nHeinsberg\n\nDen Gläubigern der an der Verschmelzung beteiligten Rechtsträger ist, wenn sie binnen sechs Monaten nach dem Tag, an dem die Eintragung der Verschmelzung in das Register des Sitzes desjenigen Rechtsträgers, dessen Gläubiger sie sind, nach § 19 Absatz 3 UmwG als bekanntgemacht gilt, ihren Anspruch nach Grund und Höhe schriftlich anmelden, Sicherheit zu leisten, soweit sie nicht Befriedigung verlangen können. Dieses Recht steht den Gläubigern jedoch nur zu, wenn sie glaubhaft machen, dass durch die Verschmelzung die Erfüllung ihrer Forderung gefährdet wird."
    },
    {
      "date": "2025-06-27",
      "id": "113744",
      "original_text": "Registerbekanntmachung nach dem Umwandlungsgesetz\nNordrhein-Westfalen Amtsgericht Neuss HRB 19250\nwearTell Deutschland GmbH – Kaarst",
      "type": "Registerbekanntmachung nach dem Umwandlungsgesetz",
      "state": "Nordrhein-Westfalen",
      "amtsgericht": "Amtsgericht Neuss",
      "registernummer": "HRB 19250",
      "registerart": "HRB",
      "company_name": "wearTell Deutschland GmbH",
      "company_seat": "Kaarst",
      "details": "27.06.2025 (Bekanntmachungsdatum)\n\nNordrhein-Westfalen Amtsgericht Neuss HRB 19250\nRegisterbekanntmachung nach dem Umwandlungsgesetz 27.06.2025 (Eintragungsdatum)\n\nwearTell Deutschland GmbH\nGesellschaft mit beschränkter Haftung\nKaarst\n\nDen Gläubigern der an der Verschmelzung beteiligten Rechtsträger ist, wenn sie binnen sechs Monaten nach dem Tag, an dem die Eintragung der Verschmelzung in das Register des Sitzes desjenigen Rechtsträgers, dessen Gläubiger sie sind, nach § 19 Absatz 3 UmwG als bekanntgemacht gilt, ihren Anspruch nach Grund und Höhe schriftlich anmelden, Sicherheit zu leisten, soweit sie nicht Befriedigung verlangen können. Dieses Recht steht den Gläubigern jedoch nur zu, wenn sie glaubhaft machen, dass durch die Verschmelzung die Erfüllung ihrer Forderung gefährdet wird."
    },
    {
      "date": "2025-06-27",
      "id": "113745",
      "original_text": "Löschungsankündigung\nNordrhein-Westfalen Amtsgericht Kleve HRB 16307\nCOMFORTPARCS GmbH – Kleve",
      "type": "Löschungsankündigung",
      "state": "Nordrhein-Westfalen",
      "amtsgericht": "Amtsgericht Kleve",
      "registernummer": "HRB 16307",
      "registerart": "HRB",
      "company_name": "COMFORTPARCS GmbH",
      "company_seat": "Kleve",
      "details": "27.06.2025 (Bekanntmachungsdatum)\n\nNordrhein-Westfalen Amtsgericht Kleve HRB 16307\nLöschungsankündigung\n\nCOMFORTPARCS GmbH\nGesellschaft mit beschränkter Haftung\nKleve\n\nDas Registergericht beabsichtigt die Gesellschaft von Amts wegen nach § 394 FamFG zu löschen. Die Frist zur Erhebung eines Widerspruchs ist auf einen Monat festgesetzt."
    },
    {
      "date": "2025-06-27",
      "id": "113746",
      "original_text": "Löschungsankündigung\nNordrhein-Westfalen Amtsgericht Wuppertal HRB 16540\nTREND Personal- und Dienstleistungen Solingen GmbH – Solingen",
      "type": "Löschungsankündigung",
      "state": "Nordrhein-Westfalen",
      "amtsgericht": "Amtsgericht Wuppertal",
      "registernummer": "HRB 16540",
      "registerart": "HRB",
      "company_name": "TREND Personal- und Dienstleistungen Solingen GmbH",
      "company_seat": "Solingen",
      "details": "27.06.2025 (Bekanntmachungsdatum)\n\nNordrhein-Westfalen Amtsgericht Wuppertal HRB 16540\nLöschungsankündigung\n\nTREND  Personal- und Dienstleistungen Solingen GmbH\nGesellschaft mit beschränkter Haftung\nSolingen\n\nDas Registergericht beabsichtigt die Gesellschaft von Amts wegen nach § 394 FamFG zu löschen. Die Frist zur Erhebung eines Widerspruchs ist auf einen Monat festgesetzt."
    },
    {
      "date": "2025-06-27",
      "id": "113747",
      "original_text": "Registerbekanntmachung nach dem Umwandlungsgesetz\nNordrhein-Westfalen Amtsgericht Mönchengladbach HRB 3437\nLennartz Reisen GmbH – Mönchengladbach",
      "type": "Registerbekanntmachung nach dem Umwandlungsgesetz",
      "state": "Nordrhein-Westfalen",
      "amtsgericht": "Amtsgericht Mönchengladbach",
      "registernummer": "HRB 3437",
      "registerart": "HRB",
      "company_name": "Lennartz Reisen GmbH",
      "company_seat": "Mönchengladbach",
      "details": "27.06.2025 (Bekanntmachungsdatum)\n\nNordrhein-Westfalen Amtsgericht Mönchengladbach HRB 3437\nRegisterbekanntmachung nach dem Umwandlungsgesetz 27.06.2025 (Eintragungsdatum)\n\nLennartz Reisen GmbH\nGesellschaft mit beschränkter Haftung\nMönchengladbach\n\nDen Gläubigern der an der Verschmelzung beteiligten Rechtsträger ist, wenn sie binnen sechs Monaten nach dem Tag, an dem die Eintragung der Verschmelzung in das Register des Sitzes desjenigen Rechtsträgers, dessen Gläubiger sie sind, nach § 19 Absatz 3 UmwG als bekanntgemacht gilt, ihren Anspruch nach Grund und Höhe schriftlich anmelden, Sicherheit zu leisten, soweit sie nicht Befriedigung verlangen können. Dieses Recht steht den Gläubigern jedoch nur zu, wenn sie glaubhaft machen, dass durch die Verschmelzung die Erfüllung ihrer Forderung gefährdet wird."
    },
    {
      "date": "2025-06-27",
      "id": "113748",
      "original_text": "Registerbekanntmachung nach dem Umwandlungsgesetz\nNordrhein-Westfalen Amtsgericht Mönchengladbach HRB 22340\nMIB Sales Stock UG (haftungsbeschränkt) – Viersen",
      "type": "Registerbekanntmachung nach dem Umwandlungsgesetz",
      "state": "Nordrhein-Westfalen",
      "amtsgericht": "Amtsgericht Mönchengladbach",
      "registernummer": "HRB 22340",
      "registerart": "HRB",
      "company_name": "MIB Sales Stock UG (haftungsbeschränkt)",
      "company_seat": "Viersen",
      "details": "27.06.2025 (Bekanntmachungsdatum)\n\nNordrhein-Westfalen Amtsgericht Mönchengladbach HRB 22340\nRegisterbekanntmachung nach dem Umwandlungsgesetz 27.06.2025 (Eintragungsdatum)\n\nMIB Sales Stock UG (haftungsbeschränkt)\nGesellschaft mit beschränkter Haftung\nViersen\n\nDen Gläubigern der an der Verschmelzung beteiligten Rechtsträger ist, wenn sie binnen sechs Monaten nach dem Tag, an dem die Eintragung der Verschmelzung in das Register des Sitzes desjenigen Rechtsträgers, dessen Gläubiger sie sind, nach § 19 Absatz 3 UmwG als bekanntgemacht gilt, ihren Anspruch nach Grund und Höhe schriftlich anmelden, Sicherheit zu leisten, soweit sie nicht Befriedigung verlangen können. Dieses Recht steht den Gläubigern jedoch nur zu, wenn sie glaubhaft machen, dass durch die Verschmelzung die Erfüllung ihrer Forderung gefährdet wird."
    },
    {
      "date": "2025-06-27",
      "id": "113749",
      "original_text": "Einreichung neuer Dokumente\nNordrhein-Westfalen Amtsgericht Düsseldorf HRB 69112\nERGO Beratung und Vertrieb AG – Düsseldorf",
      "type": "Einreichung neuer Dokumente",
      "state": "Nordrhein-Westfalen",
      "amtsgericht": "Amtsgericht Düsseldorf",
      "registernummer": "HRB 69112",
      "registerart": "HRB",
      "company_name": "ERGO Beratung und Vertrieb AG",
      "company_seat": "Düsseldorf",
      "details": "27.06.2025 (Bekanntmachungsdatum)\n\nNordrhein-Westfalen Amtsgericht Düsseldorf HRB 69112\nEinreichung neuer Dokumente\n\nERGO Beratung und Vertrieb AG\nAktiengesellschaft\nDüsseldorf\n\nDem Registergericht ist eine neue Liste der Mitglieder des Aufsichtsrates eingereicht worden."
    },
    {
      "date": "2025-06-27",
      "id": "113750",
      "original_text": "Registerbekanntmachung nach dem Umwandlungsgesetz\nNordrhein-Westfalen Amtsgericht Köln HRB 108698\nAlpha Industrial Holding GmbH – Bergheim",
      "type": "Registerbekanntmachung nach dem Umwandlungsgesetz",
      "state": "Nordrhein-Westfalen",
      "amtsgericht": "Amtsgericht Köln",
      "registernummer": "HRB 108698",
      "registerart": "HRB",
      "company_name": "Alpha Industrial Holding GmbH",
      "company_seat": "Bergheim",
      "details": "27.06.2025 (Bekanntmachungsdatum)\n\nNordrhein-Westfalen Amtsgericht Köln HRB 108698\nRegisterbekanntmachung nach dem Umwandlungsgesetz 27.06.2025 (Eintragungsdatum)\n\nAlpha Industrial Holding GmbH\nGesellschaft mit beschränkter Haftung\nBergheim\n\nDen Gläubigern der an der Verschmelzung beteiligten Rechtsträger ist, wenn sie binnen sechs Monaten nach dem Tag, an dem die Eintragung der Verschmelzung in das Register des Sitzes desjenigen Rechtsträgers, dessen Gläubiger sie sind, nach § 19 Absatz 3 UmwG als bekanntgemacht gilt, ihren Anspruch nach Grund und Höhe schriftlich anmelden, Sicherheit zu leisten, soweit sie nicht Befriedigung verlangen können. Dieses Recht steht den Gläubigern jedoch nur zu, wenn sie glaubhaft machen, dass durch die Verschmelzung die Erfüllung ihrer Forderung gefährdet wird."
    },
    {
      "date": "2025-06-27",
      "id": "113751",
      "original_text": "Sonstige Registerbekanntmachung\nNordrhein-Westfalen Amtsgericht Recklinghausen HRB 3813\nZEDAL AG – Recklinghausen",
      "type": "Sonstige Registerbekanntmachung",
      "state": "Nordrhein-Westfalen",
      "amtsgericht": "Amtsgericht Recklinghausen",
      "registernummer": "HRB 3813",
      "registerart": "HRB",
      "company_name": "ZEDAL AG",
      "company_seat": "Recklinghausen",
      "details": "27.06.2025 (Bekanntmachungsdatum)\n\nNordrhein-Westfalen Amtsgericht Recklinghausen HRB 3813\nSonstige Registerbekanntmachung 27.06.2025 (Eintragungsdatum)\n\nZEDAL AG\nAktiengesellschaft\nRecklinghausen\n\nDem Registergericht ist eine neue Liste der Mitglieder des Aufsichtsrates eingereicht worden."
    },
    {
      "date": "2025-06-27",
      "id": "113752",
      "original_text": "Registerbekanntmachung nach dem Umwandlungsgesetz\nNordrhein-Westfalen Amtsgericht Köln HRA 32139\nPortfolio Kaiserslautern II GmbH & Co. KG – Köln",
      "type": "Registerbekanntmachung nach dem Umwandlungsgesetz",
      "state": "Nordrhein-Westfalen",
      "amtsgericht": "Amtsgericht Köln",
      "registernummer": "HRA 32139",
      "registerart": "HRA",
      "company_name": "Portfolio Kaiserslautern II GmbH & Co. KG",
      "company_seat": "Köln",
      "details": "27.06.2025 (Bekanntmachungsdatum)\n\nNordrhein-Westfalen Amtsgericht Köln HRA 32139\nRegisterbekanntmachung nach dem Umwandlungsgesetz 27.06.2025 (Eintragungsdatum)\n\nPortfolio Kaiserslautern II GmbH & Co. KG\nKommanditgesellschaft\nKöln\n\nDen Gläubigern der an der formwechselnden Umwandlung beteiligten Rechtsträger ist, wenn sie binnen sechs Monaten nach dem Tag, an dem die Eintragung der formwechselnden Umwandlung in das Register des Sitzes desjenigen Rechtsträgers, dessen Gläubiger sie sind, nach § 19 Absatz 3 UmwG als bekanntgemacht gilt, ihren Anspruch nach Grund und Höhe schriftlich anmelden, Sicherheit zu leisten, soweit sie nicht Befriedigung verlangen können. Dieses Recht steht den Gläubigern jedoch nur zu, wenn sie glaubhaft machen, dass durch die formwechselnden Umwandlung die Erfüllung ihrer Forderung gefährdet wird."
    },
    {
      "date": "2025-06-27",
      "id": "113753",
      "original_text": "Registerbekanntmachung nach dem Umwandlungsgesetz\nNordrhein-Westfalen Amtsgericht Mönchengladbach HRB 9754\nBosal Deutschland GmbH – Viersen",
      "type": "Registerbekanntmachung nach dem Umwandlungsgesetz",
      "state": "Nordrhein-Westfalen",
      "amtsgericht": "Amtsgericht Mönchengladbach",
      "registernummer": "HRB 9754",
      "registerart": "HRB",
      "company_name": "Bosal Deutschland GmbH",
      "company_seat": "Viersen",
      "details": "27.06.2025 (Bekanntmachungsdatum)\n\nNordrhein-Westfalen Amtsgericht Mönchengladbach HRB 9754\nRegisterbekanntmachung nach dem Umwandlungsgesetz 27.06.2025 (Eintragungsdatum)\n\nBosal Deutschland GmbH\nGesellschaft mit beschränkter Haftung\nViersen\n\nDem Registergericht ist der Entwurf eines Verschmelzungsplanes über die geplante Verschmelzung der Gesellschaft mit beschränkter Haftung nach deutschem Recht unter Firma Bosal Deutschland GmbH mit Sitz in Viersen (Amtsgericht Mönchengladbach, HRB 9754) als übertragender Gesellschaft mit der Gesellschaft mit beschränkter Haftung nach dem Recht der Tschechischen Republik unter Firma Bosal Aftermarket Europe, spol. s r.o. mit Sitz in Brandýs nad Labem-Stará Boleslav, (Handelsregister des Stadtgerichts in Prag unter Sektion C Aktennummer 289611 (Identifikationsnummer 068 22 479)) als übernehmender Gesellschaft eingereicht worden.\n\nDie Bosal Deutschland GmbH hat Arbeitnehmer und einen Betriebsrat. Die Bosal Aftermarket Europe, spol. s r.o hat Arbeitnehmer; bei Bosal Aftermarket Europe, spol, s r.o ist eine Arbeitnehmervertretung (Gewerkschaften) tätig.\n\nEin Verschmelzungsbeschluss der Bosal Deutschland GmbH ist gemäß §§ 312 Abs. 2, 307 Abs. 3 UmwG nicht erforderlich\n\nDie vollständigen Auskünfte über diese Modalitäten können kostenlos eingeholt werden bei den Gesellschaften: Bosal Deutschland GmbH, Metallstraße 5, 41751 Viersen/Deutschland, E-Mail: heinz.richter@ bosal.com, und bei der Bosal Aftermarket Europe, spol. s r.o., Zápská 1857, Brandýs nad Labem, PLZ 250 01, Brandýs nad Labem-Stará Boleslav, Tschechische Republik, E-Mail: elisabeth.bos@bosal.com."
    },
    {
      "date": "2025-06-27",
      "id": "113754",
      "original_text": "Registerbekanntmachung nach dem Umwandlungsgesetz\nNordrhein-Westfalen Amtsgericht Hagen HRB 12361\nRENOVA GmbH – Hagen",
      "type": "Registerbekanntmachung nach dem Umwandlungsgesetz",
      "state": "Nordrhein-Westfalen",
      "amtsgericht": "Amtsgericht Hagen",
      "registernummer": "HRB 12361",
      "registerart": "HRB",
      "company_name": "RENOVA GmbH",
      "company_seat": "Hagen",
      "details": "27.06.2025 (Bekanntmachungsdatum)\n\nNordrhein-Westfalen Amtsgericht Hagen HRB 12361\nRegisterbekanntmachung nach dem Umwandlungsgesetz 27.06.2025 (Eintragungsdatum)\n\nRENOVA GmbH\nGesellschaft mit beschränkter Haftung\nHagen\n\nDen Gläubigern der an der Verschmelzung beteiligten Rechtsträger ist, wenn sie binnen sechs Monaten nach dem Tag, an dem die Eintragung der Verschmelzung in das Register des Sitzes derjenigen Rechtsträger deren Gläubiger sie sind, nach § 19 Absatz 3 UmwG als bekanntgemacht gilt, ihren Anspruch nach Grund und Höhe schriftlich anmelden, Sicherheit zu leisten, soweit sie nicht Befriedigung verlangen können. Dieses Recht steht den Gläubigern jedoch nur zu, wenn sie glaubhaft machen, dass durch die Verschmelzung die Erfüllung ihrer Forderung gefährdet wird."
    },
    {
      "date": "2025-06-27",
      "id": "113755",
      "original_text": "Registerbekanntmachung nach dem Umwandlungsgesetz\nNordrhein-Westfalen Amtsgericht Hagen HRB 11942\nValora GmbH – Hagen",
      "type": "Registerbekanntmachung nach dem Umwandlungsgesetz",
      "state": "Nordrhein-Westfalen",
      "amtsgericht": "Amtsgericht Hagen",
      "registernummer": "HRB 11942",
      "registerart": "HRB",
      "company_name": "Valora GmbH",
      "company_seat": "Hagen",
      "details": "27.06.2025 (Bekanntmachungsdatum)\n\nNordrhein-Westfalen Amtsgericht Hagen HRB 11942\nRegisterbekanntmachung nach dem Umwandlungsgesetz 27.06.2025 (Eintragungsdatum)\n\nValora GmbH\nGesellschaft mit beschränkter Haftung\nHagen\n\nDen Gläubigern der an der Verschmelzung beteiligten Rechtsträger ist, wenn sie binnen sechs Monaten nach dem Tag, an dem die Eintragung der Verschmelzung in das Register des Sitzes derjenigen Rechtsträger deren Gläubiger sie sind, nach § 19 Absatz 3 UmwG als bekanntgemacht gilt, ihren Anspruch nach Grund und Höhe schriftlich anmelden, Sicherheit zu leisten, soweit sie nicht Befriedigung verlangen können. Dieses Recht steht den Gläubigern jedoch nur zu, wenn sie glaubhaft machen, dass durch die Verschmelzung die Erfüllung ihrer Forderung gefährdet wird."
    },
    {
      "date": "2025-06-27",
      "id": "113756",
      "original_text": "Registerbekanntmachung nach dem Umwandlungsgesetz\nNordrhein-Westfalen Amtsgericht Gelsenkirchen HRB 4172\nSchwan GmbH – Gladbeck",
      "type": "Registerbekanntmachung nach dem Umwandlungsgesetz",
      "state": "Nordrhein-Westfalen",
      "amtsgericht": "Amtsgericht Gelsenkirchen",
      "registernummer": "HRB 4172",
      "registerart": "HRB",
      "company_name": "Schwan GmbH",
      "company_seat": "Gladbeck",
      "details": "27.06.2025 (Bekanntmachungsdatum)\n\nNordrhein-Westfalen Amtsgericht Gelsenkirchen HRB 4172\nRegisterbekanntmachung nach dem Umwandlungsgesetz 27.06.2025 (Eintragungsdatum)\n\nSchwan GmbH\nGesellschaft mit beschränkter Haftung\nGladbeck\n\nDen Gläubigern der an der Verschmelzung beteiligten Rechtsträger ist, wenn sie binnen sechs Monaten nach dem Tag, an dem die Eintragung der Verschmelzung in das Register des Sitzes desjenigen Rechtsträgers, dessen Gläubiger sie sind, nach § 19 Absatz 3 UmwG als bekanntgemacht gilt, ihren Anspruch nach Grund und Höhe schriftlich anmelden, Sicherheit zu leisten, soweit sie nicht Befriedigung verlangen können. Dieses Recht steht den Gläubigern jedoch nur zu, wenn sie glaubhaft machen, dass durch die Verschmelzung die Erfüllung ihrer Forderung gefährdet wird."
    },
    {
      "date": "2025-06-27",
      "id": "113757",
      "original_text": "Registerbekanntmachung nach dem Umwandlungsgesetz\nNordrhein-Westfalen Amtsgericht Gütersloh HRB 3303\nAutohaus Markötter GmbH – Gütersloh",
      "type": "Registerbekanntmachung nach dem Umwandlungsgesetz",
      "state": "Nordrhein-Westfalen",
      "amtsgericht": "Amtsgericht Gütersloh",
      "registernummer": "HRB 3303",
      "registerart": "HRB",
      "company_name": "Autohaus Markötter GmbH",
      "company_seat": "Gütersloh",
      "details": "27.06.2025 (Bekanntmachungsdatum)\n\nNordrhein-Westfalen Amtsgericht Gütersloh HRB 3303\nRegisterbekanntmachung nach dem Umwandlungsgesetz 27.06.2025 (Eintragungsdatum)\n\nAutohaus Markötter GmbH\nGesellschaft mit beschränkter Haftung\nGütersloh\n\nDen Gläubigern der an der Verschmelzung beteiligten Rechtsträger ist, wenn sie binnen sechs Monaten nach dem Tag, an dem die Eintragung der Verschmelzung in das Register des Sitzes desjenigen Rechtsträgers, dessen Gläubiger sie sind, nach § 19 Absatz 3 UmwG als bekanntgemacht gilt, ihren Anspruch nach Grund und Höhe schriftlich anmelden, Sicherheit zu leisten, soweit sie nicht Befriedigung verlangen können. Dieses Recht steht den Gläubigern jedoch nur zu, wenn sie glaubhaft machen, dass durch die Verschmelzung die Erfüllung ihrer Forderung gefährdet wird."
    },
    {
      "date": "2025-06-27",
      "id": "113758",
      "original_text": "Löschungsankündigung\nNordrhein-Westfalen Amtsgericht Duisburg HRB 32493\nSamkon GmbH – Duisburg",
      "type": "Löschungsankündigung",
      "state": "Nordrhein-Westfalen",
      "amtsgericht": "Amtsgericht Duisburg",
      "registernummer": "HRB 32493",
      "registerart": "HRB",
      "company_name": "Samkon GmbH",
      "company_seat": "Duisburg",
      "details": "27.06.2025 (Bekanntmachungsdatum)\n\nNordrhein-Westfalen Amtsgericht Duisburg HRB 32493\nLöschungsankündigung\n\nSamkon GmbH\nGesellschaft mit beschränkter Haftung\nDuisburg\n\nDas Registergericht beabsichtigt, die im Handelsregister unter HRB 32493 eingetragene Gesellschaft Samkon GmbH  gemäß § 394 FamFG wegen Vermögenslosigkeit von Amts wegen zu löschen. Gegen diese Verfügung kann Widerspruch eingelegt werden. Die Frist zur Erhebung eines Widerspruchs gegen die beabsichtigte Löschung von Amts wegen ist auf drei Monate festgesetzt. Rechtsbehelfsbelehrung Der Widerspruch ist bei dem Amtsgericht Duisburg, Kardinal-Galen-Str. 124-132, 47058 Duisburg schriftlich in deutscher Sprache oder zur Niederschrift der Geschäftsstelle einzulegen. Der Widerspruch kann auch zur Niederschrift der Geschäftsstelle eines jeden Amtsgerichtes abgegeben werden. Die Einlegung ist auch durch Übertragung eines elektronischen Dokuments an die elektronische Poststelle des Gerichts möglich. Das elektronische Dokument muss für die Bearbeitung durch das Gericht geeignet und mit einer qualifizierten elektronischen Signatur der verantwortenden Person versehen sein oder von der verantwortenden Person signiert und auf einem sicheren Übermittlungsweg gemäß § 130 a ZPO nach näherer Maßgabe der Verordnung über die technischen Rahmenbedingungen des elektronischen Rechtsverkehrs und über das besondere elektronische Behördenpostfach (BGBl. I, S. 3803) eingereicht werden. Weitere Informationen erhalten Sie auf der Internetseite www.justiz.de <http://www.justiz.de>. Der Widerspruch muss spätestens innerhalb der gesetzten Frist bei dem Amtsgericht Duisburg eingegangen sein. Dies gilt auch dann, wenn der Widerspruch zur Niederschrift der Geschäftsstelle eines anderen Amtsgerichtes abgegeben wurde. Die Frist beginnt mit der Veröffentlichung. Fällt das Ende der Frist auf einen Sonntag, einen allgemeinen Feiertag oder Sonnabend, so endet die Frist mit Ablauf des nächsten Werktages. Der Widerspruch muss die Bezeichnung der angefochtenen Verfügung sowie die Erklärung enthalten, dass Widerspruch gegen diese Verfügung eingelegt wird. Er ist zu unterzeichnen und soll begründet werden."
    },
    {
      "date": "2025-06-27",
      "id": "113759",
      "original_text": "Einreichung neuer Dokumente\nNordrhein-Westfalen Amtsgericht Paderborn HRB 17806\nBlitz P25-349 SE – Paderborn",
      "type": "Einreichung neuer Dokumente",
      "state": "Nordrhein-Westfalen",
      "amtsgericht": "Amtsgericht Paderborn",
      "registernummer": "HRB 17806",
      "registerart": "HRB",
      "company_name": "Blitz P25-349 SE",
      "company_seat": "Paderborn",
      "details": "27.06.2025 (Bekanntmachungsdatum)\n\nNordrhein-Westfalen Amtsgericht Paderborn HRB 17806\nEinreichung neuer Dokumente 27.06.2025 (Eintragungsdatum)\n\nBlitz P25-349 SE\nEuropäische Aktiengesellschaft (SE)\nPaderborn\n\nDem Registergericht ist eine Liste der Mitglieder des Aufsichtsrates eingereicht worden."
    },
    {
      "date": "2025-06-27",
      "id": "113760",
      "original_text": "Einreichung neuer Dokumente\nNordrhein-Westfalen Amtsgericht Köln HRB 101306\nRöchling Medical SE – Köln",
      "type": "Einreichung neuer Dokumente",
      "state": "Nordrhein-Westfalen",
      "amtsgericht": "Amtsgericht Köln",
      "registernummer": "HRB 101306",
      "registerart": "HRB",
      "company_name": "Röchling Medical SE",
      "company_seat": "Köln",
      "details": "27.06.2025 (Bekanntmachungsdatum)\n\nNordrhein-Westfalen Amtsgericht Köln HRB 101306\nEinreichung neuer Dokumente\n\nRöchling Medical SE\nEuropäische Aktiengesellschaft (SE)\nKöln\n\nDem Registergericht ist eine Liste der Mitglieder des Aufsichtsrates eingereicht worden."
    },
    {
      "date": "2025-06-27",
      "id": "113761",
      "original_text": "Einreichung neuer Dokumente\nNordrhein-Westfalen Amtsgericht Mönchengladbach HRB 5912\nNEW AG – Mönchengladbach",
      "type": "Einreichung neuer Dokumente",
      "state": "Nordrhein-Westfalen",
      "amtsgericht": "Amtsgericht Mönchengladbach",
      "registernummer": "HRB 5912",
      "registerart": "HRB",
      "company_name": "NEW AG",
      "company_seat": "Mönchengladbach",
      "details": "27.06.2025 (Bekanntmachungsdatum)\n\nNordrhein-Westfalen Amtsgericht Mönchengladbach HRB 5912\nEinreichung neuer Dokumente 27.06.2025 (Eintragungsdatum)\n\nNEW AG\nAktiengesellschaft\nMönchengladbach\n\nDem Registergericht ist eine neue Liste der Mitglieder des Aufsichtsrates eingereicht worden."
    },
    {
      "date": "2025-06-27",
      "id": "113762",
      "original_text": "Löschungsankündigung\nNordrhein-Westfalen Amtsgericht Duisburg HRB 34244\nBozel GmbH – Duisburg",
      "type": "Löschungsankündigung",
      "state": "Nordrhein-Westfalen",
      "amtsgericht": "Amtsgericht Duisburg",
      "registernummer": "HRB 34244",
      "registerart": "HRB",
      "company_name": "Bozel GmbH",
      "company_seat": "Duisburg",
      "details": "27.06.2025 (Bekanntmachungsdatum)\n\nNordrhein-Westfalen Amtsgericht Duisburg HRB 34244\nLöschungsankündigung\n\nBozel GmbH\nGesellschaft mit beschränkter Haftung\nDuisburg\n\nDas Registergericht beabsichtigt, die im Handelsregister eingetragene Gesellschaft Bozel GmbH gemäß § 394 Absatz 1 FamFG wegen Vermögenslosigkeit von Amts wegen zu löschen. Gegen diese Verfügung kann Widerspruch eingelegt werden. Die Frist zur Erhebung eines Widerspruchs gegen die beabsichtigte Löschung von Amts wegen ist auf drei Monate festgesetzt. Rechtsbehelfsbelehrung Der Widerspruch ist bei dem Amtsgericht Duisburg, Kardinal-Galen-Str. 124-132, 47058 Duisburg schriftlich in deutscher Sprache oder zur Niederschrift der Geschäftsstelle einzulegen. Der Widerspruch kann auch zur Niederschrift der Geschäftsstelle eines jeden Amtsgerichtes abgegeben werden. Die Einlegung ist auch durch Übertragung eines elektronischen Dokuments an die elektronische Poststelle des Gerichts möglich. Das elektronische Dokument muss für die Bearbeitung durch das Gericht geeignet und mit einer qualifizierten elektronischen Signatur der verantwortenden Person versehen sein oder von der verantwortenden Person signiert und auf einem sicheren Übermittlungsweg gemäß § 130 a ZPO nach näherer Maßgabe der Verordnung über die technischen Rahmenbedingungen des elektronischen Rechtsverkehrs und über das besondere elektronische Behördenpostfach (BGBl. I, S. 3803) eingereicht werden. Weitere Informationen erhalten Sie auf der Internetseite www.justiz.de <http://www.justiz.de>. Der Widerspruch muss spätestens innerhalb der gesetzten Frist bei dem Amtsgericht Duisburg eingegangen sein. Dies gilt auch dann, wenn der Widerspruch zur Niederschrift der Geschäftsstelle eines anderen Amtsgerichtes abgegeben wurde. Die Frist beginnt mit der Veröffentlichung. Fällt das Ende der Frist auf einen Sonntag, einen allgemeinen Feiertag oder Sonnabend, so endet die Frist mit Ablauf des nächsten Werktages. Der Widerspruch muss die Bezeichnung der angefochtenen Verfügung sowie die Erklärung enthalten, dass Widerspruch gegen diese Verfügung eingelegt wird. Er ist zu unterzeichnen und soll begründet werden."
    },
    {
      "date": "2025-06-27",
      "id": "113763",
      "original_text": "Registerbekanntmachung nach dem Umwandlungsgesetz\nNordrhein-Westfalen Amtsgericht Steinfurt HRB 8597\nKötter Consulting Engineers GmbH – Rheine",
      "type": "Registerbekanntmachung nach dem Umwandlungsgesetz",
      "state": "Nordrhein-Westfalen",
      "amtsgericht": "Amtsgericht Steinfurt",
      "registernummer": "HRB 8597",
      "registerart": "HRB",
      "company_name": "Kötter Consulting Engineers GmbH",
      "company_seat": "Rheine",
      "details": "27.06.2025 (Bekanntmachungsdatum)\n\nNordrhein-Westfalen Amtsgericht Steinfurt HRB 8597\nRegisterbekanntmachung nach dem Umwandlungsgesetz 27.06.2025 (Eintragungsdatum)\n\nKötter Consulting Engineers GmbH\nGesellschaft mit beschränkter Haftung\nRheine\n\nDen Gläubigern der an der Verschmelzung beteiligten Rechtsträger ist, wenn sie binnen sechs Monaten nach dem Tag, an dem die Eintragung der Verschmelzung in das Register des Sitzes derjenigen Rechtsträger deren Gläubiger sie sind, nach § 19 Absatz 3 UmwG als bekanntgemacht gilt, ihren Anspruch nach Grund und Höhe schriftlich anmelden, Sicherheit zu leisten, soweit sie nicht Befriedigung verlangen können. Dieses Recht steht den Gläubigern jedoch nur zu, wenn sie glaubhaft machen, dass durch die Verschmelzung die Erfüllung ihrer Forderung gefährdet wird."
    },
    {
      "date": "2025-06-27",
      "id": "113764",
      "original_text": "Löschungsankündigung\nNordrhein-Westfalen Amtsgericht Düsseldorf HRB 41016\nICON-Management Gesellschaft für Mediendienstleistungen mbH – Düsseldorf",
      "type": "Löschungsankündigung",
      "state": "Nordrhein-Westfalen",
      "amtsgericht": "Amtsgericht Düsseldorf",
      "registernummer": "HRB 41016",
      "registerart": "HRB",
      "company_name": "ICON-Management Gesellschaft für Mediendienstleistungen mbH",
      "company_seat": "Düsseldorf",
      "details": "27.06.2025 (Bekanntmachungsdatum)\n\nNordrhein-Westfalen Amtsgericht Düsseldorf HRB 41016\nLöschungsankündigung\n\nICON-Management Gesellschaft für Mediendienstleistungen mbH\nGesellschaft mit beschränkter Haftung\nDüsseldorf\n\nDas Registergericht beabsichtigt die Gesellschaft von Amts wegen nach § 394 Abs. 1 FamFG zu löschen. Die Frist zur Erhebung eines Widerspruchs ist auf einen Monat festgesetzt.\n\nRechtsbehelfsbelehrung:\nDas Widerspruchsrecht steht jedem zu, der an der Unterlassung der Löschung ein berechtigtes Interesse hat. Der Widerspruch ist bei dem Amtsgericht Düsseldorf -Registergericht-, Werdener Straße 1, 40227 Düsseldorf schriftlich in deutscher Sprache oder zur Niederschrift der Geschäftsstelle einzulegen. Der Widerspruch kann auch zur Niederschrift der Geschäftsstelle eines jeden Amtsgerichtes abgegeben werden. Die Einlegung ist auch durch Übertragung eines elektronischen Dokuments an die elektronische Poststelle des Gerichts möglich. Das elektronische Dokument muss für die Bearbeitung durch das Gericht geeignet und mit einer qualifizierten elektronischen Signatur der verantwortenden Person versehen sein oder von der verantwortenden Person signiert und auf einem sicheren Übermittlungsweg gemäß § 130a ZPO nach näherer Maßgabe der Verordnung über die technischen Rahmenbedingungen des elektronischen Rechtsverkehrs und über das besondere elektronische Behördenpostfach (BGBl. I, S.3803) eingereicht werden. Weitere Informationen erhalten Sie auf der Internetseite www.justiz.de.\nDer Widerspruch muss spätestens innerhalb der gesetzten Frist nach dem Datum der Bekanntmachung der Löschungsankündigung bei dem Amtsgericht - Registergericht - Düsseldorf eingegangen sein.  Dies gilt auch dann, wenn der Widerspruch zur Niederschrift der Geschäftsstelle eines anderen Amtsgerichtes abgegeben wurde. Die Frist beginnt mit dem Tage der Bekanntmachung der Löschungsankündigung in dem für die Bekanntmachung der Eintragungen in das Handelsregister bestimmten elektronischen Informations- und Kommunikationssystem nach § 10 des Handelsgesetzbuches. Fällt das Ende der Frist auf einen Sonntag, einen allgemeinen Feiertag oder Sonnabend, so endet die Frist mit Ablauf des nächsten Werktages.\nDer Widerspruch muss die Bezeichnung der angefochtenen Löschungsankündigung sowie die Erklärung enthalten, dass Widerspruch gegen diese Löschungsankündigung eingelegt wird. Er ist zu unterzeichnen und soll begründet werden."
    },
    {
      "date": "2025-06-27",
      "id": "113765",
      "original_text": "Einreichung neuer Dokumente\nNordrhein-Westfalen Amtsgericht Bad Oeynhausen HRB 7747\nIMA Schelling Deutschland GmbH – Lübbecke",
      "type": "Einreichung neuer Dokumente",
      "state": "Nordrhein-Westfalen",
      "amtsgericht": "Amtsgericht Bad Oeynhausen",
      "registernummer": "HRB 7747",
      "registerart": "HRB",
      "company_name": "IMA Schelling Deutschland GmbH",
      "company_seat": "Lübbecke",
      "details": "27.06.2025 (Bekanntmachungsdatum)\n\nNordrhein-Westfalen Amtsgericht Bad Oeynhausen HRB 7747\nEinreichung neuer Dokumente\n\nIMA Schelling Deutschland GmbH\nGesellschaft mit beschränkter Haftung\nLübbecke\n\nDem Registergericht ist eine neue Liste der Mitglieder des Aufsichtsrates eingereicht worden."
    },
    {
      "date": "2025-06-27",
      "id": "113766",
      "original_text": "Löschungsankündigung\nNordrhein-Westfalen Amtsgericht Mönchengladbach HRA 7363\nLockhütter KG – Viersen",
      "type": "Löschungsankündigung",
      "state": "Nordrhein-Westfalen",
      "amtsgericht": "Amtsgericht Mönchengladbach",
      "registernummer": "HRA 7363",
      "registerart": "HRA",
      "company_name": "Lockhütter KG",
      "company_seat": "Viersen",
      "details": "27.06.2025 (Bekanntmachungsdatum)\n\nNordrhein-Westfalen Amtsgericht Mönchengladbach HRA 7363\nLöschungsankündigung\n\nLockhütter KG\nKommanditgesellschaft\nViersen\n\nIn der Handelsregistersache Lockhütter KG, Viersen (Amtsgericht Mönchengladbach, HRA 7363) beabsichtigt das Registergericht, die Gesellschaft von Amts wegen aus dem Handelsregister zu löschen, da keine Anhaltspunkte vorhanden sind, dass die Gesellschaft nach dem Ende des Insolvenzverfahrens kein Vermögen mehr hat, § 394 Abs. 1, 3 FamFG."
    },
    {
      "date": "2025-06-27",
      "id": "113767",
      "original_text": "Sonstige Registerbekanntmachung\nNordrhein-Westfalen Amtsgericht Mönchengladbach HRA 7363\nLockhütter KG – Viersen",
      "type": "Sonstige Registerbekanntmachung",
      "state": "Nordrhein-Westfalen",
      "amtsgericht": "Amtsgericht Mönchengladbach",
      "registernummer": "HRA 7363",
      "registerart": "HRA",
      "company_name": "Lockhütter KG",
      "company_seat": "Viersen",
      "details": "27.06.2025 (Bekanntmachungsdatum)\n\nNordrhein-Westfalen Amtsgericht Mönchengladbach HRA 7363\nSonstige Registerbekanntmachung\n\nLockhütter KG\nKommanditgesellschaft\nViersen\n\nIn der Handelsregistersache Lockhütter KG, Viersen (Amtsgericht Mönchengladbach, HRA 7363) beabsichtigt das Registergericht, die Gesellschaft von Amts wegen aus dem Handelsregister zu löschen, da keine Anhaltspunkte vorhanden sind, dass die Gesellschaft nach dem Ende des Insolvenzverfahrens kein Vermögen mehr hat, § 394 Abs. 1, 3 FamFG. .\n\nEs wird hiermit eine Frist von 3 Monaten eingeräumt, um einen Widerspruch gegen die beabsichtigte Löschung geltend zu machen."
    },
    {
      "date": "2025-06-27",
      "id": "113768",
      "original_text": "Registerbekanntmachung nach dem Umwandlungsgesetz\nNordrhein-Westfalen Amtsgericht Siegburg HRB 14571\nVitalis Ventures GmbH – Troisdorf",
      "type": "Registerbekanntmachung nach dem Umwandlungsgesetz",
      "state": "Nordrhein-Westfalen",
      "amtsgericht": "Amtsgericht Siegburg",
      "registernummer": "HRB 14571",
      "registerart": "HRB",
      "company_name": "Vitalis Ventures GmbH",
      "company_seat": "Troisdorf",
      "details": "27.06.2025 (Bekanntmachungsdatum)\n\nNordrhein-Westfalen Amtsgericht Siegburg HRB 14571\nRegisterbekanntmachung nach dem Umwandlungsgesetz 27.06.2025 (Eintragungsdatum)\n\nVitalis Ventures GmbH\nGesellschaft mit beschränkter Haftung\nTroisdorf\n\nDen Gläubigern der an der Verschmelzung beteiligten Rechtsträger ist, wenn sie binnen sechs Monaten nach dem Tag, an dem die Eintragung der Verschmelzung in das Register des Sitzes desjenigen Rechtsträgers, dessen Gläubiger sie sind, nach § 19 Absatz 3 UmwG als bekanntgemacht gilt, ihren Anspruch nach Grund und Höhe schriftlich anmelden, Sicherheit zu leisten, soweit sie nicht Befriedigung verlangen können. Dieses Recht steht den Gläubigern jedoch nur zu, wenn sie glaubhaft machen, dass durch die Verschmelzung die Erfüllung ihrer Forderung gefährdet wird."
    },
    {
      "date": "2025-06-27",
      "id": "113769",
      "original_text": "Löschungsankündigung\nNordrhein-Westfalen Amtsgericht Duisburg HRB 33062\nZM Transport UG (haftungsbeschränkt) – Duisburg",
      "type": "Löschungsankündigung",
      "state": "Nordrhein-Westfalen",
      "amtsgericht": "Amtsgericht Duisburg",
      "registernummer": "HRB 33062",
      "registerart": "HRB",
      "company_name": "ZM Transport UG (haftungsbeschränkt)",
      "company_seat": "Duisburg",
      "details": "27.06.2025 (Bekanntmachungsdatum)\n\nNordrhein-Westfalen Amtsgericht Duisburg HRB 33062\nLöschungsankündigung\n\nZM Transport UG (haftungsbeschränkt)\nGesellschaft mit beschränkter Haftung\nDuisburg\n\nDas Registergericht beabsichtigt, die im Handelsregister unter HRB 33062  eingetragene Gesellschaft ZM Transport UG (haftungsbeschränkt) gemäß § 394 FamFG wegen Vermögenslosigkeit sowie gemäß § 395 FamFG von Amts wegen zu löschen. Gegen diese Verfügung kann Widerspruch eingelegt werden. Die Frist zur Erhebung eines Widerspruchs gegen die beabsichtigte Löschung von Amts wegen ist auf drei Monate festgesetzt. Rechtsbehelfsbelehrung Der Widerspruch ist bei dem Amtsgericht Duisburg, Kardinal-Galen-Str. 124-132, 47058 Duisburg schriftlich in deutscher Sprache oder zur Niederschrift der Geschäftsstelle einzulegen. Der Widerspruch kann auch zur Niederschrift der Geschäftsstelle eines jeden Amtsgerichtes abgegeben werden. Die Einlegung ist auch durch Übertragung eines elektronischen Dokuments an die elektronische Poststelle des Gerichts möglich. Das elektronische Dokument muss für die Bearbeitung durch das Gericht geeignet und mit einer qualifizierten elektronischen Signatur der verantwortenden Person versehen sein oder von der verantwortenden Person signiert und auf einem sicheren Übermittlungsweg gemäß § 130 a ZPO nach näherer Maßgabe der Verordnung über die technischen Rahmenbedingungen des elektronischen Rechtsverkehrs und über das besondere elektronische Behördenpostfach (BGBl. I, S. 3803) eingereicht werden. Weitere Informationen erhalten Sie auf der Internetseite www.justiz.de <http://www.justiz.de>. Der Widerspruch muss spätestens innerhalb der gesetzten Frist bei dem Amtsgericht Duisburg eingegangen sein. Dies gilt auch dann, wenn der Widerspruch zur Niederschrift der Geschäftsstelle eines anderen Amtsgerichtes abgegeben wurde. Die Frist beginnt mit der Veröffentlichung. Fällt das Ende der Frist auf einen Sonntag, einen allgemeinen Feiertag oder Sonnabend, so endet die Frist mit Ablauf des nächsten Werktages. Der Widerspruch muss die Bezeichnung der angefochtenen Verfügung sowie die Erklärung enthalten, dass Widerspruch gegen diese Verfügung eingelegt wird. Er ist zu unterzeichnen und soll begründet werden."
    },
    {
      "date": "2025-06-27",
      "id": "113770",
      "original_text": "Registerbekanntmachung nach dem Umwandlungsgesetz\nNordrhein-Westfalen Amtsgericht Bielefeld HRB 41015\nVEK-Management GmbH – Schloß Holte-Stukenbrock",
      "type": "Registerbekanntmachung nach dem Umwandlungsgesetz",
      "state": "Nordrhein-Westfalen",
      "amtsgericht": "Amtsgericht Bielefeld",
      "registernummer": "HRB 41015",
      "registerart": "HRB",
      "company_name": "VEK-Management GmbH",
      "company_seat": "Schloß Holte-Stukenbrock",
      "details": "27.06.2025 (Bekanntmachungsdatum)\n\nNordrhein-Westfalen Amtsgericht Bielefeld HRB 41015\nRegisterbekanntmachung nach dem Umwandlungsgesetz 27.06.2025 (Eintragungsdatum)\n\nVEK-Management GmbH\nGesellschaft mit beschränkter Haftung\nSchloß Holte-Stukenbrock\n\nDen Gläubigern der an der Verschmelzung beteiligten Rechtsträger ist, wenn sie binnen sechs Monaten nach dem Tag, an dem die Eintragung der Verschmelzung in das Register des Sitzes desjenigen Rechtsträgers, dessen Gläubiger sie sind, nach § 19 Absatz 3 UmwG als bekanntgemacht gilt, ihren Anspruch nach Grund und Höhe schriftlich anmelden, Sicherheit zu leisten, soweit sie nicht Befriedigung verlangen können. Dieses Recht steht den Gläubigern jedoch nur zu, wenn sie glaubhaft machen, dass durch die Verschmelzung die Erfüllung ihrer Forderung gefährdet wird."
    },
    {
      "date": "2025-06-27",
      "id": "113771",
      "original_text": "Registerbekanntmachung nach dem Umwandlungsgesetz\nNordrhein-Westfalen Amtsgericht Köln HRB 123715\nPortfolio Kaiserslautern II GmbH – Köln",
      "type": "Registerbekanntmachung nach dem Umwandlungsgesetz",
      "state": "Nordrhein-Westfalen",
      "amtsgericht": "Amtsgericht Köln",
      "registernummer": "HRB 123715",
      "registerart": "HRB",
      "company_name": "Portfolio Kaiserslautern II GmbH",
      "company_seat": "Köln",
      "details": "27.06.2025 (Bekanntmachungsdatum)\n\nNordrhein-Westfalen Amtsgericht Köln HRB 123715\nRegisterbekanntmachung nach dem Umwandlungsgesetz 27.06.2025 (Eintragungsdatum)\n\nPortfolio Kaiserslautern II GmbH\nGesellschaft mit beschränkter Haftung\nKöln\n\nDen Gläubigern der an der formwechselnden Umwandlung beteiligten Rechtsträger ist, wenn sie binnen sechs Monaten nach dem Tag, an dem die Eintragung der formwechselnden Umwandlung in das Register des Sitzes desjenigen Rechtsträgers, dessen Gläubiger sie sind, nach § 19 Absatz 3 UmwG als bekanntgemacht gilt, ihren Anspruch nach Grund und Höhe schriftlich anmelden, Sicherheit zu leisten, soweit sie nicht Befriedigung verlangen können. Dieses Recht steht den Gläubigern jedoch nur zu, wenn sie glaubhaft machen, dass durch die formwechselnden Umwandlung die Erfüllung ihrer Forderung gefährdet wird."
    },
    {
      "date": "2025-06-27",
      "id": "113772",
      "original_text": "Registerbekanntmachung nach dem Umwandlungsgesetz\nHessen Amtsgericht Offenbach am Main HRB 50811\nAhorn Wohnmobile Frankfurt GmbH – Dietzenbach",
      "type": "Registerbekanntmachung nach dem Umwandlungsgesetz",
      "state": "Hessen",
      "amtsgericht": "Amtsgericht Offenbach am Main",
      "registernummer": "HRB 50811",
      "registerart": "HRB",
      "company_name": "Ahorn Wohnmobile Frankfurt GmbH",
      "company_seat": "Dietzenbach",
      "details": "27.06.2025 (Bekanntmachungsdatum)\n\nHessen Amtsgericht Offenbach am Main HRB 50811\nRegisterbekanntmachung nach dem Umwandlungsgesetz 27.06.2025 (Eintragungsdatum)\n\nAhorn Wohnmobile Frankfurt GmbH\nGesellschaft mit beschränkter Haftung\nDietzenbach\n\nDen Gläubigern der an der Verschmelzung beteiligten Rechtsträger ist, wenn sie binnen sechs Monaten nach dem Tag, an dem die Eintragung der Verschmelzung in das Register des Sitzes desjenigen Rechtsträgers, dessen Gläubiger sie sind, nach § 19 Absatz 3 UmwG bekannt gemacht worden ist, ihren Anspruch nach Grund und Höhe schriftlich anmelden, Sicherheit zu leisten, soweit sie nicht Befriedigung verlangen können. Dieses Recht steht den Gläubigern jedoch nur zu, wenn sie glaubhaft machen, dass durch die Verschmelzung die Erfüllung ihrer Forderung gefährdet wird."
    },
    {
      "date": "2025-06-27",
      "id": "113773",
      "original_text": "Registerbekanntmachung nach dem Umwandlungsgesetz\nHessen Amtsgericht Kassel HRB 20289\nPiper Deutschland Vertriebs GmbH – Calden",
      "type": "Registerbekanntmachung nach dem Umwandlungsgesetz",
      "state": "Hessen",
      "amtsgericht": "Amtsgericht Kassel",
      "registernummer": "HRB 20289",
      "registerart": "HRB",
      "company_name": "Piper Deutschland Vertriebs GmbH",
      "company_seat": "Calden",
      "details": "27.06.2025 (Bekanntmachungsdatum)\n\nHessen Amtsgericht Kassel HRB 20289\nRegisterbekanntmachung nach dem Umwandlungsgesetz 27.06.2025 (Eintragungsdatum)\n\nPiper Deutschland Vertriebs GmbH\nGesellschaft mit beschränkter Haftung\nCalden\n\nDen Gläubigern der an der formwechselnden Umwandlung beteiligten Rechtsträger ist, wenn sie binnen sechs Monaten nach dem Tag, an dem die Eintragung der formwechselnden Umwandlung in das Register des Sitzes desjenigen Rechtsträgers, dessen Gläubiger sie sind, nach § 201 UmwG bekannt gemacht worden ist, ihren Anspruch nach Grund und Höhe schriftlich anmelden, Sicherheit zu leisten, soweit sie nicht Befriedigung verlangen können. Dieses Recht steht den Gläubigern jedoch nur zu, wenn sie glaubhaft machen, dass durch die formwechselnden Umwandlung die Erfüllung ihrer Forderung gefährdet wird."
    },
    {
      "date": "2025-06-27",
      "id": "113774",
      "original_text": "Registerbekanntmachung nach dem Umwandlungsgesetz\nHessen Amtsgericht Kassel HRB 15132\nCAMO Consulting AG – Calden",
      "type": "Registerbekanntmachung nach dem Umwandlungsgesetz",
      "state": "Hessen",
      "amtsgericht": "Amtsgericht Kassel",
      "registernummer": "HRB 15132",
      "registerart": "HRB",
      "company_name": "CAMO Consulting AG",
      "company_seat": "Calden",
      "details": "27.06.2025 (Bekanntmachungsdatum)\n\nHessen Amtsgericht Kassel HRB 15132\nRegisterbekanntmachung nach dem Umwandlungsgesetz 27.06.2025 (Eintragungsdatum)\n\nCAMO Consulting AG\nAktiengesellschaft\nCalden\n\nDen Gläubigern der an der formwechselnden Umwandlung beteiligten Rechtsträger ist, wenn sie binnen sechs Monaten nach dem Tag, an dem die Eintragung der formwechselnden Umwandlung in das Register des Sitzes desjenigen Rechtsträgers, dessen Gläubiger sie sind, nach § 201 UmwG bekannt gemacht worden ist, ihren Anspruch nach Grund und Höhe schriftlich anmelden, Sicherheit zu leisten, soweit sie nicht Befriedigung verlangen können. Dieses Recht steht den Gläubigern jedoch nur zu, wenn sie glaubhaft machen, dass durch die formwechselnden Umwandlung die Erfüllung ihrer Forderung gefährdet wird."
    },
    {
      "date": "2025-06-27",
      "id": "113775",
      "original_text": "Registerbekanntmachung nach dem Umwandlungsgesetz\nHessen Amtsgericht Fulda HRB 8501\nB+B Verwaltungs und Management GmbH – Fulda",
      "type": "Registerbekanntmachung nach dem Umwandlungsgesetz",
      "state": "Hessen",
      "amtsgericht": "Amtsgericht Fulda",
      "registernummer": "HRB 8501",
      "registerart": "HRB",
      "company_name": "B+B Verwaltungs und Management GmbH",
      "company_seat": "Fulda",
      "details": "27.06.2025 (Bekanntmachungsdatum)\n\nHessen Amtsgericht Fulda HRB 8501\nRegisterbekanntmachung nach dem Umwandlungsgesetz 27.06.2025 (Eintragungsdatum)\n\nB+B Verwaltungs und Management GmbH\nGesellschaft mit beschränkter Haftung\nFulda\n\nDen Gläubigern der an der Verschmelzung beteiligten Rechtsträger ist, wenn sie binnen sechs Monaten nach dem Tag, an dem die Eintragung der Verschmelzung in das Register des Sitzes desjenigen Rechtsträgers, dessen Gläubiger sie sind, nach § 19 Absatz 3 UmwG bekannt gemacht worden ist, ihren Anspruch nach Grund und Höhe schriftlich anmelden, Sicherheit zu leisten, soweit sie nicht Befriedigung verlangen können. Dieses Recht steht den Gläubigern jedoch nur zu, wenn sie glaubhaft machen, dass durch die Verschmelzung die Erfüllung ihrer Forderung gefährdet wird."
    },
    {
      "date": "2025-06-27",
      "id": "113776",
      "original_text": "Löschungsankündigung\nHessen Amtsgericht Frankfurt am Main HRB 94248\nLFG LEASING GmbH – Frankfurt am Main",
      "type": "Löschungsankündigung",
      "state": "Hessen",
      "amtsgericht": "Amtsgericht Frankfurt am Main",
      "registernummer": "HRB 94248",
      "registerart": "HRB",
      "company_name": "LFG LEASING GmbH",
      "company_seat": "Frankfurt am Main",
      "details": "27.06.2025 (Bekanntmachungsdatum)\n\nHessen Amtsgericht Frankfurt am Main HRB 94248\nLöschungsankündigung\n\nLFG LEASING GmbH\nGesellschaft mit beschränkter Haftung\nFrankfurt am Main\n\nDas Registergericht beabsichtigt die im Handelsregister eingetragene Gesellschaft von Amts wegen nach § 394 FamFG zu löschen. Die Frist zur Erhebung eines Widerspruchs gegen die beabsichtigte Löschung wird auf 1 Monat festgesetzt."
    },
    {
      "date": "2025-06-27",
      "id": "113777",
      "original_text": "Löschungsankündigung\nHessen Amtsgericht Fulda HRA 1698\nBadehof Bad Salzschlirf GmbH & Co. KG – Bad Salzschlirf",
      "type": "Löschungsankündigung",
      "state": "Hessen",
      "amtsgericht": "Amtsgericht Fulda",
      "registernummer": "HRA 1698",
      "registerart": "HRA",
      "company_name": "Badehof Bad Salzschlirf GmbH & Co. KG",
      "company_seat": "Bad Salzschlirf",
      "details": "27.06.2025 (Bekanntmachungsdatum)\n\nHessen Amtsgericht Fulda HRA 1698\nLöschungsankündigung\n\nBadehof Bad Salzschlirf GmbH & Co. KG\nKommanditgesellschaft\nBad Salzschlirf\n\nDas Registergericht beabsichtigt die im Handelsregister eingetragene Firma von Amts wegen nach § 394 FamFG zu löschen. Die Frist zur Erhebung eines Widerspruchs gegen die beabsichtigte Löschung wird auf 2 Monate festgesetzt."
    },
    {
      "date": "2025-06-27",
      "id": "113778",
      "original_text": "Löschungsankündigung\nHessen Amtsgericht Offenbach am Main HRB 55846\nVario Suite GmbH – Rödermark",
      "type": "Löschungsankündigung",
      "state": "Hessen",
      "amtsgericht": "Amtsgericht Offenbach am Main",
      "registernummer": "HRB 55846",
      "registerart": "HRB",
      "company_name": "Vario Suite GmbH",
      "company_seat": "Rödermark",
      "details": "27.06.2025 (Bekanntmachungsdatum)\n\nHessen Amtsgericht Offenbach am Main HRB 55846\nLöschungsankündigung\n\nVario Suite GmbH\nGesellschaft mit beschränkter Haftung\nRödermark\n\nDas Registergericht beabsichtigt die im Handelsregister eingetragene Gesellschaft von Amts wegen nach § 394 FamFG zu löschen. Die Frist zur Erhebung eines Widerspruchs gegen die beabsichtigte Löschung wird auf 3 Monate festgesetzt"
    },
    {
      "date": "2025-06-27",
      "id": "113779",
      "original_text": "Registerbekanntmachung nach dem Umwandlungsgesetz\nHessen Amtsgericht Bad Hersfeld HRA 1966\nBestattungsinstitut Herbstwind e.K. Inhaber Carola Schaake-Allendorf – Niederaula",
      "type": "Registerbekanntmachung nach dem Umwandlungsgesetz",
      "state": "Hessen",
      "amtsgericht": "Amtsgericht Bad Hersfeld",
      "registernummer": "HRA 1966",
      "registerart": "HRA",
      "company_name": "Bestattungsinstitut Herbstwind e.K. Inhaber Carola Schaake-Allendorf",
      "company_seat": "Niederaula",
      "details": "27.06.2025 (Bekanntmachungsdatum)\n\nHessen Amtsgericht Bad Hersfeld HRA 1966\nRegisterbekanntmachung nach dem Umwandlungsgesetz 27.06.2025 (Eintragungsdatum)\n\nBestattungsinstitut Herbstwind e.K. Inhaber Carola Schaake-Allendorf\nEinzelkaufmann / Einzelkauffrau\nNiederaula\n\nDen Gläubigern der an der Ausgliederung beteiligten Rechtsträger ist, wenn sie binnen sechs Monaten nach dem Tag, an dem die Eintragung der Ausgliederung in das Register des Sitzes desjenigen Rechtsträgers, dessen Gläubiger sie sind, nach §§ 125, 19 Absatz 3 UmwG bekannt gemacht worden ist, ihren Anspruch nach Grund und Höhe schriftlich anmelden, Sicherheit zu leisten, soweit sie nicht Befriedigung verlangen können. Dieses Recht steht den Gläubigern jedoch nur zu, wenn sie glaubhaft machen, dass durch die Ausgliederung die Erfüllung ihrer Forderung gefährdet wird."
    },
    {
      "date": "2025-06-27",
      "id": "113780",
      "original_text": "Registerbekanntmachung nach dem Umwandlungsgesetz\nHessen Amtsgericht Bad Hersfeld HRB 3356\nBestattungsinstitut Herbstwind GmbH – Bad Hersfeld",
      "type": "Registerbekanntmachung nach dem Umwandlungsgesetz",
      "state": "Hessen",
      "amtsgericht": "Amtsgericht Bad Hersfeld",
      "registernummer": "HRB 3356",
      "registerart": "HRB",
      "company_name": "Bestattungsinstitut Herbstwind GmbH",
      "company_seat": "Bad Hersfeld",
      "details": "27.06.2025 (Bekanntmachungsdatum)\n\nHessen Amtsgericht Bad Hersfeld HRB 3356\nRegisterbekanntmachung nach dem Umwandlungsgesetz 27.06.2025 (Eintragungsdatum)\n\nBestattungsinstitut Herbstwind GmbH\nGesellschaft mit beschränkter Haftung\nBad Hersfeld\n\nDen Gläubigern der an der Ausgliederung beteiligten Rechtsträger ist, wenn sie binnen sechs Monaten nach dem Tag, an dem die Eintragung der Ausgliederung in das Register des Sitzes desjenigen Rechtsträgers, dessen Gläubiger sie sind, nach §§ 125, 19 Absatz 3 UmwG bekannt gemacht worden ist, ihren Anspruch nach Grund und Höhe schriftlich anmelden, Sicherheit zu leisten, soweit sie nicht Befriedigung verlangen können. Dieses Recht steht den Gläubigern jedoch nur zu, wenn sie glaubhaft machen, dass durch die Ausgliederung die Erfüllung ihrer Forderung gefährdet wird."
    },
    {
      "date": "2025-06-27",
      "id": "113781",
      "original_text": "Registerbekanntmachung nach dem Umwandlungsgesetz\nHessen Amtsgericht Fulda HRB 8665\nB&B Superfast GmbH – Fulda",
      "type": "Registerbekanntmachung nach dem Umwandlungsgesetz",
      "state": "Hessen",
      "amtsgericht": "Amtsgericht Fulda",
      "registernummer": "HRB 8665",
      "registerart": "HRB",
      "company_name": "B&B Superfast GmbH",
      "company_seat": "Fulda",
      "details": "27.06.2025 (Bekanntmachungsdatum)\n\nHessen Amtsgericht Fulda HRB 8665\nRegisterbekanntmachung nach dem Umwandlungsgesetz 27.06.2025 (Eintragungsdatum)\n\nB&B Superfast GmbH\nGesellschaft mit beschränkter Haftung\nFulda\n\nDen Gläubigern der an der Verschmelzung beteiligten Rechtsträger ist, wenn sie binnen sechs Monaten nach dem Tag, an dem die Eintragung der Verschmelzung in das Register des Sitzes desjenigen Rechtsträgers, dessen Gläubiger sie sind, nach § 19 Absatz 3 UmwG bekannt gemacht worden ist, ihren Anspruch nach Grund und Höhe schriftlich anmelden, Sicherheit zu leisten, soweit sie nicht Befriedigung verlangen können. Dieses Recht steht den Gläubigern jedoch nur zu, wenn sie glaubhaft machen, dass durch die Verschmelzung die Erfüllung ihrer Forderung gefährdet wird."
    },
    {
      "date": "2025-06-27",
      "id": "113782",
      "original_text": "Einreichung neuer Dokumente\nHessen Amtsgericht Offenbach am Main HRB 34667\nusd AG – Neu-Isenburg",
      "type": "Einreichung neuer Dokumente",
      "state": "Hessen",
      "amtsgericht": "Amtsgericht Offenbach am Main",
      "registernummer": "HRB 34667",
      "registerart": "HRB",
      "company_name": "usd AG",
      "company_seat": "Neu-Isenburg",
      "details": "27.06.2025 (Bekanntmachungsdatum)\n\nHessen Amtsgericht Offenbach am Main HRB 34667\nEinreichung neuer Dokumente 27.06.2025 (Eintragungsdatum)\n\nusd AG\nAktiengesellschaft\nNeu-Isenburg\n\nDurch eine Änderung in den Personen der Aufsichtsratsmitglieder ist eine Liste der Mitglieder des Aufsichtsrates zum Handelsregister eingereicht worden."
    },
    {
      "date": "2025-06-27",
      "id": "113783",
      "original_text": "Löschungsankündigung\nHessen Amtsgericht Frankfurt am Main HRB 101248\nOhwa International GmbH – Frankfurt am Main",
      "type": "Löschungsankündigung",
      "state": "Hessen",
      "amtsgericht": "Amtsgericht Frankfurt am Main",
      "registernummer": "HRB 101248",
      "registerart": "HRB",
      "company_name": "Ohwa International GmbH",
      "company_seat": "Frankfurt am Main",
      "details": "27.06.2025 (Bekanntmachungsdatum)\n\nHessen Amtsgericht Frankfurt am Main HRB 101248\nLöschungsankündigung\n\nOhwa International GmbH\nGesellschaft mit beschränkter Haftung\nFrankfurt am Main\n\nDas Registergericht beabsichtigt die im Handelsregister eingetragene Gesellschaft von Amts wegen nach § 394 FamFG zu löschen. Die Frist zur Erhebung eines Widerspruchs gegen die beabsichtigte Löschung wird auf 3 Monate festgesetzt."
    }
  ]
}