{
  "date": "2025-06-04",
  "date_of_scrape": "2025-06-13T07:55:11.532Z",
  "tool_version": "0.2.0",
  "number_of_announcements": 161,
  "announcements": [
    {
      "date": "2025-06-04",
      "id": "111079",
      "original_text": "Löschungsankündigung\nBayern Amtsgericht München HRB 256574\nBillwall UG (haftungsbeschränkt) – Höhenkirchen-Siegertsbrunn",
      "type": "Löschungsankündigung",
      "state": "Bayern",
      "amtsgericht": "Amtsgericht München",
      "registernummer": "HRB 256574",
      "registerart": "HRB",
      "company_name": "Billwall UG (haftungsbeschränkt)",
      "company_seat": "Höhenkirchen-Siegertsbrunn",
      "details": "04.06.2025 (Bekanntmachungsdatum)\n\nBayern Amtsgericht München HRB 256574\nLöschungsankündigung\n\nBillwall UG (haftungsbeschränkt)\nGesellschaft mit beschränkter Haftung\nHöhenkirchen-Siegertsbrunn\n\nDas Registergericht beabsichtigt, die im Handelsregister eingetragene Firma von Amts wegen nach § 31 Abs. 2 HGB, § 393 FamFG zu löschen. Die Frist zur Erhebung eines Widerspruchs ist auf drei Monate festgesetzt."
    },
    {
      "date": "2025-06-04",
      "id": "111080",
      "original_text": "Registerbekanntmachung nach dem Umwandlungsgesetz\nBayern Amtsgericht Nürnberg HRB 21387\nResultance GmbH – Röthenbach a.d. Pegnitz",
      "type": "Registerbekanntmachung nach dem Umwandlungsgesetz",
      "state": "Bayern",
      "amtsgericht": "Amtsgericht Nürnberg",
      "registernummer": "HRB 21387",
      "registerart": "HRB",
      "company_name": "Resultance GmbH",
      "company_seat": "Röthenbach a.d. Pegnitz",
      "details": "04.06.2025 (Bekanntmachungsdatum)\n\nBayern Amtsgericht Nürnberg HRB 21387\nRegisterbekanntmachung nach dem Umwandlungsgesetz 03.06.2025 (Eintragungsdatum)\n\nResultance GmbH\nGesellschaft mit beschränkter Haftung\nRöthenbach a.d. Pegnitz\n\nDen Gläubigern der an der Verschmelzung beteiligten Rechtsträger ist, wenn sie binnen sechs Monaten nach dem Tag, an dem die Eintragung der Verschmelzung in das Register des Sitzes desjenigen Rechtsträgers, dessen Gläubiger sie sind, nach § 19 Abs. 3 UmwG als bekannt gemacht gilt, ihren Anspruch nach Grund und Höhe in Textform anmelden, Sicherheit zu leisten, soweit sie nicht Befriedigung verlangen können. Dieses Recht steht den Gläubigern jedoch nur zu, wenn sie glaubhaft machen, dass durch die Verschmelzung die Erfüllung ihrer Forderung gefährdet wird."
    },
    {
      "date": "2025-06-04",
      "id": "111081",
      "original_text": "Registerbekanntmachung nach dem Umwandlungsgesetz\nBayern Amtsgericht München HRB 273259\nVeteria Fachtierarzt-Zentrum & Tagesklinik GmbH – München",
      "type": "Registerbekanntmachung nach dem Umwandlungsgesetz",
      "state": "Bayern",
      "amtsgericht": "Amtsgericht München",
      "registernummer": "HRB 273259",
      "registerart": "HRB",
      "company_name": "Veteria Fachtierarzt-Zentrum & Tagesklinik GmbH",
      "company_seat": "München",
      "details": "04.06.2025 (Bekanntmachungsdatum)\n\nBayern Amtsgericht München HRB 273259\nRegisterbekanntmachung nach dem Umwandlungsgesetz 03.06.2025 (Eintragungsdatum)\n\nVeteria Fachtierarzt-Zentrum & Tagesklinik GmbH\nGesellschaft mit beschränkter Haftung\nMünchen\n\nDen Gläubigern der an der Verschmelzung beteiligten Rechtsträger ist, wenn sie binnen sechs Monaten nach dem Tag, an dem die Eintragung der Verschmelzung in das Register des Sitzes desjenigen Rechtsträgers, dessen Gläubiger sie sind, nach § 19 Abs. 3 UmwG als bekannt gemacht gilt, ihren Anspruch nach Grund und Höhe in Textform anmelden, Sicherheit zu leisten, soweit sie nicht Befriedigung verlangen können. Dieses Recht steht den Gläubigern jedoch nur zu, wenn sie glaubhaft machen, dass durch die Verschmelzung die Erfüllung ihrer Forderung gefährdet wird."
    },
    {
      "date": "2025-06-04",
      "id": "111082",
      "original_text": "Registerbekanntmachung nach dem Umwandlungsgesetz\nBayern Amtsgericht München HRB 103977\nHOKAS Beteiligungs GmbH – Pullach i. Isartal",
      "type": "Registerbekanntmachung nach dem Umwandlungsgesetz",
      "state": "Bayern",
      "amtsgericht": "Amtsgericht München",
      "registernummer": "HRB 103977",
      "registerart": "HRB",
      "company_name": "HOKAS Beteiligungs GmbH",
      "company_seat": "Pullach i. Isartal",
      "details": "04.06.2025 (Bekanntmachungsdatum)\n\nBayern Amtsgericht München HRB 103977\nRegisterbekanntmachung nach dem Umwandlungsgesetz 03.06.2025 (Eintragungsdatum)\n\nHOKAS Beteiligungs GmbH\nGesellschaft mit beschränkter Haftung\nPullach i. Isartal\n\nDen Gläubigern der an der Verschmelzung beteiligten Rechtsträger ist, wenn sie binnen sechs Monaten nach dem Tag, an dem die Eintragung der Verschmelzung in das Register des Sitzes desjenigen Rechtsträgers, dessen Gläubiger sie sind, nach § 19 Abs. 3 UmwG als bekannt gemacht gilt, ihren Anspruch nach Grund und Höhe in Textform anmelden, Sicherheit zu leisten, soweit sie nicht Befriedigung verlangen können. Dieses Recht steht den Gläubigern jedoch nur zu, wenn sie glaubhaft machen, dass durch die Verschmelzung die Erfüllung ihrer Forderung gefährdet wird."
    },
    {
      "date": "2025-06-04",
      "id": "111083",
      "original_text": "Einreichung neuer Dokumente\nBayern Amtsgericht Würzburg HRB 161\nStadtwerke Würzburg Aktiengesellschaft – Würzburg",
      "type": "Einreichung neuer Dokumente",
      "state": "Bayern",
      "amtsgericht": "Amtsgericht Würzburg",
      "registernummer": "HRB 161",
      "registerart": "HRB",
      "company_name": "Stadtwerke Würzburg Aktiengesellschaft",
      "company_seat": "Würzburg",
      "details": "04.06.2025 (Bekanntmachungsdatum)\n\nBayern Amtsgericht Würzburg HRB 161\nEinreichung neuer Dokumente 03.06.2025 (Eintragungsdatum)\n\nStadtwerke Würzburg Aktiengesellschaft\nAktiengesellschaft\nWürzburg\n\nDem Amtsgericht Würzburg -Registergericht- ist eine Liste der Mitglieder des Aufsichtsrats eingereicht worden, § 106 AktG."
    },
    {
      "date": "2025-06-04",
      "id": "111084",
      "original_text": "Einreichung neuer Dokumente\nBayern Amtsgericht Würzburg HRB 161\nStadtwerke Würzburg Aktiengesellschaft – Würzburg",
      "type": "Einreichung neuer Dokumente",
      "state": "Bayern",
      "amtsgericht": "Amtsgericht Würzburg",
      "registernummer": "HRB 161",
      "registerart": "HRB",
      "company_name": "Stadtwerke Würzburg Aktiengesellschaft",
      "company_seat": "Würzburg",
      "details": "04.06.2025 (Bekanntmachungsdatum)\n\nBayern Amtsgericht Würzburg HRB 161\nEinreichung neuer Dokumente 03.06.2025 (Eintragungsdatum)\n\nStadtwerke Würzburg Aktiengesellschaft\nAktiengesellschaft\nWürzburg\n\nDem Amtsgericht Würzburg -Registergericht- ist eine Liste der Mitglieder des Aufsichtsrats eingereicht worden, § 106 AktG."
    },
    {
      "date": "2025-06-04",
      "id": "111085",
      "original_text": "Registerbekanntmachung nach dem Umwandlungsgesetz\nBayern Amtsgericht München HRB 266643\nAVA Investment UG (haftungsbeschränkt) – München",
      "type": "Registerbekanntmachung nach dem Umwandlungsgesetz",
      "state": "Bayern",
      "amtsgericht": "Amtsgericht München",
      "registernummer": "HRB 266643",
      "registerart": "HRB",
      "company_name": "AVA Investment UG (haftungsbeschränkt)",
      "company_seat": "München",
      "details": "04.06.2025 (Bekanntmachungsdatum)\n\nBayern Amtsgericht München HRB 266643\nRegisterbekanntmachung nach dem Umwandlungsgesetz 03.06.2025 (Eintragungsdatum)\n\nAVA Investment UG (haftungsbeschränkt)\nGesellschaft mit beschränkter Haftung\nMünchen\n\nDen Gläubigern der an der Verschmelzung beteiligten Rechtsträger ist, wenn sie binnen sechs Monaten nach dem Tag, an dem die Eintragung der Verschmelzung in das Register des Sitzes desjenigen Rechtsträgers, dessen Gläubiger sie sind, nach § 19 Abs. 3 UmwG als bekannt gemacht gilt, ihren Anspruch nach Grund und Höhe in Textform anmelden, Sicherheit zu leisten, soweit sie nicht Befriedigung verlangen können. Dieses Recht steht den Gläubigern jedoch nur zu, wenn sie glaubhaft machen, dass durch die Verschmelzung die Erfüllung ihrer Forderung gefährdet wird."
    },
    {
      "date": "2025-06-04",
      "id": "111086",
      "original_text": "Registerbekanntmachung nach dem Umwandlungsgesetz\nBayern Amtsgericht München HRB 118177\nKOPAS Beteiligungs GmbH – Pullach i. Isartal",
      "type": "Registerbekanntmachung nach dem Umwandlungsgesetz",
      "state": "Bayern",
      "amtsgericht": "Amtsgericht München",
      "registernummer": "HRB 118177",
      "registerart": "HRB",
      "company_name": "KOPAS Beteiligungs GmbH",
      "company_seat": "Pullach i. Isartal",
      "details": "04.06.2025 (Bekanntmachungsdatum)\n\nBayern Amtsgericht München HRB 118177\nRegisterbekanntmachung nach dem Umwandlungsgesetz 03.06.2025 (Eintragungsdatum)\n\nKOPAS Beteiligungs GmbH\nGesellschaft mit beschränkter Haftung\nPullach i. Isartal\n\nDen Gläubigern der an der Verschmelzung beteiligten Rechtsträger ist, wenn sie binnen sechs Monaten nach dem Tag, an dem die Eintragung der Verschmelzung in das Register des Sitzes desjenigen Rechtsträgers, dessen Gläubiger sie sind, nach § 19 Abs. 3 UmwG als bekannt gemacht gilt, ihren Anspruch nach Grund und Höhe in Textform anmelden, Sicherheit zu leisten, soweit sie nicht Befriedigung verlangen können. Dieses Recht steht den Gläubigern jedoch nur zu, wenn sie glaubhaft machen, dass durch die Verschmelzung die Erfüllung ihrer Forderung gefährdet wird."
    },
    {
      "date": "2025-06-04",
      "id": "111087",
      "original_text": "Registerbekanntmachung nach dem Umwandlungsgesetz\nBayern Amtsgericht Traunstein HRB 29788\nTTP Holding GmbH – Rosenheim",
      "type": "Registerbekanntmachung nach dem Umwandlungsgesetz",
      "state": "Bayern",
      "amtsgericht": "Amtsgericht Traunstein",
      "registernummer": "HRB 29788",
      "registerart": "HRB",
      "company_name": "TTP Holding GmbH",
      "company_seat": "Rosenheim",
      "details": "04.06.2025 (Bekanntmachungsdatum)\n\nBayern Amtsgericht Traunstein HRB 29788\nRegisterbekanntmachung nach dem Umwandlungsgesetz 03.06.2025 (Eintragungsdatum)\n\nTTP Holding GmbH\nGesellschaft mit beschränkter Haftung\nRosenheim\n\nDen Gläubigern der an der Verschmelzung beteiligten Rechtsträger ist, wenn sie binnen sechs Monaten nach dem Tag, an dem die Eintragung der Verschmelzung in das Register des Sitzes desjenigen Rechtsträgers, dessen Gläubiger sie sind, nach § 19 Abs. 3 UmwG als bekannt gemacht gilt, ihren Anspruch nach Grund und Höhe in Textform anmelden, Sicherheit zu leisten, soweit sie nicht Befriedigung verlangen können. Dieses Recht steht den Gläubigern jedoch nur zu, wenn sie glaubhaft machen, dass durch die Verschmelzung die Erfüllung ihrer Forderung gefährdet wird."
    },
    {
      "date": "2025-06-04",
      "id": "111088",
      "original_text": "Einreichung neuer Dokumente\nBayern Amtsgericht Kempten (Allgäu) HRB 9948\nrose plastic AG – Hergensweiler",
      "type": "Einreichung neuer Dokumente",
      "state": "Bayern",
      "amtsgericht": "Amtsgericht Kempten (Allgäu)",
      "registernummer": "HRB 9948",
      "registerart": "HRB",
      "company_name": "rose plastic AG",
      "company_seat": "Hergensweiler",
      "details": "04.06.2025 (Bekanntmachungsdatum)\n\nBayern Amtsgericht Kempten (Allgäu) HRB 9948\nEinreichung neuer Dokumente 03.06.2025 (Eintragungsdatum)\n\nrose plastic AG\nAktiengesellschaft\nHergensweiler\n\nDem Amtsgericht Kempten (Allgäu) -Registergericht- ist eine Liste der Mitglieder des Aufsichtsrats eingereicht worden, § 106 AktG."
    },
    {
      "date": "2025-06-04",
      "id": "111089",
      "original_text": "Registerbekanntmachung nach dem Umwandlungsgesetz\nBayern Amtsgericht München HRB 194876\nFANDUS Grundstücks-Vermietungsgesellschaft mbH – Pullach i. Isartal",
      "type": "Registerbekanntmachung nach dem Umwandlungsgesetz",
      "state": "Bayern",
      "amtsgericht": "Amtsgericht München",
      "registernummer": "HRB 194876",
      "registerart": "HRB",
      "company_name": "FANDUS Grundstücks-Vermietungsgesellschaft mbH",
      "company_seat": "Pullach i. Isartal",
      "details": "04.06.2025 (Bekanntmachungsdatum)\n\nBayern Amtsgericht München HRB 194876\nRegisterbekanntmachung nach dem Umwandlungsgesetz 03.06.2025 (Eintragungsdatum)\n\nFANDUS Grundstücks-Vermietungsgesellschaft mbH\nGesellschaft mit beschränkter Haftung\nPullach i. Isartal\n\nDen Gläubigern der an der Verschmelzung beteiligten Rechtsträger ist, wenn sie binnen sechs Monaten nach dem Tag, an dem die Eintragung der Verschmelzung in das Register des Sitzes desjenigen Rechtsträgers, dessen Gläubiger sie sind, nach § 19 Abs. 3 UmwG als bekannt gemacht gilt, ihren Anspruch nach Grund und Höhe in Textform anmelden, Sicherheit zu leisten, soweit sie nicht Befriedigung verlangen können. Dieses Recht steht den Gläubigern jedoch nur zu, wenn sie glaubhaft machen, dass durch die Verschmelzung die Erfüllung ihrer Forderung gefährdet wird."
    },
    {
      "date": "2025-06-04",
      "id": "111090",
      "original_text": "Registerbekanntmachung nach dem Umwandlungsgesetz\nBayern Amtsgericht München HRA 76296\nWM Grundstücksverwaltungs-GmbH & Co. KG – Grünwald",
      "type": "Registerbekanntmachung nach dem Umwandlungsgesetz",
      "state": "Bayern",
      "amtsgericht": "Amtsgericht München",
      "registernummer": "HRA 76296",
      "registerart": "HRA",
      "company_name": "WM Grundstücksverwaltungs-GmbH & Co. KG",
      "company_seat": "Grünwald",
      "details": "04.06.2025 (Bekanntmachungsdatum)\n\nBayern Amtsgericht München HRA 76296\nRegisterbekanntmachung nach dem Umwandlungsgesetz 03.06.2025 (Eintragungsdatum)\n\nWM Grundstücksverwaltungs-GmbH & Co. KG\nKommanditgesellschaft\nGrünwald\n\nDen Gläubigern der an der Verschmelzung beteiligten Rechtsträger ist, wenn sie binnen sechs Monaten nach dem Tag, an dem die Eintragung der Verschmelzung in das Register des Sitzes desjenigen Rechtsträgers, dessen Gläubiger sie sind, nach § 19 Abs. 3 UmwG als bekannt gemacht gilt, ihren Anspruch nach Grund und Höhe in Textform anmelden, Sicherheit zu leisten, soweit sie nicht Befriedigung verlangen können. Dieses Recht steht den Gläubigern jedoch nur zu, wenn sie glaubhaft machen, dass durch die Verschmelzung die Erfüllung ihrer Forderung gefährdet wird."
    },
    {
      "date": "2025-06-04",
      "id": "111091",
      "original_text": "Registerbekanntmachung nach dem Umwandlungsgesetz\nBayern Amtsgericht München HRB 194699\nFENNER Grundstücks-Vermietungsgesellschaft mbH – Pullach i. Isartal",
      "type": "Registerbekanntmachung nach dem Umwandlungsgesetz",
      "state": "Bayern",
      "amtsgericht": "Amtsgericht München",
      "registernummer": "HRB 194699",
      "registerart": "HRB",
      "company_name": "FENNER Grundstücks-Vermietungsgesellschaft mbH",
      "company_seat": "Pullach i. Isartal",
      "details": "04.06.2025 (Bekanntmachungsdatum)\n\nBayern Amtsgericht München HRB 194699\nRegisterbekanntmachung nach dem Umwandlungsgesetz 03.06.2025 (Eintragungsdatum)\n\nFENNER Grundstücks-Vermietungsgesellschaft mbH\nGesellschaft mit beschränkter Haftung\nPullach i. Isartal\n\nDen Gläubigern der an der Verschmelzung beteiligten Rechtsträger ist, wenn sie binnen sechs Monaten nach dem Tag, an dem die Eintragung der Verschmelzung in das Register des Sitzes desjenigen Rechtsträgers, dessen Gläubiger sie sind, nach § 19 Abs. 3 UmwG als bekannt gemacht gilt, ihren Anspruch nach Grund und Höhe in Textform anmelden, Sicherheit zu leisten, soweit sie nicht Befriedigung verlangen können. Dieses Recht steht den Gläubigern jedoch nur zu, wenn sie glaubhaft machen, dass durch die Verschmelzung die Erfüllung ihrer Forderung gefährdet wird."
    },
    {
      "date": "2025-06-04",
      "id": "111092",
      "original_text": "Registerbekanntmachung nach dem Umwandlungsgesetz\nBayern Amtsgericht München HRB 117835\nZULOT Beteiligungs GmbH – Pullach i. Isartal",
      "type": "Registerbekanntmachung nach dem Umwandlungsgesetz",
      "state": "Bayern",
      "amtsgericht": "Amtsgericht München",
      "registernummer": "HRB 117835",
      "registerart": "HRB",
      "company_name": "ZULOT Beteiligungs GmbH",
      "company_seat": "Pullach i. Isartal",
      "details": "04.06.2025 (Bekanntmachungsdatum)\n\nBayern Amtsgericht München HRB 117835\nRegisterbekanntmachung nach dem Umwandlungsgesetz 03.06.2025 (Eintragungsdatum)\n\nZULOT Beteiligungs GmbH\nGesellschaft mit beschränkter Haftung\nPullach i. Isartal\n\nDen Gläubigern der an der Verschmelzung beteiligten Rechtsträger ist, wenn sie binnen sechs Monaten nach dem Tag, an dem die Eintragung der Verschmelzung in das Register des Sitzes desjenigen Rechtsträgers, dessen Gläubiger sie sind, nach § 19 Abs. 3 UmwG als bekannt gemacht gilt, ihren Anspruch nach Grund und Höhe in Textform anmelden, Sicherheit zu leisten, soweit sie nicht Befriedigung verlangen können. Dieses Recht steht den Gläubigern jedoch nur zu, wenn sie glaubhaft machen, dass durch die Verschmelzung die Erfüllung ihrer Forderung gefährdet wird."
    },
    {
      "date": "2025-06-04",
      "id": "111093",
      "original_text": "Registerbekanntmachung nach dem Umwandlungsgesetz\nBayern Amtsgericht München HRB 197074\n2corn Unternehmensberatung GmbH – München",
      "type": "Registerbekanntmachung nach dem Umwandlungsgesetz",
      "state": "Bayern",
      "amtsgericht": "Amtsgericht München",
      "registernummer": "HRB 197074",
      "registerart": "HRB",
      "company_name": "2corn Unternehmensberatung GmbH",
      "company_seat": "München",
      "details": "04.06.2025 (Bekanntmachungsdatum)\n\nBayern Amtsgericht München HRB 197074\nRegisterbekanntmachung nach dem Umwandlungsgesetz 03.06.2025 (Eintragungsdatum)\n\n2corn Unternehmensberatung GmbH\nGesellschaft mit beschränkter Haftung\nMünchen\n\nDen Gläubigern der an der Verschmelzung beteiligten Rechtsträger ist, wenn sie binnen sechs Monaten nach dem Tag, an dem die Eintragung der Verschmelzung in das Register des Sitzes desjenigen Rechtsträgers, dessen Gläubiger sie sind, nach § 19 Abs. 3 UmwG als bekannt gemacht gilt, ihren Anspruch nach Grund und Höhe in Textform anmelden, Sicherheit zu leisten, soweit sie nicht Befriedigung verlangen können. Dieses Recht steht den Gläubigern jedoch nur zu, wenn sie glaubhaft machen, dass durch die Verschmelzung die Erfüllung ihrer Forderung gefährdet wird."
    },
    {
      "date": "2025-06-04",
      "id": "111094",
      "original_text": "Registerbekanntmachung nach dem Umwandlungsgesetz\nBayern Amtsgericht München HRB 171741\nSENARO Verwaltung GmbH – Pullach i. Isartal, Landkreis München",
      "type": "Registerbekanntmachung nach dem Umwandlungsgesetz",
      "state": "Bayern",
      "amtsgericht": "Amtsgericht München",
      "registernummer": "HRB 171741",
      "registerart": "HRB",
      "company_name": "SENARO Verwaltung GmbH",
      "company_seat": "Pullach i. Isartal, Landkreis München",
      "details": "04.06.2025 (Bekanntmachungsdatum)\n\nBayern Amtsgericht München HRB 171741\nRegisterbekanntmachung nach dem Umwandlungsgesetz 03.06.2025 (Eintragungsdatum)\n\nSENARO Verwaltung GmbH\nGesellschaft mit beschränkter Haftung\nPullach i. Isartal, Landkreis München\n\nDen Gläubigern der an der Verschmelzung beteiligten Rechtsträger ist, wenn sie binnen sechs Monaten nach dem Tag, an dem die Eintragung der Verschmelzung in das Register des Sitzes desjenigen Rechtsträgers, dessen Gläubiger sie sind, nach § 19 Abs. 3 UmwG als bekannt gemacht gilt, ihren Anspruch nach Grund und Höhe in Textform anmelden, Sicherheit zu leisten, soweit sie nicht Befriedigung verlangen können. Dieses Recht steht den Gläubigern jedoch nur zu, wenn sie glaubhaft machen, dass durch die Verschmelzung die Erfüllung ihrer Forderung gefährdet wird."
    },
    {
      "date": "2025-06-04",
      "id": "111095",
      "original_text": "Registerbekanntmachung nach dem Umwandlungsgesetz\nBayern Amtsgericht Bamberg HRB 9757\nShabani-Verwaltungs-GmbH – Eggolsheim",
      "type": "Registerbekanntmachung nach dem Umwandlungsgesetz",
      "state": "Bayern",
      "amtsgericht": "Amtsgericht Bamberg",
      "registernummer": "HRB 9757",
      "registerart": "HRB",
      "company_name": "Shabani-Verwaltungs-GmbH",
      "company_seat": "Eggolsheim",
      "details": "04.06.2025 (Bekanntmachungsdatum)\n\nBayern Amtsgericht Bamberg HRB 9757\nRegisterbekanntmachung nach dem Umwandlungsgesetz 03.06.2025 (Eintragungsdatum)\n\nShabani-Verwaltungs-GmbH\nGesellschaft mit beschränkter Haftung\nEggolsheim\n\nDen Gläubigern der an der Verschmelzung beteiligten Rechtsträger ist, wenn sie binnen sechs Monaten nach dem Tag, an dem die Eintragung der Verschmelzung in das Register des Sitzes desjenigen Rechtsträgers, dessen Gläubiger sie sind, nach § 19 Abs. 3 UmwG als bekannt gemacht gilt, ihren Anspruch nach Grund und Höhe in Textform anmelden, Sicherheit zu leisten, soweit sie nicht Befriedigung verlangen können. Dieses Recht steht den Gläubigern jedoch nur zu, wenn sie glaubhaft machen, dass durch die Verschmelzung die Erfüllung ihrer Forderung gefährdet wird."
    },
    {
      "date": "2025-06-04",
      "id": "111096",
      "original_text": "Registerbekanntmachung nach dem Umwandlungsgesetz\nBayern Amtsgericht Memmingen HRB 16964\nAmici del Gusto GmbH – Benningen",
      "type": "Registerbekanntmachung nach dem Umwandlungsgesetz",
      "state": "Bayern",
      "amtsgericht": "Amtsgericht Memmingen",
      "registernummer": "HRB 16964",
      "registerart": "HRB",
      "company_name": "Amici del Gusto GmbH",
      "company_seat": "Benningen",
      "details": "04.06.2025 (Bekanntmachungsdatum)\n\nBayern Amtsgericht Memmingen HRB 16964\nRegisterbekanntmachung nach dem Umwandlungsgesetz 03.06.2025 (Eintragungsdatum)\n\nAmici del Gusto GmbH\nGesellschaft mit beschränkter Haftung\nBenningen\n\nDen Gläubigern des formwechselnden Rechtsträgers ist, wenn sie binnen sechs Monaten nach dem Tag, an dem die Eintragung des Formwechsels nach § 201 UmwG als bekannt gemacht gilt, ihren Anspruch nach Grund und Höhe in Textform anmelden, Sicherheit zu leisten, soweit sie nicht Befriedigung verlangen können. Dieses Recht steht den Gläubigern jedoch nur zu, wenn sie glaubhaft machen, dass durch den Formwechsel die Erfüllung ihrer Forderung gefährdet wird."
    },
    {
      "date": "2025-06-04",
      "id": "111097",
      "original_text": "Registerbekanntmachung nach dem Umwandlungsgesetz\nBayern Amtsgericht München HRB 194696\nFOLANA Grundstücks-Vermietungsgesellschaft mbH – Pullach i. Isartal",
      "type": "Registerbekanntmachung nach dem Umwandlungsgesetz",
      "state": "Bayern",
      "amtsgericht": "Amtsgericht München",
      "registernummer": "HRB 194696",
      "registerart": "HRB",
      "company_name": "FOLANA Grundstücks-Vermietungsgesellschaft mbH",
      "company_seat": "Pullach i. Isartal",
      "details": "04.06.2025 (Bekanntmachungsdatum)\n\nBayern Amtsgericht München HRB 194696\nRegisterbekanntmachung nach dem Umwandlungsgesetz 03.06.2025 (Eintragungsdatum)\n\nFOLANA Grundstücks-Vermietungsgesellschaft mbH\nGesellschaft mit beschränkter Haftung\nPullach i. Isartal\n\nDen Gläubigern der an der Verschmelzung beteiligten Rechtsträger ist, wenn sie binnen sechs Monaten nach dem Tag, an dem die Eintragung der Verschmelzung in das Register des Sitzes desjenigen Rechtsträgers, dessen Gläubiger sie sind, nach § 19 Abs. 3 UmwG als bekannt gemacht gilt, ihren Anspruch nach Grund und Höhe in Textform anmelden, Sicherheit zu leisten, soweit sie nicht Befriedigung verlangen können. Dieses Recht steht den Gläubigern jedoch nur zu, wenn sie glaubhaft machen, dass durch die Verschmelzung die Erfüllung ihrer Forderung gefährdet wird."
    },
    {
      "date": "2025-06-04",
      "id": "111098",
      "original_text": "Einreichung neuer Dokumente\nBayern Amtsgericht Würzburg HRB 3196\nWürzburger Stadtverkehrs-GmbH – Würzburg",
      "type": "Einreichung neuer Dokumente",
      "state": "Bayern",
      "amtsgericht": "Amtsgericht Würzburg",
      "registernummer": "HRB 3196",
      "registerart": "HRB",
      "company_name": "Würzburger Stadtverkehrs-GmbH",
      "company_seat": "Würzburg",
      "details": "04.06.2025 (Bekanntmachungsdatum)\n\nBayern Amtsgericht Würzburg HRB 3196\nEinreichung neuer Dokumente\n\nWürzburger Stadtverkehrs-GmbH\nGesellschaft mit beschränkter Haftung\nWürzburg\n\nDem Amtsgericht Würzburg -Registergericht- ist eine Liste der Mitglieder des Aufsichtsrats eingereicht worden, § 52 Abs. 3 S. 2 GmbHG."
    },
    {
      "date": "2025-06-04",
      "id": "111099",
      "original_text": "Registerbekanntmachung nach dem Umwandlungsgesetz\nBayern Amtsgericht München HRB 139133\nTANIMA Beteiligungs GmbH – Pullach i. Isartal",
      "type": "Registerbekanntmachung nach dem Umwandlungsgesetz",
      "state": "Bayern",
      "amtsgericht": "Amtsgericht München",
      "registernummer": "HRB 139133",
      "registerart": "HRB",
      "company_name": "TANIMA Beteiligungs GmbH",
      "company_seat": "Pullach i. Isartal",
      "details": "04.06.2025 (Bekanntmachungsdatum)\n\nBayern Amtsgericht München HRB 139133\nRegisterbekanntmachung nach dem Umwandlungsgesetz 03.06.2025 (Eintragungsdatum)\n\nTANIMA Beteiligungs GmbH\nGesellschaft mit beschränkter Haftung\nPullach i. Isartal\n\nDen Gläubigern der an der Verschmelzung beteiligten Rechtsträger ist, wenn sie binnen sechs Monaten nach dem Tag, an dem die Eintragung der Verschmelzung in das Register des Sitzes desjenigen Rechtsträgers, dessen Gläubiger sie sind, nach § 19 Abs. 3 UmwG als bekannt gemacht gilt, ihren Anspruch nach Grund und Höhe in Textform anmelden, Sicherheit zu leisten, soweit sie nicht Befriedigung verlangen können. Dieses Recht steht den Gläubigern jedoch nur zu, wenn sie glaubhaft machen, dass durch die Verschmelzung die Erfüllung ihrer Forderung gefährdet wird."
    },
    {
      "date": "2025-06-04",
      "id": "111100",
      "original_text": "Einreichung neuer Dokumente\nBayern Amtsgericht München HRB 129990\nRainer Moelter Filmproduktions-AG – München",
      "type": "Einreichung neuer Dokumente",
      "state": "Bayern",
      "amtsgericht": "Amtsgericht München",
      "registernummer": "HRB 129990",
      "registerart": "HRB",
      "company_name": "Rainer Moelter Filmproduktions-AG",
      "company_seat": "München",
      "details": "04.06.2025 (Bekanntmachungsdatum)\n\nBayern Amtsgericht München HRB 129990\nEinreichung neuer Dokumente 03.06.2025 (Eintragungsdatum)\n\nRainer Moelter Filmproduktions-AG\nAktiengesellschaft\nMünchen\n\nDem Amtsgericht München -Registergericht- ist eine Liste der Mitglieder des Aufsichtsrats eingereicht worden, § 106 AktG."
    },
    {
      "date": "2025-06-04",
      "id": "111101",
      "original_text": "Löschungsankündigung\nBayern Amtsgericht Nürnberg HRB 28269\nPPM-GmbH Project Personal Management – Nürnberg",
      "type": "Löschungsankündigung",
      "state": "Bayern",
      "amtsgericht": "Amtsgericht Nürnberg",
      "registernummer": "HRB 28269",
      "registerart": "HRB",
      "company_name": "PPM-GmbH Project Personal Management",
      "company_seat": "Nürnberg",
      "details": "04.06.2025 (Bekanntmachungsdatum)\n\nBayern Amtsgericht Nürnberg HRB 28269\nLöschungsankündigung\n\nPPM-GmbH Project Personal Management\nGesellschaft mit beschränkter Haftung\nNürnberg\n\nDas Registergericht beabsichtigt, die im Handelsregister eingetragene Gesellschaft wegen Vermögenslosigkeit von Amts wegen nach § 394 FamFG zu löschen. Die Frist zur Erhebung eines Widerspruchs ist auf einen Monat festgesetzt."
    },
    {
      "date": "2025-06-04",
      "id": "111102",
      "original_text": "Einreichung neuer Dokumente\nBayern Amtsgericht München HRB 174760\nHAWE Hydraulik SE – Aschheim",
      "type": "Einreichung neuer Dokumente",
      "state": "Bayern",
      "amtsgericht": "Amtsgericht München",
      "registernummer": "HRB 174760",
      "registerart": "HRB",
      "company_name": "HAWE Hydraulik SE",
      "company_seat": "Aschheim",
      "details": "04.06.2025 (Bekanntmachungsdatum)\n\nBayern Amtsgericht München HRB 174760\nEinreichung neuer Dokumente\n\nHAWE Hydraulik SE\nEuropäische Aktiengesellschaft (SE)\nAschheim\n\nDem Amtsgericht München -Registergericht- ist eine Liste der Mitglieder des Aufsichtsrats eingereicht worden, Art. 9 Abs. 1 Buchst. c (ii) SE-VO i.V.m. § 106 AktG."
    },
    {
      "date": "2025-06-04",
      "id": "111103",
      "original_text": "Registerbekanntmachung nach dem Umwandlungsgesetz\nBayern Amtsgericht München HRB 211964\nSonne/Mond Scheideanstalt GmbH – München",
      "type": "Registerbekanntmachung nach dem Umwandlungsgesetz",
      "state": "Bayern",
      "amtsgericht": "Amtsgericht München",
      "registernummer": "HRB 211964",
      "registerart": "HRB",
      "company_name": "Sonne/Mond Scheideanstalt GmbH",
      "company_seat": "München",
      "details": "04.06.2025 (Bekanntmachungsdatum)\n\nBayern Amtsgericht München HRB 211964\nRegisterbekanntmachung nach dem Umwandlungsgesetz 03.06.2025 (Eintragungsdatum)\n\nSonne/Mond Scheideanstalt GmbH\nGesellschaft mit beschränkter Haftung\nMünchen\n\nDen Gläubigern der an der Verschmelzung beteiligten Rechtsträger ist, wenn sie binnen sechs Monaten nach dem Tag, an dem die Eintragung der Verschmelzung in das Register des Sitzes desjenigen Rechtsträgers, dessen Gläubiger sie sind, nach § 19 Abs. 3 UmwG als bekannt gemacht gilt, ihren Anspruch nach Grund und Höhe in Textform anmelden, Sicherheit zu leisten, soweit sie nicht Befriedigung verlangen können. Dieses Recht steht den Gläubigern jedoch nur zu, wenn sie glaubhaft machen, dass durch die Verschmelzung die Erfüllung ihrer Forderung gefährdet wird."
    },
    {
      "date": "2025-06-04",
      "id": "111104",
      "original_text": "Registerbekanntmachung nach dem Umwandlungsgesetz\nBayern Amtsgericht Hof VR 10508\nAquarien-Vereinigung Wunsiedel-Marktredwitz e.V. – Marktredwitz",
      "type": "Registerbekanntmachung nach dem Umwandlungsgesetz",
      "state": "Bayern",
      "amtsgericht": "Amtsgericht Hof",
      "registernummer": "VR 10508",
      "registerart": "VR",
      "company_name": "Aquarien-Vereinigung Wunsiedel-Marktredwitz e.V.",
      "company_seat": "Marktredwitz",
      "details": "04.06.2025 (Bekanntmachungsdatum)\n\nBayern Amtsgericht Hof VR 10508\nRegisterbekanntmachung nach dem Umwandlungsgesetz 03.06.2025 (Eintragungsdatum)\n\nAquarien-Vereinigung Wunsiedel-Marktredwitz e.V.\neingetragener Verein\nMarktredwitz\n\nDen Gläubigern der an der Verschmelzung beteiligten Rechtsträger ist, wenn sie binnen sechs Monaten nach dem Tag, an dem die Eintragung der Verschmelzung in das Register des Sitzes desjenigen Rechtsträgers, dessen Gläubiger sie sind, nach § 19 Abs. 3 UmwG als bekannt gemacht gilt, ihren Anspruch nach Grund und Höhe in Textform anmelden, Sicherheit zu leisten, soweit sie nicht Befriedigung verlangen können. Dieses Recht steht den Gläubigern jedoch nur zu, wenn sie glaubhaft machen, dass durch die Verschmelzung die Erfüllung ihrer Forderung gefährdet wird."
    },
    {
      "date": "2025-06-04",
      "id": "111105",
      "original_text": "Registerbekanntmachung nach dem Umwandlungsgesetz\nBayern Amtsgericht Würzburg HRB 16529\nCura21 Bayern GmbH – Würzburg",
      "type": "Registerbekanntmachung nach dem Umwandlungsgesetz",
      "state": "Bayern",
      "amtsgericht": "Amtsgericht Würzburg",
      "registernummer": "HRB 16529",
      "registerart": "HRB",
      "company_name": "Cura21 Bayern GmbH",
      "company_seat": "Würzburg",
      "details": "04.06.2025 (Bekanntmachungsdatum)\n\nBayern Amtsgericht Würzburg HRB 16529\nRegisterbekanntmachung nach dem Umwandlungsgesetz 03.06.2025 (Eintragungsdatum)\n\nCura21 Bayern GmbH\nGesellschaft mit beschränkter Haftung\nWürzburg\n\nDen Gläubigern der an der Verschmelzung beteiligten Rechtsträger ist, wenn sie binnen sechs Monaten nach dem Tag, an dem die Eintragung der Verschmelzung in das Register des Sitzes desjenigen Rechtsträgers, dessen Gläubiger sie sind, nach § 19 Abs. 3 UmwG als bekannt gemacht gilt, ihren Anspruch nach Grund und Höhe in Textform anmelden, Sicherheit zu leisten, soweit sie nicht Befriedigung verlangen können. Dieses Recht steht den Gläubigern jedoch nur zu, wenn sie glaubhaft machen, dass durch die Verschmelzung die Erfüllung ihrer Forderung gefährdet wird."
    },
    {
      "date": "2025-06-04",
      "id": "111106",
      "original_text": "Registerbekanntmachung nach dem Umwandlungsgesetz\nBayern Amtsgericht Bamberg HRA 13306\nAgostea Bamberg Inh. Megjit Shabani e.K. – Bamberg",
      "type": "Registerbekanntmachung nach dem Umwandlungsgesetz",
      "state": "Bayern",
      "amtsgericht": "Amtsgericht Bamberg",
      "registernummer": "HRA 13306",
      "registerart": "HRA",
      "company_name": "Agostea Bamberg Inh. Megjit Shabani e.K.",
      "company_seat": "Bamberg",
      "details": "04.06.2025 (Bekanntmachungsdatum)\n\nBayern Amtsgericht Bamberg HRA 13306\nRegisterbekanntmachung nach dem Umwandlungsgesetz 04.06.2025 (Eintragungsdatum)\n\nAgostea Bamberg Inh. Megjit Shabani e.K.\nEinzelkaufmann / Einzelkauffrau\nBamberg\n\nDen Gläubigern der an der Verschmelzung beteiligten Rechtsträger ist, wenn sie binnen sechs Monaten nach dem Tag, an dem die Eintragung der Verschmelzung in das Register des Sitzes desjenigen Rechtsträgers, dessen Gläubiger sie sind, nach § 19 Abs. 3 UmwG als bekannt gemacht gilt, ihren Anspruch nach Grund und Höhe in Textform anmelden, Sicherheit zu leisten, soweit sie nicht Befriedigung verlangen können. Dieses Recht steht den Gläubigern jedoch nur zu, wenn sie glaubhaft machen, dass durch die Verschmelzung die Erfüllung ihrer Forderung gefährdet wird."
    },
    {
      "date": "2025-06-04",
      "id": "111107",
      "original_text": "Registerbekanntmachung nach dem Umwandlungsgesetz\nBaden-Württemberg Amtsgericht Freiburg VR 260242\n\"Kirchliche Sozialstation Elz/Glotter e.V.\" – Denzlingen",
      "type": "Registerbekanntmachung nach dem Umwandlungsgesetz",
      "state": "Baden-Württemberg",
      "amtsgericht": "Amtsgericht Freiburg",
      "registernummer": "VR 260242",
      "registerart": "VR",
      "company_name": "\"Kirchliche Sozialstation Elz/Glotter e.V.\"",
      "company_seat": "Denzlingen",
      "details": "04.06.2025 (Bekanntmachungsdatum)\n\nBaden-Württemberg Amtsgericht Freiburg VR 260242\nRegisterbekanntmachung nach dem Umwandlungsgesetz 04.06.2025 (Eintragungsdatum)\n\n\"Kirchliche Sozialstation Elz/Glotter e.V.\"\neingetragener Verein\nDenzlingen\n\nAls nicht eingetragen wird bekanntgemacht:\nDen Gläubigern des an dem Formwechsel beteiligten Rechtsträgers ist, wenn sie binnen sechs Monaten nach dem Tag, an dem die Eintragung des Formwechsels in das Register des Sitzes desjenigen Rechtsträgers, dessen Gläubiger sie sind, nach § 19 Abs. 3 UmwG als bekanntgemacht gilt, ihren Anspruch nach Grund und Höhe schriftlich anmelden, Sicherheit zu leisten, soweit sie nicht Befriedigung verlangen können. Dieses Recht steht den Gläubigern jedoch nur zu, wenn sie glaubhaft machen, dass durch den Formwechsel die Erfüllung ihrer Forderung gefährdet wird."
    },
    {
      "date": "2025-06-04",
      "id": "111108",
      "original_text": "Registerbekanntmachung nach dem Umwandlungsgesetz\nBaden-Württemberg Amtsgericht Freiburg HRB 733308\nKirchliche Sozialstation Elz/Glotter gGmbH – Denzlingen",
      "type": "Registerbekanntmachung nach dem Umwandlungsgesetz",
      "state": "Baden-Württemberg",
      "amtsgericht": "Amtsgericht Freiburg",
      "registernummer": "HRB 733308",
      "registerart": "HRB",
      "company_name": "Kirchliche Sozialstation Elz/Glotter gGmbH",
      "company_seat": "Denzlingen",
      "details": "04.06.2025 (Bekanntmachungsdatum)\n\nBaden-Württemberg Amtsgericht Freiburg HRB 733308\nRegisterbekanntmachung nach dem Umwandlungsgesetz 04.06.2025 (Eintragungsdatum)\n\nKirchliche Sozialstation Elz/Glotter gGmbH\nGesellschaft mit beschränkter Haftung\nDenzlingen\n\nAls nicht eingetragen wird bekanntgemacht:\nDen Gläubigern des an dem Formwechsel beteiligten Rechtsträgers ist, wenn sie binnen sechs Monaten nach dem Tag, an dem die Eintragung des Formwechsels in das Register des Sitzes desjenigen Rechtsträgers, dessen Gläubiger sie sind, nach § 19 Abs. 3 UmwG als bekanntgemacht gilt, ihren Anspruch nach Grund und Höhe schriftlich anmelden, Sicherheit zu leisten, soweit sie nicht Befriedigung verlangen können. Dieses Recht steht den Gläubigern jedoch nur zu, wenn sie glaubhaft machen, dass durch den Formwechsel die Erfüllung ihrer Forderung gefährdet wird."
    },
    {
      "date": "2025-06-04",
      "id": "111109",
      "original_text": "Registerbekanntmachung nach dem Umwandlungsgesetz\nBaden-Württemberg Amtsgericht Mannheim HRB 505742\nBauer Verwaltungs-GmbH – Engelsbrand",
      "type": "Registerbekanntmachung nach dem Umwandlungsgesetz",
      "state": "Baden-Württemberg",
      "amtsgericht": "Amtsgericht Mannheim",
      "registernummer": "HRB 505742",
      "registerart": "HRB",
      "company_name": "Bauer Verwaltungs-GmbH",
      "company_seat": "Engelsbrand",
      "details": "04.06.2025 (Bekanntmachungsdatum)\n\nBaden-Württemberg Amtsgericht Mannheim HRB 505742\nRegisterbekanntmachung nach dem Umwandlungsgesetz 04.06.2025 (Eintragungsdatum)\n\nBauer Verwaltungs-GmbH\nGesellschaft mit beschränkter Haftung\nEngelsbrand\n\nDen Gläubigern der an der Verschmelzung beteiligten Rechtsträger ist, wenn sie binnen sechs Monaten nach dem Tag, an dem die Eintragung der Verschmelzung in das Register des Sitzes desjenigen Rechtsträgers, dessen Gläubiger sie sind, nach § 19 Abs. 3 UmwG als bekanntgemacht gilt, ihren Anspruch nach Grund und Höhe schriftlich anmelden, Sicherheit zu leisten, soweit sie nicht Befriedigung verlangen können. Dieses Recht steht den Gläubigern jedoch nur zu, wenn sie glaubhaft machen, dass durch die Verschmelzung die Erfüllung ihrer Forderung gefährdet wird."
    },
    {
      "date": "2025-06-04",
      "id": "111110",
      "original_text": "Registerbekanntmachung nach dem Umwandlungsgesetz\nBaden-Württemberg Amtsgericht Freiburg HRA 709063\nFranz Wild OHG – Gengenbach",
      "type": "Registerbekanntmachung nach dem Umwandlungsgesetz",
      "state": "Baden-Württemberg",
      "amtsgericht": "Amtsgericht Freiburg",
      "registernummer": "HRA 709063",
      "registerart": "HRA",
      "company_name": "Franz Wild OHG",
      "company_seat": "Gengenbach",
      "details": "04.06.2025 (Bekanntmachungsdatum)\n\nBaden-Württemberg Amtsgericht Freiburg HRA 709063\nRegisterbekanntmachung nach dem Umwandlungsgesetz 04.06.2025 (Eintragungsdatum)\n\nFranz Wild OHG\nOffene Handelsgesellschaft\nGengenbach\n\nAls nicht eingetragen wird bekanntgemacht:\nDen Gläubigern des an dem Formwechsel beteiligten Rechtsträgers ist, wenn sie binnen sechs Monaten nach dem Tag, an dem die Eintragung des Formwechsels in das Register des Sitzes desjenigen Rechtsträgers, dessen Gläubiger sie sind, nach § 19 Abs. 3 UmwG als bekanntgemacht gilt, ihren Anspruch nach Grund und Höhe schriftlich anmelden, Sicherheit zu leisten, soweit sie nicht Befriedigung verlangen können. Dieses Recht steht den Gläubigern jedoch nur zu, wenn sie glaubhaft machen, dass durch den Formwechsel die Erfüllung ihrer Forderung gefährdet wird."
    },
    {
      "date": "2025-06-04",
      "id": "111111",
      "original_text": "Registerbekanntmachung nach dem Umwandlungsgesetz\nBaden-Württemberg Amtsgericht Mannheim HRB 748745\nBauer Holding GmbH – Engelsbrand",
      "type": "Registerbekanntmachung nach dem Umwandlungsgesetz",
      "state": "Baden-Württemberg",
      "amtsgericht": "Amtsgericht Mannheim",
      "registernummer": "HRB 748745",
      "registerart": "HRB",
      "company_name": "Bauer Holding GmbH",
      "company_seat": "Engelsbrand",
      "details": "04.06.2025 (Bekanntmachungsdatum)\n\nBaden-Württemberg Amtsgericht Mannheim HRB 748745\nRegisterbekanntmachung nach dem Umwandlungsgesetz 04.06.2025 (Eintragungsdatum)\n\nBauer Holding GmbH\nGesellschaft mit beschränkter Haftung\nEngelsbrand\n\nDen Gläubigern der an der Verschmelzung beteiligten Rechtsträger ist, wenn sie binnen sechs Monaten nach dem Tag, an dem die Eintragung der Verschmelzung in das Register des Sitzes desjenigen Rechtsträgers, dessen Gläubiger sie sind, nach § 19 Abs. 3 UmwG als bekanntgemacht gilt, ihren Anspruch nach Grund und Höhe schriftlich anmelden, Sicherheit zu leisten, soweit sie nicht Befriedigung verlangen können. Dieses Recht steht den Gläubigern jedoch nur zu, wenn sie glaubhaft machen, dass durch die Verschmelzung die Erfüllung ihrer Forderung gefährdet wird."
    },
    {
      "date": "2025-06-04",
      "id": "111112",
      "original_text": "Registerbekanntmachung nach dem Umwandlungsgesetz\nBaden-Württemberg Amtsgericht Freiburg HRB 733309\nWILD Schwarzwaldbrennerei & Weingut GmbH – Gengenbach",
      "type": "Registerbekanntmachung nach dem Umwandlungsgesetz",
      "state": "Baden-Württemberg",
      "amtsgericht": "Amtsgericht Freiburg",
      "registernummer": "HRB 733309",
      "registerart": "HRB",
      "company_name": "WILD Schwarzwaldbrennerei & Weingut GmbH",
      "company_seat": "Gengenbach",
      "details": "04.06.2025 (Bekanntmachungsdatum)\n\nBaden-Württemberg Amtsgericht Freiburg HRB 733309\nRegisterbekanntmachung nach dem Umwandlungsgesetz 04.06.2025 (Eintragungsdatum)\n\nWILD Schwarzwaldbrennerei & Weingut GmbH\nGesellschaft mit beschränkter Haftung\nGengenbach\n\nAls nicht eingetragen wird bekanntgemacht:\nDen Gläubigern des an dem Formwechsel beteiligten Rechtsträgers ist, wenn sie binnen sechs Monaten nach dem Tag, an dem die Eintragung des Formwechsels in das Register des Sitzes desjenigen Rechtsträgers, dessen Gläubiger sie sind, nach § 19 Abs. 3 UmwG als bekanntgemacht gilt, ihren Anspruch nach Grund und Höhe schriftlich anmelden, Sicherheit zu leisten, soweit sie nicht Befriedigung verlangen können. Dieses Recht steht den Gläubigern jedoch nur zu, wenn sie glaubhaft machen, dass durch den Formwechsel die Erfüllung ihrer Forderung gefährdet wird."
    },
    {
      "date": "2025-06-04",
      "id": "111113",
      "original_text": "Löschungsankündigung\nBaden-Württemberg Amtsgericht Mannheim HRB 750321\nAktivity Dienstleistung GmbH – Mannheim",
      "type": "Löschungsankündigung",
      "state": "Baden-Württemberg",
      "amtsgericht": "Amtsgericht Mannheim",
      "registernummer": "HRB 750321",
      "registerart": "HRB",
      "company_name": "Aktivity Dienstleistung GmbH",
      "company_seat": "Mannheim",
      "details": "04.06.2025 (Bekanntmachungsdatum)\n\nBaden-Württemberg Amtsgericht Mannheim HRB 750321\nLöschungsankündigung\n\nAktivity Dienstleistung GmbH\nGesellschaft mit beschränkter Haftung\nMannheim\n\nDas Gericht beabsichtigt, die Gesellschaft wegen Vermögenslosigkeit im Handelsregister von Amts wegen nach § 394 FamFG zu löschen. Die Frist zur Geltendmachung eines Widerspruchs gegen die beabsichtigte Löschung ist auf einen Monat ab Veröffentlichung bestimmt."
    },
    {
      "date": "2025-06-04",
      "id": "111114",
      "original_text": "Registerbekanntmachung nach dem Umwandlungsgesetz\nBaden-Württemberg Amtsgericht Stuttgart HRB 738112\nHM Fitness GmbH – Stuttgart",
      "type": "Registerbekanntmachung nach dem Umwandlungsgesetz",
      "state": "Baden-Württemberg",
      "amtsgericht": "Amtsgericht Stuttgart",
      "registernummer": "HRB 738112",
      "registerart": "HRB",
      "company_name": "HM Fitness GmbH",
      "company_seat": "Stuttgart",
      "details": "04.06.2025 (Bekanntmachungsdatum)\n\nBaden-Württemberg Amtsgericht Stuttgart HRB 738112\nRegisterbekanntmachung nach dem Umwandlungsgesetz 04.06.2025 (Eintragungsdatum)\n\nHM Fitness GmbH\nGesellschaft mit beschränkter Haftung\nStuttgart\n\nAls nicht eingetragen wird bekanntgemacht:\nDen Gläubigern der an der Verschmelzung beteiligten Rechtsträger ist, wenn sie binnen sechs Monaten nach dem Tag, an dem die Eintragung der Verschmelzung in das Register des Sitzes desjenigen Rechtsträgers, dessen Gläubiger sie sind, nach § 19 Abs. 3 UmwG als bekanntgemacht gilt, ihren Anspruch nach Grund und Höhe schriftlich anmelden, Sicherheit zu leisten, soweit sie nicht Befriedigung verlangen können. Dieses Recht steht den Gläubigern jedoch nur zu, wenn sie glaubhaft machen, dass durch die Verschmelzung die Erfüllung ihrer Forderung gefährdet wird."
    },
    {
      "date": "2025-06-04",
      "id": "111115",
      "original_text": "Registerbekanntmachung nach dem Umwandlungsgesetz\nSchleswig-Holstein Amtsgericht Flensburg HRB 15585\nuse it AG – Schleswig",
      "type": "Registerbekanntmachung nach dem Umwandlungsgesetz",
      "state": "Schleswig-Holstein",
      "amtsgericht": "Amtsgericht Flensburg",
      "registernummer": "HRB 15585",
      "registerart": "HRB",
      "company_name": "use it AG",
      "company_seat": "Schleswig",
      "details": "04.06.2025 (Bekanntmachungsdatum)\n\nSchleswig-Holstein Amtsgericht Flensburg HRB 15585\nRegisterbekanntmachung nach dem Umwandlungsgesetz\n\nuse it AG\nAktiengesellschaft\nSchleswig\n\nBekanntmachung gemäß § 61 UmwG:\nAls nicht eingetragen wird gemäß § 61 UmwG veröffentlicht:\nDie Gesellschaft hat den Entwurf des Verschmelzungsvertrages zwischen der Gesellschaft als übertragendem Rechtsträger und der use it group GmbH mit Sitz in Schleswig (Amtsgericht Flensburg HRB 13420 FL) als übernehmendem Rechtsträger zum Handelsregister des Amtsgerichts Flensburg eingereicht."
    },
    {
      "date": "2025-06-04",
      "id": "111116",
      "original_text": "Registerbekanntmachung nach dem Umwandlungsgesetz\nBrandenburg Amtsgericht Potsdam HRB 31704\ncomm.bat UG (haftungsbeschränkt) – Luckenwalde",
      "type": "Registerbekanntmachung nach dem Umwandlungsgesetz",
      "state": "Brandenburg",
      "amtsgericht": "Amtsgericht Potsdam",
      "registernummer": "HRB 31704",
      "registerart": "HRB",
      "company_name": "comm.bat UG (haftungsbeschränkt)",
      "company_seat": "Luckenwalde",
      "details": "04.06.2025 (Bekanntmachungsdatum)\n\nBrandenburg Amtsgericht Potsdam HRB 31704\nRegisterbekanntmachung nach dem Umwandlungsgesetz 22.05.2025 (Eintragungsdatum)\n\ncomm.bat UG (haftungsbeschränkt)\nGesellschaft mit beschränkter Haftung\nLuckenwalde\n\nAls nicht eingetragen wird veröffentlicht:\nDen Gläubigern der an der Verschmelzung beteiligten Rechtsträger ist, wenn sie binnen sechs Monaten nach dem Tag, an dem die Eintragung der Verschmelzung in das Register des Sitzes desjenigen Rechtsträgers, dessen Gläubiger sie sind, als bekannt gemacht gilt, ihren Anspruch nach Grund und Höhe schriftlich anmelden, Sicherheit zu leisten, soweit sie nicht Befriedigung verlangen können. Dieses Recht steht den Gläubigern jedoch nur zu, wenn sie glaubhaft machen, dass durch die Verschmelzung die Erfüllung ihrer Forderung gefährdet wird"
    },
    {
      "date": "2025-06-04",
      "id": "111117",
      "original_text": "Löschungsankündigung\nBerlin Amtsgericht Berlin (Charlottenburg) HRB 190788\n13 52 FashionTech GmbH – Berlin",
      "type": "Löschungsankündigung",
      "state": "Berlin",
      "amtsgericht": "Amtsgericht Berlin (Charlottenburg)",
      "registernummer": "HRB 190788",
      "registerart": "HRB",
      "company_name": "13 52 FashionTech GmbH",
      "company_seat": "Berlin",
      "details": "04.06.2025 (Bekanntmachungsdatum)\n\nBerlin Amtsgericht Berlin (Charlottenburg) HRB 190788\nLöschungsankündigung\n\n13 52 FashionTech GmbH\nGesellschaft mit beschränkter Haftung\nBerlin\n\nBei der nachstehenden Gesellschaft wird das Amtslöschungsverfahren gemäß § 394 FamFG eingeleitet. Widerspruchsfrist 6 Wochen"
    },
    {
      "date": "2025-06-04",
      "id": "111118",
      "original_text": "Löschungsankündigung\nBerlin Amtsgericht Berlin (Charlottenburg) HRB 132099\nGraf Dachdeckerei GmbH – Berlin",
      "type": "Löschungsankündigung",
      "state": "Berlin",
      "amtsgericht": "Amtsgericht Berlin (Charlottenburg)",
      "registernummer": "HRB 132099",
      "registerart": "HRB",
      "company_name": "Graf Dachdeckerei GmbH",
      "company_seat": "Berlin",
      "details": "04.06.2025 (Bekanntmachungsdatum)\n\nBerlin Amtsgericht Berlin (Charlottenburg) HRB 132099\nLöschungsankündigung\n\nGraf Dachdeckerei GmbH\nGesellschaft mit beschränkter Haftung\nBerlin\n\nBei der nachstehenden Gesellschaft wird das Amtslöschungsverfahren gemäß § 394 FamFG eingeleitet. Widerspruchsfrist 6 Wochen"
    },
    {
      "date": "2025-06-04",
      "id": "111119",
      "original_text": "Registerbekanntmachung nach dem Umwandlungsgesetz\nHamburg Amtsgericht Hamburg HRB 63197\nENCAVIS AG – Hamburg",
      "type": "Registerbekanntmachung nach dem Umwandlungsgesetz",
      "state": "Hamburg",
      "amtsgericht": "Amtsgericht Hamburg",
      "registernummer": "HRB 63197",
      "registerart": "HRB",
      "company_name": "ENCAVIS AG",
      "company_seat": "Hamburg",
      "details": "04.06.2025 (Bekanntmachungsdatum)\n\nHamburg Amtsgericht Hamburg HRB 63197\nRegisterbekanntmachung nach dem Umwandlungsgesetz\n\nENCAVIS AG\nAktiengesellschaft\nHamburg\n\nDie Gesellschaft hat gemäß § 61 UmwG den Entwurf eines Verschmelzungsvertrages bei dem Handelsregister eingereicht:\nAn der Verschmelzung beteiligte Gesellschaften:\nENCAVIS AG, als übertragende Gesellschaft auf die Elbe BidCo AG, München (AG München, HRB 262997) als übernehmende Gesellschaft."
    },
    {
      "date": "2025-06-04",
      "id": "111120",
      "original_text": "Registerbekanntmachung nach dem Umwandlungsgesetz\nBerlin Amtsgericht Berlin (Charlottenburg) HRB 256115\nQSB Holding GmbH – Berlin",
      "type": "Registerbekanntmachung nach dem Umwandlungsgesetz",
      "state": "Berlin",
      "amtsgericht": "Amtsgericht Berlin (Charlottenburg)",
      "registernummer": "HRB 256115",
      "registerart": "HRB",
      "company_name": "QSB Holding GmbH",
      "company_seat": "Berlin",
      "details": "04.06.2025 (Bekanntmachungsdatum)\n\nBerlin Amtsgericht Berlin (Charlottenburg) HRB 256115\nRegisterbekanntmachung nach dem Umwandlungsgesetz 28.05.2025 (Eintragungsdatum)\n\nQSB Holding GmbH\nGesellschaft mit beschränkter Haftung\nBerlin\n\nDen Gläubigern der an der Verschmelzung beteiligten Rechtsträger ist, wenn sie binnen sechs Monaten nach dem Tag, an dem die Eintragung der Verschmelzung in das Register des Sitzes desjenigen Rechtsträgers, dessen Gläubiger sie sind, als bekannt gemacht gilt, ihren Anspruch nach Grund und Höhe schriftlich anmelden, Sicherheit zu leisten, soweit sie nicht Befriedigung verlangen können. Dieses Recht steht den Gläubigern jedoch nur zu, wenn sie glaubhaft machen, dass durch die Verschmelzung die Erfüllung ihrer Forderung gefährdet wird. Das Recht, Sicherheitsleistung zu verlangen, steht Gläubigern nicht zu, die im Falle der Insolvenz ein Recht auf vorzugsweise Befriedigung aus einer Deckungsmasse haben, die nach gesetzlicher Vorschrift zu ihrem Schutz errichtet und staatlich überwacht ist.Zu Eintragungsnummer 3 vom 28.05.2025 wird als nicht eingetragen veröffentlicht:"
    },
    {
      "date": "2025-06-04",
      "id": "111121",
      "original_text": "Einreichung neuer Dokumente\nBerlin Amtsgericht Berlin (Charlottenburg) HRB 1431\nB Plus Planungs-Aktiengesellschaft – Berlin",
      "type": "Einreichung neuer Dokumente",
      "state": "Berlin",
      "amtsgericht": "Amtsgericht Berlin (Charlottenburg)",
      "registernummer": "HRB 1431",
      "registerart": "HRB",
      "company_name": "B Plus Planungs-Aktiengesellschaft",
      "company_seat": "Berlin",
      "details": "04.06.2025 (Bekanntmachungsdatum)\n\nBerlin Amtsgericht Berlin (Charlottenburg) HRB 1431\nEinreichung neuer Dokumente\n\nB Plus Planungs-Aktiengesellschaft\nAktiengesellschaft\nBerlin\n\nAls nicht eingetragen wird veröffentlicht: Es wurde eine neue Liste der Aufsichtsratsmitglieder eingereicht (§ 106 AktG)."
    },
    {
      "date": "2025-06-04",
      "id": "111122",
      "original_text": "Registerbekanntmachung nach dem Umwandlungsgesetz\nBerlin Amtsgericht Berlin (Charlottenburg) HRB 79392\nCollignon Planung GmbH – Berlin",
      "type": "Registerbekanntmachung nach dem Umwandlungsgesetz",
      "state": "Berlin",
      "amtsgericht": "Amtsgericht Berlin (Charlottenburg)",
      "registernummer": "HRB 79392",
      "registerart": "HRB",
      "company_name": "Collignon Planung GmbH",
      "company_seat": "Berlin",
      "details": "04.06.2025 (Bekanntmachungsdatum)\n\nBerlin Amtsgericht Berlin (Charlottenburg) HRB 79392\nRegisterbekanntmachung nach dem Umwandlungsgesetz 30.05.2025 (Eintragungsdatum)\n\nCollignon Planung GmbH\nGesellschaft mit beschränkter Haftung\nBerlin\n\nZu Eintragungsnummer 11 vom 30.05.2025 wird als nicht eingetragen veröffentlicht: Den Gläubigern der an der Verschmelzung beteiligten Rechtsträger ist, wenn sie binnen sechs Monaten nach dem Tag, an dem die Eintragung der Verschmelzung in das Register des Sitzes desjenigen Rechtsträgers, dessen Gläubiger sie sind, als bekannt gemacht gilt, ihren Anspruch nach Grund und Höhe schriftlich anmelden, Sicherheit zu leisten, soweit sie nicht Befriedigung verlangen können. Dieses Recht steht den Gläubigern jedoch nur zu, wenn sie glaubhaft machen, dass durch die Verschmelzung die Erfüllung ihrer Forderung gefährdet wird. Das Recht, Sicherheitsleistung zu verlangen, steht Gläubigern nicht zu, die im Falle der Insolvenz ein Recht auf vorzugsweise Befriedigung aus einer Deckungsmasse haben, die nach gesetzlicher Vorschrift zu ihrem Schutz errichtet und staatlich überwacht ist."
    },
    {
      "date": "2025-06-04",
      "id": "111123",
      "original_text": "Sonstige Registerbekanntmachung\nBaden-Württemberg Amtsgericht Ulm HRB 552249\nVBS Verkehrsbetriebe Schussental Verwaltungs-GmbH – Ravensburg",
      "type": "Sonstige Registerbekanntmachung",
      "state": "Baden-Württemberg",
      "amtsgericht": "Amtsgericht Ulm",
      "registernummer": "HRB 552249",
      "registerart": "HRB",
      "company_name": "VBS Verkehrsbetriebe Schussental Verwaltungs-GmbH",
      "company_seat": "Ravensburg",
      "details": "04.06.2025 (Bekanntmachungsdatum)\n\nBaden-Württemberg Amtsgericht Ulm HRB 552249\nSonstige Registerbekanntmachung\n\nVBS Verkehrsbetriebe Schussental Verwaltungs-GmbH\nGesellschaft mit beschränkter Haftung\nRavensburg\n\nDie Gesellschaft hat am 03.06.2025 die Liste über die Zusammensetzung des Aufsichtsrats zum Handelsregister eingereicht."
    },
    {
      "date": "2025-06-04",
      "id": "111124",
      "original_text": "Registerbekanntmachung nach dem Umwandlungsgesetz\nBrandenburg Amtsgericht Cottbus HRB 18701\nKaden Küchen GmbH – Königs Wusterhausen",
      "type": "Registerbekanntmachung nach dem Umwandlungsgesetz",
      "state": "Brandenburg",
      "amtsgericht": "Amtsgericht Cottbus",
      "registernummer": "HRB 18701",
      "registerart": "HRB",
      "company_name": "Kaden Küchen GmbH",
      "company_seat": "Königs Wusterhausen",
      "details": "04.06.2025 (Bekanntmachungsdatum)\n\nBrandenburg Amtsgericht Cottbus HRB 18701\nRegisterbekanntmachung nach dem Umwandlungsgesetz 03.06.2025 (Eintragungsdatum)\n\nKaden Küchen GmbH\nGesellschaft mit beschränkter Haftung\nKönigs Wusterhausen\n\nZu Eintragungsnummer 2 vom 03.06.2025 wird als nicht eingetragen veröffentlicht:\nDen Gläubigern der an der Ausgliederung beteiligten Rechtsträger ist, wenn sie binnen sechs Monaten nach dem Tag, an dem die Eintragung der Ausgliederung in das Register des Sitzes desjenigen Rechtsträgers, dessen Gläubiger sie sind, als bekannt gemacht gilt, ihren Anspruch nach Grund und Höhe schriftlich anmelden, Sicherheit zu leisten, soweit sie nicht Befriedigung verlangen können. Dieses Recht steht den Gläubigern jedoch nur zu, wenn sie glaubhaft machen, dass durch die Ausgleiderung die Erfüllung ihrer Forderung gefährdet wird"
    },
    {
      "date": "2025-06-04",
      "id": "111125",
      "original_text": "Registerbekanntmachung nach dem Umwandlungsgesetz\nBaden-Württemberg Amtsgericht Ulm HRB 733062\ncf Fitness Wangen GmbH – Wangen im Allgäu",
      "type": "Registerbekanntmachung nach dem Umwandlungsgesetz",
      "state": "Baden-Württemberg",
      "amtsgericht": "Amtsgericht Ulm",
      "registernummer": "HRB 733062",
      "registerart": "HRB",
      "company_name": "cf Fitness Wangen GmbH",
      "company_seat": "Wangen im Allgäu",
      "details": "04.06.2025 (Bekanntmachungsdatum)\n\nBaden-Württemberg Amtsgericht Ulm HRB 733062\nRegisterbekanntmachung nach dem Umwandlungsgesetz 04.06.2025 (Eintragungsdatum)\n\ncf Fitness Wangen GmbH\nGesellschaft mit beschränkter Haftung\nWangen im Allgäu\n\nAls nicht eingetragen wird bekanntgemacht:\nDen Gläubigern der an der Verschmelzung beteiligten Rechtsträger ist, wenn sie binnen sechs Monaten nach dem Tag, an dem die Eintragung der Verschmelzung in das Register des Sitzes desjenigen Rechtsträgers, dessen Gläubiger sie sind, nach § 19 Abs. 3 UmwG als bekanntgemacht gilt, ihren Anspruch nach Grund und Höhe schriftlich anmelden, Sicherheit zu leisten, soweit sie nicht Befriedigung verlangen können. Dieses Recht steht den Gläubigern jedoch nur zu, wenn sie glaubhaft machen, dass durch die Verschmelzung die Erfüllung ihrer Forderung gefährdet wird."
    },
    {
      "date": "2025-06-04",
      "id": "111126",
      "original_text": "Löschungsankündigung\nBrandenburg Amtsgericht Potsdam HRB 36901\nGhostwhale Games GmbH – Potsdam",
      "type": "Löschungsankündigung",
      "state": "Brandenburg",
      "amtsgericht": "Amtsgericht Potsdam",
      "registernummer": "HRB 36901",
      "registerart": "HRB",
      "company_name": "Ghostwhale Games GmbH",
      "company_seat": "Potsdam",
      "details": "04.06.2025 (Bekanntmachungsdatum)\n\nBrandenburg Amtsgericht Potsdam HRB 36901\nLöschungsankündigung\n\nGhostwhale Games GmbH\nGesellschaft mit beschränkter Haftung\nPotsdam\n\nBei der nachstehenden Gesellschaft wird das Amtslöschungsverfahren gemäß § 394 FamFG eingeleitet."
    },
    {
      "date": "2025-06-04",
      "id": "111127",
      "original_text": "Registerbekanntmachung nach dem Umwandlungsgesetz\nBaden-Württemberg Amtsgericht Ulm HRB 731987\ncf Fitness Ravensburg GmbH – Ravensburg",
      "type": "Registerbekanntmachung nach dem Umwandlungsgesetz",
      "state": "Baden-Württemberg",
      "amtsgericht": "Amtsgericht Ulm",
      "registernummer": "HRB 731987",
      "registerart": "HRB",
      "company_name": "cf Fitness Ravensburg GmbH",
      "company_seat": "Ravensburg",
      "details": "04.06.2025 (Bekanntmachungsdatum)\n\nBaden-Württemberg Amtsgericht Ulm HRB 731987\nRegisterbekanntmachung nach dem Umwandlungsgesetz 04.06.2025 (Eintragungsdatum)\n\ncf Fitness Ravensburg GmbH\nGesellschaft mit beschränkter Haftung\nRavensburg\n\nAls nicht eingetragen wird bekanntgemacht:\nDen Gläubigern der an der Verschmelzung beteiligten Rechtsträger ist, wenn sie binnen sechs Monaten nach dem Tag, an dem die Eintragung der Verschmelzung in das Register des Sitzes desjenigen Rechtsträgers, dessen Gläubiger sie sind, nach § 19 Abs. 3 UmwG als bekanntgemacht gilt, ihren Anspruch nach Grund und Höhe schriftlich anmelden, Sicherheit zu leisten, soweit sie nicht Befriedigung verlangen können. Dieses Recht steht den Gläubigern jedoch nur zu, wenn sie glaubhaft machen, dass durch die Verschmelzung die Erfüllung ihrer Forderung gefährdet wird."
    },
    {
      "date": "2025-06-04",
      "id": "111128",
      "original_text": "Registerbekanntmachung nach dem Umwandlungsgesetz\nBaden-Württemberg Amtsgericht Stuttgart HRB 762316\nExyte Europe Holding GmbH – Stuttgart",
      "type": "Registerbekanntmachung nach dem Umwandlungsgesetz",
      "state": "Baden-Württemberg",
      "amtsgericht": "Amtsgericht Stuttgart",
      "registernummer": "HRB 762316",
      "registerart": "HRB",
      "company_name": "Exyte Europe Holding GmbH",
      "company_seat": "Stuttgart",
      "details": "04.06.2025 (Bekanntmachungsdatum)\n\nBaden-Württemberg Amtsgericht Stuttgart HRB 762316\nRegisterbekanntmachung nach dem Umwandlungsgesetz 04.06.2025 (Eintragungsdatum)\n\nExyte Europe Holding GmbH\nGesellschaft mit beschränkter Haftung\nStuttgart\n\nAls nicht eingetragen wird bekanntgemacht:\nDen Gläubigern der an der Verschmelzung beteiligten Rechtsträger ist, wenn sie binnen sechs Monaten nach dem Tag, an dem die Eintragung der Verschmelzung in das Register des Sitzes desjenigen Rechtsträgers, dessen Gläubiger sie sind, nach § 19 Abs. 3 UmwG als bekanntgemacht gilt, ihren Anspruch nach Grund und Höhe schriftlich anmelden, Sicherheit zu leisten, soweit sie nicht Befriedigung verlangen können. Dieses Recht steht den Gläubigern jedoch nur zu, wenn sie glaubhaft machen, dass durch die Verschmelzung die Erfüllung ihrer Forderung gefährdet wird."
    },
    {
      "date": "2025-06-04",
      "id": "111129",
      "original_text": "Registerbekanntmachung nach dem Umwandlungsgesetz\nBaden-Württemberg Amtsgericht Ulm HRB 731062\ncf Fitness Laupheim GmbH – Laupheim",
      "type": "Registerbekanntmachung nach dem Umwandlungsgesetz",
      "state": "Baden-Württemberg",
      "amtsgericht": "Amtsgericht Ulm",
      "registernummer": "HRB 731062",
      "registerart": "HRB",
      "company_name": "cf Fitness Laupheim GmbH",
      "company_seat": "Laupheim",
      "details": "04.06.2025 (Bekanntmachungsdatum)\n\nBaden-Württemberg Amtsgericht Ulm HRB 731062\nRegisterbekanntmachung nach dem Umwandlungsgesetz 04.06.2025 (Eintragungsdatum)\n\ncf Fitness Laupheim GmbH\nGesellschaft mit beschränkter Haftung\nLaupheim\n\nAls nicht eingetragen wird bekanntgemacht:\nDen Gläubigern der an der Verschmelzung beteiligten Rechtsträger ist, wenn sie binnen sechs Monaten nach dem Tag, an dem die Eintragung der Verschmelzung in das Register des Sitzes desjenigen Rechtsträgers, dessen Gläubiger sie sind, nach § 19 Abs. 3 UmwG als bekanntgemacht gilt, ihren Anspruch nach Grund und Höhe schriftlich anmelden, Sicherheit zu leisten, soweit sie nicht Befriedigung verlangen können. Dieses Recht steht den Gläubigern jedoch nur zu, wenn sie glaubhaft machen, dass durch die Verschmelzung die Erfüllung ihrer Forderung gefährdet wird."
    },
    {
      "date": "2025-06-04",
      "id": "111130",
      "original_text": "Registerbekanntmachung nach dem Umwandlungsgesetz\nHamburg Amtsgericht Hamburg HRB 150614\nKHB Holding GmbH – Hamburg",
      "type": "Registerbekanntmachung nach dem Umwandlungsgesetz",
      "state": "Hamburg",
      "amtsgericht": "Amtsgericht Hamburg",
      "registernummer": "HRB 150614",
      "registerart": "HRB",
      "company_name": "KHB Holding GmbH",
      "company_seat": "Hamburg",
      "details": "04.06.2025 (Bekanntmachungsdatum)\n\nHamburg Amtsgericht Hamburg HRB 150614\nRegisterbekanntmachung nach dem Umwandlungsgesetz 04.06.2025 (Eintragungsdatum)\n\nKHB Holding GmbH\nGesellschaft mit beschränkter Haftung\nHamburg\n\nAls nicht eingetragen wird bekannt gemacht:\nDen Gläubigern der an der Verschmelzung beteiligten Gesellschaften ist, wenn sie binnen sechs Monaten nach dem Tag, an dem die Eintragung der Verschmelzung in das Register des Sitzes desjenigen Rechtsträgers, dessen Gläubiger sie sind, nach § 19 Absatz 3 UmwG als bekannt gemacht gilt, ihren Anspruch nach Grund und Höhe schriftlich anmelden, Sicherheit zu leisten, soweit sie nicht Befriedigung verlangen können. Dieses Recht steht den Gläubigern jedoch nur zu, wenn sie glaubhaft machen, dass durch die Verschmelzung die Erfüllung ihrer Forderung gefährdet wird."
    },
    {
      "date": "2025-06-04",
      "id": "111131",
      "original_text": "Registerbekanntmachung nach dem Umwandlungsgesetz\nHamburg Amtsgericht Hamburg HRB 150760\nRedpont GmbH – Hamburg",
      "type": "Registerbekanntmachung nach dem Umwandlungsgesetz",
      "state": "Hamburg",
      "amtsgericht": "Amtsgericht Hamburg",
      "registernummer": "HRB 150760",
      "registerart": "HRB",
      "company_name": "Redpont GmbH",
      "company_seat": "Hamburg",
      "details": "04.06.2025 (Bekanntmachungsdatum)\n\nHamburg Amtsgericht Hamburg HRB 150760\nRegisterbekanntmachung nach dem Umwandlungsgesetz 04.06.2025 (Eintragungsdatum)\n\nRedpont GmbH\nGesellschaft mit beschränkter Haftung\nHamburg\n\nAls nicht eingetragen wird bekannt gemacht:\nDen Gläubigern der an der Verschmelzung beteiligten Gesellschaften ist, wenn sie binnen sechs Monaten nach dem Tag, an dem die Eintragung der Verschmelzung in das Register des Sitzes desjenigen Rechtsträgers, dessen Gläubiger sie sind, nach § 19 Absatz 3 UmwG als bekannt gemacht gilt, ihren Anspruch nach Grund und Höhe schriftlich anmelden, Sicherheit zu leisten, soweit sie nicht Befriedigung verlangen können. Dieses Recht steht den Gläubigern jedoch nur zu, wenn sie glaubhaft machen, dass durch die Verschmelzung die Erfüllung ihrer Forderung gefährdet wird."
    },
    {
      "date": "2025-06-04",
      "id": "111132",
      "original_text": "Sonstige Registerbekanntmachung\nBaden-Württemberg Amtsgericht Ulm HRB 2776\nTWB-Technische Werke Blaubeuren GmbH – Blaubeuren",
      "type": "Sonstige Registerbekanntmachung",
      "state": "Baden-Württemberg",
      "amtsgericht": "Amtsgericht Ulm",
      "registernummer": "HRB 2776",
      "registerart": "HRB",
      "company_name": "TWB-Technische Werke Blaubeuren GmbH",
      "company_seat": "Blaubeuren",
      "details": "04.06.2025 (Bekanntmachungsdatum)\n\nBaden-Württemberg Amtsgericht Ulm HRB 2776\nSonstige Registerbekanntmachung\n\nTWB-Technische Werke Blaubeuren GmbH\nGesellschaft mit beschränkter Haftung\nBlaubeuren\n\nDie Gesellschaft hat am 03.06.2025 die Liste über die Zusammensetzung des Aufsichtsrats zum Handelsregister eingereicht."
    },
    {
      "date": "2025-06-04",
      "id": "111133",
      "original_text": "Registerbekanntmachung nach dem Umwandlungsgesetz\nBerlin Amtsgericht Berlin (Charlottenburg) HRB 63321\nZahnklinik Medeco Berlin-Dahlem Beteiligungs GmbH – Berlin",
      "type": "Registerbekanntmachung nach dem Umwandlungsgesetz",
      "state": "Berlin",
      "amtsgericht": "Amtsgericht Berlin (Charlottenburg)",
      "registernummer": "HRB 63321",
      "registerart": "HRB",
      "company_name": "Zahnklinik Medeco Berlin-Dahlem Beteiligungs GmbH",
      "company_seat": "Berlin",
      "details": "04.06.2025 (Bekanntmachungsdatum)\n\nBerlin Amtsgericht Berlin (Charlottenburg) HRB 63321\nRegisterbekanntmachung nach dem Umwandlungsgesetz 03.06.2025 (Eintragungsdatum)\n\nZahnklinik Medeco Berlin-Dahlem Beteiligungs GmbH\nGesellschaft mit beschränkter Haftung\nBerlin\n\nZu Eintragungsnummer 3 vom 03.06.2025 wird als nicht eingetragen veröffentlicht: Den Gläubigern der an der Verschmelzung beteiligten Rechtsträger ist, wenn sie binnen sechs Monaten nach dem Tag, an dem die Eintragung der Verschmelzung in das Register des Sitzes desjenigen Rechtsträgers, dessen Gläubiger sie sind, als bekannt gemacht gilt, ihren Anspruch nach Grund und Höhe schriftlich anmelden, Sicherheit zu leisten, soweit sie nicht Befriedigung verlangen können. Dieses Recht steht den Gläubigern jedoch nur zu, wenn sie glaubhaft machen, dass durch die Verschmelzung die Erfüllung ihrer Forderung gefährdet wird. Das Recht, Sicherheitsleistung zu verlangen, steht Gläubigern nicht zu, die im Falle der Insolvenz ein Recht auf vorzugsweise Befriedigung aus einer Deckungsmasse haben, die nach gesetzlicher Vorschrift zu ihrem Schutz errichtet und staatlich überwacht ist."
    },
    {
      "date": "2025-06-04",
      "id": "111134",
      "original_text": "Registerbekanntmachung nach dem Umwandlungsgesetz\nBaden-Württemberg Amtsgericht Stuttgart HRA 742181\nHonorar Finanzberatung Staiger e.K. – Dietingen",
      "type": "Registerbekanntmachung nach dem Umwandlungsgesetz",
      "state": "Baden-Württemberg",
      "amtsgericht": "Amtsgericht Stuttgart",
      "registernummer": "HRA 742181",
      "registerart": "HRA",
      "company_name": "Honorar Finanzberatung Staiger e.K.",
      "company_seat": "Dietingen",
      "details": "04.06.2025 (Bekanntmachungsdatum)\n\nBaden-Württemberg Amtsgericht Stuttgart HRA 742181\nRegisterbekanntmachung nach dem Umwandlungsgesetz 04.06.2025 (Eintragungsdatum)\n\nHonorar Finanzberatung Staiger e.K.\nEinzelkaufmann / Einzelkauffrau\nDietingen\n\nAls nicht eingetragen wird bekanntgemacht:\nDen Gläubigern der an der Ausgliederung beteiligten Rechtsträger ist, wenn sie binnen sechs Monaten nach dem Tag, an dem die Eintragung der Ausgliederung in das Register des Sitzes desjenigen Rechtsträgers, dessen Gläubiger sie sind, nach § 19 Abs. 3 UmwG als bekanntgemacht gilt, ihren Anspruch nach Grund und Höhe schriftlich anmelden, Sicherheit zu leisten, soweit sie nicht Befriedigung verlangen können. Dieses Recht steht den Gläubigern jedoch nur zu, wenn sie glaubhaft machen, dass durch die Ausgliederung die Erfüllung ihrer Forderung gefährdet wird."
    },
    {
      "date": "2025-06-04",
      "id": "111135",
      "original_text": "Registerbekanntmachung nach dem Umwandlungsgesetz\nBaden-Württemberg Amtsgericht Stuttgart HRA 742223\nStaiger Versicherungsmakler GmbH & Co. KG – Dietingen",
      "type": "Registerbekanntmachung nach dem Umwandlungsgesetz",
      "state": "Baden-Württemberg",
      "amtsgericht": "Amtsgericht Stuttgart",
      "registernummer": "HRA 742223",
      "registerart": "HRA",
      "company_name": "Staiger Versicherungsmakler GmbH & Co. KG",
      "company_seat": "Dietingen",
      "details": "04.06.2025 (Bekanntmachungsdatum)\n\nBaden-Württemberg Amtsgericht Stuttgart HRA 742223\nRegisterbekanntmachung nach dem Umwandlungsgesetz 04.06.2025 (Eintragungsdatum)\n\nStaiger Versicherungsmakler GmbH & Co. KG\nKommanditgesellschaft\nDietingen\n\nAls nicht eingetragen wird bekanntgemacht:\nDen Gläubigern der an der Ausgliederung beteiligten Rechtsträger ist, wenn sie binnen sechs Monaten nach dem Tag, an dem die Eintragung der Ausgliederung in das Register des Sitzes desjenigen Rechtsträgers, dessen Gläubiger sie sind, nach § 19 Abs. 3 UmwG als bekanntgemacht gilt, ihren Anspruch nach Grund und Höhe schriftlich anmelden, Sicherheit zu leisten, soweit sie nicht Befriedigung verlangen können. Dieses Recht steht den Gläubigern jedoch nur zu, wenn sie glaubhaft machen, dass durch die Ausgliederung die Erfüllung ihrer Forderung gefährdet wird."
    },
    {
      "date": "2025-06-04",
      "id": "111136",
      "original_text": "Registerbekanntmachung nach dem Umwandlungsgesetz\nBerlin Amtsgericht Berlin (Charlottenburg) HRB 198736\nZAHNKLINIKEN - IN - BERLIN-Dahlem Verwaltungs GmbH – Berlin",
      "type": "Registerbekanntmachung nach dem Umwandlungsgesetz",
      "state": "Berlin",
      "amtsgericht": "Amtsgericht Berlin (Charlottenburg)",
      "registernummer": "HRB 198736",
      "registerart": "HRB",
      "company_name": "ZAHNKLINIKEN - IN - BERLIN-Dahlem Verwaltungs GmbH",
      "company_seat": "Berlin",
      "details": "04.06.2025 (Bekanntmachungsdatum)\n\nBerlin Amtsgericht Berlin (Charlottenburg) HRB 198736\nRegisterbekanntmachung nach dem Umwandlungsgesetz 03.06.2025 (Eintragungsdatum)\n\nZAHNKLINIKEN - IN - BERLIN-Dahlem Verwaltungs GmbH\nGesellschaft mit beschränkter Haftung\nBerlin\n\nZu Eintragungsnummer 2 vom 03.06.2025 wird als nicht eingetragen veröffentlicht: Den Gläubigern der an der Verschmelzung beteiligten Rechtsträger ist, wenn sie binnen sechs Monaten nach dem Tag, an dem die Eintragung der Verschmelzung in das Register des Sitzes desjenigen Rechtsträgers, dessen Gläubiger sie sind, als bekannt gemacht gilt, ihren Anspruch nach Grund und Höhe schriftlich anmelden, Sicherheit zu leisten, soweit sie nicht Befriedigung verlangen können. Dieses Recht steht den Gläubigern jedoch nur zu, wenn sie glaubhaft machen, dass durch die Verschmelzung die Erfüllung ihrer Forderung gefährdet wird. Das Recht, Sicherheitsleistung zu verlangen, steht Gläubigern nicht zu, die im Falle der Insolvenz ein Recht auf vorzugsweise Befriedigung aus einer Deckungsmasse haben, die nach gesetzlicher Vorschrift zu ihrem Schutz errichtet und staatlich überwacht ist."
    },
    {
      "date": "2025-06-04",
      "id": "111137",
      "original_text": "Löschungsankündigung\nThüringen Amtsgericht Jena HRB 512665\nsleeptime UG (haftungsbeschränkt) – Gotha",
      "type": "Löschungsankündigung",
      "state": "Thüringen",
      "amtsgericht": "Amtsgericht Jena",
      "registernummer": "HRB 512665",
      "registerart": "HRB",
      "company_name": "sleeptime UG (haftungsbeschränkt)",
      "company_seat": "Gotha",
      "details": "04.06.2025 (Bekanntmachungsdatum)\n\nThüringen Amtsgericht Jena HRB 512665\nLöschungsankündigung\n\nsleeptime UG (haftungsbeschränkt)\nGesellschaft mit beschränkter Haftung\nGotha\n\nDas Registergericht beabsichtigt, die im Handelsregister eingetragene Gesellschaft wegen Vermögenslosigkeit nach § 394 FamFG von Amts wegen zu löschen. Die Frist zur Erhebung eines Widerspruchs gegen die beabsichtigte Löschung wird auf 6 Wochen festgesetzt."
    },
    {
      "date": "2025-06-04",
      "id": "111138",
      "original_text": "Registerbekanntmachung nach dem Umwandlungsgesetz\nThüringen Amtsgericht Jena HRB 113226\nSTERNAUTO Erfurt GmbH – Erfurt",
      "type": "Registerbekanntmachung nach dem Umwandlungsgesetz",
      "state": "Thüringen",
      "amtsgericht": "Amtsgericht Jena",
      "registernummer": "HRB 113226",
      "registerart": "HRB",
      "company_name": "STERNAUTO Erfurt GmbH",
      "company_seat": "Erfurt",
      "details": "04.06.2025 (Bekanntmachungsdatum)\n\nThüringen Amtsgericht Jena HRB 113226\nRegisterbekanntmachung nach dem Umwandlungsgesetz 04.06.2025 (Eintragungsdatum)\n\nSTERNAUTO Erfurt GmbH\nGesellschaft mit beschränkter Haftung\nErfurt\n\nNicht eingetragen: Den Gläubigern der an der Verschmelzung beteiligten Rechtsträger, ist wenn sie binnen sechs Monaten nach dem Tag, an dem die Eintragung der Verschmelzung in das Register des Sitzes desjenigen Rechtsträgers, dessen Gläubiger sie sind,  nach § 19 Abs. 3 UmwG als bekanntgemacht gilt, ihren Anspruch nach Grund und Höhe schriftlich anmelden, Sicherheit zu leisten, soweit sie nicht Befriedigung verlangen können. Dieses Recht steht ihnen jedoch nur zu, wenn sie glaubhaft machen, daß durch die Verschmelzung die Erfüllung ihrer Forderung gefährdet wird."
    },
    {
      "date": "2025-06-04",
      "id": "111139",
      "original_text": "Einreichung neuer Dokumente\nThüringen Amtsgericht Jena HRB 517688\nTreuenburg Real Estate AG – Erfurt",
      "type": "Einreichung neuer Dokumente",
      "state": "Thüringen",
      "amtsgericht": "Amtsgericht Jena",
      "registernummer": "HRB 517688",
      "registerart": "HRB",
      "company_name": "Treuenburg Real Estate AG",
      "company_seat": "Erfurt",
      "details": "04.06.2025 (Bekanntmachungsdatum)\n\nThüringen Amtsgericht Jena HRB 517688\nEinreichung neuer Dokumente\n\nTreuenburg Real Estate AG\nAktiengesellschaft\nErfurt\n\nBekanntmachung gem. § 106 AktG: Aufgrund einer Veränderung in den Personen der Aufsichtsratsmitglieder ist durch den Vorstand eine neue Liste zum Handelsregister eingereicht worden."
    },
    {
      "date": "2025-06-04",
      "id": "111140",
      "original_text": "Löschungsankündigung\nThüringen Amtsgericht Jena HRB 306345\nLivemold Trading GmbH – Breitungen",
      "type": "Löschungsankündigung",
      "state": "Thüringen",
      "amtsgericht": "Amtsgericht Jena",
      "registernummer": "HRB 306345",
      "registerart": "HRB",
      "company_name": "Livemold Trading GmbH",
      "company_seat": "Breitungen",
      "details": "04.06.2025 (Bekanntmachungsdatum)\n\nThüringen Amtsgericht Jena HRB 306345\nLöschungsankündigung\n\nLivemold Trading GmbH\nGesellschaft mit beschränkter Haftung\nBreitungen\n\nDas Registergericht beabsichtigt, die im Handelsregister eingetragene Gesellschaft wegen Vermögenslosigkeit nach § 394 FamFG von Amts wegen zu löschen. Die Frist zur Erhebung eines Widerspruchs gegen die beabsichtigte Löschung wird auf 6 Wochen festgesetzt."
    },
    {
      "date": "2025-06-04",
      "id": "111141",
      "original_text": "Löschungsankündigung\nBerlin Amtsgericht Berlin (Charlottenburg) HRA 52504\nFirst easytec LTD & Co. KG – Berlin",
      "type": "Löschungsankündigung",
      "state": "Berlin",
      "amtsgericht": "Amtsgericht Berlin (Charlottenburg)",
      "registernummer": "HRA 52504",
      "registerart": "HRA",
      "company_name": "First easytec LTD & Co. KG",
      "company_seat": "Berlin",
      "details": "04.06.2025 (Bekanntmachungsdatum)\n\nBerlin Amtsgericht Berlin (Charlottenburg) HRA 52504\nLöschungsankündigung\n\nFirst easytec LTD & Co. KG\nKommanditgesellschaft\nBerlin\n\nBei dem nachstehenden Unternehmen / der nachstehenden Gesellschaft wird das Amtslöschungsverfahren gemäß § 31 Abs. 2 HGB eingeleitet. Widerspruchsfrist 1 Monat"
    },
    {
      "date": "2025-06-04",
      "id": "111142",
      "original_text": "Löschungsankündigung\nBaden-Württemberg Amtsgericht Mannheim HRB 711866\nRatioCheck GmbH – Eberbach",
      "type": "Löschungsankündigung",
      "state": "Baden-Württemberg",
      "amtsgericht": "Amtsgericht Mannheim",
      "registernummer": "HRB 711866",
      "registerart": "HRB",
      "company_name": "RatioCheck GmbH",
      "company_seat": "Eberbach",
      "details": "04.06.2025 (Bekanntmachungsdatum)\n\nBaden-Württemberg Amtsgericht Mannheim HRB 711866\nLöschungsankündigung\n\nRatioCheck GmbH\nGesellschaft mit beschränkter Haftung\nEberbach\n\nDas Gericht beabsichtigt, die Gesellschaft wegen Vermögenslosigkeit im Handelsregister von Amts wegen nach § 394 FamFG zu löschen. Die Frist zur Geltendmachung eines Widerspruchs gegen die beabsichtigte Löschung ist auf einen Monat ab Veröffentlichung bestimmt."
    },
    {
      "date": "2025-06-04",
      "id": "111143",
      "original_text": "Löschungsankündigung\nBerlin Amtsgericht Berlin (Charlottenburg) HRA 55511\nA-1 Petroleum-SPOP-1. Handels GmbH & Co. KG – Berlin",
      "type": "Löschungsankündigung",
      "state": "Berlin",
      "amtsgericht": "Amtsgericht Berlin (Charlottenburg)",
      "registernummer": "HRA 55511",
      "registerart": "HRA",
      "company_name": "A-1 Petroleum-SPOP-1. Handels GmbH & Co. KG",
      "company_seat": "Berlin",
      "details": "04.06.2025 (Bekanntmachungsdatum)\n\nBerlin Amtsgericht Berlin (Charlottenburg) HRA 55511\nLöschungsankündigung\n\nA-1 Petroleum-SPOP-1. Handels GmbH & Co. KG\nKommanditgesellschaft\nBerlin\n\nBei dem nachstehenden Unternehmen / der nachstehenden Gesellschaft wird das Amtslöschungsverfahren gemäß § 31 Abs. 2 HGB eingeleitet. Widerspruchsfrist 6 Wochen"
    },
    {
      "date": "2025-06-04",
      "id": "111144",
      "original_text": "Einreichung neuer Dokumente\nSaarland Amtsgericht Saarbrücken HRB 91933\nLEBENSHILFEWERK IM KREIS NEUNKIRCHEN gemeinnützige GmbH – Neunkirchen",
      "type": "Einreichung neuer Dokumente",
      "state": "Saarland",
      "amtsgericht": "Amtsgericht Saarbrücken",
      "registernummer": "HRB 91933",
      "registerart": "HRB",
      "company_name": "LEBENSHILFEWERK IM KREIS NEUNKIRCHEN gemeinnützige GmbH",
      "company_seat": "Neunkirchen",
      "details": "04.06.2025 (Bekanntmachungsdatum)\n\nSaarland Amtsgericht Saarbrücken HRB 91933\nEinreichung neuer Dokumente\n\nLEBENSHILFEWERK IM KREIS NEUNKIRCHEN gemeinnützige GmbH\nGesellschaft mit beschränkter Haftung\nNeunkirchen\n\nDie Geschäftsführung der Gesellschaft hat eine Liste der Mitglieder des Aufsichtsrats zum Handelsregister eingereicht (§ 52 Abs. 3 Satz 2 GmbHG)."
    },
    {
      "date": "2025-06-04",
      "id": "111145",
      "original_text": "Löschungsankündigung\nBerlin Amtsgericht Berlin (Charlottenburg) HRB 260978\nProgress Projektbau GmbH – Berlin",
      "type": "Löschungsankündigung",
      "state": "Berlin",
      "amtsgericht": "Amtsgericht Berlin (Charlottenburg)",
      "registernummer": "HRB 260978",
      "registerart": "HRB",
      "company_name": "Progress Projektbau GmbH",
      "company_seat": "Berlin",
      "details": "04.06.2025 (Bekanntmachungsdatum)\n\nBerlin Amtsgericht Berlin (Charlottenburg) HRB 260978\nLöschungsankündigung\n\nProgress Projektbau GmbH\nGesellschaft mit beschränkter Haftung\nBerlin\n\nBei der nachstehenden Gesellschaft wird das Amtslöschungsverfahren gemäß § 394 FamFG eingeleitet. Widerspruchsfrist 6 Wochen"
    },
    {
      "date": "2025-06-04",
      "id": "111146",
      "original_text": "Registerbekanntmachung nach dem Umwandlungsgesetz\nBaden-Württemberg Amtsgericht Stuttgart HRA 727053\nTUTBUS GmbH & Co. KG – Tuttlingen",
      "type": "Registerbekanntmachung nach dem Umwandlungsgesetz",
      "state": "Baden-Württemberg",
      "amtsgericht": "Amtsgericht Stuttgart",
      "registernummer": "HRA 727053",
      "registerart": "HRA",
      "company_name": "TUTBUS GmbH & Co. KG",
      "company_seat": "Tuttlingen",
      "details": "04.06.2025 (Bekanntmachungsdatum)\n\nBaden-Württemberg Amtsgericht Stuttgart HRA 727053\nRegisterbekanntmachung nach dem Umwandlungsgesetz 04.06.2025 (Eintragungsdatum)\n\nTUTBUS GmbH & Co. KG\nKommanditgesellschaft\nTuttlingen\n\nAls nicht eingetragen wird bekanntgemacht:\nDen Gläubigern der an der Verschmelzung beteiligten Rechtsträger ist, wenn sie binnen sechs Monaten nach dem Tag, an dem die Eintragung der Verschmelzung in das Register des Sitzes desjenigen Rechtsträgers, dessen Gläubiger sie sind, nach § 19 Abs. 3 UmwG als bekanntgemacht gilt, ihren Anspruch nach Grund und Höhe schriftlich anmelden, Sicherheit zu leisten, soweit sie nicht Befriedigung verlangen können. Dieses Recht steht den Gläubigern jedoch nur zu, wenn sie glaubhaft machen, dass durch die Verschmelzung die Erfüllung ihrer Forderung gefährdet wird."
    },
    {
      "date": "2025-06-04",
      "id": "111147",
      "original_text": "Einreichung neuer Dokumente\nSaarland Amtsgericht Saarbrücken HRB 14935\nCFK - Centrum für Freizeit und Kommunikation der Lebenshilfe gemeinnützige Gesellschaft mit beschränkter Haftung – Spiesen-Elversberg",
      "type": "Einreichung neuer Dokumente",
      "state": "Saarland",
      "amtsgericht": "Amtsgericht Saarbrücken",
      "registernummer": "HRB 14935",
      "registerart": "HRB",
      "company_name": "CFK - Centrum für Freizeit und Kommunikation der Lebenshilfe gemeinnützige Gesellschaft mit beschränkter Haftung",
      "company_seat": "Spiesen-Elversberg",
      "details": "04.06.2025 (Bekanntmachungsdatum)\n\nSaarland Amtsgericht Saarbrücken HRB 14935\nEinreichung neuer Dokumente\n\nCFK - Centrum für Freizeit und Kommunikation der Lebenshilfe gemeinnützige Gesellschaft mit beschränkter Haftung\nGesellschaft mit beschränkter Haftung\nSpiesen-Elversberg\n\nDie Geschäftsführung der Gesellschaft hat eine Liste der Mitglieder des Aufsichtsrats zum Handelsregister eingereicht (§ 52 Abs. 3 Satz 2 GmbHG)."
    },
    {
      "date": "2025-06-04",
      "id": "111148",
      "original_text": "Registerbekanntmachung nach dem Umwandlungsgesetz\nBerlin Amtsgericht Berlin (Charlottenburg) HRB 84201\nSCHOLZ & FRIENDS Berlin GmbH – Berlin",
      "type": "Registerbekanntmachung nach dem Umwandlungsgesetz",
      "state": "Berlin",
      "amtsgericht": "Amtsgericht Berlin (Charlottenburg)",
      "registernummer": "HRB 84201",
      "registerart": "HRB",
      "company_name": "SCHOLZ & FRIENDS Berlin GmbH",
      "company_seat": "Berlin",
      "details": "04.06.2025 (Bekanntmachungsdatum)\n\nBerlin Amtsgericht Berlin (Charlottenburg) HRB 84201\nRegisterbekanntmachung nach dem Umwandlungsgesetz 03.06.2025 (Eintragungsdatum)\n\nSCHOLZ & FRIENDS Berlin GmbH\nGesellschaft mit beschränkter Haftung\nBerlin\n\nZu Eintragungsnummer 37 vom 03.06.2025 wird als nicht eingetragen veröffentlicht:Den Gläubigern der an der Verschmelzung beteiligten Rechtsträger ist, wenn sie binnen sechs Monaten nach dem Tag, an dem die Eintragung der Verschmelzung in das Register des Sitzes desjenigen Rechtsträgers, dessen Gläubiger sie sind, als bekannt gemacht gilt, ihren Anspruch nach Grund und Höhe schriftlich anmelden, Sicherheit zu leisten, soweit sie nicht Befriedigung verlangen können. Dieses Recht steht den Gläubigern jedoch nur zu, wenn sie glaubhaft machen, dass durch die Verschmelzung die Erfüllung ihrer Forderung gefährdet wird. Das Recht, Sicherheitsleistung zu verlangen, steht Gläubigern nicht zu, die im Falle der Insolvenz ein Recht auf vorzugsweise Befriedigung aus einer Deckungsmasse haben, die nach gesetzlicher Vorschrift zu ihrem Schutz errichtet und staatlich überwacht ist."
    },
    {
      "date": "2025-06-04",
      "id": "111149",
      "original_text": "Löschungsankündigung\nSchleswig-Holstein Amtsgericht Flensburg HRB 2675\nUlrich Rotermund Verwaltungsgesellschaft mbH – Flensburg",
      "type": "Löschungsankündigung",
      "state": "Schleswig-Holstein",
      "amtsgericht": "Amtsgericht Flensburg",
      "registernummer": "HRB 2675",
      "registerart": "HRB",
      "company_name": "Ulrich Rotermund Verwaltungsgesellschaft mbH",
      "company_seat": "Flensburg",
      "details": "04.06.2025 (Bekanntmachungsdatum)\n\nSchleswig-Holstein Amtsgericht Flensburg HRB 2675\nLöschungsankündigung\n\nUlrich Rotermund Verwaltungsgesellschaft mbH\nGesellschaft mit beschränkter Haftung\nFlensburg\n\nEs ist die Löschung der nachstehenden Gesellschaft wegen Vermögenslosigkeit gemäß § 394 FamFG beabsichtigt.\nWiderspruchsfrist: 2 Monate."
    },
    {
      "date": "2025-06-04",
      "id": "111150",
      "original_text": "Löschungsankündigung\nBerlin Amtsgericht Berlin (Charlottenburg) HRB 229314\nAk Tobacco GmbH – Berlin",
      "type": "Löschungsankündigung",
      "state": "Berlin",
      "amtsgericht": "Amtsgericht Berlin (Charlottenburg)",
      "registernummer": "HRB 229314",
      "registerart": "HRB",
      "company_name": "Ak Tobacco GmbH",
      "company_seat": "Berlin",
      "details": "04.06.2025 (Bekanntmachungsdatum)\n\nBerlin Amtsgericht Berlin (Charlottenburg) HRB 229314\nLöschungsankündigung\n\nAk Tobacco GmbH\nGesellschaft mit beschränkter Haftung\nBerlin\n\nBei der nachstehenden Gesellschaft wird das Amtslöschungsverfahren gemäß § 394 FamFG eingeleitet. Widerspruchsfrist 6 Wochen"
    },
    {
      "date": "2025-06-04",
      "id": "111151",
      "original_text": "Löschungsankündigung\nBerlin Amtsgericht Berlin (Charlottenburg) HRA 45811\nAutohaus Osta GmbH & Co. KG – Berlin",
      "type": "Löschungsankündigung",
      "state": "Berlin",
      "amtsgericht": "Amtsgericht Berlin (Charlottenburg)",
      "registernummer": "HRA 45811",
      "registerart": "HRA",
      "company_name": "Autohaus Osta GmbH & Co. KG",
      "company_seat": "Berlin",
      "details": "04.06.2025 (Bekanntmachungsdatum)\n\nBerlin Amtsgericht Berlin (Charlottenburg) HRA 45811\nLöschungsankündigung\n\nAutohaus Osta GmbH & Co. KG\nKommanditgesellschaft\nBerlin\n\nBei dem nachstehenden Unternehmen / der nachstehenden Gesellschaft wird das Amtslöschungsverfahren gemäß § 31 Abs. 2 HGB eingeleitet. Widerspruchsfrist 6 Wochen"
    },
    {
      "date": "2025-06-04",
      "id": "111152",
      "original_text": "Löschungsankündigung\nBerlin Amtsgericht Berlin (Charlottenburg) HRB 153308\nSara Gesundheitszentrum GmbH – Berlin",
      "type": "Löschungsankündigung",
      "state": "Berlin",
      "amtsgericht": "Amtsgericht Berlin (Charlottenburg)",
      "registernummer": "HRB 153308",
      "registerart": "HRB",
      "company_name": "Sara Gesundheitszentrum GmbH",
      "company_seat": "Berlin",
      "details": "04.06.2025 (Bekanntmachungsdatum)\n\nBerlin Amtsgericht Berlin (Charlottenburg) HRB 153308\nLöschungsankündigung\n\nSara Gesundheitszentrum GmbH\nGesellschaft mit beschränkter Haftung\nBerlin\n\nBei der nachstehenden Gesellschaft wird das Amtslöschungsverfahren gemäß § 394 FamFG eingeleitet. Widerspruchsfrist 6 Wochen"
    },
    {
      "date": "2025-06-04",
      "id": "111153",
      "original_text": "Registerbekanntmachung nach dem Umwandlungsgesetz\nBaden-Württemberg Amtsgericht Stuttgart HRB 761400\ncf Fitness Kornwestheim GmbH – Kornwestheim",
      "type": "Registerbekanntmachung nach dem Umwandlungsgesetz",
      "state": "Baden-Württemberg",
      "amtsgericht": "Amtsgericht Stuttgart",
      "registernummer": "HRB 761400",
      "registerart": "HRB",
      "company_name": "cf Fitness Kornwestheim GmbH",
      "company_seat": "Kornwestheim",
      "details": "04.06.2025 (Bekanntmachungsdatum)\n\nBaden-Württemberg Amtsgericht Stuttgart HRB 761400\nRegisterbekanntmachung nach dem Umwandlungsgesetz 04.06.2025 (Eintragungsdatum)\n\ncf Fitness Kornwestheim GmbH\nGesellschaft mit beschränkter Haftung\nKornwestheim\n\nDen Gläubigern der an der Verschmelzung beteiligten Rechtsträger ist, wenn sie binnen sechs Monaten nach dem Tag, an dem die Eintragung der Verschmelzung in das Register des Sitzes desjenigen Rechtsträgers, dessen Gläubiger sie sind, nach § 19 Abs. 3 UmwG als bekanntgemacht gilt, ihren Anspruch nach Grund und Höhe schriftlich anmelden, Sicherheit zu leisten, soweit sie nicht Befriedigung verlangen können. Dieses Recht steht den Gläubigern jedoch nur zu, wenn sie glaubhaft machen, dass durch die Verschmelzung die Erfüllung ihrer Forderung gefährdet wird."
    },
    {
      "date": "2025-06-04",
      "id": "111154",
      "original_text": "Löschungsankündigung\nBerlin Amtsgericht Berlin (Charlottenburg) HRA 56276\nUnicorn-Ice UG (haftungsbeschränkt) & Co. KG – Berlin",
      "type": "Löschungsankündigung",
      "state": "Berlin",
      "amtsgericht": "Amtsgericht Berlin (Charlottenburg)",
      "registernummer": "HRA 56276",
      "registerart": "HRA",
      "company_name": "Unicorn-Ice UG (haftungsbeschränkt) & Co. KG",
      "company_seat": "Berlin",
      "details": "04.06.2025 (Bekanntmachungsdatum)\n\nBerlin Amtsgericht Berlin (Charlottenburg) HRA 56276\nLöschungsankündigung\n\nUnicorn-Ice UG (haftungsbeschränkt) & Co. KG\nKommanditgesellschaft\nBerlin\n\nBei dem nachstehenden Unternehmen / der nachstehenden Gesellschaft wird das Amtslöschungsverfahren gemäß § 31 Abs. 2 HGB eingeleitet. Widerspruchsfrist 1 Monat"
    },
    {
      "date": "2025-06-04",
      "id": "111155",
      "original_text": "Sonstige Registerbekanntmachung\nBaden-Württemberg Amtsgericht Ulm HRB 501555\nCarl Zeiss AG – Oberkochen",
      "type": "Sonstige Registerbekanntmachung",
      "state": "Baden-Württemberg",
      "amtsgericht": "Amtsgericht Ulm",
      "registernummer": "HRB 501555",
      "registerart": "HRB",
      "company_name": "Carl Zeiss AG",
      "company_seat": "Oberkochen",
      "details": "04.06.2025 (Bekanntmachungsdatum)\n\nBaden-Württemberg Amtsgericht Ulm HRB 501555\nSonstige Registerbekanntmachung\n\nCarl Zeiss AG\nAktiengesellschaft\nOberkochen\n\nDie Gesellschaft hat am 04.06.2025 die Liste über die Zusammensetzung des Aufsichtsrats zum Handelsregister eingereicht."
    },
    {
      "date": "2025-06-04",
      "id": "111156",
      "original_text": "Einreichung neuer Dokumente\nBrandenburg Amtsgericht Potsdam HRB 10169\nDEUTSCHES ROTES KREUZ-Behindertenwerkstätten Potsdam gGmbH – Potsdam",
      "type": "Einreichung neuer Dokumente",
      "state": "Brandenburg",
      "amtsgericht": "Amtsgericht Potsdam",
      "registernummer": "HRB 10169",
      "registerart": "HRB",
      "company_name": "DEUTSCHES ROTES KREUZ-Behindertenwerkstätten Potsdam gGmbH",
      "company_seat": "Potsdam",
      "details": "04.06.2025 (Bekanntmachungsdatum)\n\nBrandenburg Amtsgericht Potsdam HRB 10169\nEinreichung neuer Dokumente\n\nDEUTSCHES ROTES KREUZ-Behindertenwerkstätten Potsdam gGmbH\nGesellschaft mit beschränkter Haftung\nPotsdam\n\nAls nicht eingetragen wird veröffentlicht: Eine Liste der Mitglieder des Aufsichtsrates wurde zum Handelsregister eingereicht."
    },
    {
      "date": "2025-06-04",
      "id": "111157",
      "original_text": "Sonstige Registerbekanntmachung\nHamburg Amtsgericht Hamburg HRB 159357\nSunnic Lighthouse Solar Invest 6 GmbH – Hamburg",
      "type": "Sonstige Registerbekanntmachung",
      "state": "Hamburg",
      "amtsgericht": "Amtsgericht Hamburg",
      "registernummer": "HRB 159357",
      "registerart": "HRB",
      "company_name": "Sunnic Lighthouse Solar Invest 6 GmbH",
      "company_seat": "Hamburg",
      "details": "04.06.2025 (Bekanntmachungsdatum)\n\nHamburg Amtsgericht Hamburg HRB 159357\nSonstige Registerbekanntmachung 04.06.2025 (Eintragungsdatum)\n\nSunnic Lighthouse Solar Invest 6 GmbH\nGesellschaft mit beschränkter Haftung\nHamburg\n\nAls nicht eingetragen wird bekannt gemacht:  Den Gläubigern der Gesellschaft, deren Forderungen begründet worden sind, bevor die Eintragung der Vertragsbeendigung in das Handelsregister nach § 10 HGB als bekannt gemacht gilt, ist vom anderen Vertragsteil Sicherheit zu leisten, wenn sie sich binnen 6 Monaten nach Bekanntmachung der Eintragung zu diesem Zweck bei ihm melden."
    },
    {
      "date": "2025-06-04",
      "id": "111158",
      "original_text": "Sonstige Registerbekanntmachung\nHamburg Amtsgericht Hamburg HRB 159358\nSunnic Lighthouse Solar Invest 7 GmbH – Hamburg",
      "type": "Sonstige Registerbekanntmachung",
      "state": "Hamburg",
      "amtsgericht": "Amtsgericht Hamburg",
      "registernummer": "HRB 159358",
      "registerart": "HRB",
      "company_name": "Sunnic Lighthouse Solar Invest 7 GmbH",
      "company_seat": "Hamburg",
      "details": "04.06.2025 (Bekanntmachungsdatum)\n\nHamburg Amtsgericht Hamburg HRB 159358\nSonstige Registerbekanntmachung 04.06.2025 (Eintragungsdatum)\n\nSunnic Lighthouse Solar Invest 7 GmbH\nGesellschaft mit beschränkter Haftung\nHamburg\n\nAls nicht eingetragen wird bekannt gemacht:  Den Gläubigern der Gesellschaft, deren Forderungen begründet worden sind, bevor die Eintragung der Vertragsbeendigung in das Handelsregister nach § 10 HGB als bekannt gemacht gilt, ist vom anderen Vertragsteil Sicherheit zu leisten, wenn sie sich binnen 6 Monaten nach Bekanntmachung der Eintragung zu diesem Zweck bei ihm melden."
    },
    {
      "date": "2025-06-04",
      "id": "111159",
      "original_text": "Einreichung neuer Dokumente\nSchleswig-Holstein Amtsgericht Pinneberg HRB 8122\nSchleswig-Holstein Netz Beteiligungs-AG – Quickborn/Krs. Pinneberg",
      "type": "Einreichung neuer Dokumente",
      "state": "Schleswig-Holstein",
      "amtsgericht": "Amtsgericht Pinneberg",
      "registernummer": "HRB 8122",
      "registerart": "HRB",
      "company_name": "Schleswig-Holstein Netz Beteiligungs-AG",
      "company_seat": "Quickborn/Krs. Pinneberg",
      "details": "04.06.2025 (Bekanntmachungsdatum)\n\nSchleswig-Holstein Amtsgericht Pinneberg HRB 8122\nEinreichung neuer Dokumente\n\nSchleswig-Holstein Netz Beteiligungs-AG\nAktiengesellschaft\nQuickborn/Krs. Pinneberg\n\nAls nicht eingetragen wird veröffentlicht: Es wurde eine neue Liste der Aufsichtsratsmitglieder gem. § 106 AktG zum Handelsregister eingereicht."
    },
    {
      "date": "2025-06-04",
      "id": "111160",
      "original_text": "Einreichung neuer Dokumente\nBerlin Amtsgericht Berlin (Charlottenburg) HRB 205362\nBrau- und Genusswerkstatt Berlin-Friedrichshagen AG – Berlin",
      "type": "Einreichung neuer Dokumente",
      "state": "Berlin",
      "amtsgericht": "Amtsgericht Berlin (Charlottenburg)",
      "registernummer": "HRB 205362",
      "registerart": "HRB",
      "company_name": "Brau- und Genusswerkstatt Berlin-Friedrichshagen AG",
      "company_seat": "Berlin",
      "details": "04.06.2025 (Bekanntmachungsdatum)\n\nBerlin Amtsgericht Berlin (Charlottenburg) HRB 205362\nEinreichung neuer Dokumente\n\nBrau- und Genusswerkstatt Berlin-Friedrichshagen AG\nAktiengesellschaft\nBerlin\n\nAls nicht eingetragen wird veröffentlicht: Es wurde eine neue Liste der Aufsichtsratsmitglieder eingereicht (§ 106 AktG)."
    },
    {
      "date": "2025-06-04",
      "id": "111161",
      "original_text": "Einreichung neuer Dokumente\nBerlin Amtsgericht Berlin (Charlottenburg) HRB 239455\nBling Services GmbH – Berlin",
      "type": "Einreichung neuer Dokumente",
      "state": "Berlin",
      "amtsgericht": "Amtsgericht Berlin (Charlottenburg)",
      "registernummer": "HRB 239455",
      "registerart": "HRB",
      "company_name": "Bling Services GmbH",
      "company_seat": "Berlin",
      "details": "04.06.2025 (Bekanntmachungsdatum)\n\nBerlin Amtsgericht Berlin (Charlottenburg) HRB 239455\nEinreichung neuer Dokumente\n\nBling Services GmbH\nGesellschaft mit beschränkter Haftung\nBerlin\n\nAls nicht eingetragen wird veröffentlicht: Es wurde eine neue Liste der Beiratsmitglieder eingereicht (§52 III GmbHG)."
    },
    {
      "date": "2025-06-04",
      "id": "111162",
      "original_text": "Registerbekanntmachung nach dem Umwandlungsgesetz\nBaden-Württemberg Amtsgericht Stuttgart HRB 774677\nFitness United Winnenden GmbH – Winnenden",
      "type": "Registerbekanntmachung nach dem Umwandlungsgesetz",
      "state": "Baden-Württemberg",
      "amtsgericht": "Amtsgericht Stuttgart",
      "registernummer": "HRB 774677",
      "registerart": "HRB",
      "company_name": "Fitness United Winnenden GmbH",
      "company_seat": "Winnenden",
      "details": "04.06.2025 (Bekanntmachungsdatum)\n\nBaden-Württemberg Amtsgericht Stuttgart HRB 774677\nRegisterbekanntmachung nach dem Umwandlungsgesetz 04.06.2025 (Eintragungsdatum)\n\nFitness United Winnenden GmbH\nGesellschaft mit beschränkter Haftung\nWinnenden\n\nDen Gläubigern der an der Verschmelzung beteiligten Rechtsträger ist, wenn sie binnen sechs Monaten nach dem Tag, an dem die Eintragung der Verschmelzung in das Register des Sitzes desjenigen Rechtsträgers, dessen Gläubiger sie sind, nach § 19 Abs. 3 UmwG als bekanntgemacht gilt, ihren Anspruch nach Grund und Höhe schriftlich anmelden, Sicherheit zu leisten, soweit sie nicht Befriedigung verlangen können. Dieses Recht steht den Gläubigern jedoch nur zu, wenn sie glaubhaft machen, dass durch die Verschmelzung die Erfüllung ihrer Forderung gefährdet wird."
    },
    {
      "date": "2025-06-04",
      "id": "111163",
      "original_text": "Registerbekanntmachung nach dem Umwandlungsgesetz\nSaarland Amtsgericht Saarbrücken HRB 17515\nMartin Söther GmbH – Beckingen",
      "type": "Registerbekanntmachung nach dem Umwandlungsgesetz",
      "state": "Saarland",
      "amtsgericht": "Amtsgericht Saarbrücken",
      "registernummer": "HRB 17515",
      "registerart": "HRB",
      "company_name": "Martin Söther GmbH",
      "company_seat": "Beckingen",
      "details": "04.06.2025 (Bekanntmachungsdatum)\n\nSaarland Amtsgericht Saarbrücken HRB 17515\nRegisterbekanntmachung nach dem Umwandlungsgesetz 04.06.2025 (Eintragungsdatum)\n\nMartin Söther GmbH\nGesellschaft mit beschränkter Haftung\nBeckingen\n\nAls nicht eingetragen wird bekannt gemacht: Den Gläubigern der an der Verschmelzung beteiligten Gesellschaften ist, wenn sie binnen sechs Monaten nach dem Tag, an dem die Eintragung der Verschmelzung in das Register des Sitzes desjenigen Rechtsträgers, dessen Gläubiger sie sind, nach § 19 Absatz 3 UmwG bekannt gemacht worden ist, ihren Anspruch nach Grund und Höhe schriftlich anmelden, Sicherheit zu leisten, soweit sie nicht Befriedigung verlangen können. Dieses Recht steht den Gläubigern jedoch nur zu, wenn sie glaubhaft machen, dass durch die Verschmelzung die Erfüllung ihrer Forderung gefährdet wird."
    },
    {
      "date": "2025-06-04",
      "id": "111164",
      "original_text": "Registerbekanntmachung nach dem Umwandlungsgesetz\nSaarland Amtsgericht Saarbrücken HRA 13694\nMartin Söther e.K. – Beckingen",
      "type": "Registerbekanntmachung nach dem Umwandlungsgesetz",
      "state": "Saarland",
      "amtsgericht": "Amtsgericht Saarbrücken",
      "registernummer": "HRA 13694",
      "registerart": "HRA",
      "company_name": "Martin Söther e.K.",
      "company_seat": "Beckingen",
      "details": "04.06.2025 (Bekanntmachungsdatum)\n\nSaarland Amtsgericht Saarbrücken HRA 13694\nRegisterbekanntmachung nach dem Umwandlungsgesetz 04.06.2025 (Eintragungsdatum)\n\nMartin Söther e.K.\nEinzelkaufmann / Einzelkauffrau\nBeckingen\n\nAls nicht eingetragen wird bekannt gemacht: Den Gläubigern der an der Verschmelzung beteiligten Rechtsträgern ist, wenn sie binnen sechs Monaten nach dem Tag, an dem die Eintragung der Verschmelzung in das Register des Sitzes desjenigen Rechtsträgers, dessen Gläubiger sie sind, nach § 19 Absatz 3 UmwG bekannt gemacht worden ist, ihren Anspruch nach Grund und Höhe schriftlich anmelden, Sicherheit zu leisten, soweit sie nicht Befriedigung verlangen können. Dieses Recht steht den Gläubigern jedoch nur zu, wenn sie glaubhaft machen, dass durch die Verschmelzung die Erfüllung ihrer Forderung gefährdet wird."
    },
    {
      "date": "2025-06-04",
      "id": "111165",
      "original_text": "Registerbekanntmachung nach dem Umwandlungsgesetz\nBaden-Württemberg Amtsgericht Stuttgart HRB 766167\nDSH Datenschutz GmbH – Heilbronn",
      "type": "Registerbekanntmachung nach dem Umwandlungsgesetz",
      "state": "Baden-Württemberg",
      "amtsgericht": "Amtsgericht Stuttgart",
      "registernummer": "HRB 766167",
      "registerart": "HRB",
      "company_name": "DSH Datenschutz GmbH",
      "company_seat": "Heilbronn",
      "details": "04.06.2025 (Bekanntmachungsdatum)\n\nBaden-Württemberg Amtsgericht Stuttgart HRB 766167\nRegisterbekanntmachung nach dem Umwandlungsgesetz 04.06.2025 (Eintragungsdatum)\n\nDSH Datenschutz GmbH\nGesellschaft mit beschränkter Haftung\nHeilbronn\n\nDen Gläubigern der an der Verschmelzung beteiligten Rechtsträger ist, wenn sie binnen sechs Monaten nach dem Tag, an dem die Eintragung der Verschmelzung in das Register des Sitzes desjenigen Rechtsträgers, dessen Gläubiger sie sind, nach § 19 Abs. 3 UmwG als bekanntgemacht gilt, ihren Anspruch nach Grund und Höhe schriftlich anmelden, Sicherheit zu leisten, soweit sie nicht Befriedigung verlangen können. Dieses Recht steht den Gläubigern jedoch nur zu, wenn sie glaubhaft machen, dass durch die Verschmelzung die Erfüllung ihrer Forderung gefährdet wird."
    },
    {
      "date": "2025-06-04",
      "id": "111166",
      "original_text": "Einreichung neuer Dokumente\nSchleswig-Holstein Amtsgericht Pinneberg HRB 5802\nHanseWerk AG – Quickborn/Krs. Pinneberg",
      "type": "Einreichung neuer Dokumente",
      "state": "Schleswig-Holstein",
      "amtsgericht": "Amtsgericht Pinneberg",
      "registernummer": "HRB 5802",
      "registerart": "HRB",
      "company_name": "HanseWerk AG",
      "company_seat": "Quickborn/Krs. Pinneberg",
      "details": "04.06.2025 (Bekanntmachungsdatum)\n\nSchleswig-Holstein Amtsgericht Pinneberg HRB 5802\nEinreichung neuer Dokumente\n\nHanseWerk AG\nAktiengesellschaft\nQuickborn/Krs. Pinneberg\n\nAls nicht eingetragen wird veröffentlicht: Es wurde eine neue Liste der Aufsichtsratsmitglieder zum Handelsregister eingereicht."
    },
    {
      "date": "2025-06-04",
      "id": "111167",
      "original_text": "Registerbekanntmachung nach dem Umwandlungsgesetz\nSchleswig-Holstein Amtsgericht Kiel HRB 22153\nOKITS GmbH – Henstedt-Ulzburg",
      "type": "Registerbekanntmachung nach dem Umwandlungsgesetz",
      "state": "Schleswig-Holstein",
      "amtsgericht": "Amtsgericht Kiel",
      "registernummer": "HRB 22153",
      "registerart": "HRB",
      "company_name": "OKITS GmbH",
      "company_seat": "Henstedt-Ulzburg",
      "details": "04.06.2025 (Bekanntmachungsdatum)\n\nSchleswig-Holstein Amtsgericht Kiel HRB 22153\nRegisterbekanntmachung nach dem Umwandlungsgesetz 28.05.2025 (Eintragungsdatum)\n\nOKITS GmbH\nGesellschaft mit beschränkter Haftung\nHenstedt-Ulzburg\n\nZu Eintragungsnummer 4 vom 28.05.2025 wird als nicht eingetragen veröffentlicht: Den Gläubigern der an der Verschmelzung beteiligten Rechtsträger ist, wenn sie binnen sechs Monaten nach dem Tag, an dem die Eintragung der Verschmelzung in das Register des Sitzes desjenigen Rechtsträgers, dessen Gläubiger sie sind, nach § 19 Abs. 3 UmwG bekannt gemacht worden ist, ihren Anspruch nach Grund und Höhe schriftlich anmelden, Sicherheit zu leisten, soweit sie nicht Befriedigung verlangen können. Dieses Recht steht den Gläubigern jedoch nur zu, wenn sie glaubhaft machen, dass durch die Verschmelzung die Erfüllung ihrer Forderung gefährdet wird."
    },
    {
      "date": "2025-06-04",
      "id": "111168",
      "original_text": "Löschungsankündigung\nBerlin Amtsgericht Berlin (Charlottenburg) HRB 211656\nACTIVA Construction GmbH – Berlin",
      "type": "Löschungsankündigung",
      "state": "Berlin",
      "amtsgericht": "Amtsgericht Berlin (Charlottenburg)",
      "registernummer": "HRB 211656",
      "registerart": "HRB",
      "company_name": "ACTIVA Construction GmbH",
      "company_seat": "Berlin",
      "details": "04.06.2025 (Bekanntmachungsdatum)\n\nBerlin Amtsgericht Berlin (Charlottenburg) HRB 211656\nLöschungsankündigung\n\nACTIVA Construction GmbH\nGesellschaft mit beschränkter Haftung\nBerlin\n\nBei der nachstehenden Gesellschaft wird das Amtslöschungsverfahren gemäß § 394 FamFG eingeleitet. Widerspruchsfrist 6 Wochen"
    },
    {
      "date": "2025-06-04",
      "id": "111169",
      "original_text": "Registerbekanntmachung nach dem Umwandlungsgesetz\nSachsen Amtsgericht Dresden HRB 40660\nStockspeed & KOKO-Dresden GmbH – Dresden",
      "type": "Registerbekanntmachung nach dem Umwandlungsgesetz",
      "state": "Sachsen",
      "amtsgericht": "Amtsgericht Dresden",
      "registernummer": "HRB 40660",
      "registerart": "HRB",
      "company_name": "Stockspeed & KOKO-Dresden GmbH",
      "company_seat": "Dresden",
      "details": "04.06.2025 (Bekanntmachungsdatum)\n\nSachsen Amtsgericht Dresden HRB 40660\nRegisterbekanntmachung nach dem Umwandlungsgesetz 04.06.2025 (Eintragungsdatum)\n\nStockspeed & KOKO-Dresden GmbH\nGesellschaft mit beschränkter Haftung\nDresden\n\nDen Gläubigern der an der Verschmelzung beteiligten Rechtsträger ist, wenn sie binnen sechs Monaten nach dem Tag, an dem die Eintragung der Verschmelzung in das Register des Sitzes desjenigen Rechtsträgers, dessen Gläubiger sie sind, nach § 19 Abs. 3 UmwG als bekannt gemacht gilt, ihren Anspruch nach Grund und Höhe in Textform anmelden, Sicherheit zu leisten, soweit sie nicht Befriedigung verlangen können. Dieses Recht steht den Gläubigern jedoch nur zu, wenn sie glaubhaft machen, dass durch die Verschmelzung die Erfüllung der Forderung gefährdet wird."
    },
    {
      "date": "2025-06-04",
      "id": "111170",
      "original_text": "Sonstige Registerbekanntmachung\nSachsen Amtsgericht Leipzig HRB 20609\nOemus Media Aktiengesellschaft – Leipzig",
      "type": "Sonstige Registerbekanntmachung",
      "state": "Sachsen",
      "amtsgericht": "Amtsgericht Leipzig",
      "registernummer": "HRB 20609",
      "registerart": "HRB",
      "company_name": "Oemus Media Aktiengesellschaft",
      "company_seat": "Leipzig",
      "details": "04.06.2025 (Bekanntmachungsdatum)\n\nSachsen Amtsgericht Leipzig HRB 20609\nSonstige Registerbekanntmachung\n\nOemus Media Aktiengesellschaft\nAktiengesellschaft\nLeipzig\n\nAm 02-06-2025 wurde beim Handelsregister des Amtsgerichts Leipzig die Liste der Mitglieder des Aufsichtsrats gemäß § 106 AktG eingereicht."
    },
    {
      "date": "2025-06-04",
      "id": "111171",
      "original_text": "Registerbekanntmachung nach dem Umwandlungsgesetz\nSachsen Amtsgericht Dresden HRB 44604\nG.S.V. & KOKO - Consulting GmbH – Dresden",
      "type": "Registerbekanntmachung nach dem Umwandlungsgesetz",
      "state": "Sachsen",
      "amtsgericht": "Amtsgericht Dresden",
      "registernummer": "HRB 44604",
      "registerart": "HRB",
      "company_name": "G.S.V. & KOKO - Consulting GmbH",
      "company_seat": "Dresden",
      "details": "04.06.2025 (Bekanntmachungsdatum)\n\nSachsen Amtsgericht Dresden HRB 44604\nRegisterbekanntmachung nach dem Umwandlungsgesetz 04.06.2025 (Eintragungsdatum)\n\nG.S.V. & KOKO - Consulting GmbH\nGesellschaft mit beschränkter Haftung\nDresden\n\nDen Gläubigern der an der Verschmelzung beteiligten Rechtsträger ist, wenn sie binnen sechs Monaten nach dem Tag, an dem die Eintragung der Verschmelzung in das Register des Sitzes desjenigen Rechtsträgers, dessen Gläubiger sie sind, nach § 19 Abs. 3 UmwG als bekannt gemacht gilt, ihren Anspruch nach Grund und Höhe in Textform anmelden, Sicherheit zu leisten, soweit sie nicht Befriedigung verlangen können. Dieses Recht steht den Gläubigern jedoch nur zu, wenn sie glaubhaft machen, dass durch die Verschmelzung die Erfüllung der Forderung gefährdet wird."
    },
    {
      "date": "2025-06-04",
      "id": "111172",
      "original_text": "Registerbekanntmachung nach dem Umwandlungsgesetz\nBaden-Württemberg Amtsgericht Stuttgart HRB 800145\nDigital Medical Academy GmbH – Waiblingen",
      "type": "Registerbekanntmachung nach dem Umwandlungsgesetz",
      "state": "Baden-Württemberg",
      "amtsgericht": "Amtsgericht Stuttgart",
      "registernummer": "HRB 800145",
      "registerart": "HRB",
      "company_name": "Digital Medical Academy GmbH",
      "company_seat": "Waiblingen",
      "details": "04.06.2025 (Bekanntmachungsdatum)\n\nBaden-Württemberg Amtsgericht Stuttgart HRB 800145\nRegisterbekanntmachung nach dem Umwandlungsgesetz 04.06.2025 (Eintragungsdatum)\n\nDigital Medical Academy GmbH\nGesellschaft mit beschränkter Haftung\nWaiblingen\n\nAls nicht eingetragen wird bekanntgemacht:\nDen Gläubigern des an dem Formwechsel beteiligten Rechtsträgers ist, wenn sie binnen sechs Monaten nach dem Tag, an dem die Eintragung des Formwechsels in das Register des Sitzes desjenigen Rechtsträgers, dessen Gläubiger sie sind, nach § 19 Abs. 3 UmwG als bekanntgemacht gilt, ihren Anspruch nach Grund und Höhe schriftlich anmelden, Sicherheit zu leisten, soweit sie nicht Befriedigung verlangen können. Dieses Recht steht den Gläubigern jedoch nur zu, wenn sie glaubhaft machen, dass durch den Formwechsel die Erfüllung ihrer Forderung gefährdet wird."
    },
    {
      "date": "2025-06-04",
      "id": "111173",
      "original_text": "Registerbekanntmachung nach dem Umwandlungsgesetz\nBaden-Württemberg Amtsgericht Stuttgart GsR 1761\nKupper Craciun Minucci eGbR – Waiblingen",
      "type": "Registerbekanntmachung nach dem Umwandlungsgesetz",
      "state": "Baden-Württemberg",
      "amtsgericht": "Amtsgericht Stuttgart",
      "registernummer": "GsR 1761",
      "registerart": "GsR",
      "company_name": "Kupper Craciun Minucci eGbR",
      "company_seat": "Waiblingen",
      "details": "04.06.2025 (Bekanntmachungsdatum)\n\nBaden-Württemberg Amtsgericht Stuttgart GsR 1761\nRegisterbekanntmachung nach dem Umwandlungsgesetz 04.06.2025 (Eintragungsdatum)\n\nKupper Craciun Minucci eGbR\nGesellschaft bürgerlichen Rechts\nWaiblingen\n\nAls nicht eingetragen wird bekanntgemacht:\nDen Gläubigern des an dem Formwechsel beteiligten Rechtsträgers ist, wenn sie binnen sechs Monaten nach dem Tag, an dem die Eintragung des Formwechsels in das Register des Sitzes desjenigen Rechtsträgers, dessen Gläubiger sie sind, nach § 19 Abs. 3 UmwG als bekanntgemacht gilt, ihren Anspruch nach Grund und Höhe schriftlich anmelden, Sicherheit zu leisten, soweit sie nicht Befriedigung verlangen können. Dieses Recht steht den Gläubigern jedoch nur zu, wenn sie glaubhaft machen, dass durch den Formwechsel die Erfüllung ihrer Forderung gefährdet wird."
    },
    {
      "date": "2025-06-04",
      "id": "111174",
      "original_text": "Registerbekanntmachung nach dem Umwandlungsgesetz\nBaden-Württemberg Amtsgericht Stuttgart HRB 786466\nKOMPETENZ Expertenverlag GmbH – Kornwestheim",
      "type": "Registerbekanntmachung nach dem Umwandlungsgesetz",
      "state": "Baden-Württemberg",
      "amtsgericht": "Amtsgericht Stuttgart",
      "registernummer": "HRB 786466",
      "registerart": "HRB",
      "company_name": "KOMPETENZ Expertenverlag GmbH",
      "company_seat": "Kornwestheim",
      "details": "04.06.2025 (Bekanntmachungsdatum)\n\nBaden-Württemberg Amtsgericht Stuttgart HRB 786466\nRegisterbekanntmachung nach dem Umwandlungsgesetz 04.06.2025 (Eintragungsdatum)\n\nKOMPETENZ Expertenverlag GmbH\nGesellschaft mit beschränkter Haftung\nKornwestheim\n\nAls nicht eingetragen wird bekanntgemacht:\nDen Gläubigern der an der Verschmelzung beteiligten Rechtsträger ist, wenn sie binnen sechs Monaten nach dem Tag, an dem die Eintragung der Verschmelzung in das Register des Sitzes desjenigen Rechtsträgers, dessen Gläubiger sie sind, nach § 19 Abs. 3 UmwG als bekanntgemacht gilt, ihren Anspruch nach Grund und Höhe schriftlich anmelden, Sicherheit zu leisten, soweit sie nicht Befriedigung verlangen können. Dieses Recht steht den Gläubigern jedoch nur zu, wenn sie glaubhaft machen, dass durch die Verschmelzung die Erfüllung ihrer Forderung gefährdet wird."
    },
    {
      "date": "2025-06-04",
      "id": "111175",
      "original_text": "Löschungsankündigung\nNiedersachsen Amtsgericht Oldenburg (Oldenburg) HRB 210300\nCharisma 4 Life GmbH – Rastede",
      "type": "Löschungsankündigung",
      "state": "Niedersachsen",
      "amtsgericht": "Amtsgericht Oldenburg (Oldenburg)",
      "registernummer": "HRB 210300",
      "registerart": "HRB",
      "company_name": "Charisma 4 Life GmbH",
      "company_seat": "Rastede",
      "details": "04.06.2025 (Bekanntmachungsdatum)\n\nNiedersachsen Amtsgericht Oldenburg (Oldenburg) HRB 210300\nLöschungsankündigung\n\nCharisma 4 Life GmbH\nGesellschaft mit beschränkter Haftung\nRastede\n\nDas Registergericht beabsichtigt, die Gesellschaft von Amts wegen nach § 394 FamFG zu löschen. Die Frist zur Erhebung eines Widerspruchs ist auf 1 Monat ab dieser Registerbekanntmachung festgesetzt."
    },
    {
      "date": "2025-06-04",
      "id": "111176",
      "original_text": "Registerbekanntmachung nach dem Umwandlungsgesetz\nNiedersachsen Amtsgericht Lüneburg HRB 200159\nspohler-direct zeitarbeit & personalentwicklung GmbH – Lüneburg",
      "type": "Registerbekanntmachung nach dem Umwandlungsgesetz",
      "state": "Niedersachsen",
      "amtsgericht": "Amtsgericht Lüneburg",
      "registernummer": "HRB 200159",
      "registerart": "HRB",
      "company_name": "spohler-direct zeitarbeit & personalentwicklung GmbH",
      "company_seat": "Lüneburg",
      "details": "04.06.2025 (Bekanntmachungsdatum)\n\nNiedersachsen Amtsgericht Lüneburg HRB 200159\nRegisterbekanntmachung nach dem Umwandlungsgesetz 04.06.2025 (Eintragungsdatum)\n\nspohler-direct zeitarbeit & personalentwicklung GmbH\nGesellschaft mit beschränkter Haftung\nLüneburg\n\nDen Gläubigern der an der Verschmelzung beteiligten Rechtsträger ist, wenn sie binnen sechs Monaten nach dem Tag, an dem die Eintragung der Verschmelzung in das Register des Sitzes desjenigen Rechtsträgers, dessen Gläubiger sie sind, nach § 19  Abs.  3 UmwG als bekannt gemacht gilt, ihren Anspruch nach Grund und Höhe schriftlich anmelden, Sicherheit zu leisten, soweit sie nicht Befriedigung verlangen können. Dieses Recht steht den Gläubigern jedoch nur zu, wenn sie glaubhaft machen, dass durch die Verschmelzung die Erfüllung der Forderung gefährdet wird."
    },
    {
      "date": "2025-06-04",
      "id": "111177",
      "original_text": "Registerbekanntmachung nach dem Umwandlungsgesetz\nNiedersachsen Amtsgericht Osnabrück HRB 205518\nBWS Beteiligungs-GmbH – Neuenkirchen",
      "type": "Registerbekanntmachung nach dem Umwandlungsgesetz",
      "state": "Niedersachsen",
      "amtsgericht": "Amtsgericht Osnabrück",
      "registernummer": "HRB 205518",
      "registerart": "HRB",
      "company_name": "BWS Beteiligungs-GmbH",
      "company_seat": "Neuenkirchen",
      "details": "04.06.2025 (Bekanntmachungsdatum)\n\nNiedersachsen Amtsgericht Osnabrück HRB 205518\nRegisterbekanntmachung nach dem Umwandlungsgesetz 04.06.2025 (Eintragungsdatum)\n\nBWS Beteiligungs-GmbH\nGesellschaft mit beschränkter Haftung\nNeuenkirchen\n\nDen Gläubigern der an der Verschmelzung beteiligten Rechtsträger ist, wenn sie binnen sechs Monaten nach dem Tag, an dem die Eintragung der Verschmelzung in das Register des Sitzes desjenigen Rechtsträgers, dessen Gläubiger sie sind, nach § 19  Abs.  3 UmwG als bekannt gemacht gilt, ihren Anspruch nach Grund und Höhe schriftlich anmelden, Sicherheit zu leisten, soweit sie nicht Befriedigung verlangen können. Dieses Recht steht den Gläubigern jedoch nur zu, wenn sie glaubhaft machen, dass durch die Verschmelzung die Erfüllung der Forderung gefährdet wird."
    },
    {
      "date": "2025-06-04",
      "id": "111178",
      "original_text": "Registerbekanntmachung nach dem Umwandlungsgesetz\nNiedersachsen Amtsgericht Hannover HRB 210270\nDEISTER HOLDING AG – Barsinghausen",
      "type": "Registerbekanntmachung nach dem Umwandlungsgesetz",
      "state": "Niedersachsen",
      "amtsgericht": "Amtsgericht Hannover",
      "registernummer": "HRB 210270",
      "registerart": "HRB",
      "company_name": "DEISTER HOLDING AG",
      "company_seat": "Barsinghausen",
      "details": "04.06.2025 (Bekanntmachungsdatum)\n\nNiedersachsen Amtsgericht Hannover HRB 210270\nRegisterbekanntmachung nach dem Umwandlungsgesetz\n\nDEISTER HOLDING AG\nAktiengesellschaft\nBarsinghausen\n\nBeim Handelsregister ist der Entwurf eines Verschmelzungsvertrages vom 02.06.2025 eingereicht worden. Danach soll die Gesellschaft  - als übernehmende Gesellschaft - mit der deister international GmbH, Barsinghausen (Amtsgericht Hannover HRB 215750) verschmolzen werden."
    },
    {
      "date": "2025-06-04",
      "id": "111179",
      "original_text": "Einreichung neuer Dokumente\nNiedersachsen Amtsgericht Braunschweig HRB 7599\nMast-Jägermeister SE – Wolfenbüttel",
      "type": "Einreichung neuer Dokumente",
      "state": "Niedersachsen",
      "amtsgericht": "Amtsgericht Braunschweig",
      "registernummer": "HRB 7599",
      "registerart": "HRB",
      "company_name": "Mast-Jägermeister SE",
      "company_seat": "Wolfenbüttel",
      "details": "04.06.2025 (Bekanntmachungsdatum)\n\nNiedersachsen Amtsgericht Braunschweig HRB 7599\nEinreichung neuer Dokumente\n\nMast-Jägermeister SE\nEuropäische Aktiengesellschaft (SE)\nWolfenbüttel\n\nEine neue Liste der Mitglieder des Aufsichtsrats wurde beim Registergericht eingereicht."
    },
    {
      "date": "2025-06-04",
      "id": "111180",
      "original_text": "Registerbekanntmachung nach dem Umwandlungsgesetz\nNiedersachsen Amtsgericht Osnabrück HRB 131754 früher Amtsgericht Nordhorn\nGUS Gewässer-Umwelt- Schutz GmbH – Nordhorn",
      "type": "Registerbekanntmachung nach dem Umwandlungsgesetz",
      "state": "Niedersachsen",
      "amtsgericht": "Amtsgericht Osnabrück",
      "registernummer": "HRB 131754",
      "registerart": "HRB",
      "company_name": "GUS Gewässer-Umwelt- Schutz GmbH",
      "company_seat": "Nordhorn",
      "former_amtsgericht": "Nordhorn",
      "details": "04.06.2025 (Bekanntmachungsdatum)\n\nNiedersachsen Amtsgericht Osnabrück HRB 131754 früher Amtsgericht Nordhorn\nRegisterbekanntmachung nach dem Umwandlungsgesetz 04.06.2025 (Eintragungsdatum)\n\nGUS Gewässer-Umwelt- Schutz GmbH\nGesellschaft mit beschränkter Haftung\nNordhorn\n\nDen Gläubigern der an der Verschmelzung beteiligten Rechtsträger ist, wenn sie binnen sechs Monaten nach dem Tag, an dem die Eintragung der Verschmelzung in das Register des Sitzes desjenigen Rechtsträgers, dessen Gläubiger sie sind, nach § 19  Abs.  3 UmwG als bekannt gemacht gilt, ihren Anspruch nach Grund und Höhe schriftlich anmelden, Sicherheit zu leisten, soweit sie nicht Befriedigung verlangen können. Dieses Recht steht den Gläubigern jedoch nur zu, wenn sie glaubhaft machen, dass durch die Verschmelzung die Erfüllung der Forderung gefährdet wird."
    },
    {
      "date": "2025-06-04",
      "id": "111181",
      "original_text": "Registerbekanntmachung nach dem Umwandlungsgesetz\nNiedersachsen Amtsgericht Aurich HRB 111574\nLabohm Fußbodentechnik GmbH – Uplengen",
      "type": "Registerbekanntmachung nach dem Umwandlungsgesetz",
      "state": "Niedersachsen",
      "amtsgericht": "Amtsgericht Aurich",
      "registernummer": "HRB 111574",
      "registerart": "HRB",
      "company_name": "Labohm Fußbodentechnik GmbH",
      "company_seat": "Uplengen",
      "details": "04.06.2025 (Bekanntmachungsdatum)\n\nNiedersachsen Amtsgericht Aurich HRB 111574\nRegisterbekanntmachung nach dem Umwandlungsgesetz 04.06.2025 (Eintragungsdatum)\n\nLabohm Fußbodentechnik GmbH\nGesellschaft mit beschränkter Haftung\nUplengen\n\nDen Gläubigern der an der Verschmelzung beteiligten Rechtsträger ist, wenn sie binnen sechs Monaten nach dem Tag, an dem die Eintragung der Verschmelzung in das Register des Sitzes desjenigen Rechtsträgers, dessen Gläubiger sie sind, nach § 19  Abs.  3 UmwG als bekannt gemacht gilt, ihren Anspruch nach Grund und Höhe schriftlich anmelden, Sicherheit zu leisten, soweit sie nicht Befriedigung verlangen können. Dieses Recht steht den Gläubigern jedoch nur zu, wenn sie glaubhaft machen, dass durch die Verschmelzung die Erfüllung der Forderung gefährdet wird."
    },
    {
      "date": "2025-06-04",
      "id": "111182",
      "original_text": "Registerbekanntmachung nach dem Umwandlungsgesetz\nNiedersachsen Amtsgericht Aurich GsR 383\nH. + T. Labohm eGbR – Uplengen",
      "type": "Registerbekanntmachung nach dem Umwandlungsgesetz",
      "state": "Niedersachsen",
      "amtsgericht": "Amtsgericht Aurich",
      "registernummer": "GsR 383",
      "registerart": "GsR",
      "company_name": "H. + T. Labohm eGbR",
      "company_seat": "Uplengen",
      "details": "04.06.2025 (Bekanntmachungsdatum)\n\nNiedersachsen Amtsgericht Aurich GsR 383\nRegisterbekanntmachung nach dem Umwandlungsgesetz 04.06.2025 (Eintragungsdatum)\n\nH. + T. Labohm eGbR\nGesellschaft bürgerlichen Rechts\nUplengen\n\nDen Gläubigern der an der Verschmelzung beteiligten Rechtsträger ist, wenn sie binnen sechs Monaten nach dem Tag, an dem die Eintragung der Verschmelzung in das Register des Sitzes desjenigen Rechtsträgers, dessen Gläubiger sie sind, nach § 19  Abs.  3 UmwG als bekannt gemacht gilt, ihren Anspruch nach Grund und Höhe schriftlich anmelden, Sicherheit zu leisten, soweit sie nicht Befriedigung verlangen können. Dieses Recht steht den Gläubigern jedoch nur zu, wenn sie glaubhaft machen, dass durch die Verschmelzung die Erfüllung der Forderung gefährdet wird."
    },
    {
      "date": "2025-06-04",
      "id": "111183",
      "original_text": "Löschungsankündigung\nNiedersachsen Amtsgericht Osnabrück HRB 212124\n3L Vermögensverwaltungsgesellschaft mbH – Bad Rothenfelde",
      "type": "Löschungsankündigung",
      "state": "Niedersachsen",
      "amtsgericht": "Amtsgericht Osnabrück",
      "registernummer": "HRB 212124",
      "registerart": "HRB",
      "company_name": "3L Vermögensverwaltungsgesellschaft mbH",
      "company_seat": "Bad Rothenfelde",
      "details": "04.06.2025 (Bekanntmachungsdatum)\n\nNiedersachsen Amtsgericht Osnabrück HRB 212124\nLöschungsankündigung\n\n3L Vermögensverwaltungsgesellschaft mbH\nGesellschaft mit beschränkter Haftung\nBad Rothenfelde\n\nDas Registergericht beabsichtigt, die Gesellschaft von Amts wegen nach § 394 FamFG wegen Vermögenslosigkeit zu löschen. Die Frist zur Erhebung eines Widerspruchs ist auf 1 Monat ab dieser Registerbekanntmachung festgesetzt."
    },
    {
      "date": "2025-06-04",
      "id": "111184",
      "original_text": "Registerbekanntmachung nach dem Umwandlungsgesetz\nNiedersachsen Amtsgericht Osnabrück HRA 202835\nBWS GmbH & Co. KG – Neuenkirchen",
      "type": "Registerbekanntmachung nach dem Umwandlungsgesetz",
      "state": "Niedersachsen",
      "amtsgericht": "Amtsgericht Osnabrück",
      "registernummer": "HRA 202835",
      "registerart": "HRA",
      "company_name": "BWS GmbH & Co. KG",
      "company_seat": "Neuenkirchen",
      "details": "04.06.2025 (Bekanntmachungsdatum)\n\nNiedersachsen Amtsgericht Osnabrück HRA 202835\nRegisterbekanntmachung nach dem Umwandlungsgesetz 04.06.2025 (Eintragungsdatum)\n\nBWS GmbH & Co. KG\nKommanditgesellschaft\nNeuenkirchen\n\nDen Gläubigern der an der Verschmelzung beteiligten Rechtsträger ist, wenn sie binnen sechs Monaten nach dem Tag, an dem die Eintragung der Verschmelzung in das Register des Sitzes desjenigen Rechtsträgers, dessen Gläubiger sie sind, nach § 19  Abs.  3 UmwG als bekannt gemacht gilt, ihren Anspruch nach Grund und Höhe schriftlich anmelden, Sicherheit zu leisten, soweit sie nicht Befriedigung verlangen können. Dieses Recht steht den Gläubigern jedoch nur zu, wenn sie glaubhaft machen, dass durch die Verschmelzung die Erfüllung der Forderung gefährdet wird."
    },
    {
      "date": "2025-06-04",
      "id": "111185",
      "original_text": "Registerbekanntmachung nach dem Umwandlungsgesetz\nNiedersachsen Amtsgericht Aurich HRB 111347 früher Amtsgericht Leer (Ostfriesland) (Leer)\nSeaway 7 Germany GmbH – Leer",
      "type": "Registerbekanntmachung nach dem Umwandlungsgesetz",
      "state": "Niedersachsen",
      "amtsgericht": "Amtsgericht Aurich",
      "registernummer": "HRB 111347",
      "registerart": "HRB",
      "company_name": "Seaway 7 Germany GmbH",
      "company_seat": "Leer",
      "former_amtsgericht": "Leer (Ostfriesland) (Leer)",
      "details": "04.06.2025 (Bekanntmachungsdatum)\n\nNiedersachsen Amtsgericht Aurich HRB 111347 früher Amtsgericht Leer (Ostfriesland) (Leer)\nRegisterbekanntmachung nach dem Umwandlungsgesetz 04.06.2025 (Eintragungsdatum)\n\nSeaway 7 Germany GmbH\nGesellschaft mit beschränkter Haftung\nLeer\n\nDen Gläubigern der an der Verschmelzung beteiligten Rechtsträger ist, wenn sie binnen sechs Monaten nach dem Tag, an dem die Eintragung der Verschmelzung in das Register des Sitzes desjenigen Rechtsträgers, dessen Gläubiger sie sind, nach § 19  Abs.  3 UmwG als bekannt gemacht gilt, ihren Anspruch nach Grund und Höhe schriftlich anmelden, Sicherheit zu leisten, soweit sie nicht Befriedigung verlangen können. Dieses Recht steht den Gläubigern jedoch nur zu, wenn sie glaubhaft machen, dass durch die Verschmelzung die Erfüllung der Forderung gefährdet wird."
    },
    {
      "date": "2025-06-04",
      "id": "111186",
      "original_text": "Einreichung neuer Dokumente\nRheinland-Pfalz Amtsgericht Mainz HRB 90\nBausparkasse Mainz Aktiengesellschaft – Mainz",
      "type": "Einreichung neuer Dokumente",
      "state": "Rheinland-Pfalz",
      "amtsgericht": "Amtsgericht Mainz",
      "registernummer": "HRB 90",
      "registerart": "HRB",
      "company_name": "Bausparkasse Mainz Aktiengesellschaft",
      "company_seat": "Mainz",
      "details": "04.06.2025 (Bekanntmachungsdatum)\n\nRheinland-Pfalz Amtsgericht Mainz HRB 90\nEinreichung neuer Dokumente\n\nBausparkasse Mainz Aktiengesellschaft\nAktiengesellschaft\nMainz\n\nDem Registergericht ist eine neue Liste der Mitglieder des Aufsichtsrates eingereicht worden."
    },
    {
      "date": "2025-06-04",
      "id": "111187",
      "original_text": "Registerbekanntmachung nach dem Umwandlungsgesetz\nRheinland-Pfalz Amtsgericht Ludwigshafen a.Rhein (Ludwigshafen) HRB 65656\nEWIS GmbH – Speyer",
      "type": "Registerbekanntmachung nach dem Umwandlungsgesetz",
      "state": "Rheinland-Pfalz",
      "amtsgericht": "Amtsgericht Ludwigshafen a.Rhein (Ludwigshafen)",
      "registernummer": "HRB 65656",
      "registerart": "HRB",
      "company_name": "EWIS GmbH",
      "company_seat": "Speyer",
      "details": "04.06.2025 (Bekanntmachungsdatum)\n\nRheinland-Pfalz Amtsgericht Ludwigshafen a.Rhein (Ludwigshafen) HRB 65656\nRegisterbekanntmachung nach dem Umwandlungsgesetz 04.06.2025 (Eintragungsdatum)\n\nEWIS GmbH\nGesellschaft mit beschränkter Haftung\nSpeyer\n\nAls nicht eingetragen wird veröffentlicht: Den Gläubigern der an der Verschmelzung beteiligten Rechtsträger ist, wenn sie binnen sechs Monaten nach dem Tag, an dem die Eintragung der Verschmelzung in das Register des Sitzes desjenigen Rechtsträgers, dessen Gläubiger sie sind, nach § 19 Abs. 3 UmwG als bekannt gemacht gilt, ihren Anspruch nach Grund und Höhe schriftlich anmelden, Sicherheit zu leisten, soweit sie nicht Befriedigung verlangen können. Dieses Recht steht den Gläubigern jedoch nur zu, wenn sie glaubhaft machen, dass durch die Verschmelzung die Erfüllung der Forderung gefährdet wird."
    },
    {
      "date": "2025-06-04",
      "id": "111188",
      "original_text": "Sonstige Registerbekanntmachung\nRheinland-Pfalz Amtsgericht Landau HRB 33354\nMegaprojekt GmbH – Kandel",
      "type": "Sonstige Registerbekanntmachung",
      "state": "Rheinland-Pfalz",
      "amtsgericht": "Amtsgericht Landau",
      "registernummer": "HRB 33354",
      "registerart": "HRB",
      "company_name": "Megaprojekt GmbH",
      "company_seat": "Kandel",
      "details": "04.06.2025 (Bekanntmachungsdatum)\n\nRheinland-Pfalz Amtsgericht Landau HRB 33354\nSonstige Registerbekanntmachung\n\nMegaprojekt GmbH\nGesellschaft mit beschränkter Haftung\nKandel\n\nDas Registergericht beabsichtigt den Geschäftsführer von Amts wegen nach § 395 FamFG zu löschen. Die Frist zur Erhebung eines Widerspruchs ist auf einen Monat festgesetzt."
    },
    {
      "date": "2025-06-04",
      "id": "111189",
      "original_text": "Einreichung neuer Dokumente\nBremen Amtsgericht Bremen HRB 6247\nASB Altenwohn- und Pflegezentrum gGmbH – Bremen",
      "type": "Einreichung neuer Dokumente",
      "state": "Bremen",
      "amtsgericht": "Amtsgericht Bremen",
      "registernummer": "HRB 6247",
      "registerart": "HRB",
      "company_name": "ASB Altenwohn- und Pflegezentrum gGmbH",
      "company_seat": "Bremen",
      "details": "04.06.2025 (Bekanntmachungsdatum)\n\nBremen Amtsgericht Bremen HRB 6247\nEinreichung neuer Dokumente\n\nASB Altenwohn- und Pflegezentrum gGmbH\nGesellschaft mit beschränkter Haftung\nBremen\n\nAls nicht eingetragen wird bekannt gemacht: Liste des Aufsichtsrats wurde eingereicht."
    },
    {
      "date": "2025-06-04",
      "id": "111190",
      "original_text": "Einreichung neuer Dokumente\nBremen Amtsgericht Bremen HRB 19744\nASB Ambulante Pflege gGmbH – Bremen",
      "type": "Einreichung neuer Dokumente",
      "state": "Bremen",
      "amtsgericht": "Amtsgericht Bremen",
      "registernummer": "HRB 19744",
      "registerart": "HRB",
      "company_name": "ASB Ambulante Pflege gGmbH",
      "company_seat": "Bremen",
      "details": "04.06.2025 (Bekanntmachungsdatum)\n\nBremen Amtsgericht Bremen HRB 19744\nEinreichung neuer Dokumente\n\nASB Ambulante Pflege gGmbH\nGesellschaft mit beschränkter Haftung\nBremen\n\nAls nicht eingetragen wird bekannt gemacht: Liste des Aufsichtsrats wurde eingereicht."
    },
    {
      "date": "2025-06-04",
      "id": "111191",
      "original_text": "Einreichung neuer Dokumente\nBremen Amtsgericht Bremen HRB 20163\nASB Seelische Gesundheit gGmbH – Bremen",
      "type": "Einreichung neuer Dokumente",
      "state": "Bremen",
      "amtsgericht": "Amtsgericht Bremen",
      "registernummer": "HRB 20163",
      "registerart": "HRB",
      "company_name": "ASB Seelische Gesundheit gGmbH",
      "company_seat": "Bremen",
      "details": "04.06.2025 (Bekanntmachungsdatum)\n\nBremen Amtsgericht Bremen HRB 20163\nEinreichung neuer Dokumente\n\nASB Seelische Gesundheit gGmbH\nGesellschaft mit beschränkter Haftung\nBremen\n\nAls nicht eingetragen wird bekannt gemacht: Liste des Aufsichtsrats wurde eingereicht."
    },
    {
      "date": "2025-06-04",
      "id": "111192",
      "original_text": "Einreichung neuer Dokumente\nBremen Amtsgericht Bremen HRB 11525\nASB Soziale Hilfen gGmbH – Bremen",
      "type": "Einreichung neuer Dokumente",
      "state": "Bremen",
      "amtsgericht": "Amtsgericht Bremen",
      "registernummer": "HRB 11525",
      "registerart": "HRB",
      "company_name": "ASB Soziale Hilfen gGmbH",
      "company_seat": "Bremen",
      "details": "04.06.2025 (Bekanntmachungsdatum)\n\nBremen Amtsgericht Bremen HRB 11525\nEinreichung neuer Dokumente\n\nASB Soziale Hilfen gGmbH\nGesellschaft mit beschränkter Haftung\nBremen\n\nAls nicht eingetragen wird bekannt gemacht: Liste des Aufsichtsrats wurde eingereicht."
    },
    {
      "date": "2025-06-04",
      "id": "111193",
      "original_text": "Einreichung neuer Dokumente\nBremen Amtsgericht Bremen HRB 20580\nASB Migration und Integration gGmbH – Bremen",
      "type": "Einreichung neuer Dokumente",
      "state": "Bremen",
      "amtsgericht": "Amtsgericht Bremen",
      "registernummer": "HRB 20580",
      "registerart": "HRB",
      "company_name": "ASB Migration und Integration gGmbH",
      "company_seat": "Bremen",
      "details": "04.06.2025 (Bekanntmachungsdatum)\n\nBremen Amtsgericht Bremen HRB 20580\nEinreichung neuer Dokumente\n\nASB Migration und Integration gGmbH\nGesellschaft mit beschränkter Haftung\nBremen\n\nAls nicht eingetragen wird bekannt gemacht: Liste des Aufsichtsrats wurde eingereicht."
    },
    {
      "date": "2025-06-04",
      "id": "111194",
      "original_text": "Registerbekanntmachung nach dem Umwandlungsgesetz\nRheinland-Pfalz Amtsgericht Bad Kreuznach HRB 21159\nSCC Scientific Consulting Company Chemisch-Wissenschaftliche Beratung GmbH – Bad Kreuznach",
      "type": "Registerbekanntmachung nach dem Umwandlungsgesetz",
      "state": "Rheinland-Pfalz",
      "amtsgericht": "Amtsgericht Bad Kreuznach",
      "registernummer": "HRB 21159",
      "registerart": "HRB",
      "company_name": "SCC Scientific Consulting Company Chemisch-Wissenschaftliche Beratung GmbH",
      "company_seat": "Bad Kreuznach",
      "details": "04.06.2025 (Bekanntmachungsdatum)\n\nRheinland-Pfalz Amtsgericht Bad Kreuznach HRB 21159\nRegisterbekanntmachung nach dem Umwandlungsgesetz 04.06.2025 (Eintragungsdatum)\n\nSCC Scientific Consulting Company Chemisch-Wissenschaftliche Beratung GmbH\nGesellschaft mit beschränkter Haftung\nBad Kreuznach\n\nAls nicht eingetragen wird veröffentlicht: Den Gläubigern der an der Verschmelzung beteiligten Rechtsträger ist, wenn sie binnen sechs Monaten nach dem Tag, an dem die Eintragung der Verschmelzung in das Register des Sitzes desjenigen Rechtsträgers, dessen Gläubiger sie sind, nach § 19 Abs. 3 UmwG als bekannt gemacht gilt, ihren Anspruch nach Grund und Höhe schriftlich anmelden, Sicherheit zu leisten, soweit sie nicht Befriedigung verlangen können. Dieses Recht steht den Gläubigern jedoch nur zu, wenn sie glaubhaft machen, dass durch die Verschmelzung die Erfüllung der Forderung gefährdet wird."
    },
    {
      "date": "2025-06-04",
      "id": "111195",
      "original_text": "Registerbekanntmachung nach dem Umwandlungsgesetz\nRheinland-Pfalz Amtsgericht Bad Kreuznach HRA 21335\nHaus Ursula mobil, Daniel Hostmann e.K. – Simmern",
      "type": "Registerbekanntmachung nach dem Umwandlungsgesetz",
      "state": "Rheinland-Pfalz",
      "amtsgericht": "Amtsgericht Bad Kreuznach",
      "registernummer": "HRA 21335",
      "registerart": "HRA",
      "company_name": "Haus Ursula mobil, Daniel Hostmann e.K.",
      "company_seat": "Simmern",
      "details": "04.06.2025 (Bekanntmachungsdatum)\n\nRheinland-Pfalz Amtsgericht Bad Kreuznach HRA 21335\nRegisterbekanntmachung nach dem Umwandlungsgesetz 04.06.2025 (Eintragungsdatum)\n\nHaus Ursula mobil, Daniel Hostmann e.K.\nEinzelkaufmann / Einzelkauffrau\nSimmern\n\nAls nicht eingetragen wird veröffentlicht: Den Gläubigern der an der Ausgliederung beteiligten Rechtsträger ist, wenn sie binnen sechs Monaten nach dem Tag, an dem die Eintragung der Ausgliederung in das Register des Sitzes desjenigen Rechtsträgers, dessen Gläubiger sie sind, nach § 19 Abs. 3 UmwG als bekannt gemacht gilt, ihren Anspruch nach Grund und Höhe schriftlich anmelden, Sicherheit zu leisten, soweit sie nicht Befriedigung verlangen können. Dieses Recht steht den Gläubigern jedoch nur zu, wenn sie glaubhaft machen, dass durch die Ausgliederung die Erfüllung der Forderung gefährdet wird."
    },
    {
      "date": "2025-06-04",
      "id": "111196",
      "original_text": "Einreichung neuer Dokumente\nRheinland-Pfalz Amtsgericht Zweibrücken HRB 23025\nWirtschaftsförderungsgesellschaft Südwestpfalz mbH – Pirmasens",
      "type": "Einreichung neuer Dokumente",
      "state": "Rheinland-Pfalz",
      "amtsgericht": "Amtsgericht Zweibrücken",
      "registernummer": "HRB 23025",
      "registerart": "HRB",
      "company_name": "Wirtschaftsförderungsgesellschaft Südwestpfalz mbH",
      "company_seat": "Pirmasens",
      "details": "04.06.2025 (Bekanntmachungsdatum)\n\nRheinland-Pfalz Amtsgericht Zweibrücken HRB 23025\nEinreichung neuer Dokumente 03.05.2025 (Eintragungsdatum)\n\nWirtschaftsförderungsgesellschaft Südwestpfalz mbH\nGesellschaft mit beschränkter Haftung\nPirmasens\n\nDem Registergericht ist eine Liste der Mitglieder des Aufsichtsrates eingereicht worden."
    },
    {
      "date": "2025-06-04",
      "id": "111197",
      "original_text": "Registerbekanntmachung nach dem Umwandlungsgesetz\nNordrhein-Westfalen Amtsgericht Bonn HRB 7965\nNiedax Galvanik GmbH. – Bonn",
      "type": "Registerbekanntmachung nach dem Umwandlungsgesetz",
      "state": "Nordrhein-Westfalen",
      "amtsgericht": "Amtsgericht Bonn",
      "registernummer": "HRB 7965",
      "registerart": "HRB",
      "company_name": "Niedax Galvanik GmbH.",
      "company_seat": "Bonn",
      "details": "04.06.2025 (Bekanntmachungsdatum)\n\nNordrhein-Westfalen Amtsgericht Bonn HRB 7965\nRegisterbekanntmachung nach dem Umwandlungsgesetz 04.06.2025 (Eintragungsdatum)\n\nNiedax Galvanik GmbH.\nGesellschaft mit beschränkter Haftung\nBonn\n\nDen Gläubigern der an der Verschmelzung beteiligten Rechtsträger ist, wenn sie binnen sechs Monaten nach dem Tag, an dem die Eintragung der Verschmelzung in das Register des Sitzes desjenigen Rechtsträgers, dessen Gläubiger sie sind, nach § 19 Absatz 3 UmwG als bekanntgemacht gilt, ihren Anspruch nach Grund und Höhe schriftlich anmelden, Sicherheit zu leisten, soweit sie nicht Befriedigung verlangen können. Dieses Recht steht den Gläubigern jedoch nur zu, wenn sie glaubhaft machen, dass durch die Verschmelzung die Erfüllung ihrer Forderung gefährdet wird."
    },
    {
      "date": "2025-06-04",
      "id": "111198",
      "original_text": "Löschungsankündigung\nNordrhein-Westfalen Amtsgericht Kleve HRB 11738\nLack Center Xanten GmbH – Xanten",
      "type": "Löschungsankündigung",
      "state": "Nordrhein-Westfalen",
      "amtsgericht": "Amtsgericht Kleve",
      "registernummer": "HRB 11738",
      "registerart": "HRB",
      "company_name": "Lack Center Xanten GmbH",
      "company_seat": "Xanten",
      "details": "04.06.2025 (Bekanntmachungsdatum)\n\nNordrhein-Westfalen Amtsgericht Kleve HRB 11738\nLöschungsankündigung\n\nLack Center Xanten GmbH\nGesellschaft mit beschränkter Haftung\nXanten\n\nDas Registergericht beabsichtigt die Gesellschaft von Amts wegen nach § 394 FamFG zu löschen. Die Frist zur Erhebung eines Widerspruchs ist auf einen Monat festgesetzt."
    },
    {
      "date": "2025-06-04",
      "id": "111199",
      "original_text": "Registerbekanntmachung nach dem Umwandlungsgesetz\nNordrhein-Westfalen Amtsgericht Dortmund HRA 19812\nHaus-Tec - Dipl.-Ing. Wolfgang Streit e. K. – Castrop-Rauxel",
      "type": "Registerbekanntmachung nach dem Umwandlungsgesetz",
      "state": "Nordrhein-Westfalen",
      "amtsgericht": "Amtsgericht Dortmund",
      "registernummer": "HRA 19812",
      "registerart": "HRA",
      "company_name": "Haus-Tec - Dipl.-Ing. Wolfgang Streit e. K.",
      "company_seat": "Castrop-Rauxel",
      "details": "04.06.2025 (Bekanntmachungsdatum)\n\nNordrhein-Westfalen Amtsgericht Dortmund HRA 19812\nRegisterbekanntmachung nach dem Umwandlungsgesetz 04.06.2025 (Eintragungsdatum)\n\nHaus-Tec - Dipl.-Ing. Wolfgang Streit e. K.\nEinzelkaufmann / Einzelkauffrau\nCastrop-Rauxel\n\nDen Gläubigern der an der Ausgliederung beteiligten Rechtsträger ist, wenn sie binnen sechs Monaten nach dem Tag, an dem die Eintragung der Ausgliederung in das Register des Sitzes desjenigen Rechtsträgers, dessen Gläubiger sie sind, nach § 19 Absatz 3 UmwG als bekanntgemacht gilt, ihren Anspruch nach Grund und Höhe schriftlich anmelden, Sicherheit zu leisten, soweit sie nicht Befriedigung verlangen können. Dieses Recht steht den Gläubigern jedoch nur zu, wenn sie glaubhaft machen, dass durch die Ausgliederung die Erfüllung ihrer Forderung gefährdet wird."
    },
    {
      "date": "2025-06-04",
      "id": "111200",
      "original_text": "Löschungsankündigung\nNordrhein-Westfalen Amtsgericht Neuss HRB 16378\nNR Warenhandel GmbH – Kaarst",
      "type": "Löschungsankündigung",
      "state": "Nordrhein-Westfalen",
      "amtsgericht": "Amtsgericht Neuss",
      "registernummer": "HRB 16378",
      "registerart": "HRB",
      "company_name": "NR Warenhandel GmbH",
      "company_seat": "Kaarst",
      "details": "04.06.2025 (Bekanntmachungsdatum)\n\nNordrhein-Westfalen Amtsgericht Neuss HRB 16378\nLöschungsankündigung\n\nNR Warenhandel GmbH\nGesellschaft mit beschränkter Haftung\nKaarst\n\nDas Registergericht beabsichtigt die Gesellschaft von Amts wegen nach § 394 FamFG zu löschen. Die Frist zur Erhebung eines Widerspruchs ist auf einen Monat festgesetzt.\nRechtsbehelfsbelehrung:\nGegen diese Verfügung können Sie Widerspruch einlegen. Der Widerspruch ist bei dem Amtsgericht Neuss, Breite Straße 48, 41460 Neuss schriftlich in deutscher Sprache oder zur Niederschrift der Geschäftsstelle einzulegen. Der Widerspruch kann auch zur Niederschrift der Geschäftsstelle eines jeden Amtsgerichtes abgegeben werden. Die Einlegung ist auch durch Übertragung eines elektronischen Dokuments an die elektronische Poststelle des Gerichts möglich. Das elektronische Dokument muss für die Bearbeitung durch das Gericht geeignet und mit einer qualifizierten elektronischen Signatur der verantwortenden Person versehen sein oder von der verantwortenden Person signiert und auf einem sicheren Übermittlungsweg gemäß § 130a ZPO nach näherer Maßgabe der Verordnung über die technischen Rahmenbedingungen des elektronischen Rechtsverkehrs und über das besondere elektronische Behördenpostfach (BGBl. I, S.3803) eingereicht werden. Weitere Informationen erhalten Sie auf der Internetseite www.justiz.de.\nDer Widerspruch muss spätestens innerhalb der gesetzten Frist bei dem Amtsgericht Neuss eingegangen sein. Dies gilt auch dann, wenn der Widerspruch zur Niederschrift der Geschäftsstelle eines anderen Amtsgerichtes abgegeben wurde. Die Frist beginnt mit der Veröffentlichung. Fällt das Ende der Frist auf einen Sonntag, einen allgemeinen Feiertag oder Sonnabend, so endet die Frist mit Ablauf des nächsten Werktages. Der Widerspruch muss die Bezeichnung der angefochtenen Verfügung sowie die Erklärung enthalten, dass Widerspruch gegen diese Verfügung eingelegt wird. Er ist zu unterzeichnen und soll begründet werden."
    },
    {
      "date": "2025-06-04",
      "id": "111201",
      "original_text": "Registerbekanntmachung nach dem Umwandlungsgesetz\nNordrhein-Westfalen Amtsgericht Köln HRB 981\nRaiffeisen Agrarholding Kartoffeln Köln GmbH – Köln",
      "type": "Registerbekanntmachung nach dem Umwandlungsgesetz",
      "state": "Nordrhein-Westfalen",
      "amtsgericht": "Amtsgericht Köln",
      "registernummer": "HRB 981",
      "registerart": "HRB",
      "company_name": "Raiffeisen Agrarholding Kartoffeln Köln GmbH",
      "company_seat": "Köln",
      "details": "04.06.2025 (Bekanntmachungsdatum)\n\nNordrhein-Westfalen Amtsgericht Köln HRB 981\nRegisterbekanntmachung nach dem Umwandlungsgesetz 04.06.2025 (Eintragungsdatum)\n\nRaiffeisen Agrarholding Kartoffeln Köln GmbH\nGesellschaft mit beschränkter Haftung\nKöln\n\nDen Gläubigern der an der Abspaltung beteiligten Rechtsträger ist, wenn sie binnen sechs Monaten nach dem Tag, an dem die Eintragung der Abspaltung in das Register des Sitzes desjenigen Rechtsträgers, dessen Gläubiger sie sind, nach § 19 Absatz 3 UmwG als bekanntgemacht gilt, ihren Anspruch nach Grund und Höhe schriftlich anmelden, Sicherheit zu leisten, soweit sie nicht Befriedigung verlangen können. Dieses Recht steht den Gläubigern jedoch nur zu, wenn sie glaubhaft machen, dass durch die Abspaltung die Erfüllung ihrer Forderung gefährdet wird."
    },
    {
      "date": "2025-06-04",
      "id": "111202",
      "original_text": "Löschungsankündigung\nNordrhein-Westfalen Amtsgericht Kleve HRB 19513\nTuebtec GmbH – Goch",
      "type": "Löschungsankündigung",
      "state": "Nordrhein-Westfalen",
      "amtsgericht": "Amtsgericht Kleve",
      "registernummer": "HRB 19513",
      "registerart": "HRB",
      "company_name": "Tuebtec GmbH",
      "company_seat": "Goch",
      "details": "04.06.2025 (Bekanntmachungsdatum)\n\nNordrhein-Westfalen Amtsgericht Kleve HRB 19513\nLöschungsankündigung\n\nTuebtec GmbH\nGesellschaft mit beschränkter Haftung\nGoch\n\nDas Registergericht beabsichtigt die Gesellschaft von Amts wegen nach § 394 FamFG zu löschen. Die Frist zur Erhebung eines Widerspruchs ist auf einen Monat festgesetzt."
    },
    {
      "date": "2025-06-04",
      "id": "111203",
      "original_text": "Einreichung neuer Dokumente\nNordrhein-Westfalen Amtsgericht Aachen HRB 24167\nCSB-System SE – Geilenkirchen",
      "type": "Einreichung neuer Dokumente",
      "state": "Nordrhein-Westfalen",
      "amtsgericht": "Amtsgericht Aachen",
      "registernummer": "HRB 24167",
      "registerart": "HRB",
      "company_name": "CSB-System SE",
      "company_seat": "Geilenkirchen",
      "details": "04.06.2025 (Bekanntmachungsdatum)\n\nNordrhein-Westfalen Amtsgericht Aachen HRB 24167\nEinreichung neuer Dokumente\n\nCSB-System SE\nEuropäische Aktiengesellschaft (SE)\nGeilenkirchen\n\nDem Registergericht ist eine neue Liste der Mitglieder des Aufsichtsrates eingereicht worden."
    },
    {
      "date": "2025-06-04",
      "id": "111204",
      "original_text": "Löschungsankündigung\nNordrhein-Westfalen Amtsgericht Essen HRA 8376\nMEDIVESTA Immobilien Fonds III GmbH & Co. KG – Essen",
      "type": "Löschungsankündigung",
      "state": "Nordrhein-Westfalen",
      "amtsgericht": "Amtsgericht Essen",
      "registernummer": "HRA 8376",
      "registerart": "HRA",
      "company_name": "MEDIVESTA Immobilien Fonds III GmbH & Co. KG",
      "company_seat": "Essen",
      "details": "04.06.2025 (Bekanntmachungsdatum)\n\nNordrhein-Westfalen Amtsgericht Essen HRA 8376\nLöschungsankündigung\n\nMEDIVESTA Immobilien Fonds III GmbH & Co. KG\nKommanditgesellschaft\nEssen\n\nDas Registergericht beabsichtigt die Firma von Amts wegen nach § 394 FamFG zu löschen. Die Frist zur Erhebung eines Widerspruchs ist auf einen Monat festgesetzt."
    },
    {
      "date": "2025-06-04",
      "id": "111205",
      "original_text": "Sonstige Registerbekanntmachung\nNordrhein-Westfalen Amtsgericht Mönchengladbach HRB 17823\nM-L ENERGIE UG (haftungsbeschränkt) – Viersen",
      "type": "Sonstige Registerbekanntmachung",
      "state": "Nordrhein-Westfalen",
      "amtsgericht": "Amtsgericht Mönchengladbach",
      "registernummer": "HRB 17823",
      "registerart": "HRB",
      "company_name": "M-L ENERGIE UG (haftungsbeschränkt)",
      "company_seat": "Viersen",
      "details": "04.06.2025 (Bekanntmachungsdatum)\n\nNordrhein-Westfalen Amtsgericht Mönchengladbach HRB 17823\nSonstige Registerbekanntmachung 04.06.2025 (Eintragungsdatum)\n\nM-L ENERGIE UG (haftungsbeschränkt)\nGesellschaft mit beschränkter Haftung\nViersen\n\nAls nicht eingetragen wird veröffentlicht: Den Gläubigern der Gesellschaft, deren Forderungen begründet worden sind bevor die Eintragung der Beendigung des Gewinnabführungsvertrages  in das Handelsregister nach § 10 des Handelsgesetzbuches als bekanntgemacht gilt, hat der andere Vertragsteil Sicherheit zu leisten, wenn sie sich binnen sechs Monaten nach der Bekanntmachung der Eintragung zu diesem Zweck bei ihm melden."
    },
    {
      "date": "2025-06-04",
      "id": "111206",
      "original_text": "Löschungsankündigung\nNordrhein-Westfalen Amtsgericht Düsseldorf HRB 91282\nJ&C Media UG (haftungsbeschränkt) – Düsseldorf",
      "type": "Löschungsankündigung",
      "state": "Nordrhein-Westfalen",
      "amtsgericht": "Amtsgericht Düsseldorf",
      "registernummer": "HRB 91282",
      "registerart": "HRB",
      "company_name": "J&C Media UG (haftungsbeschränkt)",
      "company_seat": "Düsseldorf",
      "details": "04.06.2025 (Bekanntmachungsdatum)\n\nNordrhein-Westfalen Amtsgericht Düsseldorf HRB 91282\nLöschungsankündigung\n\nJ&C Media UG (haftungsbeschränkt)\nGesellschaft mit beschränkter Haftung\nDüsseldorf\n\nDas Registergericht beabsichtigt die Gesellschaft von Amts wegen nach § 394 FamFG zu löschen. Die Frist zur Erhebung eines Widerspruchs ist auf 3 Wochen festgesetzt.\n\nRechtsbehelfsbelehrung:\nDas Widerspruchsrecht steht jedem zu, der an der Unterlassung der Löschung ein berechtigtes Interesse hat. Der Widerspruch ist bei dem Amtsgericht Düsseldorf -Registergericht-, Werdener Straße 1, 40227 Düsseldorf schriftlich in deutscher Sprache oder zur Niederschrift der Geschäftsstelle einzulegen. Der Widerspruch kann auch zur Niederschrift der Geschäftsstelle eines jeden Amtsgerichtes abgegeben werden. Die Einlegung ist auch durch Übertragung eines elektronischen Dokuments an die elektronische Poststelle des Gerichts möglich. Das elektronische Dokument muss für die Bearbeitung durch das Gericht geeignet und mit einer qualifizierten elektronischen Signatur der verantwortenden Person versehen sein oder von der verantwortenden Person signiert und auf einem sicheren Übermittlungsweg gemäß § 130a ZPO nach näherer Maßgabe der Verordnung über die technischen Rahmenbedingungen des elektronischen Rechtsverkehrs und über das besondere elektronische Behördenpostfach (BGBl. I, S.3803) eingereicht werden. Weitere Informationen erhalten Sie auf der Internetseite www.justiz.de.\nDer Widerspruch muss spätestens innerhalb der gesetzten Frist nach dem Datum der Bekanntmachung der Löschungsankündigung bei dem Amtsgericht - Registergericht - Düsseldorf eingegangen sein.  Dies gilt auch dann, wenn der Widerspruch zur Niederschrift der Geschäftsstelle eines anderen Amtsgerichtes abgegeben wurde. Die Frist beginnt mit dem Tage der Bekanntmachung der Löschungsankündigung in dem für die Bekanntmachung der Eintragungen in das Handelsregister bestimmten elektronischen Informations- und Kommunikationssystem nach § 10 des Handelsgesetzbuches. Fällt das Ende der Frist auf einen Sonntag, einen allgemeinen Feiertag oder Sonnabend, so endet die Frist mit Ablauf des nächsten Werktages.\nDer Widerspruch muss die Bezeichnung der angefochtenen Löschungsankündigung sowie die Erklärung enthalten, dass Widerspruch gegen diese Löschungsankündigung eingelegt wird. Er ist zu unterzeichnen und soll begründet werden."
    },
    {
      "date": "2025-06-04",
      "id": "111207",
      "original_text": "Registerbekanntmachung nach dem Umwandlungsgesetz\nNordrhein-Westfalen Amtsgericht Neuss HRB 20974\nALDI Dormagen Verwaltungs-SE – Dormagen",
      "type": "Registerbekanntmachung nach dem Umwandlungsgesetz",
      "state": "Nordrhein-Westfalen",
      "amtsgericht": "Amtsgericht Neuss",
      "registernummer": "HRB 20974",
      "registerart": "HRB",
      "company_name": "ALDI Dormagen Verwaltungs-SE",
      "company_seat": "Dormagen",
      "details": "04.06.2025 (Bekanntmachungsdatum)\n\nNordrhein-Westfalen Amtsgericht Neuss HRB 20974\nRegisterbekanntmachung nach dem Umwandlungsgesetz 04.06.2025 (Eintragungsdatum)\n\nALDI Dormagen Verwaltungs-SE\nEuropäische Aktiengesellschaft (SE)\nDormagen\n\nDen Gläubigern der an der Verschmelzung beteiligten Rechtsträger ist, wenn sie binnen sechs Monaten nach dem Tag, an dem die Eintragung der Verschmelzung in das Register des Sitzes derjenigen Rechtsträger deren Gläubiger sie sind, nach § 19 Absatz 3 UmwG als bekanntgemacht gilt, ihren Anspruch nach Grund und Höhe schriftlich anmelden, Sicherheit zu leisten, soweit sie nicht Befriedigung verlangen können. Dieses Recht steht den Gläubigern jedoch nur zu, wenn sie glaubhaft machen, dass durch die Verschmelzung die Erfüllung ihrer Forderung gefährdet wird."
    },
    {
      "date": "2025-06-04",
      "id": "111208",
      "original_text": "Sonstige Registerbekanntmachung\nNordrhein-Westfalen Amtsgericht Gelsenkirchen HRB 7527\nRuhr Oel GmbH – Gelsenkirchen",
      "type": "Sonstige Registerbekanntmachung",
      "state": "Nordrhein-Westfalen",
      "amtsgericht": "Amtsgericht Gelsenkirchen",
      "registernummer": "HRB 7527",
      "registerart": "HRB",
      "company_name": "Ruhr Oel GmbH",
      "company_seat": "Gelsenkirchen",
      "details": "04.06.2025 (Bekanntmachungsdatum)\n\nNordrhein-Westfalen Amtsgericht Gelsenkirchen HRB 7527\nSonstige Registerbekanntmachung 03.06.2025 (Eintragungsdatum)\n\nRuhr Oel GmbH\nGesellschaft mit beschränkter Haftung\nGelsenkirchen\n\nDem Registergericht ist eine neue Liste der Mitglieder des Aufsichtsrates eingereicht worden."
    },
    {
      "date": "2025-06-04",
      "id": "111209",
      "original_text": "Registerbekanntmachung nach dem Umwandlungsgesetz\nNordrhein-Westfalen Amtsgericht Bonn HRA 10270\nHausmeisterservice Müller e. K. – Meckenheim",
      "type": "Registerbekanntmachung nach dem Umwandlungsgesetz",
      "state": "Nordrhein-Westfalen",
      "amtsgericht": "Amtsgericht Bonn",
      "registernummer": "HRA 10270",
      "registerart": "HRA",
      "company_name": "Hausmeisterservice Müller e. K.",
      "company_seat": "Meckenheim",
      "details": "04.06.2025 (Bekanntmachungsdatum)\n\nNordrhein-Westfalen Amtsgericht Bonn HRA 10270\nRegisterbekanntmachung nach dem Umwandlungsgesetz 04.06.2025 (Eintragungsdatum)\n\nHausmeisterservice Müller e. K.\nEinzelkaufmann / Einzelkauffrau\nMeckenheim\n\nDen Gläubigern der an der Ausgliederung beteiligten Rechtsträger ist, wenn sie binnen sechs Monaten nach dem Tag, an dem die Eintragung der Ausgliederung in das Register des Sitzes desjenigen Rechtsträgers, dessen Gläubiger sie sind, nach § 19 Absatz 3 UmwG als bekanntgemacht gilt, ihren Anspruch nach Grund und Höhe schriftlich anmelden, Sicherheit zu leisten, soweit sie nicht Befriedigung verlangen können. Dieses Recht steht den Gläubigern jedoch nur zu, wenn sie glaubhaft machen, dass durch die Ausgliederung die Erfüllung ihrer Forderung gefährdet wird."
    },
    {
      "date": "2025-06-04",
      "id": "111210",
      "original_text": "Einreichung neuer Dokumente\nNordrhein-Westfalen Amtsgericht Dortmund HRB 19108\nSIGNAL IDUNA Allgemeine Versicherung Aktiengesellschaft – Dortmund",
      "type": "Einreichung neuer Dokumente",
      "state": "Nordrhein-Westfalen",
      "amtsgericht": "Amtsgericht Dortmund",
      "registernummer": "HRB 19108",
      "registerart": "HRB",
      "company_name": "SIGNAL IDUNA Allgemeine Versicherung Aktiengesellschaft",
      "company_seat": "Dortmund",
      "details": "04.06.2025 (Bekanntmachungsdatum)\n\nNordrhein-Westfalen Amtsgericht Dortmund HRB 19108\nEinreichung neuer Dokumente 04.06.2025 (Eintragungsdatum)\n\nSIGNAL IDUNA Allgemeine Versicherung Aktiengesellschaft\nAktiengesellschaft\nDortmund\n\nDem Registergericht ist eine neue Liste der Mitglieder des Aufsichtsrates eingereicht worden."
    },
    {
      "date": "2025-06-04",
      "id": "111211",
      "original_text": "Einreichung neuer Dokumente\nNordrhein-Westfalen Amtsgericht Aachen HRB 16590\nAIXTRON SE – Herzogenrath",
      "type": "Einreichung neuer Dokumente",
      "state": "Nordrhein-Westfalen",
      "amtsgericht": "Amtsgericht Aachen",
      "registernummer": "HRB 16590",
      "registerart": "HRB",
      "company_name": "AIXTRON SE",
      "company_seat": "Herzogenrath",
      "details": "04.06.2025 (Bekanntmachungsdatum)\n\nNordrhein-Westfalen Amtsgericht Aachen HRB 16590\nEinreichung neuer Dokumente 04.06.2025 (Eintragungsdatum)\n\nAIXTRON SE\nEuropäische Aktiengesellschaft (SE)\nHerzogenrath\n\nDem Registergericht ist eine Liste der Mitglieder des Aufsichtsrates eingereicht worden."
    },
    {
      "date": "2025-06-04",
      "id": "111212",
      "original_text": "Registerbekanntmachung nach dem Umwandlungsgesetz\nNordrhein-Westfalen Amtsgericht Köln HRB 37013\nBechtle GmbH – Köln",
      "type": "Registerbekanntmachung nach dem Umwandlungsgesetz",
      "state": "Nordrhein-Westfalen",
      "amtsgericht": "Amtsgericht Köln",
      "registernummer": "HRB 37013",
      "registerart": "HRB",
      "company_name": "Bechtle GmbH",
      "company_seat": "Köln",
      "details": "04.06.2025 (Bekanntmachungsdatum)\n\nNordrhein-Westfalen Amtsgericht Köln HRB 37013\nRegisterbekanntmachung nach dem Umwandlungsgesetz 04.06.2025 (Eintragungsdatum)\n\nBechtle GmbH\nGesellschaft mit beschränkter Haftung\nKöln\n\nDen Gläubigern der an der Verschmelzung beteiligten Rechtsträger ist, wenn sie binnen sechs Monaten nach dem Tag, an dem die Eintragung der Verschmelzung in das Register des Sitzes desjenigen Rechtsträgers, dessen Gläubiger sie sind, nach § 19 Absatz 3 UmwG als bekanntgemacht gilt, ihren Anspruch nach Grund und Höhe schriftlich anmelden, Sicherheit zu leisten, soweit sie nicht Befriedigung verlangen können. Dieses Recht steht den Gläubigern jedoch nur zu, wenn sie glaubhaft machen, dass durch die Verschmelzung die Erfüllung ihrer Forderung gefährdet wird."
    },
    {
      "date": "2025-06-04",
      "id": "111213",
      "original_text": "Registerbekanntmachung nach dem Umwandlungsgesetz\nNordrhein-Westfalen Amtsgericht Bad Oeynhausen HRB 17348\nFranke Smart Security GmbH – Löhne",
      "type": "Registerbekanntmachung nach dem Umwandlungsgesetz",
      "state": "Nordrhein-Westfalen",
      "amtsgericht": "Amtsgericht Bad Oeynhausen",
      "registernummer": "HRB 17348",
      "registerart": "HRB",
      "company_name": "Franke Smart Security GmbH",
      "company_seat": "Löhne",
      "details": "04.06.2025 (Bekanntmachungsdatum)\n\nNordrhein-Westfalen Amtsgericht Bad Oeynhausen HRB 17348\nRegisterbekanntmachung nach dem Umwandlungsgesetz 04.06.2025 (Eintragungsdatum)\n\nFranke Smart Security GmbH\nGesellschaft mit beschränkter Haftung\nLöhne\n\nDen Gläubigern der an der Verschmelzung beteiligten Rechtsträger ist, wenn sie binnen sechs Monaten nach dem Tag, an dem die Eintragung der Verschmelzung in das Register des Sitzes desjenigen Rechtsträgers, dessen Gläubiger sie sind, nach § 19 Absatz 3 UmwG als bekanntgemacht gilt, ihren Anspruch nach Grund und Höhe schriftlich anmelden, Sicherheit zu leisten, soweit sie nicht Befriedigung verlangen können. Dieses Recht steht den Gläubigern jedoch nur zu, wenn sie glaubhaft machen, dass durch die Verschmelzung die Erfüllung ihrer Forderung gefährdet wird."
    },
    {
      "date": "2025-06-04",
      "id": "111214",
      "original_text": "Registerbekanntmachung nach dem Umwandlungsgesetz\nNordrhein-Westfalen Amtsgericht Münster HRB 18576\nCAR Cafe and Relax GmbH – Münster",
      "type": "Registerbekanntmachung nach dem Umwandlungsgesetz",
      "state": "Nordrhein-Westfalen",
      "amtsgericht": "Amtsgericht Münster",
      "registernummer": "HRB 18576",
      "registerart": "HRB",
      "company_name": "CAR Cafe and Relax GmbH",
      "company_seat": "Münster",
      "details": "04.06.2025 (Bekanntmachungsdatum)\n\nNordrhein-Westfalen Amtsgericht Münster HRB 18576\nRegisterbekanntmachung nach dem Umwandlungsgesetz 28.05.2025 (Eintragungsdatum)\n\nCAR Cafe and Relax GmbH\nGesellschaft mit beschränkter Haftung\nMünster\n\nDen Gläubigern der an der Verschmelzung beteiligten Rechtsträger ist, wenn sie binnen sechs Monaten nach dem Tag, an dem die Eintragung der Verschmelzung in das Register des Sitzes desjenigen Rechtsträgers, dessen Gläubiger sie sind, nach § 19 Absatz 3 UmwG als bekanntgemacht gilt, ihren Anspruch nach Grund und Höhe schriftlich anmelden, Sicherheit zu leisten, soweit sie nicht Befriedigung verlangen können. Dieses Recht steht den Gläubigern jedoch nur zu, wenn sie glaubhaft machen, dass durch die Verschmelzung die Erfüllung ihrer Forderung gefährdet wird."
    },
    {
      "date": "2025-06-04",
      "id": "111215",
      "original_text": "Löschungsankündigung\nNordrhein-Westfalen Amtsgericht Düsseldorf HRB 93657\nTaco Comer Rodriguez Gonzalez UG (haftungsbeschränkt) – Ratingen",
      "type": "Löschungsankündigung",
      "state": "Nordrhein-Westfalen",
      "amtsgericht": "Amtsgericht Düsseldorf",
      "registernummer": "HRB 93657",
      "registerart": "HRB",
      "company_name": "Taco Comer Rodriguez Gonzalez UG (haftungsbeschränkt)",
      "company_seat": "Ratingen",
      "details": "04.06.2025 (Bekanntmachungsdatum)\n\nNordrhein-Westfalen Amtsgericht Düsseldorf HRB 93657\nLöschungsankündigung\n\nTaco Comer Rodriguez Gonzalez UG (haftungsbeschränkt)\nGesellschaft mit beschränkter Haftung\nRatingen\n\nDas Registergericht beabsichtigt die Gesellschaft von Amts wegen nach § 394 FamFG zu löschen. Die Frist zur Erhebung eines Widerspruchs ist auf 3 Wochen festgesetzt.\n\nRechtsbehelfsbelehrung:\nDas Widerspruchsrecht steht jedem zu, der an der Unterlassung der Löschung ein berechtigtes Interesse hat. Der Widerspruch ist bei dem Amtsgericht Düsseldorf -Registergericht-, Werdener Straße 1, 40227 Düsseldorf schriftlich in deutscher Sprache oder zur Niederschrift der Geschäftsstelle einzulegen. Der Widerspruch kann auch zur Niederschrift der Geschäftsstelle eines jeden Amtsgerichtes abgegeben werden. Die Einlegung ist auch durch Übertragung eines elektronischen Dokuments an die elektronische Poststelle des Gerichts möglich. Das elektronische Dokument muss für die Bearbeitung durch das Gericht geeignet und mit einer qualifizierten elektronischen Signatur der verantwortenden Person versehen sein oder von der verantwortenden Person signiert und auf einem sicheren Übermittlungsweg gemäß § 130a ZPO nach näherer Maßgabe der Verordnung über die technischen Rahmenbedingungen des elektronischen Rechtsverkehrs und über das besondere elektronische Behördenpostfach (BGBl. I, S.3803) eingereicht werden. Weitere Informationen erhalten Sie auf der Internetseite www.justiz.de.\nDer Widerspruch muss spätestens innerhalb der gesetzten Frist nach dem Datum der Bekanntmachung der Löschungsankündigung bei dem Amtsgericht - Registergericht - Düsseldorf eingegangen sein.  Dies gilt auch dann, wenn der Widerspruch zur Niederschrift der Geschäftsstelle eines anderen Amtsgerichtes abgegeben wurde. Die Frist beginnt mit dem Tage der Bekanntmachung der Löschungsankündigung in dem für die Bekanntmachung der Eintragungen in das Handelsregister bestimmten elektronischen Informations- und Kommunikationssystem nach § 10 des Handelsgesetzbuches. Fällt das Ende der Frist auf einen Sonntag, einen allgemeinen Feiertag oder Sonnabend, so endet die Frist mit Ablauf des nächsten Werktages.\nDer Widerspruch muss die Bezeichnung der angefochtenen Löschungsankündigung sowie die Erklärung enthalten, dass Widerspruch gegen diese Löschungsankündigung eingelegt wird. Er ist zu unterzeichnen und soll begründet werden."
    },
    {
      "date": "2025-06-04",
      "id": "111216",
      "original_text": "Registerbekanntmachung nach dem Umwandlungsgesetz\nNordrhein-Westfalen Amtsgericht Köln HRB 82684\nHauptsaaten Seed & Service GmH – Köln",
      "type": "Registerbekanntmachung nach dem Umwandlungsgesetz",
      "state": "Nordrhein-Westfalen",
      "amtsgericht": "Amtsgericht Köln",
      "registernummer": "HRB 82684",
      "registerart": "HRB",
      "company_name": "Hauptsaaten Seed & Service GmH",
      "company_seat": "Köln",
      "details": "04.06.2025 (Bekanntmachungsdatum)\n\nNordrhein-Westfalen Amtsgericht Köln HRB 82684\nRegisterbekanntmachung nach dem Umwandlungsgesetz 04.06.2025 (Eintragungsdatum)\n\nHauptsaaten Seed & Service GmH\nGesellschaft mit beschränkter Haftung\nKöln\n\nDen Gläubigern der an der Abspaltung beteiligten Rechtsträger ist, wenn sie binnen sechs Monaten nach dem Tag, an dem die Eintragung der Abspaltung in das Register des Sitzes desjenigen Rechtsträgers, dessen Gläubiger sie sind, nach § 19 Absatz 3 UmwG als bekanntgemacht gilt, ihren Anspruch nach Grund und Höhe schriftlich anmelden, Sicherheit zu leisten, soweit sie nicht Befriedigung verlangen können. Dieses Recht steht den Gläubigern jedoch nur zu, wenn sie glaubhaft machen, dass durch die Abspaltung die Erfüllung ihrer Forderung gefährdet wird."
    },
    {
      "date": "2025-06-04",
      "id": "111217",
      "original_text": "Löschungsankündigung\nNordrhein-Westfalen Amtsgericht Kleve VR 10493 früher Amtsgericht Emmerich\nBundesverband Das Bessere Müll- & Pfand-Konzept Deutschland e.V. – Rees",
      "type": "Löschungsankündigung",
      "state": "Nordrhein-Westfalen",
      "amtsgericht": "Amtsgericht Kleve",
      "registernummer": "VR 10493",
      "registerart": "VR",
      "company_name": "Bundesverband Das Bessere Müll- & Pfand-Konzept Deutschland e.V.",
      "company_seat": "Rees",
      "former_amtsgericht": "Emmerich",
      "details": "04.06.2025 (Bekanntmachungsdatum)\n\nNordrhein-Westfalen Amtsgericht Kleve VR 10493 früher Amtsgericht Emmerich\nLöschungsankündigung\n\nBundesverband Das Bessere Müll- & Pfand-Konzept Deutschland e.V.\neingetragener Verein\nRees\n\nEs ist beabsichtigt, den Verein wegen Wegfalls sämtlicher Mitglieder zu löschen, §§ 4 VRV, 395 FamFG.\n\nEs wird Gelegenheit gegeben, binnen eines Monats gegen dieses Vorhaben Widerspruch einzulegen.\n\nRechtsbehelfsbelehrung:\n\nGegen diese Verfügung können Sie Widerspruch einlegen.\n\nDer Widerspruch ist bei dem Amtsgericht Kleve, Schloßberg (Schwanenburg) 1, 47533 Kleve schriftlich in deutscher Sprache oder zur Niederschrift der Geschäftsstelle einzulegen. Der Widerspruch kann auch zur Niederschrift der Geschäftsstelle eines jeden Amtsgerichtes abgegeben werden.\n\nDer Widerspruch muss spätestens innerhalb der gesetzten Frist nach der schriftlichen Bekanntgabe der Verfügung bei dem Amtsgericht Kleve eingegangen sein. Dies gilt auch dann, wenn der Widerspruch zur Niederschrift der Geschäftsstelle eines anderen Amtsgerichtes abgegeben wurde. Die Frist beginnt mit der schriftlichen Bekanntgabe der Verfügung, spätestens mit Ablauf von fünf Monaten nach Erlass der Verfügung. Die Bekanntgabe ist entweder durch Zustellung oder am dritten Tage nach Aufgabe zur Post bewirkt. Fällt das Ende der Frist auf einen Sonntag, einen allgemeinen Feiertag oder Sonnabend, so endet die Frist mit Ablauf des nächsten Werktages.\n\nDer Widerspruch muss die Bezeichnung der angefochtenen Verfügung sowie die Erklärung enthalten, dass Widerspruch gegen diese Verfügung eingelegt wird. Er ist zu unterzeichnen und soll begründet werden."
    },
    {
      "date": "2025-06-04",
      "id": "111218",
      "original_text": "Löschungsankündigung\nThüringen Amtsgericht Jena HRB 513102\nR & P Dienstleistungsservice UG (haftungsbeschränkt) – Gotha",
      "type": "Löschungsankündigung",
      "state": "Thüringen",
      "amtsgericht": "Amtsgericht Jena",
      "registernummer": "HRB 513102",
      "registerart": "HRB",
      "company_name": "R & P Dienstleistungsservice UG (haftungsbeschränkt)",
      "company_seat": "Gotha",
      "details": "04.06.2025 (Bekanntmachungsdatum)\n\nThüringen Amtsgericht Jena HRB 513102\nLöschungsankündigung\n\nR & P Dienstleistungsservice UG (haftungsbeschränkt)\nGesellschaft mit beschränkter Haftung\nGotha\n\nDas Registergericht beabsichtigt, die im Handelsregister eingetragene Gesellschaft wegen Vermögenslosigkeit nach § 394 FamFG von Amts wegen zu löschen. Die Frist zur Erhebung eines Widerspruchs gegen die beabsichtigte Löschung wird auf 6 Wochen festgesetzt."
    },
    {
      "date": "2025-06-04",
      "id": "111219",
      "original_text": "Registerbekanntmachung nach dem Umwandlungsgesetz\nThüringen Amtsgericht Jena HRA 506873\nBaumservice Floßmann, Inh. Steffen Floßmann e.K. – Hörsel",
      "type": "Registerbekanntmachung nach dem Umwandlungsgesetz",
      "state": "Thüringen",
      "amtsgericht": "Amtsgericht Jena",
      "registernummer": "HRA 506873",
      "registerart": "HRA",
      "company_name": "Baumservice Floßmann, Inh. Steffen Floßmann e.K.",
      "company_seat": "Hörsel",
      "details": "04.06.2025 (Bekanntmachungsdatum)\n\nThüringen Amtsgericht Jena HRA 506873\nRegisterbekanntmachung nach dem Umwandlungsgesetz 04.06.2025 (Eintragungsdatum)\n\nBaumservice Floßmann, Inh. Steffen Floßmann e.K.\nEinzelkaufmann / Einzelkauffrau\nHörsel\n\nNicht eingetragen: Den Gläubigern der an der Ausgliederung beteiligten Rechtsträger, ist wenn sie binnen sechs Monaten nach dem Tag, an dem die Eintragung der Ausgliederung in das Register des Sitzes desjenigen Rechtsträgers, dessen Gläubiger sie sind, nach §§125, 19 Abs. 3 UmwG als bekanntgemacht gilt, ihren Anspruch nach Grund und Höhe schriftlich anmelden, Sicherheit zu leisten, soweit sie nicht Befriedigung verlangen können. Dieses Recht steht ihnen jedoch nur zu, wenn sie glaubhaft machen, daß durch die Ausgliederung die Erfüllung ihrer Forderung gefährdet wird."
    },
    {
      "date": "2025-06-04",
      "id": "111220",
      "original_text": "Registerbekanntmachung nach dem Umwandlungsgesetz\nThüringen Amtsgericht Jena HRB 522450\nBaumservice Floßmann GmbH – Hörsel",
      "type": "Registerbekanntmachung nach dem Umwandlungsgesetz",
      "state": "Thüringen",
      "amtsgericht": "Amtsgericht Jena",
      "registernummer": "HRB 522450",
      "registerart": "HRB",
      "company_name": "Baumservice Floßmann GmbH",
      "company_seat": "Hörsel",
      "details": "04.06.2025 (Bekanntmachungsdatum)\n\nThüringen Amtsgericht Jena HRB 522450\nRegisterbekanntmachung nach dem Umwandlungsgesetz 04.06.2025 (Eintragungsdatum)\n\nBaumservice Floßmann GmbH\nGesellschaft mit beschränkter Haftung\nHörsel\n\nNicht eingetragen: Den Gläubigern der an der Ausgliederung beteiligten Rechtsträger, ist wenn sie binnen sechs Monaten nach dem Tag, an dem die Eintragung der Ausgliederung in das Register des Sitzes desjenigen Rechtsträgers, dessen Gläubiger sie sind, nach §§125, 19 Abs. 3 UmwG als bekanntgemacht gilt, ihren Anspruch nach Grund und Höhe schriftlich anmelden, Sicherheit zu leisten, soweit sie nicht Befriedigung verlangen können. Dieses Recht steht ihnen jedoch nur zu, wenn sie glaubhaft machen, daß durch die Ausgliederung die Erfüllung ihrer Forderung gefährdet wird."
    },
    {
      "date": "2025-06-04",
      "id": "111221",
      "original_text": "Registerbekanntmachung nach dem Umwandlungsgesetz\nHessen Amtsgericht Fulda HRA 1574\nKropp Immobilien Verwaltungs GmbH & Co. KG – Großenlüder",
      "type": "Registerbekanntmachung nach dem Umwandlungsgesetz",
      "state": "Hessen",
      "amtsgericht": "Amtsgericht Fulda",
      "registernummer": "HRA 1574",
      "registerart": "HRA",
      "company_name": "Kropp Immobilien Verwaltungs GmbH & Co. KG",
      "company_seat": "Großenlüder",
      "details": "04.06.2025 (Bekanntmachungsdatum)\n\nHessen Amtsgericht Fulda HRA 1574\nRegisterbekanntmachung nach dem Umwandlungsgesetz 04.06.2025 (Eintragungsdatum)\n\nKropp Immobilien Verwaltungs GmbH & Co. KG\nKommanditgesellschaft\nGroßenlüder\n\nDen Gläubigern der an der formwechselnden Umwandlung beteiligten Rechtsträger ist, wenn sie binnen sechs Monaten nach dem Tag, an dem die Eintragung der formwechselnden Umwandlung in das Register des Sitzes desjenigen Rechtsträgers, dessen Gläubiger sie sind, nach § 201 UmwG bekannt gemacht worden ist, ihren Anspruch nach Grund und Höhe schriftlich anmelden, Sicherheit zu leisten, soweit sie nicht Befriedigung verlangen können. Dieses Recht steht den Gläubigern jedoch nur zu, wenn sie glaubhaft machen, dass durch die formwechselnden Umwandlung die Erfüllung ihrer Forderung gefährdet wird."
    },
    {
      "date": "2025-06-04",
      "id": "111222",
      "original_text": "Registerbekanntmachung nach dem Umwandlungsgesetz\nHessen Amtsgericht Fulda HRA 6672\nMartin Reith e.K. – Künzell",
      "type": "Registerbekanntmachung nach dem Umwandlungsgesetz",
      "state": "Hessen",
      "amtsgericht": "Amtsgericht Fulda",
      "registernummer": "HRA 6672",
      "registerart": "HRA",
      "company_name": "Martin Reith e.K.",
      "company_seat": "Künzell",
      "details": "04.06.2025 (Bekanntmachungsdatum)\n\nHessen Amtsgericht Fulda HRA 6672\nRegisterbekanntmachung nach dem Umwandlungsgesetz 04.06.2025 (Eintragungsdatum)\n\nMartin Reith e.K.\nEinzelkaufmann / Einzelkauffrau\nKünzell\n\nDen Gläubigern der an der Ausgliederung beteiligten Rechtsträger ist, wenn sie binnen sechs Monaten nach dem Tag, an dem die Eintragung der Ausgliederung in das Register des Sitzes desjenigen Rechtsträgers, dessen Gläubiger sie sind, nach §§ 125, 19 Absatz 3 UmwG bekannt gemacht worden ist, ihren Anspruch nach Grund und Höhe schriftlich anmelden, Sicherheit zu leisten, soweit sie nicht Befriedigung verlangen können. Dieses Recht steht den Gläubigern jedoch nur zu, wenn sie glaubhaft machen, dass durch die Ausgliederung die Erfüllung ihrer Forderung gefährdet wird."
    },
    {
      "date": "2025-06-04",
      "id": "111223",
      "original_text": "Registerbekanntmachung nach dem Umwandlungsgesetz\nHessen Amtsgericht Bad Homburg v.d.H. HRB 16058\nAB German Investments GmbH – Bad Homburg v. d. Höhe",
      "type": "Registerbekanntmachung nach dem Umwandlungsgesetz",
      "state": "Hessen",
      "amtsgericht": "Amtsgericht Bad Homburg v.d.H.",
      "registernummer": "HRB 16058",
      "registerart": "HRB",
      "company_name": "AB German Investments GmbH",
      "company_seat": "Bad Homburg v. d. Höhe",
      "details": "04.06.2025 (Bekanntmachungsdatum)\n\nHessen Amtsgericht Bad Homburg v.d.H. HRB 16058\nRegisterbekanntmachung nach dem Umwandlungsgesetz 04.06.2025 (Eintragungsdatum)\n\nAB German Investments GmbH\nGesellschaft mit beschränkter Haftung\nBad Homburg v. d. Höhe\n\nDen Gläubigern der an der Verschmelzung beteiligten Rechtsträger ist, wenn sie binnen sechs Monaten nach dem Tag, an dem die Eintragung der Verschmelzung in das Register des Sitzes desjenigen Rechtsträgers, dessen Gläubiger sie sind, nach § 19 Absatz 3 UmwG bekannt gemacht worden ist, ihren Anspruch nach Grund und Höhe schriftlich anmelden, Sicherheit zu leisten, soweit sie nicht Befriedigung verlangen können. Dieses Recht steht den Gläubigern jedoch nur zu, wenn sie glaubhaft machen, dass durch die Verschmelzung die Erfüllung ihrer Forderung gefährdet wird."
    },
    {
      "date": "2025-06-04",
      "id": "111224",
      "original_text": "Registerbekanntmachung nach dem Umwandlungsgesetz\nHessen Amtsgericht Fulda HRA 6676\nLandhotel Reith GmbH & Co. KG – Künzell",
      "type": "Registerbekanntmachung nach dem Umwandlungsgesetz",
      "state": "Hessen",
      "amtsgericht": "Amtsgericht Fulda",
      "registernummer": "HRA 6676",
      "registerart": "HRA",
      "company_name": "Landhotel Reith GmbH & Co. KG",
      "company_seat": "Künzell",
      "details": "04.06.2025 (Bekanntmachungsdatum)\n\nHessen Amtsgericht Fulda HRA 6676\nRegisterbekanntmachung nach dem Umwandlungsgesetz 04.06.2025 (Eintragungsdatum)\n\nLandhotel Reith GmbH & Co. KG\nKommanditgesellschaft\nKünzell\n\nDen Gläubigern der an der Ausgliederung beteiligten Rechtsträger ist, wenn sie binnen sechs Monaten nach dem Tag, an dem die Eintragung der Ausgliederung in das Register des Sitzes desjenigen Rechtsträgers, dessen Gläubiger sie sind, nach §§ 125, 19 Absatz 3 UmwG bekannt gemacht worden ist, ihren Anspruch nach Grund und Höhe schriftlich anmelden, Sicherheit zu leisten, soweit sie nicht Befriedigung verlangen können. Dieses Recht steht den Gläubigern jedoch nur zu, wenn sie glaubhaft machen, dass durch die Ausgliederung die Erfüllung ihrer Forderung gefährdet wird."
    },
    {
      "date": "2025-06-04",
      "id": "111225",
      "original_text": "Registerbekanntmachung nach dem Umwandlungsgesetz\nHessen Amtsgericht Darmstadt HRB 8987\nFitnesscenter One GmbH – Darmstadt",
      "type": "Registerbekanntmachung nach dem Umwandlungsgesetz",
      "state": "Hessen",
      "amtsgericht": "Amtsgericht Darmstadt",
      "registernummer": "HRB 8987",
      "registerart": "HRB",
      "company_name": "Fitnesscenter One GmbH",
      "company_seat": "Darmstadt",
      "details": "04.06.2025 (Bekanntmachungsdatum)\n\nHessen Amtsgericht Darmstadt HRB 8987\nRegisterbekanntmachung nach dem Umwandlungsgesetz 04.06.2025 (Eintragungsdatum)\n\nFitnesscenter One GmbH\nGesellschaft mit beschränkter Haftung\nDarmstadt\n\nDen Gläubigern der an der Verschmelzung beteiligten Rechtsträger ist, wenn sie binnen sechs Monaten nach dem Tag, an dem die Eintragung der Verschmelzung in das Register des Sitzes derjenigen Rechtsträger deren Gläubiger sie sind, nach § 19 Absatz 3 UmwG bekannt gemacht worden ist, ihren Anspruch nach Grund und Höhe schriftlich anmelden, Sicherheit zu leisten, soweit sie nicht Befriedigung verlangen können. Dieses Recht steht den Gläubigern jedoch nur zu, wenn sie glaubhaft machen, dass durch die Verschmelzung die Erfüllung ihrer Forderung gefährdet wird."
    },
    {
      "date": "2025-06-04",
      "id": "111226",
      "original_text": "Einreichung neuer Dokumente\nHessen Amtsgericht Offenbach am Main HRB 53717\nLight Mobility Solutions GmbH – Obertshausen",
      "type": "Einreichung neuer Dokumente",
      "state": "Hessen",
      "amtsgericht": "Amtsgericht Offenbach am Main",
      "registernummer": "HRB 53717",
      "registerart": "HRB",
      "company_name": "Light Mobility Solutions GmbH",
      "company_seat": "Obertshausen",
      "details": "04.06.2025 (Bekanntmachungsdatum)\n\nHessen Amtsgericht Offenbach am Main HRB 53717\nEinreichung neuer Dokumente 04.06.2025 (Eintragungsdatum)\n\nLight Mobility Solutions GmbH\nGesellschaft mit beschränkter Haftung\nObertshausen\n\nDurch eine Änderung in den Personen der Aufsichtsratsmitglieder ist eine Liste der Mitglieder des Aufsichtsrates zum Handelsregister eingereicht worden."
    },
    {
      "date": "2025-06-04",
      "id": "111227",
      "original_text": "Registerbekanntmachung nach dem Umwandlungsgesetz\nHessen Amtsgericht Frankfurt am Main HRB 73721\nNetScout Systems Germany GmbH – Frankfurt am Main",
      "type": "Registerbekanntmachung nach dem Umwandlungsgesetz",
      "state": "Hessen",
      "amtsgericht": "Amtsgericht Frankfurt am Main",
      "registernummer": "HRB 73721",
      "registerart": "HRB",
      "company_name": "NetScout Systems Germany GmbH",
      "company_seat": "Frankfurt am Main",
      "details": "04.06.2025 (Bekanntmachungsdatum)\n\nHessen Amtsgericht Frankfurt am Main HRB 73721\nRegisterbekanntmachung nach dem Umwandlungsgesetz 04.06.2025 (Eintragungsdatum)\n\nNetScout Systems Germany GmbH\nGesellschaft mit beschränkter Haftung\nFrankfurt am Main\n\nDen Gläubigern der an der Verschmelzung beteiligten Rechtsträger ist, wenn sie binnen sechs Monaten nach dem Tag, an dem die Eintragung der Verschmelzung in das Register des Sitzes desjenigen Rechtsträgers, dessen Gläubiger sie sind, nach § 19 Absatz 3 UmwG bekannt gemacht worden ist, ihren Anspruch nach Grund und Höhe schriftlich anmelden, Sicherheit zu leisten, soweit sie nicht Befriedigung verlangen können. Dieses Recht steht den Gläubigern jedoch nur zu, wenn sie glaubhaft machen, dass durch die Verschmelzung die Erfüllung ihrer Forderung gefährdet wird."
    },
    {
      "date": "2025-06-04",
      "id": "111228",
      "original_text": "Löschungsankündigung\nHessen Amtsgericht Offenbach am Main HRB 46364\nSensor Technologies Europe LLC Zweigniederlassung Deutschland – Rödermark",
      "type": "Löschungsankündigung",
      "state": "Hessen",
      "amtsgericht": "Amtsgericht Offenbach am Main",
      "registernummer": "HRB 46364",
      "registerart": "HRB",
      "company_name": "Sensor Technologies Europe LLC Zweigniederlassung Deutschland",
      "company_seat": "Rödermark",
      "details": "04.06.2025 (Bekanntmachungsdatum)\n\nHessen Amtsgericht Offenbach am Main HRB 46364\nLöschungsankündigung\n\nSensor Technologies Europe LLC Zweigniederlassung Deutschland\nRechtsform ausländischen Rechts HRB\nRödermark\n\nDas Registergericht beabsichtigt die im Handelsregister eingetragene Gesellschaft von Amts wegen nach § 395 FamFG zu löschen. Die Frist zur Erhebung eines Widerspruchs gegen die beabsichtigte Löschung wird auf 3 Monate festgesetzt."
    },
    {
      "date": "2025-06-04",
      "id": "111229",
      "original_text": "Registerbekanntmachung nach dem Umwandlungsgesetz\nHessen Amtsgericht Frankfurt am Main GsR 865\nCreanova-Nachfolge eGbR – Frankfurt am Main",
      "type": "Registerbekanntmachung nach dem Umwandlungsgesetz",
      "state": "Hessen",
      "amtsgericht": "Amtsgericht Frankfurt am Main",
      "registernummer": "GsR 865",
      "registerart": "GsR",
      "company_name": "Creanova-Nachfolge eGbR",
      "company_seat": "Frankfurt am Main",
      "details": "04.06.2025 (Bekanntmachungsdatum)\n\nHessen Amtsgericht Frankfurt am Main GsR 865\nRegisterbekanntmachung nach dem Umwandlungsgesetz 04.06.2025 (Eintragungsdatum)\n\nCreanova-Nachfolge eGbR\nGesellschaft bürgerlichen Rechts\nFrankfurt am Main\n\nDen Gläubigern der an der formwechselnden Umwandlung beteiligten Rechtsträger ist, wenn sie binnen sechs Monaten nach dem Tag, an dem die Eintragung der formwechselnden Umwandlung in das Register des Sitzes desjenigen Rechtsträgers, dessen Gläubiger sie sind, nach § 201 UmwG bekannt gemacht worden ist, ihren Anspruch nach Grund und Höhe schriftlich anmelden, Sicherheit zu leisten, soweit sie nicht Befriedigung verlangen können. Dieses Recht steht den Gläubigern jedoch nur zu, wenn sie glaubhaft machen, dass durch die formwechselnden Umwandlung die Erfüllung ihrer Forderung gefährdet wird."
    },
    {
      "date": "2025-06-04",
      "id": "111230",
      "original_text": "Registerbekanntmachung nach dem Umwandlungsgesetz\nHessen Amtsgericht Wiesbaden HRB 33739\nJK19 Ventures UG (haftungsbeschränkt) – Wiesbaden",
      "type": "Registerbekanntmachung nach dem Umwandlungsgesetz",
      "state": "Hessen",
      "amtsgericht": "Amtsgericht Wiesbaden",
      "registernummer": "HRB 33739",
      "registerart": "HRB",
      "company_name": "JK19 Ventures UG (haftungsbeschränkt)",
      "company_seat": "Wiesbaden",
      "details": "04.06.2025 (Bekanntmachungsdatum)\n\nHessen Amtsgericht Wiesbaden HRB 33739\nRegisterbekanntmachung nach dem Umwandlungsgesetz 04.06.2025 (Eintragungsdatum)\n\nJK19 Ventures UG (haftungsbeschränkt)\nGesellschaft mit beschränkter Haftung\nWiesbaden\n\nDen Gläubigern der an der Verschmelzung beteiligten Rechtsträger ist, wenn sie binnen sechs Monaten nach dem Tag, an dem die Eintragung der Verschmelzung in das Register des Sitzes desjenigen Rechtsträgers, dessen Gläubiger sie sind, nach § 19 Absatz 3 UmwG bekannt gemacht worden ist, ihren Anspruch nach Grund und Höhe schriftlich anmelden, Sicherheit zu leisten, soweit sie nicht Befriedigung verlangen können. Dieses Recht steht den Gläubigern jedoch nur zu, wenn sie glaubhaft machen, dass durch die Verschmelzung die Erfüllung ihrer Forderung gefährdet wird."
    },
    {
      "date": "2025-06-04",
      "id": "111231",
      "original_text": "Registerbekanntmachung nach dem Umwandlungsgesetz\nHessen Amtsgericht Wiesbaden HRB 31730\nObjekt Maison BAY 33 GmbH – Wiesbaden",
      "type": "Registerbekanntmachung nach dem Umwandlungsgesetz",
      "state": "Hessen",
      "amtsgericht": "Amtsgericht Wiesbaden",
      "registernummer": "HRB 31730",
      "registerart": "HRB",
      "company_name": "Objekt Maison BAY 33 GmbH",
      "company_seat": "Wiesbaden",
      "details": "04.06.2025 (Bekanntmachungsdatum)\n\nHessen Amtsgericht Wiesbaden HRB 31730\nRegisterbekanntmachung nach dem Umwandlungsgesetz 04.06.2025 (Eintragungsdatum)\n\nObjekt Maison BAY 33 GmbH\nGesellschaft mit beschränkter Haftung\nWiesbaden\n\nDen Gläubigern der an der Verschmelzung beteiligten Rechtsträger ist, wenn sie binnen sechs Monaten nach dem Tag, an dem die Eintragung der Verschmelzung in das Register des Sitzes derjenigen Rechtsträger deren Gläubiger sie sind, nach § 19 Absatz 3 UmwG bekannt gemacht worden ist, ihren Anspruch nach Grund und Höhe schriftlich anmelden, Sicherheit zu leisten, soweit sie nicht Befriedigung verlangen können. Dieses Recht steht den Gläubigern jedoch nur zu, wenn sie glaubhaft machen, dass durch die Verschmelzung die Erfüllung ihrer Forderung gefährdet wird."
    },
    {
      "date": "2025-06-04",
      "id": "111232",
      "original_text": "Löschungsankündigung\nHessen Amtsgericht Kassel HRA 6293\nTröster & Neuhaus, Inh. Jürgen Tröster e.Kfm. – Kassel",
      "type": "Löschungsankündigung",
      "state": "Hessen",
      "amtsgericht": "Amtsgericht Kassel",
      "registernummer": "HRA 6293",
      "registerart": "HRA",
      "company_name": "Tröster & Neuhaus, Inh. Jürgen Tröster e.Kfm.",
      "company_seat": "Kassel",
      "details": "04.06.2025 (Bekanntmachungsdatum)\n\nHessen Amtsgericht Kassel HRA 6293\nLöschungsankündigung\n\nTröster & Neuhaus, Inh. Jürgen Tröster e.Kfm.\nEinzelkaufmann / Einzelkauffrau\nKassel\n\nDas Registergericht beabsichtigt die im Handelsregister eingetragene Firma von Amts wegen nach § 31 Abs. 2 HGB zu löschen. Die Firma des Einzelkaufmanns ist erloschen, weil ein Handelsgewerbe nicht mehr betrieben wird. Die Frist zur Erhebung eines Widerspruchs gegen die beabsichtigte Löschung wird auf 1 Monat festgesetzt. Dieser kann schriftlich oder zur Protokoll der Geschäftsstelle bei dem Registergerichts des Amtsgerichts Kassel, Friedrichsstraße 32 bis 34, 34117 Kassel innerhalb von 1 Monat ab Veröffentlichung dieser Bekanntmachung erhoben werden."
    },
    {
      "date": "2025-06-04",
      "id": "111233",
      "original_text": "Löschungsankündigung\nHessen Amtsgericht Frankfurt am Main HRB 123830\nBEIKÖHN GmbH – Frankfurt am Main",
      "type": "Löschungsankündigung",
      "state": "Hessen",
      "amtsgericht": "Amtsgericht Frankfurt am Main",
      "registernummer": "HRB 123830",
      "registerart": "HRB",
      "company_name": "BEIKÖHN GmbH",
      "company_seat": "Frankfurt am Main",
      "details": "04.06.2025 (Bekanntmachungsdatum)\n\nHessen Amtsgericht Frankfurt am Main HRB 123830\nLöschungsankündigung\n\nBEIKÖHN GmbH\nGesellschaft mit beschränkter Haftung\nFrankfurt am Main\n\nDas Registergericht beabsichtigt die im Handelsregister eingetragene Gesellschaft von Amts wegen nach § 394 FamFG zu löschen. Hiergegen kann innerhalb eines Zeitraums von 1 Monat nach dieser Veröffentlichung Widerspruch beidem Amtsgericht Frankfurt am Main eingelegt werden."
    },
    {
      "date": "2025-06-04",
      "id": "111234",
      "original_text": "Registerbekanntmachung nach dem Umwandlungsgesetz\nHessen Amtsgericht Frankfurt am Main HRB 124551\nCreanova GmbH – Frankfurt am Main",
      "type": "Registerbekanntmachung nach dem Umwandlungsgesetz",
      "state": "Hessen",
      "amtsgericht": "Amtsgericht Frankfurt am Main",
      "registernummer": "HRB 124551",
      "registerart": "HRB",
      "company_name": "Creanova GmbH",
      "company_seat": "Frankfurt am Main",
      "details": "04.06.2025 (Bekanntmachungsdatum)\n\nHessen Amtsgericht Frankfurt am Main HRB 124551\nRegisterbekanntmachung nach dem Umwandlungsgesetz 04.06.2025 (Eintragungsdatum)\n\nCreanova GmbH\nGesellschaft mit beschränkter Haftung\nFrankfurt am Main\n\nDen Gläubigern der an der formwechselnden Umwandlung beteiligten Rechtsträger ist, wenn sie binnen sechs Monaten nach dem Tag, an dem die Eintragung der formwechselnden Umwandlung in das Register des Sitzes desjenigen Rechtsträgers, dessen Gläubiger sie sind, nach § 201 UmwG bekannt gemacht worden ist, ihren Anspruch nach Grund und Höhe schriftlich anmelden, Sicherheit zu leisten, soweit sie nicht Befriedigung verlangen können. Dieses Recht steht den Gläubigern jedoch nur zu, wenn sie glaubhaft machen, dass durch die formwechselnden Umwandlung die Erfüllung ihrer Forderung gefährdet wird."
    },
    {
      "date": "2025-06-04",
      "id": "111235",
      "original_text": "Löschungsankündigung\nHessen Amtsgericht Darmstadt HRA 85309\nDICO Gesellschaft für Galvanotechnik mit beschränkter Haftung & Co. KG – Lautertal",
      "type": "Löschungsankündigung",
      "state": "Hessen",
      "amtsgericht": "Amtsgericht Darmstadt",
      "registernummer": "HRA 85309",
      "registerart": "HRA",
      "company_name": "DICO Gesellschaft für Galvanotechnik mit beschränkter Haftung & Co. KG",
      "company_seat": "Lautertal",
      "details": "04.06.2025 (Bekanntmachungsdatum)\n\nHessen Amtsgericht Darmstadt HRA 85309\nLöschungsankündigung\n\nDICO Gesellschaft für Galvanotechnik mit beschränkter Haftung & Co. KG\nKommanditgesellschaft\nLautertal\n\nDas Registergericht beabsichtigt die im Handelsregister eingetragene Firma von Amts wegen nach § 31 Abs. 2 HGB zu löschen. Die Frist zur Erhebung eines Widerspruchs gegen die beabsichtigte Löschung wird auf 3 Monate festgesetzt."
    },
    {
      "date": "2025-06-04",
      "id": "111236",
      "original_text": "Registerbekanntmachung nach dem Umwandlungsgesetz\nHessen Amtsgericht Bad Homburg v.d.H. HRB 16057\nAB Global Pharma Investments GmbH – Bad Homburg v. d. Höhe",
      "type": "Registerbekanntmachung nach dem Umwandlungsgesetz",
      "state": "Hessen",
      "amtsgericht": "Amtsgericht Bad Homburg v.d.H.",
      "registernummer": "HRB 16057",
      "registerart": "HRB",
      "company_name": "AB Global Pharma Investments GmbH",
      "company_seat": "Bad Homburg v. d. Höhe",
      "details": "04.06.2025 (Bekanntmachungsdatum)\n\nHessen Amtsgericht Bad Homburg v.d.H. HRB 16057\nRegisterbekanntmachung nach dem Umwandlungsgesetz 04.06.2025 (Eintragungsdatum)\n\nAB Global Pharma Investments GmbH\nGesellschaft mit beschränkter Haftung\nBad Homburg v. d. Höhe\n\nDen Gläubigern der an der Verschmelzung beteiligten Rechtsträger ist, wenn sie binnen sechs Monaten nach dem Tag, an dem die Eintragung der Verschmelzung in das Register des Sitzes desjenigen Rechtsträgers, dessen Gläubiger sie sind, nach § 19 Absatz 3 UmwG bekannt gemacht worden ist, ihren Anspruch nach Grund und Höhe schriftlich anmelden, Sicherheit zu leisten, soweit sie nicht Befriedigung verlangen können. Dieses Recht steht den Gläubigern jedoch nur zu, wenn sie glaubhaft machen, dass durch die Verschmelzung die Erfüllung ihrer Forderung gefährdet wird."
    },
    {
      "date": "2025-06-04",
      "id": "111237",
      "original_text": "Sonstige Registerbekanntmachung\nHessen Amtsgericht Frankfurt am Main HRB 126056\nJ.P. Morgan SE – Frankfurt am Main",
      "type": "Sonstige Registerbekanntmachung",
      "state": "Hessen",
      "amtsgericht": "Amtsgericht Frankfurt am Main",
      "registernummer": "HRB 126056",
      "registerart": "HRB",
      "company_name": "J.P. Morgan SE",
      "company_seat": "Frankfurt am Main",
      "details": "04.06.2025 (Bekanntmachungsdatum)\n\nHessen Amtsgericht Frankfurt am Main HRB 126056\nSonstige Registerbekanntmachung 02.06.2025 (Eintragungsdatum)\n\nJ.P. Morgan SE\nEuropäische Aktiengesellschaft (SE)\nFrankfurt am Main\n\nDurch eine Änderung in den Personen der Aufsichtsratsmitglieder ist eine Liste der Mitglieder des Aufsichtsrates zum Handelsregister eingereicht worden."
    },
    {
      "date": "2025-06-04",
      "id": "111238",
      "original_text": "Löschungsankündigung\nHessen Amtsgericht Bad Homburg v.d.H. HRB 12447\nALMENA GmbH – Bad Homburg v. d. Höhe",
      "type": "Löschungsankündigung",
      "state": "Hessen",
      "amtsgericht": "Amtsgericht Bad Homburg v.d.H.",
      "registernummer": "HRB 12447",
      "registerart": "HRB",
      "company_name": "ALMENA GmbH",
      "company_seat": "Bad Homburg v. d. Höhe",
      "details": "04.06.2025 (Bekanntmachungsdatum)\n\nHessen Amtsgericht Bad Homburg v.d.H. HRB 12447\nLöschungsankündigung 04.06.2025 (Eintragungsdatum)\n\nALMENA GmbH\nGesellschaft mit beschränkter Haftung\nBad Homburg v. d. Höhe\n\nDas Registergericht beabsichtigt die im Handelsregister eingetragene Gesellschaft von Amts wegen nach § 394 FamFG zu löschen. Die Frist zur Erhebung eines Widerspruchs gegen die beabsichtigte Löschung wird auf 3 Monate festgesetzt."
    },
    {
      "date": "2025-06-04",
      "id": "111239",
      "original_text": "Registerbekanntmachung nach dem Umwandlungsgesetz\nHessen Amtsgericht Königstein HRB 2225\nI B O - Bau GmbH – Königstein im Taunus",
      "type": "Registerbekanntmachung nach dem Umwandlungsgesetz",
      "state": "Hessen",
      "amtsgericht": "Amtsgericht Königstein",
      "registernummer": "HRB 2225",
      "registerart": "HRB",
      "company_name": "I B O - Bau GmbH",
      "company_seat": "Königstein im Taunus",
      "details": "04.06.2025 (Bekanntmachungsdatum)\n\nHessen Amtsgericht Königstein HRB 2225\nRegisterbekanntmachung nach dem Umwandlungsgesetz 04.06.2025 (Eintragungsdatum)\n\nI B O - Bau GmbH\nGesellschaft mit beschränkter Haftung\nKönigstein im Taunus\n\nDen Gläubigern der an der Verschmelzung beteiligten Rechtsträger ist, wenn sie binnen sechs Monaten nach dem Tag, an dem die Eintragung der Verschmelzung in das Register des Sitzes desjenigen Rechtsträgers, dessen Gläubiger sie sind, nach § 19 Absatz 3 UmwG bekannt gemacht worden ist, ihren Anspruch nach Grund und Höhe schriftlich anmelden, Sicherheit zu leisten, soweit sie nicht Befriedigung verlangen können. Dieses Recht steht den Gläubigern jedoch nur zu, wenn sie glaubhaft machen, dass durch die Verschmelzung die Erfüllung ihrer Forderung gefährdet wird."
    }
  ]
}