{
  "date": "2025-06-07",
  "date_of_scrape": "2025-06-13T08:29:42.533Z",
  "tool_version": "0.2.0",
  "number_of_announcements": 25,
  "announcements": [
    {
      "date": "2025-06-07",
      "id": "111598",
      "original_text": "Registerbekanntmachung nach dem Umwandlungsgesetz\nBayern Amtsgericht Traunstein HRB 6324\nORCA Software GmbH – Neubeuern",
      "type": "Registerbekanntmachung nach dem Umwandlungsgesetz",
      "state": "Bayern",
      "amtsgericht": "Amtsgericht Traunstein",
      "registernummer": "HRB 6324",
      "registerart": "HRB",
      "company_name": "ORCA Software GmbH",
      "company_seat": "Neubeuern",
      "details": "07.06.2025 (Bekanntmachungsdatum)\n\nBayern Amtsgericht Traunstein HRB 6324\nRegisterbekanntmachung nach dem Umwandlungsgesetz 07.06.2025 (Eintragungsdatum)\n\nORCA Software GmbH\nGesellschaft mit beschränkter Haftung\nNeubeuern\n\nDen Gläubigern der an der Verschmelzung beteiligten Rechtsträger ist, wenn sie binnen sechs Monaten nach dem Tag, an dem die Eintragung der Verschmelzung in das Register des Sitzes desjenigen Rechtsträgers, dessen Gläubiger sie sind, nach § 19 Abs. 3 UmwG als bekannt gemacht gilt, ihren Anspruch nach Grund und Höhe in Textform anmelden, Sicherheit zu leisten, soweit sie nicht Befriedigung verlangen können. Dieses Recht steht den Gläubigern jedoch nur zu, wenn sie glaubhaft machen, dass durch die Verschmelzung die Erfüllung ihrer Forderung gefährdet wird."
    },
    {
      "date": "2025-06-07",
      "id": "111599",
      "original_text": "Registerbekanntmachung nach dem Umwandlungsgesetz\nBayern Amtsgericht München HRA 112158\nBaywobau Real Estate GmbH & Co. KG – Grünwald",
      "type": "Registerbekanntmachung nach dem Umwandlungsgesetz",
      "state": "Bayern",
      "amtsgericht": "Amtsgericht München",
      "registernummer": "HRA 112158",
      "registerart": "HRA",
      "company_name": "Baywobau Real Estate GmbH & Co. KG",
      "company_seat": "Grünwald",
      "details": "07.06.2025 (Bekanntmachungsdatum)\n\nBayern Amtsgericht München HRA 112158\nRegisterbekanntmachung nach dem Umwandlungsgesetz 06.06.2025 (Eintragungsdatum)\n\nBaywobau Real Estate GmbH & Co. KG\nKommanditgesellschaft\nGrünwald\n\nDen Gläubigern der an der Ausgliederung beteiligten Rechtsträger ist, wenn sie binnen sechs Monaten nach dem Tag, an dem die Eintragung der Ausgliederung in das Register des Sitzes desjenigen Rechtsträgers, dessen Gläubiger sie sind, nach §§ 125, 19 Abs. 3 UmwG als bekannt gemacht gilt, ihren Anspruch nach Grund und Höhe in Textform anmelden, Sicherheit zu leisten, soweit sie nicht Befriedigung verlangen können. Dieses Recht steht den Gläubigern jedoch nur zu, wenn sie glaubhaft machen, dass durch die Ausgliederung die Erfüllung ihrer Forderung gefährdet wird."
    },
    {
      "date": "2025-06-07",
      "id": "111600",
      "original_text": "Einreichung neuer Dokumente\nBayern Amtsgericht Fürth HRB 7924\nKennametal Holding GmbH – Fürth",
      "type": "Einreichung neuer Dokumente",
      "state": "Bayern",
      "amtsgericht": "Amtsgericht Fürth",
      "registernummer": "HRB 7924",
      "registerart": "HRB",
      "company_name": "Kennametal Holding GmbH",
      "company_seat": "Fürth",
      "details": "07.06.2025 (Bekanntmachungsdatum)\n\nBayern Amtsgericht Fürth HRB 7924\nEinreichung neuer Dokumente\n\nKennametal Holding GmbH\nGesellschaft mit beschränkter Haftung\nFürth\n\nDem Amtsgericht Fürth -Registergericht- ist eine Liste der Mitglieder des Aufsichtsrats eingereicht worden, § 52 Abs. 3 S. 2 GmbHG."
    },
    {
      "date": "2025-06-07",
      "id": "111601",
      "original_text": "Sonstige Registerbekanntmachung\nBayern Amtsgericht Traunstein HRB 8032\nW9 GmbH – Stephanskirchen",
      "type": "Sonstige Registerbekanntmachung",
      "state": "Bayern",
      "amtsgericht": "Amtsgericht Traunstein",
      "registernummer": "HRB 8032",
      "registerart": "HRB",
      "company_name": "W9 GmbH",
      "company_seat": "Stephanskirchen",
      "details": "07.06.2025 (Bekanntmachungsdatum)\n\nBayern Amtsgericht Traunstein HRB 8032\nSonstige Registerbekanntmachung 06.06.2025 (Eintragungsdatum)\n\nW9 GmbH\nGesellschaft mit beschränkter Haftung\nStephanskirchen\n\nDen Gläubigern der Gesellschaft, deren Forderungen begründet worden sind, bevor die Eintragung der Beendigung des Gewinnabführungsvertrages in das Handelsregister nach § 10 des Handelsgesetzbuches als bekanntgemacht gilt, hat der andere Vertragsteil Sicherheit zu leisten, wenn sie sich binnen sechs Monaten nach der Bekanntmachung der Eintragung zu diesem Zweck bei ihm melden."
    },
    {
      "date": "2025-06-07",
      "id": "111602",
      "original_text": "Registerbekanntmachung nach dem Umwandlungsgesetz\nBayern Amtsgericht Memmingen HRB 21613\nGerman Crowns Dental GmbH – Weißenhorn",
      "type": "Registerbekanntmachung nach dem Umwandlungsgesetz",
      "state": "Bayern",
      "amtsgericht": "Amtsgericht Memmingen",
      "registernummer": "HRB 21613",
      "registerart": "HRB",
      "company_name": "German Crowns Dental GmbH",
      "company_seat": "Weißenhorn",
      "details": "07.06.2025 (Bekanntmachungsdatum)\n\nBayern Amtsgericht Memmingen HRB 21613\nRegisterbekanntmachung nach dem Umwandlungsgesetz 06.06.2025 (Eintragungsdatum)\n\nGerman Crowns Dental GmbH\nGesellschaft mit beschränkter Haftung\nWeißenhorn\n\nDen Gläubigern der an der Ausgliederung beteiligten Rechtsträger ist, wenn sie binnen sechs Monaten nach dem Tag, an dem die Eintragung der Ausgliederung in das Register des Sitzes desjenigen Rechtsträgers, dessen Gläubiger sie sind, nach §§ 125, 19 Abs. 3 UmwG als bekannt gemacht gilt, ihren Anspruch nach Grund und Höhe in Textform anmelden, Sicherheit zu leisten, soweit sie nicht Befriedigung verlangen können. Dieses Recht steht den Gläubigern jedoch nur zu, wenn sie glaubhaft machen, dass durch die Ausgliederung die Erfüllung ihrer Forderung gefährdet wird."
    },
    {
      "date": "2025-06-07",
      "id": "111603",
      "original_text": "Sonstige Registerbekanntmachung\nBayern Amtsgericht Weiden i. d. OPf. GnR 113\nBaugenossenschaft Selbsthilfe eG – Weiden i.d.OPf.",
      "type": "Sonstige Registerbekanntmachung",
      "state": "Bayern",
      "amtsgericht": "Amtsgericht Weiden i. d. OPf.",
      "registernummer": "GnR 113",
      "registerart": "GnR",
      "company_name": "Baugenossenschaft Selbsthilfe eG",
      "company_seat": "Weiden i.d.OPf.",
      "details": "07.06.2025 (Bekanntmachungsdatum)\n\nBayern Amtsgericht Weiden i. d. OPf. GnR 113\nSonstige Registerbekanntmachung 03.06.2025 (Eintragungsdatum)\n\nBaugenossenschaft Selbsthilfe eG\neingetragene Genossenschaft\nWeiden i.d.OPf.\n\nDie Generalversammlung vom 07.12.2024 hat die Neufassung der Satzung beschlossen."
    },
    {
      "date": "2025-06-07",
      "id": "111604",
      "original_text": "Einreichung neuer Dokumente\nBayern Amtsgericht Traunstein HRB 13561\nFamilotel AG – Rosenheim",
      "type": "Einreichung neuer Dokumente",
      "state": "Bayern",
      "amtsgericht": "Amtsgericht Traunstein",
      "registernummer": "HRB 13561",
      "registerart": "HRB",
      "company_name": "Familotel AG",
      "company_seat": "Rosenheim",
      "details": "07.06.2025 (Bekanntmachungsdatum)\n\nBayern Amtsgericht Traunstein HRB 13561\nEinreichung neuer Dokumente\n\nFamilotel AG\nAktiengesellschaft\nRosenheim\n\nDem Amtsgericht Traunstein -Registergericht- ist eine Liste der Mitglieder des Aufsichtsrats eingereicht worden, § 106 AktG."
    },
    {
      "date": "2025-06-07",
      "id": "111605",
      "original_text": "Registerbekanntmachung nach dem Umwandlungsgesetz\nBayern Amtsgericht Fürth HRB 19465\nHoch-Verwaltung GmbH – Veitsbronn",
      "type": "Registerbekanntmachung nach dem Umwandlungsgesetz",
      "state": "Bayern",
      "amtsgericht": "Amtsgericht Fürth",
      "registernummer": "HRB 19465",
      "registerart": "HRB",
      "company_name": "Hoch-Verwaltung GmbH",
      "company_seat": "Veitsbronn",
      "details": "07.06.2025 (Bekanntmachungsdatum)\n\nBayern Amtsgericht Fürth HRB 19465\nRegisterbekanntmachung nach dem Umwandlungsgesetz 06.06.2025 (Eintragungsdatum)\n\nHoch-Verwaltung GmbH\nGesellschaft mit beschränkter Haftung\nVeitsbronn\n\nDen Gläubigern der an der Verschmelzung beteiligten Rechtsträger ist, wenn sie binnen sechs Monaten nach dem Tag, an dem die Eintragung der Verschmelzung in das Register des Sitzes desjenigen Rechtsträgers, dessen Gläubiger sie sind, nach § 19 Abs. 3 UmwG als bekannt gemacht gilt, ihren Anspruch nach Grund und Höhe in Textform anmelden, Sicherheit zu leisten, soweit sie nicht Befriedigung verlangen können. Dieses Recht steht den Gläubigern jedoch nur zu, wenn sie glaubhaft machen, dass durch die Verschmelzung die Erfüllung ihrer Forderung gefährdet wird."
    },
    {
      "date": "2025-06-07",
      "id": "111606",
      "original_text": "Registerbekanntmachung nach dem Umwandlungsgesetz\nBayern Amtsgericht Fürth HRB 16740\nImpulsEntwickler GmbH – Veitsbronn",
      "type": "Registerbekanntmachung nach dem Umwandlungsgesetz",
      "state": "Bayern",
      "amtsgericht": "Amtsgericht Fürth",
      "registernummer": "HRB 16740",
      "registerart": "HRB",
      "company_name": "ImpulsEntwickler GmbH",
      "company_seat": "Veitsbronn",
      "details": "07.06.2025 (Bekanntmachungsdatum)\n\nBayern Amtsgericht Fürth HRB 16740\nRegisterbekanntmachung nach dem Umwandlungsgesetz 06.06.2025 (Eintragungsdatum)\n\nImpulsEntwickler GmbH\nGesellschaft mit beschränkter Haftung\nVeitsbronn\n\nDen Gläubigern der an der Verschmelzung beteiligten Rechtsträger ist, wenn sie binnen sechs Monaten nach dem Tag, an dem die Eintragung der Verschmelzung in das Register des Sitzes desjenigen Rechtsträgers, dessen Gläubiger sie sind, nach § 19 Abs. 3 UmwG als bekannt gemacht gilt, ihren Anspruch nach Grund und Höhe in Textform anmelden, Sicherheit zu leisten, soweit sie nicht Befriedigung verlangen können. Dieses Recht steht den Gläubigern jedoch nur zu, wenn sie glaubhaft machen, dass durch die Verschmelzung die Erfüllung ihrer Forderung gefährdet wird."
    },
    {
      "date": "2025-06-07",
      "id": "111607",
      "original_text": "Registerbekanntmachung nach dem Umwandlungsgesetz\nBayern Amtsgericht München HRA 99244\nPREBAG Immobilien 22 GmbH & Co. KG – Aschheim",
      "type": "Registerbekanntmachung nach dem Umwandlungsgesetz",
      "state": "Bayern",
      "amtsgericht": "Amtsgericht München",
      "registernummer": "HRA 99244",
      "registerart": "HRA",
      "company_name": "PREBAG Immobilien 22 GmbH & Co. KG",
      "company_seat": "Aschheim",
      "details": "07.06.2025 (Bekanntmachungsdatum)\n\nBayern Amtsgericht München HRA 99244\nRegisterbekanntmachung nach dem Umwandlungsgesetz 06.06.2025 (Eintragungsdatum)\n\nPREBAG Immobilien 22 GmbH & Co. KG\nKommanditgesellschaft\nAschheim\n\nDen Gläubigern der an der Verschmelzung beteiligten Rechtsträger ist, wenn sie binnen sechs Monaten nach dem Tag, an dem die Eintragung der Verschmelzung in das Register des Sitzes desjenigen Rechtsträgers, dessen Gläubiger sie sind, nach § 19 Abs. 3 UmwG als bekannt gemacht gilt, ihren Anspruch nach Grund und Höhe in Textform anmelden, Sicherheit zu leisten, soweit sie nicht Befriedigung verlangen können. Dieses Recht steht den Gläubigern jedoch nur zu, wenn sie glaubhaft machen, dass durch die Verschmelzung die Erfüllung ihrer Forderung gefährdet wird."
    },
    {
      "date": "2025-06-07",
      "id": "111608",
      "original_text": "Registerbekanntmachung nach dem Umwandlungsgesetz\nBayern Amtsgericht Memmingen HRA 14266\nAndreas Leimbach Zahnwerkstatt e.K. – Weißenhorn",
      "type": "Registerbekanntmachung nach dem Umwandlungsgesetz",
      "state": "Bayern",
      "amtsgericht": "Amtsgericht Memmingen",
      "registernummer": "HRA 14266",
      "registerart": "HRA",
      "company_name": "Andreas Leimbach Zahnwerkstatt e.K.",
      "company_seat": "Weißenhorn",
      "details": "07.06.2025 (Bekanntmachungsdatum)\n\nBayern Amtsgericht Memmingen HRA 14266\nRegisterbekanntmachung nach dem Umwandlungsgesetz 06.06.2025 (Eintragungsdatum)\n\nAndreas Leimbach Zahnwerkstatt e.K.\nEinzelkaufmann / Einzelkauffrau\nWeißenhorn\n\nDen Gläubigern der an der Ausgliederung beteiligten Rechtsträger ist, wenn sie binnen sechs Monaten nach dem Tag, an dem die Eintragung der Ausgliederung in das Register des Sitzes desjenigen Rechtsträgers, dessen Gläubiger sie sind, nach §§ 125, 19 Abs. 3 UmwG als bekannt gemacht gilt, ihren Anspruch nach Grund und Höhe in Textform anmelden, Sicherheit zu leisten, soweit sie nicht Befriedigung verlangen können. Dieses Recht steht den Gläubigern jedoch nur zu, wenn sie glaubhaft machen, dass durch die Ausgliederung die Erfüllung ihrer Forderung gefährdet wird."
    },
    {
      "date": "2025-06-07",
      "id": "111609",
      "original_text": "Löschungsankündigung\nBayern Amtsgericht Fürth HRB 20700\nIppo Bau GmbH – Fürth",
      "type": "Löschungsankündigung",
      "state": "Bayern",
      "amtsgericht": "Amtsgericht Fürth",
      "registernummer": "HRB 20700",
      "registerart": "HRB",
      "company_name": "Ippo Bau GmbH",
      "company_seat": "Fürth",
      "details": "07.06.2025 (Bekanntmachungsdatum)\n\nBayern Amtsgericht Fürth HRB 20700\nLöschungsankündigung 06.06.2026 (Eintragungsdatum)\n\nIppo Bau GmbH\nGesellschaft mit beschränkter Haftung\nFürth\n\nDas Registergericht beabsichtigt, die im Handelsregister eingetragene Gesellschaft wegen Vermögenslosigkeit von Amts wegen nach § 394 FamFG zu löschen. Die Frist zur Erhebung eines Widerspruchs ist auf drei Monate festgesetzt."
    },
    {
      "date": "2025-06-07",
      "id": "111610",
      "original_text": "Registerbekanntmachung nach dem Umwandlungsgesetz\nBayern Amtsgericht München HRB 135401\nBrainlab AG – München",
      "type": "Registerbekanntmachung nach dem Umwandlungsgesetz",
      "state": "Bayern",
      "amtsgericht": "Amtsgericht München",
      "registernummer": "HRB 135401",
      "registerart": "HRB",
      "company_name": "Brainlab AG",
      "company_seat": "München",
      "details": "07.06.2025 (Bekanntmachungsdatum)\n\nBayern Amtsgericht München HRB 135401\nRegisterbekanntmachung nach dem Umwandlungsgesetz 06.06.2025 (Eintragungsdatum)\n\nBrainlab AG\nAktiengesellschaft\nMünchen\n\nDen Gläubigern der an der Spaltung beteiligten Rechtsträger ist, wenn sie binnen sechs Monaten nach dem Tag, an dem die Eintragung der Spaltung in das Register des Sitzes desjenigen Rechtsträgers, dessen Gläubiger sie sind, nach §§ 125, 19 Abs. 3 UmwG als bekannt gemacht gilt, ihren Anspruch nach Grund und Höhe in Textform anmelden, Sicherheit zu leisten, soweit sie nicht Befriedigung verlangen können. Dieses Recht steht den Gläubigern jedoch nur zu, wenn sie glaubhaft machen, dass durch die Spaltung die Erfüllung ihrer Forderung gefährdet wird."
    },
    {
      "date": "2025-06-07",
      "id": "111611",
      "original_text": "Sonstige Registerbekanntmachung\nBayern Amtsgericht Traunstein HRB 7915\nForum Märkte GmbH – Stephanskirchen",
      "type": "Sonstige Registerbekanntmachung",
      "state": "Bayern",
      "amtsgericht": "Amtsgericht Traunstein",
      "registernummer": "HRB 7915",
      "registerart": "HRB",
      "company_name": "Forum Märkte GmbH",
      "company_seat": "Stephanskirchen",
      "details": "07.06.2025 (Bekanntmachungsdatum)\n\nBayern Amtsgericht Traunstein HRB 7915\nSonstige Registerbekanntmachung 06.06.2025 (Eintragungsdatum)\n\nForum Märkte GmbH\nGesellschaft mit beschränkter Haftung\nStephanskirchen\n\nDen Gläubigern der Gesellschaft, deren Forderungen begründet worden sind, bevor die Eintragung der Beendigung des Gewinnabführungsvertrages in das Handelsregister nach § 10 des Handelsgesetzbuches als bekanntgemacht gilt, hat der andere Vertragsteil Sicherheit zu leisten, wenn sie sich binnen sechs Monaten nach der Bekanntmachung der Eintragung zu diesem Zweck bei ihm melden."
    },
    {
      "date": "2025-06-07",
      "id": "111612",
      "original_text": "Registerbekanntmachung nach dem Umwandlungsgesetz\nBayern Amtsgericht München HRA 112157\nBaywobau Eigentum und Wohnen GmbH & Co. KG – Grünwald",
      "type": "Registerbekanntmachung nach dem Umwandlungsgesetz",
      "state": "Bayern",
      "amtsgericht": "Amtsgericht München",
      "registernummer": "HRA 112157",
      "registerart": "HRA",
      "company_name": "Baywobau Eigentum und Wohnen GmbH & Co. KG",
      "company_seat": "Grünwald",
      "details": "07.06.2025 (Bekanntmachungsdatum)\n\nBayern Amtsgericht München HRA 112157\nRegisterbekanntmachung nach dem Umwandlungsgesetz 06.06.2025 (Eintragungsdatum)\n\nBaywobau Eigentum und Wohnen GmbH & Co. KG\nKommanditgesellschaft\nGrünwald\n\nDen Gläubigern der an der Ausgliederung beteiligten Rechtsträger ist, wenn sie binnen sechs Monaten nach dem Tag, an dem die Eintragung der Ausgliederung in das Register des Sitzes desjenigen Rechtsträgers, dessen Gläubiger sie sind, nach §§ 125, 19 Abs. 3 UmwG als bekannt gemacht gilt, ihren Anspruch nach Grund und Höhe in Textform anmelden, Sicherheit zu leisten, soweit sie nicht Befriedigung verlangen können. Dieses Recht steht den Gläubigern jedoch nur zu, wenn sie glaubhaft machen, dass durch die Ausgliederung die Erfüllung ihrer Forderung gefährdet wird."
    },
    {
      "date": "2025-06-07",
      "id": "111613",
      "original_text": "Einreichung neuer Dokumente\nBayern Amtsgericht Fürth HRB 10257\nKennametal GmbH – Fürth",
      "type": "Einreichung neuer Dokumente",
      "state": "Bayern",
      "amtsgericht": "Amtsgericht Fürth",
      "registernummer": "HRB 10257",
      "registerart": "HRB",
      "company_name": "Kennametal GmbH",
      "company_seat": "Fürth",
      "details": "07.06.2025 (Bekanntmachungsdatum)\n\nBayern Amtsgericht Fürth HRB 10257\nEinreichung neuer Dokumente\n\nKennametal GmbH\nGesellschaft mit beschränkter Haftung\nFürth\n\nDem Amtsgericht Fürth -Registergericht- ist eine Liste der Mitglieder des Aufsichtsrats eingereicht worden, § 52 Abs. 3 S. 2 GmbHG."
    },
    {
      "date": "2025-06-07",
      "id": "111614",
      "original_text": "Einreichung neuer Dokumente\nBayern Amtsgericht Bamberg HRB 4355\nH & P, Höhnen & Partner Ingenieuraktiengesellschaft – Bamberg",
      "type": "Einreichung neuer Dokumente",
      "state": "Bayern",
      "amtsgericht": "Amtsgericht Bamberg",
      "registernummer": "HRB 4355",
      "registerart": "HRB",
      "company_name": "H & P, Höhnen & Partner Ingenieuraktiengesellschaft",
      "company_seat": "Bamberg",
      "details": "07.06.2025 (Bekanntmachungsdatum)\n\nBayern Amtsgericht Bamberg HRB 4355\nEinreichung neuer Dokumente 06.06.2025 (Eintragungsdatum)\n\nH & P, Höhnen & Partner Ingenieuraktiengesellschaft\nAktiengesellschaft\nBamberg\n\nDem Amtsgericht Bamberg -Registergericht- ist eine Liste der Mitglieder des Aufsichtsrats eingereicht worden, § 106 AktG."
    },
    {
      "date": "2025-06-07",
      "id": "111615",
      "original_text": "Registerbekanntmachung nach dem Umwandlungsgesetz\nBayern Amtsgericht Augsburg HRB 25497\nSICERTO GmbH – Unterdießen",
      "type": "Registerbekanntmachung nach dem Umwandlungsgesetz",
      "state": "Bayern",
      "amtsgericht": "Amtsgericht Augsburg",
      "registernummer": "HRB 25497",
      "registerart": "HRB",
      "company_name": "SICERTO GmbH",
      "company_seat": "Unterdießen",
      "details": "07.06.2025 (Bekanntmachungsdatum)\n\nBayern Amtsgericht Augsburg HRB 25497\nRegisterbekanntmachung nach dem Umwandlungsgesetz 06.06.2025 (Eintragungsdatum)\n\nSICERTO GmbH\nGesellschaft mit beschränkter Haftung\nUnterdießen\n\nDen Gläubigern der an der Verschmelzung beteiligten Rechtsträger ist, wenn sie binnen sechs Monaten nach dem Tag, an dem die Eintragung der Verschmelzung in das Register des Sitzes desjenigen Rechtsträgers, dessen Gläubiger sie sind, nach § 19 Abs. 3 UmwG als bekannt gemacht gilt, ihren Anspruch nach Grund und Höhe in Textform anmelden, Sicherheit zu leisten, soweit sie nicht Befriedigung verlangen können. Dieses Recht steht den Gläubigern jedoch nur zu, wenn sie glaubhaft machen, dass durch die Verschmelzung die Erfüllung ihrer Forderung gefährdet wird."
    },
    {
      "date": "2025-06-07",
      "id": "111616",
      "original_text": "Registerbekanntmachung nach dem Umwandlungsgesetz\nBayern Amtsgericht Weiden i. d. OPf. HRB 2849\nMTK GmbH – Weiden i.d.OPf.",
      "type": "Registerbekanntmachung nach dem Umwandlungsgesetz",
      "state": "Bayern",
      "amtsgericht": "Amtsgericht Weiden i. d. OPf.",
      "registernummer": "HRB 2849",
      "registerart": "HRB",
      "company_name": "MTK GmbH",
      "company_seat": "Weiden i.d.OPf.",
      "details": "07.06.2025 (Bekanntmachungsdatum)\n\nBayern Amtsgericht Weiden i. d. OPf. HRB 2849\nRegisterbekanntmachung nach dem Umwandlungsgesetz 06.06.2025 (Eintragungsdatum)\n\nMTK GmbH\nGesellschaft mit beschränkter Haftung\nWeiden i.d.OPf.\n\nDen Gläubigern der an der Verschmelzung beteiligten Rechtsträger ist, wenn sie binnen sechs Monaten nach dem Tag, an dem die Eintragung der Verschmelzung in das Register des Sitzes desjenigen Rechtsträgers, dessen Gläubiger sie sind, nach § 19 Abs. 3 UmwG als bekannt gemacht gilt, ihren Anspruch nach Grund und Höhe in Textform anmelden, Sicherheit zu leisten, soweit sie nicht Befriedigung verlangen können. Dieses Recht steht den Gläubigern jedoch nur zu, wenn sie glaubhaft machen, dass durch die Verschmelzung die Erfüllung ihrer Forderung gefährdet wird."
    },
    {
      "date": "2025-06-07",
      "id": "111617",
      "original_text": "Sonstige Registerbekanntmachung\nBayern Amtsgericht Traunstein HRB 7916\nForum Baumärkte Betriebsgesellschaft mbH – Stephanskirchen",
      "type": "Sonstige Registerbekanntmachung",
      "state": "Bayern",
      "amtsgericht": "Amtsgericht Traunstein",
      "registernummer": "HRB 7916",
      "registerart": "HRB",
      "company_name": "Forum Baumärkte Betriebsgesellschaft mbH",
      "company_seat": "Stephanskirchen",
      "details": "07.06.2025 (Bekanntmachungsdatum)\n\nBayern Amtsgericht Traunstein HRB 7916\nSonstige Registerbekanntmachung 06.06.2025 (Eintragungsdatum)\n\nForum Baumärkte Betriebsgesellschaft mbH\nGesellschaft mit beschränkter Haftung\nStephanskirchen\n\nDen Gläubigern der Gesellschaft, deren Forderungen begründet worden sind, bevor die Eintragung der Beendigung des Gewinnabführungsvertrages in das Handelsregister nach § 10 des Handelsgesetzbuches als bekanntgemacht gilt, hat der andere Vertragsteil Sicherheit zu leisten, wenn sie sich binnen sechs Monaten nach der Bekanntmachung der Eintragung zu diesem Zweck bei ihm melden."
    },
    {
      "date": "2025-06-07",
      "id": "111618",
      "original_text": "Registerbekanntmachung nach dem Umwandlungsgesetz\nBayern Amtsgericht München HRB 300896\nHageda-Stumpf Pharmahandel GmbH – München",
      "type": "Registerbekanntmachung nach dem Umwandlungsgesetz",
      "state": "Bayern",
      "amtsgericht": "Amtsgericht München",
      "registernummer": "HRB 300896",
      "registerart": "HRB",
      "company_name": "Hageda-Stumpf Pharmahandel GmbH",
      "company_seat": "München",
      "details": "07.06.2025 (Bekanntmachungsdatum)\n\nBayern Amtsgericht München HRB 300896\nRegisterbekanntmachung nach dem Umwandlungsgesetz 06.06.2025 (Eintragungsdatum)\n\nHageda-Stumpf Pharmahandel GmbH\nGesellschaft mit beschränkter Haftung\nMünchen\n\nDen Gläubigern der an der Verschmelzung beteiligten Rechtsträger ist, wenn sie binnen sechs Monaten nach dem Tag, an dem die Eintragung der Verschmelzung in das Register des Sitzes desjenigen Rechtsträgers, dessen Gläubiger sie sind, nach § 19 Abs. 3 UmwG als bekannt gemacht gilt, ihren Anspruch nach Grund und Höhe in Textform anmelden, Sicherheit zu leisten, soweit sie nicht Befriedigung verlangen können. Dieses Recht steht den Gläubigern jedoch nur zu, wenn sie glaubhaft machen, dass durch die Verschmelzung die Erfüllung ihrer Forderung gefährdet wird."
    },
    {
      "date": "2025-06-07",
      "id": "111619",
      "original_text": "Registerbekanntmachung nach dem Umwandlungsgesetz\nBayern Amtsgericht München HRA 119943\nAmbient GmbH & Co. KG – München",
      "type": "Registerbekanntmachung nach dem Umwandlungsgesetz",
      "state": "Bayern",
      "amtsgericht": "Amtsgericht München",
      "registernummer": "HRA 119943",
      "registerart": "HRA",
      "company_name": "Ambient GmbH & Co. KG",
      "company_seat": "München",
      "details": "07.06.2025 (Bekanntmachungsdatum)\n\nBayern Amtsgericht München HRA 119943\nRegisterbekanntmachung nach dem Umwandlungsgesetz 06.06.2025 (Eintragungsdatum)\n\nAmbient GmbH & Co. KG\nKommanditgesellschaft\nMünchen\n\nDen Gläubigern der an der Ausgliederung beteiligten Rechtsträger ist, wenn sie binnen sechs Monaten nach dem Tag, an dem die Eintragung der Ausgliederung in das Register des Sitzes desjenigen Rechtsträgers, dessen Gläubiger sie sind, nach §§ 125, 19 Abs. 3 UmwG als bekannt gemacht gilt, ihren Anspruch nach Grund und Höhe in Textform anmelden, Sicherheit zu leisten, soweit sie nicht Befriedigung verlangen können. Dieses Recht steht den Gläubigern jedoch nur zu, wenn sie glaubhaft machen, dass durch die Ausgliederung die Erfüllung ihrer Forderung gefährdet wird."
    },
    {
      "date": "2025-06-07",
      "id": "111620",
      "original_text": "Registerbekanntmachung nach dem Umwandlungsgesetz\nBayern Amtsgericht Traunstein HRB 13787\nORCA-online GmbH – Neubeuern",
      "type": "Registerbekanntmachung nach dem Umwandlungsgesetz",
      "state": "Bayern",
      "amtsgericht": "Amtsgericht Traunstein",
      "registernummer": "HRB 13787",
      "registerart": "HRB",
      "company_name": "ORCA-online GmbH",
      "company_seat": "Neubeuern",
      "details": "07.06.2025 (Bekanntmachungsdatum)\n\nBayern Amtsgericht Traunstein HRB 13787\nRegisterbekanntmachung nach dem Umwandlungsgesetz 07.06.2025 (Eintragungsdatum)\n\nORCA-online GmbH\nGesellschaft mit beschränkter Haftung\nNeubeuern\n\nDen Gläubigern der an der Verschmelzung beteiligten Rechtsträger ist, wenn sie binnen sechs Monaten nach dem Tag, an dem die Eintragung der Verschmelzung in das Register des Sitzes desjenigen Rechtsträgers, dessen Gläubiger sie sind, nach § 19 Abs. 3 UmwG als bekannt gemacht gilt, ihren Anspruch nach Grund und Höhe in Textform anmelden, Sicherheit zu leisten, soweit sie nicht Befriedigung verlangen können. Dieses Recht steht den Gläubigern jedoch nur zu, wenn sie glaubhaft machen, dass durch die Verschmelzung die Erfüllung ihrer Forderung gefährdet wird."
    },
    {
      "date": "2025-06-07",
      "id": "111621",
      "original_text": "Registerbekanntmachung nach dem Umwandlungsgesetz\nBayern Amtsgericht München HRB 283000\nConstantin Film Verleih GmbH – München",
      "type": "Registerbekanntmachung nach dem Umwandlungsgesetz",
      "state": "Bayern",
      "amtsgericht": "Amtsgericht München",
      "registernummer": "HRB 283000",
      "registerart": "HRB",
      "company_name": "Constantin Film Verleih GmbH",
      "company_seat": "München",
      "details": "07.06.2025 (Bekanntmachungsdatum)\n\nBayern Amtsgericht München HRB 283000\nRegisterbekanntmachung nach dem Umwandlungsgesetz 06.06.2025 (Eintragungsdatum)\n\nConstantin Film Verleih GmbH\nGesellschaft mit beschränkter Haftung\nMünchen\n\nDen Gläubigern der an der Verschmelzung beteiligten Rechtsträger ist, wenn sie binnen sechs Monaten nach dem Tag, an dem die Eintragung der Verschmelzung in das Register des Sitzes desjenigen Rechtsträgers, dessen Gläubiger sie sind, nach § 19 Abs. 3 UmwG als bekannt gemacht gilt, ihren Anspruch nach Grund und Höhe in Textform anmelden, Sicherheit zu leisten, soweit sie nicht Befriedigung verlangen können. Dieses Recht steht den Gläubigern jedoch nur zu, wenn sie glaubhaft machen, dass durch die Verschmelzung die Erfüllung ihrer Forderung gefährdet wird."
    },
    {
      "date": "2025-06-07",
      "id": "111622",
      "original_text": "Registerbekanntmachung nach dem Umwandlungsgesetz\nBrandenburg Amtsgericht Cottbus HRA 2762\nH.-P. Fischer Elektronik GmbH & Co Industrie- und Labortechnik KG – Mittenwalde OT Ragow",
      "type": "Registerbekanntmachung nach dem Umwandlungsgesetz",
      "state": "Brandenburg",
      "amtsgericht": "Amtsgericht Cottbus",
      "registernummer": "HRA 2762",
      "registerart": "HRA",
      "company_name": "H.-P. Fischer Elektronik GmbH & Co Industrie- und Labortechnik KG",
      "company_seat": "Mittenwalde OT Ragow",
      "details": "07.06.2025 (Bekanntmachungsdatum)\n\nBrandenburg Amtsgericht Cottbus HRA 2762\nRegisterbekanntmachung nach dem Umwandlungsgesetz 05.06.2025 (Eintragungsdatum)\n\nH.-P. Fischer Elektronik GmbH & Co Industrie- und Labortechnik KG\nKommanditgesellschaft\nMittenwalde OT Ragow\n\nZu Eintragungsnummer 6 vom 05.06.2025 wird als nicht eingetragen veröffentlicht:\nAls nicht eingetragen wird veröffentlicht:\nDen Gläubigern der an der Verschmelzung beteiligten Rechtsträger ist, wenn sie binnen sechs Monaten nach dem Tag, an dem die Eintragung der Verschmelzung in das Register des Sitzes desjenigen Rechtsträgers, dessen Gläubiger sie sind, als bekannt gemacht gilt, ihren Anspruch nach Grund und Höhe schriftlich anmelden, Sicherheit zu leisten, soweit sie nicht Befriedigung verlangen können. Dieses Recht steht den Gläubigern jedoch nur zu, wenn sie glaubhaft machen, dass durch die Verschmelzung die Erfüllung ihrer Forderung gefährdet wird"
    }
  ]
}