{
  "date": "2025-06-26",
  "date_of_scrape": "2025-06-27T04:17:43.198Z",
  "tool_version": "0.2.0",
  "number_of_announcements": 195,
  "announcements": [
    {
      "date": "2025-06-26",
      "id": "113426",
      "original_text": "Registerbekanntmachung nach dem Umwandlungsgesetz\nBayern Amtsgericht München HRB 274328\nAmazon Deutschland E18 Transport GmbH – München",
      "type": "Registerbekanntmachung nach dem Umwandlungsgesetz",
      "state": "Bayern",
      "amtsgericht": "Amtsgericht München",
      "registernummer": "HRB 274328",
      "registerart": "HRB",
      "company_name": "Amazon Deutschland E18 Transport GmbH",
      "company_seat": "München",
      "details": "26.06.2025 (Bekanntmachungsdatum)\n\nBayern Amtsgericht München HRB 274328\nRegisterbekanntmachung nach dem Umwandlungsgesetz 25.06.2025 (Eintragungsdatum)\n\nAmazon Deutschland E18 Transport GmbH\nGesellschaft mit beschränkter Haftung\nMünchen\n\nDen Gläubigern der an der Verschmelzung beteiligten Rechtsträger ist, wenn sie binnen sechs Monaten nach dem Tag, an dem die Eintragung der Verschmelzung in das Register des Sitzes desjenigen Rechtsträgers, dessen Gläubiger sie sind, nach § 19 Abs. 3 UmwG als bekannt gemacht gilt, ihren Anspruch nach Grund und Höhe in Textform anmelden, Sicherheit zu leisten, soweit sie nicht Befriedigung verlangen können. Dieses Recht steht den Gläubigern jedoch nur zu, wenn sie glaubhaft machen, dass durch die Verschmelzung die Erfüllung ihrer Forderung gefährdet wird."
    },
    {
      "date": "2025-06-26",
      "id": "113427",
      "original_text": "Registerbekanntmachung nach dem Umwandlungsgesetz\nBayern Amtsgericht München HRB 285026\nTECVIA Media GmbH – München",
      "type": "Registerbekanntmachung nach dem Umwandlungsgesetz",
      "state": "Bayern",
      "amtsgericht": "Amtsgericht München",
      "registernummer": "HRB 285026",
      "registerart": "HRB",
      "company_name": "TECVIA Media GmbH",
      "company_seat": "München",
      "details": "26.06.2025 (Bekanntmachungsdatum)\n\nBayern Amtsgericht München HRB 285026\nRegisterbekanntmachung nach dem Umwandlungsgesetz 25.06.2025 (Eintragungsdatum)\n\nTECVIA Media GmbH\nGesellschaft mit beschränkter Haftung\nMünchen\n\nDen Gläubigern der an der Spaltung beteiligten Rechtsträger ist, wenn sie binnen sechs Monaten nach dem Tag, an dem die Eintragung der Spaltung in das Register des Sitzes desjenigen Rechtsträgers, dessen Gläubiger sie sind, nach §§ 125, 19 Abs. 3 UmwG als bekannt gemacht gilt, ihren Anspruch nach Grund und Höhe in Textform anmelden, Sicherheit zu leisten, soweit sie nicht Befriedigung verlangen können. Dieses Recht steht den Gläubigern jedoch nur zu, wenn sie glaubhaft machen, dass durch die Spaltung die Erfüllung ihrer Forderung gefährdet wird."
    },
    {
      "date": "2025-06-26",
      "id": "113428",
      "original_text": "Registerbekanntmachung nach dem Umwandlungsgesetz\nBayern Amtsgericht München HRB 274430\nAmazon Deutschland S39 Transport GmbH – München",
      "type": "Registerbekanntmachung nach dem Umwandlungsgesetz",
      "state": "Bayern",
      "amtsgericht": "Amtsgericht München",
      "registernummer": "HRB 274430",
      "registerart": "HRB",
      "company_name": "Amazon Deutschland S39 Transport GmbH",
      "company_seat": "München",
      "details": "26.06.2025 (Bekanntmachungsdatum)\n\nBayern Amtsgericht München HRB 274430\nRegisterbekanntmachung nach dem Umwandlungsgesetz 25.06.2025 (Eintragungsdatum)\n\nAmazon Deutschland S39 Transport GmbH\nGesellschaft mit beschränkter Haftung\nMünchen\n\nDen Gläubigern der an der Verschmelzung beteiligten Rechtsträger ist, wenn sie binnen sechs Monaten nach dem Tag, an dem die Eintragung der Verschmelzung in das Register des Sitzes desjenigen Rechtsträgers, dessen Gläubiger sie sind, nach § 19 Abs. 3 UmwG als bekannt gemacht gilt, ihren Anspruch nach Grund und Höhe in Textform anmelden, Sicherheit zu leisten, soweit sie nicht Befriedigung verlangen können. Dieses Recht steht den Gläubigern jedoch nur zu, wenn sie glaubhaft machen, dass durch die Verschmelzung die Erfüllung ihrer Forderung gefährdet wird."
    },
    {
      "date": "2025-06-26",
      "id": "113429",
      "original_text": "Registerbekanntmachung nach dem Umwandlungsgesetz\nBayern Amtsgericht München HRB 274427\nAmazon Deutschland W41 Transport GmbH – München",
      "type": "Registerbekanntmachung nach dem Umwandlungsgesetz",
      "state": "Bayern",
      "amtsgericht": "Amtsgericht München",
      "registernummer": "HRB 274427",
      "registerart": "HRB",
      "company_name": "Amazon Deutschland W41 Transport GmbH",
      "company_seat": "München",
      "details": "26.06.2025 (Bekanntmachungsdatum)\n\nBayern Amtsgericht München HRB 274427\nRegisterbekanntmachung nach dem Umwandlungsgesetz 25.06.2025 (Eintragungsdatum)\n\nAmazon Deutschland W41 Transport GmbH\nGesellschaft mit beschränkter Haftung\nMünchen\n\nDen Gläubigern der an der Verschmelzung beteiligten Rechtsträger ist, wenn sie binnen sechs Monaten nach dem Tag, an dem die Eintragung der Verschmelzung in das Register des Sitzes desjenigen Rechtsträgers, dessen Gläubiger sie sind, nach § 19 Abs. 3 UmwG als bekannt gemacht gilt, ihren Anspruch nach Grund und Höhe in Textform anmelden, Sicherheit zu leisten, soweit sie nicht Befriedigung verlangen können. Dieses Recht steht den Gläubigern jedoch nur zu, wenn sie glaubhaft machen, dass durch die Verschmelzung die Erfüllung ihrer Forderung gefährdet wird."
    },
    {
      "date": "2025-06-26",
      "id": "113430",
      "original_text": "Löschungsankündigung\nBayern Amtsgericht Würzburg HRB 8613\nM Protection GmbH – Waldbrunn",
      "type": "Löschungsankündigung",
      "state": "Bayern",
      "amtsgericht": "Amtsgericht Würzburg",
      "registernummer": "HRB 8613",
      "registerart": "HRB",
      "company_name": "M Protection GmbH",
      "company_seat": "Waldbrunn",
      "details": "26.06.2025 (Bekanntmachungsdatum)\n\nBayern Amtsgericht Würzburg HRB 8613\nLöschungsankündigung\n\nM Protection GmbH\nGesellschaft mit beschränkter Haftung\nWaldbrunn\n\nDas Registergericht beabsichtigt, die im Handelsregister eingetragene Gesellschaft wegen Vermögenslosigkeit von Amts wegen nach § 394 FamFG zu löschen. Die Widerspruchsfrist wird auf 3 Monate festgesetzt"
    },
    {
      "date": "2025-06-26",
      "id": "113431",
      "original_text": "Registerbekanntmachung nach dem Umwandlungsgesetz\nBayern Amtsgericht Nürnberg HRB 39511\nWell Done Games UG (haftungsbeschränkt) – Nürnberg",
      "type": "Registerbekanntmachung nach dem Umwandlungsgesetz",
      "state": "Bayern",
      "amtsgericht": "Amtsgericht Nürnberg",
      "registernummer": "HRB 39511",
      "registerart": "HRB",
      "company_name": "Well Done Games UG (haftungsbeschränkt)",
      "company_seat": "Nürnberg",
      "details": "26.06.2025 (Bekanntmachungsdatum)\n\nBayern Amtsgericht Nürnberg HRB 39511\nRegisterbekanntmachung nach dem Umwandlungsgesetz 25.06.2025 (Eintragungsdatum)\n\nWell Done Games UG (haftungsbeschränkt)\nGesellschaft mit beschränkter Haftung\nNürnberg\n\nDen Gläubigern der an der Verschmelzung beteiligten Rechtsträger ist, wenn sie binnen sechs Monaten nach dem Tag, an dem die Eintragung der Verschmelzung in das Register des Sitzes desjenigen Rechtsträgers, dessen Gläubiger sie sind, nach § 19 Abs. 3 UmwG als bekannt gemacht gilt, ihren Anspruch nach Grund und Höhe in Textform anmelden, Sicherheit zu leisten, soweit sie nicht Befriedigung verlangen können. Dieses Recht steht den Gläubigern jedoch nur zu, wenn sie glaubhaft machen, dass durch die Verschmelzung die Erfüllung ihrer Forderung gefährdet wird."
    },
    {
      "date": "2025-06-26",
      "id": "113432",
      "original_text": "Einreichung neuer Dokumente\nBayern Amtsgericht Augsburg HRB 18091\nStadtwerke Augsburg Wasser GmbH – Augsburg",
      "type": "Einreichung neuer Dokumente",
      "state": "Bayern",
      "amtsgericht": "Amtsgericht Augsburg",
      "registernummer": "HRB 18091",
      "registerart": "HRB",
      "company_name": "Stadtwerke Augsburg Wasser GmbH",
      "company_seat": "Augsburg",
      "details": "26.06.2025 (Bekanntmachungsdatum)\n\nBayern Amtsgericht Augsburg HRB 18091\nEinreichung neuer Dokumente\n\nStadtwerke Augsburg Wasser GmbH\nGesellschaft mit beschränkter Haftung\nAugsburg\n\nDem Amtsgericht Augsburg -Registergericht- ist eine Liste der Mitglieder des Aufsichtsrats eingereicht worden, § 52 Abs. 3 S. 2 GmbHG."
    },
    {
      "date": "2025-06-26",
      "id": "113433",
      "original_text": "Registerbekanntmachung nach dem Umwandlungsgesetz\nBayern Amtsgericht München HRA 120498\nKickserve GmbH & Co. KG – München",
      "type": "Registerbekanntmachung nach dem Umwandlungsgesetz",
      "state": "Bayern",
      "amtsgericht": "Amtsgericht München",
      "registernummer": "HRA 120498",
      "registerart": "HRA",
      "company_name": "Kickserve GmbH & Co. KG",
      "company_seat": "München",
      "details": "26.06.2025 (Bekanntmachungsdatum)\n\nBayern Amtsgericht München HRA 120498\nRegisterbekanntmachung nach dem Umwandlungsgesetz 25.06.2025 (Eintragungsdatum)\n\nKickserve GmbH & Co. KG\nKommanditgesellschaft\nMünchen\n\nDen Gläubigern der an der Verschmelzung beteiligten Rechtsträger ist, wenn sie binnen sechs Monaten nach dem Tag, an dem die Eintragung der Verschmelzung in das Register des Sitzes desjenigen Rechtsträgers, dessen Gläubiger sie sind, nach § 19 Abs. 3 UmwG als bekannt gemacht gilt, ihren Anspruch nach Grund und Höhe in Textform anmelden, Sicherheit zu leisten, soweit sie nicht Befriedigung verlangen können. Dieses Recht steht den Gläubigern jedoch nur zu, wenn sie glaubhaft machen, dass durch die Verschmelzung die Erfüllung ihrer Forderung gefährdet wird.\n\nDen Gläubigern der an der Ausgliederung beteiligten Rechtsträger ist, wenn sie binnen sechs Monaten nach dem Tag, an dem die Eintragung der Ausgliederung in das Register des Sitzes desjenigen Rechtsträgers, dessen Gläubiger sie sind, nach §§ 125, 19 Abs. 3 UmwG als bekannt gemacht gilt, ihren Anspruch nach Grund und Höhe in Textform anmelden, Sicherheit zu leisten, soweit sie nicht Befriedigung verlangen können. Dieses Recht steht den Gläubigern jedoch nur zu, wenn sie glaubhaft machen, dass durch die Ausgliederung die Erfüllung ihrer Forderung gefährdet wird."
    },
    {
      "date": "2025-06-26",
      "id": "113434",
      "original_text": "Löschungsankündigung\nBayern Amtsgericht Coburg HRB 6369\nSAM-M UG (haftungsbeschränkt) – Coburg",
      "type": "Löschungsankündigung",
      "state": "Bayern",
      "amtsgericht": "Amtsgericht Coburg",
      "registernummer": "HRB 6369",
      "registerart": "HRB",
      "company_name": "SAM-M UG (haftungsbeschränkt)",
      "company_seat": "Coburg",
      "details": "26.06.2025 (Bekanntmachungsdatum)\n\nBayern Amtsgericht Coburg HRB 6369\nLöschungsankündigung\n\nSAM-M UG (haftungsbeschränkt)\nGesellschaft mit beschränkter Haftung\nCoburg\n\nDas Registergericht beabsichtigt, die im Handelsregister eingetragene Gesellschaft wegen Vermögenslosigkeit von Amts wegen nach § 394 FamFG zu löschen. Die Frist zur Erhebung eines Widerspruchs ist auf sechs Wochen festgesetzt."
    },
    {
      "date": "2025-06-26",
      "id": "113435",
      "original_text": "Registerbekanntmachung nach dem Umwandlungsgesetz\nBayern Amtsgericht Würzburg VR 30312\nRV Viktoria 1925 e.V. Wombach – Lohr a.M.-Wombach",
      "type": "Registerbekanntmachung nach dem Umwandlungsgesetz",
      "state": "Bayern",
      "amtsgericht": "Amtsgericht Würzburg",
      "registernummer": "VR 30312",
      "registerart": "VR",
      "company_name": "RV Viktoria 1925 e.V. Wombach",
      "company_seat": "Lohr a.M.-Wombach",
      "details": "26.06.2025 (Bekanntmachungsdatum)\n\nBayern Amtsgericht Würzburg VR 30312\nRegisterbekanntmachung nach dem Umwandlungsgesetz 25.06.2025 (Eintragungsdatum)\n\nRV Viktoria 1925 e.V. Wombach\neingetragener Verein\nLohr a.M.-Wombach\n\nDen Gläubigern der an der Verschmelzung beteiligten Rechtsträger ist, wenn sie binnen sechs Monaten nach dem Tag, an dem die Eintragung der Verschmelzung in das Register des Sitzes desjenigen Rechtsträgers, dessen Gläubiger sie sind, nach § 19 Abs. 3 UmwG als bekannt gemacht gilt, ihren Anspruch nach Grund und Höhe in Textform anmelden, Sicherheit zu leisten, soweit sie nicht Befriedigung verlangen können. Dieses Recht steht den Gläubigern jedoch nur zu, wenn sie glaubhaft machen, dass durch die Verschmelzung die Erfüllung ihrer Forderung gefährdet wird."
    },
    {
      "date": "2025-06-26",
      "id": "113436",
      "original_text": "Registerbekanntmachung nach dem Umwandlungsgesetz\nBayern Amtsgericht München HRA 119847\nSANCTOR Grundstücks-Vermietungsgesellschaft mbH & Co. Objekt Fürstenfeldbruck KG – München",
      "type": "Registerbekanntmachung nach dem Umwandlungsgesetz",
      "state": "Bayern",
      "amtsgericht": "Amtsgericht München",
      "registernummer": "HRA 119847",
      "registerart": "HRA",
      "company_name": "SANCTOR Grundstücks-Vermietungsgesellschaft mbH & Co. Objekt Fürstenfeldbruck KG",
      "company_seat": "München",
      "details": "26.06.2025 (Bekanntmachungsdatum)\n\nBayern Amtsgericht München HRA 119847\nRegisterbekanntmachung nach dem Umwandlungsgesetz 25.06.2025 (Eintragungsdatum)\n\nSANCTOR Grundstücks-Vermietungsgesellschaft mbH & Co. Objekt Fürstenfeldbruck KG\nKommanditgesellschaft\nMünchen\n\nDen Gläubigern des formwechselnden Rechtsträgers ist, wenn sie binnen sechs Monaten nach dem Tag, an dem die Eintragung des Formwechsels nach § 201 UmwG als bekannt gemacht gilt, ihren Anspruch nach Grund und Höhe in Textform anmelden, Sicherheit zu leisten, soweit sie nicht Befriedigung verlangen können. Dieses Recht steht den Gläubigern jedoch nur zu, wenn sie glaubhaft machen, dass durch den Formwechsel die Erfüllung ihrer Forderung gefährdet wird."
    },
    {
      "date": "2025-06-26",
      "id": "113437",
      "original_text": "Registerbekanntmachung nach dem Umwandlungsgesetz\nBayern Amtsgericht München HRB 288791\nuhb Software GmbH – St. Wolfgang",
      "type": "Registerbekanntmachung nach dem Umwandlungsgesetz",
      "state": "Bayern",
      "amtsgericht": "Amtsgericht München",
      "registernummer": "HRB 288791",
      "registerart": "HRB",
      "company_name": "uhb Software GmbH",
      "company_seat": "St. Wolfgang",
      "details": "26.06.2025 (Bekanntmachungsdatum)\n\nBayern Amtsgericht München HRB 288791\nRegisterbekanntmachung nach dem Umwandlungsgesetz 25.06.2025 (Eintragungsdatum)\n\nuhb Software GmbH\nGesellschaft mit beschränkter Haftung\nSt. Wolfgang\n\nDen Gläubigern der an der Verschmelzung beteiligten Rechtsträger ist, wenn sie binnen sechs Monaten nach dem Tag, an dem die Eintragung der Verschmelzung in das Register des Sitzes desjenigen Rechtsträgers, dessen Gläubiger sie sind, nach § 19 Abs. 3 UmwG als bekannt gemacht gilt, ihren Anspruch nach Grund und Höhe in Textform anmelden, Sicherheit zu leisten, soweit sie nicht Befriedigung verlangen können. Dieses Recht steht den Gläubigern jedoch nur zu, wenn sie glaubhaft machen, dass durch die Verschmelzung die Erfüllung ihrer Forderung gefährdet wird."
    },
    {
      "date": "2025-06-26",
      "id": "113438",
      "original_text": "Löschungsankündigung\nBayern Amtsgericht Hof HRA 16\nK + M Knörnschild & Mayer OHG Wärme- und Klimatechnik – Hof (Saale)",
      "type": "Löschungsankündigung",
      "state": "Bayern",
      "amtsgericht": "Amtsgericht Hof",
      "registernummer": "HRA 16",
      "registerart": "HRA",
      "company_name": "K + M Knörnschild & Mayer OHG Wärme- und Klimatechnik",
      "company_seat": "Hof (Saale)",
      "details": "26.06.2025 (Bekanntmachungsdatum)\n\nBayern Amtsgericht Hof HRA 16\nLöschungsankündigung\n\nK + M Knörnschild & Mayer OHG Wärme- und Klimatechnik\nOffene Handelsgesellschaft\nHof (Saale)\n\nDas Registergericht beabsichtigt, die im Handelsregister eingetragene Firma von Amts wegen nach § 31 Abs. 2 HGB, § 393 FamFG zu löschen. Die Frist zur Erhebung eines Widerspruchs ist auf sechs Wochen festgesetzt."
    },
    {
      "date": "2025-06-26",
      "id": "113439",
      "original_text": "Registerbekanntmachung nach dem Umwandlungsgesetz\nBayern Amtsgericht München HRB 250456\nContrium Treuhand GmbH – Starnberg",
      "type": "Registerbekanntmachung nach dem Umwandlungsgesetz",
      "state": "Bayern",
      "amtsgericht": "Amtsgericht München",
      "registernummer": "HRB 250456",
      "registerart": "HRB",
      "company_name": "Contrium Treuhand GmbH",
      "company_seat": "Starnberg",
      "details": "26.06.2025 (Bekanntmachungsdatum)\n\nBayern Amtsgericht München HRB 250456\nRegisterbekanntmachung nach dem Umwandlungsgesetz 25.06.2025 (Eintragungsdatum)\n\nContrium Treuhand GmbH\nGesellschaft mit beschränkter Haftung\nStarnberg\n\nDen Gläubigern der an der Verschmelzung beteiligten Rechtsträger ist, wenn sie binnen sechs Monaten nach dem Tag, an dem die Eintragung der Verschmelzung in das Register des Sitzes desjenigen Rechtsträgers, dessen Gläubiger sie sind, nach § 19 Abs. 3 UmwG als bekannt gemacht gilt, ihren Anspruch nach Grund und Höhe in Textform anmelden, Sicherheit zu leisten, soweit sie nicht Befriedigung verlangen können. Dieses Recht steht den Gläubigern jedoch nur zu, wenn sie glaubhaft machen, dass durch die Verschmelzung die Erfüllung ihrer Forderung gefährdet wird."
    },
    {
      "date": "2025-06-26",
      "id": "113440",
      "original_text": "Löschungsankündigung\nBayern Amtsgericht Nürnberg HRB 24787\nENCASAN Verwaltungs GmbH – Nürnberg",
      "type": "Löschungsankündigung",
      "state": "Bayern",
      "amtsgericht": "Amtsgericht Nürnberg",
      "registernummer": "HRB 24787",
      "registerart": "HRB",
      "company_name": "ENCASAN Verwaltungs GmbH",
      "company_seat": "Nürnberg",
      "details": "26.06.2025 (Bekanntmachungsdatum)\n\nBayern Amtsgericht Nürnberg HRB 24787\nLöschungsankündigung\n\nENCASAN Verwaltungs GmbH\nGesellschaft mit beschränkter Haftung\nNürnberg\n\nDas Registergericht beabsichtigt, die im Handelsregister eingetragene Gesellschaft wegen Vermögenslosigkeit von Amts wegen nach § 394 FamFG zu löschen. Die Frist zur Erhebung eines Widerspruchs ist auf einen Monat festgesetzt."
    },
    {
      "date": "2025-06-26",
      "id": "113441",
      "original_text": "Registerbekanntmachung nach dem Umwandlungsgesetz\nBayern Amtsgericht Augsburg HRB 31479\nFriedberger Grundbesitz GmbH – Friedberg",
      "type": "Registerbekanntmachung nach dem Umwandlungsgesetz",
      "state": "Bayern",
      "amtsgericht": "Amtsgericht Augsburg",
      "registernummer": "HRB 31479",
      "registerart": "HRB",
      "company_name": "Friedberger Grundbesitz GmbH",
      "company_seat": "Friedberg",
      "details": "26.06.2025 (Bekanntmachungsdatum)\n\nBayern Amtsgericht Augsburg HRB 31479\nRegisterbekanntmachung nach dem Umwandlungsgesetz 25.06.2025 (Eintragungsdatum)\n\nFriedberger Grundbesitz GmbH\nGesellschaft mit beschränkter Haftung\nFriedberg\n\nDen Gläubigern der an der Verschmelzung beteiligten Rechtsträger ist, wenn sie binnen sechs Monaten nach dem Tag, an dem die Eintragung der Verschmelzung in das Register des Sitzes desjenigen Rechtsträgers, dessen Gläubiger sie sind, nach § 19 Abs. 3 UmwG als bekannt gemacht gilt, ihren Anspruch nach Grund und Höhe in Textform anmelden, Sicherheit zu leisten, soweit sie nicht Befriedigung verlangen können. Dieses Recht steht den Gläubigern jedoch nur zu, wenn sie glaubhaft machen, dass durch die Verschmelzung die Erfüllung ihrer Forderung gefährdet wird."
    },
    {
      "date": "2025-06-26",
      "id": "113442",
      "original_text": "Löschungsankündigung\nBayern Amtsgericht München HRB 146488\nTempower Personaldienstleistung Poing GmbH – München",
      "type": "Löschungsankündigung",
      "state": "Bayern",
      "amtsgericht": "Amtsgericht München",
      "registernummer": "HRB 146488",
      "registerart": "HRB",
      "company_name": "Tempower Personaldienstleistung Poing GmbH",
      "company_seat": "München",
      "details": "26.06.2025 (Bekanntmachungsdatum)\n\nBayern Amtsgericht München HRB 146488\nLöschungsankündigung\n\nTempower Personaldienstleistung Poing GmbH\nGesellschaft mit beschränkter Haftung\nMünchen\n\nDas Registergericht beabsichtigt, die im Handelsregister eingetragene Gesellschaft wegen Vermögenslosigkeit von Amts wegen nach § 394 FamFG zu löschen. Die Frist zur Erhebung eines Widerspruchs ist auf drei Monate festgesetzt."
    },
    {
      "date": "2025-06-26",
      "id": "113443",
      "original_text": "Einreichung neuer Dokumente\nBayern Amtsgericht Augsburg HRB 18092\nStadtwerke Augsburg Verkehrs-GmbH – Augsburg",
      "type": "Einreichung neuer Dokumente",
      "state": "Bayern",
      "amtsgericht": "Amtsgericht Augsburg",
      "registernummer": "HRB 18092",
      "registerart": "HRB",
      "company_name": "Stadtwerke Augsburg Verkehrs-GmbH",
      "company_seat": "Augsburg",
      "details": "26.06.2025 (Bekanntmachungsdatum)\n\nBayern Amtsgericht Augsburg HRB 18092\nEinreichung neuer Dokumente\n\nStadtwerke Augsburg Verkehrs-GmbH\nGesellschaft mit beschränkter Haftung\nAugsburg\n\nDem Amtsgericht Augsburg -Registergericht- ist eine Liste der Mitglieder des Aufsichtsrats eingereicht worden, § 52 Abs. 3 S. 2 GmbHG."
    },
    {
      "date": "2025-06-26",
      "id": "113444",
      "original_text": "Registerbekanntmachung nach dem Umwandlungsgesetz\nBayern Amtsgericht München HRB 274390\nAmazon Deutschland W38 Transport GmbH – München",
      "type": "Registerbekanntmachung nach dem Umwandlungsgesetz",
      "state": "Bayern",
      "amtsgericht": "Amtsgericht München",
      "registernummer": "HRB 274390",
      "registerart": "HRB",
      "company_name": "Amazon Deutschland W38 Transport GmbH",
      "company_seat": "München",
      "details": "26.06.2025 (Bekanntmachungsdatum)\n\nBayern Amtsgericht München HRB 274390\nRegisterbekanntmachung nach dem Umwandlungsgesetz 25.06.2025 (Eintragungsdatum)\n\nAmazon Deutschland W38 Transport GmbH\nGesellschaft mit beschränkter Haftung\nMünchen\n\nDen Gläubigern der an der Verschmelzung beteiligten Rechtsträger ist, wenn sie binnen sechs Monaten nach dem Tag, an dem die Eintragung der Verschmelzung in das Register des Sitzes desjenigen Rechtsträgers, dessen Gläubiger sie sind, nach § 19 Abs. 3 UmwG als bekannt gemacht gilt, ihren Anspruch nach Grund und Höhe in Textform anmelden, Sicherheit zu leisten, soweit sie nicht Befriedigung verlangen können. Dieses Recht steht den Gläubigern jedoch nur zu, wenn sie glaubhaft machen, dass durch die Verschmelzung die Erfüllung ihrer Forderung gefährdet wird."
    },
    {
      "date": "2025-06-26",
      "id": "113445",
      "original_text": "Registerbekanntmachung nach dem Umwandlungsgesetz\nBayern Amtsgericht München HRA 119848\nSANCTOR Grundstücks-Vermietungsgesellschaft mbH & Co. Objekt Unterhaching KG – München",
      "type": "Registerbekanntmachung nach dem Umwandlungsgesetz",
      "state": "Bayern",
      "amtsgericht": "Amtsgericht München",
      "registernummer": "HRA 119848",
      "registerart": "HRA",
      "company_name": "SANCTOR Grundstücks-Vermietungsgesellschaft mbH & Co. Objekt Unterhaching KG",
      "company_seat": "München",
      "details": "26.06.2025 (Bekanntmachungsdatum)\n\nBayern Amtsgericht München HRA 119848\nRegisterbekanntmachung nach dem Umwandlungsgesetz 25.06.2025 (Eintragungsdatum)\n\nSANCTOR Grundstücks-Vermietungsgesellschaft mbH & Co. Objekt Unterhaching KG\nKommanditgesellschaft\nMünchen\n\nDen Gläubigern des formwechselnden Rechtsträgers ist, wenn sie binnen sechs Monaten nach dem Tag, an dem die Eintragung des Formwechsels nach § 201 UmwG als bekannt gemacht gilt, ihren Anspruch nach Grund und Höhe in Textform anmelden, Sicherheit zu leisten, soweit sie nicht Befriedigung verlangen können. Dieses Recht steht den Gläubigern jedoch nur zu, wenn sie glaubhaft machen, dass durch den Formwechsel die Erfüllung ihrer Forderung gefährdet wird."
    },
    {
      "date": "2025-06-26",
      "id": "113446",
      "original_text": "Registerbekanntmachung nach dem Umwandlungsgesetz\nBayern Amtsgericht Memmingen HRB 1850\nExpert Schwarz GmbH – Günzburg",
      "type": "Registerbekanntmachung nach dem Umwandlungsgesetz",
      "state": "Bayern",
      "amtsgericht": "Amtsgericht Memmingen",
      "registernummer": "HRB 1850",
      "registerart": "HRB",
      "company_name": "Expert Schwarz GmbH",
      "company_seat": "Günzburg",
      "details": "26.06.2025 (Bekanntmachungsdatum)\n\nBayern Amtsgericht Memmingen HRB 1850\nRegisterbekanntmachung nach dem Umwandlungsgesetz 25.06.2025 (Eintragungsdatum)\n\nExpert Schwarz GmbH\nGesellschaft mit beschränkter Haftung\nGünzburg\n\nDen Gläubigern der an der Verschmelzung beteiligten Rechtsträger ist, wenn sie binnen sechs Monaten nach dem Tag, an dem die Eintragung der Verschmelzung in das Register des Sitzes desjenigen Rechtsträgers, dessen Gläubiger sie sind, nach § 19 Abs. 3 UmwG als bekannt gemacht gilt, ihren Anspruch nach Grund und Höhe in Textform anmelden, Sicherheit zu leisten, soweit sie nicht Befriedigung verlangen können. Dieses Recht steht den Gläubigern jedoch nur zu, wenn sie glaubhaft machen, dass durch die Verschmelzung die Erfüllung ihrer Forderung gefährdet wird."
    },
    {
      "date": "2025-06-26",
      "id": "113447",
      "original_text": "Registerbekanntmachung nach dem Umwandlungsgesetz\nBayern Amtsgericht München HRB 179531\nfidelis trust GmbH – Grünwald",
      "type": "Registerbekanntmachung nach dem Umwandlungsgesetz",
      "state": "Bayern",
      "amtsgericht": "Amtsgericht München",
      "registernummer": "HRB 179531",
      "registerart": "HRB",
      "company_name": "fidelis trust GmbH",
      "company_seat": "Grünwald",
      "details": "26.06.2025 (Bekanntmachungsdatum)\n\nBayern Amtsgericht München HRB 179531\nRegisterbekanntmachung nach dem Umwandlungsgesetz 25.06.2025 (Eintragungsdatum)\n\nfidelis trust GmbH\nGesellschaft mit beschränkter Haftung\nGrünwald\n\nDen Gläubigern der an der Ausgliederung beteiligten Rechtsträger ist, wenn sie binnen sechs Monaten nach dem Tag, an dem die Eintragung der Ausgliederung in das Register des Sitzes desjenigen Rechtsträgers, dessen Gläubiger sie sind, nach §§ 125, 19 Abs. 3 UmwG als bekannt gemacht gilt, ihren Anspruch nach Grund und Höhe in Textform anmelden, Sicherheit zu leisten, soweit sie nicht Befriedigung verlangen können. Dieses Recht steht den Gläubigern jedoch nur zu, wenn sie glaubhaft machen, dass durch die Ausgliederung die Erfüllung ihrer Forderung gefährdet wird."
    },
    {
      "date": "2025-06-26",
      "id": "113448",
      "original_text": "Einreichung neuer Dokumente\nBayern Amtsgericht Augsburg HRB 2106\nEpple Druckfarben AG – Augsburg",
      "type": "Einreichung neuer Dokumente",
      "state": "Bayern",
      "amtsgericht": "Amtsgericht Augsburg",
      "registernummer": "HRB 2106",
      "registerart": "HRB",
      "company_name": "Epple Druckfarben AG",
      "company_seat": "Augsburg",
      "details": "26.06.2025 (Bekanntmachungsdatum)\n\nBayern Amtsgericht Augsburg HRB 2106\nEinreichung neuer Dokumente 25.06.2025 (Eintragungsdatum)\n\nEpple Druckfarben AG\nAktiengesellschaft\nAugsburg\n\nDem Registergericht Augsburg ist eine Liste der Mitglieder des Aufsichtsrats eingereicht worden, § 106 AktG."
    },
    {
      "date": "2025-06-26",
      "id": "113449",
      "original_text": "Registerbekanntmachung nach dem Umwandlungsgesetz\nBayern Amtsgericht Memmingen HRB 16873\nexpertec GmbH – Günzburg",
      "type": "Registerbekanntmachung nach dem Umwandlungsgesetz",
      "state": "Bayern",
      "amtsgericht": "Amtsgericht Memmingen",
      "registernummer": "HRB 16873",
      "registerart": "HRB",
      "company_name": "expertec GmbH",
      "company_seat": "Günzburg",
      "details": "26.06.2025 (Bekanntmachungsdatum)\n\nBayern Amtsgericht Memmingen HRB 16873\nRegisterbekanntmachung nach dem Umwandlungsgesetz 25.06.2025 (Eintragungsdatum)\n\nexpertec GmbH\nGesellschaft mit beschränkter Haftung\nGünzburg\n\nDen Gläubigern der an der Verschmelzung beteiligten Rechtsträger ist, wenn sie binnen sechs Monaten nach dem Tag, an dem die Eintragung der Verschmelzung in das Register des Sitzes desjenigen Rechtsträgers, dessen Gläubiger sie sind, nach § 19 Abs. 3 UmwG als bekannt gemacht gilt, ihren Anspruch nach Grund und Höhe in Textform anmelden, Sicherheit zu leisten, soweit sie nicht Befriedigung verlangen können. Dieses Recht steht den Gläubigern jedoch nur zu, wenn sie glaubhaft machen, dass durch die Verschmelzung die Erfüllung ihrer Forderung gefährdet wird."
    },
    {
      "date": "2025-06-26",
      "id": "113450",
      "original_text": "Löschungsankündigung\nBayern Amtsgericht Bayreuth HRB 6624\nRedel Bau GmbH – Pegnitz",
      "type": "Löschungsankündigung",
      "state": "Bayern",
      "amtsgericht": "Amtsgericht Bayreuth",
      "registernummer": "HRB 6624",
      "registerart": "HRB",
      "company_name": "Redel Bau GmbH",
      "company_seat": "Pegnitz",
      "details": "26.06.2025 (Bekanntmachungsdatum)\n\nBayern Amtsgericht Bayreuth HRB 6624\nLöschungsankündigung\n\nRedel Bau GmbH\nGesellschaft mit beschränkter Haftung\nPegnitz\n\nDas Registergericht beabsichtigt, die im Handelsregister eingetragene Gesellschaft wegen Vermögenslosigkeit von Amts wegen nach § 394 FamFG zu löschen. Die Frist zur Erhebung eines Widerspruchs ist auf einen Monat festgesetzt."
    },
    {
      "date": "2025-06-26",
      "id": "113451",
      "original_text": "Löschungsankündigung\nBayern Amtsgericht Ansbach HRB 7217\nYour Only UG (haftungsbeschränkt) – Weißenburg i. Bayern",
      "type": "Löschungsankündigung",
      "state": "Bayern",
      "amtsgericht": "Amtsgericht Ansbach",
      "registernummer": "HRB 7217",
      "registerart": "HRB",
      "company_name": "Your Only UG (haftungsbeschränkt)",
      "company_seat": "Weißenburg i. Bayern",
      "details": "26.06.2025 (Bekanntmachungsdatum)\n\nBayern Amtsgericht Ansbach HRB 7217\nLöschungsankündigung\n\nYour Only UG (haftungsbeschränkt)\nGesellschaft mit beschränkter Haftung\nWeißenburg i. Bayern\n\nDas Registergericht beabsichtigt, die im Handelsregister eingetragene Gesellschaft wegen Vermögenslosigkeit von Amts wegen nach § 394 FamFG zu löschen. Die Frist zur Erhebung eines Widerspruchs ist auf sechs Wochen festgesetzt."
    },
    {
      "date": "2025-06-26",
      "id": "113452",
      "original_text": "Löschungsankündigung\nBayern Amtsgericht München HRB 212224\nNorbekov Institute Europe GmbH – München",
      "type": "Löschungsankündigung",
      "state": "Bayern",
      "amtsgericht": "Amtsgericht München",
      "registernummer": "HRB 212224",
      "registerart": "HRB",
      "company_name": "Norbekov Institute Europe GmbH",
      "company_seat": "München",
      "details": "26.06.2025 (Bekanntmachungsdatum)\n\nBayern Amtsgericht München HRB 212224\nLöschungsankündigung 25.06.2025 (Eintragungsdatum)\n\nNorbekov Institute Europe GmbH\nGesellschaft mit beschränkter Haftung\nMünchen\n\nDas Registergericht beabsichtigt, die im Handelsregister eingetragene Gesellschaft wegen Vermögenslosigkeit von Amts wegen nach § 394 FamFG zu löschen. Die Frist zur Erhebung eines Widerspruchs ist auf drei Monate festgesetzt."
    },
    {
      "date": "2025-06-26",
      "id": "113453",
      "original_text": "Registerbekanntmachung nach dem Umwandlungsgesetz\nBayern Amtsgericht Würzburg VR 30343\nSportverein Deutsche-Jugend-Kraft Wombach e.V. (SV DJK Wombach e.V.) – Lohr a.M. - Wombach",
      "type": "Registerbekanntmachung nach dem Umwandlungsgesetz",
      "state": "Bayern",
      "amtsgericht": "Amtsgericht Würzburg",
      "registernummer": "VR 30343",
      "registerart": "VR",
      "company_name": "Sportverein Deutsche-Jugend-Kraft Wombach e.V. (SV DJK Wombach e.V.)",
      "company_seat": "Lohr a.M. - Wombach",
      "details": "26.06.2025 (Bekanntmachungsdatum)\n\nBayern Amtsgericht Würzburg VR 30343\nRegisterbekanntmachung nach dem Umwandlungsgesetz 25.06.2025 (Eintragungsdatum)\n\nSportverein Deutsche-Jugend-Kraft Wombach e.V. (SV DJK Wombach e.V.)\neingetragener Verein\nLohr a.M. - Wombach\n\nDen Gläubigern der an der Verschmelzung beteiligten Rechtsträger ist, wenn sie binnen sechs Monaten nach dem Tag, an dem die Eintragung der Verschmelzung in das Register des Sitzes desjenigen Rechtsträgers, dessen Gläubiger sie sind, nach § 19 Abs. 3 UmwG als bekannt gemacht gilt, ihren Anspruch nach Grund und Höhe in Textform anmelden, Sicherheit zu leisten, soweit sie nicht Befriedigung verlangen können. Dieses Recht steht den Gläubigern jedoch nur zu, wenn sie glaubhaft machen, dass durch die Verschmelzung die Erfüllung ihrer Forderung gefährdet wird."
    },
    {
      "date": "2025-06-26",
      "id": "113454",
      "original_text": "Registerbekanntmachung nach dem Umwandlungsgesetz\nBayern Amtsgericht Passau HRB 12035\napp:team:al UG (haftungsbeschränkt) – Ortenburg",
      "type": "Registerbekanntmachung nach dem Umwandlungsgesetz",
      "state": "Bayern",
      "amtsgericht": "Amtsgericht Passau",
      "registernummer": "HRB 12035",
      "registerart": "HRB",
      "company_name": "app:team:al UG (haftungsbeschränkt)",
      "company_seat": "Ortenburg",
      "details": "26.06.2025 (Bekanntmachungsdatum)\n\nBayern Amtsgericht Passau HRB 12035\nRegisterbekanntmachung nach dem Umwandlungsgesetz 25.06.2025 (Eintragungsdatum)\n\napp:team:al UG (haftungsbeschränkt)\nGesellschaft mit beschränkter Haftung\nOrtenburg\n\nDen Gläubigern der an der Verschmelzung beteiligten Rechtsträger ist, wenn sie binnen sechs Monaten nach dem Tag, an dem die Eintragung der Verschmelzung in das Register des Sitzes desjenigen Rechtsträgers, dessen Gläubiger sie sind, nach § 19 Abs. 3 UmwG als bekannt gemacht gilt, ihren Anspruch nach Grund und Höhe in Textform anmelden, Sicherheit zu leisten, soweit sie nicht Befriedigung verlangen können. Dieses Recht steht den Gläubigern jedoch nur zu, wenn sie glaubhaft machen, dass durch die Verschmelzung die Erfüllung ihrer Forderung gefährdet wird."
    },
    {
      "date": "2025-06-26",
      "id": "113455",
      "original_text": "Löschungsankündigung\nBayern Amtsgericht München HRB 270110\nITP Real Estate Investment GmbH – Grünwald",
      "type": "Löschungsankündigung",
      "state": "Bayern",
      "amtsgericht": "Amtsgericht München",
      "registernummer": "HRB 270110",
      "registerart": "HRB",
      "company_name": "ITP Real Estate Investment GmbH",
      "company_seat": "Grünwald",
      "details": "26.06.2025 (Bekanntmachungsdatum)\n\nBayern Amtsgericht München HRB 270110\nLöschungsankündigung 25.06.2025 (Eintragungsdatum)\n\nITP Real Estate Investment GmbH\nGesellschaft mit beschränkter Haftung\nGrünwald\n\nDas Registergericht beabsichtigt, die im Handelsregister eingetragene Gesellschaft wegen Vermögenslosigkeit von Amts wegen nach § 394 FamFG zu löschen. Die Frist zur Erhebung eines Widerspruchs ist auf drei Monate festgesetzt."
    },
    {
      "date": "2025-06-26",
      "id": "113456",
      "original_text": "Registerbekanntmachung nach dem Umwandlungsgesetz\nBayern Amtsgericht München HRB 206164\nKraussMaffei Automation GmbH – Vaterstetten",
      "type": "Registerbekanntmachung nach dem Umwandlungsgesetz",
      "state": "Bayern",
      "amtsgericht": "Amtsgericht München",
      "registernummer": "HRB 206164",
      "registerart": "HRB",
      "company_name": "KraussMaffei Automation GmbH",
      "company_seat": "Vaterstetten",
      "details": "26.06.2025 (Bekanntmachungsdatum)\n\nBayern Amtsgericht München HRB 206164\nRegisterbekanntmachung nach dem Umwandlungsgesetz 25.06.2025 (Eintragungsdatum)\n\nKraussMaffei Automation GmbH\nGesellschaft mit beschränkter Haftung\nVaterstetten\n\nDen Gläubigern der an der Verschmelzung beteiligten Rechtsträger ist, wenn sie binnen sechs Monaten nach dem Tag, an dem die Eintragung der Verschmelzung in das Register des Sitzes desjenigen Rechtsträgers, dessen Gläubiger sie sind, nach § 19 Abs. 3 UmwG als bekannt gemacht gilt, ihren Anspruch nach Grund und Höhe in Textform anmelden, Sicherheit zu leisten, soweit sie nicht Befriedigung verlangen können. Dieses Recht steht den Gläubigern jedoch nur zu, wenn sie glaubhaft machen, dass durch die Verschmelzung die Erfüllung ihrer Forderung gefährdet wird."
    },
    {
      "date": "2025-06-26",
      "id": "113457",
      "original_text": "Registerbekanntmachung nach dem Umwandlungsgesetz\nBayern Amtsgericht München HRB 279335\nact to impact AG – München",
      "type": "Registerbekanntmachung nach dem Umwandlungsgesetz",
      "state": "Bayern",
      "amtsgericht": "Amtsgericht München",
      "registernummer": "HRB 279335",
      "registerart": "HRB",
      "company_name": "act to impact AG",
      "company_seat": "München",
      "details": "26.06.2025 (Bekanntmachungsdatum)\n\nBayern Amtsgericht München HRB 279335\nRegisterbekanntmachung nach dem Umwandlungsgesetz\n\nact to impact AG\nAktiengesellschaft\nMünchen\n\nDem Amtsgericht München -Registergericht- ist der Entwurf eines Verschmelzungsvertrages zwischen der act to impact Asset Management GmbH, München (Amtsgericht München HRB 276888) als übernehmender Rechtsträger und der Gesellschaft als übertragendem Rechtsträger zur Einsichtnahme eingereicht worden."
    },
    {
      "date": "2025-06-26",
      "id": "113458",
      "original_text": "Registerbekanntmachung nach dem Umwandlungsgesetz\nBayern Amtsgericht München HRB 201342\nDENKmal-Film Strigel GmbH – München",
      "type": "Registerbekanntmachung nach dem Umwandlungsgesetz",
      "state": "Bayern",
      "amtsgericht": "Amtsgericht München",
      "registernummer": "HRB 201342",
      "registerart": "HRB",
      "company_name": "DENKmal-Film Strigel GmbH",
      "company_seat": "München",
      "details": "26.06.2025 (Bekanntmachungsdatum)\n\nBayern Amtsgericht München HRB 201342\nRegisterbekanntmachung nach dem Umwandlungsgesetz 25.06.2025 (Eintragungsdatum)\n\nDENKmal-Film Strigel GmbH\nGesellschaft mit beschränkter Haftung\nMünchen\n\nDen Gläubigern der an der Verschmelzung beteiligten Rechtsträger ist, wenn sie binnen sechs Monaten nach dem Tag, an dem die Eintragung der Verschmelzung in das Register des Sitzes desjenigen Rechtsträgers, dessen Gläubiger sie sind, nach § 19 Abs. 3 UmwG als bekannt gemacht gilt, ihren Anspruch nach Grund und Höhe in Textform anmelden, Sicherheit zu leisten, soweit sie nicht Befriedigung verlangen können. Dieses Recht steht den Gläubigern jedoch nur zu, wenn sie glaubhaft machen, dass durch die Verschmelzung die Erfüllung ihrer Forderung gefährdet wird."
    },
    {
      "date": "2025-06-26",
      "id": "113459",
      "original_text": "Registerbekanntmachung nach dem Umwandlungsgesetz\nBayern Amtsgericht München HRB 288623\nBaywobau Immobilien GmbH – Grünwald",
      "type": "Registerbekanntmachung nach dem Umwandlungsgesetz",
      "state": "Bayern",
      "amtsgericht": "Amtsgericht München",
      "registernummer": "HRB 288623",
      "registerart": "HRB",
      "company_name": "Baywobau Immobilien GmbH",
      "company_seat": "Grünwald",
      "details": "26.06.2025 (Bekanntmachungsdatum)\n\nBayern Amtsgericht München HRB 288623\nRegisterbekanntmachung nach dem Umwandlungsgesetz 25.06.2025 (Eintragungsdatum)\n\nBaywobau Immobilien GmbH\nGesellschaft mit beschränkter Haftung\nGrünwald\n\nDen Gläubigern der an der Ausgliederung beteiligten Rechtsträger ist, wenn sie binnen sechs Monaten nach dem Tag, an dem die Eintragung der Ausgliederung in das Register des Sitzes desjenigen Rechtsträgers, dessen Gläubiger sie sind, nach §§ 125, 19 Abs. 3 UmwG als bekannt gemacht gilt, ihren Anspruch nach Grund und Höhe in Textform anmelden, Sicherheit zu leisten, soweit sie nicht Befriedigung verlangen können. Dieses Recht steht den Gläubigern jedoch nur zu, wenn sie glaubhaft machen, dass durch die Ausgliederung die Erfüllung ihrer Forderung gefährdet wird.Den Gläubigern der an der Ausgliederung beteiligten Rechtsträger ist, wenn sie binnen sechs Monaten nach dem Tag, an dem die Eintragung der Ausgliederung in das Register des Sitzes desjenigen Rechtsträgers, dessen Gläubiger sie sind, nach §§ 125, 19 Abs. 3 UmwG als bekannt gemacht gilt, ihren Anspruch nach Grund und Höhe in Textform anmelden, Sicherheit zu leisten, soweit sie nicht Befriedigung verlangen können. Dieses Recht steht den Gläubigern jedoch nur zu, wenn sie glaubhaft machen, dass durch die Ausgliederung die Erfüllung ihrer Forderung gefährdet wird."
    },
    {
      "date": "2025-06-26",
      "id": "113460",
      "original_text": "Registerbekanntmachung nach dem Umwandlungsgesetz\nBayern Amtsgericht München HRB 277340\nCropz GmbH – Taufkirchen",
      "type": "Registerbekanntmachung nach dem Umwandlungsgesetz",
      "state": "Bayern",
      "amtsgericht": "Amtsgericht München",
      "registernummer": "HRB 277340",
      "registerart": "HRB",
      "company_name": "Cropz GmbH",
      "company_seat": "Taufkirchen",
      "details": "26.06.2025 (Bekanntmachungsdatum)\n\nBayern Amtsgericht München HRB 277340\nRegisterbekanntmachung nach dem Umwandlungsgesetz 25.06.2025 (Eintragungsdatum)\n\nCropz GmbH\nGesellschaft mit beschränkter Haftung\nTaufkirchen\n\nDen Gläubigern der an der Verschmelzung beteiligten Rechtsträger ist, wenn sie binnen sechs Monaten nach dem Tag, an dem die Eintragung der Verschmelzung in das Register des Sitzes desjenigen Rechtsträgers, dessen Gläubiger sie sind, nach § 19 Abs. 3 UmwG als bekannt gemacht gilt, ihren Anspruch nach Grund und Höhe in Textform anmelden, Sicherheit zu leisten, soweit sie nicht Befriedigung verlangen können. Dieses Recht steht den Gläubigern jedoch nur zu, wenn sie glaubhaft machen, dass durch die Verschmelzung die Erfüllung ihrer Forderung gefährdet wird."
    },
    {
      "date": "2025-06-26",
      "id": "113461",
      "original_text": "Registerbekanntmachung nach dem Umwandlungsgesetz\nBayern Amtsgericht München HRB 54200\nKeller & Kalmbach GmbH – Unterschleißheim",
      "type": "Registerbekanntmachung nach dem Umwandlungsgesetz",
      "state": "Bayern",
      "amtsgericht": "Amtsgericht München",
      "registernummer": "HRB 54200",
      "registerart": "HRB",
      "company_name": "Keller & Kalmbach GmbH",
      "company_seat": "Unterschleißheim",
      "details": "26.06.2025 (Bekanntmachungsdatum)\n\nBayern Amtsgericht München HRB 54200\nRegisterbekanntmachung nach dem Umwandlungsgesetz 25.06.2025 (Eintragungsdatum)\n\nKeller & Kalmbach GmbH\nGesellschaft mit beschränkter Haftung\nUnterschleißheim\n\nDen Gläubigern des formwechselnden Rechtsträgers ist, wenn sie binnen sechs Monaten nach dem Tag, an dem die Eintragung des Formwechsels nach § 201 UmwG als bekannt gemacht gilt, ihren Anspruch nach Grund und Höhe in Textform anmelden, Sicherheit zu leisten, soweit sie nicht Befriedigung verlangen können. Dieses Recht steht den Gläubigern jedoch nur zu, wenn sie glaubhaft machen, dass durch den Formwechsel die Erfüllung ihrer Forderung gefährdet wird."
    },
    {
      "date": "2025-06-26",
      "id": "113462",
      "original_text": "Registerbekanntmachung nach dem Umwandlungsgesetz\nBayern Amtsgericht München HRB 274428\nAmazon Deutschland W36 Transport GmbH – München",
      "type": "Registerbekanntmachung nach dem Umwandlungsgesetz",
      "state": "Bayern",
      "amtsgericht": "Amtsgericht München",
      "registernummer": "HRB 274428",
      "registerart": "HRB",
      "company_name": "Amazon Deutschland W36 Transport GmbH",
      "company_seat": "München",
      "details": "26.06.2025 (Bekanntmachungsdatum)\n\nBayern Amtsgericht München HRB 274428\nRegisterbekanntmachung nach dem Umwandlungsgesetz 25.06.2025 (Eintragungsdatum)\n\nAmazon Deutschland W36 Transport GmbH\nGesellschaft mit beschränkter Haftung\nMünchen\n\nDen Gläubigern der an der Verschmelzung beteiligten Rechtsträger ist, wenn sie binnen sechs Monaten nach dem Tag, an dem die Eintragung der Verschmelzung in das Register des Sitzes desjenigen Rechtsträgers, dessen Gläubiger sie sind, nach § 19 Abs. 3 UmwG als bekannt gemacht gilt, ihren Anspruch nach Grund und Höhe in Textform anmelden, Sicherheit zu leisten, soweit sie nicht Befriedigung verlangen können. Dieses Recht steht den Gläubigern jedoch nur zu, wenn sie glaubhaft machen, dass durch die Verschmelzung die Erfüllung ihrer Forderung gefährdet wird."
    },
    {
      "date": "2025-06-26",
      "id": "113463",
      "original_text": "Registerbekanntmachung nach dem Umwandlungsgesetz\nBayern Amtsgericht München HRB 257271\nrehaneo Verwaltungs GmbH – München",
      "type": "Registerbekanntmachung nach dem Umwandlungsgesetz",
      "state": "Bayern",
      "amtsgericht": "Amtsgericht München",
      "registernummer": "HRB 257271",
      "registerart": "HRB",
      "company_name": "rehaneo Verwaltungs GmbH",
      "company_seat": "München",
      "details": "26.06.2025 (Bekanntmachungsdatum)\n\nBayern Amtsgericht München HRB 257271\nRegisterbekanntmachung nach dem Umwandlungsgesetz 25.06.2025 (Eintragungsdatum)\n\nrehaneo Verwaltungs GmbH\nGesellschaft mit beschränkter Haftung\nMünchen\n\nDen Gläubigern der an der Verschmelzung beteiligten Rechtsträger ist, wenn sie binnen sechs Monaten nach dem Tag, an dem die Eintragung der Verschmelzung in das Register des Sitzes desjenigen Rechtsträgers, dessen Gläubiger sie sind, nach § 19 Abs. 3 UmwG als bekannt gemacht gilt, ihren Anspruch nach Grund und Höhe in Textform anmelden, Sicherheit zu leisten, soweit sie nicht Befriedigung verlangen können. Dieses Recht steht den Gläubigern jedoch nur zu, wenn sie glaubhaft machen, dass durch die Verschmelzung die Erfüllung ihrer Forderung gefährdet wird."
    },
    {
      "date": "2025-06-26",
      "id": "113464",
      "original_text": "Registerbekanntmachung nach dem Umwandlungsgesetz\nBayern Amtsgericht Nürnberg HRB 26754\nDr. Storg GmbH Wirtschaftsprüfungsgesellschaft Steuerberatungsgesellschaft – Nürnberg",
      "type": "Registerbekanntmachung nach dem Umwandlungsgesetz",
      "state": "Bayern",
      "amtsgericht": "Amtsgericht Nürnberg",
      "registernummer": "HRB 26754",
      "registerart": "HRB",
      "company_name": "Dr. Storg GmbH Wirtschaftsprüfungsgesellschaft Steuerberatungsgesellschaft",
      "company_seat": "Nürnberg",
      "details": "26.06.2025 (Bekanntmachungsdatum)\n\nBayern Amtsgericht Nürnberg HRB 26754\nRegisterbekanntmachung nach dem Umwandlungsgesetz 25.06.2025 (Eintragungsdatum)\n\nDr. Storg GmbH Wirtschaftsprüfungsgesellschaft Steuerberatungsgesellschaft\nGesellschaft mit beschränkter Haftung\nNürnberg\n\nDen Gläubigern der an der Verschmelzung beteiligten Rechtsträger ist, wenn sie binnen sechs Monaten nach dem Tag, an dem die Eintragung der Verschmelzung in das Register des Sitzes desjenigen Rechtsträgers, dessen Gläubiger sie sind, nach § 19 Abs. 3 UmwG als bekannt gemacht gilt, ihren Anspruch nach Grund und Höhe in Textform anmelden, Sicherheit zu leisten, soweit sie nicht Befriedigung verlangen können. Dieses Recht steht den Gläubigern jedoch nur zu, wenn sie glaubhaft machen, dass durch die Verschmelzung die Erfüllung ihrer Forderung gefährdet wird."
    },
    {
      "date": "2025-06-26",
      "id": "113465",
      "original_text": "Löschungsankündigung\nBayern Amtsgericht Nürnberg HRB 36337\nFKL Touristik Verwaltungs GmbH – Nürnberg",
      "type": "Löschungsankündigung",
      "state": "Bayern",
      "amtsgericht": "Amtsgericht Nürnberg",
      "registernummer": "HRB 36337",
      "registerart": "HRB",
      "company_name": "FKL Touristik Verwaltungs GmbH",
      "company_seat": "Nürnberg",
      "details": "26.06.2025 (Bekanntmachungsdatum)\n\nBayern Amtsgericht Nürnberg HRB 36337\nLöschungsankündigung\n\nFKL Touristik Verwaltungs GmbH\nGesellschaft mit beschränkter Haftung\nNürnberg\n\nDas Registergericht beabsichtigt, die im Handelsregister eingetragene Gesellschaft wegen Vermögenslosigkeit von Amts wegen nach § 394 FamFG zu löschen. Die Frist zur Erhebung eines Widerspruchs ist auf einen Monat festgesetzt."
    },
    {
      "date": "2025-06-26",
      "id": "113466",
      "original_text": "Registerbekanntmachung nach dem Umwandlungsgesetz\nBayern Amtsgericht München HRB 193327\nAT Aero Verwaltungs GmbH – München",
      "type": "Registerbekanntmachung nach dem Umwandlungsgesetz",
      "state": "Bayern",
      "amtsgericht": "Amtsgericht München",
      "registernummer": "HRB 193327",
      "registerart": "HRB",
      "company_name": "AT Aero Verwaltungs GmbH",
      "company_seat": "München",
      "details": "26.06.2025 (Bekanntmachungsdatum)\n\nBayern Amtsgericht München HRB 193327\nRegisterbekanntmachung nach dem Umwandlungsgesetz 25.06.2025 (Eintragungsdatum)\n\nAT Aero Verwaltungs GmbH\nGesellschaft mit beschränkter Haftung\nMünchen\n\nDen Gläubigern der an der Verschmelzung beteiligten Rechtsträger ist, wenn sie binnen sechs Monaten nach dem Tag, an dem die Eintragung der Verschmelzung in das Register des Sitzes desjenigen Rechtsträgers, dessen Gläubiger sie sind, nach § 19 Abs. 3 UmwG als bekannt gemacht gilt, ihren Anspruch nach Grund und Höhe in Textform anmelden, Sicherheit zu leisten, soweit sie nicht Befriedigung verlangen können. Dieses Recht steht den Gläubigern jedoch nur zu, wenn sie glaubhaft machen, dass durch die Verschmelzung die Erfüllung ihrer Forderung gefährdet wird."
    },
    {
      "date": "2025-06-26",
      "id": "113467",
      "original_text": "Registerbekanntmachung nach dem Umwandlungsgesetz\nBayern Amtsgericht München HRB 274429\nAmazon Deutschland N22 Transport GmbH – München",
      "type": "Registerbekanntmachung nach dem Umwandlungsgesetz",
      "state": "Bayern",
      "amtsgericht": "Amtsgericht München",
      "registernummer": "HRB 274429",
      "registerart": "HRB",
      "company_name": "Amazon Deutschland N22 Transport GmbH",
      "company_seat": "München",
      "details": "26.06.2025 (Bekanntmachungsdatum)\n\nBayern Amtsgericht München HRB 274429\nRegisterbekanntmachung nach dem Umwandlungsgesetz 25.06.2025 (Eintragungsdatum)\n\nAmazon Deutschland N22 Transport GmbH\nGesellschaft mit beschränkter Haftung\nMünchen\n\nDen Gläubigern der an der Verschmelzung beteiligten Rechtsträger ist, wenn sie binnen sechs Monaten nach dem Tag, an dem die Eintragung der Verschmelzung in das Register des Sitzes desjenigen Rechtsträgers, dessen Gläubiger sie sind, nach § 19 Abs. 3 UmwG als bekannt gemacht gilt, ihren Anspruch nach Grund und Höhe in Textform anmelden, Sicherheit zu leisten, soweit sie nicht Befriedigung verlangen können. Dieses Recht steht den Gläubigern jedoch nur zu, wenn sie glaubhaft machen, dass durch die Verschmelzung die Erfüllung ihrer Forderung gefährdet wird."
    },
    {
      "date": "2025-06-26",
      "id": "113468",
      "original_text": "Löschungsankündigung\nBayern Amtsgericht München HRB 233845\nSiFinance24 GmbH – Starnberg",
      "type": "Löschungsankündigung",
      "state": "Bayern",
      "amtsgericht": "Amtsgericht München",
      "registernummer": "HRB 233845",
      "registerart": "HRB",
      "company_name": "SiFinance24 GmbH",
      "company_seat": "Starnberg",
      "details": "26.06.2025 (Bekanntmachungsdatum)\n\nBayern Amtsgericht München HRB 233845\nLöschungsankündigung 25.06.2025 (Eintragungsdatum)\n\nSiFinance24 GmbH\nGesellschaft mit beschränkter Haftung\nStarnberg\n\nDas Registergericht beabsichtigt, die im Handelsregister eingetragene Gesellschaft wegen Vermögenslosigkeit von Amts wegen nach § 394 FamFG zu löschen. Die Frist zur Erhebung eines Widerspruchs ist auf drei Monate festgesetzt."
    },
    {
      "date": "2025-06-26",
      "id": "113469",
      "original_text": "Einreichung neuer Dokumente\nBayern Amtsgericht München HRB 184376\nIF-TECH AG – München",
      "type": "Einreichung neuer Dokumente",
      "state": "Bayern",
      "amtsgericht": "Amtsgericht München",
      "registernummer": "HRB 184376",
      "registerart": "HRB",
      "company_name": "IF-TECH AG",
      "company_seat": "München",
      "details": "26.06.2025 (Bekanntmachungsdatum)\n\nBayern Amtsgericht München HRB 184376\nEinreichung neuer Dokumente\n\nIF-TECH AG\nAktiengesellschaft\nMünchen\n\nDem Amtsgericht München -Registergericht- ist eine Liste der Mitglieder des Aufsichtsrats eingereicht worden, § 106 AktG."
    },
    {
      "date": "2025-06-26",
      "id": "113470",
      "original_text": "Registerbekanntmachung nach dem Umwandlungsgesetz\nBaden-Württemberg Amtsgericht Stuttgart HRB 720674\nZÜBLIN Timber Gaildorf GmbH – Gaildorf",
      "type": "Registerbekanntmachung nach dem Umwandlungsgesetz",
      "state": "Baden-Württemberg",
      "amtsgericht": "Amtsgericht Stuttgart",
      "registernummer": "HRB 720674",
      "registerart": "HRB",
      "company_name": "ZÜBLIN Timber Gaildorf GmbH",
      "company_seat": "Gaildorf",
      "details": "26.06.2025 (Bekanntmachungsdatum)\n\nBaden-Württemberg Amtsgericht Stuttgart HRB 720674\nRegisterbekanntmachung nach dem Umwandlungsgesetz 26.06.2025 (Eintragungsdatum)\n\nZÜBLIN Timber Gaildorf GmbH\nGesellschaft mit beschränkter Haftung\nGaildorf\n\nDen Gläubigern der an der Verschmelzung beteiligten Rechtsträger ist, wenn sie binnen sechs Monaten nach dem Tag, an dem die Eintragung der Verschmelzung in das Register des Sitzes desjenigen Rechtsträgers, dessen Gläubiger sie sind, nach § 19 Abs. 3 UmwG als bekanntgemacht gilt, ihren Anspruch nach Grund und Höhe schriftlich anmelden, Sicherheit zu leisten, soweit sie nicht Befriedigung verlangen können. Dieses Recht steht den Gläubigern jedoch nur zu, wenn sie glaubhaft machen, dass durch die Verschmelzung die Erfüllung ihrer Forderung gefährdet wird."
    },
    {
      "date": "2025-06-26",
      "id": "113471",
      "original_text": "Registerbekanntmachung nach dem Umwandlungsgesetz\nBerlin Amtsgericht Berlin (Charlottenburg) HRB 44230\nKötter Consulting Engineers Berlin GmbH – Berlin",
      "type": "Registerbekanntmachung nach dem Umwandlungsgesetz",
      "state": "Berlin",
      "amtsgericht": "Amtsgericht Berlin (Charlottenburg)",
      "registernummer": "HRB 44230",
      "registerart": "HRB",
      "company_name": "Kötter Consulting Engineers Berlin GmbH",
      "company_seat": "Berlin",
      "details": "26.06.2025 (Bekanntmachungsdatum)\n\nBerlin Amtsgericht Berlin (Charlottenburg) HRB 44230\nRegisterbekanntmachung nach dem Umwandlungsgesetz 25.06.2025 (Eintragungsdatum)\n\nKötter Consulting Engineers Berlin GmbH\nGesellschaft mit beschränkter Haftung\nBerlin\n\nZu Eintragungsnummer 7 vom 25.06.2025 wird als nicht eingetragen veröffentlicht: Den Gläubigern der an der Verschmelzung beteiligten Rechtsträger ist, wenn sie binnen sechs Monaten nach dem Tag, an dem die Eintragung der Verschmelzung in das Register des Sitzes desjenigen Rechtsträgers, dessen Gläubiger sie sind, als bekannt gemacht gilt, ihren Anspruch nach Grund und Höhe schriftlich anmelden, Sicherheit zu leisten, soweit sie nicht Befriedigung verlangen können. Dieses Recht steht den Gläubigern jedoch nur zu, wenn sie glaubhaft machen, dass durch die Verschmelzung die Erfüllung ihrer Forderung gefährdet wird. Das Recht, Sicherheitsleistung zu verlangen, steht Gläubigern nicht zu, die im Falle der Insolvenz ein Recht auf vorzugsweise Befriedigung aus einer Deckungsmasse haben, die nach gesetzlicher Vorschrift zu ihrem Schutz errichtet und staatlich überwacht ist."
    },
    {
      "date": "2025-06-26",
      "id": "113472",
      "original_text": "Löschungsankündigung\nBerlin Amtsgericht Berlin (Charlottenburg) HRB 218601\nE1 Bau GmbH – Berlin",
      "type": "Löschungsankündigung",
      "state": "Berlin",
      "amtsgericht": "Amtsgericht Berlin (Charlottenburg)",
      "registernummer": "HRB 218601",
      "registerart": "HRB",
      "company_name": "E1 Bau GmbH",
      "company_seat": "Berlin",
      "details": "26.06.2025 (Bekanntmachungsdatum)\n\nBerlin Amtsgericht Berlin (Charlottenburg) HRB 218601\nLöschungsankündigung\n\nE1 Bau GmbH\nGesellschaft mit beschränkter Haftung\nBerlin\n\nBei der nachstehenden Gesellschaft wird das Amtslöschungsverfahren gemäß § 394 FamFG eingeleitet. Widerspruchsfrist 6 Wochen"
    },
    {
      "date": "2025-06-26",
      "id": "113473",
      "original_text": "Registerbekanntmachung nach dem Umwandlungsgesetz\nSachsen-Anhalt Amtsgericht Stendal HRB 5847\nBetreuungs- und Pflegedienstleistungs-Agentur (BPA) Kathrin Gerhardt GmbH – Naumburg",
      "type": "Registerbekanntmachung nach dem Umwandlungsgesetz",
      "state": "Sachsen-Anhalt",
      "amtsgericht": "Amtsgericht Stendal",
      "registernummer": "HRB 5847",
      "registerart": "HRB",
      "company_name": "Betreuungs- und Pflegedienstleistungs-Agentur (BPA) Kathrin Gerhardt GmbH",
      "company_seat": "Naumburg",
      "details": "26.06.2025 (Bekanntmachungsdatum)\n\nSachsen-Anhalt Amtsgericht Stendal HRB 5847\nRegisterbekanntmachung nach dem Umwandlungsgesetz 26.06.2025 (Eintragungsdatum)\n\nBetreuungs- und Pflegedienstleistungs-Agentur (BPA) Kathrin Gerhardt GmbH\nGesellschaft mit beschränkter Haftung\nNaumburg\n\nNicht eingetragen:\nDen Gläubigern der an der Verschmelzung beteiligten Rechtsträger ist, wenn sie binnen sechs Monaten nach dem Tag, an dem die Eintragung der Verschmelzung nach § 19 Abs. 3 UmwG als bekanntgemacht gilt, ihren Anspruch nach Grund und Höhe schriftlich anmelden, Sicherheit zu leisten, soweit sie nicht Befriedigung verlangen können. Dieses Recht steht ihnen jedoch nur zu, wenn sie glaubhaft machen, dass durch die Verschmelzung die Erfüllung ihrer Forderung gefährdet wird."
    },
    {
      "date": "2025-06-26",
      "id": "113474",
      "original_text": "Registerbekanntmachung nach dem Umwandlungsgesetz\nSachsen-Anhalt Amtsgericht Stendal HRB 23056\nBetreuungs-und Pflegedienst-Agentur MittelDeutschland UG (haftungsbeschränkt) – Naumburg (Saale)",
      "type": "Registerbekanntmachung nach dem Umwandlungsgesetz",
      "state": "Sachsen-Anhalt",
      "amtsgericht": "Amtsgericht Stendal",
      "registernummer": "HRB 23056",
      "registerart": "HRB",
      "company_name": "Betreuungs-und Pflegedienst-Agentur MittelDeutschland UG (haftungsbeschränkt)",
      "company_seat": "Naumburg (Saale)",
      "details": "26.06.2025 (Bekanntmachungsdatum)\n\nSachsen-Anhalt Amtsgericht Stendal HRB 23056\nRegisterbekanntmachung nach dem Umwandlungsgesetz 26.06.2025 (Eintragungsdatum)\n\nBetreuungs-und Pflegedienst-Agentur MittelDeutschland UG (haftungsbeschränkt)\nGesellschaft mit beschränkter Haftung\nNaumburg (Saale)\n\nNicht eingetragen:\nDen Gläubigern der an der Verschmelzung beteiligten Rechtsträger ist, wenn sie binnen sechs Monaten nach dem Tag, an dem die Eintragung der Verschmelzung nach § 19 Abs. 3 UmwG als bekanntgemacht gilt, ihren Anspruch nach Grund und Höhe schriftlich anmelden, Sicherheit zu leisten, soweit sie nicht Befriedigung verlangen können. Dieses Recht steht ihnen jedoch nur zu, wenn sie glaubhaft machen, dass durch die Verschmelzung die Erfüllung ihrer Forderung gefährdet wird."
    },
    {
      "date": "2025-06-26",
      "id": "113475",
      "original_text": "Registerbekanntmachung nach dem Umwandlungsgesetz\nHamburg Amtsgericht Hamburg HRB 107797\nGlobal Assekuranz Nord GmbH Versicherungsmakler – Hamburg",
      "type": "Registerbekanntmachung nach dem Umwandlungsgesetz",
      "state": "Hamburg",
      "amtsgericht": "Amtsgericht Hamburg",
      "registernummer": "HRB 107797",
      "registerart": "HRB",
      "company_name": "Global Assekuranz Nord GmbH Versicherungsmakler",
      "company_seat": "Hamburg",
      "details": "26.06.2025 (Bekanntmachungsdatum)\n\nHamburg Amtsgericht Hamburg HRB 107797\nRegisterbekanntmachung nach dem Umwandlungsgesetz 26.06.2025 (Eintragungsdatum)\n\nGlobal Assekuranz Nord GmbH Versicherungsmakler\nGesellschaft mit beschränkter Haftung\nHamburg\n\nAls nicht eingetragen wird bekannt gemacht:\nDen Gläubigern der an der Verschmelzung beteiligten Gesellschaften ist, wenn sie binnen sechs Monaten nach dem Tag, an dem die Eintragung der Verschmelzung in das Register des Sitzes desjenigen Rechtsträgers, dessen Gläubiger sie sind, nach § 19 Absatz 3 UmwG als bekannt gemacht gilt, ihren Anspruch nach Grund und Höhe schriftlich anmelden, Sicherheit zu leisten, soweit sie nicht Befriedigung verlangen können. Dieses Recht steht den Gläubigern jedoch nur zu, wenn sie glaubhaft machen, dass durch die Verschmelzung die Erfüllung ihrer Forderung gefährdet wird."
    },
    {
      "date": "2025-06-26",
      "id": "113476",
      "original_text": "Löschungsankündigung\nBerlin Amtsgericht Berlin (Charlottenburg) HRB 142703\nPinkcube GmbH – Berlin",
      "type": "Löschungsankündigung",
      "state": "Berlin",
      "amtsgericht": "Amtsgericht Berlin (Charlottenburg)",
      "registernummer": "HRB 142703",
      "registerart": "HRB",
      "company_name": "Pinkcube GmbH",
      "company_seat": "Berlin",
      "details": "26.06.2025 (Bekanntmachungsdatum)\n\nBerlin Amtsgericht Berlin (Charlottenburg) HRB 142703\nLöschungsankündigung\n\nPinkcube GmbH\nGesellschaft mit beschränkter Haftung\nBerlin\n\nBei der nachstehenden Gesellschaft wird das Amtslöschungsverfahren gemäß § 394 FamFG eingeleitet. Widerspruchsfrist 6 Wochen"
    },
    {
      "date": "2025-06-26",
      "id": "113477",
      "original_text": "Einreichung neuer Dokumente\nSachsen-Anhalt Amtsgericht Stendal HRB 214698\nDow Olefinverbund GmbH – Schkopau",
      "type": "Einreichung neuer Dokumente",
      "state": "Sachsen-Anhalt",
      "amtsgericht": "Amtsgericht Stendal",
      "registernummer": "HRB 214698",
      "registerart": "HRB",
      "company_name": "Dow Olefinverbund GmbH",
      "company_seat": "Schkopau",
      "details": "26.06.2025 (Bekanntmachungsdatum)\n\nSachsen-Anhalt Amtsgericht Stendal HRB 214698\nEinreichung neuer Dokumente 26.06.2025 (Eintragungsdatum)\n\nDow Olefinverbund GmbH\nGesellschaft mit beschränkter Haftung\nSchkopau\n\nEine Liste der Mitglieder des Aufsichtsrates wurde zum Handelsregister eingereicht."
    },
    {
      "date": "2025-06-26",
      "id": "113478",
      "original_text": "Registerbekanntmachung nach dem Umwandlungsgesetz\nHamburg Amtsgericht Hamburg HRB 107797\nGlobal Assekuranz Nord GmbH Versicherungsmakler – Hamburg",
      "type": "Registerbekanntmachung nach dem Umwandlungsgesetz",
      "state": "Hamburg",
      "amtsgericht": "Amtsgericht Hamburg",
      "registernummer": "HRB 107797",
      "registerart": "HRB",
      "company_name": "Global Assekuranz Nord GmbH Versicherungsmakler",
      "company_seat": "Hamburg",
      "details": "26.06.2025 (Bekanntmachungsdatum)\n\nHamburg Amtsgericht Hamburg HRB 107797\nRegisterbekanntmachung nach dem Umwandlungsgesetz 26.06.2025 (Eintragungsdatum)\n\nGlobal Assekuranz Nord GmbH Versicherungsmakler\nGesellschaft mit beschränkter Haftung\nHamburg\n\nAls nicht eingetragen wird bekannt gemacht:\nDen Gläubigern der an der Verschmelzung beteiligten Gesellschaften ist, wenn sie binnen sechs Monaten nach dem Tag, an dem die Eintragung der Verschmelzung in das Register des Sitzes desjenigen Rechtsträgers, dessen Gläubiger sie sind, nach § 19 Absatz 3 UmwG als bekannt gemacht gilt, ihren Anspruch nach Grund und Höhe schriftlich anmelden, Sicherheit zu leisten, soweit sie nicht Befriedigung verlangen können. Dieses Recht steht den Gläubigern jedoch nur zu, wenn sie glaubhaft machen, dass durch die Verschmelzung die Erfüllung ihrer Forderung gefährdet wird."
    },
    {
      "date": "2025-06-26",
      "id": "113479",
      "original_text": "Einreichung neuer Dokumente\nBaden-Württemberg Amtsgericht Ulm HRB 733552\nairtango AG – Crailsheim",
      "type": "Einreichung neuer Dokumente",
      "state": "Baden-Württemberg",
      "amtsgericht": "Amtsgericht Ulm",
      "registernummer": "HRB 733552",
      "registerart": "HRB",
      "company_name": "airtango AG",
      "company_seat": "Crailsheim",
      "details": "26.06.2025 (Bekanntmachungsdatum)\n\nBaden-Württemberg Amtsgericht Ulm HRB 733552\nEinreichung neuer Dokumente 26.06.2025 (Eintragungsdatum)\n\nairtango AG\nAktiengesellschaft\nCrailsheim\n\nDie Gesellschaft hat am 13.06.2025 die Liste über die Zusammensetzung des Aufsichtsrats zum Handelsregister eingereicht."
    },
    {
      "date": "2025-06-26",
      "id": "113480",
      "original_text": "Registerbekanntmachung nach dem Umwandlungsgesetz\nSchleswig-Holstein Amtsgericht Lübeck HRB 7331\nEDP European Dental Partners Holding GmbH – Lübeck",
      "type": "Registerbekanntmachung nach dem Umwandlungsgesetz",
      "state": "Schleswig-Holstein",
      "amtsgericht": "Amtsgericht Lübeck",
      "registernummer": "HRB 7331",
      "registerart": "HRB",
      "company_name": "EDP European Dental Partners Holding GmbH",
      "company_seat": "Lübeck",
      "details": "26.06.2025 (Bekanntmachungsdatum)\n\nSchleswig-Holstein Amtsgericht Lübeck HRB 7331\nRegisterbekanntmachung nach dem Umwandlungsgesetz 25.06.2025 (Eintragungsdatum)\n\nEDP European Dental Partners Holding GmbH\nGesellschaft mit beschränkter Haftung\nLübeck\n\nZu Eintragungsnummer 14 vom 25.06.2025 wird als nicht eingetragen veröffentlicht:\nAls nicht eingetragen wird veröffentlicht: Den Gläubigern der an der Verschmelzung beteiligten Rechtsträger ist, wenn sie binnen sechs Monaten nach dem Tag, an dem die Eintragung der Verschmelzung in das Register des Sitzes desjenigen Rechtsträgers, dessen Gläubiger sie sind, als bekannt gemacht gilt, ihren Anspruch nach Grund und Höhe schriftlich anmelden, Sicherheit zu leisten, soweit sie nicht Befriedigung verlangen können. Dieses Recht steht den Gläubigern jedoch nur zu, wenn sie glaubhaft machen, dass durch die Verschmelzung die Erfüllung ihrer Forderung gefährdet wird."
    },
    {
      "date": "2025-06-26",
      "id": "113481",
      "original_text": "Registerbekanntmachung nach dem Umwandlungsgesetz\nHamburg Amtsgericht Hamburg HRB 185300\nKIV Beteiligungs GmbH – Hamburg",
      "type": "Registerbekanntmachung nach dem Umwandlungsgesetz",
      "state": "Hamburg",
      "amtsgericht": "Amtsgericht Hamburg",
      "registernummer": "HRB 185300",
      "registerart": "HRB",
      "company_name": "KIV Beteiligungs GmbH",
      "company_seat": "Hamburg",
      "details": "26.06.2025 (Bekanntmachungsdatum)\n\nHamburg Amtsgericht Hamburg HRB 185300\nRegisterbekanntmachung nach dem Umwandlungsgesetz 26.06.2025 (Eintragungsdatum)\n\nKIV Beteiligungs GmbH\nGesellschaft mit beschränkter Haftung\nHamburg\n\nAls nicht eingetragen wird bekannt gemacht:\nDen Gläubigern der an der Verschmelzung beteiligten Gesellschaften ist, wenn sie binnen sechs Monaten nach dem Tag, an dem die Eintragung der Verschmelzung in das Register des Sitzes desjenigen Rechtsträgers, dessen Gläubiger sie sind, nach § 19 Absatz 3 UmwG als bekannt gemacht gilt, ihren Anspruch nach Grund und Höhe schriftlich anmelden, Sicherheit zu leisten, soweit sie nicht Befriedigung verlangen können. Dieses Recht steht den Gläubigern jedoch nur zu, wenn sie glaubhaft machen, dass durch die Verschmelzung die Erfüllung ihrer Forderung gefährdet wird."
    },
    {
      "date": "2025-06-26",
      "id": "113482",
      "original_text": "Sonstige Registerbekanntmachung\nHamburg Amtsgericht Hamburg HRB 185300\nKIV Beteiligungs GmbH – Hamburg",
      "type": "Sonstige Registerbekanntmachung",
      "state": "Hamburg",
      "amtsgericht": "Amtsgericht Hamburg",
      "registernummer": "HRB 185300",
      "registerart": "HRB",
      "company_name": "KIV Beteiligungs GmbH",
      "company_seat": "Hamburg",
      "details": "26.06.2025 (Bekanntmachungsdatum)\n\nHamburg Amtsgericht Hamburg HRB 185300\nSonstige Registerbekanntmachung 26.06.2025 (Eintragungsdatum)\n\nKIV Beteiligungs GmbH\nGesellschaft mit beschränkter Haftung\nHamburg\n\nAls nicht eingetragen wird bekannt gemacht:  Den Gläubigern der Gesellschaft, deren Forderungen begründet worden sind, bevor die Eintragung der Vertragsbeendigung in das Handelsregister nach § 10 HGB als bekannt gemacht gilt, ist vom anderen Vertragsteil Sicherheit zu leisten, wenn sie sich binnen 6 Monaten nach Bekanntmachung der Eintragung zu diesem Zweck bei ihm melden."
    },
    {
      "date": "2025-06-26",
      "id": "113483",
      "original_text": "Registerbekanntmachung nach dem Umwandlungsgesetz\nHamburg Amtsgericht Hamburg HRB 77864\nAlexander Falk Holding GmbH – Hamburg",
      "type": "Registerbekanntmachung nach dem Umwandlungsgesetz",
      "state": "Hamburg",
      "amtsgericht": "Amtsgericht Hamburg",
      "registernummer": "HRB 77864",
      "registerart": "HRB",
      "company_name": "Alexander Falk Holding GmbH",
      "company_seat": "Hamburg",
      "details": "26.06.2025 (Bekanntmachungsdatum)\n\nHamburg Amtsgericht Hamburg HRB 77864\nRegisterbekanntmachung nach dem Umwandlungsgesetz 26.06.2025 (Eintragungsdatum)\n\nAlexander Falk Holding GmbH\nGesellschaft mit beschränkter Haftung\nHamburg\n\nAls nicht eingetragen wird bekannt gemacht:\nDen Gläubigern der an der Verschmelzung beteiligten Gesellschaften ist, wenn sie binnen sechs Monaten nach dem Tag, an dem die Eintragung der Verschmelzung in das Register des Sitzes desjenigen Rechtsträgers, dessen Gläubiger sie sind, nach § 19 Absatz 3 UmwG als bekannt gemacht gilt, ihren Anspruch nach Grund und Höhe schriftlich anmelden, Sicherheit zu leisten, soweit sie nicht Befriedigung verlangen können. Dieses Recht steht den Gläubigern jedoch nur zu, wenn sie glaubhaft machen, dass durch die Verschmelzung die Erfüllung ihrer Forderung gefährdet wird."
    },
    {
      "date": "2025-06-26",
      "id": "113484",
      "original_text": "Registerbekanntmachung nach dem Umwandlungsgesetz\nBaden-Württemberg Amtsgericht Stuttgart HRB 22773\nIQUINOX AG – Stuttgart",
      "type": "Registerbekanntmachung nach dem Umwandlungsgesetz",
      "state": "Baden-Württemberg",
      "amtsgericht": "Amtsgericht Stuttgart",
      "registernummer": "HRB 22773",
      "registerart": "HRB",
      "company_name": "IQUINOX AG",
      "company_seat": "Stuttgart",
      "details": "26.06.2025 (Bekanntmachungsdatum)\n\nBaden-Württemberg Amtsgericht Stuttgart HRB 22773\nRegisterbekanntmachung nach dem Umwandlungsgesetz 26.06.2025 (Eintragungsdatum)\n\nIQUINOX AG\nAktiengesellschaft\nStuttgart\n\nDen Gläubigern des an dem Formwechsel beteiligten Rechtsträgers ist, wenn sie binnen sechs Monaten nach dem Tag, an dem die Eintragung des Formwechsels in das Register des Sitzes desjenigen Rechtsträgers, dessen Gläubiger sie sind, nach § 19 Abs. 3 UmwG als bekanntgemacht gilt, ihren Anspruch nach Grund und Höhe schriftlich anmelden, Sicherheit zu leisten, soweit sie nicht Befriedigung verlangen können. Dieses Recht steht den Gläubigern jedoch nur zu, wenn sie glaubhaft machen, dass durch den Formwechsel die Erfüllung ihrer Forderung gefährdet wird."
    },
    {
      "date": "2025-06-26",
      "id": "113485",
      "original_text": "Löschungsankündigung\nMecklenburg-Vorpommern Amtsgericht Rostock HRB 15172\nTerminus Bau-Projektmanagement GmbH – Rostock",
      "type": "Löschungsankündigung",
      "state": "Mecklenburg-Vorpommern",
      "amtsgericht": "Amtsgericht Rostock",
      "registernummer": "HRB 15172",
      "registerart": "HRB",
      "company_name": "Terminus Bau-Projektmanagement GmbH",
      "company_seat": "Rostock",
      "details": "26.06.2025 (Bekanntmachungsdatum)\n\nMecklenburg-Vorpommern Amtsgericht Rostock HRB 15172\nLöschungsankündigung\n\nTerminus Bau-Projektmanagement GmbH\nGesellschaft mit beschränkter Haftung\nRostock\n\nDas Registergericht beabsichtigt, die im Handelsregister eingetragene Gesellschaft von Amts wegen nach § 394 FamFG zu löschen. Die Frist zur Erhebung eines Widerspruchs gegen die beabsichtigte Löschung wird auf einen Monat festgesetzt."
    },
    {
      "date": "2025-06-26",
      "id": "113486",
      "original_text": "Registerbekanntmachung nach dem Umwandlungsgesetz\nBaden-Württemberg Amtsgericht Ulm HRB 750104\nMerz+Roth Immobilien GmbH – Hüttisheim",
      "type": "Registerbekanntmachung nach dem Umwandlungsgesetz",
      "state": "Baden-Württemberg",
      "amtsgericht": "Amtsgericht Ulm",
      "registernummer": "HRB 750104",
      "registerart": "HRB",
      "company_name": "Merz+Roth Immobilien GmbH",
      "company_seat": "Hüttisheim",
      "details": "26.06.2025 (Bekanntmachungsdatum)\n\nBaden-Württemberg Amtsgericht Ulm HRB 750104\nRegisterbekanntmachung nach dem Umwandlungsgesetz 26.06.2025 (Eintragungsdatum)\n\nMerz+Roth Immobilien GmbH\nGesellschaft mit beschränkter Haftung\nHüttisheim\n\nAls nicht eingetragen wird bekanntgemacht:\nDen Gläubigern der an der Abspaltung beteiligten Rechtsträger ist, wenn sie binnen sechs Monaten nach dem Tag, an dem die Eintragung der Abspaltung in das Register des Sitzes desjenigen Rechtsträgers, dessen Gläubiger sie sind, nach § 19 Abs. 3 UmwG als bekanntgemacht gilt, ihren Anspruch nach Grund und Höhe schriftlich anmelden, Sicherheit zu leisten, soweit sie nicht Befriedigung verlangen können. Dieses Recht steht den Gläubigern jedoch nur zu, wenn sie glaubhaft machen, dass durch die Abspaltung die Erfüllung ihrer Forderung gefährdet wird."
    },
    {
      "date": "2025-06-26",
      "id": "113487",
      "original_text": "Registerbekanntmachung nach dem Umwandlungsgesetz\nBaden-Württemberg Amtsgericht Stuttgart HRB 800436\nIQUINOX GmbH – Stuttgart",
      "type": "Registerbekanntmachung nach dem Umwandlungsgesetz",
      "state": "Baden-Württemberg",
      "amtsgericht": "Amtsgericht Stuttgart",
      "registernummer": "HRB 800436",
      "registerart": "HRB",
      "company_name": "IQUINOX GmbH",
      "company_seat": "Stuttgart",
      "details": "26.06.2025 (Bekanntmachungsdatum)\n\nBaden-Württemberg Amtsgericht Stuttgart HRB 800436\nRegisterbekanntmachung nach dem Umwandlungsgesetz 26.06.2025 (Eintragungsdatum)\n\nIQUINOX GmbH\nGesellschaft mit beschränkter Haftung\nStuttgart\n\nDen Gläubigern des an dem Formwechsel beteiligten Rechtsträgers ist, wenn sie binnen sechs Monaten nach dem Tag, an dem die Eintragung des Formwechsels in das Register des Sitzes desjenigen Rechtsträgers, dessen Gläubiger sie sind, nach § 19 Abs. 3 UmwG als bekanntgemacht gilt, ihren Anspruch nach Grund und Höhe schriftlich anmelden, Sicherheit zu leisten, soweit sie nicht Befriedigung verlangen können. Dieses Recht steht den Gläubigern jedoch nur zu, wenn sie glaubhaft machen, dass durch den Formwechsel die Erfüllung ihrer Forderung gefährdet wird."
    },
    {
      "date": "2025-06-26",
      "id": "113488",
      "original_text": "Sonstige Registerbekanntmachung\nMecklenburg-Vorpommern Amtsgericht Rostock HRB 74\nRostocker Straßenbahn AG – Rostock",
      "type": "Sonstige Registerbekanntmachung",
      "state": "Mecklenburg-Vorpommern",
      "amtsgericht": "Amtsgericht Rostock",
      "registernummer": "HRB 74",
      "registerart": "HRB",
      "company_name": "Rostocker Straßenbahn AG",
      "company_seat": "Rostock",
      "details": "26.06.2025 (Bekanntmachungsdatum)\n\nMecklenburg-Vorpommern Amtsgericht Rostock HRB 74\nSonstige Registerbekanntmachung\n\nRostocker Straßenbahn AG\nAktiengesellschaft\nRostock\n\nEine Liste der Mitglieder des Aufsichtsrats ist zum Handelsregister eingereicht worden."
    },
    {
      "date": "2025-06-26",
      "id": "113489",
      "original_text": "Löschungsankündigung\nSaarland Amtsgericht Saarbrücken HRB 18148\nTool-Service Geschäftsführungs-GmbH – Blieskastel",
      "type": "Löschungsankündigung",
      "state": "Saarland",
      "amtsgericht": "Amtsgericht Saarbrücken",
      "registernummer": "HRB 18148",
      "registerart": "HRB",
      "company_name": "Tool-Service Geschäftsführungs-GmbH",
      "company_seat": "Blieskastel",
      "details": "26.06.2025 (Bekanntmachungsdatum)\n\nSaarland Amtsgericht Saarbrücken HRB 18148\nLöschungsankündigung\n\nTool-Service Geschäftsführungs-GmbH\nGesellschaft mit beschränkter Haftung\nBlieskastel\n\nEs ist beabsichtigt, die Gesellschaft von Amts wegen gemäß § 394 FamFG wegen Vermögenslosigkeit zu löschen.\nGegen die Löschung von Amts wegen ist das Rechtsmittel des Widerspruchs statthaft. Der Widerspruch ist binnen einer Frist zwei Monaten beginnend mit dem Tag dieser Veröffentlichung durch Einreichen eines Widerspruchsschreibens -schriftlich oder zur Niederschrift der Geschäftsstelle beim Amtsgericht Saarbrücken, -zentrales Handelsregister-, Mainzerstr.178, 66121 Saarbrücken einzulegen.\nDer Widerspruch muss die Bezeichnung der angefochtenen Löschungsankündigung enthalten sowie die Erklärung, dass Widerspruch eingelegt wird. Er ist vom Widerspruchsführer oder seinem Bevollmächtigten zu unterzeichnen.\nDas Widerspruchsschreiben kann auch in der Form eines elektronischen Dokumentes eingereicht werden, das mit einer qualifizierten elektronischen Signatur nach dem Signaturgesetz versehen sein muss (§§ 14 Abs. 2 FamFG, 130a, 298 ZPO)."
    },
    {
      "date": "2025-06-26",
      "id": "113490",
      "original_text": "Registerbekanntmachung nach dem Umwandlungsgesetz\nBaden-Württemberg Amtsgericht Ulm HRB 720114\nMerz+Roth Türtechnik GmbH – Hüttisheim",
      "type": "Registerbekanntmachung nach dem Umwandlungsgesetz",
      "state": "Baden-Württemberg",
      "amtsgericht": "Amtsgericht Ulm",
      "registernummer": "HRB 720114",
      "registerart": "HRB",
      "company_name": "Merz+Roth Türtechnik GmbH",
      "company_seat": "Hüttisheim",
      "details": "26.06.2025 (Bekanntmachungsdatum)\n\nBaden-Württemberg Amtsgericht Ulm HRB 720114\nRegisterbekanntmachung nach dem Umwandlungsgesetz 26.06.2025 (Eintragungsdatum)\n\nMerz+Roth Türtechnik GmbH\nGesellschaft mit beschränkter Haftung\nHüttisheim\n\nAls nicht eingetragen wird bekanntgemacht:\nDen Gläubigern der an der Abspaltung beteiligten Rechtsträger ist, wenn sie binnen sechs Monaten nach dem Tag, an dem die Eintragung der Abspaltung in das Register des Sitzes desjenigen Rechtsträgers, dessen Gläubiger sie sind, nach § 19 Abs. 3 UmwG als bekanntgemacht gilt, ihren Anspruch nach Grund und Höhe schriftlich anmelden, Sicherheit zu leisten, soweit sie nicht Befriedigung verlangen können. Dieses Recht steht den Gläubigern jedoch nur zu, wenn sie glaubhaft machen, dass durch die Abspaltung die Erfüllung ihrer Forderung gefährdet wird."
    },
    {
      "date": "2025-06-26",
      "id": "113491",
      "original_text": "Registerbekanntmachung nach dem Umwandlungsgesetz\nSchleswig-Holstein Amtsgericht Kiel HRB 28267\nFachpraxis für Kleintiere an der Eider GmbH – Büdelsdorf",
      "type": "Registerbekanntmachung nach dem Umwandlungsgesetz",
      "state": "Schleswig-Holstein",
      "amtsgericht": "Amtsgericht Kiel",
      "registernummer": "HRB 28267",
      "registerart": "HRB",
      "company_name": "Fachpraxis für Kleintiere an der Eider GmbH",
      "company_seat": "Büdelsdorf",
      "details": "26.06.2025 (Bekanntmachungsdatum)\n\nSchleswig-Holstein Amtsgericht Kiel HRB 28267\nRegisterbekanntmachung nach dem Umwandlungsgesetz 25.06.2025 (Eintragungsdatum)\n\nFachpraxis für Kleintiere an der Eider GmbH\nGesellschaft mit beschränkter Haftung\nBüdelsdorf\n\nZu Eintragungsnummer 1 vom 25.06.2025 wird als nicht eingetragen veröffentlicht: Als nicht eingetragen wird veröffentlicht: Den Gläubigern ist, wenn sie binnen sechs Monaten nach dem Tag, an dem die Eintragung der Umwandlung bekannt gemacht worden ist, ihren Anspruch nach Grund und Höhe schriftlich anmelden, Sicherheit zu leisten, soweit sie nicht Befriedigung verlangen können. Dieses Recht steht den Gläubigern jedoch nur zu, wenn sie glaubhaft machen, dass durch die Umwandlung die Erfüllung ihrer Forderung gefährdet wird."
    },
    {
      "date": "2025-06-26",
      "id": "113492",
      "original_text": "Registerbekanntmachung nach dem Umwandlungsgesetz\nHamburg Amtsgericht Hamburg HRB 188964\nTechstarter GmbH – Hamburg",
      "type": "Registerbekanntmachung nach dem Umwandlungsgesetz",
      "state": "Hamburg",
      "amtsgericht": "Amtsgericht Hamburg",
      "registernummer": "HRB 188964",
      "registerart": "HRB",
      "company_name": "Techstarter GmbH",
      "company_seat": "Hamburg",
      "details": "26.06.2025 (Bekanntmachungsdatum)\n\nHamburg Amtsgericht Hamburg HRB 188964\nRegisterbekanntmachung nach dem Umwandlungsgesetz 26.06.2025 (Eintragungsdatum)\n\nTechstarter GmbH\nGesellschaft mit beschränkter Haftung\nHamburg\n\nAls nicht eingetragen wird bekannt gemacht:\nDen Gläubigern der an der Verschmelzung beteiligten Gesellschaften ist, wenn sie binnen sechs Monaten nach dem Tag, an dem die Eintragung der Verschmelzung in das Register des Sitzes desjenigen Rechtsträgers, dessen Gläubiger sie sind, nach § 19 Absatz 3 UmwG als bekannt gemacht gilt, ihren Anspruch nach Grund und Höhe schriftlich anmelden, Sicherheit zu leisten, soweit sie nicht Befriedigung verlangen können. Dieses Recht steht den Gläubigern jedoch nur zu, wenn sie glaubhaft machen, dass durch die Verschmelzung die Erfüllung ihrer Forderung gefährdet wird."
    },
    {
      "date": "2025-06-26",
      "id": "113493",
      "original_text": "Löschungsankündigung\nBerlin Amtsgericht Berlin (Charlottenburg) PR 1197\nvon Essen + Gödiker Partnerschaftsgesellschaft von Architekten und Ingenieuren mbB – Berlin",
      "type": "Löschungsankündigung",
      "state": "Berlin",
      "amtsgericht": "Amtsgericht Berlin (Charlottenburg)",
      "registernummer": "PR 1197",
      "registerart": "PR",
      "company_name": "von Essen + Gödiker Partnerschaftsgesellschaft von Architekten und Ingenieuren mbB",
      "company_seat": "Berlin",
      "details": "26.06.2025 (Bekanntmachungsdatum)\n\nBerlin Amtsgericht Berlin (Charlottenburg) PR 1197\nLöschungsankündigung\n\nvon Essen + Gödiker Partnerschaftsgesellschaft von Architekten und Ingenieuren mbB\nPartnerschaftsgesellschaft\nBerlin\n\nEs ist beabsichtigt, die Eintragung wegen Mangels einer wesentlichen Voraussetzung gemäß § 395 FamFG von Amts wegen zu löschen. Widerspruchsfrist 6 Wochen"
    },
    {
      "date": "2025-06-26",
      "id": "113494",
      "original_text": "Löschungsankündigung\nSchleswig-Holstein Amtsgericht Lübeck HRB 24532\nBayerische Energetische Sanierungsgesellschaft mbH – Lübeck",
      "type": "Löschungsankündigung",
      "state": "Schleswig-Holstein",
      "amtsgericht": "Amtsgericht Lübeck",
      "registernummer": "HRB 24532",
      "registerart": "HRB",
      "company_name": "Bayerische Energetische Sanierungsgesellschaft mbH",
      "company_seat": "Lübeck",
      "details": "26.06.2025 (Bekanntmachungsdatum)\n\nSchleswig-Holstein Amtsgericht Lübeck HRB 24532\nLöschungsankündigung\n\nBayerische Energetische Sanierungsgesellschaft mbH\nGesellschaft mit beschränkter Haftung\nLübeck\n\nEs ist die Löschung der nachstehenden Gesellschaft wegen Vermögenslosigkeit gemäß § 394 FamFG beabsichtigt."
    },
    {
      "date": "2025-06-26",
      "id": "113495",
      "original_text": "Löschungsankündigung\nThüringen Amtsgericht Jena HRB 305995\nmein-schulbuch.de GmbH – Ilmenau",
      "type": "Löschungsankündigung",
      "state": "Thüringen",
      "amtsgericht": "Amtsgericht Jena",
      "registernummer": "HRB 305995",
      "registerart": "HRB",
      "company_name": "mein-schulbuch.de GmbH",
      "company_seat": "Ilmenau",
      "details": "26.06.2025 (Bekanntmachungsdatum)\n\nThüringen Amtsgericht Jena HRB 305995\nLöschungsankündigung\n\nmein-schulbuch.de GmbH\nGesellschaft mit beschränkter Haftung\nIlmenau\n\nDas Registergericht beabsichtigt, die im Handelsregister eingetragene Gesellschaft wegen Vermögenslosigkeit nach § 394 FamFG von Amts wegen zu löschen. Die Frist zur Erhebung eines Widerspruchs gegen die beabsichtigte Löschung wird auf 6 Wochen festgesetzt."
    },
    {
      "date": "2025-06-26",
      "id": "113496",
      "original_text": "Löschungsankündigung\nThüringen Amtsgericht Jena HRB 109279\nÖko Lab-Gesellschaft für Ökologie und Umweltchemie mbH – Erfurt",
      "type": "Löschungsankündigung",
      "state": "Thüringen",
      "amtsgericht": "Amtsgericht Jena",
      "registernummer": "HRB 109279",
      "registerart": "HRB",
      "company_name": "Öko Lab-Gesellschaft für Ökologie und Umweltchemie mbH",
      "company_seat": "Erfurt",
      "details": "26.06.2025 (Bekanntmachungsdatum)\n\nThüringen Amtsgericht Jena HRB 109279\nLöschungsankündigung\n\nÖko Lab-Gesellschaft für Ökologie und Umweltchemie mbH\nGesellschaft mit beschränkter Haftung\nErfurt\n\nDas Registergericht beabsichtigt, die im Handelsregister eingetragene Gesellschaft wegen Vermögenslosigkeit nach § 394 FamFG von Amts wegen zu löschen. Die Frist zur Erhebung eines Widerspruchs gegen die beabsichtigte Löschung wird auf 6 Wochen festgesetzt."
    },
    {
      "date": "2025-06-26",
      "id": "113497",
      "original_text": "Registerbekanntmachung nach dem Umwandlungsgesetz\nSchleswig-Holstein Amtsgericht Lübeck HRB 8888\nPostNord Logistics GmbH – Lübeck",
      "type": "Registerbekanntmachung nach dem Umwandlungsgesetz",
      "state": "Schleswig-Holstein",
      "amtsgericht": "Amtsgericht Lübeck",
      "registernummer": "HRB 8888",
      "registerart": "HRB",
      "company_name": "PostNord Logistics GmbH",
      "company_seat": "Lübeck",
      "details": "26.06.2025 (Bekanntmachungsdatum)\n\nSchleswig-Holstein Amtsgericht Lübeck HRB 8888\nRegisterbekanntmachung nach dem Umwandlungsgesetz 26.06.2025 (Eintragungsdatum)\n\nPostNord Logistics GmbH\nGesellschaft mit beschränkter Haftung\nLübeck\n\nZu Eintragungsnummer 20 vom 26.06.2025 wird als nicht eingetragen veröffentlicht:  Den Gläubigern der an der Verschmelzung beteiligten Rechtsträger ist, wenn sie binnen sechs Monaten nach dem Tag, an dem die Eintragung der Verschmelzung in das Register des Sitzes desjenigen Rechtsträgers, dessen Gläubiger sie sind, als bekannt gemacht gilt, ihren Anspruch nach Grund und Höhe schriftlich anmelden, Sicherheit zu leisten, soweit sie nicht Befriedigung verlangen können. Dieses Recht steht den Gläubigern jedoch nur zu, wenn sie glaubhaft machen, dass durch die Verschmelzung die Erfüllung ihrer Forderung gefährdet wird."
    },
    {
      "date": "2025-06-26",
      "id": "113498",
      "original_text": "Registerbekanntmachung nach dem Umwandlungsgesetz\nSchleswig-Holstein Amtsgericht Kiel GsR 916\nFachpraxis für Kleintiere an der Eider B. Bruhn & Dr. K. Müller, eGbR – Büdelsdorf",
      "type": "Registerbekanntmachung nach dem Umwandlungsgesetz",
      "state": "Schleswig-Holstein",
      "amtsgericht": "Amtsgericht Kiel",
      "registernummer": "GsR 916",
      "registerart": "GsR",
      "company_name": "Fachpraxis für Kleintiere an der Eider B. Bruhn & Dr. K. Müller, eGbR",
      "company_seat": "Büdelsdorf",
      "details": "26.06.2025 (Bekanntmachungsdatum)\n\nSchleswig-Holstein Amtsgericht Kiel GsR 916\nRegisterbekanntmachung nach dem Umwandlungsgesetz 25.06.2025 (Eintragungsdatum)\n\nFachpraxis für Kleintiere an der Eider B. Bruhn & Dr. K. Müller, eGbR\nGesellschaft bürgerlichen Rechts\nBüdelsdorf\n\nZu Eintragungsnummer 2 vom 25.06.2025 wird als nicht eingetragen veröffentlicht: Den Gläubigern ist, wenn sie binnen sechs Monaten nach dem Tag, an dem die Eintragung der Umwandlung bekannt gemacht worden ist, ihren Anspruch nach Grund und Höhe schriftlich anmelden, Sicherheit zu leisten, soweit sie nicht Befriedigung verlangen können. Dieses Recht steht den Gläubigern jedoch nur zu, wenn sie glaubhaft machen, dass durch die Umwandlung die Erfüllung ihrer Forderung gefährdet wird."
    },
    {
      "date": "2025-06-26",
      "id": "113499",
      "original_text": "Sonstige Registerbekanntmachung\nHamburg Amtsgericht Hamburg HRB 118271\nTBWA \\ Hamburg GmbH – Hamburg",
      "type": "Sonstige Registerbekanntmachung",
      "state": "Hamburg",
      "amtsgericht": "Amtsgericht Hamburg",
      "registernummer": "HRB 118271",
      "registerart": "HRB",
      "company_name": "TBWA \\ Hamburg GmbH",
      "company_seat": "Hamburg",
      "details": "26.06.2025 (Bekanntmachungsdatum)\n\nHamburg Amtsgericht Hamburg HRB 118271\nSonstige Registerbekanntmachung 26.06.2025 (Eintragungsdatum)\n\nTBWA \\ Hamburg GmbH\nGesellschaft mit beschränkter Haftung\nHamburg\n\nAls nicht eingetragen wird bekannt gemacht:  Den Gläubigern der Gesellschaft, deren Forderungen begründet worden sind, bevor die Eintragung der Vertragsbeendigung in das Handelsregister nach § 10 HGB als bekannt gemacht gilt, ist vom anderen Vertragsteil Sicherheit zu leisten, wenn sie sich binnen 6 Monaten nach Bekanntmachung der Eintragung zu diesem Zweck bei ihm melden."
    },
    {
      "date": "2025-06-26",
      "id": "113500",
      "original_text": "Einreichung neuer Dokumente\nBerlin Amtsgericht Berlin (Charlottenburg) HRB 248174\nmomox Holding SE – Berlin",
      "type": "Einreichung neuer Dokumente",
      "state": "Berlin",
      "amtsgericht": "Amtsgericht Berlin (Charlottenburg)",
      "registernummer": "HRB 248174",
      "registerart": "HRB",
      "company_name": "momox Holding SE",
      "company_seat": "Berlin",
      "details": "26.06.2025 (Bekanntmachungsdatum)\n\nBerlin Amtsgericht Berlin (Charlottenburg) HRB 248174\nEinreichung neuer Dokumente\n\nmomox Holding SE\nEuropäische Aktiengesellschaft (SE)\nBerlin\n\nAls nicht eingetragen wird veröffentlicht: Es wurde eine neue Liste der Aufsichtsratsmitglieder eingereicht (§ 106 AktG)."
    },
    {
      "date": "2025-06-26",
      "id": "113501",
      "original_text": "Löschungsankündigung\nSchleswig-Holstein Amtsgericht Lübeck HRB 18817\nCloudservice onPremise GmbH – Ahrensburg",
      "type": "Löschungsankündigung",
      "state": "Schleswig-Holstein",
      "amtsgericht": "Amtsgericht Lübeck",
      "registernummer": "HRB 18817",
      "registerart": "HRB",
      "company_name": "Cloudservice onPremise GmbH",
      "company_seat": "Ahrensburg",
      "details": "26.06.2025 (Bekanntmachungsdatum)\n\nSchleswig-Holstein Amtsgericht Lübeck HRB 18817\nLöschungsankündigung\n\nCloudservice onPremise GmbH\nGesellschaft mit beschränkter Haftung\nAhrensburg\n\nEs ist die Löschung der nachstehenden Gesellschaft wegen Vermögenslosigkeit gemäß § 394 FamFG beabsichtigt."
    },
    {
      "date": "2025-06-26",
      "id": "113502",
      "original_text": "Löschungsankündigung\nBaden-Württemberg Amtsgericht Ulm HRB 744541\nSD Wohnbau UG (haftungsbeschränkt) – Lauchheim",
      "type": "Löschungsankündigung",
      "state": "Baden-Württemberg",
      "amtsgericht": "Amtsgericht Ulm",
      "registernummer": "HRB 744541",
      "registerart": "HRB",
      "company_name": "SD Wohnbau UG (haftungsbeschränkt)",
      "company_seat": "Lauchheim",
      "details": "26.06.2025 (Bekanntmachungsdatum)\n\nBaden-Württemberg Amtsgericht Ulm HRB 744541\nLöschungsankündigung 26.06.2025 (Eintragungsdatum)\n\nSD Wohnbau UG (haftungsbeschränkt)\nGesellschaft mit beschränkter Haftung\nLauchheim\n\nAls nicht eingetragen wird bekanntgemacht:\nDas Gericht beabsichtigt, die Gesellschaft wegen Vermögenslosigkeit im Handelsregister von Amts wegen nach § 394 FamFG zu löschen. Die Frist zur Geltendmachung eines Widerspruchs gegen die beabsichtigte Löschung ist auf  einen Monat ab Veröffentlichung bestimmt."
    },
    {
      "date": "2025-06-26",
      "id": "113503",
      "original_text": "Registerbekanntmachung nach dem Umwandlungsgesetz\nBerlin Amtsgericht Berlin (Charlottenburg) HRB 175330\nHeimatTBWA Berlin GmbH – Berlin",
      "type": "Registerbekanntmachung nach dem Umwandlungsgesetz",
      "state": "Berlin",
      "amtsgericht": "Amtsgericht Berlin (Charlottenburg)",
      "registernummer": "HRB 175330",
      "registerart": "HRB",
      "company_name": "HeimatTBWA Berlin GmbH",
      "company_seat": "Berlin",
      "details": "26.06.2025 (Bekanntmachungsdatum)\n\nBerlin Amtsgericht Berlin (Charlottenburg) HRB 175330\nRegisterbekanntmachung nach dem Umwandlungsgesetz 26.06.2025 (Eintragungsdatum)\n\nHeimatTBWA Berlin GmbH\nGesellschaft mit beschränkter Haftung\nBerlin\n\nZu Eintragungsnummer 18 vom 26.06.2025 wird als nicht eingetragen veröffentlicht: Den Gläubigern der an der Verschmelzung beteiligten Rechtsträger ist, wenn sie binnen sechs Monaten nach dem Tag, an dem die Eintragung der Verschmelzung in das Register des Sitzes desjenigen Rechtsträgers, dessen Gläubiger sie sind, als bekannt gemacht gilt, ihren Anspruch nach Grund und Höhe schriftlich anmelden, Sicherheit zu leisten, soweit sie nicht Befriedigung verlangen können. Dieses Recht steht den Gläubigern jedoch nur zu, wenn sie glaubhaft machen, dass durch die Verschmelzung die Erfüllung ihrer Forderung gefährdet wird. Das Recht, Sicherheitsleistung zu verlangen, steht Gläubigern nicht zu, die im Falle der Insolvenz ein Recht auf vorzugsweise Befriedigung aus einer Deckungsmasse haben, die nach gesetzlicher Vorschrift zu ihrem Schutz errichtet und staatlich überwacht ist."
    },
    {
      "date": "2025-06-26",
      "id": "113504",
      "original_text": "Löschungsankündigung\nBaden-Württemberg Amtsgericht Stuttgart HRB 773248\nNEXCOMM GmbH – Fellbach",
      "type": "Löschungsankündigung",
      "state": "Baden-Württemberg",
      "amtsgericht": "Amtsgericht Stuttgart",
      "registernummer": "HRB 773248",
      "registerart": "HRB",
      "company_name": "NEXCOMM GmbH",
      "company_seat": "Fellbach",
      "details": "26.06.2025 (Bekanntmachungsdatum)\n\nBaden-Württemberg Amtsgericht Stuttgart HRB 773248\nLöschungsankündigung\n\nNEXCOMM GmbH\nGesellschaft mit beschränkter Haftung\nFellbach\n\nAls nicht eingetragen wird bekanntgemacht:\nDas Gericht beabsichtigt, die Gesellschaft wegen Vermögenslosigkeit im Handelsregister von Amts wegen nach § 394 FamFG zu löschen. Die Frist zur Geltendmachung eines Widerspruchs gegen die beabsichtigte Löschung ist auf zwei Monate ab Veröffentlichung bestimmt."
    },
    {
      "date": "2025-06-26",
      "id": "113505",
      "original_text": "Registerbekanntmachung nach dem Umwandlungsgesetz\nBaden-Württemberg Amtsgericht Stuttgart HRB 25377\nDGM Kommunikation GmbH – Stuttgart",
      "type": "Registerbekanntmachung nach dem Umwandlungsgesetz",
      "state": "Baden-Württemberg",
      "amtsgericht": "Amtsgericht Stuttgart",
      "registernummer": "HRB 25377",
      "registerart": "HRB",
      "company_name": "DGM Kommunikation GmbH",
      "company_seat": "Stuttgart",
      "details": "26.06.2025 (Bekanntmachungsdatum)\n\nBaden-Württemberg Amtsgericht Stuttgart HRB 25377\nRegisterbekanntmachung nach dem Umwandlungsgesetz 26.06.2025 (Eintragungsdatum)\n\nDGM Kommunikation GmbH\nGesellschaft mit beschränkter Haftung\nStuttgart\n\nAls nicht eingetragen wird bekanntgemacht:\nDen Gläubigern der an der Verschmelzung beteiligten Rechtsträger ist, wenn sie binnen sechs Monaten nach dem Tag, an dem die Eintragung der Verschmelzung in das Register des Sitzes desjenigen Rechtsträgers, dessen Gläubiger sie sind, nach § 19 Abs. 3 UmwG als bekanntgemacht gilt, ihren Anspruch nach Grund und Höhe schriftlich anmelden, Sicherheit zu leisten, soweit sie nicht Befriedigung verlangen können. Dieses Recht steht den Gläubigern jedoch nur zu, wenn sie glaubhaft machen, dass durch die Verschmelzung die Erfüllung ihrer Forderung gefährdet wird."
    },
    {
      "date": "2025-06-26",
      "id": "113506",
      "original_text": "Einreichung neuer Dokumente\nBaden-Württemberg Amtsgericht Stuttgart HRB 263277\nSüddeutsche Krankenversicherung a.G. – Fellbach",
      "type": "Einreichung neuer Dokumente",
      "state": "Baden-Württemberg",
      "amtsgericht": "Amtsgericht Stuttgart",
      "registernummer": "HRB 263277",
      "registerart": "HRB",
      "company_name": "Süddeutsche Krankenversicherung a.G.",
      "company_seat": "Fellbach",
      "details": "26.06.2025 (Bekanntmachungsdatum)\n\nBaden-Württemberg Amtsgericht Stuttgart HRB 263277\nEinreichung neuer Dokumente\n\nSüddeutsche Krankenversicherung a.G.\nVersicherungsverein auf Gegenseitigkeit\nFellbach\n\nDie Gesellschaft hat am 24.06.2025 die Liste über die Zusammensetzung des Aufsichtsrats zum Handelsregister eingereicht."
    },
    {
      "date": "2025-06-26",
      "id": "113507",
      "original_text": "Löschungsankündigung\nBerlin Amtsgericht Berlin (Charlottenburg) HRB 226892\nSDJ Bau GmbH – Berlin",
      "type": "Löschungsankündigung",
      "state": "Berlin",
      "amtsgericht": "Amtsgericht Berlin (Charlottenburg)",
      "registernummer": "HRB 226892",
      "registerart": "HRB",
      "company_name": "SDJ Bau GmbH",
      "company_seat": "Berlin",
      "details": "26.06.2025 (Bekanntmachungsdatum)\n\nBerlin Amtsgericht Berlin (Charlottenburg) HRB 226892\nLöschungsankündigung\n\nSDJ Bau GmbH\nGesellschaft mit beschränkter Haftung\nBerlin\n\nBei der nachstehenden Gesellschaft wird das Amtslöschungsverfahren gemäß § 394 FamFG eingeleitet. Widerspruchsfrist 6 Wochen"
    },
    {
      "date": "2025-06-26",
      "id": "113508",
      "original_text": "Registerbekanntmachung nach dem Umwandlungsgesetz\nNordrhein-Westfalen Amtsgericht Coesfeld HRB 19737\nconHos GmbH – Coesfeld",
      "type": "Registerbekanntmachung nach dem Umwandlungsgesetz",
      "state": "Nordrhein-Westfalen",
      "amtsgericht": "Amtsgericht Coesfeld",
      "registernummer": "HRB 19737",
      "registerart": "HRB",
      "company_name": "conHos GmbH",
      "company_seat": "Coesfeld",
      "details": "26.06.2025 (Bekanntmachungsdatum)\n\nNordrhein-Westfalen Amtsgericht Coesfeld HRB 19737\nRegisterbekanntmachung nach dem Umwandlungsgesetz 26.06.2025 (Eintragungsdatum)\n\nconHos GmbH\nGesellschaft mit beschränkter Haftung\nCoesfeld\n\nDen Gläubigern der an der Verschmelzung beteiligten Rechtsträger ist, wenn sie binnen sechs Monaten nach dem Tag, an dem die Eintragung der Verschmelzung in das Register des Sitzes desjenigen Rechtsträgers, dessen Gläubiger sie sind, nach § 19 Absatz 3 UmwG als bekanntgemacht gilt, ihren Anspruch nach Grund und Höhe schriftlich anmelden, Sicherheit zu leisten, soweit sie nicht Befriedigung verlangen können. Dieses Recht steht den Gläubigern jedoch nur zu, wenn sie glaubhaft machen, dass durch die Verschmelzung die Erfüllung ihrer Forderung gefährdet wird."
    },
    {
      "date": "2025-06-26",
      "id": "113509",
      "original_text": "Sonstige Registerbekanntmachung\nBaden-Württemberg Amtsgericht Ulm HRB 725667\nCarl Zeiss SMT GmbH – Oberkochen",
      "type": "Sonstige Registerbekanntmachung",
      "state": "Baden-Württemberg",
      "amtsgericht": "Amtsgericht Ulm",
      "registernummer": "HRB 725667",
      "registerart": "HRB",
      "company_name": "Carl Zeiss SMT GmbH",
      "company_seat": "Oberkochen",
      "details": "26.06.2025 (Bekanntmachungsdatum)\n\nBaden-Württemberg Amtsgericht Ulm HRB 725667\nSonstige Registerbekanntmachung\n\nCarl Zeiss SMT GmbH\nGesellschaft mit beschränkter Haftung\nOberkochen\n\nDie Gesellschaft hat am 24.06.2025 die Liste über die Zusammensetzung des Aufsichtsrats zum Handelsregister eingereicht."
    },
    {
      "date": "2025-06-26",
      "id": "113510",
      "original_text": "Einreichung neuer Dokumente\nHamburg Amtsgericht Hamburg HRB 99204\nalstria office AG – Hamburg",
      "type": "Einreichung neuer Dokumente",
      "state": "Hamburg",
      "amtsgericht": "Amtsgericht Hamburg",
      "registernummer": "HRB 99204",
      "registerart": "HRB",
      "company_name": "alstria office AG",
      "company_seat": "Hamburg",
      "details": "26.06.2025 (Bekanntmachungsdatum)\n\nHamburg Amtsgericht Hamburg HRB 99204\nEinreichung neuer Dokumente\n\nalstria office AG\nAktiengesellschaft\nHamburg\n\nDie Gesellschaft hat gemäß §§ 62 Abs. 3 S. 2, 61 S. 2 UmwG den Verschmelzungsvertrag mit der alstria solutions GmbH (Amtsgericht Hamburg, HRB 111790 - übertragender Rechtsträger) zum Handelsregister eingereicht.\nAuf die bei Gericht eingereichten Unterlagen wird verwiesen."
    },
    {
      "date": "2025-06-26",
      "id": "113511",
      "original_text": "Registerbekanntmachung nach dem Umwandlungsgesetz\nBaden-Württemberg Amtsgericht Freiburg HRA 708478\nDettinger Immobilien GmbH & Co. KG – Freiburg im Breisgau",
      "type": "Registerbekanntmachung nach dem Umwandlungsgesetz",
      "state": "Baden-Württemberg",
      "amtsgericht": "Amtsgericht Freiburg",
      "registernummer": "HRA 708478",
      "registerart": "HRA",
      "company_name": "Dettinger Immobilien GmbH & Co. KG",
      "company_seat": "Freiburg im Breisgau",
      "details": "26.06.2025 (Bekanntmachungsdatum)\n\nBaden-Württemberg Amtsgericht Freiburg HRA 708478\nRegisterbekanntmachung nach dem Umwandlungsgesetz 26.06.2025 (Eintragungsdatum)\n\nDettinger Immobilien GmbH & Co. KG\nKommanditgesellschaft\nFreiburg im Breisgau\n\nDen Gläubigern des an dem Formwechsel beteiligten Rechtsträgers ist, wenn sie binnen sechs Monaten nach dem Tag, an dem die Eintragung des Formwechsels in das Register des Sitzes desjenigen Rechtsträgers, dessen Gläubiger sie sind, nach § 19 Abs. 3 UmwG als bekanntgemacht gilt, ihren Anspruch nach Grund und Höhe schriftlich anmelden, Sicherheit zu leisten, soweit sie nicht Befriedigung verlangen können. Dieses Recht steht den Gläubigern jedoch nur zu, wenn sie glaubhaft machen, dass durch den Formwechsel die Erfüllung ihrer Forderung gefährdet wird."
    },
    {
      "date": "2025-06-26",
      "id": "113512",
      "original_text": "Registerbekanntmachung nach dem Umwandlungsgesetz\nBaden-Württemberg Amtsgericht Freiburg HRB 733440\nDettinger Immobilien GmbH – Freiburg im Breisgau",
      "type": "Registerbekanntmachung nach dem Umwandlungsgesetz",
      "state": "Baden-Württemberg",
      "amtsgericht": "Amtsgericht Freiburg",
      "registernummer": "HRB 733440",
      "registerart": "HRB",
      "company_name": "Dettinger Immobilien GmbH",
      "company_seat": "Freiburg im Breisgau",
      "details": "26.06.2025 (Bekanntmachungsdatum)\n\nBaden-Württemberg Amtsgericht Freiburg HRB 733440\nRegisterbekanntmachung nach dem Umwandlungsgesetz 26.06.2025 (Eintragungsdatum)\n\nDettinger Immobilien GmbH\nGesellschaft mit beschränkter Haftung\nFreiburg im Breisgau\n\nDen Gläubigern des an dem Formwechsel beteiligten Rechtsträgers ist, wenn sie binnen sechs Monaten nach dem Tag, an dem die Eintragung des Formwechsels in das Register des Sitzes desjenigen Rechtsträgers, dessen Gläubiger sie sind, nach § 19 Abs. 3 UmwG als bekanntgemacht gilt, ihren Anspruch nach Grund und Höhe schriftlich anmelden, Sicherheit zu leisten, soweit sie nicht Befriedigung verlangen können. Dieses Recht steht den Gläubigern jedoch nur zu, wenn sie glaubhaft machen, dass durch den Formwechsel die Erfüllung ihrer Forderung gefährdet wird."
    },
    {
      "date": "2025-06-26",
      "id": "113513",
      "original_text": "Einreichung neuer Dokumente\nHamburg Amtsgericht Hamburg HRB 157670\nStena Glovis SE – Hamburg",
      "type": "Einreichung neuer Dokumente",
      "state": "Hamburg",
      "amtsgericht": "Amtsgericht Hamburg",
      "registernummer": "HRB 157670",
      "registerart": "HRB",
      "company_name": "Stena Glovis SE",
      "company_seat": "Hamburg",
      "details": "26.06.2025 (Bekanntmachungsdatum)\n\nHamburg Amtsgericht Hamburg HRB 157670\nEinreichung neuer Dokumente\n\nStena Glovis SE\nEuropäische Aktiengesellschaft (SE)\nHamburg\n\nAls nicht eingetragen wird bekannt gemacht: Liste des Verwaltungsrats wurde eingereicht."
    },
    {
      "date": "2025-06-26",
      "id": "113514",
      "original_text": "Registerbekanntmachung nach dem Umwandlungsgesetz\nSaarland Amtsgericht Saarbrücken HRB 111346\nFahrschule Truck´n Roll GmbH – Wadern",
      "type": "Registerbekanntmachung nach dem Umwandlungsgesetz",
      "state": "Saarland",
      "amtsgericht": "Amtsgericht Saarbrücken",
      "registernummer": "HRB 111346",
      "registerart": "HRB",
      "company_name": "Fahrschule Truck´n Roll GmbH",
      "company_seat": "Wadern",
      "details": "26.06.2025 (Bekanntmachungsdatum)\n\nSaarland Amtsgericht Saarbrücken HRB 111346\nRegisterbekanntmachung nach dem Umwandlungsgesetz 26.06.2025 (Eintragungsdatum)\n\nFahrschule Truck´n Roll GmbH\nGesellschaft mit beschränkter Haftung\nWadern\n\nAls nicht eingetragen wird bekannt gemacht: Den Gläubigern der an der Ausgliederung beteiligten Gesellschaften ist, wenn sie binnen sechs Monaten nach dem Tag, an dem die Eintragung der Ausgliederung in das Register des Sitzes desjenigen Rechtsträgers, dessen Gläubiger sie sind, nach § 19 Absatz 3 UmwG bekannt gemacht worden ist, ihren Anspruch nach Grund und Höhe schriftlich anmelden, Sicherheit zu leisten, soweit sie nicht Befriedigung verlangen können. Dieses Recht steht den Gläubigern jedoch nur zu, wenn sie glaubhaft machen, dass durch die Ausgliederung die Erfüllung ihrer Forderung gefährdet wird."
    },
    {
      "date": "2025-06-26",
      "id": "113515",
      "original_text": "Registerbekanntmachung nach dem Umwandlungsgesetz\nMecklenburg-Vorpommern Amtsgericht Stralsund HRB 22903\nMönchguter Zimmervermittlung GmbH – Baabe",
      "type": "Registerbekanntmachung nach dem Umwandlungsgesetz",
      "state": "Mecklenburg-Vorpommern",
      "amtsgericht": "Amtsgericht Stralsund",
      "registernummer": "HRB 22903",
      "registerart": "HRB",
      "company_name": "Mönchguter Zimmervermittlung GmbH",
      "company_seat": "Baabe",
      "details": "26.06.2025 (Bekanntmachungsdatum)\n\nMecklenburg-Vorpommern Amtsgericht Stralsund HRB 22903\nRegisterbekanntmachung nach dem Umwandlungsgesetz 26.06.2025 (Eintragungsdatum)\n\nMönchguter Zimmervermittlung GmbH\nGesellschaft mit beschränkter Haftung\nBaabe\n\nAls nicht eingetragen wird veröffentlicht: Den Gläubigern der an der Ausgliederung beteiligten Rechtsträger ist, wenn sie binnen sechs Monaten nach dem Tag, an dem die Eintragung der Ausgliederung in das Register des Sitzes desjenigen Rechtsträgers, dessen Gläubiger sie sind, nach § 19 Abs. 3 UmwG als bekannt gemacht gilt, ihren Anspruch nach Grund und Höhe in Textform anmelden,\nSicherheit zu leisten, soweit sie nicht Befriedigung verlangen können. Dieses Recht steht den Gläubigern jedoch nur zu, wenn sie glaubhaft machen, dass durch die Ausgliederung die Erfüllung der Forderung gefährdet wird."
    },
    {
      "date": "2025-06-26",
      "id": "113516",
      "original_text": "Registerbekanntmachung nach dem Umwandlungsgesetz\nSaarland Amtsgericht Saarbrücken HRA 13691\nFahrschule Truck´n Roll e.K. Inhaberin Elena Cushing – Wadern",
      "type": "Registerbekanntmachung nach dem Umwandlungsgesetz",
      "state": "Saarland",
      "amtsgericht": "Amtsgericht Saarbrücken",
      "registernummer": "HRA 13691",
      "registerart": "HRA",
      "company_name": "Fahrschule Truck´n Roll e.K. Inhaberin Elena Cushing",
      "company_seat": "Wadern",
      "details": "26.06.2025 (Bekanntmachungsdatum)\n\nSaarland Amtsgericht Saarbrücken HRA 13691\nRegisterbekanntmachung nach dem Umwandlungsgesetz 26.06.2025 (Eintragungsdatum)\n\nFahrschule Truck´n Roll e.K. Inhaberin Elena Cushing\nEinzelkaufmann / Einzelkauffrau\nWadern\n\nAls nicht eingetragen wird bekannt gemacht: Den Gläubigern der an der Ausgliederung beteiligten Gesellschaften ist, wenn sie binnen sechs Monaten nach dem Tag, an dem die Eintragung der Ausgliederung in das Register des Sitzes desjenigen Rechtsträgers, dessen Gläubiger sie sind, nach § 19 Absatz 3 UmwG bekannt gemacht worden ist, ihren Anspruch nach Grund und Höhe schriftlich anmelden, Sicherheit zu leisten, soweit sie nicht Befriedigung verlangen können. Dieses Recht steht den Gläubigern jedoch nur zu, wenn sie glaubhaft machen, dass durch die Ausgliederung die Erfüllung ihrer Forderung gefährdet wird."
    },
    {
      "date": "2025-06-26",
      "id": "113517",
      "original_text": "Registerbekanntmachung nach dem Umwandlungsgesetz\nMecklenburg-Vorpommern Amtsgericht Stralsund HRA 20933\nMönchguter Zimmervermittlung Andreas Wendt e.K. – Baabe",
      "type": "Registerbekanntmachung nach dem Umwandlungsgesetz",
      "state": "Mecklenburg-Vorpommern",
      "amtsgericht": "Amtsgericht Stralsund",
      "registernummer": "HRA 20933",
      "registerart": "HRA",
      "company_name": "Mönchguter Zimmervermittlung Andreas Wendt e.K.",
      "company_seat": "Baabe",
      "details": "26.06.2025 (Bekanntmachungsdatum)\n\nMecklenburg-Vorpommern Amtsgericht Stralsund HRA 20933\nRegisterbekanntmachung nach dem Umwandlungsgesetz 26.06.2025 (Eintragungsdatum)\n\nMönchguter Zimmervermittlung Andreas Wendt e.K.\nEinzelkaufmann / Einzelkauffrau\nBaabe\n\nAls nicht eingetragen wird veröffentlicht: Den Gläubigern der an der Ausgliederung beteiligten Rechtsträger ist, wenn sie binnen sechs Monaten nach dem Tag, an dem die Eintragung der Ausgliederung in das Register des Sitzes desjenigen Rechtsträgers, dessen Gläubiger sie sind, nach § 19 Abs. 3 UmwG als bekannt gemacht gilt, ihren Anspruch nach Grund und Höhe in Textform anmelden,\nSicherheit zu leisten, soweit sie nicht Befriedigung verlangen können. Dieses Recht steht den Gläubigern jedoch nur zu, wenn sie glaubhaft machen, dass durch die Ausgliederung die Erfüllung der Forderung gefährdet wird."
    },
    {
      "date": "2025-06-26",
      "id": "113518",
      "original_text": "Löschungsankündigung\nBrandenburg Amtsgericht Frankfurt/Oder HRB 14146\nAKM Althüttendorfer Kraft- und Maschinenfahrservice UG (haftungsbeschränkt) – Althüttendorf",
      "type": "Löschungsankündigung",
      "state": "Brandenburg",
      "amtsgericht": "Amtsgericht Frankfurt/Oder",
      "registernummer": "HRB 14146",
      "registerart": "HRB",
      "company_name": "AKM Althüttendorfer Kraft- und Maschinenfahrservice UG (haftungsbeschränkt)",
      "company_seat": "Althüttendorf",
      "details": "26.06.2025 (Bekanntmachungsdatum)\n\nBrandenburg Amtsgericht Frankfurt/Oder HRB 14146\nLöschungsankündigung\n\nAKM Althüttendorfer Kraft- und Maschinenfahrservice UG (haftungsbeschränkt)\nGesellschaft mit beschränkter Haftung\nAlthüttendorf\n\nBei der nachstehenden Gesellschaft wird das Amtslöschungsverfahren gemäß § 394 Abs. 1 FamFG eingeleitet."
    },
    {
      "date": "2025-06-26",
      "id": "113519",
      "original_text": "Löschungsankündigung\nBaden-Württemberg Amtsgericht Stuttgart HRB 747662\nE. G. Bau GmbH – Stuttgart",
      "type": "Löschungsankündigung",
      "state": "Baden-Württemberg",
      "amtsgericht": "Amtsgericht Stuttgart",
      "registernummer": "HRB 747662",
      "registerart": "HRB",
      "company_name": "E. G. Bau GmbH",
      "company_seat": "Stuttgart",
      "details": "26.06.2025 (Bekanntmachungsdatum)\n\nBaden-Württemberg Amtsgericht Stuttgart HRB 747662\nLöschungsankündigung\n\nE. G. Bau GmbH\nGesellschaft mit beschränkter Haftung\nStuttgart\n\nAls nicht eingetragen wird bekanntgemacht:\nDas Gericht beabsichtigt, die Gesellschaft wegen Vermögenslosigkeit im Handelsregister von Amts wegen nach § 394 FamFG zu löschen. Die Frist zur Geltendmachung eines Widerspruchs gegen die beabsichtigte Löschung ist auf zwei Monate ab Veröffentlichung bestimmt."
    },
    {
      "date": "2025-06-26",
      "id": "113520",
      "original_text": "Löschungsankündigung\nBaden-Württemberg Amtsgericht Stuttgart HRB 744861\nMode Fenster GmbH – Wendlingen am Neckar",
      "type": "Löschungsankündigung",
      "state": "Baden-Württemberg",
      "amtsgericht": "Amtsgericht Stuttgart",
      "registernummer": "HRB 744861",
      "registerart": "HRB",
      "company_name": "Mode Fenster GmbH",
      "company_seat": "Wendlingen am Neckar",
      "details": "26.06.2025 (Bekanntmachungsdatum)\n\nBaden-Württemberg Amtsgericht Stuttgart HRB 744861\nLöschungsankündigung\n\nMode Fenster GmbH\nGesellschaft mit beschränkter Haftung\nWendlingen am Neckar\n\nAls nicht eingetragen wird bekanntgemacht:\nDas Gericht beabsichtigt, die Gesellschaft wegen Vermögenslosigkeit im Handelsregister von Amts wegen nach § 394 FamFG zu löschen. Die Frist zur Geltendmachung eines Widerspruchs gegen die beabsichtigte Löschung ist auf zwei Monate ab Veröffentlichung bestimmt."
    },
    {
      "date": "2025-06-26",
      "id": "113521",
      "original_text": "Registerbekanntmachung nach dem Umwandlungsgesetz\nHamburg Amtsgericht Hamburg HRB 140714\nKingstar Live GmbH – Hamburg",
      "type": "Registerbekanntmachung nach dem Umwandlungsgesetz",
      "state": "Hamburg",
      "amtsgericht": "Amtsgericht Hamburg",
      "registernummer": "HRB 140714",
      "registerart": "HRB",
      "company_name": "Kingstar Live GmbH",
      "company_seat": "Hamburg",
      "details": "26.06.2025 (Bekanntmachungsdatum)\n\nHamburg Amtsgericht Hamburg HRB 140714\nRegisterbekanntmachung nach dem Umwandlungsgesetz 26.06.2025 (Eintragungsdatum)\n\nKingstar Live GmbH\nGesellschaft mit beschränkter Haftung\nHamburg\n\nAls nicht eingetragen wird bekannt gemacht:\nDen Gläubigern der an der Verschmelzung beteiligten Gesellschaften ist, wenn sie binnen sechs Monaten nach dem Tag, an dem die Eintragung der Verschmelzung in das Register des Sitzes desjenigen Rechtsträgers, dessen Gläubiger sie sind, nach § 19 Absatz 3 UmwG als bekannt gemacht gilt, ihren Anspruch nach Grund und Höhe schriftlich anmelden, Sicherheit zu leisten, soweit sie nicht Befriedigung verlangen können. Dieses Recht steht den Gläubigern jedoch nur zu, wenn sie glaubhaft machen, dass durch die Verschmelzung die Erfüllung ihrer Forderung gefährdet wird."
    },
    {
      "date": "2025-06-26",
      "id": "113522",
      "original_text": "Löschungsankündigung\nSachsen Amtsgericht Leipzig HRB 21582\nObst und Gemüse Torremocha GmbH – Leipzig",
      "type": "Löschungsankündigung",
      "state": "Sachsen",
      "amtsgericht": "Amtsgericht Leipzig",
      "registernummer": "HRB 21582",
      "registerart": "HRB",
      "company_name": "Obst und Gemüse Torremocha GmbH",
      "company_seat": "Leipzig",
      "details": "26.06.2025 (Bekanntmachungsdatum)\n\nSachsen Amtsgericht Leipzig HRB 21582\nLöschungsankündigung\n\nObst und Gemüse Torremocha GmbH\nGesellschaft mit beschränkter Haftung\nLeipzig\n\nDas Registergericht beabsichtigt, die im Handelsregister eingetragene Gesellschaft von Amts wegen nach § 394 FamFG zu löschen. Die Frist zu Erhebung eines Widerspruchs gegen die beabsichtigte Löschung wird auf einen Monat festgesetzt."
    },
    {
      "date": "2025-06-26",
      "id": "113523",
      "original_text": "Registerbekanntmachung nach dem Umwandlungsgesetz\nSachsen Amtsgericht Leipzig HRB 36767\nTwins GmbH – Leipzig",
      "type": "Registerbekanntmachung nach dem Umwandlungsgesetz",
      "state": "Sachsen",
      "amtsgericht": "Amtsgericht Leipzig",
      "registernummer": "HRB 36767",
      "registerart": "HRB",
      "company_name": "Twins GmbH",
      "company_seat": "Leipzig",
      "details": "26.06.2025 (Bekanntmachungsdatum)\n\nSachsen Amtsgericht Leipzig HRB 36767\nRegisterbekanntmachung nach dem Umwandlungsgesetz 26.06.2025 (Eintragungsdatum)\n\nTwins GmbH\nGesellschaft mit beschränkter Haftung\nLeipzig\n\nDen Gläubigern der an der Verschmelzung beteiligten Rechtsträger ist, wenn sie binnen sechs Monaten nach dem Tag, an dem die Eintragung der Verschmelzung in das Register des Sitzes desjenigen Rechtsträgers, dessen Gläubiger sie sind, nach § 19 Abs. 3 UmwG als bekannt gemacht gilt, ihren Anspruch nach Grund und Höhe in Textform anmelden, Sicherheit zu leisten, soweit sie nicht Befriedigung verlangen können. Dieses Recht steht den Gläubigern jedoch nur zu, wenn sie glaubhaft machen, dass durch die Verschmelzung die Erfüllung der Forderung gefährdet wird."
    },
    {
      "date": "2025-06-26",
      "id": "113524",
      "original_text": "Registerbekanntmachung nach dem Umwandlungsgesetz\nSachsen Amtsgericht Chemnitz HRB 37491\nWSVK Innovation GmbH – Oederan",
      "type": "Registerbekanntmachung nach dem Umwandlungsgesetz",
      "state": "Sachsen",
      "amtsgericht": "Amtsgericht Chemnitz",
      "registernummer": "HRB 37491",
      "registerart": "HRB",
      "company_name": "WSVK Innovation GmbH",
      "company_seat": "Oederan",
      "details": "26.06.2025 (Bekanntmachungsdatum)\n\nSachsen Amtsgericht Chemnitz HRB 37491\nRegisterbekanntmachung nach dem Umwandlungsgesetz 26.06.2025 (Eintragungsdatum)\n\nWSVK Innovation GmbH\nGesellschaft mit beschränkter Haftung\nOederan\n\nDen Gläubigern der an der Ausgliederung beteiligten Rechtsträger ist, wenn sie binnen sechs Monaten nach dem Tag, an dem die Eintragung der Ausgliederung in das Register des Sitzes desjenigen Rechtsträgers, dessen Gläubiger sie sind, nach § 19 Abs. 3 UmwG als bekannt gemacht gilt, ihren Anspruch nach Grund und Höhe in Textform anmelden, Sicherheit zu leisten, soweit sie nicht Befriedigung verlangen können. Dieses Recht steht den Gläubigern jedoch nur zu, wenn sie glaubhaft machen, dass durch die Ausgliederung die Erfüllung der Forderung gefährdet wird."
    },
    {
      "date": "2025-06-26",
      "id": "113525",
      "original_text": "Registerbekanntmachung nach dem Umwandlungsgesetz\nSachsen Amtsgericht Leipzig HRB 32681\nBE-terna Germany GmbH – Leipzig",
      "type": "Registerbekanntmachung nach dem Umwandlungsgesetz",
      "state": "Sachsen",
      "amtsgericht": "Amtsgericht Leipzig",
      "registernummer": "HRB 32681",
      "registerart": "HRB",
      "company_name": "BE-terna Germany GmbH",
      "company_seat": "Leipzig",
      "details": "26.06.2025 (Bekanntmachungsdatum)\n\nSachsen Amtsgericht Leipzig HRB 32681\nRegisterbekanntmachung nach dem Umwandlungsgesetz 26.06.2025 (Eintragungsdatum)\n\nBE-terna Germany GmbH\nGesellschaft mit beschränkter Haftung\nLeipzig\n\nDen Gläubigern der an der Verschmelzung beteiligten Rechtsträger ist, wenn sie binnen sechs Monaten nach dem Tag, an dem die Eintragung der Verschmelzung in das Register des Sitzes desjenigen Rechtsträgers, dessen Gläubiger sie sind, nach § 19 Abs. 3 UmwG als bekannt gemacht gilt, ihren Anspruch nach Grund und Höhe in Textform anmelden, Sicherheit zu leisten, soweit sie nicht Befriedigung verlangen können. Dieses Recht steht den Gläubigern jedoch nur zu, wenn sie glaubhaft machen, dass durch die Verschmelzung die Erfüllung der Forderung gefährdet wird."
    },
    {
      "date": "2025-06-26",
      "id": "113526",
      "original_text": "Registerbekanntmachung nach dem Umwandlungsgesetz\nSachsen Amtsgericht Leipzig HRB 15694\nBE-terna GmbH – Leipzig",
      "type": "Registerbekanntmachung nach dem Umwandlungsgesetz",
      "state": "Sachsen",
      "amtsgericht": "Amtsgericht Leipzig",
      "registernummer": "HRB 15694",
      "registerart": "HRB",
      "company_name": "BE-terna GmbH",
      "company_seat": "Leipzig",
      "details": "26.06.2025 (Bekanntmachungsdatum)\n\nSachsen Amtsgericht Leipzig HRB 15694\nRegisterbekanntmachung nach dem Umwandlungsgesetz 26.06.2025 (Eintragungsdatum)\n\nBE-terna GmbH\nGesellschaft mit beschränkter Haftung\nLeipzig\n\nDen Gläubigern der an der Verschmelzung beteiligten Rechtsträger ist, wenn sie binnen sechs Monaten nach dem Tag, an dem die Eintragung der Verschmelzung in das Register des Sitzes desjenigen Rechtsträgers, dessen Gläubiger sie sind, nach § 19 Abs. 3 UmwG als bekannt gemacht gilt, ihren Anspruch nach Grund und Höhe in Textform anmelden, Sicherheit zu leisten, soweit sie nicht Befriedigung verlangen können. Dieses Recht steht den Gläubigern jedoch nur zu, wenn sie glaubhaft machen, dass durch die Verschmelzung die Erfüllung der Forderung gefährdet wird."
    },
    {
      "date": "2025-06-26",
      "id": "113527",
      "original_text": "Registerbekanntmachung nach dem Umwandlungsgesetz\nSachsen Amtsgericht Leipzig HRB 32381\nPauly Hotelmanagement GmbH – Leipzig",
      "type": "Registerbekanntmachung nach dem Umwandlungsgesetz",
      "state": "Sachsen",
      "amtsgericht": "Amtsgericht Leipzig",
      "registernummer": "HRB 32381",
      "registerart": "HRB",
      "company_name": "Pauly Hotelmanagement GmbH",
      "company_seat": "Leipzig",
      "details": "26.06.2025 (Bekanntmachungsdatum)\n\nSachsen Amtsgericht Leipzig HRB 32381\nRegisterbekanntmachung nach dem Umwandlungsgesetz 26.06.2025 (Eintragungsdatum)\n\nPauly Hotelmanagement GmbH\nGesellschaft mit beschränkter Haftung\nLeipzig\n\nDen Gläubigern der an der Verschmelzung beteiligten Rechtsträger ist, wenn sie binnen sechs Monaten nach dem Tag, an dem die Eintragung der Verschmelzung in das Register des Sitzes desjenigen Rechtsträgers, dessen Gläubiger sie sind, nach § 19 Abs. 3 UmwG als bekannt gemacht gilt, ihren Anspruch nach Grund und Höhe in Textform anmelden, Sicherheit zu leisten, soweit sie nicht Befriedigung verlangen können. Dieses Recht steht den Gläubigern jedoch nur zu, wenn sie glaubhaft machen, dass durch die Verschmelzung die Erfüllung der Forderung gefährdet wird."
    },
    {
      "date": "2025-06-26",
      "id": "113528",
      "original_text": "Registerbekanntmachung nach dem Umwandlungsgesetz\nSachsen Amtsgericht Chemnitz HRB 27800\nWSVK Holding GmbH – Oederan",
      "type": "Registerbekanntmachung nach dem Umwandlungsgesetz",
      "state": "Sachsen",
      "amtsgericht": "Amtsgericht Chemnitz",
      "registernummer": "HRB 27800",
      "registerart": "HRB",
      "company_name": "WSVK Holding GmbH",
      "company_seat": "Oederan",
      "details": "26.06.2025 (Bekanntmachungsdatum)\n\nSachsen Amtsgericht Chemnitz HRB 27800\nRegisterbekanntmachung nach dem Umwandlungsgesetz 26.06.2025 (Eintragungsdatum)\n\nWSVK Holding GmbH\nGesellschaft mit beschränkter Haftung\nOederan\n\nDen Gläubigern der an der Spaltung beteiligten Rechtsträger ist, wenn sie binnen sechs Monaten nach dem Tag, an dem die Eintragung der Spaltung in das Register des Sitzes desjenigen Rechtsträgers, dessen Gläubiger sie sind, nach § 19 Abs. 3 UmwG als bekannt gemacht gilt, ihren Anspruch nach Grund und Höhe in Textform anmelden, Sicherheit zu leisten, soweit sie nicht Befriedigung verlangen können. Dieses Recht steht den Gläubigern jedoch nur zu, wenn sie glaubhaft machen, dass durch die Spaltung die Erfüllung der Forderung gefährdet wird."
    },
    {
      "date": "2025-06-26",
      "id": "113529",
      "original_text": "Registerbekanntmachung nach dem Umwandlungsgesetz\nNiedersachsen Amtsgericht Lüneburg HRB 212975\nSanitätshaus Maik Bauer GmbH – Uelzen",
      "type": "Registerbekanntmachung nach dem Umwandlungsgesetz",
      "state": "Niedersachsen",
      "amtsgericht": "Amtsgericht Lüneburg",
      "registernummer": "HRB 212975",
      "registerart": "HRB",
      "company_name": "Sanitätshaus Maik Bauer GmbH",
      "company_seat": "Uelzen",
      "details": "26.06.2025 (Bekanntmachungsdatum)\n\nNiedersachsen Amtsgericht Lüneburg HRB 212975\nRegisterbekanntmachung nach dem Umwandlungsgesetz 26.06.2025 (Eintragungsdatum)\n\nSanitätshaus Maik Bauer GmbH\nGesellschaft mit beschränkter Haftung\nUelzen\n\nDen Gläubigern der an der Ausgliederung beteiligten Rechtsträger ist, wenn sie binnen sechs Monaten nach dem Tag, an dem die Eintragung der Ausgliederung in das Register des Sitzes desjenigen Rechtsträgers, dessen Gläubiger sie sind, nach § 19 Abs. 3 UmwG als bekannt gemacht gilt, ihren Anspruch nach Grund und Höhe schriftlich anmelden, Sicherheit zu leisten, soweit sie nicht Befriedigung verlangen können. Dieses Recht steht den Gläubigern jedoch nur zu, wenn sie glaubhaft machen, dass durch die Ausgliederung die Erfüllung der Forderung gefährdet wird."
    },
    {
      "date": "2025-06-26",
      "id": "113530",
      "original_text": "Registerbekanntmachung nach dem Umwandlungsgesetz\nNiedersachsen Amtsgericht Lüneburg HRA 204401\nSanitätshaus Maik Bauer e.K. – Uelzen",
      "type": "Registerbekanntmachung nach dem Umwandlungsgesetz",
      "state": "Niedersachsen",
      "amtsgericht": "Amtsgericht Lüneburg",
      "registernummer": "HRA 204401",
      "registerart": "HRA",
      "company_name": "Sanitätshaus Maik Bauer e.K.",
      "company_seat": "Uelzen",
      "details": "26.06.2025 (Bekanntmachungsdatum)\n\nNiedersachsen Amtsgericht Lüneburg HRA 204401\nRegisterbekanntmachung nach dem Umwandlungsgesetz 26.06.2025 (Eintragungsdatum)\n\nSanitätshaus Maik Bauer e.K.\nEinzelkaufmann / Einzelkauffrau\nUelzen\n\nDen Gläubigern der an der Ausgliederung beteiligten Rechtsträger ist, wenn sie binnen sechs Monaten nach dem Tag, an dem die Eintragung der Ausgliederung in das Register des Sitzes desjenigen Rechtsträgers, dessen Gläubiger sie sind, nach § 19 Abs. 3 UmwG als bekannt gemacht gilt, ihren Anspruch nach Grund und Höhe schriftlich anmelden, Sicherheit zu leisten, soweit sie nicht Befriedigung verlangen können. Dieses Recht steht den Gläubigern jedoch nur zu, wenn sie glaubhaft machen, dass durch die Ausgliederung die Erfüllung der Forderung gefährdet wird."
    },
    {
      "date": "2025-06-26",
      "id": "113531",
      "original_text": "Registerbekanntmachung nach dem Umwandlungsgesetz\nNiedersachsen Amtsgericht Braunschweig HRB 815\nBlock am Ring Verwaltungs-Gesellschaft mit beschränkter Haftung – Braunschweig",
      "type": "Registerbekanntmachung nach dem Umwandlungsgesetz",
      "state": "Niedersachsen",
      "amtsgericht": "Amtsgericht Braunschweig",
      "registernummer": "HRB 815",
      "registerart": "HRB",
      "company_name": "Block am Ring Verwaltungs-Gesellschaft mit beschränkter Haftung",
      "company_seat": "Braunschweig",
      "details": "26.06.2025 (Bekanntmachungsdatum)\n\nNiedersachsen Amtsgericht Braunschweig HRB 815\nRegisterbekanntmachung nach dem Umwandlungsgesetz 26.06.2025 (Eintragungsdatum)\n\nBlock am Ring Verwaltungs-Gesellschaft mit beschränkter Haftung\nGesellschaft mit beschränkter Haftung\nBraunschweig\n\nDen Gläubigern der an der Verschmelzung beteiligten Rechtsträger ist, wenn sie binnen sechs Monaten nach dem Tag, an dem die Eintragung der Verschmelzung in das Register des Sitzes desjenigen Rechtsträgers, dessen Gläubiger sie sind, nach § 19  Abs.  3 UmwG als bekannt gemacht gilt, ihren Anspruch nach Grund und Höhe schriftlich anmelden, Sicherheit zu leisten, soweit sie nicht Befriedigung verlangen können. Dieses Recht steht den Gläubigern jedoch nur zu, wenn sie glaubhaft machen, dass durch die Verschmelzung die Erfüllung der Forderung gefährdet wird."
    },
    {
      "date": "2025-06-26",
      "id": "113532",
      "original_text": "Registerbekanntmachung nach dem Umwandlungsgesetz\nNiedersachsen Amtsgericht Osnabrück HRB 204996\nButke Holding Verwaltungs UG (haftungsbeschränkt) – Wallenhorst",
      "type": "Registerbekanntmachung nach dem Umwandlungsgesetz",
      "state": "Niedersachsen",
      "amtsgericht": "Amtsgericht Osnabrück",
      "registernummer": "HRB 204996",
      "registerart": "HRB",
      "company_name": "Butke Holding Verwaltungs UG (haftungsbeschränkt)",
      "company_seat": "Wallenhorst",
      "details": "26.06.2025 (Bekanntmachungsdatum)\n\nNiedersachsen Amtsgericht Osnabrück HRB 204996\nRegisterbekanntmachung nach dem Umwandlungsgesetz 26.06.2025 (Eintragungsdatum)\n\nButke Holding Verwaltungs UG (haftungsbeschränkt)\nGesellschaft mit beschränkter Haftung\nWallenhorst\n\nDen Gläubigern der an der Verschmelzung beteiligten Rechtsträger ist, wenn sie binnen sechs Monaten nach dem Tag, an dem die Eintragung der Verschmelzung in das Register des Sitzes desjenigen Rechtsträgers, dessen Gläubiger sie sind, nach § 19  Abs.  3 UmwG als bekannt gemacht gilt, ihren Anspruch nach Grund und Höhe schriftlich anmelden, Sicherheit zu leisten, soweit sie nicht Befriedigung verlangen können. Dieses Recht steht den Gläubigern jedoch nur zu, wenn sie glaubhaft machen, dass durch die Verschmelzung die Erfüllung der Forderung gefährdet wird."
    },
    {
      "date": "2025-06-26",
      "id": "113533",
      "original_text": "Registerbekanntmachung nach dem Umwandlungsgesetz\nNiedersachsen Amtsgericht Osnabrück HRB 211138\nBKE Immobilien Verwaltungs UG (haftungsbeschränkt) – Wallenhorst",
      "type": "Registerbekanntmachung nach dem Umwandlungsgesetz",
      "state": "Niedersachsen",
      "amtsgericht": "Amtsgericht Osnabrück",
      "registernummer": "HRB 211138",
      "registerart": "HRB",
      "company_name": "BKE Immobilien Verwaltungs UG (haftungsbeschränkt)",
      "company_seat": "Wallenhorst",
      "details": "26.06.2025 (Bekanntmachungsdatum)\n\nNiedersachsen Amtsgericht Osnabrück HRB 211138\nRegisterbekanntmachung nach dem Umwandlungsgesetz 26.06.2025 (Eintragungsdatum)\n\nBKE Immobilien Verwaltungs UG (haftungsbeschränkt)\nGesellschaft mit beschränkter Haftung\nWallenhorst\n\nDen Gläubigern der an der Verschmelzung beteiligten Rechtsträger ist, wenn sie binnen sechs Monaten nach dem Tag, an dem die Eintragung der Verschmelzung in das Register des Sitzes desjenigen Rechtsträgers, dessen Gläubiger sie sind, nach § 19  Abs.  3 UmwG als bekannt gemacht gilt, ihren Anspruch nach Grund und Höhe schriftlich anmelden, Sicherheit zu leisten, soweit sie nicht Befriedigung verlangen können. Dieses Recht steht den Gläubigern jedoch nur zu, wenn sie glaubhaft machen, dass durch die Verschmelzung die Erfüllung der Forderung gefährdet wird."
    },
    {
      "date": "2025-06-26",
      "id": "113534",
      "original_text": "Registerbekanntmachung nach dem Umwandlungsgesetz\nNiedersachsen Amtsgericht Osnabrück HRB 218851\nSprings UG (haftungsbeschränkt) – Osnabrück",
      "type": "Registerbekanntmachung nach dem Umwandlungsgesetz",
      "state": "Niedersachsen",
      "amtsgericht": "Amtsgericht Osnabrück",
      "registernummer": "HRB 218851",
      "registerart": "HRB",
      "company_name": "Springs UG (haftungsbeschränkt)",
      "company_seat": "Osnabrück",
      "details": "26.06.2025 (Bekanntmachungsdatum)\n\nNiedersachsen Amtsgericht Osnabrück HRB 218851\nRegisterbekanntmachung nach dem Umwandlungsgesetz 26.06.2025 (Eintragungsdatum)\n\nSprings UG (haftungsbeschränkt)\nGesellschaft mit beschränkter Haftung\nOsnabrück\n\nDen Gläubigern der an der Verschmelzung beteiligten Rechtsträger ist, wenn sie binnen sechs Monaten nach dem Tag, an dem die Eintragung der Verschmelzung in das Register des Sitzes desjenigen Rechtsträgers, dessen Gläubiger sie sind, nach § 19  Abs.  3 UmwG als bekannt gemacht gilt, ihren Anspruch nach Grund und Höhe schriftlich anmelden, Sicherheit zu leisten, soweit sie nicht Befriedigung verlangen können. Dieses Recht steht den Gläubigern jedoch nur zu, wenn sie glaubhaft machen, dass durch die Verschmelzung die Erfüllung der Forderung gefährdet wird."
    },
    {
      "date": "2025-06-26",
      "id": "113535",
      "original_text": "Einreichung neuer Dokumente\nBaden-Württemberg Amtsgericht Mannheim HRB 5582\nm:con - mannheim:congress GmbH – Mannheim",
      "type": "Einreichung neuer Dokumente",
      "state": "Baden-Württemberg",
      "amtsgericht": "Amtsgericht Mannheim",
      "registernummer": "HRB 5582",
      "registerart": "HRB",
      "company_name": "m:con - mannheim:congress GmbH",
      "company_seat": "Mannheim",
      "details": "26.06.2025 (Bekanntmachungsdatum)\n\nBaden-Württemberg Amtsgericht Mannheim HRB 5582\nEinreichung neuer Dokumente\n\nm:con - mannheim:congress GmbH\nGesellschaft mit beschränkter Haftung\nMannheim\n\nDie Gesellschaft hat am 26.06.2025 die Liste über die Zusammensetzung des Aufsichtsrats zum Handelsregister eingereicht."
    },
    {
      "date": "2025-06-26",
      "id": "113536",
      "original_text": "Löschungsankündigung\nSchleswig-Holstein Amtsgericht Flensburg HRB 6205\nBünsch GmbH – Morsum/Sylt",
      "type": "Löschungsankündigung",
      "state": "Schleswig-Holstein",
      "amtsgericht": "Amtsgericht Flensburg",
      "registernummer": "HRB 6205",
      "registerart": "HRB",
      "company_name": "Bünsch GmbH",
      "company_seat": "Morsum/Sylt",
      "details": "26.06.2025 (Bekanntmachungsdatum)\n\nSchleswig-Holstein Amtsgericht Flensburg HRB 6205\nLöschungsankündigung\n\nBünsch GmbH\nGesellschaft mit beschränkter Haftung\nMorsum/Sylt\n\nEs ist die Löschung der nachstehenden Gesellschaft wegen Vermögenslosigkeit gemäß § 394 FamFG beabsichtigt.\nWiderspruchsfrist: 2 Monate."
    },
    {
      "date": "2025-06-26",
      "id": "113537",
      "original_text": "Registerbekanntmachung nach dem Umwandlungsgesetz\nBremen Amtsgericht Bremen HRB 36070\nEKHB Steuerberatungsgesellschaft GmbH – Bremen",
      "type": "Registerbekanntmachung nach dem Umwandlungsgesetz",
      "state": "Bremen",
      "amtsgericht": "Amtsgericht Bremen",
      "registernummer": "HRB 36070",
      "registerart": "HRB",
      "company_name": "EKHB Steuerberatungsgesellschaft GmbH",
      "company_seat": "Bremen",
      "details": "26.06.2025 (Bekanntmachungsdatum)\n\nBremen Amtsgericht Bremen HRB 36070\nRegisterbekanntmachung nach dem Umwandlungsgesetz 20.06.2025 (Eintragungsdatum)\n\nEKHB Steuerberatungsgesellschaft GmbH\nGesellschaft mit beschränkter Haftung\nBremen\n\nZu Eintragungsnummer 3 vom 20.06.2025 wird als nicht eingetragen veröffentlicht: Den Gläubigern der an der Verschmelzung beteiligten Rechtsträger ist, wenn sie binnen sechs Monaten nach dem Tag, an dem die Eintragung der Verschmelzung in das Register des Sitzes desjenigen Rechtsträgers, dessen Gläubiger sie sind, als bekannt gemacht gilt, ihren Anspruch nach Grund und Höhe schriftlich anmelden, Sicherheit zu leisten, soweit sie nicht Befriedigung verlangen können. Dieses Recht steht den Gläubigern jedoch nur zu, wenn sie glaubhaft machen, dass durch die Verschmelzung die Erfüllung ihrer Forderung gefährdet wird. Das Recht, Sicherheitsleistung zu verlangen, steht Gläubigern nicht zu, die im Falle der Insolvenz ein Recht auf vorzugsweise Befriedigung aus einer Deckungsmasse haben, die nach gesetzlicher Vorschrift zu ihrem Schutz errichtet und staatlich überwacht ist."
    },
    {
      "date": "2025-06-26",
      "id": "113538",
      "original_text": "Registerbekanntmachung nach dem Umwandlungsgesetz\nBremen Amtsgericht Bremen HRB 36069\nEMANET Steuerberatungsgesellschaft GmbH – Bremen",
      "type": "Registerbekanntmachung nach dem Umwandlungsgesetz",
      "state": "Bremen",
      "amtsgericht": "Amtsgericht Bremen",
      "registernummer": "HRB 36069",
      "registerart": "HRB",
      "company_name": "EMANET Steuerberatungsgesellschaft GmbH",
      "company_seat": "Bremen",
      "details": "26.06.2025 (Bekanntmachungsdatum)\n\nBremen Amtsgericht Bremen HRB 36069\nRegisterbekanntmachung nach dem Umwandlungsgesetz 20.06.2025 (Eintragungsdatum)\n\nEMANET Steuerberatungsgesellschaft GmbH\nGesellschaft mit beschränkter Haftung\nBremen\n\nZu Eintragungsnummer 5 vom 20.06.2025 wird als nicht eingetragen veröffentlicht: Den Gläubigern der an der Verschmelzung beteiligten Rechtsträger ist, wenn sie binnen sechs Monaten nach dem Tag, an dem die Eintragung der Verschmelzung in das Register des Sitzes desjenigen Rechtsträgers, dessen Gläubiger sie sind, als bekannt gemacht gilt, ihren Anspruch nach Grund und Höhe schriftlich anmelden, Sicherheit zu leisten, soweit sie nicht Befriedigung verlangen können. Dieses Recht steht den Gläubigern jedoch nur zu, wenn sie glaubhaft machen, dass durch die Verschmelzung die Erfüllung ihrer Forderung gefährdet wird. Das Recht, Sicherheitsleistung zu verlangen, steht Gläubigern nicht zu, die im Falle der Insolvenz ein Recht auf vorzugsweise Befriedigung aus einer Deckungsmasse haben, die nach gesetzlicher Vorschrift zu ihrem Schutz errichtet und staatlich überwacht ist."
    },
    {
      "date": "2025-06-26",
      "id": "113539",
      "original_text": "Sonstige Registerbekanntmachung\nRheinland-Pfalz Amtsgericht Wittlich HRB 45760\nConen Produkte GmbH – Morbach",
      "type": "Sonstige Registerbekanntmachung",
      "state": "Rheinland-Pfalz",
      "amtsgericht": "Amtsgericht Wittlich",
      "registernummer": "HRB 45760",
      "registerart": "HRB",
      "company_name": "Conen Produkte GmbH",
      "company_seat": "Morbach",
      "details": "26.06.2025 (Bekanntmachungsdatum)\n\nRheinland-Pfalz Amtsgericht Wittlich HRB 45760\nSonstige Registerbekanntmachung 26.06.2025 (Eintragungsdatum)\n\nConen Produkte GmbH\nGesellschaft mit beschränkter Haftung\nMorbach\n\nAls nicht eingetragen wird veröffentlicht: Den Gläubigern der Gesellschaft, deren Forderungen begründet worden sind, bevor die Eintragung der Beendigung des Ergebnisabführungsvertrages in das Handelsregister nach § 10 des Handelsgesetzbuches als bekanntgemacht gilt, hat der andere Vertragsteil Sicherheit zu leisten, wenn sie sich binnen sechs Monaten nach der Bekanntmachung der Eintragung zu diesem Zweck bei ihm melden."
    },
    {
      "date": "2025-06-26",
      "id": "113540",
      "original_text": "Löschungsankündigung\nRheinland-Pfalz Amtsgericht Zweibrücken HRB 11525\nAbwicklungsgesellschaft GalaBau Niedermohr mbH – Niedermohr",
      "type": "Löschungsankündigung",
      "state": "Rheinland-Pfalz",
      "amtsgericht": "Amtsgericht Zweibrücken",
      "registernummer": "HRB 11525",
      "registerart": "HRB",
      "company_name": "Abwicklungsgesellschaft GalaBau Niedermohr mbH",
      "company_seat": "Niedermohr",
      "details": "26.06.2025 (Bekanntmachungsdatum)\n\nRheinland-Pfalz Amtsgericht Zweibrücken HRB 11525\nLöschungsankündigung\n\nAbwicklungsgesellschaft GalaBau Niedermohr mbH\nGesellschaft mit beschränkter Haftung\nNiedermohr\n\nDas Registergericht beabsichtigt die Gesellschaft von Amts wegen nach § 394 FamFG zu löschen. Die Frist zur Erhebung eines Widerspruchs ist auf einen Monat festgesetzt."
    },
    {
      "date": "2025-06-26",
      "id": "113541",
      "original_text": "Registerbekanntmachung nach dem Umwandlungsgesetz\nRheinland-Pfalz Amtsgericht Ludwigshafen a.Rhein (Ludwigshafen) HRA 62268\nBurgey GmbH & Co. KG – Maxdorf",
      "type": "Registerbekanntmachung nach dem Umwandlungsgesetz",
      "state": "Rheinland-Pfalz",
      "amtsgericht": "Amtsgericht Ludwigshafen a.Rhein (Ludwigshafen)",
      "registernummer": "HRA 62268",
      "registerart": "HRA",
      "company_name": "Burgey GmbH & Co. KG",
      "company_seat": "Maxdorf",
      "details": "26.06.2025 (Bekanntmachungsdatum)\n\nRheinland-Pfalz Amtsgericht Ludwigshafen a.Rhein (Ludwigshafen) HRA 62268\nRegisterbekanntmachung nach dem Umwandlungsgesetz 25.06.2025 (Eintragungsdatum)\n\nBurgey GmbH & Co. KG\nKommanditgesellschaft\nMaxdorf\n\nAls nicht eingetragen wird veröffentlicht: Den Gläubigern der an der Ausgliederung beteiligten Rechtsträger ist, wenn sie binnen sechs Monaten nac hdem Tag, an dem die Eintragung der Ausgliederung in das Register des Sitzes desjenigen Rechtsträgers,dessen Gläubiger sie sind, nach § 19 Abs. 3 UmwG als bekannt gemacht gilt, ihren Anspruch nach Grund und Höhe schriftlich anmelden, Sicherheit zu leisten, soweit sie nicht Befriedigung verlangen können. Dieses Recht steht den Gläubigern jedoch nur zu, wenn sie glaubhaft machen, dass durch die Ausgliederung die Erfüllung der Forderung gefährdet wird."
    },
    {
      "date": "2025-06-26",
      "id": "113542",
      "original_text": "Registerbekanntmachung nach dem Umwandlungsgesetz\nRheinland-Pfalz Amtsgericht Bad Kreuznach HRA 11675\nAutohaus Dieden GmbH & Co. KG – Idar-Oberstein",
      "type": "Registerbekanntmachung nach dem Umwandlungsgesetz",
      "state": "Rheinland-Pfalz",
      "amtsgericht": "Amtsgericht Bad Kreuznach",
      "registernummer": "HRA 11675",
      "registerart": "HRA",
      "company_name": "Autohaus Dieden GmbH & Co. KG",
      "company_seat": "Idar-Oberstein",
      "details": "26.06.2025 (Bekanntmachungsdatum)\n\nRheinland-Pfalz Amtsgericht Bad Kreuznach HRA 11675\nRegisterbekanntmachung nach dem Umwandlungsgesetz 26.06.2025 (Eintragungsdatum)\n\nAutohaus Dieden GmbH & Co. KG\nKommanditgesellschaft\nIdar-Oberstein\n\nAls nicht eingetragen wird veröffentlicht: Den Gläubigern der an der Ausgliederung beteiligten Rechtsträger ist, wenn sie binnen sechs Monaten nach dem Tag, an dem die Eintragung der Ausgliederung in das Register des Sitzes desjenigen Rechtsträgers,dessen Gläubiger sie sind, nach § 19 Abs. 3 UmwG als bekannt gemacht gilt, ihren Anspruch nach Grund und Höhe schriftlich anmelden, Sicherheit zu leisten, soweit sie nicht Befriedigung verlangen können. Dieses Recht steht den Gläubigern jedoch nur zu, wenn sie glaubhaft machen, dass durch die Ausgliederung die Erfüllung der Forderung gefährdet wird."
    },
    {
      "date": "2025-06-26",
      "id": "113543",
      "original_text": "Löschungsankündigung\nRheinland-Pfalz Amtsgericht Zweibrücken HRB 22681\nForestali GmbH – Münchweiler an der Rodalb",
      "type": "Löschungsankündigung",
      "state": "Rheinland-Pfalz",
      "amtsgericht": "Amtsgericht Zweibrücken",
      "registernummer": "HRB 22681",
      "registerart": "HRB",
      "company_name": "Forestali GmbH",
      "company_seat": "Münchweiler an der Rodalb",
      "details": "26.06.2025 (Bekanntmachungsdatum)\n\nRheinland-Pfalz Amtsgericht Zweibrücken HRB 22681\nLöschungsankündigung\n\nForestali GmbH\nGesellschaft mit beschränkter Haftung\nMünchweiler an der Rodalb\n\nDas Registergericht beabsichtigt die Gesellschaft von Amts wegen nach § 394 FamFG zu löschen. Die Frist zur Erhebung eines Widerspruchs ist auf einen Monat festgesetzt."
    },
    {
      "date": "2025-06-26",
      "id": "113544",
      "original_text": "Einreichung neuer Dokumente\nRheinland-Pfalz Amtsgericht Mainz HRB 7498\nDB Cargo Aktiengesellschaft – Mainz",
      "type": "Einreichung neuer Dokumente",
      "state": "Rheinland-Pfalz",
      "amtsgericht": "Amtsgericht Mainz",
      "registernummer": "HRB 7498",
      "registerart": "HRB",
      "company_name": "DB Cargo Aktiengesellschaft",
      "company_seat": "Mainz",
      "details": "26.06.2025 (Bekanntmachungsdatum)\n\nRheinland-Pfalz Amtsgericht Mainz HRB 7498\nEinreichung neuer Dokumente\n\nDB Cargo Aktiengesellschaft\nAktiengesellschaft\nMainz\n\nDem Registergericht ist eine neue Liste der Mitglieder des Aufsichtsrates eingereicht worden."
    },
    {
      "date": "2025-06-26",
      "id": "113545",
      "original_text": "Löschungsankündigung\nRheinland-Pfalz Amtsgericht Mainz HRB 49783\nEkin GmbH – Albig",
      "type": "Löschungsankündigung",
      "state": "Rheinland-Pfalz",
      "amtsgericht": "Amtsgericht Mainz",
      "registernummer": "HRB 49783",
      "registerart": "HRB",
      "company_name": "Ekin GmbH",
      "company_seat": "Albig",
      "details": "26.06.2025 (Bekanntmachungsdatum)\n\nRheinland-Pfalz Amtsgericht Mainz HRB 49783\nLöschungsankündigung\n\nEkin GmbH\nGesellschaft mit beschränkter Haftung\nAlbig\n\nDas Registergericht beabsichtigt die Gesellschaft von Amts wegen nach § 394 FamFG zu löschen. Die Frist zur Erhebung eines Widerspruchs ist auf einen Monat festgesetzt."
    },
    {
      "date": "2025-06-26",
      "id": "113546",
      "original_text": "Löschungsankündigung\nRheinland-Pfalz Amtsgericht Ludwigshafen a.Rhein (Ludwigshafen) HRB 11492\nATS Beteiligungsgesellschaft mbH – Bad Dürkheim",
      "type": "Löschungsankündigung",
      "state": "Rheinland-Pfalz",
      "amtsgericht": "Amtsgericht Ludwigshafen a.Rhein (Ludwigshafen)",
      "registernummer": "HRB 11492",
      "registerart": "HRB",
      "company_name": "ATS Beteiligungsgesellschaft mbH",
      "company_seat": "Bad Dürkheim",
      "details": "26.06.2025 (Bekanntmachungsdatum)\n\nRheinland-Pfalz Amtsgericht Ludwigshafen a.Rhein (Ludwigshafen) HRB 11492\nLöschungsankündigung\n\nATS Beteiligungsgesellschaft mbH\nGesellschaft mit beschränkter Haftung\nBad Dürkheim\n\nDas Registergericht beabsichtigt die Gesellschaft von Amts wegen nach § 394 FamFG zu löschen. Die Frist zur Erhebung eines Widerspruchs ist auf einen Monat festgesetzt."
    },
    {
      "date": "2025-06-26",
      "id": "113547",
      "original_text": "Registerbekanntmachung nach dem Umwandlungsgesetz\nRheinland-Pfalz Amtsgericht Bad Kreuznach HRA 21283\nDIEDEN KFZ e.K. – Idar-Oberstein",
      "type": "Registerbekanntmachung nach dem Umwandlungsgesetz",
      "state": "Rheinland-Pfalz",
      "amtsgericht": "Amtsgericht Bad Kreuznach",
      "registernummer": "HRA 21283",
      "registerart": "HRA",
      "company_name": "DIEDEN KFZ e.K.",
      "company_seat": "Idar-Oberstein",
      "details": "26.06.2025 (Bekanntmachungsdatum)\n\nRheinland-Pfalz Amtsgericht Bad Kreuznach HRA 21283\nRegisterbekanntmachung nach dem Umwandlungsgesetz 26.06.2025 (Eintragungsdatum)\n\nDIEDEN KFZ e.K.\nEinzelkaufmann / Einzelkauffrau\nIdar-Oberstein\n\nAls nicht eingetragen wird veröffentlicht: Den Gläubigern der an der Ausgliederung beteiligten Rechtsträger ist, wenn sie binnen sechs Monaten nach dem Tag, an dem die Eintragung der Ausgliederung in das Register des Sitzes desjenigen Rechtsträgers,dessen Gläubiger sie sind, nach § 19 Abs. 3 UmwG als bekannt gemacht gilt, ihren Anspruch nach Grund und Höhe schriftlich anmelden, Sicherheit zu leisten, soweit sie nicht Befriedigung verlangen können. Dieses Recht steht den Gläubigern jedoch nur zu, wenn sie glaubhaft machen, dass durch die Ausgliederung die Erfüllung der Forderung gefährdet wird."
    },
    {
      "date": "2025-06-26",
      "id": "113548",
      "original_text": "Löschungsankündigung\nRheinland-Pfalz Amtsgericht Mainz HRB 47188\nAuto Impex Andi GmbH – Nieder-Olm",
      "type": "Löschungsankündigung",
      "state": "Rheinland-Pfalz",
      "amtsgericht": "Amtsgericht Mainz",
      "registernummer": "HRB 47188",
      "registerart": "HRB",
      "company_name": "Auto Impex Andi GmbH",
      "company_seat": "Nieder-Olm",
      "details": "26.06.2025 (Bekanntmachungsdatum)\n\nRheinland-Pfalz Amtsgericht Mainz HRB 47188\nLöschungsankündigung\n\nAuto Impex Andi GmbH\nGesellschaft mit beschränkter Haftung\nNieder-Olm\n\nDas Registergericht beabsichtigt die Gesellschaft von Amts wegen nach § 394 FamFG zu löschen. Die Frist zur Erhebung eines Widerspruchs ist auf einen Monat festgesetzt."
    },
    {
      "date": "2025-06-26",
      "id": "113549",
      "original_text": "Registerbekanntmachung nach dem Umwandlungsgesetz\nRheinland-Pfalz Amtsgericht Kaiserslautern HRB 4104\nPfalz-Alarm GmbH – Kaiserslautern",
      "type": "Registerbekanntmachung nach dem Umwandlungsgesetz",
      "state": "Rheinland-Pfalz",
      "amtsgericht": "Amtsgericht Kaiserslautern",
      "registernummer": "HRB 4104",
      "registerart": "HRB",
      "company_name": "Pfalz-Alarm GmbH",
      "company_seat": "Kaiserslautern",
      "details": "26.06.2025 (Bekanntmachungsdatum)\n\nRheinland-Pfalz Amtsgericht Kaiserslautern HRB 4104\nRegisterbekanntmachung nach dem Umwandlungsgesetz 26.06.2025 (Eintragungsdatum)\n\nPfalz-Alarm GmbH\nGesellschaft mit beschränkter Haftung\nKaiserslautern\n\nAls nicht eingetragen wird veröffentlicht: Den Gläubigern der an der Verschmelzung beteiligten Rechtsträger ist, wenn sie binnen sechs Monaten nach dem Tag, an dem die Eintragung der Verschmelzung in das Register des Sitzes desjenigen Rechtsträgers, dessen Gläubiger sie sind, nach § 19 Abs. 3 UmwG als bekannt gemacht gilt, ihren Anspruch nach Grund und Höhe schriftlich anmelden, Sicherheit zu leisten, soweit sie nicht Befriedigung verlangen können. Dieses Recht steht den Gläubigern jedoch nur zu, wenn sie glaubhaft machen, dass durch die Verschmelzung die Erfüllung der Forderung gefährdet wird."
    },
    {
      "date": "2025-06-26",
      "id": "113550",
      "original_text": "Registerbekanntmachung nach dem Umwandlungsgesetz\nRheinland-Pfalz Amtsgericht Koblenz HRA 13194\nJürgen und Rita Wirths KG – St. Johann",
      "type": "Registerbekanntmachung nach dem Umwandlungsgesetz",
      "state": "Rheinland-Pfalz",
      "amtsgericht": "Amtsgericht Koblenz",
      "registernummer": "HRA 13194",
      "registerart": "HRA",
      "company_name": "Jürgen und Rita Wirths KG",
      "company_seat": "St. Johann",
      "details": "26.06.2025 (Bekanntmachungsdatum)\n\nRheinland-Pfalz Amtsgericht Koblenz HRA 13194\nRegisterbekanntmachung nach dem Umwandlungsgesetz 26.06.2025 (Eintragungsdatum)\n\nJürgen und Rita Wirths KG\nKommanditgesellschaft\nSt. Johann\n\nAls nicht eingetragen wird veröffentlicht: Den Gläubigern der an der Verschmelzung beteiligten Rechtsträger ist, wenn sie binnen sechs Monaten nach dem Tag, an dem die Eintragung der Verschmelzung in das Register des Sitzes desjenigen Rechtsträgers,dessen Gläubiger sie sind, nach § 19 Abs. 3 UmwG als bekannt gemacht gilt, ihren Anspruch nach Grund und Höhe schriftlich anmelden, Sicherheit zu leisten, soweit sie nicht Befriedigung verlangen können. Dieses Recht steht den Gläubigern jedoch nur zu, wenn sie glaubhaft machen, dass durch die Verschmelzung die Erfüllung der Forderung gefährdet wird."
    },
    {
      "date": "2025-06-26",
      "id": "113551",
      "original_text": "Registerbekanntmachung nach dem Umwandlungsgesetz\nRheinland-Pfalz Amtsgericht Ludwigshafen a.Rhein (Ludwigshafen) HRA 62410\nJoseph Burgey e.K. – Maxdorf",
      "type": "Registerbekanntmachung nach dem Umwandlungsgesetz",
      "state": "Rheinland-Pfalz",
      "amtsgericht": "Amtsgericht Ludwigshafen a.Rhein (Ludwigshafen)",
      "registernummer": "HRA 62410",
      "registerart": "HRA",
      "company_name": "Joseph Burgey e.K.",
      "company_seat": "Maxdorf",
      "details": "26.06.2025 (Bekanntmachungsdatum)\n\nRheinland-Pfalz Amtsgericht Ludwigshafen a.Rhein (Ludwigshafen) HRA 62410\nRegisterbekanntmachung nach dem Umwandlungsgesetz 25.06.2025 (Eintragungsdatum)\n\nJoseph Burgey e.K.\nEinzelkaufmann / Einzelkauffrau\nMaxdorf\n\nAls nicht eingetragen wird veröffentlicht: Den Gläubigern der an der Ausgliederung beteiligten Rechtsträger ist, wenn sie binnen sechs Monaten nac hdem Tag, an dem die Eintragung der Ausgliederung in das Register des Sitzes desjenigen Rechtsträgers,dessen Gläubiger sie sind, nach § 19 Abs. 3 UmwG als bekannt gemacht gilt, ihren Anspruch nach Grund und Höhe schriftlich anmelden, Sicherheit zu leisten, soweit sie nicht Befriedigung verlangen können. Dieses Recht steht den Gläubigern jedoch nur zu, wenn sie glaubhaft machen, dass durch die Ausgliederung die Erfüllung der Forderung gefährdet wird."
    },
    {
      "date": "2025-06-26",
      "id": "113552",
      "original_text": "Registerbekanntmachung nach dem Umwandlungsgesetz\nRheinland-Pfalz Amtsgericht Koblenz HRA 13158\nJ + R Wirths Logistik GmbH & Co. KG – St. Johann",
      "type": "Registerbekanntmachung nach dem Umwandlungsgesetz",
      "state": "Rheinland-Pfalz",
      "amtsgericht": "Amtsgericht Koblenz",
      "registernummer": "HRA 13158",
      "registerart": "HRA",
      "company_name": "J + R Wirths Logistik GmbH & Co. KG",
      "company_seat": "St. Johann",
      "details": "26.06.2025 (Bekanntmachungsdatum)\n\nRheinland-Pfalz Amtsgericht Koblenz HRA 13158\nRegisterbekanntmachung nach dem Umwandlungsgesetz 26.06.2025 (Eintragungsdatum)\n\nJ + R Wirths Logistik GmbH & Co. KG\nKommanditgesellschaft\nSt. Johann\n\nAls nicht eingetragen wird veröffentlicht: Den Gläubigern der an der Verschmelzung beteiligten Rechtsträger ist, wenn sie binnen sechs Monaten nach dem Tag, an dem die Eintragung der Verschmelzung in das Register des Sitzes desjenigen Rechtsträgers,dessen Gläubiger sie sind, nach § 19 Abs. 3 UmwG als bekannt gemacht gilt, ihren Anspruch nach Grund und Höhe schriftlich anmelden, Sicherheit zu leisten, soweit sie nicht Befriedigung verlangen können. Dieses Recht steht den Gläubigern jedoch nur zu, wenn sie glaubhaft machen, dass durch die Verschmelzung die Erfüllungd er Forderung gefährdet wird."
    },
    {
      "date": "2025-06-26",
      "id": "113553",
      "original_text": "Registerbekanntmachung nach dem Umwandlungsgesetz\nRheinland-Pfalz Amtsgericht Kaiserslautern HRB 1865\nSECO - Gesellschaft für Sicherheitsberatung m.b.H. – Rodenbach",
      "type": "Registerbekanntmachung nach dem Umwandlungsgesetz",
      "state": "Rheinland-Pfalz",
      "amtsgericht": "Amtsgericht Kaiserslautern",
      "registernummer": "HRB 1865",
      "registerart": "HRB",
      "company_name": "SECO - Gesellschaft für Sicherheitsberatung m.b.H.",
      "company_seat": "Rodenbach",
      "details": "26.06.2025 (Bekanntmachungsdatum)\n\nRheinland-Pfalz Amtsgericht Kaiserslautern HRB 1865\nRegisterbekanntmachung nach dem Umwandlungsgesetz 26.06.2025 (Eintragungsdatum)\n\nSECO - Gesellschaft für Sicherheitsberatung m.b.H.\nGesellschaft mit beschränkter Haftung\nRodenbach\n\nGläubigern der an der Verschmelzung beteiligten Rechtsträger ist unter den Voraussetzungen des § 22 UmwG Sicherheit zu leisten.Als nicht eingetragen wird veröffentlicht: Den Gläubigern der an der Verschmelzung beteiligten Rechtsträger ist, wenn sie binnen sechs Monaten nach dem Tag, an dem die Eintragung der Verschmelzung in das Register des Sitzes desjenigen Rechtsträgers,dessen Gläubiger sie sind, nach § 19 Abs. 3 UmwG als bekannt gemacht gilt, ihren Anspruch nach Grund und Höhe schriftlich anmelden, Sicherheit zu leisten, soweit sie nicht Befriedigung verlangen können. Dieses Recht steht den Gläubigern jedoch nur zu, wenn sie glaubhaft machen, dass durch die Verschmelzung die Erfüllung der Forderung gefährdet wird."
    },
    {
      "date": "2025-06-26",
      "id": "113554",
      "original_text": "Registerbekanntmachung nach dem Umwandlungsgesetz\nNordrhein-Westfalen Amtsgericht Gelsenkirchen VR 641\nEisenbahner -Turn- und Sportverein Gelsenkirchen - Bismarck 1931 e.V. – Gelsenkirchen",
      "type": "Registerbekanntmachung nach dem Umwandlungsgesetz",
      "state": "Nordrhein-Westfalen",
      "amtsgericht": "Amtsgericht Gelsenkirchen",
      "registernummer": "VR 641",
      "registerart": "VR",
      "company_name": "Eisenbahner -Turn- und Sportverein Gelsenkirchen - Bismarck 1931 e.V.",
      "company_seat": "Gelsenkirchen",
      "details": "26.06.2025 (Bekanntmachungsdatum)\n\nNordrhein-Westfalen Amtsgericht Gelsenkirchen VR 641\nRegisterbekanntmachung nach dem Umwandlungsgesetz 26.06.2025 (Eintragungsdatum)\n\nEisenbahner -Turn- und Sportverein Gelsenkirchen - Bismarck 1931 e.V.\neingetragener Verein\nGelsenkirchen\n\nDen Gläubigern der an der Verschmelzung beteiligten Rechtsträger ist, wenn sie binnen sechs Monaten nach dem Tag, an dem die Eintragung der Verschmelzung in das Register des Sitzes derjenigen Rechtsträger deren Gläubiger sie sind, nach § 19 Absatz 3 UmwG als bekanntgemacht gilt, ihren Anspruch nach Grund und Höhe schriftlich anmelden, Sicherheit zu leisten, soweit sie nicht Befriedigung verlangen können. Dieses Recht steht den Gläubigern jedoch nur zu, wenn sie glaubhaft machen, dass durch die Verschmelzung die Erfüllung ihrer Forderung gefährdet wird."
    },
    {
      "date": "2025-06-26",
      "id": "113555",
      "original_text": "Einreichung neuer Dokumente\nNordrhein-Westfalen Amtsgericht Köln HRB 3495\nAmpega Investment GmbH – Köln",
      "type": "Einreichung neuer Dokumente",
      "state": "Nordrhein-Westfalen",
      "amtsgericht": "Amtsgericht Köln",
      "registernummer": "HRB 3495",
      "registerart": "HRB",
      "company_name": "Ampega Investment GmbH",
      "company_seat": "Köln",
      "details": "26.06.2025 (Bekanntmachungsdatum)\n\nNordrhein-Westfalen Amtsgericht Köln HRB 3495\nEinreichung neuer Dokumente 26.06.2025 (Eintragungsdatum)\n\nAmpega Investment GmbH\nGesellschaft mit beschränkter Haftung\nKöln"
    },
    {
      "date": "2025-06-26",
      "id": "113556",
      "original_text": "Registerbekanntmachung nach dem Umwandlungsgesetz\nNordrhein-Westfalen Amtsgericht Aachen HRA 10275\nDentaltechnik Heiden e.K. – Roetgen",
      "type": "Registerbekanntmachung nach dem Umwandlungsgesetz",
      "state": "Nordrhein-Westfalen",
      "amtsgericht": "Amtsgericht Aachen",
      "registernummer": "HRA 10275",
      "registerart": "HRA",
      "company_name": "Dentaltechnik Heiden e.K.",
      "company_seat": "Roetgen",
      "details": "26.06.2025 (Bekanntmachungsdatum)\n\nNordrhein-Westfalen Amtsgericht Aachen HRA 10275\nRegisterbekanntmachung nach dem Umwandlungsgesetz 26.06.2025 (Eintragungsdatum)\n\nDentaltechnik Heiden e.K.\nEinzelkaufmann / Einzelkauffrau\nRoetgen\n\nDen Gläubigern der an der Ausgliederung beteiligten Rechtsträger ist, wenn sie binnen sechs Monaten nach dem Tag, an dem die Eintragung der Ausgliederung in das Register des Sitzes derjenigen Rechtsträger deren Gläubiger sie sind, nach § 19 Absatz 3 UmwG als bekanntgemacht gilt, ihren Anspruch nach Grund und Höhe schriftlich anmelden, Sicherheit zu leisten, soweit sie nicht Befriedigung verlangen können. Dieses Recht steht den Gläubigern jedoch nur zu, wenn sie glaubhaft machen, dass durch die Ausgliederung die Erfüllung ihrer Forderung gefährdet wird."
    },
    {
      "date": "2025-06-26",
      "id": "113557",
      "original_text": "Registerbekanntmachung nach dem Umwandlungsgesetz\nNordrhein-Westfalen Amtsgericht Köln HRA 25964\nPortfolio Kaiserslautern I GmbH & Co. KG – Köln",
      "type": "Registerbekanntmachung nach dem Umwandlungsgesetz",
      "state": "Nordrhein-Westfalen",
      "amtsgericht": "Amtsgericht Köln",
      "registernummer": "HRA 25964",
      "registerart": "HRA",
      "company_name": "Portfolio Kaiserslautern I GmbH & Co. KG",
      "company_seat": "Köln",
      "details": "26.06.2025 (Bekanntmachungsdatum)\n\nNordrhein-Westfalen Amtsgericht Köln HRA 25964\nRegisterbekanntmachung nach dem Umwandlungsgesetz 26.06.2025 (Eintragungsdatum)\n\nPortfolio Kaiserslautern I GmbH & Co. KG\nKommanditgesellschaft\nKöln\n\nDen Gläubigern der an der formwechselnden Umwandlung beteiligten Rechtsträger ist, wenn sie binnen sechs Monaten nach dem Tag, an dem die Eintragung der formwechselnden Umwandlung in das Register des Sitzes desjenigen Rechtsträgers, dessen Gläubiger sie sind, nach § 19 Absatz 3 UmwG als bekanntgemacht gilt, ihren Anspruch nach Grund und Höhe schriftlich anmelden, Sicherheit zu leisten, soweit sie nicht Befriedigung verlangen können. Dieses Recht steht den Gläubigern jedoch nur zu, wenn sie glaubhaft machen, dass durch die formwechselnden Umwandlung die Erfüllung ihrer Forderung gefährdet wird."
    },
    {
      "date": "2025-06-26",
      "id": "113558",
      "original_text": "Registerbekanntmachung nach dem Umwandlungsgesetz\nNordrhein-Westfalen Amtsgericht Köln HRB 27154\n\"der Achim\" Bilddesign GmbH – Köln",
      "type": "Registerbekanntmachung nach dem Umwandlungsgesetz",
      "state": "Nordrhein-Westfalen",
      "amtsgericht": "Amtsgericht Köln",
      "registernummer": "HRB 27154",
      "registerart": "HRB",
      "company_name": "\"der Achim\" Bilddesign GmbH",
      "company_seat": "Köln",
      "details": "26.06.2025 (Bekanntmachungsdatum)\n\nNordrhein-Westfalen Amtsgericht Köln HRB 27154\nRegisterbekanntmachung nach dem Umwandlungsgesetz 26.06.2025 (Eintragungsdatum)\n\n\"der Achim\" Bilddesign GmbH\nGesellschaft mit beschränkter Haftung\nKöln\n\nDen Gläubigern der an der Verschmelzung beteiligten Rechtsträger ist, wenn sie binnen sechs Monaten nach dem Tag, an dem die Eintragung der Verschmelzung in das Register des Sitzes desjenigen Rechtsträgers, dessen Gläubiger sie sind, nach § 19 Absatz 3 UmwG als bekanntgemacht gilt, ihren Anspruch nach Grund und Höhe schriftlich anmelden, Sicherheit zu leisten, soweit sie nicht Befriedigung verlangen können. Dieses Recht steht den Gläubigern jedoch nur zu, wenn sie glaubhaft machen, dass durch die Verschmelzung die Erfüllung ihrer Forderung gefährdet wird."
    },
    {
      "date": "2025-06-26",
      "id": "113559",
      "original_text": "Registerbekanntmachung nach dem Umwandlungsgesetz\nNordrhein-Westfalen Amtsgericht Düsseldorf HRB 102180\nScannell Deutschland No. 015 GmbH – Düsseldorf",
      "type": "Registerbekanntmachung nach dem Umwandlungsgesetz",
      "state": "Nordrhein-Westfalen",
      "amtsgericht": "Amtsgericht Düsseldorf",
      "registernummer": "HRB 102180",
      "registerart": "HRB",
      "company_name": "Scannell Deutschland No. 015 GmbH",
      "company_seat": "Düsseldorf",
      "details": "26.06.2025 (Bekanntmachungsdatum)\n\nNordrhein-Westfalen Amtsgericht Düsseldorf HRB 102180\nRegisterbekanntmachung nach dem Umwandlungsgesetz\n\nScannell Deutschland No. 015 GmbH\nGesellschaft mit beschränkter Haftung\nDüsseldorf\n\n1.\nDer Entwurf eines Verschmelzungsplanes ist beim Handelsregister eingereicht worden.\n2.\nAn der grenzüberschreitenden Verschmelzung sind die folgenden Gesellschaften beteiligt (Rechtsform, Firma und Sitz):\na) Scannell Properties Germany 5 S.à r.l. eine Gesellschaft mit beschränkter Haftung (société à responsabilité limitée) nach dem Recht des Staates Luxemburg mit Sitz und Geschäftsanschrift 8, Rue Dicks, L-1417 Herzogtum Luxembourg, Luxemburg („Übernehmende Gesellschaft“)\nb) Scannell Deutschland No. 015 GmbH mit Sitz in Düsseldorf und Geschäftsanschrift Benrather Straße 12, 40213 Düsseldorf („Übertragende Gesellschaft“)\n3.\nDie an der grenzüberschreitenden Verschmelzung beteiligten Gesellschaften sind in folgenden Registern eingetragen (nebst jeweiliger Registernummer):\na) Scannell Properties Germany 5 S.à r.l.\neingetragen im Handelsregister von Luxemburg (Registre de Commerce et des Sociétés, Luxembourg) unter der Registernummer B253883\nb) Scannell Deutschland No. 015 GmbH\neingetragen im Handelsregister des Amtsgerichts Düsseldorf unter HRB 102180\n4.\nDie Anteilsinhaber und Gläubiger der an der grenzüberschreitenden Verschmelzung beteiligten Gesellschaften sind:\na) Scannell Properties Europe S.à r.l., eine Gesellschaft mit beschränkter Haftung (société à responsabilité limitée) nach dem Recht des Staates Luxemburg mit Sitz und Geschäftsanschrift 8, Rue Dicks, L-1417 Luxembourg, Luxemburg, eingetragen im Handelsregister von Luxemburg (Registre de Commerce et des Sociétés, Luxembourg) unter der Registernummer B245273 ist der Gesellschafter der übernehmenden Gesellschaft\nb) Scannell Properties Germany 5 S.à r.l., eingetragen im Handelsregister von Luxemburg (Registre de Commerce et des Sociétés, Luxembourg) unter der Registernummer B253883, ist der Gesellschafter der übertragenden Gesellschaft.\n5.\nEs erfolgt ein Hinweis an folgende Personen, dass sie der jeweiligen Gesellschaft spätestens bis zum 24. Juli 2025 Bemerkungen zum Verschmelzungsplan übermitteln können:\nAn die Anteilsinhaber und Gläubiger der an der grenzüberschreitenden Verschmelzung beteiligten Gesellschaften.\nDa es weder einen Betriebsrat bei den beteiligten Gesellschaften gibt, noch Arbeitnehmer, ist ein Hinweis an diese nicht erforderlich."
    },
    {
      "date": "2025-06-26",
      "id": "113560",
      "original_text": "Einreichung neuer Dokumente\nNordrhein-Westfalen Amtsgericht Arnsberg HRB 10419\nTRILUX Licht GmbH – Arnsberg",
      "type": "Einreichung neuer Dokumente",
      "state": "Nordrhein-Westfalen",
      "amtsgericht": "Amtsgericht Arnsberg",
      "registernummer": "HRB 10419",
      "registerart": "HRB",
      "company_name": "TRILUX Licht GmbH",
      "company_seat": "Arnsberg",
      "details": "26.06.2025 (Bekanntmachungsdatum)\n\nNordrhein-Westfalen Amtsgericht Arnsberg HRB 10419\nEinreichung neuer Dokumente 26.06.2025 (Eintragungsdatum)\n\nTRILUX Licht GmbH\nGesellschaft mit beschränkter Haftung\nArnsberg\n\nDem Registergericht ist eine neue Liste der Mitglieder des Aufsichtsrates eingereicht worden."
    },
    {
      "date": "2025-06-26",
      "id": "113561",
      "original_text": "Einreichung neuer Dokumente\nNordrhein-Westfalen Amtsgericht Steinfurt HRB 8420\nKümpers GmbH – Rheine",
      "type": "Einreichung neuer Dokumente",
      "state": "Nordrhein-Westfalen",
      "amtsgericht": "Amtsgericht Steinfurt",
      "registernummer": "HRB 8420",
      "registerart": "HRB",
      "company_name": "Kümpers GmbH",
      "company_seat": "Rheine",
      "details": "26.06.2025 (Bekanntmachungsdatum)\n\nNordrhein-Westfalen Amtsgericht Steinfurt HRB 8420\nEinreichung neuer Dokumente 26.06.2025 (Eintragungsdatum)\n\nKümpers GmbH\nGesellschaft mit beschränkter Haftung\nRheine\n\nDem Registergericht ist eine Liste der Mitglieder des Aufsichtsrates eingereicht worden."
    },
    {
      "date": "2025-06-26",
      "id": "113562",
      "original_text": "Löschungsankündigung\nNordrhein-Westfalen Amtsgericht Duisburg HRB 30146\nmika BAU-Unternehmen GmbH – Oberhausen",
      "type": "Löschungsankündigung",
      "state": "Nordrhein-Westfalen",
      "amtsgericht": "Amtsgericht Duisburg",
      "registernummer": "HRB 30146",
      "registerart": "HRB",
      "company_name": "mika BAU-Unternehmen GmbH",
      "company_seat": "Oberhausen",
      "details": "26.06.2025 (Bekanntmachungsdatum)\n\nNordrhein-Westfalen Amtsgericht Duisburg HRB 30146\nLöschungsankündigung\n\nmika BAU-Unternehmen GmbH\nGesellschaft mit beschränkter Haftung\nOberhausen\n\nAmtsgericht Duisburg\nHRB 30146\nmika BAU-Unternehmen GmbH, Sitz Oberhausen\nDas Registergericht beabsichtigt, die im Handelsregister eingetragene Gesellschaft gemäß § 394 Absatz 1 FamFG wegen Vermögenslosigkeit von Amts wegen zu löschen. Gegen diese Verfügung kann Widerspruch eingelegt werden. Die Frist zur Erhebung eines Widerspruchs gegen die beabsichtigte Löschung von Amts wegen ist auf drei Monate festgesetzt. Rechtsbehelfsbelehrung Der Widerspruch ist bei dem Amtsgericht Duisburg, Kardinal-Galen-Str. 124-132, 47058 Duisburg schriftlich in deutscher Sprache oder zur Niederschrift der Geschäftsstelle einzulegen. Der Widerspruch kann auch zur Niederschrift der Geschäftsstelle eines jeden Amtsgerichtes abgegeben werden. Die Einlegung ist auch durch Übertragung eines elektronischen Dokuments an die elektronische Poststelle des Gerichts möglich. Das elektronische Dokument muss für die Bearbeitung durch das Gericht geeignet und mit einer qualifizierten elektronischen Signatur der verantwortenden Person versehen sein oder von der verantwortenden Person signiert und auf einem sicheren Übermittlungsweg gemäß § 130 a ZPO nach näherer Maßgabe der Verordnung über die technischen Rahmenbedingungen des elektronischen Rechtsverkehrs und über das besondere elektronische Behördenpostfach (BGBl. I, S. 3803) eingereicht werden. Weitere Informationen erhalten Sie auf der Internetseite www.justiz.de <http://www.justiz.de>. Der Widerspruch muss spätestens innerhalb der gesetzten Frist bei dem Amtsgericht Duisburg eingegangen sein. Dies gilt auch dann, wenn der Widerspruch zur Niederschrift der Geschäftsstelle eines anderen Amtsgerichtes abgegeben wurde. Die Frist beginnt mit der Veröffentlichung. Fällt das Ende der Frist auf einen Sonntag, einen allgemeinen Feiertag oder Sonnabend, so endet die Frist mit Ablauf des nächsten Werktages. Der Widerspruch muss die Bezeichnung der angefochtenen Verfügung sowie die Erklärung enthalten, dass Widerspruch gegen diese Verfügung eingelegt wird. Er ist zu unterzeichnen und soll begründet werden."
    },
    {
      "date": "2025-06-26",
      "id": "113563",
      "original_text": "Löschungsankündigung\nNordrhein-Westfalen Amtsgericht Siegburg HRB 13876\nZhongyi GmbH – Troisdorf",
      "type": "Löschungsankündigung",
      "state": "Nordrhein-Westfalen",
      "amtsgericht": "Amtsgericht Siegburg",
      "registernummer": "HRB 13876",
      "registerart": "HRB",
      "company_name": "Zhongyi GmbH",
      "company_seat": "Troisdorf",
      "details": "26.06.2025 (Bekanntmachungsdatum)\n\nNordrhein-Westfalen Amtsgericht Siegburg HRB 13876\nLöschungsankündigung\n\nZhongyi GmbH\nGesellschaft mit beschränkter Haftung\nTroisdorf\n\nDas Registergericht hat glaubhafte Kenntnis erlangt, dass die Gesellschaft vermögenslos geworden ist, da ein Insolvenzverfahren durchgeführt und nach § 200 InsO aufgehoben wurde.\n\nEs ist daher beabsichtigt, die Gesellschaft nach § 394 FamFG im Handelsregister wegen Vermögenslosigkeit zu löschen.\n\nEinwände gegen die Löschung sind durch Widerspruch binnen einer Frist von 3 Monaten geltend zu machen, andernfalls die Löschung erfolgen wird.\n\nEinzulegen ist der Widerspruch bei dem Amtsgericht Siegburg, Neue Poststraße 16, 53721 Siegburg, und zwar entweder schriftlich in deutscher Sprache oder mündlich zur Niederschrift der Geschäftsstelle. Der Widerspruch kann auch zur Niederschrift der Geschäftsstelle eines jeden Amtsgerichts abgegeben werden. Der Widerspruch ist binnen der in der Verfügung bestimmten Frist einzulegen. Die Frist ist nur gewahrt, wenn der Widerspruch rechtzeitig bei dem Amtsgericht Siegburg eingeht, auch wenn der Widerspruch zur Niederschrift der Geschäftsstelle eines anderen Amtsgerichts abgegeben wurde. Die Frist beginnt jeweils mit der schriftlichen Bekanntgabe der Verfügung an die Beteiligten. Kann die schriftliche Bekanntgabe an einen Beteiligten nicht bewirkt werden, beginnt die Frist spätestens mit Ablauf von fünf Monaten nach Erlass der Verfügung. Die Bekanntgabe ist entweder durch Zustellung oder am dritten Tage nach Aufgabe zur Post bewirkt. Sofern die Löschung noch nicht erfolgt ist, kann der Widerspruch auch noch nach Ablauf der Frist eingelegt werden. Fällt das Ende der Frist auf einen Sonnabend, einen Sonntag oder einen allgemeinen Feiertag, endet die Frist mit Ablauf des nächsten Werktages. Der Widerspruch ist zu unterzeichnen. Eine Begründung des Widerspruchs ist nicht vorgeschrieben."
    },
    {
      "date": "2025-06-26",
      "id": "113564",
      "original_text": "Löschungsankündigung\nNordrhein-Westfalen Amtsgericht Bonn HRB 25484\nSiMa GmbH – Weilerswist",
      "type": "Löschungsankündigung",
      "state": "Nordrhein-Westfalen",
      "amtsgericht": "Amtsgericht Bonn",
      "registernummer": "HRB 25484",
      "registerart": "HRB",
      "company_name": "SiMa GmbH",
      "company_seat": "Weilerswist",
      "details": "26.06.2025 (Bekanntmachungsdatum)\n\nNordrhein-Westfalen Amtsgericht Bonn HRB 25484\nLöschungsankündigung\n\nSiMa GmbH\nGesellschaft mit beschränkter Haftung\nWeilerswist\n\nDas Registergericht beabsichtigt die Gesellschaft von Amts wegen nach § 394 FamFG zu löschen. Die Frist zur Erhebung eines Widerspruchs ist auf einen Monat festgesetzt."
    },
    {
      "date": "2025-06-26",
      "id": "113565",
      "original_text": "Löschungsankündigung\nNordrhein-Westfalen Amtsgericht Aachen HRB 19809\nÖzgüler GmbH – Aachen",
      "type": "Löschungsankündigung",
      "state": "Nordrhein-Westfalen",
      "amtsgericht": "Amtsgericht Aachen",
      "registernummer": "HRB 19809",
      "registerart": "HRB",
      "company_name": "Özgüler GmbH",
      "company_seat": "Aachen",
      "details": "26.06.2025 (Bekanntmachungsdatum)\n\nNordrhein-Westfalen Amtsgericht Aachen HRB 19809\nLöschungsankündigung\n\nÖzgüler GmbH\nGesellschaft mit beschränkter Haftung\nAachen\n\nDas Registergericht beabsichtigt, von Amts wegen die Gesellschaft wegen Vermögenslosigkeit nach § 394 FamFG zu löschen, weil das Insolvenzverfahren Amtsgericht Aachen (93 IN 235/16) beendet und Vermögen der Gesellschaft nicht mehr erkennbar ist. Zur Geltendmachung des Widerspruchs gegen die beabsichtigte Löschung wird hiermit eine Frist von einem Monat ab Veröffentlichung dieser Ankündigung bestimmt.\nRechtsbehelfsbelehrung:\nGegen diese Verfügung kann Widerspruch eingelegt werden. Zum Widerspruch ist jeder berechtigt, der an der Unterlassung der Löschung ein berechtigtes Interesse hat.\nDer Widerspruch ist bei dem Amtsgericht Aachen, Adalbertsteinweg 92, 52070 Aachen schriftlich in deutscher Sprache oder zur Niederschrift der Geschäftsstelle einzulegen. Der Widerspruch kann auch zur Niederschrift der Geschäftsstelle eines jeden Amtsgerichtes abgegeben werden.\nDer Widerspruch muss spätestens innerhalb der gesetzten Frist nach der Bekanntgabe der Verfügung bei dem Amtsgericht Aachen eingegangen sein. Dies gilt auch dann, wenn der Widerspruch zur Niederschrift der Geschäftsstelle eines anderen Amtsgerichtes abgegeben wurde. Die Frist beginnt mit der Bekanntgabe der Verfügung durch Veröffentlichung. Fällt das Ende der Frist auf einen Sonntag, einen allgemeinen Feiertag oder Sonnabend, so endet die Frist mit Ablauf des nächsten Werktages.\nDer Widerspruch muss die Bezeichnung der angefochtenen Verfügung sowie die Erklärung enthalten, dass Widerspruch gegen diese Verfügung eingelegt wird. Er ist zu unterzeichnen und soll begründet werden.\nDie Einlegung ist auch durch Übertragung eines elektronischen Dokuments an die elektronische Poststelle des Gerichts möglich. Das elektronische Dokument muss für die Bearbeitung durch das Gericht geeignet und mit einer qualifizierten elektronischen Signatur der verantwortenden Person versehen sein oder von der verantwortenden Person signiert und auf einem sicheren Übermittlungsweg gemäß § 130 a ZPO nach näherer Maßgabe der Verordnung über die technischen Rahmenbedingungen des elektronischen Rechtsverkehrs und über das besondere elektronische Behördenpostfach (BGBl. I, S. 3803) eingereicht werden. Weitere Informationen erhalten Sie auf der Internetseite www.justiz.de."
    },
    {
      "date": "2025-06-26",
      "id": "113566",
      "original_text": "Löschungsankündigung\nNordrhein-Westfalen Amtsgericht Köln HRA 36407\nHorvath Gebäudereinigung e. K. – Wesseling",
      "type": "Löschungsankündigung",
      "state": "Nordrhein-Westfalen",
      "amtsgericht": "Amtsgericht Köln",
      "registernummer": "HRA 36407",
      "registerart": "HRA",
      "company_name": "Horvath Gebäudereinigung e. K.",
      "company_seat": "Wesseling",
      "details": "26.06.2025 (Bekanntmachungsdatum)\n\nNordrhein-Westfalen Amtsgericht Köln HRA 36407\nLöschungsankündigung\n\nHorvath Gebäudereinigung e. K.\nEinzelkaufmann / Einzelkauffrau\nWesseling\n\nDas Registergericht beabsichtigt die Firma von Amts wegen aufgrund Aufgabe des Geschäftsbetriebes nach §§ 6, 31 HGB zu löschen.\nDie Frist zur Erhebung eines Widerspruchs ist auf einen Monat festgesetzt."
    },
    {
      "date": "2025-06-26",
      "id": "113567",
      "original_text": "Einreichung neuer Dokumente\nNordrhein-Westfalen Amtsgericht Köln HRB 61047\nAmpega Asset Management GmbH – Köln",
      "type": "Einreichung neuer Dokumente",
      "state": "Nordrhein-Westfalen",
      "amtsgericht": "Amtsgericht Köln",
      "registernummer": "HRB 61047",
      "registerart": "HRB",
      "company_name": "Ampega Asset Management GmbH",
      "company_seat": "Köln",
      "details": "26.06.2025 (Bekanntmachungsdatum)\n\nNordrhein-Westfalen Amtsgericht Köln HRB 61047\nEinreichung neuer Dokumente\n\nAmpega Asset Management GmbH\nGesellschaft mit beschränkter Haftung\nKöln\n\nDem Registergericht ist eine Liste der Mitglieder des Aufsichtsrates eingereicht worden."
    },
    {
      "date": "2025-06-26",
      "id": "113568",
      "original_text": "Registerbekanntmachung nach dem Umwandlungsgesetz\nNordrhein-Westfalen Amtsgericht Köln HRB 78171\nCONTEAM:LIVE SOLUTIONS GmbH – Köln",
      "type": "Registerbekanntmachung nach dem Umwandlungsgesetz",
      "state": "Nordrhein-Westfalen",
      "amtsgericht": "Amtsgericht Köln",
      "registernummer": "HRB 78171",
      "registerart": "HRB",
      "company_name": "CONTEAM:LIVE SOLUTIONS GmbH",
      "company_seat": "Köln",
      "details": "26.06.2025 (Bekanntmachungsdatum)\n\nNordrhein-Westfalen Amtsgericht Köln HRB 78171\nRegisterbekanntmachung nach dem Umwandlungsgesetz 26.06.2025 (Eintragungsdatum)\n\nCONTEAM:LIVE SOLUTIONS GmbH\nGesellschaft mit beschränkter Haftung\nKöln\n\nDen Gläubigern der an der Verschmelzung beteiligten Rechtsträger ist, wenn sie binnen sechs Monaten nach dem Tag, an dem die Eintragung der Verschmelzung in das Register des Sitzes desjenigen Rechtsträgers, dessen Gläubiger sie sind, nach § 19 Absatz 3 UmwG als bekanntgemacht gilt, ihren Anspruch nach Grund und Höhe schriftlich anmelden, Sicherheit zu leisten, soweit sie nicht Befriedigung verlangen können. Dieses Recht steht den Gläubigern jedoch nur zu, wenn sie glaubhaft machen, dass durch die Verschmelzung die Erfüllung ihrer Forderung gefährdet wird."
    },
    {
      "date": "2025-06-26",
      "id": "113569",
      "original_text": "Registerbekanntmachung nach dem Umwandlungsgesetz\nNordrhein-Westfalen Amtsgericht Köln HRB 54724\nADFUTURA Immobilienmanagement GmbH – Köln",
      "type": "Registerbekanntmachung nach dem Umwandlungsgesetz",
      "state": "Nordrhein-Westfalen",
      "amtsgericht": "Amtsgericht Köln",
      "registernummer": "HRB 54724",
      "registerart": "HRB",
      "company_name": "ADFUTURA Immobilienmanagement GmbH",
      "company_seat": "Köln",
      "details": "26.06.2025 (Bekanntmachungsdatum)\n\nNordrhein-Westfalen Amtsgericht Köln HRB 54724\nRegisterbekanntmachung nach dem Umwandlungsgesetz 26.06.2025 (Eintragungsdatum)\n\nADFUTURA Immobilienmanagement GmbH\nGesellschaft mit beschränkter Haftung\nKöln\n\nDen Gläubigern der an der Verschmelzung beteiligten Rechtsträger ist, wenn sie binnen sechs Monaten nach dem Tag, an dem die Eintragung der Verschmelzung in das Register des Sitzes desjenigen Rechtsträgers, dessen Gläubiger sie sind, nach § 19 Absatz 3 UmwG als bekanntgemacht gilt, ihren Anspruch nach Grund und Höhe schriftlich anmelden, Sicherheit zu leisten, soweit sie nicht Befriedigung verlangen können. Dieses Recht steht den Gläubigern jedoch nur zu, wenn sie glaubhaft machen, dass durch die Verschmelzung die Erfüllung ihrer Forderung gefährdet wird."
    },
    {
      "date": "2025-06-26",
      "id": "113570",
      "original_text": "Registerbekanntmachung nach dem Umwandlungsgesetz\nNordrhein-Westfalen Amtsgericht Gelsenkirchen VR 2757\nSportclub Westfalia ETuS 04/31 e.V. – Gelsenkirchen",
      "type": "Registerbekanntmachung nach dem Umwandlungsgesetz",
      "state": "Nordrhein-Westfalen",
      "amtsgericht": "Amtsgericht Gelsenkirchen",
      "registernummer": "VR 2757",
      "registerart": "VR",
      "company_name": "Sportclub Westfalia ETuS 04/31 e.V.",
      "company_seat": "Gelsenkirchen",
      "details": "26.06.2025 (Bekanntmachungsdatum)\n\nNordrhein-Westfalen Amtsgericht Gelsenkirchen VR 2757\nRegisterbekanntmachung nach dem Umwandlungsgesetz 26.06.2025 (Eintragungsdatum)\n\nSportclub Westfalia ETuS 04/31 e.V.\neingetragener Verein\nGelsenkirchen\n\nDen Gläubigern der an der Verschmelzung beteiligten Rechtsträger ist, wenn sie binnen sechs Monaten nach dem Tag, an dem die Eintragung der Verschmelzung in das Register des Sitzes derjenigen Rechtsträger deren Gläubiger sie sind, nach § 19 Absatz 3 UmwG als bekanntgemacht gilt, ihren Anspruch nach Grund und Höhe schriftlich anmelden, Sicherheit zu leisten, soweit sie nicht Befriedigung verlangen können. Dieses Recht steht den Gläubigern jedoch nur zu, wenn sie glaubhaft machen, dass durch die Verschmelzung die Erfüllung ihrer Forderung gefährdet wird."
    },
    {
      "date": "2025-06-26",
      "id": "113571",
      "original_text": "Löschungsankündigung\nNordrhein-Westfalen Amtsgericht Kleve HRB 12897\nKINGCOVER GmbH – Moers",
      "type": "Löschungsankündigung",
      "state": "Nordrhein-Westfalen",
      "amtsgericht": "Amtsgericht Kleve",
      "registernummer": "HRB 12897",
      "registerart": "HRB",
      "company_name": "KINGCOVER GmbH",
      "company_seat": "Moers",
      "details": "26.06.2025 (Bekanntmachungsdatum)\n\nNordrhein-Westfalen Amtsgericht Kleve HRB 12897\nLöschungsankündigung\n\nKINGCOVER GmbH\nGesellschaft mit beschränkter Haftung\nMoers\n\nDas Registergericht beabsichtigt die Gesellschaft von Amts wegen nach § 394 FamFG zu löschen. Die Frist zur Erhebung eines Widerspruchs ist auf einen Monat festgesetzt."
    },
    {
      "date": "2025-06-26",
      "id": "113572",
      "original_text": "Registerbekanntmachung nach dem Umwandlungsgesetz\nNordrhein-Westfalen Amtsgericht Münster HRB 15973\nVainstream Festival GmbH – Münster",
      "type": "Registerbekanntmachung nach dem Umwandlungsgesetz",
      "state": "Nordrhein-Westfalen",
      "amtsgericht": "Amtsgericht Münster",
      "registernummer": "HRB 15973",
      "registerart": "HRB",
      "company_name": "Vainstream Festival GmbH",
      "company_seat": "Münster",
      "details": "26.06.2025 (Bekanntmachungsdatum)\n\nNordrhein-Westfalen Amtsgericht Münster HRB 15973\nRegisterbekanntmachung nach dem Umwandlungsgesetz 26.06.2025 (Eintragungsdatum)\n\nVainstream Festival GmbH\nGesellschaft mit beschränkter Haftung\nMünster\n\nDen Gläubigern der an der Verschmelzung beteiligten Rechtsträger ist, wenn sie binnen sechs Monaten nach dem Tag, an dem die Eintragung der Verschmelzung in das Register des Sitzes desjenigen Rechtsträgers, dessen Gläubiger sie sind, nach § 19 Absatz 3 UmwG als bekanntgemacht gilt, ihren Anspruch nach Grund und Höhe schriftlich anmelden, Sicherheit zu leisten, soweit sie nicht Befriedigung verlangen können. Dieses Recht steht den Gläubigern jedoch nur zu, wenn sie glaubhaft machen, dass durch die Verschmelzung die Erfüllung ihrer Forderung gefährdet wird."
    },
    {
      "date": "2025-06-26",
      "id": "113573",
      "original_text": "Registerbekanntmachung nach dem Umwandlungsgesetz\nNordrhein-Westfalen Amtsgericht Bonn HRB 27801\nBlickpunkt GmbH – Meckenheim",
      "type": "Registerbekanntmachung nach dem Umwandlungsgesetz",
      "state": "Nordrhein-Westfalen",
      "amtsgericht": "Amtsgericht Bonn",
      "registernummer": "HRB 27801",
      "registerart": "HRB",
      "company_name": "Blickpunkt GmbH",
      "company_seat": "Meckenheim",
      "details": "26.06.2025 (Bekanntmachungsdatum)\n\nNordrhein-Westfalen Amtsgericht Bonn HRB 27801\nRegisterbekanntmachung nach dem Umwandlungsgesetz 26.06.2025 (Eintragungsdatum)\n\nBlickpunkt GmbH\nGesellschaft mit beschränkter Haftung\nMeckenheim\n\nDen Gläubigern der an der Verschmelzung beteiligten Rechtsträger ist, wenn sie binnen sechs Monaten nach dem Tag, an dem die Eintragung der Verschmelzung in das Register des Sitzes derjenigen Rechtsträger deren Gläubiger sie sind, nach § 19 Absatz 3 UmwG als bekanntgemacht gilt, ihren Anspruch nach Grund und Höhe schriftlich anmelden, Sicherheit zu leisten, soweit sie nicht Befriedigung verlangen können. Dieses Recht steht den Gläubigern jedoch nur zu, wenn sie glaubhaft machen, dass durch die Verschmelzung die Erfüllung ihrer Forderung gefährdet wird."
    },
    {
      "date": "2025-06-26",
      "id": "113574",
      "original_text": "Einreichung neuer Dokumente\nNordrhein-Westfalen Amtsgericht Arnsberg HRB 7738\nFALKE KGaA – Schmallenberg",
      "type": "Einreichung neuer Dokumente",
      "state": "Nordrhein-Westfalen",
      "amtsgericht": "Amtsgericht Arnsberg",
      "registernummer": "HRB 7738",
      "registerart": "HRB",
      "company_name": "FALKE KGaA",
      "company_seat": "Schmallenberg",
      "details": "26.06.2025 (Bekanntmachungsdatum)\n\nNordrhein-Westfalen Amtsgericht Arnsberg HRB 7738\nEinreichung neuer Dokumente 26.06.2025 (Eintragungsdatum)\n\nFALKE KGaA\nKommanditgesellschaft auf Aktien\nSchmallenberg\n\nDem Registergericht ist eine neue Liste der Mitglieder des Aufsichtsrates eingereicht worden."
    },
    {
      "date": "2025-06-26",
      "id": "113575",
      "original_text": "Registerbekanntmachung nach dem Umwandlungsgesetz\nNordrhein-Westfalen Amtsgericht Gelsenkirchen HRA 6397\nKerim Derin e.K. – Marl",
      "type": "Registerbekanntmachung nach dem Umwandlungsgesetz",
      "state": "Nordrhein-Westfalen",
      "amtsgericht": "Amtsgericht Gelsenkirchen",
      "registernummer": "HRA 6397",
      "registerart": "HRA",
      "company_name": "Kerim Derin e.K.",
      "company_seat": "Marl",
      "details": "26.06.2025 (Bekanntmachungsdatum)\n\nNordrhein-Westfalen Amtsgericht Gelsenkirchen HRA 6397\nRegisterbekanntmachung nach dem Umwandlungsgesetz 26.06.2025 (Eintragungsdatum)\n\nKerim Derin e.K.\nEinzelkaufmann / Einzelkauffrau\nMarl\n\nDen Gläubigern der an der Ausgliederung beteiligten Rechtsträger ist, wenn sie binnen sechs Monaten nach dem Tag, an dem die Eintragung der Ausgliederung in das Register des Sitzes desjenigen Rechtsträgers, dessen Gläubiger sie sind, nach § 19 Absatz 3 UmwG als bekanntgemacht gilt, ihren Anspruch nach Grund und Höhe schriftlich anmelden, Sicherheit zu leisten, soweit sie nicht Befriedigung verlangen können. Dieses Recht steht den Gläubigern jedoch nur zu, wenn sie glaubhaft machen, dass durch die Ausgliederung die Erfüllung ihrer Forderung gefährdet wird."
    },
    {
      "date": "2025-06-26",
      "id": "113576",
      "original_text": "Löschungsankündigung\nNordrhein-Westfalen Amtsgericht Köln HRB 115913\nVinh Hoa GmbH – Köln",
      "type": "Löschungsankündigung",
      "state": "Nordrhein-Westfalen",
      "amtsgericht": "Amtsgericht Köln",
      "registernummer": "HRB 115913",
      "registerart": "HRB",
      "company_name": "Vinh Hoa GmbH",
      "company_seat": "Köln",
      "details": "26.06.2025 (Bekanntmachungsdatum)\n\nNordrhein-Westfalen Amtsgericht Köln HRB 115913\nLöschungsankündigung\n\nVinh Hoa GmbH\nGesellschaft mit beschränkter Haftung\nKöln\n\nDas Registergericht beabsichtigt die Gesellschaft von Amts wegen nach § 394 FamFG zu löschen. Die Frist zur Erhebung eines Widerspruchs ist auf einen Monat festgesetzt."
    },
    {
      "date": "2025-06-26",
      "id": "113577",
      "original_text": "Registerbekanntmachung nach dem Umwandlungsgesetz\nNordrhein-Westfalen Amtsgericht Steinfurt HRB 10541\nStadtwerke Tecklenburger Land Energie GmbH – Ibbenbüren",
      "type": "Registerbekanntmachung nach dem Umwandlungsgesetz",
      "state": "Nordrhein-Westfalen",
      "amtsgericht": "Amtsgericht Steinfurt",
      "registernummer": "HRB 10541",
      "registerart": "HRB",
      "company_name": "Stadtwerke Tecklenburger Land Energie GmbH",
      "company_seat": "Ibbenbüren",
      "details": "26.06.2025 (Bekanntmachungsdatum)\n\nNordrhein-Westfalen Amtsgericht Steinfurt HRB 10541\nRegisterbekanntmachung nach dem Umwandlungsgesetz 26.06.2025 (Eintragungsdatum)\n\nStadtwerke Tecklenburger Land Energie GmbH\nGesellschaft mit beschränkter Haftung\nIbbenbüren\n\nDen Gläubigern der an der Verschmelzung beteiligten Rechtsträger ist, wenn sie binnen sechs Monaten nach dem Tag, an dem die Eintragung der Verschmelzung in das Register des Sitzes desjenigen Rechtsträgers, dessen Gläubiger sie sind, nach § 19 Absatz 3 UmwG als bekanntgemacht gilt, ihren Anspruch nach Grund und Höhe schriftlich anmelden, Sicherheit zu leisten, soweit sie nicht Befriedigung verlangen können. Dieses Recht steht den Gläubigern jedoch nur zu, wenn sie glaubhaft machen, dass durch die Verschmelzung die Erfüllung ihrer Forderung gefährdet wird."
    },
    {
      "date": "2025-06-26",
      "id": "113578",
      "original_text": "Registerbekanntmachung nach dem Umwandlungsgesetz\nNordrhein-Westfalen Amtsgericht Köln HRB 78236\nH & C Gastro GmbH – Frechen",
      "type": "Registerbekanntmachung nach dem Umwandlungsgesetz",
      "state": "Nordrhein-Westfalen",
      "amtsgericht": "Amtsgericht Köln",
      "registernummer": "HRB 78236",
      "registerart": "HRB",
      "company_name": "H & C Gastro GmbH",
      "company_seat": "Frechen",
      "details": "26.06.2025 (Bekanntmachungsdatum)\n\nNordrhein-Westfalen Amtsgericht Köln HRB 78236\nRegisterbekanntmachung nach dem Umwandlungsgesetz 26.06.2025 (Eintragungsdatum)\n\nH & C Gastro GmbH\nGesellschaft mit beschränkter Haftung\nFrechen\n\nDen Gläubigern der an der Verschmelzung beteiligten Rechtsträger ist, wenn sie binnen sechs Monaten nach dem Tag, an dem die Eintragung der Verschmelzung in das Register des Sitzes desjenigen Rechtsträgers, dessen Gläubiger sie sind, nach § 19 Absatz 3 UmwG als bekanntgemacht gilt, ihren Anspruch nach Grund und Höhe schriftlich anmelden, Sicherheit zu leisten, soweit sie nicht Befriedigung verlangen können. Dieses Recht steht den Gläubigern jedoch nur zu, wenn sie glaubhaft machen, dass durch die Verschmelzung die Erfüllung ihrer Forderung gefährdet wird."
    },
    {
      "date": "2025-06-26",
      "id": "113579",
      "original_text": "Einreichung neuer Dokumente\nNordrhein-Westfalen Amtsgericht Arnsberg HRB 848\nTRILUX Group Management GmbH – Arnsberg",
      "type": "Einreichung neuer Dokumente",
      "state": "Nordrhein-Westfalen",
      "amtsgericht": "Amtsgericht Arnsberg",
      "registernummer": "HRB 848",
      "registerart": "HRB",
      "company_name": "TRILUX Group Management GmbH",
      "company_seat": "Arnsberg",
      "details": "26.06.2025 (Bekanntmachungsdatum)\n\nNordrhein-Westfalen Amtsgericht Arnsberg HRB 848\nEinreichung neuer Dokumente 26.06.2025 (Eintragungsdatum)\n\nTRILUX Group Management GmbH\nGesellschaft mit beschränkter Haftung\nArnsberg\n\nDem Registergericht ist eine neue Liste der Mitglieder des Aufsichtsrates eingereicht worden."
    },
    {
      "date": "2025-06-26",
      "id": "113580",
      "original_text": "Registerbekanntmachung nach dem Umwandlungsgesetz\nNordrhein-Westfalen Amtsgericht Bonn HRB 19747\nAugenklinik Dardenne SE – Bonn",
      "type": "Registerbekanntmachung nach dem Umwandlungsgesetz",
      "state": "Nordrhein-Westfalen",
      "amtsgericht": "Amtsgericht Bonn",
      "registernummer": "HRB 19747",
      "registerart": "HRB",
      "company_name": "Augenklinik Dardenne SE",
      "company_seat": "Bonn",
      "details": "26.06.2025 (Bekanntmachungsdatum)\n\nNordrhein-Westfalen Amtsgericht Bonn HRB 19747\nRegisterbekanntmachung nach dem Umwandlungsgesetz 26.06.2025 (Eintragungsdatum)\n\nAugenklinik Dardenne SE\nEuropäische Aktiengesellschaft (SE)\nBonn\n\nDen Gläubigern der an der Verschmelzung beteiligten Rechtsträger ist, wenn sie binnen sechs Monaten nach dem Tag, an dem die Eintragung der Verschmelzung in das Register des Sitzes desjenigen Rechtsträgers, dessen Gläubiger sie sind, nach § 19 Absatz 3 UmwG als bekanntgemacht gilt, ihren Anspruch nach Grund und Höhe schriftlich anmelden, Sicherheit zu leisten, soweit sie nicht Befriedigung verlangen können. Dieses Recht steht den Gläubigern jedoch nur zu, wenn sie glaubhaft machen, dass durch die Verschmelzung die Erfüllung ihrer Forderung gefährdet wird."
    },
    {
      "date": "2025-06-26",
      "id": "113581",
      "original_text": "Einreichung neuer Dokumente\nNordrhein-Westfalen Amtsgericht Neuss HRB 18611\nPARIS Process Automation Robotics Intelligence Systems AG – Kaarst",
      "type": "Einreichung neuer Dokumente",
      "state": "Nordrhein-Westfalen",
      "amtsgericht": "Amtsgericht Neuss",
      "registernummer": "HRB 18611",
      "registerart": "HRB",
      "company_name": "PARIS Process Automation Robotics Intelligence Systems AG",
      "company_seat": "Kaarst",
      "details": "26.06.2025 (Bekanntmachungsdatum)\n\nNordrhein-Westfalen Amtsgericht Neuss HRB 18611\nEinreichung neuer Dokumente\n\nPARIS Process Automation Robotics Intelligence Systems AG\nAktiengesellschaft\nKaarst\n\nDem Registergericht ist eine Liste der Mitglieder des Aufsichtsrates eingereicht worden."
    },
    {
      "date": "2025-06-26",
      "id": "113582",
      "original_text": "Registerbekanntmachung nach dem Umwandlungsgesetz\nNordrhein-Westfalen Amtsgericht Bielefeld HRB 42530\nHISB Betreuungsdienst Bielefeld GmbH – Bielefeld",
      "type": "Registerbekanntmachung nach dem Umwandlungsgesetz",
      "state": "Nordrhein-Westfalen",
      "amtsgericht": "Amtsgericht Bielefeld",
      "registernummer": "HRB 42530",
      "registerart": "HRB",
      "company_name": "HISB Betreuungsdienst Bielefeld GmbH",
      "company_seat": "Bielefeld",
      "details": "26.06.2025 (Bekanntmachungsdatum)\n\nNordrhein-Westfalen Amtsgericht Bielefeld HRB 42530\nRegisterbekanntmachung nach dem Umwandlungsgesetz 26.06.2025 (Eintragungsdatum)\n\nHISB Betreuungsdienst Bielefeld GmbH\nGesellschaft mit beschränkter Haftung\nBielefeld\n\nDen Gläubigern der an der Verschmelzung beteiligten Rechtsträger ist, wenn sie binnen sechs Monaten nach dem Tag, an dem die Eintragung der Verschmelzung in das Register des Sitzes desjenigen Rechtsträgers, dessen Gläubiger sie sind, nach § 19 Absatz 3 UmwG als bekanntgemacht gilt, ihren Anspruch nach Grund und Höhe schriftlich anmelden, Sicherheit zu leisten, soweit sie nicht Befriedigung verlangen können. Dieses Recht steht den Gläubigern jedoch nur zu, wenn sie glaubhaft machen, dass durch die Verschmelzung die Erfüllung ihrer Forderung gefährdet wird."
    },
    {
      "date": "2025-06-26",
      "id": "113583",
      "original_text": "Einreichung neuer Dokumente\nNordrhein-Westfalen Amtsgericht Arnsberg HRB 390\nTRILUX Holding GmbH – Arnsberg",
      "type": "Einreichung neuer Dokumente",
      "state": "Nordrhein-Westfalen",
      "amtsgericht": "Amtsgericht Arnsberg",
      "registernummer": "HRB 390",
      "registerart": "HRB",
      "company_name": "TRILUX Holding GmbH",
      "company_seat": "Arnsberg",
      "details": "26.06.2025 (Bekanntmachungsdatum)\n\nNordrhein-Westfalen Amtsgericht Arnsberg HRB 390\nEinreichung neuer Dokumente 26.05.2025 (Eintragungsdatum)\n\nTRILUX Holding GmbH\nGesellschaft mit beschränkter Haftung\nArnsberg\n\nDem Registergericht ist eine neue Liste der Mitglieder des Aufsichtsrates eingereicht worden."
    },
    {
      "date": "2025-06-26",
      "id": "113584",
      "original_text": "Registerbekanntmachung nach dem Umwandlungsgesetz\nNordrhein-Westfalen Amtsgericht Gütersloh HRB 13870\nHaubold Haustechnik GmbH – Rietberg",
      "type": "Registerbekanntmachung nach dem Umwandlungsgesetz",
      "state": "Nordrhein-Westfalen",
      "amtsgericht": "Amtsgericht Gütersloh",
      "registernummer": "HRB 13870",
      "registerart": "HRB",
      "company_name": "Haubold Haustechnik GmbH",
      "company_seat": "Rietberg",
      "details": "26.06.2025 (Bekanntmachungsdatum)\n\nNordrhein-Westfalen Amtsgericht Gütersloh HRB 13870\nRegisterbekanntmachung nach dem Umwandlungsgesetz 26.06.2025 (Eintragungsdatum)\n\nHaubold Haustechnik GmbH\nGesellschaft mit beschränkter Haftung\nRietberg\n\nDen Gläubigern der an der Ausgliederung beteiligten Rechtsträger ist, wenn sie binnen sechs Monaten nach dem Tag, an dem die Eintragung der Ausgliederung in das Register des Sitzes desjenigen Rechtsträgers, dessen Gläubiger sie sind, nach § 19 Absatz 3 UmwG als bekanntgemacht gilt, ihren Anspruch nach Grund und Höhe schriftlich anmelden, Sicherheit zu leisten, soweit sie nicht Befriedigung verlangen können. Dieses Recht steht den Gläubigern jedoch nur zu, wenn sie glaubhaft machen, dass durch die Ausgliederung die Erfüllung ihrer Forderung gefährdet wird."
    },
    {
      "date": "2025-06-26",
      "id": "113585",
      "original_text": "Registerbekanntmachung nach dem Umwandlungsgesetz\nNordrhein-Westfalen Amtsgericht Köln HRB 26434\nVMP Verbund mittelständischer Papiergrosshändler GmbH – Frechen",
      "type": "Registerbekanntmachung nach dem Umwandlungsgesetz",
      "state": "Nordrhein-Westfalen",
      "amtsgericht": "Amtsgericht Köln",
      "registernummer": "HRB 26434",
      "registerart": "HRB",
      "company_name": "VMP Verbund mittelständischer Papiergrosshändler GmbH",
      "company_seat": "Frechen",
      "details": "26.06.2025 (Bekanntmachungsdatum)\n\nNordrhein-Westfalen Amtsgericht Köln HRB 26434\nRegisterbekanntmachung nach dem Umwandlungsgesetz 26.06.2025 (Eintragungsdatum)\n\nVMP Verbund mittelständischer Papiergrosshändler GmbH\nGesellschaft mit beschränkter Haftung\nFrechen\n\nDen Gläubigern der an der Verschmelzung beteiligten Rechtsträger ist, wenn sie binnen sechs Monaten nach dem Tag, an dem die Eintragung der Verschmelzung in das Register des Sitzes desjenigen Rechtsträgers, dessen Gläubiger sie sind, nach § 19 Absatz 3 UmwG als bekanntgemacht gilt, ihren Anspruch nach Grund und Höhe schriftlich anmelden, Sicherheit zu leisten, soweit sie nicht Befriedigung verlangen können. Dieses Recht steht den Gläubigern jedoch nur zu, wenn sie glaubhaft machen, dass durch die Verschmelzung die Erfüllung ihrer Forderung gefährdet wird."
    },
    {
      "date": "2025-06-26",
      "id": "113586",
      "original_text": "Registerbekanntmachung nach dem Umwandlungsgesetz\nNordrhein-Westfalen Amtsgericht Köln HRB 32654\nAntalis GmbH – Frechen",
      "type": "Registerbekanntmachung nach dem Umwandlungsgesetz",
      "state": "Nordrhein-Westfalen",
      "amtsgericht": "Amtsgericht Köln",
      "registernummer": "HRB 32654",
      "registerart": "HRB",
      "company_name": "Antalis GmbH",
      "company_seat": "Frechen",
      "details": "26.06.2025 (Bekanntmachungsdatum)\n\nNordrhein-Westfalen Amtsgericht Köln HRB 32654\nRegisterbekanntmachung nach dem Umwandlungsgesetz 26.06.2025 (Eintragungsdatum)\n\nAntalis GmbH\nGesellschaft mit beschränkter Haftung\nFrechen\n\nDen Gläubigern der an der Verschmelzung beteiligten Rechtsträger ist, wenn sie binnen sechs Monaten nach dem Tag, an dem die Eintragung der Verschmelzung in das Register des Sitzes desjenigen Rechtsträgers, dessen Gläubiger sie sind, nach § 19 Absatz 3 UmwG als bekanntgemacht gilt, ihren Anspruch nach Grund und Höhe schriftlich anmelden, Sicherheit zu leisten, soweit sie nicht Befriedigung verlangen können. Dieses Recht steht den Gläubigern jedoch nur zu, wenn sie glaubhaft machen, dass durch die Verschmelzung die Erfüllung ihrer Forderung gefährdet wird."
    },
    {
      "date": "2025-06-26",
      "id": "113587",
      "original_text": "Einreichung neuer Dokumente\nNordrhein-Westfalen Amtsgericht Dortmund HRB 17117 früher Amtsgericht Lünen\nKNAPPSCHAFT KLINIKEN WESTFALEN GmbH – Dortmund",
      "type": "Einreichung neuer Dokumente",
      "state": "Nordrhein-Westfalen",
      "amtsgericht": "Amtsgericht Dortmund",
      "registernummer": "HRB 17117",
      "registerart": "HRB",
      "company_name": "KNAPPSCHAFT KLINIKEN WESTFALEN GmbH",
      "company_seat": "Dortmund",
      "former_amtsgericht": "Lünen",
      "details": "26.06.2025 (Bekanntmachungsdatum)\n\nNordrhein-Westfalen Amtsgericht Dortmund HRB 17117 früher Amtsgericht Lünen\nEinreichung neuer Dokumente\n\nKNAPPSCHAFT KLINIKEN WESTFALEN GmbH\nGesellschaft mit beschränkter Haftung\nDortmund\n\nDem Registergericht ist eine neue Liste der Mitglieder des Aufsichtsrates eingereicht worden."
    },
    {
      "date": "2025-06-26",
      "id": "113588",
      "original_text": "Registerbekanntmachung nach dem Umwandlungsgesetz\nNordrhein-Westfalen Amtsgericht Aachen HRA 10379\nHeiden Dentaltechnik GmbH & Co. KG – Roetgen",
      "type": "Registerbekanntmachung nach dem Umwandlungsgesetz",
      "state": "Nordrhein-Westfalen",
      "amtsgericht": "Amtsgericht Aachen",
      "registernummer": "HRA 10379",
      "registerart": "HRA",
      "company_name": "Heiden Dentaltechnik GmbH & Co. KG",
      "company_seat": "Roetgen",
      "details": "26.06.2025 (Bekanntmachungsdatum)\n\nNordrhein-Westfalen Amtsgericht Aachen HRA 10379\nRegisterbekanntmachung nach dem Umwandlungsgesetz 26.06.2025 (Eintragungsdatum)\n\nHeiden Dentaltechnik GmbH & Co. KG\nKommanditgesellschaft\nRoetgen\n\nDen Gläubigern der an der Ausgliederung beteiligten Rechtsträger ist, wenn sie binnen sechs Monaten nach dem Tag, an dem die Eintragung der Ausgliederung in das Register des Sitzes derjenigen Rechtsträger deren Gläubiger sie sind, nach § 19 Absatz 3 UmwG als bekanntgemacht gilt, ihren Anspruch nach Grund und Höhe schriftlich anmelden, Sicherheit zu leisten, soweit sie nicht Befriedigung verlangen können. Dieses Recht steht den Gläubigern jedoch nur zu, wenn sie glaubhaft machen, dass durch die Ausgliederung die Erfüllung ihrer Forderung gefährdet wird."
    },
    {
      "date": "2025-06-26",
      "id": "113589",
      "original_text": "Registerbekanntmachung nach dem Umwandlungsgesetz\nNordrhein-Westfalen Amtsgericht Köln HRB 56625\nPARAMA GmbH – Köln",
      "type": "Registerbekanntmachung nach dem Umwandlungsgesetz",
      "state": "Nordrhein-Westfalen",
      "amtsgericht": "Amtsgericht Köln",
      "registernummer": "HRB 56625",
      "registerart": "HRB",
      "company_name": "PARAMA GmbH",
      "company_seat": "Köln",
      "details": "26.06.2025 (Bekanntmachungsdatum)\n\nNordrhein-Westfalen Amtsgericht Köln HRB 56625\nRegisterbekanntmachung nach dem Umwandlungsgesetz 26.06.2025 (Eintragungsdatum)\n\nPARAMA GmbH\nGesellschaft mit beschränkter Haftung\nKöln\n\nDen Gläubigern der an der Verschmelzung beteiligten Rechtsträger ist, wenn sie binnen sechs Monaten nach dem Tag, an dem die Eintragung der Verschmelzung in das Register des Sitzes desjenigen Rechtsträgers, dessen Gläubiger sie sind, nach § 19 Absatz 3 UmwG als bekanntgemacht gilt, ihren Anspruch nach Grund und Höhe schriftlich anmelden, Sicherheit zu leisten, soweit sie nicht Befriedigung verlangen können. Dieses Recht steht den Gläubigern jedoch nur zu, wenn sie glaubhaft machen, dass durch die Verschmelzung die Erfüllung ihrer Forderung gefährdet wird."
    },
    {
      "date": "2025-06-26",
      "id": "113590",
      "original_text": "Registerbekanntmachung nach dem Umwandlungsgesetz\nNordrhein-Westfalen Amtsgericht Arnsberg HRB 10446\nETL ADVISA Vorderwülbecke & Kollegen GmbH Steuerberatungsgesellschaft – Marsberg",
      "type": "Registerbekanntmachung nach dem Umwandlungsgesetz",
      "state": "Nordrhein-Westfalen",
      "amtsgericht": "Amtsgericht Arnsberg",
      "registernummer": "HRB 10446",
      "registerart": "HRB",
      "company_name": "ETL ADVISA Vorderwülbecke & Kollegen GmbH Steuerberatungsgesellschaft",
      "company_seat": "Marsberg",
      "details": "26.06.2025 (Bekanntmachungsdatum)\n\nNordrhein-Westfalen Amtsgericht Arnsberg HRB 10446\nRegisterbekanntmachung nach dem Umwandlungsgesetz 26.06.2025 (Eintragungsdatum)\n\nETL ADVISA Vorderwülbecke & Kollegen GmbH Steuerberatungsgesellschaft\nGesellschaft mit beschränkter Haftung\nMarsberg\n\nDen Gläubigern der an der Verschmelzung beteiligten Rechtsträger ist, wenn sie binnen sechs Monaten nach dem Tag, an dem die Eintragung der Verschmelzung in das Register des Sitzes desjenigen Rechtsträgers, dessen Gläubiger sie sind, nach § 19 Absatz 3 UmwG als bekanntgemacht gilt, ihren Anspruch nach Grund und Höhe schriftlich anmelden, Sicherheit zu leisten, soweit sie nicht Befriedigung verlangen können. Dieses Recht steht den Gläubigern jedoch nur zu, wenn sie glaubhaft machen, dass durch die Verschmelzung die Erfüllung ihrer Forderung gefährdet wird."
    },
    {
      "date": "2025-06-26",
      "id": "113591",
      "original_text": "Registerbekanntmachung nach dem Umwandlungsgesetz\nNordrhein-Westfalen Amtsgericht Hamm VR 1078\nTRI-AS Hamm e. V. – Hamm",
      "type": "Registerbekanntmachung nach dem Umwandlungsgesetz",
      "state": "Nordrhein-Westfalen",
      "amtsgericht": "Amtsgericht Hamm",
      "registernummer": "VR 1078",
      "registerart": "VR",
      "company_name": "TRI-AS Hamm e. V.",
      "company_seat": "Hamm",
      "details": "26.06.2025 (Bekanntmachungsdatum)\n\nNordrhein-Westfalen Amtsgericht Hamm VR 1078\nRegisterbekanntmachung nach dem Umwandlungsgesetz 26.06.2025 (Eintragungsdatum)\n\nTRI-AS Hamm e. V.\neingetragener Verein\nHamm\n\nDen Gläubigern der an der Verschmelzung beteiligten Rechtsträger ist, wenn sie binnen sechs Monaten nach dem Tag, an dem die Eintragung der Verschmelzung in das Register des Sitzes desjenigen Rechtsträgers, dessen Gläubiger sie sind, nach § 19 Absatz 3 UmwG als bekanntgemacht gilt, ihren Anspruch nach Grund und Höhe schriftlich anmelden, Sicherheit zu leisten, soweit sie nicht Befriedigung verlangen können. Dieses Recht steht den Gläubigern jedoch nur zu, wenn sie glaubhaft machen, dass durch die Verschmelzung die Erfüllung ihrer Forderung gefährdet wird."
    },
    {
      "date": "2025-06-26",
      "id": "113592",
      "original_text": "Löschungsankündigung\nNordrhein-Westfalen Amtsgericht Duisburg HRB 33076\nItalia Esspress UG (haftungsbeschränkt) – Oberhausen",
      "type": "Löschungsankündigung",
      "state": "Nordrhein-Westfalen",
      "amtsgericht": "Amtsgericht Duisburg",
      "registernummer": "HRB 33076",
      "registerart": "HRB",
      "company_name": "Italia Esspress UG (haftungsbeschränkt)",
      "company_seat": "Oberhausen",
      "details": "26.06.2025 (Bekanntmachungsdatum)\n\nNordrhein-Westfalen Amtsgericht Duisburg HRB 33076\nLöschungsankündigung\n\nItalia Esspress UG (haftungsbeschränkt)\nGesellschaft mit beschränkter Haftung\nOberhausen\n\nAmtsgericht Duisburg\nHRB 33076\nItalia Esspress UG (haftungsbeschränkt), Sitz Oberhausen\nDas Registergericht beabsichtigt, die im Handelsregister eingetragene Gesellschaft gemäß § 394 Absatz 1 FamFG wegen Vermögenslosigkeit von Amts wegen zu löschen. Gegen diese Verfügung kann Widerspruch eingelegt werden. Die Frist zur Erhebung eines Widerspruchs gegen die beabsichtigte Löschung von Amts wegen ist auf drei Monate festgesetzt. Rechtsbehelfsbelehrung Der Widerspruch ist bei dem Amtsgericht Duisburg, Kardinal-Galen-Str. 124-132, 47058 Duisburg schriftlich in deutscher Sprache oder zur Niederschrift der Geschäftsstelle einzulegen. Der Widerspruch kann auch zur Niederschrift der Geschäftsstelle eines jeden Amtsgerichtes abgegeben werden. Die Einlegung ist auch durch Übertragung eines elektronischen Dokuments an die elektronische Poststelle des Gerichts möglich. Das elektronische Dokument muss für die Bearbeitung durch das Gericht geeignet und mit einer qualifizierten elektronischen Signatur der verantwortenden Person versehen sein oder von der verantwortenden Person signiert und auf einem sicheren Übermittlungsweg gemäß § 130 a ZPO nach näherer Maßgabe der Verordnung über die technischen Rahmenbedingungen des elektronischen Rechtsverkehrs und über das besondere elektronische Behördenpostfach (BGBl. I, S. 3803) eingereicht werden. Weitere Informationen erhalten Sie auf der Internetseite www.justiz.de <http://www.justiz.de>. Der Widerspruch muss spätestens innerhalb der gesetzten Frist bei dem Amtsgericht Duisburg eingegangen sein. Dies gilt auch dann, wenn der Widerspruch zur Niederschrift der Geschäftsstelle eines anderen Amtsgerichtes abgegeben wurde. Die Frist beginnt mit der Veröffentlichung. Fällt das Ende der Frist auf einen Sonntag, einen allgemeinen Feiertag oder Sonnabend, so endet die Frist mit Ablauf des nächsten Werktages. Der Widerspruch muss die Bezeichnung der angefochtenen Verfügung sowie die Erklärung enthalten, dass Widerspruch gegen diese Verfügung eingelegt wird. Er ist zu unterzeichnen und soll begründet werden."
    },
    {
      "date": "2025-06-26",
      "id": "113593",
      "original_text": "Registerbekanntmachung nach dem Umwandlungsgesetz\nNordrhein-Westfalen Amtsgericht Gelsenkirchen HRB 18727\nKD-Sicherung GmbH – Marl",
      "type": "Registerbekanntmachung nach dem Umwandlungsgesetz",
      "state": "Nordrhein-Westfalen",
      "amtsgericht": "Amtsgericht Gelsenkirchen",
      "registernummer": "HRB 18727",
      "registerart": "HRB",
      "company_name": "KD-Sicherung GmbH",
      "company_seat": "Marl",
      "details": "26.06.2025 (Bekanntmachungsdatum)\n\nNordrhein-Westfalen Amtsgericht Gelsenkirchen HRB 18727\nRegisterbekanntmachung nach dem Umwandlungsgesetz 26.06.2025 (Eintragungsdatum)\n\nKD-Sicherung GmbH\nGesellschaft mit beschränkter Haftung\nMarl\n\nDen Gläubigern der an der Ausgliederung beteiligten Rechtsträger ist, wenn sie binnen sechs Monaten nach dem Tag, an dem die Eintragung der Ausgliederung in das Register des Sitzes desjenigen Rechtsträgers, dessen Gläubiger sie sind, nach § 19 Absatz 3 UmwG als bekanntgemacht gilt, ihren Anspruch nach Grund und Höhe schriftlich anmelden, Sicherheit zu leisten, soweit sie nicht Befriedigung verlangen können. Dieses Recht steht den Gläubigern jedoch nur zu, wenn sie glaubhaft machen, dass durch die Ausgliederung die Erfüllung ihrer Forderung gefährdet wird."
    },
    {
      "date": "2025-06-26",
      "id": "113594",
      "original_text": "Registerbekanntmachung nach dem Umwandlungsgesetz\nNordrhein-Westfalen Amtsgericht Bonn HRB 27743\nBlickpunkt Werbe- und Verlagsgesellschaft mbH – Meckenheim",
      "type": "Registerbekanntmachung nach dem Umwandlungsgesetz",
      "state": "Nordrhein-Westfalen",
      "amtsgericht": "Amtsgericht Bonn",
      "registernummer": "HRB 27743",
      "registerart": "HRB",
      "company_name": "Blickpunkt Werbe- und Verlagsgesellschaft mbH",
      "company_seat": "Meckenheim",
      "details": "26.06.2025 (Bekanntmachungsdatum)\n\nNordrhein-Westfalen Amtsgericht Bonn HRB 27743\nRegisterbekanntmachung nach dem Umwandlungsgesetz 26.06.2025 (Eintragungsdatum)\n\nBlickpunkt Werbe- und Verlagsgesellschaft mbH\nGesellschaft mit beschränkter Haftung\nMeckenheim\n\nDen Gläubigern der an der Verschmelzung beteiligten Rechtsträger ist, wenn sie binnen sechs Monaten nach dem Tag, an dem die Eintragung der Verschmelzung in das Register des Sitzes derjenigen Rechtsträger deren Gläubiger sie sind, nach § 19 Absatz 3 UmwG als bekanntgemacht gilt, ihren Anspruch nach Grund und Höhe schriftlich anmelden, Sicherheit zu leisten, soweit sie nicht Befriedigung verlangen können. Dieses Recht steht den Gläubigern jedoch nur zu, wenn sie glaubhaft machen, dass durch die Verschmelzung die Erfüllung ihrer Forderung gefährdet wird."
    },
    {
      "date": "2025-06-26",
      "id": "113595",
      "original_text": "Einreichung neuer Dokumente\nNordrhein-Westfalen Amtsgericht Köln HRB 59696\nDiakonie Michaelshoven Pflege und Wohnen gGmbH – Köln",
      "type": "Einreichung neuer Dokumente",
      "state": "Nordrhein-Westfalen",
      "amtsgericht": "Amtsgericht Köln",
      "registernummer": "HRB 59696",
      "registerart": "HRB",
      "company_name": "Diakonie Michaelshoven Pflege und Wohnen gGmbH",
      "company_seat": "Köln",
      "details": "26.06.2025 (Bekanntmachungsdatum)\n\nNordrhein-Westfalen Amtsgericht Köln HRB 59696\nEinreichung neuer Dokumente\n\nDiakonie Michaelshoven Pflege und Wohnen gGmbH\nGesellschaft mit beschränkter Haftung\nKöln\n\nDem Registergericht ist eine Liste der Mitglieder des Aufsichtsrates eingereicht worden."
    },
    {
      "date": "2025-06-26",
      "id": "113596",
      "original_text": "Registerbekanntmachung nach dem Umwandlungsgesetz\nNordrhein-Westfalen Amtsgericht Hamm VR 414\nRuderclub Hamm von 1890 e.V. – Hamm",
      "type": "Registerbekanntmachung nach dem Umwandlungsgesetz",
      "state": "Nordrhein-Westfalen",
      "amtsgericht": "Amtsgericht Hamm",
      "registernummer": "VR 414",
      "registerart": "VR",
      "company_name": "Ruderclub Hamm von 1890 e.V.",
      "company_seat": "Hamm",
      "details": "26.06.2025 (Bekanntmachungsdatum)\n\nNordrhein-Westfalen Amtsgericht Hamm VR 414\nRegisterbekanntmachung nach dem Umwandlungsgesetz 26.06.2025 (Eintragungsdatum)\n\nRuderclub Hamm von 1890 e.V.\neingetragener Verein\nHamm\n\nDen Gläubigern der an der #DV.UmF(Text=\"Bitte wählen Sie die zutreffende Art nach UmwG aus!\",Eingabe=\"Verschmelzung\",\"Aufspaltung\",\"Abspaltung\",\"Ausgliederung\",\"Vermögensübertragung\",\"formwechselnden Umwandlung\") beteiligten Rechtsträger ist, wenn sie binnen sechs Monaten nach dem Tag, an dem die Eintragung der #DV.UmF in das Register des Sitzes #DV.RTr(Text=\"Bitte wählen Sie aus, ob ein oder mehrere andere Rechtsträger betroffen sind!\",Eingabe=\"desjenigen Rechtsträgers, dessen Gläubiger\",\"derjenigen Rechtsträger deren Gläubiger\") sie sind, nach § 19 Absatz 3 UmwG als bekanntgemacht gilt, ihren Anspruch nach Grund und Höhe schriftlich anmelden, Sicherheit zu leisten, soweit sie nicht Befriedigung verlangen können. Dieses Recht steht den Gläubigern jedoch nur zu, wenn sie glaubhaft machen, dass durch die #DV.UmF die Erfüllung ihrer Forderung gefährdet wird."
    },
    {
      "date": "2025-06-26",
      "id": "113597",
      "original_text": "Einreichung neuer Dokumente\nNordrhein-Westfalen Amtsgericht Köln HRB 98200\nExpleo Technology Germany GmbH – Köln",
      "type": "Einreichung neuer Dokumente",
      "state": "Nordrhein-Westfalen",
      "amtsgericht": "Amtsgericht Köln",
      "registernummer": "HRB 98200",
      "registerart": "HRB",
      "company_name": "Expleo Technology Germany GmbH",
      "company_seat": "Köln",
      "details": "26.06.2025 (Bekanntmachungsdatum)\n\nNordrhein-Westfalen Amtsgericht Köln HRB 98200\nEinreichung neuer Dokumente 26.06.2025 (Eintragungsdatum)\n\nExpleo Technology Germany GmbH\nGesellschaft mit beschränkter Haftung\nKöln\n\nDem Registergericht ist eine neue Liste der Mitglieder des Aufsichtsrates eingereicht worden."
    },
    {
      "date": "2025-06-26",
      "id": "113598",
      "original_text": "Registerbekanntmachung nach dem Umwandlungsgesetz\nNordrhein-Westfalen Amtsgericht Bonn HRB 27808\nMedia Scout Multimedia GmbH – Meckenheim",
      "type": "Registerbekanntmachung nach dem Umwandlungsgesetz",
      "state": "Nordrhein-Westfalen",
      "amtsgericht": "Amtsgericht Bonn",
      "registernummer": "HRB 27808",
      "registerart": "HRB",
      "company_name": "Media Scout Multimedia GmbH",
      "company_seat": "Meckenheim",
      "details": "26.06.2025 (Bekanntmachungsdatum)\n\nNordrhein-Westfalen Amtsgericht Bonn HRB 27808\nRegisterbekanntmachung nach dem Umwandlungsgesetz 26.06.2025 (Eintragungsdatum)\n\nMedia Scout Multimedia GmbH\nGesellschaft mit beschränkter Haftung\nMeckenheim\n\nDen Gläubigern der an der Verschmelzung beteiligten Rechtsträger ist, wenn sie binnen sechs Monaten nach dem Tag, an dem die Eintragung der Verschmelzung in das Register des Sitzes derjenigen Rechtsträger deren Gläubiger sie sind, nach § 19 Absatz 3 UmwG als bekanntgemacht gilt, ihren Anspruch nach Grund und Höhe schriftlich anmelden, Sicherheit zu leisten, soweit sie nicht Befriedigung verlangen können. Dieses Recht steht den Gläubigern jedoch nur zu, wenn sie glaubhaft machen, dass durch die Verschmelzung die Erfüllung ihrer Forderung gefährdet wird."
    },
    {
      "date": "2025-06-26",
      "id": "113599",
      "original_text": "Löschungsankündigung\nNordrhein-Westfalen Amtsgericht Wuppertal HRB 34104\nKhouli Transporte GmbH – Solingen",
      "type": "Löschungsankündigung",
      "state": "Nordrhein-Westfalen",
      "amtsgericht": "Amtsgericht Wuppertal",
      "registernummer": "HRB 34104",
      "registerart": "HRB",
      "company_name": "Khouli Transporte GmbH",
      "company_seat": "Solingen",
      "details": "26.06.2025 (Bekanntmachungsdatum)\n\nNordrhein-Westfalen Amtsgericht Wuppertal HRB 34104\nLöschungsankündigung\n\nKhouli Transporte GmbH\nGesellschaft mit beschränkter Haftung\nSolingen\n\nDas Registergericht beabsichtigt die Gesellschaft von Amts wegen nach § 394 FamFG zu löschen. Die Frist zur Erhebung eines Widerspruchs ist auf einen Monat festgesetzt."
    },
    {
      "date": "2025-06-26",
      "id": "113600",
      "original_text": "Registerbekanntmachung nach dem Umwandlungsgesetz\nNordrhein-Westfalen Amtsgericht Gelsenkirchen VR 744\nWestfalia 04 Gelsenkirchen e.V. – Gelsenkirchen",
      "type": "Registerbekanntmachung nach dem Umwandlungsgesetz",
      "state": "Nordrhein-Westfalen",
      "amtsgericht": "Amtsgericht Gelsenkirchen",
      "registernummer": "VR 744",
      "registerart": "VR",
      "company_name": "Westfalia 04 Gelsenkirchen e.V.",
      "company_seat": "Gelsenkirchen",
      "details": "26.06.2025 (Bekanntmachungsdatum)\n\nNordrhein-Westfalen Amtsgericht Gelsenkirchen VR 744\nRegisterbekanntmachung nach dem Umwandlungsgesetz 26.06.2025 (Eintragungsdatum)\n\nWestfalia 04 Gelsenkirchen e.V.\neingetragener Verein\nGelsenkirchen\n\nDen Gläubigern der an der Verschmelzung beteiligten Rechtsträger ist, wenn sie binnen sechs Monaten nach dem Tag, an dem die Eintragung der Verschmelzung in das Register des Sitzes derjenigen Rechtsträger deren Gläubiger sie sind, nach § 19 Absatz 3 UmwG als bekanntgemacht gilt, ihren Anspruch nach Grund und Höhe schriftlich anmelden, Sicherheit zu leisten, soweit sie nicht Befriedigung verlangen können. Dieses Recht steht den Gläubigern jedoch nur zu, wenn sie glaubhaft machen, dass durch die Verschmelzung die Erfüllung ihrer Forderung gefährdet wird."
    },
    {
      "date": "2025-06-26",
      "id": "113601",
      "original_text": "Registerbekanntmachung nach dem Umwandlungsgesetz\nNordrhein-Westfalen Amtsgericht Köln HRB 79091\nempulse GmbH – Köln",
      "type": "Registerbekanntmachung nach dem Umwandlungsgesetz",
      "state": "Nordrhein-Westfalen",
      "amtsgericht": "Amtsgericht Köln",
      "registernummer": "HRB 79091",
      "registerart": "HRB",
      "company_name": "empulse GmbH",
      "company_seat": "Köln",
      "details": "26.06.2025 (Bekanntmachungsdatum)\n\nNordrhein-Westfalen Amtsgericht Köln HRB 79091\nRegisterbekanntmachung nach dem Umwandlungsgesetz 26.06.2025 (Eintragungsdatum)\n\nempulse GmbH\nGesellschaft mit beschränkter Haftung\nKöln\n\nDen Gläubigern der an der Verschmelzung beteiligten Rechtsträger ist, wenn sie binnen sechs Monaten nach dem Tag, an dem die Eintragung der Verschmelzung in das Register des Sitzes desjenigen Rechtsträgers, dessen Gläubiger sie sind, nach § 19 Absatz 3 UmwG als bekanntgemacht gilt, ihren Anspruch nach Grund und Höhe schriftlich anmelden, Sicherheit zu leisten, soweit sie nicht Befriedigung verlangen können. Dieses Recht steht den Gläubigern jedoch nur zu, wenn sie glaubhaft machen, dass durch die Verschmelzung die Erfüllung ihrer Forderung gefährdet wird."
    },
    {
      "date": "2025-06-26",
      "id": "113602",
      "original_text": "Registerbekanntmachung nach dem Umwandlungsgesetz\nNordrhein-Westfalen Amtsgericht Köln HRB 123699\nPortfolio Kaiserslautern I GmbH – Köln",
      "type": "Registerbekanntmachung nach dem Umwandlungsgesetz",
      "state": "Nordrhein-Westfalen",
      "amtsgericht": "Amtsgericht Köln",
      "registernummer": "HRB 123699",
      "registerart": "HRB",
      "company_name": "Portfolio Kaiserslautern I GmbH",
      "company_seat": "Köln",
      "details": "26.06.2025 (Bekanntmachungsdatum)\n\nNordrhein-Westfalen Amtsgericht Köln HRB 123699\nRegisterbekanntmachung nach dem Umwandlungsgesetz 26.06.2025 (Eintragungsdatum)\n\nPortfolio Kaiserslautern I GmbH\nGesellschaft mit beschränkter Haftung\nKöln\n\nDen Gläubigern der an der formwechselnden Umwandlung beteiligten Rechtsträger ist, wenn sie binnen sechs Monaten nach dem Tag, an dem die Eintragung der formwechselnden Umwandlung in das Register des Sitzes desjenigen Rechtsträgers, dessen Gläubiger sie sind, nach § 19 Absatz 3 UmwG als bekanntgemacht gilt, ihren Anspruch nach Grund und Höhe schriftlich anmelden, Sicherheit zu leisten, soweit sie nicht Befriedigung verlangen können. Dieses Recht steht den Gläubigern jedoch nur zu, wenn sie glaubhaft machen, dass durch die formwechselnden Umwandlung die Erfüllung ihrer Forderung gefährdet wird."
    },
    {
      "date": "2025-06-26",
      "id": "113603",
      "original_text": "Löschungsankündigung\nThüringen Amtsgericht Jena HRB 113830\nBär Logistics & Transport GmbH – Erfurt",
      "type": "Löschungsankündigung",
      "state": "Thüringen",
      "amtsgericht": "Amtsgericht Jena",
      "registernummer": "HRB 113830",
      "registerart": "HRB",
      "company_name": "Bär Logistics & Transport GmbH",
      "company_seat": "Erfurt",
      "details": "26.06.2025 (Bekanntmachungsdatum)\n\nThüringen Amtsgericht Jena HRB 113830\nLöschungsankündigung\n\nBär Logistics & Transport GmbH\nGesellschaft mit beschränkter Haftung\nErfurt\n\nDas Registergericht beabsichtigt, die im Handelsregister eingetragene Gesellschaft wegen Vermögenslosigkeit nach § 394 FamFG von Amts wegen zu löschen. Die Frist zur Erhebung eines Widerspruchs gegen die beabsichtigte Löschung wird auf 6 Wochen festgesetzt."
    },
    {
      "date": "2025-06-26",
      "id": "113604",
      "original_text": "Registerbekanntmachung nach dem Umwandlungsgesetz\nHessen Amtsgericht Frankfurt am Main HRB 93143\nBago Immobilienverwaltung GmbH – Frankfurt am Main",
      "type": "Registerbekanntmachung nach dem Umwandlungsgesetz",
      "state": "Hessen",
      "amtsgericht": "Amtsgericht Frankfurt am Main",
      "registernummer": "HRB 93143",
      "registerart": "HRB",
      "company_name": "Bago Immobilienverwaltung GmbH",
      "company_seat": "Frankfurt am Main",
      "details": "26.06.2025 (Bekanntmachungsdatum)\n\nHessen Amtsgericht Frankfurt am Main HRB 93143\nRegisterbekanntmachung nach dem Umwandlungsgesetz 26.06.2025 (Eintragungsdatum)\n\nBago Immobilienverwaltung GmbH\nGesellschaft mit beschränkter Haftung\nFrankfurt am Main\n\nDen Gläubigern der an der Verschmelzung beteiligten Rechtsträger ist, wenn sie binnen sechs Monaten nach dem Tag, an dem die Eintragung der Verschmelzung in das Register des Sitzes desjenigen Rechtsträgers, dessen Gläubiger sie sind, nach § 19 Absatz 3 UmwG bekannt gemacht worden ist, ihren Anspruch nach Grund und Höhe schriftlich anmelden, Sicherheit zu leisten, soweit sie nicht Befriedigung verlangen können. Dieses Recht steht den Gläubigern jedoch nur zu, wenn sie glaubhaft machen, dass durch die Verschmelzung die Erfüllung ihrer Forderung gefährdet wird."
    },
    {
      "date": "2025-06-26",
      "id": "113605",
      "original_text": "Sonstige Registerbekanntmachung\nHessen Amtsgericht Wetzlar VR 4399\nWavesound Herborn e.V. - Verein zur Förderung jugendlicher Musik in Herborn – Herborn",
      "type": "Sonstige Registerbekanntmachung",
      "state": "Hessen",
      "amtsgericht": "Amtsgericht Wetzlar",
      "registernummer": "VR 4399",
      "registerart": "VR",
      "company_name": "Wavesound Herborn e.V. - Verein zur Förderung jugendlicher Musik in Herborn",
      "company_seat": "Herborn",
      "details": "26.06.2025 (Bekanntmachungsdatum)\n\nHessen Amtsgericht Wetzlar VR 4399\nSonstige Registerbekanntmachung 26.06.2025 (Eintragungsdatum)\n\nWavesound Herborn e.V. - Verein zur Förderung jugendlicher Musik in Herborn\neingetragener Verein\nHerborn\n\nDer Verein ist aufgelöst."
    },
    {
      "date": "2025-06-26",
      "id": "113606",
      "original_text": "Löschungsankündigung\nHessen Amtsgericht Darmstadt HRB 98984\nMaher GmbH – Pfungstadt",
      "type": "Löschungsankündigung",
      "state": "Hessen",
      "amtsgericht": "Amtsgericht Darmstadt",
      "registernummer": "HRB 98984",
      "registerart": "HRB",
      "company_name": "Maher GmbH",
      "company_seat": "Pfungstadt",
      "details": "26.06.2025 (Bekanntmachungsdatum)\n\nHessen Amtsgericht Darmstadt HRB 98984\nLöschungsankündigung 26.06.2025 (Eintragungsdatum)\n\nMaher GmbH\nGesellschaft mit beschränkter Haftung\nPfungstadt\n\nDas Registergericht beabsichtigt die im Handelsregister eingetragene Gesellschaft von Amts wegen nach § 394 FamFG zu löschen. Die Frist zur Erhebung eines Widerspruchs gegen die beabsichtigte Löschung wird auf 3 Monate festgesetzt."
    },
    {
      "date": "2025-06-26",
      "id": "113607",
      "original_text": "Registerbekanntmachung nach dem Umwandlungsgesetz\nHessen Amtsgericht Wiesbaden HRB 12913\nArjo Deutschland GmbH – Wiesbaden",
      "type": "Registerbekanntmachung nach dem Umwandlungsgesetz",
      "state": "Hessen",
      "amtsgericht": "Amtsgericht Wiesbaden",
      "registernummer": "HRB 12913",
      "registerart": "HRB",
      "company_name": "Arjo Deutschland GmbH",
      "company_seat": "Wiesbaden",
      "details": "26.06.2025 (Bekanntmachungsdatum)\n\nHessen Amtsgericht Wiesbaden HRB 12913\nRegisterbekanntmachung nach dem Umwandlungsgesetz 26.06.2025 (Eintragungsdatum)\n\nArjo Deutschland GmbH\nGesellschaft mit beschränkter Haftung\nWiesbaden\n\nDen Gläubigern der an der Verschmelzung beteiligten Rechtsträger ist, wenn sie binnen sechs Monaten nach dem Tag, an dem die Eintragung der Verschmelzung in das Register des Sitzes derjenigen Rechtsträger deren Gläubiger sie sind, nach § 19 Absatz 3 UmwG bekannt gemacht worden ist, ihren Anspruch nach Grund und Höhe schriftlich anmelden, Sicherheit zu leisten, soweit sie nicht Befriedigung verlangen können. Dieses Recht steht den Gläubigern jedoch nur zu, wenn sie glaubhaft machen, dass durch die Verschmelzung die Erfüllung ihrer Forderung gefährdet wird."
    },
    {
      "date": "2025-06-26",
      "id": "113608",
      "original_text": "Löschungsankündigung\nHessen Amtsgericht Frankfurt am Main HRB 109155\nAlin GmbH – Frankfurt am Main",
      "type": "Löschungsankündigung",
      "state": "Hessen",
      "amtsgericht": "Amtsgericht Frankfurt am Main",
      "registernummer": "HRB 109155",
      "registerart": "HRB",
      "company_name": "Alin GmbH",
      "company_seat": "Frankfurt am Main",
      "details": "26.06.2025 (Bekanntmachungsdatum)\n\nHessen Amtsgericht Frankfurt am Main HRB 109155\nLöschungsankündigung\n\nAlin GmbH\nGesellschaft mit beschränkter Haftung\nFrankfurt am Main\n\nDas Registergericht beabsichtigt die im Handelsregister eingetragene Gesellschaft von Amts wegen nach § 394 FamFG zu löschen. Die Frist zur Erhebung eines Widerspruchs gegen die beabsichtigte Löschung wird auf 1 Monat festgesetzt."
    },
    {
      "date": "2025-06-26",
      "id": "113609",
      "original_text": "Löschungsankündigung\nHessen Amtsgericht Frankfurt am Main HRB 92251\nCleanrapid Gebäudeservice UG (haftungsbeschränkt) – Frankfurt am Main",
      "type": "Löschungsankündigung",
      "state": "Hessen",
      "amtsgericht": "Amtsgericht Frankfurt am Main",
      "registernummer": "HRB 92251",
      "registerart": "HRB",
      "company_name": "Cleanrapid Gebäudeservice UG (haftungsbeschränkt)",
      "company_seat": "Frankfurt am Main",
      "details": "26.06.2025 (Bekanntmachungsdatum)\n\nHessen Amtsgericht Frankfurt am Main HRB 92251\nLöschungsankündigung\n\nCleanrapid Gebäudeservice UG (haftungsbeschränkt)\nGesellschaft mit beschränkter Haftung\nFrankfurt am Main\n\nDas Registergericht beabsichtigt die im Handelsregister eingetragene Gesellschaft von Amts wegen nach § 394 FamFG zu löschen. Die Frist zur Erhebung eines Widerspruchs gegen die beabsichtigte Löschung wird auf 1 Monat festgesetzt."
    },
    {
      "date": "2025-06-26",
      "id": "113610",
      "original_text": "Registerbekanntmachung nach dem Umwandlungsgesetz\nHessen Amtsgericht Frankfurt am Main HRB 110382\nSpaceping Technologies GmbH – Frankfurt am Main",
      "type": "Registerbekanntmachung nach dem Umwandlungsgesetz",
      "state": "Hessen",
      "amtsgericht": "Amtsgericht Frankfurt am Main",
      "registernummer": "HRB 110382",
      "registerart": "HRB",
      "company_name": "Spaceping Technologies GmbH",
      "company_seat": "Frankfurt am Main",
      "details": "26.06.2025 (Bekanntmachungsdatum)\n\nHessen Amtsgericht Frankfurt am Main HRB 110382\nRegisterbekanntmachung nach dem Umwandlungsgesetz 26.06.2025 (Eintragungsdatum)\n\nSpaceping Technologies GmbH\nGesellschaft mit beschränkter Haftung\nFrankfurt am Main\n\nDen Gläubigern der an der Verschmelzung beteiligten Rechtsträger ist, wenn sie binnen sechs Monaten nach dem Tag, an dem die Eintragung der Verschmelzung in das Register des Sitzes derjenigen Rechtsträger deren Gläubiger sie sind, nach § 19 Absatz 3 UmwG bekannt gemacht worden ist, ihren Anspruch nach Grund und Höhe schriftlich anmelden, Sicherheit zu leisten, soweit sie nicht Befriedigung verlangen können. Dieses Recht steht den Gläubigern jedoch nur zu, wenn sie glaubhaft machen, dass durch die Verschmelzung die Erfüllung ihrer Forderung gefährdet wird."
    },
    {
      "date": "2025-06-26",
      "id": "113611",
      "original_text": "Registerbekanntmachung nach dem Umwandlungsgesetz\nHessen Amtsgericht Frankfurt am Main HRB 93143\nBago Immobilienverwaltung GmbH – Frankfurt am Main",
      "type": "Registerbekanntmachung nach dem Umwandlungsgesetz",
      "state": "Hessen",
      "amtsgericht": "Amtsgericht Frankfurt am Main",
      "registernummer": "HRB 93143",
      "registerart": "HRB",
      "company_name": "Bago Immobilienverwaltung GmbH",
      "company_seat": "Frankfurt am Main",
      "details": "26.06.2025 (Bekanntmachungsdatum)\n\nHessen Amtsgericht Frankfurt am Main HRB 93143\nRegisterbekanntmachung nach dem Umwandlungsgesetz 26.06.2025 (Eintragungsdatum)\n\nBago Immobilienverwaltung GmbH\nGesellschaft mit beschränkter Haftung\nFrankfurt am Main\n\nDen Gläubigern der an der Verschmelzung beteiligten Rechtsträger ist, wenn sie binnen sechs Monaten nach dem Tag, an dem die Eintragung der Verschmelzung in das Register des Sitzes desjenigen Rechtsträgers, dessen Gläubiger sie sind, nach § 19 Absatz 3 UmwG bekannt gemacht worden ist, ihren Anspruch nach Grund und Höhe schriftlich anmelden, Sicherheit zu leisten, soweit sie nicht Befriedigung verlangen können. Dieses Recht steht den Gläubigern jedoch nur zu, wenn sie glaubhaft machen, dass durch die Verschmelzung die Erfüllung ihrer Forderung gefährdet wird."
    },
    {
      "date": "2025-06-26",
      "id": "113612",
      "original_text": "Registerbekanntmachung nach dem Umwandlungsgesetz\nHessen Amtsgericht Friedberg HRB 9340\nDentalTiger GmbH – Büdingen",
      "type": "Registerbekanntmachung nach dem Umwandlungsgesetz",
      "state": "Hessen",
      "amtsgericht": "Amtsgericht Friedberg",
      "registernummer": "HRB 9340",
      "registerart": "HRB",
      "company_name": "DentalTiger GmbH",
      "company_seat": "Büdingen",
      "details": "26.06.2025 (Bekanntmachungsdatum)\n\nHessen Amtsgericht Friedberg HRB 9340\nRegisterbekanntmachung nach dem Umwandlungsgesetz 26.06.2025 (Eintragungsdatum)\n\nDentalTiger GmbH\nGesellschaft mit beschränkter Haftung\nBüdingen\n\nDen Gläubigern der an der Verschmelzung beteiligten Rechtsträger ist, wenn sie binnen sechs Monaten nach dem Tag, an dem die Eintragung der Verschmelzung in das Register des Sitzes desjenigen Rechtsträgers, dessen Gläubiger sie sind, nach § 19 Absatz 3 UmwG bekannt gemacht worden ist, ihren Anspruch nach Grund und Höhe schriftlich anmelden, Sicherheit zu leisten, soweit sie nicht Befriedigung verlangen können. Dieses Recht steht den Gläubigern jedoch nur zu, wenn sie glaubhaft machen, dass durch die Verschmelzung die Erfüllung ihrer Forderung gefährdet wird."
    },
    {
      "date": "2025-06-26",
      "id": "113613",
      "original_text": "Registerbekanntmachung nach dem Umwandlungsgesetz\nHessen Amtsgericht Frankfurt am Main HRB 109473\nBPAH 1/3 GmbH – Frankfurt am Main",
      "type": "Registerbekanntmachung nach dem Umwandlungsgesetz",
      "state": "Hessen",
      "amtsgericht": "Amtsgericht Frankfurt am Main",
      "registernummer": "HRB 109473",
      "registerart": "HRB",
      "company_name": "BPAH 1/3 GmbH",
      "company_seat": "Frankfurt am Main",
      "details": "26.06.2025 (Bekanntmachungsdatum)\n\nHessen Amtsgericht Frankfurt am Main HRB 109473\nRegisterbekanntmachung nach dem Umwandlungsgesetz 26.06.2025 (Eintragungsdatum)\n\nBPAH 1/3 GmbH\nGesellschaft mit beschränkter Haftung\nFrankfurt am Main\n\nDen Gläubigern der an der Verschmelzung beteiligten Rechtsträger ist, wenn sie binnen sechs Monaten nach dem Tag, an dem die Eintragung der Verschmelzung in das Register des Sitzes desjenigen Rechtsträgers, dessen Gläubiger sie sind, nach § 19 Absatz 3 UmwG bekannt gemacht worden ist, ihren Anspruch nach Grund und Höhe schriftlich anmelden, Sicherheit zu leisten, soweit sie nicht Befriedigung verlangen können. Dieses Recht steht den Gläubigern jedoch nur zu, wenn sie glaubhaft machen, dass durch die Verschmelzung die Erfüllung ihrer Forderung gefährdet wird."
    },
    {
      "date": "2025-06-26",
      "id": "113614",
      "original_text": "Löschungsankündigung\nHessen Amtsgericht Kassel VR 1799\nEspenauer Mandolinenclub Wanderfreunde 1922 Mönchehof – Espenau",
      "type": "Löschungsankündigung",
      "state": "Hessen",
      "amtsgericht": "Amtsgericht Kassel",
      "registernummer": "VR 1799",
      "registerart": "VR",
      "company_name": "Espenauer Mandolinenclub Wanderfreunde 1922 Mönchehof",
      "company_seat": "Espenau",
      "details": "26.06.2025 (Bekanntmachungsdatum)\n\nHessen Amtsgericht Kassel VR 1799\nLöschungsankündigung\n\nEspenauer Mandolinenclub Wanderfreunde 1922 Mönchehof\neingetragener Verein\nEspenau\n\nDas Registergericht geht davon aus, dass der Verein durch Wegfall sämtlicher Mitglieder erloschen ist. Es ist daher beabsichtigt, den Verein von Amts wegen im Vereinsregister zu löschen.\nEs wird Gelegenheit gegeben, der beabsichtigten Löschung binnen 2 Monaten zu widersprechen. Dies kann schriftlich oder zu Protokoll der Geschäftsstelle bei dem Registergericht des Amtsgerichts Kassel, Friedrichsstraße 32-34, 34117 Kassel innerhalb von 2 Monaten ab Veröffentlichung dieser Löschungsankündigung geschehen."
    },
    {
      "date": "2025-06-26",
      "id": "113615",
      "original_text": "Sonstige Registerbekanntmachung\nHessen Amtsgericht Bad Homburg v.d.H. VR 2200\nZum Wohle des Menschen; freier Handel.- gesund leben und wohnen – Friedrichsdorf",
      "type": "Sonstige Registerbekanntmachung",
      "state": "Hessen",
      "amtsgericht": "Amtsgericht Bad Homburg v.d.H.",
      "registernummer": "VR 2200",
      "registerart": "VR",
      "company_name": "Zum Wohle des Menschen; freier Handel.- gesund leben und wohnen",
      "company_seat": "Friedrichsdorf",
      "details": "26.06.2025 (Bekanntmachungsdatum)\n\nHessen Amtsgericht Bad Homburg v.d.H. VR 2200\nSonstige Registerbekanntmachung 26.06.2025 (Eintragungsdatum)\n\nZum Wohle des Menschen; freier Handel.- gesund leben und wohnen\neingetragener Verein\nFriedrichsdorf\n\nDer Verein ist aufgelöst."
    },
    {
      "date": "2025-06-26",
      "id": "113616",
      "original_text": "Registerbekanntmachung nach dem Umwandlungsgesetz\nHessen Amtsgericht Frankfurt am Main HRB 110691\nMusikantenweg GmbH – Frankfurt am Main",
      "type": "Registerbekanntmachung nach dem Umwandlungsgesetz",
      "state": "Hessen",
      "amtsgericht": "Amtsgericht Frankfurt am Main",
      "registernummer": "HRB 110691",
      "registerart": "HRB",
      "company_name": "Musikantenweg GmbH",
      "company_seat": "Frankfurt am Main",
      "details": "26.06.2025 (Bekanntmachungsdatum)\n\nHessen Amtsgericht Frankfurt am Main HRB 110691\nRegisterbekanntmachung nach dem Umwandlungsgesetz 26.06.2025 (Eintragungsdatum)\n\nMusikantenweg GmbH\nGesellschaft mit beschränkter Haftung\nFrankfurt am Main\n\nDen Gläubigern der an der Verschmelzung beteiligten Rechtsträger ist, wenn sie binnen sechs Monaten nach dem Tag, an dem die Eintragung der Verschmelzung in das Register des Sitzes desjenigen Rechtsträgers, dessen Gläubiger sie sind, nach § 19 Absatz 3 UmwG bekannt gemacht worden ist, ihren Anspruch nach Grund und Höhe schriftlich anmelden, Sicherheit zu leisten, soweit sie nicht Befriedigung verlangen können. Dieses Recht steht den Gläubigern jedoch nur zu, wenn sie glaubhaft machen, dass durch die Verschmelzung die Erfüllung ihrer Forderung gefährdet wird."
    },
    {
      "date": "2025-06-26",
      "id": "113617",
      "original_text": "Löschungsankündigung\nHessen Amtsgericht Offenbach am Main HRB 41905\nFair Pay GmbH – Obertshausen",
      "type": "Löschungsankündigung",
      "state": "Hessen",
      "amtsgericht": "Amtsgericht Offenbach am Main",
      "registernummer": "HRB 41905",
      "registerart": "HRB",
      "company_name": "Fair Pay GmbH",
      "company_seat": "Obertshausen",
      "details": "26.06.2025 (Bekanntmachungsdatum)\n\nHessen Amtsgericht Offenbach am Main HRB 41905\nLöschungsankündigung\n\nFair Pay GmbH\nGesellschaft mit beschränkter Haftung\nObertshausen\n\nDas Registergericht beabsichtigt die im Handelsregister eingetragene Gesellschaft von Amts wegen nach § 394 FamFG zu löschen. Die Frist zur Erhebung eines Widerspruchs gegen die beabsichtigte Löschung wird auf 3 Monate festgesetzt."
    },
    {
      "date": "2025-06-26",
      "id": "113618",
      "original_text": "Löschungsankündigung\nHessen Amtsgericht Friedberg HRB 7862\nNidda-Jungbrunnen GmbH – Nidda-Bad Salzhausen",
      "type": "Löschungsankündigung",
      "state": "Hessen",
      "amtsgericht": "Amtsgericht Friedberg",
      "registernummer": "HRB 7862",
      "registerart": "HRB",
      "company_name": "Nidda-Jungbrunnen GmbH",
      "company_seat": "Nidda-Bad Salzhausen",
      "details": "26.06.2025 (Bekanntmachungsdatum)\n\nHessen Amtsgericht Friedberg HRB 7862\nLöschungsankündigung\n\nNidda-Jungbrunnen GmbH\nGesellschaft mit beschränkter Haftung\nNidda-Bad Salzhausen\n\nDas Registergericht beabsichtigt die im Handelsregister eingetragene Gesellschaft von Amts wegen nach § 394 FamFG zu löschen. Die Frist zur Erhebung eines Widerspruchs gegen die beabsichtigte Löschung wird auf 3 Monate festgesetzt."
    },
    {
      "date": "2025-06-26",
      "id": "113619",
      "original_text": "Registerbekanntmachung nach dem Umwandlungsgesetz\nHessen Amtsgericht Frankfurt am Main HRB 109696\nOK Venture GmbH – Frankfurt am Main",
      "type": "Registerbekanntmachung nach dem Umwandlungsgesetz",
      "state": "Hessen",
      "amtsgericht": "Amtsgericht Frankfurt am Main",
      "registernummer": "HRB 109696",
      "registerart": "HRB",
      "company_name": "OK Venture GmbH",
      "company_seat": "Frankfurt am Main",
      "details": "26.06.2025 (Bekanntmachungsdatum)\n\nHessen Amtsgericht Frankfurt am Main HRB 109696\nRegisterbekanntmachung nach dem Umwandlungsgesetz 26.06.2025 (Eintragungsdatum)\n\nOK Venture GmbH\nGesellschaft mit beschränkter Haftung\nFrankfurt am Main\n\nDen Gläubigern der an der Verschmelzung beteiligten Rechtsträger ist, wenn sie binnen sechs Monaten nach dem Tag, an dem die Eintragung der Verschmelzung in das Register des Sitzes derjenigen Rechtsträger deren Gläubiger sie sind, nach § 19 Absatz 3 UmwG bekannt gemacht worden ist, ihren Anspruch nach Grund und Höhe schriftlich anmelden, Sicherheit zu leisten, soweit sie nicht Befriedigung verlangen können. Dieses Recht steht den Gläubigern jedoch nur zu, wenn sie glaubhaft machen, dass durch die Verschmelzung die Erfüllung ihrer Forderung gefährdet wird."
    },
    {
      "date": "2025-06-26",
      "id": "87",
      "original_text": "Sonderregisterbekanntmachung OHNE Bezug zum elektr. Register\nSachsen Amtsgericht Chemnitz\n93 AR 810/25\nKoernerhoehe Vermoegensverwaltung Limited, Birmingham",
      "type": "Sonderregisterbekanntmachung OHNE Bezug zum elektr. Register",
      "state": "Sachsen",
      "amtsgericht": "Amtsgericht Chemnitz",
      "company_name": "Koernerhoehe Vermoegensverwaltung Limited, Birmingham",
      "sonderegister_referenz": "93 AR 810/25",
      "details": "26.06.2025 (Bekanntmachungsdatum)\n\nSachsen Amtsgericht Chemnitz\n93 AR 810/25\nSonderregisterbekanntmachung OHNE Bezug zum elektr. Register\n\nKoernerhoehe Vermoegensverwaltung Limited, Birmingham\n\nAmtsgericht Chemnitz; AZ: 93 AR 810/25\nAntrag auf Nachtragsliquidation\n\n26.06.2025\n\nFür die vormals im britischen Handels-/Firmenregister Companies House unter Nr. 06543432 eingetragene Gesellschaft Koernerhoehe Vermögensverwaltung Limited, Birmingham (letzte Geschäftsanschrift: Cornwall Buildings 45 Newhall Street, 1st Floor Suite 104, Birmingham, United Kingdom, B3 3QR wurde beim Amtsgericht Chemnitz (Deutschland)- Registergericht- unter dem Aktenzeichen 91 AR 810/25 am 14.05.2024 ein Antrag auf Bestellung eines Nachtragsliquidators gestellt. Für die vormaligen Gesellschafter der Koernerhoehe Vermögensverwaltung Limited; Birmingham wird hiermit Gelegenheit zur Stellungnahme bis zum 25.07.2025 gegeben."
    }
  ]
}