{
  "date": "2025-06-28",
  "date_of_scrape": "2025-06-29T04:13:55.053Z",
  "tool_version": "0.2.0",
  "number_of_announcements": 30,
  "announcements": [
    {
      "date": "2025-06-28",
      "id": "113784",
      "original_text": "Registerbekanntmachung nach dem Umwandlungsgesetz\nBayern Amtsgericht Augsburg HRB 38218\nLight International GmbH – Friedberg",
      "type": "Registerbekanntmachung nach dem Umwandlungsgesetz",
      "state": "Bayern",
      "amtsgericht": "Amtsgericht Augsburg",
      "registernummer": "HRB 38218",
      "registerart": "HRB",
      "company_name": "Light International GmbH",
      "company_seat": "Friedberg",
      "details": "28.06.2025 (Bekanntmachungsdatum)\n\nBayern Amtsgericht Augsburg HRB 38218\nRegisterbekanntmachung nach dem Umwandlungsgesetz 27.06.2025 (Eintragungsdatum)\n\nLight International GmbH\nGesellschaft mit beschränkter Haftung\nFriedberg\n\nDen Gläubigern der an der Verschmelzung beteiligten Rechtsträger ist, wenn sie binnen sechs Monaten nach dem Tag, an dem die Eintragung der Verschmelzung in das Register des Sitzes desjenigen Rechtsträgers, dessen Gläubiger sie sind, nach § 19 Abs. 3 UmwG als bekannt gemacht gilt, ihren Anspruch nach Grund und Höhe in Textform anmelden, Sicherheit zu leisten, soweit sie nicht Befriedigung verlangen können. Dieses Recht steht den Gläubigern jedoch nur zu, wenn sie glaubhaft machen, dass durch die Verschmelzung die Erfüllung ihrer Forderung gefährdet wird."
    },
    {
      "date": "2025-06-28",
      "id": "113785",
      "original_text": "Registerbekanntmachung nach dem Umwandlungsgesetz\nBayern Amtsgericht München HRB 285837\nRuhrgebiets Immobilien Verwaltungs GmbH – Rottach-Egern",
      "type": "Registerbekanntmachung nach dem Umwandlungsgesetz",
      "state": "Bayern",
      "amtsgericht": "Amtsgericht München",
      "registernummer": "HRB 285837",
      "registerart": "HRB",
      "company_name": "Ruhrgebiets Immobilien Verwaltungs GmbH",
      "company_seat": "Rottach-Egern",
      "details": "28.06.2025 (Bekanntmachungsdatum)\n\nBayern Amtsgericht München HRB 285837\nRegisterbekanntmachung nach dem Umwandlungsgesetz 27.06.2025 (Eintragungsdatum)\n\nRuhrgebiets Immobilien Verwaltungs GmbH\nGesellschaft mit beschränkter Haftung\nRottach-Egern\n\nDen Gläubigern der an der Verschmelzung beteiligten Rechtsträger ist, wenn sie binnen sechs Monaten nach dem Tag, an dem die Eintragung der Verschmelzung in das Register des Sitzes desjenigen Rechtsträgers, dessen Gläubiger sie sind, nach § 19 Abs. 3 UmwG als bekannt gemacht gilt, ihren Anspruch nach Grund und Höhe in Textform anmelden, Sicherheit zu leisten, soweit sie nicht Befriedigung verlangen können. Dieses Recht steht den Gläubigern jedoch nur zu, wenn sie glaubhaft machen, dass durch die Verschmelzung die Erfüllung ihrer Forderung gefährdet wird."
    },
    {
      "date": "2025-06-28",
      "id": "113786",
      "original_text": "Registerbekanntmachung nach dem Umwandlungsgesetz\nBayern Amtsgericht Würzburg HRB 2643\nWilms GmbH – Wiesentheid",
      "type": "Registerbekanntmachung nach dem Umwandlungsgesetz",
      "state": "Bayern",
      "amtsgericht": "Amtsgericht Würzburg",
      "registernummer": "HRB 2643",
      "registerart": "HRB",
      "company_name": "Wilms GmbH",
      "company_seat": "Wiesentheid",
      "details": "28.06.2025 (Bekanntmachungsdatum)\n\nBayern Amtsgericht Würzburg HRB 2643\nRegisterbekanntmachung nach dem Umwandlungsgesetz 27.06.2025 (Eintragungsdatum)\n\nWilms GmbH\nGesellschaft mit beschränkter Haftung\nWiesentheid\n\nDen Gläubigern der an der Verschmelzung beteiligten Rechtsträger ist, wenn sie binnen sechs Monaten nach dem Tag, an dem die Eintragung der Verschmelzung in das Register des Sitzes desjenigen Rechtsträgers, dessen Gläubiger sie sind, nach § 19 Abs. 3 UmwG als bekannt gemacht gilt, ihren Anspruch nach Grund und Höhe in Textform anmelden, Sicherheit zu leisten, soweit sie nicht Befriedigung verlangen können. Dieses Recht steht den Gläubigern jedoch nur zu, wenn sie glaubhaft machen, dass durch die Verschmelzung die Erfüllung ihrer Forderung gefährdet wird."
    },
    {
      "date": "2025-06-28",
      "id": "113787",
      "original_text": "Registerbekanntmachung nach dem Umwandlungsgesetz\nBayern Amtsgericht Amberg HRB 1907\nSCHLÖGL Maschinen- & Fahrzeugbau GmbH – Wernberg-Köblitz",
      "type": "Registerbekanntmachung nach dem Umwandlungsgesetz",
      "state": "Bayern",
      "amtsgericht": "Amtsgericht Amberg",
      "registernummer": "HRB 1907",
      "registerart": "HRB",
      "company_name": "SCHLÖGL Maschinen- & Fahrzeugbau GmbH",
      "company_seat": "Wernberg-Köblitz",
      "details": "28.06.2025 (Bekanntmachungsdatum)\n\nBayern Amtsgericht Amberg HRB 1907\nRegisterbekanntmachung nach dem Umwandlungsgesetz 27.06.2025 (Eintragungsdatum)\n\nSCHLÖGL Maschinen- & Fahrzeugbau GmbH\nGesellschaft mit beschränkter Haftung\nWernberg-Köblitz\n\nDen Gläubigern der an der Verschmelzung beteiligten Rechtsträger ist, wenn sie binnen sechs Monaten nach dem Tag, an dem die Eintragung der Verschmelzung in das Register des Sitzes desjenigen Rechtsträgers, dessen Gläubiger sie sind, nach § 19 Abs. 3 UmwG als bekannt gemacht gilt, ihren Anspruch nach Grund und Höhe in Textform anmelden, Sicherheit zu leisten, soweit sie nicht Befriedigung verlangen können. Dieses Recht steht den Gläubigern jedoch nur zu, wenn sie glaubhaft machen, dass durch die Verschmelzung die Erfüllung ihrer Forderung gefährdet wird."
    },
    {
      "date": "2025-06-28",
      "id": "113788",
      "original_text": "Registerbekanntmachung nach dem Umwandlungsgesetz\nBayern Amtsgericht München HRB 160079\nRadio Media Süd GmbH – München",
      "type": "Registerbekanntmachung nach dem Umwandlungsgesetz",
      "state": "Bayern",
      "amtsgericht": "Amtsgericht München",
      "registernummer": "HRB 160079",
      "registerart": "HRB",
      "company_name": "Radio Media Süd GmbH",
      "company_seat": "München",
      "details": "28.06.2025 (Bekanntmachungsdatum)\n\nBayern Amtsgericht München HRB 160079\nRegisterbekanntmachung nach dem Umwandlungsgesetz 27.06.2025 (Eintragungsdatum)\n\nRadio Media Süd GmbH\nGesellschaft mit beschränkter Haftung\nMünchen\n\nDen Gläubigern der an der Verschmelzung beteiligten Rechtsträger ist, wenn sie binnen sechs Monaten nach dem Tag, an dem die Eintragung der Verschmelzung in das Register des Sitzes desjenigen Rechtsträgers, dessen Gläubiger sie sind, nach § 19 Abs. 3 UmwG als bekannt gemacht gilt, ihren Anspruch nach Grund und Höhe in Textform anmelden, Sicherheit zu leisten, soweit sie nicht Befriedigung verlangen können. Dieses Recht steht den Gläubigern jedoch nur zu, wenn sie glaubhaft machen, dass durch die Verschmelzung die Erfüllung ihrer Forderung gefährdet wird."
    },
    {
      "date": "2025-06-28",
      "id": "113789",
      "original_text": "Registerbekanntmachung nach dem Umwandlungsgesetz\nBayern Amtsgericht München HRB 164537\nSunrise International GmbH – Berg",
      "type": "Registerbekanntmachung nach dem Umwandlungsgesetz",
      "state": "Bayern",
      "amtsgericht": "Amtsgericht München",
      "registernummer": "HRB 164537",
      "registerart": "HRB",
      "company_name": "Sunrise International GmbH",
      "company_seat": "Berg",
      "details": "28.06.2025 (Bekanntmachungsdatum)\n\nBayern Amtsgericht München HRB 164537\nRegisterbekanntmachung nach dem Umwandlungsgesetz 27.06.2025 (Eintragungsdatum)\n\nSunrise International GmbH\nGesellschaft mit beschränkter Haftung\nBerg\n\nDen Gläubigern der an der Verschmelzung beteiligten Rechtsträger ist, wenn sie binnen sechs Monaten nach dem Tag, an dem die Eintragung der Verschmelzung in das Register des Sitzes desjenigen Rechtsträgers, dessen Gläubiger sie sind, nach § 19 Abs. 3 UmwG als bekannt gemacht gilt, ihren Anspruch nach Grund und Höhe in Textform anmelden, Sicherheit zu leisten, soweit sie nicht Befriedigung verlangen können. Dieses Recht steht den Gläubigern jedoch nur zu, wenn sie glaubhaft machen, dass durch die Verschmelzung die Erfüllung ihrer Forderung gefährdet wird."
    },
    {
      "date": "2025-06-28",
      "id": "113790",
      "original_text": "Löschungsankündigung\nBayern Amtsgericht München HRA 107299\nHubertusstraße 27 GmbH & Co. KG – Grünwald",
      "type": "Löschungsankündigung",
      "state": "Bayern",
      "amtsgericht": "Amtsgericht München",
      "registernummer": "HRA 107299",
      "registerart": "HRA",
      "company_name": "Hubertusstraße 27 GmbH & Co. KG",
      "company_seat": "Grünwald",
      "details": "28.06.2025 (Bekanntmachungsdatum)\n\nBayern Amtsgericht München HRA 107299\nLöschungsankündigung\n\nHubertusstraße 27 GmbH & Co. KG\nKommanditgesellschaft\nGrünwald\n\nDas Registergericht beabsichtigt, die im Handelsregister eingetragene Firma von Amts wegen nach § 31 Abs. 2 HGB zu löschen. Die Frist zur Erhebung eines Widerspruchs ist auf drei Monate festgesetzt."
    },
    {
      "date": "2025-06-28",
      "id": "113791",
      "original_text": "Registerbekanntmachung nach dem Umwandlungsgesetz\nBayern Amtsgericht Augsburg HRB 32269\nPROLED Group GmbH – Friedberg",
      "type": "Registerbekanntmachung nach dem Umwandlungsgesetz",
      "state": "Bayern",
      "amtsgericht": "Amtsgericht Augsburg",
      "registernummer": "HRB 32269",
      "registerart": "HRB",
      "company_name": "PROLED Group GmbH",
      "company_seat": "Friedberg",
      "details": "28.06.2025 (Bekanntmachungsdatum)\n\nBayern Amtsgericht Augsburg HRB 32269\nRegisterbekanntmachung nach dem Umwandlungsgesetz 27.06.2025 (Eintragungsdatum)\n\nPROLED Group GmbH\nGesellschaft mit beschränkter Haftung\nFriedberg\n\nDen Gläubigern der an der Verschmelzung beteiligten Rechtsträger ist, wenn sie binnen sechs Monaten nach dem Tag, an dem die Eintragung der Verschmelzung in das Register des Sitzes desjenigen Rechtsträgers, dessen Gläubiger sie sind, nach § 19 Abs. 3 UmwG als bekannt gemacht gilt, ihren Anspruch nach Grund und Höhe in Textform anmelden, Sicherheit zu leisten, soweit sie nicht Befriedigung verlangen können. Dieses Recht steht den Gläubigern jedoch nur zu, wenn sie glaubhaft machen, dass durch die Verschmelzung die Erfüllung ihrer Forderung gefährdet wird."
    },
    {
      "date": "2025-06-28",
      "id": "113792",
      "original_text": "Einreichung neuer Dokumente\nBayern Amtsgericht München HRB 67295\nMGH-Münchner Gewerbehof- und Technologiezentrumsgesellschaft mbH – München",
      "type": "Einreichung neuer Dokumente",
      "state": "Bayern",
      "amtsgericht": "Amtsgericht München",
      "registernummer": "HRB 67295",
      "registerart": "HRB",
      "company_name": "MGH-Münchner Gewerbehof- und Technologiezentrumsgesellschaft mbH",
      "company_seat": "München",
      "details": "28.06.2025 (Bekanntmachungsdatum)\n\nBayern Amtsgericht München HRB 67295\nEinreichung neuer Dokumente\n\nMGH-Münchner Gewerbehof- und Technologiezentrumsgesellschaft mbH\nGesellschaft mit beschränkter Haftung\nMünchen\n\nDem #Re.Name ist eine Liste der Mitglieder des Aufsichtsrats eingereicht worden, § 52 Abs. 3 S. 2 GmbHG."
    },
    {
      "date": "2025-06-28",
      "id": "113793",
      "original_text": "Löschungsankündigung\nBayern Amtsgericht Kempten (Allgäu) HRA 10488\nHBS Holzbausysteme Verwaltungs KG – Immenstadt i. Allgäu",
      "type": "Löschungsankündigung",
      "state": "Bayern",
      "amtsgericht": "Amtsgericht Kempten (Allgäu)",
      "registernummer": "HRA 10488",
      "registerart": "HRA",
      "company_name": "HBS Holzbausysteme Verwaltungs KG",
      "company_seat": "Immenstadt i. Allgäu",
      "details": "28.06.2025 (Bekanntmachungsdatum)\n\nBayern Amtsgericht Kempten (Allgäu) HRA 10488\nLöschungsankündigung\n\nHBS Holzbausysteme Verwaltungs KG\nKommanditgesellschaft\nImmenstadt i. Allgäu\n\nDas Registergericht beabsichtigt, die im Handelsregister eingetragene Gesellschaft wegen Vermögenslosigkeit von Amts wegen nach § 394 FamFG zu löschen. Die Frist zur Erhebung eines Widerspruchs ist auf einen Monat festgesetzt."
    },
    {
      "date": "2025-06-28",
      "id": "113794",
      "original_text": "Registerbekanntmachung nach dem Umwandlungsgesetz\nBayern Amtsgericht Nürnberg HRB 31938\nNEWS5 GmbH – Nürnberg",
      "type": "Registerbekanntmachung nach dem Umwandlungsgesetz",
      "state": "Bayern",
      "amtsgericht": "Amtsgericht Nürnberg",
      "registernummer": "HRB 31938",
      "registerart": "HRB",
      "company_name": "NEWS5 GmbH",
      "company_seat": "Nürnberg",
      "details": "28.06.2025 (Bekanntmachungsdatum)\n\nBayern Amtsgericht Nürnberg HRB 31938\nRegisterbekanntmachung nach dem Umwandlungsgesetz 27.06.2025 (Eintragungsdatum)\n\nNEWS5 GmbH\nGesellschaft mit beschränkter Haftung\nNürnberg\n\nDen Gläubigern der an der Verschmelzung beteiligten Rechtsträger ist, wenn sie binnen sechs Monaten nach dem Tag, an dem die Eintragung der Verschmelzung in das Register des Sitzes desjenigen Rechtsträgers, dessen Gläubiger sie sind, nach § 19 Abs. 3 UmwG als bekannt gemacht gilt, ihren Anspruch nach Grund und Höhe in Textform anmelden, Sicherheit zu leisten, soweit sie nicht Befriedigung verlangen können. Dieses Recht steht den Gläubigern jedoch nur zu, wenn sie glaubhaft machen, dass durch die Verschmelzung die Erfüllung ihrer Forderung gefährdet wird."
    },
    {
      "date": "2025-06-28",
      "id": "113795",
      "original_text": "Registerbekanntmachung nach dem Umwandlungsgesetz\nBayern Amtsgericht München HRB 134549\nMinebea AccessSolutions Deutschland GmbH – Erdweg",
      "type": "Registerbekanntmachung nach dem Umwandlungsgesetz",
      "state": "Bayern",
      "amtsgericht": "Amtsgericht München",
      "registernummer": "HRB 134549",
      "registerart": "HRB",
      "company_name": "Minebea AccessSolutions Deutschland GmbH",
      "company_seat": "Erdweg",
      "details": "28.06.2025 (Bekanntmachungsdatum)\n\nBayern Amtsgericht München HRB 134549\nRegisterbekanntmachung nach dem Umwandlungsgesetz 27.06.2025 (Eintragungsdatum)\n\nMinebea AccessSolutions Deutschland GmbH\nGesellschaft mit beschränkter Haftung\nErdweg\n\nDen Gläubigern der an der Verschmelzung beteiligten Rechtsträger ist, wenn sie binnen sechs Monaten nach dem Tag, an dem die Eintragung der Verschmelzung in das Register des Sitzes desjenigen Rechtsträgers, dessen Gläubiger sie sind, nach § 19 Abs. 3 UmwG als bekannt gemacht gilt, ihren Anspruch nach Grund und Höhe in Textform anmelden, Sicherheit zu leisten, soweit sie nicht Befriedigung verlangen können. Dieses Recht steht den Gläubigern jedoch nur zu, wenn sie glaubhaft machen, dass durch die Verschmelzung die Erfüllung ihrer Forderung gefährdet wird."
    },
    {
      "date": "2025-06-28",
      "id": "113796",
      "original_text": "Registerbekanntmachung nach dem Umwandlungsgesetz\nBayern Amtsgericht München HRB 243140\nHeinrichsbad GmbH – Rottach-Egern",
      "type": "Registerbekanntmachung nach dem Umwandlungsgesetz",
      "state": "Bayern",
      "amtsgericht": "Amtsgericht München",
      "registernummer": "HRB 243140",
      "registerart": "HRB",
      "company_name": "Heinrichsbad GmbH",
      "company_seat": "Rottach-Egern",
      "details": "28.06.2025 (Bekanntmachungsdatum)\n\nBayern Amtsgericht München HRB 243140\nRegisterbekanntmachung nach dem Umwandlungsgesetz 27.06.2025 (Eintragungsdatum)\n\nHeinrichsbad GmbH\nGesellschaft mit beschränkter Haftung\nRottach-Egern\n\nDen Gläubigern der an der Verschmelzung beteiligten Rechtsträger ist, wenn sie binnen sechs Monaten nach dem Tag, an dem die Eintragung der Verschmelzung in das Register des Sitzes desjenigen Rechtsträgers, dessen Gläubiger sie sind, nach § 19 Abs. 3 UmwG als bekannt gemacht gilt, ihren Anspruch nach Grund und Höhe in Textform anmelden, Sicherheit zu leisten, soweit sie nicht Befriedigung verlangen können. Dieses Recht steht den Gläubigern jedoch nur zu, wenn sie glaubhaft machen, dass durch die Verschmelzung die Erfüllung ihrer Forderung gefährdet wird."
    },
    {
      "date": "2025-06-28",
      "id": "113797",
      "original_text": "Löschungsankündigung\nBayern Amtsgericht München HRB 215473\nLohhof Süd Wohn- und Gewerbebau GmbH – München",
      "type": "Löschungsankündigung",
      "state": "Bayern",
      "amtsgericht": "Amtsgericht München",
      "registernummer": "HRB 215473",
      "registerart": "HRB",
      "company_name": "Lohhof Süd Wohn- und Gewerbebau GmbH",
      "company_seat": "München",
      "details": "28.06.2025 (Bekanntmachungsdatum)\n\nBayern Amtsgericht München HRB 215473\nLöschungsankündigung\n\nLohhof Süd Wohn- und Gewerbebau GmbH\nGesellschaft mit beschränkter Haftung\nMünchen\n\nDas Registergericht beabsichtigt, die im Handelsregister eingetragene Gesellschaft wegen Vermögenslosigkeit von Amts wegen nach § 394 FamFG zu löschen. Die Frist zur Erhebung eines Widerspruchs ist auf drei Monate festgesetzt."
    },
    {
      "date": "2025-06-28",
      "id": "113798",
      "original_text": "Löschungsankündigung\nBayern Amtsgericht München HRB 271576\nNovastoff GmbH – München",
      "type": "Löschungsankündigung",
      "state": "Bayern",
      "amtsgericht": "Amtsgericht München",
      "registernummer": "HRB 271576",
      "registerart": "HRB",
      "company_name": "Novastoff GmbH",
      "company_seat": "München",
      "details": "28.06.2025 (Bekanntmachungsdatum)\n\nBayern Amtsgericht München HRB 271576\nLöschungsankündigung\n\nNovastoff GmbH\nGesellschaft mit beschränkter Haftung\nMünchen\n\nDas Registergericht beabsichtigt, die im Handelsregister eingetragene Gesellschaft wegen Vermögenslosigkeit von Amts wegen nach § 394 FamFG zu löschen. Die Frist zur Erhebung eines Widerspruchs ist auf drei Monate festgesetzt."
    },
    {
      "date": "2025-06-28",
      "id": "113799",
      "original_text": "Registerbekanntmachung nach dem Umwandlungsgesetz\nBayern Amtsgericht München HRB 201924\nKraussMaffei Technologies GmbH – Vaterstetten, OT Parsdorf",
      "type": "Registerbekanntmachung nach dem Umwandlungsgesetz",
      "state": "Bayern",
      "amtsgericht": "Amtsgericht München",
      "registernummer": "HRB 201924",
      "registerart": "HRB",
      "company_name": "KraussMaffei Technologies GmbH",
      "company_seat": "Vaterstetten, OT Parsdorf",
      "details": "28.06.2025 (Bekanntmachungsdatum)\n\nBayern Amtsgericht München HRB 201924\nRegisterbekanntmachung nach dem Umwandlungsgesetz 27.06.2025 (Eintragungsdatum)\n\nKraussMaffei Technologies GmbH\nGesellschaft mit beschränkter Haftung\nVaterstetten, OT Parsdorf\n\nDen Gläubigern der an der Verschmelzung beteiligten Rechtsträger ist, wenn sie binnen sechs Monaten nach dem Tag, an dem die Eintragung der Verschmelzung in das Register des Sitzes desjenigen Rechtsträgers, dessen Gläubiger sie sind, nach § 19 Abs. 3 UmwG als bekannt gemacht gilt, ihren Anspruch nach Grund und Höhe in Textform anmelden, Sicherheit zu leisten, soweit sie nicht Befriedigung verlangen können. Dieses Recht steht den Gläubigern jedoch nur zu, wenn sie glaubhaft machen, dass durch die Verschmelzung die Erfüllung ihrer Forderung gefährdet wird."
    },
    {
      "date": "2025-06-28",
      "id": "113800",
      "original_text": "Registerbekanntmachung nach dem Umwandlungsgesetz\nBayern Amtsgericht Fürth HRB 12734\nBon Profit Beteiligungsgesellschaft UG (haftungsbeschränkt) – Erlangen",
      "type": "Registerbekanntmachung nach dem Umwandlungsgesetz",
      "state": "Bayern",
      "amtsgericht": "Amtsgericht Fürth",
      "registernummer": "HRB 12734",
      "registerart": "HRB",
      "company_name": "Bon Profit Beteiligungsgesellschaft UG (haftungsbeschränkt)",
      "company_seat": "Erlangen",
      "details": "28.06.2025 (Bekanntmachungsdatum)\n\nBayern Amtsgericht Fürth HRB 12734\nRegisterbekanntmachung nach dem Umwandlungsgesetz 27.06.2025 (Eintragungsdatum)\n\nBon Profit Beteiligungsgesellschaft UG (haftungsbeschränkt)\nGesellschaft mit beschränkter Haftung\nErlangen\n\nDen Gläubigern der an der Verschmelzung beteiligten Rechtsträger ist, wenn sie binnen sechs Monaten nach dem Tag, an dem die Eintragung der Verschmelzung in das Register des Sitzes desjenigen Rechtsträgers, dessen Gläubiger sie sind, nach § 19 Abs. 3 UmwG als bekannt gemacht gilt, ihren Anspruch nach Grund und Höhe in Textform anmelden, Sicherheit zu leisten, soweit sie nicht Befriedigung verlangen können. Dieses Recht steht den Gläubigern jedoch nur zu, wenn sie glaubhaft machen, dass durch die Verschmelzung die Erfüllung ihrer Forderung gefährdet wird."
    },
    {
      "date": "2025-06-28",
      "id": "113801",
      "original_text": "Einreichung neuer Dokumente\nBayern Amtsgericht München HRB 154102\nMünchen Klinik gGmbH – München",
      "type": "Einreichung neuer Dokumente",
      "state": "Bayern",
      "amtsgericht": "Amtsgericht München",
      "registernummer": "HRB 154102",
      "registerart": "HRB",
      "company_name": "München Klinik gGmbH",
      "company_seat": "München",
      "details": "28.06.2025 (Bekanntmachungsdatum)\n\nBayern Amtsgericht München HRB 154102\nEinreichung neuer Dokumente 27.06.2025 (Eintragungsdatum)\n\nMünchen Klinik gGmbH\nGesellschaft mit beschränkter Haftung\nMünchen\n\nDem Amtsgericht München -Registergericht- ist eine Liste der Mitglieder des Aufsichtsrats eingereicht worden, § 52 Abs. 3 S. 2 GmbHG."
    },
    {
      "date": "2025-06-28",
      "id": "113802",
      "original_text": "Registerbekanntmachung nach dem Umwandlungsgesetz\nBayern Amtsgericht München HRB 300319\nDK Beteiligungs UG (haftungsbeschränkt) – Forstinning",
      "type": "Registerbekanntmachung nach dem Umwandlungsgesetz",
      "state": "Bayern",
      "amtsgericht": "Amtsgericht München",
      "registernummer": "HRB 300319",
      "registerart": "HRB",
      "company_name": "DK Beteiligungs UG (haftungsbeschränkt)",
      "company_seat": "Forstinning",
      "details": "28.06.2025 (Bekanntmachungsdatum)\n\nBayern Amtsgericht München HRB 300319\nRegisterbekanntmachung nach dem Umwandlungsgesetz 27.06.2025 (Eintragungsdatum)\n\nDK Beteiligungs UG (haftungsbeschränkt)\nGesellschaft mit beschränkter Haftung\nForstinning\n\nDen Gläubigern der an der Verschmelzung beteiligten Rechtsträger ist, wenn sie binnen sechs Monaten nach dem Tag, an dem die Eintragung der Verschmelzung in das Register des Sitzes desjenigen Rechtsträgers, dessen Gläubiger sie sind, nach § 19 Abs. 3 UmwG als bekannt gemacht gilt, ihren Anspruch nach Grund und Höhe in Textform anmelden, Sicherheit zu leisten, soweit sie nicht Befriedigung verlangen können. Dieses Recht steht den Gläubigern jedoch nur zu, wenn sie glaubhaft machen, dass durch die Verschmelzung die Erfüllung ihrer Forderung gefährdet wird."
    },
    {
      "date": "2025-06-28",
      "id": "113803",
      "original_text": "Registerbekanntmachung nach dem Umwandlungsgesetz\nBayern Amtsgericht Nürnberg HRB 31937\n5NETWORK Digital GmbH – Nürnberg",
      "type": "Registerbekanntmachung nach dem Umwandlungsgesetz",
      "state": "Bayern",
      "amtsgericht": "Amtsgericht Nürnberg",
      "registernummer": "HRB 31937",
      "registerart": "HRB",
      "company_name": "5NETWORK Digital GmbH",
      "company_seat": "Nürnberg",
      "details": "28.06.2025 (Bekanntmachungsdatum)\n\nBayern Amtsgericht Nürnberg HRB 31937\nRegisterbekanntmachung nach dem Umwandlungsgesetz 27.06.2025 (Eintragungsdatum)\n\n5NETWORK Digital GmbH\nGesellschaft mit beschränkter Haftung\nNürnberg\n\nDen Gläubigern der an der Verschmelzung beteiligten Rechtsträger ist, wenn sie binnen sechs Monaten nach dem Tag, an dem die Eintragung der Verschmelzung in das Register des Sitzes desjenigen Rechtsträgers, dessen Gläubiger sie sind, nach § 19 Abs. 3 UmwG als bekannt gemacht gilt, ihren Anspruch nach Grund und Höhe in Textform anmelden, Sicherheit zu leisten, soweit sie nicht Befriedigung verlangen können. Dieses Recht steht den Gläubigern jedoch nur zu, wenn sie glaubhaft machen, dass durch die Verschmelzung die Erfüllung ihrer Forderung gefährdet wird."
    },
    {
      "date": "2025-06-28",
      "id": "113804",
      "original_text": "Löschungsankündigung\nBayern Amtsgericht München HRB 275927\nBTM Ausbau UG (haftungsbeschränkt) – Unterhaching",
      "type": "Löschungsankündigung",
      "state": "Bayern",
      "amtsgericht": "Amtsgericht München",
      "registernummer": "HRB 275927",
      "registerart": "HRB",
      "company_name": "BTM Ausbau UG (haftungsbeschränkt)",
      "company_seat": "Unterhaching",
      "details": "28.06.2025 (Bekanntmachungsdatum)\n\nBayern Amtsgericht München HRB 275927\nLöschungsankündigung 27.06.2025 (Eintragungsdatum)\n\nBTM Ausbau UG (haftungsbeschränkt)\nGesellschaft mit beschränkter Haftung\nUnterhaching\n\nDas Registergericht beabsichtigt, die im Handelsregister eingetragene Gesellschaft wegen Vermögenslosigkeit von Amts wegen nach § 394 FamFG zu löschen. Die Frist zur Erhebung eines Widerspruchs ist auf drei Monate festgesetzt."
    },
    {
      "date": "2025-06-28",
      "id": "113805",
      "original_text": "Registerbekanntmachung nach dem Umwandlungsgesetz\nBayern Amtsgericht Augsburg HRB 10918\nSchippl Dichtungen GmbH – Welden",
      "type": "Registerbekanntmachung nach dem Umwandlungsgesetz",
      "state": "Bayern",
      "amtsgericht": "Amtsgericht Augsburg",
      "registernummer": "HRB 10918",
      "registerart": "HRB",
      "company_name": "Schippl Dichtungen GmbH",
      "company_seat": "Welden",
      "details": "28.06.2025 (Bekanntmachungsdatum)\n\nBayern Amtsgericht Augsburg HRB 10918\nRegisterbekanntmachung nach dem Umwandlungsgesetz 17.06.2025 (Eintragungsdatum)\n\nSchippl Dichtungen GmbH\nGesellschaft mit beschränkter Haftung\nWelden\n\nDen Gläubigern der an der Verschmelzung beteiligten Rechtsträger ist, wenn sie binnen sechs Monaten nach dem Tag, an dem die Eintragung der Verschmelzung in das Register des Sitzes desjenigen Rechtsträgers, dessen Gläubiger sie sind, nach § 19 Abs. 3 UmwG als bekannt gemacht gilt, ihren Anspruch nach Grund und Höhe in Textform anmelden, Sicherheit zu leisten, soweit sie nicht Befriedigung verlangen können. Dieses Recht steht den Gläubigern jedoch nur zu, wenn sie glaubhaft machen, dass durch die Verschmelzung die Erfüllung ihrer Forderung gefährdet wird."
    },
    {
      "date": "2025-06-28",
      "id": "113806",
      "original_text": "Registerbekanntmachung nach dem Umwandlungsgesetz\nBayern Amtsgericht Schweinfurt HRB 1698\nBöhm GmbH – Schweinfurt",
      "type": "Registerbekanntmachung nach dem Umwandlungsgesetz",
      "state": "Bayern",
      "amtsgericht": "Amtsgericht Schweinfurt",
      "registernummer": "HRB 1698",
      "registerart": "HRB",
      "company_name": "Böhm GmbH",
      "company_seat": "Schweinfurt",
      "details": "28.06.2025 (Bekanntmachungsdatum)\n\nBayern Amtsgericht Schweinfurt HRB 1698\nRegisterbekanntmachung nach dem Umwandlungsgesetz 27.06.2025 (Eintragungsdatum)\n\nBöhm GmbH\nGesellschaft mit beschränkter Haftung\nSchweinfurt\n\nDen Gläubigern der an der Verschmelzung beteiligten Rechtsträger ist, wenn sie binnen sechs Monaten nach dem Tag, an dem die Eintragung der Verschmelzung in das Register des Sitzes desjenigen Rechtsträgers, dessen Gläubiger sie sind, nach § 19 Abs. 3 UmwG als bekannt gemacht gilt, ihren Anspruch nach Grund und Höhe in Textform anmelden, Sicherheit zu leisten, soweit sie nicht Befriedigung verlangen können. Dieses Recht steht den Gläubigern jedoch nur zu, wenn sie glaubhaft machen, dass durch die Verschmelzung die Erfüllung ihrer Forderung gefährdet wird."
    },
    {
      "date": "2025-06-28",
      "id": "113807",
      "original_text": "Registerbekanntmachung nach dem Umwandlungsgesetz\nBayern Amtsgericht München HRB 268692\nClimate Endowment Management GmbH – München",
      "type": "Registerbekanntmachung nach dem Umwandlungsgesetz",
      "state": "Bayern",
      "amtsgericht": "Amtsgericht München",
      "registernummer": "HRB 268692",
      "registerart": "HRB",
      "company_name": "Climate Endowment Management GmbH",
      "company_seat": "München",
      "details": "28.06.2025 (Bekanntmachungsdatum)\n\nBayern Amtsgericht München HRB 268692\nRegisterbekanntmachung nach dem Umwandlungsgesetz 27.06.2025 (Eintragungsdatum)\n\nClimate Endowment Management GmbH\nGesellschaft mit beschränkter Haftung\nMünchen\n\nDen Gläubigern der an der Verschmelzung beteiligten Rechtsträger ist, wenn sie binnen sechs Monaten nach dem Tag, an dem die Eintragung der Verschmelzung in das Register des Sitzes desjenigen Rechtsträgers, dessen Gläubiger sie sind, nach § 19 Abs. 3 UmwG als bekannt gemacht gilt, ihren Anspruch nach Grund und Höhe in Textform anmelden, Sicherheit zu leisten, soweit sie nicht Befriedigung verlangen können. Dieses Recht steht den Gläubigern jedoch nur zu, wenn sie glaubhaft machen, dass durch die Verschmelzung die Erfüllung ihrer Forderung gefährdet wird."
    },
    {
      "date": "2025-06-28",
      "id": "113808",
      "original_text": "Registerbekanntmachung nach dem Umwandlungsgesetz\nBayern Amtsgericht München HRB 274350\nAmazon Deutschland N19 Transport GmbH – München",
      "type": "Registerbekanntmachung nach dem Umwandlungsgesetz",
      "state": "Bayern",
      "amtsgericht": "Amtsgericht München",
      "registernummer": "HRB 274350",
      "registerart": "HRB",
      "company_name": "Amazon Deutschland N19 Transport GmbH",
      "company_seat": "München",
      "details": "28.06.2025 (Bekanntmachungsdatum)\n\nBayern Amtsgericht München HRB 274350\nRegisterbekanntmachung nach dem Umwandlungsgesetz 27.06.2025 (Eintragungsdatum)\n\nAmazon Deutschland N19 Transport GmbH\nGesellschaft mit beschränkter Haftung\nMünchen\n\nDen Gläubigern der an der Verschmelzung beteiligten Rechtsträger ist, wenn sie binnen sechs Monaten nach dem Tag, an dem die Eintragung der Verschmelzung in das Register des Sitzes desjenigen Rechtsträgers, dessen Gläubiger sie sind, nach § 19 Abs. 3 UmwG als bekannt gemacht gilt, ihren Anspruch nach Grund und Höhe in Textform anmelden, Sicherheit zu leisten, soweit sie nicht Befriedigung verlangen können. Dieses Recht steht den Gläubigern jedoch nur zu, wenn sie glaubhaft machen, dass durch die Verschmelzung die Erfüllung ihrer Forderung gefährdet wird."
    },
    {
      "date": "2025-06-28",
      "id": "113809",
      "original_text": "Einreichung neuer Dokumente\nBayern Amtsgericht München HRB 157279\nAmper Kliniken Aktiengesellschaft – Dachau",
      "type": "Einreichung neuer Dokumente",
      "state": "Bayern",
      "amtsgericht": "Amtsgericht München",
      "registernummer": "HRB 157279",
      "registerart": "HRB",
      "company_name": "Amper Kliniken Aktiengesellschaft",
      "company_seat": "Dachau",
      "details": "28.06.2025 (Bekanntmachungsdatum)\n\nBayern Amtsgericht München HRB 157279\nEinreichung neuer Dokumente 27.06.2025 (Eintragungsdatum)\n\nAmper Kliniken Aktiengesellschaft\nAktiengesellschaft\nDachau\n\nDem Amtsgericht München -Registergericht- ist eine Liste der Mitglieder des Aufsichtsrats eingereicht worden, § 106 AktG."
    },
    {
      "date": "2025-06-28",
      "id": "113810",
      "original_text": "Registerbekanntmachung nach dem Umwandlungsgesetz\nBayern Amtsgericht Regensburg HRB 10655\nS-Refit EFRE Fonds Bayern GmbH – Regensburg",
      "type": "Registerbekanntmachung nach dem Umwandlungsgesetz",
      "state": "Bayern",
      "amtsgericht": "Amtsgericht Regensburg",
      "registernummer": "HRB 10655",
      "registerart": "HRB",
      "company_name": "S-Refit EFRE Fonds Bayern GmbH",
      "company_seat": "Regensburg",
      "details": "28.06.2025 (Bekanntmachungsdatum)\n\nBayern Amtsgericht Regensburg HRB 10655\nRegisterbekanntmachung nach dem Umwandlungsgesetz 27.06.2025 (Eintragungsdatum)\n\nS-Refit EFRE Fonds Bayern GmbH\nGesellschaft mit beschränkter Haftung\nRegensburg\n\nDen Gläubigern der an der Verschmelzung beteiligten Rechtsträger ist, wenn sie binnen sechs Monaten nach dem Tag, an dem die Eintragung der Verschmelzung in das Register des Sitzes desjenigen Rechtsträgers, dessen Gläubiger sie sind, nach § 19 Abs. 3 UmwG als bekannt gemacht gilt, ihren Anspruch nach Grund und Höhe in Textform anmelden, Sicherheit zu leisten, soweit sie nicht Befriedigung verlangen können. Dieses Recht steht den Gläubigern jedoch nur zu, wenn sie glaubhaft machen, dass durch die Verschmelzung die Erfüllung ihrer Forderung gefährdet wird."
    },
    {
      "date": "2025-06-28",
      "id": "113811",
      "original_text": "Registerbekanntmachung nach dem Umwandlungsgesetz\nBayern Amtsgericht Fürth HRB 11686\ndefacto x GmbH – Erlangen",
      "type": "Registerbekanntmachung nach dem Umwandlungsgesetz",
      "state": "Bayern",
      "amtsgericht": "Amtsgericht Fürth",
      "registernummer": "HRB 11686",
      "registerart": "HRB",
      "company_name": "defacto x GmbH",
      "company_seat": "Erlangen",
      "details": "28.06.2025 (Bekanntmachungsdatum)\n\nBayern Amtsgericht Fürth HRB 11686\nRegisterbekanntmachung nach dem Umwandlungsgesetz 27.06.2025 (Eintragungsdatum)\n\ndefacto x GmbH\nGesellschaft mit beschränkter Haftung\nErlangen\n\nDen Gläubigern der an der Verschmelzung beteiligten Rechtsträger ist, wenn sie binnen sechs Monaten nach dem Tag, an dem die Eintragung der Verschmelzung in das Register des Sitzes desjenigen Rechtsträgers, dessen Gläubiger sie sind, nach § 19 Abs. 3 UmwG als bekannt gemacht gilt, ihren Anspruch nach Grund und Höhe in Textform anmelden, Sicherheit zu leisten, soweit sie nicht Befriedigung verlangen können. Dieses Recht steht den Gläubigern jedoch nur zu, wenn sie glaubhaft machen, dass durch die Verschmelzung die Erfüllung ihrer Forderung gefährdet wird."
    },
    {
      "date": "2025-06-28",
      "id": "113812",
      "original_text": "Registerbekanntmachung nach dem Umwandlungsgesetz\nBayern Amtsgericht Regensburg HRB 8641\nS-Refit AG – Regensburg",
      "type": "Registerbekanntmachung nach dem Umwandlungsgesetz",
      "state": "Bayern",
      "amtsgericht": "Amtsgericht Regensburg",
      "registernummer": "HRB 8641",
      "registerart": "HRB",
      "company_name": "S-Refit AG",
      "company_seat": "Regensburg",
      "details": "28.06.2025 (Bekanntmachungsdatum)\n\nBayern Amtsgericht Regensburg HRB 8641\nRegisterbekanntmachung nach dem Umwandlungsgesetz 27.06.2025 (Eintragungsdatum)\n\nS-Refit AG\nAktiengesellschaft\nRegensburg\n\nDen Gläubigern der an der Verschmelzung beteiligten Rechtsträger ist, wenn sie binnen sechs Monaten nach dem Tag, an dem die Eintragung der Verschmelzung in das Register des Sitzes desjenigen Rechtsträgers, dessen Gläubiger sie sind, nach § 19 Abs. 3 UmwG als bekannt gemacht gilt, ihren Anspruch nach Grund und Höhe in Textform anmelden, Sicherheit zu leisten, soweit sie nicht Befriedigung verlangen können. Dieses Recht steht den Gläubigern jedoch nur zu, wenn sie glaubhaft machen, dass durch die Verschmelzung die Erfüllung ihrer Forderung gefährdet wird."
    },
    {
      "date": "2025-06-28",
      "id": "113813",
      "original_text": "Löschungsankündigung\nBayern Amtsgericht München HRB 246325\nNovak Dienstleistungen UG (haftungsbeschränkt) – München",
      "type": "Löschungsankündigung",
      "state": "Bayern",
      "amtsgericht": "Amtsgericht München",
      "registernummer": "HRB 246325",
      "registerart": "HRB",
      "company_name": "Novak Dienstleistungen UG (haftungsbeschränkt)",
      "company_seat": "München",
      "details": "28.06.2025 (Bekanntmachungsdatum)\n\nBayern Amtsgericht München HRB 246325\nLöschungsankündigung 27.06.2025 (Eintragungsdatum)\n\nNovak Dienstleistungen UG (haftungsbeschränkt)\nGesellschaft mit beschränkter Haftung\nMünchen\n\nDas Registergericht beabsichtigt, die im Handelsregister eingetragene Gesellschaft wegen Vermögenslosigkeit von Amts wegen nach § 394 FamFG zu löschen. Die Frist zur Erhebung eines Widerspruchs ist auf drei Monate festgesetzt."
    }
  ]
}