{
  "date": "2025-06-10",
  "date_of_scrape": "2025-06-13T08:35:57.488Z",
  "tool_version": "0.2.0",
  "number_of_announcements": 114,
  "announcements": [
    {
      "date": "2025-06-10",
      "id": "111626",
      "original_text": "Löschungsankündigung\nBaden-Württemberg Amtsgericht Mannheim HRB 744739\nHMS Hemriti Marketing Solutions UG (haftungsbeschränkt) – Karlsruhe",
      "type": "Löschungsankündigung",
      "state": "Baden-Württemberg",
      "amtsgericht": "Amtsgericht Mannheim",
      "registernummer": "HRB 744739",
      "registerart": "HRB",
      "company_name": "HMS Hemriti Marketing Solutions UG (haftungsbeschränkt)",
      "company_seat": "Karlsruhe",
      "details": "10.06.2025 (Bekanntmachungsdatum)\n\nBaden-Württemberg Amtsgericht Mannheim HRB 744739\nLöschungsankündigung\n\nHMS Hemriti Marketing Solutions UG (haftungsbeschränkt)\nGesellschaft mit beschränkter Haftung\nKarlsruhe\n\nDas Gericht beabsichtigt, die Gesellschaft wegen Vermögenslosigkeit im Handelsregister von Amts wegen nach § 394 FamFG zu löschen. Die Frist zur Geltendmachung eines Widerspruchs gegen die beabsichtigte Löschung ist auf einen Monat ab Veröffentlichung bestimmt."
    },
    {
      "date": "2025-06-10",
      "id": "111627",
      "original_text": "Einreichung neuer Dokumente\nBaden-Württemberg Amtsgericht Mannheim HRB 737878\nEvangelische Sozialstation Wertheim gGmbH – Wertheim",
      "type": "Einreichung neuer Dokumente",
      "state": "Baden-Württemberg",
      "amtsgericht": "Amtsgericht Mannheim",
      "registernummer": "HRB 737878",
      "registerart": "HRB",
      "company_name": "Evangelische Sozialstation Wertheim gGmbH",
      "company_seat": "Wertheim",
      "details": "10.06.2025 (Bekanntmachungsdatum)\n\nBaden-Württemberg Amtsgericht Mannheim HRB 737878\nEinreichung neuer Dokumente 10.06.2025 (Eintragungsdatum)\n\nEvangelische Sozialstation Wertheim gGmbH\nGesellschaft mit beschränkter Haftung\nWertheim\n\nDie Gesellschaft hat am 13.05.2025 die Liste über die Zusammensetzung des Aufsichtsrats zum Handelsregister eingereicht."
    },
    {
      "date": "2025-06-10",
      "id": "111628",
      "original_text": "Registerbekanntmachung nach dem Umwandlungsgesetz\nBaden-Württemberg Amtsgericht Stuttgart HRA 727053\nTUTBUS GmbH & Co. KG – Tuttlingen",
      "type": "Registerbekanntmachung nach dem Umwandlungsgesetz",
      "state": "Baden-Württemberg",
      "amtsgericht": "Amtsgericht Stuttgart",
      "registernummer": "HRA 727053",
      "registerart": "HRA",
      "company_name": "TUTBUS GmbH & Co. KG",
      "company_seat": "Tuttlingen",
      "details": "10.06.2025 (Bekanntmachungsdatum)\n\nBaden-Württemberg Amtsgericht Stuttgart HRA 727053\nRegisterbekanntmachung nach dem Umwandlungsgesetz 10.06.2025 (Eintragungsdatum)\n\nTUTBUS GmbH & Co. KG\nKommanditgesellschaft\nTuttlingen\n\nAls nicht eingetragen wird bekanntgemacht:\nDen Gläubigern der an der Verschmelzung beteiligten Rechtsträger ist, wenn sie binnen sechs Monaten nach dem Tag, an dem die Eintragung der Verschmelzung in das Register des Sitzes desjenigen Rechtsträgers, dessen Gläubiger sie sind, nach § 19 Abs. 3 UmwG als bekanntgemacht gilt, ihren Anspruch nach Grund und Höhe schriftlich anmelden, Sicherheit zu leisten, soweit sie nicht Befriedigung verlangen können. Dieses Recht steht den Gläubigern jedoch nur zu, wenn sie glaubhaft machen, dass durch die Verschmelzung die Erfüllung ihrer Forderung gefährdet wird."
    },
    {
      "date": "2025-06-10",
      "id": "111629",
      "original_text": "Sonstige Registerbekanntmachung\nBerlin Amtsgericht Berlin (Charlottenburg) HRB 211155\nDigital Charging Solutions GmbH – Berlin",
      "type": "Sonstige Registerbekanntmachung",
      "state": "Berlin",
      "amtsgericht": "Amtsgericht Berlin (Charlottenburg)",
      "registernummer": "HRB 211155",
      "registerart": "HRB",
      "company_name": "Digital Charging Solutions GmbH",
      "company_seat": "Berlin",
      "details": "10.06.2025 (Bekanntmachungsdatum)\n\nBerlin Amtsgericht Berlin (Charlottenburg) HRB 211155\nSonstige Registerbekanntmachung\n\nDigital Charging Solutions GmbH\nGesellschaft mit beschränkter Haftung\nBerlin\n\nAls nicht eingetragen wird veröffentlicht:Es wurde eine neue Liste der Aufsichtsratsmitglieder eingereicht (§52 GmbHG)."
    },
    {
      "date": "2025-06-10",
      "id": "111630",
      "original_text": "Registerbekanntmachung nach dem Umwandlungsgesetz\nBaden-Württemberg Amtsgericht Stuttgart HRB 753895\ncf Fitness Ludwigsburg GmbH – Ludwigsburg",
      "type": "Registerbekanntmachung nach dem Umwandlungsgesetz",
      "state": "Baden-Württemberg",
      "amtsgericht": "Amtsgericht Stuttgart",
      "registernummer": "HRB 753895",
      "registerart": "HRB",
      "company_name": "cf Fitness Ludwigsburg GmbH",
      "company_seat": "Ludwigsburg",
      "details": "10.06.2025 (Bekanntmachungsdatum)\n\nBaden-Württemberg Amtsgericht Stuttgart HRB 753895\nRegisterbekanntmachung nach dem Umwandlungsgesetz 10.06.2025 (Eintragungsdatum)\n\ncf Fitness Ludwigsburg GmbH\nGesellschaft mit beschränkter Haftung\nLudwigsburg\n\nAls nicht eingetragen wird bekanntgemacht:\nDen Gläubigern der an der Verschmelzung beteiligten Rechtsträger ist, wenn sie binnen sechs Monaten nach dem Tag, an dem die Eintragung der Verschmelzung in das Register des Sitzes desjenigen Rechtsträgers, dessen Gläubiger sie sind, nach § 19 Abs. 3 UmwG als bekanntgemacht gilt, ihren Anspruch nach Grund und Höhe schriftlich anmelden, Sicherheit zu leisten, soweit sie nicht Befriedigung verlangen können. Dieses Recht steht den Gläubigern jedoch nur zu, wenn sie glaubhaft machen, dass durch die Verschmelzung die Erfüllung ihrer Forderung gefährdet wird."
    },
    {
      "date": "2025-06-10",
      "id": "111631",
      "original_text": "Registerbekanntmachung nach dem Umwandlungsgesetz\nBaden-Württemberg Amtsgericht Mannheim HRB 750601\nSLR Group GmbH – St. Leon-Rot",
      "type": "Registerbekanntmachung nach dem Umwandlungsgesetz",
      "state": "Baden-Württemberg",
      "amtsgericht": "Amtsgericht Mannheim",
      "registernummer": "HRB 750601",
      "registerart": "HRB",
      "company_name": "SLR Group GmbH",
      "company_seat": "St. Leon-Rot",
      "details": "10.06.2025 (Bekanntmachungsdatum)\n\nBaden-Württemberg Amtsgericht Mannheim HRB 750601\nRegisterbekanntmachung nach dem Umwandlungsgesetz 10.06.2025 (Eintragungsdatum)\n\nSLR Group GmbH\nGesellschaft mit beschränkter Haftung\nSt. Leon-Rot\n\nAls nicht eingetragen wird bekanntgemacht:\nDen Gläubigern der an der Verschmelzung beteiligten Rechtsträger ist, wenn sie binnen sechs Monaten nach dem Tag, an dem die Eintragung der Verschmelzung in das Register des Sitzes desjenigen Rechtsträgers, dessen Gläubiger sie sind, nach § 19 Abs. 3 UmwG als bekanntgemacht gilt, ihren Anspruch nach Grund und Höhe schriftlich anmelden, Sicherheit zu leisten, soweit sie nicht Befriedigung verlangen können. Dieses Recht steht den Gläubigern jedoch nur zu, wenn sie glaubhaft machen, dass durch die Verschmelzung die Erfüllung ihrer Forderung gefährdet wird."
    },
    {
      "date": "2025-06-10",
      "id": "111632",
      "original_text": "Einreichung neuer Dokumente\nSachsen-Anhalt Amtsgericht Stendal HRB 29263\nLieken GmbH – Lutherstadt Wittenberg",
      "type": "Einreichung neuer Dokumente",
      "state": "Sachsen-Anhalt",
      "amtsgericht": "Amtsgericht Stendal",
      "registernummer": "HRB 29263",
      "registerart": "HRB",
      "company_name": "Lieken GmbH",
      "company_seat": "Lutherstadt Wittenberg",
      "details": "10.06.2025 (Bekanntmachungsdatum)\n\nSachsen-Anhalt Amtsgericht Stendal HRB 29263\nEinreichung neuer Dokumente\n\nLieken GmbH\nGesellschaft mit beschränkter Haftung\nLutherstadt Wittenberg"
    },
    {
      "date": "2025-06-10",
      "id": "111633",
      "original_text": "Löschungsankündigung\nBerlin Amtsgericht Berlin (Charlottenburg) HRB 250616\nECS Corporate Solutions GmbH – Berlin",
      "type": "Löschungsankündigung",
      "state": "Berlin",
      "amtsgericht": "Amtsgericht Berlin (Charlottenburg)",
      "registernummer": "HRB 250616",
      "registerart": "HRB",
      "company_name": "ECS Corporate Solutions GmbH",
      "company_seat": "Berlin",
      "details": "10.06.2025 (Bekanntmachungsdatum)\n\nBerlin Amtsgericht Berlin (Charlottenburg) HRB 250616\nLöschungsankündigung\n\nECS Corporate Solutions GmbH\nGesellschaft mit beschränkter Haftung\nBerlin\n\nBei der nachstehenden Gesellschaft wird das Amtslöschungsverfahren gemäß § 394 FamFG eingeleitet. Widerspruchsfrist 6 Wochen"
    },
    {
      "date": "2025-06-10",
      "id": "111634",
      "original_text": "Registerbekanntmachung nach dem Umwandlungsgesetz\nHamburg Amtsgericht Hamburg HRB 76660\nMS ROBERT RICKMERS Schiffahrts-Verwaltungsgesellschaft mbH – Hamburg",
      "type": "Registerbekanntmachung nach dem Umwandlungsgesetz",
      "state": "Hamburg",
      "amtsgericht": "Amtsgericht Hamburg",
      "registernummer": "HRB 76660",
      "registerart": "HRB",
      "company_name": "MS ROBERT RICKMERS Schiffahrts-Verwaltungsgesellschaft mbH",
      "company_seat": "Hamburg",
      "details": "10.06.2025 (Bekanntmachungsdatum)\n\nHamburg Amtsgericht Hamburg HRB 76660\nRegisterbekanntmachung nach dem Umwandlungsgesetz 10.06.2025 (Eintragungsdatum)\n\nMS ROBERT RICKMERS Schiffahrts-Verwaltungsgesellschaft mbH\nGesellschaft mit beschränkter Haftung\nHamburg\n\nAls nicht eingetragen wird bekannt gemacht:\nDen Gläubigern der an der Verschmelzung beteiligten Gesellschaften ist, wenn sie binnen sechs Monaten nach dem Tag, an dem die Eintragung der Verschmelzung in das Register des Sitzes desjenigen Rechtsträgers, dessen Gläubiger sie sind, nach § 19 Absatz 3 UmwG als bekannt gemacht gilt, ihren Anspruch nach Grund und Höhe schriftlich anmelden, Sicherheit zu leisten, soweit sie nicht Befriedigung verlangen können. Dieses Recht steht den Gläubigern jedoch nur zu, wenn sie glaubhaft machen, dass durch die Verschmelzung die Erfüllung ihrer Forderung gefährdet wird."
    },
    {
      "date": "2025-06-10",
      "id": "111635",
      "original_text": "Löschungsankündigung\nBrandenburg Amtsgericht Potsdam HRB 34863\nR+U Projekt UG (haftungsbeschränkt) – Kleinmachnow",
      "type": "Löschungsankündigung",
      "state": "Brandenburg",
      "amtsgericht": "Amtsgericht Potsdam",
      "registernummer": "HRB 34863",
      "registerart": "HRB",
      "company_name": "R+U Projekt UG (haftungsbeschränkt)",
      "company_seat": "Kleinmachnow",
      "details": "10.06.2025 (Bekanntmachungsdatum)\n\nBrandenburg Amtsgericht Potsdam HRB 34863\nLöschungsankündigung\n\nR+U Projekt UG (haftungsbeschränkt)\nGesellschaft mit beschränkter Haftung\nKleinmachnow\n\nBei der nachstehenden Gesellschaft wird das Amtslöschungsverfahren gemäß § 394 FamFG eingeleitet. Widerspruchsfrist: 8 Wochen"
    },
    {
      "date": "2025-06-10",
      "id": "111636",
      "original_text": "Registerbekanntmachung nach dem Umwandlungsgesetz\nBaden-Württemberg Amtsgericht Stuttgart HRB 768216\nAdolf Schreiber GmbH – Münsingen",
      "type": "Registerbekanntmachung nach dem Umwandlungsgesetz",
      "state": "Baden-Württemberg",
      "amtsgericht": "Amtsgericht Stuttgart",
      "registernummer": "HRB 768216",
      "registerart": "HRB",
      "company_name": "Adolf Schreiber GmbH",
      "company_seat": "Münsingen",
      "details": "10.06.2025 (Bekanntmachungsdatum)\n\nBaden-Württemberg Amtsgericht Stuttgart HRB 768216\nRegisterbekanntmachung nach dem Umwandlungsgesetz 10.06.2025 (Eintragungsdatum)\n\nAdolf Schreiber GmbH\nGesellschaft mit beschränkter Haftung\nMünsingen\n\nAls nicht eingetragen wird bekanntgemacht:\nDen Gläubigern der an der Verschmelzung beteiligten Rechtsträger ist, wenn sie binnen sechs Monaten nach dem Tag, an dem die Eintragung der Verschmelzung in das Register des Sitzes desjenigen Rechtsträgers, dessen Gläubiger sie sind, nach § 19 Abs. 3 UmwG als bekanntgemacht gilt, ihren Anspruch nach Grund und Höhe schriftlich anmelden, Sicherheit zu leisten, soweit sie nicht Befriedigung verlangen können. Dieses Recht steht den Gläubigern jedoch nur zu, wenn sie glaubhaft machen, dass durch die Verschmelzung die Erfüllung ihrer Forderung gefährdet wird."
    },
    {
      "date": "2025-06-10",
      "id": "111637",
      "original_text": "Registerbekanntmachung nach dem Umwandlungsgesetz\nBaden-Württemberg Amtsgericht Freiburg HRB 733343\nGipser Gojak GmbH – Laufenburg Baden",
      "type": "Registerbekanntmachung nach dem Umwandlungsgesetz",
      "state": "Baden-Württemberg",
      "amtsgericht": "Amtsgericht Freiburg",
      "registernummer": "HRB 733343",
      "registerart": "HRB",
      "company_name": "Gipser Gojak GmbH",
      "company_seat": "Laufenburg Baden",
      "details": "10.06.2025 (Bekanntmachungsdatum)\n\nBaden-Württemberg Amtsgericht Freiburg HRB 733343\nRegisterbekanntmachung nach dem Umwandlungsgesetz 10.06.2025 (Eintragungsdatum)\n\nGipser Gojak GmbH\nGesellschaft mit beschränkter Haftung\nLaufenburg Baden\n\nAls nicht eingetragen wird bekanntgemacht:\nDen Gläubigern der an der Ausgliederung beteiligten Rechtsträger ist, wenn sie binnen sechs Monaten nach dem Tag, an dem die Eintragung der Ausgliederung in das Register des Sitzes desjenigen Rechtsträgers, dessen Gläubiger sie sind, nach § 19 Abs. 3 UmwG als bekanntgemacht gilt, ihren Anspruch nach Grund und Höhe schriftlich anmelden, Sicherheit zu leisten, soweit sie nicht Befriedigung verlangen können. Dieses Recht steht den Gläubigern jedoch nur zu, wenn sie glaubhaft machen, dass durch die Ausgliederung die Erfüllung ihrer Forderung gefährdet wird."
    },
    {
      "date": "2025-06-10",
      "id": "111638",
      "original_text": "Registerbekanntmachung nach dem Umwandlungsgesetz\nBaden-Württemberg Amtsgericht Freiburg HRA 709068\nGipser Gojak e.K. – Laufenburg Baden",
      "type": "Registerbekanntmachung nach dem Umwandlungsgesetz",
      "state": "Baden-Württemberg",
      "amtsgericht": "Amtsgericht Freiburg",
      "registernummer": "HRA 709068",
      "registerart": "HRA",
      "company_name": "Gipser Gojak e.K.",
      "company_seat": "Laufenburg Baden",
      "details": "10.06.2025 (Bekanntmachungsdatum)\n\nBaden-Württemberg Amtsgericht Freiburg HRA 709068\nRegisterbekanntmachung nach dem Umwandlungsgesetz 10.06.2025 (Eintragungsdatum)\n\nGipser Gojak e.K.\nEinzelkaufmann / Einzelkauffrau\nLaufenburg Baden\n\nAls nicht eingetragen wird bekanntgemacht:\nDen Gläubigern der an der Ausgliederung beteiligten Rechtsträger ist, wenn sie binnen sechs Monaten nach dem Tag, an dem die Eintragung der Ausgliederung in das Register des Sitzes desjenigen Rechtsträgers, dessen Gläubiger sie sind, nach § 19 Abs. 3 UmwG als bekanntgemacht gilt, ihren Anspruch nach Grund und Höhe schriftlich anmelden, Sicherheit zu leisten, soweit sie nicht Befriedigung verlangen können. Dieses Recht steht den Gläubigern jedoch nur zu, wenn sie glaubhaft machen, dass durch die Ausgliederung die Erfüllung ihrer Forderung gefährdet wird."
    },
    {
      "date": "2025-06-10",
      "id": "111639",
      "original_text": "Löschungsankündigung\nBerlin Amtsgericht Berlin (Charlottenburg) HRB 194322\nScalingFunds GmbH – Berlin",
      "type": "Löschungsankündigung",
      "state": "Berlin",
      "amtsgericht": "Amtsgericht Berlin (Charlottenburg)",
      "registernummer": "HRB 194322",
      "registerart": "HRB",
      "company_name": "ScalingFunds GmbH",
      "company_seat": "Berlin",
      "details": "10.06.2025 (Bekanntmachungsdatum)\n\nBerlin Amtsgericht Berlin (Charlottenburg) HRB 194322\nLöschungsankündigung\n\nScalingFunds GmbH\nGesellschaft mit beschränkter Haftung\nBerlin\n\nBei der nachstehenden Gesellschaft wird das Amtslöschungsverfahren gemäß § 394 FamFG eingeleitet. Widerspruchsfrist 6 Wochen"
    },
    {
      "date": "2025-06-10",
      "id": "111640",
      "original_text": "Registerbekanntmachung nach dem Umwandlungsgesetz\nHamburg Amtsgericht Hamburg HRB 70777\nQuantum Immobilien Aktiengesellschaft – Hamburg",
      "type": "Registerbekanntmachung nach dem Umwandlungsgesetz",
      "state": "Hamburg",
      "amtsgericht": "Amtsgericht Hamburg",
      "registernummer": "HRB 70777",
      "registerart": "HRB",
      "company_name": "Quantum Immobilien Aktiengesellschaft",
      "company_seat": "Hamburg",
      "details": "10.06.2025 (Bekanntmachungsdatum)\n\nHamburg Amtsgericht Hamburg HRB 70777\nRegisterbekanntmachung nach dem Umwandlungsgesetz\n\nQuantum Immobilien Aktiengesellschaft\nAktiengesellschaft\nHamburg\n\nDie Gesellschaft hat gemäß § 61 UmwG die jeweiligen Entwürfe des Verschmelzungsvertrages bei dem Handelsregister eingereicht, mit dem die\nCCN Projektgesellschaft mbH mit Sitz in Hamburg (Amtsgericht Hamburg HRB 186483) und die EH-Campus Neubau GmbH mit Sitz in Hamburg (Amtsgericht Hamburg HRB 186816) als übertragende Gesellschaften auf die Quantum Immobilien Aktiengesellschaft mit Sitz in Hamburg (Amtsgericht Hamburg HRB 70777) als übernehmende Gesellschaft verschmolzen wird."
    },
    {
      "date": "2025-06-10",
      "id": "111641",
      "original_text": "Registerbekanntmachung nach dem Umwandlungsgesetz\nBaden-Württemberg Amtsgericht Ulm HRB 680461\nStadtwerk Tauberfranken GmbH – Bad Mergentheim",
      "type": "Registerbekanntmachung nach dem Umwandlungsgesetz",
      "state": "Baden-Württemberg",
      "amtsgericht": "Amtsgericht Ulm",
      "registernummer": "HRB 680461",
      "registerart": "HRB",
      "company_name": "Stadtwerk Tauberfranken GmbH",
      "company_seat": "Bad Mergentheim",
      "details": "10.06.2025 (Bekanntmachungsdatum)\n\nBaden-Württemberg Amtsgericht Ulm HRB 680461\nRegisterbekanntmachung nach dem Umwandlungsgesetz 10.06.2025 (Eintragungsdatum)\n\nStadtwerk Tauberfranken GmbH\nGesellschaft mit beschränkter Haftung\nBad Mergentheim\n\nAls nicht eingetragen wird bekanntgemacht:\nDen Gläubigern der an der Verschmelzung beteiligten Rechtsträger ist, wenn sie binnen sechs Monaten nach dem Tag, an dem die Eintragung der Verschmelzung in das Register des Sitzes desjenigen Rechtsträgers, dessen Gläubiger sie sind, nach § 19 Abs. 3 UmwG als bekanntgemacht gilt, ihren Anspruch nach Grund und Höhe schriftlich anmelden, Sicherheit zu leisten, soweit sie nicht Befriedigung verlangen können. Dieses Recht steht den Gläubigern jedoch nur zu, wenn sie glaubhaft machen, dass durch die Verschmelzung die Erfüllung ihrer Forderung gefährdet wird."
    },
    {
      "date": "2025-06-10",
      "id": "111642",
      "original_text": "Registerbekanntmachung nach dem Umwandlungsgesetz\nSchleswig-Holstein Amtsgericht Pinneberg HRA 4933\nLeibniz Privatschule Fördergesellschaft mbH & Co. KG – Elmshorn",
      "type": "Registerbekanntmachung nach dem Umwandlungsgesetz",
      "state": "Schleswig-Holstein",
      "amtsgericht": "Amtsgericht Pinneberg",
      "registernummer": "HRA 4933",
      "registerart": "HRA",
      "company_name": "Leibniz Privatschule Fördergesellschaft mbH & Co. KG",
      "company_seat": "Elmshorn",
      "details": "10.06.2025 (Bekanntmachungsdatum)\n\nSchleswig-Holstein Amtsgericht Pinneberg HRA 4933\nRegisterbekanntmachung nach dem Umwandlungsgesetz 06.06.2025 (Eintragungsdatum)\n\nLeibniz Privatschule Fördergesellschaft mbH & Co. KG\nKommanditgesellschaft\nElmshorn\n\nAls nicht eingetragen wird veröffentlicht: Den Gläubigern der an der Verschmelzung beteiligten Rechtsträger ist, wenn sie binnen sechs Monaten nach dem Tag, an dem die Eintragung der Verschmelzung in das Register des Sitzes desjenigen Rechtsträgers, dessen Gläubiger sie sind, als bekannt gemacht gilt, ihren Anspruch nach Grund und Höhe schriftlich anmelden, Sicherheit zu leisten, soweit sie nicht Befriedigung verlangen können. Dieses Recht steht den Gläubigern jedoch nur zu, wenn sie glaubhaft machen, dass durch die Verschmelzung die Erfüllung ihrer Forderung gefährdet wird. Das Recht, Sicherheitsleistung zu verlangen, steht Gläubigern nicht zu, die im Falle der Insolvenz ein Recht auf vorzugsweise Befriedigung aus einer Deckungsmasse haben, die nach gesetzlicher Vorschrift zu ihrem Schutz errichtet und staatlich überwacht ist."
    },
    {
      "date": "2025-06-10",
      "id": "111643",
      "original_text": "Einreichung neuer Dokumente\nBaden-Württemberg Amtsgericht Stuttgart HRB 775939\nKONECTA DEUTSCHLAND AG – Stuttgart",
      "type": "Einreichung neuer Dokumente",
      "state": "Baden-Württemberg",
      "amtsgericht": "Amtsgericht Stuttgart",
      "registernummer": "HRB 775939",
      "registerart": "HRB",
      "company_name": "KONECTA DEUTSCHLAND AG",
      "company_seat": "Stuttgart",
      "details": "10.06.2025 (Bekanntmachungsdatum)\n\nBaden-Württemberg Amtsgericht Stuttgart HRB 775939\nEinreichung neuer Dokumente 10.06.2025 (Eintragungsdatum)\n\nKONECTA DEUTSCHLAND AG\nAktiengesellschaft\nStuttgart\n\nDie Gesellschaft hat am 05.06.2025 die Liste über die Zusammensetzung des Aufsichtsrats zum Handelsregister eingereicht."
    },
    {
      "date": "2025-06-10",
      "id": "111644",
      "original_text": "Registerbekanntmachung nach dem Umwandlungsgesetz\nHamburg Amtsgericht Hamburg HRB 180935\nHBB Gewerbebau Objektgesellschaften mbH – Hamburg",
      "type": "Registerbekanntmachung nach dem Umwandlungsgesetz",
      "state": "Hamburg",
      "amtsgericht": "Amtsgericht Hamburg",
      "registernummer": "HRB 180935",
      "registerart": "HRB",
      "company_name": "HBB Gewerbebau Objektgesellschaften mbH",
      "company_seat": "Hamburg",
      "details": "10.06.2025 (Bekanntmachungsdatum)\n\nHamburg Amtsgericht Hamburg HRB 180935\nRegisterbekanntmachung nach dem Umwandlungsgesetz 10.06.2025 (Eintragungsdatum)\n\nHBB Gewerbebau Objektgesellschaften mbH\nGesellschaft mit beschränkter Haftung\nHamburg\n\nAls nicht eingetragen wird bekannt gemacht:\nDen Gläubigern der an der Verschmelzung beteiligten Gesellschaften ist, wenn sie binnen sechs Monaten nach dem Tag, an dem die Eintragung der Verschmelzung in das Register des Sitzes desjenigen Rechtsträgers, dessen Gläubiger sie sind, nach § 19 Absatz 3 UmwG als bekannt gemacht gilt, ihren Anspruch nach Grund und Höhe schriftlich anmelden, Sicherheit zu leisten, soweit sie nicht Befriedigung verlangen können. Dieses Recht steht den Gläubigern jedoch nur zu, wenn sie glaubhaft machen, dass durch die Verschmelzung die Erfüllung ihrer Forderung gefährdet wird."
    },
    {
      "date": "2025-06-10",
      "id": "111645",
      "original_text": "Registerbekanntmachung nach dem Umwandlungsgesetz\nBerlin Amtsgericht Berlin (Charlottenburg) HRB 248318\nUEBERBERG GmbH – Berlin",
      "type": "Registerbekanntmachung nach dem Umwandlungsgesetz",
      "state": "Berlin",
      "amtsgericht": "Amtsgericht Berlin (Charlottenburg)",
      "registernummer": "HRB 248318",
      "registerart": "HRB",
      "company_name": "UEBERBERG GmbH",
      "company_seat": "Berlin",
      "details": "10.06.2025 (Bekanntmachungsdatum)\n\nBerlin Amtsgericht Berlin (Charlottenburg) HRB 248318\nRegisterbekanntmachung nach dem Umwandlungsgesetz 06.06.2025 (Eintragungsdatum)\n\nUEBERBERG GmbH\nGesellschaft mit beschränkter Haftung\nBerlin\n\nZu Eintragungsnummer 4 vom 06.06.2025 wird als nicht eingetragen veröffentlicht: Den Gläubigern der an der Verschmelzung beteiligten Rechtsträger ist, wenn sie binnen sechs Monaten nach dem Tag, an dem die Eintragung der Verschmelzung in das Register des Sitzes desjenigen Rechtsträgers, dessen Gläubiger sie sind, als bekannt gemacht gilt, ihren Anspruch nach Grund und Höhe schriftlich anmelden, Sicherheit zu leisten, soweit sie nicht Befriedigung verlangen können. Dieses Recht steht den Gläubigern jedoch nur zu, wenn sie glaubhaft machen, dass durch die Verschmelzung die Erfüllung ihrer Forderung gefährdet wird. Das Recht, Sicherheitsleistung zu verlangen, steht Gläubigern nicht zu, die im Falle der Insolvenz ein Recht auf vorzugsweise Befriedigung aus einer Deckungsmasse haben, die nach gesetzlicher Vorschrift zu ihrem Schutz errichtet und staatlich überwacht ist."
    },
    {
      "date": "2025-06-10",
      "id": "111646",
      "original_text": "Einreichung neuer Dokumente\nBerlin Amtsgericht Berlin (Charlottenburg) HRB 98639\nWeberbank Actiengesellschaft – Berlin",
      "type": "Einreichung neuer Dokumente",
      "state": "Berlin",
      "amtsgericht": "Amtsgericht Berlin (Charlottenburg)",
      "registernummer": "HRB 98639",
      "registerart": "HRB",
      "company_name": "Weberbank Actiengesellschaft",
      "company_seat": "Berlin",
      "details": "10.06.2025 (Bekanntmachungsdatum)\n\nBerlin Amtsgericht Berlin (Charlottenburg) HRB 98639\nEinreichung neuer Dokumente\n\nWeberbank Actiengesellschaft\nAktiengesellschaft\nBerlin\n\nAls nicht eingetragen wird veröffentlicht: Es wurde eine neue Liste der Aufsichtsratsmitglieder eingereicht (§ 106 AktG)."
    },
    {
      "date": "2025-06-10",
      "id": "111647",
      "original_text": "Registerbekanntmachung nach dem Umwandlungsgesetz\nBerlin Amtsgericht Berlin (Charlottenburg) HRA 41605\nGBI Wohnungsbau GmbH & Co. KG – Berlin",
      "type": "Registerbekanntmachung nach dem Umwandlungsgesetz",
      "state": "Berlin",
      "amtsgericht": "Amtsgericht Berlin (Charlottenburg)",
      "registernummer": "HRA 41605",
      "registerart": "HRA",
      "company_name": "GBI Wohnungsbau GmbH & Co. KG",
      "company_seat": "Berlin",
      "details": "10.06.2025 (Bekanntmachungsdatum)\n\nBerlin Amtsgericht Berlin (Charlottenburg) HRA 41605\nRegisterbekanntmachung nach dem Umwandlungsgesetz 06.06.2025 (Eintragungsdatum)\n\nGBI Wohnungsbau GmbH & Co. KG\nKommanditgesellschaft\nBerlin\n\nZu Eintragungsnummer 19 vom 06.06.2025 wird als nicht eingetragen veröffentlicht: Den Gläubigern der an der Verschmelzung beteiligten Rechtsträger ist, wenn sie binnen sechs Monaten nach dem Tag, an dem die Eintragung der Verschmelzung in das Register des Sitzes desjenigen Rechtsträgers, dessen Gläubiger sie sind, als bekannt gemacht gilt, ihren Anspruch nach Grund und Höhe schriftlich anmelden, Sicherheit zu leisten, soweit sie nicht Befriedigung verlangen können. Dieses Recht steht den Gläubigern jedoch nur zu, wenn sie glaubhaft machen, dass durch die Verschmelzung die Erfüllung ihrer Forderung gefährdet wird. Das Recht, Sicherheitsleistung zu verlangen, steht Gläubigern nicht zu, die im Falle der Insolvenz ein Recht auf vorzugsweise Befriedigung aus einer Deckungsmasse haben, die nach gesetzlicher Vorschrift zu ihrem Schutz errichtet und staatlich überwacht ist."
    },
    {
      "date": "2025-06-10",
      "id": "111648",
      "original_text": "Löschungsankündigung\nSchleswig-Holstein Amtsgericht Lübeck HRB 17639\nRund ums Haus Service 24 GmbH – Lübeck",
      "type": "Löschungsankündigung",
      "state": "Schleswig-Holstein",
      "amtsgericht": "Amtsgericht Lübeck",
      "registernummer": "HRB 17639",
      "registerart": "HRB",
      "company_name": "Rund ums Haus Service 24 GmbH",
      "company_seat": "Lübeck",
      "details": "10.06.2025 (Bekanntmachungsdatum)\n\nSchleswig-Holstein Amtsgericht Lübeck HRB 17639\nLöschungsankündigung\n\nRund ums Haus Service 24 GmbH\nGesellschaft mit beschränkter Haftung\nLübeck\n\nEs ist die Löschung der nachstehenden Gesellschaft wegen Vermögenslosigkeit gemäß § 394 FamFG beabsichtigt."
    },
    {
      "date": "2025-06-10",
      "id": "111649",
      "original_text": "Einreichung neuer Dokumente\nBaden-Württemberg Amtsgericht Mannheim HRB 110206\nServiscope AG – Karlsruhe",
      "type": "Einreichung neuer Dokumente",
      "state": "Baden-Württemberg",
      "amtsgericht": "Amtsgericht Mannheim",
      "registernummer": "HRB 110206",
      "registerart": "HRB",
      "company_name": "Serviscope AG",
      "company_seat": "Karlsruhe",
      "details": "10.06.2025 (Bekanntmachungsdatum)\n\nBaden-Württemberg Amtsgericht Mannheim HRB 110206\nEinreichung neuer Dokumente 10.06.2025 (Eintragungsdatum)\n\nServiscope AG\nAktiengesellschaft\nKarlsruhe\n\nDie Gesellschaft hat am 06.06.2025 die Liste über die Zusammensetzung des Aufsichtsrats zum Handelsregister eingereicht."
    },
    {
      "date": "2025-06-10",
      "id": "111650",
      "original_text": "Einreichung neuer Dokumente\nBaden-Württemberg Amtsgericht Mannheim HRB 727217\ninit innovation in traffic systems SE – Karlsruhe",
      "type": "Einreichung neuer Dokumente",
      "state": "Baden-Württemberg",
      "amtsgericht": "Amtsgericht Mannheim",
      "registernummer": "HRB 727217",
      "registerart": "HRB",
      "company_name": "init innovation in traffic systems SE",
      "company_seat": "Karlsruhe",
      "details": "10.06.2025 (Bekanntmachungsdatum)\n\nBaden-Württemberg Amtsgericht Mannheim HRB 727217\nEinreichung neuer Dokumente\n\ninit innovation in traffic systems SE\nEuropäische Aktiengesellschaft (SE)\nKarlsruhe\n\nDie Gesellschaft hat am 09.06.2025 die Liste über die Zusammensetzung des Aufsichtsrats zum Handelsregister eingereicht."
    },
    {
      "date": "2025-06-10",
      "id": "111651",
      "original_text": "Löschungsankündigung\nBerlin Amtsgericht Berlin (Charlottenburg) HRB 231819\nBORA Reinigungsservice UG (haftungsbeschränkt) – Berlin",
      "type": "Löschungsankündigung",
      "state": "Berlin",
      "amtsgericht": "Amtsgericht Berlin (Charlottenburg)",
      "registernummer": "HRB 231819",
      "registerart": "HRB",
      "company_name": "BORA Reinigungsservice UG (haftungsbeschränkt)",
      "company_seat": "Berlin",
      "details": "10.06.2025 (Bekanntmachungsdatum)\n\nBerlin Amtsgericht Berlin (Charlottenburg) HRB 231819\nLöschungsankündigung\n\nBORA Reinigungsservice UG (haftungsbeschränkt)\nGesellschaft mit beschränkter Haftung\nBerlin\n\nBei der nachstehenden Gesellschaft wird das Amtslöschungsverfahren gemäß § 394 FamFG eingeleitet. Widerspruchsfrist 6 Wochen"
    },
    {
      "date": "2025-06-10",
      "id": "111652",
      "original_text": "Einreichung neuer Dokumente\nBaden-Württemberg Amtsgericht Stuttgart HRB 777361\nStrawtec Group AG – Stuttgart",
      "type": "Einreichung neuer Dokumente",
      "state": "Baden-Württemberg",
      "amtsgericht": "Amtsgericht Stuttgart",
      "registernummer": "HRB 777361",
      "registerart": "HRB",
      "company_name": "Strawtec Group AG",
      "company_seat": "Stuttgart",
      "details": "10.06.2025 (Bekanntmachungsdatum)\n\nBaden-Württemberg Amtsgericht Stuttgart HRB 777361\nEinreichung neuer Dokumente\n\nStrawtec Group AG\nAktiengesellschaft\nStuttgart\n\nDie Gesellschaft hat am 05.06.2025 die Liste über die Zusammensetzung des Aufsichtsrats zum Handelsregister eingereicht."
    },
    {
      "date": "2025-06-10",
      "id": "111653",
      "original_text": "Registerbekanntmachung nach dem Umwandlungsgesetz\nBaden-Württemberg Amtsgericht Stuttgart HRB 792381\nTE Immobilien GmbH – Kornwestheim",
      "type": "Registerbekanntmachung nach dem Umwandlungsgesetz",
      "state": "Baden-Württemberg",
      "amtsgericht": "Amtsgericht Stuttgart",
      "registernummer": "HRB 792381",
      "registerart": "HRB",
      "company_name": "TE Immobilien GmbH",
      "company_seat": "Kornwestheim",
      "details": "10.06.2025 (Bekanntmachungsdatum)\n\nBaden-Württemberg Amtsgericht Stuttgart HRB 792381\nRegisterbekanntmachung nach dem Umwandlungsgesetz 10.06.2025 (Eintragungsdatum)\n\nTE Immobilien GmbH\nGesellschaft mit beschränkter Haftung\nKornwestheim\n\nAls nicht eingetragen wird bekanntgemacht:\nDen Gläubigern der an der Verschmelzung beteiligten Rechtsträger ist, wenn sie binnen sechs Monaten nach dem Tag, an dem die Eintragung der Verschmelzung in das Register des Sitzes desjenigen Rechtsträgers, dessen Gläubiger sie sind, nach § 19 Abs. 3 UmwG als bekanntgemacht gilt, ihren Anspruch nach Grund und Höhe schriftlich anmelden, Sicherheit zu leisten, soweit sie nicht Befriedigung verlangen können. Dieses Recht steht den Gläubigern jedoch nur zu, wenn sie glaubhaft machen, dass durch die Verschmelzung die Erfüllung ihrer Forderung gefährdet wird."
    },
    {
      "date": "2025-06-10",
      "id": "111654",
      "original_text": "Löschungsankündigung\nSchleswig-Holstein Amtsgericht Pinneberg HRB 15716\nISD Info Service Dialog UG (haftungsbeschränkt) – Schenefeld/Krs. Pinneberg",
      "type": "Löschungsankündigung",
      "state": "Schleswig-Holstein",
      "amtsgericht": "Amtsgericht Pinneberg",
      "registernummer": "HRB 15716",
      "registerart": "HRB",
      "company_name": "ISD Info Service Dialog UG (haftungsbeschränkt)",
      "company_seat": "Schenefeld/Krs. Pinneberg",
      "details": "10.06.2025 (Bekanntmachungsdatum)\n\nSchleswig-Holstein Amtsgericht Pinneberg HRB 15716\nLöschungsankündigung\n\nISD Info Service Dialog UG (haftungsbeschränkt)\nGesellschaft mit beschränkter Haftung\nSchenefeld/Krs. Pinneberg\n\nEs ist die Löschung der nachstehenden Gesellschaft wegen Vermögenslosigkeit gemäß § 394 FamFG beabsichtigt. Widerspruchsfrist: 2 Monate."
    },
    {
      "date": "2025-06-10",
      "id": "111655",
      "original_text": "Registerbekanntmachung nach dem Umwandlungsgesetz\nBaden-Württemberg Amtsgericht Stuttgart HRB 750363\nFLORIGARD GmbH – Gechingen",
      "type": "Registerbekanntmachung nach dem Umwandlungsgesetz",
      "state": "Baden-Württemberg",
      "amtsgericht": "Amtsgericht Stuttgart",
      "registernummer": "HRB 750363",
      "registerart": "HRB",
      "company_name": "FLORIGARD GmbH",
      "company_seat": "Gechingen",
      "details": "10.06.2025 (Bekanntmachungsdatum)\n\nBaden-Württemberg Amtsgericht Stuttgart HRB 750363\nRegisterbekanntmachung nach dem Umwandlungsgesetz 10.06.2025 (Eintragungsdatum)\n\nFLORIGARD GmbH\nGesellschaft mit beschränkter Haftung\nGechingen\n\nDen Gläubigern der an der Verschmelzung beteiligten Rechtsträger ist, wenn sie binnen sechs Monaten nach dem Tag, an dem die Eintragung der Verschmelzung in das Register des Sitzes desjenigen Rechtsträgers, dessen Gläubiger sie sind, nach § 19 Abs. 3 UmwG als bekanntgemacht gilt, ihren Anspruch nach Grund und Höhe schriftlich anmelden, Sicherheit zu leisten, soweit sie nicht Befriedigung verlangen können. Dieses Recht steht den Gläubigern jedoch nur zu, wenn sie glaubhaft machen, dass durch die Verschmelzung die Erfüllung ihrer Forderung gefährdet wird."
    },
    {
      "date": "2025-06-10",
      "id": "111656",
      "original_text": "Registerbekanntmachung nach dem Umwandlungsgesetz\nBrandenburg Amtsgericht Cottbus HRA 4398\nLars Tobisch e.K. – Bestensee",
      "type": "Registerbekanntmachung nach dem Umwandlungsgesetz",
      "state": "Brandenburg",
      "amtsgericht": "Amtsgericht Cottbus",
      "registernummer": "HRA 4398",
      "registerart": "HRA",
      "company_name": "Lars Tobisch e.K.",
      "company_seat": "Bestensee",
      "details": "10.06.2025 (Bekanntmachungsdatum)\n\nBrandenburg Amtsgericht Cottbus HRA 4398\nRegisterbekanntmachung nach dem Umwandlungsgesetz 05.06.2025 (Eintragungsdatum)\n\nLars Tobisch e.K.\nEinzelkaufmann / Einzelkauffrau\nBestensee\n\nZu Eintragungsnummer 2 vom 05.06.2025 wird als nicht eingetragen veröffentlicht:\nDen Gläubigern der an der Ausgliederung beteiligten Rechtsträger ist, wenn sie binnen sechs Monaten nach dem Tag, an dem die Eintragung der Ausgliederung in das Register des Sitzes desjenigen Rechtsträgers, dessen Gläubiger sie sind, als bekannt gemacht gilt, ihren Anspruch nach Grund und Höhe schriftlich anmelden, Sicherheit zu leisten, soweit sie nicht Befriedigung verlangen können. Dieses Recht steht den Gläubigern jedoch nur zu, wenn sie glaubhaft machen, dass durch die Ausgliederung die Erfüllung ihrer Forderung gefährdet wird"
    },
    {
      "date": "2025-06-10",
      "id": "111657",
      "original_text": "Registerbekanntmachung nach dem Umwandlungsgesetz\nHamburg Amtsgericht Hamburg HRB 131910\nAviaRent MikroQuartier 1 GmbH – Hamburg",
      "type": "Registerbekanntmachung nach dem Umwandlungsgesetz",
      "state": "Hamburg",
      "amtsgericht": "Amtsgericht Hamburg",
      "registernummer": "HRB 131910",
      "registerart": "HRB",
      "company_name": "AviaRent MikroQuartier 1 GmbH",
      "company_seat": "Hamburg",
      "details": "10.06.2025 (Bekanntmachungsdatum)\n\nHamburg Amtsgericht Hamburg HRB 131910\nRegisterbekanntmachung nach dem Umwandlungsgesetz 10.06.2025 (Eintragungsdatum)\n\nAviaRent MikroQuartier 1 GmbH\nGesellschaft mit beschränkter Haftung\nHamburg\n\nAls nicht eingetragen wird bekannt gemacht:\nDen Gläubigern der an der Verschmelzung beteiligten Gesellschaften ist, wenn sie binnen sechs Monaten nach dem Tag, an dem die Eintragung der Verschmelzung in das Register des Sitzes derjenigen Rechtsträger deren Gläubiger sie sind, nach § 19 Absatz 3 UmwG als bekannt gemacht gilt, ihren Anspruch nach Grund und Höhe schriftlich anmelden, Sicherheit zu leisten, soweit sie nicht Befriedigung verlangen können. Dieses Recht steht den Gläubigern jedoch nur zu, wenn sie glaubhaft machen, dass durch die Verschmelzung die Erfüllung ihrer Forderung gefährdet wird."
    },
    {
      "date": "2025-06-10",
      "id": "111658",
      "original_text": "Einreichung neuer Dokumente\nSchleswig-Holstein Amtsgericht Pinneberg HRB 18299\nSchleswig-Holstein Netz GmbH – Quickborn/Krs. Pinneberg",
      "type": "Einreichung neuer Dokumente",
      "state": "Schleswig-Holstein",
      "amtsgericht": "Amtsgericht Pinneberg",
      "registernummer": "HRB 18299",
      "registerart": "HRB",
      "company_name": "Schleswig-Holstein Netz GmbH",
      "company_seat": "Quickborn/Krs. Pinneberg",
      "details": "10.06.2025 (Bekanntmachungsdatum)\n\nSchleswig-Holstein Amtsgericht Pinneberg HRB 18299\nEinreichung neuer Dokumente\n\nSchleswig-Holstein Netz GmbH\nGesellschaft mit beschränkter Haftung\nQuickborn/Krs. Pinneberg\n\nAls nicht eingetragen wird veröffentlicht: Eine neue Liste gemäß § 10 HGB wurde zum Register eingereicht."
    },
    {
      "date": "2025-06-10",
      "id": "111659",
      "original_text": "Löschungsankündigung\nBerlin Amtsgericht Berlin (Charlottenburg) HRB 161282\nInizio Service GmbH – Berlin",
      "type": "Löschungsankündigung",
      "state": "Berlin",
      "amtsgericht": "Amtsgericht Berlin (Charlottenburg)",
      "registernummer": "HRB 161282",
      "registerart": "HRB",
      "company_name": "Inizio Service GmbH",
      "company_seat": "Berlin",
      "details": "10.06.2025 (Bekanntmachungsdatum)\n\nBerlin Amtsgericht Berlin (Charlottenburg) HRB 161282\nLöschungsankündigung\n\nInizio Service GmbH\nGesellschaft mit beschränkter Haftung\nBerlin\n\nBei der nachstehenden Gesellschaft wird das Amtslöschungsverfahren gemäß § 394 FamFG eingeleitet. Widerspruchsfrist 6 Wochen"
    },
    {
      "date": "2025-06-10",
      "id": "111660",
      "original_text": "Einreichung neuer Dokumente\nSchleswig-Holstein Amtsgericht Kiel HRB 19\nBürgschaftsbank Schleswig-Holstein GmbH – Kiel",
      "type": "Einreichung neuer Dokumente",
      "state": "Schleswig-Holstein",
      "amtsgericht": "Amtsgericht Kiel",
      "registernummer": "HRB 19",
      "registerart": "HRB",
      "company_name": "Bürgschaftsbank Schleswig-Holstein GmbH",
      "company_seat": "Kiel",
      "details": "10.06.2025 (Bekanntmachungsdatum)\n\nSchleswig-Holstein Amtsgericht Kiel HRB 19\nEinreichung neuer Dokumente\n\nBürgschaftsbank Schleswig-Holstein GmbH\nGesellschaft mit beschränkter Haftung\nKiel\n\nAls nicht eingetragen wird veröffentlicht: Eine neue Liste der Aufsichtsratsmitglieder ist eingereicht worden."
    },
    {
      "date": "2025-06-10",
      "id": "111661",
      "original_text": "Einreichung neuer Dokumente\nHamburg Amtsgericht Hamburg HRB 141606\nKörber Technologies GmbH – Hamburg",
      "type": "Einreichung neuer Dokumente",
      "state": "Hamburg",
      "amtsgericht": "Amtsgericht Hamburg",
      "registernummer": "HRB 141606",
      "registerart": "HRB",
      "company_name": "Körber Technologies GmbH",
      "company_seat": "Hamburg",
      "details": "10.06.2025 (Bekanntmachungsdatum)\n\nHamburg Amtsgericht Hamburg HRB 141606\nEinreichung neuer Dokumente 10.06.2025 (Eintragungsdatum)\n\nKörber Technologies GmbH\nGesellschaft mit beschränkter Haftung\nHamburg\n\nAls nicht eingetragen wird bekannt gemacht: Liste des Aufsichtsrats wurde eingereicht."
    },
    {
      "date": "2025-06-10",
      "id": "111662",
      "original_text": "Löschungsankündigung\nBaden-Württemberg Amtsgericht Ulm HRB 730482\nBetonbau CELIK UG (haftungsbeschränkt) – Crailsheim",
      "type": "Löschungsankündigung",
      "state": "Baden-Württemberg",
      "amtsgericht": "Amtsgericht Ulm",
      "registernummer": "HRB 730482",
      "registerart": "HRB",
      "company_name": "Betonbau CELIK UG (haftungsbeschränkt)",
      "company_seat": "Crailsheim",
      "details": "10.06.2025 (Bekanntmachungsdatum)\n\nBaden-Württemberg Amtsgericht Ulm HRB 730482\nLöschungsankündigung\n\nBetonbau CELIK UG (haftungsbeschränkt)\nGesellschaft mit beschränkter Haftung\nCrailsheim\n\nDas Gericht beabsichtigt, die Gesellschaft wegen Vermögenslosigkeit im Handelsregister von Amts wegen nach § 394 FamFG zu löschen. Die Frist zur Geltendmachung eines Widerspruchs gegen die beabsichtigte Löschung ist auf  einen Monat ab Veröffentlichung bestimmt."
    },
    {
      "date": "2025-06-10",
      "id": "111663",
      "original_text": "Einreichung neuer Dokumente\nBaden-Württemberg Amtsgericht Stuttgart HRB 22864\nAdVertum Vermögensmanagement AG – Stuttgart",
      "type": "Einreichung neuer Dokumente",
      "state": "Baden-Württemberg",
      "amtsgericht": "Amtsgericht Stuttgart",
      "registernummer": "HRB 22864",
      "registerart": "HRB",
      "company_name": "AdVertum Vermögensmanagement AG",
      "company_seat": "Stuttgart",
      "details": "10.06.2025 (Bekanntmachungsdatum)\n\nBaden-Württemberg Amtsgericht Stuttgart HRB 22864\nEinreichung neuer Dokumente\n\nAdVertum Vermögensmanagement  AG\nAktiengesellschaft\nStuttgart\n\nDie Gesellschaft hat am 03.06.2025 die Liste über die Zusammensetzung des Aufsichtsrats zum Handelsregister eingereicht."
    },
    {
      "date": "2025-06-10",
      "id": "111664",
      "original_text": "Registerbekanntmachung nach dem Umwandlungsgesetz\nMecklenburg-Vorpommern Amtsgericht Schwerin HRB 10944\nbiotherm Hagenow GmbH – Hagenow",
      "type": "Registerbekanntmachung nach dem Umwandlungsgesetz",
      "state": "Mecklenburg-Vorpommern",
      "amtsgericht": "Amtsgericht Schwerin",
      "registernummer": "HRB 10944",
      "registerart": "HRB",
      "company_name": "biotherm Hagenow GmbH",
      "company_seat": "Hagenow",
      "details": "10.06.2025 (Bekanntmachungsdatum)\n\nMecklenburg-Vorpommern Amtsgericht Schwerin HRB 10944\nRegisterbekanntmachung nach dem Umwandlungsgesetz 10.06.2025 (Eintragungsdatum)\n\nbiotherm Hagenow GmbH\nGesellschaft mit beschränkter Haftung\nHagenow\n\nDie Gesellschaft hat Gläubigern, deren Forderungen vor dieser Bekanntmachung begründet worden sind, Sicherheit zu leisten, soweit sie nicht Befriedigung verlangen können, wenn sie sich binnen sechs Monaten zu diesem Zweck melden."
    },
    {
      "date": "2025-06-10",
      "id": "111665",
      "original_text": "Registerbekanntmachung nach dem Umwandlungsgesetz\nMecklenburg-Vorpommern Amtsgericht Schwerin HRB 10921\nbiotherm Services GmbH – Hagenow",
      "type": "Registerbekanntmachung nach dem Umwandlungsgesetz",
      "state": "Mecklenburg-Vorpommern",
      "amtsgericht": "Amtsgericht Schwerin",
      "registernummer": "HRB 10921",
      "registerart": "HRB",
      "company_name": "biotherm Services GmbH",
      "company_seat": "Hagenow",
      "details": "10.06.2025 (Bekanntmachungsdatum)\n\nMecklenburg-Vorpommern Amtsgericht Schwerin HRB 10921\nRegisterbekanntmachung nach dem Umwandlungsgesetz 10.06.2025 (Eintragungsdatum)\n\nbiotherm Services GmbH\nGesellschaft mit beschränkter Haftung\nHagenow\n\nDen Gläubigern der an der Verschmelzung beteiligten Gesellschaften ist, wenn sie binnen sechs Monaten nach dem Tag, an dem die Eintragung der Verschmelzungen in das Register des Sitzes desjenigen Rechtsträgers, dessen Gläubiger sie sind, nach § 19 Absatz 3 UmwG als bekanntgemacht gilt, ihren Anspruch nach Grund und Höhe schriftlich anmelden, Sicherheit zu leisten, soweit sie nicht Befriedigung verlangen können. Dieses Recht steht den Gläubigern jedoch nur zu, wenn sie glaubhaft machen, dass durch die Verschmelzung die Erfüllung ihrer Forderung gefährdet wird."
    },
    {
      "date": "2025-06-10",
      "id": "111666",
      "original_text": "Registerbekanntmachung nach dem Umwandlungsgesetz\nMecklenburg-Vorpommern Amtsgericht Schwerin HRB 13658\nRausch Schadstoffsanierungen GmbH – Selmsdorf",
      "type": "Registerbekanntmachung nach dem Umwandlungsgesetz",
      "state": "Mecklenburg-Vorpommern",
      "amtsgericht": "Amtsgericht Schwerin",
      "registernummer": "HRB 13658",
      "registerart": "HRB",
      "company_name": "Rausch Schadstoffsanierungen GmbH",
      "company_seat": "Selmsdorf",
      "details": "10.06.2025 (Bekanntmachungsdatum)\n\nMecklenburg-Vorpommern Amtsgericht Schwerin HRB 13658\nRegisterbekanntmachung nach dem Umwandlungsgesetz 10.06.2025 (Eintragungsdatum)\n\nRausch Schadstoffsanierungen GmbH\nGesellschaft mit beschränkter Haftung\nSelmsdorf\n\nDen Gläubigern der an der Verschmelzung beteiligten Gesellschaften ist, wenn sie binnen sechs Monaten nach dem Tag, an dem die Eintragung der Verschmelzungen in das Register des Sitzes desjenigen Rechtsträgers, dessen Gläubiger sie sind, nach § 19 Absatz 3 UmwG als bekanntgemacht gilt, ihren Anspruch nach Grund und Höhe schriftlich anmelden, Sicherheit zu leisten, soweit sie nicht Befriedigung verlangen können. Dieses Recht steht den Gläubigern jedoch nur zu, wenn sie glaubhaft machen, dass durch die Verschmelzung die Erfüllung ihrer Forderung gefährdet wird."
    },
    {
      "date": "2025-06-10",
      "id": "111667",
      "original_text": "Registerbekanntmachung nach dem Umwandlungsgesetz\nMecklenburg-Vorpommern Amtsgericht Schwerin HRB 10078\nRausch Immobiliendienstleistungen GmbH – Selmsdorf",
      "type": "Registerbekanntmachung nach dem Umwandlungsgesetz",
      "state": "Mecklenburg-Vorpommern",
      "amtsgericht": "Amtsgericht Schwerin",
      "registernummer": "HRB 10078",
      "registerart": "HRB",
      "company_name": "Rausch Immobiliendienstleistungen GmbH",
      "company_seat": "Selmsdorf",
      "details": "10.06.2025 (Bekanntmachungsdatum)\n\nMecklenburg-Vorpommern Amtsgericht Schwerin HRB 10078\nRegisterbekanntmachung nach dem Umwandlungsgesetz 10.06.2025 (Eintragungsdatum)\n\nRausch Immobiliendienstleistungen GmbH\nGesellschaft mit beschränkter Haftung\nSelmsdorf\n\nDen Gläubigern der an der Verschmelzung beteiligten Gesellschaften ist, wenn sie binnen sechs Monaten nach dem Tag, an dem die Eintragung der Verschmelzungen in das Register des Sitzes desjenigen Rechtsträgers, dessen Gläubiger sie sind, nach § 19 Absatz 3 UmwG als bekanntgemacht gilt, ihren Anspruch nach Grund und Höhe schriftlich anmelden, Sicherheit zu leisten, soweit sie nicht Befriedigung verlangen können. Dieses Recht steht den Gläubigern jedoch nur zu, wenn sie glaubhaft machen, dass durch die Verschmelzung die Erfüllung ihrer Forderung gefährdet wird."
    },
    {
      "date": "2025-06-10",
      "id": "111668",
      "original_text": "Einreichung neuer Dokumente\nSachsen-Anhalt Amtsgericht Stendal HRB 10997\nWeißandt-Gölzauer Agrar AG – Südliches Anhalt",
      "type": "Einreichung neuer Dokumente",
      "state": "Sachsen-Anhalt",
      "amtsgericht": "Amtsgericht Stendal",
      "registernummer": "HRB 10997",
      "registerart": "HRB",
      "company_name": "Weißandt-Gölzauer Agrar AG",
      "company_seat": "Südliches Anhalt",
      "details": "10.06.2025 (Bekanntmachungsdatum)\n\nSachsen-Anhalt Amtsgericht Stendal HRB 10997\nEinreichung neuer Dokumente 10.06.2025 (Eintragungsdatum)\n\nWeißandt-Gölzauer Agrar AG\nAktiengesellschaft\nSüdliches Anhalt\n\nZwei Listen der Mitglieder des Aufsichtsrates ( Stand 19.09.2019 und 30.01.2025) wurden zum Handelsregister eingereicht."
    },
    {
      "date": "2025-06-10",
      "id": "111669",
      "original_text": "Einreichung neuer Dokumente\nSaarland Amtsgericht Saarbrücken HRB 91277\nWZB Werkstattzentrum für behinderte Menschen der Lebenshilfe, Gemeinnützige Gesellschaft mit beschränkter Haftung – Spiesen-Elversberg",
      "type": "Einreichung neuer Dokumente",
      "state": "Saarland",
      "amtsgericht": "Amtsgericht Saarbrücken",
      "registernummer": "HRB 91277",
      "registerart": "HRB",
      "company_name": "WZB Werkstattzentrum für behinderte Menschen der Lebenshilfe, Gemeinnützige Gesellschaft mit beschränkter Haftung",
      "company_seat": "Spiesen-Elversberg",
      "details": "10.06.2025 (Bekanntmachungsdatum)\n\nSaarland Amtsgericht Saarbrücken HRB 91277\nEinreichung neuer Dokumente\n\nWZB Werkstattzentrum für behinderte Menschen der Lebenshilfe, Gemeinnützige Gesellschaft mit beschränkter Haftung\nGesellschaft mit beschränkter Haftung\nSpiesen-Elversberg\n\nDie Geschäftsführung der Gesellschaft hat eine Liste der Mitglieder des Aufsichtsrats zum Handelsregister eingereicht (§ 52 Abs. 3 Satz 2 GmbHG)."
    },
    {
      "date": "2025-06-10",
      "id": "111670",
      "original_text": "Löschungsankündigung\nBerlin Amtsgericht Berlin (Charlottenburg) HRB 207012\nbear-e-commerce UG (haftungsbeschränkt) – Berlin",
      "type": "Löschungsankündigung",
      "state": "Berlin",
      "amtsgericht": "Amtsgericht Berlin (Charlottenburg)",
      "registernummer": "HRB 207012",
      "registerart": "HRB",
      "company_name": "bear-e-commerce UG (haftungsbeschränkt)",
      "company_seat": "Berlin",
      "details": "10.06.2025 (Bekanntmachungsdatum)\n\nBerlin Amtsgericht Berlin (Charlottenburg) HRB 207012\nLöschungsankündigung\n\nbear-e-commerce UG (haftungsbeschränkt)\nGesellschaft mit beschränkter Haftung\nBerlin\n\nBei der nachstehenden Gesellschaft wird das Amtslöschungsverfahren gemäß § 394 FamFG eingeleitet. Widerspruchsfrist 6 Wochen"
    },
    {
      "date": "2025-06-10",
      "id": "111671",
      "original_text": "Registerbekanntmachung nach dem Umwandlungsgesetz\nBaden-Württemberg Amtsgericht Stuttgart HRB 786466\nKOMPETENZ Expertenverlag GmbH – Kornwestheim",
      "type": "Registerbekanntmachung nach dem Umwandlungsgesetz",
      "state": "Baden-Württemberg",
      "amtsgericht": "Amtsgericht Stuttgart",
      "registernummer": "HRB 786466",
      "registerart": "HRB",
      "company_name": "KOMPETENZ Expertenverlag GmbH",
      "company_seat": "Kornwestheim",
      "details": "10.06.2025 (Bekanntmachungsdatum)\n\nBaden-Württemberg Amtsgericht Stuttgart HRB 786466\nRegisterbekanntmachung nach dem Umwandlungsgesetz 10.06.2025 (Eintragungsdatum)\n\nKOMPETENZ Expertenverlag GmbH\nGesellschaft mit beschränkter Haftung\nKornwestheim\n\nAls nicht eingetragen wird bekanntgemacht:\nDen Gläubigern der an der Verschmelzung beteiligten Rechtsträger ist, wenn sie binnen sechs Monaten nach dem Tag, an dem die Eintragung der Verschmelzung in das Register des Sitzes desjenigen Rechtsträgers, dessen Gläubiger sie sind, nach § 19 Abs. 3 UmwG als bekanntgemacht gilt, ihren Anspruch nach Grund und Höhe schriftlich anmelden, Sicherheit zu leisten, soweit sie nicht Befriedigung verlangen können. Dieses Recht steht den Gläubigern jedoch nur zu, wenn sie glaubhaft machen, dass durch die Verschmelzung die Erfüllung ihrer Forderung gefährdet wird."
    },
    {
      "date": "2025-06-10",
      "id": "111672",
      "original_text": "Sonstige Registerbekanntmachung\nBaden-Württemberg Amtsgericht Ulm GnR 530031\nRaiffeisenbank Ottenbach eG – Ottenbach",
      "type": "Sonstige Registerbekanntmachung",
      "state": "Baden-Württemberg",
      "amtsgericht": "Amtsgericht Ulm",
      "registernummer": "GnR 530031",
      "registerart": "GnR",
      "company_name": "Raiffeisenbank Ottenbach eG",
      "company_seat": "Ottenbach",
      "details": "10.06.2025 (Bekanntmachungsdatum)\n\nBaden-Württemberg Amtsgericht Ulm GnR 530031\nSonstige Registerbekanntmachung 10.06.2025 (Eintragungsdatum)\n\nRaiffeisenbank Ottenbach eG\neingetragene Genossenschaft\nOttenbach\n\nAls nicht eingetragen wird bekanntgemacht:\nDie Verpflichtung der Genossen, Nachschüsse zur Insolvenzmasse zu leisten, wurde aufgehoben. Den Gläubigern der Genossenschaft ist, wenn sie sich binnen sechs Monaten nach der Bekanntmachung bei der Genossenschaft zu diesem Zweck melden, Sicherheit zu leisten, soweit sie nicht Befriedigung verlangen können."
    },
    {
      "date": "2025-06-10",
      "id": "111673",
      "original_text": "Löschungsankündigung\nSachsen-Anhalt Amtsgericht Stendal HRA 6315\nMaschinen-Metall-Heizungsbau Querfurth GmbH & Co. KG – Tangermünde",
      "type": "Löschungsankündigung",
      "state": "Sachsen-Anhalt",
      "amtsgericht": "Amtsgericht Stendal",
      "registernummer": "HRA 6315",
      "registerart": "HRA",
      "company_name": "Maschinen-Metall-Heizungsbau Querfurth GmbH & Co. KG",
      "company_seat": "Tangermünde",
      "details": "10.06.2025 (Bekanntmachungsdatum)\n\nSachsen-Anhalt Amtsgericht Stendal HRA 6315\nLöschungsankündigung\n\nMaschinen-Metall-Heizungsbau Querfurth GmbH & Co. KG\nKommanditgesellschaft\nTangermünde\n\nDas Registergericht beabsichtigt, nachfolgende im Handelregister eingetragenen Firmen von Amts wegen nach § 394 FamFG zu löschen. Die Frist zu Erhebung eines Widerspruchs wird auf drei Monate festgesetzt."
    },
    {
      "date": "2025-06-10",
      "id": "111674",
      "original_text": "Löschungsankündigung\nSchleswig-Holstein Amtsgericht Flensburg HRA 491\nKarl G. Hansen GmbH & Co.KG – Flensburg",
      "type": "Löschungsankündigung",
      "state": "Schleswig-Holstein",
      "amtsgericht": "Amtsgericht Flensburg",
      "registernummer": "HRA 491",
      "registerart": "HRA",
      "company_name": "Karl G. Hansen GmbH & Co.KG",
      "company_seat": "Flensburg",
      "details": "10.06.2025 (Bekanntmachungsdatum)\n\nSchleswig-Holstein Amtsgericht Flensburg HRA 491\nLöschungsankündigung\n\nKarl G. Hansen GmbH & Co.KG\nKommanditgesellschaft\nFlensburg\n\nEs ist die Löschung der nachstehenden Gesellschaft wegen Vermögenslosigkeit gemäß § 394 FamFG beabsichtigt.\nWiderspruchsfrist: 2 Monate."
    },
    {
      "date": "2025-06-10",
      "id": "111675",
      "original_text": "Einreichung neuer Dokumente\nBaden-Württemberg Amtsgericht Freiburg HRB 5979\nAbfallwirtschaft und Stadtreinigung Freiburg GmbH – Freiburg im Breisgau",
      "type": "Einreichung neuer Dokumente",
      "state": "Baden-Württemberg",
      "amtsgericht": "Amtsgericht Freiburg",
      "registernummer": "HRB 5979",
      "registerart": "HRB",
      "company_name": "Abfallwirtschaft und Stadtreinigung Freiburg GmbH",
      "company_seat": "Freiburg im Breisgau",
      "details": "10.06.2025 (Bekanntmachungsdatum)\n\nBaden-Württemberg Amtsgericht Freiburg HRB 5979\nEinreichung neuer Dokumente\n\nAbfallwirtschaft und Stadtreinigung Freiburg GmbH\nGesellschaft mit beschränkter Haftung\nFreiburg im Breisgau\n\nDie Gesellschaft hat am 28.05.2025 die Liste über die Zusammensetzung des Aufsichtsrats zum Handelsregister eingereicht."
    },
    {
      "date": "2025-06-10",
      "id": "111676",
      "original_text": "Löschungsankündigung\nSachsen Amtsgericht Dresden HRB 24536\nPiazzaNova Gastronomie GmbH – Dresden",
      "type": "Löschungsankündigung",
      "state": "Sachsen",
      "amtsgericht": "Amtsgericht Dresden",
      "registernummer": "HRB 24536",
      "registerart": "HRB",
      "company_name": "PiazzaNova Gastronomie GmbH",
      "company_seat": "Dresden",
      "details": "10.06.2025 (Bekanntmachungsdatum)\n\nSachsen Amtsgericht Dresden HRB 24536\nLöschungsankündigung\n\nPiazzaNova Gastronomie GmbH\nGesellschaft mit beschränkter Haftung\nDresden\n\nDas Registergericht beabsichtigt, die im Handelsregister eingetragene Gesellschaft von Amts wegen nach § 394 FamFG zu löschen. Die Frist zu Erhebung eines Widerspruchs gegen die beabsichtigte Löschung wird auf einen Monat festgesetzt."
    },
    {
      "date": "2025-06-10",
      "id": "111677",
      "original_text": "Registerbekanntmachung nach dem Umwandlungsgesetz\nSachsen Amtsgericht Dresden HRB 43144\nP-D Refractories Feuerfestwerke GmbH – Wilsdruff",
      "type": "Registerbekanntmachung nach dem Umwandlungsgesetz",
      "state": "Sachsen",
      "amtsgericht": "Amtsgericht Dresden",
      "registernummer": "HRB 43144",
      "registerart": "HRB",
      "company_name": "P-D Refractories Feuerfestwerke GmbH",
      "company_seat": "Wilsdruff",
      "details": "10.06.2025 (Bekanntmachungsdatum)\n\nSachsen Amtsgericht Dresden HRB 43144\nRegisterbekanntmachung nach dem Umwandlungsgesetz 10.06.2025 (Eintragungsdatum)\n\nP-D Refractories Feuerfestwerke GmbH\nGesellschaft mit beschränkter Haftung\nWilsdruff\n\nDen Gläubigern der an der Verschmelzung beteiligten Rechtsträger ist, wenn sie binnen sechs Monaten nach dem Tag, an dem die Eintragung der Verschmelzung in das Register des Sitzes desjenigen Rechtsträgers, dessen Gläubiger sie sind, nach § 19 Abs. 3 UmwG als bekannt gemacht gilt, ihren Anspruch nach Grund und Höhe in Textform anmelden, Sicherheit zu leisten, soweit sie nicht Befriedigung verlangen können. Dieses Recht steht den Gläubigern jedoch nur zu, wenn sie glaubhaft machen, dass durch die Verschmelzung die Erfüllung der Forderung gefährdet wird."
    },
    {
      "date": "2025-06-10",
      "id": "111678",
      "original_text": "Löschungsankündigung\nSachsen Amtsgericht Chemnitz HRB 134\nMerker-Metallverarbeitung Gesellschaft mit beschränkter Haftung – Oberlungwitz",
      "type": "Löschungsankündigung",
      "state": "Sachsen",
      "amtsgericht": "Amtsgericht Chemnitz",
      "registernummer": "HRB 134",
      "registerart": "HRB",
      "company_name": "Merker-Metallverarbeitung Gesellschaft mit beschränkter Haftung",
      "company_seat": "Oberlungwitz",
      "details": "10.06.2025 (Bekanntmachungsdatum)\n\nSachsen Amtsgericht Chemnitz HRB 134\nLöschungsankündigung\n\nMerker-Metallverarbeitung Gesellschaft mit beschränkter Haftung\nGesellschaft mit beschränkter Haftung\nOberlungwitz\n\nDas Registergericht beabsichtigt, die im Handelsregister eingetragene Gesellschaft von Amts wegen nach § 394 FamFG zu löschen. Die Frist zu Erhebung eines Widerspruchs gegen die beabsichtigte Löschung wird auf einen Monat festgesetzt."
    },
    {
      "date": "2025-06-10",
      "id": "111679",
      "original_text": "Löschungsankündigung\nSachsen Amtsgericht Dresden HRB 23637\nDOMUS Gebäudetechnik GmbH – Dresden",
      "type": "Löschungsankündigung",
      "state": "Sachsen",
      "amtsgericht": "Amtsgericht Dresden",
      "registernummer": "HRB 23637",
      "registerart": "HRB",
      "company_name": "DOMUS Gebäudetechnik GmbH",
      "company_seat": "Dresden",
      "details": "10.06.2025 (Bekanntmachungsdatum)\n\nSachsen Amtsgericht Dresden HRB 23637\nLöschungsankündigung\n\nDOMUS Gebäudetechnik GmbH\nGesellschaft mit beschränkter Haftung\nDresden\n\nDas Registergericht beabsichtigt, die im Handelsregister eingetragene Gesellschaft von Amts wegen nach § 394 FamFG zu löschen. Die Frist zu Erhebung eines Widerspruchs gegen die beabsichtigte Löschung wird auf einen Monat festgesetzt."
    },
    {
      "date": "2025-06-10",
      "id": "111680",
      "original_text": "Löschungsankündigung\nSachsen Amtsgericht Dresden HRB 40480\nHHK GmbH Haenisch Haustechnik Konzept – Königstein",
      "type": "Löschungsankündigung",
      "state": "Sachsen",
      "amtsgericht": "Amtsgericht Dresden",
      "registernummer": "HRB 40480",
      "registerart": "HRB",
      "company_name": "HHK GmbH Haenisch Haustechnik Konzept",
      "company_seat": "Königstein",
      "details": "10.06.2025 (Bekanntmachungsdatum)\n\nSachsen Amtsgericht Dresden HRB 40480\nLöschungsankündigung\n\nHHK GmbH Haenisch Haustechnik Konzept\nGesellschaft mit beschränkter Haftung\nKönigstein\n\nDas Registergericht beabsichtigt, die im Handelsregister eingetragene Gesellschaft von Amts wegen nach § 394 FamFG zu löschen. Die Frist zu Erhebung eines Widerspruchs gegen die beabsichtigte Löschung wird auf einen Monat festgesetzt."
    },
    {
      "date": "2025-06-10",
      "id": "111681",
      "original_text": "Registerbekanntmachung nach dem Umwandlungsgesetz\nSachsen Amtsgericht Leipzig HRA 19693\nconTREEbution e.K. – Leipzig",
      "type": "Registerbekanntmachung nach dem Umwandlungsgesetz",
      "state": "Sachsen",
      "amtsgericht": "Amtsgericht Leipzig",
      "registernummer": "HRA 19693",
      "registerart": "HRA",
      "company_name": "conTREEbution e.K.",
      "company_seat": "Leipzig",
      "details": "10.06.2025 (Bekanntmachungsdatum)\n\nSachsen Amtsgericht Leipzig HRA 19693\nRegisterbekanntmachung nach dem Umwandlungsgesetz 10.06.2025 (Eintragungsdatum)\n\nconTREEbution e.K.\nEinzelkaufmann / Einzelkauffrau\nLeipzig\n\nDen Gläubigern der an der Ausgliederung beteiligten Rechtsträger ist, wenn sie binnen sechs Monaten nach dem Tag, an dem die Eintragung der Ausgliederung in das Register des Sitzes desjenigen Rechtsträgers, dessen Gläubiger sie sind, nach § 19 Abs. 3 UmwG als bekannt gemacht gilt, ihren Anspruch nach Grund und Höhe in Textform anmelden, Sicherheit zu leisten, soweit sie nicht Befriedigung verlangen können. Dieses Recht steht den Gläubigern jedoch nur zu, wenn sie glaubhaft machen, dass durch die Ausgliederung die Erfüllung der Forderung gefährdet wird."
    },
    {
      "date": "2025-06-10",
      "id": "111682",
      "original_text": "Löschungsankündigung\nSachsen Amtsgericht Chemnitz HRB 33631\nCojotec GmbH – Burgstädt",
      "type": "Löschungsankündigung",
      "state": "Sachsen",
      "amtsgericht": "Amtsgericht Chemnitz",
      "registernummer": "HRB 33631",
      "registerart": "HRB",
      "company_name": "Cojotec GmbH",
      "company_seat": "Burgstädt",
      "details": "10.06.2025 (Bekanntmachungsdatum)\n\nSachsen Amtsgericht Chemnitz HRB 33631\nLöschungsankündigung\n\nCojotec GmbH\nGesellschaft mit beschränkter Haftung\nBurgstädt\n\nDas Registergericht beabsichtigt, die im Handelsregister eingetragene Gesellschaft von Amts wegen nach § 394 FamFG zu löschen. Die Frist zu Erhebung eines Widerspruchs gegen die beabsichtigte Löschung wird auf einen Monat festgesetzt."
    },
    {
      "date": "2025-06-10",
      "id": "111683",
      "original_text": "Registerbekanntmachung nach dem Umwandlungsgesetz\nSachsen Amtsgericht Leipzig HRB 44229\nconTREEbution GmbH – Leipzig",
      "type": "Registerbekanntmachung nach dem Umwandlungsgesetz",
      "state": "Sachsen",
      "amtsgericht": "Amtsgericht Leipzig",
      "registernummer": "HRB 44229",
      "registerart": "HRB",
      "company_name": "conTREEbution GmbH",
      "company_seat": "Leipzig",
      "details": "10.06.2025 (Bekanntmachungsdatum)\n\nSachsen Amtsgericht Leipzig HRB 44229\nRegisterbekanntmachung nach dem Umwandlungsgesetz 10.06.2025 (Eintragungsdatum)\n\nconTREEbution GmbH\nGesellschaft mit beschränkter Haftung\nLeipzig\n\nDen Gläubigern der an der Ausgliederung beteiligten Rechtsträger ist, wenn sie binnen sechs Monaten nach dem Tag, an dem die Eintragung der Ausgliederung in das Register des Sitzes desjenigen Rechtsträgers, dessen Gläubiger sie sind, nach § 19 Abs. 3 UmwG als bekannt gemacht gilt, ihren Anspruch nach Grund und Höhe in Textform anmelden, Sicherheit zu leisten, soweit sie nicht Befriedigung verlangen können. Dieses Recht steht den Gläubigern jedoch nur zu, wenn sie glaubhaft machen, dass durch die Ausgliederung die Erfüllung der Forderung gefährdet wird."
    },
    {
      "date": "2025-06-10",
      "id": "111684",
      "original_text": "Registerbekanntmachung nach dem Umwandlungsgesetz\nSachsen Amtsgericht Dresden HRB 17752\nP-D Management Industries-Technologies GmbH – Wilsdruff",
      "type": "Registerbekanntmachung nach dem Umwandlungsgesetz",
      "state": "Sachsen",
      "amtsgericht": "Amtsgericht Dresden",
      "registernummer": "HRB 17752",
      "registerart": "HRB",
      "company_name": "P-D Management Industries-Technologies GmbH",
      "company_seat": "Wilsdruff",
      "details": "10.06.2025 (Bekanntmachungsdatum)\n\nSachsen Amtsgericht Dresden HRB 17752\nRegisterbekanntmachung nach dem Umwandlungsgesetz 10.06.2025 (Eintragungsdatum)\n\nP-D Management Industries-Technologies GmbH\nGesellschaft mit beschränkter Haftung\nWilsdruff\n\nDen Gläubigern der an der Verschmelzung beteiligten Rechtsträger ist, wenn sie binnen sechs Monaten nach dem Tag, an dem die Eintragung der Verschmelzung in das Register des Sitzes desjenigen Rechtsträgers, dessen Gläubiger sie sind, nach § 19 Abs. 3 UmwG als bekannt gemacht gilt, ihren Anspruch nach Grund und Höhe in Textform anmelden, Sicherheit zu leisten, soweit sie nicht Befriedigung verlangen können. Dieses Recht steht den Gläubigern jedoch nur zu, wenn sie glaubhaft machen, dass durch die Verschmelzung die Erfüllung der Forderung gefährdet wird."
    },
    {
      "date": "2025-06-10",
      "id": "111685",
      "original_text": "Löschungsankündigung\nSachsen Amtsgericht Chemnitz HRB 35286\nBest Brands UG (haftungsbeschränkt) – Chemnitz",
      "type": "Löschungsankündigung",
      "state": "Sachsen",
      "amtsgericht": "Amtsgericht Chemnitz",
      "registernummer": "HRB 35286",
      "registerart": "HRB",
      "company_name": "Best Brands UG (haftungsbeschränkt)",
      "company_seat": "Chemnitz",
      "details": "10.06.2025 (Bekanntmachungsdatum)\n\nSachsen Amtsgericht Chemnitz HRB 35286\nLöschungsankündigung\n\nBest Brands UG (haftungsbeschränkt)\nGesellschaft mit beschränkter Haftung\nChemnitz\n\nDas Registergericht beabsichtigt, die im Handelsregister eingetragene Gesellschaft von Amts wegen nach § 394 FamFG zu löschen. Die Frist zu Erhebung eines Widerspruchs gegen die beabsichtigte Löschung wird auf einen Monat festgesetzt."
    },
    {
      "date": "2025-06-10",
      "id": "111686",
      "original_text": "Registerbekanntmachung nach dem Umwandlungsgesetz\nNiedersachsen Amtsgericht Hannover HRB 227526\nE+S Private Equity Beteiligungen GmbH – Hannover",
      "type": "Registerbekanntmachung nach dem Umwandlungsgesetz",
      "state": "Niedersachsen",
      "amtsgericht": "Amtsgericht Hannover",
      "registernummer": "HRB 227526",
      "registerart": "HRB",
      "company_name": "E+S Private Equity Beteiligungen GmbH",
      "company_seat": "Hannover",
      "details": "10.06.2025 (Bekanntmachungsdatum)\n\nNiedersachsen Amtsgericht Hannover HRB 227526\nRegisterbekanntmachung nach dem Umwandlungsgesetz 10.06.2025 (Eintragungsdatum)\n\nE+S Private Equity Beteiligungen GmbH\nGesellschaft mit beschränkter Haftung\nHannover\n\nDen Gläubigern der an der Verschmelzung beteiligten Rechtsträger ist, wenn sie binnen sechs Monaten nach dem Tag, an dem die Eintragung der Verschmelzung in das Register des Sitzes desjenigen Rechtsträgers, dessen Gläubiger sie sind, nach § 19  Abs.  3 UmwG als bekannt gemacht gilt, ihren Anspruch nach Grund und Höhe schriftlich anmelden, Sicherheit zu leisten, soweit sie nicht Befriedigung verlangen können. Dieses Recht steht den Gläubigern jedoch nur zu, wenn sie glaubhaft machen, dass durch die Verschmelzung die Erfüllung der Forderung gefährdet wird."
    },
    {
      "date": "2025-06-10",
      "id": "111687",
      "original_text": "Löschungsankündigung\nNiedersachsen Amtsgericht Osnabrück HRB 204539\nDJ Team Emsland UG (haftungsbeschränkt) – Meppen",
      "type": "Löschungsankündigung",
      "state": "Niedersachsen",
      "amtsgericht": "Amtsgericht Osnabrück",
      "registernummer": "HRB 204539",
      "registerart": "HRB",
      "company_name": "DJ Team Emsland UG (haftungsbeschränkt)",
      "company_seat": "Meppen",
      "details": "10.06.2025 (Bekanntmachungsdatum)\n\nNiedersachsen Amtsgericht Osnabrück HRB 204539\nLöschungsankündigung\n\nDJ Team Emsland UG (haftungsbeschränkt)\nGesellschaft mit beschränkter Haftung\nMeppen\n\nDas Registergericht beabsichtigt, die Gesellschaft von Amts wegen nach § 394 FamFG wegen Vermögenslosigkeit zu löschen. Die Frist zur Erhebung eines Widerspruchs ist auf 1 Monat ab dieser Registerbekanntmachung festgesetzt."
    },
    {
      "date": "2025-06-10",
      "id": "111688",
      "original_text": "Löschungsankündigung\nNiedersachsen Amtsgericht Braunschweig HRB 206120\nT.U.N. Sicherheitsdienst Verwaltungs GmbH – Braunschweig",
      "type": "Löschungsankündigung",
      "state": "Niedersachsen",
      "amtsgericht": "Amtsgericht Braunschweig",
      "registernummer": "HRB 206120",
      "registerart": "HRB",
      "company_name": "T.U.N. Sicherheitsdienst Verwaltungs GmbH",
      "company_seat": "Braunschweig",
      "details": "10.06.2025 (Bekanntmachungsdatum)\n\nNiedersachsen Amtsgericht Braunschweig HRB 206120\nLöschungsankündigung\n\nT.U.N. Sicherheitsdienst Verwaltungs GmbH\nGesellschaft mit beschränkter Haftung\nBraunschweig\n\nDas Registergericht beabsichtigt, die Gesellschaft von Amts wegen nach § 394 FamFG zu löschen. Die Frist zur Erhebung eines Widerspruchs ist auf 1 Monat ab dieser Registerbekanntmachung festgesetzt."
    },
    {
      "date": "2025-06-10",
      "id": "111689",
      "original_text": "Einreichung neuer Dokumente\nNiedersachsen Amtsgericht Hannover HRB 5332\nVEREINIGTE SCHIFFS-VERSICHERUNG V.A.G.® – Hannover",
      "type": "Einreichung neuer Dokumente",
      "state": "Niedersachsen",
      "amtsgericht": "Amtsgericht Hannover",
      "registernummer": "HRB 5332",
      "registerart": "HRB",
      "company_name": "VEREINIGTE SCHIFFS-VERSICHERUNG V.A.G.®",
      "company_seat": "Hannover",
      "details": "10.06.2025 (Bekanntmachungsdatum)\n\nNiedersachsen Amtsgericht Hannover HRB 5332\nEinreichung neuer Dokumente\n\nVEREINIGTE SCHIFFS-VERSICHERUNG V.A.G.®\nVersicherungsverein auf Gegenseitigkeit\nHannover\n\nDie Liste der Mitglieder des Aufsichtsrats wurde beim Registergericht eingereicht."
    },
    {
      "date": "2025-06-10",
      "id": "111690",
      "original_text": "Registerbekanntmachung nach dem Umwandlungsgesetz\nNiedersachsen Amtsgericht Hannover HRB 59817\nBechtle GmbH – Hannover",
      "type": "Registerbekanntmachung nach dem Umwandlungsgesetz",
      "state": "Niedersachsen",
      "amtsgericht": "Amtsgericht Hannover",
      "registernummer": "HRB 59817",
      "registerart": "HRB",
      "company_name": "Bechtle GmbH",
      "company_seat": "Hannover",
      "details": "10.06.2025 (Bekanntmachungsdatum)\n\nNiedersachsen Amtsgericht Hannover HRB 59817\nRegisterbekanntmachung nach dem Umwandlungsgesetz 10.06.2025 (Eintragungsdatum)\n\nBechtle GmbH\nGesellschaft mit beschränkter Haftung\nHannover\n\nDen Gläubigern der an der Verschmelzung beteiligten Rechtsträger ist, wenn sie binnen sechs Monaten nach dem Tag, an dem die Eintragung der Verschmelzung in das Register des Sitzes desjenigen Rechtsträgers, dessen Gläubiger sie sind, nach § 19  Abs.  3 UmwG als bekannt gemacht gilt, ihren Anspruch nach Grund und Höhe schriftlich anmelden, Sicherheit zu leisten, soweit sie nicht Befriedigung verlangen können. Dieses Recht steht den Gläubigern jedoch nur zu, wenn sie glaubhaft machen, dass durch die Verschmelzung die Erfüllung der Forderung gefährdet wird."
    },
    {
      "date": "2025-06-10",
      "id": "111691",
      "original_text": "Löschungsankündigung\nNiedersachsen Amtsgericht Hildesheim HRB 205054\nKunststoff-Bakery GmbH – Ummern",
      "type": "Löschungsankündigung",
      "state": "Niedersachsen",
      "amtsgericht": "Amtsgericht Hildesheim",
      "registernummer": "HRB 205054",
      "registerart": "HRB",
      "company_name": "Kunststoff-Bakery GmbH",
      "company_seat": "Ummern",
      "details": "10.06.2025 (Bekanntmachungsdatum)\n\nNiedersachsen Amtsgericht Hildesheim HRB 205054\nLöschungsankündigung\n\nKunststoff-Bakery GmbH\nGesellschaft mit beschränkter Haftung\nUmmern\n\nDas Registergericht beabsichtigt, die Gesellschaft von Amts wegen nach § 394 FamFG zu löschen. Die Frist zur Erhebung eines Widerspruchs ist auf 1 Monat ab dieser Registerbekanntmachung festgesetzt."
    },
    {
      "date": "2025-06-10",
      "id": "111692",
      "original_text": "Löschungsankündigung\nNiedersachsen Amtsgericht Braunschweig HRB 208081\nWelfen Kurier UG (haftungsbeschränkt) – Braunschweig",
      "type": "Löschungsankündigung",
      "state": "Niedersachsen",
      "amtsgericht": "Amtsgericht Braunschweig",
      "registernummer": "HRB 208081",
      "registerart": "HRB",
      "company_name": "Welfen Kurier UG (haftungsbeschränkt)",
      "company_seat": "Braunschweig",
      "details": "10.06.2025 (Bekanntmachungsdatum)\n\nNiedersachsen Amtsgericht Braunschweig HRB 208081\nLöschungsankündigung 10.06.2025 (Eintragungsdatum)\n\nWelfen Kurier UG (haftungsbeschränkt)\nGesellschaft mit beschränkter Haftung\nBraunschweig\n\nDas Registergericht beabsichtigt, die Gesellschaft von Amts wegen nach § 394 FamFG zu löschen. Die Frist zur Erhebung eines Widerspruchs ist auf 1 Monat ab dieser Registerbekanntmachung festgesetzt."
    },
    {
      "date": "2025-06-10",
      "id": "111693",
      "original_text": "Registerbekanntmachung nach dem Umwandlungsgesetz\nNiedersachsen Amtsgericht Hannover HRA 205965\nHWDS PARTNER LLC & Co. KG – Hannover",
      "type": "Registerbekanntmachung nach dem Umwandlungsgesetz",
      "state": "Niedersachsen",
      "amtsgericht": "Amtsgericht Hannover",
      "registernummer": "HRA 205965",
      "registerart": "HRA",
      "company_name": "HWDS PARTNER LLC & Co. KG",
      "company_seat": "Hannover",
      "details": "10.06.2025 (Bekanntmachungsdatum)\n\nNiedersachsen Amtsgericht Hannover HRA 205965\nRegisterbekanntmachung nach dem Umwandlungsgesetz 10.06.2025 (Eintragungsdatum)\n\nHWDS PARTNER LLC & Co. KG\nKommanditgesellschaft\nHannover\n\nDen Gläubigern der an der Verschmelzung beteiligten Rechtsträger ist, wenn sie binnen sechs Monaten nach dem Tag, an dem die Eintragung der Verschmelzung in das Register des Sitzes desjenigen Rechtsträgers, dessen Gläubiger sie sind, nach § 19  Abs.  3 UmwG als bekannt gemacht gilt, ihren Anspruch nach Grund und Höhe schriftlich anmelden, Sicherheit zu leisten, soweit sie nicht Befriedigung verlangen können. Dieses Recht steht den Gläubigern jedoch nur zu, wenn sie glaubhaft machen, dass durch die Verschmelzung die Erfüllung der Forderung gefährdet wird."
    },
    {
      "date": "2025-06-10",
      "id": "111694",
      "original_text": "Registerbekanntmachung nach dem Umwandlungsgesetz\nNiedersachsen Amtsgericht Hannover HRA 205965\nHWDS PARTNER LLC & Co. KG – Hannover",
      "type": "Registerbekanntmachung nach dem Umwandlungsgesetz",
      "state": "Niedersachsen",
      "amtsgericht": "Amtsgericht Hannover",
      "registernummer": "HRA 205965",
      "registerart": "HRA",
      "company_name": "HWDS PARTNER LLC & Co. KG",
      "company_seat": "Hannover",
      "details": "10.06.2025 (Bekanntmachungsdatum)\n\nNiedersachsen Amtsgericht Hannover HRA 205965\nRegisterbekanntmachung nach dem Umwandlungsgesetz 10.06.2025 (Eintragungsdatum)\n\nHWDS PARTNER LLC & Co. KG\nKommanditgesellschaft\nHannover\n\nDen Gläubigern der an der Verschmelzung beteiligten Rechtsträger ist, wenn sie binnen sechs Monaten nach dem Tag, an dem die Eintragung der Verschmelzung in das Register des Sitzes desjenigen Rechtsträgers, dessen Gläubiger sie sind, nach § 19  Abs.  3 UmwG als bekannt gemacht gilt, ihren Anspruch nach Grund und Höhe schriftlich anmelden, Sicherheit zu leisten, soweit sie nicht Befriedigung verlangen können. Dieses Recht steht den Gläubigern jedoch nur zu, wenn sie glaubhaft machen, dass durch die Verschmelzung die Erfüllung der Forderung gefährdet wird."
    },
    {
      "date": "2025-06-10",
      "id": "111695",
      "original_text": "Löschungsankündigung\nBremen Amtsgericht Bremen HRB 35375\nKöhn Kulturlokal Gastfeld & Flixen Kickerveranstaltungen UG (haftungsbeschränkt) – Bremen",
      "type": "Löschungsankündigung",
      "state": "Bremen",
      "amtsgericht": "Amtsgericht Bremen",
      "registernummer": "HRB 35375",
      "registerart": "HRB",
      "company_name": "Köhn Kulturlokal Gastfeld & Flixen Kickerveranstaltungen UG (haftungsbeschränkt)",
      "company_seat": "Bremen",
      "details": "10.06.2025 (Bekanntmachungsdatum)\n\nBremen Amtsgericht Bremen HRB 35375\nLöschungsankündigung\n\nKöhn Kulturlokal Gastfeld & Flixen Kickerveranstaltungen UG (haftungsbeschränkt)\nGesellschaft mit beschränkter Haftung\nBremen\n\nEs ist beabsichtigt die im Handelsregister eingetragene Gesellschaft von Amts wegen gemäß § 394 FamFG zu löschen. Gegen die Löschung kann beim AG Bremen schriftlich oder zu Protokoll der Geschäftsstelle Widerspruch eingelegt werden. Widerspruchsfrist 4 Wochen."
    },
    {
      "date": "2025-06-10",
      "id": "111696",
      "original_text": "Löschungsankündigung\nBremen Amtsgericht Bremen HRB 35536\nC. Albrecht Window Film GmbH – Bremen",
      "type": "Löschungsankündigung",
      "state": "Bremen",
      "amtsgericht": "Amtsgericht Bremen",
      "registernummer": "HRB 35536",
      "registerart": "HRB",
      "company_name": "C. Albrecht Window Film GmbH",
      "company_seat": "Bremen",
      "details": "10.06.2025 (Bekanntmachungsdatum)\n\nBremen Amtsgericht Bremen HRB 35536\nLöschungsankündigung\n\nC. Albrecht Window Film GmbH\nGesellschaft mit beschränkter Haftung\nBremen\n\nEs ist beabsichtigt die im Handelsregister eingetragene Gesellschaft von Amts wegen gemäß § 394 FamFG zu löschen. Gegen die Löschung kann beim AG Bremen schriftlich oder zu Protokoll der Geschäftsstelle Widerspruch eingelegt werden. Widerspruchsfrist 4 Wochen."
    },
    {
      "date": "2025-06-10",
      "id": "111697",
      "original_text": "Registerbekanntmachung nach dem Umwandlungsgesetz\nNordrhein-Westfalen Amtsgericht Bielefeld HRB 43072\nTheodor-Fliedner-Heim gGmbH – Bielefeld",
      "type": "Registerbekanntmachung nach dem Umwandlungsgesetz",
      "state": "Nordrhein-Westfalen",
      "amtsgericht": "Amtsgericht Bielefeld",
      "registernummer": "HRB 43072",
      "registerart": "HRB",
      "company_name": "Theodor-Fliedner-Heim gGmbH",
      "company_seat": "Bielefeld",
      "details": "10.06.2025 (Bekanntmachungsdatum)\n\nNordrhein-Westfalen Amtsgericht Bielefeld HRB 43072\nRegisterbekanntmachung nach dem Umwandlungsgesetz 10.06.2025 (Eintragungsdatum)\n\nTheodor-Fliedner-Heim gGmbH\nGesellschaft mit beschränkter Haftung\nBielefeld\n\nDen Gläubigern der an der Verschmelzung beteiligten Rechtsträger ist, wenn sie binnen sechs Monaten nach dem Tag, an dem die Eintragung der Verschmelzung in das Register des Sitzes desjenigen Rechtsträgers, dessen Gläubiger sie sind, nach § 19 Absatz 3 UmwG als bekanntgemacht gilt, ihren Anspruch nach Grund und Höhe schriftlich anmelden, Sicherheit zu leisten, soweit sie nicht Befriedigung verlangen können. Dieses Recht steht den Gläubigern jedoch nur zu, wenn sie glaubhaft machen, dass durch die Verschmelzung die Erfüllung ihrer Forderung gefährdet wird."
    },
    {
      "date": "2025-06-10",
      "id": "111698",
      "original_text": "Registerbekanntmachung nach dem Umwandlungsgesetz\nNordrhein-Westfalen Amtsgericht Bielefeld HRB 42904\nEvangelisches Hilfswerk gGmbH – Bielefeld",
      "type": "Registerbekanntmachung nach dem Umwandlungsgesetz",
      "state": "Nordrhein-Westfalen",
      "amtsgericht": "Amtsgericht Bielefeld",
      "registernummer": "HRB 42904",
      "registerart": "HRB",
      "company_name": "Evangelisches Hilfswerk gGmbH",
      "company_seat": "Bielefeld",
      "details": "10.06.2025 (Bekanntmachungsdatum)\n\nNordrhein-Westfalen Amtsgericht Bielefeld HRB 42904\nRegisterbekanntmachung nach dem Umwandlungsgesetz 10.06.2025 (Eintragungsdatum)\n\nEvangelisches Hilfswerk gGmbH\nGesellschaft mit beschränkter Haftung\nBielefeld\n\nDen Gläubigern der an der Verschmelzung beteiligten Rechtsträger ist, wenn sie binnen sechs Monaten nach dem Tag, an dem die Eintragung der Verschmelzung in das Register des Sitzes desjenigen Rechtsträgers, dessen Gläubiger sie sind, nach § 19 Absatz 3 UmwG als bekanntgemacht gilt, ihren Anspruch nach Grund und Höhe schriftlich anmelden, Sicherheit zu leisten, soweit sie nicht Befriedigung verlangen können. Dieses Recht steht den Gläubigern jedoch nur zu, wenn sie glaubhaft machen, dass durch die Verschmelzung die Erfüllung ihrer Forderung gefährdet wird."
    },
    {
      "date": "2025-06-10",
      "id": "111699",
      "original_text": "Registerbekanntmachung nach dem Umwandlungsgesetz\nNordrhein-Westfalen Amtsgericht Bielefeld HRB 42904\nEvangelisches Hilfswerk gGmbH – Bielefeld",
      "type": "Registerbekanntmachung nach dem Umwandlungsgesetz",
      "state": "Nordrhein-Westfalen",
      "amtsgericht": "Amtsgericht Bielefeld",
      "registernummer": "HRB 42904",
      "registerart": "HRB",
      "company_name": "Evangelisches Hilfswerk gGmbH",
      "company_seat": "Bielefeld",
      "details": "10.06.2025 (Bekanntmachungsdatum)\n\nNordrhein-Westfalen Amtsgericht Bielefeld HRB 42904\nRegisterbekanntmachung nach dem Umwandlungsgesetz 10.06.2025 (Eintragungsdatum)\n\nEvangelisches Hilfswerk gGmbH\nGesellschaft mit beschränkter Haftung\nBielefeld\n\nDen Gläubigern der an der Verschmelzung beteiligten Rechtsträger ist, wenn sie binnen sechs Monaten nach dem Tag, an dem die Eintragung der Verschmelzung in das Register des Sitzes desjenigen Rechtsträgers, dessen Gläubiger sie sind, nach § 19 Absatz 3 UmwG als bekanntgemacht gilt, ihren Anspruch nach Grund und Höhe schriftlich anmelden, Sicherheit zu leisten, soweit sie nicht Befriedigung verlangen können. Dieses Recht steht den Gläubigern jedoch nur zu, wenn sie glaubhaft machen, dass durch die Verschmelzung die Erfüllung ihrer Forderung gefährdet wird."
    },
    {
      "date": "2025-06-10",
      "id": "111700",
      "original_text": "Einreichung neuer Dokumente\nNordrhein-Westfalen Amtsgericht Bonn HRB 14190\nDeutsche Telekom Technik GmbH – Bonn",
      "type": "Einreichung neuer Dokumente",
      "state": "Nordrhein-Westfalen",
      "amtsgericht": "Amtsgericht Bonn",
      "registernummer": "HRB 14190",
      "registerart": "HRB",
      "company_name": "Deutsche Telekom Technik GmbH",
      "company_seat": "Bonn",
      "details": "10.06.2025 (Bekanntmachungsdatum)\n\nNordrhein-Westfalen Amtsgericht Bonn HRB 14190\nEinreichung neuer Dokumente\n\nDeutsche Telekom Technik GmbH\nGesellschaft mit beschränkter Haftung\nBonn\n\nDem Registergericht ist eine neue Liste der Mitglieder des Aufsichtsrates eingereicht worden."
    },
    {
      "date": "2025-06-10",
      "id": "111701",
      "original_text": "Registerbekanntmachung nach dem Umwandlungsgesetz\nNordrhein-Westfalen Amtsgericht Bielefeld HRB 42904\nEvangelisches Hilfswerk gGmbH – Bielefeld",
      "type": "Registerbekanntmachung nach dem Umwandlungsgesetz",
      "state": "Nordrhein-Westfalen",
      "amtsgericht": "Amtsgericht Bielefeld",
      "registernummer": "HRB 42904",
      "registerart": "HRB",
      "company_name": "Evangelisches Hilfswerk gGmbH",
      "company_seat": "Bielefeld",
      "details": "10.06.2025 (Bekanntmachungsdatum)\n\nNordrhein-Westfalen Amtsgericht Bielefeld HRB 42904\nRegisterbekanntmachung nach dem Umwandlungsgesetz 10.06.2025 (Eintragungsdatum)\n\nEvangelisches Hilfswerk gGmbH\nGesellschaft mit beschränkter Haftung\nBielefeld\n\nDen Gläubigern der an der Verschmelzung beteiligten Rechtsträger ist, wenn sie binnen sechs Monaten nach dem Tag, an dem die Eintragung der Verschmelzung in das Register des Sitzes desjenigen Rechtsträgers, dessen Gläubiger sie sind, nach § 19 Absatz 3 UmwG als bekanntgemacht gilt, ihren Anspruch nach Grund und Höhe schriftlich anmelden, Sicherheit zu leisten, soweit sie nicht Befriedigung verlangen können. Dieses Recht steht den Gläubigern jedoch nur zu, wenn sie glaubhaft machen, dass durch die Verschmelzung die Erfüllung ihrer Forderung gefährdet wird."
    },
    {
      "date": "2025-06-10",
      "id": "111702",
      "original_text": "Registerbekanntmachung nach dem Umwandlungsgesetz\nNordrhein-Westfalen Amtsgericht Bielefeld HRB 42901\nEvangelische Marien- und Lutherstift gGmbH – Bielefeld",
      "type": "Registerbekanntmachung nach dem Umwandlungsgesetz",
      "state": "Nordrhein-Westfalen",
      "amtsgericht": "Amtsgericht Bielefeld",
      "registernummer": "HRB 42901",
      "registerart": "HRB",
      "company_name": "Evangelische Marien- und Lutherstift gGmbH",
      "company_seat": "Bielefeld",
      "details": "10.06.2025 (Bekanntmachungsdatum)\n\nNordrhein-Westfalen Amtsgericht Bielefeld HRB 42901\nRegisterbekanntmachung nach dem Umwandlungsgesetz 10.06.2025 (Eintragungsdatum)\n\nEvangelische Marien- und Lutherstift gGmbH\nGesellschaft mit beschränkter Haftung\nBielefeld\n\nDen Gläubigern der an der Verschmelzung beteiligten Rechtsträger ist, wenn sie binnen sechs Monaten nach dem Tag, an dem die Eintragung der Verschmelzung in das Register des Sitzes desjenigen Rechtsträgers, dessen Gläubiger sie sind, nach § 19 Absatz 3 UmwG als bekanntgemacht gilt, ihren Anspruch nach Grund und Höhe schriftlich anmelden, Sicherheit zu leisten, soweit sie nicht Befriedigung verlangen können. Dieses Recht steht den Gläubigern jedoch nur zu, wenn sie glaubhaft machen, dass durch die Verschmelzung die Erfüllung ihrer Forderung gefährdet wird."
    },
    {
      "date": "2025-06-10",
      "id": "111703",
      "original_text": "Registerbekanntmachung nach dem Umwandlungsgesetz\nNordrhein-Westfalen Amtsgericht Bielefeld HRB 42909\nWerkheim gGmbH – Bielefeld",
      "type": "Registerbekanntmachung nach dem Umwandlungsgesetz",
      "state": "Nordrhein-Westfalen",
      "amtsgericht": "Amtsgericht Bielefeld",
      "registernummer": "HRB 42909",
      "registerart": "HRB",
      "company_name": "Werkheim gGmbH",
      "company_seat": "Bielefeld",
      "details": "10.06.2025 (Bekanntmachungsdatum)\n\nNordrhein-Westfalen Amtsgericht Bielefeld HRB 42909\nRegisterbekanntmachung nach dem Umwandlungsgesetz 10.06.2025 (Eintragungsdatum)\n\nWerkheim gGmbH\nGesellschaft mit beschränkter Haftung\nBielefeld\n\nDen Gläubigern der an der Verschmelzung beteiligten Rechtsträger ist, wenn sie binnen sechs Monaten nach dem Tag, an dem die Eintragung der Verschmelzung in das Register des Sitzes desjenigen Rechtsträgers, dessen Gläubiger sie sind, nach § 19 Absatz 3 UmwG als bekanntgemacht gilt, ihren Anspruch nach Grund und Höhe schriftlich anmelden, Sicherheit zu leisten, soweit sie nicht Befriedigung verlangen können. Dieses Recht steht den Gläubigern jedoch nur zu, wenn sie glaubhaft machen, dass durch die Verschmelzung die Erfüllung ihrer Forderung gefährdet wird."
    },
    {
      "date": "2025-06-10",
      "id": "111704",
      "original_text": "Registerbekanntmachung nach dem Umwandlungsgesetz\nNordrhein-Westfalen Amtsgericht Bielefeld HRB 42910\nVolkslesehalle gGmbH – Bielefeld",
      "type": "Registerbekanntmachung nach dem Umwandlungsgesetz",
      "state": "Nordrhein-Westfalen",
      "amtsgericht": "Amtsgericht Bielefeld",
      "registernummer": "HRB 42910",
      "registerart": "HRB",
      "company_name": "Volkslesehalle gGmbH",
      "company_seat": "Bielefeld",
      "details": "10.06.2025 (Bekanntmachungsdatum)\n\nNordrhein-Westfalen Amtsgericht Bielefeld HRB 42910\nRegisterbekanntmachung nach dem Umwandlungsgesetz 10.06.2025 (Eintragungsdatum)\n\nVolkslesehalle gGmbH\nGesellschaft mit beschränkter Haftung\nBielefeld\n\nDen Gläubigern der an der Verschmelzung beteiligten Rechtsträger ist, wenn sie binnen sechs Monaten nach dem Tag, an dem die Eintragung der Verschmelzung in das Register des Sitzes desjenigen Rechtsträgers, dessen Gläubiger sie sind, nach § 19 Absatz 3 UmwG als bekanntgemacht gilt, ihren Anspruch nach Grund und Höhe schriftlich anmelden, Sicherheit zu leisten, soweit sie nicht Befriedigung verlangen können. Dieses Recht steht den Gläubigern jedoch nur zu, wenn sie glaubhaft machen, dass durch die Verschmelzung die Erfüllung ihrer Forderung gefährdet wird."
    },
    {
      "date": "2025-06-10",
      "id": "111705",
      "original_text": "Löschungsankündigung\nNordrhein-Westfalen Amtsgericht Wuppertal HRB 25974\nOsthoff Haustechnik GmbH – Wülfrath",
      "type": "Löschungsankündigung",
      "state": "Nordrhein-Westfalen",
      "amtsgericht": "Amtsgericht Wuppertal",
      "registernummer": "HRB 25974",
      "registerart": "HRB",
      "company_name": "Osthoff Haustechnik GmbH",
      "company_seat": "Wülfrath",
      "details": "10.06.2025 (Bekanntmachungsdatum)\n\nNordrhein-Westfalen Amtsgericht Wuppertal HRB 25974\nLöschungsankündigung\n\nOsthoff Haustechnik GmbH\nGesellschaft mit beschränkter Haftung\nWülfrath\n\nDas Registergericht beabsichtigt die Gesellschaft von Amts wegen nach § 394 FamFG zu löschen. Die Frist zur Erhebung eines Widerspruchs ist auf einen Monat festgesetzt."
    },
    {
      "date": "2025-06-10",
      "id": "111706",
      "original_text": "Löschungsankündigung\nNordrhein-Westfalen Amtsgericht Siegen HRB 13806\nDrachen-Imbiss Unternehmergesellschaft (haftungsbeschränkt) – Lennestadt",
      "type": "Löschungsankündigung",
      "state": "Nordrhein-Westfalen",
      "amtsgericht": "Amtsgericht Siegen",
      "registernummer": "HRB 13806",
      "registerart": "HRB",
      "company_name": "Drachen-Imbiss Unternehmergesellschaft (haftungsbeschränkt)",
      "company_seat": "Lennestadt",
      "details": "10.06.2025 (Bekanntmachungsdatum)\n\nNordrhein-Westfalen Amtsgericht Siegen HRB 13806\nLöschungsankündigung\n\nDrachen-Imbiss Unternehmergesellschaft (haftungsbeschränkt)\nGesellschaft mit beschränkter Haftung\nLennestadt\n\nDas Registergericht beabsichtigt die Gesellschaft von Amts wegen nach § 394 FamFG zu löschen. Die Frist zur Erhebung eines Widerspruchs ist auf drei Monate festgesetzt."
    },
    {
      "date": "2025-06-10",
      "id": "111707",
      "original_text": "Registerbekanntmachung nach dem Umwandlungsgesetz\nNordrhein-Westfalen Amtsgericht Neuss HRB 14920\nNink Immobilienverwaltungs GmbH – Kaarst",
      "type": "Registerbekanntmachung nach dem Umwandlungsgesetz",
      "state": "Nordrhein-Westfalen",
      "amtsgericht": "Amtsgericht Neuss",
      "registernummer": "HRB 14920",
      "registerart": "HRB",
      "company_name": "Nink Immobilienverwaltungs GmbH",
      "company_seat": "Kaarst",
      "details": "10.06.2025 (Bekanntmachungsdatum)\n\nNordrhein-Westfalen Amtsgericht Neuss HRB 14920\nRegisterbekanntmachung nach dem Umwandlungsgesetz 10.06.2025 (Eintragungsdatum)\n\nNink Immobilienverwaltungs GmbH\nGesellschaft mit beschränkter Haftung\nKaarst\n\nDie Gesellschaft hat Gläubigern, deren Forderungen vor dieser Bekanntmachung begründet worden sind, Sicherheit zu leisten, soweit sie nicht Befriedigung verlangen können, wenn sie sich binnen sechs Monaten zu diesem Zweck melden."
    },
    {
      "date": "2025-06-10",
      "id": "111708",
      "original_text": "Löschungsankündigung\nNordrhein-Westfalen Amtsgericht Paderborn HRB 6606\nBrautmeier GmbH – Delbrück",
      "type": "Löschungsankündigung",
      "state": "Nordrhein-Westfalen",
      "amtsgericht": "Amtsgericht Paderborn",
      "registernummer": "HRB 6606",
      "registerart": "HRB",
      "company_name": "Brautmeier GmbH",
      "company_seat": "Delbrück",
      "details": "10.06.2025 (Bekanntmachungsdatum)\n\nNordrhein-Westfalen Amtsgericht Paderborn HRB 6606\nLöschungsankündigung 10.06.2025 (Eintragungsdatum)\n\nBrautmeier GmbH\nGesellschaft mit beschränkter Haftung\nDelbrück\n\nDas Registergericht beabsichtigt die Gesellschaft von Amts wegen nach § 394 FamFG zu löschen. Die Frist zur Erhebung eines Widerspruchs ist auf einen Monat festgesetzt."
    },
    {
      "date": "2025-06-10",
      "id": "111709",
      "original_text": "Registerbekanntmachung nach dem Umwandlungsgesetz\nNordrhein-Westfalen Amtsgericht Bielefeld HRB 44081\nBechtle GmbH – Bielefeld",
      "type": "Registerbekanntmachung nach dem Umwandlungsgesetz",
      "state": "Nordrhein-Westfalen",
      "amtsgericht": "Amtsgericht Bielefeld",
      "registernummer": "HRB 44081",
      "registerart": "HRB",
      "company_name": "Bechtle GmbH",
      "company_seat": "Bielefeld",
      "details": "10.06.2025 (Bekanntmachungsdatum)\n\nNordrhein-Westfalen Amtsgericht Bielefeld HRB 44081\nRegisterbekanntmachung nach dem Umwandlungsgesetz 10.06.2025 (Eintragungsdatum)\n\nBechtle GmbH\nGesellschaft mit beschränkter Haftung\nBielefeld\n\nDen Gläubigern der an der Verschmelzung beteiligten Rechtsträger ist, wenn sie binnen sechs Monaten nach dem Tag, an dem die Eintragung der Verschmelzung in das Register des Sitzes desjenigen Rechtsträgers, dessen Gläubiger sie sind, nach § 19 Absatz 3 UmwG als bekanntgemacht gilt, ihren Anspruch nach Grund und Höhe schriftlich anmelden, Sicherheit zu leisten, soweit sie nicht Befriedigung verlangen können. Dieses Recht steht den Gläubigern jedoch nur zu, wenn sie glaubhaft machen, dass durch die Verschmelzung die Erfüllung ihrer Forderung gefährdet wird."
    },
    {
      "date": "2025-06-10",
      "id": "111710",
      "original_text": "Löschungsankündigung\nNordrhein-Westfalen Amtsgericht Düsseldorf HRB 101695\nAutovento1 GmbH – Monheim am Rhein",
      "type": "Löschungsankündigung",
      "state": "Nordrhein-Westfalen",
      "amtsgericht": "Amtsgericht Düsseldorf",
      "registernummer": "HRB 101695",
      "registerart": "HRB",
      "company_name": "Autovento1 GmbH",
      "company_seat": "Monheim am Rhein",
      "details": "10.06.2025 (Bekanntmachungsdatum)\n\nNordrhein-Westfalen Amtsgericht Düsseldorf HRB 101695\nLöschungsankündigung\n\nAutovento1 GmbH\nGesellschaft mit beschränkter Haftung\nMonheim am Rhein\n\nDas Registergericht beabsichtigt die Gesellschaft von Amts wegen nach § 394 FamFG zu löschen. Die Frist zur Erhebung eines Widerspruchs ist auf 3 Wochen festgesetzt.\n\nRechtsbehelfsbelehrung:\nDas Widerspruchsrecht steht jedem zu, der an der Unterlassung der Löschung ein berechtigtes Interesse hat. Der Widerspruch ist bei dem Amtsgericht Düsseldorf -Registergericht-, Werdener Straße 1, 40227 Düsseldorf schriftlich in deutscher Sprache oder zur Niederschrift der Geschäftsstelle einzulegen. Der Widerspruch kann auch zur Niederschrift der Geschäftsstelle eines jeden Amtsgerichtes abgegeben werden. Die Einlegung ist auch durch Übertragung eines elektronischen Dokuments an die elektronische Poststelle des Gerichts möglich. Das elektronische Dokument muss für die Bearbeitung durch das Gericht geeignet und mit einer qualifizierten elektronischen Signatur der verantwortenden Person versehen sein oder von der verantwortenden Person signiert und auf einem sicheren Übermittlungsweg gemäß § 130a ZPO nach näherer Maßgabe der Verordnung über die technischen Rahmenbedingungen des elektronischen Rechtsverkehrs und über das besondere elektronische Behördenpostfach (BGBl. I, S.3803) eingereicht werden. Weitere Informationen erhalten Sie auf der Internetseite www.justiz.de.\nDer Widerspruch muss spätestens innerhalb der gesetzten Frist nach dem Datum der Bekanntmachung der Löschungsankündigung bei dem Amtsgericht - Registergericht - Düsseldorf eingegangen sein.  Dies gilt auch dann, wenn der Widerspruch zur Niederschrift der Geschäftsstelle eines anderen Amtsgerichtes abgegeben wurde. Die Frist beginnt mit dem Tage der Bekanntmachung der Löschungsankündigung in dem für die Bekanntmachung der Eintragungen in das Handelsregister bestimmten elektronischen Informations- und Kommunikationssystem nach § 10 des Handelsgesetzbuches. Fällt das Ende der Frist auf einen Sonntag, einen allgemeinen Feiertag oder Sonnabend, so endet die Frist mit Ablauf des nächsten Werktages.\nDer Widerspruch muss die Bezeichnung der angefochtenen Löschungsankündigung sowie die Erklärung enthalten, dass Widerspruch gegen diese Löschungsankündigung eingelegt wird. Er ist zu unterzeichnen und soll begründet werden."
    },
    {
      "date": "2025-06-10",
      "id": "111711",
      "original_text": "Registerbekanntmachung nach dem Umwandlungsgesetz\nNordrhein-Westfalen Amtsgericht Bielefeld HRB 42904\nEvangelisches Hilfswerk gGmbH – Bielefeld",
      "type": "Registerbekanntmachung nach dem Umwandlungsgesetz",
      "state": "Nordrhein-Westfalen",
      "amtsgericht": "Amtsgericht Bielefeld",
      "registernummer": "HRB 42904",
      "registerart": "HRB",
      "company_name": "Evangelisches Hilfswerk gGmbH",
      "company_seat": "Bielefeld",
      "details": "10.06.2025 (Bekanntmachungsdatum)\n\nNordrhein-Westfalen Amtsgericht Bielefeld HRB 42904\nRegisterbekanntmachung nach dem Umwandlungsgesetz 10.06.2025 (Eintragungsdatum)\n\nEvangelisches Hilfswerk gGmbH\nGesellschaft mit beschränkter Haftung\nBielefeld\n\nDen Gläubigern der an der Verschmelzung beteiligten Rechtsträger ist, wenn sie binnen sechs Monaten nach dem Tag, an dem die Eintragung der Verschmelzung in das Register des Sitzes desjenigen Rechtsträgers, dessen Gläubiger sie sind, nach § 19 Absatz 3 UmwG als bekanntgemacht gilt, ihren Anspruch nach Grund und Höhe schriftlich anmelden, Sicherheit zu leisten, soweit sie nicht Befriedigung verlangen können. Dieses Recht steht den Gläubigern jedoch nur zu, wenn sie glaubhaft machen, dass durch die Verschmelzung die Erfüllung ihrer Forderung gefährdet wird."
    },
    {
      "date": "2025-06-10",
      "id": "111712",
      "original_text": "Registerbekanntmachung nach dem Umwandlungsgesetz\nNordrhein-Westfalen Amtsgericht Bielefeld HRB 42904\nEvangelisches Hilfswerk gGmbH – Bielefeld",
      "type": "Registerbekanntmachung nach dem Umwandlungsgesetz",
      "state": "Nordrhein-Westfalen",
      "amtsgericht": "Amtsgericht Bielefeld",
      "registernummer": "HRB 42904",
      "registerart": "HRB",
      "company_name": "Evangelisches Hilfswerk gGmbH",
      "company_seat": "Bielefeld",
      "details": "10.06.2025 (Bekanntmachungsdatum)\n\nNordrhein-Westfalen Amtsgericht Bielefeld HRB 42904\nRegisterbekanntmachung nach dem Umwandlungsgesetz 10.06.2025 (Eintragungsdatum)\n\nEvangelisches Hilfswerk gGmbH\nGesellschaft mit beschränkter Haftung\nBielefeld\n\nDen Gläubigern der an der Verschmelzung beteiligten Rechtsträger ist, wenn sie binnen sechs Monaten nach dem Tag, an dem die Eintragung der Verschmelzung in das Register des Sitzes desjenigen Rechtsträgers, dessen Gläubiger sie sind, nach § 19 Absatz 3 UmwG als bekanntgemacht gilt, ihren Anspruch nach Grund und Höhe schriftlich anmelden, Sicherheit zu leisten, soweit sie nicht Befriedigung verlangen können. Dieses Recht steht den Gläubigern jedoch nur zu, wenn sie glaubhaft machen, dass durch die Verschmelzung die Erfüllung ihrer Forderung gefährdet wird."
    },
    {
      "date": "2025-06-10",
      "id": "111713",
      "original_text": "Registerbekanntmachung nach dem Umwandlungsgesetz\nNordrhein-Westfalen Amtsgericht Bielefeld HRB 42902\nHeimverband der Inneren Mission in Bielefeld gGmbH – Bielefeld",
      "type": "Registerbekanntmachung nach dem Umwandlungsgesetz",
      "state": "Nordrhein-Westfalen",
      "amtsgericht": "Amtsgericht Bielefeld",
      "registernummer": "HRB 42902",
      "registerart": "HRB",
      "company_name": "Heimverband der Inneren Mission in Bielefeld gGmbH",
      "company_seat": "Bielefeld",
      "details": "10.06.2025 (Bekanntmachungsdatum)\n\nNordrhein-Westfalen Amtsgericht Bielefeld HRB 42902\nRegisterbekanntmachung nach dem Umwandlungsgesetz 10.06.2025 (Eintragungsdatum)\n\nHeimverband der Inneren Mission in Bielefeld gGmbH\nGesellschaft mit beschränkter Haftung\nBielefeld\n\nDen Gläubigern der an der Verschmelzung beteiligten Rechtsträger ist, wenn sie binnen sechs Monaten nach dem Tag, an dem die Eintragung der Verschmelzung in das Register des Sitzes desjenigen Rechtsträgers, dessen Gläubiger sie sind, nach § 19 Absatz 3 UmwG als bekanntgemacht gilt, ihren Anspruch nach Grund und Höhe schriftlich anmelden, Sicherheit zu leisten, soweit sie nicht Befriedigung verlangen können. Dieses Recht steht den Gläubigern jedoch nur zu, wenn sie glaubhaft machen, dass durch die Verschmelzung die Erfüllung ihrer Forderung gefährdet wird."
    },
    {
      "date": "2025-06-10",
      "id": "111714",
      "original_text": "Einreichung neuer Dokumente\nNordrhein-Westfalen Amtsgericht Siegburg GnR 160\nKreisbaugenossenschaft Waldbröl e.G. – Waldbröl",
      "type": "Einreichung neuer Dokumente",
      "state": "Nordrhein-Westfalen",
      "amtsgericht": "Amtsgericht Siegburg",
      "registernummer": "GnR 160",
      "registerart": "GnR",
      "company_name": "Kreisbaugenossenschaft Waldbröl e.G.",
      "company_seat": "Waldbröl",
      "details": "10.06.2025 (Bekanntmachungsdatum)\n\nNordrhein-Westfalen Amtsgericht Siegburg GnR 160\nEinreichung neuer Dokumente\n\nKreisbaugenossenschaft Waldbröl e.G.\neingetragene Genossenschaft\nWaldbröl\n\nDem Registergericht ist eine Liste der Mitglieder des Aufsichtsrates eingereicht worden"
    },
    {
      "date": "2025-06-10",
      "id": "111715",
      "original_text": "Einreichung neuer Dokumente\nNordrhein-Westfalen Amtsgericht Düsseldorf HRB 74421\nStröer Management SE – Düsseldorf",
      "type": "Einreichung neuer Dokumente",
      "state": "Nordrhein-Westfalen",
      "amtsgericht": "Amtsgericht Düsseldorf",
      "registernummer": "HRB 74421",
      "registerart": "HRB",
      "company_name": "Ströer Management SE",
      "company_seat": "Düsseldorf",
      "details": "10.06.2025 (Bekanntmachungsdatum)\n\nNordrhein-Westfalen Amtsgericht Düsseldorf HRB 74421\nEinreichung neuer Dokumente 10.06.2025 (Eintragungsdatum)\n\nStröer Management SE\nEuropäische Aktiengesellschaft (SE)\nDüsseldorf\n\nDem Registergericht ist eine Liste der Mitglieder des Aufsichtsrates eingereicht worden."
    },
    {
      "date": "2025-06-10",
      "id": "111716",
      "original_text": "Löschungsankündigung\nNordrhein-Westfalen Amtsgericht Siegburg HRB 16753\nProjektbau Herchen GmbH – Eitorf",
      "type": "Löschungsankündigung",
      "state": "Nordrhein-Westfalen",
      "amtsgericht": "Amtsgericht Siegburg",
      "registernummer": "HRB 16753",
      "registerart": "HRB",
      "company_name": "Projektbau Herchen GmbH",
      "company_seat": "Eitorf",
      "details": "10.06.2025 (Bekanntmachungsdatum)\n\nNordrhein-Westfalen Amtsgericht Siegburg HRB 16753\nLöschungsankündigung\n\nProjektbau Herchen GmbH\nGesellschaft mit beschränkter Haftung\nEitorf\n\nDas Registergericht hat glaubhafte Kenntnis erlangt, dass die Gesellschaft vermögenslos geworden ist, da ein Insolvenzeröffnungsantrag mangels Masse nach § 26 InsO zurückgewiesen wurde.\n\nEs ist daher beabsichtigt, die Gesellschaft nach § 394 FamFG im Handelsregister wegen Vermögenslosigkeit zu löschen.\n\nEinwände gegen die Löschung sind durch Widerspruch binnen einer Frist von 3 Monaten geltend zu machen, andernfalls die Löschung erfolgen wird.\n\nEinzulegen ist der Widerspruch bei dem Amtsgericht Siegburg, Neue Poststraße 16, 53721 Siegburg, und zwar entweder schriftlich in deutscher Sprache oder mündlich zur Niederschrift der Geschäftsstelle. Der Widerspruch kann auch zur Niederschrift der Geschäftsstelle eines jeden Amtsgerichts abgegeben werden. Der Widerspruch ist binnen der in der Verfügung bestimmten Frist einzulegen. Die Frist ist nur gewahrt, wenn der Widerspruch rechtzeitig bei dem Amtsgericht Siegburg eingeht, auch wenn der Widerspruch zur Niederschrift der Geschäftsstelle eines anderen Amtsgerichts abgegeben wurde. Die Frist beginnt jeweils mit der schriftlichen Bekanntgabe der Verfügung an die Beteiligten. Kann die schriftliche Bekanntgabe an einen Beteiligten nicht bewirkt werden, beginnt die Frist spätestens mit Ablauf von fünf Monaten nach Erlass der Verfügung. Die Bekanntgabe ist entweder durch Zustellung oder am dritten Tage nach Aufgabe zur Post bewirkt. Sofern die Löschung noch nicht erfolgt ist, kann der Widerspruch auch noch nach Ablauf der Frist eingelegt werden. Fällt das Ende der Frist auf einen Sonnabend, einen Sonntag oder einen allgemeinen Feiertag, endet die Frist mit Ablauf des nächsten Werktages. Der Widerspruch ist zu unterzeichnen. Eine Begründung des Widerspruchs ist nicht vorgeschrieben."
    },
    {
      "date": "2025-06-10",
      "id": "111717",
      "original_text": "Löschungsankündigung\nNordrhein-Westfalen Amtsgericht Siegburg HRB 17367\nTrue Device UG (haftungsbeschränkt) – Nümbrecht",
      "type": "Löschungsankündigung",
      "state": "Nordrhein-Westfalen",
      "amtsgericht": "Amtsgericht Siegburg",
      "registernummer": "HRB 17367",
      "registerart": "HRB",
      "company_name": "True Device UG (haftungsbeschränkt)",
      "company_seat": "Nümbrecht",
      "details": "10.06.2025 (Bekanntmachungsdatum)\n\nNordrhein-Westfalen Amtsgericht Siegburg HRB 17367\nLöschungsankündigung\n\nTrue Device UG (haftungsbeschränkt)\nGesellschaft mit beschränkter Haftung\nNümbrecht\n\nDas Registergericht hat glaubhafte Kenntnis erlangt, dass die Gesellschaft vermögenslos geworden ist, da ein Insolvenzeröffnungsantrag mangels Masse nach § 26 InsO zurückgewiesen wurde.\n\nEs ist daher beabsichtigt, die Gesellschaft nach § 394 FamFG im Handelsregister wegen Vermögenslosigkeit zu löschen.\n\nEinwände gegen die Löschung sind durch Widerspruch binnen einer Frist von 3 Monaten geltend zu machen, andernfalls die Löschung erfolgen wird.\n\nEinzulegen ist der Widerspruch bei dem Amtsgericht Siegburg, Neue Poststraße 16, 53721 Siegburg, und zwar entweder schriftlich in deutscher Sprache oder mündlich zur Niederschrift der Geschäftsstelle. Der Widerspruch kann auch zur Niederschrift der Geschäftsstelle eines jeden Amtsgerichts abgegeben werden. Der Widerspruch ist binnen der in der Verfügung bestimmten Frist einzulegen. Die Frist ist nur gewahrt, wenn der Widerspruch rechtzeitig bei dem Amtsgericht Siegburg eingeht, auch wenn der Widerspruch zur Niederschrift der Geschäftsstelle eines anderen Amtsgerichts abgegeben wurde. Die Frist beginnt jeweils mit der schriftlichen Bekanntgabe der Verfügung an die Beteiligten. Kann die schriftliche Bekanntgabe an einen Beteiligten nicht bewirkt werden, beginnt die Frist spätestens mit Ablauf von fünf Monaten nach Erlass der Verfügung. Die Bekanntgabe ist entweder durch Zustellung oder am dritten Tage nach Aufgabe zur Post bewirkt. Sofern die Löschung noch nicht erfolgt ist, kann der Widerspruch auch noch nach Ablauf der Frist eingelegt werden. Fällt das Ende der Frist auf einen Sonnabend, einen Sonntag oder einen allgemeinen Feiertag, endet die Frist mit Ablauf des nächsten Werktages. Der Widerspruch ist zu unterzeichnen. Eine Begründung des Widerspruchs ist nicht vorgeschrieben."
    },
    {
      "date": "2025-06-10",
      "id": "111718",
      "original_text": "Registerbekanntmachung nach dem Umwandlungsgesetz\nNordrhein-Westfalen Amtsgericht Düsseldorf HRB 108160\nCON MOTO Strategie und Realisierung GmbH – Düsseldorf",
      "type": "Registerbekanntmachung nach dem Umwandlungsgesetz",
      "state": "Nordrhein-Westfalen",
      "amtsgericht": "Amtsgericht Düsseldorf",
      "registernummer": "HRB 108160",
      "registerart": "HRB",
      "company_name": "CON MOTO Strategie und Realisierung GmbH",
      "company_seat": "Düsseldorf",
      "details": "10.06.2025 (Bekanntmachungsdatum)\n\nNordrhein-Westfalen Amtsgericht Düsseldorf HRB 108160\nRegisterbekanntmachung nach dem Umwandlungsgesetz 10.06.2025 (Eintragungsdatum)\n\nCON MOTO Strategie und Realisierung GmbH\nGesellschaft mit beschränkter Haftung\nDüsseldorf\n\nDen Gläubigern der an der Verschmelzung beteiligten Rechtsträger ist, wenn sie binnen sechs Monaten nach dem Tag, an dem die Eintragung der Verschmelzung in das Register des Sitzes desjenigen Rechtsträgers, dessen Gläubiger sie sind, nach § 19 Absatz 3 UmwG als bekanntgemacht gilt, ihren Anspruch nach Grund und Höhe schriftlich anmelden, Sicherheit zu leisten, soweit sie nicht Befriedigung verlangen können. Dieses Recht steht den Gläubigern jedoch nur zu, wenn sie glaubhaft machen, dass durch die Verschmelzung die Erfüllung ihrer Forderung gefährdet wird."
    },
    {
      "date": "2025-06-10",
      "id": "111719",
      "original_text": "Löschungsankündigung\nNordrhein-Westfalen Amtsgericht Siegburg HRB 9317\nAutohaus Schmitz GmbH – Königswinter",
      "type": "Löschungsankündigung",
      "state": "Nordrhein-Westfalen",
      "amtsgericht": "Amtsgericht Siegburg",
      "registernummer": "HRB 9317",
      "registerart": "HRB",
      "company_name": "Autohaus Schmitz GmbH",
      "company_seat": "Königswinter",
      "details": "10.06.2025 (Bekanntmachungsdatum)\n\nNordrhein-Westfalen Amtsgericht Siegburg HRB 9317\nLöschungsankündigung\n\nAutohaus Schmitz GmbH\nGesellschaft mit beschränkter Haftung\nKönigswinter\n\nDas Registergericht hat glaubhafte Kenntnis erlangt, dass die Gesellschaft vermögenslos geworden ist, da ein Insolvenzverfahren durchgeführt und nach § 200 InsO aufgehoben wurde.\n\nEs ist daher beabsichtigt, die Gesellschaft nach § 394 FamFG im Handelsregister wegen Vermögenslosigkeit zu löschen.\n\nEinwände gegen die Löschung sind durch Widerspruch binnen einer Frist von 3 Monaten geltend zu machen, andernfalls die Löschung erfolgen wird.\n\nEinzulegen ist der Widerspruch bei dem Amtsgericht Siegburg, Neue Poststraße 16, 53721 Siegburg, und zwar entweder schriftlich in deutscher Sprache oder mündlich zur Niederschrift der Geschäftsstelle. Der Widerspruch kann auch zur Niederschrift der Geschäftsstelle eines jeden Amtsgerichts abgegeben werden. Der Widerspruch ist binnen der in der Verfügung bestimmten Frist einzulegen. Die Frist ist nur gewahrt, wenn der Widerspruch rechtzeitig bei dem Amtsgericht Siegburg eingeht, auch wenn der Widerspruch zur Niederschrift der Geschäftsstelle eines anderen Amtsgerichts abgegeben wurde. Die Frist beginnt jeweils mit der schriftlichen Bekanntgabe der Verfügung an die Beteiligten. Kann die schriftliche Bekanntgabe an einen Beteiligten nicht bewirkt werden, beginnt die Frist spätestens mit Ablauf von fünf Monaten nach Erlass der Verfügung. Die Bekanntgabe ist entweder durch Zustellung oder am dritten Tage nach Aufgabe zur Post bewirkt. Sofern die Löschung noch nicht erfolgt ist, kann der Widerspruch auch noch nach Ablauf der Frist eingelegt werden. Fällt das Ende der Frist auf einen Sonnabend, einen Sonntag oder einen allgemeinen Feiertag, endet die Frist mit Ablauf des nächsten Werktages. Der Widerspruch ist zu unterzeichnen. Eine Begründung des Widerspruchs ist nicht vorgeschrieben."
    },
    {
      "date": "2025-06-10",
      "id": "111720",
      "original_text": "Registerbekanntmachung nach dem Umwandlungsgesetz\nNordrhein-Westfalen Amtsgericht Düsseldorf HRB 71943\nBehrmann GmbH – Düsseldorf",
      "type": "Registerbekanntmachung nach dem Umwandlungsgesetz",
      "state": "Nordrhein-Westfalen",
      "amtsgericht": "Amtsgericht Düsseldorf",
      "registernummer": "HRB 71943",
      "registerart": "HRB",
      "company_name": "Behrmann GmbH",
      "company_seat": "Düsseldorf",
      "details": "10.06.2025 (Bekanntmachungsdatum)\n\nNordrhein-Westfalen Amtsgericht Düsseldorf HRB 71943\nRegisterbekanntmachung nach dem Umwandlungsgesetz 10.06.2025 (Eintragungsdatum)\n\nBehrmann GmbH\nGesellschaft mit beschränkter Haftung\nDüsseldorf\n\nDen Gläubigern der an der Verschmelzung beteiligten Rechtsträger ist, wenn sie binnen sechs Monaten nach dem Tag, an dem die Eintragung der Verschmelzung in das Register des Sitzes desjenigen Rechtsträgers, dessen Gläubiger sie sind, nach § 19 Absatz 3 UmwG als bekanntgemacht gilt, ihren Anspruch nach Grund und Höhe schriftlich anmelden, Sicherheit zu leisten, soweit sie nicht Befriedigung verlangen können. Dieses Recht steht den Gläubigern jedoch nur zu, wenn sie glaubhaft machen, dass durch die Verschmelzung die Erfüllung ihrer Forderung gefährdet wird."
    },
    {
      "date": "2025-06-10",
      "id": "111721",
      "original_text": "Registerbekanntmachung nach dem Umwandlungsgesetz\nNordrhein-Westfalen Amtsgericht Bonn HRA 10207\nVersicherungsmaklerbüro Manfred Schmelzer e.K. – Mechernich",
      "type": "Registerbekanntmachung nach dem Umwandlungsgesetz",
      "state": "Nordrhein-Westfalen",
      "amtsgericht": "Amtsgericht Bonn",
      "registernummer": "HRA 10207",
      "registerart": "HRA",
      "company_name": "Versicherungsmaklerbüro Manfred Schmelzer e.K.",
      "company_seat": "Mechernich",
      "details": "10.06.2025 (Bekanntmachungsdatum)\n\nNordrhein-Westfalen Amtsgericht Bonn HRA 10207\nRegisterbekanntmachung nach dem Umwandlungsgesetz 10.06.2025 (Eintragungsdatum)\n\nVersicherungsmaklerbüro Manfred Schmelzer e.K.\nEinzelkaufmann / Einzelkauffrau\nMechernich\n\nDen Gläubigern der an der Ausgliederung beteiligten Rechtsträger ist, wenn sie binnen sechs Monaten nach dem Tag, an dem die Eintragung der Ausgliederung in das Register des Sitzes derjenigen Rechtsträger deren Gläubiger sie sind, nach § 19 Absatz 3 UmwG als bekanntgemacht gilt, ihren Anspruch nach Grund und Höhe schriftlich anmelden, Sicherheit zu leisten, soweit sie nicht Befriedigung verlangen können. Dieses Recht steht den Gläubigern jedoch nur zu, wenn sie glaubhaft machen, dass durch die Ausgliederung die Erfüllung ihrer Forderung gefährdet wird."
    },
    {
      "date": "2025-06-10",
      "id": "111722",
      "original_text": "Löschungsankündigung\nNordrhein-Westfalen Amtsgericht Siegburg HRB 16673\nSailyGroup AG – Lohmar",
      "type": "Löschungsankündigung",
      "state": "Nordrhein-Westfalen",
      "amtsgericht": "Amtsgericht Siegburg",
      "registernummer": "HRB 16673",
      "registerart": "HRB",
      "company_name": "SailyGroup AG",
      "company_seat": "Lohmar",
      "details": "10.06.2025 (Bekanntmachungsdatum)\n\nNordrhein-Westfalen Amtsgericht Siegburg HRB 16673\nLöschungsankündigung\n\nSailyGroup AG\nAktiengesellschaft\nLohmar\n\nDas Registergericht hat glaubhafte Kenntnis erlangt, dass die Gesellschaft vermögenslos geworden ist, da ein Insolvenzeröffnungsantrag mangels Masse nach § 26 InsO zurückgewiesen wurde.\n\nEs ist daher beabsichtigt, die Gesellschaft nach § 394 FamFG im Handelsregister wegen Vermögenslosigkeit zu löschen.\n\nEinwände gegen die Löschung sind durch Widerspruch binnen einer Frist von 3 Monaten geltend zu machen, andernfalls die Löschung erfolgen wird.\n\nEinzulegen ist der Widerspruch bei dem Amtsgericht Siegburg, Neue Poststraße 16, 53721 Siegburg, und zwar entweder schriftlich in deutscher Sprache oder mündlich zur Niederschrift der Geschäftsstelle. Der Widerspruch kann auch zur Niederschrift der Geschäftsstelle eines jeden Amtsgerichts abgegeben werden. Der Widerspruch ist binnen der in der Verfügung bestimmten Frist einzulegen. Die Frist ist nur gewahrt, wenn der Widerspruch rechtzeitig bei dem Amtsgericht Siegburg eingeht, auch wenn der Widerspruch zur Niederschrift der Geschäftsstelle eines anderen Amtsgerichts abgegeben wurde. Die Frist beginnt jeweils mit der schriftlichen Bekanntgabe der Verfügung an die Beteiligten. Kann die schriftliche Bekanntgabe an einen Beteiligten nicht bewirkt werden, beginnt die Frist spätestens mit Ablauf von fünf Monaten nach Erlass der Verfügung. Die Bekanntgabe ist entweder durch Zustellung oder am dritten Tage nach Aufgabe zur Post bewirkt. Sofern die Löschung noch nicht erfolgt ist, kann der Widerspruch auch noch nach Ablauf der Frist eingelegt werden. Fällt das Ende der Frist auf einen Sonnabend, einen Sonntag oder einen allgemeinen Feiertag, endet die Frist mit Ablauf des nächsten Werktages. Der Widerspruch ist zu unterzeichnen. Eine Begründung des Widerspruchs ist nicht vorgeschrieben."
    },
    {
      "date": "2025-06-10",
      "id": "111723",
      "original_text": "Registerbekanntmachung nach dem Umwandlungsgesetz\nNordrhein-Westfalen Amtsgericht Bonn HRB 24934\nScout24 Beteiligungs SE – Bonn",
      "type": "Registerbekanntmachung nach dem Umwandlungsgesetz",
      "state": "Nordrhein-Westfalen",
      "amtsgericht": "Amtsgericht Bonn",
      "registernummer": "HRB 24934",
      "registerart": "HRB",
      "company_name": "Scout24 Beteiligungs SE",
      "company_seat": "Bonn",
      "details": "10.06.2025 (Bekanntmachungsdatum)\n\nNordrhein-Westfalen Amtsgericht Bonn HRB 24934\nRegisterbekanntmachung nach dem Umwandlungsgesetz\n\nScout24 Beteiligungs SE\nEuropäische Aktiengesellschaft (SE)\nBonn\n\nDem Registergericht ist der Entwurf eines Vertrages über die geplante Verschmelzung der Scout24 Beteiligungs SE mit der Immobilien Scout GmbH eingereicht worden."
    },
    {
      "date": "2025-06-10",
      "id": "111724",
      "original_text": "Einreichung neuer Dokumente\nNordrhein-Westfalen Amtsgericht Essen HRB 34423\nthyssenkrupp Decarbon Technologies GmbH – Essen",
      "type": "Einreichung neuer Dokumente",
      "state": "Nordrhein-Westfalen",
      "amtsgericht": "Amtsgericht Essen",
      "registernummer": "HRB 34423",
      "registerart": "HRB",
      "company_name": "thyssenkrupp Decarbon Technologies GmbH",
      "company_seat": "Essen",
      "details": "10.06.2025 (Bekanntmachungsdatum)\n\nNordrhein-Westfalen Amtsgericht Essen HRB 34423\nEinreichung neuer Dokumente\n\nthyssenkrupp Decarbon Technologies GmbH\nGesellschaft mit beschränkter Haftung\nEssen\n\nDem Registergericht ist eine neue Liste der Mitglieder des Aufsichtsrates eingereicht worden."
    },
    {
      "date": "2025-06-10",
      "id": "111725",
      "original_text": "Registerbekanntmachung nach dem Umwandlungsgesetz\nBaden-Württemberg Amtsgericht Stuttgart HRB 400773\nRenz GmbH – Albstadt",
      "type": "Registerbekanntmachung nach dem Umwandlungsgesetz",
      "state": "Baden-Württemberg",
      "amtsgericht": "Amtsgericht Stuttgart",
      "registernummer": "HRB 400773",
      "registerart": "HRB",
      "company_name": "Renz GmbH",
      "company_seat": "Albstadt",
      "details": "10.06.2025 (Bekanntmachungsdatum)\n\nBaden-Württemberg Amtsgericht Stuttgart HRB 400773\nRegisterbekanntmachung nach dem Umwandlungsgesetz 10.06.2025 (Eintragungsdatum)\n\nRenz GmbH\nGesellschaft mit beschränkter Haftung\nAlbstadt\n\nDen Gläubigern der an der Verschmelzung beteiligten Rechtsträger ist, wenn sie binnen sechs Monaten nach dem Tag, an dem die Eintragung der Verschmelzung in das Register des Sitzes desjenigen Rechtsträgers, dessen Gläubiger sie sind, nach § 19 Abs. 3 UmwG als bekanntgemacht gilt, ihren Anspruch nach Grund und Höhe schriftlich anmelden, Sicherheit zu leisten, soweit sie nicht Befriedigung verlangen können. Dieses Recht steht den Gläubigern jedoch nur zu, wenn sie glaubhaft machen, dass durch die Verschmelzung die Erfüllung ihrer Forderung gefährdet wird."
    },
    {
      "date": "2025-06-10",
      "id": "111726",
      "original_text": "Einreichung neuer Dokumente\nThüringen Amtsgericht Jena HRB 517998\nneurocare group AG – Ilmenau",
      "type": "Einreichung neuer Dokumente",
      "state": "Thüringen",
      "amtsgericht": "Amtsgericht Jena",
      "registernummer": "HRB 517998",
      "registerart": "HRB",
      "company_name": "neurocare group AG",
      "company_seat": "Ilmenau",
      "details": "10.06.2025 (Bekanntmachungsdatum)\n\nThüringen Amtsgericht Jena HRB 517998\nEinreichung neuer Dokumente\n\nneurocare group AG\nAktiengesellschaft\nIlmenau\n\nBekanntmachung gem. § 106 AktG: Aufgrund einer Veränderung in den Personen der Aufsichtsratsmitglieder ist durch den Vorstand eine neue Liste zum Handelsregister eingereicht worden."
    },
    {
      "date": "2025-06-10",
      "id": "111727",
      "original_text": "Löschungsankündigung\nHessen Amtsgericht Bad Homburg v.d.H. HRB 12509\nHC Sport Management GmbH – Oberursel (Taunus)",
      "type": "Löschungsankündigung",
      "state": "Hessen",
      "amtsgericht": "Amtsgericht Bad Homburg v.d.H.",
      "registernummer": "HRB 12509",
      "registerart": "HRB",
      "company_name": "HC Sport Management GmbH",
      "company_seat": "Oberursel (Taunus)",
      "details": "10.06.2025 (Bekanntmachungsdatum)\n\nHessen Amtsgericht Bad Homburg v.d.H. HRB 12509\nLöschungsankündigung 10.06.2025 (Eintragungsdatum)\n\nHC Sport Management GmbH\nGesellschaft mit beschränkter Haftung\nOberursel (Taunus)\n\nDas Registergericht beabsichtigt die im Handelsregister eingetragene Gesellschaft von Amts wegen nach § 394 FamFG zu löschen. Die Frist zur Erhebung eines Widerspruchs gegen die beabsichtigte Löschung wird auf 3 Monate festgesetzt."
    },
    {
      "date": "2025-06-10",
      "id": "111728",
      "original_text": "Registerbekanntmachung nach dem Umwandlungsgesetz\nHessen Amtsgericht Hanau HRB 6845\nSimPlan AG – Hanau",
      "type": "Registerbekanntmachung nach dem Umwandlungsgesetz",
      "state": "Hessen",
      "amtsgericht": "Amtsgericht Hanau",
      "registernummer": "HRB 6845",
      "registerart": "HRB",
      "company_name": "SimPlan AG",
      "company_seat": "Hanau",
      "details": "10.06.2025 (Bekanntmachungsdatum)\n\nHessen Amtsgericht Hanau HRB 6845\nRegisterbekanntmachung nach dem Umwandlungsgesetz 10.06.2025 (Eintragungsdatum)\n\nSimPlan AG\nAktiengesellschaft\nHanau\n\nDen Gläubigern der an der Verschmelzung beteiligten Rechtsträger ist, wenn sie binnen sechs Monaten nach dem Tag, an dem die Eintragung der Verschmelzung in das Register des Sitzes desjenigen Rechtsträgers, dessen Gläubiger sie sind, nach § 19 Absatz 3 UmwG bekannt gemacht worden ist, ihren Anspruch nach Grund und Höhe schriftlich anmelden, Sicherheit zu leisten, soweit sie nicht Befriedigung verlangen können. Dieses Recht steht den Gläubigern jedoch nur zu, wenn sie glaubhaft machen, dass durch die Verschmelzung die Erfüllung ihrer Forderung gefährdet wird."
    },
    {
      "date": "2025-06-10",
      "id": "111729",
      "original_text": "Sonstige Registerbekanntmachung\nHessen Amtsgericht Wiesbaden HRB 11937\nDr. Freitäger AG – Wiesbaden",
      "type": "Sonstige Registerbekanntmachung",
      "state": "Hessen",
      "amtsgericht": "Amtsgericht Wiesbaden",
      "registernummer": "HRB 11937",
      "registerart": "HRB",
      "company_name": "Dr. Freitäger AG",
      "company_seat": "Wiesbaden",
      "details": "10.06.2025 (Bekanntmachungsdatum)\n\nHessen Amtsgericht Wiesbaden HRB 11937\nSonstige Registerbekanntmachung 10.06.2025 (Eintragungsdatum)\n\nDr. Freitäger AG\nAktiengesellschaft\nWiesbaden\n\nDurch eine Änderung in den Personen der Aufsichtsratsmitglieder ist eine Liste der Mitglieder des Aufsichtsrates zum Handelsregister eingereicht worden."
    },
    {
      "date": "2025-06-10",
      "id": "111730",
      "original_text": "Registerbekanntmachung nach dem Umwandlungsgesetz\nHessen Amtsgericht Frankfurt am Main HRB 114972\naixit GmbH – Frankfurt am Main",
      "type": "Registerbekanntmachung nach dem Umwandlungsgesetz",
      "state": "Hessen",
      "amtsgericht": "Amtsgericht Frankfurt am Main",
      "registernummer": "HRB 114972",
      "registerart": "HRB",
      "company_name": "aixit GmbH",
      "company_seat": "Frankfurt am Main",
      "details": "10.06.2025 (Bekanntmachungsdatum)\n\nHessen Amtsgericht Frankfurt am Main HRB 114972\nRegisterbekanntmachung nach dem Umwandlungsgesetz 10.06.2025 (Eintragungsdatum)\n\naixit GmbH\nGesellschaft mit beschränkter Haftung\nFrankfurt am Main\n\nDen Gläubigern der an der Verschmelzung beteiligten Rechtsträger ist, wenn sie binnen sechs Monaten nach dem Tag, an dem die Eintragung der Verschmelzung in das Register des Sitzes desjenigen Rechtsträgers, dessen Gläubiger sie sind, nach § 19 Absatz 3 UmwG bekannt gemacht worden ist, ihren Anspruch nach Grund und Höhe schriftlich anmelden, Sicherheit zu leisten, soweit sie nicht Befriedigung verlangen können. Dieses Recht steht den Gläubigern jedoch nur zu, wenn sie glaubhaft machen, dass durch die Verschmelzung die Erfüllung ihrer Forderung gefährdet wird."
    },
    {
      "date": "2025-06-10",
      "id": "111731",
      "original_text": "Registerbekanntmachung nach dem Umwandlungsgesetz\nHessen Amtsgericht Limburg GnR 152\nVolksbank Schupbach eG – Beselich",
      "type": "Registerbekanntmachung nach dem Umwandlungsgesetz",
      "state": "Hessen",
      "amtsgericht": "Amtsgericht Limburg",
      "registernummer": "GnR 152",
      "registerart": "GnR",
      "company_name": "Volksbank Schupbach eG",
      "company_seat": "Beselich",
      "details": "10.06.2025 (Bekanntmachungsdatum)\n\nHessen Amtsgericht Limburg GnR 152\nRegisterbekanntmachung nach dem Umwandlungsgesetz 10.06.2025 (Eintragungsdatum)\n\nVolksbank Schupbach eG\neingetragene Genossenschaft\nBeselich\n\nDen Gläubigern der an der Verschmelzung beteiligten Rechtsträger ist, wenn sie binnen sechs Monaten nach dem Tag, an dem die Eintragung der Verschmelzung in das Register des Sitzes desjenigen Rechtsträgers, dessen Gläubiger sie sind, nach § 19 Absatz 3 UmwG bekannt gemacht worden ist, ihren Anspruch nach Grund und Höhe schriftlich anmelden, Sicherheit zu leisten, soweit sie nicht Befriedigung verlangen können. Dieses Recht steht den Gläubigern jedoch nur zu, wenn sie glaubhaft machen, dass durch die Verschmelzung die Erfüllung ihrer Forderung gefährdet wird."
    },
    {
      "date": "2025-06-10",
      "id": "111732",
      "original_text": "Löschungsankündigung\nHessen Amtsgericht Hanau HRB 98269\nAria Travel Point UG (haftungsbeschränkt) – Maintal",
      "type": "Löschungsankündigung",
      "state": "Hessen",
      "amtsgericht": "Amtsgericht Hanau",
      "registernummer": "HRB 98269",
      "registerart": "HRB",
      "company_name": "Aria Travel Point UG (haftungsbeschränkt)",
      "company_seat": "Maintal",
      "details": "10.06.2025 (Bekanntmachungsdatum)\n\nHessen Amtsgericht Hanau HRB 98269\nLöschungsankündigung\n\nAria Travel Point UG (haftungsbeschränkt)\nGesellschaft mit beschränkter Haftung\nMaintal\n\nDas Registergericht beabsichtigt den im Handelsregister eingetragenen Geschäftsführer Ahmad Reshad, Tajik, Spessartstr. 13a, 63477 Maintal von Amts wegen nach § 395 FamFG zu löschen. Die Frist zur Erhebung eines Widerspruchs gegen die beabsichtigte Löschung wird auf 1 Monat festgesetzt."
    },
    {
      "date": "2025-06-10",
      "id": "111733",
      "original_text": "Registerbekanntmachung nach dem Umwandlungsgesetz\nHessen Amtsgericht Limburg HRB 5435\nHolter Aufzüge GmbH – Limburg",
      "type": "Registerbekanntmachung nach dem Umwandlungsgesetz",
      "state": "Hessen",
      "amtsgericht": "Amtsgericht Limburg",
      "registernummer": "HRB 5435",
      "registerart": "HRB",
      "company_name": "Holter Aufzüge GmbH",
      "company_seat": "Limburg",
      "details": "10.06.2025 (Bekanntmachungsdatum)\n\nHessen Amtsgericht Limburg HRB 5435\nRegisterbekanntmachung nach dem Umwandlungsgesetz 10.06.2025 (Eintragungsdatum)\n\nHolter Aufzüge GmbH\nGesellschaft mit beschränkter Haftung\nLimburg\n\nDen Gläubigern der an der Verschmelzung beteiligten Rechtsträger ist, wenn sie binnen sechs Monaten nach dem Tag, an dem die Eintragung der Verschmelzung in das Register des Sitzes desjenigen Rechtsträgers, dessen Gläubiger sie sind, nach § 19 Absatz 3 UmwG bekannt gemacht worden ist, ihren Anspruch nach Grund und Höhe schriftlich anmelden, Sicherheit zu leisten, soweit sie nicht Befriedigung verlangen können. Dieses Recht steht den Gläubigern jedoch nur zu, wenn sie glaubhaft machen, dass durch die Verschmelzung die Erfüllung ihrer Forderung gefährdet wird."
    },
    {
      "date": "2025-06-10",
      "id": "111734",
      "original_text": "Registerbekanntmachung nach dem Umwandlungsgesetz\nHessen Amtsgericht Frankfurt am Main HRB 115097\nCASESO GmbH – Frankfurt am Main",
      "type": "Registerbekanntmachung nach dem Umwandlungsgesetz",
      "state": "Hessen",
      "amtsgericht": "Amtsgericht Frankfurt am Main",
      "registernummer": "HRB 115097",
      "registerart": "HRB",
      "company_name": "CASESO GmbH",
      "company_seat": "Frankfurt am Main",
      "details": "10.06.2025 (Bekanntmachungsdatum)\n\nHessen Amtsgericht Frankfurt am Main HRB 115097\nRegisterbekanntmachung nach dem Umwandlungsgesetz 10.06.2025 (Eintragungsdatum)\n\nCASESO GmbH\nGesellschaft mit beschränkter Haftung\nFrankfurt am Main\n\nDen Gläubigern der an der Verschmelzung beteiligten Rechtsträger ist, wenn sie binnen sechs Monaten nach dem Tag, an dem die Eintragung der Verschmelzung in das Register des Sitzes desjenigen Rechtsträgers, dessen Gläubiger sie sind, nach § 19 Absatz 3 UmwG bekannt gemacht worden ist, ihren Anspruch nach Grund und Höhe schriftlich anmelden, Sicherheit zu leisten, soweit sie nicht Befriedigung verlangen können. Dieses Recht steht den Gläubigern jedoch nur zu, wenn sie glaubhaft machen, dass durch die Verschmelzung die Erfüllung ihrer Forderung gefährdet wird."
    },
    {
      "date": "2025-06-10",
      "id": "111735",
      "original_text": "Sonstige Registerbekanntmachung\nHessen Amtsgericht Frankfurt am Main HRB 40832\nStadtwerke Verkehrsgesellschaft Frankfurt am Main mbH – Frankfurt am Main",
      "type": "Sonstige Registerbekanntmachung",
      "state": "Hessen",
      "amtsgericht": "Amtsgericht Frankfurt am Main",
      "registernummer": "HRB 40832",
      "registerart": "HRB",
      "company_name": "Stadtwerke Verkehrsgesellschaft Frankfurt am Main mbH",
      "company_seat": "Frankfurt am Main",
      "details": "10.06.2025 (Bekanntmachungsdatum)\n\nHessen Amtsgericht Frankfurt am Main HRB 40832\nSonstige Registerbekanntmachung 10.06.2025 (Eintragungsdatum)\n\nStadtwerke Verkehrsgesellschaft Frankfurt am Main mbH\nGesellschaft mit beschränkter Haftung\nFrankfurt am Main\n\nDurch eine Änderung in den Personen der Aufsichtsratsmitglieder sind Listen der Mitglieder des Aufsichtsrates zum Handelsregister eingereicht worden."
    },
    {
      "date": "2025-06-10",
      "id": "111736",
      "original_text": "Registerbekanntmachung nach dem Umwandlungsgesetz\nHessen Amtsgericht Bad Homburg v.d.H. HRB 14352\nDarius und Lino Ventures GmbH – Oberursel (Taunus)",
      "type": "Registerbekanntmachung nach dem Umwandlungsgesetz",
      "state": "Hessen",
      "amtsgericht": "Amtsgericht Bad Homburg v.d.H.",
      "registernummer": "HRB 14352",
      "registerart": "HRB",
      "company_name": "Darius und Lino Ventures GmbH",
      "company_seat": "Oberursel (Taunus)",
      "details": "10.06.2025 (Bekanntmachungsdatum)\n\nHessen Amtsgericht Bad Homburg v.d.H. HRB 14352\nRegisterbekanntmachung nach dem Umwandlungsgesetz 10.06.2025 (Eintragungsdatum)\n\nDarius und Lino Ventures GmbH\nGesellschaft mit beschränkter Haftung\nOberursel (Taunus)\n\nDen Gläubigern der an der Verschmelzung beteiligten Rechtsträger ist, wenn sie binnen sechs Monaten nach dem Tag, an dem die Eintragung der Verschmelzung in das Register des Sitzes desjenigen Rechtsträgers, dessen Gläubiger sie sind, nach § 19 Absatz 3 UmwG bekannt gemacht worden ist, ihren Anspruch nach Grund und Höhe schriftlich anmelden, Sicherheit zu leisten, soweit sie nicht Befriedigung verlangen können. Dieses Recht steht den Gläubigern jedoch nur zu, wenn sie glaubhaft machen, dass durch die Verschmelzung die Erfüllung ihrer Forderung gefährdet wird."
    },
    {
      "date": "2025-06-10",
      "id": "111737",
      "original_text": "Registerbekanntmachung nach dem Umwandlungsgesetz\nHessen Amtsgericht Frankfurt am Main HRB 137622\nFREY Berlin Property 2 GmbH – Frankfurt am Main",
      "type": "Registerbekanntmachung nach dem Umwandlungsgesetz",
      "state": "Hessen",
      "amtsgericht": "Amtsgericht Frankfurt am Main",
      "registernummer": "HRB 137622",
      "registerart": "HRB",
      "company_name": "FREY Berlin Property 2 GmbH",
      "company_seat": "Frankfurt am Main",
      "details": "10.06.2025 (Bekanntmachungsdatum)\n\nHessen Amtsgericht Frankfurt am Main HRB 137622\nRegisterbekanntmachung nach dem Umwandlungsgesetz\n\nFREY Berlin Property 2 GmbH\nGesellschaft mit beschränkter Haftung\nFrankfurt am Main\n\nDem Registergericht ist der Entwurf eines Formwechselplans über die geplante\ngrenzüberschreitende Umwandlung der FREY Berlin Property 2 GmbH mit Sitz in Frankfurt\nam Main (Amtsgericht Frankfurt am Main, HRB 137622) in eine societe e responsabilite limitee (Gesellschaft mit beschränkter Haftung) nach dem Recht des Großherzogtums Luxemburg mit voraussichtlicher Firma FREY Berlin Property 2 S.a.r.l., unter gleichzeitiger Sitzverlegung nach Luxemburg, einzutragen in das Handelsregister von Luxemburg (Registre de Commerce et des Societes), eingereicht worden. Die Gesellschaft hat darauf hingewiesen, dass Gläubiger, Anteilsinhaber und etwaige andere Berechtigte gemäß § 336, § 308 Abs. 1 Satz 2 Nr. 4 a) und b) UmwG, der Gesellschaft spätestens fünf (5) Arbeitstage vor dem Tag der Gesellschafterversammlung Bemerkungen zum Formwechselplan übermitteln können. Die Gesellschaft hat weder Arbeitnehmer noch einen Betriebsrat. Den Gläubigern der Gesellschaft stehen hinsichtlich der grenzüberschreitenden Umwandlung (Formwechsel) die folgenden Rechte zu: Den Gläubigern, der die Rechtsform wechselnden Gesellschaft ist, wenn sie binnen sechs (6) Monaten nach dem Tag, an dem die Eintragung der formwechselnden Umwandlung in das Register des Sitzes desjenigen Rechtsträgers, dessen Gläubiger sie sind, nach § 336, § 308 Abs. 1 Satz 2 UmwG bekannt gemacht worden ist, ihren Anspruch nach Grund und Höhe schriftlich bei der Gesellschaft unter der Anschrift: 16 Rue Eugene Ruppert, 2453 Luxemburg, Großherzogtum Luxemburg, anmelden, Sicherheit zu leisten, soweit sie nicht Befriedigung verlangen können.\nDieses Recht steht den Gläubigern jedoch nur zu, wenn sie glaubhaft machen, dass durch die\ngrenzüberschreitende formwechselnde Umwandlung die Erfüllung ihrer Forderung gefährdet\nwird. Bei der Gesellschaft, unter der Anschrift 16 Rue Eugene Ruppert, 2453 Luxemburg,\nGroßherzogtum Luxemburg, können vollständige Auskünfte über die Modalitäten für die Ausübung der Rechte der Gläubiger kostenlos eingeholt werden."
    },
    {
      "date": "2025-06-10",
      "id": "111738",
      "original_text": "Registerbekanntmachung nach dem Umwandlungsgesetz\nHessen Amtsgericht Gießen GnR 302\nVolksbank Mittelhessen eG – Gießen",
      "type": "Registerbekanntmachung nach dem Umwandlungsgesetz",
      "state": "Hessen",
      "amtsgericht": "Amtsgericht Gießen",
      "registernummer": "GnR 302",
      "registerart": "GnR",
      "company_name": "Volksbank Mittelhessen eG",
      "company_seat": "Gießen",
      "details": "10.06.2025 (Bekanntmachungsdatum)\n\nHessen Amtsgericht Gießen GnR 302\nRegisterbekanntmachung nach dem Umwandlungsgesetz 10.06.2025 (Eintragungsdatum)\n\nVolksbank Mittelhessen eG\neingetragene Genossenschaft\nGießen\n\nDen Gläubigern der an der Verschmelzung beteiligten Rechtsträger ist, wenn sie binnen sechs Monaten nach dem Tag, an dem die Eintragung der Verschmelzung in das Register des Sitzes desjenigen Rechtsträgers, dessen Gläubiger sie sind, nach § 19 Absatz 3 UmwG bekannt gemacht worden ist, ihren Anspruch nach Grund und Höhe schriftlich anmelden, Sicherheit zu leisten, soweit sie nicht Befriedigung verlangen können. Dieses Recht steht den Gläubigern jedoch nur zu, wenn sie glaubhaft machen, dass durch die Verschmelzung die Erfüllung ihrer Forderung gefährdet wird."
    },
    {
      "date": "2025-06-10",
      "id": "111739",
      "original_text": "Registerbekanntmachung nach dem Umwandlungsgesetz\nHessen Amtsgericht Bad Homburg v.d.H. HRB 15863\nRecomise GmbH – Oberursel (Taunus)",
      "type": "Registerbekanntmachung nach dem Umwandlungsgesetz",
      "state": "Hessen",
      "amtsgericht": "Amtsgericht Bad Homburg v.d.H.",
      "registernummer": "HRB 15863",
      "registerart": "HRB",
      "company_name": "Recomise GmbH",
      "company_seat": "Oberursel (Taunus)",
      "details": "10.06.2025 (Bekanntmachungsdatum)\n\nHessen Amtsgericht Bad Homburg v.d.H. HRB 15863\nRegisterbekanntmachung nach dem Umwandlungsgesetz 10.06.2025 (Eintragungsdatum)\n\nRecomise GmbH\nGesellschaft mit beschränkter Haftung\nOberursel (Taunus)\n\nDen Gläubigern der an der Verschmelzung beteiligten Rechtsträger ist, wenn sie binnen sechs Monaten nach dem Tag, an dem die Eintragung der Verschmelzung in das Register des Sitzes desjenigen Rechtsträgers, dessen Gläubiger sie sind, nach § 19 Absatz 3 UmwG bekannt gemacht worden ist, ihren Anspruch nach Grund und Höhe schriftlich anmelden, Sicherheit zu leisten, soweit sie nicht Befriedigung verlangen können. Dieses Recht steht den Gläubigern jedoch nur zu, wenn sie glaubhaft machen, dass durch die Verschmelzung die Erfüllung ihrer Forderung gefährdet wird."
    }
  ]
}