{
  "date": "2025-06-17",
  "date_of_scrape": "2025-06-18T04:16:11.812Z",
  "tool_version": "0.2.0",
  "number_of_announcements": 171,
  "announcements": [
    {
      "date": "2025-06-17",
      "id": "112366",
      "original_text": "Registerbekanntmachung nach dem Umwandlungsgesetz\nBayern Amtsgericht Kempten (Allgäu) HRB 15393\nAmCom Verwaltungs GmbH – Kempten (Allgäu)",
      "type": "Registerbekanntmachung nach dem Umwandlungsgesetz",
      "state": "Bayern",
      "amtsgericht": "Amtsgericht Kempten (Allgäu)",
      "registernummer": "HRB 15393",
      "registerart": "HRB",
      "company_name": "AmCom Verwaltungs GmbH",
      "company_seat": "Kempten (Allgäu)",
      "details": "17.06.2025 (Bekanntmachungsdatum)\n\nBayern Amtsgericht Kempten (Allgäu) HRB 15393\nRegisterbekanntmachung nach dem Umwandlungsgesetz 14.06.2025 (Eintragungsdatum)\n\nAmCom Verwaltungs GmbH\nGesellschaft mit beschränkter Haftung\nKempten (Allgäu)\n\nDen Gläubigern der an der Verschmelzung beteiligten Rechtsträger ist, wenn sie binnen sechs Monaten nach dem Tag, an dem die Eintragung der Verschmelzung in das Register des Sitzes desjenigen Rechtsträgers, dessen Gläubiger sie sind, nach § 19 Abs. 3 UmwG als bekannt gemacht gilt, ihren Anspruch nach Grund und Höhe in Textform anmelden, Sicherheit zu leisten, soweit sie nicht Befriedigung verlangen können. Dieses Recht steht den Gläubigern jedoch nur zu, wenn sie glaubhaft machen, dass durch die Verschmelzung die Erfüllung ihrer Forderung gefährdet wird."
    },
    {
      "date": "2025-06-17",
      "id": "112367",
      "original_text": "Registerbekanntmachung nach dem Umwandlungsgesetz\nBayern Amtsgericht Bayreuth HRA 4953\nAutohaus Zillig GmbH & Co. KG – Kulmbach",
      "type": "Registerbekanntmachung nach dem Umwandlungsgesetz",
      "state": "Bayern",
      "amtsgericht": "Amtsgericht Bayreuth",
      "registernummer": "HRA 4953",
      "registerart": "HRA",
      "company_name": "Autohaus Zillig GmbH & Co. KG",
      "company_seat": "Kulmbach",
      "details": "17.06.2025 (Bekanntmachungsdatum)\n\nBayern Amtsgericht Bayreuth HRA 4953\nRegisterbekanntmachung nach dem Umwandlungsgesetz 16.06.2025 (Eintragungsdatum)\n\nAutohaus Zillig GmbH & Co. KG\nKommanditgesellschaft\nKulmbach\n\nDen Gläubigern des formwechselnden Rechtsträgers ist, wenn sie binnen sechs Monaten nach dem Tag, an dem die Eintragung des Formwechsels nach § 201 UmwG als bekannt gemacht gilt, ihren Anspruch nach Grund und Höhe in Textform anmelden, Sicherheit zu leisten, soweit sie nicht Befriedigung verlangen können. Dieses Recht steht den Gläubigern jedoch nur zu, wenn sie glaubhaft machen, dass durch den Formwechsel die Erfüllung ihrer Forderung gefährdet wird."
    },
    {
      "date": "2025-06-17",
      "id": "112368",
      "original_text": "Einreichung neuer Dokumente\nBayern Amtsgericht Ingolstadt HRB 9891\nConti Temic microelectronic GmbH – Ingolstadt",
      "type": "Einreichung neuer Dokumente",
      "state": "Bayern",
      "amtsgericht": "Amtsgericht Ingolstadt",
      "registernummer": "HRB 9891",
      "registerart": "HRB",
      "company_name": "Conti Temic microelectronic GmbH",
      "company_seat": "Ingolstadt",
      "details": "17.06.2025 (Bekanntmachungsdatum)\n\nBayern Amtsgericht Ingolstadt HRB 9891\nEinreichung neuer Dokumente\n\nConti Temic microelectronic GmbH\nGesellschaft mit beschränkter Haftung\nIngolstadt\n\nDem Amtsgericht Ingolstadt -Registergericht- ist eine Liste der Mitglieder des Aufsichtsrats eingereicht worden, § 52 Abs. 3 S. 2 GmbHG."
    },
    {
      "date": "2025-06-17",
      "id": "112369",
      "original_text": "Registerbekanntmachung nach dem Umwandlungsgesetz\nBayern Amtsgericht München HRB 303178\nRustemeyer Holding GmbH – Penzberg",
      "type": "Registerbekanntmachung nach dem Umwandlungsgesetz",
      "state": "Bayern",
      "amtsgericht": "Amtsgericht München",
      "registernummer": "HRB 303178",
      "registerart": "HRB",
      "company_name": "Rustemeyer Holding GmbH",
      "company_seat": "Penzberg",
      "details": "17.06.2025 (Bekanntmachungsdatum)\n\nBayern Amtsgericht München HRB 303178\nRegisterbekanntmachung nach dem Umwandlungsgesetz 16.06.2025 (Eintragungsdatum)\n\nRustemeyer Holding GmbH\nGesellschaft mit beschränkter Haftung\nPenzberg\n\nDen Gläubigern der an der Ausgliederung beteiligten Rechtsträger ist, wenn sie binnen sechs Monaten nach dem Tag, an dem die Eintragung der Ausgliederung in das Register des Sitzes desjenigen Rechtsträgers, dessen Gläubiger sie sind, nach §§ 125, 19 Abs. 3 UmwG als bekannt gemacht gilt, ihren Anspruch nach Grund und Höhe in Textform anmelden, Sicherheit zu leisten, soweit sie nicht Befriedigung verlangen können. Dieses Recht steht den Gläubigern jedoch nur zu, wenn sie glaubhaft machen, dass durch die Ausgliederung die Erfüllung ihrer Forderung gefährdet wird."
    },
    {
      "date": "2025-06-17",
      "id": "112370",
      "original_text": "Löschungsankündigung\nBayern Amtsgericht Landshut HRB 9643\nEAWB Höglberg GmbH – Landshut",
      "type": "Löschungsankündigung",
      "state": "Bayern",
      "amtsgericht": "Amtsgericht Landshut",
      "registernummer": "HRB 9643",
      "registerart": "HRB",
      "company_name": "EAWB Höglberg GmbH",
      "company_seat": "Landshut",
      "details": "17.06.2025 (Bekanntmachungsdatum)\n\nBayern Amtsgericht Landshut HRB 9643\nLöschungsankündigung\n\nEAWB Höglberg GmbH\nGesellschaft mit beschränkter Haftung\nLandshut\n\nDas Registergericht beabsichtigt, die im Handelsregister eingetragene Gesellschaft wegen Vermögenslosigkeit von Amts wegen nach § 394 FamFG zu löschen. Die Frist zur Erhebung eines Widerspruchs ist auf einen Monat festgesetzt."
    },
    {
      "date": "2025-06-17",
      "id": "112371",
      "original_text": "Sonstige Registerbekanntmachung\nBayern Amtsgericht Nürnberg HRB 17412\nN-ERGIE Aktiengesellschaft – Nürnberg",
      "type": "Sonstige Registerbekanntmachung",
      "state": "Bayern",
      "amtsgericht": "Amtsgericht Nürnberg",
      "registernummer": "HRB 17412",
      "registerart": "HRB",
      "company_name": "N-ERGIE Aktiengesellschaft",
      "company_seat": "Nürnberg",
      "details": "17.06.2025 (Bekanntmachungsdatum)\n\nBayern Amtsgericht Nürnberg HRB 17412\nSonstige Registerbekanntmachung\n\nN-ERGIE Aktiengesellschaft\nAktiengesellschaft\nNürnberg\n\nDem Amtsgericht Nürnberg -Registergericht- ist eine Liste der Mitglieder des Aufsichtsrats eingereicht worden, § 106 AktG."
    },
    {
      "date": "2025-06-17",
      "id": "112372",
      "original_text": "Sonstige Registerbekanntmachung\nBayern Amtsgericht Würzburg HRB 14568\nTierärztliche Klinik Reichenberg Evidensia GmbH – Reichenberg",
      "type": "Sonstige Registerbekanntmachung",
      "state": "Bayern",
      "amtsgericht": "Amtsgericht Würzburg",
      "registernummer": "HRB 14568",
      "registerart": "HRB",
      "company_name": "Tierärztliche Klinik Reichenberg Evidensia GmbH",
      "company_seat": "Reichenberg",
      "details": "17.06.2025 (Bekanntmachungsdatum)\n\nBayern Amtsgericht Würzburg HRB 14568\nSonstige Registerbekanntmachung 14.06.2025 (Eintragungsdatum)\n\nTierärztliche Klinik Reichenberg Evidensia GmbH\nGesellschaft mit beschränkter Haftung\nReichenberg\n\nDen Gläubigern der an der Verschmelzung beteiligten Rechtsträger ist, wenn sie binnen sechs Monaten nach dem Tag, an dem die Eintragung der Verschmelzung in das Register des Sitzes desjenigen Rechtsträgers, dessen Gläubiger sie sind, nach § 19 Abs. 3 UmwG als bekannt gemacht gilt, ihren Anspruch nach Grund und Höhe in Textform anmelden, Sicherheit zu leisten, soweit sie nicht Befriedigung verlangen können. Dieses Recht steht den Gläubigern jedoch nur zu, wenn sie glaubhaft machen, dass durch die Verschmelzung die Erfüllung ihrer Forderung gefährdet wird."
    },
    {
      "date": "2025-06-17",
      "id": "112373",
      "original_text": "Registerbekanntmachung nach dem Umwandlungsgesetz\nBayern Amtsgericht München HRB 254053\nTierärzte IVC Evidensia GmbH – München",
      "type": "Registerbekanntmachung nach dem Umwandlungsgesetz",
      "state": "Bayern",
      "amtsgericht": "Amtsgericht München",
      "registernummer": "HRB 254053",
      "registerart": "HRB",
      "company_name": "Tierärzte IVC Evidensia GmbH",
      "company_seat": "München",
      "details": "17.06.2025 (Bekanntmachungsdatum)\n\nBayern Amtsgericht München HRB 254053\nRegisterbekanntmachung nach dem Umwandlungsgesetz 16.06.2025 (Eintragungsdatum)\n\nTierärzte IVC Evidensia GmbH\nGesellschaft mit beschränkter Haftung\nMünchen\n\nDen Gläubigern der an der Verschmelzung beteiligten Rechtsträger ist, wenn sie binnen sechs Monaten nach dem Tag, an dem die Eintragung der Verschmelzung in das Register des Sitzes desjenigen Rechtsträgers, dessen Gläubiger sie sind, nach § 19 Abs. 3 UmwG als bekannt gemacht gilt, ihren Anspruch nach Grund und Höhe in Textform anmelden, Sicherheit zu leisten, soweit sie nicht Befriedigung verlangen können. Dieses Recht steht den Gläubigern jedoch nur zu, wenn sie glaubhaft machen, dass durch die Verschmelzung die Erfüllung ihrer Forderung gefährdet wird."
    },
    {
      "date": "2025-06-17",
      "id": "112374",
      "original_text": "Registerbekanntmachung nach dem Umwandlungsgesetz\nBayern Amtsgericht München HRB 263138\nflaschenpost München 2 DEX GmbH – München",
      "type": "Registerbekanntmachung nach dem Umwandlungsgesetz",
      "state": "Bayern",
      "amtsgericht": "Amtsgericht München",
      "registernummer": "HRB 263138",
      "registerart": "HRB",
      "company_name": "flaschenpost München 2 DEX GmbH",
      "company_seat": "München",
      "details": "17.06.2025 (Bekanntmachungsdatum)\n\nBayern Amtsgericht München HRB 263138\nRegisterbekanntmachung nach dem Umwandlungsgesetz 16.06.2025 (Eintragungsdatum)\n\nflaschenpost München 2 DEX GmbH\nGesellschaft mit beschränkter Haftung\nMünchen\n\nDen Gläubigern der an der Verschmelzung beteiligten Rechtsträger ist, wenn sie binnen sechs Monaten nach dem Tag, an dem die Eintragung der Verschmelzung in das Register des Sitzes desjenigen Rechtsträgers, dessen Gläubiger sie sind, nach § 19 Abs. 3 UmwG als bekannt gemacht gilt, ihren Anspruch nach Grund und Höhe in Textform anmelden, Sicherheit zu leisten, soweit sie nicht Befriedigung verlangen können. Dieses Recht steht den Gläubigern jedoch nur zu, wenn sie glaubhaft machen, dass durch die Verschmelzung die Erfüllung ihrer Forderung gefährdet wird."
    },
    {
      "date": "2025-06-17",
      "id": "112375",
      "original_text": "Registerbekanntmachung nach dem Umwandlungsgesetz\nBayern Amtsgericht Traunstein HRB 17218\nCOC AG – Burghausen",
      "type": "Registerbekanntmachung nach dem Umwandlungsgesetz",
      "state": "Bayern",
      "amtsgericht": "Amtsgericht Traunstein",
      "registernummer": "HRB 17218",
      "registerart": "HRB",
      "company_name": "COC AG",
      "company_seat": "Burghausen",
      "details": "17.06.2025 (Bekanntmachungsdatum)\n\nBayern Amtsgericht Traunstein HRB 17218\nRegisterbekanntmachung nach dem Umwandlungsgesetz 16.06.2025 (Eintragungsdatum)\n\nCOC AG\nAktiengesellschaft\nBurghausen\n\nDen Gläubigern der an der Ausgliederung beteiligten Rechtsträger ist, wenn sie binnen sechs Monaten nach dem Tag, an dem die Eintragung der Ausgliederung in das Register des Sitzes desjenigen Rechtsträgers, dessen Gläubiger sie sind, nach §§ 125, 19 Abs. 3 UmwG als bekannt gemacht gilt, ihren Anspruch nach Grund und Höhe in Textform anmelden, Sicherheit zu leisten, soweit sie nicht Befriedigung verlangen können. Dieses Recht steht den Gläubigern jedoch nur zu, wenn sie glaubhaft machen, dass durch die Ausgliederung die Erfüllung ihrer Forderung gefährdet wird."
    },
    {
      "date": "2025-06-17",
      "id": "112376",
      "original_text": "Löschungsankündigung\nBayern Amtsgericht München HRB 40124\nCaravan-Center-München GmbH – München",
      "type": "Löschungsankündigung",
      "state": "Bayern",
      "amtsgericht": "Amtsgericht München",
      "registernummer": "HRB 40124",
      "registerart": "HRB",
      "company_name": "Caravan-Center-München GmbH",
      "company_seat": "München",
      "details": "17.06.2025 (Bekanntmachungsdatum)\n\nBayern Amtsgericht München HRB 40124\nLöschungsankündigung 16.06.2025 (Eintragungsdatum)\n\nCaravan-Center-München GmbH\nGesellschaft mit beschränkter Haftung\nMünchen\n\nDas Registergericht beabsichtigt, die im Handelsregister eingetragene Gesellschaft wegen Vermögenslosigkeit von Amts wegen nach § 394 FamFG zu löschen. Die Frist zur Erhebung eines Widerspruchs ist auf drei Monate festgesetzt."
    },
    {
      "date": "2025-06-17",
      "id": "112377",
      "original_text": "Registerbekanntmachung nach dem Umwandlungsgesetz\nBayern Amtsgericht München HRB 292324\nLifeFit Group InterCo GmbH – München",
      "type": "Registerbekanntmachung nach dem Umwandlungsgesetz",
      "state": "Bayern",
      "amtsgericht": "Amtsgericht München",
      "registernummer": "HRB 292324",
      "registerart": "HRB",
      "company_name": "LifeFit Group InterCo GmbH",
      "company_seat": "München",
      "details": "17.06.2025 (Bekanntmachungsdatum)\n\nBayern Amtsgericht München HRB 292324\nRegisterbekanntmachung nach dem Umwandlungsgesetz 16.06.2025 (Eintragungsdatum)\n\nLifeFit Group InterCo GmbH\nGesellschaft mit beschränkter Haftung\nMünchen\n\nDen Gläubigern der an der Verschmelzung beteiligten Rechtsträger ist, wenn sie binnen sechs Monaten nach dem Tag, an dem die Eintragung der Verschmelzung in das Register des Sitzes desjenigen Rechtsträgers, dessen Gläubiger sie sind, nach § 19 Abs. 3 UmwG als bekannt gemacht gilt, ihren Anspruch nach Grund und Höhe in Textform anmelden, Sicherheit zu leisten, soweit sie nicht Befriedigung verlangen können. Dieses Recht steht den Gläubigern jedoch nur zu, wenn sie glaubhaft machen, dass durch die Verschmelzung die Erfüllung ihrer Forderung gefährdet wird."
    },
    {
      "date": "2025-06-17",
      "id": "112378",
      "original_text": "Löschungsankündigung\nBayern Amtsgericht Traunstein HRA 5661\nLechner Immobilienverwaltung e.K. Inhaber Erwin Lechner – Brannenburg",
      "type": "Löschungsankündigung",
      "state": "Bayern",
      "amtsgericht": "Amtsgericht Traunstein",
      "registernummer": "HRA 5661",
      "registerart": "HRA",
      "company_name": "Lechner Immobilienverwaltung e.K. Inhaber Erwin Lechner",
      "company_seat": "Brannenburg",
      "details": "17.06.2025 (Bekanntmachungsdatum)\n\nBayern Amtsgericht Traunstein HRA 5661\nLöschungsankündigung\n\nLechner Immobilienverwaltung e.K. Inhaber Erwin Lechner\nEinzelkaufmann / Einzelkauffrau\nBrannenburg\n\nDas Registergericht beabsichtigt, die im Handelsregister eingetragene Firma von Amts wegen nach § 31 Abs. 2 HGB zu löschen. Die Frist zur Erhebung eines Widerspruchs ist auf drei Monate festgesetzt."
    },
    {
      "date": "2025-06-17",
      "id": "112379",
      "original_text": "Registerbekanntmachung nach dem Umwandlungsgesetz\nBayern Amtsgericht München HRB 263080\nflaschenpost München 3 GmbH – München",
      "type": "Registerbekanntmachung nach dem Umwandlungsgesetz",
      "state": "Bayern",
      "amtsgericht": "Amtsgericht München",
      "registernummer": "HRB 263080",
      "registerart": "HRB",
      "company_name": "flaschenpost München 3 GmbH",
      "company_seat": "München",
      "details": "17.06.2025 (Bekanntmachungsdatum)\n\nBayern Amtsgericht München HRB 263080\nRegisterbekanntmachung nach dem Umwandlungsgesetz 16.06.2025 (Eintragungsdatum)\n\nflaschenpost München 3 GmbH\nGesellschaft mit beschränkter Haftung\nMünchen\n\nDen Gläubigern der an der Verschmelzung beteiligten Rechtsträger ist, wenn sie binnen sechs Monaten nach dem Tag, an dem die Eintragung der Verschmelzung in das Register des Sitzes desjenigen Rechtsträgers, dessen Gläubiger sie sind, nach § 19 Abs. 3 UmwG als bekannt gemacht gilt, ihren Anspruch nach Grund und Höhe in Textform anmelden, Sicherheit zu leisten, soweit sie nicht Befriedigung verlangen können. Dieses Recht steht den Gläubigern jedoch nur zu, wenn sie glaubhaft machen, dass durch die Verschmelzung die Erfüllung ihrer Forderung gefährdet wird."
    },
    {
      "date": "2025-06-17",
      "id": "112380",
      "original_text": "Löschungsankündigung\nBayern Amtsgericht München HRB 202672\nJankovic Verputz GmbH – München",
      "type": "Löschungsankündigung",
      "state": "Bayern",
      "amtsgericht": "Amtsgericht München",
      "registernummer": "HRB 202672",
      "registerart": "HRB",
      "company_name": "Jankovic Verputz GmbH",
      "company_seat": "München",
      "details": "17.06.2025 (Bekanntmachungsdatum)\n\nBayern Amtsgericht München HRB 202672\nLöschungsankündigung\n\nJankovic Verputz GmbH\nGesellschaft mit beschränkter Haftung\nMünchen\n\nDas Registergericht beabsichtigt, den im Handelsregister eingetragenen Geschäftsführer Bojan Jankovic, geb. 16.07.1977 wegen fehlender Eignung nach § 395 FamFG zu löschen. Die Frist zur Erhebung eines Widerspruchs ist auf drei Monate festgesetzt."
    },
    {
      "date": "2025-06-17",
      "id": "112381",
      "original_text": "Löschungsankündigung\nBayern Amtsgericht Nürnberg HRB 26939\nValueVest GmbH – Nürnberg",
      "type": "Löschungsankündigung",
      "state": "Bayern",
      "amtsgericht": "Amtsgericht Nürnberg",
      "registernummer": "HRB 26939",
      "registerart": "HRB",
      "company_name": "ValueVest GmbH",
      "company_seat": "Nürnberg",
      "details": "17.06.2025 (Bekanntmachungsdatum)\n\nBayern Amtsgericht Nürnberg HRB 26939\nLöschungsankündigung\n\nValueVest GmbH\nGesellschaft mit beschränkter Haftung\nNürnberg\n\nDas Registergericht beabsichtigt, die im Handelsregister eingetragene Gesellschaft wegen Vermögenslosigkeit von Amts wegen nach § 394 FamFG zu löschen. Die Frist zur Erhebung eines Widerspruchs ist auf einen Monat festgesetzt."
    },
    {
      "date": "2025-06-17",
      "id": "112382",
      "original_text": "Registerbekanntmachung nach dem Umwandlungsgesetz\nBayern Amtsgericht Fürth GsR 332\nJunkenitz & Gerayeli eGbR – Zirndorf",
      "type": "Registerbekanntmachung nach dem Umwandlungsgesetz",
      "state": "Bayern",
      "amtsgericht": "Amtsgericht Fürth",
      "registernummer": "GsR 332",
      "registerart": "GsR",
      "company_name": "Junkenitz & Gerayeli eGbR",
      "company_seat": "Zirndorf",
      "details": "17.06.2025 (Bekanntmachungsdatum)\n\nBayern Amtsgericht Fürth GsR 332\nRegisterbekanntmachung nach dem Umwandlungsgesetz 16.06.2025 (Eintragungsdatum)\n\nJunkenitz & Gerayeli eGbR\nGesellschaft bürgerlichen Rechts\nZirndorf\n\nDen Gläubigern des formwechselnden Rechtsträgers ist, wenn sie binnen sechs Monaten nach dem Tag, an dem die Eintragung des Formwechsels nach § 201 UmwG als bekannt gemacht gilt, ihren Anspruch nach Grund und Höhe in Textform anmelden, Sicherheit zu leisten, soweit sie nicht Befriedigung verlangen können. Dieses Recht steht den Gläubigern jedoch nur zu, wenn sie glaubhaft machen, dass durch den Formwechsel die Erfüllung ihrer Forderung gefährdet wird."
    },
    {
      "date": "2025-06-17",
      "id": "112383",
      "original_text": "Registerbekanntmachung nach dem Umwandlungsgesetz\nBayern Amtsgericht München HRB 299489\nVEDRA AST Pensions GmbH – München",
      "type": "Registerbekanntmachung nach dem Umwandlungsgesetz",
      "state": "Bayern",
      "amtsgericht": "Amtsgericht München",
      "registernummer": "HRB 299489",
      "registerart": "HRB",
      "company_name": "VEDRA AST Pensions GmbH",
      "company_seat": "München",
      "details": "17.06.2025 (Bekanntmachungsdatum)\n\nBayern Amtsgericht München HRB 299489\nRegisterbekanntmachung nach dem Umwandlungsgesetz 16.06.2025 (Eintragungsdatum)\n\nVEDRA AST Pensions GmbH\nGesellschaft mit beschränkter Haftung\nMünchen\n\nDen Gläubigern der an der Spaltung beteiligten Rechtsträger ist, wenn sie binnen sechs Monaten nach dem Tag, an dem die Eintragung der Spaltung in das Register des Sitzes desjenigen Rechtsträgers, dessen Gläubiger sie sind, nach §§ 125, 19 Abs. 3 UmwG als bekannt gemacht gilt, ihren Anspruch nach Grund und Höhe in Textform anmelden, Sicherheit zu leisten, soweit sie nicht Befriedigung verlangen können. Dieses Recht steht den Gläubigern jedoch nur zu, wenn sie glaubhaft machen, dass durch die Spaltung die Erfüllung ihrer Forderung gefährdet wird."
    },
    {
      "date": "2025-06-17",
      "id": "112384",
      "original_text": "Löschungsankündigung\nBayern Amtsgericht Traunstein HRB 25290\nA-dam Underwear Germany GmbH – Prien a. Chiemsee",
      "type": "Löschungsankündigung",
      "state": "Bayern",
      "amtsgericht": "Amtsgericht Traunstein",
      "registernummer": "HRB 25290",
      "registerart": "HRB",
      "company_name": "A-dam Underwear Germany GmbH",
      "company_seat": "Prien a. Chiemsee",
      "details": "17.06.2025 (Bekanntmachungsdatum)\n\nBayern Amtsgericht Traunstein HRB 25290\nLöschungsankündigung\n\nA-dam Underwear Germany GmbH\nGesellschaft mit beschränkter Haftung\nPrien a. Chiemsee\n\nDas Registergericht beabsichtigt, die im Handelsregister eingetragene Gesellschaft wegen Vermögenslosigkeit von Amts wegen nach § 394 FamFG zu löschen. Die Frist zur Erhebung eines Widerspruchs ist auf einen Monat festgesetzt."
    },
    {
      "date": "2025-06-17",
      "id": "112385",
      "original_text": "Registerbekanntmachung nach dem Umwandlungsgesetz\nBayern Amtsgericht München HRB 203478\nW³ Consulting UG (haftungsbeschränkt) – München",
      "type": "Registerbekanntmachung nach dem Umwandlungsgesetz",
      "state": "Bayern",
      "amtsgericht": "Amtsgericht München",
      "registernummer": "HRB 203478",
      "registerart": "HRB",
      "company_name": "W³ Consulting UG (haftungsbeschränkt)",
      "company_seat": "München",
      "details": "17.06.2025 (Bekanntmachungsdatum)\n\nBayern Amtsgericht München HRB 203478\nRegisterbekanntmachung nach dem Umwandlungsgesetz 16.06.2025 (Eintragungsdatum)\n\nW³ Consulting UG (haftungsbeschränkt)\nGesellschaft mit beschränkter Haftung\nMünchen\n\nDen Gläubigern der an der Verschmelzung beteiligten Rechtsträger ist, wenn sie binnen sechs Monaten nach dem Tag, an dem die Eintragung der Verschmelzung in das Register des Sitzes desjenigen Rechtsträgers, dessen Gläubiger sie sind, nach § 19 Abs. 3 UmwG als bekannt gemacht gilt, ihren Anspruch nach Grund und Höhe in Textform anmelden, Sicherheit zu leisten, soweit sie nicht Befriedigung verlangen können. Dieses Recht steht den Gläubigern jedoch nur zu, wenn sie glaubhaft machen, dass durch die Verschmelzung die Erfüllung ihrer Forderung gefährdet wird."
    },
    {
      "date": "2025-06-17",
      "id": "112386",
      "original_text": "Registerbekanntmachung nach dem Umwandlungsgesetz\nBayern Amtsgericht München HRB 263081\nflaschenpost München 3 DEX GmbH – München",
      "type": "Registerbekanntmachung nach dem Umwandlungsgesetz",
      "state": "Bayern",
      "amtsgericht": "Amtsgericht München",
      "registernummer": "HRB 263081",
      "registerart": "HRB",
      "company_name": "flaschenpost München 3 DEX GmbH",
      "company_seat": "München",
      "details": "17.06.2025 (Bekanntmachungsdatum)\n\nBayern Amtsgericht München HRB 263081\nRegisterbekanntmachung nach dem Umwandlungsgesetz 16.06.2025 (Eintragungsdatum)\n\nflaschenpost München 3 DEX GmbH\nGesellschaft mit beschränkter Haftung\nMünchen\n\nDen Gläubigern der an der Verschmelzung beteiligten Rechtsträger ist, wenn sie binnen sechs Monaten nach dem Tag, an dem die Eintragung der Verschmelzung in das Register des Sitzes desjenigen Rechtsträgers, dessen Gläubiger sie sind, nach § 19 Abs. 3 UmwG als bekannt gemacht gilt, ihren Anspruch nach Grund und Höhe in Textform anmelden, Sicherheit zu leisten, soweit sie nicht Befriedigung verlangen können. Dieses Recht steht den Gläubigern jedoch nur zu, wenn sie glaubhaft machen, dass durch die Verschmelzung die Erfüllung ihrer Forderung gefährdet wird."
    },
    {
      "date": "2025-06-17",
      "id": "112387",
      "original_text": "Registerbekanntmachung nach dem Umwandlungsgesetz\nBayern Amtsgericht München HRB 254053\nTierärzte IVC Evidensia GmbH – München",
      "type": "Registerbekanntmachung nach dem Umwandlungsgesetz",
      "state": "Bayern",
      "amtsgericht": "Amtsgericht München",
      "registernummer": "HRB 254053",
      "registerart": "HRB",
      "company_name": "Tierärzte IVC Evidensia GmbH",
      "company_seat": "München",
      "details": "17.06.2025 (Bekanntmachungsdatum)\n\nBayern Amtsgericht München HRB 254053\nRegisterbekanntmachung nach dem Umwandlungsgesetz 16.06.2025 (Eintragungsdatum)\n\nTierärzte IVC Evidensia GmbH\nGesellschaft mit beschränkter Haftung\nMünchen\n\nDen Gläubigern der an der Verschmelzung beteiligten Rechtsträger ist, wenn sie binnen sechs Monaten nach dem Tag, an dem die Eintragung der Verschmelzung in das Register des Sitzes desjenigen Rechtsträgers, dessen Gläubiger sie sind, nach § 19 Abs. 3 UmwG als bekannt gemacht gilt, ihren Anspruch nach Grund und Höhe in Textform anmelden, Sicherheit zu leisten, soweit sie nicht Befriedigung verlangen können. Dieses Recht steht den Gläubigern jedoch nur zu, wenn sie glaubhaft machen, dass durch die Verschmelzung die Erfüllung ihrer Forderung gefährdet wird."
    },
    {
      "date": "2025-06-17",
      "id": "112388",
      "original_text": "Registerbekanntmachung nach dem Umwandlungsgesetz\nBayern Amtsgericht Nürnberg HRB 43935\nProjekt Invest Bavaria GmbH – Nürnberg",
      "type": "Registerbekanntmachung nach dem Umwandlungsgesetz",
      "state": "Bayern",
      "amtsgericht": "Amtsgericht Nürnberg",
      "registernummer": "HRB 43935",
      "registerart": "HRB",
      "company_name": "Projekt Invest Bavaria GmbH",
      "company_seat": "Nürnberg",
      "details": "17.06.2025 (Bekanntmachungsdatum)\n\nBayern Amtsgericht Nürnberg HRB 43935\nRegisterbekanntmachung nach dem Umwandlungsgesetz 16.06.2025 (Eintragungsdatum)\n\nProjekt Invest Bavaria GmbH\nGesellschaft mit beschränkter Haftung\nNürnberg\n\nDen Gläubigern des formwechselnden Rechtsträgers ist, wenn sie binnen sechs Monaten nach dem Tag, an dem die Eintragung des Formwechsels nach § 201 UmwG als bekannt gemacht gilt, ihren Anspruch nach Grund und Höhe in Textform anmelden, Sicherheit zu leisten, soweit sie nicht Befriedigung verlangen können. Dieses Recht steht den Gläubigern jedoch nur zu, wenn sie glaubhaft machen, dass durch den Formwechsel die Erfüllung ihrer Forderung gefährdet wird."
    },
    {
      "date": "2025-06-17",
      "id": "112389",
      "original_text": "Registerbekanntmachung nach dem Umwandlungsgesetz\nBayern Amtsgericht Kempten (Allgäu) HRA 10839\nAmCom Handels e.K. – Kempten (Allgäu)",
      "type": "Registerbekanntmachung nach dem Umwandlungsgesetz",
      "state": "Bayern",
      "amtsgericht": "Amtsgericht Kempten (Allgäu)",
      "registernummer": "HRA 10839",
      "registerart": "HRA",
      "company_name": "AmCom Handels e.K.",
      "company_seat": "Kempten (Allgäu)",
      "details": "17.06.2025 (Bekanntmachungsdatum)\n\nBayern Amtsgericht Kempten (Allgäu) HRA 10839\nRegisterbekanntmachung nach dem Umwandlungsgesetz 14.06.2025 (Eintragungsdatum)\n\nAmCom Handels e.K.\nEinzelkaufmann / Einzelkauffrau\nKempten (Allgäu)\n\nDen Gläubigern der an der Verschmelzung beteiligten Rechtsträger ist, wenn sie binnen sechs Monaten nach dem Tag, an dem die Eintragung der Verschmelzung in das Register des Sitzes desjenigen Rechtsträgers, dessen Gläubiger sie sind, nach § 19 Abs. 3 UmwG als bekannt gemacht gilt, ihren Anspruch nach Grund und Höhe in Textform anmelden, Sicherheit zu leisten, soweit sie nicht Befriedigung verlangen können. Dieses Recht steht den Gläubigern jedoch nur zu, wenn sie glaubhaft machen, dass durch die Verschmelzung die Erfüllung ihrer Forderung gefährdet wird."
    },
    {
      "date": "2025-06-17",
      "id": "112390",
      "original_text": "Registerbekanntmachung nach dem Umwandlungsgesetz\nBayern Amtsgericht Fürth HRB 21862\nJ & G Performance GmbH – Zirndorf",
      "type": "Registerbekanntmachung nach dem Umwandlungsgesetz",
      "state": "Bayern",
      "amtsgericht": "Amtsgericht Fürth",
      "registernummer": "HRB 21862",
      "registerart": "HRB",
      "company_name": "J & G Performance GmbH",
      "company_seat": "Zirndorf",
      "details": "17.06.2025 (Bekanntmachungsdatum)\n\nBayern Amtsgericht Fürth HRB 21862\nRegisterbekanntmachung nach dem Umwandlungsgesetz 16.06.2025 (Eintragungsdatum)\n\nJ & G Performance GmbH\nGesellschaft mit beschränkter Haftung\nZirndorf\n\nDen Gläubigern des formwechselnden Rechtsträgers ist, wenn sie binnen sechs Monaten nach dem Tag, an dem die Eintragung des Formwechsels nach § 201 UmwG als bekannt gemacht gilt, ihren Anspruch nach Grund und Höhe in Textform anmelden, Sicherheit zu leisten, soweit sie nicht Befriedigung verlangen können. Dieses Recht steht den Gläubigern jedoch nur zu, wenn sie glaubhaft machen, dass durch den Formwechsel die Erfüllung ihrer Forderung gefährdet wird."
    },
    {
      "date": "2025-06-17",
      "id": "112391",
      "original_text": "Löschungsankündigung\nBerlin Amtsgericht Berlin (Charlottenburg) HRB 157252\nGood Luck 777 GmbH – Berlin",
      "type": "Löschungsankündigung",
      "state": "Berlin",
      "amtsgericht": "Amtsgericht Berlin (Charlottenburg)",
      "registernummer": "HRB 157252",
      "registerart": "HRB",
      "company_name": "Good Luck 777 GmbH",
      "company_seat": "Berlin",
      "details": "17.06.2025 (Bekanntmachungsdatum)\n\nBerlin Amtsgericht Berlin (Charlottenburg) HRB 157252\nLöschungsankündigung\n\nGood Luck 777 GmbH\nGesellschaft mit beschränkter Haftung\nBerlin\n\nBei der nachstehenden Gesellschaft wird das Amtslöschungsverfahren gemäß § 394 FamFG eingeleitet. Widerspruchsfrist 6 Wochen"
    },
    {
      "date": "2025-06-17",
      "id": "112392",
      "original_text": "Einreichung neuer Dokumente\nBaden-Württemberg Amtsgericht Ulm HRB 4711\nSWU Energie GmbH – Ulm",
      "type": "Einreichung neuer Dokumente",
      "state": "Baden-Württemberg",
      "amtsgericht": "Amtsgericht Ulm",
      "registernummer": "HRB 4711",
      "registerart": "HRB",
      "company_name": "SWU Energie GmbH",
      "company_seat": "Ulm",
      "details": "17.06.2025 (Bekanntmachungsdatum)\n\nBaden-Württemberg Amtsgericht Ulm HRB 4711\nEinreichung neuer Dokumente\n\nSWU Energie GmbH\nGesellschaft mit beschränkter Haftung\nUlm\n\nDie Gesellschaft hat am 13.06.2025 die Liste über die Zusammensetzung des Aufsichtsrats zum Handelsregister eingereicht."
    },
    {
      "date": "2025-06-17",
      "id": "112393",
      "original_text": "Löschungsankündigung\nSaarland Amtsgericht Saarbrücken HRB 101558\nFlammings- und Flammbräu UG (haftungsbeschränkt) – Saarbrücken",
      "type": "Löschungsankündigung",
      "state": "Saarland",
      "amtsgericht": "Amtsgericht Saarbrücken",
      "registernummer": "HRB 101558",
      "registerart": "HRB",
      "company_name": "Flammings- und Flammbräu UG (haftungsbeschränkt)",
      "company_seat": "Saarbrücken",
      "details": "17.06.2025 (Bekanntmachungsdatum)\n\nSaarland Amtsgericht Saarbrücken HRB 101558\nLöschungsankündigung\n\nFlammings- und Flammbräu UG (haftungsbeschränkt)\nGesellschaft mit beschränkter Haftung\nSaarbrücken\n\nEs ist beabsichtigt, die Gesellschaft von Amts wegen gemäß § 394 FamFG wegen Vermögenslosigkeit zu löschen. Gegen die Löschung von Amts wegen ist das Rechtsmittel des Widerspruchs statthaft. Der Widerspruch ist binnen einer Frist von 2 Monaten beginnend mit dem Tag dieser Veröffentlichung durch Einreichen eines Widerspruchsschreibens -schriftlich oder zur Niederschrift der Geschäftsstelle- beim Amtsgericht Saarbrücken, -zentrales Handelsregister-, Mainzerstr.178, 66121 Saarbrücken einzulegen. Der Widerspruch muss die Bezeichnung der angefochtenen Löschungsankündigung enthalten sowie die Erklärung, dass Widerspruch eingelegt wird. Er ist vom Widerspruchsführer oder seinem Bevollmächtigten zu unterzeichnen."
    },
    {
      "date": "2025-06-17",
      "id": "112394",
      "original_text": "Löschungsankündigung\nBaden-Württemberg Amtsgericht Mannheim HRB 725999\nPGS International GmbH – Mannheim",
      "type": "Löschungsankündigung",
      "state": "Baden-Württemberg",
      "amtsgericht": "Amtsgericht Mannheim",
      "registernummer": "HRB 725999",
      "registerart": "HRB",
      "company_name": "PGS International GmbH",
      "company_seat": "Mannheim",
      "details": "17.06.2025 (Bekanntmachungsdatum)\n\nBaden-Württemberg Amtsgericht Mannheim HRB 725999\nLöschungsankündigung\n\nPGS International GmbH\nGesellschaft mit beschränkter Haftung\nMannheim\n\nDas Gericht beabsichtigt, die Gesellschaft wegen Vermögenslosigkeit im Handelsregister von Amts wegen nach § 394 FamFG zu löschen. Die Frist zur Geltendmachung eines Widerspruchs gegen die beabsichtigte Löschung ist auf einen Monat ab Veröffentlichung bestimmt."
    },
    {
      "date": "2025-06-17",
      "id": "112395",
      "original_text": "Einreichung neuer Dokumente\nBaden-Württemberg Amtsgericht Freiburg HRB 601924\nNachsorgeklinik Tannheim gemeinnützige GmbH – Villingen-Schwenningen",
      "type": "Einreichung neuer Dokumente",
      "state": "Baden-Württemberg",
      "amtsgericht": "Amtsgericht Freiburg",
      "registernummer": "HRB 601924",
      "registerart": "HRB",
      "company_name": "Nachsorgeklinik Tannheim gemeinnützige GmbH",
      "company_seat": "Villingen-Schwenningen",
      "details": "17.06.2025 (Bekanntmachungsdatum)\n\nBaden-Württemberg Amtsgericht Freiburg HRB 601924\nEinreichung neuer Dokumente\n\nNachsorgeklinik Tannheim gemeinnützige GmbH\nGesellschaft mit beschränkter Haftung\nVillingen-Schwenningen\n\nDie Gesellschaft hat am 14.06.2025 die Liste über die Zusammensetzung des Aufsichtsrats zum Handelsregister eingereicht."
    },
    {
      "date": "2025-06-17",
      "id": "112396",
      "original_text": "Registerbekanntmachung nach dem Umwandlungsgesetz\nBaden-Württemberg Amtsgericht Stuttgart HRB 300428\nBSS Brand Communication Stuttgart GmbH – Bietigheim-Bissingen",
      "type": "Registerbekanntmachung nach dem Umwandlungsgesetz",
      "state": "Baden-Württemberg",
      "amtsgericht": "Amtsgericht Stuttgart",
      "registernummer": "HRB 300428",
      "registerart": "HRB",
      "company_name": "BSS Brand Communication Stuttgart GmbH",
      "company_seat": "Bietigheim-Bissingen",
      "details": "17.06.2025 (Bekanntmachungsdatum)\n\nBaden-Württemberg Amtsgericht Stuttgart HRB 300428\nRegisterbekanntmachung nach dem Umwandlungsgesetz 17.06.2025 (Eintragungsdatum)\n\nBSS Brand Communication Stuttgart GmbH\nGesellschaft mit beschränkter Haftung\nBietigheim-Bissingen\n\nDen Gläubigern der an der Abspaltung beteiligten Rechtsträger ist, wenn sie binnen sechs Monaten nach dem Tag, an dem die Eintragung der Abspaltung in das Register des Sitzes desjenigen Rechtsträgers, dessen Gläubiger sie sind, nach § 19 Abs. 3 UmwG als bekanntgemacht gilt, ihren Anspruch nach Grund und Höhe schriftlich anmelden, Sicherheit zu leisten, soweit sie nicht Befriedigung verlangen können. Dieses Recht steht den Gläubigern jedoch nur zu, wenn sie glaubhaft machen, dass durch die Abspaltung die Erfüllung ihrer Forderung gefährdet wird."
    },
    {
      "date": "2025-06-17",
      "id": "112397",
      "original_text": "Registerbekanntmachung nach dem Umwandlungsgesetz\nSachsen-Anhalt Amtsgericht Stendal HRA 8218\nJustin Zweidorf Green Guard e.K. – Gerbstedt",
      "type": "Registerbekanntmachung nach dem Umwandlungsgesetz",
      "state": "Sachsen-Anhalt",
      "amtsgericht": "Amtsgericht Stendal",
      "registernummer": "HRA 8218",
      "registerart": "HRA",
      "company_name": "Justin Zweidorf Green Guard e.K.",
      "company_seat": "Gerbstedt",
      "details": "17.06.2025 (Bekanntmachungsdatum)\n\nSachsen-Anhalt Amtsgericht Stendal HRA 8218\nRegisterbekanntmachung nach dem Umwandlungsgesetz 17.06.2025 (Eintragungsdatum)\n\nJustin Zweidorf Green Guard e.K.\nEinzelkaufmann / Einzelkauffrau\nGerbstedt\n\nNicht eingetragen:\nDen Gläubigern der an der Ausgliederung beteiligten Rechtsträger, ist wenn sie binnen sechs Monaten nach dem Tag, an dem die Eintragung der Ausgliederung nach §§125, 19 Abs. 3 UmwG als bekanntgemacht gilt, ihren Anspruch nach Grund und Höhe schriftlich anmelden, Sicherheit zu leisten, soweit sie nicht Befriedigung verlangen können. Diese Recht steht ihnen jedoch nur zu, wenn sie glaubhaft machen, dass durch die Ausgliederung die Erfüllung ihrer Forderung gefährdet wird."
    },
    {
      "date": "2025-06-17",
      "id": "112398",
      "original_text": "Registerbekanntmachung nach dem Umwandlungsgesetz\nSachsen-Anhalt Amtsgericht Stendal HRB 35595\nGreen Guard GmbH – Gerbstedt",
      "type": "Registerbekanntmachung nach dem Umwandlungsgesetz",
      "state": "Sachsen-Anhalt",
      "amtsgericht": "Amtsgericht Stendal",
      "registernummer": "HRB 35595",
      "registerart": "HRB",
      "company_name": "Green Guard GmbH",
      "company_seat": "Gerbstedt",
      "details": "17.06.2025 (Bekanntmachungsdatum)\n\nSachsen-Anhalt Amtsgericht Stendal HRB 35595\nRegisterbekanntmachung nach dem Umwandlungsgesetz 17.06.2025 (Eintragungsdatum)\n\nGreen Guard GmbH\nGesellschaft mit beschränkter Haftung\nGerbstedt\n\nNicht eingetragen:\nDen Gläubigern der an der Ausgliederung beteiligten Rechtsträger, ist wenn sie binnen sechs Monaten nach dem Tag, an dem die Eintragung der Ausgliederung nach §§125, 19 Abs. 3 UmwG als bekanntgemacht gilt, ihren Anspruch nach Grund und Höhe schriftlich anmelden, Sicherheit zu leisten, soweit sie nicht Befriedigung verlangen können. Diese Recht steht ihnen jedoch nur zu, wenn sie glaubhaft machen, dass durch die Ausgliederung die Erfüllung ihrer Forderung gefährdet wird."
    },
    {
      "date": "2025-06-17",
      "id": "112399",
      "original_text": "Registerbekanntmachung nach dem Umwandlungsgesetz\nBaden-Württemberg Amtsgericht Stuttgart HRB 203173\nGeiger Druck GmbH – Korntal-Münchingen",
      "type": "Registerbekanntmachung nach dem Umwandlungsgesetz",
      "state": "Baden-Württemberg",
      "amtsgericht": "Amtsgericht Stuttgart",
      "registernummer": "HRB 203173",
      "registerart": "HRB",
      "company_name": "Geiger Druck GmbH",
      "company_seat": "Korntal-Münchingen",
      "details": "17.06.2025 (Bekanntmachungsdatum)\n\nBaden-Württemberg Amtsgericht Stuttgart HRB 203173\nRegisterbekanntmachung nach dem Umwandlungsgesetz 17.06.2025 (Eintragungsdatum)\n\nGeiger Druck GmbH\nGesellschaft mit beschränkter Haftung\nKorntal-Münchingen\n\nDen Gläubigern der an der Verschmelzung beteiligten Rechtsträger ist, wenn sie binnen sechs Monaten nach dem Tag, an dem die Eintragung der Verschmelzung in das Register des Sitzes desjenigen Rechtsträgers, dessen Gläubiger sie sind, nach § 19 Abs. 3 UmwG als bekanntgemacht gilt, ihren Anspruch nach Grund und Höhe schriftlich anmelden, Sicherheit zu leisten, soweit sie nicht Befriedigung verlangen können. Dieses Recht steht den Gläubigern jedoch nur zu, wenn sie glaubhaft machen, dass durch die Verschmelzung die Erfüllung ihrer Forderung gefährdet wird."
    },
    {
      "date": "2025-06-17",
      "id": "112400",
      "original_text": "Registerbekanntmachung nach dem Umwandlungsgesetz\nSchleswig-Holstein Amtsgericht Flensburg HRA 805 HU\nUtlande-Appartements Inh. Myrna Bergfeld e. K. – Sankt Peter-Ording",
      "type": "Registerbekanntmachung nach dem Umwandlungsgesetz",
      "state": "Schleswig-Holstein",
      "amtsgericht": "Amtsgericht Flensburg",
      "registernummer": "HRA 805 HU",
      "registerart": "HRA",
      "company_name": "Utlande-Appartements Inh. Myrna Bergfeld e. K.",
      "company_seat": "Sankt Peter-Ording",
      "details": "17.06.2025 (Bekanntmachungsdatum)\n\nSchleswig-Holstein Amtsgericht Flensburg HRA 805 HU\nRegisterbekanntmachung nach dem Umwandlungsgesetz 16.06.2025 (Eintragungsdatum)\n\nUtlande-Appartements Inh. Myrna Bergfeld e. K.\nEinzelkaufmann / Einzelkauffrau\nSankt Peter-Ording\n\nZu Eintragungsnummer 4 vom 16.06.2025 wird als nicht eingetragen veröffentlicht:\nDen Gläubigern der an der Spaltung beteiligten Rechtsträger ist, wenn sie binnen sechs Monaten nach dem Tag, an dem die Eintragung der Spaltung in das Register des Sitzes desjenigen Rechtsträgers, dessen Gläubiger sie sind, als bekannt gemacht gilt, ihren Anspruch nach Grund und Höhe schriftlich anmelden, Sicherheit zu leisten, soweit sie nicht Befriedigung verlangen können. Dieses Recht steht den Gläubigern jedoch nur zu, wenn sie glaubhaft machen, dass durch die Spaltung die Erfüllung ihrer Forderung gefährdet wird. Das Recht, Sicherheitsleistung zu verlangen, steht Gläubigern nicht zu, die im Falle der Insolvenz ein Recht auf vorzugsweise Befriedigung aus einer Deckungsmasse haben, die nach gesetzlicher Vorschrift zu ihrem Schutz errichtet und staatlich überwacht ist."
    },
    {
      "date": "2025-06-17",
      "id": "112401",
      "original_text": "Löschungsankündigung\nBerlin Amtsgericht Berlin (Charlottenburg) HRB 150624\nVeracruz Gastronomie GmbH – Berlin",
      "type": "Löschungsankündigung",
      "state": "Berlin",
      "amtsgericht": "Amtsgericht Berlin (Charlottenburg)",
      "registernummer": "HRB 150624",
      "registerart": "HRB",
      "company_name": "Veracruz Gastronomie GmbH",
      "company_seat": "Berlin",
      "details": "17.06.2025 (Bekanntmachungsdatum)\n\nBerlin Amtsgericht Berlin (Charlottenburg) HRB 150624\nLöschungsankündigung\n\nVeracruz Gastronomie GmbH\nGesellschaft mit beschränkter Haftung\nBerlin\n\nBei der nachstehenden Gesellschaft wird das Amtslöschungsverfahren gemäß § 394 FamFG eingeleitet. Widerspruchsfrist 6 Wochen"
    },
    {
      "date": "2025-06-17",
      "id": "112402",
      "original_text": "Löschungsankündigung\nBaden-Württemberg Amtsgericht Mannheim HRB 732818\nDSA Naturprodukte Handelsgesellschaft mbH – Mannheim",
      "type": "Löschungsankündigung",
      "state": "Baden-Württemberg",
      "amtsgericht": "Amtsgericht Mannheim",
      "registernummer": "HRB 732818",
      "registerart": "HRB",
      "company_name": "DSA Naturprodukte Handelsgesellschaft mbH",
      "company_seat": "Mannheim",
      "details": "17.06.2025 (Bekanntmachungsdatum)\n\nBaden-Württemberg Amtsgericht Mannheim HRB 732818\nLöschungsankündigung\n\nDSA Naturprodukte Handelsgesellschaft mbH\nGesellschaft mit beschränkter Haftung\nMannheim\n\nDas Gericht beabsichtigt, die Gesellschaft wegen Vermögenslosigkeit im Handelsregister von Amts wegen nach § 394 FamFG zu löschen. Die Frist zur Geltendmachung eines Widerspruchs gegen die beabsichtigte Löschung ist auf einen Monat ab Veröffentlichung bestimmt."
    },
    {
      "date": "2025-06-17",
      "id": "112403",
      "original_text": "Registerbekanntmachung nach dem Umwandlungsgesetz\nBaden-Württemberg Amtsgericht Stuttgart HRB 776435\nPrio Immobilien GmbH – Tuttlingen",
      "type": "Registerbekanntmachung nach dem Umwandlungsgesetz",
      "state": "Baden-Württemberg",
      "amtsgericht": "Amtsgericht Stuttgart",
      "registernummer": "HRB 776435",
      "registerart": "HRB",
      "company_name": "Prio Immobilien GmbH",
      "company_seat": "Tuttlingen",
      "details": "17.06.2025 (Bekanntmachungsdatum)\n\nBaden-Württemberg Amtsgericht Stuttgart HRB 776435\nRegisterbekanntmachung nach dem Umwandlungsgesetz 17.06.2025 (Eintragungsdatum)\n\nPrio Immobilien GmbH\nGesellschaft mit beschränkter Haftung\nTuttlingen\n\nDen Gläubigern der an der Ausgliederung beteiligten Rechtsträger ist, wenn sie binnen sechs Monaten nach dem Tag, an dem die Eintragung der Ausgliederung in das Register des Sitzes desjenigen Rechtsträgers, dessen Gläubiger sie sind, nach § 19 Abs. 3 UmwG als bekanntgemacht gilt, ihren Anspruch nach Grund und Höhe schriftlich anmelden, Sicherheit zu leisten, soweit sie nicht Befriedigung verlangen können. Dieses Recht steht den Gläubigern jedoch nur zu, wenn sie glaubhaft machen, dass durch die Ausgliederung die Erfüllung ihrer Forderung gefährdet wird."
    },
    {
      "date": "2025-06-17",
      "id": "112404",
      "original_text": "Einreichung neuer Dokumente\nBerlin Amtsgericht Berlin (Charlottenburg) HRB 165539\nInvesdor INV AG – Berlin",
      "type": "Einreichung neuer Dokumente",
      "state": "Berlin",
      "amtsgericht": "Amtsgericht Berlin (Charlottenburg)",
      "registernummer": "HRB 165539",
      "registerart": "HRB",
      "company_name": "Invesdor INV AG",
      "company_seat": "Berlin",
      "details": "17.06.2025 (Bekanntmachungsdatum)\n\nBerlin Amtsgericht Berlin (Charlottenburg) HRB 165539\nEinreichung neuer Dokumente\n\nInvesdor INV AG\nAktiengesellschaft\nBerlin\n\nAls nicht eingetragen wird veröffentlicht: Es wurde eine neue Liste der Aufsichtsratsmitglieder eingereicht (§ 106 AktG)."
    },
    {
      "date": "2025-06-17",
      "id": "112405",
      "original_text": "Registerbekanntmachung nach dem Umwandlungsgesetz\nBaden-Württemberg Amtsgericht Freiburg VR 630261\nMusikverein \"Alpenblick\" Willaringen e.V. – Rickenbach",
      "type": "Registerbekanntmachung nach dem Umwandlungsgesetz",
      "state": "Baden-Württemberg",
      "amtsgericht": "Amtsgericht Freiburg",
      "registernummer": "VR 630261",
      "registerart": "VR",
      "company_name": "Musikverein \"Alpenblick\" Willaringen e.V.",
      "company_seat": "Rickenbach",
      "details": "17.06.2025 (Bekanntmachungsdatum)\n\nBaden-Württemberg Amtsgericht Freiburg VR 630261\nRegisterbekanntmachung nach dem Umwandlungsgesetz 17.06.2025 (Eintragungsdatum)\n\nMusikverein \"Alpenblick\" Willaringen e.V.\neingetragener Verein\nRickenbach\n\nAls nicht eingetragen wird bekanntgemacht:\nDen Gläubigern der an der Verschmelzung beteiligten Rechtsträger ist, wenn sie binnen sechs Monaten nach dem Tag, an dem die Eintragung der Verschmelzung in das Register des Sitzes desjenigen Rechtsträgers, dessen Gläubiger sie sind, nach § 19 Abs. 3 UmwG als bekanntgemacht gilt, ihren Anspruch nach Grund und Höhe schriftlich anmelden, Sicherheit zu leisten, soweit sie nicht Befriedigung verlangen können. Dieses Recht steht den Gläubigern jedoch nur zu, wenn sie glaubhaft machen, dass durch die Verschmelzung die Erfüllung ihrer Forderung gefährdet wird."
    },
    {
      "date": "2025-06-17",
      "id": "112406",
      "original_text": "Sonstige Registerbekanntmachung\nBaden-Württemberg Amtsgericht Ulm HRB 748646\nTOX SE – Weingarten",
      "type": "Sonstige Registerbekanntmachung",
      "state": "Baden-Württemberg",
      "amtsgericht": "Amtsgericht Ulm",
      "registernummer": "HRB 748646",
      "registerart": "HRB",
      "company_name": "TOX SE",
      "company_seat": "Weingarten",
      "details": "17.06.2025 (Bekanntmachungsdatum)\n\nBaden-Württemberg Amtsgericht Ulm HRB 748646\nSonstige Registerbekanntmachung\n\nTOX SE\nEuropäische Aktiengesellschaft (SE)\nWeingarten\n\nDie Gesellschaft hat am 06.06.2025 die Liste über die Zusammensetzung des Verwaltungsrats zum Handelsregister eingereicht."
    },
    {
      "date": "2025-06-17",
      "id": "112407",
      "original_text": "Registerbekanntmachung nach dem Umwandlungsgesetz\nBaden-Württemberg Amtsgericht Mannheim HRB 733323\nTTM Verwaltungs UG (haftungsbeschränkt) – Edingen-Neckarhausen",
      "type": "Registerbekanntmachung nach dem Umwandlungsgesetz",
      "state": "Baden-Württemberg",
      "amtsgericht": "Amtsgericht Mannheim",
      "registernummer": "HRB 733323",
      "registerart": "HRB",
      "company_name": "TTM Verwaltungs UG (haftungsbeschränkt)",
      "company_seat": "Edingen-Neckarhausen",
      "details": "17.06.2025 (Bekanntmachungsdatum)\n\nBaden-Württemberg Amtsgericht Mannheim HRB 733323\nRegisterbekanntmachung nach dem Umwandlungsgesetz 17.06.2025 (Eintragungsdatum)\n\nTTM Verwaltungs UG (haftungsbeschränkt)\nGesellschaft mit beschränkter Haftung\nEdingen-Neckarhausen\n\nDen Gläubigern der an der Verschmelzung beteiligten Rechtsträger ist, wenn sie binnen sechs Monaten nach dem Tag, an dem die Eintragung der Verschmelzung in das Register des Sitzes desjenigen Rechtsträgers, dessen Gläubiger sie sind, nach § 19 Abs. 3 UmwG als bekanntgemacht gilt, ihren Anspruch nach Grund und Höhe schriftlich anmelden, Sicherheit zu leisten, soweit sie nicht Befriedigung verlangen können. Dieses Recht steht den Gläubigern jedoch nur zu, wenn sie glaubhaft machen, dass durch die Verschmelzung die Erfüllung ihrer Forderung gefährdet wird."
    },
    {
      "date": "2025-06-17",
      "id": "112410",
      "original_text": "Registerbekanntmachung nach dem Umwandlungsgesetz\nBaden-Württemberg Amtsgericht Mannheim HRA 712632\nSteffen Haug Schreinerei e.K. – Mannheim",
      "type": "Registerbekanntmachung nach dem Umwandlungsgesetz",
      "state": "Baden-Württemberg",
      "amtsgericht": "Amtsgericht Mannheim",
      "registernummer": "HRA 712632",
      "registerart": "HRA",
      "company_name": "Steffen Haug Schreinerei e.K.",
      "company_seat": "Mannheim",
      "details": "17.06.2025 (Bekanntmachungsdatum)\n\nBaden-Württemberg Amtsgericht Mannheim HRA 712632\nRegisterbekanntmachung nach dem Umwandlungsgesetz 17.06.2025 (Eintragungsdatum)\n\nSteffen Haug Schreinerei e.K.\nEinzelkaufmann / Einzelkauffrau\nMannheim\n\nDen Gläubigern der an der Ausgliederung beteiligten Rechtsträger ist, wenn sie binnen sechs Monaten nach dem Tag, an dem die Eintragung der Ausgliederung in das Register des Sitzes desjenigen Rechtsträgers, dessen Gläubiger sie sind, nach § 19 Abs. 3 UmwG als bekanntgemacht gilt, ihren Anspruch nach Grund und Höhe schriftlich anmelden, Sicherheit zu leisten, soweit sie nicht Befriedigung verlangen können. Dieses Recht steht den Gläubigern jedoch nur zu, wenn sie glaubhaft machen, dass durch die Ausgliederung die Erfüllung ihrer Forderung gefährdet wird."
    },
    {
      "date": "2025-06-17",
      "id": "112412",
      "original_text": "Registerbekanntmachung nach dem Umwandlungsgesetz\nBaden-Württemberg Amtsgericht Mannheim HRB 736645\nTTM Immobilien GmbH – Edingen-Neckarhausen",
      "type": "Registerbekanntmachung nach dem Umwandlungsgesetz",
      "state": "Baden-Württemberg",
      "amtsgericht": "Amtsgericht Mannheim",
      "registernummer": "HRB 736645",
      "registerart": "HRB",
      "company_name": "TTM Immobilien GmbH",
      "company_seat": "Edingen-Neckarhausen",
      "details": "17.06.2025 (Bekanntmachungsdatum)\n\nBaden-Württemberg Amtsgericht Mannheim HRB 736645\nRegisterbekanntmachung nach dem Umwandlungsgesetz 17.06.2025 (Eintragungsdatum)\n\nTTM Immobilien GmbH\nGesellschaft mit beschränkter Haftung\nEdingen-Neckarhausen\n\nAls nicht eingetragen wird bekanntgemacht:\nDen Gläubigern der an der Verschmelzung beteiligten Rechtsträger ist, wenn sie binnen sechs Monaten nach dem Tag, an dem die Eintragung der Verschmelzung in das Register des Sitzes desjenigen Rechtsträgers, dessen Gläubiger sie sind, nach § 19 Abs. 3 UmwG als bekanntgemacht gilt, ihren Anspruch nach Grund und Höhe schriftlich anmelden, Sicherheit zu leisten, soweit sie nicht Befriedigung verlangen können. Dieses Recht steht den Gläubigern jedoch nur zu, wenn sie glaubhaft machen, dass durch die Verschmelzung die Erfüllung ihrer Forderung gefährdet wird."
    },
    {
      "date": "2025-06-17",
      "id": "112413",
      "original_text": "Registerbekanntmachung nach dem Umwandlungsgesetz\nBaden-Württemberg Amtsgericht Stuttgart HRB 750245\ncf Fitness Backnang GmbH – Backnang",
      "type": "Registerbekanntmachung nach dem Umwandlungsgesetz",
      "state": "Baden-Württemberg",
      "amtsgericht": "Amtsgericht Stuttgart",
      "registernummer": "HRB 750245",
      "registerart": "HRB",
      "company_name": "cf Fitness Backnang GmbH",
      "company_seat": "Backnang",
      "details": "17.06.2025 (Bekanntmachungsdatum)\n\nBaden-Württemberg Amtsgericht Stuttgart HRB 750245\nRegisterbekanntmachung nach dem Umwandlungsgesetz 17.06.2025 (Eintragungsdatum)\n\ncf Fitness Backnang GmbH\nGesellschaft mit beschränkter Haftung\nBacknang\n\nDen Gläubigern der an der Verschmelzung beteiligten Rechtsträger ist, wenn sie binnen sechs Monaten nach dem Tag, an dem die Eintragung der Verschmelzung in das Register des Sitzes desjenigen Rechtsträgers, dessen Gläubiger sie sind, nach § 19 Abs. 3 UmwG als bekanntgemacht gilt, ihren Anspruch nach Grund und Höhe schriftlich anmelden, Sicherheit zu leisten, soweit sie nicht Befriedigung verlangen können. Dieses Recht steht den Gläubigern jedoch nur zu, wenn sie glaubhaft machen, dass durch die Verschmelzung die Erfüllung ihrer Forderung gefährdet wird."
    },
    {
      "date": "2025-06-17",
      "id": "112414",
      "original_text": "Sonstige Registerbekanntmachung\nBerlin Amtsgericht Berlin (Charlottenburg) HRA 55406\nZalando Stores Experiences & Clearance Solutions GmbH & Co. KG – Berlin",
      "type": "Sonstige Registerbekanntmachung",
      "state": "Berlin",
      "amtsgericht": "Amtsgericht Berlin (Charlottenburg)",
      "registernummer": "HRA 55406",
      "registerart": "HRA",
      "company_name": "Zalando Stores Experiences & Clearance Solutions GmbH & Co. KG",
      "company_seat": "Berlin",
      "details": "17.06.2025 (Bekanntmachungsdatum)\n\nBerlin Amtsgericht Berlin (Charlottenburg) HRA 55406\nSonstige Registerbekanntmachung\n\nZalando Stores Experiences & Clearance Solutions GmbH & Co. KG\nKommanditgesellschaft\nBerlin\n\nAls nicht eingetragen wird veröffentlicht: neuer Gegenstand: Der Handel mit Waren verschiedener Art, insbesondere Bekleidung, Schuhen und Accessoires sowie im Bereich Kosmetik und Parfümerie, Management von Überbeständen und Liquidation von fehlerhaften Waren für andere Unternehmen und der Betrieb eines oder mehrerer Ladengeschäfte."
    },
    {
      "date": "2025-06-17",
      "id": "112416",
      "original_text": "Registerbekanntmachung nach dem Umwandlungsgesetz\nBaden-Württemberg Amtsgericht Mannheim HRB 743004\nJMO Holding GmbH – Mannheim",
      "type": "Registerbekanntmachung nach dem Umwandlungsgesetz",
      "state": "Baden-Württemberg",
      "amtsgericht": "Amtsgericht Mannheim",
      "registernummer": "HRB 743004",
      "registerart": "HRB",
      "company_name": "JMO Holding GmbH",
      "company_seat": "Mannheim",
      "details": "17.06.2025 (Bekanntmachungsdatum)\n\nBaden-Württemberg Amtsgericht Mannheim HRB 743004\nRegisterbekanntmachung nach dem Umwandlungsgesetz 17.06.2025 (Eintragungsdatum)\n\nJMO Holding GmbH\nGesellschaft mit beschränkter Haftung\nMannheim\n\nAls nicht eingetragen wird bekanntgemacht:\nDen Gläubigern der an der Verschmelzung beteiligten Rechtsträger ist, wenn sie binnen sechs Monaten nach dem Tag, an dem die Eintragung der Verschmelzung in das Register des Sitzes desjenigen Rechtsträgers, dessen Gläubiger sie sind, nach § 19 Abs. 3 UmwG als bekanntgemacht gilt, ihren Anspruch nach Grund und Höhe schriftlich anmelden, Sicherheit zu leisten, soweit sie nicht Befriedigung verlangen können. Dieses Recht steht den Gläubigern jedoch nur zu, wenn sie glaubhaft machen, dass durch die Verschmelzung die Erfüllung ihrer Forderung gefährdet wird."
    },
    {
      "date": "2025-06-17",
      "id": "112418",
      "original_text": "Registerbekanntmachung nach dem Umwandlungsgesetz\nBaden-Württemberg Amtsgericht Mannheim HRB 743004\nJMO Holding GmbH – Mannheim",
      "type": "Registerbekanntmachung nach dem Umwandlungsgesetz",
      "state": "Baden-Württemberg",
      "amtsgericht": "Amtsgericht Mannheim",
      "registernummer": "HRB 743004",
      "registerart": "HRB",
      "company_name": "JMO Holding GmbH",
      "company_seat": "Mannheim",
      "details": "17.06.2025 (Bekanntmachungsdatum)\n\nBaden-Württemberg Amtsgericht Mannheim HRB 743004\nRegisterbekanntmachung nach dem Umwandlungsgesetz 17.06.2025 (Eintragungsdatum)\n\nJMO Holding GmbH\nGesellschaft mit beschränkter Haftung\nMannheim\n\nAls nicht eingetragen wird bekanntgemacht:\nDen Gläubigern der an der Verschmelzung beteiligten Rechtsträger ist, wenn sie binnen sechs Monaten nach dem Tag, an dem die Eintragung der Verschmelzung in das Register des Sitzes desjenigen Rechtsträgers, dessen Gläubiger sie sind, nach § 19 Abs. 3 UmwG als bekanntgemacht gilt, ihren Anspruch nach Grund und Höhe schriftlich anmelden, Sicherheit zu leisten, soweit sie nicht Befriedigung verlangen können. Dieses Recht steht den Gläubigern jedoch nur zu, wenn sie glaubhaft machen, dass durch die Verschmelzung die Erfüllung ihrer Forderung gefährdet wird."
    },
    {
      "date": "2025-06-17",
      "id": "112419",
      "original_text": "Sonstige Registerbekanntmachung\nBaden-Württemberg Amtsgericht Ulm HRB 748646\nTOX SE – Weingarten",
      "type": "Sonstige Registerbekanntmachung",
      "state": "Baden-Württemberg",
      "amtsgericht": "Amtsgericht Ulm",
      "registernummer": "HRB 748646",
      "registerart": "HRB",
      "company_name": "TOX SE",
      "company_seat": "Weingarten",
      "details": "17.06.2025 (Bekanntmachungsdatum)\n\nBaden-Württemberg Amtsgericht Ulm HRB 748646\nSonstige Registerbekanntmachung\n\nTOX SE\nEuropäische Aktiengesellschaft (SE)\nWeingarten\n\nDie Gesellschaft hat am 06.06.2025 die Liste über die Zusammensetzung des Verwaltungsrats zum Handelsregister eingereicht."
    },
    {
      "date": "2025-06-17",
      "id": "112420",
      "original_text": "Registerbekanntmachung nach dem Umwandlungsgesetz\nBaden-Württemberg Amtsgericht Mannheim HRB 743111\nLumix Solar GmbH – Mannheim",
      "type": "Registerbekanntmachung nach dem Umwandlungsgesetz",
      "state": "Baden-Württemberg",
      "amtsgericht": "Amtsgericht Mannheim",
      "registernummer": "HRB 743111",
      "registerart": "HRB",
      "company_name": "Lumix Solar GmbH",
      "company_seat": "Mannheim",
      "details": "17.06.2025 (Bekanntmachungsdatum)\n\nBaden-Württemberg Amtsgericht Mannheim HRB 743111\nRegisterbekanntmachung nach dem Umwandlungsgesetz 17.06.2025 (Eintragungsdatum)\n\nLumix Solar GmbH\nGesellschaft mit beschränkter Haftung\nMannheim\n\nAls nicht eingetragen wird bekanntgemacht:\nDen Gläubigern der an der Verschmelzung beteiligten Rechtsträger ist, wenn sie binnen sechs Monaten nach dem Tag, an dem die Eintragung der Verschmelzung in das Register des Sitzes desjenigen Rechtsträgers, dessen Gläubiger sie sind, nach § 19 Abs. 3 UmwG als bekanntgemacht gilt, ihren Anspruch nach Grund und Höhe schriftlich anmelden, Sicherheit zu leisten, soweit sie nicht Befriedigung verlangen können. Dieses Recht steht den Gläubigern jedoch nur zu, wenn sie glaubhaft machen, dass durch die Verschmelzung die Erfüllung ihrer Forderung gefährdet wird."
    },
    {
      "date": "2025-06-17",
      "id": "112421",
      "original_text": "Registerbekanntmachung nach dem Umwandlungsgesetz\nBaden-Württemberg Amtsgericht Mannheim HRB 743111\nLumix Solar GmbH – Mannheim",
      "type": "Registerbekanntmachung nach dem Umwandlungsgesetz",
      "state": "Baden-Württemberg",
      "amtsgericht": "Amtsgericht Mannheim",
      "registernummer": "HRB 743111",
      "registerart": "HRB",
      "company_name": "Lumix Solar GmbH",
      "company_seat": "Mannheim",
      "details": "17.06.2025 (Bekanntmachungsdatum)\n\nBaden-Württemberg Amtsgericht Mannheim HRB 743111\nRegisterbekanntmachung nach dem Umwandlungsgesetz 17.06.2025 (Eintragungsdatum)\n\nLumix Solar GmbH\nGesellschaft mit beschränkter Haftung\nMannheim\n\nAls nicht eingetragen wird bekanntgemacht:\nDen Gläubigern der an der Verschmelzung beteiligten Rechtsträger ist, wenn sie binnen sechs Monaten nach dem Tag, an dem die Eintragung der Verschmelzung in das Register des Sitzes desjenigen Rechtsträgers, dessen Gläubiger sie sind, nach § 19 Abs. 3 UmwG als bekanntgemacht gilt, ihren Anspruch nach Grund und Höhe schriftlich anmelden, Sicherheit zu leisten, soweit sie nicht Befriedigung verlangen können. Dieses Recht steht den Gläubigern jedoch nur zu, wenn sie glaubhaft machen, dass durch die Verschmelzung die Erfüllung ihrer Forderung gefährdet wird."
    },
    {
      "date": "2025-06-17",
      "id": "112422",
      "original_text": "Registerbekanntmachung nach dem Umwandlungsgesetz\nBaden-Württemberg Amtsgericht Stuttgart HRB 742276\nDICK Verwaltungsgesellschaft mbH – Deizisau",
      "type": "Registerbekanntmachung nach dem Umwandlungsgesetz",
      "state": "Baden-Württemberg",
      "amtsgericht": "Amtsgericht Stuttgart",
      "registernummer": "HRB 742276",
      "registerart": "HRB",
      "company_name": "DICK Verwaltungsgesellschaft mbH",
      "company_seat": "Deizisau",
      "details": "17.06.2025 (Bekanntmachungsdatum)\n\nBaden-Württemberg Amtsgericht Stuttgart HRB 742276\nRegisterbekanntmachung nach dem Umwandlungsgesetz 17.06.2025 (Eintragungsdatum)\n\nDICK Verwaltungsgesellschaft mbH\nGesellschaft mit beschränkter Haftung\nDeizisau\n\nAls nicht eingetragen wird bekanntgemacht:\nDen Gläubigern der an der Abspaltung beteiligten Rechtsträger ist, wenn sie binnen sechs Monaten nach dem Tag, an dem die Eintragung der Abspaltung in das Register des Sitzes desjenigen Rechtsträgers, dessen Gläubiger sie sind, nach § 19 Abs. 3 UmwG als bekanntgemacht gilt, ihren Anspruch nach Grund und Höhe schriftlich anmelden, Sicherheit zu leisten, soweit sie nicht Befriedigung verlangen können. Dieses Recht steht den Gläubigern jedoch nur zu, wenn sie glaubhaft machen, dass durch die Abspaltung die Erfüllung ihrer Forderung gefährdet wird."
    },
    {
      "date": "2025-06-17",
      "id": "112423",
      "original_text": "Registerbekanntmachung nach dem Umwandlungsgesetz\nBaden-Württemberg Amtsgericht Freiburg VR 630471\nMusikverein Bergalingen e.V. – Rickenbach",
      "type": "Registerbekanntmachung nach dem Umwandlungsgesetz",
      "state": "Baden-Württemberg",
      "amtsgericht": "Amtsgericht Freiburg",
      "registernummer": "VR 630471",
      "registerart": "VR",
      "company_name": "Musikverein Bergalingen e.V.",
      "company_seat": "Rickenbach",
      "details": "17.06.2025 (Bekanntmachungsdatum)\n\nBaden-Württemberg Amtsgericht Freiburg VR 630471\nRegisterbekanntmachung nach dem Umwandlungsgesetz 17.06.2025 (Eintragungsdatum)\n\nMusikverein Bergalingen e.V.\neingetragener Verein\nRickenbach\n\nDen Gläubigern der an der Verschmelzung beteiligten Rechtsträger ist, wenn sie binnen sechs Monaten nach dem Tag, an dem die Eintragung der Verschmelzung in das Register des Sitzes desjenigen Rechtsträgers, dessen Gläubiger sie sind, nach § 19 Abs. 3 UmwG als bekanntgemacht gilt, ihren Anspruch nach Grund und Höhe schriftlich anmelden, Sicherheit zu leisten, soweit sie nicht Befriedigung verlangen können. Dieses Recht steht den Gläubigern jedoch nur zu, wenn sie glaubhaft machen, dass durch die Verschmelzung die Erfüllung ihrer Forderung gefährdet wird."
    },
    {
      "date": "2025-06-17",
      "id": "112424",
      "original_text": "Einreichung neuer Dokumente\nBaden-Württemberg Amtsgericht Freiburg HRB 410096\nROCHE PHARMA AKTIENGESELLSCHAFT – Grenzach-WyhIen",
      "type": "Einreichung neuer Dokumente",
      "state": "Baden-Württemberg",
      "amtsgericht": "Amtsgericht Freiburg",
      "registernummer": "HRB 410096",
      "registerart": "HRB",
      "company_name": "ROCHE PHARMA AKTIENGESELLSCHAFT",
      "company_seat": "Grenzach-WyhIen",
      "details": "17.06.2025 (Bekanntmachungsdatum)\n\nBaden-Württemberg Amtsgericht Freiburg HRB 410096\nEinreichung neuer Dokumente 17.06.2025 (Eintragungsdatum)\n\nROCHE PHARMA AKTIENGESELLSCHAFT\nAktiengesellschaft\nGrenzach-WyhIen\n\nAls nicht eingetragen wird bekanntgemacht:\nDie Gesellschaft hat am 10.06.2025 die Liste über die Zusammensetzung des Aufsichtsrats zum Handelsregister eingereicht."
    },
    {
      "date": "2025-06-17",
      "id": "112425",
      "original_text": "Einreichung neuer Dokumente\nBerlin Amtsgericht Berlin (Charlottenburg) HRB 195463\nSpringer Nature AG & Co. KGaA – Berlin",
      "type": "Einreichung neuer Dokumente",
      "state": "Berlin",
      "amtsgericht": "Amtsgericht Berlin (Charlottenburg)",
      "registernummer": "HRB 195463",
      "registerart": "HRB",
      "company_name": "Springer Nature AG & Co. KGaA",
      "company_seat": "Berlin",
      "details": "17.06.2025 (Bekanntmachungsdatum)\n\nBerlin Amtsgericht Berlin (Charlottenburg) HRB 195463\nEinreichung neuer Dokumente\n\nSpringer Nature AG & Co. KGaA\nKommanditgesellschaft auf Aktien\nBerlin\n\nAls nicht eingetragen wird veröffentlicht:  Es wurde eine neue Liste der Aufsichtsratsmitglieder eingereicht (§ 106 AktG)."
    },
    {
      "date": "2025-06-17",
      "id": "112426",
      "original_text": "Registerbekanntmachung nach dem Umwandlungsgesetz\nHamburg Amtsgericht Hamburg HRB 138036\nAves Rail Junior I Verwaltungs GmbH – Hamburg",
      "type": "Registerbekanntmachung nach dem Umwandlungsgesetz",
      "state": "Hamburg",
      "amtsgericht": "Amtsgericht Hamburg",
      "registernummer": "HRB 138036",
      "registerart": "HRB",
      "company_name": "Aves Rail Junior I Verwaltungs GmbH",
      "company_seat": "Hamburg",
      "details": "17.06.2025 (Bekanntmachungsdatum)\n\nHamburg Amtsgericht Hamburg HRB 138036\nRegisterbekanntmachung nach dem Umwandlungsgesetz 17.06.2025 (Eintragungsdatum)\n\nAves Rail Junior I Verwaltungs GmbH\nGesellschaft mit beschränkter Haftung\nHamburg\n\nAls nicht eingetragen wird bekannt gemacht:\nDen Gläubigern der an der Verschmelzung beteiligten Gesellschaften ist, wenn sie binnen sechs Monaten nach dem Tag, an dem die Eintragung der Verschmelzung in das Register des Sitzes desjenigen Rechtsträgers, dessen Gläubiger sie sind, nach § 19 Absatz 3 UmwG als bekannt gemacht gilt, ihren Anspruch nach Grund und Höhe schriftlich anmelden, Sicherheit zu leisten, soweit sie nicht Befriedigung verlangen können. Dieses Recht steht den Gläubigern jedoch nur zu, wenn sie glaubhaft machen, dass durch die Verschmelzung die Erfüllung ihrer Forderung gefährdet wird."
    },
    {
      "date": "2025-06-17",
      "id": "112427",
      "original_text": "Registerbekanntmachung nach dem Umwandlungsgesetz\nHamburg Amtsgericht Hamburg HRB 166525\nAmazon SZ North 1 GmbH – Hamburg",
      "type": "Registerbekanntmachung nach dem Umwandlungsgesetz",
      "state": "Hamburg",
      "amtsgericht": "Amtsgericht Hamburg",
      "registernummer": "HRB 166525",
      "registerart": "HRB",
      "company_name": "Amazon SZ North 1 GmbH",
      "company_seat": "Hamburg",
      "details": "17.06.2025 (Bekanntmachungsdatum)\n\nHamburg Amtsgericht Hamburg HRB 166525\nRegisterbekanntmachung nach dem Umwandlungsgesetz 17.06.2025 (Eintragungsdatum)\n\nAmazon SZ North 1 GmbH\nGesellschaft mit beschränkter Haftung\nHamburg\n\nAls nicht eingetragen wird bekannt gemacht:\nDen Gläubigern der an der Verschmelzung beteiligten Gesellschaften ist, wenn sie binnen sechs Monaten nach dem Tag, an dem die Eintragung der Verschmelzung in das Register des Sitzes desjenigen Rechtsträgers, dessen Gläubiger sie sind, nach § 19 Absatz 3 UmwG als bekannt gemacht gilt, ihren Anspruch nach Grund und Höhe schriftlich anmelden, Sicherheit zu leisten, soweit sie nicht Befriedigung verlangen können. Dieses Recht steht den Gläubigern jedoch nur zu, wenn sie glaubhaft machen, dass durch die Verschmelzung die Erfüllung ihrer Forderung gefährdet wird."
    },
    {
      "date": "2025-06-17",
      "id": "112428",
      "original_text": "Registerbekanntmachung nach dem Umwandlungsgesetz\nBerlin Amtsgericht Berlin (Charlottenburg) HRB 218098\nFOV GmbH – Berlin",
      "type": "Registerbekanntmachung nach dem Umwandlungsgesetz",
      "state": "Berlin",
      "amtsgericht": "Amtsgericht Berlin (Charlottenburg)",
      "registernummer": "HRB 218098",
      "registerart": "HRB",
      "company_name": "FOV GmbH",
      "company_seat": "Berlin",
      "details": "17.06.2025 (Bekanntmachungsdatum)\n\nBerlin Amtsgericht Berlin (Charlottenburg) HRB 218098\nRegisterbekanntmachung nach dem Umwandlungsgesetz 13.06.2025 (Eintragungsdatum)\n\nFOV GmbH\nGesellschaft mit beschränkter Haftung\nBerlin\n\nZu Eintragungsnummer 5 vom 13.06.2025 wird als nicht eingetragen veröffentlicht: Den Gläubigern der an der Verschmelzung beteiligten Rechtsträger ist, wenn sie binnen sechs Monaten nach dem Tag, an dem die Eintragung der Verschmelzung in das Register des Sitzes desjenigen Rechtsträgers, dessen Gläubiger sie sind, als bekannt gemacht gilt, ihren Anspruch nach Grund und Höhe schriftlich anmelden, Sicherheit zu leisten, soweit sie nicht Befriedigung verlangen können. Dieses Recht steht den Gläubigern jedoch nur zu, wenn sie glaubhaft machen, dass durch die Verschmelzung die Erfüllung ihrer Forderung gefährdet wird. Das Recht, Sicherheitsleistung zu verlangen, steht Gläubigern nicht zu, die im Falle der Insolvenz ein Recht auf vorzugsweise Befriedigung aus einer Deckungsmasse haben, die nach gesetzlicher Vorschrift zu ihrem Schutz errichtet und staatlich überwacht ist."
    },
    {
      "date": "2025-06-17",
      "id": "112429",
      "original_text": "Registerbekanntmachung nach dem Umwandlungsgesetz\nSaarland Amtsgericht Saarbrücken HRB 74367\nWerner Altpeter Gesellschaft mit beschränkter Haftung – Völklingen-Fürstenhausen (Saarbrücker Str. l)",
      "type": "Registerbekanntmachung nach dem Umwandlungsgesetz",
      "state": "Saarland",
      "amtsgericht": "Amtsgericht Saarbrücken",
      "registernummer": "HRB 74367",
      "registerart": "HRB",
      "company_name": "Werner Altpeter Gesellschaft mit beschränkter Haftung",
      "company_seat": "Völklingen-Fürstenhausen (Saarbrücker Str. l)",
      "details": "17.06.2025 (Bekanntmachungsdatum)\n\nSaarland Amtsgericht Saarbrücken HRB 74367\nRegisterbekanntmachung nach dem Umwandlungsgesetz 17.06.2025 (Eintragungsdatum)\n\nWerner Altpeter Gesellschaft mit beschränkter Haftung\nGesellschaft mit beschränkter Haftung\nVölklingen-Fürstenhausen (Saarbrücker Str. l)\n\nAls nicht eingetragen wird bekannt gemacht: Den Gläubigern der an der Verschmelzung beteiligten Gesellschaften ist, wenn sie binnen sechs Monaten nach dem Tag, an dem die Eintragung der Verschmelzung in das Register des Sitzes desjenigen Rechtsträgers, dessen Gläubiger sie sind, nach § 19 Absatz 3 UmwG bekannt gemacht worden ist, ihren Anspruch nach Grund und Höhe schriftlich anmelden, Sicherheit zu leisten, soweit sie nicht Befriedigung verlangen können. Dieses Recht steht den Gläubigern jedoch nur zu, wenn sie glaubhaft machen, dass durch die Verschmelzung die Erfüllung ihrer Forderung gefährdet wird."
    },
    {
      "date": "2025-06-17",
      "id": "112430",
      "original_text": "Sonstige Registerbekanntmachung\nBaden-Württemberg Amtsgericht Ulm HRB 737136\nSWU mobil GmbH – Ulm",
      "type": "Sonstige Registerbekanntmachung",
      "state": "Baden-Württemberg",
      "amtsgericht": "Amtsgericht Ulm",
      "registernummer": "HRB 737136",
      "registerart": "HRB",
      "company_name": "SWU mobil GmbH",
      "company_seat": "Ulm",
      "details": "17.06.2025 (Bekanntmachungsdatum)\n\nBaden-Württemberg Amtsgericht Ulm HRB 737136\nSonstige Registerbekanntmachung\n\nSWU mobil GmbH\nGesellschaft mit beschränkter Haftung\nUlm\n\nDie Gesellschaft hat am 13.06.2025 die Liste über die Zusammensetzung des Aufsichtsrats zum Handelsregister eingereicht."
    },
    {
      "date": "2025-06-17",
      "id": "112431",
      "original_text": "Registerbekanntmachung nach dem Umwandlungsgesetz\nThüringen Amtsgericht Jena HRA 507114\nWeisskopf Werkzeuge GmbH & Co. KG – Meiningen",
      "type": "Registerbekanntmachung nach dem Umwandlungsgesetz",
      "state": "Thüringen",
      "amtsgericht": "Amtsgericht Jena",
      "registernummer": "HRA 507114",
      "registerart": "HRA",
      "company_name": "Weisskopf Werkzeuge GmbH & Co. KG",
      "company_seat": "Meiningen",
      "details": "17.06.2025 (Bekanntmachungsdatum)\n\nThüringen Amtsgericht Jena HRA 507114\nRegisterbekanntmachung nach dem Umwandlungsgesetz 17.06.2025 (Eintragungsdatum)\n\nWeisskopf Werkzeuge GmbH & Co. KG\nKommanditgesellschaft\nMeiningen\n\nNicht eingetragen: Den Gläubigern des formwechselnden  Rechtsträgers, ist wenn sie binnen sechs Monaten nach dem Tag, an dem die Eintragung des Formwechsels nach § 201 UmwG als bekanntgemacht gilt, ihren Anspruch nach Grund und Höhe schriftlich anmelden, Sicherheit zu leisten, soweit sie nicht Befriedigung verlangen können. Dieses Recht steht ihnen jedoch nur zu, wenn sie glaubhaft machen, daß durch den Formwechsel die Erfüllung ihrer Forderung gefährdet wird."
    },
    {
      "date": "2025-06-17",
      "id": "112432",
      "original_text": "Registerbekanntmachung nach dem Umwandlungsgesetz\nThüringen Amtsgericht Jena HRB 306138\nWeisskopf Werkzeuge GmbH – Meiningen",
      "type": "Registerbekanntmachung nach dem Umwandlungsgesetz",
      "state": "Thüringen",
      "amtsgericht": "Amtsgericht Jena",
      "registernummer": "HRB 306138",
      "registerart": "HRB",
      "company_name": "Weisskopf Werkzeuge GmbH",
      "company_seat": "Meiningen",
      "details": "17.06.2025 (Bekanntmachungsdatum)\n\nThüringen Amtsgericht Jena HRB 306138\nRegisterbekanntmachung nach dem Umwandlungsgesetz 17.06.2025 (Eintragungsdatum)\n\nWeisskopf Werkzeuge GmbH\nGesellschaft mit beschränkter Haftung\nMeiningen\n\nNicht eingetragen: Den Gläubigern des formwechselnden  Rechtsträgers, ist wenn sie binnen sechs Monaten nach dem Tag, an dem die Eintragung des Formwechsels nach § 201 UmwG als bekanntgemacht gilt, ihren Anspruch nach Grund und Höhe schriftlich anmelden, Sicherheit zu leisten, soweit sie nicht Befriedigung verlangen können. Dieses Recht steht ihnen jedoch nur zu, wenn sie glaubhaft machen, daß durch den Formwechsel die Erfüllung ihrer Forderung gefährdet wird."
    },
    {
      "date": "2025-06-17",
      "id": "112433",
      "original_text": "Registerbekanntmachung nach dem Umwandlungsgesetz\nSaarland Amtsgericht Saarbrücken HRA 12173\nAltpeter Vermögensverwaltungs UG (haftungsbeschränkt) & Co. KG – Völklingen",
      "type": "Registerbekanntmachung nach dem Umwandlungsgesetz",
      "state": "Saarland",
      "amtsgericht": "Amtsgericht Saarbrücken",
      "registernummer": "HRA 12173",
      "registerart": "HRA",
      "company_name": "Altpeter Vermögensverwaltungs UG (haftungsbeschränkt) & Co. KG",
      "company_seat": "Völklingen",
      "details": "17.06.2025 (Bekanntmachungsdatum)\n\nSaarland Amtsgericht Saarbrücken HRA 12173\nRegisterbekanntmachung nach dem Umwandlungsgesetz 17.06.2025 (Eintragungsdatum)\n\nAltpeter Vermögensverwaltungs UG (haftungsbeschränkt) & Co. KG\nKommanditgesellschaft\nVölklingen\n\nAls nicht eingetragen wird bekannt gemacht: Den Gläubigern der an der Verschmelzung beteiligten Gesellschaften ist, wenn sie binnen sechs Monaten nach dem Tag, an dem die Eintragung der Verschmelzung in das Register des Sitzes desjenigen Rechtsträgers, dessen Gläubiger sie sind, nach § 19 Absatz 3 UmwG bekannt gemacht worden ist, ihren Anspruch nach Grund und Höhe schriftlich anmelden, Sicherheit zu leisten, soweit sie nicht Befriedigung verlangen können. Dieses Recht steht den Gläubigern jedoch nur zu, wenn sie glaubhaft machen, dass durch die Verschmelzung die Erfüllung ihrer Forderung gefährdet wird."
    },
    {
      "date": "2025-06-17",
      "id": "112434",
      "original_text": "Registerbekanntmachung nach dem Umwandlungsgesetz\nBerlin Amtsgericht Berlin (Charlottenburg) HRB 276095\nUlrich Reich Eventservice GmbH – Berlin",
      "type": "Registerbekanntmachung nach dem Umwandlungsgesetz",
      "state": "Berlin",
      "amtsgericht": "Amtsgericht Berlin (Charlottenburg)",
      "registernummer": "HRB 276095",
      "registerart": "HRB",
      "company_name": "Ulrich Reich Eventservice GmbH",
      "company_seat": "Berlin",
      "details": "17.06.2025 (Bekanntmachungsdatum)\n\nBerlin Amtsgericht Berlin (Charlottenburg) HRB 276095\nRegisterbekanntmachung nach dem Umwandlungsgesetz 16.06.2025 (Eintragungsdatum)\n\nUlrich Reich Eventservice GmbH\nGesellschaft mit beschränkter Haftung\nBerlin\n\nZu Eintragungsnummer 1 vom 16.06.2025 wird als nicht eingetragen veröffentlicht:\nDen Gläubigern der an der Spaltung beteiligten Rechtsträger ist, wenn sie binnen sechs Monaten nach dem Tag, an dem die Eintragung der Spaltung in das Register des Sitzes desjenigen Rechtsträgers, dessen Gläubiger sie sind, als bekannt gemacht gilt, ihren Anspruch nach Grund und Höhe schriftlich anmelden, Sicherheit zu leisten, soweit sie nicht Befriedigung verlangen können. Dieses Recht steht den Gläubigern jedoch nur zu, wenn sie glaubhaft machen, dass durch die Spaltung die Erfüllung ihrer Forderung gefährdet wird. Das Recht, Sicherheitsleistung zu verlangen, steht Gläubigern nicht zu, die im Falle der Insolvenz ein Recht auf vorzugsweise Befriedigung aus einer Deckungsmasse haben, die nach gesetzlicher Vorschrift zu ihrem Schutz errichtet und staatlich überwacht ist."
    },
    {
      "date": "2025-06-17",
      "id": "112435",
      "original_text": "Registerbekanntmachung nach dem Umwandlungsgesetz\nBerlin Amtsgericht Berlin (Charlottenburg) HRA 63189\nUlrich Reich Märkte+Feste+Werbung e.K. – Berlin",
      "type": "Registerbekanntmachung nach dem Umwandlungsgesetz",
      "state": "Berlin",
      "amtsgericht": "Amtsgericht Berlin (Charlottenburg)",
      "registernummer": "HRA 63189",
      "registerart": "HRA",
      "company_name": "Ulrich Reich Märkte+Feste+Werbung e.K.",
      "company_seat": "Berlin",
      "details": "17.06.2025 (Bekanntmachungsdatum)\n\nBerlin Amtsgericht Berlin (Charlottenburg) HRA 63189\nRegisterbekanntmachung nach dem Umwandlungsgesetz 16.06.2025 (Eintragungsdatum)\n\nUlrich Reich Märkte+Feste+Werbung e.K.\nEinzelkaufmann / Einzelkauffrau\nBerlin\n\nZu Eintragungsnummer 2 vom 16.06.2025 wird als nicht eingetragen veröffentlicht:\nDen Gläubigern der an der Spaltung beteiligten Rechtsträger ist, wenn sie binnen sechs Monaten nach dem Tag, an dem die Eintragung der Spaltung in das Register des Sitzes desjenigen Rechtsträgers, dessen Gläubiger sie sind, als bekannt gemacht gilt, ihren Anspruch nach Grund und Höhe schriftlich anmelden, Sicherheit zu leisten, soweit sie nicht Befriedigung verlangen können. Dieses Recht steht den Gläubigern jedoch nur zu, wenn sie glaubhaft machen, dass durch die Spaltung die Erfüllung ihrer Forderung gefährdet wird. Das Recht, Sicherheitsleistung zu verlangen, steht Gläubigern nicht zu, die im Falle der Insolvenz ein Recht auf vorzugsweise Befriedigung aus einer Deckungsmasse haben, die nach gesetzlicher Vorschrift zu ihrem Schutz errichtet und staatlich überwacht ist."
    },
    {
      "date": "2025-06-17",
      "id": "112436",
      "original_text": "Einreichung neuer Dokumente\nBaden-Württemberg Amtsgericht Mannheim HRB 107865\nKVVH - Karlsruher Versorgungs-, Verkehrs- und Hafen GmbH – Karlsruhe",
      "type": "Einreichung neuer Dokumente",
      "state": "Baden-Württemberg",
      "amtsgericht": "Amtsgericht Mannheim",
      "registernummer": "HRB 107865",
      "registerart": "HRB",
      "company_name": "KVVH - Karlsruher Versorgungs-, Verkehrs- und Hafen GmbH",
      "company_seat": "Karlsruhe",
      "details": "17.06.2025 (Bekanntmachungsdatum)\n\nBaden-Württemberg Amtsgericht Mannheim HRB 107865\nEinreichung neuer Dokumente\n\nKVVH - Karlsruher Versorgungs-, Verkehrs- und Hafen GmbH\nGesellschaft mit beschränkter Haftung\nKarlsruhe\n\nDie Gesellschaft hat am 11.06.2025 die Liste über die Zusammensetzung des Aufsichtsrats zum Handelsregister eingereicht."
    },
    {
      "date": "2025-06-17",
      "id": "112437",
      "original_text": "Löschungsankündigung\nBerlin Amtsgericht Berlin (Charlottenburg) HRB 187770\nKERZ Beteiligung 2. UG (haftungsbeschränkt) – Berlin",
      "type": "Löschungsankündigung",
      "state": "Berlin",
      "amtsgericht": "Amtsgericht Berlin (Charlottenburg)",
      "registernummer": "HRB 187770",
      "registerart": "HRB",
      "company_name": "KERZ Beteiligung 2. UG (haftungsbeschränkt)",
      "company_seat": "Berlin",
      "details": "17.06.2025 (Bekanntmachungsdatum)\n\nBerlin Amtsgericht Berlin (Charlottenburg) HRB 187770\nLöschungsankündigung\n\nKERZ Beteiligung 2. UG (haftungsbeschränkt)\nGesellschaft mit beschränkter Haftung\nBerlin\n\nBei der nachstehenden Gesellschaft wird das Amtslöschungsverfahren gemäß § 394 FamFG eingeleitet. Widerspruchsfrist 6 Wochen"
    },
    {
      "date": "2025-06-17",
      "id": "112438",
      "original_text": "Löschungsankündigung\nBaden-Württemberg Amtsgericht Mannheim HRB 740966\nMAK Markt GmbH – Waldbronn",
      "type": "Löschungsankündigung",
      "state": "Baden-Württemberg",
      "amtsgericht": "Amtsgericht Mannheim",
      "registernummer": "HRB 740966",
      "registerart": "HRB",
      "company_name": "MAK Markt GmbH",
      "company_seat": "Waldbronn",
      "details": "17.06.2025 (Bekanntmachungsdatum)\n\nBaden-Württemberg Amtsgericht Mannheim HRB 740966\nLöschungsankündigung\n\nMAK Markt GmbH\nGesellschaft mit beschränkter Haftung\nWaldbronn\n\nDas Gericht beabsichtigt, die Gesellschaft wegen Vermögenslosigkeit im Handelsregister von Amts wegen nach § 394 FamFG zu löschen. Die Frist zur Geltendmachung eines Widerspruchs gegen die beabsichtigte Löschung ist auf einen Monat ab Veröffentlichung bestimmt."
    },
    {
      "date": "2025-06-17",
      "id": "112439",
      "original_text": "Registerbekanntmachung nach dem Umwandlungsgesetz\nBaden-Württemberg Amtsgericht Stuttgart HRB 786096\nDICK Holding GmbH – Deizisau",
      "type": "Registerbekanntmachung nach dem Umwandlungsgesetz",
      "state": "Baden-Württemberg",
      "amtsgericht": "Amtsgericht Stuttgart",
      "registernummer": "HRB 786096",
      "registerart": "HRB",
      "company_name": "DICK Holding GmbH",
      "company_seat": "Deizisau",
      "details": "17.06.2025 (Bekanntmachungsdatum)\n\nBaden-Württemberg Amtsgericht Stuttgart HRB 786096\nRegisterbekanntmachung nach dem Umwandlungsgesetz 17.06.2025 (Eintragungsdatum)\n\nDICK Holding GmbH\nGesellschaft mit beschränkter Haftung\nDeizisau\n\nAls nicht eingetragen wird bekanntgemacht:\nDen Gläubigern der an der Abspaltung beteiligten Rechtsträger ist, wenn sie binnen sechs Monaten nach dem Tag, an dem die Eintragung der Abspaltung in das Register des Sitzes desjenigen Rechtsträgers, dessen Gläubiger sie sind, nach § 19 Abs. 3 UmwG als bekanntgemacht gilt, ihren Anspruch nach Grund und Höhe schriftlich anmelden, Sicherheit zu leisten, soweit sie nicht Befriedigung verlangen können. Dieses Recht steht den Gläubigern jedoch nur zu, wenn sie glaubhaft machen, dass durch die Abspaltung die Erfüllung ihrer Forderung gefährdet wird."
    },
    {
      "date": "2025-06-17",
      "id": "112440",
      "original_text": "Registerbekanntmachung nach dem Umwandlungsgesetz\nBerlin Amtsgericht Berlin (Charlottenburg) HRB 271508\nUkry CEO UG (haftungsbeschränkt) – Berlin",
      "type": "Registerbekanntmachung nach dem Umwandlungsgesetz",
      "state": "Berlin",
      "amtsgericht": "Amtsgericht Berlin (Charlottenburg)",
      "registernummer": "HRB 271508",
      "registerart": "HRB",
      "company_name": "Ukry CEO UG (haftungsbeschränkt)",
      "company_seat": "Berlin",
      "details": "17.06.2025 (Bekanntmachungsdatum)\n\nBerlin Amtsgericht Berlin (Charlottenburg) HRB 271508\nRegisterbekanntmachung nach dem Umwandlungsgesetz 16.06.2025 (Eintragungsdatum)\n\nUkry CEO UG (haftungsbeschränkt)\nGesellschaft mit beschränkter Haftung\nBerlin\n\nZu Eintragungsnummer 4 vom 16.06.2025 wird als nicht eingetragen veröffentlicht: Den Gläubigern der an der Verschmelzung beteiligten Rechtsträger ist, wenn sie binnen sechs Monaten nach dem Tag, an dem die Eintragung der Verschmelzung in das Register des Sitzes desjenigen Rechtsträgers, dessen Gläubiger sie sind, als bekannt gemacht gilt, ihren Anspruch nach Grund und Höhe schriftlich anmelden, Sicherheit zu leisten, soweit sie nicht Befriedigung verlangen können. Dieses Recht steht den Gläubigern jedoch nur zu, wenn sie glaubhaft machen, dass durch die Verschmelzung die Erfüllung ihrer Forderung gefährdet wird. Das Recht, Sicherheitsleistung zu verlangen, steht Gläubigern nicht zu, die im Falle der Insolvenz ein Recht auf vorzugsweise Befriedigung aus einer Deckungsmasse haben, die nach gesetzlicher Vorschrift zu ihrem Schutz errichtet und staatlich überwacht ist."
    },
    {
      "date": "2025-06-17",
      "id": "112441",
      "original_text": "Registerbekanntmachung nach dem Umwandlungsgesetz\nBerlin Amtsgericht Berlin (Charlottenburg) HRB 210770\nXII. Bauten APL GmbH – Berlin",
      "type": "Registerbekanntmachung nach dem Umwandlungsgesetz",
      "state": "Berlin",
      "amtsgericht": "Amtsgericht Berlin (Charlottenburg)",
      "registernummer": "HRB 210770",
      "registerart": "HRB",
      "company_name": "XII. Bauten APL GmbH",
      "company_seat": "Berlin",
      "details": "17.06.2025 (Bekanntmachungsdatum)\n\nBerlin Amtsgericht Berlin (Charlottenburg) HRB 210770\nRegisterbekanntmachung nach dem Umwandlungsgesetz 16.06.2025 (Eintragungsdatum)\n\nXII. Bauten APL GmbH\nGesellschaft mit beschränkter Haftung\nBerlin\n\nZu Eintragungsnummer 4 vom 16.06.2025 wird als nicht eingetragen veröffentlicht: Den Gläubigern der an der Verschmelzung beteiligten Rechtsträger ist, wenn sie binnen sechs Monaten nach dem Tag, an dem die Eintragung der Verschmelzung in das Register des Sitzes desjenigen Rechtsträgers, dessen Gläubiger sie sind, als bekannt gemacht gilt, ihren Anspruch nach Grund und Höhe schriftlich anmelden, Sicherheit zu leisten, soweit sie nicht Befriedigung verlangen können. Dieses Recht steht den Gläubigern jedoch nur zu, wenn sie glaubhaft machen, dass durch die Verschmelzung die Erfüllung ihrer Forderung gefährdet wird. Das Recht, Sicherheitsleistung zu verlangen, steht Gläubigern nicht zu, die im Falle der Insolvenz ein Recht auf vorzugsweise Befriedigung aus einer Deckungsmasse haben, die nach gesetzlicher Vorschrift zu ihrem Schutz errichtet und staatlich überwacht ist."
    },
    {
      "date": "2025-06-17",
      "id": "112442",
      "original_text": "Löschungsankündigung\nBaden-Württemberg Amtsgericht Stuttgart HRB 764731\nE. Ludwig Service GmbH – Asperg",
      "type": "Löschungsankündigung",
      "state": "Baden-Württemberg",
      "amtsgericht": "Amtsgericht Stuttgart",
      "registernummer": "HRB 764731",
      "registerart": "HRB",
      "company_name": "E. Ludwig Service GmbH",
      "company_seat": "Asperg",
      "details": "17.06.2025 (Bekanntmachungsdatum)\n\nBaden-Württemberg Amtsgericht Stuttgart HRB 764731\nLöschungsankündigung\n\nE. Ludwig Service GmbH\nGesellschaft mit beschränkter Haftung\nAsperg\n\nDas Gericht beabsichtigt, die Gesellschaft wegen Vermögenslosigkeit im Handelsregister von Amts wegen nach § 394 FamFG zu löschen. Die Frist zur Geltendmachung eines Widerspruchs gegen die beabsichtigte Löschung ist auf zwei Monate ab Veröffentlichung bestimmt."
    },
    {
      "date": "2025-06-17",
      "id": "112443",
      "original_text": "Registerbekanntmachung nach dem Umwandlungsgesetz\nBaden-Württemberg Amtsgericht Freiburg HRB 600265\nBitumen-Mischwerk Mühlhausen GmbH – Villingen-Schwenningen",
      "type": "Registerbekanntmachung nach dem Umwandlungsgesetz",
      "state": "Baden-Württemberg",
      "amtsgericht": "Amtsgericht Freiburg",
      "registernummer": "HRB 600265",
      "registerart": "HRB",
      "company_name": "Bitumen-Mischwerk Mühlhausen GmbH",
      "company_seat": "Villingen-Schwenningen",
      "details": "17.06.2025 (Bekanntmachungsdatum)\n\nBaden-Württemberg Amtsgericht Freiburg HRB 600265\nRegisterbekanntmachung nach dem Umwandlungsgesetz 17.06.2025 (Eintragungsdatum)\n\nBitumen-Mischwerk Mühlhausen GmbH\nGesellschaft mit beschränkter Haftung\nVillingen-Schwenningen\n\nAls nicht eingetragen wird bekanntgemacht:\nDen Gläubigern der an der Verschmelzung beteiligten Rechtsträger ist, wenn sie binnen sechs Monaten nach dem Tag, an dem die Eintragung der Verschmelzung in das Register des Sitzes desjenigen Rechtsträgers, dessen Gläubiger sie sind, nach § 19 Abs. 3 UmwG als bekanntgemacht gilt, ihren Anspruch nach Grund und Höhe schriftlich anmelden, Sicherheit zu leisten, soweit sie nicht Befriedigung verlangen können. Dieses Recht steht den Gläubigern jedoch nur zu, wenn sie glaubhaft machen, dass durch die Verschmelzung die Erfüllung ihrer Forderung gefährdet wird."
    },
    {
      "date": "2025-06-17",
      "id": "112444",
      "original_text": "Sonstige Registerbekanntmachung\nHamburg Amtsgericht Hamburg HRB 74477\nReha - Service Loose GmbH – Hamburg",
      "type": "Sonstige Registerbekanntmachung",
      "state": "Hamburg",
      "amtsgericht": "Amtsgericht Hamburg",
      "registernummer": "HRB 74477",
      "registerart": "HRB",
      "company_name": "Reha - Service Loose GmbH",
      "company_seat": "Hamburg",
      "details": "17.06.2025 (Bekanntmachungsdatum)\n\nHamburg Amtsgericht Hamburg HRB 74477\nSonstige Registerbekanntmachung 17.06.2025 (Eintragungsdatum)\n\nReha - Service Loose GmbH\nGesellschaft mit beschränkter Haftung\nHamburg\n\nAls nicht eingetragen wird bekannt gemacht:  Den Gläubigern der Gesellschaft, deren Forderungen begründet worden sind, bevor die Eintragung der Vertragsbeendigung in das Handelsregister nach § 10 HGB als bekannt gemacht gilt, ist vom anderen Vertragsteil Sicherheit zu leisten, wenn sie sich binnen 6 Monaten nach Bekanntmachung der Eintragung zu diesem Zweck bei ihm melden."
    },
    {
      "date": "2025-06-17",
      "id": "112445",
      "original_text": "Registerbekanntmachung nach dem Umwandlungsgesetz\nBerlin Amtsgericht Berlin (Charlottenburg) HRB 93292\nAndromeda GmbH – Berlin",
      "type": "Registerbekanntmachung nach dem Umwandlungsgesetz",
      "state": "Berlin",
      "amtsgericht": "Amtsgericht Berlin (Charlottenburg)",
      "registernummer": "HRB 93292",
      "registerart": "HRB",
      "company_name": "Andromeda GmbH",
      "company_seat": "Berlin",
      "details": "17.06.2025 (Bekanntmachungsdatum)\n\nBerlin Amtsgericht Berlin (Charlottenburg) HRB 93292\nRegisterbekanntmachung nach dem Umwandlungsgesetz 16.06.2025 (Eintragungsdatum)\n\nAndromeda GmbH\nGesellschaft mit beschränkter Haftung\nBerlin\n\nZu Eintragungsnummer 5 vom 16.06.2025 wird als nicht eingetragen veröffentlicht: Den Gläubigern der an der Verschmelzung beteiligten Rechtsträger ist, wenn sie binnen sechs Monaten nach dem Tag, an dem die Eintragung der Verschmelzung in das Register des Sitzes desjenigen Rechtsträgers, dessen Gläubiger sie sind, als bekannt gemacht gilt, ihren Anspruch nach Grund und Höhe schriftlich anmelden, Sicherheit zu leisten, soweit sie nicht Befriedigung verlangen können. Dieses Recht steht den Gläubigern jedoch nur zu, wenn sie glaubhaft machen, dass durch die Verschmelzung die Erfüllung ihrer Forderung gefährdet wird. Das Recht, Sicherheitsleistung zu verlangen, steht Gläubigern nicht zu, die im Falle der Insolvenz ein Recht auf vorzugsweise Befriedigung aus einer Deckungsmasse haben, die nach gesetzlicher Vorschrift zu ihrem Schutz errichtet und staatlich überwacht ist."
    },
    {
      "date": "2025-06-17",
      "id": "112446",
      "original_text": "Einreichung neuer Dokumente\nBerlin Amtsgericht Berlin (Charlottenburg) HRB 267826\nTS Elements GmbH – Berlin",
      "type": "Einreichung neuer Dokumente",
      "state": "Berlin",
      "amtsgericht": "Amtsgericht Berlin (Charlottenburg)",
      "registernummer": "HRB 267826",
      "registerart": "HRB",
      "company_name": "TS Elements GmbH",
      "company_seat": "Berlin",
      "details": "17.06.2025 (Bekanntmachungsdatum)\n\nBerlin Amtsgericht Berlin (Charlottenburg) HRB 267826\nEinreichung neuer Dokumente\n\nTS Elements GmbH\nGesellschaft mit beschränkter Haftung\nBerlin\n\nAls nicht eingetragen wird veröffentlicht: Die Gesellschaft hat einen notariell beurkundeten Formwechselplan vom 11.06.2025 betreffend den grenzüberschreitenden Formwechsel unter gleichzeitiger Verlegung des Satzungssitzes der Gesellschaft nach Luxemburg gemäß §§ 333 ff. UmwG zum Handelsregister des Amtsgerichts Charlottenburg eingereicht.\n\n1\nFormwechsel\nEs  wird  darauf  hingewiesen,  dass  der  notariell  beurkundete  Formwechselplan  (UVZ-  Nr.  66/2025  der  Notarin  Dr.  Silke  Gantzckow,  Frankfurt  am  Main)  für  den  grenzüberschreitenden\nder  Gesellschaft  im  Wege  des\n„Herausformwechsels“  ohne  Abwicklung  und  Auflösung  von  einer  deutschen  GmbH  in  eine  luxemburgische  S.a  r.l.  mit  gleichzeitiger  Verlegung  des  Satzungssitzes  nach  Luxemburg  beim  Handelsregister  eingereicht  worden  ist.\nAn  dem  grenziiberschreitenden  Formwechsel  ist  beteiligt:  TS  Elements  GmbH  mit  Sitz  in  Berlin  (,Gesellschaft\").\nDie  Gesellschaft  ist  im  Handelsregister  des  Amtsgerichts  Charlottenburg  zu  HRB  267826  B  eingetragen.\nDie  Gesellschafterversammlung  zum  (a)  (b)  Beschluss  des  grenzüberschreitenden\nFormwechsels  ist  fiir  den  Tag  geplant,  der  auf  den  Ablauf  von  einem  Monat  nach  dem  Tag  der  Registerbekanntmachung  (s.u.)  folgt,  oder  ggfs.  den  nächsten  Werktag.\nDie  Anteilsinhaber  und  Gläubiger  der  Gesellschaft  erhalten  den  Hinweis,  dass  sie  spätestens  fünf  Arbeitstage  vor  dem  Tag  der  Gesellschafterversammlung  der  Gesellschaft  Bemerkungen  zum  Formwechselplan  übermitteln  können.\nEinen  Betriebsrat  gibt  es  nicht,  die  Gesellschaft  hat  keine  Arbeitnehmer.  Der  guten  Ordnung  halber  erfolgt  gleichwohl  der  Hinweis,  dass  die  zustandigen  Betriebsrate  der  Gesellschaft  oder,  soweit  es  keinen  Betriebsrat  gibt,  die  Arbeitnehmer  der  Gesellschaft,  spätestens  fünf  Arbeitstage  vor  dem  Tag  der  Gesellschafterversammlung der  Formwechselplan  übermitteln  können."
    },
    {
      "date": "2025-06-17",
      "id": "112447",
      "original_text": "Registerbekanntmachung nach dem Umwandlungsgesetz\nBaden-Württemberg Amtsgericht Ulm HRB 671450\nOmnium GmbH – Crailsheim",
      "type": "Registerbekanntmachung nach dem Umwandlungsgesetz",
      "state": "Baden-Württemberg",
      "amtsgericht": "Amtsgericht Ulm",
      "registernummer": "HRB 671450",
      "registerart": "HRB",
      "company_name": "Omnium GmbH",
      "company_seat": "Crailsheim",
      "details": "17.06.2025 (Bekanntmachungsdatum)\n\nBaden-Württemberg Amtsgericht Ulm HRB 671450\nRegisterbekanntmachung nach dem Umwandlungsgesetz 17.06.2025 (Eintragungsdatum)\n\nOmnium GmbH\nGesellschaft mit beschränkter Haftung\nCrailsheim\n\nDen Gläubigern der an der Verschmelzung beteiligten Rechtsträger ist, wenn sie binnen sechs Monaten nach dem Tag, an dem die Eintragung der Verschmelzung in das Register des Sitzes desjenigen Rechtsträgers, dessen Gläubiger sie sind, nach § 19 Abs. 3 UmwG als bekanntgemacht gilt, ihren Anspruch nach Grund und Höhe schriftlich anmelden, Sicherheit zu leisten, soweit sie nicht Befriedigung verlangen können. Dieses Recht steht den Gläubigern jedoch nur zu, wenn sie glaubhaft machen, dass durch die Verschmelzung die Erfüllung ihrer Forderung gefährdet wird."
    },
    {
      "date": "2025-06-17",
      "id": "112448",
      "original_text": "Registerbekanntmachung nach dem Umwandlungsgesetz\nBaden-Württemberg Amtsgericht Ulm HRB 725590\nYuvest GmbH – Crailsheim",
      "type": "Registerbekanntmachung nach dem Umwandlungsgesetz",
      "state": "Baden-Württemberg",
      "amtsgericht": "Amtsgericht Ulm",
      "registernummer": "HRB 725590",
      "registerart": "HRB",
      "company_name": "Yuvest GmbH",
      "company_seat": "Crailsheim",
      "details": "17.06.2025 (Bekanntmachungsdatum)\n\nBaden-Württemberg Amtsgericht Ulm HRB 725590\nRegisterbekanntmachung nach dem Umwandlungsgesetz 17.06.2025 (Eintragungsdatum)\n\nYuvest GmbH\nGesellschaft mit beschränkter Haftung\nCrailsheim\n\nDen Gläubigern der an der Verschmelzung beteiligten Rechtsträger ist, wenn sie binnen sechs Monaten nach dem Tag, an dem die Eintragung der Verschmelzung in das Register des Sitzes desjenigen Rechtsträgers, dessen Gläubiger sie sind, nach § 19 Abs. 3 UmwG als bekanntgemacht gilt, ihren Anspruch nach Grund und Höhe schriftlich anmelden, Sicherheit zu leisten, soweit sie nicht Befriedigung verlangen können. Dieses Recht steht den Gläubigern jedoch nur zu, wenn sie glaubhaft machen, dass durch die Verschmelzung die Erfüllung ihrer Forderung gefährdet wird."
    },
    {
      "date": "2025-06-17",
      "id": "112449",
      "original_text": "Registerbekanntmachung nach dem Umwandlungsgesetz\nBaden-Württemberg Amtsgericht Stuttgart HRA 736446\nRosenauer Baumaschinen e.K. – Balingen",
      "type": "Registerbekanntmachung nach dem Umwandlungsgesetz",
      "state": "Baden-Württemberg",
      "amtsgericht": "Amtsgericht Stuttgart",
      "registernummer": "HRA 736446",
      "registerart": "HRA",
      "company_name": "Rosenauer Baumaschinen e.K.",
      "company_seat": "Balingen",
      "details": "17.06.2025 (Bekanntmachungsdatum)\n\nBaden-Württemberg Amtsgericht Stuttgart HRA 736446\nRegisterbekanntmachung nach dem Umwandlungsgesetz 17.06.2025 (Eintragungsdatum)\n\nRosenauer Baumaschinen e.K.\nEinzelkaufmann / Einzelkauffrau\nBalingen\n\nAls nicht eingetragen wird bekanntgemacht:\nDen Gläubigern der an der Ausgliederung beteiligten Rechtsträger ist, wenn sie binnen sechs Monaten nach dem Tag, an dem die Eintragung der Ausgliederung in das Register des Sitzes desjenigen Rechtsträgers, dessen Gläubiger sie sind, nach § 19 Abs. 3 UmwG als bekanntgemacht gilt, ihren Anspruch nach Grund und Höhe schriftlich anmelden, Sicherheit zu leisten, soweit sie nicht Befriedigung verlangen können. Dieses Recht steht den Gläubigern jedoch nur zu, wenn sie glaubhaft machen, dass durch die Ausgliederung die Erfüllung ihrer Forderung gefährdet wird."
    },
    {
      "date": "2025-06-17",
      "id": "112450",
      "original_text": "Löschungsankündigung\nBerlin Amtsgericht Berlin (Charlottenburg) HRB 186470\nRR Deutsche Nordwestbau UG (haftungsbeschränkt) – Berlin",
      "type": "Löschungsankündigung",
      "state": "Berlin",
      "amtsgericht": "Amtsgericht Berlin (Charlottenburg)",
      "registernummer": "HRB 186470",
      "registerart": "HRB",
      "company_name": "RR Deutsche Nordwestbau UG (haftungsbeschränkt)",
      "company_seat": "Berlin",
      "details": "17.06.2025 (Bekanntmachungsdatum)\n\nBerlin Amtsgericht Berlin (Charlottenburg) HRB 186470\nLöschungsankündigung\n\nRR Deutsche Nordwestbau UG (haftungsbeschränkt)\nGesellschaft mit beschränkter Haftung\nBerlin\n\nBei der nachstehenden Gesellschaft wird das Amtslöschungsverfahren gemäß § 394 FamFG eingeleitet. Widerspruchsfrist 8 Wochen"
    },
    {
      "date": "2025-06-17",
      "id": "112451",
      "original_text": "Löschungsankündigung\nBerlin Amtsgericht Berlin (Charlottenburg) HRA 57324\nTamellia e.K. – Berlin",
      "type": "Löschungsankündigung",
      "state": "Berlin",
      "amtsgericht": "Amtsgericht Berlin (Charlottenburg)",
      "registernummer": "HRA 57324",
      "registerart": "HRA",
      "company_name": "Tamellia e.K.",
      "company_seat": "Berlin",
      "details": "17.06.2025 (Bekanntmachungsdatum)\n\nBerlin Amtsgericht Berlin (Charlottenburg) HRA 57324\nLöschungsankündigung\n\nTamellia e.K.\nEinzelkaufmann / Einzelkauffrau\nBerlin\n\nBei dem nachstehenden Unternehmen / der nachstehenden Gesellschaft wird das Amtslöschungsverfahren gemäß § 31 Abs. 2 HGB eingeleitet. Widerspruchsfrist 1 Monat"
    },
    {
      "date": "2025-06-17",
      "id": "112452",
      "original_text": "Registerbekanntmachung nach dem Umwandlungsgesetz\nNordrhein-Westfalen Amtsgericht Coesfeld HRB 2671\nRhenus Data Office GmbH – Nottuln",
      "type": "Registerbekanntmachung nach dem Umwandlungsgesetz",
      "state": "Nordrhein-Westfalen",
      "amtsgericht": "Amtsgericht Coesfeld",
      "registernummer": "HRB 2671",
      "registerart": "HRB",
      "company_name": "Rhenus Data Office GmbH",
      "company_seat": "Nottuln",
      "details": "17.06.2025 (Bekanntmachungsdatum)\n\nNordrhein-Westfalen Amtsgericht Coesfeld HRB 2671\nRegisterbekanntmachung nach dem Umwandlungsgesetz 17.06.2025 (Eintragungsdatum)\n\nRhenus Data Office GmbH\nGesellschaft mit beschränkter Haftung\nNottuln\n\nDen Gläubigern der an der Verschmelzung beteiligten Rechtsträger ist, wenn sie binnen sechs Monaten nach dem Tag, an dem die Eintragung der Verschmelzung in das Register des Sitzes derjenigen Rechtsträger deren Gläubiger sie sind, nach § 19 Absatz 3 UmwG als bekanntgemacht gilt, ihren Anspruch nach Grund und Höhe schriftlich anmelden, Sicherheit zu leisten, soweit sie nicht Befriedigung verlangen können. Dieses Recht steht den Gläubigern jedoch nur zu, wenn sie glaubhaft machen, dass durch die Verschmelzung die Erfüllung ihrer Forderung gefährdet wird."
    },
    {
      "date": "2025-06-17",
      "id": "112453",
      "original_text": "Einreichung neuer Dokumente\nBaden-Württemberg Amtsgericht Freiburg HRB 370176\nJEAN D'ARCEL GmbH – Kehl",
      "type": "Einreichung neuer Dokumente",
      "state": "Baden-Württemberg",
      "amtsgericht": "Amtsgericht Freiburg",
      "registernummer": "HRB 370176",
      "registerart": "HRB",
      "company_name": "JEAN D'ARCEL GmbH",
      "company_seat": "Kehl",
      "details": "17.06.2025 (Bekanntmachungsdatum)\n\nBaden-Württemberg Amtsgericht Freiburg HRB 370176\nEinreichung neuer Dokumente 17.06.2025 (Eintragungsdatum)\n\nJEAN D'ARCEL GmbH\nGesellschaft mit beschränkter Haftung\nKehl\n\nAm 12.06.2025 wurde durch die Gesellschaft eine aktuelle Beiratsliste beim Registergericht eingereicht."
    },
    {
      "date": "2025-06-17",
      "id": "112454",
      "original_text": "Registerbekanntmachung nach dem Umwandlungsgesetz\nBaden-Württemberg Amtsgericht Stuttgart HRB 749161\nNK Fashion Marketing & Consulting GmbH – Korntal-Münchingen",
      "type": "Registerbekanntmachung nach dem Umwandlungsgesetz",
      "state": "Baden-Württemberg",
      "amtsgericht": "Amtsgericht Stuttgart",
      "registernummer": "HRB 749161",
      "registerart": "HRB",
      "company_name": "NK Fashion Marketing & Consulting GmbH",
      "company_seat": "Korntal-Münchingen",
      "details": "17.06.2025 (Bekanntmachungsdatum)\n\nBaden-Württemberg Amtsgericht Stuttgart HRB 749161\nRegisterbekanntmachung nach dem Umwandlungsgesetz 17.06.2025 (Eintragungsdatum)\n\nNK Fashion Marketing & Consulting GmbH\nGesellschaft mit beschränkter Haftung\nKorntal-Münchingen\n\nAls nicht eingetragen wird bekanntgemacht:\nDen Gläubigern der an der Verschmelzung beteiligten Rechtsträger ist, wenn sie binnen sechs Monaten nach dem Tag, an dem die Eintragung der Verschmelzung in das Register des Sitzes desjenigen Rechtsträgers, dessen Gläubiger sie sind, nach § 19 Abs. 3 UmwG als bekanntgemacht gilt, ihren Anspruch nach Grund und Höhe schriftlich anmelden, Sicherheit zu leisten, soweit sie nicht Befriedigung verlangen können. Dieses Recht steht den Gläubigern jedoch nur zu, wenn sie glaubhaft machen, dass durch die Verschmelzung die Erfüllung ihrer Forderung gefährdet wird."
    },
    {
      "date": "2025-06-17",
      "id": "112455",
      "original_text": "Löschungsankündigung\nBaden-Württemberg Amtsgericht Freiburg HRB 717244\nPROFASHIONAL PRODUCTS Deutschland GmbH – Konstanz",
      "type": "Löschungsankündigung",
      "state": "Baden-Württemberg",
      "amtsgericht": "Amtsgericht Freiburg",
      "registernummer": "HRB 717244",
      "registerart": "HRB",
      "company_name": "PROFASHIONAL PRODUCTS Deutschland GmbH",
      "company_seat": "Konstanz",
      "details": "17.06.2025 (Bekanntmachungsdatum)\n\nBaden-Württemberg Amtsgericht Freiburg HRB 717244\nLöschungsankündigung 17.06.2025 (Eintragungsdatum)\n\nPROFASHIONAL PRODUCTS Deutschland GmbH\nGesellschaft mit beschränkter Haftung\nKonstanz\n\nAls nicht eingetragen wird bekanntgemacht:\nDas Gericht beabsichtigt, die Gesellschaft wegen Vermögenslosigkeit im Handelsregister von Amts wegen nach § 394 FamFG zu löschen. Die Frist zur Geltendmachung eines Widerspruchs gegen die beabsichtigte Löschung ist auf einen Monat ab Veröffentlichung bestimmt."
    },
    {
      "date": "2025-06-17",
      "id": "112456",
      "original_text": "Registerbekanntmachung nach dem Umwandlungsgesetz\nBrandenburg Amtsgericht Neuruppin HRB 10014\nRUDAR Anlagenmontage GmbH – Schwedt/Oder",
      "type": "Registerbekanntmachung nach dem Umwandlungsgesetz",
      "state": "Brandenburg",
      "amtsgericht": "Amtsgericht Neuruppin",
      "registernummer": "HRB 10014",
      "registerart": "HRB",
      "company_name": "RUDAR Anlagenmontage GmbH",
      "company_seat": "Schwedt/Oder",
      "details": "17.06.2025 (Bekanntmachungsdatum)\n\nBrandenburg Amtsgericht Neuruppin HRB 10014\nRegisterbekanntmachung nach dem Umwandlungsgesetz 16.06.2025 (Eintragungsdatum)\n\nRUDAR Anlagenmontage GmbH\nGesellschaft mit beschränkter Haftung\nSchwedt/Oder\n\nZu Eintragungsnummer 9 vom 16.06.2025 wird als nicht eingetragen veröffentlicht:\nDen Gläubigern der an der Umwandlung beteiligten Rechtsträger ist, wenn sie binnen sechs Monaten nach dem Tag, an dem die Eintragung der Umwandlung in das Register des Sitzes desjenigen Rechtsträgers, dessen Gläubiger sie sind, als bekannt gemacht gilt, ihren Anspruch nach Grund und Höhe schriftlich anmelden, Sicherheit zu leisten, soweit sie nicht Befriedigung verlangen können. Dieses Recht steht den Gläubigern jedoch nur zu, wenn sie glaubhaft machen, dass durch die Umwandlung die Erfüllung ihrer Forderung gefährdet wird."
    },
    {
      "date": "2025-06-17",
      "id": "112457",
      "original_text": "Registerbekanntmachung nach dem Umwandlungsgesetz\nSchleswig-Holstein Amtsgericht Flensburg HRA 8632\nFRICK + PETERSEN GmbH & Co. KG – Flensburg",
      "type": "Registerbekanntmachung nach dem Umwandlungsgesetz",
      "state": "Schleswig-Holstein",
      "amtsgericht": "Amtsgericht Flensburg",
      "registernummer": "HRA 8632",
      "registerart": "HRA",
      "company_name": "FRICK + PETERSEN GmbH & Co. KG",
      "company_seat": "Flensburg",
      "details": "17.06.2025 (Bekanntmachungsdatum)\n\nSchleswig-Holstein Amtsgericht Flensburg HRA 8632\nRegisterbekanntmachung nach dem Umwandlungsgesetz 17.06.2025 (Eintragungsdatum)\n\nFRICK + PETERSEN GmbH & Co. KG\nKommanditgesellschaft\nFlensburg\n\nZu Eintragungsnummer 5 vom 17.06.2025 wird als nicht eingetragen veröffentlicht: Den Gläubigern der an der Verschmelzung beteiligten Rechtsträger ist, wenn sie binnen sechs Monaten nach dem Tag, an dem die Eintragung der Verschmelzung in das Register des Sitzes desjenigen Rechtsträgers, dessen Gläubiger sie sind, als bekannt gemacht gilt, ihren Anspruch nach Grund und Höhe schriftlich anmelden, Sicherheit zu leisten, soweit sie nicht Befriedigung verlangen können. Dieses Recht steht den Gläubigern jedoch nur zu, wenn sie glaubhaft machen, dass durch die Verschmelzung die Erfüllung ihrer Forderung gefährdet wird. Das Recht, Sicherheitsleistung zu verlangen, steht Gläubigern nicht zu, die im Falle der Insolvenz ein Recht auf vorzugsweise Befriedigung aus einer Deckungsmasse haben, die nach gesetzlicher Vorschrift zu ihrem Schutz errichtet und staatlich überwacht ist."
    },
    {
      "date": "2025-06-17",
      "id": "112458",
      "original_text": "Registerbekanntmachung nach dem Umwandlungsgesetz\nBaden-Württemberg Amtsgericht Stuttgart HRB 766167\nDSH Datenschutz GmbH – Heilbronn",
      "type": "Registerbekanntmachung nach dem Umwandlungsgesetz",
      "state": "Baden-Württemberg",
      "amtsgericht": "Amtsgericht Stuttgart",
      "registernummer": "HRB 766167",
      "registerart": "HRB",
      "company_name": "DSH Datenschutz GmbH",
      "company_seat": "Heilbronn",
      "details": "17.06.2025 (Bekanntmachungsdatum)\n\nBaden-Württemberg Amtsgericht Stuttgart HRB 766167\nRegisterbekanntmachung nach dem Umwandlungsgesetz 17.06.2025 (Eintragungsdatum)\n\nDSH Datenschutz GmbH\nGesellschaft mit beschränkter Haftung\nHeilbronn\n\nAls nicht eingetragen wird bekanntgemacht:\nDen Gläubigern der an der Verschmelzung beteiligten Rechtsträger ist, wenn sie binnen sechs Monaten nach dem Tag, an dem die Eintragung der Verschmelzung in das Register des Sitzes desjenigen Rechtsträgers, dessen Gläubiger sie sind, nach § 19 Abs. 3 UmwG als bekanntgemacht gilt, ihren Anspruch nach Grund und Höhe schriftlich anmelden, Sicherheit zu leisten, soweit sie nicht Befriedigung verlangen können. Dieses Recht steht den Gläubigern jedoch nur zu, wenn sie glaubhaft machen, dass durch die Verschmelzung die Erfüllung ihrer Forderung gefährdet wird."
    },
    {
      "date": "2025-06-17",
      "id": "112459",
      "original_text": "Löschungsankündigung\nBrandenburg Amtsgericht Cottbus HRA 409\n\"Volman Getränkefachgroßhandel\" Inhaber Manfred Kuntzsch und Volker Effland OHG – Elsterwerda",
      "type": "Löschungsankündigung",
      "state": "Brandenburg",
      "amtsgericht": "Amtsgericht Cottbus",
      "registernummer": "HRA 409",
      "registerart": "HRA",
      "company_name": "\"Volman Getränkefachgroßhandel\" Inhaber Manfred Kuntzsch und Volker Effland OHG",
      "company_seat": "Elsterwerda",
      "details": "17.06.2025 (Bekanntmachungsdatum)\n\nBrandenburg Amtsgericht Cottbus HRA 409\nLöschungsankündigung\n\n\"Volman Getränkefachgroßhandel\" Inhaber Manfred Kuntzsch und Volker Effland OHG\nOffene Handelsgesellschaft\nElsterwerda\n\nIm Handelsregister des Amtsgerichts Cottbus ist unter dem Aktenzeichen HRA 409 CB\ndie \"Volman Getränkefachgroßhandel\" Inhaber Manfred Kuntzsch und Volker Effland OHG mit Sitz in Elsterwerda eingetragen.\n\nEs ist beabsichtigt, die Gesellschaft gem. § 394 FamFG aufgrund Vermögenslosigkeit von Amts wegen zu löschen.\nHiergegen kann innerhalb von 1 Monat Widerspruch eingelegt werden. Der Widerspruch ist durch schriftliche Eingabe oder zu Protokoll der Geschäftsstelle beim Amtsgericht Cottbus zu erheben.\nDie Einreichung kann auch elektronisch erfolgen (allerdings nicht per Email). Weitere Informationen zum elektronischen Rechtsverkehr finden Sie auf der Internetseite des Amtsgerichts Cottbus.\n\nAmtsgericht Cottbus, 13.06.2025"
    },
    {
      "date": "2025-06-17",
      "id": "112460",
      "original_text": "Registerbekanntmachung nach dem Umwandlungsgesetz\nBrandenburg Amtsgericht Potsdam HRB 23759\nTierbestattungszentrum Tierhimmel GmbH – Teltow",
      "type": "Registerbekanntmachung nach dem Umwandlungsgesetz",
      "state": "Brandenburg",
      "amtsgericht": "Amtsgericht Potsdam",
      "registernummer": "HRB 23759",
      "registerart": "HRB",
      "company_name": "Tierbestattungszentrum Tierhimmel GmbH",
      "company_seat": "Teltow",
      "details": "17.06.2025 (Bekanntmachungsdatum)\n\nBrandenburg Amtsgericht Potsdam HRB 23759\nRegisterbekanntmachung nach dem Umwandlungsgesetz 13.06.2025 (Eintragungsdatum)\n\nTierbestattungszentrum Tierhimmel GmbH\nGesellschaft mit beschränkter Haftung\nTeltow\n\nAls nicht eingetragen wird veröffentlicht:\nDen Gläubigern der an der Verschmelzung beteiligten Rechtsträger ist, wenn sie binnen sechs Monaten nach dem Tag, an dem die Eintragung der Verschmelzung in das Register des Sitzes desjenigen Rechtsträgers, dessen Gläubiger sie sind, als bekannt gemacht gilt, ihren Anspruch nach Grund und Höhe schriftlich anmelden, Sicherheit zu leisten, soweit sie nicht Befriedigung verlangen können. Dieses Recht steht den Gläubigern jedoch nur zu, wenn sie glaubhaft machen, dass durch die Verschmelzung die Erfüllung ihrer Forderung gefährdet wird"
    },
    {
      "date": "2025-06-17",
      "id": "112461",
      "original_text": "Registerbekanntmachung nach dem Umwandlungsgesetz\nBaden-Württemberg Amtsgericht Stuttgart HRB 772172\nTC Becker Consult GmbH – Stuttgart",
      "type": "Registerbekanntmachung nach dem Umwandlungsgesetz",
      "state": "Baden-Württemberg",
      "amtsgericht": "Amtsgericht Stuttgart",
      "registernummer": "HRB 772172",
      "registerart": "HRB",
      "company_name": "TC Becker Consult GmbH",
      "company_seat": "Stuttgart",
      "details": "17.06.2025 (Bekanntmachungsdatum)\n\nBaden-Württemberg Amtsgericht Stuttgart HRB 772172\nRegisterbekanntmachung nach dem Umwandlungsgesetz 17.06.2025 (Eintragungsdatum)\n\nTC Becker Consult GmbH\nGesellschaft mit beschränkter Haftung\nStuttgart\n\nAls nicht eingetragen wird bekanntgemacht:\nDen Gläubigern der an der Verschmelzung beteiligten Rechtsträger ist, wenn sie binnen sechs Monaten nach dem Tag, an dem die Eintragung der Verschmelzung in das Register des Sitzes desjenigen Rechtsträgers, dessen Gläubiger sie sind, nach § 19 Abs. 3 UmwG als bekanntgemacht gilt, ihren Anspruch nach Grund und Höhe schriftlich anmelden, Sicherheit zu leisten, soweit sie nicht Befriedigung verlangen können. Dieses Recht steht den Gläubigern jedoch nur zu, wenn sie glaubhaft machen, dass durch die Verschmelzung die Erfüllung ihrer Forderung gefährdet wird."
    },
    {
      "date": "2025-06-17",
      "id": "112462",
      "original_text": "Einreichung neuer Dokumente\nBaden-Württemberg Amtsgericht Stuttgart HRB 200155\nMANN+HUMMEL GmbH – Ludwigsburg",
      "type": "Einreichung neuer Dokumente",
      "state": "Baden-Württemberg",
      "amtsgericht": "Amtsgericht Stuttgart",
      "registernummer": "HRB 200155",
      "registerart": "HRB",
      "company_name": "MANN+HUMMEL GmbH",
      "company_seat": "Ludwigsburg",
      "details": "17.06.2025 (Bekanntmachungsdatum)\n\nBaden-Württemberg Amtsgericht Stuttgart HRB 200155\nEinreichung neuer Dokumente\n\nMANN+HUMMEL GmbH\nGesellschaft mit beschränkter Haftung\nLudwigsburg\n\nDie Gesellschaft hat am 16.06.2025 die Liste über die Zusammensetzung des Aufsichtsrats zum Handelsregister eingereicht."
    },
    {
      "date": "2025-06-17",
      "id": "112463",
      "original_text": "Registerbekanntmachung nach dem Umwandlungsgesetz\nBaden-Württemberg Amtsgericht Stuttgart HRB 762453\nHewlett Packard Enterprise Sales Center GmbH – Böblingen",
      "type": "Registerbekanntmachung nach dem Umwandlungsgesetz",
      "state": "Baden-Württemberg",
      "amtsgericht": "Amtsgericht Stuttgart",
      "registernummer": "HRB 762453",
      "registerart": "HRB",
      "company_name": "Hewlett Packard Enterprise Sales Center GmbH",
      "company_seat": "Böblingen",
      "details": "17.06.2025 (Bekanntmachungsdatum)\n\nBaden-Württemberg Amtsgericht Stuttgart HRB 762453\nRegisterbekanntmachung nach dem Umwandlungsgesetz 17.06.2025 (Eintragungsdatum)\n\nHewlett Packard Enterprise Sales Center GmbH\nGesellschaft mit beschränkter Haftung\nBöblingen\n\nAls nicht eingetragen wird bekanntgemacht:\nDen Gläubigern der an der Verschmelzung beteiligten Rechtsträger ist, wenn sie binnen sechs Monaten nach dem Tag, an dem die Eintragung der Verschmelzung in das Register des Sitzes desjenigen Rechtsträgers, dessen Gläubiger sie sind, nach § 19 Abs. 3 UmwG als bekanntgemacht gilt, ihren Anspruch nach Grund und Höhe schriftlich anmelden, Sicherheit zu leisten, soweit sie nicht Befriedigung verlangen können. Dieses Recht steht den Gläubigern jedoch nur zu, wenn sie glaubhaft machen, dass durch die Verschmelzung die Erfüllung ihrer Forderung gefährdet wird."
    },
    {
      "date": "2025-06-17",
      "id": "112464",
      "original_text": "Registerbekanntmachung nach dem Umwandlungsgesetz\nSachsen Amtsgericht Leipzig HRB 32055\nSTERNAUTO GmbH – Leipzig",
      "type": "Registerbekanntmachung nach dem Umwandlungsgesetz",
      "state": "Sachsen",
      "amtsgericht": "Amtsgericht Leipzig",
      "registernummer": "HRB 32055",
      "registerart": "HRB",
      "company_name": "STERNAUTO GmbH",
      "company_seat": "Leipzig",
      "details": "17.06.2025 (Bekanntmachungsdatum)\n\nSachsen Amtsgericht Leipzig HRB 32055\nRegisterbekanntmachung nach dem Umwandlungsgesetz 17.06.2025 (Eintragungsdatum)\n\nSTERNAUTO GmbH\nGesellschaft mit beschränkter Haftung\nLeipzig\n\nDen Gläubigern der an der Verschmelzung beteiligten Rechtsträger ist, wenn sie binnen sechs Monaten nach dem Tag, an dem die Eintragung der Verschmelzung in das Register des Sitzes desjenigen Rechtsträgers, dessen Gläubiger sie sind, nach § 19 Abs. 3 UmwG als bekannt gemacht gilt, ihren Anspruch nach Grund und Höhe in Textform anmelden, Sicherheit zu leisten, soweit sie nicht Befriedigung verlangen können. Dieses Recht steht den Gläubigern jedoch nur zu, wenn sie glaubhaft machen, dass durch die Verschmelzung die Erfüllung der Forderung gefährdet wird."
    },
    {
      "date": "2025-06-17",
      "id": "112465",
      "original_text": "Registerbekanntmachung nach dem Umwandlungsgesetz\nSachsen Amtsgericht Dresden HRB 16382\nZweite Energieversorgungscenter Dresden-Wilschdorf Verwaltungs GmbH – Dresden",
      "type": "Registerbekanntmachung nach dem Umwandlungsgesetz",
      "state": "Sachsen",
      "amtsgericht": "Amtsgericht Dresden",
      "registernummer": "HRB 16382",
      "registerart": "HRB",
      "company_name": "Zweite Energieversorgungscenter Dresden-Wilschdorf Verwaltungs GmbH",
      "company_seat": "Dresden",
      "details": "17.06.2025 (Bekanntmachungsdatum)\n\nSachsen Amtsgericht Dresden HRB 16382\nRegisterbekanntmachung nach dem Umwandlungsgesetz 17.06.2025 (Eintragungsdatum)\n\nZweite Energieversorgungscenter Dresden-Wilschdorf Verwaltungs GmbH\nGesellschaft mit beschränkter Haftung\nDresden\n\nDen Gläubigern der an der Verschmelzung beteiligten Rechtsträger ist, wenn sie binnen sechs Monaten nach dem Tag, an dem die Eintragung der Verschmelzung in das Register des Sitzes desjenigen Rechtsträgers, dessen Gläubiger sie sind, nach § 19 Abs. 3 UmwG als bekannt gemacht gilt, ihren Anspruch nach Grund und Höhe in Textform anmelden, Sicherheit zu leisten, soweit sie nicht Befriedigung verlangen können. Dieses Recht steht den Gläubigern jedoch nur zu, wenn sie glaubhaft machen, dass durch die Verschmelzung die Erfüllung der Forderung gefährdet wird."
    },
    {
      "date": "2025-06-17",
      "id": "112466",
      "original_text": "Sonstige Registerbekanntmachung\nSachsen Amtsgericht Leipzig HRB 32657\nCryo Express GmbH – Leipzig",
      "type": "Sonstige Registerbekanntmachung",
      "state": "Sachsen",
      "amtsgericht": "Amtsgericht Leipzig",
      "registernummer": "HRB 32657",
      "registerart": "HRB",
      "company_name": "Cryo Express GmbH",
      "company_seat": "Leipzig",
      "details": "17.06.2025 (Bekanntmachungsdatum)\n\nSachsen Amtsgericht Leipzig HRB 32657\nSonstige Registerbekanntmachung 17.06.2025 (Eintragungsdatum)\n\nCryo Express GmbH\nGesellschaft mit beschränkter Haftung\nLeipzig\n\nDen Gläubigern der Gesellschaft, deren Forderungen begründet worden sind bevor die Eintragung der Beendigung des Gewinnabführungsvertrages in das Handelsregister nach § 10 des Handelsgesetzbuches als bekanntgemacht gilt, hat der andere Vertragsteil Sicherheit zu leisten, wenn sie sich binnen sechs Monaten nach der Bekanntmachung der Eintragung zu diesem Zweck bei ihm melden."
    },
    {
      "date": "2025-06-17",
      "id": "112467",
      "original_text": "Registerbekanntmachung nach dem Umwandlungsgesetz\nSachsen Amtsgericht Dresden HRA 3059\nEnergieversorgungscenter Dresden-Wilschdorf GmbH & Co. KG – Dresden",
      "type": "Registerbekanntmachung nach dem Umwandlungsgesetz",
      "state": "Sachsen",
      "amtsgericht": "Amtsgericht Dresden",
      "registernummer": "HRA 3059",
      "registerart": "HRA",
      "company_name": "Energieversorgungscenter Dresden-Wilschdorf GmbH & Co. KG",
      "company_seat": "Dresden",
      "details": "17.06.2025 (Bekanntmachungsdatum)\n\nSachsen Amtsgericht Dresden HRA 3059\nRegisterbekanntmachung nach dem Umwandlungsgesetz 17.06.2025 (Eintragungsdatum)\n\nEnergieversorgungscenter Dresden-Wilschdorf GmbH & Co. KG\nKommanditgesellschaft\nDresden\n\nDen Gläubigern der an der Verschmelzung beteiligten Rechtsträger ist, wenn sie binnen sechs Monaten nach dem Tag, an dem die Eintragung der Verschmelzung in das Register des Sitzes desjenigen Rechtsträgers, dessen Gläubiger sie sind, nach § 19 Abs. 3 UmwG als bekannt gemacht gilt, ihren Anspruch nach Grund und Höhe in Textform anmelden, Sicherheit zu leisten, soweit sie nicht Befriedigung verlangen können. Dieses Recht steht den Gläubigern jedoch nur zu, wenn sie glaubhaft machen, dass durch die Verschmelzung die Erfüllung der Forderung gefährdet wird."
    },
    {
      "date": "2025-06-17",
      "id": "112468",
      "original_text": "Registerbekanntmachung nach dem Umwandlungsgesetz\nSachsen Amtsgericht Leipzig HRB 27408\nLexid UG (haftungsbeschränkt) – Neukieritzsch",
      "type": "Registerbekanntmachung nach dem Umwandlungsgesetz",
      "state": "Sachsen",
      "amtsgericht": "Amtsgericht Leipzig",
      "registernummer": "HRB 27408",
      "registerart": "HRB",
      "company_name": "Lexid UG (haftungsbeschränkt)",
      "company_seat": "Neukieritzsch",
      "details": "17.06.2025 (Bekanntmachungsdatum)\n\nSachsen Amtsgericht Leipzig HRB 27408\nRegisterbekanntmachung nach dem Umwandlungsgesetz 17.06.2025 (Eintragungsdatum)\n\nLexid UG (haftungsbeschränkt)\nGesellschaft mit beschränkter Haftung\nNeukieritzsch\n\nDen Gläubigern der an der Verschmelzung beteiligten Rechtsträger ist, wenn sie binnen sechs Monaten nach dem Tag, an dem die Eintragung der Verschmelzung in das Register des Sitzes desjenigen Rechtsträgers, dessen Gläubiger sie sind, nach § 19 Abs. 3 UmwG als bekannt gemacht gilt, ihren Anspruch nach Grund und Höhe in Textform anmelden, Sicherheit zu leisten, soweit sie nicht Befriedigung verlangen können. Dieses Recht steht den Gläubigern jedoch nur zu, wenn sie glaubhaft machen, dass durch die Verschmelzung die Erfüllung der Forderung gefährdet wird."
    },
    {
      "date": "2025-06-17",
      "id": "112469",
      "original_text": "Registerbekanntmachung nach dem Umwandlungsgesetz\nSachsen Amtsgericht Leipzig HRB 26494\nDeutrik GmbH – Taucha",
      "type": "Registerbekanntmachung nach dem Umwandlungsgesetz",
      "state": "Sachsen",
      "amtsgericht": "Amtsgericht Leipzig",
      "registernummer": "HRB 26494",
      "registerart": "HRB",
      "company_name": "Deutrik GmbH",
      "company_seat": "Taucha",
      "details": "17.06.2025 (Bekanntmachungsdatum)\n\nSachsen Amtsgericht Leipzig HRB 26494\nRegisterbekanntmachung nach dem Umwandlungsgesetz 17.06.2025 (Eintragungsdatum)\n\nDeutrik GmbH\nGesellschaft mit beschränkter Haftung\nTaucha\n\nDen Gläubigern der an der Verschmelzung beteiligten Rechtsträger ist, wenn sie binnen sechs Monaten nach dem Tag, an dem die Eintragung der Verschmelzung in das Register des Sitzes desjenigen Rechtsträgers, dessen Gläubiger sie sind, nach § 19 Abs. 3 UmwG als bekannt gemacht gilt, ihren Anspruch nach Grund und Höhe in Textform anmelden, Sicherheit zu leisten, soweit sie nicht Befriedigung verlangen können. Dieses Recht steht den Gläubigern jedoch nur zu, wenn sie glaubhaft machen, dass durch die Verschmelzung die Erfüllung der Forderung gefährdet wird."
    },
    {
      "date": "2025-06-17",
      "id": "112470",
      "original_text": "Löschungsankündigung\nSachsen Amtsgericht Dresden HRB 33201\nWUNOVO UG (haftungsbeschränkt) – Dresden",
      "type": "Löschungsankündigung",
      "state": "Sachsen",
      "amtsgericht": "Amtsgericht Dresden",
      "registernummer": "HRB 33201",
      "registerart": "HRB",
      "company_name": "WUNOVO UG (haftungsbeschränkt)",
      "company_seat": "Dresden",
      "details": "17.06.2025 (Bekanntmachungsdatum)\n\nSachsen Amtsgericht Dresden HRB 33201\nLöschungsankündigung\n\nWUNOVO UG (haftungsbeschränkt)\nGesellschaft mit beschränkter Haftung\nDresden\n\nDas Registergericht beabsichtigt, die im Handelsregister eingetragene Gesellschaft von Amts wegen nach § 394 FamFG zu löschen. Die Frist zu Erhebung eines Widerspruchs gegen die beabsichtigte Löschung wird auf einen Monat festgesetzt."
    },
    {
      "date": "2025-06-17",
      "id": "112471",
      "original_text": "Löschungsankündigung\nSachsen Amtsgericht Dresden HRB 21104\nSpatial View GmbH – Dresden",
      "type": "Löschungsankündigung",
      "state": "Sachsen",
      "amtsgericht": "Amtsgericht Dresden",
      "registernummer": "HRB 21104",
      "registerart": "HRB",
      "company_name": "Spatial View GmbH",
      "company_seat": "Dresden",
      "details": "17.06.2025 (Bekanntmachungsdatum)\n\nSachsen Amtsgericht Dresden HRB 21104\nLöschungsankündigung\n\nSpatial View GmbH\nGesellschaft mit beschränkter Haftung\nDresden\n\nDas Registergericht beabsichtigt, die im Handelsregister eingetragene Gesellschaft von Amts wegen nach § 394 FamFG zu löschen. Die Frist zu Erhebung eines Widerspruchs gegen die beabsichtigte Löschung wird auf einen Monat festgesetzt."
    },
    {
      "date": "2025-06-17",
      "id": "112472",
      "original_text": "Registerbekanntmachung nach dem Umwandlungsgesetz\nNiedersachsen Amtsgericht Aurich HRB 200600\nMagnus de Wall Verwaltungsgesellschaft mbH – Rhauderfehn",
      "type": "Registerbekanntmachung nach dem Umwandlungsgesetz",
      "state": "Niedersachsen",
      "amtsgericht": "Amtsgericht Aurich",
      "registernummer": "HRB 200600",
      "registerart": "HRB",
      "company_name": "Magnus de Wall Verwaltungsgesellschaft mbH",
      "company_seat": "Rhauderfehn",
      "details": "17.06.2025 (Bekanntmachungsdatum)\n\nNiedersachsen Amtsgericht Aurich HRB 200600\nRegisterbekanntmachung nach dem Umwandlungsgesetz 17.06.2025 (Eintragungsdatum)\n\nMagnus de Wall Verwaltungsgesellschaft mbH\nGesellschaft mit beschränkter Haftung\nRhauderfehn\n\nDen Gläubigern der an der Verschmelzung beteiligten Rechtsträger ist, wenn sie binnen sechs Monaten nach dem Tag, an dem die Eintragung der Verschmelzung in das Register des Sitzes desjenigen Rechtsträgers, dessen Gläubiger sie sind, nach § 19  Abs.  3 UmwG als bekannt gemacht gilt, ihren Anspruch nach Grund und Höhe schriftlich anmelden, Sicherheit zu leisten, soweit sie nicht Befriedigung verlangen können. Dieses Recht steht den Gläubigern jedoch nur zu, wenn sie glaubhaft machen, dass durch die Verschmelzung die Erfüllung der Forderung gefährdet wird."
    },
    {
      "date": "2025-06-17",
      "id": "112473",
      "original_text": "Registerbekanntmachung nach dem Umwandlungsgesetz\nNiedersachsen Amtsgericht Walsrode HRB 121896\nPlate Büromaterial Vertriebs GmbH – Lilienthal",
      "type": "Registerbekanntmachung nach dem Umwandlungsgesetz",
      "state": "Niedersachsen",
      "amtsgericht": "Amtsgericht Walsrode",
      "registernummer": "HRB 121896",
      "registerart": "HRB",
      "company_name": "Plate Büromaterial Vertriebs GmbH",
      "company_seat": "Lilienthal",
      "details": "17.06.2025 (Bekanntmachungsdatum)\n\nNiedersachsen Amtsgericht Walsrode HRB 121896\nRegisterbekanntmachung nach dem Umwandlungsgesetz 17.06.2025 (Eintragungsdatum)\n\nPlate Büromaterial Vertriebs GmbH\nGesellschaft mit beschränkter Haftung\nLilienthal\n\nDen Gläubigern der an der Verschmelzung beteiligten Rechtsträger ist, wenn sie binnen sechs Monaten nach dem Tag, an dem die Eintragung der Verschmelzung in das Register des Sitzes desjenigen Rechtsträgers, dessen Gläubiger sie sind, nach § 19  Abs.  3 UmwG als bekannt gemacht gilt, ihren Anspruch nach Grund und Höhe schriftlich anmelden, Sicherheit zu leisten, soweit sie nicht Befriedigung verlangen können. Dieses Recht steht den Gläubigern jedoch nur zu, wenn sie glaubhaft machen, dass durch die Verschmelzung die Erfüllung der Forderung gefährdet wird."
    },
    {
      "date": "2025-06-17",
      "id": "112474",
      "original_text": "Registerbekanntmachung nach dem Umwandlungsgesetz\nNiedersachsen Amtsgericht Hannover HRB 223824\nCaplantic ESG Solutions GmbH – Hannover",
      "type": "Registerbekanntmachung nach dem Umwandlungsgesetz",
      "state": "Niedersachsen",
      "amtsgericht": "Amtsgericht Hannover",
      "registernummer": "HRB 223824",
      "registerart": "HRB",
      "company_name": "Caplantic ESG Solutions GmbH",
      "company_seat": "Hannover",
      "details": "17.06.2025 (Bekanntmachungsdatum)\n\nNiedersachsen Amtsgericht Hannover HRB 223824\nRegisterbekanntmachung nach dem Umwandlungsgesetz 17.06.2025 (Eintragungsdatum)\n\nCaplantic ESG Solutions GmbH\nGesellschaft mit beschränkter Haftung\nHannover\n\nDen Gläubigern der an der Verschmelzung beteiligten Rechtsträger ist, wenn sie binnen sechs Monaten nach dem Tag, an dem die Eintragung der Verschmelzung in das Register des Sitzes desjenigen Rechtsträgers, dessen Gläubiger sie sind, nach § 19  Abs.  3 UmwG als bekannt gemacht gilt, ihren Anspruch nach Grund und Höhe schriftlich anmelden, Sicherheit zu leisten, soweit sie nicht Befriedigung verlangen können. Dieses Recht steht den Gläubigern jedoch nur zu, wenn sie glaubhaft machen, dass durch die Verschmelzung die Erfüllung der Forderung gefährdet wird."
    },
    {
      "date": "2025-06-17",
      "id": "112475",
      "original_text": "Einreichung neuer Dokumente\nNiedersachsen Amtsgericht Braunschweig HRB 5191\nISR Information Products AG – Braunschweig",
      "type": "Einreichung neuer Dokumente",
      "state": "Niedersachsen",
      "amtsgericht": "Amtsgericht Braunschweig",
      "registernummer": "HRB 5191",
      "registerart": "HRB",
      "company_name": "ISR Information Products AG",
      "company_seat": "Braunschweig",
      "details": "17.06.2025 (Bekanntmachungsdatum)\n\nNiedersachsen Amtsgericht Braunschweig HRB 5191\nEinreichung neuer Dokumente 17.06.2025 (Eintragungsdatum)\n\nISR Information Products AG\nAktiengesellschaft\nBraunschweig\n\nDie Liste der Mitglieder des Aufsichtsrats wurde beim Registergericht eingereicht."
    },
    {
      "date": "2025-06-17",
      "id": "112476",
      "original_text": "Registerbekanntmachung nach dem Umwandlungsgesetz\nNiedersachsen Amtsgericht Hannover HRB 221925\nflaschenpost Hannover DEX GmbH – Hannover",
      "type": "Registerbekanntmachung nach dem Umwandlungsgesetz",
      "state": "Niedersachsen",
      "amtsgericht": "Amtsgericht Hannover",
      "registernummer": "HRB 221925",
      "registerart": "HRB",
      "company_name": "flaschenpost Hannover DEX GmbH",
      "company_seat": "Hannover",
      "details": "17.06.2025 (Bekanntmachungsdatum)\n\nNiedersachsen Amtsgericht Hannover HRB 221925\nRegisterbekanntmachung nach dem Umwandlungsgesetz 17.06.2025 (Eintragungsdatum)\n\nflaschenpost Hannover DEX GmbH\nGesellschaft mit beschränkter Haftung\nHannover\n\nDen Gläubigern der an der Verschmelzung beteiligten Rechtsträger ist, wenn sie binnen sechs Monaten nach dem Tag, an dem die Eintragung der Verschmelzung in das Register des Sitzes desjenigen Rechtsträgers, dessen Gläubiger sie sind, nach § 19  Abs.  3 UmwG als bekannt gemacht gilt, ihren Anspruch nach Grund und Höhe schriftlich anmelden, Sicherheit zu leisten, soweit sie nicht Befriedigung verlangen können. Dieses Recht steht den Gläubigern jedoch nur zu, wenn sie glaubhaft machen, dass durch die Verschmelzung die Erfüllung der Forderung gefährdet wird."
    },
    {
      "date": "2025-06-17",
      "id": "112477",
      "original_text": "Einreichung neuer Dokumente\nNiedersachsen Amtsgericht Osnabrück HRB 110386 früher Amtsgericht Bad Iburg\nGeorgsmarienhütte Holding GmbH – Georgsmarienhütte",
      "type": "Einreichung neuer Dokumente",
      "state": "Niedersachsen",
      "amtsgericht": "Amtsgericht Osnabrück",
      "registernummer": "HRB 110386",
      "registerart": "HRB",
      "company_name": "Georgsmarienhütte Holding GmbH",
      "company_seat": "Georgsmarienhütte",
      "former_amtsgericht": "Bad Iburg",
      "details": "17.06.2025 (Bekanntmachungsdatum)\n\nNiedersachsen Amtsgericht Osnabrück HRB 110386 früher Amtsgericht Bad Iburg\nEinreichung neuer Dokumente\n\nGeorgsmarienhütte Holding GmbH\nGesellschaft mit beschränkter Haftung\nGeorgsmarienhütte\n\nDie Liste der Mitglieder des Aufsichtsrats wurde beim Registergericht eingereicht."
    },
    {
      "date": "2025-06-17",
      "id": "112478",
      "original_text": "Registerbekanntmachung nach dem Umwandlungsgesetz\nNiedersachsen Amtsgericht Hannover HRB 218294\nCaplantic Service GmbH – Hannover",
      "type": "Registerbekanntmachung nach dem Umwandlungsgesetz",
      "state": "Niedersachsen",
      "amtsgericht": "Amtsgericht Hannover",
      "registernummer": "HRB 218294",
      "registerart": "HRB",
      "company_name": "Caplantic Service GmbH",
      "company_seat": "Hannover",
      "details": "17.06.2025 (Bekanntmachungsdatum)\n\nNiedersachsen Amtsgericht Hannover HRB 218294\nRegisterbekanntmachung nach dem Umwandlungsgesetz 17.06.2025 (Eintragungsdatum)\n\nCaplantic Service GmbH\nGesellschaft mit beschränkter Haftung\nHannover\n\nDen Gläubigern der an der Verschmelzung beteiligten Rechtsträger ist, wenn sie binnen sechs Monaten nach dem Tag, an dem die Eintragung der Verschmelzung in das Register des Sitzes desjenigen Rechtsträgers, dessen Gläubiger sie sind, nach § 19  Abs.  3 UmwG als bekannt gemacht gilt, ihren Anspruch nach Grund und Höhe schriftlich anmelden, Sicherheit zu leisten, soweit sie nicht Befriedigung verlangen können. Dieses Recht steht den Gläubigern jedoch nur zu, wenn sie glaubhaft machen, dass durch die Verschmelzung die Erfüllung der Forderung gefährdet wird."
    },
    {
      "date": "2025-06-17",
      "id": "112479",
      "original_text": "Löschungsankündigung\nNiedersachsen Amtsgericht Braunschweig HRA 110474 früher Amtsgericht Goslar\nAugust Jacobi – Clausthal-Zellerfeld",
      "type": "Löschungsankündigung",
      "state": "Niedersachsen",
      "amtsgericht": "Amtsgericht Braunschweig",
      "registernummer": "HRA 110474",
      "registerart": "HRA",
      "company_name": "August Jacobi",
      "company_seat": "Clausthal-Zellerfeld",
      "former_amtsgericht": "Goslar",
      "details": "17.06.2025 (Bekanntmachungsdatum)\n\nNiedersachsen Amtsgericht Braunschweig HRA 110474 früher Amtsgericht Goslar\nLöschungsankündigung\n\nAugust Jacobi\nEinzelkaufmann / Einzelkauffrau\nClausthal-Zellerfeld\n\nDas Registergericht beabsichtigt, die Firma von Amts wegen nach § 31 Abs. 2 Satz 2 HGB, § 393 FamFG zu löschen. Die Frist zur Erhebung eines Widerspruchs ist auf 1 Monat ab dieser Registerbekanntmachung festgesetzt."
    },
    {
      "date": "2025-06-17",
      "id": "112480",
      "original_text": "Registerbekanntmachung nach dem Umwandlungsgesetz\nNiedersachsen Amtsgericht Hannover HRB 206788\nATLAS TITAN Mitte GmbH – Isernhagen",
      "type": "Registerbekanntmachung nach dem Umwandlungsgesetz",
      "state": "Niedersachsen",
      "amtsgericht": "Amtsgericht Hannover",
      "registernummer": "HRB 206788",
      "registerart": "HRB",
      "company_name": "ATLAS TITAN Mitte GmbH",
      "company_seat": "Isernhagen",
      "details": "17.06.2025 (Bekanntmachungsdatum)\n\nNiedersachsen Amtsgericht Hannover HRB 206788\nRegisterbekanntmachung nach dem Umwandlungsgesetz 17.06.2025 (Eintragungsdatum)\n\nATLAS TITAN Mitte GmbH\nGesellschaft mit beschränkter Haftung\nIsernhagen\n\nDen Gläubigern der an der Verschmelzung beteiligten Rechtsträger ist, wenn sie binnen sechs Monaten nach dem Tag, an dem die Eintragung der Verschmelzung in das Register des Sitzes desjenigen Rechtsträgers, dessen Gläubiger sie sind, nach § 19  Abs.  3 UmwG als bekannt gemacht gilt, ihren Anspruch nach Grund und Höhe schriftlich anmelden, Sicherheit zu leisten, soweit sie nicht Befriedigung verlangen können. Dieses Recht steht den Gläubigern jedoch nur zu, wenn sie glaubhaft machen, dass durch die Verschmelzung die Erfüllung der Forderung gefährdet wird."
    },
    {
      "date": "2025-06-17",
      "id": "112481",
      "original_text": "Registerbekanntmachung nach dem Umwandlungsgesetz\nNiedersachsen Amtsgericht Hannover HRB 224318\nNeoVinci UG (haftungsbeschränkt) – Hannover",
      "type": "Registerbekanntmachung nach dem Umwandlungsgesetz",
      "state": "Niedersachsen",
      "amtsgericht": "Amtsgericht Hannover",
      "registernummer": "HRB 224318",
      "registerart": "HRB",
      "company_name": "NeoVinci UG (haftungsbeschränkt)",
      "company_seat": "Hannover",
      "details": "17.06.2025 (Bekanntmachungsdatum)\n\nNiedersachsen Amtsgericht Hannover HRB 224318\nRegisterbekanntmachung nach dem Umwandlungsgesetz 17.06.2025 (Eintragungsdatum)\n\nNeoVinci UG (haftungsbeschränkt)\nGesellschaft mit beschränkter Haftung\nHannover\n\nDen Gläubigern der an der Verschmelzung beteiligten Rechtsträger ist, wenn sie binnen sechs Monaten nach dem Tag, an dem die Eintragung der Verschmelzung in das Register des Sitzes desjenigen Rechtsträgers, dessen Gläubiger sie sind, nach § 19  Abs.  3 UmwG als bekannt gemacht gilt, ihren Anspruch nach Grund und Höhe schriftlich anmelden, Sicherheit zu leisten, soweit sie nicht Befriedigung verlangen können. Dieses Recht steht den Gläubigern jedoch nur zu, wenn sie glaubhaft machen, dass durch die Verschmelzung die Erfüllung der Forderung gefährdet wird."
    },
    {
      "date": "2025-06-17",
      "id": "112482",
      "original_text": "Einreichung neuer Dokumente\nNiedersachsen Amtsgericht Braunschweig HRB 9371\nAllianz für die Region GmbH – Braunschweig",
      "type": "Einreichung neuer Dokumente",
      "state": "Niedersachsen",
      "amtsgericht": "Amtsgericht Braunschweig",
      "registernummer": "HRB 9371",
      "registerart": "HRB",
      "company_name": "Allianz für die Region GmbH",
      "company_seat": "Braunschweig",
      "details": "17.06.2025 (Bekanntmachungsdatum)\n\nNiedersachsen Amtsgericht Braunschweig HRB 9371\nEinreichung neuer Dokumente 17.06.2025 (Eintragungsdatum)\n\nAllianz für die Region GmbH\nGesellschaft mit beschränkter Haftung\nBraunschweig\n\nDie Liste der Mitglieder des Aufsichtsrats wurde beim Registergericht eingereicht."
    },
    {
      "date": "2025-06-17",
      "id": "112483",
      "original_text": "Registerbekanntmachung nach dem Umwandlungsgesetz\nNiedersachsen Amtsgericht Osnabrück HRB 19921\nRosengarten GmbH – Badbergen",
      "type": "Registerbekanntmachung nach dem Umwandlungsgesetz",
      "state": "Niedersachsen",
      "amtsgericht": "Amtsgericht Osnabrück",
      "registernummer": "HRB 19921",
      "registerart": "HRB",
      "company_name": "Rosengarten GmbH",
      "company_seat": "Badbergen",
      "details": "17.06.2025 (Bekanntmachungsdatum)\n\nNiedersachsen Amtsgericht Osnabrück HRB 19921\nRegisterbekanntmachung nach dem Umwandlungsgesetz 17.06.2025 (Eintragungsdatum)\n\nRosengarten GmbH\nGesellschaft mit beschränkter Haftung\nBadbergen\n\nDen Gläubigern der an der Verschmelzung beteiligten Rechtsträger ist, wenn sie binnen sechs Monaten nach dem Tag, an dem die Eintragung der Verschmelzung in das Register des Sitzes desjenigen Rechtsträgers, dessen Gläubiger sie sind, nach § 19  Abs.  3 UmwG als bekannt gemacht gilt, ihren Anspruch nach Grund und Höhe schriftlich anmelden, Sicherheit zu leisten, soweit sie nicht Befriedigung verlangen können. Dieses Recht steht den Gläubigern jedoch nur zu, wenn sie glaubhaft machen, dass durch die Verschmelzung die Erfüllung der Forderung gefährdet wird."
    },
    {
      "date": "2025-06-17",
      "id": "112484",
      "original_text": "Löschungsankündigung\nNiedersachsen Amtsgericht Braunschweig HRB 203407\nmanufaktur-leuchten Holland & Holland UG (haftungsbeschränkt) – Wolfenbüttel",
      "type": "Löschungsankündigung",
      "state": "Niedersachsen",
      "amtsgericht": "Amtsgericht Braunschweig",
      "registernummer": "HRB 203407",
      "registerart": "HRB",
      "company_name": "manufaktur-leuchten Holland & Holland UG (haftungsbeschränkt)",
      "company_seat": "Wolfenbüttel",
      "details": "17.06.2025 (Bekanntmachungsdatum)\n\nNiedersachsen Amtsgericht Braunschweig HRB 203407\nLöschungsankündigung\n\nmanufaktur-leuchten Holland & Holland UG (haftungsbeschränkt)\nGesellschaft mit beschränkter Haftung\nWolfenbüttel\n\nDas Registergericht beabsichtigt, die Gesellschaft von Amts wegen nach § 394 FamFG zu löschen. Die Frist zur Erhebung eines Widerspruchs ist auf 1 Monat ab dieser Registerbekanntmachung festgesetzt."
    },
    {
      "date": "2025-06-17",
      "id": "112485",
      "original_text": "Löschungsankündigung\nNiedersachsen Amtsgericht Braunschweig HRB 207317\nFritteusen Management Salzgitter GmbH – Salzgitter",
      "type": "Löschungsankündigung",
      "state": "Niedersachsen",
      "amtsgericht": "Amtsgericht Braunschweig",
      "registernummer": "HRB 207317",
      "registerart": "HRB",
      "company_name": "Fritteusen Management Salzgitter GmbH",
      "company_seat": "Salzgitter",
      "details": "17.06.2025 (Bekanntmachungsdatum)\n\nNiedersachsen Amtsgericht Braunschweig HRB 207317\nLöschungsankündigung\n\nFritteusen Management Salzgitter GmbH\nGesellschaft mit beschränkter Haftung\nSalzgitter\n\nDas Registergericht beabsichtigt, die Gesellschaft von Amts wegen nach § 394 FamFG zu löschen. Die Frist zur Erhebung eines Widerspruchs ist auf 1 Monat ab dieser Registerbekanntmachung festgesetzt."
    },
    {
      "date": "2025-06-17",
      "id": "112486",
      "original_text": "Einreichung neuer Dokumente\nNiedersachsen Amtsgericht Göttingen HRB 206039\nArineo Holding GmbH – Göttingen",
      "type": "Einreichung neuer Dokumente",
      "state": "Niedersachsen",
      "amtsgericht": "Amtsgericht Göttingen",
      "registernummer": "HRB 206039",
      "registerart": "HRB",
      "company_name": "Arineo Holding GmbH",
      "company_seat": "Göttingen",
      "details": "17.06.2025 (Bekanntmachungsdatum)\n\nNiedersachsen Amtsgericht Göttingen HRB 206039\nEinreichung neuer Dokumente\n\nArineo Holding GmbH\nGesellschaft mit beschränkter Haftung\nGöttingen\n\nDie Liste der Mitglieder des Aufsichtsrats wurde beim Registergericht eingereicht."
    },
    {
      "date": "2025-06-17",
      "id": "112487",
      "original_text": "Einreichung neuer Dokumente\nNiedersachsen Amtsgericht Lüneburg HRB 101177 früher Amtsgericht Celle\nallerland Immobilien GmbH – Celle",
      "type": "Einreichung neuer Dokumente",
      "state": "Niedersachsen",
      "amtsgericht": "Amtsgericht Lüneburg",
      "registernummer": "HRB 101177",
      "registerart": "HRB",
      "company_name": "allerland Immobilien GmbH",
      "company_seat": "Celle",
      "former_amtsgericht": "Celle",
      "details": "17.06.2025 (Bekanntmachungsdatum)\n\nNiedersachsen Amtsgericht Lüneburg HRB 101177 früher Amtsgericht Celle\nEinreichung neuer Dokumente\n\nallerland Immobilien GmbH\nGesellschaft mit beschränkter Haftung\nCelle\n\nDie Liste der Mitglieder des Aufsichtsrats wurde beim Registergericht eingereicht."
    },
    {
      "date": "2025-06-17",
      "id": "112488",
      "original_text": "Registerbekanntmachung nach dem Umwandlungsgesetz\nBremen Amtsgericht Bremen HRB 32967\nNehlsen Kanal- und Abwasserservice Beteiligungs-GmbH – Bremen",
      "type": "Registerbekanntmachung nach dem Umwandlungsgesetz",
      "state": "Bremen",
      "amtsgericht": "Amtsgericht Bremen",
      "registernummer": "HRB 32967",
      "registerart": "HRB",
      "company_name": "Nehlsen Kanal- und Abwasserservice Beteiligungs-GmbH",
      "company_seat": "Bremen",
      "details": "17.06.2025 (Bekanntmachungsdatum)\n\nBremen Amtsgericht Bremen HRB 32967\nRegisterbekanntmachung nach dem Umwandlungsgesetz 16.06.2025 (Eintragungsdatum)\n\nNehlsen Kanal- und Abwasserservice Beteiligungs-GmbH\nGesellschaft mit beschränkter Haftung\nBremen\n\nZu Eintragungsnummer 8 vom 16.06.2025 wird als nicht eingetragen veröffentlicht:\nDen Gläubigern der an der Verschmelzung beteiligten Rechtsträger ist, wenn sie binnen sechs Monaten nach dem Tag, an dem die Eintragung der Verschmelzung in das Register des Sitzes desjenigen Rechtsträgers, dessen Gläubiger sie sind, als bekannt gemacht gilt, ihren Anspruch nach Grund und Höhe schriftlich anmelden, Sicherheit zu leisten, soweit sie nicht Befriedigung verlangen können. Dieses Recht steht den Gläubigern jedoch nur zu, wenn sie glaubhaft machen, dass durch die Verschmelzung die Erfüllung ihrer Forderung gefährdet wird. Das Recht, Sicherheitsleistung zu verlangen, steht Gläubigern nicht zu, die im Falle der Insolvenz ein Recht auf vorzugsweise Befriedigung aus einer Deckungsmasse haben, die nach gesetzlicher Vorschrift zu ihrem Schutz errichtet und staatlich überwacht ist."
    },
    {
      "date": "2025-06-17",
      "id": "112489",
      "original_text": "Registerbekanntmachung nach dem Umwandlungsgesetz\nBremen Amtsgericht Bremen HRB 33719\nNehlsen Industrieservice Beteiligungs-GmbH – Bremen",
      "type": "Registerbekanntmachung nach dem Umwandlungsgesetz",
      "state": "Bremen",
      "amtsgericht": "Amtsgericht Bremen",
      "registernummer": "HRB 33719",
      "registerart": "HRB",
      "company_name": "Nehlsen Industrieservice Beteiligungs-GmbH",
      "company_seat": "Bremen",
      "details": "17.06.2025 (Bekanntmachungsdatum)\n\nBremen Amtsgericht Bremen HRB 33719\nRegisterbekanntmachung nach dem Umwandlungsgesetz 16.06.2025 (Eintragungsdatum)\n\nNehlsen Industrieservice Beteiligungs-GmbH\nGesellschaft mit beschränkter Haftung\nBremen\n\nZu Eintragungsnummer 10 vom 16.06.2025 wird als nicht eingetragen veröffentlicht:\nDen Gläubigern der an der Verschmelzung beteiligten Rechtsträger ist, wenn sie binnen sechs Monaten nach dem Tag, an dem die Eintragung der Verschmelzung in das Register des Sitzes desjenigen Rechtsträgers, dessen Gläubiger sie sind, als bekannt gemacht gilt, ihren Anspruch nach Grund und Höhe schriftlich anmelden, Sicherheit zu leisten, soweit sie nicht Befriedigung verlangen können. Dieses Recht steht den Gläubigern jedoch nur zu, wenn sie glaubhaft machen, dass durch die Verschmelzung die Erfüllung ihrer Forderung gefährdet wird. Das Recht, Sicherheitsleistung zu verlangen, steht Gläubigern nicht zu, die im Falle der Insolvenz ein Recht auf vorzugsweise Befriedigung aus einer Deckungsmasse haben, die nach gesetzlicher Vorschrift zu ihrem Schutz errichtet und staatlich überwacht ist."
    },
    {
      "date": "2025-06-17",
      "id": "112490",
      "original_text": "Registerbekanntmachung nach dem Umwandlungsgesetz\nBremen Amtsgericht Bremen HRA 28006\nNehlsen Kanal- und Abwasserservice GmbH & Co. KG – Bremen",
      "type": "Registerbekanntmachung nach dem Umwandlungsgesetz",
      "state": "Bremen",
      "amtsgericht": "Amtsgericht Bremen",
      "registernummer": "HRA 28006",
      "registerart": "HRA",
      "company_name": "Nehlsen Kanal- und Abwasserservice GmbH & Co. KG",
      "company_seat": "Bremen",
      "details": "17.06.2025 (Bekanntmachungsdatum)\n\nBremen Amtsgericht Bremen HRA 28006\nRegisterbekanntmachung nach dem Umwandlungsgesetz 16.06.2025 (Eintragungsdatum)\n\nNehlsen Kanal- und Abwasserservice GmbH & Co. KG\nKommanditgesellschaft\nBremen\n\nZu Eintragungsnummer 11 vom 16.06.2025 wird als nicht eingetragen veröffentlicht:\nDen Gläubigern der an der Verschmelzung beteiligten Rechtsträger ist, wenn sie binnen sechs Monaten nach dem Tag, an dem die Eintragung der Verschmelzung in das Register des Sitzes desjenigen Rechtsträgers, dessen Gläubiger sie sind, als bekannt gemacht gilt, ihren Anspruch nach Grund und Höhe schriftlich anmelden, Sicherheit zu leisten, soweit sie nicht Befriedigung verlangen können. Dieses Recht steht den Gläubigern jedoch nur zu, wenn sie glaubhaft machen, dass durch die Verschmelzung die Erfüllung ihrer Forderung gefährdet wird. Das Recht, Sicherheitsleistung zu verlangen, steht Gläubigern nicht zu, die im Falle der Insolvenz ein Recht auf vorzugsweise Befriedigung aus einer Deckungsmasse haben, die nach gesetzlicher Vorschrift zu ihrem Schutz errichtet und staatlich überwacht ist."
    },
    {
      "date": "2025-06-17",
      "id": "112491",
      "original_text": "Registerbekanntmachung nach dem Umwandlungsgesetz\nBremen Amtsgericht Bremen HRA 28215\nNehlsen Industrieservice GmbH & Co. KG – Bremen",
      "type": "Registerbekanntmachung nach dem Umwandlungsgesetz",
      "state": "Bremen",
      "amtsgericht": "Amtsgericht Bremen",
      "registernummer": "HRA 28215",
      "registerart": "HRA",
      "company_name": "Nehlsen Industrieservice GmbH & Co. KG",
      "company_seat": "Bremen",
      "details": "17.06.2025 (Bekanntmachungsdatum)\n\nBremen Amtsgericht Bremen HRA 28215\nRegisterbekanntmachung nach dem Umwandlungsgesetz 16.06.2025 (Eintragungsdatum)\n\nNehlsen Industrieservice GmbH & Co. KG\nKommanditgesellschaft\nBremen\n\nZu Eintragungsnummer 8 vom 16.06.2025 wird als nicht eingetragen veröffentlicht:\nDen Gläubigern der an der Verschmelzung beteiligten Rechtsträger ist, wenn sie binnen sechs Monaten nach dem Tag, an dem die Eintragung der Verschmelzung in das Register des Sitzes desjenigen Rechtsträgers, dessen Gläubiger sie sind, als bekannt gemacht gilt, ihren Anspruch nach Grund und Höhe schriftlich anmelden, Sicherheit zu leisten, soweit sie nicht Befriedigung verlangen können. Dieses Recht steht den Gläubigern jedoch nur zu, wenn sie glaubhaft machen, dass durch die Verschmelzung die Erfüllung ihrer Forderung gefährdet wird. Das Recht, Sicherheitsleistung zu verlangen, steht Gläubigern nicht zu, die im Falle der Insolvenz ein Recht auf vorzugsweise Befriedigung aus einer Deckungsmasse haben, die nach gesetzlicher Vorschrift zu ihrem Schutz errichtet und staatlich überwacht ist."
    },
    {
      "date": "2025-06-17",
      "id": "112492",
      "original_text": "Löschungsankündigung\nBremen Amtsgericht Bremen HRB 28026\nPastizzeria La Fenice GmbH – Bremen",
      "type": "Löschungsankündigung",
      "state": "Bremen",
      "amtsgericht": "Amtsgericht Bremen",
      "registernummer": "HRB 28026",
      "registerart": "HRB",
      "company_name": "Pastizzeria La Fenice GmbH",
      "company_seat": "Bremen",
      "details": "17.06.2025 (Bekanntmachungsdatum)\n\nBremen Amtsgericht Bremen HRB 28026\nLöschungsankündigung\n\nPastizzeria La Fenice GmbH\nGesellschaft mit beschränkter Haftung\nBremen\n\nEs ist beabsichtigt die im Handelsregister eingetragene Gesellschaft von Amts wegen gemäß § 394 FamFG zu löschen. Gegen die Löschung kann beim AG Bremen schriftlich oder zu Protokoll der Geschäftsstelle Widerspruch eingelegt werden. Widerspruchsfrist 4 Wochen."
    },
    {
      "date": "2025-06-17",
      "id": "112493",
      "original_text": "Registerbekanntmachung nach dem Umwandlungsgesetz\nRheinland-Pfalz Amtsgericht Mainz HRB 49249\nM&M Network-Ing UG (haftungsbeschränkt) – Mainz",
      "type": "Registerbekanntmachung nach dem Umwandlungsgesetz",
      "state": "Rheinland-Pfalz",
      "amtsgericht": "Amtsgericht Mainz",
      "registernummer": "HRB 49249",
      "registerart": "HRB",
      "company_name": "M&M Network-Ing UG (haftungsbeschränkt)",
      "company_seat": "Mainz",
      "details": "17.06.2025 (Bekanntmachungsdatum)\n\nRheinland-Pfalz Amtsgericht Mainz HRB 49249\nRegisterbekanntmachung nach dem Umwandlungsgesetz 17.06.2025 (Eintragungsdatum)\n\nM&M Network-Ing UG (haftungsbeschränkt)\nGesellschaft mit beschränkter Haftung\nMainz\n\nDen Gläubigern der an der Verschmelzung beteiligten Rechtsträger ist, wenn sie binnen sechs Monaten nach dem Tag, an dem die Eintragung der Verschmelzung in das Register des Sitzes desjenigen Rechtsträgers, dessen Gläubiger sie sind, nach § 19 Absatz 3 UmwG als bekanntgemacht gilt, ihren Anspruch nach Grund und Höhe schriftlich anmelden, Sicherheit zu leisten, soweit sie nicht Befriedigung verlangen können. Dieses Recht steht den Gläubigern jedoch nur zu, wenn sie glaubhaft machen, dass durch die Verschmelzung die Erfüllung ihrer Forderung gefährdet wird."
    },
    {
      "date": "2025-06-17",
      "id": "112494",
      "original_text": "Registerbekanntmachung nach dem Umwandlungsgesetz\nRheinland-Pfalz Amtsgericht Bad Kreuznach HRB 22149\nDirektvertriebsholding DACH GmbH – Rümmelsheim",
      "type": "Registerbekanntmachung nach dem Umwandlungsgesetz",
      "state": "Rheinland-Pfalz",
      "amtsgericht": "Amtsgericht Bad Kreuznach",
      "registernummer": "HRB 22149",
      "registerart": "HRB",
      "company_name": "Direktvertriebsholding DACH GmbH",
      "company_seat": "Rümmelsheim",
      "details": "17.06.2025 (Bekanntmachungsdatum)\n\nRheinland-Pfalz Amtsgericht Bad Kreuznach HRB 22149\nRegisterbekanntmachung nach dem Umwandlungsgesetz 17.06.2025 (Eintragungsdatum)\n\nDirektvertriebsholding DACH GmbH\nGesellschaft mit beschränkter Haftung\nRümmelsheim\n\nAls nicht eingetragen wird veröffentlicht: Den Gläubigern der an der Verschmelzung beteiligten Rechtsträger ist, wenn sie binnen sechs Monaten nach dem Tag, an dem die Eintragung der Verschmelzung in das Register des Sitzes desjenigen Rechtsträgers, dessen Gläubiger sie sind, nach § 19 Abs. 3 UmwG als bekannt gemacht gilt, ihren Anspruch nach Grund und Höhe schriftlich anmelden, Sicherheit zu leisten, soweit sie nicht Befriedigung verlangen können. Dieses Recht steht den Gläubigern jedoch nur zu, wenn sie glaubhaft machen, dass durch die Verschmelzung die Erfüllung der Forderung gefährdet wird."
    },
    {
      "date": "2025-06-17",
      "id": "112495",
      "original_text": "Registerbekanntmachung nach dem Umwandlungsgesetz\nRheinland-Pfalz Amtsgericht Montabaur HRA 2042\nArno Witgert Inh. Dipl.-Ing. (FH) Michael Liebig e.K. – Herschbach",
      "type": "Registerbekanntmachung nach dem Umwandlungsgesetz",
      "state": "Rheinland-Pfalz",
      "amtsgericht": "Amtsgericht Montabaur",
      "registernummer": "HRA 2042",
      "registerart": "HRA",
      "company_name": "Arno Witgert Inh. Dipl.-Ing. (FH) Michael Liebig e.K.",
      "company_seat": "Herschbach",
      "details": "17.06.2025 (Bekanntmachungsdatum)\n\nRheinland-Pfalz Amtsgericht Montabaur HRA 2042\nRegisterbekanntmachung nach dem Umwandlungsgesetz 17.06.2025 (Eintragungsdatum)\n\nArno Witgert Inh. Dipl.-Ing. (FH) Michael Liebig e.K.\nEinzelkaufmann / Einzelkauffrau\nHerschbach\n\nAls nicht eingetragen wird veröffentlicht: Den Gläubigern der an der Ausgliederung beteiligten Rechtsträger ist, wenn sie binnen sechs Monaten nach dem Tag, an dem die Eintragung der Ausgliederung in das Register des Sitzes desjenigen Rechtsträgers, dessen Gläubiger sie sind, nach § 19 Abs. 3 UmwG als bekannt gemacht gilt, ihren Anspruch nach Grund und Höhe schriftlich anmelden, Sicherheit zu leisten, soweit sie nicht Befriedigung verlangen können. Dieses Recht steht den Gläubigern jedoch nur zu, wenn sie glaubhaft machen, dass durch die Ausgliederung die Erfüllung der Forderung gefährdet wird."
    },
    {
      "date": "2025-06-17",
      "id": "112496",
      "original_text": "Registerbekanntmachung nach dem Umwandlungsgesetz\nRheinland-Pfalz Amtsgericht Montabaur HRA 23282\nWitgert GmbH & Co. KG – Herschbach/Oberwesterwald",
      "type": "Registerbekanntmachung nach dem Umwandlungsgesetz",
      "state": "Rheinland-Pfalz",
      "amtsgericht": "Amtsgericht Montabaur",
      "registernummer": "HRA 23282",
      "registerart": "HRA",
      "company_name": "Witgert GmbH & Co. KG",
      "company_seat": "Herschbach/Oberwesterwald",
      "details": "17.06.2025 (Bekanntmachungsdatum)\n\nRheinland-Pfalz Amtsgericht Montabaur HRA 23282\nRegisterbekanntmachung nach dem Umwandlungsgesetz 17.06.2025 (Eintragungsdatum)\n\nWitgert GmbH & Co. KG\nKommanditgesellschaft\nHerschbach/Oberwesterwald\n\nAls nicht eingetragen wird veröffentlicht: Den Gläubigern der an der Ausgliederung beteiligten Rechtsträger ist, wenn sie binnen sechs Monaten nach dem Tag, an dem die Eintragung der Ausgliederung in das Register des Sitzes desjenigen Rechtsträgers, dessen Gläubiger sie sind, nach § 19 Abs. 3 UmwG als bekannt gemacht gilt, ihren Anspruch nach Grund und Höhe schriftlich anmelden, Sicherheit zu leisten, soweit sie nicht Befriedigung verlangen können. Dieses Recht steht den Gläubigern jedoch nur zu, wenn sie glaubhaft machen, dass durch die Ausgliederung die Erfüllung der Forderung gefährdet wird."
    },
    {
      "date": "2025-06-17",
      "id": "112497",
      "original_text": "Sonstige Registerbekanntmachung\nRheinland-Pfalz Amtsgericht Mainz HRB 33094\nEhrfeld Mikrotechnik GmbH – Wendelsheim",
      "type": "Sonstige Registerbekanntmachung",
      "state": "Rheinland-Pfalz",
      "amtsgericht": "Amtsgericht Mainz",
      "registernummer": "HRB 33094",
      "registerart": "HRB",
      "company_name": "Ehrfeld Mikrotechnik GmbH",
      "company_seat": "Wendelsheim",
      "details": "17.06.2025 (Bekanntmachungsdatum)\n\nRheinland-Pfalz Amtsgericht Mainz HRB 33094\nSonstige Registerbekanntmachung 17.06.2025 (Eintragungsdatum)\n\nEhrfeld Mikrotechnik GmbH\nGesellschaft mit beschränkter Haftung\nWendelsheim\n\nAls nicht eingetragen wird veröffentlicht: Den Gläubigern der Gesellschaft, deren Forderungen begründet worden sind, bevor die Eintragung der Beendigung des Ergebnisabführungsvertrages in das Handelsregister nach § 10 des Handelsgesetzbuches als bekanntgemacht gilt, hat der andere Vertragsteil Sicherheit zu leisten, wenn sie sich binnen sechs Monaten nach der Bekanntmachung der Eintragung zu diesem Zweck bei ihm melden."
    },
    {
      "date": "2025-06-17",
      "id": "112498",
      "original_text": "Einreichung neuer Dokumente\nRheinland-Pfalz Amtsgericht Montabaur HRB 21942\nRenopan AG – Rheinbreitbach",
      "type": "Einreichung neuer Dokumente",
      "state": "Rheinland-Pfalz",
      "amtsgericht": "Amtsgericht Montabaur",
      "registernummer": "HRB 21942",
      "registerart": "HRB",
      "company_name": "Renopan AG",
      "company_seat": "Rheinbreitbach",
      "details": "17.06.2025 (Bekanntmachungsdatum)\n\nRheinland-Pfalz Amtsgericht Montabaur HRB 21942\nEinreichung neuer Dokumente\n\nRenopan AG\nAktiengesellschaft\nRheinbreitbach\n\nDem Registergericht ist eine Liste der Mitglieder des Aufsichtsrates eingereicht worden."
    },
    {
      "date": "2025-06-17",
      "id": "112499",
      "original_text": "Registerbekanntmachung nach dem Umwandlungsgesetz\nRheinland-Pfalz Amtsgericht Bad Kreuznach HRB 23748\nPieroth Wein GmbH – Rümmelsheim - Ortsteil Burg Layen",
      "type": "Registerbekanntmachung nach dem Umwandlungsgesetz",
      "state": "Rheinland-Pfalz",
      "amtsgericht": "Amtsgericht Bad Kreuznach",
      "registernummer": "HRB 23748",
      "registerart": "HRB",
      "company_name": "Pieroth Wein GmbH",
      "company_seat": "Rümmelsheim - Ortsteil Burg Layen",
      "details": "17.06.2025 (Bekanntmachungsdatum)\n\nRheinland-Pfalz Amtsgericht Bad Kreuznach HRB 23748\nRegisterbekanntmachung nach dem Umwandlungsgesetz 17.06.2025 (Eintragungsdatum)\n\nPieroth Wein GmbH\nGesellschaft mit beschränkter Haftung\nRümmelsheim - Ortsteil Burg Layen\n\nAls nicht eingetragen wird veröffentlicht: Den Gläubigern der an der Verschmelzung beteiligten Rechtsträger ist, wenn sie binnen sechs Monaten nach dem Tag, an dem die Eintragung der Verschmelzung in das Register des Sitzes desjenigen Rechtsträgers, dessen Gläubiger sie sind, nach § 19 Abs. 3 UmwG als bekannt gemacht gilt, ihren Anspruch nach Grund und Höhe schriftlich anmelden, Sicherheit zu leisten, soweit sie nicht Befriedigung verlangen können. Dieses Recht steht den Gläubigern jedoch nur zu, wenn sie glaubhaft machen, dass durch die Verschmelzung die Erfüllung der Forderung gefährdet wird."
    },
    {
      "date": "2025-06-17",
      "id": "112500",
      "original_text": "Einreichung neuer Dokumente\nNordrhein-Westfalen Amtsgericht Düren HRB 3498\nForschungszentrum Jülich GmbH – Jülich",
      "type": "Einreichung neuer Dokumente",
      "state": "Nordrhein-Westfalen",
      "amtsgericht": "Amtsgericht Düren",
      "registernummer": "HRB 3498",
      "registerart": "HRB",
      "company_name": "Forschungszentrum Jülich GmbH",
      "company_seat": "Jülich",
      "details": "17.06.2025 (Bekanntmachungsdatum)\n\nNordrhein-Westfalen Amtsgericht Düren HRB 3498\nEinreichung neuer Dokumente 17.06.2025 (Eintragungsdatum)\n\nForschungszentrum Jülich GmbH\nGesellschaft mit beschränkter Haftung\nJülich\n\nDem Registergericht ist eine neue Liste der Mitglieder des Aufsichtsrates eingereicht worden."
    },
    {
      "date": "2025-06-17",
      "id": "112501",
      "original_text": "Löschungsankündigung\nNordrhein-Westfalen Amtsgericht Düsseldorf HRB 97831\nAMON Holding GmbH – Düsseldorf",
      "type": "Löschungsankündigung",
      "state": "Nordrhein-Westfalen",
      "amtsgericht": "Amtsgericht Düsseldorf",
      "registernummer": "HRB 97831",
      "registerart": "HRB",
      "company_name": "AMON Holding GmbH",
      "company_seat": "Düsseldorf",
      "details": "17.06.2025 (Bekanntmachungsdatum)\n\nNordrhein-Westfalen Amtsgericht Düsseldorf HRB 97831\nLöschungsankündigung\n\nAMON Holding GmbH\nGesellschaft mit beschränkter Haftung\nDüsseldorf\n\nDas Registergericht beabsichtigt die Gesellschaft von Amts wegen nach § 394 FamFG zu löschen. Die Frist zur Erhebung eines Widerspruchs ist auf 3 Wochen festgesetzt.\n\nRechtsbehelfsbelehrung:\nDas Widerspruchsrecht steht jedem zu, der an der Unterlassung der Löschung ein berechtigtes Interesse hat. Der Widerspruch ist bei dem Amtsgericht Düsseldorf -Registergericht-, Werdener Straße 1, 40227 Düsseldorf schriftlich in deutscher Sprache oder zur Niederschrift der Geschäftsstelle einzulegen. Der Widerspruch kann auch zur Niederschrift der Geschäftsstelle eines jeden Amtsgerichtes abgegeben werden. Die Einlegung ist auch durch Übertragung eines elektronischen Dokuments an die elektronische Poststelle des Gerichts möglich. Das elektronische Dokument muss für die Bearbeitung durch das Gericht geeignet und mit einer qualifizierten elektronischen Signatur der verantwortenden Person versehen sein oder von der verantwortenden Person signiert und auf einem sicheren Übermittlungsweg gemäß § 130a ZPO nach näherer Maßgabe der Verordnung über die technischen Rahmenbedingungen des elektronischen Rechtsverkehrs und über das besondere elektronische Behördenpostfach (BGBl. I, S.3803) eingereicht werden. Weitere Informationen erhalten Sie auf der Internetseite www.justiz.de.\nDer Widerspruch muss spätestens innerhalb der gesetzten Frist nach dem Datum der Bekanntmachung der Löschungsankündigung bei dem Amtsgericht - Registergericht - Düsseldorf eingegangen sein.  Dies gilt auch dann, wenn der Widerspruch zur Niederschrift der Geschäftsstelle eines anderen Amtsgerichtes abgegeben wurde. Die Frist beginnt mit dem Tage der Bekanntmachung der Löschungsankündigung in dem für die Bekanntmachung der Eintragungen in das Handelsregister bestimmten elektronischen Informations- und Kommunikationssystem nach § 10 des Handelsgesetzbuches. Fällt das Ende der Frist auf einen Sonntag, einen allgemeinen Feiertag oder Sonnabend, so endet die Frist mit Ablauf des nächsten Werktages.\nDer Widerspruch muss die Bezeichnung der angefochtenen Löschungsankündigung sowie die Erklärung enthalten, dass Widerspruch gegen diese Löschungsankündigung eingelegt wird. Er ist zu unterzeichnen und soll begründet werden."
    },
    {
      "date": "2025-06-17",
      "id": "112502",
      "original_text": "Sonstige Registerbekanntmachung\nNordrhein-Westfalen Amtsgericht Düren HRB 4082\nSGK Germany GmbH – Jülich",
      "type": "Sonstige Registerbekanntmachung",
      "state": "Nordrhein-Westfalen",
      "amtsgericht": "Amtsgericht Düren",
      "registernummer": "HRB 4082",
      "registerart": "HRB",
      "company_name": "SGK Germany GmbH",
      "company_seat": "Jülich",
      "details": "17.06.2025 (Bekanntmachungsdatum)\n\nNordrhein-Westfalen Amtsgericht Düren HRB 4082\nSonstige Registerbekanntmachung 16.06.2025 (Eintragungsdatum)\n\nSGK Germany GmbH\nGesellschaft mit beschränkter Haftung\nJülich\n\nAls nicht eingetragen wird veröffentlicht: Den Gläubigern der Gesellschaft, deren Forderungen begründet worden sind, bevor die Eintragung der Beendigung des Ergebnisabführungsvertrages  in das Handelsregister nach § 10 des Handelsgesetzbuches als bekanntgemacht gilt, hat der andere Vertragsteil Sicherheit zu leisten, wenn sie sich binnen sechs Monaten nach der Bekanntmachung der Eintragung zu diesem Zweck bei ihm melden."
    },
    {
      "date": "2025-06-17",
      "id": "112503",
      "original_text": "Registerbekanntmachung nach dem Umwandlungsgesetz\nNordrhein-Westfalen Amtsgericht Bad Oeynhausen HRA 10606\nSBO-Sicherheitstechnische Betreuung Olszyczka, Inh. Damian Jozef Olszyczka e.Kfm. – Vlotho",
      "type": "Registerbekanntmachung nach dem Umwandlungsgesetz",
      "state": "Nordrhein-Westfalen",
      "amtsgericht": "Amtsgericht Bad Oeynhausen",
      "registernummer": "HRA 10606",
      "registerart": "HRA",
      "company_name": "SBO-Sicherheitstechnische Betreuung Olszyczka, Inh. Damian Jozef Olszyczka e.Kfm.",
      "company_seat": "Vlotho",
      "details": "17.06.2025 (Bekanntmachungsdatum)\n\nNordrhein-Westfalen Amtsgericht Bad Oeynhausen HRA 10606\nRegisterbekanntmachung nach dem Umwandlungsgesetz 17.06.2025 (Eintragungsdatum)\n\nSBO-Sicherheitstechnische Betreuung Olszyczka, Inh. Damian Jozef Olszyczka e.Kfm.\nEinzelkaufmann / Einzelkauffrau\nVlotho\n\nDen Gläubigern der an der Ausgliederung beteiligten Rechtsträger ist, wenn sie binnen sechs Monaten nach dem Tag, an dem die Eintragung der Ausgliederung in das Register des Sitzes desjenigen Rechtsträgers, dessen Gläubiger sie sind, nach § 19 Absatz 3 UmwG als bekanntgemacht gilt, ihren Anspruch nach Grund und Höhe schriftlich anmelden, Sicherheit zu leisten, soweit sie nicht Befriedigung verlangen können. Dieses Recht steht den Gläubigern jedoch nur zu, wenn sie glaubhaft machen, dass durch die Ausgliederung die Erfüllung ihrer Forderung gefährdet wird."
    },
    {
      "date": "2025-06-17",
      "id": "112504",
      "original_text": "Löschungsankündigung\nNordrhein-Westfalen Amtsgericht Krefeld HRB 18913\nBlitz UG (haftungsbeschränkt) – Krefeld",
      "type": "Löschungsankündigung",
      "state": "Nordrhein-Westfalen",
      "amtsgericht": "Amtsgericht Krefeld",
      "registernummer": "HRB 18913",
      "registerart": "HRB",
      "company_name": "Blitz UG (haftungsbeschränkt)",
      "company_seat": "Krefeld",
      "details": "17.06.2025 (Bekanntmachungsdatum)\n\nNordrhein-Westfalen Amtsgericht Krefeld HRB 18913\nLöschungsankündigung\n\nBlitz UG (haftungsbeschränkt)\nGesellschaft mit beschränkter Haftung\nKrefeld\n\nDas Registergericht beabsichtigt die Gesellschaft von Amts wegen nach § 394 FamFG zu löschen. Die Frist zur Erhebung eines Widerspruchs ist auf einen Monat festgesetzt."
    },
    {
      "date": "2025-06-17",
      "id": "112505",
      "original_text": "Registerbekanntmachung nach dem Umwandlungsgesetz\nNordrhein-Westfalen Amtsgericht Köln HRB 123592\nAVIATO GmbH – Köln",
      "type": "Registerbekanntmachung nach dem Umwandlungsgesetz",
      "state": "Nordrhein-Westfalen",
      "amtsgericht": "Amtsgericht Köln",
      "registernummer": "HRB 123592",
      "registerart": "HRB",
      "company_name": "AVIATO GmbH",
      "company_seat": "Köln",
      "details": "17.06.2025 (Bekanntmachungsdatum)\n\nNordrhein-Westfalen Amtsgericht Köln HRB 123592\nRegisterbekanntmachung nach dem Umwandlungsgesetz 17.06.2025 (Eintragungsdatum)\n\nAVIATO GmbH\nGesellschaft mit beschränkter Haftung\nKöln\n\nDen Gläubigern der an der formwechselnden Umwandlung beteiligten Rechtsträger ist, wenn sie binnen sechs Monaten nach dem Tag, an dem die Eintragung der formwechselnden Umwandlung in das Register des Sitzes desjenigen Rechtsträgers, dessen Gläubiger sie sind, nach § 19 Absatz 3 UmwG als bekanntgemacht gilt, ihren Anspruch nach Grund und Höhe schriftlich anmelden, Sicherheit zu leisten, soweit sie nicht Befriedigung verlangen können. Dieses Recht steht den Gläubigern jedoch nur zu, wenn sie glaubhaft machen, dass durch die formwechselnden Umwandlung die Erfüllung ihrer Forderung gefährdet wird."
    },
    {
      "date": "2025-06-17",
      "id": "112506",
      "original_text": "Einreichung neuer Dokumente\nNordrhein-Westfalen Amtsgericht Düsseldorf HRB 99939\nKonecranes GmbH – Düsseldorf",
      "type": "Einreichung neuer Dokumente",
      "state": "Nordrhein-Westfalen",
      "amtsgericht": "Amtsgericht Düsseldorf",
      "registernummer": "HRB 99939",
      "registerart": "HRB",
      "company_name": "Konecranes GmbH",
      "company_seat": "Düsseldorf",
      "details": "17.06.2025 (Bekanntmachungsdatum)\n\nNordrhein-Westfalen Amtsgericht Düsseldorf HRB 99939\nEinreichung neuer Dokumente\n\nKonecranes GmbH\nGesellschaft mit beschränkter Haftung\nDüsseldorf\n\nDem Registergericht ist eine Liste der Mitglieder des Aufsichtsrates eingereicht worden."
    },
    {
      "date": "2025-06-17",
      "id": "112507",
      "original_text": "Registerbekanntmachung nach dem Umwandlungsgesetz\nNordrhein-Westfalen Amtsgericht Münster HRB 21888\nP. Behrendt GmbH – Münster",
      "type": "Registerbekanntmachung nach dem Umwandlungsgesetz",
      "state": "Nordrhein-Westfalen",
      "amtsgericht": "Amtsgericht Münster",
      "registernummer": "HRB 21888",
      "registerart": "HRB",
      "company_name": "P. Behrendt GmbH",
      "company_seat": "Münster",
      "details": "17.06.2025 (Bekanntmachungsdatum)\n\nNordrhein-Westfalen Amtsgericht Münster HRB 21888\nRegisterbekanntmachung nach dem Umwandlungsgesetz 17.06.2025 (Eintragungsdatum)\n\nP. Behrendt GmbH\nGesellschaft mit beschränkter Haftung\nMünster\n\nDen Gläubigern der an der Ausgliederung beteiligten Rechtsträger ist, wenn sie binnen sechs Monaten nach dem Tag, an dem die Eintragung der Ausgliederung in das Register des Sitzes desjenigen Rechtsträgers, dessen Gläubiger sie sind, nach § 19 Absatz 3 UmwG als bekanntgemacht gilt, ihren Anspruch nach Grund und Höhe schriftlich anmelden, Sicherheit zu leisten, soweit sie nicht Befriedigung verlangen können. Dieses Recht steht den Gläubigern jedoch nur zu, wenn sie glaubhaft machen, dass durch die Ausgliederung die Erfüllung ihrer Forderung gefährdet wird."
    },
    {
      "date": "2025-06-17",
      "id": "112508",
      "original_text": "Löschungsankündigung\nNordrhein-Westfalen Amtsgericht Dortmund HRB 34411\nSchüßler Fitness- und Gesundheitscoaching GmbH – Dortmund",
      "type": "Löschungsankündigung",
      "state": "Nordrhein-Westfalen",
      "amtsgericht": "Amtsgericht Dortmund",
      "registernummer": "HRB 34411",
      "registerart": "HRB",
      "company_name": "Schüßler Fitness- und Gesundheitscoaching GmbH",
      "company_seat": "Dortmund",
      "details": "17.06.2025 (Bekanntmachungsdatum)\n\nNordrhein-Westfalen Amtsgericht Dortmund HRB 34411\nLöschungsankündigung\n\nSchüßler Fitness- und Gesundheitscoaching GmbH\nGesellschaft mit beschränkter Haftung\nDortmund\n\nDas Registergericht beabsichtigt die Gesellschaft von Amts wegen nach § 394 FamFG zu löschen. Die Frist zur Erhebung eines Widerspruchs ist auf zwei Monate festgesetzt."
    },
    {
      "date": "2025-06-17",
      "id": "112509",
      "original_text": "Registerbekanntmachung nach dem Umwandlungsgesetz\nNordrhein-Westfalen Amtsgericht Neuss HRB 13894\nNink Malerarbeiten Innenausbau und Fliesen GmbH – Kaarst",
      "type": "Registerbekanntmachung nach dem Umwandlungsgesetz",
      "state": "Nordrhein-Westfalen",
      "amtsgericht": "Amtsgericht Neuss",
      "registernummer": "HRB 13894",
      "registerart": "HRB",
      "company_name": "Nink Malerarbeiten Innenausbau und Fliesen GmbH",
      "company_seat": "Kaarst",
      "details": "17.06.2025 (Bekanntmachungsdatum)\n\nNordrhein-Westfalen Amtsgericht Neuss HRB 13894\nRegisterbekanntmachung nach dem Umwandlungsgesetz 17.06.2025 (Eintragungsdatum)\n\nNink Malerarbeiten Innenausbau und Fliesen GmbH\nGesellschaft mit beschränkter Haftung\nKaarst\n\nDen Gläubigern der an der Verschmelzung beteiligten Rechtsträger ist, wenn sie binnen sechs Monaten nach dem Tag, an dem die Eintragung der Verschmelzung in das Register des Sitzes derjenigen Rechtsträger deren Gläubiger sie sind, nach § 19 Absatz 3 UmwG als bekanntgemacht gilt, ihren Anspruch nach Grund und Höhe schriftlich anmelden, Sicherheit zu leisten, soweit sie nicht Befriedigung verlangen können. Dieses Recht steht den Gläubigern jedoch nur zu, wenn sie glaubhaft machen, dass durch die Verschmelzung die Erfüllung ihrer Forderung gefährdet wird."
    },
    {
      "date": "2025-06-17",
      "id": "112510",
      "original_text": "Registerbekanntmachung nach dem Umwandlungsgesetz\nNordrhein-Westfalen Amtsgericht Düsseldorf HRB 46319\nBIOGARTEN Verwaltungs GmbH – Hilden",
      "type": "Registerbekanntmachung nach dem Umwandlungsgesetz",
      "state": "Nordrhein-Westfalen",
      "amtsgericht": "Amtsgericht Düsseldorf",
      "registernummer": "HRB 46319",
      "registerart": "HRB",
      "company_name": "BIOGARTEN Verwaltungs GmbH",
      "company_seat": "Hilden",
      "details": "17.06.2025 (Bekanntmachungsdatum)\n\nNordrhein-Westfalen Amtsgericht Düsseldorf HRB 46319\nRegisterbekanntmachung nach dem Umwandlungsgesetz 17.06.2025 (Eintragungsdatum)\n\nBIOGARTEN Verwaltungs GmbH\nGesellschaft mit beschränkter Haftung\nHilden\n\nDen Gläubigern der an der Verschmelzung beteiligten Rechtsträger ist, wenn sie binnen sechs Monaten nach dem Tag, an dem die Eintragung der Verschmelzung in das Register des Sitzes desjenigen Rechtsträgers, dessen Gläubiger sie sind, nach § 19 Absatz 3 UmwG als bekanntgemacht gilt, ihren Anspruch nach Grund und Höhe schriftlich anmelden, Sicherheit zu leisten, soweit sie nicht Befriedigung verlangen können. Dieses Recht steht den Gläubigern jedoch nur zu, wenn sie glaubhaft machen, dass durch die Verschmelzung die Erfüllung ihrer Forderung gefährdet wird."
    },
    {
      "date": "2025-06-17",
      "id": "112511",
      "original_text": "Registerbekanntmachung nach dem Umwandlungsgesetz\nNordrhein-Westfalen Amtsgericht Düsseldorf HRB 84580\nGrundstücksgesellschaft Sternentor 6 Hotel Bremen mbH – Ratingen",
      "type": "Registerbekanntmachung nach dem Umwandlungsgesetz",
      "state": "Nordrhein-Westfalen",
      "amtsgericht": "Amtsgericht Düsseldorf",
      "registernummer": "HRB 84580",
      "registerart": "HRB",
      "company_name": "Grundstücksgesellschaft Sternentor 6 Hotel Bremen mbH",
      "company_seat": "Ratingen",
      "details": "17.06.2025 (Bekanntmachungsdatum)\n\nNordrhein-Westfalen Amtsgericht Düsseldorf HRB 84580\nRegisterbekanntmachung nach dem Umwandlungsgesetz\n\nGrundstücksgesellschaft Sternentor 6 Hotel Bremen mbH\nGesellschaft mit beschränkter Haftung\nRatingen\n\nDem Registergericht ist der Entwurf eines Verschmelzungsplans eingereicht worden. Hierzu wird folgendes bekannt gemacht:\n1.\nAn der grenzüberschreitenden Verschmelzung sind beteiligt:\nals übertragende Gesellschaft: Grundstücksgesellschaft Sternentor 6 Hotel Bremen mbH, eine Gesellschaft mit beschränkter Haftung, mit Sitz in Ratingen, Deutschland;\nals übernehmende Gesellschaft: die Luxembourg Investment Company 158 S.a´r.l.,\neine Gesellschaft mit beschränkter Haftung nach luxemburgischem Recht mit Sitz in Luxemburg, Großherzogtum Luxemburg.\n2.\nDie an der grenzüberschreitenden Verschmelzung beteiligten Gesellschaften sind bei folgenden Registern eingetragen:\ndie Grundstücksgesellschaft Sternentor 6 Hotel Bremen mbH ist in Deutschland im Handelsregister beim Amtsgericht Düsseldorf unter der Registernummer HRB 84580 eingetragen (EUID: DER1101.HR884580),\ndie Luxembourg Investment Company 158 S.a´r.l. ist im luxemburgischen Handelsregister (Registre de Commerce et de Sociétés) unter der Nummer B210206 eingetragen (EUID: LURCSL.B210206).\n3.\nDie Verschmelzung bedarf nach § 312 Abs. 2 UmwG i.V.m. § 307 Abs. 3 Nr. 1 UmwG nicht der Zustimmung der Gesellschafterversammlung der Grundstücksgesellschaft Sternentor 6 Hotel Bremen mbH, so dass die alleinige Anteilsinhaberin der Grundstücksgesellschaft Sternentor 6 Hotel Bremen mbH Bemerkungen zum Verschmelzungsplan nicht gemäß § 312 Abs. 3 UmwG vor einem Zustimmungsbeschluss der Gesellschafterversammlung der Grundstücksgesellschaft Sternentor 6 Hotel Bremen mbH zur Kenntnis nehmen kann. Stattdessen trifft die alleinige Anteilsinhaberin der Grundstücksgesellschaft Sternentor 6 Hotel Bremen mbH die Entscheidung über den Abschluss des Verschmelzungsplans mit der Beurkundung des Verschmelzungsplans, die aktuell für den 21. Juli 2025 geplant ist.\nDen Anteilsinhabern und Gläubigern sowie den Arbeitnehmern der Grundstücksgesellschaft Sternentor 6 Hotel Bremen mbH, die Bemerkungen zum Entwurf des Verschmelzungsplans abgeben möchten, wird daher empfohlen, solche Bemerkungen vor dem geplanten Beurkundungstermin zu übermitteln.\nDementsprechend können die Anteilsinhaber, Gläubiger und Arbeitnehmer der Grundstücksgesellschaft Sternentor 6 Hotel Bremen mbH der Grundstücksgesellschaft Sternentor 6 Hotel Bremen mbH spätestens bis zur Beurkundung des Verschmelzungsplans Bemerkungen zum Verschmelzungsplan übermitteln.\nDie Anteilsinhaber, Gläubiger und Arbeitnehmer der Luxembourg Investment Company 158 S.a´r.l. können spätestens fünf Arbeitstage vor dem Tag der Gesellschafterversammlung der Luxembourg Investment Company 158 S.a´r.l., die aktuell für den 21. Juli 2025 geplant ist, Bemerkungen zum Verschmelzungsplan übermitteln.\nDie Grundstücksgesellschaft Sternentor 6 Hotel Bremen mbH und die Luxembourg Investment Company 158 S.a´r.l. haben aktuell keine Arbeitnehmer.\nEntsprechende Bemerkungen können an folgenden Anschriften gerichtet werden:\nGrundstücksgesellschaft Sternentor 6 Hotel Bremen mbH, c/o Kieffer Stübben und Partner mbB, 40476 Düsseldorf, Rather Straße 110a, Deutschland;\nLuxembourg Investment Company 158 S.a´r.l., 2, rue Lamartine, L-1914 Luxemburg, Großherzogtum Luxemburg.\nSämtliche eingehenden Bemerkungen werden den jeweiligen Anteilsinhabern der jeweiligen Gesellschaft zur Kenntnis gebracht. Sollte der geplante Termin der Beurkundung des Verschmelzungsplans oder der geplante Termin der Gesellschafterversammlung der Luxembourg Investment Company 158 S.a´r.l. beispielsweise wegen Verzögerungen dieser Bekanntmachung nicht möglich sein, wird der betreffende Termin so bald wie praktisch möglich danach, jedenfalls aber unter Einhaltung der Monatsfrist gemäß § 308 Abs. 2 UmwG seit der Einreichung des Entwurfs des Verschmelzungsplans beim Registergericht stattfinden."
    },
    {
      "date": "2025-06-17",
      "id": "112512",
      "original_text": "Registerbekanntmachung nach dem Umwandlungsgesetz\nNordrhein-Westfalen Amtsgericht Bonn HRA 10396\nHaeger Consulting e.K. – Wachtberg",
      "type": "Registerbekanntmachung nach dem Umwandlungsgesetz",
      "state": "Nordrhein-Westfalen",
      "amtsgericht": "Amtsgericht Bonn",
      "registernummer": "HRA 10396",
      "registerart": "HRA",
      "company_name": "Haeger Consulting e.K.",
      "company_seat": "Wachtberg",
      "details": "17.06.2025 (Bekanntmachungsdatum)\n\nNordrhein-Westfalen Amtsgericht Bonn HRA 10396\nRegisterbekanntmachung nach dem Umwandlungsgesetz 17.06.2025 (Eintragungsdatum)\n\nHaeger Consulting e.K.\nEinzelkaufmann / Einzelkauffrau\nWachtberg\n\nDen Gläubigern der an der Ausgliederung beteiligten Rechtsträger ist, wenn sie binnen sechs Monaten nach dem Tag, an dem die Eintragung der Ausgliederung in das Register des Sitzes desjenigen Rechtsträgers, dessen Gläubiger sie sind, nach § 19 Absatz 3 UmwG als bekanntgemacht gilt, ihren Anspruch nach Grund und Höhe schriftlich anmelden, Sicherheit zu leisten, soweit sie nicht Befriedigung verlangen können. Dieses Recht steht den Gläubigern jedoch nur zu, wenn sie glaubhaft machen, dass durch die Ausgliederung die Erfüllung ihrer Forderung gefährdet wird."
    },
    {
      "date": "2025-06-17",
      "id": "112513",
      "original_text": "Registerbekanntmachung nach dem Umwandlungsgesetz\nNordrhein-Westfalen Amtsgericht Essen HRB 15082\nLuster-Haggeney Verwaltungs-GmbH – Hattingen",
      "type": "Registerbekanntmachung nach dem Umwandlungsgesetz",
      "state": "Nordrhein-Westfalen",
      "amtsgericht": "Amtsgericht Essen",
      "registernummer": "HRB 15082",
      "registerart": "HRB",
      "company_name": "Luster-Haggeney Verwaltungs-GmbH",
      "company_seat": "Hattingen",
      "details": "17.06.2025 (Bekanntmachungsdatum)\n\nNordrhein-Westfalen Amtsgericht Essen HRB 15082\nRegisterbekanntmachung nach dem Umwandlungsgesetz 17.06.2025 (Eintragungsdatum)\n\nLuster-Haggeney Verwaltungs-GmbH\nGesellschaft mit beschränkter Haftung\nHattingen\n\nDen Gläubigern der an der Verschmelzung beteiligten Rechtsträger ist, wenn sie binnen sechs Monaten nach dem Tag, an dem die Eintragung der Verschmelzung in das Register des Sitzes desjenigen Rechtsträgers, dessen Gläubiger sie sind, nach § 19 Absatz 3 UmwG als bekanntgemacht gilt, ihren Anspruch nach Grund und Höhe schriftlich anmelden, Sicherheit zu leisten, soweit sie nicht Befriedigung verlangen können. Dieses Recht steht den Gläubigern jedoch nur zu, wenn sie glaubhaft machen, dass durch die Verschmelzung die Erfüllung ihrer Forderung gefährdet wird."
    },
    {
      "date": "2025-06-17",
      "id": "112514",
      "original_text": "Registerbekanntmachung nach dem Umwandlungsgesetz\nNordrhein-Westfalen Amtsgericht Düren HRB 4082\nSGK Germany GmbH – Jülich",
      "type": "Registerbekanntmachung nach dem Umwandlungsgesetz",
      "state": "Nordrhein-Westfalen",
      "amtsgericht": "Amtsgericht Düren",
      "registernummer": "HRB 4082",
      "registerart": "HRB",
      "company_name": "SGK Germany GmbH",
      "company_seat": "Jülich",
      "details": "17.06.2025 (Bekanntmachungsdatum)\n\nNordrhein-Westfalen Amtsgericht Düren HRB 4082\nRegisterbekanntmachung nach dem Umwandlungsgesetz 16.06.2025 (Eintragungsdatum)\n\nSGK Germany GmbH\nGesellschaft mit beschränkter Haftung\nJülich\n\nDen Gläubigern der an der Abspaltung beteiligten Rechtsträger ist, wenn sie binnen sechs Monaten nach dem Tag, an dem die Eintragung der Abspaltung in das Register des Sitzes desjenigen Rechtsträgers, dessen Gläubiger sie sind, nach § 19 Absatz 3 UmwG als bekanntgemacht gilt, ihren Anspruch nach Grund und Höhe schriftlich anmelden, Sicherheit zu leisten, soweit sie nicht Befriedigung verlangen können. Dieses Recht steht den Gläubigern jedoch nur zu, wenn sie glaubhaft machen, dass durch die Abspaltung die Erfüllung ihrer Forderung gefährdet wird."
    },
    {
      "date": "2025-06-17",
      "id": "112515",
      "original_text": "Löschungsankündigung\nNordrhein-Westfalen Amtsgericht Bochum HRB 17271\nRV Hebetechnik UG (haftungsbeschränkt) – Witten",
      "type": "Löschungsankündigung",
      "state": "Nordrhein-Westfalen",
      "amtsgericht": "Amtsgericht Bochum",
      "registernummer": "HRB 17271",
      "registerart": "HRB",
      "company_name": "RV Hebetechnik UG (haftungsbeschränkt)",
      "company_seat": "Witten",
      "details": "17.06.2025 (Bekanntmachungsdatum)\n\nNordrhein-Westfalen Amtsgericht Bochum HRB 17271\nLöschungsankündigung 18.06.2025 (Eintragungsdatum)\n\nRV Hebetechnik UG (haftungsbeschränkt)\nGesellschaft mit beschränkter Haftung\nWitten\n\nDas Registergericht beabsichtigt die Gesellschaft von Amts wegen nach § 394 FamFG zu löschen. Die Frist zur Erhebung eines Widerspruchs ist auf drei Monate festgesetzt."
    },
    {
      "date": "2025-06-17",
      "id": "112516",
      "original_text": "Registerbekanntmachung nach dem Umwandlungsgesetz\nNordrhein-Westfalen Amtsgericht Hamm HRA 4667\nGarten- und Landschaftsbau Engin Abali e.K. – Bergkamen",
      "type": "Registerbekanntmachung nach dem Umwandlungsgesetz",
      "state": "Nordrhein-Westfalen",
      "amtsgericht": "Amtsgericht Hamm",
      "registernummer": "HRA 4667",
      "registerart": "HRA",
      "company_name": "Garten- und Landschaftsbau Engin Abali e.K.",
      "company_seat": "Bergkamen",
      "details": "17.06.2025 (Bekanntmachungsdatum)\n\nNordrhein-Westfalen Amtsgericht Hamm HRA 4667\nRegisterbekanntmachung nach dem Umwandlungsgesetz 17.06.2025 (Eintragungsdatum)\n\nGarten- und Landschaftsbau Engin Abali e.K.\nEinzelkaufmann / Einzelkauffrau\nBergkamen\n\nDen Gläubigern der an der Verschmelzung beteiligten Rechtsträger ist, wenn sie binnen sechs Monaten nach dem Tag, an dem die Eintragung der Verschmelzung in das Register des Sitzes derjenigen Rechtsträger deren Gläubiger sie sind, nach § 19 Absatz 3 UmwG als bekanntgemacht gilt, ihren Anspruch nach Grund und Höhe schriftlich anmelden, Sicherheit zu leisten, soweit sie nicht Befriedigung verlangen können. Dieses Recht steht den Gläubigern jedoch nur zu, wenn sie glaubhaft machen, dass durch die Verschmelzung die Erfüllung ihrer Forderung gefährdet wird."
    },
    {
      "date": "2025-06-17",
      "id": "112517",
      "original_text": "Einreichung neuer Dokumente\nNordrhein-Westfalen Amtsgericht Neuss HRB 4806\nMMC Hartmetall GmbH – Meerbusch",
      "type": "Einreichung neuer Dokumente",
      "state": "Nordrhein-Westfalen",
      "amtsgericht": "Amtsgericht Neuss",
      "registernummer": "HRB 4806",
      "registerart": "HRB",
      "company_name": "MMC Hartmetall GmbH",
      "company_seat": "Meerbusch",
      "details": "17.06.2025 (Bekanntmachungsdatum)\n\nNordrhein-Westfalen Amtsgericht Neuss HRB 4806\nEinreichung neuer Dokumente\n\nMMC Hartmetall GmbH\nGesellschaft mit beschränkter Haftung\nMeerbusch\n\nDem Registergericht ist eine neue Liste der Mitglieder des Aufsichtsrates eingereicht worden."
    },
    {
      "date": "2025-06-17",
      "id": "112518",
      "original_text": "Einreichung neuer Dokumente\nNordrhein-Westfalen Amtsgericht Köln HRB 11144\nDEVK Rechtsschutz-Versicherungs-Aktiengesellschaft – Köln",
      "type": "Einreichung neuer Dokumente",
      "state": "Nordrhein-Westfalen",
      "amtsgericht": "Amtsgericht Köln",
      "registernummer": "HRB 11144",
      "registerart": "HRB",
      "company_name": "DEVK Rechtsschutz-Versicherungs-Aktiengesellschaft",
      "company_seat": "Köln",
      "details": "17.06.2025 (Bekanntmachungsdatum)\n\nNordrhein-Westfalen Amtsgericht Köln HRB 11144\nEinreichung neuer Dokumente\n\nDEVK Rechtsschutz-Versicherungs-Aktiengesellschaft\nAktiengesellschaft\nKöln\n\nDem Registergericht ist eine neue Liste der Mitglieder des Aufsichtsrates eingereicht worden."
    },
    {
      "date": "2025-06-17",
      "id": "112519",
      "original_text": "Löschungsankündigung\nNordrhein-Westfalen Amtsgericht Siegburg HRB 16910\ncemaCom UG (haftungsbeschränkt) – Niederkassel",
      "type": "Löschungsankündigung",
      "state": "Nordrhein-Westfalen",
      "amtsgericht": "Amtsgericht Siegburg",
      "registernummer": "HRB 16910",
      "registerart": "HRB",
      "company_name": "cemaCom UG (haftungsbeschränkt)",
      "company_seat": "Niederkassel",
      "details": "17.06.2025 (Bekanntmachungsdatum)\n\nNordrhein-Westfalen Amtsgericht Siegburg HRB 16910\nLöschungsankündigung\n\ncemaCom UG (haftungsbeschränkt)\nGesellschaft mit beschränkter Haftung\nNiederkassel\n\nDas Registergericht hat glaubhafte Kenntnis erlangt, dass die Gesellschaft vermögenslos geworden ist, da ein Insolvenzeröffnungsantrag mangels Masse nach § 26 InsO zurückgewiesen wurde.\n\nEs ist daher beabsichtigt, die Gesellschaft nach § 394 FamFG im Handelsregister wegen Vermögenslosigkeit zu löschen.\n\nEinwände gegen die Löschung sind durch Widerspruch binnen einer Frist von 3 Monaten geltend zu machen, andernfalls die Löschung erfolgen wird.\n\nEinzulegen ist der Widerspruch bei dem Amtsgericht Siegburg, Neue Poststraße 16, 53721 Siegburg, und zwar entweder schriftlich in deutscher Sprache oder mündlich zur Niederschrift der Geschäftsstelle. Der Widerspruch kann auch zur Niederschrift der Geschäftsstelle eines jeden Amtsgerichts abgegeben werden. Der Widerspruch ist binnen der in der Verfügung bestimmten Frist einzulegen. Die Frist ist nur gewahrt, wenn der Widerspruch rechtzeitig bei dem Amtsgericht Siegburg eingeht, auch wenn der Widerspruch zur Niederschrift der Geschäftsstelle eines anderen Amtsgerichts abgegeben wurde. Die Frist beginnt jeweils mit der schriftlichen Bekanntgabe der Verfügung an die Beteiligten. Kann die schriftliche Bekanntgabe an einen Beteiligten nicht bewirkt werden, beginnt die Frist spätestens mit Ablauf von fünf Monaten nach Erlass der Verfügung. Die Bekanntgabe ist entweder durch Zustellung oder am dritten Tage nach Aufgabe zur Post bewirkt. Sofern die Löschung noch nicht erfolgt ist, kann der Widerspruch auch noch nach Ablauf der Frist eingelegt werden. Fällt das Ende der Frist auf einen Sonnabend, einen Sonntag oder einen allgemeinen Feiertag, endet die Frist mit Ablauf des nächsten Werktages. Der Widerspruch ist zu unterzeichnen. Eine Begründung des Widerspruchs ist nicht vorgeschrieben."
    },
    {
      "date": "2025-06-17",
      "id": "112520",
      "original_text": "Registerbekanntmachung nach dem Umwandlungsgesetz\nNordrhein-Westfalen Amtsgericht Köln HRB 91104\nAIRE Süd Komplementär GmbH – Köln",
      "type": "Registerbekanntmachung nach dem Umwandlungsgesetz",
      "state": "Nordrhein-Westfalen",
      "amtsgericht": "Amtsgericht Köln",
      "registernummer": "HRB 91104",
      "registerart": "HRB",
      "company_name": "AIRE Süd Komplementär GmbH",
      "company_seat": "Köln",
      "details": "17.06.2025 (Bekanntmachungsdatum)\n\nNordrhein-Westfalen Amtsgericht Köln HRB 91104\nRegisterbekanntmachung nach dem Umwandlungsgesetz 17.06.2025 (Eintragungsdatum)\n\nAIRE Süd Komplementär GmbH\nGesellschaft mit beschränkter Haftung\nKöln\n\nDen Gläubigern der an der Verschmelzung beteiligten Rechtsträger ist, wenn sie binnen sechs Monaten nach dem Tag, an dem die Eintragung der Verschmelzung in das Register des Sitzes desjenigen Rechtsträgers, dessen Gläubiger sie sind, nach § 19 Absatz 3 UmwG als bekanntgemacht gilt, ihren Anspruch nach Grund und Höhe schriftlich anmelden, Sicherheit zu leisten, soweit sie nicht Befriedigung verlangen können. Dieses Recht steht den Gläubigern jedoch nur zu, wenn sie glaubhaft machen, dass durch die Verschmelzung die Erfüllung ihrer Forderung gefährdet wird."
    },
    {
      "date": "2025-06-17",
      "id": "112521",
      "original_text": "Löschungsankündigung\nNordrhein-Westfalen Amtsgericht Hamm HRB 553\nSchuh Hemmerich GmbH – Hamm",
      "type": "Löschungsankündigung",
      "state": "Nordrhein-Westfalen",
      "amtsgericht": "Amtsgericht Hamm",
      "registernummer": "HRB 553",
      "registerart": "HRB",
      "company_name": "Schuh Hemmerich GmbH",
      "company_seat": "Hamm",
      "details": "17.06.2025 (Bekanntmachungsdatum)\n\nNordrhein-Westfalen Amtsgericht Hamm HRB 553\nLöschungsankündigung\n\nSchuh Hemmerich GmbH\nGesellschaft mit beschränkter Haftung\nHamm\n\nDas Registergericht beabsichtigt die Gesellschaft von Amts wegen nach § 394 FamFG zu löschen. Die Frist zur Erhebung eines Widerspruchs ist auf drei Monate festgesetzt."
    },
    {
      "date": "2025-06-17",
      "id": "112522",
      "original_text": "Registerbekanntmachung nach dem Umwandlungsgesetz\nNordrhein-Westfalen Amtsgericht Düsseldorf HRB 108051\nKK Rechenzentrum GmbH – Düsseldorf",
      "type": "Registerbekanntmachung nach dem Umwandlungsgesetz",
      "state": "Nordrhein-Westfalen",
      "amtsgericht": "Amtsgericht Düsseldorf",
      "registernummer": "HRB 108051",
      "registerart": "HRB",
      "company_name": "KK Rechenzentrum GmbH",
      "company_seat": "Düsseldorf",
      "details": "17.06.2025 (Bekanntmachungsdatum)\n\nNordrhein-Westfalen Amtsgericht Düsseldorf HRB 108051\nRegisterbekanntmachung nach dem Umwandlungsgesetz 17.06.2025 (Eintragungsdatum)\n\nKK Rechenzentrum GmbH\nGesellschaft mit beschränkter Haftung\nDüsseldorf\n\nDen Gläubigern der an der Verschmelzung beteiligten Rechtsträger ist, wenn sie binnen sechs Monaten nach dem Tag, an dem die Eintragung der Verschmelzung in das Register des Sitzes desjenigen Rechtsträgers, dessen Gläubiger sie sind, nach § 19 Absatz 3 UmwG als bekanntgemacht gilt, ihren Anspruch nach Grund und Höhe schriftlich anmelden, Sicherheit zu leisten, soweit sie nicht Befriedigung verlangen können. Dieses Recht steht den Gläubigern jedoch nur zu, wenn sie glaubhaft machen, dass durch die Verschmelzung die Erfüllung ihrer Forderung gefährdet wird."
    },
    {
      "date": "2025-06-17",
      "id": "112523",
      "original_text": "Löschungsankündigung\nHessen Amtsgericht Hanau HRB 97042\nRockalotta Booking UG (haftungsbeschränkt) – Nidderau",
      "type": "Löschungsankündigung",
      "state": "Hessen",
      "amtsgericht": "Amtsgericht Hanau",
      "registernummer": "HRB 97042",
      "registerart": "HRB",
      "company_name": "Rockalotta Booking UG (haftungsbeschränkt)",
      "company_seat": "Nidderau",
      "details": "17.06.2025 (Bekanntmachungsdatum)\n\nHessen Amtsgericht Hanau HRB 97042\nLöschungsankündigung\n\nRockalotta Booking UG (haftungsbeschränkt)\nGesellschaft mit beschränkter Haftung\nNidderau\n\nDas Registergericht beabsichtigt die im Handelsregister eingetragene Gesellschaft von Amts wegen nach § 394 FamFG zu löschen. Die Frist zur Erhebung eines Widerspruchs gegen die beabsichtigte Löschung wird auf 3 Monate festgesetzt."
    },
    {
      "date": "2025-06-17",
      "id": "112524",
      "original_text": "Registerbekanntmachung nach dem Umwandlungsgesetz\nHessen Amtsgericht Darmstadt HRB 91290\nHECF Raunheim GmbH – Bensheim",
      "type": "Registerbekanntmachung nach dem Umwandlungsgesetz",
      "state": "Hessen",
      "amtsgericht": "Amtsgericht Darmstadt",
      "registernummer": "HRB 91290",
      "registerart": "HRB",
      "company_name": "HECF Raunheim GmbH",
      "company_seat": "Bensheim",
      "details": "17.06.2025 (Bekanntmachungsdatum)\n\nHessen Amtsgericht Darmstadt HRB 91290\nRegisterbekanntmachung nach dem Umwandlungsgesetz\n\nHECF Raunheim GmbH\nGesellschaft mit beschränkter Haftung\nBensheim\n\nDem Registergericht ist ein Formwechselplan über den geplanten grenzüberschreitenden Formwechsel der HECF Raunheim GmbH mit Sitz in Bensheim (Gesellschaft mit beschränkter Haftung, eingetragen bei dem Amtsgericht Darmstadt unter HRB 91290) als formwechselnder Rechtsträger eingereicht worden.\nRechtsträger neuer Form wird eine S.à.r.l. (Societé à responsabilité limitée) nach dem Recht des Großherzogtums Luxemburg.\n\nDen Gläubigern der formwechselnden Gesellschaft ist Sicherheit zu leisten, wenn sie innerhalb einer Frist von zwei Monaten nach Bekanntmachung des Verschmelzungsplanes glaubhaft machen, dass durch den Formwechsel die Erfüllung ihrer Forderung gefährdet ist.\nAnteilsinhaber und Gläubiger der formwechselnden Gesellschaft sowie die zuständigen Betriebsräte der Gesellschaft oder, soweit es keinen Betriebsrat gibt, die Arbeitnehmer der Gesellschaft, können der Gesellschaft bis spätestens fünf Arbeitstage vor dem Tag der Gesellschafterversammlung der formwechselnden Gesellschaft Bemerkungen zum Formwechselplan übermitteln. Die Gesellschafterversammlung der formwechselnden Rechträgerin in welcher der Zustimmungsbeschluss zum Formwechselplan gefasst werden soll, wird voraussichtlich am 17.07.2025 stattfinden.Bemerkungen sind zu übermitteln an die HECF Raunheim GmbH - Geschäftsführung-, c/o Hines Immobilien GmbH, Färbergraben 16, 80331 München."
    },
    {
      "date": "2025-06-17",
      "id": "112525",
      "original_text": "Löschungsankündigung\nHessen Amtsgericht Frankfurt am Main HRA 42114\nJocks Bock Development GmbH & Co. Frankfurt Deutschherrnviertel KG – Frankfurt am Main",
      "type": "Löschungsankündigung",
      "state": "Hessen",
      "amtsgericht": "Amtsgericht Frankfurt am Main",
      "registernummer": "HRA 42114",
      "registerart": "HRA",
      "company_name": "Jocks Bock Development GmbH & Co. Frankfurt Deutschherrnviertel KG",
      "company_seat": "Frankfurt am Main",
      "details": "17.06.2025 (Bekanntmachungsdatum)\n\nHessen Amtsgericht Frankfurt am Main HRA 42114\nLöschungsankündigung 17.06.2025 (Eintragungsdatum)\n\nJocks Bock Development GmbH & Co. Frankfurt Deutschherrnviertel KG\nKommanditgesellschaft\nFrankfurt am Main\n\nDas Registergericht beabsichtigt die im Handelsregister eingetragene Firma von Amts wegen nach § 394 FamFG zu löschen. Die Frist zur Erhebung eines Widerspruchs gegen die beabsichtigte Löschung wird auf 1 Monate festgesetzt."
    },
    {
      "date": "2025-06-17",
      "id": "112526",
      "original_text": "Löschungsankündigung\nHessen Amtsgericht Frankfurt am Main HRB 127133\nSarChem Deutschland GmbH – Frankfurt am Main",
      "type": "Löschungsankündigung",
      "state": "Hessen",
      "amtsgericht": "Amtsgericht Frankfurt am Main",
      "registernummer": "HRB 127133",
      "registerart": "HRB",
      "company_name": "SarChem Deutschland GmbH",
      "company_seat": "Frankfurt am Main",
      "details": "17.06.2025 (Bekanntmachungsdatum)\n\nHessen Amtsgericht Frankfurt am Main HRB 127133\nLöschungsankündigung 17.06.2025 (Eintragungsdatum)\n\nSarChem Deutschland GmbH\nGesellschaft mit beschränkter Haftung\nFrankfurt am Main\n\nDas Registergericht beabsichtigt die im Handelsregister eingetragene Gesellschaft von Amts wegen nach § 394 FamFG zu löschen. Die Frist zur Erhebung eines Widerspruchs gegen die beabsichtigte Löschung wird auf 3 Monate festgesetzt."
    },
    {
      "date": "2025-06-17",
      "id": "112527",
      "original_text": "Einreichung neuer Dokumente\nHessen Amtsgericht Hanau HRB 11022\nStadtwerke Gelnhausen GmbH – Gelnhausen",
      "type": "Einreichung neuer Dokumente",
      "state": "Hessen",
      "amtsgericht": "Amtsgericht Hanau",
      "registernummer": "HRB 11022",
      "registerart": "HRB",
      "company_name": "Stadtwerke Gelnhausen GmbH",
      "company_seat": "Gelnhausen",
      "details": "17.06.2025 (Bekanntmachungsdatum)\n\nHessen Amtsgericht Hanau HRB 11022\nEinreichung neuer Dokumente\n\nStadtwerke Gelnhausen GmbH\nGesellschaft mit beschränkter Haftung\nGelnhausen\n\nDurch eine Änderung in den Personen der Aufsichtsratsmitglieder ist eine Liste der Mitglieder des Aufsichtsrates zum Handelsregister eingereicht worden."
    },
    {
      "date": "2025-06-17",
      "id": "112528",
      "original_text": "Registerbekanntmachung nach dem Umwandlungsgesetz\nHessen Amtsgericht Wiesbaden HRB 13184\nAareal Bank AG – Wiesbaden",
      "type": "Registerbekanntmachung nach dem Umwandlungsgesetz",
      "state": "Hessen",
      "amtsgericht": "Amtsgericht Wiesbaden",
      "registernummer": "HRB 13184",
      "registerart": "HRB",
      "company_name": "Aareal Bank AG",
      "company_seat": "Wiesbaden",
      "details": "17.06.2025 (Bekanntmachungsdatum)\n\nHessen Amtsgericht Wiesbaden HRB 13184\nRegisterbekanntmachung nach dem Umwandlungsgesetz 17.06.2025 (Eintragungsdatum)\n\nAareal Bank AG\nAktiengesellschaft\nWiesbaden\n\nDie Gesellschaft hat den Entwurf des Verschmelzungsvertrages zwischen ihr und der DHB Verwaltungs AG, Wiesbaden (Amtsgericht Wiesbaden HRB 31248) beim Amtsgericht Wiesbaden HRB 13184 zur Einsichtnahme eingereicht."
    },
    {
      "date": "2025-06-17",
      "id": "112529",
      "original_text": "Sonstige Registerbekanntmachung\nHessen Amtsgericht Kassel VR 2914\nYU-DAN-HAPKIDO – Kassel",
      "type": "Sonstige Registerbekanntmachung",
      "state": "Hessen",
      "amtsgericht": "Amtsgericht Kassel",
      "registernummer": "VR 2914",
      "registerart": "VR",
      "company_name": "YU-DAN-HAPKIDO",
      "company_seat": "Kassel",
      "details": "17.06.2025 (Bekanntmachungsdatum)\n\nHessen Amtsgericht Kassel VR 2914\nSonstige Registerbekanntmachung 17.06.2025 (Eintragungsdatum)\n\nYU-DAN-HAPKIDO\neingetragener Verein\nKassel\n\nDer Verein ist aufgelöst."
    },
    {
      "date": "2025-06-17",
      "id": "112530",
      "original_text": "Einreichung neuer Dokumente\nHessen Amtsgericht Offenbach am Main HRB 41012\nSana Klinikum Offenbach GmbH – Offenbach am Main",
      "type": "Einreichung neuer Dokumente",
      "state": "Hessen",
      "amtsgericht": "Amtsgericht Offenbach am Main",
      "registernummer": "HRB 41012",
      "registerart": "HRB",
      "company_name": "Sana Klinikum Offenbach GmbH",
      "company_seat": "Offenbach am Main",
      "details": "17.06.2025 (Bekanntmachungsdatum)\n\nHessen Amtsgericht Offenbach am Main HRB 41012\nEinreichung neuer Dokumente\n\nSana Klinikum Offenbach GmbH\nGesellschaft mit beschränkter Haftung\nOffenbach am Main\n\nDurch eine Änderung in den Personen der Aufsichtsratsmitglieder ist eine Liste der Mitglieder des Aufsichtsrates zum Handelsregister eingereicht worden."
    },
    {
      "date": "2025-06-17",
      "id": "112531",
      "original_text": "Löschungsankündigung\nHessen Amtsgericht Wiesbaden HRB 29167\nSC Protect GmbH – Wiesbaden",
      "type": "Löschungsankündigung",
      "state": "Hessen",
      "amtsgericht": "Amtsgericht Wiesbaden",
      "registernummer": "HRB 29167",
      "registerart": "HRB",
      "company_name": "SC Protect GmbH",
      "company_seat": "Wiesbaden",
      "details": "17.06.2025 (Bekanntmachungsdatum)\n\nHessen Amtsgericht Wiesbaden HRB 29167\nLöschungsankündigung\n\nSC Protect GmbH\nGesellschaft mit beschränkter Haftung\nWiesbaden\n\nDas Registergericht beabsichtigt die im Handelsregister eingetragene Gesellschaft von Amts wegen nach § 394 FamFG zu löschen. Die Frist zur Erhebung eines Widerspruchs gegen die beabsichtigte Löschung wird auf 3 Monate festgesetzt."
    },
    {
      "date": "2025-06-17",
      "id": "112532",
      "original_text": "Löschungsankündigung\nHessen Amtsgericht Frankfurt am Main HRB 129296\nKS Business GmbH – Eschborn",
      "type": "Löschungsankündigung",
      "state": "Hessen",
      "amtsgericht": "Amtsgericht Frankfurt am Main",
      "registernummer": "HRB 129296",
      "registerart": "HRB",
      "company_name": "KS Business GmbH",
      "company_seat": "Eschborn",
      "details": "17.06.2025 (Bekanntmachungsdatum)\n\nHessen Amtsgericht Frankfurt am Main HRB 129296\nLöschungsankündigung\n\nKS Business GmbH\nGesellschaft mit beschränkter Haftung\nEschborn\n\nDas Registergericht beabsichtigt die im Handelsregister eingetragene Gesellschaft von Amts wegen nach § 394 FamFG zu löschen. Die Frist zur Erhebung eines Widerspruchs gegen die beabsichtigte Löschung wird auf 1 Monat festgesetzt."
    },
    {
      "date": "2025-06-17",
      "id": "112533",
      "original_text": "Löschungsankündigung\nHessen Amtsgericht Wiesbaden HRB 18389\nMikroScan-Service GmbH – Hochheim am Main",
      "type": "Löschungsankündigung",
      "state": "Hessen",
      "amtsgericht": "Amtsgericht Wiesbaden",
      "registernummer": "HRB 18389",
      "registerart": "HRB",
      "company_name": "MikroScan-Service GmbH",
      "company_seat": "Hochheim am Main",
      "details": "17.06.2025 (Bekanntmachungsdatum)\n\nHessen Amtsgericht Wiesbaden HRB 18389\nLöschungsankündigung\n\nMikroScan-Service GmbH\nGesellschaft mit beschränkter Haftung\nHochheim am Main\n\nDas Registergericht beabsichtigt die im Handelsregister eingetragene Gesellschaft von Amts wegen nach § 394 FamFG zu löschen. Die Frist zur Erhebung eines Widerspruchs gegen die beabsichtigte Löschung wird auf 3 Monate festgesetzt."
    },
    {
      "date": "2025-06-17",
      "id": "112534",
      "original_text": "Sonstige Registerbekanntmachung\nHessen Amtsgericht Kassel VR 1595\nARADIA Verein zur Förderung von Frauenliteratur und -kunst und anderen Rechtsgeschäften, die der Förderung von Fraueninteressen dienen – Kassel",
      "type": "Sonstige Registerbekanntmachung",
      "state": "Hessen",
      "amtsgericht": "Amtsgericht Kassel",
      "registernummer": "VR 1595",
      "registerart": "VR",
      "company_name": "ARADIA Verein zur Förderung von Frauenliteratur und -kunst und anderen Rechtsgeschäften, die der Förderung von Fraueninteressen dienen",
      "company_seat": "Kassel",
      "details": "17.06.2025 (Bekanntmachungsdatum)\n\nHessen Amtsgericht Kassel VR 1595\nSonstige Registerbekanntmachung 17.06.2025 (Eintragungsdatum)\n\nARADIA Verein zur Förderung von Frauenliteratur und -kunst und anderen Rechtsgeschäften, die der Förderung von Fraueninteressen dienen\neingetragener Verein\nKassel\n\nDer Verein ist aufgelöst."
    },
    {
      "date": "2025-06-17",
      "id": "112535",
      "original_text": "Registerbekanntmachung nach dem Umwandlungsgesetz\nHessen Amtsgericht Wetzlar HRB 5312\nCarl Zeiss Sports Optics GmbH – Wetzlar",
      "type": "Registerbekanntmachung nach dem Umwandlungsgesetz",
      "state": "Hessen",
      "amtsgericht": "Amtsgericht Wetzlar",
      "registernummer": "HRB 5312",
      "registerart": "HRB",
      "company_name": "Carl Zeiss Sports Optics GmbH",
      "company_seat": "Wetzlar",
      "details": "17.06.2025 (Bekanntmachungsdatum)\n\nHessen Amtsgericht Wetzlar HRB 5312\nRegisterbekanntmachung nach dem Umwandlungsgesetz 17.06.2025 (Eintragungsdatum)\n\nCarl Zeiss Sports Optics GmbH\nGesellschaft mit beschränkter Haftung\nWetzlar\n\nDen Gläubigern der an der Abspaltung beteiligten Rechtsträger ist, wenn sie binnen sechs Monaten nach dem Tag, an dem die Eintragung der Abspaltung in das Register des Sitzes desjenigen Rechtsträgers, dessen Gläubiger sie sind, nach §§ 125, 19 Absatz 3 UmwG bekannt gemacht worden ist, ihren Anspruch nach Grund und Höhe schriftlich anmelden, Sicherheit zu leisten, soweit sie nicht Befriedigung verlangen können. Dieses Recht steht den Gläubigern jedoch nur zu, wenn sie glaubhaft machen, dass durch die Abspaltung die Erfüllung ihrer Forderung gefährdet wird."
    },
    {
      "date": "2025-06-17",
      "id": "112536",
      "original_text": "Registerbekanntmachung nach dem Umwandlungsgesetz\nHessen Amtsgericht Darmstadt HRB 33604\nMyLifeStyleclub GmbH – Darmstadt",
      "type": "Registerbekanntmachung nach dem Umwandlungsgesetz",
      "state": "Hessen",
      "amtsgericht": "Amtsgericht Darmstadt",
      "registernummer": "HRB 33604",
      "registerart": "HRB",
      "company_name": "MyLifeStyleclub GmbH",
      "company_seat": "Darmstadt",
      "details": "17.06.2025 (Bekanntmachungsdatum)\n\nHessen Amtsgericht Darmstadt HRB 33604\nRegisterbekanntmachung nach dem Umwandlungsgesetz 17.06.2025 (Eintragungsdatum)\n\nMyLifeStyleclub GmbH\nGesellschaft mit beschränkter Haftung\nDarmstadt\n\nDen Gläubigern der an der Verschmelzung beteiligten Rechtsträger ist, wenn sie binnen sechs Monaten nach dem Tag, an dem die Eintragung der Verschmelzung in das Register des Sitzes desjenigen Rechtsträgers, dessen Gläubiger sie sind, nach § 19 Absatz 3 UmwG bekannt gemacht worden ist, ihren Anspruch nach Grund und Höhe schriftlich anmelden, Sicherheit zu leisten, soweit sie nicht Befriedigung verlangen können. Dieses Recht steht den Gläubigern jedoch nur zu, wenn sie glaubhaft machen, dass durch die Verschmelzung die Erfüllung ihrer Forderung gefährdet wird."
    },
    {
      "date": "2025-06-17",
      "id": "112537",
      "original_text": "Löschungsankündigung\nHessen Amtsgericht Wiesbaden HRA 9530\nSekthaus Solter GmbH & Co. KG – Eltville am Rhein",
      "type": "Löschungsankündigung",
      "state": "Hessen",
      "amtsgericht": "Amtsgericht Wiesbaden",
      "registernummer": "HRA 9530",
      "registerart": "HRA",
      "company_name": "Sekthaus Solter GmbH & Co. KG",
      "company_seat": "Eltville am Rhein",
      "details": "17.06.2025 (Bekanntmachungsdatum)\n\nHessen Amtsgericht Wiesbaden HRA 9530\nLöschungsankündigung\n\nSekthaus Solter GmbH & Co. KG\nKommanditgesellschaft\nEltville am Rhein\n\nDas Registergericht beabsichtigt die im Handelsregister eingetragene Firma von Amts wegen nach § 394 FamFG zu löschen. Die Frist zur Erhebung eines Widerspruchs gegen die beabsichtigte Löschung wird auf 3 Monate festgesetzt."
    },
    {
      "date": "2025-06-17",
      "id": "112538",
      "original_text": "Sonstige Registerbekanntmachung\nHessen Amtsgericht Frankfurt am Main HRB 42322\nConstantin GmbH Wirtschaftsprüfungsgesellschaft – Frankfurt am Main",
      "type": "Sonstige Registerbekanntmachung",
      "state": "Hessen",
      "amtsgericht": "Amtsgericht Frankfurt am Main",
      "registernummer": "HRB 42322",
      "registerart": "HRB",
      "company_name": "Constantin GmbH Wirtschaftsprüfungsgesellschaft",
      "company_seat": "Frankfurt am Main",
      "details": "17.06.2025 (Bekanntmachungsdatum)\n\nHessen Amtsgericht Frankfurt am Main HRB 42322\nSonstige Registerbekanntmachung 17.06.2025 (Eintragungsdatum)\n\nConstantin GmbH Wirtschaftsprüfungsgesellschaft\nGesellschaft mit beschränkter Haftung\nFrankfurt am Main\n\nDen Gläubigern der Gesellschaft, deren Forderungen begründet worden sind, bevor die Eintragung der Beendigung des Vertrags in das Handelsregister nach § 10 HGB bekannt gemacht worden ist, ist vom anderen Vertragsteil Sicherheit zu leisten, wenn sie sich binnen sechs Monaten nach dieser Bekanntmachung zu diesem Zweck bei ihm melden."
    },
    {
      "date": "2025-06-17",
      "id": "112539",
      "original_text": "Löschungsankündigung\nHessen Amtsgericht Friedberg HRB 8953\nScarlet Bakery GmbH – Niddatal",
      "type": "Löschungsankündigung",
      "state": "Hessen",
      "amtsgericht": "Amtsgericht Friedberg",
      "registernummer": "HRB 8953",
      "registerart": "HRB",
      "company_name": "Scarlet Bakery GmbH",
      "company_seat": "Niddatal",
      "details": "17.06.2025 (Bekanntmachungsdatum)\n\nHessen Amtsgericht Friedberg HRB 8953\nLöschungsankündigung\n\nScarlet Bakery GmbH\nGesellschaft mit beschränkter Haftung\nNiddatal\n\nDas Registergericht beabsichtigt die im Handelsregister eingetragene Gesellschaft von Amts wegen nach § 394 FamFG zu löschen. Die Frist zur Erhebung eines Widerspruchs gegen die beabsichtigte Löschung wird auf 3 Monate festgesetzt."
    },
    {
      "date": "2025-06-17",
      "id": "82",
      "original_text": "Sonderregisterbekanntmachung OHNE Bezug zum elektr. Register\nBerlin Amtsgericht Berlin (Charlottenburg)\nHRB 22973 B\nRAH Immobilien Vermittlungs GmbH",
      "type": "Sonderregisterbekanntmachung OHNE Bezug zum elektr. Register",
      "state": "Berlin",
      "amtsgericht": "Amtsgericht Berlin (Charlottenburg)",
      "company_name": "RAH Immobilien Vermittlungs GmbH",
      "sonderegister_referenz": "HRB 22973 B",
      "details": "17.06.2025 (Bekanntmachungsdatum)\n\nBerlin Amtsgericht Berlin (Charlottenburg)\nHRB 22973 B\nSonderregisterbekanntmachung OHNE Bezug zum elektr. Register\n\nRAH Immobilien Vermittlungs GmbH\n\nIn dem unternehmensrechtlichen Verfahren betreffend die zu HRB 22973 B beim Amtsgericht Charlottenburg eingetragene und am 25.03.1994 wegen Vermögenslosigkeit aufgrund des § 2 des Gesetzes vom 09.10.1934 von Amts wegen gelöschte\nRAH Immobilien Vermittlungs GmbH beabsichtigt das Registergericht, Herrn Rechtsanwalt Alexander Aleksin, geschäftsansässig Joachimsthaler Straße 15 in 10719 Berlin zum Nachtragsliquidator zu bestellen.\n\nDer Wirkungskreis des Nachtragsliquidators soll beschränkt sein auf die Vertretung und die Wahrnehmung der Rechte der gelöschten Gesellschaft hinsichtlich der Erklärung der Auflassung zum notariellen Kaufvertrag vom 30.12.1987 des Notars Ülo Salm in Berlin (UR-Nr. 753/1987) zusammen mit dem Erwerber Roger Witte sowie der Beantragung und Bewilligung der Umschreibung des Eigentums eingetragen beim Amtsgericht Spandau, Grundbuch von Spandau, Blatt 24838.\n\nDa die letzten Gesellschafter nicht bekannt sind, wird mit dieser Bekanntmachung Gelegenheit gegeben, Einwände innerhalb von 4 Wochen ab dem Zeitpunkt der Bekanntmachung in schriftlicher Form vorzubringen."
    },
    {
      "date": "2025-06-17",
      "id": "84",
      "original_text": "Sonderregisterbekanntmachung OHNE Bezug zum elektr. Register\nNordrhein-Westfalen Amtsgericht Bochum\n14 AR 11962024\nJobnova GmbH",
      "type": "Sonderregisterbekanntmachung OHNE Bezug zum elektr. Register",
      "state": "Nordrhein-Westfalen",
      "amtsgericht": "Amtsgericht Bochum",
      "company_name": "Jobnova GmbH",
      "sonderegister_referenz": "14 AR 11962024",
      "details": "17.06.2025 (Bekanntmachungsdatum)\n\nNordrhein-Westfalen Amtsgericht Bochum\n14 AR 11962024\nSonderregisterbekanntmachung OHNE Bezug zum elektr. Register\n\nJobnova GmbH\n\nAntrag auf Eintragung einer Sitzverlegung\nDas Amtsgericht Bochum hat durch den Richter am Amtsgericht Nieswandt am 05.03.2025 beschlossen:\nDer Antrag auf Eintragung der Gesellschaft in das Handelsregister B des Amtsgerichts Bochum  wird kostenpflichtig zurückgewiesen.\nGründe: Der Antrag auf Eintragung der Gesellschaft ist zurückzuweisen, weil die erforderliche Erlaubnis nach ArbeitnehmerÜberlassungsGesetz entgegen der Zwischenverfügung vom 07.01.2025 und Erinnerung vom 24.01.2025 bis dato nicht eingereicht worden ist."
    }
  ]
}