{
  "date": "2025-06-19",
  "date_of_scrape": "2025-06-20T04:11:01.287Z",
  "tool_version": "0.2.0",
  "number_of_announcements": 94,
  "announcements": [
    {
      "date": "2025-06-19",
      "id": "112686",
      "original_text": "Löschungsankündigung\nBayern Amtsgericht München HRB 258863\nCL8 GmbH – München",
      "type": "Löschungsankündigung",
      "state": "Bayern",
      "amtsgericht": "Amtsgericht München",
      "registernummer": "HRB 258863",
      "registerart": "HRB",
      "company_name": "CL8 GmbH",
      "company_seat": "München",
      "details": "19.06.2025 (Bekanntmachungsdatum)\n\nBayern Amtsgericht München HRB 258863\nLöschungsankündigung 18.06.2025 (Eintragungsdatum)\n\nCL8 GmbH\nGesellschaft mit beschränkter Haftung\nMünchen\n\nDas Registergericht beabsichtigt, die im Handelsregister eingetragene Gesellschaft wegen Vermögenslosigkeit von Amts wegen nach § 394 FamFG zu löschen. Die Frist zur Erhebung eines Widerspruchs ist auf drei Monate festgesetzt."
    },
    {
      "date": "2025-06-19",
      "id": "112687",
      "original_text": "Registerbekanntmachung nach dem Umwandlungsgesetz\nBayern Amtsgericht Nürnberg HRB 31438\nFriedrich Hofmann Betriebsgesellschaft mbH – Büchenbach",
      "type": "Registerbekanntmachung nach dem Umwandlungsgesetz",
      "state": "Bayern",
      "amtsgericht": "Amtsgericht Nürnberg",
      "registernummer": "HRB 31438",
      "registerart": "HRB",
      "company_name": "Friedrich Hofmann Betriebsgesellschaft mbH",
      "company_seat": "Büchenbach",
      "details": "19.06.2025 (Bekanntmachungsdatum)\n\nBayern Amtsgericht Nürnberg HRB 31438\nRegisterbekanntmachung nach dem Umwandlungsgesetz 18.06.2025 (Eintragungsdatum)\n\nFriedrich Hofmann Betriebsgesellschaft mbH\nGesellschaft mit beschränkter Haftung\nBüchenbach\n\nDen Gläubigern der an der Verschmelzung beteiligten Rechtsträger ist, wenn sie binnen sechs Monaten nach dem Tag, an dem die Eintragung der Verschmelzung in das Register des Sitzes desjenigen Rechtsträgers, dessen Gläubiger sie sind, nach § 19 Abs. 3 UmwG als bekannt gemacht gilt, ihren Anspruch nach Grund und Höhe in Textform anmelden, Sicherheit zu leisten, soweit sie nicht Befriedigung verlangen können. Dieses Recht steht den Gläubigern jedoch nur zu, wenn sie glaubhaft machen, dass durch die Verschmelzung die Erfüllung ihrer Forderung gefährdet wird."
    },
    {
      "date": "2025-06-19",
      "id": "112688",
      "original_text": "Registerbekanntmachung nach dem Umwandlungsgesetz\nBayern Amtsgericht Fürth HRB 15312\nCAVOG GmbH – Herzogenaurach",
      "type": "Registerbekanntmachung nach dem Umwandlungsgesetz",
      "state": "Bayern",
      "amtsgericht": "Amtsgericht Fürth",
      "registernummer": "HRB 15312",
      "registerart": "HRB",
      "company_name": "CAVOG GmbH",
      "company_seat": "Herzogenaurach",
      "details": "19.06.2025 (Bekanntmachungsdatum)\n\nBayern Amtsgericht Fürth HRB 15312\nRegisterbekanntmachung nach dem Umwandlungsgesetz 18.06.2025 (Eintragungsdatum)\n\nCAVOG GmbH\nGesellschaft mit beschränkter Haftung\nHerzogenaurach\n\nDen Gläubigern der an der Verschmelzung beteiligten Rechtsträger ist, wenn sie binnen sechs Monaten nach dem Tag, an dem die Eintragung der Verschmelzung in das Register des Sitzes desjenigen Rechtsträgers, dessen Gläubiger sie sind, nach § 19 Abs. 3 UmwG als bekannt gemacht gilt, ihren Anspruch nach Grund und Höhe in Textform anmelden, Sicherheit zu leisten, soweit sie nicht Befriedigung verlangen können. Dieses Recht steht den Gläubigern jedoch nur zu, wenn sie glaubhaft machen, dass durch die Verschmelzung die Erfüllung ihrer Forderung gefährdet wird."
    },
    {
      "date": "2025-06-19",
      "id": "112689",
      "original_text": "Löschungsankündigung\nBayern Amtsgericht Nürnberg HRB 9360\nWOLTERS PERSONALMANAGEMENT GmbH – Nürnberg",
      "type": "Löschungsankündigung",
      "state": "Bayern",
      "amtsgericht": "Amtsgericht Nürnberg",
      "registernummer": "HRB 9360",
      "registerart": "HRB",
      "company_name": "WOLTERS PERSONALMANAGEMENT GmbH",
      "company_seat": "Nürnberg",
      "details": "19.06.2025 (Bekanntmachungsdatum)\n\nBayern Amtsgericht Nürnberg HRB 9360\nLöschungsankündigung\n\nWOLTERS PERSONALMANAGEMENT GmbH\nGesellschaft mit beschränkter Haftung\nNürnberg\n\nDas Registergericht beabsichtigt, die im Handelsregister eingetragene Gesellschaft wegen Vermögenslosigkeit von Amts wegen nach § 394 FamFG zu löschen. Die Frist zur Erhebung eines Widerspruchs ist auf einen Monat festgesetzt."
    },
    {
      "date": "2025-06-19",
      "id": "112690",
      "original_text": "Registerbekanntmachung nach dem Umwandlungsgesetz\nBayern Amtsgericht München HRB 265101\nfidelis service GmbH – Baierbrunn",
      "type": "Registerbekanntmachung nach dem Umwandlungsgesetz",
      "state": "Bayern",
      "amtsgericht": "Amtsgericht München",
      "registernummer": "HRB 265101",
      "registerart": "HRB",
      "company_name": "fidelis service GmbH",
      "company_seat": "Baierbrunn",
      "details": "19.06.2025 (Bekanntmachungsdatum)\n\nBayern Amtsgericht München HRB 265101\nRegisterbekanntmachung nach dem Umwandlungsgesetz 18.06.2025 (Eintragungsdatum)\n\nfidelis service GmbH\nGesellschaft mit beschränkter Haftung\nBaierbrunn\n\nDen Gläubigern der an der Ausgliederung beteiligten Rechtsträger ist, wenn sie binnen sechs Monaten nach dem Tag, an dem die Eintragung der Ausgliederung in das Register des Sitzes desjenigen Rechtsträgers, dessen Gläubiger sie sind, nach §§ 125, 19 Abs. 3 UmwG als bekannt gemacht gilt, ihren Anspruch nach Grund und Höhe in Textform anmelden, Sicherheit zu leisten, soweit sie nicht Befriedigung verlangen können. Dieses Recht steht den Gläubigern jedoch nur zu, wenn sie glaubhaft machen, dass durch die Ausgliederung die Erfüllung ihrer Forderung gefährdet wird."
    },
    {
      "date": "2025-06-19",
      "id": "112691",
      "original_text": "Registerbekanntmachung nach dem Umwandlungsgesetz\nBayern Amtsgericht München HRB 282451\noctopus group GmbH – Grünwald",
      "type": "Registerbekanntmachung nach dem Umwandlungsgesetz",
      "state": "Bayern",
      "amtsgericht": "Amtsgericht München",
      "registernummer": "HRB 282451",
      "registerart": "HRB",
      "company_name": "octopus group GmbH",
      "company_seat": "Grünwald",
      "details": "19.06.2025 (Bekanntmachungsdatum)\n\nBayern Amtsgericht München HRB 282451\nRegisterbekanntmachung nach dem Umwandlungsgesetz 18.06.2025 (Eintragungsdatum)\n\noctopus group GmbH\nGesellschaft mit beschränkter Haftung\nGrünwald\n\nDen Gläubigern des formwechselnden Rechtsträgers ist, wenn sie binnen sechs Monaten nach dem Tag, an dem die Eintragung des Formwechsels nach § 201 UmwG als bekannt gemacht gilt, ihren Anspruch nach Grund und Höhe in Textform anmelden, Sicherheit zu leisten, soweit sie nicht Befriedigung verlangen können. Dieses Recht steht den Gläubigern jedoch nur zu, wenn sie glaubhaft machen, dass durch den Formwechsel die Erfüllung ihrer Forderung gefährdet wird."
    },
    {
      "date": "2025-06-19",
      "id": "112692",
      "original_text": "Einreichung neuer Dokumente\nBayern Amtsgericht Augsburg HRB 19445\nCADENAS Technologies AG – Augsburg",
      "type": "Einreichung neuer Dokumente",
      "state": "Bayern",
      "amtsgericht": "Amtsgericht Augsburg",
      "registernummer": "HRB 19445",
      "registerart": "HRB",
      "company_name": "CADENAS Technologies AG",
      "company_seat": "Augsburg",
      "details": "19.06.2025 (Bekanntmachungsdatum)\n\nBayern Amtsgericht Augsburg HRB 19445\nEinreichung neuer Dokumente\n\nCADENAS Technologies AG\nAktiengesellschaft\nAugsburg\n\nDem Amtsgericht Augsburg -Registergericht- ist eine Liste der Mitglieder des Aufsichtsrats eingereicht worden, § 106 AktG."
    },
    {
      "date": "2025-06-19",
      "id": "112693",
      "original_text": "Sonstige Registerbekanntmachung\nBayern Amtsgericht München HRB 281581\nPersonio Group SE – München",
      "type": "Sonstige Registerbekanntmachung",
      "state": "Bayern",
      "amtsgericht": "Amtsgericht München",
      "registernummer": "HRB 281581",
      "registerart": "HRB",
      "company_name": "Personio Group SE",
      "company_seat": "München",
      "details": "19.06.2025 (Bekanntmachungsdatum)\n\nBayern Amtsgericht München HRB 281581\nSonstige Registerbekanntmachung\n\nPersonio Group SE\nEuropäische Aktiengesellschaft (SE)\nMünchen\n\nDem Amtsgericht München -Registergericht- ist eine Liste der Mitglieder des Aufsichtsrats eingereicht worden, Art. 9 Abs. 1 Buchst. c (ii) SE-VO i.V.m. § 106 AktG."
    },
    {
      "date": "2025-06-19",
      "id": "112694",
      "original_text": "Registerbekanntmachung nach dem Umwandlungsgesetz\nBayern Amtsgericht München HRB 268672\nALLES.AUTO AG – München",
      "type": "Registerbekanntmachung nach dem Umwandlungsgesetz",
      "state": "Bayern",
      "amtsgericht": "Amtsgericht München",
      "registernummer": "HRB 268672",
      "registerart": "HRB",
      "company_name": "ALLES.AUTO AG",
      "company_seat": "München",
      "details": "19.06.2025 (Bekanntmachungsdatum)\n\nBayern Amtsgericht München HRB 268672\nRegisterbekanntmachung nach dem Umwandlungsgesetz 18.06.2025 (Eintragungsdatum)\n\nALLES.AUTO AG\nAktiengesellschaft\nMünchen\n\nDen Gläubigern des formwechselnden Rechtsträgers ist, wenn sie binnen sechs Monaten nach dem Tag, an dem die Eintragung des Formwechsels nach § 201 UmwG als bekannt gemacht gilt, ihren Anspruch nach Grund und Höhe in Textform anmelden, Sicherheit zu leisten, soweit sie nicht Befriedigung verlangen können. Dieses Recht steht den Gläubigern jedoch nur zu, wenn sie glaubhaft machen, dass durch den Formwechsel die Erfüllung ihrer Forderung gefährdet wird."
    },
    {
      "date": "2025-06-19",
      "id": "112695",
      "original_text": "Registerbekanntmachung nach dem Umwandlungsgesetz\nBayern Amtsgericht München HRB 63179\nGemeinnützige Grundstücks-Verwaltungsgesellschaft Kirchenstraße 23 mbH – München",
      "type": "Registerbekanntmachung nach dem Umwandlungsgesetz",
      "state": "Bayern",
      "amtsgericht": "Amtsgericht München",
      "registernummer": "HRB 63179",
      "registerart": "HRB",
      "company_name": "Gemeinnützige Grundstücks-Verwaltungsgesellschaft Kirchenstraße 23 mbH",
      "company_seat": "München",
      "details": "19.06.2025 (Bekanntmachungsdatum)\n\nBayern Amtsgericht München HRB 63179\nRegisterbekanntmachung nach dem Umwandlungsgesetz 18.06.2025 (Eintragungsdatum)\n\nGemeinnützige Grundstücks-Verwaltungsgesellschaft Kirchenstraße 23 mbH\nGesellschaft mit beschränkter Haftung\nMünchen\n\nDen Gläubigern des formwechselnden Rechtsträgers ist, wenn sie binnen sechs Monaten nach dem Tag, an dem die Eintragung des Formwechsels nach § 201 UmwG als bekannt gemacht gilt, ihren Anspruch nach Grund und Höhe in Textform anmelden, Sicherheit zu leisten, soweit sie nicht Befriedigung verlangen können. Dieses Recht steht den Gläubigern jedoch nur zu, wenn sie glaubhaft machen, dass durch den Formwechsel die Erfüllung ihrer Forderung gefährdet wird."
    },
    {
      "date": "2025-06-19",
      "id": "112696",
      "original_text": "Registerbekanntmachung nach dem Umwandlungsgesetz\nBayern Amtsgericht München HRB 236984\nCheck MK Holding GmbH – München",
      "type": "Registerbekanntmachung nach dem Umwandlungsgesetz",
      "state": "Bayern",
      "amtsgericht": "Amtsgericht München",
      "registernummer": "HRB 236984",
      "registerart": "HRB",
      "company_name": "Check MK Holding GmbH",
      "company_seat": "München",
      "details": "19.06.2025 (Bekanntmachungsdatum)\n\nBayern Amtsgericht München HRB 236984\nRegisterbekanntmachung nach dem Umwandlungsgesetz\n\nCheck MK Holding GmbH\nGesellschaft mit beschränkter Haftung\nMünchen\n\nDen Gläubigern der an der Verschmelzung beteiligten Rechtsträger ist, wenn sie binnen sechs Monaten nach dem Tag, an dem die Eintragung der Verschmelzung in das Register des Sitzes desjenigen Rechtsträgers, dessen Gläubiger sie sind, nach § 19 Abs. 3 UmwG als bekannt gemacht gilt, ihren Anspruch nach Grund und Höhe in Textform anmelden, Sicherheit zu leisten, soweit sie nicht Befriedigung verlangen können. Dieses Recht steht den Gläubigern jedoch nur zu, wenn sie glaubhaft machen, dass durch die Verschmelzung die Erfüllung ihrer Forderung gefährdet wird."
    },
    {
      "date": "2025-06-19",
      "id": "112697",
      "original_text": "Löschungsankündigung\nBayern Amtsgericht München HRB 281338\nBilberry 2023 GmbH – Ottobrunn",
      "type": "Löschungsankündigung",
      "state": "Bayern",
      "amtsgericht": "Amtsgericht München",
      "registernummer": "HRB 281338",
      "registerart": "HRB",
      "company_name": "Bilberry 2023 GmbH",
      "company_seat": "Ottobrunn",
      "details": "19.06.2025 (Bekanntmachungsdatum)\n\nBayern Amtsgericht München HRB 281338\nLöschungsankündigung 17.06.2025 (Eintragungsdatum)\n\nBilberry 2023 GmbH\nGesellschaft mit beschränkter Haftung\nOttobrunn\n\nDas Registergericht beabsichtigt, die im Handelsregister eingetragene Gesellschaft wegen Vermögenslosigkeit von Amts wegen nach § 394 FamFG zu löschen. Die Frist zur Erhebung eines Widerspruchs ist auf drei Monate festgesetzt."
    },
    {
      "date": "2025-06-19",
      "id": "112698",
      "original_text": "Einreichung neuer Dokumente\nBayern Amtsgericht Fürth HRB 6485\nARA GmbH Auto und Reise ASSISTANCE – Bad Windsheim",
      "type": "Einreichung neuer Dokumente",
      "state": "Bayern",
      "amtsgericht": "Amtsgericht Fürth",
      "registernummer": "HRB 6485",
      "registerart": "HRB",
      "company_name": "ARA GmbH Auto und Reise ASSISTANCE",
      "company_seat": "Bad Windsheim",
      "details": "19.06.2025 (Bekanntmachungsdatum)\n\nBayern Amtsgericht Fürth HRB 6485\nEinreichung neuer Dokumente\n\nARA GmbH Auto und Reise ASSISTANCE\nGesellschaft mit beschränkter Haftung\nBad Windsheim\n\nDem Amtsgericht Fürth -Registergericht- ist eine Liste der Mitglieder des Aufsichtsrats eingereicht worden, § 52 Abs. 3 S. 2 GmbHG."
    },
    {
      "date": "2025-06-19",
      "id": "112699",
      "original_text": "Löschungsankündigung\nBayern Amtsgericht Landshut HRB 10971\nLandhof Konzept GmbH – Egglham",
      "type": "Löschungsankündigung",
      "state": "Bayern",
      "amtsgericht": "Amtsgericht Landshut",
      "registernummer": "HRB 10971",
      "registerart": "HRB",
      "company_name": "Landhof Konzept GmbH",
      "company_seat": "Egglham",
      "details": "19.06.2025 (Bekanntmachungsdatum)\n\nBayern Amtsgericht Landshut HRB 10971\nLöschungsankündigung\n\nLandhof Konzept GmbH\nGesellschaft mit beschränkter Haftung\nEgglham\n\nDas Registergericht beabsichtigt, die im Handelsregister eingetragene Gesellschaft wegen Vermögenslosigkeit von Amts wegen nach § 394 FamFG zu löschen. Die Frist zur Erhebung eines Widerspruchs ist auf einen Monat festgesetzt."
    },
    {
      "date": "2025-06-19",
      "id": "112700",
      "original_text": "Registerbekanntmachung nach dem Umwandlungsgesetz\nBayern Amtsgericht München HRB 242087\nCHECK24 Vergleichsportal Elektronik & Haushalt GmbH – München",
      "type": "Registerbekanntmachung nach dem Umwandlungsgesetz",
      "state": "Bayern",
      "amtsgericht": "Amtsgericht München",
      "registernummer": "HRB 242087",
      "registerart": "HRB",
      "company_name": "CHECK24 Vergleichsportal Elektronik & Haushalt GmbH",
      "company_seat": "München",
      "details": "19.06.2025 (Bekanntmachungsdatum)\n\nBayern Amtsgericht München HRB 242087\nRegisterbekanntmachung nach dem Umwandlungsgesetz 18.06.2025 (Eintragungsdatum)\n\nCHECK24 Vergleichsportal Elektronik & Haushalt GmbH\nGesellschaft mit beschränkter Haftung\nMünchen\n\nDen Gläubigern der an der Spaltung beteiligten Rechtsträger ist, wenn sie binnen sechs Monaten nach dem Tag, an dem die Eintragung der Spaltung in das Register des Sitzes desjenigen Rechtsträgers, dessen Gläubiger sie sind, nach §§ 125, 19 Abs. 3 UmwG als bekannt gemacht gilt, ihren Anspruch nach Grund und Höhe in Textform anmelden, Sicherheit zu leisten, soweit sie nicht Befriedigung verlangen können. Dieses Recht steht den Gläubigern jedoch nur zu, wenn sie glaubhaft machen, dass durch die Spaltung die Erfüllung ihrer Forderung gefährdet wird."
    },
    {
      "date": "2025-06-19",
      "id": "112701",
      "original_text": "Registerbekanntmachung nach dem Umwandlungsgesetz\nBayern Amtsgericht München HRB 235845\nClinicView GmbH – Sankt Wolfgang",
      "type": "Registerbekanntmachung nach dem Umwandlungsgesetz",
      "state": "Bayern",
      "amtsgericht": "Amtsgericht München",
      "registernummer": "HRB 235845",
      "registerart": "HRB",
      "company_name": "ClinicView GmbH",
      "company_seat": "Sankt Wolfgang",
      "details": "19.06.2025 (Bekanntmachungsdatum)\n\nBayern Amtsgericht München HRB 235845\nRegisterbekanntmachung nach dem Umwandlungsgesetz 18.06.2025 (Eintragungsdatum)\n\nClinicView GmbH\nGesellschaft mit beschränkter Haftung\nSankt Wolfgang\n\nDen Gläubigern der an der Verschmelzung beteiligten Rechtsträger ist, wenn sie binnen sechs Monaten nach dem Tag, an dem die Eintragung der Verschmelzung in das Register des Sitzes desjenigen Rechtsträgers, dessen Gläubiger sie sind, nach § 19 Abs. 3 UmwG als bekannt gemacht gilt, ihren Anspruch nach Grund und Höhe in Textform anmelden, Sicherheit zu leisten, soweit sie nicht Befriedigung verlangen können. Dieses Recht steht den Gläubigern jedoch nur zu, wenn sie glaubhaft machen, dass durch die Verschmelzung die Erfüllung ihrer Forderung gefährdet wird."
    },
    {
      "date": "2025-06-19",
      "id": "112702",
      "original_text": "Registerbekanntmachung nach dem Umwandlungsgesetz\nBayern Amtsgericht München HRB 291546\nAIRE München Hohenlindener 2 Beteiligungs GmbH – München",
      "type": "Registerbekanntmachung nach dem Umwandlungsgesetz",
      "state": "Bayern",
      "amtsgericht": "Amtsgericht München",
      "registernummer": "HRB 291546",
      "registerart": "HRB",
      "company_name": "AIRE München Hohenlindener 2 Beteiligungs GmbH",
      "company_seat": "München",
      "details": "19.06.2025 (Bekanntmachungsdatum)\n\nBayern Amtsgericht München HRB 291546\nRegisterbekanntmachung nach dem Umwandlungsgesetz 18.06.2025 (Eintragungsdatum)\n\nAIRE München Hohenlindener 2 Beteiligungs GmbH\nGesellschaft mit beschränkter Haftung\nMünchen\n\nDen Gläubigern der an der Verschmelzung beteiligten Rechtsträger ist, wenn sie binnen sechs Monaten nach dem Tag, an dem die Eintragung der Verschmelzung in das Register des Sitzes desjenigen Rechtsträgers, dessen Gläubiger sie sind, nach § 19 Abs. 3 UmwG als bekannt gemacht gilt, ihren Anspruch nach Grund und Höhe in Textform anmelden, Sicherheit zu leisten, soweit sie nicht Befriedigung verlangen können. Dieses Recht steht den Gläubigern jedoch nur zu, wenn sie glaubhaft machen, dass durch die Verschmelzung die Erfüllung ihrer Forderung gefährdet wird."
    },
    {
      "date": "2025-06-19",
      "id": "112703",
      "original_text": "Einreichung neuer Dokumente\nBayern Amtsgericht Augsburg HRB 21022\nHOSOKAWA ALPINE Aktiengesellschaft – Augsburg",
      "type": "Einreichung neuer Dokumente",
      "state": "Bayern",
      "amtsgericht": "Amtsgericht Augsburg",
      "registernummer": "HRB 21022",
      "registerart": "HRB",
      "company_name": "HOSOKAWA ALPINE Aktiengesellschaft",
      "company_seat": "Augsburg",
      "details": "19.06.2025 (Bekanntmachungsdatum)\n\nBayern Amtsgericht Augsburg HRB 21022\nEinreichung neuer Dokumente 18.06.2025 (Eintragungsdatum)\n\nHOSOKAWA ALPINE Aktiengesellschaft\nAktiengesellschaft\nAugsburg\n\nDem Amtsgericht Augsburg -Registergericht- ist eine Liste der Mitglieder des Aufsichtsrats eingereicht worden, § 106 AktG."
    },
    {
      "date": "2025-06-19",
      "id": "112704",
      "original_text": "Registerbekanntmachung nach dem Umwandlungsgesetz\nBayern Amtsgericht München HRB 123355\nCloud SG Germany GmbH – München",
      "type": "Registerbekanntmachung nach dem Umwandlungsgesetz",
      "state": "Bayern",
      "amtsgericht": "Amtsgericht München",
      "registernummer": "HRB 123355",
      "registerart": "HRB",
      "company_name": "Cloud SG Germany GmbH",
      "company_seat": "München",
      "details": "19.06.2025 (Bekanntmachungsdatum)\n\nBayern Amtsgericht München HRB 123355\nRegisterbekanntmachung nach dem Umwandlungsgesetz 18.06.2025 (Eintragungsdatum)\n\nCloud SG Germany GmbH\nGesellschaft mit beschränkter Haftung\nMünchen\n\nDen Gläubigern der an der Verschmelzung beteiligten Rechtsträger ist, wenn sie binnen sechs Monaten nach dem Tag, an dem die Eintragung der Verschmelzung in das Register des Sitzes desjenigen Rechtsträgers, dessen Gläubiger sie sind, nach § 19 Abs. 3 UmwG als bekannt gemacht gilt, ihren Anspruch nach Grund und Höhe in Textform anmelden, Sicherheit zu leisten, soweit sie nicht Befriedigung verlangen können. Dieses Recht steht den Gläubigern jedoch nur zu, wenn sie glaubhaft machen, dass durch die Verschmelzung die Erfüllung ihrer Forderung gefährdet wird."
    },
    {
      "date": "2025-06-19",
      "id": "112705",
      "original_text": "Sonstige Registerbekanntmachung\nBayern Amtsgericht Nürnberg HRB 18700\nPSYMA GROUP AG – Rückersdorf",
      "type": "Sonstige Registerbekanntmachung",
      "state": "Bayern",
      "amtsgericht": "Amtsgericht Nürnberg",
      "registernummer": "HRB 18700",
      "registerart": "HRB",
      "company_name": "PSYMA GROUP AG",
      "company_seat": "Rückersdorf",
      "details": "19.06.2025 (Bekanntmachungsdatum)\n\nBayern Amtsgericht Nürnberg HRB 18700\nSonstige Registerbekanntmachung\n\nPSYMA GROUP AG\nAktiengesellschaft\nRückersdorf\n\nDem Amtsgericht Nürnberg -Registergericht- ist eine Liste der Mitglieder des Aufsichtsrats eingereicht worden, § 106 AktG."
    },
    {
      "date": "2025-06-19",
      "id": "112706",
      "original_text": "Einreichung neuer Dokumente\nBayern Amtsgericht Würzburg HRB 12609\nOMB AG Online.Marketing.Berater. – Würzburg",
      "type": "Einreichung neuer Dokumente",
      "state": "Bayern",
      "amtsgericht": "Amtsgericht Würzburg",
      "registernummer": "HRB 12609",
      "registerart": "HRB",
      "company_name": "OMB AG Online.Marketing.Berater.",
      "company_seat": "Würzburg",
      "details": "19.06.2025 (Bekanntmachungsdatum)\n\nBayern Amtsgericht Würzburg HRB 12609\nEinreichung neuer Dokumente\n\nOMB AG Online.Marketing.Berater.\nAktiengesellschaft\nWürzburg\n\nDem Amtsgericht Würzburg -Registergericht- ist eine Liste der Mitglieder des Aufsichtsrats eingereicht worden, § 106 AktG."
    },
    {
      "date": "2025-06-19",
      "id": "112707",
      "original_text": "Registerbekanntmachung nach dem Umwandlungsgesetz\nBayern Amtsgericht München HRB 254053\nTierärzte IVC Evidensia GmbH – München",
      "type": "Registerbekanntmachung nach dem Umwandlungsgesetz",
      "state": "Bayern",
      "amtsgericht": "Amtsgericht München",
      "registernummer": "HRB 254053",
      "registerart": "HRB",
      "company_name": "Tierärzte IVC Evidensia GmbH",
      "company_seat": "München",
      "details": "19.06.2025 (Bekanntmachungsdatum)\n\nBayern Amtsgericht München HRB 254053\nRegisterbekanntmachung nach dem Umwandlungsgesetz 18.06.2025 (Eintragungsdatum)\n\nTierärzte IVC Evidensia GmbH\nGesellschaft mit beschränkter Haftung\nMünchen\n\nDen Gläubigern der an der Verschmelzung beteiligten Rechtsträger ist, wenn sie binnen sechs Monaten nach dem Tag, an dem die Eintragung der Verschmelzung in das Register des Sitzes desjenigen Rechtsträgers, dessen Gläubiger sie sind, nach § 19 Abs. 3 UmwG als bekannt gemacht gilt, ihren Anspruch nach Grund und Höhe in Textform anmelden, Sicherheit zu leisten, soweit sie nicht Befriedigung verlangen können. Dieses Recht steht den Gläubigern jedoch nur zu, wenn sie glaubhaft machen, dass durch die Verschmelzung die Erfüllung ihrer Forderung gefährdet wird."
    },
    {
      "date": "2025-06-19",
      "id": "112708",
      "original_text": "Registerbekanntmachung nach dem Umwandlungsgesetz\nBayern Amtsgericht München HRB 88876\nZweithaar-Studio Annemarie Rothbauer-Golenia Internationale Creationen GmbH – München",
      "type": "Registerbekanntmachung nach dem Umwandlungsgesetz",
      "state": "Bayern",
      "amtsgericht": "Amtsgericht München",
      "registernummer": "HRB 88876",
      "registerart": "HRB",
      "company_name": "Zweithaar-Studio Annemarie Rothbauer-Golenia Internationale Creationen GmbH",
      "company_seat": "München",
      "details": "19.06.2025 (Bekanntmachungsdatum)\n\nBayern Amtsgericht München HRB 88876\nRegisterbekanntmachung nach dem Umwandlungsgesetz 18.06.2025 (Eintragungsdatum)\n\nZweithaar-Studio Annemarie Rothbauer-Golenia Internationale Creationen GmbH\nGesellschaft mit beschränkter Haftung\nMünchen\n\nDen Gläubigern der an der Verschmelzung beteiligten Rechtsträger ist, wenn sie binnen sechs Monaten nach dem Tag, an dem die Eintragung der Verschmelzung in das Register des Sitzes desjenigen Rechtsträgers, dessen Gläubiger sie sind, nach § 19 Abs. 3 UmwG als bekannt gemacht gilt, ihren Anspruch nach Grund und Höhe in Textform anmelden, Sicherheit zu leisten, soweit sie nicht Befriedigung verlangen können. Dieses Recht steht den Gläubigern jedoch nur zu, wenn sie glaubhaft machen, dass durch die Verschmelzung die Erfüllung ihrer Forderung gefährdet wird."
    },
    {
      "date": "2025-06-19",
      "id": "112709",
      "original_text": "Registerbekanntmachung nach dem Umwandlungsgesetz\nBayern Amtsgericht München HRB 179043\nDonnerwetter Musik GmbH – Unterföhring",
      "type": "Registerbekanntmachung nach dem Umwandlungsgesetz",
      "state": "Bayern",
      "amtsgericht": "Amtsgericht München",
      "registernummer": "HRB 179043",
      "registerart": "HRB",
      "company_name": "Donnerwetter Musik GmbH",
      "company_seat": "Unterföhring",
      "details": "19.06.2025 (Bekanntmachungsdatum)\n\nBayern Amtsgericht München HRB 179043\nRegisterbekanntmachung nach dem Umwandlungsgesetz 18.06.2025 (Eintragungsdatum)\n\nDonnerwetter Musik GmbH\nGesellschaft mit beschränkter Haftung\nUnterföhring\n\nDen Gläubigern der an der Verschmelzung beteiligten Rechtsträger ist, wenn sie binnen sechs Monaten nach dem Tag, an dem die Eintragung der Verschmelzung in das Register des Sitzes desjenigen Rechtsträgers, dessen Gläubiger sie sind, nach § 19 Abs. 3 UmwG als bekannt gemacht gilt, ihren Anspruch nach Grund und Höhe in Textform anmelden, Sicherheit zu leisten, soweit sie nicht Befriedigung verlangen können. Dieses Recht steht den Gläubigern jedoch nur zu, wenn sie glaubhaft machen, dass durch die Verschmelzung die Erfüllung ihrer Forderung gefährdet wird."
    },
    {
      "date": "2025-06-19",
      "id": "112710",
      "original_text": "Löschungsankündigung\nBayern Amtsgericht Nürnberg HRA 15745\nBSM Recycling- und Industrieverwertungs GmbH & Co. KG – Nürnberg",
      "type": "Löschungsankündigung",
      "state": "Bayern",
      "amtsgericht": "Amtsgericht Nürnberg",
      "registernummer": "HRA 15745",
      "registerart": "HRA",
      "company_name": "BSM Recycling- und Industrieverwertungs GmbH & Co. KG",
      "company_seat": "Nürnberg",
      "details": "19.06.2025 (Bekanntmachungsdatum)\n\nBayern Amtsgericht Nürnberg HRA 15745\nLöschungsankündigung\n\nBSM Recycling- und Industrieverwertungs GmbH & Co. KG\nKommanditgesellschaft\nNürnberg\n\nDas Registergericht beabsichtigt, die im Handelsregister eingetragene Gesellschaft wegen Vermögenslosigkeit von Amts wegen nach § 394 Abs. 4 FamFG zu löschen. Die Frist zur Erhebung eines Widerspruchs ist auf einen Monat festgesetzt."
    },
    {
      "date": "2025-06-19",
      "id": "112711",
      "original_text": "Registerbekanntmachung nach dem Umwandlungsgesetz\nBayern Amtsgericht München HRA 99252\nPREBAG Immobilien 21 GmbH & Co. KG – Aschheim",
      "type": "Registerbekanntmachung nach dem Umwandlungsgesetz",
      "state": "Bayern",
      "amtsgericht": "Amtsgericht München",
      "registernummer": "HRA 99252",
      "registerart": "HRA",
      "company_name": "PREBAG Immobilien 21 GmbH & Co. KG",
      "company_seat": "Aschheim",
      "details": "19.06.2025 (Bekanntmachungsdatum)\n\nBayern Amtsgericht München HRA 99252\nRegisterbekanntmachung nach dem Umwandlungsgesetz 18.06.2025 (Eintragungsdatum)\n\nPREBAG Immobilien 21 GmbH & Co. KG\nKommanditgesellschaft\nAschheim\n\nDen Gläubigern der an der Verschmelzung beteiligten Rechtsträger ist, wenn sie binnen sechs Monaten nach dem Tag, an dem die Eintragung der Verschmelzung in das Register des Sitzes desjenigen Rechtsträgers, dessen Gläubiger sie sind, nach § 19 Abs. 3 UmwG als bekannt gemacht gilt, ihren Anspruch nach Grund und Höhe in Textform anmelden, Sicherheit zu leisten, soweit sie nicht Befriedigung verlangen können. Dieses Recht steht den Gläubigern jedoch nur zu, wenn sie glaubhaft machen, dass durch die Verschmelzung die Erfüllung ihrer Forderung gefährdet wird."
    },
    {
      "date": "2025-06-19",
      "id": "112712",
      "original_text": "Registerbekanntmachung nach dem Umwandlungsgesetz\nBayern Amtsgericht München HRB 250455\nContrium Emission GmbH – Starnberg",
      "type": "Registerbekanntmachung nach dem Umwandlungsgesetz",
      "state": "Bayern",
      "amtsgericht": "Amtsgericht München",
      "registernummer": "HRB 250455",
      "registerart": "HRB",
      "company_name": "Contrium Emission GmbH",
      "company_seat": "Starnberg",
      "details": "19.06.2025 (Bekanntmachungsdatum)\n\nBayern Amtsgericht München HRB 250455\nRegisterbekanntmachung nach dem Umwandlungsgesetz 18.06.2025 (Eintragungsdatum)\n\nContrium Emission GmbH\nGesellschaft mit beschränkter Haftung\nStarnberg\n\nDen Gläubigern der an der Verschmelzung beteiligten Rechtsträger ist, wenn sie binnen sechs Monaten nach dem Tag, an dem die Eintragung der Verschmelzung in das Register des Sitzes desjenigen Rechtsträgers, dessen Gläubiger sie sind, nach § 19 Abs. 3 UmwG als bekannt gemacht gilt, ihren Anspruch nach Grund und Höhe in Textform anmelden, Sicherheit zu leisten, soweit sie nicht Befriedigung verlangen können. Dieses Recht steht den Gläubigern jedoch nur zu, wenn sie glaubhaft machen, dass durch die Verschmelzung die Erfüllung ihrer Forderung gefährdet wird."
    },
    {
      "date": "2025-06-19",
      "id": "112713",
      "original_text": "Löschungsankündigung\nBayern Amtsgericht Nürnberg HRB 25158\nAndrea Walter Gastronomie UG (haftungsbeschränkt) – Nürnberg",
      "type": "Löschungsankündigung",
      "state": "Bayern",
      "amtsgericht": "Amtsgericht Nürnberg",
      "registernummer": "HRB 25158",
      "registerart": "HRB",
      "company_name": "Andrea Walter Gastronomie UG (haftungsbeschränkt)",
      "company_seat": "Nürnberg",
      "details": "19.06.2025 (Bekanntmachungsdatum)\n\nBayern Amtsgericht Nürnberg HRB 25158\nLöschungsankündigung\n\nAndrea Walter Gastronomie UG (haftungsbeschränkt)\nGesellschaft mit beschränkter Haftung\nNürnberg\n\nDas Registergericht beabsichtigt, die im Handelsregister eingetragene Gesellschaft wegen Vermögenslosigkeit von Amts wegen nach § 394 FamFG zu löschen. Die Frist zur Erhebung eines Widerspruchs ist auf einen Monat festgesetzt."
    },
    {
      "date": "2025-06-19",
      "id": "112714",
      "original_text": "Registerbekanntmachung nach dem Umwandlungsgesetz\nBayern Amtsgericht Nürnberg HRB 37257\nT9 Impact1 GmbH – Nürnberg",
      "type": "Registerbekanntmachung nach dem Umwandlungsgesetz",
      "state": "Bayern",
      "amtsgericht": "Amtsgericht Nürnberg",
      "registernummer": "HRB 37257",
      "registerart": "HRB",
      "company_name": "T9 Impact1 GmbH",
      "company_seat": "Nürnberg",
      "details": "19.06.2025 (Bekanntmachungsdatum)\n\nBayern Amtsgericht Nürnberg HRB 37257\nRegisterbekanntmachung nach dem Umwandlungsgesetz 18.06.2025 (Eintragungsdatum)\n\nT9 Impact1 GmbH\nGesellschaft mit beschränkter Haftung\nNürnberg\n\nDen Gläubigern der an der Verschmelzung beteiligten Rechtsträger ist, wenn sie binnen sechs Monaten nach dem Tag, an dem die Eintragung der Verschmelzung in das Register des Sitzes desjenigen Rechtsträgers, dessen Gläubiger sie sind, nach § 19 Abs. 3 UmwG als bekannt gemacht gilt, ihren Anspruch nach Grund und Höhe in Textform anmelden, Sicherheit zu leisten, soweit sie nicht Befriedigung verlangen können. Dieses Recht steht den Gläubigern jedoch nur zu, wenn sie glaubhaft machen, dass durch die Verschmelzung die Erfüllung ihrer Forderung gefährdet wird."
    },
    {
      "date": "2025-06-19",
      "id": "112715",
      "original_text": "Registerbekanntmachung nach dem Umwandlungsgesetz\nHamburg Amtsgericht Hamburg HRB 79863\nIntellivate GmbH – Hamburg",
      "type": "Registerbekanntmachung nach dem Umwandlungsgesetz",
      "state": "Hamburg",
      "amtsgericht": "Amtsgericht Hamburg",
      "registernummer": "HRB 79863",
      "registerart": "HRB",
      "company_name": "Intellivate GmbH",
      "company_seat": "Hamburg",
      "details": "19.06.2025 (Bekanntmachungsdatum)\n\nHamburg Amtsgericht Hamburg HRB 79863\nRegisterbekanntmachung nach dem Umwandlungsgesetz 12.06.2025 (Eintragungsdatum)\n\nIntellivate GmbH\nGesellschaft mit beschränkter Haftung\nHamburg\n\nAls nicht eingetragen wird bekannt gemacht:\nDen Gläubigern der an der Verschmelzung beteiligten Gesellschaften ist, wenn sie binnen sechs Monaten nach dem Tag, an dem die Eintragung der Verschmelzung in das Register des Sitzes desjenigen Rechtsträgers, dessen Gläubiger sie sind, nach § 19 Absatz 3 UmwG als bekannt gemacht gilt, ihren Anspruch nach Grund und Höhe schriftlich anmelden, Sicherheit zu leisten, soweit sie nicht Befriedigung verlangen können. Dieses Recht steht den Gläubigern jedoch nur zu, wenn sie glaubhaft machen, dass durch die Verschmelzung die Erfüllung ihrer Forderung gefährdet wird."
    },
    {
      "date": "2025-06-19",
      "id": "112716",
      "original_text": "Registerbekanntmachung nach dem Umwandlungsgesetz\nHamburg Amtsgericht Hamburg HRB 114750\nICS Ihr-Chiropraktor GmbH – Hamburg",
      "type": "Registerbekanntmachung nach dem Umwandlungsgesetz",
      "state": "Hamburg",
      "amtsgericht": "Amtsgericht Hamburg",
      "registernummer": "HRB 114750",
      "registerart": "HRB",
      "company_name": "ICS Ihr-Chiropraktor GmbH",
      "company_seat": "Hamburg",
      "details": "19.06.2025 (Bekanntmachungsdatum)\n\nHamburg Amtsgericht Hamburg HRB 114750\nRegisterbekanntmachung nach dem Umwandlungsgesetz 12.06.2025 (Eintragungsdatum)\n\nICS Ihr-Chiropraktor GmbH\nGesellschaft mit beschränkter Haftung\nHamburg\n\nAls nicht eingetragen wird bekannt gemacht:\nDen Gläubigern der an der Verschmelzung beteiligten Gesellschaften ist, wenn sie binnen sechs Monaten nach dem Tag, an dem die Eintragung der Verschmelzung in das Register des Sitzes desjenigen Rechtsträgers, dessen Gläubiger sie sind, nach § 19 Absatz 3 UmwG als bekannt gemacht gilt, ihren Anspruch nach Grund und Höhe schriftlich anmelden, Sicherheit zu leisten, soweit sie nicht Befriedigung verlangen können. Dieses Recht steht den Gläubigern jedoch nur zu, wenn sie glaubhaft machen, dass durch die Verschmelzung die Erfüllung ihrer Forderung gefährdet wird."
    },
    {
      "date": "2025-06-19",
      "id": "112717",
      "original_text": "Löschungsankündigung\nSchleswig-Holstein Amtsgericht Flensburg HRB 14021\nLS Springer GmbH – Handewitt",
      "type": "Löschungsankündigung",
      "state": "Schleswig-Holstein",
      "amtsgericht": "Amtsgericht Flensburg",
      "registernummer": "HRB 14021",
      "registerart": "HRB",
      "company_name": "LS Springer GmbH",
      "company_seat": "Handewitt",
      "details": "19.06.2025 (Bekanntmachungsdatum)\n\nSchleswig-Holstein Amtsgericht Flensburg HRB 14021\nLöschungsankündigung\n\nLS Springer GmbH\nGesellschaft mit beschränkter Haftung\nHandewitt\n\nEs ist die Löschung der nachstehenden Gesellschaft wegen Vermögenslosigkeit gemäß § 394 FamFG beabsichtigt.\nWiderspruchsfrist: 2 Monate"
    },
    {
      "date": "2025-06-19",
      "id": "112718",
      "original_text": "Sonstige Registerbekanntmachung\nHamburg Amtsgericht Hamburg HRB 3072\nHamburger Hochbahn Aktiengesellschaft – Hamburg",
      "type": "Sonstige Registerbekanntmachung",
      "state": "Hamburg",
      "amtsgericht": "Amtsgericht Hamburg",
      "registernummer": "HRB 3072",
      "registerart": "HRB",
      "company_name": "Hamburger Hochbahn Aktiengesellschaft",
      "company_seat": "Hamburg",
      "details": "19.06.2025 (Bekanntmachungsdatum)\n\nHamburg Amtsgericht Hamburg HRB 3072\nSonstige Registerbekanntmachung 19.06.2025 (Eintragungsdatum)\n\nHamburger Hochbahn Aktiengesellschaft\nAktiengesellschaft\nHamburg\n\nAls nicht eingetragen wird bekannt gemacht: Liste des Aufsichtsrats wurde eingereicht."
    },
    {
      "date": "2025-06-19",
      "id": "112719",
      "original_text": "Sonstige Registerbekanntmachung\nHamburg Amtsgericht Hamburg HRB 184453\nbp OFW Management 1 GmbH – Hamburg",
      "type": "Sonstige Registerbekanntmachung",
      "state": "Hamburg",
      "amtsgericht": "Amtsgericht Hamburg",
      "registernummer": "HRB 184453",
      "registerart": "HRB",
      "company_name": "bp OFW Management 1 GmbH",
      "company_seat": "Hamburg",
      "details": "19.06.2025 (Bekanntmachungsdatum)\n\nHamburg Amtsgericht Hamburg HRB 184453\nSonstige Registerbekanntmachung 19.06.2025 (Eintragungsdatum)\n\nbp OFW Management 1 GmbH\nGesellschaft mit beschränkter Haftung\nHamburg\n\nAls nicht eingetragen wird bekannt gemacht:  Den Gläubigern der Gesellschaft, deren Forderungen begründet worden sind, bevor die Eintragung der Vertragsbeendigung in das Handelsregister nach § 10 HGB als bekannt gemacht gilt, ist vom anderen Vertragsteil Sicherheit zu leisten, wenn sie sich binnen 6 Monaten nach Bekanntmachung der Eintragung zu diesem Zweck bei ihm melden."
    },
    {
      "date": "2025-06-19",
      "id": "112720",
      "original_text": "Sonstige Registerbekanntmachung\nHamburg Amtsgericht Hamburg HRB 185999\nbp OFW Management 2 GmbH – Hamburg",
      "type": "Sonstige Registerbekanntmachung",
      "state": "Hamburg",
      "amtsgericht": "Amtsgericht Hamburg",
      "registernummer": "HRB 185999",
      "registerart": "HRB",
      "company_name": "bp OFW Management 2 GmbH",
      "company_seat": "Hamburg",
      "details": "19.06.2025 (Bekanntmachungsdatum)\n\nHamburg Amtsgericht Hamburg HRB 185999\nSonstige Registerbekanntmachung 19.06.2025 (Eintragungsdatum)\n\nbp OFW Management 2 GmbH\nGesellschaft mit beschränkter Haftung\nHamburg\n\nAls nicht eingetragen wird bekannt gemacht:  Den Gläubigern der Gesellschaft, deren Forderungen begründet worden sind, bevor die Eintragung der Vertragsbeendigung in das Handelsregister nach § 10 HGB als bekannt gemacht gilt, ist vom anderen Vertragsteil Sicherheit zu leisten, wenn sie sich binnen 6 Monaten nach Bekanntmachung der Eintragung zu diesem Zweck bei ihm melden."
    },
    {
      "date": "2025-06-19",
      "id": "112721",
      "original_text": "Sonstige Registerbekanntmachung\nHamburg Amtsgericht Hamburg HRB 185996\nbp OFW Management 3 GmbH – Hamburg",
      "type": "Sonstige Registerbekanntmachung",
      "state": "Hamburg",
      "amtsgericht": "Amtsgericht Hamburg",
      "registernummer": "HRB 185996",
      "registerart": "HRB",
      "company_name": "bp OFW Management 3 GmbH",
      "company_seat": "Hamburg",
      "details": "19.06.2025 (Bekanntmachungsdatum)\n\nHamburg Amtsgericht Hamburg HRB 185996\nSonstige Registerbekanntmachung 19.06.2025 (Eintragungsdatum)\n\nbp OFW Management 3 GmbH\nGesellschaft mit beschränkter Haftung\nHamburg\n\nAls nicht eingetragen wird bekannt gemacht:  Den Gläubigern der Gesellschaft, deren Forderungen begründet worden sind, bevor die Eintragung der Vertragsbeendigung in das Handelsregister nach § 10 HGB als bekannt gemacht gilt, ist vom anderen Vertragsteil Sicherheit zu leisten, wenn sie sich binnen 6 Monaten nach Bekanntmachung der Eintragung zu diesem Zweck bei ihm melden."
    },
    {
      "date": "2025-06-19",
      "id": "112722",
      "original_text": "Einreichung neuer Dokumente\nBerlin Amtsgericht Berlin (Charlottenburg) HRB 158955\nVIKTOR Oppenheim Haus gemeinnützige SE – Berlin",
      "type": "Einreichung neuer Dokumente",
      "state": "Berlin",
      "amtsgericht": "Amtsgericht Berlin (Charlottenburg)",
      "registernummer": "HRB 158955",
      "registerart": "HRB",
      "company_name": "VIKTOR Oppenheim Haus gemeinnützige SE",
      "company_seat": "Berlin",
      "details": "19.06.2025 (Bekanntmachungsdatum)\n\nBerlin Amtsgericht Berlin (Charlottenburg) HRB 158955\nEinreichung neuer Dokumente\n\nVIKTOR Oppenheim Haus gemeinnützige SE\nEuropäische Aktiengesellschaft (SE)\nBerlin\n\nAls nicht eingetragen wird veröffentlicht:\n\nEs wurde eine neue Liste der Verwaltungsratsmitglieder eingereicht (§ 106 AktG)."
    },
    {
      "date": "2025-06-19",
      "id": "112723",
      "original_text": "Einreichung neuer Dokumente\nBerlin Amtsgericht Berlin (Charlottenburg) HRB 230317\nMister Spex SE – Berlin",
      "type": "Einreichung neuer Dokumente",
      "state": "Berlin",
      "amtsgericht": "Amtsgericht Berlin (Charlottenburg)",
      "registernummer": "HRB 230317",
      "registerart": "HRB",
      "company_name": "Mister Spex SE",
      "company_seat": "Berlin",
      "details": "19.06.2025 (Bekanntmachungsdatum)\n\nBerlin Amtsgericht Berlin (Charlottenburg) HRB 230317\nEinreichung neuer Dokumente\n\nMister Spex SE\nEuropäische Aktiengesellschaft (SE)\nBerlin\n\nAls nicht eingetragen wird veröffentlicht: Es wurde eine neue Liste der Aufsichtsratsmitglieder eingereicht (§ 106 AktG)."
    },
    {
      "date": "2025-06-19",
      "id": "112724",
      "original_text": "Registerbekanntmachung nach dem Umwandlungsgesetz\nHamburg Amtsgericht Hamburg HRB 188705\nM-CO REFINANCE l GmbH – Hamburg",
      "type": "Registerbekanntmachung nach dem Umwandlungsgesetz",
      "state": "Hamburg",
      "amtsgericht": "Amtsgericht Hamburg",
      "registernummer": "HRB 188705",
      "registerart": "HRB",
      "company_name": "M-CO REFINANCE l GmbH",
      "company_seat": "Hamburg",
      "details": "19.06.2025 (Bekanntmachungsdatum)\n\nHamburg Amtsgericht Hamburg HRB 188705\nRegisterbekanntmachung nach dem Umwandlungsgesetz 19.06.2025 (Eintragungsdatum)\n\nM-CO REFINANCE l GmbH\nGesellschaft mit beschränkter Haftung\nHamburg\n\nAls nicht eingetragen wird bekannt gemacht:\nDen Gläubigern der an der Verschmelzung beteiligten Gesellschaften ist, wenn sie binnen sechs Monaten nach dem Tag, an dem die Eintragung der Verschmelzung in das Register des Sitzes desjenigen Rechtsträgers, dessen Gläubiger sie sind, nach § 19 Absatz 3 UmwG als bekannt gemacht gilt, ihren Anspruch nach Grund und Höhe schriftlich anmelden, Sicherheit zu leisten, soweit sie nicht Befriedigung verlangen können. Dieses Recht steht den Gläubigern jedoch nur zu, wenn sie glaubhaft machen, dass durch die Verschmelzung die Erfüllung ihrer Forderung gefährdet wird."
    },
    {
      "date": "2025-06-19",
      "id": "112725",
      "original_text": "Registerbekanntmachung nach dem Umwandlungsgesetz\nHamburg Amtsgericht Hamburg HRB 157994\nMennewisch & Co. Capital GmbH – Hamburg",
      "type": "Registerbekanntmachung nach dem Umwandlungsgesetz",
      "state": "Hamburg",
      "amtsgericht": "Amtsgericht Hamburg",
      "registernummer": "HRB 157994",
      "registerart": "HRB",
      "company_name": "Mennewisch & Co. Capital GmbH",
      "company_seat": "Hamburg",
      "details": "19.06.2025 (Bekanntmachungsdatum)\n\nHamburg Amtsgericht Hamburg HRB 157994\nRegisterbekanntmachung nach dem Umwandlungsgesetz 19.06.2025 (Eintragungsdatum)\n\nMennewisch & Co. Capital GmbH\nGesellschaft mit beschränkter Haftung\nHamburg\n\nAls nicht eingetragen wird bekannt gemacht:\nDen Gläubigern der an der Verschmelzung beteiligten Gesellschaften ist, wenn sie binnen sechs Monaten nach dem Tag, an dem die Eintragung der Verschmelzung in das Register des Sitzes desjenigen Rechtsträgers, dessen Gläubiger sie sind, nach § 19 Absatz 3 UmwG als bekannt gemacht gilt, ihren Anspruch nach Grund und Höhe schriftlich anmelden, Sicherheit zu leisten, soweit sie nicht Befriedigung verlangen können. Dieses Recht steht den Gläubigern jedoch nur zu, wenn sie glaubhaft machen, dass durch die Verschmelzung die Erfüllung ihrer Forderung gefährdet wird."
    },
    {
      "date": "2025-06-19",
      "id": "112726",
      "original_text": "Löschungsankündigung\nBrandenburg Amtsgericht Potsdam HRB 38851\nI AM GmbH – Rathenow",
      "type": "Löschungsankündigung",
      "state": "Brandenburg",
      "amtsgericht": "Amtsgericht Potsdam",
      "registernummer": "HRB 38851",
      "registerart": "HRB",
      "company_name": "I AM GmbH",
      "company_seat": "Rathenow",
      "details": "19.06.2025 (Bekanntmachungsdatum)\n\nBrandenburg Amtsgericht Potsdam HRB 38851\nLöschungsankündigung\n\nI AM GmbH\nGesellschaft mit beschränkter Haftung\nRathenow\n\nBei der nachstehenden Gesellschaft wird das Amtslöschungsverfahren gemäß § 394 FamFG eingeleitet."
    },
    {
      "date": "2025-06-19",
      "id": "112727",
      "original_text": "Löschungsankündigung\nSchleswig-Holstein Amtsgericht Flensburg HRB 14933\n1A Akustikbau Fahrdorf UG (haftungsbeschränkt) – Fahrdorf",
      "type": "Löschungsankündigung",
      "state": "Schleswig-Holstein",
      "amtsgericht": "Amtsgericht Flensburg",
      "registernummer": "HRB 14933",
      "registerart": "HRB",
      "company_name": "1A Akustikbau Fahrdorf UG (haftungsbeschränkt)",
      "company_seat": "Fahrdorf",
      "details": "19.06.2025 (Bekanntmachungsdatum)\n\nSchleswig-Holstein Amtsgericht Flensburg HRB 14933\nLöschungsankündigung\n\n1A Akustikbau Fahrdorf UG (haftungsbeschränkt)\nGesellschaft mit beschränkter Haftung\nFahrdorf\n\nEs ist die Löschung der nachstehenden Gesellschaft wegen Vermögenslosigkeit gemäß § 394 FamFG beabsichtigt.\nWiderspruchsfrist: 2 Monate"
    },
    {
      "date": "2025-06-19",
      "id": "112728",
      "original_text": "Einreichung neuer Dokumente\nBerlin Amtsgericht Berlin (Charlottenburg) HRB 50000\nDeutsche Bahn Aktiengesellschaft – Berlin",
      "type": "Einreichung neuer Dokumente",
      "state": "Berlin",
      "amtsgericht": "Amtsgericht Berlin (Charlottenburg)",
      "registernummer": "HRB 50000",
      "registerart": "HRB",
      "company_name": "Deutsche Bahn Aktiengesellschaft",
      "company_seat": "Berlin",
      "details": "19.06.2025 (Bekanntmachungsdatum)\n\nBerlin Amtsgericht Berlin (Charlottenburg) HRB 50000\nEinreichung neuer Dokumente\n\nDeutsche Bahn Aktiengesellschaft\nAktiengesellschaft\nBerlin\n\nAls nicht eingetragen wird veröffentlicht: Es wurde eine neue Liste der Aufsichtsratsmitglieder eingereicht (§ 106 AktG)."
    },
    {
      "date": "2025-06-19",
      "id": "112729",
      "original_text": "Registerbekanntmachung nach dem Umwandlungsgesetz\nSchleswig-Holstein Amtsgericht Kiel HRA 12614\nHühnerhof Postkamp GmbH & Co. KG – Altenholz",
      "type": "Registerbekanntmachung nach dem Umwandlungsgesetz",
      "state": "Schleswig-Holstein",
      "amtsgericht": "Amtsgericht Kiel",
      "registernummer": "HRA 12614",
      "registerart": "HRA",
      "company_name": "Hühnerhof Postkamp GmbH & Co. KG",
      "company_seat": "Altenholz",
      "details": "19.06.2025 (Bekanntmachungsdatum)\n\nSchleswig-Holstein Amtsgericht Kiel HRA 12614\nRegisterbekanntmachung nach dem Umwandlungsgesetz 13.06.2025 (Eintragungsdatum)\n\nHühnerhof Postkamp GmbH & Co. KG\nKommanditgesellschaft\nAltenholz\n\nZu Eintragungsnummer 2 vom 13.06.2025 wird als nicht eingetragen veröffentlicht: Den Gläubigern der an der Spaltung beteiligten Rechtsträger ist, wenn sie binnen sechs Monaten nach dem Tag, an dem die Eintragung der Spaltung in das Register des Sitzes desjenigen Rechtsträgers, dessen Gläubiger sie sind,  bekannt gemacht worden ist, ihren Anspruch nach Grund und Höhe schriftlich anmelden, Sicherheit zu leisten, soweit sie nicht Befriedigung verlangen können. Dieses Recht steht den Gläubigern jedoch nur zu, wenn sie glaubhaft machen, dass durch die Spaltung die Erfüllung ihrer Forderung gefährdet wird."
    },
    {
      "date": "2025-06-19",
      "id": "112730",
      "original_text": "Einreichung neuer Dokumente\nBerlin Amtsgericht Berlin (Charlottenburg) HRB 276168\nGSB Gold Standard Global SE – Berlin",
      "type": "Einreichung neuer Dokumente",
      "state": "Berlin",
      "amtsgericht": "Amtsgericht Berlin (Charlottenburg)",
      "registernummer": "HRB 276168",
      "registerart": "HRB",
      "company_name": "GSB Gold Standard Global SE",
      "company_seat": "Berlin",
      "details": "19.06.2025 (Bekanntmachungsdatum)\n\nBerlin Amtsgericht Berlin (Charlottenburg) HRB 276168\nEinreichung neuer Dokumente\n\nGSB Gold Standard Global SE\nEuropäische Aktiengesellschaft (SE)\nBerlin\n\nAls nicht eingetragen wird veröffentlicht:\n\nEs wurde eine neue Liste der Aufsichtsratsmitglieder eingereicht (§ 106 AktG)."
    },
    {
      "date": "2025-06-19",
      "id": "112731",
      "original_text": "Einreichung neuer Dokumente\nHamburg Amtsgericht Hamburg HRB 189825\nAlsterhöhe 18. V V AG – Hamburg",
      "type": "Einreichung neuer Dokumente",
      "state": "Hamburg",
      "amtsgericht": "Amtsgericht Hamburg",
      "registernummer": "HRB 189825",
      "registerart": "HRB",
      "company_name": "Alsterhöhe 18. V V AG",
      "company_seat": "Hamburg",
      "details": "19.06.2025 (Bekanntmachungsdatum)\n\nHamburg Amtsgericht Hamburg HRB 189825\nEinreichung neuer Dokumente\n\nAlsterhöhe 18. V V AG\nAktiengesellschaft\nHamburg\n\nAls nicht eingetragen wird bekannt gemacht: Liste des Aufsichtsrats wurde eingereicht."
    },
    {
      "date": "2025-06-19",
      "id": "112732",
      "original_text": "Löschungsankündigung\nBerlin Amtsgericht Berlin (Charlottenburg) HRB 113286\nANUK GmbH – Berlin",
      "type": "Löschungsankündigung",
      "state": "Berlin",
      "amtsgericht": "Amtsgericht Berlin (Charlottenburg)",
      "registernummer": "HRB 113286",
      "registerart": "HRB",
      "company_name": "ANUK GmbH",
      "company_seat": "Berlin",
      "details": "19.06.2025 (Bekanntmachungsdatum)\n\nBerlin Amtsgericht Berlin (Charlottenburg) HRB 113286\nLöschungsankündigung\n\nANUK GmbH\nGesellschaft mit beschränkter Haftung\nBerlin\n\nBei der nachstehenden Gesellschaft wird das Amtslöschungsverfahren gemäß § 394 FamFG eingeleitet. Widerspruchsfrist 6 Wochen"
    },
    {
      "date": "2025-06-19",
      "id": "112733",
      "original_text": "Löschungsankündigung\nBerlin Amtsgericht Berlin (Charlottenburg) HRB 159289\nLuTraSol UG (haftungsbeschränkt) – Berlin",
      "type": "Löschungsankündigung",
      "state": "Berlin",
      "amtsgericht": "Amtsgericht Berlin (Charlottenburg)",
      "registernummer": "HRB 159289",
      "registerart": "HRB",
      "company_name": "LuTraSol UG (haftungsbeschränkt)",
      "company_seat": "Berlin",
      "details": "19.06.2025 (Bekanntmachungsdatum)\n\nBerlin Amtsgericht Berlin (Charlottenburg) HRB 159289\nLöschungsankündigung\n\nLuTraSol UG (haftungsbeschränkt)\nGesellschaft mit beschränkter Haftung\nBerlin\n\nBei der nachstehenden Gesellschaft wird das Amtslöschungsverfahren gemäß § 394 FamFG eingeleitet. Widerspruchsfrist 6 Wochen"
    },
    {
      "date": "2025-06-19",
      "id": "112734",
      "original_text": "Sonstige Registerbekanntmachung\nHamburg Amtsgericht Hamburg HRB 159581\nZEAL Network SE – Hamburg",
      "type": "Sonstige Registerbekanntmachung",
      "state": "Hamburg",
      "amtsgericht": "Amtsgericht Hamburg",
      "registernummer": "HRB 159581",
      "registerart": "HRB",
      "company_name": "ZEAL Network SE",
      "company_seat": "Hamburg",
      "details": "19.06.2025 (Bekanntmachungsdatum)\n\nHamburg Amtsgericht Hamburg HRB 159581\nSonstige Registerbekanntmachung\n\nZEAL Network SE\nEuropäische Aktiengesellschaft (SE)\nHamburg\n\nAls nicht eingetragen wird bekannt gemacht: Liste des Aufsichtsrats wurde eingereicht."
    },
    {
      "date": "2025-06-19",
      "id": "112735",
      "original_text": "Einreichung neuer Dokumente\nBerlin Amtsgericht Berlin (Charlottenburg) HRB 255736\nMemovida GmbH – Berlin",
      "type": "Einreichung neuer Dokumente",
      "state": "Berlin",
      "amtsgericht": "Amtsgericht Berlin (Charlottenburg)",
      "registernummer": "HRB 255736",
      "registerart": "HRB",
      "company_name": "Memovida GmbH",
      "company_seat": "Berlin",
      "details": "19.06.2025 (Bekanntmachungsdatum)\n\nBerlin Amtsgericht Berlin (Charlottenburg) HRB 255736\nEinreichung neuer Dokumente\n\nMemovida GmbH\nGesellschaft mit beschränkter Haftung\nBerlin\n\nAls nicht eingetragen wird veröffentlicht: Es wurde eine neue Liste der Beiratsmitglieder eingereicht (§52 GmbHG)."
    },
    {
      "date": "2025-06-19",
      "id": "112736",
      "original_text": "Registerbekanntmachung nach dem Umwandlungsgesetz\nHamburg Amtsgericht Hamburg HRB 98921\nContrium Capital AG – Hamburg",
      "type": "Registerbekanntmachung nach dem Umwandlungsgesetz",
      "state": "Hamburg",
      "amtsgericht": "Amtsgericht Hamburg",
      "registernummer": "HRB 98921",
      "registerart": "HRB",
      "company_name": "Contrium Capital AG",
      "company_seat": "Hamburg",
      "details": "19.06.2025 (Bekanntmachungsdatum)\n\nHamburg Amtsgericht Hamburg HRB 98921\nRegisterbekanntmachung nach dem Umwandlungsgesetz 19.06.2025 (Eintragungsdatum)\n\nContrium Capital AG\nAktiengesellschaft\nHamburg\n\nAls nicht eingetragen wird bekannt gemacht:\nDen Gläubigern der an der Verschmelzung beteiligten Gesellschaften ist, wenn sie binnen sechs Monaten nach dem Tag, an dem die Eintragung der Verschmelzung in das Register des Sitzes desjenigen Rechtsträgers, dessen Gläubiger sie sind, nach § 19 Absatz 3 UmwG als bekannt gemacht gilt, ihren Anspruch nach Grund und Höhe schriftlich anmelden, Sicherheit zu leisten, soweit sie nicht Befriedigung verlangen können. Dieses Recht steht den Gläubigern jedoch nur zu, wenn sie glaubhaft machen, dass durch die Verschmelzung die Erfüllung ihrer Forderung gefährdet wird."
    },
    {
      "date": "2025-06-19",
      "id": "112737",
      "original_text": "Löschungsankündigung\nBerlin Amtsgericht Berlin (Charlottenburg) HRA 55744\nwalluseum UG (haftungsbeschränkt) & Co. KG – Berlin",
      "type": "Löschungsankündigung",
      "state": "Berlin",
      "amtsgericht": "Amtsgericht Berlin (Charlottenburg)",
      "registernummer": "HRA 55744",
      "registerart": "HRA",
      "company_name": "walluseum UG (haftungsbeschränkt) & Co. KG",
      "company_seat": "Berlin",
      "details": "19.06.2025 (Bekanntmachungsdatum)\n\nBerlin Amtsgericht Berlin (Charlottenburg) HRA 55744\nLöschungsankündigung\n\nwalluseum UG (haftungsbeschränkt) & Co. KG\nKommanditgesellschaft\nBerlin\n\nBei dem nachstehenden Unternehmen / der nachstehenden Gesellschaft wird das Amtslöschungsverfahren gemäß § 31 Abs. 2 HGB eingeleitet. Widerspruchsfrist 1 Monat"
    },
    {
      "date": "2025-06-19",
      "id": "112738",
      "original_text": "Löschungsankündigung\nBerlin Amtsgericht Berlin (Charlottenburg) HRB 183272\nC.K. Hoch- und Tiefbau GmbH – Berlin",
      "type": "Löschungsankündigung",
      "state": "Berlin",
      "amtsgericht": "Amtsgericht Berlin (Charlottenburg)",
      "registernummer": "HRB 183272",
      "registerart": "HRB",
      "company_name": "C.K. Hoch- und Tiefbau GmbH",
      "company_seat": "Berlin",
      "details": "19.06.2025 (Bekanntmachungsdatum)\n\nBerlin Amtsgericht Berlin (Charlottenburg) HRB 183272\nLöschungsankündigung\n\nC.K. Hoch- und Tiefbau GmbH\nGesellschaft mit beschränkter Haftung\nBerlin\n\nBei der nachstehenden Gesellschaft wird das Amtslöschungsverfahren gemäß § 394 FamFG eingeleitet. Widerspruchsfrist\n6 Wochen."
    },
    {
      "date": "2025-06-19",
      "id": "112739",
      "original_text": "Löschungsankündigung\nBerlin Amtsgericht Berlin (Charlottenburg) HRB 226262\nLHP a&c UG (haftungsbeschränkt) – Berlin",
      "type": "Löschungsankündigung",
      "state": "Berlin",
      "amtsgericht": "Amtsgericht Berlin (Charlottenburg)",
      "registernummer": "HRB 226262",
      "registerart": "HRB",
      "company_name": "LHP a&c UG (haftungsbeschränkt)",
      "company_seat": "Berlin",
      "details": "19.06.2025 (Bekanntmachungsdatum)\n\nBerlin Amtsgericht Berlin (Charlottenburg) HRB 226262\nLöschungsankündigung\n\nLHP a&c UG (haftungsbeschränkt)\nGesellschaft mit beschränkter Haftung\nBerlin\n\nBei der nachstehenden Gesellschaft wird das Amtslöschungsverfahren gemäß § 394 FamFG eingeleitet. Widerspruchsfrist\n6 Wochen."
    },
    {
      "date": "2025-06-19",
      "id": "112740",
      "original_text": "Registerbekanntmachung nach dem Umwandlungsgesetz\nHamburg Amtsgericht Hamburg HRB 152719\nflaschenpost Hamburg GmbH – Hamburg",
      "type": "Registerbekanntmachung nach dem Umwandlungsgesetz",
      "state": "Hamburg",
      "amtsgericht": "Amtsgericht Hamburg",
      "registernummer": "HRB 152719",
      "registerart": "HRB",
      "company_name": "flaschenpost Hamburg GmbH",
      "company_seat": "Hamburg",
      "details": "19.06.2025 (Bekanntmachungsdatum)\n\nHamburg Amtsgericht Hamburg HRB 152719\nRegisterbekanntmachung nach dem Umwandlungsgesetz 19.06.2025 (Eintragungsdatum)\n\nflaschenpost Hamburg GmbH\nGesellschaft mit beschränkter Haftung\nHamburg\n\nAls nicht eingetragen wird bekannt gemacht:\nDen Gläubigern der an der Verschmelzung beteiligten Gesellschaften ist, wenn sie binnen sechs Monaten nach dem Tag, an dem die Eintragung der Verschmelzung in das Register des Sitzes desjenigen Rechtsträgers, dessen Gläubiger sie sind, nach § 19 Absatz 3 UmwG als bekannt gemacht gilt, ihren Anspruch nach Grund und Höhe schriftlich anmelden, Sicherheit zu leisten, soweit sie nicht Befriedigung verlangen können. Dieses Recht steht den Gläubigern jedoch nur zu, wenn sie glaubhaft machen, dass durch die Verschmelzung die Erfüllung ihrer Forderung gefährdet wird."
    },
    {
      "date": "2025-06-19",
      "id": "112741",
      "original_text": "Registerbekanntmachung nach dem Umwandlungsgesetz\nHamburg Amtsgericht Hamburg HRB 167176\nflaschenpost Hamburg DEX GmbH – Hamburg",
      "type": "Registerbekanntmachung nach dem Umwandlungsgesetz",
      "state": "Hamburg",
      "amtsgericht": "Amtsgericht Hamburg",
      "registernummer": "HRB 167176",
      "registerart": "HRB",
      "company_name": "flaschenpost Hamburg DEX GmbH",
      "company_seat": "Hamburg",
      "details": "19.06.2025 (Bekanntmachungsdatum)\n\nHamburg Amtsgericht Hamburg HRB 167176\nRegisterbekanntmachung nach dem Umwandlungsgesetz 19.06.2025 (Eintragungsdatum)\n\nflaschenpost Hamburg DEX GmbH\nGesellschaft mit beschränkter Haftung\nHamburg\n\nAls nicht eingetragen wird bekannt gemacht:\nDen Gläubigern der an der Verschmelzung beteiligten Gesellschaften ist, wenn sie binnen sechs Monaten nach dem Tag, an dem die Eintragung der Verschmelzung in das Register des Sitzes desjenigen Rechtsträgers, dessen Gläubiger sie sind, nach § 19 Absatz 3 UmwG als bekannt gemacht gilt, ihren Anspruch nach Grund und Höhe schriftlich anmelden, Sicherheit zu leisten, soweit sie nicht Befriedigung verlangen können. Dieses Recht steht den Gläubigern jedoch nur zu, wenn sie glaubhaft machen, dass durch die Verschmelzung die Erfüllung ihrer Forderung gefährdet wird."
    },
    {
      "date": "2025-06-19",
      "id": "112742",
      "original_text": "Registerbekanntmachung nach dem Umwandlungsgesetz\nHamburg Amtsgericht Hamburg HRB 167274\nflaschenpost Hamburg 2 DEX GmbH – Hamburg",
      "type": "Registerbekanntmachung nach dem Umwandlungsgesetz",
      "state": "Hamburg",
      "amtsgericht": "Amtsgericht Hamburg",
      "registernummer": "HRB 167274",
      "registerart": "HRB",
      "company_name": "flaschenpost Hamburg 2 DEX GmbH",
      "company_seat": "Hamburg",
      "details": "19.06.2025 (Bekanntmachungsdatum)\n\nHamburg Amtsgericht Hamburg HRB 167274\nRegisterbekanntmachung nach dem Umwandlungsgesetz 19.06.2025 (Eintragungsdatum)\n\nflaschenpost Hamburg 2 DEX GmbH\nGesellschaft mit beschränkter Haftung\nHamburg\n\nAls nicht eingetragen wird bekannt gemacht:\nDen Gläubigern der an der Verschmelzung beteiligten Gesellschaften ist, wenn sie binnen sechs Monaten nach dem Tag, an dem die Eintragung der Verschmelzung in das Register des Sitzes desjenigen Rechtsträgers, dessen Gläubiger sie sind, nach § 19 Absatz 3 UmwG als bekannt gemacht gilt, ihren Anspruch nach Grund und Höhe schriftlich anmelden, Sicherheit zu leisten, soweit sie nicht Befriedigung verlangen können. Dieses Recht steht den Gläubigern jedoch nur zu, wenn sie glaubhaft machen, dass durch die Verschmelzung die Erfüllung ihrer Forderung gefährdet wird."
    },
    {
      "date": "2025-06-19",
      "id": "112743",
      "original_text": "Registerbekanntmachung nach dem Umwandlungsgesetz\nHamburg Amtsgericht Hamburg HRB 167045\nflaschenpost Hamburg 2 GmbH – Hamburg",
      "type": "Registerbekanntmachung nach dem Umwandlungsgesetz",
      "state": "Hamburg",
      "amtsgericht": "Amtsgericht Hamburg",
      "registernummer": "HRB 167045",
      "registerart": "HRB",
      "company_name": "flaschenpost Hamburg 2 GmbH",
      "company_seat": "Hamburg",
      "details": "19.06.2025 (Bekanntmachungsdatum)\n\nHamburg Amtsgericht Hamburg HRB 167045\nRegisterbekanntmachung nach dem Umwandlungsgesetz 19.06.2025 (Eintragungsdatum)\n\nflaschenpost Hamburg 2 GmbH\nGesellschaft mit beschränkter Haftung\nHamburg\n\nAls nicht eingetragen wird bekannt gemacht:\nDen Gläubigern der an der Verschmelzung beteiligten Gesellschaften ist, wenn sie binnen sechs Monaten nach dem Tag, an dem die Eintragung der Verschmelzung in das Register des Sitzes desjenigen Rechtsträgers, dessen Gläubiger sie sind, nach § 19 Absatz 3 UmwG als bekannt gemacht gilt, ihren Anspruch nach Grund und Höhe schriftlich anmelden, Sicherheit zu leisten, soweit sie nicht Befriedigung verlangen können. Dieses Recht steht den Gläubigern jedoch nur zu, wenn sie glaubhaft machen, dass durch die Verschmelzung die Erfüllung ihrer Forderung gefährdet wird."
    },
    {
      "date": "2025-06-19",
      "id": "112744",
      "original_text": "Registerbekanntmachung nach dem Umwandlungsgesetz\nSchleswig-Holstein Amtsgericht Flensburg HRB 10564\nLuxusdomizile Sylt UG (haftungsbeschränkt) – Sylt/OT Westerland",
      "type": "Registerbekanntmachung nach dem Umwandlungsgesetz",
      "state": "Schleswig-Holstein",
      "amtsgericht": "Amtsgericht Flensburg",
      "registernummer": "HRB 10564",
      "registerart": "HRB",
      "company_name": "Luxusdomizile Sylt UG (haftungsbeschränkt)",
      "company_seat": "Sylt/OT Westerland",
      "details": "19.06.2025 (Bekanntmachungsdatum)\n\nSchleswig-Holstein Amtsgericht Flensburg HRB 10564\nRegisterbekanntmachung nach dem Umwandlungsgesetz 19.06.2025 (Eintragungsdatum)\n\nLuxusdomizile Sylt UG (haftungsbeschränkt)\nGesellschaft mit beschränkter Haftung\nSylt/OT Westerland\n\nZu Eintragungsnummer 3 vom 19.06.2025 wird als nicht eingetragen veröffentlicht:\nDen Gläubigern der an der Verschmelzung beteiligten Rechtsträger ist, wenn sie binnen sechs Monaten nach dem Tag, an dem die Eintragung der Verschmelzung in das Register des Sitzes desjenigen Rechtsträgers, dessen Gläubiger sie sind, als bekannt gemacht gilt, ihren Anspruch nach Grund und Höhe in Textform anmelden, Sicherheit zu leisten, soweit sie nicht Befriedigung verlangen können. Dieses Recht steht den Gläubigern jedoch nur zu, wenn sie glaubhaft machen, dass durch die Verschmelzung die Erfüllung ihrer Forderung gefährdet wird."
    },
    {
      "date": "2025-06-19",
      "id": "112745",
      "original_text": "Registerbekanntmachung nach dem Umwandlungsgesetz\nHamburg Amtsgericht Hamburg HRB 44969\nVerwaltungsgesellschaft Fleethof Mineralölhandel mbH – Hamburg",
      "type": "Registerbekanntmachung nach dem Umwandlungsgesetz",
      "state": "Hamburg",
      "amtsgericht": "Amtsgericht Hamburg",
      "registernummer": "HRB 44969",
      "registerart": "HRB",
      "company_name": "Verwaltungsgesellschaft Fleethof Mineralölhandel mbH",
      "company_seat": "Hamburg",
      "details": "19.06.2025 (Bekanntmachungsdatum)\n\nHamburg Amtsgericht Hamburg HRB 44969\nRegisterbekanntmachung nach dem Umwandlungsgesetz 19.06.2025 (Eintragungsdatum)\n\nVerwaltungsgesellschaft Fleethof Mineralölhandel mbH\nGesellschaft mit beschränkter Haftung\nHamburg\n\nAls nicht eingetragen wird bekannt gemacht:\nDen Gläubigern der an der Verschmelzung beteiligten Gesellschaften ist, wenn sie binnen sechs Monaten nach dem Tag, an dem die Eintragung der Verschmelzung in das Register des Sitzes desjenigen Rechtsträgers, dessen Gläubiger sie sind, nach § 19 Absatz 3 UmwG als bekannt gemacht gilt, ihren Anspruch nach Grund und Höhe schriftlich anmelden, Sicherheit zu leisten, soweit sie nicht Befriedigung verlangen können. Dieses Recht steht den Gläubigern jedoch nur zu, wenn sie glaubhaft machen, dass durch die Verschmelzung die Erfüllung ihrer Forderung gefährdet wird."
    },
    {
      "date": "2025-06-19",
      "id": "112746",
      "original_text": "Registerbekanntmachung nach dem Umwandlungsgesetz\nHamburg Amtsgericht Hamburg HRB 75804\nALSTERBLICK 11. Kapitalverwaltungs-GmbH – Hamburg",
      "type": "Registerbekanntmachung nach dem Umwandlungsgesetz",
      "state": "Hamburg",
      "amtsgericht": "Amtsgericht Hamburg",
      "registernummer": "HRB 75804",
      "registerart": "HRB",
      "company_name": "ALSTERBLICK 11. Kapitalverwaltungs-GmbH",
      "company_seat": "Hamburg",
      "details": "19.06.2025 (Bekanntmachungsdatum)\n\nHamburg Amtsgericht Hamburg HRB 75804\nRegisterbekanntmachung nach dem Umwandlungsgesetz 19.06.2025 (Eintragungsdatum)\n\nALSTERBLICK 11. Kapitalverwaltungs-GmbH\nGesellschaft mit beschränkter Haftung\nHamburg\n\nAls nicht eingetragen wird bekannt gemacht:\nDen Gläubigern der an der Verschmelzung beteiligten Gesellschaften ist, wenn sie binnen sechs Monaten nach dem Tag, an dem die Eintragung der Verschmelzung in das Register des Sitzes desjenigen Rechtsträgers, dessen Gläubiger sie sind, nach § 19 Absatz 3 UmwG als bekannt gemacht gilt, ihren Anspruch nach Grund und Höhe schriftlich anmelden, Sicherheit zu leisten, soweit sie nicht Befriedigung verlangen können. Dieses Recht steht den Gläubigern jedoch nur zu, wenn sie glaubhaft machen, dass durch die Verschmelzung die Erfüllung ihrer Forderung gefährdet wird."
    },
    {
      "date": "2025-06-19",
      "id": "112747",
      "original_text": "Einreichung neuer Dokumente\nSachsen Amtsgericht Chemnitz HRB 8499\nStadtwerke Oelsnitz/V. GmbH – Oelsnitz/Vogtl.",
      "type": "Einreichung neuer Dokumente",
      "state": "Sachsen",
      "amtsgericht": "Amtsgericht Chemnitz",
      "registernummer": "HRB 8499",
      "registerart": "HRB",
      "company_name": "Stadtwerke Oelsnitz/V. GmbH",
      "company_seat": "Oelsnitz/Vogtl.",
      "details": "19.06.2025 (Bekanntmachungsdatum)\n\nSachsen Amtsgericht Chemnitz HRB 8499\nEinreichung neuer Dokumente\n\nStadtwerke Oelsnitz/V. GmbH\nGesellschaft mit beschränkter Haftung\nOelsnitz/Vogtl.\n\nAm 18.06.2025 wurde beim Handelsregister des Amtsgerichts Chemnitz die Liste der Mitglieder des Aufsichtsrats gemäß § 52 GmbHG eingereicht."
    },
    {
      "date": "2025-06-19",
      "id": "112748",
      "original_text": "Löschungsankündigung\nSachsen Amtsgericht Dresden HRB 13845\nWOHN-FORMAT Hausverwaltungs-GmbH – Dresden",
      "type": "Löschungsankündigung",
      "state": "Sachsen",
      "amtsgericht": "Amtsgericht Dresden",
      "registernummer": "HRB 13845",
      "registerart": "HRB",
      "company_name": "WOHN-FORMAT Hausverwaltungs-GmbH",
      "company_seat": "Dresden",
      "details": "19.06.2025 (Bekanntmachungsdatum)\n\nSachsen Amtsgericht Dresden HRB 13845\nLöschungsankündigung\n\nWOHN-FORMAT Hausverwaltungs-GmbH\nGesellschaft mit beschränkter Haftung\nDresden\n\nDas Registergericht beabsichtigt, die im Handelsregister eingetragene Gesellschaft von Amts wegen nach § 394 FamFG zu löschen. Die Frist zu Erhebung eines Widerspruchs gegen die beabsichtigte Löschung wird auf einen Monat festgesetzt."
    },
    {
      "date": "2025-06-19",
      "id": "112749",
      "original_text": "Registerbekanntmachung nach dem Umwandlungsgesetz\nSachsen Amtsgericht Leipzig HRB 1831\nforcont business technology gmbh – Leipzig",
      "type": "Registerbekanntmachung nach dem Umwandlungsgesetz",
      "state": "Sachsen",
      "amtsgericht": "Amtsgericht Leipzig",
      "registernummer": "HRB 1831",
      "registerart": "HRB",
      "company_name": "forcont business technology gmbh",
      "company_seat": "Leipzig",
      "details": "19.06.2025 (Bekanntmachungsdatum)\n\nSachsen Amtsgericht Leipzig HRB 1831\nRegisterbekanntmachung nach dem Umwandlungsgesetz 19.06.2025 (Eintragungsdatum)\n\nforcont business technology gmbh\nGesellschaft mit beschränkter Haftung\nLeipzig\n\nDen Gläubigern der an der Verschmelzung beteiligten Rechtsträger ist, wenn sie binnen sechs Monaten nach dem Tag, an dem die Eintragung der Verschmelzung in das Register des Sitzes desjenigen Rechtsträgers, dessen Gläubiger sie sind, nach § 19 Abs. 3 UmwG als bekannt gemacht gilt, ihren Anspruch nach Grund und Höhe in Textform anmelden, Sicherheit zu leisten, soweit sie nicht Befriedigung verlangen können. Dieses Recht steht den Gläubigern jedoch nur zu, wenn sie glaubhaft machen, dass durch die Verschmelzung die Erfüllung der Forderung gefährdet wird."
    },
    {
      "date": "2025-06-19",
      "id": "112750",
      "original_text": "Einreichung neuer Dokumente\nSachsen Amtsgericht Chemnitz HRB 21641\nSozialbetriebe Mittleres Erzgebirge gGmbH – Olbernhau",
      "type": "Einreichung neuer Dokumente",
      "state": "Sachsen",
      "amtsgericht": "Amtsgericht Chemnitz",
      "registernummer": "HRB 21641",
      "registerart": "HRB",
      "company_name": "Sozialbetriebe Mittleres Erzgebirge gGmbH",
      "company_seat": "Olbernhau",
      "details": "19.06.2025 (Bekanntmachungsdatum)\n\nSachsen Amtsgericht Chemnitz HRB 21641\nEinreichung neuer Dokumente\n\nSozialbetriebe Mittleres Erzgebirge gGmbH\nGesellschaft mit beschränkter Haftung\nOlbernhau\n\nAm 17.06.2025 wurde beim Handelsregister des Amtsgerichts Chemnitz die Liste der Mitglieder des Aufsichtsrats gemäß § 52 GmbHG eingereicht."
    },
    {
      "date": "2025-06-19",
      "id": "112751",
      "original_text": "Einreichung neuer Dokumente\nSachsen Amtsgericht Leipzig HRB 3775\nKommunale Wasserwerke Leipzig GmbH – Leipzig",
      "type": "Einreichung neuer Dokumente",
      "state": "Sachsen",
      "amtsgericht": "Amtsgericht Leipzig",
      "registernummer": "HRB 3775",
      "registerart": "HRB",
      "company_name": "Kommunale Wasserwerke Leipzig GmbH",
      "company_seat": "Leipzig",
      "details": "19.06.2025 (Bekanntmachungsdatum)\n\nSachsen Amtsgericht Leipzig HRB 3775\nEinreichung neuer Dokumente\n\nKommunale Wasserwerke Leipzig GmbH\nGesellschaft mit beschränkter Haftung\nLeipzig\n\nAm 18.06.2025 wurde beim Handelsregister des Amtsgerichts Leipzig die Liste der Mitglieder des Aufsichtsrats gemäß § 52 GmbHG eingereicht."
    },
    {
      "date": "2025-06-19",
      "id": "112752",
      "original_text": "Löschungsankündigung\nNiedersachsen Amtsgericht Hannover HRB 211701\nRED Bauplanung GmbH – Wennigsen/Deister",
      "type": "Löschungsankündigung",
      "state": "Niedersachsen",
      "amtsgericht": "Amtsgericht Hannover",
      "registernummer": "HRB 211701",
      "registerart": "HRB",
      "company_name": "RED Bauplanung GmbH",
      "company_seat": "Wennigsen/Deister",
      "details": "19.06.2025 (Bekanntmachungsdatum)\n\nNiedersachsen Amtsgericht Hannover HRB 211701\nLöschungsankündigung\n\nRED Bauplanung GmbH\nGesellschaft mit beschränkter Haftung\nWennigsen/Deister\n\nDas Registergericht beabsichtigt, die Gesellschaft von Amts wegen nach § 394 FamFG zu löschen. Die Frist zur Erhebung eines Widerspruchs ist auf 1 Monat ab dieser Registerbekanntmachung festgesetzt."
    },
    {
      "date": "2025-06-19",
      "id": "112753",
      "original_text": "Löschungsankündigung\nNiedersachsen Amtsgericht Hildesheim HRB 202043\nWilhelm Bergmann Heizungsbau- und Installations GmbH – Peine",
      "type": "Löschungsankündigung",
      "state": "Niedersachsen",
      "amtsgericht": "Amtsgericht Hildesheim",
      "registernummer": "HRB 202043",
      "registerart": "HRB",
      "company_name": "Wilhelm Bergmann Heizungsbau- und Installations GmbH",
      "company_seat": "Peine",
      "details": "19.06.2025 (Bekanntmachungsdatum)\n\nNiedersachsen Amtsgericht Hildesheim HRB 202043\nLöschungsankündigung\n\nWilhelm Bergmann Heizungsbau- und Installations GmbH\nGesellschaft mit beschränkter Haftung\nPeine\n\nDas Registergericht beabsichtigt, die Gesellschaft von Amts wegen nach § 394 FamFG zu löschen. Die Frist zur Erhebung eines Widerspruchs ist auf 1 Monat ab dieser Registerbekanntmachung festgesetzt."
    },
    {
      "date": "2025-06-19",
      "id": "112754",
      "original_text": "Registerbekanntmachung nach dem Umwandlungsgesetz\nNiedersachsen Amtsgericht Oldenburg (Oldenburg) HRB 100725 früher Amtsgericht Brake\nPEE GmbH Personalservice Ems-Elbe – Stadland",
      "type": "Registerbekanntmachung nach dem Umwandlungsgesetz",
      "state": "Niedersachsen",
      "amtsgericht": "Amtsgericht Oldenburg (Oldenburg)",
      "registernummer": "HRB 100725",
      "registerart": "HRB",
      "company_name": "PEE GmbH Personalservice Ems-Elbe",
      "company_seat": "Stadland",
      "former_amtsgericht": "Brake",
      "details": "19.06.2025 (Bekanntmachungsdatum)\n\nNiedersachsen Amtsgericht Oldenburg (Oldenburg) HRB 100725 früher Amtsgericht Brake\nRegisterbekanntmachung nach dem Umwandlungsgesetz 19.06.2025 (Eintragungsdatum)\n\nPEE GmbH Personalservice Ems-Elbe\nGesellschaft mit beschränkter Haftung\nStadland\n\nDen Gläubigern der an der Verschmelzung beteiligten Rechtsträger ist, wenn sie binnen sechs Monaten nach dem Tag, an dem die Eintragung der Verschmelzung in das Register des Sitzes desjenigen Rechtsträgers, dessen Gläubiger sie sind, nach § 19  Abs.  3 UmwG als bekannt gemacht gilt, ihren Anspruch nach Grund und Höhe schriftlich anmelden, Sicherheit zu leisten, soweit sie nicht Befriedigung verlangen können. Dieses Recht steht den Gläubigern jedoch nur zu, wenn sie glaubhaft machen, dass durch die Verschmelzung die Erfüllung der Forderung gefährdet wird."
    },
    {
      "date": "2025-06-19",
      "id": "112755",
      "original_text": "Löschungsankündigung\nNiedersachsen Amtsgericht Lüneburg HRB 208965\nSchwichtenberg Hotel und Gastronomieservice GmbH – Soltau",
      "type": "Löschungsankündigung",
      "state": "Niedersachsen",
      "amtsgericht": "Amtsgericht Lüneburg",
      "registernummer": "HRB 208965",
      "registerart": "HRB",
      "company_name": "Schwichtenberg Hotel und Gastronomieservice GmbH",
      "company_seat": "Soltau",
      "details": "19.06.2025 (Bekanntmachungsdatum)\n\nNiedersachsen Amtsgericht Lüneburg HRB 208965\nLöschungsankündigung\n\nSchwichtenberg Hotel und Gastronomieservice GmbH\nGesellschaft mit beschränkter Haftung\nSoltau\n\nDie Löschungsankündigung vom 05.06.2025 wird aufgehoben. Registergericht beabsichtigt derzeit nicht mehr, die Gesellschaft von Amts wegen nach § 394 FamFG zu löschen."
    },
    {
      "date": "2025-06-19",
      "id": "112756",
      "original_text": "Löschungsankündigung\nNiedersachsen Amtsgericht Lüneburg HRB 205136\ndm-LINGUA UG (haftungsbeschänkt) – Lüneburg",
      "type": "Löschungsankündigung",
      "state": "Niedersachsen",
      "amtsgericht": "Amtsgericht Lüneburg",
      "registernummer": "HRB 205136",
      "registerart": "HRB",
      "company_name": "dm-LINGUA UG (haftungsbeschänkt)",
      "company_seat": "Lüneburg",
      "details": "19.06.2025 (Bekanntmachungsdatum)\n\nNiedersachsen Amtsgericht Lüneburg HRB 205136\nLöschungsankündigung\n\ndm-LINGUA UG (haftungsbeschänkt)\nGesellschaft mit beschränkter Haftung\nLüneburg\n\nDas Registergericht beabsichtigt, die Gesellschaft von Amts wegen nach § 394 FamFG zu löschen. Die Frist zur Erhebung eines Widerspruchs ist auf 1 Monat ab dieser Registerbekanntmachung festgesetzt."
    },
    {
      "date": "2025-06-19",
      "id": "112757",
      "original_text": "Registerbekanntmachung nach dem Umwandlungsgesetz\nNiedersachsen Amtsgericht Oldenburg (Oldenburg) HRB 3284\nOldenburger -Steuerrechts- Institut GmbH – Oldenburg",
      "type": "Registerbekanntmachung nach dem Umwandlungsgesetz",
      "state": "Niedersachsen",
      "amtsgericht": "Amtsgericht Oldenburg (Oldenburg)",
      "registernummer": "HRB 3284",
      "registerart": "HRB",
      "company_name": "Oldenburger -Steuerrechts- Institut GmbH",
      "company_seat": "Oldenburg",
      "details": "19.06.2025 (Bekanntmachungsdatum)\n\nNiedersachsen Amtsgericht Oldenburg (Oldenburg) HRB 3284\nRegisterbekanntmachung nach dem Umwandlungsgesetz 19.06.2025 (Eintragungsdatum)\n\nOldenburger -Steuerrechts- Institut GmbH\nGesellschaft mit beschränkter Haftung\nOldenburg\n\nDen Gläubigern der an der Verschmelzung beteiligten Rechtsträger ist, wenn sie binnen sechs Monaten nach dem Tag, an dem die Eintragung der Verschmelzung in das Register des Sitzes desjenigen Rechtsträgers, dessen Gläubiger sie sind, nach § 19  Abs.  3 UmwG als bekannt gemacht gilt, ihren Anspruch nach Grund und Höhe schriftlich anmelden, Sicherheit zu leisten, soweit sie nicht Befriedigung verlangen können. Dieses Recht steht den Gläubigern jedoch nur zu, wenn sie glaubhaft machen, dass durch die Verschmelzung die Erfüllung der Forderung gefährdet wird."
    },
    {
      "date": "2025-06-19",
      "id": "112758",
      "original_text": "Registerbekanntmachung nach dem Umwandlungsgesetz\nNiedersachsen Amtsgericht Hildesheim HRB 100029 früher Amtsgericht Gifhorn\nScha-Le-We-Elektro GmbH – Wittingen",
      "type": "Registerbekanntmachung nach dem Umwandlungsgesetz",
      "state": "Niedersachsen",
      "amtsgericht": "Amtsgericht Hildesheim",
      "registernummer": "HRB 100029",
      "registerart": "HRB",
      "company_name": "Scha-Le-We-Elektro GmbH",
      "company_seat": "Wittingen",
      "former_amtsgericht": "Gifhorn",
      "details": "19.06.2025 (Bekanntmachungsdatum)\n\nNiedersachsen Amtsgericht Hildesheim HRB 100029 früher Amtsgericht Gifhorn\nRegisterbekanntmachung nach dem Umwandlungsgesetz 19.06.2025 (Eintragungsdatum)\n\nScha-Le-We-Elektro GmbH\nGesellschaft mit beschränkter Haftung\nWittingen\n\nDen Gläubigern der an der Verschmelzung beteiligten Rechtsträger ist, wenn sie binnen sechs Monaten nach dem Tag, an dem die Eintragung der Verschmelzung in das Register des Sitzes desjenigen Rechtsträgers, dessen Gläubiger sie sind, nach § 19  Abs.  3 UmwG als bekannt gemacht gilt, ihren Anspruch nach Grund und Höhe schriftlich anmelden, Sicherheit zu leisten, soweit sie nicht Befriedigung verlangen können. Dieses Recht steht den Gläubigern jedoch nur zu, wenn sie glaubhaft machen, dass durch die Verschmelzung die Erfüllung der Forderung gefährdet wird."
    },
    {
      "date": "2025-06-19",
      "id": "112759",
      "original_text": "Registerbekanntmachung nach dem Umwandlungsgesetz\nNiedersachsen Amtsgericht Tostedt HRB 207944\nAndré Fiebing Verwaltungs GmbH – Buchholz",
      "type": "Registerbekanntmachung nach dem Umwandlungsgesetz",
      "state": "Niedersachsen",
      "amtsgericht": "Amtsgericht Tostedt",
      "registernummer": "HRB 207944",
      "registerart": "HRB",
      "company_name": "André Fiebing Verwaltungs GmbH",
      "company_seat": "Buchholz",
      "details": "19.06.2025 (Bekanntmachungsdatum)\n\nNiedersachsen Amtsgericht Tostedt HRB 207944\nRegisterbekanntmachung nach dem Umwandlungsgesetz 19.06.2025 (Eintragungsdatum)\n\nAndré Fiebing Verwaltungs GmbH\nGesellschaft mit beschränkter Haftung\nBuchholz\n\nDen Gläubigern der an der Verschmelzung beteiligten Rechtsträger ist, wenn sie binnen sechs Monaten nach dem Tag, an dem die Eintragung der Verschmelzung in das Register des Sitzes desjenigen Rechtsträgers, dessen Gläubiger sie sind, nach § 19  Abs.  3 UmwG als bekannt gemacht gilt, ihren Anspruch nach Grund und Höhe schriftlich anmelden, Sicherheit zu leisten, soweit sie nicht Befriedigung verlangen können. Dieses Recht steht den Gläubigern jedoch nur zu, wenn sie glaubhaft machen, dass durch die Verschmelzung die Erfüllung der Forderung gefährdet wird."
    },
    {
      "date": "2025-06-19",
      "id": "112760",
      "original_text": "Registerbekanntmachung nach dem Umwandlungsgesetz\nNiedersachsen Amtsgericht Braunschweig HRB 211876\nStadtwerke Wolfsburg Holding GmbH – Wolfsburg",
      "type": "Registerbekanntmachung nach dem Umwandlungsgesetz",
      "state": "Niedersachsen",
      "amtsgericht": "Amtsgericht Braunschweig",
      "registernummer": "HRB 211876",
      "registerart": "HRB",
      "company_name": "Stadtwerke Wolfsburg Holding GmbH",
      "company_seat": "Wolfsburg",
      "details": "19.06.2025 (Bekanntmachungsdatum)\n\nNiedersachsen Amtsgericht Braunschweig HRB 211876\nRegisterbekanntmachung nach dem Umwandlungsgesetz 19.06.2025 (Eintragungsdatum)\n\nStadtwerke Wolfsburg Holding GmbH\nGesellschaft mit beschränkter Haftung\nWolfsburg\n\nDen Gläubigern der an der Abspaltung beteiligten Rechtsträger ist, wenn sie binnen sechs Monaten nach dem Tag, an dem die Eintragung der Abspaltung in das Register des Sitzes desjenigen Rechtsträgers, dessen Gläubiger sie sind, nach § 19 Abs. 3 UmwG als bekannt gemacht gilt, ihren Anspruch nach Grund und Höhe schriftlich anmelden, Sicherheit zu leisten, soweit sie nicht Befriedigung verlangen können. Dieses Recht steht den Gläubigern jedoch nur zu, wenn sie glaubhaft machen, dass durch die Abspaltung die Erfüllung der Forderung gefährdet wird."
    },
    {
      "date": "2025-06-19",
      "id": "112761",
      "original_text": "Registerbekanntmachung nach dem Umwandlungsgesetz\nNiedersachsen Amtsgericht Oldenburg (Oldenburg) HRB 100413 früher Amtsgericht Brake\nThieling-Bau-Abwicklung-GmbH – Augustgroden, Stadland",
      "type": "Registerbekanntmachung nach dem Umwandlungsgesetz",
      "state": "Niedersachsen",
      "amtsgericht": "Amtsgericht Oldenburg (Oldenburg)",
      "registernummer": "HRB 100413",
      "registerart": "HRB",
      "company_name": "Thieling-Bau-Abwicklung-GmbH",
      "company_seat": "Augustgroden, Stadland",
      "former_amtsgericht": "Brake",
      "details": "19.06.2025 (Bekanntmachungsdatum)\n\nNiedersachsen Amtsgericht Oldenburg (Oldenburg) HRB 100413 früher Amtsgericht Brake\nRegisterbekanntmachung nach dem Umwandlungsgesetz 19.06.2025 (Eintragungsdatum)\n\nThieling-Bau-Abwicklung-GmbH\nGesellschaft mit beschränkter Haftung\nAugustgroden, Stadland\n\nDen Gläubigern der an der Verschmelzung beteiligten Rechtsträger ist, wenn sie binnen sechs Monaten nach dem Tag, an dem die Eintragung der Verschmelzung in das Register des Sitzes desjenigen Rechtsträgers, dessen Gläubiger sie sind, nach § 19  Abs.  3 UmwG als bekannt gemacht gilt, ihren Anspruch nach Grund und Höhe schriftlich anmelden, Sicherheit zu leisten, soweit sie nicht Befriedigung verlangen können. Dieses Recht steht den Gläubigern jedoch nur zu, wenn sie glaubhaft machen, dass durch die Verschmelzung die Erfüllung der Forderung gefährdet wird."
    },
    {
      "date": "2025-06-19",
      "id": "112762",
      "original_text": "Registerbekanntmachung nach dem Umwandlungsgesetz\nNiedersachsen Amtsgericht Göttingen HRB 130922 früher Amtsgericht Northeim\nObermann Speditions-GmbH – Osterode",
      "type": "Registerbekanntmachung nach dem Umwandlungsgesetz",
      "state": "Niedersachsen",
      "amtsgericht": "Amtsgericht Göttingen",
      "registernummer": "HRB 130922",
      "registerart": "HRB",
      "company_name": "Obermann Speditions-GmbH",
      "company_seat": "Osterode",
      "former_amtsgericht": "Northeim",
      "details": "19.06.2025 (Bekanntmachungsdatum)\n\nNiedersachsen Amtsgericht Göttingen HRB 130922 früher Amtsgericht Northeim\nRegisterbekanntmachung nach dem Umwandlungsgesetz 19.06.2025 (Eintragungsdatum)\n\nObermann Speditions-GmbH\nGesellschaft mit beschränkter Haftung\nOsterode\n\nDen Gläubigern der an der Verschmelzung beteiligten Rechtsträger ist, wenn sie binnen sechs Monaten nach dem Tag, an dem die Eintragung der Verschmelzung in das Register des Sitzes desjenigen Rechtsträgers, dessen Gläubiger sie sind, nach § 19  Abs.  3 UmwG als bekannt gemacht gilt, ihren Anspruch nach Grund und Höhe schriftlich anmelden, Sicherheit zu leisten, soweit sie nicht Befriedigung verlangen können. Dieses Recht steht den Gläubigern jedoch nur zu, wenn sie glaubhaft machen, dass durch die Verschmelzung die Erfüllung der Forderung gefährdet wird."
    },
    {
      "date": "2025-06-19",
      "id": "112763",
      "original_text": "Registerbekanntmachung nach dem Umwandlungsgesetz\nNiedersachsen Amtsgericht Lüneburg HRB 210692\nSolarbau Schroeder GmbH – Nienhagen",
      "type": "Registerbekanntmachung nach dem Umwandlungsgesetz",
      "state": "Niedersachsen",
      "amtsgericht": "Amtsgericht Lüneburg",
      "registernummer": "HRB 210692",
      "registerart": "HRB",
      "company_name": "Solarbau Schroeder GmbH",
      "company_seat": "Nienhagen",
      "details": "19.06.2025 (Bekanntmachungsdatum)\n\nNiedersachsen Amtsgericht Lüneburg HRB 210692\nRegisterbekanntmachung nach dem Umwandlungsgesetz 19.06.2025 (Eintragungsdatum)\n\nSolarbau Schroeder GmbH\nGesellschaft mit beschränkter Haftung\nNienhagen\n\nDen Gläubigern der an der Verschmelzung beteiligten Rechtsträger ist, wenn sie binnen sechs Monaten nach dem Tag, an dem die Eintragung der Verschmelzung in das Register des Sitzes desjenigen Rechtsträgers, dessen Gläubiger sie sind, nach § 19  Abs.  3 UmwG als bekannt gemacht gilt, ihren Anspruch nach Grund und Höhe schriftlich anmelden, Sicherheit zu leisten, soweit sie nicht Befriedigung verlangen können. Dieses Recht steht den Gläubigern jedoch nur zu, wenn sie glaubhaft machen, dass durch die Verschmelzung die Erfüllung der Forderung gefährdet wird."
    },
    {
      "date": "2025-06-19",
      "id": "112764",
      "original_text": "Registerbekanntmachung nach dem Umwandlungsgesetz\nNiedersachsen Amtsgericht Göttingen HRB 130556 früher Amtsgericht Northeim\nObermann Logistik GmbH – Osterode am Harz",
      "type": "Registerbekanntmachung nach dem Umwandlungsgesetz",
      "state": "Niedersachsen",
      "amtsgericht": "Amtsgericht Göttingen",
      "registernummer": "HRB 130556",
      "registerart": "HRB",
      "company_name": "Obermann Logistik GmbH",
      "company_seat": "Osterode am Harz",
      "former_amtsgericht": "Northeim",
      "details": "19.06.2025 (Bekanntmachungsdatum)\n\nNiedersachsen Amtsgericht Göttingen HRB 130556 früher Amtsgericht Northeim\nRegisterbekanntmachung nach dem Umwandlungsgesetz 19.06.2025 (Eintragungsdatum)\n\nObermann Logistik GmbH\nGesellschaft mit beschränkter Haftung\nOsterode am Harz\n\nDen Gläubigern der an der Verschmelzung beteiligten Rechtsträger ist, wenn sie binnen sechs Monaten nach dem Tag, an dem die Eintragung der Verschmelzung in das Register des Sitzes desjenigen Rechtsträgers, dessen Gläubiger sie sind, nach § 19  Abs.  3 UmwG als bekannt gemacht gilt, ihren Anspruch nach Grund und Höhe schriftlich anmelden, Sicherheit zu leisten, soweit sie nicht Befriedigung verlangen können. Dieses Recht steht den Gläubigern jedoch nur zu, wenn sie glaubhaft machen, dass durch die Verschmelzung die Erfüllung der Forderung gefährdet wird."
    },
    {
      "date": "2025-06-19",
      "id": "112765",
      "original_text": "Registerbekanntmachung nach dem Umwandlungsgesetz\nNiedersachsen Amtsgericht Braunschweig HRB 100014 früher Amtsgericht Wolfsburg\nStadtwerke Wolfsburg AG – Wolfsburg",
      "type": "Registerbekanntmachung nach dem Umwandlungsgesetz",
      "state": "Niedersachsen",
      "amtsgericht": "Amtsgericht Braunschweig",
      "registernummer": "HRB 100014",
      "registerart": "HRB",
      "company_name": "Stadtwerke Wolfsburg AG",
      "company_seat": "Wolfsburg",
      "former_amtsgericht": "Wolfsburg",
      "details": "19.06.2025 (Bekanntmachungsdatum)\n\nNiedersachsen Amtsgericht Braunschweig HRB 100014 früher Amtsgericht Wolfsburg\nRegisterbekanntmachung nach dem Umwandlungsgesetz 19.06.2025 (Eintragungsdatum)\n\nStadtwerke Wolfsburg AG\nAktiengesellschaft\nWolfsburg\n\nDen Gläubigern der an der Abspaltung beteiligten Rechtsträger ist, wenn sie binnen sechs Monaten nach dem Tag, an dem die Eintragung der Abspaltung in das Register des Sitzes desjenigen Rechtsträgers, dessen Gläubiger sie sind, nach § 19 Abs. 3 UmwG als bekannt gemacht gilt, ihren Anspruch nach Grund und Höhe schriftlich anmelden, Sicherheit zu leisten, soweit sie nicht Befriedigung verlangen können. Dieses Recht steht den Gläubigern jedoch nur zu, wenn sie glaubhaft machen, dass durch die Abspaltung die Erfüllung der Forderung gefährdet wird."
    },
    {
      "date": "2025-06-19",
      "id": "112766",
      "original_text": "Registerbekanntmachung nach dem Umwandlungsgesetz\nNiedersachsen Amtsgericht Osnabrück HRB 206985\nMUUUH! Next GmbH – Osnabrück",
      "type": "Registerbekanntmachung nach dem Umwandlungsgesetz",
      "state": "Niedersachsen",
      "amtsgericht": "Amtsgericht Osnabrück",
      "registernummer": "HRB 206985",
      "registerart": "HRB",
      "company_name": "MUUUH! Next GmbH",
      "company_seat": "Osnabrück",
      "details": "19.06.2025 (Bekanntmachungsdatum)\n\nNiedersachsen Amtsgericht Osnabrück HRB 206985\nRegisterbekanntmachung nach dem Umwandlungsgesetz 19.06.2025 (Eintragungsdatum)\n\nMUUUH! Next GmbH\nGesellschaft mit beschränkter Haftung\nOsnabrück\n\nDen Gläubigern der an der Verschmelzung beteiligten Rechtsträger ist, wenn sie binnen sechs Monaten nach dem Tag, an dem die Eintragung der Verschmelzung in das Register des Sitzes desjenigen Rechtsträgers, dessen Gläubiger sie sind, nach § 19  Abs.  3 UmwG als bekannt gemacht gilt, ihren Anspruch nach Grund und Höhe schriftlich anmelden, Sicherheit zu leisten, soweit sie nicht Befriedigung verlangen können. Dieses Recht steht den Gläubigern jedoch nur zu, wenn sie glaubhaft machen, dass durch die Verschmelzung die Erfüllung der Forderung gefährdet wird."
    },
    {
      "date": "2025-06-19",
      "id": "112767",
      "original_text": "Registerbekanntmachung nach dem Umwandlungsgesetz\nNiedersachsen Amtsgericht Braunschweig HRB 202153\nATLAS TITAN Ost GmbH – Vechelde",
      "type": "Registerbekanntmachung nach dem Umwandlungsgesetz",
      "state": "Niedersachsen",
      "amtsgericht": "Amtsgericht Braunschweig",
      "registernummer": "HRB 202153",
      "registerart": "HRB",
      "company_name": "ATLAS TITAN Ost GmbH",
      "company_seat": "Vechelde",
      "details": "19.06.2025 (Bekanntmachungsdatum)\n\nNiedersachsen Amtsgericht Braunschweig HRB 202153\nRegisterbekanntmachung nach dem Umwandlungsgesetz 19.06.2025 (Eintragungsdatum)\n\nATLAS TITAN Ost GmbH\nGesellschaft mit beschränkter Haftung\nVechelde\n\nDen Gläubigern der an der Verschmelzung beteiligten Rechtsträger ist, wenn sie binnen sechs Monaten nach dem Tag, an dem die Eintragung der Verschmelzung in das Register des Sitzes desjenigen Rechtsträgers, dessen Gläubiger sie sind, nach § 19  Abs.  3 UmwG als bekannt gemacht gilt, ihren Anspruch nach Grund und Höhe schriftlich anmelden, Sicherheit zu leisten, soweit sie nicht Befriedigung verlangen können. Dieses Recht steht den Gläubigern jedoch nur zu, wenn sie glaubhaft machen, dass durch die Verschmelzung die Erfüllung der Forderung gefährdet wird."
    },
    {
      "date": "2025-06-19",
      "id": "112768",
      "original_text": "Registerbekanntmachung nach dem Umwandlungsgesetz\nNiedersachsen Amtsgericht Hildesheim HRA 203129\nSchate Elektrotechnik e. K. – Wittingen",
      "type": "Registerbekanntmachung nach dem Umwandlungsgesetz",
      "state": "Niedersachsen",
      "amtsgericht": "Amtsgericht Hildesheim",
      "registernummer": "HRA 203129",
      "registerart": "HRA",
      "company_name": "Schate Elektrotechnik e. K.",
      "company_seat": "Wittingen",
      "details": "19.06.2025 (Bekanntmachungsdatum)\n\nNiedersachsen Amtsgericht Hildesheim HRA 203129\nRegisterbekanntmachung nach dem Umwandlungsgesetz 19.06.2025 (Eintragungsdatum)\n\nSchate Elektrotechnik e. K.\nEinzelkaufmann / Einzelkauffrau\nWittingen\n\nDen Gläubigern der an der Verschmelzung beteiligten Rechtsträger ist, wenn sie binnen sechs Monaten nach dem Tag, an dem die Eintragung der Verschmelzung in das Register des Sitzes desjenigen Rechtsträgers, dessen Gläubiger sie sind, nach § 19  Abs.  3 UmwG als bekannt gemacht gilt, ihren Anspruch nach Grund und Höhe schriftlich anmelden, Sicherheit zu leisten, soweit sie nicht Befriedigung verlangen können. Dieses Recht steht den Gläubigern jedoch nur zu, wenn sie glaubhaft machen, dass durch die Verschmelzung die Erfüllung der Forderung gefährdet wird."
    },
    {
      "date": "2025-06-19",
      "id": "112769",
      "original_text": "Einreichung neuer Dokumente\nNiedersachsen Amtsgericht Hannover HRB 110740 früher Amtsgericht Neustadt a. Rbge. (Neustadt)\nLPKF Laser & Electronics SE – Garbsen",
      "type": "Einreichung neuer Dokumente",
      "state": "Niedersachsen",
      "amtsgericht": "Amtsgericht Hannover",
      "registernummer": "HRB 110740",
      "registerart": "HRB",
      "company_name": "LPKF Laser & Electronics SE",
      "company_seat": "Garbsen",
      "former_amtsgericht": "Neustadt a. Rbge. (Neustadt)",
      "details": "19.06.2025 (Bekanntmachungsdatum)\n\nNiedersachsen Amtsgericht Hannover HRB 110740 früher Amtsgericht Neustadt a. Rbge. (Neustadt)\nEinreichung neuer Dokumente 19.06.2025 (Eintragungsdatum)\n\nLPKF Laser & Electronics SE\nEuropäische Aktiengesellschaft (SE)\nGarbsen\n\nDie Liste der Mitglieder des Aufsichtsrats wurde beim Registergericht eingereicht."
    },
    {
      "date": "2025-06-19",
      "id": "112770",
      "original_text": "Einreichung neuer Dokumente\nNiedersachsen Amtsgericht Hannover GnR 110009\nWirtschaftsgenossenschaft deutscher Tierärzte e G – Garbsen",
      "type": "Einreichung neuer Dokumente",
      "state": "Niedersachsen",
      "amtsgericht": "Amtsgericht Hannover",
      "registernummer": "GnR 110009",
      "registerart": "GnR",
      "company_name": "Wirtschaftsgenossenschaft deutscher Tierärzte e G",
      "company_seat": "Garbsen",
      "details": "19.06.2025 (Bekanntmachungsdatum)\n\nNiedersachsen Amtsgericht Hannover GnR 110009\nEinreichung neuer Dokumente\n\nWirtschaftsgenossenschaft deutscher Tierärzte e G\neingetragene Genossenschaft\nGarbsen\n\nDie Liste der Mitglieder des Aufsichtsrats wurde beim Registergericht eingereicht."
    },
    {
      "date": "2025-06-19",
      "id": "112771",
      "original_text": "Registerbekanntmachung nach dem Umwandlungsgesetz\nBremen Amtsgericht Bremen HRB 23856\nKAEFER Construction GmbH – Bremen",
      "type": "Registerbekanntmachung nach dem Umwandlungsgesetz",
      "state": "Bremen",
      "amtsgericht": "Amtsgericht Bremen",
      "registernummer": "HRB 23856",
      "registerart": "HRB",
      "company_name": "KAEFER Construction GmbH",
      "company_seat": "Bremen",
      "details": "19.06.2025 (Bekanntmachungsdatum)\n\nBremen Amtsgericht Bremen HRB 23856\nRegisterbekanntmachung nach dem Umwandlungsgesetz 18.06.2025 (Eintragungsdatum)\n\nKAEFER Construction GmbH\nGesellschaft mit beschränkter Haftung\nBremen\n\nZu Eintragungsnummer 29 vom 18.06.2025 wird als nicht eingetragen veröffentlicht:\nDen Gläubigern der an der Verschmelzung beteiligten Rechtsträger ist, wenn sie binnen sechs Monaten nach dem Tag, an dem die Eintragung der Verschmelzung in das Register des Sitzes desjenigen Rechtsträgers, dessen Gläubiger sie sind, als bekannt gemacht gilt, ihren Anspruch nach Grund und Höhe schriftlich anmelden, Sicherheit zu leisten, soweit sie nicht Befriedigung verlangen können. Dieses Recht steht den Gläubigern jedoch nur zu, wenn sie glaubhaft machen, dass durch die Verschmelzung die Erfüllung ihrer Forderung gefährdet wird. Das Recht, Sicherheitsleistung zu verlangen, steht Gläubigern nicht zu, die im Falle der Insolvenz ein Recht auf vorzugsweise Befriedigung aus einer Deckungsmasse haben, die nach gesetzlicher Vorschrift zu ihrem Schutz errichtet und staatlich überwacht ist."
    },
    {
      "date": "2025-06-19",
      "id": "112772",
      "original_text": "Registerbekanntmachung nach dem Umwandlungsgesetz\nBremen Amtsgericht Bremen HRB 23856\nKAEFER Construction GmbH – Bremen",
      "type": "Registerbekanntmachung nach dem Umwandlungsgesetz",
      "state": "Bremen",
      "amtsgericht": "Amtsgericht Bremen",
      "registernummer": "HRB 23856",
      "registerart": "HRB",
      "company_name": "KAEFER Construction GmbH",
      "company_seat": "Bremen",
      "details": "19.06.2025 (Bekanntmachungsdatum)\n\nBremen Amtsgericht Bremen HRB 23856\nRegisterbekanntmachung nach dem Umwandlungsgesetz 18.06.2025 (Eintragungsdatum)\n\nKAEFER Construction GmbH\nGesellschaft mit beschränkter Haftung\nBremen\n\nZu Eintragungsnummer 29 vom 18.06.2025 wird als nicht eingetragen veröffentlicht:\nGläubigern, deren Forderungen begründet worden sind, bevor die Eintragung des Beschlusses als nach § 10 des Handelsgesetzbuches bekannt gemacht gilt, ist, wenn sie sich binnen sechs Monaten nach der Bekanntmachung zu diesem Zweck melden, Sicherheit zu leisten, soweit sie nicht Befriedigung verlangen können. Dieses Recht steht den Gläubigern nicht zu, die im Fall des Insolvenzverfahrens ein Recht auf vorzugsweise Befriedigung aus der Deckungsmasse haben, die nach gesetzlicher Vorschrift zu ihrem Schutz errichtet und staatlich überwacht ist."
    },
    {
      "date": "2025-06-19",
      "id": "112773",
      "original_text": "Registerbekanntmachung nach dem Umwandlungsgesetz\nBremen Amtsgericht Bremen HRB 26260\nALLSERV GmbH – Bremen",
      "type": "Registerbekanntmachung nach dem Umwandlungsgesetz",
      "state": "Bremen",
      "amtsgericht": "Amtsgericht Bremen",
      "registernummer": "HRB 26260",
      "registerart": "HRB",
      "company_name": "ALLSERV GmbH",
      "company_seat": "Bremen",
      "details": "19.06.2025 (Bekanntmachungsdatum)\n\nBremen Amtsgericht Bremen HRB 26260\nRegisterbekanntmachung nach dem Umwandlungsgesetz 18.06.2025 (Eintragungsdatum)\n\nALLSERV GmbH\nGesellschaft mit beschränkter Haftung\nBremen\n\nZu Eintragungsnummer 7 vom 18.06.2025 wird als nicht eingetragen veröffentlicht:\nDen Gläubigern der an der Verschmelzung beteiligten Rechtsträger ist, wenn sie binnen sechs Monaten nach dem Tag, an dem die Eintragung der Verschmelzung in das Register des Sitzes desjenigen Rechtsträgers, dessen Gläubiger sie sind, als bekannt gemacht gilt, ihren Anspruch nach Grund und Höhe schriftlich anmelden, Sicherheit zu leisten, soweit sie nicht Befriedigung verlangen können. Dieses Recht steht den Gläubigern jedoch nur zu, wenn sie glaubhaft machen, dass durch die Verschmelzung die Erfüllung ihrer Forderung gefährdet wird. Das Recht, Sicherheitsleistung zu verlangen, steht Gläubigern nicht zu, die im Falle der Insolvenz ein Recht auf vorzugsweise Befriedigung aus einer Deckungsmasse haben, die nach gesetzlicher Vorschrift zu ihrem Schutz errichtet und staatlich überwacht ist."
    },
    {
      "date": "2025-06-19",
      "id": "112774",
      "original_text": "Registerbekanntmachung nach dem Umwandlungsgesetz\nBremen Amtsgericht Bremen HRB 19908\nKAEFER Deutschland Pro Services GmbH – Bremen",
      "type": "Registerbekanntmachung nach dem Umwandlungsgesetz",
      "state": "Bremen",
      "amtsgericht": "Amtsgericht Bremen",
      "registernummer": "HRB 19908",
      "registerart": "HRB",
      "company_name": "KAEFER Deutschland Pro Services GmbH",
      "company_seat": "Bremen",
      "details": "19.06.2025 (Bekanntmachungsdatum)\n\nBremen Amtsgericht Bremen HRB 19908\nRegisterbekanntmachung nach dem Umwandlungsgesetz 18.06.2025 (Eintragungsdatum)\n\nKAEFER Deutschland Pro Services GmbH\nGesellschaft mit beschränkter Haftung\nBremen\n\nZu Eintragungsnummer 34 vom 18.06.2025 wird als nicht eingetragen veröffentlicht:\nDen Gläubigern der an der Verschmelzung beteiligten Rechtsträger ist, wenn sie binnen sechs Monaten nach dem Tag, an dem die Eintragung der Verschmelzung in das Register des Sitzes desjenigen Rechtsträgers, dessen Gläubiger sie sind, als bekannt gemacht gilt, ihren Anspruch nach Grund und Höhe schriftlich anmelden, Sicherheit zu leisten, soweit sie nicht Befriedigung verlangen können. Dieses Recht steht den Gläubigern jedoch nur zu, wenn sie glaubhaft machen, dass durch die Verschmelzung die Erfüllung ihrer Forderung gefährdet wird. Das Recht, Sicherheitsleistung zu verlangen, steht Gläubigern nicht zu, die im Falle der Insolvenz ein Recht auf vorzugsweise Befriedigung aus einer Deckungsmasse haben, die nach gesetzlicher Vorschrift zu ihrem Schutz errichtet und staatlich überwacht ist."
    },
    {
      "date": "2025-06-19",
      "id": "112775",
      "original_text": "Registerbekanntmachung nach dem Umwandlungsgesetz\nThüringen Amtsgericht Jena HRB 511638\nStreubel und Seifert Rohrleitungsbau GmbH – Greiz",
      "type": "Registerbekanntmachung nach dem Umwandlungsgesetz",
      "state": "Thüringen",
      "amtsgericht": "Amtsgericht Jena",
      "registernummer": "HRB 511638",
      "registerart": "HRB",
      "company_name": "Streubel und Seifert Rohrleitungsbau GmbH",
      "company_seat": "Greiz",
      "details": "19.06.2025 (Bekanntmachungsdatum)\n\nThüringen Amtsgericht Jena HRB 511638\nRegisterbekanntmachung nach dem Umwandlungsgesetz 19.06.2025 (Eintragungsdatum)\n\nStreubel und Seifert Rohrleitungsbau GmbH\nGesellschaft mit beschränkter Haftung\nGreiz\n\nNicht eingetragen: Den Gläubigern der an der Verschmelzung beteiligten Rechtsträger, ist wenn sie binnen sechs Monaten nach dem Tag, an dem die Eintragung der Verschmelzung in das Register des Sitzes desjenigen Rechtsträgers, dessen Gläubiger sie sind,  nach § 19 Abs. 3 UmwG als bekanntgemacht gilt, ihren Anspruch nach Grund und Höhe schriftlich anmelden, Sicherheit zu leisten, soweit sie nicht Befriedigung verlangen können. Dieses Recht steht ihnen jedoch nur zu, wenn sie glaubhaft machen, daß durch die Verschmelzung die Erfüllung ihrer Forderung gefährdet wird."
    },
    {
      "date": "2025-06-19",
      "id": "112776",
      "original_text": "Registerbekanntmachung nach dem Umwandlungsgesetz\nThüringen Amtsgericht Jena HRB 513924\nRadtke Präzisionswerkzeuge GmbH – Meiningen",
      "type": "Registerbekanntmachung nach dem Umwandlungsgesetz",
      "state": "Thüringen",
      "amtsgericht": "Amtsgericht Jena",
      "registernummer": "HRB 513924",
      "registerart": "HRB",
      "company_name": "Radtke Präzisionswerkzeuge GmbH",
      "company_seat": "Meiningen",
      "details": "19.06.2025 (Bekanntmachungsdatum)\n\nThüringen Amtsgericht Jena HRB 513924\nRegisterbekanntmachung nach dem Umwandlungsgesetz 19.06.2025 (Eintragungsdatum)\n\nRadtke Präzisionswerkzeuge GmbH\nGesellschaft mit beschränkter Haftung\nMeiningen\n\nNicht eingetragen: Den Gläubigern der an der Verschmelzung beteiligten Rechtsträger, ist wenn sie binnen sechs Monaten nach dem Tag, an dem die Eintragung der Verschmelzung in das Register des Sitzes desjenigen Rechtsträgers, dessen Gläubiger sie sind,  nach § 19 Abs. 3 UmwG als bekanntgemacht gilt, ihren Anspruch nach Grund und Höhe schriftlich anmelden, Sicherheit zu leisten, soweit sie nicht Befriedigung verlangen können. Dieses Recht steht ihnen jedoch nur zu, wenn sie glaubhaft machen, daß durch die Verschmelzung die Erfüllung ihrer Forderung gefährdet wird."
    },
    {
      "date": "2025-06-19",
      "id": "112777",
      "original_text": "Registerbekanntmachung nach dem Umwandlungsgesetz\nThüringen Amtsgericht Jena HRB 204175\nTriptiser Edelstahl GmbH – Triptis",
      "type": "Registerbekanntmachung nach dem Umwandlungsgesetz",
      "state": "Thüringen",
      "amtsgericht": "Amtsgericht Jena",
      "registernummer": "HRB 204175",
      "registerart": "HRB",
      "company_name": "Triptiser Edelstahl GmbH",
      "company_seat": "Triptis",
      "details": "19.06.2025 (Bekanntmachungsdatum)\n\nThüringen Amtsgericht Jena HRB 204175\nRegisterbekanntmachung nach dem Umwandlungsgesetz 19.06.2025 (Eintragungsdatum)\n\nTriptiser Edelstahl GmbH\nGesellschaft mit beschränkter Haftung\nTriptis\n\nNicht eingetragen: Den Gläubigern der an der Verschmelzung beteiligten Rechtsträger, ist wenn sie binnen sechs Monaten nach dem Tag, an dem die Eintragung der Verschmelzung in das Register des Sitzes desjenigen Rechtsträgers, dessen Gläubiger sie sind,  nach § 19 Abs. 3 UmwG als bekanntgemacht gilt, ihren Anspruch nach Grund und Höhe schriftlich anmelden, Sicherheit zu leisten, soweit sie nicht Befriedigung verlangen können. Dieses Recht steht ihnen jedoch nur zu, wenn sie glaubhaft machen, daß durch die Verschmelzung die Erfüllung ihrer Forderung gefährdet wird."
    },
    {
      "date": "2025-06-19",
      "id": "112778",
      "original_text": "Löschungsankündigung\nThüringen Amtsgericht Jena HRB 517073\nBLA International Trading GmbH – Erfurt",
      "type": "Löschungsankündigung",
      "state": "Thüringen",
      "amtsgericht": "Amtsgericht Jena",
      "registernummer": "HRB 517073",
      "registerart": "HRB",
      "company_name": "BLA International Trading GmbH",
      "company_seat": "Erfurt",
      "details": "19.06.2025 (Bekanntmachungsdatum)\n\nThüringen Amtsgericht Jena HRB 517073\nLöschungsankündigung\n\nBLA International Trading GmbH\nGesellschaft mit beschränkter Haftung\nErfurt\n\nDas Registergericht beabsichtigt, die im Handelsregister eingetragene Gesellschaft wegen Vermögenslosigkeit nach § 394 FamFG von Amts wegen zu löschen. Die Frist zur Erhebung eines Widerspruchs gegen die beabsichtigte Löschung wird auf 6 Wochen festgesetzt."
    },
    {
      "date": "2025-06-19",
      "id": "85",
      "original_text": "Sonderregisterbekanntmachung OHNE Bezug zum elektr. Register\nSachsen-Anhalt Amtsgericht Stendal\nHRB 4187 (vormals Amtsgericht Halle- Sallkreis)\nStefan Ferkl GmbH Bauunternehmen",
      "type": "Sonderregisterbekanntmachung OHNE Bezug zum elektr. Register",
      "state": "Sachsen-Anhalt",
      "amtsgericht": "Amtsgericht Stendal",
      "company_name": "Stefan Ferkl GmbH Bauunternehmen",
      "sonderegister_referenz": "HRB 4187 (vormals Amtsgericht Halle- Sallkreis)",
      "details": "19.06.2025 (Bekanntmachungsdatum)\n\nSachsen-Anhalt Amtsgericht Stendal\nHRB 4187 (vormals Amtsgericht Halle- Sallkreis)\nSonderregisterbekanntmachung OHNE Bezug zum elektr. Register\n\nStefan Ferkl GmbH Bauunternehmen\n\nHinsichtlich der o.g. im vormaligen Handelsregister des Amtsgerichts Halle -Saalkreis  (HRB 4187) am  15.02.2006 gelöschten Gesellschaft ist beabsichtigt, Herrn Rechtsanwalt Dr. Lindner, geschäftsansässig Semder Lindner Nachtragsliquidationen GbR, Hamburg zum Nachtragsliquidator mit  beschränktem Wirkungskreis zu bestellen.\nDer Antrag kann bei berechtigtem Interesse beim Registergericht Stendal eingesehen werden.\nDie Frist zu Einreichung etwaiger Stellungnahmen bzw. Erhebung eines Widerspruchs wird auf 2 Monate festgesetzt."
    }
  ]
}