{
  "date": "2025-06-16",
  "date_of_scrape": "2025-06-17T04:14:46.957Z",
  "tool_version": "0.2.0",
  "number_of_announcements": 126,
  "announcements": [
    {
      "date": "2025-06-16",
      "id": "112240",
      "original_text": "Registerbekanntmachung nach dem Umwandlungsgesetz\nSaarland Amtsgericht Saarbrücken HRB 104249\nLivica GmbH – Merzig",
      "type": "Registerbekanntmachung nach dem Umwandlungsgesetz",
      "state": "Saarland",
      "amtsgericht": "Amtsgericht Saarbrücken",
      "registernummer": "HRB 104249",
      "registerart": "HRB",
      "company_name": "Livica GmbH",
      "company_seat": "Merzig",
      "details": "16.06.2025 (Bekanntmachungsdatum)\n\nSaarland Amtsgericht Saarbrücken HRB 104249\nRegisterbekanntmachung nach dem Umwandlungsgesetz 16.06.2025 (Eintragungsdatum)\n\nLivica GmbH\nGesellschaft mit beschränkter Haftung\nMerzig\n\nAls nicht eingetragen wird bekannt gemacht: Den Gläubigern der an der Verschmelzung beteiligten Gesellschaften ist, wenn sie binnen sechs Monaten nach dem Tag, an dem die Eintragung der Verschmelzung in das Register des Sitzes desjenigen Rechtsträgers, dessen Gläubiger sie sind, nach § 19 Absatz 3 UmwG bekannt gemacht worden ist, ihren Anspruch nach Grund und Höhe schriftlich anmelden, Sicherheit zu leisten, soweit sie nicht Befriedigung verlangen können. Dieses Recht steht den Gläubigern jedoch nur zu, wenn sie glaubhaft machen, dass durch die Verschmelzung die Erfüllung ihrer Forderung gefährdet wird."
    },
    {
      "date": "2025-06-16",
      "id": "112241",
      "original_text": "Registerbekanntmachung nach dem Umwandlungsgesetz\nSaarland Amtsgericht Saarbrücken HRB 105623\nLivica med GmbH – Merzig",
      "type": "Registerbekanntmachung nach dem Umwandlungsgesetz",
      "state": "Saarland",
      "amtsgericht": "Amtsgericht Saarbrücken",
      "registernummer": "HRB 105623",
      "registerart": "HRB",
      "company_name": "Livica med GmbH",
      "company_seat": "Merzig",
      "details": "16.06.2025 (Bekanntmachungsdatum)\n\nSaarland Amtsgericht Saarbrücken HRB 105623\nRegisterbekanntmachung nach dem Umwandlungsgesetz 16.06.2025 (Eintragungsdatum)\n\nLivica med GmbH\nGesellschaft mit beschränkter Haftung\nMerzig\n\nAls nicht eingetragen wird bekannt gemacht: Den Gläubigern der an der Verschmelzung beteiligten Gesellschaften ist, wenn sie binnen sechs Monaten nach dem Tag, an dem die Eintragung der Verschmelzung in das Register des Sitzes desjenigen Rechtsträgers, dessen Gläubiger sie sind, nach § 19 Absatz 3 UmwG bekannt gemacht worden ist, ihren Anspruch nach Grund und Höhe schriftlich anmelden, Sicherheit zu leisten, soweit sie nicht Befriedigung verlangen können. Dieses Recht steht den Gläubigern jedoch nur zu, wenn sie glaubhaft machen, dass durch die Verschmelzung die Erfüllung ihrer Forderung gefährdet wird."
    },
    {
      "date": "2025-06-16",
      "id": "112242",
      "original_text": "Löschungsankündigung\nBaden-Württemberg Amtsgericht Mannheim HRB 731464\nM&E Isoliertechnik UG (haftungsbeschränkt) – Mannheim",
      "type": "Löschungsankündigung",
      "state": "Baden-Württemberg",
      "amtsgericht": "Amtsgericht Mannheim",
      "registernummer": "HRB 731464",
      "registerart": "HRB",
      "company_name": "M&E Isoliertechnik UG (haftungsbeschränkt)",
      "company_seat": "Mannheim",
      "details": "16.06.2025 (Bekanntmachungsdatum)\n\nBaden-Württemberg Amtsgericht Mannheim HRB 731464\nLöschungsankündigung\n\nM&E Isoliertechnik UG (haftungsbeschränkt)\nGesellschaft mit beschränkter Haftung\nMannheim\n\nDas Gericht beabsichtigt, die Eintragung des Geschäftsführers Türkoglu, Eser Deniz, Ludwigshafen, *14.02.1986 im Handelsregister wegen des Mangels einer wesentlichen Voraussetzung von Amts wegen nach § 395 FamFG als unzulässig zu löschen. Die Frist zur Geltendmachung eines Widerspruchs gegen die beabsichtigte Löschung ist auf einen Monat ab Veröffentlichung bestimmt."
    },
    {
      "date": "2025-06-16",
      "id": "112243",
      "original_text": "Registerbekanntmachung nach dem Umwandlungsgesetz\nBaden-Württemberg Amtsgericht Stuttgart HRB 571255\nKW Automotive GmbH – Fichtenberg",
      "type": "Registerbekanntmachung nach dem Umwandlungsgesetz",
      "state": "Baden-Württemberg",
      "amtsgericht": "Amtsgericht Stuttgart",
      "registernummer": "HRB 571255",
      "registerart": "HRB",
      "company_name": "KW Automotive GmbH",
      "company_seat": "Fichtenberg",
      "details": "16.06.2025 (Bekanntmachungsdatum)\n\nBaden-Württemberg Amtsgericht Stuttgart HRB 571255\nRegisterbekanntmachung nach dem Umwandlungsgesetz 16.06.2025 (Eintragungsdatum)\n\nKW Automotive GmbH\nGesellschaft mit beschränkter Haftung\nFichtenberg\n\nAls nicht eingetragen wird bekanntgemacht:\nDen Gläubigern der an der Verschmelzung beteiligten Rechtsträger ist, wenn sie binnen sechs Monaten nach dem Tag, an dem die Eintragung der Verschmelzung in das Register des Sitzes desjenigen Rechtsträgers, dessen Gläubiger sie sind, nach § 19 Abs. 3 UmwG als bekanntgemacht gilt, ihren Anspruch nach Grund und Höhe schriftlich anmelden, Sicherheit zu leisten, soweit sie nicht Befriedigung verlangen können. Dieses Recht steht den Gläubigern jedoch nur zu, wenn sie glaubhaft machen, dass durch die Verschmelzung die Erfüllung ihrer Forderung gefährdet wird."
    },
    {
      "date": "2025-06-16",
      "id": "112244",
      "original_text": "Einreichung neuer Dokumente\nBaden-Württemberg Amtsgericht Mannheim HRB 201505\nImmobilien Regional Aktiengesellschaft – Baden-Baden",
      "type": "Einreichung neuer Dokumente",
      "state": "Baden-Württemberg",
      "amtsgericht": "Amtsgericht Mannheim",
      "registernummer": "HRB 201505",
      "registerart": "HRB",
      "company_name": "Immobilien Regional Aktiengesellschaft",
      "company_seat": "Baden-Baden",
      "details": "16.06.2025 (Bekanntmachungsdatum)\n\nBaden-Württemberg Amtsgericht Mannheim HRB 201505\nEinreichung neuer Dokumente\n\nImmobilien Regional Aktiengesellschaft\nAktiengesellschaft\nBaden-Baden\n\nDie Gesellschaft hat am 13.06.2025 die Liste über die Zusammensetzung des Aufsichtsrats zum Handelsregister eingereicht."
    },
    {
      "date": "2025-06-16",
      "id": "112245",
      "original_text": "Registerbekanntmachung nach dem Umwandlungsgesetz\nBaden-Württemberg Amtsgericht Stuttgart HRA 741847\nHeinz Kieser e.K. – Siegelsbach",
      "type": "Registerbekanntmachung nach dem Umwandlungsgesetz",
      "state": "Baden-Württemberg",
      "amtsgericht": "Amtsgericht Stuttgart",
      "registernummer": "HRA 741847",
      "registerart": "HRA",
      "company_name": "Heinz Kieser e.K.",
      "company_seat": "Siegelsbach",
      "details": "16.06.2025 (Bekanntmachungsdatum)\n\nBaden-Württemberg Amtsgericht Stuttgart HRA 741847\nRegisterbekanntmachung nach dem Umwandlungsgesetz 16.06.2025 (Eintragungsdatum)\n\nHeinz Kieser e.K.\nEinzelkaufmann / Einzelkauffrau\nSiegelsbach\n\nAls nicht eingetragen wird bekanntgemacht:\nDen Gläubigern der an der Ausgliederung beteiligten Rechtsträger ist, wenn sie binnen sechs Monaten nach dem Tag, an dem die Eintragung der Ausgliederung in das Register des Sitzes desjenigen Rechtsträgers, dessen Gläubiger sie sind, nach § 19 Abs. 3 UmwG als bekanntgemacht gilt, ihren Anspruch nach Grund und Höhe schriftlich anmelden, Sicherheit zu leisten, soweit sie nicht Befriedigung verlangen können. Dieses Recht steht den Gläubigern jedoch nur zu, wenn sie glaubhaft machen, dass durch die Ausgliederung die Erfüllung ihrer Forderung gefährdet wird."
    },
    {
      "date": "2025-06-16",
      "id": "112246",
      "original_text": "Einreichung neuer Dokumente\nBaden-Württemberg Amtsgericht Freiburg HRB 715057\nTesto SE & Co. KGaA – Titisee-Neustadt",
      "type": "Einreichung neuer Dokumente",
      "state": "Baden-Württemberg",
      "amtsgericht": "Amtsgericht Freiburg",
      "registernummer": "HRB 715057",
      "registerart": "HRB",
      "company_name": "Testo SE & Co. KGaA",
      "company_seat": "Titisee-Neustadt",
      "details": "16.06.2025 (Bekanntmachungsdatum)\n\nBaden-Württemberg Amtsgericht Freiburg HRB 715057\nEinreichung neuer Dokumente\n\nTesto SE & Co. KGaA\nKommanditgesellschaft auf Aktien\nTitisee-Neustadt\n\nDie Gesellschaft hat am 13.06.2025 die Liste über die Zusammensetzung des Aufsichtsrats zum Handelsregister eingereicht."
    },
    {
      "date": "2025-06-16",
      "id": "112247",
      "original_text": "Registerbekanntmachung nach dem Umwandlungsgesetz\nBrandenburg Amtsgericht Neuruppin HRB 14584\nIIP Neon GmbH – Oranienburg",
      "type": "Registerbekanntmachung nach dem Umwandlungsgesetz",
      "state": "Brandenburg",
      "amtsgericht": "Amtsgericht Neuruppin",
      "registernummer": "HRB 14584",
      "registerart": "HRB",
      "company_name": "IIP Neon GmbH",
      "company_seat": "Oranienburg",
      "details": "16.06.2025 (Bekanntmachungsdatum)\n\nBrandenburg Amtsgericht Neuruppin HRB 14584\nRegisterbekanntmachung nach dem Umwandlungsgesetz 13.06.2025 (Eintragungsdatum)\n\nIIP Neon GmbH\nGesellschaft mit beschränkter Haftung\nOranienburg\n\nZu Eintragungsnummer 7 vom 13.06.2025 wird als nicht eingetragen veröffentlicht:\nDen Gläubigern der an der Umwandlung beteiligten Rechtsträger ist, wenn sie binnen sechs Monaten nach dem Tag, an dem die Eintragung der Umwandlung in das Register des Sitzes desjenigen Rechtsträgers, dessen Gläubiger sie sind, als bekannt gemacht gilt, ihren Anspruch nach Grund und Höhe schriftlich anmelden, Sicherheit zu leisten, soweit sie nicht Befriedigung verlangen können. Dieses Recht steht den Gläubigern jedoch nur zu, wenn sie glaubhaft machen, dass durch die Umwandlung die Erfüllung ihrer Forderung gefährdet wird."
    },
    {
      "date": "2025-06-16",
      "id": "112248",
      "original_text": "Einreichung neuer Dokumente\nBaden-Württemberg Amtsgericht Stuttgart HRB 240348\nBöblinger Baugesellschaft mit beschränkter Haftung – Böblingen",
      "type": "Einreichung neuer Dokumente",
      "state": "Baden-Württemberg",
      "amtsgericht": "Amtsgericht Stuttgart",
      "registernummer": "HRB 240348",
      "registerart": "HRB",
      "company_name": "Böblinger Baugesellschaft mit beschränkter Haftung",
      "company_seat": "Böblingen",
      "details": "16.06.2025 (Bekanntmachungsdatum)\n\nBaden-Württemberg Amtsgericht Stuttgart HRB 240348\nEinreichung neuer Dokumente\n\nBöblinger Baugesellschaft mit beschränkter Haftung\nGesellschaft mit beschränkter Haftung\nBöblingen\n\nDie Gesellschaft hat am 13.06.2025 die Liste über die Zusammensetzung des Aufsichtsrats zum Handelsregister eingereicht."
    },
    {
      "date": "2025-06-16",
      "id": "112249",
      "original_text": "Einreichung neuer Dokumente\nBerlin Amtsgericht Berlin (Charlottenburg) HRB 202784\nXayn AG – Berlin",
      "type": "Einreichung neuer Dokumente",
      "state": "Berlin",
      "amtsgericht": "Amtsgericht Berlin (Charlottenburg)",
      "registernummer": "HRB 202784",
      "registerart": "HRB",
      "company_name": "Xayn AG",
      "company_seat": "Berlin",
      "details": "16.06.2025 (Bekanntmachungsdatum)\n\nBerlin Amtsgericht Berlin (Charlottenburg) HRB 202784\nEinreichung neuer Dokumente\n\nXayn AG\nAktiengesellschaft\nBerlin\n\nAls nicht eingetragen wird veröffentlicht:\n\nEs wurde eine neue Liste der Aufsichtsratsmitglieder eingereicht (§ 106 AktG)."
    },
    {
      "date": "2025-06-16",
      "id": "112250",
      "original_text": "Registerbekanntmachung nach dem Umwandlungsgesetz\nHamburg Amtsgericht Hamburg HRA 132456\nENERPARC Solar Invest 230 TU 32 GmbH & Co. KG – Hamburg",
      "type": "Registerbekanntmachung nach dem Umwandlungsgesetz",
      "state": "Hamburg",
      "amtsgericht": "Amtsgericht Hamburg",
      "registernummer": "HRA 132456",
      "registerart": "HRA",
      "company_name": "ENERPARC Solar Invest 230 TU 32 GmbH & Co. KG",
      "company_seat": "Hamburg",
      "details": "16.06.2025 (Bekanntmachungsdatum)\n\nHamburg Amtsgericht Hamburg HRA 132456\nRegisterbekanntmachung nach dem Umwandlungsgesetz 16.06.2025 (Eintragungsdatum)\n\nENERPARC Solar Invest 230 TU 32 GmbH & Co. KG\nKommanditgesellschaft\nHamburg\n\nAls nicht eingetragen wird bekannt gemacht:\nDen Gläubigern der an der Verschmelzung beteiligten Gesellschaften ist, wenn sie binnen sechs Monaten nach dem Tag, an dem die Eintragung der Verschmelzung in das Register des Sitzes desjenigen Rechtsträgers, dessen Gläubiger sie sind, nach § 19 Absatz 3 UmwG als bekannt gemacht gilt, ihren Anspruch nach Grund und Höhe schriftlich anmelden, Sicherheit zu leisten, soweit sie nicht Befriedigung verlangen können. Dieses Recht steht den Gläubigern jedoch nur zu, wenn sie glaubhaft machen, dass durch die Verschmelzung die Erfüllung ihrer Forderung gefährdet wird."
    },
    {
      "date": "2025-06-16",
      "id": "112251",
      "original_text": "Löschungsankündigung\nSachsen-Anhalt Amtsgericht Stendal VR 3792\nVon Herz zu Herz e. V. – Stendal",
      "type": "Löschungsankündigung",
      "state": "Sachsen-Anhalt",
      "amtsgericht": "Amtsgericht Stendal",
      "registernummer": "VR 3792",
      "registerart": "VR",
      "company_name": "Von Herz zu Herz e. V.",
      "company_seat": "Stendal",
      "details": "16.06.2025 (Bekanntmachungsdatum)\n\nSachsen-Anhalt Amtsgericht Stendal VR 3792\nLöschungsankündigung\n\nVon Herz zu Herz e. V.\neingetragener Verein\nStendal\n\nDas Registergericht beabsichtigt, vorstehenden Verein infolge Wegfalls sämtlicher Mitglieder bzw. vollständiger Aufgabe des Vereinszwecks v.A.w. zu löschen. Die Frist zur Erhebung eines Widerspruchs gegen die beabsichtigte Löschung wird auf zwei Monate festgesetzt."
    },
    {
      "date": "2025-06-16",
      "id": "112252",
      "original_text": "Registerbekanntmachung nach dem Umwandlungsgesetz\nSchleswig-Holstein Amtsgericht Pinneberg HRA 9863\nChristopher Ketz Elektrotechnik e.K. – Quickborn/Krs. Pinneberg",
      "type": "Registerbekanntmachung nach dem Umwandlungsgesetz",
      "state": "Schleswig-Holstein",
      "amtsgericht": "Amtsgericht Pinneberg",
      "registernummer": "HRA 9863",
      "registerart": "HRA",
      "company_name": "Christopher Ketz Elektrotechnik e.K.",
      "company_seat": "Quickborn/Krs. Pinneberg",
      "details": "16.06.2025 (Bekanntmachungsdatum)\n\nSchleswig-Holstein Amtsgericht Pinneberg HRA 9863\nRegisterbekanntmachung nach dem Umwandlungsgesetz 13.06.2025 (Eintragungsdatum)\n\nChristopher Ketz Elektrotechnik e.K.\nEinzelkaufmann / Einzelkauffrau\nQuickborn/Krs. Pinneberg\n\nZu Eintragungsnummer 2 vom 13.06.2025 wird als nicht eingetragen veröffentlicht:  Als nicht eingetragen wird veröffentlicht: Den Gläubigern ist, wenn sie binnen sechs Monaten nach dem Tag, an dem die Eintragung der Umwandlung als bekannt gemacht gilt, ihren Anspruch nach Grund und Höhe schriftlich anmelden, Sicherheit zu leisten, soweit sie nicht Befriedigung verlangen können. Dieses Recht steht den Gläubigern jedoch nur zu, wenn sie glaubhaft machen, dass durch die Umwandlung die Erfüllung ihrer Forderung gefährdet wird. Das Recht, Sicherheitsleistung zu verlangen, steht Gläubigern nicht zu, die im Falle der Insolvenz ein Recht auf vorzugsweise Befriedigung aus einer Deckungsmasse haben, die nach gesetzlicher Vorschrift zu ihrem Schutz errichtet und staatlich überwacht ist."
    },
    {
      "date": "2025-06-16",
      "id": "112253",
      "original_text": "Registerbekanntmachung nach dem Umwandlungsgesetz\nBaden-Württemberg Amtsgericht Stuttgart HRB 800296\nPrioNova GmbH – Neuhausen ob Eck",
      "type": "Registerbekanntmachung nach dem Umwandlungsgesetz",
      "state": "Baden-Württemberg",
      "amtsgericht": "Amtsgericht Stuttgart",
      "registernummer": "HRB 800296",
      "registerart": "HRB",
      "company_name": "PrioNova GmbH",
      "company_seat": "Neuhausen ob Eck",
      "details": "16.06.2025 (Bekanntmachungsdatum)\n\nBaden-Württemberg Amtsgericht Stuttgart HRB 800296\nRegisterbekanntmachung nach dem Umwandlungsgesetz 16.06.2025 (Eintragungsdatum)\n\nPrioNova GmbH\nGesellschaft mit beschränkter Haftung\nNeuhausen ob Eck\n\nDen Gläubigern der an der Ausgliederung beteiligten Rechtsträger ist, wenn sie binnen sechs Monaten nach dem Tag, an dem die Eintragung der Ausgliederung in das Register des Sitzes desjenigen Rechtsträgers, dessen Gläubiger sie sind, nach § 19 Abs. 3 UmwG als bekanntgemacht gilt, ihren Anspruch nach Grund und Höhe schriftlich anmelden, Sicherheit zu leisten, soweit sie nicht Befriedigung verlangen können. Dieses Recht steht den Gläubigern jedoch nur zu, wenn sie glaubhaft machen, dass durch die Ausgliederung die Erfüllung ihrer Forderung gefährdet wird."
    },
    {
      "date": "2025-06-16",
      "id": "112254",
      "original_text": "Registerbekanntmachung nach dem Umwandlungsgesetz\nHamburg Amtsgericht Hamburg HRB 166040\nENERPARC Solar Invest 212 GmbH – Hamburg",
      "type": "Registerbekanntmachung nach dem Umwandlungsgesetz",
      "state": "Hamburg",
      "amtsgericht": "Amtsgericht Hamburg",
      "registernummer": "HRB 166040",
      "registerart": "HRB",
      "company_name": "ENERPARC Solar Invest 212 GmbH",
      "company_seat": "Hamburg",
      "details": "16.06.2025 (Bekanntmachungsdatum)\n\nHamburg Amtsgericht Hamburg HRB 166040\nRegisterbekanntmachung nach dem Umwandlungsgesetz 16.06.2025 (Eintragungsdatum)\n\nENERPARC Solar Invest 212 GmbH\nGesellschaft mit beschränkter Haftung\nHamburg\n\nAls nicht eingetragen wird bekannt gemacht:\nDen Gläubigern der an der Verschmelzung beteiligten Gesellschaften ist, wenn sie binnen sechs Monaten nach dem Tag, an dem die Eintragung der Verschmelzung in das Register des Sitzes desjenigen Rechtsträgers, dessen Gläubiger sie sind, nach § 19 Absatz 3 UmwG als bekannt gemacht gilt, ihren Anspruch nach Grund und Höhe schriftlich anmelden, Sicherheit zu leisten, soweit sie nicht Befriedigung verlangen können. Dieses Recht steht den Gläubigern jedoch nur zu, wenn sie glaubhaft machen, dass durch die Verschmelzung die Erfüllung ihrer Forderung gefährdet wird."
    },
    {
      "date": "2025-06-16",
      "id": "112255",
      "original_text": "Einreichung neuer Dokumente\nBerlin Amtsgericht Berlin (Charlottenburg) HRB 98743\nTerraverde AG – Berlin",
      "type": "Einreichung neuer Dokumente",
      "state": "Berlin",
      "amtsgericht": "Amtsgericht Berlin (Charlottenburg)",
      "registernummer": "HRB 98743",
      "registerart": "HRB",
      "company_name": "Terraverde AG",
      "company_seat": "Berlin",
      "details": "16.06.2025 (Bekanntmachungsdatum)\n\nBerlin Amtsgericht Berlin (Charlottenburg) HRB 98743\nEinreichung neuer Dokumente\n\nTerraverde AG\nAktiengesellschaft\nBerlin\n\nAls nicht eingetragen wird veröffentlicht: Es wurde eine neue Liste der Aufsichtsratsmitglieder eingereicht (§ 106 AktG)."
    },
    {
      "date": "2025-06-16",
      "id": "112256",
      "original_text": "Registerbekanntmachung nach dem Umwandlungsgesetz\nBaden-Württemberg Amtsgericht Stuttgart HRA 740687\nHS Holding Schwaben GmbH & Co. KG – Reutlingen",
      "type": "Registerbekanntmachung nach dem Umwandlungsgesetz",
      "state": "Baden-Württemberg",
      "amtsgericht": "Amtsgericht Stuttgart",
      "registernummer": "HRA 740687",
      "registerart": "HRA",
      "company_name": "HS Holding Schwaben GmbH & Co. KG",
      "company_seat": "Reutlingen",
      "details": "16.06.2025 (Bekanntmachungsdatum)\n\nBaden-Württemberg Amtsgericht Stuttgart HRA 740687\nRegisterbekanntmachung nach dem Umwandlungsgesetz 16.06.2025 (Eintragungsdatum)\n\nHS Holding Schwaben GmbH & Co. KG\nKommanditgesellschaft\nReutlingen\n\nAls nicht eingetragen wird bekanntgemacht:\nDen Gläubigern der an der Abspaltung beteiligten Rechtsträger ist, wenn sie binnen sechs Monaten nach dem Tag, an dem die Eintragung der Abspaltung in das Register des Sitzes desjenigen Rechtsträgers, dessen Gläubiger sie sind, nach § 19 Abs. 3 UmwG als bekanntgemacht gilt, ihren Anspruch nach Grund und Höhe schriftlich anmelden, Sicherheit zu leisten, soweit sie nicht Befriedigung verlangen können. Dieses Recht steht den Gläubigern jedoch nur zu, wenn sie glaubhaft machen, dass durch die Abspaltung die Erfüllung ihrer Forderung gefährdet wird."
    },
    {
      "date": "2025-06-16",
      "id": "112257",
      "original_text": "Registerbekanntmachung nach dem Umwandlungsgesetz\nBaden-Württemberg Amtsgericht Stuttgart HRA 352232\nHS Holding Süd GmbH & Co. KG – Reutlingen",
      "type": "Registerbekanntmachung nach dem Umwandlungsgesetz",
      "state": "Baden-Württemberg",
      "amtsgericht": "Amtsgericht Stuttgart",
      "registernummer": "HRA 352232",
      "registerart": "HRA",
      "company_name": "HS Holding Süd GmbH & Co. KG",
      "company_seat": "Reutlingen",
      "details": "16.06.2025 (Bekanntmachungsdatum)\n\nBaden-Württemberg Amtsgericht Stuttgart HRA 352232\nRegisterbekanntmachung nach dem Umwandlungsgesetz 16.06.2025 (Eintragungsdatum)\n\nHS Holding Süd GmbH & Co. KG\nKommanditgesellschaft\nReutlingen\n\nDen Gläubigern der an der Abspaltung beteiligten Rechtsträger ist, wenn sie binnen sechs Monaten nach dem Tag, an dem die Eintragung der Abspaltung in das Register des Sitzes desjenigen Rechtsträgers, dessen Gläubiger sie sind, nach § 19 Abs. 3 UmwG als bekanntgemacht gilt, ihren Anspruch nach Grund und Höhe schriftlich anmelden, Sicherheit zu leisten, soweit sie nicht Befriedigung verlangen können. Dieses Recht steht den Gläubigern jedoch nur zu, wenn sie glaubhaft machen, dass durch die Abspaltung die Erfüllung ihrer Forderung gefährdet wird."
    },
    {
      "date": "2025-06-16",
      "id": "112258",
      "original_text": "Registerbekanntmachung nach dem Umwandlungsgesetz\nSchleswig-Holstein Amtsgericht Pinneberg HRA 9861\nKetz & Behnke Elektrotechnik GmbH & Co. KG – Quickborn/Krs. Pinneberg",
      "type": "Registerbekanntmachung nach dem Umwandlungsgesetz",
      "state": "Schleswig-Holstein",
      "amtsgericht": "Amtsgericht Pinneberg",
      "registernummer": "HRA 9861",
      "registerart": "HRA",
      "company_name": "Ketz & Behnke Elektrotechnik GmbH & Co. KG",
      "company_seat": "Quickborn/Krs. Pinneberg",
      "details": "16.06.2025 (Bekanntmachungsdatum)\n\nSchleswig-Holstein Amtsgericht Pinneberg HRA 9861\nRegisterbekanntmachung nach dem Umwandlungsgesetz 13.06.2025 (Eintragungsdatum)\n\nKetz & Behnke Elektrotechnik GmbH & Co. KG\nKommanditgesellschaft\nQuickborn/Krs. Pinneberg\n\nZu Eintragungsnummer 3 vom 13.06.2025 wird als nicht eingetragen veröffentlicht:  Als nicht eingetragen wird veröffentlicht: Den Gläubigern ist, wenn sie binnen sechs Monaten nach dem Tag, an dem die Eintragung der Umwandlung als bekannt gemacht gilt, ihren Anspruch nach Grund und Höhe schriftlich anmelden, Sicherheit zu leisten, soweit sie nicht Befriedigung verlangen können. Dieses Recht steht den Gläubigern jedoch nur zu, wenn sie glaubhaft machen, dass durch die Umwandlung die Erfüllung ihrer Forderung gefährdet wird. Das Recht, Sicherheitsleistung zu verlangen, steht Gläubigern nicht zu, die im Falle der Insolvenz ein Recht auf vorzugsweise Befriedigung aus einer Deckungsmasse haben, die nach gesetzlicher Vorschrift zu ihrem Schutz errichtet und staatlich überwacht ist."
    },
    {
      "date": "2025-06-16",
      "id": "112259",
      "original_text": "Registerbekanntmachung nach dem Umwandlungsgesetz\nBaden-Württemberg Amtsgericht Mannheim HRB 739820\nBeta Systems Software Aktiengesellschaft – Heidelberg",
      "type": "Registerbekanntmachung nach dem Umwandlungsgesetz",
      "state": "Baden-Württemberg",
      "amtsgericht": "Amtsgericht Mannheim",
      "registernummer": "HRB 739820",
      "registerart": "HRB",
      "company_name": "Beta Systems Software Aktiengesellschaft",
      "company_seat": "Heidelberg",
      "details": "16.06.2025 (Bekanntmachungsdatum)\n\nBaden-Württemberg Amtsgericht Mannheim HRB 739820\nRegisterbekanntmachung nach dem Umwandlungsgesetz 16.06.2025 (Eintragungsdatum)\n\nBeta Systems Software Aktiengesellschaft\nAktiengesellschaft\nHeidelberg\n\nDen Gläubigern der an der Verschmelzung beteiligten Rechtsträger ist, wenn sie binnen sechs Monaten nach dem Tag, an dem die Eintragung der Verschmelzung in das Register des Sitzes desjenigen Rechtsträgers, dessen Gläubiger sie sind, nach § 19 Abs. 3 UmwG als bekanntgemacht gilt, ihren Anspruch nach Grund und Höhe schriftlich anmelden, Sicherheit zu leisten, soweit sie nicht Befriedigung verlangen können. Dieses Recht steht den Gläubigern jedoch nur zu, wenn sie glaubhaft machen, dass durch die Verschmelzung die Erfüllung ihrer Forderung gefährdet wird."
    },
    {
      "date": "2025-06-16",
      "id": "112260",
      "original_text": "Registerbekanntmachung nach dem Umwandlungsgesetz\nBrandenburg Amtsgericht Potsdam HRB 35131\nNorth Star Ventures GmbH – Bad Belzig",
      "type": "Registerbekanntmachung nach dem Umwandlungsgesetz",
      "state": "Brandenburg",
      "amtsgericht": "Amtsgericht Potsdam",
      "registernummer": "HRB 35131",
      "registerart": "HRB",
      "company_name": "North Star Ventures GmbH",
      "company_seat": "Bad Belzig",
      "details": "16.06.2025 (Bekanntmachungsdatum)\n\nBrandenburg Amtsgericht Potsdam HRB 35131\nRegisterbekanntmachung nach dem Umwandlungsgesetz 12.06.2025 (Eintragungsdatum)\n\nNorth Star Ventures GmbH\nGesellschaft mit beschränkter Haftung\nBad Belzig\n\nZu Eintragungsnummer 3 vom 12.06.2025 wird als nicht eingetragen veröffentlicht:\nDen Gläubigern der an der Verschmelzung beteiligten Rechtsträger ist, wenn sie binnen sechs Monaten nach dem Tag, an dem die Eintragung der Verschmelzung in das Register des Sitzes desjenigen Rechtsträgers, dessen Gläubiger sie sind, als bekannt gemacht gilt, ihren Anspruch nach Grund und Höhe schriftlich anmelden, Sicherheit zu leisten, soweit sie nicht Befriedigung verlangen können. Dieses Recht steht den Gläubigern jedoch nur zu, wenn sie glaubhaft machen, dass durch die Verschmelzung die Erfüllung ihrer Forderung gefährdet wird"
    },
    {
      "date": "2025-06-16",
      "id": "112261",
      "original_text": "Registerbekanntmachung nach dem Umwandlungsgesetz\nHamburg Amtsgericht Hamburg HRB 150647\nFonds 8 AvR B Stromstraße Bestand Verwaltungs GmbH – Hamburg",
      "type": "Registerbekanntmachung nach dem Umwandlungsgesetz",
      "state": "Hamburg",
      "amtsgericht": "Amtsgericht Hamburg",
      "registernummer": "HRB 150647",
      "registerart": "HRB",
      "company_name": "Fonds 8 AvR B Stromstraße Bestand Verwaltungs GmbH",
      "company_seat": "Hamburg",
      "details": "16.06.2025 (Bekanntmachungsdatum)\n\nHamburg Amtsgericht Hamburg HRB 150647\nRegisterbekanntmachung nach dem Umwandlungsgesetz\n\nFonds 8 AvR B Stromstraße Bestand Verwaltungs GmbH\nGesellschaft mit beschränkter Haftung\nHamburg\n\nAls nicht eingetragen wird bekannt gemacht:\nEs wird darauf hingewiesen, dass ein Formwechselplan oder sein Entwurf über einen grenzüberschreitenden Formwechsel in die Fonds 8 AvR B Stromstraße Bestand Verwaltungs S.à r.l. mit Sitz in Luxemburg/Luxemburg (société à responsabilité limitée - Gesellschaft mit beschränkter Haftung  nach luxemburgischem Recht) beim Handelsregister eingereicht worden ist.\nDie Anteilsinhaber, die Gläubiger sowie die zuständigen Betriebsräte der an dem grenzüberschreitenden Formwechsel beteiligten Gesellschaft oder, soweit es keinen Betriebsrat gibt, die Arbeitnehmer der an dem grenzüberschreitenden Formwechsel beteiligten Gesellschaft, können der Gesellschaft spätestens fünf Arbeitstage vor dem Tag der Gesellschafterversammlung Bemerkungen zum Formwechselplan übermitteln."
    },
    {
      "date": "2025-06-16",
      "id": "112262",
      "original_text": "Registerbekanntmachung nach dem Umwandlungsgesetz\nSchleswig-Holstein Amtsgericht Kiel HRA 12495\nHühnerhof Inh. Imke Andersson e.Kfr. – Altenholz",
      "type": "Registerbekanntmachung nach dem Umwandlungsgesetz",
      "state": "Schleswig-Holstein",
      "amtsgericht": "Amtsgericht Kiel",
      "registernummer": "HRA 12495",
      "registerart": "HRA",
      "company_name": "Hühnerhof Inh. Imke Andersson e.Kfr.",
      "company_seat": "Altenholz",
      "details": "16.06.2025 (Bekanntmachungsdatum)\n\nSchleswig-Holstein Amtsgericht Kiel HRA 12495\nRegisterbekanntmachung nach dem Umwandlungsgesetz 13.06.2025 (Eintragungsdatum)\n\nHühnerhof Inh. Imke Andersson e.Kfr.\nEinzelkaufmann / Einzelkauffrau\nAltenholz\n\nZu Eintragungsnummer 2 vom 13.06.2025 wird als nicht eingetragen veröffentlicht: Als nicht eingetragen wird veröffentlicht: Den Gläubigern der an der Spaltung beteiligten Rechtsträger ist, wenn sie binnen sechs Monaten nach dem Tag, an dem die Eintragung der Spaltung in das Register des Sitzes desjenigen Rechtsträgers, dessen Gläubiger sie sind,  bekannt gemacht worden ist, ihren Anspruch nach Grund und Höhe schriftlich anmelden, Sicherheit zu leisten, soweit sie nicht Befriedigung verlangen können. Dieses Recht steht den Gläubigern jedoch nur zu, wenn sie glaubhaft machen, dass durch die Spaltung die Erfüllung ihrer Forderung gefährdet wird."
    },
    {
      "date": "2025-06-16",
      "id": "112263",
      "original_text": "Einreichung neuer Dokumente\nSchleswig-Holstein Amtsgericht Flensburg HRB 14440\nteam SE – Flensburg",
      "type": "Einreichung neuer Dokumente",
      "state": "Schleswig-Holstein",
      "amtsgericht": "Amtsgericht Flensburg",
      "registernummer": "HRB 14440",
      "registerart": "HRB",
      "company_name": "team SE",
      "company_seat": "Flensburg",
      "details": "16.06.2025 (Bekanntmachungsdatum)\n\nSchleswig-Holstein Amtsgericht Flensburg HRB 14440\nEinreichung neuer Dokumente\n\nteam SE\nEuropäische Aktiengesellschaft (SE)\nFlensburg\n\nAls nicht eingetragen wird veröffentlicht: Neue Aufsichtsratsliste nach Änderung eingereicht am 16.06.2025."
    },
    {
      "date": "2025-06-16",
      "id": "112264",
      "original_text": "Löschungsankündigung\nBerlin Amtsgericht Berlin (Charlottenburg) HRB 202292\nNVV Verwaltungs-GmbH – Berlin",
      "type": "Löschungsankündigung",
      "state": "Berlin",
      "amtsgericht": "Amtsgericht Berlin (Charlottenburg)",
      "registernummer": "HRB 202292",
      "registerart": "HRB",
      "company_name": "NVV Verwaltungs-GmbH",
      "company_seat": "Berlin",
      "details": "16.06.2025 (Bekanntmachungsdatum)\n\nBerlin Amtsgericht Berlin (Charlottenburg) HRB 202292\nLöschungsankündigung\n\nNVV Verwaltungs-GmbH\nGesellschaft mit beschränkter Haftung\nBerlin\n\nBei der nachstehenden Gesellschaft wird das Amtslöschungsverfahren gemäß § 394 FamFG eingeleitet. Widerspruchsfrist 6 Wochen"
    },
    {
      "date": "2025-06-16",
      "id": "112265",
      "original_text": "Löschungsankündigung\nSachsen-Anhalt Amtsgericht Stendal VR 66234\nLohnsteuerhilfeverein Egeln e.V. – Egeln",
      "type": "Löschungsankündigung",
      "state": "Sachsen-Anhalt",
      "amtsgericht": "Amtsgericht Stendal",
      "registernummer": "VR 66234",
      "registerart": "VR",
      "company_name": "Lohnsteuerhilfeverein Egeln e.V.",
      "company_seat": "Egeln",
      "details": "16.06.2025 (Bekanntmachungsdatum)\n\nSachsen-Anhalt Amtsgericht Stendal VR 66234\nLöschungsankündigung\n\nLohnsteuerhilfeverein Egeln e.V.\neingetragener Verein\nEgeln\n\nDas Registergericht beabsichtigt, vorstehenden Verein infolge Wegfalls sämtlicher Mitglieder bzw. vollständiger Aufgabe des Vereinszwecks v.A.w. zu löschen. Die Frist zur Erhebung eines Widerspruchs gegen die beabsichtigte Löschung wird auf zwei Monate festgesetzt."
    },
    {
      "date": "2025-06-16",
      "id": "112266",
      "original_text": "Einreichung neuer Dokumente\nHamburg Amtsgericht Hamburg HRB 153232\nFinexity AG – Hamburg",
      "type": "Einreichung neuer Dokumente",
      "state": "Hamburg",
      "amtsgericht": "Amtsgericht Hamburg",
      "registernummer": "HRB 153232",
      "registerart": "HRB",
      "company_name": "Finexity AG",
      "company_seat": "Hamburg",
      "details": "16.06.2025 (Bekanntmachungsdatum)\n\nHamburg Amtsgericht Hamburg HRB 153232\nEinreichung neuer Dokumente\n\nFinexity AG\nAktiengesellschaft\nHamburg\n\nAls nicht eingetragen wird bekannt gemacht: Liste des Aufsichtsrats wurde eingereicht."
    },
    {
      "date": "2025-06-16",
      "id": "112267",
      "original_text": "Löschungsankündigung\nSachsen-Anhalt Amtsgericht Stendal VR 2362\nFörderverein Zorbau e.V. – Lützen",
      "type": "Löschungsankündigung",
      "state": "Sachsen-Anhalt",
      "amtsgericht": "Amtsgericht Stendal",
      "registernummer": "VR 2362",
      "registerart": "VR",
      "company_name": "Förderverein Zorbau e.V.",
      "company_seat": "Lützen",
      "details": "16.06.2025 (Bekanntmachungsdatum)\n\nSachsen-Anhalt Amtsgericht Stendal VR 2362\nLöschungsankündigung\n\nFörderverein Zorbau e.V.\neingetragener Verein\nLützen\n\nDas Registergericht beabsichtigt, vorstehenden Verein infolge Wegfalls sämtlicher Mitglieder v.A.w. zu löschen. Die Frist zur Erhebung eines Widerspruchs gegen die beabsichtigte Löschung wird auf zwei Monate festgesetzt."
    },
    {
      "date": "2025-06-16",
      "id": "112268",
      "original_text": "Löschungsankündigung\nBaden-Württemberg Amtsgericht Mannheim HRB 751912\nRhein-Main Industrieservice GmbH – Walldorf",
      "type": "Löschungsankündigung",
      "state": "Baden-Württemberg",
      "amtsgericht": "Amtsgericht Mannheim",
      "registernummer": "HRB 751912",
      "registerart": "HRB",
      "company_name": "Rhein-Main Industrieservice GmbH",
      "company_seat": "Walldorf",
      "details": "16.06.2025 (Bekanntmachungsdatum)\n\nBaden-Württemberg Amtsgericht Mannheim HRB 751912\nLöschungsankündigung\n\nRhein-Main Industrieservice GmbH\nGesellschaft mit beschränkter Haftung\nWalldorf\n\nAls nicht eingetragen wird bekanntgemacht:\nDas Gericht beabsichtigt, die Gesellschaft wegen Vermögenslosigkeit im Handelsregister von Amts wegen nach § 394 FamFG zu löschen. Die Frist zur Geltendmachung eines Widerspruchs gegen die beabsichtigte Löschung ist auf einen Monat ab Veröffentlichung bestimmt."
    },
    {
      "date": "2025-06-16",
      "id": "112269",
      "original_text": "Löschungsankündigung\nBerlin Amtsgericht Berlin (Charlottenburg) HRB 103957\nHealthCarion GmbH – Berlin",
      "type": "Löschungsankündigung",
      "state": "Berlin",
      "amtsgericht": "Amtsgericht Berlin (Charlottenburg)",
      "registernummer": "HRB 103957",
      "registerart": "HRB",
      "company_name": "HealthCarion GmbH",
      "company_seat": "Berlin",
      "details": "16.06.2025 (Bekanntmachungsdatum)\n\nBerlin Amtsgericht Berlin (Charlottenburg) HRB 103957\nLöschungsankündigung\n\nHealthCarion GmbH\nGesellschaft mit beschränkter Haftung\nBerlin\n\nBei der nachstehenden Gesellschaft wird das Amtslöschungsverfahren gemäß § 394 FamFG eingeleitet. Widerspruchsfrist 6 Wochen"
    },
    {
      "date": "2025-06-16",
      "id": "112270",
      "original_text": "Registerbekanntmachung nach dem Umwandlungsgesetz\nSchleswig-Holstein Amtsgericht Kiel HRB 27810\nMö-We SH UG (haftungsbeschränkt) – Alt Duvenstedt",
      "type": "Registerbekanntmachung nach dem Umwandlungsgesetz",
      "state": "Schleswig-Holstein",
      "amtsgericht": "Amtsgericht Kiel",
      "registernummer": "HRB 27810",
      "registerart": "HRB",
      "company_name": "Mö-We SH UG (haftungsbeschränkt)",
      "company_seat": "Alt Duvenstedt",
      "details": "16.06.2025 (Bekanntmachungsdatum)\n\nSchleswig-Holstein Amtsgericht Kiel HRB 27810\nRegisterbekanntmachung nach dem Umwandlungsgesetz 13.06.2025 (Eintragungsdatum)\n\nMö-We SH UG (haftungsbeschränkt)\nGesellschaft mit beschränkter Haftung\nAlt Duvenstedt\n\nAls nicht eingetragen wird veröffentlicht: Den Gläubigern ist, wenn sie binnen sechs Monaten nach dem Tag, an dem die Eintragung der Umwandlung bekannt gemacht worden ist, ihren Anspruch nach Grund und Höhe schriftlich anmelden, Sicherheit zu leisten, soweit sie nicht Befriedigung verlangen können. Dieses Recht steht den Gläubigern jedoch nur zu, wenn sie glaubhaft machen, dass durch die Umwandlung die Erfüllung ihrer Forderung gefährdet wird."
    },
    {
      "date": "2025-06-16",
      "id": "112271",
      "original_text": "Registerbekanntmachung nach dem Umwandlungsgesetz\nBerlin Amtsgericht Berlin (Charlottenburg) HRA 19825\nAutohaus Köhrich e.K. – Berlin",
      "type": "Registerbekanntmachung nach dem Umwandlungsgesetz",
      "state": "Berlin",
      "amtsgericht": "Amtsgericht Berlin (Charlottenburg)",
      "registernummer": "HRA 19825",
      "registerart": "HRA",
      "company_name": "Autohaus Köhrich e.K.",
      "company_seat": "Berlin",
      "details": "16.06.2025 (Bekanntmachungsdatum)\n\nBerlin Amtsgericht Berlin (Charlottenburg) HRA 19825\nRegisterbekanntmachung nach dem Umwandlungsgesetz 14.06.2025 (Eintragungsdatum)\n\nAutohaus Köhrich e.K.\nEinzelkaufmann / Einzelkauffrau\nBerlin\n\nZu Eintragungsnummer 6 vom 14.06.2025 wird als nicht eingetragen veröffentlicht:\nDen Gläubigern der an der Spaltung beteiligten Rechtsträger ist, wenn sie binnen sechs Monaten nach dem Tag, an dem die Eintragung der Spaltung in das Register des Sitzes desjenigen Rechtsträgers, dessen Gläubiger sie sind, als bekannt gemacht gilt, ihren Anspruch nach Grund und Höhe schriftlich anmelden, Sicherheit zu leisten, soweit sie nicht Befriedigung verlangen können. Dieses Recht steht den Gläubigern jedoch nur zu, wenn sie glaubhaft machen, dass durch die Spaltung die Erfüllung ihrer Forderung gefährdet wird. Das Recht, Sicherheitsleistung zu verlangen, steht Gläubigern nicht zu, die im Falle der Insolvenz ein Recht auf vorzugsweise Befriedigung aus einer Deckungsmasse haben, die nach gesetzlicher Vorschrift zu ihrem Schutz errichtet und staatlich überwacht ist."
    },
    {
      "date": "2025-06-16",
      "id": "112272",
      "original_text": "Registerbekanntmachung nach dem Umwandlungsgesetz\nBerlin Amtsgericht Berlin (Charlottenburg) HRA 64069\nKfz-Werkstatt Köhrich GmbH & Co. KG – Berlin",
      "type": "Registerbekanntmachung nach dem Umwandlungsgesetz",
      "state": "Berlin",
      "amtsgericht": "Amtsgericht Berlin (Charlottenburg)",
      "registernummer": "HRA 64069",
      "registerart": "HRA",
      "company_name": "Kfz-Werkstatt Köhrich GmbH & Co. KG",
      "company_seat": "Berlin",
      "details": "16.06.2025 (Bekanntmachungsdatum)\n\nBerlin Amtsgericht Berlin (Charlottenburg) HRA 64069\nRegisterbekanntmachung nach dem Umwandlungsgesetz 16.06.2025 (Eintragungsdatum)\n\nKfz-Werkstatt Köhrich GmbH & Co. KG\nKommanditgesellschaft\nBerlin\n\nZu Eintragungsnummer 3 vom 16.06.2025 wird als nicht eingetragen veröffentlicht:\nDen Gläubigern der an der Spaltung beteiligten Rechtsträger ist, wenn sie binnen sechs Monaten nach dem Tag, an dem die Eintragung der Spaltung in das Register des Sitzes desjenigen Rechtsträgers, dessen Gläubiger sie sind, als bekannt gemacht gilt, ihren Anspruch nach Grund und Höhe schriftlich anmelden, Sicherheit zu leisten, soweit sie nicht Befriedigung verlangen können. Dieses Recht steht den Gläubigern jedoch nur zu, wenn sie glaubhaft machen, dass durch die Spaltung die Erfüllung ihrer Forderung gefährdet wird. Das Recht, Sicherheitsleistung zu verlangen, steht Gläubigern nicht zu, die im Falle der Insolvenz ein Recht auf vorzugsweise Befriedigung aus einer Deckungsmasse haben, die nach gesetzlicher Vorschrift zu ihrem Schutz errichtet und staatlich überwacht ist."
    },
    {
      "date": "2025-06-16",
      "id": "112273",
      "original_text": "Einreichung neuer Dokumente\nBerlin Amtsgericht Berlin (Charlottenburg) HRB 263141\nPS off market immobilien AG – Berlin",
      "type": "Einreichung neuer Dokumente",
      "state": "Berlin",
      "amtsgericht": "Amtsgericht Berlin (Charlottenburg)",
      "registernummer": "HRB 263141",
      "registerart": "HRB",
      "company_name": "PS off market immobilien AG",
      "company_seat": "Berlin",
      "details": "16.06.2025 (Bekanntmachungsdatum)\n\nBerlin Amtsgericht Berlin (Charlottenburg) HRB 263141\nEinreichung neuer Dokumente\n\nPS off market immobilien AG\nAktiengesellschaft\nBerlin\n\nAls nicht eingetragen wird veröffentlicht: Es wurde eine neue Liste der Aufsichtsratsmitglieder eingereicht (§ 106 AktG)."
    },
    {
      "date": "2025-06-16",
      "id": "112274",
      "original_text": "Einreichung neuer Dokumente\nMecklenburg-Vorpommern Amtsgericht Stralsund HRB 7035\nHanseYachts AG – Greifswald",
      "type": "Einreichung neuer Dokumente",
      "state": "Mecklenburg-Vorpommern",
      "amtsgericht": "Amtsgericht Stralsund",
      "registernummer": "HRB 7035",
      "registerart": "HRB",
      "company_name": "HanseYachts AG",
      "company_seat": "Greifswald",
      "details": "16.06.2025 (Bekanntmachungsdatum)\n\nMecklenburg-Vorpommern Amtsgericht Stralsund HRB 7035\nEinreichung neuer Dokumente\n\nHanseYachts AG\nAktiengesellschaft\nGreifswald\n\nEine Liste der Mitglieder des Aufsichtsrats ist zum Handelsregister eingereicht worden."
    },
    {
      "date": "2025-06-16",
      "id": "112275",
      "original_text": "Registerbekanntmachung nach dem Umwandlungsgesetz\nBaden-Württemberg Amtsgericht Stuttgart HRB 785096\nTK Aufzugswerke Newco GmbH – Neuhausen auf den Fildern",
      "type": "Registerbekanntmachung nach dem Umwandlungsgesetz",
      "state": "Baden-Württemberg",
      "amtsgericht": "Amtsgericht Stuttgart",
      "registernummer": "HRB 785096",
      "registerart": "HRB",
      "company_name": "TK Aufzugswerke Newco GmbH",
      "company_seat": "Neuhausen auf den Fildern",
      "details": "16.06.2025 (Bekanntmachungsdatum)\n\nBaden-Württemberg Amtsgericht Stuttgart HRB 785096\nRegisterbekanntmachung nach dem Umwandlungsgesetz 16.06.2025 (Eintragungsdatum)\n\nTK Aufzugswerke Newco GmbH\nGesellschaft mit beschränkter Haftung\nNeuhausen auf den Fildern\n\nAls nicht eingetragen wird bekanntgemacht:\nAls nicht eingetragen wird bekanntgemacht:\nDen Gläubigern der an der Verschmelzung beteiligten Rechtsträger ist, wenn sie binnen sechs Monaten nach dem Tag, an dem die Eintragung der Verschmelzung in das Register des Sitzes desjenigen Rechtsträgers, dessen Gläubiger sie sind, nach § 19 Abs. 3 UmwG als bekanntgemacht gilt, ihren Anspruch nach Grund und Höhe schriftlich anmelden, Sicherheit zu leisten, soweit sie nicht Befriedigung verlangen können. Dieses Recht steht den Gläubigern jedoch nur zu, wenn sie glaubhaft machen, dass durch die Verschmelzung die Erfüllung ihrer Forderung gefährdet wird."
    },
    {
      "date": "2025-06-16",
      "id": "112276",
      "original_text": "Registerbekanntmachung nach dem Umwandlungsgesetz\nBaden-Württemberg Amtsgericht Mannheim HRA 711801\nImmobilienverwaltung M. Brecht e. K. – Graben-Neudorf",
      "type": "Registerbekanntmachung nach dem Umwandlungsgesetz",
      "state": "Baden-Württemberg",
      "amtsgericht": "Amtsgericht Mannheim",
      "registernummer": "HRA 711801",
      "registerart": "HRA",
      "company_name": "Immobilienverwaltung M. Brecht e. K.",
      "company_seat": "Graben-Neudorf",
      "details": "16.06.2025 (Bekanntmachungsdatum)\n\nBaden-Württemberg Amtsgericht Mannheim HRA 711801\nRegisterbekanntmachung nach dem Umwandlungsgesetz 16.06.2025 (Eintragungsdatum)\n\nImmobilienverwaltung M. Brecht e. K.\nEinzelkaufmann / Einzelkauffrau\nGraben-Neudorf\n\nAls nicht eingetragen wird bekanntgemacht:\nDen Gläubigern der an der Ausgliederung beteiligten Rechtsträger ist, wenn sie binnen sechs Monaten nach dem Tag, an dem die Eintragung der Ausgliederung in das Register des Sitzes desjenigen Rechtsträgers, dessen Gläubiger sie sind, nach § 19 Abs. 3 UmwG als bekanntgemacht gilt, ihren Anspruch nach Grund und Höhe schriftlich anmelden, Sicherheit zu leisten, soweit sie nicht Befriedigung verlangen können. Dieses Recht steht den Gläubigern jedoch nur zu, wenn sie glaubhaft machen, dass durch die Ausgliederung die Erfüllung ihrer Forderung gefährdet wird."
    },
    {
      "date": "2025-06-16",
      "id": "112277",
      "original_text": "Registerbekanntmachung nach dem Umwandlungsgesetz\nBerlin Amtsgericht Berlin (Charlottenburg) HRB 91122\nCoConsult GmbH – Berlin",
      "type": "Registerbekanntmachung nach dem Umwandlungsgesetz",
      "state": "Berlin",
      "amtsgericht": "Amtsgericht Berlin (Charlottenburg)",
      "registernummer": "HRB 91122",
      "registerart": "HRB",
      "company_name": "CoConsult GmbH",
      "company_seat": "Berlin",
      "details": "16.06.2025 (Bekanntmachungsdatum)\n\nBerlin Amtsgericht Berlin (Charlottenburg) HRB 91122\nRegisterbekanntmachung nach dem Umwandlungsgesetz 13.06.2025 (Eintragungsdatum)\n\nCoConsult GmbH\nGesellschaft mit beschränkter Haftung\nBerlin\n\nZu Eintragungsnummer 5 vom 13.06.2025 wird als nicht eingetragen veröffentlicht: Den Gläubigern der an der Verschmelzung beteiligten Rechtsträger ist, wenn sie binnen sechs Monaten nach dem Tag, an dem die Eintragung der Verschmelzung in das Register des Sitzes desjenigen Rechtsträgers, dessen Gläubiger sie sind, als bekannt gemacht gilt, ihren Anspruch nach Grund und Höhe schriftlich anmelden, Sicherheit zu leisten, soweit sie nicht Befriedigung verlangen können. Dieses Recht steht den Gläubigern jedoch nur zu, wenn sie glaubhaft machen, dass durch die Verschmelzung die Erfüllung ihrer Forderung gefährdet wird. Das Recht, Sicherheitsleistung zu verlangen, steht Gläubigern nicht zu, die im Falle der Insolvenz ein Recht auf vorzugsweise Befriedigung aus einer Deckungsmasse haben, die nach gesetzlicher Vorschrift zu ihrem Schutz errichtet und staatlich überwacht ist."
    },
    {
      "date": "2025-06-16",
      "id": "112278",
      "original_text": "Registerbekanntmachung nach dem Umwandlungsgesetz\nBerlin Amtsgericht Berlin (Charlottenburg) HRB 129432\nDel Medio Verlag GmbH – Berlin",
      "type": "Registerbekanntmachung nach dem Umwandlungsgesetz",
      "state": "Berlin",
      "amtsgericht": "Amtsgericht Berlin (Charlottenburg)",
      "registernummer": "HRB 129432",
      "registerart": "HRB",
      "company_name": "Del Medio Verlag GmbH",
      "company_seat": "Berlin",
      "details": "16.06.2025 (Bekanntmachungsdatum)\n\nBerlin Amtsgericht Berlin (Charlottenburg) HRB 129432\nRegisterbekanntmachung nach dem Umwandlungsgesetz 13.06.2025 (Eintragungsdatum)\n\nDel Medio Verlag GmbH\nGesellschaft mit beschränkter Haftung\nBerlin\n\nZu Eintragungsnummer 2 vom 13.06.2025 wird als nicht eingetragen veröffentlicht: Den Gläubigern der an der Verschmelzung beteiligten Rechtsträger ist, wenn sie binnen sechs Monaten nach dem Tag, an dem die Eintragung der Verschmelzung in das Register des Sitzes desjenigen Rechtsträgers, dessen Gläubiger sie sind, als bekannt gemacht gilt, ihren Anspruch nach Grund und Höhe schriftlich anmelden, Sicherheit zu leisten, soweit sie nicht Befriedigung verlangen können. Dieses Recht steht den Gläubigern jedoch nur zu, wenn sie glaubhaft machen, dass durch die Verschmelzung die Erfüllung ihrer Forderung gefährdet wird. Das Recht, Sicherheitsleistung zu verlangen, steht Gläubigern nicht zu, die im Falle der Insolvenz ein Recht auf vorzugsweise Befriedigung aus einer Deckungsmasse haben, die nach gesetzlicher Vorschrift zu ihrem Schutz errichtet und staatlich überwacht ist."
    },
    {
      "date": "2025-06-16",
      "id": "112279",
      "original_text": "Löschungsankündigung\nSchleswig-Holstein Amtsgericht Kiel HRB 13595\nakf siemers airport GmbH – Norderstedt",
      "type": "Löschungsankündigung",
      "state": "Schleswig-Holstein",
      "amtsgericht": "Amtsgericht Kiel",
      "registernummer": "HRB 13595",
      "registerart": "HRB",
      "company_name": "akf siemers airport GmbH",
      "company_seat": "Norderstedt",
      "details": "16.06.2025 (Bekanntmachungsdatum)\n\nSchleswig-Holstein Amtsgericht Kiel HRB 13595\nLöschungsankündigung\n\nakf siemers airport GmbH\nGesellschaft mit beschränkter Haftung\nNorderstedt\n\nEs ist die Löschung der nachstehenden Gesellschaft wegen Vermögenslosigkeit gemäß § 394 FamFG beabsichtigt. Widerspruchsfrist: 2 Monate."
    },
    {
      "date": "2025-06-16",
      "id": "112280",
      "original_text": "Registerbekanntmachung nach dem Umwandlungsgesetz\nBaden-Württemberg Amtsgericht Mannheim HRB 750105\nImmobilienverwaltung Manfred Brecht GmbH – Graben-Neudorf",
      "type": "Registerbekanntmachung nach dem Umwandlungsgesetz",
      "state": "Baden-Württemberg",
      "amtsgericht": "Amtsgericht Mannheim",
      "registernummer": "HRB 750105",
      "registerart": "HRB",
      "company_name": "Immobilienverwaltung Manfred Brecht GmbH",
      "company_seat": "Graben-Neudorf",
      "details": "16.06.2025 (Bekanntmachungsdatum)\n\nBaden-Württemberg Amtsgericht Mannheim HRB 750105\nRegisterbekanntmachung nach dem Umwandlungsgesetz 16.06.2025 (Eintragungsdatum)\n\nImmobilienverwaltung Manfred Brecht GmbH\nGesellschaft mit beschränkter Haftung\nGraben-Neudorf\n\nAls nicht eingetragen wird bekanntgemacht:\nDen Gläubigern der an der Ausgliederung beteiligten Rechtsträger ist, wenn sie binnen sechs Monaten nach dem Tag, an dem die Eintragung der Ausgliederung in das Register des Sitzes desjenigen Rechtsträgers, dessen Gläubiger sie sind, nach § 19 Abs. 3 UmwG als bekanntgemacht gilt, ihren Anspruch nach Grund und Höhe schriftlich anmelden, Sicherheit zu leisten, soweit sie nicht Befriedigung verlangen können. Dieses Recht steht den Gläubigern jedoch nur zu, wenn sie glaubhaft machen, dass durch die Ausgliederung die Erfüllung ihrer Forderung gefährdet wird."
    },
    {
      "date": "2025-06-16",
      "id": "112281",
      "original_text": "Registerbekanntmachung nach dem Umwandlungsgesetz\nSchleswig-Holstein Amtsgericht Pinneberg HRB 7076\nFeldstraße die Zweite Verwaltungsgesellschaft mbH – Heist",
      "type": "Registerbekanntmachung nach dem Umwandlungsgesetz",
      "state": "Schleswig-Holstein",
      "amtsgericht": "Amtsgericht Pinneberg",
      "registernummer": "HRB 7076",
      "registerart": "HRB",
      "company_name": "Feldstraße die Zweite Verwaltungsgesellschaft mbH",
      "company_seat": "Heist",
      "details": "16.06.2025 (Bekanntmachungsdatum)\n\nSchleswig-Holstein Amtsgericht Pinneberg HRB 7076\nRegisterbekanntmachung nach dem Umwandlungsgesetz\n\nFeldstraße die Zweite Verwaltungsgesellschaft mbH\nGesellschaft mit beschränkter Haftung\nHeist\n\nAls nicht eingetragen wird veröffentlich: Gemäß § 308 UmwG, § 10 HGB wird bekannt gemacht, dass der Verschmelzungsplan zwischen der hiesigen Gesellschaft sowie der Skyline Holding GmbH, Sitz Wien beim Handelsregister eingereicht worden ist.\n\n1.Der Verschmelzungsplan vom 23.04.2025 ist beim Handelsregister eingereicht.\n\n2.Die an der Verschmelzung beteiligten Gesellschaften haben folgende Rechtsform, Firma\nund Sitz:\nSkyline Holding GmbH mit Sitz in Wien\nFeldstraße die Zweite Verwaltungsgesellschaft mbH mit Sitz in Heist.\n\n3.Die an der Verschmelzung beteiligten Gesellschaften sind eingetragen im Register\n- Skyline Holding GmbH: Firmenbuch des Handelsgerichts Wien, Registernummer FN\n443622k\n- Feldstraße die Zweite Verwaltungsgesellschaft mbH: Handelsregister des Amtsgerichts\nPinneberg, Registernummer HR B 7076 PI\n\n4.Die Gesellschaft weist hiermit die Gläubiger, die Arbeitnehmer und die jeweiligen Gesellschafter der Skyline Holding GmbH und der Feldstraße die Zweite Verwaltungsgesellschaft mbH hiermit darauf hin, dass sie der jeweiligen Gesellschaft spätestens bis zum 12. Juli 2025 Bemerkungen zum Verschmelzungsplan übermitteln können (§ 308 Abs. 1 Satz 2 Nr. 4 UmwG). Die Bemerkungen können in Textform an die folgende Adresse geschickt werden: Feldstraße die Zweite Verwaltungsgesellschaft mbH, z. Hd. Geschäftsführung, Großer Ring 28, 25492 Heist. Da weder die Skyline Holding GmbH noch die Feldstraße die Zweite Verwaltungsgesellschaft mbH einen Betriebsrat haben, ist der Hinweis an die zuständigen Betriebsräte der beteiligten Gesellschaften entbehrlich."
    },
    {
      "date": "2025-06-16",
      "id": "112282",
      "original_text": "Registerbekanntmachung nach dem Umwandlungsgesetz\nBaden-Württemberg Amtsgericht Freiburg HRB 726791\nwir unternehmen medien GmbH – Offenburg",
      "type": "Registerbekanntmachung nach dem Umwandlungsgesetz",
      "state": "Baden-Württemberg",
      "amtsgericht": "Amtsgericht Freiburg",
      "registernummer": "HRB 726791",
      "registerart": "HRB",
      "company_name": "wir unternehmen medien GmbH",
      "company_seat": "Offenburg",
      "details": "16.06.2025 (Bekanntmachungsdatum)\n\nBaden-Württemberg Amtsgericht Freiburg HRB 726791\nRegisterbekanntmachung nach dem Umwandlungsgesetz 16.06.2025 (Eintragungsdatum)\n\nwir unternehmen medien GmbH\nGesellschaft mit beschränkter Haftung\nOffenburg\n\nAls nicht eingetragen wird bekanntgemacht:\nDen Gläubigern der an der Verschmelzung beteiligten Rechtsträger ist, wenn sie binnen sechs Monaten nach dem Tag, an dem die Eintragung der Verschmelzung in das Register des Sitzes desjenigen Rechtsträgers, dessen Gläubiger sie sind, nach § 19 Abs. 3 UmwG als bekanntgemacht gilt, ihren Anspruch nach Grund und Höhe schriftlich anmelden, Sicherheit zu leisten, soweit sie nicht Befriedigung verlangen können. Dieses Recht steht den Gläubigern jedoch nur zu, wenn sie glaubhaft machen, dass durch die Verschmelzung die Erfüllung ihrer Forderung gefährdet wird."
    },
    {
      "date": "2025-06-16",
      "id": "112283",
      "original_text": "Registerbekanntmachung nach dem Umwandlungsgesetz\nSchleswig-Holstein Amtsgericht Flensburg HRB 17468\nUtlande-Appartements GmbH – Sankt Peter-Ording",
      "type": "Registerbekanntmachung nach dem Umwandlungsgesetz",
      "state": "Schleswig-Holstein",
      "amtsgericht": "Amtsgericht Flensburg",
      "registernummer": "HRB 17468",
      "registerart": "HRB",
      "company_name": "Utlande-Appartements GmbH",
      "company_seat": "Sankt Peter-Ording",
      "details": "16.06.2025 (Bekanntmachungsdatum)\n\nSchleswig-Holstein Amtsgericht Flensburg HRB 17468\nRegisterbekanntmachung nach dem Umwandlungsgesetz 16.06.2025 (Eintragungsdatum)\n\nUtlande-Appartements GmbH\nGesellschaft mit beschränkter Haftung\nSankt Peter-Ording\n\nZu Eintragungsnummer 2 vom 16.06.2025 wird als nicht eingetragen veröffentlicht:\nDen Gläubigern der an der Spaltung beteiligten Rechtsträger ist, wenn sie binnen sechs Monaten nach dem Tag, an dem die Eintragung der Spaltung in das Register des Sitzes desjenigen Rechtsträgers, dessen Gläubiger sie sind, als bekannt gemacht gilt, ihren Anspruch nach Grund und Höhe schriftlich anmelden, Sicherheit zu leisten, soweit sie nicht Befriedigung verlangen können. Dieses Recht steht den Gläubigern jedoch nur zu, wenn sie glaubhaft machen, dass durch die Spaltung die Erfüllung ihrer Forderung gefährdet wird. Das Recht, Sicherheitsleistung zu verlangen, steht Gläubigern nicht zu, die im Falle der Insolvenz ein Recht auf vorzugsweise Befriedigung aus einer Deckungsmasse haben, die nach gesetzlicher Vorschrift zu ihrem Schutz errichtet und staatlich überwacht ist."
    },
    {
      "date": "2025-06-16",
      "id": "112284",
      "original_text": "Registerbekanntmachung nach dem Umwandlungsgesetz\nSachsen-Anhalt Amtsgericht Stendal HRB 11259\nBüma Büromaterial Dessau GmbH – Dessau-Roßlau",
      "type": "Registerbekanntmachung nach dem Umwandlungsgesetz",
      "state": "Sachsen-Anhalt",
      "amtsgericht": "Amtsgericht Stendal",
      "registernummer": "HRB 11259",
      "registerart": "HRB",
      "company_name": "Büma Büromaterial Dessau GmbH",
      "company_seat": "Dessau-Roßlau",
      "details": "16.06.2025 (Bekanntmachungsdatum)\n\nSachsen-Anhalt Amtsgericht Stendal HRB 11259\nRegisterbekanntmachung nach dem Umwandlungsgesetz 16.06.2025 (Eintragungsdatum)\n\nBüma Büromaterial Dessau GmbH\nGesellschaft mit beschränkter Haftung\nDessau-Roßlau\n\nNicht eingetragen:\nDen Gläubigern der an der Verschmelzung beteiligten Rechtsträger ist, wenn sie binnen sechs Monaten nach dem Tag, an dem die Eintragung der Verschmelzung nach § 19 Abs. 3 UmwG als bekanntgemacht gilt, ihren Anspruch nach Grund und Höhe schriftlich anmelden, Sicherheit zu leisten, soweit sie nicht Befriedigung verlangen können. Dieses Recht steht ihnen jedoch nur zu, wenn sie glaubhaft machen, dass durch die Verschmelzung die Erfüllung ihrer Forderung gefährdet wird."
    },
    {
      "date": "2025-06-16",
      "id": "112285",
      "original_text": "Registerbekanntmachung nach dem Umwandlungsgesetz\nNordrhein-Westfalen Amtsgericht Coesfeld GsR 377\nGewerbepark Gausepatt 58 eGbR – Dülmen",
      "type": "Registerbekanntmachung nach dem Umwandlungsgesetz",
      "state": "Nordrhein-Westfalen",
      "amtsgericht": "Amtsgericht Coesfeld",
      "registernummer": "GsR 377",
      "registerart": "GsR",
      "company_name": "Gewerbepark Gausepatt 58 eGbR",
      "company_seat": "Dülmen",
      "details": "16.06.2025 (Bekanntmachungsdatum)\n\nNordrhein-Westfalen Amtsgericht Coesfeld GsR 377\nRegisterbekanntmachung nach dem Umwandlungsgesetz 16.06.2025 (Eintragungsdatum)\n\nGewerbepark Gausepatt 58 eGbR\nGesellschaft bürgerlichen Rechts\nDülmen\n\nAls nicht eingetragen wird bekanntgemacht: Den Gläubigern des an dem Formwechsel beteiligten Rechtsträgers ist, wenn sie binnen sechs Monaten nach dem Tag, an dem die Eintragung des Formwechsels in das Register des Sitzes desjenigen Rechtsträgers, dessen Gläubiger sie sind, nach § 19 Absatz 3 UmwG als bekanntgemacht gilt, ihren Anspruch nach Grund und Höhe schriftlich anmelden, Sicherheit zu leisten, soweit sie nicht Befriedigung verlangen können. Dieses Recht steht den Gläubigern jedoch nur zu, wenn sie glaubhaft machen, dass durch den Formwechsel die Erfüllung ihrer Forderung gefährdet wird. Das Recht, Sicherheitsleistung zu verlangen, steht Gläubigern nicht zu, die im Fall des Insolvenzverfahrens ein Recht auf vorzugsweise Befriedigung aus einer Deckungsmasse haben, die nach gesetzlicher Vorschrift zu ihrem Schutz errichtet und staatlich überwacht ist."
    },
    {
      "date": "2025-06-16",
      "id": "112286",
      "original_text": "Registerbekanntmachung nach dem Umwandlungsgesetz\nBaden-Württemberg Amtsgericht Freiburg HRB 471578\nBurda Druck GmbH – Offenburg",
      "type": "Registerbekanntmachung nach dem Umwandlungsgesetz",
      "state": "Baden-Württemberg",
      "amtsgericht": "Amtsgericht Freiburg",
      "registernummer": "HRB 471578",
      "registerart": "HRB",
      "company_name": "Burda Druck GmbH",
      "company_seat": "Offenburg",
      "details": "16.06.2025 (Bekanntmachungsdatum)\n\nBaden-Württemberg Amtsgericht Freiburg HRB 471578\nRegisterbekanntmachung nach dem Umwandlungsgesetz 16.06.2025 (Eintragungsdatum)\n\nBurda Druck GmbH\nGesellschaft mit beschränkter Haftung\nOffenburg\n\nDen Gläubigern der an der Verschmelzung beteiligten Rechtsträger ist, wenn sie binnen sechs Monaten nach dem Tag, an dem die Eintragung der Verschmelzung in das Register des Sitzes desjenigen Rechtsträgers, dessen Gläubiger sie sind, nach § 19 Abs. 3 UmwG als bekanntgemacht gilt, ihren Anspruch nach Grund und Höhe schriftlich anmelden, Sicherheit zu leisten, soweit sie nicht Befriedigung verlangen können. Dieses Recht steht den Gläubigern jedoch nur zu, wenn sie glaubhaft machen, dass durch die Verschmelzung die Erfüllung ihrer Forderung gefährdet wird."
    },
    {
      "date": "2025-06-16",
      "id": "112287",
      "original_text": "Registerbekanntmachung nach dem Umwandlungsgesetz\nBaden-Württemberg Amtsgericht Stuttgart HRB 728421\nFAWAS GmbH SAUBERE GESUNDE LEBENSRÄUME – Dettingen an der Erms",
      "type": "Registerbekanntmachung nach dem Umwandlungsgesetz",
      "state": "Baden-Württemberg",
      "amtsgericht": "Amtsgericht Stuttgart",
      "registernummer": "HRB 728421",
      "registerart": "HRB",
      "company_name": "FAWAS GmbH SAUBERE GESUNDE LEBENSRÄUME",
      "company_seat": "Dettingen an der Erms",
      "details": "16.06.2025 (Bekanntmachungsdatum)\n\nBaden-Württemberg Amtsgericht Stuttgart HRB 728421\nRegisterbekanntmachung nach dem Umwandlungsgesetz 16.06.2025 (Eintragungsdatum)\n\nFAWAS GmbH SAUBERE GESUNDE LEBENSRÄUME\nGesellschaft mit beschränkter Haftung\nDettingen an der Erms\n\nDen Gläubigern dern an der grenzüberschreitenden Verschmelzung beteiligten übernehmenden Rechtsträger ist, wenn sie binnen sechs Monaten nach dem Tag, an dem die Eintragung der Verschmelzung in das Register des Sitzes desjenigen Rechtsträgers, dessen Gläubiger sie sind, nach § 19 Absatz 3 UmwG als bekanntgemacht gilt, ihren Anspruch nach Grund und Höhe schriftlich anmelden, Sicherheit zu leisten, soweit sie nicht Befriedigung verlangen können. Dieses Recht steht den Gläubigern jedoch nur zu, wenn sie glaubhaft machen, dass durch die Verschmelzung die Erfüllung ihrer Forderung gefährdet wird."
    },
    {
      "date": "2025-06-16",
      "id": "112288",
      "original_text": "Löschungsankündigung\nBaden-Württemberg Amtsgericht Stuttgart HRB 23029\nField Packaging Germany GmbH – Obersulm",
      "type": "Löschungsankündigung",
      "state": "Baden-Württemberg",
      "amtsgericht": "Amtsgericht Stuttgart",
      "registernummer": "HRB 23029",
      "registerart": "HRB",
      "company_name": "Field Packaging Germany GmbH",
      "company_seat": "Obersulm",
      "details": "16.06.2025 (Bekanntmachungsdatum)\n\nBaden-Württemberg Amtsgericht Stuttgart HRB 23029\nLöschungsankündigung 16.06.2025 (Eintragungsdatum)\n\nField Packaging Germany GmbH\nGesellschaft mit beschränkter Haftung\nObersulm\n\nDen Gläubigern der an der Verschmelzung beteiligten Rechtsträger ist, wenn sie binnen sechs Monaten nach dem Tag, an dem die Eintragung der Verschmelzung in das Register des Sitzes desjenigen Rechtsträgers, dessen Gläubiger sie sind, nach § 19 Abs. 3 UmwG als bekanntgemacht gilt, ihren Anspruch nach Grund und Höhe schriftlich anmelden, Sicherheit zu leisten, soweit sie nicht Befriedigung verlangen können. Dieses Recht steht den Gläubigern jedoch nur zu, wenn sie glaubhaft machen, dass durch die Verschmelzung die Erfüllung ihrer Forderung gefährdet wird."
    },
    {
      "date": "2025-06-16",
      "id": "112289",
      "original_text": "Registerbekanntmachung nach dem Umwandlungsgesetz\nBrandenburg Amtsgericht Potsdam HRB 23759\nTierbestattungszentrum Tierhimmel GmbH – Teltow",
      "type": "Registerbekanntmachung nach dem Umwandlungsgesetz",
      "state": "Brandenburg",
      "amtsgericht": "Amtsgericht Potsdam",
      "registernummer": "HRB 23759",
      "registerart": "HRB",
      "company_name": "Tierbestattungszentrum Tierhimmel GmbH",
      "company_seat": "Teltow",
      "details": "16.06.2025 (Bekanntmachungsdatum)\n\nBrandenburg Amtsgericht Potsdam HRB 23759\nRegisterbekanntmachung nach dem Umwandlungsgesetz 13.06.2025 (Eintragungsdatum)\n\nTierbestattungszentrum Tierhimmel GmbH\nGesellschaft mit beschränkter Haftung\nTeltow\n\nAls nicht eingetragen wird veröffentlicht:\nDen Gläubigern der an der Verschmelzung beteiligten Rechtsträger ist, wenn sie binnen sechs Monaten nach dem Tag, an dem die Eintragung der Verschmelzung in das Register des Sitzes desjenigen Rechtsträgers, dessen Gläubiger sie sind, als bekannt gemacht gilt, ihren Anspruch nach Grund und Höhe schriftlich anmelden, Sicherheit zu leisten, soweit sie nicht Befriedigung verlangen können. Dieses Recht steht den Gläubigern jedoch nur zu, wenn sie glaubhaft machen, dass durch die Verschmelzung die Erfüllung ihrer Forderung gefährdet wird"
    },
    {
      "date": "2025-06-16",
      "id": "112290",
      "original_text": "Registerbekanntmachung nach dem Umwandlungsgesetz\nBerlin Amtsgericht Berlin (Charlottenburg) HRB 140015\nagile42 International GmbH – Berlin",
      "type": "Registerbekanntmachung nach dem Umwandlungsgesetz",
      "state": "Berlin",
      "amtsgericht": "Amtsgericht Berlin (Charlottenburg)",
      "registernummer": "HRB 140015",
      "registerart": "HRB",
      "company_name": "agile42 International GmbH",
      "company_seat": "Berlin",
      "details": "16.06.2025 (Bekanntmachungsdatum)\n\nBerlin Amtsgericht Berlin (Charlottenburg) HRB 140015\nRegisterbekanntmachung nach dem Umwandlungsgesetz 13.06.2025 (Eintragungsdatum)\n\nagile42 International GmbH\nGesellschaft mit beschränkter Haftung\nBerlin\n\nZu Eintragungsnummer 2 vom 13.06.2025 wird als nicht eingetragen veröffentlicht: Den Gläubigern der an der Verschmelzung beteiligten Rechtsträger ist, wenn sie binnen sechs Monaten nach dem Tag, an dem die Eintragung der Verschmelzung in das Register des Sitzes desjenigen Rechtsträgers, dessen Gläubiger sie sind, als bekannt gemacht gilt, ihren Anspruch nach Grund und Höhe schriftlich anmelden, Sicherheit zu leisten, soweit sie nicht Befriedigung verlangen können. Dieses Recht steht den Gläubigern jedoch nur zu, wenn sie glaubhaft machen, dass durch die Verschmelzung die Erfüllung ihrer Forderung gefährdet wird. Das Recht, Sicherheitsleistung zu verlangen, steht Gläubigern nicht zu, die im Falle der Insolvenz ein Recht auf vorzugsweise Befriedigung aus einer Deckungsmasse haben, die nach gesetzlicher Vorschrift zu ihrem Schutz errichtet und staatlich überwacht ist."
    },
    {
      "date": "2025-06-16",
      "id": "112291",
      "original_text": "Registerbekanntmachung nach dem Umwandlungsgesetz\nBerlin Amtsgericht Berlin (Charlottenburg) HRB 127104\nagile42 Consulting GmbH – Berlin",
      "type": "Registerbekanntmachung nach dem Umwandlungsgesetz",
      "state": "Berlin",
      "amtsgericht": "Amtsgericht Berlin (Charlottenburg)",
      "registernummer": "HRB 127104",
      "registerart": "HRB",
      "company_name": "agile42 Consulting GmbH",
      "company_seat": "Berlin",
      "details": "16.06.2025 (Bekanntmachungsdatum)\n\nBerlin Amtsgericht Berlin (Charlottenburg) HRB 127104\nRegisterbekanntmachung nach dem Umwandlungsgesetz 13.06.2025 (Eintragungsdatum)\n\nagile42 Consulting GmbH\nGesellschaft mit beschränkter Haftung\nBerlin\n\nZu Eintragungsnummer 2 vom 13.06.2025 wird als nicht eingetragen veröffentlicht: Den Gläubigern der an der Verschmelzung beteiligten Rechtsträger ist, wenn sie binnen sechs Monaten nach dem Tag, an dem die Eintragung der Verschmelzung in das Register des Sitzes desjenigen Rechtsträgers, dessen Gläubiger sie sind, als bekannt gemacht gilt, ihren Anspruch nach Grund und Höhe schriftlich anmelden, Sicherheit zu leisten, soweit sie nicht Befriedigung verlangen können. Dieses Recht steht den Gläubigern jedoch nur zu, wenn sie glaubhaft machen, dass durch die Verschmelzung die Erfüllung ihrer Forderung gefährdet wird. Das Recht, Sicherheitsleistung zu verlangen, steht Gläubigern nicht zu, die im Falle der Insolvenz ein Recht auf vorzugsweise Befriedigung aus einer Deckungsmasse haben, die nach gesetzlicher Vorschrift zu ihrem Schutz errichtet und staatlich überwacht ist."
    },
    {
      "date": "2025-06-16",
      "id": "112292",
      "original_text": "Registerbekanntmachung nach dem Umwandlungsgesetz\nBaden-Württemberg Amtsgericht Stuttgart HRB 361064\nFAWAS Handel mit Haustechnik GmbH – Dettingen an der Erms",
      "type": "Registerbekanntmachung nach dem Umwandlungsgesetz",
      "state": "Baden-Württemberg",
      "amtsgericht": "Amtsgericht Stuttgart",
      "registernummer": "HRB 361064",
      "registerart": "HRB",
      "company_name": "FAWAS Handel mit Haustechnik GmbH",
      "company_seat": "Dettingen an der Erms",
      "details": "16.06.2025 (Bekanntmachungsdatum)\n\nBaden-Württemberg Amtsgericht Stuttgart HRB 361064\nRegisterbekanntmachung nach dem Umwandlungsgesetz 16.06.2025 (Eintragungsdatum)\n\nFAWAS Handel mit Haustechnik GmbH\nGesellschaft mit beschränkter Haftung\nDettingen an der Erms\n\nAls nicht eingetragen wird bekanntgemacht:\nDen Gläubigern der an der Verschmelzung beteiligten Rechtsträger ist, wenn sie binnen sechs Monaten nach dem Tag, an dem die Eintragung der Verschmelzung in das Register des Sitzes desjenigen Rechtsträgers, dessen Gläubiger sie sind, nach § 19 Abs. 3 UmwG als bekanntgemacht gilt, ihren Anspruch nach Grund und Höhe schriftlich anmelden, Sicherheit zu leisten, soweit sie nicht Befriedigung verlangen können. Dieses Recht steht den Gläubigern jedoch nur zu, wenn sie glaubhaft machen, dass durch die Verschmelzung die Erfüllung ihrer Forderung gefährdet wird.\nDen Gläubigern dern an der grenzüberschreitenden Verschmelzung beteiligten übernehmenden Rechtsträger ist, wenn sie binnen sechs Monaten nach dem Tag, an dem die Eintragung der Verschmelzung in das Register des Sitzes desjenigen Rechtsträgers, dessen Gläubiger sie sind, nach § 19 Absatz 3 UmwG als bekanntgemacht gilt, ihren Anspruch nach Grund und Höhe schriftlich anmelden, Sicherheit zu leisten, soweit sie nicht Befriedigung verlangen können. Dieses Recht steht den Gläubigern jedoch nur zu, wenn sie glaubhaft machen, dass durch die Verschmelzung die Erfüllung ihrer Forderung gefährdet wird."
    },
    {
      "date": "2025-06-16",
      "id": "112293",
      "original_text": "Registerbekanntmachung nach dem Umwandlungsgesetz\nBaden-Württemberg Amtsgericht Stuttgart HRB 20165\nFichtner Solar GmbH – Stuttgart",
      "type": "Registerbekanntmachung nach dem Umwandlungsgesetz",
      "state": "Baden-Württemberg",
      "amtsgericht": "Amtsgericht Stuttgart",
      "registernummer": "HRB 20165",
      "registerart": "HRB",
      "company_name": "Fichtner Solar GmbH",
      "company_seat": "Stuttgart",
      "details": "16.06.2025 (Bekanntmachungsdatum)\n\nBaden-Württemberg Amtsgericht Stuttgart HRB 20165\nRegisterbekanntmachung nach dem Umwandlungsgesetz 16.06.2025 (Eintragungsdatum)\n\nFichtner Solar GmbH\nGesellschaft mit beschränkter Haftung\nStuttgart\n\nAls nicht eingetragen wird bekanntgemacht:\nDen Gläubigern der an der Verschmelzung beteiligten Rechtsträger ist, wenn sie binnen sechs Monaten nach dem Tag, an dem die Eintragung der Verschmelzung in das Register des Sitzes desjenigen Rechtsträgers, dessen Gläubiger sie sind, nach § 19 Abs. 3 UmwG als bekanntgemacht gilt, ihren Anspruch nach Grund und Höhe schriftlich anmelden, Sicherheit zu leisten, soweit sie nicht Befriedigung verlangen können. Dieses Recht steht den Gläubigern jedoch nur zu, wenn sie glaubhaft machen, dass durch die Verschmelzung die Erfüllung ihrer Forderung gefährdet wird."
    },
    {
      "date": "2025-06-16",
      "id": "112294",
      "original_text": "Löschungsankündigung\nBaden-Württemberg Amtsgericht Mannheim HRB 734088\nFortius Finance GmbH – Brühl",
      "type": "Löschungsankündigung",
      "state": "Baden-Württemberg",
      "amtsgericht": "Amtsgericht Mannheim",
      "registernummer": "HRB 734088",
      "registerart": "HRB",
      "company_name": "Fortius Finance GmbH",
      "company_seat": "Brühl",
      "details": "16.06.2025 (Bekanntmachungsdatum)\n\nBaden-Württemberg Amtsgericht Mannheim HRB 734088\nLöschungsankündigung\n\nFortius Finance GmbH\nGesellschaft mit beschränkter Haftung\nBrühl\n\nDas Gericht beabsichtigt, die Gesellschaft wegen Vermögenslosigkeit im Handelsregister von Amts wegen nach § 394 FamFG zu löschen. Die Frist zur Geltendmachung eines Widerspruchs gegen die beabsichtigte Löschung ist auf einen Monat ab Veröffentlichung bestimmt."
    },
    {
      "date": "2025-06-16",
      "id": "112295",
      "original_text": "Einreichung neuer Dokumente\nBaden-Württemberg Amtsgericht Ulm HRB 3863\nSWU Verkehr GmbH – Ulm",
      "type": "Einreichung neuer Dokumente",
      "state": "Baden-Württemberg",
      "amtsgericht": "Amtsgericht Ulm",
      "registernummer": "HRB 3863",
      "registerart": "HRB",
      "company_name": "SWU Verkehr GmbH",
      "company_seat": "Ulm",
      "details": "16.06.2025 (Bekanntmachungsdatum)\n\nBaden-Württemberg Amtsgericht Ulm HRB 3863\nEinreichung neuer Dokumente\n\nSWU Verkehr GmbH\nGesellschaft mit beschränkter Haftung\nUlm\n\nDie Gesellschaft hat am 13.06.2025 die Liste über die Zusammensetzung des Aufsichtsrats zum Handelsregister eingereicht."
    },
    {
      "date": "2025-06-16",
      "id": "112296",
      "original_text": "Löschungsankündigung\nMecklenburg-Vorpommern Amtsgericht Stralsund HRA 2399\nProra Projektentwicklungs GmbH & Co. Haus Kiel KG – Buschvitz",
      "type": "Löschungsankündigung",
      "state": "Mecklenburg-Vorpommern",
      "amtsgericht": "Amtsgericht Stralsund",
      "registernummer": "HRA 2399",
      "registerart": "HRA",
      "company_name": "Prora Projektentwicklungs GmbH & Co. Haus Kiel KG",
      "company_seat": "Buschvitz",
      "details": "16.06.2025 (Bekanntmachungsdatum)\n\nMecklenburg-Vorpommern Amtsgericht Stralsund HRA 2399\nLöschungsankündigung\n\nProra Projektentwicklungs GmbH & Co. Haus Kiel KG\nKommanditgesellschaft\nBuschvitz\n\nDas Registergericht beabsichtigt, die im Handelsregister eingetragene Firma von Amts wegen nach § 31 Abs.2 HGB zu löschen. Die Frist zur Erhebung eines Widerspruchs gegen die beabsichtigte Löschung ist auf 1 Monat festgesetzt."
    },
    {
      "date": "2025-06-16",
      "id": "112297",
      "original_text": "Löschungsankündigung\nMecklenburg-Vorpommern Amtsgericht Schwerin HRB 10561\nAlpha-Metall-Laser- & Umwelttechnik GmbH – Hagenow",
      "type": "Löschungsankündigung",
      "state": "Mecklenburg-Vorpommern",
      "amtsgericht": "Amtsgericht Schwerin",
      "registernummer": "HRB 10561",
      "registerart": "HRB",
      "company_name": "Alpha-Metall-Laser- & Umwelttechnik GmbH",
      "company_seat": "Hagenow",
      "details": "16.06.2025 (Bekanntmachungsdatum)\n\nMecklenburg-Vorpommern Amtsgericht Schwerin HRB 10561\nLöschungsankündigung\n\nAlpha-Metall-Laser- & Umwelttechnik GmbH\nGesellschaft mit beschränkter Haftung\nHagenow\n\nDas Registergericht beabsichtigt, die im Handelsregister eingetragene Gesellschaft von Amts wegen nach § 394 FamFG zu löschen. Die Frist zur Erhebung eines Widerspruchs gegen die beabsichtigte Löschung wird auf 1 Monat festgesetzt."
    },
    {
      "date": "2025-06-16",
      "id": "112298",
      "original_text": "Sonstige Registerbekanntmachung\nBrandenburg Amtsgericht Cottbus HRB 14290\nHDL Management und Verwaltung UG (haftungsbeschränkt) – Lieberose",
      "type": "Sonstige Registerbekanntmachung",
      "state": "Brandenburg",
      "amtsgericht": "Amtsgericht Cottbus",
      "registernummer": "HRB 14290",
      "registerart": "HRB",
      "company_name": "HDL Management und Verwaltung UG (haftungsbeschränkt)",
      "company_seat": "Lieberose",
      "details": "16.06.2025 (Bekanntmachungsdatum)\n\nBrandenburg Amtsgericht Cottbus HRB 14290\nSonstige Registerbekanntmachung 13.06.2025 (Eintragungsdatum)\n\nHDL Management und Verwaltung UG (haftungsbeschränkt)\nGesellschaft mit beschränkter Haftung\nLieberose\n\nAls nicht eingetragen wird veröffentlicht: Offentliche Bekanntmachung: Die Gesellschaft ist durch Abweisung des Antrages auf Eröffnung des Insolvenzverfahrens mangels Masse aufgelöst"
    },
    {
      "date": "2025-06-16",
      "id": "112299",
      "original_text": "Löschungsankündigung\nSachsen Amtsgericht Dresden HRB 37889\nRW Capital GmbH – Bautzen",
      "type": "Löschungsankündigung",
      "state": "Sachsen",
      "amtsgericht": "Amtsgericht Dresden",
      "registernummer": "HRB 37889",
      "registerart": "HRB",
      "company_name": "RW Capital GmbH",
      "company_seat": "Bautzen",
      "details": "16.06.2025 (Bekanntmachungsdatum)\n\nSachsen Amtsgericht Dresden HRB 37889\nLöschungsankündigung\n\nRW Capital GmbH\nGesellschaft mit beschränkter Haftung\nBautzen\n\nDas Registergericht beabsichtigt, die im Handelsregister eingetragene Gesellschaft von Amts wegen nach § 394 FamFG zu löschen. Die Frist zu Erhebung eines Widerspruchs gegen die beabsichtigte Löschung wird auf einen Monat festgesetzt."
    },
    {
      "date": "2025-06-16",
      "id": "112300",
      "original_text": "Registerbekanntmachung nach dem Umwandlungsgesetz\nSachsen Amtsgericht Leipzig HRB 37921\nHS Nord GmbH – Delitzsch",
      "type": "Registerbekanntmachung nach dem Umwandlungsgesetz",
      "state": "Sachsen",
      "amtsgericht": "Amtsgericht Leipzig",
      "registernummer": "HRB 37921",
      "registerart": "HRB",
      "company_name": "HS Nord GmbH",
      "company_seat": "Delitzsch",
      "details": "16.06.2025 (Bekanntmachungsdatum)\n\nSachsen Amtsgericht Leipzig HRB 37921\nRegisterbekanntmachung nach dem Umwandlungsgesetz 16.06.2025 (Eintragungsdatum)\n\nHS Nord GmbH\nGesellschaft mit beschränkter Haftung\nDelitzsch\n\nDen Gläubigern der an der Verschmelzung beteiligten Rechtsträger ist, wenn sie binnen sechs Monaten nach dem Tag, an dem die Eintragung der Verschmelzung in das Register des Sitzes desjenigen Rechtsträgers, dessen Gläubiger sie sind, nach § 19 Abs. 3 UmwG als bekannt gemacht gilt, ihren Anspruch nach Grund und Höhe in Textform anmelden, Sicherheit zu leisten, soweit sie nicht Befriedigung verlangen können. Dieses Recht steht den Gläubigern jedoch nur zu, wenn sie glaubhaft machen, dass durch die Verschmelzung die Erfüllung der Forderung gefährdet wird."
    },
    {
      "date": "2025-06-16",
      "id": "112301",
      "original_text": "Registerbekanntmachung nach dem Umwandlungsgesetz\nSachsen Amtsgericht Leipzig HRB 28825\nK.M.A. GmbH – Delitzsch",
      "type": "Registerbekanntmachung nach dem Umwandlungsgesetz",
      "state": "Sachsen",
      "amtsgericht": "Amtsgericht Leipzig",
      "registernummer": "HRB 28825",
      "registerart": "HRB",
      "company_name": "K.M.A. GmbH",
      "company_seat": "Delitzsch",
      "details": "16.06.2025 (Bekanntmachungsdatum)\n\nSachsen Amtsgericht Leipzig HRB 28825\nRegisterbekanntmachung nach dem Umwandlungsgesetz 16.06.2025 (Eintragungsdatum)\n\nK.M.A. GmbH\nGesellschaft mit beschränkter Haftung\nDelitzsch\n\nDen Gläubigern der an der Verschmelzung beteiligten Rechtsträger ist, wenn sie binnen sechs Monaten nach dem Tag, an dem die Eintragung der Verschmelzung in das Register des Sitzes desjenigen Rechtsträgers, dessen Gläubiger sie sind, nach § 19 Abs. 3 UmwG als bekannt gemacht gilt, ihren Anspruch nach Grund und Höhe in Textform anmelden, Sicherheit zu leisten, soweit sie nicht Befriedigung verlangen können. Dieses Recht steht den Gläubigern jedoch nur zu, wenn sie glaubhaft machen, dass durch die Verschmelzung die Erfüllung der Forderung gefährdet wird."
    },
    {
      "date": "2025-06-16",
      "id": "112302",
      "original_text": "Löschungsankündigung\nNiedersachsen Amtsgericht Hannover HRB 213235\nWeltspiele GmbH – Hannover",
      "type": "Löschungsankündigung",
      "state": "Niedersachsen",
      "amtsgericht": "Amtsgericht Hannover",
      "registernummer": "HRB 213235",
      "registerart": "HRB",
      "company_name": "Weltspiele GmbH",
      "company_seat": "Hannover",
      "details": "16.06.2025 (Bekanntmachungsdatum)\n\nNiedersachsen Amtsgericht Hannover HRB 213235\nLöschungsankündigung\n\nWeltspiele GmbH\nGesellschaft mit beschränkter Haftung\nHannover\n\nDas Registergericht beabsichtigt, den Geschäftsführer der Gesellschaft von Amts wegen nach § 395 FamFG i.V.m. § 6 Abs. 2 GmbHG zu löschen. Die Frist zur Erhebung eines Widerspruchs ist auf 1 Monat ab dieser Registerbekanntmachung festgesetzt."
    },
    {
      "date": "2025-06-16",
      "id": "112303",
      "original_text": "Löschungsankündigung\nNiedersachsen Amtsgericht Stadthagen HRB 2754\nBöttcher Kälte - Klimatechnik GmbH – Bad Nenndorf",
      "type": "Löschungsankündigung",
      "state": "Niedersachsen",
      "amtsgericht": "Amtsgericht Stadthagen",
      "registernummer": "HRB 2754",
      "registerart": "HRB",
      "company_name": "Böttcher Kälte - Klimatechnik GmbH",
      "company_seat": "Bad Nenndorf",
      "details": "16.06.2025 (Bekanntmachungsdatum)\n\nNiedersachsen Amtsgericht Stadthagen HRB 2754\nLöschungsankündigung\n\nBöttcher Kälte - Klimatechnik GmbH\nGesellschaft mit beschränkter Haftung\nBad Nenndorf\n\nDas Registergericht beabsichtigt, die Gesellschaft von Amts wegen nach § 394 FamFG zu löschen. Die Frist zur Erhebung eines Widerspruchs ist auf 1 Monat ab dieser Registerbekanntmachung festgesetzt."
    },
    {
      "date": "2025-06-16",
      "id": "112304",
      "original_text": "Einreichung neuer Dokumente\nNiedersachsen Amtsgericht Osnabrück HRB 215074\nGYeR AG – Bad Bentheim",
      "type": "Einreichung neuer Dokumente",
      "state": "Niedersachsen",
      "amtsgericht": "Amtsgericht Osnabrück",
      "registernummer": "HRB 215074",
      "registerart": "HRB",
      "company_name": "GYeR AG",
      "company_seat": "Bad Bentheim",
      "details": "16.06.2025 (Bekanntmachungsdatum)\n\nNiedersachsen Amtsgericht Osnabrück HRB 215074\nEinreichung neuer Dokumente\n\nGYeR AG\nAktiengesellschaft\nBad Bentheim\n\nDie Liste der Mitglieder des Aufsichtsrats wurde beim Registergericht eingereicht."
    },
    {
      "date": "2025-06-16",
      "id": "112305",
      "original_text": "Sonstige Registerbekanntmachung\nNiedersachsen Amtsgericht Hildesheim HRB 110356 früher Amtsgericht Alfeld\nSappi Alfeld GmbH – Alfeld (Leine)",
      "type": "Sonstige Registerbekanntmachung",
      "state": "Niedersachsen",
      "amtsgericht": "Amtsgericht Hildesheim",
      "registernummer": "HRB 110356",
      "registerart": "HRB",
      "company_name": "Sappi Alfeld GmbH",
      "company_seat": "Alfeld (Leine)",
      "former_amtsgericht": "Alfeld",
      "details": "16.06.2025 (Bekanntmachungsdatum)\n\nNiedersachsen Amtsgericht Hildesheim HRB 110356 früher Amtsgericht Alfeld\nSonstige Registerbekanntmachung\n\nSappi Alfeld GmbH\nGesellschaft mit beschränkter Haftung\nAlfeld (Leine)\n\nDie Liste der Mitglieder des Aufsichtsrats wurde beim Registergericht eingereicht."
    },
    {
      "date": "2025-06-16",
      "id": "112306",
      "original_text": "Einreichung neuer Dokumente\nNiedersachsen Amtsgericht Stadthagen HRB 201482\nTWW plus - REISE & SERVICE GmbH – Rinteln",
      "type": "Einreichung neuer Dokumente",
      "state": "Niedersachsen",
      "amtsgericht": "Amtsgericht Stadthagen",
      "registernummer": "HRB 201482",
      "registerart": "HRB",
      "company_name": "TWW plus - REISE & SERVICE GmbH",
      "company_seat": "Rinteln",
      "details": "16.06.2025 (Bekanntmachungsdatum)\n\nNiedersachsen Amtsgericht Stadthagen HRB 201482\nEinreichung neuer Dokumente 30.05.2025 (Eintragungsdatum)\n\nTWW plus - REISE & SERVICE GmbH\nGesellschaft mit beschränkter Haftung\nRinteln\n\nDie Listen der Mitglieder des Aufsichtsrats wurde beim Registergericht eingereicht."
    },
    {
      "date": "2025-06-16",
      "id": "112307",
      "original_text": "Löschungsankündigung\nNiedersachsen Amtsgericht Hildesheim HRB 3302\nRITTER GmbH Anlagen für Prozesstechnik – Hildesheim",
      "type": "Löschungsankündigung",
      "state": "Niedersachsen",
      "amtsgericht": "Amtsgericht Hildesheim",
      "registernummer": "HRB 3302",
      "registerart": "HRB",
      "company_name": "RITTER GmbH Anlagen für Prozesstechnik",
      "company_seat": "Hildesheim",
      "details": "16.06.2025 (Bekanntmachungsdatum)\n\nNiedersachsen Amtsgericht Hildesheim HRB 3302\nLöschungsankündigung\n\nRITTER GmbH Anlagen für Prozesstechnik\nGesellschaft mit beschränkter Haftung\nHildesheim\n\nDas Registergericht beabsichtigt, die Gesellschaft von Amts wegen nach § 394 FamFG zu löschen. Die Frist zur Erhebung eines Widerspruchs ist auf 1 Monat ab dieser Registerbekanntmachung festgesetzt."
    },
    {
      "date": "2025-06-16",
      "id": "112308",
      "original_text": "Löschungsankündigung\nNiedersachsen Amtsgericht Walsrode HRB 111054\nWir Könnens GmbH – Stuhr",
      "type": "Löschungsankündigung",
      "state": "Niedersachsen",
      "amtsgericht": "Amtsgericht Walsrode",
      "registernummer": "HRB 111054",
      "registerart": "HRB",
      "company_name": "Wir Könnens GmbH",
      "company_seat": "Stuhr",
      "details": "16.06.2025 (Bekanntmachungsdatum)\n\nNiedersachsen Amtsgericht Walsrode HRB 111054\nLöschungsankündigung\n\nWir Könnens GmbH\nGesellschaft mit beschränkter Haftung\nStuhr\n\nDas Registergericht beabsichtigt, die Gesellschaft von Amts wegen nach § 394 FamFG zu löschen. Die Frist zur Erhebung eines Widerspruchs ist auf 3 Monate ab dieser Registerbekanntmachung festgesetzt."
    },
    {
      "date": "2025-06-16",
      "id": "112309",
      "original_text": "Registerbekanntmachung nach dem Umwandlungsgesetz\nNiedersachsen Amtsgericht Walsrode HRA 205316\nDoIT IT-Service - Inh. Oliver Beta e. K. – Verden (Aller)",
      "type": "Registerbekanntmachung nach dem Umwandlungsgesetz",
      "state": "Niedersachsen",
      "amtsgericht": "Amtsgericht Walsrode",
      "registernummer": "HRA 205316",
      "registerart": "HRA",
      "company_name": "DoIT IT-Service - Inh. Oliver Beta e. K.",
      "company_seat": "Verden (Aller)",
      "details": "16.06.2025 (Bekanntmachungsdatum)\n\nNiedersachsen Amtsgericht Walsrode HRA 205316\nRegisterbekanntmachung nach dem Umwandlungsgesetz 16.06.2025 (Eintragungsdatum)\n\nDoIT IT-Service - Inh. Oliver Beta e. K.\nEinzelkaufmann / Einzelkauffrau\nVerden (Aller)\n\nDen Gläubigern der an der Ausgliederung beteiligten Rechtsträger ist, wenn sie binnen sechs Monaten nach dem Tag, an dem die Eintragung der Ausgliederung in das Register des Sitzes desjenigen Rechtsträgers, dessen Gläubiger sie sind, nach § 19 Abs. 3 UmwG als bekannt gemacht gilt, ihren Anspruch nach Grund und Höhe schriftlich anmelden, Sicherheit zu leisten, soweit sie nicht Befriedigung verlangen können. Dieses Recht steht den Gläubigern jedoch nur zu, wenn sie glaubhaft machen, dass durch die Ausgliederung die Erfüllung der Forderung gefährdet wird."
    },
    {
      "date": "2025-06-16",
      "id": "112310",
      "original_text": "Löschungsankündigung\nRheinland-Pfalz Amtsgericht Mainz HRB 50242\nSAS GmbH Schweißtechnik – Worms",
      "type": "Löschungsankündigung",
      "state": "Rheinland-Pfalz",
      "amtsgericht": "Amtsgericht Mainz",
      "registernummer": "HRB 50242",
      "registerart": "HRB",
      "company_name": "SAS GmbH Schweißtechnik",
      "company_seat": "Worms",
      "details": "16.06.2025 (Bekanntmachungsdatum)\n\nRheinland-Pfalz Amtsgericht Mainz HRB 50242\nLöschungsankündigung\n\nSAS GmbH Schweißtechnik\nGesellschaft mit beschränkter Haftung\nWorms\n\nDas Registergericht beabsichtigt die Gesellschaft von Amts wegen nach § 394 FamFG zu löschen. Die Frist zur Erhebung eines Widerspruchs ist auf einen Monat festgesetzt."
    },
    {
      "date": "2025-06-16",
      "id": "112311",
      "original_text": "Einreichung neuer Dokumente\nRheinland-Pfalz Amtsgericht Ludwigshafen a.Rhein (Ludwigshafen) HRB 1312\nBASF Wohnen + Bauen GmbH – Ludwigshafen am Rhein",
      "type": "Einreichung neuer Dokumente",
      "state": "Rheinland-Pfalz",
      "amtsgericht": "Amtsgericht Ludwigshafen a.Rhein (Ludwigshafen)",
      "registernummer": "HRB 1312",
      "registerart": "HRB",
      "company_name": "BASF Wohnen + Bauen GmbH",
      "company_seat": "Ludwigshafen am Rhein",
      "details": "16.06.2025 (Bekanntmachungsdatum)\n\nRheinland-Pfalz Amtsgericht Ludwigshafen a.Rhein (Ludwigshafen) HRB 1312\nEinreichung neuer Dokumente\n\nBASF Wohnen + Bauen GmbH\nGesellschaft mit beschränkter Haftung\nLudwigshafen am Rhein\n\nDem Registergericht ist eine neue Liste der Mitglieder des Aufsichtsrates eingereicht worden."
    },
    {
      "date": "2025-06-16",
      "id": "112312",
      "original_text": "Einreichung neuer Dokumente\nNordrhein-Westfalen Amtsgericht Düsseldorf HRB 101442\nKonecranes Holding GmbH – Düsseldorf",
      "type": "Einreichung neuer Dokumente",
      "state": "Nordrhein-Westfalen",
      "amtsgericht": "Amtsgericht Düsseldorf",
      "registernummer": "HRB 101442",
      "registerart": "HRB",
      "company_name": "Konecranes Holding GmbH",
      "company_seat": "Düsseldorf",
      "details": "16.06.2025 (Bekanntmachungsdatum)\n\nNordrhein-Westfalen Amtsgericht Düsseldorf HRB 101442\nEinreichung neuer Dokumente\n\nKonecranes Holding GmbH\nGesellschaft mit beschränkter Haftung\nDüsseldorf\n\nDem Registergericht ist eine Liste der Mitglieder des Aufsichtsrates eingereicht worden."
    },
    {
      "date": "2025-06-16",
      "id": "112313",
      "original_text": "Registerbekanntmachung nach dem Umwandlungsgesetz\nNordrhein-Westfalen Amtsgericht Bonn HRB 23900\nMedizinisches Versorgungszentrum R(h)einzahn am Friedensplatz MVZ GmbH – Bonn",
      "type": "Registerbekanntmachung nach dem Umwandlungsgesetz",
      "state": "Nordrhein-Westfalen",
      "amtsgericht": "Amtsgericht Bonn",
      "registernummer": "HRB 23900",
      "registerart": "HRB",
      "company_name": "Medizinisches Versorgungszentrum R(h)einzahn am Friedensplatz MVZ GmbH",
      "company_seat": "Bonn",
      "details": "16.06.2025 (Bekanntmachungsdatum)\n\nNordrhein-Westfalen Amtsgericht Bonn HRB 23900\nRegisterbekanntmachung nach dem Umwandlungsgesetz 16.06.2025 (Eintragungsdatum)\n\nMedizinisches Versorgungszentrum R(h)einzahn am Friedensplatz MVZ GmbH\nGesellschaft mit beschränkter Haftung\nBonn\n\nDen Gläubigern der an der Verschmelzung beteiligten Rechtsträger ist, wenn sie binnen sechs Monaten nach dem Tag, an dem die Eintragung der Verschmelzung in das Register des Sitzes desjenigen Rechtsträgers, dessen Gläubiger sie sind, nach § 19 Absatz 3 UmwG als bekanntgemacht gilt, ihren Anspruch nach Grund und Höhe schriftlich anmelden, Sicherheit zu leisten, soweit sie nicht Befriedigung verlangen können. Dieses Recht steht den Gläubigern jedoch nur zu, wenn sie glaubhaft machen, dass durch die Verschmelzung die Erfüllung ihrer Forderung gefährdet wird."
    },
    {
      "date": "2025-06-16",
      "id": "112314",
      "original_text": "Registerbekanntmachung nach dem Umwandlungsgesetz\nBremen Amtsgericht Bremen HRB 41559\nLinnemann Invest GmbH – Bremen",
      "type": "Registerbekanntmachung nach dem Umwandlungsgesetz",
      "state": "Bremen",
      "amtsgericht": "Amtsgericht Bremen",
      "registernummer": "HRB 41559",
      "registerart": "HRB",
      "company_name": "Linnemann Invest GmbH",
      "company_seat": "Bremen",
      "details": "16.06.2025 (Bekanntmachungsdatum)\n\nBremen Amtsgericht Bremen HRB 41559\nRegisterbekanntmachung nach dem Umwandlungsgesetz 13.06.2025 (Eintragungsdatum)\n\nLinnemann Invest GmbH\nGesellschaft mit beschränkter Haftung\nBremen\n\nZu Eintragungsnummer 1 vom 13.06.2025 wird als nicht eingetragen veröffentlicht:\nDen Gläubigern der an der Spaltung beteiligten Rechtsträger ist, wenn sie binnen sechs Monaten nach dem Tag, an dem die Eintragung der Spaltung in das Register des Sitzes desjenigen Rechtsträgers, dessen Gläubiger sie sind, als bekannt gemacht gilt, ihren Anspruch nach Grund und Höhe schriftlich anmelden, Sicherheit zu leisten, soweit sie nicht Befriedigung verlangen können. Dieses Recht steht den Gläubigern jedoch nur zu, wenn sie glaubhaft machen, dass durch die Spaltung die Erfüllung ihrer Forderung gefährdet wird. Das Recht, Sicherheitsleistung zu verlangen, steht Gläubigern nicht zu, die im Falle der Insolvenz ein Recht auf vorzugsweise Befriedigung aus einer Deckungsmasse haben, die nach gesetzlicher Vorschrift zu ihrem Schutz errichtet und staatlich überwacht ist."
    },
    {
      "date": "2025-06-16",
      "id": "112315",
      "original_text": "Registerbekanntmachung nach dem Umwandlungsgesetz\nBremen Amtsgericht Bremen HRB 21179\nJustus Grosse Projektentwicklung GmbH – Bremen",
      "type": "Registerbekanntmachung nach dem Umwandlungsgesetz",
      "state": "Bremen",
      "amtsgericht": "Amtsgericht Bremen",
      "registernummer": "HRB 21179",
      "registerart": "HRB",
      "company_name": "Justus Grosse Projektentwicklung GmbH",
      "company_seat": "Bremen",
      "details": "16.06.2025 (Bekanntmachungsdatum)\n\nBremen Amtsgericht Bremen HRB 21179\nRegisterbekanntmachung nach dem Umwandlungsgesetz 13.06.2025 (Eintragungsdatum)\n\nJustus Grosse Projektentwicklung GmbH\nGesellschaft mit beschränkter Haftung\nBremen\n\nAls nicht eingetragen wird veröffentlicht: Den Gläubigern der an der Spaltung beteiligten Rechtsträger ist, wenn sie binnen sechs Monaten nach dem Tag, an dem die Eintragung der Spaltung in das Register des Sitzes desjenigen Rechtsträgers, dessen Gläubiger sie sind, als bekannt gemacht gilt, ihren Anspruch nach Grund und Höhe schriftlich anmelden, Sicherheit zu leisten, soweit sie nicht Befriedigung verlangen können. Dieses Recht steht den Gläubigern jedoch nur zu, wenn sie glaubhaft machen, dass durch die Spaltung die Erfüllung ihrer Forderung gefährdet wird. Das Recht, Sicherheitsleistung zu verlangen, steht Gläubigern nicht zu, die im Falle der Insolvenz ein Recht auf vorzugsweise Befriedigung aus einer Deckungsmasse haben, die nach gesetzlicher Vorschrift zu ihrem Schutz errichtet und staatlich überwacht ist."
    },
    {
      "date": "2025-06-16",
      "id": "112316",
      "original_text": "Registerbekanntmachung nach dem Umwandlungsgesetz\nNordrhein-Westfalen Amtsgericht Düsseldorf HRB 59647\nbeauty & nature München GmbH – Hilden",
      "type": "Registerbekanntmachung nach dem Umwandlungsgesetz",
      "state": "Nordrhein-Westfalen",
      "amtsgericht": "Amtsgericht Düsseldorf",
      "registernummer": "HRB 59647",
      "registerart": "HRB",
      "company_name": "beauty & nature München GmbH",
      "company_seat": "Hilden",
      "details": "16.06.2025 (Bekanntmachungsdatum)\n\nNordrhein-Westfalen Amtsgericht Düsseldorf HRB 59647\nRegisterbekanntmachung nach dem Umwandlungsgesetz 16.06.2025 (Eintragungsdatum)\n\nbeauty & nature München GmbH\nGesellschaft mit beschränkter Haftung\nHilden\n\nDen Gläubigern der an der Verschmelzung beteiligten Rechtsträger ist, wenn sie binnen sechs Monaten nach dem Tag, an dem die Eintragung der Verschmelzung in das Register des Sitzes desjenigen Rechtsträgers, dessen Gläubiger sie sind, nach § 19 Absatz 3 UmwG als bekanntgemacht gilt, ihren Anspruch nach Grund und Höhe schriftlich anmelden, Sicherheit zu leisten, soweit sie nicht Befriedigung verlangen können. Dieses Recht steht den Gläubigern jedoch nur zu, wenn sie glaubhaft machen, dass durch die Verschmelzung die Erfüllung ihrer Forderung gefährdet wird."
    },
    {
      "date": "2025-06-16",
      "id": "112317",
      "original_text": "Registerbekanntmachung nach dem Umwandlungsgesetz\nNordrhein-Westfalen Amtsgericht Bonn HRB 6792\nDeutsche Post AG – Bonn",
      "type": "Registerbekanntmachung nach dem Umwandlungsgesetz",
      "state": "Nordrhein-Westfalen",
      "amtsgericht": "Amtsgericht Bonn",
      "registernummer": "HRB 6792",
      "registerart": "HRB",
      "company_name": "Deutsche Post AG",
      "company_seat": "Bonn",
      "details": "16.06.2025 (Bekanntmachungsdatum)\n\nNordrhein-Westfalen Amtsgericht Bonn HRB 6792\nRegisterbekanntmachung nach dem Umwandlungsgesetz 16.06.2025 (Eintragungsdatum)\n\nDeutsche Post AG\nAktiengesellschaft\nBonn\n\nDen Gläubigern der an der Verschmelzung beteiligten Rechtsträger ist, wenn sie binnen sechs Monaten nach dem Tag, an dem die Eintragung der Verschmelzung in das Register des Sitzes desjenigen Rechtsträgers, dessen Gläubiger sie sind, nach § 19 Absatz 3 UmwG als bekanntgemacht gilt, ihren Anspruch nach Grund und Höhe schriftlich anmelden, Sicherheit zu leisten, soweit sie nicht Befriedigung verlangen können. Dieses Recht steht den Gläubigern jedoch nur zu, wenn sie glaubhaft machen, dass durch die Verschmelzung die Erfüllung ihrer Forderung gefährdet wird."
    },
    {
      "date": "2025-06-16",
      "id": "112318",
      "original_text": "Registerbekanntmachung nach dem Umwandlungsgesetz\nNordrhein-Westfalen Amtsgericht Essen HRA 11859\nOptik & Akustik Klötgen oHG – Essen",
      "type": "Registerbekanntmachung nach dem Umwandlungsgesetz",
      "state": "Nordrhein-Westfalen",
      "amtsgericht": "Amtsgericht Essen",
      "registernummer": "HRA 11859",
      "registerart": "HRA",
      "company_name": "Optik & Akustik Klötgen oHG",
      "company_seat": "Essen",
      "details": "16.06.2025 (Bekanntmachungsdatum)\n\nNordrhein-Westfalen Amtsgericht Essen HRA 11859\nRegisterbekanntmachung nach dem Umwandlungsgesetz 16.06.2025 (Eintragungsdatum)\n\nOptik & Akustik Klötgen oHG\nOffene Handelsgesellschaft\nEssen\n\nDen Gläubigern der an der Ausgliederung beteiligten Rechtsträger ist, wenn sie binnen sechs Monaten nach dem Tag, an dem die Eintragung der Ausgliederung in das Register des Sitzes desjenigen Rechtsträgers, dessen Gläubiger sie sind, nach § 19 Absatz 3 UmwG als bekanntgemacht gilt, ihren Anspruch nach Grund und Höhe schriftlich anmelden, Sicherheit zu leisten, soweit sie nicht Befriedigung verlangen können. Dieses Recht steht den Gläubigern jedoch nur zu, wenn sie glaubhaft machen, dass durch die Ausgliederung die Erfüllung ihrer Forderung gefährdet wird."
    },
    {
      "date": "2025-06-16",
      "id": "112319",
      "original_text": "Einreichung neuer Dokumente\nNordrhein-Westfalen Amtsgericht Köln HRB 24806\nDEVK Krankenversicherungs-Aktiengesellschaft – Köln",
      "type": "Einreichung neuer Dokumente",
      "state": "Nordrhein-Westfalen",
      "amtsgericht": "Amtsgericht Köln",
      "registernummer": "HRB 24806",
      "registerart": "HRB",
      "company_name": "DEVK Krankenversicherungs-Aktiengesellschaft",
      "company_seat": "Köln",
      "details": "16.06.2025 (Bekanntmachungsdatum)\n\nNordrhein-Westfalen Amtsgericht Köln HRB 24806\nEinreichung neuer Dokumente\n\nDEVK Krankenversicherungs-Aktiengesellschaft\nAktiengesellschaft\nKöln\n\nDem Registergericht ist eine Liste der Mitglieder des Aufsichtsrates eingereicht worden."
    },
    {
      "date": "2025-06-16",
      "id": "112320",
      "original_text": "Löschungsankündigung\nNordrhein-Westfalen Amtsgericht Düsseldorf HRB 73046\nSinclair & Spark GmbH – Düsseldorf",
      "type": "Löschungsankündigung",
      "state": "Nordrhein-Westfalen",
      "amtsgericht": "Amtsgericht Düsseldorf",
      "registernummer": "HRB 73046",
      "registerart": "HRB",
      "company_name": "Sinclair & Spark GmbH",
      "company_seat": "Düsseldorf",
      "details": "16.06.2025 (Bekanntmachungsdatum)\n\nNordrhein-Westfalen Amtsgericht Düsseldorf HRB 73046\nLöschungsankündigung\n\nSinclair & Spark GmbH\nGesellschaft mit beschränkter Haftung\nDüsseldorf\n\nDas Registergericht beabsichtigt die Gesellschaft von Amts wegen nach § 394 Abs. 1 FamFG zu löschen. Die Frist zur Erhebung eines Widerspruchs ist auf einen Monat festgesetzt.\n\nRechtsbehelfsbelehrung:\nDas Widerspruchsrecht steht jedem zu, der an der Unterlassung der Löschung ein berechtigtes Interesse hat. Der Widerspruch ist bei dem Amtsgericht Düsseldorf -Registergericht-, Werdener Straße 1, 40227 Düsseldorf schriftlich in deutscher Sprache oder zur Niederschrift der Geschäftsstelle einzulegen. Der Widerspruch kann auch zur Niederschrift der Geschäftsstelle eines jeden Amtsgerichtes abgegeben werden. Die Einlegung ist auch durch Übertragung eines elektronischen Dokuments an die elektronische Poststelle des Gerichts möglich. Das elektronische Dokument muss für die Bearbeitung durch das Gericht geeignet und mit einer qualifizierten elektronischen Signatur der verantwortenden Person versehen sein oder von der verantwortenden Person signiert und auf einem sicheren Übermittlungsweg gemäß § 130a ZPO nach näherer Maßgabe der Verordnung über die technischen Rahmenbedingungen des elektronischen Rechtsverkehrs und über das besondere elektronische Behördenpostfach (BGBl. I, S.3803) eingereicht werden. Weitere Informationen erhalten Sie auf der Internetseite www.justiz.de.\nDer Widerspruch muss spätestens innerhalb der gesetzten Frist nach dem Datum der Bekanntmachung der Löschungsankündigung bei dem Amtsgericht - Registergericht - Düsseldorf eingegangen sein.  Dies gilt auch dann, wenn der Widerspruch zur Niederschrift der Geschäftsstelle eines anderen Amtsgerichtes abgegeben wurde. Die Frist beginnt mit dem Tage der Bekanntmachung der Löschungsankündigung in dem für die Bekanntmachung der Eintragungen in das Handelsregister bestimmten elektronischen Informations- und Kommunikationssystem nach § 10 des Handelsgesetzbuches. Fällt das Ende der Frist auf einen Sonntag, einen allgemeinen Feiertag oder Sonnabend, so endet die Frist mit Ablauf des nächsten Werktages.\nDer Widerspruch muss die Bezeichnung der angefochtenen Löschungsankündigung sowie die Erklärung enthalten, dass Widerspruch gegen diese Löschungsankündigung eingelegt wird. Er ist zu unterzeichnen und soll begründet werden."
    },
    {
      "date": "2025-06-16",
      "id": "112321",
      "original_text": "Registerbekanntmachung nach dem Umwandlungsgesetz\nNordrhein-Westfalen Amtsgericht Dortmund HRB 15413\nKfz- Sachverständigenbüro Rüdiger Elblein GmbH – Dortmund",
      "type": "Registerbekanntmachung nach dem Umwandlungsgesetz",
      "state": "Nordrhein-Westfalen",
      "amtsgericht": "Amtsgericht Dortmund",
      "registernummer": "HRB 15413",
      "registerart": "HRB",
      "company_name": "Kfz- Sachverständigenbüro Rüdiger Elblein GmbH",
      "company_seat": "Dortmund",
      "details": "16.06.2025 (Bekanntmachungsdatum)\n\nNordrhein-Westfalen Amtsgericht Dortmund HRB 15413\nRegisterbekanntmachung nach dem Umwandlungsgesetz 16.06.2025 (Eintragungsdatum)\n\nKfz- Sachverständigenbüro Rüdiger Elblein GmbH\nGesellschaft mit beschränkter Haftung\nDortmund\n\nDen Gläubigern der an der Verschmelzung beteiligten Rechtsträger ist, wenn sie binnen sechs Monaten nach dem Tag, an dem die Eintragung der Verschmelzung in das Register des Sitzes desjenigen Rechtsträgers, dessen Gläubiger sie sind, nach § 19 Absatz 3 UmwG als bekanntgemacht gilt, ihren Anspruch nach Grund und Höhe schriftlich anmelden, Sicherheit zu leisten, soweit sie nicht Befriedigung verlangen können. Dieses Recht steht den Gläubigern jedoch nur zu, wenn sie glaubhaft machen, dass durch die Verschmelzung die Erfüllung ihrer Forderung gefährdet wird."
    },
    {
      "date": "2025-06-16",
      "id": "112322",
      "original_text": "Registerbekanntmachung nach dem Umwandlungsgesetz\nNordrhein-Westfalen Amtsgericht Recklinghausen HRB 9989\nSenft Holding GmbH – Herten",
      "type": "Registerbekanntmachung nach dem Umwandlungsgesetz",
      "state": "Nordrhein-Westfalen",
      "amtsgericht": "Amtsgericht Recklinghausen",
      "registernummer": "HRB 9989",
      "registerart": "HRB",
      "company_name": "Senft Holding GmbH",
      "company_seat": "Herten",
      "details": "16.06.2025 (Bekanntmachungsdatum)\n\nNordrhein-Westfalen Amtsgericht Recklinghausen HRB 9989\nRegisterbekanntmachung nach dem Umwandlungsgesetz 11.06.2025 (Eintragungsdatum)\n\nSenft Holding GmbH\nGesellschaft mit beschränkter Haftung\nHerten\n\nDen Gläubigern der an der Abspaltung beteiligten Rechtsträger ist, wenn sie binnen sechs Monaten nach dem Tag, an dem die Eintragung der Abspaltung in das Register des Sitzes desjenigen Rechtsträgers, dessen Gläubiger sie sind, nach § 19 Absatz 3 UmwG als bekanntgemacht gilt, ihren Anspruch nach Grund und Höhe schriftlich anmelden, Sicherheit zu leisten, soweit sie nicht Befriedigung verlangen können. Dieses Recht steht den Gläubigern jedoch nur zu, wenn sie glaubhaft machen, dass durch die Abspaltung die Erfüllung ihrer Forderung gefährdet wird."
    },
    {
      "date": "2025-06-16",
      "id": "112323",
      "original_text": "Löschungsankündigung\nNordrhein-Westfalen Amtsgericht Essen HRB 17548\nMulti-Hoch- und Trockenbauarbeiten GmbH – Essen",
      "type": "Löschungsankündigung",
      "state": "Nordrhein-Westfalen",
      "amtsgericht": "Amtsgericht Essen",
      "registernummer": "HRB 17548",
      "registerart": "HRB",
      "company_name": "Multi-Hoch- und Trockenbauarbeiten GmbH",
      "company_seat": "Essen",
      "details": "16.06.2025 (Bekanntmachungsdatum)\n\nNordrhein-Westfalen Amtsgericht Essen HRB 17548\nLöschungsankündigung\n\nMulti-Hoch- und Trockenbauarbeiten GmbH\nGesellschaft mit beschränkter Haftung\nEssen\n\nDas Registergericht beabsichtigt die Gesellschaft von Amts wegen nach § 394 FamFG zu löschen. Die Frist zur Erhebung eines Widerspruchs ist auf einen Monat festgesetzt."
    },
    {
      "date": "2025-06-16",
      "id": "112324",
      "original_text": "Löschungsankündigung\nNordrhein-Westfalen Amtsgericht Dortmund HRB 28128\nSokulskyi Eduard UG (haftungsbeschränkt) – Dortmund",
      "type": "Löschungsankündigung",
      "state": "Nordrhein-Westfalen",
      "amtsgericht": "Amtsgericht Dortmund",
      "registernummer": "HRB 28128",
      "registerart": "HRB",
      "company_name": "Sokulskyi Eduard UG (haftungsbeschränkt)",
      "company_seat": "Dortmund",
      "details": "16.06.2025 (Bekanntmachungsdatum)\n\nNordrhein-Westfalen Amtsgericht Dortmund HRB 28128\nLöschungsankündigung\n\nSokulskyi Eduard UG (haftungsbeschränkt)\nGesellschaft mit beschränkter Haftung\nDortmund\n\nDas Registergericht beabsichtigt die Gesellschaft von Amts wegen nach § 394 FamFG zu löschen. Die Frist zur Erhebung eines Widerspruchs ist auf zwei Monate festgesetzt."
    },
    {
      "date": "2025-06-16",
      "id": "112325",
      "original_text": "Einreichung neuer Dokumente\nNordrhein-Westfalen Amtsgericht Köln HRB 52600\nLANXESS Deutschland GmbH – Köln",
      "type": "Einreichung neuer Dokumente",
      "state": "Nordrhein-Westfalen",
      "amtsgericht": "Amtsgericht Köln",
      "registernummer": "HRB 52600",
      "registerart": "HRB",
      "company_name": "LANXESS Deutschland GmbH",
      "company_seat": "Köln",
      "details": "16.06.2025 (Bekanntmachungsdatum)\n\nNordrhein-Westfalen Amtsgericht Köln HRB 52600\nEinreichung neuer Dokumente 16.06.2025 (Eintragungsdatum)\n\nLANXESS Deutschland GmbH\nGesellschaft mit beschränkter Haftung\nKöln\n\nDem Registergericht ist eine neue Liste der Mitglieder des Aufsichtsrates eingereicht worden."
    },
    {
      "date": "2025-06-16",
      "id": "112326",
      "original_text": "Registerbekanntmachung nach dem Umwandlungsgesetz\nNordrhein-Westfalen Amtsgericht Bonn HRB 23649\nMedizinisches Versorgungszentrum R(h)einZahn MVZ GmbH – Bonn",
      "type": "Registerbekanntmachung nach dem Umwandlungsgesetz",
      "state": "Nordrhein-Westfalen",
      "amtsgericht": "Amtsgericht Bonn",
      "registernummer": "HRB 23649",
      "registerart": "HRB",
      "company_name": "Medizinisches Versorgungszentrum R(h)einZahn MVZ GmbH",
      "company_seat": "Bonn",
      "details": "16.06.2025 (Bekanntmachungsdatum)\n\nNordrhein-Westfalen Amtsgericht Bonn HRB 23649\nRegisterbekanntmachung nach dem Umwandlungsgesetz 16.06.2025 (Eintragungsdatum)\n\nMedizinisches Versorgungszentrum R(h)einZahn MVZ GmbH\nGesellschaft mit beschränkter Haftung\nBonn\n\nDen Gläubigern der an der Verschmelzung beteiligten Rechtsträger ist, wenn sie binnen sechs Monaten nach dem Tag, an dem die Eintragung der Verschmelzung in das Register des Sitzes desjenigen Rechtsträgers, dessen Gläubiger sie sind, nach § 19 Absatz 3 UmwG als bekanntgemacht gilt, ihren Anspruch nach Grund und Höhe schriftlich anmelden, Sicherheit zu leisten, soweit sie nicht Befriedigung verlangen können. Dieses Recht steht den Gläubigern jedoch nur zu, wenn sie glaubhaft machen, dass durch die Verschmelzung die Erfüllung ihrer Forderung gefährdet wird."
    },
    {
      "date": "2025-06-16",
      "id": "112327",
      "original_text": "Löschungsankündigung\nNordrhein-Westfalen Amtsgericht Kleve HRB 19002\nPerformica Immobilien & Kapitalpflegegesellschaft mbH – Moers",
      "type": "Löschungsankündigung",
      "state": "Nordrhein-Westfalen",
      "amtsgericht": "Amtsgericht Kleve",
      "registernummer": "HRB 19002",
      "registerart": "HRB",
      "company_name": "Performica Immobilien & Kapitalpflegegesellschaft mbH",
      "company_seat": "Moers",
      "details": "16.06.2025 (Bekanntmachungsdatum)\n\nNordrhein-Westfalen Amtsgericht Kleve HRB 19002\nLöschungsankündigung\n\nPerformica Immobilien & Kapitalpflegegesellschaft mbH\nGesellschaft mit beschränkter Haftung\nMoers\n\nDas Registergericht beabsichtigt die Gesellschaft von Amts wegen nach § 394 FamFG zu löschen. Die Frist zur Erhebung eines Widerspruchs ist auf einen Monat festgesetzt."
    },
    {
      "date": "2025-06-16",
      "id": "112328",
      "original_text": "Löschungsankündigung\nNordrhein-Westfalen Amtsgericht Mönchengladbach HRB 10826\nBREGER Spedition GmbH – Viersen",
      "type": "Löschungsankündigung",
      "state": "Nordrhein-Westfalen",
      "amtsgericht": "Amtsgericht Mönchengladbach",
      "registernummer": "HRB 10826",
      "registerart": "HRB",
      "company_name": "BREGER Spedition GmbH",
      "company_seat": "Viersen",
      "details": "16.06.2025 (Bekanntmachungsdatum)\n\nNordrhein-Westfalen Amtsgericht Mönchengladbach HRB 10826\nLöschungsankündigung\n\nBREGER Spedition GmbH\nGesellschaft mit beschränkter Haftung\nViersen\n\nBREGER Spedition GmbH, Viersen (Amtsgericht Mönchengladbach, HRB 10826)\nDas Registergericht beabsichtigt, die im Handelsregister eingetragene Gesellschaft gemäß § 394 Absatz 1 FamFG wegen Vermögenslosigkeit von Amts wegen zu löschen. Gegen diese Verfügung kann Widerspruch eingelegt werden. Die Frist zur Erhebung eines Widerspruchs gegen die beabsichtigte Löschung von Amts wegen ist auf drei Monate festgesetzt."
    },
    {
      "date": "2025-06-16",
      "id": "112329",
      "original_text": "Löschungsankündigung\nNordrhein-Westfalen Amtsgericht Mönchengladbach HRB 17090\nARIZANA UG (haftungsbeschränkt) – Mönchengladbach",
      "type": "Löschungsankündigung",
      "state": "Nordrhein-Westfalen",
      "amtsgericht": "Amtsgericht Mönchengladbach",
      "registernummer": "HRB 17090",
      "registerart": "HRB",
      "company_name": "ARIZANA UG (haftungsbeschränkt)",
      "company_seat": "Mönchengladbach",
      "details": "16.06.2025 (Bekanntmachungsdatum)\n\nNordrhein-Westfalen Amtsgericht Mönchengladbach HRB 17090\nLöschungsankündigung 16.06.2025 (Eintragungsdatum)\n\nARIZANA UG (haftungsbeschränkt)\nGesellschaft mit beschränkter Haftung\nMönchengladbach\n\nDas Registergericht beabsichtigt die Gesellschaft von Amts wegen nach § 394 FamFG zu löschen. Die Frist zur Erhebung eines Widerspruchs ist auf drei Monate festgesetzt."
    },
    {
      "date": "2025-06-16",
      "id": "112330",
      "original_text": "Registerbekanntmachung nach dem Umwandlungsgesetz\nNordrhein-Westfalen Amtsgericht Recklinghausen HRB 9739\nSefina GmbH – Herten",
      "type": "Registerbekanntmachung nach dem Umwandlungsgesetz",
      "state": "Nordrhein-Westfalen",
      "amtsgericht": "Amtsgericht Recklinghausen",
      "registernummer": "HRB 9739",
      "registerart": "HRB",
      "company_name": "Sefina GmbH",
      "company_seat": "Herten",
      "details": "16.06.2025 (Bekanntmachungsdatum)\n\nNordrhein-Westfalen Amtsgericht Recklinghausen HRB 9739\nRegisterbekanntmachung nach dem Umwandlungsgesetz 11.06.2025 (Eintragungsdatum)\n\nSefina GmbH\nGesellschaft mit beschränkter Haftung\nHerten\n\nDen Gläubigern der an der Abspaltung beteiligten Rechtsträger ist, wenn sie binnen sechs Monaten nach dem Tag, an dem die Eintragung der Abspaltung in das Register des Sitzes desjenigen Rechtsträgers, dessen Gläubiger sie sind, nach § 19 Absatz 3 UmwG als bekanntgemacht gilt, ihren Anspruch nach Grund und Höhe schriftlich anmelden, Sicherheit zu leisten, soweit sie nicht Befriedigung verlangen können. Dieses Recht steht den Gläubigern jedoch nur zu, wenn sie glaubhaft machen, dass durch die Abspaltung die Erfüllung ihrer Forderung gefährdet wird."
    },
    {
      "date": "2025-06-16",
      "id": "112331",
      "original_text": "Registerbekanntmachung nach dem Umwandlungsgesetz\nNordrhein-Westfalen Amtsgericht Dortmund HRB 32976\nWestool Trading GmbH – Werne",
      "type": "Registerbekanntmachung nach dem Umwandlungsgesetz",
      "state": "Nordrhein-Westfalen",
      "amtsgericht": "Amtsgericht Dortmund",
      "registernummer": "HRB 32976",
      "registerart": "HRB",
      "company_name": "Westool Trading GmbH",
      "company_seat": "Werne",
      "details": "16.06.2025 (Bekanntmachungsdatum)\n\nNordrhein-Westfalen Amtsgericht Dortmund HRB 32976\nRegisterbekanntmachung nach dem Umwandlungsgesetz 16.06.2025 (Eintragungsdatum)\n\nWestool Trading GmbH\nGesellschaft mit beschränkter Haftung\nWerne"
    },
    {
      "date": "2025-06-16",
      "id": "112332",
      "original_text": "Registerbekanntmachung nach dem Umwandlungsgesetz\nNordrhein-Westfalen Amtsgericht Düsseldorf HRB 79354\nGrundstücksverwaltungsgesellschaft Margaretenhütte mbH – Düsseldorf",
      "type": "Registerbekanntmachung nach dem Umwandlungsgesetz",
      "state": "Nordrhein-Westfalen",
      "amtsgericht": "Amtsgericht Düsseldorf",
      "registernummer": "HRB 79354",
      "registerart": "HRB",
      "company_name": "Grundstücksverwaltungsgesellschaft Margaretenhütte mbH",
      "company_seat": "Düsseldorf",
      "details": "16.06.2025 (Bekanntmachungsdatum)\n\nNordrhein-Westfalen Amtsgericht Düsseldorf HRB 79354\nRegisterbekanntmachung nach dem Umwandlungsgesetz 16.06.2025 (Eintragungsdatum)\n\nGrundstücksverwaltungsgesellschaft Margaretenhütte mbH\nGesellschaft mit beschränkter Haftung\nDüsseldorf\n\nDen Gläubigern der an der Verschmelzung beteiligten Rechtsträger ist, wenn sie binnen sechs Monaten nach dem Tag, an dem die Eintragung der Verschmelzung in das Register des Sitzes desjenigen Rechtsträgers, dessen Gläubiger sie sind, nach § 19 Absatz 3 UmwG als bekanntgemacht gilt, ihren Anspruch nach Grund und Höhe schriftlich anmelden, Sicherheit zu leisten, soweit sie nicht Befriedigung verlangen können. Dieses Recht steht den Gläubigern jedoch nur zu, wenn sie glaubhaft machen, dass durch die Verschmelzung die Erfüllung ihrer Forderung gefährdet wird."
    },
    {
      "date": "2025-06-16",
      "id": "112333",
      "original_text": "Einreichung neuer Dokumente\nNordrhein-Westfalen Amtsgericht Düsseldorf HRB 72305\nDemag Cranes & Components GmbH – Düsseldorf",
      "type": "Einreichung neuer Dokumente",
      "state": "Nordrhein-Westfalen",
      "amtsgericht": "Amtsgericht Düsseldorf",
      "registernummer": "HRB 72305",
      "registerart": "HRB",
      "company_name": "Demag Cranes & Components GmbH",
      "company_seat": "Düsseldorf",
      "details": "16.06.2025 (Bekanntmachungsdatum)\n\nNordrhein-Westfalen Amtsgericht Düsseldorf HRB 72305\nEinreichung neuer Dokumente\n\nDemag Cranes & Components GmbH\nGesellschaft mit beschränkter Haftung\nDüsseldorf\n\nDem Registergericht ist eine Liste der Mitglieder des Aufsichtsrates eingereicht worden."
    },
    {
      "date": "2025-06-16",
      "id": "112334",
      "original_text": "Einreichung neuer Dokumente\nNordrhein-Westfalen Amtsgericht Düsseldorf HRB 63385\nX-CELL AG – Düsseldorf",
      "type": "Einreichung neuer Dokumente",
      "state": "Nordrhein-Westfalen",
      "amtsgericht": "Amtsgericht Düsseldorf",
      "registernummer": "HRB 63385",
      "registerart": "HRB",
      "company_name": "X-CELL AG",
      "company_seat": "Düsseldorf",
      "details": "16.06.2025 (Bekanntmachungsdatum)\n\nNordrhein-Westfalen Amtsgericht Düsseldorf HRB 63385\nEinreichung neuer Dokumente\n\nX-CELL AG\nAktiengesellschaft\nDüsseldorf\n\nDem Registergericht ist eine Liste der Mitglieder des Aufsichtsrates eingereicht worden."
    },
    {
      "date": "2025-06-16",
      "id": "112335",
      "original_text": "Einreichung neuer Dokumente\nNordrhein-Westfalen Amtsgericht Neuss HRB 18230\nWerhahn Industrieholding SE – Neuss",
      "type": "Einreichung neuer Dokumente",
      "state": "Nordrhein-Westfalen",
      "amtsgericht": "Amtsgericht Neuss",
      "registernummer": "HRB 18230",
      "registerart": "HRB",
      "company_name": "Werhahn Industrieholding SE",
      "company_seat": "Neuss",
      "details": "16.06.2025 (Bekanntmachungsdatum)\n\nNordrhein-Westfalen Amtsgericht Neuss HRB 18230\nEinreichung neuer Dokumente\n\nWerhahn Industrieholding SE\nEuropäische Aktiengesellschaft (SE)\nNeuss\n\nDem Registergericht ist eine neue Liste der Mitglieder des Aufsichtsrates eingereicht worden."
    },
    {
      "date": "2025-06-16",
      "id": "112336",
      "original_text": "Registerbekanntmachung nach dem Umwandlungsgesetz\nNordrhein-Westfalen Amtsgericht Siegburg HRB 7047\nStil ART Interieur GmbH – Königswinter",
      "type": "Registerbekanntmachung nach dem Umwandlungsgesetz",
      "state": "Nordrhein-Westfalen",
      "amtsgericht": "Amtsgericht Siegburg",
      "registernummer": "HRB 7047",
      "registerart": "HRB",
      "company_name": "Stil ART Interieur GmbH",
      "company_seat": "Königswinter",
      "details": "16.06.2025 (Bekanntmachungsdatum)\n\nNordrhein-Westfalen Amtsgericht Siegburg HRB 7047\nRegisterbekanntmachung nach dem Umwandlungsgesetz 16.06.2025 (Eintragungsdatum)\n\nStil ART Interieur GmbH\nGesellschaft mit beschränkter Haftung\nKönigswinter\n\nDen Gläubigern der an der Verschmelzung beteiligten Rechtsträger ist, wenn sie binnen sechs Monaten nach dem Tag, an dem die Eintragung der Verschmelzung in das Register des Sitzes desjenigen Rechtsträgers, dessen Gläubiger sie sind, nach § 19 Absatz 3 UmwG als bekanntgemacht gilt, ihren Anspruch nach Grund und Höhe schriftlich anmelden, Sicherheit zu leisten, soweit sie nicht Befriedigung verlangen können. Dieses Recht steht den Gläubigern jedoch nur zu, wenn sie glaubhaft machen, dass durch die Verschmelzung die Erfüllung ihrer Forderung gefährdet wird."
    },
    {
      "date": "2025-06-16",
      "id": "112337",
      "original_text": "Löschungsankündigung\nNordrhein-Westfalen Amtsgericht Dortmund HRB 28206\nBad & Raum Haustechnik GmbH – Dortmund",
      "type": "Löschungsankündigung",
      "state": "Nordrhein-Westfalen",
      "amtsgericht": "Amtsgericht Dortmund",
      "registernummer": "HRB 28206",
      "registerart": "HRB",
      "company_name": "Bad & Raum Haustechnik GmbH",
      "company_seat": "Dortmund",
      "details": "16.06.2025 (Bekanntmachungsdatum)\n\nNordrhein-Westfalen Amtsgericht Dortmund HRB 28206\nLöschungsankündigung\n\nBad & Raum Haustechnik GmbH\nGesellschaft mit beschränkter Haftung\nDortmund\n\nDas Registergericht beabsichtigt die Gesellschaft von Amts wegen nach § 394 FamFG zu löschen. Die Frist zur Erhebung eines Widerspruchs ist auf zwei Monate festgesetzt."
    },
    {
      "date": "2025-06-16",
      "id": "112338",
      "original_text": "Löschungsankündigung\nNordrhein-Westfalen Amtsgericht Düsseldorf HRB 97292\nMy Rensus Germany GmbH – Monheim am Rhein",
      "type": "Löschungsankündigung",
      "state": "Nordrhein-Westfalen",
      "amtsgericht": "Amtsgericht Düsseldorf",
      "registernummer": "HRB 97292",
      "registerart": "HRB",
      "company_name": "My Rensus Germany GmbH",
      "company_seat": "Monheim am Rhein",
      "details": "16.06.2025 (Bekanntmachungsdatum)\n\nNordrhein-Westfalen Amtsgericht Düsseldorf HRB 97292\nLöschungsankündigung\n\nMy Rensus Germany GmbH\nGesellschaft mit beschränkter Haftung\nMonheim am Rhein\n\nDas Registergericht beabsichtigt die Gesellschaft von Amts wegen nach § 394 FamFG zu löschen. Die Frist zur Erhebung eines Widerspruchs ist auf 3 Wochen festgesetzt.\n\nRechtsbehelfsbelehrung:\nDas Widerspruchsrecht steht jedem zu, der an der Unterlassung der Löschung ein berechtigtes Interesse hat. Der Widerspruch ist bei dem Amtsgericht Düsseldorf -Registergericht-, Werdener Straße 1, 40227 Düsseldorf schriftlich in deutscher Sprache oder zur Niederschrift der Geschäftsstelle einzulegen. Der Widerspruch kann auch zur Niederschrift der Geschäftsstelle eines jeden Amtsgerichtes abgegeben werden. Die Einlegung ist auch durch Übertragung eines elektronischen Dokuments an die elektronische Poststelle des Gerichts möglich. Das elektronische Dokument muss für die Bearbeitung durch das Gericht geeignet und mit einer qualifizierten elektronischen Signatur der verantwortenden Person versehen sein oder von der verantwortenden Person signiert und auf einem sicheren Übermittlungsweg gemäß § 130a ZPO nach näherer Maßgabe der Verordnung über die technischen Rahmenbedingungen des elektronischen Rechtsverkehrs und über das besondere elektronische Behördenpostfach (BGBl. I, S.3803) eingereicht werden. Weitere Informationen erhalten Sie auf der Internetseite www.justiz.de.\nDer Widerspruch muss spätestens innerhalb der gesetzten Frist nach dem Datum der Bekanntmachung der Löschungsankündigung bei dem Amtsgericht - Registergericht - Düsseldorf eingegangen sein.  Dies gilt auch dann, wenn der Widerspruch zur Niederschrift der Geschäftsstelle eines anderen Amtsgerichtes abgegeben wurde. Die Frist beginnt mit dem Tage der Bekanntmachung der Löschungsankündigung in dem für die Bekanntmachung der Eintragungen in das Handelsregister bestimmten elektronischen Informations- und Kommunikationssystem nach § 10 des Handelsgesetzbuches. Fällt das Ende der Frist auf einen Sonntag, einen allgemeinen Feiertag oder Sonnabend, so endet die Frist mit Ablauf des nächsten Werktages.\nDer Widerspruch muss die Bezeichnung der angefochtenen Löschungsankündigung sowie die Erklärung enthalten, dass Widerspruch gegen diese Löschungsankündigung eingelegt wird. Er ist zu unterzeichnen und soll begründet werden."
    },
    {
      "date": "2025-06-16",
      "id": "112339",
      "original_text": "Registerbekanntmachung nach dem Umwandlungsgesetz\nNordrhein-Westfalen Amtsgericht Bonn HRB 29339\nDeutsche Post & Paket Beteiligungsgesellschaft 1 GmbH – Bonn",
      "type": "Registerbekanntmachung nach dem Umwandlungsgesetz",
      "state": "Nordrhein-Westfalen",
      "amtsgericht": "Amtsgericht Bonn",
      "registernummer": "HRB 29339",
      "registerart": "HRB",
      "company_name": "Deutsche Post & Paket Beteiligungsgesellschaft 1 GmbH",
      "company_seat": "Bonn",
      "details": "16.06.2025 (Bekanntmachungsdatum)\n\nNordrhein-Westfalen Amtsgericht Bonn HRB 29339\nRegisterbekanntmachung nach dem Umwandlungsgesetz 16.06.2025 (Eintragungsdatum)\n\nDeutsche Post & Paket Beteiligungsgesellschaft 1 GmbH\nGesellschaft mit beschränkter Haftung\nBonn\n\nDen Gläubigern der an der Verschmelzung beteiligten Rechtsträger ist, wenn sie binnen sechs Monaten nach dem Tag, an dem die Eintragung der Verschmelzung in das Register des Sitzes desjenigen Rechtsträgers, dessen Gläubiger sie sind, nach § 19 Absatz 3 UmwG als bekanntgemacht gilt, ihren Anspruch nach Grund und Höhe schriftlich anmelden, Sicherheit zu leisten, soweit sie nicht Befriedigung verlangen können. Dieses Recht steht den Gläubigern jedoch nur zu, wenn sie glaubhaft machen, dass durch die Verschmelzung die Erfüllung ihrer Forderung gefährdet wird."
    },
    {
      "date": "2025-06-16",
      "id": "112340",
      "original_text": "Löschungsankündigung\nThüringen Amtsgericht Jena HRB 515931\nUHPC Fertigteil-Bau GmbH – Eisenach",
      "type": "Löschungsankündigung",
      "state": "Thüringen",
      "amtsgericht": "Amtsgericht Jena",
      "registernummer": "HRB 515931",
      "registerart": "HRB",
      "company_name": "UHPC Fertigteil-Bau GmbH",
      "company_seat": "Eisenach",
      "details": "16.06.2025 (Bekanntmachungsdatum)\n\nThüringen Amtsgericht Jena HRB 515931\nLöschungsankündigung\n\nUHPC Fertigteil-Bau GmbH\nGesellschaft mit beschränkter Haftung\nEisenach\n\nDas Registergericht beabsichtigt, die im Handelsregister eingetragene Gesellschaft wegen Vermögenslosigkeit nach § 394 FamFG von Amts wegen zu löschen. Die Frist zur Erhebung eines Widerspruchs gegen die beabsichtigte Löschung wird auf 6 Wochen festgesetzt."
    },
    {
      "date": "2025-06-16",
      "id": "112341",
      "original_text": "Registerbekanntmachung nach dem Umwandlungsgesetz\nThüringen Amtsgericht Jena HRB 520170\nQualitäts Miniaturen GmbH – Saalfeld/Saale",
      "type": "Registerbekanntmachung nach dem Umwandlungsgesetz",
      "state": "Thüringen",
      "amtsgericht": "Amtsgericht Jena",
      "registernummer": "HRB 520170",
      "registerart": "HRB",
      "company_name": "Qualitäts Miniaturen GmbH",
      "company_seat": "Saalfeld/Saale",
      "details": "16.06.2025 (Bekanntmachungsdatum)\n\nThüringen Amtsgericht Jena HRB 520170\nRegisterbekanntmachung nach dem Umwandlungsgesetz 16.06.2025 (Eintragungsdatum)\n\nQualitäts Miniaturen GmbH\nGesellschaft mit beschränkter Haftung\nSaalfeld/Saale\n\nNicht eingetragen: Den Gläubigern der an der Verschmelzung beteiligten Rechtsträger, ist wenn sie binnen sechs Monaten nach dem Tag, an dem die Eintragung der Verschmelzung in das Register des Sitzes desjenigen Rechtsträgers, dessen Gläubiger sie sind,  nach § 19 Abs. 3 UmwG als bekanntgemacht gilt, ihren Anspruch nach Grund und Höhe schriftlich anmelden, Sicherheit zu leisten, soweit sie nicht Befriedigung verlangen können. Dieses Recht steht ihnen jedoch nur zu, wenn sie glaubhaft machen, daß durch die Verschmelzung die Erfüllung ihrer Forderung gefährdet wird."
    },
    {
      "date": "2025-06-16",
      "id": "112342",
      "original_text": "Registerbekanntmachung nach dem Umwandlungsgesetz\nThüringen Amtsgericht Jena HRB 516048\nHIX Enterprise Unternehmergesellschaft (haftungsbeschränkt) – Saalfeld/Saale",
      "type": "Registerbekanntmachung nach dem Umwandlungsgesetz",
      "state": "Thüringen",
      "amtsgericht": "Amtsgericht Jena",
      "registernummer": "HRB 516048",
      "registerart": "HRB",
      "company_name": "HIX Enterprise Unternehmergesellschaft (haftungsbeschränkt)",
      "company_seat": "Saalfeld/Saale",
      "details": "16.06.2025 (Bekanntmachungsdatum)\n\nThüringen Amtsgericht Jena HRB 516048\nRegisterbekanntmachung nach dem Umwandlungsgesetz 16.06.2025 (Eintragungsdatum)\n\nHIX Enterprise Unternehmergesellschaft (haftungsbeschränkt)\nGesellschaft mit beschränkter Haftung\nSaalfeld/Saale\n\nNicht eingetragen: Den Gläubigern der an der Verschmelzung beteiligten Rechtsträger, ist wenn sie binnen sechs Monaten nach dem Tag, an dem die Eintragung der Verschmelzung in das Register des Sitzes desjenigen Rechtsträgers, dessen Gläubiger sie sind,  nach § 19 Abs. 3 UmwG als bekanntgemacht gilt, ihren Anspruch nach Grund und Höhe schriftlich anmelden, Sicherheit zu leisten, soweit sie nicht Befriedigung verlangen können. Dieses Recht steht ihnen jedoch nur zu, wenn sie glaubhaft machen, daß durch die Verschmelzung die Erfüllung ihrer Forderung gefährdet wird."
    },
    {
      "date": "2025-06-16",
      "id": "112343",
      "original_text": "Registerbekanntmachung nach dem Umwandlungsgesetz\nHessen Amtsgericht Darmstadt HRA 87711\nUtze Haustechnik GmbH & Co. KG – Hirschhorn (Neckar)",
      "type": "Registerbekanntmachung nach dem Umwandlungsgesetz",
      "state": "Hessen",
      "amtsgericht": "Amtsgericht Darmstadt",
      "registernummer": "HRA 87711",
      "registerart": "HRA",
      "company_name": "Utze Haustechnik GmbH & Co. KG",
      "company_seat": "Hirschhorn (Neckar)",
      "details": "16.06.2025 (Bekanntmachungsdatum)\n\nHessen Amtsgericht Darmstadt HRA 87711\nRegisterbekanntmachung nach dem Umwandlungsgesetz 16.06.2025 (Eintragungsdatum)\n\nUtze Haustechnik GmbH & Co. KG\nKommanditgesellschaft\nHirschhorn (Neckar)\n\nDen Gläubigern der an der Ausgliederung beteiligten Rechtsträger ist, wenn sie binnen sechs Monaten nach dem Tag, an dem die Eintragung der Ausgliederung in das Register des Sitzes derjenigen Rechtsträger deren Gläubiger sie sind, nach §§ 125, 19 Absatz 3 UmwG bekannt gemacht worden ist, ihren Anspruch nach Grund und Höhe schriftlich anmelden, Sicherheit zu leisten, soweit sie nicht Befriedigung verlangen können. Dieses Recht steht den Gläubigern jedoch nur zu, wenn sie glaubhaft machen, dass durch die Ausgliederung die Erfüllung ihrer Forderung gefährdet wird."
    },
    {
      "date": "2025-06-16",
      "id": "112344",
      "original_text": "Registerbekanntmachung nach dem Umwandlungsgesetz\nHessen Amtsgericht Kassel GnR 875\nCURAPRO Wohnungsbaugenossenschaft eG – Vellmar",
      "type": "Registerbekanntmachung nach dem Umwandlungsgesetz",
      "state": "Hessen",
      "amtsgericht": "Amtsgericht Kassel",
      "registernummer": "GnR 875",
      "registerart": "GnR",
      "company_name": "CURAPRO Wohnungsbaugenossenschaft eG",
      "company_seat": "Vellmar",
      "details": "16.06.2025 (Bekanntmachungsdatum)\n\nHessen Amtsgericht Kassel GnR 875\nRegisterbekanntmachung nach dem Umwandlungsgesetz 16.06.2025 (Eintragungsdatum)\n\nCURAPRO Wohnungsbaugenossenschaft eG\neingetragene Genossenschaft\nVellmar\n\nDen Gläubigern der an der Verschmelzung beteiligten Rechtsträger ist, wenn sie binnen sechs Monaten nach dem Tag, an dem die Eintragung der Verschmelzung in das Register des Sitzes desjenigen Rechtsträgers, dessen Gläubiger sie sind, nach §§ 122a Absatz 2, 19 Absatz 3 UmwG bekannt gemacht worden ist, ihren Anspruch nach Grund und Höhe schriftlich anmelden, Sicherheit zu leisten, soweit sie nicht Befriedigung verlangen können. Dieses Recht steht den Gläubigern jedoch nur zu, wenn sie glaubhaft machen, dass durch die Verschmelzung die Erfüllung ihrer Forderung gefährdet wird."
    },
    {
      "date": "2025-06-16",
      "id": "112345",
      "original_text": "Registerbekanntmachung nach dem Umwandlungsgesetz\nHessen Amtsgericht Wiesbaden HRB 34635\nDPE Engineering GmbH – Wiesbaden",
      "type": "Registerbekanntmachung nach dem Umwandlungsgesetz",
      "state": "Hessen",
      "amtsgericht": "Amtsgericht Wiesbaden",
      "registernummer": "HRB 34635",
      "registerart": "HRB",
      "company_name": "DPE Engineering GmbH",
      "company_seat": "Wiesbaden",
      "details": "16.06.2025 (Bekanntmachungsdatum)\n\nHessen Amtsgericht Wiesbaden HRB 34635\nRegisterbekanntmachung nach dem Umwandlungsgesetz 16.06.2025 (Eintragungsdatum)\n\nDPE Engineering GmbH\nGesellschaft mit beschränkter Haftung\nWiesbaden\n\nDen Gläubigern der an der Verschmelzung beteiligten Rechtsträger ist, wenn sie binnen sechs Monaten nach dem Tag, an dem die Eintragung der Verschmelzung in das Register des Sitzes derjenigen Rechtsträger deren Gläubiger sie sind, nach § 19 Absatz 3 UmwG bekannt gemacht worden ist, ihren Anspruch nach Grund und Höhe schriftlich anmelden, Sicherheit zu leisten, soweit sie nicht Befriedigung verlangen können. Dieses Recht steht den Gläubigern jedoch nur zu, wenn sie glaubhaft machen, dass durch die Verschmelzung die Erfüllung ihrer Forderung gefährdet wird."
    },
    {
      "date": "2025-06-16",
      "id": "112346",
      "original_text": "Einreichung neuer Dokumente\nHessen Amtsgericht Frankfurt am Main HRB 42397\nABG FRANKFURT HOLDING Wohnungsbau- und Beteiligungsgesellschaft mit beschränkter Haftung – Frankfurt am Main",
      "type": "Einreichung neuer Dokumente",
      "state": "Hessen",
      "amtsgericht": "Amtsgericht Frankfurt am Main",
      "registernummer": "HRB 42397",
      "registerart": "HRB",
      "company_name": "ABG FRANKFURT HOLDING Wohnungsbau- und Beteiligungsgesellschaft mit beschränkter Haftung",
      "company_seat": "Frankfurt am Main",
      "details": "16.06.2025 (Bekanntmachungsdatum)\n\nHessen Amtsgericht Frankfurt am Main HRB 42397\nEinreichung neuer Dokumente\n\nABG FRANKFURT HOLDING Wohnungsbau- und Beteiligungsgesellschaft mit beschränkter Haftung\nGesellschaft mit beschränkter Haftung\nFrankfurt am Main\n\nDurch eine Änderung in den Personen der Aufsichtsratsmitglieder ist eine Liste der Mitglieder des Aufsichtsrates zum Handelsregister eingereicht worden."
    },
    {
      "date": "2025-06-16",
      "id": "112347",
      "original_text": "Löschungsankündigung\nHessen Amtsgericht Marburg HRB 7939\nImtech Industrie Service UG (haftungsbeschränkt) – Stadtallendorf",
      "type": "Löschungsankündigung",
      "state": "Hessen",
      "amtsgericht": "Amtsgericht Marburg",
      "registernummer": "HRB 7939",
      "registerart": "HRB",
      "company_name": "Imtech Industrie Service UG (haftungsbeschränkt)",
      "company_seat": "Stadtallendorf",
      "details": "16.06.2025 (Bekanntmachungsdatum)\n\nHessen Amtsgericht Marburg HRB 7939\nLöschungsankündigung\n\nImtech Industrie Service UG (haftungsbeschränkt)\nGesellschaft mit beschränkter Haftung\nStadtallendorf\n\nDas Registergericht beabsichtigt die im Handelsregister eingetragene Gesellschaft von Amts wegen nach § 394 FamFG wegen Vermögenslosigkeit zu löschen. Die Frist zur Erhebung eines Widerspruchs gegen die beabsichtigte Löschung wird auf 3 Monate festgesetzt."
    },
    {
      "date": "2025-06-16",
      "id": "112348",
      "original_text": "Sonstige Registerbekanntmachung\nHessen Amtsgericht Wiesbaden VR 3011\nProjektgruppe Kinder von Tschernobyl – Bad Schwalbach",
      "type": "Sonstige Registerbekanntmachung",
      "state": "Hessen",
      "amtsgericht": "Amtsgericht Wiesbaden",
      "registernummer": "VR 3011",
      "registerart": "VR",
      "company_name": "Projektgruppe Kinder von Tschernobyl",
      "company_seat": "Bad Schwalbach",
      "details": "16.06.2025 (Bekanntmachungsdatum)\n\nHessen Amtsgericht Wiesbaden VR 3011\nSonstige Registerbekanntmachung 16.06.2025 (Eintragungsdatum)\n\nProjektgruppe Kinder von Tschernobyl\neingetragener Verein\nBad Schwalbach\n\nDer Verein ist aufgelöst."
    },
    {
      "date": "2025-06-16",
      "id": "112349",
      "original_text": "Registerbekanntmachung nach dem Umwandlungsgesetz\nHessen Amtsgericht Kassel HRB 19967\nWENDEROTH Lichtplanung & Vertriebs GmbH – Baunatal",
      "type": "Registerbekanntmachung nach dem Umwandlungsgesetz",
      "state": "Hessen",
      "amtsgericht": "Amtsgericht Kassel",
      "registernummer": "HRB 19967",
      "registerart": "HRB",
      "company_name": "WENDEROTH Lichtplanung & Vertriebs GmbH",
      "company_seat": "Baunatal",
      "details": "16.06.2025 (Bekanntmachungsdatum)\n\nHessen Amtsgericht Kassel HRB 19967\nRegisterbekanntmachung nach dem Umwandlungsgesetz 16.06.2025 (Eintragungsdatum)\n\nWENDEROTH Lichtplanung & Vertriebs GmbH\nGesellschaft mit beschränkter Haftung\nBaunatal\n\nDen Gläubigern der an der Ausgliederung beteiligten Rechtsträger ist, wenn sie binnen sechs Monaten nach dem Tag, an dem die Eintragung der Ausgliederung in das Register des Sitzes desjenigen Rechtsträgers, dessen Gläubiger sie sind, nach §§ 125, 19 Absatz 3 UmwG bekannt gemacht worden ist, ihren Anspruch nach Grund und Höhe schriftlich anmelden, Sicherheit zu leisten, soweit sie nicht Befriedigung verlangen können. Dieses Recht steht den Gläubigern jedoch nur zu, wenn sie glaubhaft machen, dass durch die Ausgliederung die Erfüllung ihrer Forderung gefährdet wird."
    },
    {
      "date": "2025-06-16",
      "id": "112350",
      "original_text": "Registerbekanntmachung nach dem Umwandlungsgesetz\nHessen Amtsgericht Wiesbaden HRB 33739\nJK19 Ventures UG (haftungsbeschränkt) – Wiesbaden",
      "type": "Registerbekanntmachung nach dem Umwandlungsgesetz",
      "state": "Hessen",
      "amtsgericht": "Amtsgericht Wiesbaden",
      "registernummer": "HRB 33739",
      "registerart": "HRB",
      "company_name": "JK19 Ventures UG (haftungsbeschränkt)",
      "company_seat": "Wiesbaden",
      "details": "16.06.2025 (Bekanntmachungsdatum)\n\nHessen Amtsgericht Wiesbaden HRB 33739\nRegisterbekanntmachung nach dem Umwandlungsgesetz 15.06.2025 (Eintragungsdatum)\n\nJK19 Ventures UG (haftungsbeschränkt)\nGesellschaft mit beschränkter Haftung\nWiesbaden\n\nDen Gläubigern der an der Verschmelzung beteiligten Rechtsträger ist, wenn sie binnen sechs Monaten nach dem Tag, an dem die Eintragung der Verschmelzung in das Register des Sitzes desjenigen Rechtsträgers, dessen Gläubiger sie sind, nach § 19 Absatz 3 UmwG bekannt gemacht worden ist, ihren Anspruch nach Grund und Höhe schriftlich anmelden, Sicherheit zu leisten, soweit sie nicht Befriedigung verlangen können. Dieses Recht steht den Gläubigern jedoch nur zu, wenn sie glaubhaft machen, dass durch die Verschmelzung die Erfüllung ihrer Forderung gefährdet wird."
    },
    {
      "date": "2025-06-16",
      "id": "112351",
      "original_text": "Registerbekanntmachung nach dem Umwandlungsgesetz\nHessen Amtsgericht Darmstadt HRA 87688\nUtze Haustechnik Sanitär e.K. – Hirschhorn (Neckar)",
      "type": "Registerbekanntmachung nach dem Umwandlungsgesetz",
      "state": "Hessen",
      "amtsgericht": "Amtsgericht Darmstadt",
      "registernummer": "HRA 87688",
      "registerart": "HRA",
      "company_name": "Utze Haustechnik Sanitär e.K.",
      "company_seat": "Hirschhorn (Neckar)",
      "details": "16.06.2025 (Bekanntmachungsdatum)\n\nHessen Amtsgericht Darmstadt HRA 87688\nRegisterbekanntmachung nach dem Umwandlungsgesetz 16.06.2025 (Eintragungsdatum)\n\nUtze Haustechnik Sanitär e.K.\nEinzelkaufmann / Einzelkauffrau\nHirschhorn (Neckar)\n\nDen Gläubigern der an der Ausgliederung beteiligten Rechtsträger ist, wenn sie binnen sechs Monaten nach dem Tag, an dem die Eintragung der Ausgliederung in das Register des Sitzes derjenigen Rechtsträger deren Gläubiger sie sind, nach §§ 125, 19 Absatz 3 UmwG bekannt gemacht worden ist, ihren Anspruch nach Grund und Höhe schriftlich anmelden, Sicherheit zu leisten, soweit sie nicht Befriedigung verlangen können. Dieses Recht steht den Gläubigern jedoch nur zu, wenn sie glaubhaft machen, dass durch die Ausgliederung die Erfüllung ihrer Forderung gefährdet wird."
    },
    {
      "date": "2025-06-16",
      "id": "112352",
      "original_text": "Einreichung neuer Dokumente\nHessen Amtsgericht Frankfurt am Main HRB 42465\nHof Hausen vor der Sonne Golf AG – Hofheim am Taunus",
      "type": "Einreichung neuer Dokumente",
      "state": "Hessen",
      "amtsgericht": "Amtsgericht Frankfurt am Main",
      "registernummer": "HRB 42465",
      "registerart": "HRB",
      "company_name": "Hof Hausen vor der Sonne Golf AG",
      "company_seat": "Hofheim am Taunus",
      "details": "16.06.2025 (Bekanntmachungsdatum)\n\nHessen Amtsgericht Frankfurt am Main HRB 42465\nEinreichung neuer Dokumente\n\nHof Hausen vor der Sonne Golf AG\nAktiengesellschaft\nHofheim am Taunus\n\nDurch eine Änderung in den Personen der Aufsichtsratsmitglieder ist eine Liste der Mitglieder des Aufsichtsrates zum Handelsregister eingereicht worden."
    },
    {
      "date": "2025-06-16",
      "id": "112353",
      "original_text": "Registerbekanntmachung nach dem Umwandlungsgesetz\nHessen Amtsgericht Wetzlar HRB 9403\nZenit Design GmbH – Dillenburg",
      "type": "Registerbekanntmachung nach dem Umwandlungsgesetz",
      "state": "Hessen",
      "amtsgericht": "Amtsgericht Wetzlar",
      "registernummer": "HRB 9403",
      "registerart": "HRB",
      "company_name": "Zenit Design GmbH",
      "company_seat": "Dillenburg",
      "details": "16.06.2025 (Bekanntmachungsdatum)\n\nHessen Amtsgericht Wetzlar HRB 9403\nRegisterbekanntmachung nach dem Umwandlungsgesetz 16.06.2025 (Eintragungsdatum)\n\nZenit Design GmbH\nGesellschaft mit beschränkter Haftung\nDillenburg\n\nDen Gläubigern der an der Ausgliederung beteiligten Rechtsträger ist, wenn sie binnen sechs Monaten nach dem Tag, an dem die Eintragung der Ausgliederung in das Register des Sitzes desjenigen Rechtsträgers, dessen Gläubiger sie sind, nach §§ 125, 19 Absatz 3 UmwG bekannt gemacht worden ist, ihren Anspruch nach Grund und Höhe schriftlich anmelden, Sicherheit zu leisten, soweit sie nicht Befriedigung verlangen können. Dieses Recht steht den Gläubigern jedoch nur zu, wenn sie glaubhaft machen, dass durch die Ausgliederung die Erfüllung ihrer Forderung gefährdet wird."
    },
    {
      "date": "2025-06-16",
      "id": "112354",
      "original_text": "Registerbekanntmachung nach dem Umwandlungsgesetz\nHessen Amtsgericht Frankfurt am Main HRB 92930\nMarkLogic (Germany) GmbH – Frankfurt am Main",
      "type": "Registerbekanntmachung nach dem Umwandlungsgesetz",
      "state": "Hessen",
      "amtsgericht": "Amtsgericht Frankfurt am Main",
      "registernummer": "HRB 92930",
      "registerart": "HRB",
      "company_name": "MarkLogic (Germany) GmbH",
      "company_seat": "Frankfurt am Main",
      "details": "16.06.2025 (Bekanntmachungsdatum)\n\nHessen Amtsgericht Frankfurt am Main HRB 92930\nRegisterbekanntmachung nach dem Umwandlungsgesetz 16.06.2025 (Eintragungsdatum)\n\nMarkLogic (Germany) GmbH\nGesellschaft mit beschränkter Haftung\nFrankfurt am Main\n\nDen Gläubigern der an der Verschmelzung beteiligten Rechtsträger ist, wenn sie binnen sechs Monaten nach dem Tag, an dem die Eintragung der Verschmelzung in das Register des Sitzes desjenigen Rechtsträgers, dessen Gläubiger sie sind, nach § 19 Absatz 3 UmwG bekannt gemacht worden ist, ihren Anspruch nach Grund und Höhe schriftlich anmelden, Sicherheit zu leisten, soweit sie nicht Befriedigung verlangen können. Dieses Recht steht den Gläubigern jedoch nur zu, wenn sie glaubhaft machen, dass durch die Verschmelzung die Erfüllung ihrer Forderung gefährdet wird."
    },
    {
      "date": "2025-06-16",
      "id": "112355",
      "original_text": "Registerbekanntmachung nach dem Umwandlungsgesetz\nHessen Amtsgericht Wetzlar HRA 8170\nZenit Design - David Strauch e. K. – Dillenburg",
      "type": "Registerbekanntmachung nach dem Umwandlungsgesetz",
      "state": "Hessen",
      "amtsgericht": "Amtsgericht Wetzlar",
      "registernummer": "HRA 8170",
      "registerart": "HRA",
      "company_name": "Zenit Design - David Strauch e. K.",
      "company_seat": "Dillenburg",
      "details": "16.06.2025 (Bekanntmachungsdatum)\n\nHessen Amtsgericht Wetzlar HRA 8170\nRegisterbekanntmachung nach dem Umwandlungsgesetz 16.06.2025 (Eintragungsdatum)\n\nZenit Design - David Strauch e. K.\nEinzelkaufmann / Einzelkauffrau\nDillenburg\n\nDen Gläubigern der an der Ausgliederung beteiligten Rechtsträger ist, wenn sie binnen sechs Monaten nach dem Tag, an dem die Eintragung der Ausgliederung in das Register des Sitzes desjenigen Rechtsträgers, dessen Gläubiger sie sind, nach §§ 125, 19 Absatz 3 UmwG bekannt gemacht worden ist, ihren Anspruch nach Grund und Höhe schriftlich anmelden, Sicherheit zu leisten, soweit sie nicht Befriedigung verlangen können. Dieses Recht steht den Gläubigern jedoch nur zu, wenn sie glaubhaft machen, dass durch die Ausgliederung die Erfüllung ihrer Forderung gefährdet wird."
    },
    {
      "date": "2025-06-16",
      "id": "112356",
      "original_text": "Registerbekanntmachung nach dem Umwandlungsgesetz\nHessen Amtsgericht Frankfurt am Main HRB 83867\nAdrett Immobilienleasing GmbH – Eschborn",
      "type": "Registerbekanntmachung nach dem Umwandlungsgesetz",
      "state": "Hessen",
      "amtsgericht": "Amtsgericht Frankfurt am Main",
      "registernummer": "HRB 83867",
      "registerart": "HRB",
      "company_name": "Adrett Immobilienleasing GmbH",
      "company_seat": "Eschborn",
      "details": "16.06.2025 (Bekanntmachungsdatum)\n\nHessen Amtsgericht Frankfurt am Main HRB 83867\nRegisterbekanntmachung nach dem Umwandlungsgesetz 16.06.2025 (Eintragungsdatum)\n\nAdrett Immobilienleasing GmbH\nGesellschaft mit beschränkter Haftung\nEschborn\n\nDen Gläubigern der an der Verschmelzung beteiligten Rechtsträger ist, wenn sie binnen sechs Monaten nach dem Tag, an dem die Eintragung der Verschmelzung in das Register des Sitzes desjenigen Rechtsträgers, dessen Gläubiger sie sind, nach § 19 Absatz 3 UmwG bekannt gemacht worden ist, ihren Anspruch nach Grund und Höhe schriftlich anmelden, Sicherheit zu leisten, soweit sie nicht Befriedigung verlangen können. Dieses Recht steht den Gläubigern jedoch nur zu, wenn sie glaubhaft machen, dass durch die Verschmelzung die Erfüllung ihrer Forderung gefährdet wird."
    },
    {
      "date": "2025-06-16",
      "id": "112357",
      "original_text": "Registerbekanntmachung nach dem Umwandlungsgesetz\nHessen Amtsgericht Frankfurt am Main HRB 121745\nTOMS LOFT GmbH – Frankfurt am Main",
      "type": "Registerbekanntmachung nach dem Umwandlungsgesetz",
      "state": "Hessen",
      "amtsgericht": "Amtsgericht Frankfurt am Main",
      "registernummer": "HRB 121745",
      "registerart": "HRB",
      "company_name": "TOMS LOFT GmbH",
      "company_seat": "Frankfurt am Main",
      "details": "16.06.2025 (Bekanntmachungsdatum)\n\nHessen Amtsgericht Frankfurt am Main HRB 121745\nRegisterbekanntmachung nach dem Umwandlungsgesetz 12.05.2025 (Eintragungsdatum)\n\nTOMS LOFT GmbH\nGesellschaft mit beschränkter Haftung\nFrankfurt am Main\n\nDen Gläubigern der an der Verschmelzung beteiligten Rechtsträger ist, wenn sie binnen sechs Monaten nach dem Tag, an dem die Eintragung der Verschmelzung in das Register des Sitzes desjenigen Rechtsträgers, dessen Gläubiger sie sind, nach § 19 Absatz 3 UmwG bekannt gemacht worden ist, ihren Anspruch nach Grund und Höhe schriftlich anmelden, Sicherheit zu leisten, soweit sie nicht Befriedigung verlangen können. Dieses Recht steht den Gläubigern jedoch nur zu, wenn sie glaubhaft machen, dass durch die Verschmelzung die Erfüllung ihrer Forderung gefährdet wird."
    },
    {
      "date": "2025-06-16",
      "id": "112358",
      "original_text": "Einreichung neuer Dokumente\nHessen Amtsgericht Frankfurt am Main HRB 71290\nSTADA Arzneimittel Aktiengesellschaft – Bad Vilbel",
      "type": "Einreichung neuer Dokumente",
      "state": "Hessen",
      "amtsgericht": "Amtsgericht Frankfurt am Main",
      "registernummer": "HRB 71290",
      "registerart": "HRB",
      "company_name": "STADA Arzneimittel Aktiengesellschaft",
      "company_seat": "Bad Vilbel",
      "details": "16.06.2025 (Bekanntmachungsdatum)\n\nHessen Amtsgericht Frankfurt am Main HRB 71290\nEinreichung neuer Dokumente\n\nSTADA Arzneimittel Aktiengesellschaft\nAktiengesellschaft\nBad Vilbel\n\nDurch eine Änderung in den Personen der Aufsichtsratsmitglieder ist eine Liste der Mitglieder des Aufsichtsrates zum Handelsregister eingereicht worden."
    },
    {
      "date": "2025-06-16",
      "id": "112359",
      "original_text": "Einreichung neuer Dokumente\nHessen Amtsgericht Frankfurt am Main HRB 115588\nFIDUS Finanz AG – Frankfurt am Main",
      "type": "Einreichung neuer Dokumente",
      "state": "Hessen",
      "amtsgericht": "Amtsgericht Frankfurt am Main",
      "registernummer": "HRB 115588",
      "registerart": "HRB",
      "company_name": "FIDUS Finanz AG",
      "company_seat": "Frankfurt am Main",
      "details": "16.06.2025 (Bekanntmachungsdatum)\n\nHessen Amtsgericht Frankfurt am Main HRB 115588\nEinreichung neuer Dokumente\n\nFIDUS Finanz AG\nAktiengesellschaft\nFrankfurt am Main\n\nDurch eine Änderung in den Personen der Aufsichtsratsmitglieder ist eine Liste der Mitglieder des Aufsichtsrates zum Handelsregister eingereicht worden."
    },
    {
      "date": "2025-06-16",
      "id": "112360",
      "original_text": "Registerbekanntmachung nach dem Umwandlungsgesetz\nHessen Amtsgericht Frankfurt am Main HRB 122958\nLifeCredit - Die Kreditvermittler GmbH – Frankfurt am Main",
      "type": "Registerbekanntmachung nach dem Umwandlungsgesetz",
      "state": "Hessen",
      "amtsgericht": "Amtsgericht Frankfurt am Main",
      "registernummer": "HRB 122958",
      "registerart": "HRB",
      "company_name": "LifeCredit - Die Kreditvermittler GmbH",
      "company_seat": "Frankfurt am Main",
      "details": "16.06.2025 (Bekanntmachungsdatum)\n\nHessen Amtsgericht Frankfurt am Main HRB 122958\nRegisterbekanntmachung nach dem Umwandlungsgesetz 16.06.2025 (Eintragungsdatum)\n\nLifeCredit - Die Kreditvermittler GmbH\nGesellschaft mit beschränkter Haftung\nFrankfurt am Main\n\nDen Gläubigern der an der Verschmelzung beteiligten Rechtsträger ist, wenn sie binnen sechs Monaten nach dem Tag, an dem die Eintragung der Verschmelzung in das Register des Sitzes derjenigen Rechtsträger deren Gläubiger sie sind, nach § 19 Absatz 3 UmwG bekannt gemacht worden ist, ihren Anspruch nach Grund und Höhe schriftlich anmelden, Sicherheit zu leisten, soweit sie nicht Befriedigung verlangen können. Dieses Recht steht den Gläubigern jedoch nur zu, wenn sie glaubhaft machen, dass durch die Verschmelzung die Erfüllung ihrer Forderung gefährdet wird."
    },
    {
      "date": "2025-06-16",
      "id": "112361",
      "original_text": "Registerbekanntmachung nach dem Umwandlungsgesetz\nHessen Amtsgericht Kassel GnR 884\nCURAPRO Wohnungsbau SCE mit beschränkter Haftung – Vellmar",
      "type": "Registerbekanntmachung nach dem Umwandlungsgesetz",
      "state": "Hessen",
      "amtsgericht": "Amtsgericht Kassel",
      "registernummer": "GnR 884",
      "registerart": "GnR",
      "company_name": "CURAPRO Wohnungsbau SCE mit beschränkter Haftung",
      "company_seat": "Vellmar",
      "details": "16.06.2025 (Bekanntmachungsdatum)\n\nHessen Amtsgericht Kassel GnR 884\nRegisterbekanntmachung nach dem Umwandlungsgesetz 16.06.2025 (Eintragungsdatum)\n\nCURAPRO Wohnungsbau SCE mit beschränkter Haftung\nEuropäische Genossenschaft (SCE)\nVellmar\n\nDen Gläubigern der an der Verschmelzung beteiligten Rechtsträger ist, wenn sie binnen sechs Monaten nach dem Tag, an dem die Eintragung der Verschmelzung in das Register des Sitzes desjenigen Rechtsträgers, dessen Gläubiger sie sind, nach §§ 122a Absatz 2, 19 Absatz 3 UmwG bekannt gemacht worden ist, ihren Anspruch nach Grund und Höhe schriftlich anmelden, Sicherheit zu leisten, soweit sie nicht Befriedigung verlangen können. Dieses Recht steht den Gläubigern jedoch nur zu, wenn sie glaubhaft machen, dass durch die Verschmelzung die Erfüllung ihrer Forderung gefährdet wird."
    },
    {
      "date": "2025-06-16",
      "id": "112362",
      "original_text": "Registerbekanntmachung nach dem Umwandlungsgesetz\nHessen Amtsgericht Frankfurt am Main HRB 77739\nOSTARRICHI Immobilienleasing GmbH – Eschborn",
      "type": "Registerbekanntmachung nach dem Umwandlungsgesetz",
      "state": "Hessen",
      "amtsgericht": "Amtsgericht Frankfurt am Main",
      "registernummer": "HRB 77739",
      "registerart": "HRB",
      "company_name": "OSTARRICHI Immobilienleasing GmbH",
      "company_seat": "Eschborn",
      "details": "16.06.2025 (Bekanntmachungsdatum)\n\nHessen Amtsgericht Frankfurt am Main HRB 77739\nRegisterbekanntmachung nach dem Umwandlungsgesetz 16.06.2025 (Eintragungsdatum)\n\nOSTARRICHI Immobilienleasing GmbH\nGesellschaft mit beschränkter Haftung\nEschborn\n\nDen Gläubigern der an der Verschmelzung beteiligten Rechtsträger ist, wenn sie binnen sechs Monaten nach dem Tag, an dem die Eintragung der Verschmelzung in das Register des Sitzes desjenigen Rechtsträgers, dessen Gläubiger sie sind, nach § 19 Absatz 3 UmwG bekannt gemacht worden ist, ihren Anspruch nach Grund und Höhe schriftlich anmelden, Sicherheit zu leisten, soweit sie nicht Befriedigung verlangen können. Dieses Recht steht den Gläubigern jedoch nur zu, wenn sie glaubhaft machen, dass durch die Verschmelzung die Erfüllung ihrer Forderung gefährdet wird."
    },
    {
      "date": "2025-06-16",
      "id": "112363",
      "original_text": "Registerbekanntmachung nach dem Umwandlungsgesetz\nHessen Amtsgericht Kassel HRA 18325\nWenderoth Industrievertretung e.K. – Baunatal",
      "type": "Registerbekanntmachung nach dem Umwandlungsgesetz",
      "state": "Hessen",
      "amtsgericht": "Amtsgericht Kassel",
      "registernummer": "HRA 18325",
      "registerart": "HRA",
      "company_name": "Wenderoth Industrievertretung e.K.",
      "company_seat": "Baunatal",
      "details": "16.06.2025 (Bekanntmachungsdatum)\n\nHessen Amtsgericht Kassel HRA 18325\nRegisterbekanntmachung nach dem Umwandlungsgesetz 16.06.2025 (Eintragungsdatum)\n\nWenderoth Industrievertretung e.K.\nEinzelkaufmann / Einzelkauffrau\nBaunatal\n\nDen Gläubigern der an der Ausgliederung beteiligten Rechtsträger ist, wenn sie binnen sechs Monaten nach dem Tag, an dem die Eintragung der Ausgliederung in das Register des Sitzes desjenigen Rechtsträgers, dessen Gläubiger sie sind, nach §§ 125, 19 Absatz 3 UmwG bekannt gemacht worden ist, ihren Anspruch nach Grund und Höhe schriftlich anmelden, Sicherheit zu leisten, soweit sie nicht Befriedigung verlangen können. Dieses Recht steht den Gläubigern jedoch nur zu, wenn sie glaubhaft machen, dass durch die Ausgliederung die Erfüllung ihrer Forderung gefährdet wird."
    },
    {
      "date": "2025-06-16",
      "id": "112364",
      "original_text": "Einreichung neuer Dokumente\nHessen Amtsgericht Offenbach am Main HRB 11361\nOffenbacher Stadtmarketinggesellschaft mbH – Offenbach am Main",
      "type": "Einreichung neuer Dokumente",
      "state": "Hessen",
      "amtsgericht": "Amtsgericht Offenbach am Main",
      "registernummer": "HRB 11361",
      "registerart": "HRB",
      "company_name": "Offenbacher Stadtmarketinggesellschaft mbH",
      "company_seat": "Offenbach am Main",
      "details": "16.06.2025 (Bekanntmachungsdatum)\n\nHessen Amtsgericht Offenbach am Main HRB 11361\nEinreichung neuer Dokumente\n\nOffenbacher Stadtmarketinggesellschaft mbH\nGesellschaft mit beschränkter Haftung\nOffenbach am Main\n\nDurch eine Änderung in den Personen der Aufsichtsratsmitglieder ist eine Liste der Mitglieder des Aufsichtsrates zum Handelsregister eingereicht worden."
    },
    {
      "date": "2025-06-16",
      "id": "112365",
      "original_text": "Einreichung neuer Dokumente\nHessen Amtsgericht Friedberg HRB 9028\nInfios GmbH – Bad Nauheim",
      "type": "Einreichung neuer Dokumente",
      "state": "Hessen",
      "amtsgericht": "Amtsgericht Friedberg",
      "registernummer": "HRB 9028",
      "registerart": "HRB",
      "company_name": "Infios GmbH",
      "company_seat": "Bad Nauheim",
      "details": "16.06.2025 (Bekanntmachungsdatum)\n\nHessen Amtsgericht Friedberg HRB 9028\nEinreichung neuer Dokumente\n\nInfios GmbH\nGesellschaft mit beschränkter Haftung\nBad Nauheim\n\nDurch eine Änderung in den Personen der Aufsichtsratsmitglieder ist eine Liste der Mitglieder des Aufsichtsrates zum Handelsregister eingereicht worden."
    }
  ]
}