{
  "date": "2025-06-23",
  "date_of_scrape": "2025-06-24T04:16:57.358Z",
  "tool_version": "0.2.0",
  "number_of_announcements": 140,
  "announcements": [
    {
      "date": "2025-06-23",
      "id": "112941",
      "original_text": "Registerbekanntmachung nach dem Umwandlungsgesetz\nBerlin Amtsgericht Berlin (Charlottenburg) HRB 38874\nBeta Systems Software Aktiengesellschaft – Berlin",
      "type": "Registerbekanntmachung nach dem Umwandlungsgesetz",
      "state": "Berlin",
      "amtsgericht": "Amtsgericht Berlin (Charlottenburg)",
      "registernummer": "HRB 38874",
      "registerart": "HRB",
      "company_name": "Beta Systems Software Aktiengesellschaft",
      "company_seat": "Berlin",
      "details": "23.06.2025 (Bekanntmachungsdatum)\n\nBerlin Amtsgericht Berlin (Charlottenburg) HRB 38874\nRegisterbekanntmachung nach dem Umwandlungsgesetz 19.06.2025 (Eintragungsdatum)\n\nBeta Systems Software Aktiengesellschaft\nAktiengesellschaft\nBerlin\n\nZu Eintragungsnummer 74 vom 19.06.2025 wird als nicht eingetragen veröffentlicht:Den Gläubigern der an der Verschmelzung beteiligten Rechtsträger ist, wenn sie binnen sechs Monaten nach dem Tag, an dem die Eintragung der Verschmelzung in das Register des Sitzes desjenigen Rechtsträgers, dessen Gläubiger sie sind, als bekannt gemacht gilt, ihren Anspruch nach Grund und Höhe schriftlich anmelden, Sicherheit zu leisten, soweit sie nicht Befriedigung verlangen können. Dieses Recht steht den Gläubigern jedoch nur zu, wenn sie glaubhaft machen, dass durch die Verschmelzung die Erfüllung ihrer Forderung gefährdet wird. Das Recht, Sicherheitsleistung zu verlangen, steht Gläubigern nicht zu, die im Falle der Insolvenz ein Recht auf vorzugsweise Befriedigung aus einer Deckungsmasse haben, die nach gesetzlicher Vorschrift zu ihrem Schutz errichtet und staatlich überwacht ist."
    },
    {
      "date": "2025-06-23",
      "id": "112942",
      "original_text": "Löschungsankündigung\nBaden-Württemberg Amtsgericht Mannheim HRB 511398\nEUCREA Industrieservice GmbH – Kürnbach",
      "type": "Löschungsankündigung",
      "state": "Baden-Württemberg",
      "amtsgericht": "Amtsgericht Mannheim",
      "registernummer": "HRB 511398",
      "registerart": "HRB",
      "company_name": "EUCREA Industrieservice GmbH",
      "company_seat": "Kürnbach",
      "details": "23.06.2025 (Bekanntmachungsdatum)\n\nBaden-Württemberg Amtsgericht Mannheim HRB 511398\nLöschungsankündigung\n\nEUCREA Industrieservice GmbH\nGesellschaft mit beschränkter Haftung\nKürnbach\n\nDas Gericht beabsichtigt, die Gesellschaft wegen Vermögenslosigkeit im Handelsregister von Amts wegen nach § 394 FamFG zu löschen. Die Frist zur Geltendmachung eines Widerspruchs gegen die beabsichtigte Löschung ist auf einen Monat ab Veröffentlichung bestimmt."
    },
    {
      "date": "2025-06-23",
      "id": "112943",
      "original_text": "Löschungsankündigung\nBrandenburg Amtsgericht Potsdam HRB 38193\nClara Care UG (haftungsbeschränkt) – Zossen",
      "type": "Löschungsankündigung",
      "state": "Brandenburg",
      "amtsgericht": "Amtsgericht Potsdam",
      "registernummer": "HRB 38193",
      "registerart": "HRB",
      "company_name": "Clara Care UG (haftungsbeschränkt)",
      "company_seat": "Zossen",
      "details": "23.06.2025 (Bekanntmachungsdatum)\n\nBrandenburg Amtsgericht Potsdam HRB 38193\nLöschungsankündigung\n\nClara Care UG (haftungsbeschränkt)\nGesellschaft mit beschränkter Haftung\nZossen\n\nBei der nachstehenden Gesellschaft wird das Amtslöschungsverfahren gemäß § 394 FamFG eingeleitet. Widerspruchsfrist 8 Wochen."
    },
    {
      "date": "2025-06-23",
      "id": "112944",
      "original_text": "Registerbekanntmachung nach dem Umwandlungsgesetz\nBaden-Württemberg Amtsgericht Stuttgart HRA 13874\nMakadamwerk Schwaben GmbH & Co. KG – Stuttgart",
      "type": "Registerbekanntmachung nach dem Umwandlungsgesetz",
      "state": "Baden-Württemberg",
      "amtsgericht": "Amtsgericht Stuttgart",
      "registernummer": "HRA 13874",
      "registerart": "HRA",
      "company_name": "Makadamwerk Schwaben GmbH & Co. KG",
      "company_seat": "Stuttgart",
      "details": "23.06.2025 (Bekanntmachungsdatum)\n\nBaden-Württemberg Amtsgericht Stuttgart HRA 13874\nRegisterbekanntmachung nach dem Umwandlungsgesetz 23.06.2025 (Eintragungsdatum)\n\nMakadamwerk Schwaben GmbH & Co. KG\nKommanditgesellschaft\nStuttgart\n\nDen Gläubigern der an der Verschmelzung beteiligten Rechtsträger ist, wenn sie binnen sechs Monaten nach dem Tag, an dem die Eintragung der Verschmelzung in das Register des Sitzes desjenigen Rechtsträgers, dessen Gläubiger sie sind, nach § 19 Abs. 3 UmwG als bekanntgemacht gilt, ihren Anspruch nach Grund und Höhe schriftlich anmelden, Sicherheit zu leisten, soweit sie nicht Befriedigung verlangen können. Dieses Recht steht den Gläubigern jedoch nur zu, wenn sie glaubhaft machen, dass durch die Verschmelzung die Erfüllung ihrer Forderung gefährdet wird."
    },
    {
      "date": "2025-06-23",
      "id": "112945",
      "original_text": "Löschungsankündigung\nBaden-Württemberg Amtsgericht Freiburg HRB 716076\nstage one GmbH – Weil am Rhein",
      "type": "Löschungsankündigung",
      "state": "Baden-Württemberg",
      "amtsgericht": "Amtsgericht Freiburg",
      "registernummer": "HRB 716076",
      "registerart": "HRB",
      "company_name": "stage one GmbH",
      "company_seat": "Weil am Rhein",
      "details": "23.06.2025 (Bekanntmachungsdatum)\n\nBaden-Württemberg Amtsgericht Freiburg HRB 716076\nLöschungsankündigung\n\nstage one GmbH\nGesellschaft mit beschränkter Haftung\nWeil am Rhein\n\nAls nicht eingetragen wird bekanntgemacht:\nDas Gericht beabsichtigt, die Gesellschaft wegen Vermögenslosigkeit im Handelsregister von Amts wegen nach § 394 FamFG zu löschen. Die Frist zur Geltendmachung eines Widerspruchs gegen die beabsichtigte Löschung ist auf einen Monat ab Veröffentlichung bestimmt."
    },
    {
      "date": "2025-06-23",
      "id": "112946",
      "original_text": "Löschungsankündigung\nBrandenburg Amtsgericht Potsdam HRB 37429\nCentral International eCommerce GmbH – Zossen",
      "type": "Löschungsankündigung",
      "state": "Brandenburg",
      "amtsgericht": "Amtsgericht Potsdam",
      "registernummer": "HRB 37429",
      "registerart": "HRB",
      "company_name": "Central International eCommerce GmbH",
      "company_seat": "Zossen",
      "details": "23.06.2025 (Bekanntmachungsdatum)\n\nBrandenburg Amtsgericht Potsdam HRB 37429\nLöschungsankündigung\n\nCentral International eCommerce GmbH\nGesellschaft mit beschränkter Haftung\nZossen\n\nBei der nachstehenden Gesellschaft wird das Amtslöschungsverfahren gemäß § 394 FamFG eingeleitet. Widerspruchsfrist 8 Wochen."
    },
    {
      "date": "2025-06-23",
      "id": "112947",
      "original_text": "Einreichung neuer Dokumente\nBerlin Amtsgericht Berlin (Charlottenburg) HRB 153634\nFilm House Germany AG – Berlin",
      "type": "Einreichung neuer Dokumente",
      "state": "Berlin",
      "amtsgericht": "Amtsgericht Berlin (Charlottenburg)",
      "registernummer": "HRB 153634",
      "registerart": "HRB",
      "company_name": "Film House Germany AG",
      "company_seat": "Berlin",
      "details": "23.06.2025 (Bekanntmachungsdatum)\n\nBerlin Amtsgericht Berlin (Charlottenburg) HRB 153634\nEinreichung neuer Dokumente\n\nFilm House Germany AG\nAktiengesellschaft\nBerlin\n\nAls nicht eingetragen wird veröffentlicht: Die Gesellschaft hat den Entwurf eines Verschmelzungsvertrags zwischen der Gesellschaft als übernehmenden Rechtsträger und der Egoli Tossell Film GmbH mit Sitz in Berlin (Amtsgericht Charlottenburg, HRB 151306 B) als übertragendem Rechtsträger zum Handelsregister des Amtsgerichts Charlottenburg eingereicht."
    },
    {
      "date": "2025-06-23",
      "id": "112948",
      "original_text": "Einreichung neuer Dokumente\nBaden-Württemberg Amtsgericht Stuttgart HRB 778600\nDaimler Truck Holding AG – Stuttgart",
      "type": "Einreichung neuer Dokumente",
      "state": "Baden-Württemberg",
      "amtsgericht": "Amtsgericht Stuttgart",
      "registernummer": "HRB 778600",
      "registerart": "HRB",
      "company_name": "Daimler Truck Holding AG",
      "company_seat": "Stuttgart",
      "details": "23.06.2025 (Bekanntmachungsdatum)\n\nBaden-Württemberg Amtsgericht Stuttgart HRB 778600\nEinreichung neuer Dokumente\n\nDaimler Truck Holding AG\nAktiengesellschaft\nStuttgart\n\nDie Gesellschaft hat am 30.04.2025 die Liste über die Zusammensetzung des Aufsichtsrats zum Handelsregister eingereicht."
    },
    {
      "date": "2025-06-23",
      "id": "112949",
      "original_text": "Löschungsankündigung\nBaden-Württemberg Amtsgericht Ulm HRB 738073\nLimitless Labs GmbH – Ravensburg",
      "type": "Löschungsankündigung",
      "state": "Baden-Württemberg",
      "amtsgericht": "Amtsgericht Ulm",
      "registernummer": "HRB 738073",
      "registerart": "HRB",
      "company_name": "Limitless Labs GmbH",
      "company_seat": "Ravensburg",
      "details": "23.06.2025 (Bekanntmachungsdatum)\n\nBaden-Württemberg Amtsgericht Ulm HRB 738073\nLöschungsankündigung\n\nLimitless Labs GmbH\nGesellschaft mit beschränkter Haftung\nRavensburg\n\nDas Gericht beabsichtigt, die Gesellschaft wegen Vermögenslosigkeit im Handelsregister von Amts wegen nach § 394 FamFG zu löschen. Die Frist zur Geltendmachung eines Widerspruchs gegen die beabsichtigte Löschung ist auf  einen Monat ab Veröffentlichung bestimmt."
    },
    {
      "date": "2025-06-23",
      "id": "112950",
      "original_text": "Löschungsankündigung\nSchleswig-Holstein Amtsgericht Lübeck HRB 14302\nEcoFloor GmbH – Bargteheide",
      "type": "Löschungsankündigung",
      "state": "Schleswig-Holstein",
      "amtsgericht": "Amtsgericht Lübeck",
      "registernummer": "HRB 14302",
      "registerart": "HRB",
      "company_name": "EcoFloor GmbH",
      "company_seat": "Bargteheide",
      "details": "23.06.2025 (Bekanntmachungsdatum)\n\nSchleswig-Holstein Amtsgericht Lübeck HRB 14302\nLöschungsankündigung\n\nEcoFloor GmbH\nGesellschaft mit beschränkter Haftung\nBargteheide\n\nEs ist die Löschung der nachstehenden Gesellschaft wegen Vermögenslosigkeit gemäß § 394 FamFG beabsichtigt."
    },
    {
      "date": "2025-06-23",
      "id": "112951",
      "original_text": "Registerbekanntmachung nach dem Umwandlungsgesetz\nBaden-Württemberg Amtsgericht Freiburg HRB 701084\nBechtle GmbH – Offenburg",
      "type": "Registerbekanntmachung nach dem Umwandlungsgesetz",
      "state": "Baden-Württemberg",
      "amtsgericht": "Amtsgericht Freiburg",
      "registernummer": "HRB 701084",
      "registerart": "HRB",
      "company_name": "Bechtle GmbH",
      "company_seat": "Offenburg",
      "details": "23.06.2025 (Bekanntmachungsdatum)\n\nBaden-Württemberg Amtsgericht Freiburg HRB 701084\nRegisterbekanntmachung nach dem Umwandlungsgesetz 23.06.2025 (Eintragungsdatum)\n\nBechtle GmbH\nGesellschaft mit beschränkter Haftung\nOffenburg\n\nDen Gläubigern der an der Verschmelzung beteiligten Rechtsträger ist, wenn sie binnen sechs Monaten nach dem Tag, an dem die Eintragung der Verschmelzung in das Register des Sitzes desjenigen Rechtsträgers, dessen Gläubiger sie sind, nach § 19 Abs. 3 UmwG als bekanntgemacht gilt, ihren Anspruch nach Grund und Höhe schriftlich anmelden, Sicherheit zu leisten, soweit sie nicht Befriedigung verlangen können. Dieses Recht steht den Gläubigern jedoch nur zu, wenn sie glaubhaft machen, dass durch die Verschmelzung die Erfüllung ihrer Forderung gefährdet wird."
    },
    {
      "date": "2025-06-23",
      "id": "112952",
      "original_text": "Registerbekanntmachung nach dem Umwandlungsgesetz\nBaden-Württemberg Amtsgericht Stuttgart HRA 741815\nAndrea Bohn e. K. – Ilshofen",
      "type": "Registerbekanntmachung nach dem Umwandlungsgesetz",
      "state": "Baden-Württemberg",
      "amtsgericht": "Amtsgericht Stuttgart",
      "registernummer": "HRA 741815",
      "registerart": "HRA",
      "company_name": "Andrea Bohn e. K.",
      "company_seat": "Ilshofen",
      "details": "23.06.2025 (Bekanntmachungsdatum)\n\nBaden-Württemberg Amtsgericht Stuttgart HRA 741815\nRegisterbekanntmachung nach dem Umwandlungsgesetz 23.06.2025 (Eintragungsdatum)\n\nAndrea Bohn e. K.\nEinzelkaufmann / Einzelkauffrau\nIlshofen\n\nDen Gläubigern der an der Ausgliederung beteiligten Rechtsträger ist, wenn sie binnen sechs Monaten nach dem Tag, an dem die Eintragung der Ausgliederung in das Register des Sitzes desjenigen Rechtsträgers, dessen Gläubiger sie sind, nach § 19 Abs. 3 UmwG als bekanntgemacht gilt, ihren Anspruch nach Grund und Höhe schriftlich anmelden, Sicherheit zu leisten, soweit sie nicht Befriedigung verlangen können. Dieses Recht steht den Gläubigern jedoch nur zu, wenn sie glaubhaft machen, dass durch die Ausgliederung die Erfüllung ihrer Forderung gefährdet wird."
    },
    {
      "date": "2025-06-23",
      "id": "112953",
      "original_text": "Registerbekanntmachung nach dem Umwandlungsgesetz\nMecklenburg-Vorpommern Amtsgericht Neubrandenburg HRB 6819\nKEG- Kommunale Entwicklungsgesellschaft mbH – Neubrandenburg",
      "type": "Registerbekanntmachung nach dem Umwandlungsgesetz",
      "state": "Mecklenburg-Vorpommern",
      "amtsgericht": "Amtsgericht Neubrandenburg",
      "registernummer": "HRB 6819",
      "registerart": "HRB",
      "company_name": "KEG- Kommunale Entwicklungsgesellschaft mbH",
      "company_seat": "Neubrandenburg",
      "details": "23.06.2025 (Bekanntmachungsdatum)\n\nMecklenburg-Vorpommern Amtsgericht Neubrandenburg HRB 6819\nRegisterbekanntmachung nach dem Umwandlungsgesetz 23.06.2025 (Eintragungsdatum)\n\nKEG- Kommunale Entwicklungsgesellschaft mbH\nGesellschaft mit beschränkter Haftung\nNeubrandenburg\n\nAls nicht eingetragen wird veröffentlicht: Den Gläubigern der an der Verschmelzung beteiligten Rechtsträger ist, wenn sie binnen sechs Monaten nach dem Tag, an dem die Eintragung der Verschmelzung in das Register des Sitzes desjenigen Rechtsträgers, dessen Gläubiger sie sind, nach § 19 Abs. 3 UmwG als bekannt gemacht gilt,\nihren Anspruch nach Grund und Höhe in Textform anmelden, Sicherheit zu leisten, soweit sie nicht Befriedigung verlangen können. Dieses Recht steht den Gläubigern jedoch nur zu, wenn sie glaubhaft machen, dass durch die Verschmelzung die Erfüllung der Forderung gefährdet wird."
    },
    {
      "date": "2025-06-23",
      "id": "112954",
      "original_text": "Einreichung neuer Dokumente\nBerlin Amtsgericht Berlin (Charlottenburg) HRB 34388\nGrundbesitz Am Köllnischen Park GmbH – Berlin",
      "type": "Einreichung neuer Dokumente",
      "state": "Berlin",
      "amtsgericht": "Amtsgericht Berlin (Charlottenburg)",
      "registernummer": "HRB 34388",
      "registerart": "HRB",
      "company_name": "Grundbesitz Am Köllnischen Park GmbH",
      "company_seat": "Berlin",
      "details": "23.06.2025 (Bekanntmachungsdatum)\n\nBerlin Amtsgericht Berlin (Charlottenburg) HRB 34388\nEinreichung neuer Dokumente\n\nGrundbesitz Am Köllnischen Park GmbH\nGesellschaft mit beschränkter Haftung\nBerlin\n\nAls nicht eingetragen wird veröffentlicht: Der andere Vertragsteil hat den Gläubigern dieses Rechtsträgers, deren Forderungen begründet worden sind, bevor die Eintragung der Beendigung dieses Vertrages in das Handelsregister nach § 10 des Handelsgesetzbuches als bekannt gemacht gilt, Sicherheit zu leisten, wenn sie sich binnen sechs Monaten nach der Bekanntmachung der Eintragung zu diesem Zweck bei ihm melden. Dieses Recht steht den Gläubigern nicht zu, die im Fall des Insolvenzverfahrens ein Recht auf vorzugsweise Befriedigung aus der Deckungsmasse haben, die nach gesetzlicher Vorschrift zu ihrem Schutz errichtet und staatlich überwacht ist."
    },
    {
      "date": "2025-06-23",
      "id": "112955",
      "original_text": "Registerbekanntmachung nach dem Umwandlungsgesetz\nBaden-Württemberg Amtsgericht Freiburg HRA 709043\nPacha e. K. – Villingen-Schwenningen",
      "type": "Registerbekanntmachung nach dem Umwandlungsgesetz",
      "state": "Baden-Württemberg",
      "amtsgericht": "Amtsgericht Freiburg",
      "registernummer": "HRA 709043",
      "registerart": "HRA",
      "company_name": "Pacha e. K.",
      "company_seat": "Villingen-Schwenningen",
      "details": "23.06.2025 (Bekanntmachungsdatum)\n\nBaden-Württemberg Amtsgericht Freiburg HRA 709043\nRegisterbekanntmachung nach dem Umwandlungsgesetz 23.06.2025 (Eintragungsdatum)\n\nPacha e. K.\nEinzelkaufmann / Einzelkauffrau\nVillingen-Schwenningen\n\nAls nicht eingetragen wird bekanntgemacht:\nDen Gläubigern der an der Ausgliederung beteiligten Rechtsträger ist, wenn sie binnen sechs Monaten nach dem Tag, an dem die Eintragung der Ausgliederung in das Register des Sitzes desjenigen Rechtsträgers, dessen Gläubiger sie sind, nach § 19 Abs. 3 UmwG als bekanntgemacht gilt, ihren Anspruch nach Grund und Höhe schriftlich anmelden, Sicherheit zu leisten, soweit sie nicht Befriedigung verlangen können. Dieses Recht steht den Gläubigern jedoch nur zu, wenn sie glaubhaft machen, dass durch die Ausgliederung die Erfüllung ihrer Forderung gefährdet wird."
    },
    {
      "date": "2025-06-23",
      "id": "112956",
      "original_text": "Einreichung neuer Dokumente\nBaden-Württemberg Amtsgericht Stuttgart HRB 762884\nDaimler Truck AG – Stuttgart",
      "type": "Einreichung neuer Dokumente",
      "state": "Baden-Württemberg",
      "amtsgericht": "Amtsgericht Stuttgart",
      "registernummer": "HRB 762884",
      "registerart": "HRB",
      "company_name": "Daimler Truck AG",
      "company_seat": "Stuttgart",
      "details": "23.06.2025 (Bekanntmachungsdatum)\n\nBaden-Württemberg Amtsgericht Stuttgart HRB 762884\nEinreichung neuer Dokumente\n\nDaimler Truck AG\nAktiengesellschaft\nStuttgart\n\nDie Gesellschaft hat am 23.06.2025 die Liste über die Zusammensetzung des Aufsichtsrats zum Handelsregister eingereicht."
    },
    {
      "date": "2025-06-23",
      "id": "112957",
      "original_text": "Registerbekanntmachung nach dem Umwandlungsgesetz\nBaden-Württemberg Amtsgericht Freiburg HRA 709109\nPacha Automation GmbH & Co. KG – Villingen-Schwenningen",
      "type": "Registerbekanntmachung nach dem Umwandlungsgesetz",
      "state": "Baden-Württemberg",
      "amtsgericht": "Amtsgericht Freiburg",
      "registernummer": "HRA 709109",
      "registerart": "HRA",
      "company_name": "Pacha Automation GmbH & Co. KG",
      "company_seat": "Villingen-Schwenningen",
      "details": "23.06.2025 (Bekanntmachungsdatum)\n\nBaden-Württemberg Amtsgericht Freiburg HRA 709109\nRegisterbekanntmachung nach dem Umwandlungsgesetz 23.06.2025 (Eintragungsdatum)\n\nPacha Automation GmbH & Co. KG\nKommanditgesellschaft\nVillingen-Schwenningen\n\nAls nicht eingetragen wird bekanntgemacht:\nDen Gläubigern der an der Ausgliederung beteiligten Rechtsträger ist, wenn sie binnen sechs Monaten nach dem Tag, an dem die Eintragung der Ausgliederung in das Register des Sitzes desjenigen Rechtsträgers, dessen Gläubiger sie sind, nach § 19 Abs. 3 UmwG als bekanntgemacht gilt, ihren Anspruch nach Grund und Höhe schriftlich anmelden, Sicherheit zu leisten, soweit sie nicht Befriedigung verlangen können. Dieses Recht steht den Gläubigern jedoch nur zu, wenn sie glaubhaft machen, dass durch die Ausgliederung die Erfüllung ihrer Forderung gefährdet wird."
    },
    {
      "date": "2025-06-23",
      "id": "112958",
      "original_text": "Registerbekanntmachung nach dem Umwandlungsgesetz\nBaden-Württemberg Amtsgericht Mannheim HRB 560593\nATW Metallbearbeitung Aluminium Technik Weirich GmbH – Königheim",
      "type": "Registerbekanntmachung nach dem Umwandlungsgesetz",
      "state": "Baden-Württemberg",
      "amtsgericht": "Amtsgericht Mannheim",
      "registernummer": "HRB 560593",
      "registerart": "HRB",
      "company_name": "ATW Metallbearbeitung Aluminium Technik Weirich GmbH",
      "company_seat": "Königheim",
      "details": "23.06.2025 (Bekanntmachungsdatum)\n\nBaden-Württemberg Amtsgericht Mannheim HRB 560593\nRegisterbekanntmachung nach dem Umwandlungsgesetz 23.06.2025 (Eintragungsdatum)\n\nATW Metallbearbeitung Aluminium Technik Weirich GmbH\nGesellschaft mit beschränkter Haftung\nKönigheim\n\nDen Gläubigern der an der Verschmelzung beteiligten Rechtsträger ist, wenn sie binnen sechs Monaten nach dem Tag, an dem die Eintragung der Verschmelzung in das Register des Sitzes desjenigen Rechtsträgers, dessen Gläubiger sie sind, nach § 19 Abs. 3 UmwG als bekanntgemacht gilt, ihren Anspruch nach Grund und Höhe schriftlich anmelden, Sicherheit zu leisten, soweit sie nicht Befriedigung verlangen können. Dieses Recht steht den Gläubigern jedoch nur zu, wenn sie glaubhaft machen, dass durch die Verschmelzung die Erfüllung ihrer Forderung gefährdet wird."
    },
    {
      "date": "2025-06-23",
      "id": "112959",
      "original_text": "Registerbekanntmachung nach dem Umwandlungsgesetz\nHamburg Amtsgericht Hamburg HRB 139162\nFonds 2 AvR Weimar Verwaltungs GmbH – Hamburg",
      "type": "Registerbekanntmachung nach dem Umwandlungsgesetz",
      "state": "Hamburg",
      "amtsgericht": "Amtsgericht Hamburg",
      "registernummer": "HRB 139162",
      "registerart": "HRB",
      "company_name": "Fonds 2 AvR Weimar Verwaltungs GmbH",
      "company_seat": "Hamburg",
      "details": "23.06.2025 (Bekanntmachungsdatum)\n\nHamburg Amtsgericht Hamburg HRB 139162\nRegisterbekanntmachung nach dem Umwandlungsgesetz 23.06.2025 (Eintragungsdatum)\n\nFonds 2 AvR Weimar Verwaltungs GmbH\nGesellschaft mit beschränkter Haftung\nHamburg\n\nAls nicht eingetragen wird bekannt gemacht:\nDen Gläubigern der an der Verschmelzung beteiligten Gesellschaften ist, wenn sie binnen sechs Monaten nach dem Tag, an dem die Eintragung der Verschmelzung in das Register des Sitzes desjenigen Rechtsträgers, dessen Gläubiger sie sind, nach § 19 Absatz 3 UmwG als bekannt gemacht gilt, ihren Anspruch nach Grund und Höhe schriftlich anmelden, Sicherheit zu leisten, soweit sie nicht Befriedigung verlangen können. Dieses Recht steht den Gläubigern jedoch nur zu, wenn sie glaubhaft machen, dass durch die Verschmelzung die Erfüllung ihrer Forderung gefährdet wird."
    },
    {
      "date": "2025-06-23",
      "id": "112960",
      "original_text": "Registerbekanntmachung nach dem Umwandlungsgesetz\nHamburg Amtsgericht Hamburg HRB 139020\nFonds 2 AvR München Verwaltungs GmbH – Hamburg",
      "type": "Registerbekanntmachung nach dem Umwandlungsgesetz",
      "state": "Hamburg",
      "amtsgericht": "Amtsgericht Hamburg",
      "registernummer": "HRB 139020",
      "registerart": "HRB",
      "company_name": "Fonds 2 AvR München Verwaltungs GmbH",
      "company_seat": "Hamburg",
      "details": "23.06.2025 (Bekanntmachungsdatum)\n\nHamburg Amtsgericht Hamburg HRB 139020\nRegisterbekanntmachung nach dem Umwandlungsgesetz 23.06.2025 (Eintragungsdatum)\n\nFonds 2 AvR München Verwaltungs GmbH\nGesellschaft mit beschränkter Haftung\nHamburg\n\nAls nicht eingetragen wird bekannt gemacht:\nDen Gläubigern der an der Verschmelzung beteiligten Gesellschaften ist, wenn sie binnen sechs Monaten nach dem Tag, an dem die Eintragung der Verschmelzung in das Register des Sitzes desjenigen Rechtsträgers, dessen Gläubiger sie sind, nach § 19 Absatz 3 UmwG als bekannt gemacht gilt, ihren Anspruch nach Grund und Höhe schriftlich anmelden, Sicherheit zu leisten, soweit sie nicht Befriedigung verlangen können. Dieses Recht steht den Gläubigern jedoch nur zu, wenn sie glaubhaft machen, dass durch die Verschmelzung die Erfüllung ihrer Forderung gefährdet wird."
    },
    {
      "date": "2025-06-23",
      "id": "112961",
      "original_text": "Registerbekanntmachung nach dem Umwandlungsgesetz\nHamburg Amtsgericht Hamburg HRB 138054\nFonds 2 AvR Dieburg Verwaltungs GmbH – Hamburg",
      "type": "Registerbekanntmachung nach dem Umwandlungsgesetz",
      "state": "Hamburg",
      "amtsgericht": "Amtsgericht Hamburg",
      "registernummer": "HRB 138054",
      "registerart": "HRB",
      "company_name": "Fonds 2 AvR Dieburg Verwaltungs GmbH",
      "company_seat": "Hamburg",
      "details": "23.06.2025 (Bekanntmachungsdatum)\n\nHamburg Amtsgericht Hamburg HRB 138054\nRegisterbekanntmachung nach dem Umwandlungsgesetz 23.06.2025 (Eintragungsdatum)\n\nFonds 2 AvR Dieburg Verwaltungs GmbH\nGesellschaft mit beschränkter Haftung\nHamburg\n\nAls nicht eingetragen wird bekannt gemacht:\nDen Gläubigern der an der Verschmelzung beteiligten Gesellschaften ist, wenn sie binnen sechs Monaten nach dem Tag, an dem die Eintragung der Verschmelzung in das Register des Sitzes desjenigen Rechtsträgers, dessen Gläubiger sie sind, nach § 19 Absatz 3 UmwG als bekannt gemacht gilt, ihren Anspruch nach Grund und Höhe schriftlich anmelden, Sicherheit zu leisten, soweit sie nicht Befriedigung verlangen können. Dieses Recht steht den Gläubigern jedoch nur zu, wenn sie glaubhaft machen, dass durch die Verschmelzung die Erfüllung ihrer Forderung gefährdet wird."
    },
    {
      "date": "2025-06-23",
      "id": "112962",
      "original_text": "Registerbekanntmachung nach dem Umwandlungsgesetz\nHamburg Amtsgericht Hamburg HRB 137263\nFonds 2 AvR Uhlenhorst Verwaltungs GmbH – Hamburg",
      "type": "Registerbekanntmachung nach dem Umwandlungsgesetz",
      "state": "Hamburg",
      "amtsgericht": "Amtsgericht Hamburg",
      "registernummer": "HRB 137263",
      "registerart": "HRB",
      "company_name": "Fonds 2 AvR Uhlenhorst Verwaltungs GmbH",
      "company_seat": "Hamburg",
      "details": "23.06.2025 (Bekanntmachungsdatum)\n\nHamburg Amtsgericht Hamburg HRB 137263\nRegisterbekanntmachung nach dem Umwandlungsgesetz 23.06.2025 (Eintragungsdatum)\n\nFonds 2 AvR Uhlenhorst Verwaltungs GmbH\nGesellschaft mit beschränkter Haftung\nHamburg\n\nAls nicht eingetragen wird bekannt gemacht:\nDen Gläubigern der an der Verschmelzung beteiligten Gesellschaften ist, wenn sie binnen sechs Monaten nach dem Tag, an dem die Eintragung der Verschmelzung in das Register des Sitzes desjenigen Rechtsträgers, dessen Gläubiger sie sind, nach § 19 Absatz 3 UmwG als bekannt gemacht gilt, ihren Anspruch nach Grund und Höhe schriftlich anmelden, Sicherheit zu leisten, soweit sie nicht Befriedigung verlangen können. Dieses Recht steht den Gläubigern jedoch nur zu, wenn sie glaubhaft machen, dass durch die Verschmelzung die Erfüllung ihrer Forderung gefährdet wird."
    },
    {
      "date": "2025-06-23",
      "id": "112963",
      "original_text": "Löschungsankündigung\nBerlin Amtsgericht Berlin (Charlottenburg) HRB 212298\nSWN Bauprojekte GmbH – Berlin",
      "type": "Löschungsankündigung",
      "state": "Berlin",
      "amtsgericht": "Amtsgericht Berlin (Charlottenburg)",
      "registernummer": "HRB 212298",
      "registerart": "HRB",
      "company_name": "SWN Bauprojekte GmbH",
      "company_seat": "Berlin",
      "details": "23.06.2025 (Bekanntmachungsdatum)\n\nBerlin Amtsgericht Berlin (Charlottenburg) HRB 212298\nLöschungsankündigung\n\nSWN Bauprojekte GmbH\nGesellschaft mit beschränkter Haftung\nBerlin\n\nBei der nachstehenden Gesellschaft wird das Amtslöschungsverfahren gemäß § 394 FamFG eingeleitet. Widerspruchsfrist 6 Wochen"
    },
    {
      "date": "2025-06-23",
      "id": "112964",
      "original_text": "Registerbekanntmachung nach dem Umwandlungsgesetz\nBaden-Württemberg Amtsgericht Mannheim HRB 560462\nHS Umformtechnik GmbH – Grünsfeld",
      "type": "Registerbekanntmachung nach dem Umwandlungsgesetz",
      "state": "Baden-Württemberg",
      "amtsgericht": "Amtsgericht Mannheim",
      "registernummer": "HRB 560462",
      "registerart": "HRB",
      "company_name": "HS Umformtechnik GmbH",
      "company_seat": "Grünsfeld",
      "details": "23.06.2025 (Bekanntmachungsdatum)\n\nBaden-Württemberg Amtsgericht Mannheim HRB 560462\nRegisterbekanntmachung nach dem Umwandlungsgesetz 23.06.2025 (Eintragungsdatum)\n\nHS Umformtechnik GmbH\nGesellschaft mit beschränkter Haftung\nGrünsfeld\n\nDen Gläubigern der an der Verschmelzung beteiligten Rechtsträger ist, wenn sie binnen sechs Monaten nach dem Tag, an dem die Eintragung der Verschmelzung in das Register des Sitzes desjenigen Rechtsträgers, dessen Gläubiger sie sind, nach § 19 Abs. 3 UmwG als bekanntgemacht gilt, ihren Anspruch nach Grund und Höhe schriftlich anmelden, Sicherheit zu leisten, soweit sie nicht Befriedigung verlangen können. Dieses Recht steht den Gläubigern jedoch nur zu, wenn sie glaubhaft machen, dass durch die Verschmelzung die Erfüllung ihrer Forderung gefährdet wird."
    },
    {
      "date": "2025-06-23",
      "id": "112965",
      "original_text": "Registerbekanntmachung nach dem Umwandlungsgesetz\nBaden-Württemberg Amtsgericht Mannheim HRB 336064\ntangro software components gmbh – Heidelberg",
      "type": "Registerbekanntmachung nach dem Umwandlungsgesetz",
      "state": "Baden-Württemberg",
      "amtsgericht": "Amtsgericht Mannheim",
      "registernummer": "HRB 336064",
      "registerart": "HRB",
      "company_name": "tangro software components gmbh",
      "company_seat": "Heidelberg",
      "details": "23.06.2025 (Bekanntmachungsdatum)\n\nBaden-Württemberg Amtsgericht Mannheim HRB 336064\nRegisterbekanntmachung nach dem Umwandlungsgesetz 23.06.2025 (Eintragungsdatum)\n\ntangro software components gmbh\nGesellschaft mit beschränkter Haftung\nHeidelberg\n\nDen Gläubigern der an der Verschmelzung beteiligten Rechtsträger ist, wenn sie binnen sechs Monaten nach dem Tag, an dem die Eintragung der Verschmelzung in das Register des Sitzes desjenigen Rechtsträgers, dessen Gläubiger sie sind, nach § 19 Abs. 3 UmwG als bekanntgemacht gilt, ihren Anspruch nach Grund und Höhe schriftlich anmelden, Sicherheit zu leisten, soweit sie nicht Befriedigung verlangen können. Dieses Recht steht den Gläubigern jedoch nur zu, wenn sie glaubhaft machen, dass durch die Verschmelzung die Erfüllung ihrer Forderung gefährdet wird."
    },
    {
      "date": "2025-06-23",
      "id": "112966",
      "original_text": "Registerbekanntmachung nach dem Umwandlungsgesetz\nBaden-Württemberg Amtsgericht Ulm HRA 729649\nKobler KG – Erolzheim",
      "type": "Registerbekanntmachung nach dem Umwandlungsgesetz",
      "state": "Baden-Württemberg",
      "amtsgericht": "Amtsgericht Ulm",
      "registernummer": "HRA 729649",
      "registerart": "HRA",
      "company_name": "Kobler KG",
      "company_seat": "Erolzheim",
      "details": "23.06.2025 (Bekanntmachungsdatum)\n\nBaden-Württemberg Amtsgericht Ulm HRA 729649\nRegisterbekanntmachung nach dem Umwandlungsgesetz 23.06.2025 (Eintragungsdatum)\n\nKobler KG\nKommanditgesellschaft\nErolzheim\n\nAls nicht eingetragen wird bekanntgemacht:\nDen Gläubigern des an dem Formwechsel beteiligten Rechtsträgers ist, wenn sie binnen sechs Monaten nach dem Tag, an dem die Eintragung des Formwechsels in das Register des Sitzes desjenigen Rechtsträgers, dessen Gläubiger sie sind, nach § 19 Abs. 3 UmwG als bekanntgemacht gilt, ihren Anspruch nach Grund und Höhe schriftlich anmelden, Sicherheit zu leisten, soweit sie nicht Befriedigung verlangen können. Dieses Recht steht den Gläubigern jedoch nur zu, wenn sie glaubhaft machen, dass durch den Formwechsel die Erfüllung ihrer Forderung gefährdet wird."
    },
    {
      "date": "2025-06-23",
      "id": "112967",
      "original_text": "Registerbekanntmachung nach dem Umwandlungsgesetz\nBaden-Württemberg Amtsgericht Stuttgart HRB 781985\nALUCA GmbH – Rosengarten",
      "type": "Registerbekanntmachung nach dem Umwandlungsgesetz",
      "state": "Baden-Württemberg",
      "amtsgericht": "Amtsgericht Stuttgart",
      "registernummer": "HRB 781985",
      "registerart": "HRB",
      "company_name": "ALUCA GmbH",
      "company_seat": "Rosengarten",
      "details": "23.06.2025 (Bekanntmachungsdatum)\n\nBaden-Württemberg Amtsgericht Stuttgart HRB 781985\nRegisterbekanntmachung nach dem Umwandlungsgesetz 23.06.2025 (Eintragungsdatum)\n\nALUCA GmbH\nGesellschaft mit beschränkter Haftung\nRosengarten\n\nDen Gläubigern dern an der grenzüberschreitenden Verschmelzung beteiligten übernehmenden Rechtsträger ist, wenn sie binnen sechs Monaten nach dem Tag, an dem die Eintragung der Verschmelzung in das Register des Sitzes desjenigen Rechtsträgers, dessen Gläubiger sie sind, nach § 19 Absatz 3 UmwG als bekanntgemacht gilt, ihren Anspruch nach Grund und Höhe schriftlich anmelden, Sicherheit zu leisten, soweit sie nicht Befriedigung verlangen können. Dieses Recht steht den Gläubigern jedoch nur zu, wenn sie glaubhaft machen, dass durch die Verschmelzung die Erfüllung ihrer Forderung gefährdet wird."
    },
    {
      "date": "2025-06-23",
      "id": "112968",
      "original_text": "Registerbekanntmachung nach dem Umwandlungsgesetz\nBaden-Württemberg Amtsgericht Ulm HRB 641426\nKobler GmbH – Erolzheim",
      "type": "Registerbekanntmachung nach dem Umwandlungsgesetz",
      "state": "Baden-Württemberg",
      "amtsgericht": "Amtsgericht Ulm",
      "registernummer": "HRB 641426",
      "registerart": "HRB",
      "company_name": "Kobler GmbH",
      "company_seat": "Erolzheim",
      "details": "23.06.2025 (Bekanntmachungsdatum)\n\nBaden-Württemberg Amtsgericht Ulm HRB 641426\nRegisterbekanntmachung nach dem Umwandlungsgesetz 23.06.2025 (Eintragungsdatum)\n\nKobler GmbH\nGesellschaft mit beschränkter Haftung\nErolzheim\n\nAls nicht eingetragen wird bekanntgemacht:\nDen Gläubigern des an dem Formwechsel beteiligten Rechtsträgers ist, wenn sie binnen sechs Monaten nach dem Tag, an dem die Eintragung des Formwechsels in das Register des Sitzes desjenigen Rechtsträgers, dessen Gläubiger sie sind, nach § 19 Abs. 3 UmwG als bekanntgemacht gilt, ihren Anspruch nach Grund und Höhe schriftlich anmelden, Sicherheit zu leisten, soweit sie nicht Befriedigung verlangen können. Dieses Recht steht den Gläubigern jedoch nur zu, wenn sie glaubhaft machen, dass durch den Formwechsel die Erfüllung ihrer Forderung gefährdet wird."
    },
    {
      "date": "2025-06-23",
      "id": "112969",
      "original_text": "Registerbekanntmachung nach dem Umwandlungsgesetz\nHamburg Amtsgericht Hamburg HRB 132348\nFonds 2 AvR Frankfurt Verwaltungs GmbH – Hamburg",
      "type": "Registerbekanntmachung nach dem Umwandlungsgesetz",
      "state": "Hamburg",
      "amtsgericht": "Amtsgericht Hamburg",
      "registernummer": "HRB 132348",
      "registerart": "HRB",
      "company_name": "Fonds 2 AvR Frankfurt Verwaltungs GmbH",
      "company_seat": "Hamburg",
      "details": "23.06.2025 (Bekanntmachungsdatum)\n\nHamburg Amtsgericht Hamburg HRB 132348\nRegisterbekanntmachung nach dem Umwandlungsgesetz 23.06.2025 (Eintragungsdatum)\n\nFonds 2 AvR Frankfurt Verwaltungs GmbH\nGesellschaft mit beschränkter Haftung\nHamburg\n\nAls nicht eingetragen wird bekannt gemacht:\nDen Gläubigern der an der Verschmelzung beteiligten Gesellschaften ist, wenn sie binnen sechs Monaten nach dem Tag, an dem die Eintragung der Verschmelzung in das Register des Sitzes desjenigen Rechtsträgers, dessen Gläubiger sie sind, nach § 19 Absatz 3 UmwG als bekannt gemacht gilt, ihren Anspruch nach Grund und Höhe schriftlich anmelden, Sicherheit zu leisten, soweit sie nicht Befriedigung verlangen können. Dieses Recht steht den Gläubigern jedoch nur zu, wenn sie glaubhaft machen, dass durch die Verschmelzung die Erfüllung ihrer Forderung gefährdet wird."
    },
    {
      "date": "2025-06-23",
      "id": "112970",
      "original_text": "Registerbekanntmachung nach dem Umwandlungsgesetz\nHamburg Amtsgericht Hamburg HRB 135660\nFonds 2 AvR Sachsenhausen Verwaltungs GmbH – Hamburg",
      "type": "Registerbekanntmachung nach dem Umwandlungsgesetz",
      "state": "Hamburg",
      "amtsgericht": "Amtsgericht Hamburg",
      "registernummer": "HRB 135660",
      "registerart": "HRB",
      "company_name": "Fonds 2 AvR Sachsenhausen Verwaltungs GmbH",
      "company_seat": "Hamburg",
      "details": "23.06.2025 (Bekanntmachungsdatum)\n\nHamburg Amtsgericht Hamburg HRB 135660\nRegisterbekanntmachung nach dem Umwandlungsgesetz 23.06.2025 (Eintragungsdatum)\n\nFonds 2 AvR Sachsenhausen Verwaltungs GmbH\nGesellschaft mit beschränkter Haftung\nHamburg\n\nAls nicht eingetragen wird bekannt gemacht:\nDen Gläubigern der an der Verschmelzung beteiligten Gesellschaften ist, wenn sie binnen sechs Monaten nach dem Tag, an dem die Eintragung der Verschmelzung in das Register des Sitzes desjenigen Rechtsträgers, dessen Gläubiger sie sind, nach § 19 Absatz 3 UmwG als bekannt gemacht gilt, ihren Anspruch nach Grund und Höhe schriftlich anmelden, Sicherheit zu leisten, soweit sie nicht Befriedigung verlangen können. Dieses Recht steht den Gläubigern jedoch nur zu, wenn sie glaubhaft machen, dass durch die Verschmelzung die Erfüllung ihrer Forderung gefährdet wird."
    },
    {
      "date": "2025-06-23",
      "id": "112971",
      "original_text": "Registerbekanntmachung nach dem Umwandlungsgesetz\nHamburg Amtsgericht Hamburg HRB 138127\nFonds 2 AvR Hamburg II Verwaltungs GmbH – Hamburg",
      "type": "Registerbekanntmachung nach dem Umwandlungsgesetz",
      "state": "Hamburg",
      "amtsgericht": "Amtsgericht Hamburg",
      "registernummer": "HRB 138127",
      "registerart": "HRB",
      "company_name": "Fonds 2 AvR Hamburg II Verwaltungs GmbH",
      "company_seat": "Hamburg",
      "details": "23.06.2025 (Bekanntmachungsdatum)\n\nHamburg Amtsgericht Hamburg HRB 138127\nRegisterbekanntmachung nach dem Umwandlungsgesetz 23.06.2025 (Eintragungsdatum)\n\nFonds 2 AvR Hamburg II Verwaltungs GmbH\nGesellschaft mit beschränkter Haftung\nHamburg\n\nAls nicht eingetragen wird bekannt gemacht:\nDen Gläubigern der an der Verschmelzung beteiligten Gesellschaften ist, wenn sie binnen sechs Monaten nach dem Tag, an dem die Eintragung der Verschmelzung in das Register des Sitzes desjenigen Rechtsträgers, dessen Gläubiger sie sind, nach § 19 Absatz 3 UmwG als bekannt gemacht gilt, ihren Anspruch nach Grund und Höhe schriftlich anmelden, Sicherheit zu leisten, soweit sie nicht Befriedigung verlangen können. Dieses Recht steht den Gläubigern jedoch nur zu, wenn sie glaubhaft machen, dass durch die Verschmelzung die Erfüllung ihrer Forderung gefährdet wird."
    },
    {
      "date": "2025-06-23",
      "id": "112972",
      "original_text": "Registerbekanntmachung nach dem Umwandlungsgesetz\nHamburg Amtsgericht Hamburg HRB 136169\nFonds 2 AvR Bonn Verwaltungs GmbH – Hamburg",
      "type": "Registerbekanntmachung nach dem Umwandlungsgesetz",
      "state": "Hamburg",
      "amtsgericht": "Amtsgericht Hamburg",
      "registernummer": "HRB 136169",
      "registerart": "HRB",
      "company_name": "Fonds 2 AvR Bonn Verwaltungs GmbH",
      "company_seat": "Hamburg",
      "details": "23.06.2025 (Bekanntmachungsdatum)\n\nHamburg Amtsgericht Hamburg HRB 136169\nRegisterbekanntmachung nach dem Umwandlungsgesetz 23.06.2025 (Eintragungsdatum)\n\nFonds 2 AvR Bonn Verwaltungs GmbH\nGesellschaft mit beschränkter Haftung\nHamburg\n\nAls nicht eingetragen wird bekannt gemacht:\nDen Gläubigern der an der Verschmelzung beteiligten Gesellschaften ist, wenn sie binnen sechs Monaten nach dem Tag, an dem die Eintragung der Verschmelzung in das Register des Sitzes desjenigen Rechtsträgers, dessen Gläubiger sie sind, nach § 19 Absatz 3 UmwG als bekannt gemacht gilt, ihren Anspruch nach Grund und Höhe schriftlich anmelden, Sicherheit zu leisten, soweit sie nicht Befriedigung verlangen können. Dieses Recht steht den Gläubigern jedoch nur zu, wenn sie glaubhaft machen, dass durch die Verschmelzung die Erfüllung ihrer Forderung gefährdet wird."
    },
    {
      "date": "2025-06-23",
      "id": "112973",
      "original_text": "Registerbekanntmachung nach dem Umwandlungsgesetz\nHamburg Amtsgericht Hamburg HRB 114403\nMikroQuartier Frankfurt 1 Verwaltungs GmbH – Hamburg",
      "type": "Registerbekanntmachung nach dem Umwandlungsgesetz",
      "state": "Hamburg",
      "amtsgericht": "Amtsgericht Hamburg",
      "registernummer": "HRB 114403",
      "registerart": "HRB",
      "company_name": "MikroQuartier Frankfurt 1 Verwaltungs GmbH",
      "company_seat": "Hamburg",
      "details": "23.06.2025 (Bekanntmachungsdatum)\n\nHamburg Amtsgericht Hamburg HRB 114403\nRegisterbekanntmachung nach dem Umwandlungsgesetz 23.06.2025 (Eintragungsdatum)\n\nMikroQuartier Frankfurt 1 Verwaltungs GmbH\nGesellschaft mit beschränkter Haftung\nHamburg\n\nAls nicht eingetragen wird bekannt gemacht:\nDen Gläubigern der an der Verschmelzung beteiligten Gesellschaften ist, wenn sie binnen sechs Monaten nach dem Tag, an dem die Eintragung der Verschmelzung in das Register des Sitzes desjenigen Rechtsträgers, dessen Gläubiger sie sind, nach § 19 Absatz 3 UmwG als bekannt gemacht gilt, ihren Anspruch nach Grund und Höhe schriftlich anmelden, Sicherheit zu leisten, soweit sie nicht Befriedigung verlangen können. Dieses Recht steht den Gläubigern jedoch nur zu, wenn sie glaubhaft machen, dass durch die Verschmelzung die Erfüllung ihrer Forderung gefährdet wird."
    },
    {
      "date": "2025-06-23",
      "id": "112974",
      "original_text": "Registerbekanntmachung nach dem Umwandlungsgesetz\nBrandenburg Amtsgericht Cottbus HRB 1400\nFunk und Technik GmbH Forst – Forst (Lausitz)",
      "type": "Registerbekanntmachung nach dem Umwandlungsgesetz",
      "state": "Brandenburg",
      "amtsgericht": "Amtsgericht Cottbus",
      "registernummer": "HRB 1400",
      "registerart": "HRB",
      "company_name": "Funk und Technik GmbH Forst",
      "company_seat": "Forst (Lausitz)",
      "details": "23.06.2025 (Bekanntmachungsdatum)\n\nBrandenburg Amtsgericht Cottbus HRB 1400\nRegisterbekanntmachung nach dem Umwandlungsgesetz 19.06.2025 (Eintragungsdatum)\n\nFunk und Technik GmbH Forst\nGesellschaft mit beschränkter Haftung\nForst (Lausitz)\n\nZu Eintragungsnummer 23 vom 19.06.2025 wird als nicht eingetragen veröffentlicht: Als nicht eingetragen wird veröffentlicht:\nDen Gläubigern der an der Verschmelzung beteiligten Rechtsträger ist, wenn sie binnen sechs Monaten nach dem Tag, an dem die Eintragung der Verschmelzung in das Register des Sitzes desjenigen Rechtsträgers, dessen Gläubiger sie sind, als bekannt gemacht gilt, ihren Anspruch nach Grund und Höhe schriftlich anmelden, Sicherheit zu leisten, soweit sie nicht Befriedigung verlangen können. Dieses Recht steht den Gläubigern jedoch nur zu, wenn sie glaubhaft machen, dass durch die Verschmelzung die Erfüllung ihrer Forderung gefährdet wird"
    },
    {
      "date": "2025-06-23",
      "id": "112975",
      "original_text": "Löschungsankündigung\nBerlin Amtsgericht Berlin (Charlottenburg) HRB 134139\nConcept Lease CL GmbH – Berlin",
      "type": "Löschungsankündigung",
      "state": "Berlin",
      "amtsgericht": "Amtsgericht Berlin (Charlottenburg)",
      "registernummer": "HRB 134139",
      "registerart": "HRB",
      "company_name": "Concept Lease CL GmbH",
      "company_seat": "Berlin",
      "details": "23.06.2025 (Bekanntmachungsdatum)\n\nBerlin Amtsgericht Berlin (Charlottenburg) HRB 134139\nLöschungsankündigung\n\nConcept Lease CL GmbH\nGesellschaft mit beschränkter Haftung\nBerlin\n\nBei der nachstehenden Gesellschaft wird das Amtslöschungsverfahren gemäß § 394 FamFG eingeleitet. Widerspruchsfrist 6 Wochen"
    },
    {
      "date": "2025-06-23",
      "id": "112976",
      "original_text": "Löschungsankündigung\nBerlin Amtsgericht Berlin (Charlottenburg) HRB 194679\nTarsus GmbH – Berlin",
      "type": "Löschungsankündigung",
      "state": "Berlin",
      "amtsgericht": "Amtsgericht Berlin (Charlottenburg)",
      "registernummer": "HRB 194679",
      "registerart": "HRB",
      "company_name": "Tarsus GmbH",
      "company_seat": "Berlin",
      "details": "23.06.2025 (Bekanntmachungsdatum)\n\nBerlin Amtsgericht Berlin (Charlottenburg) HRB 194679\nLöschungsankündigung\n\nTarsus GmbH\nGesellschaft mit beschränkter Haftung\nBerlin\n\nBei der nachstehenden Gesellschaft wird das Amtslöschungsverfahren gemäß § 394 FamFG eingeleitet. Widerspruchsfrist 6 Wochen"
    },
    {
      "date": "2025-06-23",
      "id": "112977",
      "original_text": "Registerbekanntmachung nach dem Umwandlungsgesetz\nHamburg Amtsgericht Hamburg HRB 59732\nJSLR - Jörg Steiniger Leit- und Regeltechnik GmbH – Hamburg",
      "type": "Registerbekanntmachung nach dem Umwandlungsgesetz",
      "state": "Hamburg",
      "amtsgericht": "Amtsgericht Hamburg",
      "registernummer": "HRB 59732",
      "registerart": "HRB",
      "company_name": "JSLR - Jörg Steiniger Leit- und Regeltechnik GmbH",
      "company_seat": "Hamburg",
      "details": "23.06.2025 (Bekanntmachungsdatum)\n\nHamburg Amtsgericht Hamburg HRB 59732\nRegisterbekanntmachung nach dem Umwandlungsgesetz 23.06.2025 (Eintragungsdatum)\n\nJSLR - Jörg Steiniger Leit- und Regeltechnik GmbH\nGesellschaft mit beschränkter Haftung\nHamburg\n\nAls nicht eingetragen wird bekannt gemacht:\nDen Gläubigern der an der Verschmelzung beteiligten Gesellschaften ist, wenn sie binnen sechs Monaten nach dem Tag, an dem die Eintragung der Verschmelzung in das Register des Sitzes desjenigen Rechtsträgers, dessen Gläubiger sie sind, nach § 19 Absatz 3 UmwG als bekannt gemacht gilt, ihren Anspruch nach Grund und Höhe schriftlich anmelden, Sicherheit zu leisten, soweit sie nicht Befriedigung verlangen können. Dieses Recht steht den Gläubigern jedoch nur zu, wenn sie glaubhaft machen, dass durch die Verschmelzung die Erfüllung ihrer Forderung gefährdet wird."
    },
    {
      "date": "2025-06-23",
      "id": "112978",
      "original_text": "Registerbekanntmachung nach dem Umwandlungsgesetz\nBerlin Amtsgericht Berlin (Charlottenburg) VR 31561\nFrüchte der Kulturen e.V. – Berlin",
      "type": "Registerbekanntmachung nach dem Umwandlungsgesetz",
      "state": "Berlin",
      "amtsgericht": "Amtsgericht Berlin (Charlottenburg)",
      "registernummer": "VR 31561",
      "registerart": "VR",
      "company_name": "Früchte der Kulturen e.V.",
      "company_seat": "Berlin",
      "details": "23.06.2025 (Bekanntmachungsdatum)\n\nBerlin Amtsgericht Berlin (Charlottenburg) VR 31561\nRegisterbekanntmachung nach dem Umwandlungsgesetz 19.06.2025 (Eintragungsdatum)\n\nFrüchte der Kulturen e.V.\neingetragener Verein\nBerlin\n\nZu Eintragungsnummer 4 vom 19.06.2025 wird als nicht eingetragen veröffentlicht: Den Gläubigern ist, wenn sie binnen sechs Monaten nach dem Tag, an dem die Eintragung der Umwandlung als bekannt gemacht gilt, ihren Anspruch nach Grund und Höhe schriftlich anmelden, Sicherheit zu leisten, soweit sie nicht Befriedigung verlangen können. Dieses Recht steht den Gläubigern jedoch nur zu, wenn sie glaubhaft machen, dass durch die Umwandlung die Erfüllung ihrer Forderung gefährdet wird. Das Recht, Sicherheitsleistung zu verlangen, steht Gläubigern nicht zu, die im Falle der Insolvenz ein Recht auf vorzugsweise Befriedigung aus einer Deckungsmasse haben, die nach gesetzlicher Vorschrift zu ihrem Schutz errichtet und staatlich überwacht ist."
    },
    {
      "date": "2025-06-23",
      "id": "112979",
      "original_text": "Registerbekanntmachung nach dem Umwandlungsgesetz\nHamburg Amtsgericht Hamburg HRB 193175\nFFG Frauen Finanz GmbH – Hamburg",
      "type": "Registerbekanntmachung nach dem Umwandlungsgesetz",
      "state": "Hamburg",
      "amtsgericht": "Amtsgericht Hamburg",
      "registernummer": "HRB 193175",
      "registerart": "HRB",
      "company_name": "FFG Frauen Finanz GmbH",
      "company_seat": "Hamburg",
      "details": "23.06.2025 (Bekanntmachungsdatum)\n\nHamburg Amtsgericht Hamburg HRB 193175\nRegisterbekanntmachung nach dem Umwandlungsgesetz 23.06.2025 (Eintragungsdatum)\n\nFFG Frauen Finanz GmbH\nGesellschaft mit beschränkter Haftung\nHamburg\n\nAls nicht eingetragen wird bekannt gemacht:\nDen Gläubigern der an der Ausgliederung beteiligten Gesellschaften ist, wenn sie binnen sechs Monaten nach dem Tag, an dem die Eintragung der Ausgliederung in das Register des Sitzes desjenigen Rechtsträgers, dessen Gläubiger sie sind, nach § 19 Absatz 3 UmwG als bekannt gemacht gilt, ihren Anspruch nach Grund und Höhe schriftlich anmelden, Sicherheit zu leisten, soweit sie nicht Befriedigung verlangen können. Dieses Recht steht den Gläubigern jedoch nur zu, wenn sie glaubhaft machen, dass durch die Ausgliederung die Erfüllung ihrer Forderung gefährdet wird."
    },
    {
      "date": "2025-06-23",
      "id": "112980",
      "original_text": "Registerbekanntmachung nach dem Umwandlungsgesetz\nHamburg Amtsgericht Hamburg HRA 118448\nSusanne Kazemieh-Aghdam e.K. – Hamburg",
      "type": "Registerbekanntmachung nach dem Umwandlungsgesetz",
      "state": "Hamburg",
      "amtsgericht": "Amtsgericht Hamburg",
      "registernummer": "HRA 118448",
      "registerart": "HRA",
      "company_name": "Susanne Kazemieh-Aghdam e.K.",
      "company_seat": "Hamburg",
      "details": "23.06.2025 (Bekanntmachungsdatum)\n\nHamburg Amtsgericht Hamburg HRA 118448\nRegisterbekanntmachung nach dem Umwandlungsgesetz 23.06.2025 (Eintragungsdatum)\n\nSusanne Kazemieh-Aghdam e.K.\nEinzelkaufmann\nHamburg\n\nAls nicht eingetragen wird bekannt gemacht:\nDen Gläubigern der an der Ausgliederung beteiligten Gesellschaften ist, wenn sie binnen sechs Monaten nach dem Tag, an dem die Eintragung der Ausgliederung in das Register des Sitzes desjenigen Rechtsträgers, dessen Gläubiger sie sind, nach § 19 Absatz 3 UmwG als bekannt gemacht gilt, ihren Anspruch nach Grund und Höhe schriftlich anmelden, Sicherheit zu leisten, soweit sie nicht Befriedigung verlangen können. Dieses Recht steht den Gläubigern jedoch nur zu, wenn sie glaubhaft machen, dass durch die Ausgliederung die Erfüllung ihrer Forderung gefährdet wird."
    },
    {
      "date": "2025-06-23",
      "id": "112981",
      "original_text": "Löschungsankündigung\nBerlin Amtsgericht Berlin (Charlottenburg) HRB 234220\nFamedica Rechtsanwaltsgesellschaft mbH – Berlin",
      "type": "Löschungsankündigung",
      "state": "Berlin",
      "amtsgericht": "Amtsgericht Berlin (Charlottenburg)",
      "registernummer": "HRB 234220",
      "registerart": "HRB",
      "company_name": "Famedica Rechtsanwaltsgesellschaft mbH",
      "company_seat": "Berlin",
      "details": "23.06.2025 (Bekanntmachungsdatum)\n\nBerlin Amtsgericht Berlin (Charlottenburg) HRB 234220\nLöschungsankündigung\n\nFamedica Rechtsanwaltsgesellschaft mbH\nGesellschaft mit beschränkter Haftung\nBerlin\n\nBei der nachstehenden Gesellschaft wird das Amtslöschungsverfahren gemäß § 394 FamFG eingeleitet. Widerspruchsfrist 6 Wochen"
    },
    {
      "date": "2025-06-23",
      "id": "112982",
      "original_text": "Registerbekanntmachung nach dem Umwandlungsgesetz\nBaden-Württemberg Amtsgericht Stuttgart HRB 774959\nAmazon SZ South 1 GmbH – Stuttgart",
      "type": "Registerbekanntmachung nach dem Umwandlungsgesetz",
      "state": "Baden-Württemberg",
      "amtsgericht": "Amtsgericht Stuttgart",
      "registernummer": "HRB 774959",
      "registerart": "HRB",
      "company_name": "Amazon SZ South 1 GmbH",
      "company_seat": "Stuttgart",
      "details": "23.06.2025 (Bekanntmachungsdatum)\n\nBaden-Württemberg Amtsgericht Stuttgart HRB 774959\nRegisterbekanntmachung nach dem Umwandlungsgesetz 23.06.2025 (Eintragungsdatum)\n\nAmazon SZ South 1 GmbH\nGesellschaft mit beschränkter Haftung\nStuttgart\n\nAls nicht eingetragen wird bekanntgemacht:\nDen Gläubigern der an der Verschmelzung beteiligten Rechtsträger ist, wenn sie binnen sechs Monaten nach dem Tag, an dem die Eintragung der Verschmelzung in das Register des Sitzes desjenigen Rechtsträgers, dessen Gläubiger sie sind, nach § 19 Abs. 3 UmwG als bekanntgemacht gilt, ihren Anspruch nach Grund und Höhe schriftlich anmelden, Sicherheit zu leisten, soweit sie nicht Befriedigung verlangen können. Dieses Recht steht den Gläubigern jedoch nur zu, wenn sie glaubhaft machen, dass durch die Verschmelzung die Erfüllung ihrer Forderung gefährdet wird."
    },
    {
      "date": "2025-06-23",
      "id": "112983",
      "original_text": "Registerbekanntmachung nach dem Umwandlungsgesetz\nBaden-Württemberg Amtsgericht Stuttgart HRB 800384\nasano GmbH – Böblingen",
      "type": "Registerbekanntmachung nach dem Umwandlungsgesetz",
      "state": "Baden-Württemberg",
      "amtsgericht": "Amtsgericht Stuttgart",
      "registernummer": "HRB 800384",
      "registerart": "HRB",
      "company_name": "asano GmbH",
      "company_seat": "Böblingen",
      "details": "23.06.2025 (Bekanntmachungsdatum)\n\nBaden-Württemberg Amtsgericht Stuttgart HRB 800384\nRegisterbekanntmachung nach dem Umwandlungsgesetz 23.06.2025 (Eintragungsdatum)\n\nasano GmbH\nGesellschaft mit beschränkter Haftung\nBöblingen\n\nAls nicht eingetragen wird bekanntgemacht:\nDen Gläubigern des an dem Formwechsel beteiligten Rechtsträgers ist, wenn sie binnen sechs Monaten nach dem Tag, an dem die Eintragung des Formwechsels in das Register des Sitzes desjenigen Rechtsträgers, dessen Gläubiger sie sind, nach § 19 Abs. 3 UmwG als bekanntgemacht gilt, ihren Anspruch nach Grund und Höhe schriftlich anmelden, Sicherheit zu leisten, soweit sie nicht Befriedigung verlangen können. Dieses Recht steht den Gläubigern jedoch nur zu, wenn sie glaubhaft machen, dass durch den Formwechsel die Erfüllung ihrer Forderung gefährdet wird."
    },
    {
      "date": "2025-06-23",
      "id": "112984",
      "original_text": "Registerbekanntmachung nach dem Umwandlungsgesetz\nBaden-Württemberg Amtsgericht Stuttgart HRB 739623\nasano AG – Böblingen",
      "type": "Registerbekanntmachung nach dem Umwandlungsgesetz",
      "state": "Baden-Württemberg",
      "amtsgericht": "Amtsgericht Stuttgart",
      "registernummer": "HRB 739623",
      "registerart": "HRB",
      "company_name": "asano AG",
      "company_seat": "Böblingen",
      "details": "23.06.2025 (Bekanntmachungsdatum)\n\nBaden-Württemberg Amtsgericht Stuttgart HRB 739623\nRegisterbekanntmachung nach dem Umwandlungsgesetz 23.06.2025 (Eintragungsdatum)\n\nasano AG\nAktiengesellschaft\nBöblingen\n\nAls nicht eingetragen wird bekanntgemacht:\nDen Gläubigern des an dem Formwechsel beteiligten Rechtsträgers ist, wenn sie binnen sechs Monaten nach dem Tag, an dem die Eintragung des Formwechsels in das Register des Sitzes desjenigen Rechtsträgers, dessen Gläubiger sie sind, nach § 19 Abs. 3 UmwG als bekanntgemacht gilt, ihren Anspruch nach Grund und Höhe schriftlich anmelden, Sicherheit zu leisten, soweit sie nicht Befriedigung verlangen können. Dieses Recht steht den Gläubigern jedoch nur zu, wenn sie glaubhaft machen, dass durch den Formwechsel die Erfüllung ihrer Forderung gefährdet wird."
    },
    {
      "date": "2025-06-23",
      "id": "112985",
      "original_text": "Löschungsankündigung\nBaden-Württemberg Amtsgericht Ulm HRA 725831\nKarisma GmbH & Co. KG – Aalen",
      "type": "Löschungsankündigung",
      "state": "Baden-Württemberg",
      "amtsgericht": "Amtsgericht Ulm",
      "registernummer": "HRA 725831",
      "registerart": "HRA",
      "company_name": "Karisma GmbH & Co. KG",
      "company_seat": "Aalen",
      "details": "23.06.2025 (Bekanntmachungsdatum)\n\nBaden-Württemberg Amtsgericht Ulm HRA 725831\nLöschungsankündigung\n\nKarisma GmbH & Co. KG\nKommanditgesellschaft\nAalen\n\nDas Gericht beabsichtigt, die Gesellschaft wegen Vermögenslosigkeit im Handelsregister von Amts wegen nach § 394 FamFG zu löschen. Die Frist zur Geltendmachung eines Widerspruchs gegen die beabsichtigte Löschung ist auf  einen Monat ab Veröffentlichung bestimmt."
    },
    {
      "date": "2025-06-23",
      "id": "112986",
      "original_text": "Registerbekanntmachung nach dem Umwandlungsgesetz\nBrandenburg Amtsgericht Neuruppin HRB 12460\nEB-C Immobilienverwaltung GmbH – Oranienburg",
      "type": "Registerbekanntmachung nach dem Umwandlungsgesetz",
      "state": "Brandenburg",
      "amtsgericht": "Amtsgericht Neuruppin",
      "registernummer": "HRB 12460",
      "registerart": "HRB",
      "company_name": "EB-C Immobilienverwaltung GmbH",
      "company_seat": "Oranienburg",
      "details": "23.06.2025 (Bekanntmachungsdatum)\n\nBrandenburg Amtsgericht Neuruppin HRB 12460\nRegisterbekanntmachung nach dem Umwandlungsgesetz 20.06.2025 (Eintragungsdatum)\n\nEB-C Immobilienverwaltung GmbH\nGesellschaft mit beschränkter Haftung\nOranienburg\n\nZu Eintragungsnummer 4 vom 20.06.2025 wird als nicht eingetragen veröffentlicht:\nDen Gläubigern der an der Umwandlung beteiligten Rechtsträger ist, wenn sie binnen sechs Monaten nach dem Tag, an dem die Eintragung der Umwandlung in das Register des Sitzes desjenigen Rechtsträgers, dessen Gläubiger sie sind, als bekannt gemacht gilt, ihren Anspruch nach Grund und Höhe schriftlich anmelden, Sicherheit zu leisten, soweit sie nicht Befriedigung verlangen können. Dieses Recht steht den Gläubigern jedoch nur zu, wenn sie glaubhaft machen, dass durch die Umwandlung die Erfüllung ihrer Forderung gefährdet wird"
    },
    {
      "date": "2025-06-23",
      "id": "112987",
      "original_text": "Einreichung neuer Dokumente\nBerlin Amtsgericht Berlin (Charlottenburg) HRB 69326\nFirst Sensor AG – Berlin",
      "type": "Einreichung neuer Dokumente",
      "state": "Berlin",
      "amtsgericht": "Amtsgericht Berlin (Charlottenburg)",
      "registernummer": "HRB 69326",
      "registerart": "HRB",
      "company_name": "First Sensor AG",
      "company_seat": "Berlin",
      "details": "23.06.2025 (Bekanntmachungsdatum)\n\nBerlin Amtsgericht Berlin (Charlottenburg) HRB 69326\nEinreichung neuer Dokumente\n\nFirst Sensor AG\nAktiengesellschaft\nBerlin\n\nAls nicht eingetragen wird veröffentlicht: Es wurde eine neue Liste der Aufsichtsratsmitglieder eingereicht (§ 106 AktG)."
    },
    {
      "date": "2025-06-23",
      "id": "112988",
      "original_text": "Registerbekanntmachung nach dem Umwandlungsgesetz\nHamburg Amtsgericht Hamburg HRB 160167\nCMS Claus Mendyka GmbH – Hamburg",
      "type": "Registerbekanntmachung nach dem Umwandlungsgesetz",
      "state": "Hamburg",
      "amtsgericht": "Amtsgericht Hamburg",
      "registernummer": "HRB 160167",
      "registerart": "HRB",
      "company_name": "CMS Claus Mendyka GmbH",
      "company_seat": "Hamburg",
      "details": "23.06.2025 (Bekanntmachungsdatum)\n\nHamburg Amtsgericht Hamburg HRB 160167\nRegisterbekanntmachung nach dem Umwandlungsgesetz 17.06.2025 (Eintragungsdatum)\n\nCMS Claus Mendyka GmbH\nGesellschaft mit beschränkter Haftung\nHamburg\n\nAls nicht eingetragen wird bekannt gemacht:\nDen Gläubigern der an der Verschmelzung beteiligten Gesellschaften ist, wenn sie binnen sechs Monaten nach dem Tag, an dem die Eintragung der Verschmelzung in das Register des Sitzes desjenigen Rechtsträgers, dessen Gläubiger sie sind, nach § 19 Absatz 3 UmwG als bekannt gemacht gilt, ihren Anspruch nach Grund und Höhe schriftlich anmelden, Sicherheit zu leisten, soweit sie nicht Befriedigung verlangen können. Dieses Recht steht den Gläubigern jedoch nur zu, wenn sie glaubhaft machen, dass durch die Verschmelzung die Erfüllung ihrer Forderung gefährdet wird."
    },
    {
      "date": "2025-06-23",
      "id": "112989",
      "original_text": "Löschungsankündigung\nSaarland Amtsgericht Saarbrücken HRB 102923\nHamle GmbH – Kirkel",
      "type": "Löschungsankündigung",
      "state": "Saarland",
      "amtsgericht": "Amtsgericht Saarbrücken",
      "registernummer": "HRB 102923",
      "registerart": "HRB",
      "company_name": "Hamle GmbH",
      "company_seat": "Kirkel",
      "details": "23.06.2025 (Bekanntmachungsdatum)\n\nSaarland Amtsgericht Saarbrücken HRB 102923\nLöschungsankündigung\n\nHamle GmbH\nGesellschaft mit beschränkter Haftung\nKirkel\n\n.Es ist beabsichtigt, die Gesellschaft von Amts wegen gemäß § 394 FamFG wegen Vermögenslosigkeit zu löschen. Gegen die Löschung von Amts wegen ist das Rechtsmittel des Widerspruchs statthaft. Der Widerspruch ist binnen einer Frist von 3 Monaten beginnend mit dem Tag dieser Veröffentlichung durch Einreichen eines Widerspruchsschreibens -schriftlich oder zur Niederschrift der Geschäftsstelle- beim Amtsgericht Saarbrücken, -zentrales Handelsregister-, Mainzerstr.178, 66121 Saarbrücken einzulegen. Der Widerspruch muss die Bezeichnung der angefochtenen Löschungsankündigung enthalten sowie die Erklärung, dass Widerspruch eingelegt wird. Er ist vom Widerspruchsführer oder seinem Bevollmächtigten zu unterzeichnen."
    },
    {
      "date": "2025-06-23",
      "id": "112990",
      "original_text": "Registerbekanntmachung nach dem Umwandlungsgesetz\nMecklenburg-Vorpommern Amtsgericht Rostock GsR 232\nLandwirtschaftsgesellschaft von Hollen eGbR – Dummerstorf",
      "type": "Registerbekanntmachung nach dem Umwandlungsgesetz",
      "state": "Mecklenburg-Vorpommern",
      "amtsgericht": "Amtsgericht Rostock",
      "registernummer": "GsR 232",
      "registerart": "GsR",
      "company_name": "Landwirtschaftsgesellschaft von Hollen eGbR",
      "company_seat": "Dummerstorf",
      "details": "23.06.2025 (Bekanntmachungsdatum)\n\nMecklenburg-Vorpommern Amtsgericht Rostock GsR 232\nRegisterbekanntmachung nach dem Umwandlungsgesetz 23.06.2025 (Eintragungsdatum)\n\nLandwirtschaftsgesellschaft von Hollen eGbR\nGesellschaft bürgerlichen Rechts\nDummerstorf\n\nAls nicht eingetragen wird veröffentlicht: Den Gläubigern der an der Verschmelzung beteiligten Rechtsträger ist, wenn sie binnen sechs Monaten nach dem Tag, an dem die Eintragung der Verschmelzung in das Register des Sitzes desjenigen Rechtsträgers, dessen Gläubiger sie sind, nach § 19 Abs. 3 UmwG als bekannt gemacht gilt,\nihren Anspruch nach Grund und Höhe in Textform anmelden, Sicherheit zu leisten, soweit sie nicht Befriedigung verlangen können. Dieses Recht steht den Gläubigern jedoch nur zu, wenn sie glaubhaft machen, dass durch die Verschmelzung die Erfüllung der Forderung gefährdet wird."
    },
    {
      "date": "2025-06-23",
      "id": "112991",
      "original_text": "Einreichung neuer Dokumente\nThüringen Amtsgericht Jena HRB 107864\nMeta Wolf AG – Kranichfeld",
      "type": "Einreichung neuer Dokumente",
      "state": "Thüringen",
      "amtsgericht": "Amtsgericht Jena",
      "registernummer": "HRB 107864",
      "registerart": "HRB",
      "company_name": "Meta Wolf AG",
      "company_seat": "Kranichfeld",
      "details": "23.06.2025 (Bekanntmachungsdatum)\n\nThüringen Amtsgericht Jena HRB 107864\nEinreichung neuer Dokumente 23.06.2025 (Eintragungsdatum)\n\nMeta Wolf AG\nAktiengesellschaft\nKranichfeld\n\nBekanntmachung gem. § 106 AktG: Aufgrund einer Veränderung in den Personen der Aufsichtsratsmitglieder ist durch den Vorstand eine neue Liste zum Handelsregister eingereicht worden."
    },
    {
      "date": "2025-06-23",
      "id": "112992",
      "original_text": "Sonstige Registerbekanntmachung\nHamburg Amtsgericht Hamburg HRB 88352\nPhilips Medizin Systeme Hofheim - Wallau GmbH – Hamburg",
      "type": "Sonstige Registerbekanntmachung",
      "state": "Hamburg",
      "amtsgericht": "Amtsgericht Hamburg",
      "registernummer": "HRB 88352",
      "registerart": "HRB",
      "company_name": "Philips Medizin Systeme Hofheim - Wallau GmbH",
      "company_seat": "Hamburg",
      "details": "23.06.2025 (Bekanntmachungsdatum)\n\nHamburg Amtsgericht Hamburg HRB 88352\nSonstige Registerbekanntmachung 23.06.2025 (Eintragungsdatum)\n\nPhilips Medizin Systeme Hofheim - Wallau GmbH\nGesellschaft mit beschränkter Haftung\nHamburg\n\nAls nicht eingetragen wird bekannt gemacht:  Den Gläubigern der Gesellschaft, deren Forderungen begründet worden sind, bevor die Eintragung der Vertragsbeendigung in das Handelsregister nach § 10 HGB als bekannt gemacht gilt, ist vom anderen Vertragsteil Sicherheit zu leisten, wenn sie sich binnen 6 Monaten nach Bekanntmachung der Eintragung zu diesem Zweck bei ihm melden."
    },
    {
      "date": "2025-06-23",
      "id": "112993",
      "original_text": "Registerbekanntmachung nach dem Umwandlungsgesetz\nHamburg Amtsgericht Hamburg HRB 88352\nPhilips Medizin Systeme Hofheim - Wallau GmbH – Hamburg",
      "type": "Registerbekanntmachung nach dem Umwandlungsgesetz",
      "state": "Hamburg",
      "amtsgericht": "Amtsgericht Hamburg",
      "registernummer": "HRB 88352",
      "registerart": "HRB",
      "company_name": "Philips Medizin Systeme Hofheim - Wallau GmbH",
      "company_seat": "Hamburg",
      "details": "23.06.2025 (Bekanntmachungsdatum)\n\nHamburg Amtsgericht Hamburg HRB 88352\nRegisterbekanntmachung nach dem Umwandlungsgesetz 23.06.2025 (Eintragungsdatum)\n\nPhilips Medizin Systeme Hofheim - Wallau GmbH\nGesellschaft mit beschränkter Haftung\nHamburg\n\nAls nicht eingetragen wird bekannt gemacht:\nDen Gläubigern der an der Verschmelzung beteiligten Gesellschaften ist, wenn sie binnen sechs Monaten nach dem Tag, an dem die Eintragung der Verschmelzung in das Register des Sitzes desjenigen Rechtsträgers, dessen Gläubiger sie sind, nach § 19 Absatz 3 UmwG als bekannt gemacht gilt, ihren Anspruch nach Grund und Höhe schriftlich anmelden, Sicherheit zu leisten, soweit sie nicht Befriedigung verlangen können. Dieses Recht steht den Gläubigern jedoch nur zu, wenn sie glaubhaft machen, dass durch die Verschmelzung die Erfüllung ihrer Forderung gefährdet wird."
    },
    {
      "date": "2025-06-23",
      "id": "112994",
      "original_text": "Registerbekanntmachung nach dem Umwandlungsgesetz\nMecklenburg-Vorpommern Amtsgericht Rostock GsR 229\nAlexis von Hollen und Thorsten von Hollen eGbR – Dummerstorf",
      "type": "Registerbekanntmachung nach dem Umwandlungsgesetz",
      "state": "Mecklenburg-Vorpommern",
      "amtsgericht": "Amtsgericht Rostock",
      "registernummer": "GsR 229",
      "registerart": "GsR",
      "company_name": "Alexis von Hollen und Thorsten von Hollen eGbR",
      "company_seat": "Dummerstorf",
      "details": "23.06.2025 (Bekanntmachungsdatum)\n\nMecklenburg-Vorpommern Amtsgericht Rostock GsR 229\nRegisterbekanntmachung nach dem Umwandlungsgesetz 23.06.2025 (Eintragungsdatum)\n\nAlexis von Hollen und Thorsten von Hollen eGbR\nGesellschaft bürgerlichen Rechts\nDummerstorf\n\nAls nicht eingetragen wird veröffentlicht: Den Gläubigern der an der Verschmelzung beteiligten Rechtsträger ist, wenn sie binnen sechs Monaten nach dem Tag, an dem die Eintragung der Verschmelzung in das Register des Sitzes desjenigen Rechtsträgers, dessen Gläubiger sie sind, nach § 19 Abs. 3 UmwG als bekannt gemacht gilt,\nihren Anspruch nach Grund und Höhe in Textform anmelden, Sicherheit zu leisten, soweit sie nicht Befriedigung verlangen können. Dieses Recht steht den Gläubigern jedoch nur zu, wenn sie glaubhaft machen, dass durch die Verschmelzung die Erfüllung der Forderung gefährdet wird."
    },
    {
      "date": "2025-06-23",
      "id": "112995",
      "original_text": "Registerbekanntmachung nach dem Umwandlungsgesetz\nBerlin Amtsgericht Berlin (Charlottenburg) HRB 69874\nATB Aufzugtechnik Berlin GmbH – Berlin",
      "type": "Registerbekanntmachung nach dem Umwandlungsgesetz",
      "state": "Berlin",
      "amtsgericht": "Amtsgericht Berlin (Charlottenburg)",
      "registernummer": "HRB 69874",
      "registerart": "HRB",
      "company_name": "ATB Aufzugtechnik Berlin GmbH",
      "company_seat": "Berlin",
      "details": "23.06.2025 (Bekanntmachungsdatum)\n\nBerlin Amtsgericht Berlin (Charlottenburg) HRB 69874\nRegisterbekanntmachung nach dem Umwandlungsgesetz 23.06.2025 (Eintragungsdatum)\n\nATB Aufzugtechnik Berlin GmbH\nGesellschaft mit beschränkter Haftung\nBerlin\n\nZu Eintragungsnummer 6 vom 23.06.2025 wird als nicht eingetragen veröffentlicht: Den Gläubigern der an der Verschmelzung beteiligten Rechtsträger ist, wenn sie binnen sechs Monaten nach dem Tag, an dem die Eintragung der Verschmelzung in das Register des Sitzes desjenigen Rechtsträgers, dessen Gläubiger sie sind, als bekannt gemacht gilt, ihren Anspruch nach Grund und Höhe schriftlich anmelden, Sicherheit zu leisten, soweit sie nicht Befriedigung verlangen können. Dieses Recht steht den Gläubigern jedoch nur zu, wenn sie glaubhaft machen, dass durch die Verschmelzung die Erfüllung ihrer Forderung gefährdet wird. Das Recht, Sicherheitsleistung zu verlangen, steht Gläubigern nicht zu, die im Falle der Insolvenz ein Recht auf vorzugsweise Befriedigung aus einer Deckungsmasse haben, die nach gesetzlicher Vorschrift zu ihrem Schutz errichtet und staatlich überwacht ist."
    },
    {
      "date": "2025-06-23",
      "id": "112996",
      "original_text": "Registerbekanntmachung nach dem Umwandlungsgesetz\nBerlin Amtsgericht Berlin (Charlottenburg) HRA 37281\nJESCH-Aufzüge GmbH & Co. KG – Berlin",
      "type": "Registerbekanntmachung nach dem Umwandlungsgesetz",
      "state": "Berlin",
      "amtsgericht": "Amtsgericht Berlin (Charlottenburg)",
      "registernummer": "HRA 37281",
      "registerart": "HRA",
      "company_name": "JESCH-Aufzüge GmbH & Co. KG",
      "company_seat": "Berlin",
      "details": "23.06.2025 (Bekanntmachungsdatum)\n\nBerlin Amtsgericht Berlin (Charlottenburg) HRA 37281\nRegisterbekanntmachung nach dem Umwandlungsgesetz 23.06.2025 (Eintragungsdatum)\n\nJESCH-Aufzüge GmbH & Co. KG\nKommanditgesellschaft\nBerlin\n\nZu Eintragungsnummer 8 vom 23.06.2025 wird als nicht eingetragen veröffentlicht: Den Gläubigern der an der Verschmelzung beteiligten Rechtsträger ist, wenn sie binnen sechs Monaten nach dem Tag, an dem die Eintragung der Verschmelzung in das Register des Sitzes desjenigen Rechtsträgers, dessen Gläubiger sie sind, als bekannt gemacht gilt, ihren Anspruch nach Grund und Höhe schriftlich anmelden, Sicherheit zu leisten, soweit sie nicht Befriedigung verlangen können. Dieses Recht steht den Gläubigern jedoch nur zu, wenn sie glaubhaft machen, dass durch die Verschmelzung die Erfüllung ihrer Forderung gefährdet wird. Das Recht, Sicherheitsleistung zu verlangen, steht Gläubigern nicht zu, die im Falle der Insolvenz ein Recht auf vorzugsweise Befriedigung aus einer Deckungsmasse haben, die nach gesetzlicher Vorschrift zu ihrem Schutz errichtet und staatlich überwacht ist."
    },
    {
      "date": "2025-06-23",
      "id": "112997",
      "original_text": "Sonstige Registerbekanntmachung\nSchleswig-Holstein Amtsgericht Flensburg GnR 40 SL\nHäute - und Felle - Spedition des Kreises Schleswig-Flensburg e.G. – Fahrdorf",
      "type": "Sonstige Registerbekanntmachung",
      "state": "Schleswig-Holstein",
      "amtsgericht": "Amtsgericht Flensburg",
      "registernummer": "GnR 40 SL",
      "registerart": "GnR",
      "company_name": "Häute - und Felle - Spedition des Kreises Schleswig-Flensburg e.G.",
      "company_seat": "Fahrdorf",
      "details": "23.06.2025 (Bekanntmachungsdatum)\n\nSchleswig-Holstein Amtsgericht Flensburg GnR 40 SL\nSonstige Registerbekanntmachung 23.06.2025 (Eintragungsdatum)\n\nHäute - und Felle - Spedition des Kreises Schleswig-Flensburg e.G.\neingetragene Genossenschaft\nFahrdorf\n\nAls nicht eingetragen wird veröffentlicht: Gläubigern, deren Forderungen begründet worden sind, bevor die Eintragung des Beschlusses als nach § 10 des Handelsgesetzbuches bekannt gemacht gilt, ist, wenn sie sich binnen sechs Monaten nach der Bekanntmachung zu diesem Zweck melden, Sicherheit zu leisten, soweit sie nicht Befriedigung verlangen können. Dieses Recht steht den Gläubigern nicht zu, die im Fall des Insolvenzverfahrens ein Recht auf vorzugsweise Befriedigung aus der Deckungsmasse haben, die nach gesetzlicher Vorschrift zu ihrem Schutz errichtet und staatlich überwacht ist."
    },
    {
      "date": "2025-06-23",
      "id": "112998",
      "original_text": "Einreichung neuer Dokumente\nBerlin Amtsgericht Berlin (Charlottenburg) HRA 41970\nDMS Deutsche Möbelspedition GmbH & Co. KG – Berlin",
      "type": "Einreichung neuer Dokumente",
      "state": "Berlin",
      "amtsgericht": "Amtsgericht Berlin (Charlottenburg)",
      "registernummer": "HRA 41970",
      "registerart": "HRA",
      "company_name": "DMS Deutsche Möbelspedition GmbH & Co. KG",
      "company_seat": "Berlin",
      "details": "23.06.2025 (Bekanntmachungsdatum)\n\nBerlin Amtsgericht Berlin (Charlottenburg) HRA 41970\nEinreichung neuer Dokumente\n\nDMS Deutsche Möbelspedition GmbH & Co. KG\nKommanditgesellschaft\nBerlin\n\nAls nicht eingetragen wird veröffentlicht: Es wurde eine neue Liste der Aufsichtsratsmitglieder eingereicht."
    },
    {
      "date": "2025-06-23",
      "id": "112999",
      "original_text": "Registerbekanntmachung nach dem Umwandlungsgesetz\nHamburg Amtsgericht Hamburg HRB 21227\nEngel & Völkers Residential GmbH – Hamburg",
      "type": "Registerbekanntmachung nach dem Umwandlungsgesetz",
      "state": "Hamburg",
      "amtsgericht": "Amtsgericht Hamburg",
      "registernummer": "HRB 21227",
      "registerart": "HRB",
      "company_name": "Engel & Völkers Residential GmbH",
      "company_seat": "Hamburg",
      "details": "23.06.2025 (Bekanntmachungsdatum)\n\nHamburg Amtsgericht Hamburg HRB 21227\nRegisterbekanntmachung nach dem Umwandlungsgesetz 23.06.2025 (Eintragungsdatum)\n\nEngel & Völkers Residential GmbH\nGesellschaft mit beschränkter Haftung\nHamburg\n\nAls nicht eingetragen wird bekannt gemacht:\nDen Gläubigern der an der Verschmelzung beteiligten Gesellschaften ist, wenn sie binnen sechs Monaten nach dem Tag, an dem die Eintragung der Verschmelzung in das Register des Sitzes desjenigen Rechtsträgers, dessen Gläubiger sie sind, nach § 19 Absatz 3 UmwG als bekannt gemacht gilt, ihren Anspruch nach Grund und Höhe schriftlich anmelden, Sicherheit zu leisten, soweit sie nicht Befriedigung verlangen können. Dieses Recht steht den Gläubigern jedoch nur zu, wenn sie glaubhaft machen, dass durch die Verschmelzung die Erfüllung ihrer Forderung gefährdet wird."
    },
    {
      "date": "2025-06-23",
      "id": "113000",
      "original_text": "Registerbekanntmachung nach dem Umwandlungsgesetz\nHamburg Amtsgericht Hamburg HRB 95746\nEngel & Völkers U.S. Holding GmbH – Hamburg",
      "type": "Registerbekanntmachung nach dem Umwandlungsgesetz",
      "state": "Hamburg",
      "amtsgericht": "Amtsgericht Hamburg",
      "registernummer": "HRB 95746",
      "registerart": "HRB",
      "company_name": "Engel & Völkers U.S. Holding GmbH",
      "company_seat": "Hamburg",
      "details": "23.06.2025 (Bekanntmachungsdatum)\n\nHamburg Amtsgericht Hamburg HRB 95746\nRegisterbekanntmachung nach dem Umwandlungsgesetz 23.06.2025 (Eintragungsdatum)\n\nEngel & Völkers U.S. Holding GmbH\nGesellschaft mit beschränkter Haftung\nHamburg\n\nAls nicht eingetragen wird bekannt gemacht:\nDen Gläubigern der an der Verschmelzung beteiligten Gesellschaften ist, wenn sie binnen sechs Monaten nach dem Tag, an dem die Eintragung der Verschmelzung in das Register des Sitzes desjenigen Rechtsträgers, dessen Gläubiger sie sind, nach § 19 Absatz 3 UmwG als bekannt gemacht gilt, ihren Anspruch nach Grund und Höhe schriftlich anmelden, Sicherheit zu leisten, soweit sie nicht Befriedigung verlangen können. Dieses Recht steht den Gläubigern jedoch nur zu, wenn sie glaubhaft machen, dass durch die Verschmelzung die Erfüllung ihrer Forderung gefährdet wird."
    },
    {
      "date": "2025-06-23",
      "id": "113001",
      "original_text": "Einreichung neuer Dokumente\nBerlin Amtsgericht Berlin (Charlottenburg) HRB 90731\nCTG BFP AG Steuerberatungsgesellschaft – Berlin",
      "type": "Einreichung neuer Dokumente",
      "state": "Berlin",
      "amtsgericht": "Amtsgericht Berlin (Charlottenburg)",
      "registernummer": "HRB 90731",
      "registerart": "HRB",
      "company_name": "CTG BFP AG Steuerberatungsgesellschaft",
      "company_seat": "Berlin",
      "details": "23.06.2025 (Bekanntmachungsdatum)\n\nBerlin Amtsgericht Berlin (Charlottenburg) HRB 90731\nEinreichung neuer Dokumente\n\nCTG BFP AG Steuerberatungsgesellschaft\nAktiengesellschaft\nBerlin\n\nAls nicht eingetragen wird veröffentlicht: Die Gesellschaft hat den Entwurf eines Verschmelzungsvertrages betreffend die Verschmelzung der Gesellschaft auf die ETL CTG GmbH Steuerberatungsgesellschaft mit Sitz in Berlin (Amtsgericht Charlottenburg, HRB 271977 B) zum Handelsregister des Amtsgericht Charlottenburg eingereicht."
    },
    {
      "date": "2025-06-23",
      "id": "113002",
      "original_text": "Registerbekanntmachung nach dem Umwandlungsgesetz\nBrandenburg Amtsgericht Cottbus HRB 18594\nRubikon Plan Projekt GmbH – Cottbus",
      "type": "Registerbekanntmachung nach dem Umwandlungsgesetz",
      "state": "Brandenburg",
      "amtsgericht": "Amtsgericht Cottbus",
      "registernummer": "HRB 18594",
      "registerart": "HRB",
      "company_name": "Rubikon Plan Projekt GmbH",
      "company_seat": "Cottbus",
      "details": "23.06.2025 (Bekanntmachungsdatum)\n\nBrandenburg Amtsgericht Cottbus HRB 18594\nRegisterbekanntmachung nach dem Umwandlungsgesetz 23.06.2025 (Eintragungsdatum)\n\nRubikon Plan Projekt GmbH\nGesellschaft mit beschränkter Haftung\nCottbus\n\nAls nicht eingetragen wird veröffentlicht:\nDen Gläubigern der an der Ausgliederung beteiligten Rechtsträger ist, wenn sie binnen sechs Monaten nach dem Tag, an dem die Eintragung der Ausgliederung in das Register des Sitzes desjenigen Rechtsträgers, dessen Gläubiger sie sind, als bekannt gemacht gilt, ihren Anspruch nach Grund und Höhe schriftlich anmelden, Sicherheit zu leisten, soweit sie nicht Befriedigung verlangen können. Dieses Recht steht den Gläubigern jedoch nur zu, wenn sie glaubhaft machen, dass durch die Ausgliederung die Erfüllung ihrer Forderung gefährdet wird"
    },
    {
      "date": "2025-06-23",
      "id": "113003",
      "original_text": "Registerbekanntmachung nach dem Umwandlungsgesetz\nBaden-Württemberg Amtsgericht Stuttgart HRA 742443\nAundO Solution OHG – Reutlingen",
      "type": "Registerbekanntmachung nach dem Umwandlungsgesetz",
      "state": "Baden-Württemberg",
      "amtsgericht": "Amtsgericht Stuttgart",
      "registernummer": "HRA 742443",
      "registerart": "HRA",
      "company_name": "AundO Solution OHG",
      "company_seat": "Reutlingen",
      "details": "23.06.2025 (Bekanntmachungsdatum)\n\nBaden-Württemberg Amtsgericht Stuttgart HRA 742443\nRegisterbekanntmachung nach dem Umwandlungsgesetz 23.06.2025 (Eintragungsdatum)\n\nAundO Solution OHG\nOffene Handelsgesellschaft\nReutlingen\n\nDen Gläubigern des an dem Formwechsel beteiligten Rechtsträgers ist, wenn sie binnen sechs Monaten nach dem Tag, an dem die Eintragung des Formwechsels in das Register des Sitzes desjenigen Rechtsträgers, dessen Gläubiger sie sind, nach § 19 Abs. 3 UmwG als bekanntgemacht gilt, ihren Anspruch nach Grund und Höhe schriftlich anmelden, Sicherheit zu leisten, soweit sie nicht Befriedigung verlangen können. Dieses Recht steht den Gläubigern jedoch nur zu, wenn sie glaubhaft machen, dass durch den Formwechsel die Erfüllung ihrer Forderung gefährdet wird."
    },
    {
      "date": "2025-06-23",
      "id": "113004",
      "original_text": "Registerbekanntmachung nach dem Umwandlungsgesetz\nBaden-Württemberg Amtsgericht Stuttgart HRB 772445\nAundO Solution GmbH – Reutlingen",
      "type": "Registerbekanntmachung nach dem Umwandlungsgesetz",
      "state": "Baden-Württemberg",
      "amtsgericht": "Amtsgericht Stuttgart",
      "registernummer": "HRB 772445",
      "registerart": "HRB",
      "company_name": "AundO Solution GmbH",
      "company_seat": "Reutlingen",
      "details": "23.06.2025 (Bekanntmachungsdatum)\n\nBaden-Württemberg Amtsgericht Stuttgart HRB 772445\nRegisterbekanntmachung nach dem Umwandlungsgesetz 23.06.2025 (Eintragungsdatum)\n\nAundO Solution GmbH\nGesellschaft mit beschränkter Haftung\nReutlingen\n\nDen Gläubigern des an dem Formwechsel beteiligten Rechtsträgers ist, wenn sie binnen sechs Monaten nach dem Tag, an dem die Eintragung des Formwechsels in das Register des Sitzes desjenigen Rechtsträgers, dessen Gläubiger sie sind, nach § 19 Abs. 3 UmwG als bekanntgemacht gilt, ihren Anspruch nach Grund und Höhe schriftlich anmelden, Sicherheit zu leisten, soweit sie nicht Befriedigung verlangen können. Dieses Recht steht den Gläubigern jedoch nur zu, wenn sie glaubhaft machen, dass durch den Formwechsel die Erfüllung ihrer Forderung gefährdet wird."
    },
    {
      "date": "2025-06-23",
      "id": "113005",
      "original_text": "Löschungsankündigung\nSchleswig-Holstein Amtsgericht Pinneberg HRA 8038\nMR Schleswig-Holstein Energie Pool GmbH & Co. KG – Lehe",
      "type": "Löschungsankündigung",
      "state": "Schleswig-Holstein",
      "amtsgericht": "Amtsgericht Pinneberg",
      "registernummer": "HRA 8038",
      "registerart": "HRA",
      "company_name": "MR Schleswig-Holstein Energie Pool GmbH & Co. KG",
      "company_seat": "Lehe",
      "details": "23.06.2025 (Bekanntmachungsdatum)\n\nSchleswig-Holstein Amtsgericht Pinneberg HRA 8038\nLöschungsankündigung\n\nMR Schleswig-Holstein Energie Pool GmbH & Co. KG\nKommanditgesellschaft\nLehe\n\nEs ist die Löschung der nachstehenden Gesellschaft wegen Vermögenslosigkeit gemäß § 394 FamFG beabsichtigt. Widerspruchsfrist: 2 Monate."
    },
    {
      "date": "2025-06-23",
      "id": "113006",
      "original_text": "Registerbekanntmachung nach dem Umwandlungsgesetz\nBaden-Württemberg Amtsgericht Stuttgart HRB 798789\nBuck Powder GmbH – Herrenberg",
      "type": "Registerbekanntmachung nach dem Umwandlungsgesetz",
      "state": "Baden-Württemberg",
      "amtsgericht": "Amtsgericht Stuttgart",
      "registernummer": "HRB 798789",
      "registerart": "HRB",
      "company_name": "Buck Powder GmbH",
      "company_seat": "Herrenberg",
      "details": "23.06.2025 (Bekanntmachungsdatum)\n\nBaden-Württemberg Amtsgericht Stuttgart HRB 798789\nRegisterbekanntmachung nach dem Umwandlungsgesetz 23.06.2025 (Eintragungsdatum)\n\nBuck Powder GmbH\nGesellschaft mit beschränkter Haftung\nHerrenberg\n\nAls nicht eingetragen wird bekanntgemacht:\nDen Gläubigern der an der Verschmelzung beteiligten Rechtsträger ist, wenn sie binnen sechs Monaten nach dem Tag, an dem die Eintragung der Verschmelzung in das Register des Sitzes desjenigen Rechtsträgers, dessen Gläubiger sie sind, nach § 19 Abs. 3 UmwG als bekanntgemacht gilt, ihren Anspruch nach Grund und Höhe schriftlich anmelden, Sicherheit zu leisten, soweit sie nicht Befriedigung verlangen können. Dieses Recht steht den Gläubigern jedoch nur zu, wenn sie glaubhaft machen, dass durch die Verschmelzung die Erfüllung ihrer Forderung gefährdet wird."
    },
    {
      "date": "2025-06-23",
      "id": "113007",
      "original_text": "Löschungsankündigung\nBerlin Amtsgericht Berlin (Charlottenburg) HRB 201513\nTrinstens UG (haftungsbeschränkt) – Berlin",
      "type": "Löschungsankündigung",
      "state": "Berlin",
      "amtsgericht": "Amtsgericht Berlin (Charlottenburg)",
      "registernummer": "HRB 201513",
      "registerart": "HRB",
      "company_name": "Trinstens UG (haftungsbeschränkt)",
      "company_seat": "Berlin",
      "details": "23.06.2025 (Bekanntmachungsdatum)\n\nBerlin Amtsgericht Berlin (Charlottenburg) HRB 201513\nLöschungsankündigung\n\nTrinstens UG (haftungsbeschränkt)\nGesellschaft mit beschränkter Haftung\nBerlin\n\nBei der nachstehenden Gesellschaft wird das Amtslöschungsverfahren gemäß § 394 FamFG eingeleitet. Widerspruchsfrist 6 Wochen"
    },
    {
      "date": "2025-06-23",
      "id": "113008",
      "original_text": "Registerbekanntmachung nach dem Umwandlungsgesetz\nBrandenburg Amtsgericht Neuruppin HRB 14963\nLebensRaum Brandenburg GmbH – Oranienburg",
      "type": "Registerbekanntmachung nach dem Umwandlungsgesetz",
      "state": "Brandenburg",
      "amtsgericht": "Amtsgericht Neuruppin",
      "registernummer": "HRB 14963",
      "registerart": "HRB",
      "company_name": "LebensRaum Brandenburg GmbH",
      "company_seat": "Oranienburg",
      "details": "23.06.2025 (Bekanntmachungsdatum)\n\nBrandenburg Amtsgericht Neuruppin HRB 14963\nRegisterbekanntmachung nach dem Umwandlungsgesetz 20.06.2025 (Eintragungsdatum)\n\nLebensRaum Brandenburg GmbH\nGesellschaft mit beschränkter Haftung\nOranienburg\n\nZu Eintragungsnummer 2 vom 20.06.2025 wird als nicht eingetragen veröffentlicht:\nDen Gläubigern der an der Umwandlung beteiligten Rechtsträger ist, wenn sie binnen sechs Monaten nach dem Tag, an dem die Eintragung der Umwandlung in das Register des Sitzes desjenigen Rechtsträgers, dessen Gläubiger sie sind, als bekannt gemacht gilt, ihren Anspruch nach Grund und Höhe schriftlich anmelden, Sicherheit zu leisten, soweit sie nicht Befriedigung verlangen können. Dieses Recht steht den Gläubigern jedoch nur zu, wenn sie glaubhaft machen, dass durch die Umwandlung die Erfüllung ihrer Forderung gefährdet wird"
    },
    {
      "date": "2025-06-23",
      "id": "113009",
      "original_text": "Registerbekanntmachung nach dem Umwandlungsgesetz\nBaden-Württemberg Amtsgericht Stuttgart HRB 13550\nEXAMION GmbH – Fellbach",
      "type": "Registerbekanntmachung nach dem Umwandlungsgesetz",
      "state": "Baden-Württemberg",
      "amtsgericht": "Amtsgericht Stuttgart",
      "registernummer": "HRB 13550",
      "registerart": "HRB",
      "company_name": "EXAMION GmbH",
      "company_seat": "Fellbach",
      "details": "23.06.2025 (Bekanntmachungsdatum)\n\nBaden-Württemberg Amtsgericht Stuttgart HRB 13550\nRegisterbekanntmachung nach dem Umwandlungsgesetz\n\nEXAMION GmbH\nGesellschaft mit beschränkter Haftung\nFellbach\n\nAls nicht eingetragen wird bekanntgemacht:\nEs wird darauf hingewiesen, dass ein ein Entwurf des Verschmelzungsplans über eine grenzüberschreitende Verschmelzung zur Aufnahme mit folgenden Rechtsträgern beim Handelsregister eingereicht worden:\na) als übertragende Gesellschaft die Vet X SRL, eine Gesellschaft mit beschränkter Haftung nach belgischem Recht mit Sitz in Andenne, Belgien und mit der Geschäftsanschrift Rue de Pontillas 338, 5300 Andenne, Belgien\nb) als übernehmende Gesellschaft die EXAMION GmbH, eine Gesellschaft mit beschränkter Haftung deutschen Rechts mit Sitz in Fellbach, Deutschland  und mit der Geschäftsanschrift Erich-Herion-Straße 37, 70736 Fellbach\nDie Gesellschaften sind in folgenden Registern eingetragen:\na) die Vet X SRL ist in der belgischen Zentralen Datenbank der Unternehmen (ZDU) (Registre des Personnes Morales Liége, division Namur) unter der Unternehmensnummer 0666.739.495 eingetragen.\nb) die EXAMION GmbH ist im Handelsregister des Amtsgerichts Stuttgart unter HRB 13550 eingetragen.\nDie Anteilsinhaber, die Gläubiger sowie die zuständigen Betriebsräte der an der grenzüberschreitenden Verschmelzung beteiligten Gesellschaften oder, soweit es keinen Betriebsrat gibt, die Arbeitnehmer der an der grenzüberschreitenden Verschmelzung beteiligten Gesellschaften, können der jeweiligen Gesellschaft spätestens fünf Arbeitstage vor dem Tag der Gesellschafterversammlung Bemerkungen zum Verschmelzungsplan übermitteln. Diese Gesellschafterversammlung wird voraussichtlich am 30.09.2025 stattfinden."
    },
    {
      "date": "2025-06-23",
      "id": "113010",
      "original_text": "Registerbekanntmachung nach dem Umwandlungsgesetz\nNiedersachsen Amtsgericht Oldenburg (Oldenburg) HRB 222372\nValego Sol 1 Beteiligungsgesellschaft mbH – Oldenburg",
      "type": "Registerbekanntmachung nach dem Umwandlungsgesetz",
      "state": "Niedersachsen",
      "amtsgericht": "Amtsgericht Oldenburg (Oldenburg)",
      "registernummer": "HRB 222372",
      "registerart": "HRB",
      "company_name": "Valego Sol 1 Beteiligungsgesellschaft mbH",
      "company_seat": "Oldenburg",
      "details": "23.06.2025 (Bekanntmachungsdatum)\n\nNiedersachsen Amtsgericht Oldenburg (Oldenburg) HRB 222372\nRegisterbekanntmachung nach dem Umwandlungsgesetz 23.06.2025 (Eintragungsdatum)\n\nValego Sol 1 Beteiligungsgesellschaft mbH\nGesellschaft mit beschränkter Haftung\nOldenburg\n\nDen Gläubigern der an der formwechselnden Umwandlung beteiligten Rechtsträger ist, wenn sie binnen sechs Monaten nach dem Tag, an dem die Eintragung der Umwandlung in das Register des Sitzes desjenigen Rechtsträgers, dessen Gläubiger sie sind, nach § 19 Abs. 3 UmwG als bekannt gemacht gilt, ihren Anspruch nach Grund und Höhe schriftlich anmelden, Sicherheit zu leisten, soweit sie nicht Befriedigung verlangen können. Dieses Recht steht den Gläubigern jedoch nur zu, wenn sie glaubhaft machen, dass durch die formwechselnde Umwandlung die Erfüllung der Forderung gefährdet wird."
    },
    {
      "date": "2025-06-23",
      "id": "113011",
      "original_text": "Einreichung neuer Dokumente\nNiedersachsen Amtsgericht Oldenburg (Oldenburg) HRB 140799 früher Amtsgericht Delmenhorst\nHYDROTEC Technologies Aktiengesellschaft – Wildeshausen",
      "type": "Einreichung neuer Dokumente",
      "state": "Niedersachsen",
      "amtsgericht": "Amtsgericht Oldenburg (Oldenburg)",
      "registernummer": "HRB 140799",
      "registerart": "HRB",
      "company_name": "HYDROTEC Technologies Aktiengesellschaft",
      "company_seat": "Wildeshausen",
      "former_amtsgericht": "Delmenhorst",
      "details": "23.06.2025 (Bekanntmachungsdatum)\n\nNiedersachsen Amtsgericht Oldenburg (Oldenburg) HRB 140799 früher Amtsgericht Delmenhorst\nEinreichung neuer Dokumente 23.06.2025 (Eintragungsdatum)\n\nHYDROTEC Technologies Aktiengesellschaft\nAktiengesellschaft\nWildeshausen\n\nDie Liste der Mitglieder des Aufsichtsrats wurde beim Registergericht eingereicht."
    },
    {
      "date": "2025-06-23",
      "id": "113012",
      "original_text": "Löschungsankündigung\nNiedersachsen Amtsgericht Aurich HRA 110587 früher Amtsgericht Leer (Ostfriesland) (Leer)\nMS \"HILDE K\" Phoenix Schiffahrts GmbH & Co. KG – Leer",
      "type": "Löschungsankündigung",
      "state": "Niedersachsen",
      "amtsgericht": "Amtsgericht Aurich",
      "registernummer": "HRA 110587",
      "registerart": "HRA",
      "company_name": "MS \"HILDE K\" Phoenix Schiffahrts GmbH & Co. KG",
      "company_seat": "Leer",
      "former_amtsgericht": "Leer (Ostfriesland) (Leer)",
      "details": "23.06.2025 (Bekanntmachungsdatum)\n\nNiedersachsen Amtsgericht Aurich HRA 110587 früher Amtsgericht Leer (Ostfriesland) (Leer)\nLöschungsankündigung\n\nMS \"HILDE K\" Phoenix Schiffahrts GmbH & Co. KG\nKommanditgesellschaft\nLeer\n\nDas Registergericht beabsichtigt, die Firma von Amts wegen nach § 394 FamFG zu löschen. Die Frist zur Erhebung eines Widerspruchs ist auf 1 Monat ab dieser Registerbekanntmachung festgesetzt."
    },
    {
      "date": "2025-06-23",
      "id": "113013",
      "original_text": "Löschungsankündigung\nNiedersachsen Amtsgericht Hildesheim HRB 3238\nAutopark Brau GmbH – Hildesheim",
      "type": "Löschungsankündigung",
      "state": "Niedersachsen",
      "amtsgericht": "Amtsgericht Hildesheim",
      "registernummer": "HRB 3238",
      "registerart": "HRB",
      "company_name": "Autopark Brau GmbH",
      "company_seat": "Hildesheim",
      "details": "23.06.2025 (Bekanntmachungsdatum)\n\nNiedersachsen Amtsgericht Hildesheim HRB 3238\nLöschungsankündigung\n\nAutopark Brau GmbH\nGesellschaft mit beschränkter Haftung\nHildesheim\n\nDas Registergericht beabsichtigt, die Gesellschaft von Amts wegen nach § 394 FamFG zu löschen. Die Frist zur Erhebung eines Widerspruchs ist auf 1 Monat ab dieser Registerbekanntmachung festgesetzt."
    },
    {
      "date": "2025-06-23",
      "id": "113014",
      "original_text": "Registerbekanntmachung nach dem Umwandlungsgesetz\nNiedersachsen Amtsgericht Hannover HRB 217309\nflaschenpost Hannover GmbH – Hannover",
      "type": "Registerbekanntmachung nach dem Umwandlungsgesetz",
      "state": "Niedersachsen",
      "amtsgericht": "Amtsgericht Hannover",
      "registernummer": "HRB 217309",
      "registerart": "HRB",
      "company_name": "flaschenpost Hannover GmbH",
      "company_seat": "Hannover",
      "details": "23.06.2025 (Bekanntmachungsdatum)\n\nNiedersachsen Amtsgericht Hannover HRB 217309\nRegisterbekanntmachung nach dem Umwandlungsgesetz 17.06.2025 (Eintragungsdatum)\n\nflaschenpost Hannover GmbH\nGesellschaft mit beschränkter Haftung\nHannover\n\nDen Gläubigern der an der Verschmelzung beteiligten Rechtsträger ist, wenn sie binnen sechs Monaten nach dem Tag, an dem die Eintragung der Verschmelzung in das Register des Sitzes desjenigen Rechtsträgers, dessen Gläubiger sie sind, nach § 19  Abs.  3 UmwG als bekannt gemacht gilt, ihren Anspruch nach Grund und Höhe schriftlich anmelden, Sicherheit zu leisten, soweit sie nicht Befriedigung verlangen können. Dieses Recht steht den Gläubigern jedoch nur zu, wenn sie glaubhaft machen, dass durch die Verschmelzung die Erfüllung der Forderung gefährdet wird."
    },
    {
      "date": "2025-06-23",
      "id": "113015",
      "original_text": "Registerbekanntmachung nach dem Umwandlungsgesetz\nNiedersachsen Amtsgericht Hannover HRA 23519\nF. A. Stichweh GmbH & Co. KG – Hannover",
      "type": "Registerbekanntmachung nach dem Umwandlungsgesetz",
      "state": "Niedersachsen",
      "amtsgericht": "Amtsgericht Hannover",
      "registernummer": "HRA 23519",
      "registerart": "HRA",
      "company_name": "F. A. Stichweh GmbH & Co. KG",
      "company_seat": "Hannover",
      "details": "23.06.2025 (Bekanntmachungsdatum)\n\nNiedersachsen Amtsgericht Hannover HRA 23519\nRegisterbekanntmachung nach dem Umwandlungsgesetz 23.06.2025 (Eintragungsdatum)\n\nF. A. Stichweh GmbH & Co. KG\nKommanditgesellschaft\nHannover\n\nDen Gläubigern der an der Verschmelzung beteiligten Rechtsträger ist, wenn sie binnen sechs Monaten nach dem Tag, an dem die Eintragung der Verschmelzung in das Register des Sitzes desjenigen Rechtsträgers, dessen Gläubiger sie sind, nach § 19  Abs.  3 UmwG als bekannt gemacht gilt, ihren Anspruch nach Grund und Höhe schriftlich anmelden, Sicherheit zu leisten, soweit sie nicht Befriedigung verlangen können. Dieses Recht steht den Gläubigern jedoch nur zu, wenn sie glaubhaft machen, dass durch die Verschmelzung die Erfüllung der Forderung gefährdet wird."
    },
    {
      "date": "2025-06-23",
      "id": "113016",
      "original_text": "Einreichung neuer Dokumente\nNiedersachsen Amtsgericht Osnabrück HRB 210689\nH&R GmbH & Co. KGaA – Salzbergen",
      "type": "Einreichung neuer Dokumente",
      "state": "Niedersachsen",
      "amtsgericht": "Amtsgericht Osnabrück",
      "registernummer": "HRB 210689",
      "registerart": "HRB",
      "company_name": "H&R GmbH & Co. KGaA",
      "company_seat": "Salzbergen",
      "details": "23.06.2025 (Bekanntmachungsdatum)\n\nNiedersachsen Amtsgericht Osnabrück HRB 210689\nEinreichung neuer Dokumente\n\nH&R GmbH & Co. KGaA\nKommanditgesellschaft auf Aktien\nSalzbergen\n\nDie Liste der Mitglieder des Aufsichtsrats wurde beim Registergericht eingereicht."
    },
    {
      "date": "2025-06-23",
      "id": "113017",
      "original_text": "Registerbekanntmachung nach dem Umwandlungsgesetz\nNiedersachsen Amtsgericht Oldenburg (Oldenburg) HRA 207734\nValego Sol 1 Beteiligungsgesellschaft mbH & Co. KG – Oldenburg",
      "type": "Registerbekanntmachung nach dem Umwandlungsgesetz",
      "state": "Niedersachsen",
      "amtsgericht": "Amtsgericht Oldenburg (Oldenburg)",
      "registernummer": "HRA 207734",
      "registerart": "HRA",
      "company_name": "Valego Sol 1 Beteiligungsgesellschaft mbH & Co. KG",
      "company_seat": "Oldenburg",
      "details": "23.06.2025 (Bekanntmachungsdatum)\n\nNiedersachsen Amtsgericht Oldenburg (Oldenburg) HRA 207734\nRegisterbekanntmachung nach dem Umwandlungsgesetz 23.06.2025 (Eintragungsdatum)\n\nValego Sol 1 Beteiligungsgesellschaft mbH & Co. KG\nKommanditgesellschaft\nOldenburg\n\nDen Gläubigern der an der formwechselnden Umwandlung beteiligten Rechtsträger ist, wenn sie binnen sechs Monaten nach dem Tag, an dem die Eintragung der Umwandlung in das Register des Sitzes desjenigen Rechtsträgers, dessen Gläubiger sie sind, nach § 19 Abs. 3 UmwG als bekannt gemacht gilt, ihren Anspruch nach Grund und Höhe schriftlich anmelden, Sicherheit zu leisten, soweit sie nicht Befriedigung verlangen können. Dieses Recht steht den Gläubigern jedoch nur zu, wenn sie glaubhaft machen, dass durch die formwechselnde Umwandlung die Erfüllung der Forderung gefährdet wird."
    },
    {
      "date": "2025-06-23",
      "id": "113018",
      "original_text": "Registerbekanntmachung nach dem Umwandlungsgesetz\nNiedersachsen Amtsgericht Hannover HRA 27214\nSAV Stichweh Anlagen Vermietung GmbH & Co. KG – Hannover",
      "type": "Registerbekanntmachung nach dem Umwandlungsgesetz",
      "state": "Niedersachsen",
      "amtsgericht": "Amtsgericht Hannover",
      "registernummer": "HRA 27214",
      "registerart": "HRA",
      "company_name": "SAV Stichweh Anlagen Vermietung GmbH & Co. KG",
      "company_seat": "Hannover",
      "details": "23.06.2025 (Bekanntmachungsdatum)\n\nNiedersachsen Amtsgericht Hannover HRA 27214\nRegisterbekanntmachung nach dem Umwandlungsgesetz 23.06.2025 (Eintragungsdatum)\n\nSAV Stichweh Anlagen Vermietung GmbH & Co. KG\nKommanditgesellschaft\nHannover\n\nDen Gläubigern der an der Verschmelzung beteiligten Rechtsträger ist, wenn sie binnen sechs Monaten nach dem Tag, an dem die Eintragung der Verschmelzung in das Register des Sitzes desjenigen Rechtsträgers, dessen Gläubiger sie sind, nach § 19  Abs.  3 UmwG als bekannt gemacht gilt, ihren Anspruch nach Grund und Höhe schriftlich anmelden, Sicherheit zu leisten, soweit sie nicht Befriedigung verlangen können. Dieses Recht steht den Gläubigern jedoch nur zu, wenn sie glaubhaft machen, dass durch die Verschmelzung die Erfüllung der Forderung gefährdet wird."
    },
    {
      "date": "2025-06-23",
      "id": "113019",
      "original_text": "Registerbekanntmachung nach dem Umwandlungsgesetz\nNiedersachsen Amtsgericht Hannover HRA 206691\nHTJ Grundstücks UG (haftungsbeschränkt) & Co. KG – Garbsen",
      "type": "Registerbekanntmachung nach dem Umwandlungsgesetz",
      "state": "Niedersachsen",
      "amtsgericht": "Amtsgericht Hannover",
      "registernummer": "HRA 206691",
      "registerart": "HRA",
      "company_name": "HTJ Grundstücks UG (haftungsbeschränkt) & Co. KG",
      "company_seat": "Garbsen",
      "details": "23.06.2025 (Bekanntmachungsdatum)\n\nNiedersachsen Amtsgericht Hannover HRA 206691\nRegisterbekanntmachung nach dem Umwandlungsgesetz 23.06.2025 (Eintragungsdatum)\n\nHTJ Grundstücks UG (haftungsbeschränkt) & Co. KG\nKommanditgesellschaft\nGarbsen\n\nDen Gläubigern der an der Ausgliederung beteiligten Rechtsträger ist, wenn sie binnen sechs Monaten nach dem Tag, an dem die Eintragung der Ausgliederung in das Register des Sitzes desjenigen Rechtsträgers, dessen Gläubiger sie sind, nach § 19 Abs. 3 UmwG als bekannt gemacht gilt, ihren Anspruch nach Grund und Höhe schriftlich anmelden, Sicherheit zu leisten, soweit sie nicht Befriedigung verlangen können. Dieses Recht steht den Gläubigern jedoch nur zu, wenn sie glaubhaft machen, dass durch die Ausgliederung die Erfüllung der Forderung gefährdet wird."
    },
    {
      "date": "2025-06-23",
      "id": "113020",
      "original_text": "Registerbekanntmachung nach dem Umwandlungsgesetz\nNiedersachsen Amtsgericht Hildesheim HRB 207950\ndigitalshopz GmbH – Giesen",
      "type": "Registerbekanntmachung nach dem Umwandlungsgesetz",
      "state": "Niedersachsen",
      "amtsgericht": "Amtsgericht Hildesheim",
      "registernummer": "HRB 207950",
      "registerart": "HRB",
      "company_name": "digitalshopz GmbH",
      "company_seat": "Giesen",
      "details": "23.06.2025 (Bekanntmachungsdatum)\n\nNiedersachsen Amtsgericht Hildesheim HRB 207950\nRegisterbekanntmachung nach dem Umwandlungsgesetz 23.06.2025 (Eintragungsdatum)\n\ndigitalshopz GmbH\nGesellschaft mit beschränkter Haftung\nGiesen\n\nDen Gläubigern der an der formwechselnden Umwandlung beteiligten Rechtsträger ist, wenn sie binnen sechs Monaten nach dem Tag, an dem die Eintragung der Umwandlung in das Register des Sitzes desjenigen Rechtsträgers, dessen Gläubiger sie sind, nach § 19 Abs. 3 UmwG als bekannt gemacht gilt, ihren Anspruch nach Grund und Höhe schriftlich anmelden, Sicherheit zu leisten, soweit sie nicht Befriedigung verlangen können. Dieses Recht steht den Gläubigern jedoch nur zu, wenn sie glaubhaft machen, dass durch die formwechselnde Umwandlung die Erfüllung der Forderung gefährdet wird."
    },
    {
      "date": "2025-06-23",
      "id": "113021",
      "original_text": "Registerbekanntmachung nach dem Umwandlungsgesetz\nNiedersachsen Amtsgericht Hannover HRA 110143 früher Amtsgericht Neustadt a. Rbge. (Neustadt)\nHarry Thiele Kraftfahrzeuge e.K. – Garbsen",
      "type": "Registerbekanntmachung nach dem Umwandlungsgesetz",
      "state": "Niedersachsen",
      "amtsgericht": "Amtsgericht Hannover",
      "registernummer": "HRA 110143",
      "registerart": "HRA",
      "company_name": "Harry Thiele Kraftfahrzeuge e.K.",
      "company_seat": "Garbsen",
      "former_amtsgericht": "Neustadt a. Rbge. (Neustadt)",
      "details": "23.06.2025 (Bekanntmachungsdatum)\n\nNiedersachsen Amtsgericht Hannover HRA 110143 früher Amtsgericht Neustadt a. Rbge. (Neustadt)\nRegisterbekanntmachung nach dem Umwandlungsgesetz 23.06.2025 (Eintragungsdatum)\n\nHarry Thiele Kraftfahrzeuge e.K.\nEinzelkaufmann / Einzelkauffrau\nGarbsen\n\nDen Gläubigern der an der Ausgliederung beteiligten Rechtsträger ist, wenn sie binnen sechs Monaten nach dem Tag, an dem die Eintragung der Ausgliederung in das Register des Sitzes desjenigen Rechtsträgers, dessen Gläubiger sie sind, nach § 19 Abs. 3 UmwG als bekannt gemacht gilt, ihren Anspruch nach Grund und Höhe schriftlich anmelden, Sicherheit zu leisten, soweit sie nicht Befriedigung verlangen können. Dieses Recht steht den Gläubigern jedoch nur zu, wenn sie glaubhaft machen, dass durch die Ausgliederung die Erfüllung der Forderung gefährdet wird."
    },
    {
      "date": "2025-06-23",
      "id": "113022",
      "original_text": "Löschungsankündigung\nNiedersachsen Amtsgericht Hildesheim HRA 202587\nGERM Gebäudetechnik GmbH & Co. KG – Meinersen",
      "type": "Löschungsankündigung",
      "state": "Niedersachsen",
      "amtsgericht": "Amtsgericht Hildesheim",
      "registernummer": "HRA 202587",
      "registerart": "HRA",
      "company_name": "GERM Gebäudetechnik GmbH & Co. KG",
      "company_seat": "Meinersen",
      "details": "23.06.2025 (Bekanntmachungsdatum)\n\nNiedersachsen Amtsgericht Hildesheim HRA 202587\nLöschungsankündigung\n\nGERM Gebäudetechnik GmbH & Co. KG\nKommanditgesellschaft\nMeinersen\n\nDas Registergericht beabsichtigt, die Firma von Amts wegen nach § 394 FamFG zu löschen. Die Frist zur Erhebung eines Widerspruchs ist auf 1 Monat ab dieser Registerbekanntmachung festgesetzt."
    },
    {
      "date": "2025-06-23",
      "id": "113023",
      "original_text": "Registerbekanntmachung nach dem Umwandlungsgesetz\nNiedersachsen Amtsgericht Walsrode HRB 209196\nUnified Experience UG (haftungsbeschränkt) – Schwarmstedt",
      "type": "Registerbekanntmachung nach dem Umwandlungsgesetz",
      "state": "Niedersachsen",
      "amtsgericht": "Amtsgericht Walsrode",
      "registernummer": "HRB 209196",
      "registerart": "HRB",
      "company_name": "Unified Experience UG (haftungsbeschränkt)",
      "company_seat": "Schwarmstedt",
      "details": "23.06.2025 (Bekanntmachungsdatum)\n\nNiedersachsen Amtsgericht Walsrode HRB 209196\nRegisterbekanntmachung nach dem Umwandlungsgesetz 23.06.2025 (Eintragungsdatum)\n\nUnified Experience UG (haftungsbeschränkt)\nGesellschaft mit beschränkter Haftung\nSchwarmstedt\n\nDen Gläubigern der an der Verschmelzung beteiligten Rechtsträger ist, wenn sie binnen sechs Monaten nach dem Tag, an dem die Eintragung der Verschmelzung in das Register des Sitzes desjenigen Rechtsträgers, dessen Gläubiger sie sind, nach § 19  Abs.  3 UmwG als bekannt gemacht gilt, ihren Anspruch nach Grund und Höhe schriftlich anmelden, Sicherheit zu leisten, soweit sie nicht Befriedigung verlangen können. Dieses Recht steht den Gläubigern jedoch nur zu, wenn sie glaubhaft machen, dass durch die Verschmelzung die Erfüllung der Forderung gefährdet wird."
    },
    {
      "date": "2025-06-23",
      "id": "113024",
      "original_text": "Registerbekanntmachung nach dem Umwandlungsgesetz\nNiedersachsen Amtsgericht Braunschweig HRB 147\nESSILOR GmbH – Braunschweig",
      "type": "Registerbekanntmachung nach dem Umwandlungsgesetz",
      "state": "Niedersachsen",
      "amtsgericht": "Amtsgericht Braunschweig",
      "registernummer": "HRB 147",
      "registerart": "HRB",
      "company_name": "ESSILOR GmbH",
      "company_seat": "Braunschweig",
      "details": "23.06.2025 (Bekanntmachungsdatum)\n\nNiedersachsen Amtsgericht Braunschweig HRB 147\nRegisterbekanntmachung nach dem Umwandlungsgesetz 23.06.2025 (Eintragungsdatum)\n\nESSILOR GmbH\nGesellschaft mit beschränkter Haftung\nBraunschweig\n\nDen Gläubigern der an der Verschmelzung beteiligten Rechtsträger ist, wenn sie binnen sechs Monaten nach dem Tag, an dem die Eintragung der Verschmelzung in das Register des Sitzes desjenigen Rechtsträgers, dessen Gläubiger sie sind, nach § 19  Abs.  3 UmwG als bekannt gemacht gilt, ihren Anspruch nach Grund und Höhe schriftlich anmelden, Sicherheit zu leisten, soweit sie nicht Befriedigung verlangen können. Dieses Recht steht den Gläubigern jedoch nur zu, wenn sie glaubhaft machen, dass durch die Verschmelzung die Erfüllung der Forderung gefährdet wird."
    },
    {
      "date": "2025-06-23",
      "id": "113025",
      "original_text": "Einreichung neuer Dokumente\nRheinland-Pfalz Amtsgericht Wittlich HRB 1149\nHochwald Foods GmbH – Thalfang",
      "type": "Einreichung neuer Dokumente",
      "state": "Rheinland-Pfalz",
      "amtsgericht": "Amtsgericht Wittlich",
      "registernummer": "HRB 1149",
      "registerart": "HRB",
      "company_name": "Hochwald Foods GmbH",
      "company_seat": "Thalfang",
      "details": "23.06.2025 (Bekanntmachungsdatum)\n\nRheinland-Pfalz Amtsgericht Wittlich HRB 1149\nEinreichung neuer Dokumente 23.06.2025 (Eintragungsdatum)\n\nHochwald Foods GmbH\nGesellschaft mit beschränkter Haftung\nThalfang\n\nDem Registergericht ist eine neue Liste der Mitglieder des Aufsichtsrates eingereicht worden."
    },
    {
      "date": "2025-06-23",
      "id": "113026",
      "original_text": "Löschungsankündigung\nRheinland-Pfalz Amtsgericht Ludwigshafen a.Rhein (Ludwigshafen) HRB 62198\nWOTRA GmbH – Frankenthal",
      "type": "Löschungsankündigung",
      "state": "Rheinland-Pfalz",
      "amtsgericht": "Amtsgericht Ludwigshafen a.Rhein (Ludwigshafen)",
      "registernummer": "HRB 62198",
      "registerart": "HRB",
      "company_name": "WOTRA GmbH",
      "company_seat": "Frankenthal",
      "details": "23.06.2025 (Bekanntmachungsdatum)\n\nRheinland-Pfalz Amtsgericht Ludwigshafen a.Rhein (Ludwigshafen) HRB 62198\nLöschungsankündigung 23.06.2025 (Eintragungsdatum)\n\nWOTRA GmbH\nGesellschaft mit beschränkter Haftung\nFrankenthal\n\nDas Registergericht beabsichtigt die Gesellschaft von Amts wegen nach § 394 FamFG zu löschen. Die Frist zur Erhebung eines Widerspruchs ist auf einen Monat festgesetzt."
    },
    {
      "date": "2025-06-23",
      "id": "113027",
      "original_text": "Löschungsankündigung\nBremen Amtsgericht Bremen HRB 29350\nACT Handels GmbH – Bremerhaven",
      "type": "Löschungsankündigung",
      "state": "Bremen",
      "amtsgericht": "Amtsgericht Bremen",
      "registernummer": "HRB 29350",
      "registerart": "HRB",
      "company_name": "ACT Handels GmbH",
      "company_seat": "Bremerhaven",
      "details": "23.06.2025 (Bekanntmachungsdatum)\n\nBremen Amtsgericht Bremen HRB 29350\nLöschungsankündigung\n\nACT Handels GmbH\nGesellschaft mit beschränkter Haftung\nBremerhaven\n\nEs ist beabsichtigt die im Handelsregister eingetragene Gesellschaft von Amts wegen gemäß § 394 FamFG zu löschen. Gegen die Löschung kann beim AG Bremen schriftlich oder zu Protokoll der Geschäftsstelle Widerspruch eingelegt werden. Widerspruchsfrist 4 Wochen."
    },
    {
      "date": "2025-06-23",
      "id": "113028",
      "original_text": "Registerbekanntmachung nach dem Umwandlungsgesetz\nNordrhein-Westfalen Amtsgericht Siegburg VR 814\nSCHOELLER-SOZIALFONDS e.V. – Eitorf",
      "type": "Registerbekanntmachung nach dem Umwandlungsgesetz",
      "state": "Nordrhein-Westfalen",
      "amtsgericht": "Amtsgericht Siegburg",
      "registernummer": "VR 814",
      "registerart": "VR",
      "company_name": "SCHOELLER-SOZIALFONDS e.V.",
      "company_seat": "Eitorf",
      "details": "23.06.2025 (Bekanntmachungsdatum)\n\nNordrhein-Westfalen Amtsgericht Siegburg VR 814\nRegisterbekanntmachung nach dem Umwandlungsgesetz 23.06.2025 (Eintragungsdatum)\n\nSCHOELLER-SOZIALFONDS e.V.\neingetragener Verein\nEitorf\n\nDen Gläubigern der an der Verschmelzung beteiligten Rechtsträger ist, wenn sie binnen sechs Monaten nach dem Tag, an dem die Eintragung der Verschmelzung in das Register des Sitzes desjenigen Rechtsträgers, dessen Gläubiger sie sind, nach § 19 Absatz 3 UmwG als bekanntgemacht gilt, ihren Anspruch nach Grund und Höhe schriftlich anmelden, Sicherheit zu leisten, soweit sie nicht Befriedigung verlangen können. Dieses Recht steht den Gläubigern jedoch nur zu, wenn sie glaubhaft machen, dass durch die Verschmelzung die Erfüllung ihrer Forderung gefährdet wird."
    },
    {
      "date": "2025-06-23",
      "id": "113029",
      "original_text": "Einreichung neuer Dokumente\nNordrhein-Westfalen Amtsgericht Bonn HRB 14178\nDeutsche Telekom Service GmbH – Bonn",
      "type": "Einreichung neuer Dokumente",
      "state": "Nordrhein-Westfalen",
      "amtsgericht": "Amtsgericht Bonn",
      "registernummer": "HRB 14178",
      "registerart": "HRB",
      "company_name": "Deutsche Telekom Service GmbH",
      "company_seat": "Bonn",
      "details": "23.06.2025 (Bekanntmachungsdatum)\n\nNordrhein-Westfalen Amtsgericht Bonn HRB 14178\nEinreichung neuer Dokumente\n\nDeutsche Telekom Service GmbH\nGesellschaft mit beschränkter Haftung\nBonn\n\nDem Registergericht ist eine neue Liste der Mitglieder des Aufsichtsrates eingereicht worden."
    },
    {
      "date": "2025-06-23",
      "id": "113030",
      "original_text": "Löschungsankündigung\nNordrhein-Westfalen Amtsgericht Hamm HRB 5511\nKIFFE Hamm Beteiligungs-GmbH – Hamm",
      "type": "Löschungsankündigung",
      "state": "Nordrhein-Westfalen",
      "amtsgericht": "Amtsgericht Hamm",
      "registernummer": "HRB 5511",
      "registerart": "HRB",
      "company_name": "KIFFE Hamm Beteiligungs-GmbH",
      "company_seat": "Hamm",
      "details": "23.06.2025 (Bekanntmachungsdatum)\n\nNordrhein-Westfalen Amtsgericht Hamm HRB 5511\nLöschungsankündigung\n\nKIFFE Hamm Beteiligungs-GmbH\nGesellschaft mit beschränkter Haftung\nHamm\n\nDas Registergericht beabsichtigt die Gesellschaft von Amts wegen nach § 394 FamFG zu löschen. Die Frist zur Erhebung eines Widerspruchs ist auf #DV.Fr(Text=\"Bitte wählen Sie die Widerspruchsfrist aus!\",Eingabe=\"einen Monat\",\"zwei Monate\",\"drei Monate\",\"#insert(Text=\"Freitext\")\"|\"freier Text\") festgesetzt."
    },
    {
      "date": "2025-06-23",
      "id": "113031",
      "original_text": "Löschungsankündigung\nNordrhein-Westfalen Amtsgericht Düsseldorf HRB 99568\nCMS Projektentwicklung GmbH – Düsseldorf",
      "type": "Löschungsankündigung",
      "state": "Nordrhein-Westfalen",
      "amtsgericht": "Amtsgericht Düsseldorf",
      "registernummer": "HRB 99568",
      "registerart": "HRB",
      "company_name": "CMS Projektentwicklung GmbH",
      "company_seat": "Düsseldorf",
      "details": "23.06.2025 (Bekanntmachungsdatum)\n\nNordrhein-Westfalen Amtsgericht Düsseldorf HRB 99568\nLöschungsankündigung\n\nCMS Projektentwicklung GmbH\nGesellschaft mit beschränkter Haftung\nDüsseldorf\n\nDas Registergericht beabsichtigt die Gesellschaft von Amts wegen nach § 394 FamFG zu löschen. Die Frist zur Erhebung eines Widerspruchs ist auf 3 Wochen festgesetzt.\n\nRechtsbehelfsbelehrung:\nDas Widerspruchsrecht steht jedem zu, der an der Unterlassung der Löschung ein berechtigtes Interesse hat. Der Widerspruch ist bei dem Amtsgericht Düsseldorf -Registergericht-, Werdener Straße 1, 40227 Düsseldorf schriftlich in deutscher Sprache oder zur Niederschrift der Geschäftsstelle einzulegen. Der Widerspruch kann auch zur Niederschrift der Geschäftsstelle eines jeden Amtsgerichtes abgegeben werden. Die Einlegung ist auch durch Übertragung eines elektronischen Dokuments an die elektronische Poststelle des Gerichts möglich. Das elektronische Dokument muss für die Bearbeitung durch das Gericht geeignet und mit einer qualifizierten elektronischen Signatur der verantwortenden Person versehen sein oder von der verantwortenden Person signiert und auf einem sicheren Übermittlungsweg gemäß § 130a ZPO nach näherer Maßgabe der Verordnung über die technischen Rahmenbedingungen des elektronischen Rechtsverkehrs und über das besondere elektronische Behördenpostfach (BGBl. I, S.3803) eingereicht werden. Weitere Informationen erhalten Sie auf der Internetseite www.justiz.de.\nDer Widerspruch muss spätestens innerhalb der gesetzten Frist nach dem Datum der Bekanntmachung der Löschungsankündigung bei dem Amtsgericht - Registergericht - Düsseldorf eingegangen sein.  Dies gilt auch dann, wenn der Widerspruch zur Niederschrift der Geschäftsstelle eines anderen Amtsgerichtes abgegeben wurde. Die Frist beginnt mit dem Tage der Bekanntmachung der Löschungsankündigung in dem für die Bekanntmachung der Eintragungen in das Handelsregister bestimmten elektronischen Informations- und Kommunikationssystem nach § 10 des Handelsgesetzbuches. Fällt das Ende der Frist auf einen Sonntag, einen allgemeinen Feiertag oder Sonnabend, so endet die Frist mit Ablauf des nächsten Werktages.\nDer Widerspruch muss die Bezeichnung der angefochtenen Löschungsankündigung sowie die Erklärung enthalten, dass Widerspruch gegen diese Löschungsankündigung eingelegt wird. Er ist zu unterzeichnen und soll begründet werden."
    },
    {
      "date": "2025-06-23",
      "id": "113032",
      "original_text": "Registerbekanntmachung nach dem Umwandlungsgesetz\nNordrhein-Westfalen Amtsgericht Münster HRB 15050\nLand24 Gesellschaft mit beschränkter Haftung – Telgte",
      "type": "Registerbekanntmachung nach dem Umwandlungsgesetz",
      "state": "Nordrhein-Westfalen",
      "amtsgericht": "Amtsgericht Münster",
      "registernummer": "HRB 15050",
      "registerart": "HRB",
      "company_name": "Land24 Gesellschaft mit beschränkter Haftung",
      "company_seat": "Telgte",
      "details": "23.06.2025 (Bekanntmachungsdatum)\n\nNordrhein-Westfalen Amtsgericht Münster HRB 15050\nRegisterbekanntmachung nach dem Umwandlungsgesetz 23.06.2025 (Eintragungsdatum)\n\nLand24 Gesellschaft mit beschränkter Haftung\nGesellschaft mit beschränkter Haftung\nTelgte\n\nDen Gläubigern der an der Verschmelzung beteiligten Rechtsträger ist, wenn sie binnen sechs Monaten nach dem Tag, an dem die Eintragung der Verschmelzung in das Register des Sitzes desjenigen Rechtsträgers, dessen Gläubiger sie sind, nach § 19 Absatz 3 UmwG als bekanntgemacht gilt, ihren Anspruch nach Grund und Höhe schriftlich anmelden, Sicherheit zu leisten, soweit sie nicht Befriedigung verlangen können. Dieses Recht steht den Gläubigern jedoch nur zu, wenn sie glaubhaft machen, dass durch die Verschmelzung die Erfüllung ihrer Forderung gefährdet wird."
    },
    {
      "date": "2025-06-23",
      "id": "113033",
      "original_text": "Einreichung neuer Dokumente\nNordrhein-Westfalen Amtsgericht Bad Oeynhausen HRB 15735\nAltendorf Group Holding GmbH – Minden",
      "type": "Einreichung neuer Dokumente",
      "state": "Nordrhein-Westfalen",
      "amtsgericht": "Amtsgericht Bad Oeynhausen",
      "registernummer": "HRB 15735",
      "registerart": "HRB",
      "company_name": "Altendorf Group Holding GmbH",
      "company_seat": "Minden",
      "details": "23.06.2025 (Bekanntmachungsdatum)\n\nNordrhein-Westfalen Amtsgericht Bad Oeynhausen HRB 15735\nEinreichung neuer Dokumente 23.06.2025 (Eintragungsdatum)\n\nAltendorf Group Holding GmbH\nGesellschaft mit beschränkter Haftung\nMinden\n\nDem Registergericht ist eine neue Liste der Mitglieder des Beirates eingereicht worden."
    },
    {
      "date": "2025-06-23",
      "id": "113034",
      "original_text": "Löschungsankündigung\nNordrhein-Westfalen Amtsgericht Wuppertal HRB 31624\nFadi International GmbH – Haan",
      "type": "Löschungsankündigung",
      "state": "Nordrhein-Westfalen",
      "amtsgericht": "Amtsgericht Wuppertal",
      "registernummer": "HRB 31624",
      "registerart": "HRB",
      "company_name": "Fadi International GmbH",
      "company_seat": "Haan",
      "details": "23.06.2025 (Bekanntmachungsdatum)\n\nNordrhein-Westfalen Amtsgericht Wuppertal HRB 31624\nLöschungsankündigung\n\nFadi International GmbH\nGesellschaft mit beschränkter Haftung\nHaan\n\nDas Registergericht beabsichtigt die Gesellschaft von Amts wegen nach § 394 FamFG zu löschen. Die Frist zur Erhebung eines Widerspruchs ist auf einen Monat festgesetzt."
    },
    {
      "date": "2025-06-23",
      "id": "113035",
      "original_text": "Registerbekanntmachung nach dem Umwandlungsgesetz\nNordrhein-Westfalen Amtsgericht Düsseldorf HRB 107819\nKK Fakturation GmbH – Düsseldorf",
      "type": "Registerbekanntmachung nach dem Umwandlungsgesetz",
      "state": "Nordrhein-Westfalen",
      "amtsgericht": "Amtsgericht Düsseldorf",
      "registernummer": "HRB 107819",
      "registerart": "HRB",
      "company_name": "KK Fakturation GmbH",
      "company_seat": "Düsseldorf",
      "details": "23.06.2025 (Bekanntmachungsdatum)\n\nNordrhein-Westfalen Amtsgericht Düsseldorf HRB 107819\nRegisterbekanntmachung nach dem Umwandlungsgesetz 23.06.2025 (Eintragungsdatum)\n\nKK Fakturation GmbH\nGesellschaft mit beschränkter Haftung\nDüsseldorf\n\nDen Gläubigern der an der Verschmelzung beteiligten Rechtsträger ist, wenn sie binnen sechs Monaten nach dem Tag, an dem die Eintragung der Verschmelzung in das Register des Sitzes desjenigen Rechtsträgers, dessen Gläubiger sie sind, nach § 19 Absatz 3 UmwG als bekanntgemacht gilt, ihren Anspruch nach Grund und Höhe schriftlich anmelden, Sicherheit zu leisten, soweit sie nicht Befriedigung verlangen können. Dieses Recht steht den Gläubigern jedoch nur zu, wenn sie glaubhaft machen, dass durch die Verschmelzung die Erfüllung ihrer Forderung gefährdet wird."
    },
    {
      "date": "2025-06-23",
      "id": "113036",
      "original_text": "Sonstige Registerbekanntmachung\nNordrhein-Westfalen Amtsgericht Lemgo HRB 11124\nPhoenix Contact E-Mobility Holding SE – Schieder-Schwalenberg",
      "type": "Sonstige Registerbekanntmachung",
      "state": "Nordrhein-Westfalen",
      "amtsgericht": "Amtsgericht Lemgo",
      "registernummer": "HRB 11124",
      "registerart": "HRB",
      "company_name": "Phoenix Contact E-Mobility Holding SE",
      "company_seat": "Schieder-Schwalenberg",
      "details": "23.06.2025 (Bekanntmachungsdatum)\n\nNordrhein-Westfalen Amtsgericht Lemgo HRB 11124\nSonstige Registerbekanntmachung\n\nPhoenix Contact E-Mobility Holding SE\nEuropäische Aktiengesellschaft (SE)\nSchieder-Schwalenberg\n\nDem Registergericht ist eine Liste der Mitglieder des Aufsichtsrates eingereicht worden."
    },
    {
      "date": "2025-06-23",
      "id": "113037",
      "original_text": "Löschungsankündigung\nNordrhein-Westfalen Amtsgericht Düsseldorf HRB 78214\nM&D Relationship GmbH – Düsseldorf",
      "type": "Löschungsankündigung",
      "state": "Nordrhein-Westfalen",
      "amtsgericht": "Amtsgericht Düsseldorf",
      "registernummer": "HRB 78214",
      "registerart": "HRB",
      "company_name": "M&D Relationship GmbH",
      "company_seat": "Düsseldorf",
      "details": "23.06.2025 (Bekanntmachungsdatum)\n\nNordrhein-Westfalen Amtsgericht Düsseldorf HRB 78214\nLöschungsankündigung\n\nM&D Relationship GmbH\nGesellschaft mit beschränkter Haftung\nDüsseldorf\n\nDas Registergericht beabsichtigt die Gesellschaft von Amts wegen nach § 394 FamFG zu löschen. Die Frist zur Erhebung eines Widerspruchs ist auf 3 Wochen festgesetzt.\n\nRechtsbehelfsbelehrung:\nDas Widerspruchsrecht steht jedem zu, der an der Unterlassung der Löschung ein berechtigtes Interesse hat. Der Widerspruch ist bei dem Amtsgericht Düsseldorf -Registergericht-, Werdener Straße 1, 40227 Düsseldorf schriftlich in deutscher Sprache oder zur Niederschrift der Geschäftsstelle einzulegen. Der Widerspruch kann auch zur Niederschrift der Geschäftsstelle eines jeden Amtsgerichtes abgegeben werden. Die Einlegung ist auch durch Übertragung eines elektronischen Dokuments an die elektronische Poststelle des Gerichts möglich. Das elektronische Dokument muss für die Bearbeitung durch das Gericht geeignet und mit einer qualifizierten elektronischen Signatur der verantwortenden Person versehen sein oder von der verantwortenden Person signiert und auf einem sicheren Übermittlungsweg gemäß § 130a ZPO nach näherer Maßgabe der Verordnung über die technischen Rahmenbedingungen des elektronischen Rechtsverkehrs und über das besondere elektronische Behördenpostfach (BGBl. I, S.3803) eingereicht werden. Weitere Informationen erhalten Sie auf der Internetseite www.justiz.de.\nDer Widerspruch muss spätestens innerhalb der gesetzten Frist nach dem Datum der Bekanntmachung der Löschungsankündigung bei dem Amtsgericht - Registergericht - Düsseldorf eingegangen sein.  Dies gilt auch dann, wenn der Widerspruch zur Niederschrift der Geschäftsstelle eines anderen Amtsgerichtes abgegeben wurde. Die Frist beginnt mit dem Tage der Bekanntmachung der Löschungsankündigung in dem für die Bekanntmachung der Eintragungen in das Handelsregister bestimmten elektronischen Informations- und Kommunikationssystem nach § 10 des Handelsgesetzbuches. Fällt das Ende der Frist auf einen Sonntag, einen allgemeinen Feiertag oder Sonnabend, so endet die Frist mit Ablauf des nächsten Werktages.\nDer Widerspruch muss die Bezeichnung der angefochtenen Löschungsankündigung sowie die Erklärung enthalten, dass Widerspruch gegen diese Löschungsankündigung eingelegt wird. Er ist zu unterzeichnen und soll begründet werden."
    },
    {
      "date": "2025-06-23",
      "id": "113038",
      "original_text": "Registerbekanntmachung nach dem Umwandlungsgesetz\nNordrhein-Westfalen Amtsgericht Bochum HRB 22449\nOS Security GmbH – Bochum",
      "type": "Registerbekanntmachung nach dem Umwandlungsgesetz",
      "state": "Nordrhein-Westfalen",
      "amtsgericht": "Amtsgericht Bochum",
      "registernummer": "HRB 22449",
      "registerart": "HRB",
      "company_name": "OS Security GmbH",
      "company_seat": "Bochum",
      "details": "23.06.2025 (Bekanntmachungsdatum)\n\nNordrhein-Westfalen Amtsgericht Bochum HRB 22449\nRegisterbekanntmachung nach dem Umwandlungsgesetz 16.06.2025 (Eintragungsdatum)\n\nOS Security GmbH\nGesellschaft mit beschränkter Haftung\nBochum\n\nDen Gläubigern der an der Ausgliederung beteiligten Rechtsträger ist, wenn sie binnen sechs Monaten nach dem Tag, an dem die Eintragung der Ausgliederung in das Register des Sitzes derjenigen Rechtsträger deren Gläubiger sie sind, nach § 19 Absatz 3 UmwG als bekanntgemacht gilt, ihren Anspruch nach Grund und Höhe schriftlich anmelden, Sicherheit zu leisten, soweit sie nicht Befriedigung verlangen können. Dieses Recht steht den Gläubigern jedoch nur zu, wenn sie glaubhaft machen, dass durch die Ausgliederung die Erfüllung ihrer Forderung gefährdet wird."
    },
    {
      "date": "2025-06-23",
      "id": "113039",
      "original_text": "Einreichung neuer Dokumente\nNordrhein-Westfalen Amtsgericht Münster HRB 20562\nTITANIUM AG – Ahlen",
      "type": "Einreichung neuer Dokumente",
      "state": "Nordrhein-Westfalen",
      "amtsgericht": "Amtsgericht Münster",
      "registernummer": "HRB 20562",
      "registerart": "HRB",
      "company_name": "TITANIUM AG",
      "company_seat": "Ahlen",
      "details": "23.06.2025 (Bekanntmachungsdatum)\n\nNordrhein-Westfalen Amtsgericht Münster HRB 20562\nEinreichung neuer Dokumente\n\nTITANIUM AG\nAktiengesellschaft\nAhlen\n\nDem Registergericht ist eine Liste der Mitglieder des Aufsichtsrates eingereicht worden."
    },
    {
      "date": "2025-06-23",
      "id": "113040",
      "original_text": "Registerbekanntmachung nach dem Umwandlungsgesetz\nNordrhein-Westfalen Amtsgericht Dortmund HRB 3130\nToKaDo Verwaltungs GmbH – Dortmund",
      "type": "Registerbekanntmachung nach dem Umwandlungsgesetz",
      "state": "Nordrhein-Westfalen",
      "amtsgericht": "Amtsgericht Dortmund",
      "registernummer": "HRB 3130",
      "registerart": "HRB",
      "company_name": "ToKaDo Verwaltungs GmbH",
      "company_seat": "Dortmund",
      "details": "23.06.2025 (Bekanntmachungsdatum)\n\nNordrhein-Westfalen Amtsgericht Dortmund HRB 3130\nRegisterbekanntmachung nach dem Umwandlungsgesetz 23.06.2025 (Eintragungsdatum)\n\nToKaDo Verwaltungs GmbH\nGesellschaft mit beschränkter Haftung\nDortmund\n\nDen Gläubigern der an der Verschmelzung beteiligten Rechtsträger ist, wenn sie binnen sechs Monaten nach dem Tag, an dem die Eintragung der Verschmelzung in das Register des Sitzes desjenigen Rechtsträgers, dessen Gläubiger sie sind, nach § 19 Absatz 3 UmwG als bekanntgemacht gilt, ihren Anspruch nach Grund und Höhe schriftlich anmelden, Sicherheit zu leisten, soweit sie nicht Befriedigung verlangen können. Dieses Recht steht den Gläubigern jedoch nur zu, wenn sie glaubhaft machen, dass durch die Verschmelzung die Erfüllung ihrer Forderung gefährdet wird."
    },
    {
      "date": "2025-06-23",
      "id": "113041",
      "original_text": "Registerbekanntmachung nach dem Umwandlungsgesetz\nNordrhein-Westfalen Amtsgericht Münster HRB 19387\nflaschenpost expansions 33 GmbH – Münster",
      "type": "Registerbekanntmachung nach dem Umwandlungsgesetz",
      "state": "Nordrhein-Westfalen",
      "amtsgericht": "Amtsgericht Münster",
      "registernummer": "HRB 19387",
      "registerart": "HRB",
      "company_name": "flaschenpost expansions 33 GmbH",
      "company_seat": "Münster",
      "details": "23.06.2025 (Bekanntmachungsdatum)\n\nNordrhein-Westfalen Amtsgericht Münster HRB 19387\nRegisterbekanntmachung nach dem Umwandlungsgesetz 23.06.2025 (Eintragungsdatum)\n\nflaschenpost expansions 33 GmbH\nGesellschaft mit beschränkter Haftung\nMünster\n\nDen Gläubigern der an der Verschmelzung beteiligten Rechtsträger ist, wenn sie binnen sechs Monaten nach dem Tag, an dem die Eintragung der Verschmelzung in das Register des Sitzes desjenigen Rechtsträgers, dessen Gläubiger sie sind, nach § 19 Absatz 3 UmwG als bekanntgemacht gilt, ihren Anspruch nach Grund und Höhe schriftlich anmelden, Sicherheit zu leisten, soweit sie nicht Befriedigung verlangen können. Dieses Recht steht den Gläubigern jedoch nur zu, wenn sie glaubhaft machen, dass durch die Verschmelzung die Erfüllung ihrer Forderung gefährdet wird."
    },
    {
      "date": "2025-06-23",
      "id": "113042",
      "original_text": "Einreichung neuer Dokumente\nNordrhein-Westfalen Amtsgericht Köln HRB 58850\nEuforma Aktiengesellschaft für das Forderungsmanagement in Europa – Köln",
      "type": "Einreichung neuer Dokumente",
      "state": "Nordrhein-Westfalen",
      "amtsgericht": "Amtsgericht Köln",
      "registernummer": "HRB 58850",
      "registerart": "HRB",
      "company_name": "Euforma Aktiengesellschaft für das Forderungsmanagement in Europa",
      "company_seat": "Köln",
      "details": "23.06.2025 (Bekanntmachungsdatum)\n\nNordrhein-Westfalen Amtsgericht Köln HRB 58850\nEinreichung neuer Dokumente 18.06.2025 (Eintragungsdatum)\n\nEuforma Aktiengesellschaft für das Forderungsmanagement in Europa\nAktiengesellschaft\nKöln\n\nDem Registergericht ist eine neue Liste der Mitglieder des Aufsichtsrates eingereicht worden."
    },
    {
      "date": "2025-06-23",
      "id": "113043",
      "original_text": "Registerbekanntmachung nach dem Umwandlungsgesetz\nNordrhein-Westfalen Amtsgericht Münster HRB 13928\nEngemann Youngsters GmbH – Münster",
      "type": "Registerbekanntmachung nach dem Umwandlungsgesetz",
      "state": "Nordrhein-Westfalen",
      "amtsgericht": "Amtsgericht Münster",
      "registernummer": "HRB 13928",
      "registerart": "HRB",
      "company_name": "Engemann Youngsters GmbH",
      "company_seat": "Münster",
      "details": "23.06.2025 (Bekanntmachungsdatum)\n\nNordrhein-Westfalen Amtsgericht Münster HRB 13928\nRegisterbekanntmachung nach dem Umwandlungsgesetz 23.06.2025 (Eintragungsdatum)\n\nEngemann Youngsters GmbH\nGesellschaft mit beschränkter Haftung\nMünster\n\nDen Gläubigern der an der Verschmelzung beteiligten Rechtsträger ist, wenn sie binnen sechs Monaten nach dem Tag, an dem die Eintragung der Verschmelzung in das Register des Sitzes desjenigen Rechtsträgers, dessen Gläubiger sie sind, nach § 19 Absatz 3 UmwG als bekanntgemacht gilt, ihren Anspruch nach Grund und Höhe schriftlich anmelden, Sicherheit zu leisten, soweit sie nicht Befriedigung verlangen können. Dieses Recht steht den Gläubigern jedoch nur zu, wenn sie glaubhaft machen, dass durch die Verschmelzung die Erfüllung ihrer Forderung gefährdet wird."
    },
    {
      "date": "2025-06-23",
      "id": "113044",
      "original_text": "Registerbekanntmachung nach dem Umwandlungsgesetz\nNordrhein-Westfalen Amtsgericht Siegburg HRB 14904\neSDe Energie UG (haftungsbeschränkt) – Reichshof",
      "type": "Registerbekanntmachung nach dem Umwandlungsgesetz",
      "state": "Nordrhein-Westfalen",
      "amtsgericht": "Amtsgericht Siegburg",
      "registernummer": "HRB 14904",
      "registerart": "HRB",
      "company_name": "eSDe Energie UG (haftungsbeschränkt)",
      "company_seat": "Reichshof",
      "details": "23.06.2025 (Bekanntmachungsdatum)\n\nNordrhein-Westfalen Amtsgericht Siegburg HRB 14904\nRegisterbekanntmachung nach dem Umwandlungsgesetz 23.06.2025 (Eintragungsdatum)\n\neSDe Energie UG (haftungsbeschränkt)\nGesellschaft mit beschränkter Haftung\nReichshof\n\nDen Gläubigern der an der Verschmelzung beteiligten Rechtsträger ist, wenn sie binnen sechs Monaten nach dem Tag, an dem die Eintragung der Verschmelzung in das Register des Sitzes desjenigen Rechtsträgers, dessen Gläubiger sie sind, nach § 19 Absatz 3 UmwG als bekanntgemacht gilt, ihren Anspruch nach Grund und Höhe schriftlich anmelden, Sicherheit zu leisten, soweit sie nicht Befriedigung verlangen können. Dieses Recht steht den Gläubigern jedoch nur zu, wenn sie glaubhaft machen, dass durch die Verschmelzung die Erfüllung ihrer Forderung gefährdet wird."
    },
    {
      "date": "2025-06-23",
      "id": "113045",
      "original_text": "Löschungsankündigung\nNordrhein-Westfalen Amtsgericht Wuppertal HRA 24409\nNETFLOWER LTD. & CO. KG – Wuppertal",
      "type": "Löschungsankündigung",
      "state": "Nordrhein-Westfalen",
      "amtsgericht": "Amtsgericht Wuppertal",
      "registernummer": "HRA 24409",
      "registerart": "HRA",
      "company_name": "NETFLOWER LTD. & CO. KG",
      "company_seat": "Wuppertal",
      "details": "23.06.2025 (Bekanntmachungsdatum)\n\nNordrhein-Westfalen Amtsgericht Wuppertal HRA 24409\nLöschungsankündigung\n\nNETFLOWER LTD. & CO. KG\nKommanditgesellschaft\nWuppertal\n\nDas Registergericht beabsichtigt die Firma von Amts wegen nach § 394 FamFG zu löschen. Die Frist zur Erhebung eines Widerspruchs ist auf drei Monate festgesetzt."
    },
    {
      "date": "2025-06-23",
      "id": "113046",
      "original_text": "Registerbekanntmachung nach dem Umwandlungsgesetz\nNordrhein-Westfalen Amtsgericht Bochum HRA 8107\nOS Security e.K. – Bochum",
      "type": "Registerbekanntmachung nach dem Umwandlungsgesetz",
      "state": "Nordrhein-Westfalen",
      "amtsgericht": "Amtsgericht Bochum",
      "registernummer": "HRA 8107",
      "registerart": "HRA",
      "company_name": "OS Security e.K.",
      "company_seat": "Bochum",
      "details": "23.06.2025 (Bekanntmachungsdatum)\n\nNordrhein-Westfalen Amtsgericht Bochum HRA 8107\nRegisterbekanntmachung nach dem Umwandlungsgesetz 18.06.2025 (Eintragungsdatum)\n\nOS Security e.K.\nEinzelkaufmann / Einzelkauffrau\nBochum\n\nDen Gläubigern der an der Ausgliederung beteiligten Rechtsträger ist, wenn sie binnen sechs Monaten nach dem Tag, an dem die Eintragung der Ausgliederung in das Register des Sitzes derjenigen Rechtsträger deren Gläubiger sie sind, nach § 19 Absatz 3 UmwG als bekanntgemacht gilt, ihren Anspruch nach Grund und Höhe schriftlich anmelden, Sicherheit zu leisten, soweit sie nicht Befriedigung verlangen können. Dieses Recht steht den Gläubigern jedoch nur zu, wenn sie glaubhaft machen, dass durch die Ausgliederung die Erfüllung ihrer Forderung gefährdet wird."
    },
    {
      "date": "2025-06-23",
      "id": "113047",
      "original_text": "Registerbekanntmachung nach dem Umwandlungsgesetz\nNordrhein-Westfalen Amtsgericht Köln HRB 36920\nSteuerlehrgänge Dr. Bannas GmbH – Köln",
      "type": "Registerbekanntmachung nach dem Umwandlungsgesetz",
      "state": "Nordrhein-Westfalen",
      "amtsgericht": "Amtsgericht Köln",
      "registernummer": "HRB 36920",
      "registerart": "HRB",
      "company_name": "Steuerlehrgänge Dr. Bannas GmbH",
      "company_seat": "Köln",
      "details": "23.06.2025 (Bekanntmachungsdatum)\n\nNordrhein-Westfalen Amtsgericht Köln HRB 36920\nRegisterbekanntmachung nach dem Umwandlungsgesetz 23.06.2025 (Eintragungsdatum)\n\nSteuerlehrgänge Dr. Bannas GmbH\nGesellschaft mit beschränkter Haftung\nKöln\n\nDen Gläubigern der an der Verschmelzung beteiligten Rechtsträger ist, wenn sie binnen sechs Monaten nach dem Tag, an dem die Eintragung der Verschmelzung in das Register des Sitzes desjenigen Rechtsträgers, dessen Gläubiger sie sind, nach § 19 Absatz 3 UmwG als bekanntgemacht gilt, ihren Anspruch nach Grund und Höhe schriftlich anmelden, Sicherheit zu leisten, soweit sie nicht Befriedigung verlangen können. Dieses Recht steht den Gläubigern jedoch nur zu, wenn sie glaubhaft machen, dass durch die Verschmelzung die Erfüllung ihrer Forderung gefährdet wird."
    },
    {
      "date": "2025-06-23",
      "id": "113048",
      "original_text": "Löschungsankündigung\nNordrhein-Westfalen Amtsgericht Dortmund HRB 32259\nThe New Crown Hospitality GmbH – Dortmund",
      "type": "Löschungsankündigung",
      "state": "Nordrhein-Westfalen",
      "amtsgericht": "Amtsgericht Dortmund",
      "registernummer": "HRB 32259",
      "registerart": "HRB",
      "company_name": "The New Crown Hospitality GmbH",
      "company_seat": "Dortmund",
      "details": "23.06.2025 (Bekanntmachungsdatum)\n\nNordrhein-Westfalen Amtsgericht Dortmund HRB 32259\nLöschungsankündigung\n\nThe New Crown Hospitality GmbH\nGesellschaft mit beschränkter Haftung\nDortmund\n\nDas Registergericht beabsichtigt die Gesellschaft von Amts wegen nach § 394 FamFG zu löschen. Die Frist zur Erhebung eines Widerspruchs ist auf zwei Monate festgesetzt."
    },
    {
      "date": "2025-06-23",
      "id": "113049",
      "original_text": "Löschungsankündigung\nNordrhein-Westfalen Amtsgericht Mönchengladbach HRB 19949\nTOPSTAR EUROPE GmbH – Viersen",
      "type": "Löschungsankündigung",
      "state": "Nordrhein-Westfalen",
      "amtsgericht": "Amtsgericht Mönchengladbach",
      "registernummer": "HRB 19949",
      "registerart": "HRB",
      "company_name": "TOPSTAR EUROPE GmbH",
      "company_seat": "Viersen",
      "details": "23.06.2025 (Bekanntmachungsdatum)\n\nNordrhein-Westfalen Amtsgericht Mönchengladbach HRB 19949\nLöschungsankündigung\n\nTOPSTAR EUROPE GmbH\nGesellschaft mit beschränkter Haftung\nViersen\n\nDas Registergericht beabsichtigt die Gesellschaft von Amts wegen nach § 394 FamFG zu löschen. Die Frist zur Erhebung eines Widerspruchs ist auf drei Monate festgesetzt."
    },
    {
      "date": "2025-06-23",
      "id": "113050",
      "original_text": "Sonstige Registerbekanntmachung\nNordrhein-Westfalen Amtsgericht Bad Oeynhausen HRB 8461\nBruckamp GmbH – Espelkamp",
      "type": "Sonstige Registerbekanntmachung",
      "state": "Nordrhein-Westfalen",
      "amtsgericht": "Amtsgericht Bad Oeynhausen",
      "registernummer": "HRB 8461",
      "registerart": "HRB",
      "company_name": "Bruckamp GmbH",
      "company_seat": "Espelkamp",
      "details": "23.06.2025 (Bekanntmachungsdatum)\n\nNordrhein-Westfalen Amtsgericht Bad Oeynhausen HRB 8461\nSonstige Registerbekanntmachung 23.06.2025 (Eintragungsdatum)\n\nBruckamp GmbH\nGesellschaft mit beschränkter Haftung\nEspelkamp\n\nAls nicht eingetragen wird veröffentlicht: Den Gläubigern der Gesellschaft, deren Forderungen begründet worden sind bevor die Eintragung der Beendigung des Beherrschungs- und Gewinnabführungsvertrages  in das Handelsregister nach § 10 des Handelsgesetzbuches als bekanntgemacht gilt, hat der andere Vertragsteil Sicherheit zu leisten, wenn sie sich binnen sechs Monaten nach der Bekanntmachung der Eintragung zu diesem Zweck bei ihm melden."
    },
    {
      "date": "2025-06-23",
      "id": "113051",
      "original_text": "Einreichung neuer Dokumente\nNordrhein-Westfalen Amtsgericht Siegburg HRB 17455\nTrinks GmbH – Hennef",
      "type": "Einreichung neuer Dokumente",
      "state": "Nordrhein-Westfalen",
      "amtsgericht": "Amtsgericht Siegburg",
      "registernummer": "HRB 17455",
      "registerart": "HRB",
      "company_name": "Trinks GmbH",
      "company_seat": "Hennef",
      "details": "23.06.2025 (Bekanntmachungsdatum)\n\nNordrhein-Westfalen Amtsgericht Siegburg HRB 17455\nEinreichung neuer Dokumente\n\nTrinks GmbH\nGesellschaft mit beschränkter Haftung\nHennef\n\nDem Registergericht ist eine neue Liste der Mitglieder des Aufsichtsrates eingereicht worden."
    },
    {
      "date": "2025-06-23",
      "id": "113052",
      "original_text": "Einreichung neuer Dokumente\nNordrhein-Westfalen Amtsgericht Steinfurt HRB 4040\napetito Aktiengesellschaft – Rheine",
      "type": "Einreichung neuer Dokumente",
      "state": "Nordrhein-Westfalen",
      "amtsgericht": "Amtsgericht Steinfurt",
      "registernummer": "HRB 4040",
      "registerart": "HRB",
      "company_name": "apetito Aktiengesellschaft",
      "company_seat": "Rheine",
      "details": "23.06.2025 (Bekanntmachungsdatum)\n\nNordrhein-Westfalen Amtsgericht Steinfurt HRB 4040\nEinreichung neuer Dokumente\n\napetito Aktiengesellschaft\nAktiengesellschaft\nRheine\n\nDem Registergericht ist eine Liste der Mitglieder des Aufsichtsrates eingereicht worden."
    },
    {
      "date": "2025-06-23",
      "id": "113053",
      "original_text": "Löschungsankündigung\nNordrhein-Westfalen Amtsgericht Köln HRB 103503\nPlaza BT GmbH – Köln",
      "type": "Löschungsankündigung",
      "state": "Nordrhein-Westfalen",
      "amtsgericht": "Amtsgericht Köln",
      "registernummer": "HRB 103503",
      "registerart": "HRB",
      "company_name": "Plaza BT GmbH",
      "company_seat": "Köln",
      "details": "23.06.2025 (Bekanntmachungsdatum)\n\nNordrhein-Westfalen Amtsgericht Köln HRB 103503\nLöschungsankündigung\n\nPlaza BT GmbH\nGesellschaft mit beschränkter Haftung\nKöln\n\nDas Registergericht beabsichtigt die Gesellschaft von Amts wegen nach § 394 FamFG zu löschen. Die Frist zur Erhebung eines Widerspruchs ist auf einen Monat festgesetzt."
    },
    {
      "date": "2025-06-23",
      "id": "113054",
      "original_text": "Löschungsankündigung\nNordrhein-Westfalen Amtsgericht Münster HRA 11325\nKAA86 Projekt GmbH & Co KG – Münster",
      "type": "Löschungsankündigung",
      "state": "Nordrhein-Westfalen",
      "amtsgericht": "Amtsgericht Münster",
      "registernummer": "HRA 11325",
      "registerart": "HRA",
      "company_name": "KAA86 Projekt GmbH & Co KG",
      "company_seat": "Münster",
      "details": "23.06.2025 (Bekanntmachungsdatum)\n\nNordrhein-Westfalen Amtsgericht Münster HRA 11325\nLöschungsankündigung\n\nKAA86 Projekt GmbH & Co KG\nKommanditgesellschaft\nMünster\n\nDas Registergericht beabsichtigt die Firma von Amts wegen nach § 394 FamFG zu löschen. Die Frist zur Erhebung eines Widerspruchs ist auf #DV.Fr(Text=\"Bitte wählen Sie die Widerspruchsfrist aus!\",Eingabe=\"einen Monat\",\"zwei Monate\",\"drei Monate\",\"#insert(Text=\"Freitext\")\"|\"freier Text\") festgesetzt."
    },
    {
      "date": "2025-06-23",
      "id": "113055",
      "original_text": "Registerbekanntmachung nach dem Umwandlungsgesetz\nNordrhein-Westfalen Amtsgericht Krefeld HRB 13516\nLaboratorium Dr. Deppe GmbH – Kempen",
      "type": "Registerbekanntmachung nach dem Umwandlungsgesetz",
      "state": "Nordrhein-Westfalen",
      "amtsgericht": "Amtsgericht Krefeld",
      "registernummer": "HRB 13516",
      "registerart": "HRB",
      "company_name": "Laboratorium Dr. Deppe GmbH",
      "company_seat": "Kempen",
      "details": "23.06.2025 (Bekanntmachungsdatum)\n\nNordrhein-Westfalen Amtsgericht Krefeld HRB 13516\nRegisterbekanntmachung nach dem Umwandlungsgesetz 23.06.2025 (Eintragungsdatum)\n\nLaboratorium Dr. Deppe GmbH\nGesellschaft mit beschränkter Haftung\nKempen\n\nDen Gläubigern der an der Verschmelzung beteiligten Rechtsträger ist, wenn sie binnen sechs Monaten nach dem Tag, an dem die Eintragung der Verschmelzung in das Register des Sitzes desjenigen Rechtsträgers, dessen Gläubiger sie sind, nach § 19 Absatz 3 UmwG als bekanntgemacht gilt, ihren Anspruch nach Grund und Höhe schriftlich anmelden, Sicherheit zu leisten, soweit sie nicht Befriedigung verlangen können. Dieses Recht steht den Gläubigern jedoch nur zu, wenn sie glaubhaft machen, dass durch die Verschmelzung die Erfüllung ihrer Forderung gefährdet wird."
    },
    {
      "date": "2025-06-23",
      "id": "113056",
      "original_text": "Registerbekanntmachung nach dem Umwandlungsgesetz\nNordrhein-Westfalen Amtsgericht Düsseldorf HRB 99481\nWIIT Aktiengesellschaft – Düsseldorf",
      "type": "Registerbekanntmachung nach dem Umwandlungsgesetz",
      "state": "Nordrhein-Westfalen",
      "amtsgericht": "Amtsgericht Düsseldorf",
      "registernummer": "HRB 99481",
      "registerart": "HRB",
      "company_name": "WIIT Aktiengesellschaft",
      "company_seat": "Düsseldorf",
      "details": "23.06.2025 (Bekanntmachungsdatum)\n\nNordrhein-Westfalen Amtsgericht Düsseldorf HRB 99481\nRegisterbekanntmachung nach dem Umwandlungsgesetz 23.06.2025 (Eintragungsdatum)\n\nWIIT Aktiengesellschaft\nAktiengesellschaft\nDüsseldorf\n\nDen Gläubigern der an der Verschmelzung beteiligten Rechtsträger ist, wenn sie binnen sechs Monaten nach dem Tag, an dem die Eintragung der Verschmelzung in das Register des Sitzes desjenigen Rechtsträgers, dessen Gläubiger sie sind, nach § 19 Absatz 3 UmwG als bekanntgemacht gilt, ihren Anspruch nach Grund und Höhe schriftlich anmelden, Sicherheit zu leisten, soweit sie nicht Befriedigung verlangen können. Dieses Recht steht den Gläubigern jedoch nur zu, wenn sie glaubhaft machen, dass durch die Verschmelzung die Erfüllung ihrer Forderung gefährdet wird."
    },
    {
      "date": "2025-06-23",
      "id": "113057",
      "original_text": "Einreichung neuer Dokumente\nThüringen Amtsgericht Jena HRB 406040\nSportbad Eisenach GmbH – Eisenach",
      "type": "Einreichung neuer Dokumente",
      "state": "Thüringen",
      "amtsgericht": "Amtsgericht Jena",
      "registernummer": "HRB 406040",
      "registerart": "HRB",
      "company_name": "Sportbad Eisenach GmbH",
      "company_seat": "Eisenach",
      "details": "23.06.2025 (Bekanntmachungsdatum)\n\nThüringen Amtsgericht Jena HRB 406040\nEinreichung neuer Dokumente 12.06.2025 (Eintragungsdatum)\n\nSportbad Eisenach GmbH\nGesellschaft mit beschränkter Haftung\nEisenach\n\nBekanntmachung gem. § 52 Abs. 3 Satz 2 GmbHG: Aufgrund einer Veränderung in den Personen der Aufsichtsratsmitglieder ist durch den Geschäftsführer eine neue Liste zum Handelsregister eingereicht worden."
    },
    {
      "date": "2025-06-23",
      "id": "113058",
      "original_text": "Registerbekanntmachung nach dem Umwandlungsgesetz\nThüringen Amtsgericht Jena HRB 518978\nQSIL SE – Erfurt",
      "type": "Registerbekanntmachung nach dem Umwandlungsgesetz",
      "state": "Thüringen",
      "amtsgericht": "Amtsgericht Jena",
      "registernummer": "HRB 518978",
      "registerart": "HRB",
      "company_name": "QSIL SE",
      "company_seat": "Erfurt",
      "details": "23.06.2025 (Bekanntmachungsdatum)\n\nThüringen Amtsgericht Jena HRB 518978\nRegisterbekanntmachung nach dem Umwandlungsgesetz 23.06.2025 (Eintragungsdatum)\n\nQSIL SE\nEuropäische Aktiengesellschaft (SE)\nErfurt\n\nNicht eingetragen: Den Gläubigern der an der Verschmelzung beteiligten Rechtsträger, ist wenn sie binnen sechs Monaten nach dem Tag, an dem die Eintragung der Verschmelzung in das Register des Sitzes desjenigen Rechtsträgers, dessen Gläubiger sie sind,  nach § 19 Abs. 3 UmwG als bekanntgemacht gilt, ihren Anspruch nach Grund und Höhe schriftlich anmelden, Sicherheit zu leisten, soweit sie nicht Befriedigung verlangen können. Dieses Recht steht ihnen jedoch nur zu, wenn sie glaubhaft machen, daß durch die Verschmelzung die Erfüllung ihrer Forderung gefährdet wird."
    },
    {
      "date": "2025-06-23",
      "id": "113059",
      "original_text": "Registerbekanntmachung nach dem Umwandlungsgesetz\nThüringen Amtsgericht Jena HRB 518978\nQSIL SE – Erfurt",
      "type": "Registerbekanntmachung nach dem Umwandlungsgesetz",
      "state": "Thüringen",
      "amtsgericht": "Amtsgericht Jena",
      "registernummer": "HRB 518978",
      "registerart": "HRB",
      "company_name": "QSIL SE",
      "company_seat": "Erfurt",
      "details": "23.06.2025 (Bekanntmachungsdatum)\n\nThüringen Amtsgericht Jena HRB 518978\nRegisterbekanntmachung nach dem Umwandlungsgesetz 23.06.2025 (Eintragungsdatum)\n\nQSIL SE\nEuropäische Aktiengesellschaft (SE)\nErfurt\n\nNicht eingetragen: Den Gläubigern der an der Verschmelzung beteiligten Rechtsträger, ist wenn sie binnen sechs Monaten nach dem Tag, an dem die Eintragung der Verschmelzung in das Register des Sitzes desjenigen Rechtsträgers, dessen Gläubiger sie sind,  nach § 19 Abs. 3 UmwG als bekanntgemacht gilt, ihren Anspruch nach Grund und Höhe schriftlich anmelden, Sicherheit zu leisten, soweit sie nicht Befriedigung verlangen können. Dieses Recht steht ihnen jedoch nur zu, wenn sie glaubhaft machen, daß durch die Verschmelzung die Erfüllung ihrer Forderung gefährdet wird."
    },
    {
      "date": "2025-06-23",
      "id": "113060",
      "original_text": "Registerbekanntmachung nach dem Umwandlungsgesetz\nThüringen Amtsgericht Jena HRB 501054\nINSERVIO GmbH – Vogtei",
      "type": "Registerbekanntmachung nach dem Umwandlungsgesetz",
      "state": "Thüringen",
      "amtsgericht": "Amtsgericht Jena",
      "registernummer": "HRB 501054",
      "registerart": "HRB",
      "company_name": "INSERVIO GmbH",
      "company_seat": "Vogtei",
      "details": "23.06.2025 (Bekanntmachungsdatum)\n\nThüringen Amtsgericht Jena HRB 501054\nRegisterbekanntmachung nach dem Umwandlungsgesetz 23.06.2025 (Eintragungsdatum)\n\nINSERVIO GmbH\nGesellschaft mit beschränkter Haftung\nVogtei\n\nNicht eingetragen: Den Gläubigern der an der Verschmelzung beteiligten Rechtsträger, ist wenn sie binnen sechs Monaten nach dem Tag, an dem die Eintragung der Verschmelzung in das Register des Sitzes desjenigen Rechtsträgers, dessen Gläubiger sie sind,  nach § 19 Abs. 3 UmwG als bekanntgemacht gilt, ihren Anspruch nach Grund und Höhe schriftlich anmelden, Sicherheit zu leisten, soweit sie nicht Befriedigung verlangen können. Dieses Recht steht ihnen jedoch nur zu, wenn sie glaubhaft machen, daß durch die Verschmelzung die Erfüllung ihrer Forderung gefährdet wird."
    },
    {
      "date": "2025-06-23",
      "id": "113061",
      "original_text": "Registerbekanntmachung nach dem Umwandlungsgesetz\nThüringen Amtsgericht Jena HRB 504854\nMineral7 GmbH – Ilmenau",
      "type": "Registerbekanntmachung nach dem Umwandlungsgesetz",
      "state": "Thüringen",
      "amtsgericht": "Amtsgericht Jena",
      "registernummer": "HRB 504854",
      "registerart": "HRB",
      "company_name": "Mineral7 GmbH",
      "company_seat": "Ilmenau",
      "details": "23.06.2025 (Bekanntmachungsdatum)\n\nThüringen Amtsgericht Jena HRB 504854\nRegisterbekanntmachung nach dem Umwandlungsgesetz 23.06.2025 (Eintragungsdatum)\n\nMineral7 GmbH\nGesellschaft mit beschränkter Haftung\nIlmenau\n\nNicht eingetragen: Den Gläubigern der an der Verschmelzung beteiligten Rechtsträger, ist wenn sie binnen sechs Monaten nach dem Tag, an dem die Eintragung der Verschmelzung in das Register des Sitzes desjenigen Rechtsträgers, dessen Gläubiger sie sind,  nach § 19 Abs. 3 UmwG als bekanntgemacht gilt, ihren Anspruch nach Grund und Höhe schriftlich anmelden, Sicherheit zu leisten, soweit sie nicht Befriedigung verlangen können. Dieses Recht steht ihnen jedoch nur zu, wenn sie glaubhaft machen, daß durch die Verschmelzung die Erfüllung ihrer Forderung gefährdet wird."
    },
    {
      "date": "2025-06-23",
      "id": "113062",
      "original_text": "Registerbekanntmachung nach dem Umwandlungsgesetz\nThüringen Amtsgericht Jena HRB 405286\nAFS GmbH – Vogtei",
      "type": "Registerbekanntmachung nach dem Umwandlungsgesetz",
      "state": "Thüringen",
      "amtsgericht": "Amtsgericht Jena",
      "registernummer": "HRB 405286",
      "registerart": "HRB",
      "company_name": "AFS GmbH",
      "company_seat": "Vogtei",
      "details": "23.06.2025 (Bekanntmachungsdatum)\n\nThüringen Amtsgericht Jena HRB 405286\nRegisterbekanntmachung nach dem Umwandlungsgesetz 23.06.2025 (Eintragungsdatum)\n\nAFS GmbH\nGesellschaft mit beschränkter Haftung\nVogtei\n\nNicht eingetragen: Den Gläubigern der an der Verschmelzung beteiligten Rechtsträger, ist wenn sie binnen sechs Monaten nach dem Tag, an dem die Eintragung der Verschmelzung in das Register des Sitzes desjenigen Rechtsträgers, dessen Gläubiger sie sind,  nach § 19 Abs. 3 UmwG als bekanntgemacht gilt, ihren Anspruch nach Grund und Höhe schriftlich anmelden, Sicherheit zu leisten, soweit sie nicht Befriedigung verlangen können. Dieses Recht steht ihnen jedoch nur zu, wenn sie glaubhaft machen, daß durch die Verschmelzung die Erfüllung ihrer Forderung gefährdet wird."
    },
    {
      "date": "2025-06-23",
      "id": "113063",
      "original_text": "Löschungsankündigung\nThüringen Amtsgericht Jena HRA 201647\nVan der Heide GmbH & Co. KG Natur- und Kunststeinarbeiten – Leutenberg",
      "type": "Löschungsankündigung",
      "state": "Thüringen",
      "amtsgericht": "Amtsgericht Jena",
      "registernummer": "HRA 201647",
      "registerart": "HRA",
      "company_name": "Van der Heide GmbH & Co. KG Natur- und Kunststeinarbeiten",
      "company_seat": "Leutenberg",
      "details": "23.06.2025 (Bekanntmachungsdatum)\n\nThüringen Amtsgericht Jena HRA 201647\nLöschungsankündigung\n\nVan der Heide GmbH & Co. KG Natur- und Kunststeinarbeiten\nKommanditgesellschaft\nLeutenberg\n\nDas Registergericht beabsichtigt, die im Handelsregister eingetragene Gesellschaft wegen Vermögenslosigkeit nach § 394 FamFG von Amts wegen zu löschen. Die Frist zur Erhebung eines Widerspruchs gegen die beabsichtigte Löschung wird auf 6 Wochen festgesetzt."
    },
    {
      "date": "2025-06-23",
      "id": "113064",
      "original_text": "Registerbekanntmachung nach dem Umwandlungsgesetz\nThüringen Amtsgericht Jena HRB 112735\nB200 Verwaltungs GmbH – Ilmenau",
      "type": "Registerbekanntmachung nach dem Umwandlungsgesetz",
      "state": "Thüringen",
      "amtsgericht": "Amtsgericht Jena",
      "registernummer": "HRB 112735",
      "registerart": "HRB",
      "company_name": "B200 Verwaltungs GmbH",
      "company_seat": "Ilmenau",
      "details": "23.06.2025 (Bekanntmachungsdatum)\n\nThüringen Amtsgericht Jena HRB 112735\nRegisterbekanntmachung nach dem Umwandlungsgesetz 23.06.2025 (Eintragungsdatum)\n\nB200 Verwaltungs GmbH\nGesellschaft mit beschränkter Haftung\nIlmenau\n\nNicht eingetragen: Den Gläubigern der an der Verschmelzung beteiligten Rechtsträger, ist wenn sie binnen sechs Monaten nach dem Tag, an dem die Eintragung der Verschmelzung in das Register des Sitzes desjenigen Rechtsträgers, dessen Gläubiger sie sind,  nach § 19 Abs. 3 UmwG als bekanntgemacht gilt, ihren Anspruch nach Grund und Höhe schriftlich anmelden, Sicherheit zu leisten, soweit sie nicht Befriedigung verlangen können. Dieses Recht steht ihnen jedoch nur zu, wenn sie glaubhaft machen, daß durch die Verschmelzung die Erfüllung ihrer Forderung gefährdet wird."
    },
    {
      "date": "2025-06-23",
      "id": "113065",
      "original_text": "Einreichung neuer Dokumente\nHessen Amtsgericht Wetzlar HRB 1025\nEnergie- und Wassergesellschaft mbH – Wetzlar",
      "type": "Einreichung neuer Dokumente",
      "state": "Hessen",
      "amtsgericht": "Amtsgericht Wetzlar",
      "registernummer": "HRB 1025",
      "registerart": "HRB",
      "company_name": "Energie- und Wassergesellschaft mbH",
      "company_seat": "Wetzlar",
      "details": "23.06.2025 (Bekanntmachungsdatum)\n\nHessen Amtsgericht Wetzlar HRB 1025\nEinreichung neuer Dokumente\n\nEnergie- und Wassergesellschaft mbH\nGesellschaft mit beschränkter Haftung\nWetzlar\n\nDurch eine Änderung in den Personen der Aufsichtsratsmitglieder ist eine Liste der Mitglieder des Aufsichtsrates zum Handelsregister eingereicht worden."
    },
    {
      "date": "2025-06-23",
      "id": "113066",
      "original_text": "Registerbekanntmachung nach dem Umwandlungsgesetz\nHessen Amtsgericht Frankfurt am Main HRB 120015\nScannell Deutschland No. 009 GmbH – Frankfurt am Main",
      "type": "Registerbekanntmachung nach dem Umwandlungsgesetz",
      "state": "Hessen",
      "amtsgericht": "Amtsgericht Frankfurt am Main",
      "registernummer": "HRB 120015",
      "registerart": "HRB",
      "company_name": "Scannell Deutschland No. 009 GmbH",
      "company_seat": "Frankfurt am Main",
      "details": "23.06.2025 (Bekanntmachungsdatum)\n\nHessen Amtsgericht Frankfurt am Main HRB 120015\nRegisterbekanntmachung nach dem Umwandlungsgesetz 10.06.2025 (Eintragungsdatum)\n\nScannell Deutschland No. 009 GmbH\nGesellschaft mit beschränkter Haftung\nFrankfurt am Main\n\n1.\tDer Entwurf des Verschmelzungsplanes wurde am 10. Juni 2025 beim Handelsregister eingereicht.\n\n2.\tAn der grenzüberschreitenden Verschmelzung sind die folgenden Gesellschaften beteiligt (Rechtsform, Firma und Sitz)\n\na.\tScannell Properties Europe S.a.r.l. eine Gesellschaft mit beschränkter Haftung (sociéte a responsabilite limitee) nach dem Recht des Staates Luxemburg mit Sitz und Geschäftsanschrift 8, Rue Dicks, L-1417 Herzogtum Luxembourg, Luxemburg (Übernehmende Gesellschaft)\n\nb.\tScannell Deutschland No. 009 GmbH mit Sitz in Frankfurt am Main und Geschäftsanschrift c/o Mazars GmbH & Co. KG, Theodor-Stern-Kai 1, 60596 Frankfurt am Main (Übertragende Gesellschaft)\n\n3.\tDie an der grenzüberschreitenden Verschmelzung beteiligten Gesellschaften sind in folgenden Registern eingetragen (nebst jeweiliger Registernummer)\n\na.\tScannell Properties Europe S.a.r.l.\neingetragen im Handelsregister von Luxemburg (Registre de Commerce et des Societes, Luxembourg) unter der Registernummer B245273\n\nb.\tScannell Deutschland No. 009 GmbH\neingetragen im Handelsregister des Amtsgerichts Frankfurt Main unter HRB 120015\n\n4.\tDie Anteilsinhaber und Gläubiger der an der grenzüberschreitenden Verschmelzung beteiligten Gesellschaften sind\n\na.\tScannell Properties Europe LLC, Handelsregisternummer 201909031343665, eingetragen beim Secretary of State von Indiana mit Sitz und Geschäftsanschrift 8801 River Crossing Blvd. Suite 300, 46240 Indiana, Vereinigte Staaten von Amerika ist der Gesellschafter der übernehmenden Gesellschaft\n\nb.\tScannell Properties Europe S.a.r.l.\neingetragen im Handelsregister von Luxemburg (Registre de Commerce et des Societes, Luxembourg) unter der Registernummer B245273 ist der Gesellschafter der übertragenden Gesellschaft.\n\n5.\tEs erfolgt ein Hinweis an folgende Personen, dass sie der jeweiligen Gesellschaft spätestens fünf Arbeitstage vor dem Tag der Gesellschafterversammlung Bemerkungen zum Verschmelzungsplan übermitteln können:\nAn die Anteilsinhaber und Gläubiger der an der grenzüberschreitenden Verschmelzung beteiligten Gesellschaften\nDa es weder einen Betriebsrat bei den beteiligten Gesellschaften gibt, noch Arbeitnehmer, ist ein Hinweis an diese nicht erforderlich."
    },
    {
      "date": "2025-06-23",
      "id": "113067",
      "original_text": "Sonstige Registerbekanntmachung\nHessen Amtsgericht Kassel VR 5023\nvivars - Zentralverband zur Förderung von Kunst, Kultur und Kreativität e.V. – Zierenberg",
      "type": "Sonstige Registerbekanntmachung",
      "state": "Hessen",
      "amtsgericht": "Amtsgericht Kassel",
      "registernummer": "VR 5023",
      "registerart": "VR",
      "company_name": "vivars - Zentralverband zur Förderung von Kunst, Kultur und Kreativität e.V.",
      "company_seat": "Zierenberg",
      "details": "23.06.2025 (Bekanntmachungsdatum)\n\nHessen Amtsgericht Kassel VR 5023\nSonstige Registerbekanntmachung 23.06.2025 (Eintragungsdatum)\n\nvivars - Zentralverband zur Förderung von Kunst, Kultur und Kreativität e.V.\neingetragener Verein\nZierenberg\n\nDer Verein ist aufgelöst."
    },
    {
      "date": "2025-06-23",
      "id": "113068",
      "original_text": "Registerbekanntmachung nach dem Umwandlungsgesetz\nHessen Amtsgericht Frankfurt am Main HRB 42572\noffice profis GmbH – Frankfurt am Main",
      "type": "Registerbekanntmachung nach dem Umwandlungsgesetz",
      "state": "Hessen",
      "amtsgericht": "Amtsgericht Frankfurt am Main",
      "registernummer": "HRB 42572",
      "registerart": "HRB",
      "company_name": "office profis GmbH",
      "company_seat": "Frankfurt am Main",
      "details": "23.06.2025 (Bekanntmachungsdatum)\n\nHessen Amtsgericht Frankfurt am Main HRB 42572\nRegisterbekanntmachung nach dem Umwandlungsgesetz 23.06.2025 (Eintragungsdatum)\n\noffice profis GmbH\nGesellschaft mit beschränkter Haftung\nFrankfurt am Main\n\nDen Gläubigern der an der Verschmelzung beteiligten Rechtsträger ist, wenn sie binnen sechs Monaten nach dem Tag, an dem die Eintragung der Verschmelzung in das Register des Sitzes desjenigen Rechtsträgers, dessen Gläubiger sie sind, nach § 19 Absatz 3 UmwG bekannt gemacht worden ist, ihren Anspruch nach Grund und Höhe schriftlich anmelden, Sicherheit zu leisten, soweit sie nicht Befriedigung verlangen können. Dieses Recht steht den Gläubigern jedoch nur zu, wenn sie glaubhaft machen, dass durch die Verschmelzung die Erfüllung ihrer Forderung gefährdet wird."
    },
    {
      "date": "2025-06-23",
      "id": "113069",
      "original_text": "Registerbekanntmachung nach dem Umwandlungsgesetz\nHessen Amtsgericht Frankfurt am Main HRB 77169\nCorestate Capital Advisors GmbH – Frankfurt am Main",
      "type": "Registerbekanntmachung nach dem Umwandlungsgesetz",
      "state": "Hessen",
      "amtsgericht": "Amtsgericht Frankfurt am Main",
      "registernummer": "HRB 77169",
      "registerart": "HRB",
      "company_name": "Corestate Capital Advisors GmbH",
      "company_seat": "Frankfurt am Main",
      "details": "23.06.2025 (Bekanntmachungsdatum)\n\nHessen Amtsgericht Frankfurt am Main HRB 77169\nRegisterbekanntmachung nach dem Umwandlungsgesetz 23.06.2025 (Eintragungsdatum)\n\nCorestate Capital Advisors GmbH\nGesellschaft mit beschränkter Haftung\nFrankfurt am Main\n\nDen Gläubigern der an der Verschmelzung beteiligten Rechtsträger ist, wenn sie binnen sechs Monaten nach dem Tag, an dem die Eintragung der Verschmelzung in das Register des Sitzes desjenigen Rechtsträgers, dessen Gläubiger sie sind, nach § 19 Absatz 3 UmwG bekannt gemacht worden ist, ihren Anspruch nach Grund und Höhe schriftlich anmelden, Sicherheit zu leisten, soweit sie nicht Befriedigung verlangen können. Dieses Recht steht den Gläubigern jedoch nur zu, wenn sie glaubhaft machen, dass durch die Verschmelzung die Erfüllung ihrer Forderung gefährdet wird."
    },
    {
      "date": "2025-06-23",
      "id": "113070",
      "original_text": "Einreichung neuer Dokumente\nHessen Amtsgericht Frankfurt am Main HRB 121661\nZurich Vertriebs und Beratungs GmbH – Frankfurt am Main",
      "type": "Einreichung neuer Dokumente",
      "state": "Hessen",
      "amtsgericht": "Amtsgericht Frankfurt am Main",
      "registernummer": "HRB 121661",
      "registerart": "HRB",
      "company_name": "Zurich Vertriebs und Beratungs GmbH",
      "company_seat": "Frankfurt am Main",
      "details": "23.06.2025 (Bekanntmachungsdatum)\n\nHessen Amtsgericht Frankfurt am Main HRB 121661\nEinreichung neuer Dokumente\n\nZurich Vertriebs und Beratungs GmbH\nGesellschaft mit beschränkter Haftung\nFrankfurt am Main\n\nDurch eine Änderung in den Personen der Aufsichtsratsmitglieder ist eine Liste der Mitglieder des Aufsichtsrates zum Handelsregister eingereicht worden."
    },
    {
      "date": "2025-06-23",
      "id": "113071",
      "original_text": "Registerbekanntmachung nach dem Umwandlungsgesetz\nHessen Amtsgericht Wiesbaden HRB 33687\nB&B Hotels Management GmbH – Hochheim am Main",
      "type": "Registerbekanntmachung nach dem Umwandlungsgesetz",
      "state": "Hessen",
      "amtsgericht": "Amtsgericht Wiesbaden",
      "registernummer": "HRB 33687",
      "registerart": "HRB",
      "company_name": "B&B Hotels Management GmbH",
      "company_seat": "Hochheim am Main",
      "details": "23.06.2025 (Bekanntmachungsdatum)\n\nHessen Amtsgericht Wiesbaden HRB 33687\nRegisterbekanntmachung nach dem Umwandlungsgesetz 23.06.2025 (Eintragungsdatum)\n\nB&B Hotels Management GmbH\nGesellschaft mit beschränkter Haftung\nHochheim am Main\n\nDen Gläubigern der an der Verschmelzung beteiligten Rechtsträger ist, wenn sie binnen sechs Monaten nach dem Tag, an dem die Eintragung der Verschmelzung in das Register des Sitzes derjenigen Rechtsträger deren Gläubiger sie sind, nach § 19 Absatz 3 UmwG bekannt gemacht worden ist, ihren Anspruch nach Grund und Höhe schriftlich anmelden, Sicherheit zu leisten, soweit sie nicht Befriedigung verlangen können. Dieses Recht steht den Gläubigern jedoch nur zu, wenn sie glaubhaft machen, dass durch die Verschmelzung die Erfüllung ihrer Forderung gefährdet wird."
    },
    {
      "date": "2025-06-23",
      "id": "113072",
      "original_text": "Löschungsankündigung\nHessen Amtsgericht Wiesbaden VR 7319\nUnternehmer machen Schule e.V. – Wiesbaden",
      "type": "Löschungsankündigung",
      "state": "Hessen",
      "amtsgericht": "Amtsgericht Wiesbaden",
      "registernummer": "VR 7319",
      "registerart": "VR",
      "company_name": "Unternehmer machen Schule e.V.",
      "company_seat": "Wiesbaden",
      "details": "23.06.2025 (Bekanntmachungsdatum)\n\nHessen Amtsgericht Wiesbaden VR 7319\nLöschungsankündigung 23.06.2025 (Eintragungsdatum)\n\nUnternehmer machen Schule e.V.\neingetragener Verein\nWiesbaden\n\nDer Verein ist aufgelöst."
    },
    {
      "date": "2025-06-23",
      "id": "113073",
      "original_text": "Löschungsankündigung\nHessen Amtsgericht Wiesbaden HRB 30218\nMG56 Consulting UG (haftungsbeschränkt) – Flörsheim am Main",
      "type": "Löschungsankündigung",
      "state": "Hessen",
      "amtsgericht": "Amtsgericht Wiesbaden",
      "registernummer": "HRB 30218",
      "registerart": "HRB",
      "company_name": "MG56 Consulting UG (haftungsbeschränkt)",
      "company_seat": "Flörsheim am Main",
      "details": "23.06.2025 (Bekanntmachungsdatum)\n\nHessen Amtsgericht Wiesbaden HRB 30218\nLöschungsankündigung\n\nMG56 Consulting UG (haftungsbeschränkt)\nGesellschaft mit beschränkter Haftung\nFlörsheim am Main\n\nDas Registergericht beabsichtigt die im Handelsregister eingetragene Gesellschaft von Amts wegen nach § 394 FamFG zu löschen. Die Frist zur Erhebung eines Widerspruchs gegen die beabsichtigte Löschung wird auf 3 Monate festgesetzt."
    },
    {
      "date": "2025-06-23",
      "id": "113074",
      "original_text": "Löschungsankündigung\nHessen Amtsgericht Wiesbaden HRB 28434\nEco Consult GmbH – Wiesbaden",
      "type": "Löschungsankündigung",
      "state": "Hessen",
      "amtsgericht": "Amtsgericht Wiesbaden",
      "registernummer": "HRB 28434",
      "registerart": "HRB",
      "company_name": "Eco Consult GmbH",
      "company_seat": "Wiesbaden",
      "details": "23.06.2025 (Bekanntmachungsdatum)\n\nHessen Amtsgericht Wiesbaden HRB 28434\nLöschungsankündigung\n\nEco Consult GmbH\nGesellschaft mit beschränkter Haftung\nWiesbaden\n\nDas Registergericht beabsichtigt die im Handelsregister eingetragene Gesellschaft von Amts wegen nach § 394 FamFG zu löschen. Die Frist zur Erhebung eines Widerspruchs gegen die beabsichtigte Löschung wird auf 3 Monate festgesetzt."
    },
    {
      "date": "2025-06-23",
      "id": "113075",
      "original_text": "Löschungsankündigung\nHessen Amtsgericht Frankfurt am Main HRB 90880\nAkzent Gebäudeservice GmbH – Frankfurt am Main",
      "type": "Löschungsankündigung",
      "state": "Hessen",
      "amtsgericht": "Amtsgericht Frankfurt am Main",
      "registernummer": "HRB 90880",
      "registerart": "HRB",
      "company_name": "Akzent Gebäudeservice GmbH",
      "company_seat": "Frankfurt am Main",
      "details": "23.06.2025 (Bekanntmachungsdatum)\n\nHessen Amtsgericht Frankfurt am Main HRB 90880\nLöschungsankündigung\n\nAkzent Gebäudeservice GmbH\nGesellschaft mit beschränkter Haftung\nFrankfurt am Main\n\nEs ist beabsichtigt, die Gesellschaft wegen Vermögenslosigkeit gemäß § 394 FamFG von Amts wegen im Handelsregister zu löschen. Hiergegen kann innerhalb eines Monats nach dieser Veröffentlichung Widerspruch bei dem Amtsgericht Frankfurt am Main eingelegt werden."
    },
    {
      "date": "2025-06-23",
      "id": "113076",
      "original_text": "Löschungsankündigung\nHessen Amtsgericht Offenbach am Main HRB 46363\nAsikis Transporte GmbH – Offenbach am Main",
      "type": "Löschungsankündigung",
      "state": "Hessen",
      "amtsgericht": "Amtsgericht Offenbach am Main",
      "registernummer": "HRB 46363",
      "registerart": "HRB",
      "company_name": "Asikis Transporte GmbH",
      "company_seat": "Offenbach am Main",
      "details": "23.06.2025 (Bekanntmachungsdatum)\n\nHessen Amtsgericht Offenbach am Main HRB 46363\nLöschungsankündigung\n\nAsikis Transporte GmbH\nGesellschaft mit beschränkter Haftung\nOffenbach am Main\n\nDas Registergericht beabsichtigt die im Handelsregister eingetragene Gesellschaft von Amts wegen nach § 394 FamFG zu löschen. Die Frist zur Erhebung eines Widerspruchs gegen die beabsichtigte Löschung wird auf 3 Monate festgesetzt."
    },
    {
      "date": "2025-06-23",
      "id": "113077",
      "original_text": "Sonstige Registerbekanntmachung\nHessen Amtsgericht Frankfurt am Main HRB 41705\nDB Energie GmbH – Frankfurt am Main",
      "type": "Sonstige Registerbekanntmachung",
      "state": "Hessen",
      "amtsgericht": "Amtsgericht Frankfurt am Main",
      "registernummer": "HRB 41705",
      "registerart": "HRB",
      "company_name": "DB Energie GmbH",
      "company_seat": "Frankfurt am Main",
      "details": "23.06.2025 (Bekanntmachungsdatum)\n\nHessen Amtsgericht Frankfurt am Main HRB 41705\nSonstige Registerbekanntmachung 11.06.2025 (Eintragungsdatum)\n\nDB Energie GmbH\nGesellschaft mit beschränkter Haftung\nFrankfurt am Main\n\nDurch eine Änderung in den Personen der Aufsichtsratsmitglieder ist eine Liste der Mitglieder des Aufsichtsrates zum Handelsregister eingereicht worden."
    },
    {
      "date": "2025-06-23",
      "id": "113078",
      "original_text": "Registerbekanntmachung nach dem Umwandlungsgesetz\nHessen Amtsgericht Wiesbaden HRB 35674\nB&B Hotels Essen GmbH – Hochheim am Main",
      "type": "Registerbekanntmachung nach dem Umwandlungsgesetz",
      "state": "Hessen",
      "amtsgericht": "Amtsgericht Wiesbaden",
      "registernummer": "HRB 35674",
      "registerart": "HRB",
      "company_name": "B&B Hotels Essen GmbH",
      "company_seat": "Hochheim am Main",
      "details": "23.06.2025 (Bekanntmachungsdatum)\n\nHessen Amtsgericht Wiesbaden HRB 35674\nRegisterbekanntmachung nach dem Umwandlungsgesetz 23.06.2025 (Eintragungsdatum)\n\nB&B Hotels Essen GmbH\nGesellschaft mit beschränkter Haftung\nHochheim am Main\n\nDen Gläubigern der an der Verschmelzung beteiligten Rechtsträger ist, wenn sie binnen sechs Monaten nach dem Tag, an dem die Eintragung der Verschmelzung in das Register des Sitzes derjenigen Rechtsträger deren Gläubiger sie sind, nach § 19 Absatz 3 UmwG bekannt gemacht worden ist, ihren Anspruch nach Grund und Höhe schriftlich anmelden, Sicherheit zu leisten, soweit sie nicht Befriedigung verlangen können. Dieses Recht steht den Gläubigern jedoch nur zu, wenn sie glaubhaft machen, dass durch die Verschmelzung die Erfüllung ihrer Forderung gefährdet wird."
    },
    {
      "date": "2025-06-23",
      "id": "113079",
      "original_text": "Registerbekanntmachung nach dem Umwandlungsgesetz\nHessen Amtsgericht Frankfurt am Main HRB 77169\nCorestate Capital Advisors GmbH – Frankfurt am Main",
      "type": "Registerbekanntmachung nach dem Umwandlungsgesetz",
      "state": "Hessen",
      "amtsgericht": "Amtsgericht Frankfurt am Main",
      "registernummer": "HRB 77169",
      "registerart": "HRB",
      "company_name": "Corestate Capital Advisors GmbH",
      "company_seat": "Frankfurt am Main",
      "details": "23.06.2025 (Bekanntmachungsdatum)\n\nHessen Amtsgericht Frankfurt am Main HRB 77169\nRegisterbekanntmachung nach dem Umwandlungsgesetz 23.06.2025 (Eintragungsdatum)\n\nCorestate Capital Advisors GmbH\nGesellschaft mit beschränkter Haftung\nFrankfurt am Main\n\nDen Gläubigern der an der Verschmelzung beteiligten Rechtsträger ist, wenn sie binnen sechs Monaten nach dem Tag, an dem die Eintragung der Verschmelzung in das Register des Sitzes desjenigen Rechtsträgers, dessen Gläubiger sie sind, nach § 19 Absatz 3 UmwG bekannt gemacht worden ist, ihren Anspruch nach Grund und Höhe schriftlich anmelden, Sicherheit zu leisten, soweit sie nicht Befriedigung verlangen können. Dieses Recht steht den Gläubigern jedoch nur zu, wenn sie glaubhaft machen, dass durch die Verschmelzung die Erfüllung ihrer Forderung gefährdet wird."
    },
    {
      "date": "2025-06-23",
      "id": "86",
      "original_text": "Sonderregisterbekanntmachung OHNE Bezug zum elektr. Register\nSachsen-Anhalt Amtsgericht Stendal\nGnR 25\nProduktionsgenossenschaft des Elektrohandwerks Kemberg",
      "type": "Sonderregisterbekanntmachung OHNE Bezug zum elektr. Register",
      "state": "Sachsen-Anhalt",
      "amtsgericht": "Amtsgericht Stendal",
      "company_name": "Produktionsgenossenschaft des Elektrohandwerks Kemberg",
      "sonderegister_referenz": "GnR 25",
      "details": "23.06.2025 (Bekanntmachungsdatum)\n\nSachsen-Anhalt Amtsgericht Stendal\nGnR 25\nSonderregisterbekanntmachung OHNE Bezug zum elektr. Register\n\nProduktionsgenossenschaft des Elektrohandwerks Kemberg\n\nDas Registergericht beabsichtigt, nachfolgende Person zum Nachtragsliquidator für die bereits gelöscht Genossenschaft zu bestellen. Die Frist zur Erhebung eines Widerspruchs gegen die beabsichtigte Löschung wird auf einen Monat festgesetzt."
    }
  ]
}