{
  "date": "2025-10-17",
  "date_of_scrape": "2025-10-27T18:23:22.930Z",
  "tool_version": "0.2.0",
  "number_of_announcements": 117,
  "announcements": [
    {
      "date": "2025-10-17",
      "id": "134311",
      "original_text": "Einreichung neuer Dokumente\nBaden-Württemberg Amtsgericht Stuttgart HRB 380686\nStadtwerke Tübingen GmbH – Tübingen",
      "type": "Einreichung neuer Dokumente",
      "state": "Baden-Württemberg",
      "amtsgericht": "Amtsgericht Stuttgart",
      "registernummer": "HRB 380686",
      "registerart": "HRB",
      "company_name": "Stadtwerke Tübingen GmbH",
      "company_seat": "Tübingen",
      "details": "17.10.2025 (Bekanntmachungsdatum)\n\nBaden-Württemberg Amtsgericht Stuttgart HRB 380686\nEinreichung neuer Dokumente\n\nStadtwerke Tübingen GmbH\nGesellschaft mit beschränkter Haftung\nTübingen\n\nDie Gesellschaft hat am 26.09.2025 die Liste über die Zusammensetzung des Aufsichtsrats zum Handelsregister eingereicht."
    },
    {
      "date": "2025-10-17",
      "id": "134312",
      "original_text": "Registerbekanntmachung nach dem Umwandlungsgesetz\nBrandenburg Amtsgericht Neuruppin HRB 7408\nENERTRAG EnergieInvest GmbH – Dauerthal",
      "type": "Registerbekanntmachung nach dem Umwandlungsgesetz",
      "state": "Brandenburg",
      "amtsgericht": "Amtsgericht Neuruppin",
      "registernummer": "HRB 7408",
      "registerart": "HRB",
      "company_name": "ENERTRAG EnergieInvest GmbH",
      "company_seat": "Dauerthal",
      "details": "17.10.2025 (Bekanntmachungsdatum)\n\nBrandenburg Amtsgericht Neuruppin HRB 7408\nRegisterbekanntmachung nach dem Umwandlungsgesetz 16.10.2025 (Eintragungsdatum)\n\nENERTRAG EnergieInvest GmbH\nGesellschaft mit beschränkter Haftung\nDauerthal\n\nZu Eintragungsnummer 15 vom 16.10.2025 wird als nicht eingetragen veröffentlicht:\nDen Gläubigern der an der Verschmelzung beteiligten Rechtsträger ist, wenn sie binnen sechs Monaten nach dem Tag, an dem die Eintragung der Verschmelzung in das Register des Sitzes desjenigen Rechtsträgers, dessen Gläubiger sie sind, als bekannt gemacht gilt, ihren Anspruch nach Grund und Höhe schriftlich anmelden, Sicherheit zu leisten, soweit sie nicht Befriedigung verlangen können. Dieses Recht steht den Gläubigern jedoch nur zu, wenn sie glaubhaft machen, dass durch die Verschmelzung die Erfüllung ihrer Forderung gefährdet wird"
    },
    {
      "date": "2025-10-17",
      "id": "134313",
      "original_text": "Löschungsankündigung\nSchleswig-Holstein Amtsgericht Kiel HRB 13739\nAGEMA-Services GmbH – Kronshagen",
      "type": "Löschungsankündigung",
      "state": "Schleswig-Holstein",
      "amtsgericht": "Amtsgericht Kiel",
      "registernummer": "HRB 13739",
      "registerart": "HRB",
      "company_name": "AGEMA-Services GmbH",
      "company_seat": "Kronshagen",
      "details": "17.10.2025 (Bekanntmachungsdatum)\n\nSchleswig-Holstein Amtsgericht Kiel HRB 13739\nLöschungsankündigung\n\nAGEMA-Services GmbH\nGesellschaft mit beschränkter Haftung\nKronshagen\n\nEs ist die Löschung der nachstehenden Gesellschaft wegen Vermögenslosigkeit gemäß § 394 FamFG beabsichtigt. Widerspruchsfrist: 1 Monat."
    },
    {
      "date": "2025-10-17",
      "id": "134314",
      "original_text": "Einreichung neuer Dokumente\nBrandenburg Amtsgericht Cottbus HRB 7673\nISG - Immobilien-Service-Gesellschaft Niederlausitz mbH – Calau",
      "type": "Einreichung neuer Dokumente",
      "state": "Brandenburg",
      "amtsgericht": "Amtsgericht Cottbus",
      "registernummer": "HRB 7673",
      "registerart": "HRB",
      "company_name": "ISG - Immobilien-Service-Gesellschaft Niederlausitz mbH",
      "company_seat": "Calau",
      "details": "17.10.2025 (Bekanntmachungsdatum)\n\nBrandenburg Amtsgericht Cottbus HRB 7673\nEinreichung neuer Dokumente\n\nISG - Immobilien-Service-Gesellschaft Niederlausitz mbH\nGesellschaft mit beschränkter Haftung\nCalau\n\nDie aktuelle Liste der Aufsichtsratsmitglieder wurde zum Handelsregister gem. § 52 Abs. 3 GmbHG eingereicht."
    },
    {
      "date": "2025-10-17",
      "id": "134315",
      "original_text": "Sonstige Registerbekanntmachung\nBerlin Amtsgericht Berlin (Charlottenburg) HRB 182950\nEV Digital Invest Assets Management AG – Berlin",
      "type": "Sonstige Registerbekanntmachung",
      "state": "Berlin",
      "amtsgericht": "Amtsgericht Berlin (Charlottenburg)",
      "registernummer": "HRB 182950",
      "registerart": "HRB",
      "company_name": "EV Digital Invest Assets Management AG",
      "company_seat": "Berlin",
      "details": "17.10.2025 (Bekanntmachungsdatum)\n\nBerlin Amtsgericht Berlin (Charlottenburg) HRB 182950\nSonstige Registerbekanntmachung\n\nEV Digital Invest Assets Management AG\nAktiengesellschaft\nBerlin\n\nAls nicht eingetragen wird veröffentlicht:\n\nDer andere Vertragsteil hat den Gläubigern dieses Rechtsträgers, deren Forderungen begründet worden sind, bevor die Eintragung der Beendigung dieses Vertrages in das Handelsregister nach § 10 des Handelsgesetzbuches als bekannt gemacht gilt, Sicherheit zu leisten, wenn sie sich binnen sechs Monaten nach der Bekanntmachung der Eintragung zu diesem Zweck bei ihm melden. Dieses Recht steht den Gläubigern nicht zu, die im Fall des Insolvenzverfahrens ein Recht auf vorzugsweise Befriedigung aus der Deckungsmasse haben, die nach gesetzlicher Vorschrift zu ihrem Schutz errichtet und staatlich überwacht ist."
    },
    {
      "date": "2025-10-17",
      "id": "134316",
      "original_text": "Registerbekanntmachung nach dem Umwandlungsgesetz\nHamburg Amtsgericht Hamburg HRB 142329\nEBC Euro-Business-College GmbH – Hamburg",
      "type": "Registerbekanntmachung nach dem Umwandlungsgesetz",
      "state": "Hamburg",
      "amtsgericht": "Amtsgericht Hamburg",
      "registernummer": "HRB 142329",
      "registerart": "HRB",
      "company_name": "EBC Euro-Business-College GmbH",
      "company_seat": "Hamburg",
      "details": "17.10.2025 (Bekanntmachungsdatum)\n\nHamburg Amtsgericht Hamburg HRB 142329\nRegisterbekanntmachung nach dem Umwandlungsgesetz 14.10.2025 (Eintragungsdatum)\n\nEBC Euro-Business-College GmbH\nGesellschaft mit beschränkter Haftung\nHamburg\n\nAls nicht eingetragen wird bekannt gemacht:\nDen Gläubigern der an der Verschmelzung beteiligten Gesellschaften ist, wenn sie binnen sechs Monaten nach dem Tag, an dem die Eintragung der Verschmelzung in das Register des Sitzes desjenigen Rechtsträgers, dessen Gläubiger sie sind, nach § 19 Absatz 3 UmwG als bekannt gemacht gilt, ihren Anspruch nach Grund und Höhe schriftlich anmelden, Sicherheit zu leisten, soweit sie nicht Befriedigung verlangen können. Dieses Recht steht den Gläubigern jedoch nur zu, wenn sie glaubhaft machen, dass durch die Verschmelzung die Erfüllung ihrer Forderung gefährdet wird."
    },
    {
      "date": "2025-10-17",
      "id": "134317",
      "original_text": "Registerbekanntmachung nach dem Umwandlungsgesetz\nHamburg Amtsgericht Hamburg HRB 170399\nElektrotechnik Schulz Verwaltungs-GmbH – Hamburg",
      "type": "Registerbekanntmachung nach dem Umwandlungsgesetz",
      "state": "Hamburg",
      "amtsgericht": "Amtsgericht Hamburg",
      "registernummer": "HRB 170399",
      "registerart": "HRB",
      "company_name": "Elektrotechnik Schulz Verwaltungs-GmbH",
      "company_seat": "Hamburg",
      "details": "17.10.2025 (Bekanntmachungsdatum)\n\nHamburg Amtsgericht Hamburg HRB 170399\nRegisterbekanntmachung nach dem Umwandlungsgesetz 17.10.2025 (Eintragungsdatum)\n\nElektrotechnik Schulz Verwaltungs-GmbH\nGesellschaft mit beschränkter Haftung\nHamburg\n\nAls nicht eingetragen wird bekannt gemacht:\nDen Gläubigern der an der Verschmelzung beteiligten Gesellschaften ist, wenn sie binnen sechs Monaten nach dem Tag, an dem die Eintragung der Verschmelzung in das Register des Sitzes desjenigen Rechtsträgers, dessen Gläubiger sie sind, nach § 19 Absatz 3 UmwG als bekannt gemacht gilt, ihren Anspruch nach Grund und Höhe schriftlich anmelden, Sicherheit zu leisten, soweit sie nicht Befriedigung verlangen können. Dieses Recht steht den Gläubigern jedoch nur zu, wenn sie glaubhaft machen, dass durch die Verschmelzung die Erfüllung ihrer Forderung gefährdet wird."
    },
    {
      "date": "2025-10-17",
      "id": "134318",
      "original_text": "Registerbekanntmachung nach dem Umwandlungsgesetz\nHamburg Amtsgericht Hamburg HRB 194501\nElektrotechnik Schulz GmbH – Hamburg",
      "type": "Registerbekanntmachung nach dem Umwandlungsgesetz",
      "state": "Hamburg",
      "amtsgericht": "Amtsgericht Hamburg",
      "registernummer": "HRB 194501",
      "registerart": "HRB",
      "company_name": "Elektrotechnik Schulz GmbH",
      "company_seat": "Hamburg",
      "details": "17.10.2025 (Bekanntmachungsdatum)\n\nHamburg Amtsgericht Hamburg HRB 194501\nRegisterbekanntmachung nach dem Umwandlungsgesetz 17.10.2025 (Eintragungsdatum)\n\nElektrotechnik Schulz GmbH\nGesellschaft mit beschränkter Haftung\nHamburg\n\nAls nicht eingetragen wird bekannt gemacht:\nDen Gläubigern der an der Verschmelzung beteiligten Gesellschaften ist, wenn sie binnen sechs Monaten nach dem Tag, an dem die Eintragung der Verschmelzung in das Register des Sitzes desjenigen Rechtsträgers, dessen Gläubiger sie sind, nach § 19 Absatz 3 UmwG als bekannt gemacht gilt, ihren Anspruch nach Grund und Höhe schriftlich anmelden, Sicherheit zu leisten, soweit sie nicht Befriedigung verlangen können. Dieses Recht steht den Gläubigern jedoch nur zu, wenn sie glaubhaft machen, dass durch die Verschmelzung die Erfüllung ihrer Forderung gefährdet wird."
    },
    {
      "date": "2025-10-17",
      "id": "134319",
      "original_text": "Einreichung neuer Dokumente\nSchleswig-Holstein Amtsgericht Pinneberg HRB 901 ME\nAbwasserentsorgung Brunsbüttel GmbH (ABG) – Brunsbüttel",
      "type": "Einreichung neuer Dokumente",
      "state": "Schleswig-Holstein",
      "amtsgericht": "Amtsgericht Pinneberg",
      "registernummer": "HRB 901 ME",
      "registerart": "HRB",
      "company_name": "Abwasserentsorgung Brunsbüttel GmbH (ABG)",
      "company_seat": "Brunsbüttel",
      "details": "17.10.2025 (Bekanntmachungsdatum)\n\nSchleswig-Holstein Amtsgericht Pinneberg HRB 901 ME\nEinreichung neuer Dokumente\n\nAbwasserentsorgung Brunsbüttel GmbH (ABG)\nGesellschaft mit beschränkter Haftung\nBrunsbüttel\n\nAls nicht eingetragen wird veröffentlicht: Es wurde eine neue Liste der Aufsichtsratsmitglieder zum Handelsregister eingereicht."
    },
    {
      "date": "2025-10-17",
      "id": "134320",
      "original_text": "Registerbekanntmachung nach dem Umwandlungsgesetz\nBaden-Württemberg Amtsgericht Stuttgart HRB 782263\nAUDERE GC GmbH – Fellbach",
      "type": "Registerbekanntmachung nach dem Umwandlungsgesetz",
      "state": "Baden-Württemberg",
      "amtsgericht": "Amtsgericht Stuttgart",
      "registernummer": "HRB 782263",
      "registerart": "HRB",
      "company_name": "AUDERE GC GmbH",
      "company_seat": "Fellbach",
      "details": "17.10.2025 (Bekanntmachungsdatum)\n\nBaden-Württemberg Amtsgericht Stuttgart HRB 782263\nRegisterbekanntmachung nach dem Umwandlungsgesetz 17.10.2025 (Eintragungsdatum)\n\nAUDERE GC GmbH\nGesellschaft mit beschränkter Haftung\nFellbach\n\nAls nicht eingetragen wird bekanntgemacht:\nDen Gläubigern der an der Verschmelzung beteiligten Rechtsträger ist, wenn sie binnen sechs Monaten nach dem Tag, an dem die Eintragung der Verschmelzung in das Register des Sitzes desjenigen Rechtsträgers, dessen Gläubiger sie sind, nach § 19 Abs. 3 UmwG als bekanntgemacht gilt, ihren Anspruch nach Grund und Höhe schriftlich anmelden, Sicherheit zu leisten, soweit sie nicht Befriedigung verlangen können. Dieses Recht steht den Gläubigern jedoch nur zu, wenn sie glaubhaft machen, dass durch die Verschmelzung die Erfüllung ihrer Forderung gefährdet wird."
    },
    {
      "date": "2025-10-17",
      "id": "134321",
      "original_text": "Registerbekanntmachung nach dem Umwandlungsgesetz\nBaden-Württemberg Amtsgericht Stuttgart HRB 753593\nKlaus Wenkert Medizintechnik GmbH – Seitingen-Oberflacht",
      "type": "Registerbekanntmachung nach dem Umwandlungsgesetz",
      "state": "Baden-Württemberg",
      "amtsgericht": "Amtsgericht Stuttgart",
      "registernummer": "HRB 753593",
      "registerart": "HRB",
      "company_name": "Klaus Wenkert Medizintechnik GmbH",
      "company_seat": "Seitingen-Oberflacht",
      "details": "17.10.2025 (Bekanntmachungsdatum)\n\nBaden-Württemberg Amtsgericht Stuttgart HRB 753593\nRegisterbekanntmachung nach dem Umwandlungsgesetz 17.10.2025 (Eintragungsdatum)\n\nKlaus Wenkert Medizintechnik GmbH\nGesellschaft mit beschränkter Haftung\nSeitingen-Oberflacht\n\nAls nicht eingetragen wird bekanntgemacht:\nDen Gläubigern der an der Verschmelzung beteiligten Rechtsträger ist, wenn sie binnen sechs Monaten nach dem Tag, an dem die Eintragung der Verschmelzung in das Register des Sitzes desjenigen Rechtsträgers, dessen Gläubiger sie sind, nach § 19 Abs. 3 UmwG als bekanntgemacht gilt, ihren Anspruch nach Grund und Höhe schriftlich anmelden, Sicherheit zu leisten, soweit sie nicht Befriedigung verlangen können. Dieses Recht steht den Gläubigern jedoch nur zu, wenn sie glaubhaft machen, dass durch die Verschmelzung die Erfüllung ihrer Forderung gefährdet wird."
    },
    {
      "date": "2025-10-17",
      "id": "134322",
      "original_text": "Löschungsankündigung\nBerlin Amtsgericht Berlin (Charlottenburg) HRB 258372\nBaylin UG (haftungsbeschränkt) – Berlin",
      "type": "Löschungsankündigung",
      "state": "Berlin",
      "amtsgericht": "Amtsgericht Berlin (Charlottenburg)",
      "registernummer": "HRB 258372",
      "registerart": "HRB",
      "company_name": "Baylin UG (haftungsbeschränkt)",
      "company_seat": "Berlin",
      "details": "17.10.2025 (Bekanntmachungsdatum)\n\nBerlin Amtsgericht Berlin (Charlottenburg) HRB 258372\nLöschungsankündigung\n\nBaylin UG (haftungsbeschränkt)\nGesellschaft mit beschränkter Haftung\nBerlin\n\nBei der nachstehenden Gesellschaft wird das Amtslöschungsverfahren gemäß § 394 FamFG eingeleitet. Widerspruchsfrist 6 Wochen"
    },
    {
      "date": "2025-10-17",
      "id": "134323",
      "original_text": "Löschungsankündigung\nBerlin Amtsgericht Berlin (Charlottenburg) HRB 163909\nALBAU GmbH – Berlin",
      "type": "Löschungsankündigung",
      "state": "Berlin",
      "amtsgericht": "Amtsgericht Berlin (Charlottenburg)",
      "registernummer": "HRB 163909",
      "registerart": "HRB",
      "company_name": "ALBAU GmbH",
      "company_seat": "Berlin",
      "details": "17.10.2025 (Bekanntmachungsdatum)\n\nBerlin Amtsgericht Berlin (Charlottenburg) HRB 163909\nLöschungsankündigung\n\nALBAU GmbH\nGesellschaft mit beschränkter Haftung\nBerlin\n\nBei der nachstehenden Gesellschaft wird das Amtslöschungsverfahren gemäß § 394 FamFG eingeleitet. Widerspruchsfrist 6 Wochen"
    },
    {
      "date": "2025-10-17",
      "id": "134324",
      "original_text": "Registerbekanntmachung nach dem Umwandlungsgesetz\nHamburg Amtsgericht Hamburg HRA 121789\nClue One GmbH & Co. KG – Hamburg",
      "type": "Registerbekanntmachung nach dem Umwandlungsgesetz",
      "state": "Hamburg",
      "amtsgericht": "Amtsgericht Hamburg",
      "registernummer": "HRA 121789",
      "registerart": "HRA",
      "company_name": "Clue One GmbH & Co. KG",
      "company_seat": "Hamburg",
      "details": "17.10.2025 (Bekanntmachungsdatum)\n\nHamburg Amtsgericht Hamburg HRA 121789\nRegisterbekanntmachung nach dem Umwandlungsgesetz 17.10.2025 (Eintragungsdatum)\n\nClue One GmbH & Co. KG\nKommanditgesellschaft\nHamburg\n\nAls nicht eingetragen wird bekannt gemacht:\nDen Gläubigern der an der Verschmelzung beteiligten Gesellschaften ist, wenn sie binnen sechs Monaten nach dem Tag, an dem die Eintragung der Verschmelzung in das Register des Sitzes desjenigen Rechtsträgers, dessen Gläubiger sie sind, nach § 19 Absatz 3 UmwG als bekannt gemacht gilt, ihren Anspruch nach Grund und Höhe schriftlich anmelden, Sicherheit zu leisten, soweit sie nicht Befriedigung verlangen können. Dieses Recht steht den Gläubigern jedoch nur zu, wenn sie glaubhaft machen, dass durch die Verschmelzung die Erfüllung ihrer Forderung gefährdet wird."
    },
    {
      "date": "2025-10-17",
      "id": "134325",
      "original_text": "Registerbekanntmachung nach dem Umwandlungsgesetz\nHamburg Amtsgericht Hamburg HRB 190901\nClue One Digital GmbH – Hamburg",
      "type": "Registerbekanntmachung nach dem Umwandlungsgesetz",
      "state": "Hamburg",
      "amtsgericht": "Amtsgericht Hamburg",
      "registernummer": "HRB 190901",
      "registerart": "HRB",
      "company_name": "Clue One Digital GmbH",
      "company_seat": "Hamburg",
      "details": "17.10.2025 (Bekanntmachungsdatum)\n\nHamburg Amtsgericht Hamburg HRB 190901\nRegisterbekanntmachung nach dem Umwandlungsgesetz 17.10.2025 (Eintragungsdatum)\n\nClue One Digital GmbH\nGesellschaft mit beschränkter Haftung\nHamburg\n\nAls nicht eingetragen wird bekannt gemacht:\nDen Gläubigern der an der Verschmelzung beteiligten Gesellschaften ist, wenn sie binnen sechs Monaten nach dem Tag, an dem die Eintragung der Verschmelzung in das Register des Sitzes desjenigen Rechtsträgers, dessen Gläubiger sie sind, nach § 19 Absatz 3 UmwG als bekannt gemacht gilt, ihren Anspruch nach Grund und Höhe schriftlich anmelden, Sicherheit zu leisten, soweit sie nicht Befriedigung verlangen können. Dieses Recht steht den Gläubigern jedoch nur zu, wenn sie glaubhaft machen, dass durch die Verschmelzung die Erfüllung ihrer Forderung gefährdet wird."
    },
    {
      "date": "2025-10-17",
      "id": "134326",
      "original_text": "Löschungsankündigung\nBerlin Amtsgericht Berlin (Charlottenburg) HRB 210553\nCHROMIC GmbH – Berlin",
      "type": "Löschungsankündigung",
      "state": "Berlin",
      "amtsgericht": "Amtsgericht Berlin (Charlottenburg)",
      "registernummer": "HRB 210553",
      "registerart": "HRB",
      "company_name": "CHROMIC GmbH",
      "company_seat": "Berlin",
      "details": "17.10.2025 (Bekanntmachungsdatum)\n\nBerlin Amtsgericht Berlin (Charlottenburg) HRB 210553\nLöschungsankündigung\n\nCHROMIC GmbH\nGesellschaft mit beschränkter Haftung\nBerlin\n\nBei der nachstehenden Gesellschaft wird das Amtslöschungsverfahren gemäß § 394 FamFG eingeleitet. Widerspruchsfrist 6 Wochen"
    },
    {
      "date": "2025-10-17",
      "id": "134327",
      "original_text": "Registerbekanntmachung nach dem Umwandlungsgesetz\nSachsen-Anhalt Amtsgericht Stendal HRB 17851\nSaale Immobilien GmbH – Halle (Saale)",
      "type": "Registerbekanntmachung nach dem Umwandlungsgesetz",
      "state": "Sachsen-Anhalt",
      "amtsgericht": "Amtsgericht Stendal",
      "registernummer": "HRB 17851",
      "registerart": "HRB",
      "company_name": "Saale Immobilien GmbH",
      "company_seat": "Halle (Saale)",
      "details": "17.10.2025 (Bekanntmachungsdatum)\n\nSachsen-Anhalt Amtsgericht Stendal HRB 17851\nRegisterbekanntmachung nach dem Umwandlungsgesetz 17.10.2025 (Eintragungsdatum)\n\nSaale Immobilien GmbH\nGesellschaft mit beschränkter Haftung\nHalle (Saale)\n\nNicht eingetragen:\nDen Gläubigern der an der Verschmelzung beteiligten Rechtsträger ist, wenn sie binnen sechs Monaten nach dem Tag, an dem die Eintragung der Verschmelzung nach § 19 Abs. 3 UmwG als bekanntgemacht gilt, ihren Anspruch nach Grund und Höhe schriftlich anmelden, Sicherheit zu leisten, soweit sie nicht Befriedigung verlangen können. Dieses Recht steht ihnen jedoch nur zu, wenn sie glaubhaft machen, dass durch die Verschmelzung die Erfüllung ihrer Forderung gefährdet wird."
    },
    {
      "date": "2025-10-17",
      "id": "134328",
      "original_text": "Registerbekanntmachung nach dem Umwandlungsgesetz\nSachsen-Anhalt Amtsgericht Stendal HRB 17860\nstu-house 1 GmbH – Halle (Saale)",
      "type": "Registerbekanntmachung nach dem Umwandlungsgesetz",
      "state": "Sachsen-Anhalt",
      "amtsgericht": "Amtsgericht Stendal",
      "registernummer": "HRB 17860",
      "registerart": "HRB",
      "company_name": "stu-house 1 GmbH",
      "company_seat": "Halle (Saale)",
      "details": "17.10.2025 (Bekanntmachungsdatum)\n\nSachsen-Anhalt Amtsgericht Stendal HRB 17860\nRegisterbekanntmachung nach dem Umwandlungsgesetz 17.10.2025 (Eintragungsdatum)\n\nstu-house 1 GmbH\nGesellschaft mit beschränkter Haftung\nHalle (Saale)\n\nNicht eingetragen:\nDen Gläubigern der an der Verschmelzung beteiligten Rechtsträger ist, wenn sie binnen sechs Monaten nach dem Tag, an dem die Eintragung der Verschmelzung nach § 19 Abs. 3 UmwG als bekanntgemacht gilt, ihren Anspruch nach Grund und Höhe schriftlich anmelden, Sicherheit zu leisten, soweit sie nicht Befriedigung verlangen können. Dieses Recht steht ihnen jedoch nur zu, wenn sie glaubhaft machen, dass durch die Verschmelzung die Erfüllung ihrer Forderung gefährdet wird."
    },
    {
      "date": "2025-10-17",
      "id": "134329",
      "original_text": "Registerbekanntmachung nach dem Umwandlungsgesetz\nBaden-Württemberg Amtsgericht Freiburg HRB 734148\nEltroplan Engineering GmbH – Endingen am Kaiserstuhl",
      "type": "Registerbekanntmachung nach dem Umwandlungsgesetz",
      "state": "Baden-Württemberg",
      "amtsgericht": "Amtsgericht Freiburg",
      "registernummer": "HRB 734148",
      "registerart": "HRB",
      "company_name": "Eltroplan Engineering GmbH",
      "company_seat": "Endingen am Kaiserstuhl",
      "details": "17.10.2025 (Bekanntmachungsdatum)\n\nBaden-Württemberg Amtsgericht Freiburg HRB 734148\nRegisterbekanntmachung nach dem Umwandlungsgesetz 17.10.2025 (Eintragungsdatum)\n\nEltroplan Engineering GmbH\nGesellschaft mit beschränkter Haftung\nEndingen am Kaiserstuhl\n\nDen Gläubigern der an der Ausgliederung beteiligten Rechtsträger ist, wenn sie binnen sechs Monaten nach dem Tag, an dem die Eintragung der Ausgliederung in das Register des Sitzes desjenigen Rechtsträgers, dessen Gläubiger sie sind, nach § 19 Abs. 3 UmwG als bekanntgemacht gilt, ihren Anspruch nach Grund und Höhe schriftlich anmelden, Sicherheit zu leisten, soweit sie nicht Befriedigung verlangen können. Dieses Recht steht den Gläubigern jedoch nur zu, wenn sie glaubhaft machen, dass durch die Ausgliederung die Erfüllung ihrer Forderung gefährdet wird."
    },
    {
      "date": "2025-10-17",
      "id": "134330",
      "original_text": "Registerbekanntmachung nach dem Umwandlungsgesetz\nBerlin Amtsgericht Berlin (Charlottenburg) HRA 26566\nR & P Maschinenbaumechanik e.K. – Berlin",
      "type": "Registerbekanntmachung nach dem Umwandlungsgesetz",
      "state": "Berlin",
      "amtsgericht": "Amtsgericht Berlin (Charlottenburg)",
      "registernummer": "HRA 26566",
      "registerart": "HRA",
      "company_name": "R & P Maschinenbaumechanik e.K.",
      "company_seat": "Berlin",
      "details": "17.10.2025 (Bekanntmachungsdatum)\n\nBerlin Amtsgericht Berlin (Charlottenburg) HRA 26566\nRegisterbekanntmachung nach dem Umwandlungsgesetz 16.10.2025 (Eintragungsdatum)\n\nR & P Maschinenbaumechanik e.K.\nEinzelkaufmann / Einzelkauffrau\nBerlin\n\nZu Eintragungsnummer 5 vom 16.10.2025 wird als nicht eingetragen veröffentlicht: Den Gläubigern der an der Verschmelzung beteiligten Rechtsträger ist, wenn sie binnen sechs Monaten nach dem Tag, an dem die Eintragung der Verschmelzung in das Register des Sitzes desjenigen Rechtsträgers, dessen Gläubiger sie sind, als bekannt gemacht gilt, ihren Anspruch nach Grund und Höhe schriftlich anmelden, Sicherheit zu leisten, soweit sie nicht Befriedigung verlangen können. Dieses Recht steht den Gläubigern jedoch nur zu, wenn sie glaubhaft machen, dass durch die Verschmelzung die Erfüllung ihrer Forderung gefährdet wird. Das Recht, Sicherheitsleistung zu verlangen, steht Gläubigern nicht zu, die im Falle der Insolvenz ein Recht auf vorzugsweise Befriedigung aus einer Deckungsmasse haben, die nach gesetzlicher Vorschrift zu ihrem Schutz errichtet und staatlich überwacht ist."
    },
    {
      "date": "2025-10-17",
      "id": "134331",
      "original_text": "Registerbekanntmachung nach dem Umwandlungsgesetz\nBerlin Amtsgericht Berlin (Charlottenburg) HRB 54738\nR & P Maschinenbaumechanik Verwaltungs-GmbH – Berlin",
      "type": "Registerbekanntmachung nach dem Umwandlungsgesetz",
      "state": "Berlin",
      "amtsgericht": "Amtsgericht Berlin (Charlottenburg)",
      "registernummer": "HRB 54738",
      "registerart": "HRB",
      "company_name": "R & P Maschinenbaumechanik Verwaltungs-GmbH",
      "company_seat": "Berlin",
      "details": "17.10.2025 (Bekanntmachungsdatum)\n\nBerlin Amtsgericht Berlin (Charlottenburg) HRB 54738\nRegisterbekanntmachung nach dem Umwandlungsgesetz 16.10.2025 (Eintragungsdatum)\n\nR & P Maschinenbaumechanik Verwaltungs-GmbH\nGesellschaft mit beschränkter Haftung\nBerlin\n\nZu Eintragungsnummer 4 vom 16.10.2025 wird als nicht eingetragen veröffentlicht:Den Gläubigern der an der Verschmelzung beteiligten Rechtsträger ist, wenn sie binnen sechs Monaten nach dem Tag, an dem die Eintragung der Verschmelzung in das Register des Sitzes desjenigen Rechtsträgers, dessen Gläubiger sie sind, als bekannt gemacht gilt, ihren Anspruch nach Grund und Höhe schriftlich anmelden, Sicherheit zu leisten, soweit sie nicht Befriedigung verlangen können. Dieses Recht steht den Gläubigern jedoch nur zu, wenn sie glaubhaft machen, dass durch die Verschmelzung die Erfüllung ihrer Forderung gefährdet wird. Das Recht, Sicherheitsleistung zu verlangen, steht Gläubigern nicht zu, die im Falle der Insolvenz ein Recht auf vorzugsweise Befriedigung aus einer Deckungsmasse haben, die nach gesetzlicher Vorschrift zu ihrem Schutz errichtet und staatlich überwacht ist."
    },
    {
      "date": "2025-10-17",
      "id": "134332",
      "original_text": "Registerbekanntmachung nach dem Umwandlungsgesetz\nBaden-Württemberg Amtsgericht Freiburg HRB 702054\nEltroplan Group GmbH – Endingen am Kaiserstuhl",
      "type": "Registerbekanntmachung nach dem Umwandlungsgesetz",
      "state": "Baden-Württemberg",
      "amtsgericht": "Amtsgericht Freiburg",
      "registernummer": "HRB 702054",
      "registerart": "HRB",
      "company_name": "Eltroplan Group GmbH",
      "company_seat": "Endingen am Kaiserstuhl",
      "details": "17.10.2025 (Bekanntmachungsdatum)\n\nBaden-Württemberg Amtsgericht Freiburg HRB 702054\nRegisterbekanntmachung nach dem Umwandlungsgesetz 17.10.2025 (Eintragungsdatum)\n\nEltroplan Group GmbH\nGesellschaft mit beschränkter Haftung\nEndingen am Kaiserstuhl\n\nDen Gläubigern der an der Ausgliederung beteiligten Rechtsträger ist, wenn sie binnen sechs Monaten nach dem Tag, an dem die Eintragung der Ausgliederung in das Register des Sitzes desjenigen Rechtsträgers, dessen Gläubiger sie sind, nach § 19 Abs. 3 UmwG als bekanntgemacht gilt, ihren Anspruch nach Grund und Höhe schriftlich anmelden, Sicherheit zu leisten, soweit sie nicht Befriedigung verlangen können. Dieses Recht steht den Gläubigern jedoch nur zu, wenn sie glaubhaft machen, dass durch die Ausgliederung die Erfüllung ihrer Forderung gefährdet wird."
    },
    {
      "date": "2025-10-17",
      "id": "134333",
      "original_text": "Registerbekanntmachung nach dem Umwandlungsgesetz\nSchleswig-Holstein Amtsgericht Kiel HRB 18934\nNorderstedter Trocknungstechnik Verwaltungs GmbH – Norderstedt",
      "type": "Registerbekanntmachung nach dem Umwandlungsgesetz",
      "state": "Schleswig-Holstein",
      "amtsgericht": "Amtsgericht Kiel",
      "registernummer": "HRB 18934",
      "registerart": "HRB",
      "company_name": "Norderstedter Trocknungstechnik Verwaltungs GmbH",
      "company_seat": "Norderstedt",
      "details": "17.10.2025 (Bekanntmachungsdatum)\n\nSchleswig-Holstein Amtsgericht Kiel HRB 18934\nRegisterbekanntmachung nach dem Umwandlungsgesetz 16.10.2025 (Eintragungsdatum)\n\nNorderstedter Trocknungstechnik Verwaltungs GmbH\nGesellschaft mit beschränkter Haftung\nNorderstedt\n\nZu Eintragungsnummer 11 vom 16.10.2025 wird als nicht eingetragen veröffentlicht: Als nicht eingetragen wird veröffentlicht: Den Gläubigern der an der Verschmelzung beteiligten Rechtsträger ist, wenn sie binnen sechs Monaten nach dem Tag, an dem die Eintragung der Verschmelzung in das Register des Sitzes desjenigen Rechtsträgers, dessen Gläubiger sie sind, nach § 19 Abs. 3 UmwG bekannt gemacht worden ist, ihren Anspruch nach Grund und Höhe schriftlich anmelden, Sicherheit zu leisten, soweit sie nicht Befriedigung verlangen können. Dieses Recht steht den Gläubigern jedoch nur zu, wenn sie glaubhaft machen, dass durch die Verschmelzung die Erfüllung ihrer Forderung gefährdet wird."
    },
    {
      "date": "2025-10-17",
      "id": "134334",
      "original_text": "Registerbekanntmachung nach dem Umwandlungsgesetz\nSchleswig-Holstein Amtsgericht Kiel HRB 18934\nNorderstedter Trocknungstechnik Verwaltungs GmbH – Norderstedt",
      "type": "Registerbekanntmachung nach dem Umwandlungsgesetz",
      "state": "Schleswig-Holstein",
      "amtsgericht": "Amtsgericht Kiel",
      "registernummer": "HRB 18934",
      "registerart": "HRB",
      "company_name": "Norderstedter Trocknungstechnik Verwaltungs GmbH",
      "company_seat": "Norderstedt",
      "details": "17.10.2025 (Bekanntmachungsdatum)\n\nSchleswig-Holstein Amtsgericht Kiel HRB 18934\nRegisterbekanntmachung nach dem Umwandlungsgesetz 01.09.2025 (Eintragungsdatum)\n\nNorderstedter Trocknungstechnik Verwaltungs GmbH\nGesellschaft mit beschränkter Haftung\nNorderstedt\n\nHRB 18934 KIZu Eintragungsnummer 10 vom 01.09.2025 wird als nicht eingetragen veröffentlicht: Als nicht eingetragen wird veröffentlicht: Den Gläubigern der an der Verschmelzung beteiligten Rechtsträger ist, wenn sie binnen sechs Monaten nach dem Tag, an dem die Eintragung der Verschmelzung in das Register des Sitzes desjenigen Rechtsträgers, dessen Gläubiger sie sind, nach § 19 Abs. 3 UmwG bekannt gemacht worden ist, ihren Anspruch nach Grund und Höhe schriftlich anmelden, Sicherheit zu leisten, soweit sie nicht Befriedigung verlangen können. Dieses Recht steht den Gläubigern jedoch nur zu, wenn sie glaubhaft machen, dass durch die Verschmelzung die Erfüllung ihrer Forderung gefährdet wird."
    },
    {
      "date": "2025-10-17",
      "id": "134335",
      "original_text": "Registerbekanntmachung nach dem Umwandlungsgesetz\nBrandenburg Amtsgericht Frankfurt/Oder HRA 4554\nMichelle Pflug Meine Stoffpakete e.K. – Fredersdorf-Vogelsdorf",
      "type": "Registerbekanntmachung nach dem Umwandlungsgesetz",
      "state": "Brandenburg",
      "amtsgericht": "Amtsgericht Frankfurt/Oder",
      "registernummer": "HRA 4554",
      "registerart": "HRA",
      "company_name": "Michelle Pflug Meine Stoffpakete e.K.",
      "company_seat": "Fredersdorf-Vogelsdorf",
      "details": "17.10.2025 (Bekanntmachungsdatum)\n\nBrandenburg Amtsgericht Frankfurt/Oder HRA 4554\nRegisterbekanntmachung nach dem Umwandlungsgesetz 16.10.2025 (Eintragungsdatum)\n\nMichelle Pflug Meine Stoffpakete e.K.\nEinzelkaufmann / Einzelkauffrau\nFredersdorf-Vogelsdorf\n\nZu Eintragungsnummer 2 vom 16.10.2025 wird als nicht eingetragen veröffentlicht: Als nicht eingetragen wird veröffentlicht:\nDen Gläubigern der an der Umwandlung beteiligten Rechtsträger ist, wenn sie binnen sechs Monaten nach dem Tag, an dem die Eintragung der Umwandlung in das Register des Sitzes desjenigen Rechtsträgers, dessen Gläubiger sie sind, als bekannt gemacht gilt, ihren Anspruch nach Grund und Höhe schriftlich anmelden, Sicherheit zu leisten, soweit sie nicht Befriedigung verlangen können. Dieses Recht steht den Gläubigern jedoch nur zu, wenn sie glaubhaft machen, dass durch die Umwandlung die Erfüllung ihrer Forderung gefährdet wird"
    },
    {
      "date": "2025-10-17",
      "id": "134336",
      "original_text": "Registerbekanntmachung nach dem Umwandlungsgesetz\nBaden-Württemberg Amtsgericht Stuttgart HRB 800571\nSocial Sound gGmbH – Stuttgart",
      "type": "Registerbekanntmachung nach dem Umwandlungsgesetz",
      "state": "Baden-Württemberg",
      "amtsgericht": "Amtsgericht Stuttgart",
      "registernummer": "HRB 800571",
      "registerart": "HRB",
      "company_name": "Social Sound gGmbH",
      "company_seat": "Stuttgart",
      "details": "17.10.2025 (Bekanntmachungsdatum)\n\nBaden-Württemberg Amtsgericht Stuttgart HRB 800571\nRegisterbekanntmachung nach dem Umwandlungsgesetz 17.10.2025 (Eintragungsdatum)\n\nSocial Sound gGmbH\nGesellschaft mit beschränkter Haftung\nStuttgart\n\nAls nicht eingetragen wird bekanntgemacht:\nDen Gläubigern der an der Ausgliederung beteiligten Rechtsträger ist, wenn sie binnen sechs Monaten nach dem Tag, an dem die Eintragung der Ausgliederung in das Register des Sitzes desjenigen Rechtsträgers, dessen Gläubiger sie sind, nach § 19 Abs. 3 UmwG als bekanntgemacht gilt, ihren Anspruch nach Grund und Höhe schriftlich anmelden, Sicherheit zu leisten, soweit sie nicht Befriedigung verlangen können. Dieses Recht steht den Gläubigern jedoch nur zu, wenn sie glaubhaft machen, dass durch die Ausgliederung die Erfüllung ihrer Forderung gefährdet wird."
    },
    {
      "date": "2025-10-17",
      "id": "134337",
      "original_text": "Registerbekanntmachung nach dem Umwandlungsgesetz\nBerlin Amtsgericht Berlin (Charlottenburg) HRB 213493\nDI FRA1 GmbH – Berlin",
      "type": "Registerbekanntmachung nach dem Umwandlungsgesetz",
      "state": "Berlin",
      "amtsgericht": "Amtsgericht Berlin (Charlottenburg)",
      "registernummer": "HRB 213493",
      "registerart": "HRB",
      "company_name": "DI FRA1 GmbH",
      "company_seat": "Berlin",
      "details": "17.10.2025 (Bekanntmachungsdatum)\n\nBerlin Amtsgericht Berlin (Charlottenburg) HRB 213493\nRegisterbekanntmachung nach dem Umwandlungsgesetz 16.10.2025 (Eintragungsdatum)\n\nDI FRA1 GmbH\nGesellschaft mit beschränkter Haftung\nBerlin\n\nZu Eintragungsnummer 7 vom 16.10.2025 wird als nicht eingetragen veröffentlicht: Den Gläubigern der an der Verschmelzung beteiligten Rechtsträger ist, wenn sie binnen sechs Monaten nach dem Tag, an dem die Eintragung der Verschmelzung in das Register des Sitzes desjenigen Rechtsträgers, dessen Gläubiger sie sind, als bekannt gemacht gilt, ihren Anspruch nach Grund und Höhe schriftlich anmelden, Sicherheit zu leisten, soweit sie nicht Befriedigung verlangen können. Dieses Recht steht den Gläubigern jedoch nur zu, wenn sie glaubhaft machen, dass durch die Verschmelzung die Erfüllung ihrer Forderung gefährdet wird. Das Recht, Sicherheitsleistung zu verlangen, steht Gläubigern nicht zu, die im Falle der Insolvenz ein Recht auf vorzugsweise Befriedigung aus einer Deckungsmasse haben, die nach gesetzlicher Vorschrift zu ihrem Schutz errichtet und staatlich überwacht ist."
    },
    {
      "date": "2025-10-17",
      "id": "134338",
      "original_text": "Registerbekanntmachung nach dem Umwandlungsgesetz\nBerlin Amtsgericht Berlin (Charlottenburg) HRB 203973\nDI Holding 5 GmbH – Berlin",
      "type": "Registerbekanntmachung nach dem Umwandlungsgesetz",
      "state": "Berlin",
      "amtsgericht": "Amtsgericht Berlin (Charlottenburg)",
      "registernummer": "HRB 203973",
      "registerart": "HRB",
      "company_name": "DI Holding 5 GmbH",
      "company_seat": "Berlin",
      "details": "17.10.2025 (Bekanntmachungsdatum)\n\nBerlin Amtsgericht Berlin (Charlottenburg) HRB 203973\nRegisterbekanntmachung nach dem Umwandlungsgesetz 16.10.2025 (Eintragungsdatum)\n\nDI Holding 5 GmbH\nGesellschaft mit beschränkter Haftung\nBerlin\n\nZu Eintragungsnummer 4 vom 16.10.2025 wird als nicht eingetragen veröffentlicht: Den Gläubigern der an der Verschmelzung beteiligten Rechtsträger ist, wenn sie binnen sechs Monaten nach dem Tag, an dem die Eintragung der Verschmelzung in das Register des Sitzes desjenigen Rechtsträgers, dessen Gläubiger sie sind, als bekannt gemacht gilt, ihren Anspruch nach Grund und Höhe schriftlich anmelden, Sicherheit zu leisten, soweit sie nicht Befriedigung verlangen können. Dieses Recht steht den Gläubigern jedoch nur zu, wenn sie glaubhaft machen, dass durch die Verschmelzung die Erfüllung ihrer Forderung gefährdet wird. Das Recht, Sicherheitsleistung zu verlangen, steht Gläubigern nicht zu, die im Falle der Insolvenz ein Recht auf vorzugsweise Befriedigung aus einer Deckungsmasse haben, die nach gesetzlicher Vorschrift zu ihrem Schutz errichtet und staatlich überwacht ist."
    },
    {
      "date": "2025-10-17",
      "id": "134339",
      "original_text": "Löschungsankündigung\nThüringen Amtsgericht Jena HRB 509908\nS & R Service und Reinigung Unternehmergesellschaft (haftungsbeschränkt) – Vogtei",
      "type": "Löschungsankündigung",
      "state": "Thüringen",
      "amtsgericht": "Amtsgericht Jena",
      "registernummer": "HRB 509908",
      "registerart": "HRB",
      "company_name": "S & R Service und Reinigung Unternehmergesellschaft (haftungsbeschränkt)",
      "company_seat": "Vogtei",
      "details": "17.10.2025 (Bekanntmachungsdatum)\n\nThüringen Amtsgericht Jena HRB 509908\nLöschungsankündigung\n\nS & R Service und Reinigung Unternehmergesellschaft (haftungsbeschränkt)\nGesellschaft mit beschränkter Haftung\nVogtei\n\nDas Registergericht beabsichtigt, die im Handelsregister eingetragene Gesellschaft wegen Vermögenslosigkeit nach § 394 FamFG von Amts wegen zu löschen. Die Frist zur Erhebung eines Widerspruchs gegen die beabsichtigte Löschung wird auf 6 Wochen festgesetzt."
    },
    {
      "date": "2025-10-17",
      "id": "134340",
      "original_text": "Sonstige Registerbekanntmachung\nThüringen Amtsgericht Jena HRB 512513\nGVB Verkehrs- und Betriebsgesellschaft Gera mbH – Gera",
      "type": "Sonstige Registerbekanntmachung",
      "state": "Thüringen",
      "amtsgericht": "Amtsgericht Jena",
      "registernummer": "HRB 512513",
      "registerart": "HRB",
      "company_name": "GVB Verkehrs- und Betriebsgesellschaft Gera mbH",
      "company_seat": "Gera",
      "details": "17.10.2025 (Bekanntmachungsdatum)\n\nThüringen Amtsgericht Jena HRB 512513\nSonstige Registerbekanntmachung 17.10.2025 (Eintragungsdatum)\n\nGVB Verkehrs- und Betriebsgesellschaft Gera mbH\nGesellschaft mit beschränkter Haftung\nGera\n\nBekanntmachung gem. § 52 Abs. 3 Satz 2 GmbHG: Aufgrund einer Veränderung in den Personen der Aufsichtsratsmitglieder ist durch die Geschäftsführer eine neue Liste zum Handelsregister eingereicht worden."
    },
    {
      "date": "2025-10-17",
      "id": "134341",
      "original_text": "Einreichung neuer Dokumente\nThüringen Amtsgericht Jena HRB 504079\nMesse Erfurt GmbH – Erfurt",
      "type": "Einreichung neuer Dokumente",
      "state": "Thüringen",
      "amtsgericht": "Amtsgericht Jena",
      "registernummer": "HRB 504079",
      "registerart": "HRB",
      "company_name": "Messe Erfurt GmbH",
      "company_seat": "Erfurt",
      "details": "17.10.2025 (Bekanntmachungsdatum)\n\nThüringen Amtsgericht Jena HRB 504079\nEinreichung neuer Dokumente 01.09.2025 (Eintragungsdatum)\n\nMesse Erfurt GmbH\nGesellschaft mit beschränkter Haftung\nErfurt\n\nBekanntmachung gem. § 52 Abs. 3 Satz 2 GmbHG: Aufgrund einer Veränderung in den Personen der Aufsichtsratsmitglieder ist durch die Geschäftsführer eine neue Liste zum Handelsregister eingereicht worden."
    },
    {
      "date": "2025-10-17",
      "id": "134342",
      "original_text": "Löschungsankündigung\nBerlin Amtsgericht Berlin (Charlottenburg) HRB 134161\nrp Trading und Handels GmbH – Berlin",
      "type": "Löschungsankündigung",
      "state": "Berlin",
      "amtsgericht": "Amtsgericht Berlin (Charlottenburg)",
      "registernummer": "HRB 134161",
      "registerart": "HRB",
      "company_name": "rp Trading und Handels GmbH",
      "company_seat": "Berlin",
      "details": "17.10.2025 (Bekanntmachungsdatum)\n\nBerlin Amtsgericht Berlin (Charlottenburg) HRB 134161\nLöschungsankündigung\n\nrp Trading und Handels GmbH\nGesellschaft mit beschränkter Haftung\nBerlin\n\nBei der nachstehenden Gesellschaft wird das Amtslöschungsverfahren gemäß § 394 FamFG eingeleitet. Widerspruchsfrist: 6 Wochen."
    },
    {
      "date": "2025-10-17",
      "id": "134343",
      "original_text": "Registerbekanntmachung nach dem Umwandlungsgesetz\nMecklenburg-Vorpommern Amtsgericht Rostock HRB 16961\nGKA GmbH – Rostock",
      "type": "Registerbekanntmachung nach dem Umwandlungsgesetz",
      "state": "Mecklenburg-Vorpommern",
      "amtsgericht": "Amtsgericht Rostock",
      "registernummer": "HRB 16961",
      "registerart": "HRB",
      "company_name": "GKA GmbH",
      "company_seat": "Rostock",
      "details": "17.10.2025 (Bekanntmachungsdatum)\n\nMecklenburg-Vorpommern Amtsgericht Rostock HRB 16961\nRegisterbekanntmachung nach dem Umwandlungsgesetz 17.10.2025 (Eintragungsdatum)\n\nGKA GmbH\nGesellschaft mit beschränkter Haftung\nRostock\n\nAls nicht eingetragen wird veröffentlicht: Den Gläubigern der an der Ausgliederung beteiligten Rechtsträger ist, wenn sie binnen sechs Monaten nach dem Tag, an dem die Eintragung der Ausgliederung in das Register des Sitzes desjenigen Rechtsträgers, dessen Gläubiger sie sind, nach § 19 Abs. 3 UmwG als bekannt gemacht gilt,\nihren Anspruch nach Grund und Höhe in Textform anmelden, Sicherheit zu leisten, soweit sie nicht Befriedigung verlangen können. Dieses Recht steht den Gläubigern jedoch nur zu, wenn sie glaubhaft machen, dass durch die Ausgliederung die Erfüllung der Forderung gefährdet wird."
    },
    {
      "date": "2025-10-17",
      "id": "134344",
      "original_text": "Registerbekanntmachung nach dem Umwandlungsgesetz\nMecklenburg-Vorpommern Amtsgericht Rostock HRA 5577\nRT Gastro e.K. – Rostock",
      "type": "Registerbekanntmachung nach dem Umwandlungsgesetz",
      "state": "Mecklenburg-Vorpommern",
      "amtsgericht": "Amtsgericht Rostock",
      "registernummer": "HRA 5577",
      "registerart": "HRA",
      "company_name": "RT Gastro e.K.",
      "company_seat": "Rostock",
      "details": "17.10.2025 (Bekanntmachungsdatum)\n\nMecklenburg-Vorpommern Amtsgericht Rostock HRA 5577\nRegisterbekanntmachung nach dem Umwandlungsgesetz 17.10.2025 (Eintragungsdatum)\n\nRT Gastro e.K.\nEinzelkaufmann / Einzelkauffrau\nRostock\n\nAls nicht eingetragen wird veröffentlicht: Den Gläubigern der an der Ausgliederung beteiligten Rechtsträger ist, wenn sie binnen sechs Monaten nach dem Tag, an dem die Eintragung der Ausgliederung in das Register des Sitzes desjenigen Rechtsträgers, dessen Gläubiger sie sind, nach § 19 Abs. 3 UmwG als bekannt gemacht gilt,\nihren Anspruch nach Grund und Höhe in Textform anmelden, Sicherheit zu leisten, soweit sie nicht Befriedigung verlangen können. Dieses Recht steht den Gläubigern jedoch nur zu, wenn sie glaubhaft machen, dass durch die Ausgliederung die Erfüllung der Forderung gefährdet wird."
    },
    {
      "date": "2025-10-17",
      "id": "134345",
      "original_text": "Sonstige Registerbekanntmachung\nBerlin Amtsgericht Berlin (Charlottenburg) HRB 168282\nRDB reliability & diligence Berlin GmbH – Berlin",
      "type": "Sonstige Registerbekanntmachung",
      "state": "Berlin",
      "amtsgericht": "Amtsgericht Berlin (Charlottenburg)",
      "registernummer": "HRB 168282",
      "registerart": "HRB",
      "company_name": "RDB reliability & diligence Berlin GmbH",
      "company_seat": "Berlin",
      "details": "17.10.2025 (Bekanntmachungsdatum)\n\nBerlin Amtsgericht Berlin (Charlottenburg) HRB 168282\nSonstige Registerbekanntmachung\n\nRDB reliability & diligence Berlin GmbH\nGesellschaft mit beschränkter Haftung\nBerlin\n\nAls nicht eingetragen wird veröffentlicht:\nIn dem unternehmensrechtlichen Verfahren der\nRDB reliability & diligence Berlin GmbH, mit Sitz in Berlin (Amtsgericht Charlottenburg, HRB 168282 B)\nliegt dem Registergericht aktuell ein Antrag der Generalstaatsanwaltschaft Hamm vom 28.04.2025 dahingehend vor, dass Herr Betriebswirt Ulrich Zerrath, Recklinghausen, zum Nachtragsliquidator für die am 28.09.2021 gelöschte Gesellschaft bestellt werden solle. Der Wirkungskreis solle dabei wie folgt gefasst werden:\nWahrnehmung der Rechte und Pflichten der gelöschten Gesellschaft hinsichtlich der Beteiligung an dem durch die Generalstaatsanwaltschaft Hamm zum Aktenzeichen 7 Js 2/20 geführten selbständigen Einziehungsverfahren und dabei insbesondere auch die Abgabe und Entgegennahme sämtlicher Erklärungen im Verfahren zu 2 HL 1156/18 F des Amtsgerichts Frankfurt am Main.\nDas Registergericht beabsichtigt zum jetzigen Zeitpunkt, diesem Antrag zu entsprechen, soweit nicht binnen einer Frist von einem Monat ab Veröffentlichung ein begründeter Widerspruch dagegen erhoben wird.\nEin Widerspruch ist entsprechend schriftlich oder elektronisch bei dem Amtsgericht Charlottenburg, DG Hardenbergstraße 31, 10623 Berlin, zum o. g. Aktenzeichen einzureichen. Der Widerspruch ist zu begründen, da eine Berücksichtigung im Verfahren andernfalls nicht erfolgen kann."
    },
    {
      "date": "2025-10-17",
      "id": "134346",
      "original_text": "Löschungsankündigung\nBrandenburg Amtsgericht Potsdam HRB 39423\nGLANEL UG (haftungsbeschränkt) – Potsdam",
      "type": "Löschungsankündigung",
      "state": "Brandenburg",
      "amtsgericht": "Amtsgericht Potsdam",
      "registernummer": "HRB 39423",
      "registerart": "HRB",
      "company_name": "GLANEL UG (haftungsbeschränkt)",
      "company_seat": "Potsdam",
      "details": "17.10.2025 (Bekanntmachungsdatum)\n\nBrandenburg Amtsgericht Potsdam HRB 39423\nLöschungsankündigung\n\nGLANEL UG (haftungsbeschränkt)\nGesellschaft mit beschränkter Haftung\nPotsdam\n\nBei der nachstehenden Gesellschaft wird das Amtslöschungsverfahren gemäß § 394 FamFG eingeleitet. Widerspruchsfrist: 8 Wochen."
    },
    {
      "date": "2025-10-17",
      "id": "134347",
      "original_text": "Registerbekanntmachung nach dem Umwandlungsgesetz\nBaden-Württemberg Amtsgericht Stuttgart HRA 300332\nWilli Weller – Bietigheim-Bissingen",
      "type": "Registerbekanntmachung nach dem Umwandlungsgesetz",
      "state": "Baden-Württemberg",
      "amtsgericht": "Amtsgericht Stuttgart",
      "registernummer": "HRA 300332",
      "registerart": "HRA",
      "company_name": "Willi Weller",
      "company_seat": "Bietigheim-Bissingen",
      "details": "17.10.2025 (Bekanntmachungsdatum)\n\nBaden-Württemberg Amtsgericht Stuttgart HRA 300332\nRegisterbekanntmachung nach dem Umwandlungsgesetz 17.10.2025 (Eintragungsdatum)\n\nWilli Weller\nEinzelkaufmann / Einzelkauffrau\nBietigheim-Bissingen\n\nAls nicht eingetragen wird bekanntgemacht:\nDen Gläubigern der an der Ausgliederung beteiligten Rechtsträger ist, wenn sie binnen sechs Monaten nach dem Tag, an dem die Eintragung der Ausgliederung in das Register des Sitzes desjenigen Rechtsträgers, dessen Gläubiger sie sind, nach § 19 Abs. 3 UmwG als bekanntgemacht gilt, ihren Anspruch nach Grund und Höhe schriftlich anmelden, Sicherheit zu leisten, soweit sie nicht Befriedigung verlangen können. Dieses Recht steht den Gläubigern jedoch nur zu, wenn sie glaubhaft machen, dass durch die Ausgliederung die Erfüllung ihrer Forderung gefährdet wird."
    },
    {
      "date": "2025-10-17",
      "id": "134348",
      "original_text": "Einreichung neuer Dokumente\nBaden-Württemberg Amtsgericht Ulm HRB 720485\nALB FILS KLINIKUM GmbH – Göppingen",
      "type": "Einreichung neuer Dokumente",
      "state": "Baden-Württemberg",
      "amtsgericht": "Amtsgericht Ulm",
      "registernummer": "HRB 720485",
      "registerart": "HRB",
      "company_name": "ALB FILS KLINIKUM GmbH",
      "company_seat": "Göppingen",
      "details": "17.10.2025 (Bekanntmachungsdatum)\n\nBaden-Württemberg Amtsgericht Ulm HRB 720485\nEinreichung neuer Dokumente\n\nALB FILS KLINIKUM GmbH\nGesellschaft mit beschränkter Haftung\nGöppingen\n\nDie Gesellschaft hat am 16.10.2025 die Liste über die Zusammensetzung des Aufsichtsrats zum Handelsregister eingereicht."
    },
    {
      "date": "2025-10-17",
      "id": "134349",
      "original_text": "Registerbekanntmachung nach dem Umwandlungsgesetz\nBerlin Amtsgericht Berlin (Charlottenburg) HRB 45399\nHGV Haagen Grundstücksgesellschaft mbH – Berlin",
      "type": "Registerbekanntmachung nach dem Umwandlungsgesetz",
      "state": "Berlin",
      "amtsgericht": "Amtsgericht Berlin (Charlottenburg)",
      "registernummer": "HRB 45399",
      "registerart": "HRB",
      "company_name": "HGV Haagen Grundstücksgesellschaft mbH",
      "company_seat": "Berlin",
      "details": "17.10.2025 (Bekanntmachungsdatum)\n\nBerlin Amtsgericht Berlin (Charlottenburg) HRB 45399\nRegisterbekanntmachung nach dem Umwandlungsgesetz 16.10.2025 (Eintragungsdatum)\n\nHGV Haagen Grundstücksgesellschaft  mbH\nGesellschaft mit beschränkter Haftung\nBerlin\n\nZu Eintragungsnummer 8 vom 16.10.2025 wird als nicht eingetragen veröffentlicht: Den Gläubigern der an der Verschmelzung beteiligten Rechtsträger ist, wenn sie binnen sechs Monaten nach dem Tag, an dem die Eintragung der Verschmelzung in das Register des Sitzes desjenigen Rechtsträgers, dessen Gläubiger sie sind, als bekannt gemacht gilt, ihren Anspruch nach Grund und Höhe schriftlich anmelden, Sicherheit zu leisten, soweit sie nicht Befriedigung verlangen können. Dieses Recht steht den Gläubigern jedoch nur zu, wenn sie glaubhaft machen, dass durch die Verschmelzung die Erfüllung ihrer Forderung gefährdet wird. Das Recht, Sicherheitsleistung zu verlangen, steht Gläubigern nicht zu, die im Falle der Insolvenz ein Recht auf vorzugsweise Befriedigung aus einer Deckungsmasse haben, die nach gesetzlicher Vorschrift zu ihrem Schutz errichtet und staatlich überwacht ist."
    },
    {
      "date": "2025-10-17",
      "id": "134350",
      "original_text": "Löschungsankündigung\nBerlin Amtsgericht Berlin (Charlottenburg) HRB 252986\nZENTURI GmbH – Berlin",
      "type": "Löschungsankündigung",
      "state": "Berlin",
      "amtsgericht": "Amtsgericht Berlin (Charlottenburg)",
      "registernummer": "HRB 252986",
      "registerart": "HRB",
      "company_name": "ZENTURI GmbH",
      "company_seat": "Berlin",
      "details": "17.10.2025 (Bekanntmachungsdatum)\n\nBerlin Amtsgericht Berlin (Charlottenburg) HRB 252986\nLöschungsankündigung\n\nZENTURI GmbH\nGesellschaft mit beschränkter Haftung\nBerlin\n\nBei der nachstehenden Gesellschaft wird das Amtslöschungsverfahren gemäß § 394 FamFG eingeleitet. Widerspruchsfrist 6 Wochen"
    },
    {
      "date": "2025-10-17",
      "id": "134351",
      "original_text": "Registerbekanntmachung nach dem Umwandlungsgesetz\nHamburg Amtsgericht Hamburg HRB 110035\nHermes Europe GmbH – Hamburg",
      "type": "Registerbekanntmachung nach dem Umwandlungsgesetz",
      "state": "Hamburg",
      "amtsgericht": "Amtsgericht Hamburg",
      "registernummer": "HRB 110035",
      "registerart": "HRB",
      "company_name": "Hermes Europe GmbH",
      "company_seat": "Hamburg",
      "details": "17.10.2025 (Bekanntmachungsdatum)\n\nHamburg Amtsgericht Hamburg HRB 110035\nRegisterbekanntmachung nach dem Umwandlungsgesetz 17.10.2025 (Eintragungsdatum)\n\nHermes Europe GmbH\nGesellschaft mit beschränkter Haftung\nHamburg\n\nAls nicht eingetragen wird bekannt gemacht:\nDen Gläubigern der an der Verschmelzung beteiligten Gesellschaften ist, wenn sie binnen sechs Monaten nach dem Tag, an dem die Eintragung der Verschmelzung in das Register des Sitzes desjenigen Rechtsträgers, dessen Gläubiger sie sind, nach § 19 Absatz 3 UmwG als bekannt gemacht gilt, ihren Anspruch nach Grund und Höhe schriftlich anmelden, Sicherheit zu leisten, soweit sie nicht Befriedigung verlangen können. Dieses Recht steht den Gläubigern jedoch nur zu, wenn sie glaubhaft machen, dass durch die Verschmelzung die Erfüllung ihrer Forderung gefährdet wird."
    },
    {
      "date": "2025-10-17",
      "id": "134352",
      "original_text": "Registerbekanntmachung nach dem Umwandlungsgesetz\nHamburg Amtsgericht Hamburg HRB 156923\nHermes UK Beteiligungs- und Verwaltungsgesellschaft mbH – Hamburg",
      "type": "Registerbekanntmachung nach dem Umwandlungsgesetz",
      "state": "Hamburg",
      "amtsgericht": "Amtsgericht Hamburg",
      "registernummer": "HRB 156923",
      "registerart": "HRB",
      "company_name": "Hermes UK Beteiligungs- und Verwaltungsgesellschaft mbH",
      "company_seat": "Hamburg",
      "details": "17.10.2025 (Bekanntmachungsdatum)\n\nHamburg Amtsgericht Hamburg HRB 156923\nRegisterbekanntmachung nach dem Umwandlungsgesetz 17.10.2025 (Eintragungsdatum)\n\nHermes UK Beteiligungs- und Verwaltungsgesellschaft mbH\nGesellschaft mit beschränkter Haftung\nHamburg\n\nAls nicht eingetragen wird bekannt gemacht:\nDen Gläubigern der an der Verschmelzung beteiligten Gesellschaften ist, wenn sie binnen sechs Monaten nach dem Tag, an dem die Eintragung der Verschmelzung in das Register des Sitzes desjenigen Rechtsträgers, dessen Gläubiger sie sind, nach § 19 Absatz 3 UmwG als bekannt gemacht gilt, ihren Anspruch nach Grund und Höhe schriftlich anmelden, Sicherheit zu leisten, soweit sie nicht Befriedigung verlangen können. Dieses Recht steht den Gläubigern jedoch nur zu, wenn sie glaubhaft machen, dass durch die Verschmelzung die Erfüllung ihrer Forderung gefährdet wird."
    },
    {
      "date": "2025-10-17",
      "id": "134353",
      "original_text": "Registerbekanntmachung nach dem Umwandlungsgesetz\nBaden-Württemberg Amtsgericht Mannheim HRB 740532\nBREMER Süd GmbH – Karlsruhe",
      "type": "Registerbekanntmachung nach dem Umwandlungsgesetz",
      "state": "Baden-Württemberg",
      "amtsgericht": "Amtsgericht Mannheim",
      "registernummer": "HRB 740532",
      "registerart": "HRB",
      "company_name": "BREMER Süd GmbH",
      "company_seat": "Karlsruhe",
      "details": "17.10.2025 (Bekanntmachungsdatum)\n\nBaden-Württemberg Amtsgericht Mannheim HRB 740532\nRegisterbekanntmachung nach dem Umwandlungsgesetz 17.10.2025 (Eintragungsdatum)\n\nBREMER Süd GmbH\nGesellschaft mit beschränkter Haftung\nKarlsruhe\n\nAls nicht eingetragen wird bekanntgemacht:\nDen Gläubigern der an der Verschmelzung beteiligten Rechtsträger ist, wenn sie binnen sechs Monaten nach dem Tag, an dem die Eintragung der Verschmelzung in das Register des Sitzes desjenigen Rechtsträgers, dessen Gläubiger sie sind, nach § 19 Abs. 3 UmwG als bekanntgemacht gilt, ihren Anspruch nach Grund und Höhe schriftlich anmelden, Sicherheit zu leisten, soweit sie nicht Befriedigung verlangen können. Dieses Recht steht den Gläubigern jedoch nur zu, wenn sie glaubhaft machen, dass durch die Verschmelzung die Erfüllung ihrer Forderung gefährdet wird."
    },
    {
      "date": "2025-10-17",
      "id": "134354",
      "original_text": "Registerbekanntmachung nach dem Umwandlungsgesetz\nHamburg Amtsgericht Hamburg HRB 175581\nNO6 BOSTRA GmbH – Hamburg",
      "type": "Registerbekanntmachung nach dem Umwandlungsgesetz",
      "state": "Hamburg",
      "amtsgericht": "Amtsgericht Hamburg",
      "registernummer": "HRB 175581",
      "registerart": "HRB",
      "company_name": "NO6 BOSTRA GmbH",
      "company_seat": "Hamburg",
      "details": "17.10.2025 (Bekanntmachungsdatum)\n\nHamburg Amtsgericht Hamburg HRB 175581\nRegisterbekanntmachung nach dem Umwandlungsgesetz 17.10.2025 (Eintragungsdatum)\n\nNO6 BOSTRA GmbH\nGesellschaft mit beschränkter Haftung\nHamburg\n\nAls nicht eingetragen wird bekannt gemacht:\nDen Gläubigern der an der Verschmelzung beteiligten Gesellschaften ist, wenn sie binnen sechs Monaten nach dem Tag, an dem die Eintragung der Verschmelzung in das Register des Sitzes desjenigen Rechtsträgers, dessen Gläubiger sie sind, nach § 19 Absatz 3 UmwG als bekannt gemacht gilt, ihren Anspruch nach Grund und Höhe schriftlich anmelden, Sicherheit zu leisten, soweit sie nicht Befriedigung verlangen können. Dieses Recht steht den Gläubigern jedoch nur zu, wenn sie glaubhaft machen, dass durch die Verschmelzung die Erfüllung ihrer Forderung gefährdet wird."
    },
    {
      "date": "2025-10-17",
      "id": "134355",
      "original_text": "Registerbekanntmachung nach dem Umwandlungsgesetz\nHamburg Amtsgericht Hamburg HRB 176146\nNO1 Kaleido Fonds GmbH – Hamburg",
      "type": "Registerbekanntmachung nach dem Umwandlungsgesetz",
      "state": "Hamburg",
      "amtsgericht": "Amtsgericht Hamburg",
      "registernummer": "HRB 176146",
      "registerart": "HRB",
      "company_name": "NO1 Kaleido Fonds GmbH",
      "company_seat": "Hamburg",
      "details": "17.10.2025 (Bekanntmachungsdatum)\n\nHamburg Amtsgericht Hamburg HRB 176146\nRegisterbekanntmachung nach dem Umwandlungsgesetz 17.10.2025 (Eintragungsdatum)\n\nNO1 Kaleido Fonds GmbH\nGesellschaft mit beschränkter Haftung\nHamburg\n\nAls nicht eingetragen wird bekannt gemacht:\nDen Gläubigern der an der Verschmelzung beteiligten Gesellschaften ist, wenn sie binnen sechs Monaten nach dem Tag, an dem die Eintragung der Verschmelzung in das Register des Sitzes desjenigen Rechtsträgers, dessen Gläubiger sie sind, nach § 19 Absatz 3 UmwG als bekannt gemacht gilt, ihren Anspruch nach Grund und Höhe schriftlich anmelden, Sicherheit zu leisten, soweit sie nicht Befriedigung verlangen können. Dieses Recht steht den Gläubigern jedoch nur zu, wenn sie glaubhaft machen, dass durch die Verschmelzung die Erfüllung ihrer Forderung gefährdet wird."
    },
    {
      "date": "2025-10-17",
      "id": "134356",
      "original_text": "Registerbekanntmachung nach dem Umwandlungsgesetz\nHamburg Amtsgericht Hamburg HRB 194919\nSA Studio GmbH – Hamburg",
      "type": "Registerbekanntmachung nach dem Umwandlungsgesetz",
      "state": "Hamburg",
      "amtsgericht": "Amtsgericht Hamburg",
      "registernummer": "HRB 194919",
      "registerart": "HRB",
      "company_name": "SA Studio GmbH",
      "company_seat": "Hamburg",
      "details": "17.10.2025 (Bekanntmachungsdatum)\n\nHamburg Amtsgericht Hamburg HRB 194919\nRegisterbekanntmachung nach dem Umwandlungsgesetz 17.10.2025 (Eintragungsdatum)\n\nSA Studio GmbH\nGesellschaft mit beschränkter Haftung\nHamburg\n\nAls nicht eingetragen wird bekannt gemacht:\nDen Gläubigern der an der Ausgliederung beteiligten Gesellschaften ist, wenn sie binnen sechs Monaten nach dem Tag, an dem die Eintragung der Ausgliederung in das Register des Sitzes desjenigen Rechtsträgers, dessen Gläubiger sie sind, nach § 19 Absatz 3 UmwG als bekannt gemacht gilt, ihren Anspruch nach Grund und Höhe schriftlich anmelden, Sicherheit zu leisten, soweit sie nicht Befriedigung verlangen können. Dieses Recht steht den Gläubigern jedoch nur zu, wenn sie glaubhaft machen, dass durch die Ausgliederung die Erfüllung ihrer Forderung gefährdet wird."
    },
    {
      "date": "2025-10-17",
      "id": "134357",
      "original_text": "Registerbekanntmachung nach dem Umwandlungsgesetz\nHamburg Amtsgericht Hamburg HRA 132686\nSA Studio e.K. – Hamburg",
      "type": "Registerbekanntmachung nach dem Umwandlungsgesetz",
      "state": "Hamburg",
      "amtsgericht": "Amtsgericht Hamburg",
      "registernummer": "HRA 132686",
      "registerart": "HRA",
      "company_name": "SA Studio e.K.",
      "company_seat": "Hamburg",
      "details": "17.10.2025 (Bekanntmachungsdatum)\n\nHamburg Amtsgericht Hamburg HRA 132686\nRegisterbekanntmachung nach dem Umwandlungsgesetz 17.10.2025 (Eintragungsdatum)\n\nSA Studio e.K.\nEinzelkaufmann\nHamburg\n\nAls nicht eingetragen wird bekannt gemacht:\nDen Gläubigern der an der Ausgliederung beteiligten Gesellschaften ist, wenn sie binnen sechs Monaten nach dem Tag, an dem die Eintragung der Ausgliederung in das Register des Sitzes desjenigen Rechtsträgers, dessen Gläubiger sie sind, nach § 19 Absatz 3 UmwG als bekannt gemacht gilt, ihren Anspruch nach Grund und Höhe schriftlich anmelden, Sicherheit zu leisten, soweit sie nicht Befriedigung verlangen können. Dieses Recht steht den Gläubigern jedoch nur zu, wenn sie glaubhaft machen, dass durch die Ausgliederung die Erfüllung ihrer Forderung gefährdet wird."
    },
    {
      "date": "2025-10-17",
      "id": "134358",
      "original_text": "Sonstige Registerbekanntmachung\nSchleswig-Holstein Amtsgericht Lübeck HRB 24726\nEAWD Energy and Water Development Deutschland GmbH – Bargteheide",
      "type": "Sonstige Registerbekanntmachung",
      "state": "Schleswig-Holstein",
      "amtsgericht": "Amtsgericht Lübeck",
      "registernummer": "HRB 24726",
      "registerart": "HRB",
      "company_name": "EAWD Energy and Water Development Deutschland GmbH",
      "company_seat": "Bargteheide",
      "details": "17.10.2025 (Bekanntmachungsdatum)\n\nSchleswig-Holstein Amtsgericht Lübeck HRB 24726\nSonstige Registerbekanntmachung\n\nEAWD Energy and Water Development Deutschland GmbH\nGesellschaft mit beschränkter Haftung\nBargteheide\n\nAls nicht eingetragen wird veröffentlicht:\n\nHerrn\nRalph Mas Hofmeier, als Geschäftsführer\nFrau Irma Velazque Diaz, als Geschäftsführerin,\nbeide unbekannten Aufenthalts:\n\nSehr geehrte Frau Velazquez Diaz, sehr geehrter Herr Hofmeier,\n\nin der Handelsregistersache der\n\nEAWD Energy and Water Development Deutschland GmbH\n\nergeben sich aus den mir vorliegenden Unterlagen Anhaltspunkte dafür, dass die Gesellschaft, als deren Geschäftsführer Sie noch eingetragen sind, vermögenslos ist:\n\nBeschluss des Amtsgerichts Reinbek vom 15.09.2025 über die Abweisung des Insolvenzverfahrens mangels Masse.\n\nIch beabsichtige daher, die Gesellschaft wegen Vermögenslosigkeit gemäß § 394 FamFG zu löschen.\n\nIch bestimme eine Frist von einem Monat zur Geltendmachung eines Widerspruchs gegen die Löschung, § 394 Abs. 2 S. 1 FamFG.\n\nWeiter bitte ich Sie, mir binnen derselben Frist mitzuteilen, ob die genannte Gesellschaft noch Vermögen hat, ggf. welche Vermögensgegenstände sie besitzt, ob die Gesellschaft noch Partei eines noch nicht rechtskräftig abgeschlossenen Rechtsstreits ist oder ob sonst noch eine Abwicklung stattfindet.\n\nNach Fristablauf ohne Widerspruch von Ihnen oder anderer Seite wird die Gesellschaft gelöscht.\n\nOstermann\nDipl.-Rechtspflegerin (FH)"
    },
    {
      "date": "2025-10-17",
      "id": "134359",
      "original_text": "Löschungsankündigung\nSchleswig-Holstein Amtsgericht Lübeck HRB 24726\nEAWD Energy and Water Development Deutschland GmbH – Bargteheide",
      "type": "Löschungsankündigung",
      "state": "Schleswig-Holstein",
      "amtsgericht": "Amtsgericht Lübeck",
      "registernummer": "HRB 24726",
      "registerart": "HRB",
      "company_name": "EAWD Energy and Water Development Deutschland GmbH",
      "company_seat": "Bargteheide",
      "details": "17.10.2025 (Bekanntmachungsdatum)\n\nSchleswig-Holstein Amtsgericht Lübeck HRB 24726\nLöschungsankündigung\n\nEAWD Energy and Water Development Deutschland GmbH\nGesellschaft mit beschränkter Haftung\nBargteheide\n\nEs ist die Löschung der nachstehenden Gesellschaft wegen Vermögenslosigkeit gemäß § 394 FamFG beabsichtigt."
    },
    {
      "date": "2025-10-17",
      "id": "134360",
      "original_text": "Registerbekanntmachung nach dem Umwandlungsgesetz\nSaarland Amtsgericht Saarbrücken HRB 109514\nHundeverhaltenstherapie Hesler UG (haftungsbeschränkt) – Riegelsberg",
      "type": "Registerbekanntmachung nach dem Umwandlungsgesetz",
      "state": "Saarland",
      "amtsgericht": "Amtsgericht Saarbrücken",
      "registernummer": "HRB 109514",
      "registerart": "HRB",
      "company_name": "Hundeverhaltenstherapie Hesler UG (haftungsbeschränkt)",
      "company_seat": "Riegelsberg",
      "details": "17.10.2025 (Bekanntmachungsdatum)\n\nSaarland Amtsgericht Saarbrücken HRB 109514\nRegisterbekanntmachung nach dem Umwandlungsgesetz 17.10.2025 (Eintragungsdatum)\n\nHundeverhaltenstherapie Hesler UG (haftungsbeschränkt)\nGesellschaft mit beschränkter Haftung\nRiegelsberg\n\nAls nicht eingetragen wird bekannt gemacht: Den Gläubigern der an der Verschmelzung beteiligten Gesellschaften ist, wenn sie binnen sechs Monaten nach dem Tag, an dem die Eintragung der Verschmelzung in das Register des Sitzes desjenigen Rechtsträgers, dessen Gläubiger sie sind, nach § 19 Absatz 3 UmwG bekannt gemacht worden ist, ihren Anspruch nach Grund und Höhe schriftlich anmelden, Sicherheit zu leisten, soweit sie nicht Befriedigung verlangen können. Dieses Recht steht den Gläubigern jedoch nur zu, wenn sie glaubhaft machen, dass durch die Verschmelzung die Erfüllung ihrer Forderung gefährdet wird."
    },
    {
      "date": "2025-10-17",
      "id": "134361",
      "original_text": "Registerbekanntmachung nach dem Umwandlungsgesetz\nSaarland Amtsgericht Saarbrücken HRB 109136\nBAUMAGREEN GmbH – Schwalbach",
      "type": "Registerbekanntmachung nach dem Umwandlungsgesetz",
      "state": "Saarland",
      "amtsgericht": "Amtsgericht Saarbrücken",
      "registernummer": "HRB 109136",
      "registerart": "HRB",
      "company_name": "BAUMAGREEN GmbH",
      "company_seat": "Schwalbach",
      "details": "17.10.2025 (Bekanntmachungsdatum)\n\nSaarland Amtsgericht Saarbrücken HRB 109136\nRegisterbekanntmachung nach dem Umwandlungsgesetz 17.10.2025 (Eintragungsdatum)\n\nBAUMAGREEN GmbH\nGesellschaft mit beschränkter Haftung\nSchwalbach\n\nAls nicht eingetragen wird bekannt gemacht: Den Gläubigern der an der Verschmelzung beteiligten Gesellschaften ist, wenn sie binnen sechs Monaten nach dem Tag, an dem die Eintragung der Verschmelzung in das Register des Sitzes desjenigen Rechtsträgers, dessen Gläubiger sie sind, nach § 19 Absatz 3 UmwG bekannt gemacht worden ist, ihren Anspruch nach Grund und Höhe schriftlich anmelden, Sicherheit zu leisten, soweit sie nicht Befriedigung verlangen können. Dieses Recht steht den Gläubigern jedoch nur zu, wenn sie glaubhaft machen, dass durch die Verschmelzung die Erfüllung ihrer Forderung gefährdet wird."
    },
    {
      "date": "2025-10-17",
      "id": "134362",
      "original_text": "Löschungsankündigung\nSchleswig-Holstein Amtsgericht Lübeck HRB 22363\nFensterspot 24 GmbH – Reinfeld",
      "type": "Löschungsankündigung",
      "state": "Schleswig-Holstein",
      "amtsgericht": "Amtsgericht Lübeck",
      "registernummer": "HRB 22363",
      "registerart": "HRB",
      "company_name": "Fensterspot 24 GmbH",
      "company_seat": "Reinfeld",
      "details": "17.10.2025 (Bekanntmachungsdatum)\n\nSchleswig-Holstein Amtsgericht Lübeck HRB 22363\nLöschungsankündigung\n\nFensterspot 24 GmbH\nGesellschaft mit beschränkter Haftung\nReinfeld\n\nEs ist die Löschung der nachstehenden Gesellschaft wegen Vermögenslosigkeit gemäß § 394 FamFG beabsichtigt."
    },
    {
      "date": "2025-10-17",
      "id": "134363",
      "original_text": "Registerbekanntmachung nach dem Umwandlungsgesetz\nBaden-Württemberg Amtsgericht Stuttgart HRB 802158\nDeutsche Real Estate Invest GmbH – Stuttgart",
      "type": "Registerbekanntmachung nach dem Umwandlungsgesetz",
      "state": "Baden-Württemberg",
      "amtsgericht": "Amtsgericht Stuttgart",
      "registernummer": "HRB 802158",
      "registerart": "HRB",
      "company_name": "Deutsche Real Estate Invest GmbH",
      "company_seat": "Stuttgart",
      "details": "17.10.2025 (Bekanntmachungsdatum)\n\nBaden-Württemberg Amtsgericht Stuttgart HRB 802158\nRegisterbekanntmachung nach dem Umwandlungsgesetz 17.10.2025 (Eintragungsdatum)\n\nDeutsche Real Estate Invest GmbH\nGesellschaft mit beschränkter Haftung\nStuttgart\n\nAls nicht eingetragen wird bekanntgemacht:\nDen Gläubigern des an dem Formwechsel beteiligten Rechtsträgers ist, wenn sie binnen sechs Monaten nach dem Tag, an dem die Eintragung des Formwechsels in das Register des Sitzes desjenigen Rechtsträgers, dessen Gläubiger sie sind, nach § 19 Abs. 3 UmwG als bekanntgemacht gilt, ihren Anspruch nach Grund und Höhe schriftlich anmelden, Sicherheit zu leisten, soweit sie nicht Befriedigung verlangen können. Dieses Recht steht den Gläubigern jedoch nur zu, wenn sie glaubhaft machen, dass durch den Formwechsel die Erfüllung ihrer Forderung gefährdet wird."
    },
    {
      "date": "2025-10-17",
      "id": "134364",
      "original_text": "Registerbekanntmachung nach dem Umwandlungsgesetz\nBaden-Württemberg Amtsgericht Stuttgart HRB 792660\nDeutsche Real Estate Invest AG – Stuttgart",
      "type": "Registerbekanntmachung nach dem Umwandlungsgesetz",
      "state": "Baden-Württemberg",
      "amtsgericht": "Amtsgericht Stuttgart",
      "registernummer": "HRB 792660",
      "registerart": "HRB",
      "company_name": "Deutsche Real Estate Invest AG",
      "company_seat": "Stuttgart",
      "details": "17.10.2025 (Bekanntmachungsdatum)\n\nBaden-Württemberg Amtsgericht Stuttgart HRB 792660\nRegisterbekanntmachung nach dem Umwandlungsgesetz 17.10.2025 (Eintragungsdatum)\n\nDeutsche Real Estate Invest AG\nAktiengesellschaft\nStuttgart\n\nAls nicht eingetragen wird bekanntgemacht:\nDen Gläubigern des an dem Formwechsel beteiligten Rechtsträgers ist, wenn sie binnen sechs Monaten nach dem Tag, an dem die Eintragung des Formwechsels in das Register des Sitzes desjenigen Rechtsträgers, dessen Gläubiger sie sind, nach § 19 Abs. 3 UmwG als bekanntgemacht gilt, ihren Anspruch nach Grund und Höhe schriftlich anmelden, Sicherheit zu leisten, soweit sie nicht Befriedigung verlangen können. Dieses Recht steht den Gläubigern jedoch nur zu, wenn sie glaubhaft machen, dass durch den Formwechsel die Erfüllung ihrer Forderung gefährdet wird."
    },
    {
      "date": "2025-10-17",
      "id": "134365",
      "original_text": "Registerbekanntmachung nach dem Umwandlungsgesetz\nBerlin Amtsgericht Berlin (Charlottenburg) HRB 5255\nBauland Hausverwaltung GmbH – Berlin",
      "type": "Registerbekanntmachung nach dem Umwandlungsgesetz",
      "state": "Berlin",
      "amtsgericht": "Amtsgericht Berlin (Charlottenburg)",
      "registernummer": "HRB 5255",
      "registerart": "HRB",
      "company_name": "Bauland Hausverwaltung GmbH",
      "company_seat": "Berlin",
      "details": "17.10.2025 (Bekanntmachungsdatum)\n\nBerlin Amtsgericht Berlin (Charlottenburg) HRB 5255\nRegisterbekanntmachung nach dem Umwandlungsgesetz 15.10.2025 (Eintragungsdatum)\n\nBauland Hausverwaltung GmbH\nGesellschaft mit beschränkter Haftung\nBerlin\n\nZu Eintragungsnummer 10 vom 15.10.2025 wird als nicht eingetragen veröffentlicht: Den Gläubigern der an der Verschmelzung beteiligten Rechtsträger ist, wenn sie binnen sechs Monaten nach dem Tag, an dem die Eintragung der Verschmelzung in das Register des Sitzes desjenigen Rechtsträgers, dessen Gläubiger sie sind, als bekannt gemacht gilt, ihren Anspruch nach Grund und Höhe schriftlich anmelden, Sicherheit zu leisten, soweit sie nicht Befriedigung verlangen können. Dieses Recht steht den Gläubigern jedoch nur zu, wenn sie glaubhaft machen, dass durch die Verschmelzung die Erfüllung ihrer Forderung gefährdet wird. Das Recht, Sicherheitsleistung zu verlangen, steht Gläubigern nicht zu, die im Falle der Insolvenz ein Recht auf vorzugsweise Befriedigung aus einer Deckungsmasse haben, die nach gesetzlicher Vorschrift zu ihrem Schutz errichtet und staatlich überwacht ist."
    },
    {
      "date": "2025-10-17",
      "id": "134366",
      "original_text": "Registerbekanntmachung nach dem Umwandlungsgesetz\nBerlin Amtsgericht Berlin (Charlottenburg) HRB 84894\nBauland Haus- und Grundstücksverwaltungsgesellschaft mbH – Berlin",
      "type": "Registerbekanntmachung nach dem Umwandlungsgesetz",
      "state": "Berlin",
      "amtsgericht": "Amtsgericht Berlin (Charlottenburg)",
      "registernummer": "HRB 84894",
      "registerart": "HRB",
      "company_name": "Bauland Haus- und Grundstücksverwaltungsgesellschaft mbH",
      "company_seat": "Berlin",
      "details": "17.10.2025 (Bekanntmachungsdatum)\n\nBerlin Amtsgericht Berlin (Charlottenburg) HRB 84894\nRegisterbekanntmachung nach dem Umwandlungsgesetz 15.10.2025 (Eintragungsdatum)\n\nBauland Haus- und Grundstücksverwaltungsgesellschaft mbH\nGesellschaft mit beschränkter Haftung\nBerlin\n\nZu Eintragungsnummer 8 vom 15.10.2025 wird als nicht eingetragen veröffentlicht: Den Gläubigern der an der Verschmelzung beteiligten Rechtsträger ist, wenn sie binnen sechs Monaten nach dem Tag, an dem die Eintragung der Verschmelzung in das Register des Sitzes desjenigen Rechtsträgers, dessen Gläubiger sie sind, als bekannt gemacht gilt, ihren Anspruch nach Grund und Höhe schriftlich anmelden, Sicherheit zu leisten, soweit sie nicht Befriedigung verlangen können. Dieses Recht steht den Gläubigern jedoch nur zu, wenn sie glaubhaft machen, dass durch die Verschmelzung die Erfüllung ihrer Forderung gefährdet wird. Das Recht, Sicherheitsleistung zu verlangen, steht Gläubigern nicht zu, die im Falle der Insolvenz ein Recht auf vorzugsweise Befriedigung aus einer Deckungsmasse haben, die nach gesetzlicher Vorschrift zu ihrem Schutz errichtet und staatlich überwacht ist."
    },
    {
      "date": "2025-10-17",
      "id": "134367",
      "original_text": "Einreichung neuer Dokumente\nBaden-Württemberg Amtsgericht Stuttgart HRB 788364\nROMMELAG MANAGEMENT SE – Sulzbach-Laufen",
      "type": "Einreichung neuer Dokumente",
      "state": "Baden-Württemberg",
      "amtsgericht": "Amtsgericht Stuttgart",
      "registernummer": "HRB 788364",
      "registerart": "HRB",
      "company_name": "ROMMELAG MANAGEMENT SE",
      "company_seat": "Sulzbach-Laufen",
      "details": "17.10.2025 (Bekanntmachungsdatum)\n\nBaden-Württemberg Amtsgericht Stuttgart HRB 788364\nEinreichung neuer Dokumente\n\nROMMELAG MANAGEMENT SE\nEuropäische Aktiengesellschaft (SE)\nSulzbach-Laufen\n\nDie Gesellschaft hat am 08.10.2025 die Liste über die Zusammensetzung des Aufsichtsrats zum Handelsregister eingereicht."
    },
    {
      "date": "2025-10-17",
      "id": "134368",
      "original_text": "Registerbekanntmachung nach dem Umwandlungsgesetz\nBrandenburg Amtsgericht Cottbus HRB 15112\nKling GmbH – Schönefeld",
      "type": "Registerbekanntmachung nach dem Umwandlungsgesetz",
      "state": "Brandenburg",
      "amtsgericht": "Amtsgericht Cottbus",
      "registernummer": "HRB 15112",
      "registerart": "HRB",
      "company_name": "Kling GmbH",
      "company_seat": "Schönefeld",
      "details": "17.10.2025 (Bekanntmachungsdatum)\n\nBrandenburg Amtsgericht Cottbus HRB 15112\nRegisterbekanntmachung nach dem Umwandlungsgesetz 17.10.2025 (Eintragungsdatum)\n\nKling GmbH\nGesellschaft mit beschränkter Haftung\nSchönefeld\n\nZu Eintragungsnummer 3 vom 17.10.2025 wird als nicht eingetragen veröffentlicht:\nAls nicht eingetragen wird veröffentlicht:\nDen Gläubigern der an der Umwandlung beteiligten Rechtsträger ist, wenn sie binnen sechs Monaten nach dem Tag, an dem die Eintragung der Umwandlung in das Register des Sitzes desjenigen Rechtsträgers, dessen Gläubiger sie sind, als bekannt gemacht gilt, ihren Anspruch nach Grund und Höhe schriftlich anmelden, Sicherheit zu leisten, soweit sie nicht Befriedigung verlangen können. Dieses Recht steht den Gläubigern jedoch nur zu, wenn sie glaubhaft machen, dass durch die Umwandlung die Erfüllung ihrer Forderung gefährdet wird"
    },
    {
      "date": "2025-10-17",
      "id": "134369",
      "original_text": "Löschungsankündigung\nSachsen Amtsgericht Leipzig VR 7619\nFörderverein Bahnhof und Renaissancestadt Torgau e.V. – Torgau",
      "type": "Löschungsankündigung",
      "state": "Sachsen",
      "amtsgericht": "Amtsgericht Leipzig",
      "registernummer": "VR 7619",
      "registerart": "VR",
      "company_name": "Förderverein Bahnhof und Renaissancestadt Torgau e.V.",
      "company_seat": "Torgau",
      "details": "17.10.2025 (Bekanntmachungsdatum)\n\nSachsen Amtsgericht Leipzig VR 7619\nLöschungsankündigung\n\nFörderverein Bahnhof und Renaissancestadt Torgau e.V.\neingetragener Verein\nTorgau\n\nDas Gericht beabsichtigt, gemäß § 4 Absatz 2 Ziffer 1 der Verordnung über das Vereinsregister das Registerblatt  des Vereins zu schließen, da nach Mitteilung des bisherigen Vorstandes sämtliche Mitglieder aus dem Verein ausgeschieden sind. Zur Geltendmachung eines Widerspruchs gegen die beabsichtigte Schließung wird eine Frist von einem Monat nach der Veröffentlichung bestimmt."
    },
    {
      "date": "2025-10-17",
      "id": "134370",
      "original_text": "Löschungsankündigung\nSachsen Amtsgericht Leipzig VR 2319\nDeutsch-Russisches Zentrum zu Leipzig e.V. – Leipzig",
      "type": "Löschungsankündigung",
      "state": "Sachsen",
      "amtsgericht": "Amtsgericht Leipzig",
      "registernummer": "VR 2319",
      "registerart": "VR",
      "company_name": "Deutsch-Russisches Zentrum zu Leipzig e.V.",
      "company_seat": "Leipzig",
      "details": "17.10.2025 (Bekanntmachungsdatum)\n\nSachsen Amtsgericht Leipzig VR 2319\nLöschungsankündigung\n\nDeutsch-Russisches Zentrum zu Leipzig e.V.\neingetragener Verein\nLeipzig\n\nDas Gericht beabsichtigt, gemäß § 4 Absatz 2 Ziffer 1 der Verordnung über das Vereinsregister das Registerblatt  des Vereins zu schließen, da nach Mitteilung eines ehemaligen Mitgliedes und den Ermittlungen des Gerichts sämtliche Mitglieder aus dem Verein ausgeschieden sind. Zur Geltendmachung eines Widerspruchs gegen die beabsichtigte Schließung wird eine Frist von einem Monat nach der Veröffentlichung bestimmt."
    },
    {
      "date": "2025-10-17",
      "id": "134371",
      "original_text": "Registerbekanntmachung nach dem Umwandlungsgesetz\nNiedersachsen Amtsgericht Lüneburg HRB 209374\ndigitLabs UG (haftungsbeschränkt) – Ahnsbeck",
      "type": "Registerbekanntmachung nach dem Umwandlungsgesetz",
      "state": "Niedersachsen",
      "amtsgericht": "Amtsgericht Lüneburg",
      "registernummer": "HRB 209374",
      "registerart": "HRB",
      "company_name": "digitLabs UG (haftungsbeschränkt)",
      "company_seat": "Ahnsbeck",
      "details": "17.10.2025 (Bekanntmachungsdatum)\n\nNiedersachsen Amtsgericht Lüneburg HRB 209374\nRegisterbekanntmachung nach dem Umwandlungsgesetz 17.10.2025 (Eintragungsdatum)\n\ndigitLabs UG (haftungsbeschränkt)\nGesellschaft mit beschränkter Haftung\nAhnsbeck\n\nDen Gläubigern der an der formwechselnden Umwandlung beteiligten Rechtsträger ist, wenn sie binnen sechs Monaten nach dem Tag, an dem die Eintragung der Umwandlung in das Register des Sitzes desjenigen Rechtsträgers, dessen Gläubiger sie sind, nach § 19 Abs. 3 UmwG als bekannt gemacht gilt, ihren Anspruch nach Grund und Höhe schriftlich anmelden, Sicherheit zu leisten, soweit sie nicht Befriedigung verlangen können. Dieses Recht steht den Gläubigern jedoch nur zu, wenn sie glaubhaft machen, dass durch die formwechselnde Umwandlung die Erfüllung der Forderung gefährdet wird."
    },
    {
      "date": "2025-10-17",
      "id": "134372",
      "original_text": "Sonstige Registerbekanntmachung\nNiedersachsen Amtsgericht Hannover HRB 59089\nexpert SE – Langenhagen",
      "type": "Sonstige Registerbekanntmachung",
      "state": "Niedersachsen",
      "amtsgericht": "Amtsgericht Hannover",
      "registernummer": "HRB 59089",
      "registerart": "HRB",
      "company_name": "expert SE",
      "company_seat": "Langenhagen",
      "details": "17.10.2025 (Bekanntmachungsdatum)\n\nNiedersachsen Amtsgericht Hannover HRB 59089\nSonstige Registerbekanntmachung\n\nexpert SE\nEuropäische Aktiengesellschaft (SE)\nLangenhagen\n\nDie Liste der Mitglieder des Aufsichtsrats wurde beim Registergericht eingereicht."
    },
    {
      "date": "2025-10-17",
      "id": "134373",
      "original_text": "Registerbekanntmachung nach dem Umwandlungsgesetz\nNiedersachsen Amtsgericht Osnabrück HRA 209802\nGMH Gruppe SE & Co. KG – Georgsmarienhütte",
      "type": "Registerbekanntmachung nach dem Umwandlungsgesetz",
      "state": "Niedersachsen",
      "amtsgericht": "Amtsgericht Osnabrück",
      "registernummer": "HRA 209802",
      "registerart": "HRA",
      "company_name": "GMH Gruppe SE & Co. KG",
      "company_seat": "Georgsmarienhütte",
      "details": "17.10.2025 (Bekanntmachungsdatum)\n\nNiedersachsen Amtsgericht Osnabrück HRA 209802\nRegisterbekanntmachung nach dem Umwandlungsgesetz 17.10.2025 (Eintragungsdatum)\n\nGMH Gruppe SE & Co. KG\nKommanditgesellschaft\nGeorgsmarienhütte\n\nDen Gläubigern der an der Ausgliederung beteiligten Rechtsträger ist, wenn sie binnen sechs Monaten nach dem Tag, an dem die Eintragung der Ausgliederung in das Register des Sitzes desjenigen Rechtsträgers, dessen Gläubiger sie sind, nach § 19 Abs. 3 UmwG als bekannt gemacht gilt, ihren Anspruch nach Grund und Höhe schriftlich anmelden, Sicherheit zu leisten, soweit sie nicht Befriedigung verlangen können. Dieses Recht steht den Gläubigern jedoch nur zu, wenn sie glaubhaft machen, dass durch die Ausgliederung die Erfüllung der Forderung gefährdet wird."
    },
    {
      "date": "2025-10-17",
      "id": "134374",
      "original_text": "Registerbekanntmachung nach dem Umwandlungsgesetz\nNiedersachsen Amtsgericht Tostedt HRA 204104\nLüdke Grundstücksgesellschaft OHG – Cuxhaven",
      "type": "Registerbekanntmachung nach dem Umwandlungsgesetz",
      "state": "Niedersachsen",
      "amtsgericht": "Amtsgericht Tostedt",
      "registernummer": "HRA 204104",
      "registerart": "HRA",
      "company_name": "Lüdke Grundstücksgesellschaft OHG",
      "company_seat": "Cuxhaven",
      "details": "17.10.2025 (Bekanntmachungsdatum)\n\nNiedersachsen Amtsgericht Tostedt HRA 204104\nRegisterbekanntmachung nach dem Umwandlungsgesetz 17.10.2025 (Eintragungsdatum)\n\nLüdke Grundstücksgesellschaft OHG\nKommanditgesellschaft\nCuxhaven\n\nDen Gläubigern der an der Verschmelzung beteiligten Rechtsträger ist, wenn sie binnen sechs Monaten nach dem Tag, an dem die Eintragung der Verschmelzung in das Register des Sitzes desjenigen Rechtsträgers, dessen Gläubiger sie sind, nach § 19  Abs.  3 UmwG als bekannt gemacht gilt, ihren Anspruch nach Grund und Höhe schriftlich anmelden, Sicherheit zu leisten, soweit sie nicht Befriedigung verlangen können. Dieses Recht steht den Gläubigern jedoch nur zu, wenn sie glaubhaft machen, dass durch die Verschmelzung die Erfüllung der Forderung gefährdet wird."
    },
    {
      "date": "2025-10-17",
      "id": "134375",
      "original_text": "Registerbekanntmachung nach dem Umwandlungsgesetz\nNiedersachsen Amtsgericht Tostedt HRB 207667\nLüdke Verwaltungsgesellschaft mbH – Cuxhaven",
      "type": "Registerbekanntmachung nach dem Umwandlungsgesetz",
      "state": "Niedersachsen",
      "amtsgericht": "Amtsgericht Tostedt",
      "registernummer": "HRB 207667",
      "registerart": "HRB",
      "company_name": "Lüdke Verwaltungsgesellschaft mbH",
      "company_seat": "Cuxhaven",
      "details": "17.10.2025 (Bekanntmachungsdatum)\n\nNiedersachsen Amtsgericht Tostedt HRB 207667\nRegisterbekanntmachung nach dem Umwandlungsgesetz 17.10.2025 (Eintragungsdatum)\n\nLüdke Verwaltungsgesellschaft mbH\nGesellschaft mit beschränkter Haftung\nCuxhaven\n\nDen Gläubigern der an der Verschmelzung beteiligten Rechtsträger ist, wenn sie binnen sechs Monaten nach dem Tag, an dem die Eintragung der Verschmelzung in das Register des Sitzes desjenigen Rechtsträgers, dessen Gläubiger sie sind, nach § 19  Abs.  3 UmwG als bekannt gemacht gilt, ihren Anspruch nach Grund und Höhe schriftlich anmelden, Sicherheit zu leisten, soweit sie nicht Befriedigung verlangen können. Dieses Recht steht den Gläubigern jedoch nur zu, wenn sie glaubhaft machen, dass durch die Verschmelzung die Erfüllung der Forderung gefährdet wird."
    },
    {
      "date": "2025-10-17",
      "id": "134376",
      "original_text": "Registerbekanntmachung nach dem Umwandlungsgesetz\nNiedersachsen Amtsgericht Osnabrück HRB 206935\nKamps GmbH Hoogstede – Hoogstede",
      "type": "Registerbekanntmachung nach dem Umwandlungsgesetz",
      "state": "Niedersachsen",
      "amtsgericht": "Amtsgericht Osnabrück",
      "registernummer": "HRB 206935",
      "registerart": "HRB",
      "company_name": "Kamps GmbH Hoogstede",
      "company_seat": "Hoogstede",
      "details": "17.10.2025 (Bekanntmachungsdatum)\n\nNiedersachsen Amtsgericht Osnabrück HRB 206935\nRegisterbekanntmachung nach dem Umwandlungsgesetz 17.10.2025 (Eintragungsdatum)\n\nKamps GmbH Hoogstede\nGesellschaft mit beschränkter Haftung\nHoogstede\n\nDen Gläubigern der an der Verschmelzung beteiligten Rechtsträger ist, wenn sie binnen sechs Monaten nach dem Tag, an dem die Eintragung der Verschmelzung in das Register des Sitzes desjenigen Rechtsträgers, dessen Gläubiger sie sind, nach § 19  Abs.  3 UmwG als bekannt gemacht gilt, ihren Anspruch nach Grund und Höhe schriftlich anmelden, Sicherheit zu leisten, soweit sie nicht Befriedigung verlangen können. Dieses Recht steht den Gläubigern jedoch nur zu, wenn sie glaubhaft machen, dass durch die Verschmelzung die Erfüllung der Forderung gefährdet wird."
    },
    {
      "date": "2025-10-17",
      "id": "134377",
      "original_text": "Registerbekanntmachung nach dem Umwandlungsgesetz\nNiedersachsen Amtsgericht Osnabrück HRA 209796\nVirMagnus SE & Co. KG – Georgsmarienhütte",
      "type": "Registerbekanntmachung nach dem Umwandlungsgesetz",
      "state": "Niedersachsen",
      "amtsgericht": "Amtsgericht Osnabrück",
      "registernummer": "HRA 209796",
      "registerart": "HRA",
      "company_name": "VirMagnus SE & Co. KG",
      "company_seat": "Georgsmarienhütte",
      "details": "17.10.2025 (Bekanntmachungsdatum)\n\nNiedersachsen Amtsgericht Osnabrück HRA 209796\nRegisterbekanntmachung nach dem Umwandlungsgesetz 17.10.2025 (Eintragungsdatum)\n\nVirMagnus SE & Co. KG\nKommanditgesellschaft\nGeorgsmarienhütte\n\nDen Gläubigern der an der Ausgliederung beteiligten Rechtsträger ist, wenn sie binnen sechs Monaten nach dem Tag, an dem die Eintragung der Ausgliederung in das Register des Sitzes desjenigen Rechtsträgers, dessen Gläubiger sie sind, nach § 19 Abs. 3 UmwG als bekannt gemacht gilt, ihren Anspruch nach Grund und Höhe schriftlich anmelden, Sicherheit zu leisten, soweit sie nicht Befriedigung verlangen können. Dieses Recht steht den Gläubigern jedoch nur zu, wenn sie glaubhaft machen, dass durch die Ausgliederung die Erfüllung der Forderung gefährdet wird."
    },
    {
      "date": "2025-10-17",
      "id": "134378",
      "original_text": "Registerbekanntmachung nach dem Umwandlungsgesetz\nNiedersachsen Amtsgericht Lüneburg HRA 204589\ndigitLabs Holding GmbH & Co. KG – Ahnsbeck",
      "type": "Registerbekanntmachung nach dem Umwandlungsgesetz",
      "state": "Niedersachsen",
      "amtsgericht": "Amtsgericht Lüneburg",
      "registernummer": "HRA 204589",
      "registerart": "HRA",
      "company_name": "digitLabs Holding GmbH & Co. KG",
      "company_seat": "Ahnsbeck",
      "details": "17.10.2025 (Bekanntmachungsdatum)\n\nNiedersachsen Amtsgericht Lüneburg HRA 204589\nRegisterbekanntmachung nach dem Umwandlungsgesetz 17.10.2025 (Eintragungsdatum)\n\ndigitLabs Holding GmbH & Co. KG\nKommanditgesellschaft\nAhnsbeck\n\nDen Gläubigern der an der formwechselnden Umwandlung beteiligten Rechtsträger ist, wenn sie binnen sechs Monaten nach dem Tag, an dem die Eintragung der Umwandlung in das Register des Sitzes desjenigen Rechtsträgers, dessen Gläubiger sie sind, nach § 19 Abs. 3 UmwG als bekannt gemacht gilt, ihren Anspruch nach Grund und Höhe schriftlich anmelden, Sicherheit zu leisten, soweit sie nicht Befriedigung verlangen können. Dieses Recht steht den Gläubigern jedoch nur zu, wenn sie glaubhaft machen, dass durch die formwechselnde Umwandlung die Erfüllung der Forderung gefährdet wird."
    },
    {
      "date": "2025-10-17",
      "id": "134379",
      "original_text": "Löschungsankündigung\nBremen Amtsgericht Bremen HRB 32670\nMost Container Logistik GmbH – Bremen",
      "type": "Löschungsankündigung",
      "state": "Bremen",
      "amtsgericht": "Amtsgericht Bremen",
      "registernummer": "HRB 32670",
      "registerart": "HRB",
      "company_name": "Most Container Logistik GmbH",
      "company_seat": "Bremen",
      "details": "17.10.2025 (Bekanntmachungsdatum)\n\nBremen Amtsgericht Bremen HRB 32670\nLöschungsankündigung\n\nMost Container Logistik GmbH\nGesellschaft mit beschränkter Haftung\nBremen\n\nEs ist beabsichtigt die im Handelsregister eingetragene Gesellschaft von Amts wegen gemäß § 394 FamFG zu löschen. Gegen die Löschung kann beim AG Bremen schriftlich oder zu Protokoll der Geschäftsstelle Widerspruch eingelegt werden. Widerspruchsfrist 4 Wochen."
    },
    {
      "date": "2025-10-17",
      "id": "134380",
      "original_text": "Registerbekanntmachung nach dem Umwandlungsgesetz\nRheinland-Pfalz Amtsgericht Ludwigshafen a.Rhein (Ludwigshafen) VR 1526\nDeutsches Rotes Kreuz Ortsverein Oppau-Edigheim- Pfingstweide e.V. – Ludwigshafen-Oppau",
      "type": "Registerbekanntmachung nach dem Umwandlungsgesetz",
      "state": "Rheinland-Pfalz",
      "amtsgericht": "Amtsgericht Ludwigshafen a.Rhein (Ludwigshafen)",
      "registernummer": "VR 1526",
      "registerart": "VR",
      "company_name": "Deutsches Rotes Kreuz Ortsverein Oppau-Edigheim- Pfingstweide e.V.",
      "company_seat": "Ludwigshafen-Oppau",
      "details": "17.10.2025 (Bekanntmachungsdatum)\n\nRheinland-Pfalz Amtsgericht Ludwigshafen a.Rhein (Ludwigshafen) VR 1526\nRegisterbekanntmachung nach dem Umwandlungsgesetz 17.10.2025 (Eintragungsdatum)\n\nDeutsches Rotes Kreuz Ortsverein Oppau-Edigheim- Pfingstweide e.V.\neingetragener Verein\nLudwigshafen-Oppau\n\nAls nicht eingetragen wird veröffentlicht: Den Gläubigern der an der Verschmelzung beteiligten Rechtsträger ist, wenn sie binnen sechs Monaten nach dem Tag, an dem die Eintragung der Verschmelzung in das Register des Sitzes desjenigen Rechtsträgers,dessen Gläubiger sie sind, nach § 19 Abs. 3 UmwG als bekannt gemacht gilt, ihren Anspruch nach Grund und Höhe schriftlich anmelden, Sicherheit zu leisten, soweit sie nicht Befriedigung verlangen können. Dieses Recht steht den Gläubigern jedoch nur zu, wenn sie glaubhaft machen, dass durch die Verschmelzung die Erfüllungd er Forderung gefährdet wird."
    },
    {
      "date": "2025-10-17",
      "id": "134381",
      "original_text": "Registerbekanntmachung nach dem Umwandlungsgesetz\nRheinland-Pfalz Amtsgericht Montabaur HRB 30261\nJohanniter-MVZ Mittelrhein GmbH – Neuwied",
      "type": "Registerbekanntmachung nach dem Umwandlungsgesetz",
      "state": "Rheinland-Pfalz",
      "amtsgericht": "Amtsgericht Montabaur",
      "registernummer": "HRB 30261",
      "registerart": "HRB",
      "company_name": "Johanniter-MVZ Mittelrhein GmbH",
      "company_seat": "Neuwied",
      "details": "17.10.2025 (Bekanntmachungsdatum)\n\nRheinland-Pfalz Amtsgericht Montabaur HRB 30261\nRegisterbekanntmachung nach dem Umwandlungsgesetz 17.10.2025 (Eintragungsdatum)\n\nJohanniter-MVZ Mittelrhein GmbH\nGesellschaft mit beschränkter Haftung\nNeuwied\n\nAls nicht eingetragen wird veröffentlicht: Den Gläubigern der an der Spaltung beteiligten Rechtsträger ist, wenn sie binnen sechs Monaten nach dem Tag, an dem die Eintragung der Spaltung in das Register des Sitzes desjenigen Rechtsträgers, dessen Gläubiger sie sind, nach § 19 Abs. 3 UmwG als bekanntgemacht gilt, ihren Anspruch nach Grund und Höhe schriftlich anmelden, Sicherheit zu leisten, soweit sie nicht Befriedigung verlangen können. Dieses Recht steht den Gläubigern jedoch nur zu, wenn sie glaubhaft machen, dass durch die Spaltung die Erfüllung der Forderung gefährdet wird."
    },
    {
      "date": "2025-10-17",
      "id": "134382",
      "original_text": "Löschungsankündigung\nRheinland-Pfalz Amtsgericht Montabaur HRB 28162\nMuha Bauunternehmen GmbH – Buchholz",
      "type": "Löschungsankündigung",
      "state": "Rheinland-Pfalz",
      "amtsgericht": "Amtsgericht Montabaur",
      "registernummer": "HRB 28162",
      "registerart": "HRB",
      "company_name": "Muha Bauunternehmen GmbH",
      "company_seat": "Buchholz",
      "details": "17.10.2025 (Bekanntmachungsdatum)\n\nRheinland-Pfalz Amtsgericht Montabaur HRB 28162\nLöschungsankündigung\n\nMuha Bauunternehmen GmbH\nGesellschaft mit beschränkter Haftung\nBuchholz\n\nDas Registergericht beabsichtigt die Gesellschaft von Amts wegen nach § 394 FamFG zu löschen. Die Frist zur Erhebung eines Widerspruchs ist auf einen Monat festgesetzt."
    },
    {
      "date": "2025-10-17",
      "id": "134383",
      "original_text": "Registerbekanntmachung nach dem Umwandlungsgesetz\nRheinland-Pfalz Amtsgericht Ludwigshafen a.Rhein (Ludwigshafen) VR 1231\nDeutsches Rotes Kreuz, Ortsverein Ludwigshafen- Friesenheim – Ludwigshafen-Friesenheim",
      "type": "Registerbekanntmachung nach dem Umwandlungsgesetz",
      "state": "Rheinland-Pfalz",
      "amtsgericht": "Amtsgericht Ludwigshafen a.Rhein (Ludwigshafen)",
      "registernummer": "VR 1231",
      "registerart": "VR",
      "company_name": "Deutsches Rotes Kreuz, Ortsverein Ludwigshafen- Friesenheim",
      "company_seat": "Ludwigshafen-Friesenheim",
      "details": "17.10.2025 (Bekanntmachungsdatum)\n\nRheinland-Pfalz Amtsgericht Ludwigshafen a.Rhein (Ludwigshafen) VR 1231\nRegisterbekanntmachung nach dem Umwandlungsgesetz 17.10.2025 (Eintragungsdatum)\n\nDeutsches Rotes Kreuz, Ortsverein Ludwigshafen- Friesenheim\neingetragener Verein\nLudwigshafen-Friesenheim\n\nAls nicht eingetragen wird veröffentlicht: Den Gläubigern der an der Verschmelzung beteiligten Rechtsträger ist, wenn sie binnen sechs Monaten nach dem Tag, an dem die Eintragung der Verschmelzung in das Register des Sitzes desjenigen Rechtsträgers,dessen Gläubiger sie sind, nach § 19 Abs. 3 UmwG als bekannt gemacht gilt, ihren Anspruch nach Grund und Höhe schriftlich anmelden, Sicherheit zu leisten, soweit sie nicht Befriedigung verlangen können. Dieses Recht steht den Gläubigern jedoch nur zu, wenn sie glaubhaft machen, dass durch die Verschmelzung die Erfüllungd er Forderung gefährdet wird."
    },
    {
      "date": "2025-10-17",
      "id": "134384",
      "original_text": "Registerbekanntmachung nach dem Umwandlungsgesetz\nRheinland-Pfalz Amtsgericht Mainz HRB 3963\nDCCS Deutschland GmbH – Mainz",
      "type": "Registerbekanntmachung nach dem Umwandlungsgesetz",
      "state": "Rheinland-Pfalz",
      "amtsgericht": "Amtsgericht Mainz",
      "registernummer": "HRB 3963",
      "registerart": "HRB",
      "company_name": "DCCS Deutschland GmbH",
      "company_seat": "Mainz",
      "details": "17.10.2025 (Bekanntmachungsdatum)\n\nRheinland-Pfalz Amtsgericht Mainz HRB 3963\nRegisterbekanntmachung nach dem Umwandlungsgesetz 17.10.2025 (Eintragungsdatum)\n\nDCCS Deutschland GmbH\nGesellschaft mit beschränkter Haftung\nMainz\n\nAls nicht eingetragen wird veröffentlicht: Den Gläubigern der an der Verschmelzung beteiligten Rechtsträger ist, wenn sie binnen sechs Monaten nach dem Tag, an dem die Eintragung der Verschmelzung in das Register des Sitzes desjenigen Rechtsträgers, dessen Gläubiger sie sind, nach § 19 Abs. 3 UmwG als bekannt gemacht gilt, ihren Anspruch nach Grund und Höhe schriftlich anmelden, Sicherheit zu leisten, soweit sie nicht Befriedigung verlangen können. Dieses Recht steht den Gläubigern jedoch nur zu, wenn sie glaubhaft machen, dass durch die Verschmelzung die Erfüllung der Forderung gefährdet wird."
    },
    {
      "date": "2025-10-17",
      "id": "134385",
      "original_text": "Löschungsankündigung\nRheinland-Pfalz Amtsgericht Koblenz HRB 20369\nMaas Verwaltungs GmbH – Wolken",
      "type": "Löschungsankündigung",
      "state": "Rheinland-Pfalz",
      "amtsgericht": "Amtsgericht Koblenz",
      "registernummer": "HRB 20369",
      "registerart": "HRB",
      "company_name": "Maas Verwaltungs GmbH",
      "company_seat": "Wolken",
      "details": "17.10.2025 (Bekanntmachungsdatum)\n\nRheinland-Pfalz Amtsgericht Koblenz HRB 20369\nLöschungsankündigung\n\nMaas Verwaltungs GmbH\nGesellschaft mit beschränkter Haftung\nWolken\n\nDas Registergericht beabsichtigt die Gesellschaft von Amts wegen nach § 394 FamFG zu löschen. Die Frist zur Erhebung eines Widerspruchs ist auf einen Monat festgesetzt."
    },
    {
      "date": "2025-10-17",
      "id": "134386",
      "original_text": "Registerbekanntmachung nach dem Umwandlungsgesetz\nRheinland-Pfalz Amtsgericht Ludwigshafen a.Rhein (Ludwigshafen) HRB 63690\nMonkey Businezz GmbH – Böhl-Iggelheim",
      "type": "Registerbekanntmachung nach dem Umwandlungsgesetz",
      "state": "Rheinland-Pfalz",
      "amtsgericht": "Amtsgericht Ludwigshafen a.Rhein (Ludwigshafen)",
      "registernummer": "HRB 63690",
      "registerart": "HRB",
      "company_name": "Monkey Businezz GmbH",
      "company_seat": "Böhl-Iggelheim",
      "details": "17.10.2025 (Bekanntmachungsdatum)\n\nRheinland-Pfalz Amtsgericht Ludwigshafen a.Rhein (Ludwigshafen) HRB 63690\nRegisterbekanntmachung nach dem Umwandlungsgesetz 16.10.2025 (Eintragungsdatum)\n\nMonkey Businezz GmbH\nGesellschaft mit beschränkter Haftung\nBöhl-Iggelheim\n\nAls nicht eingetragen wird veröffentlicht: Den Gläubigern der an der Verschmelzung beteiligten Rechtsträger ist, wenn sie binnen sechs Monaten nach dem Tag, an dem die Eintragung der Verschmelzung in das Register des Sitzes desjenigen Rechtsträgers,dessen Gläubiger sie sind, nach § 19 Abs. 3 UmwG als bekannt gemacht gilt, ihren Anspruch nach Grund und Höhe schriftlich anmelden, Sicherheit zu leisten, soweit sie nicht Befriedigung verlangen können. Dieses Recht steht den Gläubigern jedoch nur zu, wenn sie glaubhaft machen, dass durch die Verschmelzung die Erfüllungd er Forderung gefährdet wird."
    },
    {
      "date": "2025-10-17",
      "id": "134387",
      "original_text": "Registerbekanntmachung nach dem Umwandlungsgesetz\nNordrhein-Westfalen Amtsgericht Hamm HRB 9582\nSHS Münsterland GmbH – Hamm",
      "type": "Registerbekanntmachung nach dem Umwandlungsgesetz",
      "state": "Nordrhein-Westfalen",
      "amtsgericht": "Amtsgericht Hamm",
      "registernummer": "HRB 9582",
      "registerart": "HRB",
      "company_name": "SHS Münsterland GmbH",
      "company_seat": "Hamm",
      "details": "17.10.2025 (Bekanntmachungsdatum)\n\nNordrhein-Westfalen Amtsgericht Hamm HRB 9582\nRegisterbekanntmachung nach dem Umwandlungsgesetz 02.10.2025 (Eintragungsdatum)\n\nSHS Münsterland GmbH\nGesellschaft mit beschränkter Haftung\nHamm\n\nDen Gläubigern der an der Verschmelzung beteiligten Rechtsträger ist, wenn sie binnen sechs Monaten nach dem Tag, an dem die Eintragung der Verschmelzung in das Register des Sitzes desjenigen Rechtsträgers, dessen Gläubiger sie sind, nach § 19 Absatz 3 UmwG als bekanntgemacht gilt, ihren Anspruch nach Grund und Höhe schriftlich anmelden, Sicherheit zu leisten, soweit sie nicht Befriedigung verlangen können. Dieses Recht steht den Gläubigern jedoch nur zu, wenn sie glaubhaft machen, dass durch die Verschmelzung die Erfüllung ihrer Forderung gefährdet wird."
    },
    {
      "date": "2025-10-17",
      "id": "134388",
      "original_text": "Registerbekanntmachung nach dem Umwandlungsgesetz\nNordrhein-Westfalen Amtsgericht Iserlohn HRB 6787\nSynoVeda GmbH – Werdohl",
      "type": "Registerbekanntmachung nach dem Umwandlungsgesetz",
      "state": "Nordrhein-Westfalen",
      "amtsgericht": "Amtsgericht Iserlohn",
      "registernummer": "HRB 6787",
      "registerart": "HRB",
      "company_name": "SynoVeda GmbH",
      "company_seat": "Werdohl",
      "details": "17.10.2025 (Bekanntmachungsdatum)\n\nNordrhein-Westfalen Amtsgericht Iserlohn HRB 6787\nRegisterbekanntmachung nach dem Umwandlungsgesetz 16.10.2025 (Eintragungsdatum)\n\nSynoVeda GmbH\nGesellschaft mit beschränkter Haftung\nWerdohl\n\nDen Gläubigern der an der Verschmelzung beteiligten Rechtsträger ist, wenn sie binnen sechs Monaten nach dem Tag, an dem die Eintragung der Verschmelzung in das Register des Sitzes desjenigen Rechtsträgers, dessen Gläubiger sie sind, nach § 19 Absatz 3 UmwG als bekanntgemacht gilt, ihren Anspruch nach Grund und Höhe schriftlich anmelden, Sicherheit zu leisten, soweit sie nicht Befriedigung verlangen können. Dieses Recht steht den Gläubigern jedoch nur zu, wenn sie glaubhaft machen, dass durch die Verschmelzung die Erfüllung ihrer Forderung gefährdet wird."
    },
    {
      "date": "2025-10-17",
      "id": "134389",
      "original_text": "Löschungsankündigung\nNordrhein-Westfalen Amtsgericht Kleve HRB 19361\nBC ProCon GmbH – Kevelaer",
      "type": "Löschungsankündigung",
      "state": "Nordrhein-Westfalen",
      "amtsgericht": "Amtsgericht Kleve",
      "registernummer": "HRB 19361",
      "registerart": "HRB",
      "company_name": "BC ProCon GmbH",
      "company_seat": "Kevelaer",
      "details": "17.10.2025 (Bekanntmachungsdatum)\n\nNordrhein-Westfalen Amtsgericht Kleve HRB 19361\nLöschungsankündigung\n\nBC ProCon GmbH\nGesellschaft mit beschränkter Haftung\nKevelaer\n\nDas Registergericht beabsichtigt die Gesellschaft von Amts wegen nach § 394 FamFG zu löschen. Die Frist zur Erhebung eines Widerspruchs ist auf einen Monat festgesetzt."
    },
    {
      "date": "2025-10-17",
      "id": "134390",
      "original_text": "Löschungsankündigung\nNordrhein-Westfalen Amtsgericht Kleve HRB 18725\nInvicta Group GmbH – Emmerich am Rhein",
      "type": "Löschungsankündigung",
      "state": "Nordrhein-Westfalen",
      "amtsgericht": "Amtsgericht Kleve",
      "registernummer": "HRB 18725",
      "registerart": "HRB",
      "company_name": "Invicta Group GmbH",
      "company_seat": "Emmerich am Rhein",
      "details": "17.10.2025 (Bekanntmachungsdatum)\n\nNordrhein-Westfalen Amtsgericht Kleve HRB 18725\nLöschungsankündigung\n\nInvicta Group GmbH\nGesellschaft mit beschränkter Haftung\nEmmerich am Rhein\n\nDas Registergericht beabsichtigt die Gesellschaft von Amts wegen nach § 394 FamFG zu löschen. Die Frist zur Erhebung eines Widerspruchs ist auf einen Monat festgesetzt."
    },
    {
      "date": "2025-10-17",
      "id": "134391",
      "original_text": "Registerbekanntmachung nach dem Umwandlungsgesetz\nNordrhein-Westfalen Amtsgericht Bad Oeynhausen HRB 11028\nHultafors Group Germany GmbH – Herford",
      "type": "Registerbekanntmachung nach dem Umwandlungsgesetz",
      "state": "Nordrhein-Westfalen",
      "amtsgericht": "Amtsgericht Bad Oeynhausen",
      "registernummer": "HRB 11028",
      "registerart": "HRB",
      "company_name": "Hultafors Group Germany GmbH",
      "company_seat": "Herford",
      "details": "17.10.2025 (Bekanntmachungsdatum)\n\nNordrhein-Westfalen Amtsgericht Bad Oeynhausen HRB 11028\nRegisterbekanntmachung nach dem Umwandlungsgesetz 17.10.2025 (Eintragungsdatum)\n\nHultafors Group Germany GmbH\nGesellschaft mit beschränkter Haftung\nHerford\n\nDen Gläubigern der an der Verschmelzung beteiligten Rechtsträger ist, wenn sie binnen sechs Monaten nach dem Tag, an dem die Eintragung der Verschmelzung in das Register des Sitzes desjenigen Rechtsträgers, dessen Gläubiger sie sind, nach § 19 Absatz 3 UmwG als bekanntgemacht gilt, ihren Anspruch nach Grund und Höhe schriftlich anmelden, Sicherheit zu leisten, soweit sie nicht Befriedigung verlangen können. Dieses Recht steht den Gläubigern jedoch nur zu, wenn sie glaubhaft machen, dass durch die Verschmelzung die Erfüllung ihrer Forderung gefährdet wird."
    },
    {
      "date": "2025-10-17",
      "id": "134392",
      "original_text": "Registerbekanntmachung nach dem Umwandlungsgesetz\nNordrhein-Westfalen Amtsgericht Bielefeld HRA 17544\nDragan Matic e.K. – Bielefeld",
      "type": "Registerbekanntmachung nach dem Umwandlungsgesetz",
      "state": "Nordrhein-Westfalen",
      "amtsgericht": "Amtsgericht Bielefeld",
      "registernummer": "HRA 17544",
      "registerart": "HRA",
      "company_name": "Dragan Matic e.K.",
      "company_seat": "Bielefeld",
      "details": "17.10.2025 (Bekanntmachungsdatum)\n\nNordrhein-Westfalen Amtsgericht Bielefeld HRA 17544\nRegisterbekanntmachung nach dem Umwandlungsgesetz 17.10.2025 (Eintragungsdatum)\n\nDragan Matic e.K.\nEinzelkaufmann / Einzelkauffrau\nBielefeld\n\nDen Gläubigern der an der Ausgliederung beteiligten Rechtsträger ist, wenn sie binnen sechs Monaten nach dem Tag, an dem die Eintragung der Ausgliederung in das Register des Sitzes desjenigen Rechtsträgers, dessen Gläubiger sie sind, nach § 19 Absatz 3 UmwG als bekanntgemacht gilt, ihren Anspruch nach Grund und Höhe schriftlich anmelden, Sicherheit zu leisten, soweit sie nicht Befriedigung verlangen können. Dieses Recht steht den Gläubigern jedoch nur zu, wenn sie glaubhaft machen, dass durch die Ausgliederung die Erfüllung ihrer Forderung gefährdet wird."
    },
    {
      "date": "2025-10-17",
      "id": "134393",
      "original_text": "Registerbekanntmachung nach dem Umwandlungsgesetz\nNordrhein-Westfalen Amtsgericht Köln HRB 125135\nBIMA Haustechnik GmbH – Rösrath",
      "type": "Registerbekanntmachung nach dem Umwandlungsgesetz",
      "state": "Nordrhein-Westfalen",
      "amtsgericht": "Amtsgericht Köln",
      "registernummer": "HRB 125135",
      "registerart": "HRB",
      "company_name": "BIMA Haustechnik GmbH",
      "company_seat": "Rösrath",
      "details": "17.10.2025 (Bekanntmachungsdatum)\n\nNordrhein-Westfalen Amtsgericht Köln HRB 125135\nRegisterbekanntmachung nach dem Umwandlungsgesetz 17.10.2025 (Eintragungsdatum)\n\nBIMA Haustechnik GmbH\nGesellschaft mit beschränkter Haftung\nRösrath\n\nDen Gläubigern der an der Ausgliederung beteiligten Rechtsträger ist, wenn sie binnen sechs Monaten nach dem Tag, an dem die Eintragung der Ausgliederung in das Register des Sitzes derjenigen Rechtsträger deren Gläubiger sie sind, nach § 19 Absatz 3 UmwG als bekanntgemacht gilt, ihren Anspruch nach Grund und Höhe schriftlich anmelden, Sicherheit zu leisten, soweit sie nicht Befriedigung verlangen können. Dieses Recht steht den Gläubigern jedoch nur zu, wenn sie glaubhaft machen, dass durch die Ausgliederung die Erfüllung ihrer Forderung gefährdet wird."
    },
    {
      "date": "2025-10-17",
      "id": "134394",
      "original_text": "Löschungsankündigung\nNordrhein-Westfalen Amtsgericht Gelsenkirchen VR 2675\nAusländische Freundschaften e. V. – Gelsenkirchen",
      "type": "Löschungsankündigung",
      "state": "Nordrhein-Westfalen",
      "amtsgericht": "Amtsgericht Gelsenkirchen",
      "registernummer": "VR 2675",
      "registerart": "VR",
      "company_name": "Ausländische Freundschaften e. V.",
      "company_seat": "Gelsenkirchen",
      "details": "17.10.2025 (Bekanntmachungsdatum)\n\nNordrhein-Westfalen Amtsgericht Gelsenkirchen VR 2675\nLöschungsankündigung 17.10.2025 (Eintragungsdatum)\n\nAusländische Freundschaften e. V.\neingetragener Verein\nGelsenkirchen\n\nDas Amtsgericht Gelsenkirchen als Registergericht beabsichtigt, den in seinem Vereinsregister unter der Nr. VR 2675 eingetragenen Verein Ausländische Freundschaften e.V. aufgrund von § 395 FamFG wegen Wegfalls sämtlicher Mitglieder von Amts wegen zu löschen.\n\nEs wird denen, die ein berechtigtes Interesse an der Unterlassung der Löschung haben, zur etwaigen Geltendmachung eines Widerspruchs eine Frist von 1 Monat gesetzt.\n\nRechtsbehelfsbelehrung:\n\nGegen diese Verfügung können Sie Widerspruch einlegen.\n\nDer Widerspruch ist bei dem Amtsgericht Gelsenkirchen, Bochumer Straße 79, 45886 Gelsenkirchen schriftlich in deutscher Sprache oder zur Niederschrift der Geschäftsstelle einzulegen. Der Widerspruch kann auch zur Niederschrift der Geschäftsstelle eines jeden Amtsgerichtes abgegeben werden.\nDie Einlegung ist auch durch Übertragung eines elektronischen Dokuments an die elektronische Poststelle des Gerichts möglich. Das elektronische Dokument muss für die Bearbeitung durch das Gericht geeignet und mit einer qualifizierten elektronischen Signatur der verantwortenden Person versehen sein oder von der verantwortenden Person signiert und auf einem sicheren Übermittlungsweg gemäß § 130a ZPO nach näherer Maßgabe der Verordnung über die technischen Rahmenbedingungen des elektronischen Rechtsverkehrs und über das besondere elektronische Behördenpostfach (BGBl. I, S.3803) eingereicht werden. Weitere Informationen erhalten Sie auf der Internetseite www.justiz.de.\n\nDer Widerspruch muss spätestens innerhalb der gesetzten Frist bei dem Amtsgericht Gelsenkirchen eingegangen sein. Dies gilt auch dann, wenn der Widerspruch zur Niederschrift der Geschäftsstelle eines anderen Amtsgerichtes abgegeben wurde. Die Frist beginnt mit der Veröffentlichung. Fällt das Ende der Frist auf einen Sonntag, einen allgemeinen Feiertag oder Sonnabend, so endet die Frist mit Ablauf des nächsten Werktages.\n\nDer Widerspruch muss die Bezeichnung der angefochtenen Verfügung sowie die Erklärung enthalten, dass Widerspruch gegen diese Verfügung eingelegt wird. Er ist zu unterzeichnen und soll begründet werden."
    },
    {
      "date": "2025-10-17",
      "id": "134395",
      "original_text": "Löschungsankündigung\nNordrhein-Westfalen Amtsgericht Steinfurt HRB 12814\nLa Bella Vida UG (haftungsbeschränkt) – Ladbergen",
      "type": "Löschungsankündigung",
      "state": "Nordrhein-Westfalen",
      "amtsgericht": "Amtsgericht Steinfurt",
      "registernummer": "HRB 12814",
      "registerart": "HRB",
      "company_name": "La Bella Vida UG (haftungsbeschränkt)",
      "company_seat": "Ladbergen",
      "details": "17.10.2025 (Bekanntmachungsdatum)\n\nNordrhein-Westfalen Amtsgericht Steinfurt HRB 12814\nLöschungsankündigung 17.10.2025 (Eintragungsdatum)\n\nLa Bella Vida UG (haftungsbeschränkt)\nGesellschaft mit beschränkter Haftung\nLadbergen\n\nDas Registergericht beabsichtigt, die im Handelsregister eingetragene Gesellschaft gemäß § 394 Absatz 1 FamFG wegen Vermögenslosigkeit von Amts wegen zu löschen.\n\nGegen diese Verfügung kann Widerspruch eingelegt werden. Die Frist zur Erhebung eines Widerspruchs gegen die beabsichtigte Löschung von Amts wegen ist auf einen Monat festgesetzt.\n\nRechtsbehelfsbelehrung:\n\nGegen diese Verfügung können Sie Widerspruch einlegen.\n\nDer Widerspruch ist bei dem Amtsgericht Steinfurt, Gerichtstraße 2, 48565 Steinfurt schriftlich in deutscher Sprache oder zur Niederschrift der Geschäftsstelle einzulegen. Der Widerspruch kann auch zur Niederschrift der Geschäftsstelle eines jeden Amtsgerichtes abgegeben werden.\nDie Einlegung ist auch durch Übertragung eines elektronischen Dokuments an die elektronische Poststelle des Gerichts möglich. Das elektronische Dokument muss für die Bearbeitung durch das Gericht geeignet und mit einer qualifizierten elektronischen Signatur der verantwortenden Person versehen sein oder von der verantwortenden Person signiert und auf einem sicheren Übermittlungsweg gemäß § 130 a ZPO nach näherer Maßgabe der Verordnung über die technischen Rahmenbedingungen des elektronischen Rechtsverkehrs und über das besondere elektronische Behördenpostfach (BGBl. I, S.3803) eingereicht werden. Weitere Informationen erhalten Sie auf der Internetseite www.justiz.de.\n\nDer Widerspruch muss spätestens innerhalb der gesetzten Frist bei dem Amtsgericht Steinfurt eingegangen sein. Dies gilt auch dann, wenn der Widerspruch zur Niederschrift der Geschäftsstelle eines anderen Amtsgerichtes abgegeben wurde. Die Frist beginnt mit der Veröffentlichung. Fällt das Ende der Frist auf einen Sonntag, einen allgemeinen Feiertag oder Sonnabend, so endet die Frist mit Ablauf des nächsten Werktages.\n\nDer Widerspruch muss die Bezeichnung der angefochtenen Verfügung sowie die Erklärung enthalten, dass Widerspruch gegen diese Verfügung eingelegt wird. Er ist zu unterzeichnen und soll begründet werden."
    },
    {
      "date": "2025-10-17",
      "id": "134396",
      "original_text": "Registerbekanntmachung nach dem Umwandlungsgesetz\nNordrhein-Westfalen Amtsgericht Essen HRB 15364\nthyssenkrupp AG – Duisburg und Essen",
      "type": "Registerbekanntmachung nach dem Umwandlungsgesetz",
      "state": "Nordrhein-Westfalen",
      "amtsgericht": "Amtsgericht Essen",
      "registernummer": "HRB 15364",
      "registerart": "HRB",
      "company_name": "thyssenkrupp AG",
      "company_seat": "Duisburg und Essen",
      "details": "17.10.2025 (Bekanntmachungsdatum)\n\nNordrhein-Westfalen Amtsgericht Essen HRB 15364\nRegisterbekanntmachung nach dem Umwandlungsgesetz 17.10.2025 (Eintragungsdatum)\n\nthyssenkrupp AG\nAktiengesellschaft\nDuisburg und Essen\n\nDen Gläubigern der an der Abspaltung beteiligten Rechtsträger ist, wenn sie binnen sechs Monaten nach dem Tag, an dem die Eintragung der Abspaltung in das Register des Sitzes desjenigen Rechtsträgers, dessen Gläubiger sie sind, nach § 19 Absatz 3 UmwG als bekanntgemacht gilt, ihren Anspruch nach Grund und Höhe schriftlich anmelden, Sicherheit zu leisten, soweit sie nicht Befriedigung verlangen können. Dieses Recht steht den Gläubigern jedoch nur zu, wenn sie glaubhaft machen, dass durch die Abspaltung die Erfüllung ihrer Forderung gefährdet wird."
    },
    {
      "date": "2025-10-17",
      "id": "134397",
      "original_text": "Registerbekanntmachung nach dem Umwandlungsgesetz\nNordrhein-Westfalen Amtsgericht Bad Oeynhausen HRB 16503\nSkillers GmbH – Herford",
      "type": "Registerbekanntmachung nach dem Umwandlungsgesetz",
      "state": "Nordrhein-Westfalen",
      "amtsgericht": "Amtsgericht Bad Oeynhausen",
      "registernummer": "HRB 16503",
      "registerart": "HRB",
      "company_name": "Skillers GmbH",
      "company_seat": "Herford",
      "details": "17.10.2025 (Bekanntmachungsdatum)\n\nNordrhein-Westfalen Amtsgericht Bad Oeynhausen HRB 16503\nRegisterbekanntmachung nach dem Umwandlungsgesetz 17.10.2025 (Eintragungsdatum)\n\nSkillers GmbH\nGesellschaft mit beschränkter Haftung\nHerford\n\nDen Gläubigern der an der Verschmelzung beteiligten Rechtsträger ist, wenn sie binnen sechs Monaten nach dem Tag, an dem die Eintragung der Verschmelzung in das Register des Sitzes desjenigen Rechtsträgers, dessen Gläubiger sie sind, nach § 19 Absatz 3 UmwG als bekanntgemacht gilt, ihren Anspruch nach Grund und Höhe schriftlich anmelden, Sicherheit zu leisten, soweit sie nicht Befriedigung verlangen können. Dieses Recht steht den Gläubigern jedoch nur zu, wenn sie glaubhaft machen, dass durch die Verschmelzung die Erfüllung ihrer Forderung gefährdet wird."
    },
    {
      "date": "2025-10-17",
      "id": "134398",
      "original_text": "Löschungsankündigung\nNordrhein-Westfalen Amtsgericht Düsseldorf HRB 89131\nAT MOVE GmbH – Düsseldorf",
      "type": "Löschungsankündigung",
      "state": "Nordrhein-Westfalen",
      "amtsgericht": "Amtsgericht Düsseldorf",
      "registernummer": "HRB 89131",
      "registerart": "HRB",
      "company_name": "AT MOVE GmbH",
      "company_seat": "Düsseldorf",
      "details": "17.10.2025 (Bekanntmachungsdatum)\n\nNordrhein-Westfalen Amtsgericht Düsseldorf HRB 89131\nLöschungsankündigung\n\nAT MOVE GmbH\nGesellschaft mit beschränkter Haftung\nDüsseldorf\n\nDas Registergericht beabsichtigt die Gesellschaft von Amts wegen nach § 394 FamFG zu löschen. Die Frist zur Erhebung eines Widerspruchs ist auf 3 Wochen festgesetzt.\n\nRechtsbehelfsbelehrung:\nDas Widerspruchsrecht steht jedem zu, der an der Unterlassung der Löschung ein berechtigtes Interesse hat. Der Widerspruch ist bei dem Amtsgericht Düsseldorf -Registergericht-, Werdener Straße 1, 40227 Düsseldorf schriftlich in deutscher Sprache oder zur Niederschrift der Geschäftsstelle einzulegen. Der Widerspruch kann auch zur Niederschrift der Geschäftsstelle eines jeden Amtsgerichtes abgegeben werden. Die Einlegung ist auch durch Übertragung eines elektronischen Dokuments an die elektronische Poststelle des Gerichts möglich. Das elektronische Dokument muss für die Bearbeitung durch das Gericht geeignet und mit einer qualifizierten elektronischen Signatur der verantwortenden Person versehen sein oder von der verantwortenden Person signiert und auf einem sicheren Übermittlungsweg gemäß § 130a ZPO nach näherer Maßgabe der Verordnung über die technischen Rahmenbedingungen des elektronischen Rechtsverkehrs und über das besondere elektronische Behördenpostfach (BGBl. I, S.3803) eingereicht werden. Weitere Informationen erhalten Sie auf der Internetseite www.justiz.de.\nDer Widerspruch muss spätestens innerhalb der gesetzten Frist nach dem Datum der Bekanntmachung der Löschungsankündigung bei dem Amtsgericht - Registergericht - Düsseldorf eingegangen sein.  Dies gilt auch dann, wenn der Widerspruch zur Niederschrift der Geschäftsstelle eines anderen Amtsgerichtes abgegeben wurde. Die Frist beginnt mit dem Tage der Bekanntmachung der Löschungsankündigung in dem für die Bekanntmachung der Eintragungen in das Handelsregister bestimmten elektronischen Informations- und Kommunikationssystem nach § 10 des Handelsgesetzbuches. Fällt das Ende der Frist auf einen Sonntag, einen allgemeinen Feiertag oder Sonnabend, so endet die Frist mit Ablauf des nächsten Werktages.\nDer Widerspruch muss die Bezeichnung der angefochtenen Löschungsankündigung sowie die Erklärung enthalten, dass Widerspruch gegen diese Löschungsankündigung eingelegt wird. Er ist zu unterzeichnen und soll begründet werden."
    },
    {
      "date": "2025-10-17",
      "id": "134399",
      "original_text": "Registerbekanntmachung nach dem Umwandlungsgesetz\nNordrhein-Westfalen Amtsgericht Münster HRB 22995\nKirchner Immobilien GmbH – Telgte",
      "type": "Registerbekanntmachung nach dem Umwandlungsgesetz",
      "state": "Nordrhein-Westfalen",
      "amtsgericht": "Amtsgericht Münster",
      "registernummer": "HRB 22995",
      "registerart": "HRB",
      "company_name": "Kirchner Immobilien GmbH",
      "company_seat": "Telgte",
      "details": "17.10.2025 (Bekanntmachungsdatum)\n\nNordrhein-Westfalen Amtsgericht Münster HRB 22995\nRegisterbekanntmachung nach dem Umwandlungsgesetz 17.10.2025 (Eintragungsdatum)\n\nKirchner Immobilien GmbH\nGesellschaft mit beschränkter Haftung\nTelgte\n\nDen Gläubigern der an der Ausgliederung beteiligten Rechtsträger ist, wenn sie binnen sechs Monaten nach dem Tag, an dem die Eintragung der Ausgliederung in das Register des Sitzes desjenigen Rechtsträgers, dessen Gläubiger sie sind, nach § 19 Absatz 3 UmwG als bekanntgemacht gilt, ihren Anspruch nach Grund und Höhe schriftlich anmelden, Sicherheit zu leisten, soweit sie nicht Befriedigung verlangen können. Dieses Recht steht den Gläubigern jedoch nur zu, wenn sie glaubhaft machen, dass durch die Ausgliederung die Erfüllung ihrer Forderung gefährdet wird."
    },
    {
      "date": "2025-10-17",
      "id": "134400",
      "original_text": "Löschungsankündigung\nNordrhein-Westfalen Amtsgericht Neuss HRB 14972\nSEL GmbH – Neuss",
      "type": "Löschungsankündigung",
      "state": "Nordrhein-Westfalen",
      "amtsgericht": "Amtsgericht Neuss",
      "registernummer": "HRB 14972",
      "registerart": "HRB",
      "company_name": "SEL GmbH",
      "company_seat": "Neuss",
      "details": "17.10.2025 (Bekanntmachungsdatum)\n\nNordrhein-Westfalen Amtsgericht Neuss HRB 14972\nLöschungsankündigung 17.10.2025 (Eintragungsdatum)\n\nSEL GmbH\nGesellschaft mit beschränkter Haftung\nNeuss\n\nEs ist beabsichtigt, die Gesellschaft wegen Vermögenslosigkeit aufgrund des § 394 Abs. 1 FamFG zu löschen. Frist zur Geltendmachung eines Widerspruchs: 1 Monat.\n\nRechtsbehelfsbelehrung:\nGegen diese Verfügung können Sie Widerspruch einlegen.\nDer Widerspruch ist bei dem Amtsgericht Neuss - Registergericht -, Breite Str. 48, 41460 Neuss schriftlich in deutscher Sprache oder zur Niederschrift der Geschäftsstelle einzulegen.\nDer Widerspruch kann auch zur Niederschrift der Geschäftsstelle eines jeden Amtsgerichtes abgegeben werden.\nDie Einlegung ist auch durch Übertragung eines elektronischen Dokuments an die elektronische Poststelle des Gerichts möglich. Das elektronische Dokument muss für die Bearbeitung durch das Gericht geeignet und mit einer qualifizierten elektronischen Signatur der verantwortenden Person versehen sein oder von der verantwortenden Person signiert und auf einem sicheren Übermittlungsweg gemäß § 130a ZPO nach näherer Maßgabe der Verordnung über die technischen Rahmenbedingungen des elektronischen Rechtsverkehrs und über das besondere elektronische Behördenpostfach (BGBl. I, S.3803) eingereicht werden. Weitere Informationen erhalten Sie auf der Internetseite www.justiz.de.\nDer Widerspruch muss spätestens innerhalb der gesetzten Frist nach der schriftlichen Bekanntgabe der Verfügung bei dem Amtsgericht - Registergericht - Neuss eingegangen sein. Dies gilt auch dann, wenn der Widerspruch zur Niederschrift der Geschäftsstelle eines anderen Amtsgerichtes abgegeben wurde. Die Frist beginnt mit der schriftlichen Bekanntgabe der Verfügung. Die Bekanntgabe ist entweder durch Zustellung oder am dritten Tage nach Aufgabe zur Post bewirkt. Fällt das Ende der Frist auf einen Sonntag, einen allgemeinen Feiertag oder Sonnabend, so endet die Frist mit Ablauf des nächsten Werktages.\n\nDer Widerspruch muss die Bezeichnung der angefochtenen Verfügung sowie die Erklärung enthalten, dass Widerspruch gegen diese Verfügung eingelegt wird. Er ist zu unterzeichnen und soll begründet werden."
    },
    {
      "date": "2025-10-17",
      "id": "134401",
      "original_text": "Registerbekanntmachung nach dem Umwandlungsgesetz\nNordrhein-Westfalen Amtsgericht Bad Oeynhausen HRA 124\nAugust Siekmann Möbelwerke GmbH & Co. KG – Löhne",
      "type": "Registerbekanntmachung nach dem Umwandlungsgesetz",
      "state": "Nordrhein-Westfalen",
      "amtsgericht": "Amtsgericht Bad Oeynhausen",
      "registernummer": "HRA 124",
      "registerart": "HRA",
      "company_name": "August Siekmann Möbelwerke GmbH & Co. KG",
      "company_seat": "Löhne",
      "details": "17.10.2025 (Bekanntmachungsdatum)\n\nNordrhein-Westfalen Amtsgericht Bad Oeynhausen HRA 124\nRegisterbekanntmachung nach dem Umwandlungsgesetz 17.10.2025 (Eintragungsdatum)\n\nAugust Siekmann Möbelwerke GmbH & Co. KG\nKommanditgesellschaft\nLöhne\n\nDen Gläubigern der an der Verschmelzung beteiligten Rechtsträger ist, wenn sie binnen sechs Monaten nach dem Tag, an dem die Eintragung der Verschmelzung in das Register des Sitzes desjenigen Rechtsträgers, dessen Gläubiger sie sind, nach § 19 Absatz 3 UmwG als bekanntgemacht gilt, ihren Anspruch nach Grund und Höhe schriftlich anmelden, Sicherheit zu leisten, soweit sie nicht Befriedigung verlangen können. Dieses Recht steht den Gläubigern jedoch nur zu, wenn sie glaubhaft machen, dass durch die Verschmelzung die Erfüllung ihrer Forderung gefährdet wird."
    },
    {
      "date": "2025-10-17",
      "id": "134402",
      "original_text": "Registerbekanntmachung nach dem Umwandlungsgesetz\nNordrhein-Westfalen Amtsgericht Münster VR 50537\nTönnis aus dem Häuschen e.V. – Ahlen",
      "type": "Registerbekanntmachung nach dem Umwandlungsgesetz",
      "state": "Nordrhein-Westfalen",
      "amtsgericht": "Amtsgericht Münster",
      "registernummer": "VR 50537",
      "registerart": "VR",
      "company_name": "Tönnis aus dem Häuschen e.V.",
      "company_seat": "Ahlen",
      "details": "17.10.2025 (Bekanntmachungsdatum)\n\nNordrhein-Westfalen Amtsgericht Münster VR 50537\nRegisterbekanntmachung nach dem Umwandlungsgesetz 17.10.2025 (Eintragungsdatum)\n\nTönnis aus dem Häuschen e.V.\neingetragener Verein\nAhlen\n\nDen Gläubigern der an der Verschmelzung beteiligten Rechtsträger ist, wenn sie binnen sechs Monaten nach dem Tag, an dem die Eintragung der Verschmelzung in das Register des Sitzes desjenigen Rechtsträgers, dessen Gläubiger sie sind, nach § 19 Absatz 3 UmwG als bekanntgemacht gilt, ihren Anspruch nach Grund und Höhe schriftlich anmelden, Sicherheit zu leisten, soweit sie nicht Befriedigung verlangen können. Dieses Recht steht den Gläubigern jedoch nur zu, wenn sie glaubhaft machen, dass durch die Verschmelzung die Erfüllung ihrer Forderung gefährdet wird."
    },
    {
      "date": "2025-10-17",
      "id": "134403",
      "original_text": "Registerbekanntmachung nach dem Umwandlungsgesetz\nNordrhein-Westfalen Amtsgericht Gelsenkirchen HRB 4049\ninter Partner Gesellschaft für Organisations- und Personalentwicklung mbH – Gladbeck",
      "type": "Registerbekanntmachung nach dem Umwandlungsgesetz",
      "state": "Nordrhein-Westfalen",
      "amtsgericht": "Amtsgericht Gelsenkirchen",
      "registernummer": "HRB 4049",
      "registerart": "HRB",
      "company_name": "inter Partner Gesellschaft für Organisations- und Personalentwicklung mbH",
      "company_seat": "Gladbeck",
      "details": "17.10.2025 (Bekanntmachungsdatum)\n\nNordrhein-Westfalen Amtsgericht Gelsenkirchen HRB 4049\nRegisterbekanntmachung nach dem Umwandlungsgesetz 17.10.2025 (Eintragungsdatum)\n\ninter Partner Gesellschaft für Organisations- und Personalentwicklung mbH\nGesellschaft mit beschränkter Haftung\nGladbeck\n\nDen Gläubigern der an der Verschmelzung beteiligten Rechtsträger ist, wenn sie binnen sechs Monaten nach dem Tag, an dem die Eintragung der Verschmelzung in das Register des Sitzes desjenigen Rechtsträgers, dessen Gläubiger sie sind, nach § 19 Absatz 3 UmwG als bekanntgemacht gilt, ihren Anspruch nach Grund und Höhe schriftlich anmelden, Sicherheit zu leisten, soweit sie nicht Befriedigung verlangen können. Dieses Recht steht den Gläubigern jedoch nur zu, wenn sie glaubhaft machen, dass durch die Verschmelzung die Erfüllung ihrer Forderung gefährdet wird."
    },
    {
      "date": "2025-10-17",
      "id": "134404",
      "original_text": "Registerbekanntmachung nach dem Umwandlungsgesetz\nNordrhein-Westfalen Amtsgericht Düsseldorf HRB 39513\nPRIMAG AG – Düsseldorf",
      "type": "Registerbekanntmachung nach dem Umwandlungsgesetz",
      "state": "Nordrhein-Westfalen",
      "amtsgericht": "Amtsgericht Düsseldorf",
      "registernummer": "HRB 39513",
      "registerart": "HRB",
      "company_name": "PRIMAG AG",
      "company_seat": "Düsseldorf",
      "details": "17.10.2025 (Bekanntmachungsdatum)\n\nNordrhein-Westfalen Amtsgericht Düsseldorf HRB 39513\nRegisterbekanntmachung nach dem Umwandlungsgesetz 17.10.2025 (Eintragungsdatum)\n\nPRIMAG AG\nAktiengesellschaft\nDüsseldorf\n\nDem Registergericht ist der Entwurf eines Vertrages über die geplante Verschmelzung der PRIMAG Grundbesitzgesellschaft mbH\nmit Sitz in Düsseldorf, Geschäftsanschrift: Hansaallee 228, 40547 Düsseldorf,\neingetragen im Handelsregister des Amtsgerichts Düsseldorf unter HRB 36764, mit der PRIMAG AG\nmit Sitz in Düsseldorf, Geschäftsanschrift: Hansaallee 228, 40547 Düsseldorf,\neingetragen im Handelsregister des Amtsgerichts Düsseldorf unter HRB 39513, eingereicht worden."
    },
    {
      "date": "2025-10-17",
      "id": "134405",
      "original_text": "Sonstige Registerbekanntmachung\nNordrhein-Westfalen Amtsgericht Münster HRB 17214\nCamptools GmbH – Münster",
      "type": "Sonstige Registerbekanntmachung",
      "state": "Nordrhein-Westfalen",
      "amtsgericht": "Amtsgericht Münster",
      "registernummer": "HRB 17214",
      "registerart": "HRB",
      "company_name": "Camptools GmbH",
      "company_seat": "Münster",
      "details": "17.10.2025 (Bekanntmachungsdatum)\n\nNordrhein-Westfalen Amtsgericht Münster HRB 17214\nSonstige Registerbekanntmachung 16.10.2025 (Eintragungsdatum)\n\nCamptools GmbH\nGesellschaft mit beschränkter Haftung\nMünster\n\nAls nicht eingetragen wird veröffentlicht: Den Gläubigern der Gesellschaft, deren Forderungen begründet worden sind bevor die Eintragung der Beendigung des Gewinnabführungsvertrages  in das Handelsregister nach § 10 des Handelsgesetzbuches als bekanntgemacht gilt, hat der andere Vertragsteil Sicherheit zu leisten, wenn sie sich binnen sechs Monaten nach der Bekanntmachung der Eintragung zu diesem Zweck bei ihm melden."
    },
    {
      "date": "2025-10-17",
      "id": "134406",
      "original_text": "Löschungsankündigung\nNordrhein-Westfalen Amtsgericht Köln HRB 88602\nMenn Investments UG (haftungsbeschränkt) – Engelskirchen",
      "type": "Löschungsankündigung",
      "state": "Nordrhein-Westfalen",
      "amtsgericht": "Amtsgericht Köln",
      "registernummer": "HRB 88602",
      "registerart": "HRB",
      "company_name": "Menn Investments UG (haftungsbeschränkt)",
      "company_seat": "Engelskirchen",
      "details": "17.10.2025 (Bekanntmachungsdatum)\n\nNordrhein-Westfalen Amtsgericht Köln HRB 88602\nLöschungsankündigung\n\nMenn Investments UG (haftungsbeschränkt)\nGesellschaft mit beschränkter Haftung\nEngelskirchen\n\nDas Registergericht beabsichtigt die Gesellschaft von Amts wegen nach § 394 FamFG zu löschen. Die Frist zur Erhebung eines Widerspruchs ist auf einen Monat festgesetzt."
    },
    {
      "date": "2025-10-17",
      "id": "134407",
      "original_text": "Registerbekanntmachung nach dem Umwandlungsgesetz\nNordrhein-Westfalen Amtsgericht Gelsenkirchen HRB 11906\nXbet GmbH – Marl",
      "type": "Registerbekanntmachung nach dem Umwandlungsgesetz",
      "state": "Nordrhein-Westfalen",
      "amtsgericht": "Amtsgericht Gelsenkirchen",
      "registernummer": "HRB 11906",
      "registerart": "HRB",
      "company_name": "Xbet GmbH",
      "company_seat": "Marl",
      "details": "17.10.2025 (Bekanntmachungsdatum)\n\nNordrhein-Westfalen Amtsgericht Gelsenkirchen HRB 11906\nRegisterbekanntmachung nach dem Umwandlungsgesetz 17.10.2025 (Eintragungsdatum)\n\nXbet GmbH\nGesellschaft mit beschränkter Haftung\nMarl\n\nDen Gläubigern der an der Verschmelzung beteiligten Rechtsträger ist, wenn sie binnen sechs Monaten nach dem Tag, an dem die Eintragung der Verschmelzung in das Register des Sitzes desjenigen Rechtsträgers, dessen Gläubiger sie sind, nach § 19 Absatz 3 UmwG als bekanntgemacht gilt, ihren Anspruch nach Grund und Höhe schriftlich anmelden, Sicherheit zu leisten, soweit sie nicht Befriedigung verlangen können. Dieses Recht steht den Gläubigern jedoch nur zu, wenn sie glaubhaft machen, dass durch die Verschmelzung die Erfüllung ihrer Forderung gefährdet wird."
    },
    {
      "date": "2025-10-17",
      "id": "134408",
      "original_text": "Registerbekanntmachung nach dem Umwandlungsgesetz\nNordrhein-Westfalen Amtsgericht Duisburg HRB 9092\nthyssenkrupp AG – Duisburg und Essen",
      "type": "Registerbekanntmachung nach dem Umwandlungsgesetz",
      "state": "Nordrhein-Westfalen",
      "amtsgericht": "Amtsgericht Duisburg",
      "registernummer": "HRB 9092",
      "registerart": "HRB",
      "company_name": "thyssenkrupp AG",
      "company_seat": "Duisburg und Essen",
      "details": "17.10.2025 (Bekanntmachungsdatum)\n\nNordrhein-Westfalen Amtsgericht Duisburg HRB 9092\nRegisterbekanntmachung nach dem Umwandlungsgesetz 17.10.2025 (Eintragungsdatum)\n\nthyssenkrupp AG\nAktiengesellschaft\nDuisburg und Essen\n\nDie Gesellschaft hat Gläubigern, deren Forderungen vor dieser Bekanntmachung begründet worden sind, Sicherheit zu leisten, soweit sie nicht Befriedigung verlangen können, wenn sie sich binnen sechs Monaten zu diesem Zweck melden."
    },
    {
      "date": "2025-10-17",
      "id": "134409",
      "original_text": "Registerbekanntmachung nach dem Umwandlungsgesetz\nNordrhein-Westfalen Amtsgericht Bonn HRB 15257\nScopevisio AG – Bonn",
      "type": "Registerbekanntmachung nach dem Umwandlungsgesetz",
      "state": "Nordrhein-Westfalen",
      "amtsgericht": "Amtsgericht Bonn",
      "registernummer": "HRB 15257",
      "registerart": "HRB",
      "company_name": "Scopevisio AG",
      "company_seat": "Bonn",
      "details": "17.10.2025 (Bekanntmachungsdatum)\n\nNordrhein-Westfalen Amtsgericht Bonn HRB 15257\nRegisterbekanntmachung nach dem Umwandlungsgesetz 17.10.2025 (Eintragungsdatum)\n\nScopevisio AG\nAktiengesellschaft\nBonn\n\nDen Gläubigern der an der Verschmelzung beteiligten Rechtsträger ist, wenn sie binnen sechs Monaten nach dem Tag, an dem die Eintragung der Verschmelzung in das Register des Sitzes desjenigen Rechtsträgers, dessen Gläubiger sie sind, nach § 19 Absatz 3 UmwG als bekanntgemacht gilt, ihren Anspruch nach Grund und Höhe schriftlich anmelden, Sicherheit zu leisten, soweit sie nicht Befriedigung verlangen können. Dieses Recht steht den Gläubigern jedoch nur zu, wenn sie glaubhaft machen, dass durch die Verschmelzung die Erfüllung ihrer Forderung gefährdet wird."
    },
    {
      "date": "2025-10-17",
      "id": "134410",
      "original_text": "Löschungsankündigung\nNordrhein-Westfalen Amtsgericht Bad Oeynhausen HRA 7739\nArnings Garden Lake & Resorts GmbH & Co.KG – Löhne",
      "type": "Löschungsankündigung",
      "state": "Nordrhein-Westfalen",
      "amtsgericht": "Amtsgericht Bad Oeynhausen",
      "registernummer": "HRA 7739",
      "registerart": "HRA",
      "company_name": "Arnings Garden Lake & Resorts GmbH & Co.KG",
      "company_seat": "Löhne",
      "details": "17.10.2025 (Bekanntmachungsdatum)\n\nNordrhein-Westfalen Amtsgericht Bad Oeynhausen HRA 7739\nLöschungsankündigung\n\nArnings Garden Lake & Resorts GmbH & Co.KG\nKommanditgesellschaft\nLöhne\n\nDas Registergericht beabsichtigt die Firma von Amts wegen nach §§ 31 HGB, 393 FamFG zu löschen. Die Frist zur Erhebung eines Widerspruchs ist auf einen Monat festgesetzt."
    },
    {
      "date": "2025-10-17",
      "id": "134411",
      "original_text": "Registerbekanntmachung nach dem Umwandlungsgesetz\nNordrhein-Westfalen Amtsgericht Bonn HRB 15257\nScopevisio AG – Bonn",
      "type": "Registerbekanntmachung nach dem Umwandlungsgesetz",
      "state": "Nordrhein-Westfalen",
      "amtsgericht": "Amtsgericht Bonn",
      "registernummer": "HRB 15257",
      "registerart": "HRB",
      "company_name": "Scopevisio AG",
      "company_seat": "Bonn",
      "details": "17.10.2025 (Bekanntmachungsdatum)\n\nNordrhein-Westfalen Amtsgericht Bonn HRB 15257\nRegisterbekanntmachung nach dem Umwandlungsgesetz 17.10.2025 (Eintragungsdatum)\n\nScopevisio AG\nAktiengesellschaft\nBonn\n\nDen Gläubigern der an der Verschmelzung beteiligten Rechtsträger ist, wenn sie binnen sechs Monaten nach dem Tag, an dem die Eintragung der Verschmelzung in das Register des Sitzes desjenigen Rechtsträgers, dessen Gläubiger sie sind, nach § 19 Absatz 3 UmwG als bekanntgemacht gilt, ihren Anspruch nach Grund und Höhe schriftlich anmelden, Sicherheit zu leisten, soweit sie nicht Befriedigung verlangen können. Dieses Recht steht den Gläubigern jedoch nur zu, wenn sie glaubhaft machen, dass durch die Verschmelzung die Erfüllung ihrer Forderung gefährdet wird."
    },
    {
      "date": "2025-10-17",
      "id": "134412",
      "original_text": "Löschungsankündigung\nNordrhein-Westfalen Amtsgericht Krefeld HRB 18333\nMore GmbH – Willich",
      "type": "Löschungsankündigung",
      "state": "Nordrhein-Westfalen",
      "amtsgericht": "Amtsgericht Krefeld",
      "registernummer": "HRB 18333",
      "registerart": "HRB",
      "company_name": "More GmbH",
      "company_seat": "Willich",
      "details": "17.10.2025 (Bekanntmachungsdatum)\n\nNordrhein-Westfalen Amtsgericht Krefeld HRB 18333\nLöschungsankündigung\n\nMore GmbH\nGesellschaft mit beschränkter Haftung\nWillich\n\nDas Registergericht beabsichtigt die Gesellschaft von Amts wegen nach § 394 FamFG zu löschen. Die Frist zur Erhebung eines Widerspruchs ist auf einen Monat festgesetzt."
    },
    {
      "date": "2025-10-17",
      "id": "134413",
      "original_text": "Einreichung neuer Dokumente\nNordrhein-Westfalen Amtsgericht Mönchengladbach HRB 8885\nS-IBG Immobilien-Beteiligungs-Gesellschaft der Kreissparkasse Heinsberg mbH – Erkelenz",
      "type": "Einreichung neuer Dokumente",
      "state": "Nordrhein-Westfalen",
      "amtsgericht": "Amtsgericht Mönchengladbach",
      "registernummer": "HRB 8885",
      "registerart": "HRB",
      "company_name": "S-IBG Immobilien-Beteiligungs-Gesellschaft der Kreissparkasse Heinsberg mbH",
      "company_seat": "Erkelenz",
      "details": "17.10.2025 (Bekanntmachungsdatum)\n\nNordrhein-Westfalen Amtsgericht Mönchengladbach HRB 8885\nEinreichung neuer Dokumente\n\nS-IBG Immobilien-Beteiligungs-Gesellschaft der Kreissparkasse Heinsberg mbH\nGesellschaft mit beschränkter Haftung\nErkelenz\n\nDem Registergericht ist eine neue Liste der Mitglieder des Aufsichtsrates eingereicht worden."
    },
    {
      "date": "2025-10-17",
      "id": "134414",
      "original_text": "Registerbekanntmachung nach dem Umwandlungsgesetz\nNordrhein-Westfalen Amtsgericht Essen HRA 11949\nSan-Sic e. K. – Essen",
      "type": "Registerbekanntmachung nach dem Umwandlungsgesetz",
      "state": "Nordrhein-Westfalen",
      "amtsgericht": "Amtsgericht Essen",
      "registernummer": "HRA 11949",
      "registerart": "HRA",
      "company_name": "San-Sic e. K.",
      "company_seat": "Essen",
      "details": "17.10.2025 (Bekanntmachungsdatum)\n\nNordrhein-Westfalen Amtsgericht Essen HRA 11949\nRegisterbekanntmachung nach dem Umwandlungsgesetz 17.10.2025 (Eintragungsdatum)\n\nSan-Sic e. K.\nEinzelkaufmann / Einzelkauffrau\nEssen\n\nDen Gläubigern der an der Ausgliederung beteiligten Rechtsträger ist, wenn sie binnen sechs Monaten nach dem Tag, an dem die Eintragung der Ausgliederung in das Register des Sitzes desjenigen Rechtsträgers, dessen Gläubiger sie sind, nach § 19 Absatz 3 UmwG als bekanntgemacht gilt, ihren Anspruch nach Grund und Höhe schriftlich anmelden, Sicherheit zu leisten, soweit sie nicht Befriedigung verlangen können. Dieses Recht steht den Gläubigern jedoch nur zu, wenn sie glaubhaft machen, dass durch die Ausgliederung die Erfüllung ihrer Forderung gefährdet wird."
    },
    {
      "date": "2025-10-17",
      "id": "134415",
      "original_text": "Registerbekanntmachung nach dem Umwandlungsgesetz\nNordrhein-Westfalen Amtsgericht Bonn HRB 15257\nScopevisio AG – Bonn",
      "type": "Registerbekanntmachung nach dem Umwandlungsgesetz",
      "state": "Nordrhein-Westfalen",
      "amtsgericht": "Amtsgericht Bonn",
      "registernummer": "HRB 15257",
      "registerart": "HRB",
      "company_name": "Scopevisio AG",
      "company_seat": "Bonn",
      "details": "17.10.2025 (Bekanntmachungsdatum)\n\nNordrhein-Westfalen Amtsgericht Bonn HRB 15257\nRegisterbekanntmachung nach dem Umwandlungsgesetz 17.10.2025 (Eintragungsdatum)\n\nScopevisio AG\nAktiengesellschaft\nBonn\n\nDen Gläubigern der an der Verschmelzung beteiligten Rechtsträger ist, wenn sie binnen sechs Monaten nach dem Tag, an dem die Eintragung der Verschmelzung in das Register des Sitzes desjenigen Rechtsträgers, dessen Gläubiger sie sind, nach § 19 Absatz 3 UmwG als bekanntgemacht gilt, ihren Anspruch nach Grund und Höhe schriftlich anmelden, Sicherheit zu leisten, soweit sie nicht Befriedigung verlangen können. Dieses Recht steht den Gläubigern jedoch nur zu, wenn sie glaubhaft machen, dass durch die Verschmelzung die Erfüllung ihrer Forderung gefährdet wird."
    },
    {
      "date": "2025-10-17",
      "id": "134416",
      "original_text": "Löschungsankündigung\nNordrhein-Westfalen Amtsgericht Krefeld HRB 17958\nPLX UG (haftungsbeschränkt) – Nettetal",
      "type": "Löschungsankündigung",
      "state": "Nordrhein-Westfalen",
      "amtsgericht": "Amtsgericht Krefeld",
      "registernummer": "HRB 17958",
      "registerart": "HRB",
      "company_name": "PLX UG (haftungsbeschränkt)",
      "company_seat": "Nettetal",
      "details": "17.10.2025 (Bekanntmachungsdatum)\n\nNordrhein-Westfalen Amtsgericht Krefeld HRB 17958\nLöschungsankündigung\n\nPLX UG (haftungsbeschränkt)\nGesellschaft mit beschränkter Haftung\nNettetal\n\nDas Registergericht beabsichtigt die Gesellschaft von Amts wegen nach § 394 FamFG zu löschen. Die Frist zur Erhebung eines Widerspruchs ist auf einen Monat festgesetzt."
    },
    {
      "date": "2025-10-17",
      "id": "134417",
      "original_text": "Registerbekanntmachung nach dem Umwandlungsgesetz\nNordrhein-Westfalen Amtsgericht Münster VR 50781\nTönnishäuschen - Unser Dorf e.V. – Ahlen",
      "type": "Registerbekanntmachung nach dem Umwandlungsgesetz",
      "state": "Nordrhein-Westfalen",
      "amtsgericht": "Amtsgericht Münster",
      "registernummer": "VR 50781",
      "registerart": "VR",
      "company_name": "Tönnishäuschen - Unser Dorf e.V.",
      "company_seat": "Ahlen",
      "details": "17.10.2025 (Bekanntmachungsdatum)\n\nNordrhein-Westfalen Amtsgericht Münster VR 50781\nRegisterbekanntmachung nach dem Umwandlungsgesetz 17.10.2025 (Eintragungsdatum)\n\nTönnishäuschen - Unser Dorf e.V.\neingetragener Verein\nAhlen\n\nDen Gläubigern der an der Verschmelzung beteiligten Rechtsträger ist, wenn sie binnen sechs Monaten nach dem Tag, an dem die Eintragung der Verschmelzung in das Register des Sitzes desjenigen Rechtsträgers, dessen Gläubiger sie sind, nach § 19 Absatz 3 UmwG als bekanntgemacht gilt, ihren Anspruch nach Grund und Höhe schriftlich anmelden, Sicherheit zu leisten, soweit sie nicht Befriedigung verlangen können. Dieses Recht steht den Gläubigern jedoch nur zu, wenn sie glaubhaft machen, dass durch die Verschmelzung die Erfüllung ihrer Forderung gefährdet wird."
    },
    {
      "date": "2025-10-17",
      "id": "134418",
      "original_text": "Registerbekanntmachung nach dem Umwandlungsgesetz\nNordrhein-Westfalen Amtsgericht Köln HRA 38225\nBayer Elektrotechnik e.K. – Overath",
      "type": "Registerbekanntmachung nach dem Umwandlungsgesetz",
      "state": "Nordrhein-Westfalen",
      "amtsgericht": "Amtsgericht Köln",
      "registernummer": "HRA 38225",
      "registerart": "HRA",
      "company_name": "Bayer Elektrotechnik e.K.",
      "company_seat": "Overath",
      "details": "17.10.2025 (Bekanntmachungsdatum)\n\nNordrhein-Westfalen Amtsgericht Köln HRA 38225\nRegisterbekanntmachung nach dem Umwandlungsgesetz 17.10.2025 (Eintragungsdatum)\n\nBayer Elektrotechnik e.K.\nEinzelkaufmann / Einzelkauffrau\nOverath\n\nDen Gläubigern der an der Ausgliederung beteiligten Rechtsträger ist, wenn sie binnen sechs Monaten nach dem Tag, an dem die Eintragung der Ausgliederung in das Register des Sitzes desjenigen Rechtsträgers, dessen Gläubiger sie sind, nach § 19 Absatz 3 UmwG als bekanntgemacht gilt, ihren Anspruch nach Grund und Höhe schriftlich anmelden, Sicherheit zu leisten, soweit sie nicht Befriedigung verlangen können. Dieses Recht steht den Gläubigern jedoch nur zu, wenn sie glaubhaft machen, dass durch die Ausgliederung die Erfüllung ihrer Forderung gefährdet wird."
    },
    {
      "date": "2025-10-17",
      "id": "134419",
      "original_text": "Registerbekanntmachung nach dem Umwandlungsgesetz\nThüringen Amtsgericht Jena HRB 209240\nANT Granowski GmbH – Rudolstadt",
      "type": "Registerbekanntmachung nach dem Umwandlungsgesetz",
      "state": "Thüringen",
      "amtsgericht": "Amtsgericht Jena",
      "registernummer": "HRB 209240",
      "registerart": "HRB",
      "company_name": "ANT Granowski GmbH",
      "company_seat": "Rudolstadt",
      "details": "17.10.2025 (Bekanntmachungsdatum)\n\nThüringen Amtsgericht Jena HRB 209240\nRegisterbekanntmachung nach dem Umwandlungsgesetz 17.10.2025 (Eintragungsdatum)\n\nANT Granowski GmbH\nGesellschaft mit beschränkter Haftung\nRudolstadt\n\nDie Gesellschaft ist auf Grund des Verschmelzungsvertrages vom 13.08.2025 sowie der Beschlüsse der Gesellschafterversammlungen vom selben Tag mit der Thüringer Netkom GmbH mit dem Sitz in Erfurt (Amtsgericht Jena HRB 108822) verschmolzen. Die Verschmelzung ist mit zeitgleicher Eintragung der Verschmelzung in das Handelsregister der übernehmenden Gesellschaft wirksam geworden.Tag der Eintragung: 17.10.2025\nNicht eingetragen: Den Gläubigern der an der Verschmelzung beteiligten Rechtsträger, ist wenn sie binnen sechs Monaten nach dem Tag, an dem die Eintragung der Verschmelzung in das Register des Sitzes desjenigen Rechtsträgers, dessen Gläubiger sie sind,  nach § 19 Abs. 3 UmwG als bekanntgemacht gilt, ihren Anspruch nach Grund und Höhe schriftlich anmelden, Sicherheit zu leisten, soweit sie nicht Befriedigung verlangen können. Dieses Recht steht ihnen jedoch nur zu, wenn sie glaubhaft machen, daß durch die Verschmelzung die Erfüllung ihrer Forderung gefährdet wird."
    },
    {
      "date": "2025-10-17",
      "id": "134420",
      "original_text": "Registerbekanntmachung nach dem Umwandlungsgesetz\nBaden-Württemberg Amtsgericht Stuttgart GnR 430002\nVolksbank Nordschwarzwald eG – Pfalzgrafenweiler und Altensteig",
      "type": "Registerbekanntmachung nach dem Umwandlungsgesetz",
      "state": "Baden-Württemberg",
      "amtsgericht": "Amtsgericht Stuttgart",
      "registernummer": "GnR 430002",
      "registerart": "GnR",
      "company_name": "Volksbank Nordschwarzwald eG",
      "company_seat": "Pfalzgrafenweiler und Altensteig",
      "details": "17.10.2025 (Bekanntmachungsdatum)\n\nBaden-Württemberg Amtsgericht Stuttgart GnR 430002\nRegisterbekanntmachung nach dem Umwandlungsgesetz 17.10.2025 (Eintragungsdatum)\n\nVolksbank Nordschwarzwald eG\neingetragene Genossenschaft\nPfalzgrafenweiler und Altensteig\n\nAls nicht eingetragen wird bekanntgemacht:\nDen Gläubigern der an der Verschmelzung beteiligten Rechtsträger ist, wenn sie binnen sechs Monaten nach dem Tag, an dem die Eintragung der Verschmelzung in das Register des Sitzes desjenigen Rechtsträgers, dessen Gläubiger sie sind, nach § 19 Abs. 3 UmwG als bekanntgemacht gilt, ihren Anspruch nach Grund und Höhe schriftlich anmelden, Sicherheit zu leisten, soweit sie nicht Befriedigung verlangen können. Dieses Recht steht den Gläubigern jedoch nur zu, wenn sie glaubhaft machen, dass durch die Verschmelzung die Erfüllung ihrer Forderung gefährdet wird."
    },
    {
      "date": "2025-10-17",
      "id": "134421",
      "original_text": "Löschungsankündigung\nHessen Amtsgericht Frankfurt am Main HRB 112024\nStoneX Financial Europe S.A. – Frankfurt am Main",
      "type": "Löschungsankündigung",
      "state": "Hessen",
      "amtsgericht": "Amtsgericht Frankfurt am Main",
      "registernummer": "HRB 112024",
      "registerart": "HRB",
      "company_name": "StoneX Financial Europe S.A.",
      "company_seat": "Frankfurt am Main",
      "details": "17.10.2025 (Bekanntmachungsdatum)\n\nHessen Amtsgericht Frankfurt am Main HRB 112024\nLöschungsankündigung\n\nStoneX Financial Europe S.A.\nRechtsform ausländischen Rechts HRB\nFrankfurt am Main\n\nDas Registergericht beabsichtigt die Zweigniederlassung im Handelsregister von Amts wegen nach § 395 FamFG zu löschen, weil die Hauptniederlassung in England erloschen ist. Die Frist zur Erhebung eines Widerspruchs gegen die beabsichtigte Löschung wird auf 1 Monat festgesetzt."
    },
    {
      "date": "2025-10-17",
      "id": "134422",
      "original_text": "Registerbekanntmachung nach dem Umwandlungsgesetz\nHessen Amtsgericht Bad Homburg v.d.H. HRB 17115\nSWJ Engineering GmbH – Oberursel (Taunus)",
      "type": "Registerbekanntmachung nach dem Umwandlungsgesetz",
      "state": "Hessen",
      "amtsgericht": "Amtsgericht Bad Homburg v.d.H.",
      "registernummer": "HRB 17115",
      "registerart": "HRB",
      "company_name": "SWJ Engineering GmbH",
      "company_seat": "Oberursel (Taunus)",
      "details": "17.10.2025 (Bekanntmachungsdatum)\n\nHessen Amtsgericht Bad Homburg v.d.H. HRB 17115\nRegisterbekanntmachung nach dem Umwandlungsgesetz 17.10.2025 (Eintragungsdatum)\n\nSWJ Engineering GmbH\nGesellschaft mit beschränkter Haftung\nOberursel (Taunus)\n\nDen Gläubigern der an der Verschmelzung beteiligten Rechtsträger ist, wenn sie binnen sechs Monaten nach dem Tag, an dem die Eintragung der Verschmelzung in das Register des Sitzes desjenigen Rechtsträgers, dessen Gläubiger sie sind, nach § 19 Absatz 3 UmwG bekannt gemacht worden ist, ihren Anspruch nach Grund und Höhe schriftlich anmelden, Sicherheit zu leisten, soweit sie nicht Befriedigung verlangen können. Dieses Recht steht den Gläubigern jedoch nur zu, wenn sie glaubhaft machen, dass durch die Verschmelzung die Erfüllung ihrer Forderung gefährdet wird."
    },
    {
      "date": "2025-10-17",
      "id": "134423",
      "original_text": "Löschungsankündigung\nHessen Amtsgericht Hanau HRB 99346\nRio Bau GmbH – Hanau",
      "type": "Löschungsankündigung",
      "state": "Hessen",
      "amtsgericht": "Amtsgericht Hanau",
      "registernummer": "HRB 99346",
      "registerart": "HRB",
      "company_name": "Rio Bau GmbH",
      "company_seat": "Hanau",
      "details": "17.10.2025 (Bekanntmachungsdatum)\n\nHessen Amtsgericht Hanau HRB 99346\nLöschungsankündigung\n\nRio Bau GmbH\nGesellschaft mit beschränkter Haftung\nHanau\n\nDas Registergericht beabsichtigt die im Handelsregister eingetragene Gesellschaft von Amts wegen nach § 394 FamFG zu löschen. Die Frist zur Erhebung eines Widerspruchs gegen die beabsichtigte Löschung wird auf 3 Monate festgesetzt."
    },
    {
      "date": "2025-10-17",
      "id": "134424",
      "original_text": "Sonstige Registerbekanntmachung\nHessen Amtsgericht Hanau HRB 97646\nArgentum Komplementär GmbH – Hanau",
      "type": "Sonstige Registerbekanntmachung",
      "state": "Hessen",
      "amtsgericht": "Amtsgericht Hanau",
      "registernummer": "HRB 97646",
      "registerart": "HRB",
      "company_name": "Argentum Komplementär GmbH",
      "company_seat": "Hanau",
      "details": "17.10.2025 (Bekanntmachungsdatum)\n\nHessen Amtsgericht Hanau HRB 97646\nSonstige Registerbekanntmachung 17.10.2025 (Eintragungsdatum)\n\nArgentum Komplementär GmbH\nGesellschaft mit beschränkter Haftung\nHanau\n\nDen Gläubigern der Gesellschaft, deren Forderungen begründet worden sind, bevor die Eintragung der Beendigung des Vertrags in das Handelsregister nach § 10 HGB bekannt gemacht worden ist, ist vom anderen Vertragsteil Sicherheit zu leisten, wenn sie sich binnen sechs Monaten nach dieser Bekanntmachung zu diesem Zweck bei ihm melden."
    },
    {
      "date": "2025-10-17",
      "id": "134425",
      "original_text": "Einreichung neuer Dokumente\nHessen Amtsgericht Darmstadt HRB 91482\nalpha centauri beta Aktiengesellschaft – Darmstadt",
      "type": "Einreichung neuer Dokumente",
      "state": "Hessen",
      "amtsgericht": "Amtsgericht Darmstadt",
      "registernummer": "HRB 91482",
      "registerart": "HRB",
      "company_name": "alpha centauri beta Aktiengesellschaft",
      "company_seat": "Darmstadt",
      "details": "17.10.2025 (Bekanntmachungsdatum)\n\nHessen Amtsgericht Darmstadt HRB 91482\nEinreichung neuer Dokumente\n\nalpha centauri beta Aktiengesellschaft\nAktiengesellschaft\nDarmstadt\n\nWegen Änderungen in den Personen der Aufsichtsratsmitglieder ist eine Liste der Mitglieder des Aufsichtsrates zum Handelsregister eingereicht worden."
    },
    {
      "date": "2025-10-17",
      "id": "134426",
      "original_text": "Einreichung neuer Dokumente\nHessen Amtsgericht Frankfurt am Main HRB 34040\nDPG Deutsche Performancemessungs-Gesellschaft für Wertpapierportfolios mbH – Frankfurt am Main",
      "type": "Einreichung neuer Dokumente",
      "state": "Hessen",
      "amtsgericht": "Amtsgericht Frankfurt am Main",
      "registernummer": "HRB 34040",
      "registerart": "HRB",
      "company_name": "DPG Deutsche Performancemessungs-Gesellschaft für Wertpapierportfolios mbH",
      "company_seat": "Frankfurt am Main",
      "details": "17.10.2025 (Bekanntmachungsdatum)\n\nHessen Amtsgericht Frankfurt am Main HRB 34040\nEinreichung neuer Dokumente 17.10.2025 (Eintragungsdatum)\n\nDPG Deutsche Performancemessungs-Gesellschaft für Wertpapierportfolios mbH\nGesellschaft mit beschränkter Haftung\nFrankfurt am Main\n\nDurch eine Änderung in den Personen der Beiratsratsmitglieder ist eine Liste der Mitglieder des Beirates zum Handelsregister eingereicht worden."
    },
    {
      "date": "2025-10-17",
      "id": "134427",
      "original_text": "Löschungsankündigung\nHessen Amtsgericht Hanau HRB 97097\nMargho Handels GmbH – Hanau",
      "type": "Löschungsankündigung",
      "state": "Hessen",
      "amtsgericht": "Amtsgericht Hanau",
      "registernummer": "HRB 97097",
      "registerart": "HRB",
      "company_name": "Margho Handels GmbH",
      "company_seat": "Hanau",
      "details": "17.10.2025 (Bekanntmachungsdatum)\n\nHessen Amtsgericht Hanau HRB 97097\nLöschungsankündigung\n\nMargho Handels GmbH\nGesellschaft mit beschränkter Haftung\nHanau\n\nDas Registergericht beabsichtigt die im Handelsregister eingetragene Gesellschaft von Amts wegen nach § 394 FamFG zu löschen. Die Frist zur Erhebung eines Widerspruchs gegen die beabsichtigte Löschung wird auf 3 Monate festgesetzt."
    }
  ]
}