{
  "date": "2025-10-24",
  "date_of_scrape": "2025-10-27T20:14:12.262Z",
  "tool_version": "0.2.0",
  "number_of_announcements": 162,
  "announcements": [
    {
      "date": "2025-10-24",
      "id": "135136",
      "original_text": "Registerbekanntmachung nach dem Umwandlungsgesetz\nBayern Amtsgericht Nürnberg HRA 20404\nJürgen Rößner Besitz + Vermietung e.K. – Wendelstein",
      "type": "Registerbekanntmachung nach dem Umwandlungsgesetz",
      "state": "Bayern",
      "amtsgericht": "Amtsgericht Nürnberg",
      "registernummer": "HRA 20404",
      "registerart": "HRA",
      "company_name": "Jürgen Rößner Besitz + Vermietung e.K.",
      "company_seat": "Wendelstein",
      "details": "24.10.2025 (Bekanntmachungsdatum)\n\nBayern Amtsgericht Nürnberg HRA 20404\nRegisterbekanntmachung nach dem Umwandlungsgesetz 24.10.2025 (Eintragungsdatum)\n\nJürgen Rößner Besitz + Vermietung e.K.\nEinzelkaufmann / Einzelkauffrau\nWendelstein\n\nDen Gläubigern der an der Ausgliederung beteiligten Rechtsträger ist, wenn sie binnen sechs Monaten nach dem Tag, an dem die Eintragung der Ausgliederung in das Register des Sitzes desjenigen Rechtsträgers, dessen Gläubiger sie sind, nach §§ 125, 19 Abs. 3 UmwG als bekannt gemacht gilt, ihren Anspruch nach Grund und Höhe in Textform anmelden, Sicherheit zu leisten, soweit sie nicht Befriedigung verlangen können. Dieses Recht steht den Gläubigern jedoch nur zu, wenn sie glaubhaft machen, dass durch die Ausgliederung die Erfüllung ihrer Forderung gefährdet wird."
    },
    {
      "date": "2025-10-24",
      "id": "135137",
      "original_text": "Einreichung neuer Dokumente\nBayern Amtsgericht Ingolstadt HRB 101008\nBAUER Spezialtiefbau GmbH – Schrobenhausen",
      "type": "Einreichung neuer Dokumente",
      "state": "Bayern",
      "amtsgericht": "Amtsgericht Ingolstadt",
      "registernummer": "HRB 101008",
      "registerart": "HRB",
      "company_name": "BAUER Spezialtiefbau GmbH",
      "company_seat": "Schrobenhausen",
      "details": "24.10.2025 (Bekanntmachungsdatum)\n\nBayern Amtsgericht Ingolstadt HRB 101008\nEinreichung neuer Dokumente\n\nBAUER Spezialtiefbau GmbH\nGesellschaft mit beschränkter Haftung\nSchrobenhausen\n\nDem Amtsgericht Ingolstadt -Registergericht- ist eine Liste der Mitglieder des Aufsichtsrats eingereicht worden, § 52 Abs. 3 S. 2 GmbHG."
    },
    {
      "date": "2025-10-24",
      "id": "135138",
      "original_text": "Registerbekanntmachung nach dem Umwandlungsgesetz\nBayern Amtsgericht Nürnberg HRB 29057\nDESS UG (haftungsbeschränkt) – Burgthann",
      "type": "Registerbekanntmachung nach dem Umwandlungsgesetz",
      "state": "Bayern",
      "amtsgericht": "Amtsgericht Nürnberg",
      "registernummer": "HRB 29057",
      "registerart": "HRB",
      "company_name": "DESS UG (haftungsbeschränkt)",
      "company_seat": "Burgthann",
      "details": "24.10.2025 (Bekanntmachungsdatum)\n\nBayern Amtsgericht Nürnberg HRB 29057\nRegisterbekanntmachung nach dem Umwandlungsgesetz 23.10.2025 (Eintragungsdatum)\n\nDESS UG (haftungsbeschränkt)\nGesellschaft mit beschränkter Haftung\nBurgthann\n\nDen Gläubigern der an der Verschmelzung beteiligten Rechtsträger ist, wenn sie binnen sechs Monaten nach dem Tag, an dem die Eintragung der Verschmelzung in das Register des Sitzes desjenigen Rechtsträgers, dessen Gläubiger sie sind, nach § 19 Abs. 3 UmwG als bekannt gemacht gilt, ihren Anspruch nach Grund und Höhe in Textform anmelden, Sicherheit zu leisten, soweit sie nicht Befriedigung verlangen können. Dieses Recht steht den Gläubigern jedoch nur zu, wenn sie glaubhaft machen, dass durch die Verschmelzung die Erfüllung ihrer Forderung gefährdet wird."
    },
    {
      "date": "2025-10-24",
      "id": "135139",
      "original_text": "Löschungsankündigung\nBayern Amtsgericht Coburg HRB 1596\nSchreinerei Seidl GmbH – Kronach",
      "type": "Löschungsankündigung",
      "state": "Bayern",
      "amtsgericht": "Amtsgericht Coburg",
      "registernummer": "HRB 1596",
      "registerart": "HRB",
      "company_name": "Schreinerei Seidl GmbH",
      "company_seat": "Kronach",
      "details": "24.10.2025 (Bekanntmachungsdatum)\n\nBayern Amtsgericht Coburg HRB 1596\nLöschungsankündigung 20.10.2025 (Eintragungsdatum)\n\nSchreinerei Seidl GmbH\nGesellschaft mit beschränkter Haftung\nKronach\n\nDas Registergericht beabsichtigt, die im Handelsregister eingetragene Gesellschaft wegen Vermögenslosigkeit von Amts wegen nach § 394 FamFG zu löschen. Die Frist zur Erhebung eines Widerspruchs ist auf sechs Wochen festgesetzt."
    },
    {
      "date": "2025-10-24",
      "id": "135140",
      "original_text": "Registerbekanntmachung nach dem Umwandlungsgesetz\nBayern Amtsgericht Deggendorf HRA 3739\nSchuh Oswald Regen e.K. – Regen",
      "type": "Registerbekanntmachung nach dem Umwandlungsgesetz",
      "state": "Bayern",
      "amtsgericht": "Amtsgericht Deggendorf",
      "registernummer": "HRA 3739",
      "registerart": "HRA",
      "company_name": "Schuh Oswald Regen e.K.",
      "company_seat": "Regen",
      "details": "24.10.2025 (Bekanntmachungsdatum)\n\nBayern Amtsgericht Deggendorf HRA 3739\nRegisterbekanntmachung nach dem Umwandlungsgesetz 23.10.2025 (Eintragungsdatum)\n\nSchuh Oswald Regen e.K.\nEinzelkaufmann / Einzelkauffrau\nRegen\n\nDen Gläubigern der an der Verschmelzung beteiligten Rechtsträger ist, wenn sie binnen sechs Monaten nach dem Tag, an dem die Eintragung der Verschmelzung in das Register des Sitzes desjenigen Rechtsträgers, dessen Gläubiger sie sind, nach § 19 Abs. 3 UmwG als bekannt gemacht gilt, ihren Anspruch nach Grund und Höhe in Textform anmelden, Sicherheit zu leisten, soweit sie nicht Befriedigung verlangen können. Dieses Recht steht den Gläubigern jedoch nur zu, wenn sie glaubhaft machen, dass durch die Verschmelzung die Erfüllung ihrer Forderung gefährdet wird."
    },
    {
      "date": "2025-10-24",
      "id": "135141",
      "original_text": "Löschungsankündigung\nBayern Amtsgericht München HRB 182975\nYou! Life Productions GmbH – München",
      "type": "Löschungsankündigung",
      "state": "Bayern",
      "amtsgericht": "Amtsgericht München",
      "registernummer": "HRB 182975",
      "registerart": "HRB",
      "company_name": "You! Life Productions GmbH",
      "company_seat": "München",
      "details": "24.10.2025 (Bekanntmachungsdatum)\n\nBayern Amtsgericht München HRB 182975\nLöschungsankündigung\n\nYou! Life Productions GmbH\nGesellschaft mit beschränkter Haftung\nMünchen\n\nDas Registergericht beabsichtigt, die im Handelsregister eingetragene Gesellschaft wegen Vermögenslosigkeit von Amts wegen nach § 394 FamFG zu löschen. Die Frist zur Erhebung eines Widerspruchs ist auf drei Monate festgesetzt."
    },
    {
      "date": "2025-10-24",
      "id": "135142",
      "original_text": "Registerbekanntmachung nach dem Umwandlungsgesetz\nBayern Amtsgericht Deggendorf HRB 444\nSchuh-Oswald-GmbH – Regen",
      "type": "Registerbekanntmachung nach dem Umwandlungsgesetz",
      "state": "Bayern",
      "amtsgericht": "Amtsgericht Deggendorf",
      "registernummer": "HRB 444",
      "registerart": "HRB",
      "company_name": "Schuh-Oswald-GmbH",
      "company_seat": "Regen",
      "details": "24.10.2025 (Bekanntmachungsdatum)\n\nBayern Amtsgericht Deggendorf HRB 444\nRegisterbekanntmachung nach dem Umwandlungsgesetz 23.10.2025 (Eintragungsdatum)\n\nSchuh-Oswald-GmbH\nGesellschaft mit beschränkter Haftung\nRegen\n\nDen Gläubigern der an der Verschmelzung beteiligten Rechtsträger ist, wenn sie binnen sechs Monaten nach dem Tag, an dem die Eintragung der Verschmelzung in das Register des Sitzes desjenigen Rechtsträgers, dessen Gläubiger sie sind, nach § 19 Abs. 3 UmwG als bekannt gemacht gilt, ihren Anspruch nach Grund und Höhe in Textform anmelden, Sicherheit zu leisten, soweit sie nicht Befriedigung verlangen können. Dieses Recht steht den Gläubigern jedoch nur zu, wenn sie glaubhaft machen, dass durch die Verschmelzung die Erfüllung ihrer Forderung gefährdet wird."
    },
    {
      "date": "2025-10-24",
      "id": "135143",
      "original_text": "Einreichung neuer Dokumente\nBayern Amtsgericht München HRB 162836\nAllianz Capital Partners GmbH – München",
      "type": "Einreichung neuer Dokumente",
      "state": "Bayern",
      "amtsgericht": "Amtsgericht München",
      "registernummer": "HRB 162836",
      "registerart": "HRB",
      "company_name": "Allianz Capital Partners GmbH",
      "company_seat": "München",
      "details": "24.10.2025 (Bekanntmachungsdatum)\n\nBayern Amtsgericht München HRB 162836\nEinreichung neuer Dokumente\n\nAllianz Capital Partners GmbH\nGesellschaft mit beschränkter Haftung\nMünchen\n\nDem Amtsgericht München -Registergericht- ist eine Liste der Mitglieder des Aufsichtsrats eingereicht worden, § 52 Abs. 3 S. 2 GmbHG."
    },
    {
      "date": "2025-10-24",
      "id": "135144",
      "original_text": "Registerbekanntmachung nach dem Umwandlungsgesetz\nBayern Amtsgericht München HRB 196149\nSplunk Services Germany GmbH – München",
      "type": "Registerbekanntmachung nach dem Umwandlungsgesetz",
      "state": "Bayern",
      "amtsgericht": "Amtsgericht München",
      "registernummer": "HRB 196149",
      "registerart": "HRB",
      "company_name": "Splunk Services Germany GmbH",
      "company_seat": "München",
      "details": "24.10.2025 (Bekanntmachungsdatum)\n\nBayern Amtsgericht München HRB 196149\nRegisterbekanntmachung nach dem Umwandlungsgesetz 23.10.2025 (Eintragungsdatum)\n\nSplunk Services Germany GmbH\nGesellschaft mit beschränkter Haftung\nMünchen\n\nDen Gläubigern der an der Verschmelzung beteiligten Rechtsträger ist, wenn sie binnen sechs Monaten nach dem Tag, an dem die Eintragung der Verschmelzung in das Register des Sitzes desjenigen Rechtsträgers, dessen Gläubiger sie sind, nach § 19 Abs. 3 UmwG als bekannt gemacht gilt, ihren Anspruch nach Grund und Höhe in Textform anmelden, Sicherheit zu leisten, soweit sie nicht Befriedigung verlangen können. Dieses Recht steht den Gläubigern jedoch nur zu, wenn sie glaubhaft machen, dass durch die Verschmelzung die Erfüllung ihrer Forderung gefährdet wird."
    },
    {
      "date": "2025-10-24",
      "id": "135145",
      "original_text": "Registerbekanntmachung nach dem Umwandlungsgesetz\nBayern Amtsgericht Fürth HRA 12632\nS&P Objektbeteiligungs DREI GmbH & Co. KG – Erlangen",
      "type": "Registerbekanntmachung nach dem Umwandlungsgesetz",
      "state": "Bayern",
      "amtsgericht": "Amtsgericht Fürth",
      "registernummer": "HRA 12632",
      "registerart": "HRA",
      "company_name": "S&P Objektbeteiligungs DREI GmbH & Co. KG",
      "company_seat": "Erlangen",
      "details": "24.10.2025 (Bekanntmachungsdatum)\n\nBayern Amtsgericht Fürth HRA 12632\nRegisterbekanntmachung nach dem Umwandlungsgesetz 23.10.2025 (Eintragungsdatum)\n\nS&P Objektbeteiligungs DREI GmbH & Co. KG\nKommanditgesellschaft\nErlangen\n\nDen Gläubigern des formwechselnden Rechtsträgers ist, wenn sie binnen sechs Monaten nach dem Tag, an dem die Eintragung des Formwechsels nach § 201 UmwG als bekannt gemacht gilt, ihren Anspruch nach Grund und Höhe in Textform anmelden, Sicherheit zu leisten, soweit sie nicht Befriedigung verlangen können. Dieses Recht steht den Gläubigern jedoch nur zu, wenn sie glaubhaft machen, dass durch den Formwechsel die Erfüllung ihrer Forderung gefährdet wird."
    },
    {
      "date": "2025-10-24",
      "id": "135146",
      "original_text": "Registerbekanntmachung nach dem Umwandlungsgesetz\nBayern Amtsgericht Fürth HRB 15446\nS&P Objektbeteiligungs DREI GmbH – Erlangen",
      "type": "Registerbekanntmachung nach dem Umwandlungsgesetz",
      "state": "Bayern",
      "amtsgericht": "Amtsgericht Fürth",
      "registernummer": "HRB 15446",
      "registerart": "HRB",
      "company_name": "S&P Objektbeteiligungs DREI GmbH",
      "company_seat": "Erlangen",
      "details": "24.10.2025 (Bekanntmachungsdatum)\n\nBayern Amtsgericht Fürth HRB 15446\nRegisterbekanntmachung nach dem Umwandlungsgesetz 23.10.2025 (Eintragungsdatum)\n\nS&P Objektbeteiligungs DREI GmbH\nGesellschaft mit beschränkter Haftung\nErlangen\n\nDen Gläubigern des formwechselnden Rechtsträgers ist, wenn sie binnen sechs Monaten nach dem Tag, an dem die Eintragung des Formwechsels nach § 201 UmwG als bekannt gemacht gilt, ihren Anspruch nach Grund und Höhe in Textform anmelden, Sicherheit zu leisten, soweit sie nicht Befriedigung verlangen können. Dieses Recht steht den Gläubigern jedoch nur zu, wenn sie glaubhaft machen, dass durch den Formwechsel die Erfüllung ihrer Forderung gefährdet wird."
    },
    {
      "date": "2025-10-24",
      "id": "135147",
      "original_text": "Registerbekanntmachung nach dem Umwandlungsgesetz\nBayern Amtsgericht Fürth HRB 22150\nAWO Therapiezentrum \"Sachsengrund\" Diespeck GmbH – Diespeck",
      "type": "Registerbekanntmachung nach dem Umwandlungsgesetz",
      "state": "Bayern",
      "amtsgericht": "Amtsgericht Fürth",
      "registernummer": "HRB 22150",
      "registerart": "HRB",
      "company_name": "AWO Therapiezentrum \"Sachsengrund\" Diespeck GmbH",
      "company_seat": "Diespeck",
      "details": "24.10.2025 (Bekanntmachungsdatum)\n\nBayern Amtsgericht Fürth HRB 22150\nRegisterbekanntmachung nach dem Umwandlungsgesetz 23.10.2025 (Eintragungsdatum)\n\nAWO Therapiezentrum \"Sachsengrund\" Diespeck GmbH\nGesellschaft mit beschränkter Haftung\nDiespeck\n\nDen Gläubigern der an der Ausgliederung beteiligten Rechtsträger ist, wenn sie binnen sechs Monaten nach dem Tag, an dem die Eintragung der Ausgliederung in das Register des Sitzes desjenigen Rechtsträgers, dessen Gläubiger sie sind, nach §§ 125, 19 Abs. 3 UmwG als bekannt gemacht gilt, ihren Anspruch nach Grund und Höhe in Textform anmelden, Sicherheit zu leisten, soweit sie nicht Befriedigung verlangen können. Dieses Recht steht den Gläubigern jedoch nur zu, wenn sie glaubhaft machen, dass durch die Ausgliederung die Erfüllung ihrer Forderung gefährdet wird."
    },
    {
      "date": "2025-10-24",
      "id": "135148",
      "original_text": "Einreichung neuer Dokumente\nBayern Amtsgericht Nürnberg HRB 40349\nfintegra Holding AG – Nürnberg",
      "type": "Einreichung neuer Dokumente",
      "state": "Bayern",
      "amtsgericht": "Amtsgericht Nürnberg",
      "registernummer": "HRB 40349",
      "registerart": "HRB",
      "company_name": "fintegra Holding AG",
      "company_seat": "Nürnberg",
      "details": "24.10.2025 (Bekanntmachungsdatum)\n\nBayern Amtsgericht Nürnberg HRB 40349\nEinreichung neuer Dokumente\n\nfintegra Holding AG\nAktiengesellschaft\nNürnberg\n\nDem Amtsgericht Nürnberg -Registergericht- ist eine Liste der Mitglieder des Aufsichtsrats eingereicht worden, § 106 AktG."
    },
    {
      "date": "2025-10-24",
      "id": "135149",
      "original_text": "Löschungsankündigung\nBayern Amtsgericht München HRB 83496\nImpeco Import - Export GmbH – München",
      "type": "Löschungsankündigung",
      "state": "Bayern",
      "amtsgericht": "Amtsgericht München",
      "registernummer": "HRB 83496",
      "registerart": "HRB",
      "company_name": "Impeco Import - Export GmbH",
      "company_seat": "München",
      "details": "24.10.2025 (Bekanntmachungsdatum)\n\nBayern Amtsgericht München HRB 83496\nLöschungsankündigung\n\nImpeco Import - Export GmbH\nGesellschaft mit beschränkter Haftung\nMünchen\n\nDas Registergericht beabsichtigt, die im Handelsregister eingetragene Gesellschaft wegen Vermögenslosigkeit von Amts wegen nach § 394 FamFG zu löschen. Die Frist zur Erhebung eines Widerspruchs ist auf drei Monate festgesetzt."
    },
    {
      "date": "2025-10-24",
      "id": "135150",
      "original_text": "Löschungsankündigung\nBayern Amtsgericht Traunstein HRB 29111\nOans A Reparatur GmbH – Tuntenhausen OT Ostermünchen",
      "type": "Löschungsankündigung",
      "state": "Bayern",
      "amtsgericht": "Amtsgericht Traunstein",
      "registernummer": "HRB 29111",
      "registerart": "HRB",
      "company_name": "Oans A Reparatur GmbH",
      "company_seat": "Tuntenhausen OT Ostermünchen",
      "details": "24.10.2025 (Bekanntmachungsdatum)\n\nBayern Amtsgericht Traunstein HRB 29111\nLöschungsankündigung\n\nOans A Reparatur GmbH\nGesellschaft mit beschränkter Haftung\nTuntenhausen OT Ostermünchen\n\nDas Registergericht beabsichtigt, die im Handelsregister eingetragene Gesellschaft wegen Vermögenslosigkeit von Amts wegen nach § 394 FamFG zu löschen. Die Frist zur Erhebung eines Widerspruchs ist auf einen Monat festgesetzt."
    },
    {
      "date": "2025-10-24",
      "id": "135151",
      "original_text": "Löschungsankündigung\nBayern Amtsgericht München HRB 214839\nMedical Partners Verwaltungs- UG (haftungsbeschränkt) – München",
      "type": "Löschungsankündigung",
      "state": "Bayern",
      "amtsgericht": "Amtsgericht München",
      "registernummer": "HRB 214839",
      "registerart": "HRB",
      "company_name": "Medical Partners Verwaltungs- UG (haftungsbeschränkt)",
      "company_seat": "München",
      "details": "24.10.2025 (Bekanntmachungsdatum)\n\nBayern Amtsgericht München HRB 214839\nLöschungsankündigung 21.10.2025 (Eintragungsdatum)\n\nMedical Partners Verwaltungs- UG (haftungsbeschränkt)\nGesellschaft mit beschränkter Haftung\nMünchen\n\nDas Registergericht beabsichtigt, die im Handelsregister eingetragene Gesellschaft wegen Vermögenslosigkeit von Amts wegen nach § 394 FamFG zu löschen. Die Frist zur Erhebung eines Widerspruchs ist auf drei Monate festgesetzt."
    },
    {
      "date": "2025-10-24",
      "id": "135152",
      "original_text": "Löschungsankündigung\nBayern Amtsgericht Kempten (Allgäu) HRB 15931\nR & G Elektro GmbH – Kaufbeuren",
      "type": "Löschungsankündigung",
      "state": "Bayern",
      "amtsgericht": "Amtsgericht Kempten (Allgäu)",
      "registernummer": "HRB 15931",
      "registerart": "HRB",
      "company_name": "R & G Elektro GmbH",
      "company_seat": "Kaufbeuren",
      "details": "24.10.2025 (Bekanntmachungsdatum)\n\nBayern Amtsgericht Kempten (Allgäu) HRB 15931\nLöschungsankündigung\n\nR & G Elektro GmbH\nGesellschaft mit beschränkter Haftung\nKaufbeuren\n\nDas Registergericht beabsichtigt, die im Handelsregister eingetragene Gesellschaft wegen Vermögenslosigkeit von Amts wegen nach § 394 FamFG zu löschen. Die Frist zur Erhebung eines Widerspruchs ist auf einen Monat festgesetzt."
    },
    {
      "date": "2025-10-24",
      "id": "135153",
      "original_text": "Einreichung neuer Dokumente\nBayern Amtsgericht München HRB 227195\nAllane SE – Garching",
      "type": "Einreichung neuer Dokumente",
      "state": "Bayern",
      "amtsgericht": "Amtsgericht München",
      "registernummer": "HRB 227195",
      "registerart": "HRB",
      "company_name": "Allane SE",
      "company_seat": "Garching",
      "details": "24.10.2025 (Bekanntmachungsdatum)\n\nBayern Amtsgericht München HRB 227195\nEinreichung neuer Dokumente\n\nAllane SE\nEuropäische Aktiengesellschaft (SE)\nGarching\n\nDem Amtsgericht München -Registergericht- ist eine Liste der Mitglieder des Aufsichtsrats eingereicht worden, Art. 9 Abs. 1 Buchst. c (ii) SE-VO i.V.m. § 106 AktG."
    },
    {
      "date": "2025-10-24",
      "id": "135154",
      "original_text": "Löschungsankündigung\nBayern Amtsgericht Traunstein HRB 28292\nEco777 Deutsche Schuldnerberatung UG (haftungsbeschränkt) – Freilassing",
      "type": "Löschungsankündigung",
      "state": "Bayern",
      "amtsgericht": "Amtsgericht Traunstein",
      "registernummer": "HRB 28292",
      "registerart": "HRB",
      "company_name": "Eco777 Deutsche Schuldnerberatung UG (haftungsbeschränkt)",
      "company_seat": "Freilassing",
      "details": "24.10.2025 (Bekanntmachungsdatum)\n\nBayern Amtsgericht Traunstein HRB 28292\nLöschungsankündigung\n\nEco777 Deutsche Schuldnerberatung UG (haftungsbeschränkt)\nGesellschaft mit beschränkter Haftung\nFreilassing\n\nDas Registergericht beabsichtigt, die im Handelsregister eingetragene Gesellschaft wegen Vermögenslosigkeit von Amts wegen nach § 394 FamFG zu löschen. Die Frist zur Erhebung eines Widerspruchs ist auf einen Monat festgesetzt."
    },
    {
      "date": "2025-10-24",
      "id": "135155",
      "original_text": "Registerbekanntmachung nach dem Umwandlungsgesetz\nBayern Amtsgericht Nürnberg HRB 32877\nSpectralliance Holding GmbH – Nürnberg",
      "type": "Registerbekanntmachung nach dem Umwandlungsgesetz",
      "state": "Bayern",
      "amtsgericht": "Amtsgericht Nürnberg",
      "registernummer": "HRB 32877",
      "registerart": "HRB",
      "company_name": "Spectralliance Holding GmbH",
      "company_seat": "Nürnberg",
      "details": "24.10.2025 (Bekanntmachungsdatum)\n\nBayern Amtsgericht Nürnberg HRB 32877\nRegisterbekanntmachung nach dem Umwandlungsgesetz 23.10.2025 (Eintragungsdatum)\n\nSpectralliance Holding GmbH\nGesellschaft mit beschränkter Haftung\nNürnberg\n\nDen Gläubigern der an der Verschmelzung beteiligten Rechtsträger ist, wenn sie binnen sechs Monaten nach dem Tag, an dem die Eintragung der Verschmelzung in das Register des Sitzes desjenigen Rechtsträgers, dessen Gläubiger sie sind, nach § 19 Abs. 3 UmwG als bekannt gemacht gilt, ihren Anspruch nach Grund und Höhe in Textform anmelden, Sicherheit zu leisten, soweit sie nicht Befriedigung verlangen können. Dieses Recht steht den Gläubigern jedoch nur zu, wenn sie glaubhaft machen, dass durch die Verschmelzung die Erfüllung ihrer Forderung gefährdet wird."
    },
    {
      "date": "2025-10-24",
      "id": "135156",
      "original_text": "Löschungsankündigung\nBayern Amtsgericht Traunstein HRB 30790\nArt & Drive GmbH – Neuötting",
      "type": "Löschungsankündigung",
      "state": "Bayern",
      "amtsgericht": "Amtsgericht Traunstein",
      "registernummer": "HRB 30790",
      "registerart": "HRB",
      "company_name": "Art & Drive GmbH",
      "company_seat": "Neuötting",
      "details": "24.10.2025 (Bekanntmachungsdatum)\n\nBayern Amtsgericht Traunstein HRB 30790\nLöschungsankündigung\n\nArt & Drive GmbH\nGesellschaft mit beschränkter Haftung\nNeuötting\n\nDas Registergericht beabsichtigt, die im Handelsregister eingetragene Gesellschaft wegen Vermögenslosigkeit auf Antrag des Finanzamts nach § 394 FamFG zu löschen. Die Frist zur Erhebung eines Widerspruchs ist auf einen Monat festgesetzt."
    },
    {
      "date": "2025-10-24",
      "id": "135157",
      "original_text": "Registerbekanntmachung nach dem Umwandlungsgesetz\nBayern Amtsgericht Nürnberg HRB 24160\nPhysiotherapeuten/Manualtherapeuten Praxis Klages und Kollegen GmbH – Nürnberg",
      "type": "Registerbekanntmachung nach dem Umwandlungsgesetz",
      "state": "Bayern",
      "amtsgericht": "Amtsgericht Nürnberg",
      "registernummer": "HRB 24160",
      "registerart": "HRB",
      "company_name": "Physiotherapeuten/Manualtherapeuten Praxis Klages und Kollegen GmbH",
      "company_seat": "Nürnberg",
      "details": "24.10.2025 (Bekanntmachungsdatum)\n\nBayern Amtsgericht Nürnberg HRB 24160\nRegisterbekanntmachung nach dem Umwandlungsgesetz 23.10.2025 (Eintragungsdatum)\n\nPhysiotherapeuten/Manualtherapeuten Praxis Klages und Kollegen GmbH\nGesellschaft mit beschränkter Haftung\nNürnberg\n\nDen Gläubigern der an der Verschmelzung beteiligten Rechtsträger ist, wenn sie binnen sechs Monaten nach dem Tag, an dem die Eintragung der Verschmelzung in das Register des Sitzes desjenigen Rechtsträgers, dessen Gläubiger sie sind, nach § 19 Abs. 3 UmwG als bekannt gemacht gilt, ihren Anspruch nach Grund und Höhe in Textform anmelden, Sicherheit zu leisten, soweit sie nicht Befriedigung verlangen können. Dieses Recht steht den Gläubigern jedoch nur zu, wenn sie glaubhaft machen, dass durch die Verschmelzung die Erfüllung ihrer Forderung gefährdet wird."
    },
    {
      "date": "2025-10-24",
      "id": "135158",
      "original_text": "Löschungsankündigung\nBayern Amtsgericht Kempten (Allgäu) HRB 8824\nALLGÄU SERVICE Fachbetrieb für Hygienetechnik GmbH – Kempten (Allgäu)",
      "type": "Löschungsankündigung",
      "state": "Bayern",
      "amtsgericht": "Amtsgericht Kempten (Allgäu)",
      "registernummer": "HRB 8824",
      "registerart": "HRB",
      "company_name": "ALLGÄU SERVICE Fachbetrieb für Hygienetechnik GmbH",
      "company_seat": "Kempten (Allgäu)",
      "details": "24.10.2025 (Bekanntmachungsdatum)\n\nBayern Amtsgericht Kempten (Allgäu) HRB 8824\nLöschungsankündigung\n\nALLGÄU SERVICE Fachbetrieb für Hygienetechnik GmbH\nGesellschaft mit beschränkter Haftung\nKempten (Allgäu)\n\nDas Registergericht beabsichtigt, die im Handelsregister eingetragene Gesellschaft wegen Vermögenslosigkeit von Amts wegen nach § 394 FamFG zu löschen. Die Frist zur Erhebung eines Widerspruchs ist auf einen Monat festgesetzt."
    },
    {
      "date": "2025-10-24",
      "id": "135159",
      "original_text": "Registerbekanntmachung nach dem Umwandlungsgesetz\nBayern Amtsgericht Nürnberg HRA 20248\nLeRö Besitz GmbH & Co. KG – Wendelstein",
      "type": "Registerbekanntmachung nach dem Umwandlungsgesetz",
      "state": "Bayern",
      "amtsgericht": "Amtsgericht Nürnberg",
      "registernummer": "HRA 20248",
      "registerart": "HRA",
      "company_name": "LeRö Besitz GmbH & Co. KG",
      "company_seat": "Wendelstein",
      "details": "24.10.2025 (Bekanntmachungsdatum)\n\nBayern Amtsgericht Nürnberg HRA 20248\nRegisterbekanntmachung nach dem Umwandlungsgesetz 23.10.2025 (Eintragungsdatum)\n\nLeRö Besitz GmbH & Co. KG\nKommanditgesellschaft\nWendelstein\n\nDen Gläubigern der an der Ausgliederung beteiligten Rechtsträger ist, wenn sie binnen sechs Monaten nach dem Tag, an dem die Eintragung der Ausgliederung in das Register des Sitzes desjenigen Rechtsträgers, dessen Gläubiger sie sind, nach §§ 125, 19 Abs. 3 UmwG als bekannt gemacht gilt, ihren Anspruch nach Grund und Höhe in Textform anmelden, Sicherheit zu leisten, soweit sie nicht Befriedigung verlangen können. Dieses Recht steht den Gläubigern jedoch nur zu, wenn sie glaubhaft machen, dass durch die Ausgliederung die Erfüllung ihrer Forderung gefährdet wird."
    },
    {
      "date": "2025-10-24",
      "id": "135160",
      "original_text": "Registerbekanntmachung nach dem Umwandlungsgesetz\nBayern Amtsgericht Deggendorf HRA 3214\nElisabeth Krauth e.K. – Deggendorf",
      "type": "Registerbekanntmachung nach dem Umwandlungsgesetz",
      "state": "Bayern",
      "amtsgericht": "Amtsgericht Deggendorf",
      "registernummer": "HRA 3214",
      "registerart": "HRA",
      "company_name": "Elisabeth Krauth e.K.",
      "company_seat": "Deggendorf",
      "details": "24.10.2025 (Bekanntmachungsdatum)\n\nBayern Amtsgericht Deggendorf HRA 3214\nRegisterbekanntmachung nach dem Umwandlungsgesetz 23.10.2025 (Eintragungsdatum)\n\nElisabeth Krauth e.K.\nEinzelkaufmann / Einzelkauffrau\nDeggendorf\n\nDen Gläubigern der an der Ausgliederung beteiligten Rechtsträger ist, wenn sie binnen sechs Monaten nach dem Tag, an dem die Eintragung der Ausgliederung in das Register des Sitzes desjenigen Rechtsträgers, dessen Gläubiger sie sind, nach §§ 125, 19 Abs. 3 UmwG als bekannt gemacht gilt, ihren Anspruch nach Grund und Höhe in Textform anmelden, Sicherheit zu leisten, soweit sie nicht Befriedigung verlangen können. Dieses Recht steht den Gläubigern jedoch nur zu, wenn sie glaubhaft machen, dass durch die Ausgliederung die Erfüllung ihrer Forderung gefährdet wird."
    },
    {
      "date": "2025-10-24",
      "id": "135161",
      "original_text": "Registerbekanntmachung nach dem Umwandlungsgesetz\nBayern Amtsgericht Fürth VR 10267\nArbeiterwohlfahrt Kreisverband Neustadt a.d.Aisch - Bad Windsheim e.V. – Neustadt/Aisch",
      "type": "Registerbekanntmachung nach dem Umwandlungsgesetz",
      "state": "Bayern",
      "amtsgericht": "Amtsgericht Fürth",
      "registernummer": "VR 10267",
      "registerart": "VR",
      "company_name": "Arbeiterwohlfahrt Kreisverband Neustadt a.d.Aisch - Bad Windsheim e.V.",
      "company_seat": "Neustadt/Aisch",
      "details": "24.10.2025 (Bekanntmachungsdatum)\n\nBayern Amtsgericht Fürth VR 10267\nRegisterbekanntmachung nach dem Umwandlungsgesetz 23.10.2025 (Eintragungsdatum)\n\nArbeiterwohlfahrt Kreisverband Neustadt a.d.Aisch - Bad Windsheim e.V.\neingetragener Verein\nNeustadt/Aisch\n\nDen Gläubigern der an der Ausgliederung beteiligten Rechtsträger ist, wenn sie binnen sechs Monaten nach dem Tag, an dem die Eintragung der Ausgliederung in das Register des Sitzes desjenigen Rechtsträgers, dessen Gläubiger sie sind, nach §§ 125, 19 Abs. 3 UmwG als bekannt gemacht gilt, ihren Anspruch nach Grund und Höhe in Textform anmelden, Sicherheit zu leisten, soweit sie nicht Befriedigung verlangen können. Dieses Recht steht den Gläubigern jedoch nur zu, wenn sie glaubhaft machen, dass durch die Ausgliederung die Erfüllung ihrer Forderung gefährdet wird."
    },
    {
      "date": "2025-10-24",
      "id": "135162",
      "original_text": "Löschungsankündigung\nBayern Amtsgericht München HRB 272385\nStartup Zwei UG (haftungsbeschränkt) – München",
      "type": "Löschungsankündigung",
      "state": "Bayern",
      "amtsgericht": "Amtsgericht München",
      "registernummer": "HRB 272385",
      "registerart": "HRB",
      "company_name": "Startup Zwei UG (haftungsbeschränkt)",
      "company_seat": "München",
      "details": "24.10.2025 (Bekanntmachungsdatum)\n\nBayern Amtsgericht München HRB 272385\nLöschungsankündigung 23.10.2025 (Eintragungsdatum)\n\nStartup Zwei UG (haftungsbeschränkt)\nGesellschaft mit beschränkter Haftung\nMünchen\n\nDas Registergericht beabsichtigt, die im Handelsregister eingetragene Gesellschaft wegen Vermögenslosigkeit von Amts wegen nach § 394 FamFG zu löschen. Die Frist zur Erhebung eines Widerspruchs ist auf drei Monate festgesetzt."
    },
    {
      "date": "2025-10-24",
      "id": "135163",
      "original_text": "Registerbekanntmachung nach dem Umwandlungsgesetz\nBayern Amtsgericht Nürnberg HRB 30836\nSpectralliance Holding GmbH – Nürnberg",
      "type": "Registerbekanntmachung nach dem Umwandlungsgesetz",
      "state": "Bayern",
      "amtsgericht": "Amtsgericht Nürnberg",
      "registernummer": "HRB 30836",
      "registerart": "HRB",
      "company_name": "Spectralliance Holding GmbH",
      "company_seat": "Nürnberg",
      "details": "24.10.2025 (Bekanntmachungsdatum)\n\nBayern Amtsgericht Nürnberg HRB 30836\nRegisterbekanntmachung nach dem Umwandlungsgesetz 23.10.2025 (Eintragungsdatum)\n\nSpectralliance Holding GmbH\nGesellschaft mit beschränkter Haftung\nNürnberg\n\nDen Gläubigern der an der Verschmelzung beteiligten Rechtsträger ist, wenn sie binnen sechs Monaten nach dem Tag, an dem die Eintragung der Verschmelzung in das Register des Sitzes desjenigen Rechtsträgers, dessen Gläubiger sie sind, nach § 19 Abs. 3 UmwG als bekannt gemacht gilt, ihren Anspruch nach Grund und Höhe in Textform anmelden, Sicherheit zu leisten, soweit sie nicht Befriedigung verlangen können. Dieses Recht steht den Gläubigern jedoch nur zu, wenn sie glaubhaft machen, dass durch die Verschmelzung die Erfüllung ihrer Forderung gefährdet wird."
    },
    {
      "date": "2025-10-24",
      "id": "135164",
      "original_text": "Registerbekanntmachung nach dem Umwandlungsgesetz\nBayern Amtsgericht München HRB 164232\nAllianz SE – München",
      "type": "Registerbekanntmachung nach dem Umwandlungsgesetz",
      "state": "Bayern",
      "amtsgericht": "Amtsgericht München",
      "registernummer": "HRB 164232",
      "registerart": "HRB",
      "company_name": "Allianz SE",
      "company_seat": "München",
      "details": "24.10.2025 (Bekanntmachungsdatum)\n\nBayern Amtsgericht München HRB 164232\nRegisterbekanntmachung nach dem Umwandlungsgesetz\n\nAllianz SE\nEuropäische Aktiengesellschaft (SE)\nMünchen\n\nDen Gläubigern der an der Verschmelzung beteiligten Rechtsträger ist, wenn sie binnen sechs Monaten nach dem Tag, an dem die Eintragung der Verschmelzung in das Register des Sitzes desjenigen Rechtsträgers, dessen Gläubiger sie sind, nach § 19 Abs. 3 UmwG als bekannt gemacht gilt, ihren Anspruch nach Grund und Höhe in Textform anmelden, Sicherheit zu leisten, soweit sie nicht Befriedigung verlangen können. Dieses Recht steht den Gläubigern jedoch nur zu, wenn sie glaubhaft machen, dass durch die Verschmelzung die Erfüllung ihrer Forderung gefährdet wird. Dem Amtsgericht München -Registergericht- ist ein Verschmelzungsvertrag zwischen der Gesellschaft als übernehmendem Rechtsträger und der Allianz Services Holding GmbH, München (Amtsgericht München HRB 301787) zur Einsichtnahme eingereicht worden."
    },
    {
      "date": "2025-10-24",
      "id": "135165",
      "original_text": "Registerbekanntmachung nach dem Umwandlungsgesetz\nBayern Amtsgericht Nürnberg HRA 12863\nDigithurst Bildverarbeitungssysteme GmbH & Co. KG – Büchenbach",
      "type": "Registerbekanntmachung nach dem Umwandlungsgesetz",
      "state": "Bayern",
      "amtsgericht": "Amtsgericht Nürnberg",
      "registernummer": "HRA 12863",
      "registerart": "HRA",
      "company_name": "Digithurst Bildverarbeitungssysteme GmbH & Co. KG",
      "company_seat": "Büchenbach",
      "details": "24.10.2025 (Bekanntmachungsdatum)\n\nBayern Amtsgericht Nürnberg HRA 12863\nRegisterbekanntmachung nach dem Umwandlungsgesetz 23.10.2025 (Eintragungsdatum)\n\nDigithurst Bildverarbeitungssysteme GmbH & Co. KG\nKommanditgesellschaft\nBüchenbach\n\nDen Gläubigern der an der Verschmelzung beteiligten Rechtsträger ist, wenn sie binnen sechs Monaten nach dem Tag, an dem die Eintragung der Verschmelzung in das Register des Sitzes desjenigen Rechtsträgers, dessen Gläubiger sie sind, nach § 19 Abs. 3 UmwG als bekannt gemacht gilt, ihren Anspruch nach Grund und Höhe in Textform anmelden, Sicherheit zu leisten, soweit sie nicht Befriedigung verlangen können. Dieses Recht steht den Gläubigern jedoch nur zu, wenn sie glaubhaft machen, dass durch die Verschmelzung die Erfüllung ihrer Forderung gefährdet wird."
    },
    {
      "date": "2025-10-24",
      "id": "135166",
      "original_text": "Registerbekanntmachung nach dem Umwandlungsgesetz\nBayern Amtsgericht München HRA 119519\n3 B Immobilienverwaltungs GmbH & Co. KG – Geretsried",
      "type": "Registerbekanntmachung nach dem Umwandlungsgesetz",
      "state": "Bayern",
      "amtsgericht": "Amtsgericht München",
      "registernummer": "HRA 119519",
      "registerart": "HRA",
      "company_name": "3 B Immobilienverwaltungs GmbH & Co. KG",
      "company_seat": "Geretsried",
      "details": "24.10.2025 (Bekanntmachungsdatum)\n\nBayern Amtsgericht München HRA 119519\nRegisterbekanntmachung nach dem Umwandlungsgesetz 23.10.2025 (Eintragungsdatum)\n\n3 B Immobilienverwaltungs GmbH & Co. KG\nKommanditgesellschaft\nGeretsried\n\nDen Gläubigern der an der Ausgliederung beteiligten Rechtsträger ist, wenn sie binnen sechs Monaten nach dem Tag, an dem die Eintragung der Ausgliederung in das Register des Sitzes desjenigen Rechtsträgers, dessen Gläubiger sie sind, nach §§ 125, 19 Abs. 3 UmwG als bekannt gemacht gilt, ihren Anspruch nach Grund und Höhe in Textform anmelden, Sicherheit zu leisten, soweit sie nicht Befriedigung verlangen können. Dieses Recht steht den Gläubigern jedoch nur zu, wenn sie glaubhaft machen, dass durch die Ausgliederung die Erfüllung ihrer Forderung gefährdet wird."
    },
    {
      "date": "2025-10-24",
      "id": "135167",
      "original_text": "Registerbekanntmachung nach dem Umwandlungsgesetz\nBayern Amtsgericht Deggendorf HRB 3368\nKrauth Fashion GmbH – Deggendorf",
      "type": "Registerbekanntmachung nach dem Umwandlungsgesetz",
      "state": "Bayern",
      "amtsgericht": "Amtsgericht Deggendorf",
      "registernummer": "HRB 3368",
      "registerart": "HRB",
      "company_name": "Krauth Fashion GmbH",
      "company_seat": "Deggendorf",
      "details": "24.10.2025 (Bekanntmachungsdatum)\n\nBayern Amtsgericht Deggendorf HRB 3368\nRegisterbekanntmachung nach dem Umwandlungsgesetz 23.10.2025 (Eintragungsdatum)\n\nKrauth Fashion GmbH\nGesellschaft mit beschränkter Haftung\nDeggendorf\n\nDen Gläubigern der an der Ausgliederung beteiligten Rechtsträger ist, wenn sie binnen sechs Monaten nach dem Tag, an dem die Eintragung der Ausgliederung in das Register des Sitzes desjenigen Rechtsträgers, dessen Gläubiger sie sind, nach §§ 125, 19 Abs. 3 UmwG als bekannt gemacht gilt, ihren Anspruch nach Grund und Höhe in Textform anmelden, Sicherheit zu leisten, soweit sie nicht Befriedigung verlangen können. Dieses Recht steht den Gläubigern jedoch nur zu, wenn sie glaubhaft machen, dass durch die Ausgliederung die Erfüllung ihrer Forderung gefährdet wird."
    },
    {
      "date": "2025-10-24",
      "id": "135168",
      "original_text": "Registerbekanntmachung nach dem Umwandlungsgesetz\nBayern Amtsgericht Nürnberg HRB 30164\nPraxis der manuellen Therapie Klages GmbH – Nürnberg",
      "type": "Registerbekanntmachung nach dem Umwandlungsgesetz",
      "state": "Bayern",
      "amtsgericht": "Amtsgericht Nürnberg",
      "registernummer": "HRB 30164",
      "registerart": "HRB",
      "company_name": "Praxis der manuellen Therapie Klages GmbH",
      "company_seat": "Nürnberg",
      "details": "24.10.2025 (Bekanntmachungsdatum)\n\nBayern Amtsgericht Nürnberg HRB 30164\nRegisterbekanntmachung nach dem Umwandlungsgesetz 23.10.2025 (Eintragungsdatum)\n\nPraxis der manuellen Therapie Klages GmbH\nGesellschaft mit beschränkter Haftung\nNürnberg\n\nDen Gläubigern der an der Verschmelzung beteiligten Rechtsträger ist, wenn sie binnen sechs Monaten nach dem Tag, an dem die Eintragung der Verschmelzung in das Register des Sitzes desjenigen Rechtsträgers, dessen Gläubiger sie sind, nach § 19 Abs. 3 UmwG als bekannt gemacht gilt, ihren Anspruch nach Grund und Höhe in Textform anmelden, Sicherheit zu leisten, soweit sie nicht Befriedigung verlangen können. Dieses Recht steht den Gläubigern jedoch nur zu, wenn sie glaubhaft machen, dass durch die Verschmelzung die Erfüllung ihrer Forderung gefährdet wird.Den Gläubigern der an der Verschmelzung beteiligten Rechtsträger ist, wenn sie binnen sechs Monaten nach dem Tag, an dem die Eintragung der Verschmelzung in das Register des Sitzes desjenigen Rechtsträgers, dessen Gläubiger sie sind, nach § 19 Abs. 3 UmwG als bekannt gemacht gilt, ihren Anspruch nach Grund und Höhe in Textform anmelden, Sicherheit zu leisten, soweit sie nicht Befriedigung verlangen können. Dieses Recht steht den Gläubigern jedoch nur zu, wenn sie glaubhaft machen, dass durch die Verschmelzung die Erfüllung ihrer Forderung gefährdet wird."
    },
    {
      "date": "2025-10-24",
      "id": "135169",
      "original_text": "Registerbekanntmachung nach dem Umwandlungsgesetz\nBayern Amtsgericht Memmingen HRB 20077\nKenf Safety & Security GmbH – Neu-Ulm",
      "type": "Registerbekanntmachung nach dem Umwandlungsgesetz",
      "state": "Bayern",
      "amtsgericht": "Amtsgericht Memmingen",
      "registernummer": "HRB 20077",
      "registerart": "HRB",
      "company_name": "Kenf Safety & Security GmbH",
      "company_seat": "Neu-Ulm",
      "details": "24.10.2025 (Bekanntmachungsdatum)\n\nBayern Amtsgericht Memmingen HRB 20077\nRegisterbekanntmachung nach dem Umwandlungsgesetz 23.10.2025 (Eintragungsdatum)\n\nKenf Safety & Security GmbH\nGesellschaft mit beschränkter Haftung\nNeu-Ulm\n\nDen Gläubigern #dv.auswahl(Text=\"Bitte zutreffendes auswählen:\",Eingabe=\n\n\"der an der Verschmelzung beteiligten Rechtsträger ist, wenn sie binnen sechs Monaten nach dem Tag, an dem die Eintragung der Verschmelzung in das Register des Sitzes desjenigen Rechtsträgers, dessen Gläubiger sie sind, nach § 19 Abs. 3 UmwG als bekannt gemacht gilt, ihren Anspruch nach Grund und Höhe in Textform anmelden, Sicherheit zu leisten, soweit sie nicht Befriedigung verlangen können. Dieses Recht steht den Gläubigern jedoch nur zu, wenn sie glaubhaft machen, dass durch die Verschmelzung die Erfüllung ihrer Forderung gefährdet wird.\"|\"Verschmelzung\",\n\n\"der an der Spaltung beteiligten Rechtsträger ist, wenn sie binnen sechs Monaten nach dem Tag, an dem die Eintragung der Spaltung in das Register des Sitzes desjenigen Rechtsträgers, dessen Gläubiger sie sind, nach §§ 125, 19 Abs. 3 UmwG als bekannt gemacht gilt, ihren Anspruch nach Grund und Höhe in Textform anmelden, Sicherheit zu leisten, soweit sie nicht Befriedigung verlangen können. Dieses Recht steht den Gläubigern jedoch nur zu, wenn sie glaubhaft machen, dass durch die Spaltung die Erfüllung ihrer Forderung gefährdet wird.\"|\"Spaltung\",\n\n\"des formwechselnden Rechtsträgers ist, wenn sie binnen sechs Monaten nach dem Tag, an dem die Eintragung des Formwechsels nach § 201 UmwG als bekannt gemacht gilt, ihren Anspruch nach Grund und Höhe in Textform anmelden, Sicherheit zu leisten, soweit sie nicht Befriedigung verlangen können. Dieses Recht steht den Gläubigern jedoch nur zu, wenn sie glaubhaft machen, dass durch den Formwechsel die Erfüllung ihrer Forderung gefährdet wird.\"|\"formwechselnde Umwandlung\",\n\n\"der an der Ausgliederung beteiligten Rechtsträger ist, wenn sie binnen sechs Monaten nach dem Tag, an dem die Eintragung der Ausgliederung in das Register des Sitzes desjenigen Rechtsträgers, dessen Gläubiger sie sind, nach §§ 125, 19 Abs. 3 UmwG als bekannt gemacht gilt, ihren Anspruch nach Grund und Höhe in Textform anmelden, Sicherheit zu leisten, soweit sie nicht Befriedigung verlangen können. Dieses Recht steht den Gläubigern jedoch nur zu, wenn sie glaubhaft machen, dass durch die Ausgliederung die Erfüllung ihrer Forderung gefährdet wird.\"|\"Ausgliederung\")"
    },
    {
      "date": "2025-10-24",
      "id": "135170",
      "original_text": "Registerbekanntmachung nach dem Umwandlungsgesetz\nBayern Amtsgericht Memmingen HRB 20077\nKenf Safety & Security GmbH – Neu-Ulm",
      "type": "Registerbekanntmachung nach dem Umwandlungsgesetz",
      "state": "Bayern",
      "amtsgericht": "Amtsgericht Memmingen",
      "registernummer": "HRB 20077",
      "registerart": "HRB",
      "company_name": "Kenf Safety & Security GmbH",
      "company_seat": "Neu-Ulm",
      "details": "24.10.2025 (Bekanntmachungsdatum)\n\nBayern Amtsgericht Memmingen HRB 20077\nRegisterbekanntmachung nach dem Umwandlungsgesetz 23.10.2025 (Eintragungsdatum)\n\nKenf Safety & Security GmbH\nGesellschaft mit beschränkter Haftung\nNeu-Ulm\n\nDen Gläubigern der an der Verschmelzung beteiligten Rechtsträger ist, wenn sie binnen sechs Monaten nach dem Tag, an dem die Eintragung der Verschmelzung in das Register des Sitzes desjenigen Rechtsträgers, dessen Gläubiger sie sind, nach § 19 Abs. 3 UmwG als bekannt gemacht gilt, ihren Anspruch nach Grund und Höhe in Textform anmelden, Sicherheit zu leisten, soweit sie nicht Befriedigung verlangen können. Dieses Recht steht den Gläubigern jedoch nur zu, wenn sie glaubhaft machen, dass durch die Verschmelzung die Erfüllung ihrer Forderung gefährdet wird."
    },
    {
      "date": "2025-10-24",
      "id": "135171",
      "original_text": "Registerbekanntmachung nach dem Umwandlungsgesetz\nBayern Amtsgericht Weiden i. d. OPf. HRA 3320\nMonika Priebe Taxi- und Mietauto e.K. – Kemnath",
      "type": "Registerbekanntmachung nach dem Umwandlungsgesetz",
      "state": "Bayern",
      "amtsgericht": "Amtsgericht Weiden i. d. OPf.",
      "registernummer": "HRA 3320",
      "registerart": "HRA",
      "company_name": "Monika Priebe Taxi- und Mietauto e.K.",
      "company_seat": "Kemnath",
      "details": "24.10.2025 (Bekanntmachungsdatum)\n\nBayern Amtsgericht Weiden i. d. OPf. HRA 3320\nRegisterbekanntmachung nach dem Umwandlungsgesetz 23.10.2025 (Eintragungsdatum)\n\nMonika Priebe Taxi- und Mietauto e.K.\nEinzelkaufmann / Einzelkauffrau\nKemnath\n\nDen Gläubigern der an der Ausgliederung beteiligten Rechtsträger ist, wenn sie binnen sechs Monaten nach dem Tag, an dem die Eintragung der Ausgliederung in das Register des Sitzes desjenigen Rechtsträgers, dessen Gläubiger sie sind, nach §§ 125, 19 Abs. 3 UmwG als bekannt gemacht gilt, ihren Anspruch nach Grund und Höhe in Textform anmelden, Sicherheit zu leisten, soweit sie nicht Befriedigung verlangen können. Dieses Recht steht den Gläubigern jedoch nur zu, wenn sie glaubhaft machen, dass durch die Ausgliederung die Erfüllung ihrer Forderung gefährdet wird."
    },
    {
      "date": "2025-10-24",
      "id": "135172",
      "original_text": "Registerbekanntmachung nach dem Umwandlungsgesetz\nBaden-Württemberg Amtsgericht Freiburg HRB 734187\nQuantum Insights AG – Binzen",
      "type": "Registerbekanntmachung nach dem Umwandlungsgesetz",
      "state": "Baden-Württemberg",
      "amtsgericht": "Amtsgericht Freiburg",
      "registernummer": "HRB 734187",
      "registerart": "HRB",
      "company_name": "Quantum Insights AG",
      "company_seat": "Binzen",
      "details": "24.10.2025 (Bekanntmachungsdatum)\n\nBaden-Württemberg Amtsgericht Freiburg HRB 734187\nRegisterbekanntmachung nach dem Umwandlungsgesetz 24.10.2025 (Eintragungsdatum)\n\nQuantum Insights AG\nAktiengesellschaft\nBinzen\n\nDen Gläubigern des an dem Formwechsel beteiligten Rechtsträgers ist, wenn sie binnen sechs Monaten nach dem Tag, an dem die Eintragung des Formwechsels in das Register des Sitzes desjenigen Rechtsträgers, dessen Gläubiger sie sind, nach § 19 Abs. 3 UmwG als bekanntgemacht gilt, ihren Anspruch nach Grund und Höhe schriftlich anmelden, Sicherheit zu leisten, soweit sie nicht Befriedigung verlangen können. Dieses Recht steht den Gläubigern jedoch nur zu, wenn sie glaubhaft machen, dass durch den Formwechsel die Erfüllung ihrer Forderung gefährdet wird."
    },
    {
      "date": "2025-10-24",
      "id": "135173",
      "original_text": "Registerbekanntmachung nach dem Umwandlungsgesetz\nBaden-Württemberg Amtsgericht Freiburg HRB 729202\nQuantum Insights GmbH – Binzen",
      "type": "Registerbekanntmachung nach dem Umwandlungsgesetz",
      "state": "Baden-Württemberg",
      "amtsgericht": "Amtsgericht Freiburg",
      "registernummer": "HRB 729202",
      "registerart": "HRB",
      "company_name": "Quantum Insights GmbH",
      "company_seat": "Binzen",
      "details": "24.10.2025 (Bekanntmachungsdatum)\n\nBaden-Württemberg Amtsgericht Freiburg HRB 729202\nRegisterbekanntmachung nach dem Umwandlungsgesetz 24.10.2025 (Eintragungsdatum)\n\nQuantum Insights GmbH\nGesellschaft mit beschränkter Haftung\nBinzen\n\nDen Gläubigern des an dem Formwechsel beteiligten Rechtsträgers ist, wenn sie binnen sechs Monaten nach dem Tag, an dem die Eintragung des Formwechsels in das Register des Sitzes desjenigen Rechtsträgers, dessen Gläubiger sie sind, nach § 19 Abs. 3 UmwG als bekanntgemacht gilt, ihren Anspruch nach Grund und Höhe schriftlich anmelden, Sicherheit zu leisten, soweit sie nicht Befriedigung verlangen können. Dieses Recht steht den Gläubigern jedoch nur zu, wenn sie glaubhaft machen, dass durch den Formwechsel die Erfüllung ihrer Forderung gefährdet wird."
    },
    {
      "date": "2025-10-24",
      "id": "135174",
      "original_text": "Sonstige Registerbekanntmachung\nBrandenburg Amtsgericht Potsdam HRB 40144\nThomas Otto Holding UG (haftungsbeschränkt) – Potsdam",
      "type": "Sonstige Registerbekanntmachung",
      "state": "Brandenburg",
      "amtsgericht": "Amtsgericht Potsdam",
      "registernummer": "HRB 40144",
      "registerart": "HRB",
      "company_name": "Thomas Otto Holding UG (haftungsbeschränkt)",
      "company_seat": "Potsdam",
      "details": "24.10.2025 (Bekanntmachungsdatum)\n\nBrandenburg Amtsgericht Potsdam HRB 40144\nSonstige Registerbekanntmachung\n\nThomas Otto Holding UG (haftungsbeschränkt)\nGesellschaft mit beschränkter Haftung\nPotsdam\n\nAls nicht eingetragen wird veröffentlicht: Die Ankündigung der Amtslöschung vom 21.08.2025 wird wegen fehlender Vermögenslosigkeit der Gesellschaft mit Beschluss vom 23.10.2025 aufgehoben."
    },
    {
      "date": "2025-10-24",
      "id": "135175",
      "original_text": "Löschungsankündigung\nBaden-Württemberg Amtsgericht Mannheim HRB 432701\nTreugrund Bauträgergesellschaft mbH – Heddesheim",
      "type": "Löschungsankündigung",
      "state": "Baden-Württemberg",
      "amtsgericht": "Amtsgericht Mannheim",
      "registernummer": "HRB 432701",
      "registerart": "HRB",
      "company_name": "Treugrund Bauträgergesellschaft mbH",
      "company_seat": "Heddesheim",
      "details": "24.10.2025 (Bekanntmachungsdatum)\n\nBaden-Württemberg Amtsgericht Mannheim HRB 432701\nLöschungsankündigung\n\nTreugrund Bauträgergesellschaft mbH\nGesellschaft mit beschränkter Haftung\nHeddesheim\n\nDas Gericht beabsichtigt, die Gesellschaft wegen Vermögenslosigkeit im Handelsregister von Amts wegen nach § 394 FamFG zu löschen. Die Frist zur Geltendmachung eines Widerspruchs gegen die beabsichtigte Löschung ist auf einen Monat ab Veröffentlichung bestimmt."
    },
    {
      "date": "2025-10-24",
      "id": "135176",
      "original_text": "Sonstige Registerbekanntmachung\nBerlin Amtsgericht Berlin (Charlottenburg) HRB 34165\nDeutsche Kreditbank Aktiengesellschaft – Berlin",
      "type": "Sonstige Registerbekanntmachung",
      "state": "Berlin",
      "amtsgericht": "Amtsgericht Berlin (Charlottenburg)",
      "registernummer": "HRB 34165",
      "registerart": "HRB",
      "company_name": "Deutsche Kreditbank Aktiengesellschaft",
      "company_seat": "Berlin",
      "details": "24.10.2025 (Bekanntmachungsdatum)\n\nBerlin Amtsgericht Berlin (Charlottenburg) HRB 34165\nSonstige Registerbekanntmachung\n\nDeutsche Kreditbank Aktiengesellschaft\nAktiengesellschaft\nBerlin\n\nAls nicht eingetragen wird veröffentlicht:Es wurde eine neue Liste der Aufsichtsratsmitglieder eingereicht (§ 106 AktG)."
    },
    {
      "date": "2025-10-24",
      "id": "135177",
      "original_text": "Registerbekanntmachung nach dem Umwandlungsgesetz\nHamburg Amtsgericht Hamburg HRB 94492\nYOGI TEA GmbH – Hamburg",
      "type": "Registerbekanntmachung nach dem Umwandlungsgesetz",
      "state": "Hamburg",
      "amtsgericht": "Amtsgericht Hamburg",
      "registernummer": "HRB 94492",
      "registerart": "HRB",
      "company_name": "YOGI TEA GmbH",
      "company_seat": "Hamburg",
      "details": "24.10.2025 (Bekanntmachungsdatum)\n\nHamburg Amtsgericht Hamburg HRB 94492\nRegisterbekanntmachung nach dem Umwandlungsgesetz\n\nYOGI TEA GmbH\nGesellschaft mit beschränkter Haftung\nHamburg\n\nAls nicht eingetragen wird bekanntgemacht: Die Gesellschaft hat gemäß § 308 Abs. 1 Satz 3 UmwG den Entwurf des gemeinsamen Verschmelzungsplans beim Handelsregister eingereicht, betreffend die grenzüberschreitende Verschmelzung der beteiligten Gesellschaften:\n\na) Übertragende Gesellschaft  ist die Kit Holding B.V. eine nach dem niederländischen Recht gegründete and existierende\nGesellschaft mit beschrankter\nHartung mit Sitz in Amsterdam, Niederlande,\nund folgender Geschäftsanschrift:\nHerikerbergweg 238, Luna\nArenA, 1101 CM Amsterdam,\nNiederlande.\n\nb) Als übernehmende Gesellschaft die\nYOGI TEA GmbH, eine nach deutschem\nRecht gegründete und existierende\nGesellschaft mit beschrankter\nHaftung mit Sitz in Hamburg,\nDeutschland, und mit Geschäftsadresse\nBurchardstr. 24, 20095 Hamburg.\nDie Gesellschaften sind in folgenden\nRegistern eingetragen (§ 308 Abs. 1\nS. 2 Nr. 3 UmwG:\nDie Kit Holding B.V, eingetragen in das niederländische Handelsregister, (Kamer van Koophandel) unter der Nr.: 34181149;\nDie YOGI TEA GmbH ist eingetragen im Handelsregister Hamburg unter HRB 94492.\nEin Hinweis an folgende Personen,\ndass sie der Gesellschaft an deren\nGeschäftsadresse spätestens fünf\nArbeitstage vor dem Tag der Gesellschafterversammlung\nam 20. Januar\n2026 Bemerkungen zum Verschmelzungsplan\nübermitteln können:\na} an die Gesellschafter der Kit Holding\nB.V. sowie die Gläubiger der an der\ngrenzüberschreitenden\nVerschmelzung beteiligten\nGesellschaften:\nb) an den Betriebsrat der YOGI TEA\nGmbH.\nEin Hinweis an die Gesellschafter der YOGI\nTEA GmbH und an den Betriebsrat bzw. die\nArbeitnehmer der Kit HoIding B.V. ist\nentbehrlich, da die Kit Holding B.V. die\nAlleingesellschafterin der YOGI TEA GmbH\nist und die Kit Holding B.V. weder einen\nBetriebsrat noch Arbeitnehmer hat."
    },
    {
      "date": "2025-10-24",
      "id": "135178",
      "original_text": "Löschungsankündigung\nBerlin Amtsgericht Berlin (Charlottenburg) HRB 55094\nMontage und Service M & S. Elektroanlagen GmbH – Berlin",
      "type": "Löschungsankündigung",
      "state": "Berlin",
      "amtsgericht": "Amtsgericht Berlin (Charlottenburg)",
      "registernummer": "HRB 55094",
      "registerart": "HRB",
      "company_name": "Montage und Service M & S. Elektroanlagen GmbH",
      "company_seat": "Berlin",
      "details": "24.10.2025 (Bekanntmachungsdatum)\n\nBerlin Amtsgericht Berlin (Charlottenburg) HRB 55094\nLöschungsankündigung\n\nMontage und Service M & S. Elektroanlagen GmbH\nGesellschaft mit beschränkter Haftung\nBerlin\n\nBei der nachstehenden Gesellschaft wird das Amtslöschungsverfahren gemäß § 394 FamFG eingeleitet. Widerspruchsfrist 6 Wochen"
    },
    {
      "date": "2025-10-24",
      "id": "135179",
      "original_text": "Registerbekanntmachung nach dem Umwandlungsgesetz\nSchleswig-Holstein Amtsgericht Kiel HRA 12790\nPKW & Motorrad - Technik, Inh. Frank Martin e.K. – Seth",
      "type": "Registerbekanntmachung nach dem Umwandlungsgesetz",
      "state": "Schleswig-Holstein",
      "amtsgericht": "Amtsgericht Kiel",
      "registernummer": "HRA 12790",
      "registerart": "HRA",
      "company_name": "PKW & Motorrad - Technik, Inh. Frank Martin e.K.",
      "company_seat": "Seth",
      "details": "24.10.2025 (Bekanntmachungsdatum)\n\nSchleswig-Holstein Amtsgericht Kiel HRA 12790\nRegisterbekanntmachung nach dem Umwandlungsgesetz 23.10.2025 (Eintragungsdatum)\n\nPKW & Motorrad - Technik, Inh. Frank Martin e.K.\nEinzelkaufmann / Einzelkauffrau\nSeth\n\nZu Eintragungsnummer 2 vom 23.10.2025 wird als nicht eingetragen veröffentlicht: Den Gläubigern der an der Spaltung beteiligten Rechtsträger ist, wenn sie binnen sechs Monaten nach dem Tag, an dem die Eintragung der Spaltung in das Register des Sitzes desjenigen Rechtsträgers, dessen Gläubiger sie sind,  bekannt gemacht worden ist, ihren Anspruch nach Grund und Höhe schriftlich anmelden, Sicherheit zu leisten, soweit sie nicht Befriedigung verlangen können. Dieses Recht steht den Gläubigern jedoch nur zu, wenn sie glaubhaft machen, dass durch die Spaltung die Erfüllung ihrer Forderung gefährdet wird."
    },
    {
      "date": "2025-10-24",
      "id": "135180",
      "original_text": "Einreichung neuer Dokumente\nBrandenburg Amtsgericht Neuruppin HRB 9393\nUckermärkische Rettungsdienstgesellschaft mbH – Prenzlau",
      "type": "Einreichung neuer Dokumente",
      "state": "Brandenburg",
      "amtsgericht": "Amtsgericht Neuruppin",
      "registernummer": "HRB 9393",
      "registerart": "HRB",
      "company_name": "Uckermärkische Rettungsdienstgesellschaft mbH",
      "company_seat": "Prenzlau",
      "details": "24.10.2025 (Bekanntmachungsdatum)\n\nBrandenburg Amtsgericht Neuruppin HRB 9393\nEinreichung neuer Dokumente\n\nUckermärkische Rettungsdienstgesellschaft mbH\nGesellschaft mit beschränkter Haftung\nPrenzlau\n\nAls nicht eingetragen wird veröffentlicht: Eine Liste der Mitglieder des Aufsichtsrates wurde zum Handelsregister eingereicht."
    },
    {
      "date": "2025-10-24",
      "id": "135181",
      "original_text": "Löschungsankündigung\nBerlin Amtsgericht Berlin (Charlottenburg) HRB 165079\nCalaisco UG (haftungsbeschränkt) – Berlin",
      "type": "Löschungsankündigung",
      "state": "Berlin",
      "amtsgericht": "Amtsgericht Berlin (Charlottenburg)",
      "registernummer": "HRB 165079",
      "registerart": "HRB",
      "company_name": "Calaisco UG (haftungsbeschränkt)",
      "company_seat": "Berlin",
      "details": "24.10.2025 (Bekanntmachungsdatum)\n\nBerlin Amtsgericht Berlin (Charlottenburg) HRB 165079\nLöschungsankündigung\n\nCalaisco UG (haftungsbeschränkt)\nGesellschaft mit beschränkter Haftung\nBerlin\n\nBei der nachstehenden Gesellschaft wird das Amtslöschungsverfahren gemäß § 394 FamFG eingeleitet. Widerspruchsfrist 6 Wochen"
    },
    {
      "date": "2025-10-24",
      "id": "135182",
      "original_text": "Löschungsankündigung\nSaarland Amtsgericht Saarbrücken HRB 12584\nTextilreinigungen Andreas Müden GmbH – Saarbrücken",
      "type": "Löschungsankündigung",
      "state": "Saarland",
      "amtsgericht": "Amtsgericht Saarbrücken",
      "registernummer": "HRB 12584",
      "registerart": "HRB",
      "company_name": "Textilreinigungen Andreas Müden GmbH",
      "company_seat": "Saarbrücken",
      "details": "24.10.2025 (Bekanntmachungsdatum)\n\nSaarland Amtsgericht Saarbrücken HRB 12584\nLöschungsankündigung\n\nTextilreinigungen Andreas Müden GmbH\nGesellschaft mit beschränkter Haftung\nSaarbrücken\n\nEs ist beabsichtigt, die Gesellschaft von Amts wegen gemäß § 394 FamFG wegen Vermögenslosigkeit zu löschen.\nGegen die Löschung von Amts wegen ist das Rechtsmittel des Widerspruchs statthaft. Der Widerspruch ist binnen einer Frist zwei Monaten beginnend mit dem Tag dieser Veröffentlichung durch Einreichen eines Widerspruchsschreibens -schriftlich oder zur Niederschrift der Geschäftsstelle beim Amtsgericht Saarbrücken, -zentrales Handelsregister-, Mainzerstr.178, 66121 Saarbrücken einzulegen.\nDer Widerspruch muss die Bezeichnung der angefochtenen Löschungsankündigung enthalten sowie die Erklärung, dass Widerspruch eingelegt wird. Er ist vom Widerspruchsführer oder seinem Bevollmächtigten zu unterzeichnen.\nDas Widerspruchsschreiben kann auch in der Form eines elektronischen Dokumentes eingereicht werden, das mit einer qualifizierten elektronischen Signatur nach dem Signaturgesetz versehen sein muss (§§ 14 Abs. 2 FamFG, 130a, 298 ZPO)."
    },
    {
      "date": "2025-10-24",
      "id": "135183",
      "original_text": "Löschungsankündigung\nBerlin Amtsgericht Berlin (Charlottenburg) HRB 103493\nCIBR Development GmbH – Berlin",
      "type": "Löschungsankündigung",
      "state": "Berlin",
      "amtsgericht": "Amtsgericht Berlin (Charlottenburg)",
      "registernummer": "HRB 103493",
      "registerart": "HRB",
      "company_name": "CIBR Development GmbH",
      "company_seat": "Berlin",
      "details": "24.10.2025 (Bekanntmachungsdatum)\n\nBerlin Amtsgericht Berlin (Charlottenburg) HRB 103493\nLöschungsankündigung\n\nCIBR Development GmbH\nGesellschaft mit beschränkter Haftung\nBerlin\n\nBei der nachstehenden Gesellschaft wird das Amtslöschungsverfahren gemäß § 394 FamFG eingeleitet. Widerspruchsfrist 6 Wochen"
    },
    {
      "date": "2025-10-24",
      "id": "135184",
      "original_text": "Löschungsankündigung\nBerlin Amtsgericht Berlin (Charlottenburg) HRB 140376\nStar Holz Gruppe GmbH – Berlin",
      "type": "Löschungsankündigung",
      "state": "Berlin",
      "amtsgericht": "Amtsgericht Berlin (Charlottenburg)",
      "registernummer": "HRB 140376",
      "registerart": "HRB",
      "company_name": "Star Holz Gruppe GmbH",
      "company_seat": "Berlin",
      "details": "24.10.2025 (Bekanntmachungsdatum)\n\nBerlin Amtsgericht Berlin (Charlottenburg) HRB 140376\nLöschungsankündigung\n\nStar Holz Gruppe GmbH\nGesellschaft mit beschränkter Haftung\nBerlin\n\nBei der nachstehenden Gesellschaft wird das Amtslöschungsverfahren gemäß § 394 FamFG eingeleitet. Widerspruchsfrist 6 Wochen"
    },
    {
      "date": "2025-10-24",
      "id": "135185",
      "original_text": "Registerbekanntmachung nach dem Umwandlungsgesetz\nBerlin Amtsgericht Berlin (Charlottenburg) HRB 201110\nRAW Value 2 GmbH – Berlin",
      "type": "Registerbekanntmachung nach dem Umwandlungsgesetz",
      "state": "Berlin",
      "amtsgericht": "Amtsgericht Berlin (Charlottenburg)",
      "registernummer": "HRB 201110",
      "registerart": "HRB",
      "company_name": "RAW Value 2 GmbH",
      "company_seat": "Berlin",
      "details": "24.10.2025 (Bekanntmachungsdatum)\n\nBerlin Amtsgericht Berlin (Charlottenburg) HRB 201110\nRegisterbekanntmachung nach dem Umwandlungsgesetz 23.10.2025 (Eintragungsdatum)\n\nRAW Value 2 GmbH\nGesellschaft mit beschränkter Haftung\nBerlin\n\nZu Eintragungsnummer 5 vom 23.10.2025 wird als nicht eingetragen veröffentlicht: Den Gläubigern der an der Verschmelzung beteiligten Rechtsträger ist, wenn sie binnen sechs Monaten nach dem Tag, an dem die Eintragung der Verschmelzung in das Register des Sitzes desjenigen Rechtsträgers, dessen Gläubiger sie sind, als bekannt gemacht gilt, ihren Anspruch nach Grund und Höhe schriftlich anmelden, Sicherheit zu leisten, soweit sie nicht Befriedigung verlangen können. Dieses Recht steht den Gläubigern jedoch nur zu, wenn sie glaubhaft machen, dass durch die Verschmelzung die Erfüllung ihrer Forderung gefährdet wird. Das Recht, Sicherheitsleistung zu verlangen, steht Gläubigern nicht zu, die im Falle der Insolvenz ein Recht auf vorzugsweise Befriedigung aus einer Deckungsmasse haben, die nach gesetzlicher Vorschrift zu ihrem Schutz errichtet und staatlich überwacht ist."
    },
    {
      "date": "2025-10-24",
      "id": "135186",
      "original_text": "Registerbekanntmachung nach dem Umwandlungsgesetz\nBerlin Amtsgericht Berlin (Charlottenburg) HRB 201110\nRAW Value 2 GmbH – Berlin",
      "type": "Registerbekanntmachung nach dem Umwandlungsgesetz",
      "state": "Berlin",
      "amtsgericht": "Amtsgericht Berlin (Charlottenburg)",
      "registernummer": "HRB 201110",
      "registerart": "HRB",
      "company_name": "RAW Value 2 GmbH",
      "company_seat": "Berlin",
      "details": "24.10.2025 (Bekanntmachungsdatum)\n\nBerlin Amtsgericht Berlin (Charlottenburg) HRB 201110\nRegisterbekanntmachung nach dem Umwandlungsgesetz 23.10.2025 (Eintragungsdatum)\n\nRAW Value 2 GmbH\nGesellschaft mit beschränkter Haftung\nBerlin\n\nZu Eintragungsnummer 6 vom 23.10.2025 wird als nicht eingetragen veröffentlicht: Den Gläubigern der an der Verschmelzung beteiligten Rechtsträger ist, wenn sie binnen sechs Monaten nach dem Tag, an dem die Eintragung der Verschmelzung in das Register des Sitzes desjenigen Rechtsträgers, dessen Gläubiger sie sind, als bekannt gemacht gilt, ihren Anspruch nach Grund und Höhe schriftlich anmelden, Sicherheit zu leisten, soweit sie nicht Befriedigung verlangen können. Dieses Recht steht den Gläubigern jedoch nur zu, wenn sie glaubhaft machen, dass durch die Verschmelzung die Erfüllung ihrer Forderung gefährdet wird. Das Recht, Sicherheitsleistung zu verlangen, steht Gläubigern nicht zu, die im Falle der Insolvenz ein Recht auf vorzugsweise Befriedigung aus einer Deckungsmasse haben, die nach gesetzlicher Vorschrift zu ihrem Schutz errichtet und staatlich überwacht ist."
    },
    {
      "date": "2025-10-24",
      "id": "135187",
      "original_text": "Registerbekanntmachung nach dem Umwandlungsgesetz\nBaden-Württemberg Amtsgericht Stuttgart HRB 790598\nXandY Ventures UG (haftungsbeschränkt) – Dobel",
      "type": "Registerbekanntmachung nach dem Umwandlungsgesetz",
      "state": "Baden-Württemberg",
      "amtsgericht": "Amtsgericht Stuttgart",
      "registernummer": "HRB 790598",
      "registerart": "HRB",
      "company_name": "XandY Ventures UG (haftungsbeschränkt)",
      "company_seat": "Dobel",
      "details": "24.10.2025 (Bekanntmachungsdatum)\n\nBaden-Württemberg Amtsgericht Stuttgart HRB 790598\nRegisterbekanntmachung nach dem Umwandlungsgesetz 24.10.2025 (Eintragungsdatum)\n\nXandY Ventures UG (haftungsbeschränkt)\nGesellschaft mit beschränkter Haftung\nDobel\n\nAls nicht eingetragen wird bekanntgemacht:\nDen Gläubigern der an der Aufspaltung beteiligten Rechtsträger ist, wenn sie binnen sechs Monaten nach dem Tag, an dem die Eintragung der Aufspaltung in das Register des Sitzes desjenigen Rechtsträgers, dessen Gläubiger sie sind, nach § 19 Abs. 3 UmwG als bekanntgemacht gilt, ihren Anspruch nach Grund und Höhe schriftlich anmelden, Sicherheit zu leisten, soweit sie nicht Befriedigung verlangen können. Dieses Recht steht den Gläubigern jedoch nur zu, wenn sie glaubhaft machen, dass durch die Aufspaltung die Erfüllung ihrer Forderung gefährdet wird."
    },
    {
      "date": "2025-10-24",
      "id": "135188",
      "original_text": "Einreichung neuer Dokumente\nBaden-Württemberg Amtsgericht Stuttgart HRB 21934\nFilm- und Medienfestival gGmbH – Stuttgart",
      "type": "Einreichung neuer Dokumente",
      "state": "Baden-Württemberg",
      "amtsgericht": "Amtsgericht Stuttgart",
      "registernummer": "HRB 21934",
      "registerart": "HRB",
      "company_name": "Film- und Medienfestival gGmbH",
      "company_seat": "Stuttgart",
      "details": "24.10.2025 (Bekanntmachungsdatum)\n\nBaden-Württemberg Amtsgericht Stuttgart HRB 21934\nEinreichung neuer Dokumente\n\nFilm- und Medienfestival gGmbH\nGesellschaft mit beschränkter Haftung\nStuttgart\n\nDie Gesellschaft hat am 23.10.2025 die Liste über die Zusammensetzung des Aufsichtsrats zum Handelsregister eingereicht."
    },
    {
      "date": "2025-10-24",
      "id": "135189",
      "original_text": "Registerbekanntmachung nach dem Umwandlungsgesetz\nBaden-Württemberg Amtsgericht Mannheim HRB 107907\nmedavis GmbH – Karlsruhe",
      "type": "Registerbekanntmachung nach dem Umwandlungsgesetz",
      "state": "Baden-Württemberg",
      "amtsgericht": "Amtsgericht Mannheim",
      "registernummer": "HRB 107907",
      "registerart": "HRB",
      "company_name": "medavis GmbH",
      "company_seat": "Karlsruhe",
      "details": "24.10.2025 (Bekanntmachungsdatum)\n\nBaden-Württemberg Amtsgericht Mannheim HRB 107907\nRegisterbekanntmachung nach dem Umwandlungsgesetz 24.10.2025 (Eintragungsdatum)\n\nmedavis GmbH\nGesellschaft mit beschränkter Haftung\nKarlsruhe\n\nDen Gläubigern der an der Verschmelzung beteiligten Rechtsträger ist, wenn sie binnen sechs Monaten nach dem Tag, an dem die Eintragung der Verschmelzung in das Register des Sitzes desjenigen Rechtsträgers, dessen Gläubiger sie sind, nach § 19 Abs. 3 UmwG als bekanntgemacht gilt, ihren Anspruch nach Grund und Höhe schriftlich anmelden, Sicherheit zu leisten, soweit sie nicht Befriedigung verlangen können. Dieses Recht steht den Gläubigern jedoch nur zu, wenn sie glaubhaft machen, dass durch die Verschmelzung die Erfüllung ihrer Forderung gefährdet wird."
    },
    {
      "date": "2025-10-24",
      "id": "135190",
      "original_text": "Registerbekanntmachung nach dem Umwandlungsgesetz\nSchleswig-Holstein Amtsgericht Flensburg HRB 16391\nBeachfront Immobilien GmbH – Sylt / OT Westerland",
      "type": "Registerbekanntmachung nach dem Umwandlungsgesetz",
      "state": "Schleswig-Holstein",
      "amtsgericht": "Amtsgericht Flensburg",
      "registernummer": "HRB 16391",
      "registerart": "HRB",
      "company_name": "Beachfront Immobilien GmbH",
      "company_seat": "Sylt / OT Westerland",
      "details": "24.10.2025 (Bekanntmachungsdatum)\n\nSchleswig-Holstein Amtsgericht Flensburg HRB 16391\nRegisterbekanntmachung nach dem Umwandlungsgesetz 23.10.2025 (Eintragungsdatum)\n\nBeachfront Immobilien GmbH\nGesellschaft mit beschränkter Haftung\nSylt / OT Westerland\n\nZu Eintragungsnummer 4 vom 23.10.2025 wird als nicht eingetragen veröffentlicht:\nDen Gläubigern der an der Verschmelzung beteiligten Rechtsträger ist, wenn sie binnen sechs Monaten nach dem Tag, an dem die Eintragung der Verschmelzung in das Register des Sitzes desjenigen Rechtsträgers, dessen Gläubiger sie sind, als bekannt gemacht gilt, ihren Anspruch nach Grund und Höhe schriftlich anmelden, Sicherheit zu leisten, soweit sie nicht Befriedigung verlangen können. Dieses Recht steht den Gläubigern jedoch nur zu, wenn sie glaubhaft machen, dass durch die Verschmelzung die Erfüllung ihrer Forderung gefährdet wird. Das Recht, Sicherheitsleistung zu verlangen, steht Gläubigern nicht zu, die im Falle der Insolvenz ein Recht auf vorzugsweise Befriedigung aus einer Deckungsmasse haben, die nach gesetzlicher Vorschrift zu ihrem Schutz errichtet und staatlich überwacht ist."
    },
    {
      "date": "2025-10-24",
      "id": "135191",
      "original_text": "Löschungsankündigung\nSaarland Amtsgericht Saarbrücken HRB 23182\nGlas-Zech Gesellschaft mit beschränkter Haftung – Saarlouis",
      "type": "Löschungsankündigung",
      "state": "Saarland",
      "amtsgericht": "Amtsgericht Saarbrücken",
      "registernummer": "HRB 23182",
      "registerart": "HRB",
      "company_name": "Glas-Zech Gesellschaft mit beschränkter Haftung",
      "company_seat": "Saarlouis",
      "details": "24.10.2025 (Bekanntmachungsdatum)\n\nSaarland Amtsgericht Saarbrücken HRB 23182\nLöschungsankündigung\n\nGlas-Zech Gesellschaft mit beschränkter Haftung\nGesellschaft mit beschränkter Haftung\nSaarlouis\n\nEs ist beabsichtigt, die Gesellschaft von Amts wegen gemäß § 394 FamFG wegen Vermögenslosigkeit zu löschen.\nGegen die Löschung von Amts wegen ist das Rechtsmittel des Widerspruchs statthaft. Der Widerspruch ist binnen einer Frist zwei Monaten beginnend mit dem Tag dieser Veröffentlichung durch Einreichen eines Widerspruchsschreibens -schriftlich oder zur Niederschrift der Geschäftsstelle beim Amtsgericht Saarbrücken, -zentrales Handelsregister-, Mainzerstr.178, 66121 Saarbrücken einzulegen.\nDer Widerspruch muss die Bezeichnung der angefochtenen Löschungsankündigung enthalten sowie die Erklärung, dass Widerspruch eingelegt wird. Er ist vom Widerspruchsführer oder seinem Bevollmächtigten zu unterzeichnen.\nDas Widerspruchsschreiben kann auch in der Form eines elektronischen Dokumentes eingereicht werden, das mit einer qualifizierten elektronischen Signatur nach dem Signaturgesetz versehen sein muss (§§ 14 Abs. 2 FamFG, 130a, 298 ZPO)."
    },
    {
      "date": "2025-10-24",
      "id": "135192",
      "original_text": "Einreichung neuer Dokumente\nBaden-Württemberg Amtsgericht Freiburg HRB 708839\nFSM AG – Kirchzarten",
      "type": "Einreichung neuer Dokumente",
      "state": "Baden-Württemberg",
      "amtsgericht": "Amtsgericht Freiburg",
      "registernummer": "HRB 708839",
      "registerart": "HRB",
      "company_name": "FSM AG",
      "company_seat": "Kirchzarten",
      "details": "24.10.2025 (Bekanntmachungsdatum)\n\nBaden-Württemberg Amtsgericht Freiburg HRB 708839\nEinreichung neuer Dokumente\n\nFSM AG\nAktiengesellschaft\nKirchzarten\n\nDie Gesellschaft hat am 23.10.2025 die Liste über die Zusammensetzung des Aufsichtsrats zum Handelsregister eingereicht."
    },
    {
      "date": "2025-10-24",
      "id": "135193",
      "original_text": "Registerbekanntmachung nach dem Umwandlungsgesetz\nBaden-Württemberg Amtsgericht Ulm HRA 729517\nBraunschweig GmbH + Co. KG – Meßkirch",
      "type": "Registerbekanntmachung nach dem Umwandlungsgesetz",
      "state": "Baden-Württemberg",
      "amtsgericht": "Amtsgericht Ulm",
      "registernummer": "HRA 729517",
      "registerart": "HRA",
      "company_name": "Braunschweig GmbH + Co. KG",
      "company_seat": "Meßkirch",
      "details": "24.10.2025 (Bekanntmachungsdatum)\n\nBaden-Württemberg Amtsgericht Ulm HRA 729517\nRegisterbekanntmachung nach dem Umwandlungsgesetz 24.10.2025 (Eintragungsdatum)\n\nBraunschweig GmbH + Co. KG\nKommanditgesellschaft\nMeßkirch\n\nAls nicht eingetragen wird bekanntgemacht:\nDen Gläubigern der an der Ausgliederung beteiligten Rechtsträger ist, wenn sie binnen sechs Monaten nach dem Tag, an dem die Eintragung der Ausgliederung in das Register des Sitzes desjenigen Rechtsträgers, dessen Gläubiger sie sind, nach § 19 Abs. 3 UmwG als bekanntgemacht gilt, ihren Anspruch nach Grund und Höhe schriftlich anmelden, Sicherheit zu leisten, soweit sie nicht Befriedigung verlangen können. Dieses Recht steht den Gläubigern jedoch nur zu, wenn sie glaubhaft machen, dass durch die Ausgliederung die Erfüllung ihrer Forderung gefährdet wird."
    },
    {
      "date": "2025-10-24",
      "id": "135194",
      "original_text": "Registerbekanntmachung nach dem Umwandlungsgesetz\nHamburg Amtsgericht Hamburg HRB 188022\nbp Netherlands GmbH – Hamburg",
      "type": "Registerbekanntmachung nach dem Umwandlungsgesetz",
      "state": "Hamburg",
      "amtsgericht": "Amtsgericht Hamburg",
      "registernummer": "HRB 188022",
      "registerart": "HRB",
      "company_name": "bp Netherlands GmbH",
      "company_seat": "Hamburg",
      "details": "24.10.2025 (Bekanntmachungsdatum)\n\nHamburg Amtsgericht Hamburg HRB 188022\nRegisterbekanntmachung nach dem Umwandlungsgesetz 24.10.2025 (Eintragungsdatum)\n\nbp Netherlands GmbH\nGesellschaft mit beschränkter Haftung\nHamburg\n\nAls nicht eingetragen wird bekannt gemacht:\nDen Gläubigern der an der grenzüberschreitenden Sitzverlegung und Formwechsel beteiligten Rechtsträger ist, wenn sie binnen sechs Monaten nach dem Tag, an dem die Eintragung der Verschmelzung in das Register des Sitzes desjenigen Rechtsträgers, dessen Gläubiger sie sind, nach § 19 Abs. 3 bekannt gemacht worden ist, ihren Anspruch nach Grund und Höhe schriftlich anmelden, Sicherheit zu leisten, soweit sie nicht Befriedigung verlangen können. Dieses Recht steht den Gläubigern jedoch nur zu, wenn sie glaubhaft machen, dass durch grenzüberschreitenden Formwechsel die Erfüllung ihrer Forderung gefährdet wird."
    },
    {
      "date": "2025-10-24",
      "id": "135195",
      "original_text": "Registerbekanntmachung nach dem Umwandlungsgesetz\nHamburg Amtsgericht Hamburg HRB 188058\nbp Retail Netherlands GmbH – Hamburg",
      "type": "Registerbekanntmachung nach dem Umwandlungsgesetz",
      "state": "Hamburg",
      "amtsgericht": "Amtsgericht Hamburg",
      "registernummer": "HRB 188058",
      "registerart": "HRB",
      "company_name": "bp Retail Netherlands GmbH",
      "company_seat": "Hamburg",
      "details": "24.10.2025 (Bekanntmachungsdatum)\n\nHamburg Amtsgericht Hamburg HRB 188058\nRegisterbekanntmachung nach dem Umwandlungsgesetz 24.10.2025 (Eintragungsdatum)\n\nbp Retail Netherlands GmbH\nGesellschaft mit beschränkter Haftung\nHamburg\n\nAls nicht eingetragen wird bekannt gemacht:\nDen Gläubigern der an der grenzüberschreitenden Sitzverlegung und Formwechsel beteiligten Rechtsträger ist, wenn sie binnen sechs Monaten nach dem Tag, an dem die Eintragung der Verschmelzung in das Register des Sitzes desjenigen Rechtsträgers, dessen Gläubiger sie sind, nach § 19 Abs. 3 bekannt gemacht worden ist, ihren Anspruch nach Grund und Höhe schriftlich anmelden, Sicherheit zu leisten, soweit sie nicht Befriedigung verlangen können. Dieses Recht steht den Gläubigern jedoch nur zu, wenn sie glaubhaft machen, dass durch grenzüberschreitenden Formwechsel die Erfüllung ihrer Forderung gefährdet wird."
    },
    {
      "date": "2025-10-24",
      "id": "135196",
      "original_text": "Registerbekanntmachung nach dem Umwandlungsgesetz\nBaden-Württemberg Amtsgericht Ulm HRA 729097\nBraunschweig e.K. – Meßkirch",
      "type": "Registerbekanntmachung nach dem Umwandlungsgesetz",
      "state": "Baden-Württemberg",
      "amtsgericht": "Amtsgericht Ulm",
      "registernummer": "HRA 729097",
      "registerart": "HRA",
      "company_name": "Braunschweig e.K.",
      "company_seat": "Meßkirch",
      "details": "24.10.2025 (Bekanntmachungsdatum)\n\nBaden-Württemberg Amtsgericht Ulm HRA 729097\nRegisterbekanntmachung nach dem Umwandlungsgesetz 24.10.2025 (Eintragungsdatum)\n\nBraunschweig e.K.\nEinzelkaufmann / Einzelkauffrau\nMeßkirch\n\nAls nicht eingetragen wird bekanntgemacht:\nDen Gläubigern der an der Ausgliederung beteiligten Rechtsträger ist, wenn sie binnen sechs Monaten nach dem Tag, an dem die Eintragung der Ausgliederung in das Register des Sitzes desjenigen Rechtsträgers, dessen Gläubiger sie sind, nach § 19 Abs. 3 UmwG als bekanntgemacht gilt, ihren Anspruch nach Grund und Höhe schriftlich anmelden, Sicherheit zu leisten, soweit sie nicht Befriedigung verlangen können. Dieses Recht steht den Gläubigern jedoch nur zu, wenn sie glaubhaft machen, dass durch die Ausgliederung die Erfüllung ihrer Forderung gefährdet wird."
    },
    {
      "date": "2025-10-24",
      "id": "135197",
      "original_text": "Löschungsankündigung\nBaden-Württemberg Amtsgericht Ulm HRB 721960\nPVkraftwerker Verwaltungsgesellschaft mbH – Schlat",
      "type": "Löschungsankündigung",
      "state": "Baden-Württemberg",
      "amtsgericht": "Amtsgericht Ulm",
      "registernummer": "HRB 721960",
      "registerart": "HRB",
      "company_name": "PVkraftwerker Verwaltungsgesellschaft mbH",
      "company_seat": "Schlat",
      "details": "24.10.2025 (Bekanntmachungsdatum)\n\nBaden-Württemberg Amtsgericht Ulm HRB 721960\nLöschungsankündigung\n\nPVkraftwerker Verwaltungsgesellschaft mbH\nGesellschaft mit beschränkter Haftung\nSchlat\n\nDas Gericht beabsichtigt, die Gesellschaft wegen Vermögenslosigkeit im Handelsregister von Amts wegen nach § 394 FamFG zu löschen. Die Frist zur Geltendmachung eines Widerspruchs gegen die beabsichtigte Löschung ist auf  einen Monat ab Veröffentlichung bestimmt."
    },
    {
      "date": "2025-10-24",
      "id": "135198",
      "original_text": "Löschungsankündigung\nBerlin Amtsgericht Berlin (Charlottenburg) HRB 103488\nL.K.B. Trading GmbH – Berlin",
      "type": "Löschungsankündigung",
      "state": "Berlin",
      "amtsgericht": "Amtsgericht Berlin (Charlottenburg)",
      "registernummer": "HRB 103488",
      "registerart": "HRB",
      "company_name": "L.K.B. Trading GmbH",
      "company_seat": "Berlin",
      "details": "24.10.2025 (Bekanntmachungsdatum)\n\nBerlin Amtsgericht Berlin (Charlottenburg) HRB 103488\nLöschungsankündigung\n\nL.K.B. Trading GmbH\nGesellschaft mit beschränkter Haftung\nBerlin\n\nBei der nachstehenden Gesellschaft wird das Amtslöschungsverfahren gemäß § 394 FamFG eingeleitet. Widerspruchsfrist 6 Wochen"
    },
    {
      "date": "2025-10-24",
      "id": "135199",
      "original_text": "Registerbekanntmachung nach dem Umwandlungsgesetz\nBerlin Amtsgericht Berlin (Charlottenburg) HRA 64460\nDr. Friederike Feil Akademie eK – Berlin",
      "type": "Registerbekanntmachung nach dem Umwandlungsgesetz",
      "state": "Berlin",
      "amtsgericht": "Amtsgericht Berlin (Charlottenburg)",
      "registernummer": "HRA 64460",
      "registerart": "HRA",
      "company_name": "Dr. Friederike Feil Akademie eK",
      "company_seat": "Berlin",
      "details": "24.10.2025 (Bekanntmachungsdatum)\n\nBerlin Amtsgericht Berlin (Charlottenburg) HRA 64460\nRegisterbekanntmachung nach dem Umwandlungsgesetz 23.10.2025 (Eintragungsdatum)\n\nDr. Friederike Feil Akademie eK\nEinzelkaufmann / Einzelkauffrau\nBerlin\n\nZu Eintragungsnummer 2 vom 23.10.2025 wird als nicht eingetragen veröffentlicht: Den Gläubigern der an der Spaltung beteiligten Rechtsträger ist, wenn sie binnen sechs Monaten nach dem Tag, an dem die Eintragung der Spaltung in das Register des Sitzes desjenigen Rechtsträgers, dessen Gläubiger sie sind, als bekannt gemacht gilt, ihren Anspruch nach Grund und Höhe schriftlich anmelden, Sicherheit zu leisten, soweit sie nicht Befriedigung verlangen können. Dieses Recht steht den Gläubigern jedoch nur zu, wenn sie glaubhaft machen, dass durch die Spaltung die Erfüllung ihrer Forderung gefährdet wird. Das Recht, Sicherheitsleistung zu verlangen, steht Gläubigern nicht zu, die im Falle der Insolvenz ein Recht auf vorzugsweise Befriedigung aus einer Deckungsmasse haben, die nach gesetzlicher Vorschrift zu ihrem Schutz errichtet und staatlich überwacht ist."
    },
    {
      "date": "2025-10-24",
      "id": "135200",
      "original_text": "Registerbekanntmachung nach dem Umwandlungsgesetz\nSchleswig-Holstein Amtsgericht Kiel HRB 10868\nTruck-Center Uhl GmbH – Henstedt-Ulzburg",
      "type": "Registerbekanntmachung nach dem Umwandlungsgesetz",
      "state": "Schleswig-Holstein",
      "amtsgericht": "Amtsgericht Kiel",
      "registernummer": "HRB 10868",
      "registerart": "HRB",
      "company_name": "Truck-Center Uhl GmbH",
      "company_seat": "Henstedt-Ulzburg",
      "details": "24.10.2025 (Bekanntmachungsdatum)\n\nSchleswig-Holstein Amtsgericht Kiel HRB 10868\nRegisterbekanntmachung nach dem Umwandlungsgesetz 23.10.2025 (Eintragungsdatum)\n\nTruck-Center Uhl GmbH\nGesellschaft mit beschränkter Haftung\nHenstedt-Ulzburg\n\nZu Eintragungsnummer 7 vom 23.10.2025 wird als nicht eingetragen veröffentlicht: Den Gläubigern der an der Verschmelzung beteiligten Rechtsträger ist, wenn sie binnen sechs Monaten nach dem Tag, an dem die Eintragung der Verschmelzung in das Register des Sitzes desjenigen Rechtsträgers, dessen Gläubiger sie sind, nach § 19 Abs. 3 UmwG bekannt gemacht worden ist, ihren Anspruch nach Grund und Höhe schriftlich anmelden, Sicherheit zu leisten, soweit sie nicht Befriedigung verlangen können. Dieses Recht steht den Gläubigern jedoch nur zu, wenn sie glaubhaft machen, dass durch die Verschmelzung die Erfüllung ihrer Forderung gefährdet wird."
    },
    {
      "date": "2025-10-24",
      "id": "135201",
      "original_text": "Einreichung neuer Dokumente\nBaden-Württemberg Amtsgericht Ulm HRB 630670\nTechnische Werke Friedrichshafen GmbH – Friedrichshafen",
      "type": "Einreichung neuer Dokumente",
      "state": "Baden-Württemberg",
      "amtsgericht": "Amtsgericht Ulm",
      "registernummer": "HRB 630670",
      "registerart": "HRB",
      "company_name": "Technische Werke Friedrichshafen GmbH",
      "company_seat": "Friedrichshafen",
      "details": "24.10.2025 (Bekanntmachungsdatum)\n\nBaden-Württemberg Amtsgericht Ulm HRB 630670\nEinreichung neuer Dokumente\n\nTechnische Werke Friedrichshafen GmbH\nGesellschaft mit beschränkter Haftung\nFriedrichshafen\n\nDie Gesellschaft hat am 23.10.2025 die Liste über die Zusammensetzung des Aufsichtsrats zum Handelsregister eingereicht."
    },
    {
      "date": "2025-10-24",
      "id": "135202",
      "original_text": "Registerbekanntmachung nach dem Umwandlungsgesetz\nBaden-Württemberg Amtsgericht Ulm HRB 746533\nAniCura Hannover GmbH – Ravensburg",
      "type": "Registerbekanntmachung nach dem Umwandlungsgesetz",
      "state": "Baden-Württemberg",
      "amtsgericht": "Amtsgericht Ulm",
      "registernummer": "HRB 746533",
      "registerart": "HRB",
      "company_name": "AniCura Hannover GmbH",
      "company_seat": "Ravensburg",
      "details": "24.10.2025 (Bekanntmachungsdatum)\n\nBaden-Württemberg Amtsgericht Ulm HRB 746533\nRegisterbekanntmachung nach dem Umwandlungsgesetz 24.10.2025 (Eintragungsdatum)\n\nAniCura Hannover GmbH\nGesellschaft mit beschränkter Haftung\nRavensburg\n\nAls nicht eingetragen wird bekanntgemacht:\nDen Gläubigern der an der Verschmelzung beteiligten Rechtsträger ist, wenn sie binnen sechs Monaten nach dem Tag, an dem die Eintragung der Verschmelzung in das Register des Sitzes desjenigen Rechtsträgers, dessen Gläubiger sie sind, nach § 19 Abs. 3 UmwG als bekanntgemacht gilt, ihren Anspruch nach Grund und Höhe schriftlich anmelden, Sicherheit zu leisten, soweit sie nicht Befriedigung verlangen können. Dieses Recht steht den Gläubigern jedoch nur zu, wenn sie glaubhaft machen, dass durch die Verschmelzung die Erfüllung ihrer Forderung gefährdet wird."
    },
    {
      "date": "2025-10-24",
      "id": "135203",
      "original_text": "Sonstige Registerbekanntmachung\nBaden-Württemberg Amtsgericht Ulm HRB 723523\nESCAD Design GmbH – Pfullendorf",
      "type": "Sonstige Registerbekanntmachung",
      "state": "Baden-Württemberg",
      "amtsgericht": "Amtsgericht Ulm",
      "registernummer": "HRB 723523",
      "registerart": "HRB",
      "company_name": "ESCAD Design GmbH",
      "company_seat": "Pfullendorf",
      "details": "24.10.2025 (Bekanntmachungsdatum)\n\nBaden-Württemberg Amtsgericht Ulm HRB 723523\nSonstige Registerbekanntmachung 22.05.2025 (Eintragungsdatum)\n\nESCAD Design GmbH\nGesellschaft mit beschränkter Haftung\nPfullendorf\n\nAls nicht eingetragen wird bekanntgemacht:\nDen Gläubigern der Gesellschaft, deren Forderungen begründet worden sind, bevor die Eintragung der Beendigung des Vertrages in das Handelsregister nach § 10 HGB als bekanntgemacht gilt, ist vom anderen Vertragsteil Sicherheit zu leisten, wenn sie sich binnen sechs Monaten nach der Bekanntmachung zu diesem Zweck bei ihm melden."
    },
    {
      "date": "2025-10-24",
      "id": "135204",
      "original_text": "Sonstige Registerbekanntmachung\nBaden-Württemberg Amtsgericht Ulm HRB 746533\nAniCura Hannover GmbH – Ravensburg",
      "type": "Sonstige Registerbekanntmachung",
      "state": "Baden-Württemberg",
      "amtsgericht": "Amtsgericht Ulm",
      "registernummer": "HRB 746533",
      "registerart": "HRB",
      "company_name": "AniCura Hannover GmbH",
      "company_seat": "Ravensburg",
      "details": "24.10.2025 (Bekanntmachungsdatum)\n\nBaden-Württemberg Amtsgericht Ulm HRB 746533\nSonstige Registerbekanntmachung 25.09.2025 (Eintragungsdatum)\n\nAniCura Hannover GmbH\nGesellschaft mit beschränkter Haftung\nRavensburg\n\nAls nicht eingetragen wird bekanntgemacht:\nDen Gläubigern der Gesellschaft, deren Forderungen begründet worden sind, bevor die Eintragung der Beendigung des Vertrages in das Handelsregister nach § 10 HGB als bekanntgemacht gilt, ist vom anderen Vertragsteil Sicherheit zu leisten, wenn sie sich binnen sechs Monaten nach der Bekanntmachung zu diesem Zweck bei ihm melden."
    },
    {
      "date": "2025-10-24",
      "id": "135205",
      "original_text": "Registerbekanntmachung nach dem Umwandlungsgesetz\nHamburg Amtsgericht Hamburg HRB 125740\nBauer Media Audio Holding GmbH – Hamburg",
      "type": "Registerbekanntmachung nach dem Umwandlungsgesetz",
      "state": "Hamburg",
      "amtsgericht": "Amtsgericht Hamburg",
      "registernummer": "HRB 125740",
      "registerart": "HRB",
      "company_name": "Bauer Media Audio Holding GmbH",
      "company_seat": "Hamburg",
      "details": "24.10.2025 (Bekanntmachungsdatum)\n\nHamburg Amtsgericht Hamburg HRB 125740\nRegisterbekanntmachung nach dem Umwandlungsgesetz 24.10.2025 (Eintragungsdatum)\n\nBauer Media Audio Holding GmbH\nGesellschaft mit beschränkter Haftung\nHamburg\n\n1. Die Gesellschaft hat gemäß § 10 HGB den Entwurf eines Verschmelzungsplans betreffend einer grenzüberschreitenden Verschmelzung zum Handelsregister eingereicht.\nGemäß § 308 UmwG werden folgende Angaben bekanntgemacht:\n\n2. An der grenzüberschreitenden Verschmelzung sind die WKW FM Limited, eingetragen im irischen Companies Registration Office unter Nr. 347498 mit Sitz (registered Office) in Marconi House, Digges Lane, Dublin 2, Dublin, D02 TD60, Irland, in der Rechtsform einer Kapitalgesellschaft mit beschränkter Haftung irischen Rechts, als übertragende Gesellschaft und die Bauer Media Audio Holding GmbH, eine nach dem Recht der Bundesrepublik Deutschland errichtete Gesellschaft in der Rechtsform der Gesellschaft mit beschränkter Haftung mit Sitz in Hamburg, Deutschland, eingetragen im Handelsregister des Amtsgerichts Hamburg unter HRB 125740 und der Geschäftsanschrift Burchardstraße 11, 20095 Hamburg, als übernehmende Gesellschaft, beteiligt.\n3. Die Register, bei denen die an der grenzüberschreitenden Verschmelzung beteiligten Gesellschaften eingetragen sind, sind die Folgenden:\na. Die übertragende Gesellschaft, WKW FM Limited, ist eingetragen im irischen Companies Registration Office unter Nr. 347498.\nb. Die übernehmende Gesellschaft, Bauer Media Audio Holding GmbH, ist eingetragen im Handelsregister des Amtsgerichts Hamburg unter HRB 125740.\n4. Die Anteilsinhaber und Gläubiger der an der grenzüberschreitenden Verschmelzung beteiligten Gesellschaften sowie die zuständigen Betriebsräte der an der grenzüberschreitenden Verschmelzung beteiligten Gesellschaften oder, soweit es keinen Betriebsrat gibt, die Arbeitnehmer der an der grenzüberschreitenden Verschmelzung beteiligten Gesellschaften, werden darauf hingewiesen, dass sie der jeweiligen Gesellschaft spätestens fünf Arbeitstage vor dem Tag der Gesellschafterversammlung der Bauer Media Audio Holding GmbH, die über die Verschmelzung beschließt, Bemerkungen zum Verschmelzungsplan übermitteln können. Ein Verschmelzungsbeschluss der Anteilsinhaber der WKW FM Limited als übertragende Gesellschaft ist gemäß §§ 312 Abs, 2, 307 Abs. 3 UmwG nicht erforderlich, da die Bauer Media Audio Holding GmbH als übernehmende Gesellschaft alle Anteile der übertragenden Gesellschaft hält. Der Tag der Gesellschafterversammlung der Bauer Media Audio Holding GmbH, die über die Verschmelzung beschließt, steht noch nicht fest. Nach § 308 Abs. 1 Satz 4 UmwG darf die Versammlung der Anteilsinhaber frühestens einen Monat nach der Bekanntmachung über die Zustimmung zu dem Verschmelzungsplan beschließen. Unter Beachtung dieser Regelung und weiterer Umstände, die die Beteiligten im Zusammenhang mit der Verschmelzung berücksichtigen, endet die Frist zur Übermittlung von Bemerkungen zum Verschmelzungsplan am 24. November 2025."
    },
    {
      "date": "2025-10-24",
      "id": "135206",
      "original_text": "Registerbekanntmachung nach dem Umwandlungsgesetz\nBaden-Württemberg Amtsgericht Stuttgart HRA 742121\nLidl 432 GmbH & Co. KG – Bad Wimpfen",
      "type": "Registerbekanntmachung nach dem Umwandlungsgesetz",
      "state": "Baden-Württemberg",
      "amtsgericht": "Amtsgericht Stuttgart",
      "registernummer": "HRA 742121",
      "registerart": "HRA",
      "company_name": "Lidl 432 GmbH & Co. KG",
      "company_seat": "Bad Wimpfen",
      "details": "24.10.2025 (Bekanntmachungsdatum)\n\nBaden-Württemberg Amtsgericht Stuttgart HRA 742121\nRegisterbekanntmachung nach dem Umwandlungsgesetz 24.10.2025 (Eintragungsdatum)\n\nLidl 432 GmbH & Co. KG\nKommanditgesellschaft\nBad Wimpfen\n\nAls nicht eingetragen wird bekanntgemacht:\nDen Gläubigern der an der Ausgliederung beteiligten Rechtsträger ist, wenn sie binnen sechs Monaten nach dem Tag, an dem die Eintragung der Ausgliederung in das Register des Sitzes desjenigen Rechtsträgers, dessen Gläubiger sie sind, nach § 19 Abs. 3 UmwG als bekanntgemacht gilt, ihren Anspruch nach Grund und Höhe schriftlich anmelden, Sicherheit zu leisten, soweit sie nicht Befriedigung verlangen können. Dieses Recht steht den Gläubigern jedoch nur zu, wenn sie glaubhaft machen, dass durch die Ausgliederung die Erfüllung ihrer Forderung gefährdet wird."
    },
    {
      "date": "2025-10-24",
      "id": "135207",
      "original_text": "Registerbekanntmachung nach dem Umwandlungsgesetz\nHamburg Amtsgericht Hamburg HRB 135702\nHerkules Immobilien Management GmbH – Hamburg",
      "type": "Registerbekanntmachung nach dem Umwandlungsgesetz",
      "state": "Hamburg",
      "amtsgericht": "Amtsgericht Hamburg",
      "registernummer": "HRB 135702",
      "registerart": "HRB",
      "company_name": "Herkules Immobilien Management GmbH",
      "company_seat": "Hamburg",
      "details": "24.10.2025 (Bekanntmachungsdatum)\n\nHamburg Amtsgericht Hamburg HRB 135702\nRegisterbekanntmachung nach dem Umwandlungsgesetz 24.10.2025 (Eintragungsdatum)\n\nHerkules Immobilien Management GmbH\nGesellschaft mit beschränkter Haftung\nHamburg\n\nAls nicht eingetragen wird bekannt gemacht:\nDen Gläubigern der an der Verschmelzung beteiligten Gesellschaften ist, wenn sie binnen sechs Monaten nach dem Tag, an dem die Eintragung der Verschmelzung in das Register des Sitzes desjenigen Rechtsträgers, dessen Gläubiger sie sind, nach § 19 Absatz 3 UmwG als bekannt gemacht gilt, ihren Anspruch nach Grund und Höhe schriftlich anmelden, Sicherheit zu leisten, soweit sie nicht Befriedigung verlangen können. Dieses Recht steht den Gläubigern jedoch nur zu, wenn sie glaubhaft machen, dass durch die Verschmelzung die Erfüllung ihrer Forderung gefährdet wird."
    },
    {
      "date": "2025-10-24",
      "id": "135208",
      "original_text": "Registerbekanntmachung nach dem Umwandlungsgesetz\nHamburg Amtsgericht Hamburg HRB 126655\nHerkules Consulting GmbH – Hamburg",
      "type": "Registerbekanntmachung nach dem Umwandlungsgesetz",
      "state": "Hamburg",
      "amtsgericht": "Amtsgericht Hamburg",
      "registernummer": "HRB 126655",
      "registerart": "HRB",
      "company_name": "Herkules Consulting GmbH",
      "company_seat": "Hamburg",
      "details": "24.10.2025 (Bekanntmachungsdatum)\n\nHamburg Amtsgericht Hamburg HRB 126655\nRegisterbekanntmachung nach dem Umwandlungsgesetz 24.10.2025 (Eintragungsdatum)\n\nHerkules Consulting GmbH\nGesellschaft mit beschränkter Haftung\nHamburg\n\nAls nicht eingetragen wird bekannt gemacht:\nDen Gläubigern der an der Verschmelzung beteiligten Gesellschaften ist, wenn sie binnen sechs Monaten nach dem Tag, an dem die Eintragung der Verschmelzung in das Register des Sitzes desjenigen Rechtsträgers, dessen Gläubiger sie sind, nach § 19 Absatz 3 UmwG als bekannt gemacht gilt, ihren Anspruch nach Grund und Höhe schriftlich anmelden, Sicherheit zu leisten, soweit sie nicht Befriedigung verlangen können. Dieses Recht steht den Gläubigern jedoch nur zu, wenn sie glaubhaft machen, dass durch die Verschmelzung die Erfüllung ihrer Forderung gefährdet wird."
    },
    {
      "date": "2025-10-24",
      "id": "135209",
      "original_text": "Löschungsankündigung\nBerlin Amtsgericht Berlin (Charlottenburg) HRA 48263\nAirlink Passage Service Berlin GmbH & Co. KG – Berlin",
      "type": "Löschungsankündigung",
      "state": "Berlin",
      "amtsgericht": "Amtsgericht Berlin (Charlottenburg)",
      "registernummer": "HRA 48263",
      "registerart": "HRA",
      "company_name": "Airlink Passage Service Berlin GmbH & Co. KG",
      "company_seat": "Berlin",
      "details": "24.10.2025 (Bekanntmachungsdatum)\n\nBerlin Amtsgericht Berlin (Charlottenburg) HRA 48263\nLöschungsankündigung\n\nAirlink Passage Service Berlin GmbH & Co. KG\nKommanditgesellschaft\nBerlin\n\nBei dem nachstehenden Unternehmen / der nachstehenden Gesellschaft wird das Amtslöschungsverfahren gemäß § 31 Abs. 2 HGB eingeleitet. Widerspruchsfrist 2 Monate"
    },
    {
      "date": "2025-10-24",
      "id": "135210",
      "original_text": "Löschungsankündigung\nBerlin Amtsgericht Berlin (Charlottenburg) HRB 201849\nPEAK Property and Facility Services GmbH – Berlin",
      "type": "Löschungsankündigung",
      "state": "Berlin",
      "amtsgericht": "Amtsgericht Berlin (Charlottenburg)",
      "registernummer": "HRB 201849",
      "registerart": "HRB",
      "company_name": "PEAK Property and Facility Services GmbH",
      "company_seat": "Berlin",
      "details": "24.10.2025 (Bekanntmachungsdatum)\n\nBerlin Amtsgericht Berlin (Charlottenburg) HRB 201849\nLöschungsankündigung\n\nPEAK Property and Facility Services GmbH\nGesellschaft mit beschränkter Haftung\nBerlin\n\nBei der nachstehenden Gesellschaft wird das Amtslöschungsverfahren gemäß § 394 FamFG eingeleitet. Widerspruchsfrist 6 Wochen"
    },
    {
      "date": "2025-10-24",
      "id": "135211",
      "original_text": "Einreichung neuer Dokumente\nBrandenburg Amtsgericht Frankfurt/Oder HRB 1512\nHELIOS Klinikum Bad Saarow GmbH – Bad Saarow",
      "type": "Einreichung neuer Dokumente",
      "state": "Brandenburg",
      "amtsgericht": "Amtsgericht Frankfurt/Oder",
      "registernummer": "HRB 1512",
      "registerart": "HRB",
      "company_name": "HELIOS Klinikum Bad Saarow GmbH",
      "company_seat": "Bad Saarow",
      "details": "24.10.2025 (Bekanntmachungsdatum)\n\nBrandenburg Amtsgericht Frankfurt/Oder HRB 1512\nEinreichung neuer Dokumente\n\nHELIOS Klinikum Bad Saarow GmbH\nGesellschaft mit beschränkter Haftung\nBad Saarow\n\nAls nicht eingetragen wird veröffentlicht:  Die Gesellschaft hat Änderungen im Aufsichtsrat angezeigt."
    },
    {
      "date": "2025-10-24",
      "id": "135212",
      "original_text": "Löschungsankündigung\nBerlin Amtsgericht Berlin (Charlottenburg) HRB 200426\nProject Prism GmbH – Berlin",
      "type": "Löschungsankündigung",
      "state": "Berlin",
      "amtsgericht": "Amtsgericht Berlin (Charlottenburg)",
      "registernummer": "HRB 200426",
      "registerart": "HRB",
      "company_name": "Project Prism GmbH",
      "company_seat": "Berlin",
      "details": "24.10.2025 (Bekanntmachungsdatum)\n\nBerlin Amtsgericht Berlin (Charlottenburg) HRB 200426\nLöschungsankündigung\n\nProject Prism GmbH\nGesellschaft mit beschränkter Haftung\nBerlin\n\nBei der nachstehenden Gesellschaft wird das Amtslöschungsverfahren gemäß § 394 FamFG eingeleitet. Widerspruchsfrist\n6 Wochen."
    },
    {
      "date": "2025-10-24",
      "id": "135213",
      "original_text": "Löschungsankündigung\nBerlin Amtsgericht Berlin (Charlottenburg) HRB 217408\nStays GmbH – Berlin",
      "type": "Löschungsankündigung",
      "state": "Berlin",
      "amtsgericht": "Amtsgericht Berlin (Charlottenburg)",
      "registernummer": "HRB 217408",
      "registerart": "HRB",
      "company_name": "Stays GmbH",
      "company_seat": "Berlin",
      "details": "24.10.2025 (Bekanntmachungsdatum)\n\nBerlin Amtsgericht Berlin (Charlottenburg) HRB 217408\nLöschungsankündigung\n\nStays GmbH\nGesellschaft mit beschränkter Haftung\nBerlin\n\nBei der nachstehenden Gesellschaft wird das Amtslöschungsverfahren gemäß § 394 FamFG eingeleitet. Widerspruchsfrist\n6 Wochen."
    },
    {
      "date": "2025-10-24",
      "id": "135214",
      "original_text": "Löschungsankündigung\nSachsen Amtsgericht Chemnitz HRB 3596\nGärtnerei-, Betriebs- und Verwaltungs GmbH Warmbad – Großolbersdorf",
      "type": "Löschungsankündigung",
      "state": "Sachsen",
      "amtsgericht": "Amtsgericht Chemnitz",
      "registernummer": "HRB 3596",
      "registerart": "HRB",
      "company_name": "Gärtnerei-, Betriebs- und Verwaltungs GmbH Warmbad",
      "company_seat": "Großolbersdorf",
      "details": "24.10.2025 (Bekanntmachungsdatum)\n\nSachsen Amtsgericht Chemnitz HRB 3596\nLöschungsankündigung\n\nGärtnerei-, Betriebs- und Verwaltungs GmbH Warmbad\nGesellschaft mit beschränkter Haftung\nGroßolbersdorf\n\nDas Registergericht beabsichtigt, die im Handelsregister eingetragene Gesellschaft von Amts wegen nach § 394 FamFG zu löschen. Die Frist zu Erhebung eines Widerspruchs gegen die beabsichtigte Löschung wird auf einen Monat festgesetzt."
    },
    {
      "date": "2025-10-24",
      "id": "135215",
      "original_text": "Registerbekanntmachung nach dem Umwandlungsgesetz\nSachsen Amtsgericht Chemnitz HRB 35713\nWindpark Niederlungwitz Struktur GmbH – Glauchau",
      "type": "Registerbekanntmachung nach dem Umwandlungsgesetz",
      "state": "Sachsen",
      "amtsgericht": "Amtsgericht Chemnitz",
      "registernummer": "HRB 35713",
      "registerart": "HRB",
      "company_name": "Windpark Niederlungwitz Struktur GmbH",
      "company_seat": "Glauchau",
      "details": "24.10.2025 (Bekanntmachungsdatum)\n\nSachsen Amtsgericht Chemnitz HRB 35713\nRegisterbekanntmachung nach dem Umwandlungsgesetz 24.10.2025 (Eintragungsdatum)\n\nWindpark Niederlungwitz Struktur GmbH\nGesellschaft mit beschränkter Haftung\nGlauchau\n\nDen Gläubigern der an der Verschmelzung beteiligten Rechtsträger ist, wenn sie binnen sechs Monaten nach dem Tag, an dem die Eintragung der Verschmelzung in das Register des Sitzes desjenigen Rechtsträgers, dessen Gläubiger sie sind, nach § 19 Abs. 3 UmwG als bekannt gemacht gilt, ihren Anspruch nach Grund und Höhe in Textform anmelden, Sicherheit zu leisten, soweit sie nicht Befriedigung verlangen können. Dieses Recht steht den Gläubigern jedoch nur zu, wenn sie glaubhaft machen, dass durch die Verschmelzung die Erfüllung der Forderung gefährdet wird."
    },
    {
      "date": "2025-10-24",
      "id": "135216",
      "original_text": "Registerbekanntmachung nach dem Umwandlungsgesetz\nSachsen Amtsgericht Chemnitz HRB 37810\nWH Immobilien GmbH – Oelsnitz/Erzgeb.",
      "type": "Registerbekanntmachung nach dem Umwandlungsgesetz",
      "state": "Sachsen",
      "amtsgericht": "Amtsgericht Chemnitz",
      "registernummer": "HRB 37810",
      "registerart": "HRB",
      "company_name": "WH Immobilien GmbH",
      "company_seat": "Oelsnitz/Erzgeb.",
      "details": "24.10.2025 (Bekanntmachungsdatum)\n\nSachsen Amtsgericht Chemnitz HRB 37810\nRegisterbekanntmachung nach dem Umwandlungsgesetz 24.10.2025 (Eintragungsdatum)\n\nWH Immobilien GmbH\nGesellschaft mit beschränkter Haftung\nOelsnitz/Erzgeb.\n\nDen Gläubigern der an der Umwandlung beteiligten Rechtsträger ist, wenn sie binnen sechs Monaten nach dem Tag, an dem die Eintragung der Umwandlung in das Register des Sitzes desjenigen Rechtsträgers, dessen Gläubiger sie sind, nach § 19 Abs. 3 UmwG als bekannt gemacht gilt, ihren Anspruch nach Grund und Höhe in Textform anmelden, Sicherheit zu leisten, soweit sie nicht Befriedigung verlangen können. Dieses Recht steht den Gläubigern jedoch nur zu, wenn sie glaubhaft machen, dass durch die Umwandlung die Erfüllung der Forderung gefährdet wird."
    },
    {
      "date": "2025-10-24",
      "id": "135217",
      "original_text": "Sonstige Registerbekanntmachung\nSachsen Amtsgericht Chemnitz HRB 21836\nPressless GmbH – Flöha",
      "type": "Sonstige Registerbekanntmachung",
      "state": "Sachsen",
      "amtsgericht": "Amtsgericht Chemnitz",
      "registernummer": "HRB 21836",
      "registerart": "HRB",
      "company_name": "Pressless GmbH",
      "company_seat": "Flöha",
      "details": "24.10.2025 (Bekanntmachungsdatum)\n\nSachsen Amtsgericht Chemnitz HRB 21836\nSonstige Registerbekanntmachung 24.10.2025 (Eintragungsdatum)\n\nPressless GmbH\nGesellschaft mit beschränkter Haftung\nFlöha\n\nDen Gläubigern der Gesellschaft, deren Forderungen begründet worden sind bevor die Eintragung der Beendigung des Gewinnabführungsvertrages in das Handelsregister nach § 10 des Handelsgesetzbuches als bekanntgemacht gilt, hat der andere Vertragsteil Sicherheit zu leisten, wenn sie sich binnen sechs Monaten nach der Bekanntmachung der Eintragung zu diesem Zweck bei ihm melden."
    },
    {
      "date": "2025-10-24",
      "id": "135218",
      "original_text": "Registerbekanntmachung nach dem Umwandlungsgesetz\nSachsen Amtsgericht Chemnitz HRB 34829\nWowa Energy GmbH – Oberwiera",
      "type": "Registerbekanntmachung nach dem Umwandlungsgesetz",
      "state": "Sachsen",
      "amtsgericht": "Amtsgericht Chemnitz",
      "registernummer": "HRB 34829",
      "registerart": "HRB",
      "company_name": "Wowa Energy GmbH",
      "company_seat": "Oberwiera",
      "details": "24.10.2025 (Bekanntmachungsdatum)\n\nSachsen Amtsgericht Chemnitz HRB 34829\nRegisterbekanntmachung nach dem Umwandlungsgesetz 24.10.2025 (Eintragungsdatum)\n\nWowa Energy GmbH\nGesellschaft mit beschränkter Haftung\nOberwiera\n\nDen Gläubigern der an der Verschmelzung beteiligten Rechtsträger ist, wenn sie binnen sechs Monaten nach dem Tag, an dem die Eintragung der Verschmelzung in das Register des Sitzes desjenigen Rechtsträgers, dessen Gläubiger sie sind, nach § 19 Abs. 3 UmwG als bekannt gemacht gilt, ihren Anspruch nach Grund und Höhe in Textform anmelden, Sicherheit zu leisten, soweit sie nicht Befriedigung verlangen können. Dieses Recht steht den Gläubigern jedoch nur zu, wenn sie glaubhaft machen, dass durch die Verschmelzung die Erfüllung der Forderung gefährdet wird."
    },
    {
      "date": "2025-10-24",
      "id": "135219",
      "original_text": "Löschungsankündigung\nSachsen Amtsgericht Leipzig HRB 18498\nCCL Callcenter Leipzig GmbH – Leipzig",
      "type": "Löschungsankündigung",
      "state": "Sachsen",
      "amtsgericht": "Amtsgericht Leipzig",
      "registernummer": "HRB 18498",
      "registerart": "HRB",
      "company_name": "CCL Callcenter Leipzig GmbH",
      "company_seat": "Leipzig",
      "details": "24.10.2025 (Bekanntmachungsdatum)\n\nSachsen Amtsgericht Leipzig HRB 18498\nLöschungsankündigung 24.10.2025 (Eintragungsdatum)\n\nCCL Callcenter Leipzig GmbH\nGesellschaft mit beschränkter Haftung\nLeipzig\n\nDas Registergericht beabsichtigt, die im Handelsregister eingetragene Gesellschaft von Amts wegen nach § 394 FamFG zu löschen. Die Frist zu Erhebung eines Widerspruchs gegen die beabsichtigte Löschung wird auf einen Monat festgesetzt."
    },
    {
      "date": "2025-10-24",
      "id": "135220",
      "original_text": "Registerbekanntmachung nach dem Umwandlungsgesetz\nSachsen Amtsgericht Chemnitz HRA 5234\nWH Immobilien GmbH & Co. KG – Oelsnitz/Erzgeb.",
      "type": "Registerbekanntmachung nach dem Umwandlungsgesetz",
      "state": "Sachsen",
      "amtsgericht": "Amtsgericht Chemnitz",
      "registernummer": "HRA 5234",
      "registerart": "HRA",
      "company_name": "WH Immobilien GmbH & Co. KG",
      "company_seat": "Oelsnitz/Erzgeb.",
      "details": "24.10.2025 (Bekanntmachungsdatum)\n\nSachsen Amtsgericht Chemnitz HRA 5234\nRegisterbekanntmachung nach dem Umwandlungsgesetz 24.10.2025 (Eintragungsdatum)\n\nWH Immobilien GmbH & Co. KG\nKommanditgesellschaft\nOelsnitz/Erzgeb.\n\nDen Gläubigern der an der Umwandlung beteiligten Rechtsträger ist, wenn sie binnen sechs Monaten nach dem Tag, an dem die Eintragung der Umwandlung in das Register des Sitzes desjenigen Rechtsträgers, dessen Gläubiger sie sind, nach § 19 Abs. 3 UmwG als bekannt gemacht gilt, ihren Anspruch nach Grund und Höhe in Textform anmelden, Sicherheit zu leisten, soweit sie nicht Befriedigung verlangen können. Dieses Recht steht den Gläubigern jedoch nur zu, wenn sie glaubhaft machen, dass durch die Umwandlung die Erfüllung der Forderung gefährdet wird."
    },
    {
      "date": "2025-10-24",
      "id": "135221",
      "original_text": "Löschungsankündigung\nNiedersachsen Amtsgericht Lüneburg HRB 102164\nT.B.L. Gesellschaft mit beschränkter Haftung – Eicklingen",
      "type": "Löschungsankündigung",
      "state": "Niedersachsen",
      "amtsgericht": "Amtsgericht Lüneburg",
      "registernummer": "HRB 102164",
      "registerart": "HRB",
      "company_name": "T.B.L. Gesellschaft mit beschränkter Haftung",
      "company_seat": "Eicklingen",
      "details": "24.10.2025 (Bekanntmachungsdatum)\n\nNiedersachsen Amtsgericht Lüneburg HRB 102164\nLöschungsankündigung\n\nT.B.L. Gesellschaft mit beschränkter Haftung\nGesellschaft mit beschränkter Haftung\nEicklingen\n\nDas Registergericht beabsichtigt, die Gesellschaft von Amts wegen nach § 394 FamFG zu löschen. Die Frist zur Erhebung eines Widerspruchs ist auf 1 Monat ab dieser Registerbekanntmachung festgesetzt."
    },
    {
      "date": "2025-10-24",
      "id": "135222",
      "original_text": "Löschungsankündigung\nNiedersachsen Amtsgericht Osnabrück HRB 203940\nGabionac GmbH – Osnabrück",
      "type": "Löschungsankündigung",
      "state": "Niedersachsen",
      "amtsgericht": "Amtsgericht Osnabrück",
      "registernummer": "HRB 203940",
      "registerart": "HRB",
      "company_name": "Gabionac GmbH",
      "company_seat": "Osnabrück",
      "details": "24.10.2025 (Bekanntmachungsdatum)\n\nNiedersachsen Amtsgericht Osnabrück HRB 203940\nLöschungsankündigung\n\nGabionac GmbH\nGesellschaft mit beschränkter Haftung\nOsnabrück\n\nDas Registergericht beabsichtigt, die Gesellschaft von Amts wegen nach § 394 FamFG wegen Vermögenslosigkeit zu löschen. Die Frist zur Erhebung eines Widerspruchs ist auf 1 Monat ab dieser Registerbekanntmachung festgesetzt."
    },
    {
      "date": "2025-10-24",
      "id": "135223",
      "original_text": "Registerbekanntmachung nach dem Umwandlungsgesetz\nNiedersachsen Amtsgericht Hildesheim HRA 203158\nMetallbau Czyrnik GmbH & Co. KG – Peine",
      "type": "Registerbekanntmachung nach dem Umwandlungsgesetz",
      "state": "Niedersachsen",
      "amtsgericht": "Amtsgericht Hildesheim",
      "registernummer": "HRA 203158",
      "registerart": "HRA",
      "company_name": "Metallbau Czyrnik GmbH & Co. KG",
      "company_seat": "Peine",
      "details": "24.10.2025 (Bekanntmachungsdatum)\n\nNiedersachsen Amtsgericht Hildesheim HRA 203158\nRegisterbekanntmachung nach dem Umwandlungsgesetz 24.10.2025 (Eintragungsdatum)\n\nMetallbau Czyrnik GmbH & Co. KG\nKommanditgesellschaft\nPeine\n\nDen Gläubigern der an der Ausgliederung beteiligten Rechtsträger ist, wenn sie binnen sechs Monaten nach dem Tag, an dem die Eintragung der Ausgliederung in das Register des Sitzes desjenigen Rechtsträgers, dessen Gläubiger sie sind, nach § 19 Abs. 3 UmwG als bekannt gemacht gilt, ihren Anspruch nach Grund und Höhe schriftlich anmelden, Sicherheit zu leisten, soweit sie nicht Befriedigung verlangen können. Dieses Recht steht den Gläubigern jedoch nur zu, wenn sie glaubhaft machen, dass durch die Ausgliederung die Erfüllung der Forderung gefährdet wird."
    },
    {
      "date": "2025-10-24",
      "id": "135224",
      "original_text": "Registerbekanntmachung nach dem Umwandlungsgesetz\nNiedersachsen Amtsgericht Lüneburg HRB 204136\nurban apes Lüneburg Verwaltungs GmbH – Lüneburg",
      "type": "Registerbekanntmachung nach dem Umwandlungsgesetz",
      "state": "Niedersachsen",
      "amtsgericht": "Amtsgericht Lüneburg",
      "registernummer": "HRB 204136",
      "registerart": "HRB",
      "company_name": "urban apes Lüneburg Verwaltungs GmbH",
      "company_seat": "Lüneburg",
      "details": "24.10.2025 (Bekanntmachungsdatum)\n\nNiedersachsen Amtsgericht Lüneburg HRB 204136\nRegisterbekanntmachung nach dem Umwandlungsgesetz 24.10.2025 (Eintragungsdatum)\n\nurban apes Lüneburg Verwaltungs GmbH\nGesellschaft mit beschränkter Haftung\nLüneburg\n\nDen Gläubigern der an der Verschmelzung beteiligten Rechtsträger ist, wenn sie binnen sechs Monaten nach dem Tag, an dem die Eintragung der Verschmelzung in das Register des Sitzes desjenigen Rechtsträgers, dessen Gläubiger sie sind, nach § 19  Abs.  3 UmwG als bekannt gemacht gilt, ihren Anspruch nach Grund und Höhe schriftlich anmelden, Sicherheit zu leisten, soweit sie nicht Befriedigung verlangen können. Dieses Recht steht den Gläubigern jedoch nur zu, wenn sie glaubhaft machen, dass durch die Verschmelzung die Erfüllung der Forderung gefährdet wird."
    },
    {
      "date": "2025-10-24",
      "id": "135225",
      "original_text": "Registerbekanntmachung nach dem Umwandlungsgesetz\nNiedersachsen Amtsgericht Hildesheim HRA 203145\nNorbert Czyrnik e.K. – Peine",
      "type": "Registerbekanntmachung nach dem Umwandlungsgesetz",
      "state": "Niedersachsen",
      "amtsgericht": "Amtsgericht Hildesheim",
      "registernummer": "HRA 203145",
      "registerart": "HRA",
      "company_name": "Norbert Czyrnik e.K.",
      "company_seat": "Peine",
      "details": "24.10.2025 (Bekanntmachungsdatum)\n\nNiedersachsen Amtsgericht Hildesheim HRA 203145\nRegisterbekanntmachung nach dem Umwandlungsgesetz 24.10.2025 (Eintragungsdatum)\n\nNorbert Czyrnik e.K.\nEinzelkaufmann / Einzelkauffrau\nPeine\n\nDen Gläubigern der an der Ausgliederung beteiligten Rechtsträger ist, wenn sie binnen sechs Monaten nach dem Tag, an dem die Eintragung der Ausgliederung in das Register des Sitzes desjenigen Rechtsträgers, dessen Gläubiger sie sind, nach § 19 Abs. 3 UmwG als bekannt gemacht gilt, ihren Anspruch nach Grund und Höhe schriftlich anmelden, Sicherheit zu leisten, soweit sie nicht Befriedigung verlangen können. Dieses Recht steht den Gläubigern jedoch nur zu, wenn sie glaubhaft machen, dass durch die Ausgliederung die Erfüllung der Forderung gefährdet wird."
    },
    {
      "date": "2025-10-24",
      "id": "135226",
      "original_text": "Löschungsankündigung\nNiedersachsen Amtsgericht Oldenburg (Oldenburg) HRA 130840 früher Amtsgericht Wilhelmshaven\nNaPro Tec GmbH & Co. KG – Zetel",
      "type": "Löschungsankündigung",
      "state": "Niedersachsen",
      "amtsgericht": "Amtsgericht Oldenburg (Oldenburg)",
      "registernummer": "HRA 130840",
      "registerart": "HRA",
      "company_name": "NaPro Tec GmbH & Co. KG",
      "company_seat": "Zetel",
      "former_amtsgericht": "Wilhelmshaven",
      "details": "24.10.2025 (Bekanntmachungsdatum)\n\nNiedersachsen Amtsgericht Oldenburg (Oldenburg) HRA 130840 früher Amtsgericht Wilhelmshaven\nLöschungsankündigung\n\nNaPro Tec GmbH & Co. KG\nKommanditgesellschaft\nZetel\n\nDas Registergericht beabsichtigt, die Firma von Amts wegen nach § 31 Abs. 2 Satz 2 HGB, § 393 FamFG zu löschen. Die Frist zur Erhebung eines Widerspruchs ist auf 1 Monat ab dieser Registerbekanntmachung festgesetzt."
    },
    {
      "date": "2025-10-24",
      "id": "135227",
      "original_text": "Sonstige Registerbekanntmachung\nNiedersachsen Amtsgericht Lüneburg HRB 201301\nNehrig Grundstücksgesellschaft mbH – Winsen (Aller)",
      "type": "Sonstige Registerbekanntmachung",
      "state": "Niedersachsen",
      "amtsgericht": "Amtsgericht Lüneburg",
      "registernummer": "HRB 201301",
      "registerart": "HRB",
      "company_name": "Nehrig Grundstücksgesellschaft mbH",
      "company_seat": "Winsen (Aller)",
      "details": "24.10.2025 (Bekanntmachungsdatum)\n\nNiedersachsen Amtsgericht Lüneburg HRB 201301\nSonstige Registerbekanntmachung 24.10.2025 (Eintragungsdatum)\n\nNehrig Grundstücksgesellschaft mbH\nGesellschaft mit beschränkter Haftung\nWinsen (Aller)\n\nDen Gläubigern der Gesellschaft, deren Forderungen begründet worden sind, bevor die Eintragung der Beendigung des Vertrages in das Handelsregister nach § 10 HGB als bekanntgemacht gilt, hat der andere Vertragsteil Sicherheit zu leisten, wenn sie sich binnen sechs Monaten nach der Bekanntmachung der Eintragung zu diesem Zweck bei ihm melden."
    },
    {
      "date": "2025-10-24",
      "id": "135228",
      "original_text": "Einreichung neuer Dokumente\nRheinland-Pfalz Amtsgericht Zweibrücken HRB 30229\nGesellschaft für erneuerbare Energienutzung mbH Schönenberg-Kübelberg – Schönenberg-Kübelberg",
      "type": "Einreichung neuer Dokumente",
      "state": "Rheinland-Pfalz",
      "amtsgericht": "Amtsgericht Zweibrücken",
      "registernummer": "HRB 30229",
      "registerart": "HRB",
      "company_name": "Gesellschaft für erneuerbare Energienutzung mbH Schönenberg-Kübelberg",
      "company_seat": "Schönenberg-Kübelberg",
      "details": "24.10.2025 (Bekanntmachungsdatum)\n\nRheinland-Pfalz Amtsgericht Zweibrücken HRB 30229\nEinreichung neuer Dokumente 23.10.2025 (Eintragungsdatum)\n\nGesellschaft für erneuerbare Energienutzung mbH Schönenberg-Kübelberg\nGesellschaft mit beschränkter Haftung\nSchönenberg-Kübelberg\n\nDem Registergericht ist eine Liste der Mitglieder des Aufsichtsrates eingereicht worden."
    },
    {
      "date": "2025-10-24",
      "id": "135229",
      "original_text": "Löschungsankündigung\nRheinland-Pfalz Amtsgericht Ludwigshafen a.Rhein (Ludwigshafen) HRB 63112\nFSL Personenlogistik Ludwigshafen UG (haftungsbeschränkt) – Ludwigshafen",
      "type": "Löschungsankündigung",
      "state": "Rheinland-Pfalz",
      "amtsgericht": "Amtsgericht Ludwigshafen a.Rhein (Ludwigshafen)",
      "registernummer": "HRB 63112",
      "registerart": "HRB",
      "company_name": "FSL Personenlogistik Ludwigshafen UG (haftungsbeschränkt)",
      "company_seat": "Ludwigshafen",
      "details": "24.10.2025 (Bekanntmachungsdatum)\n\nRheinland-Pfalz Amtsgericht Ludwigshafen a.Rhein (Ludwigshafen) HRB 63112\nLöschungsankündigung\n\nFSL Personenlogistik Ludwigshafen UG (haftungsbeschränkt)\nGesellschaft mit beschränkter Haftung\nLudwigshafen\n\nDas Registergericht beabsichtigt die Gesellschaft von Amts wegen nach § 394 FamFG zu löschen. Die Frist zur Erhebung eines Widerspruchs ist auf einen Monat festgesetzt."
    },
    {
      "date": "2025-10-24",
      "id": "135230",
      "original_text": "Registerbekanntmachung nach dem Umwandlungsgesetz\nNordrhein-Westfalen Amtsgericht Dortmund HRB 37715\nMotido GmbH – Dortmund",
      "type": "Registerbekanntmachung nach dem Umwandlungsgesetz",
      "state": "Nordrhein-Westfalen",
      "amtsgericht": "Amtsgericht Dortmund",
      "registernummer": "HRB 37715",
      "registerart": "HRB",
      "company_name": "Motido GmbH",
      "company_seat": "Dortmund",
      "details": "24.10.2025 (Bekanntmachungsdatum)\n\nNordrhein-Westfalen Amtsgericht Dortmund HRB 37715\nRegisterbekanntmachung nach dem Umwandlungsgesetz 24.10.2025 (Eintragungsdatum)\n\nMotido GmbH\nGesellschaft mit beschränkter Haftung\nDortmund\n\nDen Gläubigern der an der formwechselnden Umwandlung beteiligten Rechtsträger ist, wenn sie binnen sechs Monaten nach dem Tag, an dem die Eintragung der formwechselnden Umwandlung in das Register des Sitzes desjenigen Rechtsträgers, dessen Gläubiger sie sind, nach § 19 Absatz 3 UmwG als bekanntgemacht gilt, ihren Anspruch nach Grund und Höhe schriftlich anmelden, Sicherheit zu leisten, soweit sie nicht Befriedigung verlangen können. Dieses Recht steht den Gläubigern jedoch nur zu, wenn sie glaubhaft machen, dass durch die formwechselnden Umwandlung die Erfüllung ihrer Forderung gefährdet wird."
    },
    {
      "date": "2025-10-24",
      "id": "135231",
      "original_text": "Registerbekanntmachung nach dem Umwandlungsgesetz\nNordrhein-Westfalen Amtsgericht Essen HRB 16612\nDextraData GmbH – Essen",
      "type": "Registerbekanntmachung nach dem Umwandlungsgesetz",
      "state": "Nordrhein-Westfalen",
      "amtsgericht": "Amtsgericht Essen",
      "registernummer": "HRB 16612",
      "registerart": "HRB",
      "company_name": "DextraData GmbH",
      "company_seat": "Essen",
      "details": "24.10.2025 (Bekanntmachungsdatum)\n\nNordrhein-Westfalen Amtsgericht Essen HRB 16612\nRegisterbekanntmachung nach dem Umwandlungsgesetz 24.10.2025 (Eintragungsdatum)\n\nDextraData GmbH\nGesellschaft mit beschränkter Haftung\nEssen\n\nDen Gläubigern der an der Ausgliederung beteiligten Rechtsträger ist, wenn sie binnen sechs Monaten nach dem Tag, an dem die Eintragung der Ausgliederung in das Register des Sitzes desjenigen Rechtsträgers, dessen Gläubiger sie sind, nach § 19 Absatz 3 UmwG als bekanntgemacht gilt, ihren Anspruch nach Grund und Höhe schriftlich anmelden, Sicherheit zu leisten, soweit sie nicht Befriedigung verlangen können. Dieses Recht steht den Gläubigern jedoch nur zu, wenn sie glaubhaft machen, dass durch die Ausgliederung die Erfüllung ihrer Forderung gefährdet wird."
    },
    {
      "date": "2025-10-24",
      "id": "135232",
      "original_text": "Löschungsankündigung\nNordrhein-Westfalen Amtsgericht Lemgo HRB 9632\nKMS Versicherungs UG (haftungsbeschränkt) – Bad Salzuflen",
      "type": "Löschungsankündigung",
      "state": "Nordrhein-Westfalen",
      "amtsgericht": "Amtsgericht Lemgo",
      "registernummer": "HRB 9632",
      "registerart": "HRB",
      "company_name": "KMS Versicherungs UG (haftungsbeschränkt)",
      "company_seat": "Bad Salzuflen",
      "details": "24.10.2025 (Bekanntmachungsdatum)\n\nNordrhein-Westfalen Amtsgericht Lemgo HRB 9632\nLöschungsankündigung 24.10.2025 (Eintragungsdatum)\n\nKMS Versicherungs UG (haftungsbeschränkt)\nGesellschaft mit beschränkter Haftung\nBad Salzuflen\n\nEs ist beabsichtigt, die Gesellschaft von Amts wegen im Hinblick auf das Fehlen jeglichen praktisch einen Wert darstellenden Aktivvermögens wegen Vermögenslosigkeit gemäß § 394 Abs. 1 FamFG zu löschen. Hiergegen kann binnen 3 Monaten nach Veröffentlichung dieser Bekanntmachung Widerspruch beim Amtsgericht Lemgo eingelegt werden."
    },
    {
      "date": "2025-10-24",
      "id": "135233",
      "original_text": "Registerbekanntmachung nach dem Umwandlungsgesetz\nNordrhein-Westfalen Amtsgericht Gelsenkirchen HRB 19216\nSchweisstechnik plus GmbH – Gladbeck",
      "type": "Registerbekanntmachung nach dem Umwandlungsgesetz",
      "state": "Nordrhein-Westfalen",
      "amtsgericht": "Amtsgericht Gelsenkirchen",
      "registernummer": "HRB 19216",
      "registerart": "HRB",
      "company_name": "Schweisstechnik plus GmbH",
      "company_seat": "Gladbeck",
      "details": "24.10.2025 (Bekanntmachungsdatum)\n\nNordrhein-Westfalen Amtsgericht Gelsenkirchen HRB 19216\nRegisterbekanntmachung nach dem Umwandlungsgesetz 24.10.2025 (Eintragungsdatum)\n\nSchweisstechnik plus GmbH\nGesellschaft mit beschränkter Haftung\nGladbeck\n\nDen Gläubigern der an der Ausgliederung beteiligten Rechtsträger ist, wenn sie binnen sechs Monaten nach dem Tag, an dem die Eintragung der Ausgliederung in das Register des Sitzes desjenigen Rechtsträgers, dessen Gläubiger sie sind, nach § 19 Absatz 3 UmwG als bekanntgemacht gilt, ihren Anspruch nach Grund und Höhe schriftlich anmelden, Sicherheit zu leisten, soweit sie nicht Befriedigung verlangen können. Dieses Recht steht den Gläubigern jedoch nur zu, wenn sie glaubhaft machen, dass durch die Ausgliederung die Erfüllung ihrer Forderung gefährdet wird."
    },
    {
      "date": "2025-10-24",
      "id": "135234",
      "original_text": "Registerbekanntmachung nach dem Umwandlungsgesetz\nNordrhein-Westfalen Amtsgericht Arnsberg HRA 5586\nWindpark Radlinghausen V. Betriebs GmbH & Co. KG – Brilon",
      "type": "Registerbekanntmachung nach dem Umwandlungsgesetz",
      "state": "Nordrhein-Westfalen",
      "amtsgericht": "Amtsgericht Arnsberg",
      "registernummer": "HRA 5586",
      "registerart": "HRA",
      "company_name": "Windpark Radlinghausen V. Betriebs GmbH & Co. KG",
      "company_seat": "Brilon",
      "details": "24.10.2025 (Bekanntmachungsdatum)\n\nNordrhein-Westfalen Amtsgericht Arnsberg HRA 5586\nRegisterbekanntmachung nach dem Umwandlungsgesetz 24.10.2025 (Eintragungsdatum)\n\nWindpark Radlinghausen V. Betriebs GmbH & Co. KG\nKommanditgesellschaft\nBrilon\n\nDen Gläubigern der an der Verschmelzung beteiligten Rechtsträger ist, wenn sie binnen sechs Monaten nach dem Tag, an dem die Eintragung der Verschmelzung in das Register des Sitzes derjenigen Rechtsträger deren Gläubiger sie sind, nach § 19 Absatz 3 UmwG als bekanntgemacht gilt, ihren Anspruch nach Grund und Höhe schriftlich anmelden, Sicherheit zu leisten, soweit sie nicht Befriedigung verlangen können. Dieses Recht steht den Gläubigern jedoch nur zu, wenn sie glaubhaft machen, dass durch die Verschmelzung die Erfüllung ihrer Forderung gefährdet wird."
    },
    {
      "date": "2025-10-24",
      "id": "135235",
      "original_text": "Sonstige Registerbekanntmachung\nNordrhein-Westfalen Amtsgericht Köln HRB 34649\nOVB Holding AG – Köln",
      "type": "Sonstige Registerbekanntmachung",
      "state": "Nordrhein-Westfalen",
      "amtsgericht": "Amtsgericht Köln",
      "registernummer": "HRB 34649",
      "registerart": "HRB",
      "company_name": "OVB Holding AG",
      "company_seat": "Köln",
      "details": "24.10.2025 (Bekanntmachungsdatum)\n\nNordrhein-Westfalen Amtsgericht Köln HRB 34649\nSonstige Registerbekanntmachung\n\nOVB Holding AG\nAktiengesellschaft\nKöln\n\nDem Registergericht ist eine Liste der Mitglieder des Aufsichtsrates eingereicht worden."
    },
    {
      "date": "2025-10-24",
      "id": "135236",
      "original_text": "Registerbekanntmachung nach dem Umwandlungsgesetz\nNordrhein-Westfalen Amtsgericht Köln HRB 122115\nCarpoint Autoservice GmbH – Leverkusen",
      "type": "Registerbekanntmachung nach dem Umwandlungsgesetz",
      "state": "Nordrhein-Westfalen",
      "amtsgericht": "Amtsgericht Köln",
      "registernummer": "HRB 122115",
      "registerart": "HRB",
      "company_name": "Carpoint Autoservice GmbH",
      "company_seat": "Leverkusen",
      "details": "24.10.2025 (Bekanntmachungsdatum)\n\nNordrhein-Westfalen Amtsgericht Köln HRB 122115\nRegisterbekanntmachung nach dem Umwandlungsgesetz 24.10.2025 (Eintragungsdatum)\n\nCarpoint Autoservice GmbH\nGesellschaft mit beschränkter Haftung\nLeverkusen\n\nDen Gläubigern der an der Ausgliederung beteiligten Rechtsträger ist, wenn sie binnen sechs Monaten nach dem Tag, an dem die Eintragung der Ausgliederung in das Register des Sitzes desjenigen Rechtsträgers, dessen Gläubiger sie sind, nach § 19 Absatz 3 UmwG als bekanntgemacht gilt, ihren Anspruch nach Grund und Höhe schriftlich anmelden, Sicherheit zu leisten, soweit sie nicht Befriedigung verlangen können. Dieses Recht steht den Gläubigern jedoch nur zu, wenn sie glaubhaft machen, dass durch die Ausgliederung die Erfüllung ihrer Forderung gefährdet wird."
    },
    {
      "date": "2025-10-24",
      "id": "135237",
      "original_text": "Löschungsankündigung\nNordrhein-Westfalen Amtsgericht Wuppertal HRB 27623\nGegic Bau GmbH – Wuppertal",
      "type": "Löschungsankündigung",
      "state": "Nordrhein-Westfalen",
      "amtsgericht": "Amtsgericht Wuppertal",
      "registernummer": "HRB 27623",
      "registerart": "HRB",
      "company_name": "Gegic Bau GmbH",
      "company_seat": "Wuppertal",
      "details": "24.10.2025 (Bekanntmachungsdatum)\n\nNordrhein-Westfalen Amtsgericht Wuppertal HRB 27623\nLöschungsankündigung\n\nGegic Bau GmbH\nGesellschaft mit beschränkter Haftung\nWuppertal\n\nDas Registergericht beabsichtigt die Gesellschaft von Amts wegen nach § 394 FamFG zu löschen. Die Frist zur Erhebung eines Widerspruchs ist auf einen Monat festgesetzt."
    },
    {
      "date": "2025-10-24",
      "id": "135238",
      "original_text": "Löschungsankündigung\nNordrhein-Westfalen Amtsgericht Dortmund HRB 32257\nKEP Vertriebs- und Dienstleistungs UG (haftungsbeschränkt) – Dortmund",
      "type": "Löschungsankündigung",
      "state": "Nordrhein-Westfalen",
      "amtsgericht": "Amtsgericht Dortmund",
      "registernummer": "HRB 32257",
      "registerart": "HRB",
      "company_name": "KEP Vertriebs- und Dienstleistungs UG (haftungsbeschränkt)",
      "company_seat": "Dortmund",
      "details": "24.10.2025 (Bekanntmachungsdatum)\n\nNordrhein-Westfalen Amtsgericht Dortmund HRB 32257\nLöschungsankündigung 24.10.2025 (Eintragungsdatum)\n\nKEP Vertriebs- und Dienstleistungs UG (haftungsbeschränkt)\nGesellschaft mit beschränkter Haftung\nDortmund\n\nDas Registergericht beabsichtigt die Gesellschaft von Amts wegen nach § 394 FamFG zu löschen. Die Frist zur Erhebung eines Widerspruchs ist auf zwei Monate festgesetzt."
    },
    {
      "date": "2025-10-24",
      "id": "135239",
      "original_text": "Sonstige Registerbekanntmachung\nNordrhein-Westfalen Amtsgericht Münster GnR 417\nVerein für Landeskultur, eingetragene Genossenschaft – Sassenberg",
      "type": "Sonstige Registerbekanntmachung",
      "state": "Nordrhein-Westfalen",
      "amtsgericht": "Amtsgericht Münster",
      "registernummer": "GnR 417",
      "registerart": "GnR",
      "company_name": "Verein für Landeskultur, eingetragene Genossenschaft",
      "company_seat": "Sassenberg",
      "details": "24.10.2025 (Bekanntmachungsdatum)\n\nNordrhein-Westfalen Amtsgericht Münster GnR 417\nSonstige Registerbekanntmachung 24.10.2025 (Eintragungsdatum)\n\nVerein für Landeskultur, eingetragene Genossenschaft\neingetragene Genossenschaft\nSassenberg\n\nAls nicht eingetragen wird veröffentlicht: Den Gläubigern der Genossenschaft ist gemäß § 22 GenG, wenn sie sich binnen sechs Monaten nach der Bekanntmachung bei der Genossenschaft  zu diesem Zweck  melden, Sicherheit zu leisten, soweit sie nicht Befriedigung verlangen können."
    },
    {
      "date": "2025-10-24",
      "id": "135240",
      "original_text": "Löschungsankündigung\nNordrhein-Westfalen Amtsgericht Dortmund HRB 19836\nNötzel Gaststätten- und Handelsgesellschaft mbH – Dortmund",
      "type": "Löschungsankündigung",
      "state": "Nordrhein-Westfalen",
      "amtsgericht": "Amtsgericht Dortmund",
      "registernummer": "HRB 19836",
      "registerart": "HRB",
      "company_name": "Nötzel Gaststätten- und Handelsgesellschaft mbH",
      "company_seat": "Dortmund",
      "details": "24.10.2025 (Bekanntmachungsdatum)\n\nNordrhein-Westfalen Amtsgericht Dortmund HRB 19836\nLöschungsankündigung\n\nNötzel Gaststätten- und Handelsgesellschaft mbH\nGesellschaft mit beschränkter Haftung\nDortmund\n\nDas Registergericht beabsichtigt die Gesellschaft von Amts wegen nach § 394 FamFG zu löschen. Die Frist zur Erhebung eines Widerspruchs ist auf zwei Monate festgesetzt."
    },
    {
      "date": "2025-10-24",
      "id": "135241",
      "original_text": "Sonstige Registerbekanntmachung\nNordrhein-Westfalen Amtsgericht Essen HRB 13854\nPRINAS MONTAN GmbH Versicherungsvermittler – Essen",
      "type": "Sonstige Registerbekanntmachung",
      "state": "Nordrhein-Westfalen",
      "amtsgericht": "Amtsgericht Essen",
      "registernummer": "HRB 13854",
      "registerart": "HRB",
      "company_name": "PRINAS MONTAN GmbH Versicherungsvermittler",
      "company_seat": "Essen",
      "details": "24.10.2025 (Bekanntmachungsdatum)\n\nNordrhein-Westfalen Amtsgericht Essen HRB 13854\nSonstige Registerbekanntmachung 24.10.2025 (Eintragungsdatum)\n\nPRINAS MONTAN GmbH Versicherungsvermittler\nGesellschaft mit beschränkter Haftung\nEssen\n\nAls nicht eingetragen wird veröffentlicht: Den Gläubigern der Gesellschaft, deren Forderungen begründet worden sind bevor die Eintragung der Beendigung des Beherrschungs- und Gewinnabführungsvertrages  in das Handelsregister nach § 10 des Handelsgesetzbuches als bekanntgemacht gilt, hat der andere Vertragsteil Sicherheit zu leisten, wenn sie sich binnen sechs Monaten nach der Bekanntmachung der Eintragung zu diesem Zweck bei ihm melden."
    },
    {
      "date": "2025-10-24",
      "id": "135242",
      "original_text": "Registerbekanntmachung nach dem Umwandlungsgesetz\nNordrhein-Westfalen Amtsgericht Düsseldorf HRB 109452\nTRATEDO GmbH – Düsseldorf",
      "type": "Registerbekanntmachung nach dem Umwandlungsgesetz",
      "state": "Nordrhein-Westfalen",
      "amtsgericht": "Amtsgericht Düsseldorf",
      "registernummer": "HRB 109452",
      "registerart": "HRB",
      "company_name": "TRATEDO GmbH",
      "company_seat": "Düsseldorf",
      "details": "24.10.2025 (Bekanntmachungsdatum)\n\nNordrhein-Westfalen Amtsgericht Düsseldorf HRB 109452\nRegisterbekanntmachung nach dem Umwandlungsgesetz 24.10.2025 (Eintragungsdatum)\n\nTRATEDO GmbH\nGesellschaft mit beschränkter Haftung\nDüsseldorf\n\nDen Gläubigern der an der Verschmelzung beteiligten Rechtsträger ist, wenn sie binnen sechs Monaten nach dem Tag, an dem die Eintragung der Verschmelzung in das Register des Sitzes desjenigen Rechtsträgers, dessen Gläubiger sie sind, nach § 19 Absatz 3 UmwG als bekanntgemacht gilt, ihren Anspruch nach Grund und Höhe schriftlich anmelden, Sicherheit zu leisten, soweit sie nicht Befriedigung verlangen können. Dieses Recht steht den Gläubigern jedoch nur zu, wenn sie glaubhaft machen, dass durch die Verschmelzung die Erfüllung ihrer Forderung gefährdet wird."
    },
    {
      "date": "2025-10-24",
      "id": "135243",
      "original_text": "Registerbekanntmachung nach dem Umwandlungsgesetz\nNordrhein-Westfalen Amtsgericht Arnsberg HRA 5585\nWindpark Radlinghausen IV. Betriebs GmbH & Co. KG – Brilon",
      "type": "Registerbekanntmachung nach dem Umwandlungsgesetz",
      "state": "Nordrhein-Westfalen",
      "amtsgericht": "Amtsgericht Arnsberg",
      "registernummer": "HRA 5585",
      "registerart": "HRA",
      "company_name": "Windpark Radlinghausen IV. Betriebs GmbH & Co. KG",
      "company_seat": "Brilon",
      "details": "24.10.2025 (Bekanntmachungsdatum)\n\nNordrhein-Westfalen Amtsgericht Arnsberg HRA 5585\nRegisterbekanntmachung nach dem Umwandlungsgesetz 24.10.2025 (Eintragungsdatum)\n\nWindpark Radlinghausen IV. Betriebs GmbH & Co. KG\nKommanditgesellschaft\nBrilon\n\nDen Gläubigern der an der Verschmelzung beteiligten Rechtsträger ist, wenn sie binnen sechs Monaten nach dem Tag, an dem die Eintragung der Verschmelzung in das Register des Sitzes derjenigen Rechtsträger deren Gläubiger sie sind, nach § 19 Absatz 3 UmwG als bekanntgemacht gilt, ihren Anspruch nach Grund und Höhe schriftlich anmelden, Sicherheit zu leisten, soweit sie nicht Befriedigung verlangen können. Dieses Recht steht den Gläubigern jedoch nur zu, wenn sie glaubhaft machen, dass durch die Verschmelzung die Erfüllung ihrer Forderung gefährdet wird."
    },
    {
      "date": "2025-10-24",
      "id": "135244",
      "original_text": "Registerbekanntmachung nach dem Umwandlungsgesetz\nNordrhein-Westfalen Amtsgericht Münster HRA 11077\nHanife Sahin e. Kfr. – Münster",
      "type": "Registerbekanntmachung nach dem Umwandlungsgesetz",
      "state": "Nordrhein-Westfalen",
      "amtsgericht": "Amtsgericht Münster",
      "registernummer": "HRA 11077",
      "registerart": "HRA",
      "company_name": "Hanife Sahin e. Kfr.",
      "company_seat": "Münster",
      "details": "24.10.2025 (Bekanntmachungsdatum)\n\nNordrhein-Westfalen Amtsgericht Münster HRA 11077\nRegisterbekanntmachung nach dem Umwandlungsgesetz 24.10.2025 (Eintragungsdatum)\n\nHanife Sahin e. Kfr.\nEinzelkaufmann / Einzelkauffrau\nMünster\n\nDen Gläubigern der an der Ausgliederung beteiligten Rechtsträger ist, wenn sie binnen sechs Monaten nach dem Tag, an dem die Eintragung der Ausgliederung in das Register des Sitzes desjenigen Rechtsträgers, dessen Gläubiger sie sind, nach § 19 Absatz 3 UmwG als bekanntgemacht gilt, ihren Anspruch nach Grund und Höhe schriftlich anmelden, Sicherheit zu leisten, soweit sie nicht Befriedigung verlangen können. Dieses Recht steht den Gläubigern jedoch nur zu, wenn sie glaubhaft machen, dass durch die Ausgliederung die Erfüllung ihrer Forderung gefährdet wird."
    },
    {
      "date": "2025-10-24",
      "id": "135245",
      "original_text": "Registerbekanntmachung nach dem Umwandlungsgesetz\nNordrhein-Westfalen Amtsgericht Essen HRB 25154\nKK8 Management GmbH – Essen",
      "type": "Registerbekanntmachung nach dem Umwandlungsgesetz",
      "state": "Nordrhein-Westfalen",
      "amtsgericht": "Amtsgericht Essen",
      "registernummer": "HRB 25154",
      "registerart": "HRB",
      "company_name": "KK8 Management GmbH",
      "company_seat": "Essen",
      "details": "24.10.2025 (Bekanntmachungsdatum)\n\nNordrhein-Westfalen Amtsgericht Essen HRB 25154\nRegisterbekanntmachung nach dem Umwandlungsgesetz 24.10.2025 (Eintragungsdatum)\n\nKK8 Management GmbH\nGesellschaft mit beschränkter Haftung\nEssen\n\nDen Gläubigern der an der Verschmelzung beteiligten Rechtsträger ist, wenn sie binnen sechs Monaten nach dem Tag, an dem die Eintragung der Verschmelzung in das Register des Sitzes desjenigen Rechtsträgers, dessen Gläubiger sie sind, nach § 19 Absatz 3 UmwG als bekanntgemacht gilt, ihren Anspruch nach Grund und Höhe schriftlich anmelden, Sicherheit zu leisten, soweit sie nicht Befriedigung verlangen können. Dieses Recht steht den Gläubigern jedoch nur zu, wenn sie glaubhaft machen, dass durch die Verschmelzung die Erfüllung ihrer Forderung gefährdet wird."
    },
    {
      "date": "2025-10-24",
      "id": "135246",
      "original_text": "Registerbekanntmachung nach dem Umwandlungsgesetz\nNordrhein-Westfalen Amtsgericht Münster HRB 22892\nMacellum Gastro GmbH – Münster",
      "type": "Registerbekanntmachung nach dem Umwandlungsgesetz",
      "state": "Nordrhein-Westfalen",
      "amtsgericht": "Amtsgericht Münster",
      "registernummer": "HRB 22892",
      "registerart": "HRB",
      "company_name": "Macellum Gastro GmbH",
      "company_seat": "Münster",
      "details": "24.10.2025 (Bekanntmachungsdatum)\n\nNordrhein-Westfalen Amtsgericht Münster HRB 22892\nRegisterbekanntmachung nach dem Umwandlungsgesetz 24.10.2025 (Eintragungsdatum)\n\nMacellum Gastro GmbH\nGesellschaft mit beschränkter Haftung\nMünster\n\nDen Gläubigern der an der Ausgliederung beteiligten Rechtsträger ist, wenn sie binnen sechs Monaten nach dem Tag, an dem die Eintragung der Ausgliederung in das Register des Sitzes desjenigen Rechtsträgers, dessen Gläubiger sie sind, nach § 19 Absatz 3 UmwG als bekanntgemacht gilt, ihren Anspruch nach Grund und Höhe schriftlich anmelden, Sicherheit zu leisten, soweit sie nicht Befriedigung verlangen können. Dieses Recht steht den Gläubigern jedoch nur zu, wenn sie glaubhaft machen, dass durch die Ausgliederung die Erfüllung ihrer Forderung gefährdet wird."
    },
    {
      "date": "2025-10-24",
      "id": "135247",
      "original_text": "Registerbekanntmachung nach dem Umwandlungsgesetz\nNordrhein-Westfalen Amtsgericht Arnsberg HRA 5584\nWindpark Radlinghausen III. Betriebs GmbH & Co. KG – Brilon",
      "type": "Registerbekanntmachung nach dem Umwandlungsgesetz",
      "state": "Nordrhein-Westfalen",
      "amtsgericht": "Amtsgericht Arnsberg",
      "registernummer": "HRA 5584",
      "registerart": "HRA",
      "company_name": "Windpark Radlinghausen III. Betriebs GmbH & Co. KG",
      "company_seat": "Brilon",
      "details": "24.10.2025 (Bekanntmachungsdatum)\n\nNordrhein-Westfalen Amtsgericht Arnsberg HRA 5584\nRegisterbekanntmachung nach dem Umwandlungsgesetz 24.10.2025 (Eintragungsdatum)\n\nWindpark Radlinghausen III. Betriebs GmbH & Co. KG\nKommanditgesellschaft\nBrilon\n\nDen Gläubigern der an der Verschmelzung beteiligten Rechtsträger ist, wenn sie binnen sechs Monaten nach dem Tag, an dem die Eintragung der Verschmelzung in das Register des Sitzes derjenigen Rechtsträger deren Gläubiger sie sind, nach § 19 Absatz 3 UmwG als bekanntgemacht gilt, ihren Anspruch nach Grund und Höhe schriftlich anmelden, Sicherheit zu leisten, soweit sie nicht Befriedigung verlangen können. Dieses Recht steht den Gläubigern jedoch nur zu, wenn sie glaubhaft machen, dass durch die Verschmelzung die Erfüllung ihrer Forderung gefährdet wird."
    },
    {
      "date": "2025-10-24",
      "id": "135248",
      "original_text": "Löschungsankündigung\nNordrhein-Westfalen Amtsgericht Recklinghausen HRB 7854\nNBS - Ausbau GmbH – Herten",
      "type": "Löschungsankündigung",
      "state": "Nordrhein-Westfalen",
      "amtsgericht": "Amtsgericht Recklinghausen",
      "registernummer": "HRB 7854",
      "registerart": "HRB",
      "company_name": "NBS - Ausbau GmbH",
      "company_seat": "Herten",
      "details": "24.10.2025 (Bekanntmachungsdatum)\n\nNordrhein-Westfalen Amtsgericht Recklinghausen HRB 7854\nLöschungsankündigung\n\nNBS - Ausbau GmbH\nGesellschaft mit beschränkter Haftung\nHerten\n\nDas Registergericht beabsichtigt die Gesellschaft von Amts wegen nach § 394 FamFG zu löschen. Die Frist zur Erhebung eines Widerspruchs ist auf drei Monate festgesetzt."
    },
    {
      "date": "2025-10-24",
      "id": "135249",
      "original_text": "Löschungsankündigung\nNordrhein-Westfalen Amtsgericht Siegburg GsR 212\nZähren & Sohn eGbR – Windeck",
      "type": "Löschungsankündigung",
      "state": "Nordrhein-Westfalen",
      "amtsgericht": "Amtsgericht Siegburg",
      "registernummer": "GsR 212",
      "registerart": "GsR",
      "company_name": "Zähren & Sohn eGbR",
      "company_seat": "Windeck",
      "details": "24.10.2025 (Bekanntmachungsdatum)\n\nNordrhein-Westfalen Amtsgericht Siegburg GsR 212\nLöschungsankündigung\n\nZähren & Sohn eGbR\nGesellschaft bürgerlichen Rechts\nWindeck\n\nDie  hiesigen Gesellschaftsregister eingetragene Gesellschaft Zähren & Sohn eGbR, GsR 212 soll wegen Vermögenslosigkeit gemäß § 394 FamFG von Amts wegen gelöscht werden. Ein etwaiger Widerspruch gegen die beabsichtigte Löschung ist binnen einer Frist von drei Monaten bei dem Registergericht geltend zu machen, anderenfalls wird die Löschung der Gesellschaft erfolgen."
    },
    {
      "date": "2025-10-24",
      "id": "135250",
      "original_text": "Löschungsankündigung\nNordrhein-Westfalen Amtsgericht Düsseldorf HRA 20877\nRolandstraße GmbH & Co. KG – Düsseldorf",
      "type": "Löschungsankündigung",
      "state": "Nordrhein-Westfalen",
      "amtsgericht": "Amtsgericht Düsseldorf",
      "registernummer": "HRA 20877",
      "registerart": "HRA",
      "company_name": "Rolandstraße GmbH & Co. KG",
      "company_seat": "Düsseldorf",
      "details": "24.10.2025 (Bekanntmachungsdatum)\n\nNordrhein-Westfalen Amtsgericht Düsseldorf HRA 20877\nLöschungsankündigung\n\nRolandstraße GmbH & Co. KG\nKommanditgesellschaft\nDüsseldorf\n\nBetr.: Rolandstraße GmbH & Co. KG, Vogelsanger Weg 111, 40470 Düsseldorf\n\nDas Registergericht beabsichtigt die Firma von Amts wegen nach § 394 Abs. 4 FamFG zu löschen, da offenbar keine Vermögenswerte mehr vorhanden sind und bereits die persönlich haftende Gesellschafterin wegen Vermögenslosigkeit gelöscht worden ist. Die Frist zur Erhebung eines Widerspruchs ist auf einen Monat festgesetzt.\n\nRechtsbehelfsbelehrung:\n\nDas Widerspruchsrecht steht jedem zu, der an der Unterlassung der Löschung ein berechtigtes Interesse hat. Der Widerspruch ist bei dem Amtsgericht Düsseldorf -Registergericht-, Werdener Straße 1, 40227 Düsseldorf schriftlich in deutscher Sprache oder zur Niederschrift der Geschäftsstelle einzulegen. Der Widerspruch kann auch zur Niederschrift der Geschäftsstelle eines jeden Amtsgerichtes abgegeben werden. Die Einlegung ist auch durch Übertragung eines elektronischen Dokuments an die elektronische Poststelle des Gerichts möglich. Das elektronische Dokument muss für die Bearbeitung durch das Gericht geeignet und mit einer qualifizierten elektronischen Signatur der verantwortenden Person versehen sein oder von der verantwortenden Person signiert und auf einem sicheren Übermittlungsweg gemäß § 130a ZPO nach näherer Maßgabe der Verordnung über die technischen Rahmenbedingungen des elektronischen Rechtsverkehrs und über das besondere elektronische Behördenpostfach (BGBl. I, S.3803) eingereicht werden. Weitere Informationen erhalten Sie auf der Internetseite www.justiz.de.\nDer Widerspruch muss spätestens innerhalb der gesetzten Frist nach dem Datum der Bekanntmachung der Löschungsankündigung bei dem Amtsgericht - Registergericht - Düsseldorf eingegangen sein.  Dies gilt auch dann, wenn der Widerspruch zur Niederschrift der Geschäftsstelle eines anderen Amtsgerichtes abgegeben wurde. Die Frist beginnt mit dem Tage der Bekanntmachung der Löschungsankündigung in dem für die Bekanntmachung der Eintragungen in das Handelsregister bestimmten elektronischen Informations- und Kommunikationssystem nach § 10 des Handelsgesetzbuches. Fällt das Ende der Frist auf einen Sonntag, einen allgemeinen Feiertag oder Sonnabend, so endet die Frist mit Ablauf des nächsten Werktages.\nDer Widerspruch muss die Bezeichnung der angefochtenen Löschungsankündigung sowie die Erklärung enthalten, dass Widerspruch gegen diese Löschungsankündigung eingelegt wird. Er ist zu unterzeichnen und soll begründet werden."
    },
    {
      "date": "2025-10-24",
      "id": "135251",
      "original_text": "Löschungsankündigung\nNordrhein-Westfalen Amtsgericht Siegburg HRB 5797\nKDW Consulting GmbH – Troisdorf",
      "type": "Löschungsankündigung",
      "state": "Nordrhein-Westfalen",
      "amtsgericht": "Amtsgericht Siegburg",
      "registernummer": "HRB 5797",
      "registerart": "HRB",
      "company_name": "KDW Consulting GmbH",
      "company_seat": "Troisdorf",
      "details": "24.10.2025 (Bekanntmachungsdatum)\n\nNordrhein-Westfalen Amtsgericht Siegburg HRB 5797\nLöschungsankündigung\n\nKDW Consulting GmbH\nGesellschaft mit beschränkter Haftung\nTroisdorf\n\nDas Registergericht hat glaubhafte Kenntnis erlangt, dass die Gesellschaft vermögenslos geworden ist, da ein Insolvenzverfahren wegen Masselosigkeit nach § 207 InsO eingestellt wurde.\n\nEs ist daher beabsichtigt, die Gesellschaft nach § 394 FamFG im Handelsregister wegen Vermögenslosigkeit zu löschen.\n\nEinwände gegen die Löschung sind durch Widerspruch binnen einer Frist von 3 Monaten geltend zu machen, andernfalls die Löschung erfolgen wird.\n\nEinzulegen ist der Widerspruch bei dem Amtsgericht Siegburg, Neue Poststraße 16, 53721 Siegburg, und zwar entweder schriftlich in deutscher Sprache oder mündlich zur Niederschrift der Geschäftsstelle. Der Widerspruch kann auch zur Niederschrift der Geschäftsstelle eines jeden Amtsgerichts abgegeben werden. Der Widerspruch ist binnen der in der Verfügung bestimmten Frist einzulegen. Die Frist ist nur gewahrt, wenn der Widerspruch rechtzeitig bei dem Amtsgericht Siegburg eingeht, auch wenn der Widerspruch zur Niederschrift der Geschäftsstelle eines anderen Amtsgerichts abgegeben wurde. Die Frist beginnt jeweils mit der schriftlichen Bekanntgabe der Verfügung an die Beteiligten. Kann die schriftliche Bekanntgabe an einen Beteiligten nicht bewirkt werden, beginnt die Frist spätestens mit Ablauf von fünf Monaten nach Erlass der Verfügung. Die Bekanntgabe ist entweder durch Zustellung oder am dritten Tage nach Aufgabe zur Post bewirkt. Sofern die Löschung noch nicht erfolgt ist, kann der Widerspruch auch noch nach Ablauf der Frist eingelegt werden. Fällt das Ende der Frist auf einen Sonnabend, einen Sonntag oder einen allgemeinen Feiertag, endet die Frist mit Ablauf des nächsten Werktages. Der Widerspruch ist zu unterzeichnen. Eine Begründung des Widerspruchs ist nicht vorgeschrieben."
    },
    {
      "date": "2025-10-24",
      "id": "135252",
      "original_text": "Registerbekanntmachung nach dem Umwandlungsgesetz\nNordrhein-Westfalen Amtsgericht Düsseldorf HRB 90866\nPegasus Investment GmbH – Monheim am Rhein",
      "type": "Registerbekanntmachung nach dem Umwandlungsgesetz",
      "state": "Nordrhein-Westfalen",
      "amtsgericht": "Amtsgericht Düsseldorf",
      "registernummer": "HRB 90866",
      "registerart": "HRB",
      "company_name": "Pegasus Investment GmbH",
      "company_seat": "Monheim am Rhein",
      "details": "24.10.2025 (Bekanntmachungsdatum)\n\nNordrhein-Westfalen Amtsgericht Düsseldorf HRB 90866\nRegisterbekanntmachung nach dem Umwandlungsgesetz 24.10.2025 (Eintragungsdatum)\n\nPegasus Investment GmbH\nGesellschaft mit beschränkter Haftung\nMonheim am Rhein\n\nDen Gläubigern der an der Verschmelzung beteiligten Rechtsträger ist, wenn sie binnen sechs Monaten nach dem Tag, an dem die Eintragung der Verschmelzung in das Register des Sitzes desjenigen Rechtsträgers, dessen Gläubiger sie sind, nach § 19 Absatz 3 UmwG als bekanntgemacht gilt, ihren Anspruch nach Grund und Höhe schriftlich anmelden, Sicherheit zu leisten, soweit sie nicht Befriedigung verlangen können. Dieses Recht steht den Gläubigern jedoch nur zu, wenn sie glaubhaft machen, dass durch die Verschmelzung die Erfüllung ihrer Forderung gefährdet wird."
    },
    {
      "date": "2025-10-24",
      "id": "135253",
      "original_text": "Löschungsankündigung\nNordrhein-Westfalen Amtsgericht Hamm HRB 7317\nEINHAUSMOBILE GmbH – Hamm",
      "type": "Löschungsankündigung",
      "state": "Nordrhein-Westfalen",
      "amtsgericht": "Amtsgericht Hamm",
      "registernummer": "HRB 7317",
      "registerart": "HRB",
      "company_name": "EINHAUSMOBILE GmbH",
      "company_seat": "Hamm",
      "details": "24.10.2025 (Bekanntmachungsdatum)\n\nNordrhein-Westfalen Amtsgericht Hamm HRB 7317\nLöschungsankündigung\n\nEINHAUSMOBILE GmbH\nGesellschaft mit beschränkter Haftung\nHamm\n\nDas Registergericht beabsichtigt die Gesellschaft von Amts wegen nach § 394 FamFG zu löschen. Die Frist zur Erhebung eines Widerspruchs ist auf drei Monate festgesetzt."
    },
    {
      "date": "2025-10-24",
      "id": "135254",
      "original_text": "Sonstige Registerbekanntmachung\nNordrhein-Westfalen Amtsgericht Essen HRB 34866\nAniCura Essen Reuenberg GmbH – Essen",
      "type": "Sonstige Registerbekanntmachung",
      "state": "Nordrhein-Westfalen",
      "amtsgericht": "Amtsgericht Essen",
      "registernummer": "HRB 34866",
      "registerart": "HRB",
      "company_name": "AniCura Essen Reuenberg GmbH",
      "company_seat": "Essen",
      "details": "24.10.2025 (Bekanntmachungsdatum)\n\nNordrhein-Westfalen Amtsgericht Essen HRB 34866\nSonstige Registerbekanntmachung 24.10.2025 (Eintragungsdatum)\n\nAniCura Essen Reuenberg GmbH\nGesellschaft mit beschränkter Haftung\nEssen\n\nAls nicht eingetragen wird veröffentlicht: Den Gläubigern der Gesellschaft, deren Forderungen begründet worden sind bevor die Eintragung der Beendigung des Gewinnabführungsvertrages  in das Handelsregister nach § 10 des Handelsgesetzbuches als bekanntgemacht gilt, hat der andere Vertragsteil Sicherheit zu leisten, wenn sie sich binnen sechs Monaten nach der Bekanntmachung der Eintragung zu diesem Zweck bei ihm melden."
    },
    {
      "date": "2025-10-24",
      "id": "135255",
      "original_text": "Registerbekanntmachung nach dem Umwandlungsgesetz\nNordrhein-Westfalen Amtsgericht Essen HRB 16612\nDextraData GmbH – Essen",
      "type": "Registerbekanntmachung nach dem Umwandlungsgesetz",
      "state": "Nordrhein-Westfalen",
      "amtsgericht": "Amtsgericht Essen",
      "registernummer": "HRB 16612",
      "registerart": "HRB",
      "company_name": "DextraData GmbH",
      "company_seat": "Essen",
      "details": "24.10.2025 (Bekanntmachungsdatum)\n\nNordrhein-Westfalen Amtsgericht Essen HRB 16612\nRegisterbekanntmachung nach dem Umwandlungsgesetz 24.10.2025 (Eintragungsdatum)\n\nDextraData GmbH\nGesellschaft mit beschränkter Haftung\nEssen\n\nDen Gläubigern der an der Ausgliederung beteiligten Rechtsträger ist, wenn sie binnen sechs Monaten nach dem Tag, an dem die Eintragung der Ausgliederung in das Register des Sitzes desjenigen Rechtsträgers, dessen Gläubiger sie sind, nach § 19 Absatz 3 UmwG als bekanntgemacht gilt, ihren Anspruch nach Grund und Höhe schriftlich anmelden, Sicherheit zu leisten, soweit sie nicht Befriedigung verlangen können. Dieses Recht steht den Gläubigern jedoch nur zu, wenn sie glaubhaft machen, dass durch die Ausgliederung die Erfüllung ihrer Forderung gefährdet wird."
    },
    {
      "date": "2025-10-24",
      "id": "135256",
      "original_text": "Löschungsankündigung\nNordrhein-Westfalen Amtsgericht Duisburg HRB 30065\nice Duisburger Getränke Markt GmbH – Duisburg",
      "type": "Löschungsankündigung",
      "state": "Nordrhein-Westfalen",
      "amtsgericht": "Amtsgericht Duisburg",
      "registernummer": "HRB 30065",
      "registerart": "HRB",
      "company_name": "ice Duisburger Getränke Markt GmbH",
      "company_seat": "Duisburg",
      "details": "24.10.2025 (Bekanntmachungsdatum)\n\nNordrhein-Westfalen Amtsgericht Duisburg HRB 30065\nLöschungsankündigung\n\nice Duisburger Getränke Markt GmbH\nGesellschaft mit beschränkter Haftung\nDuisburg\n\nDas Registergericht beabsichtigt, die im Handelsregister unter HRB 30065  eingetragene Gesellschaft ice Duisburger Getränke Markt GmbH  gemäß § 394 FamFG wegen Vermögenslosigkeit von Amts wegen zu löschen. Gegen diese Verfügung kann Widerspruch eingelegt werden. Die Frist zur Erhebung eines Widerspruchs gegen die beabsichtigte Löschung von Amts wegen ist auf drei Monate festgesetzt. Rechtsbehelfsbelehrung Der Widerspruch ist bei dem Amtsgericht Duisburg, Kardinal-Galen-Str. 124-132, 47058 Duisburg schriftlich in deutscher Sprache oder zur Niederschrift der Geschäftsstelle einzulegen. Der Widerspruch kann auch zur Niederschrift der Geschäftsstelle eines jeden Amtsgerichtes abgegeben werden. Die Einlegung ist auch durch Übertragung eines elektronischen Dokuments an die elektronische Poststelle des Gerichts möglich. Das elektronische Dokument muss für die Bearbeitung durch das Gericht geeignet und mit einer qualifizierten elektronischen Signatur der verantwortenden Person versehen sein oder von der verantwortenden Person signiert und auf einem sicheren Übermittlungsweg gemäß § 130 a ZPO nach näherer Maßgabe der Verordnung über die technischen Rahmenbedingungen des elektronischen Rechtsverkehrs und über das besondere elektronische Behördenpostfach (BGBl. I, S. 3803) eingereicht werden. Weitere Informationen erhalten Sie auf der Internetseite www.justiz.de <http://www.justiz.de>. Der Widerspruch muss spätestens innerhalb der gesetzten Frist bei dem Amtsgericht Duisburg eingegangen sein. Dies gilt auch dann, wenn der Widerspruch zur Niederschrift der Geschäftsstelle eines anderen Amtsgerichtes abgegeben wurde. Die Frist beginnt mit der Veröffentlichung. Fällt das Ende der Frist auf einen Sonntag, einen allgemeinen Feiertag oder Sonnabend, so endet die Frist mit Ablauf des nächsten Werktages. Der Widerspruch muss die Bezeichnung der angefochtenen Verfügung sowie die Erklärung enthalten, dass Widerspruch gegen diese Verfügung eingelegt wird. Er ist zu unterzeichnen und soll begründet werden."
    },
    {
      "date": "2025-10-24",
      "id": "135257",
      "original_text": "Registerbekanntmachung nach dem Umwandlungsgesetz\nNordrhein-Westfalen Amtsgericht Gelsenkirchen HRA 6426\nDaniel Olek e.K. – Gladbeck",
      "type": "Registerbekanntmachung nach dem Umwandlungsgesetz",
      "state": "Nordrhein-Westfalen",
      "amtsgericht": "Amtsgericht Gelsenkirchen",
      "registernummer": "HRA 6426",
      "registerart": "HRA",
      "company_name": "Daniel Olek e.K.",
      "company_seat": "Gladbeck",
      "details": "24.10.2025 (Bekanntmachungsdatum)\n\nNordrhein-Westfalen Amtsgericht Gelsenkirchen HRA 6426\nRegisterbekanntmachung nach dem Umwandlungsgesetz 24.10.2025 (Eintragungsdatum)\n\nDaniel Olek e.K.\nEinzelkaufmann / Einzelkauffrau\nGladbeck\n\nDen Gläubigern der an der Ausgliederung beteiligten Rechtsträger ist, wenn sie binnen sechs Monaten nach dem Tag, an dem die Eintragung der Ausgliederung in das Register des Sitzes desjenigen Rechtsträgers, dessen Gläubiger sie sind, nach § 19 Absatz 3 UmwG als bekanntgemacht gilt, ihren Anspruch nach Grund und Höhe schriftlich anmelden, Sicherheit zu leisten, soweit sie nicht Befriedigung verlangen können. Dieses Recht steht den Gläubigern jedoch nur zu, wenn sie glaubhaft machen, dass durch die Ausgliederung die Erfüllung ihrer Forderung gefährdet wird."
    },
    {
      "date": "2025-10-24",
      "id": "135258",
      "original_text": "Löschungsankündigung\nNordrhein-Westfalen Amtsgericht Düren HRB 2211\nvan der Burch Verwaltungs - GmbH – Heimbach",
      "type": "Löschungsankündigung",
      "state": "Nordrhein-Westfalen",
      "amtsgericht": "Amtsgericht Düren",
      "registernummer": "HRB 2211",
      "registerart": "HRB",
      "company_name": "van der Burch Verwaltungs - GmbH",
      "company_seat": "Heimbach",
      "details": "24.10.2025 (Bekanntmachungsdatum)\n\nNordrhein-Westfalen Amtsgericht Düren HRB 2211\nLöschungsankündigung\n\nvan der Burch Verwaltungs - GmbH\nGesellschaft mit beschränkter Haftung\nHeimbach\n\nDas Registergericht beabsichtigt die Gesellschaft von Amts wegen nach § 394 FamFG zu löschen. Die Frist zur Erhebung eines Widerspruchs ist auf drei Monate festgesetzt."
    },
    {
      "date": "2025-10-24",
      "id": "135259",
      "original_text": "Löschungsankündigung\nNordrhein-Westfalen Amtsgericht Köln HRB 91749\nDeSa Personalpower GmbH – Köln",
      "type": "Löschungsankündigung",
      "state": "Nordrhein-Westfalen",
      "amtsgericht": "Amtsgericht Köln",
      "registernummer": "HRB 91749",
      "registerart": "HRB",
      "company_name": "DeSa Personalpower GmbH",
      "company_seat": "Köln",
      "details": "24.10.2025 (Bekanntmachungsdatum)\n\nNordrhein-Westfalen Amtsgericht Köln HRB 91749\nLöschungsankündigung 24.10.2025 (Eintragungsdatum)\n\nDeSa Personalpower GmbH\nGesellschaft mit beschränkter Haftung\nKöln\n\nDas Registergericht beabsichtigt die Gesellschaft von Amts wegen nach § 394 FamFG zu löschen. Die Frist zur Erhebung eines Widerspruchs ist auf einen Monat festgesetzt."
    },
    {
      "date": "2025-10-24",
      "id": "135260",
      "original_text": "Registerbekanntmachung nach dem Umwandlungsgesetz\nNordrhein-Westfalen Amtsgericht Arnsberg HRA 5582\nWindpark Radlinghausen I. Betriebs GmbH & Co. KG – Brilon",
      "type": "Registerbekanntmachung nach dem Umwandlungsgesetz",
      "state": "Nordrhein-Westfalen",
      "amtsgericht": "Amtsgericht Arnsberg",
      "registernummer": "HRA 5582",
      "registerart": "HRA",
      "company_name": "Windpark Radlinghausen I. Betriebs GmbH & Co. KG",
      "company_seat": "Brilon",
      "details": "24.10.2025 (Bekanntmachungsdatum)\n\nNordrhein-Westfalen Amtsgericht Arnsberg HRA 5582\nRegisterbekanntmachung nach dem Umwandlungsgesetz 24.10.2025 (Eintragungsdatum)\n\nWindpark Radlinghausen I. Betriebs GmbH & Co. KG\nKommanditgesellschaft\nBrilon\n\nDen Gläubigern der an der Verschmelzung beteiligten Rechtsträger ist, wenn sie binnen sechs Monaten nach dem Tag, an dem die Eintragung der Verschmelzung in das Register des Sitzes derjenigen Rechtsträger deren Gläubiger sie sind, nach § 19 Absatz 3 UmwG als bekanntgemacht gilt, ihren Anspruch nach Grund und Höhe schriftlich anmelden, Sicherheit zu leisten, soweit sie nicht Befriedigung verlangen können. Dieses Recht steht den Gläubigern jedoch nur zu, wenn sie glaubhaft machen, dass durch die Verschmelzung die Erfüllung ihrer Forderung gefährdet wird."
    },
    {
      "date": "2025-10-24",
      "id": "135261",
      "original_text": "Registerbekanntmachung nach dem Umwandlungsgesetz\nNordrhein-Westfalen Amtsgericht Düsseldorf HRA 28378\nTM-Real Estate GmbH & Co. KG – Düsseldorf",
      "type": "Registerbekanntmachung nach dem Umwandlungsgesetz",
      "state": "Nordrhein-Westfalen",
      "amtsgericht": "Amtsgericht Düsseldorf",
      "registernummer": "HRA 28378",
      "registerart": "HRA",
      "company_name": "TM-Real Estate GmbH & Co. KG",
      "company_seat": "Düsseldorf",
      "details": "24.10.2025 (Bekanntmachungsdatum)\n\nNordrhein-Westfalen Amtsgericht Düsseldorf HRA 28378\nRegisterbekanntmachung nach dem Umwandlungsgesetz 24.10.2025 (Eintragungsdatum)\n\nTM-Real Estate GmbH & Co. KG\nKommanditgesellschaft\nDüsseldorf\n\nDen Gläubigern der an der formwechselnden Umwandlung beteiligten Rechtsträger ist, wenn sie binnen sechs Monaten nach dem Tag, an dem die Eintragung der formwechselnden Umwandlung in das Register des Sitzes desjenigen Rechtsträgers, dessen Gläubiger sie sind, nach § 19 Absatz 3 UmwG als bekanntgemacht gilt, ihren Anspruch nach Grund und Höhe schriftlich anmelden, Sicherheit zu leisten, soweit sie nicht Befriedigung verlangen können. Dieses Recht steht den Gläubigern jedoch nur zu, wenn sie glaubhaft machen, dass durch die formwechselnden Umwandlung die Erfüllung ihrer Forderung gefährdet wird."
    },
    {
      "date": "2025-10-24",
      "id": "135262",
      "original_text": "Einreichung neuer Dokumente\nNordrhein-Westfalen Amtsgericht Mönchengladbach HRB 14011\nSpeira GmbH – Grevenbroich",
      "type": "Einreichung neuer Dokumente",
      "state": "Nordrhein-Westfalen",
      "amtsgericht": "Amtsgericht Mönchengladbach",
      "registernummer": "HRB 14011",
      "registerart": "HRB",
      "company_name": "Speira GmbH",
      "company_seat": "Grevenbroich",
      "details": "24.10.2025 (Bekanntmachungsdatum)\n\nNordrhein-Westfalen Amtsgericht Mönchengladbach HRB 14011\nEinreichung neuer Dokumente 24.10.2025 (Eintragungsdatum)\n\nSpeira GmbH\nGesellschaft mit beschränkter Haftung\nGrevenbroich\n\nDem Registergericht ist eine neue Liste der Mitglieder des Aufsichtsrates eingereicht worden."
    },
    {
      "date": "2025-10-24",
      "id": "135263",
      "original_text": "Löschungsankündigung\nNordrhein-Westfalen Amtsgericht Wuppertal HRB 28067\nAKGÜC Transport & Logistik GmbH – Wuppertal",
      "type": "Löschungsankündigung",
      "state": "Nordrhein-Westfalen",
      "amtsgericht": "Amtsgericht Wuppertal",
      "registernummer": "HRB 28067",
      "registerart": "HRB",
      "company_name": "AKGÜC Transport & Logistik GmbH",
      "company_seat": "Wuppertal",
      "details": "24.10.2025 (Bekanntmachungsdatum)\n\nNordrhein-Westfalen Amtsgericht Wuppertal HRB 28067\nLöschungsankündigung\n\nAKGÜC Transport & Logistik GmbH\nGesellschaft mit beschränkter Haftung\nWuppertal\n\nDas Registergericht beabsichtigt die Gesellschaft von Amts wegen nach § 394 FamFG zu löschen. Die Frist zur Erhebung eines Widerspruchs ist auf einen Monat festgesetzt."
    },
    {
      "date": "2025-10-24",
      "id": "135264",
      "original_text": "Registerbekanntmachung nach dem Umwandlungsgesetz\nNordrhein-Westfalen Amtsgericht Bonn HRB 20406\nSB Immobilien GmbH – Bonn",
      "type": "Registerbekanntmachung nach dem Umwandlungsgesetz",
      "state": "Nordrhein-Westfalen",
      "amtsgericht": "Amtsgericht Bonn",
      "registernummer": "HRB 20406",
      "registerart": "HRB",
      "company_name": "SB Immobilien GmbH",
      "company_seat": "Bonn",
      "details": "24.10.2025 (Bekanntmachungsdatum)\n\nNordrhein-Westfalen Amtsgericht Bonn HRB 20406\nRegisterbekanntmachung nach dem Umwandlungsgesetz 24.10.2025 (Eintragungsdatum)\n\nSB Immobilien GmbH\nGesellschaft mit beschränkter Haftung\nBonn\n\nDen Gläubigern der an der Verschmelzung beteiligten Rechtsträger ist, wenn sie binnen sechs Monaten nach dem Tag, an dem die Eintragung der Verschmelzung in das Register des Sitzes desjenigen Rechtsträgers, dessen Gläubiger sie sind, nach § 19 Absatz 3 UmwG als bekanntgemacht gilt, ihren Anspruch nach Grund und Höhe schriftlich anmelden, Sicherheit zu leisten, soweit sie nicht Befriedigung verlangen können. Dieses Recht steht den Gläubigern jedoch nur zu, wenn sie glaubhaft machen, dass durch die Verschmelzung die Erfüllung ihrer Forderung gefährdet wird."
    },
    {
      "date": "2025-10-24",
      "id": "135265",
      "original_text": "Registerbekanntmachung nach dem Umwandlungsgesetz\nNordrhein-Westfalen Amtsgericht Essen HRB 27667\nIqony GmbH – Essen",
      "type": "Registerbekanntmachung nach dem Umwandlungsgesetz",
      "state": "Nordrhein-Westfalen",
      "amtsgericht": "Amtsgericht Essen",
      "registernummer": "HRB 27667",
      "registerart": "HRB",
      "company_name": "Iqony GmbH",
      "company_seat": "Essen",
      "details": "24.10.2025 (Bekanntmachungsdatum)\n\nNordrhein-Westfalen Amtsgericht Essen HRB 27667\nRegisterbekanntmachung nach dem Umwandlungsgesetz 24.10.2025 (Eintragungsdatum)\n\nIqony GmbH\nGesellschaft mit beschränkter Haftung\nEssen\n\nDen Gläubigern der an der Ausgliederung beteiligten Rechtsträger ist, wenn sie binnen sechs Monaten nach dem Tag, an dem die Eintragung der Ausgliederung in das Register des Sitzes desjenigen Rechtsträgers, dessen Gläubiger sie sind, nach § 19 Absatz 3 UmwG als bekanntgemacht gilt, ihren Anspruch nach Grund und Höhe schriftlich anmelden, Sicherheit zu leisten, soweit sie nicht Befriedigung verlangen können. Dieses Recht steht den Gläubigern jedoch nur zu, wenn sie glaubhaft machen, dass durch die Ausgliederung die Erfüllung ihrer Forderung gefährdet wird."
    },
    {
      "date": "2025-10-24",
      "id": "135266",
      "original_text": "Einreichung neuer Dokumente\nNordrhein-Westfalen Amtsgericht Duisburg HRB 15074\nSWB - Dienstleistungs-, Bauträger- und Finanzservicegesellschaft mbH – Mülheim an der Ruhr",
      "type": "Einreichung neuer Dokumente",
      "state": "Nordrhein-Westfalen",
      "amtsgericht": "Amtsgericht Duisburg",
      "registernummer": "HRB 15074",
      "registerart": "HRB",
      "company_name": "SWB - Dienstleistungs-, Bauträger- und Finanzservicegesellschaft mbH",
      "company_seat": "Mülheim an der Ruhr",
      "details": "24.10.2025 (Bekanntmachungsdatum)\n\nNordrhein-Westfalen Amtsgericht Duisburg HRB 15074\nEinreichung neuer Dokumente\n\nSWB - Dienstleistungs-, Bauträger- und Finanzservicegesellschaft mbH\nGesellschaft mit beschränkter Haftung\nMülheim an der Ruhr\n\nDem Registergericht ist eine neue Liste der Mitglieder des Aufsichtsrates eingereicht worden."
    },
    {
      "date": "2025-10-24",
      "id": "135267",
      "original_text": "Sonstige Registerbekanntmachung\nNordrhein-Westfalen Amtsgericht Essen HRB 23887\nthyssenkrupp Forged Tech GmbH – Essen",
      "type": "Sonstige Registerbekanntmachung",
      "state": "Nordrhein-Westfalen",
      "amtsgericht": "Amtsgericht Essen",
      "registernummer": "HRB 23887",
      "registerart": "HRB",
      "company_name": "thyssenkrupp Forged Tech GmbH",
      "company_seat": "Essen",
      "details": "24.10.2025 (Bekanntmachungsdatum)\n\nNordrhein-Westfalen Amtsgericht Essen HRB 23887\nSonstige Registerbekanntmachung 24.10.2025 (Eintragungsdatum)\n\nthyssenkrupp Forged Tech GmbH\nGesellschaft mit beschränkter Haftung\nEssen\n\nAls nicht eingetragen wird veröffentlicht: Den Gläubigern der Gesellschaft, deren Forderungen begründet worden sind bevor die Eintragung der Beendigung des Beherrschungs- und Gewinnabführungsvertrages  in das Handelsregister nach § 10 des Handelsgesetzbuches als bekanntgemacht gilt, hat der andere Vertragsteil Sicherheit zu leisten, wenn sie sich binnen sechs Monaten nach der Bekanntmachung der Eintragung zu diesem Zweck bei ihm melden."
    },
    {
      "date": "2025-10-24",
      "id": "135268",
      "original_text": "Einreichung neuer Dokumente\nNordrhein-Westfalen Amtsgericht Duisburg HRB 12863\nWBO Wirtschaftsbetriebe Oberhausen GmbH – Oberhausen",
      "type": "Einreichung neuer Dokumente",
      "state": "Nordrhein-Westfalen",
      "amtsgericht": "Amtsgericht Duisburg",
      "registernummer": "HRB 12863",
      "registerart": "HRB",
      "company_name": "WBO Wirtschaftsbetriebe Oberhausen GmbH",
      "company_seat": "Oberhausen",
      "details": "24.10.2025 (Bekanntmachungsdatum)\n\nNordrhein-Westfalen Amtsgericht Duisburg HRB 12863\nEinreichung neuer Dokumente\n\nWBO Wirtschaftsbetriebe Oberhausen GmbH\nGesellschaft mit beschränkter Haftung\nOberhausen\n\nDem Registergericht ist eine neue Liste der Mitglieder des Aufsichtsrates eingereicht worden."
    },
    {
      "date": "2025-10-24",
      "id": "135269",
      "original_text": "Registerbekanntmachung nach dem Umwandlungsgesetz\nNordrhein-Westfalen Amtsgericht Arnsberg HRA 5583\nWindpark Radlinghausen II. Betriebs GmbH & Co. KG – Brilon",
      "type": "Registerbekanntmachung nach dem Umwandlungsgesetz",
      "state": "Nordrhein-Westfalen",
      "amtsgericht": "Amtsgericht Arnsberg",
      "registernummer": "HRA 5583",
      "registerart": "HRA",
      "company_name": "Windpark Radlinghausen II. Betriebs GmbH & Co. KG",
      "company_seat": "Brilon",
      "details": "24.10.2025 (Bekanntmachungsdatum)\n\nNordrhein-Westfalen Amtsgericht Arnsberg HRA 5583\nRegisterbekanntmachung nach dem Umwandlungsgesetz 24.10.2025 (Eintragungsdatum)\n\nWindpark Radlinghausen II. Betriebs GmbH & Co. KG\nKommanditgesellschaft\nBrilon\n\nDen Gläubigern der an der Verschmelzung beteiligten Rechtsträger ist, wenn sie binnen sechs Monaten nach dem Tag, an dem die Eintragung der Verschmelzung in das Register des Sitzes derjenigen Rechtsträger deren Gläubiger sie sind, nach § 19 Absatz 3 UmwG als bekanntgemacht gilt, ihren Anspruch nach Grund und Höhe schriftlich anmelden, Sicherheit zu leisten, soweit sie nicht Befriedigung verlangen können. Dieses Recht steht den Gläubigern jedoch nur zu, wenn sie glaubhaft machen, dass durch die Verschmelzung die Erfüllung ihrer Forderung gefährdet wird."
    },
    {
      "date": "2025-10-24",
      "id": "135270",
      "original_text": "Löschungsankündigung\nNordrhein-Westfalen Amtsgericht Düsseldorf HRA 9601\nDr. Peiner & Paas KG – Düsseldorf",
      "type": "Löschungsankündigung",
      "state": "Nordrhein-Westfalen",
      "amtsgericht": "Amtsgericht Düsseldorf",
      "registernummer": "HRA 9601",
      "registerart": "HRA",
      "company_name": "Dr. Peiner & Paas KG",
      "company_seat": "Düsseldorf",
      "details": "24.10.2025 (Bekanntmachungsdatum)\n\nNordrhein-Westfalen Amtsgericht Düsseldorf HRA 9601\nLöschungsankündigung\n\nDr. Peiner & Paas KG\nKommanditgesellschaft\nDüsseldorf\n\nDas Registergericht beabsichtigt die Firma von Amts wegen nach § 31 Abs. 2 HGB zu löschen. Die Frist zur Erhebung eines Widerspruchs ist auf 3 Monate festgesetzt.\n\nRechtsbehelfsbelehrung:\nDas Widerspruchsrecht steht jedem zu, der an der Unterlassung der Löschung ein berechtigtes Interesse hat. Der Widerspruch ist bei dem Amtsgericht Düsseldorf -Registergericht-, Werdener Straße 1, 40227 Düsseldorf schriftlich in deutscher Sprache oder zur Niederschrift der Geschäftsstelle einzulegen. Der Widerspruch kann auch zur Niederschrift der Geschäftsstelle eines jeden Amtsgerichtes abgegeben werden. Die Einlegung ist auch durch Übertragung eines elektronischen Dokuments an die elektronische Poststelle des Gerichts möglich. Das elektronische Dokument muss für die Bearbeitung durch das Gericht geeignet und mit einer qualifizierten elektronischen Signatur der verantwortenden Person versehen sein oder von der verantwortenden Person signiert und auf einem sicheren Übermittlungsweg gemäß § 130a ZPO nach näherer Maßgabe der Verordnung über die technischen Rahmenbedingungen des elektronischen Rechtsverkehrs und über das besondere elektronische Behördenpostfach (BGBl. I, S.3803) eingereicht werden. Weitere Informationen erhalten Sie auf der Internetseite www.justiz.de.\nDer Widerspruch muss spätestens innerhalb der gesetzten Frist nach dem Datum der Bekanntmachung der Löschungsankündigung bei dem Amtsgericht - Registergericht - Düsseldorf eingegangen sein.  Dies gilt auch dann, wenn der Widerspruch zur Niederschrift der Geschäftsstelle eines anderen Amtsgerichtes abgegeben wurde. Die Frist beginnt mit dem Tage der Bekanntmachung der Löschungsankündigung in dem für die Bekanntmachung der Eintragungen in das Handelsregister bestimmten elektronischen Informations- und Kommunikationssystem nach § 10 des Handelsgesetzbuches. Fällt das Ende der Frist auf einen Sonntag, einen allgemeinen Feiertag oder Sonnabend, so endet die Frist mit Ablauf des nächsten Werktages.\nDer Widerspruch muss die Bezeichnung der angefochtenen Löschungsankündigung sowie die Erklärung enthalten, dass Widerspruch gegen diese Löschungsankündigung eingelegt wird. Er ist zu unterzeichnen und soll begründet werden."
    },
    {
      "date": "2025-10-24",
      "id": "135271",
      "original_text": "Registerbekanntmachung nach dem Umwandlungsgesetz\nNordrhein-Westfalen Amtsgericht Düsseldorf HRB 90866\nPegasus Investment GmbH – Monheim am Rhein",
      "type": "Registerbekanntmachung nach dem Umwandlungsgesetz",
      "state": "Nordrhein-Westfalen",
      "amtsgericht": "Amtsgericht Düsseldorf",
      "registernummer": "HRB 90866",
      "registerart": "HRB",
      "company_name": "Pegasus Investment GmbH",
      "company_seat": "Monheim am Rhein",
      "details": "24.10.2025 (Bekanntmachungsdatum)\n\nNordrhein-Westfalen Amtsgericht Düsseldorf HRB 90866\nRegisterbekanntmachung nach dem Umwandlungsgesetz 24.10.2025 (Eintragungsdatum)\n\nPegasus Investment GmbH\nGesellschaft mit beschränkter Haftung\nMonheim am Rhein\n\nDen Gläubigern der an der Verschmelzung beteiligten Rechtsträger ist, wenn sie binnen sechs Monaten nach dem Tag, an dem die Eintragung der Verschmelzung in das Register des Sitzes desjenigen Rechtsträgers, dessen Gläubiger sie sind, nach § 19 Absatz 3 UmwG als bekanntgemacht gilt, ihren Anspruch nach Grund und Höhe schriftlich anmelden, Sicherheit zu leisten, soweit sie nicht Befriedigung verlangen können. Dieses Recht steht den Gläubigern jedoch nur zu, wenn sie glaubhaft machen, dass durch die Verschmelzung die Erfüllung ihrer Forderung gefährdet wird."
    },
    {
      "date": "2025-10-24",
      "id": "135272",
      "original_text": "Registerbekanntmachung nach dem Umwandlungsgesetz\nNordrhein-Westfalen Amtsgericht Essen HRB 37338\nDextraData Aviation Technologies GmbH – Essen",
      "type": "Registerbekanntmachung nach dem Umwandlungsgesetz",
      "state": "Nordrhein-Westfalen",
      "amtsgericht": "Amtsgericht Essen",
      "registernummer": "HRB 37338",
      "registerart": "HRB",
      "company_name": "DextraData Aviation Technologies GmbH",
      "company_seat": "Essen",
      "details": "24.10.2025 (Bekanntmachungsdatum)\n\nNordrhein-Westfalen Amtsgericht Essen HRB 37338\nRegisterbekanntmachung nach dem Umwandlungsgesetz 24.10.2025 (Eintragungsdatum)\n\nDextraData Aviation Technologies GmbH\nGesellschaft mit beschränkter Haftung\nEssen\n\nDen Gläubigern der an der Ausgliederung beteiligten Rechtsträger ist, wenn sie binnen sechs Monaten nach dem Tag, an dem die Eintragung der Ausgliederung in das Register des Sitzes desjenigen Rechtsträgers, dessen Gläubiger sie sind, nach § 19 Absatz 3 UmwG als bekanntgemacht gilt, ihren Anspruch nach Grund und Höhe schriftlich anmelden, Sicherheit zu leisten, soweit sie nicht Befriedigung verlangen können. Dieses Recht steht den Gläubigern jedoch nur zu, wenn sie glaubhaft machen, dass durch die Ausgliederung die Erfüllung ihrer Forderung gefährdet wird."
    },
    {
      "date": "2025-10-24",
      "id": "135273",
      "original_text": "Registerbekanntmachung nach dem Umwandlungsgesetz\nNordrhein-Westfalen Amtsgericht Bielefeld HRA 17381\nHeiLe Gebäudeservice GmbH & Co. KG – Bielefeld",
      "type": "Registerbekanntmachung nach dem Umwandlungsgesetz",
      "state": "Nordrhein-Westfalen",
      "amtsgericht": "Amtsgericht Bielefeld",
      "registernummer": "HRA 17381",
      "registerart": "HRA",
      "company_name": "HeiLe Gebäudeservice GmbH & Co. KG",
      "company_seat": "Bielefeld",
      "details": "24.10.2025 (Bekanntmachungsdatum)\n\nNordrhein-Westfalen Amtsgericht Bielefeld HRA 17381\nRegisterbekanntmachung nach dem Umwandlungsgesetz 24.10.2025 (Eintragungsdatum)\n\nHeiLe Gebäudeservice GmbH & Co. KG\nKommanditgesellschaft\nBielefeld\n\nDen Gläubigern der an der Verschmelzung beteiligten Rechtsträger ist, wenn sie binnen sechs Monaten nach dem Tag, an dem die Eintragung der Verschmelzung in das Register des Sitzes desjenigen Rechtsträgers, dessen Gläubiger sie sind, nach § 19 Absatz 3 UmwG als bekanntgemacht gilt, ihren Anspruch nach Grund und Höhe schriftlich anmelden, Sicherheit zu leisten, soweit sie nicht Befriedigung verlangen können. Dieses Recht steht den Gläubigern jedoch nur zu, wenn sie glaubhaft machen, dass durch die Verschmelzung die Erfüllung ihrer Forderung gefährdet wird."
    },
    {
      "date": "2025-10-24",
      "id": "135274",
      "original_text": "Registerbekanntmachung nach dem Umwandlungsgesetz\nThüringen Amtsgericht Jena HRB 503884\nImmobilien Point 24 GmbH – Erfurt",
      "type": "Registerbekanntmachung nach dem Umwandlungsgesetz",
      "state": "Thüringen",
      "amtsgericht": "Amtsgericht Jena",
      "registernummer": "HRB 503884",
      "registerart": "HRB",
      "company_name": "Immobilien Point 24 GmbH",
      "company_seat": "Erfurt",
      "details": "24.10.2025 (Bekanntmachungsdatum)\n\nThüringen Amtsgericht Jena HRB 503884\nRegisterbekanntmachung nach dem Umwandlungsgesetz 24.10.2025 (Eintragungsdatum)\n\nImmobilien Point 24 GmbH\nGesellschaft mit beschränkter Haftung\nErfurt\n\nNicht eingetragen: Den Gläubigern der an der Ausgliederung beteiligten Rechtsträger, ist wenn sie binnen sechs Monaten nach dem Tag, an dem die Eintragung der Ausgliederung in das Register des Sitzes desjenigen Rechtsträgers, dessen Gläubiger sie sind, nach §§125, 19 Abs. 3 UmwG als bekanntgemacht gilt, ihren Anspruch nach Grund und Höhe schriftlich anmelden, Sicherheit zu leisten, soweit sie nicht Befriedigung verlangen können. Dieses Recht steht ihnen jedoch nur zu, wenn sie glaubhaft machen, daß durch die Ausgliederung die Erfüllung ihrer Forderung gefährdet wird."
    },
    {
      "date": "2025-10-24",
      "id": "135275",
      "original_text": "Registerbekanntmachung nach dem Umwandlungsgesetz\nThüringen Amtsgericht Jena HRB 514771\nSÜDSEITE Weimar GmbH – Erfurt",
      "type": "Registerbekanntmachung nach dem Umwandlungsgesetz",
      "state": "Thüringen",
      "amtsgericht": "Amtsgericht Jena",
      "registernummer": "HRB 514771",
      "registerart": "HRB",
      "company_name": "SÜDSEITE Weimar GmbH",
      "company_seat": "Erfurt",
      "details": "24.10.2025 (Bekanntmachungsdatum)\n\nThüringen Amtsgericht Jena HRB 514771\nRegisterbekanntmachung nach dem Umwandlungsgesetz 24.10.2025 (Eintragungsdatum)\n\nSÜDSEITE Weimar GmbH\nGesellschaft mit beschränkter Haftung\nErfurt\n\nNicht eingetragen: Den Gläubigern der an der Ausgliederung beteiligten Rechtsträger, ist wenn sie binnen sechs Monaten nach dem Tag, an dem die Eintragung der Ausgliederung in das Register des Sitzes desjenigen Rechtsträgers, dessen Gläubiger sie sind, nach §§125, 19 Abs. 3 UmwG als bekanntgemacht gilt, ihren Anspruch nach Grund und Höhe schriftlich anmelden, Sicherheit zu leisten, soweit sie nicht Befriedigung verlangen können. Dieses Recht steht ihnen jedoch nur zu, wenn sie glaubhaft machen, daß durch die Ausgliederung die Erfüllung ihrer Forderung gefährdet wird."
    },
    {
      "date": "2025-10-24",
      "id": "135276",
      "original_text": "Registerbekanntmachung nach dem Umwandlungsgesetz\nHessen Amtsgericht Bad Hersfeld HRA 1752\nLeist Oberflächentechnik GmbH & Co. KG – Bad Hersfeld-Kathus",
      "type": "Registerbekanntmachung nach dem Umwandlungsgesetz",
      "state": "Hessen",
      "amtsgericht": "Amtsgericht Bad Hersfeld",
      "registernummer": "HRA 1752",
      "registerart": "HRA",
      "company_name": "Leist Oberflächentechnik GmbH & Co. KG",
      "company_seat": "Bad Hersfeld-Kathus",
      "details": "24.10.2025 (Bekanntmachungsdatum)\n\nHessen Amtsgericht Bad Hersfeld HRA 1752\nRegisterbekanntmachung nach dem Umwandlungsgesetz 24.10.2025 (Eintragungsdatum)\n\nLeist Oberflächentechnik GmbH & Co. KG\nKommanditgesellschaft\nBad Hersfeld-Kathus\n\nDen Gläubigern der an der formwechselnden Umwandlung beteiligten Rechtsträger ist, wenn sie binnen sechs Monaten nach dem Tag, an dem die Eintragung der formwechselnden Umwandlung in das Register des Sitzes derjenigen Rechtsträger deren Gläubiger sie sind, nach § 201 UmwG bekannt gemacht worden ist, ihren Anspruch nach Grund und Höhe schriftlich anmelden, Sicherheit zu leisten, soweit sie nicht Befriedigung verlangen können. Dieses Recht steht den Gläubigern jedoch nur zu, wenn sie glaubhaft machen, dass durch die formwechselnden Umwandlung die Erfüllung ihrer Forderung gefährdet wird."
    },
    {
      "date": "2025-10-24",
      "id": "135277",
      "original_text": "Registerbekanntmachung nach dem Umwandlungsgesetz\nHessen Amtsgericht Bad Hersfeld HRB 3453\nLeist Holding GmbH – Bad Hersfeld-Kathus",
      "type": "Registerbekanntmachung nach dem Umwandlungsgesetz",
      "state": "Hessen",
      "amtsgericht": "Amtsgericht Bad Hersfeld",
      "registernummer": "HRB 3453",
      "registerart": "HRB",
      "company_name": "Leist Holding GmbH",
      "company_seat": "Bad Hersfeld-Kathus",
      "details": "24.10.2025 (Bekanntmachungsdatum)\n\nHessen Amtsgericht Bad Hersfeld HRB 3453\nRegisterbekanntmachung nach dem Umwandlungsgesetz 24.10.2025 (Eintragungsdatum)\n\nLeist Holding GmbH\nGesellschaft mit beschränkter Haftung\nBad Hersfeld-Kathus\n\nDen Gläubigern der an der formwechselnden Umwandlung beteiligten Rechtsträger ist, wenn sie binnen sechs Monaten nach dem Tag, an dem die Eintragung der formwechselnden Umwandlung in das Register des Sitzes derjenigen Rechtsträger deren Gläubiger sie sind, nach § 201 UmwG bekannt gemacht worden ist, ihren Anspruch nach Grund und Höhe schriftlich anmelden, Sicherheit zu leisten, soweit sie nicht Befriedigung verlangen können. Dieses Recht steht den Gläubigern jedoch nur zu, wenn sie glaubhaft machen, dass durch die formwechselnden Umwandlung die Erfüllung ihrer Forderung gefährdet wird."
    },
    {
      "date": "2025-10-24",
      "id": "135278",
      "original_text": "Registerbekanntmachung nach dem Umwandlungsgesetz\nHessen Amtsgericht Darmstadt HRB 33711\nKuratorium für Waldarbeit und Forsttechnik (KWF) GmbH – Groß-Umstadt",
      "type": "Registerbekanntmachung nach dem Umwandlungsgesetz",
      "state": "Hessen",
      "amtsgericht": "Amtsgericht Darmstadt",
      "registernummer": "HRB 33711",
      "registerart": "HRB",
      "company_name": "Kuratorium für Waldarbeit und Forsttechnik (KWF) GmbH",
      "company_seat": "Groß-Umstadt",
      "details": "24.10.2025 (Bekanntmachungsdatum)\n\nHessen Amtsgericht Darmstadt HRB 33711\nRegisterbekanntmachung nach dem Umwandlungsgesetz 24.10.2025 (Eintragungsdatum)\n\nKuratorium für Waldarbeit und Forsttechnik (KWF) GmbH\nGesellschaft mit beschränkter Haftung\nGroß-Umstadt\n\nDen Gläubigern der an der Ausgliederung beteiligten Rechtsträger ist, wenn sie binnen sechs Monaten nach dem Tag, an dem die Eintragung der Ausgliederung in das Register des Sitzes desjenigen Rechtsträgers, dessen Gläubiger sie sind, nach §§ 125, 19 Absatz 3 UmwG bekannt gemacht worden ist, ihren Anspruch nach Grund und Höhe schriftlich anmelden, Sicherheit zu leisten, soweit sie nicht Befriedigung verlangen können. Dieses Recht steht den Gläubigern jedoch nur zu, wenn sie glaubhaft machen, dass durch die Ausgliederung die Erfüllung ihrer Forderung gefährdet wird."
    },
    {
      "date": "2025-10-24",
      "id": "135279",
      "original_text": "Löschungsankündigung\nHessen Amtsgericht Frankfurt am Main HRB 110054\nCésar Security & Service GmbH – Eschborn",
      "type": "Löschungsankündigung",
      "state": "Hessen",
      "amtsgericht": "Amtsgericht Frankfurt am Main",
      "registernummer": "HRB 110054",
      "registerart": "HRB",
      "company_name": "César Security & Service GmbH",
      "company_seat": "Eschborn",
      "details": "24.10.2025 (Bekanntmachungsdatum)\n\nHessen Amtsgericht Frankfurt am Main HRB 110054\nLöschungsankündigung\n\nCésar Security & Service GmbH\nGesellschaft mit beschränkter Haftung\nEschborn\n\nEs ist beabsichtigt die Gesellschaft wegen Vermögenslosigkeit gemäß § 394 FamFG von Amts wegen zu löschen. Hiergegen kann innerhalb eines Monats nach dieser Veröffentlichung Widerspruch bei dem Amtsgericht Frankfurt am Main eingelegt werden."
    },
    {
      "date": "2025-10-24",
      "id": "135280",
      "original_text": "Registerbekanntmachung nach dem Umwandlungsgesetz\nHessen Amtsgericht Frankfurt am Main HRB 120637\nRegnology Group Holding GmbH – Frankfurt am Main",
      "type": "Registerbekanntmachung nach dem Umwandlungsgesetz",
      "state": "Hessen",
      "amtsgericht": "Amtsgericht Frankfurt am Main",
      "registernummer": "HRB 120637",
      "registerart": "HRB",
      "company_name": "Regnology Group Holding GmbH",
      "company_seat": "Frankfurt am Main",
      "details": "24.10.2025 (Bekanntmachungsdatum)\n\nHessen Amtsgericht Frankfurt am Main HRB 120637\nRegisterbekanntmachung nach dem Umwandlungsgesetz 24.10.2025 (Eintragungsdatum)\n\nRegnology Group Holding GmbH\nGesellschaft mit beschränkter Haftung\nFrankfurt am Main\n\nDen Gläubigern der an der Verschmelzung beteiligten Rechtsträger ist, wenn sie binnen sechs Monaten nach dem Tag, an dem die Eintragung der Verschmelzung in das Register des Sitzes desjenigen Rechtsträgers, dessen Gläubiger sie sind, nach § 19 Absatz 3 UmwG bekannt gemacht worden ist, ihren Anspruch nach Grund und Höhe schriftlich anmelden, Sicherheit zu leisten, soweit sie nicht Befriedigung verlangen können. Dieses Recht steht den Gläubigern jedoch nur zu, wenn sie glaubhaft machen, dass durch die Verschmelzung die Erfüllung ihrer Forderung gefährdet wird."
    },
    {
      "date": "2025-10-24",
      "id": "135281",
      "original_text": "Registerbekanntmachung nach dem Umwandlungsgesetz\nHessen Amtsgericht Offenbach am Main HRB 53878\nADECONSULT Deutschland GmbH – Dreieich",
      "type": "Registerbekanntmachung nach dem Umwandlungsgesetz",
      "state": "Hessen",
      "amtsgericht": "Amtsgericht Offenbach am Main",
      "registernummer": "HRB 53878",
      "registerart": "HRB",
      "company_name": "ADECONSULT Deutschland GmbH",
      "company_seat": "Dreieich",
      "details": "24.10.2025 (Bekanntmachungsdatum)\n\nHessen Amtsgericht Offenbach am Main HRB 53878\nRegisterbekanntmachung nach dem Umwandlungsgesetz 24.10.2025 (Eintragungsdatum)\n\nADECONSULT Deutschland GmbH\nGesellschaft mit beschränkter Haftung\nDreieich\n\nDen Gläubigern der an der Verschmelzung beteiligten Rechtsträger ist, wenn sie binnen sechs Monaten nach dem Tag, an dem die Eintragung der Verschmelzung in das Register des Sitzes desjenigen Rechtsträgers, dessen Gläubiger sie sind, nach § 19 Absatz 3 UmwG bekannt gemacht worden ist, ihren Anspruch nach Grund und Höhe schriftlich anmelden, Sicherheit zu leisten, soweit sie nicht Befriedigung verlangen können. Dieses Recht steht den Gläubigern jedoch nur zu, wenn sie glaubhaft machen, dass durch die Verschmelzung die Erfüllung ihrer Forderung gefährdet wird."
    },
    {
      "date": "2025-10-24",
      "id": "135282",
      "original_text": "Löschungsankündigung\nHessen Amtsgericht Frankfurt am Main HRB 113619\nEco-Light Biosafety GmbH – Frankfurt am Main",
      "type": "Löschungsankündigung",
      "state": "Hessen",
      "amtsgericht": "Amtsgericht Frankfurt am Main",
      "registernummer": "HRB 113619",
      "registerart": "HRB",
      "company_name": "Eco-Light Biosafety GmbH",
      "company_seat": "Frankfurt am Main",
      "details": "24.10.2025 (Bekanntmachungsdatum)\n\nHessen Amtsgericht Frankfurt am Main HRB 113619\nLöschungsankündigung\n\nEco-Light Biosafety GmbH\nGesellschaft mit beschränkter Haftung\nFrankfurt am Main\n\nDas Registergericht beabsichtigt die im Handelsregister eingetragene Gesellschaft von Amts wegen nach § 394 FamFG zu löschen. Die Frist zur Erhebung eines Widerspruchs gegen die beabsichtigte Löschung wird auf 1 Monat festgesetzt."
    },
    {
      "date": "2025-10-24",
      "id": "135283",
      "original_text": "Sonstige Registerbekanntmachung\nHessen Amtsgericht Kassel VR 3689\n\"Gesellschaft der Freunde der Glaskunst Richard Süssmuth e.V.\" – Immenhausen",
      "type": "Sonstige Registerbekanntmachung",
      "state": "Hessen",
      "amtsgericht": "Amtsgericht Kassel",
      "registernummer": "VR 3689",
      "registerart": "VR",
      "company_name": "\"Gesellschaft der Freunde der Glaskunst Richard Süssmuth e.V.\"",
      "company_seat": "Immenhausen",
      "details": "24.10.2025 (Bekanntmachungsdatum)\n\nHessen Amtsgericht Kassel VR 3689\nSonstige Registerbekanntmachung 24.10.2025 (Eintragungsdatum)\n\n\"Gesellschaft der Freunde der Glaskunst Richard Süssmuth e.V.\"\neingetragener Verein\nImmenhausen\n\nDer Verein ist aufgelöst."
    },
    {
      "date": "2025-10-24",
      "id": "135284",
      "original_text": "Registerbekanntmachung nach dem Umwandlungsgesetz\nHessen Amtsgericht Frankfurt am Main HRB 137638\nLurse Rentenversicherung GmbH – Frankfurt am Main",
      "type": "Registerbekanntmachung nach dem Umwandlungsgesetz",
      "state": "Hessen",
      "amtsgericht": "Amtsgericht Frankfurt am Main",
      "registernummer": "HRB 137638",
      "registerart": "HRB",
      "company_name": "Lurse Rentenversicherung GmbH",
      "company_seat": "Frankfurt am Main",
      "details": "24.10.2025 (Bekanntmachungsdatum)\n\nHessen Amtsgericht Frankfurt am Main HRB 137638\nRegisterbekanntmachung nach dem Umwandlungsgesetz 24.10.2025 (Eintragungsdatum)\n\nLurse Rentenversicherung GmbH\nGesellschaft mit beschränkter Haftung\nFrankfurt am Main\n\nDen Gläubigern der an der Ausgliederung beteiligten Rechtsträger ist, wenn sie binnen sechs Monaten nach dem Tag, an dem die Eintragung der Ausgliederung in das Register des Sitzes desjenigen Rechtsträgers, dessen Gläubiger sie sind, nach §§ 125, 19 Absatz 3 UmwG bekannt gemacht worden ist, ihren Anspruch nach Grund und Höhe schriftlich anmelden, Sicherheit zu leisten, soweit sie nicht Befriedigung verlangen können. Dieses Recht steht den Gläubigern jedoch nur zu, wenn sie glaubhaft machen, dass durch die Ausgliederung die Erfüllung ihrer Forderung gefährdet wird."
    },
    {
      "date": "2025-10-24",
      "id": "135285",
      "original_text": "Sonstige Registerbekanntmachung\nHessen Amtsgericht Limburg VR 1068\nMGV Sängerlust Hangenmeilingen – Elbtal-Hangenmeilingen",
      "type": "Sonstige Registerbekanntmachung",
      "state": "Hessen",
      "amtsgericht": "Amtsgericht Limburg",
      "registernummer": "VR 1068",
      "registerart": "VR",
      "company_name": "MGV Sängerlust Hangenmeilingen",
      "company_seat": "Elbtal-Hangenmeilingen",
      "details": "24.10.2025 (Bekanntmachungsdatum)\n\nHessen Amtsgericht Limburg VR 1068\nSonstige Registerbekanntmachung 24.10.2025 (Eintragungsdatum)\n\nMGV Sängerlust Hangenmeilingen\neingetragener Verein\nElbtal-Hangenmeilingen\n\nDurch rechtskräftigen Beschluss des Amtsgerichts Limburg a.d. Lahn vom 28.08.2025 ist dem Verein gemäß § 73 BGB die Rechtsfähigkeit entzogen worden."
    },
    {
      "date": "2025-10-24",
      "id": "135286",
      "original_text": "Löschungsankündigung\nHessen Amtsgericht Frankfurt am Main HRB 131341\nJR Energiesysteme GmbH – Frankfurt am Main",
      "type": "Löschungsankündigung",
      "state": "Hessen",
      "amtsgericht": "Amtsgericht Frankfurt am Main",
      "registernummer": "HRB 131341",
      "registerart": "HRB",
      "company_name": "JR Energiesysteme GmbH",
      "company_seat": "Frankfurt am Main",
      "details": "24.10.2025 (Bekanntmachungsdatum)\n\nHessen Amtsgericht Frankfurt am Main HRB 131341\nLöschungsankündigung\n\nJR Energiesysteme GmbH\nGesellschaft mit beschränkter Haftung\nFrankfurt am Main\n\nDas Registergericht beabsichtigt die im Handelsregister eingetragene Gesellschaft von Amts wegen nach § 394 FamFG zu löschen. Die Frist zur Erhebung eines Widerspruchs gegen die beabsichtigte Löschung wird auf 1 Monat festgesetzt."
    },
    {
      "date": "2025-10-24",
      "id": "135287",
      "original_text": "Löschungsankündigung\nHessen Amtsgericht Wiesbaden HRB 24050\nMDT Mips Dataline Technologies Verwaltungs-GmbH – Wiesbaden",
      "type": "Löschungsankündigung",
      "state": "Hessen",
      "amtsgericht": "Amtsgericht Wiesbaden",
      "registernummer": "HRB 24050",
      "registerart": "HRB",
      "company_name": "MDT Mips Dataline Technologies Verwaltungs-GmbH",
      "company_seat": "Wiesbaden",
      "details": "24.10.2025 (Bekanntmachungsdatum)\n\nHessen Amtsgericht Wiesbaden HRB 24050\nLöschungsankündigung\n\nMDT Mips Dataline Technologies Verwaltungs-GmbH\nGesellschaft mit beschränkter Haftung\nWiesbaden\n\nDas Registergericht beabsichtigt die im Handelsregister eingetragene Gesellschaft von Amts wegen nach § 394 FamFG zu löschen. Die Frist zur Erhebung eines Widerspruchs gegen die beabsichtigte Löschung wird auf 3 Monate festgesetzt."
    },
    {
      "date": "2025-10-24",
      "id": "135288",
      "original_text": "Registerbekanntmachung nach dem Umwandlungsgesetz\nHessen Amtsgericht Frankfurt am Main HRB 135615\noptus 1011. GmbH – Frankfurt am Main",
      "type": "Registerbekanntmachung nach dem Umwandlungsgesetz",
      "state": "Hessen",
      "amtsgericht": "Amtsgericht Frankfurt am Main",
      "registernummer": "HRB 135615",
      "registerart": "HRB",
      "company_name": "optus 1011. GmbH",
      "company_seat": "Frankfurt am Main",
      "details": "24.10.2025 (Bekanntmachungsdatum)\n\nHessen Amtsgericht Frankfurt am Main HRB 135615\nRegisterbekanntmachung nach dem Umwandlungsgesetz 24.10.2025 (Eintragungsdatum)\n\noptus 1011. GmbH\nGesellschaft mit beschränkter Haftung\nFrankfurt am Main\n\nDen Gläubigern der an der Verschmelzung beteiligten Rechtsträger ist, wenn sie binnen sechs Monaten nach dem Tag, an dem die Eintragung der Verschmelzung in das Register des Sitzes desjenigen Rechtsträgers, dessen Gläubiger sie sind, nach § 19 Absatz 3 UmwG bekannt gemacht worden ist, ihren Anspruch nach Grund und Höhe schriftlich anmelden, Sicherheit zu leisten, soweit sie nicht Befriedigung verlangen können. Dieses Recht steht den Gläubigern jedoch nur zu, wenn sie glaubhaft machen, dass durch die Verschmelzung die Erfüllung ihrer Forderung gefährdet wird."
    },
    {
      "date": "2025-10-24",
      "id": "135289",
      "original_text": "Registerbekanntmachung nach dem Umwandlungsgesetz\nHessen Amtsgericht Frankfurt am Main HRB 135615\noptus 1011. GmbH – Frankfurt am Main",
      "type": "Registerbekanntmachung nach dem Umwandlungsgesetz",
      "state": "Hessen",
      "amtsgericht": "Amtsgericht Frankfurt am Main",
      "registernummer": "HRB 135615",
      "registerart": "HRB",
      "company_name": "optus 1011. GmbH",
      "company_seat": "Frankfurt am Main",
      "details": "24.10.2025 (Bekanntmachungsdatum)\n\nHessen Amtsgericht Frankfurt am Main HRB 135615\nRegisterbekanntmachung nach dem Umwandlungsgesetz 24.10.2025 (Eintragungsdatum)\n\noptus 1011. GmbH\nGesellschaft mit beschränkter Haftung\nFrankfurt am Main\n\nDen Gläubigern der an der Verschmelzung beteiligten Rechtsträger ist, wenn sie binnen sechs Monaten nach dem Tag, an dem die Eintragung der Verschmelzung in das Register des Sitzes desjenigen Rechtsträgers, dessen Gläubiger sie sind, nach § 19 Absatz 3 UmwG bekannt gemacht worden ist, ihren Anspruch nach Grund und Höhe schriftlich anmelden, Sicherheit zu leisten, soweit sie nicht Befriedigung verlangen können. Dieses Recht steht den Gläubigern jedoch nur zu, wenn sie glaubhaft machen, dass durch die Verschmelzung die Erfüllung ihrer Forderung gefährdet wird."
    },
    {
      "date": "2025-10-24",
      "id": "135290",
      "original_text": "Löschungsankündigung\nHessen Amtsgericht Frankfurt am Main HRB 115387\nOVIA Service GmbH – Bad Vilbel",
      "type": "Löschungsankündigung",
      "state": "Hessen",
      "amtsgericht": "Amtsgericht Frankfurt am Main",
      "registernummer": "HRB 115387",
      "registerart": "HRB",
      "company_name": "OVIA Service GmbH",
      "company_seat": "Bad Vilbel",
      "details": "24.10.2025 (Bekanntmachungsdatum)\n\nHessen Amtsgericht Frankfurt am Main HRB 115387\nLöschungsankündigung\n\nOVIA Service GmbH\nGesellschaft mit beschränkter Haftung\nBad Vilbel\n\nes ist beabsichtigt, den Geschäftsführer Herrn Yahya Alkan gemäß § 395 FamFG von Amts wegen im Handelsregister zu löschen, da eine Gewerbeuntersagung des Regierungspräsidium Darmstadt vom 02.01.2008 vorliegt.\n\nHiergegen kann innerhalb eines Monats nach Zustellung dieser Verfügung Widerspruch bei dem Amtsgericht Frankfurt am Main eingelegt werden."
    },
    {
      "date": "2025-10-24",
      "id": "135291",
      "original_text": "Löschungsankündigung\nHessen Amtsgericht Hanau HRB 96488\nBuild-Tech GmbH – Sinntal",
      "type": "Löschungsankündigung",
      "state": "Hessen",
      "amtsgericht": "Amtsgericht Hanau",
      "registernummer": "HRB 96488",
      "registerart": "HRB",
      "company_name": "Build-Tech GmbH",
      "company_seat": "Sinntal",
      "details": "24.10.2025 (Bekanntmachungsdatum)\n\nHessen Amtsgericht Hanau HRB 96488\nLöschungsankündigung\n\nBuild-Tech GmbH\nGesellschaft mit beschränkter Haftung\nSinntal\n\nDas Registergericht beabsichtigt die im Handelsregister eingetragene Gesellschaft von Amts wegen nach § 394 FamFG zu löschen. Die Frist zur Erhebung eines Widerspruchs gegen die beabsichtigte Löschung wird auf 3 Monate festgesetzt."
    },
    {
      "date": "2025-10-24",
      "id": "135292",
      "original_text": "Registerbekanntmachung nach dem Umwandlungsgesetz\nHessen Amtsgericht Frankfurt am Main HRB 94684\nEurocity AG – Frankfurt am Main",
      "type": "Registerbekanntmachung nach dem Umwandlungsgesetz",
      "state": "Hessen",
      "amtsgericht": "Amtsgericht Frankfurt am Main",
      "registernummer": "HRB 94684",
      "registerart": "HRB",
      "company_name": "Eurocity AG",
      "company_seat": "Frankfurt am Main",
      "details": "24.10.2025 (Bekanntmachungsdatum)\n\nHessen Amtsgericht Frankfurt am Main HRB 94684\nRegisterbekanntmachung nach dem Umwandlungsgesetz 24.10.2025 (Eintragungsdatum)\n\nEurocity AG\nAktiengesellschaft\nFrankfurt am Main\n\nDen Gläubigern der an der Ausgliederung beteiligten Rechtsträger ist, wenn sie binnen sechs Monaten nach dem Tag, an dem die Eintragung der Ausgliederung in das Register des Sitzes desjenigen Rechtsträgers, dessen Gläubiger sie sind, nach §§ 125, 19 Absatz 3 UmwG bekannt gemacht worden ist, ihren Anspruch nach Grund und Höhe schriftlich anmelden, Sicherheit zu leisten, soweit sie nicht Befriedigung verlangen können. Dieses Recht steht den Gläubigern jedoch nur zu, wenn sie glaubhaft machen, dass durch die Ausgliederung die Erfüllung ihrer Forderung gefährdet wird."
    },
    {
      "date": "2025-10-24",
      "id": "135293",
      "original_text": "Sonstige Registerbekanntmachung\nHessen Amtsgericht Darmstadt VR 84586\nFörderverein Sportstudierende Darmstadt e.V. – Darmstadt",
      "type": "Sonstige Registerbekanntmachung",
      "state": "Hessen",
      "amtsgericht": "Amtsgericht Darmstadt",
      "registernummer": "VR 84586",
      "registerart": "VR",
      "company_name": "Förderverein Sportstudierende Darmstadt e.V.",
      "company_seat": "Darmstadt",
      "details": "24.10.2025 (Bekanntmachungsdatum)\n\nHessen Amtsgericht Darmstadt VR 84586\nSonstige Registerbekanntmachung 24.10.2025 (Eintragungsdatum)\n\nFörderverein Sportstudierende Darmstadt e.V.\neingetragener Verein\nDarmstadt\n\nDer Verein ist aufgelöst."
    },
    {
      "date": "2025-10-24",
      "id": "135294",
      "original_text": "Registerbekanntmachung nach dem Umwandlungsgesetz\nHessen Amtsgericht Offenbach am Main HRB 34461\nSD Worx GmbH – Dreieich",
      "type": "Registerbekanntmachung nach dem Umwandlungsgesetz",
      "state": "Hessen",
      "amtsgericht": "Amtsgericht Offenbach am Main",
      "registernummer": "HRB 34461",
      "registerart": "HRB",
      "company_name": "SD Worx GmbH",
      "company_seat": "Dreieich",
      "details": "24.10.2025 (Bekanntmachungsdatum)\n\nHessen Amtsgericht Offenbach am Main HRB 34461\nRegisterbekanntmachung nach dem Umwandlungsgesetz 24.10.2025 (Eintragungsdatum)\n\nSD Worx GmbH\nGesellschaft mit beschränkter Haftung\nDreieich\n\nDen Gläubigern der an der Verschmelzung beteiligten Rechtsträger ist, wenn sie binnen sechs Monaten nach dem Tag, an dem die Eintragung der Verschmelzung in das Register des Sitzes desjenigen Rechtsträgers, dessen Gläubiger sie sind, nach § 19 Absatz 3 UmwG bekannt gemacht worden ist, ihren Anspruch nach Grund und Höhe schriftlich anmelden, Sicherheit zu leisten, soweit sie nicht Befriedigung verlangen können. Dieses Recht steht den Gläubigern jedoch nur zu, wenn sie glaubhaft machen, dass durch die Verschmelzung die Erfüllung ihrer Forderung gefährdet wird."
    },
    {
      "date": "2025-10-24",
      "id": "135295",
      "original_text": "Registerbekanntmachung nach dem Umwandlungsgesetz\nHessen Amtsgericht Bad Hersfeld HRB 3452\nLeist Oberflächentechnik GmbH – Bad Hersfeld-Kathus",
      "type": "Registerbekanntmachung nach dem Umwandlungsgesetz",
      "state": "Hessen",
      "amtsgericht": "Amtsgericht Bad Hersfeld",
      "registernummer": "HRB 3452",
      "registerart": "HRB",
      "company_name": "Leist Oberflächentechnik GmbH",
      "company_seat": "Bad Hersfeld-Kathus",
      "details": "24.10.2025 (Bekanntmachungsdatum)\n\nHessen Amtsgericht Bad Hersfeld HRB 3452\nRegisterbekanntmachung nach dem Umwandlungsgesetz 24.10.2025 (Eintragungsdatum)\n\nLeist Oberflächentechnik GmbH\nGesellschaft mit beschränkter Haftung\nBad Hersfeld-Kathus\n\nDen Gläubigern der an der formwechselnden Umwandlung beteiligten Rechtsträger ist, wenn sie binnen sechs Monaten nach dem Tag, an dem die Eintragung der formwechselnden Umwandlung in das Register des Sitzes derjenigen Rechtsträger deren Gläubiger sie sind, nach § 201 UmwG bekannt gemacht worden ist, ihren Anspruch nach Grund und Höhe schriftlich anmelden, Sicherheit zu leisten, soweit sie nicht Befriedigung verlangen können. Dieses Recht steht den Gläubigern jedoch nur zu, wenn sie glaubhaft machen, dass durch die formwechselnden Umwandlung die Erfüllung ihrer Forderung gefährdet wird."
    },
    {
      "date": "2025-10-24",
      "id": "135296",
      "original_text": "Registerbekanntmachung nach dem Umwandlungsgesetz\nHessen Amtsgericht Bad Hersfeld HRA 1751\nLeist Holding GmbH & Co. KG – Bad Hersfeld-Kathus",
      "type": "Registerbekanntmachung nach dem Umwandlungsgesetz",
      "state": "Hessen",
      "amtsgericht": "Amtsgericht Bad Hersfeld",
      "registernummer": "HRA 1751",
      "registerart": "HRA",
      "company_name": "Leist Holding GmbH & Co. KG",
      "company_seat": "Bad Hersfeld-Kathus",
      "details": "24.10.2025 (Bekanntmachungsdatum)\n\nHessen Amtsgericht Bad Hersfeld HRA 1751\nRegisterbekanntmachung nach dem Umwandlungsgesetz 24.10.2025 (Eintragungsdatum)\n\nLeist Holding GmbH & Co. KG\nKommanditgesellschaft\nBad Hersfeld-Kathus\n\nDen Gläubigern der an der formwechselnden Umwandlung beteiligten Rechtsträger ist, wenn sie binnen sechs Monaten nach dem Tag, an dem die Eintragung der formwechselnden Umwandlung in das Register des Sitzes derjenigen Rechtsträger deren Gläubiger sie sind, nach § 201 UmwG bekannt gemacht worden ist, ihren Anspruch nach Grund und Höhe schriftlich anmelden, Sicherheit zu leisten, soweit sie nicht Befriedigung verlangen können. Dieses Recht steht den Gläubigern jedoch nur zu, wenn sie glaubhaft machen, dass durch die formwechselnden Umwandlung die Erfüllung ihrer Forderung gefährdet wird."
    },
    {
      "date": "2025-10-24",
      "id": "135297",
      "original_text": "Registerbekanntmachung nach dem Umwandlungsgesetz\nHessen Amtsgericht Frankfurt am Main HRB 120428\nRegnology Group GmbH – Frankfurt am Main",
      "type": "Registerbekanntmachung nach dem Umwandlungsgesetz",
      "state": "Hessen",
      "amtsgericht": "Amtsgericht Frankfurt am Main",
      "registernummer": "HRB 120428",
      "registerart": "HRB",
      "company_name": "Regnology Group GmbH",
      "company_seat": "Frankfurt am Main",
      "details": "24.10.2025 (Bekanntmachungsdatum)\n\nHessen Amtsgericht Frankfurt am Main HRB 120428\nRegisterbekanntmachung nach dem Umwandlungsgesetz 24.10.2025 (Eintragungsdatum)\n\nRegnology Group GmbH\nGesellschaft mit beschränkter Haftung\nFrankfurt am Main\n\nDen Gläubigern der an der Verschmelzung beteiligten Rechtsträger ist, wenn sie binnen sechs Monaten nach dem Tag, an dem die Eintragung der Verschmelzung in das Register des Sitzes desjenigen Rechtsträgers, dessen Gläubiger sie sind, nach § 19 Absatz 3 UmwG bekannt gemacht worden ist, ihren Anspruch nach Grund und Höhe schriftlich anmelden, Sicherheit zu leisten, soweit sie nicht Befriedigung verlangen können. Dieses Recht steht den Gläubigern jedoch nur zu, wenn sie glaubhaft machen, dass durch die Verschmelzung die Erfüllung ihrer Forderung gefährdet wird."
    }
  ]
}