{
  "date": "2025-10-11",
  "date_of_scrape": "2025-10-27T17:39:09.926Z",
  "tool_version": "0.2.0",
  "number_of_announcements": 16,
  "announcements": [
    {
      "date": "2025-10-11",
      "id": "133595",
      "original_text": "Löschungsankündigung\nBayern Amtsgericht Landshut HRB 14568\nKRII GmbH – Tiefenbach",
      "type": "Löschungsankündigung",
      "state": "Bayern",
      "amtsgericht": "Amtsgericht Landshut",
      "registernummer": "HRB 14568",
      "registerart": "HRB",
      "company_name": "KRII GmbH",
      "company_seat": "Tiefenbach",
      "details": "11.10.2025 (Bekanntmachungsdatum)\n\nBayern Amtsgericht Landshut HRB 14568\nLöschungsankündigung\n\nKRII GmbH\nGesellschaft mit beschränkter Haftung\nTiefenbach\n\nDas Registergericht beabsichtigt, die im Handelsregister eingetragene Gesellschaft wegen Vermögenslosigkeit von Amts wegen nach § 394 FamFG zu löschen. Die Frist zur Erhebung eines Widerspruchs ist auf einen Monat festgesetzt."
    },
    {
      "date": "2025-10-11",
      "id": "133596",
      "original_text": "Löschungsankündigung\nBayern Amtsgericht München HRB 209500\nSECDEF Security and Defense Integrated Technologies GmbH – Feldkirchen",
      "type": "Löschungsankündigung",
      "state": "Bayern",
      "amtsgericht": "Amtsgericht München",
      "registernummer": "HRB 209500",
      "registerart": "HRB",
      "company_name": "SECDEF Security and Defense Integrated Technologies GmbH",
      "company_seat": "Feldkirchen",
      "details": "11.10.2025 (Bekanntmachungsdatum)\n\nBayern Amtsgericht München HRB 209500\nLöschungsankündigung 10.10.2025 (Eintragungsdatum)\n\nSECDEF Security and Defense Integrated Technologies GmbH\nGesellschaft mit beschränkter Haftung\nFeldkirchen\n\nDas Registergericht beabsichtigt, die im Handelsregister eingetragene Gesellschaft wegen Vermögenslosigkeit von Amts wegen nach § 394 FamFG zu löschen. Die Frist zur Erhebung eines Widerspruchs ist auf drei Monate festgesetzt."
    },
    {
      "date": "2025-10-11",
      "id": "133597",
      "original_text": "Registerbekanntmachung nach dem Umwandlungsgesetz\nBayern Amtsgericht Augsburg HRB 22709\nKUKA Aktiengesellschaft – Augsburg",
      "type": "Registerbekanntmachung nach dem Umwandlungsgesetz",
      "state": "Bayern",
      "amtsgericht": "Amtsgericht Augsburg",
      "registernummer": "HRB 22709",
      "registerart": "HRB",
      "company_name": "KUKA Aktiengesellschaft",
      "company_seat": "Augsburg",
      "details": "11.10.2025 (Bekanntmachungsdatum)\n\nBayern Amtsgericht Augsburg HRB 22709\nRegisterbekanntmachung nach dem Umwandlungsgesetz 10.10.2025 (Eintragungsdatum)\n\nKUKA Aktiengesellschaft\nAktiengesellschaft\nAugsburg\n\nDen Gläubigern des formwechselnden Rechtsträgers ist, wenn sie binnen sechs Monaten nach dem Tag, an dem die Eintragung des Formwechsels nach § 201 UmwG als bekannt gemacht gilt, ihren Anspruch nach Grund und Höhe in Textform anmelden, Sicherheit zu leisten, soweit sie nicht Befriedigung verlangen können. Dieses Recht steht den Gläubigern jedoch nur zu, wenn sie glaubhaft machen, dass durch den Formwechsel die Erfüllung ihrer Forderung gefährdet wird."
    },
    {
      "date": "2025-10-11",
      "id": "133598",
      "original_text": "Registerbekanntmachung nach dem Umwandlungsgesetz\nBayern Amtsgericht Aschaffenburg HRB 11258\nTE POSTline Frankier -Kuvertier- Versand GmbH – Niedernberg",
      "type": "Registerbekanntmachung nach dem Umwandlungsgesetz",
      "state": "Bayern",
      "amtsgericht": "Amtsgericht Aschaffenburg",
      "registernummer": "HRB 11258",
      "registerart": "HRB",
      "company_name": "TE POSTline Frankier -Kuvertier- Versand GmbH",
      "company_seat": "Niedernberg",
      "details": "11.10.2025 (Bekanntmachungsdatum)\n\nBayern Amtsgericht Aschaffenburg HRB 11258\nRegisterbekanntmachung nach dem Umwandlungsgesetz 10.10.2025 (Eintragungsdatum)\n\nTE POSTline Frankier -Kuvertier- Versand GmbH\nGesellschaft mit beschränkter Haftung\nNiedernberg\n\nDen Gläubigern der an der Verschmelzung beteiligten Rechtsträger ist, wenn sie binnen sechs Monaten nach dem Tag, an dem die Eintragung der Verschmelzung in das Register des Sitzes desjenigen Rechtsträgers, dessen Gläubiger sie sind, nach § 19 Abs. 3 UmwG als bekannt gemacht gilt, ihren Anspruch nach Grund und Höhe in Textform anmelden, Sicherheit zu leisten, soweit sie nicht Befriedigung verlangen können. Dieses Recht steht den Gläubigern jedoch nur zu, wenn sie glaubhaft machen, dass durch die Verschmelzung die Erfüllung ihrer Forderung gefährdet wird."
    },
    {
      "date": "2025-10-11",
      "id": "133599",
      "original_text": "Einreichung neuer Dokumente\nBayern Amtsgericht München HRB 234787\nLinde Holding GmbH – Pullach i.Isartal",
      "type": "Einreichung neuer Dokumente",
      "state": "Bayern",
      "amtsgericht": "Amtsgericht München",
      "registernummer": "HRB 234787",
      "registerart": "HRB",
      "company_name": "Linde Holding GmbH",
      "company_seat": "Pullach i.Isartal",
      "details": "11.10.2025 (Bekanntmachungsdatum)\n\nBayern Amtsgericht München HRB 234787\nEinreichung neuer Dokumente\n\nLinde Holding GmbH\nGesellschaft mit beschränkter Haftung\nPullach i.Isartal\n\nDem Amtsgericht München -Registergericht- ist eine Liste der Mitglieder des Aufsichtsrats eingereicht worden, § 52 Abs. 3 S. 2 GmbHG."
    },
    {
      "date": "2025-10-11",
      "id": "133600",
      "original_text": "Registerbekanntmachung nach dem Umwandlungsgesetz\nBayern Amtsgericht Nürnberg HRB 31680\nguttenberger online AG – Freystadt",
      "type": "Registerbekanntmachung nach dem Umwandlungsgesetz",
      "state": "Bayern",
      "amtsgericht": "Amtsgericht Nürnberg",
      "registernummer": "HRB 31680",
      "registerart": "HRB",
      "company_name": "guttenberger online AG",
      "company_seat": "Freystadt",
      "details": "11.10.2025 (Bekanntmachungsdatum)\n\nBayern Amtsgericht Nürnberg HRB 31680\nRegisterbekanntmachung nach dem Umwandlungsgesetz 10.10.2025 (Eintragungsdatum)\n\nguttenberger online AG\nAktiengesellschaft\nFreystadt\n\nDen Gläubigern des formwechselnden Rechtsträgers ist, wenn sie binnen sechs Monaten nach dem Tag, an dem die Eintragung des Formwechsels nach § 201 UmwG als bekannt gemacht gilt, ihren Anspruch nach Grund und Höhe in Textform anmelden, Sicherheit zu leisten, soweit sie nicht Befriedigung verlangen können. Dieses Recht steht den Gläubigern jedoch nur zu, wenn sie glaubhaft machen, dass durch den Formwechsel die Erfüllung ihrer Forderung gefährdet wird."
    },
    {
      "date": "2025-10-11",
      "id": "133601",
      "original_text": "Einreichung neuer Dokumente\nBayern Amtsgericht Hof HRB 1480\nVishay Europe GmbH – Selb",
      "type": "Einreichung neuer Dokumente",
      "state": "Bayern",
      "amtsgericht": "Amtsgericht Hof",
      "registernummer": "HRB 1480",
      "registerart": "HRB",
      "company_name": "Vishay Europe GmbH",
      "company_seat": "Selb",
      "details": "11.10.2025 (Bekanntmachungsdatum)\n\nBayern Amtsgericht Hof HRB 1480\nEinreichung neuer Dokumente\n\nVishay Europe GmbH\nGesellschaft mit beschränkter Haftung\nSelb\n\nDem Amtsgericht Hof -Registergericht- ist eine Liste der Mitglieder des Aufsichtsrats eingereicht worden, § 52 Abs. 3 S. 2 GmbHG."
    },
    {
      "date": "2025-10-11",
      "id": "133602",
      "original_text": "Registerbekanntmachung nach dem Umwandlungsgesetz\nBayern Amtsgericht München HRB 272911\nLEONINE Licensing GmbH – München",
      "type": "Registerbekanntmachung nach dem Umwandlungsgesetz",
      "state": "Bayern",
      "amtsgericht": "Amtsgericht München",
      "registernummer": "HRB 272911",
      "registerart": "HRB",
      "company_name": "LEONINE Licensing GmbH",
      "company_seat": "München",
      "details": "11.10.2025 (Bekanntmachungsdatum)\n\nBayern Amtsgericht München HRB 272911\nRegisterbekanntmachung nach dem Umwandlungsgesetz 10.10.2025 (Eintragungsdatum)\n\nLEONINE Licensing GmbH\nGesellschaft mit beschränkter Haftung\nMünchen\n\nDen Gläubigern der an der Verschmelzung beteiligten Rechtsträger ist, wenn sie binnen sechs Monaten nach dem Tag, an dem die Eintragung der Verschmelzung in das Register des Sitzes desjenigen Rechtsträgers, dessen Gläubiger sie sind, nach § 19 Abs. 3 UmwG als bekannt gemacht gilt, ihren Anspruch nach Grund und Höhe in Textform anmelden, Sicherheit zu leisten, soweit sie nicht Befriedigung verlangen können. Dieses Recht steht den Gläubigern jedoch nur zu, wenn sie glaubhaft machen, dass durch die Verschmelzung die Erfüllung ihrer Forderung gefährdet wird."
    },
    {
      "date": "2025-10-11",
      "id": "133603",
      "original_text": "Löschungsankündigung\nBayern Amtsgericht Regensburg HRB 10348\nCasa Nobile GmbH – Regensburg",
      "type": "Löschungsankündigung",
      "state": "Bayern",
      "amtsgericht": "Amtsgericht Regensburg",
      "registernummer": "HRB 10348",
      "registerart": "HRB",
      "company_name": "Casa Nobile GmbH",
      "company_seat": "Regensburg",
      "details": "11.10.2025 (Bekanntmachungsdatum)\n\nBayern Amtsgericht Regensburg HRB 10348\nLöschungsankündigung\n\nCasa Nobile GmbH\nGesellschaft mit beschränkter Haftung\nRegensburg\n\nDas Registergericht beabsichtigt, die im Handelsregister eingetragene Gesellschaft wegen Vermögenslosigkeit von Amts wegen nach § 394 FamFG zu löschen. Die Frist zur Erhebung eines Widerspruchs ist auf einen Monat festgesetzt."
    },
    {
      "date": "2025-10-11",
      "id": "133604",
      "original_text": "Registerbekanntmachung nach dem Umwandlungsgesetz\nBayern Amtsgericht Nürnberg HRB 45075\nguttenberger online GmbH – Freystadt",
      "type": "Registerbekanntmachung nach dem Umwandlungsgesetz",
      "state": "Bayern",
      "amtsgericht": "Amtsgericht Nürnberg",
      "registernummer": "HRB 45075",
      "registerart": "HRB",
      "company_name": "guttenberger online GmbH",
      "company_seat": "Freystadt",
      "details": "11.10.2025 (Bekanntmachungsdatum)\n\nBayern Amtsgericht Nürnberg HRB 45075\nRegisterbekanntmachung nach dem Umwandlungsgesetz 10.10.2025 (Eintragungsdatum)\n\nguttenberger online GmbH\nGesellschaft mit beschränkter Haftung\nFreystadt\n\nDen Gläubigern des formwechselnden Rechtsträgers ist, wenn sie binnen sechs Monaten nach dem Tag, an dem die Eintragung des Formwechsels nach § 201 UmwG als bekannt gemacht gilt, ihren Anspruch nach Grund und Höhe in Textform anmelden, Sicherheit zu leisten, soweit sie nicht Befriedigung verlangen können. Dieses Recht steht den Gläubigern jedoch nur zu, wenn sie glaubhaft machen, dass durch den Formwechsel die Erfüllung ihrer Forderung gefährdet wird."
    },
    {
      "date": "2025-10-11",
      "id": "133605",
      "original_text": "Registerbekanntmachung nach dem Umwandlungsgesetz\nBayern Amtsgericht Traunstein HRA 13405\nE & R Muhr GmbH & Co. KG – Brannenburg",
      "type": "Registerbekanntmachung nach dem Umwandlungsgesetz",
      "state": "Bayern",
      "amtsgericht": "Amtsgericht Traunstein",
      "registernummer": "HRA 13405",
      "registerart": "HRA",
      "company_name": "E & R Muhr GmbH & Co. KG",
      "company_seat": "Brannenburg",
      "details": "11.10.2025 (Bekanntmachungsdatum)\n\nBayern Amtsgericht Traunstein HRA 13405\nRegisterbekanntmachung nach dem Umwandlungsgesetz 10.10.2025 (Eintragungsdatum)\n\nE & R Muhr GmbH & Co. KG\nKommanditgesellschaft\nBrannenburg\n\nDen Gläubigern des formwechselnden Rechtsträgers ist, wenn sie binnen sechs Monaten nach dem Tag, an dem die Eintragung des Formwechsels nach § 201 UmwG als bekannt gemacht gilt, ihren Anspruch nach Grund und Höhe in Textform anmelden, Sicherheit zu leisten, soweit sie nicht Befriedigung verlangen können. Dieses Recht steht den Gläubigern jedoch nur zu, wenn sie glaubhaft machen, dass durch den Formwechsel die Erfüllung ihrer Forderung gefährdet wird."
    },
    {
      "date": "2025-10-11",
      "id": "133606",
      "original_text": "Löschungsankündigung\nBayern Amtsgericht Ansbach HRB 7670\nAS Boden Bau UG (haftungsbeschränkt) – Feuchtwangen",
      "type": "Löschungsankündigung",
      "state": "Bayern",
      "amtsgericht": "Amtsgericht Ansbach",
      "registernummer": "HRB 7670",
      "registerart": "HRB",
      "company_name": "AS Boden Bau UG (haftungsbeschränkt)",
      "company_seat": "Feuchtwangen",
      "details": "11.10.2025 (Bekanntmachungsdatum)\n\nBayern Amtsgericht Ansbach HRB 7670\nLöschungsankündigung\n\nAS Boden Bau UG (haftungsbeschränkt)\nGesellschaft mit beschränkter Haftung\nFeuchtwangen\n\nDas Registergericht beabsichtigt, die im Handelsregister eingetragene Gesellschaft wegen Vermögenslosigkeit von Amts wegen nach § 394 FamFG zu löschen. Die Frist zur Erhebung eines Widerspruchs ist auf sechs Wochen festgesetzt."
    },
    {
      "date": "2025-10-11",
      "id": "133607",
      "original_text": "Einreichung neuer Dokumente\nBayern Amtsgericht München HRB 246068\nTRATON SE – München",
      "type": "Einreichung neuer Dokumente",
      "state": "Bayern",
      "amtsgericht": "Amtsgericht München",
      "registernummer": "HRB 246068",
      "registerart": "HRB",
      "company_name": "TRATON SE",
      "company_seat": "München",
      "details": "11.10.2025 (Bekanntmachungsdatum)\n\nBayern Amtsgericht München HRB 246068\nEinreichung neuer Dokumente\n\nTRATON SE\nEuropäische Aktiengesellschaft (SE)\nMünchen\n\nDem Amtsgericht München -Registergericht- ist eine Liste der Mitglieder des Aufsichtsrats eingereicht worden, Art. 9 Abs. 1 Buchst. c (ii) SE-VO i.V.m. § 106 AktG."
    },
    {
      "date": "2025-10-11",
      "id": "133608",
      "original_text": "Registerbekanntmachung nach dem Umwandlungsgesetz\nBayern Amtsgericht München HRA 120528\nJakubowska & Secen OHG, JASSE Möbel – München",
      "type": "Registerbekanntmachung nach dem Umwandlungsgesetz",
      "state": "Bayern",
      "amtsgericht": "Amtsgericht München",
      "registernummer": "HRA 120528",
      "registerart": "HRA",
      "company_name": "Jakubowska & Secen OHG, JASSE Möbel",
      "company_seat": "München",
      "details": "11.10.2025 (Bekanntmachungsdatum)\n\nBayern Amtsgericht München HRA 120528\nRegisterbekanntmachung nach dem Umwandlungsgesetz 10.10.2025 (Eintragungsdatum)\n\nJakubowska & Secen OHG, JASSE Möbel\nOffene Handelsgesellschaft\nMünchen\n\nDen Gläubigern des formwechselnden Rechtsträgers ist, wenn sie binnen sechs Monaten nach dem Tag, an dem die Eintragung des Formwechsels nach § 201 UmwG als bekannt gemacht gilt, ihren Anspruch nach Grund und Höhe in Textform anmelden, Sicherheit zu leisten, soweit sie nicht Befriedigung verlangen können. Dieses Recht steht den Gläubigern jedoch nur zu, wenn sie glaubhaft machen, dass durch den Formwechsel die Erfüllung ihrer Forderung gefährdet wird."
    },
    {
      "date": "2025-10-11",
      "id": "133609",
      "original_text": "Registerbekanntmachung nach dem Umwandlungsgesetz\nNordrhein-Westfalen Amtsgericht Coesfeld HRA 10212\nWerner Dehling Transportunternehmen e.K. – Reken",
      "type": "Registerbekanntmachung nach dem Umwandlungsgesetz",
      "state": "Nordrhein-Westfalen",
      "amtsgericht": "Amtsgericht Coesfeld",
      "registernummer": "HRA 10212",
      "registerart": "HRA",
      "company_name": "Werner Dehling Transportunternehmen e.K.",
      "company_seat": "Reken",
      "details": "11.10.2025 (Bekanntmachungsdatum)\n\nNordrhein-Westfalen Amtsgericht Coesfeld HRA 10212\nRegisterbekanntmachung nach dem Umwandlungsgesetz 11.10.2025 (Eintragungsdatum)\n\nWerner Dehling Transportunternehmen e.K.\nEinzelkaufmann\nReken\n\nDen Gläubigern der an der Ausgliederung beteiligten Rechtsträger ist, wenn sie binnen sechs Monaten nach dem Tag, an dem die Eintragung der Ausgliederung in das Register des Sitzes desjenigen Rechtsträgers, dessen Gläubiger sie sind, nach § 19 Absatz 3 UmwG als bekanntgemacht gilt, ihren Anspruch nach Grund und Höhe schriftlich anmelden, Sicherheit zu leisten, soweit sie nicht Befriedigung verlangen können. Dieses Recht steht den Gläubigern jedoch nur zu, wenn sie glaubhaft machen, dass durch die Ausgliederung die Erfüllung ihrer Forderung gefährdet wird."
    },
    {
      "date": "2025-10-11",
      "id": "133610",
      "original_text": "Löschungsankündigung\nBremen Amtsgericht Bremen HRB 40109\nJans Transporte GmbH – Bremen",
      "type": "Löschungsankündigung",
      "state": "Bremen",
      "amtsgericht": "Amtsgericht Bremen",
      "registernummer": "HRB 40109",
      "registerart": "HRB",
      "company_name": "Jans Transporte GmbH",
      "company_seat": "Bremen",
      "details": "11.10.2025 (Bekanntmachungsdatum)\n\nBremen Amtsgericht Bremen HRB 40109\nLöschungsankündigung\n\nJans Transporte GmbH\nGesellschaft mit beschränkter Haftung\nBremen\n\nEs ist beabsichtigt die im Handelsregister eingetragene Gesellschaft von Amts wegen gemäß § 394 FamFG zu löschen. Gegen die Löschung kann beim AG Bremen schriftlich oder zu Protokoll der Geschäftsstelle Widerspruch eingelegt werden. Widerspruchsfrist 4 Wochen."
    }
  ]
}