{
  "date": "2025-10-18",
  "date_of_scrape": "2025-10-27T18:25:34.858Z",
  "tool_version": "0.2.0",
  "number_of_announcements": 62,
  "announcements": [
    {
      "date": "2025-10-18",
      "id": "134428",
      "original_text": "Registerbekanntmachung nach dem Umwandlungsgesetz\nBayern Amtsgericht München HRB 290434\nPrinz von Hessen Gastro GmbH – München",
      "type": "Registerbekanntmachung nach dem Umwandlungsgesetz",
      "state": "Bayern",
      "amtsgericht": "Amtsgericht München",
      "registernummer": "HRB 290434",
      "registerart": "HRB",
      "company_name": "Prinz von Hessen Gastro GmbH",
      "company_seat": "München",
      "details": "18.10.2025 (Bekanntmachungsdatum)\n\nBayern Amtsgericht München HRB 290434\nRegisterbekanntmachung nach dem Umwandlungsgesetz 16.10.2025 (Eintragungsdatum)\n\nPrinz von Hessen Gastro GmbH\nGesellschaft mit beschränkter Haftung\nMünchen\n\nDen Gläubigern des formwechselnden Rechtsträgers ist, wenn sie binnen sechs Monaten nach dem Tag, an dem die Eintragung des Formwechsels nach § 201 UmwG als bekannt gemacht gilt, ihren Anspruch nach Grund und Höhe in Textform anmelden, Sicherheit zu leisten, soweit sie nicht Befriedigung verlangen können. Dieses Recht steht den Gläubigern jedoch nur zu, wenn sie glaubhaft machen, dass durch den Formwechsel die Erfüllung ihrer Forderung gefährdet wird."
    },
    {
      "date": "2025-10-18",
      "id": "134429",
      "original_text": "Registerbekanntmachung nach dem Umwandlungsgesetz\nBayern Amtsgericht München HRB 73733\nYellow Cab Verkehrsbetriebs GmbH – München",
      "type": "Registerbekanntmachung nach dem Umwandlungsgesetz",
      "state": "Bayern",
      "amtsgericht": "Amtsgericht München",
      "registernummer": "HRB 73733",
      "registerart": "HRB",
      "company_name": "Yellow Cab Verkehrsbetriebs GmbH",
      "company_seat": "München",
      "details": "18.10.2025 (Bekanntmachungsdatum)\n\nBayern Amtsgericht München HRB 73733\nRegisterbekanntmachung nach dem Umwandlungsgesetz 16.10.2025 (Eintragungsdatum)\n\nYellow Cab Verkehrsbetriebs GmbH\nGesellschaft mit beschränkter Haftung\nMünchen\n\nDen Gläubigern der an der Spaltung beteiligten Rechtsträger ist, wenn sie binnen sechs Monaten nach dem Tag, an dem die Eintragung der Spaltung in das Register des Sitzes desjenigen Rechtsträgers, dessen Gläubiger sie sind, nach §§ 125, 19 Abs. 3 UmwG als bekannt gemacht gilt, ihren Anspruch nach Grund und Höhe in Textform anmelden, Sicherheit zu leisten, soweit sie nicht Befriedigung verlangen können. Dieses Recht steht den Gläubigern jedoch nur zu, wenn sie glaubhaft machen, dass durch die Spaltung die Erfüllung ihrer Forderung gefährdet wird."
    },
    {
      "date": "2025-10-18",
      "id": "134430",
      "original_text": "Registerbekanntmachung nach dem Umwandlungsgesetz\nBayern Amtsgericht München HRB 200993\nStudienkreis Holding GmbH – Grünwald",
      "type": "Registerbekanntmachung nach dem Umwandlungsgesetz",
      "state": "Bayern",
      "amtsgericht": "Amtsgericht München",
      "registernummer": "HRB 200993",
      "registerart": "HRB",
      "company_name": "Studienkreis Holding GmbH",
      "company_seat": "Grünwald",
      "details": "18.10.2025 (Bekanntmachungsdatum)\n\nBayern Amtsgericht München HRB 200993\nRegisterbekanntmachung nach dem Umwandlungsgesetz 16.10.2025 (Eintragungsdatum)\n\nStudienkreis Holding GmbH\nGesellschaft mit beschränkter Haftung\nGrünwald\n\nDen Gläubigern des formwechselnden Rechtsträgers ist, wenn sie binnen sechs Monaten nach dem Tag, an dem die Eintragung des Formwechsels nach § 201 UmwG als bekannt gemacht gilt, ihren Anspruch nach Grund und Höhe in Textform anmelden, Sicherheit zu leisten, soweit sie nicht Befriedigung verlangen können. Dieses Recht steht den Gläubigern jedoch nur zu, wenn sie glaubhaft machen, dass durch den Formwechsel die Erfüllung ihrer Forderung gefährdet wird."
    },
    {
      "date": "2025-10-18",
      "id": "134431",
      "original_text": "Registerbekanntmachung nach dem Umwandlungsgesetz\nBayern Amtsgericht München HRB 196149\nSplunk Services Germany GmbH – München",
      "type": "Registerbekanntmachung nach dem Umwandlungsgesetz",
      "state": "Bayern",
      "amtsgericht": "Amtsgericht München",
      "registernummer": "HRB 196149",
      "registerart": "HRB",
      "company_name": "Splunk Services Germany GmbH",
      "company_seat": "München",
      "details": "18.10.2025 (Bekanntmachungsdatum)\n\nBayern Amtsgericht München HRB 196149\nRegisterbekanntmachung nach dem Umwandlungsgesetz 16.10.2025 (Eintragungsdatum)\n\nSplunk Services Germany GmbH\nGesellschaft mit beschränkter Haftung\nMünchen\n\nDen Gläubigern der an der Verschmelzung beteiligten Rechtsträger ist, wenn sie binnen sechs Monaten nach dem Tag, an dem die Eintragung der Verschmelzung in das Register des Sitzes desjenigen Rechtsträgers, dessen Gläubiger sie sind, nach § 19 Abs. 3 UmwG als bekannt gemacht gilt, ihren Anspruch nach Grund und Höhe in Textform anmelden, Sicherheit zu leisten, soweit sie nicht Befriedigung verlangen können. Dieses Recht steht den Gläubigern jedoch nur zu, wenn sie glaubhaft machen, dass durch die Verschmelzung die Erfüllung ihrer Forderung gefährdet wird."
    },
    {
      "date": "2025-10-18",
      "id": "134432",
      "original_text": "Löschungsankündigung\nBayern Amtsgericht München HRB 286331\nmOnterola GmbH – München",
      "type": "Löschungsankündigung",
      "state": "Bayern",
      "amtsgericht": "Amtsgericht München",
      "registernummer": "HRB 286331",
      "registerart": "HRB",
      "company_name": "mOnterola GmbH",
      "company_seat": "München",
      "details": "18.10.2025 (Bekanntmachungsdatum)\n\nBayern Amtsgericht München HRB 286331\nLöschungsankündigung 16.10.2025 (Eintragungsdatum)\n\nmOnterola GmbH\nGesellschaft mit beschränkter Haftung\nMünchen\n\nDas Registergericht beabsichtigt, den im Handelsregister eingetragenen GeschäftsführerHerr Dr. Felix Javier Pinto Torres, geb. 18.08.1971 wegen fehlender Eignung nach § 395 FamFG zu löschen. Die Frist zur Erhebung eines Widerspruchs ist auf drei Monate festgesetzt."
    },
    {
      "date": "2025-10-18",
      "id": "134433",
      "original_text": "Löschungsankündigung\nBayern Amtsgericht Bayreuth HRB 2638\nESTELLA Veranstaltungsmanagement GmbH – Bayreuth",
      "type": "Löschungsankündigung",
      "state": "Bayern",
      "amtsgericht": "Amtsgericht Bayreuth",
      "registernummer": "HRB 2638",
      "registerart": "HRB",
      "company_name": "ESTELLA Veranstaltungsmanagement GmbH",
      "company_seat": "Bayreuth",
      "details": "18.10.2025 (Bekanntmachungsdatum)\n\nBayern Amtsgericht Bayreuth HRB 2638\nLöschungsankündigung\n\nESTELLA Veranstaltungsmanagement GmbH\nGesellschaft mit beschränkter Haftung\nBayreuth\n\nDas Registergericht beabsichtigt, die im Handelsregister eingetragene Gesellschaft wegen Vermögenslosigkeit von Amts wegen nach § 394 FamFG zu löschen. Die Frist zur Erhebung eines Widerspruchs ist auf sechs Wochen festgesetzt."
    },
    {
      "date": "2025-10-18",
      "id": "134434",
      "original_text": "Einreichung neuer Dokumente\nBayern Amtsgericht Bamberg HRB 7614\nPROJECT Investment AG – Bamberg",
      "type": "Einreichung neuer Dokumente",
      "state": "Bayern",
      "amtsgericht": "Amtsgericht Bamberg",
      "registernummer": "HRB 7614",
      "registerart": "HRB",
      "company_name": "PROJECT Investment AG",
      "company_seat": "Bamberg",
      "details": "18.10.2025 (Bekanntmachungsdatum)\n\nBayern Amtsgericht Bamberg HRB 7614\nEinreichung neuer Dokumente 16.10.2025 (Eintragungsdatum)\n\nPROJECT Investment AG\nAktiengesellschaft\nBamberg\n\nDem Amtsgericht - Registergericht - Bamberg ist eine Liste der Mitglieder des Aufsichtsrats eingereicht worden, § 106 AktG."
    },
    {
      "date": "2025-10-18",
      "id": "134435",
      "original_text": "Registerbekanntmachung nach dem Umwandlungsgesetz\nBayern Amtsgericht München HRB 185085\nAnalysys Mason Munich GmbH – München",
      "type": "Registerbekanntmachung nach dem Umwandlungsgesetz",
      "state": "Bayern",
      "amtsgericht": "Amtsgericht München",
      "registernummer": "HRB 185085",
      "registerart": "HRB",
      "company_name": "Analysys Mason Munich GmbH",
      "company_seat": "München",
      "details": "18.10.2025 (Bekanntmachungsdatum)\n\nBayern Amtsgericht München HRB 185085\nRegisterbekanntmachung nach dem Umwandlungsgesetz 16.10.2025 (Eintragungsdatum)\n\nAnalysys Mason Munich GmbH\nGesellschaft mit beschränkter Haftung\nMünchen\n\nDen Gläubigern der an der Verschmelzung beteiligten Rechtsträger ist, wenn sie binnen sechs Monaten nach dem Tag, an dem die Eintragung der Verschmelzung in das Register des Sitzes desjenigen Rechtsträgers, dessen Gläubiger sie sind, nach § 19 Abs. 3 UmwG als bekannt gemacht gilt, ihren Anspruch nach Grund und Höhe in Textform anmelden, Sicherheit zu leisten, soweit sie nicht Befriedigung verlangen können. Dieses Recht steht den Gläubigern jedoch nur zu, wenn sie glaubhaft machen, dass durch die Verschmelzung die Erfüllung ihrer Forderung gefährdet wird."
    },
    {
      "date": "2025-10-18",
      "id": "134436",
      "original_text": "Registerbekanntmachung nach dem Umwandlungsgesetz\nBayern Amtsgericht München HRB 294281\nvaluna health GmbH – München",
      "type": "Registerbekanntmachung nach dem Umwandlungsgesetz",
      "state": "Bayern",
      "amtsgericht": "Amtsgericht München",
      "registernummer": "HRB 294281",
      "registerart": "HRB",
      "company_name": "valuna health GmbH",
      "company_seat": "München",
      "details": "18.10.2025 (Bekanntmachungsdatum)\n\nBayern Amtsgericht München HRB 294281\nRegisterbekanntmachung nach dem Umwandlungsgesetz 16.10.2025 (Eintragungsdatum)\n\nvaluna health GmbH\nGesellschaft mit beschränkter Haftung\nMünchen\n\nDen Gläubigern der an der Verschmelzung beteiligten Rechtsträger ist, wenn sie binnen sechs Monaten nach dem Tag, an dem die Eintragung der Verschmelzung in das Register des Sitzes desjenigen Rechtsträgers, dessen Gläubiger sie sind, nach § 19 Abs. 3 UmwG als bekannt gemacht gilt, ihren Anspruch nach Grund und Höhe in Textform anmelden, Sicherheit zu leisten, soweit sie nicht Befriedigung verlangen können. Dieses Recht steht den Gläubigern jedoch nur zu, wenn sie glaubhaft machen, dass durch die Verschmelzung die Erfüllung ihrer Forderung gefährdet wird."
    },
    {
      "date": "2025-10-18",
      "id": "134437",
      "original_text": "Löschungsankündigung\nBayern Amtsgericht München HRB 227088\nFirst Atlantic Union Marketing GmbH – München",
      "type": "Löschungsankündigung",
      "state": "Bayern",
      "amtsgericht": "Amtsgericht München",
      "registernummer": "HRB 227088",
      "registerart": "HRB",
      "company_name": "First Atlantic Union Marketing GmbH",
      "company_seat": "München",
      "details": "18.10.2025 (Bekanntmachungsdatum)\n\nBayern Amtsgericht München HRB 227088\nLöschungsankündigung\n\nFirst Atlantic Union Marketing GmbH\nGesellschaft mit beschränkter Haftung\nMünchen\n\nDas Registergericht beabsichtigt, die im Handelsregister eingetragene Gesellschaft wegen Vermögenslosigkeit von Amts wegen nach § 394 FamFG zu löschen. Die Frist zur Erhebung eines Widerspruchs ist auf drei Monate festgesetzt."
    },
    {
      "date": "2025-10-18",
      "id": "134438",
      "original_text": "Einreichung neuer Dokumente\nBayern Amtsgericht München HRB 98668\nSchaltbau Holding AG – München",
      "type": "Einreichung neuer Dokumente",
      "state": "Bayern",
      "amtsgericht": "Amtsgericht München",
      "registernummer": "HRB 98668",
      "registerart": "HRB",
      "company_name": "Schaltbau Holding AG",
      "company_seat": "München",
      "details": "18.10.2025 (Bekanntmachungsdatum)\n\nBayern Amtsgericht München HRB 98668\nEinreichung neuer Dokumente 16.10.2025 (Eintragungsdatum)\n\nSchaltbau Holding AG\nAktiengesellschaft\nMünchen\n\nDem Amtsgericht München -Registergericht- ist eine Liste der Mitglieder des Aufsichtsrats eingereicht worden, § 106 AktG."
    },
    {
      "date": "2025-10-18",
      "id": "134439",
      "original_text": "Löschungsankündigung\nBayern Amtsgericht Landshut HRB 13716\nEstu Eser UG (haftungsbeschränkt) – Dingolfing",
      "type": "Löschungsankündigung",
      "state": "Bayern",
      "amtsgericht": "Amtsgericht Landshut",
      "registernummer": "HRB 13716",
      "registerart": "HRB",
      "company_name": "Estu Eser UG (haftungsbeschränkt)",
      "company_seat": "Dingolfing",
      "details": "18.10.2025 (Bekanntmachungsdatum)\n\nBayern Amtsgericht Landshut HRB 13716\nLöschungsankündigung\n\nEstu Eser UG (haftungsbeschränkt)\nGesellschaft mit beschränkter Haftung\nDingolfing\n\nDas Registergericht beabsichtigt, die im Handelsregister eingetragene Gesellschaft wegen Vermögenslosigkeit von Amts wegen nach § 394 FamFG zu löschen. Die Frist zur Erhebung eines Widerspruchs ist auf einen Monat festgesetzt."
    },
    {
      "date": "2025-10-18",
      "id": "134440",
      "original_text": "Registerbekanntmachung nach dem Umwandlungsgesetz\nBayern Amtsgericht München HRA 121488\nDr. Jerome Antonio e.K. – München",
      "type": "Registerbekanntmachung nach dem Umwandlungsgesetz",
      "state": "Bayern",
      "amtsgericht": "Amtsgericht München",
      "registernummer": "HRA 121488",
      "registerart": "HRA",
      "company_name": "Dr. Jerome Antonio e.K.",
      "company_seat": "München",
      "details": "18.10.2025 (Bekanntmachungsdatum)\n\nBayern Amtsgericht München HRA 121488\nRegisterbekanntmachung nach dem Umwandlungsgesetz 16.10.2025 (Eintragungsdatum)\n\nDr. Jerome Antonio e.K.\nEinzelkaufmann / Einzelkauffrau\nMünchen\n\nDen Gläubigern der an der Ausgliederung beteiligten Rechtsträger ist, wenn sie binnen sechs Monaten nach dem Tag, an dem die Eintragung der Ausgliederung in das Register des Sitzes desjenigen Rechtsträgers, dessen Gläubiger sie sind, nach §§ 125, 19 Abs. 3 UmwG als bekannt gemacht gilt, ihren Anspruch nach Grund und Höhe in Textform anmelden, Sicherheit zu leisten, soweit sie nicht Befriedigung verlangen können. Dieses Recht steht den Gläubigern jedoch nur zu, wenn sie glaubhaft machen, dass durch die Ausgliederung die Erfüllung ihrer Forderung gefährdet wird."
    },
    {
      "date": "2025-10-18",
      "id": "134441",
      "original_text": "Registerbekanntmachung nach dem Umwandlungsgesetz\nBayern Amtsgericht München HRB 272399\nTengelmann Ventures GmbH – München",
      "type": "Registerbekanntmachung nach dem Umwandlungsgesetz",
      "state": "Bayern",
      "amtsgericht": "Amtsgericht München",
      "registernummer": "HRB 272399",
      "registerart": "HRB",
      "company_name": "Tengelmann Ventures GmbH",
      "company_seat": "München",
      "details": "18.10.2025 (Bekanntmachungsdatum)\n\nBayern Amtsgericht München HRB 272399\nRegisterbekanntmachung nach dem Umwandlungsgesetz 16.10.2025 (Eintragungsdatum)\n\nTengelmann Ventures GmbH\nGesellschaft mit beschränkter Haftung\nMünchen\n\nDen Gläubigern der an der Verschmelzung beteiligten Rechtsträger ist, wenn sie binnen sechs Monaten nach dem Tag, an dem die Eintragung der Verschmelzung in das Register des Sitzes desjenigen Rechtsträgers, dessen Gläubiger sie sind, nach § 19 Abs. 3 UmwG als bekannt gemacht gilt, ihren Anspruch nach Grund und Höhe in Textform anmelden, Sicherheit zu leisten, soweit sie nicht Befriedigung verlangen können. Dieses Recht steht den Gläubigern jedoch nur zu, wenn sie glaubhaft machen, dass durch die Verschmelzung die Erfüllung ihrer Forderung gefährdet wird."
    },
    {
      "date": "2025-10-18",
      "id": "134442",
      "original_text": "Löschungsankündigung\nBayern Amtsgericht München HRB 233206\nPHARMACY4 GmbH – Grünwald",
      "type": "Löschungsankündigung",
      "state": "Bayern",
      "amtsgericht": "Amtsgericht München",
      "registernummer": "HRB 233206",
      "registerart": "HRB",
      "company_name": "PHARMACY4 GmbH",
      "company_seat": "Grünwald",
      "details": "18.10.2025 (Bekanntmachungsdatum)\n\nBayern Amtsgericht München HRB 233206\nLöschungsankündigung 16.10.2025 (Eintragungsdatum)\n\nPHARMACY4 GmbH\nGesellschaft mit beschränkter Haftung\nGrünwald\n\nDas Registergericht beabsichtigt, die im Handelsregister eingetragene Gesellschaft wegen Vermögenslosigkeit von Amts wegen nach § 394 FamFG zu löschen. Die Frist zur Erhebung eines Widerspruchs ist auf drei Monate festgesetzt."
    },
    {
      "date": "2025-10-18",
      "id": "134443",
      "original_text": "Registerbekanntmachung nach dem Umwandlungsgesetz\nBayern Amtsgericht München HRB 182068\nPGIM Real Estate Germany AG – München",
      "type": "Registerbekanntmachung nach dem Umwandlungsgesetz",
      "state": "Bayern",
      "amtsgericht": "Amtsgericht München",
      "registernummer": "HRB 182068",
      "registerart": "HRB",
      "company_name": "PGIM Real Estate Germany AG",
      "company_seat": "München",
      "details": "18.10.2025 (Bekanntmachungsdatum)\n\nBayern Amtsgericht München HRB 182068\nRegisterbekanntmachung nach dem Umwandlungsgesetz 16.10.2025 (Eintragungsdatum)\n\nPGIM Real Estate Germany AG\nAktiengesellschaft\nMünchen\n\nDen Gläubigern der an der Verschmelzung beteiligten Rechtsträger ist, wenn sie binnen sechs Monaten nach dem Tag, an dem die Eintragung der Verschmelzung in das Register des Sitzes desjenigen Rechtsträgers, dessen Gläubiger sie sind, nach § 19 Abs. 3 UmwG als bekannt gemacht gilt, ihren Anspruch nach Grund und Höhe in Textform anmelden, Sicherheit zu leisten, soweit sie nicht Befriedigung verlangen können. Dieses Recht steht den Gläubigern jedoch nur zu, wenn sie glaubhaft machen, dass durch die Verschmelzung die Erfüllung ihrer Forderung gefährdet wird."
    },
    {
      "date": "2025-10-18",
      "id": "134444",
      "original_text": "Registerbekanntmachung nach dem Umwandlungsgesetz\nBayern Amtsgericht München HRB 255289\nTelescope Advisory Partners GmbH – München",
      "type": "Registerbekanntmachung nach dem Umwandlungsgesetz",
      "state": "Bayern",
      "amtsgericht": "Amtsgericht München",
      "registernummer": "HRB 255289",
      "registerart": "HRB",
      "company_name": "Telescope Advisory Partners GmbH",
      "company_seat": "München",
      "details": "18.10.2025 (Bekanntmachungsdatum)\n\nBayern Amtsgericht München HRB 255289\nRegisterbekanntmachung nach dem Umwandlungsgesetz 16.10.2025 (Eintragungsdatum)\n\nTelescope Advisory Partners GmbH\nGesellschaft mit beschränkter Haftung\nMünchen\n\nDen Gläubigern der an der Verschmelzung beteiligten Rechtsträger ist, wenn sie binnen sechs Monaten nach dem Tag, an dem die Eintragung der Verschmelzung in das Register des Sitzes desjenigen Rechtsträgers, dessen Gläubiger sie sind, nach § 19 Abs. 3 UmwG als bekannt gemacht gilt, ihren Anspruch nach Grund und Höhe in Textform anmelden, Sicherheit zu leisten, soweit sie nicht Befriedigung verlangen können. Dieses Recht steht den Gläubigern jedoch nur zu, wenn sie glaubhaft machen, dass durch die Verschmelzung die Erfüllung ihrer Forderung gefährdet wird."
    },
    {
      "date": "2025-10-18",
      "id": "134445",
      "original_text": "Löschungsankündigung\nBayern Amtsgericht Nürnberg HRB 27129\nIPS Sicherheitsdienst Nürnberg UG (haftungsbeschränkt) – Nürnberg",
      "type": "Löschungsankündigung",
      "state": "Bayern",
      "amtsgericht": "Amtsgericht Nürnberg",
      "registernummer": "HRB 27129",
      "registerart": "HRB",
      "company_name": "IPS Sicherheitsdienst Nürnberg UG (haftungsbeschränkt)",
      "company_seat": "Nürnberg",
      "details": "18.10.2025 (Bekanntmachungsdatum)\n\nBayern Amtsgericht Nürnberg HRB 27129\nLöschungsankündigung\n\nIPS Sicherheitsdienst Nürnberg UG (haftungsbeschränkt)\nGesellschaft mit beschränkter Haftung\nNürnberg\n\nDas Registergericht beabsichtigt, den im Handelsregister eingetragenen Geschäftsführer wegen fehlender Eignung nach § 395 FamFG zu löschen. Die Frist zur Erhebung eines Widerspruchs ist auf einen Monat festgesetzt."
    },
    {
      "date": "2025-10-18",
      "id": "134446",
      "original_text": "Registerbekanntmachung nach dem Umwandlungsgesetz\nBayern Amtsgericht München HRB 305228\nEmbvest Holding GmbH – München",
      "type": "Registerbekanntmachung nach dem Umwandlungsgesetz",
      "state": "Bayern",
      "amtsgericht": "Amtsgericht München",
      "registernummer": "HRB 305228",
      "registerart": "HRB",
      "company_name": "Embvest Holding GmbH",
      "company_seat": "München",
      "details": "18.10.2025 (Bekanntmachungsdatum)\n\nBayern Amtsgericht München HRB 305228\nRegisterbekanntmachung nach dem Umwandlungsgesetz 16.10.2025 (Eintragungsdatum)\n\nEmbvest Holding GmbH\nGesellschaft mit beschränkter Haftung\nMünchen\n\nDen Gläubigern der an der Verschmelzung beteiligten Rechtsträger ist, wenn sie binnen sechs Monaten nach dem Tag, an dem die Eintragung der Verschmelzung in das Register des Sitzes desjenigen Rechtsträgers, dessen Gläubiger sie sind, nach § 19 Abs. 3 UmwG als bekannt gemacht gilt, ihren Anspruch nach Grund und Höhe in Textform anmelden, Sicherheit zu leisten, soweit sie nicht Befriedigung verlangen können. Dieses Recht steht den Gläubigern jedoch nur zu, wenn sie glaubhaft machen, dass durch die Verschmelzung die Erfüllung ihrer Forderung gefährdet wird."
    },
    {
      "date": "2025-10-18",
      "id": "134447",
      "original_text": "Löschungsankündigung\nBayern Amtsgericht Landshut HRB 11092\nPS Quality GmbH – Eichendorf",
      "type": "Löschungsankündigung",
      "state": "Bayern",
      "amtsgericht": "Amtsgericht Landshut",
      "registernummer": "HRB 11092",
      "registerart": "HRB",
      "company_name": "PS Quality GmbH",
      "company_seat": "Eichendorf",
      "details": "18.10.2025 (Bekanntmachungsdatum)\n\nBayern Amtsgericht Landshut HRB 11092\nLöschungsankündigung\n\nPS Quality GmbH\nGesellschaft mit beschränkter Haftung\nEichendorf\n\nDas Registergericht beabsichtigt, die im Handelsregister eingetragene Gesellschaft wegen Vermögenslosigkeit von Amts wegen nach § 394 FamFG zu löschen. Die Frist zur Erhebung eines Widerspruchs ist auf einen Monat festgesetzt."
    },
    {
      "date": "2025-10-18",
      "id": "134448",
      "original_text": "Registerbekanntmachung nach dem Umwandlungsgesetz\nBayern Amtsgericht München HRB 263788\nnerano ventures UG (haftungsbeschränkt) – Planegg",
      "type": "Registerbekanntmachung nach dem Umwandlungsgesetz",
      "state": "Bayern",
      "amtsgericht": "Amtsgericht München",
      "registernummer": "HRB 263788",
      "registerart": "HRB",
      "company_name": "nerano ventures UG (haftungsbeschränkt)",
      "company_seat": "Planegg",
      "details": "18.10.2025 (Bekanntmachungsdatum)\n\nBayern Amtsgericht München HRB 263788\nRegisterbekanntmachung nach dem Umwandlungsgesetz 16.10.2025 (Eintragungsdatum)\n\nnerano ventures UG (haftungsbeschränkt)\nGesellschaft mit beschränkter Haftung\nPlanegg\n\nDen Gläubigern der an der Verschmelzung beteiligten Rechtsträger ist, wenn sie binnen sechs Monaten nach dem Tag, an dem die Eintragung der Verschmelzung in das Register des Sitzes desjenigen Rechtsträgers, dessen Gläubiger sie sind, nach § 19 Abs. 3 UmwG als bekannt gemacht gilt, ihren Anspruch nach Grund und Höhe in Textform anmelden, Sicherheit zu leisten, soweit sie nicht Befriedigung verlangen können. Dieses Recht steht den Gläubigern jedoch nur zu, wenn sie glaubhaft machen, dass durch die Verschmelzung die Erfüllung ihrer Forderung gefährdet wird."
    },
    {
      "date": "2025-10-18",
      "id": "134449",
      "original_text": "Registerbekanntmachung nach dem Umwandlungsgesetz\nBayern Amtsgericht Augsburg HRB 20641\nemtrada GmbH – Landsberg am Lech",
      "type": "Registerbekanntmachung nach dem Umwandlungsgesetz",
      "state": "Bayern",
      "amtsgericht": "Amtsgericht Augsburg",
      "registernummer": "HRB 20641",
      "registerart": "HRB",
      "company_name": "emtrada GmbH",
      "company_seat": "Landsberg am Lech",
      "details": "18.10.2025 (Bekanntmachungsdatum)\n\nBayern Amtsgericht Augsburg HRB 20641\nRegisterbekanntmachung nach dem Umwandlungsgesetz 17.10.2025 (Eintragungsdatum)\n\nemtrada GmbH\nGesellschaft mit beschränkter Haftung\nLandsberg am Lech\n\nDen Gläubigern der an der Verschmelzung beteiligten Rechtsträger ist, wenn sie binnen sechs Monaten nach dem Tag, an dem die Eintragung der Verschmelzung in das Register des Sitzes desjenigen Rechtsträgers, dessen Gläubiger sie sind, nach § 19 Abs. 3 UmwG als bekannt gemacht gilt, ihren Anspruch nach Grund und Höhe in Textform anmelden, Sicherheit zu leisten, soweit sie nicht Befriedigung verlangen können. Dieses Recht steht den Gläubigern jedoch nur zu, wenn sie glaubhaft machen, dass durch die Verschmelzung die Erfüllung ihrer Forderung gefährdet wird."
    },
    {
      "date": "2025-10-18",
      "id": "134450",
      "original_text": "Registerbekanntmachung nach dem Umwandlungsgesetz\nBayern Amtsgericht München HRB 179936\nCURANUM Verwaltungs GmbH – München",
      "type": "Registerbekanntmachung nach dem Umwandlungsgesetz",
      "state": "Bayern",
      "amtsgericht": "Amtsgericht München",
      "registernummer": "HRB 179936",
      "registerart": "HRB",
      "company_name": "CURANUM Verwaltungs GmbH",
      "company_seat": "München",
      "details": "18.10.2025 (Bekanntmachungsdatum)\n\nBayern Amtsgericht München HRB 179936\nRegisterbekanntmachung nach dem Umwandlungsgesetz 16.10.2025 (Eintragungsdatum)\n\nCURANUM Verwaltungs GmbH\nGesellschaft mit beschränkter Haftung\nMünchen\n\nDen Gläubigern der an der Verschmelzung beteiligten Rechtsträger ist, wenn sie binnen sechs Monaten nach dem Tag, an dem die Eintragung der Verschmelzung in das Register des Sitzes desjenigen Rechtsträgers, dessen Gläubiger sie sind, nach § 19 Abs. 3 UmwG als bekannt gemacht gilt, ihren Anspruch nach Grund und Höhe in Textform anmelden, Sicherheit zu leisten, soweit sie nicht Befriedigung verlangen können. Dieses Recht steht den Gläubigern jedoch nur zu, wenn sie glaubhaft machen, dass durch die Verschmelzung die Erfüllung ihrer Forderung gefährdet wird."
    },
    {
      "date": "2025-10-18",
      "id": "134451",
      "original_text": "Löschungsankündigung\nBayern Amtsgericht Traunstein HRB 28167\nGrawe Planungsgesellschaft mbH – Kiefersfelden",
      "type": "Löschungsankündigung",
      "state": "Bayern",
      "amtsgericht": "Amtsgericht Traunstein",
      "registernummer": "HRB 28167",
      "registerart": "HRB",
      "company_name": "Grawe Planungsgesellschaft mbH",
      "company_seat": "Kiefersfelden",
      "details": "18.10.2025 (Bekanntmachungsdatum)\n\nBayern Amtsgericht Traunstein HRB 28167\nLöschungsankündigung\n\nGrawe Planungsgesellschaft mbH\nGesellschaft mit beschränkter Haftung\nKiefersfelden\n\nDas Registergericht beabsichtigt, die im Handelsregister eingetragene Gesellschaft wegen Vermögenslosigkeit von Amts wegen nach § 394 FamFG zu löschen. 1 Monat Widerspruchsfrist"
    },
    {
      "date": "2025-10-18",
      "id": "134452",
      "original_text": "Einreichung neuer Dokumente\nBayern Amtsgericht Nürnberg HRB 35108\nSandoz Deutschland GmbH – Nürnberg",
      "type": "Einreichung neuer Dokumente",
      "state": "Bayern",
      "amtsgericht": "Amtsgericht Nürnberg",
      "registernummer": "HRB 35108",
      "registerart": "HRB",
      "company_name": "Sandoz Deutschland GmbH",
      "company_seat": "Nürnberg",
      "details": "18.10.2025 (Bekanntmachungsdatum)\n\nBayern Amtsgericht Nürnberg HRB 35108\nEinreichung neuer Dokumente 17.10.2025 (Eintragungsdatum)\n\nSandoz Deutschland GmbH\nGesellschaft mit beschränkter Haftung\nNürnberg\n\nDem Amtsgericht Nürnberg -Registergericht- ist eine Liste der Mitglieder des Aufsichtsrats eingereicht worden, § 52 Abs. 3 S. 2 GmbHG."
    },
    {
      "date": "2025-10-18",
      "id": "134453",
      "original_text": "Löschungsankündigung\nBayern Amtsgericht Nürnberg HRB 31367\nBär GmbH – Ottensoos",
      "type": "Löschungsankündigung",
      "state": "Bayern",
      "amtsgericht": "Amtsgericht Nürnberg",
      "registernummer": "HRB 31367",
      "registerart": "HRB",
      "company_name": "Bär GmbH",
      "company_seat": "Ottensoos",
      "details": "18.10.2025 (Bekanntmachungsdatum)\n\nBayern Amtsgericht Nürnberg HRB 31367\nLöschungsankündigung\n\nBär GmbH\nGesellschaft mit beschränkter Haftung\nOttensoos\n\nDas Registergericht beabsichtigt, die im Handelsregister eingetragene Gesellschaft wegen Vermögenslosigkeit von Amts wegen nach § 394 FamFG zu löschen. #insert(Text=\"zztb_V_Widerspruchsfrist\")"
    },
    {
      "date": "2025-10-18",
      "id": "134454",
      "original_text": "Registerbekanntmachung nach dem Umwandlungsgesetz\nBayern Amtsgericht München HRB 276783\nregConnect GmbH – Planegg",
      "type": "Registerbekanntmachung nach dem Umwandlungsgesetz",
      "state": "Bayern",
      "amtsgericht": "Amtsgericht München",
      "registernummer": "HRB 276783",
      "registerart": "HRB",
      "company_name": "regConnect GmbH",
      "company_seat": "Planegg",
      "details": "18.10.2025 (Bekanntmachungsdatum)\n\nBayern Amtsgericht München HRB 276783\nRegisterbekanntmachung nach dem Umwandlungsgesetz 17.10.2025 (Eintragungsdatum)\n\nregConnect GmbH\nGesellschaft mit beschränkter Haftung\nPlanegg\n\nDen Gläubigern der an der Verschmelzung beteiligten Rechtsträger ist, wenn sie binnen sechs Monaten nach dem Tag, an dem die Eintragung der Verschmelzung in das Register des Sitzes desjenigen Rechtsträgers, dessen Gläubiger sie sind, nach § 19 Abs. 3 UmwG als bekannt gemacht gilt, ihren Anspruch nach Grund und Höhe in Textform anmelden, Sicherheit zu leisten, soweit sie nicht Befriedigung verlangen können. Dieses Recht steht den Gläubigern jedoch nur zu, wenn sie glaubhaft machen, dass durch die Verschmelzung die Erfüllung ihrer Forderung gefährdet wird."
    },
    {
      "date": "2025-10-18",
      "id": "134455",
      "original_text": "Registerbekanntmachung nach dem Umwandlungsgesetz\nBayern Amtsgericht Amberg HRB 6932\nTGF TIRES RECYCLING UG (haftungsbeschränkt) – Schnaittenbach",
      "type": "Registerbekanntmachung nach dem Umwandlungsgesetz",
      "state": "Bayern",
      "amtsgericht": "Amtsgericht Amberg",
      "registernummer": "HRB 6932",
      "registerart": "HRB",
      "company_name": "TGF TIRES RECYCLING UG (haftungsbeschränkt)",
      "company_seat": "Schnaittenbach",
      "details": "18.10.2025 (Bekanntmachungsdatum)\n\nBayern Amtsgericht Amberg HRB 6932\nRegisterbekanntmachung nach dem Umwandlungsgesetz 17.10.2025 (Eintragungsdatum)\n\nTGF TIRES RECYCLING UG (haftungsbeschränkt)\nGesellschaft mit beschränkter Haftung\nSchnaittenbach\n\nDen Gläubigern der an der Verschmelzung beteiligten Rechtsträger ist, wenn sie binnen sechs Monaten nach dem Tag, an dem die Eintragung der Verschmelzung in das Register des Sitzes desjenigen Rechtsträgers, dessen Gläubiger sie sind, nach § 19 Abs. 3 UmwG als bekannt gemacht gilt, ihren Anspruch nach Grund und Höhe in Textform anmelden, Sicherheit zu leisten, soweit sie nicht Befriedigung verlangen können. Dieses Recht steht den Gläubigern jedoch nur zu, wenn sie glaubhaft machen, dass durch die Verschmelzung die Erfüllung ihrer Forderung gefährdet wird."
    },
    {
      "date": "2025-10-18",
      "id": "134456",
      "original_text": "Registerbekanntmachung nach dem Umwandlungsgesetz\nBayern Amtsgericht Deggendorf HRA 818\nAnton Wittenzellner GmbH & Co. KG – Patersdorf",
      "type": "Registerbekanntmachung nach dem Umwandlungsgesetz",
      "state": "Bayern",
      "amtsgericht": "Amtsgericht Deggendorf",
      "registernummer": "HRA 818",
      "registerart": "HRA",
      "company_name": "Anton Wittenzellner GmbH & Co. KG",
      "company_seat": "Patersdorf",
      "details": "18.10.2025 (Bekanntmachungsdatum)\n\nBayern Amtsgericht Deggendorf HRA 818\nRegisterbekanntmachung nach dem Umwandlungsgesetz 17.10.2025 (Eintragungsdatum)\n\nAnton Wittenzellner GmbH & Co. KG\nKommanditgesellschaft\nPatersdorf\n\nDen Gläubigern der an der Ausgliederung beteiligten Rechtsträger ist, wenn sie binnen sechs Monaten nach dem Tag, an dem die Eintragung der Ausgliederung in das Register des Sitzes desjenigen Rechtsträgers, dessen Gläubiger sie sind, nach §§ 125, 19 Abs. 3 UmwG als bekannt gemacht gilt, ihren Anspruch nach Grund und Höhe in Textform anmelden, Sicherheit zu leisten, soweit sie nicht Befriedigung verlangen können. Dieses Recht steht den Gläubigern jedoch nur zu, wenn sie glaubhaft machen, dass durch die Ausgliederung die Erfüllung ihrer Forderung gefährdet wird."
    },
    {
      "date": "2025-10-18",
      "id": "134457",
      "original_text": "Registerbekanntmachung nach dem Umwandlungsgesetz\nBayern Amtsgericht Deggendorf HRB 986\nKilger GmbH – Zachenberg",
      "type": "Registerbekanntmachung nach dem Umwandlungsgesetz",
      "state": "Bayern",
      "amtsgericht": "Amtsgericht Deggendorf",
      "registernummer": "HRB 986",
      "registerart": "HRB",
      "company_name": "Kilger GmbH",
      "company_seat": "Zachenberg",
      "details": "18.10.2025 (Bekanntmachungsdatum)\n\nBayern Amtsgericht Deggendorf HRB 986\nRegisterbekanntmachung nach dem Umwandlungsgesetz 17.10.2025 (Eintragungsdatum)\n\nKilger GmbH\nGesellschaft mit beschränkter Haftung\nZachenberg\n\nDen Gläubigern der an der Ausgliederung beteiligten Rechtsträger ist, wenn sie binnen sechs Monaten nach dem Tag, an dem die Eintragung der Ausgliederung in das Register des Sitzes desjenigen Rechtsträgers, dessen Gläubiger sie sind, nach §§ 125, 19 Abs. 3 UmwG als bekannt gemacht gilt, ihren Anspruch nach Grund und Höhe in Textform anmelden, Sicherheit zu leisten, soweit sie nicht Befriedigung verlangen können. Dieses Recht steht den Gläubigern jedoch nur zu, wenn sie glaubhaft machen, dass durch die Ausgliederung die Erfüllung ihrer Forderung gefährdet wird."
    },
    {
      "date": "2025-10-18",
      "id": "134458",
      "original_text": "Einreichung neuer Dokumente\nBayern Amtsgericht Ingolstadt HRB 101738\nBAUER Maschinen GmbH – Schrobenhausen",
      "type": "Einreichung neuer Dokumente",
      "state": "Bayern",
      "amtsgericht": "Amtsgericht Ingolstadt",
      "registernummer": "HRB 101738",
      "registerart": "HRB",
      "company_name": "BAUER Maschinen GmbH",
      "company_seat": "Schrobenhausen",
      "details": "18.10.2025 (Bekanntmachungsdatum)\n\nBayern Amtsgericht Ingolstadt HRB 101738\nEinreichung neuer Dokumente\n\nBAUER Maschinen GmbH\nGesellschaft mit beschränkter Haftung\nSchrobenhausen\n\nDem Amtsgericht Ingolstadt -Registergericht- ist eine Liste der Mitglieder des Aufsichtsrats eingereicht worden, § 52 Abs. 3 S. 2 GmbHG."
    },
    {
      "date": "2025-10-18",
      "id": "134459",
      "original_text": "Löschungsankündigung\nBayern Amtsgericht München HRB 259710\nAll Clean GmbH – München",
      "type": "Löschungsankündigung",
      "state": "Bayern",
      "amtsgericht": "Amtsgericht München",
      "registernummer": "HRB 259710",
      "registerart": "HRB",
      "company_name": "All Clean GmbH",
      "company_seat": "München",
      "details": "18.10.2025 (Bekanntmachungsdatum)\n\nBayern Amtsgericht München HRB 259710\nLöschungsankündigung 17.10.2025 (Eintragungsdatum)\n\nAll Clean GmbH\nGesellschaft mit beschränkter Haftung\nMünchen\n\nDas Registergericht beabsichtigt, die im Handelsregister eingetragene Gesellschaft wegen Vermögenslosigkeit von Amts wegen nach § 394 FamFG zu löschen. Die Frist zur Erhebung eines Widerspruchs ist auf drei Monate festgesetzt."
    },
    {
      "date": "2025-10-18",
      "id": "134460",
      "original_text": "Registerbekanntmachung nach dem Umwandlungsgesetz\nBayern Amtsgericht München HRB 306385\n83 Family Office GmbH – München",
      "type": "Registerbekanntmachung nach dem Umwandlungsgesetz",
      "state": "Bayern",
      "amtsgericht": "Amtsgericht München",
      "registernummer": "HRB 306385",
      "registerart": "HRB",
      "company_name": "83 Family Office GmbH",
      "company_seat": "München",
      "details": "18.10.2025 (Bekanntmachungsdatum)\n\nBayern Amtsgericht München HRB 306385\nRegisterbekanntmachung nach dem Umwandlungsgesetz 17.10.2025 (Eintragungsdatum)\n\n83 Family Office GmbH\nGesellschaft mit beschränkter Haftung\nMünchen\n\nDen Gläubigern des formwechselnden Rechtsträgers ist, wenn sie binnen sechs Monaten nach dem Tag, an dem die Eintragung des Formwechsels nach § 201 UmwG als bekannt gemacht gilt, ihren Anspruch nach Grund und Höhe in Textform anmelden, Sicherheit zu leisten, soweit sie nicht Befriedigung verlangen können. Dieses Recht steht den Gläubigern jedoch nur zu, wenn sie glaubhaft machen, dass durch den Formwechsel die Erfüllung ihrer Forderung gefährdet wird."
    },
    {
      "date": "2025-10-18",
      "id": "134461",
      "original_text": "Registerbekanntmachung nach dem Umwandlungsgesetz\nBayern Amtsgericht Augsburg HRB 20641\nemtrada GmbH – Landsberg am Lech",
      "type": "Registerbekanntmachung nach dem Umwandlungsgesetz",
      "state": "Bayern",
      "amtsgericht": "Amtsgericht Augsburg",
      "registernummer": "HRB 20641",
      "registerart": "HRB",
      "company_name": "emtrada GmbH",
      "company_seat": "Landsberg am Lech",
      "details": "18.10.2025 (Bekanntmachungsdatum)\n\nBayern Amtsgericht Augsburg HRB 20641\nRegisterbekanntmachung nach dem Umwandlungsgesetz 17.10.2025 (Eintragungsdatum)\n\nemtrada GmbH\nGesellschaft mit beschränkter Haftung\nLandsberg am Lech\n\nDen Gläubigern der an der Verschmelzung beteiligten Rechtsträger ist, wenn sie binnen sechs Monaten nach dem Tag, an dem die Eintragung der Verschmelzung in das Register des Sitzes desjenigen Rechtsträgers, dessen Gläubiger sie sind, nach § 19 Abs. 3 UmwG als bekannt gemacht gilt, ihren Anspruch nach Grund und Höhe in Textform anmelden, Sicherheit zu leisten, soweit sie nicht Befriedigung verlangen können. Dieses Recht steht den Gläubigern jedoch nur zu, wenn sie glaubhaft machen, dass durch die Verschmelzung die Erfüllung ihrer Forderung gefährdet wird."
    },
    {
      "date": "2025-10-18",
      "id": "134462",
      "original_text": "Löschungsankündigung\nBayern Amtsgericht München HRB 253264\nDM Blumen Import & Export UG (haftungsbeschränkt) – Murnau a.Staffelsee",
      "type": "Löschungsankündigung",
      "state": "Bayern",
      "amtsgericht": "Amtsgericht München",
      "registernummer": "HRB 253264",
      "registerart": "HRB",
      "company_name": "DM Blumen Import & Export UG (haftungsbeschränkt)",
      "company_seat": "Murnau a.Staffelsee",
      "details": "18.10.2025 (Bekanntmachungsdatum)\n\nBayern Amtsgericht München HRB 253264\nLöschungsankündigung 16.10.2025 (Eintragungsdatum)\n\nDM Blumen Import & Export UG (haftungsbeschränkt)\nGesellschaft mit beschränkter Haftung\nMurnau a.Staffelsee\n\nDas Registergericht beabsichtigt, die im Handelsregister eingetragene Gesellschaft wegen Vermögenslosigkeit von Amts wegen nach § 394 FamFG zu löschen. Die Frist zur Erhebung eines Widerspruchs ist auf drei Monate festgesetzt."
    },
    {
      "date": "2025-10-18",
      "id": "134463",
      "original_text": "Löschungsankündigung\nBayern Amtsgericht Hof HRB 4809\nMoodoo Advertising UG (haftungsbeschränkt) – Selb",
      "type": "Löschungsankündigung",
      "state": "Bayern",
      "amtsgericht": "Amtsgericht Hof",
      "registernummer": "HRB 4809",
      "registerart": "HRB",
      "company_name": "Moodoo Advertising UG (haftungsbeschränkt)",
      "company_seat": "Selb",
      "details": "18.10.2025 (Bekanntmachungsdatum)\n\nBayern Amtsgericht Hof HRB 4809\nLöschungsankündigung\n\nMoodoo Advertising UG (haftungsbeschränkt)\nGesellschaft mit beschränkter Haftung\nSelb\n\nDas Registergericht beabsichtigt, die im Handelsregister eingetragene Gesellschaft wegen Vermögenslosigkeit von Amts wegen nach § 394 FamFG zu löschen. Die Frist zur Erhebung eines Widerspruchs ist auf sechs Wochen festgesetzt."
    },
    {
      "date": "2025-10-18",
      "id": "134464",
      "original_text": "Löschungsankündigung\nBayern Amtsgericht München HRB 240411\nNikolaus Amberger UG (haftungsbeschränkt) – Garmisch-Partenkirchen",
      "type": "Löschungsankündigung",
      "state": "Bayern",
      "amtsgericht": "Amtsgericht München",
      "registernummer": "HRB 240411",
      "registerart": "HRB",
      "company_name": "Nikolaus Amberger UG (haftungsbeschränkt)",
      "company_seat": "Garmisch-Partenkirchen",
      "details": "18.10.2025 (Bekanntmachungsdatum)\n\nBayern Amtsgericht München HRB 240411\nLöschungsankündigung 16.10.2025 (Eintragungsdatum)\n\nNikolaus Amberger UG (haftungsbeschränkt)\nGesellschaft mit beschränkter Haftung\nGarmisch-Partenkirchen\n\nDas Registergericht beabsichtigt, die im Handelsregister eingetragene Gesellschaft wegen Vermögenslosigkeit von Amts wegen nach § 394 FamFG zu löschen. Die Frist zur Erhebung eines Widerspruchs ist auf drei Monate festgesetzt."
    },
    {
      "date": "2025-10-18",
      "id": "134465",
      "original_text": "Registerbekanntmachung nach dem Umwandlungsgesetz\nBayern Amtsgericht Fürth PR 74\nKnorr und Partner - Ingenieure, Informatiker, IT-Consultants – Zirndorf",
      "type": "Registerbekanntmachung nach dem Umwandlungsgesetz",
      "state": "Bayern",
      "amtsgericht": "Amtsgericht Fürth",
      "registernummer": "PR 74",
      "registerart": "PR",
      "company_name": "Knorr und Partner - Ingenieure, Informatiker, IT-Consultants",
      "company_seat": "Zirndorf",
      "details": "18.10.2025 (Bekanntmachungsdatum)\n\nBayern Amtsgericht Fürth PR 74\nRegisterbekanntmachung nach dem Umwandlungsgesetz 17.10.2025 (Eintragungsdatum)\n\nKnorr und Partner - Ingenieure, Informatiker, IT-Consultants\nPartnerschaftsgesellschaft\nZirndorf\n\nDen Gläubigern des formwechselnden Rechtsträgers ist, wenn sie binnen sechs Monaten nach dem Tag, an dem die Eintragung des Formwechsels nach § 201 UmwG als bekannt gemacht gilt, ihren Anspruch nach Grund und Höhe in Textform anmelden, Sicherheit zu leisten, soweit sie nicht Befriedigung verlangen können. Dieses Recht steht den Gläubigern jedoch nur zu, wenn sie glaubhaft machen, dass durch den Formwechsel die Erfüllung ihrer Forderung gefährdet wird."
    },
    {
      "date": "2025-10-18",
      "id": "134466",
      "original_text": "Sonstige Registerbekanntmachung\nBayern Amtsgericht München HRB 189201\nOWG Beteiligungs AG – Poing",
      "type": "Sonstige Registerbekanntmachung",
      "state": "Bayern",
      "amtsgericht": "Amtsgericht München",
      "registernummer": "HRB 189201",
      "registerart": "HRB",
      "company_name": "OWG Beteiligungs AG",
      "company_seat": "Poing",
      "details": "18.10.2025 (Bekanntmachungsdatum)\n\nBayern Amtsgericht München HRB 189201\nSonstige Registerbekanntmachung 17.10.2025 (Eintragungsdatum)\n\nOWG Beteiligungs AG\nAktiengesellschaft\nPoing\n\nDem Amtsgericht München -Registergericht- ist eine Liste der Mitglieder des Aufsichtsrats eingereicht worden, § 106 AktG."
    },
    {
      "date": "2025-10-18",
      "id": "134467",
      "original_text": "Registerbekanntmachung nach dem Umwandlungsgesetz\nBayern Amtsgericht Deggendorf HRA 2212\nFranz Kilger e. K. – Zachenberg",
      "type": "Registerbekanntmachung nach dem Umwandlungsgesetz",
      "state": "Bayern",
      "amtsgericht": "Amtsgericht Deggendorf",
      "registernummer": "HRA 2212",
      "registerart": "HRA",
      "company_name": "Franz Kilger e. K.",
      "company_seat": "Zachenberg",
      "details": "18.10.2025 (Bekanntmachungsdatum)\n\nBayern Amtsgericht Deggendorf HRA 2212\nRegisterbekanntmachung nach dem Umwandlungsgesetz 17.10.2025 (Eintragungsdatum)\n\nFranz Kilger e. K.\nEinzelkaufmann / Einzelkauffrau\nZachenberg\n\nDen Gläubigern der an der Ausgliederung beteiligten Rechtsträger ist, wenn sie binnen sechs Monaten nach dem Tag, an dem die Eintragung der Ausgliederung in das Register des Sitzes desjenigen Rechtsträgers, dessen Gläubiger sie sind, nach §§ 125, 19 Abs. 3 UmwG als bekannt gemacht gilt, ihren Anspruch nach Grund und Höhe in Textform anmelden, Sicherheit zu leisten, soweit sie nicht Befriedigung verlangen können. Dieses Recht steht den Gläubigern jedoch nur zu, wenn sie glaubhaft machen, dass durch die Ausgliederung die Erfüllung ihrer Forderung gefährdet wird."
    },
    {
      "date": "2025-10-18",
      "id": "134468",
      "original_text": "Registerbekanntmachung nach dem Umwandlungsgesetz\nBayern Amtsgericht München HRB 299319\nAmbulanter Pflegedienst Bavaria GmbH – Erding",
      "type": "Registerbekanntmachung nach dem Umwandlungsgesetz",
      "state": "Bayern",
      "amtsgericht": "Amtsgericht München",
      "registernummer": "HRB 299319",
      "registerart": "HRB",
      "company_name": "Ambulanter Pflegedienst Bavaria GmbH",
      "company_seat": "Erding",
      "details": "18.10.2025 (Bekanntmachungsdatum)\n\nBayern Amtsgericht München HRB 299319\nRegisterbekanntmachung nach dem Umwandlungsgesetz 17.10.2025 (Eintragungsdatum)\n\nAmbulanter Pflegedienst Bavaria GmbH\nGesellschaft mit beschränkter Haftung\nErding\n\nDen Gläubigern der an der Ausgliederung beteiligten Rechtsträger ist, wenn sie binnen sechs Monaten nach dem Tag, an dem die Eintragung der Ausgliederung in das Register des Sitzes desjenigen Rechtsträgers, dessen Gläubiger sie sind, nach §§ 125, 19 Abs. 3 UmwG als bekannt gemacht gilt, ihren Anspruch nach Grund und Höhe in Textform anmelden, Sicherheit zu leisten, soweit sie nicht Befriedigung verlangen können. Dieses Recht steht den Gläubigern jedoch nur zu, wenn sie glaubhaft machen, dass durch die Ausgliederung die Erfüllung ihrer Forderung gefährdet wird."
    },
    {
      "date": "2025-10-18",
      "id": "134469",
      "original_text": "Löschungsankündigung\nBayern Amtsgericht München HRB 241501\nPLM Recruitment GmbH – München",
      "type": "Löschungsankündigung",
      "state": "Bayern",
      "amtsgericht": "Amtsgericht München",
      "registernummer": "HRB 241501",
      "registerart": "HRB",
      "company_name": "PLM Recruitment GmbH",
      "company_seat": "München",
      "details": "18.10.2025 (Bekanntmachungsdatum)\n\nBayern Amtsgericht München HRB 241501\nLöschungsankündigung 17.10.2025 (Eintragungsdatum)\n\nPLM Recruitment GmbH\nGesellschaft mit beschränkter Haftung\nMünchen\n\nDas Registergericht beabsichtigt, die im Handelsregister eingetragene Gesellschaft wegen Vermögenslosigkeit von Amts wegen nach § 394 FamFG zu löschen. Die Frist zur Erhebung eines Widerspruchs ist auf drei Monate festgesetzt."
    },
    {
      "date": "2025-10-18",
      "id": "134470",
      "original_text": "Registerbekanntmachung nach dem Umwandlungsgesetz\nBayern Amtsgericht Augsburg HRB 20641\nemtrada GmbH – Landsberg am Lech",
      "type": "Registerbekanntmachung nach dem Umwandlungsgesetz",
      "state": "Bayern",
      "amtsgericht": "Amtsgericht Augsburg",
      "registernummer": "HRB 20641",
      "registerart": "HRB",
      "company_name": "emtrada GmbH",
      "company_seat": "Landsberg am Lech",
      "details": "18.10.2025 (Bekanntmachungsdatum)\n\nBayern Amtsgericht Augsburg HRB 20641\nRegisterbekanntmachung nach dem Umwandlungsgesetz 17.10.2025 (Eintragungsdatum)\n\nemtrada GmbH\nGesellschaft mit beschränkter Haftung\nLandsberg am Lech\n\nDen Gläubigern der an der Verschmelzung beteiligten Rechtsträger ist, wenn sie binnen sechs Monaten nach dem Tag, an dem die Eintragung der Verschmelzung in das Register des Sitzes desjenigen Rechtsträgers, dessen Gläubiger sie sind, nach § 19 Abs. 3 UmwG als bekannt gemacht gilt, ihren Anspruch nach Grund und Höhe in Textform anmelden, Sicherheit zu leisten, soweit sie nicht Befriedigung verlangen können. Dieses Recht steht den Gläubigern jedoch nur zu, wenn sie glaubhaft machen, dass durch die Verschmelzung die Erfüllung ihrer Forderung gefährdet wird."
    },
    {
      "date": "2025-10-18",
      "id": "134471",
      "original_text": "Registerbekanntmachung nach dem Umwandlungsgesetz\nBayern Amtsgericht Augsburg HRB 39620\nOoka GmbH – Landsberg am Lech",
      "type": "Registerbekanntmachung nach dem Umwandlungsgesetz",
      "state": "Bayern",
      "amtsgericht": "Amtsgericht Augsburg",
      "registernummer": "HRB 39620",
      "registerart": "HRB",
      "company_name": "Ooka GmbH",
      "company_seat": "Landsberg am Lech",
      "details": "18.10.2025 (Bekanntmachungsdatum)\n\nBayern Amtsgericht Augsburg HRB 39620\nRegisterbekanntmachung nach dem Umwandlungsgesetz 17.10.2025 (Eintragungsdatum)\n\nOoka GmbH\nGesellschaft mit beschränkter Haftung\nLandsberg am Lech\n\nDen Gläubigern der an der Verschmelzung beteiligten Rechtsträger ist, wenn sie binnen sechs Monaten nach dem Tag, an dem die Eintragung der Verschmelzung in das Register des Sitzes desjenigen Rechtsträgers, dessen Gläubiger sie sind, nach § 19 Abs. 3 UmwG als bekannt gemacht gilt, ihren Anspruch nach Grund und Höhe in Textform anmelden, Sicherheit zu leisten, soweit sie nicht Befriedigung verlangen können. Dieses Recht steht den Gläubigern jedoch nur zu, wenn sie glaubhaft machen, dass durch die Verschmelzung die Erfüllung ihrer Forderung gefährdet wird."
    },
    {
      "date": "2025-10-18",
      "id": "134472",
      "original_text": "Registerbekanntmachung nach dem Umwandlungsgesetz\nBayern Amtsgericht Deggendorf HRB 3895\nFliesen Greil GmbH – Geiersthal",
      "type": "Registerbekanntmachung nach dem Umwandlungsgesetz",
      "state": "Bayern",
      "amtsgericht": "Amtsgericht Deggendorf",
      "registernummer": "HRB 3895",
      "registerart": "HRB",
      "company_name": "Fliesen Greil GmbH",
      "company_seat": "Geiersthal",
      "details": "18.10.2025 (Bekanntmachungsdatum)\n\nBayern Amtsgericht Deggendorf HRB 3895\nRegisterbekanntmachung nach dem Umwandlungsgesetz 17.10.2025 (Eintragungsdatum)\n\nFliesen Greil GmbH\nGesellschaft mit beschränkter Haftung\nGeiersthal\n\nDen Gläubigern der an der Ausgliederung beteiligten Rechtsträger ist, wenn sie binnen sechs Monaten nach dem Tag, an dem die Eintragung der Ausgliederung in das Register des Sitzes desjenigen Rechtsträgers, dessen Gläubiger sie sind, nach §§ 125, 19 Abs. 3 UmwG als bekannt gemacht gilt, ihren Anspruch nach Grund und Höhe in Textform anmelden, Sicherheit zu leisten, soweit sie nicht Befriedigung verlangen können. Dieses Recht steht den Gläubigern jedoch nur zu, wenn sie glaubhaft machen, dass durch die Ausgliederung die Erfüllung ihrer Forderung gefährdet wird."
    },
    {
      "date": "2025-10-18",
      "id": "134473",
      "original_text": "Registerbekanntmachung nach dem Umwandlungsgesetz\nBayern Amtsgericht Nürnberg HRB 38530\n5V Immobilien GmbH – Freystadt",
      "type": "Registerbekanntmachung nach dem Umwandlungsgesetz",
      "state": "Bayern",
      "amtsgericht": "Amtsgericht Nürnberg",
      "registernummer": "HRB 38530",
      "registerart": "HRB",
      "company_name": "5V Immobilien GmbH",
      "company_seat": "Freystadt",
      "details": "18.10.2025 (Bekanntmachungsdatum)\n\nBayern Amtsgericht Nürnberg HRB 38530\nRegisterbekanntmachung nach dem Umwandlungsgesetz 16.10.2025 (Eintragungsdatum)\n\n5V Immobilien GmbH\nGesellschaft mit beschränkter Haftung\nFreystadt\n\nDen Gläubigern der an der Ausgliederung beteiligten Rechtsträger ist, wenn sie binnen sechs Monaten nach dem Tag, an dem die Eintragung der Ausgliederung in das Register des Sitzes desjenigen Rechtsträgers, dessen Gläubiger sie sind, nach §§ 125, 19 Abs. 3 UmwG als bekannt gemacht gilt, ihren Anspruch nach Grund und Höhe in Textform anmelden, Sicherheit zu leisten, soweit sie nicht Befriedigung verlangen können. Dieses Recht steht den Gläubigern jedoch nur zu, wenn sie glaubhaft machen, dass durch die Ausgliederung die Erfüllung ihrer Forderung gefährdet wird."
    },
    {
      "date": "2025-10-18",
      "id": "134474",
      "original_text": "Löschungsankündigung\nBayern Amtsgericht München HRB 114407\nMalereibetrieb Mitrovic GmbH – München",
      "type": "Löschungsankündigung",
      "state": "Bayern",
      "amtsgericht": "Amtsgericht München",
      "registernummer": "HRB 114407",
      "registerart": "HRB",
      "company_name": "Malereibetrieb Mitrovic GmbH",
      "company_seat": "München",
      "details": "18.10.2025 (Bekanntmachungsdatum)\n\nBayern Amtsgericht München HRB 114407\nLöschungsankündigung 17.10.2025 (Eintragungsdatum)\n\nMalereibetrieb Mitrovic GmbH\nGesellschaft mit beschränkter Haftung\nMünchen\n\nDas Registergericht beabsichtigt, die im Handelsregister eingetragene Gesellschaft wegen Vermögenslosigkeit von Amts wegen nach § 394 FamFG zu löschen. Die Frist zur Erhebung eines Widerspruchs ist auf drei Monate festgesetzt."
    },
    {
      "date": "2025-10-18",
      "id": "134475",
      "original_text": "Löschungsankündigung\nBayern Amtsgericht München HRA 109711\nPRIMUS Concept Pflegeimmobilien Neu-Anspach GmbH & Co. KG – Markt Indersdorf",
      "type": "Löschungsankündigung",
      "state": "Bayern",
      "amtsgericht": "Amtsgericht München",
      "registernummer": "HRA 109711",
      "registerart": "HRA",
      "company_name": "PRIMUS Concept Pflegeimmobilien Neu-Anspach GmbH & Co. KG",
      "company_seat": "Markt Indersdorf",
      "details": "18.10.2025 (Bekanntmachungsdatum)\n\nBayern Amtsgericht München HRA 109711\nLöschungsankündigung 17.10.2025 (Eintragungsdatum)\n\nPRIMUS Concept Pflegeimmobilien Neu-Anspach GmbH & Co. KG\nKommanditgesellschaft\nMarkt Indersdorf\n\nDas Registergericht beabsichtigt, die im Handelsregister eingetragene Firma von Amts wegen nach § 31 Abs. 2 HGB zu löschen. Die Frist zur Erhebung eines Widerspruchs ist auf drei Monate festgesetzt."
    },
    {
      "date": "2025-10-18",
      "id": "134476",
      "original_text": "Registerbekanntmachung nach dem Umwandlungsgesetz\nBayern Amtsgericht Augsburg HRB 39752\nAF Unity Labs GmbH – Landsberg am Lech",
      "type": "Registerbekanntmachung nach dem Umwandlungsgesetz",
      "state": "Bayern",
      "amtsgericht": "Amtsgericht Augsburg",
      "registernummer": "HRB 39752",
      "registerart": "HRB",
      "company_name": "AF Unity Labs GmbH",
      "company_seat": "Landsberg am Lech",
      "details": "18.10.2025 (Bekanntmachungsdatum)\n\nBayern Amtsgericht Augsburg HRB 39752\nRegisterbekanntmachung nach dem Umwandlungsgesetz 17.10.2025 (Eintragungsdatum)\n\nAF Unity Labs GmbH\nGesellschaft mit beschränkter Haftung\nLandsberg am Lech\n\nDen Gläubigern der an der Verschmelzung beteiligten Rechtsträger ist, wenn sie binnen sechs Monaten nach dem Tag, an dem die Eintragung der Verschmelzung in das Register des Sitzes desjenigen Rechtsträgers, dessen Gläubiger sie sind, nach § 19 Abs. 3 UmwG als bekannt gemacht gilt, ihren Anspruch nach Grund und Höhe in Textform anmelden, Sicherheit zu leisten, soweit sie nicht Befriedigung verlangen können. Dieses Recht steht den Gläubigern jedoch nur zu, wenn sie glaubhaft machen, dass durch die Verschmelzung die Erfüllung ihrer Forderung gefährdet wird."
    },
    {
      "date": "2025-10-18",
      "id": "134477",
      "original_text": "Registerbekanntmachung nach dem Umwandlungsgesetz\nBayern Amtsgericht Fürth HRB 22138\nKPConsult GmbH – Zirndorf",
      "type": "Registerbekanntmachung nach dem Umwandlungsgesetz",
      "state": "Bayern",
      "amtsgericht": "Amtsgericht Fürth",
      "registernummer": "HRB 22138",
      "registerart": "HRB",
      "company_name": "KPConsult GmbH",
      "company_seat": "Zirndorf",
      "details": "18.10.2025 (Bekanntmachungsdatum)\n\nBayern Amtsgericht Fürth HRB 22138\nRegisterbekanntmachung nach dem Umwandlungsgesetz 17.10.2025 (Eintragungsdatum)\n\nKPConsult GmbH\nGesellschaft mit beschränkter Haftung\nZirndorf\n\nDen Gläubigern des formwechselnden Rechtsträgers ist, wenn sie binnen sechs Monaten nach dem Tag, an dem die Eintragung des Formwechsels nach § 201 UmwG als bekannt gemacht gilt, ihren Anspruch nach Grund und Höhe in Textform anmelden, Sicherheit zu leisten, soweit sie nicht Befriedigung verlangen können. Dieses Recht steht den Gläubigern jedoch nur zu, wenn sie glaubhaft machen, dass durch den Formwechsel die Erfüllung ihrer Forderung gefährdet wird."
    },
    {
      "date": "2025-10-18",
      "id": "134478",
      "original_text": "Registerbekanntmachung nach dem Umwandlungsgesetz\nBayern Amtsgericht Nürnberg HRA 20436\nFuß-Fit-Forum GmbH & Co. KG – Nürnberg",
      "type": "Registerbekanntmachung nach dem Umwandlungsgesetz",
      "state": "Bayern",
      "amtsgericht": "Amtsgericht Nürnberg",
      "registernummer": "HRA 20436",
      "registerart": "HRA",
      "company_name": "Fuß-Fit-Forum GmbH & Co. KG",
      "company_seat": "Nürnberg",
      "details": "18.10.2025 (Bekanntmachungsdatum)\n\nBayern Amtsgericht Nürnberg HRA 20436\nRegisterbekanntmachung nach dem Umwandlungsgesetz 17.10.2025 (Eintragungsdatum)\n\nFuß-Fit-Forum GmbH & Co. KG\nKommanditgesellschaft\nNürnberg\n\nDen Gläubigern der an der Ausgliederung beteiligten Rechtsträger ist, wenn sie binnen sechs Monaten nach dem Tag, an dem die Eintragung der Ausgliederung in das Register des Sitzes desjenigen Rechtsträgers, dessen Gläubiger sie sind, nach §§ 125, 19 Abs. 3 UmwG als bekannt gemacht gilt, ihren Anspruch nach Grund und Höhe in Textform anmelden, Sicherheit zu leisten, soweit sie nicht Befriedigung verlangen können. Dieses Recht steht den Gläubigern jedoch nur zu, wenn sie glaubhaft machen, dass durch die Ausgliederung die Erfüllung ihrer Forderung gefährdet wird."
    },
    {
      "date": "2025-10-18",
      "id": "134479",
      "original_text": "Registerbekanntmachung nach dem Umwandlungsgesetz\nBayern Amtsgericht Augsburg HRB 20641\nemtrada GmbH – Landsberg am Lech",
      "type": "Registerbekanntmachung nach dem Umwandlungsgesetz",
      "state": "Bayern",
      "amtsgericht": "Amtsgericht Augsburg",
      "registernummer": "HRB 20641",
      "registerart": "HRB",
      "company_name": "emtrada GmbH",
      "company_seat": "Landsberg am Lech",
      "details": "18.10.2025 (Bekanntmachungsdatum)\n\nBayern Amtsgericht Augsburg HRB 20641\nRegisterbekanntmachung nach dem Umwandlungsgesetz 17.10.2025 (Eintragungsdatum)\n\nemtrada GmbH\nGesellschaft mit beschränkter Haftung\nLandsberg am Lech\n\nDen Gläubigern der an der Verschmelzung beteiligten Rechtsträger ist, wenn sie binnen sechs Monaten nach dem Tag, an dem die Eintragung der Verschmelzung in das Register des Sitzes desjenigen Rechtsträgers, dessen Gläubiger sie sind, nach § 19 Abs. 3 UmwG als bekannt gemacht gilt, ihren Anspruch nach Grund und Höhe in Textform anmelden, Sicherheit zu leisten, soweit sie nicht Befriedigung verlangen können. Dieses Recht steht den Gläubigern jedoch nur zu, wenn sie glaubhaft machen, dass durch die Verschmelzung die Erfüllung ihrer Forderung gefährdet wird."
    },
    {
      "date": "2025-10-18",
      "id": "134480",
      "original_text": "Registerbekanntmachung nach dem Umwandlungsgesetz\nBayern Amtsgericht Augsburg HRB 39406\nAIR Distribution Germany GmbH – Landsberg am Lech",
      "type": "Registerbekanntmachung nach dem Umwandlungsgesetz",
      "state": "Bayern",
      "amtsgericht": "Amtsgericht Augsburg",
      "registernummer": "HRB 39406",
      "registerart": "HRB",
      "company_name": "AIR Distribution Germany GmbH",
      "company_seat": "Landsberg am Lech",
      "details": "18.10.2025 (Bekanntmachungsdatum)\n\nBayern Amtsgericht Augsburg HRB 39406\nRegisterbekanntmachung nach dem Umwandlungsgesetz 17.10.2025 (Eintragungsdatum)\n\nAIR Distribution Germany GmbH\nGesellschaft mit beschränkter Haftung\nLandsberg am Lech\n\nDen Gläubigern der an der Verschmelzung beteiligten Rechtsträger ist, wenn sie binnen sechs Monaten nach dem Tag, an dem die Eintragung der Verschmelzung in das Register des Sitzes desjenigen Rechtsträgers, dessen Gläubiger sie sind, nach § 19 Abs. 3 UmwG als bekannt gemacht gilt, ihren Anspruch nach Grund und Höhe in Textform anmelden, Sicherheit zu leisten, soweit sie nicht Befriedigung verlangen können. Dieses Recht steht den Gläubigern jedoch nur zu, wenn sie glaubhaft machen, dass durch die Verschmelzung die Erfüllung ihrer Forderung gefährdet wird."
    },
    {
      "date": "2025-10-18",
      "id": "134481",
      "original_text": "Registerbekanntmachung nach dem Umwandlungsgesetz\nBayern Amtsgericht Nürnberg HRA 20377\nFuß-Fit-Forum Erdem e.K. – Nürnberg",
      "type": "Registerbekanntmachung nach dem Umwandlungsgesetz",
      "state": "Bayern",
      "amtsgericht": "Amtsgericht Nürnberg",
      "registernummer": "HRA 20377",
      "registerart": "HRA",
      "company_name": "Fuß-Fit-Forum Erdem e.K.",
      "company_seat": "Nürnberg",
      "details": "18.10.2025 (Bekanntmachungsdatum)\n\nBayern Amtsgericht Nürnberg HRA 20377\nRegisterbekanntmachung nach dem Umwandlungsgesetz 17.10.2025 (Eintragungsdatum)\n\nFuß-Fit-Forum Erdem e.K.\nEinzelkaufmann / Einzelkauffrau\nNürnberg\n\nDen Gläubigern der an der Ausgliederung beteiligten Rechtsträger ist, wenn sie binnen sechs Monaten nach dem Tag, an dem die Eintragung der Ausgliederung in das Register des Sitzes desjenigen Rechtsträgers, dessen Gläubiger sie sind, nach §§ 125, 19 Abs. 3 UmwG als bekannt gemacht gilt, ihren Anspruch nach Grund und Höhe in Textform anmelden, Sicherheit zu leisten, soweit sie nicht Befriedigung verlangen können. Dieses Recht steht den Gläubigern jedoch nur zu, wenn sie glaubhaft machen, dass durch die Ausgliederung die Erfüllung ihrer Forderung gefährdet wird."
    },
    {
      "date": "2025-10-18",
      "id": "134482",
      "original_text": "Löschungsankündigung\nBayern Amtsgericht Ansbach HRB 6514\nFM Dienstleistungsgesellschaft mbH – Heilsbronn",
      "type": "Löschungsankündigung",
      "state": "Bayern",
      "amtsgericht": "Amtsgericht Ansbach",
      "registernummer": "HRB 6514",
      "registerart": "HRB",
      "company_name": "FM Dienstleistungsgesellschaft mbH",
      "company_seat": "Heilsbronn",
      "details": "18.10.2025 (Bekanntmachungsdatum)\n\nBayern Amtsgericht Ansbach HRB 6514\nLöschungsankündigung\n\nFM Dienstleistungsgesellschaft mbH\nGesellschaft mit beschränkter Haftung\nHeilsbronn\n\nDas Registergericht beabsichtigt, die im Handelsregister eingetragene Gesellschaft wegen Vermögenslosigkeit von Amts wegen nach § 394 FamFG zu löschen. Die Frist zur Erhebung eines Widerspruchs ist auf sechs Wochen festgesetzt."
    },
    {
      "date": "2025-10-18",
      "id": "134483",
      "original_text": "Einreichung neuer Dokumente\nBayern Amtsgericht München HRB 164966\nMIV Management AG für Integrierte Versorgung – Grünwald",
      "type": "Einreichung neuer Dokumente",
      "state": "Bayern",
      "amtsgericht": "Amtsgericht München",
      "registernummer": "HRB 164966",
      "registerart": "HRB",
      "company_name": "MIV Management AG für Integrierte Versorgung",
      "company_seat": "Grünwald",
      "details": "18.10.2025 (Bekanntmachungsdatum)\n\nBayern Amtsgericht München HRB 164966\nEinreichung neuer Dokumente 17.10.2025 (Eintragungsdatum)\n\nMIV Management AG für Integrierte Versorgung\nAktiengesellschaft\nGrünwald\n\nDem Amtsgericht München -Registergericht- ist eine Liste der Mitglieder des Aufsichtsrats eingereicht worden, § 106 AktG."
    },
    {
      "date": "2025-10-18",
      "id": "134484",
      "original_text": "Löschungsankündigung\nBayern Amtsgericht München HRA 114171\nPRIMUS Concept Pflegeimmobilien Himmelkron GmbH & Co. KG – Markt Indersdorf",
      "type": "Löschungsankündigung",
      "state": "Bayern",
      "amtsgericht": "Amtsgericht München",
      "registernummer": "HRA 114171",
      "registerart": "HRA",
      "company_name": "PRIMUS Concept Pflegeimmobilien Himmelkron GmbH & Co. KG",
      "company_seat": "Markt Indersdorf",
      "details": "18.10.2025 (Bekanntmachungsdatum)\n\nBayern Amtsgericht München HRA 114171\nLöschungsankündigung\n\nPRIMUS Concept Pflegeimmobilien Himmelkron GmbH & Co. KG\nKommanditgesellschaft\nMarkt Indersdorf\n\nDas Registergericht beabsichtigt, die im Handelsregister eingetragene Firma wegen Vermögenslosigkeit von Amts wegen nach § 394 FamFG zu löschen. Die Frist zur Erhebung eines Widerspruchs ist auf drei Monate festgesetzt."
    },
    {
      "date": "2025-10-18",
      "id": "134485",
      "original_text": "Löschungsankündigung\nBayern Amtsgericht Nürnberg HRB 26995\neat & fly Airport Gastronomie GmbH – Nürnberg",
      "type": "Löschungsankündigung",
      "state": "Bayern",
      "amtsgericht": "Amtsgericht Nürnberg",
      "registernummer": "HRB 26995",
      "registerart": "HRB",
      "company_name": "eat & fly Airport Gastronomie GmbH",
      "company_seat": "Nürnberg",
      "details": "18.10.2025 (Bekanntmachungsdatum)\n\nBayern Amtsgericht Nürnberg HRB 26995\nLöschungsankündigung\n\neat & fly Airport Gastronomie GmbH\nGesellschaft mit beschränkter Haftung\nNürnberg\n\nDas Registergericht beabsichtigt, die im Handelsregister eingetragene Gesellschaft wegen Vermögenslosigkeit von Amts wegen nach § 394 FamFG zu löschen. Die Frist zur Erhebung eines Widerspruchs ist auf einen Monat festgesetzt."
    },
    {
      "date": "2025-10-18",
      "id": "134486",
      "original_text": "Registerbekanntmachung nach dem Umwandlungsgesetz\nBayern Amtsgericht München HRB 272291\nTEV Global Invest I GmbH – München",
      "type": "Registerbekanntmachung nach dem Umwandlungsgesetz",
      "state": "Bayern",
      "amtsgericht": "Amtsgericht München",
      "registernummer": "HRB 272291",
      "registerart": "HRB",
      "company_name": "TEV Global Invest I GmbH",
      "company_seat": "München",
      "details": "18.10.2025 (Bekanntmachungsdatum)\n\nBayern Amtsgericht München HRB 272291\nRegisterbekanntmachung nach dem Umwandlungsgesetz 17.10.2025 (Eintragungsdatum)\n\nTEV Global Invest I GmbH\nGesellschaft mit beschränkter Haftung\nMünchen\n\nDen Gläubigern der an der Verschmelzung beteiligten Rechtsträger ist, wenn sie binnen sechs Monaten nach dem Tag, an dem die Eintragung der Verschmelzung in das Register des Sitzes desjenigen Rechtsträgers, dessen Gläubiger sie sind, nach § 19 Abs. 3 UmwG als bekannt gemacht gilt, ihren Anspruch nach Grund und Höhe in Textform anmelden, Sicherheit zu leisten, soweit sie nicht Befriedigung verlangen können. Dieses Recht steht den Gläubigern jedoch nur zu, wenn sie glaubhaft machen, dass durch die Verschmelzung die Erfüllung ihrer Forderung gefährdet wird."
    },
    {
      "date": "2025-10-18",
      "id": "134487",
      "original_text": "Registerbekanntmachung nach dem Umwandlungsgesetz\nBayern Amtsgericht Augsburg HRB 22962\nfinis direct GmbH – Greifenberg",
      "type": "Registerbekanntmachung nach dem Umwandlungsgesetz",
      "state": "Bayern",
      "amtsgericht": "Amtsgericht Augsburg",
      "registernummer": "HRB 22962",
      "registerart": "HRB",
      "company_name": "finis direct GmbH",
      "company_seat": "Greifenberg",
      "details": "18.10.2025 (Bekanntmachungsdatum)\n\nBayern Amtsgericht Augsburg HRB 22962\nRegisterbekanntmachung nach dem Umwandlungsgesetz 17.10.2025 (Eintragungsdatum)\n\nfinis direct GmbH\nGesellschaft mit beschränkter Haftung\nGreifenberg\n\nDen Gläubigern der an der Verschmelzung beteiligten Rechtsträger ist, wenn sie binnen sechs Monaten nach dem Tag, an dem die Eintragung der Verschmelzung in das Register des Sitzes desjenigen Rechtsträgers, dessen Gläubiger sie sind, nach § 19 Abs. 3 UmwG als bekannt gemacht gilt, ihren Anspruch nach Grund und Höhe in Textform anmelden, Sicherheit zu leisten, soweit sie nicht Befriedigung verlangen können. Dieses Recht steht den Gläubigern jedoch nur zu, wenn sie glaubhaft machen, dass durch die Verschmelzung die Erfüllung ihrer Forderung gefährdet wird."
    },
    {
      "date": "2025-10-18",
      "id": "134488",
      "original_text": "Registerbekanntmachung nach dem Umwandlungsgesetz\nBayern Amtsgericht Straubing HRA 7286\nHelmut Renner Malerbetrieb e.K. – Kirchroth",
      "type": "Registerbekanntmachung nach dem Umwandlungsgesetz",
      "state": "Bayern",
      "amtsgericht": "Amtsgericht Straubing",
      "registernummer": "HRA 7286",
      "registerart": "HRA",
      "company_name": "Helmut Renner Malerbetrieb e.K.",
      "company_seat": "Kirchroth",
      "details": "18.10.2025 (Bekanntmachungsdatum)\n\nBayern Amtsgericht Straubing HRA 7286\nRegisterbekanntmachung nach dem Umwandlungsgesetz 16.10.2025 (Eintragungsdatum)\n\nHelmut Renner Malerbetrieb e.K.\nEinzelkaufmann / Einzelkauffrau\nKirchroth\n\nDen Gläubigern der an der Ausgliederung beteiligten Rechtsträger ist, wenn sie binnen sechs Monaten nach dem Tag, an dem die Eintragung der Ausgliederung in das Register des Sitzes desjenigen Rechtsträgers, dessen Gläubiger sie sind, nach §§ 125, 19 Abs. 3 UmwG als bekannt gemacht gilt, ihren Anspruch nach Grund und Höhe in Textform anmelden, Sicherheit zu leisten, soweit sie nicht Befriedigung verlangen können. Dieses Recht steht den Gläubigern jedoch nur zu, wenn sie glaubhaft machen, dass durch die Ausgliederung die Erfüllung ihrer Forderung gefährdet wird."
    },
    {
      "date": "2025-10-18",
      "id": "134489",
      "original_text": "Löschungsankündigung\nBayern Amtsgericht Passau HRB 9218\nVV Kokosblütenzucker GmbH – Passau",
      "type": "Löschungsankündigung",
      "state": "Bayern",
      "amtsgericht": "Amtsgericht Passau",
      "registernummer": "HRB 9218",
      "registerart": "HRB",
      "company_name": "VV Kokosblütenzucker GmbH",
      "company_seat": "Passau",
      "details": "18.10.2025 (Bekanntmachungsdatum)\n\nBayern Amtsgericht Passau HRB 9218\nLöschungsankündigung\n\nVV Kokosblütenzucker GmbH\nGesellschaft mit beschränkter Haftung\nPassau\n\nDas Registergericht beabsichtigt, die im Handelsregister eingetragene Gesellschaft wegen Vermögenslosigkeit von Amts wegen nach § 394 FamFG zu löschen. Die Frist zur Erhebung eines Widerspruchs ist auf einen Monat festgesetzt."
    }
  ]
}