{
  "date": "2025-10-28",
  "date_of_scrape": "2025-10-29T04:15:26.289Z",
  "tool_version": "0.2.0",
  "number_of_announcements": 143,
  "announcements": [
    {
      "date": "2025-10-28",
      "id": "135449",
      "original_text": "Registerbekanntmachung nach dem Umwandlungsgesetz\nBayern Amtsgericht Augsburg HRB 32116\nDocuServe Vertriebs-GmbH – Neusäß",
      "type": "Registerbekanntmachung nach dem Umwandlungsgesetz",
      "state": "Bayern",
      "amtsgericht": "Amtsgericht Augsburg",
      "registernummer": "HRB 32116",
      "registerart": "HRB",
      "company_name": "DocuServe Vertriebs-GmbH",
      "company_seat": "Neusäß",
      "details": "28.10.2025 (Bekanntmachungsdatum)\n\nBayern Amtsgericht Augsburg HRB 32116\nRegisterbekanntmachung nach dem Umwandlungsgesetz 27.10.2025 (Eintragungsdatum)\n\nDocuServe Vertriebs-GmbH\nGesellschaft mit beschränkter Haftung\nNeusäß\n\nDen Gläubigern der an der Verschmelzung beteiligten Rechtsträger ist, wenn sie binnen sechs Monaten nach dem Tag, an dem die Eintragung der Verschmelzung in das Register des Sitzes desjenigen Rechtsträgers, dessen Gläubiger sie sind, nach § 19 Abs. 3 UmwG als bekannt gemacht gilt, ihren Anspruch nach Grund und Höhe in Textform anmelden, Sicherheit zu leisten, soweit sie nicht Befriedigung verlangen können. Dieses Recht steht den Gläubigern jedoch nur zu, wenn sie glaubhaft machen, dass durch die Verschmelzung die Erfüllung ihrer Forderung gefährdet wird."
    },
    {
      "date": "2025-10-28",
      "id": "135450",
      "original_text": "Registerbekanntmachung nach dem Umwandlungsgesetz\nBayern Amtsgericht Fürth GsR 452\nM. u. F. GmbH & Co. eGbR – Oberasbach",
      "type": "Registerbekanntmachung nach dem Umwandlungsgesetz",
      "state": "Bayern",
      "amtsgericht": "Amtsgericht Fürth",
      "registernummer": "GsR 452",
      "registerart": "GsR",
      "company_name": "M. u. F. GmbH & Co. eGbR",
      "company_seat": "Oberasbach",
      "details": "28.10.2025 (Bekanntmachungsdatum)\n\nBayern Amtsgericht Fürth GsR 452\nRegisterbekanntmachung nach dem Umwandlungsgesetz 27.10.2025 (Eintragungsdatum)\n\nM. u. F. GmbH & Co. eGbR\nGesellschaft bürgerlichen Rechts\nOberasbach\n\nDen Gläubigern des formwechselnden Rechtsträgers ist, wenn sie binnen sechs Monaten nach dem Tag, an dem die Eintragung des Formwechsels nach § 201 UmwG als bekannt gemacht gilt, ihren Anspruch nach Grund und Höhe in Textform anmelden, Sicherheit zu leisten, soweit sie nicht Befriedigung verlangen können. Dieses Recht steht den Gläubigern jedoch nur zu, wenn sie glaubhaft machen, dass durch den Formwechsel die Erfüllung ihrer Forderung gefährdet wird."
    },
    {
      "date": "2025-10-28",
      "id": "135451",
      "original_text": "Löschungsankündigung\nBayern Amtsgericht Nürnberg HRB 16868\nAria ZZ GmbH – Nürnberg",
      "type": "Löschungsankündigung",
      "state": "Bayern",
      "amtsgericht": "Amtsgericht Nürnberg",
      "registernummer": "HRB 16868",
      "registerart": "HRB",
      "company_name": "Aria ZZ GmbH",
      "company_seat": "Nürnberg",
      "details": "28.10.2025 (Bekanntmachungsdatum)\n\nBayern Amtsgericht Nürnberg HRB 16868\nLöschungsankündigung\n\nAria ZZ GmbH\nGesellschaft mit beschränkter Haftung\nNürnberg\n\nDas Registergericht beabsichtigt, die im Handelsregister eingetragene Gesellschaft wegen Vermögenslosigkeit von Amts wegen nach § 394 FamFG zu löschen. Die Frist zur Erhebung eines Widerspruchs ist auf einen Monat festgesetzt."
    },
    {
      "date": "2025-10-28",
      "id": "135452",
      "original_text": "Löschungsankündigung\nBayern Amtsgericht Aschaffenburg HRB 18009\nTECH Bau GmbH – Kleinostheim",
      "type": "Löschungsankündigung",
      "state": "Bayern",
      "amtsgericht": "Amtsgericht Aschaffenburg",
      "registernummer": "HRB 18009",
      "registerart": "HRB",
      "company_name": "TECH Bau GmbH",
      "company_seat": "Kleinostheim",
      "details": "28.10.2025 (Bekanntmachungsdatum)\n\nBayern Amtsgericht Aschaffenburg HRB 18009\nLöschungsankündigung\n\nTECH Bau GmbH\nGesellschaft mit beschränkter Haftung\nKleinostheim\n\nDas Registergericht beabsichtigt, die im Handelsregister eingetragene Gesellschaft wegen Vermögenslosigkeit von Amts wegen nach § 394 FamFG zu löschen. Die Frist zur Erhebung eines Widerspruchs ist auf drei Monate festgesetzt."
    },
    {
      "date": "2025-10-28",
      "id": "135453",
      "original_text": "Registerbekanntmachung nach dem Umwandlungsgesetz\nBayern Amtsgericht Hof HRB 1895\nVishay Electronic GmbH – Selb",
      "type": "Registerbekanntmachung nach dem Umwandlungsgesetz",
      "state": "Bayern",
      "amtsgericht": "Amtsgericht Hof",
      "registernummer": "HRB 1895",
      "registerart": "HRB",
      "company_name": "Vishay Electronic GmbH",
      "company_seat": "Selb",
      "details": "28.10.2025 (Bekanntmachungsdatum)\n\nBayern Amtsgericht Hof HRB 1895\nRegisterbekanntmachung nach dem Umwandlungsgesetz 27.10.2025 (Eintragungsdatum)\n\nVishay Electronic GmbH\nGesellschaft mit beschränkter Haftung\nSelb\n\nDen Gläubigern der an der Verschmelzung beteiligten Rechtsträger ist, wenn sie binnen sechs Monaten nach dem Tag, an dem die Eintragung der Verschmelzung in das Register des Sitzes desjenigen Rechtsträgers, dessen Gläubiger sie sind, nach § 19 Abs. 3 UmwG als bekannt gemacht gilt, ihren Anspruch nach Grund und Höhe in Textform anmelden, Sicherheit zu leisten, soweit sie nicht Befriedigung verlangen können. Dieses Recht steht den Gläubigern jedoch nur zu, wenn sie glaubhaft machen, dass durch die Verschmelzung die Erfüllung ihrer Forderung gefährdet wird."
    },
    {
      "date": "2025-10-28",
      "id": "135454",
      "original_text": "Registerbekanntmachung nach dem Umwandlungsgesetz\nBayern Amtsgericht München HRA 121432\nLiftmanagement Ingenieurbüro Dipl.-Ing. F. Heidrich e.K. – Geretsried",
      "type": "Registerbekanntmachung nach dem Umwandlungsgesetz",
      "state": "Bayern",
      "amtsgericht": "Amtsgericht München",
      "registernummer": "HRA 121432",
      "registerart": "HRA",
      "company_name": "Liftmanagement Ingenieurbüro Dipl.-Ing. F. Heidrich e.K.",
      "company_seat": "Geretsried",
      "details": "28.10.2025 (Bekanntmachungsdatum)\n\nBayern Amtsgericht München HRA 121432\nRegisterbekanntmachung nach dem Umwandlungsgesetz 27.10.2025 (Eintragungsdatum)\n\nLiftmanagement Ingenieurbüro Dipl.-Ing. F. Heidrich e.K.\nEinzelkaufmann / Einzelkauffrau\nGeretsried\n\nDen Gläubigern der an der Ausgliederung beteiligten Rechtsträger ist, wenn sie binnen sechs Monaten nach dem Tag, an dem die Eintragung der Ausgliederung in das Register des Sitzes desjenigen Rechtsträgers, dessen Gläubiger sie sind, nach §§ 125, 19 Abs. 3 UmwG als bekannt gemacht gilt, ihren Anspruch nach Grund und Höhe in Textform anmelden, Sicherheit zu leisten, soweit sie nicht Befriedigung verlangen können. Dieses Recht steht den Gläubigern jedoch nur zu, wenn sie glaubhaft machen, dass durch die Ausgliederung die Erfüllung ihrer Forderung gefährdet wird."
    },
    {
      "date": "2025-10-28",
      "id": "135455",
      "original_text": "Registerbekanntmachung nach dem Umwandlungsgesetz\nBayern Amtsgericht Nürnberg HRA 20430\nBayerischer Hof Spalt GmbH & Co. KG – Spalt",
      "type": "Registerbekanntmachung nach dem Umwandlungsgesetz",
      "state": "Bayern",
      "amtsgericht": "Amtsgericht Nürnberg",
      "registernummer": "HRA 20430",
      "registerart": "HRA",
      "company_name": "Bayerischer Hof Spalt GmbH & Co. KG",
      "company_seat": "Spalt",
      "details": "28.10.2025 (Bekanntmachungsdatum)\n\nBayern Amtsgericht Nürnberg HRA 20430\nRegisterbekanntmachung nach dem Umwandlungsgesetz 27.10.2025 (Eintragungsdatum)\n\nBayerischer Hof Spalt GmbH & Co. KG\nKommanditgesellschaft\nSpalt\n\nDen Gläubigern der an der Ausgliederung beteiligten Rechtsträger ist, wenn sie binnen sechs Monaten nach dem Tag, an dem die Eintragung der Ausgliederung in das Register des Sitzes desjenigen Rechtsträgers, dessen Gläubiger sie sind, nach §§ 125, 19 Abs. 3 UmwG als bekannt gemacht gilt, ihren Anspruch nach Grund und Höhe in Textform anmelden, Sicherheit zu leisten, soweit sie nicht Befriedigung verlangen können. Dieses Recht steht den Gläubigern jedoch nur zu, wenn sie glaubhaft machen, dass durch die Ausgliederung die Erfüllung ihrer Forderung gefährdet wird."
    },
    {
      "date": "2025-10-28",
      "id": "135456",
      "original_text": "Einreichung neuer Dokumente\nBayern Amtsgericht Bayreuth HRB 6088\nIBG Immobilien Besitzgesellschaft Kreuz AG – Bayreuth",
      "type": "Einreichung neuer Dokumente",
      "state": "Bayern",
      "amtsgericht": "Amtsgericht Bayreuth",
      "registernummer": "HRB 6088",
      "registerart": "HRB",
      "company_name": "IBG Immobilien Besitzgesellschaft Kreuz AG",
      "company_seat": "Bayreuth",
      "details": "28.10.2025 (Bekanntmachungsdatum)\n\nBayern Amtsgericht Bayreuth HRB 6088\nEinreichung neuer Dokumente\n\nIBG Immobilien Besitzgesellschaft Kreuz AG\nAktiengesellschaft\nBayreuth\n\nDem Amtsgericht Bayreuth -Registergericht- ist eine Liste der Mitglieder des Aufsichtsrats eingereicht worden, § 106 AktG."
    },
    {
      "date": "2025-10-28",
      "id": "135457",
      "original_text": "Registerbekanntmachung nach dem Umwandlungsgesetz\nBayern Amtsgericht Nürnberg HRA 20429\nBayerischer Hof Spalt e. K. – Spalt",
      "type": "Registerbekanntmachung nach dem Umwandlungsgesetz",
      "state": "Bayern",
      "amtsgericht": "Amtsgericht Nürnberg",
      "registernummer": "HRA 20429",
      "registerart": "HRA",
      "company_name": "Bayerischer Hof Spalt e. K.",
      "company_seat": "Spalt",
      "details": "28.10.2025 (Bekanntmachungsdatum)\n\nBayern Amtsgericht Nürnberg HRA 20429\nRegisterbekanntmachung nach dem Umwandlungsgesetz 27.10.2025 (Eintragungsdatum)\n\nBayerischer Hof Spalt e. K.\nEinzelkaufmann / Einzelkauffrau\nSpalt\n\nDen Gläubigern der an der Ausgliederung beteiligten Rechtsträger ist, wenn sie binnen sechs Monaten nach dem Tag, an dem die Eintragung der Ausgliederung in das Register des Sitzes desjenigen Rechtsträgers, dessen Gläubiger sie sind, nach §§ 125, 19 Abs. 3 UmwG als bekannt gemacht gilt, ihren Anspruch nach Grund und Höhe in Textform anmelden, Sicherheit zu leisten, soweit sie nicht Befriedigung verlangen können. Dieses Recht steht den Gläubigern jedoch nur zu, wenn sie glaubhaft machen, dass durch die Ausgliederung die Erfüllung ihrer Forderung gefährdet wird."
    },
    {
      "date": "2025-10-28",
      "id": "135458",
      "original_text": "Registerbekanntmachung nach dem Umwandlungsgesetz\nBayern Amtsgericht Fürth HRB 22156\nRegenerative Energie Heinlein GmbH – Erlangen",
      "type": "Registerbekanntmachung nach dem Umwandlungsgesetz",
      "state": "Bayern",
      "amtsgericht": "Amtsgericht Fürth",
      "registernummer": "HRB 22156",
      "registerart": "HRB",
      "company_name": "Regenerative Energie Heinlein GmbH",
      "company_seat": "Erlangen",
      "details": "28.10.2025 (Bekanntmachungsdatum)\n\nBayern Amtsgericht Fürth HRB 22156\nRegisterbekanntmachung nach dem Umwandlungsgesetz 27.10.2025 (Eintragungsdatum)\n\nRegenerative Energie Heinlein GmbH\nGesellschaft mit beschränkter Haftung\nErlangen\n\nDen Gläubigern des formwechselnden Rechtsträgers ist, wenn sie binnen sechs Monaten nach dem Tag, an dem die Eintragung des Formwechsels nach § 201 UmwG als bekannt gemacht gilt, ihren Anspruch nach Grund und Höhe in Textform anmelden, Sicherheit zu leisten, soweit sie nicht Befriedigung verlangen können. Dieses Recht steht den Gläubigern jedoch nur zu, wenn sie glaubhaft machen, dass durch den Formwechsel die Erfüllung ihrer Forderung gefährdet wird."
    },
    {
      "date": "2025-10-28",
      "id": "135459",
      "original_text": "Löschungsankündigung\nBayern Amtsgericht München HRB 256340\nvCoach GmbH – München",
      "type": "Löschungsankündigung",
      "state": "Bayern",
      "amtsgericht": "Amtsgericht München",
      "registernummer": "HRB 256340",
      "registerart": "HRB",
      "company_name": "vCoach GmbH",
      "company_seat": "München",
      "details": "28.10.2025 (Bekanntmachungsdatum)\n\nBayern Amtsgericht München HRB 256340\nLöschungsankündigung 27.10.2025 (Eintragungsdatum)\n\nvCoach GmbH\nGesellschaft mit beschränkter Haftung\nMünchen\n\nDas Registergericht beabsichtigt, die im Handelsregister eingetragene Gesellschaft wegen Vermögenslosigkeit von Amts wegen nach § 394 FamFG zu löschen. Die Frist zur Erhebung eines Widerspruchs ist auf drei Monate festgesetzt."
    },
    {
      "date": "2025-10-28",
      "id": "135460",
      "original_text": "Einreichung neuer Dokumente\nBayern Amtsgericht Ingolstadt HRB 9560\nALDI Verwaltungs-SE VIII – Geisenfeld",
      "type": "Einreichung neuer Dokumente",
      "state": "Bayern",
      "amtsgericht": "Amtsgericht Ingolstadt",
      "registernummer": "HRB 9560",
      "registerart": "HRB",
      "company_name": "ALDI Verwaltungs-SE VIII",
      "company_seat": "Geisenfeld",
      "details": "28.10.2025 (Bekanntmachungsdatum)\n\nBayern Amtsgericht Ingolstadt HRB 9560\nEinreichung neuer Dokumente\n\nALDI Verwaltungs-SE VIII\nEuropäische Aktiengesellschaft (SE)\nGeisenfeld\n\nDem Amtsgericht Ingolstadt -Registergericht- ist eine Liste der Mitglieder des Verwaltungsrats eingereicht worden."
    },
    {
      "date": "2025-10-28",
      "id": "135461",
      "original_text": "Registerbekanntmachung nach dem Umwandlungsgesetz\nBayern Amtsgericht Fürth GsR 451\nRegenerative Energie Heinlein eGbR – Erlangen",
      "type": "Registerbekanntmachung nach dem Umwandlungsgesetz",
      "state": "Bayern",
      "amtsgericht": "Amtsgericht Fürth",
      "registernummer": "GsR 451",
      "registerart": "GsR",
      "company_name": "Regenerative Energie Heinlein eGbR",
      "company_seat": "Erlangen",
      "details": "28.10.2025 (Bekanntmachungsdatum)\n\nBayern Amtsgericht Fürth GsR 451\nRegisterbekanntmachung nach dem Umwandlungsgesetz 27.10.2025 (Eintragungsdatum)\n\nRegenerative Energie Heinlein eGbR\nGesellschaft bürgerlichen Rechts\nErlangen\n\nDen Gläubigern des formwechselnden Rechtsträgers ist, wenn sie binnen sechs Monaten nach dem Tag, an dem die Eintragung des Formwechsels nach § 201 UmwG als bekannt gemacht gilt, ihren Anspruch nach Grund und Höhe in Textform anmelden, Sicherheit zu leisten, soweit sie nicht Befriedigung verlangen können. Dieses Recht steht den Gläubigern jedoch nur zu, wenn sie glaubhaft machen, dass durch den Formwechsel die Erfüllung ihrer Forderung gefährdet wird."
    },
    {
      "date": "2025-10-28",
      "id": "135462",
      "original_text": "Einreichung neuer Dokumente\nBayern Amtsgericht Nürnberg HRB 38391\nBKR Software Consulting & Technology AG – Nürnberg",
      "type": "Einreichung neuer Dokumente",
      "state": "Bayern",
      "amtsgericht": "Amtsgericht Nürnberg",
      "registernummer": "HRB 38391",
      "registerart": "HRB",
      "company_name": "BKR Software Consulting & Technology AG",
      "company_seat": "Nürnberg",
      "details": "28.10.2025 (Bekanntmachungsdatum)\n\nBayern Amtsgericht Nürnberg HRB 38391\nEinreichung neuer Dokumente\n\nBKR Software Consulting & Technology AG\nAktiengesellschaft\nNürnberg\n\nDem Amtsgericht Nürnberg -Registergericht- ist eine Liste der Mitglieder des Aufsichtsrats eingereicht worden, § 106 AktG."
    },
    {
      "date": "2025-10-28",
      "id": "135463",
      "original_text": "Registerbekanntmachung nach dem Umwandlungsgesetz\nBayern Amtsgericht Regensburg HRB 21922\nKRONES Holding International GmbH – Neutraubling",
      "type": "Registerbekanntmachung nach dem Umwandlungsgesetz",
      "state": "Bayern",
      "amtsgericht": "Amtsgericht Regensburg",
      "registernummer": "HRB 21922",
      "registerart": "HRB",
      "company_name": "KRONES Holding International GmbH",
      "company_seat": "Neutraubling",
      "details": "28.10.2025 (Bekanntmachungsdatum)\n\nBayern Amtsgericht Regensburg HRB 21922\nRegisterbekanntmachung nach dem Umwandlungsgesetz 27.10.2025 (Eintragungsdatum)\n\nKRONES Holding International GmbH\nGesellschaft mit beschränkter Haftung\nNeutraubling\n\nDen Gläubigern der an der Verschmelzung beteiligten Rechtsträger ist, wenn sie binnen sechs Monaten nach dem Tag, an dem die Eintragung der Verschmelzung in das Register des Sitzes desjenigen Rechtsträgers, dessen Gläubiger sie sind, nach § 19 Abs. 3 UmwG als bekannt gemacht gilt, ihren Anspruch nach Grund und Höhe in Textform anmelden, Sicherheit zu leisten, soweit sie nicht Befriedigung verlangen können. Dieses Recht steht den Gläubigern jedoch nur zu, wenn sie glaubhaft machen, dass durch die Verschmelzung die Erfüllung ihrer Forderung gefährdet wird."
    },
    {
      "date": "2025-10-28",
      "id": "135464",
      "original_text": "Registerbekanntmachung nach dem Umwandlungsgesetz\nBayern Amtsgericht München HRA 117311\nVSP 42 GmbH & Co. KG – München",
      "type": "Registerbekanntmachung nach dem Umwandlungsgesetz",
      "state": "Bayern",
      "amtsgericht": "Amtsgericht München",
      "registernummer": "HRA 117311",
      "registerart": "HRA",
      "company_name": "VSP 42 GmbH & Co. KG",
      "company_seat": "München",
      "details": "28.10.2025 (Bekanntmachungsdatum)\n\nBayern Amtsgericht München HRA 117311\nRegisterbekanntmachung nach dem Umwandlungsgesetz 27.10.2025 (Eintragungsdatum)\n\nVSP 42 GmbH & Co. KG\nKommanditgesellschaft\nMünchen\n\nZur Verschmelzung der Energiepark Maisach Ost GmbH mit Sitz in Ismaning (AG München HRB 300693) auf die VSP 42 GmbH & Co. KG mit Sitz in München (AG München HRA 117311):\nDen Gläubigern der an der Verschmelzung beteiligten Rechtsträger ist, wenn sie binnen sechs Monaten nach dem Tag, an dem die Eintragung der Verschmelzung in das Register des Sitzes desjenigen Rechtsträgers, dessen Gläubiger sie sind, nach § 19 Abs. 3 UmwG als bekannt gemacht gilt, ihren Anspruch nach Grund und Höhe in Textform anmelden, Sicherheit zu leisten, soweit sie nicht Befriedigung verlangen können. Dieses Recht steht den Gläubigern jedoch nur zu, wenn sie glaubhaft machen, dass durch die Verschmelzung die Erfüllung ihrer Forderung gefährdet wird."
    },
    {
      "date": "2025-10-28",
      "id": "135465",
      "original_text": "Einreichung neuer Dokumente\nBayern Amtsgericht Aschaffenburg HRB 8887\nDPD Deutschland GmbH – Aschaffenburg",
      "type": "Einreichung neuer Dokumente",
      "state": "Bayern",
      "amtsgericht": "Amtsgericht Aschaffenburg",
      "registernummer": "HRB 8887",
      "registerart": "HRB",
      "company_name": "DPD Deutschland GmbH",
      "company_seat": "Aschaffenburg",
      "details": "28.10.2025 (Bekanntmachungsdatum)\n\nBayern Amtsgericht Aschaffenburg HRB 8887\nEinreichung neuer Dokumente\n\nDPD Deutschland GmbH\nGesellschaft mit beschränkter Haftung\nAschaffenburg\n\nDem Amtsgericht Aschaffenburg -Registergericht- ist eine Liste der Mitglieder des Aufsichtsrats eingereicht worden, § 52 Abs. 3 S. 2 GmbHG."
    },
    {
      "date": "2025-10-28",
      "id": "135466",
      "original_text": "Registerbekanntmachung nach dem Umwandlungsgesetz\nBayern Amtsgericht Landshut HRB 14229\nPaul Fischer Trading GmbH – Kumhausen",
      "type": "Registerbekanntmachung nach dem Umwandlungsgesetz",
      "state": "Bayern",
      "amtsgericht": "Amtsgericht Landshut",
      "registernummer": "HRB 14229",
      "registerart": "HRB",
      "company_name": "Paul Fischer Trading GmbH",
      "company_seat": "Kumhausen",
      "details": "28.10.2025 (Bekanntmachungsdatum)\n\nBayern Amtsgericht Landshut HRB 14229\nRegisterbekanntmachung nach dem Umwandlungsgesetz 27.10.2025 (Eintragungsdatum)\n\nPaul Fischer Trading GmbH\nGesellschaft mit beschränkter Haftung\nKumhausen\n\nDen Gläubigern der an der Verschmelzung beteiligten Rechtsträger ist, wenn sie binnen sechs Monaten nach dem Tag, an dem die Eintragung der Verschmelzung in das Register des Sitzes desjenigen Rechtsträgers, dessen Gläubiger sie sind, nach § 19 Abs. 3 UmwG als bekannt gemacht gilt, ihren Anspruch nach Grund und Höhe in Textform anmelden, Sicherheit zu leisten, soweit sie nicht Befriedigung verlangen können. Dieses Recht steht den Gläubigern jedoch nur zu, wenn sie glaubhaft machen, dass durch die Verschmelzung die Erfüllung ihrer Forderung gefährdet wird."
    },
    {
      "date": "2025-10-28",
      "id": "135467",
      "original_text": "Einreichung neuer Dokumente\nBayern Amtsgericht München HRB 57531\nBKL Baukran Logistik GmbH – Forstinning",
      "type": "Einreichung neuer Dokumente",
      "state": "Bayern",
      "amtsgericht": "Amtsgericht München",
      "registernummer": "HRB 57531",
      "registerart": "HRB",
      "company_name": "BKL Baukran Logistik GmbH",
      "company_seat": "Forstinning",
      "details": "28.10.2025 (Bekanntmachungsdatum)\n\nBayern Amtsgericht München HRB 57531\nEinreichung neuer Dokumente 27.10.2025 (Eintragungsdatum)\n\nBKL Baukran Logistik GmbH\nGesellschaft mit beschränkter Haftung\nForstinning\n\nDem #Re.Name ist eine Liste der Mitglieder des Aufsichtsrats eingereicht worden, § 52 Abs. 3 S. 2 GmbHG."
    },
    {
      "date": "2025-10-28",
      "id": "135468",
      "original_text": "Einreichung neuer Dokumente\nBerlin Amtsgericht Berlin (Charlottenburg) HRB 283\nBayer Pharma Aktiengesellschaft – Berlin",
      "type": "Einreichung neuer Dokumente",
      "state": "Berlin",
      "amtsgericht": "Amtsgericht Berlin (Charlottenburg)",
      "registernummer": "HRB 283",
      "registerart": "HRB",
      "company_name": "Bayer Pharma Aktiengesellschaft",
      "company_seat": "Berlin",
      "details": "28.10.2025 (Bekanntmachungsdatum)\n\nBerlin Amtsgericht Berlin (Charlottenburg) HRB 283\nEinreichung neuer Dokumente\n\nBayer Pharma Aktiengesellschaft\nAktiengesellschaft\nBerlin\n\nAls nicht eingetragen wird veröffentlicht: Es wurde eine neue Liste der Aufsichtsratsmitglieder eingereicht (§ 106 AktG)."
    },
    {
      "date": "2025-10-28",
      "id": "135469",
      "original_text": "Registerbekanntmachung nach dem Umwandlungsgesetz\nBerlin Amtsgericht Berlin (Charlottenburg) HRB 142274\nKondor Wessels Beteiligung GmbH – Berlin",
      "type": "Registerbekanntmachung nach dem Umwandlungsgesetz",
      "state": "Berlin",
      "amtsgericht": "Amtsgericht Berlin (Charlottenburg)",
      "registernummer": "HRB 142274",
      "registerart": "HRB",
      "company_name": "Kondor Wessels Beteiligung GmbH",
      "company_seat": "Berlin",
      "details": "28.10.2025 (Bekanntmachungsdatum)\n\nBerlin Amtsgericht Berlin (Charlottenburg) HRB 142274\nRegisterbekanntmachung nach dem Umwandlungsgesetz 24.10.2025 (Eintragungsdatum)\n\nKondor Wessels Beteiligung GmbH\nGesellschaft mit beschränkter Haftung\nBerlin\n\nZu Eintragungsnummer 9 vom 24.10.2025 wird als nicht eingetragen veröffentlicht: Den Gläubigern der an der Verschmelzung beteiligten Rechtsträger ist, wenn sie binnen sechs Monaten nach dem Tag, an dem die Eintragung der Verschmelzung in das Register des Sitzes desjenigen Rechtsträgers, dessen Gläubiger sie sind, als bekannt gemacht gilt, ihren Anspruch nach Grund und Höhe schriftlich anmelden, Sicherheit zu leisten, soweit sie nicht Befriedigung verlangen können. Dieses Recht steht den Gläubigern jedoch nur zu, wenn sie glaubhaft machen, dass durch die Verschmelzung die Erfüllung ihrer Forderung gefährdet wird. Das Recht, Sicherheitsleistung zu verlangen, steht Gläubigern nicht zu, die im Falle der Insolvenz ein Recht auf vorzugsweise Befriedigung aus einer Deckungsmasse haben, die nach gesetzlicher Vorschrift zu ihrem Schutz errichtet und staatlich überwacht ist."
    },
    {
      "date": "2025-10-28",
      "id": "135470",
      "original_text": "Registerbekanntmachung nach dem Umwandlungsgesetz\nBerlin Amtsgericht Berlin (Charlottenburg) HRB 101286\nKondor Wessels Invest GmbH – Berlin",
      "type": "Registerbekanntmachung nach dem Umwandlungsgesetz",
      "state": "Berlin",
      "amtsgericht": "Amtsgericht Berlin (Charlottenburg)",
      "registernummer": "HRB 101286",
      "registerart": "HRB",
      "company_name": "Kondor Wessels Invest GmbH",
      "company_seat": "Berlin",
      "details": "28.10.2025 (Bekanntmachungsdatum)\n\nBerlin Amtsgericht Berlin (Charlottenburg) HRB 101286\nRegisterbekanntmachung nach dem Umwandlungsgesetz 24.10.2025 (Eintragungsdatum)\n\nKondor Wessels Invest GmbH\nGesellschaft mit beschränkter Haftung\nBerlin\n\nZu Eintragungsnummer 17 vom 24.10.2025 wird als nicht eingetragen veröffentlicht: Den Gläubigern der an der Verschmelzung beteiligten Rechtsträger ist, wenn sie binnen sechs Monaten nach dem Tag, an dem die Eintragung der Verschmelzung in das Register des Sitzes desjenigen Rechtsträgers, dessen Gläubiger sie sind, als bekannt gemacht gilt, ihren Anspruch nach Grund und Höhe schriftlich anmelden, Sicherheit zu leisten, soweit sie nicht Befriedigung verlangen können. Dieses Recht steht den Gläubigern jedoch nur zu, wenn sie glaubhaft machen, dass durch die Verschmelzung die Erfüllung ihrer Forderung gefährdet wird. Das Recht, Sicherheitsleistung zu verlangen, steht Gläubigern nicht zu, die im Falle der Insolvenz ein Recht auf vorzugsweise Befriedigung aus einer Deckungsmasse haben, die nach gesetzlicher Vorschrift zu ihrem Schutz errichtet und staatlich überwacht ist."
    },
    {
      "date": "2025-10-28",
      "id": "135471",
      "original_text": "Registerbekanntmachung nach dem Umwandlungsgesetz\nBrandenburg Amtsgericht Potsdam HRB 40167\nDeutsches Rotes Kreuz Fläming-Spreewald Inklusion gGmbH – Luckenwalde",
      "type": "Registerbekanntmachung nach dem Umwandlungsgesetz",
      "state": "Brandenburg",
      "amtsgericht": "Amtsgericht Potsdam",
      "registernummer": "HRB 40167",
      "registerart": "HRB",
      "company_name": "Deutsches Rotes Kreuz Fläming-Spreewald Inklusion gGmbH",
      "company_seat": "Luckenwalde",
      "details": "28.10.2025 (Bekanntmachungsdatum)\n\nBrandenburg Amtsgericht Potsdam HRB 40167\nRegisterbekanntmachung nach dem Umwandlungsgesetz 24.10.2025 (Eintragungsdatum)\n\nDeutsches Rotes Kreuz Fläming-Spreewald Inklusion gGmbH\nGesellschaft mit beschränkter Haftung\nLuckenwalde\n\nZu Eintragungsnummer 2 vom 24.10.2025 wird als nicht eingetragen veröffentlicht: Den Gläubigern der an der Ausgliederung beteiligten Rechtsträgern  ist, wenn sie binnen sechs Monaten nach dem Tag, an dem die Eintragung der Ausgliederung nach den §§ 125 und 19 Abs. 3UmwG  als bekannt gemacht gilt, ihren Anspruch nach Grund und Höhe schriftlich anmelden, Sicherheit zu leisten, soweit sie nicht Befriedigung verlangen können. Dieses Recht steht den Gläubigern jedoch nur zu, wenn sie glaubhaft machen, dass durch die Ausgliederung die Erfüllung ihrer Forderung gefährdet wird."
    },
    {
      "date": "2025-10-28",
      "id": "135472",
      "original_text": "Registerbekanntmachung nach dem Umwandlungsgesetz\nBaden-Württemberg Amtsgericht Freiburg HRA 700242\nLapp GmbH & Co. KG – Freiburg im Breisgau",
      "type": "Registerbekanntmachung nach dem Umwandlungsgesetz",
      "state": "Baden-Württemberg",
      "amtsgericht": "Amtsgericht Freiburg",
      "registernummer": "HRA 700242",
      "registerart": "HRA",
      "company_name": "Lapp GmbH & Co. KG",
      "company_seat": "Freiburg im Breisgau",
      "details": "28.10.2025 (Bekanntmachungsdatum)\n\nBaden-Württemberg Amtsgericht Freiburg HRA 700242\nRegisterbekanntmachung nach dem Umwandlungsgesetz 28.10.2025 (Eintragungsdatum)\n\nLapp GmbH & Co. KG\nKommanditgesellschaft\nFreiburg im Breisgau\n\nAls nicht eingetragen wird bekanntgemacht:\nDen Gläubigern der an der Verschmelzung beteiligten Rechtsträger ist, wenn sie binnen sechs Monaten nach dem Tag, an dem die Eintragung der Verschmelzung in das Register des Sitzes desjenigen Rechtsträgers, dessen Gläubiger sie sind, nach § 19 Abs. 3 UmwG als bekanntgemacht gilt, ihren Anspruch nach Grund und Höhe schriftlich anmelden, Sicherheit zu leisten, soweit sie nicht Befriedigung verlangen können. Dieses Recht steht den Gläubigern jedoch nur zu, wenn sie glaubhaft machen, dass durch die Verschmelzung die Erfüllung ihrer Forderung gefährdet wird."
    },
    {
      "date": "2025-10-28",
      "id": "135473",
      "original_text": "Löschungsankündigung\nSchleswig-Holstein Amtsgericht Lübeck HRB 15910\nNiko Boisen GmbH – Lauenburg/Elbe",
      "type": "Löschungsankündigung",
      "state": "Schleswig-Holstein",
      "amtsgericht": "Amtsgericht Lübeck",
      "registernummer": "HRB 15910",
      "registerart": "HRB",
      "company_name": "Niko Boisen GmbH",
      "company_seat": "Lauenburg/Elbe",
      "details": "28.10.2025 (Bekanntmachungsdatum)\n\nSchleswig-Holstein Amtsgericht Lübeck HRB 15910\nLöschungsankündigung\n\nNiko Boisen GmbH\nGesellschaft mit beschränkter Haftung\nLauenburg/Elbe\n\nEs ist die Löschung der nachstehenden Gesellschaft wegen Vermögenslosigkeit gemäß § 394 FamFG beabsichtigt."
    },
    {
      "date": "2025-10-28",
      "id": "135474",
      "original_text": "Sonstige Registerbekanntmachung\nBerlin Amtsgericht Berlin (Charlottenburg) HRB 247046\nHAN Investment Holding GmbH – Berlin",
      "type": "Sonstige Registerbekanntmachung",
      "state": "Berlin",
      "amtsgericht": "Amtsgericht Berlin (Charlottenburg)",
      "registernummer": "HRB 247046",
      "registerart": "HRB",
      "company_name": "HAN Investment Holding GmbH",
      "company_seat": "Berlin",
      "details": "28.10.2025 (Bekanntmachungsdatum)\n\nBerlin Amtsgericht Berlin (Charlottenburg) HRB 247046\nSonstige Registerbekanntmachung\n\nHAN Investment Holding GmbH\nGesellschaft mit beschränkter Haftung\nBerlin\n\nAls nicht eingetragen wird veröffentlicht:Es wurde eine neue Liste der Aufsichtsratsmitglieder eingereicht (§52 GmbHG)."
    },
    {
      "date": "2025-10-28",
      "id": "135475",
      "original_text": "Löschungsankündigung\nSaarland Amtsgericht Saarbrücken HRB 104990\nDeutscher Delson Internationaler Handel GmbH – St. Ingbert",
      "type": "Löschungsankündigung",
      "state": "Saarland",
      "amtsgericht": "Amtsgericht Saarbrücken",
      "registernummer": "HRB 104990",
      "registerart": "HRB",
      "company_name": "Deutscher Delson Internationaler Handel GmbH",
      "company_seat": "St. Ingbert",
      "details": "28.10.2025 (Bekanntmachungsdatum)\n\nSaarland Amtsgericht Saarbrücken HRB 104990\nLöschungsankündigung\n\nDeutscher Delson Internationaler Handel GmbH\nGesellschaft mit beschränkter Haftung\nSt. Ingbert\n\nEs ist beabsichtigt, die Gesellschaft von Amts wegen gemäß § 394 FamFG wegen Vermögenslosigkeit zu löschen.\nGegen die Löschung von Amts wegen ist das Rechtsmittel des Widerspruchs statthaft. Der Widerspruch ist binnen einer Frist einem Monat beginnend mit dem Tag dieser Veröffentlichung durch Einreichen eines Widerspruchsschreibens -schriftlich oder zur Niederschrift der Geschäftsstelle beim Amtsgericht Saarbrücken, -zentrales Handelsregister-, Mainzerstr.178, 66121 Saarbrücken einzulegen.\nDer Widerspruch muss die Bezeichnung der angefochtenen Löschungsankündigung enthalten sowie die Erklärung, dass Widerspruch eingelegt wird. Er ist vom Widerspruchsführer oder seinem Bevollmächtigten zu unterzeichnen.\nDas Widerspruchsschreiben kann auch in der Form eines elektronischen Dokumentes eingereicht werden, das mit einer qualifizierten elektronischen Signatur nach dem Signaturgesetz versehen sein muss (§§ 14 Abs. 2 FamFG, 130a, 298 ZPO)."
    },
    {
      "date": "2025-10-28",
      "id": "135476",
      "original_text": "Löschungsankündigung\nBrandenburg Amtsgericht Potsdam HRB 36854\nAM WORXX Spezialbau GmbH – Blankenfelde-Mahlow",
      "type": "Löschungsankündigung",
      "state": "Brandenburg",
      "amtsgericht": "Amtsgericht Potsdam",
      "registernummer": "HRB 36854",
      "registerart": "HRB",
      "company_name": "AM WORXX Spezialbau GmbH",
      "company_seat": "Blankenfelde-Mahlow",
      "details": "28.10.2025 (Bekanntmachungsdatum)\n\nBrandenburg Amtsgericht Potsdam HRB 36854\nLöschungsankündigung\n\nAM WORXX Spezialbau GmbH\nGesellschaft mit beschränkter Haftung\nBlankenfelde-Mahlow\n\nBei der nachstehenden Gesellschaft wird das Amtslöschungsverfahren gemäß § 394 FamFG eingeleitet. Widerspruchsfrist 8 Wochen."
    },
    {
      "date": "2025-10-28",
      "id": "135477",
      "original_text": "Registerbekanntmachung nach dem Umwandlungsgesetz\nBaden-Württemberg Amtsgericht Stuttgart HRB 798334\nG & S Com GmbH – Calw",
      "type": "Registerbekanntmachung nach dem Umwandlungsgesetz",
      "state": "Baden-Württemberg",
      "amtsgericht": "Amtsgericht Stuttgart",
      "registernummer": "HRB 798334",
      "registerart": "HRB",
      "company_name": "G & S Com GmbH",
      "company_seat": "Calw",
      "details": "28.10.2025 (Bekanntmachungsdatum)\n\nBaden-Württemberg Amtsgericht Stuttgart HRB 798334\nRegisterbekanntmachung nach dem Umwandlungsgesetz 28.10.2025 (Eintragungsdatum)\n\nG & S Com GmbH\nGesellschaft mit beschränkter Haftung\nCalw\n\nAls nicht eingetragen wird bekanntgemacht:\nDen Gläubigern der an der Ausgliederung beteiligten Rechtsträger ist, wenn sie binnen sechs Monaten nach dem Tag, an dem die Eintragung der Ausgliederung in das Register des Sitzes desjenigen Rechtsträgers, dessen Gläubiger sie sind, nach § 19 Abs. 3 UmwG als bekanntgemacht gilt, ihren Anspruch nach Grund und Höhe schriftlich anmelden, Sicherheit zu leisten, soweit sie nicht Befriedigung verlangen können. Dieses Recht steht den Gläubigern jedoch nur zu, wenn sie glaubhaft machen, dass durch die Ausgliederung die Erfüllung ihrer Forderung gefährdet wird."
    },
    {
      "date": "2025-10-28",
      "id": "135478",
      "original_text": "Registerbekanntmachung nach dem Umwandlungsgesetz\nBaden-Württemberg Amtsgericht Stuttgart HRB 21035\nStuttgarter Versicherung Aktiengesellschaft – Stuttgart",
      "type": "Registerbekanntmachung nach dem Umwandlungsgesetz",
      "state": "Baden-Württemberg",
      "amtsgericht": "Amtsgericht Stuttgart",
      "registernummer": "HRB 21035",
      "registerart": "HRB",
      "company_name": "Stuttgarter Versicherung Aktiengesellschaft",
      "company_seat": "Stuttgart",
      "details": "28.10.2025 (Bekanntmachungsdatum)\n\nBaden-Württemberg Amtsgericht Stuttgart HRB 21035\nRegisterbekanntmachung nach dem Umwandlungsgesetz 28.10.2025 (Eintragungsdatum)\n\nStuttgarter Versicherung Aktiengesellschaft\nAktiengesellschaft\nStuttgart\n\nAls nicht eingetragen wird bekanntgemacht:\nDen Gläubigern der an der Vermögensübertragung beteiligten Rechtsträger ist, wenn sie binnen sechs Monaten nach dem Tag, an dem die Eintragung der Vermögensübertragung in das Register des Sitzes desjenigen Rechtsträgers, dessen Gläubiger sie sind, nach § 19 Abs. 3 UmwG als bekanntgemacht gilt, ihren Anspruch nach Grund und Höhe schriftlich anmelden, Sicherheit zu leisten, soweit sie nicht Befriedigung verlangen können. Dieses Recht steht den Gläubigern jedoch nur zu, wenn sie glaubhaft machen, dass durch die Vermögensübertragung die Erfüllung ihrer Forderung gefährdet wird."
    },
    {
      "date": "2025-10-28",
      "id": "135479",
      "original_text": "Löschungsankündigung\nSaarland Amtsgericht Saarbrücken HRB 105424\nKeepLocal GmbH – St. Wendel",
      "type": "Löschungsankündigung",
      "state": "Saarland",
      "amtsgericht": "Amtsgericht Saarbrücken",
      "registernummer": "HRB 105424",
      "registerart": "HRB",
      "company_name": "KeepLocal GmbH",
      "company_seat": "St. Wendel",
      "details": "28.10.2025 (Bekanntmachungsdatum)\n\nSaarland Amtsgericht Saarbrücken HRB 105424\nLöschungsankündigung\n\nKeepLocal GmbH\nGesellschaft mit beschränkter Haftung\nSt. Wendel\n\nEs ist beabsichtigt, die Gesellschaft von Amts wegen gemäß § 394 FamFG wegen Vermögenslosigkeit zu löschen.\nGegen die Löschung von Amts wegen ist das Rechtsmittel des Widerspruchs statthaft. Der Widerspruch ist binnen einer Frist von einem Monat, beginnend mit dem Tag dieser Veröffentlichung durch Einreichen eines Widerspruchsschreibens -schriftlich oder zur Niederschrift der Geschäftsstelle beim Amtsgericht Saarbrücken, -zentrales Handelsregister-, Mainzerstr.178, 66121 Saarbrücken einzulegen.\nDer Widerspruch muss die Bezeichnung der angefochtenen Löschungsankündigung enthalten sowie die Erklärung, dass Widerspruch eingelegt wird. Er ist vom Widerspruchsführer oder seinem Bevollmächtigten zu unterzeichnen.\nDas Widerspruchsschreiben kann auch in der Form eines elektronischen Dokumentes eingereicht werden, das mit einer qualifizierten elektronischen Signatur nach dem Signaturgesetz versehen sein muss (§§ 14 Abs. 2 FamFG, 130a, 298 ZPO)."
    },
    {
      "date": "2025-10-28",
      "id": "135480",
      "original_text": "Registerbekanntmachung nach dem Umwandlungsgesetz\nBerlin Amtsgericht Berlin (Charlottenburg) HRB 201110\nRAW Value 2 GmbH – Berlin",
      "type": "Registerbekanntmachung nach dem Umwandlungsgesetz",
      "state": "Berlin",
      "amtsgericht": "Amtsgericht Berlin (Charlottenburg)",
      "registernummer": "HRB 201110",
      "registerart": "HRB",
      "company_name": "RAW Value 2 GmbH",
      "company_seat": "Berlin",
      "details": "28.10.2025 (Bekanntmachungsdatum)\n\nBerlin Amtsgericht Berlin (Charlottenburg) HRB 201110\nRegisterbekanntmachung nach dem Umwandlungsgesetz 27.10.2025 (Eintragungsdatum)\n\nRAW Value 2 GmbH\nGesellschaft mit beschränkter Haftung\nBerlin\n\nZu Eintragungsnummer 7 vom 27.10.2025 wird als nicht eingetragen veröffentlicht: Den Gläubigern der an der Verschmelzung beteiligten Rechtsträger ist, wenn sie binnen sechs Monaten nach dem Tag, an dem die Eintragung der Verschmelzung in das Register des Sitzes desjenigen Rechtsträgers, dessen Gläubiger sie sind, als bekannt gemacht gilt, ihren Anspruch nach Grund und Höhe schriftlich anmelden, Sicherheit zu leisten, soweit sie nicht Befriedigung verlangen können. Dieses Recht steht den Gläubigern jedoch nur zu, wenn sie glaubhaft machen, dass durch die Verschmelzung die Erfüllung ihrer Forderung gefährdet wird. Das Recht, Sicherheitsleistung zu verlangen, steht Gläubigern nicht zu, die im Falle der Insolvenz ein Recht auf vorzugsweise Befriedigung aus einer Deckungsmasse haben, die nach gesetzlicher Vorschrift zu ihrem Schutz errichtet und staatlich überwacht ist."
    },
    {
      "date": "2025-10-28",
      "id": "135481",
      "original_text": "Registerbekanntmachung nach dem Umwandlungsgesetz\nHamburg Amtsgericht Hamburg HRA 132403\nKarina Spiess e.K. – Hamburg",
      "type": "Registerbekanntmachung nach dem Umwandlungsgesetz",
      "state": "Hamburg",
      "amtsgericht": "Amtsgericht Hamburg",
      "registernummer": "HRA 132403",
      "registerart": "HRA",
      "company_name": "Karina Spiess e.K.",
      "company_seat": "Hamburg",
      "details": "28.10.2025 (Bekanntmachungsdatum)\n\nHamburg Amtsgericht Hamburg HRA 132403\nRegisterbekanntmachung nach dem Umwandlungsgesetz 28.10.2025 (Eintragungsdatum)\n\nKarina Spiess e.K.\nEinzelkaufmann\nHamburg\n\nAls nicht eingetragen wird bekannt gemacht:\nDen Gläubigern der an der Ausgliederung beteiligten Gesellschaften ist, wenn sie binnen sechs Monaten nach dem Tag, an dem die Eintragung der Ausgliederung in das Register des Sitzes desjenigen Rechtsträgers, dessen Gläubiger sie sind, nach § 19 Absatz 3 UmwG als bekannt gemacht gilt, ihren Anspruch nach Grund und Höhe schriftlich anmelden, Sicherheit zu leisten, soweit sie nicht Befriedigung verlangen können. Dieses Recht steht den Gläubigern jedoch nur zu, wenn sie glaubhaft machen, dass durch die Ausgliederung die Erfüllung ihrer Forderung gefährdet wird."
    },
    {
      "date": "2025-10-28",
      "id": "135482",
      "original_text": "Registerbekanntmachung nach dem Umwandlungsgesetz\nBaden-Württemberg Amtsgericht Stuttgart HRB 800753\nKreaVans GmbH – Weissach im Tal",
      "type": "Registerbekanntmachung nach dem Umwandlungsgesetz",
      "state": "Baden-Württemberg",
      "amtsgericht": "Amtsgericht Stuttgart",
      "registernummer": "HRB 800753",
      "registerart": "HRB",
      "company_name": "KreaVans GmbH",
      "company_seat": "Weissach im Tal",
      "details": "28.10.2025 (Bekanntmachungsdatum)\n\nBaden-Württemberg Amtsgericht Stuttgart HRB 800753\nRegisterbekanntmachung nach dem Umwandlungsgesetz 28.10.2025 (Eintragungsdatum)\n\nKreaVans GmbH\nGesellschaft mit beschränkter Haftung\nWeissach im Tal\n\nDen Gläubigern der an der Abspaltung beteiligten Rechtsträger ist, wenn sie binnen sechs Monaten nach dem Tag, an dem die Eintragung der Abspaltung in das Register des Sitzes desjenigen Rechtsträgers, dessen Gläubiger sie sind, nach § 19 Abs. 3 UmwG als bekanntgemacht gilt, ihren Anspruch nach Grund und Höhe schriftlich anmelden, Sicherheit zu leisten, soweit sie nicht Befriedigung verlangen können. Dieses Recht steht den Gläubigern jedoch nur zu, wenn sie glaubhaft machen, dass durch die Abspaltung die Erfüllung ihrer Forderung gefährdet wird."
    },
    {
      "date": "2025-10-28",
      "id": "135483",
      "original_text": "Registerbekanntmachung nach dem Umwandlungsgesetz\nBerlin Amtsgericht Berlin (Charlottenburg) HRB 125895\nO-Quartier Projektgesellschaft mbH – Berlin",
      "type": "Registerbekanntmachung nach dem Umwandlungsgesetz",
      "state": "Berlin",
      "amtsgericht": "Amtsgericht Berlin (Charlottenburg)",
      "registernummer": "HRB 125895",
      "registerart": "HRB",
      "company_name": "O-Quartier Projektgesellschaft mbH",
      "company_seat": "Berlin",
      "details": "28.10.2025 (Bekanntmachungsdatum)\n\nBerlin Amtsgericht Berlin (Charlottenburg) HRB 125895\nRegisterbekanntmachung nach dem Umwandlungsgesetz 27.10.2025 (Eintragungsdatum)\n\nO-Quartier Projektgesellschaft mbH\nGesellschaft mit beschränkter Haftung\nBerlin\n\nZu Eintragungsnummer 12 vom 27.10.2025 wird als nicht eingetragen veröffentlicht: Den Gläubigern der an der Verschmelzung beteiligten Rechtsträger ist, wenn sie binnen sechs Monaten nach dem Tag, an dem die Eintragung der Verschmelzung in das Register des Sitzes desjenigen Rechtsträgers, dessen Gläubiger sie sind, als bekannt gemacht gilt, ihren Anspruch nach Grund und Höhe schriftlich anmelden, Sicherheit zu leisten, soweit sie nicht Befriedigung verlangen können. Dieses Recht steht den Gläubigern jedoch nur zu, wenn sie glaubhaft machen, dass durch die Verschmelzung die Erfüllung ihrer Forderung gefährdet wird. Das Recht, Sicherheitsleistung zu verlangen, steht Gläubigern nicht zu, die im Falle der Insolvenz ein Recht auf vorzugsweise Befriedigung aus einer Deckungsmasse haben, die nach gesetzlicher Vorschrift zu ihrem Schutz errichtet und staatlich überwacht ist."
    },
    {
      "date": "2025-10-28",
      "id": "135484",
      "original_text": "Einreichung neuer Dokumente\nBerlin Amtsgericht Berlin (Charlottenburg) HRB 68890\nDeutsche Grundstücksauktionen AG vormals Berliner Grundstücksauktionen – Berlin",
      "type": "Einreichung neuer Dokumente",
      "state": "Berlin",
      "amtsgericht": "Amtsgericht Berlin (Charlottenburg)",
      "registernummer": "HRB 68890",
      "registerart": "HRB",
      "company_name": "Deutsche Grundstücksauktionen AG vormals Berliner Grundstücksauktionen",
      "company_seat": "Berlin",
      "details": "28.10.2025 (Bekanntmachungsdatum)\n\nBerlin Amtsgericht Berlin (Charlottenburg) HRB 68890\nEinreichung neuer Dokumente\n\nDeutsche Grundstücksauktionen AG vormals Berliner Grundstücksauktionen\nAktiengesellschaft\nBerlin\n\nAls nicht eingetragen wird veröffentlicht: Es wurde eine neue Liste der Aufsichtsratsmitglieder eingereicht (§ 106 AktG)."
    },
    {
      "date": "2025-10-28",
      "id": "135485",
      "original_text": "Registerbekanntmachung nach dem Umwandlungsgesetz\nBrandenburg Amtsgericht Cottbus HRB 15503\nVEM Filia GmbH – Schönefeld",
      "type": "Registerbekanntmachung nach dem Umwandlungsgesetz",
      "state": "Brandenburg",
      "amtsgericht": "Amtsgericht Cottbus",
      "registernummer": "HRB 15503",
      "registerart": "HRB",
      "company_name": "VEM Filia GmbH",
      "company_seat": "Schönefeld",
      "details": "28.10.2025 (Bekanntmachungsdatum)\n\nBrandenburg Amtsgericht Cottbus HRB 15503\nRegisterbekanntmachung nach dem Umwandlungsgesetz 28.10.2025 (Eintragungsdatum)\n\nVEM Filia GmbH\nGesellschaft mit beschränkter Haftung\nSchönefeld\n\nZu Eintragungsnummer 9 vom 28.10.2025 wird als nicht eingetragen veröffentlicht:\nDen Gläubigern der an der Verschmelzung beteiligten Rechtsträger ist, wenn sie binnen sechs Monaten nach dem Tag, an dem die Eintragung der Verschmelzung in das Register des Sitzes desjenigen Rechtsträgers, dessen Gläubiger sie sind, als bekannt gemacht gilt, ihren Anspruch nach Grund und Höhe schriftlich anmelden, Sicherheit zu leisten, soweit sie nicht Befriedigung verlangen können. Dieses Recht steht den Gläubigern jedoch nur zu, wenn sie glaubhaft machen, dass durch die Verschmelzung die Erfüllung ihrer Forderung gefährdet wird."
    },
    {
      "date": "2025-10-28",
      "id": "135486",
      "original_text": "Löschungsankündigung\nSchleswig-Holstein Amtsgericht Flensburg HRB 14854\nGGM Logistik GmbH – Harrislee",
      "type": "Löschungsankündigung",
      "state": "Schleswig-Holstein",
      "amtsgericht": "Amtsgericht Flensburg",
      "registernummer": "HRB 14854",
      "registerart": "HRB",
      "company_name": "GGM Logistik GmbH",
      "company_seat": "Harrislee",
      "details": "28.10.2025 (Bekanntmachungsdatum)\n\nSchleswig-Holstein Amtsgericht Flensburg HRB 14854\nLöschungsankündigung\n\nGGM Logistik GmbH\nGesellschaft mit beschränkter Haftung\nHarrislee\n\nEs ist die Löschung der nachstehenden Gesellschaft wegen Vermögenslosigkeit gemäß § 394 FamFG beabsichtigt.\nWiderspruchsfrist: 2 Monate"
    },
    {
      "date": "2025-10-28",
      "id": "135487",
      "original_text": "Registerbekanntmachung nach dem Umwandlungsgesetz\nBrandenburg Amtsgericht Cottbus HRB 15503\nVEM Filia GmbH – Schönefeld",
      "type": "Registerbekanntmachung nach dem Umwandlungsgesetz",
      "state": "Brandenburg",
      "amtsgericht": "Amtsgericht Cottbus",
      "registernummer": "HRB 15503",
      "registerart": "HRB",
      "company_name": "VEM Filia GmbH",
      "company_seat": "Schönefeld",
      "details": "28.10.2025 (Bekanntmachungsdatum)\n\nBrandenburg Amtsgericht Cottbus HRB 15503\nRegisterbekanntmachung nach dem Umwandlungsgesetz 28.10.2025 (Eintragungsdatum)\n\nVEM Filia GmbH\nGesellschaft mit beschränkter Haftung\nSchönefeld\n\nZu Eintragungsnummer 9 vom 28.10.2025 wird als nicht eingetragen veröffentlicht:\nDen Gläubigern der an der Verschmelzung beteiligten Rechtsträger ist, wenn sie binnen sechs Monaten nach dem Tag, an dem die Eintragung der Verschmelzung in das Register des Sitzes desjenigen Rechtsträgers, dessen Gläubiger sie sind, als bekannt gemacht gilt, ihren Anspruch nach Grund und Höhe schriftlich anmelden, Sicherheit zu leisten, soweit sie nicht Befriedigung verlangen können. Dieses Recht steht den Gläubigern jedoch nur zu, wenn sie glaubhaft machen, dass durch die Verschmelzung die Erfüllung ihrer Forderung gefährdet wird."
    },
    {
      "date": "2025-10-28",
      "id": "135488",
      "original_text": "Registerbekanntmachung nach dem Umwandlungsgesetz\nBaden-Württemberg Amtsgericht Stuttgart HRA 742110\nLidl 434 GmbH & Co. KG – Bad Wimpfen",
      "type": "Registerbekanntmachung nach dem Umwandlungsgesetz",
      "state": "Baden-Württemberg",
      "amtsgericht": "Amtsgericht Stuttgart",
      "registernummer": "HRA 742110",
      "registerart": "HRA",
      "company_name": "Lidl 434 GmbH & Co. KG",
      "company_seat": "Bad Wimpfen",
      "details": "28.10.2025 (Bekanntmachungsdatum)\n\nBaden-Württemberg Amtsgericht Stuttgart HRA 742110\nRegisterbekanntmachung nach dem Umwandlungsgesetz 28.10.2025 (Eintragungsdatum)\n\nLidl 434 GmbH & Co. KG\nKommanditgesellschaft\nBad Wimpfen\n\nDen Gläubigern der an der Ausgliederung beteiligten Rechtsträger ist, wenn sie binnen sechs Monaten nach dem Tag, an dem die Eintragung der Ausgliederung in das Register des Sitzes desjenigen Rechtsträgers, dessen Gläubiger sie sind, nach § 19 Abs. 3 UmwG als bekanntgemacht gilt, ihren Anspruch nach Grund und Höhe schriftlich anmelden, Sicherheit zu leisten, soweit sie nicht Befriedigung verlangen können. Dieses Recht steht den Gläubigern jedoch nur zu, wenn sie glaubhaft machen, dass durch die Ausgliederung die Erfüllung ihrer Forderung gefährdet wird."
    },
    {
      "date": "2025-10-28",
      "id": "135489",
      "original_text": "Registerbekanntmachung nach dem Umwandlungsgesetz\nBaden-Württemberg Amtsgericht Mannheim HRB 735518\ncf Fitness Mannheim Neckarau GmbH – Mannheim",
      "type": "Registerbekanntmachung nach dem Umwandlungsgesetz",
      "state": "Baden-Württemberg",
      "amtsgericht": "Amtsgericht Mannheim",
      "registernummer": "HRB 735518",
      "registerart": "HRB",
      "company_name": "cf Fitness Mannheim Neckarau GmbH",
      "company_seat": "Mannheim",
      "details": "28.10.2025 (Bekanntmachungsdatum)\n\nBaden-Württemberg Amtsgericht Mannheim HRB 735518\nRegisterbekanntmachung nach dem Umwandlungsgesetz 28.10.2025 (Eintragungsdatum)\n\ncf Fitness Mannheim Neckarau GmbH\nGesellschaft mit beschränkter Haftung\nMannheim\n\nDen Gläubigern der an der Verschmelzung beteiligten Rechtsträger ist, wenn sie binnen sechs Monaten nach dem Tag, an dem die Eintragung der Verschmelzung in das Register des Sitzes desjenigen Rechtsträgers, dessen Gläubiger sie sind, nach § 19 Abs. 3 UmwG als bekanntgemacht gilt, ihren Anspruch nach Grund und Höhe schriftlich anmelden, Sicherheit zu leisten, soweit sie nicht Befriedigung verlangen können. Dieses Recht steht den Gläubigern jedoch nur zu, wenn sie glaubhaft machen, dass durch die Verschmelzung die Erfüllung ihrer Forderung gefährdet wird."
    },
    {
      "date": "2025-10-28",
      "id": "135490",
      "original_text": "Löschungsankündigung\nBerlin Amtsgericht Berlin (Charlottenburg) HRB 155721\nPVBI Property Value GmbH – Berlin",
      "type": "Löschungsankündigung",
      "state": "Berlin",
      "amtsgericht": "Amtsgericht Berlin (Charlottenburg)",
      "registernummer": "HRB 155721",
      "registerart": "HRB",
      "company_name": "PVBI Property Value GmbH",
      "company_seat": "Berlin",
      "details": "28.10.2025 (Bekanntmachungsdatum)\n\nBerlin Amtsgericht Berlin (Charlottenburg) HRB 155721\nLöschungsankündigung\n\nPVBI Property Value GmbH\nGesellschaft mit beschränkter Haftung\nBerlin\n\nBei der nachstehenden Gesellschaft wird das Amtslöschungsverfahren gemäß § 394 FamFG eingeleitet. Widerspruchsfrist 6 Wochen"
    },
    {
      "date": "2025-10-28",
      "id": "135491",
      "original_text": "Einreichung neuer Dokumente\nSchleswig-Holstein Amtsgericht Lübeck HRB 5787\nSparkasse zu Lübeck Aktiengesellschaft – Lübeck",
      "type": "Einreichung neuer Dokumente",
      "state": "Schleswig-Holstein",
      "amtsgericht": "Amtsgericht Lübeck",
      "registernummer": "HRB 5787",
      "registerart": "HRB",
      "company_name": "Sparkasse zu Lübeck Aktiengesellschaft",
      "company_seat": "Lübeck",
      "details": "28.10.2025 (Bekanntmachungsdatum)\n\nSchleswig-Holstein Amtsgericht Lübeck HRB 5787\nEinreichung neuer Dokumente\n\nSparkasse zu Lübeck Aktiengesellschaft\nAktiengesellschaft\nLübeck\n\nAls nicht eingetragen wird veröffentlicht:\nEs wurde eine neue Lister der Aufsichtsräte eingereicht."
    },
    {
      "date": "2025-10-28",
      "id": "135492",
      "original_text": "Registerbekanntmachung nach dem Umwandlungsgesetz\nThüringen Amtsgericht Jena HRA 504800\nAutohof Dienstedt Inhaber Andreas Keip e.K. – Stadtilm",
      "type": "Registerbekanntmachung nach dem Umwandlungsgesetz",
      "state": "Thüringen",
      "amtsgericht": "Amtsgericht Jena",
      "registernummer": "HRA 504800",
      "registerart": "HRA",
      "company_name": "Autohof Dienstedt Inhaber Andreas Keip e.K.",
      "company_seat": "Stadtilm",
      "details": "28.10.2025 (Bekanntmachungsdatum)\n\nThüringen Amtsgericht Jena HRA 504800\nRegisterbekanntmachung nach dem Umwandlungsgesetz 28.10.2025 (Eintragungsdatum)\n\nAutohof Dienstedt Inhaber Andreas Keip e.K.\nEinzelkaufmann / Einzelkauffrau\nStadtilm\n\nNicht eingetragen: Den Gläubigern der an der Ausgliederung beteiligten Rechtsträger, ist wenn sie binnen sechs Monaten nach dem Tag, an dem die Eintragung der Ausgliederung in das Register des Sitzes desjenigen Rechtsträgers, dessen Gläubiger sie sind, nach §§125, 19 Abs. 3 UmwG als bekanntgemacht gilt, ihren Anspruch nach Grund und Höhe schriftlich anmelden, Sicherheit zu leisten, soweit sie nicht Befriedigung verlangen können. Dieses Recht steht ihnen jedoch nur zu, wenn sie glaubhaft machen, daß durch die Ausgliederung die Erfüllung ihrer Forderung gefährdet wird."
    },
    {
      "date": "2025-10-28",
      "id": "135493",
      "original_text": "Löschungsankündigung\nBaden-Württemberg Amtsgericht Freiburg HRB 717978\nC.A.M. GmbH – Konstanz",
      "type": "Löschungsankündigung",
      "state": "Baden-Württemberg",
      "amtsgericht": "Amtsgericht Freiburg",
      "registernummer": "HRB 717978",
      "registerart": "HRB",
      "company_name": "C.A.M. GmbH",
      "company_seat": "Konstanz",
      "details": "28.10.2025 (Bekanntmachungsdatum)\n\nBaden-Württemberg Amtsgericht Freiburg HRB 717978\nLöschungsankündigung\n\nC.A.M. GmbH\nGesellschaft mit beschränkter Haftung\nKonstanz\n\nAls nicht eingetragen wird bekanntgemacht:\nDas Gericht beabsichtigt, die Gesellschaft wegen Vermögenslosigkeit im Handelsregister von Amts wegen nach § 394 FamFG zu löschen. Die Frist zur Geltendmachung eines Widerspruchs gegen die beabsichtigte Löschung ist auf einen Monat ab Veröffentlichung bestimmt."
    },
    {
      "date": "2025-10-28",
      "id": "135494",
      "original_text": "Registerbekanntmachung nach dem Umwandlungsgesetz\nThüringen Amtsgericht Jena HRA 507160\nZebresel e. K. Inh. Kristof Friess – Erfurt",
      "type": "Registerbekanntmachung nach dem Umwandlungsgesetz",
      "state": "Thüringen",
      "amtsgericht": "Amtsgericht Jena",
      "registernummer": "HRA 507160",
      "registerart": "HRA",
      "company_name": "Zebresel e. K. Inh. Kristof Friess",
      "company_seat": "Erfurt",
      "details": "28.10.2025 (Bekanntmachungsdatum)\n\nThüringen Amtsgericht Jena HRA 507160\nRegisterbekanntmachung nach dem Umwandlungsgesetz 28.10.2025 (Eintragungsdatum)\n\nZebresel e. K. Inh. Kristof Friess\nEinzelkaufmann / Einzelkauffrau\nErfurt\n\nNicht eingetragen: Den Gläubigern der an der Ausgliederung beteiligten Rechtsträger, ist wenn sie binnen sechs Monaten nach dem Tag, an dem die Eintragung der Ausgliederung in das Register des Sitzes desjenigen Rechtsträgers, dessen Gläubiger sie sind, nach §§125, 19 Abs. 3 UmwG als bekanntgemacht gilt, ihren Anspruch nach Grund und Höhe schriftlich anmelden, Sicherheit zu leisten, soweit sie nicht Befriedigung verlangen können. Dieses Recht steht ihnen jedoch nur zu, wenn sie glaubhaft machen, daß durch die Ausgliederung die Erfüllung ihrer Forderung gefährdet wird."
    },
    {
      "date": "2025-10-28",
      "id": "135495",
      "original_text": "Registerbekanntmachung nach dem Umwandlungsgesetz\nThüringen Amtsgericht Jena HRB 520714\nBREMER Ost GmbH – Erfurt",
      "type": "Registerbekanntmachung nach dem Umwandlungsgesetz",
      "state": "Thüringen",
      "amtsgericht": "Amtsgericht Jena",
      "registernummer": "HRB 520714",
      "registerart": "HRB",
      "company_name": "BREMER Ost GmbH",
      "company_seat": "Erfurt",
      "details": "28.10.2025 (Bekanntmachungsdatum)\n\nThüringen Amtsgericht Jena HRB 520714\nRegisterbekanntmachung nach dem Umwandlungsgesetz 28.10.2025 (Eintragungsdatum)\n\nBREMER Ost GmbH\nGesellschaft mit beschränkter Haftung\nErfurt\n\nNicht eingetragen: Den Gläubigern der an der Verschmelzung beteiligten Rechtsträger, ist wenn sie binnen sechs Monaten nach dem Tag, an dem die Eintragung der Verschmelzung in das Register des Sitzes desjenigen Rechtsträgers, dessen Gläubiger sie sind,  nach § 19 Abs. 3 UmwG als bekanntgemacht gilt, ihren Anspruch nach Grund und Höhe schriftlich anmelden, Sicherheit zu leisten, soweit sie nicht Befriedigung verlangen können. Dieses Recht steht ihnen jedoch nur zu, wenn sie glaubhaft machen, daß durch die Verschmelzung die Erfüllung ihrer Forderung gefährdet wird."
    },
    {
      "date": "2025-10-28",
      "id": "135496",
      "original_text": "Registerbekanntmachung nach dem Umwandlungsgesetz\nBrandenburg Amtsgericht Cottbus HRB 19170\nHagewald Bau GmbH – Schönefeld",
      "type": "Registerbekanntmachung nach dem Umwandlungsgesetz",
      "state": "Brandenburg",
      "amtsgericht": "Amtsgericht Cottbus",
      "registernummer": "HRB 19170",
      "registerart": "HRB",
      "company_name": "Hagewald Bau GmbH",
      "company_seat": "Schönefeld",
      "details": "28.10.2025 (Bekanntmachungsdatum)\n\nBrandenburg Amtsgericht Cottbus HRB 19170\nRegisterbekanntmachung nach dem Umwandlungsgesetz 28.10.2025 (Eintragungsdatum)\n\nHagewald Bau GmbH\nGesellschaft mit beschränkter Haftung\nSchönefeld\n\nZu Eintragungsnummer 1 vom 28.10.2025 wird als nicht eingetragen veröffentlicht:\nDen Gläubigern die an der Übertragung der beteiligten Rechtsträger ist, wenn sie binnen sechs Monaten nach dem Tag, an dem die Eintragung der Übertragung in das Register des Sitzes desjenigen Rechtsträgers, dessen Gläubiger sie sind, als bekannt gemacht gilt, ihren Anspruch nach Grund und Höhe schriftlich anmelden, Sicherheit zu leisten, soweit sie nicht Befriedigung verlangen können. Dieses Recht steht den Gläubigern jedoch nur zu, wenn sie glaubhaft machen, dass durch die Übertagung die Erfüllung ihrer Forderung gefährdet wird."
    },
    {
      "date": "2025-10-28",
      "id": "135497",
      "original_text": "Sonstige Registerbekanntmachung\nHamburg Amtsgericht Hamburg HRB 111718\nGENTUM Immobilien Kapitalverwaltungsgesellschaft mbH – Hamburg",
      "type": "Sonstige Registerbekanntmachung",
      "state": "Hamburg",
      "amtsgericht": "Amtsgericht Hamburg",
      "registernummer": "HRB 111718",
      "registerart": "HRB",
      "company_name": "GENTUM Immobilien Kapitalverwaltungsgesellschaft mbH",
      "company_seat": "Hamburg",
      "details": "28.10.2025 (Bekanntmachungsdatum)\n\nHamburg Amtsgericht Hamburg HRB 111718\nSonstige Registerbekanntmachung\n\nGENTUM Immobilien Kapitalverwaltungsgesellschaft mbH\nGesellschaft mit beschränkter Haftung\nHamburg\n\nAls nicht eingetragen wird bekannt gemacht: Liste des Aufsichtsrats wurde eingereicht."
    },
    {
      "date": "2025-10-28",
      "id": "135498",
      "original_text": "Registerbekanntmachung nach dem Umwandlungsgesetz\nSchleswig-Holstein Amtsgericht Lübeck VR 423 SB\nVolkshochschule Lauenburg/Elbe e.V. – Lauenburg/Elbe",
      "type": "Registerbekanntmachung nach dem Umwandlungsgesetz",
      "state": "Schleswig-Holstein",
      "amtsgericht": "Amtsgericht Lübeck",
      "registernummer": "VR 423 SB",
      "registerart": "VR",
      "company_name": "Volkshochschule Lauenburg/Elbe e.V.",
      "company_seat": "Lauenburg/Elbe",
      "details": "28.10.2025 (Bekanntmachungsdatum)\n\nSchleswig-Holstein Amtsgericht Lübeck VR 423 SB\nRegisterbekanntmachung nach dem Umwandlungsgesetz 27.10.2025 (Eintragungsdatum)\n\nVolkshochschule Lauenburg/Elbe e.V.\neingetragener Verein\nLauenburg/Elbe\n\nZu Eintragungsnummer 5 vom 27.10.2025 wird als nicht eingetragen veröffentlicht: Den Gläubigern der an der Verschmelzung beteiligten Rechtsträger ist, wenn sie binnen sechs Monaten nach dem Tag, an dem die Eintragung der Verschmelzung in das Register des Sitzes desjenigen Rechtsträgers, dessen Gläubiger sie sind, als bekannt gemacht gilt, ihren Anspruch nach Grund und Höhe schriftlich anmelden, Sicherheit zu leisten, soweit sie nicht Befriedigung verlangen können. Dieses Recht steht den Gläubigern jedoch nur zu, wenn sie glaubhaft machen, dass durch die Verschmelzung die Erfüllung ihrer Forderung gefährdet wird."
    },
    {
      "date": "2025-10-28",
      "id": "135499",
      "original_text": "Registerbekanntmachung nach dem Umwandlungsgesetz\nBaden-Württemberg Amtsgericht Stuttgart HRB 800622\nGauger Bestattungen GmbH – Löchgau",
      "type": "Registerbekanntmachung nach dem Umwandlungsgesetz",
      "state": "Baden-Württemberg",
      "amtsgericht": "Amtsgericht Stuttgart",
      "registernummer": "HRB 800622",
      "registerart": "HRB",
      "company_name": "Gauger Bestattungen GmbH",
      "company_seat": "Löchgau",
      "details": "28.10.2025 (Bekanntmachungsdatum)\n\nBaden-Württemberg Amtsgericht Stuttgart HRB 800622\nRegisterbekanntmachung nach dem Umwandlungsgesetz 28.10.2025 (Eintragungsdatum)\n\nGauger Bestattungen GmbH\nGesellschaft mit beschränkter Haftung\nLöchgau\n\nAls nicht eingetragen wird bekanntgemacht:\nDen Gläubigern der an der Ausgliederung beteiligten Rechtsträger ist, wenn sie binnen sechs Monaten nach dem Tag, an dem die Eintragung der Ausgliederung in das Register des Sitzes desjenigen Rechtsträgers, dessen Gläubiger sie sind, nach § 19 Abs. 3 UmwG als bekanntgemacht gilt, ihren Anspruch nach Grund und Höhe schriftlich anmelden, Sicherheit zu leisten, soweit sie nicht Befriedigung verlangen können. Dieses Recht steht den Gläubigern jedoch nur zu, wenn sie glaubhaft machen, dass durch die Ausgliederung die Erfüllung ihrer Forderung gefährdet wird."
    },
    {
      "date": "2025-10-28",
      "id": "135500",
      "original_text": "Löschungsankündigung\nBaden-Württemberg Amtsgericht Mannheim HRB 714308\nVitas GmbH – Bruchsal",
      "type": "Löschungsankündigung",
      "state": "Baden-Württemberg",
      "amtsgericht": "Amtsgericht Mannheim",
      "registernummer": "HRB 714308",
      "registerart": "HRB",
      "company_name": "Vitas GmbH",
      "company_seat": "Bruchsal",
      "details": "28.10.2025 (Bekanntmachungsdatum)\n\nBaden-Württemberg Amtsgericht Mannheim HRB 714308\nLöschungsankündigung\n\nVitas GmbH\nGesellschaft mit beschränkter Haftung\nBruchsal\n\nDas Gericht beabsichtigt, die Gesellschaft wegen Vermögenslosigkeit im Handelsregister von Amts wegen nach § 394 FamFG zu löschen. Die Frist zur Geltendmachung eines Widerspruchs gegen die beabsichtigte Löschung ist auf einen Monat ab Veröffentlichung bestimmt."
    },
    {
      "date": "2025-10-28",
      "id": "135501",
      "original_text": "Registerbekanntmachung nach dem Umwandlungsgesetz\nHamburg Amtsgericht Hamburg HRB 168253\nHausVorteil Service GmbH – Hamburg",
      "type": "Registerbekanntmachung nach dem Umwandlungsgesetz",
      "state": "Hamburg",
      "amtsgericht": "Amtsgericht Hamburg",
      "registernummer": "HRB 168253",
      "registerart": "HRB",
      "company_name": "HausVorteil Service GmbH",
      "company_seat": "Hamburg",
      "details": "28.10.2025 (Bekanntmachungsdatum)\n\nHamburg Amtsgericht Hamburg HRB 168253\nRegisterbekanntmachung nach dem Umwandlungsgesetz 28.10.2025 (Eintragungsdatum)\n\nHausVorteil Service GmbH\nGesellschaft mit beschränkter Haftung\nHamburg\n\nAls nicht eingetragen wird bekannt gemacht:\nDen Gläubigern der an der Verschmelzung beteiligten Gesellschaften ist, wenn sie binnen sechs Monaten nach dem Tag, an dem die Eintragung der Verschmelzung in das Register des Sitzes desjenigen Rechtsträgers, dessen Gläubiger sie sind, nach § 19 Absatz 3 UmwG als bekannt gemacht gilt, ihren Anspruch nach Grund und Höhe schriftlich anmelden, Sicherheit zu leisten, soweit sie nicht Befriedigung verlangen können. Dieses Recht steht den Gläubigern jedoch nur zu, wenn sie glaubhaft machen, dass durch die Verschmelzung die Erfüllung ihrer Forderung gefährdet wird."
    },
    {
      "date": "2025-10-28",
      "id": "135502",
      "original_text": "Löschungsankündigung\nBerlin Amtsgericht Berlin (Charlottenburg) HRB 267220\nT-Cars Avenue GmbH – Berlin",
      "type": "Löschungsankündigung",
      "state": "Berlin",
      "amtsgericht": "Amtsgericht Berlin (Charlottenburg)",
      "registernummer": "HRB 267220",
      "registerart": "HRB",
      "company_name": "T-Cars Avenue GmbH",
      "company_seat": "Berlin",
      "details": "28.10.2025 (Bekanntmachungsdatum)\n\nBerlin Amtsgericht Berlin (Charlottenburg) HRB 267220\nLöschungsankündigung\n\nT-Cars Avenue GmbH\nGesellschaft mit beschränkter Haftung\nBerlin\n\nBei der nachstehenden Gesellschaft wird das Amtslöschungsverfahren gemäß § 394 FamFG eingeleitet. Widerspruchsfrist: 6 Wochen."
    },
    {
      "date": "2025-10-28",
      "id": "135503",
      "original_text": "Registerbekanntmachung nach dem Umwandlungsgesetz\nHamburg Amtsgericht Hamburg HRB 192210\nHausVorteil AG – Hamburg",
      "type": "Registerbekanntmachung nach dem Umwandlungsgesetz",
      "state": "Hamburg",
      "amtsgericht": "Amtsgericht Hamburg",
      "registernummer": "HRB 192210",
      "registerart": "HRB",
      "company_name": "HausVorteil AG",
      "company_seat": "Hamburg",
      "details": "28.10.2025 (Bekanntmachungsdatum)\n\nHamburg Amtsgericht Hamburg HRB 192210\nRegisterbekanntmachung nach dem Umwandlungsgesetz 28.10.2025 (Eintragungsdatum)\n\nHausVorteil AG\nAktiengesellschaft\nHamburg\n\nAls nicht eingetragen wird bekannt gemacht:\nDen Gläubigern der an der Verschmelzung beteiligten Gesellschaften ist, wenn sie binnen sechs Monaten nach dem Tag, an dem die Eintragung der Verschmelzung in das Register des Sitzes desjenigen Rechtsträgers, dessen Gläubiger sie sind, nach § 19 Absatz 3 UmwG als bekannt gemacht gilt, ihren Anspruch nach Grund und Höhe schriftlich anmelden, Sicherheit zu leisten, soweit sie nicht Befriedigung verlangen können. Dieses Recht steht den Gläubigern jedoch nur zu, wenn sie glaubhaft machen, dass durch die Verschmelzung die Erfüllung ihrer Forderung gefährdet wird."
    },
    {
      "date": "2025-10-28",
      "id": "135504",
      "original_text": "Löschungsankündigung\nBerlin Amtsgericht Berlin (Charlottenburg) HRB 164393\nSTAR FRUCHTEN GmbH – Berlin",
      "type": "Löschungsankündigung",
      "state": "Berlin",
      "amtsgericht": "Amtsgericht Berlin (Charlottenburg)",
      "registernummer": "HRB 164393",
      "registerart": "HRB",
      "company_name": "STAR FRUCHTEN GmbH",
      "company_seat": "Berlin",
      "details": "28.10.2025 (Bekanntmachungsdatum)\n\nBerlin Amtsgericht Berlin (Charlottenburg) HRB 164393\nLöschungsankündigung\n\nSTAR FRUCHTEN GmbH\nGesellschaft mit beschränkter Haftung\nBerlin\n\nBei der nachstehenden Gesellschaft wird das Amtslöschungsverfahren gemäß § 394 FamFG eingeleitet. Widerspruchsfrist 6 Wochen"
    },
    {
      "date": "2025-10-28",
      "id": "135505",
      "original_text": "Einreichung neuer Dokumente\nBerlin Amtsgericht Berlin (Charlottenburg) HRB 161327\nKreuzberger Kinderstiftung gemeinnützige Aktiengesellschaft – Berlin",
      "type": "Einreichung neuer Dokumente",
      "state": "Berlin",
      "amtsgericht": "Amtsgericht Berlin (Charlottenburg)",
      "registernummer": "HRB 161327",
      "registerart": "HRB",
      "company_name": "Kreuzberger Kinderstiftung gemeinnützige Aktiengesellschaft",
      "company_seat": "Berlin",
      "details": "28.10.2025 (Bekanntmachungsdatum)\n\nBerlin Amtsgericht Berlin (Charlottenburg) HRB 161327\nEinreichung neuer Dokumente\n\nKreuzberger Kinderstiftung gemeinnützige Aktiengesellschaft\nAktiengesellschaft\nBerlin\n\nAls nicht eingetragen wird veröffentlicht: Es wurde eine neue Liste der Aufsichtsratsmitglieder eingereicht (§ 106 AktG)."
    },
    {
      "date": "2025-10-28",
      "id": "135506",
      "original_text": "Löschungsankündigung\nSachsen-Anhalt Amtsgericht Stendal HRB 23385\nAnhaltinische Raum und Grund Bauträger GmbH – Oebisfelde-Weferlingen",
      "type": "Löschungsankündigung",
      "state": "Sachsen-Anhalt",
      "amtsgericht": "Amtsgericht Stendal",
      "registernummer": "HRB 23385",
      "registerart": "HRB",
      "company_name": "Anhaltinische Raum und Grund Bauträger GmbH",
      "company_seat": "Oebisfelde-Weferlingen",
      "details": "28.10.2025 (Bekanntmachungsdatum)\n\nSachsen-Anhalt Amtsgericht Stendal HRB 23385\nLöschungsankündigung 28.10.2025 (Eintragungsdatum)\n\nAnhaltinische Raum und Grund Bauträger GmbH\nGesellschaft mit beschränkter Haftung\nOebisfelde-Weferlingen\n\nDas Registergericht beabsichtigt, nachfolgende Gesellschaften wegen Vermögenslosigkeit von Amts wegen nach § 394 FamFG zu löschen. Die Frist zur Erhebung eines Widerspruchs gegen die beabsichtigte Löschung wird auf drei Monate festgesetzt."
    },
    {
      "date": "2025-10-28",
      "id": "135507",
      "original_text": "Registerbekanntmachung nach dem Umwandlungsgesetz\nBrandenburg Amtsgericht Neuruppin HRB 13930\nalt & neu Holding GmbH – Brüssow",
      "type": "Registerbekanntmachung nach dem Umwandlungsgesetz",
      "state": "Brandenburg",
      "amtsgericht": "Amtsgericht Neuruppin",
      "registernummer": "HRB 13930",
      "registerart": "HRB",
      "company_name": "alt & neu Holding GmbH",
      "company_seat": "Brüssow",
      "details": "28.10.2025 (Bekanntmachungsdatum)\n\nBrandenburg Amtsgericht Neuruppin HRB 13930\nRegisterbekanntmachung nach dem Umwandlungsgesetz 27.10.2025 (Eintragungsdatum)\n\nalt & neu Holding GmbH\nGesellschaft mit beschränkter Haftung\nBrüssow\n\nZu Eintragungsnummer 3 vom 27.10.2025 wird als nicht eingetragen veröffentlicht:\nDen Gläubigern der an der Umwandlung beteiligten Rechtsträger ist, wenn sie binnen sechs Monaten nach dem Tag, an dem die Eintragung der Umwandlung in das Register des Sitzes desjenigen Rechtsträgers, dessen Gläubiger sie sind, als bekannt gemacht gilt, ihren Anspruch nach Grund und Höhe schriftlich anmelden, Sicherheit zu leisten, soweit sie nicht Befriedigung verlangen können. Dieses Recht steht den Gläubigern jedoch nur zu, wenn sie glaubhaft machen, dass durch die Umwandlung die Erfüllung ihrer Forderung gefährdet wird"
    },
    {
      "date": "2025-10-28",
      "id": "135508",
      "original_text": "Registerbekanntmachung nach dem Umwandlungsgesetz\nBrandenburg Amtsgericht Cottbus HRB 15272\nVEM Vermögensverwaltung GmbH – Schönefeld",
      "type": "Registerbekanntmachung nach dem Umwandlungsgesetz",
      "state": "Brandenburg",
      "amtsgericht": "Amtsgericht Cottbus",
      "registernummer": "HRB 15272",
      "registerart": "HRB",
      "company_name": "VEM Vermögensverwaltung GmbH",
      "company_seat": "Schönefeld",
      "details": "28.10.2025 (Bekanntmachungsdatum)\n\nBrandenburg Amtsgericht Cottbus HRB 15272\nRegisterbekanntmachung nach dem Umwandlungsgesetz 28.10.2025 (Eintragungsdatum)\n\nVEM Vermögensverwaltung GmbH\nGesellschaft mit beschränkter Haftung\nSchönefeld\n\nZu Eintragungsnummer 10 vom 28.10.2025 wird als nicht eingetragen veröffentlicht:\nDen Gläubigern der an der Verschmelzung beteiligten Rechtsträger ist, wenn sie binnen sechs Monaten nach dem Tag, an dem die Eintragung der Verschmelzung in das Register des Sitzes desjenigen Rechtsträgers, dessen Gläubiger sie sind, als bekannt gemacht gilt, ihren Anspruch nach Grund und Höhe schriftlich anmelden, Sicherheit zu leisten, soweit sie nicht Befriedigung verlangen können. Dieses Recht steht den Gläubigern jedoch nur zu, wenn sie glaubhaft machen, dass durch die Verschmelzung die Erfüllung ihrer Forderung gefährdet wird"
    },
    {
      "date": "2025-10-28",
      "id": "135509",
      "original_text": "Löschungsankündigung\nBrandenburg Amtsgericht Neuruppin HRB 12970\nAPS GmbH – Schwedt/Oder",
      "type": "Löschungsankündigung",
      "state": "Brandenburg",
      "amtsgericht": "Amtsgericht Neuruppin",
      "registernummer": "HRB 12970",
      "registerart": "HRB",
      "company_name": "APS GmbH",
      "company_seat": "Schwedt/Oder",
      "details": "28.10.2025 (Bekanntmachungsdatum)\n\nBrandenburg Amtsgericht Neuruppin HRB 12970\nLöschungsankündigung\n\nAPS GmbH\nGesellschaft mit beschränkter Haftung\nSchwedt/Oder\n\nBei der nachstehenden Gesellschaft wird das Amtslöschungsverfahren gemäß § 394 FamFG eingeleitet.\nWiderspruchsfrist: 1 Monat"
    },
    {
      "date": "2025-10-28",
      "id": "135510",
      "original_text": "Löschungsankündigung\nSaarland Amtsgericht Saarbrücken HRB 101428\nTESgrosser GmbH – St.Ingbert",
      "type": "Löschungsankündigung",
      "state": "Saarland",
      "amtsgericht": "Amtsgericht Saarbrücken",
      "registernummer": "HRB 101428",
      "registerart": "HRB",
      "company_name": "TESgrosser GmbH",
      "company_seat": "St.Ingbert",
      "details": "28.10.2025 (Bekanntmachungsdatum)\n\nSaarland Amtsgericht Saarbrücken HRB 101428\nLöschungsankündigung\n\nTESgrosser GmbH\nGesellschaft mit beschränkter Haftung\nSt.Ingbert\n\nEs ist beabsichtigt, die Gesellschaft von Amts wegen gemäß § 394 FamFG wegen Vermögenslosigkeit zu löschen.\nGegen die Löschung von Amts wegen ist das Rechtsmittel des Widerspruchs statthaft. Der Widerspruch ist binnen einer Frist von drei Monaten beginnend mit dem Tag dieser Veröffentlichung durch Einreichen eines Widerspruchsschreibens -schriftlich oder zur Niederschrift der Geschäftsstelle beim Amtsgericht Saarbrücken, -zentrales Handelsregister-, Mainzerstr.178, 66121 Saarbrücken einzulegen.\nDer Widerspruch muss die Bezeichnung der angefochtenen Löschungsankündigung enthalten sowie die Erklärung, dass Widerspruch eingelegt wird. Er ist vom Widerspruchsführer oder seinem Bevollmächtigten zu unterzeichnen.\nDas Widerspruchsschreiben kann auch in der Form eines elektronischen Dokumentes eingereicht werden, das mit einer qualifizierten elektronischen Signatur nach dem Signaturgesetz versehen sein muss (§§ 14 Abs. 2 FamFG, 130a, 298 ZPO)."
    },
    {
      "date": "2025-10-28",
      "id": "135511",
      "original_text": "Registerbekanntmachung nach dem Umwandlungsgesetz\nBerlin Amtsgericht Berlin (Charlottenburg) HRB 166156\nBerlin-Boden Grundstücksgesellschaft mbH – Berlin",
      "type": "Registerbekanntmachung nach dem Umwandlungsgesetz",
      "state": "Berlin",
      "amtsgericht": "Amtsgericht Berlin (Charlottenburg)",
      "registernummer": "HRB 166156",
      "registerart": "HRB",
      "company_name": "Berlin-Boden Grundstücksgesellschaft mbH",
      "company_seat": "Berlin",
      "details": "28.10.2025 (Bekanntmachungsdatum)\n\nBerlin Amtsgericht Berlin (Charlottenburg) HRB 166156\nRegisterbekanntmachung nach dem Umwandlungsgesetz 27.10.2025 (Eintragungsdatum)\n\nBerlin-Boden Grundstücksgesellschaft mbH\nGesellschaft mit beschränkter Haftung\nBerlin\n\nZu Eintragungsnummer 3 vom 27.10.2025 wird als nicht eingetragen veröffentlicht: Den Gläubigern der an der Verschmelzung beteiligten Rechtsträger ist, wenn sie binnen sechs Monaten nach dem Tag, an dem die Eintragung der Verschmelzung in das Register des Sitzes desjenigen Rechtsträgers, dessen Gläubiger sie sind, als bekannt gemacht gilt, ihren Anspruch nach Grund und Höhe schriftlich anmelden, Sicherheit zu leisten, soweit sie nicht Befriedigung verlangen können. Dieses Recht steht den Gläubigern jedoch nur zu, wenn sie glaubhaft machen, dass durch die Verschmelzung die Erfüllung ihrer Forderung gefährdet wird. Das Recht, Sicherheitsleistung zu verlangen, steht Gläubigern nicht zu, die im Falle der Insolvenz ein Recht auf vorzugsweise Befriedigung aus einer Deckungsmasse haben, die nach gesetzlicher Vorschrift zu ihrem Schutz errichtet und staatlich überwacht ist."
    },
    {
      "date": "2025-10-28",
      "id": "135512",
      "original_text": "Registerbekanntmachung nach dem Umwandlungsgesetz\nBerlin Amtsgericht Berlin (Charlottenburg) HRB 141915\nCitipart Berlin Grundstücksgesellschaft mbH – Berlin",
      "type": "Registerbekanntmachung nach dem Umwandlungsgesetz",
      "state": "Berlin",
      "amtsgericht": "Amtsgericht Berlin (Charlottenburg)",
      "registernummer": "HRB 141915",
      "registerart": "HRB",
      "company_name": "Citipart Berlin Grundstücksgesellschaft mbH",
      "company_seat": "Berlin",
      "details": "28.10.2025 (Bekanntmachungsdatum)\n\nBerlin Amtsgericht Berlin (Charlottenburg) HRB 141915\nRegisterbekanntmachung nach dem Umwandlungsgesetz 27.10.2025 (Eintragungsdatum)\n\nCitipart Berlin Grundstücksgesellschaft mbH\nGesellschaft mit beschränkter Haftung\nBerlin\n\nZu Eintragungsnummer 3 vom 27.10.2025 wird als nicht eingetragen veröffentlicht: Den Gläubigern der an der Verschmelzung beteiligten Rechtsträger ist, wenn sie binnen sechs Monaten nach dem Tag, an dem die Eintragung der Verschmelzung in das Register des Sitzes desjenigen Rechtsträgers, dessen Gläubiger sie sind, als bekannt gemacht gilt, ihren Anspruch nach Grund und Höhe schriftlich anmelden, Sicherheit zu leisten, soweit sie nicht Befriedigung verlangen können. Dieses Recht steht den Gläubigern jedoch nur zu, wenn sie glaubhaft machen, dass durch die Verschmelzung die Erfüllung ihrer Forderung gefährdet wird. Das Recht, Sicherheitsleistung zu verlangen, steht Gläubigern nicht zu, die im Falle der Insolvenz ein Recht auf vorzugsweise Befriedigung aus einer Deckungsmasse haben, die nach gesetzlicher Vorschrift zu ihrem Schutz errichtet und staatlich überwacht ist."
    },
    {
      "date": "2025-10-28",
      "id": "135513",
      "original_text": "Registerbekanntmachung nach dem Umwandlungsgesetz\nHamburg Amtsgericht Hamburg HRB 194002\nRABOT Energy Beteiligung GmbH – Hamburg",
      "type": "Registerbekanntmachung nach dem Umwandlungsgesetz",
      "state": "Hamburg",
      "amtsgericht": "Amtsgericht Hamburg",
      "registernummer": "HRB 194002",
      "registerart": "HRB",
      "company_name": "RABOT Energy Beteiligung GmbH",
      "company_seat": "Hamburg",
      "details": "28.10.2025 (Bekanntmachungsdatum)\n\nHamburg Amtsgericht Hamburg HRB 194002\nRegisterbekanntmachung nach dem Umwandlungsgesetz 28.10.2025 (Eintragungsdatum)\n\nRABOT Energy Beteiligung GmbH\nGesellschaft mit beschränkter Haftung\nHamburg\n\nAls nicht eingetragen wird bekannt gemacht:\nDen Gläubigern der an der Ausgliederung beteiligten Gesellschaften ist, wenn sie binnen sechs Monaten nach dem Tag, an dem die Eintragung der Ausgliederung in das Register des Sitzes desjenigen Rechtsträgers, dessen Gläubiger sie sind, nach § 19 Absatz 3 UmwG als bekannt gemacht gilt, ihren Anspruch nach Grund und Höhe schriftlich anmelden, Sicherheit zu leisten, soweit sie nicht Befriedigung verlangen können. Dieses Recht steht den Gläubigern jedoch nur zu, wenn sie glaubhaft machen, dass durch die Ausgliederung die Erfüllung ihrer Forderung gefährdet wird."
    },
    {
      "date": "2025-10-28",
      "id": "135514",
      "original_text": "Registerbekanntmachung nach dem Umwandlungsgesetz\nHamburg Amtsgericht Hamburg HRB 194021\nRABOT Energy DE GmbH – Hamburg",
      "type": "Registerbekanntmachung nach dem Umwandlungsgesetz",
      "state": "Hamburg",
      "amtsgericht": "Amtsgericht Hamburg",
      "registernummer": "HRB 194021",
      "registerart": "HRB",
      "company_name": "RABOT Energy DE GmbH",
      "company_seat": "Hamburg",
      "details": "28.10.2025 (Bekanntmachungsdatum)\n\nHamburg Amtsgericht Hamburg HRB 194021\nRegisterbekanntmachung nach dem Umwandlungsgesetz 28.10.2025 (Eintragungsdatum)\n\nRABOT Energy DE GmbH\nGesellschaft mit beschränkter Haftung\nHamburg\n\nAls nicht eingetragen wird bekannt gemacht:\nDen Gläubigern der an der Ausgliederung beteiligten Gesellschaften ist, wenn sie binnen sechs Monaten nach dem Tag, an dem die Eintragung der Ausgliederung in das Register des Sitzes desjenigen Rechtsträgers, dessen Gläubiger sie sind, nach § 19 Absatz 3 UmwG als bekannt gemacht gilt, ihren Anspruch nach Grund und Höhe schriftlich anmelden, Sicherheit zu leisten, soweit sie nicht Befriedigung verlangen können. Dieses Recht steht den Gläubigern jedoch nur zu, wenn sie glaubhaft machen, dass durch die Ausgliederung die Erfüllung ihrer Forderung gefährdet wird."
    },
    {
      "date": "2025-10-28",
      "id": "135515",
      "original_text": "Einreichung neuer Dokumente\nSachsen Amtsgericht Chemnitz HRB 12299\nHeim gemeinnützige GmbH für medizinische Betreuung, Senioren und Behinderte Chemnitz – Chemnitz",
      "type": "Einreichung neuer Dokumente",
      "state": "Sachsen",
      "amtsgericht": "Amtsgericht Chemnitz",
      "registernummer": "HRB 12299",
      "registerart": "HRB",
      "company_name": "Heim gemeinnützige GmbH für medizinische Betreuung, Senioren und Behinderte Chemnitz",
      "company_seat": "Chemnitz",
      "details": "28.10.2025 (Bekanntmachungsdatum)\n\nSachsen Amtsgericht Chemnitz HRB 12299\nEinreichung neuer Dokumente\n\nHeim gemeinnützige GmbH für medizinische Betreuung, Senioren und Behinderte Chemnitz\nGesellschaft mit beschränkter Haftung\nChemnitz\n\nAm 24.10.2025 wurde beim Handelsregister des Amtsgerichts Chemnitz die Liste der Mitglieder des Aufsichtsrats gemäß § 52 GmbHG eingereicht."
    },
    {
      "date": "2025-10-28",
      "id": "135516",
      "original_text": "Einreichung neuer Dokumente\nSachsen Amtsgericht Chemnitz HRB 4371\nFortbildungszentrum Chemnitz gemeinnützige Gesellschaft mit beschränkter Haftung – Chemnitz",
      "type": "Einreichung neuer Dokumente",
      "state": "Sachsen",
      "amtsgericht": "Amtsgericht Chemnitz",
      "registernummer": "HRB 4371",
      "registerart": "HRB",
      "company_name": "Fortbildungszentrum Chemnitz gemeinnützige Gesellschaft mit beschränkter Haftung",
      "company_seat": "Chemnitz",
      "details": "28.10.2025 (Bekanntmachungsdatum)\n\nSachsen Amtsgericht Chemnitz HRB 4371\nEinreichung neuer Dokumente\n\nFortbildungszentrum Chemnitz gemeinnützige Gesellschaft mit beschränkter Haftung\nGesellschaft mit beschränkter Haftung\nChemnitz\n\nAm 24.10.2025 wurde beim Handelsregister des Amtsgerichts Chemnitz die Liste der Mitglieder des Aufsichtsrats gemäß § 52 GmbHG eingereicht."
    },
    {
      "date": "2025-10-28",
      "id": "135517",
      "original_text": "Löschungsankündigung\nSachsen Amtsgericht Chemnitz HRB 35460\nMB Holding GmbH – Plauen",
      "type": "Löschungsankündigung",
      "state": "Sachsen",
      "amtsgericht": "Amtsgericht Chemnitz",
      "registernummer": "HRB 35460",
      "registerart": "HRB",
      "company_name": "MB Holding GmbH",
      "company_seat": "Plauen",
      "details": "28.10.2025 (Bekanntmachungsdatum)\n\nSachsen Amtsgericht Chemnitz HRB 35460\nLöschungsankündigung\n\nMB Holding GmbH\nGesellschaft mit beschränkter Haftung\nPlauen\n\nDas Registergericht beabsichtigt, die im Handelsregister eingetragene Gesellschaft von Amts wegen nach § 394 FamFG zu löschen. Die Frist zu Erhebung eines Widerspruchs gegen die beabsichtigte Löschung wird auf einen Monat festgesetzt."
    },
    {
      "date": "2025-10-28",
      "id": "135518",
      "original_text": "Registerbekanntmachung nach dem Umwandlungsgesetz\nHamburg Amtsgericht Hamburg HRB 39983\nColumbus Tours Event Business GmbH – Hamburg",
      "type": "Registerbekanntmachung nach dem Umwandlungsgesetz",
      "state": "Hamburg",
      "amtsgericht": "Amtsgericht Hamburg",
      "registernummer": "HRB 39983",
      "registerart": "HRB",
      "company_name": "Columbus Tours Event Business GmbH",
      "company_seat": "Hamburg",
      "details": "28.10.2025 (Bekanntmachungsdatum)\n\nHamburg Amtsgericht Hamburg HRB 39983\nRegisterbekanntmachung nach dem Umwandlungsgesetz 28.10.2025 (Eintragungsdatum)\n\nColumbus Tours Event Business GmbH\nGesellschaft mit beschränkter Haftung\nHamburg\n\nAls nicht eingetragen wird bekannt gemacht:\nDen Gläubigern der an der Verschmelzung beteiligten Gesellschaften ist, wenn sie binnen sechs Monaten nach dem Tag, an dem die Eintragung der Verschmelzung in das Register des Sitzes desjenigen Rechtsträgers, dessen Gläubiger sie sind, nach § 19 Absatz 3 UmwG als bekannt gemacht gilt, ihren Anspruch nach Grund und Höhe schriftlich anmelden, Sicherheit zu leisten, soweit sie nicht Befriedigung verlangen können. Dieses Recht steht den Gläubigern jedoch nur zu, wenn sie glaubhaft machen, dass durch die Verschmelzung die Erfüllung ihrer Forderung gefährdet wird."
    },
    {
      "date": "2025-10-28",
      "id": "135519",
      "original_text": "Registerbekanntmachung nach dem Umwandlungsgesetz\nHamburg Amtsgericht Hamburg HRB 2550\nATPI Hamburg GmbH – Hamburg",
      "type": "Registerbekanntmachung nach dem Umwandlungsgesetz",
      "state": "Hamburg",
      "amtsgericht": "Amtsgericht Hamburg",
      "registernummer": "HRB 2550",
      "registerart": "HRB",
      "company_name": "ATPI Hamburg GmbH",
      "company_seat": "Hamburg",
      "details": "28.10.2025 (Bekanntmachungsdatum)\n\nHamburg Amtsgericht Hamburg HRB 2550\nRegisterbekanntmachung nach dem Umwandlungsgesetz 28.10.2025 (Eintragungsdatum)\n\nATPI Hamburg GmbH\nGesellschaft mit beschränkter Haftung\nHamburg\n\nAls nicht eingetragen wird bekannt gemacht:\nDen Gläubigern der an der Verschmelzung beteiligten Gesellschaften ist, wenn sie binnen sechs Monaten nach dem Tag, an dem die Eintragung der Verschmelzung in das Register des Sitzes desjenigen Rechtsträgers, dessen Gläubiger sie sind, nach § 19 Absatz 3 UmwG als bekannt gemacht gilt, ihren Anspruch nach Grund und Höhe schriftlich anmelden, Sicherheit zu leisten, soweit sie nicht Befriedigung verlangen können. Dieses Recht steht den Gläubigern jedoch nur zu, wenn sie glaubhaft machen, dass durch die Verschmelzung die Erfüllung ihrer Forderung gefährdet wird."
    },
    {
      "date": "2025-10-28",
      "id": "135520",
      "original_text": "Löschungsankündigung\nNiedersachsen Amtsgericht Hannover VR 203328\nEishockeyclub (EHC) Hannover Warriors e.V. – Hannover",
      "type": "Löschungsankündigung",
      "state": "Niedersachsen",
      "amtsgericht": "Amtsgericht Hannover",
      "registernummer": "VR 203328",
      "registerart": "VR",
      "company_name": "Eishockeyclub (EHC) Hannover Warriors e.V.",
      "company_seat": "Hannover",
      "details": "28.10.2025 (Bekanntmachungsdatum)\n\nNiedersachsen Amtsgericht Hannover VR 203328\nLöschungsankündigung\n\nEishockeyclub (EHC) Hannover Warriors e.V.\neingetragener Verein\nHannover\n\nDas Registergericht beabsichtigt, das Registerblatt gemäß § 4 Abs. 2 Nr. 1 1. Alt. VRV von Amts wegen zu schließen.\nDie Frist zur Erhebung eines Widerspruchs ist auf 1 Monat ab dieser Registerbekanntmachung festgesetzt."
    },
    {
      "date": "2025-10-28",
      "id": "135521",
      "original_text": "Registerbekanntmachung nach dem Umwandlungsgesetz\nNiedersachsen Amtsgericht Hildesheim HRB 210363\nSLS Label GmbH – Negenborn",
      "type": "Registerbekanntmachung nach dem Umwandlungsgesetz",
      "state": "Niedersachsen",
      "amtsgericht": "Amtsgericht Hildesheim",
      "registernummer": "HRB 210363",
      "registerart": "HRB",
      "company_name": "SLS Label GmbH",
      "company_seat": "Negenborn",
      "details": "28.10.2025 (Bekanntmachungsdatum)\n\nNiedersachsen Amtsgericht Hildesheim HRB 210363\nRegisterbekanntmachung nach dem Umwandlungsgesetz 28.10.2025 (Eintragungsdatum)\n\nSLS Label GmbH\nGesellschaft mit beschränkter Haftung\nNegenborn\n\nDen Gläubigern der an der Ausgliederung beteiligten Rechtsträger ist, wenn sie binnen sechs Monaten nach dem Tag, an dem die Eintragung der Ausgliederung in das Register des Sitzes desjenigen Rechtsträgers, dessen Gläubiger sie sind, nach § 19 Abs. 3 UmwG als bekannt gemacht gilt, ihren Anspruch nach Grund und Höhe schriftlich anmelden, Sicherheit zu leisten, soweit sie nicht Befriedigung verlangen können. Dieses Recht steht den Gläubigern jedoch nur zu, wenn sie glaubhaft machen, dass durch die Ausgliederung die Erfüllung der Forderung gefährdet wird."
    },
    {
      "date": "2025-10-28",
      "id": "135522",
      "original_text": "Registerbekanntmachung nach dem Umwandlungsgesetz\nNiedersachsen Amtsgericht Osnabrück HRB 130643 früher Amtsgericht Nordhorn\nGerhard Kamps GmbH – Neuenhaus",
      "type": "Registerbekanntmachung nach dem Umwandlungsgesetz",
      "state": "Niedersachsen",
      "amtsgericht": "Amtsgericht Osnabrück",
      "registernummer": "HRB 130643",
      "registerart": "HRB",
      "company_name": "Gerhard Kamps GmbH",
      "company_seat": "Neuenhaus",
      "former_amtsgericht": "Nordhorn",
      "details": "28.10.2025 (Bekanntmachungsdatum)\n\nNiedersachsen Amtsgericht Osnabrück HRB 130643 früher Amtsgericht Nordhorn\nRegisterbekanntmachung nach dem Umwandlungsgesetz 28.10.2025 (Eintragungsdatum)\n\nGerhard Kamps GmbH\nGesellschaft mit beschränkter Haftung\nNeuenhaus\n\nDen Gläubigern der an der Verschmelzung beteiligten Rechtsträger ist, wenn sie binnen sechs Monaten nach dem Tag, an dem die Eintragung der Verschmelzung in das Register des Sitzes desjenigen Rechtsträgers, dessen Gläubiger sie sind, nach § 19  Abs.  3 UmwG als bekannt gemacht gilt, ihren Anspruch nach Grund und Höhe schriftlich anmelden, Sicherheit zu leisten, soweit sie nicht Befriedigung verlangen können. Dieses Recht steht den Gläubigern jedoch nur zu, wenn sie glaubhaft machen, dass durch die Verschmelzung die Erfüllung der Forderung gefährdet wird."
    },
    {
      "date": "2025-10-28",
      "id": "135523",
      "original_text": "Einreichung neuer Dokumente\nNiedersachsen Amtsgericht Braunschweig HRB 209737\nPowerCo SE – Salzgitter",
      "type": "Einreichung neuer Dokumente",
      "state": "Niedersachsen",
      "amtsgericht": "Amtsgericht Braunschweig",
      "registernummer": "HRB 209737",
      "registerart": "HRB",
      "company_name": "PowerCo SE",
      "company_seat": "Salzgitter",
      "details": "28.10.2025 (Bekanntmachungsdatum)\n\nNiedersachsen Amtsgericht Braunschweig HRB 209737\nEinreichung neuer Dokumente\n\nPowerCo SE\nEuropäische Aktiengesellschaft (SE)\nSalzgitter\n\nDie aktuelle Liste der Mitglieder des Aufsichtsrats wurde beim Registergericht eingereicht."
    },
    {
      "date": "2025-10-28",
      "id": "135524",
      "original_text": "Einreichung neuer Dokumente\nNiedersachsen Amtsgericht Braunschweig HRB 100835 früher Amtsgericht Wolfsburg\nKreis-Wohnungsbaugesellschaft Helmstedt mit beschränkter Haftung – Helmstedt",
      "type": "Einreichung neuer Dokumente",
      "state": "Niedersachsen",
      "amtsgericht": "Amtsgericht Braunschweig",
      "registernummer": "HRB 100835",
      "registerart": "HRB",
      "company_name": "Kreis-Wohnungsbaugesellschaft Helmstedt mit beschränkter Haftung",
      "company_seat": "Helmstedt",
      "former_amtsgericht": "Wolfsburg",
      "details": "28.10.2025 (Bekanntmachungsdatum)\n\nNiedersachsen Amtsgericht Braunschweig HRB 100835 früher Amtsgericht Wolfsburg\nEinreichung neuer Dokumente 28.10.2025 (Eintragungsdatum)\n\nKreis-Wohnungsbaugesellschaft Helmstedt mit beschränkter Haftung\nGesellschaft mit beschränkter Haftung\nHelmstedt\n\nDie Liste der Mitglieder des Aufsichtsrats wurde beim Registergericht eingereicht."
    },
    {
      "date": "2025-10-28",
      "id": "135525",
      "original_text": "Registerbekanntmachung nach dem Umwandlungsgesetz\nNiedersachsen Amtsgericht Osnabrück HRB 130246 früher Amtsgericht Nordhorn\nJohannes Helming Kultur - Tiefbau - Baustoffhandel GmbH – Wietmarschen",
      "type": "Registerbekanntmachung nach dem Umwandlungsgesetz",
      "state": "Niedersachsen",
      "amtsgericht": "Amtsgericht Osnabrück",
      "registernummer": "HRB 130246",
      "registerart": "HRB",
      "company_name": "Johannes Helming Kultur - Tiefbau - Baustoffhandel GmbH",
      "company_seat": "Wietmarschen",
      "former_amtsgericht": "Nordhorn",
      "details": "28.10.2025 (Bekanntmachungsdatum)\n\nNiedersachsen Amtsgericht Osnabrück HRB 130246 früher Amtsgericht Nordhorn\nRegisterbekanntmachung nach dem Umwandlungsgesetz 28.10.2025 (Eintragungsdatum)\n\nJohannes Helming Kultur - Tiefbau - Baustoffhandel GmbH\nGesellschaft mit beschränkter Haftung\nWietmarschen\n\nDen Gläubigern der an der Verschmelzung beteiligten Rechtsträger ist, wenn sie binnen sechs Monaten nach dem Tag, an dem die Eintragung der Verschmelzung in das Register des Sitzes desjenigen Rechtsträgers, dessen Gläubiger sie sind, nach § 19  Abs.  3 UmwG als bekannt gemacht gilt, ihren Anspruch nach Grund und Höhe schriftlich anmelden, Sicherheit zu leisten, soweit sie nicht Befriedigung verlangen können. Dieses Recht steht den Gläubigern jedoch nur zu, wenn sie glaubhaft machen, dass durch die Verschmelzung die Erfüllung der Forderung gefährdet wird."
    },
    {
      "date": "2025-10-28",
      "id": "135526",
      "original_text": "Einreichung neuer Dokumente\nNiedersachsen Amtsgericht Braunschweig HRB 8066\nAbwasserentsorgung Schladen GmbH – Schladen",
      "type": "Einreichung neuer Dokumente",
      "state": "Niedersachsen",
      "amtsgericht": "Amtsgericht Braunschweig",
      "registernummer": "HRB 8066",
      "registerart": "HRB",
      "company_name": "Abwasserentsorgung Schladen GmbH",
      "company_seat": "Schladen",
      "details": "28.10.2025 (Bekanntmachungsdatum)\n\nNiedersachsen Amtsgericht Braunschweig HRB 8066\nEinreichung neuer Dokumente 28.10.2025 (Eintragungsdatum)\n\nAbwasserentsorgung Schladen GmbH\nGesellschaft mit beschränkter Haftung\nSchladen\n\nDie Liste der Mitglieder des Aufsichtsrats wurde beim Registergericht eingereicht."
    },
    {
      "date": "2025-10-28",
      "id": "135527",
      "original_text": "Registerbekanntmachung nach dem Umwandlungsgesetz\nNiedersachsen Amtsgericht Göttingen HRB 4199\nHenze Beteiligungs-GmbH – Hörden",
      "type": "Registerbekanntmachung nach dem Umwandlungsgesetz",
      "state": "Niedersachsen",
      "amtsgericht": "Amtsgericht Göttingen",
      "registernummer": "HRB 4199",
      "registerart": "HRB",
      "company_name": "Henze Beteiligungs-GmbH",
      "company_seat": "Hörden",
      "details": "28.10.2025 (Bekanntmachungsdatum)\n\nNiedersachsen Amtsgericht Göttingen HRB 4199\nRegisterbekanntmachung nach dem Umwandlungsgesetz 28.10.2025 (Eintragungsdatum)\n\nHenze Beteiligungs-GmbH\nGesellschaft mit beschränkter Haftung\nHörden\n\nDen Gläubigern der an der Verschmelzung beteiligten Rechtsträger ist, wenn sie binnen sechs Monaten nach dem Tag, an dem die Eintragung der Verschmelzung in das Register des Sitzes desjenigen Rechtsträgers, dessen Gläubiger sie sind, nach § 19  Abs.  3 UmwG als bekannt gemacht gilt, ihren Anspruch nach Grund und Höhe schriftlich anmelden, Sicherheit zu leisten, soweit sie nicht Befriedigung verlangen können. Dieses Recht steht den Gläubigern jedoch nur zu, wenn sie glaubhaft machen, dass durch die Verschmelzung die Erfüllung der Forderung gefährdet wird."
    },
    {
      "date": "2025-10-28",
      "id": "135528",
      "original_text": "Registerbekanntmachung nach dem Umwandlungsgesetz\nNiedersachsen Amtsgericht Hildesheim HRA 203159\nSLS Label e.K. – Negenborn",
      "type": "Registerbekanntmachung nach dem Umwandlungsgesetz",
      "state": "Niedersachsen",
      "amtsgericht": "Amtsgericht Hildesheim",
      "registernummer": "HRA 203159",
      "registerart": "HRA",
      "company_name": "SLS Label e.K.",
      "company_seat": "Negenborn",
      "details": "28.10.2025 (Bekanntmachungsdatum)\n\nNiedersachsen Amtsgericht Hildesheim HRA 203159\nRegisterbekanntmachung nach dem Umwandlungsgesetz 28.10.2025 (Eintragungsdatum)\n\nSLS Label e.K.\nEinzelkaufmann / Einzelkauffrau\nNegenborn\n\nDen Gläubigern der an der Ausgliederung beteiligten Rechtsträger ist, wenn sie binnen sechs Monaten nach dem Tag, an dem die Eintragung der Ausgliederung in das Register des Sitzes desjenigen Rechtsträgers, dessen Gläubiger sie sind, nach § 19 Abs. 3 UmwG als bekannt gemacht gilt, ihren Anspruch nach Grund und Höhe schriftlich anmelden, Sicherheit zu leisten, soweit sie nicht Befriedigung verlangen können. Dieses Recht steht den Gläubigern jedoch nur zu, wenn sie glaubhaft machen, dass durch die Ausgliederung die Erfüllung der Forderung gefährdet wird."
    },
    {
      "date": "2025-10-28",
      "id": "135529",
      "original_text": "Registerbekanntmachung nach dem Umwandlungsgesetz\nNiedersachsen Amtsgericht Osnabrück HRA 204313\nLückerServices e.K – Hasbergen",
      "type": "Registerbekanntmachung nach dem Umwandlungsgesetz",
      "state": "Niedersachsen",
      "amtsgericht": "Amtsgericht Osnabrück",
      "registernummer": "HRA 204313",
      "registerart": "HRA",
      "company_name": "LückerServices e.K",
      "company_seat": "Hasbergen",
      "details": "28.10.2025 (Bekanntmachungsdatum)\n\nNiedersachsen Amtsgericht Osnabrück HRA 204313\nRegisterbekanntmachung nach dem Umwandlungsgesetz 28.10.2025 (Eintragungsdatum)\n\nLückerServices e.K\nEinzelkaufmann / Einzelkauffrau\nHasbergen\n\nDen Gläubigern der an der Ausgliederung beteiligten Rechtsträger ist, wenn sie binnen sechs Monaten nach dem Tag, an dem die Eintragung der Ausgliederung in das Register des Sitzes desjenigen Rechtsträgers, dessen Gläubiger sie sind, nach § 19 Abs. 3 UmwG als bekannt gemacht gilt, ihren Anspruch nach Grund und Höhe schriftlich anmelden, Sicherheit zu leisten, soweit sie nicht Befriedigung verlangen können. Dieses Recht steht den Gläubigern jedoch nur zu, wenn sie glaubhaft machen, dass durch die Ausgliederung die Erfüllung der Forderung gefährdet wird."
    },
    {
      "date": "2025-10-28",
      "id": "135530",
      "original_text": "Registerbekanntmachung nach dem Umwandlungsgesetz\nNiedersachsen Amtsgericht Osnabrück HRB 214134\nTM-2020 Management GmbH – Bad Rothenfelde",
      "type": "Registerbekanntmachung nach dem Umwandlungsgesetz",
      "state": "Niedersachsen",
      "amtsgericht": "Amtsgericht Osnabrück",
      "registernummer": "HRB 214134",
      "registerart": "HRB",
      "company_name": "TM-2020 Management GmbH",
      "company_seat": "Bad Rothenfelde",
      "details": "28.10.2025 (Bekanntmachungsdatum)\n\nNiedersachsen Amtsgericht Osnabrück HRB 214134\nRegisterbekanntmachung nach dem Umwandlungsgesetz 28.10.2025 (Eintragungsdatum)\n\nTM-2020 Management GmbH\nGesellschaft mit beschränkter Haftung\nBad Rothenfelde\n\nDen Gläubigern der an der Verschmelzung beteiligten Rechtsträger ist, wenn sie binnen sechs Monaten nach dem Tag, an dem die Eintragung der Verschmelzung in das Register des Sitzes desjenigen Rechtsträgers, dessen Gläubiger sie sind, nach § 19  Abs.  3 UmwG als bekannt gemacht gilt, ihren Anspruch nach Grund und Höhe schriftlich anmelden, Sicherheit zu leisten, soweit sie nicht Befriedigung verlangen können. Dieses Recht steht den Gläubigern jedoch nur zu, wenn sie glaubhaft machen, dass durch die Verschmelzung die Erfüllung der Forderung gefährdet wird."
    },
    {
      "date": "2025-10-28",
      "id": "135531",
      "original_text": "Einreichung neuer Dokumente\nBaden-Württemberg Amtsgericht Stuttgart HRB 108062\nEisenwerk Würth GmbH – Bad Friedrichshall",
      "type": "Einreichung neuer Dokumente",
      "state": "Baden-Württemberg",
      "amtsgericht": "Amtsgericht Stuttgart",
      "registernummer": "HRB 108062",
      "registerart": "HRB",
      "company_name": "Eisenwerk Würth GmbH",
      "company_seat": "Bad Friedrichshall",
      "details": "28.10.2025 (Bekanntmachungsdatum)\n\nBaden-Württemberg Amtsgericht Stuttgart HRB 108062\nEinreichung neuer Dokumente\n\nEisenwerk Würth GmbH\nGesellschaft mit beschränkter Haftung\nBad Friedrichshall\n\nDie Gesellschaft hat am 20.10.2025 die Liste über die Zusammensetzung des Aufsichtsrats zum Handelsregister eingereicht."
    },
    {
      "date": "2025-10-28",
      "id": "135532",
      "original_text": "Registerbekanntmachung nach dem Umwandlungsgesetz\nBremen Amtsgericht Bremen HRB 39147\nV & M Trade GmbH – Bremen",
      "type": "Registerbekanntmachung nach dem Umwandlungsgesetz",
      "state": "Bremen",
      "amtsgericht": "Amtsgericht Bremen",
      "registernummer": "HRB 39147",
      "registerart": "HRB",
      "company_name": "V & M Trade GmbH",
      "company_seat": "Bremen",
      "details": "28.10.2025 (Bekanntmachungsdatum)\n\nBremen Amtsgericht Bremen HRB 39147\nRegisterbekanntmachung nach dem Umwandlungsgesetz 20.10.2025 (Eintragungsdatum)\n\nV & M Trade GmbH\nGesellschaft mit beschränkter Haftung\nBremen\n\nZu Eintragungsnummer 2 vom 20.10.2025 wird als nicht eingetragen veröffentlicht: Den Gläubigern der an der Verschmelzung beteiligten Rechtsträger ist, wenn sie binnen sechs Monaten nach dem Tag, an dem die Eintragung der Verschmelzung in das Register des Sitzes desjenigen Rechtsträgers, dessen Gläubiger sie sind, als bekannt gemacht gilt, ihren Anspruch nach Grund und Höhe schriftlich anmelden, Sicherheit zu leisten, soweit sie nicht Befriedigung verlangen können. Dieses Recht steht den Gläubigern jedoch nur zu, wenn sie glaubhaft machen, dass durch die Verschmelzung die Erfüllung ihrer Forderung gefährdet wird. Das Recht, Sicherheitsleistung zu verlangen, steht Gläubigern nicht zu, die im Falle der Insolvenz ein Recht auf vorzugsweise Befriedigung aus einer Deckungsmasse haben, die nach gesetzlicher Vorschrift zu ihrem Schutz errichtet und staatlich überwacht ist."
    },
    {
      "date": "2025-10-28",
      "id": "135533",
      "original_text": "Registerbekanntmachung nach dem Umwandlungsgesetz\nBremen Amtsgericht Bremen HRA 23306\nWilhelm Lippold Sonderwerkzeugbau mech. Bearbeitung GmbH & Co.KG – Bremen",
      "type": "Registerbekanntmachung nach dem Umwandlungsgesetz",
      "state": "Bremen",
      "amtsgericht": "Amtsgericht Bremen",
      "registernummer": "HRA 23306",
      "registerart": "HRA",
      "company_name": "Wilhelm Lippold Sonderwerkzeugbau mech. Bearbeitung GmbH & Co.KG",
      "company_seat": "Bremen",
      "details": "28.10.2025 (Bekanntmachungsdatum)\n\nBremen Amtsgericht Bremen HRA 23306\nRegisterbekanntmachung nach dem Umwandlungsgesetz 22.10.2025 (Eintragungsdatum)\n\nWilhelm Lippold Sonderwerkzeugbau mech. Bearbeitung GmbH & Co.KG\nKommanditgesellschaft\nBremen\n\nAls nicht eingetragen wird veröffentlicht: Den Gläubigern ist, wenn sie binnen sechs Monaten nach dem Tag, an dem die Eintragung der Umwandlung als bekannt gemacht gilt, ihren Anspruch nach Grund und Höhe schriftlich anmelden, Sicherheit zu leisten, soweit sie nicht Befriedigung verlangen können. Dieses Recht steht den Gläubigern jedoch nur zu, wenn sie glaubhaft machen, dass durch die Umwandlung die Erfüllung ihrer Forderung gefährdet wird. Das Recht, Sicherheitsleistung zu verlangen, steht Gläubigern nicht zu, die im Falle der Insolvenz ein Recht auf vorzugsweise Befriedigung aus einer Deckungsmasse haben, die nach gesetzlicher Vorschrift zu ihrem Schutz errichtet und staatlich überwacht ist."
    },
    {
      "date": "2025-10-28",
      "id": "135534",
      "original_text": "Registerbekanntmachung nach dem Umwandlungsgesetz\nBremen Amtsgericht Bremen HRA 29840\ngeschmackslabor event & catering - K. Soytürk e.K. – Bremen",
      "type": "Registerbekanntmachung nach dem Umwandlungsgesetz",
      "state": "Bremen",
      "amtsgericht": "Amtsgericht Bremen",
      "registernummer": "HRA 29840",
      "registerart": "HRA",
      "company_name": "geschmackslabor event & catering - K. Soytürk e.K.",
      "company_seat": "Bremen",
      "details": "28.10.2025 (Bekanntmachungsdatum)\n\nBremen Amtsgericht Bremen HRA 29840\nRegisterbekanntmachung nach dem Umwandlungsgesetz 22.10.2025 (Eintragungsdatum)\n\ngeschmackslabor event & catering - K. Soytürk e.K.\nEinzelkaufmann / Einzelkauffrau\nBremen\n\nAls nicht eingetragen wird veröffentlicht: Den Gläubigern der an der Spaltung beteiligten Rechtsträger ist, wenn sie binnen sechs Monaten nach dem Tag, an dem die Eintragung der Spaltung in das Register des Sitzes desjenigen Rechtsträgers, dessen Gläubiger sie sind, als bekannt gemacht gilt, ihren Anspruch nach Grund und Höhe schriftlich anmelden, Sicherheit zu leisten, soweit sie nicht Befriedigung verlangen können. Dieses Recht steht den Gläubigern jedoch nur zu, wenn sie glaubhaft machen, dass durch die Spaltung die Erfüllung ihrer Forderung gefährdet wird. Das Recht, Sicherheitsleistung zu verlangen, steht Gläubigern nicht zu, die im Falle der Insolvenz ein Recht auf vorzugsweise Befriedigung aus einer Deckungsmasse haben, die nach gesetzlicher Vorschrift zu ihrem Schutz errichtet und staatlich überwacht ist."
    },
    {
      "date": "2025-10-28",
      "id": "135535",
      "original_text": "Registerbekanntmachung nach dem Umwandlungsgesetz\nBremen Amtsgericht Bremen HRB 41990\nWilhelm Lippold Sonderwerkzeugbau mech. Bearbeitung GmbH – Bremen",
      "type": "Registerbekanntmachung nach dem Umwandlungsgesetz",
      "state": "Bremen",
      "amtsgericht": "Amtsgericht Bremen",
      "registernummer": "HRB 41990",
      "registerart": "HRB",
      "company_name": "Wilhelm Lippold Sonderwerkzeugbau mech. Bearbeitung GmbH",
      "company_seat": "Bremen",
      "details": "28.10.2025 (Bekanntmachungsdatum)\n\nBremen Amtsgericht Bremen HRB 41990\nRegisterbekanntmachung nach dem Umwandlungsgesetz 22.10.2025 (Eintragungsdatum)\n\nWilhelm Lippold Sonderwerkzeugbau mech. Bearbeitung GmbH\nGesellschaft mit beschränkter Haftung\nBremen\n\nAls nicht eingetragen wird veröffentlicht: Den Gläubigern ist, wenn sie binnen sechs Monaten nach dem Tag, an dem die Eintragung der Umwandlung als bekannt gemacht gilt, ihren Anspruch nach Grund und Höhe schriftlich anmelden, Sicherheit zu leisten, soweit sie nicht Befriedigung verlangen können. Dieses Recht steht den Gläubigern jedoch nur zu, wenn sie glaubhaft machen, dass durch die Umwandlung die Erfüllung ihrer Forderung gefährdet wird. Das Recht, Sicherheitsleistung zu verlangen, steht Gläubigern nicht zu, die im Falle der Insolvenz ein Recht auf vorzugsweise Befriedigung aus einer Deckungsmasse haben, die nach gesetzlicher Vorschrift zu ihrem Schutz errichtet und staatlich überwacht ist."
    },
    {
      "date": "2025-10-28",
      "id": "135536",
      "original_text": "Registerbekanntmachung nach dem Umwandlungsgesetz\nBremen Amtsgericht Bremen HRA 29995\ngeschmackslabor event & catering GmbH & Co. KG – Bremen",
      "type": "Registerbekanntmachung nach dem Umwandlungsgesetz",
      "state": "Bremen",
      "amtsgericht": "Amtsgericht Bremen",
      "registernummer": "HRA 29995",
      "registerart": "HRA",
      "company_name": "geschmackslabor event & catering GmbH & Co. KG",
      "company_seat": "Bremen",
      "details": "28.10.2025 (Bekanntmachungsdatum)\n\nBremen Amtsgericht Bremen HRA 29995\nRegisterbekanntmachung nach dem Umwandlungsgesetz 22.10.2025 (Eintragungsdatum)\n\ngeschmackslabor event & catering GmbH & Co. KG\nKommanditgesellschaft\nBremen\n\nAls nicht eingetragen wird veröffentlicht: Den Gläubigern der an der Ausgliederung beteiligten Rechtsträger ist, wenn sie binnen sechs Monaten nach dem Tag, an dem die Eintragung der Ausgliederung in das Register des Sitzes desjenigen Rechtsträgers, dessen Gläubiger sie sind, als bekannt gemacht gilt, ihren Anspruch nach Grund und Höhe schriftlich anmelden, Sicherheit zu leisten, soweit sie nicht Befriedigung verlangen können. Dieses Recht steht den Gläubigern jedoch nur zu, wenn sie glaubhaft machen, dass durch die Ausgliederung die Erfüllung ihrer Forderung gefährdet wird. Das Recht, Sicherheitsleistung zu verlangen, steht Gläubigern nicht zu, die im Falle der Insolvenz ein Recht auf vorzugsweise Befriedigung aus einer Deckungsmasse haben, die nach gesetzlicher Vorschrift zu ihrem Schutz errichtet und staatlich überwacht ist."
    },
    {
      "date": "2025-10-28",
      "id": "135537",
      "original_text": "Löschungsankündigung\nBremen Amtsgericht Bremen HRB 20760\nMarkus Mettel GmbH – Bremen",
      "type": "Löschungsankündigung",
      "state": "Bremen",
      "amtsgericht": "Amtsgericht Bremen",
      "registernummer": "HRB 20760",
      "registerart": "HRB",
      "company_name": "Markus Mettel GmbH",
      "company_seat": "Bremen",
      "details": "28.10.2025 (Bekanntmachungsdatum)\n\nBremen Amtsgericht Bremen HRB 20760\nLöschungsankündigung\n\nMarkus Mettel GmbH\nGesellschaft mit beschränkter Haftung\nBremen\n\nEs ist beabsichtigt die im Handelsregister eingetragene Gesellschaft von Amts wegen gemäß § 394 FamFG zu löschen. Gegen die Löschung kann beim AG Bremen schriftlich oder zu Protokoll der Geschäftsstelle Widerspruch eingelegt werden. Widerspruchsfrist 4 Wochen."
    },
    {
      "date": "2025-10-28",
      "id": "135538",
      "original_text": "Sonstige Registerbekanntmachung\nRheinland-Pfalz Amtsgericht Wittlich HRB 32167\nAxel Tücks GmbH – Prüm",
      "type": "Sonstige Registerbekanntmachung",
      "state": "Rheinland-Pfalz",
      "amtsgericht": "Amtsgericht Wittlich",
      "registernummer": "HRB 32167",
      "registerart": "HRB",
      "company_name": "Axel Tücks GmbH",
      "company_seat": "Prüm",
      "details": "28.10.2025 (Bekanntmachungsdatum)\n\nRheinland-Pfalz Amtsgericht Wittlich HRB 32167\nSonstige Registerbekanntmachung 28.10.2025 (Eintragungsdatum)\n\nAxel Tücks GmbH\nGesellschaft mit beschränkter Haftung\nPrüm\n\nAls nicht eingetragen wird veröffentlicht: Den Gläubigern der Gesellschaft, deren Forderungen begründet worden sind, bevor die Eintragung der Beendigung des Gewinnabführungsvertrages in das Handelsregister nach § 10 des Handelsgesetzbuches als bekanntgemacht gilt, hat der andere Vertragsteil Sicherheit zu leisten, wenn sie sich binnen sechs Monaten nach der Bekanntmachung der Eintragung zu diesem Zweck bei ihm melden."
    },
    {
      "date": "2025-10-28",
      "id": "135539",
      "original_text": "Einreichung neuer Dokumente\nRheinland-Pfalz Amtsgericht Mainz HRB 50443\nALDI Bingen Verwaltungs-SE – Bingen am Rhein",
      "type": "Einreichung neuer Dokumente",
      "state": "Rheinland-Pfalz",
      "amtsgericht": "Amtsgericht Mainz",
      "registernummer": "HRB 50443",
      "registerart": "HRB",
      "company_name": "ALDI Bingen Verwaltungs-SE",
      "company_seat": "Bingen am Rhein",
      "details": "28.10.2025 (Bekanntmachungsdatum)\n\nRheinland-Pfalz Amtsgericht Mainz HRB 50443\nEinreichung neuer Dokumente 28.10.2025 (Eintragungsdatum)\n\nALDI Bingen Verwaltungs-SE\nEuropäische Aktiengesellschaft (SE)\nBingen am Rhein\n\nDem Registergericht ist eine neue Liste der Mitglieder des Aufsichtsrates eingereicht worden."
    },
    {
      "date": "2025-10-28",
      "id": "135540",
      "original_text": "Sonstige Registerbekanntmachung\nRheinland-Pfalz Amtsgericht Wittlich HRB 44477\nCAR Avenue Autohaus GmbH – Wittlich",
      "type": "Sonstige Registerbekanntmachung",
      "state": "Rheinland-Pfalz",
      "amtsgericht": "Amtsgericht Wittlich",
      "registernummer": "HRB 44477",
      "registerart": "HRB",
      "company_name": "CAR Avenue Autohaus GmbH",
      "company_seat": "Wittlich",
      "details": "28.10.2025 (Bekanntmachungsdatum)\n\nRheinland-Pfalz Amtsgericht Wittlich HRB 44477\nSonstige Registerbekanntmachung 28.10.2025 (Eintragungsdatum)\n\nCAR Avenue Autohaus GmbH\nGesellschaft mit beschränkter Haftung\nWittlich\n\nAls nicht eingetragen wird veröffentlicht: Den Gläubigern der Gesellschaft, deren Forderungen begründet worden sind, bevor die Eintragung der Beendigung des Beherrschungs- und Gewinnabführungsvertrages in das Handelsregister nach\n§ 10 des Handelsgesetzbuches als bekanntgemacht gilt, hat der andere Vertragsteil Sicherheit zu leisten, wenn sie sich binnen sechs Monaten nach der Bekanntmachung der Eintragung zu diesem Zweck bei ihm melden."
    },
    {
      "date": "2025-10-28",
      "id": "135541",
      "original_text": "Registerbekanntmachung nach dem Umwandlungsgesetz\nRheinland-Pfalz Amtsgericht Ludwigshafen a.Rhein (Ludwigshafen) HRA 3022\nCreditreform Speyer-Ludwigshafen GmbH & Co. KG – Speyer",
      "type": "Registerbekanntmachung nach dem Umwandlungsgesetz",
      "state": "Rheinland-Pfalz",
      "amtsgericht": "Amtsgericht Ludwigshafen a.Rhein (Ludwigshafen)",
      "registernummer": "HRA 3022",
      "registerart": "HRA",
      "company_name": "Creditreform Speyer-Ludwigshafen GmbH & Co. KG",
      "company_seat": "Speyer",
      "details": "28.10.2025 (Bekanntmachungsdatum)\n\nRheinland-Pfalz Amtsgericht Ludwigshafen a.Rhein (Ludwigshafen) HRA 3022\nRegisterbekanntmachung nach dem Umwandlungsgesetz 28.10.2025 (Eintragungsdatum)\n\nCreditreform Speyer-Ludwigshafen GmbH & Co. KG\nKommanditgesellschaft\nSpeyer\n\nAls nicht eingetragen wird veröffentlicht: Den Gläubigern der an der Verschmelzung beteiligten Rechtsträger ist, wenn sie binnen sechs Monaten nach dem Tag, an dem die Eintragung der Verschmelzung in das Register des Sitzes desjenigen Rechtsträgers, dessen Gläubiger sie sind, nach § 19 Abs. 3 UmwG als bekannt gemacht gilt, ihren Anspruch nach Grund und Höhe schriftlich anmelden, Sicherheit zu leisten, soweit sie nicht Befriedigung verlangen können. Dieses Recht steht den Gläubigern jedoch nur zu, wenn sie glaubhaft machen, dass durch die Verschmelzung die Erfüllung der Forderung gefährdet wird."
    },
    {
      "date": "2025-10-28",
      "id": "135542",
      "original_text": "Registerbekanntmachung nach dem Umwandlungsgesetz\nRheinland-Pfalz Amtsgericht Ludwigshafen a.Rhein (Ludwigshafen) HRA 51389\nCreditreform Speyer Skoruppa GmbH & Co. KG – Speyer",
      "type": "Registerbekanntmachung nach dem Umwandlungsgesetz",
      "state": "Rheinland-Pfalz",
      "amtsgericht": "Amtsgericht Ludwigshafen a.Rhein (Ludwigshafen)",
      "registernummer": "HRA 51389",
      "registerart": "HRA",
      "company_name": "Creditreform Speyer Skoruppa GmbH & Co. KG",
      "company_seat": "Speyer",
      "details": "28.10.2025 (Bekanntmachungsdatum)\n\nRheinland-Pfalz Amtsgericht Ludwigshafen a.Rhein (Ludwigshafen) HRA 51389\nRegisterbekanntmachung nach dem Umwandlungsgesetz 28.10.2025 (Eintragungsdatum)\n\nCreditreform Speyer Skoruppa GmbH & Co. KG\nKommanditgesellschaft\nSpeyer\n\nAls nicht eingetragen wird veröffentlicht: Den Gläubigern der an der Verschmelzung beteiligten Rechtsträger ist, wenn sie binnen sechs Monaten nach dem Tag, an dem die Eintragung der Verschmelzung in das Register des Sitzes desjenigen Rechtsträgers, dessen Gläubiger sie sind, nach § 19 Abs. 3 UmwG als bekannt gemacht gilt, ihren Anspruch nach Grund und Höhe schriftlich anmelden, Sicherheit zu leisten, soweit sie nicht Befriedigung verlangen können. Dieses Recht steht den Gläubigern jedoch nur zu, wenn sie glaubhaft machen, dass durch die Verschmelzung die Erfüllung der Forderung gefährdet wird."
    },
    {
      "date": "2025-10-28",
      "id": "135543",
      "original_text": "Löschungsankündigung\nRheinland-Pfalz Amtsgericht Montabaur HRB 26937\nProjektgesellschaft Heerstraße Bad Neuenahr mbH – Neuwied",
      "type": "Löschungsankündigung",
      "state": "Rheinland-Pfalz",
      "amtsgericht": "Amtsgericht Montabaur",
      "registernummer": "HRB 26937",
      "registerart": "HRB",
      "company_name": "Projektgesellschaft Heerstraße Bad Neuenahr mbH",
      "company_seat": "Neuwied",
      "details": "28.10.2025 (Bekanntmachungsdatum)\n\nRheinland-Pfalz Amtsgericht Montabaur HRB 26937\nLöschungsankündigung\n\nProjektgesellschaft Heerstraße Bad Neuenahr mbH\nGesellschaft mit beschränkter Haftung\nNeuwied\n\nDas Registergericht beabsichtigt die Gesellschaft von Amts wegen nach § 394 FamFG zu löschen. Die Frist zur Erhebung eines Widerspruchs ist auf einen Monat festgesetzt."
    },
    {
      "date": "2025-10-28",
      "id": "135544",
      "original_text": "Registerbekanntmachung nach dem Umwandlungsgesetz\nNordrhein-Westfalen Amtsgericht Gütersloh HRA 8663\nRichard Mangel UG (haftungsbeschränkt) & Co. KG – Rheda-Wiedenbrück",
      "type": "Registerbekanntmachung nach dem Umwandlungsgesetz",
      "state": "Nordrhein-Westfalen",
      "amtsgericht": "Amtsgericht Gütersloh",
      "registernummer": "HRA 8663",
      "registerart": "HRA",
      "company_name": "Richard Mangel UG (haftungsbeschränkt) & Co. KG",
      "company_seat": "Rheda-Wiedenbrück",
      "details": "28.10.2025 (Bekanntmachungsdatum)\n\nNordrhein-Westfalen Amtsgericht Gütersloh HRA 8663\nRegisterbekanntmachung nach dem Umwandlungsgesetz 28.10.2025 (Eintragungsdatum)\n\nRichard Mangel UG (haftungsbeschränkt) & Co. KG\nKommanditgesellschaft\nRheda-Wiedenbrück\n\nDen Gläubigern der an der Ausgliederung beteiligten Rechtsträger ist, wenn sie binnen sechs Monaten nach dem Tag, an dem die Eintragung der Ausgliederung in das Register des Sitzes desjenigen Rechtsträgers, dessen Gläubiger sie sind, nach § 19 Absatz 3 UmwG als bekanntgemacht gilt, ihren Anspruch nach Grund und Höhe schriftlich anmelden, Sicherheit zu leisten, soweit sie nicht Befriedigung verlangen können. Dieses Recht steht den Gläubigern jedoch nur zu, wenn sie glaubhaft machen, dass durch die Ausgliederung die Erfüllung ihrer Forderung gefährdet wird."
    },
    {
      "date": "2025-10-28",
      "id": "135545",
      "original_text": "Registerbekanntmachung nach dem Umwandlungsgesetz\nNordrhein-Westfalen Amtsgericht Düsseldorf HRB 110250\nSereni Bestattungen GmbH – Düsseldorf",
      "type": "Registerbekanntmachung nach dem Umwandlungsgesetz",
      "state": "Nordrhein-Westfalen",
      "amtsgericht": "Amtsgericht Düsseldorf",
      "registernummer": "HRB 110250",
      "registerart": "HRB",
      "company_name": "Sereni Bestattungen GmbH",
      "company_seat": "Düsseldorf",
      "details": "28.10.2025 (Bekanntmachungsdatum)\n\nNordrhein-Westfalen Amtsgericht Düsseldorf HRB 110250\nRegisterbekanntmachung nach dem Umwandlungsgesetz 28.10.2025 (Eintragungsdatum)\n\nSereni Bestattungen GmbH\nGesellschaft mit beschränkter Haftung\nDüsseldorf\n\nDen Gläubigern der an der Verschmelzung beteiligten Rechtsträger ist, wenn sie binnen sechs Monaten nach dem Tag, an dem die Eintragung der Verschmelzung in das Register des Sitzes desjenigen Rechtsträgers, dessen Gläubiger sie sind, nach § 19 Absatz 3 UmwG als bekanntgemacht gilt, ihren Anspruch nach Grund und Höhe schriftlich anmelden, Sicherheit zu leisten, soweit sie nicht Befriedigung verlangen können. Dieses Recht steht den Gläubigern jedoch nur zu, wenn sie glaubhaft machen, dass durch die Verschmelzung die Erfüllung ihrer Forderung gefährdet wird."
    },
    {
      "date": "2025-10-28",
      "id": "135546",
      "original_text": "Einreichung neuer Dokumente\nNordrhein-Westfalen Amtsgericht Bonn HRB 8184\nWohnbau Service Bonn GmbH – Bonn",
      "type": "Einreichung neuer Dokumente",
      "state": "Nordrhein-Westfalen",
      "amtsgericht": "Amtsgericht Bonn",
      "registernummer": "HRB 8184",
      "registerart": "HRB",
      "company_name": "Wohnbau Service Bonn GmbH",
      "company_seat": "Bonn",
      "details": "28.10.2025 (Bekanntmachungsdatum)\n\nNordrhein-Westfalen Amtsgericht Bonn HRB 8184\nEinreichung neuer Dokumente\n\nWohnbau Service Bonn GmbH\nGesellschaft mit beschränkter Haftung\nBonn\n\nDem Registergericht ist eine neue Liste der Mitglieder des Aufsichtsrates eingereicht worden."
    },
    {
      "date": "2025-10-28",
      "id": "135547",
      "original_text": "Registerbekanntmachung nach dem Umwandlungsgesetz\nNordrhein-Westfalen Amtsgericht Hamm HRB 8905\nBronk Schaumbetontechnologie GmbH – Hamm",
      "type": "Registerbekanntmachung nach dem Umwandlungsgesetz",
      "state": "Nordrhein-Westfalen",
      "amtsgericht": "Amtsgericht Hamm",
      "registernummer": "HRB 8905",
      "registerart": "HRB",
      "company_name": "Bronk Schaumbetontechnologie GmbH",
      "company_seat": "Hamm",
      "details": "28.10.2025 (Bekanntmachungsdatum)\n\nNordrhein-Westfalen Amtsgericht Hamm HRB 8905\nRegisterbekanntmachung nach dem Umwandlungsgesetz 28.10.2025 (Eintragungsdatum)\n\nBronk Schaumbetontechnologie GmbH\nGesellschaft mit beschränkter Haftung\nHamm\n\nDen Gläubigern der an der Verschmelzung beteiligten Rechtsträger ist, wenn sie binnen sechs Monaten nach dem Tag, an dem die Eintragung der Verschmelzung in das Register des Sitzes derjenigen Rechtsträger deren Gläubiger sie sind, nach § 19 Absatz 3 UmwG als bekanntgemacht gilt, ihren Anspruch nach Grund und Höhe schriftlich anmelden, Sicherheit zu leisten, soweit sie nicht Befriedigung verlangen können. Dieses Recht steht den Gläubigern jedoch nur zu, wenn sie glaubhaft machen, dass durch die Verschmelzung die Erfüllung ihrer Forderung gefährdet wird."
    },
    {
      "date": "2025-10-28",
      "id": "135548",
      "original_text": "Registerbekanntmachung nach dem Umwandlungsgesetz\nNordrhein-Westfalen Amtsgericht Köln HRB 125279\nPakt - Visual Services GmbH – Köln",
      "type": "Registerbekanntmachung nach dem Umwandlungsgesetz",
      "state": "Nordrhein-Westfalen",
      "amtsgericht": "Amtsgericht Köln",
      "registernummer": "HRB 125279",
      "registerart": "HRB",
      "company_name": "Pakt - Visual Services GmbH",
      "company_seat": "Köln",
      "details": "28.10.2025 (Bekanntmachungsdatum)\n\nNordrhein-Westfalen Amtsgericht Köln HRB 125279\nRegisterbekanntmachung nach dem Umwandlungsgesetz 28.10.2025 (Eintragungsdatum)\n\nPakt - Visual Services GmbH\nGesellschaft mit beschränkter Haftung\nKöln\n\nDen Gläubigern der an der formwechselnden Umwandlung beteiligten Rechtsträger ist, wenn sie binnen sechs Monaten nach dem Tag, an dem die Eintragung der formwechselnden Umwandlung in das Register des Sitzes desjenigen Rechtsträgers, dessen Gläubiger sie sind, nach § 19 Absatz 3 UmwG als bekanntgemacht gilt, ihren Anspruch nach Grund und Höhe schriftlich anmelden, Sicherheit zu leisten, soweit sie nicht Befriedigung verlangen können. Dieses Recht steht den Gläubigern jedoch nur zu, wenn sie glaubhaft machen, dass durch die formwechselnden Umwandlung die Erfüllung ihrer Forderung gefährdet wird."
    },
    {
      "date": "2025-10-28",
      "id": "135549",
      "original_text": "Registerbekanntmachung nach dem Umwandlungsgesetz\nNordrhein-Westfalen Amtsgericht Paderborn HRB 17718\nsewikom Netzbau GmbH – Beverungen",
      "type": "Registerbekanntmachung nach dem Umwandlungsgesetz",
      "state": "Nordrhein-Westfalen",
      "amtsgericht": "Amtsgericht Paderborn",
      "registernummer": "HRB 17718",
      "registerart": "HRB",
      "company_name": "sewikom Netzbau GmbH",
      "company_seat": "Beverungen",
      "details": "28.10.2025 (Bekanntmachungsdatum)\n\nNordrhein-Westfalen Amtsgericht Paderborn HRB 17718\nRegisterbekanntmachung nach dem Umwandlungsgesetz 28.10.2025 (Eintragungsdatum)\n\nsewikom Netzbau GmbH\nGesellschaft mit beschränkter Haftung\nBeverungen\n\nDen Gläubigern der an der Verschmelzung beteiligten Rechtsträger ist, wenn sie binnen sechs Monaten nach dem Tag, an dem die Eintragung der Verschmelzung in das Register des Sitzes desjenigen Rechtsträgers, dessen Gläubiger sie sind, nach § 19 Absatz 3 UmwG als bekanntgemacht gilt, ihren Anspruch nach Grund und Höhe schriftlich anmelden, Sicherheit zu leisten, soweit sie nicht Befriedigung verlangen können. Dieses Recht steht den Gläubigern jedoch nur zu, wenn sie glaubhaft machen, dass durch die Verschmelzung die Erfüllung ihrer Forderung gefährdet wird."
    },
    {
      "date": "2025-10-28",
      "id": "135550",
      "original_text": "Einreichung neuer Dokumente\nNordrhein-Westfalen Amtsgericht Düsseldorf HRB 81079\nDeutsch-Muslimische Bildung und Wohlfahrt gAG – Düsseldorf",
      "type": "Einreichung neuer Dokumente",
      "state": "Nordrhein-Westfalen",
      "amtsgericht": "Amtsgericht Düsseldorf",
      "registernummer": "HRB 81079",
      "registerart": "HRB",
      "company_name": "Deutsch-Muslimische Bildung und Wohlfahrt gAG",
      "company_seat": "Düsseldorf",
      "details": "28.10.2025 (Bekanntmachungsdatum)\n\nNordrhein-Westfalen Amtsgericht Düsseldorf HRB 81079\nEinreichung neuer Dokumente\n\nDeutsch-Muslimische Bildung und Wohlfahrt gAG\nAktiengesellschaft\nDüsseldorf\n\nDem Registergericht ist eine Liste der Mitglieder des Aufsichtsrates eingereicht worden."
    },
    {
      "date": "2025-10-28",
      "id": "135551",
      "original_text": "Einreichung neuer Dokumente\nNordrhein-Westfalen Amtsgericht Köln HRB 106124\nALDI Kerpen Verwaltungs-SE – Kerpen",
      "type": "Einreichung neuer Dokumente",
      "state": "Nordrhein-Westfalen",
      "amtsgericht": "Amtsgericht Köln",
      "registernummer": "HRB 106124",
      "registerart": "HRB",
      "company_name": "ALDI Kerpen Verwaltungs-SE",
      "company_seat": "Kerpen",
      "details": "28.10.2025 (Bekanntmachungsdatum)\n\nNordrhein-Westfalen Amtsgericht Köln HRB 106124\nEinreichung neuer Dokumente\n\nALDI Kerpen Verwaltungs-SE\nEuropäische Aktiengesellschaft (SE)\nKerpen\n\nDem Registergericht ist eine neue Liste der Mitglieder des Aufsichtsrates eingereicht worden."
    },
    {
      "date": "2025-10-28",
      "id": "135552",
      "original_text": "Registerbekanntmachung nach dem Umwandlungsgesetz\nNordrhein-Westfalen Amtsgericht Hamm HRB 6004\nRhenus Archiv Services GmbH – Holzwickede",
      "type": "Registerbekanntmachung nach dem Umwandlungsgesetz",
      "state": "Nordrhein-Westfalen",
      "amtsgericht": "Amtsgericht Hamm",
      "registernummer": "HRB 6004",
      "registerart": "HRB",
      "company_name": "Rhenus Archiv Services GmbH",
      "company_seat": "Holzwickede",
      "details": "28.10.2025 (Bekanntmachungsdatum)\n\nNordrhein-Westfalen Amtsgericht Hamm HRB 6004\nRegisterbekanntmachung nach dem Umwandlungsgesetz 28.10.2025 (Eintragungsdatum)\n\nRhenus Archiv Services GmbH\nGesellschaft mit beschränkter Haftung\nHolzwickede\n\nDen Gläubigern der an der Abspaltung beteiligten Rechtsträger ist, wenn sie binnen sechs Monaten nach dem Tag, an dem die Eintragung der Abspaltung in das Register des Sitzes derjenigen Rechtsträger deren Gläubiger sie sind, nach § 19 Absatz 3 UmwG als bekanntgemacht gilt, ihren Anspruch nach Grund und Höhe schriftlich anmelden, Sicherheit zu leisten, soweit sie nicht Befriedigung verlangen können. Dieses Recht steht den Gläubigern jedoch nur zu, wenn sie glaubhaft machen, dass durch die Abspaltung die Erfüllung ihrer Forderung gefährdet wird."
    },
    {
      "date": "2025-10-28",
      "id": "135553",
      "original_text": "Registerbekanntmachung nach dem Umwandlungsgesetz\nNordrhein-Westfalen Amtsgericht Krefeld HRB 14800\nToyo Tire Deutschland GmbH – Willich",
      "type": "Registerbekanntmachung nach dem Umwandlungsgesetz",
      "state": "Nordrhein-Westfalen",
      "amtsgericht": "Amtsgericht Krefeld",
      "registernummer": "HRB 14800",
      "registerart": "HRB",
      "company_name": "Toyo Tire Deutschland GmbH",
      "company_seat": "Willich",
      "details": "28.10.2025 (Bekanntmachungsdatum)\n\nNordrhein-Westfalen Amtsgericht Krefeld HRB 14800\nRegisterbekanntmachung nach dem Umwandlungsgesetz\n\nToyo Tire Deutschland GmbH\nGesellschaft mit beschränkter Haftung\nWillich\n\nDen Gläubigern der an der Verschmelzung beteiligten Rechtsträger ist, wenn sie binnen sechs Monaten nach dem Tag, an dem die Eintragung der Verschmelzung in das Register des Sitzes desjenigen Rechtsträgers, dessen Gläubiger sie sind, nach § 19 Absatz 3 UmwG als bekanntgemacht gilt, ihren Anspruch nach Grund und Höhe schriftlich anmelden, Sicherheit zu leisten, soweit sie nicht Befriedigung verlangen können. Dieses Recht steht den Gläubigern jedoch nur zu, wenn sie glaubhaft machen, dass durch die Verschmelzung die Erfüllung ihrer Forderung gefährdet wird."
    },
    {
      "date": "2025-10-28",
      "id": "135554",
      "original_text": "Registerbekanntmachung nach dem Umwandlungsgesetz\nNordrhein-Westfalen Amtsgericht Essen PR 3536\nHANSA Steuerberatung Dobler & Partner mbB Wirtschaftsprüfer Steuerberater – Köln",
      "type": "Registerbekanntmachung nach dem Umwandlungsgesetz",
      "state": "Nordrhein-Westfalen",
      "amtsgericht": "Amtsgericht Essen",
      "registernummer": "PR 3536",
      "registerart": "PR",
      "company_name": "HANSA Steuerberatung Dobler & Partner mbB Wirtschaftsprüfer Steuerberater",
      "company_seat": "Köln",
      "details": "28.10.2025 (Bekanntmachungsdatum)\n\nNordrhein-Westfalen Amtsgericht Essen PR 3536\nRegisterbekanntmachung nach dem Umwandlungsgesetz 28.10.2025 (Eintragungsdatum)\n\nHANSA Steuerberatung Dobler & Partner mbB Wirtschaftsprüfer Steuerberater\nPartnerschaftsgesellschaft\nKöln\n\nDen Gläubigern der an der Verschmelzung beteiligten Rechtsträger ist, wenn sie binnen sechs Monaten nach dem Tag, an dem die Eintragung der Verschmelzung in das Register des Sitzes desjenigen Rechtsträgers, dessen Gläubiger sie sind, nach § 19 Absatz 3 UmwG als bekanntgemacht gilt, ihren Anspruch nach Grund und Höhe schriftlich anmelden, Sicherheit zu leisten, soweit sie nicht Befriedigung verlangen können. Dieses Recht steht den Gläubigern jedoch nur zu, wenn sie glaubhaft machen, dass durch die Verschmelzung die Erfüllung ihrer Forderung gefährdet wird."
    },
    {
      "date": "2025-10-28",
      "id": "135555",
      "original_text": "Registerbekanntmachung nach dem Umwandlungsgesetz\nNordrhein-Westfalen Amtsgericht Münster HRA 4220\nMünsterländische Medien Service GmbH & Co. Kommanditgesellschaft – Münster",
      "type": "Registerbekanntmachung nach dem Umwandlungsgesetz",
      "state": "Nordrhein-Westfalen",
      "amtsgericht": "Amtsgericht Münster",
      "registernummer": "HRA 4220",
      "registerart": "HRA",
      "company_name": "Münsterländische Medien Service GmbH & Co. Kommanditgesellschaft",
      "company_seat": "Münster",
      "details": "28.10.2025 (Bekanntmachungsdatum)\n\nNordrhein-Westfalen Amtsgericht Münster HRA 4220\nRegisterbekanntmachung nach dem Umwandlungsgesetz 28.10.2025 (Eintragungsdatum)\n\nMünsterländische Medien Service GmbH & Co. Kommanditgesellschaft\nKommanditgesellschaft\nMünster\n\nDen Gläubigern der an der Verschmelzung beteiligten Rechtsträger ist, wenn sie binnen sechs Monaten nach dem Tag, an dem die Eintragung der Verschmelzung in das Register des Sitzes desjenigen Rechtsträgers, dessen Gläubiger sie sind, nach § 19 Absatz 3 UmwG als bekanntgemacht gilt, ihren Anspruch nach Grund und Höhe schriftlich anmelden, Sicherheit zu leisten, soweit sie nicht Befriedigung verlangen können. Dieses Recht steht den Gläubigern jedoch nur zu, wenn sie glaubhaft machen, dass durch die Verschmelzung die Erfüllung ihrer Forderung gefährdet wird."
    },
    {
      "date": "2025-10-28",
      "id": "135556",
      "original_text": "Registerbekanntmachung nach dem Umwandlungsgesetz\nNordrhein-Westfalen Amtsgericht Düsseldorf HRB 110250\nSereni Bestattungen GmbH – Düsseldorf",
      "type": "Registerbekanntmachung nach dem Umwandlungsgesetz",
      "state": "Nordrhein-Westfalen",
      "amtsgericht": "Amtsgericht Düsseldorf",
      "registernummer": "HRB 110250",
      "registerart": "HRB",
      "company_name": "Sereni Bestattungen GmbH",
      "company_seat": "Düsseldorf",
      "details": "28.10.2025 (Bekanntmachungsdatum)\n\nNordrhein-Westfalen Amtsgericht Düsseldorf HRB 110250\nRegisterbekanntmachung nach dem Umwandlungsgesetz 28.10.2025 (Eintragungsdatum)\n\nSereni Bestattungen GmbH\nGesellschaft mit beschränkter Haftung\nDüsseldorf\n\nDen Gläubigern der an der Verschmelzung beteiligten Rechtsträger ist, wenn sie binnen sechs Monaten nach dem Tag, an dem die Eintragung der Verschmelzung in das Register des Sitzes desjenigen Rechtsträgers, dessen Gläubiger sie sind, nach § 19 Absatz 3 UmwG als bekanntgemacht gilt, ihren Anspruch nach Grund und Höhe schriftlich anmelden, Sicherheit zu leisten, soweit sie nicht Befriedigung verlangen können. Dieses Recht steht den Gläubigern jedoch nur zu, wenn sie glaubhaft machen, dass durch die Verschmelzung die Erfüllung ihrer Forderung gefährdet wird."
    },
    {
      "date": "2025-10-28",
      "id": "135557",
      "original_text": "Registerbekanntmachung nach dem Umwandlungsgesetz\nNordrhein-Westfalen Amtsgericht Düsseldorf HRB 110250\nSereni Bestattungen GmbH – Düsseldorf",
      "type": "Registerbekanntmachung nach dem Umwandlungsgesetz",
      "state": "Nordrhein-Westfalen",
      "amtsgericht": "Amtsgericht Düsseldorf",
      "registernummer": "HRB 110250",
      "registerart": "HRB",
      "company_name": "Sereni Bestattungen GmbH",
      "company_seat": "Düsseldorf",
      "details": "28.10.2025 (Bekanntmachungsdatum)\n\nNordrhein-Westfalen Amtsgericht Düsseldorf HRB 110250\nRegisterbekanntmachung nach dem Umwandlungsgesetz 28.10.2025 (Eintragungsdatum)\n\nSereni Bestattungen GmbH\nGesellschaft mit beschränkter Haftung\nDüsseldorf\n\nDen Gläubigern der an der Verschmelzung beteiligten Rechtsträger ist, wenn sie binnen sechs Monaten nach dem Tag, an dem die Eintragung der Verschmelzung in das Register des Sitzes desjenigen Rechtsträgers, dessen Gläubiger sie sind, nach § 19 Absatz 3 UmwG als bekanntgemacht gilt, ihren Anspruch nach Grund und Höhe schriftlich anmelden, Sicherheit zu leisten, soweit sie nicht Befriedigung verlangen können. Dieses Recht steht den Gläubigern jedoch nur zu, wenn sie glaubhaft machen, dass durch die Verschmelzung die Erfüllung ihrer Forderung gefährdet wird."
    },
    {
      "date": "2025-10-28",
      "id": "135558",
      "original_text": "Registerbekanntmachung nach dem Umwandlungsgesetz\nNordrhein-Westfalen Amtsgericht Düsseldorf HRB 110250\nSereni Bestattungen GmbH – Düsseldorf",
      "type": "Registerbekanntmachung nach dem Umwandlungsgesetz",
      "state": "Nordrhein-Westfalen",
      "amtsgericht": "Amtsgericht Düsseldorf",
      "registernummer": "HRB 110250",
      "registerart": "HRB",
      "company_name": "Sereni Bestattungen GmbH",
      "company_seat": "Düsseldorf",
      "details": "28.10.2025 (Bekanntmachungsdatum)\n\nNordrhein-Westfalen Amtsgericht Düsseldorf HRB 110250\nRegisterbekanntmachung nach dem Umwandlungsgesetz 28.10.2025 (Eintragungsdatum)\n\nSereni Bestattungen GmbH\nGesellschaft mit beschränkter Haftung\nDüsseldorf\n\nDen Gläubigern der an der Verschmelzung beteiligten Rechtsträger ist, wenn sie binnen sechs Monaten nach dem Tag, an dem die Eintragung der Verschmelzung in das Register des Sitzes desjenigen Rechtsträgers, dessen Gläubiger sie sind, nach § 19 Absatz 3 UmwG als bekanntgemacht gilt, ihren Anspruch nach Grund und Höhe schriftlich anmelden, Sicherheit zu leisten, soweit sie nicht Befriedigung verlangen können. Dieses Recht steht den Gläubigern jedoch nur zu, wenn sie glaubhaft machen, dass durch die Verschmelzung die Erfüllung ihrer Forderung gefährdet wird."
    },
    {
      "date": "2025-10-28",
      "id": "135559",
      "original_text": "Registerbekanntmachung nach dem Umwandlungsgesetz\nNordrhein-Westfalen Amtsgericht Kleve HRA 1452\nbofrost* Dienstleistungs GmbH & Co. KG – Straelen",
      "type": "Registerbekanntmachung nach dem Umwandlungsgesetz",
      "state": "Nordrhein-Westfalen",
      "amtsgericht": "Amtsgericht Kleve",
      "registernummer": "HRA 1452",
      "registerart": "HRA",
      "company_name": "bofrost* Dienstleistungs GmbH & Co. KG",
      "company_seat": "Straelen",
      "details": "28.10.2025 (Bekanntmachungsdatum)\n\nNordrhein-Westfalen Amtsgericht Kleve HRA 1452\nRegisterbekanntmachung nach dem Umwandlungsgesetz 28.10.2025 (Eintragungsdatum)\n\nbofrost* Dienstleistungs GmbH & Co. KG\nKommanditgesellschaft\nStraelen"
    },
    {
      "date": "2025-10-28",
      "id": "135560",
      "original_text": "Registerbekanntmachung nach dem Umwandlungsgesetz\nNordrhein-Westfalen Amtsgericht Siegburg HRA 7218\nRed Line Vintages e.K. – Much",
      "type": "Registerbekanntmachung nach dem Umwandlungsgesetz",
      "state": "Nordrhein-Westfalen",
      "amtsgericht": "Amtsgericht Siegburg",
      "registernummer": "HRA 7218",
      "registerart": "HRA",
      "company_name": "Red Line Vintages e.K.",
      "company_seat": "Much",
      "details": "28.10.2025 (Bekanntmachungsdatum)\n\nNordrhein-Westfalen Amtsgericht Siegburg HRA 7218\nRegisterbekanntmachung nach dem Umwandlungsgesetz 28.10.2025 (Eintragungsdatum)\n\nRed Line Vintages e.K.\nEinzelkaufmann / Einzelkauffrau\nMuch\n\nDen Gläubigern der an der Verschmelzung beteiligten Rechtsträger ist, wenn sie binnen sechs Monaten nach dem Tag, an dem die Eintragung der Verschmelzung in das Register des Sitzes desjenigen Rechtsträgers, dessen Gläubiger sie sind, nach § 19 Absatz 3 UmwG als bekanntgemacht gilt, ihren Anspruch nach Grund und Höhe schriftlich anmelden, Sicherheit zu leisten, soweit sie nicht Befriedigung verlangen können. Dieses Recht steht den Gläubigern jedoch nur zu, wenn sie glaubhaft machen, dass durch die Verschmelzung die Erfüllung ihrer Forderung gefährdet wird."
    },
    {
      "date": "2025-10-28",
      "id": "135561",
      "original_text": "Registerbekanntmachung nach dem Umwandlungsgesetz\nNordrhein-Westfalen Amtsgericht Essen PR 5761\nDr. Ostermann & Rüter Rechtsanwälte PartG mbB – Bünde",
      "type": "Registerbekanntmachung nach dem Umwandlungsgesetz",
      "state": "Nordrhein-Westfalen",
      "amtsgericht": "Amtsgericht Essen",
      "registernummer": "PR 5761",
      "registerart": "PR",
      "company_name": "Dr. Ostermann & Rüter Rechtsanwälte PartG mbB",
      "company_seat": "Bünde",
      "details": "28.10.2025 (Bekanntmachungsdatum)\n\nNordrhein-Westfalen Amtsgericht Essen PR 5761\nRegisterbekanntmachung nach dem Umwandlungsgesetz 28.10.2025 (Eintragungsdatum)\n\nDr. Ostermann & Rüter Rechtsanwälte PartG mbB\nPartnerschaftsgesellschaft\nBünde\n\nDen Gläubigern der an der formwechselnden Umwandlung beteiligten Rechtsträger ist, wenn sie binnen sechs Monaten nach dem Tag, an dem die Eintragung der formwechselnden Umwandlung in das Register des Sitzes desjenigen Rechtsträgers, dessen Gläubiger sie sind, nach § 19 Absatz 3 UmwG als bekanntgemacht gilt, ihren Anspruch nach Grund und Höhe schriftlich anmelden, Sicherheit zu leisten, soweit sie nicht Befriedigung verlangen können. Dieses Recht steht den Gläubigern jedoch nur zu, wenn sie glaubhaft machen, dass durch die formwechselnden Umwandlung die Erfüllung ihrer Forderung gefährdet wird."
    },
    {
      "date": "2025-10-28",
      "id": "135562",
      "original_text": "Registerbekanntmachung nach dem Umwandlungsgesetz\nNordrhein-Westfalen Amtsgericht Düsseldorf HRB 110250\nSereni Bestattungen GmbH – Düsseldorf",
      "type": "Registerbekanntmachung nach dem Umwandlungsgesetz",
      "state": "Nordrhein-Westfalen",
      "amtsgericht": "Amtsgericht Düsseldorf",
      "registernummer": "HRB 110250",
      "registerart": "HRB",
      "company_name": "Sereni Bestattungen GmbH",
      "company_seat": "Düsseldorf",
      "details": "28.10.2025 (Bekanntmachungsdatum)\n\nNordrhein-Westfalen Amtsgericht Düsseldorf HRB 110250\nRegisterbekanntmachung nach dem Umwandlungsgesetz 28.10.2025 (Eintragungsdatum)\n\nSereni Bestattungen GmbH\nGesellschaft mit beschränkter Haftung\nDüsseldorf\n\nDen Gläubigern der an der Verschmelzung beteiligten Rechtsträger ist, wenn sie binnen sechs Monaten nach dem Tag, an dem die Eintragung der Verschmelzung in das Register des Sitzes desjenigen Rechtsträgers, dessen Gläubiger sie sind, nach § 19 Absatz 3 UmwG als bekanntgemacht gilt, ihren Anspruch nach Grund und Höhe schriftlich anmelden, Sicherheit zu leisten, soweit sie nicht Befriedigung verlangen können. Dieses Recht steht den Gläubigern jedoch nur zu, wenn sie glaubhaft machen, dass durch die Verschmelzung die Erfüllung ihrer Forderung gefährdet wird."
    },
    {
      "date": "2025-10-28",
      "id": "135563",
      "original_text": "Löschungsankündigung\nNordrhein-Westfalen Amtsgericht Kleve HRB 15217\nWienesen Trockenbauarbeiten UG (haftungsbeschränkt) – Kalkar",
      "type": "Löschungsankündigung",
      "state": "Nordrhein-Westfalen",
      "amtsgericht": "Amtsgericht Kleve",
      "registernummer": "HRB 15217",
      "registerart": "HRB",
      "company_name": "Wienesen Trockenbauarbeiten UG (haftungsbeschränkt)",
      "company_seat": "Kalkar",
      "details": "28.10.2025 (Bekanntmachungsdatum)\n\nNordrhein-Westfalen Amtsgericht Kleve HRB 15217\nLöschungsankündigung\n\nWienesen Trockenbauarbeiten UG (haftungsbeschränkt)\nGesellschaft mit beschränkter Haftung\nKalkar\n\nDas Registergericht beabsichtigt die Gesellschaft von Amts wegen nach § 394 FamFG zu löschen. Die Frist zur Erhebung eines Widerspruchs ist auf einen Monat festgesetzt."
    },
    {
      "date": "2025-10-28",
      "id": "135564",
      "original_text": "Registerbekanntmachung nach dem Umwandlungsgesetz\nNordrhein-Westfalen Amtsgericht Düsseldorf HRB 110250\nSereni Bestattungen GmbH – Düsseldorf",
      "type": "Registerbekanntmachung nach dem Umwandlungsgesetz",
      "state": "Nordrhein-Westfalen",
      "amtsgericht": "Amtsgericht Düsseldorf",
      "registernummer": "HRB 110250",
      "registerart": "HRB",
      "company_name": "Sereni Bestattungen GmbH",
      "company_seat": "Düsseldorf",
      "details": "28.10.2025 (Bekanntmachungsdatum)\n\nNordrhein-Westfalen Amtsgericht Düsseldorf HRB 110250\nRegisterbekanntmachung nach dem Umwandlungsgesetz 28.10.2025 (Eintragungsdatum)\n\nSereni Bestattungen GmbH\nGesellschaft mit beschränkter Haftung\nDüsseldorf\n\nDen Gläubigern der an der Verschmelzung beteiligten Rechtsträger ist, wenn sie binnen sechs Monaten nach dem Tag, an dem die Eintragung der Verschmelzung in das Register des Sitzes desjenigen Rechtsträgers, dessen Gläubiger sie sind, nach § 19 Absatz 3 UmwG als bekanntgemacht gilt, ihren Anspruch nach Grund und Höhe schriftlich anmelden, Sicherheit zu leisten, soweit sie nicht Befriedigung verlangen können. Dieses Recht steht den Gläubigern jedoch nur zu, wenn sie glaubhaft machen, dass durch die Verschmelzung die Erfüllung ihrer Forderung gefährdet wird."
    },
    {
      "date": "2025-10-28",
      "id": "135565",
      "original_text": "Einreichung neuer Dokumente\nNordrhein-Westfalen Amtsgericht Essen HRB 37039\nTKMS AG & Co. KGaA – Essen",
      "type": "Einreichung neuer Dokumente",
      "state": "Nordrhein-Westfalen",
      "amtsgericht": "Amtsgericht Essen",
      "registernummer": "HRB 37039",
      "registerart": "HRB",
      "company_name": "TKMS AG & Co. KGaA",
      "company_seat": "Essen",
      "details": "28.10.2025 (Bekanntmachungsdatum)\n\nNordrhein-Westfalen Amtsgericht Essen HRB 37039\nEinreichung neuer Dokumente\n\nTKMS AG & Co. KGaA\nKommanditgesellschaft auf Aktien\nEssen\n\nDem Registergericht ist eine neue Liste der Mitglieder des Aufsichtsrates eingereicht worden."
    },
    {
      "date": "2025-10-28",
      "id": "135566",
      "original_text": "Löschungsankündigung\nNordrhein-Westfalen Amtsgericht Siegburg HRB 15968\nCvetkovic UG (haftungsbeschränkt) – Niederkassel",
      "type": "Löschungsankündigung",
      "state": "Nordrhein-Westfalen",
      "amtsgericht": "Amtsgericht Siegburg",
      "registernummer": "HRB 15968",
      "registerart": "HRB",
      "company_name": "Cvetkovic UG (haftungsbeschränkt)",
      "company_seat": "Niederkassel",
      "details": "28.10.2025 (Bekanntmachungsdatum)\n\nNordrhein-Westfalen Amtsgericht Siegburg HRB 15968\nLöschungsankündigung\n\nCvetkovic UG (haftungsbeschränkt)\nGesellschaft mit beschränkter Haftung\nNiederkassel\n\nDas Registergericht hat glaubhafte Kenntnis erlangt, dass die Gesellschaft vermögenslos geworden ist, da ein Insolvenzeröffnungsantrag mangels Masse nach § 26 InsO zurückgewiesen wurde.\n\nEs ist daher beabsichtigt, die Gesellschaft nach § 394 FamFG im Handelsregister wegen Vermögenslosigkeit zu löschen.\nEinwände gegen die Löschung sind durch Widerspruch binnen einer Frist von 3 Monaten geltend zu machen, andernfalls die Löschung erfolgen wird.\n\nEinzulegen ist der Widerspruch bei dem Amtsgericht Siegburg, Neue Poststraße 16, 53721 Siegburg, und zwar entweder schriftlich in deutscher Sprache oder mündlich zur Niederschrift der Geschäftsstelle. Der Widerspruch kann auch zur Niederschrift der Geschäftsstelle eines jeden Amtsgerichts abgegeben werden. Der Widerspruch ist binnen der in der Verfügung bestimmten Frist einzulegen. Die Frist ist nur gewahrt, wenn der Widerspruch rechtzeitig bei dem Amtsgericht Siegburg eingeht, auch wenn der Widerspruch zur Niederschrift der Geschäftsstelle eines anderen Amtsgerichts abgegeben wurde. Die Frist beginnt jeweils mit der schriftlichen Bekanntgabe der Verfügung an die Beteiligten. Kann die schriftliche Bekanntgabe an einen Beteiligten nicht bewirkt werden, beginnt die Frist spätestens mit Ablauf von fünf Monaten nach Erlass der Verfügung. Die Bekanntgabe ist entweder durch Zustellung oder am dritten Tage nach Aufgabe zur Post bewirkt. Sofern die Löschung noch nicht erfolgt ist, kann der Widerspruch auch noch nach Ablauf der Frist eingelegt werden. Fällt das Ende der Frist auf einen Sonnabend, einen Sonntag oder einen allgemeinen Feiertag, endet die Frist mit Ablauf des nächsten Werktages. Der Widerspruch ist zu unterzeichnen. Eine Begründung des Widerspruchs ist nicht vorgeschrieben."
    },
    {
      "date": "2025-10-28",
      "id": "135567",
      "original_text": "Registerbekanntmachung nach dem Umwandlungsgesetz\nNordrhein-Westfalen Amtsgericht Düsseldorf HRB 110250\nSereni Bestattungen GmbH – Düsseldorf",
      "type": "Registerbekanntmachung nach dem Umwandlungsgesetz",
      "state": "Nordrhein-Westfalen",
      "amtsgericht": "Amtsgericht Düsseldorf",
      "registernummer": "HRB 110250",
      "registerart": "HRB",
      "company_name": "Sereni Bestattungen GmbH",
      "company_seat": "Düsseldorf",
      "details": "28.10.2025 (Bekanntmachungsdatum)\n\nNordrhein-Westfalen Amtsgericht Düsseldorf HRB 110250\nRegisterbekanntmachung nach dem Umwandlungsgesetz 28.10.2025 (Eintragungsdatum)\n\nSereni Bestattungen GmbH\nGesellschaft mit beschränkter Haftung\nDüsseldorf\n\nDen Gläubigern der an der Verschmelzung beteiligten Rechtsträger ist, wenn sie binnen sechs Monaten nach dem Tag, an dem die Eintragung der Verschmelzung in das Register des Sitzes desjenigen Rechtsträgers, dessen Gläubiger sie sind, nach § 19 Absatz 3 UmwG als bekanntgemacht gilt, ihren Anspruch nach Grund und Höhe schriftlich anmelden, Sicherheit zu leisten, soweit sie nicht Befriedigung verlangen können. Dieses Recht steht den Gläubigern jedoch nur zu, wenn sie glaubhaft machen, dass durch die Verschmelzung die Erfüllung ihrer Forderung gefährdet wird."
    },
    {
      "date": "2025-10-28",
      "id": "135568",
      "original_text": "Registerbekanntmachung nach dem Umwandlungsgesetz\nNordrhein-Westfalen Amtsgericht Dortmund HRA 19739\nDortmunder Trockenbau GmbH & Co. KG – Dortmund",
      "type": "Registerbekanntmachung nach dem Umwandlungsgesetz",
      "state": "Nordrhein-Westfalen",
      "amtsgericht": "Amtsgericht Dortmund",
      "registernummer": "HRA 19739",
      "registerart": "HRA",
      "company_name": "Dortmunder Trockenbau GmbH & Co. KG",
      "company_seat": "Dortmund",
      "details": "28.10.2025 (Bekanntmachungsdatum)\n\nNordrhein-Westfalen Amtsgericht Dortmund HRA 19739\nRegisterbekanntmachung nach dem Umwandlungsgesetz 28.10.2025 (Eintragungsdatum)\n\nDortmunder Trockenbau GmbH & Co. KG\nKommanditgesellschaft\nDortmund\n\nDen Gläubigern der an der Ausgliederung beteiligten Rechtsträger ist, wenn sie binnen sechs Monaten nach dem Tag, an dem die Eintragung der Ausgliederung in das Register des Sitzes desjenigen Rechtsträgers, dessen Gläubiger sie sind, nach § 19 Absatz 3 UmwG als bekanntgemacht gilt, ihren Anspruch nach Grund und Höhe schriftlich anmelden, Sicherheit zu leisten, soweit sie nicht Befriedigung verlangen können. Dieses Recht steht den Gläubigern jedoch nur zu, wenn sie glaubhaft machen, dass durch die Ausgliederung ihrer Forderung gefährdet wird."
    },
    {
      "date": "2025-10-28",
      "id": "135569",
      "original_text": "Registerbekanntmachung nach dem Umwandlungsgesetz\nNordrhein-Westfalen Amtsgericht Düsseldorf HRB 110250\nSereni Bestattungen GmbH – Düsseldorf",
      "type": "Registerbekanntmachung nach dem Umwandlungsgesetz",
      "state": "Nordrhein-Westfalen",
      "amtsgericht": "Amtsgericht Düsseldorf",
      "registernummer": "HRB 110250",
      "registerart": "HRB",
      "company_name": "Sereni Bestattungen GmbH",
      "company_seat": "Düsseldorf",
      "details": "28.10.2025 (Bekanntmachungsdatum)\n\nNordrhein-Westfalen Amtsgericht Düsseldorf HRB 110250\nRegisterbekanntmachung nach dem Umwandlungsgesetz 28.10.2025 (Eintragungsdatum)\n\nSereni Bestattungen GmbH\nGesellschaft mit beschränkter Haftung\nDüsseldorf\n\nDen Gläubigern der an der Verschmelzung beteiligten Rechtsträger ist, wenn sie binnen sechs Monaten nach dem Tag, an dem die Eintragung der Verschmelzung in das Register des Sitzes desjenigen Rechtsträgers, dessen Gläubiger sie sind, nach § 19 Absatz 3 UmwG als bekanntgemacht gilt, ihren Anspruch nach Grund und Höhe schriftlich anmelden, Sicherheit zu leisten, soweit sie nicht Befriedigung verlangen können. Dieses Recht steht den Gläubigern jedoch nur zu, wenn sie glaubhaft machen, dass durch die Verschmelzung die Erfüllung ihrer Forderung gefährdet wird."
    },
    {
      "date": "2025-10-28",
      "id": "135570",
      "original_text": "Registerbekanntmachung nach dem Umwandlungsgesetz\nNordrhein-Westfalen Amtsgericht Paderborn HRB 11988\ndean&david Paderborn GmbH – Paderborn",
      "type": "Registerbekanntmachung nach dem Umwandlungsgesetz",
      "state": "Nordrhein-Westfalen",
      "amtsgericht": "Amtsgericht Paderborn",
      "registernummer": "HRB 11988",
      "registerart": "HRB",
      "company_name": "dean&david Paderborn GmbH",
      "company_seat": "Paderborn",
      "details": "28.10.2025 (Bekanntmachungsdatum)\n\nNordrhein-Westfalen Amtsgericht Paderborn HRB 11988\nRegisterbekanntmachung nach dem Umwandlungsgesetz 28.10.2025 (Eintragungsdatum)\n\ndean&david Paderborn GmbH\nGesellschaft mit beschränkter Haftung\nPaderborn\n\nDen Gläubigern der an der Verschmelzung beteiligten Rechtsträger ist, wenn sie binnen sechs Monaten nach dem Tag, an dem die Eintragung der Verschmelzung in das Register des Sitzes desjenigen Rechtsträgers, dessen Gläubiger sie sind, nach § 19 Absatz 3 UmwG als bekanntgemacht gilt, ihren Anspruch nach Grund und Höhe schriftlich anmelden, Sicherheit zu leisten, soweit sie nicht Befriedigung verlangen können. Dieses Recht steht den Gläubigern jedoch nur zu, wenn sie glaubhaft machen, dass durch die Verschmelzung die Erfüllung ihrer Forderung gefährdet wird."
    },
    {
      "date": "2025-10-28",
      "id": "135571",
      "original_text": "Einreichung neuer Dokumente\nNordrhein-Westfalen Amtsgericht Paderborn HRB 17955\ndSPACE Group Management SE – Paderborn",
      "type": "Einreichung neuer Dokumente",
      "state": "Nordrhein-Westfalen",
      "amtsgericht": "Amtsgericht Paderborn",
      "registernummer": "HRB 17955",
      "registerart": "HRB",
      "company_name": "dSPACE Group Management SE",
      "company_seat": "Paderborn",
      "details": "28.10.2025 (Bekanntmachungsdatum)\n\nNordrhein-Westfalen Amtsgericht Paderborn HRB 17955\nEinreichung neuer Dokumente 28.10.2025 (Eintragungsdatum)\n\ndSPACE Group Management SE\nEuropäische Aktiengesellschaft (SE)\nPaderborn\n\nDem Registergericht ist eine Liste der Mitglieder des Verwaltungsrats eingereicht worden."
    },
    {
      "date": "2025-10-28",
      "id": "135572",
      "original_text": "Registerbekanntmachung nach dem Umwandlungsgesetz\nNordrhein-Westfalen Amtsgericht Düsseldorf HRB 110250\nSereni Bestattungen GmbH – Düsseldorf",
      "type": "Registerbekanntmachung nach dem Umwandlungsgesetz",
      "state": "Nordrhein-Westfalen",
      "amtsgericht": "Amtsgericht Düsseldorf",
      "registernummer": "HRB 110250",
      "registerart": "HRB",
      "company_name": "Sereni Bestattungen GmbH",
      "company_seat": "Düsseldorf",
      "details": "28.10.2025 (Bekanntmachungsdatum)\n\nNordrhein-Westfalen Amtsgericht Düsseldorf HRB 110250\nRegisterbekanntmachung nach dem Umwandlungsgesetz 28.10.2025 (Eintragungsdatum)\n\nSereni Bestattungen GmbH\nGesellschaft mit beschränkter Haftung\nDüsseldorf\n\nDen Gläubigern der an der Verschmelzung beteiligten Rechtsträger ist, wenn sie binnen sechs Monaten nach dem Tag, an dem die Eintragung der Verschmelzung in das Register des Sitzes desjenigen Rechtsträgers, dessen Gläubiger sie sind, nach § 19 Absatz 3 UmwG als bekanntgemacht gilt, ihren Anspruch nach Grund und Höhe schriftlich anmelden, Sicherheit zu leisten, soweit sie nicht Befriedigung verlangen können. Dieses Recht steht den Gläubigern jedoch nur zu, wenn sie glaubhaft machen, dass durch die Verschmelzung die Erfüllung ihrer Forderung gefährdet wird."
    },
    {
      "date": "2025-10-28",
      "id": "135573",
      "original_text": "Registerbekanntmachung nach dem Umwandlungsgesetz\nNordrhein-Westfalen Amtsgericht Gütersloh HRA 8371\nRichard Mangel, Inh. Christian Mangel e. K. – Rheda-Wiedenbrück",
      "type": "Registerbekanntmachung nach dem Umwandlungsgesetz",
      "state": "Nordrhein-Westfalen",
      "amtsgericht": "Amtsgericht Gütersloh",
      "registernummer": "HRA 8371",
      "registerart": "HRA",
      "company_name": "Richard Mangel, Inh. Christian Mangel e. K.",
      "company_seat": "Rheda-Wiedenbrück",
      "details": "28.10.2025 (Bekanntmachungsdatum)\n\nNordrhein-Westfalen Amtsgericht Gütersloh HRA 8371\nRegisterbekanntmachung nach dem Umwandlungsgesetz 28.10.2025 (Eintragungsdatum)\n\nRichard Mangel, Inh. Christian Mangel e. K.\nEinzelkaufmann / Einzelkauffrau\nRheda-Wiedenbrück\n\nDen Gläubigern der an der Ausgliederung beteiligten Rechtsträger ist, wenn sie binnen sechs Monaten nach dem Tag, an dem die Eintragung der Ausgliederung in das Register des Sitzes desjenigen Rechtsträgers, dessen Gläubiger sie sind, nach § 19 Absatz 3 UmwG als bekanntgemacht gilt, ihren Anspruch nach Grund und Höhe schriftlich anmelden, Sicherheit zu leisten, soweit sie nicht Befriedigung verlangen können. Dieses Recht steht den Gläubigern jedoch nur zu, wenn sie glaubhaft machen, dass durch die Ausgliederung die Erfüllung ihrer Forderung gefährdet wird."
    },
    {
      "date": "2025-10-28",
      "id": "135574",
      "original_text": "Registerbekanntmachung nach dem Umwandlungsgesetz\nNordrhein-Westfalen Amtsgericht Düsseldorf HRB 110250\nSereni Bestattungen GmbH – Düsseldorf",
      "type": "Registerbekanntmachung nach dem Umwandlungsgesetz",
      "state": "Nordrhein-Westfalen",
      "amtsgericht": "Amtsgericht Düsseldorf",
      "registernummer": "HRB 110250",
      "registerart": "HRB",
      "company_name": "Sereni Bestattungen GmbH",
      "company_seat": "Düsseldorf",
      "details": "28.10.2025 (Bekanntmachungsdatum)\n\nNordrhein-Westfalen Amtsgericht Düsseldorf HRB 110250\nRegisterbekanntmachung nach dem Umwandlungsgesetz 28.10.2025 (Eintragungsdatum)\n\nSereni Bestattungen GmbH\nGesellschaft mit beschränkter Haftung\nDüsseldorf\n\nDen Gläubigern der an der Verschmelzung beteiligten Rechtsträger ist, wenn sie binnen sechs Monaten nach dem Tag, an dem die Eintragung der Verschmelzung in das Register des Sitzes desjenigen Rechtsträgers, dessen Gläubiger sie sind, nach § 19 Absatz 3 UmwG als bekanntgemacht gilt, ihren Anspruch nach Grund und Höhe schriftlich anmelden, Sicherheit zu leisten, soweit sie nicht Befriedigung verlangen können. Dieses Recht steht den Gläubigern jedoch nur zu, wenn sie glaubhaft machen, dass durch die Verschmelzung die Erfüllung ihrer Forderung gefährdet wird."
    },
    {
      "date": "2025-10-28",
      "id": "135575",
      "original_text": "Registerbekanntmachung nach dem Umwandlungsgesetz\nNordrhein-Westfalen Amtsgericht Paderborn HRB 17268\nBREMER Nürnberg GmbH – Paderborn",
      "type": "Registerbekanntmachung nach dem Umwandlungsgesetz",
      "state": "Nordrhein-Westfalen",
      "amtsgericht": "Amtsgericht Paderborn",
      "registernummer": "HRB 17268",
      "registerart": "HRB",
      "company_name": "BREMER Nürnberg GmbH",
      "company_seat": "Paderborn",
      "details": "28.10.2025 (Bekanntmachungsdatum)\n\nNordrhein-Westfalen Amtsgericht Paderborn HRB 17268\nRegisterbekanntmachung nach dem Umwandlungsgesetz 28.10.2025 (Eintragungsdatum)\n\nBREMER Nürnberg GmbH\nGesellschaft mit beschränkter Haftung\nPaderborn\n\nDen Gläubigern der an der Verschmelzung beteiligten Rechtsträger ist, wenn sie binnen sechs Monaten nach dem Tag, an dem die Eintragung der Verschmelzung in das Register des Sitzes desjenigen Rechtsträgers, dessen Gläubiger sie sind, nach § 19 Absatz 3 UmwG als bekanntgemacht gilt, ihren Anspruch nach Grund und Höhe schriftlich anmelden, Sicherheit zu leisten, soweit sie nicht Befriedigung verlangen können. Dieses Recht steht den Gläubigern jedoch nur zu, wenn sie glaubhaft machen, dass durch die Verschmelzung die Erfüllung ihrer Forderung gefährdet wird."
    },
    {
      "date": "2025-10-28",
      "id": "135576",
      "original_text": "Einreichung neuer Dokumente\nNordrhein-Westfalen Amtsgericht Duisburg HRB 14235\nRWW Rheinisch- Westfälische Wasserwerksgesellschaft mbH – Mülheim an der Ruhr",
      "type": "Einreichung neuer Dokumente",
      "state": "Nordrhein-Westfalen",
      "amtsgericht": "Amtsgericht Duisburg",
      "registernummer": "HRB 14235",
      "registerart": "HRB",
      "company_name": "RWW Rheinisch- Westfälische Wasserwerksgesellschaft mbH",
      "company_seat": "Mülheim an der Ruhr",
      "details": "28.10.2025 (Bekanntmachungsdatum)\n\nNordrhein-Westfalen Amtsgericht Duisburg HRB 14235\nEinreichung neuer Dokumente\n\nRWW Rheinisch- Westfälische Wasserwerksgesellschaft mbH\nGesellschaft mit beschränkter Haftung\nMülheim an der Ruhr\n\nDem Registergericht ist eine neue Liste der Mitglieder des Aufsichtsrates eingereicht worden."
    },
    {
      "date": "2025-10-28",
      "id": "135577",
      "original_text": "Registerbekanntmachung nach dem Umwandlungsgesetz\nNordrhein-Westfalen Amtsgericht Siegburg HRB 18258\nS. Müller Werkzeugbau GmbH – Neunkirchen-Seelscheid",
      "type": "Registerbekanntmachung nach dem Umwandlungsgesetz",
      "state": "Nordrhein-Westfalen",
      "amtsgericht": "Amtsgericht Siegburg",
      "registernummer": "HRB 18258",
      "registerart": "HRB",
      "company_name": "S. Müller Werkzeugbau GmbH",
      "company_seat": "Neunkirchen-Seelscheid",
      "details": "28.10.2025 (Bekanntmachungsdatum)\n\nNordrhein-Westfalen Amtsgericht Siegburg HRB 18258\nRegisterbekanntmachung nach dem Umwandlungsgesetz 28.10.2025 (Eintragungsdatum)\n\nS. Müller Werkzeugbau GmbH\nGesellschaft mit beschränkter Haftung\nNeunkirchen-Seelscheid\n\nDen Gläubigern der an der Verschmelzung beteiligten Rechtsträger ist, wenn sie binnen sechs Monaten nach dem Tag, an dem die Eintragung der Verschmelzung in das Register des Sitzes desjenigen Rechtsträgers, dessen Gläubiger sie sind, nach § 19 Absatz 3 UmwG als bekanntgemacht gilt, ihren Anspruch nach Grund und Höhe schriftlich anmelden, Sicherheit zu leisten, soweit sie nicht Befriedigung verlangen können. Dieses Recht steht den Gläubigern jedoch nur zu, wenn sie glaubhaft machen, dass durch die Verschmelzung die Erfüllung ihrer Forderung gefährdet wird."
    },
    {
      "date": "2025-10-28",
      "id": "135578",
      "original_text": "Einreichung neuer Dokumente\nNordrhein-Westfalen Amtsgericht Düsseldorf HRB 77425\nUniper SE – Düsseldorf",
      "type": "Einreichung neuer Dokumente",
      "state": "Nordrhein-Westfalen",
      "amtsgericht": "Amtsgericht Düsseldorf",
      "registernummer": "HRB 77425",
      "registerart": "HRB",
      "company_name": "Uniper SE",
      "company_seat": "Düsseldorf",
      "details": "28.10.2025 (Bekanntmachungsdatum)\n\nNordrhein-Westfalen Amtsgericht Düsseldorf HRB 77425\nEinreichung neuer Dokumente\n\nUniper SE\nEuropäische Aktiengesellschaft (SE)\nDüsseldorf\n\nDem Registergericht ist eine Liste der Mitglieder des Aufsichtsrates eingereicht worden."
    },
    {
      "date": "2025-10-28",
      "id": "135579",
      "original_text": "Registerbekanntmachung nach dem Umwandlungsgesetz\nNordrhein-Westfalen Amtsgericht Essen VR 1535\nFamilien- und Krankenpflege e.V. – Essen",
      "type": "Registerbekanntmachung nach dem Umwandlungsgesetz",
      "state": "Nordrhein-Westfalen",
      "amtsgericht": "Amtsgericht Essen",
      "registernummer": "VR 1535",
      "registerart": "VR",
      "company_name": "Familien- und Krankenpflege e.V.",
      "company_seat": "Essen",
      "details": "28.10.2025 (Bekanntmachungsdatum)\n\nNordrhein-Westfalen Amtsgericht Essen VR 1535\nRegisterbekanntmachung nach dem Umwandlungsgesetz 28.10.2025 (Eintragungsdatum)\n\nFamilien- und Krankenpflege e.V.\neingetragener Verein\nEssen\n\nDen Gläubigern der an der Verschmelzung beteiligten Rechtsträger ist, wenn sie binnen sechs Monaten nach dem Tag, an dem die Eintragung der Verschmelzung in das Register des Sitzes desjenigen Rechtsträgers, dessen Gläubiger sie sind, nach § 19 Absatz 3 UmwG als bekanntgemacht gilt, ihren Anspruch nach Grund und Höhe schriftlich anmelden, Sicherheit zu leisten, soweit sie nicht Befriedigung verlangen können. Dieses Recht steht den Gläubigern jedoch nur zu, wenn sie glaubhaft machen, dass durch die Verschmelzung die Erfüllung ihrer Forderung gefährdet wird."
    },
    {
      "date": "2025-10-28",
      "id": "135580",
      "original_text": "Registerbekanntmachung nach dem Umwandlungsgesetz\nNordrhein-Westfalen Amtsgericht Essen VR 1535\nFamilien- und Krankenpflege e.V. – Essen",
      "type": "Registerbekanntmachung nach dem Umwandlungsgesetz",
      "state": "Nordrhein-Westfalen",
      "amtsgericht": "Amtsgericht Essen",
      "registernummer": "VR 1535",
      "registerart": "VR",
      "company_name": "Familien- und Krankenpflege e.V.",
      "company_seat": "Essen",
      "details": "28.10.2025 (Bekanntmachungsdatum)\n\nNordrhein-Westfalen Amtsgericht Essen VR 1535\nRegisterbekanntmachung nach dem Umwandlungsgesetz 28.10.2025 (Eintragungsdatum)\n\nFamilien- und Krankenpflege e.V.\neingetragener Verein\nEssen\n\nDen Gläubigern der an der Verschmelzung beteiligten Rechtsträger ist, wenn sie binnen sechs Monaten nach dem Tag, an dem die Eintragung der Verschmelzung in das Register des Sitzes desjenigen Rechtsträgers, dessen Gläubiger sie sind, nach § 19 Absatz 3 UmwG als bekanntgemacht gilt, ihren Anspruch nach Grund und Höhe schriftlich anmelden, Sicherheit zu leisten, soweit sie nicht Befriedigung verlangen können. Dieses Recht steht den Gläubigern jedoch nur zu, wenn sie glaubhaft machen, dass durch die Verschmelzung die Erfüllung ihrer Forderung gefährdet wird."
    },
    {
      "date": "2025-10-28",
      "id": "135581",
      "original_text": "Löschungsankündigung\nNordrhein-Westfalen Amtsgericht Aachen HRB 20923\nSabah GmbH – Würselen",
      "type": "Löschungsankündigung",
      "state": "Nordrhein-Westfalen",
      "amtsgericht": "Amtsgericht Aachen",
      "registernummer": "HRB 20923",
      "registerart": "HRB",
      "company_name": "Sabah GmbH",
      "company_seat": "Würselen",
      "details": "28.10.2025 (Bekanntmachungsdatum)\n\nNordrhein-Westfalen Amtsgericht Aachen HRB 20923\nLöschungsankündigung\n\nSabah GmbH\nGesellschaft mit beschränkter Haftung\nWürselen\n\nDas Registergericht beabsichtigt, von Amts wegen die Gesellschaft wegen Vermögenslosigkeit nach § 394 FamFG zu löschen.\n\nZur Geltendmachung des Widerspruchs gegen die beabsichtigte Löschung wird hiermit eine Frist von einem Monat ab Veröffentlichung dieser Ankündigung bestimmt.\n\nRechtsbehelfsbelehrung:\n\nGegen diese Verfügung kann Widerspruch eingelegt werden. Zum Widerspruch ist jeder berechtigt, der an der Unterlassung der Löschung ein berechtigtes Interesse hat.\n\nDer Widerspruch ist bei dem Amtsgericht Aachen, Adalbertsteinweg 92, 52070 Aachen schriftlich in deutscher Sprache oder zur Niederschrift der Geschäftsstelle einzulegen. Der Widerspruch kann auch zur Niederschrift der Geschäftsstelle eines jeden Amtsgerichtes abgegeben werden.\n\nDer Widerspruch muss spätestens innerhalb der gesetzten Frist nach der Bekanntgabe der Verfügung bei dem Amtsgericht Aachen eingegangen sein. Dies gilt auch dann, wenn der Widerspruch zur Niederschrift der Geschäftsstelle eines anderen Amtsgerichtes abgegeben wurde. Die Frist beginnt mit der Bekanntgabe der Verfügung durch Veröffentlichung. Fällt das Ende der Frist auf einen Sonntag, einen allgemeinen Feiertag oder Sonnabend, so endet die Frist mit Ablauf des nächsten Werktages.\n\nDer Widerspruch muss die Bezeichnung der angefochtenen Verfügung sowie die Erklärung enthalten, dass Widerspruch gegen diese Verfügung eingelegt wird. Er ist zu unterzeichnen und soll begründet werden.\n\nDie Einlegung ist auch durch Übertragung eines elektronischen Dokuments an die elektronische Poststelle des Gerichts möglich. Das elektronische Dokument muss für die Bearbeitung durch das Gericht geeignet und mit einer qualifizierten elektronischen Signatur der verantwortenden Person versehen sein oder von der verantwortenden Person signiert und auf einem sicheren Übermittlungsweg gemäß § 130 a ZPO nach näherer Maßgabe der Verordnung über die technischen Rahmenbedingungen des elektronischen Rechtsverkehrs und über das besondere elektronische Behördenpostfach (BGBl. I, S. 3803) eingereicht werden. Weitere Informationen erhalten Sie auf der Internetseite www.justiz.de."
    },
    {
      "date": "2025-10-28",
      "id": "135582",
      "original_text": "Registerbekanntmachung nach dem Umwandlungsgesetz\nNordrhein-Westfalen Amtsgericht Düsseldorf HRB 110250\nSereni Bestattungen GmbH – Düsseldorf",
      "type": "Registerbekanntmachung nach dem Umwandlungsgesetz",
      "state": "Nordrhein-Westfalen",
      "amtsgericht": "Amtsgericht Düsseldorf",
      "registernummer": "HRB 110250",
      "registerart": "HRB",
      "company_name": "Sereni Bestattungen GmbH",
      "company_seat": "Düsseldorf",
      "details": "28.10.2025 (Bekanntmachungsdatum)\n\nNordrhein-Westfalen Amtsgericht Düsseldorf HRB 110250\nRegisterbekanntmachung nach dem Umwandlungsgesetz 28.10.2025 (Eintragungsdatum)\n\nSereni Bestattungen GmbH\nGesellschaft mit beschränkter Haftung\nDüsseldorf\n\nDen Gläubigern der an der Verschmelzung beteiligten Rechtsträger ist, wenn sie binnen sechs Monaten nach dem Tag, an dem die Eintragung der Verschmelzung in das Register des Sitzes desjenigen Rechtsträgers, dessen Gläubiger sie sind, nach § 19 Absatz 3 UmwG als bekanntgemacht gilt, ihren Anspruch nach Grund und Höhe schriftlich anmelden, Sicherheit zu leisten, soweit sie nicht Befriedigung verlangen können. Dieses Recht steht den Gläubigern jedoch nur zu, wenn sie glaubhaft machen, dass durch die Verschmelzung die Erfüllung ihrer Forderung gefährdet wird."
    },
    {
      "date": "2025-10-28",
      "id": "135583",
      "original_text": "Löschungsankündigung\nNordrhein-Westfalen Amtsgericht Siegburg HRB 12834\nT & C Verwaltungs GmbH – Neunkirchen-Seelscheid",
      "type": "Löschungsankündigung",
      "state": "Nordrhein-Westfalen",
      "amtsgericht": "Amtsgericht Siegburg",
      "registernummer": "HRB 12834",
      "registerart": "HRB",
      "company_name": "T & C Verwaltungs GmbH",
      "company_seat": "Neunkirchen-Seelscheid",
      "details": "28.10.2025 (Bekanntmachungsdatum)\n\nNordrhein-Westfalen Amtsgericht Siegburg HRB 12834\nLöschungsankündigung\n\nT & C Verwaltungs GmbH\nGesellschaft mit beschränkter Haftung\nNeunkirchen-Seelscheid\n\nDas Registergericht hat glaubhafte Kenntnis erlangt, dass die Gesellschaft vermögenslos geworden ist.\n\nEs ist daher beabsichtigt, die Gesellschaft nach § 394 FamFG im Handelsregister wegen Vermögenslosigkeit zu löschen.\nEinwände gegen die Löschung sind durch Widerspruch binnen einer Frist von 3 Monaten geltend zu machen, andernfalls die Löschung erfolgen wird.\n\nEinzulegen ist der Widerspruch bei dem Amtsgericht Siegburg, Neue Poststraße 16, 53721 Siegburg, und zwar entweder schriftlich in deutscher Sprache oder mündlich zur Niederschrift der Geschäftsstelle. Der Widerspruch kann auch zur Niederschrift der Geschäftsstelle eines jeden Amtsgerichts abgegeben werden. Der Widerspruch ist binnen der in der Verfügung bestimmten Frist einzulegen. Die Frist ist nur gewahrt, wenn der Widerspruch rechtzeitig bei dem Amtsgericht Siegburg eingeht, auch wenn der Widerspruch zur Niederschrift der Geschäftsstelle eines anderen Amtsgerichts abgegeben wurde. Die Frist beginnt jeweils mit der schriftlichen Bekanntgabe der Verfügung an die Beteiligten. Kann die schriftliche Bekanntgabe an einen Beteiligten nicht bewirkt werden, beginnt die Frist spätestens mit Ablauf von fünf Monaten nach Erlass der Verfügung. Die Bekanntgabe ist entweder durch Zustellung oder am dritten Tage nach Aufgabe zur Post bewirkt. Sofern die Löschung noch nicht erfolgt ist, kann der Widerspruch auch noch nach Ablauf der Frist eingelegt werden. Fällt das Ende der Frist auf einen Sonnabend, einen Sonntag oder einen allgemeinen Feiertag, endet die Frist mit Ablauf des nächsten Werktages. Der Widerspruch ist zu unterzeichnen. Eine Begründung des Widerspruchs ist nicht vorgeschrieben."
    },
    {
      "date": "2025-10-28",
      "id": "135584",
      "original_text": "Registerbekanntmachung nach dem Umwandlungsgesetz\nNordrhein-Westfalen Amtsgericht Köln GsR 1468\nFlora Winkler und Michael Winkler eGbR – Köln",
      "type": "Registerbekanntmachung nach dem Umwandlungsgesetz",
      "state": "Nordrhein-Westfalen",
      "amtsgericht": "Amtsgericht Köln",
      "registernummer": "GsR 1468",
      "registerart": "GsR",
      "company_name": "Flora Winkler und Michael Winkler eGbR",
      "company_seat": "Köln",
      "details": "28.10.2025 (Bekanntmachungsdatum)\n\nNordrhein-Westfalen Amtsgericht Köln GsR 1468\nRegisterbekanntmachung nach dem Umwandlungsgesetz 28.10.2025 (Eintragungsdatum)\n\nFlora Winkler und Michael Winkler eGbR\nGesellschaft bürgerlichen Rechts\nKöln\n\nDen Gläubigern der an der formwechselnden Umwandlung beteiligten Rechtsträger ist, wenn sie binnen sechs Monaten nach dem Tag, an dem die Eintragung der formwechselnden Umwandlung in das Register des Sitzes desjenigen Rechtsträgers, dessen Gläubiger sie sind, nach § 19 Absatz 3 UmwG als bekanntgemacht gilt, ihren Anspruch nach Grund und Höhe schriftlich anmelden, Sicherheit zu leisten, soweit sie nicht Befriedigung verlangen können. Dieses Recht steht den Gläubigern jedoch nur zu, wenn sie glaubhaft machen, dass durch die formwechselnden Umwandlung die Erfüllung ihrer Forderung gefährdet wird."
    },
    {
      "date": "2025-10-28",
      "id": "135585",
      "original_text": "Einreichung neuer Dokumente\nThüringen Amtsgericht Jena HRB 517346\nMDR Media GmbH – Erfurt",
      "type": "Einreichung neuer Dokumente",
      "state": "Thüringen",
      "amtsgericht": "Amtsgericht Jena",
      "registernummer": "HRB 517346",
      "registerart": "HRB",
      "company_name": "MDR Media GmbH",
      "company_seat": "Erfurt",
      "details": "28.10.2025 (Bekanntmachungsdatum)\n\nThüringen Amtsgericht Jena HRB 517346\nEinreichung neuer Dokumente\n\nMDR Media GmbH\nGesellschaft mit beschränkter Haftung\nErfurt\n\nBekanntmachung gem. § 52 Abs. 3 Satz 2 GmbHG: Aufgrund einer Veränderung in den Personen der Aufsichtsratsmitglieder ist durch die Geschäftsführer eine neue Liste zum Handelsregister eingereicht worden."
    },
    {
      "date": "2025-10-28",
      "id": "135586",
      "original_text": "Registerbekanntmachung nach dem Umwandlungsgesetz\nNordrhein-Westfalen Amtsgericht Siegen HRB 12210\nBetacontrol Systems GmbH – Siegen",
      "type": "Registerbekanntmachung nach dem Umwandlungsgesetz",
      "state": "Nordrhein-Westfalen",
      "amtsgericht": "Amtsgericht Siegen",
      "registernummer": "HRB 12210",
      "registerart": "HRB",
      "company_name": "Betacontrol Systems GmbH",
      "company_seat": "Siegen",
      "details": "28.10.2025 (Bekanntmachungsdatum)\n\nNordrhein-Westfalen Amtsgericht Siegen HRB 12210\nRegisterbekanntmachung nach dem Umwandlungsgesetz 28.10.2025 (Eintragungsdatum)\n\nBetacontrol Systems GmbH\nGesellschaft mit beschränkter Haftung\nSiegen\n\nDen Gläubigern der an der Verschmelzung beteiligten Rechtsträger ist, wenn sie binnen sechs Monaten nach dem Tag, an dem die Eintragung der Verschmelzung in das Register des Sitzes derjenigen Rechtsträger deren Gläubiger sie sind, nach § 19 Absatz 3 UmwG als bekanntgemacht gilt, ihren Anspruch nach Grund und Höhe schriftlich anmelden, Sicherheit zu leisten, soweit sie nicht Befriedigung verlangen können. Dieses Recht steht den Gläubigern jedoch nur zu, wenn sie glaubhaft machen, dass durch die Verschmelzung die Erfüllung ihrer Forderung gefährdet wird."
    },
    {
      "date": "2025-10-28",
      "id": "135587",
      "original_text": "Registerbekanntmachung nach dem Umwandlungsgesetz\nHessen Amtsgericht Kassel GnR 341\nWohnungsbaugenossenschaft 1946 Kassel eG – Kassel",
      "type": "Registerbekanntmachung nach dem Umwandlungsgesetz",
      "state": "Hessen",
      "amtsgericht": "Amtsgericht Kassel",
      "registernummer": "GnR 341",
      "registerart": "GnR",
      "company_name": "Wohnungsbaugenossenschaft 1946 Kassel eG",
      "company_seat": "Kassel",
      "details": "28.10.2025 (Bekanntmachungsdatum)\n\nHessen Amtsgericht Kassel GnR 341\nRegisterbekanntmachung nach dem Umwandlungsgesetz 28.10.2025 (Eintragungsdatum)\n\nWohnungsbaugenossenschaft 1946 Kassel eG\neingetragene Genossenschaft\nKassel\n\nDen Gläubigern der an der Verschmelzung beteiligten Rechtsträger ist, wenn sie binnen sechs Monaten nach dem Tag, an dem die Eintragung der Verschmelzung in das Register des Sitzes derjenigen Rechtsträger deren Gläubiger sie sind, nach § 19 Absatz 3 UmwG bekannt gemacht worden ist, ihren Anspruch nach Grund und Höhe schriftlich anmelden, Sicherheit zu leisten, soweit sie nicht Befriedigung verlangen können. Dieses Recht steht den Gläubigern jedoch nur zu, wenn sie glaubhaft machen, dass durch die Verschmelzung die Erfüllung ihrer Forderung gefährdet wird."
    },
    {
      "date": "2025-10-28",
      "id": "135588",
      "original_text": "Registerbekanntmachung nach dem Umwandlungsgesetz\nHessen Amtsgericht Frankfurt am Main HRB 134695\nSidetrade AG – Frankfurt am Main",
      "type": "Registerbekanntmachung nach dem Umwandlungsgesetz",
      "state": "Hessen",
      "amtsgericht": "Amtsgericht Frankfurt am Main",
      "registernummer": "HRB 134695",
      "registerart": "HRB",
      "company_name": "Sidetrade AG",
      "company_seat": "Frankfurt am Main",
      "details": "28.10.2025 (Bekanntmachungsdatum)\n\nHessen Amtsgericht Frankfurt am Main HRB 134695\nRegisterbekanntmachung nach dem Umwandlungsgesetz 28.10.2025 (Eintragungsdatum)\n\nSidetrade AG\nAktiengesellschaft\nFrankfurt am Main\n\nDen Gläubigern der an der Verschmelzung beteiligten Rechtsträger ist, wenn sie binnen sechs Monaten nach dem Tag, an dem die Eintragung der Verschmelzung in das Register des Sitzes desjenigen Rechtsträgers, dessen Gläubiger sie sind, nach § 19 Absatz 3 UmwG bekannt gemacht worden ist, ihren Anspruch nach Grund und Höhe schriftlich anmelden, Sicherheit zu leisten, soweit sie nicht Befriedigung verlangen können. Dieses Recht steht den Gläubigern jedoch nur zu, wenn sie glaubhaft machen, dass durch die Verschmelzung die Erfüllung ihrer Forderung gefährdet wird."
    },
    {
      "date": "2025-10-28",
      "id": "135589",
      "original_text": "Einreichung neuer Dokumente\nHessen Amtsgericht Darmstadt HRB 25719\nNEEC New Energy Engineering Consulting AG – Bensheim",
      "type": "Einreichung neuer Dokumente",
      "state": "Hessen",
      "amtsgericht": "Amtsgericht Darmstadt",
      "registernummer": "HRB 25719",
      "registerart": "HRB",
      "company_name": "NEEC New Energy Engineering Consulting AG",
      "company_seat": "Bensheim",
      "details": "28.10.2025 (Bekanntmachungsdatum)\n\nHessen Amtsgericht Darmstadt HRB 25719\nEinreichung neuer Dokumente 28.10.2025 (Eintragungsdatum)\n\nNEEC New Energy Engineering Consulting AG\nAktiengesellschaft\nBensheim\n\nWegen Änderungen in den Personen der Aufsichtsratsmitglieder ist eine Liste der Mitglieder des Aufsichtsrates zum Handelsregister eingereicht worden."
    },
    {
      "date": "2025-10-28",
      "id": "135590",
      "original_text": "Registerbekanntmachung nach dem Umwandlungsgesetz\nHessen Amtsgericht Kassel GnR 335\nBauverein 1894 zu Kassel Wohnungsbaugenossenschaft eG – Kassel",
      "type": "Registerbekanntmachung nach dem Umwandlungsgesetz",
      "state": "Hessen",
      "amtsgericht": "Amtsgericht Kassel",
      "registernummer": "GnR 335",
      "registerart": "GnR",
      "company_name": "Bauverein 1894 zu Kassel Wohnungsbaugenossenschaft eG",
      "company_seat": "Kassel",
      "details": "28.10.2025 (Bekanntmachungsdatum)\n\nHessen Amtsgericht Kassel GnR 335\nRegisterbekanntmachung nach dem Umwandlungsgesetz 28.10.2025 (Eintragungsdatum)\n\nBauverein 1894 zu Kassel Wohnungsbaugenossenschaft eG\neingetragene Genossenschaft\nKassel\n\nDen Gläubigern der an der Verschmelzung beteiligten Rechtsträger ist, wenn sie binnen sechs Monaten nach dem Tag, an dem die Eintragung der Verschmelzung in das Register des Sitzes derjenigen Rechtsträger deren Gläubiger sie sind, nach § 19 Absatz 3 UmwG bekannt gemacht worden ist, ihren Anspruch nach Grund und Höhe schriftlich anmelden, Sicherheit zu leisten, soweit sie nicht Befriedigung verlangen können. Dieses Recht steht den Gläubigern jedoch nur zu, wenn sie glaubhaft machen, dass durch die Verschmelzung die Erfüllung ihrer Forderung gefährdet wird."
    },
    {
      "date": "2025-10-28",
      "id": "135591",
      "original_text": "Löschungsankündigung\nHessen Amtsgericht Frankfurt am Main HRA 51168\nCI PE 20 GmbH & Co. KG – Frankfurt am Main",
      "type": "Löschungsankündigung",
      "state": "Hessen",
      "amtsgericht": "Amtsgericht Frankfurt am Main",
      "registernummer": "HRA 51168",
      "registerart": "HRA",
      "company_name": "CI PE 20 GmbH & Co. KG",
      "company_seat": "Frankfurt am Main",
      "details": "28.10.2025 (Bekanntmachungsdatum)\n\nHessen Amtsgericht Frankfurt am Main HRA 51168\nLöschungsankündigung\n\nCI PE 20 GmbH & Co. KG\nKommanditgesellschaft\nFrankfurt am Main\n\nDas Registergericht beabsichtigt die im Handelsregister eingetragene Firma von Amts wegen nach § 395 FamFG zu löschen. Die Frist zur Erhebung eines Widerspruchs gegen die beabsichtigte Löschung wird auf 1 Monate festgesetzt."
    }
  ]
}