{
  "date": "2025-10-16",
  "date_of_scrape": "2025-10-27T18:19:04.122Z",
  "tool_version": "0.2.0",
  "number_of_announcements": 171,
  "announcements": [
    {
      "date": "2025-10-16",
      "id": "134140",
      "original_text": "Registerbekanntmachung nach dem Umwandlungsgesetz\nBayern Amtsgericht München HRB 272291\nTEV Global Invest I GmbH – München",
      "type": "Registerbekanntmachung nach dem Umwandlungsgesetz",
      "state": "Bayern",
      "amtsgericht": "Amtsgericht München",
      "registernummer": "HRB 272291",
      "registerart": "HRB",
      "company_name": "TEV Global Invest I GmbH",
      "company_seat": "München",
      "details": "16.10.2025 (Bekanntmachungsdatum)\n\nBayern Amtsgericht München HRB 272291\nRegisterbekanntmachung nach dem Umwandlungsgesetz 15.10.2025 (Eintragungsdatum)\n\nTEV Global Invest I GmbH\nGesellschaft mit beschränkter Haftung\nMünchen\n\nDen Gläubigern der an der Verschmelzung beteiligten Rechtsträger ist, wenn sie binnen sechs Monaten nach dem Tag, an dem die Eintragung der Verschmelzung in das Register des Sitzes desjenigen Rechtsträgers, dessen Gläubiger sie sind, nach § 19 Abs. 3 UmwG als bekannt gemacht gilt, ihren Anspruch nach Grund und Höhe in Textform anmelden, Sicherheit zu leisten, soweit sie nicht Befriedigung verlangen können. Dieses Recht steht den Gläubigern jedoch nur zu, wenn sie glaubhaft machen, dass durch die Verschmelzung die Erfüllung ihrer Forderung gefährdet wird."
    },
    {
      "date": "2025-10-16",
      "id": "134141",
      "original_text": "Löschungsankündigung\nBayern Amtsgericht München HRB 218979\nKarrfv GmbH – München",
      "type": "Löschungsankündigung",
      "state": "Bayern",
      "amtsgericht": "Amtsgericht München",
      "registernummer": "HRB 218979",
      "registerart": "HRB",
      "company_name": "Karrfv GmbH",
      "company_seat": "München",
      "details": "16.10.2025 (Bekanntmachungsdatum)\n\nBayern Amtsgericht München HRB 218979\nLöschungsankündigung\n\nKarrfv GmbH\nGesellschaft mit beschränkter Haftung\nMünchen\n\nDas Registergericht beabsichtigt, die im Handelsregister eingetragene Gesellschaft wegen Vermögenslosigkeit von Amts wegen nach § 394 FamFG zu löschen. Die Frist zur Erhebung eines Widerspruchs ist auf drei Monate festgesetzt."
    },
    {
      "date": "2025-10-16",
      "id": "134142",
      "original_text": "Einreichung neuer Dokumente\nBayern Amtsgericht Würzburg HRB 162\nWürzburger Versorgungs- und Verkehrs - Gesellschaft mit beschränkter Haftung – Würzburg",
      "type": "Einreichung neuer Dokumente",
      "state": "Bayern",
      "amtsgericht": "Amtsgericht Würzburg",
      "registernummer": "HRB 162",
      "registerart": "HRB",
      "company_name": "Würzburger Versorgungs- und Verkehrs - Gesellschaft mit beschränkter Haftung",
      "company_seat": "Würzburg",
      "details": "16.10.2025 (Bekanntmachungsdatum)\n\nBayern Amtsgericht Würzburg HRB 162\nEinreichung neuer Dokumente\n\nWürzburger Versorgungs- und Verkehrs - Gesellschaft mit beschränkter Haftung\nGesellschaft mit beschränkter Haftung\nWürzburg\n\nDem Amtsgericht Würzburg -Registergericht- ist eine Liste der Mitglieder des Aufsichtsrats eingereicht worden, § 52 Abs. 3 S. 2 GmbHG."
    },
    {
      "date": "2025-10-16",
      "id": "134143",
      "original_text": "Registerbekanntmachung nach dem Umwandlungsgesetz\nBayern Amtsgericht München HRB 158525\nsalesforce.com Germany GmbH – München",
      "type": "Registerbekanntmachung nach dem Umwandlungsgesetz",
      "state": "Bayern",
      "amtsgericht": "Amtsgericht München",
      "registernummer": "HRB 158525",
      "registerart": "HRB",
      "company_name": "salesforce.com Germany GmbH",
      "company_seat": "München",
      "details": "16.10.2025 (Bekanntmachungsdatum)\n\nBayern Amtsgericht München HRB 158525\nRegisterbekanntmachung nach dem Umwandlungsgesetz 15.10.2025 (Eintragungsdatum)\n\nsalesforce.com Germany GmbH\nGesellschaft mit beschränkter Haftung\nMünchen\n\nDen Gläubigern der an der Verschmelzung beteiligten Rechtsträger ist, wenn sie binnen sechs Monaten nach dem Tag, an dem die Eintragung der Verschmelzung in das Register des Sitzes desjenigen Rechtsträgers, dessen Gläubiger sie sind, nach § 19 Abs. 3 UmwG als bekannt gemacht gilt, ihren Anspruch nach Grund und Höhe in Textform anmelden, Sicherheit zu leisten, soweit sie nicht Befriedigung verlangen können. Dieses Recht steht den Gläubigern jedoch nur zu, wenn sie glaubhaft machen, dass durch die Verschmelzung die Erfüllung ihrer Forderung gefährdet wird."
    },
    {
      "date": "2025-10-16",
      "id": "134144",
      "original_text": "Registerbekanntmachung nach dem Umwandlungsgesetz\nBayern Amtsgericht München HRB 185635\nWSMS Verwaltungs GmbH – Vaterstetten",
      "type": "Registerbekanntmachung nach dem Umwandlungsgesetz",
      "state": "Bayern",
      "amtsgericht": "Amtsgericht München",
      "registernummer": "HRB 185635",
      "registerart": "HRB",
      "company_name": "WSMS Verwaltungs GmbH",
      "company_seat": "Vaterstetten",
      "details": "16.10.2025 (Bekanntmachungsdatum)\n\nBayern Amtsgericht München HRB 185635\nRegisterbekanntmachung nach dem Umwandlungsgesetz 15.10.2025 (Eintragungsdatum)\n\nWSMS Verwaltungs GmbH\nGesellschaft mit beschränkter Haftung\nVaterstetten\n\nDen Gläubigern der an der Verschmelzung beteiligten Rechtsträger ist, wenn sie binnen sechs Monaten nach dem Tag, an dem die Eintragung der Verschmelzung in das Register des Sitzes desjenigen Rechtsträgers, dessen Gläubiger sie sind, nach § 19 Abs. 3 UmwG als bekannt gemacht gilt, ihren Anspruch nach Grund und Höhe in Textform anmelden, Sicherheit zu leisten, soweit sie nicht Befriedigung verlangen können. Dieses Recht steht den Gläubigern jedoch nur zu, wenn sie glaubhaft machen, dass durch die Verschmelzung die Erfüllung ihrer Forderung gefährdet wird."
    },
    {
      "date": "2025-10-16",
      "id": "134145",
      "original_text": "Löschungsankündigung\nBayern Amtsgericht München HRB 215636\nRusev Trockenbau UG (haftungsbeschränkt) – München",
      "type": "Löschungsankündigung",
      "state": "Bayern",
      "amtsgericht": "Amtsgericht München",
      "registernummer": "HRB 215636",
      "registerart": "HRB",
      "company_name": "Rusev Trockenbau UG (haftungsbeschränkt)",
      "company_seat": "München",
      "details": "16.10.2025 (Bekanntmachungsdatum)\n\nBayern Amtsgericht München HRB 215636\nLöschungsankündigung 15.10.2025 (Eintragungsdatum)\n\nRusev Trockenbau UG (haftungsbeschränkt)\nGesellschaft mit beschränkter Haftung\nMünchen\n\nDas Registergericht beabsichtigt, die im Handelsregister eingetragene Gesellschaft wegen Vermögenslosigkeit von Amts wegen nach § 394 FamFG zu löschen. Die Frist zur Erhebung eines Widerspruchs ist auf drei Monate festgesetzt."
    },
    {
      "date": "2025-10-16",
      "id": "134146",
      "original_text": "Löschungsankündigung\nBayern Amtsgericht Traunstein HRA 10278\nCourtTech GmbH & Co. KG – Traunstein",
      "type": "Löschungsankündigung",
      "state": "Bayern",
      "amtsgericht": "Amtsgericht Traunstein",
      "registernummer": "HRA 10278",
      "registerart": "HRA",
      "company_name": "CourtTech GmbH & Co. KG",
      "company_seat": "Traunstein",
      "details": "16.10.2025 (Bekanntmachungsdatum)\n\nBayern Amtsgericht Traunstein HRA 10278\nLöschungsankündigung 15.10.2025 (Eintragungsdatum)\n\nCourtTech GmbH & Co. KG\nKommanditgesellschaft\nTraunstein\n\nDas Registergericht beabsichtigt, die im Handelsregister eingetragene Firma wegen Vermögenslosigkeit von Amts wegen nach § 394 FamFG zu löschen. Die Frist zur Erhebung eines Widerspruchs ist auf drei Monate festgesetzt."
    },
    {
      "date": "2025-10-16",
      "id": "134147",
      "original_text": "Registerbekanntmachung nach dem Umwandlungsgesetz\nBayern Amtsgericht München HRB 289080\nNetwrix Germany GmbH – München",
      "type": "Registerbekanntmachung nach dem Umwandlungsgesetz",
      "state": "Bayern",
      "amtsgericht": "Amtsgericht München",
      "registernummer": "HRB 289080",
      "registerart": "HRB",
      "company_name": "Netwrix Germany GmbH",
      "company_seat": "München",
      "details": "16.10.2025 (Bekanntmachungsdatum)\n\nBayern Amtsgericht München HRB 289080\nRegisterbekanntmachung nach dem Umwandlungsgesetz 15.10.2025 (Eintragungsdatum)\n\nNetwrix Germany GmbH\nGesellschaft mit beschränkter Haftung\nMünchen\n\nDen Gläubigern der an der Verschmelzung beteiligten Rechtsträger ist, wenn sie binnen sechs Monaten nach dem Tag, an dem die Eintragung der Verschmelzung in das Register des Sitzes desjenigen Rechtsträgers, dessen Gläubiger sie sind, nach § 19 Abs. 3 UmwG als bekannt gemacht gilt, ihren Anspruch nach Grund und Höhe in Textform anmelden, Sicherheit zu leisten, soweit sie nicht Befriedigung verlangen können. Dieses Recht steht den Gläubigern jedoch nur zu, wenn sie glaubhaft machen, dass durch die Verschmelzung die Erfüllung ihrer Forderung gefährdet wird."
    },
    {
      "date": "2025-10-16",
      "id": "134148",
      "original_text": "Löschungsankündigung\nBayern Amtsgericht München HRB 241681\nmunich micros GmbH – Planegg",
      "type": "Löschungsankündigung",
      "state": "Bayern",
      "amtsgericht": "Amtsgericht München",
      "registernummer": "HRB 241681",
      "registerart": "HRB",
      "company_name": "munich micros GmbH",
      "company_seat": "Planegg",
      "details": "16.10.2025 (Bekanntmachungsdatum)\n\nBayern Amtsgericht München HRB 241681\nLöschungsankündigung\n\nmunich micros GmbH\nGesellschaft mit beschränkter Haftung\nPlanegg\n\nDas Registergericht beabsichtigt, die im Handelsregister eingetragene Gesellschaft wegen Vermögenslosigkeit von Amts wegen nach § 394 FamFG zu löschen. Die Frist zur Erhebung eines Widerspruchs ist auf drei Monate festgesetzt."
    },
    {
      "date": "2025-10-16",
      "id": "134149",
      "original_text": "Registerbekanntmachung nach dem Umwandlungsgesetz\nBayern Amtsgericht München HRB 182261\nff mediacom GmbH – München",
      "type": "Registerbekanntmachung nach dem Umwandlungsgesetz",
      "state": "Bayern",
      "amtsgericht": "Amtsgericht München",
      "registernummer": "HRB 182261",
      "registerart": "HRB",
      "company_name": "ff mediacom GmbH",
      "company_seat": "München",
      "details": "16.10.2025 (Bekanntmachungsdatum)\n\nBayern Amtsgericht München HRB 182261\nRegisterbekanntmachung nach dem Umwandlungsgesetz 15.10.2025 (Eintragungsdatum)\n\nff mediacom GmbH\nGesellschaft mit beschränkter Haftung\nMünchen\n\nDen Gläubigern der an der Verschmelzung beteiligten Rechtsträger ist, wenn sie binnen sechs Monaten nach dem Tag, an dem die Eintragung der Verschmelzung in das Register des Sitzes desjenigen Rechtsträgers, dessen Gläubiger sie sind, nach § 19 Abs. 3 UmwG als bekannt gemacht gilt, ihren Anspruch nach Grund und Höhe in Textform anmelden, Sicherheit zu leisten, soweit sie nicht Befriedigung verlangen können. Dieses Recht steht den Gläubigern jedoch nur zu, wenn sie glaubhaft machen, dass durch die Verschmelzung die Erfüllung ihrer Forderung gefährdet wird."
    },
    {
      "date": "2025-10-16",
      "id": "134150",
      "original_text": "Einreichung neuer Dokumente\nBayern Amtsgericht München HRB 110375\nH e x a l Aktiengesellschaft – Holzkirchen",
      "type": "Einreichung neuer Dokumente",
      "state": "Bayern",
      "amtsgericht": "Amtsgericht München",
      "registernummer": "HRB 110375",
      "registerart": "HRB",
      "company_name": "H e x a l Aktiengesellschaft",
      "company_seat": "Holzkirchen",
      "details": "16.10.2025 (Bekanntmachungsdatum)\n\nBayern Amtsgericht München HRB 110375\nEinreichung neuer Dokumente\n\nH e x a l Aktiengesellschaft\nAktiengesellschaft\nHolzkirchen\n\nDem Amtsgericht München -Registergericht- ist eine Liste der Mitglieder des Aufsichtsrats eingereicht worden, § 106 AktG."
    },
    {
      "date": "2025-10-16",
      "id": "134151",
      "original_text": "Löschungsankündigung\nBayern Amtsgericht Nürnberg HRB 19877\nGeNa Steuerberatungsgesellschaft mbH – Nürnberg",
      "type": "Löschungsankündigung",
      "state": "Bayern",
      "amtsgericht": "Amtsgericht Nürnberg",
      "registernummer": "HRB 19877",
      "registerart": "HRB",
      "company_name": "GeNa Steuerberatungsgesellschaft mbH",
      "company_seat": "Nürnberg",
      "details": "16.10.2025 (Bekanntmachungsdatum)\n\nBayern Amtsgericht Nürnberg HRB 19877\nLöschungsankündigung\n\nGeNa Steuerberatungsgesellschaft mbH\nGesellschaft mit beschränkter Haftung\nNürnberg\n\nDas Registergericht beabsichtigt, die im Handelsregister eingetragene Gesellschaft wegen Vermögenslosigkeit von Amts wegen nach § 394 FamFG zu löschen. Die Frist zur Erhebung eines Widerspruchs ist auf einen Monat festgesetzt."
    },
    {
      "date": "2025-10-16",
      "id": "134152",
      "original_text": "Registerbekanntmachung nach dem Umwandlungsgesetz\nBayern Amtsgericht Nürnberg HRB 45097\nHotel Westend GmbH – Nürnberg",
      "type": "Registerbekanntmachung nach dem Umwandlungsgesetz",
      "state": "Bayern",
      "amtsgericht": "Amtsgericht Nürnberg",
      "registernummer": "HRB 45097",
      "registerart": "HRB",
      "company_name": "Hotel Westend GmbH",
      "company_seat": "Nürnberg",
      "details": "16.10.2025 (Bekanntmachungsdatum)\n\nBayern Amtsgericht Nürnberg HRB 45097\nRegisterbekanntmachung nach dem Umwandlungsgesetz 15.10.2025 (Eintragungsdatum)\n\nHotel Westend GmbH\nGesellschaft mit beschränkter Haftung\nNürnberg\n\nDen Gläubigern des formwechselnden Rechtsträgers ist, wenn sie binnen sechs Monaten nach dem Tag, an dem die Eintragung des Formwechsels nach § 201 UmwG als bekannt gemacht gilt, ihren Anspruch nach Grund und Höhe in Textform anmelden, Sicherheit zu leisten, soweit sie nicht Befriedigung verlangen können. Dieses Recht steht den Gläubigern jedoch nur zu, wenn sie glaubhaft machen, dass durch den Formwechsel die Erfüllung ihrer Forderung gefährdet wird."
    },
    {
      "date": "2025-10-16",
      "id": "134153",
      "original_text": "Registerbekanntmachung nach dem Umwandlungsgesetz\nBayern Amtsgericht Nürnberg HRA 20375\nHotel Westend e.K. Inh. Daniel Dümler – Nürnberg",
      "type": "Registerbekanntmachung nach dem Umwandlungsgesetz",
      "state": "Bayern",
      "amtsgericht": "Amtsgericht Nürnberg",
      "registernummer": "HRA 20375",
      "registerart": "HRA",
      "company_name": "Hotel Westend e.K. Inh. Daniel Dümler",
      "company_seat": "Nürnberg",
      "details": "16.10.2025 (Bekanntmachungsdatum)\n\nBayern Amtsgericht Nürnberg HRA 20375\nRegisterbekanntmachung nach dem Umwandlungsgesetz 15.10.2025 (Eintragungsdatum)\n\nHotel Westend e.K. Inh. Daniel Dümler\nEinzelkaufmann / Einzelkauffrau\nNürnberg\n\nDen Gläubigern des formwechselnden Rechtsträgers ist, wenn sie binnen sechs Monaten nach dem Tag, an dem die Eintragung des Formwechsels nach § 201 UmwG als bekannt gemacht gilt, ihren Anspruch nach Grund und Höhe in Textform anmelden, Sicherheit zu leisten, soweit sie nicht Befriedigung verlangen können. Dieses Recht steht den Gläubigern jedoch nur zu, wenn sie glaubhaft machen, dass durch den Formwechsel die Erfüllung ihrer Forderung gefährdet wird."
    },
    {
      "date": "2025-10-16",
      "id": "134154",
      "original_text": "Einreichung neuer Dokumente\nBayern Amtsgericht Würzburg HRB 161\nStadtwerke Würzburg Aktiengesellschaft – Würzburg",
      "type": "Einreichung neuer Dokumente",
      "state": "Bayern",
      "amtsgericht": "Amtsgericht Würzburg",
      "registernummer": "HRB 161",
      "registerart": "HRB",
      "company_name": "Stadtwerke Würzburg Aktiengesellschaft",
      "company_seat": "Würzburg",
      "details": "16.10.2025 (Bekanntmachungsdatum)\n\nBayern Amtsgericht Würzburg HRB 161\nEinreichung neuer Dokumente\n\nStadtwerke Würzburg Aktiengesellschaft\nAktiengesellschaft\nWürzburg\n\nDem Amtsgericht Würzburg -Registergericht- ist eine Liste der Mitglieder des Aufsichtsrats eingereicht worden, § 106 AktG."
    },
    {
      "date": "2025-10-16",
      "id": "134155",
      "original_text": "Löschungsankündigung\nBayern Amtsgericht Fürth HRB 7701\nZimmerei Armin Popp GmbH – Herzogenaurach",
      "type": "Löschungsankündigung",
      "state": "Bayern",
      "amtsgericht": "Amtsgericht Fürth",
      "registernummer": "HRB 7701",
      "registerart": "HRB",
      "company_name": "Zimmerei Armin Popp GmbH",
      "company_seat": "Herzogenaurach",
      "details": "16.10.2025 (Bekanntmachungsdatum)\n\nBayern Amtsgericht Fürth HRB 7701\nLöschungsankündigung 15.10.2025 (Eintragungsdatum)\n\nZimmerei Armin Popp GmbH\nGesellschaft mit beschränkter Haftung\nHerzogenaurach\n\nDas Registergericht beabsichtigt, die im Handelsregister eingetragene Gesellschaft wegen Vermögenslosigkeit von Amts wegen nach § 394 FamFG zu löschen. Die Frist zur Erhebung eines Widerspruchs ist auf drei Monate festgesetzt."
    },
    {
      "date": "2025-10-16",
      "id": "134156",
      "original_text": "Einreichung neuer Dokumente\nBayern Amtsgericht Ingolstadt HRB 10456\nBAUER Resources GmbH – Schrobenhausen",
      "type": "Einreichung neuer Dokumente",
      "state": "Bayern",
      "amtsgericht": "Amtsgericht Ingolstadt",
      "registernummer": "HRB 10456",
      "registerart": "HRB",
      "company_name": "BAUER Resources GmbH",
      "company_seat": "Schrobenhausen",
      "details": "16.10.2025 (Bekanntmachungsdatum)\n\nBayern Amtsgericht Ingolstadt HRB 10456\nEinreichung neuer Dokumente\n\nBAUER Resources GmbH\nGesellschaft mit beschränkter Haftung\nSchrobenhausen\n\nDem Amtsgericht Ingolstadt -Registergericht- ist eine Liste der Mitglieder des Aufsichtsrats eingereicht worden, § 52 Abs. 3 S. 2 GmbHG."
    },
    {
      "date": "2025-10-16",
      "id": "134157",
      "original_text": "Einreichung neuer Dokumente\nBayern Amtsgericht Nürnberg HRB 22271\nBio-Gate AG – Nürnberg",
      "type": "Einreichung neuer Dokumente",
      "state": "Bayern",
      "amtsgericht": "Amtsgericht Nürnberg",
      "registernummer": "HRB 22271",
      "registerart": "HRB",
      "company_name": "Bio-Gate AG",
      "company_seat": "Nürnberg",
      "details": "16.10.2025 (Bekanntmachungsdatum)\n\nBayern Amtsgericht Nürnberg HRB 22271\nEinreichung neuer Dokumente\n\nBio-Gate AG\nAktiengesellschaft\nNürnberg\n\nBeim Amtsgericht Nürnberg -Registergericht- wurde ein Beschluss über die Ausgabe von Wandelschuldverschreibungen sowie eine Erklärung über deren Ausgabe gem. § 221 Abs. 2 AktG hinterlegt."
    },
    {
      "date": "2025-10-16",
      "id": "134158",
      "original_text": "Registerbekanntmachung nach dem Umwandlungsgesetz\nBayern Amtsgericht Memmingen HRB 19777\nLTG Ulm GmbH – Neu-Ulm",
      "type": "Registerbekanntmachung nach dem Umwandlungsgesetz",
      "state": "Bayern",
      "amtsgericht": "Amtsgericht Memmingen",
      "registernummer": "HRB 19777",
      "registerart": "HRB",
      "company_name": "LTG Ulm GmbH",
      "company_seat": "Neu-Ulm",
      "details": "16.10.2025 (Bekanntmachungsdatum)\n\nBayern Amtsgericht Memmingen HRB 19777\nRegisterbekanntmachung nach dem Umwandlungsgesetz 15.10.2025 (Eintragungsdatum)\n\nLTG Ulm GmbH\nGesellschaft mit beschränkter Haftung\nNeu-Ulm\n\nDen Gläubigern der an der Verschmelzung beteiligten Rechtsträger ist, wenn sie binnen sechs Monaten nach dem Tag, an dem die Eintragung der Verschmelzung in das Register des Sitzes desjenigen Rechtsträgers, dessen Gläubiger sie sind, nach § 19 Abs. 3 UmwG als bekannt gemacht gilt, ihren Anspruch nach Grund und Höhe in Textform anmelden, Sicherheit zu leisten, soweit sie nicht Befriedigung verlangen können. Dieses Recht steht den Gläubigern jedoch nur zu, wenn sie glaubhaft machen, dass durch die Verschmelzung die Erfüllung ihrer Forderung gefährdet wird."
    },
    {
      "date": "2025-10-16",
      "id": "134159",
      "original_text": "Registerbekanntmachung nach dem Umwandlungsgesetz\nBayern Amtsgericht München HRB 252546\nNetwrix Germany GmbH – München",
      "type": "Registerbekanntmachung nach dem Umwandlungsgesetz",
      "state": "Bayern",
      "amtsgericht": "Amtsgericht München",
      "registernummer": "HRB 252546",
      "registerart": "HRB",
      "company_name": "Netwrix Germany GmbH",
      "company_seat": "München",
      "details": "16.10.2025 (Bekanntmachungsdatum)\n\nBayern Amtsgericht München HRB 252546\nRegisterbekanntmachung nach dem Umwandlungsgesetz 15.10.2025 (Eintragungsdatum)\n\nNetwrix Germany GmbH\nGesellschaft mit beschränkter Haftung\nMünchen\n\nDen Gläubigern der an der Verschmelzung beteiligten Rechtsträger ist, wenn sie binnen sechs Monaten nach dem Tag, an dem die Eintragung der Verschmelzung in das Register des Sitzes desjenigen Rechtsträgers, dessen Gläubiger sie sind, nach § 19 Abs. 3 UmwG als bekannt gemacht gilt, ihren Anspruch nach Grund und Höhe in Textform anmelden, Sicherheit zu leisten, soweit sie nicht Befriedigung verlangen können. Dieses Recht steht den Gläubigern jedoch nur zu, wenn sie glaubhaft machen, dass durch die Verschmelzung die Erfüllung ihrer Forderung gefährdet wird."
    },
    {
      "date": "2025-10-16",
      "id": "134160",
      "original_text": "Registerbekanntmachung nach dem Umwandlungsgesetz\nBayern Amtsgericht Nürnberg HRB 45096\nBURGER ENGINEERING GmbH – Schwaig b. Nürnberg",
      "type": "Registerbekanntmachung nach dem Umwandlungsgesetz",
      "state": "Bayern",
      "amtsgericht": "Amtsgericht Nürnberg",
      "registernummer": "HRB 45096",
      "registerart": "HRB",
      "company_name": "BURGER ENGINEERING GmbH",
      "company_seat": "Schwaig b. Nürnberg",
      "details": "16.10.2025 (Bekanntmachungsdatum)\n\nBayern Amtsgericht Nürnberg HRB 45096\nRegisterbekanntmachung nach dem Umwandlungsgesetz 15.10.2025 (Eintragungsdatum)\n\nBURGER ENGINEERING GmbH\nGesellschaft mit beschränkter Haftung\nSchwaig b. Nürnberg\n\nDen Gläubigern des formwechselnden Rechtsträgers ist, wenn sie binnen sechs Monaten nach dem Tag, an dem die Eintragung des Formwechsels nach § 201 UmwG als bekannt gemacht gilt, ihren Anspruch nach Grund und Höhe in Textform anmelden, Sicherheit zu leisten, soweit sie nicht Befriedigung verlangen können. Dieses Recht steht den Gläubigern jedoch nur zu, wenn sie glaubhaft machen, dass durch den Formwechsel die Erfüllung ihrer Forderung gefährdet wird."
    },
    {
      "date": "2025-10-16",
      "id": "134161",
      "original_text": "Registerbekanntmachung nach dem Umwandlungsgesetz\nBayern Amtsgericht Nürnberg HRA 12676\nBURGER ENGINEERING GmbH & Co. KG – Schwaig",
      "type": "Registerbekanntmachung nach dem Umwandlungsgesetz",
      "state": "Bayern",
      "amtsgericht": "Amtsgericht Nürnberg",
      "registernummer": "HRA 12676",
      "registerart": "HRA",
      "company_name": "BURGER ENGINEERING GmbH & Co. KG",
      "company_seat": "Schwaig",
      "details": "16.10.2025 (Bekanntmachungsdatum)\n\nBayern Amtsgericht Nürnberg HRA 12676\nRegisterbekanntmachung nach dem Umwandlungsgesetz 15.10.2025 (Eintragungsdatum)\n\nBURGER ENGINEERING GmbH & Co. KG\nKommanditgesellschaft\nSchwaig\n\nDen Gläubigern des formwechselnden Rechtsträgers ist, wenn sie binnen sechs Monaten nach dem Tag, an dem die Eintragung des Formwechsels nach § 201 UmwG als bekannt gemacht gilt, ihren Anspruch nach Grund und Höhe in Textform anmelden, Sicherheit zu leisten, soweit sie nicht Befriedigung verlangen können. Dieses Recht steht den Gläubigern jedoch nur zu, wenn sie glaubhaft machen, dass durch den Formwechsel die Erfüllung ihrer Forderung gefährdet wird."
    },
    {
      "date": "2025-10-16",
      "id": "134162",
      "original_text": "Registerbekanntmachung nach dem Umwandlungsgesetz\nBayern Amtsgericht Deggendorf HRB 5810\nLeonet GmbH – Deggendorf",
      "type": "Registerbekanntmachung nach dem Umwandlungsgesetz",
      "state": "Bayern",
      "amtsgericht": "Amtsgericht Deggendorf",
      "registernummer": "HRB 5810",
      "registerart": "HRB",
      "company_name": "Leonet GmbH",
      "company_seat": "Deggendorf",
      "details": "16.10.2025 (Bekanntmachungsdatum)\n\nBayern Amtsgericht Deggendorf HRB 5810\nRegisterbekanntmachung nach dem Umwandlungsgesetz 15.10.2025 (Eintragungsdatum)\n\nLeonet GmbH\nGesellschaft mit beschränkter Haftung\nDeggendorf\n\nDen Gläubigern der an der Verschmelzung beteiligten Rechtsträger ist, wenn sie binnen sechs Monaten nach dem Tag, an dem die Eintragung der Verschmelzung in das Register des Sitzes desjenigen Rechtsträgers, dessen Gläubiger sie sind, nach § 19 Abs. 3 UmwG als bekannt gemacht gilt, ihren Anspruch nach Grund und Höhe in Textform anmelden, Sicherheit zu leisten, soweit sie nicht Befriedigung verlangen können. Dieses Recht steht den Gläubigern jedoch nur zu, wenn sie glaubhaft machen, dass durch die Verschmelzung die Erfüllung ihrer Forderung gefährdet wird."
    },
    {
      "date": "2025-10-16",
      "id": "134163",
      "original_text": "Registerbekanntmachung nach dem Umwandlungsgesetz\nBayern Amtsgericht München HRB 306318\nJASSE GmbH – München",
      "type": "Registerbekanntmachung nach dem Umwandlungsgesetz",
      "state": "Bayern",
      "amtsgericht": "Amtsgericht München",
      "registernummer": "HRB 306318",
      "registerart": "HRB",
      "company_name": "JASSE GmbH",
      "company_seat": "München",
      "details": "16.10.2025 (Bekanntmachungsdatum)\n\nBayern Amtsgericht München HRB 306318\nRegisterbekanntmachung nach dem Umwandlungsgesetz 15.10.2025 (Eintragungsdatum)\n\nJASSE GmbH\nGesellschaft mit beschränkter Haftung\nMünchen\n\nDen Gläubigern des formwechselnden Rechtsträgers ist, wenn sie binnen sechs Monaten nach dem Tag, an dem die Eintragung des Formwechsels nach § 201 UmwG als bekannt gemacht gilt, ihren Anspruch nach Grund und Höhe in Textform anmelden, Sicherheit zu leisten, soweit sie nicht Befriedigung verlangen können. Dieses Recht steht den Gläubigern jedoch nur zu, wenn sie glaubhaft machen, dass durch den Formwechsel die Erfüllung ihrer Forderung gefährdet wird."
    },
    {
      "date": "2025-10-16",
      "id": "134164",
      "original_text": "Einreichung neuer Dokumente\nBayern Amtsgericht München HRB 165761\nbayernets GmbH – München",
      "type": "Einreichung neuer Dokumente",
      "state": "Bayern",
      "amtsgericht": "Amtsgericht München",
      "registernummer": "HRB 165761",
      "registerart": "HRB",
      "company_name": "bayernets GmbH",
      "company_seat": "München",
      "details": "16.10.2025 (Bekanntmachungsdatum)\n\nBayern Amtsgericht München HRB 165761\nEinreichung neuer Dokumente\n\nbayernets GmbH\nGesellschaft mit beschränkter Haftung\nMünchen\n\nDem Amtsgericht München -Registergericht- ist eine Liste der Mitglieder des Aufsichtsrats eingereicht worden, § 52 Abs. 3 S. 2 GmbHG."
    },
    {
      "date": "2025-10-16",
      "id": "134165",
      "original_text": "Löschungsankündigung\nBayern Amtsgericht Weiden i. d. OPf. HRA 1838\nFRADI Eurocourier e.K. – Weiden i.d.OPf.",
      "type": "Löschungsankündigung",
      "state": "Bayern",
      "amtsgericht": "Amtsgericht Weiden i. d. OPf.",
      "registernummer": "HRA 1838",
      "registerart": "HRA",
      "company_name": "FRADI Eurocourier e.K.",
      "company_seat": "Weiden i.d.OPf.",
      "details": "16.10.2025 (Bekanntmachungsdatum)\n\nBayern Amtsgericht Weiden i. d. OPf. HRA 1838\nLöschungsankündigung 15.10.2025 (Eintragungsdatum)\n\nFRADI Eurocourier e.K.\nEinzelkaufmann / Einzelkauffrau\nWeiden i.d.OPf.\n\nDas Registergericht beabsichtigt, die im Handelsregister eingetragene Firma von Amts wegen nach § 31 Abs. 2 HGB zu löschen. Die Frist zur Erhebung eines Widerspruchs ist auf einen Monat festgesetzt."
    },
    {
      "date": "2025-10-16",
      "id": "134166",
      "original_text": "Registerbekanntmachung nach dem Umwandlungsgesetz\nBayern Amtsgericht München HRB 303795\nYellow Cab Vermögensverwaltung GmbH – München",
      "type": "Registerbekanntmachung nach dem Umwandlungsgesetz",
      "state": "Bayern",
      "amtsgericht": "Amtsgericht München",
      "registernummer": "HRB 303795",
      "registerart": "HRB",
      "company_name": "Yellow Cab Vermögensverwaltung GmbH",
      "company_seat": "München",
      "details": "16.10.2025 (Bekanntmachungsdatum)\n\nBayern Amtsgericht München HRB 303795\nRegisterbekanntmachung nach dem Umwandlungsgesetz 15.10.2025 (Eintragungsdatum)\n\nYellow Cab Vermögensverwaltung GmbH\nGesellschaft mit beschränkter Haftung\nMünchen\n\nDen Gläubigern der an der Spaltung beteiligten Rechtsträger ist, wenn sie binnen sechs Monaten nach dem Tag, an dem die Eintragung der Spaltung in das Register des Sitzes desjenigen Rechtsträgers, dessen Gläubiger sie sind, nach §§ 125, 19 Abs. 3 UmwG als bekannt gemacht gilt, ihren Anspruch nach Grund und Höhe in Textform anmelden, Sicherheit zu leisten, soweit sie nicht Befriedigung verlangen können. Dieses Recht steht den Gläubigern jedoch nur zu, wenn sie glaubhaft machen, dass durch die Spaltung die Erfüllung ihrer Forderung gefährdet wird."
    },
    {
      "date": "2025-10-16",
      "id": "134167",
      "original_text": "Einreichung neuer Dokumente\nSaarland Amtsgericht Saarbrücken HRB 108025\nNext2Sun AG – Dillingen/Saar",
      "type": "Einreichung neuer Dokumente",
      "state": "Saarland",
      "amtsgericht": "Amtsgericht Saarbrücken",
      "registernummer": "HRB 108025",
      "registerart": "HRB",
      "company_name": "Next2Sun AG",
      "company_seat": "Dillingen/Saar",
      "details": "16.10.2025 (Bekanntmachungsdatum)\n\nSaarland Amtsgericht Saarbrücken HRB 108025\nEinreichung neuer Dokumente 16.10.2025 (Eintragungsdatum)\n\nNext2Sun AG\nAktiengesellschaft\nDillingen/Saar\n\nDer Vorstand der Gesellschaft hat eine Liste der Mitglieder des Aufsichtsrats zum Handelsregister eingereicht (§ 106 AktG)."
    },
    {
      "date": "2025-10-16",
      "id": "134168",
      "original_text": "Sonstige Registerbekanntmachung\nBaden-Württemberg Amtsgericht Mannheim HRB 211230\nSchaeffler AS Auslandsholding GmbH – Bühl",
      "type": "Sonstige Registerbekanntmachung",
      "state": "Baden-Württemberg",
      "amtsgericht": "Amtsgericht Mannheim",
      "registernummer": "HRB 211230",
      "registerart": "HRB",
      "company_name": "Schaeffler AS Auslandsholding GmbH",
      "company_seat": "Bühl",
      "details": "16.10.2025 (Bekanntmachungsdatum)\n\nBaden-Württemberg Amtsgericht Mannheim HRB 211230\nSonstige Registerbekanntmachung 15.10.2025 (Eintragungsdatum)\n\nSchaeffler AS Auslandsholding GmbH\nGesellschaft mit beschränkter Haftung\nBühl\n\nAls nicht eingetragen wird bekanntgemacht:\nDen Gläubigern der Gesellschaft, deren Forderungen begründet worden sind, bevor die Eintragung der Beendigung des Vertrages in das Handelsregister nach § 10 HGB als bekanntgemacht gilt, ist vom anderen Vertragsteil Sicherheit zu leisten, wenn sie sich binnen sechs Monaten nach der Bekanntmachung zu diesem Zweck bei ihm melden."
    },
    {
      "date": "2025-10-16",
      "id": "134169",
      "original_text": "Registerbekanntmachung nach dem Umwandlungsgesetz\nSchleswig-Holstein Amtsgericht Lübeck HRB 4537 AH\nMarecki GmbH Sanitärtechnik und Klempnerei – Ahrensburg",
      "type": "Registerbekanntmachung nach dem Umwandlungsgesetz",
      "state": "Schleswig-Holstein",
      "amtsgericht": "Amtsgericht Lübeck",
      "registernummer": "HRB 4537 AH",
      "registerart": "HRB",
      "company_name": "Marecki GmbH Sanitärtechnik und Klempnerei",
      "company_seat": "Ahrensburg",
      "details": "16.10.2025 (Bekanntmachungsdatum)\n\nSchleswig-Holstein Amtsgericht Lübeck HRB 4537 AH\nRegisterbekanntmachung nach dem Umwandlungsgesetz 13.10.2025 (Eintragungsdatum)\n\nMarecki GmbH Sanitärtechnik und Klempnerei\nGesellschaft mit beschränkter Haftung\nAhrensburg\n\nAls nicht eingetragen wird veröffentlicht: Den Gläubigern der an der Verschmelzung beteiligten Rechtsträger ist, wenn sie binnen sechs Monaten nach dem Tag, an dem die Eintragung der Verschmelzung in das Register des Sitzes desjenigen Rechtsträgers, dessen Gläubiger sie sind, als bekannt gemacht gilt, ihren Anspruch nach Grund und Höhe schriftlich anmelden, Sicherheit zu leisten, soweit sie nicht Befriedigung verlangen können. Dieses Recht steht den Gläubigern jedoch nur zu, wenn sie glaubhaft machen, dass durch die Verschmelzung die Erfüllung ihrer Forderung gefährdet wird.Zu Eintragungsnummer 5 vom 13.10.2025 wird als nicht eingetragen veröffentlicht:"
    },
    {
      "date": "2025-10-16",
      "id": "134170",
      "original_text": "Löschungsankündigung\nBerlin Amtsgericht Berlin (Charlottenburg) HRB 246176\nMarjan Handels GmbH – Berlin",
      "type": "Löschungsankündigung",
      "state": "Berlin",
      "amtsgericht": "Amtsgericht Berlin (Charlottenburg)",
      "registernummer": "HRB 246176",
      "registerart": "HRB",
      "company_name": "Marjan Handels GmbH",
      "company_seat": "Berlin",
      "details": "16.10.2025 (Bekanntmachungsdatum)\n\nBerlin Amtsgericht Berlin (Charlottenburg) HRB 246176\nLöschungsankündigung\n\nMarjan Handels GmbH\nGesellschaft mit beschränkter Haftung\nBerlin\n\nBei der nachstehenden Gesellschaft wird das Amtslöschungsverfahren gemäß § 394 FamFG eingeleitet. Widerspruchsfrist: 6 Wochen."
    },
    {
      "date": "2025-10-16",
      "id": "134171",
      "original_text": "Löschungsankündigung\nBerlin Amtsgericht Berlin (Charlottenburg) HRB 189529\nQ Clinic GmbH – Berlin",
      "type": "Löschungsankündigung",
      "state": "Berlin",
      "amtsgericht": "Amtsgericht Berlin (Charlottenburg)",
      "registernummer": "HRB 189529",
      "registerart": "HRB",
      "company_name": "Q Clinic GmbH",
      "company_seat": "Berlin",
      "details": "16.10.2025 (Bekanntmachungsdatum)\n\nBerlin Amtsgericht Berlin (Charlottenburg) HRB 189529\nLöschungsankündigung\n\nQ Clinic GmbH\nGesellschaft mit beschränkter Haftung\nBerlin\n\nBei der nachstehenden Gesellschaft wird das Amtslöschungsverfahren gemäß § 394 FamFG eingeleitet. Widerspruchsfrist 6 Wochen"
    },
    {
      "date": "2025-10-16",
      "id": "134172",
      "original_text": "Löschungsankündigung\nBerlin Amtsgericht Berlin (Charlottenburg) HRB 243443\nSirin Transporte GmbH – Berlin",
      "type": "Löschungsankündigung",
      "state": "Berlin",
      "amtsgericht": "Amtsgericht Berlin (Charlottenburg)",
      "registernummer": "HRB 243443",
      "registerart": "HRB",
      "company_name": "Sirin Transporte GmbH",
      "company_seat": "Berlin",
      "details": "16.10.2025 (Bekanntmachungsdatum)\n\nBerlin Amtsgericht Berlin (Charlottenburg) HRB 243443\nLöschungsankündigung\n\nSirin Transporte GmbH\nGesellschaft mit beschränkter Haftung\nBerlin\n\nBei der nachstehenden Gesellschaft wird das Amtslöschungsverfahren gemäß § 394 FamFG eingeleitet. Widerspruchsfrist 6 Wochen"
    },
    {
      "date": "2025-10-16",
      "id": "134173",
      "original_text": "Registerbekanntmachung nach dem Umwandlungsgesetz\nBaden-Württemberg Amtsgericht Mannheim HRB 732330\nWEISS.Fastlane GmbH – Buchen Odenwald",
      "type": "Registerbekanntmachung nach dem Umwandlungsgesetz",
      "state": "Baden-Württemberg",
      "amtsgericht": "Amtsgericht Mannheim",
      "registernummer": "HRB 732330",
      "registerart": "HRB",
      "company_name": "WEISS.Fastlane GmbH",
      "company_seat": "Buchen Odenwald",
      "details": "16.10.2025 (Bekanntmachungsdatum)\n\nBaden-Württemberg Amtsgericht Mannheim HRB 732330\nRegisterbekanntmachung nach dem Umwandlungsgesetz 16.10.2025 (Eintragungsdatum)\n\nWEISS.Fastlane GmbH\nGesellschaft mit beschränkter Haftung\nBuchen Odenwald\n\nAls nicht eingetragen wird bekanntgemacht:\nDen Gläubigern der an der Verschmelzung beteiligten Rechtsträger ist, wenn sie binnen sechs Monaten nach dem Tag, an dem die Eintragung der Verschmelzung in das Register des Sitzes desjenigen Rechtsträgers, dessen Gläubiger sie sind, nach § 19 Abs. 3 UmwG als bekanntgemacht gilt, ihren Anspruch nach Grund und Höhe schriftlich anmelden, Sicherheit zu leisten, soweit sie nicht Befriedigung verlangen können. Dieses Recht steht den Gläubigern jedoch nur zu, wenn sie glaubhaft machen, dass durch die Verschmelzung die Erfüllung ihrer Forderung gefährdet wird."
    },
    {
      "date": "2025-10-16",
      "id": "134174",
      "original_text": "Löschungsankündigung\nBerlin Amtsgericht Berlin (Charlottenburg) HRB 154235\nKleWer - Immobilien UG (haftungsbeschränkt) – Berlin",
      "type": "Löschungsankündigung",
      "state": "Berlin",
      "amtsgericht": "Amtsgericht Berlin (Charlottenburg)",
      "registernummer": "HRB 154235",
      "registerart": "HRB",
      "company_name": "KleWer - Immobilien UG (haftungsbeschränkt)",
      "company_seat": "Berlin",
      "details": "16.10.2025 (Bekanntmachungsdatum)\n\nBerlin Amtsgericht Berlin (Charlottenburg) HRB 154235\nLöschungsankündigung\n\nKleWer - Immobilien UG (haftungsbeschränkt)\nGesellschaft mit beschränkter Haftung\nBerlin\n\nBei der nachstehenden Gesellschaft wird das Amtslöschungsverfahren gemäß § 394 FamFG eingeleitet. Widerspruchsfrist 6 Wochen"
    },
    {
      "date": "2025-10-16",
      "id": "134175",
      "original_text": "Sonstige Registerbekanntmachung\nBaden-Württemberg Amtsgericht Stuttgart HRB 21442\nAlmato AG – Stuttgart",
      "type": "Sonstige Registerbekanntmachung",
      "state": "Baden-Württemberg",
      "amtsgericht": "Amtsgericht Stuttgart",
      "registernummer": "HRB 21442",
      "registerart": "HRB",
      "company_name": "Almato AG",
      "company_seat": "Stuttgart",
      "details": "16.10.2025 (Bekanntmachungsdatum)\n\nBaden-Württemberg Amtsgericht Stuttgart HRB 21442\nSonstige Registerbekanntmachung 16.10.2025 (Eintragungsdatum)\n\nAlmato AG\nAktiengesellschaft\nStuttgart\n\nAls nicht eingetragen wird bekanntgemacht: Den Gläubigern der Gesellschaft, deren Forderungen begründet worden sind, bevor die Eintragung der Beendigung des Vertrages in das Handelsregister nach § 10 HGB als bekanntgemacht gilt, ist vom anderen Vertragsteil Sicherheit zu leisten, wenn sie sich binnen sechs Monaten nach der Bekanntmachung zu diesem Zweck bei ihm melden."
    },
    {
      "date": "2025-10-16",
      "id": "134176",
      "original_text": "Registerbekanntmachung nach dem Umwandlungsgesetz\nBerlin Amtsgericht Berlin (Charlottenburg) HRB 112255\nbrandnewmusic GmbH – Berlin",
      "type": "Registerbekanntmachung nach dem Umwandlungsgesetz",
      "state": "Berlin",
      "amtsgericht": "Amtsgericht Berlin (Charlottenburg)",
      "registernummer": "HRB 112255",
      "registerart": "HRB",
      "company_name": "brandnewmusic GmbH",
      "company_seat": "Berlin",
      "details": "16.10.2025 (Bekanntmachungsdatum)\n\nBerlin Amtsgericht Berlin (Charlottenburg) HRB 112255\nRegisterbekanntmachung nach dem Umwandlungsgesetz 15.10.2025 (Eintragungsdatum)\n\nbrandnewmusic GmbH\nGesellschaft mit beschränkter Haftung\nBerlin\n\nZu Eintragungsnummer 4 vom 15.10.2025 wird als nicht eingetragen veröffentlicht: Den Gläubigern der an der Verschmelzung beteiligten Rechtsträger ist, wenn sie binnen sechs Monaten nach dem Tag, an dem die Eintragung der Verschmelzung in das Register des Sitzes desjenigen Rechtsträgers, dessen Gläubiger sie sind, als bekannt gemacht gilt, ihren Anspruch nach Grund und Höhe schriftlich anmelden, Sicherheit zu leisten, soweit sie nicht Befriedigung verlangen können. Dieses Recht steht den Gläubigern jedoch nur zu, wenn sie glaubhaft machen, dass durch die Verschmelzung die Erfüllung ihrer Forderung gefährdet wird. Das Recht, Sicherheitsleistung zu verlangen, steht Gläubigern nicht zu, die im Falle der Insolvenz ein Recht auf vorzugsweise Befriedigung aus einer Deckungsmasse haben, die nach gesetzlicher Vorschrift zu ihrem Schutz errichtet und staatlich überwacht ist."
    },
    {
      "date": "2025-10-16",
      "id": "134177",
      "original_text": "Registerbekanntmachung nach dem Umwandlungsgesetz\nBerlin Amtsgericht Berlin (Charlottenburg) HRB 198701\nHouse of Pop GmbH – Berlin",
      "type": "Registerbekanntmachung nach dem Umwandlungsgesetz",
      "state": "Berlin",
      "amtsgericht": "Amtsgericht Berlin (Charlottenburg)",
      "registernummer": "HRB 198701",
      "registerart": "HRB",
      "company_name": "House of Pop GmbH",
      "company_seat": "Berlin",
      "details": "16.10.2025 (Bekanntmachungsdatum)\n\nBerlin Amtsgericht Berlin (Charlottenburg) HRB 198701\nRegisterbekanntmachung nach dem Umwandlungsgesetz 15.10.2025 (Eintragungsdatum)\n\nHouse of Pop GmbH\nGesellschaft mit beschränkter Haftung\nBerlin\n\nZu Eintragungsnummer 3 vom 15.10.2025 wird als nicht eingetragen veröffentlicht:Den Gläubigern der an der Verschmelzung beteiligten Rechtsträger ist, wenn sie binnen sechs Monaten nach dem Tag, an dem die Eintragung der Verschmelzung in das Register des Sitzes desjenigen Rechtsträgers, dessen Gläubiger sie sind, als bekannt gemacht gilt, ihren Anspruch nach Grund und Höhe schriftlich anmelden, Sicherheit zu leisten, soweit sie nicht Befriedigung verlangen können. Dieses Recht steht den Gläubigern jedoch nur zu, wenn sie glaubhaft machen, dass durch die Verschmelzung die Erfüllung ihrer Forderung gefährdet wird. Das Recht, Sicherheitsleistung zu verlangen, steht Gläubigern nicht zu, die im Falle der Insolvenz ein Recht auf vorzugsweise Befriedigung aus einer Deckungsmasse haben, die nach gesetzlicher Vorschrift zu ihrem Schutz errichtet und staatlich überwacht ist."
    },
    {
      "date": "2025-10-16",
      "id": "134178",
      "original_text": "Registerbekanntmachung nach dem Umwandlungsgesetz\nBerlin Amtsgericht Berlin (Charlottenburg) HRB 195533\nAnticipate GmbH – Berlin",
      "type": "Registerbekanntmachung nach dem Umwandlungsgesetz",
      "state": "Berlin",
      "amtsgericht": "Amtsgericht Berlin (Charlottenburg)",
      "registernummer": "HRB 195533",
      "registerart": "HRB",
      "company_name": "Anticipate GmbH",
      "company_seat": "Berlin",
      "details": "16.10.2025 (Bekanntmachungsdatum)\n\nBerlin Amtsgericht Berlin (Charlottenburg) HRB 195533\nRegisterbekanntmachung nach dem Umwandlungsgesetz 15.10.2025 (Eintragungsdatum)\n\nAnticipate GmbH\nGesellschaft mit beschränkter Haftung\nBerlin\n\nZu Eintragungsnummer 5 vom 15.10.2025 wird als nicht eingetragen veröffentlicht: Den Gläubigern der an der Verschmelzung beteiligten Rechtsträger ist, wenn sie binnen sechs Monaten nach dem Tag, an dem die Eintragung der Verschmelzung in das Register des Sitzes desjenigen Rechtsträgers, dessen Gläubiger sie sind, als bekannt gemacht gilt, ihren Anspruch nach Grund und Höhe schriftlich anmelden, Sicherheit zu leisten, soweit sie nicht Befriedigung verlangen können. Dieses Recht steht den Gläubigern jedoch nur zu, wenn sie glaubhaft machen, dass durch die Verschmelzung die Erfüllung ihrer Forderung gefährdet wird. Das Recht, Sicherheitsleistung zu verlangen, steht Gläubigern nicht zu, die im Falle der Insolvenz ein Recht auf vorzugsweise Befriedigung aus einer Deckungsmasse haben, die nach gesetzlicher Vorschrift zu ihrem Schutz errichtet und staatlich überwacht ist."
    },
    {
      "date": "2025-10-16",
      "id": "134179",
      "original_text": "Registerbekanntmachung nach dem Umwandlungsgesetz\nSaarland Amtsgericht Saarbrücken HRA 12633\nMP Saar e.K., Inh. Michaela Lehberger – Schmelz",
      "type": "Registerbekanntmachung nach dem Umwandlungsgesetz",
      "state": "Saarland",
      "amtsgericht": "Amtsgericht Saarbrücken",
      "registernummer": "HRA 12633",
      "registerart": "HRA",
      "company_name": "MP Saar e.K., Inh. Michaela Lehberger",
      "company_seat": "Schmelz",
      "details": "16.10.2025 (Bekanntmachungsdatum)\n\nSaarland Amtsgericht Saarbrücken HRA 12633\nRegisterbekanntmachung nach dem Umwandlungsgesetz 16.10.2025 (Eintragungsdatum)\n\nMP Saar e.K., Inh. Michaela Lehberger\nEinzelkaufmann / Einzelkauffrau\nSchmelz\n\nAls nicht eingetragen wird bekannt gemacht: Den Gläubigern der an der Verschmelzung beteiligten Gesellschaften ist, wenn sie binnen sechs Monaten nach dem Tag, an dem die Eintragung der Verschmelzung in das Register des Sitzes desjenigen Rechtsträgers, dessen Gläubiger sie sind, nach § 19 Absatz 3 UmwG bekannt gemacht worden ist, ihren Anspruch nach Grund und Höhe schriftlich anmelden, Sicherheit zu leisten, soweit sie nicht Befriedigung verlangen können. Dieses Recht steht den Gläubigern jedoch nur zu, wenn sie glaubhaft machen, dass durch die Verschmelzung die Erfüllung ihrer Forderung gefährdet wird."
    },
    {
      "date": "2025-10-16",
      "id": "134180",
      "original_text": "Registerbekanntmachung nach dem Umwandlungsgesetz\nBaden-Württemberg Amtsgericht Freiburg HRB 730822\nPassion Oldihaus Baden GmbH – Schutterwald",
      "type": "Registerbekanntmachung nach dem Umwandlungsgesetz",
      "state": "Baden-Württemberg",
      "amtsgericht": "Amtsgericht Freiburg",
      "registernummer": "HRB 730822",
      "registerart": "HRB",
      "company_name": "Passion Oldihaus Baden GmbH",
      "company_seat": "Schutterwald",
      "details": "16.10.2025 (Bekanntmachungsdatum)\n\nBaden-Württemberg Amtsgericht Freiburg HRB 730822\nRegisterbekanntmachung nach dem Umwandlungsgesetz 16.10.2025 (Eintragungsdatum)\n\nPassion Oldihaus Baden GmbH\nGesellschaft mit beschränkter Haftung\nSchutterwald\n\nAls nicht eingetragen wird bekanntgemacht:\nDen Gläubigern der an der Ausgliederung beteiligten Rechtsträger ist, wenn sie binnen sechs Monaten nach dem Tag, an dem die Eintragung der Ausgliederung in das Register des Sitzes desjenigen Rechtsträgers, dessen Gläubiger sie sind, nach § 19 Abs. 3 UmwG als bekanntgemacht gilt, ihren Anspruch nach Grund und Höhe schriftlich anmelden, Sicherheit zu leisten, soweit sie nicht Befriedigung verlangen können. Dieses Recht steht den Gläubigern jedoch nur zu, wenn sie glaubhaft machen, dass durch die Ausgliederung die Erfüllung ihrer Forderung gefährdet wird."
    },
    {
      "date": "2025-10-16",
      "id": "134181",
      "original_text": "Registerbekanntmachung nach dem Umwandlungsgesetz\nBaden-Württemberg Amtsgericht Freiburg HRA 701373\nOldihaus-Baden e.K. – Schutterwald",
      "type": "Registerbekanntmachung nach dem Umwandlungsgesetz",
      "state": "Baden-Württemberg",
      "amtsgericht": "Amtsgericht Freiburg",
      "registernummer": "HRA 701373",
      "registerart": "HRA",
      "company_name": "Oldihaus-Baden e.K.",
      "company_seat": "Schutterwald",
      "details": "16.10.2025 (Bekanntmachungsdatum)\n\nBaden-Württemberg Amtsgericht Freiburg HRA 701373\nRegisterbekanntmachung nach dem Umwandlungsgesetz 16.10.2025 (Eintragungsdatum)\n\nOldihaus-Baden e.K.\nEinzelkaufmann / Einzelkauffrau\nSchutterwald\n\nAls nicht eingetragen wird bekanntgemacht:\nDen Gläubigern der an der Ausgliederung beteiligten Rechtsträger ist, wenn sie binnen sechs Monaten nach dem Tag, an dem die Eintragung der Ausgliederung in das Register des Sitzes desjenigen Rechtsträgers, dessen Gläubiger sie sind, nach § 19 Abs. 3 UmwG als bekanntgemacht gilt, ihren Anspruch nach Grund und Höhe schriftlich anmelden, Sicherheit zu leisten, soweit sie nicht Befriedigung verlangen können. Dieses Recht steht den Gläubigern jedoch nur zu, wenn sie glaubhaft machen, dass durch die Ausgliederung die Erfüllung ihrer Forderung gefährdet wird."
    },
    {
      "date": "2025-10-16",
      "id": "134182",
      "original_text": "Registerbekanntmachung nach dem Umwandlungsgesetz\nSachsen-Anhalt Amtsgericht Stendal HRB 36577\nGREIFE Finanzmakler GmbH – Wernigerode",
      "type": "Registerbekanntmachung nach dem Umwandlungsgesetz",
      "state": "Sachsen-Anhalt",
      "amtsgericht": "Amtsgericht Stendal",
      "registernummer": "HRB 36577",
      "registerart": "HRB",
      "company_name": "GREIFE Finanzmakler GmbH",
      "company_seat": "Wernigerode",
      "details": "16.10.2025 (Bekanntmachungsdatum)\n\nSachsen-Anhalt Amtsgericht Stendal HRB 36577\nRegisterbekanntmachung nach dem Umwandlungsgesetz 16.10.2025 (Eintragungsdatum)\n\nGREIFE Finanzmakler GmbH\nGesellschaft mit beschränkter Haftung\nWernigerode\n\nstanden durch Ausgliederung des von Lucas John Elias Greife, Wernigerode, *10.12.1994, als Inhaber unter der Firma \"GREIFE Finanzmakler e.K.\", mit Niederlassung in Wernigerode (Amtsgericht Stendal HRA 8240) betriebenen einzelkaufmännischen Unternehmens aus dem Vermögen des Inhabers. Die Ausgliederung ist mit Eintragung im Register des übertragenden Rechtsträgers am 16.10.2025 wirksam geworden.Nicht eingetragen:Den Gläubigern des formwechselnden  Rechtsträgers, ist wenn sie binnen sechs Monaten nach dem Tag, an dem die Eintragung des Formwechsels nach § 201 UmwG als bekanntgemacht gilt, ihren Anspruch nach Grund und Höhe schriftlich anmelden, Sicherheit zu leisten, soweit sie nicht Befriedigung verlangen können. Dieses Recht steht ihnen jedoch nur zu, wenn sie glaubhaft machen, dass durch den Formwechsel die Erfüllung ihrer Forderung gefährdet wird."
    },
    {
      "date": "2025-10-16",
      "id": "134183",
      "original_text": "Registerbekanntmachung nach dem Umwandlungsgesetz\nSachsen-Anhalt Amtsgericht Stendal HRA 8240\nGREIFE Finanzmakler e.K. – Wernigerode",
      "type": "Registerbekanntmachung nach dem Umwandlungsgesetz",
      "state": "Sachsen-Anhalt",
      "amtsgericht": "Amtsgericht Stendal",
      "registernummer": "HRA 8240",
      "registerart": "HRA",
      "company_name": "GREIFE Finanzmakler e.K.",
      "company_seat": "Wernigerode",
      "details": "16.10.2025 (Bekanntmachungsdatum)\n\nSachsen-Anhalt Amtsgericht Stendal HRA 8240\nRegisterbekanntmachung nach dem Umwandlungsgesetz 16.10.2025 (Eintragungsdatum)\n\nGREIFE Finanzmakler e.K.\nEinzelkaufmann / Einzelkauffrau\nWernigerode\n\nNicht eingetragen:\nDen Gläubigern der an der Ausgliederung beteiligten Rechtsträger, ist wenn sie binnen sechs Monaten nach dem Tag, an dem die Eintragung der Ausgliederung nach §§125, 19 Abs. 3 UmwG als bekanntgemacht gilt, ihren Anspruch nach Grund und Höhe schriftlich anmelden, Sicherheit zu leisten, soweit sie nicht Befriedigung verlangen können. Diese Recht steht ihnen jedoch nur zu, wenn sie glaubhaft machen, dass durch die Ausgliederung die Erfüllung ihrer Forderung gefährdet wird."
    },
    {
      "date": "2025-10-16",
      "id": "134184",
      "original_text": "Löschungsankündigung\nSchleswig-Holstein Amtsgericht Kiel HRA 9401\nDokan Service 21 Gebäudereinigung Inh. Idris Kadir e. K. – Kiel",
      "type": "Löschungsankündigung",
      "state": "Schleswig-Holstein",
      "amtsgericht": "Amtsgericht Kiel",
      "registernummer": "HRA 9401",
      "registerart": "HRA",
      "company_name": "Dokan Service 21 Gebäudereinigung Inh. Idris Kadir e. K.",
      "company_seat": "Kiel",
      "details": "16.10.2025 (Bekanntmachungsdatum)\n\nSchleswig-Holstein Amtsgericht Kiel HRA 9401\nLöschungsankündigung\n\nDokan Service 21 Gebäudereinigung Inh. Idris Kadir e. K.\nEinzelkaufmann / Einzelkauffrau\nKiel\n\nBei der nachstehenden Firma wird das Amtslöschungsverfahren gemäß § 31 Abs. 2 HGB eingeleitet. Widerspruchsfrist: 2 Monate."
    },
    {
      "date": "2025-10-16",
      "id": "134185",
      "original_text": "Registerbekanntmachung nach dem Umwandlungsgesetz\nBaden-Württemberg Amtsgericht Stuttgart HRB 782613\nProspera GmbH – Filderstadt",
      "type": "Registerbekanntmachung nach dem Umwandlungsgesetz",
      "state": "Baden-Württemberg",
      "amtsgericht": "Amtsgericht Stuttgart",
      "registernummer": "HRB 782613",
      "registerart": "HRB",
      "company_name": "Prospera GmbH",
      "company_seat": "Filderstadt",
      "details": "16.10.2025 (Bekanntmachungsdatum)\n\nBaden-Württemberg Amtsgericht Stuttgart HRB 782613\nRegisterbekanntmachung nach dem Umwandlungsgesetz 16.10.2025 (Eintragungsdatum)\n\nProspera GmbH\nGesellschaft mit beschränkter Haftung\nFilderstadt\n\nDen Gläubigern der an der Verschmelzung beteiligten Rechtsträger ist, wenn sie binnen sechs Monaten nach dem Tag, an dem die Eintragung der Verschmelzung in das Register des Sitzes desjenigen Rechtsträgers, dessen Gläubiger sie sind, nach § 19 Abs. 3 UmwG als bekanntgemacht gilt, ihren Anspruch nach Grund und Höhe schriftlich anmelden, Sicherheit zu leisten, soweit sie nicht Befriedigung verlangen können. Dieses Recht steht den Gläubigern jedoch nur zu, wenn sie glaubhaft machen, dass durch die Verschmelzung die Erfüllung ihrer Forderung gefährdet wird."
    },
    {
      "date": "2025-10-16",
      "id": "134186",
      "original_text": "Löschungsankündigung\nMecklenburg-Vorpommern Amtsgericht Stralsund HRA 2158\nPlumex GmbH & Co. KG – Grimmen",
      "type": "Löschungsankündigung",
      "state": "Mecklenburg-Vorpommern",
      "amtsgericht": "Amtsgericht Stralsund",
      "registernummer": "HRA 2158",
      "registerart": "HRA",
      "company_name": "Plumex GmbH & Co. KG",
      "company_seat": "Grimmen",
      "details": "16.10.2025 (Bekanntmachungsdatum)\n\nMecklenburg-Vorpommern Amtsgericht Stralsund HRA 2158\nLöschungsankündigung\n\nPlumex GmbH & Co. KG\nKommanditgesellschaft\nGrimmen\n\nDas Registergericht beabsichtigt, die im Handelsregister eingetragene Gesellschaft von Amts wegen nach § 394 FamFG zu löschen. Die Frist zur Erhebung eines Widerspruchs gegen die beabsichtigte Löschung wird auf 1 Monat festgesetzt."
    },
    {
      "date": "2025-10-16",
      "id": "134187",
      "original_text": "Löschungsankündigung\nBerlin Amtsgericht Berlin (Charlottenburg) HRB 145588\nVDL Vermögensverwaltung UG (haftungsbeschränkt) – Berlin",
      "type": "Löschungsankündigung",
      "state": "Berlin",
      "amtsgericht": "Amtsgericht Berlin (Charlottenburg)",
      "registernummer": "HRB 145588",
      "registerart": "HRB",
      "company_name": "VDL Vermögensverwaltung UG (haftungsbeschränkt)",
      "company_seat": "Berlin",
      "details": "16.10.2025 (Bekanntmachungsdatum)\n\nBerlin Amtsgericht Berlin (Charlottenburg) HRB 145588\nLöschungsankündigung\n\nVDL Vermögensverwaltung UG (haftungsbeschränkt)\nGesellschaft mit beschränkter Haftung\nBerlin\n\nBei der nachstehenden Gesellschaft wird das Amtslöschungsverfahren gemäß § 394 FamFG eingeleitet. Widerspruchsfrist 6 Wochen"
    },
    {
      "date": "2025-10-16",
      "id": "134188",
      "original_text": "Registerbekanntmachung nach dem Umwandlungsgesetz\nHamburg Amtsgericht Hamburg HRA 131207\nNoori Nutzfahrzeughandel, Inhaber Baschir Ahmad Noori e.K. – Hamburg",
      "type": "Registerbekanntmachung nach dem Umwandlungsgesetz",
      "state": "Hamburg",
      "amtsgericht": "Amtsgericht Hamburg",
      "registernummer": "HRA 131207",
      "registerart": "HRA",
      "company_name": "Noori Nutzfahrzeughandel, Inhaber Baschir Ahmad Noori e.K.",
      "company_seat": "Hamburg",
      "details": "16.10.2025 (Bekanntmachungsdatum)\n\nHamburg Amtsgericht Hamburg HRA 131207\nRegisterbekanntmachung nach dem Umwandlungsgesetz 16.10.2025 (Eintragungsdatum)\n\nNoori Nutzfahrzeughandel, Inhaber Baschir Ahmad Noori e.K.\nEinzelkaufmann\nHamburg\n\nAls nicht eingetragen wird bekannt gemacht:\nDen Gläubigern der an der Ausgliederung beteiligten Gesellschaften ist, wenn sie binnen sechs Monaten nach dem Tag, an dem die Eintragung der Ausgliederung in das Register des Sitzes desjenigen Rechtsträgers, dessen Gläubiger sie sind, nach § 19 Absatz 3 UmwG als bekannt gemacht gilt, ihren Anspruch nach Grund und Höhe schriftlich anmelden, Sicherheit zu leisten, soweit sie nicht Befriedigung verlangen können. Dieses Recht steht den Gläubigern jedoch nur zu, wenn sie glaubhaft machen, dass durch die Ausgliederung die Erfüllung ihrer Forderung gefährdet wird."
    },
    {
      "date": "2025-10-16",
      "id": "134189",
      "original_text": "Einreichung neuer Dokumente\nHamburg Amtsgericht Hamburg HRB 16106\nHGV Hamburger Gesellschaft für Vermögens- und Beteiligungsmanagement mbH – Hamburg",
      "type": "Einreichung neuer Dokumente",
      "state": "Hamburg",
      "amtsgericht": "Amtsgericht Hamburg",
      "registernummer": "HRB 16106",
      "registerart": "HRB",
      "company_name": "HGV Hamburger Gesellschaft für Vermögens- und Beteiligungsmanagement mbH",
      "company_seat": "Hamburg",
      "details": "16.10.2025 (Bekanntmachungsdatum)\n\nHamburg Amtsgericht Hamburg HRB 16106\nEinreichung neuer Dokumente\n\nHGV Hamburger Gesellschaft für Vermögens- und Beteiligungsmanagement mbH\nGesellschaft mit beschränkter Haftung\nHamburg\n\nAls nicht eingetragen wird bekannt gemacht: Liste des Aufsichtsrats wurde eingereicht."
    },
    {
      "date": "2025-10-16",
      "id": "134190",
      "original_text": "Registerbekanntmachung nach dem Umwandlungsgesetz\nHamburg Amtsgericht Hamburg HRB 122405\neverii Germany GmbH – Hamburg",
      "type": "Registerbekanntmachung nach dem Umwandlungsgesetz",
      "state": "Hamburg",
      "amtsgericht": "Amtsgericht Hamburg",
      "registernummer": "HRB 122405",
      "registerart": "HRB",
      "company_name": "everii Germany GmbH",
      "company_seat": "Hamburg",
      "details": "16.10.2025 (Bekanntmachungsdatum)\n\nHamburg Amtsgericht Hamburg HRB 122405\nRegisterbekanntmachung nach dem Umwandlungsgesetz 16.10.2025 (Eintragungsdatum)\n\neverii Germany GmbH\nGesellschaft mit beschränkter Haftung\nHamburg\n\nAls nicht eingetragen wird bekannt gemacht:\nDen Gläubigern der an der Verschmelzung beteiligten Gesellschaften ist, wenn sie binnen sechs Monaten nach dem Tag, an dem die Eintragung der Verschmelzung in das Register des Sitzes desjenigen Rechtsträgers, dessen Gläubiger sie sind, nach § 19 Absatz 3 UmwG als bekannt gemacht gilt, ihren Anspruch nach Grund und Höhe schriftlich anmelden, Sicherheit zu leisten, soweit sie nicht Befriedigung verlangen können. Dieses Recht steht den Gläubigern jedoch nur zu, wenn sie glaubhaft machen, dass durch die Verschmelzung die Erfüllung ihrer Forderung gefährdet wird."
    },
    {
      "date": "2025-10-16",
      "id": "134191",
      "original_text": "Registerbekanntmachung nach dem Umwandlungsgesetz\nHamburg Amtsgericht Hamburg HRB 186902\nMyTruck GmbH – Hamburg",
      "type": "Registerbekanntmachung nach dem Umwandlungsgesetz",
      "state": "Hamburg",
      "amtsgericht": "Amtsgericht Hamburg",
      "registernummer": "HRB 186902",
      "registerart": "HRB",
      "company_name": "MyTruck GmbH",
      "company_seat": "Hamburg",
      "details": "16.10.2025 (Bekanntmachungsdatum)\n\nHamburg Amtsgericht Hamburg HRB 186902\nRegisterbekanntmachung nach dem Umwandlungsgesetz 16.10.2025 (Eintragungsdatum)\n\nMyTruck GmbH\nGesellschaft mit beschränkter Haftung\nHamburg\n\nAls nicht eingetragen wird bekannt gemacht:\nDen Gläubigern der an der Ausgliederung beteiligten Gesellschaften ist, wenn sie binnen sechs Monaten nach dem Tag, an dem die Eintragung der Ausgliederung in das Register des Sitzes desjenigen Rechtsträgers, dessen Gläubiger sie sind, nach § 19 Absatz 3 UmwG als bekannt gemacht gilt, ihren Anspruch nach Grund und Höhe schriftlich anmelden, Sicherheit zu leisten, soweit sie nicht Befriedigung verlangen können. Dieses Recht steht den Gläubigern jedoch nur zu, wenn sie glaubhaft machen, dass durch die Ausgliederung die Erfüllung ihrer Forderung gefährdet wird."
    },
    {
      "date": "2025-10-16",
      "id": "134192",
      "original_text": "Registerbekanntmachung nach dem Umwandlungsgesetz\nBaden-Württemberg Amtsgericht Ulm HRB 728386\nIsin + Co. Consultants GmbH – Aalen",
      "type": "Registerbekanntmachung nach dem Umwandlungsgesetz",
      "state": "Baden-Württemberg",
      "amtsgericht": "Amtsgericht Ulm",
      "registernummer": "HRB 728386",
      "registerart": "HRB",
      "company_name": "Isin + Co. Consultants GmbH",
      "company_seat": "Aalen",
      "details": "16.10.2025 (Bekanntmachungsdatum)\n\nBaden-Württemberg Amtsgericht Ulm HRB 728386\nRegisterbekanntmachung nach dem Umwandlungsgesetz 16.10.2025 (Eintragungsdatum)\n\nIsin + Co. Consultants GmbH\nGesellschaft mit beschränkter Haftung\nAalen\n\nAls nicht eingetragen wird bekanntgemacht:\nDen Gläubigern der an der Verschmelzung beteiligten Rechtsträger ist, wenn sie binnen sechs Monaten nach dem Tag, an dem die Eintragung der Verschmelzung in das Register des Sitzes desjenigen Rechtsträgers, dessen Gläubiger sie sind, nach § 19 Abs. 3 UmwG als bekanntgemacht gilt, ihren Anspruch nach Grund und Höhe schriftlich anmelden, Sicherheit zu leisten, soweit sie nicht Befriedigung verlangen können. Dieses Recht steht den Gläubigern jedoch nur zu, wenn sie glaubhaft machen, dass durch die Verschmelzung die Erfüllung ihrer Forderung gefährdet wird."
    },
    {
      "date": "2025-10-16",
      "id": "134193",
      "original_text": "Einreichung neuer Dokumente\nBaden-Württemberg Amtsgericht Mannheim HRB 560619\nStadtentwicklungsgesellschaft Tauberbischofsheim mbH – Tauberbischofsheim",
      "type": "Einreichung neuer Dokumente",
      "state": "Baden-Württemberg",
      "amtsgericht": "Amtsgericht Mannheim",
      "registernummer": "HRB 560619",
      "registerart": "HRB",
      "company_name": "Stadtentwicklungsgesellschaft Tauberbischofsheim mbH",
      "company_seat": "Tauberbischofsheim",
      "details": "16.10.2025 (Bekanntmachungsdatum)\n\nBaden-Württemberg Amtsgericht Mannheim HRB 560619\nEinreichung neuer Dokumente\n\nStadtentwicklungsgesellschaft Tauberbischofsheim mbH\nGesellschaft mit beschränkter Haftung\nTauberbischofsheim\n\nDie Gesellschaft hat am 14.10.2025 die Liste über die Zusammensetzung des Aufsichtsrats zum Handelsregister eingereicht."
    },
    {
      "date": "2025-10-16",
      "id": "134194",
      "original_text": "Einreichung neuer Dokumente\nSchleswig-Holstein Amtsgericht Lübeck HRB 4901\nStadtwerke Lübeck Energie GmbH – Lübeck",
      "type": "Einreichung neuer Dokumente",
      "state": "Schleswig-Holstein",
      "amtsgericht": "Amtsgericht Lübeck",
      "registernummer": "HRB 4901",
      "registerart": "HRB",
      "company_name": "Stadtwerke Lübeck Energie GmbH",
      "company_seat": "Lübeck",
      "details": "16.10.2025 (Bekanntmachungsdatum)\n\nSchleswig-Holstein Amtsgericht Lübeck HRB 4901\nEinreichung neuer Dokumente\n\nStadtwerke Lübeck Energie GmbH\nGesellschaft mit beschränkter Haftung\nLübeck\n\nAls nicht eingetragen wird veröffentlicht: Es wurde eine neue Liste der Aufsichtsratmitglieder zum Handelsregister eingereicht."
    },
    {
      "date": "2025-10-16",
      "id": "134195",
      "original_text": "Einreichung neuer Dokumente\nSchleswig-Holstein Amtsgericht Lübeck HRB 4902\nStadtwerke Lübeck Mobil GmbH – Lübeck",
      "type": "Einreichung neuer Dokumente",
      "state": "Schleswig-Holstein",
      "amtsgericht": "Amtsgericht Lübeck",
      "registernummer": "HRB 4902",
      "registerart": "HRB",
      "company_name": "Stadtwerke Lübeck Mobil GmbH",
      "company_seat": "Lübeck",
      "details": "16.10.2025 (Bekanntmachungsdatum)\n\nSchleswig-Holstein Amtsgericht Lübeck HRB 4902\nEinreichung neuer Dokumente\n\nStadtwerke Lübeck Mobil GmbH\nGesellschaft mit beschränkter Haftung\nLübeck\n\nAls nicht eingetragen wird veröffentlicht: Es wurde eine neue Liste der Aufsichtsratmitglieder zum Handelsregister eingereicht."
    },
    {
      "date": "2025-10-16",
      "id": "134196",
      "original_text": "Registerbekanntmachung nach dem Umwandlungsgesetz\nHamburg Amtsgericht Hamburg HRB 156669\niubel invest 1 UG (haftungsbeschränkt) – Hamburg",
      "type": "Registerbekanntmachung nach dem Umwandlungsgesetz",
      "state": "Hamburg",
      "amtsgericht": "Amtsgericht Hamburg",
      "registernummer": "HRB 156669",
      "registerart": "HRB",
      "company_name": "iubel invest 1 UG (haftungsbeschränkt)",
      "company_seat": "Hamburg",
      "details": "16.10.2025 (Bekanntmachungsdatum)\n\nHamburg Amtsgericht Hamburg HRB 156669\nRegisterbekanntmachung nach dem Umwandlungsgesetz 16.10.2025 (Eintragungsdatum)\n\niubel invest 1 UG (haftungsbeschränkt)\nGesellschaft mit beschränkter Haftung\nHamburg\n\nAls nicht eingetragen wird bekannt gemacht:\nDen Gläubigern der an der Verschmelzung beteiligten Gesellschaften ist, wenn sie binnen sechs Monaten nach dem Tag, an dem die Eintragung der Verschmelzung in das Register des Sitzes desjenigen Rechtsträgers, dessen Gläubiger sie sind, nach § 19 Absatz 3 UmwG als bekannt gemacht gilt, ihren Anspruch nach Grund und Höhe schriftlich anmelden, Sicherheit zu leisten, soweit sie nicht Befriedigung verlangen können. Dieses Recht steht den Gläubigern jedoch nur zu, wenn sie glaubhaft machen, dass durch die Verschmelzung die Erfüllung ihrer Forderung gefährdet wird."
    },
    {
      "date": "2025-10-16",
      "id": "134197",
      "original_text": "Registerbekanntmachung nach dem Umwandlungsgesetz\nHamburg Amtsgericht Hamburg HRB 151056\nClaim Solutions GmbH – Hamburg",
      "type": "Registerbekanntmachung nach dem Umwandlungsgesetz",
      "state": "Hamburg",
      "amtsgericht": "Amtsgericht Hamburg",
      "registernummer": "HRB 151056",
      "registerart": "HRB",
      "company_name": "Claim Solutions GmbH",
      "company_seat": "Hamburg",
      "details": "16.10.2025 (Bekanntmachungsdatum)\n\nHamburg Amtsgericht Hamburg HRB 151056\nRegisterbekanntmachung nach dem Umwandlungsgesetz 16.10.2025 (Eintragungsdatum)\n\nClaim Solutions GmbH\nGesellschaft mit beschränkter Haftung\nHamburg\n\nAls nicht eingetragen wird bekannt gemacht:\nDen Gläubigern der an der Verschmelzung beteiligten Gesellschaften ist, wenn sie binnen sechs Monaten nach dem Tag, an dem die Eintragung der Verschmelzung in das Register des Sitzes desjenigen Rechtsträgers, dessen Gläubiger sie sind, nach § 19 Absatz 3 UmwG als bekannt gemacht gilt, ihren Anspruch nach Grund und Höhe schriftlich anmelden, Sicherheit zu leisten, soweit sie nicht Befriedigung verlangen können. Dieses Recht steht den Gläubigern jedoch nur zu, wenn sie glaubhaft machen, dass durch die Verschmelzung die Erfüllung ihrer Forderung gefährdet wird."
    },
    {
      "date": "2025-10-16",
      "id": "134198",
      "original_text": "Löschungsankündigung\nBerlin Amtsgericht Berlin (Charlottenburg) HRB 108163\nCDS TEE GmbH – Berlin",
      "type": "Löschungsankündigung",
      "state": "Berlin",
      "amtsgericht": "Amtsgericht Berlin (Charlottenburg)",
      "registernummer": "HRB 108163",
      "registerart": "HRB",
      "company_name": "CDS TEE GmbH",
      "company_seat": "Berlin",
      "details": "16.10.2025 (Bekanntmachungsdatum)\n\nBerlin Amtsgericht Berlin (Charlottenburg) HRB 108163\nLöschungsankündigung\n\nCDS TEE GmbH\nGesellschaft mit beschränkter Haftung\nBerlin\n\nBei der nachstehenden Gesellschaft wird das Amtslöschungsverfahren gemäß § 394 FamFG eingeleitet. Widerspruchsfrist 6 Wochen"
    },
    {
      "date": "2025-10-16",
      "id": "134199",
      "original_text": "Löschungsankündigung\nBerlin Amtsgericht Berlin (Charlottenburg) HRB 208173\nLSR Holding GmbH – Berlin",
      "type": "Löschungsankündigung",
      "state": "Berlin",
      "amtsgericht": "Amtsgericht Berlin (Charlottenburg)",
      "registernummer": "HRB 208173",
      "registerart": "HRB",
      "company_name": "LSR Holding GmbH",
      "company_seat": "Berlin",
      "details": "16.10.2025 (Bekanntmachungsdatum)\n\nBerlin Amtsgericht Berlin (Charlottenburg) HRB 208173\nLöschungsankündigung\n\nLSR Holding GmbH\nGesellschaft mit beschränkter Haftung\nBerlin\n\nBei der nachstehenden Gesellschaft wird das Amtslöschungsverfahren gemäß § 394 FamFG eingeleitet. Widerspruchsfrist 6 Wochen"
    },
    {
      "date": "2025-10-16",
      "id": "134200",
      "original_text": "Registerbekanntmachung nach dem Umwandlungsgesetz\nBrandenburg Amtsgericht Cottbus HRA 4431\nJens Bornemann HLKS e.K. – Calau",
      "type": "Registerbekanntmachung nach dem Umwandlungsgesetz",
      "state": "Brandenburg",
      "amtsgericht": "Amtsgericht Cottbus",
      "registernummer": "HRA 4431",
      "registerart": "HRA",
      "company_name": "Jens Bornemann HLKS e.K.",
      "company_seat": "Calau",
      "details": "16.10.2025 (Bekanntmachungsdatum)\n\nBrandenburg Amtsgericht Cottbus HRA 4431\nRegisterbekanntmachung nach dem Umwandlungsgesetz 15.10.2025 (Eintragungsdatum)\n\nJens Bornemann HLKS e.K.\nEinzelkaufmann / Einzelkauffrau\nCalau\n\nZu Eintragungsnummer 2 vom 15.10.2025 wird als nicht eingetragen veröffentlicht:\nDen Gläubigern der an der Ausgliederung beteiligten Rechtsträger ist, wenn sie binnen sechs Monaten nach dem Tag, an dem die Eintragung der Ausgliederung in das Register des Sitzes desjenigen Rechtsträgers, dessen Gläubiger sie sind, als bekannt gemacht gilt, ihren Anspruch nach Grund und Höhe schriftlich anmelden, Sicherheit zu leisten, soweit sie nicht Befriedigung verlangen können. Dieses Recht steht den Gläubigern jedoch nur zu, wenn sie glaubhaft machen, dass durch die Ausgliederung die Erfüllung ihrer Forderung gefährdet wird"
    },
    {
      "date": "2025-10-16",
      "id": "134201",
      "original_text": "Löschungsankündigung\nSchleswig-Holstein Amtsgericht Flensburg HRB 11076\nErstes Magellan Reedereikontor Beteiligungsgesellschaft mbH – Sylt",
      "type": "Löschungsankündigung",
      "state": "Schleswig-Holstein",
      "amtsgericht": "Amtsgericht Flensburg",
      "registernummer": "HRB 11076",
      "registerart": "HRB",
      "company_name": "Erstes Magellan Reedereikontor Beteiligungsgesellschaft mbH",
      "company_seat": "Sylt",
      "details": "16.10.2025 (Bekanntmachungsdatum)\n\nSchleswig-Holstein Amtsgericht Flensburg HRB 11076\nLöschungsankündigung\n\nErstes Magellan Reedereikontor Beteiligungsgesellschaft mbH\nGesellschaft mit beschränkter Haftung\nSylt\n\nEs ist die Löschung der nachstehenden Gesellschaft wegen Vermögenslosigkeit gemäß § 394 FamFG beabsichtigt.\nWiderspruchsfrist: 2 Monate."
    },
    {
      "date": "2025-10-16",
      "id": "134202",
      "original_text": "Registerbekanntmachung nach dem Umwandlungsgesetz\nSchleswig-Holstein Amtsgericht Lübeck HRB 20483\nFine Hands GmbH – Ahrensburg",
      "type": "Registerbekanntmachung nach dem Umwandlungsgesetz",
      "state": "Schleswig-Holstein",
      "amtsgericht": "Amtsgericht Lübeck",
      "registernummer": "HRB 20483",
      "registerart": "HRB",
      "company_name": "Fine Hands GmbH",
      "company_seat": "Ahrensburg",
      "details": "16.10.2025 (Bekanntmachungsdatum)\n\nSchleswig-Holstein Amtsgericht Lübeck HRB 20483\nRegisterbekanntmachung nach dem Umwandlungsgesetz 15.10.2025 (Eintragungsdatum)\n\nFine Hands GmbH\nGesellschaft mit beschränkter Haftung\nAhrensburg\n\nZu Eintragungsnummer 3 vom 15.10.2025 wird als nicht eingetragen veröffentlicht: Den Gläubigern der an der Verschmelzung beteiligten Rechtsträger ist, wenn sie binnen sechs Monaten nach dem Tag, an dem die Eintragung der Verschmelzung in das Register des Sitzes desjenigen Rechtsträgers, dessen Gläubiger sie sind, als bekannt gemacht gilt, ihren Anspruch nach Grund und Höhe schriftlich anmelden, Sicherheit zu leisten, soweit sie nicht Befriedigung verlangen können. Dieses Recht steht den Gläubigern jedoch nur zu, wenn sie glaubhaft machen, dass durch die Verschmelzung die Erfüllung ihrer Forderung gefährdet wird."
    },
    {
      "date": "2025-10-16",
      "id": "134203",
      "original_text": "Registerbekanntmachung nach dem Umwandlungsgesetz\nBrandenburg Amtsgericht Cottbus HRB 18873\nHLKS Bornemann GmbH – Calau",
      "type": "Registerbekanntmachung nach dem Umwandlungsgesetz",
      "state": "Brandenburg",
      "amtsgericht": "Amtsgericht Cottbus",
      "registernummer": "HRB 18873",
      "registerart": "HRB",
      "company_name": "HLKS Bornemann GmbH",
      "company_seat": "Calau",
      "details": "16.10.2025 (Bekanntmachungsdatum)\n\nBrandenburg Amtsgericht Cottbus HRB 18873\nRegisterbekanntmachung nach dem Umwandlungsgesetz 15.10.2025 (Eintragungsdatum)\n\nHLKS Bornemann GmbH\nGesellschaft mit beschränkter Haftung\nCalau\n\nDen Gläubigern der an der Spaltung beteiligten Rechtsträger ist, wenn sie binnen sechs Monaten nach dem Tag, an dem die Eintragung der Spaltung in das Register des Sitzes desjenigen Rechtsträgers, dessen Gläubiger sie sind, als bekannt gemacht gilt, ihren Anspruch nach Grund und Höhe schriftlich anmelden, Sicherheit zu leisten, soweit sie nicht Befriedigung verlangen können. Dieses Recht steht den Gläubigern jedoch nur zu, wenn sie glaubhaft machen, dass durch die Spaltung die Erfüllung ihrer Forderung gefährdet wird"
    },
    {
      "date": "2025-10-16",
      "id": "134204",
      "original_text": "Registerbekanntmachung nach dem Umwandlungsgesetz\nBerlin Amtsgericht Berlin (Charlottenburg) HRB 95211\nMM Car-Wash-Service GmbH – Berlin",
      "type": "Registerbekanntmachung nach dem Umwandlungsgesetz",
      "state": "Berlin",
      "amtsgericht": "Amtsgericht Berlin (Charlottenburg)",
      "registernummer": "HRB 95211",
      "registerart": "HRB",
      "company_name": "MM Car-Wash-Service GmbH",
      "company_seat": "Berlin",
      "details": "16.10.2025 (Bekanntmachungsdatum)\n\nBerlin Amtsgericht Berlin (Charlottenburg) HRB 95211\nRegisterbekanntmachung nach dem Umwandlungsgesetz 15.10.2025 (Eintragungsdatum)\n\nMM Car-Wash-Service GmbH\nGesellschaft mit beschränkter Haftung\nBerlin\n\nZu Eintragungsnummer 4 vom 15.10.2025 wird als nicht eingetragen veröffentlicht:Den Gläubigern der an der Verschmelzung beteiligten Rechtsträger ist, wenn sie binnen sechs Monaten nach dem Tag, an dem die Eintragung der Verschmelzung in das Register des Sitzes desjenigen Rechtsträgers, dessen Gläubiger sie sind, als bekannt gemacht gilt, ihren Anspruch nach Grund und Höhe schriftlich anmelden, Sicherheit zu leisten, soweit sie nicht Befriedigung verlangen können. Dieses Recht steht den Gläubigern jedoch nur zu, wenn sie glaubhaft machen, dass durch die Verschmelzung die Erfüllung ihrer Forderung gefährdet wird. Das Recht, Sicherheitsleistung zu verlangen, steht Gläubigern nicht zu, die im Falle der Insolvenz ein Recht auf vorzugsweise Befriedigung aus einer Deckungsmasse haben, die nach gesetzlicher Vorschrift zu ihrem Schutz errichtet und staatlich überwacht ist."
    },
    {
      "date": "2025-10-16",
      "id": "134205",
      "original_text": "Registerbekanntmachung nach dem Umwandlungsgesetz\nHamburg Amtsgericht Hamburg HRB 111651\nTriathlon III Beteiligungen GmbH – Hamburg",
      "type": "Registerbekanntmachung nach dem Umwandlungsgesetz",
      "state": "Hamburg",
      "amtsgericht": "Amtsgericht Hamburg",
      "registernummer": "HRB 111651",
      "registerart": "HRB",
      "company_name": "Triathlon III Beteiligungen GmbH",
      "company_seat": "Hamburg",
      "details": "16.10.2025 (Bekanntmachungsdatum)\n\nHamburg Amtsgericht Hamburg HRB 111651\nRegisterbekanntmachung nach dem Umwandlungsgesetz 16.10.2025 (Eintragungsdatum)\n\nTriathlon III Beteiligungen GmbH\nGesellschaft mit beschränkter Haftung\nHamburg\n\nAls nicht eingetragen wird bekannt gemacht:\nDen Gläubigern der an der Verschmelzung beteiligten Gesellschaften ist, wenn sie binnen sechs Monaten nach dem Tag, an dem die Eintragung der Verschmelzung in das Register des Sitzes desjenigen Rechtsträgers, dessen Gläubiger sie sind, nach § 19 Absatz 3 UmwG als bekannt gemacht gilt, ihren Anspruch nach Grund und Höhe schriftlich anmelden, Sicherheit zu leisten, soweit sie nicht Befriedigung verlangen können. Dieses Recht steht den Gläubigern jedoch nur zu, wenn sie glaubhaft machen, dass durch die Verschmelzung die Erfüllung ihrer Forderung gefährdet wird."
    },
    {
      "date": "2025-10-16",
      "id": "134206",
      "original_text": "Registerbekanntmachung nach dem Umwandlungsgesetz\nBaden-Württemberg Amtsgericht Mannheim HRB 753669\nBS Capital & Media GmbH – Angelbachtal",
      "type": "Registerbekanntmachung nach dem Umwandlungsgesetz",
      "state": "Baden-Württemberg",
      "amtsgericht": "Amtsgericht Mannheim",
      "registernummer": "HRB 753669",
      "registerart": "HRB",
      "company_name": "BS Capital & Media GmbH",
      "company_seat": "Angelbachtal",
      "details": "16.10.2025 (Bekanntmachungsdatum)\n\nBaden-Württemberg Amtsgericht Mannheim HRB 753669\nRegisterbekanntmachung nach dem Umwandlungsgesetz 16.10.2025 (Eintragungsdatum)\n\nBS Capital & Media GmbH\nGesellschaft mit beschränkter Haftung\nAngelbachtal\n\nDen Gläubigern der an der Ausgliederung beteiligten Rechtsträger ist, wenn sie binnen sechs Monaten nach dem Tag, an dem die Eintragung der Ausgliederung in das Register des Sitzes desjenigen Rechtsträgers, dessen Gläubiger sie sind, nach § 19 Abs. 3 UmwG als bekanntgemacht gilt, ihren Anspruch nach Grund und Höhe schriftlich anmelden, Sicherheit zu leisten, soweit sie nicht Befriedigung verlangen können. Dieses Recht steht den Gläubigern jedoch nur zu, wenn sie glaubhaft machen, dass durch die Ausgliederung die Erfüllung ihrer Forderung gefährdet wird."
    },
    {
      "date": "2025-10-16",
      "id": "134207",
      "original_text": "Registerbekanntmachung nach dem Umwandlungsgesetz\nBaden-Württemberg Amtsgericht Mannheim HRA 712774\nBenjamin Spahic Verlegen von sonstiger Software e.K. – Angelbachtal",
      "type": "Registerbekanntmachung nach dem Umwandlungsgesetz",
      "state": "Baden-Württemberg",
      "amtsgericht": "Amtsgericht Mannheim",
      "registernummer": "HRA 712774",
      "registerart": "HRA",
      "company_name": "Benjamin Spahic Verlegen von sonstiger Software e.K.",
      "company_seat": "Angelbachtal",
      "details": "16.10.2025 (Bekanntmachungsdatum)\n\nBaden-Württemberg Amtsgericht Mannheim HRA 712774\nRegisterbekanntmachung nach dem Umwandlungsgesetz 16.10.2025 (Eintragungsdatum)\n\nBenjamin Spahic Verlegen von sonstiger Software e.K.\nEinzelkaufmann / Einzelkauffrau\nAngelbachtal\n\nDen Gläubigern der an der Ausgliederung beteiligten Rechtsträger ist, wenn sie binnen sechs Monaten nach dem Tag, an dem die Eintragung der Ausgliederung in das Register des Sitzes desjenigen Rechtsträgers, dessen Gläubiger sie sind, nach § 19 Abs. 3 UmwG als bekanntgemacht gilt, ihren Anspruch nach Grund und Höhe schriftlich anmelden, Sicherheit zu leisten, soweit sie nicht Befriedigung verlangen können. Dieses Recht steht den Gläubigern jedoch nur zu, wenn sie glaubhaft machen, dass durch die Ausgliederung die Erfüllung ihrer Forderung gefährdet wird."
    },
    {
      "date": "2025-10-16",
      "id": "134208",
      "original_text": "Registerbekanntmachung nach dem Umwandlungsgesetz\nHamburg Amtsgericht Hamburg HRB 75628\nGROW Agency GmbH – Hamburg",
      "type": "Registerbekanntmachung nach dem Umwandlungsgesetz",
      "state": "Hamburg",
      "amtsgericht": "Amtsgericht Hamburg",
      "registernummer": "HRB 75628",
      "registerart": "HRB",
      "company_name": "GROW Agency GmbH",
      "company_seat": "Hamburg",
      "details": "16.10.2025 (Bekanntmachungsdatum)\n\nHamburg Amtsgericht Hamburg HRB 75628\nRegisterbekanntmachung nach dem Umwandlungsgesetz 16.10.2025 (Eintragungsdatum)\n\nGROW Agency GmbH\nGesellschaft mit beschränkter Haftung\nHamburg\n\nAls nicht eingetragen wird bekannt gemacht:\nDen Gläubigern der an der Verschmelzung beteiligten Gesellschaften ist, wenn sie binnen sechs Monaten nach dem Tag, an dem die Eintragung der Verschmelzung in das Register des Sitzes desjenigen Rechtsträgers, dessen Gläubiger sie sind, nach § 19 Absatz 3 UmwG als bekannt gemacht gilt, ihren Anspruch nach Grund und Höhe schriftlich anmelden, Sicherheit zu leisten, soweit sie nicht Befriedigung verlangen können. Dieses Recht steht den Gläubigern jedoch nur zu, wenn sie glaubhaft machen, dass durch die Verschmelzung die Erfüllung ihrer Forderung gefährdet wird."
    },
    {
      "date": "2025-10-16",
      "id": "134209",
      "original_text": "Registerbekanntmachung nach dem Umwandlungsgesetz\nHamburg Amtsgericht Hamburg HRB 40131\nGley Rissom Thieme Agentur für Kommunikation GmbH – Hamburg",
      "type": "Registerbekanntmachung nach dem Umwandlungsgesetz",
      "state": "Hamburg",
      "amtsgericht": "Amtsgericht Hamburg",
      "registernummer": "HRB 40131",
      "registerart": "HRB",
      "company_name": "Gley Rissom Thieme Agentur für Kommunikation GmbH",
      "company_seat": "Hamburg",
      "details": "16.10.2025 (Bekanntmachungsdatum)\n\nHamburg Amtsgericht Hamburg HRB 40131\nRegisterbekanntmachung nach dem Umwandlungsgesetz 16.10.2025 (Eintragungsdatum)\n\nGley Rissom Thieme Agentur für Kommunikation GmbH\nGesellschaft mit beschränkter Haftung\nHamburg\n\nAls nicht eingetragen wird bekannt gemacht:\nDen Gläubigern der an der Verschmelzung beteiligten Gesellschaften ist, wenn sie binnen sechs Monaten nach dem Tag, an dem die Eintragung der Verschmelzung in das Register des Sitzes desjenigen Rechtsträgers, dessen Gläubiger sie sind, nach § 19 Absatz 3 UmwG als bekannt gemacht gilt, ihren Anspruch nach Grund und Höhe schriftlich anmelden, Sicherheit zu leisten, soweit sie nicht Befriedigung verlangen können. Dieses Recht steht den Gläubigern jedoch nur zu, wenn sie glaubhaft machen, dass durch die Verschmelzung die Erfüllung ihrer Forderung gefährdet wird."
    },
    {
      "date": "2025-10-16",
      "id": "134210",
      "original_text": "Registerbekanntmachung nach dem Umwandlungsgesetz\nHamburg Amtsgericht Hamburg HRB 144512\nSpotleit GmbH – Hamburg",
      "type": "Registerbekanntmachung nach dem Umwandlungsgesetz",
      "state": "Hamburg",
      "amtsgericht": "Amtsgericht Hamburg",
      "registernummer": "HRB 144512",
      "registerart": "HRB",
      "company_name": "Spotleit GmbH",
      "company_seat": "Hamburg",
      "details": "16.10.2025 (Bekanntmachungsdatum)\n\nHamburg Amtsgericht Hamburg HRB 144512\nRegisterbekanntmachung nach dem Umwandlungsgesetz 16.10.2025 (Eintragungsdatum)\n\nSpotleit GmbH\nGesellschaft mit beschränkter Haftung\nHamburg\n\nAls nicht eingetragen wird bekannt gemacht:\nDen Gläubigern der an der Verschmelzung beteiligten Gesellschaften ist, wenn sie binnen sechs Monaten nach dem Tag, an dem die Eintragung der Verschmelzung in das Register des Sitzes desjenigen Rechtsträgers, dessen Gläubiger sie sind, nach § 19 Absatz 3 UmwG als bekannt gemacht gilt, ihren Anspruch nach Grund und Höhe schriftlich anmelden, Sicherheit zu leisten, soweit sie nicht Befriedigung verlangen können. Dieses Recht steht den Gläubigern jedoch nur zu, wenn sie glaubhaft machen, dass durch die Verschmelzung die Erfüllung ihrer Forderung gefährdet wird."
    },
    {
      "date": "2025-10-16",
      "id": "134211",
      "original_text": "Löschungsankündigung\nBerlin Amtsgericht Berlin (Charlottenburg) HRB 188898\nMega Mobilfunk GmbH – Berlin",
      "type": "Löschungsankündigung",
      "state": "Berlin",
      "amtsgericht": "Amtsgericht Berlin (Charlottenburg)",
      "registernummer": "HRB 188898",
      "registerart": "HRB",
      "company_name": "Mega Mobilfunk GmbH",
      "company_seat": "Berlin",
      "details": "16.10.2025 (Bekanntmachungsdatum)\n\nBerlin Amtsgericht Berlin (Charlottenburg) HRB 188898\nLöschungsankündigung\n\nMega Mobilfunk GmbH\nGesellschaft mit beschränkter Haftung\nBerlin\n\nBei der nachstehenden Gesellschaft wird das Amtslöschungsverfahren gemäß § 394 FamFG eingeleitet. Widerspruchsfrist 6 Wochen"
    },
    {
      "date": "2025-10-16",
      "id": "134212",
      "original_text": "Registerbekanntmachung nach dem Umwandlungsgesetz\nHamburg Amtsgericht Hamburg HRB 165886\nN & N Capital UG (haftungsbeschränkt) – Hamburg",
      "type": "Registerbekanntmachung nach dem Umwandlungsgesetz",
      "state": "Hamburg",
      "amtsgericht": "Amtsgericht Hamburg",
      "registernummer": "HRB 165886",
      "registerart": "HRB",
      "company_name": "N & N Capital UG (haftungsbeschränkt)",
      "company_seat": "Hamburg",
      "details": "16.10.2025 (Bekanntmachungsdatum)\n\nHamburg Amtsgericht Hamburg HRB 165886\nRegisterbekanntmachung nach dem Umwandlungsgesetz 16.10.2025 (Eintragungsdatum)\n\nN & N Capital UG (haftungsbeschränkt)\nGesellschaft mit beschränkter Haftung\nHamburg\n\nAls nicht eingetragen wird bekannt gemacht:\nDen Gläubigern der an der Verschmelzung beteiligten Gesellschaften ist, wenn sie binnen sechs Monaten nach dem Tag, an dem die Eintragung der Verschmelzung in das Register des Sitzes desjenigen Rechtsträgers, dessen Gläubiger sie sind, nach § 19 Absatz 3 UmwG als bekannt gemacht gilt, ihren Anspruch nach Grund und Höhe schriftlich anmelden, Sicherheit zu leisten, soweit sie nicht Befriedigung verlangen können. Dieses Recht steht den Gläubigern jedoch nur zu, wenn sie glaubhaft machen, dass durch die Verschmelzung die Erfüllung ihrer Forderung gefährdet wird."
    },
    {
      "date": "2025-10-16",
      "id": "134213",
      "original_text": "Löschungsankündigung\nBrandenburg Amtsgericht Frankfurt/Oder HRB 3794\nPLASMACTOR Umwelttechnik GmbH – Britz",
      "type": "Löschungsankündigung",
      "state": "Brandenburg",
      "amtsgericht": "Amtsgericht Frankfurt/Oder",
      "registernummer": "HRB 3794",
      "registerart": "HRB",
      "company_name": "PLASMACTOR Umwelttechnik GmbH",
      "company_seat": "Britz",
      "details": "16.10.2025 (Bekanntmachungsdatum)\n\nBrandenburg Amtsgericht Frankfurt/Oder HRB 3794\nLöschungsankündigung\n\nPLASMACTOR Umwelttechnik GmbH\nGesellschaft mit beschränkter Haftung\nBritz\n\nBei der nachstehenden Gesellschaft wird das Amtslöschungsverfahren gemäß § 394 FamFG eingeleitet."
    },
    {
      "date": "2025-10-16",
      "id": "134214",
      "original_text": "Einreichung neuer Dokumente\nBrandenburg Amtsgericht Cottbus HRB 1173\nWohn- und Baugesellschaft Calau mbH - WBC mbH – Calau",
      "type": "Einreichung neuer Dokumente",
      "state": "Brandenburg",
      "amtsgericht": "Amtsgericht Cottbus",
      "registernummer": "HRB 1173",
      "registerart": "HRB",
      "company_name": "Wohn- und Baugesellschaft Calau mbH - WBC mbH",
      "company_seat": "Calau",
      "details": "16.10.2025 (Bekanntmachungsdatum)\n\nBrandenburg Amtsgericht Cottbus HRB 1173\nEinreichung neuer Dokumente\n\nWohn- und Baugesellschaft Calau mbH - WBC mbH\nGesellschaft mit beschränkter Haftung\nCalau\n\nDie aktuelle Liste der Aufsichtsratsmitglieder wurde zum Handelsregister gem. § 52 Abs. 3 GmbHG eingereicht."
    },
    {
      "date": "2025-10-16",
      "id": "134215",
      "original_text": "Sonstige Registerbekanntmachung\nHamburg Amtsgericht Hamburg HRB 125768\nBank Deutsches Kraftfahrzeuggewerbe GmbH – Hamburg",
      "type": "Sonstige Registerbekanntmachung",
      "state": "Hamburg",
      "amtsgericht": "Amtsgericht Hamburg",
      "registernummer": "HRB 125768",
      "registerart": "HRB",
      "company_name": "Bank Deutsches Kraftfahrzeuggewerbe GmbH",
      "company_seat": "Hamburg",
      "details": "16.10.2025 (Bekanntmachungsdatum)\n\nHamburg Amtsgericht Hamburg HRB 125768\nSonstige Registerbekanntmachung\n\nBank Deutsches Kraftfahrzeuggewerbe GmbH\nGesellschaft mit beschränkter Haftung\nHamburg\n\nAls nicht eingetragen wird bekannt gemacht: Liste des Aufsichtsrats wurde eingereicht."
    },
    {
      "date": "2025-10-16",
      "id": "134216",
      "original_text": "Registerbekanntmachung nach dem Umwandlungsgesetz\nBaden-Württemberg Amtsgericht Stuttgart HRA 742484\nVitamed ambulante Pflege Inh. Natalie Hummel ambulanter Pflegedienst Stuttgart e.K. – Stuttgart",
      "type": "Registerbekanntmachung nach dem Umwandlungsgesetz",
      "state": "Baden-Württemberg",
      "amtsgericht": "Amtsgericht Stuttgart",
      "registernummer": "HRA 742484",
      "registerart": "HRA",
      "company_name": "Vitamed ambulante Pflege Inh. Natalie Hummel ambulanter Pflegedienst Stuttgart e.K.",
      "company_seat": "Stuttgart",
      "details": "16.10.2025 (Bekanntmachungsdatum)\n\nBaden-Württemberg Amtsgericht Stuttgart HRA 742484\nRegisterbekanntmachung nach dem Umwandlungsgesetz 16.10.2025 (Eintragungsdatum)\n\nVitamed ambulante Pflege Inh. Natalie Hummel ambulanter Pflegedienst Stuttgart e.K.\nEinzelkaufmann / Einzelkauffrau\nStuttgart\n\nAls nicht eingetragen wird bekanntgemacht:\nDen Gläubigern der an der Ausgliederung beteiligten Rechtsträger ist, wenn sie binnen sechs Monaten nach dem Tag, an dem die Eintragung der Ausgliederung in das Register des Sitzes desjenigen Rechtsträgers, dessen Gläubiger sie sind, nach § 19 Abs. 3 UmwG als bekanntgemacht gilt, ihren Anspruch nach Grund und Höhe schriftlich anmelden, Sicherheit zu leisten, soweit sie nicht Befriedigung verlangen können. Dieses Recht steht den Gläubigern jedoch nur zu, wenn sie glaubhaft machen, dass durch die Ausgliederung die Erfüllung ihrer Forderung gefährdet wird."
    },
    {
      "date": "2025-10-16",
      "id": "134217",
      "original_text": "Löschungsankündigung\nBrandenburg Amtsgericht Frankfurt/Oder HRA 53\nVIVA Polstermöbel-Werke GmbH & Co. KG – Storkow (Mark)",
      "type": "Löschungsankündigung",
      "state": "Brandenburg",
      "amtsgericht": "Amtsgericht Frankfurt/Oder",
      "registernummer": "HRA 53",
      "registerart": "HRA",
      "company_name": "VIVA Polstermöbel-Werke GmbH & Co. KG",
      "company_seat": "Storkow (Mark)",
      "details": "16.10.2025 (Bekanntmachungsdatum)\n\nBrandenburg Amtsgericht Frankfurt/Oder HRA 53\nLöschungsankündigung\n\nVIVA Polstermöbel-Werke GmbH & Co. KG\nKommanditgesellschaft\nStorkow (Mark)\n\nBei der nachstehenden Gesellschaft wird das Amtslöschungsverfahren gemäß § 394 FamFG eingeleitet."
    },
    {
      "date": "2025-10-16",
      "id": "134218",
      "original_text": "Registerbekanntmachung nach dem Umwandlungsgesetz\nBerlin Amtsgericht Berlin (Charlottenburg) HRB 210553\nCHROMIC GmbH – Berlin",
      "type": "Registerbekanntmachung nach dem Umwandlungsgesetz",
      "state": "Berlin",
      "amtsgericht": "Amtsgericht Berlin (Charlottenburg)",
      "registernummer": "HRB 210553",
      "registerart": "HRB",
      "company_name": "CHROMIC GmbH",
      "company_seat": "Berlin",
      "details": "16.10.2025 (Bekanntmachungsdatum)\n\nBerlin Amtsgericht Berlin (Charlottenburg) HRB 210553\nRegisterbekanntmachung nach dem Umwandlungsgesetz 24.09.2019 (Eintragungsdatum)\n\nCHROMIC GmbH\nGesellschaft mit beschränkter Haftung\nBerlin\n\nZu Eintragungsnummer 1 vom 24.09.2019 wird als nicht eingetragen veröffentlicht: Es wird bekannt gemacht, dass die Registerbekanntmachung nach dem Umwandlungsgesetz vom 26.08.2025 fehlerhaft erfolgt ist. Eine Verschmelzung hat nicht stattgefunden."
    },
    {
      "date": "2025-10-16",
      "id": "134219",
      "original_text": "Löschungsankündigung\nMecklenburg-Vorpommern Amtsgericht Rostock HRB 15752\nGebäude Innovation Nord UG (haftungsbeschränkt) – Kröpelin",
      "type": "Löschungsankündigung",
      "state": "Mecklenburg-Vorpommern",
      "amtsgericht": "Amtsgericht Rostock",
      "registernummer": "HRB 15752",
      "registerart": "HRB",
      "company_name": "Gebäude Innovation Nord UG (haftungsbeschränkt)",
      "company_seat": "Kröpelin",
      "details": "16.10.2025 (Bekanntmachungsdatum)\n\nMecklenburg-Vorpommern Amtsgericht Rostock HRB 15752\nLöschungsankündigung\n\nGebäude Innovation Nord UG (haftungsbeschränkt)\nGesellschaft mit beschränkter Haftung\nKröpelin\n\nDas Registergericht beabsichtigt, die im Handelsregister eingetragene Gesellschaft von Amts wegen nach § 394 FamFG zu löschen. Die Frist zur Erhebung eines Widerspruchs gegen die beabsichtigte Löschung wird auf einen Monat festgesetzt."
    },
    {
      "date": "2025-10-16",
      "id": "134220",
      "original_text": "Löschungsankündigung\nSchleswig-Holstein Amtsgericht Flensburg HRB 7692\nRunder Tisch Emmelsbüll-Horsbüll Verwaltungs-GmbH – Emmelsbüll-Horsbüll",
      "type": "Löschungsankündigung",
      "state": "Schleswig-Holstein",
      "amtsgericht": "Amtsgericht Flensburg",
      "registernummer": "HRB 7692",
      "registerart": "HRB",
      "company_name": "Runder Tisch Emmelsbüll-Horsbüll Verwaltungs-GmbH",
      "company_seat": "Emmelsbüll-Horsbüll",
      "details": "16.10.2025 (Bekanntmachungsdatum)\n\nSchleswig-Holstein Amtsgericht Flensburg HRB 7692\nLöschungsankündigung\n\nRunder Tisch Emmelsbüll-Horsbüll Verwaltungs-GmbH\nGesellschaft mit beschränkter Haftung\nEmmelsbüll-Horsbüll\n\nEs ist die Löschung der nachstehenden Gesellschaft wegen Vermögenslosigkeit gemäß § 394 FamFG beabsichtigt.\nWiderspruchsfrist: 2 Monate."
    },
    {
      "date": "2025-10-16",
      "id": "134221",
      "original_text": "Löschungsankündigung\nSachsen Amtsgericht Dresden HRB 33507\nUllersdorfer Getränke- und Onlinehandel GmbH – Radeberg",
      "type": "Löschungsankündigung",
      "state": "Sachsen",
      "amtsgericht": "Amtsgericht Dresden",
      "registernummer": "HRB 33507",
      "registerart": "HRB",
      "company_name": "Ullersdorfer Getränke- und Onlinehandel GmbH",
      "company_seat": "Radeberg",
      "details": "16.10.2025 (Bekanntmachungsdatum)\n\nSachsen Amtsgericht Dresden HRB 33507\nLöschungsankündigung\n\nUllersdorfer Getränke- und Onlinehandel GmbH\nGesellschaft mit beschränkter Haftung\nRadeberg\n\nDas Registergericht beabsichtigt, die im Handelsregister eingetragene Gesellschaft von Amts wegen nach § 394 FamFG zu löschen. Die Frist zu Erhebung eines Widerspruchs gegen die beabsichtigte Löschung wird auf einen Monat festgesetzt."
    },
    {
      "date": "2025-10-16",
      "id": "134222",
      "original_text": "Registerbekanntmachung nach dem Umwandlungsgesetz\nSachsen Amtsgericht Chemnitz HRA 10181\nHardy Kleist Industriemontagen e.K. – Neuhausen/Erzgeb.",
      "type": "Registerbekanntmachung nach dem Umwandlungsgesetz",
      "state": "Sachsen",
      "amtsgericht": "Amtsgericht Chemnitz",
      "registernummer": "HRA 10181",
      "registerart": "HRA",
      "company_name": "Hardy Kleist Industriemontagen e.K.",
      "company_seat": "Neuhausen/Erzgeb.",
      "details": "16.10.2025 (Bekanntmachungsdatum)\n\nSachsen Amtsgericht Chemnitz HRA 10181\nRegisterbekanntmachung nach dem Umwandlungsgesetz 16.10.2025 (Eintragungsdatum)\n\nHardy Kleist Industriemontagen e.K.\nEinzelkaufmann / Einzelkauffrau\nNeuhausen/Erzgeb.\n\nDen Gläubigern der an der Ausgliederung beteiligten Rechtsträger ist, wenn sie binnen sechs Monaten nach dem Tag, an dem die Eintragung der Ausgliederung in das Register des Sitzes desjenigen Rechtsträgers, dessen Gläubiger sie sind, nach § 19 Abs. 3 UmwG als bekannt gemacht gilt, ihren Anspruch nach Grund und Höhe in Textform anmelden, Sicherheit zu leisten, soweit sie nicht Befriedigung verlangen können. Dieses Recht steht den Gläubigern jedoch nur zu, wenn sie glaubhaft machen, dass durch die Ausgliederung die Erfüllung der Forderung gefährdet wird."
    },
    {
      "date": "2025-10-16",
      "id": "134223",
      "original_text": "Löschungsankündigung\nSachsen Amtsgericht Chemnitz HRB 35611\nBludis GmbH – Chemnitz",
      "type": "Löschungsankündigung",
      "state": "Sachsen",
      "amtsgericht": "Amtsgericht Chemnitz",
      "registernummer": "HRB 35611",
      "registerart": "HRB",
      "company_name": "Bludis GmbH",
      "company_seat": "Chemnitz",
      "details": "16.10.2025 (Bekanntmachungsdatum)\n\nSachsen Amtsgericht Chemnitz HRB 35611\nLöschungsankündigung 16.10.2025 (Eintragungsdatum)\n\nBludis GmbH\nGesellschaft mit beschränkter Haftung\nChemnitz\n\nDas Registergericht beabsichtigt, den im Handelsregister eingetragenen Geschäftsführer Matas Jurksas von Amts wegen nach § 395 Absatz 1 FamFG zu löschen. Die Frist zu Erhebung eines Widerspruchs gegen die beabsichtigte Löschung wird auf einen Monat festgesetzt."
    },
    {
      "date": "2025-10-16",
      "id": "134224",
      "original_text": "Löschungsankündigung\nSachsen Amtsgericht Leipzig HRB 30842\nImpieri Bau GmbH – Leipzig",
      "type": "Löschungsankündigung",
      "state": "Sachsen",
      "amtsgericht": "Amtsgericht Leipzig",
      "registernummer": "HRB 30842",
      "registerart": "HRB",
      "company_name": "Impieri Bau GmbH",
      "company_seat": "Leipzig",
      "details": "16.10.2025 (Bekanntmachungsdatum)\n\nSachsen Amtsgericht Leipzig HRB 30842\nLöschungsankündigung\n\nImpieri Bau GmbH\nGesellschaft mit beschränkter Haftung\nLeipzig\n\nDas Registergericht beabsichtigt, die im Handelsregister eingetragene Gesellschaft von Amts wegen nach § 394 FamFG zu löschen. Die Frist zu Erhebung eines Widerspruchs gegen die beabsichtigte Löschung wird auf einen Monat festgesetzt."
    },
    {
      "date": "2025-10-16",
      "id": "134225",
      "original_text": "Löschungsankündigung\nSachsen Amtsgericht Dresden HRB 41604\nKobers Innovation GmbH – Dresden",
      "type": "Löschungsankündigung",
      "state": "Sachsen",
      "amtsgericht": "Amtsgericht Dresden",
      "registernummer": "HRB 41604",
      "registerart": "HRB",
      "company_name": "Kobers Innovation GmbH",
      "company_seat": "Dresden",
      "details": "16.10.2025 (Bekanntmachungsdatum)\n\nSachsen Amtsgericht Dresden HRB 41604\nLöschungsankündigung\n\nKobers Innovation GmbH\nGesellschaft mit beschränkter Haftung\nDresden\n\nDas Registergericht beabsichtigt, die im Handelsregister eingetragene Gesellschaft von Amts wegen nach § 394 FamFG zu löschen. Die Frist zu Erhebung eines Widerspruchs gegen die beabsichtigte Löschung wird auf einen Monat festgesetzt."
    },
    {
      "date": "2025-10-16",
      "id": "134226",
      "original_text": "Sonstige Registerbekanntmachung\nSachsen Amtsgericht Leipzig HRB 24955\nO.media GmbH – Leipzig",
      "type": "Sonstige Registerbekanntmachung",
      "state": "Sachsen",
      "amtsgericht": "Amtsgericht Leipzig",
      "registernummer": "HRB 24955",
      "registerart": "HRB",
      "company_name": "O.media GmbH",
      "company_seat": "Leipzig",
      "details": "16.10.2025 (Bekanntmachungsdatum)\n\nSachsen Amtsgericht Leipzig HRB 24955\nSonstige Registerbekanntmachung 16.10.2025 (Eintragungsdatum)\n\nO.media GmbH\nGesellschaft mit beschränkter Haftung\nLeipzig\n\nDen Gläubigern der Gesellschaft, deren Forderungen begründet worden sind bevor die Eintragung der Beendigung des Beherrschungs- und Gewinnabführungsvertrages in das Handelsregister nach § 10 des Handelsgesetzbuches als bekanntgemacht gilt, hat der andere Vertragsteil Sicherheit zu leisten, wenn sie sich binnen sechs Monaten nach der Bekanntmachung der Eintragung zu diesem Zweck bei ihm melden."
    },
    {
      "date": "2025-10-16",
      "id": "134227",
      "original_text": "Registerbekanntmachung nach dem Umwandlungsgesetz\nSachsen Amtsgericht Chemnitz HRA 10275\nKleist Industriemontagen GmbH & Co. KG – Neuhausen/Erzgeb.",
      "type": "Registerbekanntmachung nach dem Umwandlungsgesetz",
      "state": "Sachsen",
      "amtsgericht": "Amtsgericht Chemnitz",
      "registernummer": "HRA 10275",
      "registerart": "HRA",
      "company_name": "Kleist Industriemontagen GmbH & Co. KG",
      "company_seat": "Neuhausen/Erzgeb.",
      "details": "16.10.2025 (Bekanntmachungsdatum)\n\nSachsen Amtsgericht Chemnitz HRA 10275\nRegisterbekanntmachung nach dem Umwandlungsgesetz 16.10.2025 (Eintragungsdatum)\n\nKleist Industriemontagen GmbH & Co. KG\nKommanditgesellschaft\nNeuhausen/Erzgeb.\n\nDen Gläubigern der an der Ausgliederung beteiligten Rechtsträger ist, wenn sie binnen sechs Monaten nach dem Tag, an dem die Eintragung der Ausgliederung in das Register des Sitzes desjenigen Rechtsträgers, dessen Gläubiger sie sind, nach § 19 Abs. 3 UmwG als bekannt gemacht gilt, ihren Anspruch nach Grund und Höhe in Textform anmelden, Sicherheit zu leisten, soweit sie nicht Befriedigung verlangen können. Dieses Recht steht den Gläubigern jedoch nur zu, wenn sie glaubhaft machen, dass durch die Ausgliederung die Erfüllung der Forderung gefährdet wird."
    },
    {
      "date": "2025-10-16",
      "id": "134228",
      "original_text": "Registerbekanntmachung nach dem Umwandlungsgesetz\nNiedersachsen Amtsgericht Walsrode HRA 205739\nReederei Baum e.K. – Twistringen",
      "type": "Registerbekanntmachung nach dem Umwandlungsgesetz",
      "state": "Niedersachsen",
      "amtsgericht": "Amtsgericht Walsrode",
      "registernummer": "HRA 205739",
      "registerart": "HRA",
      "company_name": "Reederei Baum e.K.",
      "company_seat": "Twistringen",
      "details": "16.10.2025 (Bekanntmachungsdatum)\n\nNiedersachsen Amtsgericht Walsrode HRA 205739\nRegisterbekanntmachung nach dem Umwandlungsgesetz 16.10.2025 (Eintragungsdatum)\n\nReederei Baum e.K.\nEinzelkaufmann / Einzelkauffrau\nTwistringen\n\nDen Gläubigern der an der Ausgliederung beteiligten Rechtsträger ist, wenn sie binnen sechs Monaten nach dem Tag, an dem die Eintragung der Ausgliederung in das Register des Sitzes desjenigen Rechtsträgers, dessen Gläubiger sie sind, nach § 19 Abs. 3 UmwG als bekannt gemacht gilt, ihren Anspruch nach Grund und Höhe schriftlich anmelden, Sicherheit zu leisten, soweit sie nicht Befriedigung verlangen können. Dieses Recht steht den Gläubigern jedoch nur zu, wenn sie glaubhaft machen, dass durch die Ausgliederung die Erfüllung der Forderung gefährdet wird."
    },
    {
      "date": "2025-10-16",
      "id": "134229",
      "original_text": "Registerbekanntmachung nach dem Umwandlungsgesetz\nNiedersachsen Amtsgericht Osnabrück HRA 207680\nLeuchtturm Immobilien UG (haftungsbeschränkt) & Co. KG – Haren (Ems)",
      "type": "Registerbekanntmachung nach dem Umwandlungsgesetz",
      "state": "Niedersachsen",
      "amtsgericht": "Amtsgericht Osnabrück",
      "registernummer": "HRA 207680",
      "registerart": "HRA",
      "company_name": "Leuchtturm Immobilien UG (haftungsbeschränkt) & Co. KG",
      "company_seat": "Haren (Ems)",
      "details": "16.10.2025 (Bekanntmachungsdatum)\n\nNiedersachsen Amtsgericht Osnabrück HRA 207680\nRegisterbekanntmachung nach dem Umwandlungsgesetz 16.10.2025 (Eintragungsdatum)\n\nLeuchtturm Immobilien UG (haftungsbeschränkt) & Co. KG\nKommanditgesellschaft\nHaren (Ems)\n\nDen Gläubigern der an der Verschmelzung beteiligten Rechtsträger ist, wenn sie binnen sechs Monaten nach dem Tag, an dem die Eintragung der Verschmelzung in das Register des Sitzes desjenigen Rechtsträgers, dessen Gläubiger sie sind, nach § 19  Abs.  3 UmwG als bekannt gemacht gilt, ihren Anspruch nach Grund und Höhe schriftlich anmelden, Sicherheit zu leisten, soweit sie nicht Befriedigung verlangen können. Dieses Recht steht den Gläubigern jedoch nur zu, wenn sie glaubhaft machen, dass durch die Verschmelzung die Erfüllung der Forderung gefährdet wird."
    },
    {
      "date": "2025-10-16",
      "id": "134230",
      "original_text": "Sonstige Registerbekanntmachung\nNiedersachsen Amtsgericht Osnabrück HRB 220721\nMEYER WERFT GmbH – Papenburg",
      "type": "Sonstige Registerbekanntmachung",
      "state": "Niedersachsen",
      "amtsgericht": "Amtsgericht Osnabrück",
      "registernummer": "HRB 220721",
      "registerart": "HRB",
      "company_name": "MEYER WERFT GmbH",
      "company_seat": "Papenburg",
      "details": "16.10.2025 (Bekanntmachungsdatum)\n\nNiedersachsen Amtsgericht Osnabrück HRB 220721\nSonstige Registerbekanntmachung 16.10.2025 (Eintragungsdatum)\n\nMEYER WERFT GmbH\nGesellschaft mit beschränkter Haftung\nPapenburg\n\nDie Liste der Mitglieder des Aufsichtsrats wurde beim Registergericht eingereicht."
    },
    {
      "date": "2025-10-16",
      "id": "134231",
      "original_text": "Registerbekanntmachung nach dem Umwandlungsgesetz\nNiedersachsen Amtsgericht Osnabrück HRB 214772\nBWB Immobilien GmbH – Haren",
      "type": "Registerbekanntmachung nach dem Umwandlungsgesetz",
      "state": "Niedersachsen",
      "amtsgericht": "Amtsgericht Osnabrück",
      "registernummer": "HRB 214772",
      "registerart": "HRB",
      "company_name": "BWB Immobilien GmbH",
      "company_seat": "Haren",
      "details": "16.10.2025 (Bekanntmachungsdatum)\n\nNiedersachsen Amtsgericht Osnabrück HRB 214772\nRegisterbekanntmachung nach dem Umwandlungsgesetz 16.10.2025 (Eintragungsdatum)\n\nBWB Immobilien GmbH\nGesellschaft mit beschränkter Haftung\nHaren\n\nDen Gläubigern der an der Verschmelzung beteiligten Rechtsträger ist, wenn sie binnen sechs Monaten nach dem Tag, an dem die Eintragung der Verschmelzung in das Register des Sitzes desjenigen Rechtsträgers, dessen Gläubiger sie sind, nach § 19  Abs.  3 UmwG als bekannt gemacht gilt, ihren Anspruch nach Grund und Höhe schriftlich anmelden, Sicherheit zu leisten, soweit sie nicht Befriedigung verlangen können. Dieses Recht steht den Gläubigern jedoch nur zu, wenn sie glaubhaft machen, dass durch die Verschmelzung die Erfüllung der Forderung gefährdet wird."
    },
    {
      "date": "2025-10-16",
      "id": "134232",
      "original_text": "Einreichung neuer Dokumente\nNiedersachsen Amtsgericht Oldenburg (Oldenburg) HRB 130004 früher Amtsgericht Wilhelmshaven\nGEW Wilhelmshaven GmbH – Wilhelmshaven",
      "type": "Einreichung neuer Dokumente",
      "state": "Niedersachsen",
      "amtsgericht": "Amtsgericht Oldenburg (Oldenburg)",
      "registernummer": "HRB 130004",
      "registerart": "HRB",
      "company_name": "GEW Wilhelmshaven GmbH",
      "company_seat": "Wilhelmshaven",
      "former_amtsgericht": "Wilhelmshaven",
      "details": "16.10.2025 (Bekanntmachungsdatum)\n\nNiedersachsen Amtsgericht Oldenburg (Oldenburg) HRB 130004 früher Amtsgericht Wilhelmshaven\nEinreichung neuer Dokumente\n\nGEW Wilhelmshaven GmbH\nGesellschaft mit beschränkter Haftung\nWilhelmshaven\n\nEine Liste der Mitglieder des Aufsichtsrats vom 13.10.2025 wurde am 15.10.2025 beim Registergericht eingereicht."
    },
    {
      "date": "2025-10-16",
      "id": "134233",
      "original_text": "Löschungsankündigung\nNiedersachsen Amtsgericht Hildesheim HRB 207682\nHacky Tours & Events UG (haftungsbeschränkt) – Boffzen",
      "type": "Löschungsankündigung",
      "state": "Niedersachsen",
      "amtsgericht": "Amtsgericht Hildesheim",
      "registernummer": "HRB 207682",
      "registerart": "HRB",
      "company_name": "Hacky Tours & Events UG (haftungsbeschränkt)",
      "company_seat": "Boffzen",
      "details": "16.10.2025 (Bekanntmachungsdatum)\n\nNiedersachsen Amtsgericht Hildesheim HRB 207682\nLöschungsankündigung\n\nHacky Tours & Events UG (haftungsbeschränkt)\nGesellschaft mit beschränkter Haftung\nBoffzen\n\nDas Registergericht beabsichtigt, die Gesellschaft von Amts wegen nach § 394 FamFG zu löschen. Die Frist zur Erhebung eines Widerspruchs ist auf 1 Monat ab dieser Registerbekanntmachung festgesetzt."
    },
    {
      "date": "2025-10-16",
      "id": "134234",
      "original_text": "Löschungsankündigung\nNiedersachsen Amtsgericht Hannover HRB 211885\nGattopardo Betriebsgesellschaft mbH – Hannover",
      "type": "Löschungsankündigung",
      "state": "Niedersachsen",
      "amtsgericht": "Amtsgericht Hannover",
      "registernummer": "HRB 211885",
      "registerart": "HRB",
      "company_name": "Gattopardo Betriebsgesellschaft mbH",
      "company_seat": "Hannover",
      "details": "16.10.2025 (Bekanntmachungsdatum)\n\nNiedersachsen Amtsgericht Hannover HRB 211885\nLöschungsankündigung 16.10.2025 (Eintragungsdatum)\n\nGattopardo Betriebsgesellschaft mbH\nGesellschaft mit beschränkter Haftung\nHannover\n\nDas Registergericht beabsichtigt, die Gesellschaft von Amts wegen nach § 394 FamFG zu löschen. Die Frist zur Erhebung eines Widerspruchs ist auf 1 Monat ab dieser Registerbekanntmachung festgesetzt."
    },
    {
      "date": "2025-10-16",
      "id": "134235",
      "original_text": "Registerbekanntmachung nach dem Umwandlungsgesetz\nNiedersachsen Amtsgericht Hannover HRB 218030\nNICJ GmbH – Hannover",
      "type": "Registerbekanntmachung nach dem Umwandlungsgesetz",
      "state": "Niedersachsen",
      "amtsgericht": "Amtsgericht Hannover",
      "registernummer": "HRB 218030",
      "registerart": "HRB",
      "company_name": "NICJ GmbH",
      "company_seat": "Hannover",
      "details": "16.10.2025 (Bekanntmachungsdatum)\n\nNiedersachsen Amtsgericht Hannover HRB 218030\nRegisterbekanntmachung nach dem Umwandlungsgesetz 16.10.2025 (Eintragungsdatum)\n\nNICJ GmbH\nGesellschaft mit beschränkter Haftung\nHannover\n\nDen Gläubigern der an der formwechselnden Umwandlung beteiligten Rechtsträger ist, wenn sie binnen sechs Monaten nach dem Tag, an dem die Eintragung der Umwandlung in das Register des Sitzes desjenigen Rechtsträgers, dessen Gläubiger sie sind, nach § 19 Abs. 3 UmwG als bekannt gemacht gilt, ihren Anspruch nach Grund und Höhe schriftlich anmelden, Sicherheit zu leisten, soweit sie nicht Befriedigung verlangen können. Dieses Recht steht den Gläubigern jedoch nur zu, wenn sie glaubhaft machen, dass durch die formwechselnde Umwandlung die Erfüllung der Forderung gefährdet wird."
    },
    {
      "date": "2025-10-16",
      "id": "134236",
      "original_text": "Registerbekanntmachung nach dem Umwandlungsgesetz\nNiedersachsen Amtsgericht Walsrode HRA 205790\nReederei Baum GmbH & Co. KG – Twistringen",
      "type": "Registerbekanntmachung nach dem Umwandlungsgesetz",
      "state": "Niedersachsen",
      "amtsgericht": "Amtsgericht Walsrode",
      "registernummer": "HRA 205790",
      "registerart": "HRA",
      "company_name": "Reederei Baum GmbH & Co. KG",
      "company_seat": "Twistringen",
      "details": "16.10.2025 (Bekanntmachungsdatum)\n\nNiedersachsen Amtsgericht Walsrode HRA 205790\nRegisterbekanntmachung nach dem Umwandlungsgesetz 16.10.2025 (Eintragungsdatum)\n\nReederei Baum GmbH & Co. KG\nKommanditgesellschaft\nTwistringen\n\nDen Gläubigern der an der Ausgliederung beteiligten Rechtsträger ist, wenn sie binnen sechs Monaten nach dem Tag, an dem die Eintragung der Ausgliederung in das Register des Sitzes desjenigen Rechtsträgers, dessen Gläubiger sie sind, nach § 19 Abs. 3 UmwG als bekannt gemacht gilt, ihren Anspruch nach Grund und Höhe schriftlich anmelden, Sicherheit zu leisten, soweit sie nicht Befriedigung verlangen können. Dieses Recht steht den Gläubigern jedoch nur zu, wenn sie glaubhaft machen, dass durch die Ausgliederung die Erfüllung der Forderung gefährdet wird."
    },
    {
      "date": "2025-10-16",
      "id": "134237",
      "original_text": "Registerbekanntmachung nach dem Umwandlungsgesetz\nSachsen Amtsgericht Chemnitz HRB 8801\nND Construction GmbH – Marienberg",
      "type": "Registerbekanntmachung nach dem Umwandlungsgesetz",
      "state": "Sachsen",
      "amtsgericht": "Amtsgericht Chemnitz",
      "registernummer": "HRB 8801",
      "registerart": "HRB",
      "company_name": "ND Construction GmbH",
      "company_seat": "Marienberg",
      "details": "16.10.2025 (Bekanntmachungsdatum)\n\nSachsen Amtsgericht Chemnitz HRB 8801\nRegisterbekanntmachung nach dem Umwandlungsgesetz 16.10.2025 (Eintragungsdatum)\n\nND Construction GmbH\nGesellschaft mit beschränkter Haftung\nMarienberg\n\nDen Gläubigern der an der Verschmelzung beteiligten Rechtsträger ist, wenn sie binnen sechs Monaten nach dem Tag, an dem die Eintragung der Verschmelzung in das Register des Sitzes desjenigen Rechtsträgers, dessen Gläubiger sie sind, nach § 19 Abs. 3 UmwG als bekannt gemacht gilt, ihren Anspruch nach Grund und Höhe in Textform anmelden, Sicherheit zu leisten, soweit sie nicht Befriedigung verlangen können. Dieses Recht steht den Gläubigern jedoch nur zu, wenn sie glaubhaft machen, dass durch die Verschmelzung die Erfüllung der Forderung gefährdet wird."
    },
    {
      "date": "2025-10-16",
      "id": "134238",
      "original_text": "Registerbekanntmachung nach dem Umwandlungsgesetz\nSachsen Amtsgericht Chemnitz HRB 19903\nSchlossGarten Rauenstein GmbH – Pockau-Lengefeld",
      "type": "Registerbekanntmachung nach dem Umwandlungsgesetz",
      "state": "Sachsen",
      "amtsgericht": "Amtsgericht Chemnitz",
      "registernummer": "HRB 19903",
      "registerart": "HRB",
      "company_name": "SchlossGarten Rauenstein GmbH",
      "company_seat": "Pockau-Lengefeld",
      "details": "16.10.2025 (Bekanntmachungsdatum)\n\nSachsen Amtsgericht Chemnitz HRB 19903\nRegisterbekanntmachung nach dem Umwandlungsgesetz 16.10.2025 (Eintragungsdatum)\n\nSchlossGarten Rauenstein GmbH\nGesellschaft mit beschränkter Haftung\nPockau-Lengefeld\n\nDen Gläubigern der an der Verschmelzung beteiligten Rechtsträger ist, wenn sie binnen sechs Monaten nach dem Tag, an dem die Eintragung der Verschmelzung in das Register des Sitzes desjenigen Rechtsträgers, dessen Gläubiger sie sind, nach § 19 Abs. 3 UmwG als bekannt gemacht gilt, ihren Anspruch nach Grund und Höhe in Textform anmelden, Sicherheit zu leisten, soweit sie nicht Befriedigung verlangen können. Dieses Recht steht den Gläubigern jedoch nur zu, wenn sie glaubhaft machen, dass durch die Verschmelzung die Erfüllung der Forderung gefährdet wird."
    },
    {
      "date": "2025-10-16",
      "id": "134239",
      "original_text": "Registerbekanntmachung nach dem Umwandlungsgesetz\nRheinland-Pfalz Amtsgericht Wittlich HRA 41536\nMICHELS Wohlfühlhotel GmbH & Co. KG – Schalkenmehren",
      "type": "Registerbekanntmachung nach dem Umwandlungsgesetz",
      "state": "Rheinland-Pfalz",
      "amtsgericht": "Amtsgericht Wittlich",
      "registernummer": "HRA 41536",
      "registerart": "HRA",
      "company_name": "MICHELS Wohlfühlhotel GmbH & Co. KG",
      "company_seat": "Schalkenmehren",
      "details": "16.10.2025 (Bekanntmachungsdatum)\n\nRheinland-Pfalz Amtsgericht Wittlich HRA 41536\nRegisterbekanntmachung nach dem Umwandlungsgesetz 16.10.2025 (Eintragungsdatum)\n\nMICHELS Wohlfühlhotel GmbH & Co. KG\nKommanditgesellschaft\nSchalkenmehren\n\nAls nicht eingetragen wird veröffentlicht:\nDen Gläubigern des formwechselnden Rechtsträgers ist, wenn sie binnen sechs Monaten nach dem Tag, an dem die Eintragung des Formwechsels nach § 201 UmwG als bekannt gemacht gilt, ihren Anspruch nach Grund und Höhe schriftlich anmelden, Sicherheit zu leisten, soweit sie nicht Befriedigung verlangen können. Dieses Recht steht den Gläubigern jedoch nur zu, wenn sie glaubhaft machen, dass durch den Formwechsel die Erfüllung der Forderung gefährdet wird."
    },
    {
      "date": "2025-10-16",
      "id": "134240",
      "original_text": "Registerbekanntmachung nach dem Umwandlungsgesetz\nRheinland-Pfalz Amtsgericht Ludwigshafen a.Rhein (Ludwigshafen) HRB 70466\nVetter Aquise GmbH – Speyer",
      "type": "Registerbekanntmachung nach dem Umwandlungsgesetz",
      "state": "Rheinland-Pfalz",
      "amtsgericht": "Amtsgericht Ludwigshafen a.Rhein (Ludwigshafen)",
      "registernummer": "HRB 70466",
      "registerart": "HRB",
      "company_name": "Vetter Aquise GmbH",
      "company_seat": "Speyer",
      "details": "16.10.2025 (Bekanntmachungsdatum)\n\nRheinland-Pfalz Amtsgericht Ludwigshafen a.Rhein (Ludwigshafen) HRB 70466\nRegisterbekanntmachung nach dem Umwandlungsgesetz 16.10.2025 (Eintragungsdatum)\n\nVetter Aquise GmbH\nGesellschaft mit beschränkter Haftung\nSpeyer\n\nAls nicht eingetragen wird veröffentlicht: Den Gläubigern der an der Ausgliederung beteiligten Rechtsträger ist, wenn sie binnen sechs Monaten nach dem Tag, an dem die Eintragung der Ausgliederung in das Register des Sitzes desjenigen Rechtsträgers,dessen Gläubiger sie sind, nach § 19 Abs. 3 UmwG als bekannt gemacht gilt, ihren Anspruch nach Grund und Höhe schriftlich anmelden, Sicherheit zu leisten, soweit sie nicht Befriedigung verlangen können. Dieses Recht steht den Gläubigern jedoch nur zu, wenn sie glaubhaft machen, dass durch die Ausgliederung die Erfüllung der Forderung gefährdet wird."
    },
    {
      "date": "2025-10-16",
      "id": "134241",
      "original_text": "Löschungsankündigung\nBremen Amtsgericht Bremen HRB 32652\nMaler & Bodensanierungsbetrieb Pichote GmbH – Bremen",
      "type": "Löschungsankündigung",
      "state": "Bremen",
      "amtsgericht": "Amtsgericht Bremen",
      "registernummer": "HRB 32652",
      "registerart": "HRB",
      "company_name": "Maler & Bodensanierungsbetrieb Pichote GmbH",
      "company_seat": "Bremen",
      "details": "16.10.2025 (Bekanntmachungsdatum)\n\nBremen Amtsgericht Bremen HRB 32652\nLöschungsankündigung\n\nMaler & Bodensanierungsbetrieb Pichote GmbH\nGesellschaft mit beschränkter Haftung\nBremen\n\nEs ist beabsichtigt die im Handelsregister eingetragene Gesellschaft von Amts wegen gemäß § 394 FamFG zu löschen. Gegen die Löschung kann beim AG Bremen schriftlich oder zu Protokoll der Geschäftsstelle Widerspruch eingelegt werden. Widerspruchsfrist 4 Wochen."
    },
    {
      "date": "2025-10-16",
      "id": "134242",
      "original_text": "Löschungsankündigung\nBremen Amtsgericht Bremen HRB 32706\nConblu.io GmbH – Bremen",
      "type": "Löschungsankündigung",
      "state": "Bremen",
      "amtsgericht": "Amtsgericht Bremen",
      "registernummer": "HRB 32706",
      "registerart": "HRB",
      "company_name": "Conblu.io GmbH",
      "company_seat": "Bremen",
      "details": "16.10.2025 (Bekanntmachungsdatum)\n\nBremen Amtsgericht Bremen HRB 32706\nLöschungsankündigung\n\nConblu.io GmbH\nGesellschaft mit beschränkter Haftung\nBremen\n\nEs ist beabsichtigt die im Handelsregister eingetragene Gesellschaft von Amts wegen gemäß § 394 FamFG zu löschen. Gegen die Löschung kann beim AG Bremen schriftlich oder zu Protokoll der Geschäftsstelle Widerspruch eingelegt werden. Widerspruchsfrist 4 Wochen."
    },
    {
      "date": "2025-10-16",
      "id": "134243",
      "original_text": "Löschungsankündigung\nBremen Amtsgericht Bremen HRB 21210\nSun & Window Verwaltungs- und Beteiligungs-GmbH – Bremen",
      "type": "Löschungsankündigung",
      "state": "Bremen",
      "amtsgericht": "Amtsgericht Bremen",
      "registernummer": "HRB 21210",
      "registerart": "HRB",
      "company_name": "Sun & Window Verwaltungs- und Beteiligungs-GmbH",
      "company_seat": "Bremen",
      "details": "16.10.2025 (Bekanntmachungsdatum)\n\nBremen Amtsgericht Bremen HRB 21210\nLöschungsankündigung\n\nSun & Window Verwaltungs- und Beteiligungs-GmbH\nGesellschaft mit beschränkter Haftung\nBremen\n\nEs ist beabsichtigt die im Handelsregister eingetragene Gesellschaft von Amts wegen gemäß § 394 FamFG zu löschen. Gegen die Löschung kann beim AG Bremen schriftlich oder zu Protokoll der Geschäftsstelle Widerspruch eingelegt werden. Widerspruchsfrist 4 Wochen."
    },
    {
      "date": "2025-10-16",
      "id": "134244",
      "original_text": "Löschungsankündigung\nBremen Amtsgericht Bremen HRB 38218\nNOWONIA GmbH – Bremen",
      "type": "Löschungsankündigung",
      "state": "Bremen",
      "amtsgericht": "Amtsgericht Bremen",
      "registernummer": "HRB 38218",
      "registerart": "HRB",
      "company_name": "NOWONIA GmbH",
      "company_seat": "Bremen",
      "details": "16.10.2025 (Bekanntmachungsdatum)\n\nBremen Amtsgericht Bremen HRB 38218\nLöschungsankündigung\n\nNOWONIA GmbH\nGesellschaft mit beschränkter Haftung\nBremen\n\nEs ist beabsichtigt die im Handelsregister eingetragene Gesellschaft von Amts wegen gemäß § 394 FamFG zu löschen. Gegen die Löschung kann beim AG Bremen schriftlich oder zu Protokoll der Geschäftsstelle Widerspruch eingelegt werden. Widerspruchsfrist 4 Wochen."
    },
    {
      "date": "2025-10-16",
      "id": "134245",
      "original_text": "Löschungsankündigung\nBremen Amtsgericht Bremen HRB 35102\nNavas Medical GmbH – Bremen",
      "type": "Löschungsankündigung",
      "state": "Bremen",
      "amtsgericht": "Amtsgericht Bremen",
      "registernummer": "HRB 35102",
      "registerart": "HRB",
      "company_name": "Navas Medical GmbH",
      "company_seat": "Bremen",
      "details": "16.10.2025 (Bekanntmachungsdatum)\n\nBremen Amtsgericht Bremen HRB 35102\nLöschungsankündigung\n\nNavas Medical GmbH\nGesellschaft mit beschränkter Haftung\nBremen\n\nEs ist beabsichtigt die im Handelsregister eingetragene Gesellschaft von Amts wegen gemäß § 394 FamFG zu löschen. Gegen die Löschung kann beim AG Bremen schriftlich oder zu Protokoll der Geschäftsstelle Widerspruch eingelegt werden. Widerspruchsfrist 4 Wochen."
    },
    {
      "date": "2025-10-16",
      "id": "134246",
      "original_text": "Registerbekanntmachung nach dem Umwandlungsgesetz\nBremen Amtsgericht Bremen HRB 41100\nSYI Property GmbH – Bremerhaven",
      "type": "Registerbekanntmachung nach dem Umwandlungsgesetz",
      "state": "Bremen",
      "amtsgericht": "Amtsgericht Bremen",
      "registernummer": "HRB 41100",
      "registerart": "HRB",
      "company_name": "SYI Property GmbH",
      "company_seat": "Bremerhaven",
      "details": "16.10.2025 (Bekanntmachungsdatum)\n\nBremen Amtsgericht Bremen HRB 41100\nRegisterbekanntmachung nach dem Umwandlungsgesetz 10.10.2025 (Eintragungsdatum)\n\nSYI Property GmbH\nGesellschaft mit beschränkter Haftung\nBremerhaven\n\nAls nicht eingetragen wird veröffentlicht: Den Gläubigern der an der Verschmelzung beteiligten Rechtsträger ist, wenn sie binnen sechs Monaten nach dem Tag, an dem die Eintragung der Verschmelzung in das Register des Sitzes desjenigen Rechtsträgers, dessen Gläubiger sie sind, als bekannt gemacht gilt, ihren Anspruch nach Grund und Höhe schriftlich anmelden, Sicherheit zu leisten, soweit sie nicht Befriedigung verlangen können. Dieses Recht steht den Gläubigern jedoch nur zu, wenn sie glaubhaft machen, dass durch die Verschmelzung die Erfüllung ihrer Forderung gefährdet wird. Das Recht, Sicherheitsleistung zu verlangen, steht Gläubigern nicht zu, die im Falle der Insolvenz ein Recht auf vorzugsweise Befriedigung aus einer Deckungsmasse haben, die nach gesetzlicher Vorschrift zu ihrem Schutz errichtet und staatlich überwacht ist."
    },
    {
      "date": "2025-10-16",
      "id": "134247",
      "original_text": "Registerbekanntmachung nach dem Umwandlungsgesetz\nBremen Amtsgericht Bremen HRB 41105\nSuperyacht Interiors GmbH – Bremerhaven",
      "type": "Registerbekanntmachung nach dem Umwandlungsgesetz",
      "state": "Bremen",
      "amtsgericht": "Amtsgericht Bremen",
      "registernummer": "HRB 41105",
      "registerart": "HRB",
      "company_name": "Superyacht Interiors GmbH",
      "company_seat": "Bremerhaven",
      "details": "16.10.2025 (Bekanntmachungsdatum)\n\nBremen Amtsgericht Bremen HRB 41105\nRegisterbekanntmachung nach dem Umwandlungsgesetz 10.10.2025 (Eintragungsdatum)\n\nSuperyacht Interiors GmbH\nGesellschaft mit beschränkter Haftung\nBremerhaven\n\nAls nicht eingetragen wird veröffentlicht: Den Gläubigern der an der Verschmelzung beteiligten Rechtsträger ist, wenn sie binnen sechs Monaten nach dem Tag, an dem die Eintragung der Verschmelzung in das Register des Sitzes desjenigen Rechtsträgers, dessen Gläubiger sie sind, als bekannt gemacht gilt, ihren Anspruch nach Grund und Höhe schriftlich anmelden, Sicherheit zu leisten, soweit sie nicht Befriedigung verlangen können. Dieses Recht steht den Gläubigern jedoch nur zu, wenn sie glaubhaft machen, dass durch die Verschmelzung die Erfüllung ihrer Forderung gefährdet wird. Das Recht, Sicherheitsleistung zu verlangen, steht Gläubigern nicht zu, die im Falle der Insolvenz ein Recht auf vorzugsweise Befriedigung aus einer Deckungsmasse haben, die nach gesetzlicher Vorschrift zu ihrem Schutz errichtet und staatlich überwacht ist."
    },
    {
      "date": "2025-10-16",
      "id": "134248",
      "original_text": "Registerbekanntmachung nach dem Umwandlungsgesetz\nRheinland-Pfalz Amtsgericht Ludwigshafen a.Rhein (Ludwigshafen) HRA 62423\nVetter Julia e. K. – Speyer",
      "type": "Registerbekanntmachung nach dem Umwandlungsgesetz",
      "state": "Rheinland-Pfalz",
      "amtsgericht": "Amtsgericht Ludwigshafen a.Rhein (Ludwigshafen)",
      "registernummer": "HRA 62423",
      "registerart": "HRA",
      "company_name": "Vetter Julia e. K.",
      "company_seat": "Speyer",
      "details": "16.10.2025 (Bekanntmachungsdatum)\n\nRheinland-Pfalz Amtsgericht Ludwigshafen a.Rhein (Ludwigshafen) HRA 62423\nRegisterbekanntmachung nach dem Umwandlungsgesetz 16.10.2025 (Eintragungsdatum)\n\nVetter Julia e. K.\nEinzelkaufmann / Einzelkauffrau\nSpeyer\n\nAls nicht eingetragen wird veröffentlicht: Den Gläubigern der an der Ausgliederung beteiligten Rechtsträger ist, wenn sie binnen sechs Monaten nach dem Tag, an dem die Eintragung der Ausgliederung in das Register des Sitzes desjenigen Rechtsträgers,dessen Gläubiger sie sind, nach § 19 Abs. 3 UmwG als bekannt gemacht gilt, ihren Anspruch nach Grund und Höhe schriftlich anmelden, Sicherheit zu leisten, soweit sie nicht Befriedigung verlangen können. Dieses Recht steht den Gläubigern jedoch nur zu, wenn sie glaubhaft machen, dass durch die Ausgliederung die Erfüllung der Forderung gefährdet wird."
    },
    {
      "date": "2025-10-16",
      "id": "134249",
      "original_text": "Registerbekanntmachung nach dem Umwandlungsgesetz\nNordrhein-Westfalen Amtsgericht Iserlohn HRA 5478\nTechniplas NRW GmbH & Co. KG – Lüdenscheid",
      "type": "Registerbekanntmachung nach dem Umwandlungsgesetz",
      "state": "Nordrhein-Westfalen",
      "amtsgericht": "Amtsgericht Iserlohn",
      "registernummer": "HRA 5478",
      "registerart": "HRA",
      "company_name": "Techniplas NRW GmbH & Co. KG",
      "company_seat": "Lüdenscheid",
      "details": "16.10.2025 (Bekanntmachungsdatum)\n\nNordrhein-Westfalen Amtsgericht Iserlohn HRA 5478\nRegisterbekanntmachung nach dem Umwandlungsgesetz 15.10.2025 (Eintragungsdatum)\n\nTechniplas NRW GmbH & Co. KG\nKommanditgesellschaft\nLüdenscheid\n\nDen Gläubigern der an der Verschmelzung beteiligten Rechtsträger ist, wenn sie binnen sechs Monaten nach dem Tag, an dem die Eintragung der Verschmelzung in das Register des Sitzes desjenigen Rechtsträgers, dessen Gläubiger sie sind, nach § 19 Absatz 3 UmwG als bekanntgemacht gilt, ihren Anspruch nach Grund und Höhe schriftlich anmelden, Sicherheit zu leisten, soweit sie nicht Befriedigung verlangen können. Dieses Recht steht den Gläubigern jedoch nur zu, wenn sie glaubhaft machen, dass durch die Verschmelzung die Erfüllung ihrer Forderung gefährdet wird."
    },
    {
      "date": "2025-10-16",
      "id": "134250",
      "original_text": "Registerbekanntmachung nach dem Umwandlungsgesetz\nNordrhein-Westfalen Amtsgericht Arnsberg HRA 9190\nMarco Barroso e.K. – Bad Sassendorf",
      "type": "Registerbekanntmachung nach dem Umwandlungsgesetz",
      "state": "Nordrhein-Westfalen",
      "amtsgericht": "Amtsgericht Arnsberg",
      "registernummer": "HRA 9190",
      "registerart": "HRA",
      "company_name": "Marco Barroso e.K.",
      "company_seat": "Bad Sassendorf",
      "details": "16.10.2025 (Bekanntmachungsdatum)\n\nNordrhein-Westfalen Amtsgericht Arnsberg HRA 9190\nRegisterbekanntmachung nach dem Umwandlungsgesetz 16.10.2025 (Eintragungsdatum)\n\nMarco Barroso e.K.\nEinzelkaufmann / Einzelkauffrau\nBad Sassendorf\n\nDen Gläubigern der an der Ausgliederung beteiligten Rechtsträger ist, wenn sie binnen sechs Monaten nach dem Tag, an dem die Eintragung der Ausgliederung in das Register des Sitzes desjenigen Rechtsträgers, dessen Gläubiger sie sind, nach § 19 Absatz 3 UmwG als bekanntgemacht gilt, ihren Anspruch nach Grund und Höhe schriftlich anmelden, Sicherheit zu leisten, soweit sie nicht Befriedigung verlangen können. Dieses Recht steht den Gläubigern jedoch nur zu, wenn sie glaubhaft machen, dass durch die Ausgliederung die Erfüllung ihrer Forderung gefährdet wird."
    },
    {
      "date": "2025-10-16",
      "id": "134251",
      "original_text": "Löschungsankündigung\nNordrhein-Westfalen Amtsgericht Duisburg HRB 10995\nUltra Scientific Europe GmbH – Wesel",
      "type": "Löschungsankündigung",
      "state": "Nordrhein-Westfalen",
      "amtsgericht": "Amtsgericht Duisburg",
      "registernummer": "HRB 10995",
      "registerart": "HRB",
      "company_name": "Ultra Scientific Europe GmbH",
      "company_seat": "Wesel",
      "details": "16.10.2025 (Bekanntmachungsdatum)\n\nNordrhein-Westfalen Amtsgericht Duisburg HRB 10995\nLöschungsankündigung\n\nUltra Scientific Europe GmbH\nGesellschaft mit beschränkter Haftung\nWesel\n\nDas Amtslöschungsverfahren nach § 394 FamFG wird eingestellt, da eine Vermögenslosigkeit nicht festgestellt werden kann."
    },
    {
      "date": "2025-10-16",
      "id": "134252",
      "original_text": "Löschungsankündigung\nNordrhein-Westfalen Amtsgericht Dortmund HRB 3133\nSeydewitz Beteiligungsgesellschaft mit beschränkter Haftung – Dortmund",
      "type": "Löschungsankündigung",
      "state": "Nordrhein-Westfalen",
      "amtsgericht": "Amtsgericht Dortmund",
      "registernummer": "HRB 3133",
      "registerart": "HRB",
      "company_name": "Seydewitz Beteiligungsgesellschaft mit beschränkter Haftung",
      "company_seat": "Dortmund",
      "details": "16.10.2025 (Bekanntmachungsdatum)\n\nNordrhein-Westfalen Amtsgericht Dortmund HRB 3133\nLöschungsankündigung\n\nSeydewitz Beteiligungsgesellschaft mit beschränkter Haftung\nGesellschaft mit beschränkter Haftung\nDortmund\n\nDas Registergericht beabsichtigt die Gesellschaft von Amts wegen nach § 394 FamFG zu löschen. Die Frist zur Erhebung eines Widerspruchs ist auf zwei Monate festgesetzt."
    },
    {
      "date": "2025-10-16",
      "id": "134253",
      "original_text": "Registerbekanntmachung nach dem Umwandlungsgesetz\nNordrhein-Westfalen Amtsgericht Dortmund VR 1519\nSozialdienst katholischer Frauen e.V. Ortsverein Hörde – Dortmund",
      "type": "Registerbekanntmachung nach dem Umwandlungsgesetz",
      "state": "Nordrhein-Westfalen",
      "amtsgericht": "Amtsgericht Dortmund",
      "registernummer": "VR 1519",
      "registerart": "VR",
      "company_name": "Sozialdienst katholischer Frauen e.V. Ortsverein Hörde",
      "company_seat": "Dortmund",
      "details": "16.10.2025 (Bekanntmachungsdatum)\n\nNordrhein-Westfalen Amtsgericht Dortmund VR 1519\nRegisterbekanntmachung nach dem Umwandlungsgesetz 16.10.2025 (Eintragungsdatum)\n\nSozialdienst katholischer Frauen e.V. Ortsverein Hörde\neingetragener Verein\nDortmund\n\nDen Gläubigern der an der Verschmelzung beteiligten Rechtsträger ist, wenn sie binnen sechs Monaten nach dem Tag, an dem die Eintragung der Verschmelzung in das Register des Sitzes desjenigen Rechtsträgers, dessen Gläubiger sie sind, nach § 19 Absatz 3 UmwG als bekanntgemacht gilt, ihren Anspruch nach Grund und Höhe schriftlich anmelden, Sicherheit zu leisten, soweit sie nicht Befriedigung verlangen können. Dieses Recht steht den Gläubigern jedoch nur zu, wenn sie glaubhaft machen, dass durch die Verschmelzung die Erfüllung ihrer Forderung gefährdet wird."
    },
    {
      "date": "2025-10-16",
      "id": "134254",
      "original_text": "Löschungsankündigung\nNordrhein-Westfalen Amtsgericht Duisburg HRB 31171\nBBD Bahnbau GmbH – Duisburg",
      "type": "Löschungsankündigung",
      "state": "Nordrhein-Westfalen",
      "amtsgericht": "Amtsgericht Duisburg",
      "registernummer": "HRB 31171",
      "registerart": "HRB",
      "company_name": "BBD Bahnbau GmbH",
      "company_seat": "Duisburg",
      "details": "16.10.2025 (Bekanntmachungsdatum)\n\nNordrhein-Westfalen Amtsgericht Duisburg HRB 31171\nLöschungsankündigung\n\nBBD Bahnbau GmbH\nGesellschaft mit beschränkter Haftung\nDuisburg\n\nDas Registergericht beabsichtigt, die im Handelsregister unter HRB 31171 eingetragene Gesellschaft BBD Bahnbau GmbH  gemäß § 394 FamFG wegen Vermögenslosigkeit von Amts wegen zu löschen. Gegen diese Verfügung kann Widerspruch eingelegt werden. Die Frist zur Erhebung eines Widerspruchs gegen die beabsichtigte Löschung von Amts wegen ist auf drei Monate festgesetzt. Rechtsbehelfsbelehrung Der Widerspruch ist bei dem Amtsgericht Duisburg, Kardinal-Galen-Str. 124-132, 47058 Duisburg schriftlich in deutscher Sprache oder zur Niederschrift der Geschäftsstelle einzulegen. Der Widerspruch kann auch zur Niederschrift der Geschäftsstelle eines jeden Amtsgerichtes abgegeben werden. Die Einlegung ist auch durch Übertragung eines elektronischen Dokuments an die elektronische Poststelle des Gerichts möglich. Das elektronische Dokument muss für die Bearbeitung durch das Gericht geeignet und mit einer qualifizierten elektronischen Signatur der verantwortenden Person versehen sein oder von der verantwortenden Person signiert und auf einem sicheren Übermittlungsweg gemäß § 130 a ZPO nach näherer Maßgabe der Verordnung über die technischen Rahmenbedingungen des elektronischen Rechtsverkehrs und über das besondere elektronische Behördenpostfach (BGBl. I, S. 3803) eingereicht werden. Weitere Informationen erhalten Sie auf der Internetseite www.justiz.de <http://www.justiz.de>. Der Widerspruch muss spätestens innerhalb der gesetzten Frist bei dem Amtsgericht Duisburg eingegangen sein. Dies gilt auch dann, wenn der Widerspruch zur Niederschrift der Geschäftsstelle eines anderen Amtsgerichtes abgegeben wurde. Die Frist beginnt mit der Veröffentlichung. Fällt das Ende der Frist auf einen Sonntag, einen allgemeinen Feiertag oder Sonnabend, so endet die Frist mit Ablauf des nächsten Werktages. Der Widerspruch muss die Bezeichnung der angefochtenen Verfügung sowie die Erklärung enthalten, dass Widerspruch gegen diese Verfügung eingelegt wird. Er ist zu unterzeichnen und soll begründet werden."
    },
    {
      "date": "2025-10-16",
      "id": "134255",
      "original_text": "Löschungsankündigung\nNordrhein-Westfalen Amtsgericht Neuss HRB 22032\nGMEE UG (haftungsbeschränkt) – Korschenbroich",
      "type": "Löschungsankündigung",
      "state": "Nordrhein-Westfalen",
      "amtsgericht": "Amtsgericht Neuss",
      "registernummer": "HRB 22032",
      "registerart": "HRB",
      "company_name": "GMEE UG (haftungsbeschränkt)",
      "company_seat": "Korschenbroich",
      "details": "16.10.2025 (Bekanntmachungsdatum)\n\nNordrhein-Westfalen Amtsgericht Neuss HRB 22032\nLöschungsankündigung 16.10.2025 (Eintragungsdatum)\n\nGMEE UG (haftungsbeschränkt)\nGesellschaft mit beschränkter Haftung\nKorschenbroich\n\nDas Registergericht beabsichtigt die Gesellschaft von Amts wegen nach § 394 FamFG zu löschen. Die Frist zur Erhebung eines Widerspruchs ist auf #DV.Fr(Text=\"Bitte wählen Sie die Widerspruchsfrist aus!\",Eingabe=\"einen Monat\",\"zwei Monate\",\"drei Monate\",\"#insert(Text=\"Freitext\")\"|\"freier Text\") festgesetzt.\nEs ist beabsichtigt, die Gesellschaft wegen Vermögenslosigkeit aufgrund des § 394 Abs. 1 FamFG zu löschen. Frist zur Geltendmachung eines Widerspruchs: 1 Monat.\n\nRechtsbehelfsbelehrung:\nGegen diese Verfügung können Sie Widerspruch einlegen.\nDer Widerspruch ist bei dem Amtsgericht Neuss - Registergericht -, Breite Str. 48, 41460 Neuss schriftlich in deutscher Sprache oder zur Niederschrift der Geschäftsstelle einzulegen.\nDer Widerspruch kann auch zur Niederschrift der Geschäftsstelle eines jeden Amtsgerichtes abgegeben werden.\nDie Einlegung ist auch durch Übertragung eines elektronischen Dokuments an die elektronische Poststelle des Gerichts möglich. Das elektronische Dokument muss für die Bearbeitung durch das Gericht geeignet und mit einer qualifizierten elektronischen Signatur der verantwortenden Person versehen sein oder von der verantwortenden Person signiert und auf einem sicheren Übermittlungsweg gemäß § 130a ZPO nach näherer Maßgabe der Verordnung über die technischen Rahmenbedingungen des elektronischen Rechtsverkehrs und über das besondere elektronische Behördenpostfach (BGBl. I, S.3803) eingereicht werden. Weitere Informationen erhalten Sie auf der Internetseite www.justiz.de.\nDer Widerspruch muss spätestens innerhalb der gesetzten Frist nach der schriftlichen Bekanntgabe der Verfügung bei dem Amtsgericht - Registergericht - Neuss eingegangen sein. Dies gilt auch dann, wenn der Widerspruch zur Niederschrift der Geschäftsstelle eines anderen Amtsgerichtes abgegeben wurde. Die Frist beginnt mit der schriftlichen Bekanntgabe der Verfügung. Die Bekanntgabe ist entweder durch Zustellung oder am dritten Tage nach Aufgabe zur Post bewirkt. Fällt das Ende der Frist auf einen Sonntag, einen allgemeinen Feiertag oder Sonnabend, so endet die Frist mit Ablauf des nächsten Werktages.\n\nDer Widerspruch muss die Bezeichnung der angefochtenen Verfügung sowie die Erklärung enthalten, dass Widerspruch gegen diese Verfügung eingelegt wird. Er ist zu unterzeichnen und soll begründet werden."
    },
    {
      "date": "2025-10-16",
      "id": "134256",
      "original_text": "Löschungsankündigung\nNordrhein-Westfalen Amtsgericht Neuss HRB 20302\nMorelli Automobili GmbH – Neuss",
      "type": "Löschungsankündigung",
      "state": "Nordrhein-Westfalen",
      "amtsgericht": "Amtsgericht Neuss",
      "registernummer": "HRB 20302",
      "registerart": "HRB",
      "company_name": "Morelli Automobili GmbH",
      "company_seat": "Neuss",
      "details": "16.10.2025 (Bekanntmachungsdatum)\n\nNordrhein-Westfalen Amtsgericht Neuss HRB 20302\nLöschungsankündigung 09.10.2025 (Eintragungsdatum)\n\nMorelli Automobili GmbH\nGesellschaft mit beschränkter Haftung\nNeuss\n\nDas Registergericht beabsichtigt die Gesellschaft wegen Vermögenslosigkeit aufgrund des § 394 Abs. 1 FamFG zu löschen. Frist zur Geltendmachung eines Widerspruchs: 1 Monat.\nRechtsbehelfsbelehrung:\nGegen diese Verfügung können Sie Widerspruch einlegen.\nDer Widerspruch ist bei dem Amtsgericht Neuss - Registergericht -, Breite Str. 48, 41460 Neuss schriftlich in deutscher Sprache oder zur Niederschrift der Geschäftsstelle einzulegen.\nDer Widerspruch kann auch zur Niederschrift der Geschäftsstelle eines jeden Amtsgerichtes abgegeben werden.\nDie Einlegung ist auch durch Übertragung eines elektronischen Dokuments an die elektronische Poststelle des Gerichts möglich. Das elektronische Dokument muss für die Bearbeitung durch das Gericht geeignet und mit einer qualifizierten elektronischen Signatur der verantwortenden Person versehen sein oder von der verantwortenden Person signiert und auf einem sicheren Übermittlungsweg gemäß § 130a ZPO nach näherer Maßgabe der Verordnung über die technischen Rahmenbedingungen des elektronischen Rechtsverkehrs und über das besondere elektronische Behördenpostfach (BGBl. I, S.3803) eingereicht werden. Weitere Informationen erhalten Sie auf der Internetseite www.justiz.de.\nDer Widerspruch muss spätestens innerhalb der gesetzten Frist nach der schriftlichen Bekanntgabe der Verfügung bei dem Amtsgericht - Registergericht - Neuss eingegangen sein. Dies gilt auch dann, wenn der Widerspruch zur Niederschrift der Geschäftsstelle eines anderen Amtsgerichtes abgegeben wurde. Die Frist beginnt mit der schriftlichen Bekanntgabe der Verfügung. Die Bekanntgabe ist entweder durch Zustellung oder am dritten Tage nach Aufgabe zur Post bewirkt. Fällt das Ende der Frist auf einen Sonntag, einen allgemeinen Feiertag oder Sonnabend, so endet die Frist mit Ablauf des nächsten Werktages.\nDer Widerspruch muss die Bezeichnung der angefochtenen Verfügung sowie die Erklärung enthalten, dass Widerspruch gegen diese Verfügung eingelegt wird. Er ist zu unterzeichnen und soll begründet werden."
    },
    {
      "date": "2025-10-16",
      "id": "134257",
      "original_text": "Löschungsankündigung\nNordrhein-Westfalen Amtsgericht Duisburg HRB 34739\nRegno Real Estate GmbH – Oberhausen",
      "type": "Löschungsankündigung",
      "state": "Nordrhein-Westfalen",
      "amtsgericht": "Amtsgericht Duisburg",
      "registernummer": "HRB 34739",
      "registerart": "HRB",
      "company_name": "Regno Real Estate GmbH",
      "company_seat": "Oberhausen",
      "details": "16.10.2025 (Bekanntmachungsdatum)\n\nNordrhein-Westfalen Amtsgericht Duisburg HRB 34739\nLöschungsankündigung 16.10.2025 (Eintragungsdatum)\n\nRegno Real Estate GmbH\nGesellschaft mit beschränkter Haftung\nOberhausen\n\nHRB 34739:\nRegno Real Estate GmbH, Duisburg\nKammerstraße 36, 47057 Duisburg.\nDas Registergericht beabsichtigt, die im Handelsregister eingetragene Gesellschaft gemäß § 394 FamFG wegen Vermögenslosigkeit von Amts wegen zu löschen. Gegen diese Verfügung kann Widerspruch eingelegt werden. Die Frist zur Erhebung eines Widerspruchs gegen die beabsichtigte Löschung von Amts wegen ist auf drei Monate festgesetzt.\nRechtsbehelfsbelehrung Der Widerspruch ist bei dem Amtsgericht Duisburg, Kardinal-Galen-Str. 124-132, 47058 Duisburg schriftlich in deutscher Sprache oder zur Niederschrift der Geschäftsstelle einzulegen. Der Widerspruch kann auch zur Niederschrift der Geschäftsstelle eines jeden Amtsgerichtes abgegeben werden. Die Einlegung ist auch durch Übertragung eines elektronischen Dokuments an die elektronische Poststelle des Gerichts möglich. Das elektronische Dokument muss für die Bearbeitung durch das Gericht geeignet und mit einer qualifizierten elektronischen Signatur der verantwortenden Person versehen sein oder von der verantwortenden Person signiert und auf einem sicheren Übermittlungsweg gemäß § 130 a ZPO nach näherer Maßgabe der Verordnung über die technischen Rahmenbedingungen des elektronischen Rechtsverkehrs und über das besondere elektronische Behördenpostfach (BGBl. I, S. 3803) eingereicht werden. Weitere Informationen erhalten Sie auf der Internetseite www.justiz.de <http://www.justiz.de>. Der Widerspruch muss spätestens innerhalb der gesetzten Frist bei dem Amtsgericht Duisburg eingegangen sein. Dies gilt auch dann, wenn der Widerspruch zur Niederschrift der Geschäftsstelle eines anderen Amtsgerichtes abgegeben wurde. Die Frist beginnt mit der Veröffentlichung. Fällt das Ende der Frist auf einen Sonntag, einen allgemeinen Feiertag oder Sonnabend, so endet die Frist mit Ablauf des nächsten Werktages. Der Widerspruch muss die Bezeichnung der angefochtenen Verfügung sowie die Erklärung enthalten, dass Widerspruch gegen diese Verfügung eingelegt wird. Er ist zu unterzeichnen und soll begründet werden."
    },
    {
      "date": "2025-10-16",
      "id": "134258",
      "original_text": "Löschungsankündigung\nNordrhein-Westfalen Amtsgericht Dortmund HRB 33195\nOM Transporte und Autovermietung GmbH – Dortmund",
      "type": "Löschungsankündigung",
      "state": "Nordrhein-Westfalen",
      "amtsgericht": "Amtsgericht Dortmund",
      "registernummer": "HRB 33195",
      "registerart": "HRB",
      "company_name": "OM Transporte und Autovermietung GmbH",
      "company_seat": "Dortmund",
      "details": "16.10.2025 (Bekanntmachungsdatum)\n\nNordrhein-Westfalen Amtsgericht Dortmund HRB 33195\nLöschungsankündigung 16.10.2025 (Eintragungsdatum)\n\nOM Transporte und Autovermietung GmbH\nGesellschaft mit beschränkter Haftung\nDortmund\n\nDas Registergericht beabsichtigt die Gesellschaft von Amts wegen nach § 394 FamFG zu löschen. Die Frist zur Erhebung eines Widerspruchs ist auf zwei Monate festgesetzt."
    },
    {
      "date": "2025-10-16",
      "id": "134259",
      "original_text": "Registerbekanntmachung nach dem Umwandlungsgesetz\nNordrhein-Westfalen Amtsgericht Essen HRB 30021\nLeadingApp UG (haftungsbeschränkt) – Essen",
      "type": "Registerbekanntmachung nach dem Umwandlungsgesetz",
      "state": "Nordrhein-Westfalen",
      "amtsgericht": "Amtsgericht Essen",
      "registernummer": "HRB 30021",
      "registerart": "HRB",
      "company_name": "LeadingApp UG (haftungsbeschränkt)",
      "company_seat": "Essen",
      "details": "16.10.2025 (Bekanntmachungsdatum)\n\nNordrhein-Westfalen Amtsgericht Essen HRB 30021\nRegisterbekanntmachung nach dem Umwandlungsgesetz 16.10.2025 (Eintragungsdatum)\n\nLeadingApp UG (haftungsbeschränkt)\nGesellschaft mit beschränkter Haftung\nEssen\n\nDen Gläubigern der an der Verschmelzung beteiligten Rechtsträger ist, wenn sie binnen sechs Monaten nach dem Tag, an dem die Eintragung der Verschmelzung in das Register des Sitzes derjenigen Rechtsträger deren Gläubiger sie sind, nach § 19 Absatz 3 UmwG als bekanntgemacht gilt, ihren Anspruch nach Grund und Höhe schriftlich anmelden, Sicherheit zu leisten, soweit sie nicht Befriedigung verlangen können. Dieses Recht steht den Gläubigern jedoch nur zu, wenn sie glaubhaft machen, dass durch die Verschmelzung die Erfüllung ihrer Forderung gefährdet wird."
    },
    {
      "date": "2025-10-16",
      "id": "134260",
      "original_text": "Registerbekanntmachung nach dem Umwandlungsgesetz\nNordrhein-Westfalen Amtsgericht Düsseldorf HRB 95424\nLandmarken Parkhaus Neue Höfe Herne GmbH – Monheim am Rhein",
      "type": "Registerbekanntmachung nach dem Umwandlungsgesetz",
      "state": "Nordrhein-Westfalen",
      "amtsgericht": "Amtsgericht Düsseldorf",
      "registernummer": "HRB 95424",
      "registerart": "HRB",
      "company_name": "Landmarken Parkhaus Neue Höfe Herne GmbH",
      "company_seat": "Monheim am Rhein",
      "details": "16.10.2025 (Bekanntmachungsdatum)\n\nNordrhein-Westfalen Amtsgericht Düsseldorf HRB 95424\nRegisterbekanntmachung nach dem Umwandlungsgesetz 16.10.2025 (Eintragungsdatum)\n\nLandmarken Parkhaus Neue Höfe Herne GmbH\nGesellschaft mit beschränkter Haftung\nMonheim am Rhein\n\nDen Gläubigern der an der Verschmelzung beteiligten Rechtsträger ist, wenn sie binnen sechs Monaten nach dem Tag, an dem die Eintragung der Verschmelzung in das Register des Sitzes desjenigen Rechtsträgers, dessen Gläubiger sie sind, nach § 19 Absatz 3 UmwG als bekanntgemacht gilt, ihren Anspruch nach Grund und Höhe schriftlich anmelden, Sicherheit zu leisten, soweit sie nicht Befriedigung verlangen können. Dieses Recht steht den Gläubigern jedoch nur zu, wenn sie glaubhaft machen, dass durch die Verschmelzung die Erfüllung ihrer Forderung gefährdet wird."
    },
    {
      "date": "2025-10-16",
      "id": "134261",
      "original_text": "Registerbekanntmachung nach dem Umwandlungsgesetz\nNordrhein-Westfalen Amtsgericht Gütersloh HRA 5235\nKÜCHEN SCHMIDT e.K. DIE WELT DER KÜCHE – Rheda-Wiedenbrück",
      "type": "Registerbekanntmachung nach dem Umwandlungsgesetz",
      "state": "Nordrhein-Westfalen",
      "amtsgericht": "Amtsgericht Gütersloh",
      "registernummer": "HRA 5235",
      "registerart": "HRA",
      "company_name": "KÜCHEN SCHMIDT e.K. DIE WELT DER KÜCHE",
      "company_seat": "Rheda-Wiedenbrück",
      "details": "16.10.2025 (Bekanntmachungsdatum)\n\nNordrhein-Westfalen Amtsgericht Gütersloh HRA 5235\nRegisterbekanntmachung nach dem Umwandlungsgesetz 16.10.2025 (Eintragungsdatum)\n\nKÜCHEN SCHMIDT e.K. DIE WELT DER KÜCHE\nEinzelkaufmann / Einzelkauffrau\nRheda-Wiedenbrück\n\nDen Gläubigern der an der Verschmelzung beteiligten Rechtsträger ist, wenn sie binnen sechs Monaten nach dem Tag, an dem die Eintragung der Verschmelzung in das Register des Sitzes desjenigen Rechtsträgers, dessen Gläubiger sie sind, nach § 19 Absatz 3 UmwG als bekanntgemacht gilt, ihren Anspruch nach Grund und Höhe schriftlich anmelden, Sicherheit zu leisten, soweit sie nicht Befriedigung verlangen können. Dieses Recht steht den Gläubigern jedoch nur zu, wenn sie glaubhaft machen, dass durch die Verschmelzung die Erfüllung ihrer Forderung gefährdet wird."
    },
    {
      "date": "2025-10-16",
      "id": "134262",
      "original_text": "Löschungsankündigung\nNordrhein-Westfalen Amtsgericht Aachen VR 6191\nDobermann-Rettung e.V. – Roetgen",
      "type": "Löschungsankündigung",
      "state": "Nordrhein-Westfalen",
      "amtsgericht": "Amtsgericht Aachen",
      "registernummer": "VR 6191",
      "registerart": "VR",
      "company_name": "Dobermann-Rettung e.V.",
      "company_seat": "Roetgen",
      "details": "16.10.2025 (Bekanntmachungsdatum)\n\nNordrhein-Westfalen Amtsgericht Aachen VR 6191\nLöschungsankündigung\n\nDobermann-Rettung e.V.\neingetragener Verein\nRoetgen\n\nDas Registergericht beabsichtigt, von Amts wegen folgende Eintragung wegen Unzulässigkeit nach § 395 FamFG zu löschen:\n\nKassenführerin Janka Siemens\n\nZur Geltendmachung des Widerspruchs gegen die beabsichtigte Löschung wird hiermit eine Frist von einem Monat ab Veröffentlichung dieser Ankündigung bestimmt.\n\nRechtsbehelfsbelehrung:\n\nGegen diese Verfügung kann Widerspruch eingelegt werden. Zum Widerspruch ist jeder berechtigt, der an der Unterlassung der Löschung ein berechtigtes Interesse hat.\n\nDer Widerspruch ist bei dem Amtsgericht Aachen, Adalbertsteinweg 92, 52070 Aachen schriftlich in deutscher Sprache oder zur Niederschrift der Geschäftsstelle einzulegen. Der Widerspruch kann auch zur Niederschrift der Geschäftsstelle eines jeden Amtsgerichtes abgegeben werden.\n\nDer Widerspruch muss spätestens innerhalb der gesetzten Frist nach der Bekanntgabe der Verfügung bei dem Amtsgericht Aachen eingegangen sein. Dies gilt auch dann, wenn der Widerspruch zur Niederschrift der Geschäftsstelle eines anderen Amtsgerichtes abgegeben wurde. Die Frist beginnt mit der Bekanntgabe der Verfügung durch Veröffentlichung. Fällt das Ende der Frist auf einen Sonntag, einen allgemeinen Feiertag oder Sonnabend, so endet die Frist mit Ablauf des nächsten Werktages.\n\nDer Widerspruch muss die Bezeichnung der angefochtenen Verfügung sowie die Erklärung enthalten, dass Widerspruch gegen diese Verfügung eingelegt wird. Er ist zu unterzeichnen und soll begründet werden.\n\nDie Einlegung ist auch durch Übertragung eines elektronischen Dokuments an die elektronische Poststelle des Gerichts möglich. Das elektronische Dokument muss für die Bearbeitung durch das Gericht geeignet und mit einer qualifizierten elektronischen Signatur der verantwortenden Person versehen sein oder von der verantwortenden Person signiert und auf einem sicheren Übermittlungsweg gemäß § 130 a ZPO nach näherer Maßgabe der Verordnung über die technischen Rahmenbedingungen des elektronischen Rechtsverkehrs und über das besondere elektronische Behördenpostfach (BGBl. I, S. 3803) eingereicht werden. Weitere Informationen erhalten Sie auf der Internetseite www.justiz.de."
    },
    {
      "date": "2025-10-16",
      "id": "134263",
      "original_text": "Registerbekanntmachung nach dem Umwandlungsgesetz\nNordrhein-Westfalen Amtsgericht Wuppertal HRB 10268\nKobold Management Systeme GmbH – Wuppertal",
      "type": "Registerbekanntmachung nach dem Umwandlungsgesetz",
      "state": "Nordrhein-Westfalen",
      "amtsgericht": "Amtsgericht Wuppertal",
      "registernummer": "HRB 10268",
      "registerart": "HRB",
      "company_name": "Kobold Management Systeme GmbH",
      "company_seat": "Wuppertal",
      "details": "16.10.2025 (Bekanntmachungsdatum)\n\nNordrhein-Westfalen Amtsgericht Wuppertal HRB 10268\nRegisterbekanntmachung nach dem Umwandlungsgesetz 16.10.2025 (Eintragungsdatum)\n\nKobold Management Systeme GmbH\nGesellschaft mit beschränkter Haftung\nWuppertal\n\nDen Gläubigern der an der Verschmelzung beteiligten Rechtsträger ist, wenn sie binnen sechs Monaten nach dem Tag, an dem die Eintragung der Verschmelzung in das Register des Sitzes derjenigen Rechtsträger deren Gläubiger sie sind, nach § 19 Absatz 3 UmwG als bekanntgemacht gilt, ihren Anspruch nach Grund und Höhe schriftlich anmelden, Sicherheit zu leisten, soweit sie nicht Befriedigung verlangen können. Dieses Recht steht den Gläubigern jedoch nur zu, wenn sie glaubhaft machen, dass durch die Verschmelzung die Erfüllung ihrer Forderung gefährdet wird."
    },
    {
      "date": "2025-10-16",
      "id": "134264",
      "original_text": "Registerbekanntmachung nach dem Umwandlungsgesetz\nNordrhein-Westfalen Amtsgericht Bad Oeynhausen GsR 368\nMahdi & Hadi Yassine Experts eGbR – Bad Oeynhausen",
      "type": "Registerbekanntmachung nach dem Umwandlungsgesetz",
      "state": "Nordrhein-Westfalen",
      "amtsgericht": "Amtsgericht Bad Oeynhausen",
      "registernummer": "GsR 368",
      "registerart": "GsR",
      "company_name": "Mahdi & Hadi Yassine Experts eGbR",
      "company_seat": "Bad Oeynhausen",
      "details": "16.10.2025 (Bekanntmachungsdatum)\n\nNordrhein-Westfalen Amtsgericht Bad Oeynhausen GsR 368\nRegisterbekanntmachung nach dem Umwandlungsgesetz 22.09.2025 (Eintragungsdatum)\n\nMahdi & Hadi Yassine Experts eGbR\nGesellschaft bürgerlichen Rechts\nBad Oeynhausen\n\nDen Gläubigern der an der formwechselnden Umwandlung beteiligten Rechtsträger ist, wenn sie binnen sechs Monaten nach dem Tag, an dem die Eintragung der formwechselnden Umwandlung in das Register des Sitzes derjenigen Rechtsträger deren Gläubiger sie sind, nach § 19 Absatz 3 UmwG als bekanntgemacht gilt, ihren Anspruch nach Grund und Höhe schriftlich anmelden, Sicherheit zu leisten, soweit sie nicht Befriedigung verlangen können. Dieses Recht steht den Gläubigern jedoch nur zu, wenn sie glaubhaft machen, dass durch die formwechselnden Umwandlung die Erfüllung ihrer Forderung gefährdet wird."
    },
    {
      "date": "2025-10-16",
      "id": "134265",
      "original_text": "Registerbekanntmachung nach dem Umwandlungsgesetz\nNordrhein-Westfalen Amtsgericht Paderborn HRB 18098\nGR Ingenieure GmbH – Paderborn",
      "type": "Registerbekanntmachung nach dem Umwandlungsgesetz",
      "state": "Nordrhein-Westfalen",
      "amtsgericht": "Amtsgericht Paderborn",
      "registernummer": "HRB 18098",
      "registerart": "HRB",
      "company_name": "GR Ingenieure GmbH",
      "company_seat": "Paderborn",
      "details": "16.10.2025 (Bekanntmachungsdatum)\n\nNordrhein-Westfalen Amtsgericht Paderborn HRB 18098\nRegisterbekanntmachung nach dem Umwandlungsgesetz 16.10.2025 (Eintragungsdatum)\n\nGR Ingenieure GmbH\nGesellschaft mit beschränkter Haftung\nPaderborn\n\nDen Gläubigern der an der Ausgliederung beteiligten Rechtsträger ist, wenn sie binnen sechs Monaten nach dem Tag, an dem die Eintragung der Ausgliederung in das Register des Sitzes desjenigen Rechtsträgers, dessen Gläubiger sie sind, nach § 19 Absatz 3 UmwG als bekanntgemacht gilt, ihren Anspruch nach Grund und Höhe schriftlich anmelden, Sicherheit zu leisten, soweit sie nicht Befriedigung verlangen können. Dieses Recht steht den Gläubigern jedoch nur zu, wenn sie glaubhaft machen, dass durch die Ausgliederung die Erfüllung ihrer Forderung gefährdet wird."
    },
    {
      "date": "2025-10-16",
      "id": "134266",
      "original_text": "Löschungsankündigung\nNordrhein-Westfalen Amtsgericht Gütersloh HRB 9014\nKaffeeabo GmbH – Rietberg",
      "type": "Löschungsankündigung",
      "state": "Nordrhein-Westfalen",
      "amtsgericht": "Amtsgericht Gütersloh",
      "registernummer": "HRB 9014",
      "registerart": "HRB",
      "company_name": "Kaffeeabo GmbH",
      "company_seat": "Rietberg",
      "details": "16.10.2025 (Bekanntmachungsdatum)\n\nNordrhein-Westfalen Amtsgericht Gütersloh HRB 9014\nLöschungsankündigung 16.10.2025 (Eintragungsdatum)\n\nKaffeeabo GmbH\nGesellschaft mit beschränkter Haftung\nRietberg\n\nDas Registergericht beabsichtigt die Gesellschaft von Amts wegen nach § 394 FamFG zu löschen. Die Frist zur Erhebung eines Widerspruchs ist auf einen Monat festgesetzt."
    },
    {
      "date": "2025-10-16",
      "id": "134267",
      "original_text": "Registerbekanntmachung nach dem Umwandlungsgesetz\nNordrhein-Westfalen Amtsgericht Siegburg HRB 12031\nGerstäcker International GmbH – Eitorf",
      "type": "Registerbekanntmachung nach dem Umwandlungsgesetz",
      "state": "Nordrhein-Westfalen",
      "amtsgericht": "Amtsgericht Siegburg",
      "registernummer": "HRB 12031",
      "registerart": "HRB",
      "company_name": "Gerstäcker International GmbH",
      "company_seat": "Eitorf",
      "details": "16.10.2025 (Bekanntmachungsdatum)\n\nNordrhein-Westfalen Amtsgericht Siegburg HRB 12031\nRegisterbekanntmachung nach dem Umwandlungsgesetz 16.10.2025 (Eintragungsdatum)\n\nGerstäcker International GmbH\nGesellschaft mit beschränkter Haftung\nEitorf\n\nDen Gläubigern der an der Verschmelzung beteiligten Rechtsträger ist, wenn sie binnen sechs Monaten nach dem Tag, an dem die Eintragung der Verschmelzung in das Register des Sitzes desjenigen Rechtsträgers, dessen Gläubiger sie sind, nach § 19 Absatz 3 UmwG als bekanntgemacht gilt, ihren Anspruch nach Grund und Höhe schriftlich anmelden, Sicherheit zu leisten, soweit sie nicht Befriedigung verlangen können. Dieses Recht steht den Gläubigern jedoch nur zu, wenn sie glaubhaft machen, dass durch die Verschmelzung die Erfüllung ihrer Forderung gefährdet wird."
    },
    {
      "date": "2025-10-16",
      "id": "134268",
      "original_text": "Löschungsankündigung\nNordrhein-Westfalen Amtsgericht Hamm HRB 10132\nDönercim Ankara UG (haftungsbeschränkt) – Hamm",
      "type": "Löschungsankündigung",
      "state": "Nordrhein-Westfalen",
      "amtsgericht": "Amtsgericht Hamm",
      "registernummer": "HRB 10132",
      "registerart": "HRB",
      "company_name": "Dönercim Ankara UG (haftungsbeschränkt)",
      "company_seat": "Hamm",
      "details": "16.10.2025 (Bekanntmachungsdatum)\n\nNordrhein-Westfalen Amtsgericht Hamm HRB 10132\nLöschungsankündigung\n\nDönercim Ankara UG (haftungsbeschränkt)\nGesellschaft mit beschränkter Haftung\nHamm\n\nDas Registergericht beabsichtigt die Gesellschaft von Amts wegen nach § 394 FamFG zu löschen. Die Frist zur Erhebung eines Widerspruchs ist auf drei Monate festgesetzt."
    },
    {
      "date": "2025-10-16",
      "id": "134269",
      "original_text": "Registerbekanntmachung nach dem Umwandlungsgesetz\nNordrhein-Westfalen Amtsgericht Gütersloh HRB 5652\nABC-Möbel Schmidt GmbH – Rheda-Wiedenbrück",
      "type": "Registerbekanntmachung nach dem Umwandlungsgesetz",
      "state": "Nordrhein-Westfalen",
      "amtsgericht": "Amtsgericht Gütersloh",
      "registernummer": "HRB 5652",
      "registerart": "HRB",
      "company_name": "ABC-Möbel Schmidt GmbH",
      "company_seat": "Rheda-Wiedenbrück",
      "details": "16.10.2025 (Bekanntmachungsdatum)\n\nNordrhein-Westfalen Amtsgericht Gütersloh HRB 5652\nRegisterbekanntmachung nach dem Umwandlungsgesetz 16.10.2025 (Eintragungsdatum)\n\nABC-Möbel Schmidt GmbH\nGesellschaft mit beschränkter Haftung\nRheda-Wiedenbrück\n\nDen Gläubigern der an der Verschmelzung beteiligten Rechtsträger ist, wenn sie binnen sechs Monaten nach dem Tag, an dem die Eintragung der Verschmelzung in das Register des Sitzes desjenigen Rechtsträgers, dessen Gläubiger sie sind, nach § 19 Absatz 3 UmwG als bekanntgemacht gilt, ihren Anspruch nach Grund und Höhe schriftlich anmelden, Sicherheit zu leisten, soweit sie nicht Befriedigung verlangen können. Dieses Recht steht den Gläubigern jedoch nur zu, wenn sie glaubhaft machen, dass durch die Verschmelzung die Erfüllung ihrer Forderung gefährdet wird."
    },
    {
      "date": "2025-10-16",
      "id": "134270",
      "original_text": "Registerbekanntmachung nach dem Umwandlungsgesetz\nNordrhein-Westfalen Amtsgericht Düsseldorf HRB 90866\nPegasus Investment GmbH – Monheim am Rhein",
      "type": "Registerbekanntmachung nach dem Umwandlungsgesetz",
      "state": "Nordrhein-Westfalen",
      "amtsgericht": "Amtsgericht Düsseldorf",
      "registernummer": "HRB 90866",
      "registerart": "HRB",
      "company_name": "Pegasus Investment GmbH",
      "company_seat": "Monheim am Rhein",
      "details": "16.10.2025 (Bekanntmachungsdatum)\n\nNordrhein-Westfalen Amtsgericht Düsseldorf HRB 90866\nRegisterbekanntmachung nach dem Umwandlungsgesetz 16.10.2025 (Eintragungsdatum)\n\nPegasus Investment GmbH\nGesellschaft mit beschränkter Haftung\nMonheim am Rhein\n\nDen Gläubigern der an der Verschmelzung beteiligten Rechtsträger ist, wenn sie binnen sechs Monaten nach dem Tag, an dem die Eintragung der Verschmelzung in das Register des Sitzes desjenigen Rechtsträgers, dessen Gläubiger sie sind, nach § 19 Absatz 3 UmwG als bekanntgemacht gilt, ihren Anspruch nach Grund und Höhe schriftlich anmelden, Sicherheit zu leisten, soweit sie nicht Befriedigung verlangen können. Dieses Recht steht den Gläubigern jedoch nur zu, wenn sie glaubhaft machen, dass durch die Verschmelzung die Erfüllung ihrer Forderung gefährdet wird."
    },
    {
      "date": "2025-10-16",
      "id": "134271",
      "original_text": "Löschungsankündigung\nNordrhein-Westfalen Amtsgericht Neuss HRB 22732\nJP Abbruch UG (haftungsbeschränkt) – Neuss",
      "type": "Löschungsankündigung",
      "state": "Nordrhein-Westfalen",
      "amtsgericht": "Amtsgericht Neuss",
      "registernummer": "HRB 22732",
      "registerart": "HRB",
      "company_name": "JP Abbruch UG (haftungsbeschränkt)",
      "company_seat": "Neuss",
      "details": "16.10.2025 (Bekanntmachungsdatum)\n\nNordrhein-Westfalen Amtsgericht Neuss HRB 22732\nLöschungsankündigung 09.10.2025 (Eintragungsdatum)\n\nJP Abbruch UG (haftungsbeschränkt)\nGesellschaft mit beschränkter Haftung\nNeuss\n\nDas Registergericht beabsichtigt die Gesellschaft wegen Vermögenslosigkeit aufgrund des § 394 Abs. 1 FamFG zu löschen. Frist zur Geltendmachung eines Widerspruchs: 1 Monat.\nRechtsbehelfsbelehrung:\nGegen diese Verfügung können Sie Widerspruch einlegen.\nDer Widerspruch ist bei dem Amtsgericht Neuss - Registergericht -, Breite Str. 48, 41460 Neuss schriftlich in deutscher Sprache oder zur Niederschrift der Geschäftsstelle einzulegen.\nDer Widerspruch kann auch zur Niederschrift der Geschäftsstelle eines jeden Amtsgerichtes abgegeben werden.\nDie Einlegung ist auch durch Übertragung eines elektronischen Dokuments an die elektronische Poststelle des Gerichts möglich. Das elektronische Dokument muss für die Bearbeitung durch das Gericht geeignet und mit einer qualifizierten elektronischen Signatur der verantwortenden Person versehen sein oder von der verantwortenden Person signiert und auf einem sicheren Übermittlungsweg gemäß § 130a ZPO nach näherer Maßgabe der Verordnung über die technischen Rahmenbedingungen des elektronischen Rechtsverkehrs und über das besondere elektronische Behördenpostfach (BGBl. I, S.3803) eingereicht werden. Weitere Informationen erhalten Sie auf der Internetseite www.justiz.de.\nDer Widerspruch muss spätestens innerhalb der gesetzten Frist nach der schriftlichen Bekanntgabe der Verfügung bei dem Amtsgericht - Registergericht - Neuss eingegangen sein. Dies gilt auch dann, wenn der Widerspruch zur Niederschrift der Geschäftsstelle eines anderen Amtsgerichtes abgegeben wurde. Die Frist beginnt mit der schriftlichen Bekanntgabe der Verfügung. Die Bekanntgabe ist entweder durch Zustellung oder am dritten Tage nach Aufgabe zur Post bewirkt. Fällt das Ende der Frist auf einen Sonntag, einen allgemeinen Feiertag oder Sonnabend, so endet die Frist mit Ablauf des nächsten Werktages.\nDer Widerspruch muss die Bezeichnung der angefochtenen Verfügung sowie die Erklärung enthalten, dass Widerspruch gegen diese Verfügung eingelegt wird. Er ist zu unterzeichnen und soll begründet werden."
    },
    {
      "date": "2025-10-16",
      "id": "134272",
      "original_text": "Löschungsankündigung\nNordrhein-Westfalen Amtsgericht Neuss HRB 21243\nTropicoolio UG (haftungsbeschränkt) – Meerbusch",
      "type": "Löschungsankündigung",
      "state": "Nordrhein-Westfalen",
      "amtsgericht": "Amtsgericht Neuss",
      "registernummer": "HRB 21243",
      "registerart": "HRB",
      "company_name": "Tropicoolio UG (haftungsbeschränkt)",
      "company_seat": "Meerbusch",
      "details": "16.10.2025 (Bekanntmachungsdatum)\n\nNordrhein-Westfalen Amtsgericht Neuss HRB 21243\nLöschungsankündigung 15.10.2025 (Eintragungsdatum)\n\nTropicoolio UG (haftungsbeschränkt)\nGesellschaft mit beschränkter Haftung\nMeerbusch\n\nDas Registergericht beabsichtigt die Gesellschaft wegen Vermögenslosigkeit aufgrund des § 394 Abs. 1 FamFG zu löschen. Frist zur Geltendmachung eines Widerspruchs: 1 Monat.\nRechtsbehelfsbelehrung:\nGegen diese Verfügung können Sie Widerspruch einlegen.\nDer Widerspruch ist bei dem Amtsgericht Neuss - Registergericht -, Breite Str. 48, 41460 Neuss schriftlich in deutscher Sprache oder zur Niederschrift der Geschäftsstelle einzulegen.\nDer Widerspruch kann auch zur Niederschrift der Geschäftsstelle eines jeden Amtsgerichtes abgegeben werden.\nDie Einlegung ist auch durch Übertragung eines elektronischen Dokuments an die elektronische Poststelle des Gerichts möglich. Das elektronische Dokument muss für die Bearbeitung durch das Gericht geeignet und mit einer qualifizierten elektronischen Signatur der verantwortenden Person versehen sein oder von der verantwortenden Person signiert und auf einem sicheren Übermittlungsweg gemäß § 130a ZPO nach näherer Maßgabe der Verordnung über die technischen Rahmenbedingungen des elektronischen Rechtsverkehrs und über das besondere elektronische Behördenpostfach (BGBl. I, S.3803) eingereicht werden. Weitere Informationen erhalten Sie auf der Internetseite www.justiz.de.\nDer Widerspruch muss spätestens innerhalb der gesetzten Frist nach der schriftlichen Bekanntgabe der Verfügung bei dem Amtsgericht - Registergericht - Neuss eingegangen sein. Dies gilt auch dann, wenn der Widerspruch zur Niederschrift der Geschäftsstelle eines anderen Amtsgerichtes abgegeben wurde. Die Frist beginnt mit der schriftlichen Bekanntgabe der Verfügung. Die Bekanntgabe ist entweder durch Zustellung oder am dritten Tage nach Aufgabe zur Post bewirkt. Fällt das Ende der Frist auf einen Sonntag, einen allgemeinen Feiertag oder Sonnabend, so endet die Frist mit Ablauf des nächsten Werktages.\nDer Widerspruch muss die Bezeichnung der angefochtenen Verfügung sowie die Erklärung enthalten, dass Widerspruch gegen diese Verfügung eingelegt wird. Er ist zu unterzeichnen und soll begründet werden."
    },
    {
      "date": "2025-10-16",
      "id": "134273",
      "original_text": "Löschungsankündigung\nNordrhein-Westfalen Amtsgericht Essen HRB 32230\nHERJUSA SERVICE GmbH – Essen",
      "type": "Löschungsankündigung",
      "state": "Nordrhein-Westfalen",
      "amtsgericht": "Amtsgericht Essen",
      "registernummer": "HRB 32230",
      "registerart": "HRB",
      "company_name": "HERJUSA SERVICE GmbH",
      "company_seat": "Essen",
      "details": "16.10.2025 (Bekanntmachungsdatum)\n\nNordrhein-Westfalen Amtsgericht Essen HRB 32230\nLöschungsankündigung\n\nHERJUSA SERVICE GmbH\nGesellschaft mit beschränkter Haftung\nEssen\n\nDas Registergericht beabsichtigt die Gesellschaft von Amts wegen nach § 394 FamFG zu löschen. Die Frist zur Erhebung eines Widerspruchs ist auf einen Monat festgesetzt."
    },
    {
      "date": "2025-10-16",
      "id": "134274",
      "original_text": "Löschungsankündigung\nNordrhein-Westfalen Amtsgericht Bad Oeynhausen HRB 5729\nViehvermarktungs GmbH im Raum Minden-Ravensberg- Lippe – Herford",
      "type": "Löschungsankündigung",
      "state": "Nordrhein-Westfalen",
      "amtsgericht": "Amtsgericht Bad Oeynhausen",
      "registernummer": "HRB 5729",
      "registerart": "HRB",
      "company_name": "Viehvermarktungs GmbH im Raum Minden-Ravensberg- Lippe",
      "company_seat": "Herford",
      "details": "16.10.2025 (Bekanntmachungsdatum)\n\nNordrhein-Westfalen Amtsgericht Bad Oeynhausen HRB 5729\nLöschungsankündigung\n\nViehvermarktungs GmbH im Raum Minden-Ravensberg- Lippe\nGesellschaft mit beschränkter Haftung\nHerford\n\nDas Registergericht beabsichtigt die Gesellschaft von Amts wegen nach § 394 FamFG zu löschen. Die Frist zur Erhebung eines Widerspruchs ist auf einen Monat festgesetzt."
    },
    {
      "date": "2025-10-16",
      "id": "134275",
      "original_text": "Registerbekanntmachung nach dem Umwandlungsgesetz\nNordrhein-Westfalen Amtsgericht Dortmund HRB 37678\nF & A Automobile GmbH – Lünen",
      "type": "Registerbekanntmachung nach dem Umwandlungsgesetz",
      "state": "Nordrhein-Westfalen",
      "amtsgericht": "Amtsgericht Dortmund",
      "registernummer": "HRB 37678",
      "registerart": "HRB",
      "company_name": "F & A Automobile GmbH",
      "company_seat": "Lünen",
      "details": "16.10.2025 (Bekanntmachungsdatum)\n\nNordrhein-Westfalen Amtsgericht Dortmund HRB 37678\nRegisterbekanntmachung nach dem Umwandlungsgesetz 16.10.2025 (Eintragungsdatum)\n\nF & A Automobile GmbH\nGesellschaft mit beschränkter Haftung\nLünen\n\nDen Gläubigern der an der formwechselnden Umwandlung beteiligten Rechtsträger ist, wenn sie binnen sechs Monaten nach dem Tag, an dem die Eintragung der formwechselnden Umwandlung in das Register des Sitzes derjenigen Rechtsträger deren Gläubiger sie sind, nach § 19 Absatz 3 UmwG als bekanntgemacht gilt, ihren Anspruch nach Grund und Höhe schriftlich anmelden, Sicherheit zu leisten, soweit sie nicht Befriedigung verlangen können. Dieses Recht steht den Gläubigern jedoch nur zu, wenn sie glaubhaft machen, dass durch die formwechselnden Umwandlung die Erfüllung ihrer Forderung gefährdet wird."
    },
    {
      "date": "2025-10-16",
      "id": "134276",
      "original_text": "Registerbekanntmachung nach dem Umwandlungsgesetz\nNordrhein-Westfalen Amtsgericht Düsseldorf HRB 93474\nConnex Grundvermögen XV GmbH – Monheim am Rhein",
      "type": "Registerbekanntmachung nach dem Umwandlungsgesetz",
      "state": "Nordrhein-Westfalen",
      "amtsgericht": "Amtsgericht Düsseldorf",
      "registernummer": "HRB 93474",
      "registerart": "HRB",
      "company_name": "Connex Grundvermögen XV GmbH",
      "company_seat": "Monheim am Rhein",
      "details": "16.10.2025 (Bekanntmachungsdatum)\n\nNordrhein-Westfalen Amtsgericht Düsseldorf HRB 93474\nRegisterbekanntmachung nach dem Umwandlungsgesetz 16.10.2025 (Eintragungsdatum)\n\nConnex Grundvermögen XV GmbH\nGesellschaft mit beschränkter Haftung\nMonheim am Rhein\n\nDen Gläubigern der an der Verschmelzung beteiligten Rechtsträger ist, wenn sie binnen sechs Monaten nach dem Tag, an dem die Eintragung der Verschmelzung in das Register des Sitzes desjenigen Rechtsträgers, dessen Gläubiger sie sind, nach § 19 Absatz 3 UmwG als bekanntgemacht gilt, ihren Anspruch nach Grund und Höhe schriftlich anmelden, Sicherheit zu leisten, soweit sie nicht Befriedigung verlangen können. Dieses Recht steht den Gläubigern jedoch nur zu, wenn sie glaubhaft machen, dass durch die Verschmelzung die Erfüllung ihrer Forderung gefährdet wird."
    },
    {
      "date": "2025-10-16",
      "id": "134277",
      "original_text": "Registerbekanntmachung nach dem Umwandlungsgesetz\nNordrhein-Westfalen Amtsgericht Essen PR 1206\ndhs CONCEPTAX Siekmann, Janell und Partner mbB Wirtschaftsprüfer Steuerberater Rechtsanwalt – Herford",
      "type": "Registerbekanntmachung nach dem Umwandlungsgesetz",
      "state": "Nordrhein-Westfalen",
      "amtsgericht": "Amtsgericht Essen",
      "registernummer": "PR 1206",
      "registerart": "PR",
      "company_name": "dhs CONCEPTAX Siekmann, Janell und Partner mbB Wirtschaftsprüfer Steuerberater Rechtsanwalt",
      "company_seat": "Herford",
      "details": "16.10.2025 (Bekanntmachungsdatum)\n\nNordrhein-Westfalen Amtsgericht Essen PR 1206\nRegisterbekanntmachung nach dem Umwandlungsgesetz 16.10.2025 (Eintragungsdatum)\n\ndhs CONCEPTAX Siekmann, Janell und Partner mbB Wirtschaftsprüfer Steuerberater Rechtsanwalt\nPartnerschaftsgesellschaft\nHerford\n\nDen Gläubigern der an der Verschmelzung beteiligten Rechtsträger ist, wenn sie binnen sechs Monaten nach dem Tag, an dem die Eintragung der Verschmelzung in das Register des Sitzes desjenigen Rechtsträgers, dessen Gläubiger sie sind, nach § 19 Absatz 3 UmwG als bekanntgemacht gilt, ihren Anspruch nach Grund und Höhe schriftlich anmelden, Sicherheit zu leisten, soweit sie nicht Befriedigung verlangen können. Dieses Recht steht den Gläubigern jedoch nur zu, wenn sie glaubhaft machen, dass durch die Verschmelzung die Erfüllung ihrer Forderung gefährdet wird."
    },
    {
      "date": "2025-10-16",
      "id": "134278",
      "original_text": "Registerbekanntmachung nach dem Umwandlungsgesetz\nNordrhein-Westfalen Amtsgericht Münster HRB 8377\nR. Kaschwig Schallschutztechnik GmbH – Sendenhorst",
      "type": "Registerbekanntmachung nach dem Umwandlungsgesetz",
      "state": "Nordrhein-Westfalen",
      "amtsgericht": "Amtsgericht Münster",
      "registernummer": "HRB 8377",
      "registerart": "HRB",
      "company_name": "R. Kaschwig Schallschutztechnik GmbH",
      "company_seat": "Sendenhorst",
      "details": "16.10.2025 (Bekanntmachungsdatum)\n\nNordrhein-Westfalen Amtsgericht Münster HRB 8377\nRegisterbekanntmachung nach dem Umwandlungsgesetz 16.10.2025 (Eintragungsdatum)\n\nR. Kaschwig Schallschutztechnik GmbH\nGesellschaft mit beschränkter Haftung\nSendenhorst\n\nDen Gläubigern der an der Verschmelzung beteiligten Rechtsträger ist, wenn sie binnen sechs Monaten nach dem Tag, an dem die Eintragung der Verschmelzung in das Register des Sitzes desjenigen Rechtsträgers, dessen Gläubiger sie sind, nach § 19 Absatz 3 UmwG als bekanntgemacht gilt, ihren Anspruch nach Grund und Höhe schriftlich anmelden, Sicherheit zu leisten, soweit sie nicht Befriedigung verlangen können. Dieses Recht steht den Gläubigern jedoch nur zu, wenn sie glaubhaft machen, dass durch die Verschmelzung die Erfüllung ihrer Forderung gefährdet wird."
    },
    {
      "date": "2025-10-16",
      "id": "134279",
      "original_text": "Löschungsankündigung\nNordrhein-Westfalen Amtsgericht Hamm HRB 8302\nMontagen Hahne UG (haftungsbeschränkt) – Bönen",
      "type": "Löschungsankündigung",
      "state": "Nordrhein-Westfalen",
      "amtsgericht": "Amtsgericht Hamm",
      "registernummer": "HRB 8302",
      "registerart": "HRB",
      "company_name": "Montagen Hahne UG (haftungsbeschränkt)",
      "company_seat": "Bönen",
      "details": "16.10.2025 (Bekanntmachungsdatum)\n\nNordrhein-Westfalen Amtsgericht Hamm HRB 8302\nLöschungsankündigung\n\nMontagen Hahne UG (haftungsbeschränkt)\nGesellschaft mit beschränkter Haftung\nBönen\n\nDas Registergericht beabsichtigt die Gesellschaft von Amts wegen nach § 394 FamFG zu löschen. Die Frist zur Erhebung eines Widerspruchs ist auf drei Monate festgesetzt."
    },
    {
      "date": "2025-10-16",
      "id": "134280",
      "original_text": "Löschungsankündigung\nNordrhein-Westfalen Amtsgericht Düsseldorf HRB 98416\nN&G UG (haftungsbeschränkt) – Düsseldorf",
      "type": "Löschungsankündigung",
      "state": "Nordrhein-Westfalen",
      "amtsgericht": "Amtsgericht Düsseldorf",
      "registernummer": "HRB 98416",
      "registerart": "HRB",
      "company_name": "N&G UG (haftungsbeschränkt)",
      "company_seat": "Düsseldorf",
      "details": "16.10.2025 (Bekanntmachungsdatum)\n\nNordrhein-Westfalen Amtsgericht Düsseldorf HRB 98416\nLöschungsankündigung\n\nN&G UG (haftungsbeschränkt)\nGesellschaft mit beschränkter Haftung\nDüsseldorf\n\nDas Registergericht beabsichtigt die Gesellschaft von Amts wegen nach § 394 Abs. 1 FamFG zu löschen. Die Frist zur Erhebung eines Widerspruchs ist auf 1 Monat festgesetzt.\n\nRechtsbehelfsbelehrung:\nDas Widerspruchsrecht steht jedem zu, der an der Unterlassung der Löschung ein berechtigtes Interesse hat. Der Widerspruch ist bei dem Amtsgericht Düsseldorf -Registergericht-, Werdener Straße 1, 40227 Düsseldorf schriftlich in deutscher Sprache oder zur Niederschrift der Geschäftsstelle einzulegen. Der Widerspruch kann auch zur Niederschrift der Geschäftsstelle eines jeden Amtsgerichtes abgegeben werden. Die Einlegung ist auch durch Übertragung eines elektronischen Dokuments an die elektronische Poststelle des Gerichts möglich. Das elektronische Dokument muss für die Bearbeitung durch das Gericht geeignet und mit einer qualifizierten elektronischen Signatur der verantwortenden Person versehen sein oder von der verantwortenden Person signiert und auf einem sicheren Übermittlungsweg gemäß § 130a ZPO nach näherer Maßgabe der Verordnung über die technischen Rahmenbedingungen des elektronischen Rechtsverkehrs und über das besondere elektronische Behördenpostfach (BGBl. I, S.3803) eingereicht werden. Weitere Informationen erhalten Sie auf der Internetseite www.justiz.de.\nDer Widerspruch muss spätestens innerhalb der gesetzten Frist nach dem Datum der Bekanntmachung der Löschungsankündigung bei dem Amtsgericht - Registergericht - Düsseldorf eingegangen sein.  Dies gilt auch dann, wenn der Widerspruch zur Niederschrift der Geschäftsstelle eines anderen Amtsgerichtes abgegeben wurde. Die Frist beginnt mit dem Tage der Bekanntmachung der Löschungsankündigung in dem für die Bekanntmachung der Eintragungen in das Handelsregister bestimmten elektronischen Informations- und Kommunikationssystem nach § 10 des Handelsgesetzbuches. Fällt das Ende der Frist auf einen Sonntag, einen allgemeinen Feiertag oder Sonnabend, so endet die Frist mit Ablauf des nächsten Werktages.\nDer Widerspruch muss die Bezeichnung der angefochtenen Löschungsankündigung sowie die Erklärung enthalten, dass Widerspruch gegen diese Löschungsankündigung eingelegt wird. Er ist zu unterzeichnen und soll begründet werden."
    },
    {
      "date": "2025-10-16",
      "id": "134281",
      "original_text": "Registerbekanntmachung nach dem Umwandlungsgesetz\nNordrhein-Westfalen Amtsgericht Bielefeld HRA 17436\nMatic Transporte GmbH & Co. KG – Bielefeld",
      "type": "Registerbekanntmachung nach dem Umwandlungsgesetz",
      "state": "Nordrhein-Westfalen",
      "amtsgericht": "Amtsgericht Bielefeld",
      "registernummer": "HRA 17436",
      "registerart": "HRA",
      "company_name": "Matic Transporte GmbH & Co. KG",
      "company_seat": "Bielefeld",
      "details": "16.10.2025 (Bekanntmachungsdatum)\n\nNordrhein-Westfalen Amtsgericht Bielefeld HRA 17436\nRegisterbekanntmachung nach dem Umwandlungsgesetz\n\nMatic Transporte GmbH & Co. KG\nKommanditgesellschaft\nBielefeld\n\nDen Gläubigern der an der Ausgliederung beteiligten Rechtsträger ist, wenn sie binnen sechs Monaten nach dem Tag, an dem die Eintragung der Ausgliederung in das Register des Sitzes desjenigen Rechtsträgers, dessen Gläubiger sie sind, nach § 19 Absatz 3 UmwG als bekanntgemacht gilt, ihren Anspruch nach Grund und Höhe schriftlich anmelden, Sicherheit zu leisten, soweit sie nicht Befriedigung verlangen können. Dieses Recht steht den Gläubigern jedoch nur zu, wenn sie glaubhaft machen, dass durch die Ausgliederung die Erfüllung ihrer Forderung gefährdet wird."
    },
    {
      "date": "2025-10-16",
      "id": "134282",
      "original_text": "Registerbekanntmachung nach dem Umwandlungsgesetz\nNordrhein-Westfalen Amtsgericht Arnsberg HRA 9358\nBarroso GmbH & Co. KG – Bad Sassendorf",
      "type": "Registerbekanntmachung nach dem Umwandlungsgesetz",
      "state": "Nordrhein-Westfalen",
      "amtsgericht": "Amtsgericht Arnsberg",
      "registernummer": "HRA 9358",
      "registerart": "HRA",
      "company_name": "Barroso GmbH & Co. KG",
      "company_seat": "Bad Sassendorf",
      "details": "16.10.2025 (Bekanntmachungsdatum)\n\nNordrhein-Westfalen Amtsgericht Arnsberg HRA 9358\nRegisterbekanntmachung nach dem Umwandlungsgesetz 16.10.2025 (Eintragungsdatum)\n\nBarroso GmbH & Co. KG\nKommanditgesellschaft\nBad Sassendorf\n\nDen Gläubigern der an der Ausgliederung beteiligten Rechtsträger ist, wenn sie binnen sechs Monaten nach dem Tag, an dem die Eintragung der Ausgliederung in das Register des Sitzes derjenigen Rechtsträger deren Gläubiger sie sind, nach § 19 Absatz 3 UmwG als bekanntgemacht gilt, ihren Anspruch nach Grund und Höhe schriftlich anmelden, Sicherheit zu leisten, soweit sie nicht Befriedigung verlangen können. Dieses Recht steht den Gläubigern jedoch nur zu, wenn sie glaubhaft machen, dass durch die Ausgliederung die Erfüllung ihrer Forderung gefährdet wird."
    },
    {
      "date": "2025-10-16",
      "id": "134283",
      "original_text": "Löschungsankündigung\nNordrhein-Westfalen Amtsgericht Wuppertal HRB 29531\nExposcale Messebautechnik GmbH – Solingen",
      "type": "Löschungsankündigung",
      "state": "Nordrhein-Westfalen",
      "amtsgericht": "Amtsgericht Wuppertal",
      "registernummer": "HRB 29531",
      "registerart": "HRB",
      "company_name": "Exposcale Messebautechnik GmbH",
      "company_seat": "Solingen",
      "details": "16.10.2025 (Bekanntmachungsdatum)\n\nNordrhein-Westfalen Amtsgericht Wuppertal HRB 29531\nLöschungsankündigung 15.10.2025 (Eintragungsdatum)\n\nExposcale Messebautechnik GmbH\nGesellschaft mit beschränkter Haftung\nSolingen\n\nDas Registergericht beabsichtigt die Gesellschaft von Amts wegen nach § 394 FamFG zu löschen. Die Frist zur Erhebung eines Widerspruchs ist auf einen Monat festgesetzt."
    },
    {
      "date": "2025-10-16",
      "id": "134284",
      "original_text": "Registerbekanntmachung nach dem Umwandlungsgesetz\nNordrhein-Westfalen Amtsgericht Lemgo HRA 6142\nTechniplas PD GmbH & Co. KG – Bad Salzuflen",
      "type": "Registerbekanntmachung nach dem Umwandlungsgesetz",
      "state": "Nordrhein-Westfalen",
      "amtsgericht": "Amtsgericht Lemgo",
      "registernummer": "HRA 6142",
      "registerart": "HRA",
      "company_name": "Techniplas PD GmbH & Co. KG",
      "company_seat": "Bad Salzuflen",
      "details": "16.10.2025 (Bekanntmachungsdatum)\n\nNordrhein-Westfalen Amtsgericht Lemgo HRA 6142\nRegisterbekanntmachung nach dem Umwandlungsgesetz 16.10.2025 (Eintragungsdatum)\n\nTechniplas PD GmbH & Co. KG\nKommanditgesellschaft\nBad Salzuflen\n\nDen Gläubigern der an der Verschmelzung beteiligten Rechtsträger ist, wenn sie binnen sechs Monaten nach dem Tag, an dem die Eintragung der Verschmelzung in das Register des Sitzes desjenigen Rechtsträgers, dessen Gläubiger sie sind, nach § 19 Absatz 3 UmwG als bekanntgemacht gilt, ihren Anspruch nach Grund und Höhe schriftlich anmelden, Sicherheit zu leisten, soweit sie nicht Befriedigung verlangen können. Dieses Recht steht den Gläubigern jedoch nur zu, wenn sie glaubhaft machen, dass durch die Verschmelzung die Erfüllung ihrer Forderung gefährdet wird."
    },
    {
      "date": "2025-10-16",
      "id": "134285",
      "original_text": "Registerbekanntmachung nach dem Umwandlungsgesetz\nNordrhein-Westfalen Amtsgericht Gütersloh HRA 8595\nJan Hartkämper e.K. – Gütersloh",
      "type": "Registerbekanntmachung nach dem Umwandlungsgesetz",
      "state": "Nordrhein-Westfalen",
      "amtsgericht": "Amtsgericht Gütersloh",
      "registernummer": "HRA 8595",
      "registerart": "HRA",
      "company_name": "Jan Hartkämper e.K.",
      "company_seat": "Gütersloh",
      "details": "16.10.2025 (Bekanntmachungsdatum)\n\nNordrhein-Westfalen Amtsgericht Gütersloh HRA 8595\nRegisterbekanntmachung nach dem Umwandlungsgesetz 16.10.2025 (Eintragungsdatum)\n\nJan Hartkämper e.K.\nEinzelkaufmann / Einzelkauffrau\nGütersloh\n\nDen Gläubigern der an der Ausgliederung beteiligten Rechtsträger ist, wenn sie binnen sechs Monaten nach dem Tag, an dem die Eintragung der Ausgliederung in das Register des Sitzes desjenigen Rechtsträgers, dessen Gläubiger sie sind, nach § 19 Absatz 3 UmwG als bekanntgemacht gilt, ihren Anspruch nach Grund und Höhe schriftlich anmelden, Sicherheit zu leisten, soweit sie nicht Befriedigung verlangen können. Dieses Recht steht den Gläubigern jedoch nur zu, wenn sie glaubhaft machen, dass durch die Ausgliederung die Erfüllung ihrer Forderung gefährdet wird."
    },
    {
      "date": "2025-10-16",
      "id": "134286",
      "original_text": "Löschungsankündigung\nNordrhein-Westfalen Amtsgericht Dortmund HRB 18026 früher Amtsgericht Lünen\nDiemers Verwaltungsgesellschaft mit beschränkter Haftung – Lünen",
      "type": "Löschungsankündigung",
      "state": "Nordrhein-Westfalen",
      "amtsgericht": "Amtsgericht Dortmund",
      "registernummer": "HRB 18026",
      "registerart": "HRB",
      "company_name": "Diemers Verwaltungsgesellschaft mit beschränkter Haftung",
      "company_seat": "Lünen",
      "former_amtsgericht": "Lünen",
      "details": "16.10.2025 (Bekanntmachungsdatum)\n\nNordrhein-Westfalen Amtsgericht Dortmund HRB 18026 früher Amtsgericht Lünen\nLöschungsankündigung\n\nDiemers Verwaltungsgesellschaft mit beschränkter Haftung\nGesellschaft mit beschränkter Haftung\nLünen\n\nDas Registergericht beabsichtigt die Gesellschaft von Amts wegen nach § 394 FamFG zu löschen. Die Frist zur Erhebung eines Widerspruchs ist auf zwei Monate festgesetzt."
    },
    {
      "date": "2025-10-16",
      "id": "134287",
      "original_text": "Einreichung neuer Dokumente\nNordrhein-Westfalen Amtsgericht Mönchengladbach HRB 17791\nAUNDE Group SE – Mönchengladbach",
      "type": "Einreichung neuer Dokumente",
      "state": "Nordrhein-Westfalen",
      "amtsgericht": "Amtsgericht Mönchengladbach",
      "registernummer": "HRB 17791",
      "registerart": "HRB",
      "company_name": "AUNDE Group SE",
      "company_seat": "Mönchengladbach",
      "details": "16.10.2025 (Bekanntmachungsdatum)\n\nNordrhein-Westfalen Amtsgericht Mönchengladbach HRB 17791\nEinreichung neuer Dokumente\n\nAUNDE Group SE\nEuropäische Aktiengesellschaft (SE)\nMönchengladbach\n\nDem Registergericht ist eine neue Liste der Mitglieder des Verwaltungsrates eingereicht worden."
    },
    {
      "date": "2025-10-16",
      "id": "134288",
      "original_text": "Registerbekanntmachung nach dem Umwandlungsgesetz\nNordrhein-Westfalen Amtsgericht Iserlohn HRB 1802\nLobbe Deutschland Geschäftsführung GmbH – Iserlohn",
      "type": "Registerbekanntmachung nach dem Umwandlungsgesetz",
      "state": "Nordrhein-Westfalen",
      "amtsgericht": "Amtsgericht Iserlohn",
      "registernummer": "HRB 1802",
      "registerart": "HRB",
      "company_name": "Lobbe Deutschland Geschäftsführung GmbH",
      "company_seat": "Iserlohn",
      "details": "16.10.2025 (Bekanntmachungsdatum)\n\nNordrhein-Westfalen Amtsgericht Iserlohn HRB 1802\nRegisterbekanntmachung nach dem Umwandlungsgesetz 14.10.2025 (Eintragungsdatum)\n\nLobbe Deutschland Geschäftsführung GmbH\nGesellschaft mit beschränkter Haftung\nIserlohn\n\nDen Gläubigern der an der grenzüberschreitenden Verschmelzung beteiligten übernehmenden Rechtsträger ist, wenn sie binnen sechs Monaten nach dem Tag, an dem die Eintragung der Spaltung in das Register des Sitzes desjenigen Rechtsträgers, dessen Gläubiger sie sind, nach § 19 Absatz 3 UmwG als bekanntgemacht gilt, ihren Anspruch nach Grund und Höhe in Textform anmelden, Sicherheit zu leisten, soweit sie nicht Befriedigung verlangen können.\n\nDieses Recht steht den Gläubigern jedoch nur zu, wenn sie glaubhaft machen, dass durch die Spaltung die Erfüllung ihrer Forderung gefährdet wird."
    },
    {
      "date": "2025-10-16",
      "id": "134289",
      "original_text": "Einreichung neuer Dokumente\nThüringen Amtsgericht Jena HRB 109791\nErfurt Tourismus und Marketing GmbH – Erfurt",
      "type": "Einreichung neuer Dokumente",
      "state": "Thüringen",
      "amtsgericht": "Amtsgericht Jena",
      "registernummer": "HRB 109791",
      "registerart": "HRB",
      "company_name": "Erfurt Tourismus und Marketing GmbH",
      "company_seat": "Erfurt",
      "details": "16.10.2025 (Bekanntmachungsdatum)\n\nThüringen Amtsgericht Jena HRB 109791\nEinreichung neuer Dokumente\n\nErfurt Tourismus und Marketing GmbH\nGesellschaft mit beschränkter Haftung\nErfurt\n\nBekanntmachung gem. § 52 Abs. 3 Satz 2 GmbHG: Aufgrund einer Veränderung in den Personen der Aufsichtsratsmitglieder ist durch die Geschäftsführer eine neue Liste zum Handelsregister eingereicht worden."
    },
    {
      "date": "2025-10-16",
      "id": "134290",
      "original_text": "Löschungsankündigung\nHessen Amtsgericht Wiesbaden HRB 26326\nVIROSCREEN & VIROFEM diagnostics GmbH – Wiesbaden",
      "type": "Löschungsankündigung",
      "state": "Hessen",
      "amtsgericht": "Amtsgericht Wiesbaden",
      "registernummer": "HRB 26326",
      "registerart": "HRB",
      "company_name": "VIROSCREEN & VIROFEM diagnostics GmbH",
      "company_seat": "Wiesbaden",
      "details": "16.10.2025 (Bekanntmachungsdatum)\n\nHessen Amtsgericht Wiesbaden HRB 26326\nLöschungsankündigung\n\nVIROSCREEN & VIROFEM diagnostics GmbH\nGesellschaft mit beschränkter Haftung\nWiesbaden\n\nDas Registergericht beabsichtigt die im Handelsregister eingetragene Gesellschaft von Amts wegen nach § 394 FamFG zu löschen. Die Frist zur Erhebung eines Widerspruchs gegen die beabsichtigte Löschung wird auf 3 Monate festgesetzt."
    },
    {
      "date": "2025-10-16",
      "id": "134291",
      "original_text": "Löschungsankündigung\nHessen Amtsgericht Frankfurt am Main HRB 94988\nakson electric GmbH – Frankfurt am Main",
      "type": "Löschungsankündigung",
      "state": "Hessen",
      "amtsgericht": "Amtsgericht Frankfurt am Main",
      "registernummer": "HRB 94988",
      "registerart": "HRB",
      "company_name": "akson electric GmbH",
      "company_seat": "Frankfurt am Main",
      "details": "16.10.2025 (Bekanntmachungsdatum)\n\nHessen Amtsgericht Frankfurt am Main HRB 94988\nLöschungsankündigung\n\nakson electric GmbH\nGesellschaft mit beschränkter Haftung\nFrankfurt am Main\n\nEs ist beabsichtigt, die Gesellschaft wegen Vermögenslosigkeit gemäß § 394 FamFG von Amts wegen im Handelsregister zu löschen. Hiergegen kann innerhalb eines Monats nach dieser Veröffentlichung Widerspruch bei dem Amtsgericht Frankfurt am Main eingelegt werden."
    },
    {
      "date": "2025-10-16",
      "id": "134292",
      "original_text": "Löschungsankündigung\nHessen Amtsgericht Wiesbaden HRB 30893\nIRONIXX UG (haftungsbeschränkt) – Wiesbaden",
      "type": "Löschungsankündigung",
      "state": "Hessen",
      "amtsgericht": "Amtsgericht Wiesbaden",
      "registernummer": "HRB 30893",
      "registerart": "HRB",
      "company_name": "IRONIXX UG (haftungsbeschränkt)",
      "company_seat": "Wiesbaden",
      "details": "16.10.2025 (Bekanntmachungsdatum)\n\nHessen Amtsgericht Wiesbaden HRB 30893\nLöschungsankündigung\n\nIRONIXX UG (haftungsbeschränkt)\nGesellschaft mit beschränkter Haftung\nWiesbaden\n\nDas Registergericht beabsichtigt die im Handelsregister eingetragene Gesellschaft von Amts wegen nach § 394 FamFG zu löschen. Die Frist zur Erhebung eines Widerspruchs gegen die beabsichtigte Löschung wird auf 3 Monate festgesetzt."
    },
    {
      "date": "2025-10-16",
      "id": "134293",
      "original_text": "Registerbekanntmachung nach dem Umwandlungsgesetz\nHessen Amtsgericht Frankfurt am Main HRB 72614\nTractebel GmbH – Bad Vilbel",
      "type": "Registerbekanntmachung nach dem Umwandlungsgesetz",
      "state": "Hessen",
      "amtsgericht": "Amtsgericht Frankfurt am Main",
      "registernummer": "HRB 72614",
      "registerart": "HRB",
      "company_name": "Tractebel GmbH",
      "company_seat": "Bad Vilbel",
      "details": "16.10.2025 (Bekanntmachungsdatum)\n\nHessen Amtsgericht Frankfurt am Main HRB 72614\nRegisterbekanntmachung nach dem Umwandlungsgesetz 16.10.2025 (Eintragungsdatum)\n\nTractebel GmbH\nGesellschaft mit beschränkter Haftung\nBad Vilbel\n\nDen Gläubigern der an der Verschmelzung beteiligten Rechtsträger ist, wenn sie binnen sechs Monaten nach dem Tag, an dem die Eintragung der Verschmelzung in das Register des Sitzes derjenigen Rechtsträger deren Gläubiger sie sind, nach § 19 Absatz 3 UmwG bekannt gemacht worden ist, ihren Anspruch nach Grund und Höhe schriftlich anmelden, Sicherheit zu leisten, soweit sie nicht Befriedigung verlangen können. Dieses Recht steht den Gläubigern jedoch nur zu, wenn sie glaubhaft machen, dass durch die Verschmelzung die Erfüllung ihrer Forderung gefährdet wird."
    },
    {
      "date": "2025-10-16",
      "id": "134294",
      "original_text": "Registerbekanntmachung nach dem Umwandlungsgesetz\nHessen Amtsgericht Friedberg HRB 8661\nDNO-Handel GmbH – Gedern",
      "type": "Registerbekanntmachung nach dem Umwandlungsgesetz",
      "state": "Hessen",
      "amtsgericht": "Amtsgericht Friedberg",
      "registernummer": "HRB 8661",
      "registerart": "HRB",
      "company_name": "DNO-Handel GmbH",
      "company_seat": "Gedern",
      "details": "16.10.2025 (Bekanntmachungsdatum)\n\nHessen Amtsgericht Friedberg HRB 8661\nRegisterbekanntmachung nach dem Umwandlungsgesetz 16.10.2025 (Eintragungsdatum)\n\nDNO-Handel GmbH\nGesellschaft mit beschränkter Haftung\nGedern\n\nDen Gläubigern der an der Verschmelzung beteiligten Rechtsträger ist, wenn sie binnen sechs Monaten nach dem Tag, an dem die Eintragung der Verschmelzung in das Register des Sitzes desjenigen Rechtsträgers, dessen Gläubiger sie sind, nach § 19 Absatz 3 UmwG bekannt gemacht worden ist, ihren Anspruch nach Grund und Höhe schriftlich anmelden, Sicherheit zu leisten, soweit sie nicht Befriedigung verlangen können. Dieses Recht steht den Gläubigern jedoch nur zu, wenn sie glaubhaft machen, dass durch die Verschmelzung die Erfüllung ihrer Forderung gefährdet wird."
    },
    {
      "date": "2025-10-16",
      "id": "134295",
      "original_text": "Registerbekanntmachung nach dem Umwandlungsgesetz\nHessen Amtsgericht Gießen HRA 5535\nZimmerei Rausch GmbH & Co. KG – Grebenhain",
      "type": "Registerbekanntmachung nach dem Umwandlungsgesetz",
      "state": "Hessen",
      "amtsgericht": "Amtsgericht Gießen",
      "registernummer": "HRA 5535",
      "registerart": "HRA",
      "company_name": "Zimmerei Rausch GmbH & Co. KG",
      "company_seat": "Grebenhain",
      "details": "16.10.2025 (Bekanntmachungsdatum)\n\nHessen Amtsgericht Gießen HRA 5535\nRegisterbekanntmachung nach dem Umwandlungsgesetz 16.10.2025 (Eintragungsdatum)\n\nZimmerei Rausch GmbH & Co. KG\nKommanditgesellschaft\nGrebenhain\n\nDen Gläubigern der an der Ausgliederung  beteiligten Rechtsträger ist, wenn sie binnen sechs Monaten nach dem Tag, an dem die Eintragung der Ausgliederung in das Register des Sitzes desjenigen Rechtsträgers, dessen Gläubiger sie sind, nach §§ 125, 19 Absatz 3 UmwG bekannt gemacht worden ist, ihren Anspruch nach Grund und Höhe schriftlich anmelden, Sicherheit zu leisten, soweit sie nicht Befriedigung verlangen können. Dieses Recht steht den Gläubigern jedoch nur zu, wenn sie glaubhaft machen, dass durch die Ausgliederung die Erfüllung ihrer Forderung gefährdet wird."
    },
    {
      "date": "2025-10-16",
      "id": "134296",
      "original_text": "Löschungsankündigung\nHessen Amtsgericht Offenbach am Main HRB 6172\nTschatsch Verwaltungsgesellschaft mit beschränkter Haftung – Offenbach am Main",
      "type": "Löschungsankündigung",
      "state": "Hessen",
      "amtsgericht": "Amtsgericht Offenbach am Main",
      "registernummer": "HRB 6172",
      "registerart": "HRB",
      "company_name": "Tschatsch Verwaltungsgesellschaft mit beschränkter Haftung",
      "company_seat": "Offenbach am Main",
      "details": "16.10.2025 (Bekanntmachungsdatum)\n\nHessen Amtsgericht Offenbach am Main HRB 6172\nLöschungsankündigung 16.10.2025 (Eintragungsdatum)\n\nTschatsch Verwaltungsgesellschaft mit beschränkter Haftung\nGesellschaft mit beschränkter Haftung\nOffenbach am Main\n\nDas Registergericht beabsichtigt die im Handelsregister eingetragene Gesellschaft von Amts wegen nach § 394 FamFG zu löschen. Die Frist zur Erhebung eines Widerspruchs gegen die beabsichtigte Löschung wird auf 3 Monate festgesetzt."
    },
    {
      "date": "2025-10-16",
      "id": "134297",
      "original_text": "Löschungsankündigung\nHessen Amtsgericht Frankfurt am Main HRB 112346\nMT Gala-Bau UG (haftungsbeschränkt) – Frankfurt am Main",
      "type": "Löschungsankündigung",
      "state": "Hessen",
      "amtsgericht": "Amtsgericht Frankfurt am Main",
      "registernummer": "HRB 112346",
      "registerart": "HRB",
      "company_name": "MT Gala-Bau UG (haftungsbeschränkt)",
      "company_seat": "Frankfurt am Main",
      "details": "16.10.2025 (Bekanntmachungsdatum)\n\nHessen Amtsgericht Frankfurt am Main HRB 112346\nLöschungsankündigung\n\nMT Gala-Bau UG (haftungsbeschränkt)\nGesellschaft mit beschränkter Haftung\nFrankfurt am Main\n\nDas Registergericht beabsichtigt die im Handelsregister eingetragene Gesellschaft von Amts wegen nach § 394 FamFG zu löschen. Die Frist zur Erhebung eines Widerspruchs gegen die beabsichtigte Löschung wird auf 1 Monat festgesetzt."
    },
    {
      "date": "2025-10-16",
      "id": "134298",
      "original_text": "Registerbekanntmachung nach dem Umwandlungsgesetz\nHessen Amtsgericht Friedberg HRB 9613\nAtloss GmbH – Gedern",
      "type": "Registerbekanntmachung nach dem Umwandlungsgesetz",
      "state": "Hessen",
      "amtsgericht": "Amtsgericht Friedberg",
      "registernummer": "HRB 9613",
      "registerart": "HRB",
      "company_name": "Atloss GmbH",
      "company_seat": "Gedern",
      "details": "16.10.2025 (Bekanntmachungsdatum)\n\nHessen Amtsgericht Friedberg HRB 9613\nRegisterbekanntmachung nach dem Umwandlungsgesetz 16.10.2025 (Eintragungsdatum)\n\nAtloss GmbH\nGesellschaft mit beschränkter Haftung\nGedern\n\nDen Gläubigern der an der Verschmelzung beteiligten Rechtsträger ist, wenn sie binnen sechs Monaten nach dem Tag, an dem die Eintragung der Verschmelzung in das Register des Sitzes desjenigen Rechtsträgers, dessen Gläubiger sie sind, nach § 19 Absatz 3 UmwG bekannt gemacht worden ist, ihren Anspruch nach Grund und Höhe schriftlich anmelden, Sicherheit zu leisten, soweit sie nicht Befriedigung verlangen können. Dieses Recht steht den Gläubigern jedoch nur zu, wenn sie glaubhaft machen, dass durch die Verschmelzung die Erfüllung ihrer Forderung gefährdet wird."
    },
    {
      "date": "2025-10-16",
      "id": "134299",
      "original_text": "Löschungsankündigung\nHessen Amtsgericht Offenbach am Main HRB 51526\nAll-Facility-Management GmbH – Offenbach am Main",
      "type": "Löschungsankündigung",
      "state": "Hessen",
      "amtsgericht": "Amtsgericht Offenbach am Main",
      "registernummer": "HRB 51526",
      "registerart": "HRB",
      "company_name": "All-Facility-Management GmbH",
      "company_seat": "Offenbach am Main",
      "details": "16.10.2025 (Bekanntmachungsdatum)\n\nHessen Amtsgericht Offenbach am Main HRB 51526\nLöschungsankündigung 16.10.2025 (Eintragungsdatum)\n\nAll-Facility-Management GmbH\nGesellschaft mit beschränkter Haftung\nOffenbach am Main\n\nDas Registergericht beabsichtigt die im Handelsregister eingetragene Gesellschaft von Amts wegen nach § 394 FamFG zu löschen. Die Frist zur Erhebung eines Widerspruchs gegen die beabsichtigte Löschung wird auf 3 Monate festgesetzt."
    },
    {
      "date": "2025-10-16",
      "id": "134300",
      "original_text": "Löschungsankündigung\nHessen Amtsgericht Offenbach am Main HRB 4726\nKetzel - Orthopädie - Schuhtechnik GmbH – Neu-Isenburg",
      "type": "Löschungsankündigung",
      "state": "Hessen",
      "amtsgericht": "Amtsgericht Offenbach am Main",
      "registernummer": "HRB 4726",
      "registerart": "HRB",
      "company_name": "Ketzel - Orthopädie - Schuhtechnik GmbH",
      "company_seat": "Neu-Isenburg",
      "details": "16.10.2025 (Bekanntmachungsdatum)\n\nHessen Amtsgericht Offenbach am Main HRB 4726\nLöschungsankündigung 16.10.2025 (Eintragungsdatum)\n\nKetzel - Orthopädie - Schuhtechnik GmbH\nGesellschaft mit beschränkter Haftung\nNeu-Isenburg\n\nDas Registergericht beabsichtigt die im Handelsregister eingetragene Gesellschaft von Amts wegen nach § 394 FamFG zu löschen. Die Frist zur Erhebung eines Widerspruchs gegen die beabsichtigte Löschung wird auf 3 Monate festgesetzt."
    },
    {
      "date": "2025-10-16",
      "id": "134301",
      "original_text": "Löschungsankündigung\nHessen Amtsgericht Offenbach am Main HRB 54920\nRMP. Dienstleistung UG (haftungsbeschränkt) – Rödermark",
      "type": "Löschungsankündigung",
      "state": "Hessen",
      "amtsgericht": "Amtsgericht Offenbach am Main",
      "registernummer": "HRB 54920",
      "registerart": "HRB",
      "company_name": "RMP. Dienstleistung UG (haftungsbeschränkt)",
      "company_seat": "Rödermark",
      "details": "16.10.2025 (Bekanntmachungsdatum)\n\nHessen Amtsgericht Offenbach am Main HRB 54920\nLöschungsankündigung 16.10.2025 (Eintragungsdatum)\n\nRMP. Dienstleistung UG (haftungsbeschränkt)\nGesellschaft mit beschränkter Haftung\nRödermark\n\nDas Registergericht beabsichtigt die im Handelsregister eingetragene Gesellschaft von Amts wegen nach § 394 FamFG zu löschen. Die Frist zur Erhebung eines Widerspruchs gegen die beabsichtigte Löschung wird auf 3 Monate festgesetzt."
    },
    {
      "date": "2025-10-16",
      "id": "134302",
      "original_text": "Löschungsankündigung\nHessen Amtsgericht Offenbach am Main HRB 49375\nClean Team UG (haftungsbeschränkt) – Offenbach am Main",
      "type": "Löschungsankündigung",
      "state": "Hessen",
      "amtsgericht": "Amtsgericht Offenbach am Main",
      "registernummer": "HRB 49375",
      "registerart": "HRB",
      "company_name": "Clean Team UG (haftungsbeschränkt)",
      "company_seat": "Offenbach am Main",
      "details": "16.10.2025 (Bekanntmachungsdatum)\n\nHessen Amtsgericht Offenbach am Main HRB 49375\nLöschungsankündigung\n\nClean Team UG (haftungsbeschränkt)\nGesellschaft mit beschränkter Haftung\nOffenbach am Main\n\nDas Registergericht beabsichtigt die im Handelsregister eingetragene Gesellschaft von Amts wegen nach § 394 FamFG zu löschen. Die Frist zur Erhebung eines Widerspruchs gegen die beabsichtigte Löschung wird auf 3 Monate festgesetzt."
    },
    {
      "date": "2025-10-16",
      "id": "134303",
      "original_text": "Löschungsankündigung\nHessen Amtsgericht Hanau HRB 96757\nLDM Umwelttechnik UG (haftungsbeschränkt) – Maintal",
      "type": "Löschungsankündigung",
      "state": "Hessen",
      "amtsgericht": "Amtsgericht Hanau",
      "registernummer": "HRB 96757",
      "registerart": "HRB",
      "company_name": "LDM Umwelttechnik UG (haftungsbeschränkt)",
      "company_seat": "Maintal",
      "details": "16.10.2025 (Bekanntmachungsdatum)\n\nHessen Amtsgericht Hanau HRB 96757\nLöschungsankündigung\n\nLDM Umwelttechnik UG (haftungsbeschränkt)\nGesellschaft mit beschränkter Haftung\nMaintal\n\nDas Registergericht beabsichtigt die im Handelsregister eingetragene Gesellschaft von Amts wegen nach § 394 FamFG zu löschen. Die Frist zur Erhebung eines Widerspruchs gegen die beabsichtigte Löschung wird auf 3 Monate festgesetzt."
    },
    {
      "date": "2025-10-16",
      "id": "134304",
      "original_text": "Einreichung neuer Dokumente\nHessen Amtsgericht Wetzlar HRB 1025\nEnergie- und Wassergesellschaft mbH – Wetzlar",
      "type": "Einreichung neuer Dokumente",
      "state": "Hessen",
      "amtsgericht": "Amtsgericht Wetzlar",
      "registernummer": "HRB 1025",
      "registerart": "HRB",
      "company_name": "Energie- und Wassergesellschaft mbH",
      "company_seat": "Wetzlar",
      "details": "16.10.2025 (Bekanntmachungsdatum)\n\nHessen Amtsgericht Wetzlar HRB 1025\nEinreichung neuer Dokumente\n\nEnergie- und Wassergesellschaft mbH\nGesellschaft mit beschränkter Haftung\nWetzlar\n\nDurch eine Änderung in den Personen der Aufsichtsratsmitglieder ist eine Liste der Mitglieder des Aufsichtsrates zum Handelsregister eingereicht worden."
    },
    {
      "date": "2025-10-16",
      "id": "134305",
      "original_text": "Registerbekanntmachung nach dem Umwandlungsgesetz\nHessen Amtsgericht Wiesbaden HRB 8139\nFederal-Mogul Holding Deutschland GmbH – Wiesbaden",
      "type": "Registerbekanntmachung nach dem Umwandlungsgesetz",
      "state": "Hessen",
      "amtsgericht": "Amtsgericht Wiesbaden",
      "registernummer": "HRB 8139",
      "registerart": "HRB",
      "company_name": "Federal-Mogul Holding Deutschland GmbH",
      "company_seat": "Wiesbaden",
      "details": "16.10.2025 (Bekanntmachungsdatum)\n\nHessen Amtsgericht Wiesbaden HRB 8139\nRegisterbekanntmachung nach dem Umwandlungsgesetz 16.10.2025 (Eintragungsdatum)\n\nFederal-Mogul Holding Deutschland GmbH\nGesellschaft mit beschränkter Haftung\nWiesbaden\n\nDen Gläubigern der an der Verschmelzung beteiligten Rechtsträger ist, wenn sie binnen sechs Monaten nach dem Tag, an dem die Eintragung der Verschmelzung in das Register des Sitzes derjenigen Rechtsträger deren Gläubiger sie sind, nach § 19 Absatz 3 UmwG bekannt gemacht worden ist, ihren Anspruch nach Grund und Höhe schriftlich anmelden, Sicherheit zu leisten, soweit sie nicht Befriedigung verlangen können. Dieses Recht steht den Gläubigern jedoch nur zu, wenn sie glaubhaft machen, dass durch die Verschmelzung die Erfüllung ihrer Forderung gefährdet wird."
    },
    {
      "date": "2025-10-16",
      "id": "134306",
      "original_text": "Löschungsankündigung\nHessen Amtsgericht Offenbach am Main HRB 49205\nGTM Technology Europe GmbH – Neu-Isenburg",
      "type": "Löschungsankündigung",
      "state": "Hessen",
      "amtsgericht": "Amtsgericht Offenbach am Main",
      "registernummer": "HRB 49205",
      "registerart": "HRB",
      "company_name": "GTM Technology Europe GmbH",
      "company_seat": "Neu-Isenburg",
      "details": "16.10.2025 (Bekanntmachungsdatum)\n\nHessen Amtsgericht Offenbach am Main HRB 49205\nLöschungsankündigung\n\nGTM Technology Europe GmbH\nGesellschaft mit beschränkter Haftung\nNeu-Isenburg\n\nDas Registergericht beabsichtigt die im Handelsregister eingetragene Gesellschaft von Amts wegen nach § 394 FamFG zu löschen. Die Frist zur Erhebung eines Widerspruchs gegen die beabsichtigte Löschung wird auf 3 Monate festgesetzt."
    },
    {
      "date": "2025-10-16",
      "id": "134307",
      "original_text": "Löschungsankündigung\nHessen Amtsgericht Wiesbaden HRB 31447\nIBS Aktiv-Bau GmbH – Wiesbaden",
      "type": "Löschungsankündigung",
      "state": "Hessen",
      "amtsgericht": "Amtsgericht Wiesbaden",
      "registernummer": "HRB 31447",
      "registerart": "HRB",
      "company_name": "IBS Aktiv-Bau GmbH",
      "company_seat": "Wiesbaden",
      "details": "16.10.2025 (Bekanntmachungsdatum)\n\nHessen Amtsgericht Wiesbaden HRB 31447\nLöschungsankündigung\n\nIBS Aktiv-Bau GmbH\nGesellschaft mit beschränkter Haftung\nWiesbaden\n\nDas Registergericht beabsichtigt die im Handelsregister eingetragene Gesellschaft von Amts wegen nach § 394 FamFG zu löschen. Die Frist zur Erhebung eines Widerspruchs gegen die beabsichtigte Löschung wird auf 3 Monate festgesetzt."
    },
    {
      "date": "2025-10-16",
      "id": "134308",
      "original_text": "Registerbekanntmachung nach dem Umwandlungsgesetz\nHessen Amtsgericht Gießen HRA 5520\nZimmerei Thomas Rausch e.K. – Grebenhain",
      "type": "Registerbekanntmachung nach dem Umwandlungsgesetz",
      "state": "Hessen",
      "amtsgericht": "Amtsgericht Gießen",
      "registernummer": "HRA 5520",
      "registerart": "HRA",
      "company_name": "Zimmerei Thomas Rausch e.K.",
      "company_seat": "Grebenhain",
      "details": "16.10.2025 (Bekanntmachungsdatum)\n\nHessen Amtsgericht Gießen HRA 5520\nRegisterbekanntmachung nach dem Umwandlungsgesetz 16.10.2025 (Eintragungsdatum)\n\nZimmerei Thomas Rausch e.K.\nEinzelkaufmann / Einzelkauffrau\nGrebenhain\n\nDen Gläubigern der an der Ausgliederung beteiligten Rechtsträger ist, wenn sie binnen sechs Monaten nach dem Tag, an dem die Eintragung der Ausgliederung in das Register des Sitzes desjenigen Rechtsträgers, dessen Gläubiger sie sind, nach §§ 125, 19 Absatz 3 UmwG bekannt gemacht worden ist, ihren Anspruch nach Grund und Höhe schriftlich anmelden, Sicherheit zu leisten, soweit sie nicht Befriedigung verlangen können. Dieses Recht steht den Gläubigern jedoch nur zu, wenn sie glaubhaft machen, dass durch die Ausgliederung die Erfüllung ihrer Forderung gefährdet wird."
    },
    {
      "date": "2025-10-16",
      "id": "134309",
      "original_text": "Einreichung neuer Dokumente\nHessen Amtsgericht Frankfurt am Main HRB 128830\nDN Group AG – Frankfurt am Main",
      "type": "Einreichung neuer Dokumente",
      "state": "Hessen",
      "amtsgericht": "Amtsgericht Frankfurt am Main",
      "registernummer": "HRB 128830",
      "registerart": "HRB",
      "company_name": "DN Group AG",
      "company_seat": "Frankfurt am Main",
      "details": "16.10.2025 (Bekanntmachungsdatum)\n\nHessen Amtsgericht Frankfurt am Main HRB 128830\nEinreichung neuer Dokumente 16.10.2025 (Eintragungsdatum)\n\nDN Group AG\nAktiengesellschaft\nFrankfurt am Main\n\nDurch eine Änderung in den Personen der Aufsichtsratsmitglieder ist eine Liste der Mitglieder des Aufsichtsrates zum Handelsregister eingereicht worden."
    },
    {
      "date": "2025-10-16",
      "id": "134310",
      "original_text": "Einreichung neuer Dokumente\nHessen Amtsgericht Hanau HRB 13302\nQualityHosting Aktiengesellschaft – Gelnhausen",
      "type": "Einreichung neuer Dokumente",
      "state": "Hessen",
      "amtsgericht": "Amtsgericht Hanau",
      "registernummer": "HRB 13302",
      "registerart": "HRB",
      "company_name": "QualityHosting Aktiengesellschaft",
      "company_seat": "Gelnhausen",
      "details": "16.10.2025 (Bekanntmachungsdatum)\n\nHessen Amtsgericht Hanau HRB 13302\nEinreichung neuer Dokumente 16.10.2025 (Eintragungsdatum)\n\nQualityHosting Aktiengesellschaft\nAktiengesellschaft\nGelnhausen\n\nDurch eine Änderung in den Personen der Aufsichtsratsmitglieder ist eine Liste der Mitglieder des Aufsichtsrates zum Handelsregister eingereicht worden."
    }
  ]
}