{
  "date": "2025-10-07",
  "date_of_scrape": "2025-10-27T17:17:30.747Z",
  "tool_version": "0.2.0",
  "number_of_announcements": 210,
  "announcements": [
    {
      "date": "2025-10-07",
      "id": "132789",
      "original_text": "Sonstige Registerbekanntmachung\nBayern Amtsgericht München HRB 50132\nMKS Instruments Deutschland Gesellschaft mit beschränkter Haftung – München",
      "type": "Sonstige Registerbekanntmachung",
      "state": "Bayern",
      "amtsgericht": "Amtsgericht München",
      "registernummer": "HRB 50132",
      "registerart": "HRB",
      "company_name": "MKS Instruments Deutschland Gesellschaft mit beschränkter Haftung",
      "company_seat": "München",
      "details": "07.10.2025 (Bekanntmachungsdatum)\n\nBayern Amtsgericht München HRB 50132\nSonstige Registerbekanntmachung 06.10.2025 (Eintragungsdatum)\n\nMKS Instruments Deutschland Gesellschaft mit beschränkter Haftung\nGesellschaft mit beschränkter Haftung\nMünchen\n\nDen Gläubigern der Gesellschaft, deren Forderungen begründet worden sind, bevor die Eintragung der Beendigung des Beherrschungs- und Gewinnabführungsvertrages in das Handelsregister nach § 10 des Handelsgesetzbuches als bekanntgemacht gilt, hat der andere Vertragsteil Sicherheit zu leisten, wenn sie sich binnen sechs Monaten nach der Bekanntmachung der Eintragung zu diesem Zweck bei ihm melden."
    },
    {
      "date": "2025-10-07",
      "id": "132790",
      "original_text": "Registerbekanntmachung nach dem Umwandlungsgesetz\nBayern Amtsgericht Fürth VR 21100\nMittel- und Oberfränkischer Dart Verband (MOFDV) e.V. – Erlangen",
      "type": "Registerbekanntmachung nach dem Umwandlungsgesetz",
      "state": "Bayern",
      "amtsgericht": "Amtsgericht Fürth",
      "registernummer": "VR 21100",
      "registerart": "VR",
      "company_name": "Mittel- und Oberfränkischer Dart Verband (MOFDV) e.V.",
      "company_seat": "Erlangen",
      "details": "07.10.2025 (Bekanntmachungsdatum)\n\nBayern Amtsgericht Fürth VR 21100\nRegisterbekanntmachung nach dem Umwandlungsgesetz 06.10.2025 (Eintragungsdatum)\n\nMittel- und Oberfränkischer Dart Verband (MOFDV) e.V.\neingetragener Verein\nErlangen\n\nDen Gläubigern der an der Verschmelzung beteiligten Rechtsträger ist, wenn sie binnen sechs Monaten nach dem Tag, an dem die Eintragung der Verschmelzung in das Register des Sitzes desjenigen Rechtsträgers, dessen Gläubiger sie sind, nach § 19 Abs. 3 UmwG als bekannt gemacht gilt, ihren Anspruch nach Grund und Höhe in Textform anmelden, Sicherheit zu leisten, soweit sie nicht Befriedigung verlangen können. Dieses Recht steht den Gläubigern jedoch nur zu, wenn sie glaubhaft machen, dass durch die Verschmelzung die Erfüllung ihrer Forderung gefährdet wird."
    },
    {
      "date": "2025-10-07",
      "id": "132791",
      "original_text": "Registerbekanntmachung nach dem Umwandlungsgesetz\nBayern Amtsgericht Aschaffenburg HRA 6744\nGetränke Pawlik GmbH & Co. KG – Leidersbach",
      "type": "Registerbekanntmachung nach dem Umwandlungsgesetz",
      "state": "Bayern",
      "amtsgericht": "Amtsgericht Aschaffenburg",
      "registernummer": "HRA 6744",
      "registerart": "HRA",
      "company_name": "Getränke Pawlik GmbH & Co. KG",
      "company_seat": "Leidersbach",
      "details": "07.10.2025 (Bekanntmachungsdatum)\n\nBayern Amtsgericht Aschaffenburg HRA 6744\nRegisterbekanntmachung nach dem Umwandlungsgesetz 06.10.2025 (Eintragungsdatum)\n\nGetränke Pawlik GmbH & Co. KG\nKommanditgesellschaft\nLeidersbach\n\nDen Gläubigern der an der Ausgliederung beteiligten Rechtsträger ist, wenn sie binnen sechs Monaten nach dem Tag, an dem die Eintragung der Ausgliederung in das Register des Sitzes desjenigen Rechtsträgers, dessen Gläubiger sie sind, nach §§ 125, 19 Abs. 3 UmwG als bekannt gemacht gilt, ihren Anspruch nach Grund und Höhe in Textform anmelden, Sicherheit zu leisten, soweit sie nicht Befriedigung verlangen können. Dieses Recht steht den Gläubigern jedoch nur zu, wenn sie glaubhaft machen, dass durch die Ausgliederung die Erfüllung ihrer Forderung gefährdet wird."
    },
    {
      "date": "2025-10-07",
      "id": "132792",
      "original_text": "Registerbekanntmachung nach dem Umwandlungsgesetz\nBayern Amtsgericht München HRB 300693\nEnergiepark Maisach Ost GmbH – Ismaning",
      "type": "Registerbekanntmachung nach dem Umwandlungsgesetz",
      "state": "Bayern",
      "amtsgericht": "Amtsgericht München",
      "registernummer": "HRB 300693",
      "registerart": "HRB",
      "company_name": "Energiepark Maisach Ost GmbH",
      "company_seat": "Ismaning",
      "details": "07.10.2025 (Bekanntmachungsdatum)\n\nBayern Amtsgericht München HRB 300693\nRegisterbekanntmachung nach dem Umwandlungsgesetz 06.10.2025 (Eintragungsdatum)\n\nEnergiepark Maisach Ost GmbH\nGesellschaft mit beschränkter Haftung\nIsmaning\n\nDen Gläubigern der an der Verschmelzung beteiligten Rechtsträger ist, wenn sie binnen sechs Monaten nach dem Tag, an dem die Eintragung der Verschmelzung in das Register des Sitzes desjenigen Rechtsträgers, dessen Gläubiger sie sind, nach § 19 Abs. 3 UmwG als bekannt gemacht gilt, ihren Anspruch nach Grund und Höhe in Textform anmelden, Sicherheit zu leisten, soweit sie nicht Befriedigung verlangen können. Dieses Recht steht den Gläubigern jedoch nur zu, wenn sie glaubhaft machen, dass durch die Verschmelzung die Erfüllung ihrer Forderung gefährdet wird."
    },
    {
      "date": "2025-10-07",
      "id": "132793",
      "original_text": "Registerbekanntmachung nach dem Umwandlungsgesetz\nBayern Amtsgericht München HRB 303996\nBlitz 25-462 GmbH – München",
      "type": "Registerbekanntmachung nach dem Umwandlungsgesetz",
      "state": "Bayern",
      "amtsgericht": "Amtsgericht München",
      "registernummer": "HRB 303996",
      "registerart": "HRB",
      "company_name": "Blitz 25-462 GmbH",
      "company_seat": "München",
      "details": "07.10.2025 (Bekanntmachungsdatum)\n\nBayern Amtsgericht München HRB 303996\nRegisterbekanntmachung nach dem Umwandlungsgesetz 06.10.2025 (Eintragungsdatum)\n\nBlitz 25-462 GmbH\nGesellschaft mit beschränkter Haftung\nMünchen\n\nDen Gläubigern der an der Verschmelzung beteiligten Rechtsträger ist, wenn sie binnen sechs Monaten nach dem Tag, an dem die Eintragung der Verschmelzung in das Register des Sitzes desjenigen Rechtsträgers, dessen Gläubiger sie sind, nach § 19 Abs. 3 UmwG als bekannt gemacht gilt, ihren Anspruch nach Grund und Höhe in Textform anmelden, Sicherheit zu leisten, soweit sie nicht Befriedigung verlangen können. Dieses Recht steht den Gläubigern jedoch nur zu, wenn sie glaubhaft machen, dass durch die Verschmelzung die Erfüllung ihrer Forderung gefährdet wird."
    },
    {
      "date": "2025-10-07",
      "id": "132794",
      "original_text": "Löschungsankündigung\nBayern Amtsgericht Nürnberg HRB 32771\nABM Vermögensverwaltung UG (haftungsbeschränkt) – Nürnberg",
      "type": "Löschungsankündigung",
      "state": "Bayern",
      "amtsgericht": "Amtsgericht Nürnberg",
      "registernummer": "HRB 32771",
      "registerart": "HRB",
      "company_name": "ABM Vermögensverwaltung UG (haftungsbeschränkt)",
      "company_seat": "Nürnberg",
      "details": "07.10.2025 (Bekanntmachungsdatum)\n\nBayern Amtsgericht Nürnberg HRB 32771\nLöschungsankündigung\n\nABM Vermögensverwaltung UG (haftungsbeschränkt)\nGesellschaft mit beschränkter Haftung\nNürnberg\n\nDas Registergericht beabsichtigt, die im Handelsregister eingetragene Gesellschaft wegen Vermögenslosigkeit von Amts wegen nach § 394 FamFG zu löschen. Die Frist zur Erhebung eines Widerspruchs ist auf einen Monat festgesetzt."
    },
    {
      "date": "2025-10-07",
      "id": "132795",
      "original_text": "Registerbekanntmachung nach dem Umwandlungsgesetz\nBayern Amtsgericht München HRB 284553\nHEROLD Fulfillment GmbH – Oberhaching",
      "type": "Registerbekanntmachung nach dem Umwandlungsgesetz",
      "state": "Bayern",
      "amtsgericht": "Amtsgericht München",
      "registernummer": "HRB 284553",
      "registerart": "HRB",
      "company_name": "HEROLD Fulfillment GmbH",
      "company_seat": "Oberhaching",
      "details": "07.10.2025 (Bekanntmachungsdatum)\n\nBayern Amtsgericht München HRB 284553\nRegisterbekanntmachung nach dem Umwandlungsgesetz 06.10.2025 (Eintragungsdatum)\n\nHEROLD Fulfillment GmbH\nGesellschaft mit beschränkter Haftung\nOberhaching\n\nDen Gläubigern des formwechselnden Rechtsträgers ist, wenn sie binnen sechs Monaten nach dem Tag, an dem die Eintragung des Formwechsels nach § 201 UmwG als bekannt gemacht gilt, ihren Anspruch nach Grund und Höhe in Textform anmelden, Sicherheit zu leisten, soweit sie nicht Befriedigung verlangen können. Dieses Recht steht den Gläubigern jedoch nur zu, wenn sie glaubhaft machen, dass durch den Formwechsel die Erfüllung ihrer Forderung gefährdet wird."
    },
    {
      "date": "2025-10-07",
      "id": "132796",
      "original_text": "Registerbekanntmachung nach dem Umwandlungsgesetz\nBayern Amtsgericht Augsburg GnR 1255\nNeue Baugenossenschaft Lauingen-Gundelfingen eG – Lauingen (Donau)",
      "type": "Registerbekanntmachung nach dem Umwandlungsgesetz",
      "state": "Bayern",
      "amtsgericht": "Amtsgericht Augsburg",
      "registernummer": "GnR 1255",
      "registerart": "GnR",
      "company_name": "Neue Baugenossenschaft Lauingen-Gundelfingen eG",
      "company_seat": "Lauingen (Donau)",
      "details": "07.10.2025 (Bekanntmachungsdatum)\n\nBayern Amtsgericht Augsburg GnR 1255\nRegisterbekanntmachung nach dem Umwandlungsgesetz 06.10.2025 (Eintragungsdatum)\n\nNeue Baugenossenschaft Lauingen-Gundelfingen eG\neingetragene Genossenschaft\nLauingen (Donau)\n\nDen Gläubigern der an der Verschmelzung beteiligten Rechtsträger ist, wenn sie binnen sechs Monaten nach dem Tag, an dem die Eintragung der Verschmelzung in das Register des Sitzes desjenigen Rechtsträgers, dessen Gläubiger sie sind, nach § 19 Abs. 3 UmwG als bekannt gemacht gilt, ihren Anspruch nach Grund und Höhe in Textform anmelden, Sicherheit zu leisten, soweit sie nicht Befriedigung verlangen können. Dieses Recht steht den Gläubigern jedoch nur zu, wenn sie glaubhaft machen, dass durch die Verschmelzung die Erfüllung ihrer Forderung gefährdet wird."
    },
    {
      "date": "2025-10-07",
      "id": "132797",
      "original_text": "Löschungsankündigung\nBayern Amtsgericht Landshut HRB 13874\nNH Phoenix GmbH – Landshut",
      "type": "Löschungsankündigung",
      "state": "Bayern",
      "amtsgericht": "Amtsgericht Landshut",
      "registernummer": "HRB 13874",
      "registerart": "HRB",
      "company_name": "NH Phoenix GmbH",
      "company_seat": "Landshut",
      "details": "07.10.2025 (Bekanntmachungsdatum)\n\nBayern Amtsgericht Landshut HRB 13874\nLöschungsankündigung\n\nNH Phoenix GmbH\nGesellschaft mit beschränkter Haftung\nLandshut\n\nDas Registergericht beabsichtigt, die im Handelsregister eingetragene Gesellschaft wegen Vermögenslosigkeit von Amts wegen nach § 394 FamFG zu löschen. Die Frist zur Erhebung eines Widerspruchs ist auf einen Monat festgesetzt."
    },
    {
      "date": "2025-10-07",
      "id": "132798",
      "original_text": "Einreichung neuer Dokumente\nBayern Amtsgericht Weiden i. d. OPf. HRB 5991\nWINKLER Management SE – Parkstein",
      "type": "Einreichung neuer Dokumente",
      "state": "Bayern",
      "amtsgericht": "Amtsgericht Weiden i. d. OPf.",
      "registernummer": "HRB 5991",
      "registerart": "HRB",
      "company_name": "WINKLER Management SE",
      "company_seat": "Parkstein",
      "details": "07.10.2025 (Bekanntmachungsdatum)\n\nBayern Amtsgericht Weiden i. d. OPf. HRB 5991\nEinreichung neuer Dokumente\n\nWINKLER Management SE\nEuropäische Aktiengesellschaft (SE)\nParkstein\n\nDem Amtsgericht Weiden i.d.OPf. -Registergericht- ist eine Liste der Mitglieder des Aufsichtsrats eingereicht worden, Art. 9 Abs. 1 Buchst. c (ii) SE-VO i.V.m. § 106 AktG."
    },
    {
      "date": "2025-10-07",
      "id": "132799",
      "original_text": "Löschungsankündigung\nBayern Amtsgericht Nürnberg HRB 34322\nEMSware GmbH – Nürnberg",
      "type": "Löschungsankündigung",
      "state": "Bayern",
      "amtsgericht": "Amtsgericht Nürnberg",
      "registernummer": "HRB 34322",
      "registerart": "HRB",
      "company_name": "EMSware GmbH",
      "company_seat": "Nürnberg",
      "details": "07.10.2025 (Bekanntmachungsdatum)\n\nBayern Amtsgericht Nürnberg HRB 34322\nLöschungsankündigung\n\nEMSware GmbH\nGesellschaft mit beschränkter Haftung\nNürnberg\n\nDas Registergericht beabsichtigt, die im Handelsregister eingetragene Gesellschaft wegen Vermögenslosigkeit von Amts wegen nach § 394 FamFG zu löschen. Die Frist zur Erhebung eines Widerspruchs ist auf einen Monat festgesetzt."
    },
    {
      "date": "2025-10-07",
      "id": "132800",
      "original_text": "Registerbekanntmachung nach dem Umwandlungsgesetz\nBayern Amtsgericht München HRA 76866\nVolz Vermögens Verwaltung GmbH & Co KG – Forstinning",
      "type": "Registerbekanntmachung nach dem Umwandlungsgesetz",
      "state": "Bayern",
      "amtsgericht": "Amtsgericht München",
      "registernummer": "HRA 76866",
      "registerart": "HRA",
      "company_name": "Volz Vermögens Verwaltung GmbH & Co KG",
      "company_seat": "Forstinning",
      "details": "07.10.2025 (Bekanntmachungsdatum)\n\nBayern Amtsgericht München HRA 76866\nRegisterbekanntmachung nach dem Umwandlungsgesetz 06.10.2025 (Eintragungsdatum)\n\nVolz Vermögens Verwaltung GmbH & Co KG\nKommanditgesellschaft\nForstinning\n\nDen Gläubigern des formwechselnden Rechtsträgers ist, wenn sie binnen sechs Monaten nach dem Tag, an dem die Eintragung des Formwechsels nach § 201 UmwG als bekannt gemacht gilt, ihren Anspruch nach Grund und Höhe in Textform anmelden, Sicherheit zu leisten, soweit sie nicht Befriedigung verlangen können. Dieses Recht steht den Gläubigern jedoch nur zu, wenn sie glaubhaft machen, dass durch den Formwechsel die Erfüllung ihrer Forderung gefährdet wird."
    },
    {
      "date": "2025-10-07",
      "id": "132801",
      "original_text": "Einreichung neuer Dokumente\nBayern Amtsgericht Traunstein HRB 18573\nDyneon GmbH – Burgkirchen a.d.Alz",
      "type": "Einreichung neuer Dokumente",
      "state": "Bayern",
      "amtsgericht": "Amtsgericht Traunstein",
      "registernummer": "HRB 18573",
      "registerart": "HRB",
      "company_name": "Dyneon GmbH",
      "company_seat": "Burgkirchen a.d.Alz",
      "details": "07.10.2025 (Bekanntmachungsdatum)\n\nBayern Amtsgericht Traunstein HRB 18573\nEinreichung neuer Dokumente\n\nDyneon GmbH\nGesellschaft mit beschränkter Haftung\nBurgkirchen a.d.Alz\n\nDem #Re.Name ist eine Liste der Mitglieder des Aufsichtsrats eingereicht worden, § 52 Abs. 3 S. 2 GmbHG."
    },
    {
      "date": "2025-10-07",
      "id": "132802",
      "original_text": "Registerbekanntmachung nach dem Umwandlungsgesetz\nBayern Amtsgericht München HRA 121578\nLukas Oppermann e.K. – München",
      "type": "Registerbekanntmachung nach dem Umwandlungsgesetz",
      "state": "Bayern",
      "amtsgericht": "Amtsgericht München",
      "registernummer": "HRA 121578",
      "registerart": "HRA",
      "company_name": "Lukas Oppermann e.K.",
      "company_seat": "München",
      "details": "07.10.2025 (Bekanntmachungsdatum)\n\nBayern Amtsgericht München HRA 121578\nRegisterbekanntmachung nach dem Umwandlungsgesetz 06.10.2025 (Eintragungsdatum)\n\nLukas Oppermann e.K.\nEinzelkaufmann / Einzelkauffrau\nMünchen\n\nDen Gläubigern der an der Ausgliederung beteiligten Rechtsträger ist, wenn sie binnen sechs Monaten nach dem Tag, an dem die Eintragung der Ausgliederung in das Register des Sitzes desjenigen Rechtsträgers, dessen Gläubiger sie sind, nach §§ 125, 19 Abs. 3 UmwG als bekannt gemacht gilt, ihren Anspruch nach Grund und Höhe in Textform anmelden, Sicherheit zu leisten, soweit sie nicht Befriedigung verlangen können. Dieses Recht steht den Gläubigern jedoch nur zu, wenn sie glaubhaft machen, dass durch die Ausgliederung die Erfüllung ihrer Forderung gefährdet wird."
    },
    {
      "date": "2025-10-07",
      "id": "132803",
      "original_text": "Registerbekanntmachung nach dem Umwandlungsgesetz\nBayern Amtsgericht Augsburg GnR 1256\nBaugenossenschaft Gundelfingen a.d.Donau eG – Gundelfingen a.d.Donau",
      "type": "Registerbekanntmachung nach dem Umwandlungsgesetz",
      "state": "Bayern",
      "amtsgericht": "Amtsgericht Augsburg",
      "registernummer": "GnR 1256",
      "registerart": "GnR",
      "company_name": "Baugenossenschaft Gundelfingen a.d.Donau eG",
      "company_seat": "Gundelfingen a.d.Donau",
      "details": "07.10.2025 (Bekanntmachungsdatum)\n\nBayern Amtsgericht Augsburg GnR 1256\nRegisterbekanntmachung nach dem Umwandlungsgesetz 06.10.2025 (Eintragungsdatum)\n\nBaugenossenschaft Gundelfingen a.d.Donau eG\neingetragene Genossenschaft\nGundelfingen a.d.Donau\n\nDen Gläubigern der an der Verschmelzung beteiligten Rechtsträger ist, wenn sie binnen sechs Monaten nach dem Tag, an dem die Eintragung der Verschmelzung in das Register des Sitzes desjenigen Rechtsträgers, dessen Gläubiger sie sind, nach § 19 Abs. 3 UmwG als bekannt gemacht gilt, ihren Anspruch nach Grund und Höhe in Textform anmelden, Sicherheit zu leisten, soweit sie nicht Befriedigung verlangen können. Dieses Recht steht den Gläubigern jedoch nur zu, wenn sie glaubhaft machen, dass durch die Verschmelzung die Erfüllung ihrer Forderung gefährdet wird."
    },
    {
      "date": "2025-10-07",
      "id": "132804",
      "original_text": "Sonstige Registerbekanntmachung\nBayern Amtsgericht Hof HRB 1895\nVishay Electronic GmbH – Selb",
      "type": "Sonstige Registerbekanntmachung",
      "state": "Bayern",
      "amtsgericht": "Amtsgericht Hof",
      "registernummer": "HRB 1895",
      "registerart": "HRB",
      "company_name": "Vishay Electronic GmbH",
      "company_seat": "Selb",
      "details": "07.10.2025 (Bekanntmachungsdatum)\n\nBayern Amtsgericht Hof HRB 1895\nSonstige Registerbekanntmachung\n\nVishay Electronic GmbH\nGesellschaft mit beschränkter Haftung\nSelb\n\nDem Amtsgericht Hof -Registergericht- ist eine Liste der Mitglieder des Aufsichtsrats eingereicht worden, § 52 Abs. 3 S. 2 GmbHG."
    },
    {
      "date": "2025-10-07",
      "id": "132805",
      "original_text": "Registerbekanntmachung nach dem Umwandlungsgesetz\nBayern Amtsgericht Fürth HRB 14529\nFeNau GmbH – Langenzenn",
      "type": "Registerbekanntmachung nach dem Umwandlungsgesetz",
      "state": "Bayern",
      "amtsgericht": "Amtsgericht Fürth",
      "registernummer": "HRB 14529",
      "registerart": "HRB",
      "company_name": "FeNau GmbH",
      "company_seat": "Langenzenn",
      "details": "07.10.2025 (Bekanntmachungsdatum)\n\nBayern Amtsgericht Fürth HRB 14529\nRegisterbekanntmachung nach dem Umwandlungsgesetz 06.10.2025 (Eintragungsdatum)\n\nFeNau GmbH\nGesellschaft mit beschränkter Haftung\nLangenzenn\n\nDen Gläubigern der an der Verschmelzung beteiligten Rechtsträger ist, wenn sie binnen sechs Monaten nach dem Tag, an dem die Eintragung der Verschmelzung in das Register des Sitzes desjenigen Rechtsträgers, dessen Gläubiger sie sind, nach § 19 Abs. 3 UmwG als bekannt gemacht gilt, ihren Anspruch nach Grund und Höhe in Textform anmelden, Sicherheit zu leisten, soweit sie nicht Befriedigung verlangen können. Dieses Recht steht den Gläubigern jedoch nur zu, wenn sie glaubhaft machen, dass durch die Verschmelzung die Erfüllung ihrer Forderung gefährdet wird."
    },
    {
      "date": "2025-10-07",
      "id": "132806",
      "original_text": "Löschungsankündigung\nBayern Amtsgericht Aschaffenburg HRB 14964\nPROING GmbH – Aschaffenburg",
      "type": "Löschungsankündigung",
      "state": "Bayern",
      "amtsgericht": "Amtsgericht Aschaffenburg",
      "registernummer": "HRB 14964",
      "registerart": "HRB",
      "company_name": "PROING GmbH",
      "company_seat": "Aschaffenburg",
      "details": "07.10.2025 (Bekanntmachungsdatum)\n\nBayern Amtsgericht Aschaffenburg HRB 14964\nLöschungsankündigung\n\nPROING GmbH\nGesellschaft mit beschränkter Haftung\nAschaffenburg\n\nDas Registergericht beabsichtigt, die im Handelsregister eingetragene Gesellschaft wegen Vermögenslosigkeit von Amts wegen nach § 394 FamFG zu löschen. Die Frist zur Erhebung eines Widerspruchs ist auf drei Monate festgesetzt."
    },
    {
      "date": "2025-10-07",
      "id": "132807",
      "original_text": "Registerbekanntmachung nach dem Umwandlungsgesetz\nBayern Amtsgericht München HRB 176278\nHxGN Safety & Infrastructure GmbH – Garching b.München",
      "type": "Registerbekanntmachung nach dem Umwandlungsgesetz",
      "state": "Bayern",
      "amtsgericht": "Amtsgericht München",
      "registernummer": "HRB 176278",
      "registerart": "HRB",
      "company_name": "HxGN Safety & Infrastructure GmbH",
      "company_seat": "Garching b.München",
      "details": "07.10.2025 (Bekanntmachungsdatum)\n\nBayern Amtsgericht München HRB 176278\nRegisterbekanntmachung nach dem Umwandlungsgesetz 06.10.2025 (Eintragungsdatum)\n\nHxGN Safety & Infrastructure GmbH\nGesellschaft mit beschränkter Haftung\nGarching b.München\n\nDen Gläubigern der an der Spaltung beteiligten Rechtsträger ist, wenn sie binnen sechs Monaten nach dem Tag, an dem die Eintragung der Spaltung in das Register des Sitzes desjenigen Rechtsträgers, dessen Gläubiger sie sind, nach §§ 125, 19 Abs. 3 UmwG als bekannt gemacht gilt, ihren Anspruch nach Grund und Höhe in Textform anmelden, Sicherheit zu leisten, soweit sie nicht Befriedigung verlangen können. Dieses Recht steht den Gläubigern jedoch nur zu, wenn sie glaubhaft machen, dass durch die Spaltung die Erfüllung ihrer Forderung gefährdet wird."
    },
    {
      "date": "2025-10-07",
      "id": "132808",
      "original_text": "Einreichung neuer Dokumente\nBayern Amtsgericht Weiden i. d. OPf. HRB 1851\nHamm AG – Tirschenreuth",
      "type": "Einreichung neuer Dokumente",
      "state": "Bayern",
      "amtsgericht": "Amtsgericht Weiden i. d. OPf.",
      "registernummer": "HRB 1851",
      "registerart": "HRB",
      "company_name": "Hamm AG",
      "company_seat": "Tirschenreuth",
      "details": "07.10.2025 (Bekanntmachungsdatum)\n\nBayern Amtsgericht Weiden i. d. OPf. HRB 1851\nEinreichung neuer Dokumente 06.10.2025 (Eintragungsdatum)\n\nHamm AG\nAktiengesellschaft\nTirschenreuth\n\nDem Amtsgericht Weiden i.d.OPf. -Registergericht- ist eine Liste der Mitglieder des Aufsichtsrats eingereicht worden, § 106 AktG."
    },
    {
      "date": "2025-10-07",
      "id": "132809",
      "original_text": "Löschungsankündigung\nBayern Amtsgericht Nürnberg HRB 33077\nA & T Verlag GmbH – Nürnberg",
      "type": "Löschungsankündigung",
      "state": "Bayern",
      "amtsgericht": "Amtsgericht Nürnberg",
      "registernummer": "HRB 33077",
      "registerart": "HRB",
      "company_name": "A & T Verlag GmbH",
      "company_seat": "Nürnberg",
      "details": "07.10.2025 (Bekanntmachungsdatum)\n\nBayern Amtsgericht Nürnberg HRB 33077\nLöschungsankündigung\n\nA & T Verlag GmbH\nGesellschaft mit beschränkter Haftung\nNürnberg\n\nDas Registergericht beabsichtigt, die im Handelsregister eingetragene Gesellschaft von Amts wegen nach § 395 FamFG zu löschen. #insert(Text=\"zztb_V_Widerspruchsfrist\")"
    },
    {
      "date": "2025-10-07",
      "id": "132810",
      "original_text": "Registerbekanntmachung nach dem Umwandlungsgesetz\nBayern Amtsgericht Augsburg HRB 24965\ndesign4living GmbH – Augsburg",
      "type": "Registerbekanntmachung nach dem Umwandlungsgesetz",
      "state": "Bayern",
      "amtsgericht": "Amtsgericht Augsburg",
      "registernummer": "HRB 24965",
      "registerart": "HRB",
      "company_name": "design4living GmbH",
      "company_seat": "Augsburg",
      "details": "07.10.2025 (Bekanntmachungsdatum)\n\nBayern Amtsgericht Augsburg HRB 24965\nRegisterbekanntmachung nach dem Umwandlungsgesetz 06.10.2025 (Eintragungsdatum)\n\ndesign4living GmbH\nGesellschaft mit beschränkter Haftung\nAugsburg\n\nDen Gläubigern der an der Verschmelzung beteiligten Rechtsträger ist, wenn sie binnen sechs Monaten nach dem Tag, an dem die Eintragung der Verschmelzung in das Register des Sitzes desjenigen Rechtsträgers, dessen Gläubiger sie sind, nach § 19 Abs. 3 UmwG als bekannt gemacht gilt, ihren Anspruch nach Grund und Höhe in Textform anmelden, Sicherheit zu leisten, soweit sie nicht Befriedigung verlangen können. Dieses Recht steht den Gläubigern jedoch nur zu, wenn sie glaubhaft machen, dass durch die Verschmelzung die Erfüllung ihrer Forderung gefährdet wird."
    },
    {
      "date": "2025-10-07",
      "id": "132811",
      "original_text": "Löschungsankündigung\nBayern Amtsgericht München HRB 212161\nProelta Verwaltungs GmbH – München",
      "type": "Löschungsankündigung",
      "state": "Bayern",
      "amtsgericht": "Amtsgericht München",
      "registernummer": "HRB 212161",
      "registerart": "HRB",
      "company_name": "Proelta Verwaltungs GmbH",
      "company_seat": "München",
      "details": "07.10.2025 (Bekanntmachungsdatum)\n\nBayern Amtsgericht München HRB 212161\nLöschungsankündigung 06.10.2025 (Eintragungsdatum)\n\nProelta Verwaltungs GmbH\nGesellschaft mit beschränkter Haftung\nMünchen\n\nDas Registergericht beabsichtigt, die im Handelsregister eingetragene Gesellschaft wegen Vermögenslosigkeit von Amts wegen nach § 394 FamFG zu löschen. Die Frist zur Erhebung eines Widerspruchs ist auf drei Monate festgesetzt."
    },
    {
      "date": "2025-10-07",
      "id": "132812",
      "original_text": "Registerbekanntmachung nach dem Umwandlungsgesetz\nBayern Amtsgericht München HRB 285660\nSolarpark Maisach-West GmbH – Ismaning",
      "type": "Registerbekanntmachung nach dem Umwandlungsgesetz",
      "state": "Bayern",
      "amtsgericht": "Amtsgericht München",
      "registernummer": "HRB 285660",
      "registerart": "HRB",
      "company_name": "Solarpark Maisach-West GmbH",
      "company_seat": "Ismaning",
      "details": "07.10.2025 (Bekanntmachungsdatum)\n\nBayern Amtsgericht München HRB 285660\nRegisterbekanntmachung nach dem Umwandlungsgesetz 06.10.2025 (Eintragungsdatum)\n\nSolarpark Maisach-West GmbH\nGesellschaft mit beschränkter Haftung\nIsmaning\n\nDen Gläubigern der an der Verschmelzung beteiligten Rechtsträger ist, wenn sie binnen sechs Monaten nach dem Tag, an dem die Eintragung der Verschmelzung in das Register des Sitzes desjenigen Rechtsträgers, dessen Gläubiger sie sind, nach § 19 Abs. 3 UmwG als bekannt gemacht gilt, ihren Anspruch nach Grund und Höhe in Textform anmelden, Sicherheit zu leisten, soweit sie nicht Befriedigung verlangen können. Dieses Recht steht den Gläubigern jedoch nur zu, wenn sie glaubhaft machen, dass durch die Verschmelzung die Erfüllung ihrer Forderung gefährdet wird."
    },
    {
      "date": "2025-10-07",
      "id": "132813",
      "original_text": "Einreichung neuer Dokumente\nBayern Amtsgericht Coburg HRB 3942\nGerresheimer Tettau GmbH – Tettau (Oberfranken)",
      "type": "Einreichung neuer Dokumente",
      "state": "Bayern",
      "amtsgericht": "Amtsgericht Coburg",
      "registernummer": "HRB 3942",
      "registerart": "HRB",
      "company_name": "Gerresheimer Tettau GmbH",
      "company_seat": "Tettau (Oberfranken)",
      "details": "07.10.2025 (Bekanntmachungsdatum)\n\nBayern Amtsgericht Coburg HRB 3942\nEinreichung neuer Dokumente 06.10.2025 (Eintragungsdatum)\n\nGerresheimer Tettau GmbH\nGesellschaft mit beschränkter Haftung\nTettau (Oberfranken)\n\nDem Amtsgericht Coburg -Registergericht- ist eine Liste der Mitglieder des Aufsichtsrats eingereicht worden, § 52 Abs. 3 S. 2 GmbHG."
    },
    {
      "date": "2025-10-07",
      "id": "132814",
      "original_text": "Registerbekanntmachung nach dem Umwandlungsgesetz\nBayern Amtsgericht Augsburg HRB 24930\npisa bpa Versicherungsmakler GmbH – Schondorf am Ammersee",
      "type": "Registerbekanntmachung nach dem Umwandlungsgesetz",
      "state": "Bayern",
      "amtsgericht": "Amtsgericht Augsburg",
      "registernummer": "HRB 24930",
      "registerart": "HRB",
      "company_name": "pisa bpa Versicherungsmakler GmbH",
      "company_seat": "Schondorf am Ammersee",
      "details": "07.10.2025 (Bekanntmachungsdatum)\n\nBayern Amtsgericht Augsburg HRB 24930\nRegisterbekanntmachung nach dem Umwandlungsgesetz 06.10.2025 (Eintragungsdatum)\n\npisa bpa Versicherungsmakler GmbH\nGesellschaft mit beschränkter Haftung\nSchondorf am Ammersee\n\nDen Gläubigern der an der Verschmelzung beteiligten Rechtsträger ist, wenn sie binnen sechs Monaten nach dem Tag, an dem die Eintragung der Verschmelzung in das Register des Sitzes desjenigen Rechtsträgers, dessen Gläubiger sie sind, nach § 19 Abs. 3 UmwG als bekannt gemacht gilt, ihren Anspruch nach Grund und Höhe in Textform anmelden, Sicherheit zu leisten, soweit sie nicht Befriedigung verlangen können. Dieses Recht steht den Gläubigern jedoch nur zu, wenn sie glaubhaft machen, dass durch die Verschmelzung die Erfüllung ihrer Forderung gefährdet wird."
    },
    {
      "date": "2025-10-07",
      "id": "132815",
      "original_text": "Einreichung neuer Dokumente\nBayern Amtsgericht München HRB 246833\nEncavis Asset Management AG – Neubiberg",
      "type": "Einreichung neuer Dokumente",
      "state": "Bayern",
      "amtsgericht": "Amtsgericht München",
      "registernummer": "HRB 246833",
      "registerart": "HRB",
      "company_name": "Encavis Asset Management AG",
      "company_seat": "Neubiberg",
      "details": "07.10.2025 (Bekanntmachungsdatum)\n\nBayern Amtsgericht München HRB 246833\nEinreichung neuer Dokumente\n\nEncavis Asset Management AG\nAktiengesellschaft\nNeubiberg\n\nDem Amtsgericht München -Registergericht- ist eine Liste der Mitglieder des Aufsichtsrats eingereicht worden, § 106 AktG."
    },
    {
      "date": "2025-10-07",
      "id": "132816",
      "original_text": "Registerbekanntmachung nach dem Umwandlungsgesetz\nBayern Amtsgericht München HRB 238853\nTHOHR II MPP Beteiligungs GmbH – München",
      "type": "Registerbekanntmachung nach dem Umwandlungsgesetz",
      "state": "Bayern",
      "amtsgericht": "Amtsgericht München",
      "registernummer": "HRB 238853",
      "registerart": "HRB",
      "company_name": "THOHR II MPP Beteiligungs GmbH",
      "company_seat": "München",
      "details": "07.10.2025 (Bekanntmachungsdatum)\n\nBayern Amtsgericht München HRB 238853\nRegisterbekanntmachung nach dem Umwandlungsgesetz 06.10.2025 (Eintragungsdatum)\n\nTHOHR II MPP Beteiligungs GmbH\nGesellschaft mit beschränkter Haftung\nMünchen\n\nDen Gläubigern der an der Verschmelzung beteiligten Rechtsträger ist, wenn sie binnen sechs Monaten nach dem Tag, an dem die Eintragung der Verschmelzung in das Register des Sitzes desjenigen Rechtsträgers, dessen Gläubiger sie sind, nach § 19 Abs. 3 UmwG als bekannt gemacht gilt, ihren Anspruch nach Grund und Höhe in Textform anmelden, Sicherheit zu leisten, soweit sie nicht Befriedigung verlangen können. Dieses Recht steht den Gläubigern jedoch nur zu, wenn sie glaubhaft machen, dass durch die Verschmelzung die Erfüllung ihrer Forderung gefährdet wird."
    },
    {
      "date": "2025-10-07",
      "id": "132817",
      "original_text": "Löschungsankündigung\nBayern Amtsgericht Nürnberg HRB 38983\nTritos Gruppe UG (haftungsbeschränkt) – Nürnberg",
      "type": "Löschungsankündigung",
      "state": "Bayern",
      "amtsgericht": "Amtsgericht Nürnberg",
      "registernummer": "HRB 38983",
      "registerart": "HRB",
      "company_name": "Tritos Gruppe UG (haftungsbeschränkt)",
      "company_seat": "Nürnberg",
      "details": "07.10.2025 (Bekanntmachungsdatum)\n\nBayern Amtsgericht Nürnberg HRB 38983\nLöschungsankündigung\n\nTritos Gruppe UG (haftungsbeschränkt)\nGesellschaft mit beschränkter Haftung\nNürnberg\n\nDas Registergericht beabsichtigt, die im Handelsregister eingetragene Gesellschaft wegen Vermögenslosigkeit von Amts wegen nach § 394 FamFG zu löschen. Die Frist zur Erhebung eines Widerspruchs ist auf einen Monat festgesetzt."
    },
    {
      "date": "2025-10-07",
      "id": "132818",
      "original_text": "Registerbekanntmachung nach dem Umwandlungsgesetz\nBayern Amtsgericht Augsburg HRB 36155\nRENK GmbH – Augsburg",
      "type": "Registerbekanntmachung nach dem Umwandlungsgesetz",
      "state": "Bayern",
      "amtsgericht": "Amtsgericht Augsburg",
      "registernummer": "HRB 36155",
      "registerart": "HRB",
      "company_name": "RENK GmbH",
      "company_seat": "Augsburg",
      "details": "07.10.2025 (Bekanntmachungsdatum)\n\nBayern Amtsgericht Augsburg HRB 36155\nRegisterbekanntmachung nach dem Umwandlungsgesetz 06.10.2025 (Eintragungsdatum)\n\nRENK GmbH\nGesellschaft mit beschränkter Haftung\nAugsburg\n\nDen Gläubigern der an der Ausgliederung beteiligten Rechtsträger ist, wenn sie binnen sechs Monaten nach dem Tag, an dem die Eintragung der Ausgliederung in das Register des Sitzes desjenigen Rechtsträgers, dessen Gläubiger sie sind, nach §§ 125, 19 Abs. 3 UmwG als bekannt gemacht gilt, ihren Anspruch nach Grund und Höhe in Textform anmelden, Sicherheit zu leisten, soweit sie nicht Befriedigung verlangen können. Dieses Recht steht den Gläubigern jedoch nur zu, wenn sie glaubhaft machen, dass durch die Ausgliederung die Erfüllung ihrer Forderung gefährdet wird."
    },
    {
      "date": "2025-10-07",
      "id": "132819",
      "original_text": "Löschungsankündigung\nBayern Amtsgericht München HRB 202227\nAMG Munich GmbH – München",
      "type": "Löschungsankündigung",
      "state": "Bayern",
      "amtsgericht": "Amtsgericht München",
      "registernummer": "HRB 202227",
      "registerart": "HRB",
      "company_name": "AMG Munich GmbH",
      "company_seat": "München",
      "details": "07.10.2025 (Bekanntmachungsdatum)\n\nBayern Amtsgericht München HRB 202227\nLöschungsankündigung 06.10.2025 (Eintragungsdatum)\n\nAMG Munich GmbH\nGesellschaft mit beschränkter Haftung\nMünchen\n\nDas Registergericht beabsichtigt, die im Handelsregister eingetragene Gesellschaft wegen Vermögenslosigkeit von Amts wegen nach § 394 FamFG zu löschen. Die Frist zur Erhebung eines Widerspruchs ist auf drei Monate festgesetzt."
    },
    {
      "date": "2025-10-07",
      "id": "132820",
      "original_text": "Registerbekanntmachung nach dem Umwandlungsgesetz\nBayern Amtsgericht Fürth HRB 18226\nGreen Clawn UG (haftungsbeschränkt) – Fürth",
      "type": "Registerbekanntmachung nach dem Umwandlungsgesetz",
      "state": "Bayern",
      "amtsgericht": "Amtsgericht Fürth",
      "registernummer": "HRB 18226",
      "registerart": "HRB",
      "company_name": "Green Clawn UG (haftungsbeschränkt)",
      "company_seat": "Fürth",
      "details": "07.10.2025 (Bekanntmachungsdatum)\n\nBayern Amtsgericht Fürth HRB 18226\nRegisterbekanntmachung nach dem Umwandlungsgesetz 06.10.2025 (Eintragungsdatum)\n\nGreen Clawn UG (haftungsbeschränkt)\nGesellschaft mit beschränkter Haftung\nFürth\n\nDen Gläubigern der an der Verschmelzung beteiligten Rechtsträger ist, wenn sie binnen sechs Monaten nach dem Tag, an dem die Eintragung der Verschmelzung in das Register des Sitzes desjenigen Rechtsträgers, dessen Gläubiger sie sind, nach § 19 Abs. 3 UmwG als bekannt gemacht gilt, ihren Anspruch nach Grund und Höhe in Textform anmelden, Sicherheit zu leisten, soweit sie nicht Befriedigung verlangen können. Dieses Recht steht den Gläubigern jedoch nur zu, wenn sie glaubhaft machen, dass durch die Verschmelzung die Erfüllung ihrer Forderung gefährdet wird."
    },
    {
      "date": "2025-10-07",
      "id": "132821",
      "original_text": "Löschungsankündigung\nBayern Amtsgericht Nürnberg HRB 26729\nFour Star GmbH – Nürnberg",
      "type": "Löschungsankündigung",
      "state": "Bayern",
      "amtsgericht": "Amtsgericht Nürnberg",
      "registernummer": "HRB 26729",
      "registerart": "HRB",
      "company_name": "Four Star GmbH",
      "company_seat": "Nürnberg",
      "details": "07.10.2025 (Bekanntmachungsdatum)\n\nBayern Amtsgericht Nürnberg HRB 26729\nLöschungsankündigung\n\nFour Star GmbH\nGesellschaft mit beschränkter Haftung\nNürnberg\n\nDas Registergericht beabsichtigt, die im Handelsregister eingetragene Gesellschaft wegen Vermögenslosigkeit von Amts wegen nach § 394 FamFG zu löschen. Die Frist zur Erhebung eines Widerspruchs ist auf einen Monat festgesetzt."
    },
    {
      "date": "2025-10-07",
      "id": "132822",
      "original_text": "Löschungsankündigung\nBayern Amtsgericht Memmingen HRA 12204\nHZ unit Hagelschaden Servicezentrum Betriebs GmbH & Co. KG – Illertissen",
      "type": "Löschungsankündigung",
      "state": "Bayern",
      "amtsgericht": "Amtsgericht Memmingen",
      "registernummer": "HRA 12204",
      "registerart": "HRA",
      "company_name": "HZ unit Hagelschaden Servicezentrum Betriebs GmbH & Co. KG",
      "company_seat": "Illertissen",
      "details": "07.10.2025 (Bekanntmachungsdatum)\n\nBayern Amtsgericht Memmingen HRA 12204\nLöschungsankündigung\n\nHZ unit Hagelschaden Servicezentrum Betriebs GmbH & Co. KG\nKommanditgesellschaft\nIllertissen\n\nDas Amtsgericht Memmingen -Registergericht- beabsichtigt, die im Handelsregister eingetragene Firma HZ unit Hagelschaden Servicezentrum Betriebs GmbH & Co. KG, Sitz: Illertissen von Amts wegen gemäß § 31 Abs. 2 HGB zu löschen. Die Frist zur Erhebung eines Widerspruchs gegen die beabsichtigte Löschung wird auf einen Monat festgesetzt."
    },
    {
      "date": "2025-10-07",
      "id": "132823",
      "original_text": "Registerbekanntmachung nach dem Umwandlungsgesetz\nBayern Amtsgericht München HRB 238229\nTHOHR II MPP Verwaltungs GmbH – München",
      "type": "Registerbekanntmachung nach dem Umwandlungsgesetz",
      "state": "Bayern",
      "amtsgericht": "Amtsgericht München",
      "registernummer": "HRB 238229",
      "registerart": "HRB",
      "company_name": "THOHR II MPP Verwaltungs GmbH",
      "company_seat": "München",
      "details": "07.10.2025 (Bekanntmachungsdatum)\n\nBayern Amtsgericht München HRB 238229\nRegisterbekanntmachung nach dem Umwandlungsgesetz 06.10.2025 (Eintragungsdatum)\n\nTHOHR II MPP Verwaltungs GmbH\nGesellschaft mit beschränkter Haftung\nMünchen\n\nDen Gläubigern der an der Verschmelzung beteiligten Rechtsträger ist, wenn sie binnen sechs Monaten nach dem Tag, an dem die Eintragung der Verschmelzung in das Register des Sitzes desjenigen Rechtsträgers, dessen Gläubiger sie sind, nach § 19 Abs. 3 UmwG als bekannt gemacht gilt, ihren Anspruch nach Grund und Höhe in Textform anmelden, Sicherheit zu leisten, soweit sie nicht Befriedigung verlangen können. Dieses Recht steht den Gläubigern jedoch nur zu, wenn sie glaubhaft machen, dass durch die Verschmelzung die Erfüllung ihrer Forderung gefährdet wird."
    },
    {
      "date": "2025-10-07",
      "id": "132824",
      "original_text": "Löschungsankündigung\nBayern Amtsgericht Ansbach HRB 796\nRE-Abwicklungsgesellschaft mbH – Weißenburg i. Bay.",
      "type": "Löschungsankündigung",
      "state": "Bayern",
      "amtsgericht": "Amtsgericht Ansbach",
      "registernummer": "HRB 796",
      "registerart": "HRB",
      "company_name": "RE-Abwicklungsgesellschaft mbH",
      "company_seat": "Weißenburg i. Bay.",
      "details": "07.10.2025 (Bekanntmachungsdatum)\n\nBayern Amtsgericht Ansbach HRB 796\nLöschungsankündigung\n\nRE-Abwicklungsgesellschaft mbH\nGesellschaft mit beschränkter Haftung\nWeißenburg i. Bay.\n\nDas Registergericht beabsichtigt, die im Handelsregister eingetragene Gesellschaft wegen Vermögenslosigkeit von Amts wegen nach § 394 FamFG zu löschen. Die Frist zur Erhebung eines Widerspruchs ist auf sechs Wochen festgesetzt."
    },
    {
      "date": "2025-10-07",
      "id": "132825",
      "original_text": "Sonstige Registerbekanntmachung\nBayern Amtsgericht München HRB 304390\nVistec GmbH – Olching",
      "type": "Sonstige Registerbekanntmachung",
      "state": "Bayern",
      "amtsgericht": "Amtsgericht München",
      "registernummer": "HRB 304390",
      "registerart": "HRB",
      "company_name": "Vistec GmbH",
      "company_seat": "Olching",
      "details": "07.10.2025 (Bekanntmachungsdatum)\n\nBayern Amtsgericht München HRB 304390\nSonstige Registerbekanntmachung 06.10.2025 (Eintragungsdatum)\n\nVistec GmbH\nGesellschaft mit beschränkter Haftung\nOlching\n\nDen Gläubigern der Gesellschaft, deren Forderungen begründet worden sind, bevor die Eintragung der Beendigung des Gewinnabführungsvertrages in das Handelsregister nach § 10 des Handelsgesetzbuches als bekanntgemacht gilt, hat der andere Vertragsteil Sicherheit zu leisten, wenn sie sich binnen sechs Monaten nach der Bekanntmachung der Eintragung zu diesem Zweck bei ihm melden."
    },
    {
      "date": "2025-10-07",
      "id": "132826",
      "original_text": "Registerbekanntmachung nach dem Umwandlungsgesetz\nBayern Amtsgericht Aschaffenburg HRA 6743\nChristel Pawlik e.K. – Leidersbach",
      "type": "Registerbekanntmachung nach dem Umwandlungsgesetz",
      "state": "Bayern",
      "amtsgericht": "Amtsgericht Aschaffenburg",
      "registernummer": "HRA 6743",
      "registerart": "HRA",
      "company_name": "Christel Pawlik e.K.",
      "company_seat": "Leidersbach",
      "details": "07.10.2025 (Bekanntmachungsdatum)\n\nBayern Amtsgericht Aschaffenburg HRA 6743\nRegisterbekanntmachung nach dem Umwandlungsgesetz 06.10.2025 (Eintragungsdatum)\n\nChristel Pawlik e.K.\nEinzelkaufmann / Einzelkauffrau\nLeidersbach\n\nDen Gläubigern der an der Ausgliederung beteiligten Rechtsträger ist, wenn sie binnen sechs Monaten nach dem Tag, an dem die Eintragung der Ausgliederung in das Register des Sitzes desjenigen Rechtsträgers, dessen Gläubiger sie sind, nach §§ 125, 19 Abs. 3 UmwG als bekannt gemacht gilt, ihren Anspruch nach Grund und Höhe in Textform anmelden, Sicherheit zu leisten, soweit sie nicht Befriedigung verlangen können. Dieses Recht steht den Gläubigern jedoch nur zu, wenn sie glaubhaft machen, dass durch die Ausgliederung die Erfüllung ihrer Forderung gefährdet wird."
    },
    {
      "date": "2025-10-07",
      "id": "132827",
      "original_text": "Registerbekanntmachung nach dem Umwandlungsgesetz\nBaden-Württemberg Amtsgericht Stuttgart HRA 742477\nCaddie Digitalberatung e.K. – Sindelfingen",
      "type": "Registerbekanntmachung nach dem Umwandlungsgesetz",
      "state": "Baden-Württemberg",
      "amtsgericht": "Amtsgericht Stuttgart",
      "registernummer": "HRA 742477",
      "registerart": "HRA",
      "company_name": "Caddie Digitalberatung e.K.",
      "company_seat": "Sindelfingen",
      "details": "07.10.2025 (Bekanntmachungsdatum)\n\nBaden-Württemberg Amtsgericht Stuttgart HRA 742477\nRegisterbekanntmachung nach dem Umwandlungsgesetz 07.10.2025 (Eintragungsdatum)\n\nCaddie Digitalberatung e.K.\nEinzelkaufmann / Einzelkauffrau\nSindelfingen\n\nAls nicht eingetragen wird bekanntgemacht:\nDen Gläubigern der an der Ausgliederung beteiligten Rechtsträger ist, wenn sie binnen sechs Monaten nach dem Tag, an dem die Eintragung der Ausgliederung in das Register des Sitzes desjenigen Rechtsträgers, dessen Gläubiger sie sind, nach § 19 Abs. 3 UmwG als bekanntgemacht gilt, ihren Anspruch nach Grund und Höhe schriftlich anmelden, Sicherheit zu leisten, soweit sie nicht Befriedigung verlangen können. Dieses Recht steht den Gläubigern jedoch nur zu, wenn sie glaubhaft machen, dass durch die Ausgliederung die Erfüllung ihrer Forderung gefährdet wird."
    },
    {
      "date": "2025-10-07",
      "id": "132828",
      "original_text": "Einreichung neuer Dokumente\nSchleswig-Holstein Amtsgericht Flensburg HRB 2981\nttp AG Steuerberatungsgesellschaft – Flensburg",
      "type": "Einreichung neuer Dokumente",
      "state": "Schleswig-Holstein",
      "amtsgericht": "Amtsgericht Flensburg",
      "registernummer": "HRB 2981",
      "registerart": "HRB",
      "company_name": "ttp AG Steuerberatungsgesellschaft",
      "company_seat": "Flensburg",
      "details": "07.10.2025 (Bekanntmachungsdatum)\n\nSchleswig-Holstein Amtsgericht Flensburg HRB 2981\nEinreichung neuer Dokumente\n\nttp AG Steuerberatungsgesellschaft\nAktiengesellschaft\nFlensburg\n\nNeue Aufsichtsratsliste nach Änderung eingereicht am 06.10.2025."
    },
    {
      "date": "2025-10-07",
      "id": "132829",
      "original_text": "Einreichung neuer Dokumente\nBaden-Württemberg Amtsgericht Mannheim HRB 715395\nGeothermie-Gesellschaft Bruchsal GmbH – Bruchsal",
      "type": "Einreichung neuer Dokumente",
      "state": "Baden-Württemberg",
      "amtsgericht": "Amtsgericht Mannheim",
      "registernummer": "HRB 715395",
      "registerart": "HRB",
      "company_name": "Geothermie-Gesellschaft Bruchsal GmbH",
      "company_seat": "Bruchsal",
      "details": "07.10.2025 (Bekanntmachungsdatum)\n\nBaden-Württemberg Amtsgericht Mannheim HRB 715395\nEinreichung neuer Dokumente 07.10.2025 (Eintragungsdatum)\n\nGeothermie-Gesellschaft Bruchsal GmbH\nGesellschaft mit beschränkter Haftung\nBruchsal\n\nDie Gesellschaft hat am 24.09.2025 die Liste über die Zusammensetzung des Aufsichtsrats zum Handelsregister eingereicht."
    },
    {
      "date": "2025-10-07",
      "id": "132830",
      "original_text": "Registerbekanntmachung nach dem Umwandlungsgesetz\nBerlin Amtsgericht Berlin (Charlottenburg) HRB 218519\nVIVA eCOM GROUP GmbH – Berlin",
      "type": "Registerbekanntmachung nach dem Umwandlungsgesetz",
      "state": "Berlin",
      "amtsgericht": "Amtsgericht Berlin (Charlottenburg)",
      "registernummer": "HRB 218519",
      "registerart": "HRB",
      "company_name": "VIVA eCOM GROUP GmbH",
      "company_seat": "Berlin",
      "details": "07.10.2025 (Bekanntmachungsdatum)\n\nBerlin Amtsgericht Berlin (Charlottenburg) HRB 218519\nRegisterbekanntmachung nach dem Umwandlungsgesetz 06.10.2025 (Eintragungsdatum)\n\nVIVA eCOM GROUP GmbH\nGesellschaft mit beschränkter Haftung\nBerlin\n\nZu Eintragungsnummer 8 vom 06.10.2025 wird als nicht eingetragen veröffentlicht: Den Gläubigern der an der Verschmelzung beteiligten Rechtsträger ist, wenn sie binnen sechs Monaten nach dem Tag, an dem die Eintragung der Verschmelzung in das Register des Sitzes desjenigen Rechtsträgers, dessen Gläubiger sie sind, als bekannt gemacht gilt, ihren Anspruch nach Grund und Höhe schriftlich anmelden, Sicherheit zu leisten, soweit sie nicht Befriedigung verlangen können. Dieses Recht steht den Gläubigern jedoch nur zu, wenn sie glaubhaft machen, dass durch die Verschmelzung die Erfüllung ihrer Forderung gefährdet wird. Das Recht, Sicherheitsleistung zu verlangen, steht Gläubigern nicht zu, die im Falle der Insolvenz ein Recht auf vorzugsweise Befriedigung aus einer Deckungsmasse haben, die nach gesetzlicher Vorschrift zu ihrem Schutz errichtet und staatlich überwacht ist."
    },
    {
      "date": "2025-10-07",
      "id": "132831",
      "original_text": "Registerbekanntmachung nach dem Umwandlungsgesetz\nBaden-Württemberg Amtsgericht Stuttgart HRB 733451\nBecklyn GmbH – Ludwigsburg",
      "type": "Registerbekanntmachung nach dem Umwandlungsgesetz",
      "state": "Baden-Württemberg",
      "amtsgericht": "Amtsgericht Stuttgart",
      "registernummer": "HRB 733451",
      "registerart": "HRB",
      "company_name": "Becklyn GmbH",
      "company_seat": "Ludwigsburg",
      "details": "07.10.2025 (Bekanntmachungsdatum)\n\nBaden-Württemberg Amtsgericht Stuttgart HRB 733451\nRegisterbekanntmachung nach dem Umwandlungsgesetz 07.10.2025 (Eintragungsdatum)\n\nBecklyn GmbH\nGesellschaft mit beschränkter Haftung\nLudwigsburg\n\nAls nicht eingetragen wird bekanntgemacht:\nDen Gläubigern der an der Verschmelzung beteiligten Rechtsträger ist, wenn sie binnen sechs Monaten nach dem Tag, an dem die Eintragung der Verschmelzung in das Register des Sitzes desjenigen Rechtsträgers, dessen Gläubiger sie sind, nach § 19 Abs. 3 UmwG als bekanntgemacht gilt, ihren Anspruch nach Grund und Höhe schriftlich anmelden, Sicherheit zu leisten, soweit sie nicht Befriedigung verlangen können. Dieses Recht steht den Gläubigern jedoch nur zu, wenn sie glaubhaft machen, dass durch die Verschmelzung die Erfüllung ihrer Forderung gefährdet wird."
    },
    {
      "date": "2025-10-07",
      "id": "132832",
      "original_text": "Löschungsankündigung\nBerlin Amtsgericht Berlin (Charlottenburg) HRB 60967\nVMB Verpackungsmaterial-Markt in Berlin GmbH – Berlin",
      "type": "Löschungsankündigung",
      "state": "Berlin",
      "amtsgericht": "Amtsgericht Berlin (Charlottenburg)",
      "registernummer": "HRB 60967",
      "registerart": "HRB",
      "company_name": "VMB Verpackungsmaterial-Markt in Berlin GmbH",
      "company_seat": "Berlin",
      "details": "07.10.2025 (Bekanntmachungsdatum)\n\nBerlin Amtsgericht Berlin (Charlottenburg) HRB 60967\nLöschungsankündigung\n\nVMB Verpackungsmaterial-Markt in Berlin GmbH\nGesellschaft mit beschränkter Haftung\nBerlin\n\nBei der nachstehenden Gesellschaft wird das Amtslöschungsverfahren gemäß § 394 FamFG eingeleitet. Widerspruchsfrist 6 Wochen"
    },
    {
      "date": "2025-10-07",
      "id": "132833",
      "original_text": "Registerbekanntmachung nach dem Umwandlungsgesetz\nBerlin Amtsgericht Berlin (Charlottenburg) HRB 277966\nTREFF Residenz-Hotel-Tagungszentrum Kassel Betriebsgesellschaft mbH – Berlin",
      "type": "Registerbekanntmachung nach dem Umwandlungsgesetz",
      "state": "Berlin",
      "amtsgericht": "Amtsgericht Berlin (Charlottenburg)",
      "registernummer": "HRB 277966",
      "registerart": "HRB",
      "company_name": "TREFF Residenz-Hotel-Tagungszentrum Kassel Betriebsgesellschaft mbH",
      "company_seat": "Berlin",
      "details": "07.10.2025 (Bekanntmachungsdatum)\n\nBerlin Amtsgericht Berlin (Charlottenburg) HRB 277966\nRegisterbekanntmachung nach dem Umwandlungsgesetz 06.10.2025 (Eintragungsdatum)\n\nTREFF Residenz-Hotel-Tagungszentrum Kassel Betriebsgesellschaft mbH\nGesellschaft mit beschränkter Haftung\nBerlin\n\nZu Eintragungsnummer 3 vom 06.10.2025 wird als nicht eingetragen veröffentlicht:\n\nDen Gläubigern der an der Spaltung beteiligten Rechtsträger ist, wenn sie binnen sechs Monaten nach dem Tag, an dem die Eintragung der Spaltung in das Register des Sitzes desjenigen Rechtsträgers, dessen Gläubiger sie sind, als bekannt gemacht gilt, ihren Anspruch nach Grund und Höhe schriftlich anmelden, Sicherheit zu leisten, soweit sie nicht Befriedigung verlangen können. Dieses Recht steht den Gläubigern jedoch nur zu, wenn sie glaubhaft machen, dass durch die Spaltung die Erfüllung ihrer Forderung gefährdet wird. Das Recht, Sicherheitsleistung zu verlangen, steht Gläubigern nicht zu, die im Falle der Insolvenz ein Recht auf vorzugsweise Befriedigung aus einer Deckungsmasse haben, die nach gesetzlicher Vorschrift zu ihrem Schutz errichtet und staatlich überwacht ist."
    },
    {
      "date": "2025-10-07",
      "id": "132834",
      "original_text": "Registerbekanntmachung nach dem Umwandlungsgesetz\nBaden-Württemberg Amtsgericht Freiburg HRB 733836\nCaritas Jugendhilfe in der Erzdiözese Freiburg gGmbH – Freiburg i. Br.",
      "type": "Registerbekanntmachung nach dem Umwandlungsgesetz",
      "state": "Baden-Württemberg",
      "amtsgericht": "Amtsgericht Freiburg",
      "registernummer": "HRB 733836",
      "registerart": "HRB",
      "company_name": "Caritas Jugendhilfe in der Erzdiözese Freiburg gGmbH",
      "company_seat": "Freiburg i. Br.",
      "details": "07.10.2025 (Bekanntmachungsdatum)\n\nBaden-Württemberg Amtsgericht Freiburg HRB 733836\nRegisterbekanntmachung nach dem Umwandlungsgesetz 07.10.2025 (Eintragungsdatum)\n\nCaritas Jugendhilfe in der Erzdiözese Freiburg gGmbH\nGesellschaft mit beschränkter Haftung\nFreiburg i. Br.\n\nAls nicht eingetragen wird bekanntgemacht:\nDen Gläubigern der an der Ausgliederung beteiligten Rechtsträger ist, wenn sie binnen sechs Monaten nach dem Tag, an dem die Eintragung der Ausgliederung in das Register des Sitzes desjenigen Rechtsträgers, dessen Gläubiger sie sind, nach § 19 Abs. 3 UmwG als bekanntgemacht gilt, ihren Anspruch nach Grund und Höhe schriftlich anmelden, Sicherheit zu leisten, soweit sie nicht Befriedigung verlangen können. Dieses Recht steht den Gläubigern jedoch nur zu, wenn sie glaubhaft machen, dass durch die Ausgliederung die Erfüllung ihrer Forderung gefährdet wird."
    },
    {
      "date": "2025-10-07",
      "id": "132835",
      "original_text": "Registerbekanntmachung nach dem Umwandlungsgesetz\nBaden-Württemberg Amtsgericht Freiburg HRB 733836\nCaritas Jugendhilfe in der Erzdiözese Freiburg gGmbH – Freiburg i. Br.",
      "type": "Registerbekanntmachung nach dem Umwandlungsgesetz",
      "state": "Baden-Württemberg",
      "amtsgericht": "Amtsgericht Freiburg",
      "registernummer": "HRB 733836",
      "registerart": "HRB",
      "company_name": "Caritas Jugendhilfe in der Erzdiözese Freiburg gGmbH",
      "company_seat": "Freiburg i. Br.",
      "details": "07.10.2025 (Bekanntmachungsdatum)\n\nBaden-Württemberg Amtsgericht Freiburg HRB 733836\nRegisterbekanntmachung nach dem Umwandlungsgesetz 07.10.2025 (Eintragungsdatum)\n\nCaritas Jugendhilfe in der Erzdiözese Freiburg gGmbH\nGesellschaft mit beschränkter Haftung\nFreiburg i. Br.\n\nAls nicht eingetragen wird bekanntgemacht:\nDen Gläubigern der an der Ausgliederung beteiligten Rechtsträger ist, wenn sie binnen sechs Monaten nach dem Tag, an dem die Eintragung der Ausgliederung in das Register des Sitzes desjenigen Rechtsträgers, dessen Gläubiger sie sind, nach § 19 Abs. 3 UmwG als bekanntgemacht gilt, ihren Anspruch nach Grund und Höhe schriftlich anmelden, Sicherheit zu leisten, soweit sie nicht Befriedigung verlangen können. Dieses Recht steht den Gläubigern jedoch nur zu, wenn sie glaubhaft machen, dass durch die Ausgliederung die Erfüllung ihrer Forderung gefährdet wird."
    },
    {
      "date": "2025-10-07",
      "id": "132836",
      "original_text": "Registerbekanntmachung nach dem Umwandlungsgesetz\nBaden-Württemberg Amtsgericht Stuttgart HRB 761454\nSAMM Holding GmbH – Riederich",
      "type": "Registerbekanntmachung nach dem Umwandlungsgesetz",
      "state": "Baden-Württemberg",
      "amtsgericht": "Amtsgericht Stuttgart",
      "registernummer": "HRB 761454",
      "registerart": "HRB",
      "company_name": "SAMM Holding GmbH",
      "company_seat": "Riederich",
      "details": "07.10.2025 (Bekanntmachungsdatum)\n\nBaden-Württemberg Amtsgericht Stuttgart HRB 761454\nRegisterbekanntmachung nach dem Umwandlungsgesetz 07.10.2025 (Eintragungsdatum)\n\nSAMM Holding GmbH\nGesellschaft mit beschränkter Haftung\nRiederich\n\nAls nicht eingetragen wird bekanntgemacht:\nDen Gläubigern der an der Ausgliederung beteiligten Rechtsträger ist, wenn sie binnen sechs Monaten nach dem Tag, an dem die Eintragung der Ausgliederung in das Register des Sitzes desjenigen Rechtsträgers, dessen Gläubiger sie sind, nach § 19 Abs. 3 UmwG als bekanntgemacht gilt, ihren Anspruch nach Grund und Höhe schriftlich anmelden, Sicherheit zu leisten, soweit sie nicht Befriedigung verlangen können. Dieses Recht steht den Gläubigern jedoch nur zu, wenn sie glaubhaft machen, dass durch die Ausgliederung die Erfüllung ihrer Forderung gefährdet wird."
    },
    {
      "date": "2025-10-07",
      "id": "132837",
      "original_text": "Registerbekanntmachung nach dem Umwandlungsgesetz\nBerlin Amtsgericht Berlin (Charlottenburg) HRB 112926\nKaminski + Brendel Hauptstadtmaler GmbH – Berlin",
      "type": "Registerbekanntmachung nach dem Umwandlungsgesetz",
      "state": "Berlin",
      "amtsgericht": "Amtsgericht Berlin (Charlottenburg)",
      "registernummer": "HRB 112926",
      "registerart": "HRB",
      "company_name": "Kaminski + Brendel Hauptstadtmaler GmbH",
      "company_seat": "Berlin",
      "details": "07.10.2025 (Bekanntmachungsdatum)\n\nBerlin Amtsgericht Berlin (Charlottenburg) HRB 112926\nRegisterbekanntmachung nach dem Umwandlungsgesetz 06.10.2025 (Eintragungsdatum)\n\nKaminski + Brendel Hauptstadtmaler GmbH\nGesellschaft mit beschränkter Haftung\nBerlin\n\nZu Eintragungsnummer 41 vom 06.10.2025 wird als nicht eingetragen veröffentlicht:\n\nDen Gläubigern der an der Spaltung beteiligten Rechtsträger ist, wenn sie binnen sechs Monaten nach dem Tag, an dem die Eintragung der Spaltung in das Register des Sitzes desjenigen Rechtsträgers, dessen Gläubiger sie sind, als bekannt gemacht gilt, ihren Anspruch nach Grund und Höhe schriftlich anmelden, Sicherheit zu leisten, soweit sie nicht Befriedigung verlangen können. Dieses Recht steht den Gläubigern jedoch nur zu, wenn sie glaubhaft machen, dass durch die Spaltung die Erfüllung ihrer Forderung gefährdet wird. Das Recht, Sicherheitsleistung zu verlangen, steht Gläubigern nicht zu, die im Falle der Insolvenz ein Recht auf vorzugsweise Befriedigung aus einer Deckungsmasse haben, die nach gesetzlicher Vorschrift zu ihrem Schutz errichtet und staatlich überwacht ist."
    },
    {
      "date": "2025-10-07",
      "id": "132838",
      "original_text": "Registerbekanntmachung nach dem Umwandlungsgesetz\nSaarland Amtsgericht Saarbrücken HRB 18864\nAHR Betriebsvorrichtungs GmbH – Saarwellingen",
      "type": "Registerbekanntmachung nach dem Umwandlungsgesetz",
      "state": "Saarland",
      "amtsgericht": "Amtsgericht Saarbrücken",
      "registernummer": "HRB 18864",
      "registerart": "HRB",
      "company_name": "AHR Betriebsvorrichtungs GmbH",
      "company_seat": "Saarwellingen",
      "details": "07.10.2025 (Bekanntmachungsdatum)\n\nSaarland Amtsgericht Saarbrücken HRB 18864\nRegisterbekanntmachung nach dem Umwandlungsgesetz 07.10.2025 (Eintragungsdatum)\n\nAHR Betriebsvorrichtungs GmbH\nGesellschaft mit beschränkter Haftung\nSaarwellingen\n\nAls nicht eingetragen wird bekannt gemacht: Den Gläubigern der an der Verschmelzung beteiligten Gesellschaften ist, wenn sie binnen sechs Monaten nach dem Tag, an dem die Eintragung der Verschmelzung in das Register des Sitzes desjenigen Rechtsträgers, dessen Gläubiger sie sind, nach § 19 Absatz 3 UmwG bekannt gemacht worden ist, ihren Anspruch nach Grund und Höhe schriftlich anmelden, Sicherheit zu leisten, soweit sie nicht Befriedigung verlangen können. Dieses Recht steht den Gläubigern jedoch nur zu, wenn sie glaubhaft machen, dass durch die Verschmelzung die Erfüllung ihrer Forderung gefährdet wird."
    },
    {
      "date": "2025-10-07",
      "id": "132839",
      "original_text": "Registerbekanntmachung nach dem Umwandlungsgesetz\nSaarland Amtsgericht Saarbrücken HRB 101087\nAhr Holding GmbH – Saarwellingen",
      "type": "Registerbekanntmachung nach dem Umwandlungsgesetz",
      "state": "Saarland",
      "amtsgericht": "Amtsgericht Saarbrücken",
      "registernummer": "HRB 101087",
      "registerart": "HRB",
      "company_name": "Ahr Holding GmbH",
      "company_seat": "Saarwellingen",
      "details": "07.10.2025 (Bekanntmachungsdatum)\n\nSaarland Amtsgericht Saarbrücken HRB 101087\nRegisterbekanntmachung nach dem Umwandlungsgesetz 07.10.2025 (Eintragungsdatum)\n\nAhr Holding GmbH\nGesellschaft mit beschränkter Haftung\nSaarwellingen\n\nAls nicht eingetragen wird bekannt gemacht: Den Gläubigern der an der Verschmelzung beteiligten Gesellschaften ist, wenn sie binnen sechs Monaten nach dem Tag, an dem die Eintragung der Verschmelzung in das Register des Sitzes desjenigen Rechtsträgers, dessen Gläubiger sie sind, nach § 19 Absatz 3 UmwG bekannt gemacht worden ist, ihren Anspruch nach Grund und Höhe schriftlich anmelden, Sicherheit zu leisten, soweit sie nicht Befriedigung verlangen können. Dieses Recht steht den Gläubigern jedoch nur zu, wenn sie glaubhaft machen, dass durch die Verschmelzung die Erfüllung ihrer Forderung gefährdet wird."
    },
    {
      "date": "2025-10-07",
      "id": "132840",
      "original_text": "Sonstige Registerbekanntmachung\nHamburg Amtsgericht Hamburg HRB 56865\nLufthansa Technik Aktiengesellschaft – Hamburg",
      "type": "Sonstige Registerbekanntmachung",
      "state": "Hamburg",
      "amtsgericht": "Amtsgericht Hamburg",
      "registernummer": "HRB 56865",
      "registerart": "HRB",
      "company_name": "Lufthansa Technik Aktiengesellschaft",
      "company_seat": "Hamburg",
      "details": "07.10.2025 (Bekanntmachungsdatum)\n\nHamburg Amtsgericht Hamburg HRB 56865\nSonstige Registerbekanntmachung\n\nLufthansa Technik Aktiengesellschaft\nAktiengesellschaft\nHamburg\n\nAls nicht eingetragen wird bekannt gemacht: Liste des Aufsichtsrats wurde eingereicht."
    },
    {
      "date": "2025-10-07",
      "id": "132841",
      "original_text": "Löschungsankündigung\nSaarland Amtsgericht Saarbrücken HRB 108403\nINVIDIA Fulfillment GmbH – Schmelz",
      "type": "Löschungsankündigung",
      "state": "Saarland",
      "amtsgericht": "Amtsgericht Saarbrücken",
      "registernummer": "HRB 108403",
      "registerart": "HRB",
      "company_name": "INVIDIA Fulfillment GmbH",
      "company_seat": "Schmelz",
      "details": "07.10.2025 (Bekanntmachungsdatum)\n\nSaarland Amtsgericht Saarbrücken HRB 108403\nLöschungsankündigung\n\nINVIDIA Fulfillment GmbH\nGesellschaft mit beschränkter Haftung\nSchmelz\n\nEs ist beabsichtigt, die Gesellschaft von Amts wegen gemäß § 394 FamFG wegen Vermögenslosigkeit zu löschen.\nGegen die Löschung von Amts wegen ist das Rechtsmittel des Widerspruchs statthaft. Der Widerspruch ist binnen einer Frist zwei Monaten beginnend mit dem Tag dieser Veröffentlichung durch Einreichen eines Widerspruchsschreibens -schriftlich oder zur Niederschrift der Geschäftsstelle beim Amtsgericht Saarbrücken, -zentrales Handelsregister-, Mainzerstr.178, 66121 Saarbrücken einzulegen.\nDer Widerspruch muss die Bezeichnung der angefochtenen Löschungsankündigung enthalten sowie die Erklärung, dass Widerspruch eingelegt wird. Er ist vom Widerspruchsführer oder seinem Bevollmächtigten zu unterzeichnen.\nDas Widerspruchsschreiben kann auch in der Form eines elektronischen Dokumentes eingereicht werden, das mit einer qualifizierten elektronischen Signatur nach dem Signaturgesetz versehen sein muss (§§ 14 Abs. 2 FamFG, 130a, 298 ZPO)."
    },
    {
      "date": "2025-10-07",
      "id": "132842",
      "original_text": "Registerbekanntmachung nach dem Umwandlungsgesetz\nSchleswig-Holstein Amtsgericht Pinneberg HRA 10005\nHarry-Brot Group SE & Co. KG – Schenefeld/Kreis Pinneberg",
      "type": "Registerbekanntmachung nach dem Umwandlungsgesetz",
      "state": "Schleswig-Holstein",
      "amtsgericht": "Amtsgericht Pinneberg",
      "registernummer": "HRA 10005",
      "registerart": "HRA",
      "company_name": "Harry-Brot Group SE & Co. KG",
      "company_seat": "Schenefeld/Kreis Pinneberg",
      "details": "07.10.2025 (Bekanntmachungsdatum)\n\nSchleswig-Holstein Amtsgericht Pinneberg HRA 10005\nRegisterbekanntmachung nach dem Umwandlungsgesetz 01.10.2025 (Eintragungsdatum)\n\nHarry-Brot Group SE & Co. KG\nKommanditgesellschaft\nSchenefeld/Kreis Pinneberg\n\nZu Eintragungsnummer 2 vom 01.10.2025 wird als nicht eingetragen veröffentlicht: Den Gläubigern der an der Spaltung beteiligten Rechtsträger ist, wenn sie binnen sechs Monaten nach dem Tag, an dem die Eintragung der Spaltung in das Register des Sitzes desjenigen Rechtsträgers, dessen Gläubiger sie sind, als bekannt gemacht gilt, ihren Anspruch nach Grund und Höhe schriftlich anmelden, Sicherheit zu leisten, soweit sie nicht Befriedigung verlangen können. Dieses Recht steht den Gläubigern jedoch nur zu, wenn sie glaubhaft machen, dass durch die Spaltung die Erfüllung ihrer Forderung gefährdet wird. Das Recht, Sicherheitsleistung zu verlangen, steht Gläubigern nicht zu, die im Falle der Insolvenz ein Recht auf vorzugsweise Befriedigung aus einer Deckungsmasse haben, die nach gesetzlicher Vorschrift zu ihrem Schutz errichtet und staatlich überwacht ist."
    },
    {
      "date": "2025-10-07",
      "id": "132843",
      "original_text": "Registerbekanntmachung nach dem Umwandlungsgesetz\nHamburg Amtsgericht Hamburg HRB 191877\nBaxter & Larsen media UG (haftungsbeschränkt) – Hamburg",
      "type": "Registerbekanntmachung nach dem Umwandlungsgesetz",
      "state": "Hamburg",
      "amtsgericht": "Amtsgericht Hamburg",
      "registernummer": "HRB 191877",
      "registerart": "HRB",
      "company_name": "Baxter & Larsen media UG (haftungsbeschränkt)",
      "company_seat": "Hamburg",
      "details": "07.10.2025 (Bekanntmachungsdatum)\n\nHamburg Amtsgericht Hamburg HRB 191877\nRegisterbekanntmachung nach dem Umwandlungsgesetz 07.10.2025 (Eintragungsdatum)\n\nBaxter & Larsen media UG (haftungsbeschränkt)\nGesellschaft mit beschränkter Haftung\nHamburg\n\nAls nicht eingetragen wird bekannt gemacht:\nDen Gläubigern der an der Verschmelzung beteiligten Gesellschaften ist, wenn sie binnen sechs Monaten nach dem Tag, an dem die Eintragung der Verschmelzung in das Register des Sitzes desjenigen Rechtsträgers, dessen Gläubiger sie sind, nach § 19 Absatz 3 UmwG als bekannt gemacht gilt, ihren Anspruch nach Grund und Höhe schriftlich anmelden, Sicherheit zu leisten, soweit sie nicht Befriedigung verlangen können. Dieses Recht steht den Gläubigern jedoch nur zu, wenn sie glaubhaft machen, dass durch die Verschmelzung die Erfüllung ihrer Forderung gefährdet wird."
    },
    {
      "date": "2025-10-07",
      "id": "132844",
      "original_text": "Registerbekanntmachung nach dem Umwandlungsgesetz\nHamburg Amtsgericht Hamburg HRB 191039\nRhythm of Time GmbH – Hamburg",
      "type": "Registerbekanntmachung nach dem Umwandlungsgesetz",
      "state": "Hamburg",
      "amtsgericht": "Amtsgericht Hamburg",
      "registernummer": "HRB 191039",
      "registerart": "HRB",
      "company_name": "Rhythm of Time GmbH",
      "company_seat": "Hamburg",
      "details": "07.10.2025 (Bekanntmachungsdatum)\n\nHamburg Amtsgericht Hamburg HRB 191039\nRegisterbekanntmachung nach dem Umwandlungsgesetz 07.10.2025 (Eintragungsdatum)\n\nRhythm of Time GmbH\nGesellschaft mit beschränkter Haftung\nHamburg\n\nAls nicht eingetragen wird bekannt gemacht:\nDen Gläubigern der an der Verschmelzung beteiligten Gesellschaften ist, wenn sie binnen sechs Monaten nach dem Tag, an dem die Eintragung der Verschmelzung in das Register des Sitzes desjenigen Rechtsträgers, dessen Gläubiger sie sind, nach § 19 Absatz 3 UmwG als bekannt gemacht gilt, ihren Anspruch nach Grund und Höhe schriftlich anmelden, Sicherheit zu leisten, soweit sie nicht Befriedigung verlangen können. Dieses Recht steht den Gläubigern jedoch nur zu, wenn sie glaubhaft machen, dass durch die Verschmelzung die Erfüllung ihrer Forderung gefährdet wird."
    },
    {
      "date": "2025-10-07",
      "id": "132845",
      "original_text": "Registerbekanntmachung nach dem Umwandlungsgesetz\nHamburg Amtsgericht Hamburg HRA 126462\nEvoco G Invest GmbH & Co. KG – Hamburg",
      "type": "Registerbekanntmachung nach dem Umwandlungsgesetz",
      "state": "Hamburg",
      "amtsgericht": "Amtsgericht Hamburg",
      "registernummer": "HRA 126462",
      "registerart": "HRA",
      "company_name": "Evoco G Invest GmbH & Co. KG",
      "company_seat": "Hamburg",
      "details": "07.10.2025 (Bekanntmachungsdatum)\n\nHamburg Amtsgericht Hamburg HRA 126462\nRegisterbekanntmachung nach dem Umwandlungsgesetz 07.10.2025 (Eintragungsdatum)\n\nEvoco G Invest GmbH & Co. KG\nKommanditgesellschaft\nHamburg\n\nAls nicht eingetragen wird bekannt gemacht:\nDen Gläubigern der an der Verschmelzung beteiligten Gesellschaften ist, wenn sie binnen sechs Monaten nach dem Tag, an dem die Eintragung der Verschmelzung in das Register des Sitzes desjenigen Rechtsträgers, dessen Gläubiger sie sind, nach § 19 Absatz 3 UmwG als bekannt gemacht gilt, ihren Anspruch nach Grund und Höhe schriftlich anmelden, Sicherheit zu leisten, soweit sie nicht Befriedigung verlangen können. Dieses Recht steht den Gläubigern jedoch nur zu, wenn sie glaubhaft machen, dass durch die Verschmelzung die Erfüllung ihrer Forderung gefährdet wird."
    },
    {
      "date": "2025-10-07",
      "id": "132846",
      "original_text": "Registerbekanntmachung nach dem Umwandlungsgesetz\nBaden-Württemberg Amtsgericht Stuttgart VR 726954\nlndustrieverein für den Raum Backnang e.V. – Backnang",
      "type": "Registerbekanntmachung nach dem Umwandlungsgesetz",
      "state": "Baden-Württemberg",
      "amtsgericht": "Amtsgericht Stuttgart",
      "registernummer": "VR 726954",
      "registerart": "VR",
      "company_name": "lndustrieverein für den Raum Backnang e.V.",
      "company_seat": "Backnang",
      "details": "07.10.2025 (Bekanntmachungsdatum)\n\nBaden-Württemberg Amtsgericht Stuttgart VR 726954\nRegisterbekanntmachung nach dem Umwandlungsgesetz 07.10.2025 (Eintragungsdatum)\n\nlndustrieverein für den Raum Backnang e.V.\neingetragener Verein\nBacknang\n\nAls nicht eingetragen wird bekanntgemacht:\nDen Gläubigern der an der Verschmelzung beteiligten Rechtsträger ist, wenn sie binnen sechs Monaten nach dem Tag, an dem die Eintragung der Verschmelzung in das Register des Sitzes desjenigen Rechtsträgers, dessen Gläubiger sie sind, nach § 19 Abs. 3 UmwG als bekanntgemacht gilt, ihren Anspruch nach Grund und Höhe schriftlich anmelden, Sicherheit zu leisten, soweit sie nicht Befriedigung verlangen können. Dieses Recht steht den Gläubigern jedoch nur zu, wenn sie glaubhaft machen, dass durch die Verschmelzung die Erfüllung ihrer Forderung gefährdet wird."
    },
    {
      "date": "2025-10-07",
      "id": "132847",
      "original_text": "Registerbekanntmachung nach dem Umwandlungsgesetz\nSachsen-Anhalt Amtsgericht Stendal HRB 36538\nAgrargesellschaft Schönfeld mbH – Schönfeld",
      "type": "Registerbekanntmachung nach dem Umwandlungsgesetz",
      "state": "Sachsen-Anhalt",
      "amtsgericht": "Amtsgericht Stendal",
      "registernummer": "HRB 36538",
      "registerart": "HRB",
      "company_name": "Agrargesellschaft Schönfeld mbH",
      "company_seat": "Schönfeld",
      "details": "07.10.2025 (Bekanntmachungsdatum)\n\nSachsen-Anhalt Amtsgericht Stendal HRB 36538\nRegisterbekanntmachung nach dem Umwandlungsgesetz 07.10.2025 (Eintragungsdatum)\n\nAgrargesellschaft Schönfeld mbH\nGesellschaft mit beschränkter Haftung\nSchönfeld\n\nEntstanden durch formwechselnde Umwandlung der Agrargenossenschaft Schönfeld eG mit dem Sitz in Schönfeld  (Amtsgericht Stendal GnR 62).Nicht eingetragen:Den Gläubigern des formwechselnden  Rechtsträgers, ist wenn sie binnen sechs Monaten nach dem Tag, an dem die Eintragung des Formwechsels nach § 201 UmwG als bekanntgemacht gilt, ihren Anspruch nach Grund und Höhe schriftlich anmelden, Sicherheit zu leisten, soweit sie nicht Befriedigung verlangen können. Dieses Recht steht ihnen jedoch nur zu, wenn sie glaubhaft machen, dass durch den Formwechsel die Erfüllung ihrer Forderung gefährdet wird."
    },
    {
      "date": "2025-10-07",
      "id": "132848",
      "original_text": "Registerbekanntmachung nach dem Umwandlungsgesetz\nSachsen-Anhalt Amtsgericht Stendal GnR 62\nAgrargenossenschaft Schönfeld eG – Schönfeld",
      "type": "Registerbekanntmachung nach dem Umwandlungsgesetz",
      "state": "Sachsen-Anhalt",
      "amtsgericht": "Amtsgericht Stendal",
      "registernummer": "GnR 62",
      "registerart": "GnR",
      "company_name": "Agrargenossenschaft Schönfeld eG",
      "company_seat": "Schönfeld",
      "details": "07.10.2025 (Bekanntmachungsdatum)\n\nSachsen-Anhalt Amtsgericht Stendal GnR 62\nRegisterbekanntmachung nach dem Umwandlungsgesetz 07.10.2025 (Eintragungsdatum)\n\nAgrargenossenschaft Schönfeld eG\neingetragene Genossenschaft\nSchönfeld\n\nNicht eingetragen:\nDen Gläubigern des formwechselnden  Rechtsträgers, ist wenn sie binnen sechs Monaten nach dem Tag, an dem die Eintragung des Formwechsels nach § 201 UmwG als bekanntgemacht gilt, ihren Anspruch nach Grund und Höhe schriftlich anmelden, Sicherheit zu leisten, soweit sie nicht Befriedigung verlangen können. Dieses Recht steht ihnen jedoch nur zu, wenn sie glaubhaft machen, dass durch den Formwechsel die Erfüllung ihrer Forderung gefährdet wird."
    },
    {
      "date": "2025-10-07",
      "id": "132849",
      "original_text": "Registerbekanntmachung nach dem Umwandlungsgesetz\nHamburg Amtsgericht Hamburg HRB 30468\nALD AutoLeasing D GmbH – Hamburg",
      "type": "Registerbekanntmachung nach dem Umwandlungsgesetz",
      "state": "Hamburg",
      "amtsgericht": "Amtsgericht Hamburg",
      "registernummer": "HRB 30468",
      "registerart": "HRB",
      "company_name": "ALD AutoLeasing D GmbH",
      "company_seat": "Hamburg",
      "details": "07.10.2025 (Bekanntmachungsdatum)\n\nHamburg Amtsgericht Hamburg HRB 30468\nRegisterbekanntmachung nach dem Umwandlungsgesetz 01.10.2025 (Eintragungsdatum)\n\nALD AutoLeasing D GmbH\nGesellschaft mit beschränkter Haftung\nHamburg\n\nAls nicht eingetragen wird bekannt gemacht:\nDen Gläubigern der an der Verschmelzung beteiligten Gesellschaften ist, wenn sie binnen sechs Monaten nach dem Tag, an dem die Eintragung der Verschmelzung in das Register des Sitzes desjenigen Rechtsträgers, dessen Gläubiger sie sind, nach § 19 Absatz 3 UmwG als bekannt gemacht gilt, ihren Anspruch nach Grund und Höhe schriftlich anmelden, Sicherheit zu leisten, soweit sie nicht Befriedigung verlangen können. Dieses Recht steht den Gläubigern jedoch nur zu, wenn sie glaubhaft machen, dass durch die Verschmelzung die Erfüllung ihrer Forderung gefährdet wird."
    },
    {
      "date": "2025-10-07",
      "id": "132850",
      "original_text": "Registerbekanntmachung nach dem Umwandlungsgesetz\nBaden-Württemberg Amtsgericht Mannheim HRB 7401\nSchollmeier GmbH – Mannheim",
      "type": "Registerbekanntmachung nach dem Umwandlungsgesetz",
      "state": "Baden-Württemberg",
      "amtsgericht": "Amtsgericht Mannheim",
      "registernummer": "HRB 7401",
      "registerart": "HRB",
      "company_name": "Schollmeier GmbH",
      "company_seat": "Mannheim",
      "details": "07.10.2025 (Bekanntmachungsdatum)\n\nBaden-Württemberg Amtsgericht Mannheim HRB 7401\nRegisterbekanntmachung nach dem Umwandlungsgesetz 07.10.2025 (Eintragungsdatum)\n\nSchollmeier GmbH\nGesellschaft mit beschränkter Haftung\nMannheim\n\nAls nicht eingetragen wird bekanntgemacht:\nDen Gläubigern der an der Verschmelzung beteiligten Rechtsträger ist, wenn sie binnen sechs Monaten nach dem Tag, an dem die Eintragung der Verschmelzung in das Register des Sitzes desjenigen Rechtsträgers, dessen Gläubiger sie sind, nach § 19 Abs. 3 UmwG als bekanntgemacht gilt, ihren Anspruch nach Grund und Höhe schriftlich anmelden, Sicherheit zu leisten, soweit sie nicht Befriedigung verlangen können. Dieses Recht steht den Gläubigern jedoch nur zu, wenn sie glaubhaft machen, dass durch die Verschmelzung die Erfüllung ihrer Forderung gefährdet wird."
    },
    {
      "date": "2025-10-07",
      "id": "132851",
      "original_text": "Einreichung neuer Dokumente\nHamburg Amtsgericht Hamburg HRB 184303\nSTERNPARTNER Management SE – Hamburg",
      "type": "Einreichung neuer Dokumente",
      "state": "Hamburg",
      "amtsgericht": "Amtsgericht Hamburg",
      "registernummer": "HRB 184303",
      "registerart": "HRB",
      "company_name": "STERNPARTNER Management SE",
      "company_seat": "Hamburg",
      "details": "07.10.2025 (Bekanntmachungsdatum)\n\nHamburg Amtsgericht Hamburg HRB 184303\nEinreichung neuer Dokumente 05.09.2025 (Eintragungsdatum)\n\nSTERNPARTNER Management SE\nEuropäische Aktiengesellschaft (SE)\nHamburg\n\nAls nicht eingetragen wird bekannt gemacht: Liste des Aufsichtsrats wurde eingereicht."
    },
    {
      "date": "2025-10-07",
      "id": "132852",
      "original_text": "Registerbekanntmachung nach dem Umwandlungsgesetz\nBaden-Württemberg Amtsgericht Mannheim HRA 712486\nSchollmeier ITK GmbH & Co. KG – Mannheim",
      "type": "Registerbekanntmachung nach dem Umwandlungsgesetz",
      "state": "Baden-Württemberg",
      "amtsgericht": "Amtsgericht Mannheim",
      "registernummer": "HRA 712486",
      "registerart": "HRA",
      "company_name": "Schollmeier ITK GmbH & Co. KG",
      "company_seat": "Mannheim",
      "details": "07.10.2025 (Bekanntmachungsdatum)\n\nBaden-Württemberg Amtsgericht Mannheim HRA 712486\nRegisterbekanntmachung nach dem Umwandlungsgesetz 07.10.2025 (Eintragungsdatum)\n\nSchollmeier ITK GmbH & Co. KG\nKommanditgesellschaft\nMannheim\n\nAls nicht eingetragen wird bekanntgemacht:\nDen Gläubigern der an der Verschmelzung beteiligten Rechtsträger ist, wenn sie binnen sechs Monaten nach dem Tag, an dem die Eintragung der Verschmelzung in das Register des Sitzes desjenigen Rechtsträgers, dessen Gläubiger sie sind, nach § 19 Abs. 3 UmwG als bekanntgemacht gilt, ihren Anspruch nach Grund und Höhe schriftlich anmelden, Sicherheit zu leisten, soweit sie nicht Befriedigung verlangen können. Dieses Recht steht den Gläubigern jedoch nur zu, wenn sie glaubhaft machen, dass durch die Verschmelzung die Erfüllung ihrer Forderung gefährdet wird."
    },
    {
      "date": "2025-10-07",
      "id": "132853",
      "original_text": "Registerbekanntmachung nach dem Umwandlungsgesetz\nBaden-Württemberg Amtsgericht Freiburg HRB 723040\nWacker Projekt GmbH – Offenburg",
      "type": "Registerbekanntmachung nach dem Umwandlungsgesetz",
      "state": "Baden-Württemberg",
      "amtsgericht": "Amtsgericht Freiburg",
      "registernummer": "HRB 723040",
      "registerart": "HRB",
      "company_name": "Wacker Projekt GmbH",
      "company_seat": "Offenburg",
      "details": "07.10.2025 (Bekanntmachungsdatum)\n\nBaden-Württemberg Amtsgericht Freiburg HRB 723040\nRegisterbekanntmachung nach dem Umwandlungsgesetz 07.10.2025 (Eintragungsdatum)\n\nWacker Projekt GmbH\nGesellschaft mit beschränkter Haftung\nOffenburg\n\nAls nicht eingetragen wird bekanntgemacht:\nDen Gläubigern der an der Verschmelzung beteiligten Rechtsträger ist, wenn sie binnen sechs Monaten nach dem Tag, an dem die Eintragung der Verschmelzung in das Register des Sitzes desjenigen Rechtsträgers, dessen Gläubiger sie sind, nach § 19 Abs. 3 UmwG als bekanntgemacht gilt, ihren Anspruch nach Grund und Höhe schriftlich anmelden, Sicherheit zu leisten, soweit sie nicht Befriedigung verlangen können. Dieses Recht steht den Gläubigern jedoch nur zu, wenn sie glaubhaft machen, dass durch die Verschmelzung die Erfüllung ihrer Forderung gefährdet wird."
    },
    {
      "date": "2025-10-07",
      "id": "132854",
      "original_text": "Registerbekanntmachung nach dem Umwandlungsgesetz\nSchleswig-Holstein Amtsgericht Lübeck HRB 18470\nSchmelzer Hörsysteme Stormarn GmbH – Ahrensburg",
      "type": "Registerbekanntmachung nach dem Umwandlungsgesetz",
      "state": "Schleswig-Holstein",
      "amtsgericht": "Amtsgericht Lübeck",
      "registernummer": "HRB 18470",
      "registerart": "HRB",
      "company_name": "Schmelzer Hörsysteme Stormarn GmbH",
      "company_seat": "Ahrensburg",
      "details": "07.10.2025 (Bekanntmachungsdatum)\n\nSchleswig-Holstein Amtsgericht Lübeck HRB 18470\nRegisterbekanntmachung nach dem Umwandlungsgesetz 06.10.2025 (Eintragungsdatum)\n\nSchmelzer Hörsysteme Stormarn GmbH\nGesellschaft mit beschränkter Haftung\nAhrensburg\n\nZu Eintragungsnummer 6 vom 06.10.2025 wird als nicht eingetragen veröffentlicht:  Als nicht eingetragen wird veröffentlicht: Den Gläubigern der an der Verschmelzung beteiligten Rechtsträger ist, wenn sie binnen sechs Monaten nach dem Tag, an dem die Eintragung der Verschmelzung in das Register des Sitzes desjenigen Rechtsträgers, dessen Gläubiger sie sind, als bekannt gemacht gilt, ihren Anspruch nach Grund und Höhe schriftlich anmelden, Sicherheit zu leisten, soweit sie nicht Befriedigung verlangen können. Dieses Recht steht den Gläubigern jedoch nur zu, wenn sie glaubhaft machen, dass durch die Verschmelzung die Erfüllung ihrer Forderung gefährdet wird."
    },
    {
      "date": "2025-10-07",
      "id": "132855",
      "original_text": "Registerbekanntmachung nach dem Umwandlungsgesetz\nBaden-Württemberg Amtsgericht Freiburg HRB 470416\nWacker Invest GmbH – Offenburg",
      "type": "Registerbekanntmachung nach dem Umwandlungsgesetz",
      "state": "Baden-Württemberg",
      "amtsgericht": "Amtsgericht Freiburg",
      "registernummer": "HRB 470416",
      "registerart": "HRB",
      "company_name": "Wacker Invest GmbH",
      "company_seat": "Offenburg",
      "details": "07.10.2025 (Bekanntmachungsdatum)\n\nBaden-Württemberg Amtsgericht Freiburg HRB 470416\nRegisterbekanntmachung nach dem Umwandlungsgesetz 07.10.2025 (Eintragungsdatum)\n\nWacker Invest GmbH\nGesellschaft mit beschränkter Haftung\nOffenburg\n\nAls nicht eingetragen wird bekanntgemacht:\nDen Gläubigern der an der Verschmelzung beteiligten Rechtsträger ist, wenn sie binnen sechs Monaten nach dem Tag, an dem die Eintragung der Verschmelzung in das Register des Sitzes desjenigen Rechtsträgers, dessen Gläubiger sie sind, nach § 19 Abs. 3 UmwG als bekanntgemacht gilt, ihren Anspruch nach Grund und Höhe schriftlich anmelden, Sicherheit zu leisten, soweit sie nicht Befriedigung verlangen können. Dieses Recht steht den Gläubigern jedoch nur zu, wenn sie glaubhaft machen, dass durch die Verschmelzung die Erfüllung ihrer Forderung gefährdet wird."
    },
    {
      "date": "2025-10-07",
      "id": "132856",
      "original_text": "Registerbekanntmachung nach dem Umwandlungsgesetz\nBrandenburg Amtsgericht Potsdam HRA 8765\nKai-Uwe Störig e.K. – Stahnsdorf",
      "type": "Registerbekanntmachung nach dem Umwandlungsgesetz",
      "state": "Brandenburg",
      "amtsgericht": "Amtsgericht Potsdam",
      "registernummer": "HRA 8765",
      "registerart": "HRA",
      "company_name": "Kai-Uwe Störig e.K.",
      "company_seat": "Stahnsdorf",
      "details": "07.10.2025 (Bekanntmachungsdatum)\n\nBrandenburg Amtsgericht Potsdam HRA 8765\nRegisterbekanntmachung nach dem Umwandlungsgesetz 06.10.2025 (Eintragungsdatum)\n\nKai-Uwe Störig e.K.\nEinzelkaufmann / Einzelkauffrau\nStahnsdorf\n\nZu Eintragungsnummer 3 vom 06.10.2025 wird als nicht eingetragen veröffentlicht: Den Gläubigern der an der Ausgliederung beteiligten Rechtsträger ist, wenn sie binnen sechs Monaten nach dem Tag, an dem die Eintragung der Ausgliederung in das Register des Sitzes desjenigen Rechtsträgers, dessen Gläubiger sie sind, als bekannt gemacht gilt, ihren Anspruch nach Grund und Höhe schriftlich anmelden, Sicherheit zu leisten, soweit sie nicht Befriedigung verlangen können. Dieses Recht steht den Gläubigern jedoch nur zu, wenn sie glaubhaft machen, dass durch die Ausgliederung die Erfüllung ihrer Forderung gefährdet wird"
    },
    {
      "date": "2025-10-07",
      "id": "132857",
      "original_text": "Sonstige Registerbekanntmachung\nSachsen-Anhalt Amtsgericht Stendal GnR 1052\nAgrargenossenschaft Zörbig e.G. – Zörbig",
      "type": "Sonstige Registerbekanntmachung",
      "state": "Sachsen-Anhalt",
      "amtsgericht": "Amtsgericht Stendal",
      "registernummer": "GnR 1052",
      "registerart": "GnR",
      "company_name": "Agrargenossenschaft Zörbig e.G.",
      "company_seat": "Zörbig",
      "details": "07.10.2025 (Bekanntmachungsdatum)\n\nSachsen-Anhalt Amtsgericht Stendal GnR 1052\nSonstige Registerbekanntmachung 07.10.2025 (Eintragungsdatum)\n\nAgrargenossenschaft Zörbig e.G.\neingetragene Genossenschaft\nZörbig\n\nAls nicht eingetragen wird veröffentlicht:\nDer Geschäftsanteil beträgt 204,50 Euro.\nDen Gläubigern der Genossenschaft ist, wenn sie sich binnen 6 Monaten nach der Bekanntmachung bei der Genossenschaft zu diesem Zweck melden, Sicherheit zu leisten, soweit sie nicht Befriedigung verlangen können (§ 22 Abs. 1 bis 3 GenG)."
    },
    {
      "date": "2025-10-07",
      "id": "132858",
      "original_text": "Registerbekanntmachung nach dem Umwandlungsgesetz\nSchleswig-Holstein Amtsgericht Lübeck HRB 14828\nSchmelzer Hörsysteme in Bargteheide GmbH – Bargteheide",
      "type": "Registerbekanntmachung nach dem Umwandlungsgesetz",
      "state": "Schleswig-Holstein",
      "amtsgericht": "Amtsgericht Lübeck",
      "registernummer": "HRB 14828",
      "registerart": "HRB",
      "company_name": "Schmelzer Hörsysteme in Bargteheide GmbH",
      "company_seat": "Bargteheide",
      "details": "07.10.2025 (Bekanntmachungsdatum)\n\nSchleswig-Holstein Amtsgericht Lübeck HRB 14828\nRegisterbekanntmachung nach dem Umwandlungsgesetz 06.10.2025 (Eintragungsdatum)\n\nSchmelzer Hörsysteme in Bargteheide GmbH\nGesellschaft mit beschränkter Haftung\nBargteheide\n\nZu Eintragungsnummer 4 vom 06.10.2025 wird als nicht eingetragen veröffentlicht:  Als nicht eingetragen wird veröffentlicht: Den Gläubigern der an der Verschmelzung beteiligten Rechtsträger ist, wenn sie binnen sechs Monaten nach dem Tag, an dem die Eintragung der Verschmelzung in das Register des Sitzes desjenigen Rechtsträgers, dessen Gläubiger sie sind, als bekannt gemacht gilt, ihren Anspruch nach Grund und Höhe schriftlich anmelden, Sicherheit zu leisten, soweit sie nicht Befriedigung verlangen können. Dieses Recht steht den Gläubigern jedoch nur zu, wenn sie glaubhaft machen, dass durch die Verschmelzung die Erfüllung ihrer Forderung gefährdet wird."
    },
    {
      "date": "2025-10-07",
      "id": "132859",
      "original_text": "Einreichung neuer Dokumente\nBerlin Amtsgericht Berlin (Charlottenburg) HRB 230153\nVOQUZ Labs Aktiengesellschaft – Berlin",
      "type": "Einreichung neuer Dokumente",
      "state": "Berlin",
      "amtsgericht": "Amtsgericht Berlin (Charlottenburg)",
      "registernummer": "HRB 230153",
      "registerart": "HRB",
      "company_name": "VOQUZ Labs Aktiengesellschaft",
      "company_seat": "Berlin",
      "details": "07.10.2025 (Bekanntmachungsdatum)\n\nBerlin Amtsgericht Berlin (Charlottenburg) HRB 230153\nEinreichung neuer Dokumente\n\nVOQUZ Labs Aktiengesellschaft\nAktiengesellschaft\nBerlin\n\nAls nicht eingetragen wird veröffentlicht: Es wurde eine neue Liste der Aufsichtsratsmitglieder eingereicht (§ 106 AktG)."
    },
    {
      "date": "2025-10-07",
      "id": "132860",
      "original_text": "Registerbekanntmachung nach dem Umwandlungsgesetz\nNordrhein-Westfalen Amtsgericht Coesfeld HRA 7271\nHermit Vermögensverwaltungs GmbH & Co. KG – Billerbeck",
      "type": "Registerbekanntmachung nach dem Umwandlungsgesetz",
      "state": "Nordrhein-Westfalen",
      "amtsgericht": "Amtsgericht Coesfeld",
      "registernummer": "HRA 7271",
      "registerart": "HRA",
      "company_name": "Hermit Vermögensverwaltungs GmbH & Co. KG",
      "company_seat": "Billerbeck",
      "details": "07.10.2025 (Bekanntmachungsdatum)\n\nNordrhein-Westfalen Amtsgericht Coesfeld HRA 7271\nRegisterbekanntmachung nach dem Umwandlungsgesetz 07.10.2025 (Eintragungsdatum)\n\nHermit Vermögensverwaltungs GmbH & Co. KG\nKommanditgesellschaft\nBillerbeck\n\nDen Gläubigern des an dem Formwechsel beteiligten Rechtsträgers ist, wenn sie binnen sechs Monaten nach dem Tag, an dem die Eintragung des Formwechsels in das Register des Sitzes desjenigen Rechtsträgers, dessen Gläubiger sie sind, nach § 19 Absatz 3 UmwG als bekanntgemacht gilt, ihren Anspruch nach Grund und Höhe schriftlich anmelden, Sicherheit zu leisten, soweit sie nicht Befriedigung verlangen können. Dieses Recht steht den Gläubigern jedoch nur zu, wenn sie glaubhaft machen, dass durch den Formwechsel die Erfüllung ihrer Forderung gefährdet wird."
    },
    {
      "date": "2025-10-07",
      "id": "132861",
      "original_text": "Registerbekanntmachung nach dem Umwandlungsgesetz\nBaden-Württemberg Amtsgericht Freiburg HRB 705638\nOSYPKA AG – Rheinfelden Baden",
      "type": "Registerbekanntmachung nach dem Umwandlungsgesetz",
      "state": "Baden-Württemberg",
      "amtsgericht": "Amtsgericht Freiburg",
      "registernummer": "HRB 705638",
      "registerart": "HRB",
      "company_name": "OSYPKA AG",
      "company_seat": "Rheinfelden Baden",
      "details": "07.10.2025 (Bekanntmachungsdatum)\n\nBaden-Württemberg Amtsgericht Freiburg HRB 705638\nRegisterbekanntmachung nach dem Umwandlungsgesetz 07.10.2025 (Eintragungsdatum)\n\nOSYPKA AG\nAktiengesellschaft\nRheinfelden Baden\n\nAls nicht eingetragen wird bekanntgemacht:\nDen Gläubigern des an dem Formwechsel beteiligten Rechtsträgers ist, wenn sie binnen sechs Monaten nach dem Tag, an dem die Eintragung des Formwechsels in das Register des Sitzes desjenigen Rechtsträgers, dessen Gläubiger sie sind, nach § 19 Abs. 3 UmwG als bekanntgemacht gilt, ihren Anspruch nach Grund und Höhe schriftlich anmelden, Sicherheit zu leisten, soweit sie nicht Befriedigung verlangen können. Dieses Recht steht den Gläubigern jedoch nur zu, wenn sie glaubhaft machen, dass durch den Formwechsel die Erfüllung ihrer Forderung gefährdet wird."
    },
    {
      "date": "2025-10-07",
      "id": "132862",
      "original_text": "Sonstige Registerbekanntmachung\nBerlin Amtsgericht Berlin (Charlottenburg) HRB 192448\nIDEAL Beteiligungen AG – Berlin",
      "type": "Sonstige Registerbekanntmachung",
      "state": "Berlin",
      "amtsgericht": "Amtsgericht Berlin (Charlottenburg)",
      "registernummer": "HRB 192448",
      "registerart": "HRB",
      "company_name": "IDEAL Beteiligungen AG",
      "company_seat": "Berlin",
      "details": "07.10.2025 (Bekanntmachungsdatum)\n\nBerlin Amtsgericht Berlin (Charlottenburg) HRB 192448\nSonstige Registerbekanntmachung 06.10.2025 (Eintragungsdatum)\n\nIDEAL Beteiligungen AG\nAktiengesellschaft\nBerlin\n\nAls nicht eingetragen wird veröffentlicht: Nicht mehr Vorstand: 3. Fritscher, Karlheinz Vorstand: 8. Schwetlik, Marc, *21.04.1970, Köln"
    },
    {
      "date": "2025-10-07",
      "id": "132863",
      "original_text": "Registerbekanntmachung nach dem Umwandlungsgesetz\nSachsen-Anhalt Amtsgericht Stendal HRB 17243\nIMMONAS GmbH – Tangerhütte",
      "type": "Registerbekanntmachung nach dem Umwandlungsgesetz",
      "state": "Sachsen-Anhalt",
      "amtsgericht": "Amtsgericht Stendal",
      "registernummer": "HRB 17243",
      "registerart": "HRB",
      "company_name": "IMMONAS GmbH",
      "company_seat": "Tangerhütte",
      "details": "07.10.2025 (Bekanntmachungsdatum)\n\nSachsen-Anhalt Amtsgericht Stendal HRB 17243\nRegisterbekanntmachung nach dem Umwandlungsgesetz\n\nIMMONAS GmbH\nGesellschaft mit beschränkter Haftung\nTangerhütte\n\nDie Gesellschaft hat im Wege der Ausgliederung aus dem Vermögen des Inhabes Heiko Specht, Tangerhütte, *27.02.1973, das von ihm betriebene Unternehmen \"SPECHT Versicherungsmakler e.K.\" mit Niederlassung in Tangerhütte (Amtsgericht Stendal HRA 8289) gemäß Ausgliederungsvertrag vom 19.08.2025 mit Nachtrag vom 28.08.2025 sowie Beschluss ihrer Gesellschafterversammlung vom 19.08.2025 übernommen. Die Ausgliederung ist am 07.10.2025 durch Eintragung der Ausgliederung in das Register des übertragenden Rechtsträgers wirksam geworden. Nicht eingetragen: Den Gläubigern der an der Ausgliederung beteiligten Rechtsträger, ist wenn sie binnen sechs Monaten nach dem Tag, an dem die Eintragung der Ausgliederung nach §§125, 19 Abs. 3 UmwG als bekanntgemacht gilt, ihren Anspruch nach Grund und Höhe schriftlich anmelden, Sicherheit zu leisten, soweit sie nicht Befriedigung verlangen können. Diese Recht steht ihnen jedoch nur zu, wenn sie glaubhaft machen, dass durch die Ausgliederung die Erfüllung ihrer Forderung gefährdet wird."
    },
    {
      "date": "2025-10-07",
      "id": "132864",
      "original_text": "Registerbekanntmachung nach dem Umwandlungsgesetz\nSachsen-Anhalt Amtsgericht Stendal HRA 8289\nSPECHT Versicherungsmakler e.K – Tangerhütte",
      "type": "Registerbekanntmachung nach dem Umwandlungsgesetz",
      "state": "Sachsen-Anhalt",
      "amtsgericht": "Amtsgericht Stendal",
      "registernummer": "HRA 8289",
      "registerart": "HRA",
      "company_name": "SPECHT Versicherungsmakler e.K",
      "company_seat": "Tangerhütte",
      "details": "07.10.2025 (Bekanntmachungsdatum)\n\nSachsen-Anhalt Amtsgericht Stendal HRA 8289\nRegisterbekanntmachung nach dem Umwandlungsgesetz 07.10.2025 (Eintragungsdatum)\n\nSPECHT Versicherungsmakler e.K\nEinzelkaufmann / Einzelkauffrau\nTangerhütte\n\nNicht eingetragen:\nDen Gläubigern der an der Ausgliederung beteiligten Rechtsträger ist, wenn sie binnen sechs Monaten nach dem Tag, an dem die Eintragung der Ausgliederung nach §§125, 19 Abs. 3 UmwG als bekanntgemacht gilt, ihren Anspruch nach Grund und Höhe schriftlich anmelden, Sicherheit zu leisten, soweit sie nicht Befriedigung verlangen können. Diese Recht steht ihnen jedoch nur zu, wenn sie glaubhaft machen, dass durch die Ausgliederung die Erfüllung ihrer Forderung gefährdet wird."
    },
    {
      "date": "2025-10-07",
      "id": "132866",
      "original_text": "Registerbekanntmachung nach dem Umwandlungsgesetz\nHamburg Amtsgericht Hamburg HRB 71940\nOVC Venture Capital GmbH – Hamburg",
      "type": "Registerbekanntmachung nach dem Umwandlungsgesetz",
      "state": "Hamburg",
      "amtsgericht": "Amtsgericht Hamburg",
      "registernummer": "HRB 71940",
      "registerart": "HRB",
      "company_name": "OVC Venture Capital GmbH",
      "company_seat": "Hamburg",
      "details": "07.10.2025 (Bekanntmachungsdatum)\n\nHamburg Amtsgericht Hamburg HRB 71940\nRegisterbekanntmachung nach dem Umwandlungsgesetz 07.10.2025 (Eintragungsdatum)\n\nOVC Venture Capital GmbH\nGesellschaft mit beschränkter Haftung\nHamburg\n\nAls nicht eingetragen wird bekannt gemacht:\nDen Gläubigern der an der Abspaltung beteiligten Gesellschaften ist, wenn sie binnen sechs Monaten nach dem Tag, an dem die Eintragung der Abspaltung in das Register des Sitzes desjenigen Rechtsträgers, dessen Gläubiger sie sind, nach § 19 Absatz 3 UmwG als bekannt gemacht gilt, ihren Anspruch nach Grund und Höhe schriftlich anmelden, Sicherheit zu leisten, soweit sie nicht Befriedigung verlangen können. Dieses Recht steht den Gläubigern jedoch nur zu, wenn sie glaubhaft machen, dass durch die Abspaltung die Erfüllung ihrer Forderung gefährdet wird."
    },
    {
      "date": "2025-10-07",
      "id": "132867",
      "original_text": "Registerbekanntmachung nach dem Umwandlungsgesetz\nThüringen Amtsgericht Jena HRA 507159\nEnergiefuchs Ronny Wünsch e.K. – Erfurt",
      "type": "Registerbekanntmachung nach dem Umwandlungsgesetz",
      "state": "Thüringen",
      "amtsgericht": "Amtsgericht Jena",
      "registernummer": "HRA 507159",
      "registerart": "HRA",
      "company_name": "Energiefuchs Ronny Wünsch e.K.",
      "company_seat": "Erfurt",
      "details": "07.10.2025 (Bekanntmachungsdatum)\n\nThüringen Amtsgericht Jena HRA 507159\nRegisterbekanntmachung nach dem Umwandlungsgesetz 07.10.2025 (Eintragungsdatum)\n\nEnergiefuchs Ronny Wünsch e.K.\nEinzelkaufmann / Einzelkauffrau\nErfurt\n\nDas von dem Einzelkaufmann Wünsch, Ronny, Erfurt, *11.11.1984 unter der Firma Energiefuchs Ronny Wünsch e.K. mit dem Sitz in Erfurt betriebene Unternehmen ist aus dem Vermögen gemäß Ausgliederungsvertrag vom 18.08.2025, mit Nachtrag vom 30.09.2025 auf die Solaranlagen Erfurt GmbH & Co. KG mit dem Sitz in Erfurt (Amtsgericht Jena HRB 507012) ausgegliedert. Die Firma ist erloschen. Von Amts wegen eingetragen aufgrund § 155 UmwG. Tag der Eintragung: 07.10.2025\nNicht eingetragen: Den Gläubigern der an der Ausgliederung beteiligten Rechtsträger, ist wenn sie binnen sechs Monaten nach dem Tag, an dem die Eintragung der Ausgliederung in das Register des Sitzes desjenigen Rechtsträgers, dessen Gläubiger sie sind, nach §§125, 19 Abs. 3 UmwG als bekanntgemacht gilt, ihren Anspruch nach Grund und Höhe schriftlich anmelden, Sicherheit zu leisten, soweit sie nicht Befriedigung verlangen können. Dieses Recht steht ihnen jedoch nur zu, wenn sie glaubhaft machen, daß durch die Ausgliederung die Erfüllung ihrer Forderung gefährdet wird."
    },
    {
      "date": "2025-10-07",
      "id": "132868",
      "original_text": "Registerbekanntmachung nach dem Umwandlungsgesetz\nThüringen Amtsgericht Jena HRA 503549\nF-tec Elektrotechnik Thomas Franzke e.K. – Schleusingen",
      "type": "Registerbekanntmachung nach dem Umwandlungsgesetz",
      "state": "Thüringen",
      "amtsgericht": "Amtsgericht Jena",
      "registernummer": "HRA 503549",
      "registerart": "HRA",
      "company_name": "F-tec Elektrotechnik Thomas Franzke e.K.",
      "company_seat": "Schleusingen",
      "details": "07.10.2025 (Bekanntmachungsdatum)\n\nThüringen Amtsgericht Jena HRA 503549\nRegisterbekanntmachung nach dem Umwandlungsgesetz 07.10.2025 (Eintragungsdatum)\n\nF-tec Elektrotechnik Thomas Franzke e.K.\nEinzelkaufmann / Einzelkauffrau\nSchleusingen\n\nNicht eingetragen: Den Gläubigern der an der Ausgliederung beteiligten Rechtsträger, ist wenn sie binnen sechs Monaten nach dem Tag, an dem die Eintragung der Ausgliederung in das Register des Sitzes desjenigen Rechtsträgers, dessen Gläubiger sie sind, nach §§125, 19 Abs. 3 UmwG als bekanntgemacht gilt, ihren Anspruch nach Grund und Höhe schriftlich anmelden, Sicherheit zu leisten, soweit sie nicht Befriedigung verlangen können. Dieses Recht steht ihnen jedoch nur zu, wenn sie glaubhaft machen, daß durch die Ausgliederung die Erfüllung ihrer Forderung gefährdet wird."
    },
    {
      "date": "2025-10-07",
      "id": "132869",
      "original_text": "Löschungsankündigung\nBaden-Württemberg Amtsgericht Stuttgart HRB 758378\nBBL Verwaltungs GmbH – Hochdorf",
      "type": "Löschungsankündigung",
      "state": "Baden-Württemberg",
      "amtsgericht": "Amtsgericht Stuttgart",
      "registernummer": "HRB 758378",
      "registerart": "HRB",
      "company_name": "BBL Verwaltungs GmbH",
      "company_seat": "Hochdorf",
      "details": "07.10.2025 (Bekanntmachungsdatum)\n\nBaden-Württemberg Amtsgericht Stuttgart HRB 758378\nLöschungsankündigung\n\nBBL Verwaltungs GmbH\nGesellschaft mit beschränkter Haftung\nHochdorf\n\nAls nicht eingetragen wird bekanntgemacht:\nDas Gericht beabsichtigt, die Gesellschaft wegen Vermögenslosigkeit im Handelsregister von Amts wegen nach § 394 FamFG zu löschen. Die Frist zur Geltendmachung eines Widerspruchs gegen die beabsichtigte Löschung ist auf zwei Monate ab Veröffentlichung bestimmt."
    },
    {
      "date": "2025-10-07",
      "id": "132870",
      "original_text": "Registerbekanntmachung nach dem Umwandlungsgesetz\nSachsen-Anhalt Amtsgericht Stendal HRB 213923\nMartens & Prahl Versicherungskontor GmbH Naumburg – Naumburg",
      "type": "Registerbekanntmachung nach dem Umwandlungsgesetz",
      "state": "Sachsen-Anhalt",
      "amtsgericht": "Amtsgericht Stendal",
      "registernummer": "HRB 213923",
      "registerart": "HRB",
      "company_name": "Martens & Prahl Versicherungskontor GmbH Naumburg",
      "company_seat": "Naumburg",
      "details": "07.10.2025 (Bekanntmachungsdatum)\n\nSachsen-Anhalt Amtsgericht Stendal HRB 213923\nRegisterbekanntmachung nach dem Umwandlungsgesetz 07.10.2025 (Eintragungsdatum)\n\nMartens & Prahl Versicherungskontor GmbH Naumburg\nGesellschaft mit beschränkter Haftung\nNaumburg\n\nDie Martens & Prahl Versicherungskontor GmbH Jena mit dem Sitz in Jena (Amtsgericht Jena HRB 204146) ist auf Grund des Verschmelzungsvertrages vom 25.08.2025    und der Beschlüsse der Gesellschafterversammlungen vom selben Tag mit der Gesellschaft verschmolzen. Nicht eingetragen: Den Gläubigern der an der Verschmelzung beteiligten Rechtsträger ist, wenn sie binnen sechs Monaten nach dem Tag, an dem die Eintragung der Verschmelzung nach § 19 Abs. 3 UmwG als bekanntgemacht gilt, ihren Anspruch nach Grund und Höhe schriftlich anmelden, Sicherheit zu leisten, soweit sie nicht Befriedigung verlangen können. Dieses Recht steht ihnen jedoch nur zu, wenn sie glaubhaft machen, dass durch die Verschmelzung die Erfüllung ihrer Forderung gefährdet wird."
    },
    {
      "date": "2025-10-07",
      "id": "132871",
      "original_text": "Registerbekanntmachung nach dem Umwandlungsgesetz\nThüringen Amtsgericht Jena HRA 507012\nSolaranlagen Erfurt GmbH & Co. KG – Erfurt",
      "type": "Registerbekanntmachung nach dem Umwandlungsgesetz",
      "state": "Thüringen",
      "amtsgericht": "Amtsgericht Jena",
      "registernummer": "HRA 507012",
      "registerart": "HRA",
      "company_name": "Solaranlagen Erfurt GmbH & Co. KG",
      "company_seat": "Erfurt",
      "details": "07.10.2025 (Bekanntmachungsdatum)\n\nThüringen Amtsgericht Jena HRA 507012\nRegisterbekanntmachung nach dem Umwandlungsgesetz 07.10.2025 (Eintragungsdatum)\n\nSolaranlagen Erfurt GmbH & Co. KG\nKommanditgesellschaft\nErfurt\n\nDie Gesellschaft hat im Wege der Ausgliederung gemäß Ausgliederungsvertrag vom 18.08.2025, mit Nachtrag vom 30.09.2025 sowie Beschlüsse ihrer Gesellschafterversammlung vom 18.08.2025 und 30.09.2025 das Vermögen des Einzelunternehmens Dorstsolar* | Christian Dorst e.K. mit dem Sitz in Werningshausen (Amtsgericht Jena HRA 507158) übernommen. Die Ausgliederung ist mit zeitgleicher Eintragung im Register des Sitzes des übertragenden Rechtsträgers wirksam geworden.\n\nDie Gesellschaft hat im Wege der Ausgliederung gemäß Ausgliederungsvertrag vom 18.08.2025, mit Nachtrag vom 30.09.2025 sowie Beschlüsse ihrer Gesellschafterversammlung vom 18.08.2025 und 30.09.2025 das Vermögen des Einzelunternehmens Energiefuchs Ronny Wünsch e.K. mit dem Sitz in Erfurt (Amtsgericht Jena HRA 507159) übernommen.Die Ausgliederung ist mit zeitgleicher Eintragung im Register des Sitzes des übertragenden Rechtsträgers wirksam geworden. Tag der Eintragung: 07.10.2025\n\nNicht eingetragen: Den Gläubigern der an der Ausgliederung beteiligten Rechtsträger, ist wenn sie binnen sechs Monaten nach dem Tag, an dem die Eintragung der Ausgliederung in das Register des Sitzes desjenigen Rechtsträgers, dessen Gläubiger sie sind, nach §§125, 19 Abs. 3 UmwG als bekanntgemacht gilt, ihren Anspruch nach Grund und Höhe schriftlich anmelden, Sicherheit zu leisten, soweit sie nicht Befriedigung verlangen können. Dieses Recht steht ihnen jedoch nur zu, wenn sie glaubhaft machen, daß durch die Ausgliederung die Erfüllung ihrer Forderung gefährdet wird."
    },
    {
      "date": "2025-10-07",
      "id": "132872",
      "original_text": "Registerbekanntmachung nach dem Umwandlungsgesetz\nThüringen Amtsgericht Jena HRA 506929\nF-TEC Elektrotechnik GmbH & Co. KG – Schleusingen",
      "type": "Registerbekanntmachung nach dem Umwandlungsgesetz",
      "state": "Thüringen",
      "amtsgericht": "Amtsgericht Jena",
      "registernummer": "HRA 506929",
      "registerart": "HRA",
      "company_name": "F-TEC Elektrotechnik GmbH & Co. KG",
      "company_seat": "Schleusingen",
      "details": "07.10.2025 (Bekanntmachungsdatum)\n\nThüringen Amtsgericht Jena HRA 506929\nRegisterbekanntmachung nach dem Umwandlungsgesetz 07.10.2025 (Eintragungsdatum)\n\nF-TEC Elektrotechnik GmbH & Co. KG\nKommanditgesellschaft\nSchleusingen\n\nNicht eingetragen: Den Gläubigern der an der Ausgliederung beteiligten Rechtsträger, ist wenn sie binnen sechs Monaten nach dem Tag, an dem die Eintragung der Ausgliederung in das Register des Sitzes desjenigen Rechtsträgers, dessen Gläubiger sie sind, nach §§125, 19 Abs. 3 UmwG als bekanntgemacht gilt, ihren Anspruch nach Grund und Höhe schriftlich anmelden, Sicherheit zu leisten, soweit sie nicht Befriedigung verlangen können. Dieses Recht steht ihnen jedoch nur zu, wenn sie glaubhaft machen, daß durch die Ausgliederung die Erfüllung ihrer Forderung gefährdet wird."
    },
    {
      "date": "2025-10-07",
      "id": "132873",
      "original_text": "Registerbekanntmachung nach dem Umwandlungsgesetz\nSachsen-Anhalt Amtsgericht Stendal HRA 8339\nAgropha e.K. – Kemberg",
      "type": "Registerbekanntmachung nach dem Umwandlungsgesetz",
      "state": "Sachsen-Anhalt",
      "amtsgericht": "Amtsgericht Stendal",
      "registernummer": "HRA 8339",
      "registerart": "HRA",
      "company_name": "Agropha e.K.",
      "company_seat": "Kemberg",
      "details": "07.10.2025 (Bekanntmachungsdatum)\n\nSachsen-Anhalt Amtsgericht Stendal HRA 8339\nRegisterbekanntmachung nach dem Umwandlungsgesetz 07.10.2025 (Eintragungsdatum)\n\nAgropha e.K.\nEinzelkaufmann / Einzelkauffrau\nKemberg\n\nNicht eingetragen:\nDen Gläubigern der an der Verschmelzung beteiligten Rechtsträger ist, wenn sie binnen sechs Monaten nach dem Tag, an dem die Eintragung der Verschmelzung nach § 19 Abs. 3 UmwG als bekanntgemacht gilt, ihren Anspruch nach Grund und Höhe schriftlich anmelden, Sicherheit zu leisten, soweit sie nicht Befriedigung verlangen können. Dieses Recht steht ihnen jedoch nur zu, wenn sie glaubhaft machen, dass durch die Verschmelzung die Erfüllung ihrer Forderung gefährdet wird."
    },
    {
      "date": "2025-10-07",
      "id": "132874",
      "original_text": "Registerbekanntmachung nach dem Umwandlungsgesetz\nThüringen Amtsgericht Jena HRA 507158\nDorstsolar* | Christian Dorst e.K. – Werningshausen",
      "type": "Registerbekanntmachung nach dem Umwandlungsgesetz",
      "state": "Thüringen",
      "amtsgericht": "Amtsgericht Jena",
      "registernummer": "HRA 507158",
      "registerart": "HRA",
      "company_name": "Dorstsolar* | Christian Dorst e.K.",
      "company_seat": "Werningshausen",
      "details": "07.10.2025 (Bekanntmachungsdatum)\n\nThüringen Amtsgericht Jena HRA 507158\nRegisterbekanntmachung nach dem Umwandlungsgesetz 07.10.2025 (Eintragungsdatum)\n\nDorstsolar* | Christian Dorst e.K.\nEinzelkaufmann / Einzelkauffrau\nWerningshausen\n\nDas von dem Einzelkaufmann Dorst, Christian, Werningshausen, *18.01.1982  unter der Firma Dorstsolar* | Christian Dorst e.K. mit dem Sitz in Werningshausen betriebene Unternehmen ist aus dem Vermögen gemäß Ausgliederungsvertrag vom 18.08.2025, mit Nachtrag vom 30.09.2025 auf die Solaranlagen Erfurt GmbH & Co. KG mit dem Sitz in Erfurt (Amtsgericht Jena HRB 507012) ausgegliedert. Die Firma ist erloschen. Von Amts wegen eingetragen aufgrund § 155 UmwG. Tag der Eintragung: 07.10.2025\nNicht eingetragen: Den Gläubigern der an der Ausgliederung beteiligten Rechtsträger, ist wenn sie binnen sechs Monaten nach dem Tag, an dem die Eintragung der Ausgliederung in das Register des Sitzes desjenigen Rechtsträgers, dessen Gläubiger sie sind, nach §§125, 19 Abs. 3 UmwG als bekanntgemacht gilt, ihren Anspruch nach Grund und Höhe schriftlich anmelden, Sicherheit zu leisten, soweit sie nicht Befriedigung verlangen können. Dieses Recht steht ihnen jedoch nur zu, wenn sie glaubhaft machen, daß durch die Ausgliederung die Erfüllung ihrer Forderung gefährdet wird."
    },
    {
      "date": "2025-10-07",
      "id": "132875",
      "original_text": "Einreichung neuer Dokumente\nHamburg Amtsgericht Hamburg HRB 2346\nJ.F. Müller & Sohn Aktien-Gesellschaft – Hamburg",
      "type": "Einreichung neuer Dokumente",
      "state": "Hamburg",
      "amtsgericht": "Amtsgericht Hamburg",
      "registernummer": "HRB 2346",
      "registerart": "HRB",
      "company_name": "J.F. Müller & Sohn Aktien-Gesellschaft",
      "company_seat": "Hamburg",
      "details": "07.10.2025 (Bekanntmachungsdatum)\n\nHamburg Amtsgericht Hamburg HRB 2346\nEinreichung neuer Dokumente 07.10.2025 (Eintragungsdatum)\n\nJ.F. Müller & Sohn Aktien-Gesellschaft\nAktiengesellschaft\nHamburg\n\nAls nicht eingetragen wird bekannt gemacht: Liste des Aufsichtsrats wurde eingereicht."
    },
    {
      "date": "2025-10-07",
      "id": "132876",
      "original_text": "Löschungsankündigung\nBaden-Württemberg Amtsgericht Stuttgart HRB 798139\nCotton Plug Vintage Store UG (haftungsbeschränkt) – Esslingen am Neckar",
      "type": "Löschungsankündigung",
      "state": "Baden-Württemberg",
      "amtsgericht": "Amtsgericht Stuttgart",
      "registernummer": "HRB 798139",
      "registerart": "HRB",
      "company_name": "Cotton Plug Vintage Store UG (haftungsbeschränkt)",
      "company_seat": "Esslingen am Neckar",
      "details": "07.10.2025 (Bekanntmachungsdatum)\n\nBaden-Württemberg Amtsgericht Stuttgart HRB 798139\nLöschungsankündigung 07.10.2025 (Eintragungsdatum)\n\nCotton Plug Vintage Store UG (haftungsbeschränkt)\nGesellschaft mit beschränkter Haftung\nEsslingen am Neckar\n\nAls nicht eingetragen wird bekanntgemacht:\nDas Gericht beabsichtigt, die Gesellschaft wegen Vermögenslosigkeit im Handelsregister von Amts wegen nach § 394 FamFG zu löschen. Die Frist zur Geltendmachung eines Widerspruchs gegen die beabsichtigte Löschung ist auf zwei Monate ab Veröffentlichung bestimmt."
    },
    {
      "date": "2025-10-07",
      "id": "132877",
      "original_text": "Löschungsankündigung\nBaden-Württemberg Amtsgericht Mannheim HRB 719545\nMaster Cleaning Service GmbH – Mannheim",
      "type": "Löschungsankündigung",
      "state": "Baden-Württemberg",
      "amtsgericht": "Amtsgericht Mannheim",
      "registernummer": "HRB 719545",
      "registerart": "HRB",
      "company_name": "Master Cleaning Service GmbH",
      "company_seat": "Mannheim",
      "details": "07.10.2025 (Bekanntmachungsdatum)\n\nBaden-Württemberg Amtsgericht Mannheim HRB 719545\nLöschungsankündigung\n\nMaster Cleaning Service GmbH\nGesellschaft mit beschränkter Haftung\nMannheim\n\nAls nicht eingetragen wird bekanntgemacht:\nDas Gericht beabsichtigt, die Gesellschaft wegen Vermögenslosigkeit im Handelsregister von Amts wegen nach § 394 FamFG zu löschen. Die Frist zur Geltendmachung eines Widerspruchs gegen die beabsichtigte Löschung ist auf einen Monat ab Veröffentlichung bestimmt."
    },
    {
      "date": "2025-10-07",
      "id": "132878",
      "original_text": "Registerbekanntmachung nach dem Umwandlungsgesetz\nSachsen-Anhalt Amtsgericht Stendal HRB 26167\nAgropha GmbH – Kemberg",
      "type": "Registerbekanntmachung nach dem Umwandlungsgesetz",
      "state": "Sachsen-Anhalt",
      "amtsgericht": "Amtsgericht Stendal",
      "registernummer": "HRB 26167",
      "registerart": "HRB",
      "company_name": "Agropha GmbH",
      "company_seat": "Kemberg",
      "details": "07.10.2025 (Bekanntmachungsdatum)\n\nSachsen-Anhalt Amtsgericht Stendal HRB 26167\nRegisterbekanntmachung nach dem Umwandlungsgesetz 07.10.2025 (Eintragungsdatum)\n\nAgropha GmbH\nGesellschaft mit beschränkter Haftung\nKemberg\n\nDie Gesellschaft ist auf Grund des Verschmelzungsvertrages vom 06.08.2025 sowie des Beschlusses der Gesellschafterversammlung vom selben Tag mit dem Vermögen des Alleingesellschafters Maus Hans Werner, Kemberg, *26.02.1956 verschmolzen. Das Unternehmen wird als Einzelfirma unter der Firma Agropha e.K. mit dem Sitz in Kemberg (Amtsgericht Stendal HRA 8339) geführt. Nicht eingetragen: Den Gläubigern der an der Verschmelzung beteiligten Rechtsträger ist, wenn sie binnen sechs Monaten nach dem Tag, an dem die Eintragung der Verschmelzung nach § 19 Abs. 3 UmwG als bekanntgemacht gilt, ihren Anspruch nach Grund und Höhe schriftlich anmelden, Sicherheit zu leisten, soweit sie nicht Befriedigung verlangen können. Dieses Recht steht ihnen jedoch nur zu, wenn sie glaubhaft machen, dass durch die Verschmelzung die Erfüllung ihrer Forderung gefährdet wird."
    },
    {
      "date": "2025-10-07",
      "id": "132879",
      "original_text": "Registerbekanntmachung nach dem Umwandlungsgesetz\nBerlin Amtsgericht Berlin (Charlottenburg) HRB 196228\nMagadan Investment Holding UG (haftungsbeschränkt) – Berlin",
      "type": "Registerbekanntmachung nach dem Umwandlungsgesetz",
      "state": "Berlin",
      "amtsgericht": "Amtsgericht Berlin (Charlottenburg)",
      "registernummer": "HRB 196228",
      "registerart": "HRB",
      "company_name": "Magadan Investment Holding UG (haftungsbeschränkt)",
      "company_seat": "Berlin",
      "details": "07.10.2025 (Bekanntmachungsdatum)\n\nBerlin Amtsgericht Berlin (Charlottenburg) HRB 196228\nRegisterbekanntmachung nach dem Umwandlungsgesetz 06.10.2025 (Eintragungsdatum)\n\nMagadan Investment Holding UG (haftungsbeschränkt)\nGesellschaft mit beschränkter Haftung\nBerlin\n\nZu Eintragungsnummer 3 vom 06.10.2025 wird als nicht eingetragen veröffentlicht:Den Gläubigern der an der Verschmelzung beteiligten Rechtsträger ist, wenn sie binnen sechs Monaten nach dem Tag, an dem die Eintragung der Verschmelzung in das Register des Sitzes desjenigen Rechtsträgers, dessen Gläubiger sie sind, als bekannt gemacht gilt, ihren Anspruch nach Grund und Höhe schriftlich anmelden, Sicherheit zu leisten, soweit sie nicht Befriedigung verlangen können. Dieses Recht steht den Gläubigern jedoch nur zu, wenn sie glaubhaft machen, dass durch die Verschmelzung die Erfüllung ihrer Forderung gefährdet wird. Das Recht, Sicherheitsleistung zu verlangen, steht Gläubigern nicht zu, die im Falle der Insolvenz ein Recht auf vorzugsweise Befriedigung aus einer Deckungsmasse haben, die nach gesetzlicher Vorschrift zu ihrem Schutz errichtet und staatlich überwacht ist."
    },
    {
      "date": "2025-10-07",
      "id": "132880",
      "original_text": "Registerbekanntmachung nach dem Umwandlungsgesetz\nBerlin Amtsgericht Berlin (Charlottenburg) HRA 64387\nPerihan Turan e.K. – Berlin",
      "type": "Registerbekanntmachung nach dem Umwandlungsgesetz",
      "state": "Berlin",
      "amtsgericht": "Amtsgericht Berlin (Charlottenburg)",
      "registernummer": "HRA 64387",
      "registerart": "HRA",
      "company_name": "Perihan Turan e.K.",
      "company_seat": "Berlin",
      "details": "07.10.2025 (Bekanntmachungsdatum)\n\nBerlin Amtsgericht Berlin (Charlottenburg) HRA 64387\nRegisterbekanntmachung nach dem Umwandlungsgesetz 06.10.2025 (Eintragungsdatum)\n\nPerihan Turan e.K.\nEinzelkaufmann / Einzelkauffrau\nBerlin\n\nZu Eintragungsnummer 2 vom 06.10.2025 wird als nicht eingetragen veröffentlicht:\nDen Gläubigern der an der Spaltung beteiligten Rechtsträger ist, wenn sie binnen sechs Monaten nach dem Tag, an dem die Eintragung der Spaltung in das Register des Sitzes desjenigen Rechtsträgers, dessen Gläubiger sie sind, als bekannt gemacht gilt, ihren Anspruch nach Grund und Höhe schriftlich anmelden, Sicherheit zu leisten, soweit sie nicht Befriedigung verlangen können. Dieses Recht steht den Gläubigern jedoch nur zu, wenn sie glaubhaft machen, dass durch die Spaltung die Erfüllung ihrer Forderung gefährdet wird. Das Recht, Sicherheitsleistung zu verlangen, steht Gläubigern nicht zu, die im Falle der Insolvenz ein Recht auf vorzugsweise Befriedigung aus einer Deckungsmasse haben, die nach gesetzlicher Vorschrift zu ihrem Schutz errichtet und staatlich überwacht ist."
    },
    {
      "date": "2025-10-07",
      "id": "132881",
      "original_text": "Registerbekanntmachung nach dem Umwandlungsgesetz\nBerlin Amtsgericht Berlin (Charlottenburg) HRB 279862\nPN Smart Consulting GmbH – Berlin",
      "type": "Registerbekanntmachung nach dem Umwandlungsgesetz",
      "state": "Berlin",
      "amtsgericht": "Amtsgericht Berlin (Charlottenburg)",
      "registernummer": "HRB 279862",
      "registerart": "HRB",
      "company_name": "PN Smart Consulting GmbH",
      "company_seat": "Berlin",
      "details": "07.10.2025 (Bekanntmachungsdatum)\n\nBerlin Amtsgericht Berlin (Charlottenburg) HRB 279862\nRegisterbekanntmachung nach dem Umwandlungsgesetz 06.10.2025 (Eintragungsdatum)\n\nPN Smart Consulting GmbH\nGesellschaft mit beschränkter Haftung\nBerlin\n\nZu Eintragungsnummer 1 vom 06.10.2025 wird als nicht eingetragen veröffentlicht:\nDen Gläubigern der an der Spaltung beteiligten Rechtsträger ist, wenn sie binnen sechs Monaten nach dem Tag, an dem die Eintragung der Spaltung in das Register des Sitzes desjenigen Rechtsträgers, dessen Gläubiger sie sind, als bekannt gemacht gilt, ihren Anspruch nach Grund und Höhe schriftlich anmelden, Sicherheit zu leisten, soweit sie nicht Befriedigung verlangen können. Dieses Recht steht den Gläubigern jedoch nur zu, wenn sie glaubhaft machen, dass durch die Spaltung die Erfüllung ihrer Forderung gefährdet wird. Das Recht, Sicherheitsleistung zu verlangen, steht Gläubigern nicht zu, die im Falle der Insolvenz ein Recht auf vorzugsweise Befriedigung aus einer Deckungsmasse haben, die nach gesetzlicher Vorschrift zu ihrem Schutz errichtet und staatlich überwacht ist."
    },
    {
      "date": "2025-10-07",
      "id": "132882",
      "original_text": "Registerbekanntmachung nach dem Umwandlungsgesetz\nBerlin Amtsgericht Berlin (Charlottenburg) HRB 196629\nVovo Commerce GmbH – Berlin",
      "type": "Registerbekanntmachung nach dem Umwandlungsgesetz",
      "state": "Berlin",
      "amtsgericht": "Amtsgericht Berlin (Charlottenburg)",
      "registernummer": "HRB 196629",
      "registerart": "HRB",
      "company_name": "Vovo Commerce GmbH",
      "company_seat": "Berlin",
      "details": "07.10.2025 (Bekanntmachungsdatum)\n\nBerlin Amtsgericht Berlin (Charlottenburg) HRB 196629\nRegisterbekanntmachung nach dem Umwandlungsgesetz 06.10.2025 (Eintragungsdatum)\n\nVovo Commerce GmbH\nGesellschaft mit beschränkter Haftung\nBerlin\n\nZu Eintragungsnummer 4 vom 06.10.2025 wird als nicht eingetragen veröffentlicht:Den Gläubigern der an der Verschmelzung beteiligten Rechtsträger ist, wenn sie binnen sechs Monaten nach dem Tag, an dem die Eintragung der Verschmelzung in das Register des Sitzes desjenigen Rechtsträgers, dessen Gläubiger sie sind, als bekannt gemacht gilt, ihren Anspruch nach Grund und Höhe schriftlich anmelden, Sicherheit zu leisten, soweit sie nicht Befriedigung verlangen können. Dieses Recht steht den Gläubigern jedoch nur zu, wenn sie glaubhaft machen, dass durch die Verschmelzung die Erfüllung ihrer Forderung gefährdet wird. Das Recht, Sicherheitsleistung zu verlangen, steht Gläubigern nicht zu, die im Falle der Insolvenz ein Recht auf vorzugsweise Befriedigung aus einer Deckungsmasse haben, die nach gesetzlicher Vorschrift zu ihrem Schutz errichtet und staatlich überwacht ist."
    },
    {
      "date": "2025-10-07",
      "id": "132883",
      "original_text": "Einreichung neuer Dokumente\nBerlin Amtsgericht Berlin (Charlottenburg) HRB 97972\nLand der Ideen Management GmbH – Berlin",
      "type": "Einreichung neuer Dokumente",
      "state": "Berlin",
      "amtsgericht": "Amtsgericht Berlin (Charlottenburg)",
      "registernummer": "HRB 97972",
      "registerart": "HRB",
      "company_name": "Land der Ideen Management GmbH",
      "company_seat": "Berlin",
      "details": "07.10.2025 (Bekanntmachungsdatum)\n\nBerlin Amtsgericht Berlin (Charlottenburg) HRB 97972\nEinreichung neuer Dokumente\n\nLand der Ideen Management GmbH\nGesellschaft mit beschränkter Haftung\nBerlin\n\nAls nicht eingetragen wird veröffentlicht: Es wurde eine neue Liste der Aufsichtsratsmitglieder eingereicht (§52 GmbHG)."
    },
    {
      "date": "2025-10-07",
      "id": "132884",
      "original_text": "Einreichung neuer Dokumente\nHamburg Amtsgericht Hamburg HRB 77887\nLURIS Aktiengesellschaft – Hamburg",
      "type": "Einreichung neuer Dokumente",
      "state": "Hamburg",
      "amtsgericht": "Amtsgericht Hamburg",
      "registernummer": "HRB 77887",
      "registerart": "HRB",
      "company_name": "LURIS Aktiengesellschaft",
      "company_seat": "Hamburg",
      "details": "07.10.2025 (Bekanntmachungsdatum)\n\nHamburg Amtsgericht Hamburg HRB 77887\nEinreichung neuer Dokumente 07.10.2025 (Eintragungsdatum)\n\nLURIS Aktiengesellschaft\nAktiengesellschaft\nHamburg\n\nAls nicht eingetragen wird bekannt gemacht: Liste des Aufsichtsrats wurde eingereicht."
    },
    {
      "date": "2025-10-07",
      "id": "132885",
      "original_text": "Registerbekanntmachung nach dem Umwandlungsgesetz\nBaden-Württemberg Amtsgericht Stuttgart GnR 720142\nBürgerEnergiegenossenschaft Unteres Jagsttal eG – Möckmühl",
      "type": "Registerbekanntmachung nach dem Umwandlungsgesetz",
      "state": "Baden-Württemberg",
      "amtsgericht": "Amtsgericht Stuttgart",
      "registernummer": "GnR 720142",
      "registerart": "GnR",
      "company_name": "BürgerEnergiegenossenschaft Unteres Jagsttal eG",
      "company_seat": "Möckmühl",
      "details": "07.10.2025 (Bekanntmachungsdatum)\n\nBaden-Württemberg Amtsgericht Stuttgart GnR 720142\nRegisterbekanntmachung nach dem Umwandlungsgesetz 07.10.2025 (Eintragungsdatum)\n\nBürgerEnergiegenossenschaft Unteres Jagsttal eG\neingetragene Genossenschaft\nMöckmühl\n\nAls nicht eingetragen wird bekanntgemacht: Den Gläubigern der an der Verschmelzung beteiligten Rechtsträger ist, wenn sie binnen sechs Monaten nach dem Tag, an dem die Eintragung der Verschmelzung in das Register des Sitzes desjenigen Rechtsträgers, dessen Gläubiger sie sind, nach § 19 Abs. 3 UmwG als bekanntgemacht gilt, ihren Anspruch nach Grund und Höhe schriftlich anmelden, Sicherheit zu leisten, soweit sie nicht Befriedigung verlangen können. Dieses Recht steht den Gläubigern jedoch nur zu, wenn sie glaubhaft machen, dass durch die Verschmelzung die Erfüllung ihrer Forderung gefährdet wird."
    },
    {
      "date": "2025-10-07",
      "id": "132886",
      "original_text": "Registerbekanntmachung nach dem Umwandlungsgesetz\nBaden-Württemberg Amtsgericht Stuttgart HRA 742607\nZaunsysteme von Mallinckrodt e.K. – Schwäbisch Hall",
      "type": "Registerbekanntmachung nach dem Umwandlungsgesetz",
      "state": "Baden-Württemberg",
      "amtsgericht": "Amtsgericht Stuttgart",
      "registernummer": "HRA 742607",
      "registerart": "HRA",
      "company_name": "Zaunsysteme von Mallinckrodt e.K.",
      "company_seat": "Schwäbisch Hall",
      "details": "07.10.2025 (Bekanntmachungsdatum)\n\nBaden-Württemberg Amtsgericht Stuttgart HRA 742607\nRegisterbekanntmachung nach dem Umwandlungsgesetz 07.10.2025 (Eintragungsdatum)\n\nZaunsysteme von Mallinckrodt e.K.\nEinzelkaufmann / Einzelkauffrau\nSchwäbisch Hall\n\nAls nicht eingetragen wird bekanntgemacht:\nDen Gläubigern der an der Ausgliederung beteiligten Rechtsträger ist, wenn sie binnen sechs Monaten nach dem Tag, an dem die Eintragung der Ausgliederung in das Register des Sitzes desjenigen Rechtsträgers, dessen Gläubiger sie sind, nach § 19 Abs. 3 UmwG als bekanntgemacht gilt, ihren Anspruch nach Grund und Höhe schriftlich anmelden, Sicherheit zu leisten, soweit sie nicht Befriedigung verlangen können. Dieses Recht steht den Gläubigern jedoch nur zu, wenn sie glaubhaft machen, dass durch die Ausgliederung die Erfüllung ihrer Forderung gefährdet wird."
    },
    {
      "date": "2025-10-07",
      "id": "132887",
      "original_text": "Registerbekanntmachung nach dem Umwandlungsgesetz\nBaden-Württemberg Amtsgericht Stuttgart GnR 720045\nBürgerEnergiegenossenschaft Hardthausen eG – Hardthausen am Kocher",
      "type": "Registerbekanntmachung nach dem Umwandlungsgesetz",
      "state": "Baden-Württemberg",
      "amtsgericht": "Amtsgericht Stuttgart",
      "registernummer": "GnR 720045",
      "registerart": "GnR",
      "company_name": "BürgerEnergiegenossenschaft Hardthausen eG",
      "company_seat": "Hardthausen am Kocher",
      "details": "07.10.2025 (Bekanntmachungsdatum)\n\nBaden-Württemberg Amtsgericht Stuttgart GnR 720045\nRegisterbekanntmachung nach dem Umwandlungsgesetz 07.10.2025 (Eintragungsdatum)\n\nBürgerEnergiegenossenschaft Hardthausen eG\neingetragene Genossenschaft\nHardthausen am Kocher\n\nAls nicht eingetragen wird bekanntgemacht:\nDen Gläubigern der an der Verschmelzung beteiligten Rechtsträger ist, wenn sie binnen sechs Monaten nach dem Tag, an dem die Eintragung der Verschmelzung in das Register des Sitzes desjenigen Rechtsträgers, dessen Gläubiger sie sind, nach § 19 Abs. 3 UmwG als bekanntgemacht gilt, ihren Anspruch nach Grund und Höhe schriftlich anmelden, Sicherheit zu leisten, soweit sie nicht Befriedigung verlangen können. Dieses Recht steht den Gläubigern jedoch nur zu, wenn sie glaubhaft machen, dass durch die Verschmelzung die Erfüllung ihrer Forderung gefährdet wird."
    },
    {
      "date": "2025-10-07",
      "id": "132888",
      "original_text": "Einreichung neuer Dokumente\nBaden-Württemberg Amtsgericht Stuttgart HRB 727315\nWeinmann Aach AG – Dornstetten",
      "type": "Einreichung neuer Dokumente",
      "state": "Baden-Württemberg",
      "amtsgericht": "Amtsgericht Stuttgart",
      "registernummer": "HRB 727315",
      "registerart": "HRB",
      "company_name": "Weinmann Aach AG",
      "company_seat": "Dornstetten",
      "details": "07.10.2025 (Bekanntmachungsdatum)\n\nBaden-Württemberg Amtsgericht Stuttgart HRB 727315\nEinreichung neuer Dokumente\n\nWeinmann Aach AG\nAktiengesellschaft\nDornstetten\n\nDie Gesellschaft hat am 06.10.2025 die Liste über die Zusammensetzung des Aufsichtsrats zum Handelsregister eingereicht."
    },
    {
      "date": "2025-10-07",
      "id": "132889",
      "original_text": "Registerbekanntmachung nach dem Umwandlungsgesetz\nBaden-Württemberg Amtsgericht Stuttgart HRB 786390\nFancyfive UG (haftungsbeschränkt) – Schwäbisch Hall",
      "type": "Registerbekanntmachung nach dem Umwandlungsgesetz",
      "state": "Baden-Württemberg",
      "amtsgericht": "Amtsgericht Stuttgart",
      "registernummer": "HRB 786390",
      "registerart": "HRB",
      "company_name": "Fancyfive UG (haftungsbeschränkt)",
      "company_seat": "Schwäbisch Hall",
      "details": "07.10.2025 (Bekanntmachungsdatum)\n\nBaden-Württemberg Amtsgericht Stuttgart HRB 786390\nRegisterbekanntmachung nach dem Umwandlungsgesetz 07.10.2025 (Eintragungsdatum)\n\nFancyfive UG (haftungsbeschränkt)\nGesellschaft mit beschränkter Haftung\nSchwäbisch Hall\n\nAls nicht eingetragen wird bekanntgemacht:\nDen Gläubigern der an der Verschmelzung beteiligten Rechtsträger ist, wenn sie binnen sechs Monaten nach dem Tag, an dem die Eintragung der Verschmelzung in das Register des Sitzes desjenigen Rechtsträgers, dessen Gläubiger sie sind, nach § 19 Abs. 3 UmwG als bekanntgemacht gilt, ihren Anspruch nach Grund und Höhe schriftlich anmelden, Sicherheit zu leisten, soweit sie nicht Befriedigung verlangen können. Dieses Recht steht den Gläubigern jedoch nur zu, wenn sie glaubhaft machen, dass durch die Verschmelzung die Erfüllung ihrer Forderung gefährdet wird."
    },
    {
      "date": "2025-10-07",
      "id": "132890",
      "original_text": "Einreichung neuer Dokumente\nSachsen-Anhalt Amtsgericht Stendal HRB 16898\nInterstarch Gesellschaft mit beschränkter Haftung – Elsteraue",
      "type": "Einreichung neuer Dokumente",
      "state": "Sachsen-Anhalt",
      "amtsgericht": "Amtsgericht Stendal",
      "registernummer": "HRB 16898",
      "registerart": "HRB",
      "company_name": "Interstarch Gesellschaft mit beschränkter Haftung",
      "company_seat": "Elsteraue",
      "details": "07.10.2025 (Bekanntmachungsdatum)\n\nSachsen-Anhalt Amtsgericht Stendal HRB 16898\nEinreichung neuer Dokumente\n\nInterstarch Gesellschaft mit beschränkter Haftung\nGesellschaft mit beschränkter Haftung\nElsteraue\n\nEine Liste der Mitglieder des Aufsichtsrates wurde zum Handelsregister eingereicht."
    },
    {
      "date": "2025-10-07",
      "id": "132891",
      "original_text": "Sonstige Registerbekanntmachung\nSchleswig-Holstein Amtsgericht Pinneberg HRB 17158\nTQG Logistics West GmbH – Elmshorn",
      "type": "Sonstige Registerbekanntmachung",
      "state": "Schleswig-Holstein",
      "amtsgericht": "Amtsgericht Pinneberg",
      "registernummer": "HRB 17158",
      "registerart": "HRB",
      "company_name": "TQG Logistics West GmbH",
      "company_seat": "Elmshorn",
      "details": "07.10.2025 (Bekanntmachungsdatum)\n\nSchleswig-Holstein Amtsgericht Pinneberg HRB 17158\nSonstige Registerbekanntmachung\n\nTQG Logistics West GmbH\nGesellschaft mit beschränkter Haftung\nElmshorn\n\nAls nicht eingetragen wird veröffentlicht: Den Gläubigern der an der Verschmelzung beteiligten Rechtsträger ist, wenn sie binnen sechs Monaten nach dem Tag, an dem die Eintragung der Verschmelzung in das Register des Sitzes desjenigen Rechtsträgers, dessen Gläubiger sie sind, als bekannt gemacht gilt, ihren Anspruch nach Grund und Höhe schriftlich anmelden, Sicherheit zu leisten, soweit sie nicht Befriedigung verlangen können. Dieses Recht steht den Gläubigern jedoch nur zu, wenn sie glaubhaft machen, dass durch die Verschmelzung die Erfüllung ihrer Forderung gefährdet wird. Das Recht, Sicherheitsleistung zu verlangen, steht Gläubigern nicht zu, die im Falle der Insolvenz ein Recht auf vorzugsweise Befriedigung aus einer Deckungsmasse haben, die nach gesetzlicher Vorschrift zu ihrem Schutz errichtet und staatlich überwacht ist."
    },
    {
      "date": "2025-10-07",
      "id": "132892",
      "original_text": "Löschungsankündigung\nBrandenburg Amtsgericht Potsdam HRB 38659\nDriveClubWear UG (haftungsbeschränkt) – Brandenburg an der Havel",
      "type": "Löschungsankündigung",
      "state": "Brandenburg",
      "amtsgericht": "Amtsgericht Potsdam",
      "registernummer": "HRB 38659",
      "registerart": "HRB",
      "company_name": "DriveClubWear UG (haftungsbeschränkt)",
      "company_seat": "Brandenburg an der Havel",
      "details": "07.10.2025 (Bekanntmachungsdatum)\n\nBrandenburg Amtsgericht Potsdam HRB 38659\nLöschungsankündigung\n\nDriveClubWear UG (haftungsbeschränkt)\nGesellschaft mit beschränkter Haftung\nBrandenburg an der Havel\n\nBei der nachstehenden Gesellschaft wird das Amtslöschungsverfahren gemäß § 394 FamFG eingeleitet. Widerspruchsfrist 8 Wochen."
    },
    {
      "date": "2025-10-07",
      "id": "132893",
      "original_text": "Registerbekanntmachung nach dem Umwandlungsgesetz\nBerlin Amtsgericht Berlin (Charlottenburg) HRA 64519\nBENKE - IT . COM e.K. – Berlin",
      "type": "Registerbekanntmachung nach dem Umwandlungsgesetz",
      "state": "Berlin",
      "amtsgericht": "Amtsgericht Berlin (Charlottenburg)",
      "registernummer": "HRA 64519",
      "registerart": "HRA",
      "company_name": "BENKE - IT . COM e.K.",
      "company_seat": "Berlin",
      "details": "07.10.2025 (Bekanntmachungsdatum)\n\nBerlin Amtsgericht Berlin (Charlottenburg) HRA 64519\nRegisterbekanntmachung nach dem Umwandlungsgesetz 06.10.2025 (Eintragungsdatum)\n\nBENKE - IT . COM e.K.\nEinzelkaufmann / Einzelkauffrau\nBerlin\n\nZu Eintragungsnummer 2 vom 06.10.2025 wird als nicht eingetragen veröffentlicht: Den Gläubigern der an der Spaltung beteiligten Rechtsträger ist, wenn sie binnen sechs Monaten nach dem Tag, an dem die Eintragung der Spaltung in das Register des Sitzes desjenigen Rechtsträgers, dessen Gläubiger sie sind, als bekannt gemacht gilt, ihren Anspruch nach Grund und Höhe schriftlich anmelden, Sicherheit zu leisten, soweit sie nicht Befriedigung verlangen können. Dieses Recht steht den Gläubigern jedoch nur zu, wenn sie glaubhaft machen, dass durch die Spaltung die Erfüllung ihrer Forderung gefährdet wird. Das Recht, Sicherheitsleistung zu verlangen, steht Gläubigern nicht zu, die im Falle der Insolvenz ein Recht auf vorzugsweise Befriedigung aus einer Deckungsmasse haben, die nach gesetzlicher Vorschrift zu ihrem Schutz errichtet und staatlich überwacht ist."
    },
    {
      "date": "2025-10-07",
      "id": "132894",
      "original_text": "Löschungsankündigung\nMecklenburg-Vorpommern Amtsgericht Rostock HRB 374\nIKN Gesellschaft für Instandhaltung, Kraftfahrzeughandel, Nachrüstung mbH Rostock – Rostock",
      "type": "Löschungsankündigung",
      "state": "Mecklenburg-Vorpommern",
      "amtsgericht": "Amtsgericht Rostock",
      "registernummer": "HRB 374",
      "registerart": "HRB",
      "company_name": "IKN Gesellschaft für Instandhaltung, Kraftfahrzeughandel, Nachrüstung mbH Rostock",
      "company_seat": "Rostock",
      "details": "07.10.2025 (Bekanntmachungsdatum)\n\nMecklenburg-Vorpommern Amtsgericht Rostock HRB 374\nLöschungsankündigung\n\nIKN Gesellschaft für Instandhaltung, Kraftfahrzeughandel, Nachrüstung mbH Rostock\nGesellschaft mit beschränkter Haftung\nRostock\n\nDas Registergericht beabsichtigt, die im Handelsregister eingetragene Gesellschaft von Amts wegen nach § 394 FamFG zu löschen. Die Frist zur Erhebung eines Widerspruchs gegen die beabsichtigte Löschung wird auf 1 Monat festgesetzt."
    },
    {
      "date": "2025-10-07",
      "id": "132895",
      "original_text": "Registerbekanntmachung nach dem Umwandlungsgesetz\nBerlin Amtsgericht Berlin (Charlottenburg) HRB 186858\nCONSULT ING. Dietel Engineers GmbH – Berlin",
      "type": "Registerbekanntmachung nach dem Umwandlungsgesetz",
      "state": "Berlin",
      "amtsgericht": "Amtsgericht Berlin (Charlottenburg)",
      "registernummer": "HRB 186858",
      "registerart": "HRB",
      "company_name": "CONSULT ING. Dietel Engineers GmbH",
      "company_seat": "Berlin",
      "details": "07.10.2025 (Bekanntmachungsdatum)\n\nBerlin Amtsgericht Berlin (Charlottenburg) HRB 186858\nRegisterbekanntmachung nach dem Umwandlungsgesetz 07.10.2025 (Eintragungsdatum)\n\nCONSULT ING. Dietel Engineers GmbH\nGesellschaft mit beschränkter Haftung\nBerlin\n\nZu Eintragungsnummer 7 vom 07.10.2025 wird als nicht eingetragen veröffentlicht: Den Gläubigern ist, wenn sie binnen sechs Monaten nach dem Tag, an dem die Eintragung der Umwandlung als bekannt gemacht gilt, ihren Anspruch nach Grund und Höhe schriftlich anmelden, Sicherheit zu leisten, soweit sie nicht Befriedigung verlangen können. Dieses Recht steht den Gläubigern jedoch nur zu, wenn sie glaubhaft machen, dass durch die Umwandlung die Erfüllung ihrer Forderung gefährdet wird. Das Recht, Sicherheitsleistung zu verlangen, steht Gläubigern nicht zu, die im Falle der Insolvenz ein Recht auf vorzugsweise Befriedigung aus einer Deckungsmasse haben, die nach gesetzlicher Vorschrift zu ihrem Schutz errichtet und staatlich überwacht ist."
    },
    {
      "date": "2025-10-07",
      "id": "132896",
      "original_text": "Registerbekanntmachung nach dem Umwandlungsgesetz\nBaden-Württemberg Amtsgericht Stuttgart HRA 742696\nN. Groß Grundstücks- und Vermögensverwaltung GmbH & Co. KG – Öhringen",
      "type": "Registerbekanntmachung nach dem Umwandlungsgesetz",
      "state": "Baden-Württemberg",
      "amtsgericht": "Amtsgericht Stuttgart",
      "registernummer": "HRA 742696",
      "registerart": "HRA",
      "company_name": "N. Groß Grundstücks- und Vermögensverwaltung GmbH & Co. KG",
      "company_seat": "Öhringen",
      "details": "07.10.2025 (Bekanntmachungsdatum)\n\nBaden-Württemberg Amtsgericht Stuttgart HRA 742696\nRegisterbekanntmachung nach dem Umwandlungsgesetz 07.10.2025 (Eintragungsdatum)\n\nN. Groß Grundstücks- und Vermögensverwaltung GmbH & Co. KG\nKommanditgesellschaft\nÖhringen\n\nAls nicht eingetragen wird bekanntgemacht:\nDen Gläubigern der an der Ausgliederung beteiligten Rechtsträger ist, wenn sie binnen sechs Monaten nach dem Tag, an dem die Eintragung der Ausgliederung in das Register des Sitzes desjenigen Rechtsträgers, dessen Gläubiger sie sind, nach § 19 Abs. 3 UmwG als bekanntgemacht gilt, ihren Anspruch nach Grund und Höhe schriftlich anmelden, Sicherheit zu leisten, soweit sie nicht Befriedigung verlangen können. Dieses Recht steht den Gläubigern jedoch nur zu, wenn sie glaubhaft machen, dass durch die Ausgliederung die Erfüllung ihrer Forderung gefährdet wird."
    },
    {
      "date": "2025-10-07",
      "id": "132897",
      "original_text": "Registerbekanntmachung nach dem Umwandlungsgesetz\nBaden-Württemberg Amtsgericht Freiburg HRB 600386\nAZ-Armaturen GmbH – Mönchweiler",
      "type": "Registerbekanntmachung nach dem Umwandlungsgesetz",
      "state": "Baden-Württemberg",
      "amtsgericht": "Amtsgericht Freiburg",
      "registernummer": "HRB 600386",
      "registerart": "HRB",
      "company_name": "AZ-Armaturen GmbH",
      "company_seat": "Mönchweiler",
      "details": "07.10.2025 (Bekanntmachungsdatum)\n\nBaden-Württemberg Amtsgericht Freiburg HRB 600386\nRegisterbekanntmachung nach dem Umwandlungsgesetz 07.10.2025 (Eintragungsdatum)\n\nAZ-Armaturen GmbH\nGesellschaft mit beschränkter Haftung\nMönchweiler\n\nAls nicht eingetragen wird bekanntgemacht:\nDen Gläubigern der an den Ausgliederungen beteiligten Rechtsträger ist, wenn sie binnen sechs Monaten nach dem Tag, an dem die Eintragung der Ausgliederungen in das Register des Sitzes desjenigen Rechtsträgers, dessen Gläubiger sie sind, nach § 19 Abs. 3 UmwG als bekanntgemacht gilt, ihren Anspruch nach Grund und Höhe schriftlich anmelden, Sicherheit zu leisten, soweit sie nicht Befriedigung verlangen können. Dieses Recht steht den Gläubigern jedoch nur zu, wenn sie glaubhaft machen, dass durch die Ausgliederungen die Erfüllung ihrer Forderung gefährdet wird."
    },
    {
      "date": "2025-10-07",
      "id": "132898",
      "original_text": "Sonstige Registerbekanntmachung\nHamburg Amtsgericht Hamburg HRB 174553\ncink AG – Hamburg",
      "type": "Sonstige Registerbekanntmachung",
      "state": "Hamburg",
      "amtsgericht": "Amtsgericht Hamburg",
      "registernummer": "HRB 174553",
      "registerart": "HRB",
      "company_name": "cink AG",
      "company_seat": "Hamburg",
      "details": "07.10.2025 (Bekanntmachungsdatum)\n\nHamburg Amtsgericht Hamburg HRB 174553\nSonstige Registerbekanntmachung\n\ncink AG\nAktiengesellschaft\nHamburg\n\nAls nicht eingetragen wird bekannt gemacht: Liste des Aufsichtsrats wurde eingereicht."
    },
    {
      "date": "2025-10-07",
      "id": "132899",
      "original_text": "Registerbekanntmachung nach dem Umwandlungsgesetz\nSachsen Amtsgericht Chemnitz HRA 10269\nLars Hack e.K. – Waldheim",
      "type": "Registerbekanntmachung nach dem Umwandlungsgesetz",
      "state": "Sachsen",
      "amtsgericht": "Amtsgericht Chemnitz",
      "registernummer": "HRA 10269",
      "registerart": "HRA",
      "company_name": "Lars Hack e.K.",
      "company_seat": "Waldheim",
      "details": "07.10.2025 (Bekanntmachungsdatum)\n\nSachsen Amtsgericht Chemnitz HRA 10269\nRegisterbekanntmachung nach dem Umwandlungsgesetz 07.10.2025 (Eintragungsdatum)\n\nLars Hack e.K.\nEinzelkaufmann / Einzelkauffrau\nWaldheim\n\nDen Gläubigern der an der Ausgliederung beteiligten Rechtsträger ist, wenn sie binnen sechs Monaten nach dem Tag, an dem die Eintragung der Ausgliederung in das Register des Sitzes desjenigen Rechtsträgers, dessen Gläubiger sie sind, nach § 19 Abs. 3 UmwG als bekannt gemacht gilt, ihren Anspruch nach Grund und Höhe in Textform anmelden, Sicherheit zu leisten, soweit sie nicht Befriedigung verlangen können. Dieses Recht steht den Gläubigern jedoch nur zu, wenn sie glaubhaft machen, dass durch die Ausgliederung die Erfüllung der Forderung gefährdet wird."
    },
    {
      "date": "2025-10-07",
      "id": "132900",
      "original_text": "Einreichung neuer Dokumente\nSachsen Amtsgericht Dresden HRB 14141\nNeustadthalle - Veranstaltungs GmbH – Neustadt/Sachsen",
      "type": "Einreichung neuer Dokumente",
      "state": "Sachsen",
      "amtsgericht": "Amtsgericht Dresden",
      "registernummer": "HRB 14141",
      "registerart": "HRB",
      "company_name": "Neustadthalle - Veranstaltungs GmbH",
      "company_seat": "Neustadt/Sachsen",
      "details": "07.10.2025 (Bekanntmachungsdatum)\n\nSachsen Amtsgericht Dresden HRB 14141\nEinreichung neuer Dokumente\n\nNeustadthalle - Veranstaltungs GmbH\nGesellschaft mit beschränkter Haftung\nNeustadt/Sachsen\n\nAm 02.10.2025 wurde beim Handelsregister des Amtsgerichts Dresden die Liste der Mitglieder des Aufsichtsrats gemäß § 52 GmbHG eingereicht."
    },
    {
      "date": "2025-10-07",
      "id": "132901",
      "original_text": "Löschungsankündigung\nSachsen Amtsgericht Dresden HRB 31968\nCitymetal Deutschland UG (haftungsbeschränkt) – Dresden",
      "type": "Löschungsankündigung",
      "state": "Sachsen",
      "amtsgericht": "Amtsgericht Dresden",
      "registernummer": "HRB 31968",
      "registerart": "HRB",
      "company_name": "Citymetal Deutschland UG (haftungsbeschränkt)",
      "company_seat": "Dresden",
      "details": "07.10.2025 (Bekanntmachungsdatum)\n\nSachsen Amtsgericht Dresden HRB 31968\nLöschungsankündigung\n\nCitymetal Deutschland UG (haftungsbeschränkt)\nGesellschaft mit beschränkter Haftung\nDresden\n\nDas Registergericht beabsichtigt, die im Handelsregister eingetragene Gesellschaft von Amts wegen nach § 394 FamFG zu löschen. Die Frist zu Erhebung eines Widerspruchs gegen die beabsichtigte Löschung wird auf einen Monat festgesetzt."
    },
    {
      "date": "2025-10-07",
      "id": "132902",
      "original_text": "Löschungsankündigung\nSachsen Amtsgericht Leipzig VR 30305\nFörderverein der Grundschule Authausen e.V. – Authausen",
      "type": "Löschungsankündigung",
      "state": "Sachsen",
      "amtsgericht": "Amtsgericht Leipzig",
      "registernummer": "VR 30305",
      "registerart": "VR",
      "company_name": "Förderverein der Grundschule Authausen e.V.",
      "company_seat": "Authausen",
      "details": "07.10.2025 (Bekanntmachungsdatum)\n\nSachsen Amtsgericht Leipzig VR 30305\nLöschungsankündigung\n\nFörderverein der Grundschule Authausen e.V.\neingetragener Verein\nAuthausen\n\nDas Gericht beabsichtigt, gemäß § 4 Absatz 2 Ziffer 1 der Verordnung über das Vereinsregister das Registerblatt  des Vereins zu schließen, da nach den Ermittlungen des Gerichts sämtliche Mitglieder aus dem Verein ausgeschieden sind. Zur Geltendmachung eines Widerspruchs gegen die beabsichtigte Schließung wird eine Frist von einem Monat nach der Veröffentlichung bestimmt."
    },
    {
      "date": "2025-10-07",
      "id": "132903",
      "original_text": "Löschungsankündigung\nSachsen Amtsgericht Leipzig HRB 21347\n\"Treugrund\" Grundbesitz-Treuhandgesellschaft mit beschränkter Haftung – Leipzig",
      "type": "Löschungsankündigung",
      "state": "Sachsen",
      "amtsgericht": "Amtsgericht Leipzig",
      "registernummer": "HRB 21347",
      "registerart": "HRB",
      "company_name": "\"Treugrund\" Grundbesitz-Treuhandgesellschaft mit beschränkter Haftung",
      "company_seat": "Leipzig",
      "details": "07.10.2025 (Bekanntmachungsdatum)\n\nSachsen Amtsgericht Leipzig HRB 21347\nLöschungsankündigung\n\n\"Treugrund\" Grundbesitz-Treuhandgesellschaft mit beschränkter Haftung\nGesellschaft mit beschränkter Haftung\nLeipzig\n\nDas Registergericht beabsichtigt, die im Handelsregister eingetragene Gesellschaft von Amts wegen nach § 394 FamFG zu löschen. Die Frist zu Erhebung eines Widerspruchs gegen die beabsichtigte Löschung wird auf einen Monat festgesetzt."
    },
    {
      "date": "2025-10-07",
      "id": "132904",
      "original_text": "Löschungsankündigung\nSachsen Amtsgericht Dresden HRB 43034\nOpen Road Tours UG (haftungsbeschränkt) – Bautzen",
      "type": "Löschungsankündigung",
      "state": "Sachsen",
      "amtsgericht": "Amtsgericht Dresden",
      "registernummer": "HRB 43034",
      "registerart": "HRB",
      "company_name": "Open Road Tours UG (haftungsbeschränkt)",
      "company_seat": "Bautzen",
      "details": "07.10.2025 (Bekanntmachungsdatum)\n\nSachsen Amtsgericht Dresden HRB 43034\nLöschungsankündigung\n\nOpen Road Tours UG (haftungsbeschränkt)\nGesellschaft mit beschränkter Haftung\nBautzen\n\nDas Registergericht beabsichtigt, die im Handelsregister eingetragene Gesellschaft von Amts wegen nach § 394 FamFG zu löschen. Die Frist zu Erhebung eines Widerspruchs gegen die beabsichtigte Löschung wird auf einen Monat festgesetzt."
    },
    {
      "date": "2025-10-07",
      "id": "132905",
      "original_text": "Registerbekanntmachung nach dem Umwandlungsgesetz\nSachsen Amtsgericht Chemnitz HRB 37774\nLars Hack Montage- und Rohrleitungsbau GmbH – Waldheim",
      "type": "Registerbekanntmachung nach dem Umwandlungsgesetz",
      "state": "Sachsen",
      "amtsgericht": "Amtsgericht Chemnitz",
      "registernummer": "HRB 37774",
      "registerart": "HRB",
      "company_name": "Lars Hack Montage- und Rohrleitungsbau GmbH",
      "company_seat": "Waldheim",
      "details": "07.10.2025 (Bekanntmachungsdatum)\n\nSachsen Amtsgericht Chemnitz HRB 37774\nRegisterbekanntmachung nach dem Umwandlungsgesetz 07.10.2025 (Eintragungsdatum)\n\nLars Hack Montage- und Rohrleitungsbau GmbH\nGesellschaft mit beschränkter Haftung\nWaldheim\n\nDen Gläubigern der an der Ausgliederung beteiligten Rechtsträger ist, wenn sie binnen sechs Monaten nach dem Tag, an dem die Eintragung der Ausgliederung in das Register des Sitzes desjenigen Rechtsträgers, dessen Gläubiger sie sind, nach § 19 Abs. 3 UmwG als bekannt gemacht gilt, ihren Anspruch nach Grund und Höhe in Textform anmelden, Sicherheit zu leisten, soweit sie nicht Befriedigung verlangen können. Dieses Recht steht den Gläubigern jedoch nur zu, wenn sie glaubhaft machen, dass durch die Ausgliederung die Erfüllung der Forderung gefährdet wird."
    },
    {
      "date": "2025-10-07",
      "id": "132906",
      "original_text": "Einreichung neuer Dokumente\nNiedersachsen Amtsgericht Hannover HRB 54404\nBildungswerk der Niedersächsischen Wirtschaft gemeinnützige GmbH – Hannover",
      "type": "Einreichung neuer Dokumente",
      "state": "Niedersachsen",
      "amtsgericht": "Amtsgericht Hannover",
      "registernummer": "HRB 54404",
      "registerart": "HRB",
      "company_name": "Bildungswerk der Niedersächsischen Wirtschaft gemeinnützige GmbH",
      "company_seat": "Hannover",
      "details": "07.10.2025 (Bekanntmachungsdatum)\n\nNiedersachsen Amtsgericht Hannover HRB 54404\nEinreichung neuer Dokumente\n\nBildungswerk der Niedersächsischen Wirtschaft gemeinnützige GmbH\nGesellschaft mit beschränkter Haftung\nHannover\n\nDie Liste der Mitglieder des Aufsichtsrats wurde beim Registergericht eingereicht."
    },
    {
      "date": "2025-10-07",
      "id": "132907",
      "original_text": "Löschungsankündigung\nNiedersachsen Amtsgericht Tostedt HRB 211018\nit4solution GmbH – Hagen im Bremischen",
      "type": "Löschungsankündigung",
      "state": "Niedersachsen",
      "amtsgericht": "Amtsgericht Tostedt",
      "registernummer": "HRB 211018",
      "registerart": "HRB",
      "company_name": "it4solution GmbH",
      "company_seat": "Hagen im Bremischen",
      "details": "07.10.2025 (Bekanntmachungsdatum)\n\nNiedersachsen Amtsgericht Tostedt HRB 211018\nLöschungsankündigung\n\nit4solution GmbH\nGesellschaft mit beschränkter Haftung\nHagen im Bremischen\n\nDas Registergericht beabsichtigt, die Gesellschaft von Amts wegen nach § 394 FamFG zu löschen. Die Frist zur Erhebung eines Widerspruchs ist auf 1 Monat ab dieser Registerbekanntmachung festgesetzt."
    },
    {
      "date": "2025-10-07",
      "id": "132908",
      "original_text": "Registerbekanntmachung nach dem Umwandlungsgesetz\nNiedersachsen Amtsgericht Lüneburg HRB 206035\nBlack Pearl Verwaltungs GmbH – Seevetal",
      "type": "Registerbekanntmachung nach dem Umwandlungsgesetz",
      "state": "Niedersachsen",
      "amtsgericht": "Amtsgericht Lüneburg",
      "registernummer": "HRB 206035",
      "registerart": "HRB",
      "company_name": "Black Pearl Verwaltungs GmbH",
      "company_seat": "Seevetal",
      "details": "07.10.2025 (Bekanntmachungsdatum)\n\nNiedersachsen Amtsgericht Lüneburg HRB 206035\nRegisterbekanntmachung nach dem Umwandlungsgesetz 07.10.2025 (Eintragungsdatum)\n\nBlack Pearl Verwaltungs GmbH\nGesellschaft mit beschränkter Haftung\nSeevetal\n\nDen Gläubigern der an der Verschmelzung beteiligten Rechtsträger ist, wenn sie binnen sechs Monaten nach dem Tag, an dem die Eintragung der Verschmelzung in das Register des Sitzes desjenigen Rechtsträgers, dessen Gläubiger sie sind, nach § 19  Abs.  3 UmwG als bekannt gemacht gilt, ihren Anspruch nach Grund und Höhe schriftlich anmelden, Sicherheit zu leisten, soweit sie nicht Befriedigung verlangen können. Dieses Recht steht den Gläubigern jedoch nur zu, wenn sie glaubhaft machen, dass durch die Verschmelzung die Erfüllung der Forderung gefährdet wird."
    },
    {
      "date": "2025-10-07",
      "id": "132909",
      "original_text": "Registerbekanntmachung nach dem Umwandlungsgesetz\nNiedersachsen Amtsgericht Osnabrück HRB 17823\nConcentrix Osnabrück GmbH – Osnabrück",
      "type": "Registerbekanntmachung nach dem Umwandlungsgesetz",
      "state": "Niedersachsen",
      "amtsgericht": "Amtsgericht Osnabrück",
      "registernummer": "HRB 17823",
      "registerart": "HRB",
      "company_name": "Concentrix Osnabrück GmbH",
      "company_seat": "Osnabrück",
      "details": "07.10.2025 (Bekanntmachungsdatum)\n\nNiedersachsen Amtsgericht Osnabrück HRB 17823\nRegisterbekanntmachung nach dem Umwandlungsgesetz 07.10.2025 (Eintragungsdatum)\n\nConcentrix Osnabrück GmbH\nGesellschaft mit beschränkter Haftung\nOsnabrück\n\nDen Gläubigern der an der Verschmelzung beteiligten Rechtsträger ist, wenn sie binnen sechs Monaten nach dem Tag, an dem die Eintragung der Verschmelzung in das Register des Sitzes desjenigen Rechtsträgers, dessen Gläubiger sie sind, nach § 19  Abs.  3 UmwG als bekannt gemacht gilt, ihren Anspruch nach Grund und Höhe schriftlich anmelden, Sicherheit zu leisten, soweit sie nicht Befriedigung verlangen können. Dieses Recht steht den Gläubigern jedoch nur zu, wenn sie glaubhaft machen, dass durch die Verschmelzung die Erfüllung der Forderung gefährdet wird."
    },
    {
      "date": "2025-10-07",
      "id": "132910",
      "original_text": "Registerbekanntmachung nach dem Umwandlungsgesetz\nNiedersachsen Amtsgericht Osnabrück HRA 205094\nConcentrix Management Holding B.V. & Co. KG – Osnabrück",
      "type": "Registerbekanntmachung nach dem Umwandlungsgesetz",
      "state": "Niedersachsen",
      "amtsgericht": "Amtsgericht Osnabrück",
      "registernummer": "HRA 205094",
      "registerart": "HRA",
      "company_name": "Concentrix Management Holding B.V. & Co. KG",
      "company_seat": "Osnabrück",
      "details": "07.10.2025 (Bekanntmachungsdatum)\n\nNiedersachsen Amtsgericht Osnabrück HRA 205094\nRegisterbekanntmachung nach dem Umwandlungsgesetz 07.10.2025 (Eintragungsdatum)\n\nConcentrix Management Holding B.V. & Co. KG\nKommanditgesellschaft\nOsnabrück\n\nDen Gläubigern der an der Verschmelzung beteiligten Rechtsträger ist, wenn sie binnen sechs Monaten nach dem Tag, an dem die Eintragung der Verschmelzung in das Register des Sitzes desjenigen Rechtsträgers, dessen Gläubiger sie sind, nach § 19  Abs.  3 UmwG als bekannt gemacht gilt, ihren Anspruch nach Grund und Höhe schriftlich anmelden, Sicherheit zu leisten, soweit sie nicht Befriedigung verlangen können. Dieses Recht steht den Gläubigern jedoch nur zu, wenn sie glaubhaft machen, dass durch die Verschmelzung die Erfüllung der Forderung gefährdet wird."
    },
    {
      "date": "2025-10-07",
      "id": "132911",
      "original_text": "Registerbekanntmachung nach dem Umwandlungsgesetz\nNiedersachsen Amtsgericht Hildesheim HRB 208981\nSchilf Tor- u. Türtechnik GmbH – Hildesheim",
      "type": "Registerbekanntmachung nach dem Umwandlungsgesetz",
      "state": "Niedersachsen",
      "amtsgericht": "Amtsgericht Hildesheim",
      "registernummer": "HRB 208981",
      "registerart": "HRB",
      "company_name": "Schilf Tor- u. Türtechnik GmbH",
      "company_seat": "Hildesheim",
      "details": "07.10.2025 (Bekanntmachungsdatum)\n\nNiedersachsen Amtsgericht Hildesheim HRB 208981\nRegisterbekanntmachung nach dem Umwandlungsgesetz 07.10.2025 (Eintragungsdatum)\n\nSchilf Tor- u. Türtechnik GmbH\nGesellschaft mit beschränkter Haftung\nHildesheim\n\nDen Gläubigern der an der Verschmelzung beteiligten Rechtsträger ist, wenn sie binnen sechs Monaten nach dem Tag, an dem die Eintragung der Verschmelzung in das Register des Sitzes desjenigen Rechtsträgers, dessen Gläubiger sie sind, nach § 19  Abs.  3 UmwG als bekannt gemacht gilt, ihren Anspruch nach Grund und Höhe schriftlich anmelden, Sicherheit zu leisten, soweit sie nicht Befriedigung verlangen können. Dieses Recht steht den Gläubigern jedoch nur zu, wenn sie glaubhaft machen, dass durch die Verschmelzung die Erfüllung der Forderung gefährdet wird."
    },
    {
      "date": "2025-10-07",
      "id": "132912",
      "original_text": "Registerbekanntmachung nach dem Umwandlungsgesetz\nNiedersachsen Amtsgericht Hildesheim HRB 200048\nHanseatic Air GmbH – Hildesheim",
      "type": "Registerbekanntmachung nach dem Umwandlungsgesetz",
      "state": "Niedersachsen",
      "amtsgericht": "Amtsgericht Hildesheim",
      "registernummer": "HRB 200048",
      "registerart": "HRB",
      "company_name": "Hanseatic Air GmbH",
      "company_seat": "Hildesheim",
      "details": "07.10.2025 (Bekanntmachungsdatum)\n\nNiedersachsen Amtsgericht Hildesheim HRB 200048\nRegisterbekanntmachung nach dem Umwandlungsgesetz 07.10.2025 (Eintragungsdatum)\n\nHanseatic Air GmbH\nGesellschaft mit beschränkter Haftung\nHildesheim\n\nDen Gläubigern der an der Verschmelzung beteiligten Rechtsträger ist, wenn sie binnen sechs Monaten nach dem Tag, an dem die Eintragung der Verschmelzung in das Register des Sitzes desjenigen Rechtsträgers, dessen Gläubiger sie sind, nach § 19  Abs.  3 UmwG als bekannt gemacht gilt, ihren Anspruch nach Grund und Höhe schriftlich anmelden, Sicherheit zu leisten, soweit sie nicht Befriedigung verlangen können. Dieses Recht steht den Gläubigern jedoch nur zu, wenn sie glaubhaft machen, dass durch die Verschmelzung die Erfüllung der Forderung gefährdet wird."
    },
    {
      "date": "2025-10-07",
      "id": "132913",
      "original_text": "Registerbekanntmachung nach dem Umwandlungsgesetz\nNiedersachsen Amtsgericht Tostedt HRA 202769\nHelmut Wicht e. K. – Stade",
      "type": "Registerbekanntmachung nach dem Umwandlungsgesetz",
      "state": "Niedersachsen",
      "amtsgericht": "Amtsgericht Tostedt",
      "registernummer": "HRA 202769",
      "registerart": "HRA",
      "company_name": "Helmut Wicht e. K.",
      "company_seat": "Stade",
      "details": "07.10.2025 (Bekanntmachungsdatum)\n\nNiedersachsen Amtsgericht Tostedt HRA 202769\nRegisterbekanntmachung nach dem Umwandlungsgesetz 07.10.2025 (Eintragungsdatum)\n\nHelmut Wicht e. K.\nEinzelkaufmann / Einzelkauffrau\nStade\n\nDen Gläubigern der an der Ausgliederung beteiligten Rechtsträger ist, wenn sie binnen sechs Monaten nach dem Tag, an dem die Eintragung der Ausgliederung in das Register des Sitzes desjenigen Rechtsträgers, dessen Gläubiger sie sind, nach § 19 Abs. 3 UmwG als bekannt gemacht gilt, ihren Anspruch nach Grund und Höhe schriftlich anmelden, Sicherheit zu leisten, soweit sie nicht Befriedigung verlangen können. Dieses Recht steht den Gläubigern jedoch nur zu, wenn sie glaubhaft machen, dass durch die Ausgliederung die Erfüllung der Forderung gefährdet wird."
    },
    {
      "date": "2025-10-07",
      "id": "132914",
      "original_text": "Registerbekanntmachung nach dem Umwandlungsgesetz\nNiedersachsen Amtsgericht Lüneburg HRB 210246\nRG Projekt GmbH – Lüneburg",
      "type": "Registerbekanntmachung nach dem Umwandlungsgesetz",
      "state": "Niedersachsen",
      "amtsgericht": "Amtsgericht Lüneburg",
      "registernummer": "HRB 210246",
      "registerart": "HRB",
      "company_name": "RG Projekt GmbH",
      "company_seat": "Lüneburg",
      "details": "07.10.2025 (Bekanntmachungsdatum)\n\nNiedersachsen Amtsgericht Lüneburg HRB 210246\nRegisterbekanntmachung nach dem Umwandlungsgesetz 07.10.2025 (Eintragungsdatum)\n\nRG Projekt GmbH\nGesellschaft mit beschränkter Haftung\nLüneburg\n\nDen Gläubigern der an der Verschmelzung beteiligten Rechtsträger ist, wenn sie binnen sechs Monaten nach dem Tag, an dem die Eintragung der Verschmelzung in das Register des Sitzes desjenigen Rechtsträgers, dessen Gläubiger sie sind, nach § 19  Abs.  3 UmwG als bekannt gemacht gilt, ihren Anspruch nach Grund und Höhe schriftlich anmelden, Sicherheit zu leisten, soweit sie nicht Befriedigung verlangen können. Dieses Recht steht den Gläubigern jedoch nur zu, wenn sie glaubhaft machen, dass durch die Verschmelzung die Erfüllung der Forderung gefährdet wird."
    },
    {
      "date": "2025-10-07",
      "id": "132915",
      "original_text": "Registerbekanntmachung nach dem Umwandlungsgesetz\nNiedersachsen Amtsgericht Braunschweig HRB 211920\nDetlef Hahne Holding GmbH – Goslar",
      "type": "Registerbekanntmachung nach dem Umwandlungsgesetz",
      "state": "Niedersachsen",
      "amtsgericht": "Amtsgericht Braunschweig",
      "registernummer": "HRB 211920",
      "registerart": "HRB",
      "company_name": "Detlef Hahne Holding GmbH",
      "company_seat": "Goslar",
      "details": "07.10.2025 (Bekanntmachungsdatum)\n\nNiedersachsen Amtsgericht Braunschweig HRB 211920\nRegisterbekanntmachung nach dem Umwandlungsgesetz 07.10.2025 (Eintragungsdatum)\n\nDetlef Hahne Holding GmbH\nGesellschaft mit beschränkter Haftung\nGoslar\n\nDen Gläubigern der an der Verschmelzung beteiligten Rechtsträger ist, wenn sie binnen sechs Monaten nach dem Tag, an dem die Eintragung der Verschmelzung in das Register des Sitzes desjenigen Rechtsträgers, dessen Gläubiger sie sind, nach § 19  Abs.  3 UmwG als bekannt gemacht gilt, ihren Anspruch nach Grund und Höhe schriftlich anmelden, Sicherheit zu leisten, soweit sie nicht Befriedigung verlangen können. Dieses Recht steht den Gläubigern jedoch nur zu, wenn sie glaubhaft machen, dass durch die Verschmelzung die Erfüllung der Forderung gefährdet wird."
    },
    {
      "date": "2025-10-07",
      "id": "132916",
      "original_text": "Registerbekanntmachung nach dem Umwandlungsgesetz\nNiedersachsen Amtsgericht Walsrode HRB 203934\nBauStroh GmbH – Verden",
      "type": "Registerbekanntmachung nach dem Umwandlungsgesetz",
      "state": "Niedersachsen",
      "amtsgericht": "Amtsgericht Walsrode",
      "registernummer": "HRB 203934",
      "registerart": "HRB",
      "company_name": "BauStroh GmbH",
      "company_seat": "Verden",
      "details": "07.10.2025 (Bekanntmachungsdatum)\n\nNiedersachsen Amtsgericht Walsrode HRB 203934\nRegisterbekanntmachung nach dem Umwandlungsgesetz 07.10.2025 (Eintragungsdatum)\n\nBauStroh GmbH\nGesellschaft mit beschränkter Haftung\nVerden\n\nDen Gläubigern der an der Verschmelzung beteiligten Rechtsträger ist, wenn sie binnen sechs Monaten nach dem Tag, an dem die Eintragung der Verschmelzung in das Register des Sitzes desjenigen Rechtsträgers, dessen Gläubiger sie sind, nach § 19  Abs.  3 UmwG als bekannt gemacht gilt, ihren Anspruch nach Grund und Höhe schriftlich anmelden, Sicherheit zu leisten, soweit sie nicht Befriedigung verlangen können. Dieses Recht steht den Gläubigern jedoch nur zu, wenn sie glaubhaft machen, dass durch die Verschmelzung die Erfüllung der Forderung gefährdet wird."
    },
    {
      "date": "2025-10-07",
      "id": "132917",
      "original_text": "Registerbekanntmachung nach dem Umwandlungsgesetz\nNiedersachsen Amtsgericht Osnabrück HRB 17823\nConcentrix Osnabrück GmbH – Osnabrück",
      "type": "Registerbekanntmachung nach dem Umwandlungsgesetz",
      "state": "Niedersachsen",
      "amtsgericht": "Amtsgericht Osnabrück",
      "registernummer": "HRB 17823",
      "registerart": "HRB",
      "company_name": "Concentrix Osnabrück GmbH",
      "company_seat": "Osnabrück",
      "details": "07.10.2025 (Bekanntmachungsdatum)\n\nNiedersachsen Amtsgericht Osnabrück HRB 17823\nRegisterbekanntmachung nach dem Umwandlungsgesetz 07.10.2025 (Eintragungsdatum)\n\nConcentrix Osnabrück GmbH\nGesellschaft mit beschränkter Haftung\nOsnabrück\n\nDen Gläubigern der an der Verschmelzung beteiligten Rechtsträger ist, wenn sie binnen sechs Monaten nach dem Tag, an dem die Eintragung der Verschmelzung in das Register des Sitzes desjenigen Rechtsträgers, dessen Gläubiger sie sind, nach § 19  Abs.  3 UmwG als bekannt gemacht gilt, ihren Anspruch nach Grund und Höhe schriftlich anmelden, Sicherheit zu leisten, soweit sie nicht Befriedigung verlangen können. Dieses Recht steht den Gläubigern jedoch nur zu, wenn sie glaubhaft machen, dass durch die Verschmelzung die Erfüllung der Forderung gefährdet wird."
    },
    {
      "date": "2025-10-07",
      "id": "132918",
      "original_text": "Registerbekanntmachung nach dem Umwandlungsgesetz\nNiedersachsen Amtsgericht Osnabrück HRB 17823\nConcentrix Osnabrück GmbH – Osnabrück",
      "type": "Registerbekanntmachung nach dem Umwandlungsgesetz",
      "state": "Niedersachsen",
      "amtsgericht": "Amtsgericht Osnabrück",
      "registernummer": "HRB 17823",
      "registerart": "HRB",
      "company_name": "Concentrix Osnabrück GmbH",
      "company_seat": "Osnabrück",
      "details": "07.10.2025 (Bekanntmachungsdatum)\n\nNiedersachsen Amtsgericht Osnabrück HRB 17823\nRegisterbekanntmachung nach dem Umwandlungsgesetz 07.10.2025 (Eintragungsdatum)\n\nConcentrix Osnabrück GmbH\nGesellschaft mit beschränkter Haftung\nOsnabrück\n\nDen Gläubigern der an der Verschmelzung beteiligten Rechtsträger ist, wenn sie binnen sechs Monaten nach dem Tag, an dem die Eintragung der Verschmelzung in das Register des Sitzes desjenigen Rechtsträgers, dessen Gläubiger sie sind, nach § 19  Abs.  3 UmwG als bekannt gemacht gilt, ihren Anspruch nach Grund und Höhe schriftlich anmelden, Sicherheit zu leisten, soweit sie nicht Befriedigung verlangen können. Dieses Recht steht den Gläubigern jedoch nur zu, wenn sie glaubhaft machen, dass durch die Verschmelzung die Erfüllung der Forderung gefährdet wird."
    },
    {
      "date": "2025-10-07",
      "id": "132919",
      "original_text": "Registerbekanntmachung nach dem Umwandlungsgesetz\nNiedersachsen Amtsgericht Oldenburg (Oldenburg) HRB 211507\nECR Solutions Software GmbH – Edewecht",
      "type": "Registerbekanntmachung nach dem Umwandlungsgesetz",
      "state": "Niedersachsen",
      "amtsgericht": "Amtsgericht Oldenburg (Oldenburg)",
      "registernummer": "HRB 211507",
      "registerart": "HRB",
      "company_name": "ECR Solutions Software GmbH",
      "company_seat": "Edewecht",
      "details": "07.10.2025 (Bekanntmachungsdatum)\n\nNiedersachsen Amtsgericht Oldenburg (Oldenburg) HRB 211507\nRegisterbekanntmachung nach dem Umwandlungsgesetz 07.10.2025 (Eintragungsdatum)\n\nECR Solutions Software GmbH\nGesellschaft mit beschränkter Haftung\nEdewecht\n\nDen Gläubigern der an der Verschmelzung beteiligten Rechtsträger ist, wenn sie binnen sechs Monaten nach dem Tag, an dem die Eintragung der Verschmelzung in das Register des Sitzes desjenigen Rechtsträgers, dessen Gläubiger sie sind, nach § 19  Abs.  3 UmwG als bekannt gemacht gilt, ihren Anspruch nach Grund und Höhe schriftlich anmelden, Sicherheit zu leisten, soweit sie nicht Befriedigung verlangen können. Dieses Recht steht den Gläubigern jedoch nur zu, wenn sie glaubhaft machen, dass durch die Verschmelzung die Erfüllung der Forderung gefährdet wird."
    },
    {
      "date": "2025-10-07",
      "id": "132920",
      "original_text": "Registerbekanntmachung nach dem Umwandlungsgesetz\nNiedersachsen Amtsgericht Lüneburg HRB 210046\nHPR Management GmbH – Lüneburg",
      "type": "Registerbekanntmachung nach dem Umwandlungsgesetz",
      "state": "Niedersachsen",
      "amtsgericht": "Amtsgericht Lüneburg",
      "registernummer": "HRB 210046",
      "registerart": "HRB",
      "company_name": "HPR Management GmbH",
      "company_seat": "Lüneburg",
      "details": "07.10.2025 (Bekanntmachungsdatum)\n\nNiedersachsen Amtsgericht Lüneburg HRB 210046\nRegisterbekanntmachung nach dem Umwandlungsgesetz 07.10.2025 (Eintragungsdatum)\n\nHPR Management GmbH\nGesellschaft mit beschränkter Haftung\nLüneburg\n\nDen Gläubigern der an der Verschmelzung beteiligten Rechtsträger ist, wenn sie binnen sechs Monaten nach dem Tag, an dem die Eintragung der Verschmelzung in das Register des Sitzes desjenigen Rechtsträgers, dessen Gläubiger sie sind, nach § 19  Abs.  3 UmwG als bekannt gemacht gilt, ihren Anspruch nach Grund und Höhe schriftlich anmelden, Sicherheit zu leisten, soweit sie nicht Befriedigung verlangen können. Dieses Recht steht den Gläubigern jedoch nur zu, wenn sie glaubhaft machen, dass durch die Verschmelzung die Erfüllung der Forderung gefährdet wird."
    },
    {
      "date": "2025-10-07",
      "id": "132921",
      "original_text": "Registerbekanntmachung nach dem Umwandlungsgesetz\nNiedersachsen Amtsgericht Osnabrück HRB 17823\nConcentrix Osnabrück GmbH – Osnabrück",
      "type": "Registerbekanntmachung nach dem Umwandlungsgesetz",
      "state": "Niedersachsen",
      "amtsgericht": "Amtsgericht Osnabrück",
      "registernummer": "HRB 17823",
      "registerart": "HRB",
      "company_name": "Concentrix Osnabrück GmbH",
      "company_seat": "Osnabrück",
      "details": "07.10.2025 (Bekanntmachungsdatum)\n\nNiedersachsen Amtsgericht Osnabrück HRB 17823\nRegisterbekanntmachung nach dem Umwandlungsgesetz 07.10.2025 (Eintragungsdatum)\n\nConcentrix Osnabrück GmbH\nGesellschaft mit beschränkter Haftung\nOsnabrück\n\nDen Gläubigern der an der Verschmelzung beteiligten Rechtsträger ist, wenn sie binnen sechs Monaten nach dem Tag, an dem die Eintragung der Verschmelzung in das Register des Sitzes desjenigen Rechtsträgers, dessen Gläubiger sie sind, nach § 19  Abs.  3 UmwG als bekannt gemacht gilt, ihren Anspruch nach Grund und Höhe schriftlich anmelden, Sicherheit zu leisten, soweit sie nicht Befriedigung verlangen können. Dieses Recht steht den Gläubigern jedoch nur zu, wenn sie glaubhaft machen, dass durch die Verschmelzung die Erfüllung der Forderung gefährdet wird."
    },
    {
      "date": "2025-10-07",
      "id": "132922",
      "original_text": "Registerbekanntmachung nach dem Umwandlungsgesetz\nNiedersachsen Amtsgericht Osnabrück HRA 100202 früher Amtsgericht Lingen (Ems)\nReiseagentur Schwall Inhaber Hans-Jürgen Schwall – Lingen/Ems",
      "type": "Registerbekanntmachung nach dem Umwandlungsgesetz",
      "state": "Niedersachsen",
      "amtsgericht": "Amtsgericht Osnabrück",
      "registernummer": "HRA 100202",
      "registerart": "HRA",
      "company_name": "Reiseagentur Schwall Inhaber Hans-Jürgen Schwall",
      "company_seat": "Lingen/Ems",
      "former_amtsgericht": "Lingen (Ems)",
      "details": "07.10.2025 (Bekanntmachungsdatum)\n\nNiedersachsen Amtsgericht Osnabrück HRA 100202 früher Amtsgericht Lingen (Ems)\nRegisterbekanntmachung nach dem Umwandlungsgesetz 07.10.2025 (Eintragungsdatum)\n\nReiseagentur Schwall Inhaber Hans-Jürgen Schwall\nEinzelkaufmann / Einzelkauffrau\nLingen/Ems\n\nDen Gläubigern der an der Ausgliederung beteiligten Rechtsträger ist, wenn sie binnen sechs Monaten nach dem Tag, an dem die Eintragung der Ausgliederung in das Register des Sitzes desjenigen Rechtsträgers, dessen Gläubiger sie sind, nach § 19 Abs. 3 UmwG als bekannt gemacht gilt, ihren Anspruch nach Grund und Höhe schriftlich anmelden, Sicherheit zu leisten, soweit sie nicht Befriedigung verlangen können. Dieses Recht steht den Gläubigern jedoch nur zu, wenn sie glaubhaft machen, dass durch die Ausgliederung die Erfüllung der Forderung gefährdet wird."
    },
    {
      "date": "2025-10-07",
      "id": "132923",
      "original_text": "Registerbekanntmachung nach dem Umwandlungsgesetz\nNiedersachsen Amtsgericht Hildesheim HRB 210327\nSchomburg Agrar GmbH – Ottenstein",
      "type": "Registerbekanntmachung nach dem Umwandlungsgesetz",
      "state": "Niedersachsen",
      "amtsgericht": "Amtsgericht Hildesheim",
      "registernummer": "HRB 210327",
      "registerart": "HRB",
      "company_name": "Schomburg Agrar GmbH",
      "company_seat": "Ottenstein",
      "details": "07.10.2025 (Bekanntmachungsdatum)\n\nNiedersachsen Amtsgericht Hildesheim HRB 210327\nRegisterbekanntmachung nach dem Umwandlungsgesetz 07.10.2025 (Eintragungsdatum)\n\nSchomburg Agrar GmbH\nGesellschaft mit beschränkter Haftung\nOttenstein\n\nDen Gläubigern der an der Ausgliederung beteiligten Rechtsträger ist, wenn sie binnen sechs Monaten nach dem Tag, an dem die Eintragung der Ausgliederung in das Register des Sitzes desjenigen Rechtsträgers, dessen Gläubiger sie sind, nach § 19 Abs. 3 UmwG als bekannt gemacht gilt, ihren Anspruch nach Grund und Höhe schriftlich anmelden, Sicherheit zu leisten, soweit sie nicht Befriedigung verlangen können. Dieses Recht steht den Gläubigern jedoch nur zu, wenn sie glaubhaft machen, dass durch die Ausgliederung die Erfüllung der Forderung gefährdet wird."
    },
    {
      "date": "2025-10-07",
      "id": "132924",
      "original_text": "Registerbekanntmachung nach dem Umwandlungsgesetz\nNiedersachsen Amtsgericht Lüneburg HRB 204651\nTRIUS 23. Verwaltungsgesellschaft mbH – Seevetal",
      "type": "Registerbekanntmachung nach dem Umwandlungsgesetz",
      "state": "Niedersachsen",
      "amtsgericht": "Amtsgericht Lüneburg",
      "registernummer": "HRB 204651",
      "registerart": "HRB",
      "company_name": "TRIUS 23. Verwaltungsgesellschaft mbH",
      "company_seat": "Seevetal",
      "details": "07.10.2025 (Bekanntmachungsdatum)\n\nNiedersachsen Amtsgericht Lüneburg HRB 204651\nRegisterbekanntmachung nach dem Umwandlungsgesetz 07.10.2025 (Eintragungsdatum)\n\nTRIUS 23. Verwaltungsgesellschaft mbH\nGesellschaft mit beschränkter Haftung\nSeevetal\n\nDen Gläubigern der an der Verschmelzung beteiligten Rechtsträger ist, wenn sie binnen sechs Monaten nach dem Tag, an dem die Eintragung der Verschmelzung in das Register des Sitzes desjenigen Rechtsträgers, dessen Gläubiger sie sind, nach § 19  Abs.  3 UmwG als bekannt gemacht gilt, ihren Anspruch nach Grund und Höhe schriftlich anmelden, Sicherheit zu leisten, soweit sie nicht Befriedigung verlangen können. Dieses Recht steht den Gläubigern jedoch nur zu, wenn sie glaubhaft machen, dass durch die Verschmelzung die Erfüllung der Forderung gefährdet wird."
    },
    {
      "date": "2025-10-07",
      "id": "132925",
      "original_text": "Registerbekanntmachung nach dem Umwandlungsgesetz\nNiedersachsen Amtsgericht Osnabrück HRB 17823\nConcentrix Osnabrück GmbH – Osnabrück",
      "type": "Registerbekanntmachung nach dem Umwandlungsgesetz",
      "state": "Niedersachsen",
      "amtsgericht": "Amtsgericht Osnabrück",
      "registernummer": "HRB 17823",
      "registerart": "HRB",
      "company_name": "Concentrix Osnabrück GmbH",
      "company_seat": "Osnabrück",
      "details": "07.10.2025 (Bekanntmachungsdatum)\n\nNiedersachsen Amtsgericht Osnabrück HRB 17823\nRegisterbekanntmachung nach dem Umwandlungsgesetz 07.10.2025 (Eintragungsdatum)\n\nConcentrix Osnabrück GmbH\nGesellschaft mit beschränkter Haftung\nOsnabrück\n\nDen Gläubigern der an der Verschmelzung beteiligten Rechtsträger ist, wenn sie binnen sechs Monaten nach dem Tag, an dem die Eintragung der Verschmelzung in das Register des Sitzes desjenigen Rechtsträgers, dessen Gläubiger sie sind, nach § 19  Abs.  3 UmwG als bekannt gemacht gilt, ihren Anspruch nach Grund und Höhe schriftlich anmelden, Sicherheit zu leisten, soweit sie nicht Befriedigung verlangen können. Dieses Recht steht den Gläubigern jedoch nur zu, wenn sie glaubhaft machen, dass durch die Verschmelzung die Erfüllung der Forderung gefährdet wird."
    },
    {
      "date": "2025-10-07",
      "id": "132926",
      "original_text": "Löschungsankündigung\nNiedersachsen Amtsgericht Stadthagen HRB 201106\nStachurski Lagersysteme GmbH – Stadthagen",
      "type": "Löschungsankündigung",
      "state": "Niedersachsen",
      "amtsgericht": "Amtsgericht Stadthagen",
      "registernummer": "HRB 201106",
      "registerart": "HRB",
      "company_name": "Stachurski Lagersysteme GmbH",
      "company_seat": "Stadthagen",
      "details": "07.10.2025 (Bekanntmachungsdatum)\n\nNiedersachsen Amtsgericht Stadthagen HRB 201106\nLöschungsankündigung\n\nStachurski Lagersysteme GmbH\nGesellschaft mit beschränkter Haftung\nStadthagen\n\nDas Registergericht beabsichtigt, die Gesellschaft von Amts wegen nach § 394 FamFG zu löschen. Die Frist zur Erhebung eines Widerspruchs ist auf 1 Monat ab dieser Registerbekanntmachung festgesetzt."
    },
    {
      "date": "2025-10-07",
      "id": "132927",
      "original_text": "Einreichung neuer Dokumente\nNiedersachsen Amtsgericht Hannover HRB 3527\nContinental Aktiengesellschaft – Hannover",
      "type": "Einreichung neuer Dokumente",
      "state": "Niedersachsen",
      "amtsgericht": "Amtsgericht Hannover",
      "registernummer": "HRB 3527",
      "registerart": "HRB",
      "company_name": "Continental Aktiengesellschaft",
      "company_seat": "Hannover",
      "details": "07.10.2025 (Bekanntmachungsdatum)\n\nNiedersachsen Amtsgericht Hannover HRB 3527\nEinreichung neuer Dokumente\n\nContinental Aktiengesellschaft\nAktiengesellschaft\nHannover\n\nDie Liste der Mitglieder des Aufsichtsrats wurde beim Registergericht eingereicht."
    },
    {
      "date": "2025-10-07",
      "id": "132928",
      "original_text": "Registerbekanntmachung nach dem Umwandlungsgesetz\nNiedersachsen Amtsgericht Oldenburg (Oldenburg) HRB 111458 früher Amtsgericht Vechta\nGrimme Landmaschinenfabrik Beteiligungs GmbH – Damme",
      "type": "Registerbekanntmachung nach dem Umwandlungsgesetz",
      "state": "Niedersachsen",
      "amtsgericht": "Amtsgericht Oldenburg (Oldenburg)",
      "registernummer": "HRB 111458",
      "registerart": "HRB",
      "company_name": "Grimme Landmaschinenfabrik Beteiligungs GmbH",
      "company_seat": "Damme",
      "former_amtsgericht": "Vechta",
      "details": "07.10.2025 (Bekanntmachungsdatum)\n\nNiedersachsen Amtsgericht Oldenburg (Oldenburg) HRB 111458 früher Amtsgericht Vechta\nRegisterbekanntmachung nach dem Umwandlungsgesetz 07.10.2025 (Eintragungsdatum)\n\nGrimme Landmaschinenfabrik Beteiligungs GmbH\nGesellschaft mit beschränkter Haftung\nDamme\n\nDen Gläubigern der an der Verschmelzung beteiligten Rechtsträger ist, wenn sie binnen sechs Monaten nach dem Tag, an dem die Eintragung der Verschmelzung in das Register des Sitzes desjenigen Rechtsträgers, dessen Gläubiger sie sind, nach § 19  Abs.  3 UmwG als bekannt gemacht gilt, ihren Anspruch nach Grund und Höhe schriftlich anmelden, Sicherheit zu leisten, soweit sie nicht Befriedigung verlangen können. Dieses Recht steht den Gläubigern jedoch nur zu, wenn sie glaubhaft machen, dass durch die Verschmelzung die Erfüllung der Forderung gefährdet wird."
    },
    {
      "date": "2025-10-07",
      "id": "132929",
      "original_text": "Registerbekanntmachung nach dem Umwandlungsgesetz\nNiedersachsen Amtsgericht Oldenburg (Oldenburg) HRB 121258 früher Amtsgericht Westerstede\nECR Solutions Servicegesellschaft mbH – Edewecht",
      "type": "Registerbekanntmachung nach dem Umwandlungsgesetz",
      "state": "Niedersachsen",
      "amtsgericht": "Amtsgericht Oldenburg (Oldenburg)",
      "registernummer": "HRB 121258",
      "registerart": "HRB",
      "company_name": "ECR Solutions Servicegesellschaft mbH",
      "company_seat": "Edewecht",
      "former_amtsgericht": "Westerstede",
      "details": "07.10.2025 (Bekanntmachungsdatum)\n\nNiedersachsen Amtsgericht Oldenburg (Oldenburg) HRB 121258 früher Amtsgericht Westerstede\nRegisterbekanntmachung nach dem Umwandlungsgesetz 07.10.2025 (Eintragungsdatum)\n\nECR Solutions Servicegesellschaft mbH\nGesellschaft mit beschränkter Haftung\nEdewecht\n\nDen Gläubigern der an der Verschmelzung beteiligten Rechtsträger ist, wenn sie binnen sechs Monaten nach dem Tag, an dem die Eintragung der Verschmelzung in das Register des Sitzes desjenigen Rechtsträgers, dessen Gläubiger sie sind, nach § 19  Abs.  3 UmwG als bekannt gemacht gilt, ihren Anspruch nach Grund und Höhe schriftlich anmelden, Sicherheit zu leisten, soweit sie nicht Befriedigung verlangen können. Dieses Recht steht den Gläubigern jedoch nur zu, wenn sie glaubhaft machen, dass durch die Verschmelzung die Erfüllung der Forderung gefährdet wird."
    },
    {
      "date": "2025-10-07",
      "id": "132930",
      "original_text": "Registerbekanntmachung nach dem Umwandlungsgesetz\nNiedersachsen Amtsgericht Osnabrück HRA 209684\nKlausing Vermögensverwaltung GmbH & Co. KG – Gehrde",
      "type": "Registerbekanntmachung nach dem Umwandlungsgesetz",
      "state": "Niedersachsen",
      "amtsgericht": "Amtsgericht Osnabrück",
      "registernummer": "HRA 209684",
      "registerart": "HRA",
      "company_name": "Klausing Vermögensverwaltung GmbH & Co. KG",
      "company_seat": "Gehrde",
      "details": "07.10.2025 (Bekanntmachungsdatum)\n\nNiedersachsen Amtsgericht Osnabrück HRA 209684\nRegisterbekanntmachung nach dem Umwandlungsgesetz 07.10.2025 (Eintragungsdatum)\n\nKlausing Vermögensverwaltung GmbH & Co. KG\nKommanditgesellschaft\nGehrde\n\nDen Gläubigern der an der Ausgliederung beteiligten Rechtsträger ist, wenn sie binnen sechs Monaten nach dem Tag, an dem die Eintragung der Ausgliederung in das Register des Sitzes desjenigen Rechtsträgers, dessen Gläubiger sie sind, nach § 19 Abs. 3 UmwG als bekannt gemacht gilt, ihren Anspruch nach Grund und Höhe schriftlich anmelden, Sicherheit zu leisten, soweit sie nicht Befriedigung verlangen können. Dieses Recht steht den Gläubigern jedoch nur zu, wenn sie glaubhaft machen, dass durch die Ausgliederung die Erfüllung der Forderung gefährdet wird."
    },
    {
      "date": "2025-10-07",
      "id": "132931",
      "original_text": "Registerbekanntmachung nach dem Umwandlungsgesetz\nNiedersachsen Amtsgericht Osnabrück HRA 209353\nFriedrich kleine Klausing e. K. – Gehrde",
      "type": "Registerbekanntmachung nach dem Umwandlungsgesetz",
      "state": "Niedersachsen",
      "amtsgericht": "Amtsgericht Osnabrück",
      "registernummer": "HRA 209353",
      "registerart": "HRA",
      "company_name": "Friedrich kleine Klausing e. K.",
      "company_seat": "Gehrde",
      "details": "07.10.2025 (Bekanntmachungsdatum)\n\nNiedersachsen Amtsgericht Osnabrück HRA 209353\nRegisterbekanntmachung nach dem Umwandlungsgesetz 07.10.2025 (Eintragungsdatum)\n\nFriedrich kleine Klausing e. K.\nEinzelkaufmann / Einzelkauffrau\nGehrde\n\nDen Gläubigern der an der Ausgliederung beteiligten Rechtsträger ist, wenn sie binnen sechs Monaten nach dem Tag, an dem die Eintragung der Ausgliederung in das Register des Sitzes desjenigen Rechtsträgers, dessen Gläubiger sie sind, nach § 19 Abs. 3 UmwG als bekannt gemacht gilt, ihren Anspruch nach Grund und Höhe schriftlich anmelden, Sicherheit zu leisten, soweit sie nicht Befriedigung verlangen können. Dieses Recht steht den Gläubigern jedoch nur zu, wenn sie glaubhaft machen, dass durch die Ausgliederung die Erfüllung der Forderung gefährdet wird."
    },
    {
      "date": "2025-10-07",
      "id": "132932",
      "original_text": "Löschungsankündigung\nNiedersachsen Amtsgericht Hildesheim HRB 207943\nHof Block Verwaltungs-GmbH – Alfeld",
      "type": "Löschungsankündigung",
      "state": "Niedersachsen",
      "amtsgericht": "Amtsgericht Hildesheim",
      "registernummer": "HRB 207943",
      "registerart": "HRB",
      "company_name": "Hof Block Verwaltungs-GmbH",
      "company_seat": "Alfeld",
      "details": "07.10.2025 (Bekanntmachungsdatum)\n\nNiedersachsen Amtsgericht Hildesheim HRB 207943\nLöschungsankündigung\n\nHof Block Verwaltungs-GmbH\nGesellschaft mit beschränkter Haftung\nAlfeld\n\nDas Registergericht beabsichtigt, die Gesellschaft von Amts wegen nach § 394 FamFG zu löschen. Die Frist zur Erhebung eines Widerspruchs ist auf 1 Monat ab dieser Registerbekanntmachung festgesetzt."
    },
    {
      "date": "2025-10-07",
      "id": "132933",
      "original_text": "Löschungsankündigung\nNiedersachsen Amtsgericht Stadthagen HRB 201317\nNeotol GmbH – Bückeburg",
      "type": "Löschungsankündigung",
      "state": "Niedersachsen",
      "amtsgericht": "Amtsgericht Stadthagen",
      "registernummer": "HRB 201317",
      "registerart": "HRB",
      "company_name": "Neotol GmbH",
      "company_seat": "Bückeburg",
      "details": "07.10.2025 (Bekanntmachungsdatum)\n\nNiedersachsen Amtsgericht Stadthagen HRB 201317\nLöschungsankündigung\n\nNeotol GmbH\nGesellschaft mit beschränkter Haftung\nBückeburg\n\nDas Registergericht beabsichtigt, die Gesellschaft von Amts wegen nach § 394 FamFG zu löschen. Die Frist zur Erhebung eines Widerspruchs ist auf 1 Monat ab dieser Registerbekanntmachung festgesetzt."
    },
    {
      "date": "2025-10-07",
      "id": "132934",
      "original_text": "Registerbekanntmachung nach dem Umwandlungsgesetz\nNiedersachsen Amtsgericht Braunschweig HRB 211821\nDetlef Hahne Holding GmbH – Goslar",
      "type": "Registerbekanntmachung nach dem Umwandlungsgesetz",
      "state": "Niedersachsen",
      "amtsgericht": "Amtsgericht Braunschweig",
      "registernummer": "HRB 211821",
      "registerart": "HRB",
      "company_name": "Detlef Hahne Holding GmbH",
      "company_seat": "Goslar",
      "details": "07.10.2025 (Bekanntmachungsdatum)\n\nNiedersachsen Amtsgericht Braunschweig HRB 211821\nRegisterbekanntmachung nach dem Umwandlungsgesetz 07.10.2025 (Eintragungsdatum)\n\nDetlef Hahne Holding GmbH\nGesellschaft mit beschränkter Haftung\nGoslar\n\nDen Gläubigern der an der Verschmelzung beteiligten Rechtsträger ist, wenn sie binnen sechs Monaten nach dem Tag, an dem die Eintragung der Verschmelzung in das Register des Sitzes desjenigen Rechtsträgers, dessen Gläubiger sie sind, nach § 19  Abs.  3 UmwG als bekannt gemacht gilt, ihren Anspruch nach Grund und Höhe schriftlich anmelden, Sicherheit zu leisten, soweit sie nicht Befriedigung verlangen können. Dieses Recht steht den Gläubigern jedoch nur zu, wenn sie glaubhaft machen, dass durch die Verschmelzung die Erfüllung der Forderung gefährdet wird."
    },
    {
      "date": "2025-10-07",
      "id": "132935",
      "original_text": "Registerbekanntmachung nach dem Umwandlungsgesetz\nNiedersachsen Amtsgericht Hildesheim HRB 204169\nHanseatic Holding GmbH – Hildesheim",
      "type": "Registerbekanntmachung nach dem Umwandlungsgesetz",
      "state": "Niedersachsen",
      "amtsgericht": "Amtsgericht Hildesheim",
      "registernummer": "HRB 204169",
      "registerart": "HRB",
      "company_name": "Hanseatic Holding GmbH",
      "company_seat": "Hildesheim",
      "details": "07.10.2025 (Bekanntmachungsdatum)\n\nNiedersachsen Amtsgericht Hildesheim HRB 204169\nRegisterbekanntmachung nach dem Umwandlungsgesetz 07.10.2025 (Eintragungsdatum)\n\nHanseatic Holding GmbH\nGesellschaft mit beschränkter Haftung\nHildesheim\n\nDen Gläubigern der an der Verschmelzung beteiligten Rechtsträger ist, wenn sie binnen sechs Monaten nach dem Tag, an dem die Eintragung der Verschmelzung in das Register des Sitzes desjenigen Rechtsträgers, dessen Gläubiger sie sind, nach § 19  Abs.  3 UmwG als bekannt gemacht gilt, ihren Anspruch nach Grund und Höhe schriftlich anmelden, Sicherheit zu leisten, soweit sie nicht Befriedigung verlangen können. Dieses Recht steht den Gläubigern jedoch nur zu, wenn sie glaubhaft machen, dass durch die Verschmelzung die Erfüllung der Forderung gefährdet wird."
    },
    {
      "date": "2025-10-07",
      "id": "132936",
      "original_text": "Registerbekanntmachung nach dem Umwandlungsgesetz\nNiedersachsen Amtsgericht Osnabrück HRB 120003 früher Amtsgericht Meppen\nWavin GmbH – Twist",
      "type": "Registerbekanntmachung nach dem Umwandlungsgesetz",
      "state": "Niedersachsen",
      "amtsgericht": "Amtsgericht Osnabrück",
      "registernummer": "HRB 120003",
      "registerart": "HRB",
      "company_name": "Wavin GmbH",
      "company_seat": "Twist",
      "former_amtsgericht": "Meppen",
      "details": "07.10.2025 (Bekanntmachungsdatum)\n\nNiedersachsen Amtsgericht Osnabrück HRB 120003 früher Amtsgericht Meppen\nRegisterbekanntmachung nach dem Umwandlungsgesetz 07.10.2025 (Eintragungsdatum)\n\nWavin GmbH\nGesellschaft mit beschränkter Haftung\nTwist\n\nDen Gläubigern der an der Verschmelzung beteiligten Rechtsträger ist, wenn sie binnen sechs Monaten nach dem Tag, an dem die Eintragung der Verschmelzung in das Register des Sitzes desjenigen Rechtsträgers, dessen Gläubiger sie sind, nach § 19  Abs.  3 UmwG als bekannt gemacht gilt, ihren Anspruch nach Grund und Höhe schriftlich anmelden, Sicherheit zu leisten, soweit sie nicht Befriedigung verlangen können. Dieses Recht steht den Gläubigern jedoch nur zu, wenn sie glaubhaft machen, dass durch die Verschmelzung die Erfüllung der Forderung gefährdet wird."
    },
    {
      "date": "2025-10-07",
      "id": "132937",
      "original_text": "Registerbekanntmachung nach dem Umwandlungsgesetz\nNiedersachsen Amtsgericht Osnabrück HRB 17823\nConcentrix Osnabrück GmbH – Osnabrück",
      "type": "Registerbekanntmachung nach dem Umwandlungsgesetz",
      "state": "Niedersachsen",
      "amtsgericht": "Amtsgericht Osnabrück",
      "registernummer": "HRB 17823",
      "registerart": "HRB",
      "company_name": "Concentrix Osnabrück GmbH",
      "company_seat": "Osnabrück",
      "details": "07.10.2025 (Bekanntmachungsdatum)\n\nNiedersachsen Amtsgericht Osnabrück HRB 17823\nRegisterbekanntmachung nach dem Umwandlungsgesetz 07.10.2025 (Eintragungsdatum)\n\nConcentrix Osnabrück GmbH\nGesellschaft mit beschränkter Haftung\nOsnabrück\n\nDen Gläubigern der an der Verschmelzung beteiligten Rechtsträger ist, wenn sie binnen sechs Monaten nach dem Tag, an dem die Eintragung der Verschmelzung in das Register des Sitzes desjenigen Rechtsträgers, dessen Gläubiger sie sind, nach § 19  Abs.  3 UmwG als bekannt gemacht gilt, ihren Anspruch nach Grund und Höhe schriftlich anmelden, Sicherheit zu leisten, soweit sie nicht Befriedigung verlangen können. Dieses Recht steht den Gläubigern jedoch nur zu, wenn sie glaubhaft machen, dass durch die Verschmelzung die Erfüllung der Forderung gefährdet wird."
    },
    {
      "date": "2025-10-07",
      "id": "132938",
      "original_text": "Registerbekanntmachung nach dem Umwandlungsgesetz\nNiedersachsen Amtsgericht Hildesheim HRB 209019\nWarmbold Türen Tore Fassaden GmbH – Hildesheim",
      "type": "Registerbekanntmachung nach dem Umwandlungsgesetz",
      "state": "Niedersachsen",
      "amtsgericht": "Amtsgericht Hildesheim",
      "registernummer": "HRB 209019",
      "registerart": "HRB",
      "company_name": "Warmbold Türen Tore Fassaden GmbH",
      "company_seat": "Hildesheim",
      "details": "07.10.2025 (Bekanntmachungsdatum)\n\nNiedersachsen Amtsgericht Hildesheim HRB 209019\nRegisterbekanntmachung nach dem Umwandlungsgesetz 07.10.2025 (Eintragungsdatum)\n\nWarmbold Türen Tore Fassaden GmbH\nGesellschaft mit beschränkter Haftung\nHildesheim\n\nDen Gläubigern der an der Verschmelzung beteiligten Rechtsträger ist, wenn sie binnen sechs Monaten nach dem Tag, an dem die Eintragung der Verschmelzung in das Register des Sitzes desjenigen Rechtsträgers, dessen Gläubiger sie sind, nach § 19  Abs.  3 UmwG als bekannt gemacht gilt, ihren Anspruch nach Grund und Höhe schriftlich anmelden, Sicherheit zu leisten, soweit sie nicht Befriedigung verlangen können. Dieses Recht steht den Gläubigern jedoch nur zu, wenn sie glaubhaft machen, dass durch die Verschmelzung die Erfüllung der Forderung gefährdet wird."
    },
    {
      "date": "2025-10-07",
      "id": "132939",
      "original_text": "Registerbekanntmachung nach dem Umwandlungsgesetz\nNiedersachsen Amtsgericht Hildesheim HRB 205063\nHanseatic Projekt Stade GmbH – Hildesheim",
      "type": "Registerbekanntmachung nach dem Umwandlungsgesetz",
      "state": "Niedersachsen",
      "amtsgericht": "Amtsgericht Hildesheim",
      "registernummer": "HRB 205063",
      "registerart": "HRB",
      "company_name": "Hanseatic Projekt Stade GmbH",
      "company_seat": "Hildesheim",
      "details": "07.10.2025 (Bekanntmachungsdatum)\n\nNiedersachsen Amtsgericht Hildesheim HRB 205063\nRegisterbekanntmachung nach dem Umwandlungsgesetz 07.10.2025 (Eintragungsdatum)\n\nHanseatic Projekt Stade GmbH\nGesellschaft mit beschränkter Haftung\nHildesheim\n\nDen Gläubigern der an der Verschmelzung beteiligten Rechtsträger ist, wenn sie binnen sechs Monaten nach dem Tag, an dem die Eintragung der Verschmelzung in das Register des Sitzes desjenigen Rechtsträgers, dessen Gläubiger sie sind, nach § 19  Abs.  3 UmwG als bekannt gemacht gilt, ihren Anspruch nach Grund und Höhe schriftlich anmelden, Sicherheit zu leisten, soweit sie nicht Befriedigung verlangen können. Dieses Recht steht den Gläubigern jedoch nur zu, wenn sie glaubhaft machen, dass durch die Verschmelzung die Erfüllung der Forderung gefährdet wird."
    },
    {
      "date": "2025-10-07",
      "id": "132940",
      "original_text": "Registerbekanntmachung nach dem Umwandlungsgesetz\nNiedersachsen Amtsgericht Lüneburg HRB 1571\n1KOMMA5° Lüneburg GmbH – Kirchgellersen",
      "type": "Registerbekanntmachung nach dem Umwandlungsgesetz",
      "state": "Niedersachsen",
      "amtsgericht": "Amtsgericht Lüneburg",
      "registernummer": "HRB 1571",
      "registerart": "HRB",
      "company_name": "1KOMMA5° Lüneburg GmbH",
      "company_seat": "Kirchgellersen",
      "details": "07.10.2025 (Bekanntmachungsdatum)\n\nNiedersachsen Amtsgericht Lüneburg HRB 1571\nRegisterbekanntmachung nach dem Umwandlungsgesetz 07.10.2025 (Eintragungsdatum)\n\n1KOMMA5° Lüneburg GmbH\nGesellschaft mit beschränkter Haftung\nKirchgellersen\n\nDen Gläubigern der an der Verschmelzung beteiligten Rechtsträger ist, wenn sie binnen sechs Monaten nach dem Tag, an dem die Eintragung der Verschmelzung in das Register des Sitzes desjenigen Rechtsträgers, dessen Gläubiger sie sind, nach § 19  Abs.  3 UmwG als bekannt gemacht gilt, ihren Anspruch nach Grund und Höhe schriftlich anmelden, Sicherheit zu leisten, soweit sie nicht Befriedigung verlangen können. Dieses Recht steht den Gläubigern jedoch nur zu, wenn sie glaubhaft machen, dass durch die Verschmelzung die Erfüllung der Forderung gefährdet wird."
    },
    {
      "date": "2025-10-07",
      "id": "132941",
      "original_text": "Registerbekanntmachung nach dem Umwandlungsgesetz\nNiedersachsen Amtsgericht Osnabrück HRB 202404\nFortwengel Holding GmbH – Sögel",
      "type": "Registerbekanntmachung nach dem Umwandlungsgesetz",
      "state": "Niedersachsen",
      "amtsgericht": "Amtsgericht Osnabrück",
      "registernummer": "HRB 202404",
      "registerart": "HRB",
      "company_name": "Fortwengel Holding GmbH",
      "company_seat": "Sögel",
      "details": "07.10.2025 (Bekanntmachungsdatum)\n\nNiedersachsen Amtsgericht Osnabrück HRB 202404\nRegisterbekanntmachung nach dem Umwandlungsgesetz 07.10.2025 (Eintragungsdatum)\n\nFortwengel Holding GmbH\nGesellschaft mit beschränkter Haftung\nSögel\n\nDen Gläubigern der an der Verschmelzung beteiligten Rechtsträger ist, wenn sie binnen sechs Monaten nach dem Tag, an dem die Eintragung der Verschmelzung in das Register des Sitzes desjenigen Rechtsträgers, dessen Gläubiger sie sind, nach § 19  Abs.  3 UmwG als bekannt gemacht gilt, ihren Anspruch nach Grund und Höhe schriftlich anmelden, Sicherheit zu leisten, soweit sie nicht Befriedigung verlangen können. Dieses Recht steht den Gläubigern jedoch nur zu, wenn sie glaubhaft machen, dass durch die Verschmelzung die Erfüllung der Forderung gefährdet wird."
    },
    {
      "date": "2025-10-07",
      "id": "132942",
      "original_text": "Registerbekanntmachung nach dem Umwandlungsgesetz\nNiedersachsen Amtsgericht Tostedt HRB 204990\nOssi Taxi Helmut Wicht GmbH – Stade",
      "type": "Registerbekanntmachung nach dem Umwandlungsgesetz",
      "state": "Niedersachsen",
      "amtsgericht": "Amtsgericht Tostedt",
      "registernummer": "HRB 204990",
      "registerart": "HRB",
      "company_name": "Ossi Taxi Helmut Wicht GmbH",
      "company_seat": "Stade",
      "details": "07.10.2025 (Bekanntmachungsdatum)\n\nNiedersachsen Amtsgericht Tostedt HRB 204990\nRegisterbekanntmachung nach dem Umwandlungsgesetz 07.10.2025 (Eintragungsdatum)\n\nOssi Taxi Helmut Wicht GmbH\nGesellschaft mit beschränkter Haftung\nStade\n\nDen Gläubigern der an der Ausgliederung beteiligten Rechtsträger ist, wenn sie binnen sechs Monaten nach dem Tag, an dem die Eintragung der Ausgliederung in das Register des Sitzes desjenigen Rechtsträgers, dessen Gläubiger sie sind, nach § 19 Abs. 3 UmwG als bekannt gemacht gilt, ihren Anspruch nach Grund und Höhe schriftlich anmelden, Sicherheit zu leisten, soweit sie nicht Befriedigung verlangen können. Dieses Recht steht den Gläubigern jedoch nur zu, wenn sie glaubhaft machen, dass durch die Ausgliederung die Erfüllung der Forderung gefährdet wird."
    },
    {
      "date": "2025-10-07",
      "id": "132943",
      "original_text": "Registerbekanntmachung nach dem Umwandlungsgesetz\nNiedersachsen Amtsgericht Hildesheim HRB 204169\nHanseatic Holding GmbH – Hildesheim",
      "type": "Registerbekanntmachung nach dem Umwandlungsgesetz",
      "state": "Niedersachsen",
      "amtsgericht": "Amtsgericht Hildesheim",
      "registernummer": "HRB 204169",
      "registerart": "HRB",
      "company_name": "Hanseatic Holding GmbH",
      "company_seat": "Hildesheim",
      "details": "07.10.2025 (Bekanntmachungsdatum)\n\nNiedersachsen Amtsgericht Hildesheim HRB 204169\nRegisterbekanntmachung nach dem Umwandlungsgesetz 07.10.2025 (Eintragungsdatum)\n\nHanseatic Holding GmbH\nGesellschaft mit beschränkter Haftung\nHildesheim\n\nDen Gläubigern der an der Verschmelzung beteiligten Rechtsträger ist, wenn sie binnen sechs Monaten nach dem Tag, an dem die Eintragung der Verschmelzung in das Register des Sitzes desjenigen Rechtsträgers, dessen Gläubiger sie sind, nach § 19  Abs.  3 UmwG als bekannt gemacht gilt, ihren Anspruch nach Grund und Höhe schriftlich anmelden, Sicherheit zu leisten, soweit sie nicht Befriedigung verlangen können. Dieses Recht steht den Gläubigern jedoch nur zu, wenn sie glaubhaft machen, dass durch die Verschmelzung die Erfüllung der Forderung gefährdet wird."
    },
    {
      "date": "2025-10-07",
      "id": "132944",
      "original_text": "Registerbekanntmachung nach dem Umwandlungsgesetz\nNiedersachsen Amtsgericht Hildesheim HRA 203117\nKai Schomburg e. Kfm. – Ottenstein",
      "type": "Registerbekanntmachung nach dem Umwandlungsgesetz",
      "state": "Niedersachsen",
      "amtsgericht": "Amtsgericht Hildesheim",
      "registernummer": "HRA 203117",
      "registerart": "HRA",
      "company_name": "Kai Schomburg e. Kfm.",
      "company_seat": "Ottenstein",
      "details": "07.10.2025 (Bekanntmachungsdatum)\n\nNiedersachsen Amtsgericht Hildesheim HRA 203117\nRegisterbekanntmachung nach dem Umwandlungsgesetz 07.10.2025 (Eintragungsdatum)\n\nKai Schomburg e. Kfm.\nEinzelkaufmann / Einzelkauffrau\nOttenstein\n\nDen Gläubigern der an der Ausgliederung beteiligten Rechtsträger ist, wenn sie binnen sechs Monaten nach dem Tag, an dem die Eintragung der Ausgliederung in das Register des Sitzes desjenigen Rechtsträgers, dessen Gläubiger sie sind, nach § 19 Abs. 3 UmwG als bekannt gemacht gilt, ihren Anspruch nach Grund und Höhe schriftlich anmelden, Sicherheit zu leisten, soweit sie nicht Befriedigung verlangen können. Dieses Recht steht den Gläubigern jedoch nur zu, wenn sie glaubhaft machen, dass durch die Ausgliederung die Erfüllung der Forderung gefährdet wird."
    },
    {
      "date": "2025-10-07",
      "id": "132945",
      "original_text": "Registerbekanntmachung nach dem Umwandlungsgesetz\nBremen Amtsgericht Bremen HRB 2357 BHV\nErich Nonne GmbH – Bremerhaven",
      "type": "Registerbekanntmachung nach dem Umwandlungsgesetz",
      "state": "Bremen",
      "amtsgericht": "Amtsgericht Bremen",
      "registernummer": "HRB 2357 BHV",
      "registerart": "HRB",
      "company_name": "Erich Nonne GmbH",
      "company_seat": "Bremerhaven",
      "details": "07.10.2025 (Bekanntmachungsdatum)\n\nBremen Amtsgericht Bremen HRB 2357 BHV\nRegisterbekanntmachung nach dem Umwandlungsgesetz 30.09.2025 (Eintragungsdatum)\n\nErich Nonne GmbH\nGesellschaft mit beschränkter Haftung\nBremerhaven\n\nZu Eintragungsnummer 9 vom 30.09.2025 wird als nicht eingetragen veröffentlicht:  Den Gläubigern der an der Verschmelzung beteiligten Rechtsträger ist, wenn sie binnen sechs Monaten nach dem Tag, an dem die Eintragung der Verschmelzung in das Register des Sitzes desjenigen Rechtsträgers, dessen Gläubiger sie sind, als bekannt gemacht gilt, ihren Anspruch nach Grund und Höhe schriftlich anmelden, Sicherheit zu leisten, soweit sie nicht Befriedigung verlangen können. Dieses Recht steht den Gläubigern jedoch nur zu, wenn sie glaubhaft machen, dass durch die Verschmelzung die Erfüllung ihrer Forderung gefährdet wird. Das Recht, Sicherheitsleistung zu verlangen, steht Gläubigern nicht zu, die im Falle der Insolvenz ein Recht auf vorzugsweise Befriedigung aus einer Deckungsmasse haben, die nach gesetzlicher Vorschrift zu ihrem Schutz errichtet und staatlich überwacht ist."
    },
    {
      "date": "2025-10-07",
      "id": "132946",
      "original_text": "Registerbekanntmachung nach dem Umwandlungsgesetz\nBremen Amtsgericht Bremen HRB 4489\nVerlag für Staatsbürgerkunde Gesellschaft mit beschränkter Haftung – Bremen",
      "type": "Registerbekanntmachung nach dem Umwandlungsgesetz",
      "state": "Bremen",
      "amtsgericht": "Amtsgericht Bremen",
      "registernummer": "HRB 4489",
      "registerart": "HRB",
      "company_name": "Verlag für Staatsbürgerkunde Gesellschaft mit beschränkter Haftung",
      "company_seat": "Bremen",
      "details": "07.10.2025 (Bekanntmachungsdatum)\n\nBremen Amtsgericht Bremen HRB 4489\nRegisterbekanntmachung nach dem Umwandlungsgesetz 01.10.2025 (Eintragungsdatum)\n\nVerlag für Staatsbürgerkunde Gesellschaft mit beschränkter Haftung\nGesellschaft mit beschränkter Haftung\nBremen\n\nAls nicht eingetragen wird veröffentlicht: Den Gläubigern der an der Verschmelzung beteiligten Rechtsträger ist, wenn sie binnen sechs Monaten nach dem Tag, an dem die Eintragung der Verschmelzung in das Register des Sitzes desjenigen Rechtsträgers, dessen Gläubiger sie sind, als bekannt gemacht gilt, ihren Anspruch nach Grund und Höhe schriftlich anmelden, Sicherheit zu leisten, soweit sie nicht Befriedigung verlangen können. Dieses Recht steht den Gläubigern jedoch nur zu, wenn sie glaubhaft machen, dass durch die Verschmelzung die Erfüllung ihrer Forderung gefährdet wird. Das Recht, Sicherheitsleistung zu verlangen, steht Gläubigern nicht zu, die im Falle der Insolvenz ein Recht auf vorzugsweise Befriedigung aus einer Deckungsmasse haben, die nach gesetzlicher Vorschrift zu ihrem Schutz errichtet und staatlich überwacht ist."
    },
    {
      "date": "2025-10-07",
      "id": "132947",
      "original_text": "Registerbekanntmachung nach dem Umwandlungsgesetz\nBremen Amtsgericht Bremen HRB 36074\nRelyOn Germany GmbH – Bremerhaven",
      "type": "Registerbekanntmachung nach dem Umwandlungsgesetz",
      "state": "Bremen",
      "amtsgericht": "Amtsgericht Bremen",
      "registernummer": "HRB 36074",
      "registerart": "HRB",
      "company_name": "RelyOn Germany GmbH",
      "company_seat": "Bremerhaven",
      "details": "07.10.2025 (Bekanntmachungsdatum)\n\nBremen Amtsgericht Bremen HRB 36074\nRegisterbekanntmachung nach dem Umwandlungsgesetz 01.10.2025 (Eintragungsdatum)\n\nRelyOn Germany GmbH\nGesellschaft mit beschränkter Haftung\nBremerhaven\n\nAls nicht eingetragen wird veröffentlicht: Den Gläubigern der an der Verschmelzung beteiligten Rechtsträger ist, wenn sie binnen sechs Monaten nach dem Tag, an dem die Eintragung der Verschmelzung in das Register des Sitzes desjenigen Rechtsträgers, dessen Gläubiger sie sind, als bekannt gemacht gilt, ihren Anspruch nach Grund und Höhe schriftlich anmelden, Sicherheit zu leisten, soweit sie nicht Befriedigung verlangen können. Dieses Recht steht den Gläubigern jedoch nur zu, wenn sie glaubhaft machen, dass durch die Verschmelzung die Erfüllung ihrer Forderung gefährdet wird. Das Recht, Sicherheitsleistung zu verlangen, steht Gläubigern nicht zu, die im Falle der Insolvenz ein Recht auf vorzugsweise Befriedigung aus einer Deckungsmasse haben, die nach gesetzlicher Vorschrift zu ihrem Schutz errichtet und staatlich überwacht ist."
    },
    {
      "date": "2025-10-07",
      "id": "132948",
      "original_text": "Registerbekanntmachung nach dem Umwandlungsgesetz\nBremen Amtsgericht Bremen HRB 31124\nT + T Treuhand und Asset Management GmbH – Bremen",
      "type": "Registerbekanntmachung nach dem Umwandlungsgesetz",
      "state": "Bremen",
      "amtsgericht": "Amtsgericht Bremen",
      "registernummer": "HRB 31124",
      "registerart": "HRB",
      "company_name": "T + T Treuhand und Asset Management GmbH",
      "company_seat": "Bremen",
      "details": "07.10.2025 (Bekanntmachungsdatum)\n\nBremen Amtsgericht Bremen HRB 31124\nRegisterbekanntmachung nach dem Umwandlungsgesetz 06.10.2025 (Eintragungsdatum)\n\nT + T Treuhand und Asset Management GmbH\nGesellschaft mit beschränkter Haftung\nBremen\n\nZu Eintragungsnummer 3 vom 06.10.2025 wird als nicht eingetragen veröffentlicht: Den Gläubigern der an der Verschmelzung beteiligten Rechtsträger ist, wenn sie binnen sechs Monaten nach dem Tag, an dem die Eintragung der Verschmelzung in das Register des Sitzes desjenigen Rechtsträgers, dessen Gläubiger sie sind, als bekannt gemacht gilt, ihren Anspruch nach Grund und Höhe schriftlich anmelden, Sicherheit zu leisten, soweit sie nicht Befriedigung verlangen können. Dieses Recht steht den Gläubigern jedoch nur zu, wenn sie glaubhaft machen, dass durch die Verschmelzung die Erfüllung ihrer Forderung gefährdet wird. Das Recht, Sicherheitsleistung zu verlangen, steht Gläubigern nicht zu, die im Falle der Insolvenz ein Recht auf vorzugsweise Befriedigung aus einer Deckungsmasse haben, die nach gesetzlicher Vorschrift zu ihrem Schutz errichtet und staatlich überwacht ist."
    },
    {
      "date": "2025-10-07",
      "id": "132949",
      "original_text": "Registerbekanntmachung nach dem Umwandlungsgesetz\nBremen Amtsgericht Bremen HRB 33427\nSpielhalle GmbH Verden – Bremen",
      "type": "Registerbekanntmachung nach dem Umwandlungsgesetz",
      "state": "Bremen",
      "amtsgericht": "Amtsgericht Bremen",
      "registernummer": "HRB 33427",
      "registerart": "HRB",
      "company_name": "Spielhalle GmbH Verden",
      "company_seat": "Bremen",
      "details": "07.10.2025 (Bekanntmachungsdatum)\n\nBremen Amtsgericht Bremen HRB 33427\nRegisterbekanntmachung nach dem Umwandlungsgesetz 02.10.2025 (Eintragungsdatum)\n\nSpielhalle GmbH Verden\nGesellschaft mit beschränkter Haftung\nBremen\n\nZu Eintragungsnummer 4 vom 02.10.2025 wird als nicht eingetragen veröffentlicht:  Den Gläubigern der an der Verschmelzung beteiligten Rechtsträger ist, wenn sie binnen sechs Monaten nach dem Tag, an dem die Eintragung der Verschmelzung in das Register des Sitzes desjenigen Rechtsträgers, dessen Gläubiger sie sind, als bekannt gemacht gilt, ihren Anspruch nach Grund und Höhe schriftlich anmelden, Sicherheit zu leisten, soweit sie nicht Befriedigung verlangen können. Dieses Recht steht den Gläubigern jedoch nur zu, wenn sie glaubhaft machen, dass durch die Verschmelzung die Erfüllung ihrer Forderung gefährdet wird. Das Recht, Sicherheitsleistung zu verlangen, steht Gläubigern nicht zu, die im Falle der Insolvenz ein Recht auf vorzugsweise Befriedigung aus einer Deckungsmasse haben, die nach gesetzlicher Vorschrift zu ihrem Schutz errichtet und staatlich überwacht ist."
    },
    {
      "date": "2025-10-07",
      "id": "132950",
      "original_text": "Registerbekanntmachung nach dem Umwandlungsgesetz\nRheinland-Pfalz Amtsgericht Koblenz HRB 30877\nLFAS Merger GmbH – Koblenz",
      "type": "Registerbekanntmachung nach dem Umwandlungsgesetz",
      "state": "Rheinland-Pfalz",
      "amtsgericht": "Amtsgericht Koblenz",
      "registernummer": "HRB 30877",
      "registerart": "HRB",
      "company_name": "LFAS Merger GmbH",
      "company_seat": "Koblenz",
      "details": "07.10.2025 (Bekanntmachungsdatum)\n\nRheinland-Pfalz Amtsgericht Koblenz HRB 30877\nRegisterbekanntmachung nach dem Umwandlungsgesetz 07.10.2025 (Eintragungsdatum)\n\nLFAS Merger GmbH\nGesellschaft mit beschränkter Haftung\nKoblenz\n\nAls nicht eingetragen wird veröffentlicht: Den Gläubigern der an der Verschmelzung beteiligten Rechtsträger ist, wenn sie binnen sechs Monaten nach dem Tag, an dem die Eintragung der Verschmelzung in das Register des Sitzes desjenigen Rechtsträgers,dessen Gläubiger sie sind, nach § 19 Abs. 3 UmwG als bekannt gemacht gilt, ihren Anspruch nach Grund und Höhe schriftlich anmelden, Sicherheit zu leisten, soweit sie nicht Befriedigung verlangen können. Dieses Recht steht den Gläubigern jedoch nur zu, wenn sie glaubhaft machen, dass durch die Verschmelzung die Erfüllungd er Forderung gefährdet wird."
    },
    {
      "date": "2025-10-07",
      "id": "132951",
      "original_text": "Registerbekanntmachung nach dem Umwandlungsgesetz\nRheinland-Pfalz Amtsgericht Koblenz HRB 31385\nBBT Region Koblenz-Saffig gGmbH – Koblenz",
      "type": "Registerbekanntmachung nach dem Umwandlungsgesetz",
      "state": "Rheinland-Pfalz",
      "amtsgericht": "Amtsgericht Koblenz",
      "registernummer": "HRB 31385",
      "registerart": "HRB",
      "company_name": "BBT Region Koblenz-Saffig gGmbH",
      "company_seat": "Koblenz",
      "details": "07.10.2025 (Bekanntmachungsdatum)\n\nRheinland-Pfalz Amtsgericht Koblenz HRB 31385\nRegisterbekanntmachung nach dem Umwandlungsgesetz 07.10.2025 (Eintragungsdatum)\n\nBBT Region Koblenz-Saffig gGmbH\nGesellschaft mit beschränkter Haftung\nKoblenz\n\nAls nicht eingetragen wird veröffentlicht: Den Gläubigern der an der Ausgliederung beteiligten Rechtsträger ist, wenn sie binnen sechs Monaten nach dem Tag, an dem die Eintragung der Ausgliederung in das Register des Sitzes desjenigen Rechtsträgers,dessen Gläubiger sie sind, nach § 19 Abs. 3 UmwG als bekannt gemacht gilt, ihren Anspruch nach Grund und Höhe schriftlich anmelden, Sicherheit zu leisten, soweit sie nicht Befriedigung verlangen können. Dieses Recht steht den Gläubigern jedoch nur zu, wenn sie glaubhaft machen, dass durch die Ausgliederung die Erfüllung der Forderung gefährdet wird."
    },
    {
      "date": "2025-10-07",
      "id": "132952",
      "original_text": "Löschungsankündigung\nRheinland-Pfalz Amtsgericht Koblenz HRB 26301\nSonnenschein Consult UG (haftungsbeschränkt) – Polch",
      "type": "Löschungsankündigung",
      "state": "Rheinland-Pfalz",
      "amtsgericht": "Amtsgericht Koblenz",
      "registernummer": "HRB 26301",
      "registerart": "HRB",
      "company_name": "Sonnenschein Consult UG (haftungsbeschränkt)",
      "company_seat": "Polch",
      "details": "07.10.2025 (Bekanntmachungsdatum)\n\nRheinland-Pfalz Amtsgericht Koblenz HRB 26301\nLöschungsankündigung\n\nSonnenschein Consult UG (haftungsbeschränkt)\nGesellschaft mit beschränkter Haftung\nPolch\n\nDas Registergericht beabsichtigt die Gesellschaft von Amts wegen nach § 394 FamFG zu löschen. Die Frist zur Erhebung eines Widerspruchs ist auf einen Monat festgesetzt."
    },
    {
      "date": "2025-10-07",
      "id": "132953",
      "original_text": "Registerbekanntmachung nach dem Umwandlungsgesetz\nRheinland-Pfalz Amtsgericht Koblenz HRA 23330\nLAUER-FISCHER ApothekenService SE & Co. KG – Koblenz",
      "type": "Registerbekanntmachung nach dem Umwandlungsgesetz",
      "state": "Rheinland-Pfalz",
      "amtsgericht": "Amtsgericht Koblenz",
      "registernummer": "HRA 23330",
      "registerart": "HRA",
      "company_name": "LAUER-FISCHER ApothekenService SE & Co. KG",
      "company_seat": "Koblenz",
      "details": "07.10.2025 (Bekanntmachungsdatum)\n\nRheinland-Pfalz Amtsgericht Koblenz HRA 23330\nRegisterbekanntmachung nach dem Umwandlungsgesetz 07.10.2025 (Eintragungsdatum)\n\nLAUER-FISCHER ApothekenService SE & Co. KG\nKommanditgesellschaft\nKoblenz\n\nAls nicht eingetragen wird veröffentlicht: Den Gläubigern der an der Verschmelzung beteiligten Rechtsträger ist, wenn sie binnen sechs Monaten nach dem Tag, an dem die Eintragung der Verschmelzung in das Register des Sitzes desjenigen Rechtsträgers,dessen Gläubiger sie sind, nach § 19 Abs. 3 UmwG als bekannt gemacht gilt, ihren Anspruch nach Grund und Höhe schriftlich anmelden, Sicherheit zu leisten, soweit sie nicht Befriedigung verlangen können. Dieses Recht steht den Gläubigern jedoch nur zu, wenn sie glaubhaft machen, dass durch die Verschmelzung die Erfüllungd er Forderung gefährdet wird."
    },
    {
      "date": "2025-10-07",
      "id": "132954",
      "original_text": "Registerbekanntmachung nach dem Umwandlungsgesetz\nRheinland-Pfalz Amtsgericht Koblenz HRB 13829\nVerlag für Anzeigenblätter Gesellschaft mit beschränkter Haftung – Mülheim-Kärlich",
      "type": "Registerbekanntmachung nach dem Umwandlungsgesetz",
      "state": "Rheinland-Pfalz",
      "amtsgericht": "Amtsgericht Koblenz",
      "registernummer": "HRB 13829",
      "registerart": "HRB",
      "company_name": "Verlag für Anzeigenblätter Gesellschaft mit beschränkter Haftung",
      "company_seat": "Mülheim-Kärlich",
      "details": "07.10.2025 (Bekanntmachungsdatum)\n\nRheinland-Pfalz Amtsgericht Koblenz HRB 13829\nRegisterbekanntmachung nach dem Umwandlungsgesetz 07.10.2025 (Eintragungsdatum)\n\nVerlag für Anzeigenblätter Gesellschaft mit beschränkter Haftung\nGesellschaft mit beschränkter Haftung\nMülheim-Kärlich\n\nAls nicht eingetragen wird veröffentlicht: Den Gläubigern der an der Verschmelzung beteiligten Rechtsträger ist, wenn sie binnen sechs Monaten nach dem Tag, an dem die Eintragung der Verschmelzung in das Register des Sitzes desjenigen Rechtsträgers,dessen Gläubiger sie sind, nach § 19 Abs. 3 UmwG als bekannt gemacht gilt, ihren Anspruch nach Grund und Höhe schriftlich anmelden, Sicherheit zu leisten, soweit sie nicht Befriedigung verlangen können. Dieses Recht steht den Gläubigern jedoch nur zu, wenn sie glaubhaft machen, dass durch die Verschmelzung die Erfüllungd er Forderung gefährdet wird."
    },
    {
      "date": "2025-10-07",
      "id": "132955",
      "original_text": "Registerbekanntmachung nach dem Umwandlungsgesetz\nRheinland-Pfalz Amtsgericht Koblenz HRB 24056\nBarmherzige Brüder Trier gGmbH – Koblenz",
      "type": "Registerbekanntmachung nach dem Umwandlungsgesetz",
      "state": "Rheinland-Pfalz",
      "amtsgericht": "Amtsgericht Koblenz",
      "registernummer": "HRB 24056",
      "registerart": "HRB",
      "company_name": "Barmherzige Brüder Trier gGmbH",
      "company_seat": "Koblenz",
      "details": "07.10.2025 (Bekanntmachungsdatum)\n\nRheinland-Pfalz Amtsgericht Koblenz HRB 24056\nRegisterbekanntmachung nach dem Umwandlungsgesetz 07.10.2025 (Eintragungsdatum)\n\nBarmherzige Brüder Trier gGmbH\nGesellschaft mit beschränkter Haftung\nKoblenz\n\nAls nicht eingetragen wird veröffentlicht: Den Gläubigern der an der Ausgliederung beteiligten Rechtsträger ist, wenn sie binnen sechs Monaten nach dem Tag, an dem die Eintragung der Ausgliederung in das Register des Sitzes desjenigen Rechtsträgers,dessen Gläubiger sie sind, nach § 19 Abs. 3 UmwG als bekannt gemacht gilt, ihren Anspruch nach Grund und Höhe schriftlich anmelden, Sicherheit zu leisten, soweit sie nicht Befriedigung verlangen können. Dieses Recht steht den Gläubigern jedoch nur zu, wenn sie glaubhaft machen, dass durch die Ausgliederung die Erfüllung der Forderung gefährdet wird."
    },
    {
      "date": "2025-10-07",
      "id": "132956",
      "original_text": "Registerbekanntmachung nach dem Umwandlungsgesetz\nRheinland-Pfalz Amtsgericht Koblenz HRB 21807\nMEDIA Direktmarketing GmbH – Koblenz",
      "type": "Registerbekanntmachung nach dem Umwandlungsgesetz",
      "state": "Rheinland-Pfalz",
      "amtsgericht": "Amtsgericht Koblenz",
      "registernummer": "HRB 21807",
      "registerart": "HRB",
      "company_name": "MEDIA Direktmarketing GmbH",
      "company_seat": "Koblenz",
      "details": "07.10.2025 (Bekanntmachungsdatum)\n\nRheinland-Pfalz Amtsgericht Koblenz HRB 21807\nRegisterbekanntmachung nach dem Umwandlungsgesetz 07.10.2025 (Eintragungsdatum)\n\nMEDIA Direktmarketing GmbH\nGesellschaft mit beschränkter Haftung\nKoblenz\n\nAls nicht eingetragen wird veröffentlicht: Den Gläubigern der an der Verschmelzung beteiligten Rechtsträger ist, wenn sie binnen sechs Monaten nach dem Tag, an dem die Eintragung der Verschmelzung in das Register des Sitzes desjenigen Rechtsträgers,dessen Gläubiger sie sind, nach § 19 Abs. 3 UmwG als bekannt gemacht gilt, ihren Anspruch nach Grund und Höhe schriftlich anmelden, Sicherheit zu leisten, soweit sie nicht Befriedigung verlangen können. Dieses Recht steht den Gläubigern jedoch nur zu, wenn sie glaubhaft machen, dass durch die Verschmelzung die Erfüllungd er Forderung gefährdet wird."
    },
    {
      "date": "2025-10-07",
      "id": "132957",
      "original_text": "Einreichung neuer Dokumente\nRheinland-Pfalz Amtsgericht Mainz HRB 651\nMainzer Stadtwerke AG – Mainz",
      "type": "Einreichung neuer Dokumente",
      "state": "Rheinland-Pfalz",
      "amtsgericht": "Amtsgericht Mainz",
      "registernummer": "HRB 651",
      "registerart": "HRB",
      "company_name": "Mainzer Stadtwerke AG",
      "company_seat": "Mainz",
      "details": "07.10.2025 (Bekanntmachungsdatum)\n\nRheinland-Pfalz Amtsgericht Mainz HRB 651\nEinreichung neuer Dokumente\n\nMainzer Stadtwerke AG\nAktiengesellschaft\nMainz\n\nDem Registergericht ist eine Liste der Mitglieder des Aufsichtsrates eingereicht worden."
    },
    {
      "date": "2025-10-07",
      "id": "132958",
      "original_text": "Löschungsankündigung\nNordrhein-Westfalen Amtsgericht Aachen HRB 21308\nPU-Solutions UG (haftungsbeschränkt) – Baesweiler",
      "type": "Löschungsankündigung",
      "state": "Nordrhein-Westfalen",
      "amtsgericht": "Amtsgericht Aachen",
      "registernummer": "HRB 21308",
      "registerart": "HRB",
      "company_name": "PU-Solutions UG (haftungsbeschränkt)",
      "company_seat": "Baesweiler",
      "details": "07.10.2025 (Bekanntmachungsdatum)\n\nNordrhein-Westfalen Amtsgericht Aachen HRB 21308\nLöschungsankündigung\n\nPU-Solutions UG (haftungsbeschränkt)\nGesellschaft mit beschränkter Haftung\nBaesweiler\n\nDas Registergericht beabsichtigt, von Amts wegen die Gesellschaft wegen Vermögenslosigkeit nach § 394 FamFG zu löschen, weil das Finanzamt Aachen-Kreis mit Schreiben vom 23.09.2025 und 25.08.2025 Umstände mitgeteilt hat, aufgrund derer das Gericht davon überzeugt ist, dass die Gesellschaft vollständig vermögenslos ist.\n\nZur Geltendmachung des Widerspruchs gegen die beabsichtigte Löschung wird hiermit eine Frist von einem Monat ab Veröffentlichung dieser Ankündigung bestimmt.\n\nRechtsbehelfsbelehrung:\n\nGegen diese Verfügung kann Widerspruch eingelegt werden. Zum Widerspruch ist jeder berechtigt, der an der Unterlassung der Löschung ein berechtigtes Interesse hat.\n\nDer Widerspruch ist bei dem Amtsgericht Aachen, Adalbertsteinweg 92, 52070 Aachen schriftlich in deutscher Sprache oder zur Niederschrift der Geschäftsstelle einzulegen. Der Widerspruch kann auch zur Niederschrift der Geschäftsstelle eines jeden Amtsgerichtes abgegeben werden.\n\nDer Widerspruch muss spätestens innerhalb der gesetzten Frist nach der Bekanntgabe der Verfügung bei dem Amtsgericht Aachen eingegangen sein. Dies gilt auch dann, wenn der Widerspruch zur Niederschrift der Geschäftsstelle eines anderen Amtsgerichtes abgegeben wurde. Die Frist beginnt mit der Bekanntgabe der Verfügung durch Veröffentlichung. Fällt das Ende der Frist auf einen Sonntag, einen allgemeinen Feiertag oder Sonnabend, so endet die Frist mit Ablauf des nächsten Werktages.\n\nDer Widerspruch muss die Bezeichnung der angefochtenen Verfügung sowie die Erklärung enthalten, dass Widerspruch gegen diese Verfügung eingelegt wird. Er ist zu unterzeichnen und soll begründet werden.\n\nDie Einlegung ist auch durch Übertragung eines elektronischen Dokuments an die elektronische Poststelle des Gerichts möglich. Das elektronische Dokument muss für die Bearbeitung durch das Gericht geeignet und mit einer qualifizierten elektronischen Signatur der verantwortenden Person versehen sein oder von der verantwortenden Person signiert und auf einem sicheren Übermittlungsweg gemäß § 130 a ZPO nach näherer Maßgabe der Verordnung über die technischen Rahmenbedingungen des elektronischen Rechtsverkehrs und über das besondere elektronische Behördenpostfach (BGBl. I, S. 3803) eingereicht werden. Weitere Informationen erhalten Sie auf der Internetseite www.justiz.de."
    },
    {
      "date": "2025-10-07",
      "id": "132959",
      "original_text": "Registerbekanntmachung nach dem Umwandlungsgesetz\nNordrhein-Westfalen Amtsgericht Wuppertal HRB 10268\nKobold Management Systeme GmbH – Wuppertal",
      "type": "Registerbekanntmachung nach dem Umwandlungsgesetz",
      "state": "Nordrhein-Westfalen",
      "amtsgericht": "Amtsgericht Wuppertal",
      "registernummer": "HRB 10268",
      "registerart": "HRB",
      "company_name": "Kobold Management Systeme GmbH",
      "company_seat": "Wuppertal",
      "details": "07.10.2025 (Bekanntmachungsdatum)\n\nNordrhein-Westfalen Amtsgericht Wuppertal HRB 10268\nRegisterbekanntmachung nach dem Umwandlungsgesetz 07.10.2025 (Eintragungsdatum)\n\nKobold Management Systeme GmbH\nGesellschaft mit beschränkter Haftung\nWuppertal\n\nDen Gläubigern der an der Verschmelzung beteiligten Rechtsträger ist, wenn sie binnen sechs Monaten nach dem Tag, an dem die Eintragung der Verschmelzung in das Register des Sitzes derjenigen Rechtsträger deren Gläubiger sie sind, nach § 19 Absatz 3 UmwG als bekanntgemacht gilt, ihren Anspruch nach Grund und Höhe schriftlich anmelden, Sicherheit zu leisten, soweit sie nicht Befriedigung verlangen können. Dieses Recht steht den Gläubigern jedoch nur zu, wenn sie glaubhaft machen, dass durch die Verschmelzung die Erfüllung ihrer Forderung gefährdet wird."
    },
    {
      "date": "2025-10-07",
      "id": "132960",
      "original_text": "Einreichung neuer Dokumente\nNordrhein-Westfalen Amtsgericht Essen HRB 31635\nSTEAG Power GmbH – Essen",
      "type": "Einreichung neuer Dokumente",
      "state": "Nordrhein-Westfalen",
      "amtsgericht": "Amtsgericht Essen",
      "registernummer": "HRB 31635",
      "registerart": "HRB",
      "company_name": "STEAG Power GmbH",
      "company_seat": "Essen",
      "details": "07.10.2025 (Bekanntmachungsdatum)\n\nNordrhein-Westfalen Amtsgericht Essen HRB 31635\nEinreichung neuer Dokumente\n\nSTEAG Power GmbH\nGesellschaft mit beschränkter Haftung\nEssen\n\nAls nicht eingetragen wird bekannt gegeben:\nDem Registergericht ist eine neue Liste der Mitglieder des Aufsichtsrates eingereicht worden."
    },
    {
      "date": "2025-10-07",
      "id": "132961",
      "original_text": "Löschungsankündigung\nNordrhein-Westfalen Amtsgericht Hamm HRB 9907\nStar Bau Design GmbH – Bönen",
      "type": "Löschungsankündigung",
      "state": "Nordrhein-Westfalen",
      "amtsgericht": "Amtsgericht Hamm",
      "registernummer": "HRB 9907",
      "registerart": "HRB",
      "company_name": "Star Bau Design GmbH",
      "company_seat": "Bönen",
      "details": "07.10.2025 (Bekanntmachungsdatum)\n\nNordrhein-Westfalen Amtsgericht Hamm HRB 9907\nLöschungsankündigung\n\nStar Bau Design GmbH\nGesellschaft mit beschränkter Haftung\nBönen\n\nDas Registergericht beabsichtigt die Gesellschaft von Amts wegen nach § 394 FamFG zu löschen. Die Frist zur Erhebung eines Widerspruchs ist auf drei Monate festgesetzt."
    },
    {
      "date": "2025-10-07",
      "id": "132962",
      "original_text": "Registerbekanntmachung nach dem Umwandlungsgesetz\nNordrhein-Westfalen Amtsgericht Gelsenkirchen HRB 4737\nMarienhospital Bottrop gGmbH – Bottrop",
      "type": "Registerbekanntmachung nach dem Umwandlungsgesetz",
      "state": "Nordrhein-Westfalen",
      "amtsgericht": "Amtsgericht Gelsenkirchen",
      "registernummer": "HRB 4737",
      "registerart": "HRB",
      "company_name": "Marienhospital Bottrop gGmbH",
      "company_seat": "Bottrop",
      "details": "07.10.2025 (Bekanntmachungsdatum)\n\nNordrhein-Westfalen Amtsgericht Gelsenkirchen HRB 4737\nRegisterbekanntmachung nach dem Umwandlungsgesetz 07.10.2025 (Eintragungsdatum)\n\nMarienhospital Bottrop gGmbH\nGesellschaft mit beschränkter Haftung\nBottrop\n\nDen Gläubigern der an der Verschmelzung beteiligten Rechtsträger ist, wenn sie binnen sechs Monaten nach dem Tag, an dem die Eintragung der Verschmelzung in das Register des Sitzes desjenigen Rechtsträgers, dessen Gläubiger sie sind, nach § 19 Absatz 3 UmwG als bekanntgemacht gilt, ihren Anspruch nach Grund und Höhe schriftlich anmelden, Sicherheit zu leisten, soweit sie nicht Befriedigung verlangen können. Dieses Recht steht den Gläubigern jedoch nur zu, wenn sie glaubhaft machen, dass durch die Verschmelzung die Erfüllung ihrer Forderung gefährdet wird."
    },
    {
      "date": "2025-10-07",
      "id": "132963",
      "original_text": "Löschungsankündigung\nNordrhein-Westfalen Amtsgericht Aachen HRB 24077\nRIPARO GmbH – Stolberg",
      "type": "Löschungsankündigung",
      "state": "Nordrhein-Westfalen",
      "amtsgericht": "Amtsgericht Aachen",
      "registernummer": "HRB 24077",
      "registerart": "HRB",
      "company_name": "RIPARO GmbH",
      "company_seat": "Stolberg",
      "details": "07.10.2025 (Bekanntmachungsdatum)\n\nNordrhein-Westfalen Amtsgericht Aachen HRB 24077\nLöschungsankündigung\n\nRIPARO GmbH\nGesellschaft mit beschränkter Haftung\nStolberg\n\nDas Registergericht beabsichtigt, von Amts wegen die Gesellschaft wegen Vermögenslosigkeit nach § 394 FamFG zu löschen, weil das Finanzamt   Aachen-Kreis mit Schreiben vom 08.09.2025 und 26.09.2025 Umstände mitgeteilt hat, aufgrund derer das Gericht davon überzeugt ist, dass die Gesellschaft vollständig vermögenslos ist.\n\nZur Geltendmachung des Widerspruchs gegen die beabsichtigte Löschung wird hiermit eine Frist von einem Monat ab Veröffentlichung dieser Ankündigung bestimmt.Das Registergericht beabsichtigt, die im Handelsregister eingetragene Firma von Amts wegen nach §§ 31 Abs. 2 HGB, 393 FamFG zu löschen.\n\nZur Geltendmachung des Widerspruchs gegen die beabsichtigte Löschung wird hiermit eine Frist von einem Monat ab Veröffentlichung dieser Ankündigung bestimmt.\n\nRechtsbehelfsbelehrung:\n\nGegen diese Verfügung kann Widerspruch eingelegt werden.\n\nDer Widerspruch ist bei dem Amtsgericht Aachen, Adalbertsteinweg 92, 52070 Aachen schriftlich in deutscher Sprache oder zur Niederschrift der Geschäftsstelle einzulegen. Der Widerspruch kann auch zur Niederschrift der Geschäftsstelle eines jeden Amtsgerichtes abgegeben werden.\n\nDer Widerspruch muss spätestens innerhalb der gesetzten Frist nach der Bekanntgabe der Verfügung bei dem Amtsgericht Aachen eingegangen sein. Dies gilt auch dann, wenn der Widerspruch zur Niederschrift der Geschäftsstelle eines anderen Amtsgerichtes abgegeben wurde. Die Frist beginnt mit der Bekanntgabe der Verfügung durch Veröffentlichung. Fällt das Ende der Frist auf einen Sonntag, einen allgemeinen Feiertag oder Sonnabend, so endet die Frist mit Ablauf des nächsten Werktages.\n\nDer Widerspruch muss die Bezeichnung der angefochtenen Verfügung sowie die Erklärung enthalten, dass Widerspruch gegen diese Verfügung eingelegt wird. Er ist zu unterzeichnen und soll begründet werden.\n\nDie Einlegung ist auch durch Übertragung eines elektronischen Dokuments an die elektronische Poststelle des Gerichts möglich. Das elektronische Dokument muss für die Bearbeitung durch das Gericht geeignet und mit einer qualifizierten elektronischen Signatur der verantwortenden Person versehen sein oder von der verantwortenden Person signiert und auf einem sicheren Übermittlungsweg gemäß § 130 a ZPO nach näherer Maßgabe der Verordnung über die technischen Rahmenbedingungen des elektronischen Rechtsverkehrs und über das besondere elektronische Behördenpostfach (BGBl. I, S. 3803) eingereicht werden. Weitere Informationen erhalten Sie auf der Internetseite www.justiz.de."
    },
    {
      "date": "2025-10-07",
      "id": "132964",
      "original_text": "Registerbekanntmachung nach dem Umwandlungsgesetz\nNordrhein-Westfalen Amtsgericht Paderborn GnR 303\nVR Bank Westfalen-Lippe eG – Lippstadt",
      "type": "Registerbekanntmachung nach dem Umwandlungsgesetz",
      "state": "Nordrhein-Westfalen",
      "amtsgericht": "Amtsgericht Paderborn",
      "registernummer": "GnR 303",
      "registerart": "GnR",
      "company_name": "VR Bank Westfalen-Lippe eG",
      "company_seat": "Lippstadt",
      "details": "07.10.2025 (Bekanntmachungsdatum)\n\nNordrhein-Westfalen Amtsgericht Paderborn GnR 303\nRegisterbekanntmachung nach dem Umwandlungsgesetz 07.10.2025 (Eintragungsdatum)\n\nVR Bank Westfalen-Lippe eG\neingetragene Genossenschaft\nLippstadt\n\nDen Gläubigern der an der Verschmelzung beteiligten Rechtsträger ist, wenn sie binnen sechs Monaten nach dem Tag, an dem die Eintragung der Verschmelzung in das Register des Sitzes desjenigen Rechtsträgers, dessen Gläubiger sie sind, nach § 19 Absatz 3 UmwG als bekanntgemacht gilt, ihren Anspruch nach Grund und Höhe schriftlich anmelden, Sicherheit zu leisten, soweit sie nicht Befriedigung verlangen können. Dieses Recht steht den Gläubigern jedoch nur zu, wenn sie glaubhaft machen, dass durch die Verschmelzung die Erfüllung ihrer Forderung gefährdet wird."
    },
    {
      "date": "2025-10-07",
      "id": "132965",
      "original_text": "Löschungsankündigung\nNordrhein-Westfalen Amtsgericht Aachen HRB 21207\nTUSBA Trading GmbH – Aachen",
      "type": "Löschungsankündigung",
      "state": "Nordrhein-Westfalen",
      "amtsgericht": "Amtsgericht Aachen",
      "registernummer": "HRB 21207",
      "registerart": "HRB",
      "company_name": "TUSBA Trading GmbH",
      "company_seat": "Aachen",
      "details": "07.10.2025 (Bekanntmachungsdatum)\n\nNordrhein-Westfalen Amtsgericht Aachen HRB 21207\nLöschungsankündigung\n\nTUSBA Trading GmbH\nGesellschaft mit beschränkter Haftung\nAachen\n\ndas Registergericht beabsichtigt, von Amts wegen die Gesellschaft wegen Vermögenslosigkeit nach § 394 FamFG zu löschen, weil das Finanzamt Aachen-Stadt mit Schreiben vom 23.09.2025 und 17.09.2025 Umstände mitgeteilt hat, aufgrund derer das Gericht davon überzeugt ist, dass die Gesellschaft vollständig vermögenslos ist.\n\nZur Geltendmachung des Widerspruchs gegen die beabsichtigte Löschung wird hiermit eine Frist von einem Monat ab Veröffentlichung dieser Ankündigung bestimmt.\n\nRechtsbehelfsbelehrung:\n\nGegen diese Verfügung kann Widerspruch eingelegt werden. Zum Widerspruch ist jeder berechtigt, der an der Unterlassung der Löschung ein berechtigtes Interesse hat.\n\nDer Widerspruch ist bei dem Amtsgericht Aachen, Adalbertsteinweg 92, 52070 Aachen schriftlich in deutscher Sprache oder zur Niederschrift der Geschäftsstelle einzulegen. Der Widerspruch kann auch zur Niederschrift der Geschäftsstelle eines jeden Amtsgerichtes abgegeben werden.\n\nDer Widerspruch muss spätestens innerhalb der gesetzten Frist nach der Bekanntgabe der Verfügung bei dem Amtsgericht Aachen eingegangen sein. Dies gilt auch dann, wenn der Widerspruch zur Niederschrift der Geschäftsstelle eines anderen Amtsgerichtes abgegeben wurde. Die Frist beginnt mit der Bekanntgabe der Verfügung durch Veröffentlichung. Fällt das Ende der Frist auf einen Sonntag, einen allgemeinen Feiertag oder Sonnabend, so endet die Frist mit Ablauf des nächsten Werktages.\n\nDer Widerspruch muss die Bezeichnung der angefochtenen Verfügung sowie die Erklärung enthalten, dass Widerspruch gegen diese Verfügung eingelegt wird. Er ist zu unterzeichnen und soll begründet werden.\n\nDie Einlegung ist auch durch Übertragung eines elektronischen Dokuments an die elektronische Poststelle des Gerichts möglich. Das elektronische Dokument muss für die Bearbeitung durch das Gericht geeignet und mit einer qualifizierten elektronischen Signatur der verantwortenden Person versehen sein oder von der verantwortenden Person signiert und auf einem sicheren Übermittlungsweg gemäß § 130 a ZPO nach näherer Maßgabe der Verordnung über die technischen Rahmenbedingungen des elektronischen Rechtsverkehrs und über das besondere elektronische Behördenpostfach (BGBl. I, S. 3803) eingereicht werden. Weitere Informationen erhalten Sie auf der Internetseite www.justiz.de."
    },
    {
      "date": "2025-10-07",
      "id": "132966",
      "original_text": "Sonstige Registerbekanntmachung\nNordrhein-Westfalen Amtsgericht Düsseldorf HRB 73649\nTyco Fire & Security Deutschland GmbH – Ratingen",
      "type": "Sonstige Registerbekanntmachung",
      "state": "Nordrhein-Westfalen",
      "amtsgericht": "Amtsgericht Düsseldorf",
      "registernummer": "HRB 73649",
      "registerart": "HRB",
      "company_name": "Tyco Fire & Security Deutschland GmbH",
      "company_seat": "Ratingen",
      "details": "07.10.2025 (Bekanntmachungsdatum)\n\nNordrhein-Westfalen Amtsgericht Düsseldorf HRB 73649\nSonstige Registerbekanntmachung 07.10.2025 (Eintragungsdatum)\n\nTyco Fire & Security Deutschland GmbH\nGesellschaft mit beschränkter Haftung\nRatingen\n\nAls nicht eingetragen wird veröffentlicht: Den Gläubigern der Gesellschaft, deren Forderungen begründet worden sind bevor die Eintragung der Beendigung des Gewinnabführungsvertrages  in das Handelsregister nach § 10 des Handelsgesetzbuches als bekanntgemacht gilt, hat der andere Vertragsteil Sicherheit zu leisten, wenn sie sich binnen sechs Monaten nach der Bekanntmachung der Eintragung zu diesem Zweck bei ihm melden."
    },
    {
      "date": "2025-10-07",
      "id": "132967",
      "original_text": "Registerbekanntmachung nach dem Umwandlungsgesetz\nNordrhein-Westfalen Amtsgericht Düsseldorf HRA 11658\nKÖTTER SE & Co. KG Security – Düsseldorf",
      "type": "Registerbekanntmachung nach dem Umwandlungsgesetz",
      "state": "Nordrhein-Westfalen",
      "amtsgericht": "Amtsgericht Düsseldorf",
      "registernummer": "HRA 11658",
      "registerart": "HRA",
      "company_name": "KÖTTER SE & Co. KG Security",
      "company_seat": "Düsseldorf",
      "details": "07.10.2025 (Bekanntmachungsdatum)\n\nNordrhein-Westfalen Amtsgericht Düsseldorf HRA 11658\nRegisterbekanntmachung nach dem Umwandlungsgesetz 07.10.2025 (Eintragungsdatum)\n\nKÖTTER SE & Co. KG Security\nKommanditgesellschaft\nDüsseldorf\n\nDen Gläubigern der an der Verschmelzung beteiligten Rechtsträger ist, wenn sie binnen sechs Monaten nach dem Tag, an dem die Eintragung der Verschmelzung in das Register des Sitzes desjenigen Rechtsträgers, dessen Gläubiger sie sind, nach § 19 Absatz 3 UmwG als bekanntgemacht gilt, ihren Anspruch nach Grund und Höhe schriftlich anmelden, Sicherheit zu leisten, soweit sie nicht Befriedigung verlangen können. Dieses Recht steht den Gläubigern jedoch nur zu, wenn sie glaubhaft machen, dass durch die Verschmelzung die Erfüllung ihrer Forderung gefährdet wird."
    },
    {
      "date": "2025-10-07",
      "id": "132968",
      "original_text": "Registerbekanntmachung nach dem Umwandlungsgesetz\nNordrhein-Westfalen Amtsgericht Hagen VR 20281 früher Amtsgericht Schwerte\nSozialdienst katholischer Frauen e.V. Schwerte – Schwerte",
      "type": "Registerbekanntmachung nach dem Umwandlungsgesetz",
      "state": "Nordrhein-Westfalen",
      "amtsgericht": "Amtsgericht Hagen",
      "registernummer": "VR 20281",
      "registerart": "VR",
      "company_name": "Sozialdienst katholischer Frauen e.V. Schwerte",
      "company_seat": "Schwerte",
      "former_amtsgericht": "Schwerte",
      "details": "07.10.2025 (Bekanntmachungsdatum)\n\nNordrhein-Westfalen Amtsgericht Hagen VR 20281 früher Amtsgericht Schwerte\nRegisterbekanntmachung nach dem Umwandlungsgesetz 07.10.2025 (Eintragungsdatum)\n\nSozialdienst katholischer Frauen e.V. Schwerte\neingetragener Verein\nSchwerte\n\nDen Gläubigern der an der Verschmelzung beteiligten Rechtsträger ist, wenn sie binnen sechs Monaten nach dem Tag, an dem die Eintragung der Verschmelzung in das Register des Sitzes derjenigen Rechtsträger deren Gläubiger sie sind, nach § 19 Absatz 3 UmwG als bekanntgemacht gilt, ihren Anspruch nach Grund und Höhe schriftlich anmelden, Sicherheit zu leisten, soweit sie nicht Befriedigung verlangen können. Dieses Recht steht den Gläubigern jedoch nur zu, wenn sie glaubhaft machen, dass durch die Verschmelzung die Erfüllung ihrer Forderung gefährdet wird."
    },
    {
      "date": "2025-10-07",
      "id": "132969",
      "original_text": "Löschungsankündigung\nNordrhein-Westfalen Amtsgericht Bochum HRB 15406\nevenco Verwaltungs GmbH – Witten",
      "type": "Löschungsankündigung",
      "state": "Nordrhein-Westfalen",
      "amtsgericht": "Amtsgericht Bochum",
      "registernummer": "HRB 15406",
      "registerart": "HRB",
      "company_name": "evenco Verwaltungs GmbH",
      "company_seat": "Witten",
      "details": "07.10.2025 (Bekanntmachungsdatum)\n\nNordrhein-Westfalen Amtsgericht Bochum HRB 15406\nLöschungsankündigung 08.10.2025 (Eintragungsdatum)\n\nevenco Verwaltungs GmbH\nGesellschaft mit beschränkter Haftung\nWitten\n\nDas Registergericht beabsichtigt die Gesellschaft von Amts wegen nach § 394 FamFG zu löschen. Die Frist zur Erhebung eines Widerspruchs ist auf drei Monate festgesetzt."
    },
    {
      "date": "2025-10-07",
      "id": "132970",
      "original_text": "Löschungsankündigung\nNordrhein-Westfalen Amtsgericht Bochum HRB 19474\nLalee UG (haftungsbeschränkt) – Bochum",
      "type": "Löschungsankündigung",
      "state": "Nordrhein-Westfalen",
      "amtsgericht": "Amtsgericht Bochum",
      "registernummer": "HRB 19474",
      "registerart": "HRB",
      "company_name": "Lalee UG (haftungsbeschränkt)",
      "company_seat": "Bochum",
      "details": "07.10.2025 (Bekanntmachungsdatum)\n\nNordrhein-Westfalen Amtsgericht Bochum HRB 19474\nLöschungsankündigung 08.10.2025 (Eintragungsdatum)\n\nLalee UG (haftungsbeschränkt)\nGesellschaft mit beschränkter Haftung\nBochum\n\nDas Registergericht beabsichtigt die Gesellschaft von Amts wegen nach § 394 FamFG zu löschen. Die Frist zur Erhebung eines Widerspruchs ist auf drei Monate festgesetzt."
    },
    {
      "date": "2025-10-07",
      "id": "132971",
      "original_text": "Registerbekanntmachung nach dem Umwandlungsgesetz\nNordrhein-Westfalen Amtsgericht Siegburg HRB 1636\nG. Rudolf Seiler GmbH – Siegburg",
      "type": "Registerbekanntmachung nach dem Umwandlungsgesetz",
      "state": "Nordrhein-Westfalen",
      "amtsgericht": "Amtsgericht Siegburg",
      "registernummer": "HRB 1636",
      "registerart": "HRB",
      "company_name": "G. Rudolf Seiler GmbH",
      "company_seat": "Siegburg",
      "details": "07.10.2025 (Bekanntmachungsdatum)\n\nNordrhein-Westfalen Amtsgericht Siegburg HRB 1636\nRegisterbekanntmachung nach dem Umwandlungsgesetz 07.10.2025 (Eintragungsdatum)\n\nG. Rudolf Seiler GmbH\nGesellschaft mit beschränkter Haftung\nSiegburg\n\nDen Gläubigern der an der Verschmelzung beteiligten Rechtsträger ist, wenn sie binnen sechs Monaten nach dem Tag, an dem die Eintragung der Verschmelzung in das Register des Sitzes desjenigen Rechtsträgers, dessen Gläubiger sie sind, nach § 19 Absatz 3 UmwG als bekanntgemacht gilt, ihren Anspruch nach Grund und Höhe schriftlich anmelden, Sicherheit zu leisten, soweit sie nicht Befriedigung verlangen können. Dieses Recht steht den Gläubigern jedoch nur zu, wenn sie glaubhaft machen, dass durch die Verschmelzung die Erfüllung ihrer Forderung gefährdet wird."
    },
    {
      "date": "2025-10-07",
      "id": "132972",
      "original_text": "Registerbekanntmachung nach dem Umwandlungsgesetz\nNordrhein-Westfalen Amtsgericht Hagen HRA 6264\nBora Products e. K. – Ennepetal",
      "type": "Registerbekanntmachung nach dem Umwandlungsgesetz",
      "state": "Nordrhein-Westfalen",
      "amtsgericht": "Amtsgericht Hagen",
      "registernummer": "HRA 6264",
      "registerart": "HRA",
      "company_name": "Bora Products e. K.",
      "company_seat": "Ennepetal",
      "details": "07.10.2025 (Bekanntmachungsdatum)\n\nNordrhein-Westfalen Amtsgericht Hagen HRA 6264\nRegisterbekanntmachung nach dem Umwandlungsgesetz 07.10.2025 (Eintragungsdatum)\n\nBora Products e. K.\nEinzelkaufmann / Einzelkauffrau\nEnnepetal\n\nDen Gläubigern der an der Ausgliederung beteiligten Rechtsträger ist, wenn sie binnen sechs Monaten nach dem Tag, an dem die Eintragung der Ausgliederung in das Register des Sitzes derjenigen Rechtsträger deren Gläubiger sie sind, nach § 19 Absatz 3 UmwG als bekanntgemacht gilt, ihren Anspruch nach Grund und Höhe schriftlich anmelden, Sicherheit zu leisten, soweit sie nicht Befriedigung verlangen können. Dieses Recht steht den Gläubigern jedoch nur zu, wenn sie glaubhaft machen, dass durch die Ausgliederung die Erfüllung ihrer Forderung gefährdet wird."
    },
    {
      "date": "2025-10-07",
      "id": "132973",
      "original_text": "Registerbekanntmachung nach dem Umwandlungsgesetz\nNordrhein-Westfalen Amtsgericht Neuss HRB 24878\nKramer Immobilien GmbH – Meerbusch",
      "type": "Registerbekanntmachung nach dem Umwandlungsgesetz",
      "state": "Nordrhein-Westfalen",
      "amtsgericht": "Amtsgericht Neuss",
      "registernummer": "HRB 24878",
      "registerart": "HRB",
      "company_name": "Kramer Immobilien GmbH",
      "company_seat": "Meerbusch",
      "details": "07.10.2025 (Bekanntmachungsdatum)\n\nNordrhein-Westfalen Amtsgericht Neuss HRB 24878\nRegisterbekanntmachung nach dem Umwandlungsgesetz 07.10.2025 (Eintragungsdatum)\n\nKramer Immobilien GmbH\nGesellschaft mit beschränkter Haftung\nMeerbusch\n\nDen Gläubigern der an der formwechselnden Umwandlung beteiligten Rechtsträger ist, wenn sie binnen sechs Monaten nach dem Tag, an dem die Eintragung der formwechselnden Umwandlung in das Register des Sitzes derjenigen Rechtsträger deren Gläubiger sie sind, nach § 19 Absatz 3 UmwG als bekanntgemacht gilt, ihren Anspruch nach Grund und Höhe schriftlich anmelden, Sicherheit zu leisten, soweit sie nicht Befriedigung verlangen können. Dieses Recht steht den Gläubigern jedoch nur zu, wenn sie glaubhaft machen, dass durch die formwechselnden Umwandlung die Erfüllung ihrer Forderung gefährdet wird."
    },
    {
      "date": "2025-10-07",
      "id": "132974",
      "original_text": "Registerbekanntmachung nach dem Umwandlungsgesetz\nNordrhein-Westfalen Amtsgericht Gelsenkirchen HRB 12559\nKnappschaft Kliniken Bottrop GmbH – Bottrop",
      "type": "Registerbekanntmachung nach dem Umwandlungsgesetz",
      "state": "Nordrhein-Westfalen",
      "amtsgericht": "Amtsgericht Gelsenkirchen",
      "registernummer": "HRB 12559",
      "registerart": "HRB",
      "company_name": "Knappschaft Kliniken Bottrop GmbH",
      "company_seat": "Bottrop",
      "details": "07.10.2025 (Bekanntmachungsdatum)\n\nNordrhein-Westfalen Amtsgericht Gelsenkirchen HRB 12559\nRegisterbekanntmachung nach dem Umwandlungsgesetz 07.10.2025 (Eintragungsdatum)\n\nKnappschaft Kliniken Bottrop GmbH\nGesellschaft mit beschränkter Haftung\nBottrop\n\nDen Gläubigern der an der Verschmelzung beteiligten Rechtsträger ist, wenn sie binnen sechs Monaten nach dem Tag, an dem die Eintragung der Verschmelzung in das Register des Sitzes desjenigen Rechtsträgers, dessen Gläubiger sie sind, nach § 19 Absatz 3 UmwG als bekanntgemacht gilt, ihren Anspruch nach Grund und Höhe schriftlich anmelden, Sicherheit zu leisten, soweit sie nicht Befriedigung verlangen können. Dieses Recht steht den Gläubigern jedoch nur zu, wenn sie glaubhaft machen, dass durch die Verschmelzung die Erfüllung ihrer Forderung gefährdet wird."
    },
    {
      "date": "2025-10-07",
      "id": "132975",
      "original_text": "Löschungsankündigung\nNordrhein-Westfalen Amtsgericht Dortmund HRB 30650\nBoru UG (haftungsbeschränkt) – Dortmund",
      "type": "Löschungsankündigung",
      "state": "Nordrhein-Westfalen",
      "amtsgericht": "Amtsgericht Dortmund",
      "registernummer": "HRB 30650",
      "registerart": "HRB",
      "company_name": "Boru UG (haftungsbeschränkt)",
      "company_seat": "Dortmund",
      "details": "07.10.2025 (Bekanntmachungsdatum)\n\nNordrhein-Westfalen Amtsgericht Dortmund HRB 30650\nLöschungsankündigung\n\nBoru UG (haftungsbeschränkt)\nGesellschaft mit beschränkter Haftung\nDortmund\n\nDas Registergericht beabsichtigt die Gesellschaft von Amts wegen nach § 394 FamFG zu löschen. Die Frist zur Erhebung eines Widerspruchs ist auf zwei Monate festgesetzt."
    },
    {
      "date": "2025-10-07",
      "id": "132976",
      "original_text": "Löschungsankündigung\nNordrhein-Westfalen Amtsgericht Dortmund HRB 30050\nBK I Immobilien UG (haftungsbeschränkt) – Dortmund",
      "type": "Löschungsankündigung",
      "state": "Nordrhein-Westfalen",
      "amtsgericht": "Amtsgericht Dortmund",
      "registernummer": "HRB 30050",
      "registerart": "HRB",
      "company_name": "BK I Immobilien UG (haftungsbeschränkt)",
      "company_seat": "Dortmund",
      "details": "07.10.2025 (Bekanntmachungsdatum)\n\nNordrhein-Westfalen Amtsgericht Dortmund HRB 30050\nLöschungsankündigung\n\nBK I Immobilien UG (haftungsbeschränkt)\nGesellschaft mit beschränkter Haftung\nDortmund\n\nDas Registergericht beabsichtigt die Gesellschaft von Amts wegen nach § 394 FamFG zu löschen. Die Frist zur Erhebung eines Widerspruchs ist auf zwei Monate festgesetzt."
    },
    {
      "date": "2025-10-07",
      "id": "132977",
      "original_text": "Sonstige Registerbekanntmachung\nNordrhein-Westfalen Amtsgericht Aachen HRB 18923\nUtimaco TS GmbH – Aachen",
      "type": "Sonstige Registerbekanntmachung",
      "state": "Nordrhein-Westfalen",
      "amtsgericht": "Amtsgericht Aachen",
      "registernummer": "HRB 18923",
      "registerart": "HRB",
      "company_name": "Utimaco TS GmbH",
      "company_seat": "Aachen",
      "details": "07.10.2025 (Bekanntmachungsdatum)\n\nNordrhein-Westfalen Amtsgericht Aachen HRB 18923\nSonstige Registerbekanntmachung 07.10.2025 (Eintragungsdatum)\n\nUtimaco TS GmbH\nGesellschaft mit beschränkter Haftung\nAachen\n\nAls nicht eingetragen wird veröffentlicht: Den Gläubigern der Gesellschaft, deren Forderungen begründet worden sind bevor die Eintragung der Beendigung des Beherrschungs- und Gewinnabführungsvertrages  in das Handelsregister nach § 10 des Handelsgesetzbuches als bekanntgemacht gilt, hat der andere Vertragsteil Sicherheit zu leisten, wenn sie sich binnen sechs Monaten nach der Bekanntmachung der Eintragung zu diesem Zweck bei ihm melden."
    },
    {
      "date": "2025-10-07",
      "id": "132978",
      "original_text": "Registerbekanntmachung nach dem Umwandlungsgesetz\nNordrhein-Westfalen Amtsgericht Dortmund HRB 37647\nHOMEOFSPORTS GmbH – Dortmund",
      "type": "Registerbekanntmachung nach dem Umwandlungsgesetz",
      "state": "Nordrhein-Westfalen",
      "amtsgericht": "Amtsgericht Dortmund",
      "registernummer": "HRB 37647",
      "registerart": "HRB",
      "company_name": "HOMEOFSPORTS GmbH",
      "company_seat": "Dortmund",
      "details": "07.10.2025 (Bekanntmachungsdatum)\n\nNordrhein-Westfalen Amtsgericht Dortmund HRB 37647\nRegisterbekanntmachung nach dem Umwandlungsgesetz 07.10.2025 (Eintragungsdatum)\n\nHOMEOFSPORTS GmbH\nGesellschaft mit beschränkter Haftung\nDortmund\n\nDen Gläubigern der an der formwechselnden Umwandlung beteiligten Rechtsträger ist, wenn sie binnen sechs Monaten nach dem Tag, an dem die Eintragung der formwechselnden Umwandlung in das Register des Sitzes derjenigen Rechtsträger deren Gläubiger sie sind, nach § 19 Absatz 3 UmwG als bekanntgemacht gilt, ihren Anspruch nach Grund und Höhe schriftlich anmelden, Sicherheit zu leisten, soweit sie nicht Befriedigung verlangen können. Dieses Recht steht den Gläubigern jedoch nur zu, wenn sie glaubhaft machen, dass durch die formwechselnden Umwandlung die Erfüllung ihrer Forderung gefährdet wird."
    },
    {
      "date": "2025-10-07",
      "id": "132979",
      "original_text": "Löschungsankündigung\nNordrhein-Westfalen Amtsgericht Düsseldorf HRB 80774\nFarmeh GmbH – Düsseldorf",
      "type": "Löschungsankündigung",
      "state": "Nordrhein-Westfalen",
      "amtsgericht": "Amtsgericht Düsseldorf",
      "registernummer": "HRB 80774",
      "registerart": "HRB",
      "company_name": "Farmeh GmbH",
      "company_seat": "Düsseldorf",
      "details": "07.10.2025 (Bekanntmachungsdatum)\n\nNordrhein-Westfalen Amtsgericht Düsseldorf HRB 80774\nLöschungsankündigung\n\nFarmeh GmbH\nGesellschaft mit beschränkter Haftung\nDüsseldorf\n\nDas Registergericht beabsichtigt die Gesellschaft von Amts wegen nach § 394 FamFG zu löschen. Die Frist zur Erhebung eines Widerspruchs ist auf #DV.Fr(Text=\"Bitte wählen Sie die Widerspruchsfrist aus!\",Eingabe=\"einen Monat\",\"zwei Monate\",\"drei Monate\",\"#insert(Text=\"Freitext\")\"|\"freier Text\") festgesetzt.\n\nRechtsbehelfsbelehrung:\nDas Widerspruchsrecht steht jedem zu, der an der Unterlassung der Löschung ein berechtigtes Interesse hat. Der Widerspruch ist bei dem Amtsgericht Düsseldorf -Registergericht-, Werdener Straße 1, 40227 Düsseldorf schriftlich in deutscher Sprache oder zur Niederschrift der Geschäftsstelle einzulegen. Der Widerspruch kann auch zur Niederschrift der Geschäftsstelle eines jeden Amtsgerichtes abgegeben werden. Die Einlegung ist auch durch Übertragung eines elektronischen Dokuments an die elektronische Poststelle des Gerichts möglich. Das elektronische Dokument muss für die Bearbeitung durch das Gericht geeignet und mit einer qualifizierten elektronischen Signatur der verantwortenden Person versehen sein oder von der verantwortenden Person signiert und auf einem sicheren Übermittlungsweg gemäß § 130a ZPO nach näherer Maßgabe der Verordnung über die technischen Rahmenbedingungen des elektronischen Rechtsverkehrs und über das besondere elektronische Behördenpostfach (BGBl. I, S.3803) eingereicht werden. Weitere Informationen erhalten Sie auf der Internetseite www.justiz.de.\nDer Widerspruch muss spätestens innerhalb der gesetzten Frist nach dem Datum der Bekanntmachung der Löschungsankündigung bei dem Amtsgericht - Registergericht - Düsseldorf eingegangen sein.  Dies gilt auch dann, wenn der Widerspruch zur Niederschrift der Geschäftsstelle eines anderen Amtsgerichtes abgegeben wurde. Die Frist beginnt mit dem Tage der Bekanntmachung der Löschungsankündigung in dem für die Bekanntmachung der Eintragungen in das Handelsregister bestimmten elektronischen Informations- und Kommunikationssystem nach § 10 des Handelsgesetzbuches. Fällt das Ende der Frist auf einen Sonntag, einen allgemeinen Feiertag oder Sonnabend, so endet die Frist mit Ablauf des nächsten Werktages.\nDer Widerspruch muss die Bezeichnung der angefochtenen Löschungsankündigung sowie die Erklärung enthalten, dass Widerspruch gegen diese Löschungsankündigung eingelegt wird. Er ist zu unterzeichnen und soll begründet werden."
    },
    {
      "date": "2025-10-07",
      "id": "132980",
      "original_text": "Registerbekanntmachung nach dem Umwandlungsgesetz\nNordrhein-Westfalen Amtsgericht Münster HRB 18150\nHagedorn Schüttgut GmbH – Sassenberg",
      "type": "Registerbekanntmachung nach dem Umwandlungsgesetz",
      "state": "Nordrhein-Westfalen",
      "amtsgericht": "Amtsgericht Münster",
      "registernummer": "HRB 18150",
      "registerart": "HRB",
      "company_name": "Hagedorn Schüttgut GmbH",
      "company_seat": "Sassenberg",
      "details": "07.10.2025 (Bekanntmachungsdatum)\n\nNordrhein-Westfalen Amtsgericht Münster HRB 18150\nRegisterbekanntmachung nach dem Umwandlungsgesetz 07.10.2025 (Eintragungsdatum)\n\nHagedorn Schüttgut GmbH\nGesellschaft mit beschränkter Haftung\nSassenberg\n\nDen Gläubigern der an der Verschmelzung beteiligten Rechtsträger ist, wenn sie binnen sechs Monaten nach dem Tag, an dem die Eintragung der Verschmelzung in das Register des Sitzes desjenigen Rechtsträgers, dessen Gläubiger sie sind, nach § 19 Absatz 3 UmwG als bekanntgemacht gilt, ihren Anspruch nach Grund und Höhe schriftlich anmelden, Sicherheit zu leisten, soweit sie nicht Befriedigung verlangen können. Dieses Recht steht den Gläubigern jedoch nur zu, wenn sie glaubhaft machen, dass durch die Verschmelzung die Erfüllung ihrer Forderung gefährdet wird."
    },
    {
      "date": "2025-10-07",
      "id": "132981",
      "original_text": "Löschungsankündigung\nNordrhein-Westfalen Amtsgericht Hamm HRB 10338\nAY Ören - Bau GmbH – Hamm",
      "type": "Löschungsankündigung",
      "state": "Nordrhein-Westfalen",
      "amtsgericht": "Amtsgericht Hamm",
      "registernummer": "HRB 10338",
      "registerart": "HRB",
      "company_name": "AY Ören - Bau GmbH",
      "company_seat": "Hamm",
      "details": "07.10.2025 (Bekanntmachungsdatum)\n\nNordrhein-Westfalen Amtsgericht Hamm HRB 10338\nLöschungsankündigung\n\nAY Ören - Bau GmbH\nGesellschaft mit beschränkter Haftung\nHamm\n\nDas Registergericht beabsichtigt die Gesellschaft von Amts wegen nach § 394 FamFG zu löschen. Die Frist zur Erhebung eines Widerspruchs ist auf drei Monate festgesetzt."
    },
    {
      "date": "2025-10-07",
      "id": "132982",
      "original_text": "Einreichung neuer Dokumente\nNordrhein-Westfalen Amtsgericht Köln HRB 112841\nINU - Innovative University AG – Köln",
      "type": "Einreichung neuer Dokumente",
      "state": "Nordrhein-Westfalen",
      "amtsgericht": "Amtsgericht Köln",
      "registernummer": "HRB 112841",
      "registerart": "HRB",
      "company_name": "INU - Innovative University AG",
      "company_seat": "Köln",
      "details": "07.10.2025 (Bekanntmachungsdatum)\n\nNordrhein-Westfalen Amtsgericht Köln HRB 112841\nEinreichung neuer Dokumente 07.10.2025 (Eintragungsdatum)\n\nINU - Innovative University AG\nAktiengesellschaft\nKöln\n\nDem Registergericht ist eine neue Liste der Mitglieder des Aufsichtsrates eingereicht worden."
    },
    {
      "date": "2025-10-07",
      "id": "132983",
      "original_text": "Löschungsankündigung\nThüringen Amtsgericht Jena HRB 502978\nWWT GmbH – Mühlhausen/Thüringen",
      "type": "Löschungsankündigung",
      "state": "Thüringen",
      "amtsgericht": "Amtsgericht Jena",
      "registernummer": "HRB 502978",
      "registerart": "HRB",
      "company_name": "WWT GmbH",
      "company_seat": "Mühlhausen/Thüringen",
      "details": "07.10.2025 (Bekanntmachungsdatum)\n\nThüringen Amtsgericht Jena HRB 502978\nLöschungsankündigung\n\nWWT GmbH\nGesellschaft mit beschränkter Haftung\nMühlhausen/Thüringen\n\nDas Registergericht beabsichtigt, die im Handelsregister eingetragene Gesellschaft wegen Vermögenslosigkeit nach § 394 FamFG von Amts wegen zu löschen. Die Frist zur Erhebung eines Widerspruchs gegen die beabsichtigte Löschung wird auf 6 Wochen festgesetzt."
    },
    {
      "date": "2025-10-07",
      "id": "132984",
      "original_text": "Registerbekanntmachung nach dem Umwandlungsgesetz\nHessen Amtsgericht Hanau HRB 11892\nABV AUTO - BUS Vertriebs- und Instandsetzungs GmbH – Gründau",
      "type": "Registerbekanntmachung nach dem Umwandlungsgesetz",
      "state": "Hessen",
      "amtsgericht": "Amtsgericht Hanau",
      "registernummer": "HRB 11892",
      "registerart": "HRB",
      "company_name": "ABV AUTO - BUS Vertriebs- und Instandsetzungs GmbH",
      "company_seat": "Gründau",
      "details": "07.10.2025 (Bekanntmachungsdatum)\n\nHessen Amtsgericht Hanau HRB 11892\nRegisterbekanntmachung nach dem Umwandlungsgesetz 07.10.2025 (Eintragungsdatum)\n\nABV AUTO - BUS Vertriebs- und Instandsetzungs GmbH\nGesellschaft mit beschränkter Haftung\nGründau\n\nDen Gläubigern der an der Verschmelzung beteiligten Rechtsträger ist, wenn sie binnen sechs Monaten nach dem Tag, an dem die Eintragung der Verschmelzung in das Register des Sitzes desjenigen Rechtsträgers, dessen Gläubiger sie sind, nach § 19 Absatz 3 UmwG bekannt gemacht worden ist, ihren Anspruch nach Grund und Höhe schriftlich anmelden, Sicherheit zu leisten, soweit sie nicht Befriedigung verlangen können. Dieses Recht steht den Gläubigern jedoch nur zu, wenn sie glaubhaft machen, dass durch die Verschmelzung die Erfüllung ihrer Forderung gefährdet wird."
    },
    {
      "date": "2025-10-07",
      "id": "132985",
      "original_text": "Registerbekanntmachung nach dem Umwandlungsgesetz\nHessen Amtsgericht Darmstadt HRB 85465\nb + b Automations- und Steuerungstechnik GmbH – Beerfelden-Airlenbach",
      "type": "Registerbekanntmachung nach dem Umwandlungsgesetz",
      "state": "Hessen",
      "amtsgericht": "Amtsgericht Darmstadt",
      "registernummer": "HRB 85465",
      "registerart": "HRB",
      "company_name": "b + b Automations- und Steuerungstechnik GmbH",
      "company_seat": "Beerfelden-Airlenbach",
      "details": "07.10.2025 (Bekanntmachungsdatum)\n\nHessen Amtsgericht Darmstadt HRB 85465\nRegisterbekanntmachung nach dem Umwandlungsgesetz 07.10.2025 (Eintragungsdatum)\n\nb + b Automations- und Steuerungstechnik GmbH\nGesellschaft mit beschränkter Haftung\nBeerfelden-Airlenbach\n\nDen Gläubigern der an der Verschmelzung beteiligten Rechtsträger ist, wenn sie binnen sechs Monaten nach dem Tag, an dem die Eintragung der Verschmelzung in das Register des Sitzes derjenigen Rechtsträger deren Gläubiger sie sind, nach § 19 Absatz 3 UmwG bekannt gemacht worden ist, ihren Anspruch nach Grund und Höhe schriftlich anmelden, Sicherheit zu leisten, soweit sie nicht Befriedigung verlangen können. Dieses Recht steht den Gläubigern jedoch nur zu, wenn sie glaubhaft machen, dass durch die Verschmelzung die Erfüllung ihrer Forderung gefährdet wird."
    },
    {
      "date": "2025-10-07",
      "id": "132986",
      "original_text": "Registerbekanntmachung nach dem Umwandlungsgesetz\nHessen Amtsgericht Hanau HRA 92809\nRDG Regionalverkehrsdienst Gründau Elke Laubach e.K. – Gründau",
      "type": "Registerbekanntmachung nach dem Umwandlungsgesetz",
      "state": "Hessen",
      "amtsgericht": "Amtsgericht Hanau",
      "registernummer": "HRA 92809",
      "registerart": "HRA",
      "company_name": "RDG Regionalverkehrsdienst Gründau Elke Laubach e.K.",
      "company_seat": "Gründau",
      "details": "07.10.2025 (Bekanntmachungsdatum)\n\nHessen Amtsgericht Hanau HRA 92809\nRegisterbekanntmachung nach dem Umwandlungsgesetz 07.10.2025 (Eintragungsdatum)\n\nRDG Regionalverkehrsdienst Gründau Elke Laubach e.K.\nEinzelkaufmann / Einzelkauffrau\nGründau\n\nDen Gläubigern der an der Verschmelzung beteiligten Rechtsträger ist, wenn sie binnen sechs Monaten nach dem Tag, an dem die Eintragung der Verschmelzung in das Register des Sitzes desjenigen Rechtsträgers, dessen Gläubiger sie sind, nach § 19 Absatz 3 UmwG bekannt gemacht worden ist, ihren Anspruch nach Grund und Höhe schriftlich anmelden, Sicherheit zu leisten, soweit sie nicht Befriedigung verlangen können. Dieses Recht steht den Gläubigern jedoch nur zu, wenn sie glaubhaft machen, dass durch die Verschmelzung die Erfüllung ihrer Forderung gefährdet wird."
    },
    {
      "date": "2025-10-07",
      "id": "132987",
      "original_text": "Löschungsankündigung\nHessen Amtsgericht Hanau HRB 97338\nALG GmbH – Maintal",
      "type": "Löschungsankündigung",
      "state": "Hessen",
      "amtsgericht": "Amtsgericht Hanau",
      "registernummer": "HRB 97338",
      "registerart": "HRB",
      "company_name": "ALG GmbH",
      "company_seat": "Maintal",
      "details": "07.10.2025 (Bekanntmachungsdatum)\n\nHessen Amtsgericht Hanau HRB 97338\nLöschungsankündigung\n\nALG GmbH\nGesellschaft mit beschränkter Haftung\nMaintal\n\nDas Registergericht beabsichtigt die im Handelsregister eingetragene Gesellschaft von Amts wegen nach § 394 FamFG zu löschen. Die Frist zur Erhebung eines Widerspruchs gegen die beabsichtigte Löschung wird auf 3 Monate festgesetzt."
    },
    {
      "date": "2025-10-07",
      "id": "132988",
      "original_text": "Registerbekanntmachung nach dem Umwandlungsgesetz\nHessen Amtsgericht Frankfurt am Main HRB 133060\nBusch Immobilien GmbH – Frankfurt am Main",
      "type": "Registerbekanntmachung nach dem Umwandlungsgesetz",
      "state": "Hessen",
      "amtsgericht": "Amtsgericht Frankfurt am Main",
      "registernummer": "HRB 133060",
      "registerart": "HRB",
      "company_name": "Busch Immobilien GmbH",
      "company_seat": "Frankfurt am Main",
      "details": "07.10.2025 (Bekanntmachungsdatum)\n\nHessen Amtsgericht Frankfurt am Main HRB 133060\nRegisterbekanntmachung nach dem Umwandlungsgesetz 07.10.2025 (Eintragungsdatum)\n\nBusch Immobilien GmbH\nGesellschaft mit beschränkter Haftung\nFrankfurt am Main\n\nDen Gläubigern der an der Verschmelzung beteiligten Rechtsträger ist, wenn sie binnen sechs Monaten nach dem Tag, an dem die Eintragung der Verschmelzung in das Register des Sitzes desjenigen Rechtsträgers, dessen Gläubiger sie sind, nach § 19 Absatz 3 UmwG bekannt gemacht worden ist, ihren Anspruch nach Grund und Höhe schriftlich anmelden, Sicherheit zu leisten, soweit sie nicht Befriedigung verlangen können. Dieses Recht steht den Gläubigern jedoch nur zu, wenn sie glaubhaft machen, dass durch die Verschmelzung die Erfüllung ihrer Forderung gefährdet wird."
    },
    {
      "date": "2025-10-07",
      "id": "132989",
      "original_text": "Registerbekanntmachung nach dem Umwandlungsgesetz\nHessen Amtsgericht Frankfurt am Main HRA 49868\nGEG Triforum Holding GmbH & Co. KG – Frankfurt am Main",
      "type": "Registerbekanntmachung nach dem Umwandlungsgesetz",
      "state": "Hessen",
      "amtsgericht": "Amtsgericht Frankfurt am Main",
      "registernummer": "HRA 49868",
      "registerart": "HRA",
      "company_name": "GEG Triforum Holding GmbH & Co. KG",
      "company_seat": "Frankfurt am Main",
      "details": "07.10.2025 (Bekanntmachungsdatum)\n\nHessen Amtsgericht Frankfurt am Main HRA 49868\nRegisterbekanntmachung nach dem Umwandlungsgesetz 07.10.2025 (Eintragungsdatum)\n\nGEG Triforum Holding GmbH & Co. KG\nKommanditgesellschaft\nFrankfurt am Main\n\nDen Gläubigern der an der Verschmelzung beteiligten Rechtsträger ist, wenn sie binnen sechs Monaten nach dem Tag, an dem die Eintragung der Verschmelzung in das Register des Sitzes desjenigen Rechtsträgers, dessen Gläubiger sie sind, nach § 19 Absatz 3 UmwG bekannt gemacht worden ist, ihren Anspruch nach Grund und Höhe schriftlich anmelden, Sicherheit zu leisten, soweit sie nicht Befriedigung verlangen können. Dieses Recht steht den Gläubigern jedoch nur zu, wenn sie glaubhaft machen, dass durch die Verschmelzung die Erfüllung ihrer Forderung gefährdet wird."
    },
    {
      "date": "2025-10-07",
      "id": "132990",
      "original_text": "Einreichung neuer Dokumente\nHessen Amtsgericht Frankfurt am Main HRB 85926\nFinance in Motion GmbH – Frankfurt am Main",
      "type": "Einreichung neuer Dokumente",
      "state": "Hessen",
      "amtsgericht": "Amtsgericht Frankfurt am Main",
      "registernummer": "HRB 85926",
      "registerart": "HRB",
      "company_name": "Finance in Motion GmbH",
      "company_seat": "Frankfurt am Main",
      "details": "07.10.2025 (Bekanntmachungsdatum)\n\nHessen Amtsgericht Frankfurt am Main HRB 85926\nEinreichung neuer Dokumente\n\nFinance in Motion GmbH\nGesellschaft mit beschränkter Haftung\nFrankfurt am Main\n\nDurch eine Änderung in den Personen der Aufsichtsratsmitglieder ist eine Liste der Mitglieder des Aufsichtsrates zum Handelsregister eingereicht worden."
    },
    {
      "date": "2025-10-07",
      "id": "132991",
      "original_text": "Registerbekanntmachung nach dem Umwandlungsgesetz\nHessen Amtsgericht Frankfurt am Main HRB 33269\nWEISS Hygiene-Service GmbH – Frankfurt am Main",
      "type": "Registerbekanntmachung nach dem Umwandlungsgesetz",
      "state": "Hessen",
      "amtsgericht": "Amtsgericht Frankfurt am Main",
      "registernummer": "HRB 33269",
      "registerart": "HRB",
      "company_name": "WEISS Hygiene-Service GmbH",
      "company_seat": "Frankfurt am Main",
      "details": "07.10.2025 (Bekanntmachungsdatum)\n\nHessen Amtsgericht Frankfurt am Main HRB 33269\nRegisterbekanntmachung nach dem Umwandlungsgesetz 07.10.2025 (Eintragungsdatum)\n\nWEISS Hygiene-Service GmbH\nGesellschaft mit beschränkter Haftung\nFrankfurt am Main\n\nDen Gläubigern der an der Verschmelzung beteiligten Rechtsträger ist, wenn sie binnen sechs Monaten nach dem Tag, an dem die Eintragung der Verschmelzung in das Register des Sitzes desjenigen Rechtsträgers, dessen Gläubiger sie sind, nach § 19 Absatz 3 UmwG bekannt gemacht worden ist, ihren Anspruch nach Grund und Höhe schriftlich anmelden, Sicherheit zu leisten, soweit sie nicht Befriedigung verlangen können. Dieses Recht steht den Gläubigern jedoch nur zu, wenn sie glaubhaft machen, dass durch die Verschmelzung die Erfüllung ihrer Forderung gefährdet wird."
    },
    {
      "date": "2025-10-07",
      "id": "132992",
      "original_text": "Löschungsankündigung\nHessen Amtsgericht Frankfurt am Main HRB 120431\nGAT Akquisition 1 GmbH – Frankfurt am Main",
      "type": "Löschungsankündigung",
      "state": "Hessen",
      "amtsgericht": "Amtsgericht Frankfurt am Main",
      "registernummer": "HRB 120431",
      "registerart": "HRB",
      "company_name": "GAT Akquisition 1 GmbH",
      "company_seat": "Frankfurt am Main",
      "details": "07.10.2025 (Bekanntmachungsdatum)\n\nHessen Amtsgericht Frankfurt am Main HRB 120431\nLöschungsankündigung 07.10.2025 (Eintragungsdatum)\n\nGAT Akquisition 1 GmbH\nGesellschaft mit beschränkter Haftung\nFrankfurt am Main\n\nDas Registergericht beabsichtigt die im Handelsregister eingetragene Gesellschaft von Amts wegen nach § 394 FamFG zu löschen. Die Frist zur Erhebung eines Widerspruchs gegen die beabsichtigte Löschung wird auf 1 Monat festgesetzt."
    },
    {
      "date": "2025-10-07",
      "id": "132993",
      "original_text": "Registerbekanntmachung nach dem Umwandlungsgesetz\nHessen Amtsgericht Bad Hersfeld VR 648\nWohnraumhilfe Bad Hersfeld e.V. – Bad Hersfeld",
      "type": "Registerbekanntmachung nach dem Umwandlungsgesetz",
      "state": "Hessen",
      "amtsgericht": "Amtsgericht Bad Hersfeld",
      "registernummer": "VR 648",
      "registerart": "VR",
      "company_name": "Wohnraumhilfe Bad Hersfeld e.V.",
      "company_seat": "Bad Hersfeld",
      "details": "07.10.2025 (Bekanntmachungsdatum)\n\nHessen Amtsgericht Bad Hersfeld VR 648\nRegisterbekanntmachung nach dem Umwandlungsgesetz 07.10.2025 (Eintragungsdatum)\n\nWohnraumhilfe Bad Hersfeld e.V.\neingetragener Verein\nBad Hersfeld\n\nDen Gläubigern der an der formwechselnden Umwandlung beteiligten Rechtsträger ist, wenn sie binnen sechs Monaten nach dem Tag, an dem die Eintragung der formwechselnden Umwandlung in das Register des Sitzes desjenigen Rechtsträgers, dessen Gläubiger sie sind, nach § 201 UmwG bekannt gemacht worden ist, ihren Anspruch nach Grund und Höhe schriftlich anmelden, Sicherheit zu leisten, soweit sie nicht Befriedigung verlangen können. Dieses Recht steht den Gläubigern jedoch nur zu, wenn sie glaubhaft machen, dass durch die formwechselnden Umwandlung die Erfüllung ihrer Forderung gefährdet wird."
    },
    {
      "date": "2025-10-07",
      "id": "132994",
      "original_text": "Registerbekanntmachung nach dem Umwandlungsgesetz\nHessen Amtsgericht Bad Hersfeld HRB 3444\nWohnraumhilfe Bad Hersfeld GmbH – Bad Hersfeld",
      "type": "Registerbekanntmachung nach dem Umwandlungsgesetz",
      "state": "Hessen",
      "amtsgericht": "Amtsgericht Bad Hersfeld",
      "registernummer": "HRB 3444",
      "registerart": "HRB",
      "company_name": "Wohnraumhilfe Bad Hersfeld GmbH",
      "company_seat": "Bad Hersfeld",
      "details": "07.10.2025 (Bekanntmachungsdatum)\n\nHessen Amtsgericht Bad Hersfeld HRB 3444\nRegisterbekanntmachung nach dem Umwandlungsgesetz 07.10.2025 (Eintragungsdatum)\n\nWohnraumhilfe Bad Hersfeld GmbH\nGesellschaft mit beschränkter Haftung\nBad Hersfeld\n\nDen Gläubigern der an der formwechselnden Umwandlung beteiligten Rechtsträger ist, wenn sie binnen sechs Monaten nach dem Tag, an dem die Eintragung der formwechselnden Umwandlung in das Register des Sitzes desjenigen Rechtsträgers, dessen Gläubiger sie sind, nach § 201 UmwG bekannt gemacht worden ist, ihren Anspruch nach Grund und Höhe schriftlich anmelden, Sicherheit zu leisten, soweit sie nicht Befriedigung verlangen können. Dieses Recht steht den Gläubigern jedoch nur zu, wenn sie glaubhaft machen, dass durch die formwechselnden Umwandlung die Erfüllung ihrer Forderung gefährdet wird."
    },
    {
      "date": "2025-10-07",
      "id": "132995",
      "original_text": "Registerbekanntmachung nach dem Umwandlungsgesetz\nHessen Amtsgericht Darmstadt HRB 70529\nB B K Etikettier- und Sondermaschinenbau Gesellschaft mit beschränkter Haftung – Beerfelden",
      "type": "Registerbekanntmachung nach dem Umwandlungsgesetz",
      "state": "Hessen",
      "amtsgericht": "Amtsgericht Darmstadt",
      "registernummer": "HRB 70529",
      "registerart": "HRB",
      "company_name": "B B K Etikettier- und Sondermaschinenbau Gesellschaft mit beschränkter Haftung",
      "company_seat": "Beerfelden",
      "details": "07.10.2025 (Bekanntmachungsdatum)\n\nHessen Amtsgericht Darmstadt HRB 70529\nRegisterbekanntmachung nach dem Umwandlungsgesetz 07.10.2025 (Eintragungsdatum)\n\nB B K   Etikettier- und Sondermaschinenbau Gesellschaft mit beschränkter Haftung\nGesellschaft mit beschränkter Haftung\nBeerfelden\n\nDen Gläubigern der an der Verschmelzung beteiligten Rechtsträger ist, wenn sie binnen sechs Monaten nach dem Tag, an dem die Eintragung der Verschmelzung in das Register des Sitzes derjenigen Rechtsträger deren Gläubiger sie sind, nach § 19 Absatz 3 UmwG bekannt gemacht worden ist, ihren Anspruch nach Grund und Höhe schriftlich anmelden, Sicherheit zu leisten, soweit sie nicht Befriedigung verlangen können. Dieses Recht steht den Gläubigern jedoch nur zu, wenn sie glaubhaft machen, dass durch die Verschmelzung die Erfüllung ihrer Forderung gefährdet wird."
    },
    {
      "date": "2025-10-07",
      "id": "132996",
      "original_text": "Registerbekanntmachung nach dem Umwandlungsgesetz\nHessen Amtsgericht Offenbach am Main HRB 45594\nKBO Rhein-Main GmbH – Offenbach am Main",
      "type": "Registerbekanntmachung nach dem Umwandlungsgesetz",
      "state": "Hessen",
      "amtsgericht": "Amtsgericht Offenbach am Main",
      "registernummer": "HRB 45594",
      "registerart": "HRB",
      "company_name": "KBO Rhein-Main GmbH",
      "company_seat": "Offenbach am Main",
      "details": "07.10.2025 (Bekanntmachungsdatum)\n\nHessen Amtsgericht Offenbach am Main HRB 45594\nRegisterbekanntmachung nach dem Umwandlungsgesetz 07.10.2025 (Eintragungsdatum)\n\nKBO Rhein-Main GmbH\nGesellschaft mit beschränkter Haftung\nOffenbach am Main\n\nDen Gläubigern der an der Verschmelzung beteiligten Rechtsträger ist, wenn sie binnen sechs Monaten nach dem Tag, an dem die Eintragung der Verschmelzung in das Register des Sitzes desjenigen Rechtsträgers, dessen Gläubiger sie sind, nach § 19 Absatz 3 UmwG bekannt gemacht worden ist, ihren Anspruch nach Grund und Höhe schriftlich anmelden, Sicherheit zu leisten, soweit sie nicht Befriedigung verlangen können. Dieses Recht steht den Gläubigern jedoch nur zu, wenn sie glaubhaft machen, dass durch die Verschmelzung die Erfüllung ihrer Forderung gefährdet wird."
    },
    {
      "date": "2025-10-07",
      "id": "132997",
      "original_text": "Sonstige Registerbekanntmachung\nHessen Amtsgericht Wiesbaden HRB 27539\nSchumm und Rösch Planen + Einrichten GmbH – Wiesbaden",
      "type": "Sonstige Registerbekanntmachung",
      "state": "Hessen",
      "amtsgericht": "Amtsgericht Wiesbaden",
      "registernummer": "HRB 27539",
      "registerart": "HRB",
      "company_name": "Schumm und Rösch Planen + Einrichten GmbH",
      "company_seat": "Wiesbaden",
      "details": "07.10.2025 (Bekanntmachungsdatum)\n\nHessen Amtsgericht Wiesbaden HRB 27539\nSonstige Registerbekanntmachung 07.10.2025 (Eintragungsdatum)\n\nSchumm und Rösch Planen + Einrichten GmbH\nGesellschaft mit beschränkter Haftung\nWiesbaden\n\nDen Gläubigern der Gesellschaft, deren Forderungen begründet worden sind, bevor die Eintragung der Beendigung des Vertrags in das Handelsregister nach § 10 HGB bekannt gemacht worden ist, ist vom anderen Vertragsteil Sicherheit zu leisten, wenn sie sich binnen sechs Monaten nach dieser Bekanntmachung zu diesem Zweck bei ihm melden."
    },
    {
      "date": "2025-10-07",
      "id": "132998",
      "original_text": "Registerbekanntmachung nach dem Umwandlungsgesetz\nHessen Amtsgericht Frankfurt am Main HRB 110084\nGEG Triforum BVO GmbH – Frankfurt am Main",
      "type": "Registerbekanntmachung nach dem Umwandlungsgesetz",
      "state": "Hessen",
      "amtsgericht": "Amtsgericht Frankfurt am Main",
      "registernummer": "HRB 110084",
      "registerart": "HRB",
      "company_name": "GEG Triforum BVO GmbH",
      "company_seat": "Frankfurt am Main",
      "details": "07.10.2025 (Bekanntmachungsdatum)\n\nHessen Amtsgericht Frankfurt am Main HRB 110084\nRegisterbekanntmachung nach dem Umwandlungsgesetz 07.10.2025 (Eintragungsdatum)\n\nGEG Triforum BVO GmbH\nGesellschaft mit beschränkter Haftung\nFrankfurt am Main\n\nDen Gläubigern der an der Verschmelzung beteiligten Rechtsträger ist, wenn sie binnen sechs Monaten nach dem Tag, an dem die Eintragung der Verschmelzung in das Register des Sitzes desjenigen Rechtsträgers, dessen Gläubiger sie sind, nach § 19 Absatz 3 UmwG bekannt gemacht worden ist, ihren Anspruch nach Grund und Höhe schriftlich anmelden, Sicherheit zu leisten, soweit sie nicht Befriedigung verlangen können. Dieses Recht steht den Gläubigern jedoch nur zu, wenn sie glaubhaft machen, dass durch die Verschmelzung die Erfüllung ihrer Forderung gefährdet wird."
    },
    {
      "date": "2025-10-07",
      "id": "132999",
      "original_text": "Registerbekanntmachung nach dem Umwandlungsgesetz\nHessen Amtsgericht Offenbach am Main HRB 40270\nA + M Caruso GmbH – Offenbach am Main",
      "type": "Registerbekanntmachung nach dem Umwandlungsgesetz",
      "state": "Hessen",
      "amtsgericht": "Amtsgericht Offenbach am Main",
      "registernummer": "HRB 40270",
      "registerart": "HRB",
      "company_name": "A + M Caruso GmbH",
      "company_seat": "Offenbach am Main",
      "details": "07.10.2025 (Bekanntmachungsdatum)\n\nHessen Amtsgericht Offenbach am Main HRB 40270\nRegisterbekanntmachung nach dem Umwandlungsgesetz 07.10.2025 (Eintragungsdatum)\n\nA + M Caruso GmbH\nGesellschaft mit beschränkter Haftung\nOffenbach am Main\n\nDen Gläubigern der an der Verschmelzung beteiligten Rechtsträger ist, wenn sie binnen sechs Monaten nach dem Tag, an dem die Eintragung der Verschmelzung in das Register des Sitzes desjenigen Rechtsträgers, dessen Gläubiger sie sind, nach § 19 Absatz 3 UmwG bekannt gemacht worden ist, ihren Anspruch nach Grund und Höhe schriftlich anmelden, Sicherheit zu leisten, soweit sie nicht Befriedigung verlangen können. Dieses Recht steht den Gläubigern jedoch nur zu, wenn sie glaubhaft machen, dass durch die Verschmelzung die Erfüllung ihrer Forderung gefährdet wird."
    }
  ]
}