{
  "date": "2025-10-25",
  "date_of_scrape": "2025-10-26T19:12:35.515Z",
  "tool_version": "0.2.0",
  "number_of_announcements": 16,
  "announcements": [
    {
      "date": "2025-10-25",
      "id": "135298",
      "original_text": "Einreichung neuer Dokumente\nBayern Amtsgericht München HRB 273662\ndigid AG – Pullach i. Isartal",
      "type": "Einreichung neuer Dokumente",
      "state": "Bayern",
      "amtsgericht": "Amtsgericht München",
      "registernummer": "HRB 273662",
      "registerart": "HRB",
      "company_name": "digid AG",
      "company_seat": "Pullach i. Isartal",
      "details": "25.10.2025 (Bekanntmachungsdatum)\n\nBayern Amtsgericht München HRB 273662\nEinreichung neuer Dokumente\n\ndigid AG\nAktiengesellschaft\nPullach i. Isartal\n\nDem Amtsgericht München -Registergericht- ist eine Liste der Mitglieder des Aufsichtsrats eingereicht worden, § 106 AktG."
    },
    {
      "date": "2025-10-25",
      "id": "135299",
      "original_text": "Registerbekanntmachung nach dem Umwandlungsgesetz\nBayern Amtsgericht Deggendorf HRB 4915\nRSD Grundstücks GmbH – Deggendorf",
      "type": "Registerbekanntmachung nach dem Umwandlungsgesetz",
      "state": "Bayern",
      "amtsgericht": "Amtsgericht Deggendorf",
      "registernummer": "HRB 4915",
      "registerart": "HRB",
      "company_name": "RSD Grundstücks GmbH",
      "company_seat": "Deggendorf",
      "details": "25.10.2025 (Bekanntmachungsdatum)\n\nBayern Amtsgericht Deggendorf HRB 4915\nRegisterbekanntmachung nach dem Umwandlungsgesetz 24.10.2025 (Eintragungsdatum)\n\nRSD Grundstücks GmbH\nGesellschaft mit beschränkter Haftung\nDeggendorf\n\nDen Gläubigern der an der Verschmelzung beteiligten Rechtsträger ist, wenn sie binnen sechs Monaten nach dem Tag, an dem die Eintragung der Verschmelzung in das Register des Sitzes desjenigen Rechtsträgers, dessen Gläubiger sie sind, nach § 19 Abs. 3 UmwG als bekannt gemacht gilt, ihren Anspruch nach Grund und Höhe in Textform anmelden, Sicherheit zu leisten, soweit sie nicht Befriedigung verlangen können. Dieses Recht steht den Gläubigern jedoch nur zu, wenn sie glaubhaft machen, dass durch die Verschmelzung die Erfüllung ihrer Forderung gefährdet wird."
    },
    {
      "date": "2025-10-25",
      "id": "135300",
      "original_text": "Registerbekanntmachung nach dem Umwandlungsgesetz\nBayern Amtsgericht Nürnberg HRB 29820\nT.U.licious GmbH – Schwabach",
      "type": "Registerbekanntmachung nach dem Umwandlungsgesetz",
      "state": "Bayern",
      "amtsgericht": "Amtsgericht Nürnberg",
      "registernummer": "HRB 29820",
      "registerart": "HRB",
      "company_name": "T.U.licious GmbH",
      "company_seat": "Schwabach",
      "details": "25.10.2025 (Bekanntmachungsdatum)\n\nBayern Amtsgericht Nürnberg HRB 29820\nRegisterbekanntmachung nach dem Umwandlungsgesetz 24.10.2025 (Eintragungsdatum)\n\nT.U.licious GmbH\nGesellschaft mit beschränkter Haftung\nSchwabach\n\nDen Gläubigern der an der Spaltung beteiligten Rechtsträger ist, wenn sie binnen sechs Monaten nach dem Tag, an dem die Eintragung der Spaltung in das Register des Sitzes desjenigen Rechtsträgers, dessen Gläubiger sie sind, nach §§ 125, 19 Abs. 3 UmwG als bekannt gemacht gilt, ihren Anspruch nach Grund und Höhe in Textform anmelden, Sicherheit zu leisten, soweit sie nicht Befriedigung verlangen können. Dieses Recht steht den Gläubigern jedoch nur zu, wenn sie glaubhaft machen, dass durch die Spaltung die Erfüllung ihrer Forderung gefährdet wird."
    },
    {
      "date": "2025-10-25",
      "id": "135301",
      "original_text": "Registerbekanntmachung nach dem Umwandlungsgesetz\nBayern Amtsgericht München HRB 268936\nGSR GmbH – Olching",
      "type": "Registerbekanntmachung nach dem Umwandlungsgesetz",
      "state": "Bayern",
      "amtsgericht": "Amtsgericht München",
      "registernummer": "HRB 268936",
      "registerart": "HRB",
      "company_name": "GSR GmbH",
      "company_seat": "Olching",
      "details": "25.10.2025 (Bekanntmachungsdatum)\n\nBayern Amtsgericht München HRB 268936\nRegisterbekanntmachung nach dem Umwandlungsgesetz 24.10.2025 (Eintragungsdatum)\n\nGSR GmbH\nGesellschaft mit beschränkter Haftung\nOlching\n\nDen Gläubigern der an der Verschmelzung beteiligten Rechtsträger ist, wenn sie binnen sechs Monaten nach dem Tag, an dem die Eintragung der Verschmelzung in das Register des Sitzes desjenigen Rechtsträgers, dessen Gläubiger sie sind, nach § 19 Abs. 3 UmwG als bekannt gemacht gilt, ihren Anspruch nach Grund und Höhe in Textform anmelden, Sicherheit zu leisten, soweit sie nicht Befriedigung verlangen können. Dieses Recht steht den Gläubigern jedoch nur zu, wenn sie glaubhaft machen, dass durch die Verschmelzung die Erfüllung ihrer Forderung gefährdet wird."
    },
    {
      "date": "2025-10-25",
      "id": "135302",
      "original_text": "Einreichung neuer Dokumente\nBayern Amtsgericht München HRB 118952\nKNDS Deutschland Verwaltungs GmbH – München",
      "type": "Einreichung neuer Dokumente",
      "state": "Bayern",
      "amtsgericht": "Amtsgericht München",
      "registernummer": "HRB 118952",
      "registerart": "HRB",
      "company_name": "KNDS Deutschland Verwaltungs GmbH",
      "company_seat": "München",
      "details": "25.10.2025 (Bekanntmachungsdatum)\n\nBayern Amtsgericht München HRB 118952\nEinreichung neuer Dokumente 24.10.2025 (Eintragungsdatum)\n\nKNDS Deutschland Verwaltungs GmbH\nGesellschaft mit beschränkter Haftung\nMünchen\n\nDem Amtsgericht München -Registergericht- ist eine Liste der Mitglieder des Aufsichtsrats eingereicht worden, § 52 Abs. 3 S. 2 GmbHG."
    },
    {
      "date": "2025-10-25",
      "id": "135303",
      "original_text": "Löschungsankündigung\nBayern Amtsgericht Landshut HRB 11884\nFlorian Bauunternehmen UG (haftungsbeschränkt) – Eggenfelden",
      "type": "Löschungsankündigung",
      "state": "Bayern",
      "amtsgericht": "Amtsgericht Landshut",
      "registernummer": "HRB 11884",
      "registerart": "HRB",
      "company_name": "Florian Bauunternehmen UG (haftungsbeschränkt)",
      "company_seat": "Eggenfelden",
      "details": "25.10.2025 (Bekanntmachungsdatum)\n\nBayern Amtsgericht Landshut HRB 11884\nLöschungsankündigung\n\nFlorian Bauunternehmen UG (haftungsbeschränkt)\nGesellschaft mit beschränkter Haftung\nEggenfelden\n\nDas Registergericht beabsichtigt, die im Handelsregister eingetragene Gesellschaft wegen Vermögenslosigkeit von Amts wegen nach § 394 FamFG zu löschen. Die Frist zur Erhebung eines Widerspruchs ist auf einen Monat festgesetzt."
    },
    {
      "date": "2025-10-25",
      "id": "135304",
      "original_text": "Registerbekanntmachung nach dem Umwandlungsgesetz\nBayern Amtsgericht Ingolstadt HRB 12082\nBMR Beteiligung GmbH – Schrobenhausen",
      "type": "Registerbekanntmachung nach dem Umwandlungsgesetz",
      "state": "Bayern",
      "amtsgericht": "Amtsgericht Ingolstadt",
      "registernummer": "HRB 12082",
      "registerart": "HRB",
      "company_name": "BMR Beteiligung GmbH",
      "company_seat": "Schrobenhausen",
      "details": "25.10.2025 (Bekanntmachungsdatum)\n\nBayern Amtsgericht Ingolstadt HRB 12082\nRegisterbekanntmachung nach dem Umwandlungsgesetz 24.10.2025 (Eintragungsdatum)\n\nBMR Beteiligung GmbH\nGesellschaft mit beschränkter Haftung\nSchrobenhausen\n\nDen Gläubigern der an der Verschmelzung beteiligten Rechtsträger ist, wenn sie binnen sechs Monaten nach dem Tag, an dem die Eintragung der Verschmelzung in das Register des Sitzes desjenigen Rechtsträgers, dessen Gläubiger sie sind, nach § 19 Abs. 3 UmwG als bekannt gemacht gilt, ihren Anspruch nach Grund und Höhe in Textform anmelden, Sicherheit zu leisten, soweit sie nicht Befriedigung verlangen können. Dieses Recht steht den Gläubigern jedoch nur zu, wenn sie glaubhaft machen, dass durch die Verschmelzung die Erfüllung ihrer Forderung gefährdet wird."
    },
    {
      "date": "2025-10-25",
      "id": "135305",
      "original_text": "Registerbekanntmachung nach dem Umwandlungsgesetz\nBayern Amtsgericht Nürnberg HRB 42356\nM.E. One GmbH – Kammerstein",
      "type": "Registerbekanntmachung nach dem Umwandlungsgesetz",
      "state": "Bayern",
      "amtsgericht": "Amtsgericht Nürnberg",
      "registernummer": "HRB 42356",
      "registerart": "HRB",
      "company_name": "M.E. One GmbH",
      "company_seat": "Kammerstein",
      "details": "25.10.2025 (Bekanntmachungsdatum)\n\nBayern Amtsgericht Nürnberg HRB 42356\nRegisterbekanntmachung nach dem Umwandlungsgesetz 24.10.2025 (Eintragungsdatum)\n\nM.E. One GmbH\nGesellschaft mit beschränkter Haftung\nKammerstein\n\nDen Gläubigern der an der Spaltung beteiligten Rechtsträger ist, wenn sie binnen sechs Monaten nach dem Tag, an dem die Eintragung der Spaltung in das Register des Sitzes desjenigen Rechtsträgers, dessen Gläubiger sie sind, nach §§ 125, 19 Abs. 3 UmwG als bekannt gemacht gilt, ihren Anspruch nach Grund und Höhe in Textform anmelden, Sicherheit zu leisten, soweit sie nicht Befriedigung verlangen können. Dieses Recht steht den Gläubigern jedoch nur zu, wenn sie glaubhaft machen, dass durch die Spaltung die Erfüllung ihrer Forderung gefährdet wird."
    },
    {
      "date": "2025-10-25",
      "id": "135306",
      "original_text": "Registerbekanntmachung nach dem Umwandlungsgesetz\nBayern Amtsgericht München HRB 306547\nSchunn Metallbau GmbH – Geretsried",
      "type": "Registerbekanntmachung nach dem Umwandlungsgesetz",
      "state": "Bayern",
      "amtsgericht": "Amtsgericht München",
      "registernummer": "HRB 306547",
      "registerart": "HRB",
      "company_name": "Schunn Metallbau GmbH",
      "company_seat": "Geretsried",
      "details": "25.10.2025 (Bekanntmachungsdatum)\n\nBayern Amtsgericht München HRB 306547\nRegisterbekanntmachung nach dem Umwandlungsgesetz 24.10.2025 (Eintragungsdatum)\n\nSchunn Metallbau GmbH\nGesellschaft mit beschränkter Haftung\nGeretsried\n\nDen Gläubigern des formwechselnden Rechtsträgers ist, wenn sie binnen sechs Monaten nach dem Tag, an dem die Eintragung des Formwechsels nach § 201 UmwG als bekannt gemacht gilt, ihren Anspruch nach Grund und Höhe in Textform anmelden, Sicherheit zu leisten, soweit sie nicht Befriedigung verlangen können. Dieses Recht steht den Gläubigern jedoch nur zu, wenn sie glaubhaft machen, dass durch den Formwechsel die Erfüllung ihrer Forderung gefährdet wird."
    },
    {
      "date": "2025-10-25",
      "id": "135307",
      "original_text": "Registerbekanntmachung nach dem Umwandlungsgesetz\nBayern Amtsgericht München HRB 306548\nEnerchange GmbH – München",
      "type": "Registerbekanntmachung nach dem Umwandlungsgesetz",
      "state": "Bayern",
      "amtsgericht": "Amtsgericht München",
      "registernummer": "HRB 306548",
      "registerart": "HRB",
      "company_name": "Enerchange GmbH",
      "company_seat": "München",
      "details": "25.10.2025 (Bekanntmachungsdatum)\n\nBayern Amtsgericht München HRB 306548\nRegisterbekanntmachung nach dem Umwandlungsgesetz 24.10.2025 (Eintragungsdatum)\n\nEnerchange GmbH\nGesellschaft mit beschränkter Haftung\nMünchen\n\nDen Gläubigern des formwechselnden Rechtsträgers ist, wenn sie binnen sechs Monaten nach dem Tag, an dem die Eintragung des Formwechsels nach § 201 UmwG als bekannt gemacht gilt, ihren Anspruch nach Grund und Höhe in Textform anmelden, Sicherheit zu leisten, soweit sie nicht Befriedigung verlangen können. Dieses Recht steht den Gläubigern jedoch nur zu, wenn sie glaubhaft machen, dass durch den Formwechsel die Erfüllung ihrer Forderung gefährdet wird."
    },
    {
      "date": "2025-10-25",
      "id": "135308",
      "original_text": "Registerbekanntmachung nach dem Umwandlungsgesetz\nBayern Amtsgericht Landshut HRB 13689\nStangl Rumänien GmbH – Simbach",
      "type": "Registerbekanntmachung nach dem Umwandlungsgesetz",
      "state": "Bayern",
      "amtsgericht": "Amtsgericht Landshut",
      "registernummer": "HRB 13689",
      "registerart": "HRB",
      "company_name": "Stangl Rumänien GmbH",
      "company_seat": "Simbach",
      "details": "25.10.2025 (Bekanntmachungsdatum)\n\nBayern Amtsgericht Landshut HRB 13689\nRegisterbekanntmachung nach dem Umwandlungsgesetz 24.10.2025 (Eintragungsdatum)\n\nStangl Rumänien GmbH\nGesellschaft mit beschränkter Haftung\nSimbach\n\nDen Gläubigern der an der Verschmelzung beteiligten Rechtsträger ist, wenn sie binnen sechs Monaten nach dem Tag, an dem die Eintragung der Verschmelzung in das Register des Sitzes desjenigen Rechtsträgers, dessen Gläubiger sie sind, nach § 19 Abs. 3 UmwG als bekannt gemacht gilt, ihren Anspruch nach Grund und Höhe in Textform anmelden, Sicherheit zu leisten, soweit sie nicht Befriedigung verlangen können. Dieses Recht steht den Gläubigern jedoch nur zu, wenn sie glaubhaft machen, dass durch die Verschmelzung die Erfüllung ihrer Forderung gefährdet wird."
    },
    {
      "date": "2025-10-25",
      "id": "135309",
      "original_text": "Registerbekanntmachung nach dem Umwandlungsgesetz\nBayern Amtsgericht Deggendorf HRA 3038\nDGD Projektentwicklungs GmbH & Co. KG – Deggendorf",
      "type": "Registerbekanntmachung nach dem Umwandlungsgesetz",
      "state": "Bayern",
      "amtsgericht": "Amtsgericht Deggendorf",
      "registernummer": "HRA 3038",
      "registerart": "HRA",
      "company_name": "DGD Projektentwicklungs GmbH & Co. KG",
      "company_seat": "Deggendorf",
      "details": "25.10.2025 (Bekanntmachungsdatum)\n\nBayern Amtsgericht Deggendorf HRA 3038\nRegisterbekanntmachung nach dem Umwandlungsgesetz 24.10.2025 (Eintragungsdatum)\n\nDGD Projektentwicklungs GmbH & Co. KG\nKommanditgesellschaft\nDeggendorf\n\nDen Gläubigern der an der Verschmelzung beteiligten Rechtsträger ist, wenn sie binnen sechs Monaten nach dem Tag, an dem die Eintragung der Verschmelzung in das Register des Sitzes desjenigen Rechtsträgers, dessen Gläubiger sie sind, nach § 19 Abs. 3 UmwG als bekannt gemacht gilt, ihren Anspruch nach Grund und Höhe in Textform anmelden, Sicherheit zu leisten, soweit sie nicht Befriedigung verlangen können. Dieses Recht steht den Gläubigern jedoch nur zu, wenn sie glaubhaft machen, dass durch die Verschmelzung die Erfüllung ihrer Forderung gefährdet wird."
    },
    {
      "date": "2025-10-25",
      "id": "135310",
      "original_text": "Registerbekanntmachung nach dem Umwandlungsgesetz\nBayern Amtsgericht Ingolstadt HRB 101738\nBAUER Maschinen GmbH – Schrobenhausen",
      "type": "Registerbekanntmachung nach dem Umwandlungsgesetz",
      "state": "Bayern",
      "amtsgericht": "Amtsgericht Ingolstadt",
      "registernummer": "HRB 101738",
      "registerart": "HRB",
      "company_name": "BAUER Maschinen GmbH",
      "company_seat": "Schrobenhausen",
      "details": "25.10.2025 (Bekanntmachungsdatum)\n\nBayern Amtsgericht Ingolstadt HRB 101738\nRegisterbekanntmachung nach dem Umwandlungsgesetz 24.10.2025 (Eintragungsdatum)\n\nBAUER Maschinen GmbH\nGesellschaft mit beschränkter Haftung\nSchrobenhausen\n\nDen Gläubigern der an der Verschmelzung beteiligten Rechtsträger ist, wenn sie binnen sechs Monaten nach dem Tag, an dem die Eintragung der Verschmelzung in das Register des Sitzes desjenigen Rechtsträgers, dessen Gläubiger sie sind, nach § 19 Abs. 3 UmwG als bekannt gemacht gilt, ihren Anspruch nach Grund und Höhe in Textform anmelden, Sicherheit zu leisten, soweit sie nicht Befriedigung verlangen können. Dieses Recht steht den Gläubigern jedoch nur zu, wenn sie glaubhaft machen, dass durch die Verschmelzung die Erfüllung ihrer Forderung gefährdet wird."
    },
    {
      "date": "2025-10-25",
      "id": "135311",
      "original_text": "Registerbekanntmachung nach dem Umwandlungsgesetz\nBayern Amtsgericht München HRB 275231\nKenf Safety & Security Oberbayern GmbH – Dorfen",
      "type": "Registerbekanntmachung nach dem Umwandlungsgesetz",
      "state": "Bayern",
      "amtsgericht": "Amtsgericht München",
      "registernummer": "HRB 275231",
      "registerart": "HRB",
      "company_name": "Kenf Safety & Security Oberbayern GmbH",
      "company_seat": "Dorfen",
      "details": "25.10.2025 (Bekanntmachungsdatum)\n\nBayern Amtsgericht München HRB 275231\nRegisterbekanntmachung nach dem Umwandlungsgesetz 24.10.2025 (Eintragungsdatum)\n\nKenf Safety & Security Oberbayern GmbH\nGesellschaft mit beschränkter Haftung\nDorfen\n\nDen Gläubigern der an der Verschmelzung beteiligten Rechtsträger ist, wenn sie binnen sechs Monaten nach dem Tag, an dem die Eintragung der Verschmelzung in das Register des Sitzes desjenigen Rechtsträgers, dessen Gläubiger sie sind, nach § 19 Abs. 3 UmwG als bekannt gemacht gilt, ihren Anspruch nach Grund und Höhe in Textform anmelden, Sicherheit zu leisten, soweit sie nicht Befriedigung verlangen können. Dieses Recht steht den Gläubigern jedoch nur zu, wenn sie glaubhaft machen, dass durch die Verschmelzung die Erfüllung ihrer Forderung gefährdet wird."
    },
    {
      "date": "2025-10-25",
      "id": "135312",
      "original_text": "Registerbekanntmachung nach dem Umwandlungsgesetz\nMecklenburg-Vorpommern Amtsgericht Rostock HRB 15268\nSteinberg Faszination Raum GmbH – Broderstorf",
      "type": "Registerbekanntmachung nach dem Umwandlungsgesetz",
      "state": "Mecklenburg-Vorpommern",
      "amtsgericht": "Amtsgericht Rostock",
      "registernummer": "HRB 15268",
      "registerart": "HRB",
      "company_name": "Steinberg Faszination Raum GmbH",
      "company_seat": "Broderstorf",
      "details": "25.10.2025 (Bekanntmachungsdatum)\n\nMecklenburg-Vorpommern Amtsgericht Rostock HRB 15268\nRegisterbekanntmachung nach dem Umwandlungsgesetz 24.10.2025 (Eintragungsdatum)\n\nSteinberg Faszination Raum GmbH\nGesellschaft mit beschränkter Haftung\nBroderstorf\n\nAls nicht eingetragen wird veröffentlicht: Den Gläubigern der an der Verschmelzung beteiligten Rechtsträger ist, wenn sie binnen sechs Monaten nach dem Tag, an dem die Eintragung der Verschmelzung in das Register des Sitzes desjenigen Rechtsträgers, dessen Gläubiger sie sind, nach § 19 Abs. 3 UmwG als bekannt gemacht gilt,\nihren Anspruch nach Grund und Höhe in Textform anmelden, Sicherheit zu leisten, soweit sie nicht Befriedigung verlangen können. Dieses Recht steht den Gläubigern jedoch nur zu, wenn sie glaubhaft machen, dass durch die Verschmelzung die Erfüllung der Forderung gefährdet wird."
    },
    {
      "date": "2025-10-25",
      "id": "135313",
      "original_text": "Registerbekanntmachung nach dem Umwandlungsgesetz\nMecklenburg-Vorpommern Amtsgericht Rostock HRB 15267\nSteinberg Holding GmbH – Rostock",
      "type": "Registerbekanntmachung nach dem Umwandlungsgesetz",
      "state": "Mecklenburg-Vorpommern",
      "amtsgericht": "Amtsgericht Rostock",
      "registernummer": "HRB 15267",
      "registerart": "HRB",
      "company_name": "Steinberg Holding GmbH",
      "company_seat": "Rostock",
      "details": "25.10.2025 (Bekanntmachungsdatum)\n\nMecklenburg-Vorpommern Amtsgericht Rostock HRB 15267\nRegisterbekanntmachung nach dem Umwandlungsgesetz 24.10.2025 (Eintragungsdatum)\n\nSteinberg Holding GmbH\nGesellschaft mit beschränkter Haftung\nRostock\n\nAls nicht eingetragen wird veröffentlicht: Den Gläubigern der an der Verschmelzung beteiligten Rechtsträger ist, wenn sie binnen sechs Monaten nach dem Tag, an dem die Eintragung der Verschmelzung in das Register des Sitzes desjenigen Rechtsträgers, dessen Gläubiger sie sind, nach § 19 Abs. 3 UmwG als bekannt gemacht gilt,\nihren Anspruch nach Grund und Höhe in Textform anmelden, Sicherheit zu leisten, soweit sie nicht Befriedigung verlangen können. Dieses Recht steht den Gläubigern jedoch nur zu, wenn sie glaubhaft machen, dass durch die Verschmelzung die Erfüllung der Forderung gefährdet wird."
    }
  ]
}