{
  "date": "2025-10-04",
  "date_of_scrape": "2025-10-27T17:03:55.815Z",
  "tool_version": "0.2.0",
  "number_of_announcements": 2,
  "announcements": [
    {
      "date": "2025-10-04",
      "id": "132620",
      "original_text": "Registerbekanntmachung nach dem Umwandlungsgesetz\nNordrhein-Westfalen Amtsgericht Gütersloh HRB 4568\nStötzel GmbH – Steinhagen",
      "type": "Registerbekanntmachung nach dem Umwandlungsgesetz",
      "state": "Nordrhein-Westfalen",
      "amtsgericht": "Amtsgericht Gütersloh",
      "registernummer": "HRB 4568",
      "registerart": "HRB",
      "company_name": "Stötzel GmbH",
      "company_seat": "Steinhagen",
      "details": "04.10.2025 (Bekanntmachungsdatum)\n\nNordrhein-Westfalen Amtsgericht Gütersloh HRB 4568\nRegisterbekanntmachung nach dem Umwandlungsgesetz 04.10.2025 (Eintragungsdatum)\n\nStötzel GmbH\nGesellschaft mit beschränkter Haftung\nSteinhagen\n\nDen Gläubigern der an der Verschmelzung beteiligten Rechtsträger ist, wenn sie binnen sechs Monaten nach dem Tag, an dem die Eintragung der Verschmelzung in das Register des Sitzes desjenigen Rechtsträgers, dessen Gläubiger sie sind, nach § 19 Absatz 3 UmwG als bekanntgemacht gilt, ihren Anspruch nach Grund und Höhe schriftlich anmelden, Sicherheit zu leisten, soweit sie nicht Befriedigung verlangen können. Dieses Recht steht den Gläubigern jedoch nur zu, wenn sie glaubhaft machen, dass durch die Verschmelzung die Erfüllung ihrer Forderung gefährdet wird."
    },
    {
      "date": "2025-10-04",
      "id": "132621",
      "original_text": "Registerbekanntmachung nach dem Umwandlungsgesetz\nNordrhein-Westfalen Amtsgericht Gütersloh HRB 8212\nStötzel Verkehrs GmbH Fahrschule und Kraftfahrerschulung – Steinhagen",
      "type": "Registerbekanntmachung nach dem Umwandlungsgesetz",
      "state": "Nordrhein-Westfalen",
      "amtsgericht": "Amtsgericht Gütersloh",
      "registernummer": "HRB 8212",
      "registerart": "HRB",
      "company_name": "Stötzel Verkehrs GmbH Fahrschule und Kraftfahrerschulung",
      "company_seat": "Steinhagen",
      "details": "04.10.2025 (Bekanntmachungsdatum)\n\nNordrhein-Westfalen Amtsgericht Gütersloh HRB 8212\nRegisterbekanntmachung nach dem Umwandlungsgesetz 04.10.2025 (Eintragungsdatum)\n\nStötzel Verkehrs GmbH Fahrschule und Kraftfahrerschulung\nGesellschaft mit beschränkter Haftung\nSteinhagen\n\nDen Gläubigern der an der Verschmelzung beteiligten Rechtsträger ist, wenn sie binnen sechs Monaten nach dem Tag, an dem die Eintragung der Verschmelzung in das Register des Sitzes desjenigen Rechtsträgers, dessen Gläubiger sie sind, nach § 19 Absatz 3 UmwG als bekanntgemacht gilt, ihren Anspruch nach Grund und Höhe schriftlich anmelden, Sicherheit zu leisten, soweit sie nicht Befriedigung verlangen können. Dieses Recht steht den Gläubigern jedoch nur zu, wenn sie glaubhaft machen, dass durch die Verschmelzung die Erfüllung ihrer Forderung gefährdet wird."
    }
  ]
}