{
  "date": "2025-10-21",
  "date_of_scrape": "2025-10-27T18:37:32.856Z",
  "tool_version": "0.2.0",
  "number_of_announcements": 168,
  "announcements": [
    {
      "date": "2025-10-21",
      "id": "134641",
      "original_text": "Löschungsankündigung\nBayern Amtsgericht Ansbach HRB 4181\n0 0 : 0 0 - 24 : 0 0 N.D.S.National Door Security - Schlüsseldienst Schlüsselnotdienst - Preiswert - Kundennah Bereitschaftszentrale Leutershausen GmbH – Leutershausen",
      "type": "Löschungsankündigung",
      "state": "Bayern",
      "amtsgericht": "Amtsgericht Ansbach",
      "registernummer": "HRB 4181",
      "registerart": "HRB",
      "company_name": "0 0 : 0 0 - 24 : 0 0 N.D.S.National Door Security - Schlüsseldienst Schlüsselnotdienst - Preiswert - Kundennah Bereitschaftszentrale Leutershausen GmbH",
      "company_seat": "Leutershausen",
      "details": "21.10.2025 (Bekanntmachungsdatum)\n\nBayern Amtsgericht Ansbach HRB 4181\nLöschungsankündigung\n\n0 0 : 0 0 - 24 : 0 0 N.D.S.National Door Security - Schlüsseldienst Schlüsselnotdienst - Preiswert - Kundennah Bereitschaftszentrale Leutershausen GmbH\nGesellschaft mit beschränkter Haftung\nLeutershausen\n\nDas Registergericht beabsichtigt, die im Handelsregister eingetragene Gesellschaft wegen Vermögenslosigkeit von Amts wegen nach § 394 FamFG zu löschen. Die Frist zur Erhebung eines Widerspruchs ist auf sechs Wochen festgesetzt."
    },
    {
      "date": "2025-10-21",
      "id": "134642",
      "original_text": "Registerbekanntmachung nach dem Umwandlungsgesetz\nBayern Amtsgericht Regensburg HRB 20850\nVitesco Technologies Beteiligungs GmbH – Regensburg",
      "type": "Registerbekanntmachung nach dem Umwandlungsgesetz",
      "state": "Bayern",
      "amtsgericht": "Amtsgericht Regensburg",
      "registernummer": "HRB 20850",
      "registerart": "HRB",
      "company_name": "Vitesco Technologies Beteiligungs GmbH",
      "company_seat": "Regensburg",
      "details": "21.10.2025 (Bekanntmachungsdatum)\n\nBayern Amtsgericht Regensburg HRB 20850\nRegisterbekanntmachung nach dem Umwandlungsgesetz 20.10.2025 (Eintragungsdatum)\n\nVitesco Technologies Beteiligungs GmbH\nGesellschaft mit beschränkter Haftung\nRegensburg\n\nDen Gläubigern der an der Verschmelzung beteiligten Rechtsträger ist, wenn sie binnen sechs Monaten nach dem Tag, an dem die Eintragung der Verschmelzung in das Register des Sitzes desjenigen Rechtsträgers, dessen Gläubiger sie sind, nach § 19 Abs. 3 UmwG als bekannt gemacht gilt, ihren Anspruch nach Grund und Höhe in Textform anmelden, Sicherheit zu leisten, soweit sie nicht Befriedigung verlangen können. Dieses Recht steht den Gläubigern jedoch nur zu, wenn sie glaubhaft machen, dass durch die Verschmelzung die Erfüllung ihrer Forderung gefährdet wird."
    },
    {
      "date": "2025-10-21",
      "id": "134643",
      "original_text": "Registerbekanntmachung nach dem Umwandlungsgesetz\nBayern Amtsgericht Regensburg HRB 20451\nVitesco Technologies Grundstücks GmbH – Regensburg",
      "type": "Registerbekanntmachung nach dem Umwandlungsgesetz",
      "state": "Bayern",
      "amtsgericht": "Amtsgericht Regensburg",
      "registernummer": "HRB 20451",
      "registerart": "HRB",
      "company_name": "Vitesco Technologies Grundstücks GmbH",
      "company_seat": "Regensburg",
      "details": "21.10.2025 (Bekanntmachungsdatum)\n\nBayern Amtsgericht Regensburg HRB 20451\nRegisterbekanntmachung nach dem Umwandlungsgesetz 20.10.2025 (Eintragungsdatum)\n\nVitesco Technologies Grundstücks GmbH\nGesellschaft mit beschränkter Haftung\nRegensburg\n\nDen Gläubigern der an der Verschmelzung beteiligten Rechtsträger ist, wenn sie binnen sechs Monaten nach dem Tag, an dem die Eintragung der Verschmelzung in das Register des Sitzes desjenigen Rechtsträgers, dessen Gläubiger sie sind, nach § 19 Abs. 3 UmwG als bekannt gemacht gilt, ihren Anspruch nach Grund und Höhe in Textform anmelden, Sicherheit zu leisten, soweit sie nicht Befriedigung verlangen können. Dieses Recht steht den Gläubigern jedoch nur zu, wenn sie glaubhaft machen, dass durch die Verschmelzung die Erfüllung ihrer Forderung gefährdet wird."
    },
    {
      "date": "2025-10-21",
      "id": "134644",
      "original_text": "Löschungsankündigung\nBayern Amtsgericht Aschaffenburg HRB 16593\nMain Deals UG (haftungsbeschränkt) – Miltenberg",
      "type": "Löschungsankündigung",
      "state": "Bayern",
      "amtsgericht": "Amtsgericht Aschaffenburg",
      "registernummer": "HRB 16593",
      "registerart": "HRB",
      "company_name": "Main Deals UG (haftungsbeschränkt)",
      "company_seat": "Miltenberg",
      "details": "21.10.2025 (Bekanntmachungsdatum)\n\nBayern Amtsgericht Aschaffenburg HRB 16593\nLöschungsankündigung\n\nMain Deals UG (haftungsbeschränkt)\nGesellschaft mit beschränkter Haftung\nMiltenberg\n\nDas Registergericht beabsichtigt, die im Handelsregister eingetragene Gesellschaft wegen Vermögenslosigkeit von Amts wegen nach § 394 FamFG zu löschen. Die Frist zur Erhebung eines Widerspruchs ist auf drei Monate festgesetzt."
    },
    {
      "date": "2025-10-21",
      "id": "134645",
      "original_text": "Registerbekanntmachung nach dem Umwandlungsgesetz\nBayern Amtsgericht Fürth HRB 15353\nS&P Stadtbau Projekt 7 GmbH – Erlangen",
      "type": "Registerbekanntmachung nach dem Umwandlungsgesetz",
      "state": "Bayern",
      "amtsgericht": "Amtsgericht Fürth",
      "registernummer": "HRB 15353",
      "registerart": "HRB",
      "company_name": "S&P Stadtbau Projekt 7 GmbH",
      "company_seat": "Erlangen",
      "details": "21.10.2025 (Bekanntmachungsdatum)\n\nBayern Amtsgericht Fürth HRB 15353\nRegisterbekanntmachung nach dem Umwandlungsgesetz 20.10.2025 (Eintragungsdatum)\n\nS&P Stadtbau Projekt 7 GmbH\nGesellschaft mit beschränkter Haftung\nErlangen\n\nDen Gläubigern des formwechselnden Rechtsträgers ist, wenn sie binnen sechs Monaten nach dem Tag, an dem die Eintragung des Formwechsels nach § 201 UmwG als bekannt gemacht gilt, ihren Anspruch nach Grund und Höhe in Textform anmelden, Sicherheit zu leisten, soweit sie nicht Befriedigung verlangen können. Dieses Recht steht den Gläubigern jedoch nur zu, wenn sie glaubhaft machen, dass durch den Formwechsel die Erfüllung ihrer Forderung gefährdet wird."
    },
    {
      "date": "2025-10-21",
      "id": "134646",
      "original_text": "Registerbekanntmachung nach dem Umwandlungsgesetz\nBayern Amtsgericht München HRB 282432\nConnex Holding GmbH – Grünwald",
      "type": "Registerbekanntmachung nach dem Umwandlungsgesetz",
      "state": "Bayern",
      "amtsgericht": "Amtsgericht München",
      "registernummer": "HRB 282432",
      "registerart": "HRB",
      "company_name": "Connex Holding GmbH",
      "company_seat": "Grünwald",
      "details": "21.10.2025 (Bekanntmachungsdatum)\n\nBayern Amtsgericht München HRB 282432\nRegisterbekanntmachung nach dem Umwandlungsgesetz 20.10.2025 (Eintragungsdatum)\n\nConnex Holding GmbH\nGesellschaft mit beschränkter Haftung\nGrünwald\n\nDen Gläubigern der an der Verschmelzung beteiligten Rechtsträger ist, wenn sie binnen sechs Monaten nach dem Tag, an dem die Eintragung der Verschmelzung in das Register des Sitzes desjenigen Rechtsträgers, dessen Gläubiger sie sind, nach § 19 Abs. 3 UmwG als bekannt gemacht gilt, ihren Anspruch nach Grund und Höhe in Textform anmelden, Sicherheit zu leisten, soweit sie nicht Befriedigung verlangen können. Dieses Recht steht den Gläubigern jedoch nur zu, wenn sie glaubhaft machen, dass durch die Verschmelzung die Erfüllung ihrer Forderung gefährdet wird."
    },
    {
      "date": "2025-10-21",
      "id": "134647",
      "original_text": "Registerbekanntmachung nach dem Umwandlungsgesetz\nBayern Amtsgericht München HRB 255928\nMaiks Landschaft & Erdbau UG (haftungsbeschränkt) – Fischbachau",
      "type": "Registerbekanntmachung nach dem Umwandlungsgesetz",
      "state": "Bayern",
      "amtsgericht": "Amtsgericht München",
      "registernummer": "HRB 255928",
      "registerart": "HRB",
      "company_name": "Maiks Landschaft & Erdbau UG (haftungsbeschränkt)",
      "company_seat": "Fischbachau",
      "details": "21.10.2025 (Bekanntmachungsdatum)\n\nBayern Amtsgericht München HRB 255928\nRegisterbekanntmachung nach dem Umwandlungsgesetz 20.10.2025 (Eintragungsdatum)\n\nMaiks Landschaft & Erdbau UG (haftungsbeschränkt)\nGesellschaft mit beschränkter Haftung\nFischbachau\n\nDen Gläubigern der an der Verschmelzung beteiligten Rechtsträger ist, wenn sie binnen sechs Monaten nach dem Tag, an dem die Eintragung der Verschmelzung in das Register des Sitzes desjenigen Rechtsträgers, dessen Gläubiger sie sind, nach § 19 Abs. 3 UmwG als bekannt gemacht gilt, ihren Anspruch nach Grund und Höhe in Textform anmelden, Sicherheit zu leisten, soweit sie nicht Befriedigung verlangen können. Dieses Recht steht den Gläubigern jedoch nur zu, wenn sie glaubhaft machen, dass durch die Verschmelzung die Erfüllung ihrer Forderung gefährdet wird."
    },
    {
      "date": "2025-10-21",
      "id": "134648",
      "original_text": "Einreichung neuer Dokumente\nBayern Amtsgericht München HRB 262679\nFAISSNER PETERMEIER Fahrzeugtechnik AG – Garching b.München",
      "type": "Einreichung neuer Dokumente",
      "state": "Bayern",
      "amtsgericht": "Amtsgericht München",
      "registernummer": "HRB 262679",
      "registerart": "HRB",
      "company_name": "FAISSNER PETERMEIER Fahrzeugtechnik AG",
      "company_seat": "Garching b.München",
      "details": "21.10.2025 (Bekanntmachungsdatum)\n\nBayern Amtsgericht München HRB 262679\nEinreichung neuer Dokumente\n\nFAISSNER PETERMEIER Fahrzeugtechnik AG\nAktiengesellschaft\nGarching b.München\n\nDem Amtsgericht München -Registergericht- ist eine Liste der Mitglieder des Aufsichtsrats eingereicht worden, § 106 AktG."
    },
    {
      "date": "2025-10-21",
      "id": "134649",
      "original_text": "Registerbekanntmachung nach dem Umwandlungsgesetz\nBayern Amtsgericht Passau HRB 10443\ngHOME AG – Vilshofen an der Donau",
      "type": "Registerbekanntmachung nach dem Umwandlungsgesetz",
      "state": "Bayern",
      "amtsgericht": "Amtsgericht Passau",
      "registernummer": "HRB 10443",
      "registerart": "HRB",
      "company_name": "gHOME AG",
      "company_seat": "Vilshofen an der Donau",
      "details": "21.10.2025 (Bekanntmachungsdatum)\n\nBayern Amtsgericht Passau HRB 10443\nRegisterbekanntmachung nach dem Umwandlungsgesetz 20.10.2025 (Eintragungsdatum)\n\ngHOME AG\nAktiengesellschaft\nVilshofen an der Donau\n\nDen Gläubigern der an der Verschmelzung beteiligten Rechtsträger ist, wenn sie binnen sechs Monaten nach dem Tag, an dem die Eintragung der Verschmelzung in das Register des Sitzes desjenigen Rechtsträgers, dessen Gläubiger sie sind, nach § 19 Abs. 3 UmwG als bekannt gemacht gilt, ihren Anspruch nach Grund und Höhe in Textform anmelden, Sicherheit zu leisten, soweit sie nicht Befriedigung verlangen können. Dieses Recht steht den Gläubigern jedoch nur zu, wenn sie glaubhaft machen, dass durch die Verschmelzung die Erfüllung ihrer Forderung gefährdet wird."
    },
    {
      "date": "2025-10-21",
      "id": "134650",
      "original_text": "Löschungsankündigung\nBayern Amtsgericht München HRB 262235\nUnity Gears UG (haftungsbeschränkt) – Grünwald",
      "type": "Löschungsankündigung",
      "state": "Bayern",
      "amtsgericht": "Amtsgericht München",
      "registernummer": "HRB 262235",
      "registerart": "HRB",
      "company_name": "Unity Gears UG (haftungsbeschränkt)",
      "company_seat": "Grünwald",
      "details": "21.10.2025 (Bekanntmachungsdatum)\n\nBayern Amtsgericht München HRB 262235\nLöschungsankündigung 13.10.2025 (Eintragungsdatum)\n\nUnity Gears UG (haftungsbeschränkt)\nGesellschaft mit beschränkter Haftung\nGrünwald\n\nDas Registergericht beabsichtigt, die im Handelsregister eingetragene Gesellschaft wegen Vermögenslosigkeit von Amts wegen nach § 394 FamFG zu löschen. Die Frist zur Erhebung eines Widerspruchs ist auf drei Monate festgesetzt."
    },
    {
      "date": "2025-10-21",
      "id": "134651",
      "original_text": "Löschungsankündigung\nBayern Amtsgericht München HRB 258151\nBetter Shapes UG (haftungsbeschränkt) – München",
      "type": "Löschungsankündigung",
      "state": "Bayern",
      "amtsgericht": "Amtsgericht München",
      "registernummer": "HRB 258151",
      "registerart": "HRB",
      "company_name": "Better Shapes UG (haftungsbeschränkt)",
      "company_seat": "München",
      "details": "21.10.2025 (Bekanntmachungsdatum)\n\nBayern Amtsgericht München HRB 258151\nLöschungsankündigung 20.10.2025 (Eintragungsdatum)\n\nBetter Shapes UG (haftungsbeschränkt)\nGesellschaft mit beschränkter Haftung\nMünchen\n\nDas Registergericht beabsichtigt, den im Handelsregister eingetragenen Geschäftsführer Sundgaard Schultz, geb. 10.06.1974 wegen fehlender Eignung nach § 395 FamFG zu löschen. Die Frist zur Erhebung eines Widerspruchs ist auf drei Monate festgesetzt."
    },
    {
      "date": "2025-10-21",
      "id": "134652",
      "original_text": "Registerbekanntmachung nach dem Umwandlungsgesetz\nBayern Amtsgericht Fürth HRB 10004\nCCM Cash & Control Management GmbH – Fürth",
      "type": "Registerbekanntmachung nach dem Umwandlungsgesetz",
      "state": "Bayern",
      "amtsgericht": "Amtsgericht Fürth",
      "registernummer": "HRB 10004",
      "registerart": "HRB",
      "company_name": "CCM Cash & Control Management GmbH",
      "company_seat": "Fürth",
      "details": "21.10.2025 (Bekanntmachungsdatum)\n\nBayern Amtsgericht Fürth HRB 10004\nRegisterbekanntmachung nach dem Umwandlungsgesetz 20.10.2025 (Eintragungsdatum)\n\nCCM Cash & Control Management GmbH\nGesellschaft mit beschränkter Haftung\nFürth\n\nDen Gläubigern der an der Verschmelzung beteiligten Rechtsträger ist, wenn sie binnen sechs Monaten nach dem Tag, an dem die Eintragung der Verschmelzung in das Register des Sitzes desjenigen Rechtsträgers, dessen Gläubiger sie sind, nach § 19 Abs. 3 UmwG als bekannt gemacht gilt, ihren Anspruch nach Grund und Höhe in Textform anmelden, Sicherheit zu leisten, soweit sie nicht Befriedigung verlangen können. Dieses Recht steht den Gläubigern jedoch nur zu, wenn sie glaubhaft machen, dass durch die Verschmelzung die Erfüllung ihrer Forderung gefährdet wird."
    },
    {
      "date": "2025-10-21",
      "id": "134653",
      "original_text": "Registerbekanntmachung nach dem Umwandlungsgesetz\nBayern Amtsgericht Hof PR 42\nbeyer architekten PartG mbB – Döhlau",
      "type": "Registerbekanntmachung nach dem Umwandlungsgesetz",
      "state": "Bayern",
      "amtsgericht": "Amtsgericht Hof",
      "registernummer": "PR 42",
      "registerart": "PR",
      "company_name": "beyer architekten PartG mbB",
      "company_seat": "Döhlau",
      "details": "21.10.2025 (Bekanntmachungsdatum)\n\nBayern Amtsgericht Hof PR 42\nRegisterbekanntmachung nach dem Umwandlungsgesetz 20.10.2025 (Eintragungsdatum)\n\nbeyer architekten PartG mbB\nPartnerschaftsgesellschaft\nDöhlau\n\nDen Gläubigern der an der Verschmelzung beteiligten Rechtsträger ist, wenn sie binnen sechs Monaten nach dem Tag, an dem die Eintragung der Verschmelzung in das Register des Sitzes desjenigen Rechtsträgers, dessen Gläubiger sie sind, nach § 19 Abs. 3 UmwG als bekannt gemacht gilt, ihren Anspruch nach Grund und Höhe in Textform anmelden, Sicherheit zu leisten, soweit sie nicht Befriedigung verlangen können. Dieses Recht steht den Gläubigern jedoch nur zu, wenn sie glaubhaft machen, dass durch die Verschmelzung die Erfüllung ihrer Forderung gefährdet wird."
    },
    {
      "date": "2025-10-21",
      "id": "134654",
      "original_text": "Registerbekanntmachung nach dem Umwandlungsgesetz\nBayern Amtsgericht Hof HRB 7080\nM. Beyer Architekten GmbH – Döhlau",
      "type": "Registerbekanntmachung nach dem Umwandlungsgesetz",
      "state": "Bayern",
      "amtsgericht": "Amtsgericht Hof",
      "registernummer": "HRB 7080",
      "registerart": "HRB",
      "company_name": "M. Beyer Architekten GmbH",
      "company_seat": "Döhlau",
      "details": "21.10.2025 (Bekanntmachungsdatum)\n\nBayern Amtsgericht Hof HRB 7080\nRegisterbekanntmachung nach dem Umwandlungsgesetz 20.10.2025 (Eintragungsdatum)\n\nM. Beyer Architekten GmbH\nGesellschaft mit beschränkter Haftung\nDöhlau\n\nDen Gläubigern der an der Verschmelzung beteiligten Rechtsträger ist, wenn sie binnen sechs Monaten nach dem Tag, an dem die Eintragung der Verschmelzung in das Register des Sitzes desjenigen Rechtsträgers, dessen Gläubiger sie sind, nach § 19 Abs. 3 UmwG als bekannt gemacht gilt, ihren Anspruch nach Grund und Höhe in Textform anmelden, Sicherheit zu leisten, soweit sie nicht Befriedigung verlangen können. Dieses Recht steht den Gläubigern jedoch nur zu, wenn sie glaubhaft machen, dass durch die Verschmelzung die Erfüllung ihrer Forderung gefährdet wird."
    },
    {
      "date": "2025-10-21",
      "id": "134655",
      "original_text": "Registerbekanntmachung nach dem Umwandlungsgesetz\nBayern Amtsgericht München HRA 121732\nOsman Hadzikic e.K. – Erding",
      "type": "Registerbekanntmachung nach dem Umwandlungsgesetz",
      "state": "Bayern",
      "amtsgericht": "Amtsgericht München",
      "registernummer": "HRA 121732",
      "registerart": "HRA",
      "company_name": "Osman Hadzikic e.K.",
      "company_seat": "Erding",
      "details": "21.10.2025 (Bekanntmachungsdatum)\n\nBayern Amtsgericht München HRA 121732\nRegisterbekanntmachung nach dem Umwandlungsgesetz 20.10.2025 (Eintragungsdatum)\n\nOsman Hadzikic e.K.\nEinzelkaufmann / Einzelkauffrau\nErding\n\nDen Gläubigern der an der Ausgliederung beteiligten Rechtsträger ist, wenn sie binnen sechs Monaten nach dem Tag, an dem die Eintragung der Ausgliederung in das Register des Sitzes desjenigen Rechtsträgers, dessen Gläubiger sie sind, nach §§ 125, 19 Abs. 3 UmwG als bekannt gemacht gilt, ihren Anspruch nach Grund und Höhe in Textform anmelden, Sicherheit zu leisten, soweit sie nicht Befriedigung verlangen können. Dieses Recht steht den Gläubigern jedoch nur zu, wenn sie glaubhaft machen, dass durch die Ausgliederung die Erfüllung ihrer Forderung gefährdet wird."
    },
    {
      "date": "2025-10-21",
      "id": "134656",
      "original_text": "Registerbekanntmachung nach dem Umwandlungsgesetz\nBayern Amtsgericht Deggendorf HRA 2643\nIprona Hengersberg KG – Hengersberg",
      "type": "Registerbekanntmachung nach dem Umwandlungsgesetz",
      "state": "Bayern",
      "amtsgericht": "Amtsgericht Deggendorf",
      "registernummer": "HRA 2643",
      "registerart": "HRA",
      "company_name": "Iprona Hengersberg KG",
      "company_seat": "Hengersberg",
      "details": "21.10.2025 (Bekanntmachungsdatum)\n\nBayern Amtsgericht Deggendorf HRA 2643\nRegisterbekanntmachung nach dem Umwandlungsgesetz 20.10.2025 (Eintragungsdatum)\n\nIprona Hengersberg KG\nKommanditgesellschaft\nHengersberg\n\nDen Gläubigern des formwechselnden Rechtsträgers ist, wenn sie binnen sechs Monaten nach dem Tag, an dem die Eintragung des Formwechsels nach § 201 UmwG als bekannt gemacht gilt, ihren Anspruch nach Grund und Höhe in Textform anmelden, Sicherheit zu leisten, soweit sie nicht Befriedigung verlangen können. Dieses Recht steht den Gläubigern jedoch nur zu, wenn sie glaubhaft machen, dass durch den Formwechsel die Erfüllung ihrer Forderung gefährdet wird."
    },
    {
      "date": "2025-10-21",
      "id": "134657",
      "original_text": "Registerbekanntmachung nach dem Umwandlungsgesetz\nBayern Amtsgericht Traunstein GsR 702\nGestione Immobilien und Vermögen eGbR – Traunstein",
      "type": "Registerbekanntmachung nach dem Umwandlungsgesetz",
      "state": "Bayern",
      "amtsgericht": "Amtsgericht Traunstein",
      "registernummer": "GsR 702",
      "registerart": "GsR",
      "company_name": "Gestione Immobilien und Vermögen eGbR",
      "company_seat": "Traunstein",
      "details": "21.10.2025 (Bekanntmachungsdatum)\n\nBayern Amtsgericht Traunstein GsR 702\nRegisterbekanntmachung nach dem Umwandlungsgesetz 20.10.2025 (Eintragungsdatum)\n\nGestione Immobilien und Vermögen eGbR\nGesellschaft bürgerlichen Rechts\nTraunstein\n\nDen Gläubigern des formwechselnden Rechtsträgers ist, wenn sie binnen sechs Monaten nach dem Tag, an dem die Eintragung des Formwechsels nach § 201 UmwG als bekannt gemacht gilt, ihren Anspruch nach Grund und Höhe in Textform anmelden, Sicherheit zu leisten, soweit sie nicht Befriedigung verlangen können. Dieses Recht steht den Gläubigern jedoch nur zu, wenn sie glaubhaft machen, dass durch den Formwechsel die Erfüllung ihrer Forderung gefährdet wird."
    },
    {
      "date": "2025-10-21",
      "id": "134658",
      "original_text": "Registerbekanntmachung nach dem Umwandlungsgesetz\nBayern Amtsgericht Traunstein HRB 11207\nEBS Syndicus Vermögensverwaltungs Aktiengesellschaft – Prien a.Chiemsee",
      "type": "Registerbekanntmachung nach dem Umwandlungsgesetz",
      "state": "Bayern",
      "amtsgericht": "Amtsgericht Traunstein",
      "registernummer": "HRB 11207",
      "registerart": "HRB",
      "company_name": "EBS Syndicus Vermögensverwaltungs Aktiengesellschaft",
      "company_seat": "Prien a.Chiemsee",
      "details": "21.10.2025 (Bekanntmachungsdatum)\n\nBayern Amtsgericht Traunstein HRB 11207\nRegisterbekanntmachung nach dem Umwandlungsgesetz 20.10.2025 (Eintragungsdatum)\n\nEBS Syndicus Vermögensverwaltungs Aktiengesellschaft\nAktiengesellschaft\nPrien a.Chiemsee\n\nDen Gläubigern des formwechselnden Rechtsträgers ist, wenn sie binnen sechs Monaten nach dem Tag, an dem die Eintragung des Formwechsels nach § 201 UmwG als bekannt gemacht gilt, ihren Anspruch nach Grund und Höhe in Textform anmelden, Sicherheit zu leisten, soweit sie nicht Befriedigung verlangen können. Dieses Recht steht den Gläubigern jedoch nur zu, wenn sie glaubhaft machen, dass durch den Formwechsel die Erfüllung ihrer Forderung gefährdet wird."
    },
    {
      "date": "2025-10-21",
      "id": "134659",
      "original_text": "Registerbekanntmachung nach dem Umwandlungsgesetz\nBayern Amtsgericht Ingolstadt HRB 9228\nmyschoolcare GmbH – Ingolstadt",
      "type": "Registerbekanntmachung nach dem Umwandlungsgesetz",
      "state": "Bayern",
      "amtsgericht": "Amtsgericht Ingolstadt",
      "registernummer": "HRB 9228",
      "registerart": "HRB",
      "company_name": "myschoolcare GmbH",
      "company_seat": "Ingolstadt",
      "details": "21.10.2025 (Bekanntmachungsdatum)\n\nBayern Amtsgericht Ingolstadt HRB 9228\nRegisterbekanntmachung nach dem Umwandlungsgesetz 20.10.2025 (Eintragungsdatum)\n\nmyschoolcare GmbH\nGesellschaft mit beschränkter Haftung\nIngolstadt\n\nDen Gläubigern der an der Spaltung beteiligten Rechtsträger ist, wenn sie binnen sechs Monaten nach dem Tag, an dem die Eintragung der Spaltung in das Register des Sitzes desjenigen Rechtsträgers, dessen Gläubiger sie sind, nach §§ 125, 19 Abs. 3 UmwG als bekannt gemacht gilt, ihren Anspruch nach Grund und Höhe in Textform anmelden, Sicherheit zu leisten, soweit sie nicht Befriedigung verlangen können. Dieses Recht steht den Gläubigern jedoch nur zu, wenn sie glaubhaft machen, dass durch die Spaltung die Erfüllung ihrer Forderung gefährdet wird."
    },
    {
      "date": "2025-10-21",
      "id": "134660",
      "original_text": "Registerbekanntmachung nach dem Umwandlungsgesetz\nBayern Amtsgericht Aschaffenburg HRB 18022\nNTB Digital Solutions GmbH – Aschaffenburg",
      "type": "Registerbekanntmachung nach dem Umwandlungsgesetz",
      "state": "Bayern",
      "amtsgericht": "Amtsgericht Aschaffenburg",
      "registernummer": "HRB 18022",
      "registerart": "HRB",
      "company_name": "NTB Digital Solutions GmbH",
      "company_seat": "Aschaffenburg",
      "details": "21.10.2025 (Bekanntmachungsdatum)\n\nBayern Amtsgericht Aschaffenburg HRB 18022\nRegisterbekanntmachung nach dem Umwandlungsgesetz 20.10.2025 (Eintragungsdatum)\n\nNTB Digital Solutions GmbH\nGesellschaft mit beschränkter Haftung\nAschaffenburg\n\nDen Gläubigern der an der Ausgliederung beteiligten Rechtsträger ist, wenn sie binnen sechs Monaten nach dem Tag, an dem die Eintragung der Ausgliederung in das Register des Sitzes desjenigen Rechtsträgers, dessen Gläubiger sie sind, nach §§ 125, 19 Abs. 3 UmwG als bekannt gemacht gilt, ihren Anspruch nach Grund und Höhe in Textform anmelden, Sicherheit zu leisten, soweit sie nicht Befriedigung verlangen können. Dieses Recht steht den Gläubigern jedoch nur zu, wenn sie glaubhaft machen, dass durch die Ausgliederung die Erfüllung ihrer Forderung gefährdet wird."
    },
    {
      "date": "2025-10-21",
      "id": "134661",
      "original_text": "Löschungsankündigung\nBayern Amtsgericht München HRB 263746\nLENCOR BAU GmbH – München",
      "type": "Löschungsankündigung",
      "state": "Bayern",
      "amtsgericht": "Amtsgericht München",
      "registernummer": "HRB 263746",
      "registerart": "HRB",
      "company_name": "LENCOR BAU GmbH",
      "company_seat": "München",
      "details": "21.10.2025 (Bekanntmachungsdatum)\n\nBayern Amtsgericht München HRB 263746\nLöschungsankündigung 20.10.2025 (Eintragungsdatum)\n\nLENCOR BAU GmbH\nGesellschaft mit beschränkter Haftung\nMünchen\n\nDas Registergericht beabsichtigt, die im Handelsregister eingetragene Gesellschaft wegen Vermögenslosigkeit von Amts wegen nach § 394 FamFG zu löschen. Die Frist zur Erhebung eines Widerspruchs ist auf drei Monate festgesetzt."
    },
    {
      "date": "2025-10-21",
      "id": "134662",
      "original_text": "Löschungsankündigung\nBayern Amtsgericht Traunstein GnR 294\nHealth care solutions & family eG – Trostberg",
      "type": "Löschungsankündigung",
      "state": "Bayern",
      "amtsgericht": "Amtsgericht Traunstein",
      "registernummer": "GnR 294",
      "registerart": "GnR",
      "company_name": "Health care solutions & family eG",
      "company_seat": "Trostberg",
      "details": "21.10.2025 (Bekanntmachungsdatum)\n\nBayern Amtsgericht Traunstein GnR 294\nLöschungsankündigung\n\nHealth care solutions & family eG\neingetragene Genossenschaft\nTrostberg\n\nDas Registergericht beabsichtigt, die im Genossenschaftsregister eingetragene Genossenschaft wegen Vermögenslosigkeit auf Antrag der Genossenschaft nach § 394 FamFG zu löschen. Die Frist zur Erhebung eines Widerspruchs ist auf 2 Monate festgesetzt."
    },
    {
      "date": "2025-10-21",
      "id": "134663",
      "original_text": "Registerbekanntmachung nach dem Umwandlungsgesetz\nBayern Amtsgericht Aschaffenburg HRA 6742\nNils Becker e.K. – Aschaffenburg",
      "type": "Registerbekanntmachung nach dem Umwandlungsgesetz",
      "state": "Bayern",
      "amtsgericht": "Amtsgericht Aschaffenburg",
      "registernummer": "HRA 6742",
      "registerart": "HRA",
      "company_name": "Nils Becker e.K.",
      "company_seat": "Aschaffenburg",
      "details": "21.10.2025 (Bekanntmachungsdatum)\n\nBayern Amtsgericht Aschaffenburg HRA 6742\nRegisterbekanntmachung nach dem Umwandlungsgesetz 20.10.2025 (Eintragungsdatum)\n\nNils Becker e.K.\nEinzelkaufmann / Einzelkauffrau\nAschaffenburg\n\nDen Gläubigern der an der Ausgliederung beteiligten Rechtsträger ist, wenn sie binnen sechs Monaten nach dem Tag, an dem die Eintragung der Ausgliederung in das Register des Sitzes desjenigen Rechtsträgers, dessen Gläubiger sie sind, nach §§ 125, 19 Abs. 3 UmwG als bekannt gemacht gilt, ihren Anspruch nach Grund und Höhe in Textform anmelden, Sicherheit zu leisten, soweit sie nicht Befriedigung verlangen können. Dieses Recht steht den Gläubigern jedoch nur zu, wenn sie glaubhaft machen, dass durch die Ausgliederung die Erfüllung ihrer Forderung gefährdet wird."
    },
    {
      "date": "2025-10-21",
      "id": "134664",
      "original_text": "Registerbekanntmachung nach dem Umwandlungsgesetz\nBayern Amtsgericht Deggendorf GsR 102\nFlorian Stoiber und Silvia Stoiber Hackschnitzlerei eGbR – Oberpöring",
      "type": "Registerbekanntmachung nach dem Umwandlungsgesetz",
      "state": "Bayern",
      "amtsgericht": "Amtsgericht Deggendorf",
      "registernummer": "GsR 102",
      "registerart": "GsR",
      "company_name": "Florian Stoiber und Silvia Stoiber Hackschnitzlerei eGbR",
      "company_seat": "Oberpöring",
      "details": "21.10.2025 (Bekanntmachungsdatum)\n\nBayern Amtsgericht Deggendorf GsR 102\nRegisterbekanntmachung nach dem Umwandlungsgesetz 20.10.2025 (Eintragungsdatum)\n\nFlorian Stoiber und Silvia Stoiber Hackschnitzlerei eGbR\nGesellschaft bürgerlichen Rechts\nOberpöring\n\nDen Gläubigern des formwechselnden Rechtsträgers ist, wenn sie binnen sechs Monaten nach dem Tag, an dem die Eintragung des Formwechsels nach § 201 UmwG als bekannt gemacht gilt, ihren Anspruch nach Grund und Höhe in Textform anmelden, Sicherheit zu leisten, soweit sie nicht Befriedigung verlangen können. Dieses Recht steht den Gläubigern jedoch nur zu, wenn sie glaubhaft machen, dass durch den Formwechsel die Erfüllung ihrer Forderung gefährdet wird."
    },
    {
      "date": "2025-10-21",
      "id": "134665",
      "original_text": "Registerbekanntmachung nach dem Umwandlungsgesetz\nBayern Amtsgericht Fürth HRB 19066\nTriathlon Trainings GmbH – Fürth",
      "type": "Registerbekanntmachung nach dem Umwandlungsgesetz",
      "state": "Bayern",
      "amtsgericht": "Amtsgericht Fürth",
      "registernummer": "HRB 19066",
      "registerart": "HRB",
      "company_name": "Triathlon Trainings GmbH",
      "company_seat": "Fürth",
      "details": "21.10.2025 (Bekanntmachungsdatum)\n\nBayern Amtsgericht Fürth HRB 19066\nRegisterbekanntmachung nach dem Umwandlungsgesetz 20.10.2025 (Eintragungsdatum)\n\nTriathlon Trainings GmbH\nGesellschaft mit beschränkter Haftung\nFürth\n\nDen Gläubigern der an der Verschmelzung beteiligten Rechtsträger ist, wenn sie binnen sechs Monaten nach dem Tag, an dem die Eintragung der Verschmelzung in das Register des Sitzes desjenigen Rechtsträgers, dessen Gläubiger sie sind, nach § 19 Abs. 3 UmwG als bekannt gemacht gilt, ihren Anspruch nach Grund und Höhe in Textform anmelden, Sicherheit zu leisten, soweit sie nicht Befriedigung verlangen können. Dieses Recht steht den Gläubigern jedoch nur zu, wenn sie glaubhaft machen, dass durch die Verschmelzung die Erfüllung ihrer Forderung gefährdet wird."
    },
    {
      "date": "2025-10-21",
      "id": "134666",
      "original_text": "Registerbekanntmachung nach dem Umwandlungsgesetz\nBayern Amtsgericht Fürth HRA 12630\nS&P Stadtbau Projekt 7 GmbH & Co. KG – Erlangen",
      "type": "Registerbekanntmachung nach dem Umwandlungsgesetz",
      "state": "Bayern",
      "amtsgericht": "Amtsgericht Fürth",
      "registernummer": "HRA 12630",
      "registerart": "HRA",
      "company_name": "S&P Stadtbau Projekt 7 GmbH & Co. KG",
      "company_seat": "Erlangen",
      "details": "21.10.2025 (Bekanntmachungsdatum)\n\nBayern Amtsgericht Fürth HRA 12630\nRegisterbekanntmachung nach dem Umwandlungsgesetz 20.10.2025 (Eintragungsdatum)\n\nS&P Stadtbau Projekt 7 GmbH & Co. KG\nKommanditgesellschaft\nErlangen\n\nDen Gläubigern des formwechselnden Rechtsträgers ist, wenn sie binnen sechs Monaten nach dem Tag, an dem die Eintragung des Formwechsels nach § 201 UmwG als bekannt gemacht gilt, ihren Anspruch nach Grund und Höhe in Textform anmelden, Sicherheit zu leisten, soweit sie nicht Befriedigung verlangen können. Dieses Recht steht den Gläubigern jedoch nur zu, wenn sie glaubhaft machen, dass durch den Formwechsel die Erfüllung ihrer Forderung gefährdet wird."
    },
    {
      "date": "2025-10-21",
      "id": "134667",
      "original_text": "Registerbekanntmachung nach dem Umwandlungsgesetz\nBayern Amtsgericht München HRB 280099\nCuprum Wire Holding GmbH – München",
      "type": "Registerbekanntmachung nach dem Umwandlungsgesetz",
      "state": "Bayern",
      "amtsgericht": "Amtsgericht München",
      "registernummer": "HRB 280099",
      "registerart": "HRB",
      "company_name": "Cuprum Wire Holding GmbH",
      "company_seat": "München",
      "details": "21.10.2025 (Bekanntmachungsdatum)\n\nBayern Amtsgericht München HRB 280099\nRegisterbekanntmachung nach dem Umwandlungsgesetz 20.10.2025 (Eintragungsdatum)\n\nCuprum Wire Holding GmbH\nGesellschaft mit beschränkter Haftung\nMünchen\n\nDen Gläubigern der an der Verschmelzung beteiligten Rechtsträger ist, wenn sie binnen sechs Monaten nach dem Tag, an dem die Eintragung der Verschmelzung in das Register des Sitzes desjenigen Rechtsträgers, dessen Gläubiger sie sind, nach § 19 Abs. 3 UmwG als bekannt gemacht gilt, ihren Anspruch nach Grund und Höhe in Textform anmelden, Sicherheit zu leisten, soweit sie nicht Befriedigung verlangen können. Dieses Recht steht den Gläubigern jedoch nur zu, wenn sie glaubhaft machen, dass durch die Verschmelzung die Erfüllung ihrer Forderung gefährdet wird."
    },
    {
      "date": "2025-10-21",
      "id": "134668",
      "original_text": "Löschungsankündigung\nBerlin Amtsgericht Berlin (Charlottenburg) HRB 141279\nTeam 44 GmbH – Berlin",
      "type": "Löschungsankündigung",
      "state": "Berlin",
      "amtsgericht": "Amtsgericht Berlin (Charlottenburg)",
      "registernummer": "HRB 141279",
      "registerart": "HRB",
      "company_name": "Team 44 GmbH",
      "company_seat": "Berlin",
      "details": "21.10.2025 (Bekanntmachungsdatum)\n\nBerlin Amtsgericht Berlin (Charlottenburg) HRB 141279\nLöschungsankündigung\n\nTeam 44 GmbH\nGesellschaft mit beschränkter Haftung\nBerlin\n\nEs ist beabsichtigt, die Eintragung des Geschäftsführers Herrn Andreas Stefan Müller wegen Mangels einer wesentlichen Voraussetzung gemäß § 395 FamFG von Amts wegen zu löschen. Widerspruchsfrist: 4 Wochen."
    },
    {
      "date": "2025-10-21",
      "id": "134669",
      "original_text": "Löschungsankündigung\nBerlin Amtsgericht Berlin (Charlottenburg) HRB 148261\nLangner Vermögensverwaltung GmbH – Berlin",
      "type": "Löschungsankündigung",
      "state": "Berlin",
      "amtsgericht": "Amtsgericht Berlin (Charlottenburg)",
      "registernummer": "HRB 148261",
      "registerart": "HRB",
      "company_name": "Langner Vermögensverwaltung GmbH",
      "company_seat": "Berlin",
      "details": "21.10.2025 (Bekanntmachungsdatum)\n\nBerlin Amtsgericht Berlin (Charlottenburg) HRB 148261\nLöschungsankündigung\n\nLangner Vermögensverwaltung GmbH\nGesellschaft mit beschränkter Haftung\nBerlin\n\nBei der nachstehenden Gesellschaft wird das Amtslöschungsverfahren gemäß § 394 FamFG eingeleitet. Widerspruchsfrist: 6 Wochen."
    },
    {
      "date": "2025-10-21",
      "id": "134670",
      "original_text": "Löschungsankündigung\nBerlin Amtsgericht Berlin (Charlottenburg) HRB 206273\nProjekta GmbH – Berlin",
      "type": "Löschungsankündigung",
      "state": "Berlin",
      "amtsgericht": "Amtsgericht Berlin (Charlottenburg)",
      "registernummer": "HRB 206273",
      "registerart": "HRB",
      "company_name": "Projekta GmbH",
      "company_seat": "Berlin",
      "details": "21.10.2025 (Bekanntmachungsdatum)\n\nBerlin Amtsgericht Berlin (Charlottenburg) HRB 206273\nLöschungsankündigung\n\nProjekta GmbH\nGesellschaft mit beschränkter Haftung\nBerlin\n\nBei der nachstehenden Gesellschaft wird das Amtslöschungsverfahren gemäß § 394 FamFG eingeleitet. Widerspruchsfrist: 6 Wochen."
    },
    {
      "date": "2025-10-21",
      "id": "134671",
      "original_text": "Löschungsankündigung\nBerlin Amtsgericht Berlin (Charlottenburg) HRB 220276\nNisa Sen Gastro GmbH – Berlin",
      "type": "Löschungsankündigung",
      "state": "Berlin",
      "amtsgericht": "Amtsgericht Berlin (Charlottenburg)",
      "registernummer": "HRB 220276",
      "registerart": "HRB",
      "company_name": "Nisa Sen Gastro GmbH",
      "company_seat": "Berlin",
      "details": "21.10.2025 (Bekanntmachungsdatum)\n\nBerlin Amtsgericht Berlin (Charlottenburg) HRB 220276\nLöschungsankündigung\n\nNisa Sen Gastro GmbH\nGesellschaft mit beschränkter Haftung\nBerlin\n\nBei der nachstehenden Gesellschaft wird das Amtslöschungsverfahren gemäß § 394 FamFG eingeleitet. Widerspruchsfrist: 6 Wochen."
    },
    {
      "date": "2025-10-21",
      "id": "134672",
      "original_text": "Löschungsankündigung\nBrandenburg Amtsgericht Potsdam HRB 32464\nHJL Logistic GmbH – Potsdam",
      "type": "Löschungsankündigung",
      "state": "Brandenburg",
      "amtsgericht": "Amtsgericht Potsdam",
      "registernummer": "HRB 32464",
      "registerart": "HRB",
      "company_name": "HJL Logistic GmbH",
      "company_seat": "Potsdam",
      "details": "21.10.2025 (Bekanntmachungsdatum)\n\nBrandenburg Amtsgericht Potsdam HRB 32464\nLöschungsankündigung\n\nHJL Logistic GmbH\nGesellschaft mit beschränkter Haftung\nPotsdam\n\nBei der nachstehenden Gesellschaft wird das Amtslöschungsverfahren gemäß § 394 FamFG eingeleitet. Widerspruchsfrist 8 Wochen."
    },
    {
      "date": "2025-10-21",
      "id": "134673",
      "original_text": "Löschungsankündigung\nBaden-Württemberg Amtsgericht Stuttgart HRB 752135\nBelt Lift GmbH – Ludwigsburg",
      "type": "Löschungsankündigung",
      "state": "Baden-Württemberg",
      "amtsgericht": "Amtsgericht Stuttgart",
      "registernummer": "HRB 752135",
      "registerart": "HRB",
      "company_name": "Belt Lift GmbH",
      "company_seat": "Ludwigsburg",
      "details": "21.10.2025 (Bekanntmachungsdatum)\n\nBaden-Württemberg Amtsgericht Stuttgart HRB 752135\nLöschungsankündigung\n\nBelt Lift GmbH\nGesellschaft mit beschränkter Haftung\nLudwigsburg\n\nAls nicht eingetragen wird bekanntgemacht:\nDas Gericht beabsichtigt, die Gesellschaft wegen Vermögenslosigkeit im Handelsregister von Amts wegen nach § 394 FamFG zu löschen. Die Frist zur Geltendmachung eines Widerspruchs gegen die beabsichtigte Löschung ist auf zwei Monate ab Veröffentlichung bestimmt."
    },
    {
      "date": "2025-10-21",
      "id": "134674",
      "original_text": "Löschungsankündigung\nBrandenburg Amtsgericht Potsdam HRB 31694\nDIY SOLUTION GmbH – Teltow",
      "type": "Löschungsankündigung",
      "state": "Brandenburg",
      "amtsgericht": "Amtsgericht Potsdam",
      "registernummer": "HRB 31694",
      "registerart": "HRB",
      "company_name": "DIY SOLUTION GmbH",
      "company_seat": "Teltow",
      "details": "21.10.2025 (Bekanntmachungsdatum)\n\nBrandenburg Amtsgericht Potsdam HRB 31694\nLöschungsankündigung\n\nDIY SOLUTION GmbH\nGesellschaft mit beschränkter Haftung\nTeltow\n\nBei der nachstehenden Gesellschaft wird das Amtslöschungsverfahren gemäß § 394 FamFG eingeleitet. Widerspruchsfrist 8 Wochen."
    },
    {
      "date": "2025-10-21",
      "id": "134675",
      "original_text": "Registerbekanntmachung nach dem Umwandlungsgesetz\nSchleswig-Holstein Amtsgericht Lübeck HRB 12968\nHOP Flugcharter GmbH – Bad Schwartau",
      "type": "Registerbekanntmachung nach dem Umwandlungsgesetz",
      "state": "Schleswig-Holstein",
      "amtsgericht": "Amtsgericht Lübeck",
      "registernummer": "HRB 12968",
      "registerart": "HRB",
      "company_name": "HOP Flugcharter GmbH",
      "company_seat": "Bad Schwartau",
      "details": "21.10.2025 (Bekanntmachungsdatum)\n\nSchleswig-Holstein Amtsgericht Lübeck HRB 12968\nRegisterbekanntmachung nach dem Umwandlungsgesetz 20.10.2025 (Eintragungsdatum)\n\nHOP Flugcharter GmbH\nGesellschaft mit beschränkter Haftung\nBad Schwartau\n\nZu Eintragungsnummer 3 vom 20.10.2025 wird als nicht eingetragen veröffentlicht:\nDen Gläubigern der an der Verschmelzung beteiligten Rechtsträger ist, wenn sie binnen sechs Monaten nach dem Tag, an dem die Eintragung der Verschmelzung in das Register des Sitzes desjenigen Rechtsträgers, dessen Gläubiger sie sind, als bekannt gemacht gilt, ihren Anspruch nach Grund und Höhe schriftlich anmelden, Sicherheit zu leisten, soweit sie nicht Befriedigung verlangen können. Dieses Recht steht den Gläubigern jedoch nur zu, wenn sie glaubhaft machen, dass durch die Verschmelzung die Erfüllung ihrer Forderung gefährdet wird."
    },
    {
      "date": "2025-10-21",
      "id": "134676",
      "original_text": "Einreichung neuer Dokumente\nBaden-Württemberg Amtsgericht Mannheim HRB 341363\nMWCom-Communikations-AG – Sinsheim",
      "type": "Einreichung neuer Dokumente",
      "state": "Baden-Württemberg",
      "amtsgericht": "Amtsgericht Mannheim",
      "registernummer": "HRB 341363",
      "registerart": "HRB",
      "company_name": "MWCom-Communikations-AG",
      "company_seat": "Sinsheim",
      "details": "21.10.2025 (Bekanntmachungsdatum)\n\nBaden-Württemberg Amtsgericht Mannheim HRB 341363\nEinreichung neuer Dokumente 21.10.2025 (Eintragungsdatum)\n\nMWCom-Communikations-AG\nAktiengesellschaft\nSinsheim\n\nDie Gesellschaft hat am 16.10.2025 die Liste über die Zusammensetzung des Aufsichtsrats zum Handelsregister eingereicht."
    },
    {
      "date": "2025-10-21",
      "id": "134677",
      "original_text": "Löschungsankündigung\nBrandenburg Amtsgericht Potsdam HRB 35574\nTOBA Grundstücksvermittlungs GmbH – Zossen",
      "type": "Löschungsankündigung",
      "state": "Brandenburg",
      "amtsgericht": "Amtsgericht Potsdam",
      "registernummer": "HRB 35574",
      "registerart": "HRB",
      "company_name": "TOBA Grundstücksvermittlungs GmbH",
      "company_seat": "Zossen",
      "details": "21.10.2025 (Bekanntmachungsdatum)\n\nBrandenburg Amtsgericht Potsdam HRB 35574\nLöschungsankündigung\n\nTOBA Grundstücksvermittlungs GmbH\nGesellschaft mit beschränkter Haftung\nZossen\n\nBei der nachstehenden Gesellschaft wird das Amtslöschungsverfahren gemäß § 394 FamFG eingeleitet. Widerspruchsfrist 8 Wochen."
    },
    {
      "date": "2025-10-21",
      "id": "134678",
      "original_text": "Registerbekanntmachung nach dem Umwandlungsgesetz\nBaden-Württemberg Amtsgericht Mannheim HRB 755443\nmyschoolcare Baden-Württemberg GmbH – Mannheim",
      "type": "Registerbekanntmachung nach dem Umwandlungsgesetz",
      "state": "Baden-Württemberg",
      "amtsgericht": "Amtsgericht Mannheim",
      "registernummer": "HRB 755443",
      "registerart": "HRB",
      "company_name": "myschoolcare Baden-Württemberg GmbH",
      "company_seat": "Mannheim",
      "details": "21.10.2025 (Bekanntmachungsdatum)\n\nBaden-Württemberg Amtsgericht Mannheim HRB 755443\nRegisterbekanntmachung nach dem Umwandlungsgesetz 21.10.2025 (Eintragungsdatum)\n\nmyschoolcare Baden-Württemberg GmbH\nGesellschaft mit beschränkter Haftung\nMannheim\n\nDen Gläubigern der an der Aufspaltung beteiligten Rechtsträger ist, wenn sie binnen sechs Monaten nach dem Tag, an dem die Eintragung der Aufspaltung in das Register des Sitzes desjenigen Rechtsträgers, dessen Gläubiger sie sind, nach § 19 Abs. 3 UmwG als bekanntgemacht gilt, ihren Anspruch nach Grund und Höhe schriftlich anmelden, Sicherheit zu leisten, soweit sie nicht Befriedigung verlangen können. Dieses Recht steht den Gläubigern jedoch nur zu, wenn sie glaubhaft machen, dass durch die Aufspaltung die Erfüllung ihrer Forderung gefährdet wird."
    },
    {
      "date": "2025-10-21",
      "id": "134679",
      "original_text": "Registerbekanntmachung nach dem Umwandlungsgesetz\nBaden-Württemberg Amtsgericht Mannheim HRB 734231\nErnst Automobile Heidelberg Verwaltungsgesellschaft mbH – Mannheim",
      "type": "Registerbekanntmachung nach dem Umwandlungsgesetz",
      "state": "Baden-Württemberg",
      "amtsgericht": "Amtsgericht Mannheim",
      "registernummer": "HRB 734231",
      "registerart": "HRB",
      "company_name": "Ernst Automobile Heidelberg Verwaltungsgesellschaft mbH",
      "company_seat": "Mannheim",
      "details": "21.10.2025 (Bekanntmachungsdatum)\n\nBaden-Württemberg Amtsgericht Mannheim HRB 734231\nRegisterbekanntmachung nach dem Umwandlungsgesetz 21.10.2025 (Eintragungsdatum)\n\nErnst Automobile Heidelberg Verwaltungsgesellschaft mbH\nGesellschaft mit beschränkter Haftung\nMannheim\n\nAls nicht eingetragen wird bekanntgemacht:\nDen Gläubigern der an der Verschmelzung beteiligten Rechtsträger ist, wenn sie binnen sechs Monaten nach dem Tag, an dem die Eintragung der Verschmelzung in das Register des Sitzes desjenigen Rechtsträgers, dessen Gläubiger sie sind, nach § 19 Abs. 3 UmwG als bekanntgemacht gilt, ihren Anspruch nach Grund und Höhe schriftlich anmelden, Sicherheit zu leisten, soweit sie nicht Befriedigung verlangen können. Dieses Recht steht den Gläubigern jedoch nur zu, wenn sie glaubhaft machen, dass durch die Verschmelzung die Erfüllung ihrer Forderung gefährdet wird."
    },
    {
      "date": "2025-10-21",
      "id": "134680",
      "original_text": "Löschungsankündigung\nBaden-Württemberg Amtsgericht Stuttgart HRB 755692\nSilocon GmbH – Güglingen",
      "type": "Löschungsankündigung",
      "state": "Baden-Württemberg",
      "amtsgericht": "Amtsgericht Stuttgart",
      "registernummer": "HRB 755692",
      "registerart": "HRB",
      "company_name": "Silocon GmbH",
      "company_seat": "Güglingen",
      "details": "21.10.2025 (Bekanntmachungsdatum)\n\nBaden-Württemberg Amtsgericht Stuttgart HRB 755692\nLöschungsankündigung\n\nSilocon GmbH\nGesellschaft mit beschränkter Haftung\nGüglingen\n\nAls nicht eingetragen wird bekanntgemacht:\nDas Gericht beabsichtigt, die Gesellschaft wegen Vermögenslosigkeit im Handelsregister von Amts wegen nach § 394 FamFG zu löschen. Die Frist zur Geltendmachung eines Widerspruchs gegen die beabsichtigte Löschung ist auf zwei Monate ab Veröffentlichung bestimmt."
    },
    {
      "date": "2025-10-21",
      "id": "134681",
      "original_text": "Registerbekanntmachung nach dem Umwandlungsgesetz\nNordrhein-Westfalen Amtsgericht Coesfeld HRA 10209\nWerner Dehling GmbH & Co. KG – Reken",
      "type": "Registerbekanntmachung nach dem Umwandlungsgesetz",
      "state": "Nordrhein-Westfalen",
      "amtsgericht": "Amtsgericht Coesfeld",
      "registernummer": "HRA 10209",
      "registerart": "HRA",
      "company_name": "Werner Dehling GmbH & Co. KG",
      "company_seat": "Reken",
      "details": "21.10.2025 (Bekanntmachungsdatum)\n\nNordrhein-Westfalen Amtsgericht Coesfeld HRA 10209\nRegisterbekanntmachung nach dem Umwandlungsgesetz 21.10.2025 (Eintragungsdatum)\n\nWerner Dehling GmbH & Co. KG\nKommanditgesellschaft\nReken\n\nDen Gläubigern der an der Ausgliederung beteiligten Rechtsträger ist, wenn sie binnen sechs Monaten nach dem Tag, an dem die Eintragung der Ausgliederung in das Register des Sitzes derjenigen Rechtsträger deren Gläubiger sie sind, nach § 19 Absatz 3 UmwG als bekanntgemacht gilt, ihren Anspruch nach Grund und Höhe schriftlich anmelden, Sicherheit zu leisten, soweit sie nicht Befriedigung verlangen können. Dieses Recht steht den Gläubigern jedoch nur zu, wenn sie glaubhaft machen, dass durch die Ausgliederung die Erfüllung ihrer Forderung gefährdet wird."
    },
    {
      "date": "2025-10-21",
      "id": "134682",
      "original_text": "Löschungsankündigung\nSchleswig-Holstein Amtsgericht Lübeck HRB 23730\nEvents & More GmbH – Lübeck",
      "type": "Löschungsankündigung",
      "state": "Schleswig-Holstein",
      "amtsgericht": "Amtsgericht Lübeck",
      "registernummer": "HRB 23730",
      "registerart": "HRB",
      "company_name": "Events & More GmbH",
      "company_seat": "Lübeck",
      "details": "21.10.2025 (Bekanntmachungsdatum)\n\nSchleswig-Holstein Amtsgericht Lübeck HRB 23730\nLöschungsankündigung\n\nEvents & More GmbH\nGesellschaft mit beschränkter Haftung\nLübeck\n\nEs ist die Löschung der nachstehenden Gesellschaft wegen Vermögenslosigkeit gemäß § 394 FamFG beabsichtigt.\n\nWiderspruchsfrist: 3 Wochen"
    },
    {
      "date": "2025-10-21",
      "id": "134683",
      "original_text": "Registerbekanntmachung nach dem Umwandlungsgesetz\nBaden-Württemberg Amtsgericht Mannheim HRA 712851\nFrank Schuster Vermietungs UG (haftungsbeschränkt) & Co. KG – Mauer",
      "type": "Registerbekanntmachung nach dem Umwandlungsgesetz",
      "state": "Baden-Württemberg",
      "amtsgericht": "Amtsgericht Mannheim",
      "registernummer": "HRA 712851",
      "registerart": "HRA",
      "company_name": "Frank Schuster Vermietungs UG (haftungsbeschränkt) & Co. KG",
      "company_seat": "Mauer",
      "details": "21.10.2025 (Bekanntmachungsdatum)\n\nBaden-Württemberg Amtsgericht Mannheim HRA 712851\nRegisterbekanntmachung nach dem Umwandlungsgesetz 21.10.2025 (Eintragungsdatum)\n\nFrank Schuster Vermietungs UG (haftungsbeschränkt) & Co. KG\nKommanditgesellschaft\nMauer\n\nDen Gläubigern des an dem Formwechsel beteiligten Rechtsträgers ist, wenn sie binnen sechs Monaten nach dem Tag, an dem die Eintragung des Formwechsels in das Register des Sitzes desjenigen Rechtsträgers, dessen Gläubiger sie sind, nach § 19 Abs. 3 UmwG als bekanntgemacht gilt, ihren Anspruch nach Grund und Höhe schriftlich anmelden, Sicherheit zu leisten, soweit sie nicht Befriedigung verlangen können. Dieses Recht steht den Gläubigern jedoch nur zu, wenn sie glaubhaft machen, dass durch den Formwechsel die Erfüllung ihrer Forderung gefährdet wird."
    },
    {
      "date": "2025-10-21",
      "id": "134684",
      "original_text": "Registerbekanntmachung nach dem Umwandlungsgesetz\nBaden-Württemberg Amtsgericht Mannheim HRB 753086\nFrank Schuster Vermietungs UG (haftungsbeschränkt) – Mauer",
      "type": "Registerbekanntmachung nach dem Umwandlungsgesetz",
      "state": "Baden-Württemberg",
      "amtsgericht": "Amtsgericht Mannheim",
      "registernummer": "HRB 753086",
      "registerart": "HRB",
      "company_name": "Frank Schuster Vermietungs UG (haftungsbeschränkt)",
      "company_seat": "Mauer",
      "details": "21.10.2025 (Bekanntmachungsdatum)\n\nBaden-Württemberg Amtsgericht Mannheim HRB 753086\nRegisterbekanntmachung nach dem Umwandlungsgesetz 21.10.2025 (Eintragungsdatum)\n\nFrank Schuster Vermietungs UG (haftungsbeschränkt)\nGesellschaft mit beschränkter Haftung\nMauer\n\nAls nicht eingetragen wird bekanntgemacht:\nDen Gläubigern des an dem Formwechsel beteiligten Rechtsträgers ist, wenn sie binnen sechs Monaten nach dem Tag, an dem die Eintragung des Formwechsels in das Register des Sitzes desjenigen Rechtsträgers, dessen Gläubiger sie sind, nach § 19 Abs. 3 UmwG als bekanntgemacht gilt, ihren Anspruch nach Grund und Höhe schriftlich anmelden, Sicherheit zu leisten, soweit sie nicht Befriedigung verlangen können. Dieses Recht steht den Gläubigern jedoch nur zu, wenn sie glaubhaft machen, dass durch den Formwechsel die Erfüllung ihrer Forderung gefährdet wird."
    },
    {
      "date": "2025-10-21",
      "id": "134685",
      "original_text": "Registerbekanntmachung nach dem Umwandlungsgesetz\nBrandenburg Amtsgericht Cottbus HRB 15413\nPiwa GmbH – Schönefeld",
      "type": "Registerbekanntmachung nach dem Umwandlungsgesetz",
      "state": "Brandenburg",
      "amtsgericht": "Amtsgericht Cottbus",
      "registernummer": "HRB 15413",
      "registerart": "HRB",
      "company_name": "Piwa GmbH",
      "company_seat": "Schönefeld",
      "details": "21.10.2025 (Bekanntmachungsdatum)\n\nBrandenburg Amtsgericht Cottbus HRB 15413\nRegisterbekanntmachung nach dem Umwandlungsgesetz 20.10.2025 (Eintragungsdatum)\n\nPiwa GmbH\nGesellschaft mit beschränkter Haftung\nSchönefeld\n\nDen Gläubigern der an der Verschmelzung beteiligten Rechtsträger ist, wenn sie binnen sechs Monaten nach dem Tag, an dem die Eintragung der Verschmelzung in das Register des Sitzes desjenigen Rechtsträgers, dessen Gläubiger sie sind, als bekannt gemacht gilt, ihren Anspruch nach Grund und Höhe schriftlich anmelden, Sicherheit zu leisten, soweit sie nicht Befriedigung verlangen können. Dieses Recht steht den Gläubigern jedoch nur zu, wenn sie glaubhaft machen, dass durch die Verschmelzung die Erfüllung ihrer Forderung gefährdet wird"
    },
    {
      "date": "2025-10-21",
      "id": "134686",
      "original_text": "Registerbekanntmachung nach dem Umwandlungsgesetz\nBrandenburg Amtsgericht Cottbus HRB 16533\nUBH VEM GmbH – Schönefeld",
      "type": "Registerbekanntmachung nach dem Umwandlungsgesetz",
      "state": "Brandenburg",
      "amtsgericht": "Amtsgericht Cottbus",
      "registernummer": "HRB 16533",
      "registerart": "HRB",
      "company_name": "UBH VEM GmbH",
      "company_seat": "Schönefeld",
      "details": "21.10.2025 (Bekanntmachungsdatum)\n\nBrandenburg Amtsgericht Cottbus HRB 16533\nRegisterbekanntmachung nach dem Umwandlungsgesetz 20.10.2025 (Eintragungsdatum)\n\nUBH VEM GmbH\nGesellschaft mit beschränkter Haftung\nSchönefeld\n\nDen Gläubigern der an der Verschmelzung beteiligten Rechtsträger ist, wenn sie binnen sechs Monaten nach dem Tag, an dem die Eintragung der Verschmelzung in das Register des Sitzes desjenigen Rechtsträgers, dessen Gläubiger sie sind, als bekannt gemacht gilt, ihren Anspruch nach Grund und Höhe schriftlich anmelden, Sicherheit zu leisten, soweit sie nicht Befriedigung verlangen können. Dieses Recht steht den Gläubigern jedoch nur zu, wenn sie glaubhaft machen, dass durch die Verschmelzung die Erfüllung ihrer Forderung gefährdet wird"
    },
    {
      "date": "2025-10-21",
      "id": "134687",
      "original_text": "Einreichung neuer Dokumente\nSachsen-Anhalt Amtsgericht Stendal HRB 5828\nDEUREX AG – Elsteraue",
      "type": "Einreichung neuer Dokumente",
      "state": "Sachsen-Anhalt",
      "amtsgericht": "Amtsgericht Stendal",
      "registernummer": "HRB 5828",
      "registerart": "HRB",
      "company_name": "DEUREX AG",
      "company_seat": "Elsteraue",
      "details": "21.10.2025 (Bekanntmachungsdatum)\n\nSachsen-Anhalt Amtsgericht Stendal HRB 5828\nEinreichung neuer Dokumente\n\nDEUREX AG\nAktiengesellschaft\nElsteraue\n\nEine Liste der Mitglieder des Aufsichtsrates wurde zum Handelsregister eingereicht."
    },
    {
      "date": "2025-10-21",
      "id": "134688",
      "original_text": "Registerbekanntmachung nach dem Umwandlungsgesetz\nBaden-Württemberg Amtsgericht Freiburg HRA 708763\nSchäfer Energietechnik u. Sanitärinstallation e.K. – Königsfeld im Schwarzwald",
      "type": "Registerbekanntmachung nach dem Umwandlungsgesetz",
      "state": "Baden-Württemberg",
      "amtsgericht": "Amtsgericht Freiburg",
      "registernummer": "HRA 708763",
      "registerart": "HRA",
      "company_name": "Schäfer Energietechnik u. Sanitärinstallation e.K.",
      "company_seat": "Königsfeld im Schwarzwald",
      "details": "21.10.2025 (Bekanntmachungsdatum)\n\nBaden-Württemberg Amtsgericht Freiburg HRA 708763\nRegisterbekanntmachung nach dem Umwandlungsgesetz 21.10.2025 (Eintragungsdatum)\n\nSchäfer Energietechnik u. Sanitärinstallation e.K.\nEinzelkaufmann / Einzelkauffrau\nKönigsfeld im Schwarzwald\n\nAls nicht eingetragen wird bekanntgemacht:\nDen Gläubigern der an der Ausgliederung beteiligten Rechtsträger ist, wenn sie binnen sechs Monaten nach dem Tag, an dem die Eintragung der Ausgliederung in das Register des Sitzes desjenigen Rechtsträgers, dessen Gläubiger sie sind, nach § 19 Abs. 3 UmwG als bekanntgemacht gilt, ihren Anspruch nach Grund und Höhe schriftlich anmelden, Sicherheit zu leisten, soweit sie nicht Befriedigung verlangen können. Dieses Recht steht den Gläubigern jedoch nur zu, wenn sie glaubhaft machen, dass durch die Ausgliederung die Erfüllung ihrer Forderung gefährdet wird."
    },
    {
      "date": "2025-10-21",
      "id": "134689",
      "original_text": "Registerbekanntmachung nach dem Umwandlungsgesetz\nBaden-Württemberg Amtsgericht Freiburg HRB 733814\nSchäfer Energie- und Gebäudetechnik GmbH – Brigachtal",
      "type": "Registerbekanntmachung nach dem Umwandlungsgesetz",
      "state": "Baden-Württemberg",
      "amtsgericht": "Amtsgericht Freiburg",
      "registernummer": "HRB 733814",
      "registerart": "HRB",
      "company_name": "Schäfer Energie- und Gebäudetechnik GmbH",
      "company_seat": "Brigachtal",
      "details": "21.10.2025 (Bekanntmachungsdatum)\n\nBaden-Württemberg Amtsgericht Freiburg HRB 733814\nRegisterbekanntmachung nach dem Umwandlungsgesetz 21.10.2025 (Eintragungsdatum)\n\nSchäfer Energie- und Gebäudetechnik GmbH\nGesellschaft mit beschränkter Haftung\nBrigachtal\n\nAls nicht eingetragen wird bekanntgemacht:\nDen Gläubigern der an der Ausgliederung beteiligten Rechtsträger ist, wenn sie binnen sechs Monaten nach dem Tag, an dem die Eintragung der Ausgliederung in das Register des Sitzes desjenigen Rechtsträgers, dessen Gläubiger sie sind, nach § 19 Abs. 3 UmwG als bekanntgemacht gilt, ihren Anspruch nach Grund und Höhe schriftlich anmelden, Sicherheit zu leisten, soweit sie nicht Befriedigung verlangen können. Dieses Recht steht den Gläubigern jedoch nur zu, wenn sie glaubhaft machen, dass durch die Ausgliederung die Erfüllung ihrer Forderung gefährdet wird."
    },
    {
      "date": "2025-10-21",
      "id": "134690",
      "original_text": "Löschungsankündigung\nSchleswig-Holstein Amtsgericht Flensburg HRB 16008\nDIREKTSPEED UG (haftungsbeschränkt) – Flensburg",
      "type": "Löschungsankündigung",
      "state": "Schleswig-Holstein",
      "amtsgericht": "Amtsgericht Flensburg",
      "registernummer": "HRB 16008",
      "registerart": "HRB",
      "company_name": "DIREKTSPEED UG (haftungsbeschränkt)",
      "company_seat": "Flensburg",
      "details": "21.10.2025 (Bekanntmachungsdatum)\n\nSchleswig-Holstein Amtsgericht Flensburg HRB 16008\nLöschungsankündigung\n\nDIREKTSPEED UG (haftungsbeschränkt)\nGesellschaft mit beschränkter Haftung\nFlensburg\n\nEs ist die Löschung der nachstehenden Gesellschaft wegen Vermögenslosigkeit gemäß § 394 FamFG beabsichtigt.\nWiderspruchsfrist: 2 Monate."
    },
    {
      "date": "2025-10-21",
      "id": "134691",
      "original_text": "Einreichung neuer Dokumente\nBerlin Amtsgericht Berlin (Charlottenburg) HRB 216452\nmindsquare AG – Berlin",
      "type": "Einreichung neuer Dokumente",
      "state": "Berlin",
      "amtsgericht": "Amtsgericht Berlin (Charlottenburg)",
      "registernummer": "HRB 216452",
      "registerart": "HRB",
      "company_name": "mindsquare AG",
      "company_seat": "Berlin",
      "details": "21.10.2025 (Bekanntmachungsdatum)\n\nBerlin Amtsgericht Berlin (Charlottenburg) HRB 216452\nEinreichung neuer Dokumente\n\nmindsquare AG\nAktiengesellschaft\nBerlin\n\nAls nicht eingetragen wird veröffentlicht:Es wurde eine neue Liste der Aufsichtsratsmitglieder eingereicht (§ 106 AktG)."
    },
    {
      "date": "2025-10-21",
      "id": "134692",
      "original_text": "Löschungsankündigung\nBerlin Amtsgericht Berlin (Charlottenburg) HRB 124077\nSmart Mobile Factory GmbH – Berlin",
      "type": "Löschungsankündigung",
      "state": "Berlin",
      "amtsgericht": "Amtsgericht Berlin (Charlottenburg)",
      "registernummer": "HRB 124077",
      "registerart": "HRB",
      "company_name": "Smart Mobile Factory GmbH",
      "company_seat": "Berlin",
      "details": "21.10.2025 (Bekanntmachungsdatum)\n\nBerlin Amtsgericht Berlin (Charlottenburg) HRB 124077\nLöschungsankündigung\n\nSmart Mobile Factory GmbH\nGesellschaft mit beschränkter Haftung\nBerlin\n\nBei der nachstehenden Gesellschaft wird das Amtslöschungsverfahren gemäß § 394 FamFG eingeleitet. Widerspruchsfrist 6 Wochen"
    },
    {
      "date": "2025-10-21",
      "id": "134693",
      "original_text": "Löschungsankündigung\nBerlin Amtsgericht Berlin (Charlottenburg) HRB 168060\nFuks & Wagner GmbH – Berlin",
      "type": "Löschungsankündigung",
      "state": "Berlin",
      "amtsgericht": "Amtsgericht Berlin (Charlottenburg)",
      "registernummer": "HRB 168060",
      "registerart": "HRB",
      "company_name": "Fuks & Wagner GmbH",
      "company_seat": "Berlin",
      "details": "21.10.2025 (Bekanntmachungsdatum)\n\nBerlin Amtsgericht Berlin (Charlottenburg) HRB 168060\nLöschungsankündigung\n\nFuks & Wagner GmbH\nGesellschaft mit beschränkter Haftung\nBerlin\n\nBei der nachstehenden Gesellschaft wird das Amtslöschungsverfahren gemäß § 394 FamFG eingeleitet. Widerspruchsfrist 6 Wochen"
    },
    {
      "date": "2025-10-21",
      "id": "134695",
      "original_text": "Registerbekanntmachung nach dem Umwandlungsgesetz\nBaden-Württemberg Amtsgericht Freiburg HRB 716977\nFitnesspark Singen GmbH – Singen Hohentwiel",
      "type": "Registerbekanntmachung nach dem Umwandlungsgesetz",
      "state": "Baden-Württemberg",
      "amtsgericht": "Amtsgericht Freiburg",
      "registernummer": "HRB 716977",
      "registerart": "HRB",
      "company_name": "Fitnesspark Singen GmbH",
      "company_seat": "Singen Hohentwiel",
      "details": "21.10.2025 (Bekanntmachungsdatum)\n\nBaden-Württemberg Amtsgericht Freiburg HRB 716977\nRegisterbekanntmachung nach dem Umwandlungsgesetz 21.10.2025 (Eintragungsdatum)\n\nFitnesspark Singen GmbH\nGesellschaft mit beschränkter Haftung\nSingen Hohentwiel\n\nAls nicht eingetragen wird bekanntgemacht:\nDen Gläubigern der an der Verschmelzung beteiligten Rechtsträger ist, wenn sie binnen sechs Monaten nach dem Tag, an dem die Eintragung der Verschmelzung in das Register des Sitzes desjenigen Rechtsträgers, dessen Gläubiger sie sind, nach § 19 Abs. 3 UmwG als bekanntgemacht gilt, ihren Anspruch nach Grund und Höhe schriftlich anmelden, Sicherheit zu leisten, soweit sie nicht Befriedigung verlangen können. Dieses Recht steht den Gläubigern jedoch nur zu, wenn sie glaubhaft machen, dass durch die Verschmelzung die Erfüllung ihrer Forderung gefährdet wird."
    },
    {
      "date": "2025-10-21",
      "id": "134698",
      "original_text": "Einreichung neuer Dokumente\nBaden-Württemberg Amtsgericht Stuttgart HRB 240224\nWohnstätten Sindelfingen GmbH – Sindelfingen",
      "type": "Einreichung neuer Dokumente",
      "state": "Baden-Württemberg",
      "amtsgericht": "Amtsgericht Stuttgart",
      "registernummer": "HRB 240224",
      "registerart": "HRB",
      "company_name": "Wohnstätten Sindelfingen GmbH",
      "company_seat": "Sindelfingen",
      "details": "21.10.2025 (Bekanntmachungsdatum)\n\nBaden-Württemberg Amtsgericht Stuttgart HRB 240224\nEinreichung neuer Dokumente\n\nWohnstätten Sindelfingen GmbH\nGesellschaft mit beschränkter Haftung\nSindelfingen\n\nDie Gesellschaft hat am 20.10.2025 die Liste über die Zusammensetzung des Aufsichtsrats zum Handelsregister eingereicht."
    },
    {
      "date": "2025-10-21",
      "id": "134700",
      "original_text": "Löschungsankündigung\nBerlin Amtsgericht Berlin (Charlottenburg) HRB 200051\niSentinel GmbH – Berlin",
      "type": "Löschungsankündigung",
      "state": "Berlin",
      "amtsgericht": "Amtsgericht Berlin (Charlottenburg)",
      "registernummer": "HRB 200051",
      "registerart": "HRB",
      "company_name": "iSentinel GmbH",
      "company_seat": "Berlin",
      "details": "21.10.2025 (Bekanntmachungsdatum)\n\nBerlin Amtsgericht Berlin (Charlottenburg) HRB 200051\nLöschungsankündigung\n\niSentinel GmbH\nGesellschaft mit beschränkter Haftung\nBerlin\n\nBei der nachstehenden Gesellschaft wird das Amtslöschungsverfahren gemäß § 394 FamFG eingeleitet. Widerspruchsfrist 6 Wochen"
    },
    {
      "date": "2025-10-21",
      "id": "134702",
      "original_text": "Sonstige Registerbekanntmachung\nBerlin Amtsgericht Berlin (Charlottenburg) HRB 272639\nFeWo-Touristik GmbH – Berlin",
      "type": "Sonstige Registerbekanntmachung",
      "state": "Berlin",
      "amtsgericht": "Amtsgericht Berlin (Charlottenburg)",
      "registernummer": "HRB 272639",
      "registerart": "HRB",
      "company_name": "FeWo-Touristik GmbH",
      "company_seat": "Berlin",
      "details": "21.10.2025 (Bekanntmachungsdatum)\n\nBerlin Amtsgericht Berlin (Charlottenburg) HRB 272639\nSonstige Registerbekanntmachung\n\nFeWo-Touristik GmbH\nGesellschaft mit beschränkter Haftung\nBerlin\n\nAls nicht eingetragen wird veröffentlicht: Den Gläubigern der an der Verschmelzung beteiligten Rechtsträger ist, wenn sie binnen sechs Monaten nach dem Tag, an dem die Eintragung der Verschmelzung in das Register des Sitzes desjenigen Rechtsträgers, dessen Gläubiger sie sind, als bekannt gemacht gilt, ihren Anspruch nach Grund und Höhe schriftlich anmelden, Sicherheit zu leisten, soweit sie nicht Befriedigung verlangen können. Dieses Recht steht den Gläubigern jedoch nur zu, wenn sie glaubhaft machen, dass durch die Verschmelzung die Erfüllung ihrer Forderung gefährdet wird. Das Recht, Sicherheitsleistung zu verlangen, steht Gläubigern nicht zu, die im Falle der Insolvenz ein Recht auf vorzugsweise Befriedigung aus einer Deckungsmasse haben, die nach gesetzlicher Vorschrift zu ihrem Schutz errichtet und staatlich überwacht ist."
    },
    {
      "date": "2025-10-21",
      "id": "134704",
      "original_text": "Löschungsankündigung\nBerlin Amtsgericht Berlin (Charlottenburg) HRB 229046\nRenato Bau GmbH – Berlin",
      "type": "Löschungsankündigung",
      "state": "Berlin",
      "amtsgericht": "Amtsgericht Berlin (Charlottenburg)",
      "registernummer": "HRB 229046",
      "registerart": "HRB",
      "company_name": "Renato Bau GmbH",
      "company_seat": "Berlin",
      "details": "21.10.2025 (Bekanntmachungsdatum)\n\nBerlin Amtsgericht Berlin (Charlottenburg) HRB 229046\nLöschungsankündigung\n\nRenato Bau GmbH\nGesellschaft mit beschränkter Haftung\nBerlin\n\nBei der nachstehenden Gesellschaft wird das Amtslöschungsverfahren gemäß § 394 FamFG eingeleitet. Widerspruchsfrist 6 Wochen"
    },
    {
      "date": "2025-10-21",
      "id": "134705",
      "original_text": "Registerbekanntmachung nach dem Umwandlungsgesetz\nBaden-Württemberg Amtsgericht Mannheim HRB 743858\nPro Concept Immobilien-Betriebsgesellschaft mbH – Mannheim",
      "type": "Registerbekanntmachung nach dem Umwandlungsgesetz",
      "state": "Baden-Württemberg",
      "amtsgericht": "Amtsgericht Mannheim",
      "registernummer": "HRB 743858",
      "registerart": "HRB",
      "company_name": "Pro Concept Immobilien-Betriebsgesellschaft mbH",
      "company_seat": "Mannheim",
      "details": "21.10.2025 (Bekanntmachungsdatum)\n\nBaden-Württemberg Amtsgericht Mannheim HRB 743858\nRegisterbekanntmachung nach dem Umwandlungsgesetz 21.10.2025 (Eintragungsdatum)\n\nPro Concept Immobilien-Betriebsgesellschaft mbH\nGesellschaft mit beschränkter Haftung\nMannheim\n\nAls nicht eingetragen wird bekanntgemacht:Den Gläubigern der an der Verschmelzung beteiligten Rechtsträger ist, wenn sie binnen sechs Monaten nach dem Tag, an dem die Eintragung der Verschmelzung in das Register des Sitzes desjenigen Rechtsträgers, dessen Gläubiger sie sind, nach § 19 Abs. 3 UmwG als bekanntgemacht gilt, ihren Anspruch nach Grund und Höhe schriftlich anmelden, Sicherheit zu leisten, soweit sie nicht Befriedigung verlangen können. Dieses Recht steht den Gläubigern jedoch nur zu, wenn sie glaubhaft machen, dass durch die Verschmelzung die Erfüllung ihrer Forderung gefährdet wird."
    },
    {
      "date": "2025-10-21",
      "id": "134707",
      "original_text": "Sonstige Registerbekanntmachung\nBerlin Amtsgericht Berlin (Charlottenburg) HRB 166134\nPassion 4 Gästezimmer GmbH – Berlin",
      "type": "Sonstige Registerbekanntmachung",
      "state": "Berlin",
      "amtsgericht": "Amtsgericht Berlin (Charlottenburg)",
      "registernummer": "HRB 166134",
      "registerart": "HRB",
      "company_name": "Passion 4 Gästezimmer GmbH",
      "company_seat": "Berlin",
      "details": "21.10.2025 (Bekanntmachungsdatum)\n\nBerlin Amtsgericht Berlin (Charlottenburg) HRB 166134\nSonstige Registerbekanntmachung\n\nPassion 4 Gästezimmer GmbH\nGesellschaft mit beschränkter Haftung\nBerlin\n\nAls nicht eingetragen wird veröffentlicht: Den Gläubigern der an der Verschmelzung beteiligten Rechtsträger ist, wenn sie binnen sechs Monaten nach dem Tag, an dem die Eintragung der Verschmelzung in das Register des Sitzes desjenigen Rechtsträgers, dessen Gläubiger sie sind, als bekannt gemacht gilt, ihren Anspruch nach Grund und Höhe schriftlich anmelden, Sicherheit zu leisten, soweit sie nicht Befriedigung verlangen können. Dieses Recht steht den Gläubigern jedoch nur zu, wenn sie glaubhaft machen, dass durch die Verschmelzung die Erfüllung ihrer Forderung gefährdet wird. Das Recht, Sicherheitsleistung zu verlangen, steht Gläubigern nicht zu, die im Falle der Insolvenz ein Recht auf vorzugsweise Befriedigung aus einer Deckungsmasse haben, die nach gesetzlicher Vorschrift zu ihrem Schutz errichtet und staatlich überwacht ist."
    },
    {
      "date": "2025-10-21",
      "id": "134708",
      "original_text": "Löschungsankündigung\nBerlin Amtsgericht Berlin (Charlottenburg) HRB 175047\nRIEMEN GmbH – Berlin",
      "type": "Löschungsankündigung",
      "state": "Berlin",
      "amtsgericht": "Amtsgericht Berlin (Charlottenburg)",
      "registernummer": "HRB 175047",
      "registerart": "HRB",
      "company_name": "RIEMEN GmbH",
      "company_seat": "Berlin",
      "details": "21.10.2025 (Bekanntmachungsdatum)\n\nBerlin Amtsgericht Berlin (Charlottenburg) HRB 175047\nLöschungsankündigung\n\nRIEMEN GmbH\nGesellschaft mit beschränkter Haftung\nBerlin\n\nBei der nachstehenden Gesellschaft wird das Amtslöschungsverfahren gemäß § 394 FamFG eingeleitet. Widerspruchsfrist 6 Wochen"
    },
    {
      "date": "2025-10-21",
      "id": "134710",
      "original_text": "Registerbekanntmachung nach dem Umwandlungsgesetz\nThüringen Amtsgericht Jena HRA 507146\nGaststätte \"Zum Grünen Baum\", Inh. Marcel Lippold e. K. – Bodelwitz",
      "type": "Registerbekanntmachung nach dem Umwandlungsgesetz",
      "state": "Thüringen",
      "amtsgericht": "Amtsgericht Jena",
      "registernummer": "HRA 507146",
      "registerart": "HRA",
      "company_name": "Gaststätte \"Zum Grünen Baum\", Inh. Marcel Lippold e. K.",
      "company_seat": "Bodelwitz",
      "details": "21.10.2025 (Bekanntmachungsdatum)\n\nThüringen Amtsgericht Jena HRA 507146\nRegisterbekanntmachung nach dem Umwandlungsgesetz 21.10.2025 (Eintragungsdatum)\n\nGaststätte \"Zum Grünen Baum\", Inh. Marcel Lippold e. K.\nEinzelkaufmann / Einzelkauffrau\nBodelwitz\n\nNicht eingetragen: Den Gläubigern der an der Ausgliederung beteiligten Rechtsträger, ist wenn sie binnen sechs Monaten nach dem Tag, an dem die Eintragung der Ausgliederung in das Register des Sitzes desjenigen Rechtsträgers, dessen Gläubiger sie sind, nach §§125, 19 Abs. 3 UmwG als bekanntgemacht gilt, ihren Anspruch nach Grund und Höhe schriftlich anmelden, Sicherheit zu leisten, soweit sie nicht Befriedigung verlangen können. Dieses Recht steht ihnen jedoch nur zu, wenn sie glaubhaft machen, daß durch die Ausgliederung die Erfüllung ihrer Forderung gefährdet wird."
    },
    {
      "date": "2025-10-21",
      "id": "134711",
      "original_text": "Registerbekanntmachung nach dem Umwandlungsgesetz\nBaden-Württemberg Amtsgericht Mannheim HRA 712853\nMia Holding GmbH & Co. KG – Plankstadt",
      "type": "Registerbekanntmachung nach dem Umwandlungsgesetz",
      "state": "Baden-Württemberg",
      "amtsgericht": "Amtsgericht Mannheim",
      "registernummer": "HRA 712853",
      "registerart": "HRA",
      "company_name": "Mia Holding GmbH & Co. KG",
      "company_seat": "Plankstadt",
      "details": "21.10.2025 (Bekanntmachungsdatum)\n\nBaden-Württemberg Amtsgericht Mannheim HRA 712853\nRegisterbekanntmachung nach dem Umwandlungsgesetz 21.10.2025 (Eintragungsdatum)\n\nMia Holding GmbH & Co. KG\nKommanditgesellschaft\nPlankstadt\n\nDen Gläubigern des an dem Formwechsel beteiligten Rechtsträgers ist, wenn sie binnen sechs Monaten nach dem Tag, an dem die Eintragung des Formwechsels in das Register des Sitzes desjenigen Rechtsträgers, dessen Gläubiger sie sind, nach § 19 Abs. 3 UmwG als bekanntgemacht gilt, ihren Anspruch nach Grund und Höhe schriftlich anmelden, Sicherheit zu leisten, soweit sie nicht Befriedigung verlangen können. Dieses Recht steht den Gläubigern jedoch nur zu, wenn sie glaubhaft machen, dass durch den Formwechsel die Erfüllung ihrer Forderung gefährdet wird."
    },
    {
      "date": "2025-10-21",
      "id": "134712",
      "original_text": "Registerbekanntmachung nach dem Umwandlungsgesetz\nBaden-Württemberg Amtsgericht Mannheim HRB 744254\nMia Holding GmbH – Plankstadt",
      "type": "Registerbekanntmachung nach dem Umwandlungsgesetz",
      "state": "Baden-Württemberg",
      "amtsgericht": "Amtsgericht Mannheim",
      "registernummer": "HRB 744254",
      "registerart": "HRB",
      "company_name": "Mia Holding GmbH",
      "company_seat": "Plankstadt",
      "details": "21.10.2025 (Bekanntmachungsdatum)\n\nBaden-Württemberg Amtsgericht Mannheim HRB 744254\nRegisterbekanntmachung nach dem Umwandlungsgesetz 21.10.2025 (Eintragungsdatum)\n\nMia Holding GmbH\nGesellschaft mit beschränkter Haftung\nPlankstadt\n\nDen Gläubigern des an dem Formwechsel beteiligten Rechtsträgers ist, wenn sie binnen sechs Monaten nach dem Tag, an dem die Eintragung des Formwechsels in das Register des Sitzes desjenigen Rechtsträgers, dessen Gläubiger sie sind, nach § 19 Abs. 3 UmwG als bekanntgemacht gilt, ihren Anspruch nach Grund und Höhe schriftlich anmelden, Sicherheit zu leisten, soweit sie nicht Befriedigung verlangen können. Dieses Recht steht den Gläubigern jedoch nur zu, wenn sie glaubhaft machen, dass durch den Formwechsel die Erfüllung ihrer Forderung gefährdet wird."
    },
    {
      "date": "2025-10-21",
      "id": "134713",
      "original_text": "Einreichung neuer Dokumente\nBaden-Württemberg Amtsgericht Stuttgart HRB 766007\nSensoriens AG – Herrenberg",
      "type": "Einreichung neuer Dokumente",
      "state": "Baden-Württemberg",
      "amtsgericht": "Amtsgericht Stuttgart",
      "registernummer": "HRB 766007",
      "registerart": "HRB",
      "company_name": "Sensoriens AG",
      "company_seat": "Herrenberg",
      "details": "21.10.2025 (Bekanntmachungsdatum)\n\nBaden-Württemberg Amtsgericht Stuttgart HRB 766007\nEinreichung neuer Dokumente 21.10.2025 (Eintragungsdatum)\n\nSensoriens AG\nAktiengesellschaft\nHerrenberg\n\nDie Gesellschaft hat am 27.09.2024 die Liste über die Zusammensetzung des Aufsichtsrats zum Handelsregister eingereicht."
    },
    {
      "date": "2025-10-21",
      "id": "134714",
      "original_text": "Einreichung neuer Dokumente\nSachsen-Anhalt Amtsgericht Stendal HRB 23158\nStadtmarketinggesellschaft Dessau-Roßlau mbH – Dessau-Roßlau",
      "type": "Einreichung neuer Dokumente",
      "state": "Sachsen-Anhalt",
      "amtsgericht": "Amtsgericht Stendal",
      "registernummer": "HRB 23158",
      "registerart": "HRB",
      "company_name": "Stadtmarketinggesellschaft Dessau-Roßlau mbH",
      "company_seat": "Dessau-Roßlau",
      "details": "21.10.2025 (Bekanntmachungsdatum)\n\nSachsen-Anhalt Amtsgericht Stendal HRB 23158\nEinreichung neuer Dokumente 06.08.2025 (Eintragungsdatum)\n\nStadtmarketinggesellschaft Dessau-Roßlau mbH\nGesellschaft mit beschränkter Haftung\nDessau-Roßlau\n\nEine Liste der Mitglieder des Aufsichtsrates wurde zum Handelsregister eingereicht."
    },
    {
      "date": "2025-10-21",
      "id": "134715",
      "original_text": "Registerbekanntmachung nach dem Umwandlungsgesetz\nBaden-Württemberg Amtsgericht Stuttgart HRA 742098\nLidl 402 GmbH & Co. KG – Bad Wimpfen",
      "type": "Registerbekanntmachung nach dem Umwandlungsgesetz",
      "state": "Baden-Württemberg",
      "amtsgericht": "Amtsgericht Stuttgart",
      "registernummer": "HRA 742098",
      "registerart": "HRA",
      "company_name": "Lidl 402 GmbH & Co. KG",
      "company_seat": "Bad Wimpfen",
      "details": "21.10.2025 (Bekanntmachungsdatum)\n\nBaden-Württemberg Amtsgericht Stuttgart HRA 742098\nRegisterbekanntmachung nach dem Umwandlungsgesetz 21.10.2025 (Eintragungsdatum)\n\nLidl 402 GmbH & Co. KG\nKommanditgesellschaft\nBad Wimpfen\n\nAls nicht eingetragen wird bekanntgemacht:\nDen Gläubigern der an der Ausgliederung beteiligten Rechtsträger ist, wenn sie binnen sechs Monaten nach dem Tag, an dem die Eintragung der Ausgliederung in das Register des Sitzes desjenigen Rechtsträgers, dessen Gläubiger sie sind, nach § 19 Abs. 3 UmwG als bekanntgemacht gilt, ihren Anspruch nach Grund und Höhe schriftlich anmelden, Sicherheit zu leisten, soweit sie nicht Befriedigung verlangen können. Dieses Recht steht den Gläubigern jedoch nur zu, wenn sie glaubhaft machen, dass durch die Ausgliederung die Erfüllung ihrer Forderung gefährdet wird."
    },
    {
      "date": "2025-10-21",
      "id": "134716",
      "original_text": "Registerbekanntmachung nach dem Umwandlungsgesetz\nBerlin Amtsgericht Berlin (Charlottenburg) HRB 211494\nBJ Facility Management UG (haftungsbeschränkt) – Berlin",
      "type": "Registerbekanntmachung nach dem Umwandlungsgesetz",
      "state": "Berlin",
      "amtsgericht": "Amtsgericht Berlin (Charlottenburg)",
      "registernummer": "HRB 211494",
      "registerart": "HRB",
      "company_name": "BJ Facility Management UG (haftungsbeschränkt)",
      "company_seat": "Berlin",
      "details": "21.10.2025 (Bekanntmachungsdatum)\n\nBerlin Amtsgericht Berlin (Charlottenburg) HRB 211494\nRegisterbekanntmachung nach dem Umwandlungsgesetz 20.10.2025 (Eintragungsdatum)\n\nBJ Facility Management UG (haftungsbeschränkt)\nGesellschaft mit beschränkter Haftung\nBerlin\n\nZu Eintragungsnummer 2 vom 20.10.2025 wird als nicht eingetragen veröffentlicht: Den Gläubigern der an der Verschmelzung beteiligten Rechtsträger ist, wenn sie binnen sechs Monaten nach dem Tag, an dem die Eintragung der Verschmelzung in das Register des Sitzes desjenigen Rechtsträgers, dessen Gläubiger sie sind, als bekannt gemacht gilt, ihren Anspruch nach Grund und Höhe schriftlich anmelden, Sicherheit zu leisten, soweit sie nicht Befriedigung verlangen können. Dieses Recht steht den Gläubigern jedoch nur zu, wenn sie glaubhaft machen, dass durch die Verschmelzung die Erfüllung ihrer Forderung gefährdet wird. Das Recht, Sicherheitsleistung zu verlangen, steht Gläubigern nicht zu, die im Falle der Insolvenz ein Recht auf vorzugsweise Befriedigung aus einer Deckungsmasse haben, die nach gesetzlicher Vorschrift zu ihrem Schutz errichtet und staatlich überwacht ist."
    },
    {
      "date": "2025-10-21",
      "id": "134717",
      "original_text": "Registerbekanntmachung nach dem Umwandlungsgesetz\nBerlin Amtsgericht Berlin (Charlottenburg) HRA 64823\nBJ Gebäude Management Jacqueline Birke e. K. – Berlin",
      "type": "Registerbekanntmachung nach dem Umwandlungsgesetz",
      "state": "Berlin",
      "amtsgericht": "Amtsgericht Berlin (Charlottenburg)",
      "registernummer": "HRA 64823",
      "registerart": "HRA",
      "company_name": "BJ Gebäude Management Jacqueline Birke e. K.",
      "company_seat": "Berlin",
      "details": "21.10.2025 (Bekanntmachungsdatum)\n\nBerlin Amtsgericht Berlin (Charlottenburg) HRA 64823\nRegisterbekanntmachung nach dem Umwandlungsgesetz 20.10.2025 (Eintragungsdatum)\n\nBJ Gebäude Management Jacqueline Birke e. K.\nEinzelkaufmann / Einzelkauffrau\nBerlin\n\nZu Eintragungsnummer 1 vom 20.10.2025 wird als nicht eingetragen veröffentlicht: Den Gläubigern der an der Verschmelzung beteiligten Rechtsträger ist, wenn sie binnen sechs Monaten nach dem Tag, an dem die Eintragung der Verschmelzung in das Register des Sitzes desjenigen Rechtsträgers, dessen Gläubiger sie sind, als bekannt gemacht gilt, ihren Anspruch nach Grund und Höhe schriftlich anmelden, Sicherheit zu leisten, soweit sie nicht Befriedigung verlangen können. Dieses Recht steht den Gläubigern jedoch nur zu, wenn sie glaubhaft machen, dass durch die Verschmelzung die Erfüllung ihrer Forderung gefährdet wird. Das Recht, Sicherheitsleistung zu verlangen, steht Gläubigern nicht zu, die im Falle der Insolvenz ein Recht auf vorzugsweise Befriedigung aus einer Deckungsmasse haben, die nach gesetzlicher Vorschrift zu ihrem Schutz errichtet und staatlich überwacht ist."
    },
    {
      "date": "2025-10-21",
      "id": "134718",
      "original_text": "Löschungsankündigung\nBerlin Amtsgericht Berlin (Charlottenburg) HRB 211672\nBURG & Co. Immobilien Management AG – Berlin",
      "type": "Löschungsankündigung",
      "state": "Berlin",
      "amtsgericht": "Amtsgericht Berlin (Charlottenburg)",
      "registernummer": "HRB 211672",
      "registerart": "HRB",
      "company_name": "BURG & Co. Immobilien Management AG",
      "company_seat": "Berlin",
      "details": "21.10.2025 (Bekanntmachungsdatum)\n\nBerlin Amtsgericht Berlin (Charlottenburg) HRB 211672\nLöschungsankündigung\n\nBURG & Co. Immobilien Management AG\nAktiengesellschaft\nBerlin\n\nBei der nachstehenden Gesellschaft wird das Amtslöschungsverfahren gemäß § 394 FamFG eingeleitet. Widerspruchsfrist 6 Wochen"
    },
    {
      "date": "2025-10-21",
      "id": "134719",
      "original_text": "Löschungsankündigung\nBaden-Württemberg Amtsgericht Stuttgart HRB 752019\nJunior Fashion GmbH – Pliezhausen",
      "type": "Löschungsankündigung",
      "state": "Baden-Württemberg",
      "amtsgericht": "Amtsgericht Stuttgart",
      "registernummer": "HRB 752019",
      "registerart": "HRB",
      "company_name": "Junior Fashion GmbH",
      "company_seat": "Pliezhausen",
      "details": "21.10.2025 (Bekanntmachungsdatum)\n\nBaden-Württemberg Amtsgericht Stuttgart HRB 752019\nLöschungsankündigung\n\nJunior Fashion GmbH\nGesellschaft mit beschränkter Haftung\nPliezhausen\n\nDas Gericht beabsichtigt, die Gesellschaft wegen Vermögenslosigkeit im Handelsregister von Amts wegen nach § 394 FamFG zu löschen. Die Frist zur Geltendmachung eines Widerspruchs gegen die beabsichtigte Löschung ist auf zwei Monate ab Veröffentlichung bestimmt."
    },
    {
      "date": "2025-10-21",
      "id": "134720",
      "original_text": "Einreichung neuer Dokumente\nBaden-Württemberg Amtsgericht Stuttgart HRB 755683\nFenos AG – Neckarwestheim",
      "type": "Einreichung neuer Dokumente",
      "state": "Baden-Württemberg",
      "amtsgericht": "Amtsgericht Stuttgart",
      "registernummer": "HRB 755683",
      "registerart": "HRB",
      "company_name": "Fenos AG",
      "company_seat": "Neckarwestheim",
      "details": "21.10.2025 (Bekanntmachungsdatum)\n\nBaden-Württemberg Amtsgericht Stuttgart HRB 755683\nEinreichung neuer Dokumente 21.10.2025 (Eintragungsdatum)\n\nFenos AG\nAktiengesellschaft\nNeckarwestheim\n\nDie Gesellschaft hat am 15.10.2025 die Liste über die Zusammensetzung des Aufsichtsrats zum Handelsregister eingereicht."
    },
    {
      "date": "2025-10-21",
      "id": "134721",
      "original_text": "Registerbekanntmachung nach dem Umwandlungsgesetz\nSchleswig-Holstein Amtsgericht Lübeck HRB 12975\nSchwartau Food Ingredients GmbH – Bad Schwartau",
      "type": "Registerbekanntmachung nach dem Umwandlungsgesetz",
      "state": "Schleswig-Holstein",
      "amtsgericht": "Amtsgericht Lübeck",
      "registernummer": "HRB 12975",
      "registerart": "HRB",
      "company_name": "Schwartau Food Ingredients GmbH",
      "company_seat": "Bad Schwartau",
      "details": "21.10.2025 (Bekanntmachungsdatum)\n\nSchleswig-Holstein Amtsgericht Lübeck HRB 12975\nRegisterbekanntmachung nach dem Umwandlungsgesetz 20.10.2025 (Eintragungsdatum)\n\nSchwartau Food Ingredients GmbH\nGesellschaft mit beschränkter Haftung\nBad Schwartau\n\nZu Eintragungsnummer 5 vom 20.10.2025 wird als nicht eingetragen veröffentlicht: Den Gläubigern der an der Verschmelzung beteiligten Rechtsträger ist, wenn sie binnen sechs Monaten nach dem Tag, an dem die Eintragung der Verschmelzung in das Register des Sitzes desjenigen Rechtsträgers, dessen Gläubiger sie sind, als bekannt gemacht gilt, ihren Anspruch nach Grund und Höhe schriftlich anmelden, Sicherheit zu leisten, soweit sie nicht Befriedigung verlangen können. Dieses Recht steht den Gläubigern jedoch nur zu, wenn sie glaubhaft machen, dass durch die Verschmelzung die Erfüllung ihrer Forderung gefährdet wird."
    },
    {
      "date": "2025-10-21",
      "id": "134722",
      "original_text": "Registerbekanntmachung nach dem Umwandlungsgesetz\nSchleswig-Holstein Amtsgericht Lübeck HRB 12975\nSchwartau Food Ingredients GmbH – Bad Schwartau",
      "type": "Registerbekanntmachung nach dem Umwandlungsgesetz",
      "state": "Schleswig-Holstein",
      "amtsgericht": "Amtsgericht Lübeck",
      "registernummer": "HRB 12975",
      "registerart": "HRB",
      "company_name": "Schwartau Food Ingredients GmbH",
      "company_seat": "Bad Schwartau",
      "details": "21.10.2025 (Bekanntmachungsdatum)\n\nSchleswig-Holstein Amtsgericht Lübeck HRB 12975\nRegisterbekanntmachung nach dem Umwandlungsgesetz 20.10.2025 (Eintragungsdatum)\n\nSchwartau Food Ingredients GmbH\nGesellschaft mit beschränkter Haftung\nBad Schwartau\n\nZu Eintragungsnummer 6 vom 20.10.2025 wird als nicht eingetragen veröffentlicht: Den Gläubigern der an der Verschmelzung beteiligten Rechtsträger ist, wenn sie binnen sechs Monaten nach dem Tag, an dem die Eintragung der Verschmelzung in das Register des Sitzes desjenigen Rechtsträgers, dessen Gläubiger sie sind, als bekannt gemacht gilt, ihren Anspruch nach Grund und Höhe schriftlich anmelden, Sicherheit zu leisten, soweit sie nicht Befriedigung verlangen können. Dieses Recht steht den Gläubigern jedoch nur zu, wenn sie glaubhaft machen, dass durch die Verschmelzung die Erfüllung ihrer Forderung gefährdet wird."
    },
    {
      "date": "2025-10-21",
      "id": "134723",
      "original_text": "Registerbekanntmachung nach dem Umwandlungsgesetz\nBaden-Württemberg Amtsgericht Mannheim HRB 753034\nmarqon GmbH – Karlsruhe",
      "type": "Registerbekanntmachung nach dem Umwandlungsgesetz",
      "state": "Baden-Württemberg",
      "amtsgericht": "Amtsgericht Mannheim",
      "registernummer": "HRB 753034",
      "registerart": "HRB",
      "company_name": "marqon GmbH",
      "company_seat": "Karlsruhe",
      "details": "21.10.2025 (Bekanntmachungsdatum)\n\nBaden-Württemberg Amtsgericht Mannheim HRB 753034\nRegisterbekanntmachung nach dem Umwandlungsgesetz 21.10.2025 (Eintragungsdatum)\n\nmarqon GmbH\nGesellschaft mit beschränkter Haftung\nKarlsruhe\n\nDen Gläubigern der an der Ausgliederung beteiligten Rechtsträger ist, wenn sie binnen sechs Monaten nach dem Tag, an dem die Eintragung der Ausgliederung in das Register des Sitzes desjenigen Rechtsträgers, dessen Gläubiger sie sind, nach § 19 Abs. 3 UmwG als bekanntgemacht gilt, ihren Anspruch nach Grund und Höhe schriftlich anmelden, Sicherheit zu leisten, soweit sie nicht Befriedigung verlangen können. Dieses Recht steht den Gläubigern jedoch nur zu, wenn sie glaubhaft machen, dass durch die Ausgliederung die Erfüllung ihrer Forderung gefährdet wird."
    },
    {
      "date": "2025-10-21",
      "id": "134724",
      "original_text": "Registerbekanntmachung nach dem Umwandlungsgesetz\nBaden-Württemberg Amtsgericht Mannheim HRA 709905\nPB Produkte Beschriften e.K. – Karlsruhe",
      "type": "Registerbekanntmachung nach dem Umwandlungsgesetz",
      "state": "Baden-Württemberg",
      "amtsgericht": "Amtsgericht Mannheim",
      "registernummer": "HRA 709905",
      "registerart": "HRA",
      "company_name": "PB Produkte Beschriften e.K.",
      "company_seat": "Karlsruhe",
      "details": "21.10.2025 (Bekanntmachungsdatum)\n\nBaden-Württemberg Amtsgericht Mannheim HRA 709905\nRegisterbekanntmachung nach dem Umwandlungsgesetz 21.10.2025 (Eintragungsdatum)\n\nPB Produkte Beschriften e.K.\nEinzelkaufmann / Einzelkauffrau\nKarlsruhe\n\nAls nicht eingetragen wird bekanntgemacht:\nDen Gläubigern der an der Ausgliederung beteiligten Rechtsträger ist, wenn sie binnen sechs Monaten nach dem Tag, an dem die Eintragung der Ausgliederung in das Register des Sitzes desjenigen Rechtsträgers, dessen Gläubiger sie sind, nach § 19 Abs. 3 UmwG als bekanntgemacht gilt, ihren Anspruch nach Grund und Höhe schriftlich anmelden, Sicherheit zu leisten, soweit sie nicht Befriedigung verlangen können. Dieses Recht steht den Gläubigern jedoch nur zu, wenn sie glaubhaft machen, dass durch die Ausgliederung die Erfüllung ihrer Forderung gefährdet wird."
    },
    {
      "date": "2025-10-21",
      "id": "134725",
      "original_text": "Einreichung neuer Dokumente\nBaden-Württemberg Amtsgericht Mannheim HRB 741455\ntrans-o-flex Express GmbH & Co. KGaA – Weinheim",
      "type": "Einreichung neuer Dokumente",
      "state": "Baden-Württemberg",
      "amtsgericht": "Amtsgericht Mannheim",
      "registernummer": "HRB 741455",
      "registerart": "HRB",
      "company_name": "trans-o-flex Express GmbH & Co. KGaA",
      "company_seat": "Weinheim",
      "details": "21.10.2025 (Bekanntmachungsdatum)\n\nBaden-Württemberg Amtsgericht Mannheim HRB 741455\nEinreichung neuer Dokumente 21.10.2025 (Eintragungsdatum)\n\ntrans-o-flex Express GmbH & Co. KGaA\nKommanditgesellschaft auf Aktien\nWeinheim\n\nAm 20.10.2025 hat die Gesellschaft das Hauptversammlungsprotokoll vom 09.10.2025 hier eingereicht."
    },
    {
      "date": "2025-10-21",
      "id": "134726",
      "original_text": "Registerbekanntmachung nach dem Umwandlungsgesetz\nSchleswig-Holstein Amtsgericht Lübeck HRB 21286\nHansa Nußspezialitäten GmbH – Bad Schwartau",
      "type": "Registerbekanntmachung nach dem Umwandlungsgesetz",
      "state": "Schleswig-Holstein",
      "amtsgericht": "Amtsgericht Lübeck",
      "registernummer": "HRB 21286",
      "registerart": "HRB",
      "company_name": "Hansa Nußspezialitäten GmbH",
      "company_seat": "Bad Schwartau",
      "details": "21.10.2025 (Bekanntmachungsdatum)\n\nSchleswig-Holstein Amtsgericht Lübeck HRB 21286\nRegisterbekanntmachung nach dem Umwandlungsgesetz 20.10.2025 (Eintragungsdatum)\n\nHansa Nußspezialitäten GmbH\nGesellschaft mit beschränkter Haftung\nBad Schwartau\n\nZu Eintragungsnummer 2 vom 20.10.2025 wird als nicht eingetragen veröffentlicht: Den Gläubigern der an der Verschmelzung beteiligten Rechtsträger ist, wenn sie binnen sechs Monaten nach dem Tag, an dem die Eintragung der Verschmelzung in das Register des Sitzes desjenigen Rechtsträgers, dessen Gläubiger sie sind, als bekannt gemacht gilt, ihren Anspruch nach Grund und Höhe schriftlich anmelden, Sicherheit zu leisten, soweit sie nicht Befriedigung verlangen können. Dieses Recht steht den Gläubigern jedoch nur zu, wenn sie glaubhaft machen, dass durch die Verschmelzung die Erfüllung ihrer Forderung gefährdet wird."
    },
    {
      "date": "2025-10-21",
      "id": "134727",
      "original_text": "Registerbekanntmachung nach dem Umwandlungsgesetz\nBaden-Württemberg Amtsgericht Mannheim HRB 756043\nAnexia Digital Engineering GmbH – Karlsruhe",
      "type": "Registerbekanntmachung nach dem Umwandlungsgesetz",
      "state": "Baden-Württemberg",
      "amtsgericht": "Amtsgericht Mannheim",
      "registernummer": "HRB 756043",
      "registerart": "HRB",
      "company_name": "Anexia Digital Engineering GmbH",
      "company_seat": "Karlsruhe",
      "details": "21.10.2025 (Bekanntmachungsdatum)\n\nBaden-Württemberg Amtsgericht Mannheim HRB 756043\nRegisterbekanntmachung nach dem Umwandlungsgesetz 21.10.2025 (Eintragungsdatum)\n\nAnexia Digital Engineering GmbH\nGesellschaft mit beschränkter Haftung\nKarlsruhe\n\nDen Gläubigern der an der Abspaltung beteiligten Rechtsträger ist, wenn sie binnen sechs Monaten nach dem Tag, an dem die Eintragung der Abspaltung in das Register des Sitzes desjenigen Rechtsträgers, dessen Gläubiger sie sind, nach § 19 Abs. 3 UmwG als bekanntgemacht gilt, ihren Anspruch nach Grund und Höhe schriftlich anmelden, Sicherheit zu leisten, soweit sie nicht Befriedigung verlangen können. Dieses Recht steht den Gläubigern jedoch nur zu, wenn sie glaubhaft machen, dass durch die Abspaltung die Erfüllung ihrer Forderung gefährdet wird."
    },
    {
      "date": "2025-10-21",
      "id": "134728",
      "original_text": "Registerbekanntmachung nach dem Umwandlungsgesetz\nBaden-Württemberg Amtsgericht Mannheim HRB 745484\nANEXIA Deutschland GmbH – Karlsruhe",
      "type": "Registerbekanntmachung nach dem Umwandlungsgesetz",
      "state": "Baden-Württemberg",
      "amtsgericht": "Amtsgericht Mannheim",
      "registernummer": "HRB 745484",
      "registerart": "HRB",
      "company_name": "ANEXIA Deutschland GmbH",
      "company_seat": "Karlsruhe",
      "details": "21.10.2025 (Bekanntmachungsdatum)\n\nBaden-Württemberg Amtsgericht Mannheim HRB 745484\nRegisterbekanntmachung nach dem Umwandlungsgesetz 21.10.2025 (Eintragungsdatum)\n\nANEXIA Deutschland GmbH\nGesellschaft mit beschränkter Haftung\nKarlsruhe\n\nDen Gläubigern der an der grenzüberschreitenden Abspaltung beteiligten übernehmenden Rechtsträger ist, wenn sie binnen sechs Monaten nach dem Tag, an dem die Eintragung der Spaltung in das Register des Sitzes desjenigen Rechtsträgers, dessen Gläubiger sie sind, nach § 19 Absatz 3 UmwG als bekanntgemacht gilt, ihren Anspruch nach Grund und Höhe schriftlich anmelden, Sicherheit zu leisten, soweit sie nicht Befriedigung verlangen können.\nDieses Recht steht den Gläubigern jedoch nur zu, wenn sie glaubhaft machen, dass durch die Spaltung die Erfüllung ihrer Forderung gefährdet wird."
    },
    {
      "date": "2025-10-21",
      "id": "134729",
      "original_text": "Registerbekanntmachung nach dem Umwandlungsgesetz\nHamburg Amtsgericht Hamburg HRB 96117\nZweite Verwaltungsgesellschaft Maritim Invest mbH – Hamburg",
      "type": "Registerbekanntmachung nach dem Umwandlungsgesetz",
      "state": "Hamburg",
      "amtsgericht": "Amtsgericht Hamburg",
      "registernummer": "HRB 96117",
      "registerart": "HRB",
      "company_name": "Zweite Verwaltungsgesellschaft Maritim Invest mbH",
      "company_seat": "Hamburg",
      "details": "21.10.2025 (Bekanntmachungsdatum)\n\nHamburg Amtsgericht Hamburg HRB 96117\nRegisterbekanntmachung nach dem Umwandlungsgesetz 21.10.2025 (Eintragungsdatum)\n\nZweite Verwaltungsgesellschaft Maritim Invest mbH\nGesellschaft mit beschränkter Haftung\nHamburg\n\nAls nicht eingetragen wird bekannt gemacht:\nDen Gläubigern der an der Verschmelzung beteiligten Gesellschaften ist, wenn sie binnen sechs Monaten nach dem Tag, an dem die Eintragung der Verschmelzung in das Register des Sitzes desjenigen Rechtsträgers, dessen Gläubiger sie sind, nach § 19 Absatz 3 UmwG als bekannt gemacht gilt, ihren Anspruch nach Grund und Höhe schriftlich anmelden, Sicherheit zu leisten, soweit sie nicht Befriedigung verlangen können. Dieses Recht steht den Gläubigern jedoch nur zu, wenn sie glaubhaft machen, dass durch die Verschmelzung die Erfüllung ihrer Forderung gefährdet wird."
    },
    {
      "date": "2025-10-21",
      "id": "134730",
      "original_text": "Registerbekanntmachung nach dem Umwandlungsgesetz\nHamburg Amtsgericht Hamburg HRB 97976\nRIZ Real Invest GmbH – Hamburg",
      "type": "Registerbekanntmachung nach dem Umwandlungsgesetz",
      "state": "Hamburg",
      "amtsgericht": "Amtsgericht Hamburg",
      "registernummer": "HRB 97976",
      "registerart": "HRB",
      "company_name": "RIZ Real Invest GmbH",
      "company_seat": "Hamburg",
      "details": "21.10.2025 (Bekanntmachungsdatum)\n\nHamburg Amtsgericht Hamburg HRB 97976\nRegisterbekanntmachung nach dem Umwandlungsgesetz 21.10.2025 (Eintragungsdatum)\n\nRIZ Real Invest GmbH\nGesellschaft mit beschränkter Haftung\nHamburg\n\nAls nicht eingetragen wird bekannt gemacht:\nDen Gläubigern der an der Verschmelzung beteiligten Gesellschaften ist, wenn sie binnen sechs Monaten nach dem Tag, an dem die Eintragung der Verschmelzung in das Register des Sitzes derjenigen Rechtsträger deren Gläubiger sie sind, nach § 19 Absatz 3 UmwG als bekannt gemacht gilt, ihren Anspruch nach Grund und Höhe schriftlich anmelden, Sicherheit zu leisten, soweit sie nicht Befriedigung verlangen können. Dieses Recht steht den Gläubigern jedoch nur zu, wenn sie glaubhaft machen, dass durch die Verschmelzung die Erfüllung ihrer Forderung gefährdet wird."
    },
    {
      "date": "2025-10-21",
      "id": "134731",
      "original_text": "Registerbekanntmachung nach dem Umwandlungsgesetz\nHamburg Amtsgericht Hamburg HRB 105239\nMIB Maritime Verwaltungsgesellschaft mbH – Hamburg",
      "type": "Registerbekanntmachung nach dem Umwandlungsgesetz",
      "state": "Hamburg",
      "amtsgericht": "Amtsgericht Hamburg",
      "registernummer": "HRB 105239",
      "registerart": "HRB",
      "company_name": "MIB Maritime Verwaltungsgesellschaft mbH",
      "company_seat": "Hamburg",
      "details": "21.10.2025 (Bekanntmachungsdatum)\n\nHamburg Amtsgericht Hamburg HRB 105239\nRegisterbekanntmachung nach dem Umwandlungsgesetz 21.10.2025 (Eintragungsdatum)\n\nMIB Maritime Verwaltungsgesellschaft mbH\nGesellschaft mit beschränkter Haftung\nHamburg\n\nAls nicht eingetragen wird bekannt gemacht:\nDen Gläubigern der an der Verschmelzung beteiligten Gesellschaften ist, wenn sie binnen sechs Monaten nach dem Tag, an dem die Eintragung der Verschmelzung in das Register des Sitzes desjenigen Rechtsträgers, dessen Gläubiger sie sind, nach § 19 Absatz 3 UmwG als bekannt gemacht gilt, ihren Anspruch nach Grund und Höhe schriftlich anmelden, Sicherheit zu leisten, soweit sie nicht Befriedigung verlangen können. Dieses Recht steht den Gläubigern jedoch nur zu, wenn sie glaubhaft machen, dass durch die Verschmelzung die Erfüllung ihrer Forderung gefährdet wird."
    },
    {
      "date": "2025-10-21",
      "id": "134732",
      "original_text": "Löschungsankündigung\nBrandenburg Amtsgericht Frankfurt/Oder HRB 17563\nFeuerbach Food GmbH Panketal – Panketal",
      "type": "Löschungsankündigung",
      "state": "Brandenburg",
      "amtsgericht": "Amtsgericht Frankfurt/Oder",
      "registernummer": "HRB 17563",
      "registerart": "HRB",
      "company_name": "Feuerbach Food GmbH Panketal",
      "company_seat": "Panketal",
      "details": "21.10.2025 (Bekanntmachungsdatum)\n\nBrandenburg Amtsgericht Frankfurt/Oder HRB 17563\nLöschungsankündigung\n\nFeuerbach Food GmbH Panketal\nGesellschaft mit beschränkter Haftung\nPanketal\n\nBei der nachstehenden Gesellschaft wird das Amtslöschungsverfahren gemäß § 394 FamFG eingeleitet."
    },
    {
      "date": "2025-10-21",
      "id": "134733",
      "original_text": "Registerbekanntmachung nach dem Umwandlungsgesetz\nHamburg Amtsgericht Hamburg HRB 94792\nVerwaltungsgesellschaft Maritim Invest mbH – Hamburg",
      "type": "Registerbekanntmachung nach dem Umwandlungsgesetz",
      "state": "Hamburg",
      "amtsgericht": "Amtsgericht Hamburg",
      "registernummer": "HRB 94792",
      "registerart": "HRB",
      "company_name": "Verwaltungsgesellschaft Maritim Invest mbH",
      "company_seat": "Hamburg",
      "details": "21.10.2025 (Bekanntmachungsdatum)\n\nHamburg Amtsgericht Hamburg HRB 94792\nRegisterbekanntmachung nach dem Umwandlungsgesetz 21.10.2025 (Eintragungsdatum)\n\nVerwaltungsgesellschaft Maritim Invest mbH\nGesellschaft mit beschränkter Haftung\nHamburg\n\nAls nicht eingetragen wird bekannt gemacht:\nDen Gläubigern der an der Verschmelzung beteiligten Gesellschaften ist, wenn sie binnen sechs Monaten nach dem Tag, an dem die Eintragung der Verschmelzung in das Register des Sitzes desjenigen Rechtsträgers, dessen Gläubiger sie sind, nach § 19 Absatz 3 UmwG als bekannt gemacht gilt, ihren Anspruch nach Grund und Höhe schriftlich anmelden, Sicherheit zu leisten, soweit sie nicht Befriedigung verlangen können. Dieses Recht steht den Gläubigern jedoch nur zu, wenn sie glaubhaft machen, dass durch die Verschmelzung die Erfüllung ihrer Forderung gefährdet wird."
    },
    {
      "date": "2025-10-21",
      "id": "134734",
      "original_text": "Registerbekanntmachung nach dem Umwandlungsgesetz\nHamburg Amtsgericht Hamburg HRB 101690\nVerwaltungsgesellschaft Maritim Equity mbH – Hamburg",
      "type": "Registerbekanntmachung nach dem Umwandlungsgesetz",
      "state": "Hamburg",
      "amtsgericht": "Amtsgericht Hamburg",
      "registernummer": "HRB 101690",
      "registerart": "HRB",
      "company_name": "Verwaltungsgesellschaft Maritim Equity mbH",
      "company_seat": "Hamburg",
      "details": "21.10.2025 (Bekanntmachungsdatum)\n\nHamburg Amtsgericht Hamburg HRB 101690\nRegisterbekanntmachung nach dem Umwandlungsgesetz 21.10.2025 (Eintragungsdatum)\n\nVerwaltungsgesellschaft Maritim Equity mbH\nGesellschaft mit beschränkter Haftung\nHamburg\n\nAls nicht eingetragen wird bekannt gemacht:\nDen Gläubigern der an der Verschmelzung beteiligten Gesellschaften ist, wenn sie binnen sechs Monaten nach dem Tag, an dem die Eintragung der Verschmelzung in das Register des Sitzes desjenigen Rechtsträgers, dessen Gläubiger sie sind, nach § 19 Absatz 3 UmwG als bekannt gemacht gilt, ihren Anspruch nach Grund und Höhe schriftlich anmelden, Sicherheit zu leisten, soweit sie nicht Befriedigung verlangen können. Dieses Recht steht den Gläubigern jedoch nur zu, wenn sie glaubhaft machen, dass durch die Verschmelzung die Erfüllung ihrer Forderung gefährdet wird."
    },
    {
      "date": "2025-10-21",
      "id": "134735",
      "original_text": "Löschungsankündigung\nBrandenburg Amtsgericht Frankfurt/Oder HRB 13923\nAutoService Schweimer Unternehmergesellschaft (haftungsbeschränkt) – Wriezen",
      "type": "Löschungsankündigung",
      "state": "Brandenburg",
      "amtsgericht": "Amtsgericht Frankfurt/Oder",
      "registernummer": "HRB 13923",
      "registerart": "HRB",
      "company_name": "AutoService Schweimer Unternehmergesellschaft (haftungsbeschränkt)",
      "company_seat": "Wriezen",
      "details": "21.10.2025 (Bekanntmachungsdatum)\n\nBrandenburg Amtsgericht Frankfurt/Oder HRB 13923\nLöschungsankündigung\n\nAutoService Schweimer Unternehmergesellschaft (haftungsbeschränkt)\nGesellschaft mit beschränkter Haftung\nWriezen\n\nBei der nachstehenden Gesellschaft wird das Amtslöschungsverfahren gemäß § 394 FamFG eingeleitet."
    },
    {
      "date": "2025-10-21",
      "id": "134736",
      "original_text": "Einreichung neuer Dokumente\nBaden-Württemberg Amtsgericht Mannheim HRB 362973\nadi Innovation AG – Karlsruhe",
      "type": "Einreichung neuer Dokumente",
      "state": "Baden-Württemberg",
      "amtsgericht": "Amtsgericht Mannheim",
      "registernummer": "HRB 362973",
      "registerart": "HRB",
      "company_name": "adi Innovation AG",
      "company_seat": "Karlsruhe",
      "details": "21.10.2025 (Bekanntmachungsdatum)\n\nBaden-Württemberg Amtsgericht Mannheim HRB 362973\nEinreichung neuer Dokumente\n\nadi Innovation AG\nAktiengesellschaft\nKarlsruhe\n\nDie Gesellschaft hat am 19.09.2024 die Liste über die Zusammensetzung des Aufsichtsrats zum Handelsregister eingereicht."
    },
    {
      "date": "2025-10-21",
      "id": "134737",
      "original_text": "Einreichung neuer Dokumente\nHamburg Amtsgericht Hamburg HRB 129858\nElbstein AG – Hamburg",
      "type": "Einreichung neuer Dokumente",
      "state": "Hamburg",
      "amtsgericht": "Amtsgericht Hamburg",
      "registernummer": "HRB 129858",
      "registerart": "HRB",
      "company_name": "Elbstein AG",
      "company_seat": "Hamburg",
      "details": "21.10.2025 (Bekanntmachungsdatum)\n\nHamburg Amtsgericht Hamburg HRB 129858\nEinreichung neuer Dokumente\n\nElbstein AG\nAktiengesellschaft\nHamburg\n\nAls nicht eingetragen wird bekannt gemacht: Liste des Aufsichtsrats wurde eingereicht."
    },
    {
      "date": "2025-10-21",
      "id": "134738",
      "original_text": "Einreichung neuer Dokumente\nBaden-Württemberg Amtsgericht Stuttgart HRB 733057\nSIMTEK AG – Mössingen",
      "type": "Einreichung neuer Dokumente",
      "state": "Baden-Württemberg",
      "amtsgericht": "Amtsgericht Stuttgart",
      "registernummer": "HRB 733057",
      "registerart": "HRB",
      "company_name": "SIMTEK AG",
      "company_seat": "Mössingen",
      "details": "21.10.2025 (Bekanntmachungsdatum)\n\nBaden-Württemberg Amtsgericht Stuttgart HRB 733057\nEinreichung neuer Dokumente\n\nSIMTEK AG\nAktiengesellschaft\nMössingen\n\nDie Gesellschaft hat am 16.10.2025 die Liste über die Zusammensetzung des Aufsichtsrats zum Handelsregister eingereicht."
    },
    {
      "date": "2025-10-21",
      "id": "134739",
      "original_text": "Löschungsankündigung\nBerlin Amtsgericht Berlin (Charlottenburg) HRB 186709\nRK Health Care GmbH – Berlin",
      "type": "Löschungsankündigung",
      "state": "Berlin",
      "amtsgericht": "Amtsgericht Berlin (Charlottenburg)",
      "registernummer": "HRB 186709",
      "registerart": "HRB",
      "company_name": "RK Health Care GmbH",
      "company_seat": "Berlin",
      "details": "21.10.2025 (Bekanntmachungsdatum)\n\nBerlin Amtsgericht Berlin (Charlottenburg) HRB 186709\nLöschungsankündigung\n\nRK Health Care GmbH\nGesellschaft mit beschränkter Haftung\nBerlin\n\nBei der nachstehenden Gesellschaft wird das Amtslöschungsverfahren gemäß § 394 FamFG eingeleitet. Widerspruchsfrist 6 Wochen"
    },
    {
      "date": "2025-10-21",
      "id": "134740",
      "original_text": "Löschungsankündigung\nBaden-Württemberg Amtsgericht Mannheim HRB 721188\nA.T.T. Söylemez GmbH – Karlsruhe",
      "type": "Löschungsankündigung",
      "state": "Baden-Württemberg",
      "amtsgericht": "Amtsgericht Mannheim",
      "registernummer": "HRB 721188",
      "registerart": "HRB",
      "company_name": "A.T.T. Söylemez GmbH",
      "company_seat": "Karlsruhe",
      "details": "21.10.2025 (Bekanntmachungsdatum)\n\nBaden-Württemberg Amtsgericht Mannheim HRB 721188\nLöschungsankündigung\n\nA.T.T. Söylemez GmbH\nGesellschaft mit beschränkter Haftung\nKarlsruhe\n\nDas Gericht beabsichtigt, die Gesellschaft wegen Vermögenslosigkeit im Handelsregister von Amts wegen nach § 394 FamFG zu löschen. Die Frist zur Geltendmachung eines Widerspruchs gegen die beabsichtigte Löschung ist auf einen Monat ab Veröffentlichung bestimmt."
    },
    {
      "date": "2025-10-21",
      "id": "134741",
      "original_text": "Einreichung neuer Dokumente\nBaden-Württemberg Amtsgericht Ulm HRB 750199\nFNT Services GmbH – Ellwangen Jagst",
      "type": "Einreichung neuer Dokumente",
      "state": "Baden-Württemberg",
      "amtsgericht": "Amtsgericht Ulm",
      "registernummer": "HRB 750199",
      "registerart": "HRB",
      "company_name": "FNT Services GmbH",
      "company_seat": "Ellwangen Jagst",
      "details": "21.10.2025 (Bekanntmachungsdatum)\n\nBaden-Württemberg Amtsgericht Ulm HRB 750199\nEinreichung neuer Dokumente\n\nFNT Services GmbH\nGesellschaft mit beschränkter Haftung\nEllwangen Jagst\n\nDie Gesellschaft hat am 06.10.2025 die Liste über die Zusammensetzung des Aufsichtsrats zum Handelsregister eingereicht."
    },
    {
      "date": "2025-10-21",
      "id": "134742",
      "original_text": "Löschungsankündigung\nBerlin Amtsgericht Berlin (Charlottenburg) HRB 236863\nHadrian VV30 UG (haftungsbeschränkt) – Berlin",
      "type": "Löschungsankündigung",
      "state": "Berlin",
      "amtsgericht": "Amtsgericht Berlin (Charlottenburg)",
      "registernummer": "HRB 236863",
      "registerart": "HRB",
      "company_name": "Hadrian VV30 UG (haftungsbeschränkt)",
      "company_seat": "Berlin",
      "details": "21.10.2025 (Bekanntmachungsdatum)\n\nBerlin Amtsgericht Berlin (Charlottenburg) HRB 236863\nLöschungsankündigung\n\nHadrian VV30 UG (haftungsbeschränkt)\nGesellschaft mit beschränkter Haftung\nBerlin\n\nBei der nachstehenden Gesellschaft wird das Amtslöschungsverfahren gemäß § 394 FamFG eingeleitet. Widerspruchsfrist 6 Wochen"
    },
    {
      "date": "2025-10-21",
      "id": "134743",
      "original_text": "Einreichung neuer Dokumente\nSachsen-Anhalt Amtsgericht Stendal HRB 12193\nStadtentwicklungsgesellschaft Bitterfeld-Wolfen mbH (STEG Bitterfeld-Wolfen) – Bitterfeld-Wolfen",
      "type": "Einreichung neuer Dokumente",
      "state": "Sachsen-Anhalt",
      "amtsgericht": "Amtsgericht Stendal",
      "registernummer": "HRB 12193",
      "registerart": "HRB",
      "company_name": "Stadtentwicklungsgesellschaft Bitterfeld-Wolfen mbH (STEG Bitterfeld-Wolfen)",
      "company_seat": "Bitterfeld-Wolfen",
      "details": "21.10.2025 (Bekanntmachungsdatum)\n\nSachsen-Anhalt Amtsgericht Stendal HRB 12193\nEinreichung neuer Dokumente\n\nStadtentwicklungsgesellschaft Bitterfeld-Wolfen mbH (STEG Bitterfeld-Wolfen)\nGesellschaft mit beschränkter Haftung\nBitterfeld-Wolfen\n\nEine Liste der Mitglieder des Aufsichtsrates wurde zum Handelsregister eingereicht."
    },
    {
      "date": "2025-10-21",
      "id": "134744",
      "original_text": "Einreichung neuer Dokumente\nBrandenburg Amtsgericht Frankfurt/Oder HRB 18107\nTesla Manufacturing Brandenburg SE – Grünheide (Mark)",
      "type": "Einreichung neuer Dokumente",
      "state": "Brandenburg",
      "amtsgericht": "Amtsgericht Frankfurt/Oder",
      "registernummer": "HRB 18107",
      "registerart": "HRB",
      "company_name": "Tesla Manufacturing Brandenburg SE",
      "company_seat": "Grünheide (Mark)",
      "details": "21.10.2025 (Bekanntmachungsdatum)\n\nBrandenburg Amtsgericht Frankfurt/Oder HRB 18107\nEinreichung neuer Dokumente\n\nTesla Manufacturing Brandenburg SE\nEuropäische Aktiengesellschaft (SE)\nGrünheide (Mark)\n\nEs wurde eine Liste der Aufsichtsratsmitglieder vom 30.09.2025 eingereicht."
    },
    {
      "date": "2025-10-21",
      "id": "134745",
      "original_text": "Löschungsankündigung\nBrandenburg Amtsgericht Cottbus HRB 15015\nREIMERS & PARTNER COMPANY LIMITED BY GUARANTEE - Niederlassung Deutschland – Forst (Lausitz)",
      "type": "Löschungsankündigung",
      "state": "Brandenburg",
      "amtsgericht": "Amtsgericht Cottbus",
      "registernummer": "HRB 15015",
      "registerart": "HRB",
      "company_name": "REIMERS & PARTNER COMPANY LIMITED BY GUARANTEE - Niederlassung Deutschland",
      "company_seat": "Forst (Lausitz)",
      "details": "21.10.2025 (Bekanntmachungsdatum)\n\nBrandenburg Amtsgericht Cottbus HRB 15015\nLöschungsankündigung\n\nREIMERS & PARTNER COMPANY LIMITED BY GUARANTEE - Niederlassung Deutschland\nRechtsform ausländischen Rechts HRB\nForst (Lausitz)\n\nBei der nachstehenden Gesellschaft wird das Amtslöschungsverfahren gemäß § 394 FamFG eingeleitet."
    },
    {
      "date": "2025-10-21",
      "id": "134746",
      "original_text": "Löschungsankündigung\nSchleswig-Holstein Amtsgericht Lübeck HRB 16818\nOrgemt GmbH – Ahrensburg",
      "type": "Löschungsankündigung",
      "state": "Schleswig-Holstein",
      "amtsgericht": "Amtsgericht Lübeck",
      "registernummer": "HRB 16818",
      "registerart": "HRB",
      "company_name": "Orgemt GmbH",
      "company_seat": "Ahrensburg",
      "details": "21.10.2025 (Bekanntmachungsdatum)\n\nSchleswig-Holstein Amtsgericht Lübeck HRB 16818\nLöschungsankündigung\n\nOrgemt GmbH\nGesellschaft mit beschränkter Haftung\nAhrensburg\n\nEs ist die Löschung der nachstehenden Gesellschaft wegen Vermögenslosigkeit gemäß § 394 FamFG beabsichtigt."
    },
    {
      "date": "2025-10-21",
      "id": "134747",
      "original_text": "Registerbekanntmachung nach dem Umwandlungsgesetz\nSachsen Amtsgericht Chemnitz HRA 278\nAutohaus Dittmar Mäke e.K. – Brand-Erbisdorf",
      "type": "Registerbekanntmachung nach dem Umwandlungsgesetz",
      "state": "Sachsen",
      "amtsgericht": "Amtsgericht Chemnitz",
      "registernummer": "HRA 278",
      "registerart": "HRA",
      "company_name": "Autohaus Dittmar Mäke e.K.",
      "company_seat": "Brand-Erbisdorf",
      "details": "21.10.2025 (Bekanntmachungsdatum)\n\nSachsen Amtsgericht Chemnitz HRA 278\nRegisterbekanntmachung nach dem Umwandlungsgesetz 21.10.2025 (Eintragungsdatum)\n\nAutohaus Dittmar Mäke e.K.\nEinzelkaufmann / Einzelkauffrau\nBrand-Erbisdorf\n\nDen Gläubigern der an der Ausgliederung beteiligten Rechtsträger ist, wenn sie binnen sechs Monaten nach dem Tag, an dem die Eintragung der Ausgliederung in das Register des Sitzes desjenigen Rechtsträgers, dessen Gläubiger sie sind, nach § 19 Abs. 3 UmwG als bekannt gemacht gilt, ihren Anspruch nach Grund und Höhe in Textform anmelden, Sicherheit zu leisten, soweit sie nicht Befriedigung verlangen können. Dieses Recht steht den Gläubigern jedoch nur zu, wenn sie glaubhaft machen, dass durch die Ausgliederung die Erfüllung der Forderung gefährdet wird."
    },
    {
      "date": "2025-10-21",
      "id": "134748",
      "original_text": "Löschungsankündigung\nSachsen Amtsgericht Leipzig VR 4442\nRockwurst e.V. – Leipzig",
      "type": "Löschungsankündigung",
      "state": "Sachsen",
      "amtsgericht": "Amtsgericht Leipzig",
      "registernummer": "VR 4442",
      "registerart": "VR",
      "company_name": "Rockwurst e.V.",
      "company_seat": "Leipzig",
      "details": "21.10.2025 (Bekanntmachungsdatum)\n\nSachsen Amtsgericht Leipzig VR 4442\nLöschungsankündigung\n\nRockwurst e.V.\neingetragener Verein\nLeipzig\n\nDas Gericht beabsichtigt, gemäß § 4 Absatz 2 Ziffer 1 der Verordnung über das Vereinsregister das Registerblatt  des Vereins zu schließen, da nach den Ermittlungen des Gerichts sämtliche Mitglieder aus dem Verein ausgeschieden sind. Zur Geltendmachung eines Widerspruchs gegen die beabsichtigte Schließung wird eine Frist von einem Monat nach der Veröffentlichung bestimmt."
    },
    {
      "date": "2025-10-21",
      "id": "134749",
      "original_text": "Registerbekanntmachung nach dem Umwandlungsgesetz\nSachsen Amtsgericht Leipzig HRB 7530\nBIOVERSAL DEUTSCHLAND GmbH – Delitzsch",
      "type": "Registerbekanntmachung nach dem Umwandlungsgesetz",
      "state": "Sachsen",
      "amtsgericht": "Amtsgericht Leipzig",
      "registernummer": "HRB 7530",
      "registerart": "HRB",
      "company_name": "BIOVERSAL DEUTSCHLAND GmbH",
      "company_seat": "Delitzsch",
      "details": "21.10.2025 (Bekanntmachungsdatum)\n\nSachsen Amtsgericht Leipzig HRB 7530\nRegisterbekanntmachung nach dem Umwandlungsgesetz 21.10.2025 (Eintragungsdatum)\n\nBIOVERSAL DEUTSCHLAND GmbH\nGesellschaft mit beschränkter Haftung\nDelitzsch\n\nDen Gläubigern der an der Spaltung beteiligten Rechtsträger ist, wenn sie binnen sechs Monaten nach dem Tag, an dem die Eintragung der Spaltung in das Register des Sitzes desjenigen Rechtsträgers, dessen Gläubiger sie sind, nach §§ 125, 19 Abs. 3 UmwG als bekannt gemacht gilt, ihren Anspruch nach Grund und Höhe in Textform anmelden, Sicherheit zu leisten, soweit sie nicht Befriedigung verlangen können. Dieses Recht steht den Gläubigern jedoch nur zu, wenn sie glaubhaft machen, dass durch die Spaltung die Erfüllung der Forderung gefährdet wird."
    },
    {
      "date": "2025-10-21",
      "id": "134750",
      "original_text": "Löschungsankündigung\nSachsen Amtsgericht Leipzig HRB 28406\nPinball Shop GmbH – Bad Lausick",
      "type": "Löschungsankündigung",
      "state": "Sachsen",
      "amtsgericht": "Amtsgericht Leipzig",
      "registernummer": "HRB 28406",
      "registerart": "HRB",
      "company_name": "Pinball Shop GmbH",
      "company_seat": "Bad Lausick",
      "details": "21.10.2025 (Bekanntmachungsdatum)\n\nSachsen Amtsgericht Leipzig HRB 28406\nLöschungsankündigung 21.10.2025 (Eintragungsdatum)\n\nPinball Shop GmbH\nGesellschaft mit beschränkter Haftung\nBad Lausick\n\nDas Registergericht beabsichtigt, die im Handelsregister eingetragene Gesellschaft von Amts wegen nach § 394 FamFG zu löschen. Die Frist zu Erhebung eines Widerspruchs gegen die beabsichtigte Löschung wird auf einen Monat festgesetzt."
    },
    {
      "date": "2025-10-21",
      "id": "134751",
      "original_text": "Einreichung neuer Dokumente\nSachsen Amtsgericht Chemnitz HRB 8310\nVerkehrslandeplatz Chemnitz/Jahnsdorf Gesellschaft mit beschränkter Haftung – Jahnsdorf/Erzgeb.",
      "type": "Einreichung neuer Dokumente",
      "state": "Sachsen",
      "amtsgericht": "Amtsgericht Chemnitz",
      "registernummer": "HRB 8310",
      "registerart": "HRB",
      "company_name": "Verkehrslandeplatz Chemnitz/Jahnsdorf Gesellschaft mit beschränkter Haftung",
      "company_seat": "Jahnsdorf/Erzgeb.",
      "details": "21.10.2025 (Bekanntmachungsdatum)\n\nSachsen Amtsgericht Chemnitz HRB 8310\nEinreichung neuer Dokumente\n\nVerkehrslandeplatz Chemnitz/Jahnsdorf Gesellschaft mit beschränkter Haftung\nGesellschaft mit beschränkter Haftung\nJahnsdorf/Erzgeb.\n\nAm 20.10.2025 wurde beim Handelsregister des Amtsgerichts Chemnitz die Liste der Mitglieder des Aufsichtsrats gemäß § 52 GmbHG eingereicht."
    },
    {
      "date": "2025-10-21",
      "id": "134752",
      "original_text": "Registerbekanntmachung nach dem Umwandlungsgesetz\nSachsen Amtsgericht Chemnitz HRA 10279\nAutomobile Dittmar Mäke GmbH & Co. KG Waldheim – Waldheim",
      "type": "Registerbekanntmachung nach dem Umwandlungsgesetz",
      "state": "Sachsen",
      "amtsgericht": "Amtsgericht Chemnitz",
      "registernummer": "HRA 10279",
      "registerart": "HRA",
      "company_name": "Automobile Dittmar Mäke GmbH & Co. KG Waldheim",
      "company_seat": "Waldheim",
      "details": "21.10.2025 (Bekanntmachungsdatum)\n\nSachsen Amtsgericht Chemnitz HRA 10279\nRegisterbekanntmachung nach dem Umwandlungsgesetz 21.10.2025 (Eintragungsdatum)\n\nAutomobile Dittmar Mäke GmbH & Co. KG Waldheim\nKommanditgesellschaft\nWaldheim\n\nDen Gläubigern der an der Ausgliederung beteiligten Rechtsträger ist, wenn sie binnen sechs Monaten nach dem Tag, an dem die Eintragung der Ausgliederung in das Register des Sitzes desjenigen Rechtsträgers, dessen Gläubiger sie sind, nach § 19 Abs. 3 UmwG als bekannt gemacht gilt, ihren Anspruch nach Grund und Höhe in Textform anmelden, Sicherheit zu leisten, soweit sie nicht Befriedigung verlangen können. Dieses Recht steht den Gläubigern jedoch nur zu, wenn sie glaubhaft machen, dass durch die Ausgliederung die Erfüllung der Forderung gefährdet wird."
    },
    {
      "date": "2025-10-21",
      "id": "134753",
      "original_text": "Löschungsankündigung\nSachsen Amtsgericht Leipzig HRB 33019\nAxe - Capital Real Estate GmbH – Markkleeberg",
      "type": "Löschungsankündigung",
      "state": "Sachsen",
      "amtsgericht": "Amtsgericht Leipzig",
      "registernummer": "HRB 33019",
      "registerart": "HRB",
      "company_name": "Axe - Capital Real Estate GmbH",
      "company_seat": "Markkleeberg",
      "details": "21.10.2025 (Bekanntmachungsdatum)\n\nSachsen Amtsgericht Leipzig HRB 33019\nLöschungsankündigung 21.10.2025 (Eintragungsdatum)\n\nAxe - Capital Real Estate GmbH\nGesellschaft mit beschränkter Haftung\nMarkkleeberg\n\nDas Registergericht beabsichtigt, die im Handelsregister eingetragene Gesellschaft von Amts wegen nach § 394 FamFG zu löschen. Die Frist zu Erhebung eines Widerspruchs gegen die beabsichtigte Löschung wird auf einen Monat festgesetzt."
    },
    {
      "date": "2025-10-21",
      "id": "134754",
      "original_text": "Registerbekanntmachung nach dem Umwandlungsgesetz\nSachsen Amtsgericht Chemnitz HRA 10277\nAutomobile Dittmar Mäke GmbH & Co. KG – Brand-Erbisdorf",
      "type": "Registerbekanntmachung nach dem Umwandlungsgesetz",
      "state": "Sachsen",
      "amtsgericht": "Amtsgericht Chemnitz",
      "registernummer": "HRA 10277",
      "registerart": "HRA",
      "company_name": "Automobile Dittmar Mäke GmbH & Co. KG",
      "company_seat": "Brand-Erbisdorf",
      "details": "21.10.2025 (Bekanntmachungsdatum)\n\nSachsen Amtsgericht Chemnitz HRA 10277\nRegisterbekanntmachung nach dem Umwandlungsgesetz 21.10.2025 (Eintragungsdatum)\n\nAutomobile Dittmar Mäke GmbH & Co. KG\nKommanditgesellschaft\nBrand-Erbisdorf\n\nDen Gläubigern der an der Ausgliederung beteiligten Rechtsträger ist, wenn sie binnen sechs Monaten nach dem Tag, an dem die Eintragung der Ausgliederung in das Register des Sitzes desjenigen Rechtsträgers, dessen Gläubiger sie sind, nach § 19 Abs. 3 UmwG als bekannt gemacht gilt, ihren Anspruch nach Grund und Höhe in Textform anmelden, Sicherheit zu leisten, soweit sie nicht Befriedigung verlangen können. Dieses Recht steht den Gläubigern jedoch nur zu, wenn sie glaubhaft machen, dass durch die Ausgliederung die Erfüllung der Forderung gefährdet wird."
    },
    {
      "date": "2025-10-21",
      "id": "134755",
      "original_text": "Registerbekanntmachung nach dem Umwandlungsgesetz\nSachsen Amtsgericht Chemnitz VR 5232\nTourismusverband LEIPZIG REGION e.V. – Waldheim",
      "type": "Registerbekanntmachung nach dem Umwandlungsgesetz",
      "state": "Sachsen",
      "amtsgericht": "Amtsgericht Chemnitz",
      "registernummer": "VR 5232",
      "registerart": "VR",
      "company_name": "Tourismusverband LEIPZIG REGION e.V.",
      "company_seat": "Waldheim",
      "details": "21.10.2025 (Bekanntmachungsdatum)\n\nSachsen Amtsgericht Chemnitz VR 5232\nRegisterbekanntmachung nach dem Umwandlungsgesetz 21.10.2025 (Eintragungsdatum)\n\nTourismusverband LEIPZIG REGION e.V.\neingetragener Verein\nWaldheim\n\nDen Gläubigern der an der Verschmelzung beteiligten Rechtsträger ist, wenn sie binnen sechs Monaten nach dem Tag, an dem die Eintragung der Verschmelzung in das Register des Sitzes desjenigen Rechtsträgers, dessen Gläubiger sie sind, nach § 19 Abs. 3 UmwG als bekannt gemacht gilt, ihren Anspruch nach Grund und Höhe in Textform anmelden, Sicherheit zu leisten, soweit sie nicht Befriedigung verlangen können. Dieses Recht steht den Gläubigern jedoch nur zu, wenn sie glaubhaft machen, dass durch die Verschmelzung die Erfüllung der Forderung gefährdet wird."
    },
    {
      "date": "2025-10-21",
      "id": "134756",
      "original_text": "Löschungsankündigung\nNiedersachsen Amtsgericht Braunschweig HRB 205492\nDienstleistungsgesellschaft der Regionalen Energie- und KlimaschutzAgentur UG (haftungsbeschränkt) – Braunschweig",
      "type": "Löschungsankündigung",
      "state": "Niedersachsen",
      "amtsgericht": "Amtsgericht Braunschweig",
      "registernummer": "HRB 205492",
      "registerart": "HRB",
      "company_name": "Dienstleistungsgesellschaft der Regionalen Energie- und KlimaschutzAgentur UG (haftungsbeschränkt)",
      "company_seat": "Braunschweig",
      "details": "21.10.2025 (Bekanntmachungsdatum)\n\nNiedersachsen Amtsgericht Braunschweig HRB 205492\nLöschungsankündigung\n\nDienstleistungsgesellschaft der Regionalen Energie- und KlimaschutzAgentur UG (haftungsbeschränkt)\nGesellschaft mit beschränkter Haftung\nBraunschweig\n\nDas Registergericht beabsichtigt, die Gesellschaft von Amts wegen nach § 394 FamFG zu löschen. Die Frist zur Erhebung eines Widerspruchs ist auf 1 Monat ab dieser Registerbekanntmachung festgesetzt."
    },
    {
      "date": "2025-10-21",
      "id": "134757",
      "original_text": "Registerbekanntmachung nach dem Umwandlungsgesetz\nNiedersachsen Amtsgericht Osnabrück HRB 211775\nHagemeier GmbH – Lingen (Ems)",
      "type": "Registerbekanntmachung nach dem Umwandlungsgesetz",
      "state": "Niedersachsen",
      "amtsgericht": "Amtsgericht Osnabrück",
      "registernummer": "HRB 211775",
      "registerart": "HRB",
      "company_name": "Hagemeier GmbH",
      "company_seat": "Lingen (Ems)",
      "details": "21.10.2025 (Bekanntmachungsdatum)\n\nNiedersachsen Amtsgericht Osnabrück HRB 211775\nRegisterbekanntmachung nach dem Umwandlungsgesetz 21.10.2025 (Eintragungsdatum)\n\nHagemeier GmbH\nGesellschaft mit beschränkter Haftung\nLingen (Ems)\n\nDen Gläubigern der an der Verschmelzung beteiligten Rechtsträger ist, wenn sie binnen sechs Monaten nach dem Tag, an dem die Eintragung der Verschmelzung in das Register des Sitzes desjenigen Rechtsträgers, dessen Gläubiger sie sind, nach § 19  Abs.  3 UmwG als bekannt gemacht gilt, ihren Anspruch nach Grund und Höhe schriftlich anmelden, Sicherheit zu leisten, soweit sie nicht Befriedigung verlangen können. Dieses Recht steht den Gläubigern jedoch nur zu, wenn sie glaubhaft machen, dass durch die Verschmelzung die Erfüllung der Forderung gefährdet wird."
    },
    {
      "date": "2025-10-21",
      "id": "134758",
      "original_text": "Registerbekanntmachung nach dem Umwandlungsgesetz\nNiedersachsen Amtsgericht Walsrode HRB 210882\nMicroPurpose GmbH – Visselhövede",
      "type": "Registerbekanntmachung nach dem Umwandlungsgesetz",
      "state": "Niedersachsen",
      "amtsgericht": "Amtsgericht Walsrode",
      "registernummer": "HRB 210882",
      "registerart": "HRB",
      "company_name": "MicroPurpose GmbH",
      "company_seat": "Visselhövede",
      "details": "21.10.2025 (Bekanntmachungsdatum)\n\nNiedersachsen Amtsgericht Walsrode HRB 210882\nRegisterbekanntmachung nach dem Umwandlungsgesetz 21.10.2025 (Eintragungsdatum)\n\nMicroPurpose GmbH\nGesellschaft mit beschränkter Haftung\nVisselhövede\n\nDen Gläubigern der an der Verschmelzung beteiligten Rechtsträger ist, wenn sie binnen sechs Monaten nach dem Tag, an dem die Eintragung der Verschmelzung in das Register des Sitzes desjenigen Rechtsträgers, dessen Gläubiger sie sind, nach § 19  Abs.  3 UmwG als bekannt gemacht gilt, ihren Anspruch nach Grund und Höhe schriftlich anmelden, Sicherheit zu leisten, soweit sie nicht Befriedigung verlangen können. Dieses Recht steht den Gläubigern jedoch nur zu, wenn sie glaubhaft machen, dass durch die Verschmelzung die Erfüllung der Forderung gefährdet wird."
    },
    {
      "date": "2025-10-21",
      "id": "134759",
      "original_text": "Registerbekanntmachung nach dem Umwandlungsgesetz\nNiedersachsen Amtsgericht Hildesheim HRA 203185\nLIV Administration GmbH & Co. KG – Hildesheim",
      "type": "Registerbekanntmachung nach dem Umwandlungsgesetz",
      "state": "Niedersachsen",
      "amtsgericht": "Amtsgericht Hildesheim",
      "registernummer": "HRA 203185",
      "registerart": "HRA",
      "company_name": "LIV Administration GmbH & Co. KG",
      "company_seat": "Hildesheim",
      "details": "21.10.2025 (Bekanntmachungsdatum)\n\nNiedersachsen Amtsgericht Hildesheim HRA 203185\nRegisterbekanntmachung nach dem Umwandlungsgesetz 20.10.2025 (Eintragungsdatum)\n\nLIV Administration GmbH & Co. KG\nKommanditgesellschaft\nHildesheim\n\nDen Gläubigern der an der formwechselnden Umwandlung beteiligten Rechtsträger ist, wenn sie binnen sechs Monaten nach dem Tag, an dem die Eintragung der Umwandlung in das Register des Sitzes desjenigen Rechtsträgers, dessen Gläubiger sie sind, nach § 19 Abs. 3 UmwG als bekannt gemacht gilt, ihren Anspruch nach Grund und Höhe schriftlich anmelden, Sicherheit zu leisten, soweit sie nicht Befriedigung verlangen können. Dieses Recht steht den Gläubigern jedoch nur zu, wenn sie glaubhaft machen, dass durch die formwechselnde Umwandlung die Erfüllung der Forderung gefährdet wird."
    },
    {
      "date": "2025-10-21",
      "id": "134760",
      "original_text": "Registerbekanntmachung nach dem Umwandlungsgesetz\nNiedersachsen Amtsgericht Hildesheim HRB 203124\nLIV Administration GmbH – Hildesheim",
      "type": "Registerbekanntmachung nach dem Umwandlungsgesetz",
      "state": "Niedersachsen",
      "amtsgericht": "Amtsgericht Hildesheim",
      "registernummer": "HRB 203124",
      "registerart": "HRB",
      "company_name": "LIV Administration GmbH",
      "company_seat": "Hildesheim",
      "details": "21.10.2025 (Bekanntmachungsdatum)\n\nNiedersachsen Amtsgericht Hildesheim HRB 203124\nRegisterbekanntmachung nach dem Umwandlungsgesetz 20.10.2025 (Eintragungsdatum)\n\nLIV Administration GmbH\nGesellschaft mit beschränkter Haftung\nHildesheim\n\nDen Gläubigern der an der formwechselnden Umwandlung beteiligten Rechtsträger ist, wenn sie binnen sechs Monaten nach dem Tag, an dem die Eintragung der Umwandlung in das Register des Sitzes desjenigen Rechtsträgers, dessen Gläubiger sie sind, nach § 19 Abs. 3 UmwG als bekannt gemacht gilt, ihren Anspruch nach Grund und Höhe schriftlich anmelden, Sicherheit zu leisten, soweit sie nicht Befriedigung verlangen können. Dieses Recht steht den Gläubigern jedoch nur zu, wenn sie glaubhaft machen, dass durch die formwechselnde Umwandlung die Erfüllung der Forderung gefährdet wird."
    },
    {
      "date": "2025-10-21",
      "id": "134761",
      "original_text": "Löschungsankündigung\nNiedersachsen Amtsgericht Hannover HRB 217220\nMotorcraft GmbH – Hannover",
      "type": "Löschungsankündigung",
      "state": "Niedersachsen",
      "amtsgericht": "Amtsgericht Hannover",
      "registernummer": "HRB 217220",
      "registerart": "HRB",
      "company_name": "Motorcraft GmbH",
      "company_seat": "Hannover",
      "details": "21.10.2025 (Bekanntmachungsdatum)\n\nNiedersachsen Amtsgericht Hannover HRB 217220\nLöschungsankündigung\n\nMotorcraft GmbH\nGesellschaft mit beschränkter Haftung\nHannover\n\nDas Registergericht beabsichtigt, die Gesellschaft von Amts wegen nach § 394 FamFG zu löschen. Die Frist zur Erhebung eines Widerspruchs ist auf 1 Monat ab dieser Registerbekanntmachung festgesetzt."
    },
    {
      "date": "2025-10-21",
      "id": "134762",
      "original_text": "Registerbekanntmachung nach dem Umwandlungsgesetz\nRheinland-Pfalz Amtsgericht Ludwigshafen a.Rhein (Ludwigshafen) HRB 63360\nWendt-Insulation GmbH – Frankenthal",
      "type": "Registerbekanntmachung nach dem Umwandlungsgesetz",
      "state": "Rheinland-Pfalz",
      "amtsgericht": "Amtsgericht Ludwigshafen a.Rhein (Ludwigshafen)",
      "registernummer": "HRB 63360",
      "registerart": "HRB",
      "company_name": "Wendt-Insulation GmbH",
      "company_seat": "Frankenthal",
      "details": "21.10.2025 (Bekanntmachungsdatum)\n\nRheinland-Pfalz Amtsgericht Ludwigshafen a.Rhein (Ludwigshafen) HRB 63360\nRegisterbekanntmachung nach dem Umwandlungsgesetz 20.10.2025 (Eintragungsdatum)\n\nWendt-Insulation GmbH\nGesellschaft mit beschränkter Haftung\nFrankenthal\n\nAls nicht eingetragen wird veröffentlicht: Den Gläubigern der an der Verschmelzung beteiligten Rechtsträger ist, wenn sie binnen sechs Monaten nach dem Tag, an dem die Eintragung der Verschmelzung in das Register des Sitzes desjenigen Rechtsträgers,dessen Gläubiger sie sind, nach § 19 Abs. 3 UmwG als bekannt gemacht gilt, ihren Anspruch nach Grund und Höhe schriftlich anmelden, Sicherheit zu leisten, soweit sie nicht Befriedigung verlangen können. Dieses Recht steht den Gläubigern jedoch nur zu, wenn sie glaubhaft machen, dass durch die Verschmelzung die Erfüllungd er Forderung gefährdet wird."
    },
    {
      "date": "2025-10-21",
      "id": "134763",
      "original_text": "Löschungsankündigung\nRheinland-Pfalz Amtsgericht Montabaur HRB 29697\nDreischläger Hof GmbH – Neustadt (Wied)",
      "type": "Löschungsankündigung",
      "state": "Rheinland-Pfalz",
      "amtsgericht": "Amtsgericht Montabaur",
      "registernummer": "HRB 29697",
      "registerart": "HRB",
      "company_name": "Dreischläger Hof GmbH",
      "company_seat": "Neustadt (Wied)",
      "details": "21.10.2025 (Bekanntmachungsdatum)\n\nRheinland-Pfalz Amtsgericht Montabaur HRB 29697\nLöschungsankündigung\n\nDreischläger Hof GmbH\nGesellschaft mit beschränkter Haftung\nNeustadt (Wied)\n\nDas Registergericht beabsichtigt die Gesellschaft von Amts wegen nach § 394 FamFG zu löschen. Die Frist zur Erhebung eines Widerspruchs ist auf 1 Monat festgesetzt."
    },
    {
      "date": "2025-10-21",
      "id": "134764",
      "original_text": "Registerbekanntmachung nach dem Umwandlungsgesetz\nRheinland-Pfalz Amtsgericht Bad Kreuznach HRA 21350\nRossano Vincenti e.K. – Waldlaubersheim",
      "type": "Registerbekanntmachung nach dem Umwandlungsgesetz",
      "state": "Rheinland-Pfalz",
      "amtsgericht": "Amtsgericht Bad Kreuznach",
      "registernummer": "HRA 21350",
      "registerart": "HRA",
      "company_name": "Rossano Vincenti e.K.",
      "company_seat": "Waldlaubersheim",
      "details": "21.10.2025 (Bekanntmachungsdatum)\n\nRheinland-Pfalz Amtsgericht Bad Kreuznach HRA 21350\nRegisterbekanntmachung nach dem Umwandlungsgesetz 21.10.2025 (Eintragungsdatum)\n\nRossano Vincenti e.K.\nEinzelkaufmann / Einzelkauffrau\nWaldlaubersheim\n\nAls nicht eingetragen wird veröffentlicht: Den Gläubigern der an der Ausgliederung beteiligten Rechtsträger ist, wenn sie binnen sechs Monaten nach dem Tag, an dem die Eintragung der Ausgliederung in das Register des Sitzes desjenigen Rechtsträgers,dessen Gläubiger sie sind, nach § 19 Abs. 3 UmwG als bekannt gemacht gilt, ihren Anspruch nach Grund und Höhe schriftlich anmelden, Sicherheit zu leisten, soweit sie nicht Befriedigung verlangen können. Dieses Recht steht den Gläubigern jedoch nur zu, wenn sie glaubhaft machen, dass durch die Ausgliederung die Erfüllung der Forderung gefährdet wird."
    },
    {
      "date": "2025-10-21",
      "id": "134765",
      "original_text": "Registerbekanntmachung nach dem Umwandlungsgesetz\nRheinland-Pfalz Amtsgericht Ludwigshafen a.Rhein (Ludwigshafen) HRB 22050\nWendt SIT GmbH – Frankenthal",
      "type": "Registerbekanntmachung nach dem Umwandlungsgesetz",
      "state": "Rheinland-Pfalz",
      "amtsgericht": "Amtsgericht Ludwigshafen a.Rhein (Ludwigshafen)",
      "registernummer": "HRB 22050",
      "registerart": "HRB",
      "company_name": "Wendt SIT GmbH",
      "company_seat": "Frankenthal",
      "details": "21.10.2025 (Bekanntmachungsdatum)\n\nRheinland-Pfalz Amtsgericht Ludwigshafen a.Rhein (Ludwigshafen) HRB 22050\nRegisterbekanntmachung nach dem Umwandlungsgesetz 20.10.2025 (Eintragungsdatum)\n\nWendt SIT GmbH\nGesellschaft mit beschränkter Haftung\nFrankenthal\n\nAls nicht eingetragen wird veröffentlicht: Den Gläubigern der an der Verschmelzung beteiligten Rechtsträger ist, wenn sie binnen sechs Monaten nach dem Tag, an dem die Eintragung der Verschmelzung in das Register des Sitzes desjenigen Rechtsträgers,dessen Gläubiger sie sind, nach § 19 Abs. 3 UmwG als bekannt gemacht gilt, ihren Anspruch nach Grund und Höhe schriftlich anmelden, Sicherheit zu leisten, soweit sie nicht Befriedigung verlangen können. Dieses Recht steht den Gläubigern jedoch nur zu, wenn sie glaubhaft machen, dass durch die Verschmelzung die Erfüllungd er Forderung gefährdet wird."
    },
    {
      "date": "2025-10-21",
      "id": "134766",
      "original_text": "Löschungsankündigung\nRheinland-Pfalz Amtsgericht Kaiserslautern HRB 30101\nProfessional Network Technologies PNT GmbH – Kaiserslautern",
      "type": "Löschungsankündigung",
      "state": "Rheinland-Pfalz",
      "amtsgericht": "Amtsgericht Kaiserslautern",
      "registernummer": "HRB 30101",
      "registerart": "HRB",
      "company_name": "Professional Network Technologies PNT GmbH",
      "company_seat": "Kaiserslautern",
      "details": "21.10.2025 (Bekanntmachungsdatum)\n\nRheinland-Pfalz Amtsgericht Kaiserslautern HRB 30101\nLöschungsankündigung 20.10.2025 (Eintragungsdatum)\n\nProfessional Network Technologies PNT GmbH\nGesellschaft mit beschränkter Haftung\nKaiserslautern\n\nDas Registergericht beabsichtigt die vorgenannte Firma gemäß § 394 FamFG wegen Vermögenslosigkeit zu löschen. Widerspruch gegen die Löschung kann nur binnen 3 Monaten ab Veröffentlichung dieser Verfügung eingelegt werden."
    },
    {
      "date": "2025-10-21",
      "id": "134767",
      "original_text": "Registerbekanntmachung nach dem Umwandlungsgesetz\nRheinland-Pfalz Amtsgericht Koblenz HRB 31390\nKeralith GmbH – Ochtendung",
      "type": "Registerbekanntmachung nach dem Umwandlungsgesetz",
      "state": "Rheinland-Pfalz",
      "amtsgericht": "Amtsgericht Koblenz",
      "registernummer": "HRB 31390",
      "registerart": "HRB",
      "company_name": "Keralith GmbH",
      "company_seat": "Ochtendung",
      "details": "21.10.2025 (Bekanntmachungsdatum)\n\nRheinland-Pfalz Amtsgericht Koblenz HRB 31390\nRegisterbekanntmachung nach dem Umwandlungsgesetz 21.10.2025 (Eintragungsdatum)\n\nKeralith GmbH\nGesellschaft mit beschränkter Haftung\nOchtendung\n\nAls nicht eingetragen wird veröffentlicht: Den Gläubigern der an der Verschmelzung beteiligten Rechtsträger ist, wenn sie binnen sechs Monaten nach dem Tag, an dem die Eintragung der Verschmelzung in das Register des Sitzes desjenigen Rechtsträgers,dessen Gläubiger sie sind, nach § 19 Abs. 3 UmwG als bekannt gemacht gilt, ihren Anspruch nach Grund und Höhe schriftlich anmelden, Sicherheit zu leisten, soweit sie nicht Befriedigung verlangen können. Dieses Recht steht den Gläubigern jedoch nur zu, wenn sie glaubhaft machen, dass durch die Verschmelzung die Erfüllungd er Forderung gefährdet wird."
    },
    {
      "date": "2025-10-21",
      "id": "134768",
      "original_text": "Löschungsankündigung\nRheinland-Pfalz Amtsgericht Ludwigshafen a.Rhein (Ludwigshafen) HRB 63626\nGeld & Grund Immobilien GmbH – Frankenthal",
      "type": "Löschungsankündigung",
      "state": "Rheinland-Pfalz",
      "amtsgericht": "Amtsgericht Ludwigshafen a.Rhein (Ludwigshafen)",
      "registernummer": "HRB 63626",
      "registerart": "HRB",
      "company_name": "Geld & Grund Immobilien GmbH",
      "company_seat": "Frankenthal",
      "details": "21.10.2025 (Bekanntmachungsdatum)\n\nRheinland-Pfalz Amtsgericht Ludwigshafen a.Rhein (Ludwigshafen) HRB 63626\nLöschungsankündigung\n\nGeld & Grund Immobilien GmbH\nGesellschaft mit beschränkter Haftung\nFrankenthal\n\nDas Registergericht beabsichtigt die Gesellschaft von Amts wegen nach § 394 FamFG zu löschen. Die Frist zur Erhebung eines Widerspruchs ist auf einen Monat festgesetzt."
    },
    {
      "date": "2025-10-21",
      "id": "134769",
      "original_text": "Registerbekanntmachung nach dem Umwandlungsgesetz\nRheinland-Pfalz Amtsgericht Koblenz HRB 15555\nKeralith Verwaltungs-GmbH – Ochtendung",
      "type": "Registerbekanntmachung nach dem Umwandlungsgesetz",
      "state": "Rheinland-Pfalz",
      "amtsgericht": "Amtsgericht Koblenz",
      "registernummer": "HRB 15555",
      "registerart": "HRB",
      "company_name": "Keralith Verwaltungs-GmbH",
      "company_seat": "Ochtendung",
      "details": "21.10.2025 (Bekanntmachungsdatum)\n\nRheinland-Pfalz Amtsgericht Koblenz HRB 15555\nRegisterbekanntmachung nach dem Umwandlungsgesetz 21.10.2025 (Eintragungsdatum)\n\nKeralith Verwaltungs-GmbH\nGesellschaft mit beschränkter Haftung\nOchtendung\n\nDen Gläubigern der an der Verschmelzung beteiligten Rechtsträger ist, wenn sie binnen sechs Monaten nach dem Tag, an dem die Eintragung der Verschmelzung in das Register des Sitzes desjenigen Rechtsträgers,dessen Gläubiger sie sind, nach § 19 Abs. 3 UmwG als bekannt gemacht gilt, ihren Anspruch nach Grund und Höhe schriftlich anmelden, Sicherheit zu leisten, soweit sie nicht Befriedigung verlangen können. Dieses Recht steht den Gläubigern jedoch nur zu, wenn sie glaubhaft machen, dass durch die Verschmelzung die Erfüllungd er Forderung gefährdet wird."
    },
    {
      "date": "2025-10-21",
      "id": "134770",
      "original_text": "Löschungsankündigung\nRheinland-Pfalz Amtsgericht Montabaur HRB 27909\nObjektgesellschaft RVW 18 GmbH – Neuwied",
      "type": "Löschungsankündigung",
      "state": "Rheinland-Pfalz",
      "amtsgericht": "Amtsgericht Montabaur",
      "registernummer": "HRB 27909",
      "registerart": "HRB",
      "company_name": "Objektgesellschaft RVW 18 GmbH",
      "company_seat": "Neuwied",
      "details": "21.10.2025 (Bekanntmachungsdatum)\n\nRheinland-Pfalz Amtsgericht Montabaur HRB 27909\nLöschungsankündigung\n\nObjektgesellschaft RVW 18 GmbH\nGesellschaft mit beschränkter Haftung\nNeuwied\n\nDas Registergericht beabsichtigt nachfolgemde Firma von Amts wegen nach § 394 FamFG zu löschen. Die Frist zur Erhebung eines Widerspruchs ist auf 1 Monat festgesetzt."
    },
    {
      "date": "2025-10-21",
      "id": "134771",
      "original_text": "Registerbekanntmachung nach dem Umwandlungsgesetz\nNordrhein-Westfalen Amtsgericht Bonn HRB 10819\nDr. Brinkmann + Co. Gesellschaft mit beschränkter Haftung – Euskirchen",
      "type": "Registerbekanntmachung nach dem Umwandlungsgesetz",
      "state": "Nordrhein-Westfalen",
      "amtsgericht": "Amtsgericht Bonn",
      "registernummer": "HRB 10819",
      "registerart": "HRB",
      "company_name": "Dr. Brinkmann + Co. Gesellschaft mit beschränkter Haftung",
      "company_seat": "Euskirchen",
      "details": "21.10.2025 (Bekanntmachungsdatum)\n\nNordrhein-Westfalen Amtsgericht Bonn HRB 10819\nRegisterbekanntmachung nach dem Umwandlungsgesetz 21.10.2025 (Eintragungsdatum)\n\nDr. Brinkmann + Co. Gesellschaft mit beschränkter Haftung\nGesellschaft mit beschränkter Haftung\nEuskirchen\n\nDen Gläubigern der an der Verschmelzung beteiligten Rechtsträger ist, wenn sie binnen sechs Monaten nach dem Tag, an dem die Eintragung der Verschmelzung in das Register des Sitzes desjenigen Rechtsträgers, dessen Gläubiger sie sind, nach § 19 Absatz 3 UmwG als bekanntgemacht gilt, ihren Anspruch nach Grund und Höhe schriftlich anmelden, Sicherheit zu leisten, soweit sie nicht Befriedigung verlangen können. Dieses Recht steht den Gläubigern jedoch nur zu, wenn sie glaubhaft machen, dass durch die Verschmelzung die Erfüllung ihrer Forderung gefährdet wird."
    },
    {
      "date": "2025-10-21",
      "id": "134772",
      "original_text": "Registerbekanntmachung nach dem Umwandlungsgesetz\nNordrhein-Westfalen Amtsgericht Duisburg HRA 13659\nMebey Import-Export e.K. – Duisburg",
      "type": "Registerbekanntmachung nach dem Umwandlungsgesetz",
      "state": "Nordrhein-Westfalen",
      "amtsgericht": "Amtsgericht Duisburg",
      "registernummer": "HRA 13659",
      "registerart": "HRA",
      "company_name": "Mebey Import-Export e.K.",
      "company_seat": "Duisburg",
      "details": "21.10.2025 (Bekanntmachungsdatum)\n\nNordrhein-Westfalen Amtsgericht Duisburg HRA 13659\nRegisterbekanntmachung nach dem Umwandlungsgesetz 21.10.2025 (Eintragungsdatum)\n\nMebey Import-Export e.K.\nEinzelkaufmann / Einzelkauffrau\nDuisburg\n\nDie Gesellschaft hat Gläubigern, deren Forderungen vor dieser Bekanntmachung begründet worden sind, Sicherheit zu leisten, soweit sie nicht Befriedigung verlangen können, wenn sie sich binnen sechs Monaten zu diesem Zweck melden."
    },
    {
      "date": "2025-10-21",
      "id": "134773",
      "original_text": "Registerbekanntmachung nach dem Umwandlungsgesetz\nNordrhein-Westfalen Amtsgericht Bonn HRB 11669\nReiner H. Nitschke Verlags-GmbH – Euskirchen",
      "type": "Registerbekanntmachung nach dem Umwandlungsgesetz",
      "state": "Nordrhein-Westfalen",
      "amtsgericht": "Amtsgericht Bonn",
      "registernummer": "HRB 11669",
      "registerart": "HRB",
      "company_name": "Reiner H. Nitschke Verlags-GmbH",
      "company_seat": "Euskirchen",
      "details": "21.10.2025 (Bekanntmachungsdatum)\n\nNordrhein-Westfalen Amtsgericht Bonn HRB 11669\nRegisterbekanntmachung nach dem Umwandlungsgesetz 21.10.2025 (Eintragungsdatum)\n\nReiner H. Nitschke Verlags-GmbH\nGesellschaft mit beschränkter Haftung\nEuskirchen\n\nDen Gläubigern der an der Verschmelzung beteiligten Rechtsträger ist, wenn sie binnen sechs Monaten nach dem Tag, an dem die Eintragung der Verschmelzung in das Register des Sitzes desjenigen Rechtsträgers, dessen Gläubiger sie sind, nach § 19 Absatz 3 UmwG als bekanntgemacht gilt, ihren Anspruch nach Grund und Höhe schriftlich anmelden, Sicherheit zu leisten, soweit sie nicht Befriedigung verlangen können. Dieses Recht steht den Gläubigern jedoch nur zu, wenn sie glaubhaft machen, dass durch die Verschmelzung die Erfüllung ihrer Forderung gefährdet wird."
    },
    {
      "date": "2025-10-21",
      "id": "134774",
      "original_text": "Registerbekanntmachung nach dem Umwandlungsgesetz\nNordrhein-Westfalen Amtsgericht Düsseldorf HRB 84987\nWIR am See GmbH – Ratingen",
      "type": "Registerbekanntmachung nach dem Umwandlungsgesetz",
      "state": "Nordrhein-Westfalen",
      "amtsgericht": "Amtsgericht Düsseldorf",
      "registernummer": "HRB 84987",
      "registerart": "HRB",
      "company_name": "WIR am See GmbH",
      "company_seat": "Ratingen",
      "details": "21.10.2025 (Bekanntmachungsdatum)\n\nNordrhein-Westfalen Amtsgericht Düsseldorf HRB 84987\nRegisterbekanntmachung nach dem Umwandlungsgesetz 21.10.2025 (Eintragungsdatum)\n\nWIR am See GmbH\nGesellschaft mit beschränkter Haftung\nRatingen\n\nDen Gläubigern der an der Verschmelzung beteiligten Rechtsträger ist, wenn sie binnen sechs Monaten nach dem Tag, an dem die Eintragung der Verschmelzung in das Register des Sitzes desjenigen Rechtsträgers, dessen Gläubiger sie sind, nach § 19 Absatz 3 UmwG als bekanntgemacht gilt, ihren Anspruch nach Grund und Höhe schriftlich anmelden, Sicherheit zu leisten, soweit sie nicht Befriedigung verlangen können. Dieses Recht steht den Gläubigern jedoch nur zu, wenn sie glaubhaft machen, dass durch die Verschmelzung die Erfüllung ihrer Forderung gefährdet wird."
    },
    {
      "date": "2025-10-21",
      "id": "134775",
      "original_text": "Löschungsankündigung\nNordrhein-Westfalen Amtsgericht Wuppertal HRB 32397\nCITY CARS WUPPERTAL GmbH – Wuppertal",
      "type": "Löschungsankündigung",
      "state": "Nordrhein-Westfalen",
      "amtsgericht": "Amtsgericht Wuppertal",
      "registernummer": "HRB 32397",
      "registerart": "HRB",
      "company_name": "CITY CARS WUPPERTAL GmbH",
      "company_seat": "Wuppertal",
      "details": "21.10.2025 (Bekanntmachungsdatum)\n\nNordrhein-Westfalen Amtsgericht Wuppertal HRB 32397\nLöschungsankündigung\n\nCITY CARS WUPPERTAL GmbH\nGesellschaft mit beschränkter Haftung\nWuppertal\n\nDas Registergericht beabsichtigt die Gesellschaft von Amts wegen nach § 394 FamFG zu löschen. Die Frist zur Erhebung eines Widerspruchs ist auf einen Monat festgesetzt."
    },
    {
      "date": "2025-10-21",
      "id": "134776",
      "original_text": "Registerbekanntmachung nach dem Umwandlungsgesetz\nNordrhein-Westfalen Amtsgericht Siegburg HRB 15868\nOptik Arndt by Jonen GmbH – Eitorf",
      "type": "Registerbekanntmachung nach dem Umwandlungsgesetz",
      "state": "Nordrhein-Westfalen",
      "amtsgericht": "Amtsgericht Siegburg",
      "registernummer": "HRB 15868",
      "registerart": "HRB",
      "company_name": "Optik Arndt by Jonen GmbH",
      "company_seat": "Eitorf",
      "details": "21.10.2025 (Bekanntmachungsdatum)\n\nNordrhein-Westfalen Amtsgericht Siegburg HRB 15868\nRegisterbekanntmachung nach dem Umwandlungsgesetz 21.10.2025 (Eintragungsdatum)\n\nOptik Arndt by Jonen GmbH\nGesellschaft mit beschränkter Haftung\nEitorf\n\nDen Gläubigern der an der Verschmelzung beteiligten Rechtsträger ist, wenn sie binnen sechs Monaten nach dem Tag, an dem die Eintragung der Verschmelzung in das Register des Sitzes desjenigen Rechtsträgers, dessen Gläubiger sie sind, nach § 19 Absatz 3 UmwG als bekanntgemacht gilt, ihren Anspruch nach Grund und Höhe schriftlich anmelden, Sicherheit zu leisten, soweit sie nicht Befriedigung verlangen können. Dieses Recht steht den Gläubigern jedoch nur zu, wenn sie glaubhaft machen, dass durch die Verschmelzung die Erfüllung ihrer Forderung gefährdet wird."
    },
    {
      "date": "2025-10-21",
      "id": "134777",
      "original_text": "Löschungsankündigung\nNordrhein-Westfalen Amtsgericht Dortmund HRB 34810\nNAG Bau GmbH – Dortmund",
      "type": "Löschungsankündigung",
      "state": "Nordrhein-Westfalen",
      "amtsgericht": "Amtsgericht Dortmund",
      "registernummer": "HRB 34810",
      "registerart": "HRB",
      "company_name": "NAG Bau GmbH",
      "company_seat": "Dortmund",
      "details": "21.10.2025 (Bekanntmachungsdatum)\n\nNordrhein-Westfalen Amtsgericht Dortmund HRB 34810\nLöschungsankündigung\n\nNAG Bau GmbH\nGesellschaft mit beschränkter Haftung\nDortmund\n\nDas Registergericht beabsichtigt die Gesellschaft von Amts wegen nach § 394 FamFG zu löschen. Die Frist zur Erhebung eines Widerspruchs ist auf zwei Monate festgesetzt."
    },
    {
      "date": "2025-10-21",
      "id": "134778",
      "original_text": "Registerbekanntmachung nach dem Umwandlungsgesetz\nNordrhein-Westfalen Amtsgericht Dortmund HRA 17941\nMotido GmbH & Co. KG – Dortmund",
      "type": "Registerbekanntmachung nach dem Umwandlungsgesetz",
      "state": "Nordrhein-Westfalen",
      "amtsgericht": "Amtsgericht Dortmund",
      "registernummer": "HRA 17941",
      "registerart": "HRA",
      "company_name": "Motido GmbH & Co. KG",
      "company_seat": "Dortmund",
      "details": "21.10.2025 (Bekanntmachungsdatum)\n\nNordrhein-Westfalen Amtsgericht Dortmund HRA 17941\nRegisterbekanntmachung nach dem Umwandlungsgesetz 21.10.2025 (Eintragungsdatum)\n\nMotido GmbH & Co. KG\nKommanditgesellschaft\nDortmund\n\nDen Gläubigern der an der formwechselnden Umwandlung beteiligten Rechtsträger ist, wenn sie binnen sechs Monaten nach dem Tag, an dem die Eintragung der formwechselnden Umwandlung in das Register des Sitzes desjenigen Rechtsträgers, dessen Gläubiger sie sind, nach § 19 Absatz 3 UmwG als bekanntgemacht gilt, ihren Anspruch nach Grund und Höhe schriftlich anmelden, Sicherheit zu leisten, soweit sie nicht Befriedigung verlangen können. Dieses Recht steht den Gläubigern jedoch nur zu, wenn sie glaubhaft machen, dass durch die formwechselnden Umwandlung die Erfüllung ihrer Forderung gefährdet wird."
    },
    {
      "date": "2025-10-21",
      "id": "134779",
      "original_text": "Löschungsankündigung\nNordrhein-Westfalen Amtsgericht Essen HRB 35957\nRN Bau GmbH – Essen",
      "type": "Löschungsankündigung",
      "state": "Nordrhein-Westfalen",
      "amtsgericht": "Amtsgericht Essen",
      "registernummer": "HRB 35957",
      "registerart": "HRB",
      "company_name": "RN Bau GmbH",
      "company_seat": "Essen",
      "details": "21.10.2025 (Bekanntmachungsdatum)\n\nNordrhein-Westfalen Amtsgericht Essen HRB 35957\nLöschungsankündigung\n\nRN Bau GmbH\nGesellschaft mit beschränkter Haftung\nEssen\n\nDas Registergericht beabsichtigt die Gesellschaft von Amts wegen nach § 394 FamFG zu löschen. Die Frist zur Erhebung eines Widerspruchs ist auf einen Monat festgesetzt."
    },
    {
      "date": "2025-10-21",
      "id": "134780",
      "original_text": "Registerbekanntmachung nach dem Umwandlungsgesetz\nNordrhein-Westfalen Amtsgericht Köln HRB 105628\nreebate AG – Leverkusen",
      "type": "Registerbekanntmachung nach dem Umwandlungsgesetz",
      "state": "Nordrhein-Westfalen",
      "amtsgericht": "Amtsgericht Köln",
      "registernummer": "HRB 105628",
      "registerart": "HRB",
      "company_name": "reebate AG",
      "company_seat": "Leverkusen",
      "details": "21.10.2025 (Bekanntmachungsdatum)\n\nNordrhein-Westfalen Amtsgericht Köln HRB 105628\nRegisterbekanntmachung nach dem Umwandlungsgesetz 21.10.2025 (Eintragungsdatum)\n\nreebate AG\nAktiengesellschaft\nLeverkusen\n\nDen Gläubigern der an der Verschmelzung beteiligten Rechtsträger ist, wenn sie binnen sechs Monaten nach dem Tag, an dem die Eintragung der Verschmelzung in das Register des Sitzes desjenigen Rechtsträgers, dessen Gläubiger sie sind, nach § 19 Absatz 3 UmwG als bekanntgemacht gilt, ihren Anspruch nach Grund und Höhe schriftlich anmelden, Sicherheit zu leisten, soweit sie nicht Befriedigung verlangen können. Dieses Recht steht den Gläubigern jedoch nur zu, wenn sie glaubhaft machen, dass durch die Verschmelzung die Erfüllung ihrer Forderung gefährdet wird."
    },
    {
      "date": "2025-10-21",
      "id": "134781",
      "original_text": "Löschungsankündigung\nNordrhein-Westfalen Amtsgericht Gelsenkirchen HRB 17956\nPipeMont GmbH – Gelsenkirchen",
      "type": "Löschungsankündigung",
      "state": "Nordrhein-Westfalen",
      "amtsgericht": "Amtsgericht Gelsenkirchen",
      "registernummer": "HRB 17956",
      "registerart": "HRB",
      "company_name": "PipeMont GmbH",
      "company_seat": "Gelsenkirchen",
      "details": "21.10.2025 (Bekanntmachungsdatum)\n\nNordrhein-Westfalen Amtsgericht Gelsenkirchen HRB 17956\nLöschungsankündigung\n\nPipeMont GmbH\nGesellschaft mit beschränkter Haftung\nGelsenkirchen\n\nDas Gericht beabsichtigt, die im Handelsregister eingetragene PipeMont GmbH mit Sitz in Gelsenkirchen, HRB 17956, Amtsgericht Gelsenkirchen, wegen Vermögenslosigkeit zu löschen.\nHiermit wird denjenigen, die an der Unterlassung der Löschung ein berechtigtes Interesse haben, gem. § 394 Abs. 2 FamFG Gelegenheit gegeben, gegen dieses Vorhaben binnen eines Monats nach dieser Bekanntmachung Widerspruch einzulegen. Der Widerspruch kann schriftlich oder zu Protokoll der Geschäftsstelle erhoben werden."
    },
    {
      "date": "2025-10-21",
      "id": "134782",
      "original_text": "Registerbekanntmachung nach dem Umwandlungsgesetz\nNordrhein-Westfalen Amtsgericht Bochum HRA 8149\nFleischerei Wohlfahrt e. K., Inh. Mirco Wohlfahrt – Bochum",
      "type": "Registerbekanntmachung nach dem Umwandlungsgesetz",
      "state": "Nordrhein-Westfalen",
      "amtsgericht": "Amtsgericht Bochum",
      "registernummer": "HRA 8149",
      "registerart": "HRA",
      "company_name": "Fleischerei Wohlfahrt e. K., Inh. Mirco Wohlfahrt",
      "company_seat": "Bochum",
      "details": "21.10.2025 (Bekanntmachungsdatum)\n\nNordrhein-Westfalen Amtsgericht Bochum HRA 8149\nRegisterbekanntmachung nach dem Umwandlungsgesetz 17.09.2025 (Eintragungsdatum)\n\nFleischerei Wohlfahrt e. K., Inh. Mirco Wohlfahrt\nEinzelkaufmann / Einzelkauffrau\nBochum\n\nDen Gläubigern der an der Verschmelzung beteiligten Rechtsträger ist, wenn sie binnen sechs Monaten nach dem Tag, an dem die Eintragung der Verschmelzung in das Register des Sitzes desjenigen Rechtsträgers, dessen Gläubiger sie sind, nach § 19 Absatz 3 UmwG als bekanntgemacht gilt, ihren Anspruch nach Grund und Höhe schriftlich anmelden, Sicherheit zu leisten, soweit sie nicht Befriedigung verlangen können. Dieses Recht steht den Gläubigern jedoch nur zu, wenn sie glaubhaft machen, dass durch die Verschmelzung die Erfüllung ihrer Forderung gefährdet wird."
    },
    {
      "date": "2025-10-21",
      "id": "134783",
      "original_text": "Registerbekanntmachung nach dem Umwandlungsgesetz\nNordrhein-Westfalen Amtsgericht Hagen HRA 6645\nBehije Hyseni e.K. – Schwelm",
      "type": "Registerbekanntmachung nach dem Umwandlungsgesetz",
      "state": "Nordrhein-Westfalen",
      "amtsgericht": "Amtsgericht Hagen",
      "registernummer": "HRA 6645",
      "registerart": "HRA",
      "company_name": "Behije Hyseni e.K.",
      "company_seat": "Schwelm",
      "details": "21.10.2025 (Bekanntmachungsdatum)\n\nNordrhein-Westfalen Amtsgericht Hagen HRA 6645\nRegisterbekanntmachung nach dem Umwandlungsgesetz 21.10.2025 (Eintragungsdatum)\n\nBehije Hyseni e.K.\nEinzelkaufmann / Einzelkauffrau\nSchwelm\n\nDen Gläubigern der an der Ausgliederung beteiligten Rechtsträger ist, wenn sie binnen sechs Monaten nach dem Tag, an dem die Eintragung der Ausgliederung in das Register des Sitzes desjenigen Rechtsträgers, dessen Gläubiger sie sind, nach § 19 Absatz 3 UmwG als bekanntgemacht gilt, ihren Anspruch nach Grund und Höhe schriftlich anmelden, Sicherheit zu leisten, soweit sie nicht Befriedigung verlangen können. Dieses Recht steht den Gläubigern jedoch nur zu, wenn sie glaubhaft machen, dass durch die Ausgliederung die Erfüllung ihrer Forderung gefährdet wird."
    },
    {
      "date": "2025-10-21",
      "id": "134784",
      "original_text": "Registerbekanntmachung nach dem Umwandlungsgesetz\nNordrhein-Westfalen Amtsgericht Düsseldorf HRB 85114\nKondor Wessels Seepromenade Kettwig GmbH – Ratingen",
      "type": "Registerbekanntmachung nach dem Umwandlungsgesetz",
      "state": "Nordrhein-Westfalen",
      "amtsgericht": "Amtsgericht Düsseldorf",
      "registernummer": "HRB 85114",
      "registerart": "HRB",
      "company_name": "Kondor Wessels Seepromenade Kettwig GmbH",
      "company_seat": "Ratingen",
      "details": "21.10.2025 (Bekanntmachungsdatum)\n\nNordrhein-Westfalen Amtsgericht Düsseldorf HRB 85114\nRegisterbekanntmachung nach dem Umwandlungsgesetz 21.10.2025 (Eintragungsdatum)\n\nKondor Wessels Seepromenade Kettwig GmbH\nGesellschaft mit beschränkter Haftung\nRatingen\n\nDen Gläubigern der an der Verschmelzung beteiligten Rechtsträger ist, wenn sie binnen sechs Monaten nach dem Tag, an dem die Eintragung der Verschmelzung in das Register des Sitzes desjenigen Rechtsträgers, dessen Gläubiger sie sind, nach § 19 Absatz 3 UmwG als bekanntgemacht gilt, ihren Anspruch nach Grund und Höhe schriftlich anmelden, Sicherheit zu leisten, soweit sie nicht Befriedigung verlangen können. Dieses Recht steht den Gläubigern jedoch nur zu, wenn sie glaubhaft machen, dass durch die Verschmelzung die Erfüllung ihrer Forderung gefährdet wird."
    },
    {
      "date": "2025-10-21",
      "id": "134785",
      "original_text": "Registerbekanntmachung nach dem Umwandlungsgesetz\nNordrhein-Westfalen Amtsgericht Dortmund HRB 37696\nF + A Vermögensverwaltung GmbH – Lünen",
      "type": "Registerbekanntmachung nach dem Umwandlungsgesetz",
      "state": "Nordrhein-Westfalen",
      "amtsgericht": "Amtsgericht Dortmund",
      "registernummer": "HRB 37696",
      "registerart": "HRB",
      "company_name": "F + A Vermögensverwaltung GmbH",
      "company_seat": "Lünen",
      "details": "21.10.2025 (Bekanntmachungsdatum)\n\nNordrhein-Westfalen Amtsgericht Dortmund HRB 37696\nRegisterbekanntmachung nach dem Umwandlungsgesetz 21.10.2025 (Eintragungsdatum)\n\nF + A Vermögensverwaltung GmbH\nGesellschaft mit beschränkter Haftung\nLünen\n\nDen Gläubigern der an der formwechselnden Umwandlung beteiligten Rechtsträger ist, wenn sie binnen sechs Monaten nach dem Tag, an dem die Eintragung der formwechselnden Umwandlung in das Register des Sitzes derjenigen Rechtsträger deren Gläubiger sie sind, nach § 19 Absatz 3 UmwG als bekanntgemacht gilt, ihren Anspruch nach Grund und Höhe schriftlich anmelden, Sicherheit zu leisten, soweit sie nicht Befriedigung verlangen können. Dieses Recht steht den Gläubigern jedoch nur zu, wenn sie glaubhaft machen, dass durch die formwechselnden Umwandlung die Erfüllung ihrer Forderung gefährdet wird."
    },
    {
      "date": "2025-10-21",
      "id": "134786",
      "original_text": "Einreichung neuer Dokumente\nNordrhein-Westfalen Amtsgericht Duisburg HRB 14256\nSiebtechnik GmbH – Mülheim an der Ruhr",
      "type": "Einreichung neuer Dokumente",
      "state": "Nordrhein-Westfalen",
      "amtsgericht": "Amtsgericht Duisburg",
      "registernummer": "HRB 14256",
      "registerart": "HRB",
      "company_name": "Siebtechnik GmbH",
      "company_seat": "Mülheim an der Ruhr",
      "details": "21.10.2025 (Bekanntmachungsdatum)\n\nNordrhein-Westfalen Amtsgericht Duisburg HRB 14256\nEinreichung neuer Dokumente\n\nSiebtechnik GmbH\nGesellschaft mit beschränkter Haftung\nMülheim an der Ruhr\n\nDem Registergericht ist eine neue Liste der Mitglieder des Aufsichtsrates eingereicht worden."
    },
    {
      "date": "2025-10-21",
      "id": "134787",
      "original_text": "Löschungsankündigung\nNordrhein-Westfalen Amtsgericht Essen HRB 34644\nCL Auto GmbH – Essen",
      "type": "Löschungsankündigung",
      "state": "Nordrhein-Westfalen",
      "amtsgericht": "Amtsgericht Essen",
      "registernummer": "HRB 34644",
      "registerart": "HRB",
      "company_name": "CL Auto GmbH",
      "company_seat": "Essen",
      "details": "21.10.2025 (Bekanntmachungsdatum)\n\nNordrhein-Westfalen Amtsgericht Essen HRB 34644\nLöschungsankündigung\n\nCL Auto GmbH\nGesellschaft mit beschränkter Haftung\nEssen\n\nDas Registergericht beabsichtigt die Gesellschaft von Amts wegen nach § 394 FamFG zu löschen. Die Frist zur Erhebung eines Widerspruchs ist auf einen Monat festgesetzt."
    },
    {
      "date": "2025-10-21",
      "id": "134788",
      "original_text": "Registerbekanntmachung nach dem Umwandlungsgesetz\nNordrhein-Westfalen Amtsgericht Bonn HRB 10944\nMöbel Wachendorf GmbH – Euskirchen",
      "type": "Registerbekanntmachung nach dem Umwandlungsgesetz",
      "state": "Nordrhein-Westfalen",
      "amtsgericht": "Amtsgericht Bonn",
      "registernummer": "HRB 10944",
      "registerart": "HRB",
      "company_name": "Möbel Wachendorf GmbH",
      "company_seat": "Euskirchen",
      "details": "21.10.2025 (Bekanntmachungsdatum)\n\nNordrhein-Westfalen Amtsgericht Bonn HRB 10944\nRegisterbekanntmachung nach dem Umwandlungsgesetz 21.10.2025 (Eintragungsdatum)\n\nMöbel Wachendorf GmbH\nGesellschaft mit beschränkter Haftung\nEuskirchen\n\nDen Gläubigern der an der Verschmelzung beteiligten Rechtsträger ist, wenn sie binnen sechs Monaten nach dem Tag, an dem die Eintragung der Verschmelzung in das Register des Sitzes desjenigen Rechtsträgers, dessen Gläubiger sie sind, nach § 19 Absatz 3 UmwG als bekanntgemacht gilt, ihren Anspruch nach Grund und Höhe schriftlich anmelden, Sicherheit zu leisten, soweit sie nicht Befriedigung verlangen können. Dieses Recht steht den Gläubigern jedoch nur zu, wenn sie glaubhaft machen, dass durch die Verschmelzung die Erfüllung ihrer Forderung gefährdet wird."
    },
    {
      "date": "2025-10-21",
      "id": "134789",
      "original_text": "Löschungsankündigung\nNordrhein-Westfalen Amtsgericht Wuppertal HRB 33612\nM H Tankstellen GmbH – Haan",
      "type": "Löschungsankündigung",
      "state": "Nordrhein-Westfalen",
      "amtsgericht": "Amtsgericht Wuppertal",
      "registernummer": "HRB 33612",
      "registerart": "HRB",
      "company_name": "M H Tankstellen GmbH",
      "company_seat": "Haan",
      "details": "21.10.2025 (Bekanntmachungsdatum)\n\nNordrhein-Westfalen Amtsgericht Wuppertal HRB 33612\nLöschungsankündigung\n\nM H Tankstellen GmbH\nGesellschaft mit beschränkter Haftung\nHaan\n\nDas Registergericht beabsichtigt die Gesellschaft von Amts wegen nach § 394 FamFG zu löschen. Die Frist zur Erhebung eines Widerspruchs ist auf einen Monat festgesetzt."
    },
    {
      "date": "2025-10-21",
      "id": "134790",
      "original_text": "Löschungsankündigung\nNordrhein-Westfalen Amtsgericht Siegburg HRB 17179\nLoft9 Tattoo Unternehmergesellschaft (haftungsbeschränkt) – Troisdorf",
      "type": "Löschungsankündigung",
      "state": "Nordrhein-Westfalen",
      "amtsgericht": "Amtsgericht Siegburg",
      "registernummer": "HRB 17179",
      "registerart": "HRB",
      "company_name": "Loft9 Tattoo Unternehmergesellschaft (haftungsbeschränkt)",
      "company_seat": "Troisdorf",
      "details": "21.10.2025 (Bekanntmachungsdatum)\n\nNordrhein-Westfalen Amtsgericht Siegburg HRB 17179\nLöschungsankündigung\n\nLoft9 Tattoo Unternehmergesellschaft (haftungsbeschränkt)\nGesellschaft mit beschränkter Haftung\nTroisdorf\n\nDas Registergericht hat glaubhafte Kenntnis erlangt, dass die Gesellschaft vermögenslos geworden ist.\n\nEs ist daher beabsichtigt, die Gesellschaft nach § 394 FamFG im Handelsregister wegen Vermögenslosigkeit zu löschen.\nEinwände gegen die Löschung sind durch Widerspruch binnen einer Frist von 3 Monaten geltend zu machen, andernfalls die Löschung erfolgen wird.\n\nEinzulegen ist der Widerspruch bei dem Amtsgericht Siegburg, Neue Poststraße 16, 53721 Siegburg, und zwar entweder schriftlich in deutscher Sprache oder mündlich zur Niederschrift der Geschäftsstelle. Der Widerspruch kann auch zur Niederschrift der Geschäftsstelle eines jeden Amtsgerichts abgegeben werden. Der Widerspruch ist binnen der in der Verfügung bestimmten Frist einzulegen. Die Frist ist nur gewahrt, wenn der Widerspruch rechtzeitig bei dem Amtsgericht Siegburg eingeht, auch wenn der Widerspruch zur Niederschrift der Geschäftsstelle eines anderen Amtsgerichts abgegeben wurde. Die Frist beginnt jeweils mit der schriftlichen Bekanntgabe der Verfügung an die Beteiligten. Kann die schriftliche Bekanntgabe an einen Beteiligten nicht bewirkt werden, beginnt die Frist spätestens mit Ablauf von fünf Monaten nach Erlass der Verfügung. Die Bekanntgabe ist entweder durch Zustellung oder am dritten Tage nach Aufgabe zur Post bewirkt. Sofern die Löschung noch nicht erfolgt ist, kann der Widerspruch auch noch nach Ablauf der Frist eingelegt werden. Fällt das Ende der Frist auf einen Sonnabend, einen Sonntag oder einen allgemeinen Feiertag, endet die Frist mit Ablauf des nächsten Werktages. Der Widerspruch ist zu unterzeichnen. Eine Begründung des Widerspruchs ist nicht vorgeschrieben."
    },
    {
      "date": "2025-10-21",
      "id": "134791",
      "original_text": "Registerbekanntmachung nach dem Umwandlungsgesetz\nNordrhein-Westfalen Amtsgericht Iserlohn HRB 11418\nSchulte-Maas Landschaftsbau GmbH – Neuenrade",
      "type": "Registerbekanntmachung nach dem Umwandlungsgesetz",
      "state": "Nordrhein-Westfalen",
      "amtsgericht": "Amtsgericht Iserlohn",
      "registernummer": "HRB 11418",
      "registerart": "HRB",
      "company_name": "Schulte-Maas Landschaftsbau GmbH",
      "company_seat": "Neuenrade",
      "details": "21.10.2025 (Bekanntmachungsdatum)\n\nNordrhein-Westfalen Amtsgericht Iserlohn HRB 11418\nRegisterbekanntmachung nach dem Umwandlungsgesetz 20.10.2025 (Eintragungsdatum)\n\nSchulte-Maas Landschaftsbau GmbH\nGesellschaft mit beschränkter Haftung\nNeuenrade\n\nDen Gläubigern der an der Ausgliederung beteiligten Rechtsträger ist, wenn sie binnen sechs Monaten nach dem Tag, an dem die Eintragung der Ausgliederung in das Register des Sitzes desjenigen Rechtsträgers, dessen Gläubiger sie sind, nach § 19 Absatz 3 UmwG als bekanntgemacht gilt, ihren Anspruch nach Grund und Höhe schriftlich anmelden, Sicherheit zu leisten, soweit sie nicht Befriedigung verlangen können. Dieses Recht steht den Gläubigern jedoch nur zu, wenn sie glaubhaft machen, dass durch die Ausgliederung die Erfüllung ihrer Forderung gefährdet wird."
    },
    {
      "date": "2025-10-21",
      "id": "134792",
      "original_text": "Registerbekanntmachung nach dem Umwandlungsgesetz\nNordrhein-Westfalen Amtsgericht Duisburg HRB 39650\nMEBEY GmbH – Duisburg",
      "type": "Registerbekanntmachung nach dem Umwandlungsgesetz",
      "state": "Nordrhein-Westfalen",
      "amtsgericht": "Amtsgericht Duisburg",
      "registernummer": "HRB 39650",
      "registerart": "HRB",
      "company_name": "MEBEY GmbH",
      "company_seat": "Duisburg",
      "details": "21.10.2025 (Bekanntmachungsdatum)\n\nNordrhein-Westfalen Amtsgericht Duisburg HRB 39650\nRegisterbekanntmachung nach dem Umwandlungsgesetz 21.10.2025 (Eintragungsdatum)\n\nMEBEY GmbH\nGesellschaft mit beschränkter Haftung\nDuisburg\n\nDie Gesellschaft hat Gläubigern, deren Forderungen vor dieser Bekanntmachung begründet worden sind, Sicherheit zu leisten, soweit sie nicht Befriedigung verlangen können, wenn sie sich binnen sechs Monaten zu diesem Zweck melden."
    },
    {
      "date": "2025-10-21",
      "id": "134793",
      "original_text": "Registerbekanntmachung nach dem Umwandlungsgesetz\nNordrhein-Westfalen Amtsgericht Dortmund VR 1757\n\" Westfälischer Fechter Bund e.V.\" ( W.F.B.) – Dortmund",
      "type": "Registerbekanntmachung nach dem Umwandlungsgesetz",
      "state": "Nordrhein-Westfalen",
      "amtsgericht": "Amtsgericht Dortmund",
      "registernummer": "VR 1757",
      "registerart": "VR",
      "company_name": "\" Westfälischer Fechter Bund e.V.\" ( W.F.B.)",
      "company_seat": "Dortmund",
      "details": "21.10.2025 (Bekanntmachungsdatum)\n\nNordrhein-Westfalen Amtsgericht Dortmund VR 1757\nRegisterbekanntmachung nach dem Umwandlungsgesetz\n\n\" Westfälischer Fechter Bund e.V.\" ( W.F.B.)\neingetragener Verein\nDortmund\n\nDen Gläubigern der an der Verschmelzung beteiligten Rechtsträger ist, wenn sie binnen sechs Monaten nach dem Tag, an dem die Eintragung der Verschmelzung desjenigen Rechtsträgers, dessen Gläubiger sie sind, nach § 19 Absatz 3 UmwG als bekanntgemacht gilt, ihren Anspruch nach Grund und Höhe schriftlich anmelden, Sicherheit zu leisten, soweit sie nicht Befriedigung verlangen können. Dieses Recht steht den Gläubigern jedoch nur zu, wenn sie glaubhaft machen, dass durch die Verschmelzung die Erfüllung ihrer Forderung gefährdet wird."
    },
    {
      "date": "2025-10-21",
      "id": "134794",
      "original_text": "Einreichung neuer Dokumente\nNordrhein-Westfalen Amtsgericht Düsseldorf HRB 41871\nGMG Gesundheitsmanagementgesellschaft mbH – Düsseldorf",
      "type": "Einreichung neuer Dokumente",
      "state": "Nordrhein-Westfalen",
      "amtsgericht": "Amtsgericht Düsseldorf",
      "registernummer": "HRB 41871",
      "registerart": "HRB",
      "company_name": "GMG Gesundheitsmanagementgesellschaft mbH",
      "company_seat": "Düsseldorf",
      "details": "21.10.2025 (Bekanntmachungsdatum)\n\nNordrhein-Westfalen Amtsgericht Düsseldorf HRB 41871\nEinreichung neuer Dokumente\n\nGMG Gesundheitsmanagementgesellschaft mbH\nGesellschaft mit beschränkter Haftung\nDüsseldorf\n\nDem Registergericht ist eine neue Liste der Mitglieder des Aufsichtsrates eingereicht worden."
    },
    {
      "date": "2025-10-21",
      "id": "134795",
      "original_text": "Einreichung neuer Dokumente\nNordrhein-Westfalen Amtsgericht Düsseldorf HRB 37996\nITERGO Informationstechnologie GmbH – Düsseldorf",
      "type": "Einreichung neuer Dokumente",
      "state": "Nordrhein-Westfalen",
      "amtsgericht": "Amtsgericht Düsseldorf",
      "registernummer": "HRB 37996",
      "registerart": "HRB",
      "company_name": "ITERGO Informationstechnologie GmbH",
      "company_seat": "Düsseldorf",
      "details": "21.10.2025 (Bekanntmachungsdatum)\n\nNordrhein-Westfalen Amtsgericht Düsseldorf HRB 37996\nEinreichung neuer Dokumente\n\nITERGO Informationstechnologie GmbH\nGesellschaft mit beschränkter Haftung\nDüsseldorf\n\nDem Registergericht ist eine neue Liste der Mitglieder des Aufsichtsrates eingereicht worden."
    },
    {
      "date": "2025-10-21",
      "id": "134796",
      "original_text": "Registerbekanntmachung nach dem Umwandlungsgesetz\nNordrhein-Westfalen Amtsgericht Düsseldorf HRB 84969\nKondor Wessels Grundstücksverwaltung NRW GmbH – Ratingen",
      "type": "Registerbekanntmachung nach dem Umwandlungsgesetz",
      "state": "Nordrhein-Westfalen",
      "amtsgericht": "Amtsgericht Düsseldorf",
      "registernummer": "HRB 84969",
      "registerart": "HRB",
      "company_name": "Kondor Wessels Grundstücksverwaltung NRW GmbH",
      "company_seat": "Ratingen",
      "details": "21.10.2025 (Bekanntmachungsdatum)\n\nNordrhein-Westfalen Amtsgericht Düsseldorf HRB 84969\nRegisterbekanntmachung nach dem Umwandlungsgesetz 21.10.2025 (Eintragungsdatum)\n\nKondor Wessels Grundstücksverwaltung NRW GmbH\nGesellschaft mit beschränkter Haftung\nRatingen\n\nDen Gläubigern der an der Verschmelzung beteiligten Rechtsträger ist, wenn sie binnen sechs Monaten nach dem Tag, an dem die Eintragung der Verschmelzung in das Register des Sitzes desjenigen Rechtsträgers, dessen Gläubiger sie sind, nach § 19 Absatz 3 UmwG als bekanntgemacht gilt, ihren Anspruch nach Grund und Höhe schriftlich anmelden, Sicherheit zu leisten, soweit sie nicht Befriedigung verlangen können. Dieses Recht steht den Gläubigern jedoch nur zu, wenn sie glaubhaft machen, dass durch die Verschmelzung die Erfüllung ihrer Forderung gefährdet wird."
    },
    {
      "date": "2025-10-21",
      "id": "134797",
      "original_text": "Registerbekanntmachung nach dem Umwandlungsgesetz\nNordrhein-Westfalen Amtsgericht Aachen HRB 15487\nLandmarken Pontviertel GmbH – Aachen",
      "type": "Registerbekanntmachung nach dem Umwandlungsgesetz",
      "state": "Nordrhein-Westfalen",
      "amtsgericht": "Amtsgericht Aachen",
      "registernummer": "HRB 15487",
      "registerart": "HRB",
      "company_name": "Landmarken Pontviertel GmbH",
      "company_seat": "Aachen",
      "details": "21.10.2025 (Bekanntmachungsdatum)\n\nNordrhein-Westfalen Amtsgericht Aachen HRB 15487\nRegisterbekanntmachung nach dem Umwandlungsgesetz 21.10.2025 (Eintragungsdatum)\n\nLandmarken Pontviertel GmbH\nGesellschaft mit beschränkter Haftung\nAachen\n\nDen Gläubigern der an der Verschmelzung beteiligten Rechtsträger ist, wenn sie binnen sechs Monaten nach dem Tag, an dem die Eintragung der Verschmelzung in das Register des Sitzes desjenigen Rechtsträgers, dessen Gläubiger sie sind, nach § 19 Absatz 3 UmwG als bekanntgemacht gilt, ihren Anspruch nach Grund und Höhe schriftlich anmelden, Sicherheit zu leisten, soweit sie nicht Befriedigung verlangen können. Dieses Recht steht den Gläubigern jedoch nur zu, wenn sie glaubhaft machen, dass durch die Verschmelzung die Erfüllung ihrer Forderung gefährdet wird."
    },
    {
      "date": "2025-10-21",
      "id": "134798",
      "original_text": "Registerbekanntmachung nach dem Umwandlungsgesetz\nNordrhein-Westfalen Amtsgericht Köln GsR 2277\nDatAds eGbR – Köln",
      "type": "Registerbekanntmachung nach dem Umwandlungsgesetz",
      "state": "Nordrhein-Westfalen",
      "amtsgericht": "Amtsgericht Köln",
      "registernummer": "GsR 2277",
      "registerart": "GsR",
      "company_name": "DatAds eGbR",
      "company_seat": "Köln",
      "details": "21.10.2025 (Bekanntmachungsdatum)\n\nNordrhein-Westfalen Amtsgericht Köln GsR 2277\nRegisterbekanntmachung nach dem Umwandlungsgesetz 21.10.2025 (Eintragungsdatum)\n\nDatAds eGbR\nGesellschaft bürgerlichen Rechts\nKöln\n\nDen Gläubigern der an der formwechselnden Umwandlung beteiligten Rechtsträger ist, wenn sie binnen sechs Monaten nach dem Tag, an dem die Eintragung der formwechselnden Umwandlung in das Register des Sitzes desjenigen Rechtsträgers, dessen Gläubiger sie sind, nach § 19 Absatz 3 UmwG als bekanntgemacht gilt, ihren Anspruch nach Grund und Höhe schriftlich anmelden, Sicherheit zu leisten, soweit sie nicht Befriedigung verlangen können. Dieses Recht steht den Gläubigern jedoch nur zu, wenn sie glaubhaft machen, dass durch die formwechselnden Umwandlung die Erfüllung ihrer Forderung gefährdet wird."
    },
    {
      "date": "2025-10-21",
      "id": "134799",
      "original_text": "Registerbekanntmachung nach dem Umwandlungsgesetz\nNordrhein-Westfalen Amtsgericht Bonn HRB 19197\nIVS Initiativer Verwaltungsservice GmbH – Bonn",
      "type": "Registerbekanntmachung nach dem Umwandlungsgesetz",
      "state": "Nordrhein-Westfalen",
      "amtsgericht": "Amtsgericht Bonn",
      "registernummer": "HRB 19197",
      "registerart": "HRB",
      "company_name": "IVS Initiativer Verwaltungsservice GmbH",
      "company_seat": "Bonn",
      "details": "21.10.2025 (Bekanntmachungsdatum)\n\nNordrhein-Westfalen Amtsgericht Bonn HRB 19197\nRegisterbekanntmachung nach dem Umwandlungsgesetz 21.10.2025 (Eintragungsdatum)\n\nIVS Initiativer Verwaltungsservice GmbH\nGesellschaft mit beschränkter Haftung\nBonn\n\nDen Gläubigern der an der formwechselnden Umwandlung beteiligten Rechtsträger ist, wenn sie binnen sechs Monaten nach dem Tag, an dem die Eintragung der formwechselnden Umwandlung in das Register des Sitzes desjenigen Rechtsträgers, dessen Gläubiger sie sind, nach § 19 Absatz 3 UmwG als bekanntgemacht gilt, ihren Anspruch nach Grund und Höhe schriftlich anmelden, Sicherheit zu leisten, soweit sie nicht Befriedigung verlangen können. Dieses Recht steht den Gläubigern jedoch nur zu, wenn sie glaubhaft machen, dass durch die formwechselnden Umwandlung die Erfüllung ihrer Forderung gefährdet wird."
    },
    {
      "date": "2025-10-21",
      "id": "134800",
      "original_text": "Löschungsankündigung\nNordrhein-Westfalen Amtsgericht Dortmund HRB 30296\nUpperclass Movement UG (haftungsbeschränkt) – Dortmund",
      "type": "Löschungsankündigung",
      "state": "Nordrhein-Westfalen",
      "amtsgericht": "Amtsgericht Dortmund",
      "registernummer": "HRB 30296",
      "registerart": "HRB",
      "company_name": "Upperclass Movement UG (haftungsbeschränkt)",
      "company_seat": "Dortmund",
      "details": "21.10.2025 (Bekanntmachungsdatum)\n\nNordrhein-Westfalen Amtsgericht Dortmund HRB 30296\nLöschungsankündigung\n\nUpperclass Movement UG (haftungsbeschränkt)\nGesellschaft mit beschränkter Haftung\nDortmund\n\nDas Registergericht beabsichtigt die Gesellschaft von Amts wegen nach § 394 FamFG zu löschen. Die Frist zur Erhebung eines Widerspruchs ist auf zwei Monate festgesetzt."
    },
    {
      "date": "2025-10-21",
      "id": "134801",
      "original_text": "Registerbekanntmachung nach dem Umwandlungsgesetz\nNordrhein-Westfalen Amtsgericht Krefeld HRB 21018\nARUS Versicherungs-Vermittlungsgesellschaft mbH – Nettetal-Kaldenkirchen",
      "type": "Registerbekanntmachung nach dem Umwandlungsgesetz",
      "state": "Nordrhein-Westfalen",
      "amtsgericht": "Amtsgericht Krefeld",
      "registernummer": "HRB 21018",
      "registerart": "HRB",
      "company_name": "ARUS Versicherungs-Vermittlungsgesellschaft mbH",
      "company_seat": "Nettetal-Kaldenkirchen",
      "details": "21.10.2025 (Bekanntmachungsdatum)\n\nNordrhein-Westfalen Amtsgericht Krefeld HRB 21018\nRegisterbekanntmachung nach dem Umwandlungsgesetz 21.10.2025 (Eintragungsdatum)\n\nARUS Versicherungs-Vermittlungsgesellschaft mbH\nGesellschaft mit beschränkter Haftung\nNettetal-Kaldenkirchen\n\nDen Gläubigern der an der Verschmelzung beteiligten Rechtsträger ist, wenn sie binnen sechs Monaten nach dem Tag, an dem die Eintragung der Verschmelzung in das Register des Sitzes derjenigen Rechtsträger deren Gläubiger sie sind, nach § 19 Absatz 3 UmwG als bekanntgemacht gilt, ihren Anspruch nach Grund und Höhe schriftlich anmelden, Sicherheit zu leisten, soweit sie nicht Befriedigung verlangen können. Dieses Recht steht den Gläubigern jedoch nur zu, wenn sie glaubhaft machen, dass durch die Verschmelzung die Erfüllung ihrer Forderung gefährdet wird."
    },
    {
      "date": "2025-10-21",
      "id": "134802",
      "original_text": "Sonstige Registerbekanntmachung\nNordrhein-Westfalen Amtsgericht Mönchengladbach HRB 1747\nSantander Consumer Bank Aktiengesellschaft – Mönchengladbach",
      "type": "Sonstige Registerbekanntmachung",
      "state": "Nordrhein-Westfalen",
      "amtsgericht": "Amtsgericht Mönchengladbach",
      "registernummer": "HRB 1747",
      "registerart": "HRB",
      "company_name": "Santander Consumer Bank Aktiengesellschaft",
      "company_seat": "Mönchengladbach",
      "details": "21.10.2025 (Bekanntmachungsdatum)\n\nNordrhein-Westfalen Amtsgericht Mönchengladbach HRB 1747\nSonstige Registerbekanntmachung\n\nSantander Consumer Bank Aktiengesellschaft\nAktiengesellschaft\nMönchengladbach\n\n106 AktG\nDem Registergericht ist eine Liste der Mitglieder des Aufsichtsrates eingereicht worden."
    },
    {
      "date": "2025-10-21",
      "id": "134803",
      "original_text": "Registerbekanntmachung nach dem Umwandlungsgesetz\nNordrhein-Westfalen Amtsgericht Köln HRB 38417\nKienbaum Real Estate GmbH – Köln",
      "type": "Registerbekanntmachung nach dem Umwandlungsgesetz",
      "state": "Nordrhein-Westfalen",
      "amtsgericht": "Amtsgericht Köln",
      "registernummer": "HRB 38417",
      "registerart": "HRB",
      "company_name": "Kienbaum Real Estate GmbH",
      "company_seat": "Köln",
      "details": "21.10.2025 (Bekanntmachungsdatum)\n\nNordrhein-Westfalen Amtsgericht Köln HRB 38417\nRegisterbekanntmachung nach dem Umwandlungsgesetz 21.10.2025 (Eintragungsdatum)\n\nKienbaum Real Estate GmbH\nGesellschaft mit beschränkter Haftung\nKöln\n\nDen Gläubigern der an der Abspaltung beteiligten Rechtsträger ist, wenn sie binnen sechs Monaten nach dem Tag, an dem die Eintragung der Abspaltung in das Register des Sitzes desjenigen Rechtsträgers, dessen Gläubiger sie sind, nach § 19 Absatz 3 UmwG als bekanntgemacht gilt, ihren Anspruch nach Grund und Höhe schriftlich anmelden, Sicherheit zu leisten, soweit sie nicht Befriedigung verlangen können. Dieses Recht steht den Gläubigern jedoch nur zu, wenn sie glaubhaft machen, dass durch die Abspaltung die Erfüllung ihrer Forderung gefährdet wird."
    },
    {
      "date": "2025-10-21",
      "id": "134804",
      "original_text": "Registerbekanntmachung nach dem Umwandlungsgesetz\nHessen Amtsgericht Frankfurt am Main HRB 123975\nBaker McKenzie Rechtsanwaltsgesellschaft mbH von Rechtsanwälten und Steuerberatern – Frankfurt am Main",
      "type": "Registerbekanntmachung nach dem Umwandlungsgesetz",
      "state": "Hessen",
      "amtsgericht": "Amtsgericht Frankfurt am Main",
      "registernummer": "HRB 123975",
      "registerart": "HRB",
      "company_name": "Baker McKenzie Rechtsanwaltsgesellschaft mbH von Rechtsanwälten und Steuerberatern",
      "company_seat": "Frankfurt am Main",
      "details": "21.10.2025 (Bekanntmachungsdatum)\n\nHessen Amtsgericht Frankfurt am Main HRB 123975\nRegisterbekanntmachung nach dem Umwandlungsgesetz 21.10.2025 (Eintragungsdatum)\n\nBaker McKenzie Rechtsanwaltsgesellschaft mbH von Rechtsanwälten und Steuerberatern\nGesellschaft mit beschränkter Haftung\nFrankfurt am Main\n\nDen Gläubigern der an der Verschmelzung beteiligten Rechtsträger ist, wenn sie binnen sechs Monaten nach dem Tag, an dem die Eintragung der Verschmelzung in das Register des Sitzes desjenigen Rechtsträgers, dessen Gläubiger sie sind, nach § 19 Absatz 3 UmwG bekannt gemacht worden ist, ihren Anspruch nach Grund und Höhe schriftlich anmelden, Sicherheit zu leisten, soweit sie nicht Befriedigung verlangen können. Dieses Recht steht den Gläubigern jedoch nur zu, wenn sie glaubhaft machen, dass durch die Verschmelzung die Erfüllung ihrer Forderung gefährdet wird."
    },
    {
      "date": "2025-10-21",
      "id": "134805",
      "original_text": "Registerbekanntmachung nach dem Umwandlungsgesetz\nHessen Amtsgericht Wiesbaden HRB 32788\nAlpaca Investments GmbH – Wiesbaden",
      "type": "Registerbekanntmachung nach dem Umwandlungsgesetz",
      "state": "Hessen",
      "amtsgericht": "Amtsgericht Wiesbaden",
      "registernummer": "HRB 32788",
      "registerart": "HRB",
      "company_name": "Alpaca Investments GmbH",
      "company_seat": "Wiesbaden",
      "details": "21.10.2025 (Bekanntmachungsdatum)\n\nHessen Amtsgericht Wiesbaden HRB 32788\nRegisterbekanntmachung nach dem Umwandlungsgesetz 21.10.2025 (Eintragungsdatum)\n\nAlpaca Investments GmbH\nGesellschaft mit beschränkter Haftung\nWiesbaden\n\nDen Gläubigern der an der Verschmelzung beteiligten Rechtsträger ist, wenn sie binnen sechs Monaten nach dem Tag, an dem die Eintragung der Verschmelzung in das Register des Sitzes derjenigen Rechtsträger deren Gläubiger sie sind, nach § 19 Absatz 3 UmwG bekannt gemacht worden ist, ihren Anspruch nach Grund und Höhe schriftlich anmelden, Sicherheit zu leisten, soweit sie nicht Befriedigung verlangen können. Dieses Recht steht den Gläubigern jedoch nur zu, wenn sie glaubhaft machen, dass durch die Verschmelzung die Erfüllung ihrer Forderung gefährdet wird."
    },
    {
      "date": "2025-10-21",
      "id": "134806",
      "original_text": "Löschungsankündigung\nHessen Amtsgericht Wetzlar VR 1298\nFörderverein \"zur Unterstützung und Unterhaltung von ACTIVE-MOTIVATIONS- Systemen (ACMOTI) e. V. \" – Wetzlar",
      "type": "Löschungsankündigung",
      "state": "Hessen",
      "amtsgericht": "Amtsgericht Wetzlar",
      "registernummer": "VR 1298",
      "registerart": "VR",
      "company_name": "Förderverein \"zur Unterstützung und Unterhaltung von ACTIVE-MOTIVATIONS- Systemen (ACMOTI) e. V. \"",
      "company_seat": "Wetzlar",
      "details": "21.10.2025 (Bekanntmachungsdatum)\n\nHessen Amtsgericht Wetzlar VR 1298\nLöschungsankündigung\n\nFörderverein \"zur Unterstützung und Unterhaltung von ACTIVE-MOTIVATIONS- Systemen (ACMOTI) e. V. \"\neingetragener Verein\nWetzlar\n\nDas Registergericht beabsichtigt den im Vereinsregister eingetragenen Verein von Amts wegen, wegen Wegfalls aller Mitglieder zu löschen. Die Frist zur Erhebung eines Widerspruchs gegen die beabsichtigte Löschung wird auf 3 Monate festgesetzt."
    },
    {
      "date": "2025-10-21",
      "id": "134807",
      "original_text": "Löschungsankündigung\nHessen Amtsgericht Frankfurt am Main HRB 102136\nBIO-DELI & more GmbH – Frankfurt am Main",
      "type": "Löschungsankündigung",
      "state": "Hessen",
      "amtsgericht": "Amtsgericht Frankfurt am Main",
      "registernummer": "HRB 102136",
      "registerart": "HRB",
      "company_name": "BIO-DELI & more GmbH",
      "company_seat": "Frankfurt am Main",
      "details": "21.10.2025 (Bekanntmachungsdatum)\n\nHessen Amtsgericht Frankfurt am Main HRB 102136\nLöschungsankündigung\n\nBIO-DELI & more GmbH\nGesellschaft mit beschränkter Haftung\nFrankfurt am Main\n\nDas Registergericht beabsichtigt die im Handelsregister eingetragene Gesellschaft von Amts wegen nach § 394 FamFG zu löschen. Die Frist zur Erhebung eines Widerspruchs gegen die beabsichtigte Löschung wird auf 1 Monat festgesetzt."
    },
    {
      "date": "2025-10-21",
      "id": "134808",
      "original_text": "Registerbekanntmachung nach dem Umwandlungsgesetz\nHessen Amtsgericht Marburg HRB 8767\nPBBR Pulverbeschichtung GmbH – Rosenthal",
      "type": "Registerbekanntmachung nach dem Umwandlungsgesetz",
      "state": "Hessen",
      "amtsgericht": "Amtsgericht Marburg",
      "registernummer": "HRB 8767",
      "registerart": "HRB",
      "company_name": "PBBR Pulverbeschichtung GmbH",
      "company_seat": "Rosenthal",
      "details": "21.10.2025 (Bekanntmachungsdatum)\n\nHessen Amtsgericht Marburg HRB 8767\nRegisterbekanntmachung nach dem Umwandlungsgesetz 21.10.2025 (Eintragungsdatum)\n\nPBBR Pulverbeschichtung GmbH\nGesellschaft mit beschränkter Haftung\nRosenthal\n\nDen Gläubigern der an der Ausgliederung beteiligten Rechtsträger ist, wenn sie binnen sechs Monaten nach dem Tag, an dem die Eintragung der Ausgliederung in das Register des Sitzes desjenigen Rechtsträgers, dessen Gläubiger sie sind, nach §§ 125, 19 Absatz 3 UmwG bekannt gemacht worden ist, ihren Anspruch nach Grund und Höhe schriftlich anmelden, Sicherheit zu leisten, soweit sie nicht Befriedigung verlangen können. Dieses Recht steht den Gläubigern jedoch nur zu, wenn sie glaubhaft machen, dass durch die Ausgliederung die Erfüllung ihrer Forderung gefährdet wird."
    },
    {
      "date": "2025-10-21",
      "id": "134809",
      "original_text": "Registerbekanntmachung nach dem Umwandlungsgesetz\nHessen Amtsgericht Frankfurt am Main GsR 971\nKrankenpflegedienst Bender und Otten eGbR – Karben",
      "type": "Registerbekanntmachung nach dem Umwandlungsgesetz",
      "state": "Hessen",
      "amtsgericht": "Amtsgericht Frankfurt am Main",
      "registernummer": "GsR 971",
      "registerart": "GsR",
      "company_name": "Krankenpflegedienst Bender und Otten eGbR",
      "company_seat": "Karben",
      "details": "21.10.2025 (Bekanntmachungsdatum)\n\nHessen Amtsgericht Frankfurt am Main GsR 971\nRegisterbekanntmachung nach dem Umwandlungsgesetz 21.10.2025 (Eintragungsdatum)\n\nKrankenpflegedienst Bender und Otten eGbR\nGesellschaft bürgerlichen Rechts\nKarben\n\nDen Gläubigern der an der formwechselnden Umwandlung beteiligten Rechtsträger ist, wenn sie binnen sechs Monaten nach dem Tag, an dem die Eintragung der formwechselnden Umwandlung in das Register des Sitzes desjenigen Rechtsträgers, dessen Gläubiger sie sind, nach § 201 UmwG bekannt gemacht worden ist, ihren Anspruch nach Grund und Höhe schriftlich anmelden, Sicherheit zu leisten, soweit sie nicht Befriedigung verlangen können. Dieses Recht steht den Gläubigern jedoch nur zu, wenn sie glaubhaft machen, dass durch die formwechselnden Umwandlung die Erfüllung ihrer Forderung gefährdet wird."
    },
    {
      "date": "2025-10-21",
      "id": "134810",
      "original_text": "Sonstige Registerbekanntmachung\nHessen Amtsgericht Darmstadt HRB 5151\nENTEGA AG – Darmstadt",
      "type": "Sonstige Registerbekanntmachung",
      "state": "Hessen",
      "amtsgericht": "Amtsgericht Darmstadt",
      "registernummer": "HRB 5151",
      "registerart": "HRB",
      "company_name": "ENTEGA AG",
      "company_seat": "Darmstadt",
      "details": "21.10.2025 (Bekanntmachungsdatum)\n\nHessen Amtsgericht Darmstadt HRB 5151\nSonstige Registerbekanntmachung 21.10.2025 (Eintragungsdatum)\n\nENTEGA AG\nAktiengesellschaft\nDarmstadt\n\nWegen Änderungen in den Personen der Aufsichtsratsmitglieder ist eine Liste der Mitglieder des Aufsichtsrates zum Handelsregister eingereicht worden."
    },
    {
      "date": "2025-10-21",
      "id": "134811",
      "original_text": "Sonstige Registerbekanntmachung\nHessen Amtsgericht Kassel VR 4293\nBürgergeld e. V. Verein für solidarisches Wirtschaften – Kassel",
      "type": "Sonstige Registerbekanntmachung",
      "state": "Hessen",
      "amtsgericht": "Amtsgericht Kassel",
      "registernummer": "VR 4293",
      "registerart": "VR",
      "company_name": "Bürgergeld e. V. Verein für solidarisches Wirtschaften",
      "company_seat": "Kassel",
      "details": "21.10.2025 (Bekanntmachungsdatum)\n\nHessen Amtsgericht Kassel VR 4293\nSonstige Registerbekanntmachung 21.10.2025 (Eintragungsdatum)\n\nBürgergeld e. V. Verein für solidarisches Wirtschaften\neingetragener Verein\nKassel\n\nDer Verein ist aufgelöst."
    },
    {
      "date": "2025-10-21",
      "id": "134812",
      "original_text": "Registerbekanntmachung nach dem Umwandlungsgesetz\nHessen Amtsgericht Marburg HRA 5589\nP.B.B.R. PulverBeschichtungsBetrieb e.K. – Rosenthal",
      "type": "Registerbekanntmachung nach dem Umwandlungsgesetz",
      "state": "Hessen",
      "amtsgericht": "Amtsgericht Marburg",
      "registernummer": "HRA 5589",
      "registerart": "HRA",
      "company_name": "P.B.B.R. PulverBeschichtungsBetrieb e.K.",
      "company_seat": "Rosenthal",
      "details": "21.10.2025 (Bekanntmachungsdatum)\n\nHessen Amtsgericht Marburg HRA 5589\nRegisterbekanntmachung nach dem Umwandlungsgesetz 21.10.2025 (Eintragungsdatum)\n\nP.B.B.R. PulverBeschichtungsBetrieb e.K.\nEinzelkaufmann / Einzelkauffrau\nRosenthal\n\nDen Gläubigern der an der Ausgliederung beteiligten Rechtsträger ist, wenn sie binnen sechs Monaten nach dem Tag, an dem die Eintragung der Ausgliederung in das Register des Sitzes desjenigen Rechtsträgers, dessen Gläubiger sie sind, nach §§ 125, 19 Absatz 3 UmwG bekannt gemacht worden ist, ihren Anspruch nach Grund und Höhe schriftlich anmelden, Sicherheit zu leisten, soweit sie nicht Befriedigung verlangen können. Dieses Recht steht den Gläubigern jedoch nur zu, wenn sie glaubhaft machen, dass durch die Ausgliederung die Erfüllung ihrer Forderung gefährdet wird."
    },
    {
      "date": "2025-10-21",
      "id": "134813",
      "original_text": "Registerbekanntmachung nach dem Umwandlungsgesetz\nHessen Amtsgericht Wiesbaden HRB 36170\n10er CreatorLabs GmbH – Idstein",
      "type": "Registerbekanntmachung nach dem Umwandlungsgesetz",
      "state": "Hessen",
      "amtsgericht": "Amtsgericht Wiesbaden",
      "registernummer": "HRB 36170",
      "registerart": "HRB",
      "company_name": "10er CreatorLabs GmbH",
      "company_seat": "Idstein",
      "details": "21.10.2025 (Bekanntmachungsdatum)\n\nHessen Amtsgericht Wiesbaden HRB 36170\nRegisterbekanntmachung nach dem Umwandlungsgesetz 20.10.2025 (Eintragungsdatum)\n\n10er CreatorLabs GmbH\nGesellschaft mit beschränkter Haftung\nIdstein\n\nDen Gläubigern der an der Ausgliederung beteiligten Rechtsträger ist, wenn sie binnen sechs Monaten nach dem Tag, an dem die Eintragung der Ausgliederung in das Register des Sitzes desjenigen Rechtsträgers, dessen Gläubiger sie sind, nach §§ 125, 19 Absatz 3 UmwG bekannt gemacht worden ist, ihren Anspruch nach Grund und Höhe schriftlich anmelden, Sicherheit zu leisten, soweit sie nicht Befriedigung verlangen können. Dieses Recht steht den Gläubigern jedoch nur zu, wenn sie glaubhaft machen, dass durch die Ausgliederung die Erfüllung ihrer Forderung gefährdet wird."
    },
    {
      "date": "2025-10-21",
      "id": "134814",
      "original_text": "Registerbekanntmachung nach dem Umwandlungsgesetz\nHessen Amtsgericht Frankfurt am Main HRB 140511\nKrankenpflegedienst Bender GmbH – Karben",
      "type": "Registerbekanntmachung nach dem Umwandlungsgesetz",
      "state": "Hessen",
      "amtsgericht": "Amtsgericht Frankfurt am Main",
      "registernummer": "HRB 140511",
      "registerart": "HRB",
      "company_name": "Krankenpflegedienst Bender GmbH",
      "company_seat": "Karben",
      "details": "21.10.2025 (Bekanntmachungsdatum)\n\nHessen Amtsgericht Frankfurt am Main HRB 140511\nRegisterbekanntmachung nach dem Umwandlungsgesetz 21.10.2025 (Eintragungsdatum)\n\nKrankenpflegedienst Bender GmbH\nGesellschaft mit beschränkter Haftung\nKarben\n\nDen Gläubigern der an der formwechselnden Umwandlung beteiligten Rechtsträger ist, wenn sie binnen sechs Monaten nach dem Tag, an dem die Eintragung der formwechselnden Umwandlung in das Register des Sitzes desjenigen Rechtsträgers, dessen Gläubiger sie sind, nach § 201 UmwG bekannt gemacht worden ist, ihren Anspruch nach Grund und Höhe schriftlich anmelden, Sicherheit zu leisten, soweit sie nicht Befriedigung verlangen können. Dieses Recht steht den Gläubigern jedoch nur zu, wenn sie glaubhaft machen, dass durch die formwechselnden Umwandlung die Erfüllung ihrer Forderung gefährdet wird."
    },
    {
      "date": "2025-10-21",
      "id": "134815",
      "original_text": "Löschungsankündigung\nHessen Amtsgericht Frankfurt am Main HRB 25336\nKöhler Hoch-Tief- und Wasserbaugesellschaft mit beschränkter Haftung – Frankfurt am Main",
      "type": "Löschungsankündigung",
      "state": "Hessen",
      "amtsgericht": "Amtsgericht Frankfurt am Main",
      "registernummer": "HRB 25336",
      "registerart": "HRB",
      "company_name": "Köhler Hoch-Tief- und Wasserbaugesellschaft mit beschränkter Haftung",
      "company_seat": "Frankfurt am Main",
      "details": "21.10.2025 (Bekanntmachungsdatum)\n\nHessen Amtsgericht Frankfurt am Main HRB 25336\nLöschungsankündigung\n\nKöhler Hoch-Tief- und Wasserbaugesellschaft mit beschränkter Haftung\nGesellschaft mit beschränkter Haftung\nFrankfurt am Main\n\nEs ist beabsichtig, die Gesellschaft wegen Vermögenslosigkeit gemäß § 394 FamFG von Amts wegen im Handelsregister zu löschen. Hiergegen kann innerhalb eines Zeitraums von 1 Monat nach dieser Veröffentlichung Widerspruch bei dem Amtsgericht Frankfurt am Main eingelegt werden."
    },
    {
      "date": "2025-10-21",
      "id": "134816",
      "original_text": "Einreichung neuer Dokumente\nHessen Amtsgericht Gießen HRB 6384\nUniversitätsklinikum Gießen und Marburg GmbH – Gießen",
      "type": "Einreichung neuer Dokumente",
      "state": "Hessen",
      "amtsgericht": "Amtsgericht Gießen",
      "registernummer": "HRB 6384",
      "registerart": "HRB",
      "company_name": "Universitätsklinikum Gießen und Marburg GmbH",
      "company_seat": "Gießen",
      "details": "21.10.2025 (Bekanntmachungsdatum)\n\nHessen Amtsgericht Gießen HRB 6384\nEinreichung neuer Dokumente 21.10.2025 (Eintragungsdatum)\n\nUniversitätsklinikum Gießen und Marburg GmbH\nGesellschaft mit beschränkter Haftung\nGießen\n\nAufgrund einer Änderung in den Personen der Aufsichtsratsmitglieder ist eine Liste der Mitglieder des Aufsichtsrates zum Handelsregister eingereicht worden."
    }
  ]
}