{
  "date": "2025-10-10",
  "date_of_scrape": "2025-10-27T17:38:27.583Z",
  "tool_version": "0.2.0",
  "number_of_announcements": 143,
  "announcements": [
    {
      "date": "2025-10-10",
      "id": "133452",
      "original_text": "Sonstige Registerbekanntmachung\nBayern Amtsgericht Augsburg GnR 1544\nRaiffeisenbank Bobingen eG – Bobingen",
      "type": "Sonstige Registerbekanntmachung",
      "state": "Bayern",
      "amtsgericht": "Amtsgericht Augsburg",
      "registernummer": "GnR 1544",
      "registerart": "GnR",
      "company_name": "Raiffeisenbank Bobingen eG",
      "company_seat": "Bobingen",
      "details": "10.10.2025 (Bekanntmachungsdatum)\n\nBayern Amtsgericht Augsburg GnR 1544\nSonstige Registerbekanntmachung 09.10.2025 (Eintragungsdatum)\n\nRaiffeisenbank Bobingen eG\neingetragene Genossenschaft\nBobingen\n\nDie Vertreterversammlung vom 22.07.2025 hat die Änderung der Satzung beschlossen. Geändert wurde u.a. § 40 (Nachschusspflicht); dieser lautet nun: Eine Nachschusspflicht der Mitglieder ist ausgeschlossen. Den Gläubigern der Genossenschaft ist gemäß §§ 22a i.V.m. 22 GenG, wenn sie sich binnen sechs Monaten nach der Bekanntmachung bei der Genossenschaft zu diesem Zweck melden, Sicherheit zu leisten, soweit sie nicht Befriedigung verlangen können."
    },
    {
      "date": "2025-10-10",
      "id": "133453",
      "original_text": "Einreichung neuer Dokumente\nBayern Amtsgericht Traunstein HRB 15063\nSüddeutsche Truthahn Aktiengesellschaft Handelsgesellschaft – Ampfing",
      "type": "Einreichung neuer Dokumente",
      "state": "Bayern",
      "amtsgericht": "Amtsgericht Traunstein",
      "registernummer": "HRB 15063",
      "registerart": "HRB",
      "company_name": "Süddeutsche Truthahn Aktiengesellschaft Handelsgesellschaft",
      "company_seat": "Ampfing",
      "details": "10.10.2025 (Bekanntmachungsdatum)\n\nBayern Amtsgericht Traunstein HRB 15063\nEinreichung neuer Dokumente\n\nSüddeutsche Truthahn Aktiengesellschaft Handelsgesellschaft\nAktiengesellschaft\nAmpfing\n\nDem Amtsgericht Traunstein -Registergericht- ist eine Liste der Mitglieder des Aufsichtsrats eingereicht worden, § 106 AktG."
    },
    {
      "date": "2025-10-10",
      "id": "133454",
      "original_text": "Einreichung neuer Dokumente\nBayern Amtsgericht München HRB 296297\nSoftware GmbH – München",
      "type": "Einreichung neuer Dokumente",
      "state": "Bayern",
      "amtsgericht": "Amtsgericht München",
      "registernummer": "HRB 296297",
      "registerart": "HRB",
      "company_name": "Software GmbH",
      "company_seat": "München",
      "details": "10.10.2025 (Bekanntmachungsdatum)\n\nBayern Amtsgericht München HRB 296297\nEinreichung neuer Dokumente\n\nSoftware GmbH\nGesellschaft mit beschränkter Haftung\nMünchen\n\nDem Amtsgericht München -Registergericht- ist eine Liste der Mitglieder des Aufsichtsrats eingereicht worden, § 52 Abs. 3 S. 2 GmbHG."
    },
    {
      "date": "2025-10-10",
      "id": "133455",
      "original_text": "Löschungsankündigung\nBayern Amtsgericht Hof HRA 3621\nAugsten & Scheuerlein sportpark untreusee GmbH & Co. KG – Hof",
      "type": "Löschungsankündigung",
      "state": "Bayern",
      "amtsgericht": "Amtsgericht Hof",
      "registernummer": "HRA 3621",
      "registerart": "HRA",
      "company_name": "Augsten & Scheuerlein sportpark untreusee GmbH & Co. KG",
      "company_seat": "Hof",
      "details": "10.10.2025 (Bekanntmachungsdatum)\n\nBayern Amtsgericht Hof HRA 3621\nLöschungsankündigung\n\nAugsten & Scheuerlein sportpark untreusee GmbH & Co.  KG\nKommanditgesellschaft\nHof\n\nDas Registergericht beabsichtigt, die im Handelsregister eingetragene Gesellschaft wegen Vermögenslosigkeit von Amts wegen nach § 394 FamFG zu löschen. Die Frist zur Erhebung eines Widerspruchs ist auf sechs Wochen festgesetzt."
    },
    {
      "date": "2025-10-10",
      "id": "133456",
      "original_text": "Registerbekanntmachung nach dem Umwandlungsgesetz\nBayern Amtsgericht München HRA 121484\nReichl Garten GmbH & Co. KG – Bad Wiessee",
      "type": "Registerbekanntmachung nach dem Umwandlungsgesetz",
      "state": "Bayern",
      "amtsgericht": "Amtsgericht München",
      "registernummer": "HRA 121484",
      "registerart": "HRA",
      "company_name": "Reichl Garten GmbH & Co. KG",
      "company_seat": "Bad Wiessee",
      "details": "10.10.2025 (Bekanntmachungsdatum)\n\nBayern Amtsgericht München HRA 121484\nRegisterbekanntmachung nach dem Umwandlungsgesetz 09.10.2025 (Eintragungsdatum)\n\nReichl Garten GmbH & Co. KG\nKommanditgesellschaft\nBad Wiessee\n\nDen Gläubigern der an der Ausgliederung beteiligten Rechtsträger ist, wenn sie binnen sechs Monaten nach dem Tag, an dem die Eintragung der Ausgliederung in das Register des Sitzes desjenigen Rechtsträgers, dessen Gläubiger sie sind, nach §§ 125, 19 Abs. 3 UmwG als bekannt gemacht gilt, ihren Anspruch nach Grund und Höhe in Textform anmelden, Sicherheit zu leisten, soweit sie nicht Befriedigung verlangen können. Dieses Recht steht den Gläubigern jedoch nur zu, wenn sie glaubhaft machen, dass durch die Ausgliederung die Erfüllung ihrer Forderung gefährdet wird."
    },
    {
      "date": "2025-10-10",
      "id": "133457",
      "original_text": "Registerbekanntmachung nach dem Umwandlungsgesetz\nBayern Amtsgericht München HRB 189933\nPhilipp Roesch-Schlanderer Investments GmbH – Grünwald",
      "type": "Registerbekanntmachung nach dem Umwandlungsgesetz",
      "state": "Bayern",
      "amtsgericht": "Amtsgericht München",
      "registernummer": "HRB 189933",
      "registerart": "HRB",
      "company_name": "Philipp Roesch-Schlanderer Investments GmbH",
      "company_seat": "Grünwald",
      "details": "10.10.2025 (Bekanntmachungsdatum)\n\nBayern Amtsgericht München HRB 189933\nRegisterbekanntmachung nach dem Umwandlungsgesetz 09.10.2025 (Eintragungsdatum)\n\nPhilipp Roesch-Schlanderer Investments GmbH\nGesellschaft mit beschränkter Haftung\nGrünwald\n\nDen Gläubigern der an der Verschmelzung beteiligten Rechtsträger ist, wenn sie binnen sechs Monaten nach dem Tag, an dem die Eintragung der Verschmelzung in das Register des Sitzes desjenigen Rechtsträgers, dessen Gläubiger sie sind, nach § 19 Abs. 3 UmwG als bekannt gemacht gilt, ihren Anspruch nach Grund und Höhe in Textform anmelden, Sicherheit zu leisten, soweit sie nicht Befriedigung verlangen können. Dieses Recht steht den Gläubigern jedoch nur zu, wenn sie glaubhaft machen, dass durch die Verschmelzung die Erfüllung ihrer Forderung gefährdet wird."
    },
    {
      "date": "2025-10-10",
      "id": "133458",
      "original_text": "Registerbekanntmachung nach dem Umwandlungsgesetz\nBayern Amtsgericht München HRB 284710\nFreedom Cap GmbH – München",
      "type": "Registerbekanntmachung nach dem Umwandlungsgesetz",
      "state": "Bayern",
      "amtsgericht": "Amtsgericht München",
      "registernummer": "HRB 284710",
      "registerart": "HRB",
      "company_name": "Freedom Cap GmbH",
      "company_seat": "München",
      "details": "10.10.2025 (Bekanntmachungsdatum)\n\nBayern Amtsgericht München HRB 284710\nRegisterbekanntmachung nach dem Umwandlungsgesetz 09.10.2025 (Eintragungsdatum)\n\nFreedom Cap GmbH\nGesellschaft mit beschränkter Haftung\nMünchen\n\nDen Gläubigern der an der Verschmelzung beteiligten Rechtsträger ist, wenn sie binnen sechs Monaten nach dem Tag, an dem die Eintragung der Verschmelzung in das Register des Sitzes desjenigen Rechtsträgers, dessen Gläubiger sie sind, nach § 19 Abs. 3 UmwG als bekannt gemacht gilt, ihren Anspruch nach Grund und Höhe in Textform anmelden, Sicherheit zu leisten, soweit sie nicht Befriedigung verlangen können. Dieses Recht steht den Gläubigern jedoch nur zu, wenn sie glaubhaft machen, dass durch die Verschmelzung die Erfüllung ihrer Forderung gefährdet wird."
    },
    {
      "date": "2025-10-10",
      "id": "133459",
      "original_text": "Löschungsankündigung\nBayern Amtsgericht Augsburg HRB 34419\nMicro Clean Tools UG (haftungsbeschränkt) – Augsburg",
      "type": "Löschungsankündigung",
      "state": "Bayern",
      "amtsgericht": "Amtsgericht Augsburg",
      "registernummer": "HRB 34419",
      "registerart": "HRB",
      "company_name": "Micro Clean Tools UG (haftungsbeschränkt)",
      "company_seat": "Augsburg",
      "details": "10.10.2025 (Bekanntmachungsdatum)\n\nBayern Amtsgericht Augsburg HRB 34419\nLöschungsankündigung\n\nMicro Clean Tools UG (haftungsbeschränkt)\nGesellschaft mit beschränkter Haftung\nAugsburg\n\nDas Registergericht beabsichtigt, die im Handelsregister eingetragene Gesellschaft wegen Vermögenslosigkeit von Amts wegen nach § 394 FamFG zu löschen. Die Frist zur Erhebung eines Widerspruchs ist auf einen Monat festgesetzt."
    },
    {
      "date": "2025-10-10",
      "id": "133460",
      "original_text": "Löschungsankündigung\nBayern Amtsgericht München HRB 274423\nWorkSET GmbH – München",
      "type": "Löschungsankündigung",
      "state": "Bayern",
      "amtsgericht": "Amtsgericht München",
      "registernummer": "HRB 274423",
      "registerart": "HRB",
      "company_name": "WorkSET GmbH",
      "company_seat": "München",
      "details": "10.10.2025 (Bekanntmachungsdatum)\n\nBayern Amtsgericht München HRB 274423\nLöschungsankündigung 09.10.2025 (Eintragungsdatum)\n\nWorkSET GmbH\nGesellschaft mit beschränkter Haftung\nMünchen\n\nDas Registergericht beabsichtigt, die im Handelsregister eingetragene Gesellschaft wegen Vermögenslosigkeit von Amts wegen nach § 394 FamFG zu löschen. Die Frist zur Erhebung eines Widerspruchs ist auf drei Monate festgesetzt."
    },
    {
      "date": "2025-10-10",
      "id": "133461",
      "original_text": "Registerbekanntmachung nach dem Umwandlungsgesetz\nBayern Amtsgericht München HRB 304043\nBlitz 25-461 GmbH – München",
      "type": "Registerbekanntmachung nach dem Umwandlungsgesetz",
      "state": "Bayern",
      "amtsgericht": "Amtsgericht München",
      "registernummer": "HRB 304043",
      "registerart": "HRB",
      "company_name": "Blitz 25-461 GmbH",
      "company_seat": "München",
      "details": "10.10.2025 (Bekanntmachungsdatum)\n\nBayern Amtsgericht München HRB 304043\nRegisterbekanntmachung nach dem Umwandlungsgesetz 09.10.2025 (Eintragungsdatum)\n\nBlitz 25-461 GmbH\nGesellschaft mit beschränkter Haftung\nMünchen\n\nDen Gläubigern der an der Verschmelzung beteiligten Rechtsträger ist, wenn sie binnen sechs Monaten nach dem Tag, an dem die Eintragung der Verschmelzung in das Register des Sitzes desjenigen Rechtsträgers, dessen Gläubiger sie sind, nach § 19 Abs. 3 UmwG als bekannt gemacht gilt, ihren Anspruch nach Grund und Höhe in Textform anmelden, Sicherheit zu leisten, soweit sie nicht Befriedigung verlangen können. Dieses Recht steht den Gläubigern jedoch nur zu, wenn sie glaubhaft machen, dass durch die Verschmelzung die Erfüllung ihrer Forderung gefährdet wird."
    },
    {
      "date": "2025-10-10",
      "id": "133462",
      "original_text": "Löschungsankündigung\nBayern Amtsgericht Nürnberg HRB 27727\nDENTAL-SPEKTRUM GmbH – Nürnberg",
      "type": "Löschungsankündigung",
      "state": "Bayern",
      "amtsgericht": "Amtsgericht Nürnberg",
      "registernummer": "HRB 27727",
      "registerart": "HRB",
      "company_name": "DENTAL-SPEKTRUM GmbH",
      "company_seat": "Nürnberg",
      "details": "10.10.2025 (Bekanntmachungsdatum)\n\nBayern Amtsgericht Nürnberg HRB 27727\nLöschungsankündigung\n\nDENTAL-SPEKTRUM GmbH\nGesellschaft mit beschränkter Haftung\nNürnberg\n\nDas Registergericht beabsichtigt, die im Handelsregister eingetragene Gesellschaft wegen Vermögenslosigkeit von Amts wegen nach § 394 FamFG zu löschen. Die Frist zur Erhebung eines Widerspruchs ist auf einen Monat festgesetzt."
    },
    {
      "date": "2025-10-10",
      "id": "133463",
      "original_text": "Registerbekanntmachung nach dem Umwandlungsgesetz\nBayern Amtsgericht München HRB 269344\nMantrarella Yoga UG (haftungsbeschränkt) – München",
      "type": "Registerbekanntmachung nach dem Umwandlungsgesetz",
      "state": "Bayern",
      "amtsgericht": "Amtsgericht München",
      "registernummer": "HRB 269344",
      "registerart": "HRB",
      "company_name": "Mantrarella Yoga UG (haftungsbeschränkt)",
      "company_seat": "München",
      "details": "10.10.2025 (Bekanntmachungsdatum)\n\nBayern Amtsgericht München HRB 269344\nRegisterbekanntmachung nach dem Umwandlungsgesetz 09.10.2025 (Eintragungsdatum)\n\nMantrarella Yoga UG (haftungsbeschränkt)\nGesellschaft mit beschränkter Haftung\nMünchen\n\nDen Gläubigern der an der Verschmelzung beteiligten Rechtsträger ist, wenn sie binnen sechs Monaten nach dem Tag, an dem die Eintragung der Verschmelzung in das Register des Sitzes desjenigen Rechtsträgers, dessen Gläubiger sie sind, nach § 19 Abs. 3 UmwG als bekannt gemacht gilt, ihren Anspruch nach Grund und Höhe in Textform anmelden, Sicherheit zu leisten, soweit sie nicht Befriedigung verlangen können. Dieses Recht steht den Gläubigern jedoch nur zu, wenn sie glaubhaft machen, dass durch die Verschmelzung die Erfüllung ihrer Forderung gefährdet wird."
    },
    {
      "date": "2025-10-10",
      "id": "133464",
      "original_text": "Löschungsankündigung\nBayern Amtsgericht Nürnberg HRB 37328\nBlue Amber UG (haftungsbeschränkt) – Nürnberg",
      "type": "Löschungsankündigung",
      "state": "Bayern",
      "amtsgericht": "Amtsgericht Nürnberg",
      "registernummer": "HRB 37328",
      "registerart": "HRB",
      "company_name": "Blue Amber UG (haftungsbeschränkt)",
      "company_seat": "Nürnberg",
      "details": "10.10.2025 (Bekanntmachungsdatum)\n\nBayern Amtsgericht Nürnberg HRB 37328\nLöschungsankündigung\n\nBlue Amber UG (haftungsbeschränkt)\nGesellschaft mit beschränkter Haftung\nNürnberg\n\nDas Registergericht beabsichtigt, die im Handelsregister eingetragene Gesellschaft wegen Vermögenslosigkeit von Amts wegen nach § 394 FamFG zu löschen. Die Frist zur Erhebung eines Widerspruchs ist auf einen Monat festgesetzt."
    },
    {
      "date": "2025-10-10",
      "id": "133465",
      "original_text": "Registerbekanntmachung nach dem Umwandlungsgesetz\nBayern Amtsgericht München HRA 121446\nOtto Reichl e.K. – Bad Wiessee",
      "type": "Registerbekanntmachung nach dem Umwandlungsgesetz",
      "state": "Bayern",
      "amtsgericht": "Amtsgericht München",
      "registernummer": "HRA 121446",
      "registerart": "HRA",
      "company_name": "Otto Reichl e.K.",
      "company_seat": "Bad Wiessee",
      "details": "10.10.2025 (Bekanntmachungsdatum)\n\nBayern Amtsgericht München HRA 121446\nRegisterbekanntmachung nach dem Umwandlungsgesetz 09.10.2025 (Eintragungsdatum)\n\nOtto Reichl e.K.\nEinzelkaufmann / Einzelkauffrau\nBad Wiessee\n\nDen Gläubigern der an der Ausgliederung beteiligten Rechtsträger ist, wenn sie binnen sechs Monaten nach dem Tag, an dem die Eintragung der Ausgliederung in das Register des Sitzes desjenigen Rechtsträgers, dessen Gläubiger sie sind, nach §§ 125, 19 Abs. 3 UmwG als bekannt gemacht gilt, ihren Anspruch nach Grund und Höhe in Textform anmelden, Sicherheit zu leisten, soweit sie nicht Befriedigung verlangen können. Dieses Recht steht den Gläubigern jedoch nur zu, wenn sie glaubhaft machen, dass durch die Ausgliederung die Erfüllung ihrer Forderung gefährdet wird."
    },
    {
      "date": "2025-10-10",
      "id": "133466",
      "original_text": "Registerbekanntmachung nach dem Umwandlungsgesetz\nBayern Amtsgericht München HRB 267246\nPunkr UG (haftungsbeschränkt) – München",
      "type": "Registerbekanntmachung nach dem Umwandlungsgesetz",
      "state": "Bayern",
      "amtsgericht": "Amtsgericht München",
      "registernummer": "HRB 267246",
      "registerart": "HRB",
      "company_name": "Punkr UG (haftungsbeschränkt)",
      "company_seat": "München",
      "details": "10.10.2025 (Bekanntmachungsdatum)\n\nBayern Amtsgericht München HRB 267246\nRegisterbekanntmachung nach dem Umwandlungsgesetz 09.10.2025 (Eintragungsdatum)\n\nPunkr UG (haftungsbeschränkt)\nGesellschaft mit beschränkter Haftung\nMünchen\n\nDen Gläubigern der an der Verschmelzung beteiligten Rechtsträger ist, wenn sie binnen sechs Monaten nach dem Tag, an dem die Eintragung der Verschmelzung in das Register des Sitzes desjenigen Rechtsträgers, dessen Gläubiger sie sind, nach § 19 Abs. 3 UmwG als bekannt gemacht gilt, ihren Anspruch nach Grund und Höhe in Textform anmelden, Sicherheit zu leisten, soweit sie nicht Befriedigung verlangen können. Dieses Recht steht den Gläubigern jedoch nur zu, wenn sie glaubhaft machen, dass durch die Verschmelzung die Erfüllung ihrer Forderung gefährdet wird."
    },
    {
      "date": "2025-10-10",
      "id": "133467",
      "original_text": "Registerbekanntmachung nach dem Umwandlungsgesetz\nBayern Amtsgericht Memmingen HRB 18805\nBismont GmbH – Ebershausen",
      "type": "Registerbekanntmachung nach dem Umwandlungsgesetz",
      "state": "Bayern",
      "amtsgericht": "Amtsgericht Memmingen",
      "registernummer": "HRB 18805",
      "registerart": "HRB",
      "company_name": "Bismont GmbH",
      "company_seat": "Ebershausen",
      "details": "10.10.2025 (Bekanntmachungsdatum)\n\nBayern Amtsgericht Memmingen HRB 18805\nRegisterbekanntmachung nach dem Umwandlungsgesetz 09.10.2025 (Eintragungsdatum)\n\nBismont GmbH\nGesellschaft mit beschränkter Haftung\nEbershausen\n\nDen Gläubigern der an der Verschmelzung beteiligten Rechtsträger ist, wenn sie binnen sechs Monaten nach dem Tag, an dem die Eintragung der Verschmelzung in das Register des Sitzes desjenigen Rechtsträgers, dessen Gläubiger sie sind, nach § 19 Abs. 3 UmwG als bekannt gemacht gilt, ihren Anspruch nach Grund und Höhe in Textform anmelden, Sicherheit zu leisten, soweit sie nicht Befriedigung verlangen können. Dieses Recht steht den Gläubigern jedoch nur zu, wenn sie glaubhaft machen, dass durch die Verschmelzung die Erfüllung ihrer Forderung gefährdet wird."
    },
    {
      "date": "2025-10-10",
      "id": "133468",
      "original_text": "Löschungsankündigung\nBayern Amtsgericht Nürnberg HRB 18030\nantim Verlag GmbH – Nürnberg",
      "type": "Löschungsankündigung",
      "state": "Bayern",
      "amtsgericht": "Amtsgericht Nürnberg",
      "registernummer": "HRB 18030",
      "registerart": "HRB",
      "company_name": "antim Verlag GmbH",
      "company_seat": "Nürnberg",
      "details": "10.10.2025 (Bekanntmachungsdatum)\n\nBayern Amtsgericht Nürnberg HRB 18030\nLöschungsankündigung\n\nantim Verlag GmbH\nGesellschaft mit beschränkter Haftung\nNürnberg\n\nDas Registergericht beabsichtigt, die im Handelsregister eingetragene Gesellschaft wegen Vermögenslosigkeit von Amts wegen nach § 394 FamFG zu löschen. Die Frist zur Erhebung eines Widerspruchs ist auf einen Monat festgesetzt."
    },
    {
      "date": "2025-10-10",
      "id": "133469",
      "original_text": "Registerbekanntmachung nach dem Umwandlungsgesetz\nBayern Amtsgericht Augsburg HRA 22022\nIngenieurbüro Thorsten Singh e.K. – Augsburg",
      "type": "Registerbekanntmachung nach dem Umwandlungsgesetz",
      "state": "Bayern",
      "amtsgericht": "Amtsgericht Augsburg",
      "registernummer": "HRA 22022",
      "registerart": "HRA",
      "company_name": "Ingenieurbüro Thorsten Singh e.K.",
      "company_seat": "Augsburg",
      "details": "10.10.2025 (Bekanntmachungsdatum)\n\nBayern Amtsgericht Augsburg HRA 22022\nRegisterbekanntmachung nach dem Umwandlungsgesetz 09.10.2025 (Eintragungsdatum)\n\nIngenieurbüro Thorsten Singh e.K.\nEinzelkaufmann / Einzelkauffrau\nAugsburg\n\nDen Gläubigern der an der Ausgliederung beteiligten Rechtsträger ist, wenn sie binnen sechs Monaten nach dem Tag, an dem die Eintragung der Ausgliederung in das Register des Sitzes desjenigen Rechtsträgers, dessen Gläubiger sie sind, nach §§ 125, 19 Abs. 3 UmwG als bekannt gemacht gilt, ihren Anspruch nach Grund und Höhe in Textform anmelden, Sicherheit zu leisten, soweit sie nicht Befriedigung verlangen können. Dieses Recht steht den Gläubigern jedoch nur zu, wenn sie glaubhaft machen, dass durch die Ausgliederung die Erfüllung ihrer Forderung gefährdet wird."
    },
    {
      "date": "2025-10-10",
      "id": "133470",
      "original_text": "Registerbekanntmachung nach dem Umwandlungsgesetz\nBayern Amtsgericht Augsburg HRA 10968\nMolkerei Alois Müller GmbH & Co. KG – Fischach",
      "type": "Registerbekanntmachung nach dem Umwandlungsgesetz",
      "state": "Bayern",
      "amtsgericht": "Amtsgericht Augsburg",
      "registernummer": "HRA 10968",
      "registerart": "HRA",
      "company_name": "Molkerei Alois Müller GmbH & Co. KG",
      "company_seat": "Fischach",
      "details": "10.10.2025 (Bekanntmachungsdatum)\n\nBayern Amtsgericht Augsburg HRA 10968\nRegisterbekanntmachung nach dem Umwandlungsgesetz 09.10.2025 (Eintragungsdatum)\n\nMolkerei Alois Müller GmbH & Co. KG\nKommanditgesellschaft\nFischach\n\nDen Gläubigern der an der Verschmelzung beteiligten Rechtsträger ist, wenn sie binnen sechs Monaten nach dem Tag, an dem die Eintragung der Verschmelzung in das Register des Sitzes desjenigen Rechtsträgers, dessen Gläubiger sie sind, nach § 19 Abs. 3 UmwG als bekannt gemacht gilt, ihren Anspruch nach Grund und Höhe in Textform anmelden, Sicherheit zu leisten, soweit sie nicht Befriedigung verlangen können. Dieses Recht steht den Gläubigern jedoch nur zu, wenn sie glaubhaft machen, dass durch die Verschmelzung die Erfüllung ihrer Forderung gefährdet wird."
    },
    {
      "date": "2025-10-10",
      "id": "133471",
      "original_text": "Registerbekanntmachung nach dem Umwandlungsgesetz\nBaden-Württemberg Amtsgericht Ulm GnR 630006\nVolksbank Bodensee-Oberschwaben eG – Tettnang",
      "type": "Registerbekanntmachung nach dem Umwandlungsgesetz",
      "state": "Baden-Württemberg",
      "amtsgericht": "Amtsgericht Ulm",
      "registernummer": "GnR 630006",
      "registerart": "GnR",
      "company_name": "Volksbank Bodensee-Oberschwaben eG",
      "company_seat": "Tettnang",
      "details": "10.10.2025 (Bekanntmachungsdatum)\n\nBaden-Württemberg Amtsgericht Ulm GnR 630006\nRegisterbekanntmachung nach dem Umwandlungsgesetz 10.10.2025 (Eintragungsdatum)\n\nVolksbank Bodensee-Oberschwaben eG\neingetragene Genossenschaft\nTettnang\n\nAls nicht eingetragen wird bekanntgemacht:\nDen Gläubigern der an der Verschmelzung beteiligten Rechtsträger ist, wenn sie binnen sechs Monaten nach dem Tag, an dem die Eintragung der Verschmelzung in das Register des Sitzes desjenigen Rechtsträgers, dessen Gläubiger sie sind, nach § 19 Abs. 3 UmwG als bekanntgemacht gilt, ihren Anspruch nach Grund und Höhe schriftlich anmelden, Sicherheit zu leisten, soweit sie nicht Befriedigung verlangen können. Dieses Recht steht den Gläubigern jedoch nur zu, wenn sie glaubhaft machen, dass durch die Verschmelzung die Erfüllung ihrer Forderung gefährdet wird."
    },
    {
      "date": "2025-10-10",
      "id": "133472",
      "original_text": "Registerbekanntmachung nach dem Umwandlungsgesetz\nBrandenburg Amtsgericht Potsdam HRA 4744\nNAWARO Damsdorf GmbH & Co. KG – Kloster Lehnin",
      "type": "Registerbekanntmachung nach dem Umwandlungsgesetz",
      "state": "Brandenburg",
      "amtsgericht": "Amtsgericht Potsdam",
      "registernummer": "HRA 4744",
      "registerart": "HRA",
      "company_name": "NAWARO Damsdorf GmbH & Co. KG",
      "company_seat": "Kloster Lehnin",
      "details": "10.10.2025 (Bekanntmachungsdatum)\n\nBrandenburg Amtsgericht Potsdam HRA 4744\nRegisterbekanntmachung nach dem Umwandlungsgesetz 09.10.2025 (Eintragungsdatum)\n\nNAWARO Damsdorf GmbH & Co. KG\nKommanditgesellschaft\nKloster Lehnin\n\nZu Eintragungsnummer 6 vom 09.10.2025 wird als nicht eingetragen veröffentlicht:\nDen Gläubigern der an der Verschmelzung beteiligten Rechtsträger ist, wenn sie binnen sechs Monaten nach dem Tag, an dem die Eintragung der Verschmelzung in das Register des Sitzes desjenigen Rechtsträgers, dessen Gläubiger sie sind, als bekannt gemacht gilt, ihren Anspruch nach Grund und Höhe schriftlich anmelden, Sicherheit zu leisten, soweit sie nicht Befriedigung verlangen können. Dieses Recht steht den Gläubigern jedoch nur zu, wenn sie glaubhaft machen, dass durch die Verschmelzung die Erfüllung ihrer Forderung gefährdet wird."
    },
    {
      "date": "2025-10-10",
      "id": "133473",
      "original_text": "Löschungsankündigung\nSaarland Amtsgericht Saarbrücken HRB 108663\nZOE Health UG (haftungsbeschränkt) – Ottweiler",
      "type": "Löschungsankündigung",
      "state": "Saarland",
      "amtsgericht": "Amtsgericht Saarbrücken",
      "registernummer": "HRB 108663",
      "registerart": "HRB",
      "company_name": "ZOE Health UG (haftungsbeschränkt)",
      "company_seat": "Ottweiler",
      "details": "10.10.2025 (Bekanntmachungsdatum)\n\nSaarland Amtsgericht Saarbrücken HRB 108663\nLöschungsankündigung\n\nZOE Health UG (haftungsbeschränkt)\nGesellschaft mit beschränkter Haftung\nOttweiler\n\nEs ist beabsichtigt, die Gesellschaft von Amts wegen gemäß § 394 FamFG wegen Vermögenslosigkeit zu löschen.\nGegen die Löschung von Amts wegen ist das Rechtsmittel des Widerspruchs statthaft. Der Widerspruch ist binnen einer Frist von 2 Monaten beginnend mit dem Tag dieser Veröffentlichung durch Einreichen eines Widerspruchsschreibens -schriftlich oder zur Niederschrift der Geschäftsstelle beim Amtsgericht Saarbrücken, -zentrales Handelsregister-, Mainzerstr.178, 66121 Saarbrücken einzulegen.\nDer Widerspruch muss die Bezeichnung der angefochtenen Löschungsankündigung enthalten sowie die Erklärung, dass Widerspruch eingelegt wird. Er ist vom Widerspruchsführer oder seinem Bevollmächtigten zu unterzeichnen.\nDas Widerspruchsschreiben kann auch in der Form eines elektronischen Dokumentes eingereicht werden, das mit einer qualifizierten elektronischen Signatur nach dem Signaturgesetz versehen sein muss (§§ 14 Abs. 2 FamFG, 130a, 298 ZPO)."
    },
    {
      "date": "2025-10-10",
      "id": "133474",
      "original_text": "Löschungsankündigung\nSaarland Amtsgericht Saarbrücken HRB 108661\nZOE STAR GmbH – Ottweiler",
      "type": "Löschungsankündigung",
      "state": "Saarland",
      "amtsgericht": "Amtsgericht Saarbrücken",
      "registernummer": "HRB 108661",
      "registerart": "HRB",
      "company_name": "ZOE STAR GmbH",
      "company_seat": "Ottweiler",
      "details": "10.10.2025 (Bekanntmachungsdatum)\n\nSaarland Amtsgericht Saarbrücken HRB 108661\nLöschungsankündigung\n\nZOE STAR GmbH\nGesellschaft mit beschränkter Haftung\nOttweiler\n\nEs ist beabsichtigt, die Gesellschaft von Amts wegen gemäß § 394 FamFG wegen Vermögenslosigkeit zu löschen.\nGegen die Löschung von Amts wegen ist das Rechtsmittel des Widerspruchs statthaft. Der Widerspruch ist binnen einer Frist von 2 Monaten beginnend mit dem Tag dieser Veröffentlichung durch Einreichen eines Widerspruchsschreibens -schriftlich oder zur Niederschrift der Geschäftsstelle beim Amtsgericht Saarbrücken, -zentrales Handelsregister-, Mainzerstr.178, 66121 Saarbrücken einzulegen.\nDer Widerspruch muss die Bezeichnung der angefochtenen Löschungsankündigung enthalten sowie die Erklärung, dass Widerspruch eingelegt wird. Er ist vom Widerspruchsführer oder seinem Bevollmächtigten zu unterzeichnen.\nDas Widerspruchsschreiben kann auch in der Form eines elektronischen Dokumentes eingereicht werden, das mit einer qualifizierten elektronischen Signatur nach dem Signaturgesetz versehen sein muss (§§ 14 Abs. 2 FamFG, 130a, 298 ZPO)."
    },
    {
      "date": "2025-10-10",
      "id": "133475",
      "original_text": "Registerbekanntmachung nach dem Umwandlungsgesetz\nBrandenburg Amtsgericht Potsdam HRA 5371\nNawaro Trechwitz GmbH & Co. KG – Kloster Lehnin",
      "type": "Registerbekanntmachung nach dem Umwandlungsgesetz",
      "state": "Brandenburg",
      "amtsgericht": "Amtsgericht Potsdam",
      "registernummer": "HRA 5371",
      "registerart": "HRA",
      "company_name": "Nawaro Trechwitz GmbH & Co. KG",
      "company_seat": "Kloster Lehnin",
      "details": "10.10.2025 (Bekanntmachungsdatum)\n\nBrandenburg Amtsgericht Potsdam HRA 5371\nRegisterbekanntmachung nach dem Umwandlungsgesetz 09.10.2025 (Eintragungsdatum)\n\nNawaro Trechwitz GmbH & Co. KG\nKommanditgesellschaft\nKloster Lehnin\n\nZu Eintragungsnummer 3 vom 09.10.2025 wird als nicht eingetragen veröffentlicht:\nDen Gläubigern der an der Verschmelzung beteiligten Rechtsträger ist, wenn sie binnen sechs Monaten nach dem Tag, an dem die Eintragung der Verschmelzung in das Register des Sitzes desjenigen Rechtsträgers, dessen Gläubiger sie sind, als bekannt gemacht gilt, ihren Anspruch nach Grund und Höhe schriftlich anmelden, Sicherheit zu leisten, soweit sie nicht Befriedigung verlangen können. Dieses Recht steht den Gläubigern jedoch nur zu, wenn sie glaubhaft machen, dass durch die Verschmelzung die Erfüllung ihrer Forderung gefährdet wird"
    },
    {
      "date": "2025-10-10",
      "id": "133476",
      "original_text": "Löschungsankündigung\nBaden-Württemberg Amtsgericht Stuttgart HRB 787789\nRK Mont GmbH – Stuttgart",
      "type": "Löschungsankündigung",
      "state": "Baden-Württemberg",
      "amtsgericht": "Amtsgericht Stuttgart",
      "registernummer": "HRB 787789",
      "registerart": "HRB",
      "company_name": "RK Mont GmbH",
      "company_seat": "Stuttgart",
      "details": "10.10.2025 (Bekanntmachungsdatum)\n\nBaden-Württemberg Amtsgericht Stuttgart HRB 787789\nLöschungsankündigung\n\nRK Mont GmbH\nGesellschaft mit beschränkter Haftung\nStuttgart\n\nAls nicht eingetragen wird bekanntgemacht:\nDas Gericht beabsichtigt, die Gesellschaft wegen Vermögenslosigkeit im Handelsregister von Amts wegen nach § 394 FamFG zu löschen. Die Frist zur Geltendmachung eines Widerspruchs gegen die beabsichtigte Löschung ist auf zwei Monate ab Veröffentlichung bestimmt."
    },
    {
      "date": "2025-10-10",
      "id": "133477",
      "original_text": "Registerbekanntmachung nach dem Umwandlungsgesetz\nSchleswig-Holstein Amtsgericht Pinneberg HRA 9418\nRieck Garten- und Landschaftsbau OHG – Wedel",
      "type": "Registerbekanntmachung nach dem Umwandlungsgesetz",
      "state": "Schleswig-Holstein",
      "amtsgericht": "Amtsgericht Pinneberg",
      "registernummer": "HRA 9418",
      "registerart": "HRA",
      "company_name": "Rieck Garten- und Landschaftsbau OHG",
      "company_seat": "Wedel",
      "details": "10.10.2025 (Bekanntmachungsdatum)\n\nSchleswig-Holstein Amtsgericht Pinneberg HRA 9418\nRegisterbekanntmachung nach dem Umwandlungsgesetz 08.10.2025 (Eintragungsdatum)\n\nRieck Garten- und Landschaftsbau OHG\nOffene Handelsgesellschaft\nWedel\n\nZu Eintragungsnummer 2 vom 08.10.2025 wird als nicht eingetragen veröffentlicht: Den Gläubigern ist, wenn sie binnen sechs Monaten nach dem Tag, an dem die Eintragung der Umwandlung als bekannt gemacht gilt, ihren Anspruch nach Grund und Höhe schriftlich anmelden, Sicherheit zu leisten, soweit sie nicht Befriedigung verlangen können. Dieses Recht steht den Gläubigern jedoch nur zu, wenn sie glaubhaft machen, dass durch die Umwandlung die Erfüllung ihrer Forderung gefährdet wird. Das Recht, Sicherheitsleistung zu verlangen, steht Gläubigern nicht zu, die im Falle der Insolvenz ein Recht auf vorzugsweise Befriedigung aus einer Deckungsmasse haben, die nach gesetzlicher Vorschrift zu ihrem Schutz errichtet und staatlich überwacht ist."
    },
    {
      "date": "2025-10-10",
      "id": "133478",
      "original_text": "Einreichung neuer Dokumente\nBerlin Amtsgericht Berlin (Charlottenburg) HRB 37967\nGeschäftszentrum Kurfürstendamm 106 Verwaltungs-GmbH – Berlin",
      "type": "Einreichung neuer Dokumente",
      "state": "Berlin",
      "amtsgericht": "Amtsgericht Berlin (Charlottenburg)",
      "registernummer": "HRB 37967",
      "registerart": "HRB",
      "company_name": "Geschäftszentrum Kurfürstendamm 106 Verwaltungs-GmbH",
      "company_seat": "Berlin",
      "details": "10.10.2025 (Bekanntmachungsdatum)\n\nBerlin Amtsgericht Berlin (Charlottenburg) HRB 37967\nEinreichung neuer Dokumente\n\nGeschäftszentrum Kurfürstendamm 106 Verwaltungs-GmbH\nGesellschaft mit beschränkter Haftung\nBerlin\n\nAls nicht eingetragen wird veröffentlicht:\n\nEs wurde eine neue Liste der Beiratsmitglieder eingereicht (§52 GmbHG)."
    },
    {
      "date": "2025-10-10",
      "id": "133479",
      "original_text": "Registerbekanntmachung nach dem Umwandlungsgesetz\nHamburg Amtsgericht Hamburg HRB 56865\nLufthansa Technik Aktiengesellschaft – Hamburg",
      "type": "Registerbekanntmachung nach dem Umwandlungsgesetz",
      "state": "Hamburg",
      "amtsgericht": "Amtsgericht Hamburg",
      "registernummer": "HRB 56865",
      "registerart": "HRB",
      "company_name": "Lufthansa Technik Aktiengesellschaft",
      "company_seat": "Hamburg",
      "details": "10.10.2025 (Bekanntmachungsdatum)\n\nHamburg Amtsgericht Hamburg HRB 56865\nRegisterbekanntmachung nach dem Umwandlungsgesetz 10.10.2025 (Eintragungsdatum)\n\nLufthansa Technik Aktiengesellschaft\nAktiengesellschaft\nHamburg\n\nAls nicht eingetragen wird bekannt gemacht:\nDen Gläubigern der an der Abspaltung beteiligten Gesellschaften ist, wenn sie binnen sechs Monaten nach dem Tag, an dem die Eintragung der Abspaltung in das Register des Sitzes desjenigen Rechtsträgers, dessen Gläubiger sie sind, nach § 19 Absatz 3 UmwG als bekannt gemacht gilt, ihren Anspruch nach Grund und Höhe schriftlich anmelden, Sicherheit zu leisten, soweit sie nicht Befriedigung verlangen können. Dieses Recht steht den Gläubigern jedoch nur zu, wenn sie glaubhaft machen, dass durch die Abspaltung die Erfüllung ihrer Forderung gefährdet wird."
    },
    {
      "date": "2025-10-10",
      "id": "133480",
      "original_text": "Registerbekanntmachung nach dem Umwandlungsgesetz\nSchleswig-Holstein Amtsgericht Lübeck HRB 26692\nVivanco Gruppe GmbH – Ahrensburg",
      "type": "Registerbekanntmachung nach dem Umwandlungsgesetz",
      "state": "Schleswig-Holstein",
      "amtsgericht": "Amtsgericht Lübeck",
      "registernummer": "HRB 26692",
      "registerart": "HRB",
      "company_name": "Vivanco Gruppe GmbH",
      "company_seat": "Ahrensburg",
      "details": "10.10.2025 (Bekanntmachungsdatum)\n\nSchleswig-Holstein Amtsgericht Lübeck HRB 26692\nRegisterbekanntmachung nach dem Umwandlungsgesetz 09.10.2025 (Eintragungsdatum)\n\nVivanco Gruppe GmbH\nGesellschaft mit beschränkter Haftung\nAhrensburg\n\nZu Eintragungsnummer 1 vom 09.10.2025 wird als nicht eingetragen veröffentlicht:  Den Gläubigern ist, wenn sie binnen sechs Monaten nach dem Tag, an dem die Eintragung der Umwandlung als bekannt gemacht gilt, ihren Anspruch nach Grund und Höhe schriftlich anmelden, Sicherheit zu leisten, soweit sie nicht Befriedigung verlangen können. Dieses Recht steht den Gläubigern jedoch nur zu, wenn sie glaubhaft machen, dass durch die Umwandlung die Erfüllung ihrer Forderung gefährdet wird."
    },
    {
      "date": "2025-10-10",
      "id": "133481",
      "original_text": "Löschungsankündigung\nBaden-Württemberg Amtsgericht Stuttgart HRB 785391\nD & S GmbH – Welzheim",
      "type": "Löschungsankündigung",
      "state": "Baden-Württemberg",
      "amtsgericht": "Amtsgericht Stuttgart",
      "registernummer": "HRB 785391",
      "registerart": "HRB",
      "company_name": "D & S GmbH",
      "company_seat": "Welzheim",
      "details": "10.10.2025 (Bekanntmachungsdatum)\n\nBaden-Württemberg Amtsgericht Stuttgart HRB 785391\nLöschungsankündigung\n\nD & S GmbH\nGesellschaft mit beschränkter Haftung\nWelzheim\n\nAls nicht eingetragen wird bekanntgemacht:\nDas Gericht beabsichtigt, die Gesellschaft wegen Vermögenslosigkeit im Handelsregister von Amts wegen nach § 394 FamFG zu löschen. Die Frist zur Geltendmachung eines Widerspruchs gegen die beabsichtigte Löschung ist auf zwei Monate ab Veröffentlichung bestimmt."
    },
    {
      "date": "2025-10-10",
      "id": "133482",
      "original_text": "Löschungsankündigung\nSaarland Amtsgericht Saarbrücken HRB 4980\nZimmermann Putz-GmbH – Kleinblittersdorf",
      "type": "Löschungsankündigung",
      "state": "Saarland",
      "amtsgericht": "Amtsgericht Saarbrücken",
      "registernummer": "HRB 4980",
      "registerart": "HRB",
      "company_name": "Zimmermann Putz-GmbH",
      "company_seat": "Kleinblittersdorf",
      "details": "10.10.2025 (Bekanntmachungsdatum)\n\nSaarland Amtsgericht Saarbrücken HRB 4980\nLöschungsankündigung\n\nZimmermann Putz-GmbH\nGesellschaft mit beschränkter Haftung\nKleinblittersdorf\n\nEs ist beabsichtigt, die Gesellschaft von Amts wegen gemäß § 394 FamFG wegen Vermögenslosigkeit zu löschen.\nGegen die Löschung von Amts wegen ist das Rechtsmittel des Widerspruchs statthaft. Der Widerspruch ist binnen einer Frist zwei Monaten beginnend mit dem Tag dieser Veröffentlichung durch Einreichen eines Widerspruchsschreibens -schriftlich oder zur Niederschrift der Geschäftsstelle beim Amtsgericht Saarbrücken, -zentrales Handelsregister-, Mainzerstr.178, 66121 Saarbrücken einzulegen.\nDer Widerspruch muss die Bezeichnung der angefochtenen Löschungsankündigung enthalten sowie die Erklärung, dass Widerspruch eingelegt wird. Er ist vom Widerspruchsführer oder seinem Bevollmächtigten zu unterzeichnen.\nDas Widerspruchsschreiben kann auch in der Form eines elektronischen Dokumentes eingereicht werden, das mit einer qualifizierten elektronischen Signatur nach dem Signaturgesetz versehen sein muss (§§ 14 Abs. 2 FamFG, 130a, 298 ZPO)."
    },
    {
      "date": "2025-10-10",
      "id": "133483",
      "original_text": "Registerbekanntmachung nach dem Umwandlungsgesetz\nHamburg Amtsgericht Hamburg HRB 110566\naccantec information solutions AG – Hamburg",
      "type": "Registerbekanntmachung nach dem Umwandlungsgesetz",
      "state": "Hamburg",
      "amtsgericht": "Amtsgericht Hamburg",
      "registernummer": "HRB 110566",
      "registerart": "HRB",
      "company_name": "accantec information solutions AG",
      "company_seat": "Hamburg",
      "details": "10.10.2025 (Bekanntmachungsdatum)\n\nHamburg Amtsgericht Hamburg HRB 110566\nRegisterbekanntmachung nach dem Umwandlungsgesetz 10.10.2025 (Eintragungsdatum)\n\naccantec information solutions AG\nAktiengesellschaft\nHamburg\n\nAls nicht eingetragen wird bekannt gemacht:\nDen Gläubigern der an der formwechselnden Umwandlung beteiligten Gesellschaften ist, wenn sie binnen sechs Monaten nach dem Tag, an dem die Eintragung der formwechselnden Umwandlung in das Register des Sitzes desjenigen Rechtsträgers, dessen Gläubiger sie sind, nach § 19 Absatz 3 UmwG als bekannt gemacht gilt, ihren Anspruch nach Grund und Höhe schriftlich anmelden, Sicherheit zu leisten, soweit sie nicht Befriedigung verlangen können. Dieses Recht steht den Gläubigern jedoch nur zu, wenn sie glaubhaft machen, dass durch die formwechselnde Umwandlung die Erfüllung ihrer Forderung gefährdet wird."
    },
    {
      "date": "2025-10-10",
      "id": "133484",
      "original_text": "Registerbekanntmachung nach dem Umwandlungsgesetz\nBerlin Amtsgericht Berlin (Charlottenburg) HRB 54800\nCenes Immo GmbH – Berlin",
      "type": "Registerbekanntmachung nach dem Umwandlungsgesetz",
      "state": "Berlin",
      "amtsgericht": "Amtsgericht Berlin (Charlottenburg)",
      "registernummer": "HRB 54800",
      "registerart": "HRB",
      "company_name": "Cenes Immo GmbH",
      "company_seat": "Berlin",
      "details": "10.10.2025 (Bekanntmachungsdatum)\n\nBerlin Amtsgericht Berlin (Charlottenburg) HRB 54800\nRegisterbekanntmachung nach dem Umwandlungsgesetz 09.10.2025 (Eintragungsdatum)\n\nCenes Immo GmbH\nGesellschaft mit beschränkter Haftung\nBerlin\n\nZu Eintragungsnummer 11 vom 09.10.2025 wird als nicht eingetragen veröffentlicht: Den Gläubigern der an der Verschmelzung beteiligten Rechtsträger ist, wenn sie binnen sechs Monaten nach dem Tag, an dem die Eintragung der Verschmelzung in das Register des Sitzes desjenigen Rechtsträgers, dessen Gläubiger sie sind, als bekannt gemacht gilt, ihren Anspruch nach Grund und Höhe schriftlich anmelden, Sicherheit zu leisten, soweit sie nicht Befriedigung verlangen können. Dieses Recht steht den Gläubigern jedoch nur zu, wenn sie glaubhaft machen, dass durch die Verschmelzung die Erfüllung ihrer Forderung gefährdet wird. Das Recht, Sicherheitsleistung zu verlangen, steht Gläubigern nicht zu, die im Falle der Insolvenz ein Recht auf vorzugsweise Befriedigung aus einer Deckungsmasse haben, die nach gesetzlicher Vorschrift zu ihrem Schutz errichtet und staatlich überwacht ist."
    },
    {
      "date": "2025-10-10",
      "id": "133485",
      "original_text": "Registerbekanntmachung nach dem Umwandlungsgesetz\nHamburg Amtsgericht Hamburg HRB 101311\naccantec finance solutions AG – Hamburg",
      "type": "Registerbekanntmachung nach dem Umwandlungsgesetz",
      "state": "Hamburg",
      "amtsgericht": "Amtsgericht Hamburg",
      "registernummer": "HRB 101311",
      "registerart": "HRB",
      "company_name": "accantec finance solutions AG",
      "company_seat": "Hamburg",
      "details": "10.10.2025 (Bekanntmachungsdatum)\n\nHamburg Amtsgericht Hamburg HRB 101311\nRegisterbekanntmachung nach dem Umwandlungsgesetz 10.10.2025 (Eintragungsdatum)\n\naccantec finance solutions AG\nAktiengesellschaft\nHamburg\n\nAls nicht eingetragen wird bekannt gemacht:\nDen Gläubigern der an der formwechselnden Umwandlung beteiligten Gesellschaften ist, wenn sie binnen sechs Monaten nach dem Tag, an dem die Eintragung der formwechselnden Umwandlung in das Register des Sitzes desjenigen Rechtsträgers, dessen Gläubiger sie sind, nach § 19 Absatz 3 UmwG als bekannt gemacht gilt, ihren Anspruch nach Grund und Höhe schriftlich anmelden, Sicherheit zu leisten, soweit sie nicht Befriedigung verlangen können. Dieses Recht steht den Gläubigern jedoch nur zu, wenn sie glaubhaft machen, dass durch die formwechselnde Umwandlung die Erfüllung ihrer Forderung gefährdet wird."
    },
    {
      "date": "2025-10-10",
      "id": "133486",
      "original_text": "Registerbekanntmachung nach dem Umwandlungsgesetz\nBerlin Amtsgericht Berlin (Charlottenburg) HRB 248996\nBoksi.com GmbH – Berlin",
      "type": "Registerbekanntmachung nach dem Umwandlungsgesetz",
      "state": "Berlin",
      "amtsgericht": "Amtsgericht Berlin (Charlottenburg)",
      "registernummer": "HRB 248996",
      "registerart": "HRB",
      "company_name": "Boksi.com GmbH",
      "company_seat": "Berlin",
      "details": "10.10.2025 (Bekanntmachungsdatum)\n\nBerlin Amtsgericht Berlin (Charlottenburg) HRB 248996\nRegisterbekanntmachung nach dem Umwandlungsgesetz 10.10.2025 (Eintragungsdatum)\n\nBoksi.com GmbH\nGesellschaft mit beschränkter Haftung\nBerlin\n\nZu Eintragungsnummer 4 vom 10.10.2025 wird als nicht eingetragen veröffentlicht: Den Gläubigern der an der Verschmelzung beteiligten Rechtsträger ist, wenn sie binnen sechs Monaten nach dem Tag, an dem die Eintragung der Verschmelzung in das Register des Sitzes desjenigen Rechtsträgers, dessen Gläubiger sie sind, als bekannt gemacht gilt, ihren Anspruch nach Grund und Höhe schriftlich anmelden, Sicherheit zu leisten, soweit sie nicht Befriedigung verlangen können. Dieses Recht steht den Gläubigern jedoch nur zu, wenn sie glaubhaft machen, dass durch die Verschmelzung die Erfüllung ihrer Forderung gefährdet wird. Das Recht, Sicherheitsleistung zu verlangen, steht Gläubigern nicht zu, die im Falle der Insolvenz ein Recht auf vorzugsweise Befriedigung aus einer Deckungsmasse haben, die nach gesetzlicher Vorschrift zu ihrem Schutz errichtet und staatlich überwacht ist."
    },
    {
      "date": "2025-10-10",
      "id": "133487",
      "original_text": "Registerbekanntmachung nach dem Umwandlungsgesetz\nBerlin Amtsgericht Berlin (Charlottenburg) HRB 266497\nCenes HV1 UG (haftungsbeschränkt) – Berlin",
      "type": "Registerbekanntmachung nach dem Umwandlungsgesetz",
      "state": "Berlin",
      "amtsgericht": "Amtsgericht Berlin (Charlottenburg)",
      "registernummer": "HRB 266497",
      "registerart": "HRB",
      "company_name": "Cenes HV1 UG (haftungsbeschränkt)",
      "company_seat": "Berlin",
      "details": "10.10.2025 (Bekanntmachungsdatum)\n\nBerlin Amtsgericht Berlin (Charlottenburg) HRB 266497\nRegisterbekanntmachung nach dem Umwandlungsgesetz 09.10.2025 (Eintragungsdatum)\n\nCenes HV1  UG (haftungsbeschränkt)\nGesellschaft mit beschränkter Haftung\nBerlin\n\nZu Eintragungsnummer 2 vom 09.10.2025 wird als nicht eingetragen veröffentlicht: Den Gläubigern der an der Verschmelzung beteiligten Rechtsträger ist, wenn sie binnen sechs Monaten nach dem Tag, an dem die Eintragung der Verschmelzung in das Register des Sitzes desjenigen Rechtsträgers, dessen Gläubiger sie sind, als bekannt gemacht gilt, ihren Anspruch nach Grund und Höhe schriftlich anmelden, Sicherheit zu leisten, soweit sie nicht Befriedigung verlangen können. Dieses Recht steht den Gläubigern jedoch nur zu, wenn sie glaubhaft machen, dass durch die Verschmelzung die Erfüllung ihrer Forderung gefährdet wird. Das Recht, Sicherheitsleistung zu verlangen, steht Gläubigern nicht zu, die im Falle der Insolvenz ein Recht auf vorzugsweise Befriedigung aus einer Deckungsmasse haben, die nach gesetzlicher Vorschrift zu ihrem Schutz errichtet und staatlich überwacht ist."
    },
    {
      "date": "2025-10-10",
      "id": "133488",
      "original_text": "Registerbekanntmachung nach dem Umwandlungsgesetz\nHamburg Amtsgericht Hamburg HRB 185732\nElektro Fastabend GmbH – Hamburg",
      "type": "Registerbekanntmachung nach dem Umwandlungsgesetz",
      "state": "Hamburg",
      "amtsgericht": "Amtsgericht Hamburg",
      "registernummer": "HRB 185732",
      "registerart": "HRB",
      "company_name": "Elektro Fastabend GmbH",
      "company_seat": "Hamburg",
      "details": "10.10.2025 (Bekanntmachungsdatum)\n\nHamburg Amtsgericht Hamburg HRB 185732\nRegisterbekanntmachung nach dem Umwandlungsgesetz 10.10.2025 (Eintragungsdatum)\n\nElektro Fastabend GmbH\nGesellschaft mit beschränkter Haftung\nHamburg\n\nAls nicht eingetragen wird bekannt gemacht:\nDen Gläubigern der an der Verschmelzung beteiligten Gesellschaften ist, wenn sie binnen sechs Monaten nach dem Tag, an dem die Eintragung der Verschmelzung in das Register des Sitzes desjenigen Rechtsträgers, dessen Gläubiger sie sind, nach § 19 Absatz 3 UmwG als bekannt gemacht gilt, ihren Anspruch nach Grund und Höhe schriftlich anmelden, Sicherheit zu leisten, soweit sie nicht Befriedigung verlangen können. Dieses Recht steht den Gläubigern jedoch nur zu, wenn sie glaubhaft machen, dass durch die Verschmelzung die Erfüllung ihrer Forderung gefährdet wird."
    },
    {
      "date": "2025-10-10",
      "id": "133489",
      "original_text": "Registerbekanntmachung nach dem Umwandlungsgesetz\nSchleswig-Holstein Amtsgericht Kiel HRA 12785\nTimm-Anhänger GmbH & Co. KG – Stolpe",
      "type": "Registerbekanntmachung nach dem Umwandlungsgesetz",
      "state": "Schleswig-Holstein",
      "amtsgericht": "Amtsgericht Kiel",
      "registernummer": "HRA 12785",
      "registerart": "HRA",
      "company_name": "Timm-Anhänger GmbH & Co. KG",
      "company_seat": "Stolpe",
      "details": "10.10.2025 (Bekanntmachungsdatum)\n\nSchleswig-Holstein Amtsgericht Kiel HRA 12785\nRegisterbekanntmachung nach dem Umwandlungsgesetz 07.10.2025 (Eintragungsdatum)\n\nTimm-Anhänger GmbH & Co. KG\nKommanditgesellschaft\nStolpe\n\nZu Eintragungsnummer 2 vom 07.10.2025 wird als nicht eingetragen veröffentlicht: Den Gläubigern der an der Spaltung beteiligten Rechtsträger ist, wenn sie binnen sechs Monaten nach dem Tag, an dem die Eintragung der Spaltung in das Register des Sitzes desjenigen Rechtsträgers, dessen Gläubiger sie sind,  bekannt gemacht worden ist, ihren Anspruch nach Grund und Höhe schriftlich anmelden, Sicherheit zu leisten, soweit sie nicht Befriedigung verlangen können. Dieses Recht steht den Gläubigern jedoch nur zu, wenn sie glaubhaft machen, dass durch die Spaltung die Erfüllung ihrer Forderung gefährdet wird."
    },
    {
      "date": "2025-10-10",
      "id": "133490",
      "original_text": "Löschungsankündigung\nBerlin Amtsgericht Berlin (Charlottenburg) HRB 248241\nglamfunk-connect GmbH – Berlin",
      "type": "Löschungsankündigung",
      "state": "Berlin",
      "amtsgericht": "Amtsgericht Berlin (Charlottenburg)",
      "registernummer": "HRB 248241",
      "registerart": "HRB",
      "company_name": "glamfunk-connect GmbH",
      "company_seat": "Berlin",
      "details": "10.10.2025 (Bekanntmachungsdatum)\n\nBerlin Amtsgericht Berlin (Charlottenburg) HRB 248241\nLöschungsankündigung\n\nglamfunk-connect GmbH\nGesellschaft mit beschränkter Haftung\nBerlin\n\nBei der nachstehenden Gesellschaft wird das Amtslöschungsverfahren gemäß § 394 FamFG eingeleitet. Widerspruchsfrist 6 Wochen"
    },
    {
      "date": "2025-10-10",
      "id": "133491",
      "original_text": "Registerbekanntmachung nach dem Umwandlungsgesetz\nHamburg Amtsgericht Hamburg HRB 148574\nurban apes Hamburg Ost GmbH – Hamburg",
      "type": "Registerbekanntmachung nach dem Umwandlungsgesetz",
      "state": "Hamburg",
      "amtsgericht": "Amtsgericht Hamburg",
      "registernummer": "HRB 148574",
      "registerart": "HRB",
      "company_name": "urban apes Hamburg Ost GmbH",
      "company_seat": "Hamburg",
      "details": "10.10.2025 (Bekanntmachungsdatum)\n\nHamburg Amtsgericht Hamburg HRB 148574\nRegisterbekanntmachung nach dem Umwandlungsgesetz 10.10.2025 (Eintragungsdatum)\n\nurban apes Hamburg Ost GmbH\nGesellschaft mit beschränkter Haftung\nHamburg\n\nAls nicht eingetragen wird bekannt gemacht:\nDen Gläubigern der an der Verschmelzung beteiligten Gesellschaften ist, wenn sie binnen sechs Monaten nach dem Tag, an dem die Eintragung der Verschmelzung in das Register des Sitzes desjenigen Rechtsträgers, dessen Gläubiger sie sind, nach § 19 Absatz 3 UmwG als bekannt gemacht gilt, ihren Anspruch nach Grund und Höhe schriftlich anmelden, Sicherheit zu leisten, soweit sie nicht Befriedigung verlangen können. Dieses Recht steht den Gläubigern jedoch nur zu, wenn sie glaubhaft machen, dass durch die Verschmelzung die Erfüllung ihrer Forderung gefährdet wird."
    },
    {
      "date": "2025-10-10",
      "id": "133492",
      "original_text": "Registerbekanntmachung nach dem Umwandlungsgesetz\nHamburg Amtsgericht Hamburg HRB 169192\nurban apes Hamburg Mitte GmbH – Hamburg",
      "type": "Registerbekanntmachung nach dem Umwandlungsgesetz",
      "state": "Hamburg",
      "amtsgericht": "Amtsgericht Hamburg",
      "registernummer": "HRB 169192",
      "registerart": "HRB",
      "company_name": "urban apes Hamburg Mitte GmbH",
      "company_seat": "Hamburg",
      "details": "10.10.2025 (Bekanntmachungsdatum)\n\nHamburg Amtsgericht Hamburg HRB 169192\nRegisterbekanntmachung nach dem Umwandlungsgesetz 10.10.2025 (Eintragungsdatum)\n\nurban apes Hamburg Mitte GmbH\nGesellschaft mit beschränkter Haftung\nHamburg\n\nAls nicht eingetragen wird bekannt gemacht:\nDen Gläubigern der an der Verschmelzung beteiligten Gesellschaften ist, wenn sie binnen sechs Monaten nach dem Tag, an dem die Eintragung der Verschmelzung in das Register des Sitzes desjenigen Rechtsträgers, dessen Gläubiger sie sind, nach § 19 Absatz 3 UmwG als bekannt gemacht gilt, ihren Anspruch nach Grund und Höhe schriftlich anmelden, Sicherheit zu leisten, soweit sie nicht Befriedigung verlangen können. Dieses Recht steht den Gläubigern jedoch nur zu, wenn sie glaubhaft machen, dass durch die Verschmelzung die Erfüllung ihrer Forderung gefährdet wird."
    },
    {
      "date": "2025-10-10",
      "id": "133493",
      "original_text": "Sonstige Registerbekanntmachung\nBerlin Amtsgericht Berlin (Charlottenburg) HRB 124396\nEduard Winter Dienstleistungsgesellschaft mbH – Berlin",
      "type": "Sonstige Registerbekanntmachung",
      "state": "Berlin",
      "amtsgericht": "Amtsgericht Berlin (Charlottenburg)",
      "registernummer": "HRB 124396",
      "registerart": "HRB",
      "company_name": "Eduard Winter Dienstleistungsgesellschaft mbH",
      "company_seat": "Berlin",
      "details": "10.10.2025 (Bekanntmachungsdatum)\n\nBerlin Amtsgericht Berlin (Charlottenburg) HRB 124396\nSonstige Registerbekanntmachung\n\nEduard Winter Dienstleistungsgesellschaft mbH\nGesellschaft mit beschränkter Haftung\nBerlin\n\nAls nicht eingetragen wird veröffentlicht: Es wurde eine neue Liste der Beiratsmitglieder eingereicht (§52 GmbHG)."
    },
    {
      "date": "2025-10-10",
      "id": "133494",
      "original_text": "Einreichung neuer Dokumente\nBaden-Württemberg Amtsgericht Stuttgart HRB 480006\nSchramberger Wohnungsbau, Gesellschaft mit beschränkter Haftung – Schramberg",
      "type": "Einreichung neuer Dokumente",
      "state": "Baden-Württemberg",
      "amtsgericht": "Amtsgericht Stuttgart",
      "registernummer": "HRB 480006",
      "registerart": "HRB",
      "company_name": "Schramberger Wohnungsbau, Gesellschaft mit beschränkter Haftung",
      "company_seat": "Schramberg",
      "details": "10.10.2025 (Bekanntmachungsdatum)\n\nBaden-Württemberg Amtsgericht Stuttgart HRB 480006\nEinreichung neuer Dokumente\n\nSchramberger Wohnungsbau, Gesellschaft mit beschränkter Haftung\nGesellschaft mit beschränkter Haftung\nSchramberg\n\nDie Gesellschaft hat am 09.10.2025 die Liste über die Zusammensetzung des Aufsichtsrats zum Handelsregister eingereicht."
    },
    {
      "date": "2025-10-10",
      "id": "133495",
      "original_text": "Einreichung neuer Dokumente\nBaden-Württemberg Amtsgericht Ulm HRB 680461\nStadtwerk Tauberfranken GmbH – Bad Mergentheim",
      "type": "Einreichung neuer Dokumente",
      "state": "Baden-Württemberg",
      "amtsgericht": "Amtsgericht Ulm",
      "registernummer": "HRB 680461",
      "registerart": "HRB",
      "company_name": "Stadtwerk Tauberfranken GmbH",
      "company_seat": "Bad Mergentheim",
      "details": "10.10.2025 (Bekanntmachungsdatum)\n\nBaden-Württemberg Amtsgericht Ulm HRB 680461\nEinreichung neuer Dokumente 10.10.2025 (Eintragungsdatum)\n\nStadtwerk Tauberfranken GmbH\nGesellschaft mit beschränkter Haftung\nBad Mergentheim\n\nDie Gesellschaft hat am 02.10.2025 die Liste über die Zusammensetzung des Aufsichtsrats zum Handelsregister eingereicht."
    },
    {
      "date": "2025-10-10",
      "id": "133496",
      "original_text": "Registerbekanntmachung nach dem Umwandlungsgesetz\nHamburg Amtsgericht Hamburg HRB 166194\nurban apes Hamburg GmbH – Hamburg",
      "type": "Registerbekanntmachung nach dem Umwandlungsgesetz",
      "state": "Hamburg",
      "amtsgericht": "Amtsgericht Hamburg",
      "registernummer": "HRB 166194",
      "registerart": "HRB",
      "company_name": "urban apes Hamburg GmbH",
      "company_seat": "Hamburg",
      "details": "10.10.2025 (Bekanntmachungsdatum)\n\nHamburg Amtsgericht Hamburg HRB 166194\nRegisterbekanntmachung nach dem Umwandlungsgesetz 10.10.2025 (Eintragungsdatum)\n\nurban apes Hamburg GmbH\nGesellschaft mit beschränkter Haftung\nHamburg\n\nAls nicht eingetragen wird bekannt gemacht:\nDen Gläubigern der an der Verschmelzung beteiligten Gesellschaften ist, wenn sie binnen sechs Monaten nach dem Tag, an dem die Eintragung der Verschmelzung in das Register des Sitzes derjenigen Rechtsträger deren Gläubiger sie sind, nach § 19 Absatz 3 UmwG als bekannt gemacht gilt, ihren Anspruch nach Grund und Höhe schriftlich anmelden, Sicherheit zu leisten, soweit sie nicht Befriedigung verlangen können. Dieses Recht steht den Gläubigern jedoch nur zu, wenn sie glaubhaft machen, dass durch die Verschmelzung die Erfüllung ihrer Forderung gefährdet wird."
    },
    {
      "date": "2025-10-10",
      "id": "133497",
      "original_text": "Sonstige Registerbekanntmachung\nBerlin Amtsgericht Berlin (Charlottenburg) HRB 176365\nTele Columbus Netz GmbH – Berlin",
      "type": "Sonstige Registerbekanntmachung",
      "state": "Berlin",
      "amtsgericht": "Amtsgericht Berlin (Charlottenburg)",
      "registernummer": "HRB 176365",
      "registerart": "HRB",
      "company_name": "Tele Columbus Netz GmbH",
      "company_seat": "Berlin",
      "details": "10.10.2025 (Bekanntmachungsdatum)\n\nBerlin Amtsgericht Berlin (Charlottenburg) HRB 176365\nSonstige Registerbekanntmachung\n\nTele Columbus Netz GmbH\nGesellschaft mit beschränkter Haftung\nBerlin\n\nAls nicht eingetragen wird veröffentlicht: Den Gläubigern der an der Spaltung beteiligten Rechtsträger ist, wenn sie binnen sechs Monaten nach dem Tag, an dem die Eintragung der Spaltung in das Register des Sitzes desjenigen Rechtsträgers, dessen Gläubiger sie sind, als bekannt gemacht gilt, ihren Anspruch nach Grund und Höhe schriftlich anmelden, Sicherheit zu leisten, soweit sie nicht Befriedigung verlangen können. Dieses Recht steht den Gläubigern jedoch nur zu, wenn sie glaubhaft machen, dass durch die Spaltung die Erfüllung ihrer Forderung gefährdet wird. Das Recht, Sicherheitsleistung zu verlangen, steht Gläubigern nicht zu, die im Falle der Insolvenz ein Recht auf vorzugsweise Befriedigung aus einer Deckungsmasse haben, die nach gesetzlicher Vorschrift zu ihrem Schutz errichtet und staatlich überwacht ist."
    },
    {
      "date": "2025-10-10",
      "id": "133498",
      "original_text": "Registerbekanntmachung nach dem Umwandlungsgesetz\nBaden-Württemberg Amtsgericht Stuttgart HRA 290445\nKSK Kabel- und Steckerkonfektionierung GmbH & Co. KG – Sachsenheim",
      "type": "Registerbekanntmachung nach dem Umwandlungsgesetz",
      "state": "Baden-Württemberg",
      "amtsgericht": "Amtsgericht Stuttgart",
      "registernummer": "HRA 290445",
      "registerart": "HRA",
      "company_name": "KSK Kabel- und Steckerkonfektionierung GmbH & Co. KG",
      "company_seat": "Sachsenheim",
      "details": "10.10.2025 (Bekanntmachungsdatum)\n\nBaden-Württemberg Amtsgericht Stuttgart HRA 290445\nRegisterbekanntmachung nach dem Umwandlungsgesetz 10.10.2025 (Eintragungsdatum)\n\nKSK Kabel- und Steckerkonfektionierung GmbH & Co. KG\nKommanditgesellschaft\nSachsenheim\n\nAls nicht eingetragen wird bekanntgemacht:\nDen Gläubigern der an der Abspaltung beteiligten Rechtsträger ist, wenn sie binnen sechs Monaten nach dem Tag, an dem die Eintragung der Abspaltung in das Register des Sitzes desjenigen Rechtsträgers, dessen Gläubiger sie sind, nach § 19 Abs. 3 UmwG als bekanntgemacht gilt, ihren Anspruch nach Grund und Höhe schriftlich anmelden, Sicherheit zu leisten, soweit sie nicht Befriedigung verlangen können. Dieses Recht steht den Gläubigern jedoch nur zu, wenn sie glaubhaft machen, dass durch die Abspaltung die Erfüllung ihrer Forderung gefährdet wird."
    },
    {
      "date": "2025-10-10",
      "id": "133499",
      "original_text": "Löschungsankündigung\nBerlin Amtsgericht Berlin (Charlottenburg) HRB 178705\nKonvex Bau GmbH – Berlin",
      "type": "Löschungsankündigung",
      "state": "Berlin",
      "amtsgericht": "Amtsgericht Berlin (Charlottenburg)",
      "registernummer": "HRB 178705",
      "registerart": "HRB",
      "company_name": "Konvex Bau GmbH",
      "company_seat": "Berlin",
      "details": "10.10.2025 (Bekanntmachungsdatum)\n\nBerlin Amtsgericht Berlin (Charlottenburg) HRB 178705\nLöschungsankündigung\n\nKonvex Bau GmbH\nGesellschaft mit beschränkter Haftung\nBerlin\n\nBei der nachstehenden Gesellschaft wird das Amtslöschungsverfahren gemäß § 394 FamFG eingeleitet. Widerspruchsfrist 6 Wochen"
    },
    {
      "date": "2025-10-10",
      "id": "133500",
      "original_text": "Löschungsankündigung\nSchleswig-Holstein Amtsgericht Pinneberg HRB 13053\nstockmaritime GmbH – Schenefeld/Krs. Schenefeld",
      "type": "Löschungsankündigung",
      "state": "Schleswig-Holstein",
      "amtsgericht": "Amtsgericht Pinneberg",
      "registernummer": "HRB 13053",
      "registerart": "HRB",
      "company_name": "stockmaritime GmbH",
      "company_seat": "Schenefeld/Krs. Schenefeld",
      "details": "10.10.2025 (Bekanntmachungsdatum)\n\nSchleswig-Holstein Amtsgericht Pinneberg HRB 13053\nLöschungsankündigung\n\nstockmaritime GmbH\nGesellschaft mit beschränkter Haftung\nSchenefeld/Krs. Schenefeld\n\nEs ist die Löschung der nachstehenden Gesellschaft wegen Vermögenslosigkeit gemäß § 394 FamFG beabsichtigt. Widerspruchsfrist: 2 Monate."
    },
    {
      "date": "2025-10-10",
      "id": "133501",
      "original_text": "Löschungsankündigung\nBerlin Amtsgericht Berlin (Charlottenburg) HRB 176696\nGlobus Gold GmbH – Berlin",
      "type": "Löschungsankündigung",
      "state": "Berlin",
      "amtsgericht": "Amtsgericht Berlin (Charlottenburg)",
      "registernummer": "HRB 176696",
      "registerart": "HRB",
      "company_name": "Globus Gold GmbH",
      "company_seat": "Berlin",
      "details": "10.10.2025 (Bekanntmachungsdatum)\n\nBerlin Amtsgericht Berlin (Charlottenburg) HRB 176696\nLöschungsankündigung\n\nGlobus Gold GmbH\nGesellschaft mit beschränkter Haftung\nBerlin\n\nBei der nachstehenden Gesellschaft wird das Amtslöschungsverfahren gemäß § 394 FamFG eingeleitet. Widerspruchsfrist 6 Wochen"
    },
    {
      "date": "2025-10-10",
      "id": "133502",
      "original_text": "Registerbekanntmachung nach dem Umwandlungsgesetz\nSchleswig-Holstein Amtsgericht Kiel HRB 15641\nVION Zucht- und Nutzvieh GmbH – Bad Bramstedt",
      "type": "Registerbekanntmachung nach dem Umwandlungsgesetz",
      "state": "Schleswig-Holstein",
      "amtsgericht": "Amtsgericht Kiel",
      "registernummer": "HRB 15641",
      "registerart": "HRB",
      "company_name": "VION Zucht- und Nutzvieh GmbH",
      "company_seat": "Bad Bramstedt",
      "details": "10.10.2025 (Bekanntmachungsdatum)\n\nSchleswig-Holstein Amtsgericht Kiel HRB 15641\nRegisterbekanntmachung nach dem Umwandlungsgesetz 09.10.2025 (Eintragungsdatum)\n\nVION Zucht- und Nutzvieh GmbH\nGesellschaft mit beschränkter Haftung\nBad Bramstedt\n\nAls nicht eingetragen wird veröffentlicht: Den Gläubigern der an der Verschmelzung beteiligten Rechtsträger ist, wenn sie binnen sechs Monaten nach dem Tag, an dem die Eintragung der Verschmelzung in das Register des Sitzes desjenigen Rechtsträgers, dessen Gläubiger sie sind, nach § 19 Abs. 3 UmwG bekannt gemacht worden ist, ihren Anspruch nach Grund und Höhe schriftlich anmelden, Sicherheit zu leisten, soweit sie nicht Befriedigung verlangen können. Dieses Recht steht den Gläubigern jedoch nur zu, wenn sie glaubhaft machen, dass durch die Verschmelzung die Erfüllung ihrer Forderung gefährdet wird."
    },
    {
      "date": "2025-10-10",
      "id": "133503",
      "original_text": "Löschungsankündigung\nBerlin Amtsgericht Berlin (Charlottenburg) HRB 119817\nLiedtke Unternehmensberatung GmbH – Berlin",
      "type": "Löschungsankündigung",
      "state": "Berlin",
      "amtsgericht": "Amtsgericht Berlin (Charlottenburg)",
      "registernummer": "HRB 119817",
      "registerart": "HRB",
      "company_name": "Liedtke Unternehmensberatung GmbH",
      "company_seat": "Berlin",
      "details": "10.10.2025 (Bekanntmachungsdatum)\n\nBerlin Amtsgericht Berlin (Charlottenburg) HRB 119817\nLöschungsankündigung\n\nLiedtke Unternehmensberatung GmbH\nGesellschaft mit beschränkter Haftung\nBerlin\n\nBei der nachstehenden Gesellschaft wird das Amtslöschungsverfahren gemäß § 394 FamFG eingeleitet. Widerspruchsfrist 6 Wochen"
    },
    {
      "date": "2025-10-10",
      "id": "133504",
      "original_text": "Registerbekanntmachung nach dem Umwandlungsgesetz\nBaden-Württemberg Amtsgericht Stuttgart HRA 742643\nCosmo Logistik e.K., Inh. Rifat Güner – Kornwestheim",
      "type": "Registerbekanntmachung nach dem Umwandlungsgesetz",
      "state": "Baden-Württemberg",
      "amtsgericht": "Amtsgericht Stuttgart",
      "registernummer": "HRA 742643",
      "registerart": "HRA",
      "company_name": "Cosmo Logistik e.K., Inh. Rifat Güner",
      "company_seat": "Kornwestheim",
      "details": "10.10.2025 (Bekanntmachungsdatum)\n\nBaden-Württemberg Amtsgericht Stuttgart HRA 742643\nRegisterbekanntmachung nach dem Umwandlungsgesetz 10.10.2025 (Eintragungsdatum)\n\nCosmo Logistik e.K., Inh. Rifat Güner\nEinzelkaufmann / Einzelkauffrau\nKornwestheim\n\nAls nicht eingetragen wird bekanntgemacht:\nDen Gläubigern der an der Ausgliederung beteiligten Rechtsträger ist, wenn sie binnen sechs Monaten nach dem Tag, an dem die Eintragung der Ausgliederung in das Register des Sitzes desjenigen Rechtsträgers, dessen Gläubiger sie sind, nach § 19 Abs. 3 UmwG als bekanntgemacht gilt, ihren Anspruch nach Grund und Höhe schriftlich anmelden, Sicherheit zu leisten, soweit sie nicht Befriedigung verlangen können. Dieses Recht steht den Gläubigern jedoch nur zu, wenn sie glaubhaft machen, dass durch die Ausgliederung die Erfüllung ihrer Forderung gefährdet wird."
    },
    {
      "date": "2025-10-10",
      "id": "133505",
      "original_text": "Registerbekanntmachung nach dem Umwandlungsgesetz\nBaden-Württemberg Amtsgericht Mannheim HRB 106393\nHeinrich Heine GmbH – Karlsruhe",
      "type": "Registerbekanntmachung nach dem Umwandlungsgesetz",
      "state": "Baden-Württemberg",
      "amtsgericht": "Amtsgericht Mannheim",
      "registernummer": "HRB 106393",
      "registerart": "HRB",
      "company_name": "Heinrich Heine GmbH",
      "company_seat": "Karlsruhe",
      "details": "10.10.2025 (Bekanntmachungsdatum)\n\nBaden-Württemberg Amtsgericht Mannheim HRB 106393\nRegisterbekanntmachung nach dem Umwandlungsgesetz 10.10.2025 (Eintragungsdatum)\n\nHeinrich Heine GmbH\nGesellschaft mit beschränkter Haftung\nKarlsruhe\n\nAls nicht eingetragen wird bekanntgemacht:\nDen Gläubigern der an der Abspaltung beteiligten Rechtsträger ist, wenn sie binnen sechs Monaten nach dem Tag, an dem die Eintragung der Abspaltung in das Register des Sitzes desjenigen Rechtsträgers, dessen Gläubiger sie sind, nach § 19 Abs. 3 UmwG als bekanntgemacht gilt, ihren Anspruch nach Grund und Höhe schriftlich anmelden, Sicherheit zu leisten, soweit sie nicht Befriedigung verlangen können. Dieses Recht steht den Gläubigern jedoch nur zu, wenn sie glaubhaft machen, dass durch die Abspaltung die Erfüllung ihrer Forderung gefährdet wird."
    },
    {
      "date": "2025-10-10",
      "id": "133506",
      "original_text": "Registerbekanntmachung nach dem Umwandlungsgesetz\nSchleswig-Holstein Amtsgericht Lübeck HRB 3913 AH\nVivanco Gruppe Aktiengesellschaft – Ahrensburg",
      "type": "Registerbekanntmachung nach dem Umwandlungsgesetz",
      "state": "Schleswig-Holstein",
      "amtsgericht": "Amtsgericht Lübeck",
      "registernummer": "HRB 3913 AH",
      "registerart": "HRB",
      "company_name": "Vivanco Gruppe Aktiengesellschaft",
      "company_seat": "Ahrensburg",
      "details": "10.10.2025 (Bekanntmachungsdatum)\n\nSchleswig-Holstein Amtsgericht Lübeck HRB 3913 AH\nRegisterbekanntmachung nach dem Umwandlungsgesetz 09.10.2025 (Eintragungsdatum)\n\nVivanco Gruppe Aktiengesellschaft\nAktiengesellschaft\nAhrensburg\n\nZu Eintragungsnummer 25 vom 09.10.2025 wird als nicht eingetragen veröffentlicht: Den Gläubigern ist, wenn sie binnen sechs Monaten nach dem Tag, an dem die Eintragung der Umwandlung als bekannt gemacht gilt, ihren Anspruch nach Grund und Höhe schriftlich anmelden, Sicherheit zu leisten, soweit sie nicht Befriedigung verlangen können. Dieses Recht steht den Gläubigern jedoch nur zu, wenn sie glaubhaft machen, dass durch die Umwandlung die Erfüllung ihrer Forderung gefährdet wird."
    },
    {
      "date": "2025-10-10",
      "id": "133507",
      "original_text": "Registerbekanntmachung nach dem Umwandlungsgesetz\nThüringen Amtsgericht Jena HRB 508744\nTMR-Radio.de UG (haftungsbeschränkt) – Waltershausen",
      "type": "Registerbekanntmachung nach dem Umwandlungsgesetz",
      "state": "Thüringen",
      "amtsgericht": "Amtsgericht Jena",
      "registernummer": "HRB 508744",
      "registerart": "HRB",
      "company_name": "TMR-Radio.de UG (haftungsbeschränkt)",
      "company_seat": "Waltershausen",
      "details": "10.10.2025 (Bekanntmachungsdatum)\n\nThüringen Amtsgericht Jena HRB 508744\nRegisterbekanntmachung nach dem Umwandlungsgesetz 10.10.2025 (Eintragungsdatum)\n\nTMR-Radio.de UG (haftungsbeschränkt)\nGesellschaft mit beschränkter Haftung\nWaltershausen\n\nNicht eingetragen: Den Gläubigern der an der Verschmelzung beteiligten Rechtsträger, ist wenn sie binnen sechs Monaten nach dem Tag, an dem die Eintragung der Verschmelzung in das Register des Sitzes desjenigen Rechtsträgers, dessen Gläubiger sie sind,  nach § 19 Abs. 3 UmwG als bekanntgemacht gilt, ihren Anspruch nach Grund und Höhe schriftlich anmelden, Sicherheit zu leisten, soweit sie nicht Befriedigung verlangen können. Dieses Recht steht ihnen jedoch nur zu, wenn sie glaubhaft machen, daß durch die Verschmelzung die Erfüllung ihrer Forderung gefährdet wird."
    },
    {
      "date": "2025-10-10",
      "id": "133508",
      "original_text": "Registerbekanntmachung nach dem Umwandlungsgesetz\nThüringen Amtsgericht Jena HRB 108380\nGianni.uno GmbH – Erfurt",
      "type": "Registerbekanntmachung nach dem Umwandlungsgesetz",
      "state": "Thüringen",
      "amtsgericht": "Amtsgericht Jena",
      "registernummer": "HRB 108380",
      "registerart": "HRB",
      "company_name": "Gianni.uno GmbH",
      "company_seat": "Erfurt",
      "details": "10.10.2025 (Bekanntmachungsdatum)\n\nThüringen Amtsgericht Jena HRB 108380\nRegisterbekanntmachung nach dem Umwandlungsgesetz 10.10.2025 (Eintragungsdatum)\n\nGianni.uno GmbH\nGesellschaft mit beschränkter Haftung\nErfurt\n\nNicht eingetragen: Den Gläubigern der an der Verschmelzung beteiligten Rechtsträger, ist wenn sie binnen sechs Monaten nach dem Tag, an dem die Eintragung der Verschmelzung in das Register des Sitzes desjenigen Rechtsträgers, dessen Gläubiger sie sind,  nach § 19 Abs. 3 UmwG als bekanntgemacht gilt, ihren Anspruch nach Grund und Höhe schriftlich anmelden, Sicherheit zu leisten, soweit sie nicht Befriedigung verlangen können. Dieses Recht steht ihnen jedoch nur zu, wenn sie glaubhaft machen, daß durch die Verschmelzung die Erfüllung ihrer Forderung gefährdet wird."
    },
    {
      "date": "2025-10-10",
      "id": "133509",
      "original_text": "Registerbekanntmachung nach dem Umwandlungsgesetz\nThüringen Amtsgericht Jena HRA 507134\nAmbulanter Pflegedienst Hund OHG – Nordhausen",
      "type": "Registerbekanntmachung nach dem Umwandlungsgesetz",
      "state": "Thüringen",
      "amtsgericht": "Amtsgericht Jena",
      "registernummer": "HRA 507134",
      "registerart": "HRA",
      "company_name": "Ambulanter Pflegedienst Hund OHG",
      "company_seat": "Nordhausen",
      "details": "10.10.2025 (Bekanntmachungsdatum)\n\nThüringen Amtsgericht Jena HRA 507134\nRegisterbekanntmachung nach dem Umwandlungsgesetz 10.10.2025 (Eintragungsdatum)\n\nAmbulanter Pflegedienst Hund OHG\nOffene Handelsgesellschaft\nNordhausen\n\nNicht eingetragen: Den Gläubigern des formwechselnden  Rechtsträgers, ist wenn sie binnen sechs Monaten nach dem Tag, an dem die Eintragung des Formwechsels nach § 201 UmwG als bekanntgemacht gilt, ihren Anspruch nach Grund und Höhe schriftlich anmelden, Sicherheit zu leisten, soweit sie nicht Befriedigung verlangen können. Dieses Recht steht ihnen jedoch nur zu, wenn sie glaubhaft machen, daß durch den Formwechsel die Erfüllung ihrer Forderung gefährdet wird."
    },
    {
      "date": "2025-10-10",
      "id": "133510",
      "original_text": "Einreichung neuer Dokumente\nBaden-Württemberg Amtsgericht Stuttgart HRB 1916\nKreditgarantiegemeinschaft des Handels Baden-Württemberg Verwaltungs-GmbH – Stuttgart",
      "type": "Einreichung neuer Dokumente",
      "state": "Baden-Württemberg",
      "amtsgericht": "Amtsgericht Stuttgart",
      "registernummer": "HRB 1916",
      "registerart": "HRB",
      "company_name": "Kreditgarantiegemeinschaft des Handels Baden-Württemberg Verwaltungs-GmbH",
      "company_seat": "Stuttgart",
      "details": "10.10.2025 (Bekanntmachungsdatum)\n\nBaden-Württemberg Amtsgericht Stuttgart HRB 1916\nEinreichung neuer Dokumente\n\nKreditgarantiegemeinschaft des Handels Baden-Württemberg Verwaltungs-GmbH\nGesellschaft mit beschränkter Haftung\nStuttgart\n\nDie Gesellschaft hat am 09.10.2025 die Liste über die Zusammensetzung des Aufsichtsrats zum Handelsregister eingereicht."
    },
    {
      "date": "2025-10-10",
      "id": "133511",
      "original_text": "Registerbekanntmachung nach dem Umwandlungsgesetz\nBaden-Württemberg Amtsgericht Stuttgart HRA 742592\nScholtz Quartiermanager GmbH & Co. KG – Gärtringen",
      "type": "Registerbekanntmachung nach dem Umwandlungsgesetz",
      "state": "Baden-Württemberg",
      "amtsgericht": "Amtsgericht Stuttgart",
      "registernummer": "HRA 742592",
      "registerart": "HRA",
      "company_name": "Scholtz Quartiermanager GmbH & Co. KG",
      "company_seat": "Gärtringen",
      "details": "10.10.2025 (Bekanntmachungsdatum)\n\nBaden-Württemberg Amtsgericht Stuttgart HRA 742592\nRegisterbekanntmachung nach dem Umwandlungsgesetz 10.10.2025 (Eintragungsdatum)\n\nScholtz Quartiermanager GmbH & Co. KG\nKommanditgesellschaft\nGärtringen\n\nAls nicht eingetragen wird bekanntgemacht:\nDen Gläubigern der an der Ausgliederung beteiligten Rechtsträger ist, wenn sie binnen sechs Monaten nach dem Tag, an dem die Eintragung der Ausgliederung in das Register des Sitzes desjenigen Rechtsträgers, dessen Gläubiger sie sind, nach § 19 Abs. 3 UmwG als bekanntgemacht gilt, ihren Anspruch nach Grund und Höhe schriftlich anmelden, Sicherheit zu leisten, soweit sie nicht Befriedigung verlangen können. Dieses Recht steht den Gläubigern jedoch nur zu, wenn sie glaubhaft machen, dass durch die Ausgliederung die Erfüllung ihrer Forderung gefährdet wird."
    },
    {
      "date": "2025-10-10",
      "id": "133512",
      "original_text": "Registerbekanntmachung nach dem Umwandlungsgesetz\nBaden-Württemberg Amtsgericht Mannheim HRB 362577\nvi2vi GmbH – Malsch",
      "type": "Registerbekanntmachung nach dem Umwandlungsgesetz",
      "state": "Baden-Württemberg",
      "amtsgericht": "Amtsgericht Mannheim",
      "registernummer": "HRB 362577",
      "registerart": "HRB",
      "company_name": "vi2vi GmbH",
      "company_seat": "Malsch",
      "details": "10.10.2025 (Bekanntmachungsdatum)\n\nBaden-Württemberg Amtsgericht Mannheim HRB 362577\nRegisterbekanntmachung nach dem Umwandlungsgesetz 10.10.2025 (Eintragungsdatum)\n\nvi2vi GmbH\nGesellschaft mit beschränkter Haftung\nMalsch\n\nDen Gläubigern der an der Verschmelzung beteiligten Rechtsträger ist, wenn sie binnen sechs Monaten nach dem Tag, an dem die Eintragung der Verschmelzung in das Register des Sitzes desjenigen Rechtsträgers, dessen Gläubiger sie sind, nach § 19 Abs. 3 UmwG als bekanntgemacht gilt, ihren Anspruch nach Grund und Höhe schriftlich anmelden, Sicherheit zu leisten, soweit sie nicht Befriedigung verlangen können. Dieses Recht steht den Gläubigern jedoch nur zu, wenn sie glaubhaft machen, dass durch die Verschmelzung die Erfüllung ihrer Forderung gefährdet wird."
    },
    {
      "date": "2025-10-10",
      "id": "133513",
      "original_text": "Registerbekanntmachung nach dem Umwandlungsgesetz\nBerlin Amtsgericht Berlin (Charlottenburg) HRA 63202\nPhilipp Druse - Coatings - e. K. – Berlin",
      "type": "Registerbekanntmachung nach dem Umwandlungsgesetz",
      "state": "Berlin",
      "amtsgericht": "Amtsgericht Berlin (Charlottenburg)",
      "registernummer": "HRA 63202",
      "registerart": "HRA",
      "company_name": "Philipp Druse - Coatings - e. K.",
      "company_seat": "Berlin",
      "details": "10.10.2025 (Bekanntmachungsdatum)\n\nBerlin Amtsgericht Berlin (Charlottenburg) HRA 63202\nRegisterbekanntmachung nach dem Umwandlungsgesetz 09.10.2025 (Eintragungsdatum)\n\nPhilipp Druse - Coatings - e. K.\nEinzelkaufmann / Einzelkauffrau\nBerlin\n\nZu Eintragungsnummer 3 vom 09.10.2025 wird als nicht eingetragen veröffentlicht: Den Gläubigern der an der Spaltung beteiligten Rechtsträger ist, wenn sie binnen sechs Monaten nach dem Tag, an dem die Eintragung der Spaltung in das Register des Sitzes desjenigen Rechtsträgers, dessen Gläubiger sie sind, als bekannt gemacht gilt, ihren Anspruch nach Grund und Höhe schriftlich anmelden, Sicherheit zu leisten, soweit sie nicht Befriedigung verlangen können. Dieses Recht steht den Gläubigern jedoch nur zu, wenn sie glaubhaft machen, dass durch die Spaltung die Erfüllung ihrer Forderung gefährdet wird. Das Recht, Sicherheitsleistung zu verlangen, steht Gläubigern nicht zu, die im Falle der Insolvenz ein Recht auf vorzugsweise Befriedigung aus einer Deckungsmasse haben, die nach gesetzlicher Vorschrift zu ihrem Schutz errichtet und staatlich überwacht ist."
    },
    {
      "date": "2025-10-10",
      "id": "133514",
      "original_text": "Registerbekanntmachung nach dem Umwandlungsgesetz\nBerlin Amtsgericht Berlin (Charlottenburg) HRB 266568\nPhilipp Druse -coatings- Maler- & Lackarbeiten Meisterbetrieb GmbH – Berlin",
      "type": "Registerbekanntmachung nach dem Umwandlungsgesetz",
      "state": "Berlin",
      "amtsgericht": "Amtsgericht Berlin (Charlottenburg)",
      "registernummer": "HRB 266568",
      "registerart": "HRB",
      "company_name": "Philipp Druse -coatings- Maler- & Lackarbeiten Meisterbetrieb GmbH",
      "company_seat": "Berlin",
      "details": "10.10.2025 (Bekanntmachungsdatum)\n\nBerlin Amtsgericht Berlin (Charlottenburg) HRB 266568\nRegisterbekanntmachung nach dem Umwandlungsgesetz 09.10.2025 (Eintragungsdatum)\n\nPhilipp Druse -coatings- Maler- & Lackarbeiten Meisterbetrieb GmbH\nGesellschaft mit beschränkter Haftung\nBerlin\n\nZu Eintragungsnummer 2 vom 09.10.2025 wird als nicht eingetragen veröffentlicht: Den Gläubigern der an der Spaltung beteiligten Rechtsträger ist, wenn sie binnen sechs Monaten nach dem Tag, an dem die Eintragung der Spaltung in das Register des Sitzes desjenigen Rechtsträgers, dessen Gläubiger sie sind, als bekannt gemacht gilt, ihren Anspruch nach Grund und Höhe schriftlich anmelden, Sicherheit zu leisten, soweit sie nicht Befriedigung verlangen können. Dieses Recht steht den Gläubigern jedoch nur zu, wenn sie glaubhaft machen, dass durch die Spaltung die Erfüllung ihrer Forderung gefährdet wird. Das Recht, Sicherheitsleistung zu verlangen, steht Gläubigern nicht zu, die im Falle der Insolvenz ein Recht auf vorzugsweise Befriedigung aus einer Deckungsmasse haben, die nach gesetzlicher Vorschrift zu ihrem Schutz errichtet und staatlich überwacht ist."
    },
    {
      "date": "2025-10-10",
      "id": "133515",
      "original_text": "Löschungsankündigung\nSchleswig-Holstein Amtsgericht Lübeck VR 1647\nSelbsthilfegruppe Vogteistraße – Lübeck",
      "type": "Löschungsankündigung",
      "state": "Schleswig-Holstein",
      "amtsgericht": "Amtsgericht Lübeck",
      "registernummer": "VR 1647",
      "registerart": "VR",
      "company_name": "Selbsthilfegruppe Vogteistraße",
      "company_seat": "Lübeck",
      "details": "10.10.2025 (Bekanntmachungsdatum)\n\nSchleswig-Holstein Amtsgericht Lübeck VR 1647\nLöschungsankündigung\n\nSelbsthilfegruppe Vogteistraße\neingetragener Verein\nLübeck\n\nDer nachstehende Verein wird gemäß § 395 FamFG wegen Wegfalls sämtlicher Mitglieder von Amts wegen gelöscht. Widerspruchsfrist: 3 Wochen."
    },
    {
      "date": "2025-10-10",
      "id": "133516",
      "original_text": "Registerbekanntmachung nach dem Umwandlungsgesetz\nBaden-Württemberg Amtsgericht Mannheim HRB 350718\nSchäfer Werkzeug- und Sondermaschinenbau GmbH – Mühlhausen",
      "type": "Registerbekanntmachung nach dem Umwandlungsgesetz",
      "state": "Baden-Württemberg",
      "amtsgericht": "Amtsgericht Mannheim",
      "registernummer": "HRB 350718",
      "registerart": "HRB",
      "company_name": "Schäfer Werkzeug- und Sondermaschinenbau GmbH",
      "company_seat": "Mühlhausen",
      "details": "10.10.2025 (Bekanntmachungsdatum)\n\nBaden-Württemberg Amtsgericht Mannheim HRB 350718\nRegisterbekanntmachung nach dem Umwandlungsgesetz 09.10.2025 (Eintragungsdatum)\n\nSchäfer Werkzeug- und Sondermaschinenbau GmbH\nGesellschaft mit beschränkter Haftung\nMühlhausen\n\nDen Gläubigern der an der Verschmelzung beteiligten Rechtsträger ist, wenn sie binnen sechs Monaten nach dem Tag, an dem die Eintragung der Verschmelzung in das Register des Sitzes desjenigen Rechtsträgers, dessen Gläubiger sie sind, nach § 19 Abs. 3 UmwG als bekanntgemacht gilt, ihren Anspruch nach Grund und Höhe schriftlich anmelden, Sicherheit zu leisten, soweit sie nicht Befriedigung verlangen können. Dieses Recht steht den Gläubigern jedoch nur zu, wenn sie glaubhaft machen, dass durch die Verschmelzung die Erfüllung ihrer Forderung gefährdet wird."
    },
    {
      "date": "2025-10-10",
      "id": "133517",
      "original_text": "Registerbekanntmachung nach dem Umwandlungsgesetz\nHamburg Amtsgericht Hamburg HRB 72577\nBuss Logistik Management GmbH – Hamburg",
      "type": "Registerbekanntmachung nach dem Umwandlungsgesetz",
      "state": "Hamburg",
      "amtsgericht": "Amtsgericht Hamburg",
      "registernummer": "HRB 72577",
      "registerart": "HRB",
      "company_name": "Buss Logistik Management GmbH",
      "company_seat": "Hamburg",
      "details": "10.10.2025 (Bekanntmachungsdatum)\n\nHamburg Amtsgericht Hamburg HRB 72577\nRegisterbekanntmachung nach dem Umwandlungsgesetz 10.10.2025 (Eintragungsdatum)\n\nBuss Logistik Management GmbH\nGesellschaft mit beschränkter Haftung\nHamburg\n\nAls nicht eingetragen wird bekannt gemacht:\nDen Gläubigern der an der Verschmelzung beteiligten Gesellschaften ist, wenn sie binnen sechs Monaten nach dem Tag, an dem die Eintragung der Verschmelzung in das Register des Sitzes desjenigen Rechtsträgers, dessen Gläubiger sie sind, nach § 19 Absatz 3 UmwG als bekannt gemacht gilt, ihren Anspruch nach Grund und Höhe schriftlich anmelden, Sicherheit zu leisten, soweit sie nicht Befriedigung verlangen können. Dieses Recht steht den Gläubigern jedoch nur zu, wenn sie glaubhaft machen, dass durch die Verschmelzung die Erfüllung ihrer Forderung gefährdet wird."
    },
    {
      "date": "2025-10-10",
      "id": "133518",
      "original_text": "Registerbekanntmachung nach dem Umwandlungsgesetz\nHamburg Amtsgericht Hamburg HRA 83176\nBuss Holding GmbH & Co.KG – Hamburg",
      "type": "Registerbekanntmachung nach dem Umwandlungsgesetz",
      "state": "Hamburg",
      "amtsgericht": "Amtsgericht Hamburg",
      "registernummer": "HRA 83176",
      "registerart": "HRA",
      "company_name": "Buss Holding GmbH & Co.KG",
      "company_seat": "Hamburg",
      "details": "10.10.2025 (Bekanntmachungsdatum)\n\nHamburg Amtsgericht Hamburg HRA 83176\nRegisterbekanntmachung nach dem Umwandlungsgesetz 10.10.2025 (Eintragungsdatum)\n\nBuss Holding GmbH & Co.KG\nKommanditgesellschaft\nHamburg\n\nAls nicht eingetragen wird bekannt gemacht:\nDen Gläubigern der an der Verschmelzung beteiligten Gesellschaften ist, wenn sie binnen sechs Monaten nach dem Tag, an dem die Eintragung der Verschmelzung in das Register des Sitzes desjenigen Rechtsträgers, dessen Gläubiger sie sind, nach § 19 Absatz 3 UmwG als bekannt gemacht gilt, ihren Anspruch nach Grund und Höhe schriftlich anmelden, Sicherheit zu leisten, soweit sie nicht Befriedigung verlangen können. Dieses Recht steht den Gläubigern jedoch nur zu, wenn sie glaubhaft machen, dass durch die Verschmelzung die Erfüllung ihrer Forderung gefährdet wird."
    },
    {
      "date": "2025-10-10",
      "id": "133519",
      "original_text": "Löschungsankündigung\nBerlin Amtsgericht Berlin (Charlottenburg) HRB 267761\nMH Bau GmbH – Berlin",
      "type": "Löschungsankündigung",
      "state": "Berlin",
      "amtsgericht": "Amtsgericht Berlin (Charlottenburg)",
      "registernummer": "HRB 267761",
      "registerart": "HRB",
      "company_name": "MH Bau GmbH",
      "company_seat": "Berlin",
      "details": "10.10.2025 (Bekanntmachungsdatum)\n\nBerlin Amtsgericht Berlin (Charlottenburg) HRB 267761\nLöschungsankündigung\n\nMH Bau GmbH\nGesellschaft mit beschränkter Haftung\nBerlin\n\nBei der nachstehenden Gesellschaft wird das Amtslöschungsverfahren gemäß § 394 FamFG eingeleitet. Widerspruchsfrist 6 Wochen"
    },
    {
      "date": "2025-10-10",
      "id": "133520",
      "original_text": "Löschungsankündigung\nBerlin Amtsgericht Berlin (Charlottenburg) HRB 246282\nBirnkraft GmbH – Berlin",
      "type": "Löschungsankündigung",
      "state": "Berlin",
      "amtsgericht": "Amtsgericht Berlin (Charlottenburg)",
      "registernummer": "HRB 246282",
      "registerart": "HRB",
      "company_name": "Birnkraft GmbH",
      "company_seat": "Berlin",
      "details": "10.10.2025 (Bekanntmachungsdatum)\n\nBerlin Amtsgericht Berlin (Charlottenburg) HRB 246282\nLöschungsankündigung\n\nBirnkraft GmbH\nGesellschaft mit beschränkter Haftung\nBerlin\n\nBei der nachstehenden Gesellschaft wird das Amtslöschungsverfahren gemäß § 394 FamFG eingeleitet. Widerspruchsfrist: 6 Wochen."
    },
    {
      "date": "2025-10-10",
      "id": "133521",
      "original_text": "Registerbekanntmachung nach dem Umwandlungsgesetz\nBerlin Amtsgericht Berlin (Charlottenburg) HRB 232148\nTB Lead UG (haftungsbeschränkt) – Berlin",
      "type": "Registerbekanntmachung nach dem Umwandlungsgesetz",
      "state": "Berlin",
      "amtsgericht": "Amtsgericht Berlin (Charlottenburg)",
      "registernummer": "HRB 232148",
      "registerart": "HRB",
      "company_name": "TB Lead UG (haftungsbeschränkt)",
      "company_seat": "Berlin",
      "details": "10.10.2025 (Bekanntmachungsdatum)\n\nBerlin Amtsgericht Berlin (Charlottenburg) HRB 232148\nRegisterbekanntmachung nach dem Umwandlungsgesetz 09.10.2025 (Eintragungsdatum)\n\nTB Lead UG (haftungsbeschränkt)\nGesellschaft mit beschränkter Haftung\nBerlin\n\nZu Eintragungsnummer 4 vom 09.10.2025 wird als nicht eingetragen veröffentlicht: Den Gläubigern der an der Verschmelzung beteiligten Rechtsträger ist, wenn sie binnen sechs Monaten nach dem Tag, an dem die Eintragung der Verschmelzung in das Register des Sitzes desjenigen Rechtsträgers, dessen Gläubiger sie sind, als bekannt gemacht gilt, ihren Anspruch nach Grund und Höhe schriftlich anmelden, Sicherheit zu leisten, soweit sie nicht Befriedigung verlangen können. Dieses Recht steht den Gläubigern jedoch nur zu, wenn sie glaubhaft machen, dass durch die Verschmelzung die Erfüllung ihrer Forderung gefährdet wird. Das Recht, Sicherheitsleistung zu verlangen, steht Gläubigern nicht zu, die im Falle der Insolvenz ein Recht auf vorzugsweise Befriedigung aus einer Deckungsmasse haben, die nach gesetzlicher Vorschrift zu ihrem Schutz errichtet und staatlich überwacht ist."
    },
    {
      "date": "2025-10-10",
      "id": "133522",
      "original_text": "Registerbekanntmachung nach dem Umwandlungsgesetz\nBrandenburg Amtsgericht Potsdam HRA 5992\nAnteros Solar GmbH & Co. KG – Retzow",
      "type": "Registerbekanntmachung nach dem Umwandlungsgesetz",
      "state": "Brandenburg",
      "amtsgericht": "Amtsgericht Potsdam",
      "registernummer": "HRA 5992",
      "registerart": "HRA",
      "company_name": "Anteros Solar GmbH & Co. KG",
      "company_seat": "Retzow",
      "details": "10.10.2025 (Bekanntmachungsdatum)\n\nBrandenburg Amtsgericht Potsdam HRA 5992\nRegisterbekanntmachung nach dem Umwandlungsgesetz 10.10.2025 (Eintragungsdatum)\n\nAnteros Solar GmbH & Co. KG\nKommanditgesellschaft\nRetzow\n\nZu Eintragungsnummer 5 vom 10.10.2025 wird als nicht eingetragen veröffentlicht:\nDen Gläubigern der an der Verschmelzung beteiligten Rechtsträger ist, wenn sie binnen sechs Monaten nach dem Tag, an dem die Eintragung der Verschmelzung in das Register des Sitzes desjenigen Rechtsträgers, dessen Gläubiger sie sind, als bekannt gemacht gilt, ihren Anspruch nach Grund und Höhe schriftlich anmelden, Sicherheit zu leisten, soweit sie nicht Befriedigung verlangen können. Dieses Recht steht den Gläubigern jedoch nur zu, wenn sie glaubhaft machen, dass durch die Verschmelzung die Erfüllung ihrer Forderung gefährdet wird."
    },
    {
      "date": "2025-10-10",
      "id": "133523",
      "original_text": "Registerbekanntmachung nach dem Umwandlungsgesetz\nBrandenburg Amtsgericht Potsdam HRA 5993\nBacchus Solar GmbH & Co. KG – Retzow",
      "type": "Registerbekanntmachung nach dem Umwandlungsgesetz",
      "state": "Brandenburg",
      "amtsgericht": "Amtsgericht Potsdam",
      "registernummer": "HRA 5993",
      "registerart": "HRA",
      "company_name": "Bacchus Solar GmbH & Co. KG",
      "company_seat": "Retzow",
      "details": "10.10.2025 (Bekanntmachungsdatum)\n\nBrandenburg Amtsgericht Potsdam HRA 5993\nRegisterbekanntmachung nach dem Umwandlungsgesetz 10.10.2025 (Eintragungsdatum)\n\nBacchus Solar GmbH & Co. KG\nKommanditgesellschaft\nRetzow\n\nZu Eintragungsnummer 4 vom 10.10.2025 wird als nicht eingetragen veröffentlicht:\nDen Gläubigern der an der Verschmelzung beteiligten Rechtsträger ist, wenn sie binnen sechs Monaten nach dem Tag, an dem die Eintragung der Verschmelzung in das Register des Sitzes desjenigen Rechtsträgers, dessen Gläubiger sie sind, als bekannt gemacht gilt, ihren Anspruch nach Grund und Höhe schriftlich anmelden, Sicherheit zu leisten, soweit sie nicht Befriedigung verlangen können. Dieses Recht steht den Gläubigern jedoch nur zu, wenn sie glaubhaft machen, dass durch die Verschmelzung die Erfüllung ihrer Forderung gefährdet wird."
    },
    {
      "date": "2025-10-10",
      "id": "133524",
      "original_text": "Löschungsankündigung\nBerlin Amtsgericht Berlin (Charlottenburg) HRB 145125\nRB Profi Bau GmbH – Berlin",
      "type": "Löschungsankündigung",
      "state": "Berlin",
      "amtsgericht": "Amtsgericht Berlin (Charlottenburg)",
      "registernummer": "HRB 145125",
      "registerart": "HRB",
      "company_name": "RB Profi Bau GmbH",
      "company_seat": "Berlin",
      "details": "10.10.2025 (Bekanntmachungsdatum)\n\nBerlin Amtsgericht Berlin (Charlottenburg) HRB 145125\nLöschungsankündigung\n\nRB Profi Bau GmbH\nGesellschaft mit beschränkter Haftung\nBerlin\n\nBei der nachstehenden Gesellschaft wird das Amtslöschungsverfahren gemäß § 394 FamFG eingeleitet. Widerspruchsfrist 6 Wochen"
    },
    {
      "date": "2025-10-10",
      "id": "133525",
      "original_text": "Löschungsankündigung\nBaden-Württemberg Amtsgericht Mannheim HRB 702059\nRenosan GmbH – Karlsruhe",
      "type": "Löschungsankündigung",
      "state": "Baden-Württemberg",
      "amtsgericht": "Amtsgericht Mannheim",
      "registernummer": "HRB 702059",
      "registerart": "HRB",
      "company_name": "Renosan GmbH",
      "company_seat": "Karlsruhe",
      "details": "10.10.2025 (Bekanntmachungsdatum)\n\nBaden-Württemberg Amtsgericht Mannheim HRB 702059\nLöschungsankündigung\n\nRenosan GmbH\nGesellschaft mit beschränkter Haftung\nKarlsruhe\n\nDas Gericht beabsichtigt, die Gesellschaft wegen Vermögenslosigkeit im Handelsregister von Amts wegen nach § 394 FamFG zu löschen. Die Frist zur Geltendmachung eines Widerspruchs gegen die beabsichtigte Löschung ist auf einen Monat ab Veröffentlichung bestimmt."
    },
    {
      "date": "2025-10-10",
      "id": "133526",
      "original_text": "Löschungsankündigung\nSchleswig-Holstein Amtsgericht Flensburg HRB 9808\nJessen Dachbeschichtung & Dämmsysteme GmbH – Leck",
      "type": "Löschungsankündigung",
      "state": "Schleswig-Holstein",
      "amtsgericht": "Amtsgericht Flensburg",
      "registernummer": "HRB 9808",
      "registerart": "HRB",
      "company_name": "Jessen Dachbeschichtung & Dämmsysteme GmbH",
      "company_seat": "Leck",
      "details": "10.10.2025 (Bekanntmachungsdatum)\n\nSchleswig-Holstein Amtsgericht Flensburg HRB 9808\nLöschungsankündigung\n\nJessen Dachbeschichtung & Dämmsysteme GmbH\nGesellschaft mit beschränkter Haftung\nLeck\n\nEs ist die Löschung der nachstehenden Gesellschaft wegen Vermögenslosigkeit gemäß § 394 FamFG beabsichtigt.\nWiderspruchsfrist: 2 Monate."
    },
    {
      "date": "2025-10-10",
      "id": "133527",
      "original_text": "Registerbekanntmachung nach dem Umwandlungsgesetz\nSachsen Amtsgericht Leipzig HRB 28318\nGermanedge Solutions GmbH – Leipzig",
      "type": "Registerbekanntmachung nach dem Umwandlungsgesetz",
      "state": "Sachsen",
      "amtsgericht": "Amtsgericht Leipzig",
      "registernummer": "HRB 28318",
      "registerart": "HRB",
      "company_name": "Germanedge Solutions GmbH",
      "company_seat": "Leipzig",
      "details": "10.10.2025 (Bekanntmachungsdatum)\n\nSachsen Amtsgericht Leipzig HRB 28318\nRegisterbekanntmachung nach dem Umwandlungsgesetz 10.10.2025 (Eintragungsdatum)\n\nGermanedge Solutions GmbH\nGesellschaft mit beschränkter Haftung\nLeipzig\n\nDen Gläubigern der an der Verschmelzung beteiligten Rechtsträger ist, wenn sie binnen sechs Monaten nach dem Tag, an dem die Eintragung der Verschmelzung in das Register des Sitzes desjenigen Rechtsträgers, dessen Gläubiger sie sind, nach § 19 Abs. 3 UmwG als bekannt gemacht gilt, ihren Anspruch nach Grund und Höhe in Textform anmelden, Sicherheit zu leisten, soweit sie nicht Befriedigung verlangen können. Dieses Recht steht den Gläubigern jedoch nur zu, wenn sie glaubhaft machen, dass durch die Verschmelzung die Erfüllung der Forderung gefährdet wird."
    },
    {
      "date": "2025-10-10",
      "id": "133528",
      "original_text": "Registerbekanntmachung nach dem Umwandlungsgesetz\nSachsen Amtsgericht Leipzig HRA 19739\nBBI Service GmbH & Co. KG – Taucha",
      "type": "Registerbekanntmachung nach dem Umwandlungsgesetz",
      "state": "Sachsen",
      "amtsgericht": "Amtsgericht Leipzig",
      "registernummer": "HRA 19739",
      "registerart": "HRA",
      "company_name": "BBI Service GmbH & Co. KG",
      "company_seat": "Taucha",
      "details": "10.10.2025 (Bekanntmachungsdatum)\n\nSachsen Amtsgericht Leipzig HRA 19739\nRegisterbekanntmachung nach dem Umwandlungsgesetz 10.10.2025 (Eintragungsdatum)\n\nBBI Service GmbH & Co. KG\nKommanditgesellschaft\nTaucha\n\nDen Gläubigern der an der Ausgliederung beteiligten Rechtsträger ist, wenn sie binnen sechs Monaten nach dem Tag, an dem die Eintragung der Ausgliederung in das Register des Sitzes desjenigen Rechtsträgers, dessen Gläubiger sie sind, nach § 19 Abs. 3 UmwG als bekannt gemacht gilt, ihren Anspruch nach Grund und Höhe in Textform anmelden, Sicherheit zu leisten, soweit sie nicht Befriedigung verlangen können. Dieses Recht steht den Gläubigern jedoch nur zu, wenn sie glaubhaft machen, dass durch die Ausgliederung die Erfüllung der Forderung gefährdet wird."
    },
    {
      "date": "2025-10-10",
      "id": "133529",
      "original_text": "Registerbekanntmachung nach dem Umwandlungsgesetz\nSachsen Amtsgericht Leipzig HRA 16428\nBBI Service e.K. – Taucha",
      "type": "Registerbekanntmachung nach dem Umwandlungsgesetz",
      "state": "Sachsen",
      "amtsgericht": "Amtsgericht Leipzig",
      "registernummer": "HRA 16428",
      "registerart": "HRA",
      "company_name": "BBI Service e.K.",
      "company_seat": "Taucha",
      "details": "10.10.2025 (Bekanntmachungsdatum)\n\nSachsen Amtsgericht Leipzig HRA 16428\nRegisterbekanntmachung nach dem Umwandlungsgesetz 10.10.2025 (Eintragungsdatum)\n\nBBI Service e.K.\nEinzelkaufmann / Einzelkauffrau\nTaucha\n\nDen Gläubigern der an der Ausgliederung beteiligten Rechtsträger ist, wenn sie binnen sechs Monaten nach dem Tag, an dem die Eintragung der Ausgliederung in das Register des Sitzes desjenigen Rechtsträgers, dessen Gläubiger sie sind, nach § 19 Abs. 3 UmwG als bekannt gemacht gilt, ihren Anspruch nach Grund und Höhe in Textform anmelden, Sicherheit zu leisten, soweit sie nicht Befriedigung verlangen können. Dieses Recht steht den Gläubigern jedoch nur zu, wenn sie glaubhaft machen, dass durch die Ausgliederung die Erfüllung der Forderung gefährdet wird."
    },
    {
      "date": "2025-10-10",
      "id": "133530",
      "original_text": "Einreichung neuer Dokumente\nSachsen Amtsgericht Dresden HRB 43521\nUND Unternehmensnetzwerk Deutschland Aktiengesellschaft – Dresden",
      "type": "Einreichung neuer Dokumente",
      "state": "Sachsen",
      "amtsgericht": "Amtsgericht Dresden",
      "registernummer": "HRB 43521",
      "registerart": "HRB",
      "company_name": "UND Unternehmensnetzwerk Deutschland Aktiengesellschaft",
      "company_seat": "Dresden",
      "details": "10.10.2025 (Bekanntmachungsdatum)\n\nSachsen Amtsgericht Dresden HRB 43521\nEinreichung neuer Dokumente\n\nUND Unternehmensnetzwerk Deutschland Aktiengesellschaft\nAktiengesellschaft\nDresden\n\nAm 08.10.2025 wurde beim Handelsregister des Amtsgerichts Dresden die Liste der Mitglieder des Aufsichtsrats gemäß § 106 AktG eingereicht."
    },
    {
      "date": "2025-10-10",
      "id": "133531",
      "original_text": "Löschungsankündigung\nSachsen Amtsgericht Leipzig HRB 39084\nApogem Courier Service UG (haftungsbeschränkt) – Leipzig",
      "type": "Löschungsankündigung",
      "state": "Sachsen",
      "amtsgericht": "Amtsgericht Leipzig",
      "registernummer": "HRB 39084",
      "registerart": "HRB",
      "company_name": "Apogem Courier Service UG (haftungsbeschränkt)",
      "company_seat": "Leipzig",
      "details": "10.10.2025 (Bekanntmachungsdatum)\n\nSachsen Amtsgericht Leipzig HRB 39084\nLöschungsankündigung\n\nApogem Courier Service UG (haftungsbeschränkt)\nGesellschaft mit beschränkter Haftung\nLeipzig\n\nDas Registergericht beabsichtigt, die im Handelsregister eingetragene Gesellschaft von Amts wegen nach § 394 FamFG zu löschen. Die Frist zu Erhebung eines Widerspruchs gegen die beabsichtigte Löschung wird auf einen Monat festgesetzt."
    },
    {
      "date": "2025-10-10",
      "id": "133532",
      "original_text": "Löschungsankündigung\nSachsen Amtsgericht Dresden HRB 28017\nKochloft Unternehmergesellschaft (haftungsbeschränkt) – Dresden",
      "type": "Löschungsankündigung",
      "state": "Sachsen",
      "amtsgericht": "Amtsgericht Dresden",
      "registernummer": "HRB 28017",
      "registerart": "HRB",
      "company_name": "Kochloft Unternehmergesellschaft (haftungsbeschränkt)",
      "company_seat": "Dresden",
      "details": "10.10.2025 (Bekanntmachungsdatum)\n\nSachsen Amtsgericht Dresden HRB 28017\nLöschungsankündigung\n\nKochloft Unternehmergesellschaft (haftungsbeschränkt)\nGesellschaft mit beschränkter Haftung\nDresden\n\nDas Registergericht beabsichtigt, die im Handelsregister eingetragene Gesellschaft von Amts wegen nach § 394 FamFG zu löschen. Die Frist zu Erhebung eines Widerspruchs gegen die beabsichtigte Löschung wird auf einen Monat festgesetzt."
    },
    {
      "date": "2025-10-10",
      "id": "133533",
      "original_text": "Registerbekanntmachung nach dem Umwandlungsgesetz\nNiedersachsen Amtsgericht Walsrode HRB 213070\nLohnunternehmen M. Grashoff GmbH – Schwarme",
      "type": "Registerbekanntmachung nach dem Umwandlungsgesetz",
      "state": "Niedersachsen",
      "amtsgericht": "Amtsgericht Walsrode",
      "registernummer": "HRB 213070",
      "registerart": "HRB",
      "company_name": "Lohnunternehmen M. Grashoff GmbH",
      "company_seat": "Schwarme",
      "details": "10.10.2025 (Bekanntmachungsdatum)\n\nNiedersachsen Amtsgericht Walsrode HRB 213070\nRegisterbekanntmachung nach dem Umwandlungsgesetz 10.10.2025 (Eintragungsdatum)\n\nLohnunternehmen M. Grashoff GmbH\nGesellschaft mit beschränkter Haftung\nSchwarme\n\nDen Gläubigern der an der formwechselnden Umwandlung beteiligten Rechtsträger ist, wenn sie binnen sechs Monaten nach dem Tag, an dem die Eintragung der Umwandlung in das Register des Sitzes desjenigen Rechtsträgers, dessen Gläubiger sie sind, nach § 19 Abs. 3 UmwG als bekannt gemacht gilt, ihren Anspruch nach Grund und Höhe schriftlich anmelden, Sicherheit zu leisten, soweit sie nicht Befriedigung verlangen können. Dieses Recht steht den Gläubigern jedoch nur zu, wenn sie glaubhaft machen, dass durch die formwechselnde Umwandlung die Erfüllung der Forderung gefährdet wird."
    },
    {
      "date": "2025-10-10",
      "id": "133534",
      "original_text": "Einreichung neuer Dokumente\nNiedersachsen Amtsgericht Hannover HRB 100485 früher Amtsgericht Hameln\nStadtwerke Hessisch Oldendorf GmbH – Hessisch Oldendorf",
      "type": "Einreichung neuer Dokumente",
      "state": "Niedersachsen",
      "amtsgericht": "Amtsgericht Hannover",
      "registernummer": "HRB 100485",
      "registerart": "HRB",
      "company_name": "Stadtwerke Hessisch Oldendorf GmbH",
      "company_seat": "Hessisch Oldendorf",
      "former_amtsgericht": "Hameln",
      "details": "10.10.2025 (Bekanntmachungsdatum)\n\nNiedersachsen Amtsgericht Hannover HRB 100485 früher Amtsgericht Hameln\nEinreichung neuer Dokumente\n\nStadtwerke Hessisch Oldendorf GmbH\nGesellschaft mit beschränkter Haftung\nHessisch Oldendorf\n\nDie Liste der Mitglieder des Aufsichtsrats wurde beim Registergericht eingereicht."
    },
    {
      "date": "2025-10-10",
      "id": "133535",
      "original_text": "Einreichung neuer Dokumente\nNiedersachsen Amtsgericht Braunschweig HRB 100419 früher Amtsgericht Wolfsburg\nAutostadt GmbH – Wolfsburg",
      "type": "Einreichung neuer Dokumente",
      "state": "Niedersachsen",
      "amtsgericht": "Amtsgericht Braunschweig",
      "registernummer": "HRB 100419",
      "registerart": "HRB",
      "company_name": "Autostadt GmbH",
      "company_seat": "Wolfsburg",
      "former_amtsgericht": "Wolfsburg",
      "details": "10.10.2025 (Bekanntmachungsdatum)\n\nNiedersachsen Amtsgericht Braunschweig HRB 100419 früher Amtsgericht Wolfsburg\nEinreichung neuer Dokumente\n\nAutostadt GmbH\nGesellschaft mit beschränkter Haftung\nWolfsburg\n\nDie aktuelle Liste der Mitglieder des Aufsichtsrats wurde beim Registergericht eingereicht."
    },
    {
      "date": "2025-10-10",
      "id": "133536",
      "original_text": "Registerbekanntmachung nach dem Umwandlungsgesetz\nNiedersachsen Amtsgericht Lüneburg GsR 931\nIchgold - Matthias Schwandt UG (haftungsbeschränkt) & Co. eGbR – Lüneburg",
      "type": "Registerbekanntmachung nach dem Umwandlungsgesetz",
      "state": "Niedersachsen",
      "amtsgericht": "Amtsgericht Lüneburg",
      "registernummer": "GsR 931",
      "registerart": "GsR",
      "company_name": "Ichgold - Matthias Schwandt UG (haftungsbeschränkt) & Co. eGbR",
      "company_seat": "Lüneburg",
      "details": "10.10.2025 (Bekanntmachungsdatum)\n\nNiedersachsen Amtsgericht Lüneburg GsR 931\nRegisterbekanntmachung nach dem Umwandlungsgesetz 09.10.2025 (Eintragungsdatum)\n\nIchgold - Matthias Schwandt UG (haftungsbeschränkt) & Co. eGbR\nGesellschaft bürgerlichen Rechts\nLüneburg\n\nDen Gläubigern der an der formwechselnden Umwandlung beteiligten Rechtsträger ist, wenn sie binnen sechs Monaten nach dem Tag, an dem die Eintragung der Umwandlung in das Register des Sitzes desjenigen Rechtsträgers, dessen Gläubiger sie sind, nach § 19 Abs. 3 UmwG als bekannt gemacht gilt, ihren Anspruch nach Grund und Höhe schriftlich anmelden, Sicherheit zu leisten, soweit sie nicht Befriedigung verlangen können. Dieses Recht steht den Gläubigern jedoch nur zu, wenn sie glaubhaft machen, dass durch die formwechselnde Umwandlung die Erfüllung der Forderung gefährdet wird."
    },
    {
      "date": "2025-10-10",
      "id": "133537",
      "original_text": "Einreichung neuer Dokumente\nNiedersachsen Amtsgericht Hannover HRB 204239\nContinental Reifen Deutschland GmbH – Hannover",
      "type": "Einreichung neuer Dokumente",
      "state": "Niedersachsen",
      "amtsgericht": "Amtsgericht Hannover",
      "registernummer": "HRB 204239",
      "registerart": "HRB",
      "company_name": "Continental Reifen Deutschland GmbH",
      "company_seat": "Hannover",
      "details": "10.10.2025 (Bekanntmachungsdatum)\n\nNiedersachsen Amtsgericht Hannover HRB 204239\nEinreichung neuer Dokumente\n\nContinental Reifen Deutschland GmbH\nGesellschaft mit beschränkter Haftung\nHannover\n\nDie Liste der Mitglieder des Aufsichtsrats wurde beim Registergericht eingereicht."
    },
    {
      "date": "2025-10-10",
      "id": "133538",
      "original_text": "Löschungsankündigung\nNiedersachsen Amtsgericht Braunschweig HRB 204258\nMTM Wilddieb Unternehmergesellschaft (haftungsbeschränkt) – Clausthal-Zellerfeld",
      "type": "Löschungsankündigung",
      "state": "Niedersachsen",
      "amtsgericht": "Amtsgericht Braunschweig",
      "registernummer": "HRB 204258",
      "registerart": "HRB",
      "company_name": "MTM Wilddieb Unternehmergesellschaft (haftungsbeschränkt)",
      "company_seat": "Clausthal-Zellerfeld",
      "details": "10.10.2025 (Bekanntmachungsdatum)\n\nNiedersachsen Amtsgericht Braunschweig HRB 204258\nLöschungsankündigung\n\nMTM Wilddieb Unternehmergesellschaft (haftungsbeschränkt)\nGesellschaft mit beschränkter Haftung\nClausthal-Zellerfeld\n\nDas Registergericht beabsichtigt, die Gesellschaft von Amts wegen nach § 394 FamFG zu löschen. Die Frist zur Erhebung eines Widerspruchs ist auf 1 Monat ab dieser Registerbekanntmachung festgesetzt."
    },
    {
      "date": "2025-10-10",
      "id": "133539",
      "original_text": "Registerbekanntmachung nach dem Umwandlungsgesetz\nNiedersachsen Amtsgericht Oldenburg (Oldenburg) HRA 208620\nTim Stöhr Logistik e. K., Inh. Tim Stöhr – Delmenhorst",
      "type": "Registerbekanntmachung nach dem Umwandlungsgesetz",
      "state": "Niedersachsen",
      "amtsgericht": "Amtsgericht Oldenburg (Oldenburg)",
      "registernummer": "HRA 208620",
      "registerart": "HRA",
      "company_name": "Tim Stöhr Logistik e. K., Inh. Tim Stöhr",
      "company_seat": "Delmenhorst",
      "details": "10.10.2025 (Bekanntmachungsdatum)\n\nNiedersachsen Amtsgericht Oldenburg (Oldenburg) HRA 208620\nRegisterbekanntmachung nach dem Umwandlungsgesetz 10.10.2025 (Eintragungsdatum)\n\nTim Stöhr Logistik e. K., Inh. Tim Stöhr\nEinzelkaufmann / Einzelkauffrau\nDelmenhorst\n\nDen Gläubigern der an der Ausgliederung beteiligten Rechtsträger ist, wenn sie binnen sechs Monaten nach dem Tag, an dem die Eintragung der Ausgliederung in das Register des Sitzes desjenigen Rechtsträgers, dessen Gläubiger sie sind, nach § 19 Abs. 3 UmwG als bekannt gemacht gilt, ihren Anspruch nach Grund und Höhe schriftlich anmelden, Sicherheit zu leisten, soweit sie nicht Befriedigung verlangen können. Dieses Recht steht den Gläubigern jedoch nur zu, wenn sie glaubhaft machen, dass durch die Ausgliederung die Erfüllung der Forderung gefährdet wird."
    },
    {
      "date": "2025-10-10",
      "id": "133540",
      "original_text": "Löschungsankündigung\nNiedersachsen Amtsgericht Aurich HRA 202594\nMC Bauprojekt UG (haftungsbeschränkt) & Co. KG – Emden",
      "type": "Löschungsankündigung",
      "state": "Niedersachsen",
      "amtsgericht": "Amtsgericht Aurich",
      "registernummer": "HRA 202594",
      "registerart": "HRA",
      "company_name": "MC Bauprojekt UG (haftungsbeschränkt) & Co. KG",
      "company_seat": "Emden",
      "details": "10.10.2025 (Bekanntmachungsdatum)\n\nNiedersachsen Amtsgericht Aurich HRA 202594\nLöschungsankündigung\n\nMC Bauprojekt UG (haftungsbeschränkt) & Co. KG\nKommanditgesellschaft\nEmden\n\nDas Registergericht beabsichtigt, die Firma von Amts wegen nach § 394 FamFG zu löschen. Die Frist zur Erhebung eines Widerspruchs ist auf 2 Monate ab dieser Registerbekanntmachung festgesetzt."
    },
    {
      "date": "2025-10-10",
      "id": "133541",
      "original_text": "Registerbekanntmachung nach dem Umwandlungsgesetz\nNiedersachsen Amtsgericht Göttingen VR 200084\nGesundheitssportverein Hann. Münden e.V. – Hann. Münden",
      "type": "Registerbekanntmachung nach dem Umwandlungsgesetz",
      "state": "Niedersachsen",
      "amtsgericht": "Amtsgericht Göttingen",
      "registernummer": "VR 200084",
      "registerart": "VR",
      "company_name": "Gesundheitssportverein Hann. Münden e.V.",
      "company_seat": "Hann. Münden",
      "details": "10.10.2025 (Bekanntmachungsdatum)\n\nNiedersachsen Amtsgericht Göttingen VR 200084\nRegisterbekanntmachung nach dem Umwandlungsgesetz 10.10.2025 (Eintragungsdatum)\n\nGesundheitssportverein Hann. Münden e.V.\neingetragener Verein\nHann. Münden\n\nDen Gläubigern der an der Verschmelzung beteiligten Rechtsträger ist, wenn sie binnen sechs Monaten nach dem Tag, an dem die Eintragung der Verschmelzung in das Register des Sitzes desjenigen Rechtsträgers, dessen Gläubiger sie sind, nach § 19  Abs.  3 UmwG als bekannt gemacht gilt, ihren Anspruch nach Grund und Höhe schriftlich anmelden, Sicherheit zu leisten, soweit sie nicht Befriedigung verlangen können. Dieses Recht steht den Gläubigern jedoch nur zu, wenn sie glaubhaft machen, dass durch die Verschmelzung die Erfüllung der Forderung gefährdet wird."
    },
    {
      "date": "2025-10-10",
      "id": "133542",
      "original_text": "Registerbekanntmachung nach dem Umwandlungsgesetz\nNiedersachsen Amtsgericht Osnabrück HRA 209166\nSB Elektro Batz e.K. – Spelle",
      "type": "Registerbekanntmachung nach dem Umwandlungsgesetz",
      "state": "Niedersachsen",
      "amtsgericht": "Amtsgericht Osnabrück",
      "registernummer": "HRA 209166",
      "registerart": "HRA",
      "company_name": "SB Elektro Batz e.K.",
      "company_seat": "Spelle",
      "details": "10.10.2025 (Bekanntmachungsdatum)\n\nNiedersachsen Amtsgericht Osnabrück HRA 209166\nRegisterbekanntmachung nach dem Umwandlungsgesetz 10.10.2025 (Eintragungsdatum)\n\nSB Elektro Batz e.K.\nEinzelkaufmann / Einzelkauffrau\nSpelle\n\nDen Gläubigern der an der Ausgliederung beteiligten Rechtsträger ist, wenn sie binnen sechs Monaten nach dem Tag, an dem die Eintragung der Ausgliederung in das Register des Sitzes desjenigen Rechtsträgers, dessen Gläubiger sie sind, nach § 19 Abs. 3 UmwG als bekannt gemacht gilt, ihren Anspruch nach Grund und Höhe schriftlich anmelden, Sicherheit zu leisten, soweit sie nicht Befriedigung verlangen können. Dieses Recht steht den Gläubigern jedoch nur zu, wenn sie glaubhaft machen, dass durch die Ausgliederung die Erfüllung der Forderung gefährdet wird."
    },
    {
      "date": "2025-10-10",
      "id": "133543",
      "original_text": "Löschungsankündigung\nNiedersachsen Amtsgericht Hildesheim HRB 204842\nX Plate GmbH – Hildesheim",
      "type": "Löschungsankündigung",
      "state": "Niedersachsen",
      "amtsgericht": "Amtsgericht Hildesheim",
      "registernummer": "HRB 204842",
      "registerart": "HRB",
      "company_name": "X Plate GmbH",
      "company_seat": "Hildesheim",
      "details": "10.10.2025 (Bekanntmachungsdatum)\n\nNiedersachsen Amtsgericht Hildesheim HRB 204842\nLöschungsankündigung\n\nX Plate GmbH\nGesellschaft mit beschränkter Haftung\nHildesheim\n\nDas Registergericht beabsichtigt, die Gesellschaft von Amts wegen nach § 394 FamFG zu löschen. Die Frist zur Erhebung eines Widerspruchs ist auf 1 Monat ab dieser Registerbekanntmachung festgesetzt."
    },
    {
      "date": "2025-10-10",
      "id": "133544",
      "original_text": "Löschungsankündigung\nBremen Amtsgericht Bremen HRB 37721\nEmpire of Spirits UG (haftungsbeschränkt) – Bremen",
      "type": "Löschungsankündigung",
      "state": "Bremen",
      "amtsgericht": "Amtsgericht Bremen",
      "registernummer": "HRB 37721",
      "registerart": "HRB",
      "company_name": "Empire of Spirits UG (haftungsbeschränkt)",
      "company_seat": "Bremen",
      "details": "10.10.2025 (Bekanntmachungsdatum)\n\nBremen Amtsgericht Bremen HRB 37721\nLöschungsankündigung\n\nEmpire of Spirits UG (haftungsbeschränkt)\nGesellschaft mit beschränkter Haftung\nBremen\n\nEs ist beabsichtigt die im Handelsregister eingetragene Gesellschaft von Amts wegen gemäß § 394 FamFG zu löschen. Gegen die Löschung kann beim AG Bremen schriftlich oder zu Protokoll der Geschäftsstelle Widerspruch eingelegt werden. Widerspruchsfrist 4 Wochen."
    },
    {
      "date": "2025-10-10",
      "id": "133545",
      "original_text": "Registerbekanntmachung nach dem Umwandlungsgesetz\nRheinland-Pfalz Amtsgericht Ludwigshafen a.Rhein (Ludwigshafen) GsR 335\nHyzi-Grundbesitz eGbR – Limburgerhof",
      "type": "Registerbekanntmachung nach dem Umwandlungsgesetz",
      "state": "Rheinland-Pfalz",
      "amtsgericht": "Amtsgericht Ludwigshafen a.Rhein (Ludwigshafen)",
      "registernummer": "GsR 335",
      "registerart": "GsR",
      "company_name": "Hyzi-Grundbesitz eGbR",
      "company_seat": "Limburgerhof",
      "details": "10.10.2025 (Bekanntmachungsdatum)\n\nRheinland-Pfalz Amtsgericht Ludwigshafen a.Rhein (Ludwigshafen) GsR 335\nRegisterbekanntmachung nach dem Umwandlungsgesetz 10.10.2025 (Eintragungsdatum)\n\nHyzi-Grundbesitz eGbR\nGesellschaft bürgerlichen Rechts\nLimburgerhof\n\nAls nicht eingetragen wird veröffentlicht:\nDen Gläubigern des formwechselnden Rechtsträgers ist, wenn sie binnen sechs Monaten nach dem Tag, an dem die Eintragung des Formwechsels nach § 201 UmwG als bekannt gemacht gilt, ihren Anspruch nach Grund und Höhe schriftlich anmelden, Sicherheit zu leisten, soweit sie nicht Befriedigung verlangen können. Dieses Recht steht den Gläubigern jedoch nur zu, wenn sie glaubhaft machen, dass durch den Formwechsel die Erfüllung der Forderung gefährdet wird."
    },
    {
      "date": "2025-10-10",
      "id": "133546",
      "original_text": "Registerbekanntmachung nach dem Umwandlungsgesetz\nRheinland-Pfalz Amtsgericht Ludwigshafen a.Rhein (Ludwigshafen) HRB 70462\nLimbArt Die Prothesenmanufaktur GmbH – Speyer",
      "type": "Registerbekanntmachung nach dem Umwandlungsgesetz",
      "state": "Rheinland-Pfalz",
      "amtsgericht": "Amtsgericht Ludwigshafen a.Rhein (Ludwigshafen)",
      "registernummer": "HRB 70462",
      "registerart": "HRB",
      "company_name": "LimbArt Die Prothesenmanufaktur GmbH",
      "company_seat": "Speyer",
      "details": "10.10.2025 (Bekanntmachungsdatum)\n\nRheinland-Pfalz Amtsgericht Ludwigshafen a.Rhein (Ludwigshafen) HRB 70462\nRegisterbekanntmachung nach dem Umwandlungsgesetz 10.10.2025 (Eintragungsdatum)\n\nLimbArt Die Prothesenmanufaktur GmbH\nGesellschaft mit beschränkter Haftung\nSpeyer\n\nAls nicht eingetragen wird veröffentlicht: Den Gläubigern der an der Ausgliederung beteiligten Rechtsträger ist, wenn sie binnen sechs Monaten nach dem Tag, an dem die Eintragung der Ausgliederung in das Register des Sitzes desjenigen Rechtsträgers, dessen Gläubiger sie sind, nach § 19 Abs. 3 UmwG als bekannt gemacht gilt, ihren Anspruch nach Grund und Höhe schriftlich anmelden, Sicherheit zu leisten, soweit sie nicht Befriedigung verlangen können. Dieses Recht steht den Gläubigern jedoch nur zu, wenn sie glaubhaft machen, dass durch die Ausgliederung die Erfüllung der Forderung gefährdet wird."
    },
    {
      "date": "2025-10-10",
      "id": "133547",
      "original_text": "Registerbekanntmachung nach dem Umwandlungsgesetz\nRheinland-Pfalz Amtsgericht Ludwigshafen a.Rhein (Ludwigshafen) HRB 68146\nHyzi-Immobilien GmbH – Limburgerhof",
      "type": "Registerbekanntmachung nach dem Umwandlungsgesetz",
      "state": "Rheinland-Pfalz",
      "amtsgericht": "Amtsgericht Ludwigshafen a.Rhein (Ludwigshafen)",
      "registernummer": "HRB 68146",
      "registerart": "HRB",
      "company_name": "Hyzi-Immobilien GmbH",
      "company_seat": "Limburgerhof",
      "details": "10.10.2025 (Bekanntmachungsdatum)\n\nRheinland-Pfalz Amtsgericht Ludwigshafen a.Rhein (Ludwigshafen) HRB 68146\nRegisterbekanntmachung nach dem Umwandlungsgesetz 10.10.2025 (Eintragungsdatum)\n\nHyzi-Immobilien GmbH\nGesellschaft mit beschränkter Haftung\nLimburgerhof\n\nAls nicht eingetragen wird veröffentlicht:\nDen Gläubigern des formwechselnden Rechtsträgers ist, wenn sie binnen sechs Monaten nach dem Tag, an dem die Eintragung des Formwechsels nach § 201 UmwG als bekannt gemacht gilt, ihren Anspruch nach Grund und Höhe schriftlich anmelden, Sicherheit zu leisten, soweit sie nicht Befriedigung verlangen können. Dieses Recht steht den Gläubigern jedoch nur zu, wenn sie glaubhaft machen, dass durch den Formwechsel die Erfüllung der Forderung gefährdet wird."
    },
    {
      "date": "2025-10-10",
      "id": "133548",
      "original_text": "Registerbekanntmachung nach dem Umwandlungsgesetz\nRheinland-Pfalz Amtsgericht Ludwigshafen a.Rhein (Ludwigshafen) HRA 62432\nLimbArt Die Prothesenmanufaktur Inh. Tobias Werner e. K. – Speyer",
      "type": "Registerbekanntmachung nach dem Umwandlungsgesetz",
      "state": "Rheinland-Pfalz",
      "amtsgericht": "Amtsgericht Ludwigshafen a.Rhein (Ludwigshafen)",
      "registernummer": "HRA 62432",
      "registerart": "HRA",
      "company_name": "LimbArt Die Prothesenmanufaktur Inh. Tobias Werner e. K.",
      "company_seat": "Speyer",
      "details": "10.10.2025 (Bekanntmachungsdatum)\n\nRheinland-Pfalz Amtsgericht Ludwigshafen a.Rhein (Ludwigshafen) HRA 62432\nRegisterbekanntmachung nach dem Umwandlungsgesetz 10.10.2025 (Eintragungsdatum)\n\nLimbArt Die Prothesenmanufaktur Inh. Tobias Werner e. K.\nEinzelkaufmann / Einzelkauffrau\nSpeyer\n\nAls nicht eingetragen wird veröffentlicht: Den Gläubigern der an der Ausgliederung beteiligten Rechtsträger ist, wenn sie binnen sechs Monaten nach dem Tag, an dem die Eintragung der Ausgliederung in das Register des Sitzes desjenigen Rechtsträgers, dessen Gläubiger sie sind, nach § 19 Abs. 3 UmwG als bekannt gemacht gilt, ihren Anspruch nach Grund und Höhe schriftlich anmelden, Sicherheit zu leisten, soweit sie nicht Befriedigung verlangen können. Dieses Recht steht den Gläubigern jedoch nur zu, wenn sie glaubhaft machen, dass durch die Ausgliederung die Erfüllung der Forderung gefährdet wird."
    },
    {
      "date": "2025-10-10",
      "id": "133549",
      "original_text": "Registerbekanntmachung nach dem Umwandlungsgesetz\nNordrhein-Westfalen Amtsgericht Arnsberg HRB 4455\nMETATEC GMBH – Wickede",
      "type": "Registerbekanntmachung nach dem Umwandlungsgesetz",
      "state": "Nordrhein-Westfalen",
      "amtsgericht": "Amtsgericht Arnsberg",
      "registernummer": "HRB 4455",
      "registerart": "HRB",
      "company_name": "METATEC GMBH",
      "company_seat": "Wickede",
      "details": "10.10.2025 (Bekanntmachungsdatum)\n\nNordrhein-Westfalen Amtsgericht Arnsberg HRB 4455\nRegisterbekanntmachung nach dem Umwandlungsgesetz 10.10.2025 (Eintragungsdatum)\n\nMETATEC GMBH\nGesellschaft mit beschränkter Haftung\nWickede\n\nDen Gläubigern der an der Ausgliederung beteiligten Rechtsträger ist, wenn sie binnen sechs Monaten nach dem Tag, an dem die Eintragung der Ausgliederung in das Register des Sitzes desjenigen Rechtsträgers, dessen Gläubiger sie sind, nach § 19 Absatz 3 UmwG als bekanntgemacht gilt, ihren Anspruch nach Grund und Höhe schriftlich anmelden, Sicherheit zu leisten, soweit sie nicht Befriedigung verlangen können. Dieses Recht steht den Gläubigern jedoch nur zu, wenn sie glaubhaft machen, dass durch die Ausgliederung die Erfüllung ihrer Forderung gefährdet wird."
    },
    {
      "date": "2025-10-10",
      "id": "133550",
      "original_text": "Registerbekanntmachung nach dem Umwandlungsgesetz\nNordrhein-Westfalen Amtsgericht Bonn GnR 429\nWillms & Schömer e.G. – Euskirchen",
      "type": "Registerbekanntmachung nach dem Umwandlungsgesetz",
      "state": "Nordrhein-Westfalen",
      "amtsgericht": "Amtsgericht Bonn",
      "registernummer": "GnR 429",
      "registerart": "GnR",
      "company_name": "Willms & Schömer e.G.",
      "company_seat": "Euskirchen",
      "details": "10.10.2025 (Bekanntmachungsdatum)\n\nNordrhein-Westfalen Amtsgericht Bonn GnR 429\nRegisterbekanntmachung nach dem Umwandlungsgesetz 10.10.2025 (Eintragungsdatum)\n\nWillms & Schömer e.G.\neingetragene Genossenschaft\nEuskirchen\n\nDen Gläubigern der an der formwechselnden Umwandlung beteiligten Rechtsträger ist, wenn sie binnen sechs Monaten nach dem Tag, an dem die Eintragung der formwechselnden Umwandlung in das Register des Sitzes desjenigen Rechtsträgers, dessen Gläubiger sie sind, nach § 19 Absatz 3 UmwG als bekanntgemacht gilt, ihren Anspruch nach Grund und Höhe schriftlich anmelden, Sicherheit zu leisten, soweit sie nicht Befriedigung verlangen können. Dieses Recht steht den Gläubigern jedoch nur zu, wenn sie glaubhaft machen, dass durch die formwechselnden Umwandlung die Erfüllung ihrer Forderung gefährdet wird."
    },
    {
      "date": "2025-10-10",
      "id": "133551",
      "original_text": "Löschungsankündigung\nNordrhein-Westfalen Amtsgericht Düsseldorf HRB 96098\nDüssel-Bau GmbH – Düsseldorf",
      "type": "Löschungsankündigung",
      "state": "Nordrhein-Westfalen",
      "amtsgericht": "Amtsgericht Düsseldorf",
      "registernummer": "HRB 96098",
      "registerart": "HRB",
      "company_name": "Düssel-Bau GmbH",
      "company_seat": "Düsseldorf",
      "details": "10.10.2025 (Bekanntmachungsdatum)\n\nNordrhein-Westfalen Amtsgericht Düsseldorf HRB 96098\nLöschungsankündigung\n\nDüssel-Bau GmbH\nGesellschaft mit beschränkter Haftung\nDüsseldorf\n\nDas Registergericht beabsichtigt die Gesellschaft von Amts wegen nach § 394 FamFG zu löschen. Die Frist zur Erhebung eines Widerspruchs ist auf 3 Wochen festgesetzt.\n\nRechtsbehelfsbelehrung:\nDas Widerspruchsrecht steht jedem zu, der an der Unterlassung der Löschung ein berechtigtes Interesse hat. Der Widerspruch ist bei dem Amtsgericht Düsseldorf -Registergericht-, Werdener Straße 1, 40227 Düsseldorf schriftlich in deutscher Sprache oder zur Niederschrift der Geschäftsstelle einzulegen. Der Widerspruch kann auch zur Niederschrift der Geschäftsstelle eines jeden Amtsgerichtes abgegeben werden. Die Einlegung ist auch durch Übertragung eines elektronischen Dokuments an die elektronische Poststelle des Gerichts möglich. Das elektronische Dokument muss für die Bearbeitung durch das Gericht geeignet und mit einer qualifizierten elektronischen Signatur der verantwortenden Person versehen sein oder von der verantwortenden Person signiert und auf einem sicheren Übermittlungsweg gemäß § 130a ZPO nach näherer Maßgabe der Verordnung über die technischen Rahmenbedingungen des elektronischen Rechtsverkehrs und über das besondere elektronische Behördenpostfach (BGBl. I, S.3803) eingereicht werden. Weitere Informationen erhalten Sie auf der Internetseite www.justiz.de.\nDer Widerspruch muss spätestens innerhalb der gesetzten Frist nach dem Datum der Bekanntmachung der Löschungsankündigung bei dem Amtsgericht - Registergericht - Düsseldorf eingegangen sein.  Dies gilt auch dann, wenn der Widerspruch zur Niederschrift der Geschäftsstelle eines anderen Amtsgerichtes abgegeben wurde. Die Frist beginnt mit dem Tage der Bekanntmachung der Löschungsankündigung in dem für die Bekanntmachung der Eintragungen in das Handelsregister bestimmten elektronischen Informations- und Kommunikationssystem nach § 10 des Handelsgesetzbuches. Fällt das Ende der Frist auf einen Sonntag, einen allgemeinen Feiertag oder Sonnabend, so endet die Frist mit Ablauf des nächsten Werktages.\nDer Widerspruch muss die Bezeichnung der angefochtenen Löschungsankündigung sowie die Erklärung enthalten, dass Widerspruch gegen diese Löschungsankündigung eingelegt wird. Er ist zu unterzeichnen und soll begründet werden."
    },
    {
      "date": "2025-10-10",
      "id": "133552",
      "original_text": "Registerbekanntmachung nach dem Umwandlungsgesetz\nNordrhein-Westfalen Amtsgericht Essen HRB 5486\nTREM GmbH – Essen",
      "type": "Registerbekanntmachung nach dem Umwandlungsgesetz",
      "state": "Nordrhein-Westfalen",
      "amtsgericht": "Amtsgericht Essen",
      "registernummer": "HRB 5486",
      "registerart": "HRB",
      "company_name": "TREM GmbH",
      "company_seat": "Essen",
      "details": "10.10.2025 (Bekanntmachungsdatum)\n\nNordrhein-Westfalen Amtsgericht Essen HRB 5486\nRegisterbekanntmachung nach dem Umwandlungsgesetz 10.10.2025 (Eintragungsdatum)\n\nTREM GmbH\nGesellschaft mit beschränkter Haftung\nEssen\n\nDen Gläubigern der an der Verschmelzung beteiligten Rechtsträger ist, wenn sie binnen sechs Monaten nach dem Tag, an dem die Eintragung der Verschmelzung in das Register des Sitzes desjenigen Rechtsträgers, dessen Gläubiger sie sind, nach § 19 Absatz 3 UmwG als bekanntgemacht gilt, ihren Anspruch nach Grund und Höhe schriftlich anmelden, Sicherheit zu leisten, soweit sie nicht Befriedigung verlangen können. Dieses Recht steht den Gläubigern jedoch nur zu, wenn sie glaubhaft machen, dass durch die Verschmelzung die Erfüllung ihrer Forderung gefährdet wird."
    },
    {
      "date": "2025-10-10",
      "id": "133553",
      "original_text": "Registerbekanntmachung nach dem Umwandlungsgesetz\nNordrhein-Westfalen Amtsgericht Kleve HRB 6799\nSchroers GmbH, Ingenieurgesellschaft des Vemessungswesens – Kamp-Lintfort",
      "type": "Registerbekanntmachung nach dem Umwandlungsgesetz",
      "state": "Nordrhein-Westfalen",
      "amtsgericht": "Amtsgericht Kleve",
      "registernummer": "HRB 6799",
      "registerart": "HRB",
      "company_name": "Schroers GmbH, Ingenieurgesellschaft des Vemessungswesens",
      "company_seat": "Kamp-Lintfort",
      "details": "10.10.2025 (Bekanntmachungsdatum)\n\nNordrhein-Westfalen Amtsgericht Kleve HRB 6799\nRegisterbekanntmachung nach dem Umwandlungsgesetz 10.10.2025 (Eintragungsdatum)\n\nSchroers GmbH, Ingenieurgesellschaft des Vemessungswesens\nGesellschaft mit beschränkter Haftung\nKamp-Lintfort\n\nDen Gläubigern der an der Verschmelzung beteiligten Rechtsträger ist, wenn sie binnen sechs Monaten nach dem Tag, an dem die Eintragung der Verschmelzung in das Register des Sitzes derjenigen Rechtsträger deren Gläubiger sie sind, nach § 19 Absatz 3 UmwG als bekanntgemacht gilt, ihren Anspruch nach Grund und Höhe schriftlich anmelden, Sicherheit zu leisten, soweit sie nicht Befriedigung verlangen können. Dieses Recht steht den Gläubigern jedoch nur zu, wenn sie glaubhaft machen, dass durch die Verschmelzung die Erfüllung ihrer Forderung gefährdet wird."
    },
    {
      "date": "2025-10-10",
      "id": "133554",
      "original_text": "Registerbekanntmachung nach dem Umwandlungsgesetz\nNordrhein-Westfalen Amtsgericht Münster HRB 22214\nGetränkemarkt Sassenberg GmbH – Everswinkel",
      "type": "Registerbekanntmachung nach dem Umwandlungsgesetz",
      "state": "Nordrhein-Westfalen",
      "amtsgericht": "Amtsgericht Münster",
      "registernummer": "HRB 22214",
      "registerart": "HRB",
      "company_name": "Getränkemarkt Sassenberg GmbH",
      "company_seat": "Everswinkel",
      "details": "10.10.2025 (Bekanntmachungsdatum)\n\nNordrhein-Westfalen Amtsgericht Münster HRB 22214\nRegisterbekanntmachung nach dem Umwandlungsgesetz 10.10.2025 (Eintragungsdatum)\n\nGetränkemarkt Sassenberg GmbH\nGesellschaft mit beschränkter Haftung\nEverswinkel\n\nDen Gläubigern der an der Abspaltung beteiligten Rechtsträger ist, wenn sie binnen sechs Monaten nach dem Tag, an dem die Eintragung der Abspaltung in das Register des Sitzes desjenigen Rechtsträgers, dessen Gläubiger sie sind, nach § 19 Absatz 3 UmwG als bekanntgemacht gilt, ihren Anspruch nach Grund und Höhe schriftlich anmelden, Sicherheit zu leisten, soweit sie nicht Befriedigung verlangen können. Dieses Recht steht den Gläubigern jedoch nur zu, wenn sie glaubhaft machen, dass durch die Abspaltung die Erfüllung ihrer Forderung gefährdet wird."
    },
    {
      "date": "2025-10-10",
      "id": "133555",
      "original_text": "Registerbekanntmachung nach dem Umwandlungsgesetz\nNordrhein-Westfalen Amtsgericht Münster HRB 22242\nGetränkemarkt Sendenhorst GmbH – Everswinkel",
      "type": "Registerbekanntmachung nach dem Umwandlungsgesetz",
      "state": "Nordrhein-Westfalen",
      "amtsgericht": "Amtsgericht Münster",
      "registernummer": "HRB 22242",
      "registerart": "HRB",
      "company_name": "Getränkemarkt Sendenhorst GmbH",
      "company_seat": "Everswinkel",
      "details": "10.10.2025 (Bekanntmachungsdatum)\n\nNordrhein-Westfalen Amtsgericht Münster HRB 22242\nRegisterbekanntmachung nach dem Umwandlungsgesetz 10.10.2025 (Eintragungsdatum)\n\nGetränkemarkt Sendenhorst GmbH\nGesellschaft mit beschränkter Haftung\nEverswinkel\n\nDen Gläubigern der an der Abspaltung beteiligten Rechtsträger ist, wenn sie binnen sechs Monaten nach dem Tag, an dem die Eintragung der Abspaltung in das Register des Sitzes derjenigen Rechtsträger deren Gläubiger sie sind, nach § 19 Absatz 3 UmwG als bekanntgemacht gilt, ihren Anspruch nach Grund und Höhe schriftlich anmelden, Sicherheit zu leisten, soweit sie nicht Befriedigung verlangen können. Dieses Recht steht den Gläubigern jedoch nur zu, wenn sie glaubhaft machen, dass durch die Abspaltung die Erfüllung ihrer Forderung gefährdet wird."
    },
    {
      "date": "2025-10-10",
      "id": "133556",
      "original_text": "Registerbekanntmachung nach dem Umwandlungsgesetz\nNordrhein-Westfalen Amtsgericht Münster HRB 8953\nStrohbücker GmbH – Everswinkel",
      "type": "Registerbekanntmachung nach dem Umwandlungsgesetz",
      "state": "Nordrhein-Westfalen",
      "amtsgericht": "Amtsgericht Münster",
      "registernummer": "HRB 8953",
      "registerart": "HRB",
      "company_name": "Strohbücker GmbH",
      "company_seat": "Everswinkel",
      "details": "10.10.2025 (Bekanntmachungsdatum)\n\nNordrhein-Westfalen Amtsgericht Münster HRB 8953\nRegisterbekanntmachung nach dem Umwandlungsgesetz 10.10.2025 (Eintragungsdatum)\n\nStrohbücker GmbH\nGesellschaft mit beschränkter Haftung\nEverswinkel\n\nDen Gläubigern der an der Abspaltung beteiligten Rechtsträger ist, wenn sie binnen sechs Monaten nach dem Tag, an dem die Eintragung der Abspaltung in das Register des Sitzes derjenigen Rechtsträger deren Gläubiger sie sind, nach § 19 Absatz 3 UmwG als bekanntgemacht gilt, ihren Anspruch nach Grund und Höhe schriftlich anmelden, Sicherheit zu leisten, soweit sie nicht Befriedigung verlangen können. Dieses Recht steht den Gläubigern jedoch nur zu, wenn sie glaubhaft machen, dass durch die Abspaltung die Erfüllung ihrer Forderung gefährdet wird."
    },
    {
      "date": "2025-10-10",
      "id": "133557",
      "original_text": "Registerbekanntmachung nach dem Umwandlungsgesetz\nNordrhein-Westfalen Amtsgericht Hamm HRA 4565\nNico Maschmeyer e.K. – Bergkamen",
      "type": "Registerbekanntmachung nach dem Umwandlungsgesetz",
      "state": "Nordrhein-Westfalen",
      "amtsgericht": "Amtsgericht Hamm",
      "registernummer": "HRA 4565",
      "registerart": "HRA",
      "company_name": "Nico Maschmeyer e.K.",
      "company_seat": "Bergkamen",
      "details": "10.10.2025 (Bekanntmachungsdatum)\n\nNordrhein-Westfalen Amtsgericht Hamm HRA 4565\nRegisterbekanntmachung nach dem Umwandlungsgesetz 08.10.2025 (Eintragungsdatum)\n\nNico Maschmeyer e.K.\nEinzelkaufmann / Einzelkauffrau\nBergkamen\n\nDen Gläubigern der an der Ausgliederung beteiligten Rechtsträger ist, wenn sie binnen sechs Monaten nach dem Tag, an dem die Eintragung der Ausgliederung in das Register des Sitzes desjenigen Rechtsträgers, dessen Gläubiger sie sind, nach § 19 Absatz 3 UmwG als bekanntgemacht gilt, ihren Anspruch nach Grund und Höhe schriftlich anmelden, Sicherheit zu leisten, soweit sie nicht Befriedigung verlangen können. Dieses Recht steht den Gläubigern jedoch nur zu, wenn sie glaubhaft machen, dass durch die Ausgliederung die Erfüllung ihrer Forderung gefährdet wird."
    },
    {
      "date": "2025-10-10",
      "id": "133558",
      "original_text": "Registerbekanntmachung nach dem Umwandlungsgesetz\nNordrhein-Westfalen Amtsgericht Arnsberg HRB 16117\nBronk Dienstleistungen GmbH – Lippetal",
      "type": "Registerbekanntmachung nach dem Umwandlungsgesetz",
      "state": "Nordrhein-Westfalen",
      "amtsgericht": "Amtsgericht Arnsberg",
      "registernummer": "HRB 16117",
      "registerart": "HRB",
      "company_name": "Bronk Dienstleistungen GmbH",
      "company_seat": "Lippetal",
      "details": "10.10.2025 (Bekanntmachungsdatum)\n\nNordrhein-Westfalen Amtsgericht Arnsberg HRB 16117\nRegisterbekanntmachung nach dem Umwandlungsgesetz 10.10.2025 (Eintragungsdatum)\n\nBronk Dienstleistungen GmbH\nGesellschaft mit beschränkter Haftung\nLippetal\n\nDen Gläubigern der an der Ausgliederung beteiligten Rechtsträger ist, wenn sie binnen sechs Monaten nach dem Tag, an dem die Eintragung der Ausgliederung in das Register des Sitzes desjenigen Rechtsträgers, dessen Gläubiger sie sind, nach § 19 Absatz 3 UmwG als bekanntgemacht gilt, ihren Anspruch nach Grund und Höhe schriftlich anmelden, Sicherheit zu leisten, soweit sie nicht Befriedigung verlangen können. Dieses Recht steht den Gläubigern jedoch nur zu, wenn sie glaubhaft machen, dass durch die Ausgliederung die Erfüllung ihrer Forderung gefährdet wird."
    },
    {
      "date": "2025-10-10",
      "id": "133559",
      "original_text": "Registerbekanntmachung nach dem Umwandlungsgesetz\nNordrhein-Westfalen Amtsgericht Essen HRA 11961\nbahar business Essen e.K. – Essen",
      "type": "Registerbekanntmachung nach dem Umwandlungsgesetz",
      "state": "Nordrhein-Westfalen",
      "amtsgericht": "Amtsgericht Essen",
      "registernummer": "HRA 11961",
      "registerart": "HRA",
      "company_name": "bahar business Essen e.K.",
      "company_seat": "Essen",
      "details": "10.10.2025 (Bekanntmachungsdatum)\n\nNordrhein-Westfalen Amtsgericht Essen HRA 11961\nRegisterbekanntmachung nach dem Umwandlungsgesetz 10.10.2025 (Eintragungsdatum)\n\nbahar business Essen e.K.\nEinzelkaufmann / Einzelkauffrau\nEssen\n\nDen Gläubigern der an der Ausgliederung beteiligten Rechtsträger ist, wenn sie binnen sechs Monaten nach dem Tag, an dem die Eintragung der Ausgliederung in das Register des Sitzes desjenigen Rechtsträgers, dessen Gläubiger sie sind, nach § 19 Absatz 3 UmwG als bekanntgemacht gilt, ihren Anspruch nach Grund und Höhe schriftlich anmelden, Sicherheit zu leisten, soweit sie nicht Befriedigung verlangen können. Dieses Recht steht den Gläubigern jedoch nur zu, wenn sie glaubhaft machen, dass durch die Ausgliederung die Erfüllung ihrer Forderung gefährdet wird."
    },
    {
      "date": "2025-10-10",
      "id": "133560",
      "original_text": "Registerbekanntmachung nach dem Umwandlungsgesetz\nNordrhein-Westfalen Amtsgericht Arnsberg HRB 16118\nIBA-TEC | IT Systemhaus GmbH – Arnsberg",
      "type": "Registerbekanntmachung nach dem Umwandlungsgesetz",
      "state": "Nordrhein-Westfalen",
      "amtsgericht": "Amtsgericht Arnsberg",
      "registernummer": "HRB 16118",
      "registerart": "HRB",
      "company_name": "IBA-TEC | IT Systemhaus GmbH",
      "company_seat": "Arnsberg",
      "details": "10.10.2025 (Bekanntmachungsdatum)\n\nNordrhein-Westfalen Amtsgericht Arnsberg HRB 16118\nRegisterbekanntmachung nach dem Umwandlungsgesetz 10.10.2025 (Eintragungsdatum)\n\nIBA-TEC | IT Systemhaus GmbH\nGesellschaft mit beschränkter Haftung\nArnsberg\n\nDen Gläubigern der an der Ausgliederung beteiligten Rechtsträger ist, wenn sie binnen sechs Monaten nach dem Tag, an dem die Eintragung der Ausgliederung in das Register des Sitzes desjenigen Rechtsträgers, dessen Gläubiger sie sind, nach § 19 Absatz 3 UmwG als bekanntgemacht gilt, ihren Anspruch nach Grund und Höhe schriftlich anmelden, Sicherheit zu leisten, soweit sie nicht Befriedigung verlangen können. Dieses Recht steht den Gläubigern jedoch nur zu, wenn sie glaubhaft machen, dass durch die Ausgliederung die Erfüllung ihrer Forderung gefährdet wird."
    },
    {
      "date": "2025-10-10",
      "id": "133561",
      "original_text": "Löschungsankündigung\nNordrhein-Westfalen Amtsgericht Iserlohn HRB 10980\nRWL GmbH – Lüdenscheid",
      "type": "Löschungsankündigung",
      "state": "Nordrhein-Westfalen",
      "amtsgericht": "Amtsgericht Iserlohn",
      "registernummer": "HRB 10980",
      "registerart": "HRB",
      "company_name": "RWL GmbH",
      "company_seat": "Lüdenscheid",
      "details": "10.10.2025 (Bekanntmachungsdatum)\n\nNordrhein-Westfalen Amtsgericht Iserlohn HRB 10980\nLöschungsankündigung 02.10.2025 (Eintragungsdatum)\n\nRWL GmbH\nGesellschaft mit beschränkter Haftung\nLüdenscheid\n\nIn der Handelsregistersache der Firma RWL\nIst auf der Grundlage einer Ermittlung von der Stadt Lüdenscheid mitgeteilt worden, dass an der hier bekannten Geschäftsadresse die Gesellschaft nicht mehr betrieben wird. Es ist davon auszugehen, dass Geschäfte insgesamt nicht mehr betrieben werden. Nach Ermittlung der Stadt Iserlohn sollen alle bekannten Betriebsadressen nur zum Schein angegeben worden sein. Eine Sitzverlegung ist nicht beantragt. Der Geschäftsführer, der zugleich einziger Gesellschafter ist, ist für das Amtsgericht Iserlohn nicht erreichbar. Die Geschäftsführerpflichten sind mehrfach verletzt. Es muss davon ausgegangen werden, dass sich der Geschäftsführer ins Ausland abgesetzt hat.\nVermögen der Gesellschaft ist nicht ersichtlich oder ermittelbar.\nEs ist daher beabsichtigt, die Firma gemäß § 394 FamFG im Handelsregister zu löschen.\nVon diesem Vorhaben werden Sie hiermit verständigt und erhalten Gelegenheit, innerhalb einer Frist von 2 Monaten nach Zustellung dieses Schreibens hiergegen Widerspruch zu erheben.\nRechtsbehelfsbelehrung:\nGegen diese Verfügung können Sie Widerspruch einlegen. Der Widerspruch ist bei dem Amtsgericht Iserlohn, Friedrichstraße 108-110, 58636 Iserlohn schriftlich in deutscher Sprache oder zur Niederschrift der Geschäftsstelle einzulegen. Der Widerspruch kann auch zur Niederschrift der Geschäftsstelle eines jeden Amtsgerichts abgegeben werden. Der Widerspruch muss spätestens innerhalb der gesetzten Frist bei dem Amtsgericht Iserlohn eingegangen sein. Dies gilt auch dann, wenn der Widerspruch zur Niederschrift der Geschäftsstelle eines anderen Amtsgerichts abgegeben wurde. Die Frist beginnt mit der Veröffentlichung. Fällt das Ende der Frist auf einen Sonntag, einen allgemeinen Feiertag oder Sonnabend, so endet die Frist mit Ablauf des nächsten Werktages. Der Widerspruch muss die Bezeichnung der angefochtenen Verfügung sowie die Erklärung enthalten, dass Widerspruch gegen diese Verfügung eingelegt wird. Er ist zu unterzeichnen und soll begründet werden."
    },
    {
      "date": "2025-10-10",
      "id": "133562",
      "original_text": "Registerbekanntmachung nach dem Umwandlungsgesetz\nNordrhein-Westfalen Amtsgericht Düsseldorf HRB 95132\nA&W TopCo GmbH – Düsseldorf",
      "type": "Registerbekanntmachung nach dem Umwandlungsgesetz",
      "state": "Nordrhein-Westfalen",
      "amtsgericht": "Amtsgericht Düsseldorf",
      "registernummer": "HRB 95132",
      "registerart": "HRB",
      "company_name": "A&W TopCo GmbH",
      "company_seat": "Düsseldorf",
      "details": "10.10.2025 (Bekanntmachungsdatum)\n\nNordrhein-Westfalen Amtsgericht Düsseldorf HRB 95132\nRegisterbekanntmachung nach dem Umwandlungsgesetz 10.10.2025 (Eintragungsdatum)\n\nA&W TopCo GmbH\nGesellschaft mit beschränkter Haftung\nDüsseldorf\n\nDen Gläubigern der an der Verschmelzung beteiligten Rechtsträger ist, wenn sie binnen sechs Monaten nach dem Tag, an dem die Eintragung der Verschmelzung in das Register des Sitzes desjenigen Rechtsträgers, dessen Gläubiger sie sind, nach § 19 Absatz 3 UmwG als bekanntgemacht gilt, ihren Anspruch nach Grund und Höhe schriftlich anmelden, Sicherheit zu leisten, soweit sie nicht Befriedigung verlangen können. Dieses Recht steht den Gläubigern jedoch nur zu, wenn sie glaubhaft machen, dass durch die Verschmelzung die Erfüllung ihrer Forderung gefährdet wird."
    },
    {
      "date": "2025-10-10",
      "id": "133563",
      "original_text": "Registerbekanntmachung nach dem Umwandlungsgesetz\nNordrhein-Westfalen Amtsgericht Arnsberg HRB 16116\nHaverland Immobilien GmbH – Soest",
      "type": "Registerbekanntmachung nach dem Umwandlungsgesetz",
      "state": "Nordrhein-Westfalen",
      "amtsgericht": "Amtsgericht Arnsberg",
      "registernummer": "HRB 16116",
      "registerart": "HRB",
      "company_name": "Haverland Immobilien GmbH",
      "company_seat": "Soest",
      "details": "10.10.2025 (Bekanntmachungsdatum)\n\nNordrhein-Westfalen Amtsgericht Arnsberg HRB 16116\nRegisterbekanntmachung nach dem Umwandlungsgesetz 10.10.2025 (Eintragungsdatum)\n\nHaverland Immobilien GmbH\nGesellschaft mit beschränkter Haftung\nSoest\n\nDen Gläubigern der an der Ausgliederung beteiligten Rechtsträger ist, wenn sie binnen sechs Monaten nach dem Tag, an dem die Eintragung der Ausgliederung in das Register des Sitzes desjenigen Rechtsträgers, dessen Gläubiger sie sind, nach § 19 Absatz 3 UmwG als bekanntgemacht gilt, ihren Anspruch nach Grund und Höhe schriftlich anmelden, Sicherheit zu leisten, soweit sie nicht Befriedigung verlangen können. Dieses Recht steht den Gläubigern jedoch nur zu, wenn sie glaubhaft machen, dass durch die Ausgliederung die Erfüllung ihrer Forderung gefährdet wird."
    },
    {
      "date": "2025-10-10",
      "id": "133564",
      "original_text": "Registerbekanntmachung nach dem Umwandlungsgesetz\nNordrhein-Westfalen Amtsgericht Bielefeld HRB 32729\nTop-Spiel Oppermann GmbH – Bielefeld",
      "type": "Registerbekanntmachung nach dem Umwandlungsgesetz",
      "state": "Nordrhein-Westfalen",
      "amtsgericht": "Amtsgericht Bielefeld",
      "registernummer": "HRB 32729",
      "registerart": "HRB",
      "company_name": "Top-Spiel Oppermann GmbH",
      "company_seat": "Bielefeld",
      "details": "10.10.2025 (Bekanntmachungsdatum)\n\nNordrhein-Westfalen Amtsgericht Bielefeld HRB 32729\nRegisterbekanntmachung nach dem Umwandlungsgesetz 10.10.2025 (Eintragungsdatum)\n\nTop-Spiel Oppermann GmbH\nGesellschaft mit beschränkter Haftung\nBielefeld\n\nDen Gläubigern der an der Verschmelzung beteiligten Rechtsträger ist, wenn sie binnen sechs Monaten nach dem Tag, an dem die Eintragung der Verschmelzung in das Register des Sitzes desjenigen Rechtsträgers, dessen Gläubiger sie sind, nach § 19 Absatz 3 UmwG als bekanntgemacht gilt, ihren Anspruch nach Grund und Höhe schriftlich anmelden, Sicherheit zu leisten, soweit sie nicht Befriedigung verlangen können. Dieses Recht steht den Gläubigern jedoch nur zu, wenn sie glaubhaft machen, dass durch die Verschmelzung die Erfüllung ihrer Forderung gefährdet wird."
    },
    {
      "date": "2025-10-10",
      "id": "133565",
      "original_text": "Löschungsankündigung\nNordrhein-Westfalen Amtsgericht Wuppertal HRA 18859\nSedenquell-Apotheke Dr. Anne-Christel von Sturmfeder – Erkrath",
      "type": "Löschungsankündigung",
      "state": "Nordrhein-Westfalen",
      "amtsgericht": "Amtsgericht Wuppertal",
      "registernummer": "HRA 18859",
      "registerart": "HRA",
      "company_name": "Sedenquell-Apotheke Dr. Anne-Christel von Sturmfeder",
      "company_seat": "Erkrath",
      "details": "10.10.2025 (Bekanntmachungsdatum)\n\nNordrhein-Westfalen Amtsgericht Wuppertal HRA 18859\nLöschungsankündigung\n\nSedenquell-Apotheke Dr. Anne-Christel von Sturmfeder\nEinzelkaufmann / Einzelkauffrau\nErkrath\n\nDas Registergericht beabsichtigt die Firma von Amts wegen nach § 31 Abs. 2 HGB, § 393 FamFG zu löschen. Die Frist zur Erhebung eines Widerspruchs ist auf zwei Monate festgesetzt."
    },
    {
      "date": "2025-10-10",
      "id": "133566",
      "original_text": "Einreichung neuer Dokumente\nNordrhein-Westfalen Amtsgericht Köln HRB 88066\nRegionalwert AG Rheinland – Köln",
      "type": "Einreichung neuer Dokumente",
      "state": "Nordrhein-Westfalen",
      "amtsgericht": "Amtsgericht Köln",
      "registernummer": "HRB 88066",
      "registerart": "HRB",
      "company_name": "Regionalwert AG Rheinland",
      "company_seat": "Köln",
      "details": "10.10.2025 (Bekanntmachungsdatum)\n\nNordrhein-Westfalen Amtsgericht Köln HRB 88066\nEinreichung neuer Dokumente\n\nRegionalwert AG Rheinland\nAktiengesellschaft\nKöln\n\nDem Registergericht ist eine Liste der Mitglieder des Aufsichtsrates eingereicht worden."
    },
    {
      "date": "2025-10-10",
      "id": "133567",
      "original_text": "Löschungsankündigung\nNordrhein-Westfalen Amtsgericht Kleve HRB 16491\nGalerie Max UG (haftungsbeschränkt) – Kranenburg",
      "type": "Löschungsankündigung",
      "state": "Nordrhein-Westfalen",
      "amtsgericht": "Amtsgericht Kleve",
      "registernummer": "HRB 16491",
      "registerart": "HRB",
      "company_name": "Galerie Max UG (haftungsbeschränkt)",
      "company_seat": "Kranenburg",
      "details": "10.10.2025 (Bekanntmachungsdatum)\n\nNordrhein-Westfalen Amtsgericht Kleve HRB 16491\nLöschungsankündigung\n\nGalerie Max UG (haftungsbeschränkt)\nGesellschaft mit beschränkter Haftung\nKranenburg\n\nDas Registergericht beabsichtigt die Gesellschaft von Amts wegen nach § 394 FamFG zu löschen. Die Frist zur Erhebung eines Widerspruchs ist auf einen Monat festgesetzt."
    },
    {
      "date": "2025-10-10",
      "id": "133568",
      "original_text": "Registerbekanntmachung nach dem Umwandlungsgesetz\nNordrhein-Westfalen Amtsgericht Recklinghausen HRA 6908\nOnline Shopping Jörg Druske e. K. – Datteln",
      "type": "Registerbekanntmachung nach dem Umwandlungsgesetz",
      "state": "Nordrhein-Westfalen",
      "amtsgericht": "Amtsgericht Recklinghausen",
      "registernummer": "HRA 6908",
      "registerart": "HRA",
      "company_name": "Online Shopping Jörg Druske e. K.",
      "company_seat": "Datteln",
      "details": "10.10.2025 (Bekanntmachungsdatum)\n\nNordrhein-Westfalen Amtsgericht Recklinghausen HRA 6908\nRegisterbekanntmachung nach dem Umwandlungsgesetz 10.10.2025 (Eintragungsdatum)\n\nOnline Shopping Jörg Druske e. K.\nEinzelkaufmann / Einzelkauffrau\nDatteln\n\nDen Gläubigern der an der Verschmelzung beteiligten Rechtsträger ist, wenn sie binnen sechs Monaten nach dem Tag, an dem die Eintragung der Verschmelzung in das Register des Sitzes desjenigen Rechtsträgers, dessen Gläubiger sie sind, nach § 19 Absatz 3 UmwG als bekanntgemacht gilt, ihren Anspruch nach Grund und Höhe schriftlich anmelden, Sicherheit zu leisten, soweit sie nicht Befriedigung verlangen können. Dieses Recht steht den Gläubigern jedoch nur zu, wenn sie glaubhaft machen, dass durch die Verschmelzung die Erfüllung ihrer Forderung gefährdet wird."
    },
    {
      "date": "2025-10-10",
      "id": "133569",
      "original_text": "Registerbekanntmachung nach dem Umwandlungsgesetz\nNordrhein-Westfalen Amtsgericht Düren GsR 186\nCHROMA GLOBE S. & S. Frohn eGbR – Kreuzau",
      "type": "Registerbekanntmachung nach dem Umwandlungsgesetz",
      "state": "Nordrhein-Westfalen",
      "amtsgericht": "Amtsgericht Düren",
      "registernummer": "GsR 186",
      "registerart": "GsR",
      "company_name": "CHROMA GLOBE S. & S. Frohn eGbR",
      "company_seat": "Kreuzau",
      "details": "10.10.2025 (Bekanntmachungsdatum)\n\nNordrhein-Westfalen Amtsgericht Düren GsR 186\nRegisterbekanntmachung nach dem Umwandlungsgesetz 10.10.2025 (Eintragungsdatum)\n\nCHROMA GLOBE S. & S. Frohn eGbR\nGesellschaft bürgerlichen Rechts\nKreuzau\n\nDen Gläubigern der an der Verschmelzung beteiligten Rechtsträger ist, wenn sie binnen sechs Monaten nach dem Tag, an dem die Eintragung der Verschmelzung in das Register des Sitzes desjenigen Rechtsträgers, dessen Gläubiger sie sind, nach § 19 Absatz 3 UmwG als bekanntgemacht gilt, ihren Anspruch nach Grund und Höhe schriftlich anmelden, Sicherheit zu leisten, soweit sie nicht Befriedigung verlangen können. Dieses Recht steht den Gläubigern jedoch nur zu, wenn sie glaubhaft machen, dass durch die Verschmelzung die Erfüllung ihrer Forderung gefährdet wird."
    },
    {
      "date": "2025-10-10",
      "id": "133570",
      "original_text": "Registerbekanntmachung nach dem Umwandlungsgesetz\nNordrhein-Westfalen Amtsgericht Arnsberg HRA 9276\nBronk Dienstleistungen e.K. – Lippetal",
      "type": "Registerbekanntmachung nach dem Umwandlungsgesetz",
      "state": "Nordrhein-Westfalen",
      "amtsgericht": "Amtsgericht Arnsberg",
      "registernummer": "HRA 9276",
      "registerart": "HRA",
      "company_name": "Bronk Dienstleistungen e.K.",
      "company_seat": "Lippetal",
      "details": "10.10.2025 (Bekanntmachungsdatum)\n\nNordrhein-Westfalen Amtsgericht Arnsberg HRA 9276\nRegisterbekanntmachung nach dem Umwandlungsgesetz 10.10.2025 (Eintragungsdatum)\n\nBronk Dienstleistungen e.K.\nEinzelkaufmann / Einzelkauffrau\nLippetal\n\nDen Gläubigern der an der Ausgliederung beteiligten Rechtsträger ist, wenn sie binnen sechs Monaten nach dem Tag, an dem die Eintragung der Ausgliederung in das Register des Sitzes desjenigen Rechtsträgers, dessen Gläubiger sie sind, nach § 19 Absatz 3 UmwG als bekanntgemacht gilt, ihren Anspruch nach Grund und Höhe schriftlich anmelden, Sicherheit zu leisten, soweit sie nicht Befriedigung verlangen können. Dieses Recht steht den Gläubigern jedoch nur zu, wenn sie glaubhaft machen, dass durch die Ausgliederung die Erfüllung ihrer Forderung gefährdet wird."
    },
    {
      "date": "2025-10-10",
      "id": "133571",
      "original_text": "Registerbekanntmachung nach dem Umwandlungsgesetz\nNordrhein-Westfalen Amtsgericht Arnsberg HRA 6477\nHaverland Immobilien, Inh. Joachim Jatzkowski e.K. – Soest",
      "type": "Registerbekanntmachung nach dem Umwandlungsgesetz",
      "state": "Nordrhein-Westfalen",
      "amtsgericht": "Amtsgericht Arnsberg",
      "registernummer": "HRA 6477",
      "registerart": "HRA",
      "company_name": "Haverland Immobilien, Inh. Joachim Jatzkowski e.K.",
      "company_seat": "Soest",
      "details": "10.10.2025 (Bekanntmachungsdatum)\n\nNordrhein-Westfalen Amtsgericht Arnsberg HRA 6477\nRegisterbekanntmachung nach dem Umwandlungsgesetz 10.10.2025 (Eintragungsdatum)\n\nHaverland Immobilien, Inh. Joachim Jatzkowski e.K.\nEinzelkaufmann / Einzelkauffrau\nSoest\n\nDen Gläubigern der an der Ausgliederung beteiligten Rechtsträger ist, wenn sie binnen sechs Monaten nach dem Tag, an dem die Eintragung der Ausgliederung in das Register des Sitzes desjenigen Rechtsträgers, dessen Gläubiger sie sind, nach § 19 Absatz 3 UmwG als bekanntgemacht gilt, ihren Anspruch nach Grund und Höhe schriftlich anmelden, Sicherheit zu leisten, soweit sie nicht Befriedigung verlangen können. Dieses Recht steht den Gläubigern jedoch nur zu, wenn sie glaubhaft machen, dass durch die Ausgliederung die Erfüllung ihrer Forderung gefährdet wird."
    },
    {
      "date": "2025-10-10",
      "id": "133572",
      "original_text": "Registerbekanntmachung nach dem Umwandlungsgesetz\nNordrhein-Westfalen Amtsgericht Bielefeld HRB 33149\nAVERS Automaten Betriebs-GmbH – Bielefeld",
      "type": "Registerbekanntmachung nach dem Umwandlungsgesetz",
      "state": "Nordrhein-Westfalen",
      "amtsgericht": "Amtsgericht Bielefeld",
      "registernummer": "HRB 33149",
      "registerart": "HRB",
      "company_name": "AVERS Automaten Betriebs-GmbH",
      "company_seat": "Bielefeld",
      "details": "10.10.2025 (Bekanntmachungsdatum)\n\nNordrhein-Westfalen Amtsgericht Bielefeld HRB 33149\nRegisterbekanntmachung nach dem Umwandlungsgesetz 10.10.2025 (Eintragungsdatum)\n\nAVERS Automaten Betriebs-GmbH\nGesellschaft mit beschränkter Haftung\nBielefeld\n\nDen Gläubigern der an der Verschmelzung beteiligten Rechtsträger ist, wenn sie binnen sechs Monaten nach dem Tag, an dem die Eintragung der Verschmelzung in das Register des Sitzes desjenigen Rechtsträgers, dessen Gläubiger sie sind, nach § 19 Absatz 3 UmwG als bekanntgemacht gilt, ihren Anspruch nach Grund und Höhe schriftlich anmelden, Sicherheit zu leisten, soweit sie nicht Befriedigung verlangen können. Dieses Recht steht den Gläubigern jedoch nur zu, wenn sie glaubhaft machen, dass durch die Verschmelzung die Erfüllung ihrer Forderung gefährdet wird."
    },
    {
      "date": "2025-10-10",
      "id": "133573",
      "original_text": "Registerbekanntmachung nach dem Umwandlungsgesetz\nNordrhein-Westfalen Amtsgericht Arnsberg HRB 14727\nCBS Holding GmbH – Arnsberg",
      "type": "Registerbekanntmachung nach dem Umwandlungsgesetz",
      "state": "Nordrhein-Westfalen",
      "amtsgericht": "Amtsgericht Arnsberg",
      "registernummer": "HRB 14727",
      "registerart": "HRB",
      "company_name": "CBS Holding GmbH",
      "company_seat": "Arnsberg",
      "details": "10.10.2025 (Bekanntmachungsdatum)\n\nNordrhein-Westfalen Amtsgericht Arnsberg HRB 14727\nRegisterbekanntmachung nach dem Umwandlungsgesetz 10.10.2025 (Eintragungsdatum)\n\nCBS Holding GmbH\nGesellschaft mit beschränkter Haftung\nArnsberg\n\nDen Gläubigern der an der Ausgliederung beteiligten Rechtsträger ist, wenn sie binnen sechs Monaten nach dem Tag, an dem die Eintragung der Ausgliederung in das Register des Sitzes desjenigen Rechtsträgers, dessen Gläubiger sie sind, nach § 19 Absatz 3 UmwG als bekanntgemacht gilt, ihren Anspruch nach Grund und Höhe schriftlich anmelden, Sicherheit zu leisten, soweit sie nicht Befriedigung verlangen können. Dieses Recht steht den Gläubigern jedoch nur zu, wenn sie glaubhaft machen, dass durch die Ausgliederung die Erfüllung ihrer Forderung gefährdet wird."
    },
    {
      "date": "2025-10-10",
      "id": "133574",
      "original_text": "Löschungsankündigung\nNordrhein-Westfalen Amtsgericht Essen HRB 29741\nRasant Logistik GmbH – Essen",
      "type": "Löschungsankündigung",
      "state": "Nordrhein-Westfalen",
      "amtsgericht": "Amtsgericht Essen",
      "registernummer": "HRB 29741",
      "registerart": "HRB",
      "company_name": "Rasant Logistik GmbH",
      "company_seat": "Essen",
      "details": "10.10.2025 (Bekanntmachungsdatum)\n\nNordrhein-Westfalen Amtsgericht Essen HRB 29741\nLöschungsankündigung 10.10.2025 (Eintragungsdatum)\n\nRasant Logistik GmbH\nGesellschaft mit beschränkter Haftung\nEssen\n\nDas Registergericht beabsichtigt die Gesellschaft von Amts wegen nach § 394 FamFG zu löschen. Die Frist zur Erhebung eines Widerspruchs ist auf einen Monat festgesetzt."
    },
    {
      "date": "2025-10-10",
      "id": "133575",
      "original_text": "Löschungsankündigung\nNordrhein-Westfalen Amtsgericht Hamm HRB 3577\nHemke Heizungs- und Lüftungsbau GmbH – Holzwickede",
      "type": "Löschungsankündigung",
      "state": "Nordrhein-Westfalen",
      "amtsgericht": "Amtsgericht Hamm",
      "registernummer": "HRB 3577",
      "registerart": "HRB",
      "company_name": "Hemke Heizungs- und Lüftungsbau GmbH",
      "company_seat": "Holzwickede",
      "details": "10.10.2025 (Bekanntmachungsdatum)\n\nNordrhein-Westfalen Amtsgericht Hamm HRB 3577\nLöschungsankündigung\n\nHemke Heizungs- und Lüftungsbau GmbH\nGesellschaft mit beschränkter Haftung\nHolzwickede\n\nDas Registergericht beabsichtigt die Gesellschaft von Amts wegen nach § 394 FamFG zu löschen. Die Frist zur Erhebung eines Widerspruchs ist auf drei Monate festgesetzt."
    },
    {
      "date": "2025-10-10",
      "id": "133576",
      "original_text": "Registerbekanntmachung nach dem Umwandlungsgesetz\nNordrhein-Westfalen Amtsgericht Arnsberg HRA 9256\nVerpachtung Detlef Ebert e.K. – Wickede",
      "type": "Registerbekanntmachung nach dem Umwandlungsgesetz",
      "state": "Nordrhein-Westfalen",
      "amtsgericht": "Amtsgericht Arnsberg",
      "registernummer": "HRA 9256",
      "registerart": "HRA",
      "company_name": "Verpachtung Detlef Ebert e.K.",
      "company_seat": "Wickede",
      "details": "10.10.2025 (Bekanntmachungsdatum)\n\nNordrhein-Westfalen Amtsgericht Arnsberg HRA 9256\nRegisterbekanntmachung nach dem Umwandlungsgesetz 10.10.2025 (Eintragungsdatum)\n\nVerpachtung Detlef Ebert e.K.\nEinzelkaufmann / Einzelkauffrau\nWickede\n\nDen Gläubigern der an der Ausgliederung beteiligten Rechtsträger ist, wenn sie binnen sechs Monaten nach dem Tag, an dem die Eintragung der Ausgliederung in das Register des Sitzes desjenigen Rechtsträgers, dessen Gläubiger sie sind, nach § 19 Absatz 3 UmwG als bekanntgemacht gilt, ihren Anspruch nach Grund und Höhe schriftlich anmelden, Sicherheit zu leisten, soweit sie nicht Befriedigung verlangen können. Dieses Recht steht den Gläubigern jedoch nur zu, wenn sie glaubhaft machen, dass durch die Ausgliederung die Erfüllung ihrer Forderung gefährdet wird."
    },
    {
      "date": "2025-10-10",
      "id": "133577",
      "original_text": "Löschungsankündigung\nNordrhein-Westfalen Amtsgericht Mönchengladbach HRB 20829\nEKO-Rund ums Haus UG (haftungsbeschränkt) – Mönchengladbach",
      "type": "Löschungsankündigung",
      "state": "Nordrhein-Westfalen",
      "amtsgericht": "Amtsgericht Mönchengladbach",
      "registernummer": "HRB 20829",
      "registerart": "HRB",
      "company_name": "EKO-Rund ums Haus UG (haftungsbeschränkt)",
      "company_seat": "Mönchengladbach",
      "details": "10.10.2025 (Bekanntmachungsdatum)\n\nNordrhein-Westfalen Amtsgericht Mönchengladbach HRB 20829\nLöschungsankündigung\n\nEKO-Rund ums Haus UG (haftungsbeschränkt)\nGesellschaft mit beschränkter Haftung\nMönchengladbach\n\nDas Registergericht beabsichtigt, die im Handelsregister eingetragene Gesellschaft gemäß § 394 Absatz 1 FamFG wegen Vermögenslosigkeit von Amts wegen zu löschen. Gegen diese Verfügung kann Widerspruch eingelegt werden. Die Frist zur Erhebung eines Widerspruchs gegen die beabsichtigte Löschung von Amts wegen ist auf drei Monate festgesetzt."
    },
    {
      "date": "2025-10-10",
      "id": "133578",
      "original_text": "Löschungsankündigung\nNordrhein-Westfalen Amtsgericht Aachen HRB 23055\nEFF ENTERPRISES HOLDINGS GmbH – Heinsberg",
      "type": "Löschungsankündigung",
      "state": "Nordrhein-Westfalen",
      "amtsgericht": "Amtsgericht Aachen",
      "registernummer": "HRB 23055",
      "registerart": "HRB",
      "company_name": "EFF ENTERPRISES HOLDINGS GmbH",
      "company_seat": "Heinsberg",
      "details": "10.10.2025 (Bekanntmachungsdatum)\n\nNordrhein-Westfalen Amtsgericht Aachen HRB 23055\nLöschungsankündigung\n\nEFF ENTERPRISES HOLDINGS GmbH\nGesellschaft mit beschränkter Haftung\nHeinsberg\n\nDas Registergericht beabsichtigt, von Amts wegen die Gesellschaft wegen Vermögenslosigkeit nach § 394 FamFG zu löschen, weil das Insolvenzverfahren Amtsgericht Aachen (Az.: 93 IN 36/21) beendet und Vermögen der Gesellschaft nicht mehr erkennbar ist.\n\nZur Geltendmachung des Widerspruchs gegen die beabsichtigte Löschung wird hiermit eine Frist von einem Monat ab Veröffentlichung dieser Ankündigung bestimmt.\n\nRechtsbehelfsbelehrung:\n\nGegen diese Verfügung kann Widerspruch eingelegt werden. Zum Widerspruch ist jeder berechtigt, der an der Unterlassung der Löschung ein berechtigtes Interesse hat.\n\nDer Widerspruch ist bei dem Amtsgericht Aachen, Adalbertsteinweg 92, 52070 Aachen schriftlich in deutscher Sprache oder zur Niederschrift der Geschäftsstelle einzulegen. Der Widerspruch kann auch zur Niederschrift der Geschäftsstelle eines jeden Amtsgerichtes abgegeben werden.\n\nDer Widerspruch muss spätestens innerhalb der gesetzten Frist nach der Bekanntgabe der Verfügung bei dem Amtsgericht Aachen eingegangen sein. Dies gilt auch dann, wenn der Widerspruch zur Niederschrift der Geschäftsstelle eines anderen Amtsgerichtes abgegeben wurde. Die Frist beginnt mit der Bekanntgabe der Verfügung durch Veröffentlichung. Fällt das Ende der Frist auf einen Sonntag, einen allgemeinen Feiertag oder Sonnabend, so endet die Frist mit Ablauf des nächsten Werktages.\n\nDer Widerspruch muss die Bezeichnung der angefochtenen Verfügung sowie die Erklärung enthalten, dass Widerspruch gegen diese Verfügung eingelegt wird. Er ist zu unterzeichnen und soll begründet werden.\n\nDie Einlegung ist auch durch Übertragung eines elektronischen Dokuments an die elektronische Poststelle des Gerichts möglich. Das elektronische Dokument muss für die Bearbeitung durch das Gericht geeignet und mit einer qualifizierten elektronischen Signatur der verantwortenden Person versehen sein oder von der verantwortenden Person signiert und auf einem sicheren Übermittlungsweg gemäß § 130 a ZPO nach näherer Maßgabe der Verordnung über die technischen Rahmenbedingungen des elektronischen Rechtsverkehrs und über das besondere elektronische Behördenpostfach (BGBl. I, S. 3803) eingereicht werden. Weitere Informationen erhalten Sie auf der Internetseite www.justiz.de."
    },
    {
      "date": "2025-10-10",
      "id": "133579",
      "original_text": "Registerbekanntmachung nach dem Umwandlungsgesetz\nThüringen Amtsgericht Jena HRA 507082\nKüchenstudio Matthäs e.K. – Saalfeld/Saale",
      "type": "Registerbekanntmachung nach dem Umwandlungsgesetz",
      "state": "Thüringen",
      "amtsgericht": "Amtsgericht Jena",
      "registernummer": "HRA 507082",
      "registerart": "HRA",
      "company_name": "Küchenstudio Matthäs e.K.",
      "company_seat": "Saalfeld/Saale",
      "details": "10.10.2025 (Bekanntmachungsdatum)\n\nThüringen Amtsgericht Jena HRA 507082\nRegisterbekanntmachung nach dem Umwandlungsgesetz 10.10.2025 (Eintragungsdatum)\n\nKüchenstudio Matthäs e.K.\nEinzelkaufmann / Einzelkauffrau\nSaalfeld/Saale\n\nDas von dem Einzelkaufmann Matthäs, Marko, Unterwellenborn OT Bucha, *20.06.1972  unter der Firma Küchenstudio Matthäs e.K. mit dem Sitz in Saalfeld/Saale betriebene Unternehmen ist aus dem Vermögen gemäß Ausgliederungserklärung/Ausgliederungsplan vom 02.07.2025, mit Nachtrag vom 26.08.2025 auf die neu gegründete Küchenstudio Matthäs GmbH mit dem Sitz in Saalfeld/Saale (Amtsgericht Jena HRB 523776) ausgegliedert. Die Firma ist erloschen. Von Amts wegen eingetragen aufgrund § 155 UmwG.Tag der Eintragung:10.10.2025\nNicht eingetragen: Den Gläubigern der an der Ausgliederung beteiligten Rechtsträger, ist wenn sie binnen sechs Monaten nach dem Tag, an dem die Eintragung der Ausgliederung in das Register des Sitzes desjenigen Rechtsträgers, dessen Gläubiger sie sind, nach §§125, 19 Abs. 3 UmwG als bekanntgemacht gilt, ihren Anspruch nach Grund und Höhe schriftlich anmelden, Sicherheit zu leisten, soweit sie nicht Befriedigung verlangen können. Dieses Recht steht ihnen jedoch nur zu, wenn sie glaubhaft machen, daß durch die Ausgliederung die Erfüllung ihrer Forderung gefährdet wird."
    },
    {
      "date": "2025-10-10",
      "id": "133580",
      "original_text": "Löschungsankündigung\nHessen Amtsgericht Hanau HRB 95184\nHell´s Pack UG (haftungsbeschränkt) – Hasselroth",
      "type": "Löschungsankündigung",
      "state": "Hessen",
      "amtsgericht": "Amtsgericht Hanau",
      "registernummer": "HRB 95184",
      "registerart": "HRB",
      "company_name": "Hell´s Pack UG (haftungsbeschränkt)",
      "company_seat": "Hasselroth",
      "details": "10.10.2025 (Bekanntmachungsdatum)\n\nHessen Amtsgericht Hanau HRB 95184\nLöschungsankündigung\n\nHell´s Pack UG (haftungsbeschränkt)\nGesellschaft mit beschränkter Haftung\nHasselroth\n\nDas Registergericht beabsichtigt die im Handelsregister eingetragene Gesellschaft von Amts wegen nach § 394 FamFG zu löschen. Die Frist zur Erhebung eines Widerspruchs gegen die beabsichtigte Löschung wird auf 3 Monate festgesetzt."
    },
    {
      "date": "2025-10-10",
      "id": "133581",
      "original_text": "Löschungsankündigung\nHessen Amtsgericht Offenbach am Main HRB 40306\nAlbatros-Medienvertriebs GmbH – Dreieich",
      "type": "Löschungsankündigung",
      "state": "Hessen",
      "amtsgericht": "Amtsgericht Offenbach am Main",
      "registernummer": "HRB 40306",
      "registerart": "HRB",
      "company_name": "Albatros-Medienvertriebs GmbH",
      "company_seat": "Dreieich",
      "details": "10.10.2025 (Bekanntmachungsdatum)\n\nHessen Amtsgericht Offenbach am Main HRB 40306\nLöschungsankündigung\n\nAlbatros-Medienvertriebs GmbH\nGesellschaft mit beschränkter Haftung\nDreieich\n\nDas Registergericht beabsichtigt die im Handelsregister eingetragene Gesellschaft von Amts wegen nach § 394 FamFG zu löschen. Die Frist zur Erhebung eines Widerspruchs gegen die beabsichtigte Löschung wird auf 3 Monate festgesetzt"
    },
    {
      "date": "2025-10-10",
      "id": "133582",
      "original_text": "Registerbekanntmachung nach dem Umwandlungsgesetz\nHessen Amtsgericht Offenbach am Main HRA 42105\nDeutsche Realwert GmbH & Co KG – Dreieich",
      "type": "Registerbekanntmachung nach dem Umwandlungsgesetz",
      "state": "Hessen",
      "amtsgericht": "Amtsgericht Offenbach am Main",
      "registernummer": "HRA 42105",
      "registerart": "HRA",
      "company_name": "Deutsche Realwert GmbH & Co KG",
      "company_seat": "Dreieich",
      "details": "10.10.2025 (Bekanntmachungsdatum)\n\nHessen Amtsgericht Offenbach am Main HRA 42105\nRegisterbekanntmachung nach dem Umwandlungsgesetz 10.10.2025 (Eintragungsdatum)\n\nDeutsche Realwert GmbH & Co KG\nKommanditgesellschaft\nDreieich\n\nDen Gläubigern der an der Verschmelzung beteiligten Rechtsträger ist, wenn sie binnen sechs Monaten nach dem Tag, an dem die Eintragung der Verschmelzung in das Register des Sitzes desjenigen Rechtsträgers, dessen Gläubiger sie sind, nach § 19 Absatz 3 UmwG bekannt gemacht worden ist, ihren Anspruch nach Grund und Höhe schriftlich anmelden, Sicherheit zu leisten, soweit sie nicht Befriedigung verlangen können. Dieses Recht steht den Gläubigern jedoch nur zu, wenn sie glaubhaft machen, dass durch die Verschmelzung die Erfüllung ihrer Forderung gefährdet wird."
    },
    {
      "date": "2025-10-10",
      "id": "133583",
      "original_text": "Einreichung neuer Dokumente\nHessen Amtsgericht Frankfurt am Main HRB 53261\nStifel Europe AG – Frankfurt am Main",
      "type": "Einreichung neuer Dokumente",
      "state": "Hessen",
      "amtsgericht": "Amtsgericht Frankfurt am Main",
      "registernummer": "HRB 53261",
      "registerart": "HRB",
      "company_name": "Stifel Europe AG",
      "company_seat": "Frankfurt am Main",
      "details": "10.10.2025 (Bekanntmachungsdatum)\n\nHessen Amtsgericht Frankfurt am Main HRB 53261\nEinreichung neuer Dokumente\n\nStifel Europe AG\nAktiengesellschaft\nFrankfurt am Main\n\nDurch eine Änderung in den Personen der Aufsichtsratsmitglieder ist eine Liste der Mitglieder des Aufsichtsrates zum Handelsregister eingereicht worden."
    },
    {
      "date": "2025-10-10",
      "id": "133584",
      "original_text": "Registerbekanntmachung nach dem Umwandlungsgesetz\nHessen Amtsgericht Offenbach am Main HRA 42528\nDeutsche Realwert 2. GmbH & Co. KG – Dreieich",
      "type": "Registerbekanntmachung nach dem Umwandlungsgesetz",
      "state": "Hessen",
      "amtsgericht": "Amtsgericht Offenbach am Main",
      "registernummer": "HRA 42528",
      "registerart": "HRA",
      "company_name": "Deutsche Realwert 2. GmbH & Co. KG",
      "company_seat": "Dreieich",
      "details": "10.10.2025 (Bekanntmachungsdatum)\n\nHessen Amtsgericht Offenbach am Main HRA 42528\nRegisterbekanntmachung nach dem Umwandlungsgesetz 10.10.2025 (Eintragungsdatum)\n\nDeutsche Realwert 2. GmbH & Co. KG\nKommanditgesellschaft\nDreieich\n\nDen Gläubigern der an der Verschmelzung beteiligten Rechtsträger ist, wenn sie binnen sechs Monaten nach dem Tag, an dem die Eintragung der Verschmelzung in das Register des Sitzes desjenigen Rechtsträgers, dessen Gläubiger sie sind, nach § 19 Absatz 3 UmwG bekannt gemacht worden ist, ihren Anspruch nach Grund und Höhe schriftlich anmelden, Sicherheit zu leisten, soweit sie nicht Befriedigung verlangen können. Dieses Recht steht den Gläubigern jedoch nur zu, wenn sie glaubhaft machen, dass durch die Verschmelzung die Erfüllung ihrer Forderung gefährdet wird."
    },
    {
      "date": "2025-10-10",
      "id": "133585",
      "original_text": "Registerbekanntmachung nach dem Umwandlungsgesetz\nHessen Amtsgericht Bad Homburg v.d.H. HRB 7790\nSKion Water MENA GmbH – Bad Homburg v. d. Höhe",
      "type": "Registerbekanntmachung nach dem Umwandlungsgesetz",
      "state": "Hessen",
      "amtsgericht": "Amtsgericht Bad Homburg v.d.H.",
      "registernummer": "HRB 7790",
      "registerart": "HRB",
      "company_name": "SKion Water MENA GmbH",
      "company_seat": "Bad Homburg v. d. Höhe",
      "details": "10.10.2025 (Bekanntmachungsdatum)\n\nHessen Amtsgericht Bad Homburg v.d.H. HRB 7790\nRegisterbekanntmachung nach dem Umwandlungsgesetz 10.10.2025 (Eintragungsdatum)\n\nSKion Water MENA GmbH\nGesellschaft mit beschränkter Haftung\nBad Homburg v. d. Höhe\n\nDen Gläubigern der an der Verschmelzung beteiligten Rechtsträger ist, wenn sie binnen sechs Monaten nach dem Tag, an dem die Eintragung der Verschmelzung in das Register des Sitzes desjenigen Rechtsträgers, dessen Gläubiger sie sind, nach § 19 Absatz 3 UmwG bekannt gemacht worden ist, ihren Anspruch nach Grund und Höhe schriftlich anmelden, Sicherheit zu leisten, soweit sie nicht Befriedigung verlangen können. Dieses Recht steht den Gläubigern jedoch nur zu, wenn sie glaubhaft machen, dass durch die Verschmelzung die Erfüllung ihrer Forderung gefährdet wird."
    },
    {
      "date": "2025-10-10",
      "id": "133586",
      "original_text": "Registerbekanntmachung nach dem Umwandlungsgesetz\nHessen Amtsgericht Wiesbaden HRB 32721\nLama Investments UG (haftungsbeschränkt) – Wiesbaden",
      "type": "Registerbekanntmachung nach dem Umwandlungsgesetz",
      "state": "Hessen",
      "amtsgericht": "Amtsgericht Wiesbaden",
      "registernummer": "HRB 32721",
      "registerart": "HRB",
      "company_name": "Lama Investments UG (haftungsbeschränkt)",
      "company_seat": "Wiesbaden",
      "details": "10.10.2025 (Bekanntmachungsdatum)\n\nHessen Amtsgericht Wiesbaden HRB 32721\nRegisterbekanntmachung nach dem Umwandlungsgesetz 10.10.2025 (Eintragungsdatum)\n\nLama Investments UG (haftungsbeschränkt)\nGesellschaft mit beschränkter Haftung\nWiesbaden\n\nDen Gläubigern der an der Verschmelzung beteiligten Rechtsträger ist, wenn sie binnen sechs Monaten nach dem Tag, an dem die Eintragung der Verschmelzung in das Register des Sitzes desjenigen Rechtsträgers, dessen Gläubiger sie sind, nach § 19 Absatz 3 UmwG bekannt gemacht worden ist, ihren Anspruch nach Grund und Höhe schriftlich anmelden, Sicherheit zu leisten, soweit sie nicht Befriedigung verlangen können. Dieses Recht steht den Gläubigern jedoch nur zu, wenn sie glaubhaft machen, dass durch die Verschmelzung die Erfüllung ihrer Forderung gefährdet wird."
    },
    {
      "date": "2025-10-10",
      "id": "133587",
      "original_text": "Löschungsankündigung\nHessen Amtsgericht Frankfurt am Main HRB 132333\nKolm Solutions GmbH – Frankfurt am Main",
      "type": "Löschungsankündigung",
      "state": "Hessen",
      "amtsgericht": "Amtsgericht Frankfurt am Main",
      "registernummer": "HRB 132333",
      "registerart": "HRB",
      "company_name": "Kolm Solutions GmbH",
      "company_seat": "Frankfurt am Main",
      "details": "10.10.2025 (Bekanntmachungsdatum)\n\nHessen Amtsgericht Frankfurt am Main HRB 132333\nLöschungsankündigung\n\nKolm Solutions GmbH\nGesellschaft mit beschränkter Haftung\nFrankfurt am Main\n\nEs ist beabsichtigt die Gesellschaft wegen Vermögenslosigkeit gemäß § 394 FamFG von Amts wegen zu löschen. Hiergegen kann innerhalb eines Monats nach dieser Veröffentlichung Widerspruch bei dem Amtsgericht Frankfurt am Main eingelegt werden."
    },
    {
      "date": "2025-10-10",
      "id": "133588",
      "original_text": "Sonstige Registerbekanntmachung\nHessen Amtsgericht Darmstadt VR 1398\nInteressenverband der GemeindepädagogInnen und Gemeindepädagogischen MitarbeiterInnen im Bereich der EKHN e.V. (IVGM) – Darmstadt",
      "type": "Sonstige Registerbekanntmachung",
      "state": "Hessen",
      "amtsgericht": "Amtsgericht Darmstadt",
      "registernummer": "VR 1398",
      "registerart": "VR",
      "company_name": "Interessenverband der GemeindepädagogInnen und Gemeindepädagogischen MitarbeiterInnen im Bereich der EKHN e.V. (IVGM)",
      "company_seat": "Darmstadt",
      "details": "10.10.2025 (Bekanntmachungsdatum)\n\nHessen Amtsgericht Darmstadt VR 1398\nSonstige Registerbekanntmachung 10.10.2025 (Eintragungsdatum)\n\nInteressenverband der GemeindepädagogInnen und Gemeindepädagogischen MitarbeiterInnen im Bereich der EKHN e.V. (IVGM)\neingetragener Verein\nDarmstadt\n\nDer Verein ist aufgelöst."
    },
    {
      "date": "2025-10-10",
      "id": "133589",
      "original_text": "Registerbekanntmachung nach dem Umwandlungsgesetz\nHessen Amtsgericht Offenbach am Main HRB 48826\nBBV Thüringen GmbH – Dreieich",
      "type": "Registerbekanntmachung nach dem Umwandlungsgesetz",
      "state": "Hessen",
      "amtsgericht": "Amtsgericht Offenbach am Main",
      "registernummer": "HRB 48826",
      "registerart": "HRB",
      "company_name": "BBV Thüringen GmbH",
      "company_seat": "Dreieich",
      "details": "10.10.2025 (Bekanntmachungsdatum)\n\nHessen Amtsgericht Offenbach am Main HRB 48826\nRegisterbekanntmachung nach dem Umwandlungsgesetz 10.10.2025 (Eintragungsdatum)\n\nBBV Thüringen GmbH\nGesellschaft mit beschränkter Haftung\nDreieich\n\nDen Gläubigern der an der Verschmelzung beteiligten Rechtsträger ist, wenn sie binnen sechs Monaten nach dem Tag, an dem die Eintragung der Verschmelzung in das Register des Sitzes desjenigen Rechtsträgers, dessen Gläubiger sie sind, nach § 19 Absatz 3 UmwG bekannt gemacht worden ist, ihren Anspruch nach Grund und Höhe schriftlich anmelden, Sicherheit zu leisten, soweit sie nicht Befriedigung verlangen können. Dieses Recht steht den Gläubigern jedoch nur zu, wenn sie glaubhaft machen, dass durch die Verschmelzung die Erfüllung ihrer Forderung gefährdet wird."
    },
    {
      "date": "2025-10-10",
      "id": "133590",
      "original_text": "Löschungsankündigung\nHessen Amtsgericht Darmstadt HRB 96801\nMH Bauausführung GmbH – Rüsselsheim",
      "type": "Löschungsankündigung",
      "state": "Hessen",
      "amtsgericht": "Amtsgericht Darmstadt",
      "registernummer": "HRB 96801",
      "registerart": "HRB",
      "company_name": "MH Bauausführung GmbH",
      "company_seat": "Rüsselsheim",
      "details": "10.10.2025 (Bekanntmachungsdatum)\n\nHessen Amtsgericht Darmstadt HRB 96801\nLöschungsankündigung\n\nMH Bauausführung GmbH\nGesellschaft mit beschränkter Haftung\nRüsselsheim\n\nDas Registergericht beabsichtigt die im Handelsregister eingetragene Gesellschaft von Amts wegen nach § 394 FamFG zu löschen. Die Frist zur Erhebung eines Widerspruchs gegen die beabsichtigte Löschung wird auf 3 Monate festgesetzt."
    },
    {
      "date": "2025-10-10",
      "id": "133591",
      "original_text": "Löschungsankündigung\nHessen Amtsgericht Bad Hersfeld HRB 1005\nPLUS PLAN Kunststoff- und Verfahrenstechnik, Gesellschaft mit beschränkter Haftung – Bebra",
      "type": "Löschungsankündigung",
      "state": "Hessen",
      "amtsgericht": "Amtsgericht Bad Hersfeld",
      "registernummer": "HRB 1005",
      "registerart": "HRB",
      "company_name": "PLUS PLAN Kunststoff- und Verfahrenstechnik, Gesellschaft mit beschränkter Haftung",
      "company_seat": "Bebra",
      "details": "10.10.2025 (Bekanntmachungsdatum)\n\nHessen Amtsgericht Bad Hersfeld HRB 1005\nLöschungsankündigung\n\nPLUS PLAN Kunststoff- und Verfahrenstechnik, Gesellschaft mit beschränkter Haftung\nGesellschaft mit beschränkter Haftung\nBebra\n\nDas Registergericht beabsichtigt die im Handelsregister eingetragene Gesellschaft von Amts wegen nach § 394 FamFG zu löschen. Die Frist zur Erhebung eines Widerspruchs gegen die beabsichtigte Löschung wird auf 6 Wochen festgesetzt."
    },
    {
      "date": "2025-10-10",
      "id": "133592",
      "original_text": "Löschungsankündigung\nHessen Amtsgericht Wetzlar VR 3623\nDorfGeschichte Greifenstein – Greifenstein",
      "type": "Löschungsankündigung",
      "state": "Hessen",
      "amtsgericht": "Amtsgericht Wetzlar",
      "registernummer": "VR 3623",
      "registerart": "VR",
      "company_name": "DorfGeschichte Greifenstein",
      "company_seat": "Greifenstein",
      "details": "10.10.2025 (Bekanntmachungsdatum)\n\nHessen Amtsgericht Wetzlar VR 3623\nLöschungsankündigung\n\nDorfGeschichte Greifenstein\neingetragener Verein\nGreifenstein\n\nDas Registergericht beabsichtigt den im Vereinsregister eingetragenen Verein von Amts wegen, wegen Wegfall aller Mitglieder zu löschen. Die Frist zur Erhebung eines Widerspruchs gegen die beabsichtigte Löschung wird auf 3 Monate festgesetzt."
    },
    {
      "date": "2025-10-10",
      "id": "133593",
      "original_text": "Löschungsankündigung\nHessen Amtsgericht Hanau HRB 93388\nConviva Gastro GmbH – Hanau",
      "type": "Löschungsankündigung",
      "state": "Hessen",
      "amtsgericht": "Amtsgericht Hanau",
      "registernummer": "HRB 93388",
      "registerart": "HRB",
      "company_name": "Conviva Gastro GmbH",
      "company_seat": "Hanau",
      "details": "10.10.2025 (Bekanntmachungsdatum)\n\nHessen Amtsgericht Hanau HRB 93388\nLöschungsankündigung\n\nConviva Gastro GmbH\nGesellschaft mit beschränkter Haftung\nHanau\n\nDas Registergericht beabsichtigt die im Handelsregister eingetragene Gesellschaft von Amts wegen nach § 394 FamFG zu löschen. Die Frist zur Erhebung eines Widerspruchs gegen die beabsichtigte Löschung wird auf 3 Monate festgesetzt."
    },
    {
      "date": "2025-10-10",
      "id": "133594",
      "original_text": "Einreichung neuer Dokumente\nBaden-Württemberg Amtsgericht Freiburg HRB 706986\nTineon Aktiengesellschaft – Meersburg",
      "type": "Einreichung neuer Dokumente",
      "state": "Baden-Württemberg",
      "amtsgericht": "Amtsgericht Freiburg",
      "registernummer": "HRB 706986",
      "registerart": "HRB",
      "company_name": "Tineon Aktiengesellschaft",
      "company_seat": "Meersburg",
      "details": "10.10.2025 (Bekanntmachungsdatum)\n\nBaden-Württemberg Amtsgericht Freiburg HRB 706986\nEinreichung neuer Dokumente\n\nTineon Aktiengesellschaft\nAktiengesellschaft\nMeersburg\n\nDie Gesellschaft hat am 09.10.2025 die Liste über die Zusammensetzung des Aufsichtsrats zum Handelsregister eingereicht."
    }
  ]
}