{
  "date": "2025-10-29",
  "date_of_scrape": "2025-10-30T04:12:09.110Z",
  "tool_version": "0.2.0",
  "number_of_announcements": 179,
  "announcements": [
    {
      "date": "2025-10-29",
      "id": "135592",
      "original_text": "Löschungsankündigung\nBayern Amtsgericht München HRB 244767\nBayram GmbH – München",
      "type": "Löschungsankündigung",
      "state": "Bayern",
      "amtsgericht": "Amtsgericht München",
      "registernummer": "HRB 244767",
      "registerart": "HRB",
      "company_name": "Bayram GmbH",
      "company_seat": "München",
      "details": "29.10.2025 (Bekanntmachungsdatum)\n\nBayern Amtsgericht München HRB 244767\nLöschungsankündigung 28.10.2025 (Eintragungsdatum)\n\nBayram GmbH\nGesellschaft mit beschränkter Haftung\nMünchen\n\nDas Registergericht beabsichtigt, die im Handelsregister eingetragene Gesellschaft wegen Vermögenslosigkeit von Amts wegen nach § 394 FamFG zu löschen. Die Frist zur Erhebung eines Widerspruchs ist auf drei Monate festgesetzt."
    },
    {
      "date": "2025-10-29",
      "id": "135593",
      "original_text": "Registerbekanntmachung nach dem Umwandlungsgesetz\nBayern Amtsgericht Fürth HRA 12638\nS&P Stadtbau Projekt 2 GmbH & Co. KG – Erlangen",
      "type": "Registerbekanntmachung nach dem Umwandlungsgesetz",
      "state": "Bayern",
      "amtsgericht": "Amtsgericht Fürth",
      "registernummer": "HRA 12638",
      "registerart": "HRA",
      "company_name": "S&P Stadtbau Projekt 2 GmbH & Co. KG",
      "company_seat": "Erlangen",
      "details": "29.10.2025 (Bekanntmachungsdatum)\n\nBayern Amtsgericht Fürth HRA 12638\nRegisterbekanntmachung nach dem Umwandlungsgesetz 28.10.2025 (Eintragungsdatum)\n\nS&P Stadtbau Projekt 2 GmbH & Co. KG\nKommanditgesellschaft\nErlangen\n\nDen Gläubigern des formwechselnden Rechtsträgers ist, wenn sie binnen sechs Monaten nach dem Tag, an dem die Eintragung des Formwechsels nach § 201 UmwG als bekannt gemacht gilt, ihren Anspruch nach Grund und Höhe in Textform anmelden, Sicherheit zu leisten, soweit sie nicht Befriedigung verlangen können. Dieses Recht steht den Gläubigern jedoch nur zu, wenn sie glaubhaft machen, dass durch den Formwechsel die Erfüllung ihrer Forderung gefährdet wird."
    },
    {
      "date": "2025-10-29",
      "id": "135594",
      "original_text": "Löschungsankündigung\nBayern Amtsgericht München HRB 280699\nLotus Gebäude & Event Services GmbH – Grünwald",
      "type": "Löschungsankündigung",
      "state": "Bayern",
      "amtsgericht": "Amtsgericht München",
      "registernummer": "HRB 280699",
      "registerart": "HRB",
      "company_name": "Lotus Gebäude & Event Services GmbH",
      "company_seat": "Grünwald",
      "details": "29.10.2025 (Bekanntmachungsdatum)\n\nBayern Amtsgericht München HRB 280699\nLöschungsankündigung\n\nLotus Gebäude & Event Services GmbH\nGesellschaft mit beschränkter Haftung\nGrünwald\n\nDas Registergericht beabsichtigt, die im Handelsregister eingetragene Gesellschaft wegen Vermögenslosigkeit von Amts wegen nach § 394 FamFG zu löschen. Die Frist zur Erhebung eines Widerspruchs ist auf drei Monate festgesetzt."
    },
    {
      "date": "2025-10-29",
      "id": "135595",
      "original_text": "Registerbekanntmachung nach dem Umwandlungsgesetz\nBayern Amtsgericht Fürth HRB 15355\nS&P Stadtbau Projekt 8 GmbH – Erlangen",
      "type": "Registerbekanntmachung nach dem Umwandlungsgesetz",
      "state": "Bayern",
      "amtsgericht": "Amtsgericht Fürth",
      "registernummer": "HRB 15355",
      "registerart": "HRB",
      "company_name": "S&P Stadtbau Projekt 8 GmbH",
      "company_seat": "Erlangen",
      "details": "29.10.2025 (Bekanntmachungsdatum)\n\nBayern Amtsgericht Fürth HRB 15355\nRegisterbekanntmachung nach dem Umwandlungsgesetz 28.10.2025 (Eintragungsdatum)\n\nS&P Stadtbau Projekt 8 GmbH\nGesellschaft mit beschränkter Haftung\nErlangen\n\nDen Gläubigern des formwechselnden Rechtsträgers ist, wenn sie binnen sechs Monaten nach dem Tag, an dem die Eintragung des Formwechsels nach § 201 UmwG als bekannt gemacht gilt, ihren Anspruch nach Grund und Höhe in Textform anmelden, Sicherheit zu leisten, soweit sie nicht Befriedigung verlangen können. Dieses Recht steht den Gläubigern jedoch nur zu, wenn sie glaubhaft machen, dass durch den Formwechsel die Erfüllung ihrer Forderung gefährdet wird."
    },
    {
      "date": "2025-10-29",
      "id": "135596",
      "original_text": "Löschungsankündigung\nBayern Amtsgericht München HRB 254263\nchangepilots GmbH – Inning a.Ammersee",
      "type": "Löschungsankündigung",
      "state": "Bayern",
      "amtsgericht": "Amtsgericht München",
      "registernummer": "HRB 254263",
      "registerart": "HRB",
      "company_name": "changepilots GmbH",
      "company_seat": "Inning a.Ammersee",
      "details": "29.10.2025 (Bekanntmachungsdatum)\n\nBayern Amtsgericht München HRB 254263\nLöschungsankündigung 27.10.2025 (Eintragungsdatum)\n\nchangepilots GmbH\nGesellschaft mit beschränkter Haftung\nInning a.Ammersee\n\nDas Registergericht beabsichtigt, die im Handelsregister eingetragene Gesellschaft wegen Vermögenslosigkeit von Amts wegen nach § 394 FamFG zu löschen. Die Frist zur Erhebung eines Widerspruchs ist auf drei Monate festgesetzt."
    },
    {
      "date": "2025-10-29",
      "id": "135597",
      "original_text": "Löschungsankündigung\nBayern Amtsgericht München HRB 54196\nSchwaiger & Schelle Bau GmbH – München",
      "type": "Löschungsankündigung",
      "state": "Bayern",
      "amtsgericht": "Amtsgericht München",
      "registernummer": "HRB 54196",
      "registerart": "HRB",
      "company_name": "Schwaiger & Schelle Bau GmbH",
      "company_seat": "München",
      "details": "29.10.2025 (Bekanntmachungsdatum)\n\nBayern Amtsgericht München HRB 54196\nLöschungsankündigung\n\nSchwaiger & Schelle Bau GmbH\nGesellschaft mit beschränkter Haftung\nMünchen\n\nDas Registergericht beabsichtigt, die im Handelsregister eingetragene Gesellschaft wegen Vermögenslosigkeit von Amts wegen nach § 394 FamFG zu löschen. Die Frist zur Erhebung eines Widerspruchs ist auf drei Monate festgesetzt."
    },
    {
      "date": "2025-10-29",
      "id": "135598",
      "original_text": "Registerbekanntmachung nach dem Umwandlungsgesetz\nBayern Amtsgericht Fürth HRB 14997\nS&P Stadtbau Projekt 2 GmbH – Erlangen",
      "type": "Registerbekanntmachung nach dem Umwandlungsgesetz",
      "state": "Bayern",
      "amtsgericht": "Amtsgericht Fürth",
      "registernummer": "HRB 14997",
      "registerart": "HRB",
      "company_name": "S&P Stadtbau Projekt 2 GmbH",
      "company_seat": "Erlangen",
      "details": "29.10.2025 (Bekanntmachungsdatum)\n\nBayern Amtsgericht Fürth HRB 14997\nRegisterbekanntmachung nach dem Umwandlungsgesetz 28.10.2025 (Eintragungsdatum)\n\nS&P Stadtbau Projekt 2 GmbH\nGesellschaft mit beschränkter Haftung\nErlangen\n\nDen Gläubigern des formwechselnden Rechtsträgers ist, wenn sie binnen sechs Monaten nach dem Tag, an dem die Eintragung des Formwechsels nach § 201 UmwG als bekannt gemacht gilt, ihren Anspruch nach Grund und Höhe in Textform anmelden, Sicherheit zu leisten, soweit sie nicht Befriedigung verlangen können. Dieses Recht steht den Gläubigern jedoch nur zu, wenn sie glaubhaft machen, dass durch den Formwechsel die Erfüllung ihrer Forderung gefährdet wird."
    },
    {
      "date": "2025-10-29",
      "id": "135599",
      "original_text": "Registerbekanntmachung nach dem Umwandlungsgesetz\nBayern Amtsgericht München HRB 306624\nGenerationSound Events GmbH – Erdweg",
      "type": "Registerbekanntmachung nach dem Umwandlungsgesetz",
      "state": "Bayern",
      "amtsgericht": "Amtsgericht München",
      "registernummer": "HRB 306624",
      "registerart": "HRB",
      "company_name": "GenerationSound Events GmbH",
      "company_seat": "Erdweg",
      "details": "29.10.2025 (Bekanntmachungsdatum)\n\nBayern Amtsgericht München HRB 306624\nRegisterbekanntmachung nach dem Umwandlungsgesetz 28.10.2025 (Eintragungsdatum)\n\nGenerationSound Events GmbH\nGesellschaft mit beschränkter Haftung\nErdweg\n\nDen Gläubigern der an der Ausgliederung beteiligten Rechtsträger ist, wenn sie binnen sechs Monaten nach dem Tag, an dem die Eintragung der Ausgliederung in das Register des Sitzes desjenigen Rechtsträgers, dessen Gläubiger sie sind, nach §§ 125, 19 Abs. 3 UmwG als bekannt gemacht gilt, ihren Anspruch nach Grund und Höhe in Textform anmelden, Sicherheit zu leisten, soweit sie nicht Befriedigung verlangen können. Dieses Recht steht den Gläubigern jedoch nur zu, wenn sie glaubhaft machen, dass durch die Ausgliederung die Erfüllung ihrer Forderung gefährdet wird."
    },
    {
      "date": "2025-10-29",
      "id": "135600",
      "original_text": "Registerbekanntmachung nach dem Umwandlungsgesetz\nBayern Amtsgericht München HRB 258497\nTradeManiacs GmbH – Höhenkirchen-Siegertsbrunn",
      "type": "Registerbekanntmachung nach dem Umwandlungsgesetz",
      "state": "Bayern",
      "amtsgericht": "Amtsgericht München",
      "registernummer": "HRB 258497",
      "registerart": "HRB",
      "company_name": "TradeManiacs GmbH",
      "company_seat": "Höhenkirchen-Siegertsbrunn",
      "details": "29.10.2025 (Bekanntmachungsdatum)\n\nBayern Amtsgericht München HRB 258497\nRegisterbekanntmachung nach dem Umwandlungsgesetz 28.10.2025 (Eintragungsdatum)\n\nTradeManiacs GmbH\nGesellschaft mit beschränkter Haftung\nHöhenkirchen-Siegertsbrunn\n\nDen Gläubigern des formwechselnden Rechtsträgers ist, wenn sie binnen sechs Monaten nach dem Tag, an dem die Eintragung des Formwechsels nach § 201 UmwG als bekannt gemacht gilt, ihren Anspruch nach Grund und Höhe in Textform anmelden, Sicherheit zu leisten, soweit sie nicht Befriedigung verlangen können. Dieses Recht steht den Gläubigern jedoch nur zu, wenn sie glaubhaft machen, dass durch den Formwechsel die Erfüllung ihrer Forderung gefährdet wird."
    },
    {
      "date": "2025-10-29",
      "id": "135601",
      "original_text": "Einreichung neuer Dokumente\nBayern Amtsgericht Augsburg HRB 14796\nSPN Schwaben Präzision Fritz Hopf GmbH – Nördlingen",
      "type": "Einreichung neuer Dokumente",
      "state": "Bayern",
      "amtsgericht": "Amtsgericht Augsburg",
      "registernummer": "HRB 14796",
      "registerart": "HRB",
      "company_name": "SPN Schwaben Präzision Fritz Hopf GmbH",
      "company_seat": "Nördlingen",
      "details": "29.10.2025 (Bekanntmachungsdatum)\n\nBayern Amtsgericht Augsburg HRB 14796\nEinreichung neuer Dokumente\n\nSPN Schwaben Präzision Fritz Hopf GmbH\nGesellschaft mit beschränkter Haftung\nNördlingen\n\nDem Amtsgericht Augsburg -Registergericht- ist eine Liste der Mitglieder des Aufsichtsrats eingereicht worden, § 52 Abs. 3 S. 2 GmbHG."
    },
    {
      "date": "2025-10-29",
      "id": "135602",
      "original_text": "Registerbekanntmachung nach dem Umwandlungsgesetz\nBayern Amtsgericht Memmingen HRB 20076\nSK Investment SE – Jettingen-Scheppach",
      "type": "Registerbekanntmachung nach dem Umwandlungsgesetz",
      "state": "Bayern",
      "amtsgericht": "Amtsgericht Memmingen",
      "registernummer": "HRB 20076",
      "registerart": "HRB",
      "company_name": "SK Investment SE",
      "company_seat": "Jettingen-Scheppach",
      "details": "29.10.2025 (Bekanntmachungsdatum)\n\nBayern Amtsgericht Memmingen HRB 20076\nRegisterbekanntmachung nach dem Umwandlungsgesetz\n\nSK Investment SE\nEuropäische Aktiengesellschaft (SE)\nJettingen-Scheppach\n\nDem Amtsgericht Memmingen -Registergericht- ist der Entwurf eines Verschmelzungsvertrages zwischen der Gesellschaft als übernehmendem Rechtsträger und der August Invest GmbH, Jettingen-Scheppach (Amtsgericht Memmingen HRB 21712) zur Einsichtnahme eingereicht worden."
    },
    {
      "date": "2025-10-29",
      "id": "135603",
      "original_text": "Löschungsankündigung\nBayern Amtsgericht Nürnberg HRB 38337\nCEFUND GmbH – Lauf a. d. Pegnitz",
      "type": "Löschungsankündigung",
      "state": "Bayern",
      "amtsgericht": "Amtsgericht Nürnberg",
      "registernummer": "HRB 38337",
      "registerart": "HRB",
      "company_name": "CEFUND GmbH",
      "company_seat": "Lauf a. d. Pegnitz",
      "details": "29.10.2025 (Bekanntmachungsdatum)\n\nBayern Amtsgericht Nürnberg HRB 38337\nLöschungsankündigung\n\nCEFUND GmbH\nGesellschaft mit beschränkter Haftung\nLauf a. d. Pegnitz\n\nDas Registergericht beabsichtigt, die im Handelsregister eingetragene Gesellschaft wegen Vermögenslosigkeit von Amts wegen nach § 394 FamFG zu löschen. Die Frist zur Erhebung eines Widerspruchs ist auf einen Monat festgesetzt."
    },
    {
      "date": "2025-10-29",
      "id": "135604",
      "original_text": "Registerbekanntmachung nach dem Umwandlungsgesetz\nBayern Amtsgericht Regensburg HRB 2906\nSchäfer Moden GmbH – Regensburg",
      "type": "Registerbekanntmachung nach dem Umwandlungsgesetz",
      "state": "Bayern",
      "amtsgericht": "Amtsgericht Regensburg",
      "registernummer": "HRB 2906",
      "registerart": "HRB",
      "company_name": "Schäfer Moden GmbH",
      "company_seat": "Regensburg",
      "details": "29.10.2025 (Bekanntmachungsdatum)\n\nBayern Amtsgericht Regensburg HRB 2906\nRegisterbekanntmachung nach dem Umwandlungsgesetz 28.10.2025 (Eintragungsdatum)\n\nSchäfer Moden GmbH\nGesellschaft mit beschränkter Haftung\nRegensburg\n\nDen Gläubigern der an der Verschmelzung beteiligten Rechtsträger ist, wenn sie binnen sechs Monaten nach dem Tag, an dem die Eintragung der Verschmelzung in das Register des Sitzes desjenigen Rechtsträgers, dessen Gläubiger sie sind, nach § 19 Abs. 3 UmwG als bekannt gemacht gilt, ihren Anspruch nach Grund und Höhe in Textform anmelden, Sicherheit zu leisten, soweit sie nicht Befriedigung verlangen können. Dieses Recht steht den Gläubigern jedoch nur zu, wenn sie glaubhaft machen, dass durch die Verschmelzung die Erfüllung ihrer Forderung gefährdet wird."
    },
    {
      "date": "2025-10-29",
      "id": "135605",
      "original_text": "Einreichung neuer Dokumente\nBayern Amtsgericht München HRB 235509\nAtos Information Technology GmbH – München",
      "type": "Einreichung neuer Dokumente",
      "state": "Bayern",
      "amtsgericht": "Amtsgericht München",
      "registernummer": "HRB 235509",
      "registerart": "HRB",
      "company_name": "Atos Information Technology GmbH",
      "company_seat": "München",
      "details": "29.10.2025 (Bekanntmachungsdatum)\n\nBayern Amtsgericht München HRB 235509\nEinreichung neuer Dokumente\n\nAtos Information Technology GmbH\nGesellschaft mit beschränkter Haftung\nMünchen\n\nDem Amtsgericht München -Registergericht- ist eine Liste der Mitglieder des Aufsichtsrats eingereicht worden, § 52 Abs. 3 S. 2 GmbHG."
    },
    {
      "date": "2025-10-29",
      "id": "135606",
      "original_text": "Löschungsankündigung\nBayern Amtsgericht München HRB 284935\nFinnegan Mancini UG (haftungsbeschränkt) – München",
      "type": "Löschungsankündigung",
      "state": "Bayern",
      "amtsgericht": "Amtsgericht München",
      "registernummer": "HRB 284935",
      "registerart": "HRB",
      "company_name": "Finnegan Mancini UG (haftungsbeschränkt)",
      "company_seat": "München",
      "details": "29.10.2025 (Bekanntmachungsdatum)\n\nBayern Amtsgericht München HRB 284935\nLöschungsankündigung 28.10.2025 (Eintragungsdatum)\n\nFinnegan Mancini UG (haftungsbeschränkt)\nGesellschaft mit beschränkter Haftung\nMünchen\n\nDas Registergericht beabsichtigt, die im Handelsregister eingetragene Gesellschaft wegen Vermögenslosigkeit von Amts wegen nach § 394 FamFG zu löschen. Die Frist zur Erhebung eines Widerspruchs ist auf drei Monate festgesetzt."
    },
    {
      "date": "2025-10-29",
      "id": "135607",
      "original_text": "Löschungsankündigung\nBayern Amtsgericht Fürth HRB 19424\nShoeFX GmbH – Erlangen",
      "type": "Löschungsankündigung",
      "state": "Bayern",
      "amtsgericht": "Amtsgericht Fürth",
      "registernummer": "HRB 19424",
      "registerart": "HRB",
      "company_name": "ShoeFX GmbH",
      "company_seat": "Erlangen",
      "details": "29.10.2025 (Bekanntmachungsdatum)\n\nBayern Amtsgericht Fürth HRB 19424\nLöschungsankündigung 28.10.2025 (Eintragungsdatum)\n\nShoeFX GmbH\nGesellschaft mit beschränkter Haftung\nErlangen\n\nDas Registergericht beabsichtigt, die im Handelsregister eingetragene Gesellschaft wegen Vermögenslosigkeit von Amts wegen nach § 394 FamFG zu löschen. Die Frist zur Erhebung eines Widerspruchs ist auf drei Monate festgesetzt."
    },
    {
      "date": "2025-10-29",
      "id": "135608",
      "original_text": "Registerbekanntmachung nach dem Umwandlungsgesetz\nBayern Amtsgericht München GsR 2805\nTradeManiacs-Nachfolge eGbR – Höhenkirchen-Siegertsbrunn",
      "type": "Registerbekanntmachung nach dem Umwandlungsgesetz",
      "state": "Bayern",
      "amtsgericht": "Amtsgericht München",
      "registernummer": "GsR 2805",
      "registerart": "GsR",
      "company_name": "TradeManiacs-Nachfolge eGbR",
      "company_seat": "Höhenkirchen-Siegertsbrunn",
      "details": "29.10.2025 (Bekanntmachungsdatum)\n\nBayern Amtsgericht München GsR 2805\nRegisterbekanntmachung nach dem Umwandlungsgesetz 28.10.2025 (Eintragungsdatum)\n\nTradeManiacs-Nachfolge eGbR\nGesellschaft bürgerlichen Rechts\nHöhenkirchen-Siegertsbrunn\n\nDen Gläubigern des formwechselnden Rechtsträgers ist, wenn sie binnen sechs Monaten nach dem Tag, an dem die Eintragung des Formwechsels nach § 201 UmwG als bekannt gemacht gilt, ihren Anspruch nach Grund und Höhe in Textform anmelden, Sicherheit zu leisten, soweit sie nicht Befriedigung verlangen können. Dieses Recht steht den Gläubigern jedoch nur zu, wenn sie glaubhaft machen, dass durch den Formwechsel die Erfüllung ihrer Forderung gefährdet wird."
    },
    {
      "date": "2025-10-29",
      "id": "135609",
      "original_text": "Löschungsankündigung\nBayern Amtsgericht Würzburg HRB 13217\nCC Sport Germany GmbH – Rimpar",
      "type": "Löschungsankündigung",
      "state": "Bayern",
      "amtsgericht": "Amtsgericht Würzburg",
      "registernummer": "HRB 13217",
      "registerart": "HRB",
      "company_name": "CC Sport Germany GmbH",
      "company_seat": "Rimpar",
      "details": "29.10.2025 (Bekanntmachungsdatum)\n\nBayern Amtsgericht Würzburg HRB 13217\nLöschungsankündigung\n\nCC Sport Germany GmbH\nGesellschaft mit beschränkter Haftung\nRimpar\n\nDas Registergericht beabsichtigt, die im Handelsregister eingetragene Gesellschaft wegen Vermögenslosigkeit von Amts wegen nach § 394 FamFG zu löschen. Die Frist zur Erhebung eines Widerspruchs ist auf drei Monate festgesetzt."
    },
    {
      "date": "2025-10-29",
      "id": "135610",
      "original_text": "Löschungsankündigung\nBayern Amtsgericht München HRB 253298\nBodywear Consulting Dizayn Anonim Sirketi – München",
      "type": "Löschungsankündigung",
      "state": "Bayern",
      "amtsgericht": "Amtsgericht München",
      "registernummer": "HRB 253298",
      "registerart": "HRB",
      "company_name": "Bodywear Consulting Dizayn Anonim Sirketi",
      "company_seat": "München",
      "details": "29.10.2025 (Bekanntmachungsdatum)\n\nBayern Amtsgericht München HRB 253298\nLöschungsankündigung\n\nBodywear Consulting Dizayn Anonim Sirketi\nRechtsform ausländischen Rechts HRB\nMünchen\n\nDas Registergericht beabsichtigt, den im Handelsregister eingetragenen Vorstand Steck, Yurdanur, geb. 18.06.1969 wegen fehlender Eignung nach § 395 FamFG zu löschen. Die Frist zur Erhebung eines Widerspruchs ist auf drei Monate festgesetzt."
    },
    {
      "date": "2025-10-29",
      "id": "135611",
      "original_text": "Registerbekanntmachung nach dem Umwandlungsgesetz\nBayern Amtsgericht Bamberg HRB 2841\nRegus Handel und Logistik GmbH – Bamberg",
      "type": "Registerbekanntmachung nach dem Umwandlungsgesetz",
      "state": "Bayern",
      "amtsgericht": "Amtsgericht Bamberg",
      "registernummer": "HRB 2841",
      "registerart": "HRB",
      "company_name": "Regus Handel und Logistik GmbH",
      "company_seat": "Bamberg",
      "details": "29.10.2025 (Bekanntmachungsdatum)\n\nBayern Amtsgericht Bamberg HRB 2841\nRegisterbekanntmachung nach dem Umwandlungsgesetz 28.10.2025 (Eintragungsdatum)\n\nRegus Handel und Logistik GmbH\nGesellschaft mit beschränkter Haftung\nBamberg\n\nDen Gläubigern der an der Verschmelzung beteiligten Rechtsträger ist, wenn sie binnen sechs Monaten nach dem Tag, an dem die Eintragung der Verschmelzung in das Register des Sitzes desjenigen Rechtsträgers, dessen Gläubiger sie sind, nach § 19 Abs. 3 UmwG als bekannt gemacht gilt, ihren Anspruch nach Grund und Höhe in Textform anmelden, Sicherheit zu leisten, soweit sie nicht Befriedigung verlangen können. Dieses Recht steht den Gläubigern jedoch nur zu, wenn sie glaubhaft machen, dass durch die Verschmelzung die Erfüllung ihrer Forderung gefährdet wird."
    },
    {
      "date": "2025-10-29",
      "id": "135612",
      "original_text": "Löschungsankündigung\nBayern Amtsgericht Hof HRB 4528\nTechnometa GmbH – Schwarzenbach a. d. Saale",
      "type": "Löschungsankündigung",
      "state": "Bayern",
      "amtsgericht": "Amtsgericht Hof",
      "registernummer": "HRB 4528",
      "registerart": "HRB",
      "company_name": "Technometa GmbH",
      "company_seat": "Schwarzenbach a. d. Saale",
      "details": "29.10.2025 (Bekanntmachungsdatum)\n\nBayern Amtsgericht Hof HRB 4528\nLöschungsankündigung\n\nTechnometa GmbH\nGesellschaft mit beschränkter Haftung\nSchwarzenbach a. d. Saale\n\nDas Registergericht beabsichtigt, die im Handelsregister eingetragene Gesellschaft wegen Vermögenslosigkeit von Amts wegen nach § 394 FamFG zu löschen. Die Frist zur Erhebung eines Widerspruchs ist auf sechs Wochen festgesetzt."
    },
    {
      "date": "2025-10-29",
      "id": "135613",
      "original_text": "Löschungsankündigung\nBayern Amtsgericht Regensburg HRB 19286\nWINNER AUTOTRANSFER GmbH – Neutraubling",
      "type": "Löschungsankündigung",
      "state": "Bayern",
      "amtsgericht": "Amtsgericht Regensburg",
      "registernummer": "HRB 19286",
      "registerart": "HRB",
      "company_name": "WINNER AUTOTRANSFER GmbH",
      "company_seat": "Neutraubling",
      "details": "29.10.2025 (Bekanntmachungsdatum)\n\nBayern Amtsgericht Regensburg HRB 19286\nLöschungsankündigung 28.10.2025 (Eintragungsdatum)\n\nWINNER AUTOTRANSFER GmbH\nGesellschaft mit beschränkter Haftung\nNeutraubling\n\nDas Registergericht beabsichtigt, die im Handelsregister eingetragene Gesellschaft von Amts wegen nach § 395 FamFG zu löschen. Die Frist zur Erhebung eines Widerspruchs ist auf 2 Monate festgesetzt."
    },
    {
      "date": "2025-10-29",
      "id": "135614",
      "original_text": "Registerbekanntmachung nach dem Umwandlungsgesetz\nBayern Amtsgericht München HRB 200781\nAlfa GmbH – München",
      "type": "Registerbekanntmachung nach dem Umwandlungsgesetz",
      "state": "Bayern",
      "amtsgericht": "Amtsgericht München",
      "registernummer": "HRB 200781",
      "registerart": "HRB",
      "company_name": "Alfa GmbH",
      "company_seat": "München",
      "details": "29.10.2025 (Bekanntmachungsdatum)\n\nBayern Amtsgericht München HRB 200781\nRegisterbekanntmachung nach dem Umwandlungsgesetz 28.10.2025 (Eintragungsdatum)\n\nAlfa GmbH\nGesellschaft mit beschränkter Haftung\nMünchen\n\nDen Gläubigern der an der Verschmelzung beteiligten Rechtsträger ist, wenn sie binnen sechs Monaten nach dem Tag, an dem die Eintragung der Verschmelzung in das Register des Sitzes desjenigen Rechtsträgers, dessen Gläubiger sie sind, nach § 19 Abs. 3 UmwG als bekannt gemacht gilt, ihren Anspruch nach Grund und Höhe in Textform anmelden, Sicherheit zu leisten, soweit sie nicht Befriedigung verlangen können. Dieses Recht steht den Gläubigern jedoch nur zu, wenn sie glaubhaft machen, dass durch die Verschmelzung die Erfüllung ihrer Forderung gefährdet wird."
    },
    {
      "date": "2025-10-29",
      "id": "135615",
      "original_text": "Registerbekanntmachung nach dem Umwandlungsgesetz\nBayern Amtsgericht Nürnberg HRB 26900\nurban apes Nürnberg GmbH – Nürnberg",
      "type": "Registerbekanntmachung nach dem Umwandlungsgesetz",
      "state": "Bayern",
      "amtsgericht": "Amtsgericht Nürnberg",
      "registernummer": "HRB 26900",
      "registerart": "HRB",
      "company_name": "urban apes Nürnberg GmbH",
      "company_seat": "Nürnberg",
      "details": "29.10.2025 (Bekanntmachungsdatum)\n\nBayern Amtsgericht Nürnberg HRB 26900\nRegisterbekanntmachung nach dem Umwandlungsgesetz 28.10.2025 (Eintragungsdatum)\n\nurban apes Nürnberg GmbH\nGesellschaft mit beschränkter Haftung\nNürnberg\n\nDen Gläubigern der an der Verschmelzung beteiligten Rechtsträger ist, wenn sie binnen sechs Monaten nach dem Tag, an dem die Eintragung der Verschmelzung in das Register des Sitzes desjenigen Rechtsträgers, dessen Gläubiger sie sind, nach § 19 Abs. 3 UmwG als bekannt gemacht gilt, ihren Anspruch nach Grund und Höhe in Textform anmelden, Sicherheit zu leisten, soweit sie nicht Befriedigung verlangen können. Dieses Recht steht den Gläubigern jedoch nur zu, wenn sie glaubhaft machen, dass durch die Verschmelzung die Erfüllung ihrer Forderung gefährdet wird."
    },
    {
      "date": "2025-10-29",
      "id": "135616",
      "original_text": "Löschungsankündigung\nBayern Amtsgericht München HRA 108542\nPRIMUS Concept 2. Grundbesitz Germering GmbH & Co. KG – Markt Indersdorf",
      "type": "Löschungsankündigung",
      "state": "Bayern",
      "amtsgericht": "Amtsgericht München",
      "registernummer": "HRA 108542",
      "registerart": "HRA",
      "company_name": "PRIMUS Concept 2. Grundbesitz Germering GmbH & Co. KG",
      "company_seat": "Markt Indersdorf",
      "details": "29.10.2025 (Bekanntmachungsdatum)\n\nBayern Amtsgericht München HRA 108542\nLöschungsankündigung 28.10.2025 (Eintragungsdatum)\n\nPRIMUS Concept 2. Grundbesitz Germering GmbH & Co. KG\nKommanditgesellschaft\nMarkt Indersdorf\n\nDas Registergericht beabsichtigt, die im Handelsregister eingetragene Gesellschaft wegen Vermögenslosigkeit von Amts wegen nach § 394 FamFG zu löschen. Die Frist zur Erhebung eines Widerspruchs ist auf drei Monate festgesetzt."
    },
    {
      "date": "2025-10-29",
      "id": "135617",
      "original_text": "Registerbekanntmachung nach dem Umwandlungsgesetz\nBayern Amtsgericht München HRB 216573\nGhotel Beteiligungs GmbH – Grünwald",
      "type": "Registerbekanntmachung nach dem Umwandlungsgesetz",
      "state": "Bayern",
      "amtsgericht": "Amtsgericht München",
      "registernummer": "HRB 216573",
      "registerart": "HRB",
      "company_name": "Ghotel Beteiligungs GmbH",
      "company_seat": "Grünwald",
      "details": "29.10.2025 (Bekanntmachungsdatum)\n\nBayern Amtsgericht München HRB 216573\nRegisterbekanntmachung nach dem Umwandlungsgesetz 28.10.2025 (Eintragungsdatum)\n\nGhotel Beteiligungs GmbH\nGesellschaft mit beschränkter Haftung\nGrünwald\n\nDen Gläubigern der an der Verschmelzung beteiligten Rechtsträger ist, wenn sie binnen sechs Monaten nach dem Tag, an dem die Eintragung der Verschmelzung in das Register des Sitzes desjenigen Rechtsträgers, dessen Gläubiger sie sind, nach § 19 Abs. 3 UmwG als bekannt gemacht gilt, ihren Anspruch nach Grund und Höhe in Textform anmelden, Sicherheit zu leisten, soweit sie nicht Befriedigung verlangen können. Dieses Recht steht den Gläubigern jedoch nur zu, wenn sie glaubhaft machen, dass durch die Verschmelzung die Erfüllung ihrer Forderung gefährdet wird."
    },
    {
      "date": "2025-10-29",
      "id": "135618",
      "original_text": "Einreichung neuer Dokumente\nBayern Amtsgericht München HRB 235409\nStarnberger Kliniken GmbH – Starnberg",
      "type": "Einreichung neuer Dokumente",
      "state": "Bayern",
      "amtsgericht": "Amtsgericht München",
      "registernummer": "HRB 235409",
      "registerart": "HRB",
      "company_name": "Starnberger Kliniken GmbH",
      "company_seat": "Starnberg",
      "details": "29.10.2025 (Bekanntmachungsdatum)\n\nBayern Amtsgericht München HRB 235409\nEinreichung neuer Dokumente\n\nStarnberger Kliniken GmbH\nGesellschaft mit beschränkter Haftung\nStarnberg\n\nDem Amtsgericht München -Registergericht- ist eine Liste der Mitglieder des Aufsichtsrats eingereicht worden, § 52 Abs. 3 S. 2 GmbHG."
    },
    {
      "date": "2025-10-29",
      "id": "135619",
      "original_text": "Einreichung neuer Dokumente\nBayern Amtsgericht Kempten (Allgäu) HRB 6408\nADC Automotive Distance Control Systems GmbH – Lindau (B)",
      "type": "Einreichung neuer Dokumente",
      "state": "Bayern",
      "amtsgericht": "Amtsgericht Kempten (Allgäu)",
      "registernummer": "HRB 6408",
      "registerart": "HRB",
      "company_name": "ADC Automotive Distance Control Systems GmbH",
      "company_seat": "Lindau (B)",
      "details": "29.10.2025 (Bekanntmachungsdatum)\n\nBayern Amtsgericht Kempten (Allgäu) HRB 6408\nEinreichung neuer Dokumente 28.10.2025 (Eintragungsdatum)\n\nADC Automotive Distance Control Systems GmbH\nGesellschaft mit beschränkter Haftung\nLindau (B)\n\nDem Amtsgericht Kempten (Allgäu) -Registergericht- ist eine Liste der Mitglieder des Aufsichtsrats eingereicht worden, § 52 Abs. 3 S. 2 GmbHG."
    },
    {
      "date": "2025-10-29",
      "id": "135620",
      "original_text": "Registerbekanntmachung nach dem Umwandlungsgesetz\nBayern Amtsgericht Augsburg HRB 9950\nBusch-Konditorei-Café-GmbH – Dießen a. Ammersee",
      "type": "Registerbekanntmachung nach dem Umwandlungsgesetz",
      "state": "Bayern",
      "amtsgericht": "Amtsgericht Augsburg",
      "registernummer": "HRB 9950",
      "registerart": "HRB",
      "company_name": "Busch-Konditorei-Café-GmbH",
      "company_seat": "Dießen a. Ammersee",
      "details": "29.10.2025 (Bekanntmachungsdatum)\n\nBayern Amtsgericht Augsburg HRB 9950\nRegisterbekanntmachung nach dem Umwandlungsgesetz 28.10.2025 (Eintragungsdatum)\n\nBusch-Konditorei-Café-GmbH\nGesellschaft mit beschränkter Haftung\nDießen a. Ammersee\n\nDen Gläubigern der an der Verschmelzung beteiligten Rechtsträger ist, wenn sie binnen sechs Monaten nach dem Tag, an dem die Eintragung der Verschmelzung in das Register des Sitzes desjenigen Rechtsträgers, dessen Gläubiger sie sind, nach § 19 Abs. 3 UmwG als bekannt gemacht gilt, ihren Anspruch nach Grund und Höhe in Textform anmelden, Sicherheit zu leisten, soweit sie nicht Befriedigung verlangen können. Dieses Recht steht den Gläubigern jedoch nur zu, wenn sie glaubhaft machen, dass durch die Verschmelzung die Erfüllung ihrer Forderung gefährdet wird."
    },
    {
      "date": "2025-10-29",
      "id": "135621",
      "original_text": "Registerbekanntmachung nach dem Umwandlungsgesetz\nBayern Amtsgericht Fürth HRA 12637\nS&P Stadtbau Projekt 8 GmbH & Co. KG – Erlangen",
      "type": "Registerbekanntmachung nach dem Umwandlungsgesetz",
      "state": "Bayern",
      "amtsgericht": "Amtsgericht Fürth",
      "registernummer": "HRA 12637",
      "registerart": "HRA",
      "company_name": "S&P Stadtbau Projekt 8 GmbH & Co. KG",
      "company_seat": "Erlangen",
      "details": "29.10.2025 (Bekanntmachungsdatum)\n\nBayern Amtsgericht Fürth HRA 12637\nRegisterbekanntmachung nach dem Umwandlungsgesetz 28.10.2025 (Eintragungsdatum)\n\nS&P Stadtbau Projekt 8 GmbH & Co. KG\nKommanditgesellschaft\nErlangen\n\nDen Gläubigern des formwechselnden Rechtsträgers ist, wenn sie binnen sechs Monaten nach dem Tag, an dem die Eintragung des Formwechsels nach § 201 UmwG als bekannt gemacht gilt, ihren Anspruch nach Grund und Höhe in Textform anmelden, Sicherheit zu leisten, soweit sie nicht Befriedigung verlangen können. Dieses Recht steht den Gläubigern jedoch nur zu, wenn sie glaubhaft machen, dass durch den Formwechsel die Erfüllung ihrer Forderung gefährdet wird."
    },
    {
      "date": "2025-10-29",
      "id": "135622",
      "original_text": "Löschungsankündigung\nBayern Amtsgericht Nürnberg HRB 25300\nEULOG Spedition GmbH – Nürnberg",
      "type": "Löschungsankündigung",
      "state": "Bayern",
      "amtsgericht": "Amtsgericht Nürnberg",
      "registernummer": "HRB 25300",
      "registerart": "HRB",
      "company_name": "EULOG Spedition GmbH",
      "company_seat": "Nürnberg",
      "details": "29.10.2025 (Bekanntmachungsdatum)\n\nBayern Amtsgericht Nürnberg HRB 25300\nLöschungsankündigung\n\nEULOG Spedition GmbH\nGesellschaft mit beschränkter Haftung\nNürnberg\n\nDas Registergericht beabsichtigt, die im Handelsregister eingetragene Gesellschaft wegen Vermögenslosigkeit von Amts wegen nach § 394 FamFG zu löschen. Die Frist zur Erhebung eines Widerspruchs ist auf einen Monat festgesetzt."
    },
    {
      "date": "2025-10-29",
      "id": "135623",
      "original_text": "Registerbekanntmachung nach dem Umwandlungsgesetz\nBaden-Württemberg Amtsgericht Stuttgart HRB 782263\nAUDERE GC GmbH – Fellbach",
      "type": "Registerbekanntmachung nach dem Umwandlungsgesetz",
      "state": "Baden-Württemberg",
      "amtsgericht": "Amtsgericht Stuttgart",
      "registernummer": "HRB 782263",
      "registerart": "HRB",
      "company_name": "AUDERE GC GmbH",
      "company_seat": "Fellbach",
      "details": "29.10.2025 (Bekanntmachungsdatum)\n\nBaden-Württemberg Amtsgericht Stuttgart HRB 782263\nRegisterbekanntmachung nach dem Umwandlungsgesetz 29.10.2025 (Eintragungsdatum)\n\nAUDERE GC GmbH\nGesellschaft mit beschränkter Haftung\nFellbach\n\nAls nicht eingetragen wird bekanntgemacht:\nDen Gläubigern der an der Verschmelzung beteiligten Rechtsträger ist, wenn sie binnen sechs Monaten nach dem Tag, an dem die Eintragung der Verschmelzung in das Register des Sitzes desjenigen Rechtsträgers, dessen Gläubiger sie sind, nach § 19 Abs. 3 UmwG als bekanntgemacht gilt, ihren Anspruch nach Grund und Höhe schriftlich anmelden, Sicherheit zu leisten, soweit sie nicht Befriedigung verlangen können. Dieses Recht steht den Gläubigern jedoch nur zu, wenn sie glaubhaft machen, dass durch die Verschmelzung die Erfüllung ihrer Forderung gefährdet wird."
    },
    {
      "date": "2025-10-29",
      "id": "135624",
      "original_text": "Sonstige Registerbekanntmachung\nMecklenburg-Vorpommern Amtsgericht Schwerin HRB 187\nDVZ Datenverarbeitungszentrum Mecklenburg-Vorpommern GmbH – Schwerin",
      "type": "Sonstige Registerbekanntmachung",
      "state": "Mecklenburg-Vorpommern",
      "amtsgericht": "Amtsgericht Schwerin",
      "registernummer": "HRB 187",
      "registerart": "HRB",
      "company_name": "DVZ Datenverarbeitungszentrum Mecklenburg-Vorpommern GmbH",
      "company_seat": "Schwerin",
      "details": "29.10.2025 (Bekanntmachungsdatum)\n\nMecklenburg-Vorpommern Amtsgericht Schwerin HRB 187\nSonstige Registerbekanntmachung 28.10.2025 (Eintragungsdatum)\n\nDVZ Datenverarbeitungszentrum Mecklenburg-Vorpommern GmbH\nGesellschaft mit beschränkter Haftung\nSchwerin\n\nEine Liste der Mitglieder des Aufsichtsrats ist zum Handelsregister eingereicht worden."
    },
    {
      "date": "2025-10-29",
      "id": "135625",
      "original_text": "Löschungsankündigung\nMecklenburg-Vorpommern Amtsgericht Rostock HRB 1659\nAutohaus Meyer & Partner GmbH – Elmenhorst",
      "type": "Löschungsankündigung",
      "state": "Mecklenburg-Vorpommern",
      "amtsgericht": "Amtsgericht Rostock",
      "registernummer": "HRB 1659",
      "registerart": "HRB",
      "company_name": "Autohaus Meyer & Partner GmbH",
      "company_seat": "Elmenhorst",
      "details": "29.10.2025 (Bekanntmachungsdatum)\n\nMecklenburg-Vorpommern Amtsgericht Rostock HRB 1659\nLöschungsankündigung\n\nAutohaus Meyer & Partner GmbH\nGesellschaft mit beschränkter Haftung\nElmenhorst\n\nDas Registergericht beabsichtigt, die im Handelsregister eingetragene Gesellschaft von Amts wegen nach § 394 FamFG zu löschen. Die Frist zur Erhebung eines Widerspruchs gegen die beabsichtigte Löschung wird auf einen Monat festgesetzt."
    },
    {
      "date": "2025-10-29",
      "id": "135626",
      "original_text": "Registerbekanntmachung nach dem Umwandlungsgesetz\nBaden-Württemberg Amtsgericht Stuttgart HRB 18989\nSWB Immowert GmbH – Stuttgart",
      "type": "Registerbekanntmachung nach dem Umwandlungsgesetz",
      "state": "Baden-Württemberg",
      "amtsgericht": "Amtsgericht Stuttgart",
      "registernummer": "HRB 18989",
      "registerart": "HRB",
      "company_name": "SWB Immowert GmbH",
      "company_seat": "Stuttgart",
      "details": "29.10.2025 (Bekanntmachungsdatum)\n\nBaden-Württemberg Amtsgericht Stuttgart HRB 18989\nRegisterbekanntmachung nach dem Umwandlungsgesetz 29.10.2025 (Eintragungsdatum)\n\nSWB Immowert GmbH\nGesellschaft mit beschränkter Haftung\nStuttgart\n\nAls nicht eingetragen wird bekanntgemacht:\nDen Gläubigern der an der Verschmelzung beteiligten Rechtsträger ist, wenn sie binnen sechs Monaten nach dem Tag, an dem die Eintragung der Verschmelzung in das Register des Sitzes desjenigen Rechtsträgers, dessen Gläubiger sie sind, nach § 19 Abs. 3 UmwG als bekanntgemacht gilt, ihren Anspruch nach Grund und Höhe schriftlich anmelden, Sicherheit zu leisten, soweit sie nicht Befriedigung verlangen können. Dieses Recht steht den Gläubigern jedoch nur zu, wenn sie glaubhaft machen, dass durch die Verschmelzung die Erfüllung ihrer Forderung gefährdet wird."
    },
    {
      "date": "2025-10-29",
      "id": "135627",
      "original_text": "Löschungsankündigung\nMecklenburg-Vorpommern Amtsgericht Rostock HRB 15531\nYoung Vision UG (haftungsbeschränkt) – Rostock",
      "type": "Löschungsankündigung",
      "state": "Mecklenburg-Vorpommern",
      "amtsgericht": "Amtsgericht Rostock",
      "registernummer": "HRB 15531",
      "registerart": "HRB",
      "company_name": "Young Vision UG (haftungsbeschränkt)",
      "company_seat": "Rostock",
      "details": "29.10.2025 (Bekanntmachungsdatum)\n\nMecklenburg-Vorpommern Amtsgericht Rostock HRB 15531\nLöschungsankündigung\n\nYoung Vision UG (haftungsbeschränkt)\nGesellschaft mit beschränkter Haftung\nRostock\n\nDas Registergericht beabsichtigt, die im Handelsregister eingetragene Gesellschaft von Amts wegen nach § 394 FamFG zu löschen. Die Frist zur Erhebung eines Widerspruchs gegen die beabsichtigte Löschung wird auf einen Monat festgesetzt."
    },
    {
      "date": "2025-10-29",
      "id": "135628",
      "original_text": "Sonstige Registerbekanntmachung\nBaden-Württemberg Amtsgericht Mannheim HRB 8606\nLeonardo Venture GmbH & Co. KGaA – Mannheim",
      "type": "Sonstige Registerbekanntmachung",
      "state": "Baden-Württemberg",
      "amtsgericht": "Amtsgericht Mannheim",
      "registernummer": "HRB 8606",
      "registerart": "HRB",
      "company_name": "Leonardo Venture GmbH & Co. KGaA",
      "company_seat": "Mannheim",
      "details": "29.10.2025 (Bekanntmachungsdatum)\n\nBaden-Württemberg Amtsgericht Mannheim HRB 8606\nSonstige Registerbekanntmachung 29.10.2025 (Eintragungsdatum)\n\nLeonardo Venture GmbH & Co. KGaA\nKommanditgesellschaft auf Aktien\nMannheim\n\nAls nicht eingetragen wird bekanntgemacht:\nDen Gläubigern, deren Forderungen begründet worden sind, bevor die Eintragung des Beschlusses bekanntgemacht worden ist, ist, wenn sie sich binnen sechs Monaten nach der Bekanntmachung zu diesem Zweck melden, Sicherheit zu leisten, soweit sie nicht Befriedigung verlangen können."
    },
    {
      "date": "2025-10-29",
      "id": "135629",
      "original_text": "Löschungsankündigung\nMecklenburg-Vorpommern Amtsgericht Rostock HRB 8648\nTEAM 2000 Hoch- und Tiefbau GmbH – Kühlungsborn",
      "type": "Löschungsankündigung",
      "state": "Mecklenburg-Vorpommern",
      "amtsgericht": "Amtsgericht Rostock",
      "registernummer": "HRB 8648",
      "registerart": "HRB",
      "company_name": "TEAM 2000 Hoch- und Tiefbau GmbH",
      "company_seat": "Kühlungsborn",
      "details": "29.10.2025 (Bekanntmachungsdatum)\n\nMecklenburg-Vorpommern Amtsgericht Rostock HRB 8648\nLöschungsankündigung\n\nTEAM 2000 Hoch- und Tiefbau GmbH\nGesellschaft mit beschränkter Haftung\nKühlungsborn\n\nDas Registergericht beabsichtigt, die im Handelsregister eingetragene Gesellschaft von Amts wegen nach § 394 FamFG zu löschen. Die Frist zur Erhebung eines Widerspruchs gegen die beabsichtigte Löschung wird auf einen Monat festgesetzt."
    },
    {
      "date": "2025-10-29",
      "id": "135630",
      "original_text": "Löschungsankündigung\nSaarland Amtsgericht Saarbrücken HRB 100926\nTele-Service 7 GmbH – Saarbrücken",
      "type": "Löschungsankündigung",
      "state": "Saarland",
      "amtsgericht": "Amtsgericht Saarbrücken",
      "registernummer": "HRB 100926",
      "registerart": "HRB",
      "company_name": "Tele-Service 7 GmbH",
      "company_seat": "Saarbrücken",
      "details": "29.10.2025 (Bekanntmachungsdatum)\n\nSaarland Amtsgericht Saarbrücken HRB 100926\nLöschungsankündigung\n\nTele-Service 7 GmbH\nGesellschaft mit beschränkter Haftung\nSaarbrücken\n\nEs ist beabsichtigt, die Gesellschaft von Amts wegen gemäß § 394 FamFG wegen Vermögenslosigkeit zu löschen.\nGegen die Löschung von Amts wegen ist das Rechtsmittel des Widerspruchs statthaft. Der Widerspruch ist binnen einer Frist von drei Monaten beginnend mit dem Tag dieser Veröffentlichung durch Einreichen eines Widerspruchsschreibens -schriftlich oder zur Niederschrift der Geschäftsstelle beim Amtsgericht Saarbrücken, -zentrales Handelsregister-, Mainzerstr.178, 66121 Saarbrücken einzulegen.\nDer Widerspruch muss die Bezeichnung der angefochtenen Löschungsankündigung enthalten sowie die Erklärung, dass Widerspruch eingelegt wird. Er ist vom Widerspruchsführer oder seinem Bevollmächtigten zu unterzeichnen.\nDas Widerspruchsschreiben kann auch in der Form eines elektronischen Dokumentes eingereicht werden, das mit einer qualifizierten elektronischen Signatur nach dem Signaturgesetz versehen sein muss (§§ 14 Abs. 2 FamFG, 130a, 298 ZPO)."
    },
    {
      "date": "2025-10-29",
      "id": "135631",
      "original_text": "Registerbekanntmachung nach dem Umwandlungsgesetz\nBrandenburg Amtsgericht Neuruppin HRB 1121\nStadtwerke Hennigsdorf GmbH – Hennigsdorf",
      "type": "Registerbekanntmachung nach dem Umwandlungsgesetz",
      "state": "Brandenburg",
      "amtsgericht": "Amtsgericht Neuruppin",
      "registernummer": "HRB 1121",
      "registerart": "HRB",
      "company_name": "Stadtwerke Hennigsdorf GmbH",
      "company_seat": "Hennigsdorf",
      "details": "29.10.2025 (Bekanntmachungsdatum)\n\nBrandenburg Amtsgericht Neuruppin HRB 1121\nRegisterbekanntmachung nach dem Umwandlungsgesetz 28.10.2025 (Eintragungsdatum)\n\nStadtwerke Hennigsdorf GmbH\nGesellschaft mit beschränkter Haftung\nHennigsdorf\n\nZu Eintragungsnummer 11 vom 28.10.2025 wird als nicht eingetragen veröffentlicht:\nDen Gläubigern der an der Umwandlung beteiligten Rechtsträger ist, wenn sie binnen sechs Monaten nach dem Tag, an dem die Eintragung der Umwandlung in das Register des Sitzes desjenigen Rechtsträgers, dessen Gläubiger sie sind, als bekannt gemacht gilt, ihren Anspruch nach Grund und Höhe schriftlich anmelden, Sicherheit zu leisten, soweit sie nicht Befriedigung verlangen können. Dieses Recht steht den Gläubigern jedoch nur zu, wenn sie glaubhaft machen, dass durch die Umwandlung die Erfüllung ihrer Forderung gefährdet wird"
    },
    {
      "date": "2025-10-29",
      "id": "135632",
      "original_text": "Registerbekanntmachung nach dem Umwandlungsgesetz\nSchleswig-Holstein Amtsgericht Lübeck VR 268 SB\nVolkshochschule Schwarzenbek-Lauenburg e.V. – Schwarzenbek",
      "type": "Registerbekanntmachung nach dem Umwandlungsgesetz",
      "state": "Schleswig-Holstein",
      "amtsgericht": "Amtsgericht Lübeck",
      "registernummer": "VR 268 SB",
      "registerart": "VR",
      "company_name": "Volkshochschule Schwarzenbek-Lauenburg e.V.",
      "company_seat": "Schwarzenbek",
      "details": "29.10.2025 (Bekanntmachungsdatum)\n\nSchleswig-Holstein Amtsgericht Lübeck VR 268 SB\nRegisterbekanntmachung nach dem Umwandlungsgesetz 27.10.2025 (Eintragungsdatum)\n\nVolkshochschule Schwarzenbek-Lauenburg e.V.\neingetragener Verein\nSchwarzenbek\n\nZu Eintragungsnummer 4 vom 28.10.2025 wird als nicht eingetragen veröffentlicht:\nDen Gläubigern der an der Verschmelzung beteiligten Rechtsträger ist, wenn sie binnen sechs Monaten nach dem Tag, an dem die Eintragung der Verschmelzung in das Register des Sitzes desjenigen Rechtsträgers, dessen Gläubiger sie sind, als bekannt gemacht gilt, ihren Anspruch nach Grund und Höhe schriftlich anmelden, Sicherheit zu leisten, soweit sie nicht Befriedigung verlangen können. Dieses Recht steht den Gläubigern jedoch nur zu, wenn sie glaubhaft machen, dass durch die Verschmelzung die Erfüllung ihrer Forderung gefährdet wird."
    },
    {
      "date": "2025-10-29",
      "id": "135633",
      "original_text": "Registerbekanntmachung nach dem Umwandlungsgesetz\nBaden-Württemberg Amtsgericht Stuttgart HRB 791297\nFNTSY Ventures UG (haftungsbeschränkt) – Dobel",
      "type": "Registerbekanntmachung nach dem Umwandlungsgesetz",
      "state": "Baden-Württemberg",
      "amtsgericht": "Amtsgericht Stuttgart",
      "registernummer": "HRB 791297",
      "registerart": "HRB",
      "company_name": "FNTSY Ventures UG (haftungsbeschränkt)",
      "company_seat": "Dobel",
      "details": "29.10.2025 (Bekanntmachungsdatum)\n\nBaden-Württemberg Amtsgericht Stuttgart HRB 791297\nRegisterbekanntmachung nach dem Umwandlungsgesetz 29.10.2025 (Eintragungsdatum)\n\nFNTSY Ventures UG (haftungsbeschränkt)\nGesellschaft mit beschränkter Haftung\nDobel\n\nAls nicht eingetragen wird bekanntgemacht:\nDen Gläubigern der an der Aufspaltung beteiligten Rechtsträger ist, wenn sie binnen sechs Monaten nach dem Tag, an dem die Eintragung der Aufspaltung in das Register des Sitzes desjenigen Rechtsträgers, dessen Gläubiger sie sind, nach § 19 Abs. 3 UmwG als bekanntgemacht gilt, ihren Anspruch nach Grund und Höhe schriftlich anmelden, Sicherheit zu leisten, soweit sie nicht Befriedigung verlangen können. Dieses Recht steht den Gläubigern jedoch nur zu, wenn sie glaubhaft machen, dass durch die Aufspaltung die Erfüllung ihrer Forderung gefährdet wird."
    },
    {
      "date": "2025-10-29",
      "id": "135634",
      "original_text": "Registerbekanntmachung nach dem Umwandlungsgesetz\nBaden-Württemberg Amtsgericht Freiburg HRB 411547\nKahl Immobilien GmbH – Grenzach-WyhIen",
      "type": "Registerbekanntmachung nach dem Umwandlungsgesetz",
      "state": "Baden-Württemberg",
      "amtsgericht": "Amtsgericht Freiburg",
      "registernummer": "HRB 411547",
      "registerart": "HRB",
      "company_name": "Kahl Immobilien GmbH",
      "company_seat": "Grenzach-WyhIen",
      "details": "29.10.2025 (Bekanntmachungsdatum)\n\nBaden-Württemberg Amtsgericht Freiburg HRB 411547\nRegisterbekanntmachung nach dem Umwandlungsgesetz 29.10.2025 (Eintragungsdatum)\n\nKahl Immobilien GmbH\nGesellschaft mit beschränkter Haftung\nGrenzach-WyhIen\n\nAls nicht eingetragen wird bekanntgemacht:\nDen Gläubigern der an der Ausgliederung beteiligten Rechtsträger ist, wenn sie binnen sechs Monaten nach dem Tag, an dem die Eintragung der Ausgliederung in das Register des Sitzes desjenigen Rechtsträgers, dessen Gläubiger sie sind, nach § 19 Abs. 3 UmwG als bekanntgemacht gilt, ihren Anspruch nach Grund und Höhe schriftlich anmelden, Sicherheit zu leisten, soweit sie nicht Befriedigung verlangen können. Dieses Recht steht den Gläubigern jedoch nur zu, wenn sie glaubhaft machen, dass durch die Ausgliederung die Erfüllung ihrer Forderung gefährdet wird."
    },
    {
      "date": "2025-10-29",
      "id": "135635",
      "original_text": "Registerbekanntmachung nach dem Umwandlungsgesetz\nBaden-Württemberg Amtsgericht Freiburg HRA 708836\nKahl Hausverwaltung und Immobilienvermittlung e.K. – Lörrach",
      "type": "Registerbekanntmachung nach dem Umwandlungsgesetz",
      "state": "Baden-Württemberg",
      "amtsgericht": "Amtsgericht Freiburg",
      "registernummer": "HRA 708836",
      "registerart": "HRA",
      "company_name": "Kahl Hausverwaltung und Immobilienvermittlung e.K.",
      "company_seat": "Lörrach",
      "details": "29.10.2025 (Bekanntmachungsdatum)\n\nBaden-Württemberg Amtsgericht Freiburg HRA 708836\nRegisterbekanntmachung nach dem Umwandlungsgesetz 29.10.2025 (Eintragungsdatum)\n\nKahl Hausverwaltung und Immobilienvermittlung e.K.\nEinzelkaufmann / Einzelkauffrau\nLörrach\n\nAls nicht eingetragen wird bekanntgemacht:\nDen Gläubigern der an der Ausgliederung beteiligten Rechtsträger ist, wenn sie binnen sechs Monaten nach dem Tag, an dem die Eintragung der Ausgliederung in das Register des Sitzes desjenigen Rechtsträgers, dessen Gläubiger sie sind, nach § 19 Abs. 3 UmwG als bekanntgemacht gilt, ihren Anspruch nach Grund und Höhe schriftlich anmelden, Sicherheit zu leisten, soweit sie nicht Befriedigung verlangen können. Dieses Recht steht den Gläubigern jedoch nur zu, wenn sie glaubhaft machen, dass durch die Ausgliederung die Erfüllung ihrer Forderung gefährdet wird."
    },
    {
      "date": "2025-10-29",
      "id": "135636",
      "original_text": "Registerbekanntmachung nach dem Umwandlungsgesetz\nBaden-Württemberg Amtsgericht Stuttgart HRB 782613\nProspera GmbH – Filderstadt",
      "type": "Registerbekanntmachung nach dem Umwandlungsgesetz",
      "state": "Baden-Württemberg",
      "amtsgericht": "Amtsgericht Stuttgart",
      "registernummer": "HRB 782613",
      "registerart": "HRB",
      "company_name": "Prospera GmbH",
      "company_seat": "Filderstadt",
      "details": "29.10.2025 (Bekanntmachungsdatum)\n\nBaden-Württemberg Amtsgericht Stuttgart HRB 782613\nRegisterbekanntmachung nach dem Umwandlungsgesetz 29.10.2025 (Eintragungsdatum)\n\nProspera GmbH\nGesellschaft mit beschränkter Haftung\nFilderstadt\n\nDen Gläubigern der an der Verschmelzung beteiligten Rechtsträger ist, wenn sie binnen sechs Monaten nach dem Tag, an dem die Eintragung der Verschmelzung in das Register des Sitzes desjenigen Rechtsträgers, dessen Gläubiger sie sind, nach § 19 Abs. 3 UmwG als bekanntgemacht gilt, ihren Anspruch nach Grund und Höhe schriftlich anmelden, Sicherheit zu leisten, soweit sie nicht Befriedigung verlangen können. Dieses Recht steht den Gläubigern jedoch nur zu, wenn sie glaubhaft machen, dass durch die Verschmelzung die Erfüllung ihrer Forderung gefährdet wird."
    },
    {
      "date": "2025-10-29",
      "id": "135637",
      "original_text": "Registerbekanntmachung nach dem Umwandlungsgesetz\nBaden-Württemberg Amtsgericht Stuttgart HRA 728776\nMein Quartier Nürtingen GmbH & Co. KG – Nürtingen",
      "type": "Registerbekanntmachung nach dem Umwandlungsgesetz",
      "state": "Baden-Württemberg",
      "amtsgericht": "Amtsgericht Stuttgart",
      "registernummer": "HRA 728776",
      "registerart": "HRA",
      "company_name": "Mein Quartier Nürtingen GmbH & Co. KG",
      "company_seat": "Nürtingen",
      "details": "29.10.2025 (Bekanntmachungsdatum)\n\nBaden-Württemberg Amtsgericht Stuttgart HRA 728776\nRegisterbekanntmachung nach dem Umwandlungsgesetz 29.10.2025 (Eintragungsdatum)\n\nMein Quartier Nürtingen GmbH & Co. KG\nKommanditgesellschaft\nNürtingen\n\nAls nicht eingetragen wird bekanntgemacht:\nDen Gläubigern der an der Verschmelzung beteiligten Rechtsträger ist, wenn sie binnen sechs Monaten nach dem Tag, an dem die Eintragung der Verschmelzung in das Register des Sitzes desjenigen Rechtsträgers, dessen Gläubiger sie sind, nach § 19 Abs. 3 UmwG als bekanntgemacht gilt, ihren Anspruch nach Grund und Höhe schriftlich anmelden, Sicherheit zu leisten, soweit sie nicht Befriedigung verlangen können. Dieses Recht steht den Gläubigern jedoch nur zu, wenn sie glaubhaft machen, dass durch die Verschmelzung die Erfüllung ihrer Forderung gefährdet wird."
    },
    {
      "date": "2025-10-29",
      "id": "135638",
      "original_text": "Einreichung neuer Dokumente\nBaden-Württemberg Amtsgericht Stuttgart HRB 778600\nDaimler Truck Holding AG – Stuttgart",
      "type": "Einreichung neuer Dokumente",
      "state": "Baden-Württemberg",
      "amtsgericht": "Amtsgericht Stuttgart",
      "registernummer": "HRB 778600",
      "registerart": "HRB",
      "company_name": "Daimler Truck Holding AG",
      "company_seat": "Stuttgart",
      "details": "29.10.2025 (Bekanntmachungsdatum)\n\nBaden-Württemberg Amtsgericht Stuttgart HRB 778600\nEinreichung neuer Dokumente\n\nDaimler Truck Holding AG\nAktiengesellschaft\nStuttgart\n\nDie Gesellschaft hat am 11.09.2025 die Liste über die Zusammensetzung des Aufsichtsrats zum Handelsregister eingereicht."
    },
    {
      "date": "2025-10-29",
      "id": "135639",
      "original_text": "Registerbekanntmachung nach dem Umwandlungsgesetz\nBerlin Amtsgericht Berlin (Charlottenburg) HRA 64855\nEU BM Trading EOOD & Co. KG – Berlin",
      "type": "Registerbekanntmachung nach dem Umwandlungsgesetz",
      "state": "Berlin",
      "amtsgericht": "Amtsgericht Berlin (Charlottenburg)",
      "registernummer": "HRA 64855",
      "registerart": "HRA",
      "company_name": "EU BM Trading EOOD & Co. KG",
      "company_seat": "Berlin",
      "details": "29.10.2025 (Bekanntmachungsdatum)\n\nBerlin Amtsgericht Berlin (Charlottenburg) HRA 64855\nRegisterbekanntmachung nach dem Umwandlungsgesetz 28.10.2025 (Eintragungsdatum)\n\nEU BM Trading EOOD & Co. KG\nKommanditgesellschaft\nBerlin\n\nZu Eintragungsnummer 1 vom 28.10.2025 wird als nicht eingetragen veröffentlicht: Den Gläubigern ist, wenn sie binnen sechs Monaten nach dem Tag, an dem die Eintragung der Umwandlung als bekannt gemacht gilt, ihren Anspruch nach Grund und Höhe schriftlich anmelden, Sicherheit zu leisten, soweit sie nicht Befriedigung verlangen können. Dieses Recht steht den Gläubigern jedoch nur zu, wenn sie glaubhaft machen, dass durch die Umwandlung die Erfüllung ihrer Forderung gefährdet wird. Das Recht, Sicherheitsleistung zu verlangen, steht Gläubigern nicht zu, die im Falle der Insolvenz ein Recht auf vorzugsweise Befriedigung aus einer Deckungsmasse haben, die nach gesetzlicher Vorschrift zu ihrem Schutz errichtet und staatlich überwacht ist."
    },
    {
      "date": "2025-10-29",
      "id": "135640",
      "original_text": "Einreichung neuer Dokumente\nBaden-Württemberg Amtsgericht Freiburg HRB 709453\nCelenus SE – Offenburg",
      "type": "Einreichung neuer Dokumente",
      "state": "Baden-Württemberg",
      "amtsgericht": "Amtsgericht Freiburg",
      "registernummer": "HRB 709453",
      "registerart": "HRB",
      "company_name": "Celenus SE",
      "company_seat": "Offenburg",
      "details": "29.10.2025 (Bekanntmachungsdatum)\n\nBaden-Württemberg Amtsgericht Freiburg HRB 709453\nEinreichung neuer Dokumente\n\nCelenus SE\nEuropäische Aktiengesellschaft (SE)\nOffenburg\n\nDie Gesellschaft hat am 27.10.2025 die Liste über die Zusammensetzung des Aufsichtsrats zum Handelsregister eingereicht."
    },
    {
      "date": "2025-10-29",
      "id": "135641",
      "original_text": "Registerbekanntmachung nach dem Umwandlungsgesetz\nHamburg Amtsgericht Hamburg HRB 22243\nMARAGU Immobilien GmbH – Hamburg",
      "type": "Registerbekanntmachung nach dem Umwandlungsgesetz",
      "state": "Hamburg",
      "amtsgericht": "Amtsgericht Hamburg",
      "registernummer": "HRB 22243",
      "registerart": "HRB",
      "company_name": "MARAGU Immobilien GmbH",
      "company_seat": "Hamburg",
      "details": "29.10.2025 (Bekanntmachungsdatum)\n\nHamburg Amtsgericht Hamburg HRB 22243\nRegisterbekanntmachung nach dem Umwandlungsgesetz 29.10.2025 (Eintragungsdatum)\n\nMARAGU Immobilien GmbH\nGesellschaft mit beschränkter Haftung\nHamburg\n\nAls nicht eingetragen wird bekannt gemacht:\nDen Gläubigern der an der Ausgliederung beteiligten Gesellschaften ist, wenn sie binnen sechs Monaten nach dem Tag, an dem die Eintragung der Ausgliederung in das Register des Sitzes desjenigen Rechtsträgers, dessen Gläubiger sie sind, nach § 19 Absatz 3 UmwG als bekannt gemacht gilt, ihren Anspruch nach Grund und Höhe schriftlich anmelden, Sicherheit zu leisten, soweit sie nicht Befriedigung verlangen können. Dieses Recht steht den Gläubigern jedoch nur zu, wenn sie glaubhaft machen, dass durch die Ausgliederung die Erfüllung ihrer Forderung gefährdet wird."
    },
    {
      "date": "2025-10-29",
      "id": "135642",
      "original_text": "Einreichung neuer Dokumente\nBerlin Amtsgericht Berlin (Charlottenburg) HRB 147973\nFunanga AG – Berlin",
      "type": "Einreichung neuer Dokumente",
      "state": "Berlin",
      "amtsgericht": "Amtsgericht Berlin (Charlottenburg)",
      "registernummer": "HRB 147973",
      "registerart": "HRB",
      "company_name": "Funanga AG",
      "company_seat": "Berlin",
      "details": "29.10.2025 (Bekanntmachungsdatum)\n\nBerlin Amtsgericht Berlin (Charlottenburg) HRB 147973\nEinreichung neuer Dokumente\n\nFunanga AG\nAktiengesellschaft\nBerlin\n\nAls nicht eingetragen wird veröffentlicht: Es wurde eine neue Liste der Aufsichtsratsmitglieder eingereicht (§ 106 AktG)."
    },
    {
      "date": "2025-10-29",
      "id": "135643",
      "original_text": "Löschungsankündigung\nBerlin Amtsgericht Berlin (Charlottenburg) HRB 216037\nMCS Gebäudeservice GmbH – Berlin",
      "type": "Löschungsankündigung",
      "state": "Berlin",
      "amtsgericht": "Amtsgericht Berlin (Charlottenburg)",
      "registernummer": "HRB 216037",
      "registerart": "HRB",
      "company_name": "MCS Gebäudeservice GmbH",
      "company_seat": "Berlin",
      "details": "29.10.2025 (Bekanntmachungsdatum)\n\nBerlin Amtsgericht Berlin (Charlottenburg) HRB 216037\nLöschungsankündigung\n\nMCS Gebäudeservice GmbH\nGesellschaft mit beschränkter Haftung\nBerlin\n\nBei der nachstehenden Gesellschaft wird das Amtslöschungsverfahren gemäß § 394 FamFG eingeleitet. Widerspruchsfrist 6 Wochen"
    },
    {
      "date": "2025-10-29",
      "id": "135644",
      "original_text": "Registerbekanntmachung nach dem Umwandlungsgesetz\nHamburg Amtsgericht Hamburg HRB 113367\nShabanaj GmbH – Hamburg",
      "type": "Registerbekanntmachung nach dem Umwandlungsgesetz",
      "state": "Hamburg",
      "amtsgericht": "Amtsgericht Hamburg",
      "registernummer": "HRB 113367",
      "registerart": "HRB",
      "company_name": "Shabanaj GmbH",
      "company_seat": "Hamburg",
      "details": "29.10.2025 (Bekanntmachungsdatum)\n\nHamburg Amtsgericht Hamburg HRB 113367\nRegisterbekanntmachung nach dem Umwandlungsgesetz 29.10.2025 (Eintragungsdatum)\n\nShabanaj GmbH\nGesellschaft mit beschränkter Haftung\nHamburg\n\nAls nicht eingetragen wird bekannt gemacht:\nDen Gläubigern der an der Verschmelzung beteiligten Gesellschaften ist, wenn sie binnen sechs Monaten nach dem Tag, an dem die Eintragung der Verschmelzung in das Register des Sitzes desjenigen Rechtsträgers, dessen Gläubiger sie sind, nach § 19 Absatz 3 UmwG als bekannt gemacht gilt, ihren Anspruch nach Grund und Höhe schriftlich anmelden, Sicherheit zu leisten, soweit sie nicht Befriedigung verlangen können. Dieses Recht steht den Gläubigern jedoch nur zu, wenn sie glaubhaft machen, dass durch die Verschmelzung die Erfüllung ihrer Forderung gefährdet wird."
    },
    {
      "date": "2025-10-29",
      "id": "135645",
      "original_text": "Registerbekanntmachung nach dem Umwandlungsgesetz\nBaden-Württemberg Amtsgericht Stuttgart HRB 225678\nCONVOTIS Deutschland GmbH – Nürtingen",
      "type": "Registerbekanntmachung nach dem Umwandlungsgesetz",
      "state": "Baden-Württemberg",
      "amtsgericht": "Amtsgericht Stuttgart",
      "registernummer": "HRB 225678",
      "registerart": "HRB",
      "company_name": "CONVOTIS Deutschland GmbH",
      "company_seat": "Nürtingen",
      "details": "29.10.2025 (Bekanntmachungsdatum)\n\nBaden-Württemberg Amtsgericht Stuttgart HRB 225678\nRegisterbekanntmachung nach dem Umwandlungsgesetz 29.10.2025 (Eintragungsdatum)\n\nCONVOTIS Deutschland GmbH\nGesellschaft mit beschränkter Haftung\nNürtingen\n\nAls nicht eingetragen wird bekanntgemacht:\nDen Gläubigern der an der Verschmelzung beteiligten Rechtsträger ist, wenn sie binnen sechs Monaten nach dem Tag, an dem die Eintragung der Verschmelzung in das Register des Sitzes desjenigen Rechtsträgers, dessen Gläubiger sie sind, nach § 19 Abs. 3 UmwG als bekanntgemacht gilt, ihren Anspruch nach Grund und Höhe schriftlich anmelden, Sicherheit zu leisten, soweit sie nicht Befriedigung verlangen können. Dieses Recht steht den Gläubigern jedoch nur zu, wenn sie glaubhaft machen, dass durch die Verschmelzung die Erfüllung ihrer Forderung gefährdet wird."
    },
    {
      "date": "2025-10-29",
      "id": "135646",
      "original_text": "Registerbekanntmachung nach dem Umwandlungsgesetz\nBrandenburg Amtsgericht Cottbus HRB 15691\nVEM Beteiligungen GmbH – Schönefeld",
      "type": "Registerbekanntmachung nach dem Umwandlungsgesetz",
      "state": "Brandenburg",
      "amtsgericht": "Amtsgericht Cottbus",
      "registernummer": "HRB 15691",
      "registerart": "HRB",
      "company_name": "VEM Beteiligungen GmbH",
      "company_seat": "Schönefeld",
      "details": "29.10.2025 (Bekanntmachungsdatum)\n\nBrandenburg Amtsgericht Cottbus HRB 15691\nRegisterbekanntmachung nach dem Umwandlungsgesetz 28.10.2025 (Eintragungsdatum)\n\nVEM Beteiligungen GmbH\nGesellschaft mit beschränkter Haftung\nSchönefeld\n\nZu Eintragungsnummer 10 vom 28.10.2025 wird als nicht eingetragen veröffentlicht:\nDen Gläubigern der an der Verschmelzung beteiligten Rechtsträger ist, wenn sie binnen sechs Monaten nach dem Tag, an dem die Eintragung der Verschmelzung in das Register des Sitzes desjenigen Rechtsträgers, dessen Gläubiger sie sind, als bekannt gemacht gilt, ihren Anspruch nach Grund und Höhe schriftlich anmelden, Sicherheit zu leisten, soweit sie nicht Befriedigung verlangen können. Dieses Recht steht den Gläubigern jedoch nur zu, wenn sie glaubhaft machen, dass durch die Verschmelzung die Erfüllung ihrer Forderung gefährdet wird"
    },
    {
      "date": "2025-10-29",
      "id": "135647",
      "original_text": "Registerbekanntmachung nach dem Umwandlungsgesetz\nBaden-Württemberg Amtsgericht Stuttgart HRA 742553\nRehatechnikzentrum BON REHA e.K. – Obersulm",
      "type": "Registerbekanntmachung nach dem Umwandlungsgesetz",
      "state": "Baden-Württemberg",
      "amtsgericht": "Amtsgericht Stuttgart",
      "registernummer": "HRA 742553",
      "registerart": "HRA",
      "company_name": "Rehatechnikzentrum BON REHA e.K.",
      "company_seat": "Obersulm",
      "details": "29.10.2025 (Bekanntmachungsdatum)\n\nBaden-Württemberg Amtsgericht Stuttgart HRA 742553\nRegisterbekanntmachung nach dem Umwandlungsgesetz 29.10.2025 (Eintragungsdatum)\n\nRehatechnikzentrum BON REHA e.K.\nEinzelkaufmann / Einzelkauffrau\nObersulm\n\nAls nicht eingetragen wird bekanntgemacht:\nDen Gläubigern der an der Ausgliederung beteiligten Rechtsträger ist, wenn sie binnen sechs Monaten nach dem Tag, an dem die Eintragung der Ausgliederung in das Register des Sitzes desjenigen Rechtsträgers, dessen Gläubiger sie sind, nach § 19 Abs. 3 UmwG als bekanntgemacht gilt, ihren Anspruch nach Grund und Höhe schriftlich anmelden, Sicherheit zu leisten, soweit sie nicht Befriedigung verlangen können. Dieses Recht steht den Gläubigern jedoch nur zu, wenn sie glaubhaft machen, dass durch die Ausgliederung die Erfüllung ihrer Forderung gefährdet wird."
    },
    {
      "date": "2025-10-29",
      "id": "135648",
      "original_text": "Löschungsankündigung\nSchleswig-Holstein Amtsgericht Kiel HRB 24168\nNeversbau GmbH – Neversdorf",
      "type": "Löschungsankündigung",
      "state": "Schleswig-Holstein",
      "amtsgericht": "Amtsgericht Kiel",
      "registernummer": "HRB 24168",
      "registerart": "HRB",
      "company_name": "Neversbau GmbH",
      "company_seat": "Neversdorf",
      "details": "29.10.2025 (Bekanntmachungsdatum)\n\nSchleswig-Holstein Amtsgericht Kiel HRB 24168\nLöschungsankündigung\n\nNeversbau GmbH\nGesellschaft mit beschränkter Haftung\nNeversdorf\n\nEs ist die Löschung der nachstehenden Gesellschaft wegen Vermögenslosigkeit gemäß § 394 FamFG beabsichtigt. Widerspruchsfrist: 2 Monate."
    },
    {
      "date": "2025-10-29",
      "id": "135649",
      "original_text": "Registerbekanntmachung nach dem Umwandlungsgesetz\nBaden-Württemberg Amtsgericht Stuttgart HRA 742115\nLidl 423 GmbH & Co. KG – Bad Wimpfen",
      "type": "Registerbekanntmachung nach dem Umwandlungsgesetz",
      "state": "Baden-Württemberg",
      "amtsgericht": "Amtsgericht Stuttgart",
      "registernummer": "HRA 742115",
      "registerart": "HRA",
      "company_name": "Lidl 423 GmbH & Co. KG",
      "company_seat": "Bad Wimpfen",
      "details": "29.10.2025 (Bekanntmachungsdatum)\n\nBaden-Württemberg Amtsgericht Stuttgart HRA 742115\nRegisterbekanntmachung nach dem Umwandlungsgesetz 29.10.2025 (Eintragungsdatum)\n\nLidl 423 GmbH & Co. KG\nKommanditgesellschaft\nBad Wimpfen\n\nDen Gläubigern der an der Ausgliederung beteiligten Rechtsträger ist, wenn sie binnen sechs Monaten nach dem Tag, an dem die Eintragung der Ausgliederung in das Register des Sitzes desjenigen Rechtsträgers, dessen Gläubiger sie sind, nach § 19 Abs. 3 UmwG als bekanntgemacht gilt, ihren Anspruch nach Grund und Höhe schriftlich anmelden, Sicherheit zu leisten, soweit sie nicht Befriedigung verlangen können. Dieses Recht steht den Gläubigern jedoch nur zu, wenn sie glaubhaft machen, dass durch die Ausgliederung die Erfüllung ihrer Forderung gefährdet wird."
    },
    {
      "date": "2025-10-29",
      "id": "135650",
      "original_text": "Registerbekanntmachung nach dem Umwandlungsgesetz\nBaden-Württemberg Amtsgericht Stuttgart HRA 742677\nmyTREILER - Marcel Eiler e.K. – Besigheim",
      "type": "Registerbekanntmachung nach dem Umwandlungsgesetz",
      "state": "Baden-Württemberg",
      "amtsgericht": "Amtsgericht Stuttgart",
      "registernummer": "HRA 742677",
      "registerart": "HRA",
      "company_name": "myTREILER - Marcel Eiler e.K.",
      "company_seat": "Besigheim",
      "details": "29.10.2025 (Bekanntmachungsdatum)\n\nBaden-Württemberg Amtsgericht Stuttgart HRA 742677\nRegisterbekanntmachung nach dem Umwandlungsgesetz 29.10.2025 (Eintragungsdatum)\n\nmyTREILER - Marcel Eiler e.K.\nEinzelkaufmann / Einzelkauffrau\nBesigheim\n\nDen Gläubigern der an der Ausgliederung beteiligten Rechtsträger ist, wenn sie binnen sechs Monaten nach dem Tag, an dem die Eintragung der Ausgliederung in das Register des Sitzes desjenigen Rechtsträgers, dessen Gläubiger sie sind, nach § 19 Abs. 3 UmwG als bekanntgemacht gilt, ihren Anspruch nach Grund und Höhe schriftlich anmelden, Sicherheit zu leisten, soweit sie nicht Befriedigung verlangen können. Dieses Recht steht den Gläubigern jedoch nur zu, wenn sie glaubhaft machen, dass durch die Ausgliederung die Erfüllung ihrer Forderung gefährdet wird."
    },
    {
      "date": "2025-10-29",
      "id": "135651",
      "original_text": "Registerbekanntmachung nach dem Umwandlungsgesetz\nBaden-Württemberg Amtsgericht Stuttgart HRB 798690\nWhyConsult UG (haftungsbeschränkt) – Ludwigsburg",
      "type": "Registerbekanntmachung nach dem Umwandlungsgesetz",
      "state": "Baden-Württemberg",
      "amtsgericht": "Amtsgericht Stuttgart",
      "registernummer": "HRB 798690",
      "registerart": "HRB",
      "company_name": "WhyConsult UG (haftungsbeschränkt)",
      "company_seat": "Ludwigsburg",
      "details": "29.10.2025 (Bekanntmachungsdatum)\n\nBaden-Württemberg Amtsgericht Stuttgart HRB 798690\nRegisterbekanntmachung nach dem Umwandlungsgesetz 29.10.2025 (Eintragungsdatum)\n\nWhyConsult UG (haftungsbeschränkt)\nGesellschaft mit beschränkter Haftung\nLudwigsburg\n\nAls nicht eingetragen wird bekanntgemacht:\nDen Gläubigern der an der Verschmelzung beteiligten Rechtsträger ist, wenn sie binnen sechs Monaten nach dem Tag, an dem die Eintragung der Verschmelzung in das Register des Sitzes desjenigen Rechtsträgers, dessen Gläubiger sie sind, nach § 19 Abs. 3 UmwG als bekanntgemacht gilt, ihren Anspruch nach Grund und Höhe schriftlich anmelden, Sicherheit zu leisten, soweit sie nicht Befriedigung verlangen können. Dieses Recht steht den Gläubigern jedoch nur zu, wenn sie glaubhaft machen, dass durch die Verschmelzung die Erfüllung ihrer Forderung gefährdet wird."
    },
    {
      "date": "2025-10-29",
      "id": "135652",
      "original_text": "Sonstige Registerbekanntmachung\nBerlin Amtsgericht Berlin (Charlottenburg) HRB 278028\nAcadeMedia Holding SE – Berlin",
      "type": "Sonstige Registerbekanntmachung",
      "state": "Berlin",
      "amtsgericht": "Amtsgericht Berlin (Charlottenburg)",
      "registernummer": "HRB 278028",
      "registerart": "HRB",
      "company_name": "AcadeMedia Holding SE",
      "company_seat": "Berlin",
      "details": "29.10.2025 (Bekanntmachungsdatum)\n\nBerlin Amtsgericht Berlin (Charlottenburg) HRB 278028\nSonstige Registerbekanntmachung\n\nAcadeMedia Holding SE\nEuropäische Aktiengesellschaft (SE)\nBerlin\n\nEs wurde eine neue Liste der Verwaltungsmitglieder eingereicht (§ 106 AktG).Als nicht eingetragen wird veröffentlicht:"
    },
    {
      "date": "2025-10-29",
      "id": "135653",
      "original_text": "Registerbekanntmachung nach dem Umwandlungsgesetz\nBerlin Amtsgericht Berlin (Charlottenburg) HRB 183542\nurban venture beteiligungen UG (haftungsbeschränkt) – Berlin",
      "type": "Registerbekanntmachung nach dem Umwandlungsgesetz",
      "state": "Berlin",
      "amtsgericht": "Amtsgericht Berlin (Charlottenburg)",
      "registernummer": "HRB 183542",
      "registerart": "HRB",
      "company_name": "urban venture beteiligungen UG (haftungsbeschränkt)",
      "company_seat": "Berlin",
      "details": "29.10.2025 (Bekanntmachungsdatum)\n\nBerlin Amtsgericht Berlin (Charlottenburg) HRB 183542\nRegisterbekanntmachung nach dem Umwandlungsgesetz 28.10.2025 (Eintragungsdatum)\n\nurban venture beteiligungen UG (haftungsbeschränkt)\nGesellschaft mit beschränkter Haftung\nBerlin\n\nZu Eintragungsnummer 4 vom 28.10.2025 wird als nicht eingetragen veröffentlicht: Den Gläubigern der an der Verschmelzung beteiligten Rechtsträger ist, wenn sie binnen sechs Monaten nach dem Tag, an dem die Eintragung der Verschmelzung in das Register des Sitzes desjenigen Rechtsträgers, dessen Gläubiger sie sind, als bekannt gemacht gilt, ihren Anspruch nach Grund und Höhe schriftlich anmelden, Sicherheit zu leisten, soweit sie nicht Befriedigung verlangen können. Dieses Recht steht den Gläubigern jedoch nur zu, wenn sie glaubhaft machen, dass durch die Verschmelzung die Erfüllung ihrer Forderung gefährdet wird. Das Recht, Sicherheitsleistung zu verlangen, steht Gläubigern nicht zu, die im Falle der Insolvenz ein Recht auf vorzugsweise Befriedigung aus einer Deckungsmasse haben, die nach gesetzlicher Vorschrift zu ihrem Schutz errichtet und staatlich überwacht ist."
    },
    {
      "date": "2025-10-29",
      "id": "135654",
      "original_text": "Registerbekanntmachung nach dem Umwandlungsgesetz\nHamburg Amtsgericht Hamburg HRB 141436\nTrilliarden Entertainment GmbH – Hamburg",
      "type": "Registerbekanntmachung nach dem Umwandlungsgesetz",
      "state": "Hamburg",
      "amtsgericht": "Amtsgericht Hamburg",
      "registernummer": "HRB 141436",
      "registerart": "HRB",
      "company_name": "Trilliarden Entertainment GmbH",
      "company_seat": "Hamburg",
      "details": "29.10.2025 (Bekanntmachungsdatum)\n\nHamburg Amtsgericht Hamburg HRB 141436\nRegisterbekanntmachung nach dem Umwandlungsgesetz 29.10.2025 (Eintragungsdatum)\n\nTrilliarden Entertainment GmbH\nGesellschaft mit beschränkter Haftung\nHamburg\n\nAls nicht eingetragen wird bekannt gemacht:\nDen Gläubigern der an der Ausgliederung beteiligten Gesellschaften ist, wenn sie binnen sechs Monaten nach dem Tag, an dem die Eintragung der Ausgliederung in das Register des Sitzes desjenigen Rechtsträgers, dessen Gläubiger sie sind, nach § 19 Absatz 3 UmwG als bekannt gemacht gilt, ihren Anspruch nach Grund und Höhe schriftlich anmelden, Sicherheit zu leisten, soweit sie nicht Befriedigung verlangen können. Dieses Recht steht den Gläubigern jedoch nur zu, wenn sie glaubhaft machen, dass durch die Ausgliederung die Erfüllung ihrer Forderung gefährdet wird."
    },
    {
      "date": "2025-10-29",
      "id": "135655",
      "original_text": "Registerbekanntmachung nach dem Umwandlungsgesetz\nBaden-Württemberg Amtsgericht Stuttgart HRA 742113\nLidl 406 GmbH & Co. KG – Bad Wimpfen",
      "type": "Registerbekanntmachung nach dem Umwandlungsgesetz",
      "state": "Baden-Württemberg",
      "amtsgericht": "Amtsgericht Stuttgart",
      "registernummer": "HRA 742113",
      "registerart": "HRA",
      "company_name": "Lidl 406 GmbH & Co. KG",
      "company_seat": "Bad Wimpfen",
      "details": "29.10.2025 (Bekanntmachungsdatum)\n\nBaden-Württemberg Amtsgericht Stuttgart HRA 742113\nRegisterbekanntmachung nach dem Umwandlungsgesetz 29.10.2025 (Eintragungsdatum)\n\nLidl 406 GmbH & Co. KG\nKommanditgesellschaft\nBad Wimpfen\n\nDen Gläubigern der an der Ausgliederung beteiligten Rechtsträger ist, wenn sie binnen sechs Monaten nach dem Tag, an dem die Eintragung der Ausgliederung in das Register des Sitzes desjenigen Rechtsträgers, dessen Gläubiger sie sind, nach § 19 Abs. 3 UmwG als bekanntgemacht gilt, ihren Anspruch nach Grund und Höhe schriftlich anmelden, Sicherheit zu leisten, soweit sie nicht Befriedigung verlangen können. Dieses Recht steht den Gläubigern jedoch nur zu, wenn sie glaubhaft machen, dass durch die Ausgliederung die Erfüllung ihrer Forderung gefährdet wird."
    },
    {
      "date": "2025-10-29",
      "id": "135656",
      "original_text": "Registerbekanntmachung nach dem Umwandlungsgesetz\nBerlin Amtsgericht Berlin (Charlottenburg) HRB 187342\nHIGHGATE BERLIN-RE GmbH – Berlin",
      "type": "Registerbekanntmachung nach dem Umwandlungsgesetz",
      "state": "Berlin",
      "amtsgericht": "Amtsgericht Berlin (Charlottenburg)",
      "registernummer": "HRB 187342",
      "registerart": "HRB",
      "company_name": "HIGHGATE BERLIN-RE GmbH",
      "company_seat": "Berlin",
      "details": "29.10.2025 (Bekanntmachungsdatum)\n\nBerlin Amtsgericht Berlin (Charlottenburg) HRB 187342\nRegisterbekanntmachung nach dem Umwandlungsgesetz 28.10.2025 (Eintragungsdatum)\n\nHIGHGATE BERLIN-RE GmbH\nGesellschaft mit beschränkter Haftung\nBerlin\n\nZu Eintragungsnummer 5 vom 28.10.2025 wird als nicht eingetragen veröffentlicht: Den Gläubigern der an der Verschmelzung beteiligten Rechtsträger ist, wenn sie binnen sechs Monaten nach dem Tag, an dem die Eintragung der Verschmelzung in das Register des Sitzes desjenigen Rechtsträgers, dessen Gläubiger sie sind, als bekannt gemacht gilt, ihren Anspruch nach Grund und Höhe schriftlich anmelden, Sicherheit zu leisten, soweit sie nicht Befriedigung verlangen können. Dieses Recht steht den Gläubigern jedoch nur zu, wenn sie glaubhaft machen, dass durch die Verschmelzung die Erfüllung ihrer Forderung gefährdet wird. Das Recht, Sicherheitsleistung zu verlangen, steht Gläubigern nicht zu, die im Falle der Insolvenz ein Recht auf vorzugsweise Befriedigung aus einer Deckungsmasse haben, die nach gesetzlicher Vorschrift zu ihrem Schutz errichtet und staatlich überwacht ist."
    },
    {
      "date": "2025-10-29",
      "id": "135657",
      "original_text": "Registerbekanntmachung nach dem Umwandlungsgesetz\nBerlin Amtsgericht Berlin (Charlottenburg) HRA 64639\nMehrfachagentur Olaf Stobbe Versicherungen & Finanzen e.K. – Berlin",
      "type": "Registerbekanntmachung nach dem Umwandlungsgesetz",
      "state": "Berlin",
      "amtsgericht": "Amtsgericht Berlin (Charlottenburg)",
      "registernummer": "HRA 64639",
      "registerart": "HRA",
      "company_name": "Mehrfachagentur Olaf Stobbe Versicherungen & Finanzen e.K.",
      "company_seat": "Berlin",
      "details": "29.10.2025 (Bekanntmachungsdatum)\n\nBerlin Amtsgericht Berlin (Charlottenburg) HRA 64639\nRegisterbekanntmachung nach dem Umwandlungsgesetz 28.10.2025 (Eintragungsdatum)\n\nMehrfachagentur Olaf Stobbe Versicherungen & Finanzen e.K.\nEinzelkaufmann / Einzelkauffrau\nBerlin\n\nZu Eintragungsnummer 2 vom 28.10.2025 wird als nicht eingetragen veröffentlicht: Den Gläubigern der an der Spaltung beteiligten Rechtsträger ist, wenn sie binnen sechs Monaten nach dem Tag, an dem die Eintragung der Spaltung in das Register des Sitzes desjenigen Rechtsträgers, dessen Gläubiger sie sind, als bekannt gemacht gilt, ihren Anspruch nach Grund und Höhe schriftlich anmelden, Sicherheit zu leisten, soweit sie nicht Befriedigung verlangen können. Dieses Recht steht den Gläubigern jedoch nur zu, wenn sie glaubhaft machen, dass durch die Spaltung die Erfüllung ihrer Forderung gefährdet wird. Das Recht, Sicherheitsleistung zu verlangen, steht Gläubigern nicht zu, die im Falle der Insolvenz ein Recht auf vorzugsweise Befriedigung aus einer Deckungsmasse haben, die nach gesetzlicher Vorschrift zu ihrem Schutz errichtet und staatlich überwacht ist."
    },
    {
      "date": "2025-10-29",
      "id": "135658",
      "original_text": "Registerbekanntmachung nach dem Umwandlungsgesetz\nBaden-Württemberg Amtsgericht Mannheim HRB 737018\ndhmp Personalmanagement und Beratung GmbH – Karlsruhe",
      "type": "Registerbekanntmachung nach dem Umwandlungsgesetz",
      "state": "Baden-Württemberg",
      "amtsgericht": "Amtsgericht Mannheim",
      "registernummer": "HRB 737018",
      "registerart": "HRB",
      "company_name": "dhmp Personalmanagement und Beratung GmbH",
      "company_seat": "Karlsruhe",
      "details": "29.10.2025 (Bekanntmachungsdatum)\n\nBaden-Württemberg Amtsgericht Mannheim HRB 737018\nRegisterbekanntmachung nach dem Umwandlungsgesetz 29.10.2025 (Eintragungsdatum)\n\ndhmp Personalmanagement und Beratung GmbH\nGesellschaft mit beschränkter Haftung\nKarlsruhe\n\nDen Gläubigern des an dem Formwechsel beteiligten Rechtsträgers ist, wenn sie binnen sechs Monaten nach dem Tag, an dem die Eintragung des Formwechsels in das Register des Sitzes desjenigen Rechtsträgers, dessen Gläubiger sie sind, nach § 19 Abs. 3 UmwG als bekanntgemacht gilt, ihren Anspruch nach Grund und Höhe schriftlich anmelden, Sicherheit zu leisten, soweit sie nicht Befriedigung verlangen können. Dieses Recht steht den Gläubigern jedoch nur zu, wenn sie glaubhaft machen, dass durch den Formwechsel die Erfüllung ihrer Forderung gefährdet wird."
    },
    {
      "date": "2025-10-29",
      "id": "135659",
      "original_text": "Löschungsankündigung\nBerlin Amtsgericht Berlin (Charlottenburg) HRA 58043\nATRIA Hauptstadtexpress GmbH & Co. KG – Berlin",
      "type": "Löschungsankündigung",
      "state": "Berlin",
      "amtsgericht": "Amtsgericht Berlin (Charlottenburg)",
      "registernummer": "HRA 58043",
      "registerart": "HRA",
      "company_name": "ATRIA Hauptstadtexpress GmbH & Co. KG",
      "company_seat": "Berlin",
      "details": "29.10.2025 (Bekanntmachungsdatum)\n\nBerlin Amtsgericht Berlin (Charlottenburg) HRA 58043\nLöschungsankündigung\n\nATRIA Hauptstadtexpress GmbH & Co. KG\nKommanditgesellschaft\nBerlin\n\nBei dem nachstehenden Unternehmen / der nachstehenden Gesellschaft wird das Amtslöschungsverfahren gemäß § 31 Abs. 2 HGB eingeleitet. Widerspruchsfrist 2 Monate"
    },
    {
      "date": "2025-10-29",
      "id": "135660",
      "original_text": "Registerbekanntmachung nach dem Umwandlungsgesetz\nBaden-Württemberg Amtsgericht Mannheim HRA 712862\ndhmp Personalmanagement und Beratung GmbH & Co. KG – Karlsruhe",
      "type": "Registerbekanntmachung nach dem Umwandlungsgesetz",
      "state": "Baden-Württemberg",
      "amtsgericht": "Amtsgericht Mannheim",
      "registernummer": "HRA 712862",
      "registerart": "HRA",
      "company_name": "dhmp Personalmanagement und Beratung GmbH & Co. KG",
      "company_seat": "Karlsruhe",
      "details": "29.10.2025 (Bekanntmachungsdatum)\n\nBaden-Württemberg Amtsgericht Mannheim HRA 712862\nRegisterbekanntmachung nach dem Umwandlungsgesetz 29.10.2025 (Eintragungsdatum)\n\ndhmp Personalmanagement und Beratung GmbH & Co. KG\nKommanditgesellschaft\nKarlsruhe\n\nDen Gläubigern des an dem Formwechsel beteiligten Rechtsträgers ist, wenn sie binnen sechs Monaten nach dem Tag, an dem die Eintragung des Formwechsels in das Register des Sitzes desjenigen Rechtsträgers, dessen Gläubiger sie sind, nach § 19 Abs. 3 UmwG als bekanntgemacht gilt, ihren Anspruch nach Grund und Höhe schriftlich anmelden, Sicherheit zu leisten, soweit sie nicht Befriedigung verlangen können. Dieses Recht steht den Gläubigern jedoch nur zu, wenn sie glaubhaft machen, dass durch den Formwechsel die Erfüllung ihrer Forderung gefährdet wird."
    },
    {
      "date": "2025-10-29",
      "id": "135661",
      "original_text": "Registerbekanntmachung nach dem Umwandlungsgesetz\nBaden-Württemberg Amtsgericht Stuttgart VR 220292\nKrankenpflegeverein Plattenhardt e.V. – Filderstadt",
      "type": "Registerbekanntmachung nach dem Umwandlungsgesetz",
      "state": "Baden-Württemberg",
      "amtsgericht": "Amtsgericht Stuttgart",
      "registernummer": "VR 220292",
      "registerart": "VR",
      "company_name": "Krankenpflegeverein Plattenhardt e.V.",
      "company_seat": "Filderstadt",
      "details": "29.10.2025 (Bekanntmachungsdatum)\n\nBaden-Württemberg Amtsgericht Stuttgart VR 220292\nRegisterbekanntmachung nach dem Umwandlungsgesetz 29.10.2025 (Eintragungsdatum)\n\nKrankenpflegeverein Plattenhardt e.V.\neingetragener Verein\nFilderstadt\n\nAls nicht eingetragen wird bekanntgemacht:\nDen Gläubigern der an der Verschmelzung beteiligten Rechtsträger ist, wenn sie binnen sechs Monaten nach dem Tag, an dem die Eintragung der Verschmelzung in das Register des Sitzes desjenigen Rechtsträgers, dessen Gläubiger sie sind, nach § 19 Abs. 3 UmwG als bekanntgemacht gilt, ihren Anspruch nach Grund und Höhe schriftlich anmelden, Sicherheit zu leisten, soweit sie nicht Befriedigung verlangen können. Dieses Recht steht den Gläubigern jedoch nur zu, wenn sie glaubhaft machen, dass durch die Verschmelzung die Erfüllung ihrer Forderung gefährdet wird."
    },
    {
      "date": "2025-10-29",
      "id": "135662",
      "original_text": "Einreichung neuer Dokumente\nBerlin Amtsgericht Berlin (Charlottenburg) HRB 101965\nAVILA Management & Consulting AG – Berlin",
      "type": "Einreichung neuer Dokumente",
      "state": "Berlin",
      "amtsgericht": "Amtsgericht Berlin (Charlottenburg)",
      "registernummer": "HRB 101965",
      "registerart": "HRB",
      "company_name": "AVILA Management & Consulting AG",
      "company_seat": "Berlin",
      "details": "29.10.2025 (Bekanntmachungsdatum)\n\nBerlin Amtsgericht Berlin (Charlottenburg) HRB 101965\nEinreichung neuer Dokumente\n\nAVILA Management & Consulting AG\nAktiengesellschaft\nBerlin\n\nAls nicht eingetragen wird veröffentlicht: Es wurde eine neue Liste der Aufsichtsratsmitglieder eingereicht (§ 106 AktG)."
    },
    {
      "date": "2025-10-29",
      "id": "135663",
      "original_text": "Registerbekanntmachung nach dem Umwandlungsgesetz\nSachsen-Anhalt Amtsgericht Stendal HRB 25485\nPHO P GmbH – Weißenfels",
      "type": "Registerbekanntmachung nach dem Umwandlungsgesetz",
      "state": "Sachsen-Anhalt",
      "amtsgericht": "Amtsgericht Stendal",
      "registernummer": "HRB 25485",
      "registerart": "HRB",
      "company_name": "PHO P GmbH",
      "company_seat": "Weißenfels",
      "details": "29.10.2025 (Bekanntmachungsdatum)\n\nSachsen-Anhalt Amtsgericht Stendal HRB 25485\nRegisterbekanntmachung nach dem Umwandlungsgesetz 29.10.2025 (Eintragungsdatum)\n\nPHO P GmbH\nGesellschaft mit beschränkter Haftung\nWeißenfels\n\nNicht eingetragen:\nDen Gläubigern des formwechselnden  Rechtsträgers, ist wenn sie binnen sechs Monaten nach dem Tag, an dem die Eintragung des Formwechsels nach § 201 UmwG als bekanntgemacht gilt, ihren Anspruch nach Grund und Höhe schriftlich anmelden, Sicherheit zu leisten, soweit sie nicht Befriedigung verlangen können. Dieses Recht steht ihnen jedoch nur zu, wenn sie glaubhaft machen, dass durch den Formwechsel die Erfüllung ihrer Forderung gefährdet wird."
    },
    {
      "date": "2025-10-29",
      "id": "135664",
      "original_text": "Löschungsankündigung\nBaden-Württemberg Amtsgericht Mannheim HRB 731633\nSorgenlos-NV Baudienstleistungen GmbH – Wiesloch",
      "type": "Löschungsankündigung",
      "state": "Baden-Württemberg",
      "amtsgericht": "Amtsgericht Mannheim",
      "registernummer": "HRB 731633",
      "registerart": "HRB",
      "company_name": "Sorgenlos-NV Baudienstleistungen GmbH",
      "company_seat": "Wiesloch",
      "details": "29.10.2025 (Bekanntmachungsdatum)\n\nBaden-Württemberg Amtsgericht Mannheim HRB 731633\nLöschungsankündigung 29.10.2025 (Eintragungsdatum)\n\nSorgenlos-NV Baudienstleistungen GmbH\nGesellschaft mit beschränkter Haftung\nWiesloch\n\nAls nicht eingetragen wird bekanntgemacht:\nDas Gericht beabsichtigt, die Gesellschaft wegen Vermögenslosigkeit im Handelsregister von Amts wegen nach § 394 FamFG zu löschen. Die Frist zur Geltendmachung eines Widerspruchs gegen die beabsichtigte Löschung ist auf einen Monat ab Veröffentlichung bestimmt."
    },
    {
      "date": "2025-10-29",
      "id": "135665",
      "original_text": "Sonstige Registerbekanntmachung\nThüringen Amtsgericht Eisenach VR 311076\n1. Eisenacher Dart Club – Eisenach",
      "type": "Sonstige Registerbekanntmachung",
      "state": "Thüringen",
      "amtsgericht": "Amtsgericht Eisenach",
      "registernummer": "VR 311076",
      "registerart": "VR",
      "company_name": "1. Eisenacher Dart Club",
      "company_seat": "Eisenach",
      "details": "29.10.2025 (Bekanntmachungsdatum)\n\nThüringen Amtsgericht Eisenach VR 311076\nSonstige Registerbekanntmachung 29.10.2025 (Eintragungsdatum)\n\n1. Eisenacher Dart Club\neingetragener Verein\nEisenach"
    },
    {
      "date": "2025-10-29",
      "id": "135666",
      "original_text": "Registerbekanntmachung nach dem Umwandlungsgesetz\nBaden-Württemberg Amtsgericht Stuttgart HRA 731976\nSubs MILANEO GmbH & Co. KG – Filderstadt",
      "type": "Registerbekanntmachung nach dem Umwandlungsgesetz",
      "state": "Baden-Württemberg",
      "amtsgericht": "Amtsgericht Stuttgart",
      "registernummer": "HRA 731976",
      "registerart": "HRA",
      "company_name": "Subs MILANEO GmbH & Co. KG",
      "company_seat": "Filderstadt",
      "details": "29.10.2025 (Bekanntmachungsdatum)\n\nBaden-Württemberg Amtsgericht Stuttgart HRA 731976\nRegisterbekanntmachung nach dem Umwandlungsgesetz 29.10.2025 (Eintragungsdatum)\n\nSubs MILANEO GmbH & Co. KG\nKommanditgesellschaft\nFilderstadt\n\nAls nicht eingetragen wird bekanntgemacht:\nDen Gläubigern der an der Verschmelzung beteiligten Rechtsträger ist, wenn sie binnen sechs Monaten nach dem Tag, an dem die Eintragung der Verschmelzung in das Register des Sitzes desjenigen Rechtsträgers, dessen Gläubiger sie sind, nach § 19 Abs. 3 UmwG als bekanntgemacht gilt, ihren Anspruch nach Grund und Höhe schriftlich anmelden, Sicherheit zu leisten, soweit sie nicht Befriedigung verlangen können. Dieses Recht steht den Gläubigern jedoch nur zu, wenn sie glaubhaft machen, dass durch die Verschmelzung die Erfüllung ihrer Forderung gefährdet wird."
    },
    {
      "date": "2025-10-29",
      "id": "135667",
      "original_text": "Löschungsankündigung\nBerlin Amtsgericht Berlin (Charlottenburg) HRB 177683\nNTS Property GmbH – Berlin",
      "type": "Löschungsankündigung",
      "state": "Berlin",
      "amtsgericht": "Amtsgericht Berlin (Charlottenburg)",
      "registernummer": "HRB 177683",
      "registerart": "HRB",
      "company_name": "NTS Property GmbH",
      "company_seat": "Berlin",
      "details": "29.10.2025 (Bekanntmachungsdatum)\n\nBerlin Amtsgericht Berlin (Charlottenburg) HRB 177683\nLöschungsankündigung\n\nNTS Property GmbH\nGesellschaft mit beschränkter Haftung\nBerlin\n\nBei der nachstehenden Gesellschaft wird das Amtslöschungsverfahren gemäß § 394 FamFG eingeleitet. Widerspruchsfrist 6 Wochen"
    },
    {
      "date": "2025-10-29",
      "id": "135668",
      "original_text": "Registerbekanntmachung nach dem Umwandlungsgesetz\nSchleswig-Holstein Amtsgericht Flensburg HRA 11575\nHenry Kahl e.K. – Sylt",
      "type": "Registerbekanntmachung nach dem Umwandlungsgesetz",
      "state": "Schleswig-Holstein",
      "amtsgericht": "Amtsgericht Flensburg",
      "registernummer": "HRA 11575",
      "registerart": "HRA",
      "company_name": "Henry Kahl e.K.",
      "company_seat": "Sylt",
      "details": "29.10.2025 (Bekanntmachungsdatum)\n\nSchleswig-Holstein Amtsgericht Flensburg HRA 11575\nRegisterbekanntmachung nach dem Umwandlungsgesetz 29.10.2025 (Eintragungsdatum)\n\nHenry Kahl e.K.\nEinzelkaufmann / Einzelkauffrau\nSylt\n\nZu Eintragungsnummer 2 vom 29.10.2025 wird als nicht eingetragen veröffentlicht: Den Gläubigern der an der Spaltung beteiligten Rechtsträger ist, wenn sie binnen sechs Monaten nach dem Tag, an dem die Eintragung der Spaltung in das Register des Sitzes desjenigen Rechtsträgers, dessen Gläubiger sie sind, als bekannt gemacht gilt, ihren Anspruch nach Grund und Höhe in Textform anmelden, Sicherheit zu leisten, soweit sie nicht Befriedigung verlangen können. Dieses Recht steht den Gläubigern jedoch nur zu, wenn sie glaubhaft machen, dass durch die Spaltung die Erfüllung ihrer Forderung gefährdet wird."
    },
    {
      "date": "2025-10-29",
      "id": "135669",
      "original_text": "Registerbekanntmachung nach dem Umwandlungsgesetz\nSchleswig-Holstein Amtsgericht Flensburg HRB 17794\nKahl Consulting GmbH – Sylt",
      "type": "Registerbekanntmachung nach dem Umwandlungsgesetz",
      "state": "Schleswig-Holstein",
      "amtsgericht": "Amtsgericht Flensburg",
      "registernummer": "HRB 17794",
      "registerart": "HRB",
      "company_name": "Kahl Consulting GmbH",
      "company_seat": "Sylt",
      "details": "29.10.2025 (Bekanntmachungsdatum)\n\nSchleswig-Holstein Amtsgericht Flensburg HRB 17794\nRegisterbekanntmachung nach dem Umwandlungsgesetz 29.10.2025 (Eintragungsdatum)\n\nKahl Consulting GmbH\nGesellschaft mit beschränkter Haftung\nSylt\n\nAls nicht eingetragen wird veröffentlicht: Den Gläubigern der an der Spaltung beteiligten Rechtsträger ist, wenn sie binnen sechs Monaten nach dem Tag, an dem die Eintragung der Spaltung in das Register des Sitzes desjenigen Rechtsträgers, dessen Gläubiger sie sind, als bekannt gemacht gilt, ihren Anspruch nach Grund und Höhe in Textform anmelden, Sicherheit zu leisten, soweit sie nicht Befriedigung verlangen können. Dieses Recht steht den Gläubigern jedoch nur zu, wenn sie glaubhaft machen, dass durch die Spaltung die Erfüllung ihrer Forderung gefährdet wird."
    },
    {
      "date": "2025-10-29",
      "id": "135670",
      "original_text": "Registerbekanntmachung nach dem Umwandlungsgesetz\nNordrhein-Westfalen Amtsgericht Coesfeld HRA 8553\nTen Brinke Bau Baden-Württemberg GmbH & Co. KG – Bocholt",
      "type": "Registerbekanntmachung nach dem Umwandlungsgesetz",
      "state": "Nordrhein-Westfalen",
      "amtsgericht": "Amtsgericht Coesfeld",
      "registernummer": "HRA 8553",
      "registerart": "HRA",
      "company_name": "Ten Brinke Bau Baden-Württemberg GmbH & Co. KG",
      "company_seat": "Bocholt",
      "details": "29.10.2025 (Bekanntmachungsdatum)\n\nNordrhein-Westfalen Amtsgericht Coesfeld HRA 8553\nRegisterbekanntmachung nach dem Umwandlungsgesetz 29.10.2025 (Eintragungsdatum)\n\nTen Brinke Bau Baden-Württemberg GmbH & Co. KG\nKommanditgesellschaft\nBocholt\n\nDen Gläubigern der an der Verschmelzung beteiligten Rechtsträger ist, wenn sie binnen sechs Monaten nach dem Tag, an dem die Eintragung der Verschmelzung in das Register des Sitzes desjenigen Rechtsträgers, dessen Gläubiger sie sind, nach § 19 Absatz 3 UmwG als bekanntgemacht gilt, ihren Anspruch nach Grund und Höhe schriftlich anmelden, Sicherheit zu leisten, soweit sie nicht Befriedigung verlangen können. Dieses Recht steht den Gläubigern jedoch nur zu, wenn sie glaubhaft machen, dass durch die Verschmelzung die Erfüllung ihrer Forderung gefährdet wird."
    },
    {
      "date": "2025-10-29",
      "id": "135671",
      "original_text": "Registerbekanntmachung nach dem Umwandlungsgesetz\nBerlin Amtsgericht Berlin (Charlottenburg) HRB 214657\nEasytrans24.com GmbH – Berlin",
      "type": "Registerbekanntmachung nach dem Umwandlungsgesetz",
      "state": "Berlin",
      "amtsgericht": "Amtsgericht Berlin (Charlottenburg)",
      "registernummer": "HRB 214657",
      "registerart": "HRB",
      "company_name": "Easytrans24.com GmbH",
      "company_seat": "Berlin",
      "details": "29.10.2025 (Bekanntmachungsdatum)\n\nBerlin Amtsgericht Berlin (Charlottenburg) HRB 214657\nRegisterbekanntmachung nach dem Umwandlungsgesetz 29.10.2025 (Eintragungsdatum)\n\nEasytrans24.com GmbH\nGesellschaft mit beschränkter Haftung\nBerlin\n\nZu Eintragungsnummer 9 vom 29.10.2025 wird als nicht eingetragen veröffentlicht: Den Gläubigern der an der Verschmelzung beteiligten Rechtsträger ist, wenn sie binnen sechs Monaten nach dem Tag, an dem die Eintragung der Verschmelzung in das Register des Sitzes desjenigen Rechtsträgers, dessen Gläubiger sie sind, als bekannt gemacht gilt, ihren Anspruch nach Grund und Höhe schriftlich anmelden, Sicherheit zu leisten, soweit sie nicht Befriedigung verlangen können. Dieses Recht steht den Gläubigern jedoch nur zu, wenn sie glaubhaft machen, dass durch die Verschmelzung die Erfüllung ihrer Forderung gefährdet wird. Das Recht, Sicherheitsleistung zu verlangen, steht Gläubigern nicht zu, die im Falle der Insolvenz ein Recht auf vorzugsweise Befriedigung aus einer Deckungsmasse haben, die nach gesetzlicher Vorschrift zu ihrem Schutz errichtet und staatlich überwacht ist."
    },
    {
      "date": "2025-10-29",
      "id": "135672",
      "original_text": "Löschungsankündigung\nBaden-Württemberg Amtsgericht Stuttgart HRB 765657\nDouble Digital System GmbH – Stuttgart",
      "type": "Löschungsankündigung",
      "state": "Baden-Württemberg",
      "amtsgericht": "Amtsgericht Stuttgart",
      "registernummer": "HRB 765657",
      "registerart": "HRB",
      "company_name": "Double Digital System GmbH",
      "company_seat": "Stuttgart",
      "details": "29.10.2025 (Bekanntmachungsdatum)\n\nBaden-Württemberg Amtsgericht Stuttgart HRB 765657\nLöschungsankündigung\n\nDouble Digital System GmbH\nGesellschaft mit beschränkter Haftung\nStuttgart\n\nAls nicht eingetragen wird bekanntgemacht:\nDas Gericht beabsichtigt, die Gesellschaft wegen Vermögenslosigkeit im Handelsregister von Amts wegen nach § 394 FamFG zu löschen. Die Frist zur Geltendmachung eines Widerspruchs gegen die beabsichtigte Löschung ist auf zwei Monate ab Veröffentlichung bestimmt."
    },
    {
      "date": "2025-10-29",
      "id": "135673",
      "original_text": "Löschungsankündigung\nBerlin Amtsgericht Berlin (Charlottenburg) HRB 197067\nHT Service & Vermittlung GmbH – Berlin",
      "type": "Löschungsankündigung",
      "state": "Berlin",
      "amtsgericht": "Amtsgericht Berlin (Charlottenburg)",
      "registernummer": "HRB 197067",
      "registerart": "HRB",
      "company_name": "HT Service & Vermittlung GmbH",
      "company_seat": "Berlin",
      "details": "29.10.2025 (Bekanntmachungsdatum)\n\nBerlin Amtsgericht Berlin (Charlottenburg) HRB 197067\nLöschungsankündigung\n\nHT Service & Vermittlung GmbH\nGesellschaft mit beschränkter Haftung\nBerlin\n\nBei der nachstehenden Gesellschaft wird das Amtslöschungsverfahren gemäß § 394 FamFG eingeleitet. Widerspruchsfrist 6 Wochen"
    },
    {
      "date": "2025-10-29",
      "id": "135674",
      "original_text": "Löschungsankündigung\nBerlin Amtsgericht Berlin (Charlottenburg) HRB 241071\nEwer GmbH – Berlin",
      "type": "Löschungsankündigung",
      "state": "Berlin",
      "amtsgericht": "Amtsgericht Berlin (Charlottenburg)",
      "registernummer": "HRB 241071",
      "registerart": "HRB",
      "company_name": "Ewer GmbH",
      "company_seat": "Berlin",
      "details": "29.10.2025 (Bekanntmachungsdatum)\n\nBerlin Amtsgericht Berlin (Charlottenburg) HRB 241071\nLöschungsankündigung\n\nEwer GmbH\nGesellschaft mit beschränkter Haftung\nBerlin\n\nBei der nachstehenden Gesellschaft wird das Amtslöschungsverfahren gemäß § 394 FamFG eingeleitet. Widerspruchsfrist 6 Wochen"
    },
    {
      "date": "2025-10-29",
      "id": "135675",
      "original_text": "Registerbekanntmachung nach dem Umwandlungsgesetz\nBrandenburg Amtsgericht Potsdam VR 6081\nDeutsches Rotes Kreuz Kreisverband Fläming-Spreewald e.V. – Luckenwalde",
      "type": "Registerbekanntmachung nach dem Umwandlungsgesetz",
      "state": "Brandenburg",
      "amtsgericht": "Amtsgericht Potsdam",
      "registernummer": "VR 6081",
      "registerart": "VR",
      "company_name": "Deutsches Rotes Kreuz Kreisverband Fläming-Spreewald e.V.",
      "company_seat": "Luckenwalde",
      "details": "29.10.2025 (Bekanntmachungsdatum)\n\nBrandenburg Amtsgericht Potsdam VR 6081\nRegisterbekanntmachung nach dem Umwandlungsgesetz 24.10.2025 (Eintragungsdatum)\n\nDeutsches Rotes Kreuz Kreisverband Fläming-Spreewald e.V.\neingetragener Verein\nLuckenwalde\n\nZu Eintragungsnummer 8 vom 24.10.2025 wird als nicht eingetragen veröffentlicht: Als nicht eingetragen wird veröffentlicht:\nDen Gläubigern der an der Ausgliederung beteiligten Rechtsträger ist, wenn sie binnen sechs Monaten nach dem Tag, an dem die Eintragung der Ausgliederung nach den §§ 125 und 19 Abs. 3 UmwG  als bekannt gemacht gilt, ihren Anspruch nach Grund und Höhe schriftlich anmelden, Sicherheit zu leisten, soweit sie nicht Befriedigung verlangen können. Dieses Recht steht den Gläubigern jedoch nur zu, wenn sie glaubhaft machen, dass durch die Ausgliederung die Erfüllung ihrer Forderung gefährdet wird."
    },
    {
      "date": "2025-10-29",
      "id": "135676",
      "original_text": "Registerbekanntmachung nach dem Umwandlungsgesetz\nBrandenburg Amtsgericht Neuruppin HRB 3341\nBBG Beteiligungs- und Beratungsgesellschaft mbH – Hennigsdorf",
      "type": "Registerbekanntmachung nach dem Umwandlungsgesetz",
      "state": "Brandenburg",
      "amtsgericht": "Amtsgericht Neuruppin",
      "registernummer": "HRB 3341",
      "registerart": "HRB",
      "company_name": "BBG Beteiligungs- und Beratungsgesellschaft mbH",
      "company_seat": "Hennigsdorf",
      "details": "29.10.2025 (Bekanntmachungsdatum)\n\nBrandenburg Amtsgericht Neuruppin HRB 3341\nRegisterbekanntmachung nach dem Umwandlungsgesetz 28.10.2025 (Eintragungsdatum)\n\nBBG Beteiligungs- und Beratungsgesellschaft mbH\nGesellschaft mit beschränkter Haftung\nHennigsdorf\n\nZu Eintragungsnummer 11 vom 28.10.2025 wird als nicht eingetragen veröffentlicht:\nDen Gläubigern der an der Umwandlung beteiligten Rechtsträger ist, wenn sie binnen sechs Monaten nach dem Tag, an dem die Eintragung der Umwandlung in das Register des Sitzes desjenigen Rechtsträgers, dessen Gläubiger sie sind, als bekannt gemacht gilt, ihren Anspruch nach Grund und Höhe schriftlich anmelden, Sicherheit zu leisten, soweit sie nicht Befriedigung verlangen können. Dieses Recht steht den Gläubigern jedoch nur zu, wenn sie glaubhaft machen, dass durch die Umwandlung die Erfüllung ihrer Forderung gefährdet wird"
    },
    {
      "date": "2025-10-29",
      "id": "135677",
      "original_text": "Löschungsankündigung\nBaden-Württemberg Amtsgericht Stuttgart HRA 351815\nZIKA Leime und Klebstoffe L. Zimmermann GmbH + Co. KG – Pfullingen",
      "type": "Löschungsankündigung",
      "state": "Baden-Württemberg",
      "amtsgericht": "Amtsgericht Stuttgart",
      "registernummer": "HRA 351815",
      "registerart": "HRA",
      "company_name": "ZIKA Leime und Klebstoffe L. Zimmermann GmbH + Co. KG",
      "company_seat": "Pfullingen",
      "details": "29.10.2025 (Bekanntmachungsdatum)\n\nBaden-Württemberg Amtsgericht Stuttgart HRA 351815\nLöschungsankündigung\n\nZIKA Leime und Klebstoffe L. Zimmermann GmbH + Co. KG\nKommanditgesellschaft\nPfullingen\n\nDas Gericht beabsichtigt, die Gesellschaft wegen Vermögenslosigkeit im Handelsregister von Amts wegen nach § 394 FamFG zu löschen. Die Frist zur Geltendmachung eines Widerspruchs gegen die beabsichtigte Löschung ist auf zwei Monate ab Veröffentlichung bestimmt."
    },
    {
      "date": "2025-10-29",
      "id": "135678",
      "original_text": "Registerbekanntmachung nach dem Umwandlungsgesetz\nSaarland Amtsgericht Saarbrücken HRA 13009\nTechniplas PropCo GmbH & Co. KG – Spiesen-Elversberg",
      "type": "Registerbekanntmachung nach dem Umwandlungsgesetz",
      "state": "Saarland",
      "amtsgericht": "Amtsgericht Saarbrücken",
      "registernummer": "HRA 13009",
      "registerart": "HRA",
      "company_name": "Techniplas PropCo GmbH & Co. KG",
      "company_seat": "Spiesen-Elversberg",
      "details": "29.10.2025 (Bekanntmachungsdatum)\n\nSaarland Amtsgericht Saarbrücken HRA 13009\nRegisterbekanntmachung nach dem Umwandlungsgesetz 29.10.2025 (Eintragungsdatum)\n\nTechniplas PropCo GmbH & Co. KG\nKommanditgesellschaft\nSpiesen-Elversberg\n\nAls nicht eingetragen wird bekannt gemacht: Den Gläubigern der an der Verschmelzung beteiligten Gesellschaften ist, wenn sie binnen sechs Monaten nach dem Tag, an dem die Eintragung der Verschmelzung in das Register des Sitzes derjenigen Rechtsträger deren Gläubiger sie sind, nach § 19 Absatz 3 UmwG bekannt gemacht worden ist, ihren Anspruch nach Grund und Höhe schriftlich anmelden, Sicherheit zu leisten, soweit sie nicht Befriedigung verlangen können. Dieses Recht steht den Gläubigern jedoch nur zu, wenn sie glaubhaft machen, dass durch die Verschmelzung die Erfüllung ihrer Forderung gefährdet wird."
    },
    {
      "date": "2025-10-29",
      "id": "135679",
      "original_text": "Registerbekanntmachung nach dem Umwandlungsgesetz\nBaden-Württemberg Amtsgericht Stuttgart HRB 775407\nAUDERE LC-Invest No. 1 GmbH – Fellbach",
      "type": "Registerbekanntmachung nach dem Umwandlungsgesetz",
      "state": "Baden-Württemberg",
      "amtsgericht": "Amtsgericht Stuttgart",
      "registernummer": "HRB 775407",
      "registerart": "HRB",
      "company_name": "AUDERE LC-Invest No. 1 GmbH",
      "company_seat": "Fellbach",
      "details": "29.10.2025 (Bekanntmachungsdatum)\n\nBaden-Württemberg Amtsgericht Stuttgart HRB 775407\nRegisterbekanntmachung nach dem Umwandlungsgesetz 29.10.2025 (Eintragungsdatum)\n\nAUDERE LC-Invest No. 1 GmbH\nGesellschaft mit beschränkter Haftung\nFellbach\n\nDen Gläubigern der an der Verschmelzung beteiligten Rechtsträger ist, wenn sie binnen sechs Monaten nach dem Tag, an dem die Eintragung der Verschmelzung in das Register des Sitzes desjenigen Rechtsträgers, dessen Gläubiger sie sind, nach § 19 Abs. 3 UmwG als bekanntgemacht gilt, ihren Anspruch nach Grund und Höhe schriftlich anmelden, Sicherheit zu leisten, soweit sie nicht Befriedigung verlangen können. Dieses Recht steht den Gläubigern jedoch nur zu, wenn sie glaubhaft machen, dass durch die Verschmelzung die Erfüllung ihrer Forderung gefährdet wird."
    },
    {
      "date": "2025-10-29",
      "id": "135680",
      "original_text": "Registerbekanntmachung nach dem Umwandlungsgesetz\nBaden-Württemberg Amtsgericht Mannheim HRB 756137\nHellwig Elektrotechnik GmbH – Oberderdingen",
      "type": "Registerbekanntmachung nach dem Umwandlungsgesetz",
      "state": "Baden-Württemberg",
      "amtsgericht": "Amtsgericht Mannheim",
      "registernummer": "HRB 756137",
      "registerart": "HRB",
      "company_name": "Hellwig Elektrotechnik GmbH",
      "company_seat": "Oberderdingen",
      "details": "29.10.2025 (Bekanntmachungsdatum)\n\nBaden-Württemberg Amtsgericht Mannheim HRB 756137\nRegisterbekanntmachung nach dem Umwandlungsgesetz 29.10.2025 (Eintragungsdatum)\n\nHellwig Elektrotechnik GmbH\nGesellschaft mit beschränkter Haftung\nOberderdingen\n\nDen Gläubigern der an der Ausgliederung beteiligten Rechtsträger ist, wenn sie binnen sechs Monaten nach dem Tag, an dem die Eintragung der Ausgliederung in das Register des Sitzes desjenigen Rechtsträgers, dessen Gläubiger sie sind, nach § 19 Abs. 3 UmwG als bekanntgemacht gilt, ihren Anspruch nach Grund und Höhe schriftlich anmelden, Sicherheit zu leisten, soweit sie nicht Befriedigung verlangen können. Dieses Recht steht den Gläubigern jedoch nur zu, wenn sie glaubhaft machen, dass durch die Ausgliederung die Erfüllung ihrer Forderung gefährdet wird."
    },
    {
      "date": "2025-10-29",
      "id": "135681",
      "original_text": "Einreichung neuer Dokumente\nBerlin Amtsgericht Berlin (Charlottenburg) HRB 156627\nhello.de AG – Berlin",
      "type": "Einreichung neuer Dokumente",
      "state": "Berlin",
      "amtsgericht": "Amtsgericht Berlin (Charlottenburg)",
      "registernummer": "HRB 156627",
      "registerart": "HRB",
      "company_name": "hello.de AG",
      "company_seat": "Berlin",
      "details": "29.10.2025 (Bekanntmachungsdatum)\n\nBerlin Amtsgericht Berlin (Charlottenburg) HRB 156627\nEinreichung neuer Dokumente\n\nhello.de AG\nAktiengesellschaft\nBerlin\n\nAls nicht eingetragen wird veröffentlicht: Es wurde eine neue Liste der Aufsichtsratsmitglieder eingereicht (§ 106 AktG)."
    },
    {
      "date": "2025-10-29",
      "id": "135682",
      "original_text": "Einreichung neuer Dokumente\nBaden-Württemberg Amtsgericht Stuttgart HRB 380587\nWodtke GmbH – Tübingen",
      "type": "Einreichung neuer Dokumente",
      "state": "Baden-Württemberg",
      "amtsgericht": "Amtsgericht Stuttgart",
      "registernummer": "HRB 380587",
      "registerart": "HRB",
      "company_name": "Wodtke GmbH",
      "company_seat": "Tübingen",
      "details": "29.10.2025 (Bekanntmachungsdatum)\n\nBaden-Württemberg Amtsgericht Stuttgart HRB 380587\nEinreichung neuer Dokumente 29.10.2025 (Eintragungsdatum)\n\nWodtke GmbH\nGesellschaft mit beschränkter Haftung\nTübingen\n\nAls nicht eingetragen wird bekanntgemacht:\nDie Gesellschaft hat am 21.10.2025 die Liste über die Zusammensetzung des Aufsichtsrats zum Handelsregister eingereicht."
    },
    {
      "date": "2025-10-29",
      "id": "135683",
      "original_text": "Einreichung neuer Dokumente\nBaden-Württemberg Amtsgericht Stuttgart HRB 741544\nWERU GmbH – Rudersberg",
      "type": "Einreichung neuer Dokumente",
      "state": "Baden-Württemberg",
      "amtsgericht": "Amtsgericht Stuttgart",
      "registernummer": "HRB 741544",
      "registerart": "HRB",
      "company_name": "WERU GmbH",
      "company_seat": "Rudersberg",
      "details": "29.10.2025 (Bekanntmachungsdatum)\n\nBaden-Württemberg Amtsgericht Stuttgart HRB 741544\nEinreichung neuer Dokumente\n\nWERU GmbH\nGesellschaft mit beschränkter Haftung\nRudersberg\n\nDie Gesellschaft hat am 29.10.2025 die Liste über die Zusammensetzung des Aufsichtsrats zum Handelsregister eingereicht."
    },
    {
      "date": "2025-10-29",
      "id": "135684",
      "original_text": "Registerbekanntmachung nach dem Umwandlungsgesetz\nSchleswig-Holstein Amtsgericht Lübeck HRB 14458\nRatzeburger Grundstücks-Verwaltungs GmbH – Ratzeburg",
      "type": "Registerbekanntmachung nach dem Umwandlungsgesetz",
      "state": "Schleswig-Holstein",
      "amtsgericht": "Amtsgericht Lübeck",
      "registernummer": "HRB 14458",
      "registerart": "HRB",
      "company_name": "Ratzeburger Grundstücks-Verwaltungs GmbH",
      "company_seat": "Ratzeburg",
      "details": "29.10.2025 (Bekanntmachungsdatum)\n\nSchleswig-Holstein Amtsgericht Lübeck HRB 14458\nRegisterbekanntmachung nach dem Umwandlungsgesetz 29.10.2025 (Eintragungsdatum)\n\nRatzeburger Grundstücks-Verwaltungs GmbH\nGesellschaft mit beschränkter Haftung\nRatzeburg\n\nZu Eintragungsnummer 7 vom 29.10.2025 wird als nicht eingetragen veröffentlicht:  Den Gläubigern der an der Verschmelzung beteiligten Rechtsträger ist, wenn sie binnen sechs Monaten nach dem Tag, an dem die Eintragung der Verschmelzung in das Register des Sitzes desjenigen Rechtsträgers, dessen Gläubiger sie sind, als bekannt gemacht gilt, ihren Anspruch nach Grund und Höhe schriftlich anmelden, Sicherheit zu leisten, soweit sie nicht Befriedigung verlangen können. Dieses Recht steht den Gläubigern jedoch nur zu, wenn sie glaubhaft machen, dass durch die Verschmelzung die Erfüllung ihrer Forderung gefährdet wird."
    },
    {
      "date": "2025-10-29",
      "id": "135685",
      "original_text": "Löschungsankündigung\nSchleswig-Holstein Amtsgericht Pinneberg HRA 1454 ME\nA. Heinemann Heide GmbH & Co. Kommanditgesellschaft – Heide",
      "type": "Löschungsankündigung",
      "state": "Schleswig-Holstein",
      "amtsgericht": "Amtsgericht Pinneberg",
      "registernummer": "HRA 1454 ME",
      "registerart": "HRA",
      "company_name": "A. Heinemann Heide GmbH & Co. Kommanditgesellschaft",
      "company_seat": "Heide",
      "details": "29.10.2025 (Bekanntmachungsdatum)\n\nSchleswig-Holstein Amtsgericht Pinneberg HRA 1454 ME\nLöschungsankündigung\n\nA. Heinemann Heide GmbH & Co. Kommanditgesellschaft\nKommanditgesellschaft\nHeide\n\nEs ist die Löschung der nachstehenden Gesellschaft wegen Vermögenslosigkeit gemäß § 394 FamFG beabsichtigt. Widerspruchsfrist: 2 Monate."
    },
    {
      "date": "2025-10-29",
      "id": "135686",
      "original_text": "Löschungsankündigung\nBerlin Amtsgericht Berlin (Charlottenburg) HRB 188153\nBRENDO Dienstleistungen GmbH – Berlin",
      "type": "Löschungsankündigung",
      "state": "Berlin",
      "amtsgericht": "Amtsgericht Berlin (Charlottenburg)",
      "registernummer": "HRB 188153",
      "registerart": "HRB",
      "company_name": "BRENDO Dienstleistungen GmbH",
      "company_seat": "Berlin",
      "details": "29.10.2025 (Bekanntmachungsdatum)\n\nBerlin Amtsgericht Berlin (Charlottenburg) HRB 188153\nLöschungsankündigung\n\nBRENDO Dienstleistungen GmbH\nGesellschaft mit beschränkter Haftung\nBerlin\n\nBei der nachstehenden Gesellschaft wird das Amtslöschungsverfahren gemäß § 394 FamFG eingeleitet. Widerspruchsfrist 6 Wochen"
    },
    {
      "date": "2025-10-29",
      "id": "135687",
      "original_text": "Löschungsankündigung\nSachsen-Anhalt Amtsgericht Stendal HRB 30696\nDAR Bau GmbH – Magdeburg",
      "type": "Löschungsankündigung",
      "state": "Sachsen-Anhalt",
      "amtsgericht": "Amtsgericht Stendal",
      "registernummer": "HRB 30696",
      "registerart": "HRB",
      "company_name": "DAR Bau GmbH",
      "company_seat": "Magdeburg",
      "details": "29.10.2025 (Bekanntmachungsdatum)\n\nSachsen-Anhalt Amtsgericht Stendal HRB 30696\nLöschungsankündigung\n\nDAR Bau GmbH\nGesellschaft mit beschränkter Haftung\nMagdeburg\n\nDas Registergericht beabsichtigt, nachfolgende Gesellschaften wegen Vermögenslosigkeit von Amts wegen nach § 394 FamFG zu löschen. Die Frist zur Erhebung eines Widerspruchs gegen die beabsichtigte Löschung wird auf drei Monate festgesetzt."
    },
    {
      "date": "2025-10-29",
      "id": "135688",
      "original_text": "Registerbekanntmachung nach dem Umwandlungsgesetz\nBaden-Württemberg Amtsgericht Mannheim HRA 712158\nFabian Hellwig e.K. – Oberderdingen",
      "type": "Registerbekanntmachung nach dem Umwandlungsgesetz",
      "state": "Baden-Württemberg",
      "amtsgericht": "Amtsgericht Mannheim",
      "registernummer": "HRA 712158",
      "registerart": "HRA",
      "company_name": "Fabian Hellwig e.K.",
      "company_seat": "Oberderdingen",
      "details": "29.10.2025 (Bekanntmachungsdatum)\n\nBaden-Württemberg Amtsgericht Mannheim HRA 712158\nRegisterbekanntmachung nach dem Umwandlungsgesetz 29.10.2025 (Eintragungsdatum)\n\nFabian Hellwig e.K.\nEinzelkaufmann / Einzelkauffrau\nOberderdingen\n\nAls nicht eingetragen wird bekanntgemacht: Den Gläubigern der an der Ausgliederung beteiligten Rechtsträger ist, wenn sie binnen sechs Monaten nach dem Tag, an dem die Eintragung der Ausgliederung in das Register des Sitzes desjenigen Rechtsträgers, dessen Gläubiger sie sind, nach § 19 Abs. 3 UmwG als bekanntgemacht gilt, ihren Anspruch nach Grund und Höhe schriftlich anmelden, Sicherheit zu leisten, soweit sie nicht Befriedigung verlangen können. Dieses Recht steht den Gläubigern jedoch nur zu, wenn sie glaubhaft machen, dass durch die Ausgliederung die Erfüllung ihrer Forderung gefährdet wird."
    },
    {
      "date": "2025-10-29",
      "id": "135689",
      "original_text": "Löschungsankündigung\nSaarland Amtsgericht Saarbrücken HRB 13087\nSTUKKA GmbH – Lebach",
      "type": "Löschungsankündigung",
      "state": "Saarland",
      "amtsgericht": "Amtsgericht Saarbrücken",
      "registernummer": "HRB 13087",
      "registerart": "HRB",
      "company_name": "STUKKA GmbH",
      "company_seat": "Lebach",
      "details": "29.10.2025 (Bekanntmachungsdatum)\n\nSaarland Amtsgericht Saarbrücken HRB 13087\nLöschungsankündigung\n\nSTUKKA GmbH\nGesellschaft mit beschränkter Haftung\nLebach\n\nEs ist beabsichtigt, die Gesellschaft von Amts wegen gemäß § 394 FamFG wegen Vermögenslosigkeit zu löschen.\nGegen die Löschung von Amts wegen ist das Rechtsmittel des Widerspruchs statthaft. Der Widerspruch ist binnen einer Frist zwei Monaten beginnend mit dem Tag dieser Veröffentlichung durch Einreichen eines Widerspruchsschreibens -schriftlich oder zur Niederschrift der Geschäftsstelle beim Amtsgericht Saarbrücken, -zentrales Handelsregister-, Mainzerstr.178, 66121 Saarbrücken einzulegen.\nDer Widerspruch muss die Bezeichnung der angefochtenen Löschungsankündigung enthalten sowie die Erklärung, dass Widerspruch eingelegt wird. Er ist vom Widerspruchsführer oder seinem Bevollmächtigten zu unterzeichnen.\nDas Widerspruchsschreiben kann auch in der Form eines elektronischen Dokumentes eingereicht werden, das mit einer qualifizierten elektronischen Signatur nach dem Signaturgesetz versehen sein muss (§§ 14 Abs. 2 FamFG, 130a, 298 ZPO)."
    },
    {
      "date": "2025-10-29",
      "id": "135690",
      "original_text": "Löschungsankündigung\nBaden-Württemberg Amtsgericht Stuttgart HRB 760692\nSH Gebäudemanagement GmbH – Stuttgart",
      "type": "Löschungsankündigung",
      "state": "Baden-Württemberg",
      "amtsgericht": "Amtsgericht Stuttgart",
      "registernummer": "HRB 760692",
      "registerart": "HRB",
      "company_name": "SH Gebäudemanagement GmbH",
      "company_seat": "Stuttgart",
      "details": "29.10.2025 (Bekanntmachungsdatum)\n\nBaden-Württemberg Amtsgericht Stuttgart HRB 760692\nLöschungsankündigung\n\nSH Gebäudemanagement GmbH\nGesellschaft mit beschränkter Haftung\nStuttgart\n\nAls nicht eingetragen wird bekanntgemacht:\nDas Gericht beabsichtigt, die Gesellschaft wegen Vermögenslosigkeit im Handelsregister von Amts wegen nach § 394 FamFG zu löschen. Die Frist zur Geltendmachung eines Widerspruchs gegen die beabsichtigte Löschung ist auf zwei Monate ab Veröffentlichung bestimmt."
    },
    {
      "date": "2025-10-29",
      "id": "135691",
      "original_text": "Einreichung neuer Dokumente\nBaden-Württemberg Amtsgericht Freiburg HRB 721802\nALDI Verwaltungs-SE VI – Mahlberg",
      "type": "Einreichung neuer Dokumente",
      "state": "Baden-Württemberg",
      "amtsgericht": "Amtsgericht Freiburg",
      "registernummer": "HRB 721802",
      "registerart": "HRB",
      "company_name": "ALDI Verwaltungs-SE VI",
      "company_seat": "Mahlberg",
      "details": "29.10.2025 (Bekanntmachungsdatum)\n\nBaden-Württemberg Amtsgericht Freiburg HRB 721802\nEinreichung neuer Dokumente\n\nALDI Verwaltungs-SE VI\nEuropäische Aktiengesellschaft (SE)\nMahlberg\n\nDie Gesellschaft hat am 24.10.2025 die Liste über die Zusammensetzung des Aufsichtsrats zum Handelsregister eingereicht."
    },
    {
      "date": "2025-10-29",
      "id": "135692",
      "original_text": "Einreichung neuer Dokumente\nSachsen Amtsgericht Dresden HRB 22959\nAgrargesellschaft Ruppendorf AG – Klingenberg",
      "type": "Einreichung neuer Dokumente",
      "state": "Sachsen",
      "amtsgericht": "Amtsgericht Dresden",
      "registernummer": "HRB 22959",
      "registerart": "HRB",
      "company_name": "Agrargesellschaft Ruppendorf AG",
      "company_seat": "Klingenberg",
      "details": "29.10.2025 (Bekanntmachungsdatum)\n\nSachsen Amtsgericht Dresden HRB 22959\nEinreichung neuer Dokumente 29.10.2025 (Eintragungsdatum)\n\nAgrargesellschaft Ruppendorf AG\nAktiengesellschaft\nKlingenberg\n\nAm 27.10.2025 wurde beim Handelsregister des Amtsgerichts Dresden die Liste der Mitglieder des Aufsichtsrats gemäß § 106 AktG eingereicht."
    },
    {
      "date": "2025-10-29",
      "id": "135693",
      "original_text": "Registerbekanntmachung nach dem Umwandlungsgesetz\nSachsen Amtsgericht Chemnitz HRB 4346\nRFC Radio-, Fernseh- u. Computertechnik GmbH – Chemnitz",
      "type": "Registerbekanntmachung nach dem Umwandlungsgesetz",
      "state": "Sachsen",
      "amtsgericht": "Amtsgericht Chemnitz",
      "registernummer": "HRB 4346",
      "registerart": "HRB",
      "company_name": "RFC Radio-, Fernseh- u. Computertechnik GmbH",
      "company_seat": "Chemnitz",
      "details": "29.10.2025 (Bekanntmachungsdatum)\n\nSachsen Amtsgericht Chemnitz HRB 4346\nRegisterbekanntmachung nach dem Umwandlungsgesetz 29.10.2025 (Eintragungsdatum)\n\nRFC Radio-, Fernseh- u. Computertechnik GmbH\nGesellschaft mit beschränkter Haftung\nChemnitz\n\nDen Gläubigern der an der Verschmelzung beteiligten Rechtsträger ist, wenn sie binnen sechs Monaten nach dem Tag, an dem die Eintragung der Verschmelzung in das Register des Sitzes desjenigen Rechtsträgers, dessen Gläubiger sie sind, nach § 19 Abs. 3 UmwG als bekannt gemacht gilt, ihren Anspruch nach Grund und Höhe in Textform anmelden, Sicherheit zu leisten, soweit sie nicht Befriedigung verlangen können. Dieses Recht steht den Gläubigern jedoch nur zu, wenn sie glaubhaft machen, dass durch die Verschmelzung die Erfüllung der Forderung gefährdet wird."
    },
    {
      "date": "2025-10-29",
      "id": "135694",
      "original_text": "Löschungsankündigung\nNiedersachsen Amtsgericht Lüneburg HRB 202118\nAWS Investment UG (haftungsbeschränkt) – Lüneburg",
      "type": "Löschungsankündigung",
      "state": "Niedersachsen",
      "amtsgericht": "Amtsgericht Lüneburg",
      "registernummer": "HRB 202118",
      "registerart": "HRB",
      "company_name": "AWS Investment UG (haftungsbeschränkt)",
      "company_seat": "Lüneburg",
      "details": "29.10.2025 (Bekanntmachungsdatum)\n\nNiedersachsen Amtsgericht Lüneburg HRB 202118\nLöschungsankündigung 29.10.2025 (Eintragungsdatum)\n\nAWS Investment UG (haftungsbeschränkt)\nGesellschaft mit beschränkter Haftung\nLüneburg\n\nDas Registergericht beabsichtigt, die Gesellschaft von Amts wegen nach § 394 FamFG zu löschen. Die Frist zur Erhebung eines Widerspruchs ist auf 1 Monat ab dieser Registerbekanntmachung festgesetzt."
    },
    {
      "date": "2025-10-29",
      "id": "135695",
      "original_text": "Registerbekanntmachung nach dem Umwandlungsgesetz\nNiedersachsen Amtsgericht Walsrode HRB 208238\nImmobilien an der Weser GmbH – Nienburg",
      "type": "Registerbekanntmachung nach dem Umwandlungsgesetz",
      "state": "Niedersachsen",
      "amtsgericht": "Amtsgericht Walsrode",
      "registernummer": "HRB 208238",
      "registerart": "HRB",
      "company_name": "Immobilien an der Weser GmbH",
      "company_seat": "Nienburg",
      "details": "29.10.2025 (Bekanntmachungsdatum)\n\nNiedersachsen Amtsgericht Walsrode HRB 208238\nRegisterbekanntmachung nach dem Umwandlungsgesetz 29.10.2025 (Eintragungsdatum)\n\nImmobilien an der Weser GmbH\nGesellschaft mit beschränkter Haftung\nNienburg\n\nDen Gläubigern der an der Verschmelzung beteiligten Rechtsträger ist, wenn sie binnen sechs Monaten nach dem Tag, an dem die Eintragung der Verschmelzung in das Register des Sitzes desjenigen Rechtsträgers, dessen Gläubiger sie sind, nach § 19  Abs.  3 UmwG als bekannt gemacht gilt, ihren Anspruch nach Grund und Höhe schriftlich anmelden, Sicherheit zu leisten, soweit sie nicht Befriedigung verlangen können. Dieses Recht steht den Gläubigern jedoch nur zu, wenn sie glaubhaft machen, dass durch die Verschmelzung die Erfüllung der Forderung gefährdet wird."
    },
    {
      "date": "2025-10-29",
      "id": "135696",
      "original_text": "Registerbekanntmachung nach dem Umwandlungsgesetz\nNiedersachsen Amtsgericht Walsrode HRB 100343\nHeli-Charter Verwaltungs-GmbH – Wagenfeld-Ströhen",
      "type": "Registerbekanntmachung nach dem Umwandlungsgesetz",
      "state": "Niedersachsen",
      "amtsgericht": "Amtsgericht Walsrode",
      "registernummer": "HRB 100343",
      "registerart": "HRB",
      "company_name": "Heli-Charter Verwaltungs-GmbH",
      "company_seat": "Wagenfeld-Ströhen",
      "details": "29.10.2025 (Bekanntmachungsdatum)\n\nNiedersachsen Amtsgericht Walsrode HRB 100343\nRegisterbekanntmachung nach dem Umwandlungsgesetz 29.10.2025 (Eintragungsdatum)\n\nHeli-Charter Verwaltungs-GmbH\nGesellschaft mit beschränkter Haftung\nWagenfeld-Ströhen\n\nDen Gläubigern der an der Verschmelzung beteiligten Rechtsträger ist, wenn sie binnen sechs Monaten nach dem Tag, an dem die Eintragung der Verschmelzung in das Register des Sitzes desjenigen Rechtsträgers, dessen Gläubiger sie sind, nach § 19  Abs.  3 UmwG als bekannt gemacht gilt, ihren Anspruch nach Grund und Höhe schriftlich anmelden, Sicherheit zu leisten, soweit sie nicht Befriedigung verlangen können. Dieses Recht steht den Gläubigern jedoch nur zu, wenn sie glaubhaft machen, dass durch die Verschmelzung die Erfüllung der Forderung gefährdet wird."
    },
    {
      "date": "2025-10-29",
      "id": "135697",
      "original_text": "Registerbekanntmachung nach dem Umwandlungsgesetz\nNiedersachsen Amtsgericht Göttingen HRB 200234\nHarz Energie Netz GmbH – Osterode",
      "type": "Registerbekanntmachung nach dem Umwandlungsgesetz",
      "state": "Niedersachsen",
      "amtsgericht": "Amtsgericht Göttingen",
      "registernummer": "HRB 200234",
      "registerart": "HRB",
      "company_name": "Harz Energie Netz GmbH",
      "company_seat": "Osterode",
      "details": "29.10.2025 (Bekanntmachungsdatum)\n\nNiedersachsen Amtsgericht Göttingen HRB 200234\nRegisterbekanntmachung nach dem Umwandlungsgesetz 29.10.2025 (Eintragungsdatum)\n\nHarz Energie Netz GmbH\nGesellschaft mit beschränkter Haftung\nOsterode\n\nDen Gläubigern der an der Abspaltung beteiligten Rechtsträger ist, wenn sie binnen sechs Monaten nach dem Tag, an dem die Eintragung der Abspaltung in das Register des Sitzes desjenigen Rechtsträgers, dessen Gläubiger sie sind, nach § 19 Abs. 3 UmwG als bekannt gemacht gilt, ihren Anspruch nach Grund und Höhe schriftlich anmelden, Sicherheit zu leisten, soweit sie nicht Befriedigung verlangen können. Dieses Recht steht den Gläubigern jedoch nur zu, wenn sie glaubhaft machen, dass durch die Abspaltung die Erfüllung der Forderung gefährdet wird."
    },
    {
      "date": "2025-10-29",
      "id": "135698",
      "original_text": "Einreichung neuer Dokumente\nNiedersachsen Amtsgericht Osnabrück HRB 202587\nWGO Wohnungsservicegesellschaft Osnabrück mbH – Osnabrück",
      "type": "Einreichung neuer Dokumente",
      "state": "Niedersachsen",
      "amtsgericht": "Amtsgericht Osnabrück",
      "registernummer": "HRB 202587",
      "registerart": "HRB",
      "company_name": "WGO Wohnungsservicegesellschaft Osnabrück mbH",
      "company_seat": "Osnabrück",
      "details": "29.10.2025 (Bekanntmachungsdatum)\n\nNiedersachsen Amtsgericht Osnabrück HRB 202587\nEinreichung neuer Dokumente 29.10.2025 (Eintragungsdatum)\n\nWGO Wohnungsservicegesellschaft Osnabrück mbH\nGesellschaft mit beschränkter Haftung\nOsnabrück\n\nDie Liste der Mitglieder des Aufsichtsrats wurde beim Registergericht eingereicht."
    },
    {
      "date": "2025-10-29",
      "id": "135699",
      "original_text": "Einreichung neuer Dokumente\nNiedersachsen Amtsgericht Oldenburg (Oldenburg) HRB 221074\nRemmers Gruppe SE – Löningen",
      "type": "Einreichung neuer Dokumente",
      "state": "Niedersachsen",
      "amtsgericht": "Amtsgericht Oldenburg (Oldenburg)",
      "registernummer": "HRB 221074",
      "registerart": "HRB",
      "company_name": "Remmers Gruppe SE",
      "company_seat": "Löningen",
      "details": "29.10.2025 (Bekanntmachungsdatum)\n\nNiedersachsen Amtsgericht Oldenburg (Oldenburg) HRB 221074\nEinreichung neuer Dokumente\n\nRemmers Gruppe SE\nEuropäische Aktiengesellschaft (SE)\nLöningen\n\nDie Liste der Mitglieder des Aufsichtsrats wurde beim Registergericht eingereicht."
    },
    {
      "date": "2025-10-29",
      "id": "135700",
      "original_text": "Registerbekanntmachung nach dem Umwandlungsgesetz\nNiedersachsen Amtsgericht Oldenburg (Oldenburg) HRB 221612\nHartwich Holding GmbH – Delmenhorst",
      "type": "Registerbekanntmachung nach dem Umwandlungsgesetz",
      "state": "Niedersachsen",
      "amtsgericht": "Amtsgericht Oldenburg (Oldenburg)",
      "registernummer": "HRB 221612",
      "registerart": "HRB",
      "company_name": "Hartwich Holding GmbH",
      "company_seat": "Delmenhorst",
      "details": "29.10.2025 (Bekanntmachungsdatum)\n\nNiedersachsen Amtsgericht Oldenburg (Oldenburg) HRB 221612\nRegisterbekanntmachung nach dem Umwandlungsgesetz 29.10.2025 (Eintragungsdatum)\n\nHartwich Holding GmbH\nGesellschaft mit beschränkter Haftung\nDelmenhorst\n\nDen Gläubigern der an der Verschmelzung beteiligten Rechtsträger ist, wenn sie binnen sechs Monaten nach dem Tag, an dem die Eintragung der Verschmelzung in das Register des Sitzes desjenigen Rechtsträgers, dessen Gläubiger sie sind, nach § 19  Abs.  3 UmwG als bekannt gemacht gilt, ihren Anspruch nach Grund und Höhe schriftlich anmelden, Sicherheit zu leisten, soweit sie nicht Befriedigung verlangen können. Dieses Recht steht den Gläubigern jedoch nur zu, wenn sie glaubhaft machen, dass durch die Verschmelzung die Erfüllung der Forderung gefährdet wird.\nDen Gläubigern der an der Verschmelzung beteiligten Rechtsträger ist, wenn sie binnen sechs Monaten nach dem Tag, an dem die Eintragung der Verschmelzung in das Register des Sitzes desjenigen Rechtsträgers, dessen Gläubiger sie sind, nach § 19  Abs.  3 UmwG als bekannt gemacht gilt, ihren Anspruch nach Grund und Höhe schriftlich anmelden, Sicherheit zu leisten, soweit sie nicht Befriedigung verlangen können. Dieses Recht steht den Gläubigern jedoch nur zu, wenn sie glaubhaft machen, dass durch die Verschmelzung die Erfüllung der Forderung gefährdet wird."
    },
    {
      "date": "2025-10-29",
      "id": "135701",
      "original_text": "Registerbekanntmachung nach dem Umwandlungsgesetz\nNiedersachsen Amtsgericht Walsrode HRB 208161\nD&S Immobilien GmbH – Nienburg",
      "type": "Registerbekanntmachung nach dem Umwandlungsgesetz",
      "state": "Niedersachsen",
      "amtsgericht": "Amtsgericht Walsrode",
      "registernummer": "HRB 208161",
      "registerart": "HRB",
      "company_name": "D&S Immobilien GmbH",
      "company_seat": "Nienburg",
      "details": "29.10.2025 (Bekanntmachungsdatum)\n\nNiedersachsen Amtsgericht Walsrode HRB 208161\nRegisterbekanntmachung nach dem Umwandlungsgesetz 29.10.2025 (Eintragungsdatum)\n\nD&S Immobilien GmbH\nGesellschaft mit beschränkter Haftung\nNienburg\n\nDen Gläubigern der an der Verschmelzung beteiligten Rechtsträger ist, wenn sie binnen sechs Monaten nach dem Tag, an dem die Eintragung der Verschmelzung in das Register des Sitzes desjenigen Rechtsträgers, dessen Gläubiger sie sind, nach § 19  Abs.  3 UmwG als bekannt gemacht gilt, ihren Anspruch nach Grund und Höhe schriftlich anmelden, Sicherheit zu leisten, soweit sie nicht Befriedigung verlangen können. Dieses Recht steht den Gläubigern jedoch nur zu, wenn sie glaubhaft machen, dass durch die Verschmelzung die Erfüllung der Forderung gefährdet wird."
    },
    {
      "date": "2025-10-29",
      "id": "135702",
      "original_text": "Registerbekanntmachung nach dem Umwandlungsgesetz\nNiedersachsen Amtsgericht Walsrode HRB 100147\nHenke GmbH – Wagenfeld",
      "type": "Registerbekanntmachung nach dem Umwandlungsgesetz",
      "state": "Niedersachsen",
      "amtsgericht": "Amtsgericht Walsrode",
      "registernummer": "HRB 100147",
      "registerart": "HRB",
      "company_name": "Henke GmbH",
      "company_seat": "Wagenfeld",
      "details": "29.10.2025 (Bekanntmachungsdatum)\n\nNiedersachsen Amtsgericht Walsrode HRB 100147\nRegisterbekanntmachung nach dem Umwandlungsgesetz 29.10.2025 (Eintragungsdatum)\n\nHenke GmbH\nGesellschaft mit beschränkter Haftung\nWagenfeld\n\nDen Gläubigern der an der Verschmelzung beteiligten Rechtsträger ist, wenn sie binnen sechs Monaten nach dem Tag, an dem die Eintragung der Verschmelzung in das Register des Sitzes desjenigen Rechtsträgers, dessen Gläubiger sie sind, nach § 19  Abs.  3 UmwG als bekannt gemacht gilt, ihren Anspruch nach Grund und Höhe schriftlich anmelden, Sicherheit zu leisten, soweit sie nicht Befriedigung verlangen können. Dieses Recht steht den Gläubigern jedoch nur zu, wenn sie glaubhaft machen, dass durch die Verschmelzung die Erfüllung der Forderung gefährdet wird."
    },
    {
      "date": "2025-10-29",
      "id": "135703",
      "original_text": "Registerbekanntmachung nach dem Umwandlungsgesetz\nNiedersachsen Amtsgericht Tostedt HRA 204832\nTopsun Terrassen und Markisen Lars Riebesell e. K. – Otter",
      "type": "Registerbekanntmachung nach dem Umwandlungsgesetz",
      "state": "Niedersachsen",
      "amtsgericht": "Amtsgericht Tostedt",
      "registernummer": "HRA 204832",
      "registerart": "HRA",
      "company_name": "Topsun Terrassen und Markisen Lars Riebesell e. K.",
      "company_seat": "Otter",
      "details": "29.10.2025 (Bekanntmachungsdatum)\n\nNiedersachsen Amtsgericht Tostedt HRA 204832\nRegisterbekanntmachung nach dem Umwandlungsgesetz 29.10.2025 (Eintragungsdatum)\n\nTopsun Terrassen und Markisen Lars Riebesell e. K.\nEinzelkaufmann / Einzelkauffrau\nOtter\n\nDen Gläubigern der an der Ausgliederung beteiligten Rechtsträger ist, wenn sie binnen sechs Monaten nach dem Tag, an dem die Eintragung der Ausgliederung in das Register des Sitzes desjenigen Rechtsträgers, dessen Gläubiger sie sind, nach § 19 Abs. 3 UmwG als bekannt gemacht gilt, ihren Anspruch nach Grund und Höhe schriftlich anmelden, Sicherheit zu leisten, soweit sie nicht Befriedigung verlangen können. Dieses Recht steht den Gläubigern jedoch nur zu, wenn sie glaubhaft machen, dass durch die Ausgliederung die Erfüllung der Forderung gefährdet wird."
    },
    {
      "date": "2025-10-29",
      "id": "135704",
      "original_text": "Registerbekanntmachung nach dem Umwandlungsgesetz\nNiedersachsen Amtsgericht Tostedt HRB 206194\nTopSun Dienstleistungs- und Beratungsgesellschaft mbH – Otter",
      "type": "Registerbekanntmachung nach dem Umwandlungsgesetz",
      "state": "Niedersachsen",
      "amtsgericht": "Amtsgericht Tostedt",
      "registernummer": "HRB 206194",
      "registerart": "HRB",
      "company_name": "TopSun Dienstleistungs- und Beratungsgesellschaft mbH",
      "company_seat": "Otter",
      "details": "29.10.2025 (Bekanntmachungsdatum)\n\nNiedersachsen Amtsgericht Tostedt HRB 206194\nRegisterbekanntmachung nach dem Umwandlungsgesetz 29.10.2025 (Eintragungsdatum)\n\nTopSun Dienstleistungs- und Beratungsgesellschaft mbH\nGesellschaft mit beschränkter Haftung\nOtter\n\nDen Gläubigern der an der Ausgliederung beteiligten Rechtsträger ist, wenn sie binnen sechs Monaten nach dem Tag, an dem die Eintragung der Ausgliederung in das Register des Sitzes desjenigen Rechtsträgers, dessen Gläubiger sie sind, nach § 19 Abs. 3 UmwG als bekannt gemacht gilt, ihren Anspruch nach Grund und Höhe schriftlich anmelden, Sicherheit zu leisten, soweit sie nicht Befriedigung verlangen können. Dieses Recht steht den Gläubigern jedoch nur zu, wenn sie glaubhaft machen, dass durch die Ausgliederung die Erfüllung der Forderung gefährdet wird."
    },
    {
      "date": "2025-10-29",
      "id": "135705",
      "original_text": "Registerbekanntmachung nach dem Umwandlungsgesetz\nNiedersachsen Amtsgericht Hannover HRB 224909\nGETEC Stiftung Vermögensverwaltung GmbH – Hannover",
      "type": "Registerbekanntmachung nach dem Umwandlungsgesetz",
      "state": "Niedersachsen",
      "amtsgericht": "Amtsgericht Hannover",
      "registernummer": "HRB 224909",
      "registerart": "HRB",
      "company_name": "GETEC Stiftung Vermögensverwaltung GmbH",
      "company_seat": "Hannover",
      "details": "29.10.2025 (Bekanntmachungsdatum)\n\nNiedersachsen Amtsgericht Hannover HRB 224909\nRegisterbekanntmachung nach dem Umwandlungsgesetz 29.10.2025 (Eintragungsdatum)\n\nGETEC Stiftung Vermögensverwaltung GmbH\nGesellschaft mit beschränkter Haftung\nHannover\n\nDen Gläubigern der an der Abspaltung beteiligten Rechtsträger ist, wenn sie binnen sechs Monaten nach dem Tag, an dem die Eintragung der Abspaltung in das Register des Sitzes desjenigen Rechtsträgers, dessen Gläubiger sie sind, nach § 19 Abs. 3 UmwG als bekannt gemacht gilt, ihren Anspruch nach Grund und Höhe schriftlich anmelden, Sicherheit zu leisten, soweit sie nicht Befriedigung verlangen können. Dieses Recht steht den Gläubigern jedoch nur zu, wenn sie glaubhaft machen, dass durch die Abspaltung die Erfüllung der Forderung gefährdet wird."
    },
    {
      "date": "2025-10-29",
      "id": "135706",
      "original_text": "Löschungsankündigung\nNiedersachsen Amtsgericht Tostedt HRB 208775\nMeydi Group GmbH – Stade",
      "type": "Löschungsankündigung",
      "state": "Niedersachsen",
      "amtsgericht": "Amtsgericht Tostedt",
      "registernummer": "HRB 208775",
      "registerart": "HRB",
      "company_name": "Meydi Group GmbH",
      "company_seat": "Stade",
      "details": "29.10.2025 (Bekanntmachungsdatum)\n\nNiedersachsen Amtsgericht Tostedt HRB 208775\nLöschungsankündigung\n\nMeydi Group GmbH\nGesellschaft mit beschränkter Haftung\nStade\n\nDas Registergericht beabsichtigt, die Gesellschaft von Amts wegen nach § 394 FamFG zu löschen. Die Frist zur Erhebung eines Widerspruchs ist auf 1 Monat ab dieser Registerbekanntmachung festgesetzt."
    },
    {
      "date": "2025-10-29",
      "id": "135707",
      "original_text": "Registerbekanntmachung nach dem Umwandlungsgesetz\nNiedersachsen Amtsgericht Hannover HRB 215098\nGETEC Energie Holding GmbH – Hannover",
      "type": "Registerbekanntmachung nach dem Umwandlungsgesetz",
      "state": "Niedersachsen",
      "amtsgericht": "Amtsgericht Hannover",
      "registernummer": "HRB 215098",
      "registerart": "HRB",
      "company_name": "GETEC Energie Holding GmbH",
      "company_seat": "Hannover",
      "details": "29.10.2025 (Bekanntmachungsdatum)\n\nNiedersachsen Amtsgericht Hannover HRB 215098\nRegisterbekanntmachung nach dem Umwandlungsgesetz 29.10.2025 (Eintragungsdatum)\n\nGETEC Energie Holding GmbH\nGesellschaft mit beschränkter Haftung\nHannover\n\nDen Gläubigern der an der Abspaltung beteiligten Rechtsträger ist, wenn sie binnen sechs Monaten nach dem Tag, an dem die Eintragung der Aufspaltung in das Register des Sitzes desjenigen Rechtsträgers, dessen Gläubiger sie sind, nach § 19 Abs. 3 UmwG als bekannt gemacht gilt, ihren Anspruch nach Grund und Höhe schriftlich anmelden, Sicherheit zu leisten, soweit sie nicht Befriedigung verlangen können. Dieses Recht steht den Gläubigern jedoch nur zu, wenn sie glaubhaft machen, dass durch die Abspaltung die Erfüllung der Forderung gefährdet wird."
    },
    {
      "date": "2025-10-29",
      "id": "135708",
      "original_text": "Einreichung neuer Dokumente\nBaden-Württemberg Amtsgericht Stuttgart HRB 24542\nSV SparkassenVersicherung Lebensversicherung Aktiengesellschaft – Stuttgart",
      "type": "Einreichung neuer Dokumente",
      "state": "Baden-Württemberg",
      "amtsgericht": "Amtsgericht Stuttgart",
      "registernummer": "HRB 24542",
      "registerart": "HRB",
      "company_name": "SV SparkassenVersicherung Lebensversicherung Aktiengesellschaft",
      "company_seat": "Stuttgart",
      "details": "29.10.2025 (Bekanntmachungsdatum)\n\nBaden-Württemberg Amtsgericht Stuttgart HRB 24542\nEinreichung neuer Dokumente\n\nSV SparkassenVersicherung Lebensversicherung Aktiengesellschaft\nAktiengesellschaft\nStuttgart\n\nDie Gesellschaft hat am 28.10.2025 die Liste über die Zusammensetzung des Aufsichtsrats zum Handelsregister eingereicht."
    },
    {
      "date": "2025-10-29",
      "id": "135709",
      "original_text": "Löschungsankündigung\nBremen Amtsgericht Bremen HRB 38036\nGkogkas Bau UG (haftungsbeschränkt) – Bremen",
      "type": "Löschungsankündigung",
      "state": "Bremen",
      "amtsgericht": "Amtsgericht Bremen",
      "registernummer": "HRB 38036",
      "registerart": "HRB",
      "company_name": "Gkogkas Bau UG (haftungsbeschränkt)",
      "company_seat": "Bremen",
      "details": "29.10.2025 (Bekanntmachungsdatum)\n\nBremen Amtsgericht Bremen HRB 38036\nLöschungsankündigung\n\nGkogkas Bau UG (haftungsbeschränkt)\nGesellschaft mit beschränkter Haftung\nBremen\n\nEs ist beabsichtigt die im Handelsregister eingetragene Gesellschaft von Amts wegen gemäß § 394 FamFG zu löschen. Gegen die Löschung kann beim AG Bremen schriftlich oder zu Protokoll der Geschäftsstelle Widerspruch eingelegt werden. Widerspruchsfrist 4 Wochen."
    },
    {
      "date": "2025-10-29",
      "id": "135710",
      "original_text": "Einreichung neuer Dokumente\nBremen Amtsgericht Bremen HRB 41988\nBLACKFIELD AI AG – Bremen",
      "type": "Einreichung neuer Dokumente",
      "state": "Bremen",
      "amtsgericht": "Amtsgericht Bremen",
      "registernummer": "HRB 41988",
      "registerart": "HRB",
      "company_name": "BLACKFIELD AI AG",
      "company_seat": "Bremen",
      "details": "29.10.2025 (Bekanntmachungsdatum)\n\nBremen Amtsgericht Bremen HRB 41988\nEinreichung neuer Dokumente\n\nBLACKFIELD AI AG\nAktiengesellschaft\nBremen\n\nAls nicht eingetragen wird bekannt gemacht: Liste des Aufsichtsrats wurde eingereicht."
    },
    {
      "date": "2025-10-29",
      "id": "135711",
      "original_text": "Einreichung neuer Dokumente\nRheinland-Pfalz Amtsgericht Ludwigshafen a.Rhein (Ludwigshafen) HRB 64198\nSuperior Industries Europe AG – Bad Dürkheim",
      "type": "Einreichung neuer Dokumente",
      "state": "Rheinland-Pfalz",
      "amtsgericht": "Amtsgericht Ludwigshafen a.Rhein (Ludwigshafen)",
      "registernummer": "HRB 64198",
      "registerart": "HRB",
      "company_name": "Superior Industries Europe AG",
      "company_seat": "Bad Dürkheim",
      "details": "29.10.2025 (Bekanntmachungsdatum)\n\nRheinland-Pfalz Amtsgericht Ludwigshafen a.Rhein (Ludwigshafen) HRB 64198\nEinreichung neuer Dokumente\n\nSuperior Industries Europe AG\nAktiengesellschaft\nBad Dürkheim\n\nDem Registergericht ist eine Liste der Mitglieder des Aufsichtsrates eingereicht worden."
    },
    {
      "date": "2025-10-29",
      "id": "135712",
      "original_text": "Einreichung neuer Dokumente\nRheinland-Pfalz Amtsgericht Ludwigshafen a.Rhein (Ludwigshafen) HRB 62108\nJoseph Vögele Aktiengesellschaft – Ludwigshafen/Rhein",
      "type": "Einreichung neuer Dokumente",
      "state": "Rheinland-Pfalz",
      "amtsgericht": "Amtsgericht Ludwigshafen a.Rhein (Ludwigshafen)",
      "registernummer": "HRB 62108",
      "registerart": "HRB",
      "company_name": "Joseph Vögele Aktiengesellschaft",
      "company_seat": "Ludwigshafen/Rhein",
      "details": "29.10.2025 (Bekanntmachungsdatum)\n\nRheinland-Pfalz Amtsgericht Ludwigshafen a.Rhein (Ludwigshafen) HRB 62108\nEinreichung neuer Dokumente 29.10.2025 (Eintragungsdatum)\n\nJoseph Vögele Aktiengesellschaft\nAktiengesellschaft\nLudwigshafen/Rhein\n\nDem Registergericht ist eine Liste der Mitglieder des Aufsichtsrates eingereicht worden."
    },
    {
      "date": "2025-10-29",
      "id": "135713",
      "original_text": "Löschungsankündigung\nRheinland-Pfalz Amtsgericht Ludwigshafen a.Rhein (Ludwigshafen) HRB 64376\nMega-Stone Bau GmbH – Ludwigshafen am Rhein",
      "type": "Löschungsankündigung",
      "state": "Rheinland-Pfalz",
      "amtsgericht": "Amtsgericht Ludwigshafen a.Rhein (Ludwigshafen)",
      "registernummer": "HRB 64376",
      "registerart": "HRB",
      "company_name": "Mega-Stone Bau GmbH",
      "company_seat": "Ludwigshafen am Rhein",
      "details": "29.10.2025 (Bekanntmachungsdatum)\n\nRheinland-Pfalz Amtsgericht Ludwigshafen a.Rhein (Ludwigshafen) HRB 64376\nLöschungsankündigung\n\nMega-Stone Bau GmbH\nGesellschaft mit beschränkter Haftung\nLudwigshafen am Rhein\n\nDas Registergericht beabsichtigt die Gesellschaft von Amts wegen nach § 394 FamFG zu löschen. Die Frist zur Erhebung eines Widerspruchs ist auf einen Monat festgesetzt."
    },
    {
      "date": "2025-10-29",
      "id": "135714",
      "original_text": "Löschungsankündigung\nNordrhein-Westfalen Amtsgericht Aachen HRB 23064\nVerda Trading GmbH – Stolberg",
      "type": "Löschungsankündigung",
      "state": "Nordrhein-Westfalen",
      "amtsgericht": "Amtsgericht Aachen",
      "registernummer": "HRB 23064",
      "registerart": "HRB",
      "company_name": "Verda Trading GmbH",
      "company_seat": "Stolberg",
      "details": "29.10.2025 (Bekanntmachungsdatum)\n\nNordrhein-Westfalen Amtsgericht Aachen HRB 23064\nLöschungsankündigung\n\nVerda Trading GmbH\nGesellschaft mit beschränkter Haftung\nStolberg\n\nDas Registergericht beabsichtigt, von Amts wegen die Gesellschaft wegen Vermögenslosigkeit nach § 394 FamFG zu löschen weil das Insolvenzverfahren Amtsgericht Aachen (Az.: 91 IN 112/25 ) beendet und Vermögen der Gesellschaft nicht mehr erkennbar ist.\n\nZur Geltendmachung des Widerspruchs gegen die beabsichtigte Löschung wird hiermit eine Frist von einem Monat ab Veröffentlichung dieser Ankündigung bestimmt.\n\nRechtsbehelfsbelehrung:\n\nGegen diese Verfügung kann Widerspruch eingelegt werden. Zum Widerspruch ist jeder berechtigt, der an der Unterlassung der Löschung ein berechtigtes Interesse hat.\n\nDer Widerspruch ist bei dem Amtsgericht Aachen, Adalbertsteinweg 92, 52070 Aachen schriftlich in deutscher Sprache oder zur Niederschrift der Geschäftsstelle einzulegen. Der Widerspruch kann auch zur Niederschrift der Geschäftsstelle eines jeden Amtsgerichtes abgegeben werden.\n\nDer Widerspruch muss spätestens innerhalb der gesetzten Frist nach der Bekanntgabe der Verfügung bei dem Amtsgericht Aachen eingegangen sein. Dies gilt auch dann, wenn der Widerspruch zur Niederschrift der Geschäftsstelle eines anderen Amtsgerichtes abgegeben wurde. Die Frist beginnt mit der Bekanntgabe der Verfügung durch Veröffentlichung. Fällt das Ende der Frist auf einen Sonntag, einen allgemeinen Feiertag oder Sonnabend, so endet die Frist mit Ablauf des nächsten Werktages.\n\nDer Widerspruch muss die Bezeichnung der angefochtenen Verfügung sowie die Erklärung enthalten, dass Widerspruch gegen diese Verfügung eingelegt wird. Er ist zu unterzeichnen und soll begründet werden.\n\nDie Einlegung ist auch durch Übertragung eines elektronischen Dokuments an die elektronische Poststelle des Gerichts möglich. Das elektronische Dokument muss für die Bearbeitung durch das Gericht geeignet und mit einer qualifizierten elektronischen Signatur der verantwortenden Person versehen sein oder von der verantwortenden Person signiert und auf einem sicheren Übermittlungsweg gemäß § 130 a ZPO nach näherer Maßgabe der Verordnung über die technischen Rahmenbedingungen des elektronischen Rechtsverkehrs und über das besondere elektronische Behördenpostfach (BGBl. I, S. 3803) eingereicht werden. Weitere Informationen erhalten Sie auf der Internetseite www.justiz.de."
    },
    {
      "date": "2025-10-29",
      "id": "135715",
      "original_text": "Löschungsankündigung\nNordrhein-Westfalen Amtsgericht Düsseldorf HRB 105726\nMihaita UG (haftungsbeschränkt) – Monheim am Rhein",
      "type": "Löschungsankündigung",
      "state": "Nordrhein-Westfalen",
      "amtsgericht": "Amtsgericht Düsseldorf",
      "registernummer": "HRB 105726",
      "registerart": "HRB",
      "company_name": "Mihaita UG (haftungsbeschränkt)",
      "company_seat": "Monheim am Rhein",
      "details": "29.10.2025 (Bekanntmachungsdatum)\n\nNordrhein-Westfalen Amtsgericht Düsseldorf HRB 105726\nLöschungsankündigung\n\nMihaita UG (haftungsbeschränkt)\nGesellschaft mit beschränkter Haftung\nMonheim am Rhein\n\nDas Registergericht beabsichtigt die Gesellschaft von Amts wegen nach § 394 Abs. 1 FamFG zu löschen. Die Frist zur Erhebung eines Widerspruchs ist auf einen Monat festgesetzt.\n\nRechtsbehelfsbelehrung:\nDas Widerspruchsrecht steht jedem zu, der an der Unterlassung der Löschung ein berechtigtes Interesse hat. Der Widerspruch ist bei dem Amtsgericht Düsseldorf -Registergericht-, Werdener Straße 1, 40227 Düsseldorf schriftlich in deutscher Sprache oder zur Niederschrift der Geschäftsstelle einzulegen. Der Widerspruch kann auch zur Niederschrift der Geschäftsstelle eines jeden Amtsgerichtes abgegeben werden. Die Einlegung ist auch durch Übertragung eines elektronischen Dokuments an die elektronische Poststelle des Gerichts möglich. Das elektronische Dokument muss für die Bearbeitung durch das Gericht geeignet und mit einer qualifizierten elektronischen Signatur der verantwortenden Person versehen sein oder von der verantwortenden Person signiert und auf einem sicheren Übermittlungsweg gemäß § 130a ZPO nach näherer Maßgabe der Verordnung über die technischen Rahmenbedingungen des elektronischen Rechtsverkehrs und über das besondere elektronische Behördenpostfach (BGBl. I, S.3803) eingereicht werden. Weitere Informationen erhalten Sie auf der Internetseite www.justiz.de.\nDer Widerspruch muss spätestens innerhalb der gesetzten Frist nach dem Datum der Bekanntmachung der Löschungsankündigung bei dem Amtsgericht - Registergericht - Düsseldorf eingegangen sein.  Dies gilt auch dann, wenn der Widerspruch zur Niederschrift der Geschäftsstelle eines anderen Amtsgerichtes abgegeben wurde. Die Frist beginnt mit dem Tage der Bekanntmachung der Löschungsankündigung in dem für die Bekanntmachung der Eintragungen in das Handelsregister bestimmten elektronischen Informations- und Kommunikationssystem nach § 10 des Handelsgesetzbuches. Fällt das Ende der Frist auf einen Sonntag, einen allgemeinen Feiertag oder Sonnabend, so endet die Frist mit Ablauf des nächsten Werktages.\nDer Widerspruch muss die Bezeichnung der angefochtenen Löschungsankündigung sowie die Erklärung enthalten, dass Widerspruch gegen diese Löschungsankündigung eingelegt wird. Er ist zu unterzeichnen und soll begründet werden."
    },
    {
      "date": "2025-10-29",
      "id": "135716",
      "original_text": "Löschungsankündigung\nNordrhein-Westfalen Amtsgericht Köln HRB 51837\nG + M Hausverwaltung GmbH – Köln",
      "type": "Löschungsankündigung",
      "state": "Nordrhein-Westfalen",
      "amtsgericht": "Amtsgericht Köln",
      "registernummer": "HRB 51837",
      "registerart": "HRB",
      "company_name": "G + M Hausverwaltung GmbH",
      "company_seat": "Köln",
      "details": "29.10.2025 (Bekanntmachungsdatum)\n\nNordrhein-Westfalen Amtsgericht Köln HRB 51837\nLöschungsankündigung\n\nG + M Hausverwaltung GmbH\nGesellschaft mit beschränkter Haftung\nKöln\n\nDas Registergericht beabsichtigt, die im Handelsregister eingetragene Gesellschaft gemäß § 394 Absatz 1 FamFG wegen Vermögenslosigkeit von Amts wegen zu löschen. Gegen diese Verfügung kann Widerspruch eingelegt werden. Die Frist zur Erhebung eines Widerspruchs gegen die beabsichtigte Löschung von Amts wegen ist auf einen Monat festgesetzt. Rechtsbehelfsbelehrung: Gegen diese Verfügung können Sie Widerspruch einlegen. Der Widerspruch ist bei dem Amtsgericht Köln, Reichenspergerplatz 1, 50670 Köln schriftlich in deutscher Sprache oder zur Niederschrift der Geschäftsstelle einzulegen. Der Widerspruch kann auch zur Niederschrift der Geschäftsstelle eines jeden Amtsgerichtes abgegeben werden. Die Einlegung ist auch durch Übertragung eines elektronischen Dokuments an die elektronische Poststelle des Gerichts möglich. Das elektronische Dokument muss für die Bearbeitung durch das Gericht geeignet und mit einer qualifizierten elektronischen Signatur der verantwortenden Person versehen sein oder von der verantwortenden Person signiert und auf einem sicheren Übermittlungsweg gemäß § 130a ZPO nach näherer Maßgabe der Verordnung über die technischen Rahmenbedingungen des elektronischen Rechtsverkehrs und über das besondere elektronische Behördenpostfach (BGBl. I, S.3803) eingereicht werden. Weitere Informationen erhalten Sie auf der Internetseite www.justiz.de.Der Widerspruch muss spätestens innerhalb der gesetzten Frist bei dem Amtsgericht Köln eingegangen sein. Dies gilt auch dann, wenn der Widerspruch zur Niederschrift der Geschäftsstelle eines anderen Amtsgerichtes abgegeben wurde. Die Frist beginnt mit der Veröffentlichung. Fällt das Ende der Frist auf einen Sonntag, einen allgemeinen Feiertag oder Sonnabend, so endet die Frist mit Ablauf des nächsten Werktages.\n\nDer Widerspruch muss die Bezeichnung der angefochtenen Verfügung sowie die Erklärung enthalten, dass Widerspruch gegen diese Verfügung eingelegt wird. Er ist zu unterzeichnen und soll begründet werden."
    },
    {
      "date": "2025-10-29",
      "id": "135717",
      "original_text": "Löschungsankündigung\nNordrhein-Westfalen Amtsgericht Hamm HRB 10236\nTeam Seemann Bau-Management GmbH – Bergkamen",
      "type": "Löschungsankündigung",
      "state": "Nordrhein-Westfalen",
      "amtsgericht": "Amtsgericht Hamm",
      "registernummer": "HRB 10236",
      "registerart": "HRB",
      "company_name": "Team Seemann Bau-Management GmbH",
      "company_seat": "Bergkamen",
      "details": "29.10.2025 (Bekanntmachungsdatum)\n\nNordrhein-Westfalen Amtsgericht Hamm HRB 10236\nLöschungsankündigung\n\nTeam Seemann Bau-Management GmbH\nGesellschaft mit beschränkter Haftung\nBergkamen\n\nDas Registergericht beabsichtigt die Gesellschaft von Amts wegen nach § 394 FamFG zu löschen. Die Frist zur Erhebung eines Widerspruchs ist auf drei Monate festgesetzt."
    },
    {
      "date": "2025-10-29",
      "id": "135718",
      "original_text": "Registerbekanntmachung nach dem Umwandlungsgesetz\nNordrhein-Westfalen Amtsgericht Bad Oeynhausen GnR 171\nLuft Immobilien eG – Porta Westfalica",
      "type": "Registerbekanntmachung nach dem Umwandlungsgesetz",
      "state": "Nordrhein-Westfalen",
      "amtsgericht": "Amtsgericht Bad Oeynhausen",
      "registernummer": "GnR 171",
      "registerart": "GnR",
      "company_name": "Luft Immobilien eG",
      "company_seat": "Porta Westfalica",
      "details": "29.10.2025 (Bekanntmachungsdatum)\n\nNordrhein-Westfalen Amtsgericht Bad Oeynhausen GnR 171\nRegisterbekanntmachung nach dem Umwandlungsgesetz 29.10.2025 (Eintragungsdatum)\n\nLuft Immobilien eG\neingetragene Genossenschaft\nPorta Westfalica\n\nDen Gläubigern der an der formwechselnden Umwandlung beteiligten Rechtsträger ist, wenn sie binnen sechs Monaten nach dem Tag, an dem die Eintragung der formwechselnden Umwandlung in das Register des Sitzes desjenigen Rechtsträgers, dessen Gläubiger sie sind, nach § 19 Absatz 3 UmwG als bekanntgemacht gilt, ihren Anspruch nach Grund und Höhe schriftlich anmelden, Sicherheit zu leisten, soweit sie nicht Befriedigung verlangen können. Dieses Recht steht den Gläubigern jedoch nur zu, wenn sie glaubhaft machen, dass durch die formwechselnden Umwandlung die Erfüllung ihrer Forderung gefährdet wird."
    },
    {
      "date": "2025-10-29",
      "id": "135719",
      "original_text": "Löschungsankündigung\nNordrhein-Westfalen Amtsgericht Neuss HRB 19388\nABM Fashion GmbH – Neuss",
      "type": "Löschungsankündigung",
      "state": "Nordrhein-Westfalen",
      "amtsgericht": "Amtsgericht Neuss",
      "registernummer": "HRB 19388",
      "registerart": "HRB",
      "company_name": "ABM Fashion GmbH",
      "company_seat": "Neuss",
      "details": "29.10.2025 (Bekanntmachungsdatum)\n\nNordrhein-Westfalen Amtsgericht Neuss HRB 19388\nLöschungsankündigung\n\nABM Fashion GmbH\nGesellschaft mit beschränkter Haftung\nNeuss\n\nDas Registergericht beabsichtigt, die im Handelsregister eingetragene Gesellschaft gemäß § 394 Absatz 1 FamFG wegen Vermögenslosigkeit von Amts wegen zu löschen.\nFrist zur Geltendmachung eines Widerspruchs: 1 Monat\n\nRechtsbehelfsbelehrung:\nGegen diese Verfügung können Sie Widerspruch einlegen. Der Widerspruch ist bei dem Amtsgericht Neuss, Breite Straße 48, 41460 Neuss schriftlich in deutscher Sprache oder zur Niederschrift der Geschäftsstelle einzulegen. Der Widerspruch kann auch zur Niederschrift der Geschäftsstelle eines jeden Amtsgerichtes abgegeben werden. Die Einlegung ist auch durch Übertragung eines elektronischen Dokuments an die elektronische Poststelle des Gerichts möglich. Das elektronische Dokument muss für die Bearbeitung durch das Gericht geeignet und mit einer qualifizierten elektronischen Signatur der verantwortenden Person versehen sein oder von der verantwortenden Person signiert und auf einem sicheren Übermittlungsweg gemäß § 130a ZPO nach näherer Maßgabe der Verordnung über die technischen Rahmenbedingungen des elektronischen Rechtsverkehrs und über das besondere elektronische Behördenpostfach (BGBl. I, S.3803) eingereicht werden. Weitere Informationen erhalten Sie auf der Internetseite www.justiz.de.\nDer Widerspruch muss spätestens innerhalb der gesetzten Frist bei dem Amtsgericht Neuss eingegangen sein. Dies gilt auch dann, wenn der Widerspruch zur Niederschrift der Geschäftsstelle eines anderen Amtsgerichtes abgegeben wurde. Die Frist beginnt mit der Veröffentlichung. Fällt das Ende der Frist auf einen Sonntag, einen allgemeinen Feiertag oder Sonnabend, so endet die Frist mit Ablauf des nächsten Werktages. Der Widerspruch muss die Bezeichnung der angefochtenen Verfügung sowie die Erklärung enthalten, dass Widerspruch gegen diese Verfügung eingelegt wird. Er ist zu unterzeichnen und soll begründet werden."
    },
    {
      "date": "2025-10-29",
      "id": "135720",
      "original_text": "Löschungsankündigung\nNordrhein-Westfalen Amtsgericht Siegburg HRB 16827\nRheinGenuss Betriebsgesellschaft mbH – Bad Honnef",
      "type": "Löschungsankündigung",
      "state": "Nordrhein-Westfalen",
      "amtsgericht": "Amtsgericht Siegburg",
      "registernummer": "HRB 16827",
      "registerart": "HRB",
      "company_name": "RheinGenuss Betriebsgesellschaft mbH",
      "company_seat": "Bad Honnef",
      "details": "29.10.2025 (Bekanntmachungsdatum)\n\nNordrhein-Westfalen Amtsgericht Siegburg HRB 16827\nLöschungsankündigung\n\nRheinGenuss Betriebsgesellschaft mbH\nGesellschaft mit beschränkter Haftung\nBad Honnef\n\nDas Registergericht hat glaubhafte Kenntnis erlangt, dass die Gesellschaft vermögenslos geworden ist.\n\nEs ist daher beabsichtigt, die Gesellschaft nach § 394 FamFG im Handelsregister wegen Vermögenslosigkeit zu löschen.\nEinwände gegen die Löschung sind durch Widerspruch binnen einer Frist von 3 Monaten geltend zu machen, andernfalls die Löschung erfolgen wird.\n\nEinzulegen ist der Widerspruch bei dem Amtsgericht Siegburg, Neue Poststraße 16, 53721 Siegburg, und zwar entweder schriftlich in deutscher Sprache oder mündlich zur Niederschrift der Geschäftsstelle. Der Widerspruch kann auch zur Niederschrift der Geschäftsstelle eines jeden Amtsgerichts abgegeben werden. Der Widerspruch ist binnen der in der Verfügung bestimmten Frist einzulegen. Die Frist ist nur gewahrt, wenn der Widerspruch rechtzeitig bei dem Amtsgericht Siegburg eingeht, auch wenn der Widerspruch zur Niederschrift der Geschäftsstelle eines anderen Amtsgerichts abgegeben wurde. Die Frist beginnt jeweils mit der schriftlichen Bekanntgabe der Verfügung an die Beteiligten. Kann die schriftliche Bekanntgabe an einen Beteiligten nicht bewirkt werden, beginnt die Frist spätestens mit Ablauf von fünf Monaten nach Erlass der Verfügung. Die Bekanntgabe ist entweder durch Zustellung oder am dritten Tage nach Aufgabe zur Post bewirkt. Sofern die Löschung noch nicht erfolgt ist, kann der Widerspruch auch noch nach Ablauf der Frist eingelegt werden. Fällt das Ende der Frist auf einen Sonnabend, einen Sonntag oder einen allgemeinen Feiertag, endet die Frist mit Ablauf des nächsten Werktages. Der Widerspruch ist zu unterzeichnen. Eine Begründung des Widerspruchs ist nicht vorgeschrieben."
    },
    {
      "date": "2025-10-29",
      "id": "135721",
      "original_text": "Registerbekanntmachung nach dem Umwandlungsgesetz\nNordrhein-Westfalen Amtsgericht Düsseldorf HRB 87555\n24/7 by stays GmbH – Düsseldorf",
      "type": "Registerbekanntmachung nach dem Umwandlungsgesetz",
      "state": "Nordrhein-Westfalen",
      "amtsgericht": "Amtsgericht Düsseldorf",
      "registernummer": "HRB 87555",
      "registerart": "HRB",
      "company_name": "24/7 by stays GmbH",
      "company_seat": "Düsseldorf",
      "details": "29.10.2025 (Bekanntmachungsdatum)\n\nNordrhein-Westfalen Amtsgericht Düsseldorf HRB 87555\nRegisterbekanntmachung nach dem Umwandlungsgesetz 29.10.2025 (Eintragungsdatum)\n\n24/7 by stays GmbH\nGesellschaft mit beschränkter Haftung\nDüsseldorf\n\nDen Gläubigern der an der Verschmelzung beteiligten Rechtsträger ist, wenn sie binnen sechs Monaten nach dem Tag, an dem die Eintragung der Verschmelzung in das Register des Sitzes desjenigen Rechtsträgers, dessen Gläubiger sie sind, nach § 19 Absatz 3 UmwG als bekanntgemacht gilt, ihren Anspruch nach Grund und Höhe schriftlich anmelden, Sicherheit zu leisten, soweit sie nicht Befriedigung verlangen können. Dieses Recht steht den Gläubigern jedoch nur zu, wenn sie glaubhaft machen, dass durch die Verschmelzung die Erfüllung ihrer Forderung gefährdet wird."
    },
    {
      "date": "2025-10-29",
      "id": "135722",
      "original_text": "Löschungsankündigung\nNordrhein-Westfalen Amtsgericht Mönchengladbach HRB 6761\nBTM Textilmaschinen GmbH – Mönchengladbach",
      "type": "Löschungsankündigung",
      "state": "Nordrhein-Westfalen",
      "amtsgericht": "Amtsgericht Mönchengladbach",
      "registernummer": "HRB 6761",
      "registerart": "HRB",
      "company_name": "BTM Textilmaschinen GmbH",
      "company_seat": "Mönchengladbach",
      "details": "29.10.2025 (Bekanntmachungsdatum)\n\nNordrhein-Westfalen Amtsgericht Mönchengladbach HRB 6761\nLöschungsankündigung\n\nBTM Textilmaschinen GmbH\nGesellschaft mit beschränkter Haftung\nMönchengladbach\n\nDas Registergericht beabsichtigt, die im Handelsregister eingetragene Gesellschaft gemäß § 394 Absatz 1 FamFG wegen Vermögenslosigkeit von Amts wegen zu löschen. Gegen diese Verfügung kann Widerspruch eingelegt werden. Die Frist zur Erhebung eines Widerspruchs gegen die beabsichtigte Löschung von Amts wegen ist auf drei Monate festgesetzt."
    },
    {
      "date": "2025-10-29",
      "id": "135723",
      "original_text": "Registerbekanntmachung nach dem Umwandlungsgesetz\nNordrhein-Westfalen Amtsgericht Paderborn HRA 8802\nGarten- und Landschaftsbau Hördemann e.K. – Borgentreich",
      "type": "Registerbekanntmachung nach dem Umwandlungsgesetz",
      "state": "Nordrhein-Westfalen",
      "amtsgericht": "Amtsgericht Paderborn",
      "registernummer": "HRA 8802",
      "registerart": "HRA",
      "company_name": "Garten- und Landschaftsbau Hördemann e.K.",
      "company_seat": "Borgentreich",
      "details": "29.10.2025 (Bekanntmachungsdatum)\n\nNordrhein-Westfalen Amtsgericht Paderborn HRA 8802\nRegisterbekanntmachung nach dem Umwandlungsgesetz 29.10.2025 (Eintragungsdatum)\n\nGarten- und Landschaftsbau Hördemann e.K.\nEinzelkaufmann / Einzelkauffrau\nBorgentreich\n\nDen Gläubigern der an der Ausgliederung beteiligten Rechtsträger ist, wenn sie binnen sechs Monaten nach dem Tag, an dem die Eintragung der Ausgliederung in das Register des Sitzes desjenigen Rechtsträgers, dessen Gläubiger sie sind, nach § 19 Absatz 3 UmwG als bekanntgemacht gilt, ihren Anspruch nach Grund und Höhe schriftlich anmelden, Sicherheit zu leisten, soweit sie nicht Befriedigung verlangen können. Dieses Recht steht den Gläubigern jedoch nur zu, wenn sie glaubhaft machen, dass durch die Ausgliederung die Erfüllung ihrer Forderung gefährdet wird."
    },
    {
      "date": "2025-10-29",
      "id": "135724",
      "original_text": "Löschungsankündigung\nNordrhein-Westfalen Amtsgericht Aachen HRB 23932\nECCO Fenster & Türen UG (haftungsbeschränkt) – Alsdorf",
      "type": "Löschungsankündigung",
      "state": "Nordrhein-Westfalen",
      "amtsgericht": "Amtsgericht Aachen",
      "registernummer": "HRB 23932",
      "registerart": "HRB",
      "company_name": "ECCO Fenster & Türen UG (haftungsbeschränkt)",
      "company_seat": "Alsdorf",
      "details": "29.10.2025 (Bekanntmachungsdatum)\n\nNordrhein-Westfalen Amtsgericht Aachen HRB 23932\nLöschungsankündigung\n\nECCO Fenster & Türen UG (haftungsbeschränkt)\nGesellschaft mit beschränkter Haftung\nAlsdorf\n\nDas Registergericht beabsichtigt, von Amts wegen die Gesellschaft wegen Vermögenslosigkeit nach § 394 FamFG zu löschen, weil das Finanzamt Aachen-Kreis mit Schreiben vom 20.10.2025 Umstände mitgeteilt hat, aufgrund derer das Gericht davon überzeugt ist, dass die Gesellschaft vollständig vermögenslos ist.\n\nZur Geltendmachung des Widerspruchs gegen die beabsichtigte Löschung wird hiermit eine Frist von einem Monat ab Veröffentlichung dieser Ankündigung bestimmt.\n\nRechtsbehelfsbelehrung:\n\nGegen diese Verfügung kann Widerspruch eingelegt werden. Zum Widerspruch ist jeder berechtigt, der an der Unterlassung der Löschung ein berechtigtes Interesse hat.\n\nDer Widerspruch ist bei dem Amtsgericht Aachen, Adalbertsteinweg 92, 52070 Aachen schriftlich in deutscher Sprache oder zur Niederschrift der Geschäftsstelle einzulegen. Der Widerspruch kann auch zur Niederschrift der Geschäftsstelle eines jeden Amtsgerichtes abgegeben werden.\n\nDer Widerspruch muss spätestens innerhalb der gesetzten Frist nach der Bekanntgabe der Verfügung bei dem Amtsgericht Aachen eingegangen sein. Dies gilt auch dann, wenn der Widerspruch zur Niederschrift der Geschäftsstelle eines anderen Amtsgerichtes abgegeben wurde. Die Frist beginnt mit der Bekanntgabe der Verfügung durch Veröffentlichung. Fällt das Ende der Frist auf einen Sonntag, einen allgemeinen Feiertag oder Sonnabend, so endet die Frist mit Ablauf des nächsten Werktages.\n\nDer Widerspruch muss die Bezeichnung der angefochtenen Verfügung sowie die Erklärung enthalten, dass Widerspruch gegen diese Verfügung eingelegt wird. Er ist zu unterzeichnen und soll begründet werden.\n\nDie Einlegung ist auch durch Übertragung eines elektronischen Dokuments an die elektronische Poststelle des Gerichts möglich. Das elektronische Dokument muss für die Bearbeitung durch das Gericht geeignet und mit einer qualifizierten elektronischen Signatur der verantwortenden Person versehen sein oder von der verantwortenden Person signiert und auf einem sicheren Übermittlungsweg gemäß § 130 a ZPO nach näherer Maßgabe der Verordnung über die technischen Rahmenbedingungen des elektronischen Rechtsverkehrs und über das besondere elektronische Behördenpostfach (BGBl. I, S. 3803) eingereicht werden. Weitere Informationen erhalten Sie auf der Internetseite www.justiz.de."
    },
    {
      "date": "2025-10-29",
      "id": "135725",
      "original_text": "Löschungsankündigung\nNordrhein-Westfalen Amtsgericht Dortmund HRB 23972\nTechno Control GmbH – Werne",
      "type": "Löschungsankündigung",
      "state": "Nordrhein-Westfalen",
      "amtsgericht": "Amtsgericht Dortmund",
      "registernummer": "HRB 23972",
      "registerart": "HRB",
      "company_name": "Techno Control GmbH",
      "company_seat": "Werne",
      "details": "29.10.2025 (Bekanntmachungsdatum)\n\nNordrhein-Westfalen Amtsgericht Dortmund HRB 23972\nLöschungsankündigung 29.10.2025 (Eintragungsdatum)\n\nTechno Control GmbH\nGesellschaft mit beschränkter Haftung\nWerne\n\nDas Registergericht beabsichtigt die Gesellschaft von Amts wegen nach § 394 FamFG zu löschen. Die Frist zur Erhebung eines Widerspruchs ist auf zwei Monate festgesetzt."
    },
    {
      "date": "2025-10-29",
      "id": "135726",
      "original_text": "Löschungsankündigung\nNordrhein-Westfalen Amtsgericht Dortmund HRB 34847\nZolaris UG (haftungsbeschränkt) – Dortmund",
      "type": "Löschungsankündigung",
      "state": "Nordrhein-Westfalen",
      "amtsgericht": "Amtsgericht Dortmund",
      "registernummer": "HRB 34847",
      "registerart": "HRB",
      "company_name": "Zolaris UG (haftungsbeschränkt)",
      "company_seat": "Dortmund",
      "details": "29.10.2025 (Bekanntmachungsdatum)\n\nNordrhein-Westfalen Amtsgericht Dortmund HRB 34847\nLöschungsankündigung 28.10.2025 (Eintragungsdatum)\n\nZolaris UG (haftungsbeschränkt)\nGesellschaft mit beschränkter Haftung\nDortmund\n\nDas Registergericht beabsichtigt die Gesellschaft von Amts wegen nach § 394 FamFG zu löschen. Die Frist zur Erhebung eines Widerspruchs ist auf zwei Monate festgesetzt."
    },
    {
      "date": "2025-10-29",
      "id": "135727",
      "original_text": "Löschungsankündigung\nNordrhein-Westfalen Amtsgericht Neuss HRB 20906\nGPE German Pharma Equipment GmbH – Meerbusch",
      "type": "Löschungsankündigung",
      "state": "Nordrhein-Westfalen",
      "amtsgericht": "Amtsgericht Neuss",
      "registernummer": "HRB 20906",
      "registerart": "HRB",
      "company_name": "GPE German Pharma Equipment GmbH",
      "company_seat": "Meerbusch",
      "details": "29.10.2025 (Bekanntmachungsdatum)\n\nNordrhein-Westfalen Amtsgericht Neuss HRB 20906\nLöschungsankündigung 29.10.2025 (Eintragungsdatum)\n\nGPE German Pharma Equipment GmbH\nGesellschaft mit beschränkter Haftung\nMeerbusch\n\nDas Registergericht beabsichtigt die Gesellschaft von Amts wegen nach § 394 FamFG zu löschen. Die Frist zur Erhebung eines Widerspruchs ist auf einen Monat festgesetzt. Rechtsbehelfsbelehrung: Gegen diese Verfügung können Sie Widerspruch einlegen. Der Widerspruch ist bei dem Amtsgericht Neuss - Registergericht -, Breite Str. 48, 41460 Neuss schriftlich in deutscher Sprache oder zur Niederschrift der Geschäftsstelle einzulegen. Der Widerspruch kann auch zur Niederschrift der Geschäftsstelle eines jeden Amtsgerichtes abgegeben werden. Die Einlegung ist auch durch Übertragung eines elektronischen Dokuments an die elektronische Poststelle des Gerichts möglich. Das elektronische Dokument muss für die Bearbeitung durch das Gericht geeignet und mit einer qualifizierten elektronischen Signatur der verantwortenden Person versehen sein oder von der verantwortenden Person signiert und auf einem sicheren Übermittlungsweg gemäß § 130a ZPO nach näherer Maßgabe der Verordnung über die technischen Rahmenbedingungen des elektronischen Rechtsverkehrs und über das besondere elektronische Behördenpostfach (BGBl. I, S.3803) eingereicht werden. Weitere Informationen erhalten Sie auf der Internetseite www.justiz.de. Der Widerspruch muss spätestens innerhalb der gesetzten Frist nach der schriftlichen Bekanntgabe der Verfügung bei dem Amtsgericht - Registergericht - Neuss eingegangen sein. Dies gilt auch dann, wenn der Widerspruch zur Niederschrift der Geschäftsstelle eines anderen Amtsgerichtes abgegeben wurde. Die Frist beginnt mit der schriftlichen Bekanntgabe der Verfügung. Die Bekanntgabe ist entweder durch Zustellung oder am dritten Tage nach Aufgabe zur Post bewirkt. Fällt das Ende der Frist auf einen Sonntag, einen allgemeinen Feiertag oder Sonnabend, so endet die Frist mit Ablauf des nächsten Werktages. Der Widerspruch muss die Bezeichnung der angefochtenen Verfügung sowie die Erklärung enthalten, dass Widerspruch gegen diese Verfügung eingelegt wird. Er ist zu unterzeichnen und soll begründet werden."
    },
    {
      "date": "2025-10-29",
      "id": "135728",
      "original_text": "Registerbekanntmachung nach dem Umwandlungsgesetz\nNordrhein-Westfalen Amtsgericht Köln HRB 110896\nBrillant Holding GmbH – Leverkusen",
      "type": "Registerbekanntmachung nach dem Umwandlungsgesetz",
      "state": "Nordrhein-Westfalen",
      "amtsgericht": "Amtsgericht Köln",
      "registernummer": "HRB 110896",
      "registerart": "HRB",
      "company_name": "Brillant Holding GmbH",
      "company_seat": "Leverkusen",
      "details": "29.10.2025 (Bekanntmachungsdatum)\n\nNordrhein-Westfalen Amtsgericht Köln HRB 110896\nRegisterbekanntmachung nach dem Umwandlungsgesetz 29.10.2025 (Eintragungsdatum)\n\nBrillant Holding GmbH\nGesellschaft mit beschränkter Haftung\nLeverkusen\n\nDen Gläubigern der an der Verschmelzung beteiligten Rechtsträger ist, wenn sie binnen sechs Monaten nach dem Tag, an dem die Eintragung der Verschmelzung in das Register des Sitzes desjenigen Rechtsträgers, dessen Gläubiger sie sind, nach § 19 Absatz 3 UmwG als bekanntgemacht gilt, ihren Anspruch nach Grund und Höhe schriftlich anmelden, Sicherheit zu leisten, soweit sie nicht Befriedigung verlangen können. Dieses Recht steht den Gläubigern jedoch nur zu, wenn sie glaubhaft machen, dass durch die Verschmelzung die Erfüllung ihrer Forderung gefährdet wird."
    },
    {
      "date": "2025-10-29",
      "id": "135729",
      "original_text": "Löschungsankündigung\nNordrhein-Westfalen Amtsgericht Dortmund HRB 33697\nPATRICK TROCKENBAU UG (haftungsbeschränkt) – Castrop-Rauxel",
      "type": "Löschungsankündigung",
      "state": "Nordrhein-Westfalen",
      "amtsgericht": "Amtsgericht Dortmund",
      "registernummer": "HRB 33697",
      "registerart": "HRB",
      "company_name": "PATRICK TROCKENBAU UG (haftungsbeschränkt)",
      "company_seat": "Castrop-Rauxel",
      "details": "29.10.2025 (Bekanntmachungsdatum)\n\nNordrhein-Westfalen Amtsgericht Dortmund HRB 33697\nLöschungsankündigung 28.10.2025 (Eintragungsdatum)\n\nPATRICK TROCKENBAU UG (haftungsbeschränkt)\nGesellschaft mit beschränkter Haftung\nCastrop-Rauxel\n\nDas Registergericht beabsichtigt die Gesellschaft von Amts wegen nach § 394 FamFG zu löschen. Die Frist zur Erhebung eines Widerspruchs ist auf zwei Monate festgesetzt."
    },
    {
      "date": "2025-10-29",
      "id": "135730",
      "original_text": "Registerbekanntmachung nach dem Umwandlungsgesetz\nNordrhein-Westfalen Amtsgericht Bad Oeynhausen HRB 17692\nGoldman Karaton GmbH – Bünde",
      "type": "Registerbekanntmachung nach dem Umwandlungsgesetz",
      "state": "Nordrhein-Westfalen",
      "amtsgericht": "Amtsgericht Bad Oeynhausen",
      "registernummer": "HRB 17692",
      "registerart": "HRB",
      "company_name": "Goldman Karaton GmbH",
      "company_seat": "Bünde",
      "details": "29.10.2025 (Bekanntmachungsdatum)\n\nNordrhein-Westfalen Amtsgericht Bad Oeynhausen HRB 17692\nRegisterbekanntmachung nach dem Umwandlungsgesetz 29.10.2025 (Eintragungsdatum)\n\nGoldman Karaton GmbH\nGesellschaft mit beschränkter Haftung\nBünde\n\nDen Gläubigern der an der Ausgliederung beteiligten Rechtsträger ist, wenn sie binnen sechs Monaten nach dem Tag, an dem die Eintragung der Ausgliederung in das Register des Sitzes desjenigen Rechtsträgers, dessen Gläubiger sie sind, nach § 19 Absatz 3 UmwG als bekanntgemacht gilt, ihren Anspruch nach Grund und Höhe schriftlich anmelden, Sicherheit zu leisten, soweit sie nicht Befriedigung verlangen können. Dieses Recht steht den Gläubigern jedoch nur zu, wenn sie glaubhaft machen, dass durch die Ausgliederung die Erfüllung ihrer Forderung gefährdet wird."
    },
    {
      "date": "2025-10-29",
      "id": "135731",
      "original_text": "Löschungsankündigung\nNordrhein-Westfalen Amtsgericht Düsseldorf HRB 102871\nYiqifa E-Commerce Handel GmbH – Düsseldorf",
      "type": "Löschungsankündigung",
      "state": "Nordrhein-Westfalen",
      "amtsgericht": "Amtsgericht Düsseldorf",
      "registernummer": "HRB 102871",
      "registerart": "HRB",
      "company_name": "Yiqifa E-Commerce Handel GmbH",
      "company_seat": "Düsseldorf",
      "details": "29.10.2025 (Bekanntmachungsdatum)\n\nNordrhein-Westfalen Amtsgericht Düsseldorf HRB 102871\nLöschungsankündigung\n\nYiqifa E-Commerce Handel GmbH\nGesellschaft mit beschränkter Haftung\nDüsseldorf\n\nBetr.: Yiqifa E-Commerce Handel GmbH, Schanzenstr. 96, 40549 Düsseldorf\n\nDas Registergericht beabsichtigt die Gesellschaft von Amts wegen nach § 394 FamFG zu löschen. Die Frist zur Erhebung eines Widerspruchs ist auf 3 Wochen festgesetzt.\n\nRechtsbehelfsbelehrung:\n\nDas Widerspruchsrecht steht jedem zu, der an der Unterlassung der Löschung ein berechtigtes Interesse hat. Der Widerspruch ist bei dem Amtsgericht Düsseldorf -Registergericht-, Werdener Straße 1, 40227 Düsseldorf schriftlich in deutscher Sprache oder zur Niederschrift der Geschäftsstelle einzulegen. Der Widerspruch kann auch zur Niederschrift der Geschäftsstelle eines jeden Amtsgerichtes abgegeben werden. Die Einlegung ist auch durch Übertragung eines elektronischen Dokuments an die elektronische Poststelle des Gerichts möglich. Das elektronische Dokument muss für die Bearbeitung durch das Gericht geeignet und mit einer qualifizierten elektronischen Signatur der verantwortenden Person versehen sein oder von der verantwortenden Person signiert und auf einem sicheren Übermittlungsweg gemäß § 130a ZPO nach näherer Maßgabe der Verordnung über die technischen Rahmenbedingungen des elektronischen Rechtsverkehrs und über das besondere elektronische Behördenpostfach (BGBl. I, S.3803) eingereicht werden. Weitere Informationen erhalten Sie auf der Internetseite www.justiz.de.\nDer Widerspruch muss spätestens innerhalb der gesetzten Frist nach dem Datum der Bekanntmachung der Löschungsankündigung bei dem Amtsgericht - Registergericht - Düsseldorf eingegangen sein.  Dies gilt auch dann, wenn der Widerspruch zur Niederschrift der Geschäftsstelle eines anderen Amtsgerichtes abgegeben wurde. Die Frist beginnt mit dem Tage der Bekanntmachung der Löschungsankündigung in dem für die Bekanntmachung der Eintragungen in das Handelsregister bestimmten elektronischen Informations- und Kommunikationssystem nach § 10 des Handelsgesetzbuches. Fällt das Ende der Frist auf einen Sonntag, einen allgemeinen Feiertag oder Sonnabend, so endet die Frist mit Ablauf des nächsten Werktages.\nDer Widerspruch muss die Bezeichnung der angefochtenen Löschungsankündigung sowie die Erklärung enthalten, dass Widerspruch gegen diese Löschungsankündigung eingelegt wird. Er ist zu unterzeichnen und soll begründet werden."
    },
    {
      "date": "2025-10-29",
      "id": "135732",
      "original_text": "Löschungsankündigung\nNordrhein-Westfalen Amtsgericht Gelsenkirchen HRB 16978\nGWS Serviceleistungen UG (haftungsbeschränkt) – Gladbeck",
      "type": "Löschungsankündigung",
      "state": "Nordrhein-Westfalen",
      "amtsgericht": "Amtsgericht Gelsenkirchen",
      "registernummer": "HRB 16978",
      "registerart": "HRB",
      "company_name": "GWS Serviceleistungen UG (haftungsbeschränkt)",
      "company_seat": "Gladbeck",
      "details": "29.10.2025 (Bekanntmachungsdatum)\n\nNordrhein-Westfalen Amtsgericht Gelsenkirchen HRB 16978\nLöschungsankündigung\n\nGWS Serviceleistungen UG (haftungsbeschränkt)\nGesellschaft mit beschränkter Haftung\nGladbeck\n\nDas Gericht beabsichtigt, die Gesellschaft GWS Serviceleistungen UG (haftungsbeschränkt) mit Sitz in Gladbeck, HRB 16978 Amtsgericht Gelsenkirchen, wegen Vermögenslosigkeit zu löschen.\n\nHiermit wird denjenigen, die an der Unterlassung der Löschung ein berechtigtes Interesse haben, gem. § 394 Abs. 2 FamFG Gelegenheit gegeben, gegen dieses Vorhaben binnen eines Monats nach dieser Bekanntmachung Widerspruch einzulegen. Der Widerspruch kann schriftlich oder zu Protokoll der Geschäftsstelle erhoben werden."
    },
    {
      "date": "2025-10-29",
      "id": "135733",
      "original_text": "Registerbekanntmachung nach dem Umwandlungsgesetz\nNordrhein-Westfalen Amtsgericht Duisburg HRA 13673\nFS Infotainment GmbH & Co. KG – Mülheim an der Ruhr",
      "type": "Registerbekanntmachung nach dem Umwandlungsgesetz",
      "state": "Nordrhein-Westfalen",
      "amtsgericht": "Amtsgericht Duisburg",
      "registernummer": "HRA 13673",
      "registerart": "HRA",
      "company_name": "FS Infotainment GmbH & Co. KG",
      "company_seat": "Mülheim an der Ruhr",
      "details": "29.10.2025 (Bekanntmachungsdatum)\n\nNordrhein-Westfalen Amtsgericht Duisburg HRA 13673\nRegisterbekanntmachung nach dem Umwandlungsgesetz 29.10.2025 (Eintragungsdatum)\n\nFS Infotainment GmbH & Co. KG\nKommanditgesellschaft\nMülheim an der Ruhr\n\nDen Gläubigern der an der Ausgliederung beteiligten Rechtsträger ist, wenn sie binnen sechs Monaten nach dem Tag, an dem die Eintragung der Ausgliederung in das Register des Sitzes desjenigen Rechtsträgers, dessen Gläubiger sie sind, nach § 19 Absatz 3 UmwG als bekanntgemacht gilt, ihren Anspruch nach Grund und Höhe schriftlich anmelden, Sicherheit zu leisten, soweit sie nicht Befriedigung verlangen können. Dieses Recht steht den Gläubigern jedoch nur zu, wenn sie glaubhaft machen, dass durch die Ausgliederung die Erfüllung ihrer Forderung gefährdet wird."
    },
    {
      "date": "2025-10-29",
      "id": "135734",
      "original_text": "Registerbekanntmachung nach dem Umwandlungsgesetz\nNordrhein-Westfalen Amtsgericht Wuppertal HRA 26061\nU.P. Elektro & Datentechnik GmbH & Co. KG – Haan",
      "type": "Registerbekanntmachung nach dem Umwandlungsgesetz",
      "state": "Nordrhein-Westfalen",
      "amtsgericht": "Amtsgericht Wuppertal",
      "registernummer": "HRA 26061",
      "registerart": "HRA",
      "company_name": "U.P. Elektro & Datentechnik GmbH & Co. KG",
      "company_seat": "Haan",
      "details": "29.10.2025 (Bekanntmachungsdatum)\n\nNordrhein-Westfalen Amtsgericht Wuppertal HRA 26061\nRegisterbekanntmachung nach dem Umwandlungsgesetz 29.10.2025 (Eintragungsdatum)\n\nU.P. Elektro & Datentechnik GmbH & Co. KG\nKommanditgesellschaft\nHaan\n\nDen Gläubigern der an der Ausgliederung beteiligten Rechtsträger ist, wenn sie binnen sechs Monaten nach dem Tag, an dem die Eintragung der Ausgliederung in das Register des Sitzes desjenigen Rechtsträgers, dessen Gläubiger sie sind, nach § 19 Absatz 3 UmwG als bekanntgemacht gilt, ihren Anspruch nach Grund und Höhe schriftlich anmelden, Sicherheit zu leisten, soweit sie nicht Befriedigung verlangen können. Dieses Recht steht den Gläubigern jedoch nur zu, wenn sie glaubhaft machen, dass durch die Ausgliederung die Erfüllung ihrer Forderung gefährdet wird."
    },
    {
      "date": "2025-10-29",
      "id": "135735",
      "original_text": "Registerbekanntmachung nach dem Umwandlungsgesetz\nNordrhein-Westfalen Amtsgericht Steinfurt HRB 15684\nHGD Strauss GmbH – Ibbenbüren",
      "type": "Registerbekanntmachung nach dem Umwandlungsgesetz",
      "state": "Nordrhein-Westfalen",
      "amtsgericht": "Amtsgericht Steinfurt",
      "registernummer": "HRB 15684",
      "registerart": "HRB",
      "company_name": "HGD Strauss GmbH",
      "company_seat": "Ibbenbüren",
      "details": "29.10.2025 (Bekanntmachungsdatum)\n\nNordrhein-Westfalen Amtsgericht Steinfurt HRB 15684\nRegisterbekanntmachung nach dem Umwandlungsgesetz 29.10.2025 (Eintragungsdatum)\n\nHGD Strauss GmbH\nGesellschaft mit beschränkter Haftung\nIbbenbüren\n\nDen Gläubigern der an der Ausgliederung beteiligten Rechtsträger ist, wenn sie binnen sechs Monaten nach dem Tag, an dem die Eintragung der Ausgliederung in das Register des Sitzes desjenigen Rechtsträgers, dessen Gläubiger sie sind, nach § 19 Absatz 3 UmwG als bekanntgemacht gilt, ihren Anspruch nach Grund und Höhe schriftlich anmelden, Sicherheit zu leisten, soweit sie nicht Befriedigung verlangen können. Dieses Recht steht den Gläubigern jedoch nur zu, wenn sie glaubhaft machen, dass durch die Ausgliederung die Erfüllung ihrer Forderung gefährdet wird."
    },
    {
      "date": "2025-10-29",
      "id": "135736",
      "original_text": "Löschungsankündigung\nNordrhein-Westfalen Amtsgericht Aachen HRB 19853\nCzakler Baudienstleistung UG (haftungsbeschränkt) – Übach-Palenberg",
      "type": "Löschungsankündigung",
      "state": "Nordrhein-Westfalen",
      "amtsgericht": "Amtsgericht Aachen",
      "registernummer": "HRB 19853",
      "registerart": "HRB",
      "company_name": "Czakler Baudienstleistung UG (haftungsbeschränkt)",
      "company_seat": "Übach-Palenberg",
      "details": "29.10.2025 (Bekanntmachungsdatum)\n\nNordrhein-Westfalen Amtsgericht Aachen HRB 19853\nLöschungsankündigung\n\nCzakler Baudienstleistung UG (haftungsbeschränkt)\nGesellschaft mit beschränkter Haftung\nÜbach-Palenberg\n\nDas Registergericht beabsichtigt, von Amts wegen die Gesellschaft wegen Vermögenslosigkeit nach § 394 FamFG zu löschen, weil das Finanzamt Geilenkirchen mit Schreiben vom 23.10.2025 Umstände mitgeteilt hat, aufgrund derer das Gericht davon überzeugt ist, dass die Gesellschaft vollständig vermögenslos ist.\n\nZur Geltendmachung des Widerspruchs gegen die beabsichtigte Löschung wird hiermit eine Frist von einem Monat ab Veröffentlichung dieser Ankündigung bestimmt.\n\nRechtsbehelfsbelehrung:\n\nGegen diese Verfügung kann Widerspruch eingelegt werden. Zum Widerspruch ist jeder berechtigt, der an der Unterlassung der Löschung ein berechtigtes Interesse hat.\n\nDer Widerspruch ist bei dem Amtsgericht Aachen, Adalbertsteinweg 92, 52070 Aachen schriftlich in deutscher Sprache oder zur Niederschrift der Geschäftsstelle einzulegen. Der Widerspruch kann auch zur Niederschrift der Geschäftsstelle eines jeden Amtsgerichtes abgegeben werden.\n\nDer Widerspruch muss spätestens innerhalb der gesetzten Frist nach der Bekanntgabe der Verfügung bei dem Amtsgericht Aachen eingegangen sein. Dies gilt auch dann, wenn der Widerspruch zur Niederschrift der Geschäftsstelle eines anderen Amtsgerichtes abgegeben wurde. Die Frist beginnt mit der Bekanntgabe der Verfügung durch Veröffentlichung. Fällt das Ende der Frist auf einen Sonntag, einen allgemeinen Feiertag oder Sonnabend, so endet die Frist mit Ablauf des nächsten Werktages.\n\nDer Widerspruch muss die Bezeichnung der angefochtenen Verfügung sowie die Erklärung enthalten, dass Widerspruch gegen diese Verfügung eingelegt wird. Er ist zu unterzeichnen und soll begründet werden.\n\nDie Einlegung ist auch durch Übertragung eines elektronischen Dokuments an die elektronische Poststelle des Gerichts möglich. Das elektronische Dokument muss für die Bearbeitung durch das Gericht geeignet und mit einer qualifizierten elektronischen Signatur der verantwortenden Person versehen sein oder von der verantwortenden Person signiert und auf einem sicheren Übermittlungsweg gemäß § 130 a ZPO nach näherer Maßgabe der Verordnung über die technischen Rahmenbedingungen des elektronischen Rechtsverkehrs und über das besondere elektronische Behördenpostfach (BGBl. I, S. 3803) eingereicht werden. Weitere Informationen erhalten Sie auf der Internetseite www.justiz.de."
    },
    {
      "date": "2025-10-29",
      "id": "135737",
      "original_text": "Registerbekanntmachung nach dem Umwandlungsgesetz\nNordrhein-Westfalen Amtsgericht Neuss HRB 23803\nEYS Project GmbH – Korschenbroich",
      "type": "Registerbekanntmachung nach dem Umwandlungsgesetz",
      "state": "Nordrhein-Westfalen",
      "amtsgericht": "Amtsgericht Neuss",
      "registernummer": "HRB 23803",
      "registerart": "HRB",
      "company_name": "EYS Project GmbH",
      "company_seat": "Korschenbroich",
      "details": "29.10.2025 (Bekanntmachungsdatum)\n\nNordrhein-Westfalen Amtsgericht Neuss HRB 23803\nRegisterbekanntmachung nach dem Umwandlungsgesetz 29.10.2025 (Eintragungsdatum)\n\nEYS Project GmbH\nGesellschaft mit beschränkter Haftung\nKorschenbroich\n\nDen Gläubigern der an der Verschmelzung beteiligten Rechtsträger ist, wenn sie binnen sechs Monaten nach dem Tag, an dem die Eintragung der Verschmelzung in das Register des Sitzes desjenigen Rechtsträgers, dessen Gläubiger sie sind, nach § 19 Absatz 3 UmwG als bekanntgemacht gilt, ihren Anspruch nach Grund und Höhe schriftlich anmelden, Sicherheit zu leisten, soweit sie nicht Befriedigung verlangen können. Dieses Recht steht den Gläubigern jedoch nur zu, wenn sie glaubhaft machen, dass durch die Verschmelzung die Erfüllung ihrer Forderung gefährdet wird."
    },
    {
      "date": "2025-10-29",
      "id": "135738",
      "original_text": "Registerbekanntmachung nach dem Umwandlungsgesetz\nNordrhein-Westfalen Amtsgericht Köln HRB 37474\nRadium Lampenwerk Gesellschaft mit beschränkter Haftung – Wipperfürth",
      "type": "Registerbekanntmachung nach dem Umwandlungsgesetz",
      "state": "Nordrhein-Westfalen",
      "amtsgericht": "Amtsgericht Köln",
      "registernummer": "HRB 37474",
      "registerart": "HRB",
      "company_name": "Radium Lampenwerk Gesellschaft mit beschränkter Haftung",
      "company_seat": "Wipperfürth",
      "details": "29.10.2025 (Bekanntmachungsdatum)\n\nNordrhein-Westfalen Amtsgericht Köln HRB 37474\nRegisterbekanntmachung nach dem Umwandlungsgesetz 29.10.2025 (Eintragungsdatum)\n\nRadium Lampenwerk Gesellschaft mit beschränkter Haftung\nGesellschaft mit beschränkter Haftung\nWipperfürth\n\nDie Bekanntmachung vom 20.10.2025 wird von Amts wegen berichtigt und insgesamt wie folgt neu gefasst:\nDen Gläubigern der an der Ausgliederung beteiligten Rechtsträger ist, wenn sie binnen sechs Monaten nach dem Tag, an dem die Eintragung der Ausgliederung in das Register des Sitzes desjenigen Rechtsträgers, dessen Gläubiger sie sind, nach § 19 Absatz 3 UmwG als bekanntgemacht gilt, ihren Anspruch nach Grund und Höhe schriftlich anmelden, Sicherheit zu leisten, soweit sie nicht Befriedigung verlangen können. Dieses Recht steht den Gläubigern jedoch nur zu, wenn sie glaubhaft machen, dass durch die Ausgliederung die Erfüllung ihrer Forderung gefährdet wird."
    },
    {
      "date": "2025-10-29",
      "id": "135739",
      "original_text": "Registerbekanntmachung nach dem Umwandlungsgesetz\nNordrhein-Westfalen Amtsgericht Duisburg HRA 13654\nFriedhelm Susok - FS Infotainment e.K. – Mülheim an der Ruhr",
      "type": "Registerbekanntmachung nach dem Umwandlungsgesetz",
      "state": "Nordrhein-Westfalen",
      "amtsgericht": "Amtsgericht Duisburg",
      "registernummer": "HRA 13654",
      "registerart": "HRA",
      "company_name": "Friedhelm Susok - FS Infotainment e.K.",
      "company_seat": "Mülheim an der Ruhr",
      "details": "29.10.2025 (Bekanntmachungsdatum)\n\nNordrhein-Westfalen Amtsgericht Duisburg HRA 13654\nRegisterbekanntmachung nach dem Umwandlungsgesetz 29.10.2025 (Eintragungsdatum)\n\nFriedhelm Susok - FS Infotainment e.K.\nEinzelkaufmann / Einzelkauffrau\nMülheim an der Ruhr\n\nDen Gläubigern der an der Ausgliederung beteiligten Rechtsträger ist, wenn sie binnen sechs Monaten nach dem Tag, an dem die Eintragung der Ausgliederung in das Register des Sitzes desjenigen Rechtsträgers, dessen Gläubiger sie sind, nach § 19 Absatz 3 UmwG als bekanntgemacht gilt, ihren Anspruch nach Grund und Höhe schriftlich anmelden, Sicherheit zu leisten, soweit sie nicht Befriedigung verlangen können. Dieses Recht steht den Gläubigern jedoch nur zu, wenn sie glaubhaft machen, dass durch die Ausgliederung die Erfüllung ihrer Forderung gefährdet wird."
    },
    {
      "date": "2025-10-29",
      "id": "135740",
      "original_text": "Registerbekanntmachung nach dem Umwandlungsgesetz\nNordrhein-Westfalen Amtsgericht Köln HRA 37985\nEiymer Moumne Kfz-Werkstatt e.K. – Leverkusen",
      "type": "Registerbekanntmachung nach dem Umwandlungsgesetz",
      "state": "Nordrhein-Westfalen",
      "amtsgericht": "Amtsgericht Köln",
      "registernummer": "HRA 37985",
      "registerart": "HRA",
      "company_name": "Eiymer Moumne Kfz-Werkstatt e.K.",
      "company_seat": "Leverkusen",
      "details": "29.10.2025 (Bekanntmachungsdatum)\n\nNordrhein-Westfalen Amtsgericht Köln HRA 37985\nRegisterbekanntmachung nach dem Umwandlungsgesetz 29.10.2025 (Eintragungsdatum)\n\nEiymer Moumne Kfz-Werkstatt e.K.\nEinzelkaufmann / Einzelkauffrau\nLeverkusen\n\nDen Gläubigern der an der Ausgliederung beteiligten Rechtsträger ist, wenn sie binnen sechs Monaten nach dem Tag, an dem die Eintragung der Ausgliederung in das Register des Sitzes derjenigen Rechtsträger deren Gläubiger sie sind, nach § 19 Absatz 3 UmwG als bekanntgemacht gilt, ihren Anspruch nach Grund und Höhe schriftlich anmelden, Sicherheit zu leisten, soweit sie nicht Befriedigung verlangen können. Dieses Recht steht den Gläubigern jedoch nur zu, wenn sie glaubhaft machen, dass durch die Ausgliederung die Erfüllung ihrer Forderung gefährdet wird."
    },
    {
      "date": "2025-10-29",
      "id": "135741",
      "original_text": "Registerbekanntmachung nach dem Umwandlungsgesetz\nNordrhein-Westfalen Amtsgericht Wuppertal HRA 25840\nU.P. Datentechnik e.K. – Haan",
      "type": "Registerbekanntmachung nach dem Umwandlungsgesetz",
      "state": "Nordrhein-Westfalen",
      "amtsgericht": "Amtsgericht Wuppertal",
      "registernummer": "HRA 25840",
      "registerart": "HRA",
      "company_name": "U.P. Datentechnik e.K.",
      "company_seat": "Haan",
      "details": "29.10.2025 (Bekanntmachungsdatum)\n\nNordrhein-Westfalen Amtsgericht Wuppertal HRA 25840\nRegisterbekanntmachung nach dem Umwandlungsgesetz 29.10.2025 (Eintragungsdatum)\n\nU.P. Datentechnik e.K.\nEinzelkaufmann / Einzelkauffrau\nHaan\n\nDen Gläubigern der an der Ausgliederung beteiligten Rechtsträger ist, wenn sie binnen sechs Monaten nach dem Tag, an dem die Eintragung der Ausgliederung in das Register des Sitzes desjenigen Rechtsträgers, dessen Gläubiger sie sind, nach § 19 Absatz 3 UmwG als bekanntgemacht gilt, ihren Anspruch nach Grund und Höhe schriftlich anmelden, Sicherheit zu leisten, soweit sie nicht Befriedigung verlangen können. Dieses Recht steht den Gläubigern jedoch nur zu, wenn sie glaubhaft machen, dass durch die Ausgliederung die Erfüllung ihrer Forderung gefährdet wird."
    },
    {
      "date": "2025-10-29",
      "id": "135742",
      "original_text": "Registerbekanntmachung nach dem Umwandlungsgesetz\nNordrhein-Westfalen Amtsgericht Köln HRB 111903\nAlcides Robotics GmbH – Leverkusen",
      "type": "Registerbekanntmachung nach dem Umwandlungsgesetz",
      "state": "Nordrhein-Westfalen",
      "amtsgericht": "Amtsgericht Köln",
      "registernummer": "HRB 111903",
      "registerart": "HRB",
      "company_name": "Alcides Robotics GmbH",
      "company_seat": "Leverkusen",
      "details": "29.10.2025 (Bekanntmachungsdatum)\n\nNordrhein-Westfalen Amtsgericht Köln HRB 111903\nRegisterbekanntmachung nach dem Umwandlungsgesetz 29.10.2025 (Eintragungsdatum)\n\nAlcides Robotics GmbH\nGesellschaft mit beschränkter Haftung\nLeverkusen\n\nDen Gläubigern der an der Verschmelzung beteiligten Rechtsträger ist, wenn sie binnen sechs Monaten nach dem Tag, an dem die Eintragung der Verschmelzung in das Register des Sitzes desjenigen Rechtsträgers, dessen Gläubiger sie sind, nach § 19 Absatz 3 UmwG als bekanntgemacht gilt, ihren Anspruch nach Grund und Höhe schriftlich anmelden, Sicherheit zu leisten, soweit sie nicht Befriedigung verlangen können. Dieses Recht steht den Gläubigern jedoch nur zu, wenn sie glaubhaft machen, dass durch die Verschmelzung die Erfüllung ihrer Forderung gefährdet wird."
    },
    {
      "date": "2025-10-29",
      "id": "135743",
      "original_text": "Registerbekanntmachung nach dem Umwandlungsgesetz\nNordrhein-Westfalen Amtsgericht Bad Oeynhausen HRB 20583\nGoldman Karaton Bau GmbH – Bünde",
      "type": "Registerbekanntmachung nach dem Umwandlungsgesetz",
      "state": "Nordrhein-Westfalen",
      "amtsgericht": "Amtsgericht Bad Oeynhausen",
      "registernummer": "HRB 20583",
      "registerart": "HRB",
      "company_name": "Goldman Karaton Bau GmbH",
      "company_seat": "Bünde",
      "details": "29.10.2025 (Bekanntmachungsdatum)\n\nNordrhein-Westfalen Amtsgericht Bad Oeynhausen HRB 20583\nRegisterbekanntmachung nach dem Umwandlungsgesetz 29.10.2025 (Eintragungsdatum)\n\nGoldman Karaton Bau GmbH\nGesellschaft mit beschränkter Haftung\nBünde\n\nDen Gläubigern der an der Ausgliederung beteiligten Rechtsträger ist, wenn sie binnen sechs Monaten nach dem Tag, an dem die Eintragung der Ausgliederung in das Register des Sitzes desjenigen Rechtsträgers, dessen Gläubiger sie sind, nach § 19 Absatz 3 UmwG als bekanntgemacht gilt, ihren Anspruch nach Grund und Höhe schriftlich anmelden, Sicherheit zu leisten, soweit sie nicht Befriedigung verlangen können. Dieses Recht steht den Gläubigern jedoch nur zu, wenn sie glaubhaft machen, dass durch die Ausgliederung die Erfüllung ihrer Forderung gefährdet wird."
    },
    {
      "date": "2025-10-29",
      "id": "135744",
      "original_text": "Löschungsankündigung\nNordrhein-Westfalen Amtsgericht Neuss HRB 22943\nPersonalgeist UG (haftungsbeschränkt) – Meerbusch",
      "type": "Löschungsankündigung",
      "state": "Nordrhein-Westfalen",
      "amtsgericht": "Amtsgericht Neuss",
      "registernummer": "HRB 22943",
      "registerart": "HRB",
      "company_name": "Personalgeist UG (haftungsbeschränkt)",
      "company_seat": "Meerbusch",
      "details": "29.10.2025 (Bekanntmachungsdatum)\n\nNordrhein-Westfalen Amtsgericht Neuss HRB 22943\nLöschungsankündigung 29.10.2025 (Eintragungsdatum)\n\nPersonalgeist UG (haftungsbeschränkt)\nGesellschaft mit beschränkter Haftung\nMeerbusch\n\nDas Registergericht beabsichtigt die Gesellschaft wegen Vermögenslosigkeit aufgrund des § 394 Abs. 1 FamFG zu löschen. Frist zur Geltendmachung eines Widerspruchs: 1 Monat.\nRechtsbehelfsbelehrung:\nGegen diese Verfügung können Sie Widerspruch einlegen.\nDer Widerspruch ist bei dem Amtsgericht Neuss - Registergericht -, Breite Str. 48, 41460 Neuss schriftlich in deutscher Sprache oder zur Niederschrift der Geschäftsstelle einzulegen.\nDer Widerspruch kann auch zur Niederschrift der Geschäftsstelle eines jeden Amtsgerichtes abgegeben werden.\nDie Einlegung ist auch durch Übertragung eines elektronischen Dokuments an die elektronische Poststelle des Gerichts möglich. Das elektronische Dokument muss für die Bearbeitung durch das Gericht geeignet und mit einer qualifizierten elektronischen Signatur der verantwortenden Person versehen sein oder von der verantwortenden Person signiert und auf einem sicheren Übermittlungsweg gemäß § 130a ZPO nach näherer Maßgabe der Verordnung über die technischen Rahmenbedingungen des elektronischen Rechtsverkehrs und über das besondere elektronische Behördenpostfach (BGBl. I, S.3803) eingereicht werden. Weitere Informationen erhalten Sie auf der Internetseite www.justiz.de.\nDer Widerspruch muss spätestens innerhalb der gesetzten Frist nach der schriftlichen Bekanntgabe der Verfügung bei dem Amtsgericht - Registergericht - Neuss eingegangen sein. Dies gilt auch dann, wenn der Widerspruch zur Niederschrift der Geschäftsstelle eines anderen Amtsgerichtes abgegeben wurde. Die Frist beginnt mit der schriftlichen Bekanntgabe der Verfügung. Die Bekanntgabe ist entweder durch Zustellung oder am dritten Tage nach Aufgabe zur Post bewirkt. Fällt das Ende der Frist auf einen Sonntag, einen allgemeinen Feiertag oder Sonnabend, so endet die Frist mit Ablauf des nächsten Werktages.\nDer Widerspruch muss die Bezeichnung der angefochtenen Verfügung sowie die Erklärung enthalten, dass Widerspruch gegen diese Verfügung eingelegt wird. Er ist zu unterzeichnen und soll begründet werden."
    },
    {
      "date": "2025-10-29",
      "id": "135745",
      "original_text": "Löschungsankündigung\nNordrhein-Westfalen Amtsgericht Neuss HRB 22460\nGaranzia Property Management GmbH – Meerbusch",
      "type": "Löschungsankündigung",
      "state": "Nordrhein-Westfalen",
      "amtsgericht": "Amtsgericht Neuss",
      "registernummer": "HRB 22460",
      "registerart": "HRB",
      "company_name": "Garanzia Property Management GmbH",
      "company_seat": "Meerbusch",
      "details": "29.10.2025 (Bekanntmachungsdatum)\n\nNordrhein-Westfalen Amtsgericht Neuss HRB 22460\nLöschungsankündigung 29.10.2025 (Eintragungsdatum)\n\nGaranzia Property Management GmbH\nGesellschaft mit beschränkter Haftung\nMeerbusch\n\nDas Registergericht beabsichtigt die Gesellschaft wegen Vermögenslosigkeit aufgrund des § 394 Abs. 1 FamFG zu löschen. Frist zur Geltendmachung eines Widerspruchs: 1 Monat.\nRechtsbehelfsbelehrung:\nGegen diese Verfügung können Sie Widerspruch einlegen.\nDer Widerspruch ist bei dem Amtsgericht Neuss - Registergericht -, Breite Str. 48, 41460 Neuss schriftlich in deutscher Sprache oder zur Niederschrift der Geschäftsstelle einzulegen.\nDer Widerspruch kann auch zur Niederschrift der Geschäftsstelle eines jeden Amtsgerichtes abgegeben werden.\nDie Einlegung ist auch durch Übertragung eines elektronischen Dokuments an die elektronische Poststelle des Gerichts möglich. Das elektronische Dokument muss für die Bearbeitung durch das Gericht geeignet und mit einer qualifizierten elektronischen Signatur der verantwortenden Person versehen sein oder von der verantwortenden Person signiert und auf einem sicheren Übermittlungsweg gemäß § 130a ZPO nach näherer Maßgabe der Verordnung über die technischen Rahmenbedingungen des elektronischen Rechtsverkehrs und über das besondere elektronische Behördenpostfach (BGBl. I, S.3803) eingereicht werden. Weitere Informationen erhalten Sie auf der Internetseite www.justiz.de.\nDer Widerspruch muss spätestens innerhalb der gesetzten Frist nach der schriftlichen Bekanntgabe der Verfügung bei dem Amtsgericht - Registergericht - Neuss eingegangen sein. Dies gilt auch dann, wenn der Widerspruch zur Niederschrift der Geschäftsstelle eines anderen Amtsgerichtes abgegeben wurde. Die Frist beginnt mit der schriftlichen Bekanntgabe der Verfügung. Die Bekanntgabe ist entweder durch Zustellung oder am dritten Tage nach Aufgabe zur Post bewirkt. Fällt das Ende der Frist auf einen Sonntag, einen allgemeinen Feiertag oder Sonnabend, so endet die Frist mit Ablauf des nächsten Werktages.\nDer Widerspruch muss die Bezeichnung der angefochtenen Verfügung sowie die Erklärung enthalten, dass Widerspruch gegen diese Verfügung eingelegt wird. Er ist zu unterzeichnen und soll begründet werden."
    },
    {
      "date": "2025-10-29",
      "id": "135746",
      "original_text": "Löschungsankündigung\nNordrhein-Westfalen Amtsgericht Köln HRB 113707\nEFT AA trading GmbH – Köln",
      "type": "Löschungsankündigung",
      "state": "Nordrhein-Westfalen",
      "amtsgericht": "Amtsgericht Köln",
      "registernummer": "HRB 113707",
      "registerart": "HRB",
      "company_name": "EFT AA trading GmbH",
      "company_seat": "Köln",
      "details": "29.10.2025 (Bekanntmachungsdatum)\n\nNordrhein-Westfalen Amtsgericht Köln HRB 113707\nLöschungsankündigung\n\nEFT AA trading GmbH\nGesellschaft mit beschränkter Haftung\nKöln\n\nDas Registergericht beabsichtigt die Gesellschaft von Amts wegen nach § 394 FamFG zu löschen. Die Frist zur Erhebung eines Widerspruchs ist auf einen Monat festgesetzt."
    },
    {
      "date": "2025-10-29",
      "id": "135747",
      "original_text": "Löschungsankündigung\nNordrhein-Westfalen Amtsgericht Lemgo HRB 11149\nNG Flachdach UG (haftungsbeschränkt) – Bad Salzuflen",
      "type": "Löschungsankündigung",
      "state": "Nordrhein-Westfalen",
      "amtsgericht": "Amtsgericht Lemgo",
      "registernummer": "HRB 11149",
      "registerart": "HRB",
      "company_name": "NG Flachdach UG (haftungsbeschränkt)",
      "company_seat": "Bad Salzuflen",
      "details": "29.10.2025 (Bekanntmachungsdatum)\n\nNordrhein-Westfalen Amtsgericht Lemgo HRB 11149\nLöschungsankündigung 29.10.2025 (Eintragungsdatum)\n\nNG Flachdach UG (haftungsbeschränkt)\nGesellschaft mit beschränkter Haftung\nBad Salzuflen\n\nEs ist beabsichtigt, die Gesellschaft von Amts wegen im Hinblick auf das Fehlen jeglichen praktisch einen Wert darstellenden Aktivvermögens wegen Vermögenslosigkeit gemäß § 394 Absatz 1 FamFG zu löschen. Hiergegen kann binnen 3 Monaten nach Veröffentlichung dieser Bekanntmachung Widerspruch beim Amtsgericht Lemgo eingelegt werden."
    },
    {
      "date": "2025-10-29",
      "id": "135748",
      "original_text": "Registerbekanntmachung nach dem Umwandlungsgesetz\nHessen Amtsgericht Fulda HRB 5560\nHartung Bau, Ingenieur- Tief- und Straßenbau GmbH – Fulda",
      "type": "Registerbekanntmachung nach dem Umwandlungsgesetz",
      "state": "Hessen",
      "amtsgericht": "Amtsgericht Fulda",
      "registernummer": "HRB 5560",
      "registerart": "HRB",
      "company_name": "Hartung Bau, Ingenieur- Tief- und Straßenbau GmbH",
      "company_seat": "Fulda",
      "details": "29.10.2025 (Bekanntmachungsdatum)\n\nHessen Amtsgericht Fulda HRB 5560\nRegisterbekanntmachung nach dem Umwandlungsgesetz 29.10.2025 (Eintragungsdatum)\n\nHartung Bau, Ingenieur- Tief- und Straßenbau GmbH\nGesellschaft mit beschränkter Haftung\nFulda\n\nDen Gläubigern der an der Verschmelzung beteiligten Rechtsträger ist, wenn sie binnen sechs Monaten nach dem Tag, an dem die Eintragung der Verschmelzung in das Register des Sitzes desjenigen Rechtsträgers, dessen Gläubiger sie sind, nach § 19 Absatz 3 UmwG bekannt gemacht worden ist, ihren Anspruch nach Grund und Höhe schriftlich anmelden, Sicherheit zu leisten, soweit sie nicht Befriedigung verlangen können. Dieses Recht steht den Gläubigern jedoch nur zu, wenn sie glaubhaft machen, dass durch die Verschmelzung die Erfüllung ihrer Forderung gefährdet wird."
    },
    {
      "date": "2025-10-29",
      "id": "135749",
      "original_text": "Einreichung neuer Dokumente\nHessen Amtsgericht Darmstadt HRB 100475\nRöhm GmbH – Darmstadt",
      "type": "Einreichung neuer Dokumente",
      "state": "Hessen",
      "amtsgericht": "Amtsgericht Darmstadt",
      "registernummer": "HRB 100475",
      "registerart": "HRB",
      "company_name": "Röhm GmbH",
      "company_seat": "Darmstadt",
      "details": "29.10.2025 (Bekanntmachungsdatum)\n\nHessen Amtsgericht Darmstadt HRB 100475\nEinreichung neuer Dokumente 21.10.2025 (Eintragungsdatum)\n\nRöhm GmbH\nGesellschaft mit beschränkter Haftung\nDarmstadt\n\nWegen Änderungen in den Personen der Aufsichtsratsmitglieder ist eine Liste der Mitglieder des Aufsichtsrates zum Handelsregister eingereicht worden."
    },
    {
      "date": "2025-10-29",
      "id": "135750",
      "original_text": "Löschungsankündigung\nHessen Amtsgericht Darmstadt HRA 84621\nAuto Bryjak GmbH & Co. KG – Darmstadt",
      "type": "Löschungsankündigung",
      "state": "Hessen",
      "amtsgericht": "Amtsgericht Darmstadt",
      "registernummer": "HRA 84621",
      "registerart": "HRA",
      "company_name": "Auto Bryjak GmbH & Co. KG",
      "company_seat": "Darmstadt",
      "details": "29.10.2025 (Bekanntmachungsdatum)\n\nHessen Amtsgericht Darmstadt HRA 84621\nLöschungsankündigung\n\nAuto Bryjak GmbH & Co. KG\nKommanditgesellschaft\nDarmstadt\n\nGemäß § 31 Abs. 2 S. 2 HGB soll das Erlöschen der Firma von Amts wegen in das Handelsregister eingetragen werden.\nVon diesem Vorhaben werden die bisherigen Gesellschafter oder deren Rechtsnachfolger auf diesem Wege unterrichtet.\nZugleich wird ihnen zur etwaigen Geltendmachung eines Widerspruchs eine Frist von 3 Monaten bestimmt."
    },
    {
      "date": "2025-10-29",
      "id": "135751",
      "original_text": "Löschungsankündigung\nHessen Amtsgericht Hanau HRB 96363\nIMMO-Wohnhaus- und Vermögensanlagen-Verwaltungs GmbH – Linsengericht",
      "type": "Löschungsankündigung",
      "state": "Hessen",
      "amtsgericht": "Amtsgericht Hanau",
      "registernummer": "HRB 96363",
      "registerart": "HRB",
      "company_name": "IMMO-Wohnhaus- und Vermögensanlagen-Verwaltungs GmbH",
      "company_seat": "Linsengericht",
      "details": "29.10.2025 (Bekanntmachungsdatum)\n\nHessen Amtsgericht Hanau HRB 96363\nLöschungsankündigung\n\nIMMO-Wohnhaus- und Vermögensanlagen-Verwaltungs GmbH\nGesellschaft mit beschränkter Haftung\nLinsengericht\n\nDas Registergericht beabsichtigt, den im Handelsregister eingetragenen Liquidator Detlef Unglaub, Linsengericht, von Amts wegen nach § 395 FamFG zu löschen. Die Frist zur Erhebung eines Widerspruchs gegen die beabsichtigte Löschung wird auf 3 Monate festgesetzt."
    },
    {
      "date": "2025-10-29",
      "id": "135752",
      "original_text": "Einreichung neuer Dokumente\nHessen Amtsgericht Offenbach am Main HRB 40710\nSchüllermann und Partner AG Wirtschaftsprüfungsgesellschaft Steuerberatungsgesellschaft – Dreieich",
      "type": "Einreichung neuer Dokumente",
      "state": "Hessen",
      "amtsgericht": "Amtsgericht Offenbach am Main",
      "registernummer": "HRB 40710",
      "registerart": "HRB",
      "company_name": "Schüllermann und Partner AG Wirtschaftsprüfungsgesellschaft Steuerberatungsgesellschaft",
      "company_seat": "Dreieich",
      "details": "29.10.2025 (Bekanntmachungsdatum)\n\nHessen Amtsgericht Offenbach am Main HRB 40710\nEinreichung neuer Dokumente 29.10.2025 (Eintragungsdatum)\n\nSchüllermann und Partner AG Wirtschaftsprüfungsgesellschaft Steuerberatungsgesellschaft\nAktiengesellschaft\nDreieich\n\nDurch eine Änderung in den Personen der Aufsichtsratsmitglieder ist eine Liste der Mitglieder des Aufsichtsrates zum Handelsregister eingereicht worden."
    },
    {
      "date": "2025-10-29",
      "id": "135753",
      "original_text": "Löschungsankündigung\nHessen Amtsgericht Frankfurt am Main HRB 103891\nEAG GmbH – Frankfurt am Main",
      "type": "Löschungsankündigung",
      "state": "Hessen",
      "amtsgericht": "Amtsgericht Frankfurt am Main",
      "registernummer": "HRB 103891",
      "registerart": "HRB",
      "company_name": "EAG GmbH",
      "company_seat": "Frankfurt am Main",
      "details": "29.10.2025 (Bekanntmachungsdatum)\n\nHessen Amtsgericht Frankfurt am Main HRB 103891\nLöschungsankündigung\n\nEAG GmbH\nGesellschaft mit beschränkter Haftung\nFrankfurt am Main\n\nDas Registergericht beabsichtigt die im Handelsregister eingetragene Gesellschaft von Amts wegen nach § 394 FamFG zu löschen. Die Frist zur Erhebung eines Widerspruchs gegen die beabsichtigte Löschung wird auf 1 Monate festgesetzt."
    },
    {
      "date": "2025-10-29",
      "id": "135754",
      "original_text": "Löschungsankündigung\nHessen Amtsgericht Königstein HRB 10112\nCom2Safe GmbH – Königstein im Taunus",
      "type": "Löschungsankündigung",
      "state": "Hessen",
      "amtsgericht": "Amtsgericht Königstein",
      "registernummer": "HRB 10112",
      "registerart": "HRB",
      "company_name": "Com2Safe GmbH",
      "company_seat": "Königstein im Taunus",
      "details": "29.10.2025 (Bekanntmachungsdatum)\n\nHessen Amtsgericht Königstein HRB 10112\nLöschungsankündigung\n\nCom2Safe GmbH\nGesellschaft mit beschränkter Haftung\nKönigstein im Taunus\n\nDas Registergericht beabsichtigt die im Handelsregister eingetragene Gesellschaft von Amts wegen nach § 394 FamFG zu löschen. Die Frist zur Erhebung eines Widerspruchs gegen die beabsichtigte Löschung wird auf 3 Monate festgesetzt."
    },
    {
      "date": "2025-10-29",
      "id": "135755",
      "original_text": "Registerbekanntmachung nach dem Umwandlungsgesetz\nHessen Amtsgericht Limburg HRB 7555\nGerüstbau Limburg GmbH – Merenberg",
      "type": "Registerbekanntmachung nach dem Umwandlungsgesetz",
      "state": "Hessen",
      "amtsgericht": "Amtsgericht Limburg",
      "registernummer": "HRB 7555",
      "registerart": "HRB",
      "company_name": "Gerüstbau Limburg GmbH",
      "company_seat": "Merenberg",
      "details": "29.10.2025 (Bekanntmachungsdatum)\n\nHessen Amtsgericht Limburg HRB 7555\nRegisterbekanntmachung nach dem Umwandlungsgesetz 29.10.2025 (Eintragungsdatum)\n\nGerüstbau Limburg GmbH\nGesellschaft mit beschränkter Haftung\nMerenberg\n\nDen Gläubigern der an der Ausgliederung beteiligten Rechtsträger ist, wenn sie binnen sechs Monaten nach dem Tag, an dem die Eintragung der Ausgliederung in das Register des Sitzes desjenigen Rechtsträgers, dessen Gläubiger sie sind, nach §§ 125, 19 Absatz 3 UmwG bekannt gemacht worden ist, ihren Anspruch nach Grund und Höhe schriftlich anmelden, Sicherheit zu leisten, soweit sie nicht Befriedigung verlangen können. Dieses Recht steht den Gläubigern jedoch nur zu, wenn sie glaubhaft machen, dass durch die Ausgliederung die Erfüllung ihrer Forderung gefährdet wird."
    },
    {
      "date": "2025-10-29",
      "id": "135756",
      "original_text": "Sonstige Registerbekanntmachung\nHessen Amtsgericht Kassel VR 5187\nLateinamerikanischer Tanzverein Kassel e.V. – Kassel",
      "type": "Sonstige Registerbekanntmachung",
      "state": "Hessen",
      "amtsgericht": "Amtsgericht Kassel",
      "registernummer": "VR 5187",
      "registerart": "VR",
      "company_name": "Lateinamerikanischer Tanzverein Kassel e.V.",
      "company_seat": "Kassel",
      "details": "29.10.2025 (Bekanntmachungsdatum)\n\nHessen Amtsgericht Kassel VR 5187\nSonstige Registerbekanntmachung 29.10.2025 (Eintragungsdatum)\n\nLateinamerikanischer Tanzverein Kassel e.V.\neingetragener Verein\nKassel\n\nDer Verein ist aufgelöst und liquidationslos erloschen."
    },
    {
      "date": "2025-10-29",
      "id": "135757",
      "original_text": "Löschungsankündigung\nHessen Amtsgericht Wiesbaden HRB 33049\nVital Bau Profi GmbH – Wiesbaden",
      "type": "Löschungsankündigung",
      "state": "Hessen",
      "amtsgericht": "Amtsgericht Wiesbaden",
      "registernummer": "HRB 33049",
      "registerart": "HRB",
      "company_name": "Vital Bau Profi GmbH",
      "company_seat": "Wiesbaden",
      "details": "29.10.2025 (Bekanntmachungsdatum)\n\nHessen Amtsgericht Wiesbaden HRB 33049\nLöschungsankündigung\n\nVital Bau Profi GmbH\nGesellschaft mit beschränkter Haftung\nWiesbaden\n\nDas Registergericht beabsichtigt die im Handelsregister eingetragene Gesellschaft von Amts wegen nach § 394 FamFG zu löschen. Die Frist zur Erhebung eines Widerspruchs gegen die beabsichtigte Löschung wird auf 3 Monate festgesetzt."
    },
    {
      "date": "2025-10-29",
      "id": "135758",
      "original_text": "Registerbekanntmachung nach dem Umwandlungsgesetz\nHessen Amtsgericht Fulda HRA 6701\nPeter Boschetto Vermietung von Mobilen e.K. – Dipperz",
      "type": "Registerbekanntmachung nach dem Umwandlungsgesetz",
      "state": "Hessen",
      "amtsgericht": "Amtsgericht Fulda",
      "registernummer": "HRA 6701",
      "registerart": "HRA",
      "company_name": "Peter Boschetto Vermietung von Mobilen e.K.",
      "company_seat": "Dipperz",
      "details": "29.10.2025 (Bekanntmachungsdatum)\n\nHessen Amtsgericht Fulda HRA 6701\nRegisterbekanntmachung nach dem Umwandlungsgesetz 29.10.2025 (Eintragungsdatum)\n\nPeter Boschetto Vermietung von Mobilen e.K.\nEinzelkaufmann / Einzelkauffrau\nDipperz\n\nDen Gläubigern der an der Ausgliederung beteiligten Rechtsträger ist, wenn sie binnen sechs Monaten nach dem Tag, an dem die Eintragung der Ausgliederung in das Register des Sitzes desjenigen Rechtsträgers, dessen Gläubiger sie sind, nach §§ 125, 19 Absatz 3 UmwG bekannt gemacht worden ist, ihren Anspruch nach Grund und Höhe schriftlich anmelden, Sicherheit zu leisten, soweit sie nicht Befriedigung verlangen können. Dieses Recht steht den Gläubigern jedoch nur zu, wenn sie glaubhaft machen, dass durch die Ausgliederung die Erfüllung ihrer Forderung gefährdet wird."
    },
    {
      "date": "2025-10-29",
      "id": "135759",
      "original_text": "Registerbekanntmachung nach dem Umwandlungsgesetz\nHessen Amtsgericht Marburg HRA 5590\nFBS Protect Daniel Geibel GmbH & Co. KG – Schwalmstadt",
      "type": "Registerbekanntmachung nach dem Umwandlungsgesetz",
      "state": "Hessen",
      "amtsgericht": "Amtsgericht Marburg",
      "registernummer": "HRA 5590",
      "registerart": "HRA",
      "company_name": "FBS Protect Daniel Geibel GmbH & Co. KG",
      "company_seat": "Schwalmstadt",
      "details": "29.10.2025 (Bekanntmachungsdatum)\n\nHessen Amtsgericht Marburg HRA 5590\nRegisterbekanntmachung nach dem Umwandlungsgesetz 29.10.2025 (Eintragungsdatum)\n\nFBS Protect Daniel Geibel GmbH & Co. KG\nKommanditgesellschaft\nSchwalmstadt\n\nDen Gläubigern der an der Ausgliederung beteiligten Rechtsträger ist, wenn sie binnen sechs Monaten nach dem Tag, an dem die Eintragung der Ausgliederung in das Register des Sitzes derjenigen Rechtsträger deren Gläubiger sie sind, nach §§ 125, 19 Absatz 3 UmwG bekannt gemacht worden ist, ihren Anspruch nach Grund und Höhe schriftlich anmelden, Sicherheit zu leisten, soweit sie nicht Befriedigung verlangen können. Dieses Recht steht den Gläubigern jedoch nur zu, wenn sie glaubhaft machen, dass durch die Ausgliederung die Erfüllung ihrer Forderung gefährdet wird."
    },
    {
      "date": "2025-10-29",
      "id": "135760",
      "original_text": "Registerbekanntmachung nach dem Umwandlungsgesetz\nHessen Amtsgericht Fulda HRA 6698\nBernd Boschetto Vermietung von Mobilen e.K. – Dipperz",
      "type": "Registerbekanntmachung nach dem Umwandlungsgesetz",
      "state": "Hessen",
      "amtsgericht": "Amtsgericht Fulda",
      "registernummer": "HRA 6698",
      "registerart": "HRA",
      "company_name": "Bernd Boschetto Vermietung von Mobilen e.K.",
      "company_seat": "Dipperz",
      "details": "29.10.2025 (Bekanntmachungsdatum)\n\nHessen Amtsgericht Fulda HRA 6698\nRegisterbekanntmachung nach dem Umwandlungsgesetz 29.10.2025 (Eintragungsdatum)\n\nBernd Boschetto Vermietung von Mobilen e.K.\nEinzelkaufmann / Einzelkauffrau\nDipperz\n\nDen Gläubigern der an der Ausgliederung beteiligten Rechtsträger ist, wenn sie binnen sechs Monaten nach dem Tag, an dem die Eintragung der Ausgliederung in das Register des Sitzes desjenigen Rechtsträgers, dessen Gläubiger sie sind, nach §§ 125, 19 Absatz 3 UmwG bekannt gemacht worden ist, ihren Anspruch nach Grund und Höhe schriftlich anmelden, Sicherheit zu leisten, soweit sie nicht Befriedigung verlangen können. Dieses Recht steht den Gläubigern jedoch nur zu, wenn sie glaubhaft machen, dass durch die Ausgliederung die Erfüllung ihrer Forderung gefährdet wird."
    },
    {
      "date": "2025-10-29",
      "id": "135761",
      "original_text": "Sonstige Registerbekanntmachung\nHessen Amtsgericht Bad Homburg v.d.H. VR 1864\nTTV Burgholzhausen - Köppern – Friedrichsdorf",
      "type": "Sonstige Registerbekanntmachung",
      "state": "Hessen",
      "amtsgericht": "Amtsgericht Bad Homburg v.d.H.",
      "registernummer": "VR 1864",
      "registerart": "VR",
      "company_name": "TTV Burgholzhausen - Köppern",
      "company_seat": "Friedrichsdorf",
      "details": "29.10.2025 (Bekanntmachungsdatum)\n\nHessen Amtsgericht Bad Homburg v.d.H. VR 1864\nSonstige Registerbekanntmachung 29.10.2025 (Eintragungsdatum)\n\nTTV Burgholzhausen - Köppern\neingetragener Verein\nFriedrichsdorf\n\nDer Verein ist aufgelöst."
    },
    {
      "date": "2025-10-29",
      "id": "135762",
      "original_text": "Registerbekanntmachung nach dem Umwandlungsgesetz\nHessen Amtsgericht Wiesbaden HRA 11867\nDaniel Gundlich Optikcom e.K. – Walluf",
      "type": "Registerbekanntmachung nach dem Umwandlungsgesetz",
      "state": "Hessen",
      "amtsgericht": "Amtsgericht Wiesbaden",
      "registernummer": "HRA 11867",
      "registerart": "HRA",
      "company_name": "Daniel Gundlich Optikcom e.K.",
      "company_seat": "Walluf",
      "details": "29.10.2025 (Bekanntmachungsdatum)\n\nHessen Amtsgericht Wiesbaden HRA 11867\nRegisterbekanntmachung nach dem Umwandlungsgesetz 29.10.2025 (Eintragungsdatum)\n\nDaniel Gundlich Optikcom e.K.\nEinzelkaufmann / Einzelkauffrau\nWalluf\n\nDen Gläubigern der an der Ausgliederung beteiligten Rechtsträger ist, wenn sie binnen sechs Monaten nach dem Tag, an dem die Eintragung der Ausgliederung in das Register des Sitzes desjenigen Rechtsträgers, dessen Gläubiger sie sind, nach §§ 125, 19 Absatz 3 UmwG bekannt gemacht worden ist, ihren Anspruch nach Grund und Höhe schriftlich anmelden, Sicherheit zu leisten, soweit sie nicht Befriedigung verlangen können. Dieses Recht steht den Gläubigern jedoch nur zu, wenn sie glaubhaft machen, dass durch die Ausgliederung die Erfüllung ihrer Forderung gefährdet wird."
    },
    {
      "date": "2025-10-29",
      "id": "135763",
      "original_text": "Sonstige Registerbekanntmachung\nHessen Amtsgericht Frankfurt am Main HRB 112533\nNestlé Pensionsfonds AG (NPF) – Frankfurt am Main",
      "type": "Sonstige Registerbekanntmachung",
      "state": "Hessen",
      "amtsgericht": "Amtsgericht Frankfurt am Main",
      "registernummer": "HRB 112533",
      "registerart": "HRB",
      "company_name": "Nestlé Pensionsfonds AG (NPF)",
      "company_seat": "Frankfurt am Main",
      "details": "29.10.2025 (Bekanntmachungsdatum)\n\nHessen Amtsgericht Frankfurt am Main HRB 112533\nSonstige Registerbekanntmachung 29.10.2025 (Eintragungsdatum)\n\nNestlé Pensionsfonds AG (NPF)\nAktiengesellschaft\nFrankfurt am Main\n\nDurch eine Änderung in den Personen der Aufsichtsratsmitglieder ist eine Liste der Mitglieder des Aufsichtsrates zum Handelsregister eingereicht worden."
    },
    {
      "date": "2025-10-29",
      "id": "135764",
      "original_text": "Registerbekanntmachung nach dem Umwandlungsgesetz\nHessen Amtsgericht Fulda HRB 2365\nITF GmbH – Fulda",
      "type": "Registerbekanntmachung nach dem Umwandlungsgesetz",
      "state": "Hessen",
      "amtsgericht": "Amtsgericht Fulda",
      "registernummer": "HRB 2365",
      "registerart": "HRB",
      "company_name": "ITF GmbH",
      "company_seat": "Fulda",
      "details": "29.10.2025 (Bekanntmachungsdatum)\n\nHessen Amtsgericht Fulda HRB 2365\nRegisterbekanntmachung nach dem Umwandlungsgesetz 29.10.2025 (Eintragungsdatum)\n\nITF GmbH\nGesellschaft mit beschränkter Haftung\nFulda\n\nDen Gläubigern der an der Verschmelzung beteiligten Rechtsträger ist, wenn sie binnen sechs Monaten nach dem Tag, an dem die Eintragung der Verschmelzung in das Register des Sitzes desjenigen Rechtsträgers, dessen Gläubiger sie sind, nach § 19 Absatz 3 UmwG bekannt gemacht worden ist, ihren Anspruch nach Grund und Höhe schriftlich anmelden, Sicherheit zu leisten, soweit sie nicht Befriedigung verlangen können. Dieses Recht steht den Gläubigern jedoch nur zu, wenn sie glaubhaft machen, dass durch die Verschmelzung die Erfüllung ihrer Forderung gefährdet wird."
    },
    {
      "date": "2025-10-29",
      "id": "135765",
      "original_text": "Registerbekanntmachung nach dem Umwandlungsgesetz\nHessen Amtsgericht Wetzlar HRA 7590\nLB Handels GmbH & Co. KG – Wetzlar",
      "type": "Registerbekanntmachung nach dem Umwandlungsgesetz",
      "state": "Hessen",
      "amtsgericht": "Amtsgericht Wetzlar",
      "registernummer": "HRA 7590",
      "registerart": "HRA",
      "company_name": "LB Handels GmbH & Co. KG",
      "company_seat": "Wetzlar",
      "details": "29.10.2025 (Bekanntmachungsdatum)\n\nHessen Amtsgericht Wetzlar HRA 7590\nRegisterbekanntmachung nach dem Umwandlungsgesetz 29.10.0205 (Eintragungsdatum)\n\nLB Handels GmbH & Co. KG\nKommanditgesellschaft\nWetzlar\n\nDen Gläubigern der an der formwechselnden Umwandlung beteiligten Rechtsträger ist, wenn sie binnen sechs Monaten nach dem Tag, an dem die Eintragung der formwechselnden Umwandlung in das Register des Sitzes desjenigen Rechtsträgers, dessen Gläubiger sie sind, nach § 201 UmwG bekannt gemacht worden ist, ihren Anspruch nach Grund und Höhe schriftlich anmelden, Sicherheit zu leisten, soweit sie nicht Befriedigung verlangen können. Dieses Recht steht den Gläubigern jedoch nur zu, wenn sie glaubhaft machen, dass durch die formwechselnden Umwandlung die Erfüllung ihrer Forderung gefährdet wird."
    },
    {
      "date": "2025-10-29",
      "id": "135766",
      "original_text": "Registerbekanntmachung nach dem Umwandlungsgesetz\nHessen Amtsgericht Marburg HRA 5582\nFBS Protect e. K. – Schwalmstadt",
      "type": "Registerbekanntmachung nach dem Umwandlungsgesetz",
      "state": "Hessen",
      "amtsgericht": "Amtsgericht Marburg",
      "registernummer": "HRA 5582",
      "registerart": "HRA",
      "company_name": "FBS Protect e. K.",
      "company_seat": "Schwalmstadt",
      "details": "29.10.2025 (Bekanntmachungsdatum)\n\nHessen Amtsgericht Marburg HRA 5582\nRegisterbekanntmachung nach dem Umwandlungsgesetz 29.10.2025 (Eintragungsdatum)\n\nFBS Protect e. K.\nEinzelkaufmann / Einzelkauffrau\nSchwalmstadt\n\nDen Gläubigern der an der Ausgliederung beteiligten Rechtsträger ist, wenn sie binnen sechs Monaten nach dem Tag, an dem die Eintragung der Ausgliederung in das Register des Sitzes derjenigen Rechtsträger deren Gläubiger sie sind, nach §§ 125, 19 Absatz 3 UmwG bekannt gemacht worden ist, ihren Anspruch nach Grund und Höhe schriftlich anmelden, Sicherheit zu leisten, soweit sie nicht Befriedigung verlangen können. Dieses Recht steht den Gläubigern jedoch nur zu, wenn sie glaubhaft machen, dass durch die Ausgliederung die Erfüllung ihrer Forderung gefährdet wird."
    },
    {
      "date": "2025-10-29",
      "id": "135767",
      "original_text": "Sonstige Registerbekanntmachung\nHessen Amtsgericht Wetzlar HRB 5359\nRH Automation GmbH – Ehringshausen",
      "type": "Sonstige Registerbekanntmachung",
      "state": "Hessen",
      "amtsgericht": "Amtsgericht Wetzlar",
      "registernummer": "HRB 5359",
      "registerart": "HRB",
      "company_name": "RH Automation GmbH",
      "company_seat": "Ehringshausen",
      "details": "29.10.2025 (Bekanntmachungsdatum)\n\nHessen Amtsgericht Wetzlar HRB 5359\nSonstige Registerbekanntmachung 29.10.2025 (Eintragungsdatum)\n\nRH Automation GmbH\nGesellschaft mit beschränkter Haftung\nEhringshausen\n\nDen Gläubigern der Gesellschaft, deren Forderungen begründet worden sind, bevor die Eintragung der Beendigung des Vertrags in das Handelsregister nach § 10 HGB bekannt gemacht worden ist, ist vom anderen Vertragsteil Sicherheit zu leisten, wenn sie sich binnen sechs Monaten nach dieser Bekanntmachung zu diesem Zweck bei ihm melden."
    },
    {
      "date": "2025-10-29",
      "id": "135768",
      "original_text": "Registerbekanntmachung nach dem Umwandlungsgesetz\nHessen Amtsgericht Fulda HRA 6187\nBoschetto Grundstücksverwaltung GmbH & Co. KG – Dipperz",
      "type": "Registerbekanntmachung nach dem Umwandlungsgesetz",
      "state": "Hessen",
      "amtsgericht": "Amtsgericht Fulda",
      "registernummer": "HRA 6187",
      "registerart": "HRA",
      "company_name": "Boschetto Grundstücksverwaltung GmbH & Co. KG",
      "company_seat": "Dipperz",
      "details": "29.10.2025 (Bekanntmachungsdatum)\n\nHessen Amtsgericht Fulda HRA 6187\nRegisterbekanntmachung nach dem Umwandlungsgesetz 29.10.2025 (Eintragungsdatum)\n\nBoschetto Grundstücksverwaltung GmbH & Co. KG\nKommanditgesellschaft\nDipperz\n\nDen Gläubigern der an der Ausgliederung beteiligten Rechtsträger ist, wenn sie binnen sechs Monaten nach dem Tag, an dem die Eintragung der Ausgliederung in das Register des Sitzes derjenigen Rechtsträger deren Gläubiger sie sind, nach §§ 125, 19 Absatz 3 UmwG bekannt gemacht worden ist, ihren Anspruch nach Grund und Höhe schriftlich anmelden, Sicherheit zu leisten, soweit sie nicht Befriedigung verlangen können. Dieses Recht steht den Gläubigern jedoch nur zu, wenn sie glaubhaft machen, dass durch die Ausgliederung die Erfüllung ihrer Forderung gefährdet wird."
    },
    {
      "date": "2025-10-29",
      "id": "135769",
      "original_text": "Sonstige Registerbekanntmachung\nHessen Amtsgericht Kassel VR 5719\nDeutsche Gesellschaft für Bildung & Wohlstand e.V. – Zierenberg",
      "type": "Sonstige Registerbekanntmachung",
      "state": "Hessen",
      "amtsgericht": "Amtsgericht Kassel",
      "registernummer": "VR 5719",
      "registerart": "VR",
      "company_name": "Deutsche Gesellschaft für Bildung & Wohlstand e.V.",
      "company_seat": "Zierenberg",
      "details": "29.10.2025 (Bekanntmachungsdatum)\n\nHessen Amtsgericht Kassel VR 5719\nSonstige Registerbekanntmachung 29.10.2025 (Eintragungsdatum)\n\nDeutsche Gesellschaft für Bildung & Wohlstand e.V.\neingetragener Verein\nZierenberg\n\nDer Verein ist aufgelöst."
    },
    {
      "date": "2025-10-29",
      "id": "135770",
      "original_text": "Registerbekanntmachung nach dem Umwandlungsgesetz\nHessen Amtsgericht Limburg HRA 3619\nGerüstbau Limburg - Sascha Krämer e.K. – Hadamar-Steinbach",
      "type": "Registerbekanntmachung nach dem Umwandlungsgesetz",
      "state": "Hessen",
      "amtsgericht": "Amtsgericht Limburg",
      "registernummer": "HRA 3619",
      "registerart": "HRA",
      "company_name": "Gerüstbau Limburg - Sascha Krämer e.K.",
      "company_seat": "Hadamar-Steinbach",
      "details": "29.10.2025 (Bekanntmachungsdatum)\n\nHessen Amtsgericht Limburg HRA 3619\nRegisterbekanntmachung nach dem Umwandlungsgesetz 29.10.2025 (Eintragungsdatum)\n\nGerüstbau Limburg - Sascha Krämer e.K.\nEinzelkaufmann / Einzelkauffrau\nHadamar-Steinbach\n\nDen Gläubigern der an der Ausgliederung beteiligten Rechtsträger ist, wenn sie binnen sechs Monaten nach dem Tag, an dem die Eintragung der Ausgliederung in das Register des Sitzes desjenigen Rechtsträgers, dessen Gläubiger sie sind, nach §§ 125, 19 Absatz 3 UmwG bekannt gemacht worden ist, ihren Anspruch nach Grund und Höhe schriftlich anmelden, Sicherheit zu leisten, soweit sie nicht Befriedigung verlangen können. Dieses Recht steht den Gläubigern jedoch nur zu, wenn sie glaubhaft machen, dass durch die Ausgliederung die Erfüllung ihrer Forderung gefährdet wird."
    }
  ]
}