{
  "date": "2025-10-30",
  "date_of_scrape": "2025-10-31T04:12:48.964Z",
  "tool_version": "0.2.0",
  "number_of_announcements": 155,
  "announcements": [
    {
      "date": "2025-10-30",
      "id": "135771",
      "original_text": "Löschungsankündigung\nBayern Amtsgericht München HRA 94979\nTAURAM Solarpark Barletta GmbH & Co. KG – Grasbrunn",
      "type": "Löschungsankündigung",
      "state": "Bayern",
      "amtsgericht": "Amtsgericht München",
      "registernummer": "HRA 94979",
      "registerart": "HRA",
      "company_name": "TAURAM Solarpark Barletta GmbH & Co. KG",
      "company_seat": "Grasbrunn",
      "details": "30.10.2025 (Bekanntmachungsdatum)\n\nBayern Amtsgericht München HRA 94979\nLöschungsankündigung\n\nTAURAM Solarpark Barletta GmbH & Co. KG\nKommanditgesellschaft\nGrasbrunn\n\nDas Registergericht beabsichtigt, die im Handelsregister eingetragene Firma von Amts wegen nach § 31 Abs. 2 HGB zu löschen. Die Frist zur Erhebung eines Widerspruchs ist auf drei Monate festgesetzt."
    },
    {
      "date": "2025-10-30",
      "id": "135772",
      "original_text": "Löschungsankündigung\nBayern Amtsgericht München HRB 237011\nMEGA GLOBAL SERVICE GmbH – München",
      "type": "Löschungsankündigung",
      "state": "Bayern",
      "amtsgericht": "Amtsgericht München",
      "registernummer": "HRB 237011",
      "registerart": "HRB",
      "company_name": "MEGA GLOBAL SERVICE GmbH",
      "company_seat": "München",
      "details": "30.10.2025 (Bekanntmachungsdatum)\n\nBayern Amtsgericht München HRB 237011\nLöschungsankündigung 29.10.2025 (Eintragungsdatum)\n\nMEGA GLOBAL SERVICE GmbH\nGesellschaft mit beschränkter Haftung\nMünchen\n\nDas Registergericht beabsichtigt, die im Handelsregister eingetragene Gesellschaft wegen Vermögenslosigkeit von Amts wegen nach § 394 FamFG zu löschen. Die Frist zur Erhebung eines Widerspruchs ist auf drei Monate festgesetzt."
    },
    {
      "date": "2025-10-30",
      "id": "135773",
      "original_text": "Registerbekanntmachung nach dem Umwandlungsgesetz\nBayern Amtsgericht Nürnberg HRA 20411\nSportpark Nord GmbH & Co. KG – Nürnberg",
      "type": "Registerbekanntmachung nach dem Umwandlungsgesetz",
      "state": "Bayern",
      "amtsgericht": "Amtsgericht Nürnberg",
      "registernummer": "HRA 20411",
      "registerart": "HRA",
      "company_name": "Sportpark Nord GmbH & Co. KG",
      "company_seat": "Nürnberg",
      "details": "30.10.2025 (Bekanntmachungsdatum)\n\nBayern Amtsgericht Nürnberg HRA 20411\nRegisterbekanntmachung nach dem Umwandlungsgesetz 29.10.2025 (Eintragungsdatum)\n\nSportpark Nord GmbH & Co. KG\nKommanditgesellschaft\nNürnberg\n\nDen Gläubigern der an der Ausgliederung beteiligten Rechtsträger ist, wenn sie binnen sechs Monaten nach dem Tag, an dem die Eintragung der Ausgliederung in das Register des Sitzes desjenigen Rechtsträgers, dessen Gläubiger sie sind, nach §§ 125, 19 Abs. 3 UmwG als bekannt gemacht gilt, ihren Anspruch nach Grund und Höhe in Textform anmelden, Sicherheit zu leisten, soweit sie nicht Befriedigung verlangen können. Dieses Recht steht den Gläubigern jedoch nur zu, wenn sie glaubhaft machen, dass durch die Ausgliederung die Erfüllung ihrer Forderung gefährdet wird."
    },
    {
      "date": "2025-10-30",
      "id": "135774",
      "original_text": "Löschungsankündigung\nBayern Amtsgericht Ingolstadt HRA 3535\nFleisch- und Wurstwaren Beyer UG (haftungsbeschränkt) & Co. KG – Ingolstadt",
      "type": "Löschungsankündigung",
      "state": "Bayern",
      "amtsgericht": "Amtsgericht Ingolstadt",
      "registernummer": "HRA 3535",
      "registerart": "HRA",
      "company_name": "Fleisch- und Wurstwaren Beyer UG (haftungsbeschränkt) & Co. KG",
      "company_seat": "Ingolstadt",
      "details": "30.10.2025 (Bekanntmachungsdatum)\n\nBayern Amtsgericht Ingolstadt HRA 3535\nLöschungsankündigung\n\nFleisch- und Wurstwaren Beyer UG (haftungsbeschränkt) & Co. KG\nKommanditgesellschaft\nIngolstadt\n\nDas Registergericht beabsichtigt, die im Handelsregister eingetragene Firma wegen Vermögenslosigkeit von Amts wegen nach § 394 FamFG zu löschen. Die Frist zur Erhebung eines Widerspruchs ist auf einen Monat festgesetzt."
    },
    {
      "date": "2025-10-30",
      "id": "135775",
      "original_text": "Registerbekanntmachung nach dem Umwandlungsgesetz\nBayern Amtsgericht München HRA 121511\nGenerationSound Eventverleih Patrick Hausotter e.K. – Erdweg",
      "type": "Registerbekanntmachung nach dem Umwandlungsgesetz",
      "state": "Bayern",
      "amtsgericht": "Amtsgericht München",
      "registernummer": "HRA 121511",
      "registerart": "HRA",
      "company_name": "GenerationSound Eventverleih Patrick Hausotter e.K.",
      "company_seat": "Erdweg",
      "details": "30.10.2025 (Bekanntmachungsdatum)\n\nBayern Amtsgericht München HRA 121511\nRegisterbekanntmachung nach dem Umwandlungsgesetz 29.10.2025 (Eintragungsdatum)\n\nGenerationSound Eventverleih Patrick Hausotter e.K.\nEinzelkaufmann / Einzelkauffrau\nErdweg\n\nZur Ausgliederung des einzelkaufmännischen Unternehmens GenerationSound Eventverleih Patrick Hausotter e.K. mit Sitz in Erdweg (Amtsgericht München, HRA 121511) auf die GenerationSound Events GmbH mit Sitz in Erdweg (Amtsgericht München HRB 306624): Den Gläubigern der an der Ausgliederung beteiligten Rechtsträger ist, wenn sie binnen sechs Monaten nach dem Tag, an dem die Eintragung der Ausgliederung in das Register des Sitzes desjenigen Rechtsträgers, dessen Gläubiger sie sind, nach §§ 125, 19 Abs. 3 UmwG als bekannt gemacht gilt, ihren Anspruch nach Grund und Höhe in Textform anmelden, Sicherheit zu leisten, soweit sie nicht Befriedigung verlangen können. Dieses Recht steht den Gläubigern jedoch nur zu, wenn sie glaubhaft machen, dass durch die Ausgliederung die Erfüllung ihrer Forderung gefährdet wird."
    },
    {
      "date": "2025-10-30",
      "id": "135776",
      "original_text": "Löschungsankündigung\nBayern Amtsgericht München HRB 240960\nBernie Blumberg Immobilien International Real Estate UG (haftungsbeschränkt) – München",
      "type": "Löschungsankündigung",
      "state": "Bayern",
      "amtsgericht": "Amtsgericht München",
      "registernummer": "HRB 240960",
      "registerart": "HRB",
      "company_name": "Bernie Blumberg Immobilien International Real Estate UG (haftungsbeschränkt)",
      "company_seat": "München",
      "details": "30.10.2025 (Bekanntmachungsdatum)\n\nBayern Amtsgericht München HRB 240960\nLöschungsankündigung 29.10.2025 (Eintragungsdatum)\n\nBernie Blumberg Immobilien International Real Estate UG (haftungsbeschränkt)\nGesellschaft mit beschränkter Haftung\nMünchen\n\nDas Registergericht beabsichtigt, die im Handelsregister eingetragene Gesellschaft wegen Vermögenslosigkeit von Amts wegen nach § 394 FamFG zu löschen. Die Frist zur Erhebung eines Widerspruchs ist auf drei Monate festgesetzt."
    },
    {
      "date": "2025-10-30",
      "id": "135777",
      "original_text": "Löschungsankündigung\nBayern Amtsgericht München HRB 263857\nPactum GmbH – München",
      "type": "Löschungsankündigung",
      "state": "Bayern",
      "amtsgericht": "Amtsgericht München",
      "registernummer": "HRB 263857",
      "registerart": "HRB",
      "company_name": "Pactum GmbH",
      "company_seat": "München",
      "details": "30.10.2025 (Bekanntmachungsdatum)\n\nBayern Amtsgericht München HRB 263857\nLöschungsankündigung 29.10.2025 (Eintragungsdatum)\n\nPactum GmbH\nGesellschaft mit beschränkter Haftung\nMünchen\n\nDas Registergericht beabsichtigt, die im Handelsregister eingetragene Gesellschaft wegen Vermögenslosigkeit von Amts wegen nach § 394 FamFG zu löschen. Die Frist zur Erhebung eines Widerspruchs ist auf drei Monate festgesetzt."
    },
    {
      "date": "2025-10-30",
      "id": "135778",
      "original_text": "Registerbekanntmachung nach dem Umwandlungsgesetz\nBayern Amtsgericht Fürth HRB 7129\nM. + K. Zwingel Möhrendorf GmbH – Weisendorf",
      "type": "Registerbekanntmachung nach dem Umwandlungsgesetz",
      "state": "Bayern",
      "amtsgericht": "Amtsgericht Fürth",
      "registernummer": "HRB 7129",
      "registerart": "HRB",
      "company_name": "M. + K. Zwingel Möhrendorf GmbH",
      "company_seat": "Weisendorf",
      "details": "30.10.2025 (Bekanntmachungsdatum)\n\nBayern Amtsgericht Fürth HRB 7129\nRegisterbekanntmachung nach dem Umwandlungsgesetz 29.10.2025 (Eintragungsdatum)\n\nM. + K. Zwingel Möhrendorf GmbH\nGesellschaft mit beschränkter Haftung\nWeisendorf\n\nDen Gläubigern der an der Verschmelzung beteiligten Rechtsträger ist, wenn sie binnen sechs Monaten nach dem Tag, an dem die Eintragung der Verschmelzung in das Register des Sitzes desjenigen Rechtsträgers, dessen Gläubiger sie sind, nach § 19 Abs. 3 UmwG als bekannt gemacht gilt, ihren Anspruch nach Grund und Höhe in Textform anmelden, Sicherheit zu leisten, soweit sie nicht Befriedigung verlangen können. Dieses Recht steht den Gläubigern jedoch nur zu, wenn sie glaubhaft machen, dass durch die Verschmelzung die Erfüllung ihrer Forderung gefährdet wird."
    },
    {
      "date": "2025-10-30",
      "id": "135779",
      "original_text": "Löschungsankündigung\nBayern Amtsgericht Fürth HRB 17223\nVilicus Personalservice GmbH – Erlangen",
      "type": "Löschungsankündigung",
      "state": "Bayern",
      "amtsgericht": "Amtsgericht Fürth",
      "registernummer": "HRB 17223",
      "registerart": "HRB",
      "company_name": "Vilicus Personalservice GmbH",
      "company_seat": "Erlangen",
      "details": "30.10.2025 (Bekanntmachungsdatum)\n\nBayern Amtsgericht Fürth HRB 17223\nLöschungsankündigung\n\nVilicus Personalservice GmbH\nGesellschaft mit beschränkter Haftung\nErlangen\n\nDas Registergericht beabsichtigt, die im Handelsregister eingetragene Gesellschaft wegen Vermögenslosigkeit von Amts wegen nach § 394 FamFG zu löschen. Die Frist zur Erhebung eines Widerspruchs ist auf drei Monate festgesetzt."
    },
    {
      "date": "2025-10-30",
      "id": "135780",
      "original_text": "Registerbekanntmachung nach dem Umwandlungsgesetz\nBayern Amtsgericht München HRB 135919\nAlex Jan Avedikjan Vermögensverwaltungsgesellschaft mbH – München",
      "type": "Registerbekanntmachung nach dem Umwandlungsgesetz",
      "state": "Bayern",
      "amtsgericht": "Amtsgericht München",
      "registernummer": "HRB 135919",
      "registerart": "HRB",
      "company_name": "Alex Jan Avedikjan Vermögensverwaltungsgesellschaft mbH",
      "company_seat": "München",
      "details": "30.10.2025 (Bekanntmachungsdatum)\n\nBayern Amtsgericht München HRB 135919\nRegisterbekanntmachung nach dem Umwandlungsgesetz 29.10.2025 (Eintragungsdatum)\n\nAlex Jan Avedikjan Vermögensverwaltungsgesellschaft mbH\nGesellschaft mit beschränkter Haftung\nMünchen\n\nDen Gläubigern der an der Verschmelzung beteiligten Rechtsträger ist, wenn sie binnen sechs Monaten nach dem Tag, an dem die Eintragung der Verschmelzung in das Register des Sitzes desjenigen Rechtsträgers, dessen Gläubiger sie sind, nach § 19 Abs. 3 UmwG als bekannt gemacht gilt, ihren Anspruch nach Grund und Höhe in Textform anmelden, Sicherheit zu leisten, soweit sie nicht Befriedigung verlangen können. Dieses Recht steht den Gläubigern jedoch nur zu, wenn sie glaubhaft machen, dass durch die Verschmelzung die Erfüllung ihrer Forderung gefährdet wird."
    },
    {
      "date": "2025-10-30",
      "id": "135781",
      "original_text": "Registerbekanntmachung nach dem Umwandlungsgesetz\nBayern Amtsgericht München HRB 41671\nMELO Service GmbH – München",
      "type": "Registerbekanntmachung nach dem Umwandlungsgesetz",
      "state": "Bayern",
      "amtsgericht": "Amtsgericht München",
      "registernummer": "HRB 41671",
      "registerart": "HRB",
      "company_name": "MELO Service GmbH",
      "company_seat": "München",
      "details": "30.10.2025 (Bekanntmachungsdatum)\n\nBayern Amtsgericht München HRB 41671\nRegisterbekanntmachung nach dem Umwandlungsgesetz 29.10.2025 (Eintragungsdatum)\n\nMELO Service GmbH\nGesellschaft mit beschränkter Haftung\nMünchen\n\nDen Gläubigern der an der Verschmelzung beteiligten Rechtsträger ist, wenn sie binnen sechs Monaten nach dem Tag, an dem die Eintragung der Verschmelzung in das Register des Sitzes desjenigen Rechtsträgers, dessen Gläubiger sie sind, nach § 19 Abs. 3 UmwG als bekannt gemacht gilt, ihren Anspruch nach Grund und Höhe in Textform anmelden, Sicherheit zu leisten, soweit sie nicht Befriedigung verlangen können. Dieses Recht steht den Gläubigern jedoch nur zu, wenn sie glaubhaft machen, dass durch die Verschmelzung die Erfüllung ihrer Forderung gefährdet wird."
    },
    {
      "date": "2025-10-30",
      "id": "135782",
      "original_text": "Einreichung neuer Dokumente\nBayern Amtsgericht München HRB 243276\nscyfyn AG – Fürstenfeldbruck",
      "type": "Einreichung neuer Dokumente",
      "state": "Bayern",
      "amtsgericht": "Amtsgericht München",
      "registernummer": "HRB 243276",
      "registerart": "HRB",
      "company_name": "scyfyn AG",
      "company_seat": "Fürstenfeldbruck",
      "details": "30.10.2025 (Bekanntmachungsdatum)\n\nBayern Amtsgericht München HRB 243276\nEinreichung neuer Dokumente 29.10.2025 (Eintragungsdatum)\n\nscyfyn AG\nAktiengesellschaft\nFürstenfeldbruck\n\nDem Amtsgericht München -Registergericht- ist eine Liste der Mitglieder des Aufsichtsrats eingereicht worden, § 106 AktG."
    },
    {
      "date": "2025-10-30",
      "id": "135783",
      "original_text": "Registerbekanntmachung nach dem Umwandlungsgesetz\nBayern Amtsgericht Amberg HRB 8177\nKießlinger Holding GmbH – Burglengenfeld",
      "type": "Registerbekanntmachung nach dem Umwandlungsgesetz",
      "state": "Bayern",
      "amtsgericht": "Amtsgericht Amberg",
      "registernummer": "HRB 8177",
      "registerart": "HRB",
      "company_name": "Kießlinger Holding GmbH",
      "company_seat": "Burglengenfeld",
      "details": "30.10.2025 (Bekanntmachungsdatum)\n\nBayern Amtsgericht Amberg HRB 8177\nRegisterbekanntmachung nach dem Umwandlungsgesetz 29.10.2025 (Eintragungsdatum)\n\nKießlinger Holding GmbH\nGesellschaft mit beschränkter Haftung\nBurglengenfeld\n\nDen Gläubigern der an der Ausgliederung beteiligten Rechtsträger ist, wenn sie binnen sechs Monaten nach dem Tag, an dem die Eintragung der Ausgliederung in das Register des Sitzes desjenigen Rechtsträgers, dessen Gläubiger sie sind, nach §§ 125, 19 Abs. 3 UmwG als bekannt gemacht gilt, ihren Anspruch nach Grund und Höhe in Textform anmelden, Sicherheit zu leisten, soweit sie nicht Befriedigung verlangen können. Dieses Recht steht den Gläubigern jedoch nur zu, wenn sie glaubhaft machen, dass durch die Ausgliederung die Erfüllung ihrer Forderung gefährdet wird."
    },
    {
      "date": "2025-10-30",
      "id": "135784",
      "original_text": "Löschungsankündigung\nBayern Amtsgericht München HRB 150677\nTEAM ACTIV für Sicherheit & Service GmbH – Wolfratshausen",
      "type": "Löschungsankündigung",
      "state": "Bayern",
      "amtsgericht": "Amtsgericht München",
      "registernummer": "HRB 150677",
      "registerart": "HRB",
      "company_name": "TEAM ACTIV für Sicherheit & Service GmbH",
      "company_seat": "Wolfratshausen",
      "details": "30.10.2025 (Bekanntmachungsdatum)\n\nBayern Amtsgericht München HRB 150677\nLöschungsankündigung\n\nTEAM ACTIV für Sicherheit & Service GmbH\nGesellschaft mit beschränkter Haftung\nWolfratshausen\n\nDas Registergericht beabsichtigt, die im Handelsregister eingetragene Gesellschaft wegen Vermögenslosigkeit von Amts wegen nach § 394 FamFG zu löschen. Die Frist zur Erhebung eines Widerspruchs ist auf drei Monate festgesetzt."
    },
    {
      "date": "2025-10-30",
      "id": "135785",
      "original_text": "Einreichung neuer Dokumente\nBayern Amtsgericht Nürnberg HRB 25498\nWeatherdock AG – Nürnberg",
      "type": "Einreichung neuer Dokumente",
      "state": "Bayern",
      "amtsgericht": "Amtsgericht Nürnberg",
      "registernummer": "HRB 25498",
      "registerart": "HRB",
      "company_name": "Weatherdock AG",
      "company_seat": "Nürnberg",
      "details": "30.10.2025 (Bekanntmachungsdatum)\n\nBayern Amtsgericht Nürnberg HRB 25498\nEinreichung neuer Dokumente\n\nWeatherdock AG\nAktiengesellschaft\nNürnberg\n\nDem Amtsgericht Nürnberg -Registergericht- ist eine Liste der Mitglieder des Aufsichtsrats eingereicht worden, § 106 AktG."
    },
    {
      "date": "2025-10-30",
      "id": "135786",
      "original_text": "Löschungsankündigung\nBayern Amtsgericht München HRB 87766\nUDC-GmbH Gesellschaft für Unternehmensberatung- Datenverarbeitung-Computertechnik – München",
      "type": "Löschungsankündigung",
      "state": "Bayern",
      "amtsgericht": "Amtsgericht München",
      "registernummer": "HRB 87766",
      "registerart": "HRB",
      "company_name": "UDC-GmbH Gesellschaft für Unternehmensberatung- Datenverarbeitung-Computertechnik",
      "company_seat": "München",
      "details": "30.10.2025 (Bekanntmachungsdatum)\n\nBayern Amtsgericht München HRB 87766\nLöschungsankündigung 29.10.2025 (Eintragungsdatum)\n\nUDC-GmbH Gesellschaft für Unternehmensberatung- Datenverarbeitung-Computertechnik\nGesellschaft mit beschränkter Haftung\nMünchen\n\nDas Registergericht beabsichtigt, die im Handelsregister eingetragene Gesellschaft wegen Vermögenslosigkeit von Amts wegen nach § 394 FamFG zu löschen. Die Frist zur Erhebung eines Widerspruchs ist auf drei Monate festgesetzt."
    },
    {
      "date": "2025-10-30",
      "id": "135787",
      "original_text": "Löschungsankündigung\nBayern Amtsgericht München HRB 51559\nGumba-Last Elastomer-Produkte GmbH – Grasbrunn",
      "type": "Löschungsankündigung",
      "state": "Bayern",
      "amtsgericht": "Amtsgericht München",
      "registernummer": "HRB 51559",
      "registerart": "HRB",
      "company_name": "Gumba-Last Elastomer-Produkte GmbH",
      "company_seat": "Grasbrunn",
      "details": "30.10.2025 (Bekanntmachungsdatum)\n\nBayern Amtsgericht München HRB 51559\nLöschungsankündigung 29.10.2025 (Eintragungsdatum)\n\nGumba-Last Elastomer-Produkte GmbH\nGesellschaft mit beschränkter Haftung\nGrasbrunn\n\nDas Registergericht beabsichtigt, die im Handelsregister eingetragene Gesellschaft wegen Vermögenslosigkeit von Amts wegen nach § 394 FamFG zu löschen. #insert(Text=\"zztb_V_Widerspruchsfrist\")"
    },
    {
      "date": "2025-10-30",
      "id": "135788",
      "original_text": "Registerbekanntmachung nach dem Umwandlungsgesetz\nBayern Amtsgericht München HRB 180782\nAURELIUS Transaktionsberatungs AG – München",
      "type": "Registerbekanntmachung nach dem Umwandlungsgesetz",
      "state": "Bayern",
      "amtsgericht": "Amtsgericht München",
      "registernummer": "HRB 180782",
      "registerart": "HRB",
      "company_name": "AURELIUS Transaktionsberatungs AG",
      "company_seat": "München",
      "details": "30.10.2025 (Bekanntmachungsdatum)\n\nBayern Amtsgericht München HRB 180782\nRegisterbekanntmachung nach dem Umwandlungsgesetz 29.10.2025 (Eintragungsdatum)\n\nAURELIUS Transaktionsberatungs AG\nAktiengesellschaft\nMünchen\n\nDen Gläubigern des formwechselnden Rechtsträgers ist, wenn sie binnen sechs Monaten nach dem Tag, an dem die Eintragung des Formwechsels nach § 201 UmwG als bekannt gemacht gilt, ihren Anspruch nach Grund und Höhe in Textform anmelden, Sicherheit zu leisten, soweit sie nicht Befriedigung verlangen können. Dieses Recht steht den Gläubigern jedoch nur zu, wenn sie glaubhaft machen, dass durch den Formwechsel die Erfüllung ihrer Forderung gefährdet wird."
    },
    {
      "date": "2025-10-30",
      "id": "135789",
      "original_text": "Einreichung neuer Dokumente\nBayern Amtsgericht München HRB 133859\nEuropean Computer Telecoms AG – München",
      "type": "Einreichung neuer Dokumente",
      "state": "Bayern",
      "amtsgericht": "Amtsgericht München",
      "registernummer": "HRB 133859",
      "registerart": "HRB",
      "company_name": "European Computer Telecoms AG",
      "company_seat": "München",
      "details": "30.10.2025 (Bekanntmachungsdatum)\n\nBayern Amtsgericht München HRB 133859\nEinreichung neuer Dokumente\n\nEuropean Computer Telecoms AG\nAktiengesellschaft\nMünchen\n\nDem Amtsgericht München -Registergericht- ist eine Liste der Mitglieder des Aufsichtsrats eingereicht worden, § 106 AktG."
    },
    {
      "date": "2025-10-30",
      "id": "135790",
      "original_text": "Registerbekanntmachung nach dem Umwandlungsgesetz\nBayern Amtsgericht Amberg HRB 8048\nSchwandorfer Wohnstätten gGmbH – Schwandorf",
      "type": "Registerbekanntmachung nach dem Umwandlungsgesetz",
      "state": "Bayern",
      "amtsgericht": "Amtsgericht Amberg",
      "registernummer": "HRB 8048",
      "registerart": "HRB",
      "company_name": "Schwandorfer Wohnstätten gGmbH",
      "company_seat": "Schwandorf",
      "details": "30.10.2025 (Bekanntmachungsdatum)\n\nBayern Amtsgericht Amberg HRB 8048\nRegisterbekanntmachung nach dem Umwandlungsgesetz 29.10.2025 (Eintragungsdatum)\n\nSchwandorfer Wohnstätten gGmbH\nGesellschaft mit beschränkter Haftung\nSchwandorf\n\nDen Gläubigern der an der Ausgliederung beteiligten Rechtsträger ist, wenn sie binnen sechs Monaten nach dem Tag, an dem die Eintragung der Ausgliederung in das Register des Sitzes desjenigen Rechtsträgers, dessen Gläubiger sie sind, nach §§ 125, 19 Abs. 3 UmwG als bekannt gemacht gilt, ihren Anspruch nach Grund und Höhe in Textform anmelden, Sicherheit zu leisten, soweit sie nicht Befriedigung verlangen können. Dieses Recht steht den Gläubigern jedoch nur zu, wenn sie glaubhaft machen, dass durch die Ausgliederung die Erfüllung ihrer Forderung gefährdet wird."
    },
    {
      "date": "2025-10-30",
      "id": "135791",
      "original_text": "Registerbekanntmachung nach dem Umwandlungsgesetz\nBayern Amtsgericht München HRB 284643\nAURELIUS Development Fourty-Six GmbH – Grünwald",
      "type": "Registerbekanntmachung nach dem Umwandlungsgesetz",
      "state": "Bayern",
      "amtsgericht": "Amtsgericht München",
      "registernummer": "HRB 284643",
      "registerart": "HRB",
      "company_name": "AURELIUS Development Fourty-Six GmbH",
      "company_seat": "Grünwald",
      "details": "30.10.2025 (Bekanntmachungsdatum)\n\nBayern Amtsgericht München HRB 284643\nRegisterbekanntmachung nach dem Umwandlungsgesetz\n\nAURELIUS Development Fourty-Six GmbH\nGesellschaft mit beschränkter Haftung\nGrünwald\n\nDen Gläubigern des formwechselnden Rechtsträgers ist, wenn sie binnen sechs Monaten nach dem Tag, an dem die Eintragung des Formwechsels nach § 201 UmwG als bekannt gemacht gilt, ihren Anspruch nach Grund und Höhe in Textform anmelden, Sicherheit zu leisten, soweit sie nicht Befriedigung verlangen können. Dieses Recht steht den Gläubigern jedoch nur zu, wenn sie glaubhaft machen, dass durch den Formwechsel die Erfüllung ihrer Forderung gefährdet wird."
    },
    {
      "date": "2025-10-30",
      "id": "135792",
      "original_text": "Registerbekanntmachung nach dem Umwandlungsgesetz\nBayern Amtsgericht Amberg VR 10047\nLebenshilfe für Menschen mit Behinderungen, Orts- und Kreisvereinigung Schwandorf e.V. – Schwandorf",
      "type": "Registerbekanntmachung nach dem Umwandlungsgesetz",
      "state": "Bayern",
      "amtsgericht": "Amtsgericht Amberg",
      "registernummer": "VR 10047",
      "registerart": "VR",
      "company_name": "Lebenshilfe für Menschen mit Behinderungen, Orts- und Kreisvereinigung Schwandorf e.V.",
      "company_seat": "Schwandorf",
      "details": "30.10.2025 (Bekanntmachungsdatum)\n\nBayern Amtsgericht Amberg VR 10047\nRegisterbekanntmachung nach dem Umwandlungsgesetz 29.10.2025 (Eintragungsdatum)\n\nLebenshilfe für Menschen mit Behinderungen, Orts- und Kreisvereinigung Schwandorf e.V.\neingetragener Verein\nSchwandorf\n\nDen Gläubigern der an der Ausgliederung beteiligten Rechtsträger ist, wenn sie binnen sechs Monaten nach dem Tag, an dem die Eintragung der Ausgliederung in das Register des Sitzes desjenigen Rechtsträgers, dessen Gläubiger sie sind, nach §§ 125, 19 Abs. 3 UmwG als bekannt gemacht gilt, ihren Anspruch nach Grund und Höhe in Textform anmelden, Sicherheit zu leisten, soweit sie nicht Befriedigung verlangen können. Dieses Recht steht den Gläubigern jedoch nur zu, wenn sie glaubhaft machen, dass durch die Ausgliederung die Erfüllung ihrer Forderung gefährdet wird."
    },
    {
      "date": "2025-10-30",
      "id": "135793",
      "original_text": "Löschungsankündigung\nBayern Amtsgericht Bamberg HRB 11330\nMMC Security Bamberg UG (haftungsbeschränkt) – Scheßlitz",
      "type": "Löschungsankündigung",
      "state": "Bayern",
      "amtsgericht": "Amtsgericht Bamberg",
      "registernummer": "HRB 11330",
      "registerart": "HRB",
      "company_name": "MMC Security Bamberg UG (haftungsbeschränkt)",
      "company_seat": "Scheßlitz",
      "details": "30.10.2025 (Bekanntmachungsdatum)\n\nBayern Amtsgericht Bamberg HRB 11330\nLöschungsankündigung\n\nMMC Security Bamberg UG (haftungsbeschränkt)\nGesellschaft mit beschränkter Haftung\nScheßlitz\n\nDas Registergericht beabsichtigt, die im Handelsregister eingetragene Gesellschaft wegen Vermögenslosigkeit von Amts wegen nach § 394 FamFG zu löschen. Die Frist zur Erhebung eines Widerspruchs ist auf einen Monat festgesetzt."
    },
    {
      "date": "2025-10-30",
      "id": "135794",
      "original_text": "Registerbekanntmachung nach dem Umwandlungsgesetz\nBayern Amtsgericht München HRA 121372\nSyle Haziraj e.K. – München",
      "type": "Registerbekanntmachung nach dem Umwandlungsgesetz",
      "state": "Bayern",
      "amtsgericht": "Amtsgericht München",
      "registernummer": "HRA 121372",
      "registerart": "HRA",
      "company_name": "Syle Haziraj e.K.",
      "company_seat": "München",
      "details": "30.10.2025 (Bekanntmachungsdatum)\n\nBayern Amtsgericht München HRA 121372\nRegisterbekanntmachung nach dem Umwandlungsgesetz 29.10.2025 (Eintragungsdatum)\n\nSyle Haziraj e.K.\nEinzelkaufmann / Einzelkauffrau\nMünchen\n\nDen Gläubigern der an der Ausgliederung beteiligten Rechtsträger ist, wenn sie binnen sechs Monaten nach dem Tag, an dem die Eintragung der Ausgliederung in das Register des Sitzes desjenigen Rechtsträgers, dessen Gläubiger sie sind, nach §§ 125, 19 Abs. 3 UmwG als bekannt gemacht gilt, ihren Anspruch nach Grund und Höhe in Textform anmelden, Sicherheit zu leisten, soweit sie nicht Befriedigung verlangen können. Dieses Recht steht den Gläubigern jedoch nur zu, wenn sie glaubhaft machen, dass durch die Ausgliederung die Erfüllung ihrer Forderung gefährdet wird."
    },
    {
      "date": "2025-10-30",
      "id": "135795",
      "original_text": "Löschungsankündigung\nBayern Amtsgericht Landshut HRB 13345\nRoyal Gold Negoce International GmbH – Bad Birnbach",
      "type": "Löschungsankündigung",
      "state": "Bayern",
      "amtsgericht": "Amtsgericht Landshut",
      "registernummer": "HRB 13345",
      "registerart": "HRB",
      "company_name": "Royal Gold Negoce International GmbH",
      "company_seat": "Bad Birnbach",
      "details": "30.10.2025 (Bekanntmachungsdatum)\n\nBayern Amtsgericht Landshut HRB 13345\nLöschungsankündigung\n\nRoyal Gold Negoce International GmbH\nGesellschaft mit beschränkter Haftung\nBad Birnbach\n\nDas Registergericht beabsichtigt, die im Handelsregister eingetragene Gesellschaft wegen Vermögenslosigkeit von Amts wegen nach § 394 FamFG zu löschen. Die Frist zur Erhebung eines Widerspruchs ist auf einen Monat festgesetzt."
    },
    {
      "date": "2025-10-30",
      "id": "135796",
      "original_text": "Registerbekanntmachung nach dem Umwandlungsgesetz\nBayern Amtsgericht Nürnberg HRA 14277\nSportpark-Nord Markus Sojka e.K. – Nürnberg",
      "type": "Registerbekanntmachung nach dem Umwandlungsgesetz",
      "state": "Bayern",
      "amtsgericht": "Amtsgericht Nürnberg",
      "registernummer": "HRA 14277",
      "registerart": "HRA",
      "company_name": "Sportpark-Nord Markus Sojka e.K.",
      "company_seat": "Nürnberg",
      "details": "30.10.2025 (Bekanntmachungsdatum)\n\nBayern Amtsgericht Nürnberg HRA 14277\nRegisterbekanntmachung nach dem Umwandlungsgesetz 29.10.2025 (Eintragungsdatum)\n\nSportpark-Nord Markus Sojka e.K.\nEinzelkaufmann / Einzelkauffrau\nNürnberg\n\nDen Gläubigern der an der Ausgliederung beteiligten Rechtsträger ist, wenn sie binnen sechs Monaten nach dem Tag, an dem die Eintragung der Ausgliederung in das Register des Sitzes desjenigen Rechtsträgers, dessen Gläubiger sie sind, nach §§ 125, 19 Abs. 3 UmwG als bekannt gemacht gilt, ihren Anspruch nach Grund und Höhe in Textform anmelden, Sicherheit zu leisten, soweit sie nicht Befriedigung verlangen können. Dieses Recht steht den Gläubigern jedoch nur zu, wenn sie glaubhaft machen, dass durch die Ausgliederung die Erfüllung ihrer Forderung gefährdet wird."
    },
    {
      "date": "2025-10-30",
      "id": "135797",
      "original_text": "Registerbekanntmachung nach dem Umwandlungsgesetz\nBayern Amtsgericht Nürnberg HRB 44833\nNisoma Holding GmbH – Nürnberg",
      "type": "Registerbekanntmachung nach dem Umwandlungsgesetz",
      "state": "Bayern",
      "amtsgericht": "Amtsgericht Nürnberg",
      "registernummer": "HRB 44833",
      "registerart": "HRB",
      "company_name": "Nisoma Holding GmbH",
      "company_seat": "Nürnberg",
      "details": "30.10.2025 (Bekanntmachungsdatum)\n\nBayern Amtsgericht Nürnberg HRB 44833\nRegisterbekanntmachung nach dem Umwandlungsgesetz 29.10.2025 (Eintragungsdatum)\n\nNisoma Holding GmbH\nGesellschaft mit beschränkter Haftung\nNürnberg\n\nDen Gläubigern der an der Ausgliederung beteiligten Rechtsträger ist, wenn sie binnen sechs Monaten nach dem Tag, an dem die Eintragung der Ausgliederung in das Register des Sitzes desjenigen Rechtsträgers, dessen Gläubiger sie sind, nach §§ 125, 19 Abs. 3 UmwG als bekannt gemacht gilt, ihren Anspruch nach Grund und Höhe in Textform anmelden, Sicherheit zu leisten, soweit sie nicht Befriedigung verlangen können. Dieses Recht steht den Gläubigern jedoch nur zu, wenn sie glaubhaft machen, dass durch die Ausgliederung die Erfüllung ihrer Forderung gefährdet wird."
    },
    {
      "date": "2025-10-30",
      "id": "135798",
      "original_text": "Löschungsankündigung\nBayern Amtsgericht München HRA 102776\nWingracers Sports Games UG (haftungsbeschränkt) & Co. Erste Productions KG – München",
      "type": "Löschungsankündigung",
      "state": "Bayern",
      "amtsgericht": "Amtsgericht München",
      "registernummer": "HRA 102776",
      "registerart": "HRA",
      "company_name": "Wingracers Sports Games UG (haftungsbeschränkt) & Co. Erste Productions KG",
      "company_seat": "München",
      "details": "30.10.2025 (Bekanntmachungsdatum)\n\nBayern Amtsgericht München HRA 102776\nLöschungsankündigung\n\nWingracers Sports Games UG (haftungsbeschränkt) & Co. Erste Productions KG\nKommanditgesellschaft\nMünchen\n\nDas Registergericht beabsichtigt, die im Handelsregister eingetragene Firma von Amts wegen nach § 31 Abs. 2 HGB zu löschen. Die Frist zur Erhebung eines Widerspruchs ist auf drei Monate festgesetzt."
    },
    {
      "date": "2025-10-30",
      "id": "135799",
      "original_text": "Registerbekanntmachung nach dem Umwandlungsgesetz\nBayern Amtsgericht Fürth HRB 7217\nZwingel Nord GmbH – Weisendorf",
      "type": "Registerbekanntmachung nach dem Umwandlungsgesetz",
      "state": "Bayern",
      "amtsgericht": "Amtsgericht Fürth",
      "registernummer": "HRB 7217",
      "registerart": "HRB",
      "company_name": "Zwingel Nord GmbH",
      "company_seat": "Weisendorf",
      "details": "30.10.2025 (Bekanntmachungsdatum)\n\nBayern Amtsgericht Fürth HRB 7217\nRegisterbekanntmachung nach dem Umwandlungsgesetz 29.10.2025 (Eintragungsdatum)\n\nZwingel Nord GmbH\nGesellschaft mit beschränkter Haftung\nWeisendorf\n\nDen Gläubigern der an der Verschmelzung beteiligten Rechtsträger ist, wenn sie binnen sechs Monaten nach dem Tag, an dem die Eintragung der Verschmelzung in das Register des Sitzes desjenigen Rechtsträgers, dessen Gläubiger sie sind, nach § 19 Abs. 3 UmwG als bekannt gemacht gilt, ihren Anspruch nach Grund und Höhe in Textform anmelden, Sicherheit zu leisten, soweit sie nicht Befriedigung verlangen können. Dieses Recht steht den Gläubigern jedoch nur zu, wenn sie glaubhaft machen, dass durch die Verschmelzung die Erfüllung ihrer Forderung gefährdet wird."
    },
    {
      "date": "2025-10-30",
      "id": "135800",
      "original_text": "Registerbekanntmachung nach dem Umwandlungsgesetz\nBayern Amtsgericht Amberg HRA 4191\nKießlinger Christian Gewerbliche Verpachtung e. K. – Maxhütte-Haidhof",
      "type": "Registerbekanntmachung nach dem Umwandlungsgesetz",
      "state": "Bayern",
      "amtsgericht": "Amtsgericht Amberg",
      "registernummer": "HRA 4191",
      "registerart": "HRA",
      "company_name": "Kießlinger Christian Gewerbliche Verpachtung e. K.",
      "company_seat": "Maxhütte-Haidhof",
      "details": "30.10.2025 (Bekanntmachungsdatum)\n\nBayern Amtsgericht Amberg HRA 4191\nRegisterbekanntmachung nach dem Umwandlungsgesetz 29.10.2025 (Eintragungsdatum)\n\nKießlinger Christian Gewerbliche Verpachtung e. K.\nEinzelkaufmann / Einzelkauffrau\nMaxhütte-Haidhof\n\nDen Gläubigern der an der Ausgliederung beteiligten Rechtsträger ist, wenn sie binnen sechs Monaten nach dem Tag, an dem die Eintragung der Ausgliederung in das Register des Sitzes desjenigen Rechtsträgers, dessen Gläubiger sie sind, nach §§ 125, 19 Abs. 3 UmwG als bekannt gemacht gilt, ihren Anspruch nach Grund und Höhe in Textform anmelden, Sicherheit zu leisten, soweit sie nicht Befriedigung verlangen können. Dieses Recht steht den Gläubigern jedoch nur zu, wenn sie glaubhaft machen, dass durch die Ausgliederung die Erfüllung ihrer Forderung gefährdet wird."
    },
    {
      "date": "2025-10-30",
      "id": "135801",
      "original_text": "Löschungsankündigung\nSaarland Amtsgericht Saarbrücken HRB 109170\nS1-Gastrobetriebe UG (haftungsbeschränkt) – Wallerfangen",
      "type": "Löschungsankündigung",
      "state": "Saarland",
      "amtsgericht": "Amtsgericht Saarbrücken",
      "registernummer": "HRB 109170",
      "registerart": "HRB",
      "company_name": "S1-Gastrobetriebe UG (haftungsbeschränkt)",
      "company_seat": "Wallerfangen",
      "details": "30.10.2025 (Bekanntmachungsdatum)\n\nSaarland Amtsgericht Saarbrücken HRB 109170\nLöschungsankündigung\n\nS1-Gastrobetriebe UG (haftungsbeschränkt)\nGesellschaft mit beschränkter Haftung\nWallerfangen\n\nEs ist beabsichtigt, die Gesellschaft von Amts wegen gemäß § 394 FamFG wegen Vermögenslosigkeit zu löschen.\nGegen die Löschung von Amts wegen ist das Rechtsmittel des Widerspruchs statthaft. Der Widerspruch ist binnen einer Frist drei Monaten beginnend mit dem Tag dieser Veröffentlichung durch Einreichen eines Widerspruchsschreibens -schriftlich oder zur Niederschrift der Geschäftsstelle beim Amtsgericht Saarbrücken, -zentrales Handelsregister-, Mainzerstr.178, 66121 Saarbrücken einzulegen.\nDer Widerspruch muss die Bezeichnung der angefochtenen Löschungsankündigung enthalten sowie die Erklärung, dass Widerspruch eingelegt wird. Er ist vom Widerspruchsführer oder seinem Bevollmächtigten zu unterzeichnen.\nDas Widerspruchsschreiben kann auch in der Form eines elektronischen Dokumentes eingereicht werden, das mit einer qualifizierten elektronischen Signatur nach dem Signaturgesetz versehen sein muss (§§ 14 Abs. 2 FamFG, 130a, 298 ZPO)."
    },
    {
      "date": "2025-10-30",
      "id": "135802",
      "original_text": "Löschungsankündigung\nBerlin Amtsgericht Berlin (Charlottenburg) HRB 167795\nAviva Diamonds GmbH – Berlin",
      "type": "Löschungsankündigung",
      "state": "Berlin",
      "amtsgericht": "Amtsgericht Berlin (Charlottenburg)",
      "registernummer": "HRB 167795",
      "registerart": "HRB",
      "company_name": "Aviva Diamonds GmbH",
      "company_seat": "Berlin",
      "details": "30.10.2025 (Bekanntmachungsdatum)\n\nBerlin Amtsgericht Berlin (Charlottenburg) HRB 167795\nLöschungsankündigung\n\nAviva Diamonds GmbH\nGesellschaft mit beschränkter Haftung\nBerlin\n\nBei der nachstehenden Gesellschaft wird das Amtslöschungsverfahren gemäß § 394 FamFG eingeleitet. Widerspruchsfrist 6 Wochen"
    },
    {
      "date": "2025-10-30",
      "id": "135803",
      "original_text": "Registerbekanntmachung nach dem Umwandlungsgesetz\nBerlin Amtsgericht Berlin (Charlottenburg) HRB 113399\nDeutsche KNM GmbH – Berlin",
      "type": "Registerbekanntmachung nach dem Umwandlungsgesetz",
      "state": "Berlin",
      "amtsgericht": "Amtsgericht Berlin (Charlottenburg)",
      "registernummer": "HRB 113399",
      "registerart": "HRB",
      "company_name": "Deutsche KNM GmbH",
      "company_seat": "Berlin",
      "details": "30.10.2025 (Bekanntmachungsdatum)\n\nBerlin Amtsgericht Berlin (Charlottenburg) HRB 113399\nRegisterbekanntmachung nach dem Umwandlungsgesetz 29.10.2025 (Eintragungsdatum)\n\nDeutsche KNM GmbH\nGesellschaft mit beschränkter Haftung\nBerlin\n\nZu Eintragungsnummer 16 vom 29.10.2025 wird als nicht eingetragen veröffentlicht: Den Gläubigern der an der Verschmelzung beteiligten Rechtsträger ist, wenn sie binnen sechs Monaten nach dem Tag, an dem die Eintragung der Verschmelzung in das Register des Sitzes desjenigen Rechtsträgers, dessen Gläubiger sie sind, als bekannt gemacht gilt, ihren Anspruch nach Grund und Höhe schriftlich anmelden, Sicherheit zu leisten, soweit sie nicht Befriedigung verlangen können. Dieses Recht steht den Gläubigern jedoch nur zu, wenn sie glaubhaft machen, dass durch die Verschmelzung die Erfüllung ihrer Forderung gefährdet wird. Das Recht, Sicherheitsleistung zu verlangen, steht Gläubigern nicht zu, die im Falle der Insolvenz ein Recht auf vorzugsweise Befriedigung aus einer Deckungsmasse haben, die nach gesetzlicher Vorschrift zu ihrem Schutz errichtet und staatlich überwacht ist."
    },
    {
      "date": "2025-10-30",
      "id": "135804",
      "original_text": "Registerbekanntmachung nach dem Umwandlungsgesetz\nBerlin Amtsgericht Berlin (Charlottenburg) HRB 150077\nBorsig Boiler Systems GmbH – Berlin",
      "type": "Registerbekanntmachung nach dem Umwandlungsgesetz",
      "state": "Berlin",
      "amtsgericht": "Amtsgericht Berlin (Charlottenburg)",
      "registernummer": "HRB 150077",
      "registerart": "HRB",
      "company_name": "Borsig Boiler Systems GmbH",
      "company_seat": "Berlin",
      "details": "30.10.2025 (Bekanntmachungsdatum)\n\nBerlin Amtsgericht Berlin (Charlottenburg) HRB 150077\nRegisterbekanntmachung nach dem Umwandlungsgesetz 29.10.2025 (Eintragungsdatum)\n\nBorsig Boiler Systems GmbH\nGesellschaft mit beschränkter Haftung\nBerlin\n\nZu Eintragungsnummer 9 vom 29.10.2025 wird als nicht eingetragen veröffentlicht: Den Gläubigern der an der Verschmelzung beteiligten Rechtsträger ist, wenn sie binnen sechs Monaten nach dem Tag, an dem die Eintragung der Verschmelzung in das Register des Sitzes desjenigen Rechtsträgers, dessen Gläubiger sie sind, als bekannt gemacht gilt, ihren Anspruch nach Grund und Höhe schriftlich anmelden, Sicherheit zu leisten, soweit sie nicht Befriedigung verlangen können. Dieses Recht steht den Gläubigern jedoch nur zu, wenn sie glaubhaft machen, dass durch die Verschmelzung die Erfüllung ihrer Forderung gefährdet wird. Das Recht, Sicherheitsleistung zu verlangen, steht Gläubigern nicht zu, die im Falle der Insolvenz ein Recht auf vorzugsweise Befriedigung aus einer Deckungsmasse haben, die nach gesetzlicher Vorschrift zu ihrem Schutz errichtet und staatlich überwacht ist."
    },
    {
      "date": "2025-10-30",
      "id": "135805",
      "original_text": "Löschungsankündigung\nBaden-Württemberg Amtsgericht Stuttgart HRB 724119\nAddlogic Labs GmbH – Jettingen",
      "type": "Löschungsankündigung",
      "state": "Baden-Württemberg",
      "amtsgericht": "Amtsgericht Stuttgart",
      "registernummer": "HRB 724119",
      "registerart": "HRB",
      "company_name": "Addlogic Labs GmbH",
      "company_seat": "Jettingen",
      "details": "30.10.2025 (Bekanntmachungsdatum)\n\nBaden-Württemberg Amtsgericht Stuttgart HRB 724119\nLöschungsankündigung\n\nAddlogic Labs GmbH\nGesellschaft mit beschränkter Haftung\nJettingen\n\nDas Gericht beabsichtigt, die Gesellschaft wegen Vermögenslosigkeit im Handelsregister von Amts wegen nach § 394 FamFG zu löschen. Die Frist zur Geltendmachung eines Widerspruchs gegen die beabsichtigte Löschung ist auf zwei Monate ab Veröffentlichung bestimmt."
    },
    {
      "date": "2025-10-30",
      "id": "135806",
      "original_text": "Löschungsankündigung\nBerlin Amtsgericht Berlin (Charlottenburg) HRB 144173\nBARAS GmbH – Berlin",
      "type": "Löschungsankündigung",
      "state": "Berlin",
      "amtsgericht": "Amtsgericht Berlin (Charlottenburg)",
      "registernummer": "HRB 144173",
      "registerart": "HRB",
      "company_name": "BARAS GmbH",
      "company_seat": "Berlin",
      "details": "30.10.2025 (Bekanntmachungsdatum)\n\nBerlin Amtsgericht Berlin (Charlottenburg) HRB 144173\nLöschungsankündigung\n\nBARAS GmbH\nGesellschaft mit beschränkter Haftung\nBerlin\n\nBei der nachstehenden Gesellschaft wird das Amtslöschungsverfahren gemäß § 394 FamFG eingeleitet. Widerspruchsfrist 6 Wochen"
    },
    {
      "date": "2025-10-30",
      "id": "135807",
      "original_text": "Registerbekanntmachung nach dem Umwandlungsgesetz\nSachsen-Anhalt Amtsgericht Stendal HRA 8202\nTobias Burkert e.K. Gebäudemanagement und hauswirtschaftliche Dienstleistungen – Sangerhausen",
      "type": "Registerbekanntmachung nach dem Umwandlungsgesetz",
      "state": "Sachsen-Anhalt",
      "amtsgericht": "Amtsgericht Stendal",
      "registernummer": "HRA 8202",
      "registerart": "HRA",
      "company_name": "Tobias Burkert e.K. Gebäudemanagement und hauswirtschaftliche Dienstleistungen",
      "company_seat": "Sangerhausen",
      "details": "30.10.2025 (Bekanntmachungsdatum)\n\nSachsen-Anhalt Amtsgericht Stendal HRA 8202\nRegisterbekanntmachung nach dem Umwandlungsgesetz 30.10.2025 (Eintragungsdatum)\n\nTobias Burkert e.K. Gebäudemanagement und hauswirtschaftliche Dienstleistungen\nEinzelkaufmann / Einzelkauffrau\nSangerhausen\n\nNicht eingetragen:\nDen Gläubigern der an der Ausgliederung beteiligten Rechtsträger, ist wenn sie binnen sechs Monaten nach dem Tag, an dem die Eintragung der Ausgliederung nach §§125, 19 Abs. 3 UmwG als bekanntgemacht gilt, ihren Anspruch nach Grund und Höhe schriftlich anmelden, Sicherheit zu leisten, soweit sie nicht Befriedigung verlangen können. Diese Recht steht ihnen jedoch nur zu, wenn sie glaubhaft machen, dass durch die Ausgliederung die Erfüllung ihrer Forderung gefährdet wird."
    },
    {
      "date": "2025-10-30",
      "id": "135808",
      "original_text": "Registerbekanntmachung nach dem Umwandlungsgesetz\nSachsen-Anhalt Amtsgericht Stendal HRB 27265\nHaus- & Grundstücksservice Burkert GmbH – Sangerhausen",
      "type": "Registerbekanntmachung nach dem Umwandlungsgesetz",
      "state": "Sachsen-Anhalt",
      "amtsgericht": "Amtsgericht Stendal",
      "registernummer": "HRB 27265",
      "registerart": "HRB",
      "company_name": "Haus- & Grundstücksservice Burkert GmbH",
      "company_seat": "Sangerhausen",
      "details": "30.10.2025 (Bekanntmachungsdatum)\n\nSachsen-Anhalt Amtsgericht Stendal HRB 27265\nRegisterbekanntmachung nach dem Umwandlungsgesetz 30.10.2025 (Eintragungsdatum)\n\nHaus- & Grundstücksservice Burkert GmbH\nGesellschaft mit beschränkter Haftung\nSangerhausen\n\nNicht eingetragen:\nDen Gläubigern der an der Ausgliederung beteiligten Rechtsträger, ist wenn sie binnen sechs Monaten nach dem Tag, an dem die Eintragung der Ausgliederung nach §§125, 19 Abs. 3 UmwG als bekanntgemacht gilt, ihren Anspruch nach Grund und Höhe schriftlich anmelden, Sicherheit zu leisten, soweit sie nicht Befriedigung verlangen können. Diese Recht steht ihnen jedoch nur zu, wenn sie glaubhaft machen, dass durch die Ausgliederung die Erfüllung ihrer Forderung gefährdet wird."
    },
    {
      "date": "2025-10-30",
      "id": "135809",
      "original_text": "Löschungsankündigung\nBaden-Württemberg Amtsgericht Ulm HRB 742231\nPS Süd GmbH – Bad Waldsee",
      "type": "Löschungsankündigung",
      "state": "Baden-Württemberg",
      "amtsgericht": "Amtsgericht Ulm",
      "registernummer": "HRB 742231",
      "registerart": "HRB",
      "company_name": "PS Süd GmbH",
      "company_seat": "Bad Waldsee",
      "details": "30.10.2025 (Bekanntmachungsdatum)\n\nBaden-Württemberg Amtsgericht Ulm HRB 742231\nLöschungsankündigung\n\nPS Süd GmbH\nGesellschaft mit beschränkter Haftung\nBad Waldsee\n\nDas Gericht beabsichtigt, die Gesellschaft wegen Vermögenslosigkeit im Handelsregister von Amts wegen nach § 394 FamFG zu löschen. Die Frist zur Geltendmachung eines Widerspruchs gegen die beabsichtigte Löschung ist auf  einen Monat ab Veröffentlichung bestimmt."
    },
    {
      "date": "2025-10-30",
      "id": "135810",
      "original_text": "Registerbekanntmachung nach dem Umwandlungsgesetz\nBrandenburg Amtsgericht Cottbus HRB 15599\nPreuss & Kuhn-Temmler GmbH – Schönefeld",
      "type": "Registerbekanntmachung nach dem Umwandlungsgesetz",
      "state": "Brandenburg",
      "amtsgericht": "Amtsgericht Cottbus",
      "registernummer": "HRB 15599",
      "registerart": "HRB",
      "company_name": "Preuss & Kuhn-Temmler GmbH",
      "company_seat": "Schönefeld",
      "details": "30.10.2025 (Bekanntmachungsdatum)\n\nBrandenburg Amtsgericht Cottbus HRB 15599\nRegisterbekanntmachung nach dem Umwandlungsgesetz 30.10.2025 (Eintragungsdatum)\n\nPreuss & Kuhn-Temmler GmbH\nGesellschaft mit beschränkter Haftung\nSchönefeld\n\nAls nicht eingetragen wird veröffentlicht:\nDen Gläubigern der an der Verschmelzung beteiligten Rechtsträger ist, wenn sie binnen sechs Monaten nach dem Tag, an dem die Eintragung der Verschmelzung in das Register des Sitzes desjenigen Rechtsträgers, dessen Gläubiger sie sind, als bekannt gemacht gilt, ihren Anspruch nach Grund und Höhe schriftlich anmelden, Sicherheit zu leisten, soweit sie nicht Befriedigung verlangen können. Dieses Recht steht den Gläubigern jedoch nur zu, wenn sie glaubhaft machen, dass durch die Verschmelzung die Erfüllung ihrer Forderung gefährdet wird"
    },
    {
      "date": "2025-10-30",
      "id": "135811",
      "original_text": "Registerbekanntmachung nach dem Umwandlungsgesetz\nHamburg Amtsgericht Hamburg HRB 183216\nWWH Asset 2 Pengalia GmbH – Hamburg",
      "type": "Registerbekanntmachung nach dem Umwandlungsgesetz",
      "state": "Hamburg",
      "amtsgericht": "Amtsgericht Hamburg",
      "registernummer": "HRB 183216",
      "registerart": "HRB",
      "company_name": "WWH Asset 2 Pengalia GmbH",
      "company_seat": "Hamburg",
      "details": "30.10.2025 (Bekanntmachungsdatum)\n\nHamburg Amtsgericht Hamburg HRB 183216\nRegisterbekanntmachung nach dem Umwandlungsgesetz 30.10.2025 (Eintragungsdatum)\n\nWWH Asset 2 Pengalia GmbH\nGesellschaft mit beschränkter Haftung\nHamburg\n\nAls nicht eingetragen wird bekannt gemacht:\nDen Gläubigern der an der Verschmelzung beteiligten Gesellschaften ist, wenn sie binnen sechs Monaten nach dem Tag, an dem die Eintragung der Verschmelzung in das Register des Sitzes desjenigen Rechtsträgers, dessen Gläubiger sie sind, nach § 19 Absatz 3 UmwG als bekannt gemacht gilt, ihren Anspruch nach Grund und Höhe schriftlich anmelden, Sicherheit zu leisten, soweit sie nicht Befriedigung verlangen können. Dieses Recht steht den Gläubigern jedoch nur zu, wenn sie glaubhaft machen, dass durch die Verschmelzung die Erfüllung ihrer Forderung gefährdet wird."
    },
    {
      "date": "2025-10-30",
      "id": "135812",
      "original_text": "Sonstige Registerbekanntmachung\nHamburg Amtsgericht Hamburg HRB 185295\nAsset Solution AG – Hamburg",
      "type": "Sonstige Registerbekanntmachung",
      "state": "Hamburg",
      "amtsgericht": "Amtsgericht Hamburg",
      "registernummer": "HRB 185295",
      "registerart": "HRB",
      "company_name": "Asset Solution AG",
      "company_seat": "Hamburg",
      "details": "30.10.2025 (Bekanntmachungsdatum)\n\nHamburg Amtsgericht Hamburg HRB 185295\nSonstige Registerbekanntmachung\n\nAsset Solution AG\nAktiengesellschaft\nHamburg\n\nAls nicht eingetragen wird bekannt gemacht, es wurde eine Liste des Aufsichtsrates eingereicht"
    },
    {
      "date": "2025-10-30",
      "id": "135813",
      "original_text": "Löschungsankündigung\nSchleswig-Holstein Amtsgericht Lübeck HRB 21631\nKANGaROO Trends GmbH – Behlendorf",
      "type": "Löschungsankündigung",
      "state": "Schleswig-Holstein",
      "amtsgericht": "Amtsgericht Lübeck",
      "registernummer": "HRB 21631",
      "registerart": "HRB",
      "company_name": "KANGaROO Trends GmbH",
      "company_seat": "Behlendorf",
      "details": "30.10.2025 (Bekanntmachungsdatum)\n\nSchleswig-Holstein Amtsgericht Lübeck HRB 21631\nLöschungsankündigung\n\nKANGaROO Trends GmbH\nGesellschaft mit beschränkter Haftung\nBehlendorf\n\nEs ist die Löschung der nachstehenden Gesellschaft wegen Vermögenslosigkeit gemäß § 394 FamFG beabsichtigt. Widerspruchsfrist: 1 Monat"
    },
    {
      "date": "2025-10-30",
      "id": "135814",
      "original_text": "Registerbekanntmachung nach dem Umwandlungsgesetz\nBrandenburg Amtsgericht Cottbus HRA 3330\nWEK Windenergie Kolkwitz GmbH & Co. KG – Kolkwitz",
      "type": "Registerbekanntmachung nach dem Umwandlungsgesetz",
      "state": "Brandenburg",
      "amtsgericht": "Amtsgericht Cottbus",
      "registernummer": "HRA 3330",
      "registerart": "HRA",
      "company_name": "WEK Windenergie Kolkwitz GmbH & Co. KG",
      "company_seat": "Kolkwitz",
      "details": "30.10.2025 (Bekanntmachungsdatum)\n\nBrandenburg Amtsgericht Cottbus HRA 3330\nRegisterbekanntmachung nach dem Umwandlungsgesetz 29.10.2025 (Eintragungsdatum)\n\nWEK Windenergie Kolkwitz GmbH & Co. KG\nKommanditgesellschaft\nKolkwitz\n\nZu Eintragungsnummer 4 vom 29.10.2025 wird als nicht eingetragen veröffentlicht:\nDen Gläubigern der an der Verschmelzung beteiligten Rechtsträger ist, wenn sie binnen sechs Monaten nach dem Tag, an dem die Eintragung der Verschmelzung in das Register des Sitzes desjenigen Rechtsträgers, dessen Gläubiger sie sind, als bekannt gemacht gilt, ihren Anspruch nach Grund und Höhe schriftlich anmelden, Sicherheit zu leisten, soweit sie nicht Befriedigung verlangen können. Dieses Recht steht den Gläubigern jedoch nur zu, wenn sie glaubhaft machen, dass durch die Verschmelzung die Erfüllung ihrer Forderung gefährdet wird"
    },
    {
      "date": "2025-10-30",
      "id": "135815",
      "original_text": "Löschungsankündigung\nBerlin Amtsgericht Berlin (Charlottenburg) HRB 188618\nFIB FIXIT UG (haftungsbeschränkt) – Berlin",
      "type": "Löschungsankündigung",
      "state": "Berlin",
      "amtsgericht": "Amtsgericht Berlin (Charlottenburg)",
      "registernummer": "HRB 188618",
      "registerart": "HRB",
      "company_name": "FIB FIXIT UG (haftungsbeschränkt)",
      "company_seat": "Berlin",
      "details": "30.10.2025 (Bekanntmachungsdatum)\n\nBerlin Amtsgericht Berlin (Charlottenburg) HRB 188618\nLöschungsankündigung\n\nFIB FIXIT UG (haftungsbeschränkt)\nGesellschaft mit beschränkter Haftung\nBerlin\n\nBei der nachstehenden Gesellschaft wird das Amtslöschungsverfahren gemäß § 394 FamFG eingeleitet. Widerspruchsfrist 6 Wochen"
    },
    {
      "date": "2025-10-30",
      "id": "135816",
      "original_text": "Sonstige Registerbekanntmachung\nHamburg Amtsgericht Hamburg HRB 168273\nRamboll Deutschland GmbH – Hamburg",
      "type": "Sonstige Registerbekanntmachung",
      "state": "Hamburg",
      "amtsgericht": "Amtsgericht Hamburg",
      "registernummer": "HRB 168273",
      "registerart": "HRB",
      "company_name": "Ramboll Deutschland GmbH",
      "company_seat": "Hamburg",
      "details": "30.10.2025 (Bekanntmachungsdatum)\n\nHamburg Amtsgericht Hamburg HRB 168273\nSonstige Registerbekanntmachung\n\nRamboll Deutschland GmbH\nGesellschaft mit beschränkter Haftung\nHamburg\n\nAls nicht eingetragen wird bekannt gemacht: Liste des Aufsichtsrats wurde eingereicht."
    },
    {
      "date": "2025-10-30",
      "id": "135817",
      "original_text": "Einreichung neuer Dokumente\nBerlin Amtsgericht Berlin (Charlottenburg) HRB 5583\nHelmholtz-Zentrum Berlin für Materialien und Energie Gesellschaft mit beschränkter Haftung – Berlin",
      "type": "Einreichung neuer Dokumente",
      "state": "Berlin",
      "amtsgericht": "Amtsgericht Berlin (Charlottenburg)",
      "registernummer": "HRB 5583",
      "registerart": "HRB",
      "company_name": "Helmholtz-Zentrum Berlin für Materialien und Energie Gesellschaft mit beschränkter Haftung",
      "company_seat": "Berlin",
      "details": "30.10.2025 (Bekanntmachungsdatum)\n\nBerlin Amtsgericht Berlin (Charlottenburg) HRB 5583\nEinreichung neuer Dokumente\n\nHelmholtz-Zentrum Berlin für Materialien und Energie Gesellschaft mit beschränkter Haftung\nGesellschaft mit beschränkter Haftung\nBerlin\n\nAls nicht eingetragen wird veröffentlicht: Es wurde eine neue Liste der Aufsichtsratsmitglieder eingereicht (§52 GmbHG)."
    },
    {
      "date": "2025-10-30",
      "id": "135818",
      "original_text": "Einreichung neuer Dokumente\nBaden-Württemberg Amtsgericht Mannheim HRB 714554\nAmazon Pforzheim GmbH – Pforzheim",
      "type": "Einreichung neuer Dokumente",
      "state": "Baden-Württemberg",
      "amtsgericht": "Amtsgericht Mannheim",
      "registernummer": "HRB 714554",
      "registerart": "HRB",
      "company_name": "Amazon Pforzheim GmbH",
      "company_seat": "Pforzheim",
      "details": "30.10.2025 (Bekanntmachungsdatum)\n\nBaden-Württemberg Amtsgericht Mannheim HRB 714554\nEinreichung neuer Dokumente\n\nAmazon Pforzheim GmbH\nGesellschaft mit beschränkter Haftung\nPforzheim\n\nDie Gesellschaft hat am 29.10.2025 die Liste über die Zusammensetzung des Aufsichtsrats zum Handelsregister eingereicht."
    },
    {
      "date": "2025-10-30",
      "id": "135819",
      "original_text": "Registerbekanntmachung nach dem Umwandlungsgesetz\nBaden-Württemberg Amtsgericht Stuttgart HRB 725661\nKreafaktur GmbH – Backnang",
      "type": "Registerbekanntmachung nach dem Umwandlungsgesetz",
      "state": "Baden-Württemberg",
      "amtsgericht": "Amtsgericht Stuttgart",
      "registernummer": "HRB 725661",
      "registerart": "HRB",
      "company_name": "Kreafaktur GmbH",
      "company_seat": "Backnang",
      "details": "30.10.2025 (Bekanntmachungsdatum)\n\nBaden-Württemberg Amtsgericht Stuttgart HRB 725661\nRegisterbekanntmachung nach dem Umwandlungsgesetz 30.10.2025 (Eintragungsdatum)\n\nKreafaktur GmbH\nGesellschaft mit beschränkter Haftung\nBacknang\n\nAls nicht eingetragen wird bekanntgemacht:\nDen Gläubigern der an der Abspaltung beteiligten Rechtsträger ist, wenn sie binnen sechs Monaten nach dem Tag, an dem die Eintragung der Abspaltung in das Register des Sitzes desjenigen Rechtsträgers, dessen Gläubiger sie sind, nach § 19 Abs. 3 UmwG als bekanntgemacht gilt, ihren Anspruch nach Grund und Höhe schriftlich anmelden, Sicherheit zu leisten, soweit sie nicht Befriedigung verlangen können. Dieses Recht steht den Gläubigern jedoch nur zu, wenn sie glaubhaft machen, dass durch die Abspaltung die Erfüllung ihrer Forderung gefährdet wird."
    },
    {
      "date": "2025-10-30",
      "id": "135820",
      "original_text": "Einreichung neuer Dokumente\nSchleswig-Holstein Amtsgericht Kiel HRB 6960\nTKMS GmbH – Kiel",
      "type": "Einreichung neuer Dokumente",
      "state": "Schleswig-Holstein",
      "amtsgericht": "Amtsgericht Kiel",
      "registernummer": "HRB 6960",
      "registerart": "HRB",
      "company_name": "TKMS GmbH",
      "company_seat": "Kiel",
      "details": "30.10.2025 (Bekanntmachungsdatum)\n\nSchleswig-Holstein Amtsgericht Kiel HRB 6960\nEinreichung neuer Dokumente\n\nTKMS GmbH\nGesellschaft mit beschränkter Haftung\nKiel\n\nEine neue Liste der Aufsichtsratsmitglieder ist eingereicht worden."
    },
    {
      "date": "2025-10-30",
      "id": "135821",
      "original_text": "Registerbekanntmachung nach dem Umwandlungsgesetz\nHamburg Amtsgericht Hamburg HRB 183336\nWWH Asset Verwaltung Sunaid X GmbH – Hamburg",
      "type": "Registerbekanntmachung nach dem Umwandlungsgesetz",
      "state": "Hamburg",
      "amtsgericht": "Amtsgericht Hamburg",
      "registernummer": "HRB 183336",
      "registerart": "HRB",
      "company_name": "WWH Asset Verwaltung Sunaid X GmbH",
      "company_seat": "Hamburg",
      "details": "30.10.2025 (Bekanntmachungsdatum)\n\nHamburg Amtsgericht Hamburg HRB 183336\nRegisterbekanntmachung nach dem Umwandlungsgesetz 30.10.2025 (Eintragungsdatum)\n\nWWH Asset Verwaltung Sunaid X GmbH\nGesellschaft mit beschränkter Haftung\nHamburg\n\nAls nicht eingetragen wird bekannt gemacht:\nDen Gläubigern der an der Verschmelzung beteiligten Gesellschaften ist, wenn sie binnen sechs Monaten nach dem Tag, an dem die Eintragung der Verschmelzung in das Register des Sitzes desjenigen Rechtsträgers, dessen Gläubiger sie sind, nach § 19 Absatz 3 UmwG als bekannt gemacht gilt, ihren Anspruch nach Grund und Höhe schriftlich anmelden, Sicherheit zu leisten, soweit sie nicht Befriedigung verlangen können. Dieses Recht steht den Gläubigern jedoch nur zu, wenn sie glaubhaft machen, dass durch die Verschmelzung die Erfüllung ihrer Forderung gefährdet wird."
    },
    {
      "date": "2025-10-30",
      "id": "135822",
      "original_text": "Registerbekanntmachung nach dem Umwandlungsgesetz\nMecklenburg-Vorpommern Amtsgericht Schwerin HRA 4800\nSamweljan Baudienstleistungen e.K. – Dersenow OT Dammereez",
      "type": "Registerbekanntmachung nach dem Umwandlungsgesetz",
      "state": "Mecklenburg-Vorpommern",
      "amtsgericht": "Amtsgericht Schwerin",
      "registernummer": "HRA 4800",
      "registerart": "HRA",
      "company_name": "Samweljan Baudienstleistungen e.K.",
      "company_seat": "Dersenow OT Dammereez",
      "details": "30.10.2025 (Bekanntmachungsdatum)\n\nMecklenburg-Vorpommern Amtsgericht Schwerin HRA 4800\nRegisterbekanntmachung nach dem Umwandlungsgesetz 30.10.2025 (Eintragungsdatum)\n\nSamweljan Baudienstleistungen e.K.\nEinzelkaufmann / Einzelkauffrau\nDersenow OT Dammereez\n\nAls nicht eingetragen wird veröffentlicht: Den Gläubigern der an der Ausgliederung beteiligten Rechtsträger ist, wenn sie binnen sechs Monaten nach dem Tag, an dem die Eintragung der Ausgliederung in das Register des Sitzes desjenigen Rechtsträgers, dessen Gläubiger sie sind, nach § 19 Abs. 3 UmwG als bekannt gemacht gilt, ihren Anspruch nach Grund und Höhe in Textform anmelden,\nSicherheit zu leisten, soweit sie nicht Befriedigung verlangen können. Dieses Recht steht den Gläubigern jedoch nur zu, wenn sie glaubhaft machen, dass durch die Ausgliederung die Erfüllung der Forderung gefährdet wird."
    },
    {
      "date": "2025-10-30",
      "id": "135823",
      "original_text": "Löschungsankündigung\nSaarland Amtsgericht Saarbrücken HRB 91446\nGünther Krämer Baustoffe, Int. Spedition GmbH – Neunkirchen",
      "type": "Löschungsankündigung",
      "state": "Saarland",
      "amtsgericht": "Amtsgericht Saarbrücken",
      "registernummer": "HRB 91446",
      "registerart": "HRB",
      "company_name": "Günther Krämer Baustoffe, Int. Spedition GmbH",
      "company_seat": "Neunkirchen",
      "details": "30.10.2025 (Bekanntmachungsdatum)\n\nSaarland Amtsgericht Saarbrücken HRB 91446\nLöschungsankündigung\n\nGünther Krämer Baustoffe, Int. Spedition GmbH\nGesellschaft mit beschränkter Haftung\nNeunkirchen\n\nEs ist beabsichtigt, die Gesellschaft von Amts wegen gemäß § 394 FamFG wegen Vermögenslosigkeit zu löschen.\nGegen die Löschung von Amts wegen ist das Rechtsmittel des Widerspruchs statthaft. Der Widerspruch ist binnen einer Frist zwei Monaten beginnend mit dem Tag dieser Veröffentlichung durch Einreichen eines Widerspruchsschreibens -schriftlich oder zur Niederschrift der Geschäftsstelle beim Amtsgericht Saarbrücken, -zentrales Handelsregister-, Mainzerstr.178, 66121 Saarbrücken einzulegen.\nDer Widerspruch muss die Bezeichnung der angefochtenen Löschungsankündigung enthalten sowie die Erklärung, dass Widerspruch eingelegt wird. Er ist vom Widerspruchsführer oder seinem Bevollmächtigten zu unterzeichnen.\nDas Widerspruchsschreiben kann auch in der Form eines elektronischen Dokumentes eingereicht werden, das mit einer qualifizierten elektronischen Signatur nach dem Signaturgesetz versehen sein muss (§§ 14 Abs. 2 FamFG, 130a, 298 ZPO)."
    },
    {
      "date": "2025-10-30",
      "id": "135824",
      "original_text": "Registerbekanntmachung nach dem Umwandlungsgesetz\nBaden-Württemberg Amtsgericht Stuttgart HRA 742642\nAutohaus Lott GmbH & Co. KG – Neudenau",
      "type": "Registerbekanntmachung nach dem Umwandlungsgesetz",
      "state": "Baden-Württemberg",
      "amtsgericht": "Amtsgericht Stuttgart",
      "registernummer": "HRA 742642",
      "registerart": "HRA",
      "company_name": "Autohaus Lott GmbH & Co. KG",
      "company_seat": "Neudenau",
      "details": "30.10.2025 (Bekanntmachungsdatum)\n\nBaden-Württemberg Amtsgericht Stuttgart HRA 742642\nRegisterbekanntmachung nach dem Umwandlungsgesetz 30.10.2025 (Eintragungsdatum)\n\nAutohaus Lott GmbH & Co. KG\nKommanditgesellschaft\nNeudenau\n\nAls nicht eingetragen wird bekanntgemacht: Den Gläubigern der an der Ausgliederung beteiligten Rechtsträger ist, wenn sie binnen sechs Monaten nach dem Tag, an dem die Eintragung der Ausgliederung in das Register des Sitzes desjenigen Rechtsträgers, dessen Gläubiger sie sind, nach § 19 Abs. 3 UmwG als bekanntgemacht gilt, ihren Anspruch nach Grund und Höhe schriftlich anmelden, Sicherheit zu leisten, soweit sie nicht Befriedigung verlangen können. Dieses Recht steht den Gläubigern jedoch nur zu, wenn sie glaubhaft machen, dass durch die Ausgliederung die Erfüllung ihrer Forderung gefährdet wird."
    },
    {
      "date": "2025-10-30",
      "id": "135825",
      "original_text": "Registerbekanntmachung nach dem Umwandlungsgesetz\nBaden-Württemberg Amtsgericht Stuttgart HRA 104608\nFriedbert Lott e.K. – Neudenau",
      "type": "Registerbekanntmachung nach dem Umwandlungsgesetz",
      "state": "Baden-Württemberg",
      "amtsgericht": "Amtsgericht Stuttgart",
      "registernummer": "HRA 104608",
      "registerart": "HRA",
      "company_name": "Friedbert Lott e.K.",
      "company_seat": "Neudenau",
      "details": "30.10.2025 (Bekanntmachungsdatum)\n\nBaden-Württemberg Amtsgericht Stuttgart HRA 104608\nRegisterbekanntmachung nach dem Umwandlungsgesetz 30.10.2025 (Eintragungsdatum)\n\nFriedbert Lott e.K.\nEinzelkaufmann / Einzelkauffrau\nNeudenau\n\nDen Gläubigern der an der Ausgliederung beteiligten Rechtsträger ist, wenn sie binnen sechs Monaten nach dem Tag, an dem die Eintragung der Ausgliederung in das Register des Sitzes desjenigen Rechtsträgers, dessen Gläubiger sie sind, nach § 19 Abs. 3 UmwG als bekanntgemacht gilt, ihren Anspruch nach Grund und Höhe schriftlich anmelden, Sicherheit zu leisten, soweit sie nicht Befriedigung verlangen können. Dieses Recht steht den Gläubigern jedoch nur zu, wenn sie glaubhaft machen, dass durch die Ausgliederung die Erfüllung ihrer Forderung gefährdet wird."
    },
    {
      "date": "2025-10-30",
      "id": "135826",
      "original_text": "Sonstige Registerbekanntmachung\nBerlin Amtsgericht Berlin (Charlottenburg) HRB 41516\nIBM Deutschland Customer Support Services GmbH – Berlin",
      "type": "Sonstige Registerbekanntmachung",
      "state": "Berlin",
      "amtsgericht": "Amtsgericht Berlin (Charlottenburg)",
      "registernummer": "HRB 41516",
      "registerart": "HRB",
      "company_name": "IBM Deutschland Customer Support Services GmbH",
      "company_seat": "Berlin",
      "details": "30.10.2025 (Bekanntmachungsdatum)\n\nBerlin Amtsgericht Berlin (Charlottenburg) HRB 41516\nSonstige Registerbekanntmachung\n\nIBM Deutschland Customer Support Services GmbH\nGesellschaft mit beschränkter Haftung\nBerlin\n\nAls nicht eingetragen wird veröffentlicht: Der andere Vertragsteil hat den Gläubigern dieses Rechtsträgers, deren Forderungen begründet worden sind, bevor die Eintragung der Beendigung dieses Vertrages in das Handelsregister nach § 10 des Handelsgesetzbuches als bekannt gemacht gilt, Sicherheit zu leisten, wenn sie sich binnen sechs Monaten nach der Bekanntmachung der Eintragung zu diesem Zweck bei ihm melden. Dieses Recht steht den Gläubigern nicht zu, die im Fall des Insolvenzverfahrens ein Recht auf vorzugsweise Befriedigung aus der Deckungsmasse haben, die nach gesetzlicher Vorschrift zu ihrem Schutz errichtet und staatlich überwacht ist."
    },
    {
      "date": "2025-10-30",
      "id": "135827",
      "original_text": "Registerbekanntmachung nach dem Umwandlungsgesetz\nBaden-Württemberg Amtsgericht Stuttgart HRA 102788\nKaufland 018 GmbH & Co. KG – Neckarsulm",
      "type": "Registerbekanntmachung nach dem Umwandlungsgesetz",
      "state": "Baden-Württemberg",
      "amtsgericht": "Amtsgericht Stuttgart",
      "registernummer": "HRA 102788",
      "registerart": "HRA",
      "company_name": "Kaufland 018 GmbH & Co. KG",
      "company_seat": "Neckarsulm",
      "details": "30.10.2025 (Bekanntmachungsdatum)\n\nBaden-Württemberg Amtsgericht Stuttgart HRA 102788\nRegisterbekanntmachung nach dem Umwandlungsgesetz 30.10.2025 (Eintragungsdatum)\n\nKaufland 018 GmbH & Co. KG\nKommanditgesellschaft\nNeckarsulm\n\nAls nicht eingetragen wird bekanntgemacht:\nDen Gläubigern der an der Abspaltung beteiligten Rechtsträger ist, wenn sie binnen sechs Monaten nach dem Tag, an dem die Eintragung der Abspaltung in das Register des Sitzes desjenigen Rechtsträgers, dessen Gläubiger sie sind, nach § 19 Abs. 3 UmwG als bekanntgemacht gilt, ihren Anspruch nach Grund und Höhe schriftlich anmelden, Sicherheit zu leisten, soweit sie nicht Befriedigung verlangen können. Dieses Recht steht den Gläubigern jedoch nur zu, wenn sie glaubhaft machen, dass durch die Abspaltung die Erfüllung ihrer Forderung gefährdet wird."
    },
    {
      "date": "2025-10-30",
      "id": "135828",
      "original_text": "Löschungsankündigung\nBerlin Amtsgericht Berlin (Charlottenburg) HRA 49163\nGrundstücksgesellschaft Heerstr. 16 mbH & Co. Verwaltung KG – Berlin",
      "type": "Löschungsankündigung",
      "state": "Berlin",
      "amtsgericht": "Amtsgericht Berlin (Charlottenburg)",
      "registernummer": "HRA 49163",
      "registerart": "HRA",
      "company_name": "Grundstücksgesellschaft Heerstr. 16 mbH & Co. Verwaltung KG",
      "company_seat": "Berlin",
      "details": "30.10.2025 (Bekanntmachungsdatum)\n\nBerlin Amtsgericht Berlin (Charlottenburg) HRA 49163\nLöschungsankündigung\n\nGrundstücksgesellschaft Heerstr. 16 mbH & Co. Verwaltung KG\nKommanditgesellschaft\nBerlin\n\nBei dem nachstehenden Unternehmen / der nachstehenden Gesellschaft wird das Amtslöschungsverfahren gemäß § 31 Abs. 2 HGB eingeleitet. Widerspruchsfrist 2 Monate"
    },
    {
      "date": "2025-10-30",
      "id": "135829",
      "original_text": "Registerbekanntmachung nach dem Umwandlungsgesetz\nSchleswig-Holstein Amtsgericht Lübeck HRA 1225 OL\nH. F. Meyer Maschinenbau GmbH & Co. KG – Neustadt in Holstein",
      "type": "Registerbekanntmachung nach dem Umwandlungsgesetz",
      "state": "Schleswig-Holstein",
      "amtsgericht": "Amtsgericht Lübeck",
      "registernummer": "HRA 1225 OL",
      "registerart": "HRA",
      "company_name": "H. F. Meyer Maschinenbau GmbH & Co. KG",
      "company_seat": "Neustadt in Holstein",
      "details": "30.10.2025 (Bekanntmachungsdatum)\n\nSchleswig-Holstein Amtsgericht Lübeck HRA 1225 OL\nRegisterbekanntmachung nach dem Umwandlungsgesetz 29.10.2025 (Eintragungsdatum)\n\nH. F. Meyer Maschinenbau GmbH & Co. KG\nKommanditgesellschaft\nNeustadt in Holstein\n\nZu Eintragungsnummer 22 vom 29.10.2025 wird als nicht eingetragen veröffentlicht: Den Gläubigern ist, wenn sie binnen sechs Monaten nach dem Tag, an dem die Eintragung der Umwandlung als bekannt gemacht gilt, ihren Anspruch nach Grund und Höhe schriftlich anmelden, Sicherheit zu leisten, soweit sie nicht Befriedigung verlangen können. Dieses Recht steht den Gläubigern jedoch nur zu, wenn sie glaubhaft machen, dass durch die Umwandlung die Erfüllung ihrer Forderung gefährdet wird."
    },
    {
      "date": "2025-10-30",
      "id": "135830",
      "original_text": "Löschungsankündigung\nBaden-Württemberg Amtsgericht Mannheim HRB 729979\nEpic4Business - Beratungs- & Beteiligungs GmbH – Mannheim",
      "type": "Löschungsankündigung",
      "state": "Baden-Württemberg",
      "amtsgericht": "Amtsgericht Mannheim",
      "registernummer": "HRB 729979",
      "registerart": "HRB",
      "company_name": "Epic4Business - Beratungs- & Beteiligungs GmbH",
      "company_seat": "Mannheim",
      "details": "30.10.2025 (Bekanntmachungsdatum)\n\nBaden-Württemberg Amtsgericht Mannheim HRB 729979\nLöschungsankündigung\n\nEpic4Business - Beratungs- & Beteiligungs GmbH\nGesellschaft mit beschränkter Haftung\nMannheim\n\nAls nicht eingetragen wird bekanntgemacht:\nDas Gericht beabsichtigt, die Gesellschaft wegen Vermögenslosigkeit im Handelsregister von Amts wegen nach § 394 FamFG zu löschen. Die Frist zur Geltendmachung eines Widerspruchs gegen die beabsichtigte Löschung ist auf einen Monat ab Veröffentlichung bestimmt."
    },
    {
      "date": "2025-10-30",
      "id": "135831",
      "original_text": "Sonstige Registerbekanntmachung\nBaden-Württemberg Amtsgericht Stuttgart GnR 210059\nBaugenossenschaft Reichenbach an der Fils Eingetragene Genossenschaft – Reichenbach an der Fils",
      "type": "Sonstige Registerbekanntmachung",
      "state": "Baden-Württemberg",
      "amtsgericht": "Amtsgericht Stuttgart",
      "registernummer": "GnR 210059",
      "registerart": "GnR",
      "company_name": "Baugenossenschaft Reichenbach an der Fils Eingetragene Genossenschaft",
      "company_seat": "Reichenbach an der Fils",
      "details": "30.10.2025 (Bekanntmachungsdatum)\n\nBaden-Württemberg Amtsgericht Stuttgart GnR 210059\nSonstige Registerbekanntmachung 30.10.2025 (Eintragungsdatum)\n\nBaugenossenschaft Reichenbach an der Fils Eingetragene Genossenschaft\neingetragene Genossenschaft\nReichenbach an der Fils\n\nAls nicht eingetragen wird bekanntgemacht:\nDie Verpflichtung der Genossen, Nachschüsse zur Insolvenzmasse zu leisten, wurde aufgehoben. Den Gläubigern der Genossenschaft ist, wenn sie sich binnen sechs Monaten nach der Bekanntmachung bei der Genossenschaft zu diesem Zweck melden, Sicherheit zu leisten, soweit sie nicht Befriedigung verlangen können."
    },
    {
      "date": "2025-10-30",
      "id": "135832",
      "original_text": "Sonstige Registerbekanntmachung\nBaden-Württemberg Amtsgericht Stuttgart GnR 210059\nBaugenossenschaft Reichenbach an der Fils Eingetragene Genossenschaft – Reichenbach an der Fils",
      "type": "Sonstige Registerbekanntmachung",
      "state": "Baden-Württemberg",
      "amtsgericht": "Amtsgericht Stuttgart",
      "registernummer": "GnR 210059",
      "registerart": "GnR",
      "company_name": "Baugenossenschaft Reichenbach an der Fils Eingetragene Genossenschaft",
      "company_seat": "Reichenbach an der Fils",
      "details": "30.10.2025 (Bekanntmachungsdatum)\n\nBaden-Württemberg Amtsgericht Stuttgart GnR 210059\nSonstige Registerbekanntmachung 30.10.2025 (Eintragungsdatum)\n\nBaugenossenschaft Reichenbach an der Fils Eingetragene Genossenschaft\neingetragene Genossenschaft\nReichenbach an der Fils\n\nAls nicht eingetragen wird ergänzend bekanntgemacht:\nDie Verpflichtung der Genossen, Nachschüsse zur Insolvenzmasse zu leisten, wurde aufgehoben. Den Gläubigern der Genossenschaft ist, wenn sie sich binnen sechs Monaten nach der Bekanntmachung bei der Genossenschaft zu diesem Zweck melden, Sicherheit zu leisten, soweit sie nicht Befriedigung verlangen können.\nDas Recht, Sicherheitsleistung zu verlangen, steht Gläubigern nicht zu, die im Fall der Insolvenz ein Recht auf vorzugsweise Befriedigung aus einer Deckungsmasse haben, die nach gesetzlicher Vorschrift zu ihrem Schutz errichtet und staatlich überwacht ist."
    },
    {
      "date": "2025-10-30",
      "id": "135833",
      "original_text": "Löschungsankündigung\nBerlin Amtsgericht Berlin (Charlottenburg) HRB 224839\nDelphin Logistik UG (haftungsbeschränkt) – Berlin",
      "type": "Löschungsankündigung",
      "state": "Berlin",
      "amtsgericht": "Amtsgericht Berlin (Charlottenburg)",
      "registernummer": "HRB 224839",
      "registerart": "HRB",
      "company_name": "Delphin Logistik UG (haftungsbeschränkt)",
      "company_seat": "Berlin",
      "details": "30.10.2025 (Bekanntmachungsdatum)\n\nBerlin Amtsgericht Berlin (Charlottenburg) HRB 224839\nLöschungsankündigung\n\nDelphin Logistik UG (haftungsbeschränkt)\nGesellschaft mit beschränkter Haftung\nBerlin\n\nBei der nachstehenden Gesellschaft wird das Amtslöschungsverfahren gemäß § 394 FamFG eingeleitet. Widerspruchsfrist 6 Wochen"
    },
    {
      "date": "2025-10-30",
      "id": "135834",
      "original_text": "Registerbekanntmachung nach dem Umwandlungsgesetz\nBrandenburg Amtsgericht Cottbus HRB 17787\nKIH GmbH – Schönefeld",
      "type": "Registerbekanntmachung nach dem Umwandlungsgesetz",
      "state": "Brandenburg",
      "amtsgericht": "Amtsgericht Cottbus",
      "registernummer": "HRB 17787",
      "registerart": "HRB",
      "company_name": "KIH GmbH",
      "company_seat": "Schönefeld",
      "details": "30.10.2025 (Bekanntmachungsdatum)\n\nBrandenburg Amtsgericht Cottbus HRB 17787\nRegisterbekanntmachung nach dem Umwandlungsgesetz 30.10.2025 (Eintragungsdatum)\n\nKIH GmbH\nGesellschaft mit beschränkter Haftung\nSchönefeld\n\nAls nicht eingetragen wird veröffentlicht:\nDen Gläubigern der an der Verschmelzung beteiligten Rechtsträger ist, wenn sie binnen sechs Monaten nach dem Tag, an dem die Eintragung der Verschmelzung in das Register des Sitzes desjenigen Rechtsträgers, dessen Gläubiger sie sind, als bekannt gemacht gilt, ihren Anspruch nach Grund und Höhe schriftlich anmelden, Sicherheit zu leisten, soweit sie nicht Befriedigung verlangen können. Dieses Recht steht den Gläubigern jedoch nur zu, wenn sie glaubhaft machen, dass durch die Verschmelzung die Erfüllung ihrer Forderung gefährdet wird"
    },
    {
      "date": "2025-10-30",
      "id": "135835",
      "original_text": "Einreichung neuer Dokumente\nBaden-Württemberg Amtsgericht Mannheim HRB 701644\nCARUS AG – Heidelberg",
      "type": "Einreichung neuer Dokumente",
      "state": "Baden-Württemberg",
      "amtsgericht": "Amtsgericht Mannheim",
      "registernummer": "HRB 701644",
      "registerart": "HRB",
      "company_name": "CARUS AG",
      "company_seat": "Heidelberg",
      "details": "30.10.2025 (Bekanntmachungsdatum)\n\nBaden-Württemberg Amtsgericht Mannheim HRB 701644\nEinreichung neuer Dokumente\n\nCARUS AG\nAktiengesellschaft\nHeidelberg\n\nDie Gesellschaft hat am 29.10.2025 die Liste über die Zusammensetzung des Aufsichtsrats zum Handelsregister eingereicht."
    },
    {
      "date": "2025-10-30",
      "id": "135836",
      "original_text": "Löschungsankündigung\nBerlin Amtsgericht Berlin (Charlottenburg) HRB 238217\nSinocard GmbH – Berlin",
      "type": "Löschungsankündigung",
      "state": "Berlin",
      "amtsgericht": "Amtsgericht Berlin (Charlottenburg)",
      "registernummer": "HRB 238217",
      "registerart": "HRB",
      "company_name": "Sinocard GmbH",
      "company_seat": "Berlin",
      "details": "30.10.2025 (Bekanntmachungsdatum)\n\nBerlin Amtsgericht Berlin (Charlottenburg) HRB 238217\nLöschungsankündigung\n\nSinocard GmbH\nGesellschaft mit beschränkter Haftung\nBerlin\n\nBei der nachstehenden Gesellschaft wird das Amtslöschungsverfahren gemäß § 394 FamFG eingeleitet. Widerspruchsfrist 6 Wochen"
    },
    {
      "date": "2025-10-30",
      "id": "135837",
      "original_text": "Registerbekanntmachung nach dem Umwandlungsgesetz\nThüringen Amtsgericht Jena VR 231715\nLaw Clinics Deutschland – Jena",
      "type": "Registerbekanntmachung nach dem Umwandlungsgesetz",
      "state": "Thüringen",
      "amtsgericht": "Amtsgericht Jena",
      "registernummer": "VR 231715",
      "registerart": "VR",
      "company_name": "Law Clinics Deutschland",
      "company_seat": "Jena",
      "details": "30.10.2025 (Bekanntmachungsdatum)\n\nThüringen Amtsgericht Jena VR 231715\nRegisterbekanntmachung nach dem Umwandlungsgesetz 29.10.2025 (Eintragungsdatum)\n\nLaw Clinics Deutschland\neingetragener Verein\nJena\n\nNicht eingetragen: Den Gläubigern der an der Verschmelzung beteiligten Rechtsträger, ist wenn sie binnen sechs Monaten nach dem Tag, an dem die Eintragung der Verschmelzung in das Register des Sitzes desjenigen Rechtsträgers, dessen Gläubiger sie sind,  nach § 19 Abs. 3 UmwG als bekanntgemacht gilt, ihren Anspruch nach Grund und Höhe schriftlich anmelden, Sicherheit zu leisten, soweit sie nicht Befriedigung verlangen können. Dieses Recht steht ihnen jedoch nur zu, wenn sie glaubhaft machen, daß durch die Verschmelzung die Erfüllung ihrer Forderung gefährdet wird."
    },
    {
      "date": "2025-10-30",
      "id": "135838",
      "original_text": "Einreichung neuer Dokumente\nBrandenburg Amtsgericht Neuruppin HRB 2161\nAWU Abfallwirtschafts-Union Ostprignitz-Ruppin GmbH – Märkisch Linden",
      "type": "Einreichung neuer Dokumente",
      "state": "Brandenburg",
      "amtsgericht": "Amtsgericht Neuruppin",
      "registernummer": "HRB 2161",
      "registerart": "HRB",
      "company_name": "AWU Abfallwirtschafts-Union Ostprignitz-Ruppin GmbH",
      "company_seat": "Märkisch Linden",
      "details": "30.10.2025 (Bekanntmachungsdatum)\n\nBrandenburg Amtsgericht Neuruppin HRB 2161\nEinreichung neuer Dokumente\n\nAWU Abfallwirtschafts-Union Ostprignitz-Ruppin GmbH\nGesellschaft mit beschränkter Haftung\nMärkisch Linden\n\nAls nicht eingetragen wird veröffentlicht: Eine Liste der Mitglieder des Aufsichtsrates wurde zum Handelsregister eingereicht."
    },
    {
      "date": "2025-10-30",
      "id": "135839",
      "original_text": "Löschungsankündigung\nBerlin Amtsgericht Berlin (Charlottenburg) HRA 57252\nDeSa Bauservice UG (haftungsbeschränkt) & Co. KG – Berlin",
      "type": "Löschungsankündigung",
      "state": "Berlin",
      "amtsgericht": "Amtsgericht Berlin (Charlottenburg)",
      "registernummer": "HRA 57252",
      "registerart": "HRA",
      "company_name": "DeSa Bauservice UG (haftungsbeschränkt) & Co. KG",
      "company_seat": "Berlin",
      "details": "30.10.2025 (Bekanntmachungsdatum)\n\nBerlin Amtsgericht Berlin (Charlottenburg) HRA 57252\nLöschungsankündigung\n\nDeSa Bauservice UG (haftungsbeschränkt) & Co. KG\nKommanditgesellschaft\nBerlin\n\nBei dem nachstehenden Unternehmen / der nachstehenden Gesellschaft wird das Amtslöschungsverfahren gemäß § 31 Abs. 2 HGB eingeleitet. Widerspruchsfrist 1 Monat"
    },
    {
      "date": "2025-10-30",
      "id": "135840",
      "original_text": "Sonstige Registerbekanntmachung\nBerlin Amtsgericht Berlin (Charlottenburg) HRB 214057\nEU BM Trading UG (haftungsbeschränkt) – Berlin",
      "type": "Sonstige Registerbekanntmachung",
      "state": "Berlin",
      "amtsgericht": "Amtsgericht Berlin (Charlottenburg)",
      "registernummer": "HRB 214057",
      "registerart": "HRB",
      "company_name": "EU BM Trading UG (haftungsbeschränkt)",
      "company_seat": "Berlin",
      "details": "30.10.2025 (Bekanntmachungsdatum)\n\nBerlin Amtsgericht Berlin (Charlottenburg) HRB 214057\nSonstige Registerbekanntmachung\n\nEU BM Trading UG (haftungsbeschränkt)\nGesellschaft mit beschränkter Haftung\nBerlin\n\nAls nicht eingetragen wird veröffentlicht: Den Gläubigern ist, wenn sie binnen sechs Monaten nach dem Tag, an dem die Eintragung der Umwandlung als bekannt gemacht gilt, ihren Anspruch nach Grund und Höhe schriftlich anmelden, Sicherheit zu leisten, soweit sie nicht Befriedigung verlangen können. Dieses Recht steht den Gläubigern jedoch nur zu, wenn sie glaubhaft machen, dass durch die Umwandlung die Erfüllung ihrer Forderung gefährdet wird. Das Recht, Sicherheitsleistung zu verlangen, steht Gläubigern nicht zu, die im Falle der Insolvenz ein Recht auf vorzugsweise Befriedigung aus einer Deckungsmasse haben, die nach gesetzlicher Vorschrift zu ihrem Schutz errichtet und staatlich überwacht ist."
    },
    {
      "date": "2025-10-30",
      "id": "135841",
      "original_text": "Registerbekanntmachung nach dem Umwandlungsgesetz\nBaden-Württemberg Amtsgericht Stuttgart HRB 758202\nsfbic consulting GmbH – Weissach im Tal",
      "type": "Registerbekanntmachung nach dem Umwandlungsgesetz",
      "state": "Baden-Württemberg",
      "amtsgericht": "Amtsgericht Stuttgart",
      "registernummer": "HRB 758202",
      "registerart": "HRB",
      "company_name": "sfbic consulting GmbH",
      "company_seat": "Weissach im Tal",
      "details": "30.10.2025 (Bekanntmachungsdatum)\n\nBaden-Württemberg Amtsgericht Stuttgart HRB 758202\nRegisterbekanntmachung nach dem Umwandlungsgesetz 30.10.2025 (Eintragungsdatum)\n\nsfbic consulting GmbH\nGesellschaft mit beschränkter Haftung\nWeissach im Tal\n\nAls nicht eingetragen wird bekanntgemacht:\nDen Gläubigern der an der Verschmelzung beteiligten Rechtsträger ist, wenn sie binnen sechs Monaten nach dem Tag, an dem die Eintragung der Verschmelzung in das Register des Sitzes desjenigen Rechtsträgers, dessen Gläubiger sie sind, nach § 19 Abs. 3 UmwG als bekanntgemacht gilt, ihren Anspruch nach Grund und Höhe schriftlich anmelden, Sicherheit zu leisten, soweit sie nicht Befriedigung verlangen können. Dieses Recht steht den Gläubigern jedoch nur zu, wenn sie glaubhaft machen, dass durch die Verschmelzung die Erfüllung ihrer Forderung gefährdet wird."
    },
    {
      "date": "2025-10-30",
      "id": "135842",
      "original_text": "Löschungsankündigung\nSchleswig-Holstein Amtsgericht Lübeck HRB 21329\nNorthern Networks UG (haftungsbeschränkt) – Bad Schwartau",
      "type": "Löschungsankündigung",
      "state": "Schleswig-Holstein",
      "amtsgericht": "Amtsgericht Lübeck",
      "registernummer": "HRB 21329",
      "registerart": "HRB",
      "company_name": "Northern Networks UG (haftungsbeschränkt)",
      "company_seat": "Bad Schwartau",
      "details": "30.10.2025 (Bekanntmachungsdatum)\n\nSchleswig-Holstein Amtsgericht Lübeck HRB 21329\nLöschungsankündigung\n\nNorthern Networks UG (haftungsbeschränkt)\nGesellschaft mit beschränkter Haftung\nBad Schwartau\n\nAn die Gesellschaft per Vreöffentlichung:\n\nin der Handelsregistersache der\nNorthern Networks UG (haftungsbeschränkt)\n\nergeben sich Anhaltspunkte dafür, dass die Gesellschaft vermögenslos ist.\nEs ist daher beabsichtigt, die Gesellschaft wegen Vermögenslosigkeit gemäß § 394 FamFG zu löschen.\nEs ist eine Frist von einem Monat zur Geltendmachung eines Widerspruchs beginnend ab der Veröffentlichung gegen die Löschung, § 394 Abs. 2 S. 1 FamFG bestimmt.\n\nNach Fristablauf ohne Widerspruch von Ihnen oder anderer Seite wird die Gesellschaft gelöscht.\n\nGärtner\nDipl.-Rechtspflegerin (FH)"
    },
    {
      "date": "2025-10-30",
      "id": "135843",
      "original_text": "Einreichung neuer Dokumente\nBerlin Amtsgericht Berlin (Charlottenburg) HRB 190317\nLloyds Bank GmbH – Berlin",
      "type": "Einreichung neuer Dokumente",
      "state": "Berlin",
      "amtsgericht": "Amtsgericht Berlin (Charlottenburg)",
      "registernummer": "HRB 190317",
      "registerart": "HRB",
      "company_name": "Lloyds Bank GmbH",
      "company_seat": "Berlin",
      "details": "30.10.2025 (Bekanntmachungsdatum)\n\nBerlin Amtsgericht Berlin (Charlottenburg) HRB 190317\nEinreichung neuer Dokumente\n\nLloyds Bank GmbH\nGesellschaft mit beschränkter Haftung\nBerlin\n\nAls nicht eingetragen wird veröffentlicht: Es wurde eine neue Liste der Aufsichtsratsmitglieder eingereicht (§52 GmbHG)."
    },
    {
      "date": "2025-10-30",
      "id": "135844",
      "original_text": "Löschungsankündigung\nBerlin Amtsgericht Berlin (Charlottenburg) HRB 212669\nHumaChannels UG (haftungsbeschränkt) – Berlin",
      "type": "Löschungsankündigung",
      "state": "Berlin",
      "amtsgericht": "Amtsgericht Berlin (Charlottenburg)",
      "registernummer": "HRB 212669",
      "registerart": "HRB",
      "company_name": "HumaChannels UG (haftungsbeschränkt)",
      "company_seat": "Berlin",
      "details": "30.10.2025 (Bekanntmachungsdatum)\n\nBerlin Amtsgericht Berlin (Charlottenburg) HRB 212669\nLöschungsankündigung\n\nHumaChannels UG (haftungsbeschränkt)\nGesellschaft mit beschränkter Haftung\nBerlin\n\nBei der nachstehenden Gesellschaft wird das Amtslöschungsverfahren gemäß § 394 FamFG eingeleitet. Widerspruchsfrist 6 Wochen"
    },
    {
      "date": "2025-10-30",
      "id": "135845",
      "original_text": "Registerbekanntmachung nach dem Umwandlungsgesetz\nBaden-Württemberg Amtsgericht Mannheim HRB 734220\nAuto Ernst Verwaltungsgesellschaft mbH – Mannheim",
      "type": "Registerbekanntmachung nach dem Umwandlungsgesetz",
      "state": "Baden-Württemberg",
      "amtsgericht": "Amtsgericht Mannheim",
      "registernummer": "HRB 734220",
      "registerart": "HRB",
      "company_name": "Auto Ernst Verwaltungsgesellschaft mbH",
      "company_seat": "Mannheim",
      "details": "30.10.2025 (Bekanntmachungsdatum)\n\nBaden-Württemberg Amtsgericht Mannheim HRB 734220\nRegisterbekanntmachung nach dem Umwandlungsgesetz 30.10.2025 (Eintragungsdatum)\n\nAuto Ernst Verwaltungsgesellschaft mbH\nGesellschaft mit beschränkter Haftung\nMannheim\n\nDen Gläubigern der an der Verschmelzung beteiligten Rechtsträger ist, wenn sie binnen sechs Monaten nach dem Tag, an dem die Eintragung der Verschmelzung in das Register des Sitzes desjenigen Rechtsträgers, dessen Gläubiger sie sind, nach § 19 Abs. 3 UmwG als bekanntgemacht gilt, ihren Anspruch nach Grund und Höhe schriftlich anmelden, Sicherheit zu leisten, soweit sie nicht Befriedigung verlangen können. Dieses Recht steht den Gläubigern jedoch nur zu, wenn sie glaubhaft machen, dass durch die Verschmelzung die Erfüllung ihrer Forderung gefährdet wird."
    },
    {
      "date": "2025-10-30",
      "id": "135846",
      "original_text": "Löschungsankündigung\nSchleswig-Holstein Amtsgericht Lübeck HRB 18003\nJEKA Parts Trading GmbH – Lübeck",
      "type": "Löschungsankündigung",
      "state": "Schleswig-Holstein",
      "amtsgericht": "Amtsgericht Lübeck",
      "registernummer": "HRB 18003",
      "registerart": "HRB",
      "company_name": "JEKA Parts Trading GmbH",
      "company_seat": "Lübeck",
      "details": "30.10.2025 (Bekanntmachungsdatum)\n\nSchleswig-Holstein Amtsgericht Lübeck HRB 18003\nLöschungsankündigung\n\nJEKA Parts Trading GmbH\nGesellschaft mit beschränkter Haftung\nLübeck\n\nEs ist die Löschung der nachstehenden Gesellschaft wegen Vermögenslosigkeit gemäß § 394 FamFG beabsichtigt."
    },
    {
      "date": "2025-10-30",
      "id": "135847",
      "original_text": "Registerbekanntmachung nach dem Umwandlungsgesetz\nBaden-Württemberg Amtsgericht Mannheim HRB 351860\nSAP Portals Holding Beteiligungs GmbH – Walldorf",
      "type": "Registerbekanntmachung nach dem Umwandlungsgesetz",
      "state": "Baden-Württemberg",
      "amtsgericht": "Amtsgericht Mannheim",
      "registernummer": "HRB 351860",
      "registerart": "HRB",
      "company_name": "SAP Portals Holding Beteiligungs GmbH",
      "company_seat": "Walldorf",
      "details": "30.10.2025 (Bekanntmachungsdatum)\n\nBaden-Württemberg Amtsgericht Mannheim HRB 351860\nRegisterbekanntmachung nach dem Umwandlungsgesetz 30.10.2025 (Eintragungsdatum)\n\nSAP Portals Holding Beteiligungs GmbH\nGesellschaft mit beschränkter Haftung\nWalldorf\n\nDen Gläubigern der an der Verschmelzung beteiligten Rechtsträger ist, wenn sie binnen sechs Monaten nach dem Tag, an dem die Eintragung der Verschmelzung in das Register des Sitzes desjenigen Rechtsträgers, dessen Gläubiger sie sind, nach § 19 Abs. 3 UmwG als bekanntgemacht gilt, ihren Anspruch nach Grund und Höhe schriftlich anmelden, Sicherheit zu leisten, soweit sie nicht Befriedigung verlangen können. Dieses Recht steht den Gläubigern jedoch nur zu, wenn sie glaubhaft machen, dass durch die Verschmelzung die Erfüllung ihrer Forderung gefährdet wird."
    },
    {
      "date": "2025-10-30",
      "id": "135848",
      "original_text": "Sonstige Registerbekanntmachung\nBerlin Amtsgericht Berlin (Charlottenburg) VR 28748\nUNITI Bundesverband EnergieMittelstand e.V. – Berlin",
      "type": "Sonstige Registerbekanntmachung",
      "state": "Berlin",
      "amtsgericht": "Amtsgericht Berlin (Charlottenburg)",
      "registernummer": "VR 28748",
      "registerart": "VR",
      "company_name": "UNITI Bundesverband EnergieMittelstand e.V.",
      "company_seat": "Berlin",
      "details": "30.10.2025 (Bekanntmachungsdatum)\n\nBerlin Amtsgericht Berlin (Charlottenburg) VR 28748\nSonstige Registerbekanntmachung\n\nUNITI Bundesverband EnergieMittelstand e.V.\neingetragener Verein\nBerlin\n\nAls nicht eingetragen wird veröffentlicht:Den Gläubigern der an der Verschmelzung beteiligten Rechtsträger ist, wenn sie binnen sechs Monaten nach dem Tag, an dem die Eintragung der Verschmelzung in das Register des Sitzes desjenigen Rechtsträgers, dessen Gläubiger sie sind, als bekannt gemacht gilt, ihren Anspruch nach Grund und Höhe schriftlich anmelden, Sicherheit zu leisten, soweit sie nicht Befriedigung verlangen können. Dieses Recht steht den Gläubigern jedoch nur zu, wenn sie glaubhaft machen, dass durch die Verschmelzung die Erfüllung ihrer Forderung gefährdet wird. Das Recht, Sicherheitsleistung zu verlangen, steht Gläubigern nicht zu, die im Falle der Insolvenz ein Recht auf vorzugsweise Befriedigung aus einer Deckungsmasse haben, die nach gesetzlicher Vorschrift zu ihrem Schutz errichtet und staatlich überwacht ist."
    },
    {
      "date": "2025-10-30",
      "id": "135849",
      "original_text": "Löschungsankündigung\nBaden-Württemberg Amtsgericht Mannheim HRB 755422\nGermany Hidden Champions Verwaltungs GmbH – Heidelberg",
      "type": "Löschungsankündigung",
      "state": "Baden-Württemberg",
      "amtsgericht": "Amtsgericht Mannheim",
      "registernummer": "HRB 755422",
      "registerart": "HRB",
      "company_name": "Germany Hidden Champions Verwaltungs GmbH",
      "company_seat": "Heidelberg",
      "details": "30.10.2025 (Bekanntmachungsdatum)\n\nBaden-Württemberg Amtsgericht Mannheim HRB 755422\nLöschungsankündigung 30.10.2025 (Eintragungsdatum)\n\nGermany Hidden Champions Verwaltungs GmbH\nGesellschaft mit beschränkter Haftung\nHeidelberg\n\nDas Gericht beabsichtigt, die Gesellschaft wegen Vermögenslosigkeit im Handelsregister von Amts wegen nach § 394 FamFG zu löschen. Die Frist zur Geltendmachung eines Widerspruchs gegen die beabsichtigte Löschung ist auf einen Monat ab Veröffentlichung bestimmt."
    },
    {
      "date": "2025-10-30",
      "id": "135850",
      "original_text": "Registerbekanntmachung nach dem Umwandlungsgesetz\nBaden-Württemberg Amtsgericht Mannheim HRA 712363\nAvesta Services e.K. – Ettlingen",
      "type": "Registerbekanntmachung nach dem Umwandlungsgesetz",
      "state": "Baden-Württemberg",
      "amtsgericht": "Amtsgericht Mannheim",
      "registernummer": "HRA 712363",
      "registerart": "HRA",
      "company_name": "Avesta Services e.K.",
      "company_seat": "Ettlingen",
      "details": "30.10.2025 (Bekanntmachungsdatum)\n\nBaden-Württemberg Amtsgericht Mannheim HRA 712363\nRegisterbekanntmachung nach dem Umwandlungsgesetz 30.10.2025 (Eintragungsdatum)\n\nAvesta Services e.K.\nEinzelkaufmann / Einzelkauffrau\nEttlingen\n\nAls nicht eingetragen wird bekanntgemacht: Den Gläubigern der an der Ausgliederung beteiligten Rechtsträger ist, wenn sie binnen sechs Monaten nach dem Tag, an dem die Eintragung der Ausgliederung in das Register des Sitzes desjenigen Rechtsträgers, dessen Gläubiger sie sind, nach § 19 Abs. 3 UmwG als bekanntgemacht gilt, ihren Anspruch nach Grund und Höhe schriftlich anmelden, Sicherheit zu leisten, soweit sie nicht Befriedigung verlangen können. Dieses Recht steht den Gläubigern jedoch nur zu, wenn sie glaubhaft machen, dass durch die Ausgliederung die Erfüllung ihrer Forderung gefährdet wird."
    },
    {
      "date": "2025-10-30",
      "id": "135851",
      "original_text": "Einreichung neuer Dokumente\nBaden-Württemberg Amtsgericht Stuttgart HRB 752094\nODYSYS AG – Mundelsheim",
      "type": "Einreichung neuer Dokumente",
      "state": "Baden-Württemberg",
      "amtsgericht": "Amtsgericht Stuttgart",
      "registernummer": "HRB 752094",
      "registerart": "HRB",
      "company_name": "ODYSYS AG",
      "company_seat": "Mundelsheim",
      "details": "30.10.2025 (Bekanntmachungsdatum)\n\nBaden-Württemberg Amtsgericht Stuttgart HRB 752094\nEinreichung neuer Dokumente\n\nODYSYS AG\nAktiengesellschaft\nMundelsheim\n\nDie Gesellschaft hat am 09.10.2025 die Liste über die Zusammensetzung des Aufsichtsrats zum Handelsregister eingereicht."
    },
    {
      "date": "2025-10-30",
      "id": "135852",
      "original_text": "Registerbekanntmachung nach dem Umwandlungsgesetz\nBaden-Württemberg Amtsgericht Stuttgart HRB 801925\nRehatechnikzentrum BON REHA GmbH – Obersulm",
      "type": "Registerbekanntmachung nach dem Umwandlungsgesetz",
      "state": "Baden-Württemberg",
      "amtsgericht": "Amtsgericht Stuttgart",
      "registernummer": "HRB 801925",
      "registerart": "HRB",
      "company_name": "Rehatechnikzentrum BON REHA GmbH",
      "company_seat": "Obersulm",
      "details": "30.10.2025 (Bekanntmachungsdatum)\n\nBaden-Württemberg Amtsgericht Stuttgart HRB 801925\nRegisterbekanntmachung nach dem Umwandlungsgesetz 30.10.2025 (Eintragungsdatum)\n\nRehatechnikzentrum BON REHA GmbH\nGesellschaft mit beschränkter Haftung\nObersulm\n\nAls nicht eingetragen wird bekanntgemacht:\nDen Gläubigern der an der Ausgliederung beteiligten Rechtsträger ist, wenn sie binnen sechs Monaten nach dem Tag, an dem die Eintragung der Ausgliederung in das Register des Sitzes desjenigen Rechtsträgers, dessen Gläubiger sie sind, nach § 19 Abs. 3 UmwG als bekanntgemacht gilt, ihren Anspruch nach Grund und Höhe schriftlich anmelden, Sicherheit zu leisten, soweit sie nicht Befriedigung verlangen können. Dieses Recht steht den Gläubigern jedoch nur zu, wenn sie glaubhaft machen, dass durch die Ausgliederung die Erfüllung ihrer Forderung gefährdet wird."
    },
    {
      "date": "2025-10-30",
      "id": "135853",
      "original_text": "Löschungsankündigung\nSchleswig-Holstein Amtsgericht Flensburg HRB 11184\nSPL Verwaltungs GmbH – Horstedt",
      "type": "Löschungsankündigung",
      "state": "Schleswig-Holstein",
      "amtsgericht": "Amtsgericht Flensburg",
      "registernummer": "HRB 11184",
      "registerart": "HRB",
      "company_name": "SPL Verwaltungs GmbH",
      "company_seat": "Horstedt",
      "details": "30.10.2025 (Bekanntmachungsdatum)\n\nSchleswig-Holstein Amtsgericht Flensburg HRB 11184\nLöschungsankündigung\n\nSPL Verwaltungs GmbH\nGesellschaft mit beschränkter Haftung\nHorstedt\n\nEs ist die Löschung der nachstehenden Gesellschaft wegen Vermögenslosigkeit gemäß § 394 FamFG beabsichtigt.\nWiderspruchsfrist: 2 Monate."
    },
    {
      "date": "2025-10-30",
      "id": "135854",
      "original_text": "Registerbekanntmachung nach dem Umwandlungsgesetz\nBaden-Württemberg Amtsgericht Mannheim HRB 756158\nAvesta Services GmbH – Ettlingen",
      "type": "Registerbekanntmachung nach dem Umwandlungsgesetz",
      "state": "Baden-Württemberg",
      "amtsgericht": "Amtsgericht Mannheim",
      "registernummer": "HRB 756158",
      "registerart": "HRB",
      "company_name": "Avesta Services GmbH",
      "company_seat": "Ettlingen",
      "details": "30.10.2025 (Bekanntmachungsdatum)\n\nBaden-Württemberg Amtsgericht Mannheim HRB 756158\nRegisterbekanntmachung nach dem Umwandlungsgesetz 30.10.2025 (Eintragungsdatum)\n\nAvesta Services GmbH\nGesellschaft mit beschränkter Haftung\nEttlingen\n\nAls nicht eingetragen wird bekanntgemacht: Den Gläubigern der an der Ausgliederung beteiligten Rechtsträger ist, wenn sie binnen sechs Monaten nach dem Tag, an dem die Eintragung der Ausgliederung in das Register des Sitzes desjenigen Rechtsträgers, dessen Gläubiger sie sind, nach § 19 Abs. 3 UmwG als bekanntgemacht gilt, ihren Anspruch nach Grund und Höhe schriftlich anmelden, Sicherheit zu leisten, soweit sie nicht Befriedigung verlangen können. Dieses Recht steht den Gläubigern jedoch nur zu, wenn sie glaubhaft machen, dass durch die Ausgliederung die Erfüllung ihrer Forderung gefährdet wird."
    },
    {
      "date": "2025-10-30",
      "id": "135855",
      "original_text": "Registerbekanntmachung nach dem Umwandlungsgesetz\nBaden-Württemberg Amtsgericht Stuttgart HRB 768804\nMein Quartier Nürtingen Betriebsgesellschaft mbH – Nürtingen",
      "type": "Registerbekanntmachung nach dem Umwandlungsgesetz",
      "state": "Baden-Württemberg",
      "amtsgericht": "Amtsgericht Stuttgart",
      "registernummer": "HRB 768804",
      "registerart": "HRB",
      "company_name": "Mein Quartier Nürtingen Betriebsgesellschaft mbH",
      "company_seat": "Nürtingen",
      "details": "30.10.2025 (Bekanntmachungsdatum)\n\nBaden-Württemberg Amtsgericht Stuttgart HRB 768804\nRegisterbekanntmachung nach dem Umwandlungsgesetz 30.10.2025 (Eintragungsdatum)\n\nMein Quartier Nürtingen Betriebsgesellschaft mbH\nGesellschaft mit beschränkter Haftung\nNürtingen\n\nDen Gläubigern der an der Verschmelzung beteiligten Rechtsträger ist, wenn sie binnen sechs Monaten nach dem Tag, an dem die Eintragung der Verschmelzung in das Register des Sitzes desjenigen Rechtsträgers, dessen Gläubiger sie sind, nach § 19 Abs. 3 UmwG als bekanntgemacht gilt, ihren Anspruch nach Grund und Höhe schriftlich anmelden, Sicherheit zu leisten, soweit sie nicht Befriedigung verlangen können. Dieses Recht steht den Gläubigern jedoch nur zu, wenn sie glaubhaft machen, dass durch die Verschmelzung die Erfüllung ihrer Forderung gefährdet wird."
    },
    {
      "date": "2025-10-30",
      "id": "135856",
      "original_text": "Registerbekanntmachung nach dem Umwandlungsgesetz\nSachsen Amtsgericht Leipzig HRB 37768\nCommpanion GmbH – Leipzig",
      "type": "Registerbekanntmachung nach dem Umwandlungsgesetz",
      "state": "Sachsen",
      "amtsgericht": "Amtsgericht Leipzig",
      "registernummer": "HRB 37768",
      "registerart": "HRB",
      "company_name": "Commpanion GmbH",
      "company_seat": "Leipzig",
      "details": "30.10.2025 (Bekanntmachungsdatum)\n\nSachsen Amtsgericht Leipzig HRB 37768\nRegisterbekanntmachung nach dem Umwandlungsgesetz 30.10.2025 (Eintragungsdatum)\n\nCommpanion GmbH\nGesellschaft mit beschränkter Haftung\nLeipzig\n\nDen Gläubigern der an der Verschmelzung beteiligten Rechtsträger ist, wenn sie binnen sechs Monaten nach dem Tag, an dem die Eintragung der Verschmelzung in das Register des Sitzes desjenigen Rechtsträgers, dessen Gläubiger sie sind, nach § 19 Abs. 3 UmwG als bekannt gemacht gilt, ihren Anspruch nach Grund und Höhe in Textform anmelden, Sicherheit zu leisten, soweit sie nicht Befriedigung verlangen können. Dieses Recht steht den Gläubigern jedoch nur zu, wenn sie glaubhaft machen, dass durch die Verschmelzung die Erfüllung der Forderung gefährdet wird."
    },
    {
      "date": "2025-10-30",
      "id": "135857",
      "original_text": "Registerbekanntmachung nach dem Umwandlungsgesetz\nSachsen Amtsgericht Leipzig HRB 649\nCommpanion GmbH – Leipzig",
      "type": "Registerbekanntmachung nach dem Umwandlungsgesetz",
      "state": "Sachsen",
      "amtsgericht": "Amtsgericht Leipzig",
      "registernummer": "HRB 649",
      "registerart": "HRB",
      "company_name": "Commpanion GmbH",
      "company_seat": "Leipzig",
      "details": "30.10.2025 (Bekanntmachungsdatum)\n\nSachsen Amtsgericht Leipzig HRB 649\nRegisterbekanntmachung nach dem Umwandlungsgesetz 30.10.2025 (Eintragungsdatum)\n\nCommpanion GmbH\nGesellschaft mit beschränkter Haftung\nLeipzig\n\nDen Gläubigern der an der Verschmelzung beteiligten Rechtsträger ist, wenn sie binnen sechs Monaten nach dem Tag, an dem die Eintragung der Verschmelzung in das Register des Sitzes desjenigen Rechtsträgers, dessen Gläubiger sie sind, nach § 19 Abs. 3 UmwG als bekannt gemacht gilt, ihren Anspruch nach Grund und Höhe in Textform anmelden, Sicherheit zu leisten, soweit sie nicht Befriedigung verlangen können. Dieses Recht steht den Gläubigern jedoch nur zu, wenn sie glaubhaft machen, dass durch die Verschmelzung die Erfüllung der Forderung gefährdet wird."
    },
    {
      "date": "2025-10-30",
      "id": "135858",
      "original_text": "Registerbekanntmachung nach dem Umwandlungsgesetz\nSachsen Amtsgericht Leipzig HRB 38480\nGPM Verwaltung GmbH – Markkleeberg",
      "type": "Registerbekanntmachung nach dem Umwandlungsgesetz",
      "state": "Sachsen",
      "amtsgericht": "Amtsgericht Leipzig",
      "registernummer": "HRB 38480",
      "registerart": "HRB",
      "company_name": "GPM Verwaltung GmbH",
      "company_seat": "Markkleeberg",
      "details": "30.10.2025 (Bekanntmachungsdatum)\n\nSachsen Amtsgericht Leipzig HRB 38480\nRegisterbekanntmachung nach dem Umwandlungsgesetz 30.10.2025 (Eintragungsdatum)\n\nGPM Verwaltung GmbH\nGesellschaft mit beschränkter Haftung\nMarkkleeberg\n\nDen Gläubigern der an der Verschmelzung beteiligten Rechtsträger ist, wenn sie binnen sechs Monaten nach dem Tag, an dem die Eintragung der Verschmelzung in das Register des Sitzes desjenigen Rechtsträgers, dessen Gläubiger sie sind, nach § 19 Abs. 3 UmwG als bekannt gemacht gilt, ihren Anspruch nach Grund und Höhe in Textform anmelden, Sicherheit zu leisten, soweit sie nicht Befriedigung verlangen können. Dieses Recht steht den Gläubigern jedoch nur zu, wenn sie glaubhaft machen, dass durch die Verschmelzung die Erfüllung der Forderung gefährdet wird."
    },
    {
      "date": "2025-10-30",
      "id": "135859",
      "original_text": "Registerbekanntmachung nach dem Umwandlungsgesetz\nSachsen Amtsgericht Leipzig HRB 38563\nGPM Projekt 60 UG (haftungsbeschränkt) – Markkleeberg",
      "type": "Registerbekanntmachung nach dem Umwandlungsgesetz",
      "state": "Sachsen",
      "amtsgericht": "Amtsgericht Leipzig",
      "registernummer": "HRB 38563",
      "registerart": "HRB",
      "company_name": "GPM Projekt 60 UG (haftungsbeschränkt)",
      "company_seat": "Markkleeberg",
      "details": "30.10.2025 (Bekanntmachungsdatum)\n\nSachsen Amtsgericht Leipzig HRB 38563\nRegisterbekanntmachung nach dem Umwandlungsgesetz 30.10.2025 (Eintragungsdatum)\n\nGPM Projekt 60 UG (haftungsbeschränkt)\nGesellschaft mit beschränkter Haftung\nMarkkleeberg\n\nDen Gläubigern der an der Verschmelzung beteiligten Rechtsträger ist, wenn sie binnen sechs Monaten nach dem Tag, an dem die Eintragung der Verschmelzung in das Register des Sitzes desjenigen Rechtsträgers, dessen Gläubiger sie sind, nach § 19 Abs. 3 UmwG als bekannt gemacht gilt, ihren Anspruch nach Grund und Höhe in Textform anmelden, Sicherheit zu leisten, soweit sie nicht Befriedigung verlangen können. Dieses Recht steht den Gläubigern jedoch nur zu, wenn sie glaubhaft machen, dass durch die Verschmelzung die Erfüllung der Forderung gefährdet wird."
    },
    {
      "date": "2025-10-30",
      "id": "135860",
      "original_text": "Einreichung neuer Dokumente\nSachsen Amtsgericht Chemnitz HRB 9661\nC³ Chemnitzer Veranstaltungszentren GmbH – Chemnitz",
      "type": "Einreichung neuer Dokumente",
      "state": "Sachsen",
      "amtsgericht": "Amtsgericht Chemnitz",
      "registernummer": "HRB 9661",
      "registerart": "HRB",
      "company_name": "C³ Chemnitzer Veranstaltungszentren GmbH",
      "company_seat": "Chemnitz",
      "details": "30.10.2025 (Bekanntmachungsdatum)\n\nSachsen Amtsgericht Chemnitz HRB 9661\nEinreichung neuer Dokumente\n\nC³ Chemnitzer Veranstaltungszentren GmbH\nGesellschaft mit beschränkter Haftung\nChemnitz\n\nAm 23.10.2025 wurde beim Handelsregister des Amtsgerichts Chemnitz die Liste der Mitglieder des Aufsichtsrats gemäß § 52 GmbHG eingereicht."
    },
    {
      "date": "2025-10-30",
      "id": "135861",
      "original_text": "Registerbekanntmachung nach dem Umwandlungsgesetz\nNiedersachsen Amtsgericht Tostedt HRB 208896\nMS Immobilien GmbH – Harsefeld",
      "type": "Registerbekanntmachung nach dem Umwandlungsgesetz",
      "state": "Niedersachsen",
      "amtsgericht": "Amtsgericht Tostedt",
      "registernummer": "HRB 208896",
      "registerart": "HRB",
      "company_name": "MS Immobilien GmbH",
      "company_seat": "Harsefeld",
      "details": "30.10.2025 (Bekanntmachungsdatum)\n\nNiedersachsen Amtsgericht Tostedt HRB 208896\nRegisterbekanntmachung nach dem Umwandlungsgesetz 30.10.2025 (Eintragungsdatum)\n\nMS Immobilien GmbH\nGesellschaft mit beschränkter Haftung\nHarsefeld\n\nDen Gläubigern der an der Verschmelzung beteiligten Rechtsträger ist, wenn sie binnen sechs Monaten nach dem Tag, an dem die Eintragung der Verschmelzung in das Register des Sitzes desjenigen Rechtsträgers, dessen Gläubiger sie sind, nach § 19  Abs.  3 UmwG als bekannt gemacht gilt, ihren Anspruch nach Grund und Höhe schriftlich anmelden, Sicherheit zu leisten, soweit sie nicht Befriedigung verlangen können. Dieses Recht steht den Gläubigern jedoch nur zu, wenn sie glaubhaft machen, dass durch die Verschmelzung die Erfüllung der Forderung gefährdet wird."
    },
    {
      "date": "2025-10-30",
      "id": "135862",
      "original_text": "Sonstige Registerbekanntmachung\nNiedersachsen Amtsgericht Osnabrück HRB 201244\nSSB Seniorenzentrum Lüstringen GmbH – Osnabrück",
      "type": "Sonstige Registerbekanntmachung",
      "state": "Niedersachsen",
      "amtsgericht": "Amtsgericht Osnabrück",
      "registernummer": "HRB 201244",
      "registerart": "HRB",
      "company_name": "SSB Seniorenzentrum Lüstringen GmbH",
      "company_seat": "Osnabrück",
      "details": "30.10.2025 (Bekanntmachungsdatum)\n\nNiedersachsen Amtsgericht Osnabrück HRB 201244\nSonstige Registerbekanntmachung 29.10.2025 (Eintragungsdatum)\n\nSSB Seniorenzentrum Lüstringen GmbH\nGesellschaft mit beschränkter Haftung\nOsnabrück\n\nDen Gläubigern der Gesellschaft, deren Forderungen begründet worden sind, bevor die Eintragung der Beendigung des Vertrages in das Handelsregister nach § 10 HGB als bekanntgemacht gilt, ist vom anderen Vertragsteil Sicherheit zu leisten, wenn sie sich binnen sechs Monaten nach der Bekanntmachung zu diesem Zweck bei ihm melden."
    },
    {
      "date": "2025-10-30",
      "id": "135863",
      "original_text": "Registerbekanntmachung nach dem Umwandlungsgesetz\nNiedersachsen Amtsgericht Hildesheim HRB 202093\nHager-Lüdde Verwaltungs-GmbH – Müden (Aller)",
      "type": "Registerbekanntmachung nach dem Umwandlungsgesetz",
      "state": "Niedersachsen",
      "amtsgericht": "Amtsgericht Hildesheim",
      "registernummer": "HRB 202093",
      "registerart": "HRB",
      "company_name": "Hager-Lüdde Verwaltungs-GmbH",
      "company_seat": "Müden (Aller)",
      "details": "30.10.2025 (Bekanntmachungsdatum)\n\nNiedersachsen Amtsgericht Hildesheim HRB 202093\nRegisterbekanntmachung nach dem Umwandlungsgesetz 30.10.2025 (Eintragungsdatum)\n\nHager-Lüdde Verwaltungs-GmbH\nGesellschaft mit beschränkter Haftung\nMüden (Aller)\n\nDen Gläubigern der an der Verschmelzung beteiligten Rechtsträger ist, wenn sie binnen sechs Monaten nach dem Tag, an dem die Eintragung der Verschmelzung in das Register des Sitzes desjenigen Rechtsträgers, dessen Gläubiger sie sind, nach § 19  Abs.  3 UmwG als bekannt gemacht gilt, ihren Anspruch nach Grund und Höhe schriftlich anmelden, Sicherheit zu leisten, soweit sie nicht Befriedigung verlangen können. Dieses Recht steht den Gläubigern jedoch nur zu, wenn sie glaubhaft machen, dass durch die Verschmelzung die Erfüllung der Forderung gefährdet wird."
    },
    {
      "date": "2025-10-30",
      "id": "135864",
      "original_text": "Registerbekanntmachung nach dem Umwandlungsgesetz\nNiedersachsen Amtsgericht Walsrode HRA 205600\nImmobilien Lange Inh. Kai Müscher e.K. – Ritterhude",
      "type": "Registerbekanntmachung nach dem Umwandlungsgesetz",
      "state": "Niedersachsen",
      "amtsgericht": "Amtsgericht Walsrode",
      "registernummer": "HRA 205600",
      "registerart": "HRA",
      "company_name": "Immobilien Lange Inh. Kai Müscher e.K.",
      "company_seat": "Ritterhude",
      "details": "30.10.2025 (Bekanntmachungsdatum)\n\nNiedersachsen Amtsgericht Walsrode HRA 205600\nRegisterbekanntmachung nach dem Umwandlungsgesetz 30.10.2025 (Eintragungsdatum)\n\nImmobilien Lange Inh. Kai Müscher e.K.\nEinzelkaufmann / Einzelkauffrau\nRitterhude\n\nDen Gläubigern der an der Ausgliederung beteiligten Rechtsträger ist, wenn sie binnen sechs Monaten nach dem Tag, an dem die Eintragung der Ausgliederung in das Register des Sitzes desjenigen Rechtsträgers, dessen Gläubiger sie sind, nach § 19 Abs. 3 UmwG als bekannt gemacht gilt, ihren Anspruch nach Grund und Höhe schriftlich anmelden, Sicherheit zu leisten, soweit sie nicht Befriedigung verlangen können. Dieses Recht steht den Gläubigern jedoch nur zu, wenn sie glaubhaft machen, dass durch die Ausgliederung die Erfüllung der Forderung gefährdet wird."
    },
    {
      "date": "2025-10-30",
      "id": "135865",
      "original_text": "Einreichung neuer Dokumente\nNiedersachsen Amtsgericht Hildesheim HRB 202841\nKSM Castings Group GmbH – Hildesheim",
      "type": "Einreichung neuer Dokumente",
      "state": "Niedersachsen",
      "amtsgericht": "Amtsgericht Hildesheim",
      "registernummer": "HRB 202841",
      "registerart": "HRB",
      "company_name": "KSM Castings Group GmbH",
      "company_seat": "Hildesheim",
      "details": "30.10.2025 (Bekanntmachungsdatum)\n\nNiedersachsen Amtsgericht Hildesheim HRB 202841\nEinreichung neuer Dokumente\n\nKSM Castings Group GmbH\nGesellschaft mit beschränkter Haftung\nHildesheim\n\nDie Liste der Mitglieder des Aufsichtsrats wurde beim Registergericht eingereicht."
    },
    {
      "date": "2025-10-30",
      "id": "135866",
      "original_text": "Löschungsankündigung\nNiedersachsen Amtsgericht Braunschweig HRB 205433\nHarzer Veranstaltungs-Agentur UG (haftungsbeschränkt) – Braunlage",
      "type": "Löschungsankündigung",
      "state": "Niedersachsen",
      "amtsgericht": "Amtsgericht Braunschweig",
      "registernummer": "HRB 205433",
      "registerart": "HRB",
      "company_name": "Harzer Veranstaltungs-Agentur UG (haftungsbeschränkt)",
      "company_seat": "Braunlage",
      "details": "30.10.2025 (Bekanntmachungsdatum)\n\nNiedersachsen Amtsgericht Braunschweig HRB 205433\nLöschungsankündigung\n\nHarzer Veranstaltungs-Agentur UG (haftungsbeschränkt)\nGesellschaft mit beschränkter Haftung\nBraunlage\n\nDas Registergericht beabsichtigt, die Gesellschaft von Amts wegen nach § 394 FamFG zu löschen. Die Frist zur Erhebung eines Widerspruchs ist auf 1 Monat ab dieser Registerbekanntmachung festgesetzt."
    },
    {
      "date": "2025-10-30",
      "id": "135867",
      "original_text": "Löschungsankündigung\nNiedersachsen Amtsgericht Göttingen HRB 205661\nZeetex Reifen GmbH – Göttingen",
      "type": "Löschungsankündigung",
      "state": "Niedersachsen",
      "amtsgericht": "Amtsgericht Göttingen",
      "registernummer": "HRB 205661",
      "registerart": "HRB",
      "company_name": "Zeetex Reifen GmbH",
      "company_seat": "Göttingen",
      "details": "30.10.2025 (Bekanntmachungsdatum)\n\nNiedersachsen Amtsgericht Göttingen HRB 205661\nLöschungsankündigung\n\nZeetex Reifen GmbH\nGesellschaft mit beschränkter Haftung\nGöttingen\n\nDas Registergericht beabsichtigt, die Gesellschaft von Amts wegen nach § 394 FamFG zu löschen. Die Frist zur Erhebung eines Widerspruchs ist auf 1 Monat ab dieser Registerbekanntmachung festgesetzt."
    },
    {
      "date": "2025-10-30",
      "id": "135868",
      "original_text": "Registerbekanntmachung nach dem Umwandlungsgesetz\nNiedersachsen Amtsgericht Hildesheim HRB 202156\nHager-Lüdde Biogasanlage-GmbH – Müden (Aller)",
      "type": "Registerbekanntmachung nach dem Umwandlungsgesetz",
      "state": "Niedersachsen",
      "amtsgericht": "Amtsgericht Hildesheim",
      "registernummer": "HRB 202156",
      "registerart": "HRB",
      "company_name": "Hager-Lüdde Biogasanlage-GmbH",
      "company_seat": "Müden (Aller)",
      "details": "30.10.2025 (Bekanntmachungsdatum)\n\nNiedersachsen Amtsgericht Hildesheim HRB 202156\nRegisterbekanntmachung nach dem Umwandlungsgesetz 30.10.2025 (Eintragungsdatum)\n\nHager-Lüdde Biogasanlage-GmbH\nGesellschaft mit beschränkter Haftung\nMüden (Aller)\n\nDen Gläubigern der an der Verschmelzung beteiligten Rechtsträger ist, wenn sie binnen sechs Monaten nach dem Tag, an dem die Eintragung der Verschmelzung in das Register des Sitzes desjenigen Rechtsträgers, dessen Gläubiger sie sind, nach § 19  Abs.  3 UmwG als bekannt gemacht gilt, ihren Anspruch nach Grund und Höhe schriftlich anmelden, Sicherheit zu leisten, soweit sie nicht Befriedigung verlangen können. Dieses Recht steht den Gläubigern jedoch nur zu, wenn sie glaubhaft machen, dass durch die Verschmelzung die Erfüllung der Forderung gefährdet wird."
    },
    {
      "date": "2025-10-30",
      "id": "135869",
      "original_text": "Registerbekanntmachung nach dem Umwandlungsgesetz\nNiedersachsen Amtsgericht Oldenburg (Oldenburg) HRB 212470\nIYOUWE Distribution GmbH – Wardenburg",
      "type": "Registerbekanntmachung nach dem Umwandlungsgesetz",
      "state": "Niedersachsen",
      "amtsgericht": "Amtsgericht Oldenburg (Oldenburg)",
      "registernummer": "HRB 212470",
      "registerart": "HRB",
      "company_name": "IYOUWE Distribution GmbH",
      "company_seat": "Wardenburg",
      "details": "30.10.2025 (Bekanntmachungsdatum)\n\nNiedersachsen Amtsgericht Oldenburg (Oldenburg) HRB 212470\nRegisterbekanntmachung nach dem Umwandlungsgesetz 30.10.2025 (Eintragungsdatum)\n\nIYOUWE Distribution GmbH\nGesellschaft mit beschränkter Haftung\nWardenburg\n\nDen Gläubigern der an der Verschmelzung beteiligten Rechtsträger ist, wenn sie binnen sechs Monaten nach dem Tag, an dem die Eintragung der Verschmelzung in das Register des Sitzes desjenigen Rechtsträgers, dessen Gläubiger sie sind, nach § 19  Abs.  3 UmwG als bekannt gemacht gilt, ihren Anspruch nach Grund und Höhe schriftlich anmelden, Sicherheit zu leisten, soweit sie nicht Befriedigung verlangen können. Dieses Recht steht den Gläubigern jedoch nur zu, wenn sie glaubhaft machen, dass durch die Verschmelzung die Erfüllung der Forderung gefährdet wird."
    },
    {
      "date": "2025-10-30",
      "id": "135870",
      "original_text": "Sonstige Registerbekanntmachung\nNiedersachsen Amtsgericht Lüneburg HRB 205393\nGröninger Landwirtschafts GmbH – Winsen (Aller)",
      "type": "Sonstige Registerbekanntmachung",
      "state": "Niedersachsen",
      "amtsgericht": "Amtsgericht Lüneburg",
      "registernummer": "HRB 205393",
      "registerart": "HRB",
      "company_name": "Gröninger Landwirtschafts GmbH",
      "company_seat": "Winsen (Aller)",
      "details": "30.10.2025 (Bekanntmachungsdatum)\n\nNiedersachsen Amtsgericht Lüneburg HRB 205393\nSonstige Registerbekanntmachung 30.10.2025 (Eintragungsdatum)\n\nGröninger Landwirtschafts GmbH\nGesellschaft mit beschränkter Haftung\nWinsen (Aller)\n\nDen Gläubigern der Gesellschaft, deren Forderungen begründet worden sind, bevor die Eintragung der Beendigung des Vertrages in das Handelsregister nach § 10 HGB als bekanntgemacht gilt, ist vom anderen Vertragsteil Sicherheit zu leisten, wenn sie sich binnen sechs Monaten nach der Bekanntmachung zu diesem Zweck bei ihm melden."
    },
    {
      "date": "2025-10-30",
      "id": "135871",
      "original_text": "Löschungsankündigung\nNiedersachsen Amtsgericht Tostedt HRA 204236\nLanghans Spedition + Agrartransporte UG (haftungsbeschränkt) & Co. KG – Gyhum",
      "type": "Löschungsankündigung",
      "state": "Niedersachsen",
      "amtsgericht": "Amtsgericht Tostedt",
      "registernummer": "HRA 204236",
      "registerart": "HRA",
      "company_name": "Langhans Spedition + Agrartransporte UG (haftungsbeschränkt) & Co. KG",
      "company_seat": "Gyhum",
      "details": "30.10.2025 (Bekanntmachungsdatum)\n\nNiedersachsen Amtsgericht Tostedt HRA 204236\nLöschungsankündigung\n\nLanghans Spedition + Agrartransporte UG (haftungsbeschränkt) & Co. KG\nKommanditgesellschaft\nGyhum\n\nDas Registergericht beabsichtigt, die Firma von Amts wegen nach § 395 FamFG zu löschen. Die Frist zur Erhebung eines Widerspruchs ist auf 1 Monat ab dieser Registerbekanntmachung festgesetzt."
    },
    {
      "date": "2025-10-30",
      "id": "135872",
      "original_text": "Löschungsankündigung\nNiedersachsen Amtsgericht Tostedt HRB 209094\nLOGINA SOLUTION UG - Oldendorf (haftungsbeschränkt) – Oldendorf",
      "type": "Löschungsankündigung",
      "state": "Niedersachsen",
      "amtsgericht": "Amtsgericht Tostedt",
      "registernummer": "HRB 209094",
      "registerart": "HRB",
      "company_name": "LOGINA SOLUTION UG - Oldendorf (haftungsbeschränkt)",
      "company_seat": "Oldendorf",
      "details": "30.10.2025 (Bekanntmachungsdatum)\n\nNiedersachsen Amtsgericht Tostedt HRB 209094\nLöschungsankündigung\n\nLOGINA SOLUTION UG - Oldendorf (haftungsbeschränkt)\nGesellschaft mit beschränkter Haftung\nOldendorf\n\nDas Registergericht beabsichtigt, die Gesellschaft von Amts wegen nach § 394 FamFG zu löschen. Die Frist zur Erhebung eines Widerspruchs ist auf 1 Monat ab dieser Registerbekanntmachung festgesetzt."
    },
    {
      "date": "2025-10-30",
      "id": "135873",
      "original_text": "Registerbekanntmachung nach dem Umwandlungsgesetz\nNiedersachsen Amtsgericht Tostedt HRB 203826\nO.S.T. Cuxhaven Verwaltungs GmbH – Cuxhaven",
      "type": "Registerbekanntmachung nach dem Umwandlungsgesetz",
      "state": "Niedersachsen",
      "amtsgericht": "Amtsgericht Tostedt",
      "registernummer": "HRB 203826",
      "registerart": "HRB",
      "company_name": "O.S.T. Cuxhaven Verwaltungs GmbH",
      "company_seat": "Cuxhaven",
      "details": "30.10.2025 (Bekanntmachungsdatum)\n\nNiedersachsen Amtsgericht Tostedt HRB 203826\nRegisterbekanntmachung nach dem Umwandlungsgesetz 30.10.2025 (Eintragungsdatum)\n\nO.S.T. Cuxhaven Verwaltungs GmbH\nGesellschaft mit beschränkter Haftung\nCuxhaven\n\nDen Gläubigern der an der Verschmelzung beteiligten Rechtsträger ist, wenn sie binnen sechs Monaten nach dem Tag, an dem die Eintragung der Verschmelzung in das Register des Sitzes desjenigen Rechtsträgers, dessen Gläubiger sie sind, nach § 19  Abs.  3 UmwG als bekannt gemacht gilt, ihren Anspruch nach Grund und Höhe schriftlich anmelden, Sicherheit zu leisten, soweit sie nicht Befriedigung verlangen können. Dieses Recht steht den Gläubigern jedoch nur zu, wenn sie glaubhaft machen, dass durch die Verschmelzung die Erfüllung der Forderung gefährdet wird."
    },
    {
      "date": "2025-10-30",
      "id": "135874",
      "original_text": "Registerbekanntmachung nach dem Umwandlungsgesetz\nNiedersachsen Amtsgericht Oldenburg (Oldenburg) HRB 203213\nSharing the Presence GmbH – Wardenburg",
      "type": "Registerbekanntmachung nach dem Umwandlungsgesetz",
      "state": "Niedersachsen",
      "amtsgericht": "Amtsgericht Oldenburg (Oldenburg)",
      "registernummer": "HRB 203213",
      "registerart": "HRB",
      "company_name": "Sharing the Presence GmbH",
      "company_seat": "Wardenburg",
      "details": "30.10.2025 (Bekanntmachungsdatum)\n\nNiedersachsen Amtsgericht Oldenburg (Oldenburg) HRB 203213\nRegisterbekanntmachung nach dem Umwandlungsgesetz 30.10.2025 (Eintragungsdatum)\n\nSharing the Presence GmbH\nGesellschaft mit beschränkter Haftung\nWardenburg\n\nDen Gläubigern der an der Verschmelzung beteiligten Rechtsträger ist, wenn sie binnen sechs Monaten nach dem Tag, an dem die Eintragung der Verschmelzung in das Register des Sitzes desjenigen Rechtsträgers, dessen Gläubiger sie sind, nach § 19  Abs.  3 UmwG als bekannt gemacht gilt, ihren Anspruch nach Grund und Höhe schriftlich anmelden, Sicherheit zu leisten, soweit sie nicht Befriedigung verlangen können. Dieses Recht steht den Gläubigern jedoch nur zu, wenn sie glaubhaft machen, dass durch die Verschmelzung die Erfüllung der Forderung gefährdet wird."
    },
    {
      "date": "2025-10-30",
      "id": "135875",
      "original_text": "Registerbekanntmachung nach dem Umwandlungsgesetz\nNiedersachsen Amtsgericht Walsrode HRB 213117\nImmobilien Lange GmbH – Ritterhude",
      "type": "Registerbekanntmachung nach dem Umwandlungsgesetz",
      "state": "Niedersachsen",
      "amtsgericht": "Amtsgericht Walsrode",
      "registernummer": "HRB 213117",
      "registerart": "HRB",
      "company_name": "Immobilien Lange GmbH",
      "company_seat": "Ritterhude",
      "details": "30.10.2025 (Bekanntmachungsdatum)\n\nNiedersachsen Amtsgericht Walsrode HRB 213117\nRegisterbekanntmachung nach dem Umwandlungsgesetz 30.10.2025 (Eintragungsdatum)\n\nImmobilien Lange GmbH\nGesellschaft mit beschränkter Haftung\nRitterhude\n\nDen Gläubigern der an der Ausgliederung beteiligten Rechtsträger ist, wenn sie binnen sechs Monaten nach dem Tag, an dem die Eintragung der Ausgliederung in das Register des Sitzes desjenigen Rechtsträgers, dessen Gläubiger sie sind, nach § 19 Abs. 3 UmwG als bekannt gemacht gilt, ihren Anspruch nach Grund und Höhe schriftlich anmelden, Sicherheit zu leisten, soweit sie nicht Befriedigung verlangen können. Dieses Recht steht den Gläubigern jedoch nur zu, wenn sie glaubhaft machen, dass durch die Ausgliederung die Erfüllung der Forderung gefährdet wird."
    },
    {
      "date": "2025-10-30",
      "id": "135876",
      "original_text": "Löschungsankündigung\nBremen Amtsgericht Bremen VR 1064 BHV\ntürkisch-arabischer Kulturverein in Bremerhaven – Bremerhaven",
      "type": "Löschungsankündigung",
      "state": "Bremen",
      "amtsgericht": "Amtsgericht Bremen",
      "registernummer": "VR 1064 BHV",
      "registerart": "VR",
      "company_name": "türkisch-arabischer Kulturverein in Bremerhaven",
      "company_seat": "Bremerhaven",
      "details": "30.10.2025 (Bekanntmachungsdatum)\n\nBremen Amtsgericht Bremen VR 1064 BHV\nLöschungsankündigung\n\ntürkisch-arabischer Kulturverein in Bremerhaven\neingetragener Verein\nBremerhaven\n\nEs wird beabsichtigt den Verein wegen Wegfall sämtlicher Mitglieder gemäß § 395 FamFGvon Amts wegen zu löschen.\nGegen die Löschung kann beim AG Bremen schriftlich oder zu Protokoll der Geschäftsstelle Widerspruch eingelegt werden. Widerspruchsfrist 4 Wochen."
    },
    {
      "date": "2025-10-30",
      "id": "135877",
      "original_text": "Löschungsankündigung\nBremen Amtsgericht Bremen HRA 27705\nHausbau Ost GmbH & Co. KG – Bremen",
      "type": "Löschungsankündigung",
      "state": "Bremen",
      "amtsgericht": "Amtsgericht Bremen",
      "registernummer": "HRA 27705",
      "registerart": "HRA",
      "company_name": "Hausbau Ost GmbH & Co. KG",
      "company_seat": "Bremen",
      "details": "30.10.2025 (Bekanntmachungsdatum)\n\nBremen Amtsgericht Bremen HRA 27705\nLöschungsankündigung\n\nHausbau Ost GmbH & Co. KG\nKommanditgesellschaft\nBremen\n\nEs ist beabsichtigt die im Handelsregister eingetragene Firma von Amts wegen gemäß § 31 Abs.2 HGB zu löschen. Gegen die Löschung kann beim AG Bremen schriftlich oder zu Protokoll der Geschäftsstelle Widerspruch eingelegt werden. Widerspruchsfrist 4 Wochen."
    },
    {
      "date": "2025-10-30",
      "id": "135878",
      "original_text": "Löschungsankündigung\nBremen Amtsgericht Bremen HRB 34179\nYurudesign GmbH – Bremen",
      "type": "Löschungsankündigung",
      "state": "Bremen",
      "amtsgericht": "Amtsgericht Bremen",
      "registernummer": "HRB 34179",
      "registerart": "HRB",
      "company_name": "Yurudesign GmbH",
      "company_seat": "Bremen",
      "details": "30.10.2025 (Bekanntmachungsdatum)\n\nBremen Amtsgericht Bremen HRB 34179\nLöschungsankündigung\n\nYurudesign GmbH\nGesellschaft mit beschränkter Haftung\nBremen\n\nEs ist beabsichtigt die im Handelsregister eingetragene Gesellschaft von Amts wegen gemäß § 394 FamFG zu löschen. Gegen die Löschung kann beim AG Bremen schriftlich oder zu Protokoll der Geschäftsstelle Widerspruch eingelegt werden. Widerspruchsfrist 4 Wochen."
    },
    {
      "date": "2025-10-30",
      "id": "135879",
      "original_text": "Löschungsankündigung\nRheinland-Pfalz Amtsgericht Ludwigshafen a.Rhein (Ludwigshafen) HRB 67413\nRamaj GmbH – Neuhofen",
      "type": "Löschungsankündigung",
      "state": "Rheinland-Pfalz",
      "amtsgericht": "Amtsgericht Ludwigshafen a.Rhein (Ludwigshafen)",
      "registernummer": "HRB 67413",
      "registerart": "HRB",
      "company_name": "Ramaj GmbH",
      "company_seat": "Neuhofen",
      "details": "30.10.2025 (Bekanntmachungsdatum)\n\nRheinland-Pfalz Amtsgericht Ludwigshafen a.Rhein (Ludwigshafen) HRB 67413\nLöschungsankündigung\n\nRamaj GmbH\nGesellschaft mit beschränkter Haftung\nNeuhofen\n\nDas Registergericht beabsichtigt die Gesellschaft von Amts wegen nach § 394 FamFG zu löschen. Die Frist zur Erhebung eines Widerspruchs ist auf einen Monat festgesetzt."
    },
    {
      "date": "2025-10-30",
      "id": "135880",
      "original_text": "Registerbekanntmachung nach dem Umwandlungsgesetz\nRheinland-Pfalz Amtsgericht Koblenz HRB 27018\nsim cargo GmbH – Sinzig",
      "type": "Registerbekanntmachung nach dem Umwandlungsgesetz",
      "state": "Rheinland-Pfalz",
      "amtsgericht": "Amtsgericht Koblenz",
      "registernummer": "HRB 27018",
      "registerart": "HRB",
      "company_name": "sim cargo GmbH",
      "company_seat": "Sinzig",
      "details": "30.10.2025 (Bekanntmachungsdatum)\n\nRheinland-Pfalz Amtsgericht Koblenz HRB 27018\nRegisterbekanntmachung nach dem Umwandlungsgesetz 30.10.2025 (Eintragungsdatum)\n\nsim cargo GmbH\nGesellschaft mit beschränkter Haftung\nSinzig\n\nAls nicht eingetragen wird veröffentlicht: Den Gläubigern der an der Verschmelzung beteiligten Rechtsträger ist, wenn sie binnen sechs Monaten nach dem Tag, an dem die Eintragung der Verschmelzung in das Register des Sitzes desjenigen Rechtsträgers,dessen Gläubiger sie sind, nach § 19 Abs. 3 UmwG als bekannt gemacht gilt, ihren Anspruch nach Grund und Höhe schriftlich anmelden, Sicherheit zu leisten, soweit sie nicht Befriedigung verlangen können. Dieses Recht steht den Gläubigern jedoch nur zu, wenn sie glaubhaft machen, dass durch die Verschmelzung die Erfüllungd er Forderung gefährdet wird."
    },
    {
      "date": "2025-10-30",
      "id": "135881",
      "original_text": "Registerbekanntmachung nach dem Umwandlungsgesetz\nRheinland-Pfalz Amtsgericht Ludwigshafen a.Rhein (Ludwigshafen) HRB 66544\nMUL Grundstücksholding Sachsen GmbH – Ludwigshafen",
      "type": "Registerbekanntmachung nach dem Umwandlungsgesetz",
      "state": "Rheinland-Pfalz",
      "amtsgericht": "Amtsgericht Ludwigshafen a.Rhein (Ludwigshafen)",
      "registernummer": "HRB 66544",
      "registerart": "HRB",
      "company_name": "MUL Grundstücksholding Sachsen GmbH",
      "company_seat": "Ludwigshafen",
      "details": "30.10.2025 (Bekanntmachungsdatum)\n\nRheinland-Pfalz Amtsgericht Ludwigshafen a.Rhein (Ludwigshafen) HRB 66544\nRegisterbekanntmachung nach dem Umwandlungsgesetz 27.10.2025 (Eintragungsdatum)\n\nMUL Grundstücksholding Sachsen GmbH\nGesellschaft mit beschränkter Haftung\nLudwigshafen\n\nAls nicht eingetragen wird veröffentlicht: Den Gläubigern der an der Verschmelzung beteiligten Rechtsträger ist, wenn sie binnen sechs Monaten nach dem Tag, an dem die Eintragung der Verschmelzung in das Register des Sitzes desjenigen Rechtsträgers,dessen Gläubiger sie sind, nach § 19 Abs. 3 UmwG als bekannt gemacht gilt, ihren Anspruch nach Grund und Höhe schriftlich anmelden, Sicherheit zu leisten, soweit sie nicht Befriedigung verlangen können. Dieses Recht steht den Gläubigern jedoch nur zu, wenn sie glaubhaft machen, dass durch die Verschmelzung die Erfüllungd er Forderung gefährdet wird."
    },
    {
      "date": "2025-10-30",
      "id": "135882",
      "original_text": "Registerbekanntmachung nach dem Umwandlungsgesetz\nRheinland-Pfalz Amtsgericht Ludwigshafen a.Rhein (Ludwigshafen) HRB 66785\nMedien Union Grundbesitz Sachsen Verwaltungs GmbH – Ludwigshafen am Rhein",
      "type": "Registerbekanntmachung nach dem Umwandlungsgesetz",
      "state": "Rheinland-Pfalz",
      "amtsgericht": "Amtsgericht Ludwigshafen a.Rhein (Ludwigshafen)",
      "registernummer": "HRB 66785",
      "registerart": "HRB",
      "company_name": "Medien Union Grundbesitz Sachsen Verwaltungs GmbH",
      "company_seat": "Ludwigshafen am Rhein",
      "details": "30.10.2025 (Bekanntmachungsdatum)\n\nRheinland-Pfalz Amtsgericht Ludwigshafen a.Rhein (Ludwigshafen) HRB 66785\nRegisterbekanntmachung nach dem Umwandlungsgesetz 27.10.2025 (Eintragungsdatum)\n\nMedien Union Grundbesitz Sachsen Verwaltungs GmbH\nGesellschaft mit beschränkter Haftung\nLudwigshafen am Rhein\n\nAls nicht eingetragen wird veröffentlicht: Den Gläubigern der an der Verschmelzung beteiligten Rechtsträger ist, wenn sie binnen sechs Monaten nach dem Tag, an dem die Eintragung der Verschmelzung in das Register des Sitzes desjenigen Rechtsträgers,dessen Gläubiger sie sind, nach § 19 Abs. 3 UmwG als bekannt gemacht gilt, ihren Anspruch nach Grund und Höhe schriftlich anmelden, Sicherheit zu leisten, soweit sie nicht Befriedigung verlangen können. Dieses Recht steht den Gläubigern jedoch nur zu, wenn sie glaubhaft machen, dass durch die Verschmelzung die Erfüllungd er Forderung gefährdet wird."
    },
    {
      "date": "2025-10-30",
      "id": "135883",
      "original_text": "Registerbekanntmachung nach dem Umwandlungsgesetz\nRheinland-Pfalz Amtsgericht Landau HRB 33855\nMafaza UG (haftungsbeschränkt) – Landau in der Pfalz",
      "type": "Registerbekanntmachung nach dem Umwandlungsgesetz",
      "state": "Rheinland-Pfalz",
      "amtsgericht": "Amtsgericht Landau",
      "registernummer": "HRB 33855",
      "registerart": "HRB",
      "company_name": "Mafaza UG (haftungsbeschränkt)",
      "company_seat": "Landau in der Pfalz",
      "details": "30.10.2025 (Bekanntmachungsdatum)\n\nRheinland-Pfalz Amtsgericht Landau HRB 33855\nRegisterbekanntmachung nach dem Umwandlungsgesetz\n\nMafaza UG (haftungsbeschränkt)\nGesellschaft mit beschränkter Haftung\nLandau in der Pfalz\n\nDas Registergericht beabsichtigt die Gesellschaft von Amts wegen nach § 394 FamFG zu löschen. Die Frist zur Erhebung eines Widerspruchs ist auf einen Monat festgesetzt."
    },
    {
      "date": "2025-10-30",
      "id": "135884",
      "original_text": "Registerbekanntmachung nach dem Umwandlungsgesetz\nRheinland-Pfalz Amtsgericht Koblenz HRB 31444\nSchmitz Hifi-Video GmbH – Koblenz",
      "type": "Registerbekanntmachung nach dem Umwandlungsgesetz",
      "state": "Rheinland-Pfalz",
      "amtsgericht": "Amtsgericht Koblenz",
      "registernummer": "HRB 31444",
      "registerart": "HRB",
      "company_name": "Schmitz Hifi-Video GmbH",
      "company_seat": "Koblenz",
      "details": "30.10.2025 (Bekanntmachungsdatum)\n\nRheinland-Pfalz Amtsgericht Koblenz HRB 31444\nRegisterbekanntmachung nach dem Umwandlungsgesetz 30.10.2025 (Eintragungsdatum)\n\nSchmitz Hifi-Video GmbH\nGesellschaft mit beschränkter Haftung\nKoblenz\n\nAls nicht eingetragen wird veröffentlicht: Den Gläubigern der an der Umwandlung beteiligten Rechtsträger ist, wenn sie binnen sechs Monaten nach dem Tag, an dem die Eintragung der Umwandlung in das Register des Sitzes desjenigen Rechtsträgers, dessen Gläubiger sie sind, nach § 19 Abs. 3 UmwG als bekannt gemacht gilt, ihren Anspruch nach Grund und Höhe schriftlich anmelden, Sicherheit zu leisten, soweit sie nicht Befriedigung verlangen können. Dieses Recht steht den Gläubigern jedoch nur zu, wenn sie glaubhaft machen, dass durch die Umwandlung die Erfüllung der Forderung gefährdet wird."
    },
    {
      "date": "2025-10-30",
      "id": "135885",
      "original_text": "Registerbekanntmachung nach dem Umwandlungsgesetz\nRheinland-Pfalz Amtsgericht Koblenz HRA 3915\nSchmitz HiFi-Video GmbH & Co. KG – Koblenz",
      "type": "Registerbekanntmachung nach dem Umwandlungsgesetz",
      "state": "Rheinland-Pfalz",
      "amtsgericht": "Amtsgericht Koblenz",
      "registernummer": "HRA 3915",
      "registerart": "HRA",
      "company_name": "Schmitz HiFi-Video GmbH & Co. KG",
      "company_seat": "Koblenz",
      "details": "30.10.2025 (Bekanntmachungsdatum)\n\nRheinland-Pfalz Amtsgericht Koblenz HRA 3915\nRegisterbekanntmachung nach dem Umwandlungsgesetz 30.10.2025 (Eintragungsdatum)\n\nSchmitz HiFi-Video GmbH & Co. KG\nKommanditgesellschaft\nKoblenz\n\nAls nicht eingetragen wird veröffentlicht: Den Gläubigern der an der Umwandlungbeteiligten Rechtsträger ist, wenn sie binnen sechs Monaten nach dem Tag, an dem die Eintragung der Umwandlung in das Register des Sitzes desjenigen Rechtsträgers, dessen Gläubiger sie sind, nach § 19 Abs. 3 UmwG als bekannt gemacht gilt, ihren Anspruch nach Grund und Höhe schriftlich anmelden, Sicherheit zu leisten, soweit sie nicht Befriedigung verlangen können. Dieses Recht steht den Gläubigern jedoch nur zu, wenn sie glaubhaft machen, dass durch die Umwandlung die Erfüllung der Forderung gefährdet wird."
    },
    {
      "date": "2025-10-30",
      "id": "135886",
      "original_text": "Löschungsankündigung\nNordrhein-Westfalen Amtsgericht Köln HRB 45511\nKRANTZ - TKT GmbH – Bergisch Gladbach",
      "type": "Löschungsankündigung",
      "state": "Nordrhein-Westfalen",
      "amtsgericht": "Amtsgericht Köln",
      "registernummer": "HRB 45511",
      "registerart": "HRB",
      "company_name": "KRANTZ - TKT GmbH",
      "company_seat": "Bergisch Gladbach",
      "details": "30.10.2025 (Bekanntmachungsdatum)\n\nNordrhein-Westfalen Amtsgericht Köln HRB 45511\nLöschungsankündigung\n\nKRANTZ - TKT GmbH\nGesellschaft mit beschränkter Haftung\nBergisch Gladbach\n\nDas Registergericht beabsichtigt die Gesellschaft von Amts wegen nach § 394 FamFG zu löschen. Die Frist zur Erhebung eines Widerspruchs ist auf einen Monat festgesetzt."
    },
    {
      "date": "2025-10-30",
      "id": "135887",
      "original_text": "Löschungsankündigung\nNordrhein-Westfalen Amtsgericht Köln HRB 96873\nE.T. Feinausbau GmbH – Köln",
      "type": "Löschungsankündigung",
      "state": "Nordrhein-Westfalen",
      "amtsgericht": "Amtsgericht Köln",
      "registernummer": "HRB 96873",
      "registerart": "HRB",
      "company_name": "E.T. Feinausbau GmbH",
      "company_seat": "Köln",
      "details": "30.10.2025 (Bekanntmachungsdatum)\n\nNordrhein-Westfalen Amtsgericht Köln HRB 96873\nLöschungsankündigung\n\nE.T. Feinausbau GmbH\nGesellschaft mit beschränkter Haftung\nKöln\n\nDas Registergericht beabsichtigt die Gesellschaft von Amts wegen nach § 394 FamFG zu löschen. Die Frist zur Erhebung eines Widerspruchs ist auf einen Monat festgesetzt."
    },
    {
      "date": "2025-10-30",
      "id": "135888",
      "original_text": "Löschungsankündigung\nNordrhein-Westfalen Amtsgericht Iserlohn HRB 9089\nAcar HandelsGmbH – Werdohl",
      "type": "Löschungsankündigung",
      "state": "Nordrhein-Westfalen",
      "amtsgericht": "Amtsgericht Iserlohn",
      "registernummer": "HRB 9089",
      "registerart": "HRB",
      "company_name": "Acar HandelsGmbH",
      "company_seat": "Werdohl",
      "details": "30.10.2025 (Bekanntmachungsdatum)\n\nNordrhein-Westfalen Amtsgericht Iserlohn HRB 9089\nLöschungsankündigung\n\nAcar HandelsGmbH\nGesellschaft mit beschränkter Haftung\nWerdohl\n\nDas Registergericht beabsichtigt die Gesellschaft von Amts wegen nach § 394 FamFG zu löschen. Die Frist zur Erhebung eines Widerspruchs ist auf zwei Monate festgesetzt."
    },
    {
      "date": "2025-10-30",
      "id": "135889",
      "original_text": "Löschungsankündigung\nNordrhein-Westfalen Amtsgericht Düsseldorf HRB 80697\nSM Electronic GmbH – Düsseldorf",
      "type": "Löschungsankündigung",
      "state": "Nordrhein-Westfalen",
      "amtsgericht": "Amtsgericht Düsseldorf",
      "registernummer": "HRB 80697",
      "registerart": "HRB",
      "company_name": "SM Electronic GmbH",
      "company_seat": "Düsseldorf",
      "details": "30.10.2025 (Bekanntmachungsdatum)\n\nNordrhein-Westfalen Amtsgericht Düsseldorf HRB 80697\nLöschungsankündigung\n\nSM Electronic GmbH\nGesellschaft mit beschränkter Haftung\nDüsseldorf\n\nDas Registergericht beabsichtigt die Gesellschaft von Amts wegen nach § 394 FamFG zu löschen. Die Frist zur Erhebung eines Widerspruchs ist auf 3 Wochen festgesetzt.\n\nRechtsbehelfsbelehrung:\nDas Widerspruchsrecht steht jedem zu, der an der Unterlassung der Löschung ein berechtigtes Interesse hat. Der Widerspruch ist bei dem Amtsgericht Düsseldorf -Registergericht-, Werdener Straße 1, 40227 Düsseldorf schriftlich in deutscher Sprache oder zur Niederschrift der Geschäftsstelle einzulegen. Der Widerspruch kann auch zur Niederschrift der Geschäftsstelle eines jeden Amtsgerichtes abgegeben werden. Die Einlegung ist auch durch Übertragung eines elektronischen Dokuments an die elektronische Poststelle des Gerichts möglich. Das elektronische Dokument muss für die Bearbeitung durch das Gericht geeignet und mit einer qualifizierten elektronischen Signatur der verantwortenden Person versehen sein oder von der verantwortenden Person signiert und auf einem sicheren Übermittlungsweg gemäß § 130a ZPO nach näherer Maßgabe der Verordnung über die technischen Rahmenbedingungen des elektronischen Rechtsverkehrs und über das besondere elektronische Behördenpostfach (BGBl. I, S.3803) eingereicht werden. Weitere Informationen erhalten Sie auf der Internetseite www.justiz.de.\nDer Widerspruch muss spätestens innerhalb der gesetzten Frist nach dem Datum der Bekanntmachung der Löschungsankündigung bei dem Amtsgericht - Registergericht - Düsseldorf eingegangen sein.  Dies gilt auch dann, wenn der Widerspruch zur Niederschrift der Geschäftsstelle eines anderen Amtsgerichtes abgegeben wurde. Die Frist beginnt mit dem Tage der Bekanntmachung der Löschungsankündigung in dem für die Bekanntmachung der Eintragungen in das Handelsregister bestimmten elektronischen Informations- und Kommunikationssystem nach § 10 des Handelsgesetzbuches. Fällt das Ende der Frist auf einen Sonntag, einen allgemeinen Feiertag oder Sonnabend, so endet die Frist mit Ablauf des nächsten Werktages.\nDer Widerspruch muss die Bezeichnung der angefochtenen Löschungsankündigung sowie die Erklärung enthalten, dass Widerspruch gegen diese Löschungsankündigung eingelegt wird. Er ist zu unterzeichnen und soll begründet werden."
    },
    {
      "date": "2025-10-30",
      "id": "135890",
      "original_text": "Registerbekanntmachung nach dem Umwandlungsgesetz\nNordrhein-Westfalen Amtsgericht Duisburg HRA 13021\nFranz & Dr. Stefan Rhiem GmbH & Co. KG – Voerde",
      "type": "Registerbekanntmachung nach dem Umwandlungsgesetz",
      "state": "Nordrhein-Westfalen",
      "amtsgericht": "Amtsgericht Duisburg",
      "registernummer": "HRA 13021",
      "registerart": "HRA",
      "company_name": "Franz & Dr. Stefan Rhiem GmbH & Co. KG",
      "company_seat": "Voerde",
      "details": "30.10.2025 (Bekanntmachungsdatum)\n\nNordrhein-Westfalen Amtsgericht Duisburg HRA 13021\nRegisterbekanntmachung nach dem Umwandlungsgesetz 30.10.2025 (Eintragungsdatum)\n\nFranz & Dr. Stefan Rhiem GmbH & Co. KG\nKommanditgesellschaft\nVoerde\n\nDie Gesellschaft hat Gläubigern, deren Forderungen vor dieser Bekanntmachung begründet worden sind, Sicherheit zu leisten, soweit sie nicht Befriedigung verlangen können, wenn sie sich binnen sechs Monaten zu diesem Zweck melden."
    },
    {
      "date": "2025-10-30",
      "id": "135891",
      "original_text": "Registerbekanntmachung nach dem Umwandlungsgesetz\nNordrhein-Westfalen Amtsgericht Köln HRB 104497\nWinkel Capital GmbH – Köln",
      "type": "Registerbekanntmachung nach dem Umwandlungsgesetz",
      "state": "Nordrhein-Westfalen",
      "amtsgericht": "Amtsgericht Köln",
      "registernummer": "HRB 104497",
      "registerart": "HRB",
      "company_name": "Winkel Capital GmbH",
      "company_seat": "Köln",
      "details": "30.10.2025 (Bekanntmachungsdatum)\n\nNordrhein-Westfalen Amtsgericht Köln HRB 104497\nRegisterbekanntmachung nach dem Umwandlungsgesetz\n\nWinkel Capital GmbH\nGesellschaft mit beschränkter Haftung\nKöln\n\nDen Gläubigern der an der formwechselnden Umwandlung beteiligten Rechtsträger ist, wenn sie binnen sechs Monaten nach dem Tag, an dem die Eintragung der formwechselnden Umwandlung in das Register des Sitzes desjenigen Rechtsträgers, dessen Gläubiger sie sind, nach § 19 Absatz 3 UmwG als bekanntgemacht gilt, ihren Anspruch nach Grund und Höhe schriftlich anmelden, Sicherheit zu leisten, soweit sie nicht Befriedigung verlangen können. Dieses Recht steht den Gläubigern jedoch nur zu, wenn sie glaubhaft machen, dass durch die formwechselnden Umwandlung die Erfüllung ihrer Forderung gefährdet wird."
    },
    {
      "date": "2025-10-30",
      "id": "135892",
      "original_text": "Einreichung neuer Dokumente\nNordrhein-Westfalen Amtsgericht Dortmund HRB 28699\nAmazon Logistik Dortmund GmbH – Dortmund",
      "type": "Einreichung neuer Dokumente",
      "state": "Nordrhein-Westfalen",
      "amtsgericht": "Amtsgericht Dortmund",
      "registernummer": "HRB 28699",
      "registerart": "HRB",
      "company_name": "Amazon Logistik Dortmund GmbH",
      "company_seat": "Dortmund",
      "details": "30.10.2025 (Bekanntmachungsdatum)\n\nNordrhein-Westfalen Amtsgericht Dortmund HRB 28699\nEinreichung neuer Dokumente\n\nAmazon Logistik Dortmund GmbH\nGesellschaft mit beschränkter Haftung\nDortmund\n\nDem Registergericht ist eine neue Liste der Mitglieder des Aufsichtsrates eingereicht worden."
    },
    {
      "date": "2025-10-30",
      "id": "135893",
      "original_text": "Registerbekanntmachung nach dem Umwandlungsgesetz\nNordrhein-Westfalen Amtsgericht Essen HRB 30999\nE.ON Drive Germany GmbH – Essen",
      "type": "Registerbekanntmachung nach dem Umwandlungsgesetz",
      "state": "Nordrhein-Westfalen",
      "amtsgericht": "Amtsgericht Essen",
      "registernummer": "HRB 30999",
      "registerart": "HRB",
      "company_name": "E.ON Drive Germany GmbH",
      "company_seat": "Essen",
      "details": "30.10.2025 (Bekanntmachungsdatum)\n\nNordrhein-Westfalen Amtsgericht Essen HRB 30999\nRegisterbekanntmachung nach dem Umwandlungsgesetz 30.10.2025 (Eintragungsdatum)\n\nE.ON Drive Germany GmbH\nGesellschaft mit beschränkter Haftung\nEssen\n\nDen Gläubigern der an der Verschmelzung beteiligten Rechtsträger ist, wenn sie binnen sechs Monaten nach dem Tag, an dem die Eintragung der Verschmelzung in das Register des Sitzes desjenigen Rechtsträgers, dessen Gläubiger sie sind, nach § 19 Absatz 3 UmwG als bekanntgemacht gilt, ihren Anspruch nach Grund und Höhe schriftlich anmelden, Sicherheit zu leisten, soweit sie nicht Befriedigung verlangen können. Dieses Recht steht den Gläubigern jedoch nur zu, wenn sie glaubhaft machen, dass durch die Verschmelzung die Erfüllung ihrer Forderung gefährdet wird."
    },
    {
      "date": "2025-10-30",
      "id": "135894",
      "original_text": "Registerbekanntmachung nach dem Umwandlungsgesetz\nNordrhein-Westfalen Amtsgericht Düsseldorf HRB 100356\nCast-Property Servicer GmbH – Düsseldorf",
      "type": "Registerbekanntmachung nach dem Umwandlungsgesetz",
      "state": "Nordrhein-Westfalen",
      "amtsgericht": "Amtsgericht Düsseldorf",
      "registernummer": "HRB 100356",
      "registerart": "HRB",
      "company_name": "Cast-Property Servicer GmbH",
      "company_seat": "Düsseldorf",
      "details": "30.10.2025 (Bekanntmachungsdatum)\n\nNordrhein-Westfalen Amtsgericht Düsseldorf HRB 100356\nRegisterbekanntmachung nach dem Umwandlungsgesetz 30.10.2025 (Eintragungsdatum)\n\nCast-Property Servicer GmbH\nGesellschaft mit beschränkter Haftung\nDüsseldorf\n\nDen Gläubigern der an der Verschmelzung beteiligten Rechtsträger ist, wenn sie binnen sechs Monaten nach dem Tag, an dem die Eintragung der Verschmelzung in das Register des Sitzes desjenigen Rechtsträgers, dessen Gläubiger sie sind, nach § 19 Absatz 3 UmwG als bekanntgemacht gilt, ihren Anspruch nach Grund und Höhe schriftlich anmelden, Sicherheit zu leisten, soweit sie nicht Befriedigung verlangen können. Dieses Recht steht den Gläubigern jedoch nur zu, wenn sie glaubhaft machen, dass durch die Verschmelzung die Erfüllung ihrer Forderung gefährdet wird."
    },
    {
      "date": "2025-10-30",
      "id": "135895",
      "original_text": "Registerbekanntmachung nach dem Umwandlungsgesetz\nNordrhein-Westfalen Amtsgericht Siegburg GsR 509\nLeier & Martens eGbR – Hennef",
      "type": "Registerbekanntmachung nach dem Umwandlungsgesetz",
      "state": "Nordrhein-Westfalen",
      "amtsgericht": "Amtsgericht Siegburg",
      "registernummer": "GsR 509",
      "registerart": "GsR",
      "company_name": "Leier & Martens eGbR",
      "company_seat": "Hennef",
      "details": "30.10.2025 (Bekanntmachungsdatum)\n\nNordrhein-Westfalen Amtsgericht Siegburg GsR 509\nRegisterbekanntmachung nach dem Umwandlungsgesetz 30.10.2025 (Eintragungsdatum)\n\nLeier & Martens eGbR\nGesellschaft bürgerlichen Rechts\nHennef\n\nDen Gläubigern der an der formwechselnden Umwandlung beteiligten Rechtsträger ist, wenn sie binnen sechs Monaten nach dem Tag, an dem die Eintragung der formwechselnden Umwandlung in das Register des Sitzes desjenigen Rechtsträgers, dessen Gläubiger sie sind, nach § 19 Absatz 3 UmwG als bekanntgemacht gilt, ihren Anspruch nach Grund und Höhe schriftlich anmelden, Sicherheit zu leisten, soweit sie nicht Befriedigung verlangen können. Dieses Recht steht den Gläubigern jedoch nur zu, wenn sie glaubhaft machen, dass durch die formwechselnden Umwandlung die Erfüllung ihrer Forderung gefährdet wird."
    },
    {
      "date": "2025-10-30",
      "id": "135896",
      "original_text": "Löschungsankündigung\nNordrhein-Westfalen Amtsgericht Köln HRB 106740\nMut fruits GmbH – Köln",
      "type": "Löschungsankündigung",
      "state": "Nordrhein-Westfalen",
      "amtsgericht": "Amtsgericht Köln",
      "registernummer": "HRB 106740",
      "registerart": "HRB",
      "company_name": "Mut fruits GmbH",
      "company_seat": "Köln",
      "details": "30.10.2025 (Bekanntmachungsdatum)\n\nNordrhein-Westfalen Amtsgericht Köln HRB 106740\nLöschungsankündigung\n\nMut fruits GmbH\nGesellschaft mit beschränkter Haftung\nKöln\n\nDas Registergericht beabsichtigt die Gesellschaft von Amts wegen nach § 394 FamFG zu löschen. Die Frist zur Erhebung eines Widerspruchs ist auf einen Monat festgesetzt."
    },
    {
      "date": "2025-10-30",
      "id": "135897",
      "original_text": "Registerbekanntmachung nach dem Umwandlungsgesetz\nNordrhein-Westfalen Amtsgericht Dortmund HRA 17941\nMotido GmbH & Co. KG – Dortmund",
      "type": "Registerbekanntmachung nach dem Umwandlungsgesetz",
      "state": "Nordrhein-Westfalen",
      "amtsgericht": "Amtsgericht Dortmund",
      "registernummer": "HRA 17941",
      "registerart": "HRA",
      "company_name": "Motido GmbH & Co. KG",
      "company_seat": "Dortmund",
      "details": "30.10.2025 (Bekanntmachungsdatum)\n\nNordrhein-Westfalen Amtsgericht Dortmund HRA 17941\nRegisterbekanntmachung nach dem Umwandlungsgesetz 30.10.2025 (Eintragungsdatum)\n\nMotido GmbH & Co. KG\nKommanditgesellschaft\nDortmund\n\nDen Gläubigern der an der formwechselnden Umwandlung beteiligten Rechtsträger ist, wenn sie binnen sechs Monaten nach dem Tag, an dem die Eintragung der formwechselnden Umwandlung in das Register des Sitzes desjenigen Rechtsträgers, dessen Gläubiger sie sind, nach § 19 Absatz 3 UmwG als bekanntgemacht gilt, ihren Anspruch nach Grund und Höhe schriftlich anmelden, Sicherheit zu leisten, soweit sie nicht Befriedigung verlangen können. Dieses Recht steht den Gläubigern jedoch nur zu, wenn sie glaubhaft machen, dass durch die formwechselnden Umwandlung die Erfüllung ihrer Forderung gefährdet wird."
    },
    {
      "date": "2025-10-30",
      "id": "135898",
      "original_text": "Registerbekanntmachung nach dem Umwandlungsgesetz\nNordrhein-Westfalen Amtsgericht Hagen HRB 13581\nKathi's Pflege GmbH – Schwelm",
      "type": "Registerbekanntmachung nach dem Umwandlungsgesetz",
      "state": "Nordrhein-Westfalen",
      "amtsgericht": "Amtsgericht Hagen",
      "registernummer": "HRB 13581",
      "registerart": "HRB",
      "company_name": "Kathi's Pflege GmbH",
      "company_seat": "Schwelm",
      "details": "30.10.2025 (Bekanntmachungsdatum)\n\nNordrhein-Westfalen Amtsgericht Hagen HRB 13581\nRegisterbekanntmachung nach dem Umwandlungsgesetz 30.10.2025 (Eintragungsdatum)\n\nKathi's Pflege GmbH\nGesellschaft mit beschränkter Haftung\nSchwelm\n\nDen Gläubigern der an der Ausgliederung beteiligten Rechtsträger ist, wenn sie binnen sechs Monaten nach dem Tag, an dem die Eintragung der Ausgliederung in das Register des Sitzes derjenigen Rechtsträger deren Gläubiger sie sind, nach § 19 Absatz 3 UmwG als bekanntgemacht gilt, ihren Anspruch nach Grund und Höhe schriftlich anmelden, Sicherheit zu leisten, soweit sie nicht Befriedigung verlangen können. Dieses Recht steht den Gläubigern jedoch nur zu, wenn sie glaubhaft machen, dass durch die Ausgliederung die Erfüllung ihrer Forderung gefährdet wird."
    },
    {
      "date": "2025-10-30",
      "id": "135899",
      "original_text": "Registerbekanntmachung nach dem Umwandlungsgesetz\nNordrhein-Westfalen Amtsgericht Paderborn HRB 8516\nsewikom GmbH – Beverungen",
      "type": "Registerbekanntmachung nach dem Umwandlungsgesetz",
      "state": "Nordrhein-Westfalen",
      "amtsgericht": "Amtsgericht Paderborn",
      "registernummer": "HRB 8516",
      "registerart": "HRB",
      "company_name": "sewikom GmbH",
      "company_seat": "Beverungen",
      "details": "30.10.2025 (Bekanntmachungsdatum)\n\nNordrhein-Westfalen Amtsgericht Paderborn HRB 8516\nRegisterbekanntmachung nach dem Umwandlungsgesetz 30.10.2025 (Eintragungsdatum)\n\nsewikom GmbH\nGesellschaft mit beschränkter Haftung\nBeverungen\n\nDen Gläubigern der an der Verschmelzung beteiligten Rechtsträger ist, wenn sie binnen sechs Monaten nach dem Tag, an dem die Eintragung der Verschmelzung in das Register des Sitzes desjenigen Rechtsträgers, dessen Gläubiger sie sind, nach § 19 Absatz 3 UmwG als bekanntgemacht gilt, ihren Anspruch nach Grund und Höhe schriftlich anmelden, Sicherheit zu leisten, soweit sie nicht Befriedigung verlangen können. Dieses Recht steht den Gläubigern jedoch nur zu, wenn sie glaubhaft machen, dass durch die Verschmelzung die Erfüllung ihrer Forderung gefährdet wird."
    },
    {
      "date": "2025-10-30",
      "id": "135900",
      "original_text": "Löschungsankündigung\nNordrhein-Westfalen Amtsgericht Dortmund HRB 29290\nHAPA pharm GmbH – Dortmund",
      "type": "Löschungsankündigung",
      "state": "Nordrhein-Westfalen",
      "amtsgericht": "Amtsgericht Dortmund",
      "registernummer": "HRB 29290",
      "registerart": "HRB",
      "company_name": "HAPA pharm GmbH",
      "company_seat": "Dortmund",
      "details": "30.10.2025 (Bekanntmachungsdatum)\n\nNordrhein-Westfalen Amtsgericht Dortmund HRB 29290\nLöschungsankündigung\n\nHAPA pharm GmbH\nGesellschaft mit beschränkter Haftung\nDortmund\n\nDas Registergericht beabsichtigt die Gesellschaft von Amts wegen nach § 394 FamFG zu löschen. Die Frist zur Erhebung eines Widerspruchs ist auf einen Monat festgesetzt."
    },
    {
      "date": "2025-10-30",
      "id": "135901",
      "original_text": "Registerbekanntmachung nach dem Umwandlungsgesetz\nNordrhein-Westfalen Amtsgericht Hamm HRB 10010\nTranslog Internationale Spedition GmbH – Hamm",
      "type": "Registerbekanntmachung nach dem Umwandlungsgesetz",
      "state": "Nordrhein-Westfalen",
      "amtsgericht": "Amtsgericht Hamm",
      "registernummer": "HRB 10010",
      "registerart": "HRB",
      "company_name": "Translog Internationale Spedition GmbH",
      "company_seat": "Hamm",
      "details": "30.10.2025 (Bekanntmachungsdatum)\n\nNordrhein-Westfalen Amtsgericht Hamm HRB 10010\nRegisterbekanntmachung nach dem Umwandlungsgesetz 30.10.2025 (Eintragungsdatum)\n\nTranslog Internationale Spedition GmbH\nGesellschaft mit beschränkter Haftung\nHamm\n\nDen Gläubigern der an der Verschmelzung beteiligten Rechtsträger ist, wenn sie binnen sechs Monaten nach dem Tag, an dem die Eintragung der Verschmelzung in das Register des Sitzes desjenigen Rechtsträgers, dessen Gläubiger sie sind, nach § 19 Absatz 3 UmwG als bekanntgemacht gilt, ihren Anspruch nach Grund und Höhe schriftlich anmelden, Sicherheit zu leisten, soweit sie nicht Befriedigung verlangen können. Dieses Recht steht den Gläubigern jedoch nur zu, wenn sie glaubhaft machen, dass durch die Verschmelzung die Erfüllung ihrer Forderung gefährdet wird."
    },
    {
      "date": "2025-10-30",
      "id": "135902",
      "original_text": "Löschungsankündigung\nNordrhein-Westfalen Amtsgericht Düsseldorf HRB 101291\nD+D Logistik GmbH – Düsseldorf",
      "type": "Löschungsankündigung",
      "state": "Nordrhein-Westfalen",
      "amtsgericht": "Amtsgericht Düsseldorf",
      "registernummer": "HRB 101291",
      "registerart": "HRB",
      "company_name": "D+D Logistik GmbH",
      "company_seat": "Düsseldorf",
      "details": "30.10.2025 (Bekanntmachungsdatum)\n\nNordrhein-Westfalen Amtsgericht Düsseldorf HRB 101291\nLöschungsankündigung\n\nD+D Logistik GmbH\nGesellschaft mit beschränkter Haftung\nDüsseldorf\n\nDas Registergericht beabsichtigt die Gesellschaft von Amts wegen nach § 394 FamFG zu löschen. Die Frist zur Erhebung eines Widerspruchs ist auf 3 Wochen festgesetzt.\n\nRechtsbehelfsbelehrung:\nDas Widerspruchsrecht steht jedem zu, der an der Unterlassung der Löschung ein berechtigtes Interesse hat. Der Widerspruch ist bei dem Amtsgericht Düsseldorf -Registergericht-, Werdener Straße 1, 40227 Düsseldorf schriftlich in deutscher Sprache oder zur Niederschrift der Geschäftsstelle einzulegen. Der Widerspruch kann auch zur Niederschrift der Geschäftsstelle eines jeden Amtsgerichtes abgegeben werden. Die Einlegung ist auch durch Übertragung eines elektronischen Dokuments an die elektronische Poststelle des Gerichts möglich. Das elektronische Dokument muss für die Bearbeitung durch das Gericht geeignet und mit einer qualifizierten elektronischen Signatur der verantwortenden Person versehen sein oder von der verantwortenden Person signiert und auf einem sicheren Übermittlungsweg gemäß § 130a ZPO nach näherer Maßgabe der Verordnung über die technischen Rahmenbedingungen des elektronischen Rechtsverkehrs und über das besondere elektronische Behördenpostfach (BGBl. I, S.3803) eingereicht werden. Weitere Informationen erhalten Sie auf der Internetseite www.justiz.de.\nDer Widerspruch muss spätestens innerhalb der gesetzten Frist nach dem Datum der Bekanntmachung der Löschungsankündigung bei dem Amtsgericht - Registergericht - Düsseldorf eingegangen sein.  Dies gilt auch dann, wenn der Widerspruch zur Niederschrift der Geschäftsstelle eines anderen Amtsgerichtes abgegeben wurde. Die Frist beginnt mit dem Tage der Bekanntmachung der Löschungsankündigung in dem für die Bekanntmachung der Eintragungen in das Handelsregister bestimmten elektronischen Informations- und Kommunikationssystem nach § 10 des Handelsgesetzbuches. Fällt das Ende der Frist auf einen Sonntag, einen allgemeinen Feiertag oder Sonnabend, so endet die Frist mit Ablauf des nächsten Werktages.\nDer Widerspruch muss die Bezeichnung der angefochtenen Löschungsankündigung sowie die Erklärung enthalten, dass Widerspruch gegen diese Löschungsankündigung eingelegt wird. Er ist zu unterzeichnen und soll begründet werden."
    },
    {
      "date": "2025-10-30",
      "id": "135903",
      "original_text": "Registerbekanntmachung nach dem Umwandlungsgesetz\nNordrhein-Westfalen Amtsgericht Düsseldorf HRA 10102\nA. Gebhard GmbH & Co. – Düsseldorf",
      "type": "Registerbekanntmachung nach dem Umwandlungsgesetz",
      "state": "Nordrhein-Westfalen",
      "amtsgericht": "Amtsgericht Düsseldorf",
      "registernummer": "HRA 10102",
      "registerart": "HRA",
      "company_name": "A. Gebhard GmbH & Co.",
      "company_seat": "Düsseldorf",
      "details": "30.10.2025 (Bekanntmachungsdatum)\n\nNordrhein-Westfalen Amtsgericht Düsseldorf HRA 10102\nRegisterbekanntmachung nach dem Umwandlungsgesetz 30.10.2025 (Eintragungsdatum)\n\nA. Gebhard GmbH & Co.\nKommanditgesellschaft\nDüsseldorf\n\nDen Gläubigern der an der formwechselnden Umwandlung beteiligten Rechtsträger ist, wenn sie binnen sechs Monaten nach dem Tag, an dem die Eintragung der formwechselnden Umwandlung in das Register des Sitzes desjenigen Rechtsträgers, dessen Gläubiger sie sind, nach § 19 Absatz 3 UmwG als bekanntgemacht gilt, ihren Anspruch nach Grund und Höhe schriftlich anmelden, Sicherheit zu leisten, soweit sie nicht Befriedigung verlangen können. Dieses Recht steht den Gläubigern jedoch nur zu, wenn sie glaubhaft machen, dass durch die formwechselnden Umwandlung die Erfüllung ihrer Forderung gefährdet wird."
    },
    {
      "date": "2025-10-30",
      "id": "135904",
      "original_text": "Registerbekanntmachung nach dem Umwandlungsgesetz\nNordrhein-Westfalen Amtsgericht Bochum HRB 16322\nBrauco Rohr- und Umweltservice Ruhr GmbH – Bochum",
      "type": "Registerbekanntmachung nach dem Umwandlungsgesetz",
      "state": "Nordrhein-Westfalen",
      "amtsgericht": "Amtsgericht Bochum",
      "registernummer": "HRB 16322",
      "registerart": "HRB",
      "company_name": "Brauco Rohr- und Umweltservice Ruhr GmbH",
      "company_seat": "Bochum",
      "details": "30.10.2025 (Bekanntmachungsdatum)\n\nNordrhein-Westfalen Amtsgericht Bochum HRB 16322\nRegisterbekanntmachung nach dem Umwandlungsgesetz 28.10.2025 (Eintragungsdatum)\n\nBrauco Rohr- und Umweltservice Ruhr GmbH\nGesellschaft mit beschränkter Haftung\nBochum\n\nDen Gläubigern der an der Verschmelzung beteiligten Rechtsträger ist, wenn sie binnen sechs Monaten nach dem Tag, an dem die Eintragung der Verschmelzung in das Register des Sitzes desjenigen Rechtsträgers, dessen Gläubiger sie sind, nach § 19 Absatz 3 UmwG als bekanntgemacht gilt, ihren Anspruch nach Grund und Höhe schriftlich anmelden, Sicherheit zu leisten, soweit sie nicht Befriedigung verlangen können. Dieses Recht steht den Gläubigern jedoch nur zu, wenn sie glaubhaft machen, dass durch die Verschmelzung die Erfüllung ihrer Forderung gefährdet wird."
    },
    {
      "date": "2025-10-30",
      "id": "135905",
      "original_text": "Registerbekanntmachung nach dem Umwandlungsgesetz\nNordrhein-Westfalen Amtsgericht Duisburg HRB 39695\nF&S Immobilien GmbH – Voerde",
      "type": "Registerbekanntmachung nach dem Umwandlungsgesetz",
      "state": "Nordrhein-Westfalen",
      "amtsgericht": "Amtsgericht Duisburg",
      "registernummer": "HRB 39695",
      "registerart": "HRB",
      "company_name": "F&S Immobilien GmbH",
      "company_seat": "Voerde",
      "details": "30.10.2025 (Bekanntmachungsdatum)\n\nNordrhein-Westfalen Amtsgericht Duisburg HRB 39695\nRegisterbekanntmachung nach dem Umwandlungsgesetz 30.10.2025 (Eintragungsdatum)\n\nF&S Immobilien GmbH\nGesellschaft mit beschränkter Haftung\nVoerde\n\nDie Gesellschaft hat Gläubigern, deren Forderungen vor dieser Bekanntmachung begründet worden sind, Sicherheit zu leisten, soweit sie nicht Befriedigung verlangen können, wenn sie sich binnen sechs Monaten zu diesem Zweck melden."
    },
    {
      "date": "2025-10-30",
      "id": "135906",
      "original_text": "Registerbekanntmachung nach dem Umwandlungsgesetz\nNordrhein-Westfalen Amtsgericht Köln HRA 38411\nWinkel Capital KG – Köln",
      "type": "Registerbekanntmachung nach dem Umwandlungsgesetz",
      "state": "Nordrhein-Westfalen",
      "amtsgericht": "Amtsgericht Köln",
      "registernummer": "HRA 38411",
      "registerart": "HRA",
      "company_name": "Winkel Capital KG",
      "company_seat": "Köln",
      "details": "30.10.2025 (Bekanntmachungsdatum)\n\nNordrhein-Westfalen Amtsgericht Köln HRA 38411\nRegisterbekanntmachung nach dem Umwandlungsgesetz 30.10.2025 (Eintragungsdatum)\n\nWinkel Capital KG\nKommanditgesellschaft\nKöln\n\nDen Gläubigern der an der formwechselnden Umwandlung beteiligten Rechtsträger ist, wenn sie binnen sechs Monaten nach dem Tag, an dem die Eintragung der formwechselnden Umwandlung in das Register des Sitzes desjenigen Rechtsträgers, dessen Gläubiger sie sind, nach § 19 Absatz 3 UmwG als bekanntgemacht gilt, ihren Anspruch nach Grund und Höhe schriftlich anmelden, Sicherheit zu leisten, soweit sie nicht Befriedigung verlangen können. Dieses Recht steht den Gläubigern jedoch nur zu, wenn sie glaubhaft machen, dass durch die formwechselnden Umwandlung die Erfüllung ihrer Forderung gefährdet wird."
    },
    {
      "date": "2025-10-30",
      "id": "135907",
      "original_text": "Registerbekanntmachung nach dem Umwandlungsgesetz\nNordrhein-Westfalen Amtsgericht Düsseldorf HRB 65211\nAzerion AG – Düsseldorf",
      "type": "Registerbekanntmachung nach dem Umwandlungsgesetz",
      "state": "Nordrhein-Westfalen",
      "amtsgericht": "Amtsgericht Düsseldorf",
      "registernummer": "HRB 65211",
      "registerart": "HRB",
      "company_name": "Azerion AG",
      "company_seat": "Düsseldorf",
      "details": "30.10.2025 (Bekanntmachungsdatum)\n\nNordrhein-Westfalen Amtsgericht Düsseldorf HRB 65211\nRegisterbekanntmachung nach dem Umwandlungsgesetz 30.10.2025 (Eintragungsdatum)\n\nAzerion AG\nAktiengesellschaft\nDüsseldorf\n\nDen Gläubigern der an der Verschmelzung beteiligten Rechtsträger ist, wenn sie binnen sechs Monaten nach dem Tag, an dem die Eintragung der Verschmelzung in das Register des Sitzes desjenigen Rechtsträgers, dessen Gläubiger sie sind, nach § 19 Absatz 3 UmwG als bekanntgemacht gilt, ihren Anspruch nach Grund und Höhe schriftlich anmelden, Sicherheit zu leisten, soweit sie nicht Befriedigung verlangen können. Dieses Recht steht den Gläubigern jedoch nur zu, wenn sie glaubhaft machen, dass durch die Verschmelzung die Erfüllung ihrer Forderung gefährdet wird."
    },
    {
      "date": "2025-10-30",
      "id": "135908",
      "original_text": "Löschungsankündigung\nNordrhein-Westfalen Amtsgericht Mönchengladbach HRB 19025\nNtk GmbH – Viersen",
      "type": "Löschungsankündigung",
      "state": "Nordrhein-Westfalen",
      "amtsgericht": "Amtsgericht Mönchengladbach",
      "registernummer": "HRB 19025",
      "registerart": "HRB",
      "company_name": "Ntk GmbH",
      "company_seat": "Viersen",
      "details": "30.10.2025 (Bekanntmachungsdatum)\n\nNordrhein-Westfalen Amtsgericht Mönchengladbach HRB 19025\nLöschungsankündigung\n\nNtk GmbH\nGesellschaft mit beschränkter Haftung\nViersen\n\nDas Registergericht beabsichtigt die Gesellschaft von Amts wegen nach § 394 FamFG zu löschen. Die Frist zur Erhebung eines Widerspruchs ist auf drei Monate festgesetzt."
    },
    {
      "date": "2025-10-30",
      "id": "135909",
      "original_text": "Löschungsankündigung\nHessen Amtsgericht Wiesbaden HRB 30174\nDemonrec GmbH – Wiesbaden",
      "type": "Löschungsankündigung",
      "state": "Hessen",
      "amtsgericht": "Amtsgericht Wiesbaden",
      "registernummer": "HRB 30174",
      "registerart": "HRB",
      "company_name": "Demonrec GmbH",
      "company_seat": "Wiesbaden",
      "details": "30.10.2025 (Bekanntmachungsdatum)\n\nHessen Amtsgericht Wiesbaden HRB 30174\nLöschungsankündigung\n\nDemonrec GmbH\nGesellschaft mit beschränkter Haftung\nWiesbaden\n\nDas Registergericht beabsichtigt die im Handelsregister eingetragene Gesellschaft von Amts wegen nach § 394 FamFG zu löschen. Die Frist zur Erhebung eines Widerspruchs gegen die beabsichtigte Löschung wird auf 3 Monate festgesetzt."
    },
    {
      "date": "2025-10-30",
      "id": "135910",
      "original_text": "Sonstige Registerbekanntmachung\nHessen Amtsgericht Bad Homburg v.d.H. VR 1732\nArthouse Künstlergemeinschaft Hochtaunus – Neu-Anspach",
      "type": "Sonstige Registerbekanntmachung",
      "state": "Hessen",
      "amtsgericht": "Amtsgericht Bad Homburg v.d.H.",
      "registernummer": "VR 1732",
      "registerart": "VR",
      "company_name": "Arthouse Künstlergemeinschaft Hochtaunus",
      "company_seat": "Neu-Anspach",
      "details": "30.10.2025 (Bekanntmachungsdatum)\n\nHessen Amtsgericht Bad Homburg v.d.H. VR 1732\nSonstige Registerbekanntmachung 30.10.2025 (Eintragungsdatum)\n\nArthouse Künstlergemeinschaft Hochtaunus\neingetragener Verein\nNeu-Anspach\n\nDer Verein ist aufgelöst."
    },
    {
      "date": "2025-10-30",
      "id": "135911",
      "original_text": "Löschungsankündigung\nHessen Amtsgericht Offenbach am Main HRB 47200\nA-Z Trockenbau GmbH – Offenbach am Main",
      "type": "Löschungsankündigung",
      "state": "Hessen",
      "amtsgericht": "Amtsgericht Offenbach am Main",
      "registernummer": "HRB 47200",
      "registerart": "HRB",
      "company_name": "A-Z Trockenbau GmbH",
      "company_seat": "Offenbach am Main",
      "details": "30.10.2025 (Bekanntmachungsdatum)\n\nHessen Amtsgericht Offenbach am Main HRB 47200\nLöschungsankündigung\n\nA-Z Trockenbau GmbH\nGesellschaft mit beschränkter Haftung\nOffenbach am Main\n\nDas Registergericht beabsichtigt die im Handelsregister eingetragene Gesellschaft von Amts wegen nach § 394 FamFG zu löschen. Die Frist zur Erhebung eines Widerspruchs gegen die beabsichtigte Löschung wird auf 3 Monate festgesetzt."
    },
    {
      "date": "2025-10-30",
      "id": "135912",
      "original_text": "Sonstige Registerbekanntmachung\nHessen Amtsgericht Eschwege VR 266\nSchützenverein Abterode – Meißner-Abterode",
      "type": "Sonstige Registerbekanntmachung",
      "state": "Hessen",
      "amtsgericht": "Amtsgericht Eschwege",
      "registernummer": "VR 266",
      "registerart": "VR",
      "company_name": "Schützenverein Abterode",
      "company_seat": "Meißner-Abterode",
      "details": "30.10.2025 (Bekanntmachungsdatum)\n\nHessen Amtsgericht Eschwege VR 266\nSonstige Registerbekanntmachung 30.10.2025 (Eintragungsdatum)\n\nSchützenverein Abterode\neingetragener Verein\nMeißner-Abterode\n\nDer Verein ist aufgelöst."
    },
    {
      "date": "2025-10-30",
      "id": "135913",
      "original_text": "Sonstige Registerbekanntmachung\nHessen Amtsgericht Bad Homburg v.d.H. VR 2283\nSino-German International Education e.V. – Bad Homburg v. d. Höhe",
      "type": "Sonstige Registerbekanntmachung",
      "state": "Hessen",
      "amtsgericht": "Amtsgericht Bad Homburg v.d.H.",
      "registernummer": "VR 2283",
      "registerart": "VR",
      "company_name": "Sino-German International Education e.V.",
      "company_seat": "Bad Homburg v. d. Höhe",
      "details": "30.10.2025 (Bekanntmachungsdatum)\n\nHessen Amtsgericht Bad Homburg v.d.H. VR 2283\nSonstige Registerbekanntmachung 30.10.2025 (Eintragungsdatum)\n\nSino-German International Education e.V.\neingetragener Verein\nBad Homburg v. d. Höhe\n\nDer Verein ist aufgelöst."
    },
    {
      "date": "2025-10-30",
      "id": "135914",
      "original_text": "Löschungsankündigung\nHessen Amtsgericht Wiesbaden HRB 28419\nAABB-GASTRO GmbH – Wiesbaden",
      "type": "Löschungsankündigung",
      "state": "Hessen",
      "amtsgericht": "Amtsgericht Wiesbaden",
      "registernummer": "HRB 28419",
      "registerart": "HRB",
      "company_name": "AABB-GASTRO GmbH",
      "company_seat": "Wiesbaden",
      "details": "30.10.2025 (Bekanntmachungsdatum)\n\nHessen Amtsgericht Wiesbaden HRB 28419\nLöschungsankündigung\n\nAABB-GASTRO GmbH\nGesellschaft mit beschränkter Haftung\nWiesbaden\n\nDas Registergericht beabsichtigt die im Handelsregister eingetragene Gesellschaft von Amts wegen nach § 394 FamFG zu löschen. Die Frist zur Erhebung eines Widerspruchs gegen die beabsichtigte Löschung wird auf 3 Monate festgesetzt."
    },
    {
      "date": "2025-10-30",
      "id": "135915",
      "original_text": "Löschungsankündigung\nHessen Amtsgericht Wiesbaden HRB 29599\nKonopka Verwaltungs GmbH – Idstein",
      "type": "Löschungsankündigung",
      "state": "Hessen",
      "amtsgericht": "Amtsgericht Wiesbaden",
      "registernummer": "HRB 29599",
      "registerart": "HRB",
      "company_name": "Konopka Verwaltungs GmbH",
      "company_seat": "Idstein",
      "details": "30.10.2025 (Bekanntmachungsdatum)\n\nHessen Amtsgericht Wiesbaden HRB 29599\nLöschungsankündigung\n\nKonopka Verwaltungs GmbH\nGesellschaft mit beschränkter Haftung\nIdstein\n\nDas Registergericht beabsichtigt die im Handelsregister eingetragene Gesellschaft von Amts wegen nach § 394 FamFG zu löschen. Die Frist zur Erhebung eines Widerspruchs gegen die beabsichtigte Löschung wird auf 3 Monate festgesetzt."
    },
    {
      "date": "2025-10-30",
      "id": "135916",
      "original_text": "Löschungsankündigung\nHessen Amtsgericht Hanau HRB 96988\nTIU Facility UG (haftungsbeschränkt) – Hanau",
      "type": "Löschungsankündigung",
      "state": "Hessen",
      "amtsgericht": "Amtsgericht Hanau",
      "registernummer": "HRB 96988",
      "registerart": "HRB",
      "company_name": "TIU Facility UG (haftungsbeschränkt)",
      "company_seat": "Hanau",
      "details": "30.10.2025 (Bekanntmachungsdatum)\n\nHessen Amtsgericht Hanau HRB 96988\nLöschungsankündigung\n\nTIU Facility UG (haftungsbeschränkt)\nGesellschaft mit beschränkter Haftung\nHanau\n\nDas Registergericht beabsichtigt die im Handelsregister eingetragene Gesellschaft von Amts wegen nach § 394 FamFG zu löschen. Die Frist zur Erhebung eines Widerspruchs gegen die beabsichtigte Löschung wird auf 3 Monate festgesetzt."
    },
    {
      "date": "2025-10-30",
      "id": "135917",
      "original_text": "Registerbekanntmachung nach dem Umwandlungsgesetz\nHessen Amtsgericht Darmstadt HRA 83756\nDritte animus GmbH & Co. KG – Darmstadt",
      "type": "Registerbekanntmachung nach dem Umwandlungsgesetz",
      "state": "Hessen",
      "amtsgericht": "Amtsgericht Darmstadt",
      "registernummer": "HRA 83756",
      "registerart": "HRA",
      "company_name": "Dritte animus GmbH & Co. KG",
      "company_seat": "Darmstadt",
      "details": "30.10.2025 (Bekanntmachungsdatum)\n\nHessen Amtsgericht Darmstadt HRA 83756\nRegisterbekanntmachung nach dem Umwandlungsgesetz 30.10.2025 (Eintragungsdatum)\n\nDritte animus GmbH & Co. KG\nKommanditgesellschaft\nDarmstadt\n\nDen Gläubigern der an der Verschmelzung beteiligten Rechtsträger ist, wenn sie binnen sechs Monaten nach dem Tag, an dem die Eintragung der Verschmelzung in das Register des Sitzes desjenigen Rechtsträgers, dessen Gläubiger sie sind, nach § 19 Absatz 3 UmwG bekannt gemacht worden ist, ihren Anspruch nach Grund und Höhe schriftlich anmelden, Sicherheit zu leisten, soweit sie nicht Befriedigung verlangen können. Dieses Recht steht den Gläubigern jedoch nur zu, wenn sie glaubhaft machen, dass durch die Verschmelzung die Erfüllung ihrer Forderung gefährdet wird."
    },
    {
      "date": "2025-10-30",
      "id": "135918",
      "original_text": "Löschungsankündigung\nHessen Amtsgericht Wiesbaden HRB 12373\nFlorin GmbH – Wiesbaden",
      "type": "Löschungsankündigung",
      "state": "Hessen",
      "amtsgericht": "Amtsgericht Wiesbaden",
      "registernummer": "HRB 12373",
      "registerart": "HRB",
      "company_name": "Florin GmbH",
      "company_seat": "Wiesbaden",
      "details": "30.10.2025 (Bekanntmachungsdatum)\n\nHessen Amtsgericht Wiesbaden HRB 12373\nLöschungsankündigung\n\nFlorin GmbH\nGesellschaft mit beschränkter Haftung\nWiesbaden\n\nDas Registergericht beabsichtigt die im Handelsregister eingetragene Gesellschaft von Amts wegen nach § 394 FamFG zu löschen. Die Frist zur Erhebung eines Widerspruchs gegen die beabsichtigte Löschung wird auf 3 Monate festgesetzt."
    },
    {
      "date": "2025-10-30",
      "id": "135919",
      "original_text": "Löschungsankündigung\nHessen Amtsgericht Frankfurt am Main HRB 115007\nPure Construction GmbH – Eschborn",
      "type": "Löschungsankündigung",
      "state": "Hessen",
      "amtsgericht": "Amtsgericht Frankfurt am Main",
      "registernummer": "HRB 115007",
      "registerart": "HRB",
      "company_name": "Pure Construction GmbH",
      "company_seat": "Eschborn",
      "details": "30.10.2025 (Bekanntmachungsdatum)\n\nHessen Amtsgericht Frankfurt am Main HRB 115007\nLöschungsankündigung 30.10.2025 (Eintragungsdatum)\n\nPure Construction GmbH\nGesellschaft mit beschränkter Haftung\nEschborn\n\nEs ist beabsichtigt die Gesellschaft wegen Vermögenslosigkeit gemäß § 394 FamFG von Amts wegen zu löschen. Hiergegen kann innerhalb eines Monats nach dieser Veröffentlichung Widerspruch bei dem Amtsgericht Frankfurt am Main eingelegt werden."
    },
    {
      "date": "2025-10-30",
      "id": "135920",
      "original_text": "Einreichung neuer Dokumente\nHessen Amtsgericht Frankfurt am Main HRB 113320\nERWE Immobilien AG – Frankfurt am Main",
      "type": "Einreichung neuer Dokumente",
      "state": "Hessen",
      "amtsgericht": "Amtsgericht Frankfurt am Main",
      "registernummer": "HRB 113320",
      "registerart": "HRB",
      "company_name": "ERWE Immobilien AG",
      "company_seat": "Frankfurt am Main",
      "details": "30.10.2025 (Bekanntmachungsdatum)\n\nHessen Amtsgericht Frankfurt am Main HRB 113320\nEinreichung neuer Dokumente 30.10.2025 (Eintragungsdatum)\n\nERWE Immobilien AG\nAktiengesellschaft\nFrankfurt am Main\n\nDurch eine Änderung in den Personen der Aufsichtsratsmitglieder ist eine Liste der Mitglieder des Aufsichtsrates zum Handelsregister eingereicht worden."
    },
    {
      "date": "2025-10-30",
      "id": "135921",
      "original_text": "Sonstige Registerbekanntmachung\nHessen Amtsgericht Frankfurt am Main HRB 117198\nDS Albatross MidCo GmbH – Frankfurt am Main",
      "type": "Sonstige Registerbekanntmachung",
      "state": "Hessen",
      "amtsgericht": "Amtsgericht Frankfurt am Main",
      "registernummer": "HRB 117198",
      "registerart": "HRB",
      "company_name": "DS Albatross MidCo GmbH",
      "company_seat": "Frankfurt am Main",
      "details": "30.10.2025 (Bekanntmachungsdatum)\n\nHessen Amtsgericht Frankfurt am Main HRB 117198\nSonstige Registerbekanntmachung 30.10.2025 (Eintragungsdatum)\n\nDS Albatross MidCo GmbH\nGesellschaft mit beschränkter Haftung\nFrankfurt am Main\n\nDen Gläubigern der Gesellschaft, deren Forderungen begründet worden sind, bevor die Eintragung der Beendigung des Vertrags in das Handelsregister nach § 10 HGB bekannt gemacht worden ist, ist vom anderen Vertragsteil Sicherheit zu leisten, wenn sie sich binnen sechs Monaten nach dieser Bekanntmachung zu diesem Zweck bei ihm melden."
    },
    {
      "date": "2025-10-30",
      "id": "135922",
      "original_text": "Registerbekanntmachung nach dem Umwandlungsgesetz\nHessen Amtsgericht Frankfurt am Main HRB 119705\nProjektgesellschaft Ditmarstraße 34-38 GmbH – Frankfurt am Main",
      "type": "Registerbekanntmachung nach dem Umwandlungsgesetz",
      "state": "Hessen",
      "amtsgericht": "Amtsgericht Frankfurt am Main",
      "registernummer": "HRB 119705",
      "registerart": "HRB",
      "company_name": "Projektgesellschaft Ditmarstraße 34-38 GmbH",
      "company_seat": "Frankfurt am Main",
      "details": "30.10.2025 (Bekanntmachungsdatum)\n\nHessen Amtsgericht Frankfurt am Main HRB 119705\nRegisterbekanntmachung nach dem Umwandlungsgesetz 30.10.2025 (Eintragungsdatum)\n\nProjektgesellschaft Ditmarstraße 34-38 GmbH\nGesellschaft mit beschränkter Haftung\nFrankfurt am Main\n\nDen Gläubigern der an der Verschmelzung beteiligten Rechtsträger ist, wenn sie binnen sechs Monaten nach dem Tag, an dem die Eintragung der Verschmelzung in das Register des Sitzes desjenigen Rechtsträgers, dessen Gläubiger sie sind, nach § 19 Absatz 3 UmwG bekannt gemacht worden ist, ihren Anspruch nach Grund und Höhe schriftlich anmelden, Sicherheit zu leisten, soweit sie nicht Befriedigung verlangen können. Dieses Recht steht den Gläubigern jedoch nur zu, wenn sie glaubhaft machen, dass durch die Verschmelzung die Erfüllung ihrer Forderung gefährdet wird."
    },
    {
      "date": "2025-10-30",
      "id": "135923",
      "original_text": "Einreichung neuer Dokumente\nHessen Amtsgericht Frankfurt am Main HRB 12394\nDeutsche Gesellschaft für Internationale Zusammenarbeit (GIZ) GmbH – Eschborn und Bonn",
      "type": "Einreichung neuer Dokumente",
      "state": "Hessen",
      "amtsgericht": "Amtsgericht Frankfurt am Main",
      "registernummer": "HRB 12394",
      "registerart": "HRB",
      "company_name": "Deutsche Gesellschaft für Internationale Zusammenarbeit (GIZ) GmbH",
      "company_seat": "Eschborn und Bonn",
      "details": "30.10.2025 (Bekanntmachungsdatum)\n\nHessen Amtsgericht Frankfurt am Main HRB 12394\nEinreichung neuer Dokumente\n\nDeutsche Gesellschaft für Internationale Zusammenarbeit (GIZ) GmbH\nGesellschaft mit beschränkter Haftung\nEschborn und Bonn\n\nDurch eine Änderung in den Personen der Aufsichtsratsmitglieder ist eine Liste der Mitglieder des Aufsichtsrates zum Handelsregister eingereicht worden."
    },
    {
      "date": "2025-10-30",
      "id": "135924",
      "original_text": "Löschungsankündigung\nHessen Amtsgericht Wiesbaden HRB 16109\nHaka-Bauträgergesellschaft mbH – Hohenstein",
      "type": "Löschungsankündigung",
      "state": "Hessen",
      "amtsgericht": "Amtsgericht Wiesbaden",
      "registernummer": "HRB 16109",
      "registerart": "HRB",
      "company_name": "Haka-Bauträgergesellschaft mbH",
      "company_seat": "Hohenstein",
      "details": "30.10.2025 (Bekanntmachungsdatum)\n\nHessen Amtsgericht Wiesbaden HRB 16109\nLöschungsankündigung\n\nHaka-Bauträgergesellschaft mbH\nGesellschaft mit beschränkter Haftung\nHohenstein\n\nDas Registergericht beabsichtigt die im Handelsregister eingetragene Gesellschaft von Amts wegen nach § 394 FamFG zu löschen. Die Frist zur Erhebung eines Widerspruchs gegen die beabsichtigte Löschung wird auf 3 Monate festgesetzt."
    },
    {
      "date": "2025-10-30",
      "id": "135925",
      "original_text": "Registerbekanntmachung nach dem Umwandlungsgesetz\nHessen Amtsgericht Frankfurt am Main HRB 83870\nSandberg Holding GmbH – Frankfurt am Main",
      "type": "Registerbekanntmachung nach dem Umwandlungsgesetz",
      "state": "Hessen",
      "amtsgericht": "Amtsgericht Frankfurt am Main",
      "registernummer": "HRB 83870",
      "registerart": "HRB",
      "company_name": "Sandberg Holding GmbH",
      "company_seat": "Frankfurt am Main",
      "details": "30.10.2025 (Bekanntmachungsdatum)\n\nHessen Amtsgericht Frankfurt am Main HRB 83870\nRegisterbekanntmachung nach dem Umwandlungsgesetz 30.10.2025 (Eintragungsdatum)\n\nSandberg Holding GmbH\nGesellschaft mit beschränkter Haftung\nFrankfurt am Main\n\nDen Gläubigern der an der Verschmelzung beteiligten Rechtsträger ist, wenn sie binnen sechs Monaten nach dem Tag, an dem die Eintragung der Verschmelzung in das Register des Sitzes desjenigen Rechtsträgers, dessen Gläubiger sie sind, nach § 19 Absatz 3 UmwG bekannt gemacht worden ist, ihren Anspruch nach Grund und Höhe schriftlich anmelden, Sicherheit zu leisten, soweit sie nicht Befriedigung verlangen können. Dieses Recht steht den Gläubigern jedoch nur zu, wenn sie glaubhaft machen, dass durch die Verschmelzung die Erfüllung ihrer Forderung gefährdet wird."
    }
  ]
}