{
  "date": "2025-10-06",
  "date_of_scrape": "2025-10-27T17:10:14.205Z",
  "tool_version": "0.2.0",
  "number_of_announcements": 167,
  "announcements": [
    {
      "date": "2025-10-06",
      "id": "132623",
      "original_text": "Sonstige Registerbekanntmachung\nBaden-Württemberg Amtsgericht Mannheim HRB 500094\nWitzenmann GmbH – Pforzheim",
      "type": "Sonstige Registerbekanntmachung",
      "state": "Baden-Württemberg",
      "amtsgericht": "Amtsgericht Mannheim",
      "registernummer": "HRB 500094",
      "registerart": "HRB",
      "company_name": "Witzenmann GmbH",
      "company_seat": "Pforzheim",
      "details": "06.10.2025 (Bekanntmachungsdatum)\n\nBaden-Württemberg Amtsgericht Mannheim HRB 500094\nSonstige Registerbekanntmachung\n\nWitzenmann GmbH\nGesellschaft mit beschränkter Haftung\nPforzheim\n\nDie Gesellschaft hat am 02.10.2025 die Liste über die Zusammensetzung des Aufsichtsrats zum Handelsregister eingereicht."
    },
    {
      "date": "2025-10-06",
      "id": "132624",
      "original_text": "Löschungsankündigung\nBerlin Amtsgericht Berlin (Charlottenburg) HRB 107539\nHOAG vierte Verwaltungs GmbH – Berlin",
      "type": "Löschungsankündigung",
      "state": "Berlin",
      "amtsgericht": "Amtsgericht Berlin (Charlottenburg)",
      "registernummer": "HRB 107539",
      "registerart": "HRB",
      "company_name": "HOAG vierte Verwaltungs GmbH",
      "company_seat": "Berlin",
      "details": "06.10.2025 (Bekanntmachungsdatum)\n\nBerlin Amtsgericht Berlin (Charlottenburg) HRB 107539\nLöschungsankündigung\n\nHOAG vierte Verwaltungs GmbH\nGesellschaft mit beschränkter Haftung\nBerlin\n\nBei der nachstehenden Gesellschaft wird das Amtslöschungsverfahren gemäß § 394 FamFG eingeleitet. Widerspruchsfrist 6 Wochen"
    },
    {
      "date": "2025-10-06",
      "id": "132625",
      "original_text": "Registerbekanntmachung nach dem Umwandlungsgesetz\nSchleswig-Holstein Amtsgericht Lübeck HRB 17175\nFerienhaus.de GmbH – Wentorf bei Hamburg",
      "type": "Registerbekanntmachung nach dem Umwandlungsgesetz",
      "state": "Schleswig-Holstein",
      "amtsgericht": "Amtsgericht Lübeck",
      "registernummer": "HRB 17175",
      "registerart": "HRB",
      "company_name": "Ferienhaus.de GmbH",
      "company_seat": "Wentorf bei Hamburg",
      "details": "06.10.2025 (Bekanntmachungsdatum)\n\nSchleswig-Holstein Amtsgericht Lübeck HRB 17175\nRegisterbekanntmachung nach dem Umwandlungsgesetz 04.10.2025 (Eintragungsdatum)\n\nFerienhaus.de GmbH\nGesellschaft mit beschränkter Haftung\nWentorf bei Hamburg\n\nZu Eintragungsnummer 5 vom 04.10.2025 wird als nicht eingetragen veröffentlicht:  Den Gläubigern der an der Verschmelzung beteiligten Rechtsträger ist, wenn sie binnen sechs Monaten nach dem Tag, an dem die Eintragung der Verschmelzung in das Register des Sitzes desjenigen Rechtsträgers, dessen Gläubiger sie sind, als bekannt gemacht gilt, ihren Anspruch nach Grund und Höhe schriftlich anmelden, Sicherheit zu leisten, soweit sie nicht Befriedigung verlangen können. Dieses Recht steht den Gläubigern jedoch nur zu, wenn sie glaubhaft machen, dass durch die Verschmelzung die Erfüllung ihrer Forderung gefährdet wird."
    },
    {
      "date": "2025-10-06",
      "id": "132626",
      "original_text": "Einreichung neuer Dokumente\nBerlin Amtsgericht Berlin (Charlottenburg) HRB 142946\nAIOS Tax AG Steuerberatungsgesellschaft – Berlin",
      "type": "Einreichung neuer Dokumente",
      "state": "Berlin",
      "amtsgericht": "Amtsgericht Berlin (Charlottenburg)",
      "registernummer": "HRB 142946",
      "registerart": "HRB",
      "company_name": "AIOS Tax AG Steuerberatungsgesellschaft",
      "company_seat": "Berlin",
      "details": "06.10.2025 (Bekanntmachungsdatum)\n\nBerlin Amtsgericht Berlin (Charlottenburg) HRB 142946\nEinreichung neuer Dokumente\n\nAIOS Tax AG Steuerberatungsgesellschaft\nAktiengesellschaft\nBerlin\n\nAls nicht eingetragen wird veröffentlicht:\n\nEs wurde eine neue Liste der Aufsichtsratsmitglieder eingereicht (§ 106 AktG)."
    },
    {
      "date": "2025-10-06",
      "id": "132627",
      "original_text": "Registerbekanntmachung nach dem Umwandlungsgesetz\nBerlin Amtsgericht Berlin (Charlottenburg) HRB 104378\nHGHI Immobilien Verwaltung GmbH – Berlin",
      "type": "Registerbekanntmachung nach dem Umwandlungsgesetz",
      "state": "Berlin",
      "amtsgericht": "Amtsgericht Berlin (Charlottenburg)",
      "registernummer": "HRB 104378",
      "registerart": "HRB",
      "company_name": "HGHI Immobilien Verwaltung GmbH",
      "company_seat": "Berlin",
      "details": "06.10.2025 (Bekanntmachungsdatum)\n\nBerlin Amtsgericht Berlin (Charlottenburg) HRB 104378\nRegisterbekanntmachung nach dem Umwandlungsgesetz 02.10.2025 (Eintragungsdatum)\n\nHGHI Immobilien Verwaltung GmbH\nGesellschaft mit beschränkter Haftung\nBerlin\n\nZu Eintragungsnummer 27 vom 02.10.2025 wird als nicht eingetragen veröffentlicht:\n\nDen Gläubigern der an der Verschmelzung beteiligten Rechtsträger ist, wenn sie binnen sechs Monaten nach dem Tag, an dem die Eintragung der Verschmelzung in das Register des Sitzes desjenigen Rechtsträgers, dessen Gläubiger sie sind, als bekannt gemacht gilt, ihren Anspruch nach Grund und Höhe schriftlich anmelden, Sicherheit zu leisten, soweit sie nicht Befriedigung verlangen können. Dieses Recht steht den Gläubigern jedoch nur zu, wenn sie glaubhaft machen, dass durch die Verschmelzung die Erfüllung ihrer Forderung gefährdet wird. Das Recht, Sicherheitsleistung zu verlangen, steht Gläubigern nicht zu, die im Falle der Insolvenz ein Recht auf vorzugsweise Befriedigung aus einer Deckungsmasse haben, die nach gesetzlicher Vorschrift zu ihrem Schutz errichtet und staatlich überwacht ist."
    },
    {
      "date": "2025-10-06",
      "id": "132628",
      "original_text": "Registerbekanntmachung nach dem Umwandlungsgesetz\nBerlin Amtsgericht Berlin (Charlottenburg) HRB 153911\nHGHI Immobilien Verwaltung GmbH – Berlin",
      "type": "Registerbekanntmachung nach dem Umwandlungsgesetz",
      "state": "Berlin",
      "amtsgericht": "Amtsgericht Berlin (Charlottenburg)",
      "registernummer": "HRB 153911",
      "registerart": "HRB",
      "company_name": "HGHI Immobilien Verwaltung GmbH",
      "company_seat": "Berlin",
      "details": "06.10.2025 (Bekanntmachungsdatum)\n\nBerlin Amtsgericht Berlin (Charlottenburg) HRB 153911\nRegisterbekanntmachung nach dem Umwandlungsgesetz 02.10.2025 (Eintragungsdatum)\n\nHGHI Immobilien Verwaltung GmbH\nGesellschaft mit beschränkter Haftung\nBerlin\n\nZu Eintragungsnummer 10 vom 02.10.2025 wird als nicht eingetragen veröffentlicht:\n\nDen Gläubigern der an der Verschmelzung beteiligten Rechtsträger ist, wenn sie binnen sechs Monaten nach dem Tag, an dem die Eintragung der Verschmelzung in das Register des Sitzes desjenigen Rechtsträgers, dessen Gläubiger sie sind, als bekannt gemacht gilt, ihren Anspruch nach Grund und Höhe schriftlich anmelden, Sicherheit zu leisten, soweit sie nicht Befriedigung verlangen können. Dieses Recht steht den Gläubigern jedoch nur zu, wenn sie glaubhaft machen, dass durch die Verschmelzung die Erfüllung ihrer Forderung gefährdet wird. Das Recht, Sicherheitsleistung zu verlangen, steht Gläubigern nicht zu, die im Falle der Insolvenz ein Recht auf vorzugsweise Befriedigung aus einer Deckungsmasse haben, die nach gesetzlicher Vorschrift zu ihrem Schutz errichtet und staatlich überwacht ist."
    },
    {
      "date": "2025-10-06",
      "id": "132629",
      "original_text": "Registerbekanntmachung nach dem Umwandlungsgesetz\nBerlin Amtsgericht Berlin (Charlottenburg) HRB 275512\nIMPERIAL Facilities GmbH – Berlin",
      "type": "Registerbekanntmachung nach dem Umwandlungsgesetz",
      "state": "Berlin",
      "amtsgericht": "Amtsgericht Berlin (Charlottenburg)",
      "registernummer": "HRB 275512",
      "registerart": "HRB",
      "company_name": "IMPERIAL Facilities GmbH",
      "company_seat": "Berlin",
      "details": "06.10.2025 (Bekanntmachungsdatum)\n\nBerlin Amtsgericht Berlin (Charlottenburg) HRB 275512\nRegisterbekanntmachung nach dem Umwandlungsgesetz 30.09.2025 (Eintragungsdatum)\n\nIMPERIAL Facilities GmbH\nGesellschaft mit beschränkter Haftung\nBerlin\n\nZu Eintragungsnummer 3 vom 30.09.2025 wird als nicht eingetragen veröffentlicht: Den Gläubigern der an der Spaltung beteiligten Rechtsträger ist, wenn sie binnen sechs Monaten nach dem Tag, an dem die Eintragung der Spaltung in das Register des Sitzes desjenigen Rechtsträgers, dessen Gläubiger sie sind, als bekannt gemacht gilt, ihren Anspruch nach Grund und Höhe schriftlich anmelden, Sicherheit zu leisten, soweit sie nicht Befriedigung verlangen können. Dieses Recht steht den Gläubigern jedoch nur zu, wenn sie glaubhaft machen, dass durch die Spaltung die Erfüllung ihrer Forderung gefährdet wird. Das Recht, Sicherheitsleistung zu verlangen, steht Gläubigern nicht zu, die im Falle der Insolvenz ein Recht auf vorzugsweise Befriedigung aus einer Deckungsmasse haben, die nach gesetzlicher Vorschrift zu ihrem Schutz errichtet und staatlich überwacht ist."
    },
    {
      "date": "2025-10-06",
      "id": "132630",
      "original_text": "Registerbekanntmachung nach dem Umwandlungsgesetz\nHamburg Amtsgericht Hamburg HRB 166773\nBIK Verwaltung GmbH – Hamburg",
      "type": "Registerbekanntmachung nach dem Umwandlungsgesetz",
      "state": "Hamburg",
      "amtsgericht": "Amtsgericht Hamburg",
      "registernummer": "HRB 166773",
      "registerart": "HRB",
      "company_name": "BIK Verwaltung GmbH",
      "company_seat": "Hamburg",
      "details": "06.10.2025 (Bekanntmachungsdatum)\n\nHamburg Amtsgericht Hamburg HRB 166773\nRegisterbekanntmachung nach dem Umwandlungsgesetz 06.10.2025 (Eintragungsdatum)\n\nBIK Verwaltung GmbH\nGesellschaft mit beschränkter Haftung\nHamburg\n\nAls nicht eingetragen wird bekannt gemacht:\nDen Gläubigern der an der Verschmelzung beteiligten Gesellschaften ist, wenn sie binnen sechs Monaten nach dem Tag, an dem die Eintragung der Verschmelzung in das Register des Sitzes desjenigen Rechtsträgers, dessen Gläubiger sie sind, nach § 19 Absatz 3 UmwG als bekannt gemacht gilt, ihren Anspruch nach Grund und Höhe schriftlich anmelden, Sicherheit zu leisten, soweit sie nicht Befriedigung verlangen können. Dieses Recht steht den Gläubigern jedoch nur zu, wenn sie glaubhaft machen, dass durch die Verschmelzung die Erfüllung ihrer Forderung gefährdet wird."
    },
    {
      "date": "2025-10-06",
      "id": "132631",
      "original_text": "Registerbekanntmachung nach dem Umwandlungsgesetz\nBaden-Württemberg Amtsgericht Stuttgart HRB 801260\nZaun- und Torsysteme Schwäbisch Hall GmbH – Schwäbisch Hall",
      "type": "Registerbekanntmachung nach dem Umwandlungsgesetz",
      "state": "Baden-Württemberg",
      "amtsgericht": "Amtsgericht Stuttgart",
      "registernummer": "HRB 801260",
      "registerart": "HRB",
      "company_name": "Zaun- und Torsysteme Schwäbisch Hall GmbH",
      "company_seat": "Schwäbisch Hall",
      "details": "06.10.2025 (Bekanntmachungsdatum)\n\nBaden-Württemberg Amtsgericht Stuttgart HRB 801260\nRegisterbekanntmachung nach dem Umwandlungsgesetz 06.10.2025 (Eintragungsdatum)\n\nZaun- und Torsysteme Schwäbisch Hall GmbH\nGesellschaft mit beschränkter Haftung\nSchwäbisch Hall\n\nAls nicht eingetragen wird bekanntgemacht:\nDen Gläubigern der an der Ausgliederung beteiligten Rechtsträger ist, wenn sie binnen sechs Monaten nach dem Tag, an dem die Eintragung der Ausgliederung in das Register des Sitzes desjenigen Rechtsträgers, dessen Gläubiger sie sind, nach § 19 Abs. 3 UmwG als bekanntgemacht gilt, ihren Anspruch nach Grund und Höhe schriftlich anmelden, Sicherheit zu leisten, soweit sie nicht Befriedigung verlangen können. Dieses Recht steht den Gläubigern jedoch nur zu, wenn sie glaubhaft machen, dass durch die Ausgliederung die Erfüllung ihrer Forderung gefährdet wird."
    },
    {
      "date": "2025-10-06",
      "id": "132632",
      "original_text": "Registerbekanntmachung nach dem Umwandlungsgesetz\nBerlin Amtsgericht Berlin (Charlottenburg) HRB 112926\nKaminski + Brendel Hauptstadtmaler GmbH – Berlin",
      "type": "Registerbekanntmachung nach dem Umwandlungsgesetz",
      "state": "Berlin",
      "amtsgericht": "Amtsgericht Berlin (Charlottenburg)",
      "registernummer": "HRB 112926",
      "registerart": "HRB",
      "company_name": "Kaminski + Brendel Hauptstadtmaler GmbH",
      "company_seat": "Berlin",
      "details": "06.10.2025 (Bekanntmachungsdatum)\n\nBerlin Amtsgericht Berlin (Charlottenburg) HRB 112926\nRegisterbekanntmachung nach dem Umwandlungsgesetz 02.10.2025 (Eintragungsdatum)\n\nKaminski + Brendel Hauptstadtmaler GmbH\nGesellschaft mit beschränkter Haftung\nBerlin\n\nZu Eintragungsnummer 40 vom 02.10.2025 wird als nicht eingetragen veröffentlicht:\n\nDen Gläubigern der an der Spaltung beteiligten Rechtsträger ist, wenn sie binnen sechs Monaten nach dem Tag, an dem die Eintragung der Spaltung in das Register des Sitzes desjenigen Rechtsträgers, dessen Gläubiger sie sind, als bekannt gemacht gilt, ihren Anspruch nach Grund und Höhe schriftlich anmelden, Sicherheit zu leisten, soweit sie nicht Befriedigung verlangen können. Dieses Recht steht den Gläubigern jedoch nur zu, wenn sie glaubhaft machen, dass durch die Spaltung die Erfüllung ihrer Forderung gefährdet wird. Das Recht, Sicherheitsleistung zu verlangen, steht Gläubigern nicht zu, die im Falle der Insolvenz ein Recht auf vorzugsweise Befriedigung aus einer Deckungsmasse haben, die nach gesetzlicher Vorschrift zu ihrem Schutz errichtet und staatlich überwacht ist."
    },
    {
      "date": "2025-10-06",
      "id": "132633",
      "original_text": "Löschungsankündigung\nBerlin Amtsgericht Berlin (Charlottenburg) HRB 63647\nT.I.P. Telecommunication & Information Products GmbH – Berlin",
      "type": "Löschungsankündigung",
      "state": "Berlin",
      "amtsgericht": "Amtsgericht Berlin (Charlottenburg)",
      "registernummer": "HRB 63647",
      "registerart": "HRB",
      "company_name": "T.I.P. Telecommunication & Information Products GmbH",
      "company_seat": "Berlin",
      "details": "06.10.2025 (Bekanntmachungsdatum)\n\nBerlin Amtsgericht Berlin (Charlottenburg) HRB 63647\nLöschungsankündigung\n\nT.I.P. Telecommunication & Information Products GmbH\nGesellschaft mit beschränkter Haftung\nBerlin\n\nBei der nachstehenden Gesellschaft wird das Amtslöschungsverfahren gemäß § 394 FamFG eingeleitet. Widerspruchsfrist 6 Wochen"
    },
    {
      "date": "2025-10-06",
      "id": "132634",
      "original_text": "Einreichung neuer Dokumente\nBaden-Württemberg Amtsgericht Stuttgart HRB 757961\nGroz-Beckert Verwaltungs- und Beteiligungs-SE – Albstadt",
      "type": "Einreichung neuer Dokumente",
      "state": "Baden-Württemberg",
      "amtsgericht": "Amtsgericht Stuttgart",
      "registernummer": "HRB 757961",
      "registerart": "HRB",
      "company_name": "Groz-Beckert Verwaltungs- und Beteiligungs-SE",
      "company_seat": "Albstadt",
      "details": "06.10.2025 (Bekanntmachungsdatum)\n\nBaden-Württemberg Amtsgericht Stuttgart HRB 757961\nEinreichung neuer Dokumente\n\nGroz-Beckert Verwaltungs- und Beteiligungs-SE\nEuropäische Aktiengesellschaft (SE)\nAlbstadt\n\nDie Gesellschaft hat am 25.09.2025 die Liste über die Zusammensetzung des Aufsichtsrats zum Handelsregister eingereicht."
    },
    {
      "date": "2025-10-06",
      "id": "132635",
      "original_text": "Registerbekanntmachung nach dem Umwandlungsgesetz\nBaden-Württemberg Amtsgericht Stuttgart HRB 352288\nWörner Medizinprodukte und Logistik GmbH – Reutlingen",
      "type": "Registerbekanntmachung nach dem Umwandlungsgesetz",
      "state": "Baden-Württemberg",
      "amtsgericht": "Amtsgericht Stuttgart",
      "registernummer": "HRB 352288",
      "registerart": "HRB",
      "company_name": "Wörner Medizinprodukte und Logistik GmbH",
      "company_seat": "Reutlingen",
      "details": "06.10.2025 (Bekanntmachungsdatum)\n\nBaden-Württemberg Amtsgericht Stuttgart HRB 352288\nRegisterbekanntmachung nach dem Umwandlungsgesetz 06.10.2025 (Eintragungsdatum)\n\nWörner Medizinprodukte und Logistik GmbH\nGesellschaft mit beschränkter Haftung\nReutlingen\n\nAls nicht eingetragen wird bekanntgemacht:\nDen Gläubigern der an der Verschmelzung beteiligten Rechtsträger ist, wenn sie binnen sechs Monaten nach dem Tag, an dem die Eintragung der Verschmelzung in das Register des Sitzes desjenigen Rechtsträgers, dessen Gläubiger sie sind, nach § 19 Abs. 3 UmwG als bekanntgemacht gilt, ihren Anspruch nach Grund und Höhe schriftlich anmelden, Sicherheit zu leisten, soweit sie nicht Befriedigung verlangen können. Dieses Recht steht den Gläubigern jedoch nur zu, wenn sie glaubhaft machen, dass durch die Verschmelzung die Erfüllung ihrer Forderung gefährdet wird."
    },
    {
      "date": "2025-10-06",
      "id": "132636",
      "original_text": "Registerbekanntmachung nach dem Umwandlungsgesetz\nSchleswig-Holstein Amtsgericht Lübeck HRB 13499\nTARIF CHECK24 GmbH – Wentorf",
      "type": "Registerbekanntmachung nach dem Umwandlungsgesetz",
      "state": "Schleswig-Holstein",
      "amtsgericht": "Amtsgericht Lübeck",
      "registernummer": "HRB 13499",
      "registerart": "HRB",
      "company_name": "TARIF CHECK24 GmbH",
      "company_seat": "Wentorf",
      "details": "06.10.2025 (Bekanntmachungsdatum)\n\nSchleswig-Holstein Amtsgericht Lübeck HRB 13499\nRegisterbekanntmachung nach dem Umwandlungsgesetz 04.10.2025 (Eintragungsdatum)\n\nTARIF CHECK24 GmbH\nGesellschaft mit beschränkter Haftung\nWentorf\n\nZu Eintragungsnummer 3 vom 04.10.2025 wird als nicht eingetragen veröffentlicht:  Den Gläubigern der an der Verschmelzung beteiligten Rechtsträger ist, wenn sie binnen sechs Monaten nach dem Tag, an dem die Eintragung der Verschmelzung in das Register des Sitzes desjenigen Rechtsträgers, dessen Gläubiger sie sind, als bekannt gemacht gilt, ihren Anspruch nach Grund und Höhe schriftlich anmelden, Sicherheit zu leisten, soweit sie nicht Befriedigung verlangen können. Dieses Recht steht den Gläubigern jedoch nur zu, wenn sie glaubhaft machen, dass durch die Verschmelzung die Erfüllung ihrer Forderung gefährdet wird."
    },
    {
      "date": "2025-10-06",
      "id": "132637",
      "original_text": "Registerbekanntmachung nach dem Umwandlungsgesetz\nBerlin Amtsgericht Berlin (Charlottenburg) HRB 112926\nKaminski + Brendel Hauptstadtmaler GmbH – Berlin",
      "type": "Registerbekanntmachung nach dem Umwandlungsgesetz",
      "state": "Berlin",
      "amtsgericht": "Amtsgericht Berlin (Charlottenburg)",
      "registernummer": "HRB 112926",
      "registerart": "HRB",
      "company_name": "Kaminski + Brendel Hauptstadtmaler GmbH",
      "company_seat": "Berlin",
      "details": "06.10.2025 (Bekanntmachungsdatum)\n\nBerlin Amtsgericht Berlin (Charlottenburg) HRB 112926\nRegisterbekanntmachung nach dem Umwandlungsgesetz 02.10.2025 (Eintragungsdatum)\n\nKaminski + Brendel Hauptstadtmaler GmbH\nGesellschaft mit beschränkter Haftung\nBerlin\n\nZu Eintragungsnummer 39 vom 02.10.2025 wird als nicht eingetragen veröffentlicht:\n\nDen Gläubigern der an der Spaltung beteiligten Rechtsträger ist, wenn sie binnen sechs Monaten nach dem Tag, an dem die Eintragung der Spaltung in das Register des Sitzes desjenigen Rechtsträgers, dessen Gläubiger sie sind, als bekannt gemacht gilt, ihren Anspruch nach Grund und Höhe schriftlich anmelden, Sicherheit zu leisten, soweit sie nicht Befriedigung verlangen können. Dieses Recht steht den Gläubigern jedoch nur zu, wenn sie glaubhaft machen, dass durch die Spaltung die Erfüllung ihrer Forderung gefährdet wird. Das Recht, Sicherheitsleistung zu verlangen, steht Gläubigern nicht zu, die im Falle der Insolvenz ein Recht auf vorzugsweise Befriedigung aus einer Deckungsmasse haben, die nach gesetzlicher Vorschrift zu ihrem Schutz errichtet und staatlich überwacht ist."
    },
    {
      "date": "2025-10-06",
      "id": "132638",
      "original_text": "Registerbekanntmachung nach dem Umwandlungsgesetz\nHamburg Amtsgericht Hamburg HRB 137510\nBREMER Nord GmbH – Hamburg",
      "type": "Registerbekanntmachung nach dem Umwandlungsgesetz",
      "state": "Hamburg",
      "amtsgericht": "Amtsgericht Hamburg",
      "registernummer": "HRB 137510",
      "registerart": "HRB",
      "company_name": "BREMER Nord GmbH",
      "company_seat": "Hamburg",
      "details": "06.10.2025 (Bekanntmachungsdatum)\n\nHamburg Amtsgericht Hamburg HRB 137510\nRegisterbekanntmachung nach dem Umwandlungsgesetz 06.10.2025 (Eintragungsdatum)\n\nBREMER Nord GmbH\nGesellschaft mit beschränkter Haftung\nHamburg\n\nAls nicht eingetragen wird bekannt gemacht:\nDen Gläubigern der an der Verschmelzung beteiligten Gesellschaften ist, wenn sie binnen sechs Monaten nach dem Tag, an dem die Eintragung der Verschmelzung in das Register des Sitzes desjenigen Rechtsträgers, dessen Gläubiger sie sind, nach § 19 Absatz 3 UmwG als bekannt gemacht gilt, ihren Anspruch nach Grund und Höhe schriftlich anmelden, Sicherheit zu leisten, soweit sie nicht Befriedigung verlangen können. Dieses Recht steht den Gläubigern jedoch nur zu, wenn sie glaubhaft machen, dass durch die Verschmelzung die Erfüllung ihrer Forderung gefährdet wird."
    },
    {
      "date": "2025-10-06",
      "id": "132639",
      "original_text": "Sonstige Registerbekanntmachung\nBaden-Württemberg Amtsgericht Ulm HRB 1315\nGARDENA Manufacturing GmbH – Ulm",
      "type": "Sonstige Registerbekanntmachung",
      "state": "Baden-Württemberg",
      "amtsgericht": "Amtsgericht Ulm",
      "registernummer": "HRB 1315",
      "registerart": "HRB",
      "company_name": "GARDENA Manufacturing GmbH",
      "company_seat": "Ulm",
      "details": "06.10.2025 (Bekanntmachungsdatum)\n\nBaden-Württemberg Amtsgericht Ulm HRB 1315\nSonstige Registerbekanntmachung 06.10.2025 (Eintragungsdatum)\n\nGARDENA Manufacturing GmbH\nGesellschaft mit beschränkter Haftung\nUlm\n\nAls nicht eingetragen wird bekanntgemacht:\nDie Gesellschaft hat am 29.09.2025 die Liste über die Zusammensetzung des Aufsichtsrates zum Handelsregister eingereicht."
    },
    {
      "date": "2025-10-06",
      "id": "132640",
      "original_text": "Löschungsankündigung\nBaden-Württemberg Amtsgericht Stuttgart HRB 737635\nBE.ST PROJECT UG (haftungsbeschränkt) – Esslingen am Neckar",
      "type": "Löschungsankündigung",
      "state": "Baden-Württemberg",
      "amtsgericht": "Amtsgericht Stuttgart",
      "registernummer": "HRB 737635",
      "registerart": "HRB",
      "company_name": "BE.ST PROJECT UG (haftungsbeschränkt)",
      "company_seat": "Esslingen am Neckar",
      "details": "06.10.2025 (Bekanntmachungsdatum)\n\nBaden-Württemberg Amtsgericht Stuttgart HRB 737635\nLöschungsankündigung\n\nBE.ST PROJECT UG (haftungsbeschränkt)\nGesellschaft mit beschränkter Haftung\nEsslingen am Neckar\n\nAls nicht eingetragen wird bekanntgemacht:\nDas Gericht beabsichtigt, die Gesellschaft wegen Vermögenslosigkeit im Handelsregister von Amts wegen nach § 394 FamFG zu löschen. Die Frist zur Geltendmachung eines Widerspruchs gegen die beabsichtigte Löschung ist auf zwei Monate ab Veröffentlichung bestimmt."
    },
    {
      "date": "2025-10-06",
      "id": "132641",
      "original_text": "Löschungsankündigung\nBaden-Württemberg Amtsgericht Mannheim HRB 723658\nLIVARS GmbH – Mannheim",
      "type": "Löschungsankündigung",
      "state": "Baden-Württemberg",
      "amtsgericht": "Amtsgericht Mannheim",
      "registernummer": "HRB 723658",
      "registerart": "HRB",
      "company_name": "LIVARS GmbH",
      "company_seat": "Mannheim",
      "details": "06.10.2025 (Bekanntmachungsdatum)\n\nBaden-Württemberg Amtsgericht Mannheim HRB 723658\nLöschungsankündigung\n\nLIVARS GmbH\nGesellschaft mit beschränkter Haftung\nMannheim\n\nAls nicht eingetragen wird bekanntgemacht: Das Gericht beabsichtigt, die Eintragung des Geschäftsführers im Handelsregister wegen des Mangels einer wesentlichen Voraussetzung von Amts wegen nach § 395 FamFG als unzulässig zu löschen. Die Frist zur Geltendmachung eines Widerspruchs gegen die beabsichtigte Löschung ist auf einen Monat ab Veröffentlichung bestimmt."
    },
    {
      "date": "2025-10-06",
      "id": "132642",
      "original_text": "Einreichung neuer Dokumente\nBrandenburg Amtsgericht Potsdam HRB 25819\nPHI Grundbesitz AG – Teltow",
      "type": "Einreichung neuer Dokumente",
      "state": "Brandenburg",
      "amtsgericht": "Amtsgericht Potsdam",
      "registernummer": "HRB 25819",
      "registerart": "HRB",
      "company_name": "PHI Grundbesitz AG",
      "company_seat": "Teltow",
      "details": "06.10.2025 (Bekanntmachungsdatum)\n\nBrandenburg Amtsgericht Potsdam HRB 25819\nEinreichung neuer Dokumente\n\nPHI Grundbesitz AG\nAktiengesellschaft\nTeltow\n\nAls nicht eingetragen wird veröffentlicht: Eine Liste der Mitglieder des Aufsichtsrates wurde zum Handelsregister eingereicht."
    },
    {
      "date": "2025-10-06",
      "id": "132643",
      "original_text": "Löschungsankündigung\nBerlin Amtsgericht Berlin (Charlottenburg) HRB 229419\nOnlyOne - Sonnenallee 55 GmbH – Berlin",
      "type": "Löschungsankündigung",
      "state": "Berlin",
      "amtsgericht": "Amtsgericht Berlin (Charlottenburg)",
      "registernummer": "HRB 229419",
      "registerart": "HRB",
      "company_name": "OnlyOne - Sonnenallee 55 GmbH",
      "company_seat": "Berlin",
      "details": "06.10.2025 (Bekanntmachungsdatum)\n\nBerlin Amtsgericht Berlin (Charlottenburg) HRB 229419\nLöschungsankündigung\n\nOnlyOne - Sonnenallee 55 GmbH\nGesellschaft mit beschränkter Haftung\nBerlin\n\nBei der nachstehenden Gesellschaft wird das Amtslöschungsverfahren gemäß § 394 FamFG eingeleitet. Widerspruchsfrist 6 Wochen"
    },
    {
      "date": "2025-10-06",
      "id": "132644",
      "original_text": "Registerbekanntmachung nach dem Umwandlungsgesetz\nBaden-Württemberg Amtsgericht Ulm HRB 750349\nZerspanungstechnik Pareth GmbH – Argenbühl",
      "type": "Registerbekanntmachung nach dem Umwandlungsgesetz",
      "state": "Baden-Württemberg",
      "amtsgericht": "Amtsgericht Ulm",
      "registernummer": "HRB 750349",
      "registerart": "HRB",
      "company_name": "Zerspanungstechnik Pareth GmbH",
      "company_seat": "Argenbühl",
      "details": "06.10.2025 (Bekanntmachungsdatum)\n\nBaden-Württemberg Amtsgericht Ulm HRB 750349\nRegisterbekanntmachung nach dem Umwandlungsgesetz 06.10.2025 (Eintragungsdatum)\n\nZerspanungstechnik Pareth GmbH\nGesellschaft mit beschränkter Haftung\nArgenbühl\n\nAls nicht eingetragen wird bekanntgemacht:\nDen Gläubigern der an der Ausgliederung beteiligten Rechtsträger ist, wenn sie binnen sechs Monaten nach dem Tag, an dem die Eintragung der Ausgliederung in das Register des Sitzes desjenigen Rechtsträgers, dessen Gläubiger sie sind, nach § 19 Abs. 3 UmwG als bekanntgemacht gilt, ihren Anspruch nach Grund und Höhe schriftlich anmelden, Sicherheit zu leisten, soweit sie nicht Befriedigung verlangen können. Dieses Recht steht den Gläubigern jedoch nur zu, wenn sie glaubhaft machen, dass durch die Ausgliederung die Erfüllung ihrer Forderung gefährdet wird."
    },
    {
      "date": "2025-10-06",
      "id": "132645",
      "original_text": "Registerbekanntmachung nach dem Umwandlungsgesetz\nBaden-Württemberg Amtsgericht Ulm HRA 729768\nDaniel Pareth Zerspanungstechnik e.K. – Argenbühl",
      "type": "Registerbekanntmachung nach dem Umwandlungsgesetz",
      "state": "Baden-Württemberg",
      "amtsgericht": "Amtsgericht Ulm",
      "registernummer": "HRA 729768",
      "registerart": "HRA",
      "company_name": "Daniel Pareth Zerspanungstechnik e.K.",
      "company_seat": "Argenbühl",
      "details": "06.10.2025 (Bekanntmachungsdatum)\n\nBaden-Württemberg Amtsgericht Ulm HRA 729768\nRegisterbekanntmachung nach dem Umwandlungsgesetz 06.10.2025 (Eintragungsdatum)\n\nDaniel Pareth Zerspanungstechnik e.K.\nEinzelkaufmann / Einzelkauffrau\nArgenbühl\n\nAls nicht eingetragen wird bekanntgemacht:\nDen Gläubigern der an der Ausgliederung beteiligten Rechtsträger ist, wenn sie binnen sechs Monaten nach dem Tag, an dem die Eintragung der Ausgliederung in das Register des Sitzes desjenigen Rechtsträgers, dessen Gläubiger sie sind, nach § 19 Abs. 3 UmwG als bekanntgemacht gilt, ihren Anspruch nach Grund und Höhe schriftlich anmelden, Sicherheit zu leisten, soweit sie nicht Befriedigung verlangen können. Dieses Recht steht den Gläubigern jedoch nur zu, wenn sie glaubhaft machen, dass durch die Ausgliederung die Erfüllung ihrer Forderung gefährdet wird."
    },
    {
      "date": "2025-10-06",
      "id": "132646",
      "original_text": "Einreichung neuer Dokumente\nHamburg Amtsgericht Hamburg HRB 87512\nVattenfall Europe Sales GmbH – Hamburg",
      "type": "Einreichung neuer Dokumente",
      "state": "Hamburg",
      "amtsgericht": "Amtsgericht Hamburg",
      "registernummer": "HRB 87512",
      "registerart": "HRB",
      "company_name": "Vattenfall Europe Sales GmbH",
      "company_seat": "Hamburg",
      "details": "06.10.2025 (Bekanntmachungsdatum)\n\nHamburg Amtsgericht Hamburg HRB 87512\nEinreichung neuer Dokumente 02.10.2025 (Eintragungsdatum)\n\nVattenfall Europe Sales GmbH\nGesellschaft mit beschränkter Haftung\nHamburg\n\nAls nicht eingetragen wird bekannt gemacht: Liste des Aufsichtsrats wurde eingereicht."
    },
    {
      "date": "2025-10-06",
      "id": "132647",
      "original_text": "Löschungsankündigung\nBerlin Amtsgericht Berlin (Charlottenburg) HRB 107680\nGRÜEZI Commercial Properties GmbH – Berlin",
      "type": "Löschungsankündigung",
      "state": "Berlin",
      "amtsgericht": "Amtsgericht Berlin (Charlottenburg)",
      "registernummer": "HRB 107680",
      "registerart": "HRB",
      "company_name": "GRÜEZI Commercial Properties GmbH",
      "company_seat": "Berlin",
      "details": "06.10.2025 (Bekanntmachungsdatum)\n\nBerlin Amtsgericht Berlin (Charlottenburg) HRB 107680\nLöschungsankündigung\n\nGRÜEZI Commercial Properties GmbH\nGesellschaft mit beschränkter Haftung\nBerlin\n\nBei der nachstehenden Gesellschaft wird das Amtslöschungsverfahren gemäß § 394 FamFG eingeleitet. Widerspruchsfrist 6 Wochen"
    },
    {
      "date": "2025-10-06",
      "id": "132648",
      "original_text": "Löschungsankündigung\nSchleswig-Holstein Amtsgericht Lübeck HRB 22654\nSaniertechnik Nord UG (haftungsbeschränkt) – Sereetz",
      "type": "Löschungsankündigung",
      "state": "Schleswig-Holstein",
      "amtsgericht": "Amtsgericht Lübeck",
      "registernummer": "HRB 22654",
      "registerart": "HRB",
      "company_name": "Saniertechnik Nord UG (haftungsbeschränkt)",
      "company_seat": "Sereetz",
      "details": "06.10.2025 (Bekanntmachungsdatum)\n\nSchleswig-Holstein Amtsgericht Lübeck HRB 22654\nLöschungsankündigung\n\nSaniertechnik Nord UG (haftungsbeschränkt)\nGesellschaft mit beschränkter Haftung\nSereetz\n\nEs ist die Löschung der nachstehenden Gesellschaft wegen Vermögenslosigkeit gemäß § 394 FamFG beabsichtigt. Widerspruchsfrist: 1 Monat."
    },
    {
      "date": "2025-10-06",
      "id": "132649",
      "original_text": "Registerbekanntmachung nach dem Umwandlungsgesetz\nBaden-Württemberg Amtsgericht Freiburg HRA 709230\nHans-Joachim Willam Baumaschinen e. K. – Singen Hohentwiel",
      "type": "Registerbekanntmachung nach dem Umwandlungsgesetz",
      "state": "Baden-Württemberg",
      "amtsgericht": "Amtsgericht Freiburg",
      "registernummer": "HRA 709230",
      "registerart": "HRA",
      "company_name": "Hans-Joachim Willam Baumaschinen e. K.",
      "company_seat": "Singen Hohentwiel",
      "details": "06.10.2025 (Bekanntmachungsdatum)\n\nBaden-Württemberg Amtsgericht Freiburg HRA 709230\nRegisterbekanntmachung nach dem Umwandlungsgesetz 06.10.2025 (Eintragungsdatum)\n\nHans-Joachim Willam Baumaschinen e. K.\nEinzelkaufmann / Einzelkauffrau\nSingen Hohentwiel\n\nAls nicht eingetragen wird bekanntgemacht:\nDen Gläubigern der an der Ausgliederung beteiligten Rechtsträger ist, wenn sie binnen sechs Monaten nach dem Tag, an dem die Eintragung der Ausgliederung in das Register des Sitzes desjenigen Rechtsträgers, dessen Gläubiger sie sind, nach § 19 Abs. 3 UmwG als bekanntgemacht gilt, ihren Anspruch nach Grund und Höhe schriftlich anmelden, Sicherheit zu leisten, soweit sie nicht Befriedigung verlangen können. Dieses Recht steht den Gläubigern jedoch nur zu, wenn sie glaubhaft machen, dass durch die Ausgliederung die Erfüllung ihrer Forderung gefährdet wird."
    },
    {
      "date": "2025-10-06",
      "id": "132650",
      "original_text": "Registerbekanntmachung nach dem Umwandlungsgesetz\nMecklenburg-Vorpommern Amtsgericht Schwerin HRA 4810\nHardtke Moden e.Kfr. – Schwerin",
      "type": "Registerbekanntmachung nach dem Umwandlungsgesetz",
      "state": "Mecklenburg-Vorpommern",
      "amtsgericht": "Amtsgericht Schwerin",
      "registernummer": "HRA 4810",
      "registerart": "HRA",
      "company_name": "Hardtke Moden e.Kfr.",
      "company_seat": "Schwerin",
      "details": "06.10.2025 (Bekanntmachungsdatum)\n\nMecklenburg-Vorpommern Amtsgericht Schwerin HRA 4810\nRegisterbekanntmachung nach dem Umwandlungsgesetz 06.10.2025 (Eintragungsdatum)\n\nHardtke Moden e.Kfr.\nEinzelkaufmann / Einzelkauffrau\nSchwerin\n\nAls nicht eingetragen wird veröffentlicht: Den Gläubigern der an der Verschmelzung beteiligten Rechtsträger ist, wenn sie binnen sechs Monaten nach dem Tag, an dem die Eintragung der Verschmelzung in das Register des Sitzes desjenigen Rechtsträgers, dessen Gläubiger sie sind, nach § 19 Abs. 3 UmwG als bekannt gemacht gilt,\nihren Anspruch nach Grund und Höhe in Textform anmelden, Sicherheit zu leisten, soweit sie nicht Befriedigung verlangen können. Dieses Recht steht den Gläubigern jedoch nur zu, wenn sie glaubhaft machen, dass durch die Verschmelzung die Erfüllung der Forderung gefährdet wird."
    },
    {
      "date": "2025-10-06",
      "id": "132651",
      "original_text": "Registerbekanntmachung nach dem Umwandlungsgesetz\nSaarland Amtsgericht Saarbrücken HRB 111207\nGreen Future E-Commerce GmbH – Saarbrücken",
      "type": "Registerbekanntmachung nach dem Umwandlungsgesetz",
      "state": "Saarland",
      "amtsgericht": "Amtsgericht Saarbrücken",
      "registernummer": "HRB 111207",
      "registerart": "HRB",
      "company_name": "Green Future E-Commerce GmbH",
      "company_seat": "Saarbrücken",
      "details": "06.10.2025 (Bekanntmachungsdatum)\n\nSaarland Amtsgericht Saarbrücken HRB 111207\nRegisterbekanntmachung nach dem Umwandlungsgesetz\n\nGreen Future E-Commerce GmbH\nGesellschaft mit beschränkter Haftung\nSaarbrücken\n\nDem Registergericht ist der Entwurf eines Verschmelzungsplanes über die geplante Verschmelzung der beslotenen vennootschap nach niederländischem Recht unter der Firma Feelgood Shop B.V. mit Sitz in Eindhoven, Niederlande (Handelsregister van de Kamer van Koophandel Nederland Nr. 17215662) mit der Gesellschaft mit beschränkter Haftung nach deutschem Recht unter der Firma Green Futue E-Commerce GmbH mit Sitz in Saarbrücken (HRB 111207) eingereicht worden.\nDen Gläubigern der an der Verschmelzung beteiligten Rechtsträger ist Sicherheit zu leisten, sofern sie ihren Anspruch unter Angabe des Rechtsgrundes und der Höhe innerhalb von sechs Monaten nach dem Tag, an die Eintragung der Verschmelzung im Handelsregister am Sitz der Green Future E-Commerce GmbH als bekannt gemacht gilt (§ 305, § 19 Abs. 3 UmwG), schriftlich anmelden. Gläubiger sind zu diesem Recht berechtigt, wenn sie glaubhaft machen, dass die Erfüllung ihrer Forderungen durch die Verschmelzung gefährdet wird.Hinsichtlich der übertragenden Gesellschaft richten sich die Rechte der Gläubiger nach 2:16 DCC.\nDie vollständigen Auskünfte über diese Modalitäten können beim Sitz jeder verschmelzenden Gesellschaft kostenlos eingeholt werden."
    },
    {
      "date": "2025-10-06",
      "id": "132652",
      "original_text": "Löschungsankündigung\nBerlin Amtsgericht Berlin (Charlottenburg) HRB 113003\nGRÜEZI Investment Properties GmbH – Berlin",
      "type": "Löschungsankündigung",
      "state": "Berlin",
      "amtsgericht": "Amtsgericht Berlin (Charlottenburg)",
      "registernummer": "HRB 113003",
      "registerart": "HRB",
      "company_name": "GRÜEZI Investment Properties GmbH",
      "company_seat": "Berlin",
      "details": "06.10.2025 (Bekanntmachungsdatum)\n\nBerlin Amtsgericht Berlin (Charlottenburg) HRB 113003\nLöschungsankündigung\n\nGRÜEZI Investment Properties GmbH\nGesellschaft mit beschränkter Haftung\nBerlin\n\nBei der nachstehenden Gesellschaft wird das Amtslöschungsverfahren gemäß § 394 FamFG eingeleitet. Widerspruchsfrist 6 Wochen"
    },
    {
      "date": "2025-10-06",
      "id": "132653",
      "original_text": "Registerbekanntmachung nach dem Umwandlungsgesetz\nBaden-Württemberg Amtsgericht Stuttgart HRA 742416\nQuartiermanager - Ines Scholtz e. K. – Gärtringen",
      "type": "Registerbekanntmachung nach dem Umwandlungsgesetz",
      "state": "Baden-Württemberg",
      "amtsgericht": "Amtsgericht Stuttgart",
      "registernummer": "HRA 742416",
      "registerart": "HRA",
      "company_name": "Quartiermanager - Ines Scholtz e. K.",
      "company_seat": "Gärtringen",
      "details": "06.10.2025 (Bekanntmachungsdatum)\n\nBaden-Württemberg Amtsgericht Stuttgart HRA 742416\nRegisterbekanntmachung nach dem Umwandlungsgesetz 06.10.2025 (Eintragungsdatum)\n\nQuartiermanager - Ines Scholtz e. K.\nEinzelkaufmann / Einzelkauffrau\nGärtringen\n\nAls nicht eingetragen wird bekanntgemacht:\nDen Gläubigern der an der Ausgliederung beteiligten Rechtsträger ist, wenn sie binnen sechs Monaten nach dem Tag, an dem die Eintragung der Ausgliederung in das Register des Sitzes desjenigen Rechtsträgers, dessen Gläubiger sie sind, nach § 19 Abs. 3 UmwG als bekanntgemacht gilt, ihren Anspruch nach Grund und Höhe schriftlich anmelden, Sicherheit zu leisten, soweit sie nicht Befriedigung verlangen können. Dieses Recht steht den Gläubigern jedoch nur zu, wenn sie glaubhaft machen, dass durch die Ausgliederung die Erfüllung ihrer Forderung gefährdet wird."
    },
    {
      "date": "2025-10-06",
      "id": "132654",
      "original_text": "Registerbekanntmachung nach dem Umwandlungsgesetz\nBaden-Württemberg Amtsgericht Freiburg HRA 709265\nW & W Baumaschinen GmbH & Co. KG – Singen Hohentwiel",
      "type": "Registerbekanntmachung nach dem Umwandlungsgesetz",
      "state": "Baden-Württemberg",
      "amtsgericht": "Amtsgericht Freiburg",
      "registernummer": "HRA 709265",
      "registerart": "HRA",
      "company_name": "W & W Baumaschinen GmbH & Co. KG",
      "company_seat": "Singen Hohentwiel",
      "details": "06.10.2025 (Bekanntmachungsdatum)\n\nBaden-Württemberg Amtsgericht Freiburg HRA 709265\nRegisterbekanntmachung nach dem Umwandlungsgesetz 06.10.2025 (Eintragungsdatum)\n\nW & W Baumaschinen GmbH & Co. KG\nKommanditgesellschaft\nSingen Hohentwiel\n\nAls nicht eingetragen wird bekanntgemacht:\nDen Gläubigern der an der Ausgliederung beteiligten Rechtsträger ist, wenn sie binnen sechs Monaten nach dem Tag, an dem die Eintragung der Ausgliederung in das Register des Sitzes desjenigen Rechtsträgers, dessen Gläubiger sie sind, nach § 19 Abs. 3 UmwG als bekanntgemacht gilt, ihren Anspruch nach Grund und Höhe schriftlich anmelden, Sicherheit zu leisten, soweit sie nicht Befriedigung verlangen können. Dieses Recht steht den Gläubigern jedoch nur zu, wenn sie glaubhaft machen, dass durch die Ausgliederung die Erfüllung ihrer Forderung gefährdet wird.\n\nHRA 709265"
    },
    {
      "date": "2025-10-06",
      "id": "132655",
      "original_text": "Löschungsankündigung\nBerlin Amtsgericht Berlin (Charlottenburg) HRB 249775\nFS Baumanagement GmbH – Berlin",
      "type": "Löschungsankündigung",
      "state": "Berlin",
      "amtsgericht": "Amtsgericht Berlin (Charlottenburg)",
      "registernummer": "HRB 249775",
      "registerart": "HRB",
      "company_name": "FS Baumanagement GmbH",
      "company_seat": "Berlin",
      "details": "06.10.2025 (Bekanntmachungsdatum)\n\nBerlin Amtsgericht Berlin (Charlottenburg) HRB 249775\nLöschungsankündigung\n\nFS Baumanagement GmbH\nGesellschaft mit beschränkter Haftung\nBerlin\n\nBei der nachstehenden Gesellschaft wird das Amtslöschungsverfahren gemäß § 394 FamFG eingeleitet. Widerspruchsfrist 6 Wochen"
    },
    {
      "date": "2025-10-06",
      "id": "132656",
      "original_text": "Registerbekanntmachung nach dem Umwandlungsgesetz\nBaden-Württemberg Amtsgericht Mannheim HRB 755902\nNIK WAHL GmbH – Mannheim",
      "type": "Registerbekanntmachung nach dem Umwandlungsgesetz",
      "state": "Baden-Württemberg",
      "amtsgericht": "Amtsgericht Mannheim",
      "registernummer": "HRB 755902",
      "registerart": "HRB",
      "company_name": "NIK WAHL GmbH",
      "company_seat": "Mannheim",
      "details": "06.10.2025 (Bekanntmachungsdatum)\n\nBaden-Württemberg Amtsgericht Mannheim HRB 755902\nRegisterbekanntmachung nach dem Umwandlungsgesetz 06.10.2025 (Eintragungsdatum)\n\nNIK WAHL GmbH\nGesellschaft mit beschränkter Haftung\nMannheim\n\nDen Gläubigern des an dem Formwechsel beteiligten Rechtsträgers ist, wenn sie binnen sechs Monaten nach dem Tag, an dem die Eintragung des Formwechsels in das Register des Sitzes desjenigen Rechtsträgers, dessen Gläubiger sie sind, nach § 19 Abs. 3 UmwG als bekanntgemacht gilt, ihren Anspruch nach Grund und Höhe schriftlich anmelden, Sicherheit zu leisten, soweit sie nicht Befriedigung verlangen können. Dieses Recht steht den Gläubigern jedoch nur zu, wenn sie glaubhaft machen, dass durch den Formwechsel die Erfüllung ihrer Forderung gefährdet wird."
    },
    {
      "date": "2025-10-06",
      "id": "132657",
      "original_text": "Registerbekanntmachung nach dem Umwandlungsgesetz\nNordrhein-Westfalen Amtsgericht Coesfeld HRA 10029\nTischlerei/CNC Thomas Cluse e.K. – Borken",
      "type": "Registerbekanntmachung nach dem Umwandlungsgesetz",
      "state": "Nordrhein-Westfalen",
      "amtsgericht": "Amtsgericht Coesfeld",
      "registernummer": "HRA 10029",
      "registerart": "HRA",
      "company_name": "Tischlerei/CNC Thomas Cluse e.K.",
      "company_seat": "Borken",
      "details": "06.10.2025 (Bekanntmachungsdatum)\n\nNordrhein-Westfalen Amtsgericht Coesfeld HRA 10029\nRegisterbekanntmachung nach dem Umwandlungsgesetz\n\nTischlerei/CNC Thomas Cluse e.K.\nEinzelkaufmann\nBorken\n\nDen Gläubigern der an der Ausgliederung beteiligten Rechtsträger ist, wenn sie binnen sechs Monaten nach dem Tag, an dem die Eintragung der Ausgliederung in das Register des Sitzes derjenigen Rechtsträger deren Gläubiger sie sind, nach § 19 Absatz 3 UmwG als bekanntgemacht gilt, ihren Anspruch nach Grund und Höhe schriftlich anmelden, Sicherheit zu leisten, soweit sie nicht Befriedigung verlangen können. Dieses Recht steht den Gläubigern jedoch nur zu, wenn sie glaubhaft machen, dass durch die Ausgliederung die Erfüllung ihrer Forderung gefährdet wird."
    },
    {
      "date": "2025-10-06",
      "id": "132658",
      "original_text": "Löschungsankündigung\nSaarland Amtsgericht Saarbrücken HRB 105087\nMOSI PM GmbH – Saarbrücken",
      "type": "Löschungsankündigung",
      "state": "Saarland",
      "amtsgericht": "Amtsgericht Saarbrücken",
      "registernummer": "HRB 105087",
      "registerart": "HRB",
      "company_name": "MOSI PM GmbH",
      "company_seat": "Saarbrücken",
      "details": "06.10.2025 (Bekanntmachungsdatum)\n\nSaarland Amtsgericht Saarbrücken HRB 105087\nLöschungsankündigung\n\nMOSI PM GmbH\nGesellschaft mit beschränkter Haftung\nSaarbrücken\n\nEs ist beabsichtigt, die Gesellschaft von Amts wegen gemäß § 394 FamFG wegen Vermögenslosigkeit zu löschen.\nGegen die Löschung von Amts wegen ist das Rechtsmittel des Widerspruchs statthaft. Der Widerspruch ist binnen einer Frist zwei Monaten beginnend mit dem Tag dieser Veröffentlichung durch Einreichen eines Widerspruchsschreibens -schriftlich oder zur Niederschrift der Geschäftsstelle beim Amtsgericht Saarbrücken, -zentrales Handelsregister-, Mainzerstr.178, 66121 Saarbrücken einzulegen.\nDer Widerspruch muss die Bezeichnung der angefochtenen Löschungsankündigung enthalten sowie die Erklärung, dass Widerspruch eingelegt wird. Er ist vom Widerspruchsführer oder seinem Bevollmächtigten zu unterzeichnen.\nDas Widerspruchsschreiben kann auch in der Form eines elektronischen Dokumentes eingereicht werden, das mit einer qualifizierten elektronischen Signatur nach dem Signaturgesetz versehen sein muss (§§ 14 Abs. 2 FamFG, 130a, 298 ZPO)."
    },
    {
      "date": "2025-10-06",
      "id": "132659",
      "original_text": "Einreichung neuer Dokumente\nBerlin Amtsgericht Berlin (Charlottenburg) HRB 106747\nDahlke Vermögensverwaltungs AG – Berlin",
      "type": "Einreichung neuer Dokumente",
      "state": "Berlin",
      "amtsgericht": "Amtsgericht Berlin (Charlottenburg)",
      "registernummer": "HRB 106747",
      "registerart": "HRB",
      "company_name": "Dahlke Vermögensverwaltungs AG",
      "company_seat": "Berlin",
      "details": "06.10.2025 (Bekanntmachungsdatum)\n\nBerlin Amtsgericht Berlin (Charlottenburg) HRB 106747\nEinreichung neuer Dokumente\n\nDahlke Vermögensverwaltungs AG\nAktiengesellschaft\nBerlin\n\nAls nicht eingetragen wird veröffentlicht:\n\nEs wurde eine neue Liste der Aufsichtsratsmitglieder eingereicht (§ 106 AktG)."
    },
    {
      "date": "2025-10-06",
      "id": "132660",
      "original_text": "Registerbekanntmachung nach dem Umwandlungsgesetz\nBerlin Amtsgericht Berlin (Charlottenburg) HRB 235126\nuncharted 39 UG (haftungsbeschränkt) – Berlin",
      "type": "Registerbekanntmachung nach dem Umwandlungsgesetz",
      "state": "Berlin",
      "amtsgericht": "Amtsgericht Berlin (Charlottenburg)",
      "registernummer": "HRB 235126",
      "registerart": "HRB",
      "company_name": "uncharted 39 UG (haftungsbeschränkt)",
      "company_seat": "Berlin",
      "details": "06.10.2025 (Bekanntmachungsdatum)\n\nBerlin Amtsgericht Berlin (Charlottenburg) HRB 235126\nRegisterbekanntmachung nach dem Umwandlungsgesetz 30.09.2025 (Eintragungsdatum)\n\nuncharted 39 UG (haftungsbeschränkt)\nGesellschaft mit beschränkter Haftung\nBerlin\n\nZu Eintragungsnummer 3 vom 30.09.2025 wird als nicht eingetragen veröffentlicht: Den Gläubigern der an der Verschmelzung beteiligten Rechtsträger ist, wenn sie binnen sechs Monaten nach dem Tag, an dem die Eintragung der Verschmelzung in das Register des Sitzes desjenigen Rechtsträgers, dessen Gläubiger sie sind, als bekannt gemacht gilt, ihren Anspruch nach Grund und Höhe schriftlich anmelden, Sicherheit zu leisten, soweit sie nicht Befriedigung verlangen können. Dieses Recht steht den Gläubigern jedoch nur zu, wenn sie glaubhaft machen, dass durch die Verschmelzung die Erfüllung ihrer Forderung gefährdet wird. Das Recht, Sicherheitsleistung zu verlangen, steht Gläubigern nicht zu, die im Falle der Insolvenz ein Recht auf vorzugsweise Befriedigung aus einer Deckungsmasse haben, die nach gesetzlicher Vorschrift zu ihrem Schutz errichtet und staatlich überwacht ist."
    },
    {
      "date": "2025-10-06",
      "id": "132661",
      "original_text": "Löschungsankündigung\nThüringen Amtsgericht Jena GnR 100188\nTierproduktion Weißensee e.G. – Weißensee",
      "type": "Löschungsankündigung",
      "state": "Thüringen",
      "amtsgericht": "Amtsgericht Jena",
      "registernummer": "GnR 100188",
      "registerart": "GnR",
      "company_name": "Tierproduktion Weißensee e.G.",
      "company_seat": "Weißensee",
      "details": "06.10.2025 (Bekanntmachungsdatum)\n\nThüringen Amtsgericht Jena GnR 100188\nLöschungsankündigung\n\nTierproduktion Weißensee e.G.\neingetragene Genossenschaft\nWeißensee\n\nDas Registergericht beabsichtigt, die im Handelsregister eingetragene Gesellschaft wegen Vermögenslosigkeit nach § 394 FamFG von Amts wegen zu löschen. Die Frist zur Erhebung eines Widerspruchs gegen die beabsichtigte Löschung wird auf 6 Wochen festgesetzt."
    },
    {
      "date": "2025-10-06",
      "id": "132662",
      "original_text": "Einreichung neuer Dokumente\nThüringen Amtsgericht Jena HRB 515875\ndreistrom.land AG – Jena",
      "type": "Einreichung neuer Dokumente",
      "state": "Thüringen",
      "amtsgericht": "Amtsgericht Jena",
      "registernummer": "HRB 515875",
      "registerart": "HRB",
      "company_name": "dreistrom.land AG",
      "company_seat": "Jena",
      "details": "06.10.2025 (Bekanntmachungsdatum)\n\nThüringen Amtsgericht Jena HRB 515875\nEinreichung neuer Dokumente\n\ndreistrom.land AG\nAktiengesellschaft\nJena\n\nBekanntmachung gem. § 106 AktG: Aufgrund einer Veränderung in den Personen der Aufsichtsratsmitglieder ist durch den Vorstand eine neue Liste zum Handelsregister eingereicht worden."
    },
    {
      "date": "2025-10-06",
      "id": "132663",
      "original_text": "Löschungsankündigung\nThüringen Amtsgericht Jena HRB 512638\nD. Möschen UG (haftungsbeschränkt) – Holzsußra",
      "type": "Löschungsankündigung",
      "state": "Thüringen",
      "amtsgericht": "Amtsgericht Jena",
      "registernummer": "HRB 512638",
      "registerart": "HRB",
      "company_name": "D. Möschen UG (haftungsbeschränkt)",
      "company_seat": "Holzsußra",
      "details": "06.10.2025 (Bekanntmachungsdatum)\n\nThüringen Amtsgericht Jena HRB 512638\nLöschungsankündigung\n\nD. Möschen UG (haftungsbeschränkt)\nGesellschaft mit beschränkter Haftung\nHolzsußra\n\nDas Registergericht beabsichtigt, die im Handelsregister eingetragene Gesellschaft wegen Vermögenslosigkeit nach § 394 FamFG von Amts wegen zu löschen. Die Frist zur Erhebung eines Widerspruchs gegen die beabsichtigte Löschung wird auf 6 Wochen festgesetzt."
    },
    {
      "date": "2025-10-06",
      "id": "132664",
      "original_text": "Registerbekanntmachung nach dem Umwandlungsgesetz\nHamburg Amtsgericht Hamburg HRB 110833\nDr. Möllenhoff Rechtsanwaltsgesellschaft mbH – Hamburg",
      "type": "Registerbekanntmachung nach dem Umwandlungsgesetz",
      "state": "Hamburg",
      "amtsgericht": "Amtsgericht Hamburg",
      "registernummer": "HRB 110833",
      "registerart": "HRB",
      "company_name": "Dr. Möllenhoff Rechtsanwaltsgesellschaft mbH",
      "company_seat": "Hamburg",
      "details": "06.10.2025 (Bekanntmachungsdatum)\n\nHamburg Amtsgericht Hamburg HRB 110833\nRegisterbekanntmachung nach dem Umwandlungsgesetz 06.10.2025 (Eintragungsdatum)\n\nDr. Möllenhoff Rechtsanwaltsgesellschaft mbH\nGesellschaft mit beschränkter Haftung\nHamburg\n\nAls nicht eingetragen wird bekannt gemacht:\nDen Gläubigern der an der formwechselnden Umwandlung beteiligten Gesellschaften ist, wenn sie binnen sechs Monaten nach dem Tag, an dem die Eintragung der formwechselnden Umwandlung in das Register des Sitzes desjenigen Rechtsträgers, dessen Gläubiger sie sind, nach § 19 Absatz 3 UmwG als bekannt gemacht gilt, ihren Anspruch nach Grund und Höhe schriftlich anmelden, Sicherheit zu leisten, soweit sie nicht Befriedigung verlangen können. Dieses Recht steht den Gläubigern jedoch nur zu, wenn sie glaubhaft machen, dass durch die formwechselnde Umwandlung die Erfüllung ihrer Forderung gefährdet wird."
    },
    {
      "date": "2025-10-06",
      "id": "132665",
      "original_text": "Registerbekanntmachung nach dem Umwandlungsgesetz\nHamburg Amtsgericht Hamburg HRA 132874\nDr. Möllenhoff Rechtsanwaltsgesellschaft mbH & Co. KG – Hamburg",
      "type": "Registerbekanntmachung nach dem Umwandlungsgesetz",
      "state": "Hamburg",
      "amtsgericht": "Amtsgericht Hamburg",
      "registernummer": "HRA 132874",
      "registerart": "HRA",
      "company_name": "Dr. Möllenhoff Rechtsanwaltsgesellschaft mbH & Co. KG",
      "company_seat": "Hamburg",
      "details": "06.10.2025 (Bekanntmachungsdatum)\n\nHamburg Amtsgericht Hamburg HRA 132874\nRegisterbekanntmachung nach dem Umwandlungsgesetz 06.10.2025 (Eintragungsdatum)\n\nDr. Möllenhoff Rechtsanwaltsgesellschaft mbH & Co. KG\nKommanditgesellschaft\nHamburg\n\nAls nicht eingetragen wird bekannt gemacht:\nDen Gläubigern der an der formwechselnden Umwandlung beteiligten Gesellschaften ist, wenn sie binnen sechs Monaten nach dem Tag, an dem die Eintragung der formwechselnden Umwandlung in das Register des Sitzes desjenigen Rechtsträgers, dessen Gläubiger sie sind, nach § 19 Absatz 3 UmwG als bekannt gemacht gilt, ihren Anspruch nach Grund und Höhe schriftlich anmelden, Sicherheit zu leisten, soweit sie nicht Befriedigung verlangen können. Dieses Recht steht den Gläubigern jedoch nur zu, wenn sie glaubhaft machen, dass durch die formwechselnde Umwandlung die Erfüllung ihrer Forderung gefährdet wird."
    },
    {
      "date": "2025-10-06",
      "id": "132666",
      "original_text": "Registerbekanntmachung nach dem Umwandlungsgesetz\nBerlin Amtsgericht Berlin (Charlottenburg) HRA 64106\nVahap Akpolat, Akpolat Gastro e. K. – Berlin",
      "type": "Registerbekanntmachung nach dem Umwandlungsgesetz",
      "state": "Berlin",
      "amtsgericht": "Amtsgericht Berlin (Charlottenburg)",
      "registernummer": "HRA 64106",
      "registerart": "HRA",
      "company_name": "Vahap Akpolat, Akpolat Gastro e. K.",
      "company_seat": "Berlin",
      "details": "06.10.2025 (Bekanntmachungsdatum)\n\nBerlin Amtsgericht Berlin (Charlottenburg) HRA 64106\nRegisterbekanntmachung nach dem Umwandlungsgesetz 02.10.2025 (Eintragungsdatum)\n\nVahap Akpolat, Akpolat Gastro e. K.\nEinzelkaufmann / Einzelkauffrau\nBerlin\n\nZu Eintragungsnummer 2 vom 02.10.2025 wird als nicht eingetragen veröffentlicht: Den Gläubigern der an der Spaltung beteiligten Rechtsträger ist, wenn sie binnen sechs Monaten nach dem Tag, an dem die Eintragung der Spaltung in das Register des Sitzes desjenigen Rechtsträgers, dessen Gläubiger sie sind, als bekannt gemacht gilt, ihren Anspruch nach Grund und Höhe schriftlich anmelden, Sicherheit zu leisten, soweit sie nicht Befriedigung verlangen können. Dieses Recht steht den Gläubigern jedoch nur zu, wenn sie glaubhaft machen, dass durch die Spaltung die Erfüllung ihrer Forderung gefährdet wird. Das Recht, Sicherheitsleistung zu verlangen, steht Gläubigern nicht zu, die im Falle der Insolvenz ein Recht auf vorzugsweise Befriedigung aus einer Deckungsmasse haben, die nach gesetzlicher Vorschrift zu ihrem Schutz errichtet und staatlich überwacht ist."
    },
    {
      "date": "2025-10-06",
      "id": "132667",
      "original_text": "Registerbekanntmachung nach dem Umwandlungsgesetz\nBerlin Amtsgericht Berlin (Charlottenburg) HRB 271926\nAkpolat Gastro GmbH – Berlin",
      "type": "Registerbekanntmachung nach dem Umwandlungsgesetz",
      "state": "Berlin",
      "amtsgericht": "Amtsgericht Berlin (Charlottenburg)",
      "registernummer": "HRB 271926",
      "registerart": "HRB",
      "company_name": "Akpolat Gastro GmbH",
      "company_seat": "Berlin",
      "details": "06.10.2025 (Bekanntmachungsdatum)\n\nBerlin Amtsgericht Berlin (Charlottenburg) HRB 271926\nRegisterbekanntmachung nach dem Umwandlungsgesetz 02.10.2025 (Eintragungsdatum)\n\nAkpolat Gastro GmbH\nGesellschaft mit beschränkter Haftung\nBerlin\n\nZu Eintragungsnummer 2 vom 02.10.2025 wird als nicht eingetragen veröffentlicht: Den Gläubigern der an der Spaltung beteiligten Rechtsträger ist, wenn sie binnen sechs Monaten nach dem Tag, an dem die Eintragung der Spaltung in das Register des Sitzes desjenigen Rechtsträgers, dessen Gläubiger sie sind, als bekannt gemacht gilt, ihren Anspruch nach Grund und Höhe schriftlich anmelden, Sicherheit zu leisten, soweit sie nicht Befriedigung verlangen können. Dieses Recht steht den Gläubigern jedoch nur zu, wenn sie glaubhaft machen, dass durch die Spaltung die Erfüllung ihrer Forderung gefährdet wird. Das Recht, Sicherheitsleistung zu verlangen, steht Gläubigern nicht zu, die im Falle der Insolvenz ein Recht auf vorzugsweise Befriedigung aus einer Deckungsmasse haben, die nach gesetzlicher Vorschrift zu ihrem Schutz errichtet und staatlich überwacht ist."
    },
    {
      "date": "2025-10-06",
      "id": "132668",
      "original_text": "Löschungsankündigung\nBaden-Württemberg Amtsgericht Mannheim HRB 729661\nBauwerk und Konzept Bonior UG (haftungsbeschränkt) – Mannheim",
      "type": "Löschungsankündigung",
      "state": "Baden-Württemberg",
      "amtsgericht": "Amtsgericht Mannheim",
      "registernummer": "HRB 729661",
      "registerart": "HRB",
      "company_name": "Bauwerk und Konzept Bonior UG (haftungsbeschränkt)",
      "company_seat": "Mannheim",
      "details": "06.10.2025 (Bekanntmachungsdatum)\n\nBaden-Württemberg Amtsgericht Mannheim HRB 729661\nLöschungsankündigung\n\nBauwerk und Konzept Bonior UG (haftungsbeschränkt)\nGesellschaft mit beschränkter Haftung\nMannheim\n\nAls nicht eingetragen wird bekanntgemacht:\nDas Gericht beabsichtigt, die Gesellschaft wegen Vermögenslosigkeit im Handelsregister von Amts wegen nach § 394 FamFG zu löschen. Die Frist zur Geltendmachung eines Widerspruchs gegen die beabsichtigte Löschung ist auf einen Monat ab Veröffentlichung bestimmt."
    },
    {
      "date": "2025-10-06",
      "id": "132669",
      "original_text": "Registerbekanntmachung nach dem Umwandlungsgesetz\nHamburg Amtsgericht Hamburg HRA 118835\nFernando Feeder Parent GmbH & Co. KG – Hamburg",
      "type": "Registerbekanntmachung nach dem Umwandlungsgesetz",
      "state": "Hamburg",
      "amtsgericht": "Amtsgericht Hamburg",
      "registernummer": "HRA 118835",
      "registerart": "HRA",
      "company_name": "Fernando Feeder Parent GmbH & Co. KG",
      "company_seat": "Hamburg",
      "details": "06.10.2025 (Bekanntmachungsdatum)\n\nHamburg Amtsgericht Hamburg HRA 118835\nRegisterbekanntmachung nach dem Umwandlungsgesetz 06.10.2025 (Eintragungsdatum)\n\nFernando Feeder Parent GmbH & Co. KG\nKommanditgesellschaft\nHamburg\n\nAls nicht eingetragen wird bekannt gemacht:\nDen Gläubigern der an der Verschmelzung beteiligten Gesellschaften ist, wenn sie binnen sechs Monaten nach dem Tag, an dem die Eintragung der Verschmelzung in das Register des Sitzes desjenigen Rechtsträgers, dessen Gläubiger sie sind, nach § 19 Absatz 3 UmwG als bekannt gemacht gilt, ihren Anspruch nach Grund und Höhe schriftlich anmelden, Sicherheit zu leisten, soweit sie nicht Befriedigung verlangen können. Dieses Recht steht den Gläubigern jedoch nur zu, wenn sie glaubhaft machen, dass durch die Verschmelzung die Erfüllung ihrer Forderung gefährdet wird."
    },
    {
      "date": "2025-10-06",
      "id": "132670",
      "original_text": "Registerbekanntmachung nach dem Umwandlungsgesetz\nHamburg Amtsgericht Hamburg HRA 127111\nErnst Russ Schiff II GmbH & Co. KG – Hamburg",
      "type": "Registerbekanntmachung nach dem Umwandlungsgesetz",
      "state": "Hamburg",
      "amtsgericht": "Amtsgericht Hamburg",
      "registernummer": "HRA 127111",
      "registerart": "HRA",
      "company_name": "Ernst Russ Schiff II GmbH & Co. KG",
      "company_seat": "Hamburg",
      "details": "06.10.2025 (Bekanntmachungsdatum)\n\nHamburg Amtsgericht Hamburg HRA 127111\nRegisterbekanntmachung nach dem Umwandlungsgesetz 06.10.2025 (Eintragungsdatum)\n\nErnst Russ Schiff II GmbH & Co. KG\nKommanditgesellschaft\nHamburg\n\nAls nicht eingetragen wird bekannt gemacht:\nDen Gläubigern der an der Verschmelzung beteiligten Gesellschaften ist, wenn sie binnen sechs Monaten nach dem Tag, an dem die Eintragung der Verschmelzung in das Register des Sitzes desjenigen Rechtsträgers, dessen Gläubiger sie sind, nach § 19 Absatz 3 UmwG als bekannt gemacht gilt, ihren Anspruch nach Grund und Höhe schriftlich anmelden, Sicherheit zu leisten, soweit sie nicht Befriedigung verlangen können. Dieses Recht steht den Gläubigern jedoch nur zu, wenn sie glaubhaft machen, dass durch die Verschmelzung die Erfüllung ihrer Forderung gefährdet wird."
    },
    {
      "date": "2025-10-06",
      "id": "132671",
      "original_text": "Registerbekanntmachung nach dem Umwandlungsgesetz\nBerlin Amtsgericht Berlin (Charlottenburg) HRB 162373\nFinanzchecks IFB GmbH – Berlin",
      "type": "Registerbekanntmachung nach dem Umwandlungsgesetz",
      "state": "Berlin",
      "amtsgericht": "Amtsgericht Berlin (Charlottenburg)",
      "registernummer": "HRB 162373",
      "registerart": "HRB",
      "company_name": "Finanzchecks IFB GmbH",
      "company_seat": "Berlin",
      "details": "06.10.2025 (Bekanntmachungsdatum)\n\nBerlin Amtsgericht Berlin (Charlottenburg) HRB 162373\nRegisterbekanntmachung nach dem Umwandlungsgesetz 02.10.2025 (Eintragungsdatum)\n\nFinanzchecks IFB GmbH\nGesellschaft mit beschränkter Haftung\nBerlin\n\nZu Eintragungsnummer 5 vom 02.10.2025 wird als nicht eingetragen veröffentlicht: Den Gläubigern ist, wenn sie binnen sechs Monaten nach dem Tag, an dem die Eintragung der Umwandlung als bekannt gemacht gilt, ihren Anspruch nach Grund und Höhe schriftlich anmelden, Sicherheit zu leisten, soweit sie nicht Befriedigung verlangen können. Dieses Recht steht den Gläubigern jedoch nur zu, wenn sie glaubhaft machen, dass durch die Umwandlung die Erfüllung ihrer Forderung gefährdet wird. Das Recht, Sicherheitsleistung zu verlangen, steht Gläubigern nicht zu, die im Falle der Insolvenz ein Recht auf vorzugsweise Befriedigung aus einer Deckungsmasse haben, die nach gesetzlicher Vorschrift zu ihrem Schutz errichtet und staatlich überwacht ist."
    },
    {
      "date": "2025-10-06",
      "id": "132672",
      "original_text": "Einreichung neuer Dokumente\nBerlin Amtsgericht Berlin (Charlottenburg) HRB 70200\nVINCI Construction GmbH – Berlin",
      "type": "Einreichung neuer Dokumente",
      "state": "Berlin",
      "amtsgericht": "Amtsgericht Berlin (Charlottenburg)",
      "registernummer": "HRB 70200",
      "registerart": "HRB",
      "company_name": "VINCI Construction GmbH",
      "company_seat": "Berlin",
      "details": "06.10.2025 (Bekanntmachungsdatum)\n\nBerlin Amtsgericht Berlin (Charlottenburg) HRB 70200\nEinreichung neuer Dokumente\n\nVINCI Construction GmbH\nGesellschaft mit beschränkter Haftung\nBerlin\n\nAls nicht eingetragen wird veröffentlicht:Es wurde eine neue Liste der Aufsichtsratsmitglieder eingereicht (§52 GmbHG)."
    },
    {
      "date": "2025-10-06",
      "id": "132673",
      "original_text": "Löschungsankündigung\nBerlin Amtsgericht Berlin (Charlottenburg) HRA 47327\nPOC Natural Gas 2 GmbH & Co. KG – Berlin",
      "type": "Löschungsankündigung",
      "state": "Berlin",
      "amtsgericht": "Amtsgericht Berlin (Charlottenburg)",
      "registernummer": "HRA 47327",
      "registerart": "HRA",
      "company_name": "POC Natural Gas 2 GmbH & Co. KG",
      "company_seat": "Berlin",
      "details": "06.10.2025 (Bekanntmachungsdatum)\n\nBerlin Amtsgericht Berlin (Charlottenburg) HRA 47327\nLöschungsankündigung\n\nPOC Natural Gas 2 GmbH & Co. KG\nKommanditgesellschaft\nBerlin\n\nBei dem nachstehenden Unternehmen / der nachstehenden Gesellschaft wird das Amtslöschungsverfahren gemäß § 31 Abs. 2 HGB eingeleitet. Widerspruchsfrist 1 Monat"
    },
    {
      "date": "2025-10-06",
      "id": "132674",
      "original_text": "Registerbekanntmachung nach dem Umwandlungsgesetz\nBerlin Amtsgericht Berlin (Charlottenburg) HRA 64781\nFinanzchecks IFB GmbH & Co. KG – Berlin",
      "type": "Registerbekanntmachung nach dem Umwandlungsgesetz",
      "state": "Berlin",
      "amtsgericht": "Amtsgericht Berlin (Charlottenburg)",
      "registernummer": "HRA 64781",
      "registerart": "HRA",
      "company_name": "Finanzchecks IFB GmbH & Co. KG",
      "company_seat": "Berlin",
      "details": "06.10.2025 (Bekanntmachungsdatum)\n\nBerlin Amtsgericht Berlin (Charlottenburg) HRA 64781\nRegisterbekanntmachung nach dem Umwandlungsgesetz 02.10.2025 (Eintragungsdatum)\n\nFinanzchecks IFB GmbH & Co. KG\nKommanditgesellschaft\nBerlin\n\nZu Eintragungsnummer 1 vom 02.10.2025 wird als nicht eingetragen veröffentlicht: Den Gläubigern ist, wenn sie binnen sechs Monaten nach dem Tag, an dem die Eintragung der Umwandlung als bekannt gemacht gilt, ihren Anspruch nach Grund und Höhe schriftlich anmelden, Sicherheit zu leisten, soweit sie nicht Befriedigung verlangen können. Dieses Recht steht den Gläubigern jedoch nur zu, wenn sie glaubhaft machen, dass durch die Umwandlung die Erfüllung ihrer Forderung gefährdet wird. Das Recht, Sicherheitsleistung zu verlangen, steht Gläubigern nicht zu, die im Falle der Insolvenz ein Recht auf vorzugsweise Befriedigung aus einer Deckungsmasse haben, die nach gesetzlicher Vorschrift zu ihrem Schutz errichtet und staatlich überwacht ist."
    },
    {
      "date": "2025-10-06",
      "id": "132675",
      "original_text": "Registerbekanntmachung nach dem Umwandlungsgesetz\nBrandenburg Amtsgericht Cottbus HRA 4491\nBennet Freitel - Gewerbezentrum Schönefeld e.K. – Schönefeld",
      "type": "Registerbekanntmachung nach dem Umwandlungsgesetz",
      "state": "Brandenburg",
      "amtsgericht": "Amtsgericht Cottbus",
      "registernummer": "HRA 4491",
      "registerart": "HRA",
      "company_name": "Bennet Freitel - Gewerbezentrum Schönefeld e.K.",
      "company_seat": "Schönefeld",
      "details": "06.10.2025 (Bekanntmachungsdatum)\n\nBrandenburg Amtsgericht Cottbus HRA 4491\nRegisterbekanntmachung nach dem Umwandlungsgesetz 02.10.2025 (Eintragungsdatum)\n\nBennet Freitel - Gewerbezentrum Schönefeld e.K.\nEinzelkaufmann / Einzelkauffrau\nSchönefeld\n\nZu Eintragungsnummer 2 vom 02.10.2025 wird als nicht eingetragen veröffentlicht:\nAls nicht eingetragen wird veröffentlicht:\nDen Gläubigern der an der Ausgliederung beteiligten Rechtsträger ist, wenn sie binnen sechs Monaten nach dem Tag, an dem die Eintragung der Umwandlung in das Register des Sitzes desjenigen Rechtsträgers, dessen Gläubiger sie sind, als bekannt gemacht gilt, ihren Anspruch nach Grund und Höhe schriftlich anmelden, Sicherheit zu leisten, soweit sie nicht Befriedigung verlangen können. Dieses Recht steht den Gläubigern jedoch nur zu, wenn sie glaubhaft machen, dass durch die Ausgliederung die Erfüllung ihrer Forderung gefährdet wird"
    },
    {
      "date": "2025-10-06",
      "id": "132676",
      "original_text": "Registerbekanntmachung nach dem Umwandlungsgesetz\nBaden-Württemberg Amtsgericht Stuttgart HRA 742675\nNorbert Groß e.K. – Öhringen",
      "type": "Registerbekanntmachung nach dem Umwandlungsgesetz",
      "state": "Baden-Württemberg",
      "amtsgericht": "Amtsgericht Stuttgart",
      "registernummer": "HRA 742675",
      "registerart": "HRA",
      "company_name": "Norbert Groß e.K.",
      "company_seat": "Öhringen",
      "details": "06.10.2025 (Bekanntmachungsdatum)\n\nBaden-Württemberg Amtsgericht Stuttgart HRA 742675\nRegisterbekanntmachung nach dem Umwandlungsgesetz 06.10.2025 (Eintragungsdatum)\n\nNorbert Groß e.K.\nEinzelkaufmann / Einzelkauffrau\nÖhringen\n\nAls nicht eingetragen wird bekanntgemacht:\nDen Gläubigern der an der Ausgliederung beteiligten Rechtsträger ist, wenn sie binnen sechs Monaten nach dem Tag, an dem die Eintragung der Ausgliederung in das Register des Sitzes desjenigen Rechtsträgers, dessen Gläubiger sie sind, nach § 19 Abs. 3 UmwG als bekanntgemacht gilt, ihren Anspruch nach Grund und Höhe schriftlich anmelden, Sicherheit zu leisten, soweit sie nicht Befriedigung verlangen können. Dieses Recht steht den Gläubigern jedoch nur zu, wenn sie glaubhaft machen, dass durch die Ausgliederung die Erfüllung ihrer Forderung gefährdet wird."
    },
    {
      "date": "2025-10-06",
      "id": "132677",
      "original_text": "Löschungsankündigung\nBaden-Württemberg Amtsgericht Mannheim HRB 704777\nPlanet Kart GmbH – Weinheim",
      "type": "Löschungsankündigung",
      "state": "Baden-Württemberg",
      "amtsgericht": "Amtsgericht Mannheim",
      "registernummer": "HRB 704777",
      "registerart": "HRB",
      "company_name": "Planet Kart GmbH",
      "company_seat": "Weinheim",
      "details": "06.10.2025 (Bekanntmachungsdatum)\n\nBaden-Württemberg Amtsgericht Mannheim HRB 704777\nLöschungsankündigung\n\nPlanet Kart GmbH\nGesellschaft mit beschränkter Haftung\nWeinheim\n\nAls nicht eingetragen wird bekanntgemacht:\nDas Gericht beabsichtigt, die Gesellschaft wegen Vermögenslosigkeit im Handelsregister von Amts wegen nach § 394 FamFG zu löschen. Die Frist zur Geltendmachung eines Widerspruchs gegen die beabsichtigte Löschung ist auf einen Monat ab Veröffentlichung bestimmt."
    },
    {
      "date": "2025-10-06",
      "id": "132678",
      "original_text": "Registerbekanntmachung nach dem Umwandlungsgesetz\nBerlin Amtsgericht Berlin (Charlottenburg) HRB 229260\nAB AllManagement GmbH – Berlin",
      "type": "Registerbekanntmachung nach dem Umwandlungsgesetz",
      "state": "Berlin",
      "amtsgericht": "Amtsgericht Berlin (Charlottenburg)",
      "registernummer": "HRB 229260",
      "registerart": "HRB",
      "company_name": "AB AllManagement GmbH",
      "company_seat": "Berlin",
      "details": "06.10.2025 (Bekanntmachungsdatum)\n\nBerlin Amtsgericht Berlin (Charlottenburg) HRB 229260\nRegisterbekanntmachung nach dem Umwandlungsgesetz 02.10.2025 (Eintragungsdatum)\n\nAB AllManagement GmbH\nGesellschaft mit beschränkter Haftung\nBerlin\n\nZu Eintragungsnummer 2 vom 02.10.2025 wird als nicht eingetragen veröffentlicht: Den Gläubigern der an der Verschmelzung beteiligten Rechtsträger ist, wenn sie binnen sechs Monaten nach dem Tag, an dem die Eintragung der Verschmelzung in das Register des Sitzes desjenigen Rechtsträgers, dessen Gläubiger sie sind, als bekannt gemacht gilt, ihren Anspruch nach Grund und Höhe schriftlich anmelden, Sicherheit zu leisten, soweit sie nicht Befriedigung verlangen können. Dieses Recht steht den Gläubigern jedoch nur zu, wenn sie glaubhaft machen, dass durch die Verschmelzung die Erfüllung ihrer Forderung gefährdet wird. Das Recht, Sicherheitsleistung zu verlangen, steht Gläubigern nicht zu, die im Falle der Insolvenz ein Recht auf vorzugsweise Befriedigung aus einer Deckungsmasse haben, die nach gesetzlicher Vorschrift zu ihrem Schutz errichtet und staatlich überwacht ist."
    },
    {
      "date": "2025-10-06",
      "id": "132679",
      "original_text": "Einreichung neuer Dokumente\nBerlin Amtsgericht Berlin (Charlottenburg) HRB 198015\nDelivery Hero SE – Berlin",
      "type": "Einreichung neuer Dokumente",
      "state": "Berlin",
      "amtsgericht": "Amtsgericht Berlin (Charlottenburg)",
      "registernummer": "HRB 198015",
      "registerart": "HRB",
      "company_name": "Delivery Hero SE",
      "company_seat": "Berlin",
      "details": "06.10.2025 (Bekanntmachungsdatum)\n\nBerlin Amtsgericht Berlin (Charlottenburg) HRB 198015\nEinreichung neuer Dokumente\n\nDelivery Hero SE\nEuropäische Aktiengesellschaft (SE)\nBerlin\n\nAls nicht eingetragen wird veröffentlicht: Es wurde eine neue Liste der Aufsichtsratsmitglieder eingereicht (§ 106 AktG)."
    },
    {
      "date": "2025-10-06",
      "id": "132680",
      "original_text": "Registerbekanntmachung nach dem Umwandlungsgesetz\nBrandenburg Amtsgericht Cottbus HRA 4501\nEvergym - Bennet Freitel e.K. – Schönefeld",
      "type": "Registerbekanntmachung nach dem Umwandlungsgesetz",
      "state": "Brandenburg",
      "amtsgericht": "Amtsgericht Cottbus",
      "registernummer": "HRA 4501",
      "registerart": "HRA",
      "company_name": "Evergym - Bennet Freitel e.K.",
      "company_seat": "Schönefeld",
      "details": "06.10.2025 (Bekanntmachungsdatum)\n\nBrandenburg Amtsgericht Cottbus HRA 4501\nRegisterbekanntmachung nach dem Umwandlungsgesetz 02.10.2025 (Eintragungsdatum)\n\nEvergym - Bennet Freitel e.K.\nEinzelkaufmann / Einzelkauffrau\nSchönefeld\n\nDen Gläubigern der an der Spaltung beteiligten Rechtsträger ist, wenn sie binnen sechs Monaten nach dem Tag, an dem die Eintragung der Spaltung in das Register des Sitzes desjenigen Rechtsträgers, dessen Gläubiger sie sind, als bekannt gemacht gilt, ihren Anspruch nach Grund und Höhe schriftlich anmelden, Sicherheit zu leisten, soweit sie nicht Befriedigung verlangen können. Dieses Recht steht den Gläubigern jedoch nur zu, wenn sie glaubhaft machen, dass durch die Spaltung die Erfüllung ihrer Forderung gefährdet wird."
    },
    {
      "date": "2025-10-06",
      "id": "132681",
      "original_text": "Registerbekanntmachung nach dem Umwandlungsgesetz\nBerlin Amtsgericht Berlin (Charlottenburg) HRB 201472\nEBNA Properties GmbH – Berlin",
      "type": "Registerbekanntmachung nach dem Umwandlungsgesetz",
      "state": "Berlin",
      "amtsgericht": "Amtsgericht Berlin (Charlottenburg)",
      "registernummer": "HRB 201472",
      "registerart": "HRB",
      "company_name": "EBNA Properties GmbH",
      "company_seat": "Berlin",
      "details": "06.10.2025 (Bekanntmachungsdatum)\n\nBerlin Amtsgericht Berlin (Charlottenburg) HRB 201472\nRegisterbekanntmachung nach dem Umwandlungsgesetz 02.10.2025 (Eintragungsdatum)\n\nEBNA Properties GmbH\nGesellschaft mit beschränkter Haftung\nBerlin\n\nZu Eintragungsnummer 2 vom 02.10.2025 wird als nicht eingetragen veröffentlicht: Den Gläubigern der an der Verschmelzung beteiligten Rechtsträger ist, wenn sie binnen sechs Monaten nach dem Tag, an dem die Eintragung der Verschmelzung in das Register des Sitzes desjenigen Rechtsträgers, dessen Gläubiger sie sind, als bekannt gemacht gilt, ihren Anspruch nach Grund und Höhe schriftlich anmelden, Sicherheit zu leisten, soweit sie nicht Befriedigung verlangen können. Dieses Recht steht den Gläubigern jedoch nur zu, wenn sie glaubhaft machen, dass durch die Verschmelzung die Erfüllung ihrer Forderung gefährdet wird. Das Recht, Sicherheitsleistung zu verlangen, steht Gläubigern nicht zu, die im Falle der Insolvenz ein Recht auf vorzugsweise Befriedigung aus einer Deckungsmasse haben, die nach gesetzlicher Vorschrift zu ihrem Schutz errichtet und staatlich überwacht ist."
    },
    {
      "date": "2025-10-06",
      "id": "132682",
      "original_text": "Registerbekanntmachung nach dem Umwandlungsgesetz\nNordrhein-Westfalen Amtsgericht Coesfeld HRB 2442\nStadtentwicklungsgesellschaft Coesfeld mbH – Coesfeld",
      "type": "Registerbekanntmachung nach dem Umwandlungsgesetz",
      "state": "Nordrhein-Westfalen",
      "amtsgericht": "Amtsgericht Coesfeld",
      "registernummer": "HRB 2442",
      "registerart": "HRB",
      "company_name": "Stadtentwicklungsgesellschaft Coesfeld mbH",
      "company_seat": "Coesfeld",
      "details": "06.10.2025 (Bekanntmachungsdatum)\n\nNordrhein-Westfalen Amtsgericht Coesfeld HRB 2442\nRegisterbekanntmachung nach dem Umwandlungsgesetz 06.10.2025 (Eintragungsdatum)\n\nStadtentwicklungsgesellschaft Coesfeld mbH\nGesellschaft mit beschränkter Haftung\nCoesfeld\n\nDen Gläubigern des an dem Formwechsel beteiligten Rechtsträgers ist, wenn sie binnen sechs Monaten nach dem Tag, an dem die Eintragung des Formwechsels in das Register des Sitzes derjenigen Rechtsträger deren Gläubiger sie sind, nach § 19 Absatz 3 UmwG als bekanntgemacht gilt, ihren Anspruch nach Grund und Höhe schriftlich anmelden, Sicherheit zu leisten, soweit sie nicht Befriedigung verlangen können. Dieses Recht steht den Gläubigern jedoch nur zu, wenn sie glaubhaft machen, dass durch den Formwechsel die Erfüllung ihrer Forderung gefährdet wird."
    },
    {
      "date": "2025-10-06",
      "id": "132683",
      "original_text": "Registerbekanntmachung nach dem Umwandlungsgesetz\nHamburg Amtsgericht Hamburg VR 7651\nPrüfungsverband der Deutschen Verkehrs-, Dienstleistungs- und Konsumgenossenschaften e.V. – Hamburg",
      "type": "Registerbekanntmachung nach dem Umwandlungsgesetz",
      "state": "Hamburg",
      "amtsgericht": "Amtsgericht Hamburg",
      "registernummer": "VR 7651",
      "registerart": "VR",
      "company_name": "Prüfungsverband der Deutschen Verkehrs-, Dienstleistungs- und Konsumgenossenschaften e.V.",
      "company_seat": "Hamburg",
      "details": "06.10.2025 (Bekanntmachungsdatum)\n\nHamburg Amtsgericht Hamburg VR 7651\nRegisterbekanntmachung nach dem Umwandlungsgesetz 06.10.2025 (Eintragungsdatum)\n\nPrüfungsverband der Deutschen Verkehrs-, Dienstleistungs- und Konsumgenossenschaften e.V.\neingetragener Verein\nHamburg\n\nDie Verschmelzung ist im Register des übernehmenden Genoverband e.V. am 29.08.2025 eingetragen worden; von Amts wegen eingetragen gemäß § 19 Abs. 2 UmwG."
    },
    {
      "date": "2025-10-06",
      "id": "132684",
      "original_text": "Löschungsankündigung\nBerlin Amtsgericht Berlin (Charlottenburg) HRB 260688\nB2B Quadrat GmbH – Berlin",
      "type": "Löschungsankündigung",
      "state": "Berlin",
      "amtsgericht": "Amtsgericht Berlin (Charlottenburg)",
      "registernummer": "HRB 260688",
      "registerart": "HRB",
      "company_name": "B2B Quadrat GmbH",
      "company_seat": "Berlin",
      "details": "06.10.2025 (Bekanntmachungsdatum)\n\nBerlin Amtsgericht Berlin (Charlottenburg) HRB 260688\nLöschungsankündigung\n\nB2B Quadrat GmbH\nGesellschaft mit beschränkter Haftung\nBerlin\n\nBei der nachstehenden Gesellschaft wird das Amtslöschungsverfahren gemäß § 394 FamFG eingeleitet. Widerspruchsfrist 6 Wochen"
    },
    {
      "date": "2025-10-06",
      "id": "132685",
      "original_text": "Registerbekanntmachung nach dem Umwandlungsgesetz\nBerlin Amtsgericht Berlin (Charlottenburg) HRB 277016\nDeVos Capitalmanagement GmbH – Berlin",
      "type": "Registerbekanntmachung nach dem Umwandlungsgesetz",
      "state": "Berlin",
      "amtsgericht": "Amtsgericht Berlin (Charlottenburg)",
      "registernummer": "HRB 277016",
      "registerart": "HRB",
      "company_name": "DeVos Capitalmanagement GmbH",
      "company_seat": "Berlin",
      "details": "06.10.2025 (Bekanntmachungsdatum)\n\nBerlin Amtsgericht Berlin (Charlottenburg) HRB 277016\nRegisterbekanntmachung nach dem Umwandlungsgesetz 01.10.2025 (Eintragungsdatum)\n\nDeVos Capitalmanagement GmbH\nGesellschaft mit beschränkter Haftung\nBerlin\n\nZu Eintragungsnummer 3 vom 01.10.2025 wird als nicht eingetragen veröffentlicht: Den Gläubigern der an der Verschmelzung beteiligten Rechtsträger ist, wenn sie binnen sechs Monaten nach dem Tag, an dem die Eintragung der Verschmelzung in das Register des Sitzes desjenigen Rechtsträgers, dessen Gläubiger sie sind, als bekannt gemacht gilt, ihren Anspruch nach Grund und Höhe schriftlich anmelden, Sicherheit zu leisten, soweit sie nicht Befriedigung verlangen können. Dieses Recht steht den Gläubigern jedoch nur zu, wenn sie glaubhaft machen, dass durch die Verschmelzung die Erfüllung ihrer Forderung gefährdet wird. Das Recht, Sicherheitsleistung zu verlangen, steht Gläubigern nicht zu, die im Falle der Insolvenz ein Recht auf vorzugsweise Befriedigung aus einer Deckungsmasse haben, die nach gesetzlicher Vorschrift zu ihrem Schutz errichtet und staatlich überwacht ist."
    },
    {
      "date": "2025-10-06",
      "id": "132686",
      "original_text": "Einreichung neuer Dokumente\nBaden-Württemberg Amtsgericht Freiburg HRB 703438\nmynetfair AG – Kehl",
      "type": "Einreichung neuer Dokumente",
      "state": "Baden-Württemberg",
      "amtsgericht": "Amtsgericht Freiburg",
      "registernummer": "HRB 703438",
      "registerart": "HRB",
      "company_name": "mynetfair AG",
      "company_seat": "Kehl",
      "details": "06.10.2025 (Bekanntmachungsdatum)\n\nBaden-Württemberg Amtsgericht Freiburg HRB 703438\nEinreichung neuer Dokumente\n\nmynetfair AG\nAktiengesellschaft\nKehl\n\nDie Gesellschaft hat am 02.10.2025 die Liste über die Zusammensetzung des Aufsichtsrats zum Handelsregister eingereicht."
    },
    {
      "date": "2025-10-06",
      "id": "132687",
      "original_text": "Registerbekanntmachung nach dem Umwandlungsgesetz\nSaarland Amtsgericht Saarbrücken HRB 101539\nTerra Value Investment GmbH – Saarbrücken",
      "type": "Registerbekanntmachung nach dem Umwandlungsgesetz",
      "state": "Saarland",
      "amtsgericht": "Amtsgericht Saarbrücken",
      "registernummer": "HRB 101539",
      "registerart": "HRB",
      "company_name": "Terra Value Investment GmbH",
      "company_seat": "Saarbrücken",
      "details": "06.10.2025 (Bekanntmachungsdatum)\n\nSaarland Amtsgericht Saarbrücken HRB 101539\nRegisterbekanntmachung nach dem Umwandlungsgesetz 06.10.2025 (Eintragungsdatum)\n\nTerra Value Investment GmbH\nGesellschaft mit beschränkter Haftung\nSaarbrücken\n\nAls nicht eingetragen wird bekannt gemacht: Den Gläubigern der an der Verschmelzung beteiligten Gesellschaften ist, wenn sie binnen sechs Monaten nach dem Tag, an dem die Eintragung der Verschmelzung in das Register des Sitzes desjenigen Rechtsträgers, dessen Gläubiger sie sind, nach § 19 Absatz 3 UmwG bekannt gemacht worden ist, ihren Anspruch nach Grund und Höhe schriftlich anmelden, Sicherheit zu leisten, soweit sie nicht Befriedigung verlangen können. Dieses Recht steht den Gläubigern jedoch nur zu, wenn sie glaubhaft machen, dass durch die Verschmelzung die Erfüllung ihrer Forderung gefährdet wird."
    },
    {
      "date": "2025-10-06",
      "id": "132688",
      "original_text": "Registerbekanntmachung nach dem Umwandlungsgesetz\nSaarland Amtsgericht Saarbrücken HRB 11801\nSEC - Sustainable Energy Consulting GmbH – Saarbrücken",
      "type": "Registerbekanntmachung nach dem Umwandlungsgesetz",
      "state": "Saarland",
      "amtsgericht": "Amtsgericht Saarbrücken",
      "registernummer": "HRB 11801",
      "registerart": "HRB",
      "company_name": "SEC - Sustainable Energy Consulting GmbH",
      "company_seat": "Saarbrücken",
      "details": "06.10.2025 (Bekanntmachungsdatum)\n\nSaarland Amtsgericht Saarbrücken HRB 11801\nRegisterbekanntmachung nach dem Umwandlungsgesetz 06.10.2025 (Eintragungsdatum)\n\nSEC - Sustainable Energy Consulting GmbH\nGesellschaft mit beschränkter Haftung\nSaarbrücken\n\nAls nicht eingetragen wird bekannt gemacht: Den Gläubigern der an der Verschmelzung beteiligten Gesellschaften ist, wenn sie binnen sechs Monaten nach dem Tag, an dem die Eintragung der Verschmelzung in das Register des Sitzes desjenigen Rechtsträgers, dessen Gläubiger sie sind, nach § 19 Absatz 3 UmwG bekannt gemacht worden ist, ihren Anspruch nach Grund und Höhe schriftlich anmelden, Sicherheit zu leisten, soweit sie nicht Befriedigung verlangen können. Dieses Recht steht den Gläubigern jedoch nur zu, wenn sie glaubhaft machen, dass durch die Verschmelzung die Erfüllung ihrer Forderung gefährdet wird."
    },
    {
      "date": "2025-10-06",
      "id": "132689",
      "original_text": "Einreichung neuer Dokumente\nBaden-Württemberg Amtsgericht Mannheim HRB 713801\nINTER Beteiligungen AG – Mannheim",
      "type": "Einreichung neuer Dokumente",
      "state": "Baden-Württemberg",
      "amtsgericht": "Amtsgericht Mannheim",
      "registernummer": "HRB 713801",
      "registerart": "HRB",
      "company_name": "INTER Beteiligungen AG",
      "company_seat": "Mannheim",
      "details": "06.10.2025 (Bekanntmachungsdatum)\n\nBaden-Württemberg Amtsgericht Mannheim HRB 713801\nEinreichung neuer Dokumente\n\nINTER Beteiligungen AG\nAktiengesellschaft\nMannheim\n\nDie Gesellschaft hat am 02.10.2025 die Liste über die Zusammensetzung des Aufsichtsrats zum Handelsregister eingereicht."
    },
    {
      "date": "2025-10-06",
      "id": "132690",
      "original_text": "Löschungsankündigung\nBrandenburg Amtsgericht Potsdam HRB 29586\nWeissTech Software UG (haftungsbeschränkt) – Zossen",
      "type": "Löschungsankündigung",
      "state": "Brandenburg",
      "amtsgericht": "Amtsgericht Potsdam",
      "registernummer": "HRB 29586",
      "registerart": "HRB",
      "company_name": "WeissTech Software UG (haftungsbeschränkt)",
      "company_seat": "Zossen",
      "details": "06.10.2025 (Bekanntmachungsdatum)\n\nBrandenburg Amtsgericht Potsdam HRB 29586\nLöschungsankündigung\n\nWeissTech Software UG (haftungsbeschränkt)\nGesellschaft mit beschränkter Haftung\nZossen\n\nBei der nachstehenden Gesellschaft wird das Amtslöschungsverfahren gemäß § 394 FamFG eingeleitet. Widerspruchsfrist: 8 Wochen."
    },
    {
      "date": "2025-10-06",
      "id": "132691",
      "original_text": "Sonstige Registerbekanntmachung\nHamburg Amtsgericht Hamburg HRB 162517\nF&P Executive Solutions AG – Hamburg",
      "type": "Sonstige Registerbekanntmachung",
      "state": "Hamburg",
      "amtsgericht": "Amtsgericht Hamburg",
      "registernummer": "HRB 162517",
      "registerart": "HRB",
      "company_name": "F&P Executive Solutions AG",
      "company_seat": "Hamburg",
      "details": "06.10.2025 (Bekanntmachungsdatum)\n\nHamburg Amtsgericht Hamburg HRB 162517\nSonstige Registerbekanntmachung 02.10.2025 (Eintragungsdatum)\n\nF&P Executive Solutions AG\nAktiengesellschaft\nHamburg\n\nAls nicht eingetragen wird bekannt gemacht: Liste des Aufsichtsrats wurde eingereicht."
    },
    {
      "date": "2025-10-06",
      "id": "132692",
      "original_text": "Registerbekanntmachung nach dem Umwandlungsgesetz\nBerlin Amtsgericht Berlin (Charlottenburg) HRB 198581\nBaltic Eagle GmbH – Berlin",
      "type": "Registerbekanntmachung nach dem Umwandlungsgesetz",
      "state": "Berlin",
      "amtsgericht": "Amtsgericht Berlin (Charlottenburg)",
      "registernummer": "HRB 198581",
      "registerart": "HRB",
      "company_name": "Baltic Eagle GmbH",
      "company_seat": "Berlin",
      "details": "06.10.2025 (Bekanntmachungsdatum)\n\nBerlin Amtsgericht Berlin (Charlottenburg) HRB 198581\nRegisterbekanntmachung nach dem Umwandlungsgesetz 06.10.2025 (Eintragungsdatum)\n\nBaltic Eagle GmbH\nGesellschaft mit beschränkter Haftung\nBerlin\n\nZu Eintragungsnummer 14 vom 06.10.2025 wird als nicht eingetragen veröffentlicht: Den Gläubigern ist, wenn sie binnen sechs Monaten nach dem Tag, an dem die Eintragung der Umwandlung als bekannt gemacht gilt, ihren Anspruch nach Grund und Höhe schriftlich anmelden, Sicherheit zu leisten, soweit sie nicht Befriedigung verlangen können. Dieses Recht steht den Gläubigern jedoch nur zu, wenn sie glaubhaft machen, dass durch die Umwandlung die Erfüllung ihrer Forderung gefährdet wird. Das Recht, Sicherheitsleistung zu verlangen, steht Gläubigern nicht zu, die im Falle der Insolvenz ein Recht auf vorzugsweise Befriedigung aus einer Deckungsmasse haben, die nach gesetzlicher Vorschrift zu ihrem Schutz errichtet und staatlich überwacht ist."
    },
    {
      "date": "2025-10-06",
      "id": "132693",
      "original_text": "Registerbekanntmachung nach dem Umwandlungsgesetz\nSaarland Amtsgericht Saarbrücken HRB 101510\nJosef Bearzatto, Gesellschaft mit beschränkter Haftung – Perl",
      "type": "Registerbekanntmachung nach dem Umwandlungsgesetz",
      "state": "Saarland",
      "amtsgericht": "Amtsgericht Saarbrücken",
      "registernummer": "HRB 101510",
      "registerart": "HRB",
      "company_name": "Josef Bearzatto, Gesellschaft mit beschränkter Haftung",
      "company_seat": "Perl",
      "details": "06.10.2025 (Bekanntmachungsdatum)\n\nSaarland Amtsgericht Saarbrücken HRB 101510\nRegisterbekanntmachung nach dem Umwandlungsgesetz 06.10.2025 (Eintragungsdatum)\n\nJosef Bearzatto, Gesellschaft mit beschränkter Haftung\nGesellschaft mit beschränkter Haftung\nPerl\n\nAls nicht eingetragen wird bekannt gemacht: Den Gläubigern der an der Verschmelzung beteiligten Gesellschaften ist, wenn sie binnen sechs Monaten nach dem Tag, an dem die Eintragung der Verschmelzung in das Register des Sitzes desjenigen Rechtsträgers, dessen Gläubiger sie sind, nach § 19 Absatz 3 UmwG bekannt gemacht worden ist, ihren Anspruch nach Grund und Höhe schriftlich anmelden, Sicherheit zu leisten, soweit sie nicht Befriedigung verlangen können. Dieses Recht steht den Gläubigern jedoch nur zu, wenn sie glaubhaft machen, dass durch die Verschmelzung die Erfüllung ihrer Forderung gefährdet wird."
    },
    {
      "date": "2025-10-06",
      "id": "132694",
      "original_text": "Registerbekanntmachung nach dem Umwandlungsgesetz\nBerlin Amtsgericht Berlin (Charlottenburg) HRA 64786\nBaltic Eagle GmbH & Co. KG – Berlin",
      "type": "Registerbekanntmachung nach dem Umwandlungsgesetz",
      "state": "Berlin",
      "amtsgericht": "Amtsgericht Berlin (Charlottenburg)",
      "registernummer": "HRA 64786",
      "registerart": "HRA",
      "company_name": "Baltic Eagle GmbH & Co. KG",
      "company_seat": "Berlin",
      "details": "06.10.2025 (Bekanntmachungsdatum)\n\nBerlin Amtsgericht Berlin (Charlottenburg) HRA 64786\nRegisterbekanntmachung nach dem Umwandlungsgesetz 06.10.2025 (Eintragungsdatum)\n\nBaltic Eagle GmbH & Co. KG\nKommanditgesellschaft\nBerlin\n\nZu Eintragungsnummer 1 vom 06.10.2025 wird als nicht eingetragen veröffentlicht: Den Gläubigern der an der Verschmelzung beteiligten Rechtsträger ist, wenn sie binnen sechs Monaten nach dem Tag, an dem die Eintragung der Verschmelzung in das Register des Sitzes desjenigen Rechtsträgers, dessen Gläubiger sie sind, als bekannt gemacht gilt, ihren Anspruch nach Grund und Höhe schriftlich anmelden, Sicherheit zu leisten, soweit sie nicht Befriedigung verlangen können. Dieses Recht steht den Gläubigern jedoch nur zu, wenn sie glaubhaft machen, dass durch die Verschmelzung die Erfüllung ihrer Forderung gefährdet wird. Das Recht, Sicherheitsleistung zu verlangen, steht Gläubigern nicht zu, die im Falle der Insolvenz ein Recht auf vorzugsweise Befriedigung aus einer Deckungsmasse haben, die nach gesetzlicher Vorschrift zu ihrem Schutz errichtet und staatlich überwacht ist."
    },
    {
      "date": "2025-10-06",
      "id": "132695",
      "original_text": "Registerbekanntmachung nach dem Umwandlungsgesetz\nSaarland Amtsgericht Saarbrücken HRB 105836\nFixemer ESCATE Technology GmbH – Perl",
      "type": "Registerbekanntmachung nach dem Umwandlungsgesetz",
      "state": "Saarland",
      "amtsgericht": "Amtsgericht Saarbrücken",
      "registernummer": "HRB 105836",
      "registerart": "HRB",
      "company_name": "Fixemer ESCATE Technology GmbH",
      "company_seat": "Perl",
      "details": "06.10.2025 (Bekanntmachungsdatum)\n\nSaarland Amtsgericht Saarbrücken HRB 105836\nRegisterbekanntmachung nach dem Umwandlungsgesetz 06.10.2025 (Eintragungsdatum)\n\nFixemer ESCATE Technology GmbH\nGesellschaft mit beschränkter Haftung\nPerl\n\nAls nicht eingetragen wird bekannt gemacht: Den Gläubigern der an der Verschmelzung beteiligten Gesellschaften ist, wenn sie binnen sechs Monaten nach dem Tag, an dem die Eintragung der Verschmelzung in das Register des Sitzes desjenigen Rechtsträgers, dessen Gläubiger sie sind, nach § 19 Absatz 3 UmwG bekannt gemacht worden ist, ihren Anspruch nach Grund und Höhe schriftlich anmelden, Sicherheit zu leisten, soweit sie nicht Befriedigung verlangen können. Dieses Recht steht den Gläubigern jedoch nur zu, wenn sie glaubhaft machen, dass durch die Verschmelzung die Erfüllung ihrer Forderung gefährdet wird."
    },
    {
      "date": "2025-10-06",
      "id": "132696",
      "original_text": "Einreichung neuer Dokumente\nBrandenburg Amtsgericht Frankfurt/Oder HRB 16661\nNGH Gastro AG – Buckow (Märkische Schweiz)",
      "type": "Einreichung neuer Dokumente",
      "state": "Brandenburg",
      "amtsgericht": "Amtsgericht Frankfurt/Oder",
      "registernummer": "HRB 16661",
      "registerart": "HRB",
      "company_name": "NGH Gastro AG",
      "company_seat": "Buckow (Märkische Schweiz)",
      "details": "06.10.2025 (Bekanntmachungsdatum)\n\nBrandenburg Amtsgericht Frankfurt/Oder HRB 16661\nEinreichung neuer Dokumente\n\nNGH Gastro AG\nAktiengesellschaft\nBuckow (Märkische Schweiz)\n\nAls nicht eingetragen wird veröffentlicht: Die Gesellschaft hat Änderungen im Aufsichtsrat angezeigt."
    },
    {
      "date": "2025-10-06",
      "id": "132697",
      "original_text": "Registerbekanntmachung nach dem Umwandlungsgesetz\nHamburg Amtsgericht Hamburg HRA 131856\nARCATIUM GmbH & Co. KG – Hamburg",
      "type": "Registerbekanntmachung nach dem Umwandlungsgesetz",
      "state": "Hamburg",
      "amtsgericht": "Amtsgericht Hamburg",
      "registernummer": "HRA 131856",
      "registerart": "HRA",
      "company_name": "ARCATIUM GmbH & Co. KG",
      "company_seat": "Hamburg",
      "details": "06.10.2025 (Bekanntmachungsdatum)\n\nHamburg Amtsgericht Hamburg HRA 131856\nRegisterbekanntmachung nach dem Umwandlungsgesetz 06.10.2025 (Eintragungsdatum)\n\nARCATIUM GmbH & Co. KG\nKommanditgesellschaft\nHamburg\n\nAls nicht eingetragen wird bekannt gemacht:\nDen Gläubigern der an der Ausgliederung beteiligten Gesellschaften ist, wenn sie binnen sechs Monaten nach dem Tag, an dem die Eintragung der Ausgliederung in das Register des Sitzes desjenigen Rechtsträgers, dessen Gläubiger sie sind, nach § 19 Absatz 3 UmwG als bekannt gemacht gilt, ihren Anspruch nach Grund und Höhe schriftlich anmelden, Sicherheit zu leisten, soweit sie nicht Befriedigung verlangen können. Dieses Recht steht den Gläubigern jedoch nur zu, wenn sie glaubhaft machen, dass durch die Ausgliederung die Erfüllung ihrer Forderung gefährdet wird."
    },
    {
      "date": "2025-10-06",
      "id": "132698",
      "original_text": "Registerbekanntmachung nach dem Umwandlungsgesetz\nHamburg Amtsgericht Hamburg HRA 40841\nFrank Siedlungsbaugesellschaft mbH & Co. KG – Hamburg",
      "type": "Registerbekanntmachung nach dem Umwandlungsgesetz",
      "state": "Hamburg",
      "amtsgericht": "Amtsgericht Hamburg",
      "registernummer": "HRA 40841",
      "registerart": "HRA",
      "company_name": "Frank Siedlungsbaugesellschaft mbH & Co. KG",
      "company_seat": "Hamburg",
      "details": "06.10.2025 (Bekanntmachungsdatum)\n\nHamburg Amtsgericht Hamburg HRA 40841\nRegisterbekanntmachung nach dem Umwandlungsgesetz 06.10.2025 (Eintragungsdatum)\n\nFrank Siedlungsbaugesellschaft mbH & Co. KG\nKommanditgesellschaft\nHamburg\n\nAls nicht eingetragen wird bekannt gemacht:\nDen Gläubigern der an der Ausgliederung beteiligten Gesellschaften ist, wenn sie binnen sechs Monaten nach dem Tag, an dem die Eintragung der Ausgliederung in das Register des Sitzes desjenigen Rechtsträgers, dessen Gläubiger sie sind, nach § 19 Absatz 3 UmwG als bekannt gemacht gilt, ihren Anspruch nach Grund und Höhe schriftlich anmelden, Sicherheit zu leisten, soweit sie nicht Befriedigung verlangen können. Dieses Recht steht den Gläubigern jedoch nur zu, wenn sie glaubhaft machen, dass durch die Ausgliederung die Erfüllung ihrer Forderung gefährdet wird."
    },
    {
      "date": "2025-10-06",
      "id": "132699",
      "original_text": "Registerbekanntmachung nach dem Umwandlungsgesetz\nBrandenburg Amtsgericht Cottbus HRB 19134\nEVERHUB GmbH – Schönefeld",
      "type": "Registerbekanntmachung nach dem Umwandlungsgesetz",
      "state": "Brandenburg",
      "amtsgericht": "Amtsgericht Cottbus",
      "registernummer": "HRB 19134",
      "registerart": "HRB",
      "company_name": "EVERHUB GmbH",
      "company_seat": "Schönefeld",
      "details": "06.10.2025 (Bekanntmachungsdatum)\n\nBrandenburg Amtsgericht Cottbus HRB 19134\nRegisterbekanntmachung nach dem Umwandlungsgesetz 02.10.2025 (Eintragungsdatum)\n\nEVERHUB GmbH\nGesellschaft mit beschränkter Haftung\nSchönefeld\n\nZu Eintragungsnummer 1 vom 02.10.2025 wird als nicht eingetragen veröffentlicht:\nDen Gläubigern der an der Spaltung beteiligten Rechtsträger ist, wenn sie binnen sechs Monaten nach dem Tag, an dem die Eintragung der Spaltung in das Register des Sitzes desjenigen Rechtsträgers, dessen Gläubiger sie sind, als bekannt gemacht gilt, ihren Anspruch nach Grund und Höhe schriftlich anmelden, Sicherheit zu leisten, soweit sie nicht Befriedigung verlangen können. Dieses Recht steht den Gläubigern jedoch nur zu, wenn sie glaubhaft machen, dass durch die Spaltung die Erfüllung ihrer Forderung gefährdet wird"
    },
    {
      "date": "2025-10-06",
      "id": "132700",
      "original_text": "Registerbekanntmachung nach dem Umwandlungsgesetz\nBaden-Württemberg Amtsgericht Stuttgart HRA 742752\nRolf Schürholz e.K. – Renningen",
      "type": "Registerbekanntmachung nach dem Umwandlungsgesetz",
      "state": "Baden-Württemberg",
      "amtsgericht": "Amtsgericht Stuttgart",
      "registernummer": "HRA 742752",
      "registerart": "HRA",
      "company_name": "Rolf Schürholz e.K.",
      "company_seat": "Renningen",
      "details": "06.10.2025 (Bekanntmachungsdatum)\n\nBaden-Württemberg Amtsgericht Stuttgart HRA 742752\nRegisterbekanntmachung nach dem Umwandlungsgesetz 06.10.2025 (Eintragungsdatum)\n\nRolf Schürholz e.K.\nEinzelkaufmann / Einzelkauffrau\nRenningen\n\nAls nicht eingetragen wird bekanntgemacht:\nDen Gläubigern der an der Verschmelzung beteiligten Rechtsträger ist, wenn sie binnen sechs Monaten nach dem Tag, an dem die Eintragung der Verschmelzung in das Register des Sitzes desjenigen Rechtsträgers, dessen Gläubiger sie sind, nach § 19 Abs. 3 UmwG als bekanntgemacht gilt, ihren Anspruch nach Grund und Höhe schriftlich anmelden, Sicherheit zu leisten, soweit sie nicht Befriedigung verlangen können. Dieses Recht steht den Gläubigern jedoch nur zu, wenn sie glaubhaft machen, dass durch die Verschmelzung die Erfüllung ihrer Forderung gefährdet wird."
    },
    {
      "date": "2025-10-06",
      "id": "132701",
      "original_text": "Registerbekanntmachung nach dem Umwandlungsgesetz\nHamburg Amtsgericht Hamburg HRB 126200\nPawlik Consultants GmbH – Hamburg",
      "type": "Registerbekanntmachung nach dem Umwandlungsgesetz",
      "state": "Hamburg",
      "amtsgericht": "Amtsgericht Hamburg",
      "registernummer": "HRB 126200",
      "registerart": "HRB",
      "company_name": "Pawlik Consultants GmbH",
      "company_seat": "Hamburg",
      "details": "06.10.2025 (Bekanntmachungsdatum)\n\nHamburg Amtsgericht Hamburg HRB 126200\nRegisterbekanntmachung nach dem Umwandlungsgesetz 06.10.2025 (Eintragungsdatum)\n\nPawlik Consultants GmbH\nGesellschaft mit beschränkter Haftung\nHamburg\n\nAls nicht eingetragen wird bekannt gemacht:\nDen Gläubigern der an der Verschmelzung beteiligten Gesellschaften ist, wenn sie binnen sechs Monaten nach dem Tag, an dem die Eintragung der Verschmelzung in das Register des Sitzes desjenigen Rechtsträgers, dessen Gläubiger sie sind, nach § 19 Absatz 3 UmwG als bekannt gemacht gilt, ihren Anspruch nach Grund und Höhe schriftlich anmelden, Sicherheit zu leisten, soweit sie nicht Befriedigung verlangen können. Dieses Recht steht den Gläubigern jedoch nur zu, wenn sie glaubhaft machen, dass durch die Verschmelzung die Erfüllung ihrer Forderung gefährdet wird."
    },
    {
      "date": "2025-10-06",
      "id": "132702",
      "original_text": "Registerbekanntmachung nach dem Umwandlungsgesetz\nHamburg Amtsgericht Hamburg HRB 59047\nTeam Dr. Albrecht Marketing & Consulting GmbH – Hamburg",
      "type": "Registerbekanntmachung nach dem Umwandlungsgesetz",
      "state": "Hamburg",
      "amtsgericht": "Amtsgericht Hamburg",
      "registernummer": "HRB 59047",
      "registerart": "HRB",
      "company_name": "Team Dr. Albrecht Marketing & Consulting GmbH",
      "company_seat": "Hamburg",
      "details": "06.10.2025 (Bekanntmachungsdatum)\n\nHamburg Amtsgericht Hamburg HRB 59047\nRegisterbekanntmachung nach dem Umwandlungsgesetz 06.10.2025 (Eintragungsdatum)\n\nTeam Dr. Albrecht Marketing & Consulting GmbH\nGesellschaft mit beschränkter Haftung\nHamburg\n\nAls nicht eingetragen wird bekannt gemacht:\nDen Gläubigern der an der Verschmelzung beteiligten Gesellschaften ist, wenn sie binnen sechs Monaten nach dem Tag, an dem die Eintragung der Verschmelzung in das Register des Sitzes desjenigen Rechtsträgers, dessen Gläubiger sie sind, nach § 19 Absatz 3 UmwG als bekannt gemacht gilt, ihren Anspruch nach Grund und Höhe schriftlich anmelden, Sicherheit zu leisten, soweit sie nicht Befriedigung verlangen können. Dieses Recht steht den Gläubigern jedoch nur zu, wenn sie glaubhaft machen, dass durch die Verschmelzung die Erfüllung ihrer Forderung gefährdet wird."
    },
    {
      "date": "2025-10-06",
      "id": "132703",
      "original_text": "Registerbekanntmachung nach dem Umwandlungsgesetz\nHamburg Amtsgericht Hamburg HRB 61740\nVerwaltung M & C Marketing und Consulting GmbH – Hamburg",
      "type": "Registerbekanntmachung nach dem Umwandlungsgesetz",
      "state": "Hamburg",
      "amtsgericht": "Amtsgericht Hamburg",
      "registernummer": "HRB 61740",
      "registerart": "HRB",
      "company_name": "Verwaltung M & C Marketing und Consulting GmbH",
      "company_seat": "Hamburg",
      "details": "06.10.2025 (Bekanntmachungsdatum)\n\nHamburg Amtsgericht Hamburg HRB 61740\nRegisterbekanntmachung nach dem Umwandlungsgesetz 06.10.2025 (Eintragungsdatum)\n\nVerwaltung M & C Marketing und Consulting GmbH\nGesellschaft mit beschränkter Haftung\nHamburg\n\nAls nicht eingetragen wird bekannt gemacht:\nDen Gläubigern der an der Verschmelzung beteiligten Gesellschaften ist, wenn sie binnen sechs Monaten nach dem Tag, an dem die Eintragung der Verschmelzung in das Register des Sitzes desjenigen Rechtsträgers, dessen Gläubiger sie sind, nach § 19 Absatz 3 UmwG als bekannt gemacht gilt, ihren Anspruch nach Grund und Höhe schriftlich anmelden, Sicherheit zu leisten, soweit sie nicht Befriedigung verlangen können. Dieses Recht steht den Gläubigern jedoch nur zu, wenn sie glaubhaft machen, dass durch die Verschmelzung die Erfüllung ihrer Forderung gefährdet wird."
    },
    {
      "date": "2025-10-06",
      "id": "132704",
      "original_text": "Registerbekanntmachung nach dem Umwandlungsgesetz\nBrandenburg Amtsgericht Cottbus HRA 4425\nTorsten Teichert Gasthaus Wotschofskaweg 1 Betrieb e.K. – Lübbenau/Spreewald",
      "type": "Registerbekanntmachung nach dem Umwandlungsgesetz",
      "state": "Brandenburg",
      "amtsgericht": "Amtsgericht Cottbus",
      "registernummer": "HRA 4425",
      "registerart": "HRA",
      "company_name": "Torsten Teichert Gasthaus Wotschofskaweg 1 Betrieb e.K.",
      "company_seat": "Lübbenau/Spreewald",
      "details": "06.10.2025 (Bekanntmachungsdatum)\n\nBrandenburg Amtsgericht Cottbus HRA 4425\nRegisterbekanntmachung nach dem Umwandlungsgesetz 02.10.2025 (Eintragungsdatum)\n\nTorsten Teichert Gasthaus Wotschofskaweg 1 Betrieb e.K.\nEinzelkaufmann / Einzelkauffrau\nLübbenau/Spreewald\n\nZu Eintragungsnummer 2 vom 02.10.2025 wird als nicht eingetragen veröffentlicht:\nDen Gläubigern der an der Ausgliederung beteiligten Rechtsträger ist, wenn sie binnen sechs Monaten nach dem Tag, an dem die Eintragung der Ausgliederung in das Register des Sitzes desjenigen Rechtsträgers, dessen Gläubiger sie sind, als bekannt gemacht gilt, ihren Anspruch nach Grund und Höhe schriftlich anmelden, Sicherheit zu leisten, soweit sie nicht Befriedigung verlangen können. Dieses Recht steht den Gläubigern jedoch nur zu, wenn sie glaubhaft machen, dass durch die Ausgliederung die Erfüllung ihrer Forderung gefährdet wird"
    },
    {
      "date": "2025-10-06",
      "id": "132705",
      "original_text": "Löschungsankündigung\nSachsen Amtsgericht Dresden HRA 8554\nBfW Consult GmbH & Co. KG – Dresden",
      "type": "Löschungsankündigung",
      "state": "Sachsen",
      "amtsgericht": "Amtsgericht Dresden",
      "registernummer": "HRA 8554",
      "registerart": "HRA",
      "company_name": "BfW Consult GmbH & Co. KG",
      "company_seat": "Dresden",
      "details": "06.10.2025 (Bekanntmachungsdatum)\n\nSachsen Amtsgericht Dresden HRA 8554\nLöschungsankündigung\n\nBfW Consult GmbH & Co. KG\nKommanditgesellschaft\nDresden\n\nDas Registergericht beabsichtigt, die im Handelsregister eingetragene Gesellschaft von Amts wegen nach § 394 FamFG zu löschen. Die Frist zu Erhebung eines Widerspruchs gegen die beabsichtigte Löschung wird auf einen Monat festgesetzt."
    },
    {
      "date": "2025-10-06",
      "id": "132706",
      "original_text": "Löschungsankündigung\nSachsen Amtsgericht Dresden HRB 33828\nElbtalschmiede Gastro UG (haftungsbeschränkt) – Meißen",
      "type": "Löschungsankündigung",
      "state": "Sachsen",
      "amtsgericht": "Amtsgericht Dresden",
      "registernummer": "HRB 33828",
      "registerart": "HRB",
      "company_name": "Elbtalschmiede Gastro UG (haftungsbeschränkt)",
      "company_seat": "Meißen",
      "details": "06.10.2025 (Bekanntmachungsdatum)\n\nSachsen Amtsgericht Dresden HRB 33828\nLöschungsankündigung\n\nElbtalschmiede Gastro UG (haftungsbeschränkt)\nGesellschaft mit beschränkter Haftung\nMeißen\n\nDas Registergericht beabsichtigt, die im Handelsregister eingetragene Gesellschaft von Amts wegen nach § 394 FamFG zu löschen. Die Frist zu Erhebung eines Widerspruchs gegen die beabsichtigte Löschung wird auf einen Monat festgesetzt."
    },
    {
      "date": "2025-10-06",
      "id": "132707",
      "original_text": "Einreichung neuer Dokumente\nSachsen Amtsgericht Leipzig HRB 32141\nPeires AG – Leipzig",
      "type": "Einreichung neuer Dokumente",
      "state": "Sachsen",
      "amtsgericht": "Amtsgericht Leipzig",
      "registernummer": "HRB 32141",
      "registerart": "HRB",
      "company_name": "Peires AG",
      "company_seat": "Leipzig",
      "details": "06.10.2025 (Bekanntmachungsdatum)\n\nSachsen Amtsgericht Leipzig HRB 32141\nEinreichung neuer Dokumente\n\nPeires AG\nAktiengesellschaft\nLeipzig\n\nAm 28.08.2025 wurde beim Handelsregister des Amtsgerichts Leipzig die Liste der Mitglieder des Aufsichtsrats gemäß § 106 AktG eingereicht."
    },
    {
      "date": "2025-10-06",
      "id": "132708",
      "original_text": "Löschungsankündigung\nSachsen Amtsgericht Dresden HRB 36181\nLions & Doves Privates Institut für Neuromarketing GmbH – Meißen",
      "type": "Löschungsankündigung",
      "state": "Sachsen",
      "amtsgericht": "Amtsgericht Dresden",
      "registernummer": "HRB 36181",
      "registerart": "HRB",
      "company_name": "Lions & Doves Privates Institut für Neuromarketing GmbH",
      "company_seat": "Meißen",
      "details": "06.10.2025 (Bekanntmachungsdatum)\n\nSachsen Amtsgericht Dresden HRB 36181\nLöschungsankündigung\n\nLions & Doves Privates Institut für Neuromarketing GmbH\nGesellschaft mit beschränkter Haftung\nMeißen\n\nDas Registergericht beabsichtigt, die im Handelsregister eingetragene Gesellschaft von Amts wegen nach § 394 FamFG zu löschen. Die Frist zu Erhebung eines Widerspruchs gegen die beabsichtigte Löschung wird auf einen Monat festgesetzt."
    },
    {
      "date": "2025-10-06",
      "id": "132709",
      "original_text": "Einreichung neuer Dokumente\nSachsen Amtsgericht Chemnitz HRB 651\nChemnitzer Verkehrs-Aktiengesellschaft – Chemnitz",
      "type": "Einreichung neuer Dokumente",
      "state": "Sachsen",
      "amtsgericht": "Amtsgericht Chemnitz",
      "registernummer": "HRB 651",
      "registerart": "HRB",
      "company_name": "Chemnitzer Verkehrs-Aktiengesellschaft",
      "company_seat": "Chemnitz",
      "details": "06.10.2025 (Bekanntmachungsdatum)\n\nSachsen Amtsgericht Chemnitz HRB 651\nEinreichung neuer Dokumente\n\nChemnitzer Verkehrs-Aktiengesellschaft\nAktiengesellschaft\nChemnitz\n\nAm 02.10.2025 wurde beim Handelsregister des Amtsgerichts Chemnitz die Liste der Mitglieder des Aufsichtsrats gemäß § 106 AktG eingereicht."
    },
    {
      "date": "2025-10-06",
      "id": "132710",
      "original_text": "Registerbekanntmachung nach dem Umwandlungsgesetz\nNiedersachsen Amtsgericht Hildesheim HRB 209494\nDiavola Media UG (haftungsbeschränkt) – Gifhorn",
      "type": "Registerbekanntmachung nach dem Umwandlungsgesetz",
      "state": "Niedersachsen",
      "amtsgericht": "Amtsgericht Hildesheim",
      "registernummer": "HRB 209494",
      "registerart": "HRB",
      "company_name": "Diavola Media UG (haftungsbeschränkt)",
      "company_seat": "Gifhorn",
      "details": "06.10.2025 (Bekanntmachungsdatum)\n\nNiedersachsen Amtsgericht Hildesheim HRB 209494\nRegisterbekanntmachung nach dem Umwandlungsgesetz 06.10.2025 (Eintragungsdatum)\n\nDiavola Media UG (haftungsbeschränkt)\nGesellschaft mit beschränkter Haftung\nGifhorn\n\nDen Gläubigern der an der Verschmelzung beteiligten Rechtsträger ist, wenn sie binnen sechs Monaten nach dem Tag, an dem die Eintragung der Verschmelzung in das Register des Sitzes desjenigen Rechtsträgers, dessen Gläubiger sie sind, nach § 19  Abs.  3 UmwG als bekannt gemacht gilt, ihren Anspruch nach Grund und Höhe schriftlich anmelden, Sicherheit zu leisten, soweit sie nicht Befriedigung verlangen können. Dieses Recht steht den Gläubigern jedoch nur zu, wenn sie glaubhaft machen, dass durch die Verschmelzung die Erfüllung der Forderung gefährdet wird."
    },
    {
      "date": "2025-10-06",
      "id": "132711",
      "original_text": "Registerbekanntmachung nach dem Umwandlungsgesetz\nNiedersachsen Amtsgericht Hildesheim HRB 209270\nVentus Holding UG (haftungsbeschränkt) – Gifhorn",
      "type": "Registerbekanntmachung nach dem Umwandlungsgesetz",
      "state": "Niedersachsen",
      "amtsgericht": "Amtsgericht Hildesheim",
      "registernummer": "HRB 209270",
      "registerart": "HRB",
      "company_name": "Ventus Holding UG (haftungsbeschränkt)",
      "company_seat": "Gifhorn",
      "details": "06.10.2025 (Bekanntmachungsdatum)\n\nNiedersachsen Amtsgericht Hildesheim HRB 209270\nRegisterbekanntmachung nach dem Umwandlungsgesetz 06.10.2025 (Eintragungsdatum)\n\nVentus Holding UG (haftungsbeschränkt)\nGesellschaft mit beschränkter Haftung\nGifhorn\n\nDen Gläubigern der an der Verschmelzung beteiligten Rechtsträger ist, wenn sie binnen sechs Monaten nach dem Tag, an dem die Eintragung der Verschmelzung in das Register des Sitzes desjenigen Rechtsträgers, dessen Gläubiger sie sind, nach § 19  Abs.  3 UmwG als bekannt gemacht gilt, ihren Anspruch nach Grund und Höhe schriftlich anmelden, Sicherheit zu leisten, soweit sie nicht Befriedigung verlangen können. Dieses Recht steht den Gläubigern jedoch nur zu, wenn sie glaubhaft machen, dass durch die Verschmelzung die Erfüllung der Forderung gefährdet wird."
    },
    {
      "date": "2025-10-06",
      "id": "132712",
      "original_text": "Registerbekanntmachung nach dem Umwandlungsgesetz\nNiedersachsen Amtsgericht Hannover HRB 217963\nSöfjer Kernbohr & Schneidetechnik GmbH – Bad Münder",
      "type": "Registerbekanntmachung nach dem Umwandlungsgesetz",
      "state": "Niedersachsen",
      "amtsgericht": "Amtsgericht Hannover",
      "registernummer": "HRB 217963",
      "registerart": "HRB",
      "company_name": "Söfjer Kernbohr & Schneidetechnik GmbH",
      "company_seat": "Bad Münder",
      "details": "06.10.2025 (Bekanntmachungsdatum)\n\nNiedersachsen Amtsgericht Hannover HRB 217963\nRegisterbekanntmachung nach dem Umwandlungsgesetz 06.10.2025 (Eintragungsdatum)\n\nSöfjer Kernbohr & Schneidetechnik GmbH\nGesellschaft mit beschränkter Haftung\nBad Münder\n\nDen Gläubigern der an der Verschmelzung beteiligten Rechtsträger ist, wenn sie binnen sechs Monaten nach dem Tag, an dem die Eintragung der Verschmelzung in das Register des Sitzes desjenigen Rechtsträgers, dessen Gläubiger sie sind, nach § 19  Abs.  3 UmwG als bekannt gemacht gilt, ihren Anspruch nach Grund und Höhe schriftlich anmelden, Sicherheit zu leisten, soweit sie nicht Befriedigung verlangen können. Dieses Recht steht den Gläubigern jedoch nur zu, wenn sie glaubhaft machen, dass durch die Verschmelzung die Erfüllung der Forderung gefährdet wird."
    },
    {
      "date": "2025-10-06",
      "id": "132713",
      "original_text": "Registerbekanntmachung nach dem Umwandlungsgesetz\nNiedersachsen Amtsgericht Hannover HRA 206732\nSöfjer Kernbohrung Inh. Frank Söfjer e.K. – Bad Münder",
      "type": "Registerbekanntmachung nach dem Umwandlungsgesetz",
      "state": "Niedersachsen",
      "amtsgericht": "Amtsgericht Hannover",
      "registernummer": "HRA 206732",
      "registerart": "HRA",
      "company_name": "Söfjer Kernbohrung Inh. Frank Söfjer e.K.",
      "company_seat": "Bad Münder",
      "details": "06.10.2025 (Bekanntmachungsdatum)\n\nNiedersachsen Amtsgericht Hannover HRA 206732\nRegisterbekanntmachung nach dem Umwandlungsgesetz 06.10.2025 (Eintragungsdatum)\n\nSöfjer Kernbohrung Inh. Frank Söfjer e.K.\nEinzelkaufmann / Einzelkauffrau\nBad Münder\n\nDen Gläubigern der an der Verschmelzung beteiligten Rechtsträger ist, wenn sie binnen sechs Monaten nach dem Tag, an dem die Eintragung der Verschmelzung in das Register des Sitzes desjenigen Rechtsträgers, dessen Gläubiger sie sind, nach § 19  Abs.  3 UmwG als bekannt gemacht gilt, ihren Anspruch nach Grund und Höhe schriftlich anmelden, Sicherheit zu leisten, soweit sie nicht Befriedigung verlangen können. Dieses Recht steht den Gläubigern jedoch nur zu, wenn sie glaubhaft machen, dass durch die Verschmelzung die Erfüllung der Forderung gefährdet wird."
    },
    {
      "date": "2025-10-06",
      "id": "132714",
      "original_text": "Registerbekanntmachung nach dem Umwandlungsgesetz\nNiedersachsen Amtsgericht Walsrode GnR 200066\nFinance Masters eG – Buchholz/Aller",
      "type": "Registerbekanntmachung nach dem Umwandlungsgesetz",
      "state": "Niedersachsen",
      "amtsgericht": "Amtsgericht Walsrode",
      "registernummer": "GnR 200066",
      "registerart": "GnR",
      "company_name": "Finance Masters eG",
      "company_seat": "Buchholz/Aller",
      "details": "06.10.2025 (Bekanntmachungsdatum)\n\nNiedersachsen Amtsgericht Walsrode GnR 200066\nRegisterbekanntmachung nach dem Umwandlungsgesetz 06.10.2025 (Eintragungsdatum)\n\nFinance Masters eG\neingetragene Genossenschaft\nBuchholz/Aller\n\nDen Gläubigern der an der formwechselnden Umwandlung beteiligten Rechtsträger ist, wenn sie binnen sechs Monaten nach dem Tag, an dem die Eintragung der Umwandlung in das Register des Sitzes desjenigen Rechtsträgers, dessen Gläubiger sie sind, nach § 19 Abs. 3 UmwG als bekannt gemacht gilt, ihren Anspruch nach Grund und Höhe schriftlich anmelden, Sicherheit zu leisten, soweit sie nicht Befriedigung verlangen können. Dieses Recht steht den Gläubigern jedoch nur zu, wenn sie glaubhaft machen, dass durch die formwechselnde Umwandlung die Erfüllung der Forderung gefährdet wird."
    },
    {
      "date": "2025-10-06",
      "id": "132715",
      "original_text": "Registerbekanntmachung nach dem Umwandlungsgesetz\nNiedersachsen Amtsgericht Walsrode HRB 211968\nFinance Masters GmbH – Schwarmstedt",
      "type": "Registerbekanntmachung nach dem Umwandlungsgesetz",
      "state": "Niedersachsen",
      "amtsgericht": "Amtsgericht Walsrode",
      "registernummer": "HRB 211968",
      "registerart": "HRB",
      "company_name": "Finance Masters GmbH",
      "company_seat": "Schwarmstedt",
      "details": "06.10.2025 (Bekanntmachungsdatum)\n\nNiedersachsen Amtsgericht Walsrode HRB 211968\nRegisterbekanntmachung nach dem Umwandlungsgesetz 06.10.2025 (Eintragungsdatum)\n\nFinance Masters GmbH\nGesellschaft mit beschränkter Haftung\nSchwarmstedt\n\nDen Gläubigern der an der formwechselnden Umwandlung beteiligten Rechtsträger ist, wenn sie binnen sechs Monaten nach dem Tag, an dem die Eintragung der Umwandlung in das Register des Sitzes desjenigen Rechtsträgers, dessen Gläubiger sie sind, nach § 19 Abs. 3 UmwG als bekannt gemacht gilt, ihren Anspruch nach Grund und Höhe schriftlich anmelden, Sicherheit zu leisten, soweit sie nicht Befriedigung verlangen können. Dieses Recht steht den Gläubigern jedoch nur zu, wenn sie glaubhaft machen, dass durch die formwechselnde Umwandlung die Erfüllung der Forderung gefährdet wird."
    },
    {
      "date": "2025-10-06",
      "id": "132716",
      "original_text": "Löschungsankündigung\nNiedersachsen Amtsgericht Walsrode HRB 206464\nDamas-Service UG (haftungsbeschränkt) – Diepholz",
      "type": "Löschungsankündigung",
      "state": "Niedersachsen",
      "amtsgericht": "Amtsgericht Walsrode",
      "registernummer": "HRB 206464",
      "registerart": "HRB",
      "company_name": "Damas-Service UG (haftungsbeschränkt)",
      "company_seat": "Diepholz",
      "details": "06.10.2025 (Bekanntmachungsdatum)\n\nNiedersachsen Amtsgericht Walsrode HRB 206464\nLöschungsankündigung\n\nDamas-Service UG (haftungsbeschränkt)\nGesellschaft mit beschränkter Haftung\nDiepholz\n\nDas Registergericht beabsichtigt, die Gesellschaft von Amts wegen nach § 394 FamFG zu löschen. Die Frist zur Erhebung eines Widerspruchs ist auf 3 Monate ab dieser Registerbekanntmachung festgesetzt."
    },
    {
      "date": "2025-10-06",
      "id": "132717",
      "original_text": "Registerbekanntmachung nach dem Umwandlungsgesetz\nNiedersachsen Amtsgericht Braunschweig HRA 203317\nJonas Hary Handel und Transport e.K. – Liebenburg",
      "type": "Registerbekanntmachung nach dem Umwandlungsgesetz",
      "state": "Niedersachsen",
      "amtsgericht": "Amtsgericht Braunschweig",
      "registernummer": "HRA 203317",
      "registerart": "HRA",
      "company_name": "Jonas Hary Handel und Transport e.K.",
      "company_seat": "Liebenburg",
      "details": "06.10.2025 (Bekanntmachungsdatum)\n\nNiedersachsen Amtsgericht Braunschweig HRA 203317\nRegisterbekanntmachung nach dem Umwandlungsgesetz 06.10.2025 (Eintragungsdatum)\n\nJonas Hary Handel und Transport e.K.\nEinzelkaufmann / Einzelkauffrau\nLiebenburg\n\nDen Gläubigern der an der Ausgliederung beteiligten Rechtsträger ist, wenn sie binnen sechs Monaten nach dem Tag, an dem die Eintragung der Ausgliederung in das Register des Sitzes desjenigen Rechtsträgers, dessen Gläubiger sie sind, nach § 19 Abs. 3 UmwG als bekannt gemacht gilt, ihren Anspruch nach Grund und Höhe schriftlich anmelden, Sicherheit zu leisten, soweit sie nicht Befriedigung verlangen können. Dieses Recht steht den Gläubigern jedoch nur zu, wenn sie glaubhaft machen, dass durch die Ausgliederung die Erfüllung der Forderung gefährdet wird."
    },
    {
      "date": "2025-10-06",
      "id": "132718",
      "original_text": "Registerbekanntmachung nach dem Umwandlungsgesetz\nNiedersachsen Amtsgericht Osnabrück HRB 214945\nDura-Line Germany GmbH – Meppen",
      "type": "Registerbekanntmachung nach dem Umwandlungsgesetz",
      "state": "Niedersachsen",
      "amtsgericht": "Amtsgericht Osnabrück",
      "registernummer": "HRB 214945",
      "registerart": "HRB",
      "company_name": "Dura-Line Germany GmbH",
      "company_seat": "Meppen",
      "details": "06.10.2025 (Bekanntmachungsdatum)\n\nNiedersachsen Amtsgericht Osnabrück HRB 214945\nRegisterbekanntmachung nach dem Umwandlungsgesetz 06.10.2025 (Eintragungsdatum)\n\nDura-Line Germany GmbH\nGesellschaft mit beschränkter Haftung\nMeppen\n\nDen Gläubigern der an der Verschmelzung beteiligten Rechtsträger ist, wenn sie binnen sechs Monaten nach dem Tag, an dem die Eintragung der Verschmelzung in das Register des Sitzes desjenigen Rechtsträgers, dessen Gläubiger sie sind, nach § 19  Abs.  3 UmwG als bekannt gemacht gilt, ihren Anspruch nach Grund und Höhe schriftlich anmelden, Sicherheit zu leisten, soweit sie nicht Befriedigung verlangen können. Dieses Recht steht den Gläubigern jedoch nur zu, wenn sie glaubhaft machen, dass durch die Verschmelzung die Erfüllung der Forderung gefährdet wird."
    },
    {
      "date": "2025-10-06",
      "id": "132719",
      "original_text": "Registerbekanntmachung nach dem Umwandlungsgesetz\nNiedersachsen Amtsgericht Lüneburg HRA 202822\n3B GmbH & Co. KG – Eyendorf",
      "type": "Registerbekanntmachung nach dem Umwandlungsgesetz",
      "state": "Niedersachsen",
      "amtsgericht": "Amtsgericht Lüneburg",
      "registernummer": "HRA 202822",
      "registerart": "HRA",
      "company_name": "3B GmbH & Co. KG",
      "company_seat": "Eyendorf",
      "details": "06.10.2025 (Bekanntmachungsdatum)\n\nNiedersachsen Amtsgericht Lüneburg HRA 202822\nRegisterbekanntmachung nach dem Umwandlungsgesetz 06.10.2025 (Eintragungsdatum)\n\n3B GmbH & Co. KG\nKommanditgesellschaft\nEyendorf\n\nDen Gläubigern der an der Verschmelzung beteiligten Rechtsträger ist, wenn sie binnen sechs Monaten nach dem Tag, an dem die Eintragung der Verschmelzung in das Register des Sitzes desjenigen Rechtsträgers, dessen Gläubiger sie sind, nach § 19  Abs.  3 UmwG als bekannt gemacht gilt, ihren Anspruch nach Grund und Höhe schriftlich anmelden, Sicherheit zu leisten, soweit sie nicht Befriedigung verlangen können. Dieses Recht steht den Gläubigern jedoch nur zu, wenn sie glaubhaft machen, dass durch die Verschmelzung die Erfüllung der Forderung gefährdet wird."
    },
    {
      "date": "2025-10-06",
      "id": "132720",
      "original_text": "Registerbekanntmachung nach dem Umwandlungsgesetz\nNiedersachsen Amtsgericht Braunschweig HRB 207234\nGebr. Gehrke GmbH – Liebenburg",
      "type": "Registerbekanntmachung nach dem Umwandlungsgesetz",
      "state": "Niedersachsen",
      "amtsgericht": "Amtsgericht Braunschweig",
      "registernummer": "HRB 207234",
      "registerart": "HRB",
      "company_name": "Gebr. Gehrke GmbH",
      "company_seat": "Liebenburg",
      "details": "06.10.2025 (Bekanntmachungsdatum)\n\nNiedersachsen Amtsgericht Braunschweig HRB 207234\nRegisterbekanntmachung nach dem Umwandlungsgesetz 06.10.2025 (Eintragungsdatum)\n\nGebr. Gehrke GmbH\nGesellschaft mit beschränkter Haftung\nLiebenburg\n\nDen Gläubigern der an der Ausgliederung beteiligten Rechtsträger ist, wenn sie binnen sechs Monaten nach dem Tag, an dem die Eintragung der Ausgliederung in das Register des Sitzes desjenigen Rechtsträgers, dessen Gläubiger sie sind, nach § 19 Abs. 3 UmwG als bekannt gemacht gilt, ihren Anspruch nach Grund und Höhe schriftlich anmelden, Sicherheit zu leisten, soweit sie nicht Befriedigung verlangen können. Dieses Recht steht den Gläubigern jedoch nur zu, wenn sie glaubhaft machen, dass durch die Ausgliederung die Erfüllung der Forderung gefährdet wird."
    },
    {
      "date": "2025-10-06",
      "id": "132721",
      "original_text": "Registerbekanntmachung nach dem Umwandlungsgesetz\nNiedersachsen Amtsgericht Hannover HRB 229579\nGETEC Immobilien II GmbH – Hannover",
      "type": "Registerbekanntmachung nach dem Umwandlungsgesetz",
      "state": "Niedersachsen",
      "amtsgericht": "Amtsgericht Hannover",
      "registernummer": "HRB 229579",
      "registerart": "HRB",
      "company_name": "GETEC Immobilien II GmbH",
      "company_seat": "Hannover",
      "details": "06.10.2025 (Bekanntmachungsdatum)\n\nNiedersachsen Amtsgericht Hannover HRB 229579\nRegisterbekanntmachung nach dem Umwandlungsgesetz 06.10.2025 (Eintragungsdatum)\n\nGETEC Immobilien II GmbH\nGesellschaft mit beschränkter Haftung\nHannover\n\nDen Gläubigern der an der Abspaltung beteiligten Rechtsträger ist, wenn sie binnen sechs Monaten nach dem Tag, an dem die Eintragung der Abspaltung in das Register des Sitzes desjenigen Rechtsträgers, dessen Gläubiger sie sind, nach § 19 Abs. 3 UmwG als bekannt gemacht gilt, ihren Anspruch nach Grund und Höhe schriftlich anmelden, Sicherheit zu leisten, soweit sie nicht Befriedigung verlangen können. Dieses Recht steht den Gläubigern jedoch nur zu, wenn sie glaubhaft machen, dass durch die Abspaltung die Erfüllung der Forderung gefährdet wird."
    },
    {
      "date": "2025-10-06",
      "id": "132722",
      "original_text": "Registerbekanntmachung nach dem Umwandlungsgesetz\nNiedersachsen Amtsgericht Hannover HRB 215098\nGETEC Energie Holding GmbH – Hannover",
      "type": "Registerbekanntmachung nach dem Umwandlungsgesetz",
      "state": "Niedersachsen",
      "amtsgericht": "Amtsgericht Hannover",
      "registernummer": "HRB 215098",
      "registerart": "HRB",
      "company_name": "GETEC Energie Holding GmbH",
      "company_seat": "Hannover",
      "details": "06.10.2025 (Bekanntmachungsdatum)\n\nNiedersachsen Amtsgericht Hannover HRB 215098\nRegisterbekanntmachung nach dem Umwandlungsgesetz 06.10.2025 (Eintragungsdatum)\n\nGETEC Energie Holding GmbH\nGesellschaft mit beschränkter Haftung\nHannover\n\nDen Gläubigern der an der Abspaltung beteiligten Rechtsträger ist, wenn sie binnen sechs Monaten nach dem Tag, an dem die Eintragung der Abspaltung in das Register des Sitzes desjenigen Rechtsträgers, dessen Gläubiger sie sind, nach § 19 Abs. 3 UmwG als bekannt gemacht gilt, ihren Anspruch nach Grund und Höhe schriftlich anmelden, Sicherheit zu leisten, soweit sie nicht Befriedigung verlangen können. Dieses Recht steht den Gläubigern jedoch nur zu, wenn sie glaubhaft machen, dass durch die Abspaltung die Erfüllung der Forderung gefährdet wird."
    },
    {
      "date": "2025-10-06",
      "id": "132723",
      "original_text": "Registerbekanntmachung nach dem Umwandlungsgesetz\nNiedersachsen Amtsgericht Osnabrück HRB 220032\nFuchs Holztechnik GmbH – Dissen a.T.W.",
      "type": "Registerbekanntmachung nach dem Umwandlungsgesetz",
      "state": "Niedersachsen",
      "amtsgericht": "Amtsgericht Osnabrück",
      "registernummer": "HRB 220032",
      "registerart": "HRB",
      "company_name": "Fuchs Holztechnik GmbH",
      "company_seat": "Dissen a.T.W.",
      "details": "06.10.2025 (Bekanntmachungsdatum)\n\nNiedersachsen Amtsgericht Osnabrück HRB 220032\nRegisterbekanntmachung nach dem Umwandlungsgesetz 06.10.2025 (Eintragungsdatum)\n\nFuchs Holztechnik GmbH\nGesellschaft mit beschränkter Haftung\nDissen a.T.W.\n\nDen Gläubigern der an der Abspaltung beteiligten Rechtsträger ist, wenn sie binnen sechs Monaten nach dem Tag, an dem die Eintragung der Abspaltung in das Register des Sitzes desjenigen Rechtsträgers, dessen Gläubiger sie sind, nach § 19 Abs. 3 UmwG als bekannt gemacht gilt, ihren Anspruch nach Grund und Höhe schriftlich anmelden, Sicherheit zu leisten, soweit sie nicht Befriedigung verlangen können. Dieses Recht steht den Gläubigern jedoch nur zu, wenn sie glaubhaft machen, dass durch die Abspaltung die Erfüllung der Forderung gefährdet wird."
    },
    {
      "date": "2025-10-06",
      "id": "132724",
      "original_text": "Löschungsankündigung\nRheinland-Pfalz Amtsgericht Landau HRB 2625\nAutohaus Lingenfelder GmbH – Landau in der Pfalz",
      "type": "Löschungsankündigung",
      "state": "Rheinland-Pfalz",
      "amtsgericht": "Amtsgericht Landau",
      "registernummer": "HRB 2625",
      "registerart": "HRB",
      "company_name": "Autohaus Lingenfelder GmbH",
      "company_seat": "Landau in der Pfalz",
      "details": "06.10.2025 (Bekanntmachungsdatum)\n\nRheinland-Pfalz Amtsgericht Landau HRB 2625\nLöschungsankündigung\n\nAutohaus Lingenfelder GmbH\nGesellschaft mit beschränkter Haftung\nLandau in der Pfalz\n\nDas Registergericht beabsichtigt die Gesellschaft von Amts wegen nach § 394 FamFG zu löschen. Die Frist zur Erhebung eines Widerspruchs ist auf einen Monat festgesetzt."
    },
    {
      "date": "2025-10-06",
      "id": "132725",
      "original_text": "Registerbekanntmachung nach dem Umwandlungsgesetz\nRheinland-Pfalz Amtsgericht Mainz HRB 42853\nTekin Bau GmbH – Worms",
      "type": "Registerbekanntmachung nach dem Umwandlungsgesetz",
      "state": "Rheinland-Pfalz",
      "amtsgericht": "Amtsgericht Mainz",
      "registernummer": "HRB 42853",
      "registerart": "HRB",
      "company_name": "Tekin Bau GmbH",
      "company_seat": "Worms",
      "details": "06.10.2025 (Bekanntmachungsdatum)\n\nRheinland-Pfalz Amtsgericht Mainz HRB 42853\nRegisterbekanntmachung nach dem Umwandlungsgesetz 06.10.2025 (Eintragungsdatum)\n\nTekin Bau GmbH\nGesellschaft mit beschränkter Haftung\nWorms\n\nAls nicht eingetragen wird veröffentlicht: Den Gläubigern der an der Verschmelzung beteiligten Rechtsträger ist, wenn sie binnen sechs Monaten nach dem Tag, an dem die Eintragung der Verschmelzung in das Register des Sitzes desjenigen Rechtsträgers, dessen Gläubiger sie sind, nach § 19 Abs. 3 UmwG als bekannt gemacht gilt, ihren Anspruch nach Grund und Höhe schriftlich anmelden, Sicherheit zu leisten, soweit sie nicht Befriedigung verlangen können. Dieses Recht steht den Gläubigern jedoch nur zu, wenn sie glaubhaft machen, dass durch die Verschmelzung die Erfüllung der Forderung gefährdet wird."
    },
    {
      "date": "2025-10-06",
      "id": "132726",
      "original_text": "Registerbekanntmachung nach dem Umwandlungsgesetz\nRheinland-Pfalz Amtsgericht Mainz HRB 48229\nTEK Solution GmbH – Worms",
      "type": "Registerbekanntmachung nach dem Umwandlungsgesetz",
      "state": "Rheinland-Pfalz",
      "amtsgericht": "Amtsgericht Mainz",
      "registernummer": "HRB 48229",
      "registerart": "HRB",
      "company_name": "TEK Solution GmbH",
      "company_seat": "Worms",
      "details": "06.10.2025 (Bekanntmachungsdatum)\n\nRheinland-Pfalz Amtsgericht Mainz HRB 48229\nRegisterbekanntmachung nach dem Umwandlungsgesetz 06.10.2025 (Eintragungsdatum)\n\nTEK Solution GmbH\nGesellschaft mit beschränkter Haftung\nWorms\n\nAls nicht eingetragen wird veröffentlicht: Den Gläubigern der an der Verschmelzung beteiligten Rechtsträger ist, wenn sie binnen sechs Monaten nach dem Tag, an dem die Eintragung der Verschmelzung in das Register des Sitzes desjenigen Rechtsträgers, dessen Gläubiger sie sind, nach § 19 Abs. 3 UmwG als bekannt gemacht gilt, ihren Anspruch nach Grund und Höhe schriftlich anmelden, Sicherheit zu leisten, soweit sie nicht Befriedigung verlangen können. Dieses Recht steht den Gläubigern jedoch nur zu, wenn sie glaubhaft machen, dass durch die Verschmelzung die Erfüllung der Forderung gefährdet wird."
    },
    {
      "date": "2025-10-06",
      "id": "132727",
      "original_text": "Registerbekanntmachung nach dem Umwandlungsgesetz\nRheinland-Pfalz Amtsgericht Ludwigshafen a.Rhein (Ludwigshafen) HRB 51431\nCAPELLA VERLAG Speyer - Musikalien am Altpörtel GmbH – Speyer",
      "type": "Registerbekanntmachung nach dem Umwandlungsgesetz",
      "state": "Rheinland-Pfalz",
      "amtsgericht": "Amtsgericht Ludwigshafen a.Rhein (Ludwigshafen)",
      "registernummer": "HRB 51431",
      "registerart": "HRB",
      "company_name": "CAPELLA VERLAG Speyer - Musikalien am Altpörtel GmbH",
      "company_seat": "Speyer",
      "details": "06.10.2025 (Bekanntmachungsdatum)\n\nRheinland-Pfalz Amtsgericht Ludwigshafen a.Rhein (Ludwigshafen) HRB 51431\nRegisterbekanntmachung nach dem Umwandlungsgesetz 06.10.2025 (Eintragungsdatum)\n\nCAPELLA VERLAG Speyer  - Musikalien am Altpörtel GmbH\nGesellschaft mit beschränkter Haftung\nSpeyer\n\nAls nicht eingetragen wird veröffentlicht: Den Gläubigern der an der Verschmelzung beteiligten Rechtsträger ist, wenn sie binnen sechs Monaten nach dem Tag, an dem die Eintragung der Verschmelzung in das Register des Sitzes desjenigen Rechtsträgers, dessen Gläubiger sie sind, nach § 19 Abs. 3 UmwG als bekannt gemacht gilt, ihren Anspruch nach Grund und Höhe schriftlich anmelden, Sicherheit zu leisten, soweit sie nicht Befriedigung verlangen können. Dieses Recht steht den Gläubigern jedoch nur zu, wenn sie glaubhaft machen, dass durch die Verschmelzung die Erfüllung der Forderung gefährdet wird."
    },
    {
      "date": "2025-10-06",
      "id": "132728",
      "original_text": "Registerbekanntmachung nach dem Umwandlungsgesetz\nRheinland-Pfalz Amtsgericht Landau HRA 31106\nThorsten Klein Hausmeisterservice Der Dienstleister e.K. – Birkenhördt",
      "type": "Registerbekanntmachung nach dem Umwandlungsgesetz",
      "state": "Rheinland-Pfalz",
      "amtsgericht": "Amtsgericht Landau",
      "registernummer": "HRA 31106",
      "registerart": "HRA",
      "company_name": "Thorsten Klein Hausmeisterservice Der Dienstleister e.K.",
      "company_seat": "Birkenhördt",
      "details": "06.10.2025 (Bekanntmachungsdatum)\n\nRheinland-Pfalz Amtsgericht Landau HRA 31106\nRegisterbekanntmachung nach dem Umwandlungsgesetz 26.09.2025 (Eintragungsdatum)\n\nThorsten Klein Hausmeisterservice Der Dienstleister e.K.\nEinzelkaufmann / Einzelkauffrau\nBirkenhördt\n\nAls nicht eingetragen wird veröffentlicht: Den Gläubigern der an der Ausgliederung beteiligten Rechtsträger ist, wenn sie binnen sechs Monaten nach dem Tag, an dem die Eintragung der Ausgliederung in das Register des Sitzes desjenigen Rechtsträgers, dessen Gläubiger sie sind, nach § 19 Abs. 3 UmwG als bekannt gemacht gilt, ihren Anspruch nach Grund und Höhe schriftlich anmelden, Sicherheit zu leisten, soweit sie nicht Befriedigung verlangen können. Dieses Recht steht den Gläubigern jedoch nur zu, wenn sie glaubhaft machen, dass durch die Ausgliederung die Erfüllung der Forderung gefährdet wird."
    },
    {
      "date": "2025-10-06",
      "id": "132729",
      "original_text": "Löschungsankündigung\nRheinland-Pfalz Amtsgericht Zweibrücken HRB 22699\nWolfgang Magin Druckerei und Verlag GmbH – Rodalben",
      "type": "Löschungsankündigung",
      "state": "Rheinland-Pfalz",
      "amtsgericht": "Amtsgericht Zweibrücken",
      "registernummer": "HRB 22699",
      "registerart": "HRB",
      "company_name": "Wolfgang Magin Druckerei und Verlag GmbH",
      "company_seat": "Rodalben",
      "details": "06.10.2025 (Bekanntmachungsdatum)\n\nRheinland-Pfalz Amtsgericht Zweibrücken HRB 22699\nLöschungsankündigung\n\nWolfgang Magin Druckerei und Verlag GmbH\nGesellschaft mit beschränkter Haftung\nRodalben\n\nDas Registergericht beabsichtigt die Gesellschaft von Amts wegen nach § 394 FamFG zu löschen. Die Frist zur Erhebung eines Widerspruchs ist auf einen Monat festgesetzt."
    },
    {
      "date": "2025-10-06",
      "id": "132730",
      "original_text": "Registerbekanntmachung nach dem Umwandlungsgesetz\nRheinland-Pfalz Amtsgericht Ludwigshafen a.Rhein (Ludwigshafen) HRA 62445\nCapella-Verlag Inh. Ruth Zimbelmann e.K. – Speyer",
      "type": "Registerbekanntmachung nach dem Umwandlungsgesetz",
      "state": "Rheinland-Pfalz",
      "amtsgericht": "Amtsgericht Ludwigshafen a.Rhein (Ludwigshafen)",
      "registernummer": "HRA 62445",
      "registerart": "HRA",
      "company_name": "Capella-Verlag Inh. Ruth Zimbelmann e.K.",
      "company_seat": "Speyer",
      "details": "06.10.2025 (Bekanntmachungsdatum)\n\nRheinland-Pfalz Amtsgericht Ludwigshafen a.Rhein (Ludwigshafen) HRA 62445\nRegisterbekanntmachung nach dem Umwandlungsgesetz 06.10.2025 (Eintragungsdatum)\n\nCapella-Verlag Inh. Ruth Zimbelmann e.K.\nEinzelkaufmann / Einzelkauffrau\nSpeyer\n\nAls nicht eingetragen wird veröffentlicht: Den Gläubigern der an der Verschmelzung beteiligten Rechtsträger ist, wenn sie binnen sechs Monaten nach dem Tag, an dem die Eintragung der Verschmelzung in das Register des Sitzes desjenigen Rechtsträgers, dessen Gläubiger sie sind, nach § 19 Abs. 3 UmwG als bekannt gemacht gilt, ihren Anspruch nach Grund und Höhe schriftlich anmelden, Sicherheit zu leisten, soweit sie nicht Befriedigung verlangen können. Dieses Recht steht den Gläubigern jedoch nur zu, wenn sie glaubhaft machen, dass durch die Verschmelzung die Erfüllung der Forderung gefährdet wird."
    },
    {
      "date": "2025-10-06",
      "id": "132731",
      "original_text": "Löschungsankündigung\nRheinland-Pfalz Amtsgericht Zweibrücken HRB 23602\nTaxi-Garus GmbH – Pirmasens",
      "type": "Löschungsankündigung",
      "state": "Rheinland-Pfalz",
      "amtsgericht": "Amtsgericht Zweibrücken",
      "registernummer": "HRB 23602",
      "registerart": "HRB",
      "company_name": "Taxi-Garus GmbH",
      "company_seat": "Pirmasens",
      "details": "06.10.2025 (Bekanntmachungsdatum)\n\nRheinland-Pfalz Amtsgericht Zweibrücken HRB 23602\nLöschungsankündigung\n\nTaxi-Garus GmbH\nGesellschaft mit beschränkter Haftung\nPirmasens\n\nDas Registergericht beabsichtigt die Gesellschaft von Amts wegen nach § 394 FamFG zu löschen. Die Frist zur Erhebung eines Widerspruchs ist auf einen Monat festgesetzt."
    },
    {
      "date": "2025-10-06",
      "id": "132732",
      "original_text": "Registerbekanntmachung nach dem Umwandlungsgesetz\nRheinland-Pfalz Amtsgericht Wittlich HRB 45173\nmoccamedia GmbH – Trier",
      "type": "Registerbekanntmachung nach dem Umwandlungsgesetz",
      "state": "Rheinland-Pfalz",
      "amtsgericht": "Amtsgericht Wittlich",
      "registernummer": "HRB 45173",
      "registerart": "HRB",
      "company_name": "moccamedia GmbH",
      "company_seat": "Trier",
      "details": "06.10.2025 (Bekanntmachungsdatum)\n\nRheinland-Pfalz Amtsgericht Wittlich HRB 45173\nRegisterbekanntmachung nach dem Umwandlungsgesetz 06.10.2025 (Eintragungsdatum)\n\nmoccamedia GmbH\nGesellschaft mit beschränkter Haftung\nTrier\n\nDen Gläubigern der an der grenzüberschreitenden Verschmelzung beteiligten übernehmenden Rechtsträger ist, wenn sie binnen sechs Monaten nach dem Tag, an dem die Eintragung der Spaltung in das Register des Sitzes desjenigen Rechtsträgers, dessen Gläubiger sie sind, nach § 19 Absatz 3 UmwG als bekanntgemacht gilt, ihren Anspruch nach Grund und Höhe schriftlich anmelden, Sicherheit zu leisten, soweit sie nicht Befriedigung verlangen können.\n\nDieses Recht steht den Gläubigern jedoch nur zu, wenn sie glaubhaft machen, dass durch die Verschmelzung die Erfüllung ihrer Forderung gefährdet wird.\nAls nicht eingetragen wird veröffentlicht: Den Gläubigern der an der Verschmelzung beteiligten Rechtsträger ist, wenn sie binnen sechs Monaten nach dem Tag, an dem die Eintragung der Verschmelzung in das Register des Sitzes desjenigen Rechtsträgers,dessen Gläubiger sie sind, nach § 19 Abs. 3 UmwG als bekannt gemacht gilt, ihren Anspruch nach Grund und Höhe schriftlich anmelden, Sicherheit zu leisten, soweit sie nicht Befriedigung verlangen können. Dieses Recht steht den Gläubigern jedoch nur zu, wenn sie glaubhaft machen, dass durch die Verschmelzung die Erfüllung der Forderung gefährdet wird."
    },
    {
      "date": "2025-10-06",
      "id": "132733",
      "original_text": "Registerbekanntmachung nach dem Umwandlungsgesetz\nRheinland-Pfalz Amtsgericht Koblenz HRB 25747\nSHD Solutions GmbH – Andernach",
      "type": "Registerbekanntmachung nach dem Umwandlungsgesetz",
      "state": "Rheinland-Pfalz",
      "amtsgericht": "Amtsgericht Koblenz",
      "registernummer": "HRB 25747",
      "registerart": "HRB",
      "company_name": "SHD Solutions GmbH",
      "company_seat": "Andernach",
      "details": "06.10.2025 (Bekanntmachungsdatum)\n\nRheinland-Pfalz Amtsgericht Koblenz HRB 25747\nRegisterbekanntmachung nach dem Umwandlungsgesetz 06.10.2025 (Eintragungsdatum)\n\nSHD Solutions GmbH\nGesellschaft mit beschränkter Haftung\nAndernach\n\nAls nicht eingetragen wird veröffentlicht: Den Gläubigern der an der Verschmelzung beteiligten Rechtsträger ist, wenn sie binnen sechs Monaten nach dem Tag, an dem die Eintragung der Verschmelzung in das Register des Sitzes desjenigen Rechtsträgers,dessen Gläubiger sie sind, nach § 19 Abs. 3 UmwG als bekannt gemacht gilt, ihren Anspruch nach Grund und Höhe schriftlich anmelden, Sicherheit zu leisten, soweit sie nicht Befriedigung verlangen können. Dieses Recht steht den Gläubigern jedoch nur zu, wenn sie glaubhaft machen, dass durch die Verschmelzung die Erfüllungd er Forderung gefährdet wird."
    },
    {
      "date": "2025-10-06",
      "id": "132734",
      "original_text": "Sonstige Registerbekanntmachung\nRheinland-Pfalz Amtsgericht Wittlich HRB 44520\ndetailM GmbH – Trier",
      "type": "Sonstige Registerbekanntmachung",
      "state": "Rheinland-Pfalz",
      "amtsgericht": "Amtsgericht Wittlich",
      "registernummer": "HRB 44520",
      "registerart": "HRB",
      "company_name": "detailM GmbH",
      "company_seat": "Trier",
      "details": "06.10.2025 (Bekanntmachungsdatum)\n\nRheinland-Pfalz Amtsgericht Wittlich HRB 44520\nSonstige Registerbekanntmachung\n\ndetailM GmbH\nGesellschaft mit beschränkter Haftung\nTrier\n\nAls nicht eingetragen wird veröffentlicht: Den Gläubigern der Gesellschaft, deren Forderungen begründet worden sind, bevor die Eintragung der Beendigung des Gewinnabführungsvertrages in das Handelsregister nach § 10 des Handelsgesetzbuches als bekanntgemacht gilt, hat der andere Vertragsteil Sicherheit zu leisten, wenn sie sich binnen sechs Monaten nach der Bekanntmachung der Eintragung zu diesem Zweck bei ihm melden."
    },
    {
      "date": "2025-10-06",
      "id": "132735",
      "original_text": "Löschungsankündigung\nRheinland-Pfalz Amtsgericht Wittlich HRB 44754\nParcelution GmbH – Osburg",
      "type": "Löschungsankündigung",
      "state": "Rheinland-Pfalz",
      "amtsgericht": "Amtsgericht Wittlich",
      "registernummer": "HRB 44754",
      "registerart": "HRB",
      "company_name": "Parcelution GmbH",
      "company_seat": "Osburg",
      "details": "06.10.2025 (Bekanntmachungsdatum)\n\nRheinland-Pfalz Amtsgericht Wittlich HRB 44754\nLöschungsankündigung\n\nParcelution GmbH\nGesellschaft mit beschränkter Haftung\nOsburg\n\nDas Registergericht beabsichtigt die Gesellschaft von Amts wegen nach § 394 FamFG zu löschen. Die Frist zur Erhebung eines Widerspruchs ist auf einen Monat festgesetzt."
    },
    {
      "date": "2025-10-06",
      "id": "132736",
      "original_text": "Registerbekanntmachung nach dem Umwandlungsgesetz\nNordrhein-Westfalen Amtsgericht Dortmund HRB 37641\nKIRSTENS by Kirsten Staegemeir GmbH – Dortmund",
      "type": "Registerbekanntmachung nach dem Umwandlungsgesetz",
      "state": "Nordrhein-Westfalen",
      "amtsgericht": "Amtsgericht Dortmund",
      "registernummer": "HRB 37641",
      "registerart": "HRB",
      "company_name": "KIRSTENS by Kirsten Staegemeir GmbH",
      "company_seat": "Dortmund",
      "details": "06.10.2025 (Bekanntmachungsdatum)\n\nNordrhein-Westfalen Amtsgericht Dortmund HRB 37641\nRegisterbekanntmachung nach dem Umwandlungsgesetz 06.10.2025 (Eintragungsdatum)\n\nKIRSTENS by Kirsten Staegemeir GmbH\nGesellschaft mit beschränkter Haftung\nDortmund\n\nDen Gläubigern der an der Ausgliederung beteiligten Rechtsträger ist, wenn sie binnen sechs Monaten nach dem Tag, an dem die Eintragung der Ausgliederung in das Register des Sitzes desjenigen Rechtsträgers, dessen Gläubiger sie sind, nach § 19 Absatz 3 UmwG als bekanntgemacht gilt, ihren Anspruch nach Grund und Höhe schriftlich anmelden, Sicherheit zu leisten, soweit sie nicht Befriedigung verlangen können. Dieses Recht steht den Gläubigern jedoch nur zu, wenn sie glaubhaft machen, dass durch die Ausgliederung die Erfüllung ihrer Forderung gefährdet wird."
    },
    {
      "date": "2025-10-06",
      "id": "132737",
      "original_text": "Registerbekanntmachung nach dem Umwandlungsgesetz\nNordrhein-Westfalen Amtsgericht Siegburg HRB 18481\nkälte cöllen gmbh – Siegburg",
      "type": "Registerbekanntmachung nach dem Umwandlungsgesetz",
      "state": "Nordrhein-Westfalen",
      "amtsgericht": "Amtsgericht Siegburg",
      "registernummer": "HRB 18481",
      "registerart": "HRB",
      "company_name": "kälte cöllen gmbh",
      "company_seat": "Siegburg",
      "details": "06.10.2025 (Bekanntmachungsdatum)\n\nNordrhein-Westfalen Amtsgericht Siegburg HRB 18481\nRegisterbekanntmachung nach dem Umwandlungsgesetz 06.10.2025 (Eintragungsdatum)\n\nkälte cöllen gmbh\nGesellschaft mit beschränkter Haftung\nSiegburg\n\nDen Gläubigern der an der Verschmelzung beteiligten Rechtsträger ist, wenn sie binnen sechs Monaten nach dem Tag, an dem die Eintragung der Verschmelzung in das Register des Sitzes desjenigen Rechtsträgers, dessen Gläubiger sie sind, nach § 19 Absatz 3 UmwG als bekanntgemacht gilt, ihren Anspruch nach Grund und Höhe schriftlich anmelden, Sicherheit zu leisten, soweit sie nicht Befriedigung verlangen können. Dieses Recht steht den Gläubigern jedoch nur zu, wenn sie glaubhaft machen, dass durch die Verschmelzung die Erfüllung ihrer Forderung gefährdet wird."
    },
    {
      "date": "2025-10-06",
      "id": "132738",
      "original_text": "Löschungsankündigung\nNordrhein-Westfalen Amtsgericht Köln HRB 84281\nWWD World Wide Digital GmbH – Köln",
      "type": "Löschungsankündigung",
      "state": "Nordrhein-Westfalen",
      "amtsgericht": "Amtsgericht Köln",
      "registernummer": "HRB 84281",
      "registerart": "HRB",
      "company_name": "WWD World Wide Digital GmbH",
      "company_seat": "Köln",
      "details": "06.10.2025 (Bekanntmachungsdatum)\n\nNordrhein-Westfalen Amtsgericht Köln HRB 84281\nLöschungsankündigung\n\nWWD World Wide Digital GmbH\nGesellschaft mit beschränkter Haftung\nKöln\n\nDas Registergericht beabsichtigt die Gesellschaft von Amts wegen nach § 394 FamFG zu löschen. Die Frist zur Erhebung eines Widerspruchs ist auf einen Monat festgesetzt."
    },
    {
      "date": "2025-10-06",
      "id": "132739",
      "original_text": "Einreichung neuer Dokumente\nNordrhein-Westfalen Amtsgericht Essen HRB 28810\nRAG AKTIENGESELLSCHAFT – Essen",
      "type": "Einreichung neuer Dokumente",
      "state": "Nordrhein-Westfalen",
      "amtsgericht": "Amtsgericht Essen",
      "registernummer": "HRB 28810",
      "registerart": "HRB",
      "company_name": "RAG AKTIENGESELLSCHAFT",
      "company_seat": "Essen",
      "details": "06.10.2025 (Bekanntmachungsdatum)\n\nNordrhein-Westfalen Amtsgericht Essen HRB 28810\nEinreichung neuer Dokumente\n\nRAG AKTIENGESELLSCHAFT\nAktiengesellschaft\nEssen\n\nDem Registergericht ist eine Liste der Mitglieder des Aufsichtsrates eingereicht worden."
    },
    {
      "date": "2025-10-06",
      "id": "132740",
      "original_text": "Löschungsankündigung\nNordrhein-Westfalen Amtsgericht Bad Oeynhausen HRB 18687\nBERKUT Logistik UG (haftungsbeschränkt) – Herford",
      "type": "Löschungsankündigung",
      "state": "Nordrhein-Westfalen",
      "amtsgericht": "Amtsgericht Bad Oeynhausen",
      "registernummer": "HRB 18687",
      "registerart": "HRB",
      "company_name": "BERKUT Logistik UG (haftungsbeschränkt)",
      "company_seat": "Herford",
      "details": "06.10.2025 (Bekanntmachungsdatum)\n\nNordrhein-Westfalen Amtsgericht Bad Oeynhausen HRB 18687\nLöschungsankündigung\n\nBERKUT Logistik UG (haftungsbeschränkt)\nGesellschaft mit beschränkter Haftung\nHerford\n\nDas Registergericht beabsichtigt die Gesellschaft von Amts wegen nach § 394 FamFG zu löschen. Die Frist zur Erhebung eines Widerspruchs ist auf zwei Monate festgesetzt."
    },
    {
      "date": "2025-10-06",
      "id": "132741",
      "original_text": "Registerbekanntmachung nach dem Umwandlungsgesetz\nNordrhein-Westfalen Amtsgericht Essen PR 5279\nSteuerberater Koenig & Partner mbB – Aachen",
      "type": "Registerbekanntmachung nach dem Umwandlungsgesetz",
      "state": "Nordrhein-Westfalen",
      "amtsgericht": "Amtsgericht Essen",
      "registernummer": "PR 5279",
      "registerart": "PR",
      "company_name": "Steuerberater Koenig & Partner mbB",
      "company_seat": "Aachen",
      "details": "06.10.2025 (Bekanntmachungsdatum)\n\nNordrhein-Westfalen Amtsgericht Essen PR 5279\nRegisterbekanntmachung nach dem Umwandlungsgesetz 06.10.2025 (Eintragungsdatum)\n\nSteuerberater Koenig & Partner mbB\nPartnerschaftsgesellschaft\nAachen\n\nDen Gläubigern der an der Verschmelzung beteiligten Rechtsträger ist, wenn sie binnen sechs Monaten nach dem Tag, an dem die Eintragung der Verschmelzung in das Register des Sitzes desjenigen Rechtsträgers, dessen Gläubiger sie sind, nach § 19 Absatz 3 UmwG als bekanntgemacht gilt, ihren Anspruch nach Grund und Höhe schriftlich anmelden, Sicherheit zu leisten, soweit sie nicht Befriedigung verlangen können. Dieses Recht steht den Gläubigern jedoch nur zu, wenn sie glaubhaft machen, dass durch die Verschmelzung die Erfüllung ihrer Forderung gefährdet wird."
    },
    {
      "date": "2025-10-06",
      "id": "132742",
      "original_text": "Registerbekanntmachung nach dem Umwandlungsgesetz\nNordrhein-Westfalen Amtsgericht Iserlohn HRB 5370\nEhrenberg GmbH – Nachrodt-Wiblingwerde",
      "type": "Registerbekanntmachung nach dem Umwandlungsgesetz",
      "state": "Nordrhein-Westfalen",
      "amtsgericht": "Amtsgericht Iserlohn",
      "registernummer": "HRB 5370",
      "registerart": "HRB",
      "company_name": "Ehrenberg GmbH",
      "company_seat": "Nachrodt-Wiblingwerde",
      "details": "06.10.2025 (Bekanntmachungsdatum)\n\nNordrhein-Westfalen Amtsgericht Iserlohn HRB 5370\nRegisterbekanntmachung nach dem Umwandlungsgesetz 01.10.2025 (Eintragungsdatum)\n\nEhrenberg GmbH\nGesellschaft mit beschränkter Haftung\nNachrodt-Wiblingwerde\n\nDen Gläubigern der an der Verschmelzung beteiligten Rechtsträger ist, wenn sie binnen sechs Monaten nach dem Tag, an dem die Eintragung der Verschmelzung in das Register des Sitzes desjenigen Rechtsträgers, dessen Gläubiger sie sind, nach § 19 Absatz 3 UmwG als bekanntgemacht gilt, ihren Anspruch nach Grund und Höhe schriftlich anmelden, Sicherheit zu leisten, soweit sie nicht Befriedigung verlangen können. Dieses Recht steht den Gläubigern jedoch nur zu, wenn sie glaubhaft machen, dass durch die Verschmelzung die Erfüllung ihrer Forderung gefährdet wird."
    },
    {
      "date": "2025-10-06",
      "id": "132743",
      "original_text": "Registerbekanntmachung nach dem Umwandlungsgesetz\nNordrhein-Westfalen Amtsgericht Münster HRA 12190\nAribert Rotthowe - Beratungsdienstleistungen e.K. – Münster",
      "type": "Registerbekanntmachung nach dem Umwandlungsgesetz",
      "state": "Nordrhein-Westfalen",
      "amtsgericht": "Amtsgericht Münster",
      "registernummer": "HRA 12190",
      "registerart": "HRA",
      "company_name": "Aribert Rotthowe - Beratungsdienstleistungen e.K.",
      "company_seat": "Münster",
      "details": "06.10.2025 (Bekanntmachungsdatum)\n\nNordrhein-Westfalen Amtsgericht Münster HRA 12190\nRegisterbekanntmachung nach dem Umwandlungsgesetz 06.10.2025 (Eintragungsdatum)\n\nAribert Rotthowe - Beratungsdienstleistungen e.K.\nEinzelkaufmann / Einzelkauffrau\nMünster\n\nDen Gläubigern der an der Verschmelzung beteiligten Rechtsträger ist, wenn sie binnen sechs Monaten nach dem Tag, an dem die Eintragung der Verschmelzung in das Register des Sitzes desjenigen Rechtsträgers, dessen Gläubiger sie sind, nach § 19 Absatz 3 UmwG als bekanntgemacht gilt, ihren Anspruch nach Grund und Höhe schriftlich anmelden, Sicherheit zu leisten, soweit sie nicht Befriedigung verlangen können. Dieses Recht steht den Gläubigern jedoch nur zu, wenn sie glaubhaft machen, dass durch die Verschmelzung die Erfüllung ihrer Forderung gefährdet wird."
    },
    {
      "date": "2025-10-06",
      "id": "132744",
      "original_text": "Registerbekanntmachung nach dem Umwandlungsgesetz\nNordrhein-Westfalen Amtsgericht Hamm HRB 11995\nKreikenberg Asset Management GmbH – Hamm",
      "type": "Registerbekanntmachung nach dem Umwandlungsgesetz",
      "state": "Nordrhein-Westfalen",
      "amtsgericht": "Amtsgericht Hamm",
      "registernummer": "HRB 11995",
      "registerart": "HRB",
      "company_name": "Kreikenberg Asset Management GmbH",
      "company_seat": "Hamm",
      "details": "06.10.2025 (Bekanntmachungsdatum)\n\nNordrhein-Westfalen Amtsgericht Hamm HRB 11995\nRegisterbekanntmachung nach dem Umwandlungsgesetz 06.10.2025 (Eintragungsdatum)\n\nKreikenberg Asset Management GmbH\nGesellschaft mit beschränkter Haftung\nHamm\n\nDen Gläubigern der an der formwechselnden Umwandlung beteiligten Rechtsträger ist, wenn sie binnen sechs Monaten nach dem Tag, an dem die Eintragung der formwechselnden Umwandlung in das Register des Sitzes derjenigen Rechtsträger deren Gläubiger sie sind, nach § 19 Absatz 3 UmwG als bekanntgemacht gilt, ihren Anspruch nach Grund und Höhe schriftlich anmelden, Sicherheit zu leisten, soweit sie nicht Befriedigung verlangen können. Dieses Recht steht den Gläubigern jedoch nur zu, wenn sie glaubhaft machen, dass durch die formwechselnden Umwandlung die Erfüllung ihrer Forderung gefährdet wird."
    },
    {
      "date": "2025-10-06",
      "id": "132745",
      "original_text": "Registerbekanntmachung nach dem Umwandlungsgesetz\nNordrhein-Westfalen Amtsgericht Düsseldorf HRB 90866\nPegasus Investment GmbH – Monheim am Rhein",
      "type": "Registerbekanntmachung nach dem Umwandlungsgesetz",
      "state": "Nordrhein-Westfalen",
      "amtsgericht": "Amtsgericht Düsseldorf",
      "registernummer": "HRB 90866",
      "registerart": "HRB",
      "company_name": "Pegasus Investment GmbH",
      "company_seat": "Monheim am Rhein",
      "details": "06.10.2025 (Bekanntmachungsdatum)\n\nNordrhein-Westfalen Amtsgericht Düsseldorf HRB 90866\nRegisterbekanntmachung nach dem Umwandlungsgesetz 06.10.2025 (Eintragungsdatum)\n\nPegasus Investment GmbH\nGesellschaft mit beschränkter Haftung\nMonheim am Rhein\n\nDen Gläubigern der an der Verschmelzung beteiligten Rechtsträger ist, wenn sie binnen sechs Monaten nach dem Tag, an dem die Eintragung der Verschmelzung in das Register des Sitzes desjenigen Rechtsträgers, dessen Gläubiger sie sind, nach § 19 Absatz 3 UmwG als bekanntgemacht gilt, ihren Anspruch nach Grund und Höhe schriftlich anmelden, Sicherheit zu leisten, soweit sie nicht Befriedigung verlangen können. Dieses Recht steht den Gläubigern jedoch nur zu, wenn sie glaubhaft machen, dass durch die Verschmelzung die Erfüllung ihrer Forderung gefährdet wird."
    },
    {
      "date": "2025-10-06",
      "id": "132746",
      "original_text": "Registerbekanntmachung nach dem Umwandlungsgesetz\nNordrhein-Westfalen Amtsgericht Kleve HRB 1684\nFUJIFILM Electronic Imaging Europe GmbH – Kleve",
      "type": "Registerbekanntmachung nach dem Umwandlungsgesetz",
      "state": "Nordrhein-Westfalen",
      "amtsgericht": "Amtsgericht Kleve",
      "registernummer": "HRB 1684",
      "registerart": "HRB",
      "company_name": "FUJIFILM Electronic Imaging Europe GmbH",
      "company_seat": "Kleve",
      "details": "06.10.2025 (Bekanntmachungsdatum)\n\nNordrhein-Westfalen Amtsgericht Kleve HRB 1684\nRegisterbekanntmachung nach dem Umwandlungsgesetz 06.10.2025 (Eintragungsdatum)\n\nFUJIFILM Electronic Imaging Europe GmbH\nGesellschaft mit beschränkter Haftung\nKleve\n\nDen Gläubigern der an der Verschmelzung beteiligten Rechtsträger ist, wenn sie binnen sechs Monaten nach dem Tag, an dem die Eintragung der Verschmelzung in das Register des Sitzes derjenigen Rechtsträger deren Gläubiger sie sind, nach § 19 Absatz 3 UmwG als bekanntgemacht gilt, ihren Anspruch nach Grund und Höhe schriftlich anmelden, Sicherheit zu leisten, soweit sie nicht Befriedigung verlangen können. Dieses Recht steht den Gläubigern jedoch nur zu, wenn sie glaubhaft machen, dass durch die Verschmelzung die Erfüllung ihrer Forderung gefährdet wird."
    },
    {
      "date": "2025-10-06",
      "id": "132747",
      "original_text": "Registerbekanntmachung nach dem Umwandlungsgesetz\nNordrhein-Westfalen Amtsgericht Hamm HRA 2493\nRhenus Assets & Services GmbH & Co. KG – Holzwickede",
      "type": "Registerbekanntmachung nach dem Umwandlungsgesetz",
      "state": "Nordrhein-Westfalen",
      "amtsgericht": "Amtsgericht Hamm",
      "registernummer": "HRA 2493",
      "registerart": "HRA",
      "company_name": "Rhenus Assets & Services GmbH & Co. KG",
      "company_seat": "Holzwickede",
      "details": "06.10.2025 (Bekanntmachungsdatum)\n\nNordrhein-Westfalen Amtsgericht Hamm HRA 2493\nRegisterbekanntmachung nach dem Umwandlungsgesetz 06.10.2025 (Eintragungsdatum)\n\nRhenus Assets & Services GmbH & Co. KG\nKommanditgesellschaft\nHolzwickede\n\nDen Gläubigern der an der Abspaltung beteiligten Rechtsträger ist, wenn sie binnen sechs Monaten nach dem Tag, an dem die Eintragung der Abspaltung in das Register des Sitzes desjenigen Rechtsträgers, dessen Gläubiger sie sind, nach § 19 Absatz 3 UmwG als bekanntgemacht gilt, ihren Anspruch nach Grund und Höhe schriftlich anmelden, Sicherheit zu leisten, soweit sie nicht Befriedigung verlangen können. Dieses Recht steht den Gläubigern jedoch nur zu, wenn sie glaubhaft machen, dass durch die Abspaltung die Erfüllung ihrer Forderung gefährdet wird."
    },
    {
      "date": "2025-10-06",
      "id": "132748",
      "original_text": "Registerbekanntmachung nach dem Umwandlungsgesetz\nNordrhein-Westfalen Amtsgericht Bonn GnR 300\nGemeinnützige Wohnungsgenossenschaft eingetragene Genossenschaft – Bonn",
      "type": "Registerbekanntmachung nach dem Umwandlungsgesetz",
      "state": "Nordrhein-Westfalen",
      "amtsgericht": "Amtsgericht Bonn",
      "registernummer": "GnR 300",
      "registerart": "GnR",
      "company_name": "Gemeinnützige Wohnungsgenossenschaft eingetragene Genossenschaft",
      "company_seat": "Bonn",
      "details": "06.10.2025 (Bekanntmachungsdatum)\n\nNordrhein-Westfalen Amtsgericht Bonn GnR 300\nRegisterbekanntmachung nach dem Umwandlungsgesetz 06.10.2025 (Eintragungsdatum)\n\nGemeinnützige Wohnungsgenossenschaft eingetragene Genossenschaft\neingetragene Genossenschaft\nBonn\n\nDen Gläubigern der an der Verschmelzung beteiligten Rechtsträger ist, wenn sie binnen sechs Monaten nach dem Tag, an dem die Eintragung der Verschmelzung in das Register des Sitzes desjenigen Rechtsträgers, dessen Gläubiger sie sind, nach § 19 Absatz 3 UmwG als bekanntgemacht gilt, ihren Anspruch nach Grund und Höhe schriftlich anmelden, Sicherheit zu leisten, soweit sie nicht Befriedigung verlangen können. Dieses Recht steht den Gläubigern jedoch nur zu, wenn sie glaubhaft machen, dass durch die Verschmelzung die Erfüllung ihrer Forderung gefährdet wird."
    },
    {
      "date": "2025-10-06",
      "id": "132749",
      "original_text": "Registerbekanntmachung nach dem Umwandlungsgesetz\nNordrhein-Westfalen Amtsgericht Hamm HRB 11994\nAm Eichenwäldchen gGmbH – Hamm",
      "type": "Registerbekanntmachung nach dem Umwandlungsgesetz",
      "state": "Nordrhein-Westfalen",
      "amtsgericht": "Amtsgericht Hamm",
      "registernummer": "HRB 11994",
      "registerart": "HRB",
      "company_name": "Am Eichenwäldchen gGmbH",
      "company_seat": "Hamm",
      "details": "06.10.2025 (Bekanntmachungsdatum)\n\nNordrhein-Westfalen Amtsgericht Hamm HRB 11994\nRegisterbekanntmachung nach dem Umwandlungsgesetz 06.10.2025 (Eintragungsdatum)\n\nAm Eichenwäldchen gGmbH\nGesellschaft mit beschränkter Haftung\nHamm\n\nDen Gläubigern der an der formwechselnden Umwandlung beteiligten Rechtsträger ist, wenn sie binnen sechs Monaten nach dem Tag, an dem die Eintragung der formwechselnden Umwandlung in das Register des Sitzes desjenigen Rechtsträgers, dessen Gläubiger sie sind, nach § 19 Absatz 3 UmwG als bekanntgemacht gilt, ihren Anspruch nach Grund und Höhe schriftlich anmelden, Sicherheit zu leisten, soweit sie nicht Befriedigung verlangen können. Dieses Recht steht den Gläubigern jedoch nur zu, wenn sie glaubhaft machen, dass durch die formwechselnden Umwandlung die Erfüllung ihrer Forderung gefährdet wird."
    },
    {
      "date": "2025-10-06",
      "id": "132750",
      "original_text": "Registerbekanntmachung nach dem Umwandlungsgesetz\nNordrhein-Westfalen Amtsgericht Bad Oeynhausen HRA 10638\nMichael Wurzel e.K. – Porta Westfalica",
      "type": "Registerbekanntmachung nach dem Umwandlungsgesetz",
      "state": "Nordrhein-Westfalen",
      "amtsgericht": "Amtsgericht Bad Oeynhausen",
      "registernummer": "HRA 10638",
      "registerart": "HRA",
      "company_name": "Michael Wurzel e.K.",
      "company_seat": "Porta Westfalica",
      "details": "06.10.2025 (Bekanntmachungsdatum)\n\nNordrhein-Westfalen Amtsgericht Bad Oeynhausen HRA 10638\nRegisterbekanntmachung nach dem Umwandlungsgesetz 06.10.2025 (Eintragungsdatum)\n\nMichael Wurzel e.K.\nEinzelkaufmann / Einzelkauffrau\nPorta Westfalica\n\nDen Gläubigern der an der Ausgliederung beteiligten Rechtsträger ist, wenn sie binnen sechs Monaten nach dem Tag, an dem die Eintragung der Ausgliederung in das Register des Sitzes desjenigen Rechtsträgers, dessen Gläubiger sie sind, nach § 19 Absatz 3 UmwG als bekanntgemacht gilt, ihren Anspruch nach Grund und Höhe schriftlich anmelden, Sicherheit zu leisten, soweit sie nicht Befriedigung verlangen können. Dieses Recht steht den Gläubigern jedoch nur zu, wenn sie glaubhaft machen, dass durch die Ausgliederung die Erfüllung ihrer Forderung gefährdet wird."
    },
    {
      "date": "2025-10-06",
      "id": "132751",
      "original_text": "Löschungsankündigung\nNordrhein-Westfalen Amtsgericht Dortmund HRB 22439\nNET V Verwaltungs UG (haftungsbeschränkt) – Dortmund",
      "type": "Löschungsankündigung",
      "state": "Nordrhein-Westfalen",
      "amtsgericht": "Amtsgericht Dortmund",
      "registernummer": "HRB 22439",
      "registerart": "HRB",
      "company_name": "NET V Verwaltungs UG (haftungsbeschränkt)",
      "company_seat": "Dortmund",
      "details": "06.10.2025 (Bekanntmachungsdatum)\n\nNordrhein-Westfalen Amtsgericht Dortmund HRB 22439\nLöschungsankündigung\n\nNET V Verwaltungs UG (haftungsbeschränkt)\nGesellschaft mit beschränkter Haftung\nDortmund\n\nDas Registergericht beabsichtigt die Gesellschaft von Amts wegen nach § 394 FamFG zu löschen. Die Frist zur Erhebung eines Widerspruchs ist auf zwei Monate festgesetzt."
    },
    {
      "date": "2025-10-06",
      "id": "132752",
      "original_text": "Registerbekanntmachung nach dem Umwandlungsgesetz\nNordrhein-Westfalen Amtsgericht Münster GnR 380\nVR Bank Westfalen-Lippe eG – Münster",
      "type": "Registerbekanntmachung nach dem Umwandlungsgesetz",
      "state": "Nordrhein-Westfalen",
      "amtsgericht": "Amtsgericht Münster",
      "registernummer": "GnR 380",
      "registerart": "GnR",
      "company_name": "VR Bank Westfalen-Lippe eG",
      "company_seat": "Münster",
      "details": "06.10.2025 (Bekanntmachungsdatum)\n\nNordrhein-Westfalen Amtsgericht Münster GnR 380\nRegisterbekanntmachung nach dem Umwandlungsgesetz 06.10.2025 (Eintragungsdatum)\n\nVR Bank Westfalen-Lippe eG\neingetragene Genossenschaft\nMünster\n\nDen Gläubigern der an der Verschmelzung beteiligten Rechtsträger ist, wenn sie binnen sechs Monaten nach dem Tag, an dem die Eintragung der Verschmelzung in das Register des Sitzes desjenigen Rechtsträgers, dessen Gläubiger sie sind, nach § 19 Absatz 3 UmwG als bekanntgemacht gilt, ihren Anspruch nach Grund und Höhe schriftlich anmelden, Sicherheit zu leisten, soweit sie nicht Befriedigung verlangen können. Dieses Recht steht den Gläubigern jedoch nur zu, wenn sie glaubhaft machen, dass durch die Verschmelzung die Erfüllung ihrer Forderung gefährdet wird."
    },
    {
      "date": "2025-10-06",
      "id": "132753",
      "original_text": "Registerbekanntmachung nach dem Umwandlungsgesetz\nNordrhein-Westfalen Amtsgericht Duisburg HRB 39583\nKOMIS Immobilien GmbH – Oberhausen",
      "type": "Registerbekanntmachung nach dem Umwandlungsgesetz",
      "state": "Nordrhein-Westfalen",
      "amtsgericht": "Amtsgericht Duisburg",
      "registernummer": "HRB 39583",
      "registerart": "HRB",
      "company_name": "KOMIS Immobilien GmbH",
      "company_seat": "Oberhausen",
      "details": "06.10.2025 (Bekanntmachungsdatum)\n\nNordrhein-Westfalen Amtsgericht Duisburg HRB 39583\nRegisterbekanntmachung nach dem Umwandlungsgesetz 06.10.2025 (Eintragungsdatum)\n\nKOMIS Immobilien GmbH\nGesellschaft mit beschränkter Haftung\nOberhausen\n\nDie Gesellschaft hat Gläubigern, deren Forderungen vor dieser Bekanntmachung begründet worden sind, Sicherheit zu leisten, soweit sie nicht Befriedigung verlangen können, wenn sie sich binnen sechs Monaten zu diesem Zweck melden."
    },
    {
      "date": "2025-10-06",
      "id": "132754",
      "original_text": "Registerbekanntmachung nach dem Umwandlungsgesetz\nNordrhein-Westfalen Amtsgericht Hamm HRB 11996\nARISTO Investment GmbH – Unna",
      "type": "Registerbekanntmachung nach dem Umwandlungsgesetz",
      "state": "Nordrhein-Westfalen",
      "amtsgericht": "Amtsgericht Hamm",
      "registernummer": "HRB 11996",
      "registerart": "HRB",
      "company_name": "ARISTO Investment GmbH",
      "company_seat": "Unna",
      "details": "06.10.2025 (Bekanntmachungsdatum)\n\nNordrhein-Westfalen Amtsgericht Hamm HRB 11996\nRegisterbekanntmachung nach dem Umwandlungsgesetz 06.10.2025 (Eintragungsdatum)\n\nARISTO Investment GmbH\nGesellschaft mit beschränkter Haftung\nUnna\n\nDen Gläubigern der an der formwechselnden Umwandlung beteiligten Rechtsträger ist, wenn sie binnen sechs Monaten nach dem Tag, an dem die Eintragung der formwechselnden Umwandlung in das Register des Sitzes derjenigen Rechtsträger deren Gläubiger sie sind, nach § 19 Absatz 3 UmwG als bekanntgemacht gilt, ihren Anspruch nach Grund und Höhe schriftlich anmelden, Sicherheit zu leisten, soweit sie nicht Befriedigung verlangen können. Dieses Recht steht den Gläubigern jedoch nur zu, wenn sie glaubhaft machen, dass durch die formwechselnden Umwandlung die Erfüllung ihrer Forderung gefährdet wird.Den Gläubigern der an der formwechselnden Umwandlung beteiligten Rechtsträger ist, wenn sie binnen sechs Monaten nach dem Tag, an dem die Eintragung der formwechselnden Umwandlung in das Register des Sitzes derjenigen Rechtsträger deren Gläubiger sie sind, nach § 19 Absatz 3 UmwG als bekanntgemacht gilt, ihren Anspruch nach Grund und Höhe schriftlich anmelden, Sicherheit zu leisten, soweit sie nicht Befriedigung verlangen können. Dieses Recht steht den Gläubigern jedoch nur zu, wenn sie glaubhaft machen, dass durch die formwechselnden Umwandlung die Erfüllung ihrer Forderung gefährdet wird."
    },
    {
      "date": "2025-10-06",
      "id": "132755",
      "original_text": "Löschungsankündigung\nNordrhein-Westfalen Amtsgericht Mönchengladbach HRB 19847\nKWT Nettetal UG (haftungsbeschränkt) – Viersen",
      "type": "Löschungsankündigung",
      "state": "Nordrhein-Westfalen",
      "amtsgericht": "Amtsgericht Mönchengladbach",
      "registernummer": "HRB 19847",
      "registerart": "HRB",
      "company_name": "KWT Nettetal UG (haftungsbeschränkt)",
      "company_seat": "Viersen",
      "details": "06.10.2025 (Bekanntmachungsdatum)\n\nNordrhein-Westfalen Amtsgericht Mönchengladbach HRB 19847\nLöschungsankündigung\n\nKWT Nettetal UG (haftungsbeschränkt)\nGesellschaft mit beschränkter Haftung\nViersen\n\nDas Registergericht beabsichtigt, die im Handelsregister eingetragene Gesellschaft gemäß § 394 Absatz 1 FamFG wegen Vermögenslosigkeit von Amts wegen zu löschen. Gegen diese Verfügung kann Widerspruch eingelegt werden. Die Frist zur Erhebung eines Widerspruchs gegen die beabsichtigte Löschung von Amts wegen ist auf zwei Monate festgesetzt."
    },
    {
      "date": "2025-10-06",
      "id": "132756",
      "original_text": "Registerbekanntmachung nach dem Umwandlungsgesetz\nNordrhein-Westfalen Amtsgericht Kleve HRB 935\nFUJIFILM Recording Media GmbH – Kleve",
      "type": "Registerbekanntmachung nach dem Umwandlungsgesetz",
      "state": "Nordrhein-Westfalen",
      "amtsgericht": "Amtsgericht Kleve",
      "registernummer": "HRB 935",
      "registerart": "HRB",
      "company_name": "FUJIFILM Recording Media GmbH",
      "company_seat": "Kleve",
      "details": "06.10.2025 (Bekanntmachungsdatum)\n\nNordrhein-Westfalen Amtsgericht Kleve HRB 935\nRegisterbekanntmachung nach dem Umwandlungsgesetz 06.10.2025 (Eintragungsdatum)\n\nFUJIFILM Recording Media GmbH\nGesellschaft mit beschränkter Haftung\nKleve\n\nDen Gläubigern der an der Verschmelzung beteiligten Rechtsträger ist, wenn sie binnen sechs Monaten nach dem Tag, an dem die Eintragung der Verschmelzung in das Register des Sitzes derjenigen Rechtsträger deren Gläubiger sie sind, nach § 19 Absatz 3 UmwG als bekanntgemacht gilt, ihren Anspruch nach Grund und Höhe schriftlich anmelden, Sicherheit zu leisten, soweit sie nicht Befriedigung verlangen können. Dieses Recht steht den Gläubigern jedoch nur zu, wenn sie glaubhaft machen, dass durch die Verschmelzung die Erfüllung ihrer Forderung gefährdet wird."
    },
    {
      "date": "2025-10-06",
      "id": "132757",
      "original_text": "Registerbekanntmachung nach dem Umwandlungsgesetz\nNordrhein-Westfalen Amtsgericht Düsseldorf HRB 39473\nCECONOMY AG – Düsseldorf",
      "type": "Registerbekanntmachung nach dem Umwandlungsgesetz",
      "state": "Nordrhein-Westfalen",
      "amtsgericht": "Amtsgericht Düsseldorf",
      "registernummer": "HRB 39473",
      "registerart": "HRB",
      "company_name": "CECONOMY AG",
      "company_seat": "Düsseldorf",
      "details": "06.10.2025 (Bekanntmachungsdatum)\n\nNordrhein-Westfalen Amtsgericht Düsseldorf HRB 39473\nRegisterbekanntmachung nach dem Umwandlungsgesetz\n\nCECONOMY AG\nAktiengesellschaft\nDüsseldorf\n\nDem Registergericht ist der Entwurf eines Vertrages über die geplante Verschmelzung der CECONOMY Retail GmbH mit Sitz in Düsseldorf (AG Düsseldorf, HRB 44806) und der Media-Saturn-Holding GmbH mit Sitz in Ingolstadt (AG Ingolstadt, HRB 1123) mit der CECONOMY AG mit Sitz in Düsseldorf (AG Düsseldorf, HRB 39473) eingereicht worden."
    },
    {
      "date": "2025-10-06",
      "id": "132758",
      "original_text": "Registerbekanntmachung nach dem Umwandlungsgesetz\nNordrhein-Westfalen Amtsgericht Paderborn HRA 8829\nWestfalen Weser Energieerzeugung GmbH & Co. KG – Paderborn",
      "type": "Registerbekanntmachung nach dem Umwandlungsgesetz",
      "state": "Nordrhein-Westfalen",
      "amtsgericht": "Amtsgericht Paderborn",
      "registernummer": "HRA 8829",
      "registerart": "HRA",
      "company_name": "Westfalen Weser Energieerzeugung GmbH & Co. KG",
      "company_seat": "Paderborn",
      "details": "06.10.2025 (Bekanntmachungsdatum)\n\nNordrhein-Westfalen Amtsgericht Paderborn HRA 8829\nRegisterbekanntmachung nach dem Umwandlungsgesetz 06.10.2025 (Eintragungsdatum)\n\nWestfalen Weser Energieerzeugung GmbH & Co. KG\nKommanditgesellschaft\nPaderborn\n\nDen Gläubigern der an der Abspaltung beteiligten Rechtsträger ist, wenn sie binnen sechs Monaten nach dem Tag, an dem die Eintragung der Abspaltung in das Register des Sitzes desjenigen Rechtsträgers, dessen Gläubiger sie sind, nach § 19 Absatz 3 UmwG als bekanntgemacht gilt, ihren Anspruch nach Grund und Höhe schriftlich anmelden, Sicherheit zu leisten, soweit sie nicht Befriedigung verlangen können. Dieses Recht steht den Gläubigern jedoch nur zu, wenn sie glaubhaft machen, dass durch die Abspaltung die Erfüllung ihrer Forderung gefährdet wird."
    },
    {
      "date": "2025-10-06",
      "id": "132759",
      "original_text": "Registerbekanntmachung nach dem Umwandlungsgesetz\nNordrhein-Westfalen Amtsgericht Hagen HRA 6641\nAmra Bajramovic e.K. – Hagen",
      "type": "Registerbekanntmachung nach dem Umwandlungsgesetz",
      "state": "Nordrhein-Westfalen",
      "amtsgericht": "Amtsgericht Hagen",
      "registernummer": "HRA 6641",
      "registerart": "HRA",
      "company_name": "Amra Bajramovic e.K.",
      "company_seat": "Hagen",
      "details": "06.10.2025 (Bekanntmachungsdatum)\n\nNordrhein-Westfalen Amtsgericht Hagen HRA 6641\nRegisterbekanntmachung nach dem Umwandlungsgesetz 06.10.2025 (Eintragungsdatum)\n\nAmra Bajramovic e.K.\nEinzelkaufmann / Einzelkauffrau\nHagen\n\nDen Gläubigern der an der Ausgliederung beteiligten Rechtsträger ist, wenn sie binnen sechs Monaten nach dem Tag, an dem die Eintragung der Ausgliederung in das Register des Sitzes derjenigen Rechtsträger deren Gläubiger sie sind, nach § 19 Absatz 3 UmwG als bekanntgemacht gilt, ihren Anspruch nach Grund und Höhe schriftlich anmelden, Sicherheit zu leisten, soweit sie nicht Befriedigung verlangen können. Dieses Recht steht den Gläubigern jedoch nur zu, wenn sie glaubhaft machen, dass durch die Ausgliederung die Erfüllung ihrer Forderung gefährdet wird."
    },
    {
      "date": "2025-10-06",
      "id": "132760",
      "original_text": "Registerbekanntmachung nach dem Umwandlungsgesetz\nNordrhein-Westfalen Amtsgericht Düren HRB 9936\nCHROMA GLOBE GmbH – Kreuzau",
      "type": "Registerbekanntmachung nach dem Umwandlungsgesetz",
      "state": "Nordrhein-Westfalen",
      "amtsgericht": "Amtsgericht Düren",
      "registernummer": "HRB 9936",
      "registerart": "HRB",
      "company_name": "CHROMA GLOBE GmbH",
      "company_seat": "Kreuzau",
      "details": "06.10.2025 (Bekanntmachungsdatum)\n\nNordrhein-Westfalen Amtsgericht Düren HRB 9936\nRegisterbekanntmachung nach dem Umwandlungsgesetz\n\nCHROMA GLOBE GmbH\nGesellschaft mit beschränkter Haftung\nKreuzau\n\nDen Gläubigern der an der Verschmelzung beteiligten Rechtsträger ist, wenn sie binnen sechs Monaten nach dem Tag, an dem die Eintragung der Verschmelzung in das Register des Sitzes derjenigen Rechtsträger deren Gläubiger sie sind, nach § 19 Absatz 3 UmwG als bekanntgemacht gilt, ihren Anspruch nach Grund und Höhe schriftlich anmelden, Sicherheit zu leisten, soweit sie nicht Befriedigung verlangen können. Dieses Recht steht den Gläubigern jedoch nur zu, wenn sie glaubhaft machen, dass durch die Verschmelzung die Erfüllung ihrer Forderung gefährdet wird."
    },
    {
      "date": "2025-10-06",
      "id": "132761",
      "original_text": "Löschungsankündigung\nNordrhein-Westfalen Amtsgericht Düsseldorf HRB 23845\nExacta-Glastechnik GmbH – Düsseldorf",
      "type": "Löschungsankündigung",
      "state": "Nordrhein-Westfalen",
      "amtsgericht": "Amtsgericht Düsseldorf",
      "registernummer": "HRB 23845",
      "registerart": "HRB",
      "company_name": "Exacta-Glastechnik GmbH",
      "company_seat": "Düsseldorf",
      "details": "06.10.2025 (Bekanntmachungsdatum)\n\nNordrhein-Westfalen Amtsgericht Düsseldorf HRB 23845\nLöschungsankündigung\n\nExacta-Glastechnik GmbH\nGesellschaft mit beschränkter Haftung\nDüsseldorf\n\nDas Registergericht beabsichtigt die Gesellschaft von Amts wegen nach § 394 FamFG zu löschen. Die Frist zur Erhebung eines Widerspruchs ist auf 3 Wochen festgesetzt.\n\nRechtsbehelfsbelehrung:\nDas Widerspruchsrecht steht jedem zu, der an der Unterlassung der Löschung ein berechtigtes Interesse hat. Der Widerspruch ist bei dem Amtsgericht Düsseldorf -Registergericht-, Werdener Straße 1, 40227 Düsseldorf schriftlich in deutscher Sprache oder zur Niederschrift der Geschäftsstelle einzulegen. Der Widerspruch kann auch zur Niederschrift der Geschäftsstelle eines jeden Amtsgerichtes abgegeben werden. Die Einlegung ist auch durch Übertragung eines elektronischen Dokuments an die elektronische Poststelle des Gerichts möglich. Das elektronische Dokument muss für die Bearbeitung durch das Gericht geeignet und mit einer qualifizierten elektronischen Signatur der verantwortenden Person versehen sein oder von der verantwortenden Person signiert und auf einem sicheren Übermittlungsweg gemäß § 130a ZPO nach näherer Maßgabe der Verordnung über die technischen Rahmenbedingungen des elektronischen Rechtsverkehrs und über das besondere elektronische Behördenpostfach (BGBl. I, S.3803) eingereicht werden. Weitere Informationen erhalten Sie auf der Internetseite www.justiz.de.\nDer Widerspruch muss spätestens innerhalb der gesetzten Frist nach dem Datum der Bekanntmachung der Löschungsankündigung bei dem Amtsgericht - Registergericht - Düsseldorf eingegangen sein.  Dies gilt auch dann, wenn der Widerspruch zur Niederschrift der Geschäftsstelle eines anderen Amtsgerichtes abgegeben wurde. Die Frist beginnt mit dem Tage der Bekanntmachung der Löschungsankündigung in dem für die Bekanntmachung der Eintragungen in das Handelsregister bestimmten elektronischen Informations- und Kommunikationssystem nach § 10 des Handelsgesetzbuches. Fällt das Ende der Frist auf einen Sonntag, einen allgemeinen Feiertag oder Sonnabend, so endet die Frist mit Ablauf des nächsten Werktages.\nDer Widerspruch muss die Bezeichnung der angefochtenen Löschungsankündigung sowie die Erklärung enthalten, dass Widerspruch gegen diese Löschungsankündigung eingelegt wird. Er ist zu unterzeichnen und soll begründet werden."
    },
    {
      "date": "2025-10-06",
      "id": "132762",
      "original_text": "Löschungsankündigung\nNordrhein-Westfalen Amtsgericht Mönchengladbach HRB 19049\nJS UG (haftungsbeschränkt) – Viersen",
      "type": "Löschungsankündigung",
      "state": "Nordrhein-Westfalen",
      "amtsgericht": "Amtsgericht Mönchengladbach",
      "registernummer": "HRB 19049",
      "registerart": "HRB",
      "company_name": "JS UG (haftungsbeschränkt)",
      "company_seat": "Viersen",
      "details": "06.10.2025 (Bekanntmachungsdatum)\n\nNordrhein-Westfalen Amtsgericht Mönchengladbach HRB 19049\nLöschungsankündigung\n\nJS UG (haftungsbeschränkt)\nGesellschaft mit beschränkter Haftung\nViersen\n\nDas Registergericht beabsichtigt, die im Handelsregister eingetragene Gesellschaft gemäß § 394 Absatz 1 FamFG wegen Vermögenslosigkeit von Amts wegen zu löschen. Gegen diese Verfügung kann Widerspruch eingelegt werden. Die Frist zur Erhebung eines Widerspruchs gegen die beabsichtigte Löschung von Amts wegen ist auf zwei Monate festgesetzt."
    },
    {
      "date": "2025-10-06",
      "id": "132763",
      "original_text": "Registerbekanntmachung nach dem Umwandlungsgesetz\nNordrhein-Westfalen Amtsgericht Münster HRB 20406\nDres. MZH Geschäftsführungs-GmbH – Münster",
      "type": "Registerbekanntmachung nach dem Umwandlungsgesetz",
      "state": "Nordrhein-Westfalen",
      "amtsgericht": "Amtsgericht Münster",
      "registernummer": "HRB 20406",
      "registerart": "HRB",
      "company_name": "Dres. MZH Geschäftsführungs-GmbH",
      "company_seat": "Münster",
      "details": "06.10.2025 (Bekanntmachungsdatum)\n\nNordrhein-Westfalen Amtsgericht Münster HRB 20406\nRegisterbekanntmachung nach dem Umwandlungsgesetz 06.10.2025 (Eintragungsdatum)\n\nDres. MZH Geschäftsführungs-GmbH\nGesellschaft mit beschränkter Haftung\nMünster\n\nDen Gläubigern der an der Verschmelzung beteiligten Rechtsträger ist, wenn sie binnen sechs Monaten nach dem Tag, an dem die Eintragung der Verschmelzung in das Register des Sitzes desjenigen Rechtsträgers, dessen Gläubiger sie sind, nach § 19 Absatz 3 UmwG als bekanntgemacht gilt, ihren Anspruch nach Grund und Höhe schriftlich anmelden, Sicherheit zu leisten, soweit sie nicht Befriedigung verlangen können. Dieses Recht steht den Gläubigern jedoch nur zu, wenn sie glaubhaft machen, dass durch die Verschmelzung die Erfüllung ihrer Forderung gefährdet wird."
    },
    {
      "date": "2025-10-06",
      "id": "132764",
      "original_text": "Registerbekanntmachung nach dem Umwandlungsgesetz\nNordrhein-Westfalen Amtsgericht Dortmund HRA 19923\nWiederhöft Immobilien GmbH & Co. KG – Dortmund",
      "type": "Registerbekanntmachung nach dem Umwandlungsgesetz",
      "state": "Nordrhein-Westfalen",
      "amtsgericht": "Amtsgericht Dortmund",
      "registernummer": "HRA 19923",
      "registerart": "HRA",
      "company_name": "Wiederhöft Immobilien GmbH & Co. KG",
      "company_seat": "Dortmund",
      "details": "06.10.2025 (Bekanntmachungsdatum)\n\nNordrhein-Westfalen Amtsgericht Dortmund HRA 19923\nRegisterbekanntmachung nach dem Umwandlungsgesetz 06.10.2025 (Eintragungsdatum)\n\nWiederhöft Immobilien GmbH & Co. KG\nKommanditgesellschaft\nDortmund\n\nDen Gläubigern der an der Ausgliederung beteiligten Rechtsträger ist, wenn sie binnen sechs Monaten nach dem Tag, an dem die Eintragung der Ausgliederung in das Register des Sitzes desjenigen Rechtsträgers, dessen Gläubiger sie sind, nach § 19 Absatz 3 UmwG als bekanntgemacht gilt, ihren Anspruch nach Grund und Höhe schriftlich anmelden, Sicherheit zu leisten, soweit sie nicht Befriedigung verlangen können. Dieses Recht steht den Gläubigern jedoch nur zu, wenn sie glaubhaft machen, dass durch die Ausgliederung die Erfüllung ihrer Forderung gefährdet wird."
    },
    {
      "date": "2025-10-06",
      "id": "132765",
      "original_text": "Registerbekanntmachung nach dem Umwandlungsgesetz\nNordrhein-Westfalen Amtsgericht Hamm HRA 2493\nRhenus Assets & Services GmbH & Co. KG – Holzwickede",
      "type": "Registerbekanntmachung nach dem Umwandlungsgesetz",
      "state": "Nordrhein-Westfalen",
      "amtsgericht": "Amtsgericht Hamm",
      "registernummer": "HRA 2493",
      "registerart": "HRA",
      "company_name": "Rhenus Assets & Services GmbH & Co. KG",
      "company_seat": "Holzwickede",
      "details": "06.10.2025 (Bekanntmachungsdatum)\n\nNordrhein-Westfalen Amtsgericht Hamm HRA 2493\nRegisterbekanntmachung nach dem Umwandlungsgesetz 01.10.2025 (Eintragungsdatum)\n\nRhenus Assets & Services GmbH & Co. KG\nKommanditgesellschaft\nHolzwickede\n\nDen Gläubigern der an der Abspaltung beteiligten Rechtsträger ist, wenn sie binnen sechs Monaten nach dem Tag, an dem die Eintragung der Abspaltung in das Register des Sitzes desjenigen Rechtsträgers, dessen Gläubiger sie sind, nach § 19 Absatz 3 UmwG als bekanntgemacht gilt, ihren Anspruch nach Grund und Höhe schriftlich anmelden, Sicherheit zu leisten, soweit sie nicht Befriedigung verlangen können. Dieses Recht steht den Gläubigern jedoch nur zu, wenn sie glaubhaft machen, dass durch die Abspaltung die Erfüllung ihrer Forderung gefährdet wird."
    },
    {
      "date": "2025-10-06",
      "id": "132766",
      "original_text": "Löschungsankündigung\nNordrhein-Westfalen Amtsgericht Bad Oeynhausen HRB 6767\nGöding & Partner GmbH – Spenge",
      "type": "Löschungsankündigung",
      "state": "Nordrhein-Westfalen",
      "amtsgericht": "Amtsgericht Bad Oeynhausen",
      "registernummer": "HRB 6767",
      "registerart": "HRB",
      "company_name": "Göding & Partner GmbH",
      "company_seat": "Spenge",
      "details": "06.10.2025 (Bekanntmachungsdatum)\n\nNordrhein-Westfalen Amtsgericht Bad Oeynhausen HRB 6767\nLöschungsankündigung\n\nGöding & Partner GmbH\nGesellschaft mit beschränkter Haftung\nSpenge\n\nDas Registergericht beabsichtigt die Gesellschaft von Amts wegen nach § 394 FamFG zu löschen. Die Frist zur Erhebung eines Widerspruchs ist auf zwei Monate festgesetzt."
    },
    {
      "date": "2025-10-06",
      "id": "132767",
      "original_text": "Löschungsankündigung\nNordrhein-Westfalen Amtsgericht Köln HRB 101273\nMI-RO Transport GmbH – Köln",
      "type": "Löschungsankündigung",
      "state": "Nordrhein-Westfalen",
      "amtsgericht": "Amtsgericht Köln",
      "registernummer": "HRB 101273",
      "registerart": "HRB",
      "company_name": "MI-RO Transport GmbH",
      "company_seat": "Köln",
      "details": "06.10.2025 (Bekanntmachungsdatum)\n\nNordrhein-Westfalen Amtsgericht Köln HRB 101273\nLöschungsankündigung\n\nMI-RO Transport GmbH\nGesellschaft mit beschränkter Haftung\nKöln\n\nDas Registergericht beabsichtigt die Gesellschaft von Amts wegen nach § 394 FamFG zu löschen. Die Frist zur Erhebung eines Widerspruchs ist auf einen Monat festgesetzt."
    },
    {
      "date": "2025-10-06",
      "id": "132768",
      "original_text": "Registerbekanntmachung nach dem Umwandlungsgesetz\nNordrhein-Westfalen Amtsgericht Düsseldorf HRB 90866\nPegasus Investment GmbH – Monheim am Rhein",
      "type": "Registerbekanntmachung nach dem Umwandlungsgesetz",
      "state": "Nordrhein-Westfalen",
      "amtsgericht": "Amtsgericht Düsseldorf",
      "registernummer": "HRB 90866",
      "registerart": "HRB",
      "company_name": "Pegasus Investment GmbH",
      "company_seat": "Monheim am Rhein",
      "details": "06.10.2025 (Bekanntmachungsdatum)\n\nNordrhein-Westfalen Amtsgericht Düsseldorf HRB 90866\nRegisterbekanntmachung nach dem Umwandlungsgesetz 06.10.2025 (Eintragungsdatum)\n\nPegasus Investment GmbH\nGesellschaft mit beschränkter Haftung\nMonheim am Rhein\n\nDen Gläubigern der an der Verschmelzung beteiligten Rechtsträger ist, wenn sie binnen sechs Monaten nach dem Tag, an dem die Eintragung der Verschmelzung in das Register des Sitzes desjenigen Rechtsträgers, dessen Gläubiger sie sind, nach § 19 Absatz 3 UmwG als bekanntgemacht gilt, ihren Anspruch nach Grund und Höhe schriftlich anmelden, Sicherheit zu leisten, soweit sie nicht Befriedigung verlangen können. Dieses Recht steht den Gläubigern jedoch nur zu, wenn sie glaubhaft machen, dass durch die Verschmelzung die Erfüllung ihrer Forderung gefährdet wird."
    },
    {
      "date": "2025-10-06",
      "id": "132769",
      "original_text": "Löschungsankündigung\nNordrhein-Westfalen Amtsgericht Gelsenkirchen HRB 10085\nR & R Liegenschaftsverwaltung GmbH – Haltern am See",
      "type": "Löschungsankündigung",
      "state": "Nordrhein-Westfalen",
      "amtsgericht": "Amtsgericht Gelsenkirchen",
      "registernummer": "HRB 10085",
      "registerart": "HRB",
      "company_name": "R & R Liegenschaftsverwaltung GmbH",
      "company_seat": "Haltern am See",
      "details": "06.10.2025 (Bekanntmachungsdatum)\n\nNordrhein-Westfalen Amtsgericht Gelsenkirchen HRB 10085\nLöschungsankündigung\n\nR & R Liegenschaftsverwaltung GmbH\nGesellschaft mit beschränkter Haftung\nHaltern am See\n\nDas Gericht beabsichtigt, die im Handelsregister eingetragene R & R Liegenschaftsverwaltung GmbH mit Sitz in Haltern am See, HRB 10085, Amtsgericht Gelsenkirchen, wegen Vermögenslosigkeit zu löschen.\nHiermit wird denjenigen, die an der Unterlassung der Löschung ein berechtigtes Interesse haben, gem. § 394 Abs. 2 FamFG Gelegenheit gegeben, gegen dieses Vorhaben binnen eines Monats nach dieser Bekanntmachung Widerspruch einzulegen. Der Widerspruch kann schriftlich oder zu Protokoll der Geschäftsstelle erhoben werden."
    },
    {
      "date": "2025-10-06",
      "id": "132770",
      "original_text": "Registerbekanntmachung nach dem Umwandlungsgesetz\nNordrhein-Westfalen Amtsgericht Iserlohn HRB 9231\nTechnik- und Panzermuseum Sauerland UG (haftungsbeschränkt) – Plettenberg",
      "type": "Registerbekanntmachung nach dem Umwandlungsgesetz",
      "state": "Nordrhein-Westfalen",
      "amtsgericht": "Amtsgericht Iserlohn",
      "registernummer": "HRB 9231",
      "registerart": "HRB",
      "company_name": "Technik- und Panzermuseum Sauerland UG (haftungsbeschränkt)",
      "company_seat": "Plettenberg",
      "details": "06.10.2025 (Bekanntmachungsdatum)\n\nNordrhein-Westfalen Amtsgericht Iserlohn HRB 9231\nRegisterbekanntmachung nach dem Umwandlungsgesetz 02.10.2025 (Eintragungsdatum)\n\nTechnik- und Panzermuseum Sauerland UG (haftungsbeschränkt)\nGesellschaft mit beschränkter Haftung\nPlettenberg\n\nDen Gläubigern der an der Verschmelzung beteiligten Rechtsträger ist, wenn sie binnen sechs Monaten nach dem Tag, an dem die Eintragung der Verschmelzung in das Register des Sitzes desjenigen Rechtsträgers, dessen Gläubiger sie sind, nach § 19 Absatz 3 UmwG als bekanntgemacht gilt, ihren Anspruch nach Grund und Höhe schriftlich anmelden, Sicherheit zu leisten, soweit sie nicht Befriedigung verlangen können. Dieses Recht steht den Gläubigern jedoch nur zu, wenn sie glaubhaft machen, dass durch die Verschmelzung die Erfüllung ihrer Forderung gefährdet wird."
    },
    {
      "date": "2025-10-06",
      "id": "132771",
      "original_text": "Löschungsankündigung\nThüringen Amtsgericht Jena HRB 512149\nWeber - Projektgesellschaft mbH – Treffurt",
      "type": "Löschungsankündigung",
      "state": "Thüringen",
      "amtsgericht": "Amtsgericht Jena",
      "registernummer": "HRB 512149",
      "registerart": "HRB",
      "company_name": "Weber - Projektgesellschaft mbH",
      "company_seat": "Treffurt",
      "details": "06.10.2025 (Bekanntmachungsdatum)\n\nThüringen Amtsgericht Jena HRB 512149\nLöschungsankündigung\n\nWeber - Projektgesellschaft mbH\nGesellschaft mit beschränkter Haftung\nTreffurt\n\nDas Registergericht beabsichtigt, die im Handelsregister eingetragene Gesellschaft wegen Vermögenslosigkeit nach § 394 FamFG von Amts wegen zu löschen. Die Frist zur Erhebung eines Widerspruchs gegen die beabsichtigte Löschung wird auf 6 Wochen festgesetzt."
    },
    {
      "date": "2025-10-06",
      "id": "132772",
      "original_text": "Sonstige Registerbekanntmachung\nHessen Amtsgericht Frankfurt am Main HRB 10781\nFrankfurter Bankgesellschaft (Deutschland) AG – Frankfurt am Main",
      "type": "Sonstige Registerbekanntmachung",
      "state": "Hessen",
      "amtsgericht": "Amtsgericht Frankfurt am Main",
      "registernummer": "HRB 10781",
      "registerart": "HRB",
      "company_name": "Frankfurter Bankgesellschaft (Deutschland) AG",
      "company_seat": "Frankfurt am Main",
      "details": "06.10.2025 (Bekanntmachungsdatum)\n\nHessen Amtsgericht Frankfurt am Main HRB 10781\nSonstige Registerbekanntmachung 06.10.2025 (Eintragungsdatum)\n\nFrankfurter Bankgesellschaft (Deutschland) AG\nAktiengesellschaft\nFrankfurt am Main\n\nDurch eine Änderung in den Personen der Aufsichtsratsmitglieder ist eine Liste der Mitglieder des Aufsichtsrates zum Handelsregister eingereicht worden."
    },
    {
      "date": "2025-10-06",
      "id": "132773",
      "original_text": "Registerbekanntmachung nach dem Umwandlungsgesetz\nHessen Amtsgericht Frankfurt am Main HRA 53980\nDariusz Salamonowicz EVEREST ONE e.K. – Frankfurt am Main",
      "type": "Registerbekanntmachung nach dem Umwandlungsgesetz",
      "state": "Hessen",
      "amtsgericht": "Amtsgericht Frankfurt am Main",
      "registernummer": "HRA 53980",
      "registerart": "HRA",
      "company_name": "Dariusz Salamonowicz EVEREST ONE e.K.",
      "company_seat": "Frankfurt am Main",
      "details": "06.10.2025 (Bekanntmachungsdatum)\n\nHessen Amtsgericht Frankfurt am Main HRA 53980\nRegisterbekanntmachung nach dem Umwandlungsgesetz 05.10.2025 (Eintragungsdatum)\n\nDariusz Salamonowicz EVEREST ONE e.K.\nEinzelkaufmann / Einzelkauffrau\nFrankfurt am Main\n\nDen Gläubigern der an der Verschmelzung beteiligten Rechtsträger ist, wenn sie binnen sechs Monaten nach dem Tag, an dem die Eintragung der Verschmelzung in das Register des Sitzes desjenigen Rechtsträgers, dessen Gläubiger sie sind, nach § 19 Absatz 3 UmwG bekannt gemacht worden ist, ihren Anspruch nach Grund und Höhe schriftlich anmelden, Sicherheit zu leisten, soweit sie nicht Befriedigung verlangen können. Dieses Recht steht den Gläubigern jedoch nur zu, wenn sie glaubhaft machen, dass durch die Verschmelzung die Erfüllung ihrer Forderung gefährdet wird."
    },
    {
      "date": "2025-10-06",
      "id": "132774",
      "original_text": "Registerbekanntmachung nach dem Umwandlungsgesetz\nHessen Amtsgericht Fulda HRB 7882\nFreshFood24 GmbH – Fulda",
      "type": "Registerbekanntmachung nach dem Umwandlungsgesetz",
      "state": "Hessen",
      "amtsgericht": "Amtsgericht Fulda",
      "registernummer": "HRB 7882",
      "registerart": "HRB",
      "company_name": "FreshFood24 GmbH",
      "company_seat": "Fulda",
      "details": "06.10.2025 (Bekanntmachungsdatum)\n\nHessen Amtsgericht Fulda HRB 7882\nRegisterbekanntmachung nach dem Umwandlungsgesetz 06.10.2025 (Eintragungsdatum)\n\nFreshFood24 GmbH\nGesellschaft mit beschränkter Haftung\nFulda\n\nDen Gläubigern der an der Verschmelzung beteiligten Rechtsträger ist, wenn sie binnen sechs Monaten nach dem Tag, an dem die Eintragung der Verschmelzung in das Register des Sitzes desjenigen Rechtsträgers, dessen Gläubiger sie sind, nach § 19 Absatz 3 UmwG bekannt gemacht worden ist, ihren Anspruch nach Grund und Höhe schriftlich anmelden, Sicherheit zu leisten, soweit sie nicht Befriedigung verlangen können. Dieses Recht steht den Gläubigern jedoch nur zu, wenn sie glaubhaft machen, dass durch die Verschmelzung die Erfüllung ihrer Forderung gefährdet wird."
    },
    {
      "date": "2025-10-06",
      "id": "132775",
      "original_text": "Sonstige Registerbekanntmachung\nHessen Amtsgericht Bad Hersfeld VR 827\nFörderverein der Heinrich-Grupe-Schule e. V. – Philippsthal",
      "type": "Sonstige Registerbekanntmachung",
      "state": "Hessen",
      "amtsgericht": "Amtsgericht Bad Hersfeld",
      "registernummer": "VR 827",
      "registerart": "VR",
      "company_name": "Förderverein der Heinrich-Grupe-Schule e. V.",
      "company_seat": "Philippsthal",
      "details": "06.10.2025 (Bekanntmachungsdatum)\n\nHessen Amtsgericht Bad Hersfeld VR 827\nSonstige Registerbekanntmachung 06.10.2025 (Eintragungsdatum)\n\nFörderverein der Heinrich-Grupe-Schule e. V.\neingetragener Verein\nPhilippsthal\n\nDer Verein ist aufgelöst."
    },
    {
      "date": "2025-10-06",
      "id": "132776",
      "original_text": "Sonstige Registerbekanntmachung\nHessen Amtsgericht Fritzlar VR 322\nDie Dienstleistergemeinschaft Niedenstein – Niedenstein",
      "type": "Sonstige Registerbekanntmachung",
      "state": "Hessen",
      "amtsgericht": "Amtsgericht Fritzlar",
      "registernummer": "VR 322",
      "registerart": "VR",
      "company_name": "Die Dienstleistergemeinschaft Niedenstein",
      "company_seat": "Niedenstein",
      "details": "06.10.2025 (Bekanntmachungsdatum)\n\nHessen Amtsgericht Fritzlar VR 322\nSonstige Registerbekanntmachung 06.10.2025 (Eintragungsdatum)\n\nDie Dienstleistergemeinschaft Niedenstein\neingetragener Verein\nNiedenstein\n\nDer Verein ist aufgelöst."
    },
    {
      "date": "2025-10-06",
      "id": "132777",
      "original_text": "Registerbekanntmachung nach dem Umwandlungsgesetz\nHessen Amtsgericht Frankfurt am Main HRB 109979\nLufthansa Commercial Holding Gesellschaft mit beschränkter Haftung – Frankfurt am Main",
      "type": "Registerbekanntmachung nach dem Umwandlungsgesetz",
      "state": "Hessen",
      "amtsgericht": "Amtsgericht Frankfurt am Main",
      "registernummer": "HRB 109979",
      "registerart": "HRB",
      "company_name": "Lufthansa Commercial Holding Gesellschaft mit beschränkter Haftung",
      "company_seat": "Frankfurt am Main",
      "details": "06.10.2025 (Bekanntmachungsdatum)\n\nHessen Amtsgericht Frankfurt am Main HRB 109979\nRegisterbekanntmachung nach dem Umwandlungsgesetz 05.10.2025 (Eintragungsdatum)\n\nLufthansa Commercial Holding Gesellschaft mit beschränkter Haftung\nGesellschaft mit beschränkter Haftung\nFrankfurt am Main\n\nDen Gläubigern der an der Abspaltung beteiligten Rechtsträger ist, wenn sie binnen sechs Monaten nach dem Tag, an dem die Eintragung der Abspaltung in das Register des Sitzes desjenigen Rechtsträgers, dessen Gläubiger sie sind, nach §§ 125, 19 Absatz 3 UmwG bekannt gemacht worden ist, ihren Anspruch nach Grund und Höhe schriftlich anmelden, Sicherheit zu leisten, soweit sie nicht Befriedigung verlangen können. Dieses Recht steht den Gläubigern jedoch nur zu, wenn sie glaubhaft machen, dass durch die Abspaltung die Erfüllung ihrer Forderung gefährdet wird."
    },
    {
      "date": "2025-10-06",
      "id": "132778",
      "original_text": "Registerbekanntmachung nach dem Umwandlungsgesetz\nHessen Amtsgericht Frankfurt am Main HRB 133436\nTruffle Holding AG – Frankfurt am Main",
      "type": "Registerbekanntmachung nach dem Umwandlungsgesetz",
      "state": "Hessen",
      "amtsgericht": "Amtsgericht Frankfurt am Main",
      "registernummer": "HRB 133436",
      "registerart": "HRB",
      "company_name": "Truffle Holding AG",
      "company_seat": "Frankfurt am Main",
      "details": "06.10.2025 (Bekanntmachungsdatum)\n\nHessen Amtsgericht Frankfurt am Main HRB 133436\nRegisterbekanntmachung nach dem Umwandlungsgesetz 05.10.2025 (Eintragungsdatum)\n\nTruffle Holding AG\nAktiengesellschaft\nFrankfurt am Main\n\nDen Gläubigern der an der Abspaltung beteiligten Rechtsträger ist, wenn sie binnen sechs Monaten nach dem Tag, an dem die Eintragung der Abspaltung in das Register des Sitzes desjenigen Rechtsträgers, dessen Gläubiger sie sind, nach §§ 125, 19 Absatz 3 UmwG bekannt gemacht worden ist, ihren Anspruch nach Grund und Höhe schriftlich anmelden, Sicherheit zu leisten, soweit sie nicht Befriedigung verlangen können. Dieses Recht steht den Gläubigern jedoch nur zu, wenn sie glaubhaft machen, dass durch die Abspaltung die Erfüllung ihrer Forderung gefährdet wird."
    },
    {
      "date": "2025-10-06",
      "id": "132779",
      "original_text": "Registerbekanntmachung nach dem Umwandlungsgesetz\nHessen Amtsgericht Gießen HRB 2365\nA. B. T Anlagen- und Bautrocknungs GmbH – Langgöns",
      "type": "Registerbekanntmachung nach dem Umwandlungsgesetz",
      "state": "Hessen",
      "amtsgericht": "Amtsgericht Gießen",
      "registernummer": "HRB 2365",
      "registerart": "HRB",
      "company_name": "A. B. T Anlagen- und Bautrocknungs GmbH",
      "company_seat": "Langgöns",
      "details": "06.10.2025 (Bekanntmachungsdatum)\n\nHessen Amtsgericht Gießen HRB 2365\nRegisterbekanntmachung nach dem Umwandlungsgesetz 05.10.2025 (Eintragungsdatum)\n\nA. B. T Anlagen- und Bautrocknungs GmbH\nGesellschaft mit beschränkter Haftung\nLanggöns\n\nDen Gläubigern der an der Verschmelzung beteiligten Rechtsträger ist, wenn sie binnen sechs Monaten nach dem Tag, an dem die Eintragung der Verschmelzung in das Register des Sitzes desjenigen Rechtsträgers, dessen Gläubiger sie sind, nach § 19 Absatz 3 UmwG bekannt gemacht worden ist, ihren Anspruch nach Grund und Höhe schriftlich anmelden, Sicherheit zu leisten, soweit sie nicht Befriedigung verlangen können. Dieses Recht steht den Gläubigern jedoch nur zu, wenn sie glaubhaft machen, dass durch die Verschmelzung die Erfüllung ihrer Forderung gefährdet wird."
    },
    {
      "date": "2025-10-06",
      "id": "132780",
      "original_text": "Registerbekanntmachung nach dem Umwandlungsgesetz\nHessen Amtsgericht Korbach HRB 2393\nReipron GmbH – Diemelstadt",
      "type": "Registerbekanntmachung nach dem Umwandlungsgesetz",
      "state": "Hessen",
      "amtsgericht": "Amtsgericht Korbach",
      "registernummer": "HRB 2393",
      "registerart": "HRB",
      "company_name": "Reipron GmbH",
      "company_seat": "Diemelstadt",
      "details": "06.10.2025 (Bekanntmachungsdatum)\n\nHessen Amtsgericht Korbach HRB 2393\nRegisterbekanntmachung nach dem Umwandlungsgesetz 06.10.2025 (Eintragungsdatum)\n\nReipron GmbH\nGesellschaft mit beschränkter Haftung\nDiemelstadt\n\nDen Gläubigern der an der Verschmelzung beteiligten Rechtsträger ist, wenn sie binnen sechs Monaten nach dem Tag, an dem die Eintragung der Verschmelzung in das Register des Sitzes derjenigen Rechtsträger deren Gläubiger sie sind, nach § 19 Absatz 3 UmwG bekannt gemacht worden ist, ihren Anspruch nach Grund und Höhe schriftlich anmelden, Sicherheit zu leisten, soweit sie nicht Befriedigung verlangen können. Dieses Recht steht den Gläubigern jedoch nur zu, wenn sie glaubhaft machen, dass durch die Verschmelzung die Erfüllung ihrer Forderung gefährdet wird."
    },
    {
      "date": "2025-10-06",
      "id": "132781",
      "original_text": "Löschungsankündigung\nHessen Amtsgericht Frankfurt am Main HRB 115811\nSarmat UG (haftungsbeschränkt) – Frankfurt am Main",
      "type": "Löschungsankündigung",
      "state": "Hessen",
      "amtsgericht": "Amtsgericht Frankfurt am Main",
      "registernummer": "HRB 115811",
      "registerart": "HRB",
      "company_name": "Sarmat UG (haftungsbeschränkt)",
      "company_seat": "Frankfurt am Main",
      "details": "06.10.2025 (Bekanntmachungsdatum)\n\nHessen Amtsgericht Frankfurt am Main HRB 115811\nLöschungsankündigung\n\nSarmat UG (haftungsbeschränkt)\nGesellschaft mit beschränkter Haftung\nFrankfurt am Main\n\nEs ist beabsichtigt die Gesellschaft wegen Vermögenslosigkeit gemäß § 394 FamFG von Amts wegen zu löschen. Hiergegen kann innerhalb eines Monats nach dieser Veröffentlichung Widerspruch bei dem Amtsgericht Frankfurt am Main eingelegt werden."
    },
    {
      "date": "2025-10-06",
      "id": "132782",
      "original_text": "Registerbekanntmachung nach dem Umwandlungsgesetz\nHessen Amtsgericht Fulda HRA 5954\nGGG Unternehmensführung GmbH & Co. BV oHG – Fulda",
      "type": "Registerbekanntmachung nach dem Umwandlungsgesetz",
      "state": "Hessen",
      "amtsgericht": "Amtsgericht Fulda",
      "registernummer": "HRA 5954",
      "registerart": "HRA",
      "company_name": "GGG Unternehmensführung GmbH & Co. BV oHG",
      "company_seat": "Fulda",
      "details": "06.10.2025 (Bekanntmachungsdatum)\n\nHessen Amtsgericht Fulda HRA 5954\nRegisterbekanntmachung nach dem Umwandlungsgesetz 06.10.2025 (Eintragungsdatum)\n\nGGG Unternehmensführung GmbH & Co. BV oHG\nOffene Handelsgesellschaft\nFulda\n\nDen Gläubigern der an der formwechselnden Umwandlung beteiligten Rechtsträger ist, wenn sie binnen sechs Monaten nach dem Tag, an dem die Eintragung der formwechselnden Umwandlung in das Register des Sitzes desjenigen Rechtsträgers, dessen Gläubiger sie sind, nach § 201 UmwG bekannt gemacht worden ist, ihren Anspruch nach Grund und Höhe schriftlich anmelden, Sicherheit zu leisten, soweit sie nicht Befriedigung verlangen können. Dieses Recht steht den Gläubigern jedoch nur zu, wenn sie glaubhaft machen, dass durch die formwechselnden Umwandlung die Erfüllung ihrer Forderung gefährdet wird."
    },
    {
      "date": "2025-10-06",
      "id": "132783",
      "original_text": "Einreichung neuer Dokumente\nHessen Amtsgericht Frankfurt am Main HRB 133359\nZurich Insurance Europe AG – Frankfurt am Main",
      "type": "Einreichung neuer Dokumente",
      "state": "Hessen",
      "amtsgericht": "Amtsgericht Frankfurt am Main",
      "registernummer": "HRB 133359",
      "registerart": "HRB",
      "company_name": "Zurich Insurance Europe AG",
      "company_seat": "Frankfurt am Main",
      "details": "06.10.2025 (Bekanntmachungsdatum)\n\nHessen Amtsgericht Frankfurt am Main HRB 133359\nEinreichung neuer Dokumente 06.10.2025 (Eintragungsdatum)\n\nZurich Insurance Europe AG\nAktiengesellschaft\nFrankfurt am Main\n\nDurch eine Änderung in den Personen der Aufsichtsratsmitglieder ist eine Liste der Mitglieder des Aufsichtsrates zum Handelsregister eingereicht worden."
    },
    {
      "date": "2025-10-06",
      "id": "132784",
      "original_text": "Einreichung neuer Dokumente\nHessen Amtsgericht Frankfurt am Main HRB 8242\nHofheimer Wohnungsbaugesellschaft mit beschränkter Haftung – Hofheim am Taunus",
      "type": "Einreichung neuer Dokumente",
      "state": "Hessen",
      "amtsgericht": "Amtsgericht Frankfurt am Main",
      "registernummer": "HRB 8242",
      "registerart": "HRB",
      "company_name": "Hofheimer Wohnungsbaugesellschaft mit beschränkter Haftung",
      "company_seat": "Hofheim am Taunus",
      "details": "06.10.2025 (Bekanntmachungsdatum)\n\nHessen Amtsgericht Frankfurt am Main HRB 8242\nEinreichung neuer Dokumente\n\nHofheimer Wohnungsbaugesellschaft mit beschränkter Haftung\nGesellschaft mit beschränkter Haftung\nHofheim am Taunus\n\nDurch eine Änderung in den Personen der Aufsichtsratsmitglieder ist eine Liste der Mitglieder des Aufsichtsrates zum Handelsregister eingereicht worden."
    },
    {
      "date": "2025-10-06",
      "id": "132785",
      "original_text": "Sonstige Registerbekanntmachung\nHessen Amtsgericht Darmstadt HRB 86209\nKochen mit Herz GmbH – Bad König",
      "type": "Sonstige Registerbekanntmachung",
      "state": "Hessen",
      "amtsgericht": "Amtsgericht Darmstadt",
      "registernummer": "HRB 86209",
      "registerart": "HRB",
      "company_name": "Kochen mit Herz GmbH",
      "company_seat": "Bad König",
      "details": "06.10.2025 (Bekanntmachungsdatum)\n\nHessen Amtsgericht Darmstadt HRB 86209\nSonstige Registerbekanntmachung 05.10.2025 (Eintragungsdatum)\n\nKochen mit Herz GmbH\nGesellschaft mit beschränkter Haftung\nBad König\n\nDen Gläubigern der Gesellschaft, deren Forderungen begründet worden sind, bevor die Eintragung der Beendigung des Vertrages in das Handelsregister nach § 10 des Handelsgesetzbuches als bekanntgemacht gilt, hat der andere Vertragsteil Sicherheit zu leisten, wenn sie sich binnen sechs Monaten nach der Bekanntmachung der Eintragung zu diesem Zweck bei ihm melden."
    },
    {
      "date": "2025-10-06",
      "id": "132786",
      "original_text": "Sonstige Registerbekanntmachung\nHessen Amtsgericht Wiesbaden HRB 3599\nVerkehrs-Verbund Mainz-Wiesbaden Gesellschaft mit beschränkter Haftung – Wiesbaden",
      "type": "Sonstige Registerbekanntmachung",
      "state": "Hessen",
      "amtsgericht": "Amtsgericht Wiesbaden",
      "registernummer": "HRB 3599",
      "registerart": "HRB",
      "company_name": "Verkehrs-Verbund Mainz-Wiesbaden Gesellschaft mit beschränkter Haftung",
      "company_seat": "Wiesbaden",
      "details": "06.10.2025 (Bekanntmachungsdatum)\n\nHessen Amtsgericht Wiesbaden HRB 3599\nSonstige Registerbekanntmachung\n\nVerkehrs-Verbund Mainz-Wiesbaden Gesellschaft mit beschränkter Haftung\nGesellschaft mit beschränkter Haftung\nWiesbaden\n\nDurch eine Änderung in den Personen der Aufsichtsratsmitglieder ist eine Liste der Mitglieder des Aufsichtsrates zum Handelsregister eingereicht worden."
    },
    {
      "date": "2025-10-06",
      "id": "132787",
      "original_text": "Registerbekanntmachung nach dem Umwandlungsgesetz\nHessen Amtsgericht Fulda HRB 6479\nSeven Days GmbH – Fulda",
      "type": "Registerbekanntmachung nach dem Umwandlungsgesetz",
      "state": "Hessen",
      "amtsgericht": "Amtsgericht Fulda",
      "registernummer": "HRB 6479",
      "registerart": "HRB",
      "company_name": "Seven Days GmbH",
      "company_seat": "Fulda",
      "details": "06.10.2025 (Bekanntmachungsdatum)\n\nHessen Amtsgericht Fulda HRB 6479\nRegisterbekanntmachung nach dem Umwandlungsgesetz 06.10.2025 (Eintragungsdatum)\n\nSeven Days GmbH\nGesellschaft mit beschränkter Haftung\nFulda\n\nDen Gläubigern der an der Verschmelzung beteiligten Rechtsträger ist, wenn sie binnen sechs Monaten nach dem Tag, an dem die Eintragung der Verschmelzung in das Register des Sitzes desjenigen Rechtsträgers, dessen Gläubiger sie sind, nach § 19 Absatz 3 UmwG bekannt gemacht worden ist, ihren Anspruch nach Grund und Höhe schriftlich anmelden, Sicherheit zu leisten, soweit sie nicht Befriedigung verlangen können. Dieses Recht steht den Gläubigern jedoch nur zu, wenn sie glaubhaft machen, dass durch die Verschmelzung die Erfüllung ihrer Forderung gefährdet wird."
    },
    {
      "date": "2025-10-06",
      "id": "132788",
      "original_text": "Registerbekanntmachung nach dem Umwandlungsgesetz\nHessen Amtsgericht Frankfurt am Main HRB 110915\nEV SR Immobilien GmbH – Bad Vilbel",
      "type": "Registerbekanntmachung nach dem Umwandlungsgesetz",
      "state": "Hessen",
      "amtsgericht": "Amtsgericht Frankfurt am Main",
      "registernummer": "HRB 110915",
      "registerart": "HRB",
      "company_name": "EV SR Immobilien GmbH",
      "company_seat": "Bad Vilbel",
      "details": "06.10.2025 (Bekanntmachungsdatum)\n\nHessen Amtsgericht Frankfurt am Main HRB 110915\nRegisterbekanntmachung nach dem Umwandlungsgesetz 06.10.2025 (Eintragungsdatum)\n\nEV SR Immobilien GmbH\nGesellschaft mit beschränkter Haftung\nBad Vilbel\n\nDen Gläubigern der an der Verschmelzung beteiligten Rechtsträger ist, wenn sie binnen sechs Monaten nach dem Tag, an dem die Eintragung der Verschmelzung in das Register des Sitzes desjenigen Rechtsträgers, dessen Gläubiger sie sind, nach § 19 Absatz 3 UmwG bekannt gemacht worden ist, ihren Anspruch nach Grund und Höhe schriftlich anmelden, Sicherheit zu leisten, soweit sie nicht Befriedigung verlangen können. Dieses Recht steht den Gläubigern jedoch nur zu, wenn sie glaubhaft machen, dass durch die Verschmelzung die Erfüllung ihrer Forderung gefährdet wird."
    },
    {
      "date": "2025-10-06",
      "id": "94",
      "original_text": "Sonderregisterbekanntmachung OHNE Bezug zum elektr. Register\nBrandenburg Amtsgericht Neuruppin\nHRB 15064 NP\n12. VC Beteiligungs KGaA",
      "type": "Sonderregisterbekanntmachung OHNE Bezug zum elektr. Register",
      "state": "Brandenburg",
      "amtsgericht": "Amtsgericht Neuruppin",
      "company_name": "12. VC Beteiligungs KGaA",
      "sonderegister_referenz": "HRB 15064 NP",
      "details": "06.10.2025 (Bekanntmachungsdatum)\n\nBrandenburg Amtsgericht Neuruppin\nHRB 15064 NP\nSonderregisterbekanntmachung OHNE Bezug zum elektr. Register\n\n12. VC Beteiligungs KGaA\n\nAls nicht eingetragen wird bekannt gemacht: Eine Liste der Mitglieder des Aufsichtsrates wurde zum Handelsregister eingereicht."
    }
  ]
}