{
  "date": "2025-10-13",
  "date_of_scrape": "2025-10-27T17:59:54.317Z",
  "tool_version": "0.2.0",
  "number_of_announcements": 143,
  "announcements": [
    {
      "date": "2025-10-13",
      "id": "133614",
      "original_text": "Löschungsankündigung\nBaden-Württemberg Amtsgericht Mannheim HRB 714993\nSessler Galvano International GmbH – Keltern",
      "type": "Löschungsankündigung",
      "state": "Baden-Württemberg",
      "amtsgericht": "Amtsgericht Mannheim",
      "registernummer": "HRB 714993",
      "registerart": "HRB",
      "company_name": "Sessler Galvano International GmbH",
      "company_seat": "Keltern",
      "details": "13.10.2025 (Bekanntmachungsdatum)\n\nBaden-Württemberg Amtsgericht Mannheim HRB 714993\nLöschungsankündigung\n\nSessler Galvano International GmbH\nGesellschaft mit beschränkter Haftung\nKeltern\n\nDas Gericht beabsichtigt, die Gesellschaft wegen Vermögenslosigkeit im Handelsregister von Amts wegen nach § 394 FamFG zu löschen. Die Frist zur Geltendmachung eines Widerspruchs gegen die beabsichtigte Löschung ist auf einen Monat ab Veröffentlichung bestimmt."
    },
    {
      "date": "2025-10-13",
      "id": "133615",
      "original_text": "Einreichung neuer Dokumente\nBerlin Amtsgericht Berlin (Charlottenburg) HRB 271612\nmomox TopCo SE – Berlin",
      "type": "Einreichung neuer Dokumente",
      "state": "Berlin",
      "amtsgericht": "Amtsgericht Berlin (Charlottenburg)",
      "registernummer": "HRB 271612",
      "registerart": "HRB",
      "company_name": "momox TopCo SE",
      "company_seat": "Berlin",
      "details": "13.10.2025 (Bekanntmachungsdatum)\n\nBerlin Amtsgericht Berlin (Charlottenburg) HRB 271612\nEinreichung neuer Dokumente\n\nmomox TopCo SE\nEuropäische Aktiengesellschaft (SE)\nBerlin\n\nAls nicht eingetragen wird veröffentlicht: Es wurde eine neue Liste der Aufsichtsratsmitglieder eingereicht (§ 106 AktG)."
    },
    {
      "date": "2025-10-13",
      "id": "133616",
      "original_text": "Einreichung neuer Dokumente\nSchleswig-Holstein Amtsgericht Flensburg HRB 17667\nHerm. G. Dethleffsen SE – Flensburg",
      "type": "Einreichung neuer Dokumente",
      "state": "Schleswig-Holstein",
      "amtsgericht": "Amtsgericht Flensburg",
      "registernummer": "HRB 17667",
      "registerart": "HRB",
      "company_name": "Herm. G. Dethleffsen SE",
      "company_seat": "Flensburg",
      "details": "13.10.2025 (Bekanntmachungsdatum)\n\nSchleswig-Holstein Amtsgericht Flensburg HRB 17667\nEinreichung neuer Dokumente\n\nHerm. G. Dethleffsen SE\nEuropäische Aktiengesellschaft (SE)\nFlensburg\n\nAls nicht eingetragen wird veröffentlicht: Firmenanschrift: Raiffeisenstraße 13, 24941 Flensburg.\nNeue Verwaltungsratsliste nach Änderung eingereicht am 08.10.2025."
    },
    {
      "date": "2025-10-13",
      "id": "133617",
      "original_text": "Löschungsankündigung\nSchleswig-Holstein Amtsgericht Flensburg HRB 12666\nGerman Expansion GmbH – Handewitt",
      "type": "Löschungsankündigung",
      "state": "Schleswig-Holstein",
      "amtsgericht": "Amtsgericht Flensburg",
      "registernummer": "HRB 12666",
      "registerart": "HRB",
      "company_name": "German Expansion GmbH",
      "company_seat": "Handewitt",
      "details": "13.10.2025 (Bekanntmachungsdatum)\n\nSchleswig-Holstein Amtsgericht Flensburg HRB 12666\nLöschungsankündigung\n\nGerman Expansion GmbH\nGesellschaft mit beschränkter Haftung\nHandewitt\n\nEs ist die Löschung der nachstehenden Gesellschaft wegen Vermögenslosigkeit gemäß § 394 FamFG beabsichtigt.\nWiderspruchsfrist: 2 Monate."
    },
    {
      "date": "2025-10-13",
      "id": "133618",
      "original_text": "Registerbekanntmachung nach dem Umwandlungsgesetz\nBrandenburg Amtsgericht Potsdam HRA 8621\nKusche GmbH & Co. KG – Kleinmachnow",
      "type": "Registerbekanntmachung nach dem Umwandlungsgesetz",
      "state": "Brandenburg",
      "amtsgericht": "Amtsgericht Potsdam",
      "registernummer": "HRA 8621",
      "registerart": "HRA",
      "company_name": "Kusche GmbH & Co. KG",
      "company_seat": "Kleinmachnow",
      "details": "13.10.2025 (Bekanntmachungsdatum)\n\nBrandenburg Amtsgericht Potsdam HRA 8621\nRegisterbekanntmachung nach dem Umwandlungsgesetz 10.10.2025 (Eintragungsdatum)\n\nKusche GmbH & Co. KG\nKommanditgesellschaft\nKleinmachnow\n\nZu Eintragungsnummer 2 vom 10.10.2025 wird als nicht eingetragen veröffentlicht:\nDen Gläubigern der an der Spaltung beteiligten Rechtsträger ist, wenn sie binnen sechs Monaten nach dem Tag, an dem die Eintragung der Spaltung in das Register des Sitzes desjenigen Rechtsträgers, dessen Gläubiger sie sind, als bekannt gemacht gilt, ihren Anspruch nach Grund und Höhe schriftlich anmelden, Sicherheit zu leisten, soweit sie nicht Befriedigung verlangen können. Dieses Recht steht den Gläubigern jedoch nur zu, wenn sie glaubhaft machen, dass durch die Spaltung die Erfüllung ihrer Forderung gefährdet wird"
    },
    {
      "date": "2025-10-13",
      "id": "133619",
      "original_text": "Löschungsankündigung\nBerlin Amtsgericht Berlin (Charlottenburg) HRB 219365\nMedirella Berlin UG (haftungsbeschränkt) – Berlin",
      "type": "Löschungsankündigung",
      "state": "Berlin",
      "amtsgericht": "Amtsgericht Berlin (Charlottenburg)",
      "registernummer": "HRB 219365",
      "registerart": "HRB",
      "company_name": "Medirella Berlin UG (haftungsbeschränkt)",
      "company_seat": "Berlin",
      "details": "13.10.2025 (Bekanntmachungsdatum)\n\nBerlin Amtsgericht Berlin (Charlottenburg) HRB 219365\nLöschungsankündigung\n\nMedirella Berlin UG (haftungsbeschränkt)\nGesellschaft mit beschränkter Haftung\nBerlin\n\nBei der nachstehenden Gesellschaft wird das Amtslöschungsverfahren gemäß § 394 FamFG eingeleitet. Widerspruchsfrist 6 Wochen"
    },
    {
      "date": "2025-10-13",
      "id": "133620",
      "original_text": "Löschungsankündigung\nBerlin Amtsgericht Berlin (Charlottenburg) HRB 145355\nMolekyleis Produktionsgesellschaft mbH – Berlin",
      "type": "Löschungsankündigung",
      "state": "Berlin",
      "amtsgericht": "Amtsgericht Berlin (Charlottenburg)",
      "registernummer": "HRB 145355",
      "registerart": "HRB",
      "company_name": "Molekyleis Produktionsgesellschaft mbH",
      "company_seat": "Berlin",
      "details": "13.10.2025 (Bekanntmachungsdatum)\n\nBerlin Amtsgericht Berlin (Charlottenburg) HRB 145355\nLöschungsankündigung\n\nMolekyleis Produktionsgesellschaft mbH\nGesellschaft mit beschränkter Haftung\nBerlin\n\nBei der nachstehenden Gesellschaft wird das Amtslöschungsverfahren gemäß § 394 FamFG eingeleitet. Widerspruchsfrist 6 Wochen"
    },
    {
      "date": "2025-10-13",
      "id": "133621",
      "original_text": "Registerbekanntmachung nach dem Umwandlungsgesetz\nBrandenburg Amtsgericht Potsdam HRA 8570\nTorsten Kusche e.K. – Kleinmachnow",
      "type": "Registerbekanntmachung nach dem Umwandlungsgesetz",
      "state": "Brandenburg",
      "amtsgericht": "Amtsgericht Potsdam",
      "registernummer": "HRA 8570",
      "registerart": "HRA",
      "company_name": "Torsten Kusche e.K.",
      "company_seat": "Kleinmachnow",
      "details": "13.10.2025 (Bekanntmachungsdatum)\n\nBrandenburg Amtsgericht Potsdam HRA 8570\nRegisterbekanntmachung nach dem Umwandlungsgesetz 10.10.2025 (Eintragungsdatum)\n\nTorsten Kusche e.K.\nEinzelkaufmann / Einzelkauffrau\nKleinmachnow\n\nZu Eintragungsnummer 2 vom 10.10.2025 wird als nicht eingetragen veröffentlicht:\nDen Gläubigern der an der Spaltung beteiligten Rechtsträger ist, wenn sie binnen sechs Monaten nach dem Tag, an dem die Eintragung der Spaltung in das Register des Sitzes desjenigen Rechtsträgers, dessen Gläubiger sie sind, als bekannt gemacht gilt, ihren Anspruch nach Grund und Höhe schriftlich anmelden, Sicherheit zu leisten, soweit sie nicht Befriedigung verlangen können. Dieses Recht steht den Gläubigern jedoch nur zu, wenn sie glaubhaft machen, dass durch die Spaltung die Erfüllung ihrer Forderung gefährdet wird"
    },
    {
      "date": "2025-10-13",
      "id": "133622",
      "original_text": "Registerbekanntmachung nach dem Umwandlungsgesetz\nSaarland Amtsgericht Saarbrücken HRB 105551\nMathieu & Kollegen Steuerberatungsgesellschaft mbH – Homburg",
      "type": "Registerbekanntmachung nach dem Umwandlungsgesetz",
      "state": "Saarland",
      "amtsgericht": "Amtsgericht Saarbrücken",
      "registernummer": "HRB 105551",
      "registerart": "HRB",
      "company_name": "Mathieu & Kollegen Steuerberatungsgesellschaft mbH",
      "company_seat": "Homburg",
      "details": "13.10.2025 (Bekanntmachungsdatum)\n\nSaarland Amtsgericht Saarbrücken HRB 105551\nRegisterbekanntmachung nach dem Umwandlungsgesetz 13.10.2025 (Eintragungsdatum)\n\nMathieu & Kollegen Steuerberatungsgesellschaft mbH\nGesellschaft mit beschränkter Haftung\nHomburg\n\nAls nicht eingetragen wird bekannt gemacht: Den Gläubigern der an der Verschmelzung beteiligten Gesellschaften ist, wenn sie binnen sechs Monaten nach dem Tag, an dem die Eintragung der Verschmelzung in das Register des Sitzes desjenigen Rechtsträgers, dessen Gläubiger sie sind, nach § 19 Absatz 3 UmwG bekannt gemacht worden ist, ihren Anspruch nach Grund und Höhe schriftlich anmelden, Sicherheit zu leisten, soweit sie nicht Befriedigung verlangen können. Dieses Recht steht den Gläubigern jedoch nur zu, wenn sie glaubhaft machen, dass durch die Verschmelzung die Erfüllung ihrer Forderung gefährdet wird."
    },
    {
      "date": "2025-10-13",
      "id": "133623",
      "original_text": "Registerbekanntmachung nach dem Umwandlungsgesetz\nSaarland Amtsgericht Saarbrücken HRB 100199\nEntwicklungsgesellschaft Ferienhauspark Bostalsee GmbH – Nohfelden",
      "type": "Registerbekanntmachung nach dem Umwandlungsgesetz",
      "state": "Saarland",
      "amtsgericht": "Amtsgericht Saarbrücken",
      "registernummer": "HRB 100199",
      "registerart": "HRB",
      "company_name": "Entwicklungsgesellschaft Ferienhauspark Bostalsee GmbH",
      "company_seat": "Nohfelden",
      "details": "13.10.2025 (Bekanntmachungsdatum)\n\nSaarland Amtsgericht Saarbrücken HRB 100199\nRegisterbekanntmachung nach dem Umwandlungsgesetz 13.10.2025 (Eintragungsdatum)\n\nEntwicklungsgesellschaft Ferienhauspark Bostalsee GmbH\nGesellschaft mit beschränkter Haftung\nNohfelden\n\nAls nicht eingetragen wird bekannt gemacht: Den Gläubigern der an der Verschmelzung beteiligten Gesellschaften ist, wenn sie binnen sechs Monaten nach dem Tag, an dem die Eintragung der Verschmelzung in das Register des Sitzes desjenigen Rechtsträgers, dessen Gläubiger sie sind, nach § 19 Absatz 3 UmwG bekannt gemacht worden ist, ihren Anspruch nach Grund und Höhe schriftlich anmelden, Sicherheit zu leisten, soweit sie nicht Befriedigung verlangen können. Dieses Recht steht den Gläubigern jedoch nur zu, wenn sie glaubhaft machen, dass durch die Verschmelzung die Erfüllung ihrer Forderung gefährdet wird."
    },
    {
      "date": "2025-10-13",
      "id": "133624",
      "original_text": "Registerbekanntmachung nach dem Umwandlungsgesetz\nSaarland Amtsgericht Saarbrücken PR 176\nKöninger & Mathieu Steuerberater PartG mbB – Homburg/Saar",
      "type": "Registerbekanntmachung nach dem Umwandlungsgesetz",
      "state": "Saarland",
      "amtsgericht": "Amtsgericht Saarbrücken",
      "registernummer": "PR 176",
      "registerart": "PR",
      "company_name": "Köninger & Mathieu Steuerberater PartG mbB",
      "company_seat": "Homburg/Saar",
      "details": "13.10.2025 (Bekanntmachungsdatum)\n\nSaarland Amtsgericht Saarbrücken PR 176\nRegisterbekanntmachung nach dem Umwandlungsgesetz 13.10.2025 (Eintragungsdatum)\n\nKöninger & Mathieu Steuerberater PartG mbB\nPartnerschaftsgesellschaft\nHomburg/Saar\n\nAls nicht eingetragen wird bekannt gemacht: Den Gläubigern der an der Verschmelzung beteiligten Gesellschaften ist, wenn sie binnen sechs Monaten nach dem Tag, an dem die Eintragung der Verschmelzung in das Register des Sitzes desjenigen Rechtsträgers, dessen Gläubiger sie sind, nach § 19 Absatz 3 UmwG bekannt gemacht worden ist, ihren Anspruch nach Grund und Höhe schriftlich anmelden, Sicherheit zu leisten, soweit sie nicht Befriedigung verlangen können. Dieses Recht steht den Gläubigern jedoch nur zu, wenn sie glaubhaft machen, dass durch die Verschmelzung die Erfüllung ihrer Forderung gefährdet wird."
    },
    {
      "date": "2025-10-13",
      "id": "133625",
      "original_text": "Löschungsankündigung\nBrandenburg Amtsgericht Potsdam HRB 16818\nPietsch Bau GmbH – Teltow",
      "type": "Löschungsankündigung",
      "state": "Brandenburg",
      "amtsgericht": "Amtsgericht Potsdam",
      "registernummer": "HRB 16818",
      "registerart": "HRB",
      "company_name": "Pietsch Bau GmbH",
      "company_seat": "Teltow",
      "details": "13.10.2025 (Bekanntmachungsdatum)\n\nBrandenburg Amtsgericht Potsdam HRB 16818\nLöschungsankündigung\n\nPietsch Bau GmbH\nGesellschaft mit beschränkter Haftung\nTeltow\n\nBei der nachstehenden Gesellschaft wird das Amtslöschungsverfahren gemäß § 394 FamFG eingeleitet. Widerspruchsfrist: 8 Wochen."
    },
    {
      "date": "2025-10-13",
      "id": "133626",
      "original_text": "Registerbekanntmachung nach dem Umwandlungsgesetz\nBaden-Württemberg Amtsgericht Stuttgart HRB 785416\naMoS KiTa Invest No. 2 GmbH – Fellbach",
      "type": "Registerbekanntmachung nach dem Umwandlungsgesetz",
      "state": "Baden-Württemberg",
      "amtsgericht": "Amtsgericht Stuttgart",
      "registernummer": "HRB 785416",
      "registerart": "HRB",
      "company_name": "aMoS KiTa Invest No. 2 GmbH",
      "company_seat": "Fellbach",
      "details": "13.10.2025 (Bekanntmachungsdatum)\n\nBaden-Württemberg Amtsgericht Stuttgart HRB 785416\nRegisterbekanntmachung nach dem Umwandlungsgesetz 13.10.2025 (Eintragungsdatum)\n\naMoS KiTa Invest No. 2 GmbH\nGesellschaft mit beschränkter Haftung\nFellbach\n\nAls nicht eingetragen wird bekanntgemacht:\nDen Gläubigern der an der Verschmelzung beteiligten Rechtsträger ist, wenn sie binnen sechs Monaten nach dem Tag, an dem die Eintragung der Verschmelzung in das Register des Sitzes desjenigen Rechtsträgers, dessen Gläubiger sie sind, nach § 19 Abs. 3 UmwG als bekanntgemacht gilt, ihren Anspruch nach Grund und Höhe schriftlich anmelden, Sicherheit zu leisten, soweit sie nicht Befriedigung verlangen können. Dieses Recht steht den Gläubigern jedoch nur zu, wenn sie glaubhaft machen, dass durch die Verschmelzung die Erfüllung ihrer Forderung gefährdet wird."
    },
    {
      "date": "2025-10-13",
      "id": "133627",
      "original_text": "Löschungsankündigung\nSchleswig-Holstein Amtsgericht Kiel HRB 24193\nTAKEOVER GmbH – Kiel",
      "type": "Löschungsankündigung",
      "state": "Schleswig-Holstein",
      "amtsgericht": "Amtsgericht Kiel",
      "registernummer": "HRB 24193",
      "registerart": "HRB",
      "company_name": "TAKEOVER GmbH",
      "company_seat": "Kiel",
      "details": "13.10.2025 (Bekanntmachungsdatum)\n\nSchleswig-Holstein Amtsgericht Kiel HRB 24193\nLöschungsankündigung\n\nTAKEOVER GmbH\nGesellschaft mit beschränkter Haftung\nKiel\n\nEs ist die Löschung der nachstehenden Gesellschaft wegen Vermögenslosigkeit gemäß § 394 FamFG beabsichtigt. Widerspruchsfrist: 2 Monate."
    },
    {
      "date": "2025-10-13",
      "id": "133628",
      "original_text": "Registerbekanntmachung nach dem Umwandlungsgesetz\nSaarland Amtsgericht Saarbrücken HRB 26497\nSWARMDA Beteiligungs GmbH – Wadgassen",
      "type": "Registerbekanntmachung nach dem Umwandlungsgesetz",
      "state": "Saarland",
      "amtsgericht": "Amtsgericht Saarbrücken",
      "registernummer": "HRB 26497",
      "registerart": "HRB",
      "company_name": "SWARMDA Beteiligungs GmbH",
      "company_seat": "Wadgassen",
      "details": "13.10.2025 (Bekanntmachungsdatum)\n\nSaarland Amtsgericht Saarbrücken HRB 26497\nRegisterbekanntmachung nach dem Umwandlungsgesetz 13.10.2025 (Eintragungsdatum)\n\nSWARMDA Beteiligungs GmbH\nGesellschaft mit beschränkter Haftung\nWadgassen\n\nAls nicht eingetragen wird bekannt gemacht: Den Gläubigern der an der Verschmelzung beteiligten Gesellschaften ist, wenn sie binnen sechs Monaten nach dem Tag, an dem die Eintragung der Verschmelzung in das Register des Sitzes desjenigen Rechtsträgers, dessen Gläubiger sie sind, nach § 19 Absatz 3 UmwG bekannt gemacht worden ist, ihren Anspruch nach Grund und Höhe schriftlich anmelden, Sicherheit zu leisten, soweit sie nicht Befriedigung verlangen können. Dieses Recht steht den Gläubigern jedoch nur zu, wenn sie glaubhaft machen, dass durch die Verschmelzung die Erfüllung ihrer Forderung gefährdet wird."
    },
    {
      "date": "2025-10-13",
      "id": "133629",
      "original_text": "Registerbekanntmachung nach dem Umwandlungsgesetz\nBaden-Württemberg Amtsgericht Stuttgart HRB 766914\nAccelerated Innovation GmbH – Hechingen",
      "type": "Registerbekanntmachung nach dem Umwandlungsgesetz",
      "state": "Baden-Württemberg",
      "amtsgericht": "Amtsgericht Stuttgart",
      "registernummer": "HRB 766914",
      "registerart": "HRB",
      "company_name": "Accelerated Innovation GmbH",
      "company_seat": "Hechingen",
      "details": "13.10.2025 (Bekanntmachungsdatum)\n\nBaden-Württemberg Amtsgericht Stuttgart HRB 766914\nRegisterbekanntmachung nach dem Umwandlungsgesetz 13.10.2025 (Eintragungsdatum)\n\nAccelerated Innovation GmbH\nGesellschaft mit beschränkter Haftung\nHechingen\n\nDen Gläubigern der an der Verschmelzung beteiligten Rechtsträger ist, wenn sie binnen sechs Monaten nach dem Tag, an dem die Eintragung der Verschmelzung in das Register des Sitzes desjenigen Rechtsträgers, dessen Gläubiger sie sind, nach § 19 Abs. 3 UmwG als bekanntgemacht gilt, ihren Anspruch nach Grund und Höhe schriftlich anmelden, Sicherheit zu leisten, soweit sie nicht Befriedigung verlangen können. Dieses Recht steht den Gläubigern jedoch nur zu, wenn sie glaubhaft machen, dass durch die Verschmelzung die Erfüllung ihrer Forderung gefährdet wird."
    },
    {
      "date": "2025-10-13",
      "id": "133630",
      "original_text": "Löschungsankündigung\nBaden-Württemberg Amtsgericht Ulm HRB 747412\nINDEVCO GmbH – Satteldorf",
      "type": "Löschungsankündigung",
      "state": "Baden-Württemberg",
      "amtsgericht": "Amtsgericht Ulm",
      "registernummer": "HRB 747412",
      "registerart": "HRB",
      "company_name": "INDEVCO GmbH",
      "company_seat": "Satteldorf",
      "details": "13.10.2025 (Bekanntmachungsdatum)\n\nBaden-Württemberg Amtsgericht Ulm HRB 747412\nLöschungsankündigung\n\nINDEVCO GmbH\nGesellschaft mit beschränkter Haftung\nSatteldorf\n\nDas Gericht beabsichtigt, die Gesellschaft wegen Vermögenslosigkeit im Handelsregister von Amts wegen nach § 394 FamFG zu löschen. Die Frist zur Geltendmachung eines Widerspruchs gegen die beabsichtigte Löschung ist auf  einen Monat ab Veröffentlichung bestimmt."
    },
    {
      "date": "2025-10-13",
      "id": "133631",
      "original_text": "Einreichung neuer Dokumente\nMecklenburg-Vorpommern Amtsgericht Stralsund HRB 2951\nWohnungsverwaltung Binz GmbH – Binz",
      "type": "Einreichung neuer Dokumente",
      "state": "Mecklenburg-Vorpommern",
      "amtsgericht": "Amtsgericht Stralsund",
      "registernummer": "HRB 2951",
      "registerart": "HRB",
      "company_name": "Wohnungsverwaltung Binz GmbH",
      "company_seat": "Binz",
      "details": "13.10.2025 (Bekanntmachungsdatum)\n\nMecklenburg-Vorpommern Amtsgericht Stralsund HRB 2951\nEinreichung neuer Dokumente\n\nWohnungsverwaltung Binz GmbH\nGesellschaft mit beschränkter Haftung\nBinz\n\nEine Liste der Mitglieder des Aufsichtsrats ist zum Handelsregister eingereicht worden."
    },
    {
      "date": "2025-10-13",
      "id": "133632",
      "original_text": "Registerbekanntmachung nach dem Umwandlungsgesetz\nBerlin Amtsgericht Berlin (Charlottenburg) HRB 280030\nPalliative Care Team Berlin am Krankenhaus Waldfriede GmbH – Berlin",
      "type": "Registerbekanntmachung nach dem Umwandlungsgesetz",
      "state": "Berlin",
      "amtsgericht": "Amtsgericht Berlin (Charlottenburg)",
      "registernummer": "HRB 280030",
      "registerart": "HRB",
      "company_name": "Palliative Care Team Berlin am Krankenhaus Waldfriede GmbH",
      "company_seat": "Berlin",
      "details": "13.10.2025 (Bekanntmachungsdatum)\n\nBerlin Amtsgericht Berlin (Charlottenburg) HRB 280030\nRegisterbekanntmachung nach dem Umwandlungsgesetz 09.10.2025 (Eintragungsdatum)\n\nPalliative Care Team Berlin am Krankenhaus Waldfriede GmbH\nGesellschaft mit beschränkter Haftung\nBerlin\n\nZu Eintragungsnummer 1 vom 09.10.2025 wird als nicht eingetragen veröffentlicht:Den Gläubigern ist, wenn sie binnen sechs Monaten nach dem Tag, an dem die Eintragung der Umwandlung als bekannt gemacht gilt, ihren Anspruch nach Grund und Höhe schriftlich anmelden, Sicherheit zu leisten, soweit sie nicht Befriedigung verlangen können. Dieses Recht steht den Gläubigern jedoch nur zu, wenn sie glaubhaft machen, dass durch die Umwandlung die Erfüllung ihrer Forderung gefährdet wird. Das Recht, Sicherheitsleistung zu verlangen, steht Gläubigern nicht zu, die im Falle der Insolvenz ein Recht auf vorzugsweise Befriedigung aus einer Deckungsmasse haben, die nach gesetzlicher Vorschrift zu ihrem Schutz errichtet und staatlich überwacht ist."
    },
    {
      "date": "2025-10-13",
      "id": "133633",
      "original_text": "Löschungsankündigung\nBaden-Württemberg Amtsgericht Stuttgart HRB 760014\nBW Schadensanierung GmbH – Talheim",
      "type": "Löschungsankündigung",
      "state": "Baden-Württemberg",
      "amtsgericht": "Amtsgericht Stuttgart",
      "registernummer": "HRB 760014",
      "registerart": "HRB",
      "company_name": "BW Schadensanierung GmbH",
      "company_seat": "Talheim",
      "details": "13.10.2025 (Bekanntmachungsdatum)\n\nBaden-Württemberg Amtsgericht Stuttgart HRB 760014\nLöschungsankündigung\n\nBW Schadensanierung GmbH\nGesellschaft mit beschränkter Haftung\nTalheim\n\nDas Gericht beabsichtigt, die Gesellschaft wegen Vermögenslosigkeit im Handelsregister von Amts wegen nach § 394 FamFG zu löschen. Die Frist zur Geltendmachung eines Widerspruchs gegen die beabsichtigte Löschung ist auf zwei Monate ab Veröffentlichung bestimmt."
    },
    {
      "date": "2025-10-13",
      "id": "133634",
      "original_text": "Löschungsankündigung\nBrandenburg Amtsgericht Potsdam HRB 39978\nZFK Transport GmbH – Potsdam",
      "type": "Löschungsankündigung",
      "state": "Brandenburg",
      "amtsgericht": "Amtsgericht Potsdam",
      "registernummer": "HRB 39978",
      "registerart": "HRB",
      "company_name": "ZFK Transport GmbH",
      "company_seat": "Potsdam",
      "details": "13.10.2025 (Bekanntmachungsdatum)\n\nBrandenburg Amtsgericht Potsdam HRB 39978\nLöschungsankündigung\n\nZFK Transport GmbH\nGesellschaft mit beschränkter Haftung\nPotsdam\n\nBei der nachstehenden Gesellschaft wird das Amtslöschungsverfahren gemäß § 394 FamFG eingeleitet. Widerspruchsfrist: 8 Wochen."
    },
    {
      "date": "2025-10-13",
      "id": "133635",
      "original_text": "Löschungsankündigung\nBerlin Amtsgericht Berlin (Charlottenburg) HRB 235236\nHartmut Bau GmbH – Berlin",
      "type": "Löschungsankündigung",
      "state": "Berlin",
      "amtsgericht": "Amtsgericht Berlin (Charlottenburg)",
      "registernummer": "HRB 235236",
      "registerart": "HRB",
      "company_name": "Hartmut Bau GmbH",
      "company_seat": "Berlin",
      "details": "13.10.2025 (Bekanntmachungsdatum)\n\nBerlin Amtsgericht Berlin (Charlottenburg) HRB 235236\nLöschungsankündigung\n\nHartmut Bau GmbH\nGesellschaft mit beschränkter Haftung\nBerlin\n\nBei der nachstehenden Gesellschaft wird das Amtslöschungsverfahren gemäß § 394 FamFG eingeleitet. Widerspruchsfrist 6 Wochen"
    },
    {
      "date": "2025-10-13",
      "id": "133636",
      "original_text": "Registerbekanntmachung nach dem Umwandlungsgesetz\nSchleswig-Holstein Amtsgericht Lübeck HRA 6248\nThomas Görß Wohnungsunternehmen GmbH & Co. KG – Lübeck",
      "type": "Registerbekanntmachung nach dem Umwandlungsgesetz",
      "state": "Schleswig-Holstein",
      "amtsgericht": "Amtsgericht Lübeck",
      "registernummer": "HRA 6248",
      "registerart": "HRA",
      "company_name": "Thomas Görß Wohnungsunternehmen GmbH & Co. KG",
      "company_seat": "Lübeck",
      "details": "13.10.2025 (Bekanntmachungsdatum)\n\nSchleswig-Holstein Amtsgericht Lübeck HRA 6248\nRegisterbekanntmachung nach dem Umwandlungsgesetz 10.10.2025 (Eintragungsdatum)\n\nThomas Görß Wohnungsunternehmen GmbH & Co. KG\nKommanditgesellschaft\nLübeck\n\nZu Eintragungsnummer 5 vom 10.10.2025 wird als nicht eingetragen veröffentlicht: Den Gläubigern ist, wenn sie binnen sechs Monaten nach dem Tag, an dem die Eintragung der Umwandlung als bekannt gemacht gilt, ihren Anspruch nach Grund und Höhe schriftlich anmelden, Sicherheit zu leisten, soweit sie nicht Befriedigung verlangen können. Dieses Recht steht den Gläubigern jedoch nur zu, wenn sie glaubhaft machen, dass durch die Umwandlung die Erfüllung ihrer Forderung gefährdet wird."
    },
    {
      "date": "2025-10-13",
      "id": "133637",
      "original_text": "Löschungsankündigung\nBrandenburg Amtsgericht Potsdam HRB 33738\nAJT Mobilheime UG (haftungsbeschränkt) – Brieselang",
      "type": "Löschungsankündigung",
      "state": "Brandenburg",
      "amtsgericht": "Amtsgericht Potsdam",
      "registernummer": "HRB 33738",
      "registerart": "HRB",
      "company_name": "AJT Mobilheime UG (haftungsbeschränkt)",
      "company_seat": "Brieselang",
      "details": "13.10.2025 (Bekanntmachungsdatum)\n\nBrandenburg Amtsgericht Potsdam HRB 33738\nLöschungsankündigung\n\nAJT Mobilheime UG (haftungsbeschränkt)\nGesellschaft mit beschränkter Haftung\nBrieselang\n\nBei der nachstehenden Gesellschaft wird das Amtslöschungsverfahren gemäß § 394 FamFG eingeleitet. Widerspruchsfrist: 8 Wochen."
    },
    {
      "date": "2025-10-13",
      "id": "133638",
      "original_text": "Registerbekanntmachung nach dem Umwandlungsgesetz\nHamburg Amtsgericht Hamburg HRB 46346\nFoconis Trading GmbH – Hamburg",
      "type": "Registerbekanntmachung nach dem Umwandlungsgesetz",
      "state": "Hamburg",
      "amtsgericht": "Amtsgericht Hamburg",
      "registernummer": "HRB 46346",
      "registerart": "HRB",
      "company_name": "Foconis Trading GmbH",
      "company_seat": "Hamburg",
      "details": "13.10.2025 (Bekanntmachungsdatum)\n\nHamburg Amtsgericht Hamburg HRB 46346\nRegisterbekanntmachung nach dem Umwandlungsgesetz 13.10.2025 (Eintragungsdatum)\n\nFoconis Trading GmbH\nGesellschaft mit beschränkter Haftung\nHamburg\n\nAls nicht eingetragen wird bekannt gemacht:\nDen Gläubigern der an der Verschmelzung beteiligten Gesellschaften ist, wenn sie binnen sechs Monaten nach dem Tag, an dem die Eintragung der Verschmelzung in das Register des Sitzes desjenigen Rechtsträgers, dessen Gläubiger sie sind, nach § 19 Absatz 3 UmwG als bekannt gemacht gilt, ihren Anspruch nach Grund und Höhe schriftlich anmelden, Sicherheit zu leisten, soweit sie nicht Befriedigung verlangen können. Dieses Recht steht den Gläubigern jedoch nur zu, wenn sie glaubhaft machen, dass durch die Verschmelzung die Erfüllung ihrer Forderung gefährdet wird."
    },
    {
      "date": "2025-10-13",
      "id": "133639",
      "original_text": "Löschungsankündigung\nSchleswig-Holstein Amtsgericht Flensburg HRB 8002\nSchatzkiste UG (haftungsbeschränkt) – Sylt/OT Westerland",
      "type": "Löschungsankündigung",
      "state": "Schleswig-Holstein",
      "amtsgericht": "Amtsgericht Flensburg",
      "registernummer": "HRB 8002",
      "registerart": "HRB",
      "company_name": "Schatzkiste UG (haftungsbeschränkt)",
      "company_seat": "Sylt/OT Westerland",
      "details": "13.10.2025 (Bekanntmachungsdatum)\n\nSchleswig-Holstein Amtsgericht Flensburg HRB 8002\nLöschungsankündigung\n\nSchatzkiste UG (haftungsbeschränkt)\nGesellschaft mit beschränkter Haftung\nSylt/OT Westerland\n\nEs ist die Löschung der nachstehenden Gesellschaft wegen Vermögenslosigkeit gemäß § 394 FamFG beabsichtigt.\nWiderspruchsfrist: 2 Monate."
    },
    {
      "date": "2025-10-13",
      "id": "133640",
      "original_text": "Registerbekanntmachung nach dem Umwandlungsgesetz\nBaden-Württemberg Amtsgericht Stuttgart HRB 771067\nAUDERE Financial Services GmbH – Fellbach",
      "type": "Registerbekanntmachung nach dem Umwandlungsgesetz",
      "state": "Baden-Württemberg",
      "amtsgericht": "Amtsgericht Stuttgart",
      "registernummer": "HRB 771067",
      "registerart": "HRB",
      "company_name": "AUDERE Financial Services GmbH",
      "company_seat": "Fellbach",
      "details": "13.10.2025 (Bekanntmachungsdatum)\n\nBaden-Württemberg Amtsgericht Stuttgart HRB 771067\nRegisterbekanntmachung nach dem Umwandlungsgesetz 13.10.2025 (Eintragungsdatum)\n\nAUDERE Financial Services GmbH\nGesellschaft mit beschränkter Haftung\nFellbach\n\nDen Gläubigern der an der Verschmelzung beteiligten Rechtsträger ist, wenn sie binnen sechs Monaten nach dem Tag, an dem die Eintragung der Verschmelzung in das Register des Sitzes desjenigen Rechtsträgers, dessen Gläubiger sie sind, nach § 19 Abs. 3 UmwG als bekanntgemacht gilt, ihren Anspruch nach Grund und Höhe schriftlich anmelden, Sicherheit zu leisten, soweit sie nicht Befriedigung verlangen können. Dieses Recht steht den Gläubigern jedoch nur zu, wenn sie glaubhaft machen, dass durch die Verschmelzung die Erfüllung ihrer Forderung gefährdet wird."
    },
    {
      "date": "2025-10-13",
      "id": "133641",
      "original_text": "Registerbekanntmachung nach dem Umwandlungsgesetz\nHamburg Amtsgericht Hamburg HRB 171398\nChristian Martens GmbH – Hamburg",
      "type": "Registerbekanntmachung nach dem Umwandlungsgesetz",
      "state": "Hamburg",
      "amtsgericht": "Amtsgericht Hamburg",
      "registernummer": "HRB 171398",
      "registerart": "HRB",
      "company_name": "Christian Martens GmbH",
      "company_seat": "Hamburg",
      "details": "13.10.2025 (Bekanntmachungsdatum)\n\nHamburg Amtsgericht Hamburg HRB 171398\nRegisterbekanntmachung nach dem Umwandlungsgesetz 13.10.2025 (Eintragungsdatum)\n\nChristian Martens GmbH\nGesellschaft mit beschränkter Haftung\nHamburg\n\nAls nicht eingetragen wird bekannt gemacht:\nDen Gläubigern der an der Verschmelzung beteiligten Gesellschaften ist, wenn sie binnen sechs Monaten nach dem Tag, an dem die Eintragung der Verschmelzung in das Register des Sitzes desjenigen Rechtsträgers, dessen Gläubiger sie sind, nach § 19 Absatz 3 UmwG als bekannt gemacht gilt, ihren Anspruch nach Grund und Höhe schriftlich anmelden, Sicherheit zu leisten, soweit sie nicht Befriedigung verlangen können. Dieses Recht steht den Gläubigern jedoch nur zu, wenn sie glaubhaft machen, dass durch die Verschmelzung die Erfüllung ihrer Forderung gefährdet wird."
    },
    {
      "date": "2025-10-13",
      "id": "133642",
      "original_text": "Registerbekanntmachung nach dem Umwandlungsgesetz\nHamburg Amtsgericht Hamburg HRB 194787\nagilo-Kita Zauberberg gGmbH – Hamburg",
      "type": "Registerbekanntmachung nach dem Umwandlungsgesetz",
      "state": "Hamburg",
      "amtsgericht": "Amtsgericht Hamburg",
      "registernummer": "HRB 194787",
      "registerart": "HRB",
      "company_name": "agilo-Kita Zauberberg gGmbH",
      "company_seat": "Hamburg",
      "details": "13.10.2025 (Bekanntmachungsdatum)\n\nHamburg Amtsgericht Hamburg HRB 194787\nRegisterbekanntmachung nach dem Umwandlungsgesetz 13.10.2025 (Eintragungsdatum)\n\nagilo-Kita Zauberberg gGmbH\nGesellschaft mit beschränkter Haftung\nHamburg\n\nAls nicht eingetragen wird bekannt gemacht:\nDen Gläubigern der an der Ausgliederung beteiligten Gesellschaften ist, wenn sie binnen sechs Monaten nach dem Tag, an dem die Eintragung der Ausgliederung in das Register des Sitzes desjenigen Rechtsträgers, dessen Gläubiger sie sind, nach § 19 Absatz 3 UmwG als bekannt gemacht gilt, ihren Anspruch nach Grund und Höhe schriftlich anmelden, Sicherheit zu leisten, soweit sie nicht Befriedigung verlangen können. Dieses Recht steht den Gläubigern jedoch nur zu, wenn sie glaubhaft machen, dass durch die Ausgliederung die Erfüllung ihrer Forderung gefährdet wird."
    },
    {
      "date": "2025-10-13",
      "id": "133643",
      "original_text": "Registerbekanntmachung nach dem Umwandlungsgesetz\nHamburg Amtsgericht Hamburg HRB 165255\nagilo Schleswig-Holstein gGmbH – Hamburg",
      "type": "Registerbekanntmachung nach dem Umwandlungsgesetz",
      "state": "Hamburg",
      "amtsgericht": "Amtsgericht Hamburg",
      "registernummer": "HRB 165255",
      "registerart": "HRB",
      "company_name": "agilo Schleswig-Holstein gGmbH",
      "company_seat": "Hamburg",
      "details": "13.10.2025 (Bekanntmachungsdatum)\n\nHamburg Amtsgericht Hamburg HRB 165255\nRegisterbekanntmachung nach dem Umwandlungsgesetz 13.10.2025 (Eintragungsdatum)\n\nagilo Schleswig-Holstein gGmbH\nGesellschaft mit beschränkter Haftung\nHamburg\n\nAls nicht eingetragen wird bekannt gemacht:\nDen Gläubigern der an der Ausgliederung beteiligten Gesellschaften ist, wenn sie binnen sechs Monaten nach dem Tag, an dem die Eintragung der Ausgliederung in das Register des Sitzes desjenigen Rechtsträgers, dessen Gläubiger sie sind, nach § 19 Absatz 3 UmwG als bekannt gemacht gilt, ihren Anspruch nach Grund und Höhe schriftlich anmelden, Sicherheit zu leisten, soweit sie nicht Befriedigung verlangen können. Dieses Recht steht den Gläubigern jedoch nur zu, wenn sie glaubhaft machen, dass durch die Ausgliederung die Erfüllung ihrer Forderung gefährdet wird."
    },
    {
      "date": "2025-10-13",
      "id": "133644",
      "original_text": "Registerbekanntmachung nach dem Umwandlungsgesetz\nHamburg Amtsgericht Hamburg HRB 194786\nagilo-Kita Naturkinder gGmbH – Hamburg",
      "type": "Registerbekanntmachung nach dem Umwandlungsgesetz",
      "state": "Hamburg",
      "amtsgericht": "Amtsgericht Hamburg",
      "registernummer": "HRB 194786",
      "registerart": "HRB",
      "company_name": "agilo-Kita Naturkinder gGmbH",
      "company_seat": "Hamburg",
      "details": "13.10.2025 (Bekanntmachungsdatum)\n\nHamburg Amtsgericht Hamburg HRB 194786\nRegisterbekanntmachung nach dem Umwandlungsgesetz 13.10.2025 (Eintragungsdatum)\n\nagilo-Kita Naturkinder gGmbH\nGesellschaft mit beschränkter Haftung\nHamburg\n\nAls nicht eingetragen wird bekannt gemacht:\nDen Gläubigern der an der Ausgliederung beteiligten Gesellschaften ist, wenn sie binnen sechs Monaten nach dem Tag, an dem die Eintragung der Ausgliederung in das Register des Sitzes desjenigen Rechtsträgers, dessen Gläubiger sie sind, nach § 19 Absatz 3 UmwG als bekannt gemacht gilt, ihren Anspruch nach Grund und Höhe schriftlich anmelden, Sicherheit zu leisten, soweit sie nicht Befriedigung verlangen können. Dieses Recht steht den Gläubigern jedoch nur zu, wenn sie glaubhaft machen, dass durch die Ausgliederung die Erfüllung ihrer Forderung gefährdet wird."
    },
    {
      "date": "2025-10-13",
      "id": "133645",
      "original_text": "Löschungsankündigung\nSchleswig-Holstein Amtsgericht Pinneberg VR 120\nMotor-Boot-Club Schulau e.V. – Wedel",
      "type": "Löschungsankündigung",
      "state": "Schleswig-Holstein",
      "amtsgericht": "Amtsgericht Pinneberg",
      "registernummer": "VR 120",
      "registerart": "VR",
      "company_name": "Motor-Boot-Club Schulau e.V.",
      "company_seat": "Wedel",
      "details": "13.10.2025 (Bekanntmachungsdatum)\n\nSchleswig-Holstein Amtsgericht Pinneberg VR 120\nLöschungsankündigung\n\nMotor-Boot-Club Schulau e.V.\neingetragener Verein\nWedel\n\nEs ist die Löschung des nachstehenden Vereins wegen Vermögenslosigkeit gemäß § 394 FamFG beabsichtigt. Widerspruchsfrist: 3 Monate."
    },
    {
      "date": "2025-10-13",
      "id": "133646",
      "original_text": "Registerbekanntmachung nach dem Umwandlungsgesetz\nBaden-Württemberg Amtsgericht Mannheim HRB 704707\nLTG Informationssysteme Holding GmbH – Rastatt",
      "type": "Registerbekanntmachung nach dem Umwandlungsgesetz",
      "state": "Baden-Württemberg",
      "amtsgericht": "Amtsgericht Mannheim",
      "registernummer": "HRB 704707",
      "registerart": "HRB",
      "company_name": "LTG Informationssysteme Holding GmbH",
      "company_seat": "Rastatt",
      "details": "13.10.2025 (Bekanntmachungsdatum)\n\nBaden-Württemberg Amtsgericht Mannheim HRB 704707\nRegisterbekanntmachung nach dem Umwandlungsgesetz 13.10.2025 (Eintragungsdatum)\n\nLTG Informationssysteme Holding GmbH\nGesellschaft mit beschränkter Haftung\nRastatt\n\nDen Gläubigern der an der Verschmelzung beteiligten Rechtsträger ist, wenn sie binnen sechs Monaten nach dem Tag, an dem die Eintragung der Verschmelzung in das Register des Sitzes desjenigen Rechtsträgers, dessen Gläubiger sie sind, nach § 19 Abs. 3 UmwG als bekanntgemacht gilt, ihren Anspruch nach Grund und Höhe schriftlich anmelden, Sicherheit zu leisten, soweit sie nicht Befriedigung verlangen können. Dieses Recht steht den Gläubigern jedoch nur zu, wenn sie glaubhaft machen, dass durch die Verschmelzung die Erfüllung ihrer Forderung gefährdet wird."
    },
    {
      "date": "2025-10-13",
      "id": "133647",
      "original_text": "Registerbekanntmachung nach dem Umwandlungsgesetz\nBaden-Württemberg Amtsgericht Mannheim HRB 521501\nLTG Rastatt GmbH – Rastatt",
      "type": "Registerbekanntmachung nach dem Umwandlungsgesetz",
      "state": "Baden-Württemberg",
      "amtsgericht": "Amtsgericht Mannheim",
      "registernummer": "HRB 521501",
      "registerart": "HRB",
      "company_name": "LTG Rastatt GmbH",
      "company_seat": "Rastatt",
      "details": "13.10.2025 (Bekanntmachungsdatum)\n\nBaden-Württemberg Amtsgericht Mannheim HRB 521501\nRegisterbekanntmachung nach dem Umwandlungsgesetz 13.10.2025 (Eintragungsdatum)\n\nLTG Rastatt GmbH\nGesellschaft mit beschränkter Haftung\nRastatt\n\nAls nicht eingetragen wird bekanntgemacht:\nDen Gläubigern der an der Verschmelzung beteiligten Rechtsträger ist, wenn sie binnen sechs Monaten nach dem Tag, an dem die Eintragung der Verschmelzung in das Register des Sitzes desjenigen Rechtsträgers, dessen Gläubiger sie sind, nach § 19 Abs. 3 UmwG als bekanntgemacht gilt, ihren Anspruch nach Grund und Höhe schriftlich anmelden, Sicherheit zu leisten, soweit sie nicht Befriedigung verlangen können. Dieses Recht steht den Gläubigern jedoch nur zu, wenn sie glaubhaft machen, dass durch die Verschmelzung die Erfüllung ihrer Forderung gefährdet wird."
    },
    {
      "date": "2025-10-13",
      "id": "133648",
      "original_text": "Registerbekanntmachung nach dem Umwandlungsgesetz\nBaden-Württemberg Amtsgericht Stuttgart HRB 801176\n70x Consulting GmbH – Egenhausen",
      "type": "Registerbekanntmachung nach dem Umwandlungsgesetz",
      "state": "Baden-Württemberg",
      "amtsgericht": "Amtsgericht Stuttgart",
      "registernummer": "HRB 801176",
      "registerart": "HRB",
      "company_name": "70x Consulting GmbH",
      "company_seat": "Egenhausen",
      "details": "13.10.2025 (Bekanntmachungsdatum)\n\nBaden-Württemberg Amtsgericht Stuttgart HRB 801176\nRegisterbekanntmachung nach dem Umwandlungsgesetz 13.10.2025 (Eintragungsdatum)\n\n70x Consulting GmbH\nGesellschaft mit beschränkter Haftung\nEgenhausen\n\nAls nicht eingetragen wird bekanntgemacht:\nDen Gläubigern der an der Ausgliederung beteiligten Rechtsträger ist, wenn sie binnen sechs Monaten nach dem Tag, an dem die Eintragung der Ausgliederung in das Register des Sitzes desjenigen Rechtsträgers, dessen Gläubiger sie sind, nach § 19 Abs. 3 UmwG als bekanntgemacht gilt, ihren Anspruch nach Grund und Höhe schriftlich anmelden, Sicherheit zu leisten, soweit sie nicht Befriedigung verlangen können. Dieses Recht steht den Gläubigern jedoch nur zu, wenn sie glaubhaft machen, dass durch die Ausgliederung die Erfüllung ihrer Forderung gefährdet wird."
    },
    {
      "date": "2025-10-13",
      "id": "133649",
      "original_text": "Registerbekanntmachung nach dem Umwandlungsgesetz\nHamburg Amtsgericht Hamburg HRB 26741\nATH Altonaer-Technologie-Holding GmbH – Hamburg",
      "type": "Registerbekanntmachung nach dem Umwandlungsgesetz",
      "state": "Hamburg",
      "amtsgericht": "Amtsgericht Hamburg",
      "registernummer": "HRB 26741",
      "registerart": "HRB",
      "company_name": "ATH Altonaer-Technologie-Holding GmbH",
      "company_seat": "Hamburg",
      "details": "13.10.2025 (Bekanntmachungsdatum)\n\nHamburg Amtsgericht Hamburg HRB 26741\nRegisterbekanntmachung nach dem Umwandlungsgesetz 13.10.2025 (Eintragungsdatum)\n\nATH Altonaer-Technologie-Holding GmbH\nGesellschaft mit beschränkter Haftung\nHamburg\n\nAls nicht eingetragen wird bekannt gemacht:\nDen Gläubigern der an der Verschmelzung beteiligten Gesellschaften ist, wenn sie binnen sechs Monaten nach dem Tag, an dem die Eintragung der Verschmelzung in das Register des Sitzes desjenigen Rechtsträgers, dessen Gläubiger sie sind, nach § 19 Absatz 3 UmwG als bekannt gemacht gilt, ihren Anspruch nach Grund und Höhe schriftlich anmelden, Sicherheit zu leisten, soweit sie nicht Befriedigung verlangen können. Dieses Recht steht den Gläubigern jedoch nur zu, wenn sie glaubhaft machen, dass durch die Verschmelzung die Erfüllung ihrer Forderung gefährdet wird."
    },
    {
      "date": "2025-10-13",
      "id": "133650",
      "original_text": "Löschungsankündigung\nSaarland Amtsgericht Saarbrücken HRB 108040\nPMF GmbH – Neunkirchen",
      "type": "Löschungsankündigung",
      "state": "Saarland",
      "amtsgericht": "Amtsgericht Saarbrücken",
      "registernummer": "HRB 108040",
      "registerart": "HRB",
      "company_name": "PMF GmbH",
      "company_seat": "Neunkirchen",
      "details": "13.10.2025 (Bekanntmachungsdatum)\n\nSaarland Amtsgericht Saarbrücken HRB 108040\nLöschungsankündigung\n\nPMF GmbH\nGesellschaft mit beschränkter Haftung\nNeunkirchen\n\nEs ist beabsichtigt, die Gesellschaft von Amts wegen gemäß § 394 FamFG wegen Vermögenslosigkeit zu löschen.\nGegen die Löschung von Amts wegen ist das Rechtsmittel des Widerspruchs statthaft. Der Widerspruch ist binnen einer Frist zwei Monaten beginnend mit dem Tag dieser Veröffentlichung durch Einreichen eines Widerspruchsschreibens -schriftlich oder zur Niederschrift der Geschäftsstelle beim Amtsgericht Saarbrücken, -zentrales Handelsregister-, Mainzerstr.178, 66121 Saarbrücken einzulegen.\nDer Widerspruch muss die Bezeichnung der angefochtenen Löschungsankündigung enthalten sowie die Erklärung, dass Widerspruch eingelegt wird. Er ist vom Widerspruchsführer oder seinem Bevollmächtigten zu unterzeichnen.\nDas Widerspruchsschreiben kann auch in der Form eines elektronischen Dokumentes eingereicht werden, das mit einer qualifizierten elektronischen Signatur nach dem Signaturgesetz versehen sein muss (§§ 14 Abs. 2 FamFG, 130a, 298 ZPO)."
    },
    {
      "date": "2025-10-13",
      "id": "133651",
      "original_text": "Registerbekanntmachung nach dem Umwandlungsgesetz\nBaden-Württemberg Amtsgericht Ulm HRB 750493\nGrillrost.com BBQ Immobilien GmbH – Rottenacker",
      "type": "Registerbekanntmachung nach dem Umwandlungsgesetz",
      "state": "Baden-Württemberg",
      "amtsgericht": "Amtsgericht Ulm",
      "registernummer": "HRB 750493",
      "registerart": "HRB",
      "company_name": "Grillrost.com BBQ Immobilien GmbH",
      "company_seat": "Rottenacker",
      "details": "13.10.2025 (Bekanntmachungsdatum)\n\nBaden-Württemberg Amtsgericht Ulm HRB 750493\nRegisterbekanntmachung nach dem Umwandlungsgesetz 13.10.2025 (Eintragungsdatum)\n\nGrillrost.com BBQ Immobilien GmbH\nGesellschaft mit beschränkter Haftung\nRottenacker\n\nAls nicht eingetragen wird bekanntgemacht:\nDen Gläubigern der an der Abspaltung beteiligten Rechtsträger ist, wenn sie binnen sechs Monaten nach dem Tag, an dem die Eintragung der Abspaltung in das Register des Sitzes desjenigen Rechtsträgers, dessen Gläubiger sie sind, nach § 19 Abs. 3 UmwG als bekanntgemacht gilt, ihren Anspruch nach Grund und Höhe schriftlich anmelden, Sicherheit zu leisten, soweit sie nicht Befriedigung verlangen können. Dieses Recht steht den Gläubigern jedoch nur zu, wenn sie glaubhaft machen, dass durch die Abspaltung die Erfüllung ihrer Forderung gefährdet wird."
    },
    {
      "date": "2025-10-13",
      "id": "133652",
      "original_text": "Löschungsankündigung\nSaarland Amtsgericht Saarbrücken HRB 3842\nMONDUS Immobilien Management GmbH – Gersheim",
      "type": "Löschungsankündigung",
      "state": "Saarland",
      "amtsgericht": "Amtsgericht Saarbrücken",
      "registernummer": "HRB 3842",
      "registerart": "HRB",
      "company_name": "MONDUS Immobilien Management GmbH",
      "company_seat": "Gersheim",
      "details": "13.10.2025 (Bekanntmachungsdatum)\n\nSaarland Amtsgericht Saarbrücken HRB 3842\nLöschungsankündigung\n\nMONDUS Immobilien Management GmbH\nGesellschaft mit beschränkter Haftung\nGersheim\n\nEs ist beabsichtigt, die Gesellschaft von Amts wegen gemäß § 394 FamFG wegen Vermögenslosigkeit zu löschen.\nGegen die Löschung von Amts wegen ist das Rechtsmittel des Widerspruchs statthaft. Der Widerspruch ist binnen einer Frist zwei Monaten beginnend mit dem Tag dieser Veröffentlichung durch Einreichen eines Widerspruchsschreibens -schriftlich oder zur Niederschrift der Geschäftsstelle beim Amtsgericht Saarbrücken, -zentrales Handelsregister-, Mainzerstr.178, 66121 Saarbrücken einzulegen.\nDer Widerspruch muss die Bezeichnung der angefochtenen Löschungsankündigung enthalten sowie die Erklärung, dass Widerspruch eingelegt wird. Er ist vom Widerspruchsführer oder seinem Bevollmächtigten zu unterzeichnen.\nDas Widerspruchsschreiben kann auch in der Form eines elektronischen Dokumentes eingereicht werden, das mit einer qualifizierten elektronischen Signatur nach dem Signaturgesetz versehen sein muss (§§ 14 Abs. 2 FamFG, 130a, 298 ZPO)."
    },
    {
      "date": "2025-10-13",
      "id": "133653",
      "original_text": "Einreichung neuer Dokumente\nBaden-Württemberg Amtsgericht Stuttgart HRB 793641\ndbeyond ag – Stuttgart",
      "type": "Einreichung neuer Dokumente",
      "state": "Baden-Württemberg",
      "amtsgericht": "Amtsgericht Stuttgart",
      "registernummer": "HRB 793641",
      "registerart": "HRB",
      "company_name": "dbeyond ag",
      "company_seat": "Stuttgart",
      "details": "13.10.2025 (Bekanntmachungsdatum)\n\nBaden-Württemberg Amtsgericht Stuttgart HRB 793641\nEinreichung neuer Dokumente\n\ndbeyond ag\nAktiengesellschaft\nStuttgart\n\nDie Gesellschaft hat am 08.10.2025 die Liste über die Zusammensetzung des Aufsichtsrats zum Handelsregister eingereicht."
    },
    {
      "date": "2025-10-13",
      "id": "133654",
      "original_text": "Einreichung neuer Dokumente\nBerlin Amtsgericht Berlin (Charlottenburg) HRB 246719\nSiemens Energy Electrolyzer Manufacturing GmbH – Berlin",
      "type": "Einreichung neuer Dokumente",
      "state": "Berlin",
      "amtsgericht": "Amtsgericht Berlin (Charlottenburg)",
      "registernummer": "HRB 246719",
      "registerart": "HRB",
      "company_name": "Siemens Energy Electrolyzer Manufacturing GmbH",
      "company_seat": "Berlin",
      "details": "13.10.2025 (Bekanntmachungsdatum)\n\nBerlin Amtsgericht Berlin (Charlottenburg) HRB 246719\nEinreichung neuer Dokumente\n\nSiemens Energy Electrolyzer Manufacturing GmbH\nGesellschaft mit beschränkter Haftung\nBerlin\n\nAls nicht eingetragen wird veröffentlicht: Es wurde eine neue Liste der Beiratsmitglieder eingereicht (§52 GmbHG)."
    },
    {
      "date": "2025-10-13",
      "id": "133655",
      "original_text": "Löschungsankündigung\nBerlin Amtsgericht Berlin (Charlottenburg) HRB 117686\nHADICO GmbH – Berlin",
      "type": "Löschungsankündigung",
      "state": "Berlin",
      "amtsgericht": "Amtsgericht Berlin (Charlottenburg)",
      "registernummer": "HRB 117686",
      "registerart": "HRB",
      "company_name": "HADICO GmbH",
      "company_seat": "Berlin",
      "details": "13.10.2025 (Bekanntmachungsdatum)\n\nBerlin Amtsgericht Berlin (Charlottenburg) HRB 117686\nLöschungsankündigung\n\nHADICO GmbH\nGesellschaft mit beschränkter Haftung\nBerlin\n\nBei der nachstehenden Gesellschaft wird das Amtslöschungsverfahren gemäß § 394 FamFG eingeleitet. Widerspruchsfrist 6 Wochen"
    },
    {
      "date": "2025-10-13",
      "id": "133656",
      "original_text": "Registerbekanntmachung nach dem Umwandlungsgesetz\nSchleswig-Holstein Amtsgericht Kiel HRB 4005 NM\nBautec GmbH Baumarktartikel – Hitzhusen",
      "type": "Registerbekanntmachung nach dem Umwandlungsgesetz",
      "state": "Schleswig-Holstein",
      "amtsgericht": "Amtsgericht Kiel",
      "registernummer": "HRB 4005 NM",
      "registerart": "HRB",
      "company_name": "Bautec GmbH Baumarktartikel",
      "company_seat": "Hitzhusen",
      "details": "13.10.2025 (Bekanntmachungsdatum)\n\nSchleswig-Holstein Amtsgericht Kiel HRB 4005 NM\nRegisterbekanntmachung nach dem Umwandlungsgesetz 09.10.2025 (Eintragungsdatum)\n\nBautec GmbH Baumarktartikel\nGesellschaft mit beschränkter Haftung\nHitzhusen\n\nZu Eintragungsnummer 9 vom 09.10.2025 wird als nicht eingetragen veröffentlicht: Als nicht eingetragen wird veröffentlicht: Den Gläubigern der an der Verschmelzung beteiligten Rechtsträger ist, wenn sie binnen sechs Monaten nach dem Tag, an dem die Eintragung der Verschmelzung in das Register des Sitzes desjenigen Rechtsträgers, dessen Gläubiger sie sind, nach § 19 Abs. 3 UmwG bekannt gemacht worden ist, ihren Anspruch nach Grund und Höhe schriftlich anmelden, Sicherheit zu leisten, soweit sie nicht Befriedigung verlangen können. Dieses Recht steht den Gläubigern jedoch nur zu, wenn sie glaubhaft machen, dass durch die Verschmelzung die Erfüllung ihrer Forderung gefährdet wird."
    },
    {
      "date": "2025-10-13",
      "id": "133657",
      "original_text": "Einreichung neuer Dokumente\nBerlin Amtsgericht Berlin (Charlottenburg) HRB 4391\nEduard Winter Verwaltungsgesellschaft mbH – Berlin",
      "type": "Einreichung neuer Dokumente",
      "state": "Berlin",
      "amtsgericht": "Amtsgericht Berlin (Charlottenburg)",
      "registernummer": "HRB 4391",
      "registerart": "HRB",
      "company_name": "Eduard Winter Verwaltungsgesellschaft mbH",
      "company_seat": "Berlin",
      "details": "13.10.2025 (Bekanntmachungsdatum)\n\nBerlin Amtsgericht Berlin (Charlottenburg) HRB 4391\nEinreichung neuer Dokumente\n\nEduard Winter Verwaltungsgesellschaft mbH\nGesellschaft mit beschränkter Haftung\nBerlin\n\nAls nicht eingetragen wird veröffentlicht:Es wurde eine neue Beiratsliste eingereicht (§ 106 AktG)."
    },
    {
      "date": "2025-10-13",
      "id": "133658",
      "original_text": "Einreichung neuer Dokumente\nBerlin Amtsgericht Berlin (Charlottenburg) HRB 74180\nEduard Winter Immobilien Verwaltungs-GmbH – Berlin",
      "type": "Einreichung neuer Dokumente",
      "state": "Berlin",
      "amtsgericht": "Amtsgericht Berlin (Charlottenburg)",
      "registernummer": "HRB 74180",
      "registerart": "HRB",
      "company_name": "Eduard Winter Immobilien Verwaltungs-GmbH",
      "company_seat": "Berlin",
      "details": "13.10.2025 (Bekanntmachungsdatum)\n\nBerlin Amtsgericht Berlin (Charlottenburg) HRB 74180\nEinreichung neuer Dokumente\n\nEduard Winter Immobilien Verwaltungs-GmbH\nGesellschaft mit beschränkter Haftung\nBerlin\n\nAls nicht eingetragen wird veröffentlicht:Es wurde eine neue Liste der Beiratsmitglieder eingereicht (§ 106 AktG)."
    },
    {
      "date": "2025-10-13",
      "id": "133659",
      "original_text": "Löschungsankündigung\nBerlin Amtsgericht Berlin (Charlottenburg) HRB 155469\nVEIM Real Estate Management GmbH – Berlin",
      "type": "Löschungsankündigung",
      "state": "Berlin",
      "amtsgericht": "Amtsgericht Berlin (Charlottenburg)",
      "registernummer": "HRB 155469",
      "registerart": "HRB",
      "company_name": "VEIM Real Estate Management GmbH",
      "company_seat": "Berlin",
      "details": "13.10.2025 (Bekanntmachungsdatum)\n\nBerlin Amtsgericht Berlin (Charlottenburg) HRB 155469\nLöschungsankündigung\n\nVEIM Real Estate Management GmbH\nGesellschaft mit beschränkter Haftung\nBerlin\n\nBei der nachstehenden Gesellschaft wird das Amtslöschungsverfahren gemäß § 394 FamFG eingeleitet. Widerspruchsfrist 6 Wochen"
    },
    {
      "date": "2025-10-13",
      "id": "133660",
      "original_text": "Registerbekanntmachung nach dem Umwandlungsgesetz\nNordrhein-Westfalen Amtsgericht Coesfeld HRA 8270\nHWA Vorsorgemanagement GmbH & Co. KG – Olfen",
      "type": "Registerbekanntmachung nach dem Umwandlungsgesetz",
      "state": "Nordrhein-Westfalen",
      "amtsgericht": "Amtsgericht Coesfeld",
      "registernummer": "HRA 8270",
      "registerart": "HRA",
      "company_name": "HWA Vorsorgemanagement GmbH & Co. KG",
      "company_seat": "Olfen",
      "details": "13.10.2025 (Bekanntmachungsdatum)\n\nNordrhein-Westfalen Amtsgericht Coesfeld HRA 8270\nRegisterbekanntmachung nach dem Umwandlungsgesetz 07.10.2025 (Eintragungsdatum)\n\nHWA Vorsorgemanagement GmbH & Co. KG\nKommanditgesellschaft\nOlfen\n\nDen Gläubigern der an der Verschmelzung beteiligten Rechtsträger ist, wenn sie binnen sechs Monaten nach dem Tag, an dem die Eintragung der Verschmelzung in das Register des Sitzes derjenigen Rechtsträger deren Gläubiger sie sind, nach § 19 Absatz 3 UmwG als bekanntgemacht gilt, ihren Anspruch nach Grund und Höhe schriftlich anmelden, Sicherheit zu leisten, soweit sie nicht Befriedigung verlangen können. Dieses Recht steht den Gläubigern jedoch nur zu, wenn sie glaubhaft machen, dass durch die Verschmelzung die Erfüllung ihrer Forderung gefährdet wird."
    },
    {
      "date": "2025-10-13",
      "id": "133661",
      "original_text": "Registerbekanntmachung nach dem Umwandlungsgesetz\nBaden-Württemberg Amtsgericht Mannheim HRB 220212\nAdvanced Industries Packaging Germany GmbH – Achern",
      "type": "Registerbekanntmachung nach dem Umwandlungsgesetz",
      "state": "Baden-Württemberg",
      "amtsgericht": "Amtsgericht Mannheim",
      "registernummer": "HRB 220212",
      "registerart": "HRB",
      "company_name": "Advanced Industries Packaging Germany GmbH",
      "company_seat": "Achern",
      "details": "13.10.2025 (Bekanntmachungsdatum)\n\nBaden-Württemberg Amtsgericht Mannheim HRB 220212\nRegisterbekanntmachung nach dem Umwandlungsgesetz 13.10.2025 (Eintragungsdatum)\n\nAdvanced Industries Packaging Germany GmbH\nGesellschaft mit beschränkter Haftung\nAchern\n\nDen Gläubigern der an der Verschmelzung beteiligten Rechtsträger ist, wenn sie binnen sechs Monaten nach dem Tag, an dem die Eintragung der Verschmelzung in das Register des Sitzes desjenigen Rechtsträgers, dessen Gläubiger sie sind, nach § 19 Abs. 3 UmwG als bekanntgemacht gilt, ihren Anspruch nach Grund und Höhe schriftlich anmelden, Sicherheit zu leisten, soweit sie nicht Befriedigung verlangen können. Dieses Recht steht den Gläubigern jedoch nur zu, wenn sie glaubhaft machen, dass durch die Verschmelzung die Erfüllung ihrer Forderung gefährdet wird."
    },
    {
      "date": "2025-10-13",
      "id": "133662",
      "original_text": "Registerbekanntmachung nach dem Umwandlungsgesetz\nBaden-Württemberg Amtsgericht Mannheim HRB 220054\nAdvanced Industries Packaging GmbH – Achern",
      "type": "Registerbekanntmachung nach dem Umwandlungsgesetz",
      "state": "Baden-Württemberg",
      "amtsgericht": "Amtsgericht Mannheim",
      "registernummer": "HRB 220054",
      "registerart": "HRB",
      "company_name": "Advanced Industries Packaging GmbH",
      "company_seat": "Achern",
      "details": "13.10.2025 (Bekanntmachungsdatum)\n\nBaden-Württemberg Amtsgericht Mannheim HRB 220054\nRegisterbekanntmachung nach dem Umwandlungsgesetz 13.10.2025 (Eintragungsdatum)\n\nAdvanced Industries Packaging GmbH\nGesellschaft mit beschränkter Haftung\nAchern\n\nDen Gläubigern der an der Verschmelzung beteiligten Rechtsträger ist, wenn sie binnen sechs Monaten nach dem Tag, an dem die Eintragung der Verschmelzung in das Register des Sitzes desjenigen Rechtsträgers, dessen Gläubiger sie sind, nach § 19 Abs. 3 UmwG als bekanntgemacht gilt, ihren Anspruch nach Grund und Höhe schriftlich anmelden, Sicherheit zu leisten, soweit sie nicht Befriedigung verlangen können. Dieses Recht steht den Gläubigern jedoch nur zu, wenn sie glaubhaft machen, dass durch die Verschmelzung die Erfüllung ihrer Forderung gefährdet wird."
    },
    {
      "date": "2025-10-13",
      "id": "133663",
      "original_text": "Löschungsankündigung\nBerlin Amtsgericht Berlin (Charlottenburg) HRB 165477\nGenerous Group International GmbH – Berlin",
      "type": "Löschungsankündigung",
      "state": "Berlin",
      "amtsgericht": "Amtsgericht Berlin (Charlottenburg)",
      "registernummer": "HRB 165477",
      "registerart": "HRB",
      "company_name": "Generous Group International GmbH",
      "company_seat": "Berlin",
      "details": "13.10.2025 (Bekanntmachungsdatum)\n\nBerlin Amtsgericht Berlin (Charlottenburg) HRB 165477\nLöschungsankündigung\n\nGenerous Group International GmbH\nGesellschaft mit beschränkter Haftung\nBerlin\n\nBei der nachstehenden Gesellschaft wird das Amtslöschungsverfahren gemäß § 394 FamFG eingeleitet. Widerspruchsfrist 6 Wochen"
    },
    {
      "date": "2025-10-13",
      "id": "133664",
      "original_text": "Löschungsankündigung\nBaden-Württemberg Amtsgericht Freiburg HRB 412209\nMinicar + Citycar, Funk-Mietwagen-Funktaxen, Vermittlung + Beförderungs GmbH – Lörrach",
      "type": "Löschungsankündigung",
      "state": "Baden-Württemberg",
      "amtsgericht": "Amtsgericht Freiburg",
      "registernummer": "HRB 412209",
      "registerart": "HRB",
      "company_name": "Minicar + Citycar, Funk-Mietwagen-Funktaxen, Vermittlung + Beförderungs GmbH",
      "company_seat": "Lörrach",
      "details": "13.10.2025 (Bekanntmachungsdatum)\n\nBaden-Württemberg Amtsgericht Freiburg HRB 412209\nLöschungsankündigung 13.10.2025 (Eintragungsdatum)\n\nMinicar + Citycar, Funk-Mietwagen-Funktaxen, Vermittlung + Beförderungs GmbH\nGesellschaft mit beschränkter Haftung\nLörrach\n\nAls nicht eingetragen wird bekanntgemacht:\nDas Gericht beabsichtigt, die Gesellschaft wegen Vermögenslosigkeit im Handelsregister von Amts wegen nach § 394 FamFG zu löschen. Die Frist zur Geltendmachung eines Widerspruchs gegen die beabsichtigte Löschung ist auf einen Monat ab Veröffentlichung bestimmt."
    },
    {
      "date": "2025-10-13",
      "id": "133665",
      "original_text": "Registerbekanntmachung nach dem Umwandlungsgesetz\nSachsen-Anhalt Amtsgericht Stendal HRB 36560\nCarmates GmbH – Halle (Saale)",
      "type": "Registerbekanntmachung nach dem Umwandlungsgesetz",
      "state": "Sachsen-Anhalt",
      "amtsgericht": "Amtsgericht Stendal",
      "registernummer": "HRB 36560",
      "registerart": "HRB",
      "company_name": "Carmates GmbH",
      "company_seat": "Halle (Saale)",
      "details": "13.10.2025 (Bekanntmachungsdatum)\n\nSachsen-Anhalt Amtsgericht Stendal HRB 36560\nRegisterbekanntmachung nach dem Umwandlungsgesetz 13.10.2025 (Eintragungsdatum)\n\nCarmates GmbH\nGesellschaft mit beschränkter Haftung\nHalle (Saale)\n\nNicht eingetragen:\nDen Gläubigern des formwechselnden  Rechtsträgers, ist wenn sie binnen sechs Monaten nach dem Tag, an dem die Eintragung des Formwechsels nach § 201 UmwG als bekanntgemacht gilt, ihren Anspruch nach Grund und Höhe schriftlich anmelden, Sicherheit zu leisten, soweit sie nicht Befriedigung verlangen können. Dieses Recht steht ihnen jedoch nur zu, wenn sie glaubhaft machen, dass durch den Formwechsel die Erfüllung ihrer Forderung gefährdet wird."
    },
    {
      "date": "2025-10-13",
      "id": "133666",
      "original_text": "Registerbekanntmachung nach dem Umwandlungsgesetz\nSachsen-Anhalt Amtsgericht Stendal GsR 1027\nCarmates eGbR Gebrauchtwagenhandel, Teile & Zubehör – Halle (Saale)",
      "type": "Registerbekanntmachung nach dem Umwandlungsgesetz",
      "state": "Sachsen-Anhalt",
      "amtsgericht": "Amtsgericht Stendal",
      "registernummer": "GsR 1027",
      "registerart": "GsR",
      "company_name": "Carmates eGbR Gebrauchtwagenhandel, Teile & Zubehör",
      "company_seat": "Halle (Saale)",
      "details": "13.10.2025 (Bekanntmachungsdatum)\n\nSachsen-Anhalt Amtsgericht Stendal GsR 1027\nRegisterbekanntmachung nach dem Umwandlungsgesetz 13.10.2025 (Eintragungsdatum)\n\nCarmates eGbR Gebrauchtwagenhandel, Teile & Zubehör\nGesellschaft bürgerlichen Rechts\nHalle (Saale)\n\nNicht eingetragen:\nDen Gläubigern des formwechselnden  Rechtsträgers, ist wenn sie binnen sechs Monaten nach dem Tag, an dem die Eintragung des Formwechsels nach § 201 UmwG als bekanntgemacht gilt, ihren Anspruch nach Grund und Höhe schriftlich anmelden, Sicherheit zu leisten, soweit sie nicht Befriedigung verlangen können. Dieses Recht steht ihnen jedoch nur zu, wenn sie glaubhaft machen, dass durch den Formwechsel die Erfüllung ihrer Forderung gefährdet wird."
    },
    {
      "date": "2025-10-13",
      "id": "133667",
      "original_text": "Löschungsankündigung\nBerlin Amtsgericht Berlin (Charlottenburg) HRB 135576\n\"Forest Camp\" Hotel GmbH – Berlin",
      "type": "Löschungsankündigung",
      "state": "Berlin",
      "amtsgericht": "Amtsgericht Berlin (Charlottenburg)",
      "registernummer": "HRB 135576",
      "registerart": "HRB",
      "company_name": "\"Forest Camp\" Hotel GmbH",
      "company_seat": "Berlin",
      "details": "13.10.2025 (Bekanntmachungsdatum)\n\nBerlin Amtsgericht Berlin (Charlottenburg) HRB 135576\nLöschungsankündigung\n\n\"Forest Camp\" Hotel GmbH\nGesellschaft mit beschränkter Haftung\nBerlin\n\nBei der nachstehenden Gesellschaft wird das Amtslöschungsverfahren gemäß § 394 FamFG eingeleitet. Widerspruchsfrist 6 Wochen"
    },
    {
      "date": "2025-10-13",
      "id": "133668",
      "original_text": "Löschungsankündigung\nBaden-Württemberg Amtsgericht Stuttgart HRB 774329\nConex Network UG (haftungsbeschränkt) – Tuttlingen",
      "type": "Löschungsankündigung",
      "state": "Baden-Württemberg",
      "amtsgericht": "Amtsgericht Stuttgart",
      "registernummer": "HRB 774329",
      "registerart": "HRB",
      "company_name": "Conex Network UG (haftungsbeschränkt)",
      "company_seat": "Tuttlingen",
      "details": "13.10.2025 (Bekanntmachungsdatum)\n\nBaden-Württemberg Amtsgericht Stuttgart HRB 774329\nLöschungsankündigung\n\nConex Network UG (haftungsbeschränkt)\nGesellschaft mit beschränkter Haftung\nTuttlingen\n\nDas Gericht beabsichtigt, die Gesellschaft wegen Vermögenslosigkeit im Handelsregister von Amts wegen nach § 394 FamFG zu löschen. Die Frist zur Geltendmachung eines Widerspruchs gegen die beabsichtigte Löschung ist auf zwei Monate ab Veröffentlichung bestimmt."
    },
    {
      "date": "2025-10-13",
      "id": "133669",
      "original_text": "Registerbekanntmachung nach dem Umwandlungsgesetz\nBaden-Württemberg Amtsgericht Stuttgart HRB 783830\ndataglobal Group GmbH – Heilbronn",
      "type": "Registerbekanntmachung nach dem Umwandlungsgesetz",
      "state": "Baden-Württemberg",
      "amtsgericht": "Amtsgericht Stuttgart",
      "registernummer": "HRB 783830",
      "registerart": "HRB",
      "company_name": "dataglobal Group GmbH",
      "company_seat": "Heilbronn",
      "details": "13.10.2025 (Bekanntmachungsdatum)\n\nBaden-Württemberg Amtsgericht Stuttgart HRB 783830\nRegisterbekanntmachung nach dem Umwandlungsgesetz 13.10.2025 (Eintragungsdatum)\n\ndataglobal Group GmbH\nGesellschaft mit beschränkter Haftung\nHeilbronn\n\nDen Gläubigern der an der Verschmelzung beteiligten Rechtsträger ist, wenn sie binnen sechs Monaten nach dem Tag, an dem die Eintragung der Verschmelzung in das Register des Sitzes desjenigen Rechtsträgers, dessen Gläubiger sie sind, nach § 19 Abs. 3 UmwG als bekanntgemacht gilt, ihren Anspruch nach Grund und Höhe schriftlich anmelden, Sicherheit zu leisten, soweit sie nicht Befriedigung verlangen können. Dieses Recht steht den Gläubigern jedoch nur zu, wenn sie glaubhaft machen, dass durch die Verschmelzung die Erfüllung ihrer Forderung gefährdet wird."
    },
    {
      "date": "2025-10-13",
      "id": "133670",
      "original_text": "Registerbekanntmachung nach dem Umwandlungsgesetz\nSachsen-Anhalt Amtsgericht Stendal HRB 20273\nMplus Halle GmbH – Halle (Saale)",
      "type": "Registerbekanntmachung nach dem Umwandlungsgesetz",
      "state": "Sachsen-Anhalt",
      "amtsgericht": "Amtsgericht Stendal",
      "registernummer": "HRB 20273",
      "registerart": "HRB",
      "company_name": "Mplus Halle GmbH",
      "company_seat": "Halle (Saale)",
      "details": "13.10.2025 (Bekanntmachungsdatum)\n\nSachsen-Anhalt Amtsgericht Stendal HRB 20273\nRegisterbekanntmachung nach dem Umwandlungsgesetz 10.10.2025 (Eintragungsdatum)\n\nMplus Halle GmbH\nGesellschaft mit beschränkter Haftung\nHalle (Saale)\n\nDie Gesellschaft ist auf Grund des Verschmelzungsvertrages vom 26.08.2025 sowie der Beschlüsse der Gesellschafterversammlungen vom selben Tag mit der Mplus Bremen GmbH mit dem Sitz in Bremen (Amtsgericht Bremen HRB 30272) verschmolzen. Die Verschmelzung wurde am 10.10.2025 in das Handelsregister der übernehmenden Gesellschaft eingetragen. Nicht eingetragen:Den Gläubigern der an der Verschmelzung beteiligten Rechtsträger ist, wenn sie binnen sechs Monaten nach dem Tag, an dem die Eintragung der Verschmelzung nach § 19 Abs. 3 UmwG als bekanntgemacht gilt, ihren Anspruch nach Grund und Höhe schriftlich anmelden, Sicherheit zu leisten, soweit sie nicht Befriedigung verlangen können. Dieses Recht steht ihnen jedoch nur zu, wenn sie glaubhaft machen, dass durch die Verschmelzung die Erfüllung ihrer Forderung gefährdet wird."
    },
    {
      "date": "2025-10-13",
      "id": "133671",
      "original_text": "Registerbekanntmachung nach dem Umwandlungsgesetz\nSchleswig-Holstein Amtsgericht Pinneberg HRB 19202\nPixel Unit GmbH – Ellerbek",
      "type": "Registerbekanntmachung nach dem Umwandlungsgesetz",
      "state": "Schleswig-Holstein",
      "amtsgericht": "Amtsgericht Pinneberg",
      "registernummer": "HRB 19202",
      "registerart": "HRB",
      "company_name": "Pixel Unit GmbH",
      "company_seat": "Ellerbek",
      "details": "13.10.2025 (Bekanntmachungsdatum)\n\nSchleswig-Holstein Amtsgericht Pinneberg HRB 19202\nRegisterbekanntmachung nach dem Umwandlungsgesetz 09.10.2025 (Eintragungsdatum)\n\nPixel Unit GmbH\nGesellschaft mit beschränkter Haftung\nEllerbek\n\nZu Eintragungsnummer 2 vom 09.10.2025 wird als nicht eingetragen veröffentlicht: Den Gläubigern der an der Spaltung beteiligten Rechtsträger ist, wenn sie binnen sechs Monaten nach dem Tag, an dem die Eintragung der Spaltung in das Register des Sitzes desjenigen Rechtsträgers, dessen Gläubiger sie sind, als bekannt gemacht gilt, ihren Anspruch nach Grund und Höhe schriftlich anmelden, Sicherheit zu leisten, soweit sie nicht Befriedigung verlangen können. Dieses Recht steht den Gläubigern jedoch nur zu, wenn sie glaubhaft machen, dass durch die Spaltung die Erfüllung ihrer Forderung gefährdet wird. Das Recht, Sicherheitsleistung zu verlangen, steht Gläubigern nicht zu, die im Falle der Insolvenz ein Recht auf vorzugsweise Befriedigung aus einer Deckungsmasse haben, die nach gesetzlicher Vorschrift zu ihrem Schutz errichtet und staatlich überwacht ist."
    },
    {
      "date": "2025-10-13",
      "id": "133672",
      "original_text": "Registerbekanntmachung nach dem Umwandlungsgesetz\nBaden-Württemberg Amtsgericht Stuttgart HRB 205529\nSchollbach GmbH – Schwieberdingen",
      "type": "Registerbekanntmachung nach dem Umwandlungsgesetz",
      "state": "Baden-Württemberg",
      "amtsgericht": "Amtsgericht Stuttgart",
      "registernummer": "HRB 205529",
      "registerart": "HRB",
      "company_name": "Schollbach GmbH",
      "company_seat": "Schwieberdingen",
      "details": "13.10.2025 (Bekanntmachungsdatum)\n\nBaden-Württemberg Amtsgericht Stuttgart HRB 205529\nRegisterbekanntmachung nach dem Umwandlungsgesetz 13.10.2025 (Eintragungsdatum)\n\nSchollbach GmbH\nGesellschaft mit beschränkter Haftung\nSchwieberdingen\n\nDen Gläubigern der an der Verschmelzung beteiligten Rechtsträger ist, wenn sie binnen sechs Monaten nach dem Tag, an dem die Eintragung der Verschmelzung in das Register des Sitzes desjenigen Rechtsträgers, dessen Gläubiger sie sind, nach § 19 Abs. 3 UmwG als bekanntgemacht gilt, ihren Anspruch nach Grund und Höhe schriftlich anmelden, Sicherheit zu leisten, soweit sie nicht Befriedigung verlangen können. Dieses Recht steht den Gläubigern jedoch nur zu, wenn sie glaubhaft machen, dass durch die Verschmelzung die Erfüllung ihrer Forderung gefährdet wird."
    },
    {
      "date": "2025-10-13",
      "id": "133673",
      "original_text": "Registerbekanntmachung nach dem Umwandlungsgesetz\nSchleswig-Holstein Amtsgericht Pinneberg HRA 10020\nBenjamin Behre Colorist e.K. – Ellerbek",
      "type": "Registerbekanntmachung nach dem Umwandlungsgesetz",
      "state": "Schleswig-Holstein",
      "amtsgericht": "Amtsgericht Pinneberg",
      "registernummer": "HRA 10020",
      "registerart": "HRA",
      "company_name": "Benjamin Behre Colorist e.K.",
      "company_seat": "Ellerbek",
      "details": "13.10.2025 (Bekanntmachungsdatum)\n\nSchleswig-Holstein Amtsgericht Pinneberg HRA 10020\nRegisterbekanntmachung nach dem Umwandlungsgesetz 09.10.2025 (Eintragungsdatum)\n\nBenjamin Behre Colorist e.K.\nEinzelkaufmann / Einzelkauffrau\nEllerbek\n\nZu Eintragungsnummer 2 vom 09.10.2025 wird als nicht eingetragen veröffentlicht: Den Gläubigern der an der Spaltung beteiligten Rechtsträger ist, wenn sie binnen sechs Monaten nach dem Tag, an dem die Eintragung der Spaltung in das Register des Sitzes desjenigen Rechtsträgers, dessen Gläubiger sie sind, als bekannt gemacht gilt, ihren Anspruch nach Grund und Höhe schriftlich anmelden, Sicherheit zu leisten, soweit sie nicht Befriedigung verlangen können. Dieses Recht steht den Gläubigern jedoch nur zu, wenn sie glaubhaft machen, dass durch die Spaltung die Erfüllung ihrer Forderung gefährdet wird. Das Recht, Sicherheitsleistung zu verlangen, steht Gläubigern nicht zu, die im Falle der Insolvenz ein Recht auf vorzugsweise Befriedigung aus einer Deckungsmasse haben, die nach gesetzlicher Vorschrift zu ihrem Schutz errichtet und staatlich überwacht ist."
    },
    {
      "date": "2025-10-13",
      "id": "133674",
      "original_text": "Registerbekanntmachung nach dem Umwandlungsgesetz\nHamburg Amtsgericht Hamburg HRB 159976\nHSP7 Elbe GmbH – Hamburg",
      "type": "Registerbekanntmachung nach dem Umwandlungsgesetz",
      "state": "Hamburg",
      "amtsgericht": "Amtsgericht Hamburg",
      "registernummer": "HRB 159976",
      "registerart": "HRB",
      "company_name": "HSP7 Elbe GmbH",
      "company_seat": "Hamburg",
      "details": "13.10.2025 (Bekanntmachungsdatum)\n\nHamburg Amtsgericht Hamburg HRB 159976\nRegisterbekanntmachung nach dem Umwandlungsgesetz 13.10.2025 (Eintragungsdatum)\n\nHSP7 Elbe GmbH\nGesellschaft mit beschränkter Haftung\nHamburg\n\nAls nicht eingetragen wird bekannt gemacht:\nDen Gläubigern der an der Verschmelzung beteiligten Gesellschaften ist, wenn sie binnen sechs Monaten nach dem Tag, an dem die Eintragung der Verschmelzung in das Register des Sitzes desjenigen Rechtsträgers, dessen Gläubiger sie sind, nach § 19 Absatz 3 UmwG als bekannt gemacht gilt, ihren Anspruch nach Grund und Höhe schriftlich anmelden, Sicherheit zu leisten, soweit sie nicht Befriedigung verlangen können. Dieses Recht steht den Gläubigern jedoch nur zu, wenn sie glaubhaft machen, dass durch die Verschmelzung die Erfüllung ihrer Forderung gefährdet wird."
    },
    {
      "date": "2025-10-13",
      "id": "133675",
      "original_text": "Registerbekanntmachung nach dem Umwandlungsgesetz\nHamburg Amtsgericht Hamburg HRB 136171\nHSP7 Asset Management GmbH – Hamburg",
      "type": "Registerbekanntmachung nach dem Umwandlungsgesetz",
      "state": "Hamburg",
      "amtsgericht": "Amtsgericht Hamburg",
      "registernummer": "HRB 136171",
      "registerart": "HRB",
      "company_name": "HSP7 Asset Management GmbH",
      "company_seat": "Hamburg",
      "details": "13.10.2025 (Bekanntmachungsdatum)\n\nHamburg Amtsgericht Hamburg HRB 136171\nRegisterbekanntmachung nach dem Umwandlungsgesetz 13.10.2025 (Eintragungsdatum)\n\nHSP7 Asset Management GmbH\nGesellschaft mit beschränkter Haftung\nHamburg\n\nAls nicht eingetragen wird bekannt gemacht:\nDen Gläubigern der an der Verschmelzung beteiligten Gesellschaften ist, wenn sie binnen sechs Monaten nach dem Tag, an dem die Eintragung der Verschmelzung in das Register des Sitzes desjenigen Rechtsträgers, dessen Gläubiger sie sind, nach § 19 Absatz 3 UmwG als bekannt gemacht gilt, ihren Anspruch nach Grund und Höhe schriftlich anmelden, Sicherheit zu leisten, soweit sie nicht Befriedigung verlangen können. Dieses Recht steht den Gläubigern jedoch nur zu, wenn sie glaubhaft machen, dass durch die Verschmelzung die Erfüllung ihrer Forderung gefährdet wird."
    },
    {
      "date": "2025-10-13",
      "id": "133676",
      "original_text": "Registerbekanntmachung nach dem Umwandlungsgesetz\nBaden-Württemberg Amtsgericht Stuttgart GnR 720030\nBürgerEnergiegenossenschaft Raum Neuenstadt eG – Neuenstadt am Kocher",
      "type": "Registerbekanntmachung nach dem Umwandlungsgesetz",
      "state": "Baden-Württemberg",
      "amtsgericht": "Amtsgericht Stuttgart",
      "registernummer": "GnR 720030",
      "registerart": "GnR",
      "company_name": "BürgerEnergiegenossenschaft Raum Neuenstadt eG",
      "company_seat": "Neuenstadt am Kocher",
      "details": "13.10.2025 (Bekanntmachungsdatum)\n\nBaden-Württemberg Amtsgericht Stuttgart GnR 720030\nRegisterbekanntmachung nach dem Umwandlungsgesetz 13.10.2025 (Eintragungsdatum)\n\nBürgerEnergiegenossenschaft Raum Neuenstadt eG\neingetragene Genossenschaft\nNeuenstadt am Kocher\n\nDen Gläubigern der an der Verschmelzung beteiligten Rechtsträger ist, wenn sie binnen sechs Monaten nach dem Tag, an dem die Eintragung der Verschmelzung in das Register des Sitzes desjenigen Rechtsträgers, dessen Gläubiger sie sind, nach § 19 Abs. 3 UmwG als bekanntgemacht gilt, ihren Anspruch nach Grund und Höhe schriftlich anmelden, Sicherheit zu leisten, soweit sie nicht Befriedigung verlangen können. Dieses Recht steht den Gläubigern jedoch nur zu, wenn sie glaubhaft machen, dass durch die Verschmelzung die Erfüllung ihrer Forderung gefährdet wird."
    },
    {
      "date": "2025-10-13",
      "id": "133677",
      "original_text": "Sonstige Registerbekanntmachung\nBerlin Amtsgericht Berlin (Charlottenburg) HRB 118165\nGeschäftshaus Franklinstraße 25 Verwaltungsgesellschaft mbH – Berlin",
      "type": "Sonstige Registerbekanntmachung",
      "state": "Berlin",
      "amtsgericht": "Amtsgericht Berlin (Charlottenburg)",
      "registernummer": "HRB 118165",
      "registerart": "HRB",
      "company_name": "Geschäftshaus Franklinstraße 25 Verwaltungsgesellschaft mbH",
      "company_seat": "Berlin",
      "details": "13.10.2025 (Bekanntmachungsdatum)\n\nBerlin Amtsgericht Berlin (Charlottenburg) HRB 118165\nSonstige Registerbekanntmachung\n\nGeschäftshaus Franklinstraße 25 Verwaltungsgesellschaft mbH\nGesellschaft mit beschränkter Haftung\nBerlin\n\nAls nicht eingetragen wird veröffentlicht: Es wurde eine neue Liste des Beirats eingereicht (§52 GmbHG)."
    },
    {
      "date": "2025-10-13",
      "id": "133678",
      "original_text": "Sonstige Registerbekanntmachung\nHamburg Amtsgericht Hamburg HRB 28198\nHamburgische Staatsoper Gesellschaft mit beschränkter Haftung – Hamburg",
      "type": "Sonstige Registerbekanntmachung",
      "state": "Hamburg",
      "amtsgericht": "Amtsgericht Hamburg",
      "registernummer": "HRB 28198",
      "registerart": "HRB",
      "company_name": "Hamburgische Staatsoper Gesellschaft mit beschränkter Haftung",
      "company_seat": "Hamburg",
      "details": "13.10.2025 (Bekanntmachungsdatum)\n\nHamburg Amtsgericht Hamburg HRB 28198\nSonstige Registerbekanntmachung 13.10.2025 (Eintragungsdatum)\n\nHamburgische Staatsoper Gesellschaft mit beschränkter Haftung\nGesellschaft mit beschränkter Haftung\nHamburg\n\nAls nicht eingetragen wird bekannt gemacht: Listen des Aufsichtsrats wurden eingereicht."
    },
    {
      "date": "2025-10-13",
      "id": "133679",
      "original_text": "Löschungsankündigung\nBerlin Amtsgericht Berlin (Charlottenburg) HRB 156587\nFOCUS Risk Solutions UG (haftungsbeschränkt) – Berlin",
      "type": "Löschungsankündigung",
      "state": "Berlin",
      "amtsgericht": "Amtsgericht Berlin (Charlottenburg)",
      "registernummer": "HRB 156587",
      "registerart": "HRB",
      "company_name": "FOCUS Risk Solutions UG (haftungsbeschränkt)",
      "company_seat": "Berlin",
      "details": "13.10.2025 (Bekanntmachungsdatum)\n\nBerlin Amtsgericht Berlin (Charlottenburg) HRB 156587\nLöschungsankündigung\n\nFOCUS Risk Solutions UG (haftungsbeschränkt)\nGesellschaft mit beschränkter Haftung\nBerlin\n\nBei der nachstehenden Gesellschaft wird das Amtslöschungsverfahren gemäß § 394 FamFG eingeleitet. Widerspruchsfrist 6 Wochen"
    },
    {
      "date": "2025-10-13",
      "id": "133680",
      "original_text": "Registerbekanntmachung nach dem Umwandlungsgesetz\nBrandenburg Amtsgericht Cottbus HRB 12502\nF.O.X. - Pharma GmbH – Cottbus",
      "type": "Registerbekanntmachung nach dem Umwandlungsgesetz",
      "state": "Brandenburg",
      "amtsgericht": "Amtsgericht Cottbus",
      "registernummer": "HRB 12502",
      "registerart": "HRB",
      "company_name": "F.O.X. - Pharma GmbH",
      "company_seat": "Cottbus",
      "details": "13.10.2025 (Bekanntmachungsdatum)\n\nBrandenburg Amtsgericht Cottbus HRB 12502\nRegisterbekanntmachung nach dem Umwandlungsgesetz 13.10.2025 (Eintragungsdatum)\n\nF.O.X. - Pharma GmbH\nGesellschaft mit beschränkter Haftung\nCottbus\n\nZu Eintragungsnummer 4 vom 13.10.2025 wird als nicht eingetragen veröffentlicht:\nAls nicht eingetragen wird veröffentlicht:\nDen Gläubigern der an der Verschmelzung beteiligten Rechtsträger ist, wenn sie binnen sechs Monaten nach dem Tag, an dem die Eintragung der Verschmelzung in das Register des Sitzes desjenigen Rechtsträgers, dessen Gläubiger sie sind, als bekannt gemacht gilt, ihren Anspruch nach Grund und Höhe schriftlich anmelden, Sicherheit zu leisten, soweit sie nicht Befriedigung verlangen können. Dieses Recht steht den Gläubigern jedoch nur zu, wenn sie glaubhaft machen, dass durch die Verschmelzung die Erfüllung ihrer Forderung gefährdet wird"
    },
    {
      "date": "2025-10-13",
      "id": "133681",
      "original_text": "Registerbekanntmachung nach dem Umwandlungsgesetz\nHamburg Amtsgericht Hamburg HRA 125241\nLove & Brands GmbH & Co. KG – Hamburg",
      "type": "Registerbekanntmachung nach dem Umwandlungsgesetz",
      "state": "Hamburg",
      "amtsgericht": "Amtsgericht Hamburg",
      "registernummer": "HRA 125241",
      "registerart": "HRA",
      "company_name": "Love & Brands GmbH & Co. KG",
      "company_seat": "Hamburg",
      "details": "13.10.2025 (Bekanntmachungsdatum)\n\nHamburg Amtsgericht Hamburg HRA 125241\nRegisterbekanntmachung nach dem Umwandlungsgesetz 13.10.2025 (Eintragungsdatum)\n\nLove & Brands GmbH & Co. KG\nKommanditgesellschaft\nHamburg\n\nAls nicht eingetragen wird bekannt gemacht:\nDen Gläubigern der an der Abspaltung beteiligten Gesellschaften ist, wenn sie binnen sechs Monaten nach dem Tag, an dem die Eintragung der Abspaltung in das Register des Sitzes desjenigen Rechtsträgers, dessen Gläubiger sie sind, nach § 19 Absatz 3 UmwG als bekannt gemacht gilt, ihren Anspruch nach Grund und Höhe schriftlich anmelden, Sicherheit zu leisten, soweit sie nicht Befriedigung verlangen können. Dieses Recht steht den Gläubigern jedoch nur zu, wenn sie glaubhaft machen, dass durch die Abspaltung die Erfüllung ihrer Forderung gefährdet wird."
    },
    {
      "date": "2025-10-13",
      "id": "133682",
      "original_text": "Registerbekanntmachung nach dem Umwandlungsgesetz\nHamburg Amtsgericht Hamburg HRB 179606\nMarisa GmbH – Hamburg",
      "type": "Registerbekanntmachung nach dem Umwandlungsgesetz",
      "state": "Hamburg",
      "amtsgericht": "Amtsgericht Hamburg",
      "registernummer": "HRB 179606",
      "registerart": "HRB",
      "company_name": "Marisa GmbH",
      "company_seat": "Hamburg",
      "details": "13.10.2025 (Bekanntmachungsdatum)\n\nHamburg Amtsgericht Hamburg HRB 179606\nRegisterbekanntmachung nach dem Umwandlungsgesetz 13.10.2025 (Eintragungsdatum)\n\nMarisa GmbH\nGesellschaft mit beschränkter Haftung\nHamburg\n\nAls nicht eingetragen wird bekannt gemacht:\nDen Gläubigern der an der Abspaltung beteiligten Gesellschaften ist, wenn sie binnen sechs Monaten nach dem Tag, an dem die Eintragung der Abspaltung in das Register des Sitzes desjenigen Rechtsträgers, dessen Gläubiger sie sind, nach § 19 Absatz 3 UmwG als bekannt gemacht gilt, ihren Anspruch nach Grund und Höhe schriftlich anmelden, Sicherheit zu leisten, soweit sie nicht Befriedigung verlangen können. Dieses Recht steht den Gläubigern jedoch nur zu, wenn sie glaubhaft machen, dass durch die Abspaltung die Erfüllung ihrer Forderung gefährdet wird."
    },
    {
      "date": "2025-10-13",
      "id": "133683",
      "original_text": "Registerbekanntmachung nach dem Umwandlungsgesetz\nHamburg Amtsgericht Hamburg HRA 132438\nW.A.B. Gastro e. Kfr. – Hamburg",
      "type": "Registerbekanntmachung nach dem Umwandlungsgesetz",
      "state": "Hamburg",
      "amtsgericht": "Amtsgericht Hamburg",
      "registernummer": "HRA 132438",
      "registerart": "HRA",
      "company_name": "W.A.B. Gastro e. Kfr.",
      "company_seat": "Hamburg",
      "details": "13.10.2025 (Bekanntmachungsdatum)\n\nHamburg Amtsgericht Hamburg HRA 132438\nRegisterbekanntmachung nach dem Umwandlungsgesetz 13.10.2025 (Eintragungsdatum)\n\nW.A.B. Gastro e. Kfr.\nEinzelkaufmann\nHamburg\n\nAls nicht eingetragen wird bekannt gemacht:\nDen Gläubigern der an der Ausgliederung beteiligten Gesellschaften ist, wenn sie binnen sechs Monaten nach dem Tag, an dem die Eintragung der Ausgliederung in das Register des Sitzes desjenigen Rechtsträgers, dessen Gläubiger sie sind, nach § 19 Absatz 3 UmwG als bekannt gemacht gilt, ihren Anspruch nach Grund und Höhe schriftlich anmelden, Sicherheit zu leisten, soweit sie nicht Befriedigung verlangen können. Dieses Recht steht den Gläubigern jedoch nur zu, wenn sie glaubhaft machen, dass durch die Ausgliederung die Erfüllung ihrer Forderung gefährdet wird."
    },
    {
      "date": "2025-10-13",
      "id": "133684",
      "original_text": "Registerbekanntmachung nach dem Umwandlungsgesetz\nHamburg Amtsgericht Hamburg HRB 194805\nW.A.B. Gastro GmbH – Hamburg",
      "type": "Registerbekanntmachung nach dem Umwandlungsgesetz",
      "state": "Hamburg",
      "amtsgericht": "Amtsgericht Hamburg",
      "registernummer": "HRB 194805",
      "registerart": "HRB",
      "company_name": "W.A.B. Gastro GmbH",
      "company_seat": "Hamburg",
      "details": "13.10.2025 (Bekanntmachungsdatum)\n\nHamburg Amtsgericht Hamburg HRB 194805\nRegisterbekanntmachung nach dem Umwandlungsgesetz 13.10.2025 (Eintragungsdatum)\n\nW.A.B. Gastro GmbH\nGesellschaft mit beschränkter Haftung\nHamburg\n\nDen Gläubigern der an der Ausgliederung beteiligten Gesellschaften ist, wenn sie binnen sechs Monaten nach dem Tag, an dem die Eintragung der Ausgliederung in das Register des Sitzes desjenigen Rechtsträgers, dessen Gläubiger sie sind, nach § 19 Absatz 3 UmwG als bekannt gemacht gilt, ihren Anspruch nach Grund und Höhe schriftlich anmelden, Sicherheit zu leisten, soweit sie nicht Befriedigung verlangen können. Dieses Recht steht den Gläubigern jedoch nur zu, wenn sie glaubhaft machen, dass durch die Ausgliederung die Erfüllung ihrer Forderung gefährdet wird."
    },
    {
      "date": "2025-10-13",
      "id": "133685",
      "original_text": "Registerbekanntmachung nach dem Umwandlungsgesetz\nSachsen Amtsgericht Dresden HRB 2227\nDRK-Blutspendedienst Nord - Ost gemeinnützige GmbH – Dresden",
      "type": "Registerbekanntmachung nach dem Umwandlungsgesetz",
      "state": "Sachsen",
      "amtsgericht": "Amtsgericht Dresden",
      "registernummer": "HRB 2227",
      "registerart": "HRB",
      "company_name": "DRK-Blutspendedienst Nord - Ost gemeinnützige GmbH",
      "company_seat": "Dresden",
      "details": "13.10.2025 (Bekanntmachungsdatum)\n\nSachsen Amtsgericht Dresden HRB 2227\nRegisterbekanntmachung nach dem Umwandlungsgesetz 13.10.2025 (Eintragungsdatum)\n\nDRK-Blutspendedienst Nord - Ost gemeinnützige GmbH\nGesellschaft mit beschränkter Haftung\nDresden\n\nDen Gläubigern der an der Verschmelzung beteiligten Rechtsträger ist, wenn sie binnen sechs Monaten nach dem Tag, an dem die Eintragung der Verschmelzung in das Register des Sitzes desjenigen Rechtsträgers, dessen Gläubiger sie sind, nach § 19 Abs. 3 UmwG als bekannt gemacht gilt, ihren Anspruch nach Grund und Höhe in Textform anmelden, Sicherheit zu leisten, soweit sie nicht Befriedigung verlangen können. Dieses Recht steht den Gläubigern jedoch nur zu, wenn sie glaubhaft machen, dass durch die Verschmelzung die Erfüllung der Forderung gefährdet wird."
    },
    {
      "date": "2025-10-13",
      "id": "133686",
      "original_text": "Löschungsankündigung\nSachsen Amtsgericht Dresden HRB 28172\nSeetor Betriebs GmbH – Dresden",
      "type": "Löschungsankündigung",
      "state": "Sachsen",
      "amtsgericht": "Amtsgericht Dresden",
      "registernummer": "HRB 28172",
      "registerart": "HRB",
      "company_name": "Seetor Betriebs GmbH",
      "company_seat": "Dresden",
      "details": "13.10.2025 (Bekanntmachungsdatum)\n\nSachsen Amtsgericht Dresden HRB 28172\nLöschungsankündigung\n\nSeetor Betriebs GmbH\nGesellschaft mit beschränkter Haftung\nDresden\n\nDas Registergericht beabsichtigt, die im Handelsregister eingetragene Gesellschaft von Amts wegen nach § 394 FamFG zu löschen. Die Frist zu Erhebung eines Widerspruchs gegen die beabsichtigte Löschung wird auf einen Monat festgesetzt."
    },
    {
      "date": "2025-10-13",
      "id": "133687",
      "original_text": "Sonstige Registerbekanntmachung\nSachsen Amtsgericht Leipzig HRB 16377\nPorsche Leipzig GmbH – Leipzig",
      "type": "Sonstige Registerbekanntmachung",
      "state": "Sachsen",
      "amtsgericht": "Amtsgericht Leipzig",
      "registernummer": "HRB 16377",
      "registerart": "HRB",
      "company_name": "Porsche Leipzig GmbH",
      "company_seat": "Leipzig",
      "details": "13.10.2025 (Bekanntmachungsdatum)\n\nSachsen Amtsgericht Leipzig HRB 16377\nSonstige Registerbekanntmachung\n\nPorsche Leipzig GmbH\nGesellschaft mit beschränkter Haftung\nLeipzig\n\nAm 10.10.2025 wurde beim Handelsregister des Amtsgerichts Leipzig die Liste der Mitglieder des Aufsichtsrats gemäß § 52 GmbHG eingereicht."
    },
    {
      "date": "2025-10-13",
      "id": "133688",
      "original_text": "Registerbekanntmachung nach dem Umwandlungsgesetz\nBaden-Württemberg Amtsgericht Freiburg HRB 733831\nMarkus Stock Versicherungsmakler GmbH – Zell am Harmersbach",
      "type": "Registerbekanntmachung nach dem Umwandlungsgesetz",
      "state": "Baden-Württemberg",
      "amtsgericht": "Amtsgericht Freiburg",
      "registernummer": "HRB 733831",
      "registerart": "HRB",
      "company_name": "Markus Stock Versicherungsmakler GmbH",
      "company_seat": "Zell am Harmersbach",
      "details": "13.10.2025 (Bekanntmachungsdatum)\n\nBaden-Württemberg Amtsgericht Freiburg HRB 733831\nRegisterbekanntmachung nach dem Umwandlungsgesetz 13.10.2025 (Eintragungsdatum)\n\nMarkus Stock Versicherungsmakler GmbH\nGesellschaft mit beschränkter Haftung\nZell am Harmersbach\n\nDas einzelkaufmännische Unternehmen \"Markus Stock e.K.\", Zell am Harmersbach (Amtsgericht Freiburg i. Br. HRA 709198) wurde gemäß Vertrag und Beschluss vom 25.08.2025 mit Korrektur vom 30.09.2025 im Wege der Ausgliederung zur Aufnahme auf diese Gesellschaft übertragen. Den Gläubigern der an der Ausgliederung beteiligten Rechtsträger ist, wenn sie binnen sechs Monaten nach dem Tag, an dem die Eintragung der Ausgliederung in das Register des Sitzes desjenigen Rechtsträgers, dessen Gläubiger sie sind, nach § 19 Abs. 3 UmwG als bekanntgemacht gilt, ihren Anspruch nach Grund und Höhe schriftlich anmelden, Sicherheit zu leisten, soweit sie nicht Befriedigung verlangen können. Dieses Recht steht den Gläubigern jedoch nur zu, wenn sie glaubhaft machen, dass durch die Ausgliederung die Erfüllung ihrer Forderung gefährdet wird."
    },
    {
      "date": "2025-10-13",
      "id": "133689",
      "original_text": "Registerbekanntmachung nach dem Umwandlungsgesetz\nMecklenburg-Vorpommern Amtsgericht Neubrandenburg HRB 22283\nTIAMI Immobilien GmbH – Anklam",
      "type": "Registerbekanntmachung nach dem Umwandlungsgesetz",
      "state": "Mecklenburg-Vorpommern",
      "amtsgericht": "Amtsgericht Neubrandenburg",
      "registernummer": "HRB 22283",
      "registerart": "HRB",
      "company_name": "TIAMI Immobilien GmbH",
      "company_seat": "Anklam",
      "details": "13.10.2025 (Bekanntmachungsdatum)\n\nMecklenburg-Vorpommern Amtsgericht Neubrandenburg HRB 22283\nRegisterbekanntmachung nach dem Umwandlungsgesetz 13.10.2025 (Eintragungsdatum)\n\nTIAMI Immobilien GmbH\nGesellschaft mit beschränkter Haftung\nAnklam\n\nAls nicht eingetragen wird veröffentlicht: Den Gläubigern der an der Verschmelzung beteiligten Rechtsträger ist, wenn sie binnen sechs Monaten nach dem Tag, an dem die Eintragung der Verschmelzung in das Register des Sitzes desjenigen Rechtsträgers, dessen Gläubiger sie sind, nach § 19 Abs. 3 UmwG als bekannt gemacht gilt,\nihren Anspruch nach Grund und Höhe in Textform anmelden, Sicherheit zu leisten, soweit sie nicht Befriedigung verlangen können. Dieses Recht steht den Gläubigern jedoch nur zu, wenn sie glaubhaft machen, dass durch die Verschmelzung die Erfüllung der Forderung gefährdet wird."
    },
    {
      "date": "2025-10-13",
      "id": "133690",
      "original_text": "Registerbekanntmachung nach dem Umwandlungsgesetz\nBaden-Württemberg Amtsgericht Freiburg HRA 709198\nMarkus Stock e.K. – Zell am Harmersbach",
      "type": "Registerbekanntmachung nach dem Umwandlungsgesetz",
      "state": "Baden-Württemberg",
      "amtsgericht": "Amtsgericht Freiburg",
      "registernummer": "HRA 709198",
      "registerart": "HRA",
      "company_name": "Markus Stock e.K.",
      "company_seat": "Zell am Harmersbach",
      "details": "13.10.2025 (Bekanntmachungsdatum)\n\nBaden-Württemberg Amtsgericht Freiburg HRA 709198\nRegisterbekanntmachung nach dem Umwandlungsgesetz 13.10.2025 (Eintragungsdatum)\n\nMarkus Stock e.K.\nEinzelkaufmann / Einzelkauffrau\nZell am Harmersbach\n\nGemäß Vertrag und Beschluss vom 25.08.2025 mit Korrektur vom 30.09.2025 ist das Unternehmen zur Aufnahme ausgegliedert auf die \"Markus Stock Versicherungsmakler GmbH\", Zell am Harmersbach (Amtsgericht Freiburg i. Br. HRB 733831). Den Gläubigern der an der Ausgliederung beteiligten Rechtsträger ist, wenn sie binnen sechs Monaten nach dem Tag, an dem die Eintragung der Ausgliederung in das Register des Sitzes desjenigen Rechtsträgers, dessen Gläubiger sie sind, nach § 19 Abs. 3 UmwG als bekanntgemacht gilt, ihren Anspruch nach Grund und Höhe schriftlich anmelden, Sicherheit zu leisten, soweit sie nicht Befriedigung verlangen können. Dieses Recht steht den Gläubigern jedoch nur zu, wenn sie glaubhaft machen, dass durch die Ausgliederung die Erfüllung ihrer Forderung gefährdet wird."
    },
    {
      "date": "2025-10-13",
      "id": "133691",
      "original_text": "Registerbekanntmachung nach dem Umwandlungsgesetz\nMecklenburg-Vorpommern Amtsgericht Neubrandenburg HRB 21438\nDOMAM GmbH – Anklam",
      "type": "Registerbekanntmachung nach dem Umwandlungsgesetz",
      "state": "Mecklenburg-Vorpommern",
      "amtsgericht": "Amtsgericht Neubrandenburg",
      "registernummer": "HRB 21438",
      "registerart": "HRB",
      "company_name": "DOMAM GmbH",
      "company_seat": "Anklam",
      "details": "13.10.2025 (Bekanntmachungsdatum)\n\nMecklenburg-Vorpommern Amtsgericht Neubrandenburg HRB 21438\nRegisterbekanntmachung nach dem Umwandlungsgesetz 13.10.2025 (Eintragungsdatum)\n\nDOMAM GmbH\nGesellschaft mit beschränkter Haftung\nAnklam\n\nAls nicht eingetragen wird veröffentlicht: Den Gläubigern der an der Verschmelzung beteiligten Rechtsträger ist, wenn sie binnen sechs Monaten nach dem Tag, an dem die Eintragung der Verschmelzung in das Register des Sitzes desjenigen Rechtsträgers, dessen Gläubiger sie sind, nach § 19 Abs. 3 UmwG als bekannt gemacht gilt,\nihren Anspruch nach Grund und Höhe in Textform anmelden, Sicherheit zu leisten, soweit sie nicht Befriedigung verlangen können. Dieses Recht steht den Gläubigern jedoch nur zu, wenn sie glaubhaft machen, dass durch die Verschmelzung die Erfüllung der Forderung gefährdet wird."
    },
    {
      "date": "2025-10-13",
      "id": "133692",
      "original_text": "Registerbekanntmachung nach dem Umwandlungsgesetz\nNiedersachsen Amtsgericht Hannover HRA 206777\nKahawa Verlagsdienstleistung e.K. – Hannover",
      "type": "Registerbekanntmachung nach dem Umwandlungsgesetz",
      "state": "Niedersachsen",
      "amtsgericht": "Amtsgericht Hannover",
      "registernummer": "HRA 206777",
      "registerart": "HRA",
      "company_name": "Kahawa Verlagsdienstleistung e.K.",
      "company_seat": "Hannover",
      "details": "13.10.2025 (Bekanntmachungsdatum)\n\nNiedersachsen Amtsgericht Hannover HRA 206777\nRegisterbekanntmachung nach dem Umwandlungsgesetz 13.10.2025 (Eintragungsdatum)\n\nKahawa Verlagsdienstleistung e.K.\nEinzelkaufmann / Einzelkauffrau\nHannover\n\nDen Gläubigern der an der Ausgliederung beteiligten Rechtsträger ist, wenn sie binnen sechs Monaten nach dem Tag, an dem die Eintragung der Ausgliederung in das Register des Sitzes desjenigen Rechtsträgers, dessen Gläubiger sie sind, nach § 19 Abs. 3 UmwG als bekannt gemacht gilt, ihren Anspruch nach Grund und Höhe schriftlich anmelden, Sicherheit zu leisten, soweit sie nicht Befriedigung verlangen können. Dieses Recht steht den Gläubigern jedoch nur zu, wenn sie glaubhaft machen, dass durch die Ausgliederung die Erfüllung der Forderung gefährdet wird."
    },
    {
      "date": "2025-10-13",
      "id": "133693",
      "original_text": "Löschungsankündigung\nNiedersachsen Amtsgericht Braunschweig HRB 200832\nGenthe Glas AG – Goslar",
      "type": "Löschungsankündigung",
      "state": "Niedersachsen",
      "amtsgericht": "Amtsgericht Braunschweig",
      "registernummer": "HRB 200832",
      "registerart": "HRB",
      "company_name": "Genthe Glas AG",
      "company_seat": "Goslar",
      "details": "13.10.2025 (Bekanntmachungsdatum)\n\nNiedersachsen Amtsgericht Braunschweig HRB 200832\nLöschungsankündigung\n\nGenthe Glas AG\nAktiengesellschaft\nGoslar\n\nDas Registergericht beabsichtigt, die Gesellschaft von Amts wegen nach § 394 FamFG zu löschen. Die Frist zur Erhebung eines Widerspruchs ist auf 1 Monat ab dieser Registerbekanntmachung festgesetzt."
    },
    {
      "date": "2025-10-13",
      "id": "133694",
      "original_text": "Registerbekanntmachung nach dem Umwandlungsgesetz\nNiedersachsen Amtsgericht Osnabrück HRA 209732\nStefan Schulz e.K. – Wietmarschen",
      "type": "Registerbekanntmachung nach dem Umwandlungsgesetz",
      "state": "Niedersachsen",
      "amtsgericht": "Amtsgericht Osnabrück",
      "registernummer": "HRA 209732",
      "registerart": "HRA",
      "company_name": "Stefan Schulz e.K.",
      "company_seat": "Wietmarschen",
      "details": "13.10.2025 (Bekanntmachungsdatum)\n\nNiedersachsen Amtsgericht Osnabrück HRA 209732\nRegisterbekanntmachung nach dem Umwandlungsgesetz 13.10.2025 (Eintragungsdatum)\n\nStefan Schulz e.K.\nEinzelkaufmann / Einzelkauffrau\nWietmarschen\n\nDen Gläubigern der an der Ausgliederung beteiligten Rechtsträger ist, wenn sie binnen sechs Monaten nach dem Tag, an dem die Eintragung der Ausgliederung in das Register des Sitzes desjenigen Rechtsträgers, dessen Gläubiger sie sind, nach § 19 Abs. 3 UmwG als bekannt gemacht gilt, ihren Anspruch nach Grund und Höhe schriftlich anmelden, Sicherheit zu leisten, soweit sie nicht Befriedigung verlangen können. Dieses Recht steht den Gläubigern jedoch nur zu, wenn sie glaubhaft machen, dass durch die Ausgliederung die Erfüllung der Forderung gefährdet wird."
    },
    {
      "date": "2025-10-13",
      "id": "133695",
      "original_text": "Registerbekanntmachung nach dem Umwandlungsgesetz\nNiedersachsen Amtsgericht Hannover HRB 229619\nKahawa Medien GmbH – Hannover",
      "type": "Registerbekanntmachung nach dem Umwandlungsgesetz",
      "state": "Niedersachsen",
      "amtsgericht": "Amtsgericht Hannover",
      "registernummer": "HRB 229619",
      "registerart": "HRB",
      "company_name": "Kahawa Medien GmbH",
      "company_seat": "Hannover",
      "details": "13.10.2025 (Bekanntmachungsdatum)\n\nNiedersachsen Amtsgericht Hannover HRB 229619\nRegisterbekanntmachung nach dem Umwandlungsgesetz 13.10.2025 (Eintragungsdatum)\n\nKahawa Medien GmbH\nGesellschaft mit beschränkter Haftung\nHannover\n\nDen Gläubigern der an der Ausgliederung beteiligten Rechtsträger ist, wenn sie binnen sechs Monaten nach dem Tag, an dem die Eintragung der Ausgliederung in das Register des Sitzes desjenigen Rechtsträgers, dessen Gläubiger sie sind, nach § 19 Abs. 3 UmwG als bekannt gemacht gilt, ihren Anspruch nach Grund und Höhe schriftlich anmelden, Sicherheit zu leisten, soweit sie nicht Befriedigung verlangen können. Dieses Recht steht den Gläubigern jedoch nur zu, wenn sie glaubhaft machen, dass durch die Ausgliederung die Erfüllung der Forderung gefährdet wird."
    },
    {
      "date": "2025-10-13",
      "id": "133696",
      "original_text": "Registerbekanntmachung nach dem Umwandlungsgesetz\nNiedersachsen Amtsgericht Hildesheim HRB 209270\nVentus Holding UG (haftungsbeschränkt) – Gifhorn",
      "type": "Registerbekanntmachung nach dem Umwandlungsgesetz",
      "state": "Niedersachsen",
      "amtsgericht": "Amtsgericht Hildesheim",
      "registernummer": "HRB 209270",
      "registerart": "HRB",
      "company_name": "Ventus Holding UG (haftungsbeschränkt)",
      "company_seat": "Gifhorn",
      "details": "13.10.2025 (Bekanntmachungsdatum)\n\nNiedersachsen Amtsgericht Hildesheim HRB 209270\nRegisterbekanntmachung nach dem Umwandlungsgesetz 13.10.2025 (Eintragungsdatum)\n\nVentus Holding UG (haftungsbeschränkt)\nGesellschaft mit beschränkter Haftung\nGifhorn\n\nDen Gläubigern der an der Verschmelzung beteiligten Rechtsträger ist, wenn sie binnen sechs Monaten nach dem Tag, an dem die Eintragung der Verschmelzung in das Register des Sitzes desjenigen Rechtsträgers, dessen Gläubiger sie sind, nach § 19  Abs.  3 UmwG als bekannt gemacht gilt, ihren Anspruch nach Grund und Höhe schriftlich anmelden, Sicherheit zu leisten, soweit sie nicht Befriedigung verlangen können. Dieses Recht steht den Gläubigern jedoch nur zu, wenn sie glaubhaft machen, dass durch die Verschmelzung die Erfüllung der Forderung gefährdet wird."
    },
    {
      "date": "2025-10-13",
      "id": "133697",
      "original_text": "Registerbekanntmachung nach dem Umwandlungsgesetz\nNiedersachsen Amtsgericht Göttingen HRB 207953\nKFZ-Technik Liehr GmbH – Osterode am Harz",
      "type": "Registerbekanntmachung nach dem Umwandlungsgesetz",
      "state": "Niedersachsen",
      "amtsgericht": "Amtsgericht Göttingen",
      "registernummer": "HRB 207953",
      "registerart": "HRB",
      "company_name": "KFZ-Technik Liehr GmbH",
      "company_seat": "Osterode am Harz",
      "details": "13.10.2025 (Bekanntmachungsdatum)\n\nNiedersachsen Amtsgericht Göttingen HRB 207953\nRegisterbekanntmachung nach dem Umwandlungsgesetz 13.10.2025 (Eintragungsdatum)\n\nKFZ-Technik Liehr GmbH\nGesellschaft mit beschränkter Haftung\nOsterode am Harz\n\nDen Gläubigern der an der Ausgliederung beteiligten Rechtsträger ist, wenn sie binnen sechs Monaten nach dem Tag, an dem die Eintragung der Ausgliederung in das Register des Sitzes desjenigen Rechtsträgers, dessen Gläubiger sie sind, nach § 19 Abs. 3 UmwG als bekannt gemacht gilt, ihren Anspruch nach Grund und Höhe schriftlich anmelden, Sicherheit zu leisten, soweit sie nicht Befriedigung verlangen können. Dieses Recht steht den Gläubigern jedoch nur zu, wenn sie glaubhaft machen, dass durch die Ausgliederung die Erfüllung der Forderung gefährdet wird."
    },
    {
      "date": "2025-10-13",
      "id": "133698",
      "original_text": "Sonstige Registerbekanntmachung\nNiedersachsen Amtsgericht Göttingen HRB 205339\nOttobock SE & Co. KGaA – Duderstadt",
      "type": "Sonstige Registerbekanntmachung",
      "state": "Niedersachsen",
      "amtsgericht": "Amtsgericht Göttingen",
      "registernummer": "HRB 205339",
      "registerart": "HRB",
      "company_name": "Ottobock SE & Co. KGaA",
      "company_seat": "Duderstadt",
      "details": "13.10.2025 (Bekanntmachungsdatum)\n\nNiedersachsen Amtsgericht Göttingen HRB 205339\nSonstige Registerbekanntmachung 08.10.2025 (Eintragungsdatum)\n\nOttobock SE & Co. KGaA\nKommanditgesellschaft auf Aktien\nDuderstadt\n\nDie Hauptversammlung vom 07.10.2025 hat die Erhöhung des Grundkapitals um 1.515.151,00 EUR gegen Barzahlung und die entsprechende Änderung der Satzung in § 4 (Grundkapital) beschlossen. Als nicht eingetragen wird bekanntgemacht: Das Grundkapital der Gesellschaft beträgt 63.990.151,00 EUR und ist eingeteilt in 63.990.151 Inhaber-Stückaktien."
    },
    {
      "date": "2025-10-13",
      "id": "133699",
      "original_text": "Registerbekanntmachung nach dem Umwandlungsgesetz\nNiedersachsen Amtsgericht Lüneburg HRB 208317\nETL Oehlmann, Aspeir & Kollegen GmbH Steuerberatungsgesellschaft – Uelzen",
      "type": "Registerbekanntmachung nach dem Umwandlungsgesetz",
      "state": "Niedersachsen",
      "amtsgericht": "Amtsgericht Lüneburg",
      "registernummer": "HRB 208317",
      "registerart": "HRB",
      "company_name": "ETL Oehlmann, Aspeir & Kollegen GmbH Steuerberatungsgesellschaft",
      "company_seat": "Uelzen",
      "details": "13.10.2025 (Bekanntmachungsdatum)\n\nNiedersachsen Amtsgericht Lüneburg HRB 208317\nRegisterbekanntmachung nach dem Umwandlungsgesetz 13.10.2025 (Eintragungsdatum)\n\nETL Oehlmann, Aspeir & Kollegen GmbH Steuerberatungsgesellschaft\nGesellschaft mit beschränkter Haftung\nUelzen\n\nDen Gläubigern der an der Verschmelzung beteiligten Rechtsträger ist, wenn sie binnen sechs Monaten nach dem Tag, an dem die Eintragung der Verschmelzung in das Register des Sitzes desjenigen Rechtsträgers, dessen Gläubiger sie sind, nach § 19  Abs.  3 UmwG als bekannt gemacht gilt, ihren Anspruch nach Grund und Höhe schriftlich anmelden, Sicherheit zu leisten, soweit sie nicht Befriedigung verlangen können. Dieses Recht steht den Gläubigern jedoch nur zu, wenn sie glaubhaft machen, dass durch die Verschmelzung die Erfüllung der Forderung gefährdet wird."
    },
    {
      "date": "2025-10-13",
      "id": "133700",
      "original_text": "Registerbekanntmachung nach dem Umwandlungsgesetz\nNiedersachsen Amtsgericht Osnabrück HRA 209796\nVirMagnus SE & Co. KG – Georgsmarienhütte",
      "type": "Registerbekanntmachung nach dem Umwandlungsgesetz",
      "state": "Niedersachsen",
      "amtsgericht": "Amtsgericht Osnabrück",
      "registernummer": "HRA 209796",
      "registerart": "HRA",
      "company_name": "VirMagnus SE & Co. KG",
      "company_seat": "Georgsmarienhütte",
      "details": "13.10.2025 (Bekanntmachungsdatum)\n\nNiedersachsen Amtsgericht Osnabrück HRA 209796\nRegisterbekanntmachung nach dem Umwandlungsgesetz 13.10.2025 (Eintragungsdatum)\n\nVirMagnus SE & Co. KG\nKommanditgesellschaft\nGeorgsmarienhütte\n\nDen Gläubigern der an der formwechselnden Umwandlung beteiligten Rechtsträger ist, wenn sie binnen sechs Monaten nach dem Tag, an dem die Eintragung der Umwandlung in das Register des Sitzes desjenigen Rechtsträgers, dessen Gläubiger sie sind, nach § 19 Abs. 3 UmwG als bekannt gemacht gilt, ihren Anspruch nach Grund und Höhe schriftlich anmelden, Sicherheit zu leisten, soweit sie nicht Befriedigung verlangen können. Dieses Recht steht den Gläubigern jedoch nur zu, wenn sie glaubhaft machen, dass durch die formwechselnde Umwandlung die Erfüllung der Forderung gefährdet wird."
    },
    {
      "date": "2025-10-13",
      "id": "133701",
      "original_text": "Registerbekanntmachung nach dem Umwandlungsgesetz\nNiedersachsen Amtsgericht Oldenburg (Oldenburg) HRB 120500 früher Amtsgericht Westerstede\nKARNA-BIOCHEMIE GmbH – Rastede",
      "type": "Registerbekanntmachung nach dem Umwandlungsgesetz",
      "state": "Niedersachsen",
      "amtsgericht": "Amtsgericht Oldenburg (Oldenburg)",
      "registernummer": "HRB 120500",
      "registerart": "HRB",
      "company_name": "KARNA-BIOCHEMIE GmbH",
      "company_seat": "Rastede",
      "former_amtsgericht": "Westerstede",
      "details": "13.10.2025 (Bekanntmachungsdatum)\n\nNiedersachsen Amtsgericht Oldenburg (Oldenburg) HRB 120500 früher Amtsgericht Westerstede\nRegisterbekanntmachung nach dem Umwandlungsgesetz 13.10.2025 (Eintragungsdatum)\n\nKARNA-BIOCHEMIE GmbH\nGesellschaft mit beschränkter Haftung\nRastede\n\nDen Gläubigern der an der Abspaltung beteiligten Rechtsträger ist, wenn sie binnen sechs Monaten nach dem Tag, an dem die Eintragung der Abspaltung in das Register des Sitzes desjenigen Rechtsträgers, dessen Gläubiger sie sind, nach § 19 Abs. 3 UmwG als bekannt gemacht gilt, ihren Anspruch nach Grund und Höhe schriftlich anmelden, Sicherheit zu leisten, soweit sie nicht Befriedigung verlangen können. Dieses Recht steht den Gläubigern jedoch nur zu, wenn sie glaubhaft machen, dass durch die Abspaltung die Erfüllung der Forderung gefährdet wird."
    },
    {
      "date": "2025-10-13",
      "id": "133702",
      "original_text": "Registerbekanntmachung nach dem Umwandlungsgesetz\nNiedersachsen Amtsgericht Braunschweig HRB 207021\nETL Aller Treuhand GmbH Steuerberatungsgesellschaft – Wolfsburg",
      "type": "Registerbekanntmachung nach dem Umwandlungsgesetz",
      "state": "Niedersachsen",
      "amtsgericht": "Amtsgericht Braunschweig",
      "registernummer": "HRB 207021",
      "registerart": "HRB",
      "company_name": "ETL Aller Treuhand GmbH Steuerberatungsgesellschaft",
      "company_seat": "Wolfsburg",
      "details": "13.10.2025 (Bekanntmachungsdatum)\n\nNiedersachsen Amtsgericht Braunschweig HRB 207021\nRegisterbekanntmachung nach dem Umwandlungsgesetz 13.10.2025 (Eintragungsdatum)\n\nETL Aller Treuhand GmbH Steuerberatungsgesellschaft\nGesellschaft mit beschränkter Haftung\nWolfsburg\n\nDen Gläubigern der an der Verschmelzung beteiligten Rechtsträger ist, wenn sie binnen sechs Monaten nach dem Tag, an dem die Eintragung der Verschmelzung in das Register des Sitzes desjenigen Rechtsträgers, dessen Gläubiger sie sind, nach § 19  Abs.  3 UmwG als bekannt gemacht gilt, ihren Anspruch nach Grund und Höhe schriftlich anmelden, Sicherheit zu leisten, soweit sie nicht Befriedigung verlangen können. Dieses Recht steht den Gläubigern jedoch nur zu, wenn sie glaubhaft machen, dass durch die Verschmelzung die Erfüllung der Forderung gefährdet wird."
    },
    {
      "date": "2025-10-13",
      "id": "133703",
      "original_text": "Registerbekanntmachung nach dem Umwandlungsgesetz\nNiedersachsen Amtsgericht Hildesheim HRB 208848\nKekse & Kollegen Media GmbH – Gifhorn",
      "type": "Registerbekanntmachung nach dem Umwandlungsgesetz",
      "state": "Niedersachsen",
      "amtsgericht": "Amtsgericht Hildesheim",
      "registernummer": "HRB 208848",
      "registerart": "HRB",
      "company_name": "Kekse & Kollegen Media GmbH",
      "company_seat": "Gifhorn",
      "details": "13.10.2025 (Bekanntmachungsdatum)\n\nNiedersachsen Amtsgericht Hildesheim HRB 208848\nRegisterbekanntmachung nach dem Umwandlungsgesetz 13.10.2025 (Eintragungsdatum)\n\nKekse & Kollegen Media GmbH\nGesellschaft mit beschränkter Haftung\nGifhorn\n\nDen Gläubigern der an der Verschmelzung beteiligten Rechtsträger ist, wenn sie binnen sechs Monaten nach dem Tag, an dem die Eintragung der Verschmelzung in das Register des Sitzes desjenigen Rechtsträgers, dessen Gläubiger sie sind, nach § 19  Abs.  3 UmwG als bekannt gemacht gilt, ihren Anspruch nach Grund und Höhe schriftlich anmelden, Sicherheit zu leisten, soweit sie nicht Befriedigung verlangen können. Dieses Recht steht den Gläubigern jedoch nur zu, wenn sie glaubhaft machen, dass durch die Verschmelzung die Erfüllung der Forderung gefährdet wird."
    },
    {
      "date": "2025-10-13",
      "id": "133704",
      "original_text": "Registerbekanntmachung nach dem Umwandlungsgesetz\nNiedersachsen Amtsgericht Stadthagen HRB 202463\nWehrmann Bestattungen GmbH – Bückeburg",
      "type": "Registerbekanntmachung nach dem Umwandlungsgesetz",
      "state": "Niedersachsen",
      "amtsgericht": "Amtsgericht Stadthagen",
      "registernummer": "HRB 202463",
      "registerart": "HRB",
      "company_name": "Wehrmann Bestattungen GmbH",
      "company_seat": "Bückeburg",
      "details": "13.10.2025 (Bekanntmachungsdatum)\n\nNiedersachsen Amtsgericht Stadthagen HRB 202463\nRegisterbekanntmachung nach dem Umwandlungsgesetz 10.10.2025 (Eintragungsdatum)\n\nWehrmann Bestattungen GmbH\nGesellschaft mit beschränkter Haftung\nBückeburg\n\nDen Gläubigern der an der Ausgliederung beteiligten Rechtsträger ist, wenn sie binnen sechs Monaten nach dem Tag, an dem die Eintragung der Ausgliederung in das Register des Sitzes desjenigen Rechtsträgers, dessen Gläubiger sie sind, nach § 19 Abs. 3 UmwG als bekannt gemacht gilt, ihren Anspruch nach Grund und Höhe schriftlich anmelden, Sicherheit zu leisten, soweit sie nicht Befriedigung verlangen können. Dieses Recht steht den Gläubigern jedoch nur zu, wenn sie glaubhaft machen, dass durch die Ausgliederung die Erfüllung der Forderung gefährdet wird."
    },
    {
      "date": "2025-10-13",
      "id": "133705",
      "original_text": "Registerbekanntmachung nach dem Umwandlungsgesetz\nNiedersachsen Amtsgericht Osnabrück HRB 110386 früher Amtsgericht Bad Iburg\nGeorgsmarienhütte Holding GmbH – Georgsmarienhütte",
      "type": "Registerbekanntmachung nach dem Umwandlungsgesetz",
      "state": "Niedersachsen",
      "amtsgericht": "Amtsgericht Osnabrück",
      "registernummer": "HRB 110386",
      "registerart": "HRB",
      "company_name": "Georgsmarienhütte Holding GmbH",
      "company_seat": "Georgsmarienhütte",
      "former_amtsgericht": "Bad Iburg",
      "details": "13.10.2025 (Bekanntmachungsdatum)\n\nNiedersachsen Amtsgericht Osnabrück HRB 110386 früher Amtsgericht Bad Iburg\nRegisterbekanntmachung nach dem Umwandlungsgesetz 13.10.2025 (Eintragungsdatum)\n\nGeorgsmarienhütte Holding GmbH\nGesellschaft mit beschränkter Haftung\nGeorgsmarienhütte\n\nDen Gläubigern der an der formwechselnden Umwandlung beteiligten Rechtsträger ist, wenn sie binnen sechs Monaten nach dem Tag, an dem die Eintragung der Umwandlung in das Register des Sitzes desjenigen Rechtsträgers, dessen Gläubiger sie sind, nach § 19 Abs. 3 UmwG als bekannt gemacht gilt, ihren Anspruch nach Grund und Höhe schriftlich anmelden, Sicherheit zu leisten, soweit sie nicht Befriedigung verlangen können. Dieses Recht steht den Gläubigern jedoch nur zu, wenn sie glaubhaft machen, dass durch die formwechselnde Umwandlung die Erfüllung der Forderung gefährdet wird."
    },
    {
      "date": "2025-10-13",
      "id": "133706",
      "original_text": "Registerbekanntmachung nach dem Umwandlungsgesetz\nBremen Amtsgericht Bremen HRB 30272\nMplus Bremen GmbH – Bremen",
      "type": "Registerbekanntmachung nach dem Umwandlungsgesetz",
      "state": "Bremen",
      "amtsgericht": "Amtsgericht Bremen",
      "registernummer": "HRB 30272",
      "registerart": "HRB",
      "company_name": "Mplus Bremen GmbH",
      "company_seat": "Bremen",
      "details": "13.10.2025 (Bekanntmachungsdatum)\n\nBremen Amtsgericht Bremen HRB 30272\nRegisterbekanntmachung nach dem Umwandlungsgesetz 10.10.2025 (Eintragungsdatum)\n\nMplus Bremen GmbH\nGesellschaft mit beschränkter Haftung\nBremen\n\nZu Eintragungsnummer 10 vom 10.10.2025 wird als nicht eingetragen veröffentlicht:  Den Gläubigern der an der Verschmelzung beteiligten Rechtsträger ist, wenn sie binnen sechs Monaten nach dem Tag, an dem die Eintragung der Verschmelzung in das Register des Sitzes desjenigen Rechtsträgers, dessen Gläubiger sie sind, als bekannt gemacht gilt, ihren Anspruch nach Grund und Höhe schriftlich anmelden, Sicherheit zu leisten, soweit sie nicht Befriedigung verlangen können. Dieses Recht steht den Gläubigern jedoch nur zu, wenn sie glaubhaft machen, dass durch die Verschmelzung die Erfüllung ihrer Forderung gefährdet wird. Das Recht, Sicherheitsleistung zu verlangen, steht Gläubigern nicht zu, die im Falle der Insolvenz ein Recht auf vorzugsweise Befriedigung aus einer Deckungsmasse haben, die nach gesetzlicher Vorschrift zu ihrem Schutz errichtet und staatlich überwacht ist."
    },
    {
      "date": "2025-10-13",
      "id": "133707",
      "original_text": "Registerbekanntmachung nach dem Umwandlungsgesetz\nBremen Amtsgericht Bremen HRB 30272\nMplus Bremen GmbH – Bremen",
      "type": "Registerbekanntmachung nach dem Umwandlungsgesetz",
      "state": "Bremen",
      "amtsgericht": "Amtsgericht Bremen",
      "registernummer": "HRB 30272",
      "registerart": "HRB",
      "company_name": "Mplus Bremen GmbH",
      "company_seat": "Bremen",
      "details": "13.10.2025 (Bekanntmachungsdatum)\n\nBremen Amtsgericht Bremen HRB 30272\nRegisterbekanntmachung nach dem Umwandlungsgesetz 10.10.2025 (Eintragungsdatum)\n\nMplus Bremen GmbH\nGesellschaft mit beschränkter Haftung\nBremen\n\nZu Eintragungsnummer 9 vom 10.10.2025 wird als nicht eingetragen veröffentlicht: Den Gläubigern der an der Verschmelzung beteiligten Rechtsträger ist, wenn sie binnen sechs Monaten nach dem Tag, an dem die Eintragung der Verschmelzung in das Register des Sitzes desjenigen Rechtsträgers, dessen Gläubiger sie sind, als bekannt gemacht gilt, ihren Anspruch nach Grund und Höhe schriftlich anmelden, Sicherheit zu leisten, soweit sie nicht Befriedigung verlangen können. Dieses Recht steht den Gläubigern jedoch nur zu, wenn sie glaubhaft machen, dass durch die Verschmelzung die Erfüllung ihrer Forderung gefährdet wird. Das Recht, Sicherheitsleistung zu verlangen, steht Gläubigern nicht zu, die im Falle der Insolvenz ein Recht auf vorzugsweise Befriedigung aus einer Deckungsmasse haben, die nach gesetzlicher Vorschrift zu ihrem Schutz errichtet und staatlich überwacht ist."
    },
    {
      "date": "2025-10-13",
      "id": "133708",
      "original_text": "Registerbekanntmachung nach dem Umwandlungsgesetz\nBremen Amtsgericht Bremen HRB 33626\nHansefit GmbH – Bremen",
      "type": "Registerbekanntmachung nach dem Umwandlungsgesetz",
      "state": "Bremen",
      "amtsgericht": "Amtsgericht Bremen",
      "registernummer": "HRB 33626",
      "registerart": "HRB",
      "company_name": "Hansefit GmbH",
      "company_seat": "Bremen",
      "details": "13.10.2025 (Bekanntmachungsdatum)\n\nBremen Amtsgericht Bremen HRB 33626\nRegisterbekanntmachung nach dem Umwandlungsgesetz 07.10.2025 (Eintragungsdatum)\n\nHansefit GmbH\nGesellschaft mit beschränkter Haftung\nBremen\n\nAls nicht eingetragen wird veröffentlicht: Den Gläubigern der an der Verschmelzung beteiligten Rechtsträger ist, wenn sie binnen sechs Monaten nach dem Tag, an dem die Eintragung der Verschmelzung in das Register des Sitzes desjenigen Rechtsträgers, dessen Gläubiger sie sind, als bekannt gemacht gilt, ihren Anspruch nach Grund und Höhe schriftlich anmelden, Sicherheit zu leisten, soweit sie nicht Befriedigung verlangen können. Dieses Recht steht den Gläubigern jedoch nur zu, wenn sie glaubhaft machen, dass durch die Verschmelzung die Erfüllung ihrer Forderung gefährdet wird. Das Recht, Sicherheitsleistung zu verlangen, steht Gläubigern nicht zu, die im Falle der Insolvenz ein Recht auf vorzugsweise Befriedigung aus einer Deckungsmasse haben, die nach gesetzlicher Vorschrift zu ihrem Schutz errichtet und staatlich überwacht ist."
    },
    {
      "date": "2025-10-13",
      "id": "133709",
      "original_text": "Registerbekanntmachung nach dem Umwandlungsgesetz\nBremen Amtsgericht Bremen HRA 30667\nHartje Immobilien e.K. – Bremen",
      "type": "Registerbekanntmachung nach dem Umwandlungsgesetz",
      "state": "Bremen",
      "amtsgericht": "Amtsgericht Bremen",
      "registernummer": "HRA 30667",
      "registerart": "HRA",
      "company_name": "Hartje Immobilien e.K.",
      "company_seat": "Bremen",
      "details": "13.10.2025 (Bekanntmachungsdatum)\n\nBremen Amtsgericht Bremen HRA 30667\nRegisterbekanntmachung nach dem Umwandlungsgesetz 07.10.2025 (Eintragungsdatum)\n\nHartje Immobilien e.K.\nEinzelkaufmann / Einzelkauffrau\nBremen\n\nAls nicht eingetragen wird veröffentlicht: Den Gläubigern der an der Ausgliederung beteiligten Rechtsträger ist, wenn sie binnen sechs Monaten nach dem Tag, an dem die Eintragung der Ausgliederung in das Register des Sitzes desjenigen Rechtsträgers, dessen Gläubiger sie sind, als bekannt gemacht gilt, ihren Anspruch nach Grund und Höhe schriftlich anmelden, Sicherheit zu leisten, soweit sie nicht Befriedigung verlangen können. Dieses Recht steht den Gläubigern jedoch nur zu, wenn sie glaubhaft machen, dass durch die Ausgliederung die Erfüllung ihrer Forderung gefährdet wird. Das Recht, Sicherheitsleistung zu verlangen, steht Gläubigern nicht zu, die im Falle der Insolvenz ein Recht auf vorzugsweise Befriedigung aus einer Deckungsmasse haben, die nach gesetzlicher Vorschrift zu ihrem Schutz errichtet und staatlich überwacht ist."
    },
    {
      "date": "2025-10-13",
      "id": "133710",
      "original_text": "Registerbekanntmachung nach dem Umwandlungsgesetz\nRheinland-Pfalz Amtsgericht Koblenz HRB 31397\nBBT Region Trier gGmbH – Koblenz",
      "type": "Registerbekanntmachung nach dem Umwandlungsgesetz",
      "state": "Rheinland-Pfalz",
      "amtsgericht": "Amtsgericht Koblenz",
      "registernummer": "HRB 31397",
      "registerart": "HRB",
      "company_name": "BBT Region Trier gGmbH",
      "company_seat": "Koblenz",
      "details": "13.10.2025 (Bekanntmachungsdatum)\n\nRheinland-Pfalz Amtsgericht Koblenz HRB 31397\nRegisterbekanntmachung nach dem Umwandlungsgesetz 13.10.2025 (Eintragungsdatum)\n\nBBT Region Trier gGmbH\nGesellschaft mit beschränkter Haftung\nKoblenz\n\nAls nicht eingetragen wird veröffentlicht: Den Gläubigern der an der Ausgliederung beteiligten Rechtsträger ist, wenn sie binnen sechs Monaten nach dem Tag, an dem die Eintragung der Ausgliederung in das Register des Sitzes desjenigen Rechtsträgers,dessen Gläubiger sie sind, nach § 19 Abs. 3 UmwG als bekannt gemacht gilt, ihren Anspruch nach Grund und Höhe schriftlich anmelden, Sicherheit zu leisten, soweit sie nicht Befriedigung verlangen können. Dieses Recht steht den Gläubigern jedoch nur zu, wenn sie glaubhaft machen, dass durch die Ausgliederung die Erfüllung der Forderung gefährdet wird."
    },
    {
      "date": "2025-10-13",
      "id": "133711",
      "original_text": "Registerbekanntmachung nach dem Umwandlungsgesetz\nRheinland-Pfalz Amtsgericht Koblenz HRB 24056\nBarmherzige Brüder Trier gGmbH – Koblenz",
      "type": "Registerbekanntmachung nach dem Umwandlungsgesetz",
      "state": "Rheinland-Pfalz",
      "amtsgericht": "Amtsgericht Koblenz",
      "registernummer": "HRB 24056",
      "registerart": "HRB",
      "company_name": "Barmherzige Brüder Trier gGmbH",
      "company_seat": "Koblenz",
      "details": "13.10.2025 (Bekanntmachungsdatum)\n\nRheinland-Pfalz Amtsgericht Koblenz HRB 24056\nRegisterbekanntmachung nach dem Umwandlungsgesetz 13.10.2025 (Eintragungsdatum)\n\nBarmherzige Brüder Trier gGmbH\nGesellschaft mit beschränkter Haftung\nKoblenz\n\nAls nicht eingetragen wird veröffentlicht: Den Gläubigern der an der Ausgliederung beteiligten Rechtsträger ist, wenn sie binnen sechs Monaten nach dem Tag, an dem die Eintragung der Ausgliederung in das Register des Sitzes desjenigen Rechtsträgers,dessen Gläubiger sie sind, nach § 19 Abs. 3 UmwG als bekannt gemacht gilt, ihren Anspruch nach Grund und Höhe schriftlich anmelden, Sicherheit zu leisten, soweit sie nicht Befriedigung verlangen können. Dieses Recht steht den Gläubigern jedoch nur zu, wenn sie glaubhaft machen, dass durch die Ausgliederung die Erfüllung der Forderung gefährdet wird."
    },
    {
      "date": "2025-10-13",
      "id": "133712",
      "original_text": "Registerbekanntmachung nach dem Umwandlungsgesetz\nRheinland-Pfalz Amtsgericht Mainz VR 2648\nSozialtherapeutische Beratungsstelle/Betreuungsverein e.V. (SBB Mainz e.V.) – Mainz",
      "type": "Registerbekanntmachung nach dem Umwandlungsgesetz",
      "state": "Rheinland-Pfalz",
      "amtsgericht": "Amtsgericht Mainz",
      "registernummer": "VR 2648",
      "registerart": "VR",
      "company_name": "Sozialtherapeutische Beratungsstelle/Betreuungsverein e.V. (SBB Mainz e.V.)",
      "company_seat": "Mainz",
      "details": "13.10.2025 (Bekanntmachungsdatum)\n\nRheinland-Pfalz Amtsgericht Mainz VR 2648\nRegisterbekanntmachung nach dem Umwandlungsgesetz 13.10.2025 (Eintragungsdatum)\n\nSozialtherapeutische Beratungsstelle/Betreuungsverein e.V. (SBB Mainz e.V.)\neingetragener Verein\nMainz\n\nAls nicht eingetragen wird veröffentlicht:\nDen Gläubigern des formwechselnden Rechtsträgers ist, wenn sie binnen sechs Monaten nach dem Tag, an dem die Eintragung des Formwechsels nach § 201 UmwG als bekanntgemacht gilt, ihren Anspruch nach Grund und Höhe schriftlich anmelden, Sicherheit zu leisten, soweit sie nicht Befriedigung verlangen können. Dieses Recht steht den Gläubigern jedoch nur zu, wenn sie glaubhaft machen, dass durch den Formwechsel die Erfüllung ihrer Forderung gefährdet wird."
    },
    {
      "date": "2025-10-13",
      "id": "133713",
      "original_text": "Löschungsankündigung\nRheinland-Pfalz Amtsgericht Ludwigshafen a.Rhein (Ludwigshafen) HRB 68109\nAris Baudienstleistungen und Handels GmbH – Ludwigshafen / Rhein",
      "type": "Löschungsankündigung",
      "state": "Rheinland-Pfalz",
      "amtsgericht": "Amtsgericht Ludwigshafen a.Rhein (Ludwigshafen)",
      "registernummer": "HRB 68109",
      "registerart": "HRB",
      "company_name": "Aris Baudienstleistungen und Handels GmbH",
      "company_seat": "Ludwigshafen / Rhein",
      "details": "13.10.2025 (Bekanntmachungsdatum)\n\nRheinland-Pfalz Amtsgericht Ludwigshafen a.Rhein (Ludwigshafen) HRB 68109\nLöschungsankündigung 13.10.2025 (Eintragungsdatum)\n\nAris Baudienstleistungen und Handels GmbH\nGesellschaft mit beschränkter Haftung\nLudwigshafen / Rhein\n\nDas Registergericht beabsichtigt die Gesellschaft von Amts wegen nach § 394 FamFG zu löschen. Die Frist zur Erhebung eines Widerspruchs ist auf einen Monat festgesetzt."
    },
    {
      "date": "2025-10-13",
      "id": "133714",
      "original_text": "Registerbekanntmachung nach dem Umwandlungsgesetz\nRheinland-Pfalz Amtsgericht Mainz HRB 54104\nSBB Sozialtherapeutische Beratungsstelle Mainz gGmbH – Mainz",
      "type": "Registerbekanntmachung nach dem Umwandlungsgesetz",
      "state": "Rheinland-Pfalz",
      "amtsgericht": "Amtsgericht Mainz",
      "registernummer": "HRB 54104",
      "registerart": "HRB",
      "company_name": "SBB Sozialtherapeutische Beratungsstelle Mainz gGmbH",
      "company_seat": "Mainz",
      "details": "13.10.2025 (Bekanntmachungsdatum)\n\nRheinland-Pfalz Amtsgericht Mainz HRB 54104\nRegisterbekanntmachung nach dem Umwandlungsgesetz 13.10.2025 (Eintragungsdatum)\n\nSBB Sozialtherapeutische Beratungsstelle Mainz gGmbH\nGesellschaft mit beschränkter Haftung\nMainz\n\nAls nicht eingetragen wird veröffentlicht:\nDen Gläubigern des formwechselnden Rechtsträgers ist, wenn sie binnen sechs Monaten nach dem Tag, an dem die Eintragung des Formwechsels nach § 201 UmwG als bekanntgemacht gilt, ihren Anspruch nach Grund und Höhe schriftlich anmelden, Sicherheit zu leisten, soweit sie nicht Befriedigung verlangen können. Dieses Recht steht den Gläubigern jedoch nur zu, wenn sie glaubhaft machen, dass durch den Formwechsel die Erfüllung ihrer Forderung gefährdet wird."
    },
    {
      "date": "2025-10-13",
      "id": "133715",
      "original_text": "Löschungsankündigung\nRheinland-Pfalz Amtsgericht Mainz HRB 45144\nK & Ö Bauunternehmen GmbH – Ingelheim am Rhein",
      "type": "Löschungsankündigung",
      "state": "Rheinland-Pfalz",
      "amtsgericht": "Amtsgericht Mainz",
      "registernummer": "HRB 45144",
      "registerart": "HRB",
      "company_name": "K & Ö Bauunternehmen GmbH",
      "company_seat": "Ingelheim am Rhein",
      "details": "13.10.2025 (Bekanntmachungsdatum)\n\nRheinland-Pfalz Amtsgericht Mainz HRB 45144\nLöschungsankündigung\n\nK & Ö Bauunternehmen GmbH\nGesellschaft mit beschränkter Haftung\nIngelheim am Rhein\n\nDas Registergericht beabsichtigt die Gesellschaft von Amts wegen nach § 394 FamFG zu löschen. Die Frist zur Erhebung eines Widerspruchs ist auf einen Monat festgesetzt."
    },
    {
      "date": "2025-10-13",
      "id": "133716",
      "original_text": "Löschungsankündigung\nRheinland-Pfalz Amtsgericht Wittlich HRA 11973\nBauunternehmen Harald Gerhards GmbH & Co. KG – Gillenfeld",
      "type": "Löschungsankündigung",
      "state": "Rheinland-Pfalz",
      "amtsgericht": "Amtsgericht Wittlich",
      "registernummer": "HRA 11973",
      "registerart": "HRA",
      "company_name": "Bauunternehmen Harald Gerhards GmbH & Co. KG",
      "company_seat": "Gillenfeld",
      "details": "13.10.2025 (Bekanntmachungsdatum)\n\nRheinland-Pfalz Amtsgericht Wittlich HRA 11973\nLöschungsankündigung 13.10.2025 (Eintragungsdatum)\n\nBauunternehmen Harald Gerhards GmbH & Co. KG\nKommanditgesellschaft\nGillenfeld\n\nDas Registergericht beabsichtigt die Firma von Amts wegen nach § 394 FamFG zu löschen. Die Frist zur Erhebung eines Widerspruchs ist auf einen Monat festgesetzt."
    },
    {
      "date": "2025-10-13",
      "id": "133717",
      "original_text": "Löschungsankündigung\nNordrhein-Westfalen Amtsgericht Gelsenkirchen HRA 4124\nVVMK Versicherungsmakler e.K. Philipp Kreft – Haltern am See",
      "type": "Löschungsankündigung",
      "state": "Nordrhein-Westfalen",
      "amtsgericht": "Amtsgericht Gelsenkirchen",
      "registernummer": "HRA 4124",
      "registerart": "HRA",
      "company_name": "VVMK Versicherungsmakler e.K. Philipp Kreft",
      "company_seat": "Haltern am See",
      "details": "13.10.2025 (Bekanntmachungsdatum)\n\nNordrhein-Westfalen Amtsgericht Gelsenkirchen HRA 4124\nLöschungsankündigung 13.10.2025 (Eintragungsdatum)\n\nVVMK Versicherungsmakler e.K. Philipp Kreft\nEinzelkaufmann / Einzelkauffrau\nHaltern am See\n\nDas Registergericht beabsichtigt die Firma von Amts wegen nach § 31 Abs. 2 HGB, § 393 FamFG zu löschen. Die Frist zur Erhebung eines Widerspruchs ist auf einen Monat festgesetzt."
    },
    {
      "date": "2025-10-13",
      "id": "133718",
      "original_text": "Registerbekanntmachung nach dem Umwandlungsgesetz\nNordrhein-Westfalen Amtsgericht Hamm HRA 1818\nKreikenberg Immobilien GmbH & Co. KG – Hamm",
      "type": "Registerbekanntmachung nach dem Umwandlungsgesetz",
      "state": "Nordrhein-Westfalen",
      "amtsgericht": "Amtsgericht Hamm",
      "registernummer": "HRA 1818",
      "registerart": "HRA",
      "company_name": "Kreikenberg Immobilien GmbH & Co. KG",
      "company_seat": "Hamm",
      "details": "13.10.2025 (Bekanntmachungsdatum)\n\nNordrhein-Westfalen Amtsgericht Hamm HRA 1818\nRegisterbekanntmachung nach dem Umwandlungsgesetz 01.10.2025 (Eintragungsdatum)\n\nKreikenberg Immobilien GmbH & Co. KG\nKommanditgesellschaft\nHamm\n\nDen Gläubigern der an der formwechselnden Umwandlung beteiligten Rechtsträger ist, wenn sie binnen sechs Monaten nach dem Tag, an dem die Eintragung der formwechselnden Umwandlung in das Register des Sitzes derjenigen Rechtsträger deren Gläubiger sie sind, nach § 19 Absatz 3 UmwG als bekanntgemacht gilt, ihren Anspruch nach Grund und Höhe schriftlich anmelden, Sicherheit zu leisten, soweit sie nicht Befriedigung verlangen können. Dieses Recht steht den Gläubigern jedoch nur zu, wenn sie glaubhaft machen, dass durch die formwechselnden Umwandlung die Erfüllung ihrer Forderung gefährdet wird."
    },
    {
      "date": "2025-10-13",
      "id": "133719",
      "original_text": "Registerbekanntmachung nach dem Umwandlungsgesetz\nNordrhein-Westfalen Amtsgericht Bonn HRB 19529\nFitpark GmbH – Bonn",
      "type": "Registerbekanntmachung nach dem Umwandlungsgesetz",
      "state": "Nordrhein-Westfalen",
      "amtsgericht": "Amtsgericht Bonn",
      "registernummer": "HRB 19529",
      "registerart": "HRB",
      "company_name": "Fitpark GmbH",
      "company_seat": "Bonn",
      "details": "13.10.2025 (Bekanntmachungsdatum)\n\nNordrhein-Westfalen Amtsgericht Bonn HRB 19529\nRegisterbekanntmachung nach dem Umwandlungsgesetz\n\nFitpark GmbH\nGesellschaft mit beschränkter Haftung\nBonn\n\nDen Gläubigern der an der Ausgliederung beteiligten Rechtsträger ist, wenn sie binnen sechs Monaten nach dem Tag, an dem die Eintragung der Ausgliederung in das Register des Sitzes desjenigen Rechtsträgers, dessen Gläubiger sie sind, nach § 19 Absatz 3 UmwG als bekanntgemacht gilt, ihren Anspruch nach Grund und Höhe schriftlich anmelden, Sicherheit zu leisten, soweit sie nicht Befriedigung verlangen können. Dieses Recht steht den Gläubigern jedoch nur zu, wenn sie glaubhaft machen, dass durch die Ausgliederung die Erfüllung ihrer Forderung gefährdet wird."
    },
    {
      "date": "2025-10-13",
      "id": "133720",
      "original_text": "Registerbekanntmachung nach dem Umwandlungsgesetz\nNordrhein-Westfalen Amtsgericht Bonn HRB 30108\nGo for Sports GmbH – Bonn",
      "type": "Registerbekanntmachung nach dem Umwandlungsgesetz",
      "state": "Nordrhein-Westfalen",
      "amtsgericht": "Amtsgericht Bonn",
      "registernummer": "HRB 30108",
      "registerart": "HRB",
      "company_name": "Go for Sports GmbH",
      "company_seat": "Bonn",
      "details": "13.10.2025 (Bekanntmachungsdatum)\n\nNordrhein-Westfalen Amtsgericht Bonn HRB 30108\nRegisterbekanntmachung nach dem Umwandlungsgesetz 13.10.2025 (Eintragungsdatum)\n\nGo for Sports GmbH\nGesellschaft mit beschränkter Haftung\nBonn\n\nDen Gläubigern der an der Ausgliederung beteiligten Rechtsträger ist, wenn sie binnen sechs Monaten nach dem Tag, an dem die Eintragung der Ausgliederung in das Register des Sitzes desjenigen Rechtsträgers, dessen Gläubiger sie sind, nach § 19 Absatz 3 UmwG als bekanntgemacht gilt, ihren Anspruch nach Grund und Höhe schriftlich anmelden, Sicherheit zu leisten, soweit sie nicht Befriedigung verlangen können. Dieses Recht steht den Gläubigern jedoch nur zu, wenn sie glaubhaft machen, dass durch die Ausgliederung die Erfüllung ihrer Forderung gefährdet wird."
    },
    {
      "date": "2025-10-13",
      "id": "133721",
      "original_text": "Registerbekanntmachung nach dem Umwandlungsgesetz\nNordrhein-Westfalen Amtsgericht Essen HRB 37075\nSan-Sic Dienst GmbH – Essen",
      "type": "Registerbekanntmachung nach dem Umwandlungsgesetz",
      "state": "Nordrhein-Westfalen",
      "amtsgericht": "Amtsgericht Essen",
      "registernummer": "HRB 37075",
      "registerart": "HRB",
      "company_name": "San-Sic Dienst GmbH",
      "company_seat": "Essen",
      "details": "13.10.2025 (Bekanntmachungsdatum)\n\nNordrhein-Westfalen Amtsgericht Essen HRB 37075\nRegisterbekanntmachung nach dem Umwandlungsgesetz 13.10.2025 (Eintragungsdatum)\n\nSan-Sic Dienst GmbH\nGesellschaft mit beschränkter Haftung\nEssen\n\nDen Gläubigern der an der Ausgliederung beteiligten Rechtsträger ist, wenn sie binnen sechs Monaten nach dem Tag, an dem die Eintragung der Ausgliederung in das Register des Sitzes desjenigen Rechtsträgers, dessen Gläubiger sie sind, nach § 19 Absatz 3 UmwG als bekanntgemacht gilt, ihren Anspruch nach Grund und Höhe schriftlich anmelden, Sicherheit zu leisten, soweit sie nicht Befriedigung verlangen können. Dieses Recht steht den Gläubigern jedoch nur zu, wenn sie glaubhaft machen, dass durch die Ausgliederung die Erfüllung ihrer Forderung gefährdet wird."
    },
    {
      "date": "2025-10-13",
      "id": "133722",
      "original_text": "Registerbekanntmachung nach dem Umwandlungsgesetz\nNordrhein-Westfalen Amtsgericht Düsseldorf HRB 83430\nCTOUCH Germany GmbH – Düsseldorf",
      "type": "Registerbekanntmachung nach dem Umwandlungsgesetz",
      "state": "Nordrhein-Westfalen",
      "amtsgericht": "Amtsgericht Düsseldorf",
      "registernummer": "HRB 83430",
      "registerart": "HRB",
      "company_name": "CTOUCH Germany GmbH",
      "company_seat": "Düsseldorf",
      "details": "13.10.2025 (Bekanntmachungsdatum)\n\nNordrhein-Westfalen Amtsgericht Düsseldorf HRB 83430\nRegisterbekanntmachung nach dem Umwandlungsgesetz 13.10.2025 (Eintragungsdatum)\n\nCTOUCH Germany GmbH\nGesellschaft mit beschränkter Haftung\nDüsseldorf\n\nDen Gläubigern der an der Verschmelzung beteiligten Rechtsträger ist, wenn sie binnen sechs Monaten nach dem Tag, an dem die Eintragung der Verschmelzung in das Register des Sitzes desjenigen Rechtsträgers, dessen Gläubiger sie sind, nach § 19 Absatz 3 UmwG als bekanntgemacht gilt, ihren Anspruch nach Grund und Höhe schriftlich anmelden, Sicherheit zu leisten, soweit sie nicht Befriedigung verlangen können. Dieses Recht steht den Gläubigern jedoch nur zu, wenn sie glaubhaft machen, dass durch die Verschmelzung die Erfüllung ihrer Forderung gefährdet wird."
    },
    {
      "date": "2025-10-13",
      "id": "133723",
      "original_text": "Einreichung neuer Dokumente\nNordrhein-Westfalen Amtsgericht Essen HRB 34388\nRundum Sorglos Holding AG – Essen",
      "type": "Einreichung neuer Dokumente",
      "state": "Nordrhein-Westfalen",
      "amtsgericht": "Amtsgericht Essen",
      "registernummer": "HRB 34388",
      "registerart": "HRB",
      "company_name": "Rundum Sorglos Holding AG",
      "company_seat": "Essen",
      "details": "13.10.2025 (Bekanntmachungsdatum)\n\nNordrhein-Westfalen Amtsgericht Essen HRB 34388\nEinreichung neuer Dokumente 13.10.2025 (Eintragungsdatum)\n\nRundum Sorglos Holding AG\nAktiengesellschaft\nEssen\n\nDem Registergericht ist eine neue Liste der Mitglieder des Aufsichtsrates eingereicht worden."
    },
    {
      "date": "2025-10-13",
      "id": "133724",
      "original_text": "Löschungsankündigung\nNordrhein-Westfalen Amtsgericht Köln HRB 116111\nGameday GmbH – Köln",
      "type": "Löschungsankündigung",
      "state": "Nordrhein-Westfalen",
      "amtsgericht": "Amtsgericht Köln",
      "registernummer": "HRB 116111",
      "registerart": "HRB",
      "company_name": "Gameday GmbH",
      "company_seat": "Köln",
      "details": "13.10.2025 (Bekanntmachungsdatum)\n\nNordrhein-Westfalen Amtsgericht Köln HRB 116111\nLöschungsankündigung\n\nGameday GmbH\nGesellschaft mit beschränkter Haftung\nKöln\n\nDas Registergericht beabsichtigt die Gesellschaft von Amts wegen nach § 394 FamFG zu löschen. Die Frist zur Erhebung eines Widerspruchs ist auf einen Monat festgesetzt."
    },
    {
      "date": "2025-10-13",
      "id": "133725",
      "original_text": "Registerbekanntmachung nach dem Umwandlungsgesetz\nNordrhein-Westfalen Amtsgericht Mönchengladbach HRB 5110\nPalm & Kropp GmbH – Mönchengladbach",
      "type": "Registerbekanntmachung nach dem Umwandlungsgesetz",
      "state": "Nordrhein-Westfalen",
      "amtsgericht": "Amtsgericht Mönchengladbach",
      "registernummer": "HRB 5110",
      "registerart": "HRB",
      "company_name": "Palm & Kropp GmbH",
      "company_seat": "Mönchengladbach",
      "details": "13.10.2025 (Bekanntmachungsdatum)\n\nNordrhein-Westfalen Amtsgericht Mönchengladbach HRB 5110\nRegisterbekanntmachung nach dem Umwandlungsgesetz 13.10.2025 (Eintragungsdatum)\n\nPalm & Kropp GmbH\nGesellschaft mit beschränkter Haftung\nMönchengladbach\n\nDen Gläubigern der an der Verschmelzung beteiligten Rechtsträger ist, wenn sie binnen sechs Monaten nach dem Tag, an dem die Eintragung der Verschmelzung in das Register des Sitzes desjenigen Rechtsträgers, dessen Gläubiger sie sind, nach § 19 Absatz 3 UmwG als bekanntgemacht gilt, ihren Anspruch nach Grund und Höhe schriftlich anmelden, Sicherheit zu leisten, soweit sie nicht Befriedigung verlangen können. Dieses Recht steht den Gläubigern jedoch nur zu, wenn sie glaubhaft machen, dass durch die Verschmelzung die Erfüllung ihrer Forderung gefährdet wird."
    },
    {
      "date": "2025-10-13",
      "id": "133726",
      "original_text": "Registerbekanntmachung nach dem Umwandlungsgesetz\nNordrhein-Westfalen Amtsgericht Köln HRA 38048\nRadium Pensionsverwaltung GmbH & Co. KG – Wipperfürth",
      "type": "Registerbekanntmachung nach dem Umwandlungsgesetz",
      "state": "Nordrhein-Westfalen",
      "amtsgericht": "Amtsgericht Köln",
      "registernummer": "HRA 38048",
      "registerart": "HRA",
      "company_name": "Radium Pensionsverwaltung GmbH & Co. KG",
      "company_seat": "Wipperfürth",
      "details": "13.10.2025 (Bekanntmachungsdatum)\n\nNordrhein-Westfalen Amtsgericht Köln HRA 38048\nRegisterbekanntmachung nach dem Umwandlungsgesetz 13.10.2025 (Eintragungsdatum)\n\nRadium Pensionsverwaltung GmbH & Co. KG\nKommanditgesellschaft\nWipperfürth\n\nDen Gläubigern der an der Ausgliederung beteiligten Rechtsträger ist, wenn sie binnen sechs Monaten nach dem Tag, an dem die Eintragung der Ausgliederung in das Register des Sitzes desjenigen Rechtsträgers, dessen Gläubiger sie sind, nach § 19 Absatz 3 UmwG als bekanntgemacht gilt, ihren Anspruch nach Grund und Höhe schriftlich anmelden, Sicherheit zu leisten, soweit sie nicht Befriedigung verlangen können. Dieses Recht steht den Gläubigern jedoch nur zu, wenn sie glaubhaft machen, dass durch die Ausgliederung die Erfüllung ihrer Forderung gefährdet wird."
    },
    {
      "date": "2025-10-13",
      "id": "133727",
      "original_text": "Löschungsankündigung\nNordrhein-Westfalen Amtsgericht Steinfurt HRB 12814\nLa Bella Vida UG (haftungsbeschränkt) – Ladbergen",
      "type": "Löschungsankündigung",
      "state": "Nordrhein-Westfalen",
      "amtsgericht": "Amtsgericht Steinfurt",
      "registernummer": "HRB 12814",
      "registerart": "HRB",
      "company_name": "La Bella Vida UG (haftungsbeschränkt)",
      "company_seat": "Ladbergen",
      "details": "13.10.2025 (Bekanntmachungsdatum)\n\nNordrhein-Westfalen Amtsgericht Steinfurt HRB 12814\nLöschungsankündigung 10.10.2025 (Eintragungsdatum)\n\nLa Bella Vida UG (haftungsbeschränkt)\nGesellschaft mit beschränkter Haftung\nLadbergen\n\nDas Registergericht beabsichtigt, die im Handelsregister eingetragene Firma von Amts wegen nach §§ 31 Abs. 2, 6 HGB, § 393 FamFG zu löschen.\n\nGegen diese Verfügung kann Widerspruch eingelegt werden. Die Frist zur Erhebung eines Widerspruchs gegen die beabsichtigte Löschung von Amts wegen ist auf einen Monat festgesetzt.\n\nRechtsbehelfsbelehrung:\n\nGegen diese Verfügung können Sie Widerspruch einlegen.\n\nDer Widerspruch ist bei dem Amtsgericht Steinfurt, Gerichtstraße 2, 48565 Steinfurt schriftlich in deutscher Sprache oder zur Niederschrift der Geschäftsstelle einzulegen. Der Widerspruch kann auch zur Niederschrift der Geschäftsstelle eines jeden Amtsgerichtes abgegeben werden.\nDie Einlegung ist auch durch Übertragung eines elektronischen Dokuments an die elektronische Poststelle des Gerichts möglich. Das elektronische Dokument muss für die Bearbeitung durch das Gericht geeignet und mit einer qualifizierten elektronischen Signatur der verantwortenden Person versehen sein oder von der verantwortenden Person signiert und auf einem sicheren Übermittlungsweg gemäß § 130 a ZPO nach näherer Maßgabe der Verordnung über die technischen Rahmenbedingungen des elektronischen Rechtsverkehrs und über das besondere elektronische Behördenpostfach (BGBl. I, S.3803) eingereicht werden. Weitere Informationen erhalten Sie auf der Internetseite www.justiz.de.\n\nDer Widerspruch muss spätestens innerhalb der gesetzten Frist bei dem Amtsgericht Steinfurt eingegangen sein. Dies gilt auch dann, wenn der Widerspruch zur Niederschrift der Geschäftsstelle eines anderen Amtsgerichtes abgegeben wurde. Die Frist beginnt mit der Veröffentlichung. Fällt das Ende der Frist auf einen Sonntag, einen allgemeinen Feiertag oder Sonnabend, so endet die Frist mit Ablauf des nächsten Werktages.\n\nDer Widerspruch muss die Bezeichnung der angefochtenen Verfügung sowie die Erklärung enthalten, dass Widerspruch gegen diese Verfügung eingelegt wird. Er ist zu unterzeichnen und soll begründet werden."
    },
    {
      "date": "2025-10-13",
      "id": "133728",
      "original_text": "Registerbekanntmachung nach dem Umwandlungsgesetz\nNordrhein-Westfalen Amtsgericht Düsseldorf HRB 59759\nJüntgen Invest GmbH – Düsseldorf",
      "type": "Registerbekanntmachung nach dem Umwandlungsgesetz",
      "state": "Nordrhein-Westfalen",
      "amtsgericht": "Amtsgericht Düsseldorf",
      "registernummer": "HRB 59759",
      "registerart": "HRB",
      "company_name": "Jüntgen Invest GmbH",
      "company_seat": "Düsseldorf",
      "details": "13.10.2025 (Bekanntmachungsdatum)\n\nNordrhein-Westfalen Amtsgericht Düsseldorf HRB 59759\nRegisterbekanntmachung nach dem Umwandlungsgesetz 13.10.2025 (Eintragungsdatum)\n\nJüntgen Invest GmbH\nGesellschaft mit beschränkter Haftung\nDüsseldorf\n\nDen Gläubigern der an der Verschmelzung beteiligten Rechtsträger ist, wenn sie binnen sechs Monaten nach dem Tag, an dem die Eintragung der Verschmelzung in das Register des Sitzes desjenigen Rechtsträgers, dessen Gläubiger sie sind, nach § 19 Absatz 3 UmwG als bekanntgemacht gilt, ihren Anspruch nach Grund und Höhe schriftlich anmelden, Sicherheit zu leisten, soweit sie nicht Befriedigung verlangen können. Dieses Recht steht den Gläubigern jedoch nur zu, wenn sie glaubhaft machen, dass durch die Verschmelzung die Erfüllung ihrer Forderung gefährdet wird."
    },
    {
      "date": "2025-10-13",
      "id": "133729",
      "original_text": "Registerbekanntmachung nach dem Umwandlungsgesetz\nNordrhein-Westfalen Amtsgericht Siegburg HRB 14382\nPIA Industries GmbH – Königswinter",
      "type": "Registerbekanntmachung nach dem Umwandlungsgesetz",
      "state": "Nordrhein-Westfalen",
      "amtsgericht": "Amtsgericht Siegburg",
      "registernummer": "HRB 14382",
      "registerart": "HRB",
      "company_name": "PIA Industries GmbH",
      "company_seat": "Königswinter",
      "details": "13.10.2025 (Bekanntmachungsdatum)\n\nNordrhein-Westfalen Amtsgericht Siegburg HRB 14382\nRegisterbekanntmachung nach dem Umwandlungsgesetz 13.10.2025 (Eintragungsdatum)\n\nPIA Industries GmbH\nGesellschaft mit beschränkter Haftung\nKönigswinter\n\nDen Gläubigern der an der Verschmelzung beteiligten Rechtsträger ist, wenn sie binnen sechs Monaten nach dem Tag, an dem die Eintragung der Verschmelzung in das Register des Sitzes desjenigen Rechtsträgers, dessen Gläubiger sie sind, nach § 19 Absatz 3 UmwG als bekanntgemacht gilt, ihren Anspruch nach Grund und Höhe schriftlich anmelden, Sicherheit zu leisten, soweit sie nicht Befriedigung verlangen können. Dieses Recht steht den Gläubigern jedoch nur zu, wenn sie glaubhaft machen, dass durch die Verschmelzung die Erfüllung ihrer Forderung gefährdet wird."
    },
    {
      "date": "2025-10-13",
      "id": "133730",
      "original_text": "Löschungsankündigung\nNordrhein-Westfalen Amtsgericht Essen HRB 33782\nIFI Tobacco Groß- und Einzelhandel GmbH – Essen",
      "type": "Löschungsankündigung",
      "state": "Nordrhein-Westfalen",
      "amtsgericht": "Amtsgericht Essen",
      "registernummer": "HRB 33782",
      "registerart": "HRB",
      "company_name": "IFI Tobacco Groß- und Einzelhandel GmbH",
      "company_seat": "Essen",
      "details": "13.10.2025 (Bekanntmachungsdatum)\n\nNordrhein-Westfalen Amtsgericht Essen HRB 33782\nLöschungsankündigung\n\nIFI Tobacco Groß- und Einzelhandel GmbH\nGesellschaft mit beschränkter Haftung\nEssen\n\nDas Registergericht beabsichtigt die Gesellschaft von Amts wegen nach § 394 FamFG zu löschen. Die Frist zur Erhebung eines Widerspruchs ist auf einen Monat festgesetzt."
    },
    {
      "date": "2025-10-13",
      "id": "133731",
      "original_text": "Registerbekanntmachung nach dem Umwandlungsgesetz\nNordrhein-Westfalen Amtsgericht Siegen HRB 10713\nPOLYGON Deutschland GmbH – Olpe",
      "type": "Registerbekanntmachung nach dem Umwandlungsgesetz",
      "state": "Nordrhein-Westfalen",
      "amtsgericht": "Amtsgericht Siegen",
      "registernummer": "HRB 10713",
      "registerart": "HRB",
      "company_name": "POLYGON Deutschland GmbH",
      "company_seat": "Olpe",
      "details": "13.10.2025 (Bekanntmachungsdatum)\n\nNordrhein-Westfalen Amtsgericht Siegen HRB 10713\nRegisterbekanntmachung nach dem Umwandlungsgesetz 13.10.2025 (Eintragungsdatum)\n\nPOLYGON Deutschland GmbH\nGesellschaft mit beschränkter Haftung\nOlpe\n\nDen Gläubigern der an der Verschmelzung beteiligten Rechtsträger ist, wenn sie binnen sechs Monaten nach dem Tag, an dem die Eintragung der Verschmelzung in das Register des Sitzes derjenigen Rechtsträger deren Gläubiger sie sind, nach § 19 Absatz 3 UmwG als bekanntgemacht gilt, ihren Anspruch nach Grund und Höhe schriftlich anmelden, Sicherheit zu leisten, soweit sie nicht Befriedigung verlangen können. Dieses Recht steht den Gläubigern jedoch nur zu, wenn sie glaubhaft machen, dass durch die Verschmelzung die Erfüllung ihrer Forderung gefährdet wird."
    },
    {
      "date": "2025-10-13",
      "id": "133732",
      "original_text": "Löschungsankündigung\nNordrhein-Westfalen Amtsgericht Bochum HRB 15288\nDie 2 GmbH – Bochum",
      "type": "Löschungsankündigung",
      "state": "Nordrhein-Westfalen",
      "amtsgericht": "Amtsgericht Bochum",
      "registernummer": "HRB 15288",
      "registerart": "HRB",
      "company_name": "Die 2 GmbH",
      "company_seat": "Bochum",
      "details": "13.10.2025 (Bekanntmachungsdatum)\n\nNordrhein-Westfalen Amtsgericht Bochum HRB 15288\nLöschungsankündigung\n\nDie 2 GmbH\nGesellschaft mit beschränkter Haftung\nBochum\n\nDas Registergericht beabsichtigt die Gesellschaft von Amts wegen nach § 394 FamFG zu löschen. Die Frist zur Erhebung eines Widerspruchs ist auf drei Monate festgesetzt."
    },
    {
      "date": "2025-10-13",
      "id": "133733",
      "original_text": "Registerbekanntmachung nach dem Umwandlungsgesetz\nNordrhein-Westfalen Amtsgericht Siegen HRB 12832\nTKL GmbH – Olpe",
      "type": "Registerbekanntmachung nach dem Umwandlungsgesetz",
      "state": "Nordrhein-Westfalen",
      "amtsgericht": "Amtsgericht Siegen",
      "registernummer": "HRB 12832",
      "registerart": "HRB",
      "company_name": "TKL GmbH",
      "company_seat": "Olpe",
      "details": "13.10.2025 (Bekanntmachungsdatum)\n\nNordrhein-Westfalen Amtsgericht Siegen HRB 12832\nRegisterbekanntmachung nach dem Umwandlungsgesetz 13.10.2025 (Eintragungsdatum)\n\nTKL GmbH\nGesellschaft mit beschränkter Haftung\nOlpe\n\nDen Gläubigern der an der Verschmelzung beteiligten Rechtsträger ist, wenn sie binnen sechs Monaten nach dem Tag, an dem die Eintragung der Verschmelzung in das Register des Sitzes derjenigen Rechtsträger deren Gläubiger sie sind, nach § 19 Absatz 3 UmwG als bekanntgemacht gilt, ihren Anspruch nach Grund und Höhe schriftlich anmelden, Sicherheit zu leisten, soweit sie nicht Befriedigung verlangen können. Dieses Recht steht den Gläubigern jedoch nur zu, wenn sie glaubhaft machen, dass durch die Verschmelzung die Erfüllung ihrer Forderung gefährdet wird."
    },
    {
      "date": "2025-10-13",
      "id": "133734",
      "original_text": "Löschungsankündigung\nNordrhein-Westfalen Amtsgericht Dortmund HRB 29786\nD&B International Trading GmbH – Lünen",
      "type": "Löschungsankündigung",
      "state": "Nordrhein-Westfalen",
      "amtsgericht": "Amtsgericht Dortmund",
      "registernummer": "HRB 29786",
      "registerart": "HRB",
      "company_name": "D&B International Trading GmbH",
      "company_seat": "Lünen",
      "details": "13.10.2025 (Bekanntmachungsdatum)\n\nNordrhein-Westfalen Amtsgericht Dortmund HRB 29786\nLöschungsankündigung\n\nD&B International Trading GmbH\nGesellschaft mit beschränkter Haftung\nLünen\n\nDas Registergericht beabsichtigt die Gesellschaft von Amts wegen nach § 394 FamFG zu löschen. Die Frist zur Erhebung eines Widerspruchs ist auf zwei Monate festgesetzt."
    },
    {
      "date": "2025-10-13",
      "id": "133735",
      "original_text": "Registerbekanntmachung nach dem Umwandlungsgesetz\nNordrhein-Westfalen Amtsgericht Wuppertal GsR 357\nBizjak Immobilien eGbR – Erkrath",
      "type": "Registerbekanntmachung nach dem Umwandlungsgesetz",
      "state": "Nordrhein-Westfalen",
      "amtsgericht": "Amtsgericht Wuppertal",
      "registernummer": "GsR 357",
      "registerart": "GsR",
      "company_name": "Bizjak Immobilien eGbR",
      "company_seat": "Erkrath",
      "details": "13.10.2025 (Bekanntmachungsdatum)\n\nNordrhein-Westfalen Amtsgericht Wuppertal GsR 357\nRegisterbekanntmachung nach dem Umwandlungsgesetz 13.10.2025 (Eintragungsdatum)\n\nBizjak Immobilien eGbR\nGesellschaft bürgerlichen Rechts\nErkrath\n\nDen Gläubigern der an der formwechselnden Umwandlung beteiligten Rechtsträger ist, wenn sie binnen sechs Monaten nach dem Tag, an dem die Eintragung der formwechselnden Umwandlung in das Register des Sitzes desjenigen Rechtsträgers, dessen Gläubiger sie sind, nach § 19 Absatz 3 UmwG als bekanntgemacht gilt, ihren Anspruch nach Grund und Höhe schriftlich anmelden, Sicherheit zu leisten, soweit sie nicht Befriedigung verlangen können. Dieses Recht steht den Gläubigern jedoch nur zu, wenn sie glaubhaft machen, dass durch die formwechselnden Umwandlung die Erfüllung ihrer Forderung gefährdet wird."
    },
    {
      "date": "2025-10-13",
      "id": "133736",
      "original_text": "Registerbekanntmachung nach dem Umwandlungsgesetz\nNordrhein-Westfalen Amtsgericht Wuppertal HRB 36149\nBizjak Immobilien GmbH – Erkrath",
      "type": "Registerbekanntmachung nach dem Umwandlungsgesetz",
      "state": "Nordrhein-Westfalen",
      "amtsgericht": "Amtsgericht Wuppertal",
      "registernummer": "HRB 36149",
      "registerart": "HRB",
      "company_name": "Bizjak Immobilien GmbH",
      "company_seat": "Erkrath",
      "details": "13.10.2025 (Bekanntmachungsdatum)\n\nNordrhein-Westfalen Amtsgericht Wuppertal HRB 36149\nRegisterbekanntmachung nach dem Umwandlungsgesetz 13.10.2025 (Eintragungsdatum)\n\nBizjak Immobilien GmbH\nGesellschaft mit beschränkter Haftung\nErkrath\n\nDen Gläubigern der an der formwechselnden Umwandlung beteiligten Rechtsträger ist, wenn sie binnen sechs Monaten nach dem Tag, an dem die Eintragung der formwechselnden Umwandlung in das Register des Sitzes desjenigen Rechtsträgers, dessen Gläubiger sie sind, nach § 19 Absatz 3 UmwG als bekanntgemacht gilt, ihren Anspruch nach Grund und Höhe schriftlich anmelden, Sicherheit zu leisten, soweit sie nicht Befriedigung verlangen können. Dieses Recht steht den Gläubigern jedoch nur zu, wenn sie glaubhaft machen, dass durch die formwechselnden Umwandlung die Erfüllung ihrer Forderung gefährdet wird."
    },
    {
      "date": "2025-10-13",
      "id": "133737",
      "original_text": "Registerbekanntmachung nach dem Umwandlungsgesetz\nNordrhein-Westfalen Amtsgericht Bochum HRB 22639\nGlubo Immobilien GmbH – Bochum",
      "type": "Registerbekanntmachung nach dem Umwandlungsgesetz",
      "state": "Nordrhein-Westfalen",
      "amtsgericht": "Amtsgericht Bochum",
      "registernummer": "HRB 22639",
      "registerart": "HRB",
      "company_name": "Glubo Immobilien GmbH",
      "company_seat": "Bochum",
      "details": "13.10.2025 (Bekanntmachungsdatum)\n\nNordrhein-Westfalen Amtsgericht Bochum HRB 22639\nRegisterbekanntmachung nach dem Umwandlungsgesetz 15.09.2025 (Eintragungsdatum)\n\nGlubo Immobilien GmbH\nGesellschaft mit beschränkter Haftung\nBochum\n\nDen Gläubigern der an der Ausgliederung beteiligten Rechtsträger ist, wenn sie binnen sechs Monaten nach dem Tag, an dem die Eintragung der Ausgliederung in das Register des Sitzes derjenigen Rechtsträger deren Gläubiger sie sind, nach § 19 Absatz 3 UmwG als bekanntgemacht gilt, ihren Anspruch nach Grund und Höhe schriftlich anmelden, Sicherheit zu leisten, soweit sie nicht Befriedigung verlangen können. Dieses Recht steht den Gläubigern jedoch nur zu, wenn sie glaubhaft machen, dass durch die Ausgliederung die Erfüllung ihrer Forderung gefährdet wird."
    },
    {
      "date": "2025-10-13",
      "id": "133738",
      "original_text": "Löschungsankündigung\nNordrhein-Westfalen Amtsgericht Köln HRB 59423\nPPR Planen Projektieren Realisieren Limited – Leverkusen",
      "type": "Löschungsankündigung",
      "state": "Nordrhein-Westfalen",
      "amtsgericht": "Amtsgericht Köln",
      "registernummer": "HRB 59423",
      "registerart": "HRB",
      "company_name": "PPR Planen Projektieren Realisieren Limited",
      "company_seat": "Leverkusen",
      "details": "13.10.2025 (Bekanntmachungsdatum)\n\nNordrhein-Westfalen Amtsgericht Köln HRB 59423\nLöschungsankündigung\n\nPPR Planen Projektieren Realisieren Limited\nRechtsform ausländischen Rechts HRB\nLeverkusen\n\nDas Registergericht beabsichtigt die Zweigniederlassung von Amts wegen nach § 394 FamFG zu löschen. Die Frist zur Erhebung eines Widerspruchs ist auf einen Monat festgesetzt."
    },
    {
      "date": "2025-10-13",
      "id": "133739",
      "original_text": "Einreichung neuer Dokumente\nNordrhein-Westfalen Amtsgericht Düsseldorf HRB 65691\nGEA Group Aktiengesellschaft – Düsseldorf",
      "type": "Einreichung neuer Dokumente",
      "state": "Nordrhein-Westfalen",
      "amtsgericht": "Amtsgericht Düsseldorf",
      "registernummer": "HRB 65691",
      "registerart": "HRB",
      "company_name": "GEA Group Aktiengesellschaft",
      "company_seat": "Düsseldorf",
      "details": "13.10.2025 (Bekanntmachungsdatum)\n\nNordrhein-Westfalen Amtsgericht Düsseldorf HRB 65691\nEinreichung neuer Dokumente\n\nGEA Group Aktiengesellschaft\nAktiengesellschaft\nDüsseldorf\n\nDem Registergericht ist eine neue Liste der Mitglieder des Aufsichtsrates eingereicht worden."
    },
    {
      "date": "2025-10-13",
      "id": "133740",
      "original_text": "Einreichung neuer Dokumente\nNordrhein-Westfalen Amtsgericht Düsseldorf HRB 613\nAIR LIQUIDE Deutschland GmbH – Düsseldorf",
      "type": "Einreichung neuer Dokumente",
      "state": "Nordrhein-Westfalen",
      "amtsgericht": "Amtsgericht Düsseldorf",
      "registernummer": "HRB 613",
      "registerart": "HRB",
      "company_name": "AIR LIQUIDE Deutschland GmbH",
      "company_seat": "Düsseldorf",
      "details": "13.10.2025 (Bekanntmachungsdatum)\n\nNordrhein-Westfalen Amtsgericht Düsseldorf HRB 613\nEinreichung neuer Dokumente\n\nAIR LIQUIDE Deutschland GmbH\nGesellschaft mit beschränkter Haftung\nDüsseldorf\n\nDem Registergericht ist eine neue Liste der Mitglieder des Aufsichtsrates eingereicht worden."
    },
    {
      "date": "2025-10-13",
      "id": "133741",
      "original_text": "Löschungsankündigung\nNordrhein-Westfalen Amtsgericht Düren HRB 8354\nASN Bauservice GmbH – Nörvenich",
      "type": "Löschungsankündigung",
      "state": "Nordrhein-Westfalen",
      "amtsgericht": "Amtsgericht Düren",
      "registernummer": "HRB 8354",
      "registerart": "HRB",
      "company_name": "ASN Bauservice GmbH",
      "company_seat": "Nörvenich",
      "details": "13.10.2025 (Bekanntmachungsdatum)\n\nNordrhein-Westfalen Amtsgericht Düren HRB 8354\nLöschungsankündigung 13.10.2025 (Eintragungsdatum)\n\nASN Bauservice GmbH\nGesellschaft mit beschränkter Haftung\nNörvenich\n\nDas Registergericht beabsichtigt die Gesellschaft von Amts wegen nach § 394 FamFG zu löschen. Die Frist zur Erhebung eines Widerspruchs ist auf drei Monate festgesetzt."
    },
    {
      "date": "2025-10-13",
      "id": "133742",
      "original_text": "Registerbekanntmachung nach dem Umwandlungsgesetz\nNordrhein-Westfalen Amtsgericht Essen HRB 37039\nTKMS AG & Co. KGaA – Essen",
      "type": "Registerbekanntmachung nach dem Umwandlungsgesetz",
      "state": "Nordrhein-Westfalen",
      "amtsgericht": "Amtsgericht Essen",
      "registernummer": "HRB 37039",
      "registerart": "HRB",
      "company_name": "TKMS AG & Co. KGaA",
      "company_seat": "Essen",
      "details": "13.10.2025 (Bekanntmachungsdatum)\n\nNordrhein-Westfalen Amtsgericht Essen HRB 37039\nRegisterbekanntmachung nach dem Umwandlungsgesetz 13.10.2025 (Eintragungsdatum)\n\nTKMS AG & Co. KGaA\nKommanditgesellschaft auf Aktien\nEssen\n\nDen Gläubigern der an der Abspaltung beteiligten Rechtsträger ist, wenn sie binnen sechs Monaten nach dem Tag, an dem die Eintragung der Abspaltung in das Register des Sitzes derjenigen Rechtsträger deren Gläubiger sie sind, nach § 19 Absatz 3 UmwG als bekanntgemacht gilt, ihren Anspruch nach Grund und Höhe schriftlich anmelden, Sicherheit zu leisten, soweit sie nicht Befriedigung verlangen können. Dieses Recht steht den Gläubigern jedoch nur zu, wenn sie glaubhaft machen, dass durch die Abspaltung die Erfüllung ihrer Forderung gefährdet wird."
    },
    {
      "date": "2025-10-13",
      "id": "133743",
      "original_text": "Registerbekanntmachung nach dem Umwandlungsgesetz\nNordrhein-Westfalen Amtsgericht Wuppertal HRA 26033\nD. Knie e.K. – Wuppertal",
      "type": "Registerbekanntmachung nach dem Umwandlungsgesetz",
      "state": "Nordrhein-Westfalen",
      "amtsgericht": "Amtsgericht Wuppertal",
      "registernummer": "HRA 26033",
      "registerart": "HRA",
      "company_name": "D. Knie e.K.",
      "company_seat": "Wuppertal",
      "details": "13.10.2025 (Bekanntmachungsdatum)\n\nNordrhein-Westfalen Amtsgericht Wuppertal HRA 26033\nRegisterbekanntmachung nach dem Umwandlungsgesetz 13.10.2025 (Eintragungsdatum)\n\nD. Knie e.K.\nEinzelkaufmann / Einzelkauffrau\nWuppertal\n\nDen Gläubigern der an der Ausgliederung beteiligten Rechtsträger ist, wenn sie binnen sechs Monaten nach dem Tag, an dem die Eintragung der Ausgliederung in das Register des Sitzes desjenigen Rechtsträgers, dessen Gläubiger sie sind, nach § 19 Absatz 3 UmwG als bekanntgemacht gilt, ihren Anspruch nach Grund und Höhe schriftlich anmelden, Sicherheit zu leisten, soweit sie nicht Befriedigung verlangen können. Dieses Recht steht den Gläubigern jedoch nur zu, wenn sie glaubhaft machen, dass durch die Ausgliederung die Erfüllung ihrer Forderung gefährdet wird."
    },
    {
      "date": "2025-10-13",
      "id": "133744",
      "original_text": "Registerbekanntmachung nach dem Umwandlungsgesetz\nNordrhein-Westfalen Amtsgericht Hamm HRA 1988\nZeitungsverlag Rubens GmbH & Co. KG – Unna",
      "type": "Registerbekanntmachung nach dem Umwandlungsgesetz",
      "state": "Nordrhein-Westfalen",
      "amtsgericht": "Amtsgericht Hamm",
      "registernummer": "HRA 1988",
      "registerart": "HRA",
      "company_name": "Zeitungsverlag Rubens GmbH & Co. KG",
      "company_seat": "Unna",
      "details": "13.10.2025 (Bekanntmachungsdatum)\n\nNordrhein-Westfalen Amtsgericht Hamm HRA 1988\nRegisterbekanntmachung nach dem Umwandlungsgesetz 13.10.2025 (Eintragungsdatum)\n\nZeitungsverlag Rubens GmbH & Co. KG\nKommanditgesellschaft\nUnna\n\nDen Gläubigern der an der Ausgliederung beteiligten Rechtsträger ist, wenn sie binnen sechs Monaten nach dem Tag, an dem die Eintragung der Ausgliederung in das Register des Sitzes derjenigen Rechtsträger deren Gläubiger sie sind, nach § 19 Absatz 3 UmwG als bekanntgemacht gilt, ihren Anspruch nach Grund und Höhe schriftlich anmelden, Sicherheit zu leisten, soweit sie nicht Befriedigung verlangen können. Dieses Recht steht den Gläubigern jedoch nur zu, wenn sie glaubhaft machen, dass durch die Ausgliederung die Erfüllung ihrer Forderung gefährdet wird."
    },
    {
      "date": "2025-10-13",
      "id": "133745",
      "original_text": "Registerbekanntmachung nach dem Umwandlungsgesetz\nNordrhein-Westfalen Amtsgericht Hamm HRA 4684\nCarsten Herzig e.K. – Unna",
      "type": "Registerbekanntmachung nach dem Umwandlungsgesetz",
      "state": "Nordrhein-Westfalen",
      "amtsgericht": "Amtsgericht Hamm",
      "registernummer": "HRA 4684",
      "registerart": "HRA",
      "company_name": "Carsten Herzig e.K.",
      "company_seat": "Unna",
      "details": "13.10.2025 (Bekanntmachungsdatum)\n\nNordrhein-Westfalen Amtsgericht Hamm HRA 4684\nRegisterbekanntmachung nach dem Umwandlungsgesetz 07.10.2025 (Eintragungsdatum)\n\nCarsten Herzig e.K.\nEinzelkaufmann / Einzelkauffrau\nUnna\n\nDen Gläubigern der an der Verschmelzung beteiligten Rechtsträger ist, wenn sie binnen sechs Monaten nach dem Tag, an dem die Eintragung der Verschmelzung in das Register des Sitzes desjenigen Rechtsträgers, dessen Gläubiger sie sind, nach § 19 Absatz 3 UmwG als bekanntgemacht gilt, ihren Anspruch nach Grund und Höhe schriftlich anmelden, Sicherheit zu leisten, soweit sie nicht Befriedigung verlangen können. Dieses Recht steht den Gläubigern jedoch nur zu, wenn sie glaubhaft machen, dass durch die Verschmelzung die Erfüllung ihrer Forderung gefährdet wird."
    },
    {
      "date": "2025-10-13",
      "id": "133746",
      "original_text": "Einreichung neuer Dokumente\nNordrhein-Westfalen Amtsgericht Dortmund HRB 35894\nSIBA Holding Verwaltungs GmbH – Lünen",
      "type": "Einreichung neuer Dokumente",
      "state": "Nordrhein-Westfalen",
      "amtsgericht": "Amtsgericht Dortmund",
      "registernummer": "HRB 35894",
      "registerart": "HRB",
      "company_name": "SIBA Holding Verwaltungs GmbH",
      "company_seat": "Lünen",
      "details": "13.10.2025 (Bekanntmachungsdatum)\n\nNordrhein-Westfalen Amtsgericht Dortmund HRB 35894\nEinreichung neuer Dokumente 13.10.2025 (Eintragungsdatum)\n\nSIBA Holding Verwaltungs GmbH\nGesellschaft mit beschränkter Haftung\nLünen\n\nDem Registergericht ist eine Liste der Mitglieder des Aufsichtsrates eingereicht worden."
    },
    {
      "date": "2025-10-13",
      "id": "133747",
      "original_text": "Registerbekanntmachung nach dem Umwandlungsgesetz\nHessen Amtsgericht Darmstadt HRB 106275\nNovozymes Deutschland GmbH – Groß-Gerau",
      "type": "Registerbekanntmachung nach dem Umwandlungsgesetz",
      "state": "Hessen",
      "amtsgericht": "Amtsgericht Darmstadt",
      "registernummer": "HRB 106275",
      "registerart": "HRB",
      "company_name": "Novozymes Deutschland GmbH",
      "company_seat": "Groß-Gerau",
      "details": "13.10.2025 (Bekanntmachungsdatum)\n\nHessen Amtsgericht Darmstadt HRB 106275\nRegisterbekanntmachung nach dem Umwandlungsgesetz 13.10.2025 (Eintragungsdatum)\n\nNovozymes Deutschland GmbH\nGesellschaft mit beschränkter Haftung\nGroß-Gerau\n\nDen Gläubigern der an der Verschmelzung beteiligten Rechtsträger ist, wenn sie binnen sechs Monaten nach dem Tag, an dem die Eintragung der Verschmelzung in das Register des Sitzes derjenigen Rechtsträger deren Gläubiger sie sind, nach § 19 Absatz 3 UmwG bekannt gemacht worden ist, ihren Anspruch nach Grund und Höhe schriftlich anmelden, Sicherheit zu leisten, soweit sie nicht Befriedigung verlangen können. Dieses Recht steht den Gläubigern jedoch nur zu, wenn sie glaubhaft machen, dass durch die Verschmelzung die Erfüllung ihrer Forderung gefährdet wird."
    },
    {
      "date": "2025-10-13",
      "id": "133748",
      "original_text": "Löschungsankündigung\nHessen Amtsgericht Wiesbaden HRB 33794\nQUZO GmbH – Wiesbaden",
      "type": "Löschungsankündigung",
      "state": "Hessen",
      "amtsgericht": "Amtsgericht Wiesbaden",
      "registernummer": "HRB 33794",
      "registerart": "HRB",
      "company_name": "QUZO GmbH",
      "company_seat": "Wiesbaden",
      "details": "13.10.2025 (Bekanntmachungsdatum)\n\nHessen Amtsgericht Wiesbaden HRB 33794\nLöschungsankündigung\n\nQUZO GmbH\nGesellschaft mit beschränkter Haftung\nWiesbaden\n\nDas Registergericht beabsichtigt die im Handelsregister eingetragene Gesellschaft von Amts wegen nach § 394 FamFG zu löschen. Die Frist zur Erhebung eines Widerspruchs gegen die beabsichtigte Löschung wird auf 3 Monate festgesetzt."
    },
    {
      "date": "2025-10-13",
      "id": "133749",
      "original_text": "Löschungsankündigung\nHessen Amtsgericht Bad Hersfeld HRB 2648\nBoris Bütefür Fashion GmbH – Friedewald",
      "type": "Löschungsankündigung",
      "state": "Hessen",
      "amtsgericht": "Amtsgericht Bad Hersfeld",
      "registernummer": "HRB 2648",
      "registerart": "HRB",
      "company_name": "Boris Bütefür Fashion GmbH",
      "company_seat": "Friedewald",
      "details": "13.10.2025 (Bekanntmachungsdatum)\n\nHessen Amtsgericht Bad Hersfeld HRB 2648\nLöschungsankündigung\n\nBoris Bütefür Fashion GmbH\nGesellschaft mit beschränkter Haftung\nFriedewald\n\nDas Registergericht beabsichtigt die im Handelsregister eingetragene Gesellschaft von Amts wegen nach § 394 FamFG zu löschen. Die Frist zur Erhebung eines Widerspruchs gegen die beabsichtigte Löschung wird auf 6 Wochen festgesetzt."
    },
    {
      "date": "2025-10-13",
      "id": "133750",
      "original_text": "Registerbekanntmachung nach dem Umwandlungsgesetz\nHessen Amtsgericht Gießen HRB 11425\nSpeedy Rugs UG (haftungsbeschränkt) – Lich",
      "type": "Registerbekanntmachung nach dem Umwandlungsgesetz",
      "state": "Hessen",
      "amtsgericht": "Amtsgericht Gießen",
      "registernummer": "HRB 11425",
      "registerart": "HRB",
      "company_name": "Speedy Rugs UG (haftungsbeschränkt)",
      "company_seat": "Lich",
      "details": "13.10.2025 (Bekanntmachungsdatum)\n\nHessen Amtsgericht Gießen HRB 11425\nRegisterbekanntmachung nach dem Umwandlungsgesetz 13.10.2025 (Eintragungsdatum)\n\nSpeedy Rugs UG (haftungsbeschränkt)\nGesellschaft mit beschränkter Haftung\nLich\n\nDen Gläubigern der an der Verschmelzung beteiligten Rechtsträger ist, wenn sie binnen sechs Monaten nach dem Tag, an dem die Eintragung der Verschmelzung in das Register des Sitzes desjenigen Rechtsträgers, dessen Gläubiger sie sind, nach § 19 Absatz 3 UmwG bekannt gemacht worden ist, ihren Anspruch nach Grund und Höhe schriftlich anmelden, Sicherheit zu leisten, soweit sie nicht Befriedigung verlangen können. Dieses Recht steht den Gläubigern jedoch nur zu, wenn sie glaubhaft machen, dass durch die Verschmelzung die Erfüllung ihrer Forderung gefährdet wird."
    },
    {
      "date": "2025-10-13",
      "id": "133751",
      "original_text": "Registerbekanntmachung nach dem Umwandlungsgesetz\nHessen Amtsgericht Kassel HRB 20419\nE+S Immobilienverwaltungs-GmbH – Baunatal",
      "type": "Registerbekanntmachung nach dem Umwandlungsgesetz",
      "state": "Hessen",
      "amtsgericht": "Amtsgericht Kassel",
      "registernummer": "HRB 20419",
      "registerart": "HRB",
      "company_name": "E+S Immobilienverwaltungs-GmbH",
      "company_seat": "Baunatal",
      "details": "13.10.2025 (Bekanntmachungsdatum)\n\nHessen Amtsgericht Kassel HRB 20419\nRegisterbekanntmachung nach dem Umwandlungsgesetz 13.10.2025 (Eintragungsdatum)\n\nE+S Immobilienverwaltungs-GmbH\nGesellschaft mit beschränkter Haftung\nBaunatal\n\nDen Gläubigern der an der formwechselnden Umwandlung beteiligten Rechtsträger ist, wenn sie binnen sechs Monaten nach dem Tag, an dem die Eintragung der formwechselnden Umwandlung in das Register des Sitzes desjenigen Rechtsträgers, dessen Gläubiger sie sind, nach § 201 UmwG bekannt gemacht worden ist, ihren Anspruch nach Grund und Höhe schriftlich anmelden, Sicherheit zu leisten, soweit sie nicht Befriedigung verlangen können. Dieses Recht steht den Gläubigern jedoch nur zu, wenn sie glaubhaft machen, dass durch die formwechselnden Umwandlung die Erfüllung ihrer Forderung gefährdet wird."
    },
    {
      "date": "2025-10-13",
      "id": "133752",
      "original_text": "Registerbekanntmachung nach dem Umwandlungsgesetz\nHessen Amtsgericht Kassel GsR 43\nE+S Immobilienverwaltungs-eGbR – Baunatal",
      "type": "Registerbekanntmachung nach dem Umwandlungsgesetz",
      "state": "Hessen",
      "amtsgericht": "Amtsgericht Kassel",
      "registernummer": "GsR 43",
      "registerart": "GsR",
      "company_name": "E+S Immobilienverwaltungs-eGbR",
      "company_seat": "Baunatal",
      "details": "13.10.2025 (Bekanntmachungsdatum)\n\nHessen Amtsgericht Kassel GsR 43\nRegisterbekanntmachung nach dem Umwandlungsgesetz 13.10.2025 (Eintragungsdatum)\n\nE+S Immobilienverwaltungs-eGbR\nGesellschaft bürgerlichen Rechts\nBaunatal\n\nDen Gläubigern der an der formwechselnden Umwandlung beteiligten Rechtsträger ist, wenn sie binnen sechs Monaten nach dem Tag, an dem die Eintragung der formwechselnden Umwandlung in das Register des Sitzes desjenigen Rechtsträgers, dessen Gläubiger sie sind, nach § 201 UmwG bekannt gemacht worden ist, ihren Anspruch nach Grund und Höhe schriftlich anmelden, Sicherheit zu leisten, soweit sie nicht Befriedigung verlangen können. Dieses Recht steht den Gläubigern jedoch nur zu, wenn sie glaubhaft machen, dass durch die formwechselnden Umwandlung die Erfüllung ihrer Forderung gefährdet wird."
    },
    {
      "date": "2025-10-13",
      "id": "133753",
      "original_text": "Löschungsankündigung\nHessen Amtsgericht Frankfurt am Main HRB 124393\nBA EM GmbH – Frankfurt am Main",
      "type": "Löschungsankündigung",
      "state": "Hessen",
      "amtsgericht": "Amtsgericht Frankfurt am Main",
      "registernummer": "HRB 124393",
      "registerart": "HRB",
      "company_name": "BA EM GmbH",
      "company_seat": "Frankfurt am Main",
      "details": "13.10.2025 (Bekanntmachungsdatum)\n\nHessen Amtsgericht Frankfurt am Main HRB 124393\nLöschungsankündigung\n\nBA EM GmbH\nGesellschaft mit beschränkter Haftung\nFrankfurt am Main\n\nDas Registergericht beabsichtigt die im Handelsregister eingetragene Gesellschaft von Amts wegen nach § 394 FamFG zu löschen. Die Frist zur Erhebung eines Widerspruchs gegen die beabsichtigte Löschung wird auf 1 Monat festgesetzt."
    },
    {
      "date": "2025-10-13",
      "id": "133754",
      "original_text": "Einreichung neuer Dokumente\nHessen Amtsgericht Frankfurt am Main HRB 133436\nTruffle Holding AG – Frankfurt am Main",
      "type": "Einreichung neuer Dokumente",
      "state": "Hessen",
      "amtsgericht": "Amtsgericht Frankfurt am Main",
      "registernummer": "HRB 133436",
      "registerart": "HRB",
      "company_name": "Truffle Holding AG",
      "company_seat": "Frankfurt am Main",
      "details": "13.10.2025 (Bekanntmachungsdatum)\n\nHessen Amtsgericht Frankfurt am Main HRB 133436\nEinreichung neuer Dokumente\n\nTruffle Holding AG\nAktiengesellschaft\nFrankfurt am Main\n\nDurch eine Änderung in den Personen der Aufsichtsratsmitglieder ist eine Liste der Mitglieder des Aufsichtsrates zum Handelsregister eingereicht worden."
    },
    {
      "date": "2025-10-13",
      "id": "133755",
      "original_text": "Registerbekanntmachung nach dem Umwandlungsgesetz\nHessen Amtsgericht Friedberg HRB 8515\nVinexus Deutschland GmbH – Butzbach",
      "type": "Registerbekanntmachung nach dem Umwandlungsgesetz",
      "state": "Hessen",
      "amtsgericht": "Amtsgericht Friedberg",
      "registernummer": "HRB 8515",
      "registerart": "HRB",
      "company_name": "Vinexus Deutschland GmbH",
      "company_seat": "Butzbach",
      "details": "13.10.2025 (Bekanntmachungsdatum)\n\nHessen Amtsgericht Friedberg HRB 8515\nRegisterbekanntmachung nach dem Umwandlungsgesetz 13.10.2025 (Eintragungsdatum)\n\nVinexus Deutschland GmbH\nGesellschaft mit beschränkter Haftung\nButzbach\n\nDen Gläubigern der an der Verschmelzung beteiligten Rechtsträger ist, wenn sie binnen sechs Monaten nach dem Tag, an dem die Eintragung der Verschmelzung in das Register des Sitzes desjenigen Rechtsträgers, dessen Gläubiger sie sind, nach § 19 Absatz 3 UmwG bekannt gemacht worden ist, ihren Anspruch nach Grund und Höhe schriftlich anmelden, Sicherheit zu leisten, soweit sie nicht Befriedigung verlangen können. Dieses Recht steht den Gläubigern jedoch nur zu, wenn sie glaubhaft machen, dass durch die Verschmelzung die Erfüllung ihrer Forderung gefährdet wird."
    },
    {
      "date": "2025-10-13",
      "id": "95",
      "original_text": "Sonderregisterbekanntmachung OHNE Bezug zum elektr. Register\nSachsen-Anhalt Amtsgericht Stendal\nHRB 8495\nPeter Müller & Partner GmbH",
      "type": "Sonderregisterbekanntmachung OHNE Bezug zum elektr. Register",
      "state": "Sachsen-Anhalt",
      "amtsgericht": "Amtsgericht Stendal",
      "company_name": "Peter Müller & Partner GmbH",
      "sonderegister_referenz": "HRB 8495",
      "details": "13.10.2025 (Bekanntmachungsdatum)\n\nSachsen-Anhalt Amtsgericht Stendal\nHRB 8495\nSonderregisterbekanntmachung OHNE Bezug zum elektr. Register\n\nPeter Müller & Partner GmbH\n\nHinsichtlich o.g. Gesellschaft ist beabsichtigt, Herrn Peter Müller (* 07.10.1958) wh.: Weißenfels OT Leißlingen zum Nachtragsliquidator mit dem beschränkten Wirkungskreis:\nVertretung der  Peter Müller & Partner GmbH gegenüber der Allianz Lebensversicherung-AG in Bezug auf die bei der Allianz bestehenden Rückversicherungen für Herrn Peter Müller und Frau Almut Scheibert sowie eine etwaige Nachtragsverteilung\nZu bestellen.\nDie Frist zu Einreichung etwaiger Stellungnahmen bzw. Erhebung eines Widerspruchs wird auf 1 Monat festgesetzt."
    }
  ]
}