{
  "date": "2025-10-14",
  "date_of_scrape": "2025-10-27T18:06:07.721Z",
  "tool_version": "0.2.0",
  "number_of_announcements": 176,
  "announcements": [
    {
      "date": "2025-10-14",
      "id": "133756",
      "original_text": "Löschungsankündigung\nBayern Amtsgericht Landshut HRB 10242\nKiefl Pool GmbH – Ergoldsbach",
      "type": "Löschungsankündigung",
      "state": "Bayern",
      "amtsgericht": "Amtsgericht Landshut",
      "registernummer": "HRB 10242",
      "registerart": "HRB",
      "company_name": "Kiefl Pool GmbH",
      "company_seat": "Ergoldsbach",
      "details": "14.10.2025 (Bekanntmachungsdatum)\n\nBayern Amtsgericht Landshut HRB 10242\nLöschungsankündigung\n\nKiefl Pool GmbH\nGesellschaft mit beschränkter Haftung\nErgoldsbach\n\nDas Registergericht beabsichtigt, die im Handelsregister eingetragene Gesellschaft wegen Vermögenslosigkeit von Amts wegen nach § 394 FamFG zu löschen. Die Frist zur Erhebung eines Widerspruchs ist auf einen Monat festgesetzt."
    },
    {
      "date": "2025-10-14",
      "id": "133757",
      "original_text": "Löschungsankündigung\nBayern Amtsgericht München HRB 261031\nFo-Va Bauunternehmung GmbH – München",
      "type": "Löschungsankündigung",
      "state": "Bayern",
      "amtsgericht": "Amtsgericht München",
      "registernummer": "HRB 261031",
      "registerart": "HRB",
      "company_name": "Fo-Va Bauunternehmung GmbH",
      "company_seat": "München",
      "details": "14.10.2025 (Bekanntmachungsdatum)\n\nBayern Amtsgericht München HRB 261031\nLöschungsankündigung 13.10.2025 (Eintragungsdatum)\n\nFo-Va Bauunternehmung GmbH\nGesellschaft mit beschränkter Haftung\nMünchen\n\nDas Registergericht beabsichtigt, die im Handelsregister eingetragene Gesellschaft wegen Vermögenslosigkeit von Amts wegen nach § 394 FamFG zu löschen. Die Frist zur Erhebung eines Widerspruchs ist auf drei Monate festgesetzt."
    },
    {
      "date": "2025-10-14",
      "id": "133758",
      "original_text": "Löschungsankündigung\nBayern Amtsgericht München HRB 148238\nE & U Bauprojektentwicklungsgesellschaft mbH – München",
      "type": "Löschungsankündigung",
      "state": "Bayern",
      "amtsgericht": "Amtsgericht München",
      "registernummer": "HRB 148238",
      "registerart": "HRB",
      "company_name": "E & U Bauprojektentwicklungsgesellschaft mbH",
      "company_seat": "München",
      "details": "14.10.2025 (Bekanntmachungsdatum)\n\nBayern Amtsgericht München HRB 148238\nLöschungsankündigung 10.10.2025 (Eintragungsdatum)\n\nE & U Bauprojektentwicklungsgesellschaft mbH\nGesellschaft mit beschränkter Haftung\nMünchen\n\nDas Registergericht beabsichtigt, die im Handelsregister eingetragene Gesellschaft wegen Vermögenslosigkeit von Amts wegen nach § 394 FamFG zu löschen. Die Frist zur Erhebung eines Widerspruchs ist auf drei Monate festgesetzt."
    },
    {
      "date": "2025-10-14",
      "id": "133759",
      "original_text": "Löschungsankündigung\nBayern Amtsgericht München HRB 225884\nFesta GmbH – München",
      "type": "Löschungsankündigung",
      "state": "Bayern",
      "amtsgericht": "Amtsgericht München",
      "registernummer": "HRB 225884",
      "registerart": "HRB",
      "company_name": "Festa GmbH",
      "company_seat": "München",
      "details": "14.10.2025 (Bekanntmachungsdatum)\n\nBayern Amtsgericht München HRB 225884\nLöschungsankündigung 13.10.2025 (Eintragungsdatum)\n\nFesta GmbH\nGesellschaft mit beschränkter Haftung\nMünchen\n\nDas Registergericht beabsichtigt, die im Handelsregister eingetragene Gesellschaft wegen Vermögenslosigkeit von Amts wegen nach § 394 FamFG zu löschen. Die Frist zur Erhebung eines Widerspruchs ist auf drei Monate festgesetzt."
    },
    {
      "date": "2025-10-14",
      "id": "133760",
      "original_text": "Registerbekanntmachung nach dem Umwandlungsgesetz\nBayern Amtsgericht München HRA 109553\nA-Town High GmbH & Co. KG – München",
      "type": "Registerbekanntmachung nach dem Umwandlungsgesetz",
      "state": "Bayern",
      "amtsgericht": "Amtsgericht München",
      "registernummer": "HRA 109553",
      "registerart": "HRA",
      "company_name": "A-Town High GmbH & Co. KG",
      "company_seat": "München",
      "details": "14.10.2025 (Bekanntmachungsdatum)\n\nBayern Amtsgericht München HRA 109553\nRegisterbekanntmachung nach dem Umwandlungsgesetz 13.10.2025 (Eintragungsdatum)\n\nA-Town High GmbH & Co. KG\nKommanditgesellschaft\nMünchen\n\nDen Gläubigern der an der Verschmelzung beteiligten Rechtsträger ist, wenn sie binnen sechs Monaten nach dem Tag, an dem die Eintragung der Verschmelzung in das Register des Sitzes desjenigen Rechtsträgers, dessen Gläubiger sie sind, nach § 19 Abs. 3 UmwG als bekannt gemacht gilt, ihren Anspruch nach Grund und Höhe in Textform anmelden, Sicherheit zu leisten, soweit sie nicht Befriedigung verlangen können. Dieses Recht steht den Gläubigern jedoch nur zu, wenn sie glaubhaft machen, dass durch die Verschmelzung die Erfüllung ihrer Forderung gefährdet wird."
    },
    {
      "date": "2025-10-14",
      "id": "133761",
      "original_text": "Löschungsankündigung\nBayern Amtsgericht Bayreuth HRB 2223\nDruckhaus Pegnitz GmbH – Pegnitz",
      "type": "Löschungsankündigung",
      "state": "Bayern",
      "amtsgericht": "Amtsgericht Bayreuth",
      "registernummer": "HRB 2223",
      "registerart": "HRB",
      "company_name": "Druckhaus Pegnitz GmbH",
      "company_seat": "Pegnitz",
      "details": "14.10.2025 (Bekanntmachungsdatum)\n\nBayern Amtsgericht Bayreuth HRB 2223\nLöschungsankündigung\n\nDruckhaus Pegnitz GmbH\nGesellschaft mit beschränkter Haftung\nPegnitz\n\nDas Registergericht beabsichtigt, die im Handelsregister eingetragene Gesellschaft wegen Vermögenslosigkeit von Amts wegen nach § 394 FamFG zu löschen. Die Frist zur Erhebung eines Widerspruchs ist auf einen Monat festgesetzt."
    },
    {
      "date": "2025-10-14",
      "id": "133762",
      "original_text": "Löschungsankündigung\nBayern Amtsgericht München HRB 268288\nfu24 Verwaltungs-GmbH – München",
      "type": "Löschungsankündigung",
      "state": "Bayern",
      "amtsgericht": "Amtsgericht München",
      "registernummer": "HRB 268288",
      "registerart": "HRB",
      "company_name": "fu24 Verwaltungs-GmbH",
      "company_seat": "München",
      "details": "14.10.2025 (Bekanntmachungsdatum)\n\nBayern Amtsgericht München HRB 268288\nLöschungsankündigung\n\nfu24 Verwaltungs-GmbH\nGesellschaft mit beschränkter Haftung\nMünchen\n\nDas Registergericht beabsichtigt, die im Handelsregister eingetragene Gesellschaft wegen Vermögenslosigkeit von Amts wegen nach § 394 FamFG zu löschen. Die Frist zur Erhebung eines Widerspruchs ist auf drei Monate festgesetzt."
    },
    {
      "date": "2025-10-14",
      "id": "133763",
      "original_text": "Registerbekanntmachung nach dem Umwandlungsgesetz\nBayern Amtsgericht München HRB 282432\nConnex Holding GmbH – Grünwald",
      "type": "Registerbekanntmachung nach dem Umwandlungsgesetz",
      "state": "Bayern",
      "amtsgericht": "Amtsgericht München",
      "registernummer": "HRB 282432",
      "registerart": "HRB",
      "company_name": "Connex Holding GmbH",
      "company_seat": "Grünwald",
      "details": "14.10.2025 (Bekanntmachungsdatum)\n\nBayern Amtsgericht München HRB 282432\nRegisterbekanntmachung nach dem Umwandlungsgesetz 13.10.2025 (Eintragungsdatum)\n\nConnex Holding GmbH\nGesellschaft mit beschränkter Haftung\nGrünwald\n\nDen Gläubigern der an der Verschmelzung beteiligten Rechtsträger ist, wenn sie binnen sechs Monaten nach dem Tag, an dem die Eintragung der Verschmelzung in das Register des Sitzes desjenigen Rechtsträgers, dessen Gläubiger sie sind, nach § 19 Abs. 3 UmwG als bekannt gemacht gilt, ihren Anspruch nach Grund und Höhe in Textform anmelden, Sicherheit zu leisten, soweit sie nicht Befriedigung verlangen können. Dieses Recht steht den Gläubigern jedoch nur zu, wenn sie glaubhaft machen, dass durch die Verschmelzung die Erfüllung ihrer Forderung gefährdet wird."
    },
    {
      "date": "2025-10-14",
      "id": "133764",
      "original_text": "Löschungsankündigung\nBayern Amtsgericht München HRB 249887\nMaison M Holding UG (haftungsbeschränkt) – München",
      "type": "Löschungsankündigung",
      "state": "Bayern",
      "amtsgericht": "Amtsgericht München",
      "registernummer": "HRB 249887",
      "registerart": "HRB",
      "company_name": "Maison M Holding UG (haftungsbeschränkt)",
      "company_seat": "München",
      "details": "14.10.2025 (Bekanntmachungsdatum)\n\nBayern Amtsgericht München HRB 249887\nLöschungsankündigung 13.10.2025 (Eintragungsdatum)\n\nMaison M Holding UG (haftungsbeschränkt)\nGesellschaft mit beschränkter Haftung\nMünchen\n\nDas Registergericht beabsichtigt, die im Handelsregister eingetragene Gesellschaft wegen Vermögenslosigkeit von Amts wegen nach § 394 FamFG zu löschen. Die Frist zur Erhebung eines Widerspruchs ist auf drei Monate festgesetzt."
    },
    {
      "date": "2025-10-14",
      "id": "133765",
      "original_text": "Löschungsankündigung\nBayern Amtsgericht Augsburg HRB 28623\nToolbox & Services GmbH – Eching am Ammersee",
      "type": "Löschungsankündigung",
      "state": "Bayern",
      "amtsgericht": "Amtsgericht Augsburg",
      "registernummer": "HRB 28623",
      "registerart": "HRB",
      "company_name": "Toolbox & Services GmbH",
      "company_seat": "Eching am Ammersee",
      "details": "14.10.2025 (Bekanntmachungsdatum)\n\nBayern Amtsgericht Augsburg HRB 28623\nLöschungsankündigung\n\nToolbox & Services GmbH\nGesellschaft mit beschränkter Haftung\nEching am Ammersee\n\nDas Registergericht beabsichtigt, die im Handelsregister eingetragene Gesellschaft wegen Vermögenslosigkeit von Amts wegen nach § 394 FamFG zu löschen. Die Frist zur Erhebung eines Widerspruchs ist auf einen Monat festgesetzt."
    },
    {
      "date": "2025-10-14",
      "id": "133766",
      "original_text": "Registerbekanntmachung nach dem Umwandlungsgesetz\nBayern Amtsgericht Landshut HRB 8403\nHans Lindner Familien AG – Arnstorf",
      "type": "Registerbekanntmachung nach dem Umwandlungsgesetz",
      "state": "Bayern",
      "amtsgericht": "Amtsgericht Landshut",
      "registernummer": "HRB 8403",
      "registerart": "HRB",
      "company_name": "Hans Lindner Familien AG",
      "company_seat": "Arnstorf",
      "details": "14.10.2025 (Bekanntmachungsdatum)\n\nBayern Amtsgericht Landshut HRB 8403\nDie Registerbekanntmachung ist nachträglich am 15.10.2025 um 02:01 Uhr gelöscht worden.\nWegen der Einzelheiten und näherer Auskünfte wenden Sie sich bitte an das Amtsgericht Landshut ."
    },
    {
      "date": "2025-10-14",
      "id": "133767",
      "original_text": "Einreichung neuer Dokumente\nBayern Amtsgericht München HRB 275917\nHANLIX Holding AG – Gräfelfing",
      "type": "Einreichung neuer Dokumente",
      "state": "Bayern",
      "amtsgericht": "Amtsgericht München",
      "registernummer": "HRB 275917",
      "registerart": "HRB",
      "company_name": "HANLIX Holding AG",
      "company_seat": "Gräfelfing",
      "details": "14.10.2025 (Bekanntmachungsdatum)\n\nBayern Amtsgericht München HRB 275917\nEinreichung neuer Dokumente 13.10.2025 (Eintragungsdatum)\n\nHANLIX Holding AG\nAktiengesellschaft\nGräfelfing\n\nDem Amtsgericht München -Registergericht- ist eine Liste der Mitglieder des Aufsichtsrats eingereicht worden, § 106 AktG."
    },
    {
      "date": "2025-10-14",
      "id": "133768",
      "original_text": "Löschungsankündigung\nBayern Amtsgericht München HRB 128607\nVerlag für Trabrennsport GmbH – München",
      "type": "Löschungsankündigung",
      "state": "Bayern",
      "amtsgericht": "Amtsgericht München",
      "registernummer": "HRB 128607",
      "registerart": "HRB",
      "company_name": "Verlag für Trabrennsport GmbH",
      "company_seat": "München",
      "details": "14.10.2025 (Bekanntmachungsdatum)\n\nBayern Amtsgericht München HRB 128607\nLöschungsankündigung 13.10.2025 (Eintragungsdatum)\n\nVerlag für Trabrennsport GmbH\nGesellschaft mit beschränkter Haftung\nMünchen\n\nDas Registergericht beabsichtigt, die im Handelsregister eingetragene Gesellschaft wegen Vermögenslosigkeit von Amts wegen nach § 394 FamFG zu löschen. Die Frist zur Erhebung eines Widerspruchs ist auf drei Monate festgesetzt."
    },
    {
      "date": "2025-10-14",
      "id": "133769",
      "original_text": "Registerbekanntmachung nach dem Umwandlungsgesetz\nBayern Amtsgericht München HRB 306264\nAichhof 3 GmbH – Pullach i.Isartal",
      "type": "Registerbekanntmachung nach dem Umwandlungsgesetz",
      "state": "Bayern",
      "amtsgericht": "Amtsgericht München",
      "registernummer": "HRB 306264",
      "registerart": "HRB",
      "company_name": "Aichhof 3 GmbH",
      "company_seat": "Pullach i.Isartal",
      "details": "14.10.2025 (Bekanntmachungsdatum)\n\nBayern Amtsgericht München HRB 306264\nRegisterbekanntmachung nach dem Umwandlungsgesetz 13.10.2025 (Eintragungsdatum)\n\nAichhof 3 GmbH\nGesellschaft mit beschränkter Haftung\nPullach i.Isartal\n\nDen Gläubigern der an der Spaltung beteiligten Rechtsträger ist, wenn sie binnen sechs Monaten nach dem Tag, an dem die Eintragung der Spaltung in das Register des Sitzes desjenigen Rechtsträgers, dessen Gläubiger sie sind, nach §§ 125, 19 Abs. 3 UmwG als bekannt gemacht gilt, ihren Anspruch nach Grund und Höhe in Textform anmelden, Sicherheit zu leisten, soweit sie nicht Befriedigung verlangen können. Dieses Recht steht den Gläubigern jedoch nur zu, wenn sie glaubhaft machen, dass durch die Spaltung die Erfüllung ihrer Forderung gefährdet wird."
    },
    {
      "date": "2025-10-14",
      "id": "133770",
      "original_text": "Registerbekanntmachung nach dem Umwandlungsgesetz\nBayern Amtsgericht Augsburg HRB 28081\nBAYK AG – Aichach",
      "type": "Registerbekanntmachung nach dem Umwandlungsgesetz",
      "state": "Bayern",
      "amtsgericht": "Amtsgericht Augsburg",
      "registernummer": "HRB 28081",
      "registerart": "HRB",
      "company_name": "BAYK AG",
      "company_seat": "Aichach",
      "details": "14.10.2025 (Bekanntmachungsdatum)\n\nBayern Amtsgericht Augsburg HRB 28081\nRegisterbekanntmachung nach dem Umwandlungsgesetz 13.10.2025 (Eintragungsdatum)\n\nBAYK AG\nAktiengesellschaft\nAichach\n\nDen Gläubigern des formwechselnden Rechtsträgers ist, wenn sie binnen sechs Monaten nach dem Tag, an dem die Eintragung des Formwechsels nach § 201 UmwG als bekannt gemacht gilt, ihren Anspruch nach Grund und Höhe in Textform anmelden, Sicherheit zu leisten, soweit sie nicht Befriedigung verlangen können. Dieses Recht steht den Gläubigern jedoch nur zu, wenn sie glaubhaft machen, dass durch den Formwechsel die Erfüllung ihrer Forderung gefährdet wird."
    },
    {
      "date": "2025-10-14",
      "id": "133771",
      "original_text": "Löschungsankündigung\nBayern Amtsgericht Nürnberg HRB 4664\nFEMONT GmbH, Fertigung - Montagen - Zeitarbeit – Schwarzenbruck",
      "type": "Löschungsankündigung",
      "state": "Bayern",
      "amtsgericht": "Amtsgericht Nürnberg",
      "registernummer": "HRB 4664",
      "registerart": "HRB",
      "company_name": "FEMONT GmbH, Fertigung - Montagen - Zeitarbeit",
      "company_seat": "Schwarzenbruck",
      "details": "14.10.2025 (Bekanntmachungsdatum)\n\nBayern Amtsgericht Nürnberg HRB 4664\nLöschungsankündigung\n\nFEMONT GmbH, Fertigung - Montagen - Zeitarbeit\nGesellschaft mit beschränkter Haftung\nSchwarzenbruck\n\nDas Registergericht beabsichtigt, die im Handelsregister eingetragene Gesellschaft wegen Vermögenslosigkeit von Amts wegen nach § 394 FamFG zu löschen. Die Frist zur Erhebung eines Widerspruchs ist auf einen Monat festgesetzt."
    },
    {
      "date": "2025-10-14",
      "id": "133772",
      "original_text": "Einreichung neuer Dokumente\nBayern Amtsgericht Bamberg HRB 7614\nPROJECT Investment AG – Bamberg",
      "type": "Einreichung neuer Dokumente",
      "state": "Bayern",
      "amtsgericht": "Amtsgericht Bamberg",
      "registernummer": "HRB 7614",
      "registerart": "HRB",
      "company_name": "PROJECT Investment AG",
      "company_seat": "Bamberg",
      "details": "14.10.2025 (Bekanntmachungsdatum)\n\nBayern Amtsgericht Bamberg HRB 7614\nEinreichung neuer Dokumente 13.10.2025 (Eintragungsdatum)\n\nPROJECT Investment AG\nAktiengesellschaft\nBamberg\n\nDem Amtsgericht - Registergericht - Bamberg ist eine Liste der Mitglieder des Aufsichtsrats eingereicht worden, § 106 AktG."
    },
    {
      "date": "2025-10-14",
      "id": "133773",
      "original_text": "Registerbekanntmachung nach dem Umwandlungsgesetz\nBayern Amtsgericht München HRB 140669\nWavestone Germany AG – München",
      "type": "Registerbekanntmachung nach dem Umwandlungsgesetz",
      "state": "Bayern",
      "amtsgericht": "Amtsgericht München",
      "registernummer": "HRB 140669",
      "registerart": "HRB",
      "company_name": "Wavestone Germany AG",
      "company_seat": "München",
      "details": "14.10.2025 (Bekanntmachungsdatum)\n\nBayern Amtsgericht München HRB 140669\nRegisterbekanntmachung nach dem Umwandlungsgesetz 13.10.2025 (Eintragungsdatum)\n\nWavestone Germany AG\nAktiengesellschaft\nMünchen\n\nDen Gläubigern der an der Verschmelzung beteiligten Rechtsträger ist, wenn sie binnen sechs Monaten nach dem Tag, an dem die Eintragung der Verschmelzung in das Register des Sitzes desjenigen Rechtsträgers, dessen Gläubiger sie sind, nach § 19 Abs. 3 UmwG als bekannt gemacht gilt, ihren Anspruch nach Grund und Höhe in Textform anmelden, Sicherheit zu leisten, soweit sie nicht Befriedigung verlangen können. Dieses Recht steht den Gläubigern jedoch nur zu, wenn sie glaubhaft machen, dass durch die Verschmelzung die Erfüllung ihrer Forderung gefährdet wird."
    },
    {
      "date": "2025-10-14",
      "id": "133774",
      "original_text": "Registerbekanntmachung nach dem Umwandlungsgesetz\nBayern Amtsgericht München HRB 237273\nStargate Invest GmbH – München",
      "type": "Registerbekanntmachung nach dem Umwandlungsgesetz",
      "state": "Bayern",
      "amtsgericht": "Amtsgericht München",
      "registernummer": "HRB 237273",
      "registerart": "HRB",
      "company_name": "Stargate Invest GmbH",
      "company_seat": "München",
      "details": "14.10.2025 (Bekanntmachungsdatum)\n\nBayern Amtsgericht München HRB 237273\nRegisterbekanntmachung nach dem Umwandlungsgesetz 13.10.2025 (Eintragungsdatum)\n\nStargate Invest GmbH\nGesellschaft mit beschränkter Haftung\nMünchen\n\nDen Gläubigern der an der Verschmelzung beteiligten Rechtsträger ist, wenn sie binnen sechs Monaten nach dem Tag, an dem die Eintragung der Verschmelzung in das Register des Sitzes desjenigen Rechtsträgers, dessen Gläubiger sie sind, nach § 19 Abs. 3 UmwG als bekannt gemacht gilt, ihren Anspruch nach Grund und Höhe in Textform anmelden, Sicherheit zu leisten, soweit sie nicht Befriedigung verlangen können. Dieses Recht steht den Gläubigern jedoch nur zu, wenn sie glaubhaft machen, dass durch die Verschmelzung die Erfüllung ihrer Forderung gefährdet wird."
    },
    {
      "date": "2025-10-14",
      "id": "133775",
      "original_text": "Registerbekanntmachung nach dem Umwandlungsgesetz\nBayern Amtsgericht München HRB 260580\nSBI Management GmbH – Grünwald",
      "type": "Registerbekanntmachung nach dem Umwandlungsgesetz",
      "state": "Bayern",
      "amtsgericht": "Amtsgericht München",
      "registernummer": "HRB 260580",
      "registerart": "HRB",
      "company_name": "SBI Management GmbH",
      "company_seat": "Grünwald",
      "details": "14.10.2025 (Bekanntmachungsdatum)\n\nBayern Amtsgericht München HRB 260580\nRegisterbekanntmachung nach dem Umwandlungsgesetz 13.10.2025 (Eintragungsdatum)\n\nSBI Management GmbH\nGesellschaft mit beschränkter Haftung\nGrünwald\n\nDen Gläubigern der an der Verschmelzung beteiligten Rechtsträger ist, wenn sie binnen sechs Monaten nach dem Tag, an dem die Eintragung der Verschmelzung in das Register des Sitzes desjenigen Rechtsträgers, dessen Gläubiger sie sind, nach § 19 Abs. 3 UmwG als bekannt gemacht gilt, ihren Anspruch nach Grund und Höhe in Textform anmelden, Sicherheit zu leisten, soweit sie nicht Befriedigung verlangen können. Dieses Recht steht den Gläubigern jedoch nur zu, wenn sie glaubhaft machen, dass durch die Verschmelzung die Erfüllung ihrer Forderung gefährdet wird."
    },
    {
      "date": "2025-10-14",
      "id": "133776",
      "original_text": "Registerbekanntmachung nach dem Umwandlungsgesetz\nBayern Amtsgericht München HRB 305470\nMS VV GmbH – Vaterstetten",
      "type": "Registerbekanntmachung nach dem Umwandlungsgesetz",
      "state": "Bayern",
      "amtsgericht": "Amtsgericht München",
      "registernummer": "HRB 305470",
      "registerart": "HRB",
      "company_name": "MS VV GmbH",
      "company_seat": "Vaterstetten",
      "details": "14.10.2025 (Bekanntmachungsdatum)\n\nBayern Amtsgericht München HRB 305470\nRegisterbekanntmachung nach dem Umwandlungsgesetz 13.10.2025 (Eintragungsdatum)\n\nMS VV GmbH\nGesellschaft mit beschränkter Haftung\nVaterstetten\n\nDen Gläubigern der an der Verschmelzung beteiligten Rechtsträger ist, wenn sie binnen sechs Monaten nach dem Tag, an dem die Eintragung der Verschmelzung in das Register des Sitzes desjenigen Rechtsträgers, dessen Gläubiger sie sind, nach § 19 Abs. 3 UmwG als bekannt gemacht gilt, ihren Anspruch nach Grund und Höhe in Textform anmelden, Sicherheit zu leisten, soweit sie nicht Befriedigung verlangen können. Dieses Recht steht den Gläubigern jedoch nur zu, wenn sie glaubhaft machen, dass durch die Verschmelzung die Erfüllung ihrer Forderung gefährdet wird."
    },
    {
      "date": "2025-10-14",
      "id": "133777",
      "original_text": "Löschungsankündigung\nBayern Amtsgericht München HRB 279483\nISD Haustechnik UG (haftungsbeschränkt) – Gräfelfing",
      "type": "Löschungsankündigung",
      "state": "Bayern",
      "amtsgericht": "Amtsgericht München",
      "registernummer": "HRB 279483",
      "registerart": "HRB",
      "company_name": "ISD Haustechnik UG (haftungsbeschränkt)",
      "company_seat": "Gräfelfing",
      "details": "14.10.2025 (Bekanntmachungsdatum)\n\nBayern Amtsgericht München HRB 279483\nLöschungsankündigung 13.10.2025 (Eintragungsdatum)\n\nISD Haustechnik UG (haftungsbeschränkt)\nGesellschaft mit beschränkter Haftung\nGräfelfing\n\nDas Registergericht beabsichtigt, die im Handelsregister eingetragene Gesellschaft wegen Vermögenslosigkeit von Amts wegen nach § 394 FamFG zu löschen. Die Frist zur Erhebung eines Widerspruchs ist auf drei Monate festgesetzt."
    },
    {
      "date": "2025-10-14",
      "id": "133778",
      "original_text": "Registerbekanntmachung nach dem Umwandlungsgesetz\nBayern Amtsgericht Landshut HRB 5363\nLindner Beteiligungs GmbH – Arnstorf",
      "type": "Registerbekanntmachung nach dem Umwandlungsgesetz",
      "state": "Bayern",
      "amtsgericht": "Amtsgericht Landshut",
      "registernummer": "HRB 5363",
      "registerart": "HRB",
      "company_name": "Lindner Beteiligungs GmbH",
      "company_seat": "Arnstorf",
      "details": "14.10.2025 (Bekanntmachungsdatum)\n\nBayern Amtsgericht Landshut HRB 5363\nRegisterbekanntmachung nach dem Umwandlungsgesetz 13.10.2025 (Eintragungsdatum)\n\nLindner Beteiligungs GmbH\nGesellschaft mit beschränkter Haftung\nArnstorf"
    },
    {
      "date": "2025-10-14",
      "id": "133779",
      "original_text": "Registerbekanntmachung nach dem Umwandlungsgesetz\nBayern Amtsgericht Würzburg VR 1621\nUnterfränkischer Dart Verband (UDV) e.V. – Würzburg",
      "type": "Registerbekanntmachung nach dem Umwandlungsgesetz",
      "state": "Bayern",
      "amtsgericht": "Amtsgericht Würzburg",
      "registernummer": "VR 1621",
      "registerart": "VR",
      "company_name": "Unterfränkischer Dart Verband (UDV) e.V.",
      "company_seat": "Würzburg",
      "details": "14.10.2025 (Bekanntmachungsdatum)\n\nBayern Amtsgericht Würzburg VR 1621\nRegisterbekanntmachung nach dem Umwandlungsgesetz 13.10.2025 (Eintragungsdatum)\n\nUnterfränkischer Dart Verband (UDV) e.V.\neingetragener Verein\nWürzburg\n\nDen Gläubigern der an der Verschmelzung beteiligten Rechtsträger ist, wenn sie binnen sechs Monaten nach dem Tag, an dem die Eintragung der Verschmelzung in das Register des Sitzes desjenigen Rechtsträgers, dessen Gläubiger sie sind, nach § 19 Abs. 3 UmwG als bekannt gemacht gilt, ihren Anspruch nach Grund und Höhe in Textform anmelden, Sicherheit zu leisten, soweit sie nicht Befriedigung verlangen können. Dieses Recht steht den Gläubigern jedoch nur zu, wenn sie glaubhaft machen, dass durch die Verschmelzung die Erfüllung ihrer Forderung gefährdet wird."
    },
    {
      "date": "2025-10-14",
      "id": "133780",
      "original_text": "Löschungsankündigung\nBayern Amtsgericht München HRB 296956\nStart Cup GmbH – München",
      "type": "Löschungsankündigung",
      "state": "Bayern",
      "amtsgericht": "Amtsgericht München",
      "registernummer": "HRB 296956",
      "registerart": "HRB",
      "company_name": "Start Cup GmbH",
      "company_seat": "München",
      "details": "14.10.2025 (Bekanntmachungsdatum)\n\nBayern Amtsgericht München HRB 296956\nLöschungsankündigung 13.10.2025 (Eintragungsdatum)\n\nStart Cup GmbH\nGesellschaft mit beschränkter Haftung\nMünchen\n\nDas Registergericht beabsichtigt, die im Handelsregister eingetragene Gesellschaft wegen Vermögenslosigkeit von Amts wegen nach § 394 FamFG zu löschen. Die Frist zur Erhebung eines Widerspruchs ist auf drei Monate festgesetzt."
    },
    {
      "date": "2025-10-14",
      "id": "133781",
      "original_text": "Registerbekanntmachung nach dem Umwandlungsgesetz\nBayern Amtsgericht Nürnberg HRB 25554\nDie Krieger des Lichts GmbH – Nürnberg",
      "type": "Registerbekanntmachung nach dem Umwandlungsgesetz",
      "state": "Bayern",
      "amtsgericht": "Amtsgericht Nürnberg",
      "registernummer": "HRB 25554",
      "registerart": "HRB",
      "company_name": "Die Krieger des Lichts GmbH",
      "company_seat": "Nürnberg",
      "details": "14.10.2025 (Bekanntmachungsdatum)\n\nBayern Amtsgericht Nürnberg HRB 25554\nRegisterbekanntmachung nach dem Umwandlungsgesetz 13.10.2025 (Eintragungsdatum)\n\nDie Krieger des Lichts GmbH\nGesellschaft mit beschränkter Haftung\nNürnberg\n\nDen Gläubigern der an der Verschmelzung beteiligten Rechtsträger ist, wenn sie binnen sechs Monaten nach dem Tag, an dem die Eintragung der Verschmelzung in das Register des Sitzes desjenigen Rechtsträgers, dessen Gläubiger sie sind, nach § 19 Abs. 3 UmwG als bekannt gemacht gilt, ihren Anspruch nach Grund und Höhe in Textform anmelden, Sicherheit zu leisten, soweit sie nicht Befriedigung verlangen können. Dieses Recht steht den Gläubigern jedoch nur zu, wenn sie glaubhaft machen, dass durch die Verschmelzung die Erfüllung ihrer Forderung gefährdet wird."
    },
    {
      "date": "2025-10-14",
      "id": "133782",
      "original_text": "Registerbekanntmachung nach dem Umwandlungsgesetz\nBayern Amtsgericht München HRB 305228\nEmbvest Holding GmbH – München",
      "type": "Registerbekanntmachung nach dem Umwandlungsgesetz",
      "state": "Bayern",
      "amtsgericht": "Amtsgericht München",
      "registernummer": "HRB 305228",
      "registerart": "HRB",
      "company_name": "Embvest Holding GmbH",
      "company_seat": "München",
      "details": "14.10.2025 (Bekanntmachungsdatum)\n\nBayern Amtsgericht München HRB 305228\nRegisterbekanntmachung nach dem Umwandlungsgesetz 13.10.2025 (Eintragungsdatum)\n\nEmbvest Holding GmbH\nGesellschaft mit beschränkter Haftung\nMünchen\n\nDen Gläubigern der an der Verschmelzung beteiligten Rechtsträger ist, wenn sie binnen sechs Monaten nach dem Tag, an dem die Eintragung der Verschmelzung in das Register des Sitzes desjenigen Rechtsträgers, dessen Gläubiger sie sind, nach § 19 Abs. 3 UmwG als bekannt gemacht gilt, ihren Anspruch nach Grund und Höhe in Textform anmelden, Sicherheit zu leisten, soweit sie nicht Befriedigung verlangen können. Dieses Recht steht den Gläubigern jedoch nur zu, wenn sie glaubhaft machen, dass durch die Verschmelzung die Erfüllung ihrer Forderung gefährdet wird."
    },
    {
      "date": "2025-10-14",
      "id": "133783",
      "original_text": "Löschungsankündigung\nBayern Amtsgericht München HRB 233905\nSportfuchs Fitness & Wellnessoase GmbH – Gräfelfing",
      "type": "Löschungsankündigung",
      "state": "Bayern",
      "amtsgericht": "Amtsgericht München",
      "registernummer": "HRB 233905",
      "registerart": "HRB",
      "company_name": "Sportfuchs Fitness & Wellnessoase GmbH",
      "company_seat": "Gräfelfing",
      "details": "14.10.2025 (Bekanntmachungsdatum)\n\nBayern Amtsgericht München HRB 233905\nLöschungsankündigung 13.10.2025 (Eintragungsdatum)\n\nSportfuchs Fitness & Wellnessoase GmbH\nGesellschaft mit beschränkter Haftung\nGräfelfing\n\nDas Registergericht beabsichtigt, die im Handelsregister eingetragene Gesellschaft wegen Vermögenslosigkeit von Amts wegen nach § 394 FamFG zu löschen. Die Frist zur Erhebung eines Widerspruchs ist auf drei Monate festgesetzt."
    },
    {
      "date": "2025-10-14",
      "id": "133784",
      "original_text": "Löschungsankündigung\nBayern Amtsgericht München HRB 267227\nextensive GmbH – Grünwald",
      "type": "Löschungsankündigung",
      "state": "Bayern",
      "amtsgericht": "Amtsgericht München",
      "registernummer": "HRB 267227",
      "registerart": "HRB",
      "company_name": "extensive GmbH",
      "company_seat": "Grünwald",
      "details": "14.10.2025 (Bekanntmachungsdatum)\n\nBayern Amtsgericht München HRB 267227\nLöschungsankündigung 13.10.2025 (Eintragungsdatum)\n\nextensive GmbH\nGesellschaft mit beschränkter Haftung\nGrünwald\n\nDas Registergericht beabsichtigt, die im Handelsregister eingetragene Gesellschaft wegen Vermögenslosigkeit von Amts wegen nach § 394 FamFG zu löschen. Die Frist zur Erhebung eines Widerspruchs ist auf drei Monate festgesetzt."
    },
    {
      "date": "2025-10-14",
      "id": "133785",
      "original_text": "Registerbekanntmachung nach dem Umwandlungsgesetz\nBayern Amtsgericht München HRB 306266\nFinancial Management Group FMG GmbH – München",
      "type": "Registerbekanntmachung nach dem Umwandlungsgesetz",
      "state": "Bayern",
      "amtsgericht": "Amtsgericht München",
      "registernummer": "HRB 306266",
      "registerart": "HRB",
      "company_name": "Financial Management Group FMG GmbH",
      "company_seat": "München",
      "details": "14.10.2025 (Bekanntmachungsdatum)\n\nBayern Amtsgericht München HRB 306266\nRegisterbekanntmachung nach dem Umwandlungsgesetz 13.10.2025 (Eintragungsdatum)\n\nFinancial Management Group FMG GmbH\nGesellschaft mit beschränkter Haftung\nMünchen\n\nDen Gläubigern des formwechselnden Rechtsträgers ist, wenn sie binnen sechs Monaten nach dem Tag, an dem die Eintragung des Formwechsels nach § 201 UmwG als bekannt gemacht gilt, ihren Anspruch nach Grund und Höhe in Textform anmelden, Sicherheit zu leisten, soweit sie nicht Befriedigung verlangen können. Dieses Recht steht den Gläubigern jedoch nur zu, wenn sie glaubhaft machen, dass durch den Formwechsel die Erfüllung ihrer Forderung gefährdet wird."
    },
    {
      "date": "2025-10-14",
      "id": "133786",
      "original_text": "Registerbekanntmachung nach dem Umwandlungsgesetz\nBayern Amtsgericht München HRB 163267\nFinancial Management Group FMG Aktiengesellschaft – München",
      "type": "Registerbekanntmachung nach dem Umwandlungsgesetz",
      "state": "Bayern",
      "amtsgericht": "Amtsgericht München",
      "registernummer": "HRB 163267",
      "registerart": "HRB",
      "company_name": "Financial Management Group FMG Aktiengesellschaft",
      "company_seat": "München",
      "details": "14.10.2025 (Bekanntmachungsdatum)\n\nBayern Amtsgericht München HRB 163267\nRegisterbekanntmachung nach dem Umwandlungsgesetz 13.10.2025 (Eintragungsdatum)\n\nFinancial Management Group FMG Aktiengesellschaft\nAktiengesellschaft\nMünchen\n\nDen Gläubigern des formwechselnden Rechtsträgers ist, wenn sie binnen sechs Monaten nach dem Tag, an dem die Eintragung des Formwechsels nach § 201 UmwG als bekannt gemacht gilt, ihren Anspruch nach Grund und Höhe in Textform anmelden, Sicherheit zu leisten, soweit sie nicht Befriedigung verlangen können. Dieses Recht steht den Gläubigern jedoch nur zu, wenn sie glaubhaft machen, dass durch den Formwechsel die Erfüllung ihrer Forderung gefährdet wird."
    },
    {
      "date": "2025-10-14",
      "id": "133787",
      "original_text": "Registerbekanntmachung nach dem Umwandlungsgesetz\nBayern Amtsgericht Traunstein HRA 13237\nEschrich Bedachung GmbH & Co. KG – Bad Reichenhall",
      "type": "Registerbekanntmachung nach dem Umwandlungsgesetz",
      "state": "Bayern",
      "amtsgericht": "Amtsgericht Traunstein",
      "registernummer": "HRA 13237",
      "registerart": "HRA",
      "company_name": "Eschrich Bedachung GmbH & Co. KG",
      "company_seat": "Bad Reichenhall",
      "details": "14.10.2025 (Bekanntmachungsdatum)\n\nBayern Amtsgericht Traunstein HRA 13237\nRegisterbekanntmachung nach dem Umwandlungsgesetz 13.10.2025 (Eintragungsdatum)\n\nEschrich Bedachung GmbH & Co. KG\nKommanditgesellschaft\nBad Reichenhall\n\nDen Gläubigern des formwechselnden Rechtsträgers ist, wenn sie binnen sechs Monaten nach dem Tag, an dem die Eintragung des Formwechsels nach § 201 UmwG als bekannt gemacht gilt, ihren Anspruch nach Grund und Höhe in Textform anmelden, Sicherheit zu leisten, soweit sie nicht Befriedigung verlangen können. Dieses Recht steht den Gläubigern jedoch nur zu, wenn sie glaubhaft machen, dass durch den Formwechsel die Erfüllung ihrer Forderung gefährdet wird."
    },
    {
      "date": "2025-10-14",
      "id": "133788",
      "original_text": "Registerbekanntmachung nach dem Umwandlungsgesetz\nBayern Amtsgericht München HRB 189427\nAichhof GmbH – Pullach i. Isartal",
      "type": "Registerbekanntmachung nach dem Umwandlungsgesetz",
      "state": "Bayern",
      "amtsgericht": "Amtsgericht München",
      "registernummer": "HRB 189427",
      "registerart": "HRB",
      "company_name": "Aichhof GmbH",
      "company_seat": "Pullach i. Isartal",
      "details": "14.10.2025 (Bekanntmachungsdatum)\n\nBayern Amtsgericht München HRB 189427\nRegisterbekanntmachung nach dem Umwandlungsgesetz 13.10.2025 (Eintragungsdatum)\n\nAichhof GmbH\nGesellschaft mit beschränkter Haftung\nPullach i. Isartal\n\nDen Gläubigern der an der Spaltung beteiligten Rechtsträger ist, wenn sie binnen sechs Monaten nach dem Tag, an dem die Eintragung der Spaltung in das Register des Sitzes desjenigen Rechtsträgers, dessen Gläubiger sie sind, nach §§ 125, 19 Abs. 3 UmwG als bekannt gemacht gilt, ihren Anspruch nach Grund und Höhe in Textform anmelden, Sicherheit zu leisten, soweit sie nicht Befriedigung verlangen können. Dieses Recht steht den Gläubigern jedoch nur zu, wenn sie glaubhaft machen, dass durch die Spaltung die Erfüllung ihrer Forderung gefährdet wird."
    },
    {
      "date": "2025-10-14",
      "id": "133789",
      "original_text": "Registerbekanntmachung nach dem Umwandlungsgesetz\nBayern Amtsgericht München HRB 180782\nAURELIUS Transaktionsberatungs AG – München",
      "type": "Registerbekanntmachung nach dem Umwandlungsgesetz",
      "state": "Bayern",
      "amtsgericht": "Amtsgericht München",
      "registernummer": "HRB 180782",
      "registerart": "HRB",
      "company_name": "AURELIUS Transaktionsberatungs AG",
      "company_seat": "München",
      "details": "14.10.2025 (Bekanntmachungsdatum)\n\nBayern Amtsgericht München HRB 180782\nRegisterbekanntmachung nach dem Umwandlungsgesetz 13.10.2025 (Eintragungsdatum)\n\nAURELIUS Transaktionsberatungs AG\nAktiengesellschaft\nMünchen\n\nDen Gläubigern des formwechselnden Rechtsträgers ist, wenn sie binnen sechs Monaten nach dem Tag, an dem die Eintragung des Formwechsels nach § 201 UmwG als bekannt gemacht gilt, ihren Anspruch nach Grund und Höhe in Textform anmelden, Sicherheit zu leisten, soweit sie nicht Befriedigung verlangen können. Dieses Recht steht den Gläubigern jedoch nur zu, wenn sie glaubhaft machen, dass durch den Formwechsel die Erfüllung ihrer Forderung gefährdet wird."
    },
    {
      "date": "2025-10-14",
      "id": "133790",
      "original_text": "Löschungsankündigung\nBayern Amtsgericht München HRB 224086\nCleanMax GmbH – München",
      "type": "Löschungsankündigung",
      "state": "Bayern",
      "amtsgericht": "Amtsgericht München",
      "registernummer": "HRB 224086",
      "registerart": "HRB",
      "company_name": "CleanMax GmbH",
      "company_seat": "München",
      "details": "14.10.2025 (Bekanntmachungsdatum)\n\nBayern Amtsgericht München HRB 224086\nLöschungsankündigung 13.10.2025 (Eintragungsdatum)\n\nCleanMax GmbH\nGesellschaft mit beschränkter Haftung\nMünchen\n\nDas Registergericht beabsichtigt, die im Handelsregister eingetragene Gesellschaft wegen Vermögenslosigkeit von Amts wegen nach § 394 FamFG zu löschen. Die Frist zur Erhebung eines Widerspruchs ist auf drei Monate festgesetzt."
    },
    {
      "date": "2025-10-14",
      "id": "133791",
      "original_text": "Einreichung neuer Dokumente\nBayern Amtsgericht Fürth HRB 8180\nESIRION AG – Fürth",
      "type": "Einreichung neuer Dokumente",
      "state": "Bayern",
      "amtsgericht": "Amtsgericht Fürth",
      "registernummer": "HRB 8180",
      "registerart": "HRB",
      "company_name": "ESIRION AG",
      "company_seat": "Fürth",
      "details": "14.10.2025 (Bekanntmachungsdatum)\n\nBayern Amtsgericht Fürth HRB 8180\nEinreichung neuer Dokumente 13.10.2025 (Eintragungsdatum)\n\nESIRION AG\nAktiengesellschaft\nFürth\n\nDem Amtsgericht Fürth -Registergericht- ist eine Liste der Mitglieder des Aufsichtsrats eingereicht worden, § 106 AktG."
    },
    {
      "date": "2025-10-14",
      "id": "133792",
      "original_text": "Registerbekanntmachung nach dem Umwandlungsgesetz\nBaden-Württemberg Amtsgericht Ulm HRB 744598\nDomek GmbH – Niederstotzingen",
      "type": "Registerbekanntmachung nach dem Umwandlungsgesetz",
      "state": "Baden-Württemberg",
      "amtsgericht": "Amtsgericht Ulm",
      "registernummer": "HRB 744598",
      "registerart": "HRB",
      "company_name": "Domek GmbH",
      "company_seat": "Niederstotzingen",
      "details": "14.10.2025 (Bekanntmachungsdatum)\n\nBaden-Württemberg Amtsgericht Ulm HRB 744598\nRegisterbekanntmachung nach dem Umwandlungsgesetz 14.10.2025 (Eintragungsdatum)\n\nDomek GmbH\nGesellschaft mit beschränkter Haftung\nNiederstotzingen\n\nAls nicht eingetragen wird bekanntgemacht:\nDen Gläubigern der an der Verschmelzung beteiligten Rechtsträger ist, wenn sie binnen sechs Monaten nach dem Tag, an dem die Eintragung der Verschmelzung in das Register des Sitzes desjenigen Rechtsträgers, dessen Gläubiger sie sind, nach § 19 Abs. 3 UmwG als bekanntgemacht gilt, ihren Anspruch nach Grund und Höhe schriftlich anmelden, Sicherheit zu leisten, soweit sie nicht Befriedigung verlangen können. Dieses Recht steht den Gläubigern jedoch nur zu, wenn sie glaubhaft machen, dass durch die Verschmelzung die Erfüllung ihrer Forderung gefährdet wird."
    },
    {
      "date": "2025-10-14",
      "id": "133793",
      "original_text": "Löschungsankündigung\nSchleswig-Holstein Amtsgericht Lübeck VR 444 EU\nSpielmannszug Haffkrug e.V. – Scharbeutz/Haffkrug",
      "type": "Löschungsankündigung",
      "state": "Schleswig-Holstein",
      "amtsgericht": "Amtsgericht Lübeck",
      "registernummer": "VR 444 EU",
      "registerart": "VR",
      "company_name": "Spielmannszug Haffkrug e.V.",
      "company_seat": "Scharbeutz/Haffkrug",
      "details": "14.10.2025 (Bekanntmachungsdatum)\n\nSchleswig-Holstein Amtsgericht Lübeck VR 444 EU\nLöschungsankündigung\n\nSpielmannszug Haffkrug e.V.\neingetragener Verein\nScharbeutz/Haffkrug\n\nBei der nachstehenden Gesellschaft wird das Amtslöschungsverfahren eingeleitet."
    },
    {
      "date": "2025-10-14",
      "id": "133794",
      "original_text": "Sonstige Registerbekanntmachung\nBaden-Württemberg Amtsgericht Mannheim HRB 109190\nVincentius-Diakonissen-Kliniken gemeinnützige AG – Karlsruhe",
      "type": "Sonstige Registerbekanntmachung",
      "state": "Baden-Württemberg",
      "amtsgericht": "Amtsgericht Mannheim",
      "registernummer": "HRB 109190",
      "registerart": "HRB",
      "company_name": "Vincentius-Diakonissen-Kliniken gemeinnützige AG",
      "company_seat": "Karlsruhe",
      "details": "14.10.2025 (Bekanntmachungsdatum)\n\nBaden-Württemberg Amtsgericht Mannheim HRB 109190\nSonstige Registerbekanntmachung\n\nVincentius-Diakonissen-Kliniken gemeinnützige AG\nAktiengesellschaft\nKarlsruhe\n\nDie Gesellschaft hat am 29.09.2025 die Liste über die Zusammensetzung des Aufsichtsrats zum Handelsregister eingereicht."
    },
    {
      "date": "2025-10-14",
      "id": "133795",
      "original_text": "Einreichung neuer Dokumente\nBrandenburg Amtsgericht Potsdam HRB 40177\nMetabolic Balance Global AG – Potsdam",
      "type": "Einreichung neuer Dokumente",
      "state": "Brandenburg",
      "amtsgericht": "Amtsgericht Potsdam",
      "registernummer": "HRB 40177",
      "registerart": "HRB",
      "company_name": "Metabolic Balance Global AG",
      "company_seat": "Potsdam",
      "details": "14.10.2025 (Bekanntmachungsdatum)\n\nBrandenburg Amtsgericht Potsdam HRB 40177\nEinreichung neuer Dokumente\n\nMetabolic Balance Global AG\nAktiengesellschaft\nPotsdam\n\nAls nicht eingetragen wird bekanntgemacht : Eine Liste der Mitglieder des Aufsichtsrates wurde zum Handelsregister eingereicht."
    },
    {
      "date": "2025-10-14",
      "id": "133796",
      "original_text": "Löschungsankündigung\nBaden-Württemberg Amtsgericht Mannheim HRB 728567\nDoKa GmbH – Mannheim",
      "type": "Löschungsankündigung",
      "state": "Baden-Württemberg",
      "amtsgericht": "Amtsgericht Mannheim",
      "registernummer": "HRB 728567",
      "registerart": "HRB",
      "company_name": "DoKa GmbH",
      "company_seat": "Mannheim",
      "details": "14.10.2025 (Bekanntmachungsdatum)\n\nBaden-Württemberg Amtsgericht Mannheim HRB 728567\nLöschungsankündigung\n\nDoKa GmbH\nGesellschaft mit beschränkter Haftung\nMannheim\n\nDas Gericht beabsichtigt, die Gesellschaft wegen Vermögenslosigkeit im Handelsregister von Amts wegen nach § 394 FamFG zu löschen. Die Frist zur Geltendmachung eines Widerspruchs gegen die beabsichtigte Löschung ist auf einen Monat ab Veröffentlichung bestimmt."
    },
    {
      "date": "2025-10-14",
      "id": "133797",
      "original_text": "Löschungsankündigung\nBaden-Württemberg Amtsgericht Ulm HRA 701222\nReiter Heiztechnik GmbH & Co.KG – Lorch",
      "type": "Löschungsankündigung",
      "state": "Baden-Württemberg",
      "amtsgericht": "Amtsgericht Ulm",
      "registernummer": "HRA 701222",
      "registerart": "HRA",
      "company_name": "Reiter Heiztechnik GmbH & Co.KG",
      "company_seat": "Lorch",
      "details": "14.10.2025 (Bekanntmachungsdatum)\n\nBaden-Württemberg Amtsgericht Ulm HRA 701222\nLöschungsankündigung\n\nReiter Heiztechnik GmbH & Co.KG\nKommanditgesellschaft\nLorch\n\nDas Gericht beabsichtigt, die Gesellschaft wegen Vermögenslosigkeit im Handelsregister von Amts wegen nach § 394 FamFG zu löschen. Die Frist zur Geltendmachung eines Widerspruchs gegen die beabsichtigte Löschung ist auf  einen Monat ab Veröffentlichung bestimmt."
    },
    {
      "date": "2025-10-14",
      "id": "133798",
      "original_text": "Registerbekanntmachung nach dem Umwandlungsgesetz\nSachsen-Anhalt Amtsgericht Stendal HRB 33185\nSunCoal Sales GmbH – Leuna",
      "type": "Registerbekanntmachung nach dem Umwandlungsgesetz",
      "state": "Sachsen-Anhalt",
      "amtsgericht": "Amtsgericht Stendal",
      "registernummer": "HRB 33185",
      "registerart": "HRB",
      "company_name": "SunCoal Sales GmbH",
      "company_seat": "Leuna",
      "details": "14.10.2025 (Bekanntmachungsdatum)\n\nSachsen-Anhalt Amtsgericht Stendal HRB 33185\nRegisterbekanntmachung nach dem Umwandlungsgesetz 14.10.2025 (Eintragungsdatum)\n\nSunCoal Sales GmbH\nGesellschaft mit beschränkter Haftung\nLeuna\n\nNicht eingetragen:\nDen Gläubigern der an der Verschmelzung beteiligten Rechtsträger ist, wenn sie binnen sechs Monaten nach dem Tag, an dem die Eintragung der Verschmelzung nach § 19 Abs. 3 UmwG als bekanntgemacht gilt, ihren Anspruch nach Grund und Höhe schriftlich anmelden, Sicherheit zu leisten, soweit sie nicht Befriedigung verlangen können. Dieses Recht steht ihnen jedoch nur zu, wenn sie glaubhaft machen, dass durch die Verschmelzung die Erfüllung ihrer Forderung gefährdet wird."
    },
    {
      "date": "2025-10-14",
      "id": "133799",
      "original_text": "Registerbekanntmachung nach dem Umwandlungsgesetz\nSachsen-Anhalt Amtsgericht Stendal HRB 28253\nUPM Biochemicals GmbH – Leuna",
      "type": "Registerbekanntmachung nach dem Umwandlungsgesetz",
      "state": "Sachsen-Anhalt",
      "amtsgericht": "Amtsgericht Stendal",
      "registernummer": "HRB 28253",
      "registerart": "HRB",
      "company_name": "UPM Biochemicals GmbH",
      "company_seat": "Leuna",
      "details": "14.10.2025 (Bekanntmachungsdatum)\n\nSachsen-Anhalt Amtsgericht Stendal HRB 28253\nRegisterbekanntmachung nach dem Umwandlungsgesetz 14.10.2025 (Eintragungsdatum)\n\nUPM Biochemicals GmbH\nGesellschaft mit beschränkter Haftung\nLeuna\n\nNicht eingetragen:\nDen Gläubigern der an der Verschmelzung beteiligten Rechtsträger ist, wenn sie binnen sechs Monaten nach dem Tag, an dem die Eintragung der Verschmelzung nach § 19 Abs. 3 UmwG als bekanntgemacht gilt, ihren Anspruch nach Grund und Höhe schriftlich anmelden, Sicherheit zu leisten, soweit sie nicht Befriedigung verlangen können. Dieses Recht steht ihnen jedoch nur zu, wenn sie glaubhaft machen, dass durch die Verschmelzung die Erfüllung ihrer Forderung gefährdet wird."
    },
    {
      "date": "2025-10-14",
      "id": "133800",
      "original_text": "Löschungsankündigung\nSaarland Amtsgericht Saarbrücken HRB 18213\nEventkiste GmbH – Schwalbach",
      "type": "Löschungsankündigung",
      "state": "Saarland",
      "amtsgericht": "Amtsgericht Saarbrücken",
      "registernummer": "HRB 18213",
      "registerart": "HRB",
      "company_name": "Eventkiste GmbH",
      "company_seat": "Schwalbach",
      "details": "14.10.2025 (Bekanntmachungsdatum)\n\nSaarland Amtsgericht Saarbrücken HRB 18213\nLöschungsankündigung\n\nEventkiste GmbH\nGesellschaft mit beschränkter Haftung\nSchwalbach\n\nEs ist beabsichtigt, die Gesellschaft von Amts wegen gemäß § 394 FamFG wegen Vermögenslosigkeit zu löschen.\nGegen die Löschung von Amts wegen ist das Rechtsmittel des Widerspruchs statthaft. Der Widerspruch ist binnen einer Frist von zwei Monaten beginnend mit dem Tag dieser Veröffentlichung durch Einreichen eines Widerspruchsschreibens -schriftlich oder zur Niederschrift der Geschäftsstelle beim Amtsgericht Saarbrücken, -zentrales Handelsregister-, Mainzer Str.178, 66121 Saarbrücken einzulegen.\nDer Widerspruch muss die Bezeichnung der angefochtenen Löschungsankündigung enthalten sowie die Erklärung, dass Widerspruch eingelegt wird. Er ist vom Widerspruchsführer oder seinem Bevollmächtigten zu unterzeichnen.\nDas Widerspruchsschreiben kann auch in der Form eines elektronischen Dokumentes eingereicht werden, das mit einer qualifizierten elektronischen Signatur nach dem Signaturgesetz versehen sein muss (§§ 14 Abs. 2 FamFG, 130a, 298 ZPO)."
    },
    {
      "date": "2025-10-14",
      "id": "133801",
      "original_text": "Einreichung neuer Dokumente\nBerlin Amtsgericht Berlin (Charlottenburg) HRB 125990\nALDB GmbH – Berlin",
      "type": "Einreichung neuer Dokumente",
      "state": "Berlin",
      "amtsgericht": "Amtsgericht Berlin (Charlottenburg)",
      "registernummer": "HRB 125990",
      "registerart": "HRB",
      "company_name": "ALDB GmbH",
      "company_seat": "Berlin",
      "details": "14.10.2025 (Bekanntmachungsdatum)\n\nBerlin Amtsgericht Berlin (Charlottenburg) HRB 125990\nEinreichung neuer Dokumente\n\nALDB GmbH\nGesellschaft mit beschränkter Haftung\nBerlin\n\nAls nicht eingetragen wird veröffentlicht: Es wurde eine neue Liste der Aufsichtsratsmitglieder eingereicht (§52 GmbHG)."
    },
    {
      "date": "2025-10-14",
      "id": "133802",
      "original_text": "Löschungsankündigung\nSchleswig-Holstein Amtsgericht Pinneberg HRB 2124 EL\nJürgen Horn GmbH – Elmshorn",
      "type": "Löschungsankündigung",
      "state": "Schleswig-Holstein",
      "amtsgericht": "Amtsgericht Pinneberg",
      "registernummer": "HRB 2124 EL",
      "registerart": "HRB",
      "company_name": "Jürgen Horn GmbH",
      "company_seat": "Elmshorn",
      "details": "14.10.2025 (Bekanntmachungsdatum)\n\nSchleswig-Holstein Amtsgericht Pinneberg HRB 2124 EL\nLöschungsankündigung\n\nJürgen Horn GmbH\nGesellschaft mit beschränkter Haftung\nElmshorn\n\nEs ist die Löschung der nachstehenden Gesellschaft wegen Vermögenslosigkeit gemäß § 394 FamFG beabsichtigt. Widerspruchsfrist: 3 Monate."
    },
    {
      "date": "2025-10-14",
      "id": "133803",
      "original_text": "Registerbekanntmachung nach dem Umwandlungsgesetz\nHamburg Amtsgericht Hamburg HRB 160050\nUhl Trucks & Trailer Zentrum GmbH – Hamburg",
      "type": "Registerbekanntmachung nach dem Umwandlungsgesetz",
      "state": "Hamburg",
      "amtsgericht": "Amtsgericht Hamburg",
      "registernummer": "HRB 160050",
      "registerart": "HRB",
      "company_name": "Uhl Trucks & Trailer Zentrum GmbH",
      "company_seat": "Hamburg",
      "details": "14.10.2025 (Bekanntmachungsdatum)\n\nHamburg Amtsgericht Hamburg HRB 160050\nRegisterbekanntmachung nach dem Umwandlungsgesetz 13.10.2025 (Eintragungsdatum)\n\nUhl Trucks & Trailer Zentrum GmbH\nGesellschaft mit beschränkter Haftung\nHamburg\n\nAls nicht eingetragen wird bekannt gemacht:\nDen Gläubigern der an der Verschmelzung beteiligten Gesellschaften ist, wenn sie binnen sechs Monaten nach dem Tag, an dem die Eintragung der Verschmelzung in das Register des Sitzes desjenigen Rechtsträgers, dessen Gläubiger sie sind, nach § 19 Absatz 3 UmwG als bekannt gemacht gilt, ihren Anspruch nach Grund und Höhe schriftlich anmelden, Sicherheit zu leisten, soweit sie nicht Befriedigung verlangen können. Dieses Recht steht den Gläubigern jedoch nur zu, wenn sie glaubhaft machen, dass durch die Verschmelzung die Erfüllung ihrer Forderung gefährdet wird."
    },
    {
      "date": "2025-10-14",
      "id": "133804",
      "original_text": "Löschungsankündigung\nBerlin Amtsgericht Berlin (Charlottenburg) HRB 113659\nMiLi Gastronomie GmbH – Berlin",
      "type": "Löschungsankündigung",
      "state": "Berlin",
      "amtsgericht": "Amtsgericht Berlin (Charlottenburg)",
      "registernummer": "HRB 113659",
      "registerart": "HRB",
      "company_name": "MiLi Gastronomie GmbH",
      "company_seat": "Berlin",
      "details": "14.10.2025 (Bekanntmachungsdatum)\n\nBerlin Amtsgericht Berlin (Charlottenburg) HRB 113659\nLöschungsankündigung\n\nMiLi Gastronomie GmbH\nGesellschaft mit beschränkter Haftung\nBerlin\n\nBei der nachstehenden Gesellschaft wird das Amtslöschungsverfahren gemäß § 394 FamFG eingeleitet. Widerspruchsfrist 6 Wochen"
    },
    {
      "date": "2025-10-14",
      "id": "133805",
      "original_text": "Löschungsankündigung\nBaden-Württemberg Amtsgericht Stuttgart HRB 771408\nTegtmeier Family GmbH – Heilbronn",
      "type": "Löschungsankündigung",
      "state": "Baden-Württemberg",
      "amtsgericht": "Amtsgericht Stuttgart",
      "registernummer": "HRB 771408",
      "registerart": "HRB",
      "company_name": "Tegtmeier Family GmbH",
      "company_seat": "Heilbronn",
      "details": "14.10.2025 (Bekanntmachungsdatum)\n\nBaden-Württemberg Amtsgericht Stuttgart HRB 771408\nLöschungsankündigung\n\nTegtmeier Family GmbH\nGesellschaft mit beschränkter Haftung\nHeilbronn\n\nDas Gericht beabsichtigt, die Gesellschaft wegen Vermögenslosigkeit im Handelsregister von Amts wegen nach § 394 FamFG zu löschen. Die Frist zur Geltendmachung eines Widerspruchs gegen die beabsichtigte Löschung ist auf zwei Monate ab Veröffentlichung bestimmt."
    },
    {
      "date": "2025-10-14",
      "id": "133806",
      "original_text": "Löschungsankündigung\nBerlin Amtsgericht Berlin (Charlottenburg) HRB 80842\nDr. Geyer Rechtsanwalts GmbH – Berlin",
      "type": "Löschungsankündigung",
      "state": "Berlin",
      "amtsgericht": "Amtsgericht Berlin (Charlottenburg)",
      "registernummer": "HRB 80842",
      "registerart": "HRB",
      "company_name": "Dr. Geyer Rechtsanwalts GmbH",
      "company_seat": "Berlin",
      "details": "14.10.2025 (Bekanntmachungsdatum)\n\nBerlin Amtsgericht Berlin (Charlottenburg) HRB 80842\nLöschungsankündigung\n\nDr. Geyer Rechtsanwalts GmbH\nGesellschaft mit beschränkter Haftung\nBerlin\n\nBei der nachstehenden Gesellschaft wird das Amtslöschungsverfahren gemäß § 394 FamFG eingeleitet. Widerspruchsfrist 6 Wochen"
    },
    {
      "date": "2025-10-14",
      "id": "133807",
      "original_text": "Löschungsankündigung\nBerlin Amtsgericht Berlin (Charlottenburg) HRB 188585\nIngo Lohde UG (haftungsbeschränkt) – Berlin",
      "type": "Löschungsankündigung",
      "state": "Berlin",
      "amtsgericht": "Amtsgericht Berlin (Charlottenburg)",
      "registernummer": "HRB 188585",
      "registerart": "HRB",
      "company_name": "Ingo Lohde UG (haftungsbeschränkt)",
      "company_seat": "Berlin",
      "details": "14.10.2025 (Bekanntmachungsdatum)\n\nBerlin Amtsgericht Berlin (Charlottenburg) HRB 188585\nLöschungsankündigung\n\nIngo Lohde UG (haftungsbeschränkt)\nGesellschaft mit beschränkter Haftung\nBerlin\n\nBei der nachstehenden Gesellschaft wird das Amtslöschungsverfahren gemäß § 394 FamFG eingeleitet. Widerspruchsfrist 6 Wochen"
    },
    {
      "date": "2025-10-14",
      "id": "133808",
      "original_text": "Registerbekanntmachung nach dem Umwandlungsgesetz\nBaden-Württemberg Amtsgericht Stuttgart HRB 785279\naMoS KiTa Rheinau GmbH – Fellbach",
      "type": "Registerbekanntmachung nach dem Umwandlungsgesetz",
      "state": "Baden-Württemberg",
      "amtsgericht": "Amtsgericht Stuttgart",
      "registernummer": "HRB 785279",
      "registerart": "HRB",
      "company_name": "aMoS KiTa Rheinau GmbH",
      "company_seat": "Fellbach",
      "details": "14.10.2025 (Bekanntmachungsdatum)\n\nBaden-Württemberg Amtsgericht Stuttgart HRB 785279\nRegisterbekanntmachung nach dem Umwandlungsgesetz 14.10.2025 (Eintragungsdatum)\n\naMoS KiTa Rheinau GmbH\nGesellschaft mit beschränkter Haftung\nFellbach\n\nAls nicht eingetragen wird bekanntgemacht:\nDen Gläubigern der an der Verschmelzung beteiligten Rechtsträger ist, wenn sie binnen sechs Monaten nach dem Tag, an dem die Eintragung der Verschmelzung in das Register des Sitzes desjenigen Rechtsträgers, dessen Gläubiger sie sind, nach § 19 Abs. 3 UmwG als bekanntgemacht gilt, ihren Anspruch nach Grund und Höhe schriftlich anmelden, Sicherheit zu leisten, soweit sie nicht Befriedigung verlangen können. Dieses Recht steht den Gläubigern jedoch nur zu, wenn sie glaubhaft machen, dass durch die Verschmelzung die Erfüllung ihrer Forderung gefährdet wird."
    },
    {
      "date": "2025-10-14",
      "id": "133809",
      "original_text": "Registerbekanntmachung nach dem Umwandlungsgesetz\nBerlin Amtsgericht Berlin (Charlottenburg) HRA 41034\nBMH Beratungsgesellschaft mbH & Co KG – Berlin",
      "type": "Registerbekanntmachung nach dem Umwandlungsgesetz",
      "state": "Berlin",
      "amtsgericht": "Amtsgericht Berlin (Charlottenburg)",
      "registernummer": "HRA 41034",
      "registerart": "HRA",
      "company_name": "BMH Beratungsgesellschaft mbH & Co KG",
      "company_seat": "Berlin",
      "details": "14.10.2025 (Bekanntmachungsdatum)\n\nBerlin Amtsgericht Berlin (Charlottenburg) HRA 41034\nRegisterbekanntmachung nach dem Umwandlungsgesetz 13.10.2025 (Eintragungsdatum)\n\nBMH Beratungsgesellschaft mbH & Co KG\nKommanditgesellschaft\nBerlin\n\nZu Eintragungsnummer 7 vom 13.10.2025 wird als nicht eingetragen veröffentlicht: Den Gläubigern der an der Spaltung beteiligten Rechtsträger ist, wenn sie binnen sechs Monaten nach dem Tag, an dem die Eintragung der Spaltung in das Register des Sitzes desjenigen Rechtsträgers, dessen Gläubiger sie sind, als bekannt gemacht gilt, ihren Anspruch nach Grund und Höhe schriftlich anmelden, Sicherheit zu leisten, soweit sie nicht Befriedigung verlangen können. Dieses Recht steht den Gläubigern jedoch nur zu, wenn sie glaubhaft machen, dass durch die Spaltung die Erfüllung ihrer Forderung gefährdet wird. Das Recht, Sicherheitsleistung zu verlangen, steht Gläubigern nicht zu, die im Falle der Insolvenz ein Recht auf vorzugsweise Befriedigung aus einer Deckungsmasse haben, die nach gesetzlicher Vorschrift zu ihrem Schutz errichtet und staatlich überwacht ist."
    },
    {
      "date": "2025-10-14",
      "id": "133810",
      "original_text": "Registerbekanntmachung nach dem Umwandlungsgesetz\nBerlin Amtsgericht Berlin (Charlottenburg) HRA 64810\nBMH Vermögensverwaltungsgesellschaft mbH & Co. KG – Berlin",
      "type": "Registerbekanntmachung nach dem Umwandlungsgesetz",
      "state": "Berlin",
      "amtsgericht": "Amtsgericht Berlin (Charlottenburg)",
      "registernummer": "HRA 64810",
      "registerart": "HRA",
      "company_name": "BMH Vermögensverwaltungsgesellschaft mbH & Co. KG",
      "company_seat": "Berlin",
      "details": "14.10.2025 (Bekanntmachungsdatum)\n\nBerlin Amtsgericht Berlin (Charlottenburg) HRA 64810\nRegisterbekanntmachung nach dem Umwandlungsgesetz 13.10.2025 (Eintragungsdatum)\n\nBMH Vermögensverwaltungsgesellschaft mbH & Co. KG\nKommanditgesellschaft\nBerlin\n\nZu Eintragungsnummer 1 vom 13.10.2025 wird als nicht eingetragen veröffentlicht: Den Gläubigern der an der Spaltung beteiligten Rechtsträger ist, wenn sie binnen sechs Monaten nach dem Tag, an dem die Eintragung der Spaltung in das Register des Sitzes desjenigen Rechtsträgers, dessen Gläubiger sie sind, als bekannt gemacht gilt, ihren Anspruch nach Grund und Höhe schriftlich anmelden, Sicherheit zu leisten, soweit sie nicht Befriedigung verlangen können. Dieses Recht steht den Gläubigern jedoch nur zu, wenn sie glaubhaft machen, dass durch die Spaltung die Erfüllung ihrer Forderung gefährdet wird. Das Recht, Sicherheitsleistung zu verlangen, steht Gläubigern nicht zu, die im Falle der Insolvenz ein Recht auf vorzugsweise Befriedigung aus einer Deckungsmasse haben, die nach gesetzlicher Vorschrift zu ihrem Schutz errichtet und staatlich überwacht ist."
    },
    {
      "date": "2025-10-14",
      "id": "133811",
      "original_text": "Löschungsankündigung\nBerlin Amtsgericht Berlin (Charlottenburg) HRB 156716\nGENESIS Vietinvest Group GmbH – Berlin",
      "type": "Löschungsankündigung",
      "state": "Berlin",
      "amtsgericht": "Amtsgericht Berlin (Charlottenburg)",
      "registernummer": "HRB 156716",
      "registerart": "HRB",
      "company_name": "GENESIS Vietinvest Group GmbH",
      "company_seat": "Berlin",
      "details": "14.10.2025 (Bekanntmachungsdatum)\n\nBerlin Amtsgericht Berlin (Charlottenburg) HRB 156716\nLöschungsankündigung\n\nGENESIS Vietinvest Group GmbH\nGesellschaft mit beschränkter Haftung\nBerlin\n\nBei der nachstehenden Gesellschaft wird das Amtslöschungsverfahren gemäß § 394 FamFG eingeleitet. Widerspruchsfrist 6 Wochen"
    },
    {
      "date": "2025-10-14",
      "id": "133812",
      "original_text": "Registerbekanntmachung nach dem Umwandlungsgesetz\nBaden-Württemberg Amtsgericht Stuttgart HRB 744828\nMZV direkt - ZENIT Verwaltungsgesellschaft mbH – Stuttgart",
      "type": "Registerbekanntmachung nach dem Umwandlungsgesetz",
      "state": "Baden-Württemberg",
      "amtsgericht": "Amtsgericht Stuttgart",
      "registernummer": "HRB 744828",
      "registerart": "HRB",
      "company_name": "MZV direkt - ZENIT Verwaltungsgesellschaft mbH",
      "company_seat": "Stuttgart",
      "details": "14.10.2025 (Bekanntmachungsdatum)\n\nBaden-Württemberg Amtsgericht Stuttgart HRB 744828\nRegisterbekanntmachung nach dem Umwandlungsgesetz 14.10.2025 (Eintragungsdatum)\n\nMZV direkt - ZENIT Verwaltungsgesellschaft mbH\nGesellschaft mit beschränkter Haftung\nStuttgart\n\nDen Gläubigern dern an der grenzüberschreitenden Verschmelzung beteiligten übernehmenden Rechtsträger ist, wenn sie binnen sechs Monaten nach dem Tag, an dem die Eintragung der Verschmelzung in das Register des Sitzes desjenigen Rechtsträgers, dessen Gläubiger sie sind, nach § 19 Absatz 3 UmwG als bekanntgemacht gilt, ihren Anspruch nach Grund und Höhe schriftlich anmelden, Sicherheit zu leisten, soweit sie nicht Befriedigung verlangen können. Dieses Recht steht den Gläubigern jedoch nur zu, wenn sie glaubhaft machen, dass durch die Verschmelzung die Erfüllung ihrer Forderung gefährdet wird."
    },
    {
      "date": "2025-10-14",
      "id": "133813",
      "original_text": "Registerbekanntmachung nach dem Umwandlungsgesetz\nBrandenburg Amtsgericht Frankfurt/Oder HRB 18867\nWJH Ingbau 2020 GmbH – Oderberg",
      "type": "Registerbekanntmachung nach dem Umwandlungsgesetz",
      "state": "Brandenburg",
      "amtsgericht": "Amtsgericht Frankfurt/Oder",
      "registernummer": "HRB 18867",
      "registerart": "HRB",
      "company_name": "WJH Ingbau 2020 GmbH",
      "company_seat": "Oderberg",
      "details": "14.10.2025 (Bekanntmachungsdatum)\n\nBrandenburg Amtsgericht Frankfurt/Oder HRB 18867\nRegisterbekanntmachung nach dem Umwandlungsgesetz 22.09.2025 (Eintragungsdatum)\n\nWJH Ingbau 2020 GmbH\nGesellschaft mit beschränkter Haftung\nOderberg\n\nZu Eintragungsnummer 5 vom 22.09.2025 wird als nicht eingetragen veröffentlicht:\nDen Gläubigern der an der Verschmelzung beteiligten Rechtsträger ist, wenn sie binnen sechs Monaten nach dem Tag, an dem die Eintragung der Verschmelzung in das Register des Sitzes desjenigen Rechtsträgers, dessen Gläubiger sie sind, als bekannt gemacht gilt, ihren Anspruch nach Grund und Höhe schriftlich anmelden, Sicherheit zu leisten, soweit sie nicht Befriedigung verlangen können. Dieses Recht steht den Gläubigern jedoch nur zu, wenn sie glaubhaft machen, dass durch die Verschmelzung die Erfüllung ihrer Forderung gefährdet wird"
    },
    {
      "date": "2025-10-14",
      "id": "133814",
      "original_text": "Löschungsankündigung\nBerlin Amtsgericht Berlin (Charlottenburg) HRB 158672\nFlying Turtle GmbH – Berlin",
      "type": "Löschungsankündigung",
      "state": "Berlin",
      "amtsgericht": "Amtsgericht Berlin (Charlottenburg)",
      "registernummer": "HRB 158672",
      "registerart": "HRB",
      "company_name": "Flying Turtle GmbH",
      "company_seat": "Berlin",
      "details": "14.10.2025 (Bekanntmachungsdatum)\n\nBerlin Amtsgericht Berlin (Charlottenburg) HRB 158672\nLöschungsankündigung\n\nFlying Turtle GmbH\nGesellschaft mit beschränkter Haftung\nBerlin\n\nBei der nachstehenden Gesellschaft wird das Amtslöschungsverfahren gemäß § 394 FamFG eingeleitet. Widerspruchsfrist 6 Wochen"
    },
    {
      "date": "2025-10-14",
      "id": "133815",
      "original_text": "Registerbekanntmachung nach dem Umwandlungsgesetz\nMecklenburg-Vorpommern Amtsgericht Schwerin GsR 300\nDie Gartenbauer eGbR – Schwerin",
      "type": "Registerbekanntmachung nach dem Umwandlungsgesetz",
      "state": "Mecklenburg-Vorpommern",
      "amtsgericht": "Amtsgericht Schwerin",
      "registernummer": "GsR 300",
      "registerart": "GsR",
      "company_name": "Die Gartenbauer eGbR",
      "company_seat": "Schwerin",
      "details": "14.10.2025 (Bekanntmachungsdatum)\n\nMecklenburg-Vorpommern Amtsgericht Schwerin GsR 300\nRegisterbekanntmachung nach dem Umwandlungsgesetz 14.10.2025 (Eintragungsdatum)\n\nDie Gartenbauer eGbR\nGesellschaft bürgerlichen Rechts\nSchwerin\n\nAls nicht eingetragen wird veröffentlicht: Den Gläubigern der an der Umwandlung beteiligten Rechtsträger ist, wenn sie binnen sechs\nMonaten nach dem Tag, an dem die Eintragung der Umwandlung in das Register des Sitzes desjenigen Rechtsträgers, dessen Gläubiger sie sind, nach § 19 Abs. 3 UmwG als bekannt gemacht gilt, ihren Anspruch nach Grund und Höhe in Textform anmelden, Sicherheit zu leisten, soweit sie nicht Befriedigung verlangen können. Dieses Recht steht den Gläubigern jedoch nur zu, wenn sie glaubhaft machen, dass durch die Umwandlung die Erfüllung der Forderung gefährdet wird."
    },
    {
      "date": "2025-10-14",
      "id": "133819",
      "original_text": "Löschungsankündigung\nBaden-Württemberg Amtsgericht Stuttgart HRB 765402\nCaruba GmbH – Stuttgart",
      "type": "Löschungsankündigung",
      "state": "Baden-Württemberg",
      "amtsgericht": "Amtsgericht Stuttgart",
      "registernummer": "HRB 765402",
      "registerart": "HRB",
      "company_name": "Caruba GmbH",
      "company_seat": "Stuttgart",
      "details": "14.10.2025 (Bekanntmachungsdatum)\n\nBaden-Württemberg Amtsgericht Stuttgart HRB 765402\nLöschungsankündigung\n\nCaruba GmbH\nGesellschaft mit beschränkter Haftung\nStuttgart\n\nAls nicht eingetragen wird bekanntgemacht:\nDas Gericht beabsichtigt, die Gesellschaft wegen Vermögenslosigkeit im Handelsregister von Amts wegen nach § 394 FamFG zu löschen. Die Frist zur Geltendmachung eines Widerspruchs gegen die beabsichtigte Löschung ist auf zwei Monate ab Veröffentlichung bestimmt."
    },
    {
      "date": "2025-10-14",
      "id": "133820",
      "original_text": "Einreichung neuer Dokumente\nBerlin Amtsgericht Berlin (Charlottenburg) HRB 76530\nBEST CONNECTION Beteiligung & Consulting AG – Berlin",
      "type": "Einreichung neuer Dokumente",
      "state": "Berlin",
      "amtsgericht": "Amtsgericht Berlin (Charlottenburg)",
      "registernummer": "HRB 76530",
      "registerart": "HRB",
      "company_name": "BEST CONNECTION Beteiligung & Consulting AG",
      "company_seat": "Berlin",
      "details": "14.10.2025 (Bekanntmachungsdatum)\n\nBerlin Amtsgericht Berlin (Charlottenburg) HRB 76530\nEinreichung neuer Dokumente\n\nBEST CONNECTION Beteiligung & Consulting AG\nAktiengesellschaft\nBerlin\n\nAls nicht eingetragen wird veröffentlicht: Es wurde eine neue Liste der Aufsichtsratsmitglieder eingereicht (§ 106 AktG)."
    },
    {
      "date": "2025-10-14",
      "id": "133821",
      "original_text": "Löschungsankündigung\nThüringen Amtsgericht Jena HRB 517965\nLohof Transport UG (haftungsbeschränkt) – Eisenach",
      "type": "Löschungsankündigung",
      "state": "Thüringen",
      "amtsgericht": "Amtsgericht Jena",
      "registernummer": "HRB 517965",
      "registerart": "HRB",
      "company_name": "Lohof Transport UG (haftungsbeschränkt)",
      "company_seat": "Eisenach",
      "details": "14.10.2025 (Bekanntmachungsdatum)\n\nThüringen Amtsgericht Jena HRB 517965\nLöschungsankündigung\n\nLohof Transport UG (haftungsbeschränkt)\nGesellschaft mit beschränkter Haftung\nEisenach\n\nDas Registergericht beabsichtigt, die im Handelsregister eingetragene Gesellschaft wegen Vermögenslosigkeit nach § 394 FamFG von Amts wegen zu löschen. Die Frist zur Erhebung eines Widerspruchs gegen die beabsichtigte Löschung wird auf 6 Wochen festgesetzt."
    },
    {
      "date": "2025-10-14",
      "id": "133822",
      "original_text": "Löschungsankündigung\nThüringen Amtsgericht Jena HRB 520577\nLUPUS Vermögensverwaltung GmbH – Erfurt",
      "type": "Löschungsankündigung",
      "state": "Thüringen",
      "amtsgericht": "Amtsgericht Jena",
      "registernummer": "HRB 520577",
      "registerart": "HRB",
      "company_name": "LUPUS Vermögensverwaltung GmbH",
      "company_seat": "Erfurt",
      "details": "14.10.2025 (Bekanntmachungsdatum)\n\nThüringen Amtsgericht Jena HRB 520577\nLöschungsankündigung\n\nLUPUS Vermögensverwaltung GmbH\nGesellschaft mit beschränkter Haftung\nErfurt\n\nDas Registergericht beabsichtigt, die im Handelsregister eingetragene Gesellschaft wegen Vermögenslosigkeit nach § 394 FamFG von Amts wegen zu löschen. Die Frist zur Erhebung eines Widerspruchs gegen die beabsichtigte Löschung wird auf 6 Wochen festgesetzt."
    },
    {
      "date": "2025-10-14",
      "id": "133823",
      "original_text": "Registerbekanntmachung nach dem Umwandlungsgesetz\nBaden-Württemberg Amtsgericht Mannheim HRB 211135\nSchaeffler Bühl Verwaltungs GmbH – Bühl",
      "type": "Registerbekanntmachung nach dem Umwandlungsgesetz",
      "state": "Baden-Württemberg",
      "amtsgericht": "Amtsgericht Mannheim",
      "registernummer": "HRB 211135",
      "registerart": "HRB",
      "company_name": "Schaeffler Bühl Verwaltungs GmbH",
      "company_seat": "Bühl",
      "details": "14.10.2025 (Bekanntmachungsdatum)\n\nBaden-Württemberg Amtsgericht Mannheim HRB 211135\nRegisterbekanntmachung nach dem Umwandlungsgesetz 14.10.2025 (Eintragungsdatum)\n\nSchaeffler Bühl Verwaltungs GmbH\nGesellschaft mit beschränkter Haftung\nBühl\n\nDen Gläubigern der an der Verschmelzung beteiligten Rechtsträger ist, wenn sie binnen sechs Monaten nach dem Tag, an dem die Eintragung der Verschmelzung in das Register des Sitzes desjenigen Rechtsträgers, dessen Gläubiger sie sind, nach § 19 Abs. 3 UmwG als bekanntgemacht gilt, ihren Anspruch nach Grund und Höhe schriftlich anmelden, Sicherheit zu leisten, soweit sie nicht Befriedigung verlangen können. Dieses Recht steht den Gläubigern jedoch nur zu, wenn sie glaubhaft machen, dass durch die Verschmelzung die Erfüllung ihrer Forderung gefährdet wird."
    },
    {
      "date": "2025-10-14",
      "id": "133824",
      "original_text": "Registerbekanntmachung nach dem Umwandlungsgesetz\nBaden-Württemberg Amtsgericht Freiburg HRA 709291\nCo-Industry GmbH & Co. KG – Bad Säckingen",
      "type": "Registerbekanntmachung nach dem Umwandlungsgesetz",
      "state": "Baden-Württemberg",
      "amtsgericht": "Amtsgericht Freiburg",
      "registernummer": "HRA 709291",
      "registerart": "HRA",
      "company_name": "Co-Industry GmbH & Co. KG",
      "company_seat": "Bad Säckingen",
      "details": "14.10.2025 (Bekanntmachungsdatum)\n\nBaden-Württemberg Amtsgericht Freiburg HRA 709291\nRegisterbekanntmachung nach dem Umwandlungsgesetz 14.10.2025 (Eintragungsdatum)\n\nCo-Industry GmbH & Co. KG\nKommanditgesellschaft\nBad Säckingen\n\nDen Gläubigern der an der Ausgliederung beteiligten Rechtsträger ist, wenn sie binnen sechs Monaten nach dem Tag, an dem die Eintragung der Ausgliederung in das Register des Sitzes desjenigen Rechtsträgers, dessen Gläubiger sie sind, nach § 19 Abs. 3 UmwG als bekanntgemacht gilt, ihren Anspruch nach Grund und Höhe schriftlich anmelden, Sicherheit zu leisten, soweit sie nicht Befriedigung verlangen können. Dieses Recht steht den Gläubigern jedoch nur zu, wenn sie glaubhaft machen, dass durch die Ausgliederung die Erfüllung ihrer Forderung gefährdet wird."
    },
    {
      "date": "2025-10-14",
      "id": "133825",
      "original_text": "Registerbekanntmachung nach dem Umwandlungsgesetz\nBaden-Württemberg Amtsgericht Freiburg HRB 630150\nSUHNER Deutschland GmbH – Bad Säckingen",
      "type": "Registerbekanntmachung nach dem Umwandlungsgesetz",
      "state": "Baden-Württemberg",
      "amtsgericht": "Amtsgericht Freiburg",
      "registernummer": "HRB 630150",
      "registerart": "HRB",
      "company_name": "SUHNER Deutschland GmbH",
      "company_seat": "Bad Säckingen",
      "details": "14.10.2025 (Bekanntmachungsdatum)\n\nBaden-Württemberg Amtsgericht Freiburg HRB 630150\nRegisterbekanntmachung nach dem Umwandlungsgesetz 14.10.2025 (Eintragungsdatum)\n\nSUHNER Deutschland GmbH\nGesellschaft mit beschränkter Haftung\nBad Säckingen\n\nDen Gläubigern der an der Ausgliederung beteiligten Rechtsträger ist, wenn sie binnen sechs Monaten nach dem Tag, an dem die Eintragung der Ausgliederung in das Register des Sitzes desjenigen Rechtsträgers, dessen Gläubiger sie sind, nach § 19 Abs. 3 UmwG als bekanntgemacht gilt, ihren Anspruch nach Grund und Höhe schriftlich anmelden, Sicherheit zu leisten, soweit sie nicht Befriedigung verlangen können. Dieses Recht steht den Gläubigern jedoch nur zu, wenn sie glaubhaft machen, dass durch die Ausgliederung die Erfüllung ihrer Forderung gefährdet wird."
    },
    {
      "date": "2025-10-14",
      "id": "133826",
      "original_text": "Löschungsankündigung\nBrandenburg Amtsgericht Frankfurt/Oder HRB 15807\nH & H Pflegegruppe UG (haftungsbeschränkt) – Gosen-Neu Zittau",
      "type": "Löschungsankündigung",
      "state": "Brandenburg",
      "amtsgericht": "Amtsgericht Frankfurt/Oder",
      "registernummer": "HRB 15807",
      "registerart": "HRB",
      "company_name": "H & H Pflegegruppe UG (haftungsbeschränkt)",
      "company_seat": "Gosen-Neu Zittau",
      "details": "14.10.2025 (Bekanntmachungsdatum)\n\nBrandenburg Amtsgericht Frankfurt/Oder HRB 15807\nLöschungsankündigung\n\nH & H Pflegegruppe UG (haftungsbeschränkt)\nGesellschaft mit beschränkter Haftung\nGosen-Neu Zittau\n\nBei der nachstehenden Gesellschaft wird das Amtslöschungsverfahren gemäß § 394 FamFG eingeleitet."
    },
    {
      "date": "2025-10-14",
      "id": "133827",
      "original_text": "Löschungsankündigung\nBaden-Württemberg Amtsgericht Stuttgart HRB 724773\nWKon Engineering Limited – Ammerbuch",
      "type": "Löschungsankündigung",
      "state": "Baden-Württemberg",
      "amtsgericht": "Amtsgericht Stuttgart",
      "registernummer": "HRB 724773",
      "registerart": "HRB",
      "company_name": "WKon Engineering Limited",
      "company_seat": "Ammerbuch",
      "details": "14.10.2025 (Bekanntmachungsdatum)\n\nBaden-Württemberg Amtsgericht Stuttgart HRB 724773\nLöschungsankündigung\n\nWKon Engineering Limited\nRechtsform ausländischen Rechts HRB\nAmmerbuch\n\nDas Gericht beabsichtigt, die Eintragung der Gesellschaft im Handelsregister wegen des Mangels einer wesentlichen Voraussetzung von Amts wegen nach § 395 FamFG als unzulässig zu löschen. Die Frist zur Geltendmachung eines Widerspruchs gegen die beabsichtigte Löschung ist auf einen Monat ab Veröffentlichung bestimmt."
    },
    {
      "date": "2025-10-14",
      "id": "133828",
      "original_text": "Registerbekanntmachung nach dem Umwandlungsgesetz\nSchleswig-Holstein Amtsgericht Lübeck HRB 7777\nDeubner & Marecki GmbH – Ahrensburg",
      "type": "Registerbekanntmachung nach dem Umwandlungsgesetz",
      "state": "Schleswig-Holstein",
      "amtsgericht": "Amtsgericht Lübeck",
      "registernummer": "HRB 7777",
      "registerart": "HRB",
      "company_name": "Deubner & Marecki GmbH",
      "company_seat": "Ahrensburg",
      "details": "14.10.2025 (Bekanntmachungsdatum)\n\nSchleswig-Holstein Amtsgericht Lübeck HRB 7777\nRegisterbekanntmachung nach dem Umwandlungsgesetz 13.10.2025 (Eintragungsdatum)\n\nDeubner & Marecki GmbH\nGesellschaft mit beschränkter Haftung\nAhrensburg\n\nZu Eintragungsnummer 6 vom 13.10.2025 wird als nicht eingetragen veröffentlicht:  Als nicht eingetragen wird veröffentlicht: Den Gläubigern der an der Verschmelzung beteiligten Rechtsträger ist, wenn sie binnen sechs Monaten nach dem Tag, an dem die Eintragung der Verschmelzung in das Register des Sitzes desjenigen Rechtsträgers, dessen Gläubiger sie sind, als bekannt gemacht gilt, ihren Anspruch nach Grund und Höhe schriftlich anmelden, Sicherheit zu leisten, soweit sie nicht Befriedigung verlangen können. Dieses Recht steht den Gläubigern jedoch nur zu, wenn sie glaubhaft machen, dass durch die Verschmelzung die Erfüllung ihrer Forderung gefährdet wird."
    },
    {
      "date": "2025-10-14",
      "id": "133829",
      "original_text": "Einreichung neuer Dokumente\nBerlin Amtsgericht Berlin (Charlottenburg) HRB 241181\nEmpatrust Global Trade AG – Berlin",
      "type": "Einreichung neuer Dokumente",
      "state": "Berlin",
      "amtsgericht": "Amtsgericht Berlin (Charlottenburg)",
      "registernummer": "HRB 241181",
      "registerart": "HRB",
      "company_name": "Empatrust Global Trade AG",
      "company_seat": "Berlin",
      "details": "14.10.2025 (Bekanntmachungsdatum)\n\nBerlin Amtsgericht Berlin (Charlottenburg) HRB 241181\nEinreichung neuer Dokumente\n\nEmpatrust Global Trade AG\nAktiengesellschaft\nBerlin\n\nAls nicht eingetragen wird veröffentlicht: Es wurde eine neue Liste der Aufsichtsratsmitglieder eingereicht (§ 106 AktG)."
    },
    {
      "date": "2025-10-14",
      "id": "133830",
      "original_text": "Registerbekanntmachung nach dem Umwandlungsgesetz\nBerlin Amtsgericht Berlin (Charlottenburg) HRA 64454\nPole Flow Berlin by LT e.K. – Berlin",
      "type": "Registerbekanntmachung nach dem Umwandlungsgesetz",
      "state": "Berlin",
      "amtsgericht": "Amtsgericht Berlin (Charlottenburg)",
      "registernummer": "HRA 64454",
      "registerart": "HRA",
      "company_name": "Pole Flow Berlin by LT e.K.",
      "company_seat": "Berlin",
      "details": "14.10.2025 (Bekanntmachungsdatum)\n\nBerlin Amtsgericht Berlin (Charlottenburg) HRA 64454\nRegisterbekanntmachung nach dem Umwandlungsgesetz 13.10.2025 (Eintragungsdatum)\n\nPole Flow Berlin by LT e.K.\nEinzelkaufmann / Einzelkauffrau\nBerlin\n\nZu Eintragungsnummer 2 vom 13.10.2025 wird als nicht eingetragen veröffentlicht: Den Gläubigern der an der Spaltung beteiligten Rechtsträger ist, wenn sie binnen sechs Monaten nach dem Tag, an dem die Eintragung der Spaltung in das Register des Sitzes desjenigen Rechtsträgers, dessen Gläubiger sie sind, als bekannt gemacht gilt, ihren Anspruch nach Grund und Höhe schriftlich anmelden, Sicherheit zu leisten, soweit sie nicht Befriedigung verlangen können. Dieses Recht steht den Gläubigern jedoch nur zu, wenn sie glaubhaft machen, dass durch die Spaltung die Erfüllung ihrer Forderung gefährdet wird. Das Recht, Sicherheitsleistung zu verlangen, steht Gläubigern nicht zu, die im Falle der Insolvenz ein Recht auf vorzugsweise Befriedigung aus einer Deckungsmasse haben, die nach gesetzlicher Vorschrift zu ihrem Schutz errichtet und staatlich überwacht ist."
    },
    {
      "date": "2025-10-14",
      "id": "133831",
      "original_text": "Einreichung neuer Dokumente\nBaden-Württemberg Amtsgericht Mannheim HRB 702566\nEXXETA AG – Karlsruhe",
      "type": "Einreichung neuer Dokumente",
      "state": "Baden-Württemberg",
      "amtsgericht": "Amtsgericht Mannheim",
      "registernummer": "HRB 702566",
      "registerart": "HRB",
      "company_name": "EXXETA AG",
      "company_seat": "Karlsruhe",
      "details": "14.10.2025 (Bekanntmachungsdatum)\n\nBaden-Württemberg Amtsgericht Mannheim HRB 702566\nEinreichung neuer Dokumente\n\nEXXETA AG\nAktiengesellschaft\nKarlsruhe\n\nDie Gesellschaft hat am 10.10.2025 die Liste über die Zusammensetzung des Aufsichtsrats zum Handelsregister eingereicht."
    },
    {
      "date": "2025-10-14",
      "id": "133832",
      "original_text": "Registerbekanntmachung nach dem Umwandlungsgesetz\nBerlin Amtsgericht Berlin (Charlottenburg) HRB 278617\nPole Flow Berlin GmbH – Berlin",
      "type": "Registerbekanntmachung nach dem Umwandlungsgesetz",
      "state": "Berlin",
      "amtsgericht": "Amtsgericht Berlin (Charlottenburg)",
      "registernummer": "HRB 278617",
      "registerart": "HRB",
      "company_name": "Pole Flow Berlin GmbH",
      "company_seat": "Berlin",
      "details": "14.10.2025 (Bekanntmachungsdatum)\n\nBerlin Amtsgericht Berlin (Charlottenburg) HRB 278617\nRegisterbekanntmachung nach dem Umwandlungsgesetz 13.10.2025 (Eintragungsdatum)\n\nPole Flow Berlin GmbH\nGesellschaft mit beschränkter Haftung\nBerlin\n\nZu Eintragungsnummer 2 vom 13.10.2025 wird als nicht eingetragen veröffentlicht: Den Gläubigern der an der Spaltung beteiligten Rechtsträger ist, wenn sie binnen sechs Monaten nach dem Tag, an dem die Eintragung der Spaltung in das Register des Sitzes desjenigen Rechtsträgers, dessen Gläubiger sie sind, als bekannt gemacht gilt, ihren Anspruch nach Grund und Höhe schriftlich anmelden, Sicherheit zu leisten, soweit sie nicht Befriedigung verlangen können. Dieses Recht steht den Gläubigern jedoch nur zu, wenn sie glaubhaft machen, dass durch die Spaltung die Erfüllung ihrer Forderung gefährdet wird. Das Recht, Sicherheitsleistung zu verlangen, steht Gläubigern nicht zu, die im Falle der Insolvenz ein Recht auf vorzugsweise Befriedigung aus einer Deckungsmasse haben, die nach gesetzlicher Vorschrift zu ihrem Schutz errichtet und staatlich überwacht ist."
    },
    {
      "date": "2025-10-14",
      "id": "133833",
      "original_text": "Löschungsankündigung\nSchleswig-Holstein Amtsgericht Lübeck HRB 21207\nBootshuus Verwaltungs GmbH – Grömitz",
      "type": "Löschungsankündigung",
      "state": "Schleswig-Holstein",
      "amtsgericht": "Amtsgericht Lübeck",
      "registernummer": "HRB 21207",
      "registerart": "HRB",
      "company_name": "Bootshuus Verwaltungs GmbH",
      "company_seat": "Grömitz",
      "details": "14.10.2025 (Bekanntmachungsdatum)\n\nSchleswig-Holstein Amtsgericht Lübeck HRB 21207\nLöschungsankündigung\n\nBootshuus Verwaltungs GmbH\nGesellschaft mit beschränkter Haftung\nGrömitz\n\nEs ist die Löschung der nachstehenden Gesellschaft wegen Vermögenslosigkeit gemäß § 394 FamFG beabsichtigt. Widerspruchsfrist: 1 Monat."
    },
    {
      "date": "2025-10-14",
      "id": "133834",
      "original_text": "Einreichung neuer Dokumente\nBerlin Amtsgericht Berlin (Charlottenburg) HRB 123774\nGeschäftshaus Franklinstraße 22/23 Verwaltungsgesellschaft mbH – Berlin",
      "type": "Einreichung neuer Dokumente",
      "state": "Berlin",
      "amtsgericht": "Amtsgericht Berlin (Charlottenburg)",
      "registernummer": "HRB 123774",
      "registerart": "HRB",
      "company_name": "Geschäftshaus Franklinstraße 22/23 Verwaltungsgesellschaft mbH",
      "company_seat": "Berlin",
      "details": "14.10.2025 (Bekanntmachungsdatum)\n\nBerlin Amtsgericht Berlin (Charlottenburg) HRB 123774\nEinreichung neuer Dokumente\n\nGeschäftshaus Franklinstraße 22/23 Verwaltungsgesellschaft mbH\nGesellschaft mit beschränkter Haftung\nBerlin\n\nAls nicht eingetragen wird veröffentlicht:\n\nEs wurde eine neue Liste der Beiratsmitglieder eingereicht (§52 GmbHG)."
    },
    {
      "date": "2025-10-14",
      "id": "133835",
      "original_text": "Löschungsankündigung\nHamburg Amtsgericht Hamburg HRA 107779\nPSV Hellespont Defiance GmbH & Co. KG – Hamburg",
      "type": "Löschungsankündigung",
      "state": "Hamburg",
      "amtsgericht": "Amtsgericht Hamburg",
      "registernummer": "HRA 107779",
      "registerart": "HRA",
      "company_name": "PSV Hellespont Defiance GmbH & Co. KG",
      "company_seat": "Hamburg",
      "details": "14.10.2025 (Bekanntmachungsdatum)\n\nHamburg Amtsgericht Hamburg HRA 107779\nLöschungsankündigung\n\nPSV Hellespont Defiance GmbH & Co. KG\nKommanditgesellschaft\nHamburg\n\nDas Registergericht beabsichtigt, die im Handelsregister eingetragene Gesellschaft von Amts wegen nach § 394 FamFG zu löschen. Die Frist zur Erhebung eines Widerspruchs gegen die beabsichtigte Löschung wird auf 3 Monate festgesetzt."
    },
    {
      "date": "2025-10-14",
      "id": "133836",
      "original_text": "Registerbekanntmachung nach dem Umwandlungsgesetz\nBaden-Württemberg Amtsgericht Stuttgart VR 270001\nBund der Selbständigen Gewerbeverein Backnang e.V. – Backnang",
      "type": "Registerbekanntmachung nach dem Umwandlungsgesetz",
      "state": "Baden-Württemberg",
      "amtsgericht": "Amtsgericht Stuttgart",
      "registernummer": "VR 270001",
      "registerart": "VR",
      "company_name": "Bund der Selbständigen Gewerbeverein Backnang e.V.",
      "company_seat": "Backnang",
      "details": "14.10.2025 (Bekanntmachungsdatum)\n\nBaden-Württemberg Amtsgericht Stuttgart VR 270001\nRegisterbekanntmachung nach dem Umwandlungsgesetz 14.10.2025 (Eintragungsdatum)\n\nBund der Selbständigen Gewerbeverein Backnang e.V.\neingetragener Verein\nBacknang\n\nAls nicht eingetragen wird bekanntgemacht:\nDen Gläubigern der an der Verschmelzung beteiligten Rechtsträger ist, wenn sie binnen sechs Monaten nach dem Tag, an dem die Eintragung der Verschmelzung in das Register des Sitzes desjenigen Rechtsträgers, dessen Gläubiger sie sind, nach § 19 Abs. 3 UmwG als bekanntgemacht gilt, ihren Anspruch nach Grund und Höhe schriftlich anmelden, Sicherheit zu leisten, soweit sie nicht Befriedigung verlangen können. Dieses Recht steht den Gläubigern jedoch nur zu, wenn sie glaubhaft machen, dass durch die Verschmelzung die Erfüllung ihrer Forderung gefährdet wird."
    },
    {
      "date": "2025-10-14",
      "id": "133837",
      "original_text": "Registerbekanntmachung nach dem Umwandlungsgesetz\nSaarland Amtsgericht Saarbrücken HRB 111647\nDSG Clean Saar Glas- und Gebäudereinigung GmbH – Neunkirchen",
      "type": "Registerbekanntmachung nach dem Umwandlungsgesetz",
      "state": "Saarland",
      "amtsgericht": "Amtsgericht Saarbrücken",
      "registernummer": "HRB 111647",
      "registerart": "HRB",
      "company_name": "DSG Clean Saar Glas- und Gebäudereinigung GmbH",
      "company_seat": "Neunkirchen",
      "details": "14.10.2025 (Bekanntmachungsdatum)\n\nSaarland Amtsgericht Saarbrücken HRB 111647\nRegisterbekanntmachung nach dem Umwandlungsgesetz 14.10.2025 (Eintragungsdatum)\n\nDSG Clean Saar Glas- und Gebäudereinigung GmbH\nGesellschaft mit beschränkter Haftung\nNeunkirchen\n\nAls nicht eingetragen wird bekannt gemacht: Den Gläubigern der an der Verschmelzung beteiligten Gesellschaften ist, wenn sie binnen sechs Monaten nach dem Tag, an dem die Eintragung der Verschmelzung in das Register des Sitzes desjenigen Rechtsträgers, dessen Gläubiger sie sind, nach § 19 Absatz 3 UmwG bekannt gemacht worden ist, ihren Anspruch nach Grund und Höhe schriftlich anmelden, Sicherheit zu leisten, soweit sie nicht Befriedigung verlangen können. Dieses Recht steht den Gläubigern jedoch nur zu, wenn sie glaubhaft machen, dass durch die Verschmelzung die Erfüllung ihrer Forderung gefährdet wird."
    },
    {
      "date": "2025-10-14",
      "id": "133838",
      "original_text": "Registerbekanntmachung nach dem Umwandlungsgesetz\nSaarland Amtsgericht Saarbrücken HRA 13690\nDSG Clean Saar Glas- und Gebäudereinigung e.K. – Neunkirchen",
      "type": "Registerbekanntmachung nach dem Umwandlungsgesetz",
      "state": "Saarland",
      "amtsgericht": "Amtsgericht Saarbrücken",
      "registernummer": "HRA 13690",
      "registerart": "HRA",
      "company_name": "DSG Clean Saar Glas- und Gebäudereinigung e.K.",
      "company_seat": "Neunkirchen",
      "details": "14.10.2025 (Bekanntmachungsdatum)\n\nSaarland Amtsgericht Saarbrücken HRA 13690\nRegisterbekanntmachung nach dem Umwandlungsgesetz 14.10.2025 (Eintragungsdatum)\n\nDSG Clean Saar Glas- und Gebäudereinigung e.K.\nEinzelkaufmann / Einzelkauffrau\nNeunkirchen\n\nAls nicht eingetragen wird bekannt gemacht: Den Gläubigern der an der Verschmelzung beteiligten Gesellschaften ist, wenn sie binnen sechs Monaten nach dem Tag, an dem die Eintragung der Verschmelzung in das Register des Sitzes desjenigen Rechtsträgers, dessen Gläubiger sie sind, nach § 19 Absatz 3 UmwG bekannt gemacht worden ist, ihren Anspruch nach Grund und Höhe schriftlich anmelden, Sicherheit zu leisten, soweit sie nicht Befriedigung verlangen können. Dieses Recht steht den Gläubigern jedoch nur zu, wenn sie glaubhaft machen, dass durch die Verschmelzung die Erfüllung ihrer Forderung gefährdet wird."
    },
    {
      "date": "2025-10-14",
      "id": "133839",
      "original_text": "Registerbekanntmachung nach dem Umwandlungsgesetz\nSaarland Amtsgericht Saarbrücken HRA 13747\nRaumdesign Schiegl e.K. – Homburg",
      "type": "Registerbekanntmachung nach dem Umwandlungsgesetz",
      "state": "Saarland",
      "amtsgericht": "Amtsgericht Saarbrücken",
      "registernummer": "HRA 13747",
      "registerart": "HRA",
      "company_name": "Raumdesign Schiegl e.K.",
      "company_seat": "Homburg",
      "details": "14.10.2025 (Bekanntmachungsdatum)\n\nSaarland Amtsgericht Saarbrücken HRA 13747\nRegisterbekanntmachung nach dem Umwandlungsgesetz 14.10.2025 (Eintragungsdatum)\n\nRaumdesign Schiegl e.K.\nEinzelkaufmann / Einzelkauffrau\nHomburg\n\nAls nicht eingetragen wird bekannt gemacht: Den Gläubigern der an der Verschmelzung beteiligten Gesellschaften ist, wenn sie binnen sechs Monaten nach dem Tag, an dem die Eintragung der Verschmelzung in das Register des Sitzes desjenigen Rechtsträgers, dessen Gläubiger sie sind, nach § 19 Absatz 3 UmwG bekannt gemacht worden ist, ihren Anspruch nach Grund und Höhe schriftlich anmelden, Sicherheit zu leisten, soweit sie nicht Befriedigung verlangen können. Dieses Recht steht den Gläubigern jedoch nur zu, wenn sie glaubhaft machen, dass durch die Verschmelzung die Erfüllung ihrer Forderung gefährdet wird."
    },
    {
      "date": "2025-10-14",
      "id": "133840",
      "original_text": "Registerbekanntmachung nach dem Umwandlungsgesetz\nSaarland Amtsgericht Saarbrücken HRB 100636\nRaum-Design Schiegl GmbH – Homburg",
      "type": "Registerbekanntmachung nach dem Umwandlungsgesetz",
      "state": "Saarland",
      "amtsgericht": "Amtsgericht Saarbrücken",
      "registernummer": "HRB 100636",
      "registerart": "HRB",
      "company_name": "Raum-Design Schiegl GmbH",
      "company_seat": "Homburg",
      "details": "14.10.2025 (Bekanntmachungsdatum)\n\nSaarland Amtsgericht Saarbrücken HRB 100636\nRegisterbekanntmachung nach dem Umwandlungsgesetz 14.10.2025 (Eintragungsdatum)\n\nRaum-Design Schiegl GmbH\nGesellschaft mit beschränkter Haftung\nHomburg\n\nAls nicht eingetragen wird bekannt gemacht: Den Gläubigern der an der Verschmelzung beteiligten Gesellschaften ist, wenn sie binnen sechs Monaten nach dem Tag, an dem die Eintragung der Verschmelzung in das Register des Sitzes desjenigen Rechtsträgers, dessen Gläubiger sie sind, nach § 19 Absatz 3 UmwG bekannt gemacht worden ist, ihren Anspruch nach Grund und Höhe schriftlich anmelden, Sicherheit zu leisten, soweit sie nicht Befriedigung verlangen können. Dieses Recht steht den Gläubigern jedoch nur zu, wenn sie glaubhaft machen, dass durch die Verschmelzung die Erfüllung ihrer Forderung gefährdet wird."
    },
    {
      "date": "2025-10-14",
      "id": "133841",
      "original_text": "Einreichung neuer Dokumente\nBerlin Amtsgericht Berlin (Charlottenburg) HRB 94083\ne-vendo AG – Berlin",
      "type": "Einreichung neuer Dokumente",
      "state": "Berlin",
      "amtsgericht": "Amtsgericht Berlin (Charlottenburg)",
      "registernummer": "HRB 94083",
      "registerart": "HRB",
      "company_name": "e-vendo AG",
      "company_seat": "Berlin",
      "details": "14.10.2025 (Bekanntmachungsdatum)\n\nBerlin Amtsgericht Berlin (Charlottenburg) HRB 94083\nEinreichung neuer Dokumente\n\ne-vendo AG\nAktiengesellschaft\nBerlin\n\nAls nicht eingetragen wird veröffentlicht:Gläubigern, deren Forderungen begründet worden sind, bevor die Eintragung des Beschlusses als nach § 10 des Handelsgesetzbuches bekannt gemacht gilt, ist, wenn sie sich binnen sechs Monaten nach der Bekanntmachung zu diesem Zweck melden, Sicherheit zu leisten, soweit sie nicht Befriedigung verlangen können. Dieses Recht steht den Gläubigern nicht zu, die im Fall des Insolvenzverfahrens ein Recht auf vorzugsweise Befriedigung aus der Deckungsmasse haben, die nach gesetzlicher Vorschrift zu ihrem Schutz errichtet und staatlich überwacht ist."
    },
    {
      "date": "2025-10-14",
      "id": "133842",
      "original_text": "Einreichung neuer Dokumente\nBaden-Württemberg Amtsgericht Stuttgart HRB 792328\nTTS Europe SE – Wendlingen am Neckar",
      "type": "Einreichung neuer Dokumente",
      "state": "Baden-Württemberg",
      "amtsgericht": "Amtsgericht Stuttgart",
      "registernummer": "HRB 792328",
      "registerart": "HRB",
      "company_name": "TTS Europe SE",
      "company_seat": "Wendlingen am Neckar",
      "details": "14.10.2025 (Bekanntmachungsdatum)\n\nBaden-Württemberg Amtsgericht Stuttgart HRB 792328\nEinreichung neuer Dokumente\n\nTTS Europe SE\nEuropäische Aktiengesellschaft (SE)\nWendlingen am Neckar\n\nDie Gesellschaft hat am 10.10.2025 die Liste über die Zusammensetzung des Aufsichtsrats zum Handelsregister eingereicht."
    },
    {
      "date": "2025-10-14",
      "id": "133843",
      "original_text": "Registerbekanntmachung nach dem Umwandlungsgesetz\nHamburg Amtsgericht Hamburg HRB 73499\nEUROGATE Container Terminal Hamburg GmbH – Hamburg",
      "type": "Registerbekanntmachung nach dem Umwandlungsgesetz",
      "state": "Hamburg",
      "amtsgericht": "Amtsgericht Hamburg",
      "registernummer": "HRB 73499",
      "registerart": "HRB",
      "company_name": "EUROGATE Container Terminal Hamburg GmbH",
      "company_seat": "Hamburg",
      "details": "14.10.2025 (Bekanntmachungsdatum)\n\nHamburg Amtsgericht Hamburg HRB 73499\nRegisterbekanntmachung nach dem Umwandlungsgesetz 14.10.2025 (Eintragungsdatum)\n\nEUROGATE Container Terminal Hamburg GmbH\nGesellschaft mit beschränkter Haftung\nHamburg\n\nAls nicht eingetragen wird bekannt gemacht:\nDen Gläubigern der an der Abspaltung beteiligten Gesellschaften ist, wenn sie binnen sechs Monaten nach dem Tag, an dem die Eintragung der Abspaltung in das Register des Sitzes desjenigen Rechtsträgers, dessen Gläubiger sie sind, nach § 19 Absatz 3 UmwG als bekannt gemacht gilt, ihren Anspruch nach Grund und Höhe schriftlich anmelden, Sicherheit zu leisten, soweit sie nicht Befriedigung verlangen können. Dieses Recht steht den Gläubigern jedoch nur zu, wenn sie glaubhaft machen, dass durch die Abspaltung die Erfüllung ihrer Forderung gefährdet wird."
    },
    {
      "date": "2025-10-14",
      "id": "133844",
      "original_text": "Registerbekanntmachung nach dem Umwandlungsgesetz\nSchleswig-Holstein Amtsgericht Lübeck HRB 26709\nCity Box 24 Betriebs GmbH – Lübeck",
      "type": "Registerbekanntmachung nach dem Umwandlungsgesetz",
      "state": "Schleswig-Holstein",
      "amtsgericht": "Amtsgericht Lübeck",
      "registernummer": "HRB 26709",
      "registerart": "HRB",
      "company_name": "City Box 24 Betriebs GmbH",
      "company_seat": "Lübeck",
      "details": "14.10.2025 (Bekanntmachungsdatum)\n\nSchleswig-Holstein Amtsgericht Lübeck HRB 26709\nRegisterbekanntmachung nach dem Umwandlungsgesetz 14.10.2025 (Eintragungsdatum)\n\nCity Box 24 Betriebs GmbH\nGesellschaft mit beschränkter Haftung\nLübeck\n\nZu Eintragungsnummer 1 vom 14.10.2025 wird als nicht eingetragen veröffentlicht:  Den Gläubigern der an der Spaltung beteiligten Rechtsträger ist, wenn sie binnen sechs Monaten nach dem Tag, an dem die Eintragung der Spaltung in das Register des Sitzes desjenigen Rechtsträgers, dessen Gläubiger sie sind, als bekannt gemacht gilt, ihren Anspruch nach Grund und Höhe schriftlich anmelden, Sicherheit zu leisten, soweit sie nicht Befriedigung verlangen können. Dieses Recht steht den Gläubigern jedoch nur zu, wenn sie glaubhaft machen, dass durch die Spaltung die Erfüllung ihrer Forderung gefährdet wird."
    },
    {
      "date": "2025-10-14",
      "id": "133845",
      "original_text": "Registerbekanntmachung nach dem Umwandlungsgesetz\nHamburg Amtsgericht Hamburg HRB 82856\nBRICK Bau-Holding GmbH – Hamburg",
      "type": "Registerbekanntmachung nach dem Umwandlungsgesetz",
      "state": "Hamburg",
      "amtsgericht": "Amtsgericht Hamburg",
      "registernummer": "HRB 82856",
      "registerart": "HRB",
      "company_name": "BRICK Bau-Holding GmbH",
      "company_seat": "Hamburg",
      "details": "14.10.2025 (Bekanntmachungsdatum)\n\nHamburg Amtsgericht Hamburg HRB 82856\nRegisterbekanntmachung nach dem Umwandlungsgesetz 14.10.2025 (Eintragungsdatum)\n\nBRICK Bau-Holding GmbH\nGesellschaft mit beschränkter Haftung\nHamburg\n\nAls nicht eingetragen wird bekannt gemacht:\nDen Gläubigern der an der Verschmelzung beteiligten Gesellschaften ist, wenn sie binnen sechs Monaten nach dem Tag, an dem die Eintragung der Verschmelzung in das Register des Sitzes desjenigen Rechtsträgers, dessen Gläubiger sie sind, nach § 19 Absatz 3 UmwG als bekannt gemacht gilt, ihren Anspruch nach Grund und Höhe schriftlich anmelden, Sicherheit zu leisten, soweit sie nicht Befriedigung verlangen können. Dieses Recht steht den Gläubigern jedoch nur zu, wenn sie glaubhaft machen, dass durch die Verschmelzung die Erfüllung ihrer Forderung gefährdet wird."
    },
    {
      "date": "2025-10-14",
      "id": "133846",
      "original_text": "Registerbekanntmachung nach dem Umwandlungsgesetz\nHamburg Amtsgericht Hamburg HRA 131806\nTheodor Müller Software e.K. – Hamburg",
      "type": "Registerbekanntmachung nach dem Umwandlungsgesetz",
      "state": "Hamburg",
      "amtsgericht": "Amtsgericht Hamburg",
      "registernummer": "HRA 131806",
      "registerart": "HRA",
      "company_name": "Theodor Müller Software e.K.",
      "company_seat": "Hamburg",
      "details": "14.10.2025 (Bekanntmachungsdatum)\n\nHamburg Amtsgericht Hamburg HRA 131806\nRegisterbekanntmachung nach dem Umwandlungsgesetz 14.10.2025 (Eintragungsdatum)\n\nTheodor Müller Software e.K.\nEinzelkaufmann\nHamburg\n\nAls nicht eingetragen wird bekannt gemacht:\nDen Gläubigern der an der Ausgliederung beteiligten Gesellschaften ist, wenn sie binnen sechs Monaten nach dem Tag, an dem die Eintragung der Ausgliederung in das Register des Sitzes desjenigen Rechtsträgers, dessen Gläubiger sie sind, nach § 19 Absatz 3 UmwG als bekannt gemacht gilt, ihren Anspruch nach Grund und Höhe schriftlich anmelden, Sicherheit zu leisten, soweit sie nicht Befriedigung verlangen können. Dieses Recht steht den Gläubigern jedoch nur zu, wenn sie glaubhaft machen, dass durch die Ausgliederung die Erfüllung ihrer Forderung gefährdet wird."
    },
    {
      "date": "2025-10-14",
      "id": "133847",
      "original_text": "Registerbekanntmachung nach dem Umwandlungsgesetz\nHamburg Amtsgericht Hamburg HRB 82856\nBRICK Bau-Holding GmbH – Hamburg",
      "type": "Registerbekanntmachung nach dem Umwandlungsgesetz",
      "state": "Hamburg",
      "amtsgericht": "Amtsgericht Hamburg",
      "registernummer": "HRB 82856",
      "registerart": "HRB",
      "company_name": "BRICK Bau-Holding GmbH",
      "company_seat": "Hamburg",
      "details": "14.10.2025 (Bekanntmachungsdatum)\n\nHamburg Amtsgericht Hamburg HRB 82856\nRegisterbekanntmachung nach dem Umwandlungsgesetz 14.10.2025 (Eintragungsdatum)\n\nBRICK Bau-Holding GmbH\nGesellschaft mit beschränkter Haftung\nHamburg\n\nAls nicht eingetragen wird bekannt gemacht:\nDen Gläubigern der an der Verschmelzung beteiligten Gesellschaften ist, wenn sie binnen sechs Monaten nach dem Tag, an dem die Eintragung der Verschmelzung in das Register des Sitzes desjenigen Rechtsträgers, dessen Gläubiger sie sind, nach § 19 Absatz 3 UmwG als bekannt gemacht gilt, ihren Anspruch nach Grund und Höhe schriftlich anmelden, Sicherheit zu leisten, soweit sie nicht Befriedigung verlangen können. Dieses Recht steht den Gläubigern jedoch nur zu, wenn sie glaubhaft machen, dass durch die Verschmelzung die Erfüllung ihrer Forderung gefährdet wird."
    },
    {
      "date": "2025-10-14",
      "id": "133848",
      "original_text": "Registerbekanntmachung nach dem Umwandlungsgesetz\nHamburg Amtsgericht Hamburg HRB 81517\nBRICK Beteiligungs GmbH – Hamburg",
      "type": "Registerbekanntmachung nach dem Umwandlungsgesetz",
      "state": "Hamburg",
      "amtsgericht": "Amtsgericht Hamburg",
      "registernummer": "HRB 81517",
      "registerart": "HRB",
      "company_name": "BRICK Beteiligungs GmbH",
      "company_seat": "Hamburg",
      "details": "14.10.2025 (Bekanntmachungsdatum)\n\nHamburg Amtsgericht Hamburg HRB 81517\nRegisterbekanntmachung nach dem Umwandlungsgesetz 14.10.2025 (Eintragungsdatum)\n\nBRICK Beteiligungs GmbH\nGesellschaft mit beschränkter Haftung\nHamburg\n\nAls nicht eingetragen wird bekannt gemacht:\nDen Gläubigern der an der Verschmelzung beteiligten Gesellschaften ist, wenn sie binnen sechs Monaten nach dem Tag, an dem die Eintragung der Verschmelzung in das Register des Sitzes desjenigen Rechtsträgers, dessen Gläubiger sie sind, nach § 19 Absatz 3 UmwG als bekannt gemacht gilt, ihren Anspruch nach Grund und Höhe schriftlich anmelden, Sicherheit zu leisten, soweit sie nicht Befriedigung verlangen können. Dieses Recht steht den Gläubigern jedoch nur zu, wenn sie glaubhaft machen, dass durch die Verschmelzung die Erfüllung ihrer Forderung gefährdet wird."
    },
    {
      "date": "2025-10-14",
      "id": "133849",
      "original_text": "Registerbekanntmachung nach dem Umwandlungsgesetz\nHamburg Amtsgericht Hamburg HRB 141436\nTrilliarden Entertainment GmbH – Hamburg",
      "type": "Registerbekanntmachung nach dem Umwandlungsgesetz",
      "state": "Hamburg",
      "amtsgericht": "Amtsgericht Hamburg",
      "registernummer": "HRB 141436",
      "registerart": "HRB",
      "company_name": "Trilliarden Entertainment GmbH",
      "company_seat": "Hamburg",
      "details": "14.10.2025 (Bekanntmachungsdatum)\n\nHamburg Amtsgericht Hamburg HRB 141436\nRegisterbekanntmachung nach dem Umwandlungsgesetz 14.10.2025 (Eintragungsdatum)\n\nTrilliarden Entertainment GmbH\nGesellschaft mit beschränkter Haftung\nHamburg\n\nAls nicht eingetragen wird bekannt gemacht:\nDen Gläubigern der an der Ausgliederung beteiligten Gesellschaften ist, wenn sie binnen sechs Monaten nach dem Tag, an dem die Eintragung der Ausgliederung in das Register des Sitzes desjenigen Rechtsträgers, dessen Gläubiger sie sind, nach § 19 Absatz 3 UmwG als bekannt gemacht gilt, ihren Anspruch nach Grund und Höhe schriftlich anmelden, Sicherheit zu leisten, soweit sie nicht Befriedigung verlangen können. Dieses Recht steht den Gläubigern jedoch nur zu, wenn sie glaubhaft machen, dass durch die Ausgliederung die Erfüllung ihrer Forderung gefährdet wird."
    },
    {
      "date": "2025-10-14",
      "id": "133850",
      "original_text": "Registerbekanntmachung nach dem Umwandlungsgesetz\nHamburg Amtsgericht Hamburg HRB 76662\nBRICK Wohnungsbau GmbH – Hamburg",
      "type": "Registerbekanntmachung nach dem Umwandlungsgesetz",
      "state": "Hamburg",
      "amtsgericht": "Amtsgericht Hamburg",
      "registernummer": "HRB 76662",
      "registerart": "HRB",
      "company_name": "BRICK Wohnungsbau GmbH",
      "company_seat": "Hamburg",
      "details": "14.10.2025 (Bekanntmachungsdatum)\n\nHamburg Amtsgericht Hamburg HRB 76662\nRegisterbekanntmachung nach dem Umwandlungsgesetz 14.10.2025 (Eintragungsdatum)\n\nBRICK Wohnungsbau GmbH\nGesellschaft mit beschränkter Haftung\nHamburg\n\nAls nicht eingetragen wird bekannt gemacht:\nDen Gläubigern der an der Verschmelzung beteiligten Gesellschaften ist, wenn sie binnen sechs Monaten nach dem Tag, an dem die Eintragung der Verschmelzung in das Register des Sitzes desjenigen Rechtsträgers, dessen Gläubiger sie sind, nach § 19 Absatz 3 UmwG als bekannt gemacht gilt, ihren Anspruch nach Grund und Höhe schriftlich anmelden, Sicherheit zu leisten, soweit sie nicht Befriedigung verlangen können. Dieses Recht steht den Gläubigern jedoch nur zu, wenn sie glaubhaft machen, dass durch die Verschmelzung die Erfüllung ihrer Forderung gefährdet wird."
    },
    {
      "date": "2025-10-14",
      "id": "133851",
      "original_text": "Registerbekanntmachung nach dem Umwandlungsgesetz\nBaden-Württemberg Amtsgericht Stuttgart HRB 775407\nAUDERE LC-Invest No. 1 GmbH – Fellbach",
      "type": "Registerbekanntmachung nach dem Umwandlungsgesetz",
      "state": "Baden-Württemberg",
      "amtsgericht": "Amtsgericht Stuttgart",
      "registernummer": "HRB 775407",
      "registerart": "HRB",
      "company_name": "AUDERE LC-Invest No. 1 GmbH",
      "company_seat": "Fellbach",
      "details": "14.10.2025 (Bekanntmachungsdatum)\n\nBaden-Württemberg Amtsgericht Stuttgart HRB 775407\nRegisterbekanntmachung nach dem Umwandlungsgesetz 14.10.2025 (Eintragungsdatum)\n\nAUDERE LC-Invest No. 1 GmbH\nGesellschaft mit beschränkter Haftung\nFellbach\n\nDen Gläubigern der an der Verschmelzung beteiligten Rechtsträger ist, wenn sie binnen sechs Monaten nach dem Tag, an dem die Eintragung der Verschmelzung in das Register des Sitzes desjenigen Rechtsträgers, dessen Gläubiger sie sind, nach § 19 Abs. 3 UmwG als bekanntgemacht gilt, ihren Anspruch nach Grund und Höhe schriftlich anmelden, Sicherheit zu leisten, soweit sie nicht Befriedigung verlangen können. Dieses Recht steht den Gläubigern jedoch nur zu, wenn sie glaubhaft machen, dass durch die Verschmelzung die Erfüllung ihrer Forderung gefährdet wird."
    },
    {
      "date": "2025-10-14",
      "id": "133852",
      "original_text": "Registerbekanntmachung nach dem Umwandlungsgesetz\nBaden-Württemberg Amtsgericht Freiburg HRA 709239\nHorst Leisinger e.K. – Kleines Wiesental",
      "type": "Registerbekanntmachung nach dem Umwandlungsgesetz",
      "state": "Baden-Württemberg",
      "amtsgericht": "Amtsgericht Freiburg",
      "registernummer": "HRA 709239",
      "registerart": "HRA",
      "company_name": "Horst Leisinger e.K.",
      "company_seat": "Kleines Wiesental",
      "details": "14.10.2025 (Bekanntmachungsdatum)\n\nBaden-Württemberg Amtsgericht Freiburg HRA 709239\nRegisterbekanntmachung nach dem Umwandlungsgesetz 14.10.2025 (Eintragungsdatum)\n\nHorst Leisinger e.K.\nEinzelkaufmann / Einzelkauffrau\nKleines Wiesental\n\nAls nicht eingetragen wird bekanntgemacht:\nDen Gläubigern der an der Ausgliederung beteiligten Rechtsträger ist, wenn sie binnen sechs Monaten nach dem Tag, an dem die Eintragung der Ausgliederung in das Register des Sitzes desjenigen Rechtsträgers, dessen Gläubiger sie sind, nach § 19 Abs. 3 UmwG als bekanntgemacht gilt, ihren Anspruch nach Grund und Höhe schriftlich anmelden, Sicherheit zu leisten, soweit sie nicht Befriedigung verlangen können. Dieses Recht steht den Gläubigern jedoch nur zu, wenn sie glaubhaft machen, dass durch die Ausgliederung die Erfüllung ihrer Forderung gefährdet wird."
    },
    {
      "date": "2025-10-14",
      "id": "133853",
      "original_text": "Registerbekanntmachung nach dem Umwandlungsgesetz\nBaden-Württemberg Amtsgericht Mannheim HRB 747571\nALU Top Design GmbH – Karlsbad",
      "type": "Registerbekanntmachung nach dem Umwandlungsgesetz",
      "state": "Baden-Württemberg",
      "amtsgericht": "Amtsgericht Mannheim",
      "registernummer": "HRB 747571",
      "registerart": "HRB",
      "company_name": "ALU Top Design GmbH",
      "company_seat": "Karlsbad",
      "details": "14.10.2025 (Bekanntmachungsdatum)\n\nBaden-Württemberg Amtsgericht Mannheim HRB 747571\nRegisterbekanntmachung nach dem Umwandlungsgesetz 14.10.2025 (Eintragungsdatum)\n\nALU Top Design GmbH\nGesellschaft mit beschränkter Haftung\nKarlsbad\n\nAls nicht eingetragen wird bekanntgemacht: Den Gläubigern der an der Verschmelzung beteiligten Rechtsträger ist, wenn sie binnen sechs Monaten nach dem Tag, an dem die Eintragung der Verschmelzung in das Register des Sitzes desjenigen Rechtsträgers, dessen Gläubiger sie sind, nach § 19 Abs. 3 UmwG als bekanntgemacht gilt, ihren Anspruch nach Grund und Höhe schriftlich anmelden, Sicherheit zu leisten, soweit sie nicht Befriedigung verlangen können. Dieses Recht steht den Gläubigern jedoch nur zu, wenn sie glaubhaft machen, dass durch die Verschmelzung die Erfüllung ihrer Forderung gefährdet wird."
    },
    {
      "date": "2025-10-14",
      "id": "133854",
      "original_text": "Registerbekanntmachung nach dem Umwandlungsgesetz\nBaden-Württemberg Amtsgericht Mannheim HRB 747572\nUK Profi GmbH – Karlsbad",
      "type": "Registerbekanntmachung nach dem Umwandlungsgesetz",
      "state": "Baden-Württemberg",
      "amtsgericht": "Amtsgericht Mannheim",
      "registernummer": "HRB 747572",
      "registerart": "HRB",
      "company_name": "UK Profi GmbH",
      "company_seat": "Karlsbad",
      "details": "14.10.2025 (Bekanntmachungsdatum)\n\nBaden-Württemberg Amtsgericht Mannheim HRB 747572\nRegisterbekanntmachung nach dem Umwandlungsgesetz 14.10.2025 (Eintragungsdatum)\n\nUK Profi GmbH\nGesellschaft mit beschränkter Haftung\nKarlsbad\n\nDen Gläubigern der an der Verschmelzung beteiligten Rechtsträger ist, wenn sie binnen sechs Monaten nach dem Tag, an dem die Eintragung der Verschmelzung in das Register des Sitzes desjenigen Rechtsträgers, dessen Gläubiger sie sind, nach § 19 Abs. 3 UmwG als bekanntgemacht gilt, ihren Anspruch nach Grund und Höhe schriftlich anmelden, Sicherheit zu leisten, soweit sie nicht Befriedigung verlangen können. Dieses Recht steht den Gläubigern jedoch nur zu, wenn sie glaubhaft machen, dass durch die Verschmelzung die Erfüllung ihrer Forderung gefährdet wird."
    },
    {
      "date": "2025-10-14",
      "id": "133855",
      "original_text": "Registerbekanntmachung nach dem Umwandlungsgesetz\nHamburg Amtsgericht Hamburg HRB 81517\nBRICK Beteiligungs GmbH – Hamburg",
      "type": "Registerbekanntmachung nach dem Umwandlungsgesetz",
      "state": "Hamburg",
      "amtsgericht": "Amtsgericht Hamburg",
      "registernummer": "HRB 81517",
      "registerart": "HRB",
      "company_name": "BRICK Beteiligungs GmbH",
      "company_seat": "Hamburg",
      "details": "14.10.2025 (Bekanntmachungsdatum)\n\nHamburg Amtsgericht Hamburg HRB 81517\nRegisterbekanntmachung nach dem Umwandlungsgesetz 14.10.2025 (Eintragungsdatum)\n\nBRICK Beteiligungs GmbH\nGesellschaft mit beschränkter Haftung\nHamburg\n\nAls nicht eingetragen wird bekannt gemacht:\nDen Gläubigern der an der Verschmelzung beteiligten Gesellschaften ist, wenn sie binnen sechs Monaten nach dem Tag, an dem die Eintragung der Verschmelzung in das Register des Sitzes desjenigen Rechtsträgers, dessen Gläubiger sie sind, nach § 19 Absatz 3 UmwG als bekannt gemacht gilt, ihren Anspruch nach Grund und Höhe schriftlich anmelden, Sicherheit zu leisten, soweit sie nicht Befriedigung verlangen können. Dieses Recht steht den Gläubigern jedoch nur zu, wenn sie glaubhaft machen, dass durch die Verschmelzung die Erfüllung ihrer Forderung gefährdet wird."
    },
    {
      "date": "2025-10-14",
      "id": "133856",
      "original_text": "Registerbekanntmachung nach dem Umwandlungsgesetz\nHamburg Amtsgericht Hamburg HRB 68239\nBrick Rainvilles GmbH – Hamburg",
      "type": "Registerbekanntmachung nach dem Umwandlungsgesetz",
      "state": "Hamburg",
      "amtsgericht": "Amtsgericht Hamburg",
      "registernummer": "HRB 68239",
      "registerart": "HRB",
      "company_name": "Brick Rainvilles GmbH",
      "company_seat": "Hamburg",
      "details": "14.10.2025 (Bekanntmachungsdatum)\n\nHamburg Amtsgericht Hamburg HRB 68239\nRegisterbekanntmachung nach dem Umwandlungsgesetz 14.10.2025 (Eintragungsdatum)\n\nBrick Rainvilles GmbH\nGesellschaft mit beschränkter Haftung\nHamburg\n\nAls nicht eingetragen wird bekannt gemacht:\nDen Gläubigern der an der Verschmelzung beteiligten Gesellschaften ist, wenn sie binnen sechs Monaten nach dem Tag, an dem die Eintragung der Verschmelzung in das Register des Sitzes desjenigen Rechtsträgers, dessen Gläubiger sie sind, nach § 19 Absatz 3 UmwG als bekannt gemacht gilt, ihren Anspruch nach Grund und Höhe schriftlich anmelden, Sicherheit zu leisten, soweit sie nicht Befriedigung verlangen können. Dieses Recht steht den Gläubigern jedoch nur zu, wenn sie glaubhaft machen, dass durch die Verschmelzung die Erfüllung ihrer Forderung gefährdet wird."
    },
    {
      "date": "2025-10-14",
      "id": "133857",
      "original_text": "Einreichung neuer Dokumente\nBerlin Amtsgericht Berlin (Charlottenburg) HRB 224621\nVelero Immobilien GmbH – Berlin",
      "type": "Einreichung neuer Dokumente",
      "state": "Berlin",
      "amtsgericht": "Amtsgericht Berlin (Charlottenburg)",
      "registernummer": "HRB 224621",
      "registerart": "HRB",
      "company_name": "Velero Immobilien GmbH",
      "company_seat": "Berlin",
      "details": "14.10.2025 (Bekanntmachungsdatum)\n\nBerlin Amtsgericht Berlin (Charlottenburg) HRB 224621\nEinreichung neuer Dokumente\n\nVelero Immobilien GmbH\nGesellschaft mit beschränkter Haftung\nBerlin\n\nAls nicht eingetragen wird veröffentlicht: Es wurde eine neue Liste der Aufsichtsratsmitglieder eingereicht (§52 GmbHG)."
    },
    {
      "date": "2025-10-14",
      "id": "133858",
      "original_text": "Registerbekanntmachung nach dem Umwandlungsgesetz\nSchleswig-Holstein Amtsgericht Lübeck HRB 2966\nHWP Maler & Ausbauer SH GmbH – Lübeck",
      "type": "Registerbekanntmachung nach dem Umwandlungsgesetz",
      "state": "Schleswig-Holstein",
      "amtsgericht": "Amtsgericht Lübeck",
      "registernummer": "HRB 2966",
      "registerart": "HRB",
      "company_name": "HWP Maler & Ausbauer SH GmbH",
      "company_seat": "Lübeck",
      "details": "14.10.2025 (Bekanntmachungsdatum)\n\nSchleswig-Holstein Amtsgericht Lübeck HRB 2966\nRegisterbekanntmachung nach dem Umwandlungsgesetz 13.10.2025 (Eintragungsdatum)\n\nHWP Maler & Ausbauer SH GmbH\nGesellschaft mit beschränkter Haftung\nLübeck\n\nZu Eintragungsnummer 15 vom 13.10.2025 wird als nicht eingetragen veröffentlicht:  Als nicht eingetragen wird veröffentlicht: Den Gläubigern der an der Spaltung beteiligten Rechtsträger ist, wenn sie binnen sechs Monaten nach dem Tag, an dem die Eintragung der Spaltung in das Register des Sitzes desjenigen Rechtsträgers, dessen Gläubiger sie sind, als bekannt gemacht gilt, ihren Anspruch nach Grund und Höhe schriftlich anmelden, Sicherheit zu leisten, soweit sie nicht Befriedigung verlangen können. Dieses Recht steht den Gläubigern jedoch nur zu, wenn sie glaubhaft machen, dass durch die Spaltung die Erfüllung ihrer Forderung gefährdet wird."
    },
    {
      "date": "2025-10-14",
      "id": "133859",
      "original_text": "Registerbekanntmachung nach dem Umwandlungsgesetz\nMecklenburg-Vorpommern Amtsgericht Schwerin HRB 15363\nDie Gartenbauer GmbH – Schwerin",
      "type": "Registerbekanntmachung nach dem Umwandlungsgesetz",
      "state": "Mecklenburg-Vorpommern",
      "amtsgericht": "Amtsgericht Schwerin",
      "registernummer": "HRB 15363",
      "registerart": "HRB",
      "company_name": "Die Gartenbauer GmbH",
      "company_seat": "Schwerin",
      "details": "14.10.2025 (Bekanntmachungsdatum)\n\nMecklenburg-Vorpommern Amtsgericht Schwerin HRB 15363\nRegisterbekanntmachung nach dem Umwandlungsgesetz 14.10.2025 (Eintragungsdatum)\n\nDie Gartenbauer GmbH\nGesellschaft mit beschränkter Haftung\nSchwerin\n\nDen Gläubigern der am Formwechsel beteiligten Rechtsträger ist, wenn sie binnen sechs Monaten nach dem Tag, an dem die Eintragung des Formwechsels in das Register des Sitzes desjenigen Rechtsträgers, dessen Gläubiger sie sind, nach § 201 UmwG als bekanntgemacht gilt, ihren Anspruch nach Grund und Höhe schriftlich anmelden, Sicherheit zu leisten, soweit sie nicht Befriedigung verlangen können. Dieses Recht steht den Gläubigern jedoch nur zu, wenn sie glaubhaft machen, dass durch den Formwechsel die Erfüllung ihrer Forderung gefährdet wird."
    },
    {
      "date": "2025-10-14",
      "id": "133860",
      "original_text": "Registerbekanntmachung nach dem Umwandlungsgesetz\nBerlin Amtsgericht Berlin (Charlottenburg) HRB 176726\nFVV Verwaltung GmbH – Berlin",
      "type": "Registerbekanntmachung nach dem Umwandlungsgesetz",
      "state": "Berlin",
      "amtsgericht": "Amtsgericht Berlin (Charlottenburg)",
      "registernummer": "HRB 176726",
      "registerart": "HRB",
      "company_name": "FVV Verwaltung GmbH",
      "company_seat": "Berlin",
      "details": "14.10.2025 (Bekanntmachungsdatum)\n\nBerlin Amtsgericht Berlin (Charlottenburg) HRB 176726\nRegisterbekanntmachung nach dem Umwandlungsgesetz 14.10.2025 (Eintragungsdatum)\n\nFVV Verwaltung GmbH\nGesellschaft mit beschränkter Haftung\nBerlin\n\nZu Eintragungsnummer 4 vom 14.10.2025 wird als nicht eingetragen veröffentlicht: Den Gläubigern der an der Verschmelzung beteiligten Rechtsträger ist, wenn sie binnen sechs Monaten nach dem Tag, an dem die Eintragung der Verschmelzung in das Register des Sitzes desjenigen Rechtsträgers, dessen Gläubiger sie sind, als bekannt gemacht gilt, ihren Anspruch nach Grund und Höhe schriftlich anmelden, Sicherheit zu leisten, soweit sie nicht Befriedigung verlangen können. Dieses Recht steht den Gläubigern jedoch nur zu, wenn sie glaubhaft machen, dass durch die Verschmelzung die Erfüllung ihrer Forderung gefährdet wird. Das Recht, Sicherheitsleistung zu verlangen, steht Gläubigern nicht zu, die im Falle der Insolvenz ein Recht auf vorzugsweise Befriedigung aus einer Deckungsmasse haben, die nach gesetzlicher Vorschrift zu ihrem Schutz errichtet und staatlich überwacht ist."
    },
    {
      "date": "2025-10-14",
      "id": "133861",
      "original_text": "Registerbekanntmachung nach dem Umwandlungsgesetz\nBerlin Amtsgericht Berlin (Charlottenburg) HRB 237934\nRufimex GmbH – Berlin",
      "type": "Registerbekanntmachung nach dem Umwandlungsgesetz",
      "state": "Berlin",
      "amtsgericht": "Amtsgericht Berlin (Charlottenburg)",
      "registernummer": "HRB 237934",
      "registerart": "HRB",
      "company_name": "Rufimex GmbH",
      "company_seat": "Berlin",
      "details": "14.10.2025 (Bekanntmachungsdatum)\n\nBerlin Amtsgericht Berlin (Charlottenburg) HRB 237934\nRegisterbekanntmachung nach dem Umwandlungsgesetz 14.10.2025 (Eintragungsdatum)\n\nRufimex GmbH\nGesellschaft mit beschränkter Haftung\nBerlin\n\nZu Eintragungsnummer 2 vom 14.10.2025 wird als nicht eingetragen veröffentlicht: Den Gläubigern der an der Verschmelzung beteiligten Rechtsträger ist, wenn sie binnen sechs Monaten nach dem Tag, an dem die Eintragung der Verschmelzung in das Register des Sitzes desjenigen Rechtsträgers, dessen Gläubiger sie sind, als bekannt gemacht gilt, ihren Anspruch nach Grund und Höhe schriftlich anmelden, Sicherheit zu leisten, soweit sie nicht Befriedigung verlangen können. Dieses Recht steht den Gläubigern jedoch nur zu, wenn sie glaubhaft machen, dass durch die Verschmelzung die Erfüllung ihrer Forderung gefährdet wird. Das Recht, Sicherheitsleistung zu verlangen, steht Gläubigern nicht zu, die im Falle der Insolvenz ein Recht auf vorzugsweise Befriedigung aus einer Deckungsmasse haben, die nach gesetzlicher Vorschrift zu ihrem Schutz errichtet und staatlich überwacht ist."
    },
    {
      "date": "2025-10-14",
      "id": "133862",
      "original_text": "Löschungsankündigung\nBrandenburg Amtsgericht Potsdam HRB 19212\nKwando GmbH – Havelsee",
      "type": "Löschungsankündigung",
      "state": "Brandenburg",
      "amtsgericht": "Amtsgericht Potsdam",
      "registernummer": "HRB 19212",
      "registerart": "HRB",
      "company_name": "Kwando GmbH",
      "company_seat": "Havelsee",
      "details": "14.10.2025 (Bekanntmachungsdatum)\n\nBrandenburg Amtsgericht Potsdam HRB 19212\nLöschungsankündigung\n\nKwando GmbH\nGesellschaft mit beschränkter Haftung\nHavelsee\n\nBei der nachstehenden Gesellschaft wird das Amtslöschungsverfahren gemäß § 394 FamFG eingeleitet. Widerspruchsfrist: 8 Wochen"
    },
    {
      "date": "2025-10-14",
      "id": "133863",
      "original_text": "Einreichung neuer Dokumente\nSachsen Amtsgericht Dresden HRB 16019\nLausitzer Seenland Klinikum GmbH – Hoyerswerda",
      "type": "Einreichung neuer Dokumente",
      "state": "Sachsen",
      "amtsgericht": "Amtsgericht Dresden",
      "registernummer": "HRB 16019",
      "registerart": "HRB",
      "company_name": "Lausitzer Seenland Klinikum GmbH",
      "company_seat": "Hoyerswerda",
      "details": "14.10.2025 (Bekanntmachungsdatum)\n\nSachsen Amtsgericht Dresden HRB 16019\nEinreichung neuer Dokumente 13.10.2025 (Eintragungsdatum)\n\nLausitzer Seenland Klinikum GmbH\nGesellschaft mit beschränkter Haftung\nHoyerswerda\n\nAm 13.10.2025 wurde beim Handelsregister des Amtsgerichts Dresden die Liste der Mitglieder des Aufsichtsrats gemäß § 52 GmbHG eingereicht."
    },
    {
      "date": "2025-10-14",
      "id": "133864",
      "original_text": "Löschungsankündigung\nSachsen Amtsgericht Dresden HRB 40053\nhire2go - Personaldienstleistungs UG (haftungsbeschränkt) – Dresden",
      "type": "Löschungsankündigung",
      "state": "Sachsen",
      "amtsgericht": "Amtsgericht Dresden",
      "registernummer": "HRB 40053",
      "registerart": "HRB",
      "company_name": "hire2go - Personaldienstleistungs UG (haftungsbeschränkt)",
      "company_seat": "Dresden",
      "details": "14.10.2025 (Bekanntmachungsdatum)\n\nSachsen Amtsgericht Dresden HRB 40053\nLöschungsankündigung\n\nhire2go - Personaldienstleistungs UG (haftungsbeschränkt)\nGesellschaft mit beschränkter Haftung\nDresden\n\nDas Registergericht beabsichtigt, die im Handelsregister eingetragene Gesellschaft von Amts wegen nach § 394 FamFG zu löschen. Die Frist zu Erhebung eines Widerspruchs gegen die beabsichtigte Löschung wird auf einen Monat festgesetzt."
    },
    {
      "date": "2025-10-14",
      "id": "133865",
      "original_text": "Löschungsankündigung\nSachsen Amtsgericht Chemnitz HRB 32068\nELEGANT Haus GmbH – Reinsberg",
      "type": "Löschungsankündigung",
      "state": "Sachsen",
      "amtsgericht": "Amtsgericht Chemnitz",
      "registernummer": "HRB 32068",
      "registerart": "HRB",
      "company_name": "ELEGANT Haus GmbH",
      "company_seat": "Reinsberg",
      "details": "14.10.2025 (Bekanntmachungsdatum)\n\nSachsen Amtsgericht Chemnitz HRB 32068\nLöschungsankündigung\n\nELEGANT Haus GmbH\nGesellschaft mit beschränkter Haftung\nReinsberg\n\nDas Registergericht beabsichtigt, die im Handelsregister eingetragene Gesellschaft von Amts wegen nach § 394 FamFG zu löschen. Die Frist zu Erhebung eines Widerspruchs gegen die beabsichtigte Löschung wird auf einen Monat festgesetzt."
    },
    {
      "date": "2025-10-14",
      "id": "133866",
      "original_text": "Löschungsankündigung\nSachsen Amtsgericht Leipzig HRA 19195\nContiMaxx Grundbesitz GmbH & Co. Schkeuditz KG – Schkeuditz",
      "type": "Löschungsankündigung",
      "state": "Sachsen",
      "amtsgericht": "Amtsgericht Leipzig",
      "registernummer": "HRA 19195",
      "registerart": "HRA",
      "company_name": "ContiMaxx Grundbesitz GmbH & Co. Schkeuditz KG",
      "company_seat": "Schkeuditz",
      "details": "14.10.2025 (Bekanntmachungsdatum)\n\nSachsen Amtsgericht Leipzig HRA 19195\nLöschungsankündigung\n\nContiMaxx Grundbesitz GmbH & Co. Schkeuditz KG\nKommanditgesellschaft\nSchkeuditz\n\nDas Registergericht beabsichtigt, die im Handelsregister eingetragene Firma von Amts wegen nach § 31 Abs. 2 HGB, 393 FamFG zu löschen. Die Frist zur Erhebung eines Widerspruchs gegen die beabsichtigte Löschung wird auf einen Monat festgesetzt."
    },
    {
      "date": "2025-10-14",
      "id": "133867",
      "original_text": "Registerbekanntmachung nach dem Umwandlungsgesetz\nNiedersachsen Amtsgericht Hannover HRB 4133\nDegener Verlag GmbH – Hannover",
      "type": "Registerbekanntmachung nach dem Umwandlungsgesetz",
      "state": "Niedersachsen",
      "amtsgericht": "Amtsgericht Hannover",
      "registernummer": "HRB 4133",
      "registerart": "HRB",
      "company_name": "Degener Verlag GmbH",
      "company_seat": "Hannover",
      "details": "14.10.2025 (Bekanntmachungsdatum)\n\nNiedersachsen Amtsgericht Hannover HRB 4133\nRegisterbekanntmachung nach dem Umwandlungsgesetz 14.10.2025 (Eintragungsdatum)\n\nDegener Verlag GmbH\nGesellschaft mit beschränkter Haftung\nHannover\n\nDen Gläubigern der an der Verschmelzung beteiligten Rechtsträger ist, wenn sie binnen sechs Monaten nach dem Tag, an dem die Eintragung der Verschmelzung in das Register des Sitzes desjenigen Rechtsträgers, dessen Gläubiger sie sind, nach § 19  Abs.  3 UmwG als bekannt gemacht gilt, ihren Anspruch nach Grund und Höhe schriftlich anmelden, Sicherheit zu leisten, soweit sie nicht Befriedigung verlangen können. Dieses Recht steht den Gläubigern jedoch nur zu, wenn sie glaubhaft machen, dass durch die Verschmelzung die Erfüllung der Forderung gefährdet wird."
    },
    {
      "date": "2025-10-14",
      "id": "133868",
      "original_text": "Registerbekanntmachung nach dem Umwandlungsgesetz\nNiedersachsen Amtsgericht Hannover HRB 61791\nDegener International GmbH – Hannover",
      "type": "Registerbekanntmachung nach dem Umwandlungsgesetz",
      "state": "Niedersachsen",
      "amtsgericht": "Amtsgericht Hannover",
      "registernummer": "HRB 61791",
      "registerart": "HRB",
      "company_name": "Degener International GmbH",
      "company_seat": "Hannover",
      "details": "14.10.2025 (Bekanntmachungsdatum)\n\nNiedersachsen Amtsgericht Hannover HRB 61791\nRegisterbekanntmachung nach dem Umwandlungsgesetz 14.10.2025 (Eintragungsdatum)\n\nDegener International GmbH\nGesellschaft mit beschränkter Haftung\nHannover\n\nDen Gläubigern der an der Verschmelzung beteiligten Rechtsträger ist, wenn sie binnen sechs Monaten nach dem Tag, an dem die Eintragung der Verschmelzung in das Register des Sitzes desjenigen Rechtsträgers, dessen Gläubiger sie sind, nach § 19  Abs.  3 UmwG als bekannt gemacht gilt, ihren Anspruch nach Grund und Höhe schriftlich anmelden, Sicherheit zu leisten, soweit sie nicht Befriedigung verlangen können. Dieses Recht steht den Gläubigern jedoch nur zu, wenn sie glaubhaft machen, dass durch die Verschmelzung die Erfüllung der Forderung gefährdet wird."
    },
    {
      "date": "2025-10-14",
      "id": "133869",
      "original_text": "Löschungsankündigung\nNiedersachsen Amtsgericht Osnabrück HRB 207903\nRofra Home Osnabrück GmbH – Osnabrück",
      "type": "Löschungsankündigung",
      "state": "Niedersachsen",
      "amtsgericht": "Amtsgericht Osnabrück",
      "registernummer": "HRB 207903",
      "registerart": "HRB",
      "company_name": "Rofra Home Osnabrück GmbH",
      "company_seat": "Osnabrück",
      "details": "14.10.2025 (Bekanntmachungsdatum)\n\nNiedersachsen Amtsgericht Osnabrück HRB 207903\nLöschungsankündigung\n\nRofra Home Osnabrück GmbH\nGesellschaft mit beschränkter Haftung\nOsnabrück\n\nDas Registergericht beabsichtigt, die Gesellschaft von Amts wegen nach § 394 FamFG wegen Vermögenslosigkeit zu löschen. Die Frist zur Erhebung eines Widerspruchs ist auf 1 Monat ab dieser Registerbekanntmachung festgesetzt."
    },
    {
      "date": "2025-10-14",
      "id": "133870",
      "original_text": "Einreichung neuer Dokumente\nNiedersachsen Amtsgericht Osnabrück HRB 20215\nIQ-Agrar Service GmbH – Osnabrück",
      "type": "Einreichung neuer Dokumente",
      "state": "Niedersachsen",
      "amtsgericht": "Amtsgericht Osnabrück",
      "registernummer": "HRB 20215",
      "registerart": "HRB",
      "company_name": "IQ-Agrar Service GmbH",
      "company_seat": "Osnabrück",
      "details": "14.10.2025 (Bekanntmachungsdatum)\n\nNiedersachsen Amtsgericht Osnabrück HRB 20215\nEinreichung neuer Dokumente\n\nIQ-Agrar Service GmbH\nGesellschaft mit beschränkter Haftung\nOsnabrück\n\nDie Liste der Mitglieder des Aufsichtsrats wurde beim Registergericht eingereicht."
    },
    {
      "date": "2025-10-14",
      "id": "133871",
      "original_text": "Löschungsankündigung\nNiedersachsen Amtsgericht Osnabrück HRB 215159\nLaminica UG (haftungsbeschränkt) – Neuenhaus",
      "type": "Löschungsankündigung",
      "state": "Niedersachsen",
      "amtsgericht": "Amtsgericht Osnabrück",
      "registernummer": "HRB 215159",
      "registerart": "HRB",
      "company_name": "Laminica UG (haftungsbeschränkt)",
      "company_seat": "Neuenhaus",
      "details": "14.10.2025 (Bekanntmachungsdatum)\n\nNiedersachsen Amtsgericht Osnabrück HRB 215159\nLöschungsankündigung\n\nLaminica UG (haftungsbeschränkt)\nGesellschaft mit beschränkter Haftung\nNeuenhaus\n\nDas Registergericht beabsichtigt, die Gesellschaft von Amts wegen nach § 394 FamFG wegen Vermögenslosigkeit zu löschen. Die Frist zur Erhebung eines Widerspruchs ist auf 1 Monat ab dieser Registerbekanntmachung festgesetzt."
    },
    {
      "date": "2025-10-14",
      "id": "133872",
      "original_text": "Registerbekanntmachung nach dem Umwandlungsgesetz\nNiedersachsen Amtsgericht Osnabrück HRB 204168\nKnue & Stening Massivhaus GmbH – Lingen (Ems)",
      "type": "Registerbekanntmachung nach dem Umwandlungsgesetz",
      "state": "Niedersachsen",
      "amtsgericht": "Amtsgericht Osnabrück",
      "registernummer": "HRB 204168",
      "registerart": "HRB",
      "company_name": "Knue & Stening Massivhaus GmbH",
      "company_seat": "Lingen (Ems)",
      "details": "14.10.2025 (Bekanntmachungsdatum)\n\nNiedersachsen Amtsgericht Osnabrück HRB 204168\nRegisterbekanntmachung nach dem Umwandlungsgesetz 14.10.2025 (Eintragungsdatum)\n\nKnue & Stening Massivhaus GmbH\nGesellschaft mit beschränkter Haftung\nLingen (Ems)\n\nDen Gläubigern der an der Verschmelzung beteiligten Rechtsträger ist, wenn sie binnen sechs Monaten nach dem Tag, an dem die Eintragung der Verschmelzung in das Register des Sitzes desjenigen Rechtsträgers, dessen Gläubiger sie sind, nach § 19  Abs.  3 UmwG als bekannt gemacht gilt, ihren Anspruch nach Grund und Höhe schriftlich anmelden, Sicherheit zu leisten, soweit sie nicht Befriedigung verlangen können. Dieses Recht steht den Gläubigern jedoch nur zu, wenn sie glaubhaft machen, dass durch die Verschmelzung die Erfüllung der Forderung gefährdet wird."
    },
    {
      "date": "2025-10-14",
      "id": "133873",
      "original_text": "Registerbekanntmachung nach dem Umwandlungsgesetz\nNiedersachsen Amtsgericht Hildesheim HRB 205176\nKNDR GmbH – Sehnde",
      "type": "Registerbekanntmachung nach dem Umwandlungsgesetz",
      "state": "Niedersachsen",
      "amtsgericht": "Amtsgericht Hildesheim",
      "registernummer": "HRB 205176",
      "registerart": "HRB",
      "company_name": "KNDR GmbH",
      "company_seat": "Sehnde",
      "details": "14.10.2025 (Bekanntmachungsdatum)\n\nNiedersachsen Amtsgericht Hildesheim HRB 205176\nRegisterbekanntmachung nach dem Umwandlungsgesetz 14.10.2025 (Eintragungsdatum)\n\nKNDR GmbH\nGesellschaft mit beschränkter Haftung\nSehnde\n\nDen Gläubigern der an der Verschmelzung beteiligten Rechtsträger ist, wenn sie binnen sechs Monaten nach dem Tag, an dem die Eintragung der Verschmelzung in das Register des Sitzes desjenigen Rechtsträgers, dessen Gläubiger sie sind, nach § 19  Abs.  3 UmwG als bekannt gemacht gilt, ihren Anspruch nach Grund und Höhe schriftlich anmelden, Sicherheit zu leisten, soweit sie nicht Befriedigung verlangen können. Dieses Recht steht den Gläubigern jedoch nur zu, wenn sie glaubhaft machen, dass durch die Verschmelzung die Erfüllung der Forderung gefährdet wird."
    },
    {
      "date": "2025-10-14",
      "id": "133874",
      "original_text": "Registerbekanntmachung nach dem Umwandlungsgesetz\nNiedersachsen Amtsgericht Hannover HRA 204419\nHausbau Tießen GmbH & Co. KG – Burgwedel ST Großburgwedel",
      "type": "Registerbekanntmachung nach dem Umwandlungsgesetz",
      "state": "Niedersachsen",
      "amtsgericht": "Amtsgericht Hannover",
      "registernummer": "HRA 204419",
      "registerart": "HRA",
      "company_name": "Hausbau Tießen GmbH & Co. KG",
      "company_seat": "Burgwedel ST Großburgwedel",
      "details": "14.10.2025 (Bekanntmachungsdatum)\n\nNiedersachsen Amtsgericht Hannover HRA 204419\nRegisterbekanntmachung nach dem Umwandlungsgesetz 14.10.2025 (Eintragungsdatum)\n\nHausbau Tießen GmbH & Co. KG\nKommanditgesellschaft\nBurgwedel ST Großburgwedel\n\nDen Gläubigern der an der Verschmelzung beteiligten Rechtsträger ist, wenn sie binnen sechs Monaten nach dem Tag, an dem die Eintragung der Verschmelzung in das Register des Sitzes desjenigen Rechtsträgers, dessen Gläubiger sie sind, nach § 19  Abs.  3 UmwG als bekannt gemacht gilt, ihren Anspruch nach Grund und Höhe schriftlich anmelden, Sicherheit zu leisten, soweit sie nicht Befriedigung verlangen können. Dieses Recht steht den Gläubigern jedoch nur zu, wenn sie glaubhaft machen, dass durch die Verschmelzung die Erfüllung der Forderung gefährdet wird."
    },
    {
      "date": "2025-10-14",
      "id": "133875",
      "original_text": "Registerbekanntmachung nach dem Umwandlungsgesetz\nNiedersachsen Amtsgericht Osnabrück HRB 214173\nMSS Ventures GmbH – Osnabrück",
      "type": "Registerbekanntmachung nach dem Umwandlungsgesetz",
      "state": "Niedersachsen",
      "amtsgericht": "Amtsgericht Osnabrück",
      "registernummer": "HRB 214173",
      "registerart": "HRB",
      "company_name": "MSS Ventures GmbH",
      "company_seat": "Osnabrück",
      "details": "14.10.2025 (Bekanntmachungsdatum)\n\nNiedersachsen Amtsgericht Osnabrück HRB 214173\nRegisterbekanntmachung nach dem Umwandlungsgesetz 14.10.2025 (Eintragungsdatum)\n\nMSS Ventures GmbH\nGesellschaft mit beschränkter Haftung\nOsnabrück\n\nDen Gläubigern der an der Verschmelzung beteiligten Rechtsträger ist, wenn sie binnen sechs Monaten nach dem Tag, an dem die Eintragung der Verschmelzung in das Register des Sitzes desjenigen Rechtsträgers, dessen Gläubiger sie sind, nach § 19  Abs.  3 UmwG als bekannt gemacht gilt, ihren Anspruch nach Grund und Höhe schriftlich anmelden, Sicherheit zu leisten, soweit sie nicht Befriedigung verlangen können. Dieses Recht steht den Gläubigern jedoch nur zu, wenn sie glaubhaft machen, dass durch die Verschmelzung die Erfüllung der Forderung gefährdet wird."
    },
    {
      "date": "2025-10-14",
      "id": "133876",
      "original_text": "Löschungsankündigung\nNiedersachsen Amtsgericht Lüneburg HRB 204960\nWegner Marketing Service GmbH – Seevetal",
      "type": "Löschungsankündigung",
      "state": "Niedersachsen",
      "amtsgericht": "Amtsgericht Lüneburg",
      "registernummer": "HRB 204960",
      "registerart": "HRB",
      "company_name": "Wegner Marketing Service GmbH",
      "company_seat": "Seevetal",
      "details": "14.10.2025 (Bekanntmachungsdatum)\n\nNiedersachsen Amtsgericht Lüneburg HRB 204960\nLöschungsankündigung\n\nWegner Marketing Service GmbH\nGesellschaft mit beschränkter Haftung\nSeevetal\n\nDas Registergericht beabsichtigt, die Gesellschaft von Amts wegen nach § 394 FamFG zu löschen. Die Frist zur Erhebung eines Widerspruchs ist auf 1 Monat ab dieser Registerbekanntmachung festgesetzt."
    },
    {
      "date": "2025-10-14",
      "id": "133877",
      "original_text": "Registerbekanntmachung nach dem Umwandlungsgesetz\nNiedersachsen Amtsgericht Hannover HRA 206642\nElbert Gaststätte Plümecke - sturmfest und erdverwachsen - OHG – Hannover",
      "type": "Registerbekanntmachung nach dem Umwandlungsgesetz",
      "state": "Niedersachsen",
      "amtsgericht": "Amtsgericht Hannover",
      "registernummer": "HRA 206642",
      "registerart": "HRA",
      "company_name": "Elbert Gaststätte Plümecke - sturmfest und erdverwachsen - OHG",
      "company_seat": "Hannover",
      "details": "14.10.2025 (Bekanntmachungsdatum)\n\nNiedersachsen Amtsgericht Hannover HRA 206642\nRegisterbekanntmachung nach dem Umwandlungsgesetz 14.10.2025 (Eintragungsdatum)\n\nElbert Gaststätte Plümecke - sturmfest und erdverwachsen - OHG\nOffene Handelsgesellschaft\nHannover\n\nDen Gläubigern der an der Verschmelzung beteiligten Rechtsträger ist, wenn sie binnen sechs Monaten nach dem Tag, an dem die Eintragung der Verschmelzung in das Register des Sitzes desjenigen Rechtsträgers, dessen Gläubiger sie sind, nach § 19  Abs.  3 UmwG als bekannt gemacht gilt, ihren Anspruch nach Grund und Höhe schriftlich anmelden, Sicherheit zu leisten, soweit sie nicht Befriedigung verlangen können. Dieses Recht steht den Gläubigern jedoch nur zu, wenn sie glaubhaft machen, dass durch die Verschmelzung die Erfüllung der Forderung gefährdet wird."
    },
    {
      "date": "2025-10-14",
      "id": "133878",
      "original_text": "Registerbekanntmachung nach dem Umwandlungsgesetz\nNiedersachsen Amtsgericht Osnabrück HRB 212423\nHundhausen Grundstücksverwaltung GmbH – Georgsmarienhütte",
      "type": "Registerbekanntmachung nach dem Umwandlungsgesetz",
      "state": "Niedersachsen",
      "amtsgericht": "Amtsgericht Osnabrück",
      "registernummer": "HRB 212423",
      "registerart": "HRB",
      "company_name": "Hundhausen Grundstücksverwaltung GmbH",
      "company_seat": "Georgsmarienhütte",
      "details": "14.10.2025 (Bekanntmachungsdatum)\n\nNiedersachsen Amtsgericht Osnabrück HRB 212423\nRegisterbekanntmachung nach dem Umwandlungsgesetz 14.10.2025 (Eintragungsdatum)\n\nHundhausen Grundstücksverwaltung GmbH\nGesellschaft mit beschränkter Haftung\nGeorgsmarienhütte\n\nDen Gläubigern der an der formwechselnden Umwandlung beteiligten Rechtsträger ist, wenn sie binnen sechs Monaten nach dem Tag, an dem die Eintragung der Umwandlung in das Register des Sitzes desjenigen Rechtsträgers, dessen Gläubiger sie sind, nach § 19 Abs. 3 UmwG als bekannt gemacht gilt, ihren Anspruch nach Grund und Höhe schriftlich anmelden, Sicherheit zu leisten, soweit sie nicht Befriedigung verlangen können. Dieses Recht steht den Gläubigern jedoch nur zu, wenn sie glaubhaft machen, dass durch die formwechselnde Umwandlung die Erfüllung der Forderung gefährdet wird."
    },
    {
      "date": "2025-10-14",
      "id": "133879",
      "original_text": "Löschungsankündigung\nNiedersachsen Amtsgericht Osnabrück HRB 214441\nDoMa GmbH – Osnabrück",
      "type": "Löschungsankündigung",
      "state": "Niedersachsen",
      "amtsgericht": "Amtsgericht Osnabrück",
      "registernummer": "HRB 214441",
      "registerart": "HRB",
      "company_name": "DoMa GmbH",
      "company_seat": "Osnabrück",
      "details": "14.10.2025 (Bekanntmachungsdatum)\n\nNiedersachsen Amtsgericht Osnabrück HRB 214441\nLöschungsankündigung\n\nDoMa GmbH\nGesellschaft mit beschränkter Haftung\nOsnabrück\n\nDas Registergericht beabsichtigt, die Gesellschaft von Amts wegen nach § 394 FamFG wegen Vermögenslosigkeit zu löschen. Die Frist zur Erhebung eines Widerspruchs ist auf 1 Monat ab dieser Registerbekanntmachung festgesetzt."
    },
    {
      "date": "2025-10-14",
      "id": "133880",
      "original_text": "Registerbekanntmachung nach dem Umwandlungsgesetz\nNiedersachsen Amtsgericht Hildesheim HRB 205122\nPiNAO GmbH – Sehnde",
      "type": "Registerbekanntmachung nach dem Umwandlungsgesetz",
      "state": "Niedersachsen",
      "amtsgericht": "Amtsgericht Hildesheim",
      "registernummer": "HRB 205122",
      "registerart": "HRB",
      "company_name": "PiNAO GmbH",
      "company_seat": "Sehnde",
      "details": "14.10.2025 (Bekanntmachungsdatum)\n\nNiedersachsen Amtsgericht Hildesheim HRB 205122\nRegisterbekanntmachung nach dem Umwandlungsgesetz 14.10.2025 (Eintragungsdatum)\n\nPiNAO GmbH\nGesellschaft mit beschränkter Haftung\nSehnde\n\nDen Gläubigern der an der Verschmelzung beteiligten Rechtsträger ist, wenn sie binnen sechs Monaten nach dem Tag, an dem die Eintragung der Verschmelzung in das Register des Sitzes desjenigen Rechtsträgers, dessen Gläubiger sie sind, nach § 19  Abs.  3 UmwG als bekannt gemacht gilt, ihren Anspruch nach Grund und Höhe schriftlich anmelden, Sicherheit zu leisten, soweit sie nicht Befriedigung verlangen können. Dieses Recht steht den Gläubigern jedoch nur zu, wenn sie glaubhaft machen, dass durch die Verschmelzung die Erfüllung der Forderung gefährdet wird."
    },
    {
      "date": "2025-10-14",
      "id": "133881",
      "original_text": "Registerbekanntmachung nach dem Umwandlungsgesetz\nNiedersachsen Amtsgericht Osnabrück HRA 130305 früher Amtsgericht Nordhorn\nKortmann Industries GmbH & Co. KG – Schüttorf",
      "type": "Registerbekanntmachung nach dem Umwandlungsgesetz",
      "state": "Niedersachsen",
      "amtsgericht": "Amtsgericht Osnabrück",
      "registernummer": "HRA 130305",
      "registerart": "HRA",
      "company_name": "Kortmann Industries GmbH & Co. KG",
      "company_seat": "Schüttorf",
      "former_amtsgericht": "Nordhorn",
      "details": "14.10.2025 (Bekanntmachungsdatum)\n\nNiedersachsen Amtsgericht Osnabrück HRA 130305 früher Amtsgericht Nordhorn\nRegisterbekanntmachung nach dem Umwandlungsgesetz 14.10.2025 (Eintragungsdatum)\n\nKortmann Industries GmbH & Co. KG\nKommanditgesellschaft\nSchüttorf\n\nDen Gläubigern der an der formwechselnden Umwandlung beteiligten Rechtsträger ist, wenn sie binnen sechs Monaten nach dem Tag, an dem die Eintragung der Umwandlung in das Register des Sitzes desjenigen Rechtsträgers, dessen Gläubiger sie sind, nach § 19 Abs. 3 UmwG als bekannt gemacht gilt, ihren Anspruch nach Grund und Höhe schriftlich anmelden, Sicherheit zu leisten, soweit sie nicht Befriedigung verlangen können. Dieses Recht steht den Gläubigern jedoch nur zu, wenn sie glaubhaft machen, dass durch die formwechselnde Umwandlung die Erfüllung der Forderung gefährdet wird."
    },
    {
      "date": "2025-10-14",
      "id": "133882",
      "original_text": "Registerbekanntmachung nach dem Umwandlungsgesetz\nNiedersachsen Amtsgericht Hannover HRA 206018\nPremium Massivhaus Tießen GmbH & Co. KG – Burgwedel",
      "type": "Registerbekanntmachung nach dem Umwandlungsgesetz",
      "state": "Niedersachsen",
      "amtsgericht": "Amtsgericht Hannover",
      "registernummer": "HRA 206018",
      "registerart": "HRA",
      "company_name": "Premium Massivhaus Tießen GmbH & Co. KG",
      "company_seat": "Burgwedel",
      "details": "14.10.2025 (Bekanntmachungsdatum)\n\nNiedersachsen Amtsgericht Hannover HRA 206018\nRegisterbekanntmachung nach dem Umwandlungsgesetz 14.10.2025 (Eintragungsdatum)\n\nPremium Massivhaus Tießen GmbH & Co. KG\nKommanditgesellschaft\nBurgwedel\n\nDen Gläubigern der an der Verschmelzung beteiligten Rechtsträger ist, wenn sie binnen sechs Monaten nach dem Tag, an dem die Eintragung der Verschmelzung in das Register des Sitzes desjenigen Rechtsträgers, dessen Gläubiger sie sind, nach § 19  Abs.  3 UmwG als bekannt gemacht gilt, ihren Anspruch nach Grund und Höhe schriftlich anmelden, Sicherheit zu leisten, soweit sie nicht Befriedigung verlangen können. Dieses Recht steht den Gläubigern jedoch nur zu, wenn sie glaubhaft machen, dass durch die Verschmelzung die Erfüllung der Forderung gefährdet wird."
    },
    {
      "date": "2025-10-14",
      "id": "133883",
      "original_text": "Registerbekanntmachung nach dem Umwandlungsgesetz\nNiedersachsen Amtsgericht Osnabrück HRA 202081\nBestattungshaus Pingel GmbH & Co. KG – Lingen (Ems)",
      "type": "Registerbekanntmachung nach dem Umwandlungsgesetz",
      "state": "Niedersachsen",
      "amtsgericht": "Amtsgericht Osnabrück",
      "registernummer": "HRA 202081",
      "registerart": "HRA",
      "company_name": "Bestattungshaus Pingel GmbH & Co. KG",
      "company_seat": "Lingen (Ems)",
      "details": "14.10.2025 (Bekanntmachungsdatum)\n\nNiedersachsen Amtsgericht Osnabrück HRA 202081\nRegisterbekanntmachung nach dem Umwandlungsgesetz 14.10.2025 (Eintragungsdatum)\n\nBestattungshaus Pingel GmbH & Co. KG\nKommanditgesellschaft\nLingen (Ems)\n\nDen Gläubigern der an der formwechselnden Umwandlung beteiligten Rechtsträger ist, wenn sie binnen sechs Monaten nach dem Tag, an dem die Eintragung der Umwandlung in das Register des Sitzes desjenigen Rechtsträgers, dessen Gläubiger sie sind, nach § 19 Abs. 3 UmwG als bekannt gemacht gilt, ihren Anspruch nach Grund und Höhe schriftlich anmelden, Sicherheit zu leisten, soweit sie nicht Befriedigung verlangen können. Dieses Recht steht den Gläubigern jedoch nur zu, wenn sie glaubhaft machen, dass durch die formwechselnde Umwandlung die Erfüllung der Forderung gefährdet wird."
    },
    {
      "date": "2025-10-14",
      "id": "133884",
      "original_text": "Einreichung neuer Dokumente\nBremen Amtsgericht Bremen HRB 35856\nWitt Holding SE – Bremen",
      "type": "Einreichung neuer Dokumente",
      "state": "Bremen",
      "amtsgericht": "Amtsgericht Bremen",
      "registernummer": "HRB 35856",
      "registerart": "HRB",
      "company_name": "Witt Holding SE",
      "company_seat": "Bremen",
      "details": "14.10.2025 (Bekanntmachungsdatum)\n\nBremen Amtsgericht Bremen HRB 35856\nEinreichung neuer Dokumente\n\nWitt Holding SE\nEuropäische Aktiengesellschaft (SE)\nBremen\n\nAls nicht eingetragen wird bekannt gemacht:  Liste der Verwaltungsratsmitglieder wurde eingereicht."
    },
    {
      "date": "2025-10-14",
      "id": "133885",
      "original_text": "Löschungsankündigung\nRheinland-Pfalz Amtsgericht Zweibrücken HRB 32027\nvocedo GmbH – Zweibrücken",
      "type": "Löschungsankündigung",
      "state": "Rheinland-Pfalz",
      "amtsgericht": "Amtsgericht Zweibrücken",
      "registernummer": "HRB 32027",
      "registerart": "HRB",
      "company_name": "vocedo GmbH",
      "company_seat": "Zweibrücken",
      "details": "14.10.2025 (Bekanntmachungsdatum)\n\nRheinland-Pfalz Amtsgericht Zweibrücken HRB 32027\nLöschungsankündigung\n\nvocedo GmbH\nGesellschaft mit beschränkter Haftung\nZweibrücken\n\nDas Registergericht beabsichtigt die Gesellschaft von Amts wegen nach § 394 FamFG zu löschen. Die Frist zur Erhebung eines Widerspruchs ist auf einen Monat festgesetzt."
    },
    {
      "date": "2025-10-14",
      "id": "133886",
      "original_text": "Registerbekanntmachung nach dem Umwandlungsgesetz\nRheinland-Pfalz Amtsgericht Mainz HRA 44930\nNico Lorenz e.K. – Mainz",
      "type": "Registerbekanntmachung nach dem Umwandlungsgesetz",
      "state": "Rheinland-Pfalz",
      "amtsgericht": "Amtsgericht Mainz",
      "registernummer": "HRA 44930",
      "registerart": "HRA",
      "company_name": "Nico Lorenz e.K.",
      "company_seat": "Mainz",
      "details": "14.10.2025 (Bekanntmachungsdatum)\n\nRheinland-Pfalz Amtsgericht Mainz HRA 44930\nRegisterbekanntmachung nach dem Umwandlungsgesetz 14.10.2025 (Eintragungsdatum)\n\nNico Lorenz e.K.\nEinzelkaufmann / Einzelkauffrau\nMainz\n\nAls nicht eingetragen wird veröffentlicht: Den Gläubigern der an der Ausgliederung beteiligten Rechtsträger ist, wenn sie binnen sechs Monaten nach dem Tag, an dem die Eintragung der Ausgliederung in das Register des Sitzes desjenigen Rechtsträgers, dessen Gläubiger sie sind, nach § 19 Abs. 3 UmwG als bekannt gemacht gilt, ihren Anspruch nach Grund und Höhe schriftlich anmelden, Sicherheit zu leisten, soweit sie nicht Befriedigung verlangen können. Dieses Recht steht den Gläubigern jedoch nur zu, wenn sie glaubhaft machen, dass durch die Ausgliederung die Erfüllung der Forderung gefährdet wird."
    },
    {
      "date": "2025-10-14",
      "id": "133887",
      "original_text": "Löschungsankündigung\nRheinland-Pfalz Amtsgericht Koblenz HRA 21503\nKIAI GmbH & Co. KG – Koblenz",
      "type": "Löschungsankündigung",
      "state": "Rheinland-Pfalz",
      "amtsgericht": "Amtsgericht Koblenz",
      "registernummer": "HRA 21503",
      "registerart": "HRA",
      "company_name": "KIAI GmbH & Co. KG",
      "company_seat": "Koblenz",
      "details": "14.10.2025 (Bekanntmachungsdatum)\n\nRheinland-Pfalz Amtsgericht Koblenz HRA 21503\nLöschungsankündigung\n\nKIAI GmbH & Co. KG\nKommanditgesellschaft\nKoblenz\n\nDas Registergericht beabsichtigt die Firma von Amts wegen nach § 394 FamFG zu löschen. Die Frist zur Erhebung eines Widerspruchs ist auf einen Monat festgesetzt."
    },
    {
      "date": "2025-10-14",
      "id": "133888",
      "original_text": "Registerbekanntmachung nach dem Umwandlungsgesetz\nRheinland-Pfalz Amtsgericht Ludwigshafen a.Rhein (Ludwigshafen) HRB 67440\nEMUNEL Chova GmbH – Ludwigshafen am Rhein",
      "type": "Registerbekanntmachung nach dem Umwandlungsgesetz",
      "state": "Rheinland-Pfalz",
      "amtsgericht": "Amtsgericht Ludwigshafen a.Rhein (Ludwigshafen)",
      "registernummer": "HRB 67440",
      "registerart": "HRB",
      "company_name": "EMUNEL Chova GmbH",
      "company_seat": "Ludwigshafen am Rhein",
      "details": "14.10.2025 (Bekanntmachungsdatum)\n\nRheinland-Pfalz Amtsgericht Ludwigshafen a.Rhein (Ludwigshafen) HRB 67440\nRegisterbekanntmachung nach dem Umwandlungsgesetz 13.10.2025 (Eintragungsdatum)\n\nEMUNEL Chova GmbH\nGesellschaft mit beschränkter Haftung\nLudwigshafen am Rhein\n\nAls nicht eingetragen wird veröffentlicht: Den Gläubigern der an der Verschmelzung beteiligten Rechtsträger ist, wenn sie binnen sechs Monaten nach dem Tag, an dem die Eintragung der Verschmelzung in das Register des Sitzes desjenigen Rechtsträgers,dessen Gläubiger sie sind, nach § 19 Abs. 3 UmwG als bekannt gemacht gilt, ihren Anspruch nach Grund und Höhe schriftlich anmelden, Sicherheit zu leisten, soweit sie nicht Befriedigung verlangen können. Dieses Recht steht den Gläubigern jedoch nur zu, wenn sie glaubhaft machen, dass durch die Verschmelzung die Erfüllungd er Forderung gefährdet wird."
    },
    {
      "date": "2025-10-14",
      "id": "133889",
      "original_text": "Registerbekanntmachung nach dem Umwandlungsgesetz\nRheinland-Pfalz Amtsgericht Mainz HRB 53988\nNext Level Ads GmbH – Mainz",
      "type": "Registerbekanntmachung nach dem Umwandlungsgesetz",
      "state": "Rheinland-Pfalz",
      "amtsgericht": "Amtsgericht Mainz",
      "registernummer": "HRB 53988",
      "registerart": "HRB",
      "company_name": "Next Level Ads GmbH",
      "company_seat": "Mainz",
      "details": "14.10.2025 (Bekanntmachungsdatum)\n\nRheinland-Pfalz Amtsgericht Mainz HRB 53988\nRegisterbekanntmachung nach dem Umwandlungsgesetz 14.10.2025 (Eintragungsdatum)\n\nNext Level Ads GmbH\nGesellschaft mit beschränkter Haftung\nMainz\n\nAls nicht eingetragen wird veröffentlicht: Den Gläubigern der an der Ausgliederung beteiligten Rechtsträger ist, wenn sie binnen sechs Monaten nach dem Tag, an dem die Eintragung der Ausgliederung in das Register des Sitzes desjenigen Rechtsträgers, dessen Gläubiger sie sind, nach § 19 Abs. 3 UmwG als bekannt gemacht gilt, ihren Anspruch nach Grund und Höhe schriftlich anmelden, Sicherheit zu leisten, soweit sie nicht Befriedigung verlangen können. Dieses Recht steht den Gläubigern jedoch nur zu, wenn sie glaubhaft machen, dass durch die Ausgliederung die Erfüllung der Forderung gefährdet wird."
    },
    {
      "date": "2025-10-14",
      "id": "133890",
      "original_text": "Registerbekanntmachung nach dem Umwandlungsgesetz\nRheinland-Pfalz Amtsgericht Wittlich HRA 42222\nJohn Jegen e.K. – Bitburg",
      "type": "Registerbekanntmachung nach dem Umwandlungsgesetz",
      "state": "Rheinland-Pfalz",
      "amtsgericht": "Amtsgericht Wittlich",
      "registernummer": "HRA 42222",
      "registerart": "HRA",
      "company_name": "John Jegen e.K.",
      "company_seat": "Bitburg",
      "details": "14.10.2025 (Bekanntmachungsdatum)\n\nRheinland-Pfalz Amtsgericht Wittlich HRA 42222\nRegisterbekanntmachung nach dem Umwandlungsgesetz 14.10.2025 (Eintragungsdatum)\n\nJohn Jegen e.K.\nEinzelkaufmann / Einzelkauffrau\nBitburg\n\nAls nicht eingetragen wird veröffentlicht: Den Gläubigern der an der Verschmelzung beteiligten Rechtsträger ist, wenn sie binnen sechs Monaten nach dem Tag, an dem die Eintragung der Verschmelzung in das Register des Sitzes desjenigen Rechtsträgers,dessen Gläubiger sie sind, nach § 19 Abs. 3 UmwG als bekannt gemacht gilt, ihren Anspruch nach Grund und Höhe schriftlich anmelden, Sicherheit zu leisten, soweit sie nicht Befriedigung verlangen können. Dieses Recht steht den Gläubigern jedoch nur zu, wenn sie glaubhaft machen, dass durch die Verschmelzung die Erfüllungd der Forderung gefährdet wird."
    },
    {
      "date": "2025-10-14",
      "id": "133891",
      "original_text": "Löschungsankündigung\nRheinland-Pfalz Amtsgericht Montabaur HRB 7139\nK.L.P. Metall-Innovationen Verwaltungsgesellschaft mbH – Roth",
      "type": "Löschungsankündigung",
      "state": "Rheinland-Pfalz",
      "amtsgericht": "Amtsgericht Montabaur",
      "registernummer": "HRB 7139",
      "registerart": "HRB",
      "company_name": "K.L.P. Metall-Innovationen Verwaltungsgesellschaft mbH",
      "company_seat": "Roth",
      "details": "14.10.2025 (Bekanntmachungsdatum)\n\nRheinland-Pfalz Amtsgericht Montabaur HRB 7139\nLöschungsankündigung\n\nK.L.P. Metall-Innovationen Verwaltungsgesellschaft mbH\nGesellschaft mit beschränkter Haftung\nRoth\n\nDas Registergericht beabsichtigt die Gesellschaft von Amts wegen nach § 394 FamFG zu löschen. Die Frist zur Erhebung eines Widerspruchs ist auf einen Monat festgesetzt."
    },
    {
      "date": "2025-10-14",
      "id": "133892",
      "original_text": "Einreichung neuer Dokumente\nRheinland-Pfalz Amtsgericht Mainz HRB 6567\nLandbell Aktiengesellschaft für Rückhol-Systeme – Mainz",
      "type": "Einreichung neuer Dokumente",
      "state": "Rheinland-Pfalz",
      "amtsgericht": "Amtsgericht Mainz",
      "registernummer": "HRB 6567",
      "registerart": "HRB",
      "company_name": "Landbell Aktiengesellschaft für Rückhol-Systeme",
      "company_seat": "Mainz",
      "details": "14.10.2025 (Bekanntmachungsdatum)\n\nRheinland-Pfalz Amtsgericht Mainz HRB 6567\nEinreichung neuer Dokumente\n\nLandbell Aktiengesellschaft für Rückhol-Systeme\nAktiengesellschaft\nMainz\n\nDem Registergericht ist eine neue Liste der Mitglieder des Aufsichtsrates eingereicht worden."
    },
    {
      "date": "2025-10-14",
      "id": "133893",
      "original_text": "Löschungsankündigung\nRheinland-Pfalz Amtsgericht Ludwigshafen a.Rhein (Ludwigshafen) HRB 68729\nBlechbearbeitung T. Fessler UG (haftungsbeschränkt) – Maxdorf",
      "type": "Löschungsankündigung",
      "state": "Rheinland-Pfalz",
      "amtsgericht": "Amtsgericht Ludwigshafen a.Rhein (Ludwigshafen)",
      "registernummer": "HRB 68729",
      "registerart": "HRB",
      "company_name": "Blechbearbeitung T. Fessler UG (haftungsbeschränkt)",
      "company_seat": "Maxdorf",
      "details": "14.10.2025 (Bekanntmachungsdatum)\n\nRheinland-Pfalz Amtsgericht Ludwigshafen a.Rhein (Ludwigshafen) HRB 68729\nLöschungsankündigung 14.10.2025 (Eintragungsdatum)\n\nBlechbearbeitung T. Fessler UG (haftungsbeschränkt)\nGesellschaft mit beschränkter Haftung\nMaxdorf\n\nDas Registergericht beabsichtigt die Gesellschaft von Amts wegen nach § 394 FamFG zu löschen. Die Frist zur Erhebung eines Widerspruchs ist auf einen Monat festgesetzt."
    },
    {
      "date": "2025-10-14",
      "id": "133894",
      "original_text": "Löschungsankündigung\nNordrhein-Westfalen Amtsgericht Aachen HRB 22433\nsemseosalesolutions UG (haftungsbeschränkt) – Aachen",
      "type": "Löschungsankündigung",
      "state": "Nordrhein-Westfalen",
      "amtsgericht": "Amtsgericht Aachen",
      "registernummer": "HRB 22433",
      "registerart": "HRB",
      "company_name": "semseosalesolutions UG (haftungsbeschränkt)",
      "company_seat": "Aachen",
      "details": "14.10.2025 (Bekanntmachungsdatum)\n\nNordrhein-Westfalen Amtsgericht Aachen HRB 22433\nLöschungsankündigung\n\nsemseosalesolutions UG (haftungsbeschränkt)\nGesellschaft mit beschränkter Haftung\nAachen\n\nDas Registergericht beabsichtigt, von Amts wegen die Gesellschaft wegen Vermögenslosigkeit nach § 394 FamFG zu löschen, weil das Finanzamt Aachen-Stadt mit Schreiben vom 03.09.2025 Umstände mitgeteilt hat, aufgrund derer das Gericht davon überzeugt ist, dass die Gesellschaft vollständig vermögenslos ist.\n\nZur Geltendmachung des Widerspruchs gegen die beabsichtigte Löschung wird hiermit eine Frist von einem Monat ab Veröffentlichung dieser Ankündigung bestimmt.\n\nRechtsbehelfsbelehrung:\n\nGegen diese Verfügung kann Widerspruch eingelegt werden. Zum Widerspruch ist jeder berechtigt, der an der Unterlassung der Löschung ein berechtigtes Interesse hat.\n\nDer Widerspruch ist bei dem Amtsgericht Aachen, Adalbertsteinweg 92, 52070 Aachen schriftlich in deutscher Sprache oder zur Niederschrift der Geschäftsstelle einzulegen. Der Widerspruch kann auch zur Niederschrift der Geschäftsstelle eines jeden Amtsgerichtes abgegeben werden.\n\nDer Widerspruch muss spätestens innerhalb der gesetzten Frist nach der Bekanntgabe der Verfügung bei dem Amtsgericht Aachen eingegangen sein. Dies gilt auch dann, wenn der Widerspruch zur Niederschrift der Geschäftsstelle eines anderen Amtsgerichtes abgegeben wurde. Die Frist beginnt mit der Bekanntgabe der Verfügung durch Veröffentlichung. Fällt das Ende der Frist auf einen Sonntag, einen allgemeinen Feiertag oder Sonnabend, so endet die Frist mit Ablauf des nächsten Werktages.\n\nDer Widerspruch muss die Bezeichnung der angefochtenen Verfügung sowie die Erklärung enthalten, dass Widerspruch gegen diese Verfügung eingelegt wird. Er ist zu unterzeichnen und soll begründet werden.\n\nDie Einlegung ist auch durch Übertragung eines elektronischen Dokuments an die elektronische Poststelle des Gerichts möglich. Das elektronische Dokument muss für die Bearbeitung durch das Gericht geeignet und mit einer qualifizierten elektronischen Signatur der verantwortenden Person versehen sein oder von der verantwortenden Person signiert und auf einem sicheren Übermittlungsweg gemäß § 130 a ZPO nach näherer Maßgabe der Verordnung über die technischen Rahmenbedingungen des elektronischen Rechtsverkehrs und über das besondere elektronische Behördenpostfach (BGBl. I, S. 3803) eingereicht werden. Weitere Informationen erhalten Sie auf der Internetseite www.justiz.de."
    },
    {
      "date": "2025-10-14",
      "id": "133895",
      "original_text": "Registerbekanntmachung nach dem Umwandlungsgesetz\nNordrhein-Westfalen Amtsgericht Bielefeld VR 1499\nWohnstift Salzburg e.V. – Bielefeld",
      "type": "Registerbekanntmachung nach dem Umwandlungsgesetz",
      "state": "Nordrhein-Westfalen",
      "amtsgericht": "Amtsgericht Bielefeld",
      "registernummer": "VR 1499",
      "registerart": "VR",
      "company_name": "Wohnstift Salzburg e.V.",
      "company_seat": "Bielefeld",
      "details": "14.10.2025 (Bekanntmachungsdatum)\n\nNordrhein-Westfalen Amtsgericht Bielefeld VR 1499\nRegisterbekanntmachung nach dem Umwandlungsgesetz 14.10.2025 (Eintragungsdatum)\n\nWohnstift Salzburg e.V.\neingetragener Verein\nBielefeld\n\nDen Gläubigern der an der formwechselnden Umwandlung beteiligten Rechtsträger ist, wenn sie binnen sechs Monaten nach dem Tag, an dem die Eintragung der formwechselnden Umwandlung in das Register des Sitzes desjenigen Rechtsträgers, dessen Gläubiger sie sind, nach § 19 Absatz 3 UmwG als bekanntgemacht gilt, ihren Anspruch nach Grund und Höhe schriftlich anmelden, Sicherheit zu leisten, soweit sie nicht Befriedigung verlangen können. Dieses Recht steht den Gläubigern jedoch nur zu, wenn sie glaubhaft machen, dass durch die formwechselnden Umwandlung die Erfüllung ihrer Forderung gefährdet wird."
    },
    {
      "date": "2025-10-14",
      "id": "133896",
      "original_text": "Löschungsankündigung\nNordrhein-Westfalen Amtsgericht Düsseldorf HRB 89675\nreal-it GmbH – Monheim am Rhein",
      "type": "Löschungsankündigung",
      "state": "Nordrhein-Westfalen",
      "amtsgericht": "Amtsgericht Düsseldorf",
      "registernummer": "HRB 89675",
      "registerart": "HRB",
      "company_name": "real-it GmbH",
      "company_seat": "Monheim am Rhein",
      "details": "14.10.2025 (Bekanntmachungsdatum)\n\nNordrhein-Westfalen Amtsgericht Düsseldorf HRB 89675\nLöschungsankündigung\n\nreal-it GmbH\nGesellschaft mit beschränkter Haftung\nMonheim am Rhein\n\nDas Registergericht beabsichtigt die Gesellschaft von Amts wegen nach § 394 FamFG zu löschen. Die Frist zur Erhebung eines Widerspruchs ist auf 3 Wochen festgesetzt.\n\nRechtsbehelfsbelehrung:\nDas Widerspruchsrecht steht jedem zu, der an der Unterlassung der Löschung ein berechtigtes Interesse hat. Der Widerspruch ist bei dem Amtsgericht Düsseldorf -Registergericht-, Werdener Straße 1, 40227 Düsseldorf schriftlich in deutscher Sprache oder zur Niederschrift der Geschäftsstelle einzulegen. Der Widerspruch kann auch zur Niederschrift der Geschäftsstelle eines jeden Amtsgerichtes abgegeben werden. Die Einlegung ist auch durch Übertragung eines elektronischen Dokuments an die elektronische Poststelle des Gerichts möglich. Das elektronische Dokument muss für die Bearbeitung durch das Gericht geeignet und mit einer qualifizierten elektronischen Signatur der verantwortenden Person versehen sein oder von der verantwortenden Person signiert und auf einem sicheren Übermittlungsweg gemäß § 130a ZPO nach näherer Maßgabe der Verordnung über die technischen Rahmenbedingungen des elektronischen Rechtsverkehrs und über das besondere elektronische Behördenpostfach (BGBl. I, S.3803) eingereicht werden. Weitere Informationen erhalten Sie auf der Internetseite www.justiz.de.\nDer Widerspruch muss spätestens innerhalb der gesetzten Frist nach dem Datum der Bekanntmachung der Löschungsankündigung bei dem Amtsgericht - Registergericht - Düsseldorf eingegangen sein.  Dies gilt auch dann, wenn der Widerspruch zur Niederschrift der Geschäftsstelle eines anderen Amtsgerichtes abgegeben wurde. Die Frist beginnt mit dem Tage der Bekanntmachung der Löschungsankündigung in dem für die Bekanntmachung der Eintragungen in das Handelsregister bestimmten elektronischen Informations- und Kommunikationssystem nach § 10 des Handelsgesetzbuches. Fällt das Ende der Frist auf einen Sonntag, einen allgemeinen Feiertag oder Sonnabend, so endet die Frist mit Ablauf des nächsten Werktages.\nDer Widerspruch muss die Bezeichnung der angefochtenen Löschungsankündigung sowie die Erklärung enthalten, dass Widerspruch gegen diese Löschungsankündigung eingelegt wird. Er ist zu unterzeichnen und soll begründet werden."
    },
    {
      "date": "2025-10-14",
      "id": "133897",
      "original_text": "Registerbekanntmachung nach dem Umwandlungsgesetz\nNordrhein-Westfalen Amtsgericht Münster HRB 8820\nInter Pharma Dienstleistungsgesellschaft mbH – Ennigerloh",
      "type": "Registerbekanntmachung nach dem Umwandlungsgesetz",
      "state": "Nordrhein-Westfalen",
      "amtsgericht": "Amtsgericht Münster",
      "registernummer": "HRB 8820",
      "registerart": "HRB",
      "company_name": "Inter Pharma Dienstleistungsgesellschaft mbH",
      "company_seat": "Ennigerloh",
      "details": "14.10.2025 (Bekanntmachungsdatum)\n\nNordrhein-Westfalen Amtsgericht Münster HRB 8820\nRegisterbekanntmachung nach dem Umwandlungsgesetz 14.10.2025 (Eintragungsdatum)\n\nInter Pharma Dienstleistungsgesellschaft mbH\nGesellschaft mit beschränkter Haftung\nEnnigerloh\n\nDen Gläubigern der an der Verschmelzung beteiligten Rechtsträger ist, wenn sie binnen sechs Monaten nach dem Tag, an dem die Eintragung der Verschmelzung in das Register des Sitzes desjenigen Rechtsträgers, dessen Gläubiger sie sind, nach § 19 Absatz 3 UmwG als bekanntgemacht gilt, ihren Anspruch nach Grund und Höhe schriftlich anmelden, Sicherheit zu leisten, soweit sie nicht Befriedigung verlangen können. Dieses Recht steht den Gläubigern jedoch nur zu, wenn sie glaubhaft machen, dass durch die Verschmelzung die Erfüllung ihrer Forderung gefährdet wird."
    },
    {
      "date": "2025-10-14",
      "id": "133898",
      "original_text": "Registerbekanntmachung nach dem Umwandlungsgesetz\nNordrhein-Westfalen Amtsgericht Paderborn HRB 11572\nWestfalen Weser Netz GmbH – Paderborn",
      "type": "Registerbekanntmachung nach dem Umwandlungsgesetz",
      "state": "Nordrhein-Westfalen",
      "amtsgericht": "Amtsgericht Paderborn",
      "registernummer": "HRB 11572",
      "registerart": "HRB",
      "company_name": "Westfalen Weser Netz GmbH",
      "company_seat": "Paderborn",
      "details": "14.10.2025 (Bekanntmachungsdatum)\n\nNordrhein-Westfalen Amtsgericht Paderborn HRB 11572\nRegisterbekanntmachung nach dem Umwandlungsgesetz 14.10.2025 (Eintragungsdatum)\n\nWestfalen Weser Netz GmbH\nGesellschaft mit beschränkter Haftung\nPaderborn\n\nDen Gläubigern der an der Verschmelzung beteiligten Rechtsträger ist, wenn sie binnen sechs Monaten nach dem Tag, an dem die Eintragung der Verschmelzung in das Register des Sitzes desjenigen Rechtsträgers, dessen Gläubiger sie sind, nach § 19 Absatz 3 UmwG als bekanntgemacht gilt, ihren Anspruch nach Grund und Höhe schriftlich anmelden, Sicherheit zu leisten, soweit sie nicht Befriedigung verlangen können. Dieses Recht steht den Gläubigern jedoch nur zu, wenn sie glaubhaft machen, dass durch die Verschmelzung die Erfüllung ihrer Forderung gefährdet wird."
    },
    {
      "date": "2025-10-14",
      "id": "133899",
      "original_text": "Löschungsankündigung\nNordrhein-Westfalen Amtsgericht Wuppertal HRB 31275\nTKM Bau GmbH – Wuppertal",
      "type": "Löschungsankündigung",
      "state": "Nordrhein-Westfalen",
      "amtsgericht": "Amtsgericht Wuppertal",
      "registernummer": "HRB 31275",
      "registerart": "HRB",
      "company_name": "TKM Bau GmbH",
      "company_seat": "Wuppertal",
      "details": "14.10.2025 (Bekanntmachungsdatum)\n\nNordrhein-Westfalen Amtsgericht Wuppertal HRB 31275\nLöschungsankündigung\n\nTKM Bau GmbH\nGesellschaft mit beschränkter Haftung\nWuppertal\n\nDas Registergericht beabsichtigt die Gesellschaft von Amts wegen nach § 394 FamFG zu löschen. Die Frist zur Erhebung eines Widerspruchs ist auf einen Monat festgesetzt."
    },
    {
      "date": "2025-10-14",
      "id": "133900",
      "original_text": "Löschungsankündigung\nNordrhein-Westfalen Amtsgericht Düsseldorf HRB 67562\nVelocio Sports GmbH – Düsseldorf",
      "type": "Löschungsankündigung",
      "state": "Nordrhein-Westfalen",
      "amtsgericht": "Amtsgericht Düsseldorf",
      "registernummer": "HRB 67562",
      "registerart": "HRB",
      "company_name": "Velocio Sports GmbH",
      "company_seat": "Düsseldorf",
      "details": "14.10.2025 (Bekanntmachungsdatum)\n\nNordrhein-Westfalen Amtsgericht Düsseldorf HRB 67562\nLöschungsankündigung\n\nVelocio Sports GmbH\nGesellschaft mit beschränkter Haftung\nDüsseldorf\n\nDas Registergericht beabsichtigt die Gesellschaft von Amts wegen nach § 394 FamFG zu löschen. Die Frist zur Erhebung eines Widerspruchs ist auf 3 Wochen festgesetzt.\n\nRechtsbehelfsbelehrung:\nDas Widerspruchsrecht steht jedem zu, der an der Unterlassung der Löschung ein berechtigtes Interesse hat. Der Widerspruch ist bei dem Amtsgericht Düsseldorf -Registergericht-, Werdener Straße 1, 40227 Düsseldorf schriftlich in deutscher Sprache oder zur Niederschrift der Geschäftsstelle einzulegen. Der Widerspruch kann auch zur Niederschrift der Geschäftsstelle eines jeden Amtsgerichtes abgegeben werden. Die Einlegung ist auch durch Übertragung eines elektronischen Dokuments an die elektronische Poststelle des Gerichts möglich. Das elektronische Dokument muss für die Bearbeitung durch das Gericht geeignet und mit einer qualifizierten elektronischen Signatur der verantwortenden Person versehen sein oder von der verantwortenden Person signiert und auf einem sicheren Übermittlungsweg gemäß § 130a ZPO nach näherer Maßgabe der Verordnung über die technischen Rahmenbedingungen des elektronischen Rechtsverkehrs und über das besondere elektronische Behördenpostfach (BGBl. I, S.3803) eingereicht werden. Weitere Informationen erhalten Sie auf der Internetseite www.justiz.de.\nDer Widerspruch muss spätestens innerhalb der gesetzten Frist nach dem Datum der Bekanntmachung der Löschungsankündigung bei dem Amtsgericht - Registergericht - Düsseldorf eingegangen sein.  Dies gilt auch dann, wenn der Widerspruch zur Niederschrift der Geschäftsstelle eines anderen Amtsgerichtes abgegeben wurde. Die Frist beginnt mit dem Tage der Bekanntmachung der Löschungsankündigung in dem für die Bekanntmachung der Eintragungen in das Handelsregister bestimmten elektronischen Informations- und Kommunikationssystem nach § 10 des Handelsgesetzbuches. Fällt das Ende der Frist auf einen Sonntag, einen allgemeinen Feiertag oder Sonnabend, so endet die Frist mit Ablauf des nächsten Werktages.\nDer Widerspruch muss die Bezeichnung der angefochtenen Löschungsankündigung sowie die Erklärung enthalten, dass Widerspruch gegen diese Löschungsankündigung eingelegt wird. Er ist zu unterzeichnen und soll begründet werden."
    },
    {
      "date": "2025-10-14",
      "id": "133901",
      "original_text": "Registerbekanntmachung nach dem Umwandlungsgesetz\nNordrhein-Westfalen Amtsgericht Düsseldorf HRB 108327\nMeCon GmbH Wirtschaftsprüfungsgesellschaft Steuerberatungsgesellschaft – Düsseldorf",
      "type": "Registerbekanntmachung nach dem Umwandlungsgesetz",
      "state": "Nordrhein-Westfalen",
      "amtsgericht": "Amtsgericht Düsseldorf",
      "registernummer": "HRB 108327",
      "registerart": "HRB",
      "company_name": "MeCon GmbH Wirtschaftsprüfungsgesellschaft Steuerberatungsgesellschaft",
      "company_seat": "Düsseldorf",
      "details": "14.10.2025 (Bekanntmachungsdatum)\n\nNordrhein-Westfalen Amtsgericht Düsseldorf HRB 108327\nRegisterbekanntmachung nach dem Umwandlungsgesetz 14.10.2025 (Eintragungsdatum)\n\nMeCon GmbH Wirtschaftsprüfungsgesellschaft Steuerberatungsgesellschaft\nGesellschaft mit beschränkter Haftung\nDüsseldorf\n\nDen Gläubigern der an der Abspaltung beteiligten Rechtsträger ist, wenn sie binnen sechs Monaten nach dem Tag, an dem die Eintragung der Abspaltung in das Register des Sitzes desjenigen Rechtsträgers, dessen Gläubiger sie sind, nach § 19 Absatz 3 UmwG als bekanntgemacht gilt, ihren Anspruch nach Grund und Höhe schriftlich anmelden, Sicherheit zu leisten, soweit sie nicht Befriedigung verlangen können. Dieses Recht steht den Gläubigern jedoch nur zu, wenn sie glaubhaft machen, dass durch die Abspaltung die Erfüllung ihrer Forderung gefährdet wird."
    },
    {
      "date": "2025-10-14",
      "id": "133902",
      "original_text": "Registerbekanntmachung nach dem Umwandlungsgesetz\nNordrhein-Westfalen Amtsgericht Paderborn HRB 18087\nwallmedien GmbH – Paderborn",
      "type": "Registerbekanntmachung nach dem Umwandlungsgesetz",
      "state": "Nordrhein-Westfalen",
      "amtsgericht": "Amtsgericht Paderborn",
      "registernummer": "HRB 18087",
      "registerart": "HRB",
      "company_name": "wallmedien GmbH",
      "company_seat": "Paderborn",
      "details": "14.10.2025 (Bekanntmachungsdatum)\n\nNordrhein-Westfalen Amtsgericht Paderborn HRB 18087\nRegisterbekanntmachung nach dem Umwandlungsgesetz 14.10.2025 (Eintragungsdatum)\n\nwallmedien GmbH\nGesellschaft mit beschränkter Haftung\nPaderborn\n\nDen Gläubigern der an der formwechselnden Umwandlung beteiligten Rechtsträger ist, wenn sie binnen sechs Monaten nach dem Tag, an dem die Eintragung der formwechselnden Umwandlung in das Register des Sitzes desjenigen Rechtsträgers, dessen Gläubiger sie sind, nach § 19 Absatz 3 UmwG als bekanntgemacht gilt, ihren Anspruch nach Grund und Höhe schriftlich anmelden, Sicherheit zu leisten, soweit sie nicht Befriedigung verlangen können. Dieses Recht steht den Gläubigern jedoch nur zu, wenn sie glaubhaft machen, dass durch die formwechselnden Umwandlung die Erfüllung ihrer Forderung gefährdet wird."
    },
    {
      "date": "2025-10-14",
      "id": "133903",
      "original_text": "Registerbekanntmachung nach dem Umwandlungsgesetz\nNordrhein-Westfalen Amtsgericht Dortmund HRA 17981\nF&A Automobile GmbH & Co. KG – Lünen",
      "type": "Registerbekanntmachung nach dem Umwandlungsgesetz",
      "state": "Nordrhein-Westfalen",
      "amtsgericht": "Amtsgericht Dortmund",
      "registernummer": "HRA 17981",
      "registerart": "HRA",
      "company_name": "F&A Automobile GmbH & Co. KG",
      "company_seat": "Lünen",
      "details": "14.10.2025 (Bekanntmachungsdatum)\n\nNordrhein-Westfalen Amtsgericht Dortmund HRA 17981\nRegisterbekanntmachung nach dem Umwandlungsgesetz 13.10.2025 (Eintragungsdatum)\n\nF&A Automobile GmbH & Co. KG\nKommanditgesellschaft\nLünen\n\nDen Gläubigern der an der formwechselnden Umwandlung beteiligten Rechtsträger ist, wenn sie binnen sechs Monaten nach dem Tag, an dem die Eintragung der formwechselnden Umwandlung desjenigen Rechtsträgers, dessen Gläubiger sie sind, nach § 19 Absatz 3 UmwG als bekanntgemacht gilt, ihren Anspruch nach Grund und Höhe schriftlich anmelden, Sicherheit zu leisten, soweit sie nicht Befriedigung verlangen können. Dieses Recht steht den Gläubigern jedoch nur zu, wenn sie glaubhaft machen, dass durch die formwechelnde Umwandlung die Erfüllung ihrer Forderung gefährdet wird."
    },
    {
      "date": "2025-10-14",
      "id": "133904",
      "original_text": "Registerbekanntmachung nach dem Umwandlungsgesetz\nNordrhein-Westfalen Amtsgericht Gütersloh HRA 8648\nSebastian Dahlkötter Fuhrhalterei und Gartenbau e.K. – Gütersloh",
      "type": "Registerbekanntmachung nach dem Umwandlungsgesetz",
      "state": "Nordrhein-Westfalen",
      "amtsgericht": "Amtsgericht Gütersloh",
      "registernummer": "HRA 8648",
      "registerart": "HRA",
      "company_name": "Sebastian Dahlkötter Fuhrhalterei und Gartenbau e.K.",
      "company_seat": "Gütersloh",
      "details": "14.10.2025 (Bekanntmachungsdatum)\n\nNordrhein-Westfalen Amtsgericht Gütersloh HRA 8648\nRegisterbekanntmachung nach dem Umwandlungsgesetz 14.10.2025 (Eintragungsdatum)\n\nSebastian Dahlkötter Fuhrhalterei und Gartenbau e.K.\nEinzelkaufmann / Einzelkauffrau\nGütersloh\n\nDen Gläubigern der an der Ausgliederung beteiligten Rechtsträger ist, wenn sie binnen sechs Monaten nach dem Tag, an dem die Eintragung der Ausgliederung in das Register des Sitzes desjenigen Rechtsträgers, dessen Gläubiger sie sind, nach § 19 Absatz 3 UmwG als bekanntgemacht gilt, ihren Anspruch nach Grund und Höhe schriftlich anmelden, Sicherheit zu leisten, soweit sie nicht Befriedigung verlangen können. Dieses Recht steht den Gläubigern jedoch nur zu, wenn sie glaubhaft machen, dass durch die Ausgliederung die Erfüllung ihrer Forderung gefährdet wird."
    },
    {
      "date": "2025-10-14",
      "id": "133905",
      "original_text": "Sonstige Registerbekanntmachung\nNordrhein-Westfalen Amtsgericht Düsseldorf HRB 53760\nHSBC Trinkaus Family Office GmbH – Düsseldorf",
      "type": "Sonstige Registerbekanntmachung",
      "state": "Nordrhein-Westfalen",
      "amtsgericht": "Amtsgericht Düsseldorf",
      "registernummer": "HRB 53760",
      "registerart": "HRB",
      "company_name": "HSBC Trinkaus Family Office GmbH",
      "company_seat": "Düsseldorf",
      "details": "14.10.2025 (Bekanntmachungsdatum)\n\nNordrhein-Westfalen Amtsgericht Düsseldorf HRB 53760\nSonstige Registerbekanntmachung 14.10.2025 (Eintragungsdatum)\n\nHSBC Trinkaus Family Office GmbH\nGesellschaft mit beschränkter Haftung\nDüsseldorf\n\nAls nicht eingetragen wird veröffentlicht: Den Gläubigern der Gesellschaft, deren Forderungen begründet worden sind bevor die Eintragung der Beendigung des Beherrschungsvertrages  in das Handelsregister nach § 10 des Handelsgesetzbuches als bekanntgemacht gilt, hat der andere Vertragsteil Sicherheit zu leisten, wenn sie sich binnen sechs Monaten nach der Bekanntmachung der Eintragung zu diesem Zweck bei ihm melden."
    },
    {
      "date": "2025-10-14",
      "id": "133906",
      "original_text": "Löschungsankündigung\nNordrhein-Westfalen Amtsgericht Köln HRA 37042\nLeitbarda GmbH & Co. KG – Köln",
      "type": "Löschungsankündigung",
      "state": "Nordrhein-Westfalen",
      "amtsgericht": "Amtsgericht Köln",
      "registernummer": "HRA 37042",
      "registerart": "HRA",
      "company_name": "Leitbarda GmbH & Co. KG",
      "company_seat": "Köln",
      "details": "14.10.2025 (Bekanntmachungsdatum)\n\nNordrhein-Westfalen Amtsgericht Köln HRA 37042\nLöschungsankündigung\n\nLeitbarda GmbH & Co. KG\nKommanditgesellschaft\nKöln\n\nDas Registergericht beabsichtigt nachfolgende Firmen von Amts wegen nach § 31 Abs. 2 HGB zu löschen. Die Frist zur Erhebung eines Widerspruchs ist auf 2 Monate festgesetzt."
    },
    {
      "date": "2025-10-14",
      "id": "133907",
      "original_text": "Löschungsankündigung\nNordrhein-Westfalen Amtsgericht Wuppertal HRB 22065\nDacor TexTechnology GmbH – Wuppertal",
      "type": "Löschungsankündigung",
      "state": "Nordrhein-Westfalen",
      "amtsgericht": "Amtsgericht Wuppertal",
      "registernummer": "HRB 22065",
      "registerart": "HRB",
      "company_name": "Dacor TexTechnology GmbH",
      "company_seat": "Wuppertal",
      "details": "14.10.2025 (Bekanntmachungsdatum)\n\nNordrhein-Westfalen Amtsgericht Wuppertal HRB 22065\nLöschungsankündigung\n\nDacor TexTechnology GmbH\nGesellschaft mit beschränkter Haftung\nWuppertal\n\nDas Registergericht beabsichtigt die Gesellschaft von Amts wegen nach § 394 FamFG zu löschen. Die Frist zur Erhebung eines Widerspruchs ist auf einen Monat festgesetzt."
    },
    {
      "date": "2025-10-14",
      "id": "133908",
      "original_text": "Löschungsankündigung\nNordrhein-Westfalen Amtsgericht Düren HRB 6356\nCasa Romantica GmbH – Nideggen",
      "type": "Löschungsankündigung",
      "state": "Nordrhein-Westfalen",
      "amtsgericht": "Amtsgericht Düren",
      "registernummer": "HRB 6356",
      "registerart": "HRB",
      "company_name": "Casa Romantica GmbH",
      "company_seat": "Nideggen",
      "details": "14.10.2025 (Bekanntmachungsdatum)\n\nNordrhein-Westfalen Amtsgericht Düren HRB 6356\nLöschungsankündigung\n\nCasa Romantica GmbH\nGesellschaft mit beschränkter Haftung\nNideggen\n\nDas Registergericht beabsichtigt die Gesellschaft von Amts wegen nach § 394 FamFG zu löschen. Die Frist zur Erhebung eines Widerspruchs ist auf drei Monate festgesetzt."
    },
    {
      "date": "2025-10-14",
      "id": "133909",
      "original_text": "Registerbekanntmachung nach dem Umwandlungsgesetz\nNordrhein-Westfalen Amtsgericht Neuss HRB 22400\nMD CLOUD SERVICES GmbH – Neuss",
      "type": "Registerbekanntmachung nach dem Umwandlungsgesetz",
      "state": "Nordrhein-Westfalen",
      "amtsgericht": "Amtsgericht Neuss",
      "registernummer": "HRB 22400",
      "registerart": "HRB",
      "company_name": "MD CLOUD SERVICES GmbH",
      "company_seat": "Neuss",
      "details": "14.10.2025 (Bekanntmachungsdatum)\n\nNordrhein-Westfalen Amtsgericht Neuss HRB 22400\nRegisterbekanntmachung nach dem Umwandlungsgesetz 14.10.2025 (Eintragungsdatum)\n\nMD CLOUD SERVICES GmbH\nGesellschaft mit beschränkter Haftung\nNeuss\n\nDen Gläubigern der an der Verschmelzung beteiligten Rechtsträger ist, wenn sie binnen sechs Monaten nach dem Tag, an dem die Eintragung der Verschmelzung in das Register des Sitzes desjenigen Rechtsträgers, dessen Gläubiger sie sind, nach § 19 Absatz 3 UmwG als bekanntgemacht gilt, ihren Anspruch nach Grund und Höhe schriftlich anmelden, Sicherheit zu leisten, soweit sie nicht Befriedigung verlangen können. Dieses Recht steht den Gläubigern jedoch nur zu, wenn sie glaubhaft machen, dass durch die Verschmelzung die Erfüllung ihrer Forderung gefährdet wird."
    },
    {
      "date": "2025-10-14",
      "id": "133910",
      "original_text": "Registerbekanntmachung nach dem Umwandlungsgesetz\nNordrhein-Westfalen Amtsgericht Paderborn HRB 18088\nKöhler-VLM Testing Technologies GmbH – Lippstadt",
      "type": "Registerbekanntmachung nach dem Umwandlungsgesetz",
      "state": "Nordrhein-Westfalen",
      "amtsgericht": "Amtsgericht Paderborn",
      "registernummer": "HRB 18088",
      "registerart": "HRB",
      "company_name": "Köhler-VLM Testing Technologies GmbH",
      "company_seat": "Lippstadt",
      "details": "14.10.2025 (Bekanntmachungsdatum)\n\nNordrhein-Westfalen Amtsgericht Paderborn HRB 18088\nRegisterbekanntmachung nach dem Umwandlungsgesetz 14.10.2025 (Eintragungsdatum)\n\nKöhler-VLM Testing Technologies GmbH\nGesellschaft mit beschränkter Haftung\nLippstadt\n\nDen Gläubigern der an der Abspaltung beteiligten Rechtsträger ist, wenn sie binnen sechs Monaten nach dem Tag, an dem die Eintragung der Abspaltung in das Register des Sitzes desjenigen Rechtsträgers, dessen Gläubiger sie sind, nach § 19 Absatz 3 UmwG als bekanntgemacht gilt, ihren Anspruch nach Grund und Höhe schriftlich anmelden, Sicherheit zu leisten, soweit sie nicht Befriedigung verlangen können. Dieses Recht steht den Gläubigern jedoch nur zu, wenn sie glaubhaft machen, dass durch die Abspaltung die Erfüllung ihrer Forderung gefährdet wird."
    },
    {
      "date": "2025-10-14",
      "id": "133911",
      "original_text": "Löschungsankündigung\nNordrhein-Westfalen Amtsgericht Krefeld HRB 17157\nClever Business UG (haftungsbeschränkt) – Brüggen",
      "type": "Löschungsankündigung",
      "state": "Nordrhein-Westfalen",
      "amtsgericht": "Amtsgericht Krefeld",
      "registernummer": "HRB 17157",
      "registerart": "HRB",
      "company_name": "Clever Business UG (haftungsbeschränkt)",
      "company_seat": "Brüggen",
      "details": "14.10.2025 (Bekanntmachungsdatum)\n\nNordrhein-Westfalen Amtsgericht Krefeld HRB 17157\nLöschungsankündigung\n\nClever Business UG (haftungsbeschränkt)\nGesellschaft mit beschränkter Haftung\nBrüggen\n\nDas Registergericht beabsichtigt die Gesellschaft von Amts wegen nach § 394 FamFG zu löschen. Die Frist zur Erhebung eines Widerspruchs ist auf einen Monat festgesetzt."
    },
    {
      "date": "2025-10-14",
      "id": "133912",
      "original_text": "Registerbekanntmachung nach dem Umwandlungsgesetz\nNordrhein-Westfalen Amtsgericht Paderborn HRB 15706\ndean&david PB Detmolder GmbH – Paderborn",
      "type": "Registerbekanntmachung nach dem Umwandlungsgesetz",
      "state": "Nordrhein-Westfalen",
      "amtsgericht": "Amtsgericht Paderborn",
      "registernummer": "HRB 15706",
      "registerart": "HRB",
      "company_name": "dean&david PB Detmolder GmbH",
      "company_seat": "Paderborn",
      "details": "14.10.2025 (Bekanntmachungsdatum)\n\nNordrhein-Westfalen Amtsgericht Paderborn HRB 15706\nRegisterbekanntmachung nach dem Umwandlungsgesetz 14.10.2025 (Eintragungsdatum)\n\ndean&david PB Detmolder GmbH\nGesellschaft mit beschränkter Haftung\nPaderborn\n\nDen Gläubigern der an der Verschmelzung beteiligten Rechtsträger ist, wenn sie binnen sechs Monaten nach dem Tag, an dem die Eintragung der Verschmelzung in das Register des Sitzes desjenigen Rechtsträgers, dessen Gläubiger sie sind, nach § 19 Absatz 3 UmwG als bekanntgemacht gilt, ihren Anspruch nach Grund und Höhe schriftlich anmelden, Sicherheit zu leisten, soweit sie nicht Befriedigung verlangen können. Dieses Recht steht den Gläubigern jedoch nur zu, wenn sie glaubhaft machen, dass durch die Verschmelzung die Erfüllung ihrer Forderung gefährdet wird."
    },
    {
      "date": "2025-10-14",
      "id": "133913",
      "original_text": "Einreichung neuer Dokumente\nNordrhein-Westfalen Amtsgericht Münster HRB 17515\nAM Holding AG – Münster",
      "type": "Einreichung neuer Dokumente",
      "state": "Nordrhein-Westfalen",
      "amtsgericht": "Amtsgericht Münster",
      "registernummer": "HRB 17515",
      "registerart": "HRB",
      "company_name": "AM Holding AG",
      "company_seat": "Münster",
      "details": "14.10.2025 (Bekanntmachungsdatum)\n\nNordrhein-Westfalen Amtsgericht Münster HRB 17515\nEinreichung neuer Dokumente\n\nAM Holding AG\nAktiengesellschaft\nMünster\n\nDem Registergericht ist eine Liste der Mitglieder des Aufsichtsrates eingereicht worden."
    },
    {
      "date": "2025-10-14",
      "id": "133914",
      "original_text": "Sonstige Registerbekanntmachung\nNordrhein-Westfalen Amtsgericht Essen HRB 34483\nthyssenkrupp Transrapid GmbH – Essen",
      "type": "Sonstige Registerbekanntmachung",
      "state": "Nordrhein-Westfalen",
      "amtsgericht": "Amtsgericht Essen",
      "registernummer": "HRB 34483",
      "registerart": "HRB",
      "company_name": "thyssenkrupp Transrapid GmbH",
      "company_seat": "Essen",
      "details": "14.10.2025 (Bekanntmachungsdatum)\n\nNordrhein-Westfalen Amtsgericht Essen HRB 34483\nSonstige Registerbekanntmachung 14.10.2025 (Eintragungsdatum)\n\nthyssenkrupp Transrapid GmbH\nGesellschaft mit beschränkter Haftung\nEssen\n\nAls nicht eingetragen wird veröffentlicht: Den Gläubigern der Gesellschaft, deren Forderungen begründet worden sind bevor die Eintragung der Beendigung des Beherrschungs- und Gewinnabführungsvertrages  in das Handelsregister nach § 10 des Handelsgesetzbuches als bekanntgemacht gilt, hat der andere Vertragsteil Sicherheit zu leisten, wenn sie sich binnen sechs Monaten nach der Bekanntmachung der Eintragung zu diesem Zweck bei ihm melden."
    },
    {
      "date": "2025-10-14",
      "id": "133915",
      "original_text": "Löschungsankündigung\nNordrhein-Westfalen Amtsgericht Bochum HRB 5493\nAltenbochumer Steuerberatungsgesellschaft mbH – Bochum",
      "type": "Löschungsankündigung",
      "state": "Nordrhein-Westfalen",
      "amtsgericht": "Amtsgericht Bochum",
      "registernummer": "HRB 5493",
      "registerart": "HRB",
      "company_name": "Altenbochumer Steuerberatungsgesellschaft mbH",
      "company_seat": "Bochum",
      "details": "14.10.2025 (Bekanntmachungsdatum)\n\nNordrhein-Westfalen Amtsgericht Bochum HRB 5493\nLöschungsankündigung\n\nAltenbochumer Steuerberatungsgesellschaft mbH\nGesellschaft mit beschränkter Haftung\nBochum\n\nDas Registergericht beabsichtigt die Gesellschaft von Amts wegen nach § 394 FamFG zu löschen. Die Frist zur Erhebung eines Widerspruchs ist auf drei Monate festgesetzt."
    },
    {
      "date": "2025-10-14",
      "id": "133916",
      "original_text": "Löschungsankündigung\nNordrhein-Westfalen Amtsgericht Kleve HRB 13730\nECHO BETONFERTIGTEILE GmbH – Moers",
      "type": "Löschungsankündigung",
      "state": "Nordrhein-Westfalen",
      "amtsgericht": "Amtsgericht Kleve",
      "registernummer": "HRB 13730",
      "registerart": "HRB",
      "company_name": "ECHO BETONFERTIGTEILE GmbH",
      "company_seat": "Moers",
      "details": "14.10.2025 (Bekanntmachungsdatum)\n\nNordrhein-Westfalen Amtsgericht Kleve HRB 13730\nLöschungsankündigung\n\nECHO BETONFERTIGTEILE GmbH\nGesellschaft mit beschränkter Haftung\nMoers\n\nDas Registergericht beabsichtigt die Gesellschaft von Amts wegen nach § 394 FamFG zu löschen. Die Frist zur Erhebung eines Widerspruchs ist auf einen Monat festgesetzt."
    },
    {
      "date": "2025-10-14",
      "id": "133917",
      "original_text": "Registerbekanntmachung nach dem Umwandlungsgesetz\nThüringen Amtsgericht Jena HRB 523781\nBetreuungsdienst Thüringen KB GmbH – Jena",
      "type": "Registerbekanntmachung nach dem Umwandlungsgesetz",
      "state": "Thüringen",
      "amtsgericht": "Amtsgericht Jena",
      "registernummer": "HRB 523781",
      "registerart": "HRB",
      "company_name": "Betreuungsdienst Thüringen KB GmbH",
      "company_seat": "Jena",
      "details": "14.10.2025 (Bekanntmachungsdatum)\n\nThüringen Amtsgericht Jena HRB 523781\nRegisterbekanntmachung nach dem Umwandlungsgesetz 14.10.2025 (Eintragungsdatum)\n\nBetreuungsdienst Thüringen KB GmbH\nGesellschaft mit beschränkter Haftung\nJena\n\nNicht eingetragen: Den Gläubigern der an der Ausgliederung beteiligten Rechtsträger, ist wenn sie binnen sechs Monaten nach dem Tag, an dem die Eintragung der Ausgliederung in das Register des Sitzes desjenigen Rechtsträgers, dessen Gläubiger sie sind, nach §§125, 19 Abs. 3 UmwG als bekanntgemacht gilt, ihren Anspruch nach Grund und Höhe schriftlich anmelden, Sicherheit zu leisten, soweit sie nicht Befriedigung verlangen können. Dieses Recht steht ihnen jedoch nur zu, wenn sie glaubhaft machen, daß durch die Ausgliederung die Erfüllung ihrer Forderung gefährdet wird."
    },
    {
      "date": "2025-10-14",
      "id": "133918",
      "original_text": "Registerbekanntmachung nach dem Umwandlungsgesetz\nThüringen Amtsgericht Jena HRA 507100\nBetreuungsdienst Thüringen KB e. K. – Jena",
      "type": "Registerbekanntmachung nach dem Umwandlungsgesetz",
      "state": "Thüringen",
      "amtsgericht": "Amtsgericht Jena",
      "registernummer": "HRA 507100",
      "registerart": "HRA",
      "company_name": "Betreuungsdienst Thüringen KB e. K.",
      "company_seat": "Jena",
      "details": "14.10.2025 (Bekanntmachungsdatum)\n\nThüringen Amtsgericht Jena HRA 507100\nRegisterbekanntmachung nach dem Umwandlungsgesetz 14.10.2025 (Eintragungsdatum)\n\nBetreuungsdienst Thüringen KB e. K.\nEinzelkaufmann / Einzelkauffrau\nJena\n\nNicht eingetragen: Den Gläubigern der an der Ausgliederung beteiligten Rechtsträger, ist wenn sie binnen sechs Monaten nach dem Tag, an dem die Eintragung der Ausgliederung in das Register des Sitzes desjenigen Rechtsträgers, dessen Gläubiger sie sind, nach §§125, 19 Abs. 3 UmwG als bekanntgemacht gilt, ihren Anspruch nach Grund und Höhe schriftlich anmelden, Sicherheit zu leisten, soweit sie nicht Befriedigung verlangen können. Dieses Recht steht ihnen jedoch nur zu, wenn sie glaubhaft machen, daß durch die Ausgliederung die Erfüllung ihrer Forderung gefährdet wird."
    },
    {
      "date": "2025-10-14",
      "id": "133919",
      "original_text": "Löschungsankündigung\nHessen Amtsgericht Offenbach am Main HRB 53594\nMPE Dienstleistungen GmbH – Offenbach am Main",
      "type": "Löschungsankündigung",
      "state": "Hessen",
      "amtsgericht": "Amtsgericht Offenbach am Main",
      "registernummer": "HRB 53594",
      "registerart": "HRB",
      "company_name": "MPE Dienstleistungen GmbH",
      "company_seat": "Offenbach am Main",
      "details": "14.10.2025 (Bekanntmachungsdatum)\n\nHessen Amtsgericht Offenbach am Main HRB 53594\nLöschungsankündigung 14.10.2025 (Eintragungsdatum)\n\nMPE Dienstleistungen GmbH\nGesellschaft mit beschränkter Haftung\nOffenbach am Main\n\nDas Registergericht beabsichtigt die im Handelsregister eingetragene Gesellschaft von Amts wegen nach § 394 FamFG zu löschen. Die Frist zur Erhebung eines Widerspruchs gegen die beabsichtigte Löschung wird auf 3 Monate festgesetzt."
    },
    {
      "date": "2025-10-14",
      "id": "133920",
      "original_text": "Löschungsankündigung\nHessen Amtsgericht Frankfurt am Main HRB 110089\nFeher Mihai GmbH – Frankfurt am Main",
      "type": "Löschungsankündigung",
      "state": "Hessen",
      "amtsgericht": "Amtsgericht Frankfurt am Main",
      "registernummer": "HRB 110089",
      "registerart": "HRB",
      "company_name": "Feher Mihai GmbH",
      "company_seat": "Frankfurt am Main",
      "details": "14.10.2025 (Bekanntmachungsdatum)\n\nHessen Amtsgericht Frankfurt am Main HRB 110089\nLöschungsankündigung\n\nFeher Mihai GmbH\nGesellschaft mit beschränkter Haftung\nFrankfurt am Main\n\nEs ist beabsichtigt, die Gesellschaft wegen Vermögenslosigkeit gemäß § 394 FamFG von Amts wegen im Handelsregister zu löschen. Hiergegen kann innerhalb eines Monats nach dieser Veröffentlichung Widerspruch bei dem Amtsgericht Frankfurt am Main eingelegt werden."
    },
    {
      "date": "2025-10-14",
      "id": "133921",
      "original_text": "Löschungsankündigung\nHessen Amtsgericht Offenbach am Main HRB 50604\nH & H Bau GmbH – Offenbach am Main",
      "type": "Löschungsankündigung",
      "state": "Hessen",
      "amtsgericht": "Amtsgericht Offenbach am Main",
      "registernummer": "HRB 50604",
      "registerart": "HRB",
      "company_name": "H & H Bau GmbH",
      "company_seat": "Offenbach am Main",
      "details": "14.10.2025 (Bekanntmachungsdatum)\n\nHessen Amtsgericht Offenbach am Main HRB 50604\nLöschungsankündigung 14.10.2025 (Eintragungsdatum)\n\nH & H Bau GmbH\nGesellschaft mit beschränkter Haftung\nOffenbach am Main\n\nDas Registergericht beabsichtigt die im Handelsregister eingetragene Gesellschaft von Amts wegen nach § 394 FamFG zu löschen. Die Frist zur Erhebung eines Widerspruchs gegen die beabsichtigte Löschung wird auf 3 Monate festgesetzt."
    },
    {
      "date": "2025-10-14",
      "id": "133922",
      "original_text": "Registerbekanntmachung nach dem Umwandlungsgesetz\nHessen Amtsgericht Offenbach am Main HRB 51712\nKARL MAYER STOLL R&D GmbH – Obertshausen",
      "type": "Registerbekanntmachung nach dem Umwandlungsgesetz",
      "state": "Hessen",
      "amtsgericht": "Amtsgericht Offenbach am Main",
      "registernummer": "HRB 51712",
      "registerart": "HRB",
      "company_name": "KARL MAYER STOLL R&D GmbH",
      "company_seat": "Obertshausen",
      "details": "14.10.2025 (Bekanntmachungsdatum)\n\nHessen Amtsgericht Offenbach am Main HRB 51712\nRegisterbekanntmachung nach dem Umwandlungsgesetz 14.10.2025 (Eintragungsdatum)\n\nKARL MAYER STOLL R&D GmbH\nGesellschaft mit beschränkter Haftung\nObertshausen\n\nDen Gläubigern der an der Verschmelzung beteiligten Rechtsträger ist, wenn sie binnen sechs Monaten nach dem Tag, an dem die Eintragung der Verschmelzung in das Register des Sitzes desjenigen Rechtsträgers, dessen Gläubiger sie sind, nach § 19 Absatz 3 UmwG bekannt gemacht worden ist, ihren Anspruch nach Grund und Höhe schriftlich anmelden, Sicherheit zu leisten, soweit sie nicht Befriedigung verlangen können. Dieses Recht steht den Gläubigern jedoch nur zu, wenn sie glaubhaft machen, dass durch die Verschmelzung die Erfüllung ihrer Forderung gefährdet wird."
    },
    {
      "date": "2025-10-14",
      "id": "133923",
      "original_text": "Löschungsankündigung\nHessen Amtsgericht Wiesbaden HRB 27455\nCASA MAX BAUWERK SANIERUNGS KONZEPT GmbH – Taunusstein",
      "type": "Löschungsankündigung",
      "state": "Hessen",
      "amtsgericht": "Amtsgericht Wiesbaden",
      "registernummer": "HRB 27455",
      "registerart": "HRB",
      "company_name": "CASA MAX BAUWERK SANIERUNGS KONZEPT GmbH",
      "company_seat": "Taunusstein",
      "details": "14.10.2025 (Bekanntmachungsdatum)\n\nHessen Amtsgericht Wiesbaden HRB 27455\nLöschungsankündigung\n\nCASA MAX BAUWERK SANIERUNGS KONZEPT GmbH\nGesellschaft mit beschränkter Haftung\nTaunusstein\n\nDas Registergericht beabsichtigt die im Handelsregister eingetragene Gesellschaft von Amts wegen nach § 394 FamFG zu löschen. Die Frist zur Erhebung eines Widerspruchs gegen die beabsichtigte Löschung wird auf 3 Monate festgesetzt."
    },
    {
      "date": "2025-10-14",
      "id": "133924",
      "original_text": "Registerbekanntmachung nach dem Umwandlungsgesetz\nHessen Amtsgericht Kassel HRB 5184\nAntrok Energie- und Anlagentechnik GmbH – Lohfelden",
      "type": "Registerbekanntmachung nach dem Umwandlungsgesetz",
      "state": "Hessen",
      "amtsgericht": "Amtsgericht Kassel",
      "registernummer": "HRB 5184",
      "registerart": "HRB",
      "company_name": "Antrok Energie- und Anlagentechnik GmbH",
      "company_seat": "Lohfelden",
      "details": "14.10.2025 (Bekanntmachungsdatum)\n\nHessen Amtsgericht Kassel HRB 5184\nRegisterbekanntmachung nach dem Umwandlungsgesetz 14.10.2025 (Eintragungsdatum)\n\nAntrok Energie- und Anlagentechnik GmbH\nGesellschaft mit beschränkter Haftung\nLohfelden\n\nDen Gläubigern der an der Verschmelzung beteiligten Rechtsträger ist, wenn sie binnen sechs Monaten nach dem Tag, an dem die Eintragung der Verschmelzung in das Register des Sitzes desjenigen Rechtsträgers, dessen Gläubiger sie sind, nach § 19 Absatz 3 UmwG bekannt gemacht worden ist, ihren Anspruch nach Grund und Höhe schriftlich anmelden, Sicherheit zu leisten, soweit sie nicht Befriedigung verlangen können. Dieses Recht steht den Gläubigern jedoch nur zu, wenn sie glaubhaft machen, dass durch die Verschmelzung die Erfüllung ihrer Forderung gefährdet wird."
    },
    {
      "date": "2025-10-14",
      "id": "133925",
      "original_text": "Löschungsankündigung\nHessen Amtsgericht Frankfurt am Main HRB 113659\nRoyal Argan UG (haftungsbeschränkt) – Karben",
      "type": "Löschungsankündigung",
      "state": "Hessen",
      "amtsgericht": "Amtsgericht Frankfurt am Main",
      "registernummer": "HRB 113659",
      "registerart": "HRB",
      "company_name": "Royal Argan UG (haftungsbeschränkt)",
      "company_seat": "Karben",
      "details": "14.10.2025 (Bekanntmachungsdatum)\n\nHessen Amtsgericht Frankfurt am Main HRB 113659\nLöschungsankündigung 14.10.2025 (Eintragungsdatum)\n\nRoyal Argan UG (haftungsbeschränkt)\nGesellschaft mit beschränkter Haftung\nKarben\n\nDas Registergericht beabsichtigt die im Handelsregister eingetragene Gesellschaft von Amts wegen nach § 394 FamFG zu löschen. Die Frist zur Erhebung eines Widerspruchs gegen die beabsichtigte Löschung wird auf 1 Monat festgesetzt."
    },
    {
      "date": "2025-10-14",
      "id": "133926",
      "original_text": "Einreichung neuer Dokumente\nHessen Amtsgericht Frankfurt am Main HRB 55933\nT-Systems International GmbH – Frankfurt am Main",
      "type": "Einreichung neuer Dokumente",
      "state": "Hessen",
      "amtsgericht": "Amtsgericht Frankfurt am Main",
      "registernummer": "HRB 55933",
      "registerart": "HRB",
      "company_name": "T-Systems International GmbH",
      "company_seat": "Frankfurt am Main",
      "details": "14.10.2025 (Bekanntmachungsdatum)\n\nHessen Amtsgericht Frankfurt am Main HRB 55933\nEinreichung neuer Dokumente\n\nT-Systems International GmbH\nGesellschaft mit beschränkter Haftung\nFrankfurt am Main\n\nDurch eine Änderung in den Personen der Aufsichtsratsmitglieder ist eine Liste der Mitglieder des Aufsichtsrates zum Handelsregister eingereicht worden."
    },
    {
      "date": "2025-10-14",
      "id": "133927",
      "original_text": "Löschungsankündigung\nHessen Amtsgericht Offenbach am Main HRB 40736\nZENIT Finanz-Agentur GmbH – Rödermark",
      "type": "Löschungsankündigung",
      "state": "Hessen",
      "amtsgericht": "Amtsgericht Offenbach am Main",
      "registernummer": "HRB 40736",
      "registerart": "HRB",
      "company_name": "ZENIT Finanz-Agentur GmbH",
      "company_seat": "Rödermark",
      "details": "14.10.2025 (Bekanntmachungsdatum)\n\nHessen Amtsgericht Offenbach am Main HRB 40736\nLöschungsankündigung 14.10.2025 (Eintragungsdatum)\n\nZENIT Finanz-Agentur GmbH\nGesellschaft mit beschränkter Haftung\nRödermark\n\nDas Registergericht beabsichtigt die im Handelsregister eingetragene Gesellschaft von Amts wegen nach § 394 FamFG zu löschen. Die Frist zur Erhebung eines Widerspruchs gegen die beabsichtigte Löschung wird auf 3 Monate festgesetzt."
    },
    {
      "date": "2025-10-14",
      "id": "133928",
      "original_text": "Löschungsankündigung\nHessen Amtsgericht Offenbach am Main HRB 53926\nBau-tec GmbH – Rödermark",
      "type": "Löschungsankündigung",
      "state": "Hessen",
      "amtsgericht": "Amtsgericht Offenbach am Main",
      "registernummer": "HRB 53926",
      "registerart": "HRB",
      "company_name": "Bau-tec GmbH",
      "company_seat": "Rödermark",
      "details": "14.10.2025 (Bekanntmachungsdatum)\n\nHessen Amtsgericht Offenbach am Main HRB 53926\nLöschungsankündigung 14.10.2025 (Eintragungsdatum)\n\nBau-tec GmbH\nGesellschaft mit beschränkter Haftung\nRödermark\n\nDas Registergericht beabsichtigt die im Handelsregister eingetragene Gesellschaft von Amts wegen nach § 394 FamFG zu löschen. Die Frist zur Erhebung eines Widerspruchs gegen die beabsichtigte Löschung wird auf 3 Monate festgesetzt."
    },
    {
      "date": "2025-10-14",
      "id": "133929",
      "original_text": "Löschungsankündigung\nHessen Amtsgericht Frankfurt am Main HRB 93570\nHandy Corner GmbH – Frankfurt am Main",
      "type": "Löschungsankündigung",
      "state": "Hessen",
      "amtsgericht": "Amtsgericht Frankfurt am Main",
      "registernummer": "HRB 93570",
      "registerart": "HRB",
      "company_name": "Handy Corner GmbH",
      "company_seat": "Frankfurt am Main",
      "details": "14.10.2025 (Bekanntmachungsdatum)\n\nHessen Amtsgericht Frankfurt am Main HRB 93570\nLöschungsankündigung\n\nHandy Corner GmbH\nGesellschaft mit beschränkter Haftung\nFrankfurt am Main\n\nDas Registergericht beabsichtigt die im Handelsregister eingetragene Gesellschaft von Amts wegen nach § 394 FamFG zu löschen. Die Frist zur Erhebung eines Widerspruchs gegen die beabsichtigte Löschung wird auf 1 Monat festgesetzt."
    },
    {
      "date": "2025-10-14",
      "id": "133930",
      "original_text": "Registerbekanntmachung nach dem Umwandlungsgesetz\nHessen Amtsgericht Kassel HRB 6827\nAntrok Maschinenbau GmbH – Lohfelden",
      "type": "Registerbekanntmachung nach dem Umwandlungsgesetz",
      "state": "Hessen",
      "amtsgericht": "Amtsgericht Kassel",
      "registernummer": "HRB 6827",
      "registerart": "HRB",
      "company_name": "Antrok Maschinenbau GmbH",
      "company_seat": "Lohfelden",
      "details": "14.10.2025 (Bekanntmachungsdatum)\n\nHessen Amtsgericht Kassel HRB 6827\nRegisterbekanntmachung nach dem Umwandlungsgesetz 14.10.2025 (Eintragungsdatum)\n\nAntrok Maschinenbau GmbH\nGesellschaft mit beschränkter Haftung\nLohfelden\n\nDen Gläubigern der an der Verschmelzung beteiligten Rechtsträger ist, wenn sie binnen sechs Monaten nach dem Tag, an dem die Eintragung der Verschmelzung in das Register des Sitzes desjenigen Rechtsträgers, dessen Gläubiger sie sind, nach § 19 Absatz 3 UmwG bekannt gemacht worden ist, ihren Anspruch nach Grund und Höhe schriftlich anmelden, Sicherheit zu leisten, soweit sie nicht Befriedigung verlangen können. Dieses Recht steht den Gläubigern jedoch nur zu, wenn sie glaubhaft machen, dass durch die Verschmelzung die Erfüllung ihrer Forderung gefährdet wird."
    },
    {
      "date": "2025-10-14",
      "id": "133931",
      "original_text": "Löschungsankündigung\nHessen Amtsgericht Offenbach am Main HRB 54620\nLuca Flex Trans GmbH – Dietzenbach",
      "type": "Löschungsankündigung",
      "state": "Hessen",
      "amtsgericht": "Amtsgericht Offenbach am Main",
      "registernummer": "HRB 54620",
      "registerart": "HRB",
      "company_name": "Luca Flex Trans GmbH",
      "company_seat": "Dietzenbach",
      "details": "14.10.2025 (Bekanntmachungsdatum)\n\nHessen Amtsgericht Offenbach am Main HRB 54620\nLöschungsankündigung 14.10.2025 (Eintragungsdatum)\n\nLuca Flex Trans GmbH\nGesellschaft mit beschränkter Haftung\nDietzenbach\n\nDas Registergericht beabsichtigt die im Handelsregister eingetragene Gesellschaft von Amts wegen nach § 394 FamFG zu löschen. Die Frist zur Erhebung eines Widerspruchs gegen die beabsichtigte Löschung wird auf 3 Monate festgesetzt."
    },
    {
      "date": "2025-10-14",
      "id": "133932",
      "original_text": "Löschungsankündigung\nHessen Amtsgericht Offenbach am Main HRB 51022\nADI Marketing GmbH – Dietzenbach",
      "type": "Löschungsankündigung",
      "state": "Hessen",
      "amtsgericht": "Amtsgericht Offenbach am Main",
      "registernummer": "HRB 51022",
      "registerart": "HRB",
      "company_name": "ADI Marketing GmbH",
      "company_seat": "Dietzenbach",
      "details": "14.10.2025 (Bekanntmachungsdatum)\n\nHessen Amtsgericht Offenbach am Main HRB 51022\nLöschungsankündigung 14.10.2025 (Eintragungsdatum)\n\nADI Marketing GmbH\nGesellschaft mit beschränkter Haftung\nDietzenbach\n\nDas Registergericht beabsichtigt die im Handelsregister eingetragene Gesellschaft von Amts wegen nach § 394 FamFG zu löschen. Die Frist zur Erhebung eines Widerspruchs gegen die beabsichtigte Löschung wird auf 3 Monate festgesetzt."
    },
    {
      "date": "2025-10-14",
      "id": "133933",
      "original_text": "Löschungsankündigung\nHessen Amtsgericht Offenbach am Main HRB 45426\nBrilliant Bau GmbH – Offenbach am Main",
      "type": "Löschungsankündigung",
      "state": "Hessen",
      "amtsgericht": "Amtsgericht Offenbach am Main",
      "registernummer": "HRB 45426",
      "registerart": "HRB",
      "company_name": "Brilliant Bau GmbH",
      "company_seat": "Offenbach am Main",
      "details": "14.10.2025 (Bekanntmachungsdatum)\n\nHessen Amtsgericht Offenbach am Main HRB 45426\nLöschungsankündigung 14.10.2025 (Eintragungsdatum)\n\nBrilliant Bau GmbH\nGesellschaft mit beschränkter Haftung\nOffenbach am Main\n\nDas Registergericht beabsichtigt die im Handelsregister eingetragene Gesellschaft von Amts wegen nach § 394 FamFG zu löschen. Die Frist zur Erhebung eines Widerspruchs gegen die beabsichtigte Löschung wird auf 3 Monate festgesetzt."
    },
    {
      "date": "2025-10-14",
      "id": "133934",
      "original_text": "Löschungsankündigung\nHessen Amtsgericht Offenbach am Main HRB 45516\nmySportz GmbH – Offenbach am Main",
      "type": "Löschungsankündigung",
      "state": "Hessen",
      "amtsgericht": "Amtsgericht Offenbach am Main",
      "registernummer": "HRB 45516",
      "registerart": "HRB",
      "company_name": "mySportz GmbH",
      "company_seat": "Offenbach am Main",
      "details": "14.10.2025 (Bekanntmachungsdatum)\n\nHessen Amtsgericht Offenbach am Main HRB 45516\nLöschungsankündigung 14.10.2025 (Eintragungsdatum)\n\nmySportz GmbH\nGesellschaft mit beschränkter Haftung\nOffenbach am Main\n\nDas Registergericht beabsichtigt die im Handelsregister eingetragene Gesellschaft von Amts wegen nach § 394 FamFG zu löschen. Die Frist zur Erhebung eines Widerspruchs gegen die beabsichtigte Löschung wird auf 3 Monate festgesetzt."
    }
  ]
}