{
  "date": "2025-10-01",
  "date_of_scrape": "2025-10-27T16:03:07.227Z",
  "tool_version": "0.2.0",
  "number_of_announcements": 266,
  "announcements": [
    {
      "date": "2025-10-01",
      "id": "132127",
      "original_text": "Registerbekanntmachung nach dem Umwandlungsgesetz\nBayern Amtsgericht München HRB 148388\nHETA Asset Resolution Germany GmbH – München",
      "type": "Registerbekanntmachung nach dem Umwandlungsgesetz",
      "state": "Bayern",
      "amtsgericht": "Amtsgericht München",
      "registernummer": "HRB 148388",
      "registerart": "HRB",
      "company_name": "HETA Asset Resolution Germany GmbH",
      "company_seat": "München",
      "details": "01.10.2025 (Bekanntmachungsdatum)\n\nBayern Amtsgericht München HRB 148388\nRegisterbekanntmachung nach dem Umwandlungsgesetz 30.09.2025 (Eintragungsdatum)\n\nHETA Asset Resolution Germany GmbH\nGesellschaft mit beschränkter Haftung\nMünchen\n\nDen Gläubigern der an der Verschmelzung beteiligten Rechtsträger ist, wenn sie binnen sechs Monaten nach dem Tag, an dem die Eintragung der Verschmelzung in das Register des Sitzes desjenigen Rechtsträgers, dessen Gläubiger sie sind, nach § 19 Abs. 3 UmwG als bekannt gemacht gilt, ihren Anspruch nach Grund und Höhe in Textform anmelden, Sicherheit zu leisten, soweit sie nicht Befriedigung verlangen können. Dieses Recht steht den Gläubigern jedoch nur zu, wenn sie glaubhaft machen, dass durch die Verschmelzung die Erfüllung ihrer Forderung gefährdet wird."
    },
    {
      "date": "2025-10-01",
      "id": "132128",
      "original_text": "Registerbekanntmachung nach dem Umwandlungsgesetz\nBayern Amtsgericht Augsburg HRA 22034\nSchulten & Zillich OHG – Augsburg",
      "type": "Registerbekanntmachung nach dem Umwandlungsgesetz",
      "state": "Bayern",
      "amtsgericht": "Amtsgericht Augsburg",
      "registernummer": "HRA 22034",
      "registerart": "HRA",
      "company_name": "Schulten & Zillich OHG",
      "company_seat": "Augsburg",
      "details": "01.10.2025 (Bekanntmachungsdatum)\n\nBayern Amtsgericht Augsburg HRA 22034\nRegisterbekanntmachung nach dem Umwandlungsgesetz 30.09.2025 (Eintragungsdatum)\n\nSchulten & Zillich OHG\nOffene Handelsgesellschaft\nAugsburg\n\nDen Gläubigern der an der Verschmelzung beteiligten Rechtsträger ist, wenn sie binnen sechs Monaten nach dem Tag, an dem die Eintragung der Verschmelzung in das Register des Sitzes desjenigen Rechtsträgers, dessen Gläubiger sie sind, nach § 19 Abs. 3 UmwG als bekannt gemacht gilt, ihren Anspruch nach Grund und Höhe in Textform anmelden, Sicherheit zu leisten, soweit sie nicht Befriedigung verlangen können. Dieses Recht steht den Gläubigern jedoch nur zu, wenn sie glaubhaft machen, dass durch die Verschmelzung die Erfüllung ihrer Forderung gefährdet wird."
    },
    {
      "date": "2025-10-01",
      "id": "132129",
      "original_text": "Einreichung neuer Dokumente\nBayern Amtsgericht Nürnberg HRB 15409\nTeamBank AG Nürnberg – Nürnberg",
      "type": "Einreichung neuer Dokumente",
      "state": "Bayern",
      "amtsgericht": "Amtsgericht Nürnberg",
      "registernummer": "HRB 15409",
      "registerart": "HRB",
      "company_name": "TeamBank AG Nürnberg",
      "company_seat": "Nürnberg",
      "details": "01.10.2025 (Bekanntmachungsdatum)\n\nBayern Amtsgericht Nürnberg HRB 15409\nEinreichung neuer Dokumente 30.09.2025 (Eintragungsdatum)\n\nTeamBank AG Nürnberg\nAktiengesellschaft\nNürnberg\n\nDem Amtsgericht Nürnberg -Registergericht- ist eine Liste der Mitglieder des Aufsichtsrats eingereicht worden, § 106 AktG."
    },
    {
      "date": "2025-10-01",
      "id": "132130",
      "original_text": "Löschungsankündigung\nBayern Amtsgericht Amberg HRB 1699\nAtlantis Handelskontor GmbH – Schwandorf",
      "type": "Löschungsankündigung",
      "state": "Bayern",
      "amtsgericht": "Amtsgericht Amberg",
      "registernummer": "HRB 1699",
      "registerart": "HRB",
      "company_name": "Atlantis Handelskontor GmbH",
      "company_seat": "Schwandorf",
      "details": "01.10.2025 (Bekanntmachungsdatum)\n\nBayern Amtsgericht Amberg HRB 1699\nLöschungsankündigung\n\nAtlantis Handelskontor GmbH\nGesellschaft mit beschränkter Haftung\nSchwandorf\n\nDas Registergericht beabsichtigt, die im Handelsregister eingetragene Gesellschaft wegen Vermögenslosigkeit von Amts wegen nach § 394 FamFG zu löschen. Die Frist zur Erhebung eines Widerspruchs ist auf einen Monat festgesetzt."
    },
    {
      "date": "2025-10-01",
      "id": "132131",
      "original_text": "Löschungsankündigung\nBayern Amtsgericht München HRB 271986\nD.M. Handels UG (haftungsbeschränkt) – Baierbrunn",
      "type": "Löschungsankündigung",
      "state": "Bayern",
      "amtsgericht": "Amtsgericht München",
      "registernummer": "HRB 271986",
      "registerart": "HRB",
      "company_name": "D.M. Handels UG (haftungsbeschränkt)",
      "company_seat": "Baierbrunn",
      "details": "01.10.2025 (Bekanntmachungsdatum)\n\nBayern Amtsgericht München HRB 271986\nLöschungsankündigung\n\nD.M. Handels UG (haftungsbeschränkt)\nGesellschaft mit beschränkter Haftung\nBaierbrunn\n\nDas Registergericht beabsichtigt, die im Handelsregister eingetragene Gesellschaft wegen Vermögenslosigkeit von Amts wegen nach § 394 FamFG zu löschen. Die Frist zur Erhebung eines Widerspruchs ist auf drei Monate festgesetzt."
    },
    {
      "date": "2025-10-01",
      "id": "132132",
      "original_text": "Registerbekanntmachung nach dem Umwandlungsgesetz\nBayern Amtsgericht München HRB 218597\nAdvanz Pharma GmbH – München",
      "type": "Registerbekanntmachung nach dem Umwandlungsgesetz",
      "state": "Bayern",
      "amtsgericht": "Amtsgericht München",
      "registernummer": "HRB 218597",
      "registerart": "HRB",
      "company_name": "Advanz Pharma GmbH",
      "company_seat": "München",
      "details": "01.10.2025 (Bekanntmachungsdatum)\n\nBayern Amtsgericht München HRB 218597\nRegisterbekanntmachung nach dem Umwandlungsgesetz 30.09.2025 (Eintragungsdatum)\n\nAdvanz Pharma GmbH\nGesellschaft mit beschränkter Haftung\nMünchen\n\nDen Gläubigern der an der Verschmelzung beteiligten Rechtsträger ist, wenn sie binnen sechs Monaten nach dem Tag, an dem die Eintragung der Verschmelzung in das Register des Sitzes desjenigen Rechtsträgers, dessen Gläubiger sie sind, nach § 19 Abs. 3 UmwG als bekannt gemacht gilt, ihren Anspruch nach Grund und Höhe in Textform anmelden, Sicherheit zu leisten, soweit sie nicht Befriedigung verlangen können. Dieses Recht steht den Gläubigern jedoch nur zu, wenn sie glaubhaft machen, dass durch die Verschmelzung die Erfüllung ihrer Forderung gefährdet wird."
    },
    {
      "date": "2025-10-01",
      "id": "132133",
      "original_text": "Registerbekanntmachung nach dem Umwandlungsgesetz\nBayern Amtsgericht München HRB 88308\nGeoplan Bauentwicklungs GmbH – Grünwald",
      "type": "Registerbekanntmachung nach dem Umwandlungsgesetz",
      "state": "Bayern",
      "amtsgericht": "Amtsgericht München",
      "registernummer": "HRB 88308",
      "registerart": "HRB",
      "company_name": "Geoplan Bauentwicklungs GmbH",
      "company_seat": "Grünwald",
      "details": "01.10.2025 (Bekanntmachungsdatum)\n\nBayern Amtsgericht München HRB 88308\nRegisterbekanntmachung nach dem Umwandlungsgesetz 30.09.2025 (Eintragungsdatum)\n\nGeoplan Bauentwicklungs GmbH\nGesellschaft mit beschränkter Haftung\nGrünwald\n\nDen Gläubigern der an der Verschmelzung beteiligten Rechtsträger ist, wenn sie binnen sechs Monaten nach dem Tag, an dem die Eintragung der Verschmelzung in das Register des Sitzes desjenigen Rechtsträgers, dessen Gläubiger sie sind, nach § 19 Abs. 3 UmwG als bekannt gemacht gilt, ihren Anspruch nach Grund und Höhe in Textform anmelden, Sicherheit zu leisten, soweit sie nicht Befriedigung verlangen können. Dieses Recht steht den Gläubigern jedoch nur zu, wenn sie glaubhaft machen, dass durch die Verschmelzung die Erfüllung ihrer Forderung gefährdet wird."
    },
    {
      "date": "2025-10-01",
      "id": "132134",
      "original_text": "Registerbekanntmachung nach dem Umwandlungsgesetz\nBayern Amtsgericht München HRB 176455\nIntergraph PP&M Deutschland GmbH – Garching b. München",
      "type": "Registerbekanntmachung nach dem Umwandlungsgesetz",
      "state": "Bayern",
      "amtsgericht": "Amtsgericht München",
      "registernummer": "HRB 176455",
      "registerart": "HRB",
      "company_name": "Intergraph PP&M Deutschland GmbH",
      "company_seat": "Garching b. München",
      "details": "01.10.2025 (Bekanntmachungsdatum)\n\nBayern Amtsgericht München HRB 176455\nRegisterbekanntmachung nach dem Umwandlungsgesetz 30.09.2025 (Eintragungsdatum)\n\nIntergraph PP&M Deutschland GmbH\nGesellschaft mit beschränkter Haftung\nGarching b. München\n\nDen Gläubigern der an der Spaltung beteiligten Rechtsträger ist, wenn sie binnen sechs Monaten nach dem Tag, an dem die Eintragung der Spaltung in das Register des Sitzes desjenigen Rechtsträgers, dessen Gläubiger sie sind, nach §§ 125, 19 Abs. 3 UmwG als bekannt gemacht gilt, ihren Anspruch nach Grund und Höhe in Textform anmelden, Sicherheit zu leisten, soweit sie nicht Befriedigung verlangen können. Dieses Recht steht den Gläubigern jedoch nur zu, wenn sie glaubhaft machen, dass durch die Spaltung die Erfüllung ihrer Forderung gefährdet wird."
    },
    {
      "date": "2025-10-01",
      "id": "132135",
      "original_text": "Registerbekanntmachung nach dem Umwandlungsgesetz\nBayern Amtsgericht Traunstein HRB 14677\nOSRAM SBT GmbH – Traunreut",
      "type": "Registerbekanntmachung nach dem Umwandlungsgesetz",
      "state": "Bayern",
      "amtsgericht": "Amtsgericht Traunstein",
      "registernummer": "HRB 14677",
      "registerart": "HRB",
      "company_name": "OSRAM SBT GmbH",
      "company_seat": "Traunreut",
      "details": "01.10.2025 (Bekanntmachungsdatum)\n\nBayern Amtsgericht Traunstein HRB 14677\nRegisterbekanntmachung nach dem Umwandlungsgesetz 30.09.2025 (Eintragungsdatum)\n\nOSRAM SBT GmbH\nGesellschaft mit beschränkter Haftung\nTraunreut\n\nDen Gläubigern der an der Verschmelzung beteiligten Rechtsträger ist, wenn sie binnen sechs Monaten nach dem Tag, an dem die Eintragung der Verschmelzung in das Register des Sitzes desjenigen Rechtsträgers, dessen Gläubiger sie sind, nach § 19 Abs. 3 UmwG als bekannt gemacht gilt, ihren Anspruch nach Grund und Höhe in Textform anmelden, Sicherheit zu leisten, soweit sie nicht Befriedigung verlangen können. Dieses Recht steht den Gläubigern jedoch nur zu, wenn sie glaubhaft machen, dass durch die Verschmelzung die Erfüllung ihrer Forderung gefährdet wird."
    },
    {
      "date": "2025-10-01",
      "id": "132136",
      "original_text": "Registerbekanntmachung nach dem Umwandlungsgesetz\nBayern Amtsgericht München HRB 144230\nBüschl Vermögensverwaltungs GmbH – Grünwald",
      "type": "Registerbekanntmachung nach dem Umwandlungsgesetz",
      "state": "Bayern",
      "amtsgericht": "Amtsgericht München",
      "registernummer": "HRB 144230",
      "registerart": "HRB",
      "company_name": "Büschl Vermögensverwaltungs GmbH",
      "company_seat": "Grünwald",
      "details": "01.10.2025 (Bekanntmachungsdatum)\n\nBayern Amtsgericht München HRB 144230\nRegisterbekanntmachung nach dem Umwandlungsgesetz 30.09.2025 (Eintragungsdatum)\n\nBüschl Vermögensverwaltungs GmbH\nGesellschaft mit beschränkter Haftung\nGrünwald\n\nDen Gläubigern #dv.auswahl(Text=\"Bitte zutreffendes auswählen:\",Eingabe=\n\n\"der an der Verschmelzung beteiligten Rechtsträger ist, wenn sie binnen sechs Monaten nach dem Tag, an dem die Eintragung der Verschmelzung in das Register des Sitzes desjenigen Rechtsträgers, dessen Gläubiger sie sind, nach § 19 Abs. 3 UmwG als bekannt gemacht gilt, ihren Anspruch nach Grund und Höhe in Textform anmelden, Sicherheit zu leisten, soweit sie nicht Befriedigung verlangen können. Dieses Recht steht den Gläubigern jedoch nur zu, wenn sie glaubhaft machen, dass durch die Verschmelzung die Erfüllung ihrer Forderung gefährdet wird.\"|\"Verschmelzung\",\n\n\"der an der Spaltung beteiligten Rechtsträger ist, wenn sie binnen sechs Monaten nach dem Tag, an dem die Eintragung der Spaltung in das Register des Sitzes desjenigen Rechtsträgers, dessen Gläubiger sie sind, nach §§ 125, 19 Abs. 3 UmwG als bekannt gemacht gilt, ihren Anspruch nach Grund und Höhe in Textform anmelden, Sicherheit zu leisten, soweit sie nicht Befriedigung verlangen können. Dieses Recht steht den Gläubigern jedoch nur zu, wenn sie glaubhaft machen, dass durch die Spaltung die Erfüllung ihrer Forderung gefährdet wird.\"|\"Spaltung\",\n\n\"des formwechselnden Rechtsträgers ist, wenn sie binnen sechs Monaten nach dem Tag, an dem die Eintragung des Formwechsels nach § 201 UmwG als bekannt gemacht gilt, ihren Anspruch nach Grund und Höhe in Textform anmelden, Sicherheit zu leisten, soweit sie nicht Befriedigung verlangen können. Dieses Recht steht den Gläubigern jedoch nur zu, wenn sie glaubhaft machen, dass durch den Formwechsel die Erfüllung ihrer Forderung gefährdet wird.\"|\"formwechselnde Umwandlung\",\n\n\"der an der Ausgliederung beteiligten Rechtsträger ist, wenn sie binnen sechs Monaten nach dem Tag, an dem die Eintragung der Ausgliederung in das Register des Sitzes desjenigen Rechtsträgers, dessen Gläubiger sie sind, nach §§ 125, 19 Abs. 3 UmwG als bekannt gemacht gilt, ihren Anspruch nach Grund und Höhe in Textform anmelden, Sicherheit zu leisten, soweit sie nicht Befriedigung verlangen können. Dieses Recht steht den Gläubigern jedoch nur zu, wenn sie glaubhaft machen, dass durch die Ausgliederung die Erfüllung ihrer Forderung gefährdet wird.\"|\"Ausgliederung\")"
    },
    {
      "date": "2025-10-01",
      "id": "132137",
      "original_text": "Einreichung neuer Dokumente\nBayern Amtsgericht München HRB 101008\nUBS Real Estate GmbH – München",
      "type": "Einreichung neuer Dokumente",
      "state": "Bayern",
      "amtsgericht": "Amtsgericht München",
      "registernummer": "HRB 101008",
      "registerart": "HRB",
      "company_name": "UBS Real Estate GmbH",
      "company_seat": "München",
      "details": "01.10.2025 (Bekanntmachungsdatum)\n\nBayern Amtsgericht München HRB 101008\nEinreichung neuer Dokumente\n\nUBS Real Estate GmbH\nGesellschaft mit beschränkter Haftung\nMünchen\n\nDem Amtsgericht München -Registergericht- ist eine Liste der Mitglieder des Aufsichtsrats eingereicht worden, § 52 Abs. 3 S. 2 GmbHG."
    },
    {
      "date": "2025-10-01",
      "id": "132138",
      "original_text": "Registerbekanntmachung nach dem Umwandlungsgesetz\nBayern Amtsgericht Augsburg HRB 37553\nGERO Trade GmbH – Horgau",
      "type": "Registerbekanntmachung nach dem Umwandlungsgesetz",
      "state": "Bayern",
      "amtsgericht": "Amtsgericht Augsburg",
      "registernummer": "HRB 37553",
      "registerart": "HRB",
      "company_name": "GERO Trade GmbH",
      "company_seat": "Horgau",
      "details": "01.10.2025 (Bekanntmachungsdatum)\n\nBayern Amtsgericht Augsburg HRB 37553\nRegisterbekanntmachung nach dem Umwandlungsgesetz 30.09.2025 (Eintragungsdatum)\n\nGERO Trade GmbH\nGesellschaft mit beschränkter Haftung\nHorgau\n\nDen Gläubigern der an der Ausgliederung beteiligten Rechtsträger ist, wenn sie binnen sechs Monaten nach dem Tag, an dem die Eintragung der Ausgliederung in das Register des Sitzes desjenigen Rechtsträgers, dessen Gläubiger sie sind, nach §§ 125, 19 Abs. 3 UmwG als bekannt gemacht gilt, ihren Anspruch nach Grund und Höhe in Textform anmelden, Sicherheit zu leisten, soweit sie nicht Befriedigung verlangen können. Dieses Recht steht den Gläubigern jedoch nur zu, wenn sie glaubhaft machen, dass durch die Ausgliederung die Erfüllung ihrer Forderung gefährdet wird."
    },
    {
      "date": "2025-10-01",
      "id": "132139",
      "original_text": "Registerbekanntmachung nach dem Umwandlungsgesetz\nBayern Amtsgericht Augsburg HRB 40617\nMeisterbility GmbH – Meitingen",
      "type": "Registerbekanntmachung nach dem Umwandlungsgesetz",
      "state": "Bayern",
      "amtsgericht": "Amtsgericht Augsburg",
      "registernummer": "HRB 40617",
      "registerart": "HRB",
      "company_name": "Meisterbility GmbH",
      "company_seat": "Meitingen",
      "details": "01.10.2025 (Bekanntmachungsdatum)\n\nBayern Amtsgericht Augsburg HRB 40617\nRegisterbekanntmachung nach dem Umwandlungsgesetz 30.09.2025 (Eintragungsdatum)\n\nMeisterbility GmbH\nGesellschaft mit beschränkter Haftung\nMeitingen\n\nDen Gläubigern der an der Ausgliederung beteiligten Rechtsträger ist, wenn sie binnen sechs Monaten nach dem Tag, an dem die Eintragung der Ausgliederung in das Register des Sitzes desjenigen Rechtsträgers, dessen Gläubiger sie sind, nach §§ 125, 19 Abs. 3 UmwG als bekannt gemacht gilt, ihren Anspruch nach Grund und Höhe in Textform anmelden, Sicherheit zu leisten, soweit sie nicht Befriedigung verlangen können. Dieses Recht steht den Gläubigern jedoch nur zu, wenn sie glaubhaft machen, dass durch die Ausgliederung die Erfüllung ihrer Forderung gefährdet wird."
    },
    {
      "date": "2025-10-01",
      "id": "132140",
      "original_text": "Registerbekanntmachung nach dem Umwandlungsgesetz\nBayern Amtsgericht München HRB 232876\nDKI GmbH – Feldkirchen",
      "type": "Registerbekanntmachung nach dem Umwandlungsgesetz",
      "state": "Bayern",
      "amtsgericht": "Amtsgericht München",
      "registernummer": "HRB 232876",
      "registerart": "HRB",
      "company_name": "DKI GmbH",
      "company_seat": "Feldkirchen",
      "details": "01.10.2025 (Bekanntmachungsdatum)\n\nBayern Amtsgericht München HRB 232876\nRegisterbekanntmachung nach dem Umwandlungsgesetz 30.09.2025 (Eintragungsdatum)\n\nDKI GmbH\nGesellschaft mit beschränkter Haftung\nFeldkirchen\n\nDen Gläubigern der an der Verschmelzung beteiligten Rechtsträger ist, wenn sie binnen sechs Monaten nach dem Tag, an dem die Eintragung der Verschmelzung in das Register des Sitzes desjenigen Rechtsträgers, dessen Gläubiger sie sind, nach § 19 Abs. 3 UmwG als bekannt gemacht gilt, ihren Anspruch nach Grund und Höhe in Textform anmelden, Sicherheit zu leisten, soweit sie nicht Befriedigung verlangen können. Dieses Recht steht den Gläubigern jedoch nur zu, wenn sie glaubhaft machen, dass durch die Verschmelzung die Erfüllung ihrer Forderung gefährdet wird."
    },
    {
      "date": "2025-10-01",
      "id": "132141",
      "original_text": "Einreichung neuer Dokumente\nBayern Amtsgericht München HRB 211141\nMuP Verwaltungs- und Beteiligungs AG – Tegernsee",
      "type": "Einreichung neuer Dokumente",
      "state": "Bayern",
      "amtsgericht": "Amtsgericht München",
      "registernummer": "HRB 211141",
      "registerart": "HRB",
      "company_name": "MuP Verwaltungs- und Beteiligungs AG",
      "company_seat": "Tegernsee",
      "details": "01.10.2025 (Bekanntmachungsdatum)\n\nBayern Amtsgericht München HRB 211141\nEinreichung neuer Dokumente 30.09.2025 (Eintragungsdatum)\n\nMuP Verwaltungs- und Beteiligungs AG\nAktiengesellschaft\nTegernsee\n\nDem Amtsgericht München -Registergericht- ist eine Liste der Mitglieder des Aufsichtsrats eingereicht worden, § 106 AktG."
    },
    {
      "date": "2025-10-01",
      "id": "132142",
      "original_text": "Registerbekanntmachung nach dem Umwandlungsgesetz\nBayern Amtsgericht Memmingen HRB 1537\nAL-KO Geräte GmbH – Kötz",
      "type": "Registerbekanntmachung nach dem Umwandlungsgesetz",
      "state": "Bayern",
      "amtsgericht": "Amtsgericht Memmingen",
      "registernummer": "HRB 1537",
      "registerart": "HRB",
      "company_name": "AL-KO Geräte GmbH",
      "company_seat": "Kötz",
      "details": "01.10.2025 (Bekanntmachungsdatum)\n\nBayern Amtsgericht Memmingen HRB 1537\nRegisterbekanntmachung nach dem Umwandlungsgesetz 30.09.2025 (Eintragungsdatum)\n\nAL-KO Geräte GmbH\nGesellschaft mit beschränkter Haftung\nKötz\n\nDen Gläubigern #dv.auswahl(Text=\"Bitte zutreffendes auswählen:\",Eingabe=\n\n\"der an der Verschmelzung beteiligten Rechtsträger ist, wenn sie binnen sechs Monaten nach dem Tag, an dem die Eintragung der Verschmelzung in das Register des Sitzes desjenigen Rechtsträgers, dessen Gläubiger sie sind, nach § 19 Abs. 3 UmwG als bekannt gemacht gilt, ihren Anspruch nach Grund und Höhe in Textform anmelden, Sicherheit zu leisten, soweit sie nicht Befriedigung verlangen können. Dieses Recht steht den Gläubigern jedoch nur zu, wenn sie glaubhaft machen, dass durch die Verschmelzung die Erfüllung ihrer Forderung gefährdet wird.\"|\"Verschmelzung\",\n\n\"der an der Spaltung beteiligten Rechtsträger ist, wenn sie binnen sechs Monaten nach dem Tag, an dem die Eintragung der Spaltung in das Register des Sitzes desjenigen Rechtsträgers, dessen Gläubiger sie sind, nach §§ 125, 19 Abs. 3 UmwG als bekannt gemacht gilt, ihren Anspruch nach Grund und Höhe in Textform anmelden, Sicherheit zu leisten, soweit sie nicht Befriedigung verlangen können. Dieses Recht steht den Gläubigern jedoch nur zu, wenn sie glaubhaft machen, dass durch die Spaltung die Erfüllung ihrer Forderung gefährdet wird.\"|\"Spaltung\",\n\n\"des formwechselnden Rechtsträgers ist, wenn sie binnen sechs Monaten nach dem Tag, an dem die Eintragung des Formwechsels nach § 201 UmwG als bekannt gemacht gilt, ihren Anspruch nach Grund und Höhe in Textform anmelden, Sicherheit zu leisten, soweit sie nicht Befriedigung verlangen können. Dieses Recht steht den Gläubigern jedoch nur zu, wenn sie glaubhaft machen, dass durch den Formwechsel die Erfüllung ihrer Forderung gefährdet wird.\"|\"formwechselnde Umwandlung\",\n\n\"der an der Ausgliederung beteiligten Rechtsträger ist, wenn sie binnen sechs Monaten nach dem Tag, an dem die Eintragung der Ausgliederung in das Register des Sitzes desjenigen Rechtsträgers, dessen Gläubiger sie sind, nach §§ 125, 19 Abs. 3 UmwG als bekannt gemacht gilt, ihren Anspruch nach Grund und Höhe in Textform anmelden, Sicherheit zu leisten, soweit sie nicht Befriedigung verlangen können. Dieses Recht steht den Gläubigern jedoch nur zu, wenn sie glaubhaft machen, dass durch die Ausgliederung die Erfüllung ihrer Forderung gefährdet wird.\"|\"Ausgliederung\")"
    },
    {
      "date": "2025-10-01",
      "id": "132143",
      "original_text": "Registerbekanntmachung nach dem Umwandlungsgesetz\nBayern Amtsgericht Augsburg HRA 22008\nHorst Bottesch Import & Export e.K. – Horgau",
      "type": "Registerbekanntmachung nach dem Umwandlungsgesetz",
      "state": "Bayern",
      "amtsgericht": "Amtsgericht Augsburg",
      "registernummer": "HRA 22008",
      "registerart": "HRA",
      "company_name": "Horst Bottesch Import & Export e.K.",
      "company_seat": "Horgau",
      "details": "01.10.2025 (Bekanntmachungsdatum)\n\nBayern Amtsgericht Augsburg HRA 22008\nRegisterbekanntmachung nach dem Umwandlungsgesetz 30.09.2025 (Eintragungsdatum)\n\nHorst Bottesch Import & Export e.K.\nEinzelkaufmann / Einzelkauffrau\nHorgau\n\nDen Gläubigern der an der Ausgliederung beteiligten Rechtsträger ist, wenn sie binnen sechs Monaten nach dem Tag, an dem die Eintragung der Ausgliederung in das Register des Sitzes desjenigen Rechtsträgers, dessen Gläubiger sie sind, nach §§ 125, 19 Abs. 3 UmwG als bekannt gemacht gilt, ihren Anspruch nach Grund und Höhe in Textform anmelden, Sicherheit zu leisten, soweit sie nicht Befriedigung verlangen können. Dieses Recht steht den Gläubigern jedoch nur zu, wenn sie glaubhaft machen, dass durch die Ausgliederung die Erfüllung ihrer Forderung gefährdet wird."
    },
    {
      "date": "2025-10-01",
      "id": "132144",
      "original_text": "Registerbekanntmachung nach dem Umwandlungsgesetz\nBayern Amtsgericht Straubing HRB 13740\nAuto Raab Service GmbH – Geiselhöring",
      "type": "Registerbekanntmachung nach dem Umwandlungsgesetz",
      "state": "Bayern",
      "amtsgericht": "Amtsgericht Straubing",
      "registernummer": "HRB 13740",
      "registerart": "HRB",
      "company_name": "Auto Raab Service GmbH",
      "company_seat": "Geiselhöring",
      "details": "01.10.2025 (Bekanntmachungsdatum)\n\nBayern Amtsgericht Straubing HRB 13740\nRegisterbekanntmachung nach dem Umwandlungsgesetz 30.09.2025 (Eintragungsdatum)\n\nAuto Raab Service GmbH\nGesellschaft mit beschränkter Haftung\nGeiselhöring\n\nDen Gläubigern der an der Ausgliederung beteiligten Rechtsträger ist, wenn sie binnen sechs Monaten nach dem Tag, an dem die Eintragung der Ausgliederung in das Register des Sitzes desjenigen Rechtsträgers, dessen Gläubiger sie sind, nach §§ 125, 19 Abs. 3 UmwG als bekannt gemacht gilt, ihren Anspruch nach Grund und Höhe in Textform anmelden, Sicherheit zu leisten, soweit sie nicht Befriedigung verlangen können. Dieses Recht steht den Gläubigern jedoch nur zu, wenn sie glaubhaft machen, dass durch die Ausgliederung die Erfüllung ihrer Forderung gefährdet wird."
    },
    {
      "date": "2025-10-01",
      "id": "132145",
      "original_text": "Löschungsankündigung\nBayern Amtsgericht Bamberg HRB 7474\nDereser Logistik GmbH – Rauhenebrach",
      "type": "Löschungsankündigung",
      "state": "Bayern",
      "amtsgericht": "Amtsgericht Bamberg",
      "registernummer": "HRB 7474",
      "registerart": "HRB",
      "company_name": "Dereser Logistik GmbH",
      "company_seat": "Rauhenebrach",
      "details": "01.10.2025 (Bekanntmachungsdatum)\n\nBayern Amtsgericht Bamberg HRB 7474\nLöschungsankündigung\n\nDereser Logistik GmbH\nGesellschaft mit beschränkter Haftung\nRauhenebrach\n\nDas Registergericht beabsichtigt, die im Handelsregister eingetragene Gesellschaft wegen Vermögenslosigkeit von Amts wegen nach § 394 FamFG zu löschen. Die Frist zur Erhebung eines Widerspruchs ist auf einen Monat festgesetzt."
    },
    {
      "date": "2025-10-01",
      "id": "132146",
      "original_text": "Registerbekanntmachung nach dem Umwandlungsgesetz\nBayern Amtsgericht Straubing HRA 7291\nRaab Julian Kfz-Reparatur e.K. – Geiselhöring",
      "type": "Registerbekanntmachung nach dem Umwandlungsgesetz",
      "state": "Bayern",
      "amtsgericht": "Amtsgericht Straubing",
      "registernummer": "HRA 7291",
      "registerart": "HRA",
      "company_name": "Raab Julian Kfz-Reparatur e.K.",
      "company_seat": "Geiselhöring",
      "details": "01.10.2025 (Bekanntmachungsdatum)\n\nBayern Amtsgericht Straubing HRA 7291\nRegisterbekanntmachung nach dem Umwandlungsgesetz 30.09.2025 (Eintragungsdatum)\n\nRaab Julian Kfz-Reparatur e.K.\nEinzelkaufmann / Einzelkauffrau\nGeiselhöring\n\nDen Gläubigern der an der Ausgliederung beteiligten Rechtsträger ist, wenn sie binnen sechs Monaten nach dem Tag, an dem die Eintragung der Ausgliederung in das Register des Sitzes desjenigen Rechtsträgers, dessen Gläubiger sie sind, nach §§ 125, 19 Abs. 3 UmwG als bekannt gemacht gilt, ihren Anspruch nach Grund und Höhe in Textform anmelden, Sicherheit zu leisten, soweit sie nicht Befriedigung verlangen können. Dieses Recht steht den Gläubigern jedoch nur zu, wenn sie glaubhaft machen, dass durch die Ausgliederung die Erfüllung ihrer Forderung gefährdet wird."
    },
    {
      "date": "2025-10-01",
      "id": "132147",
      "original_text": "Registerbekanntmachung nach dem Umwandlungsgesetz\nBayern Amtsgericht Bamberg HRB 6863\nElektro Horz GmbH – Egloffstein",
      "type": "Registerbekanntmachung nach dem Umwandlungsgesetz",
      "state": "Bayern",
      "amtsgericht": "Amtsgericht Bamberg",
      "registernummer": "HRB 6863",
      "registerart": "HRB",
      "company_name": "Elektro Horz GmbH",
      "company_seat": "Egloffstein",
      "details": "01.10.2025 (Bekanntmachungsdatum)\n\nBayern Amtsgericht Bamberg HRB 6863\nRegisterbekanntmachung nach dem Umwandlungsgesetz 30.09.2025 (Eintragungsdatum)\n\nElektro Horz GmbH\nGesellschaft mit beschränkter Haftung\nEgloffstein\n\nDen Gläubigern der an der Verschmelzung beteiligten Rechtsträger ist, wenn sie binnen sechs Monaten nach dem Tag, an dem die Eintragung der Verschmelzung in das Register des Sitzes desjenigen Rechtsträgers, dessen Gläubiger sie sind, nach § 19 Abs. 3 UmwG als bekannt gemacht gilt, ihren Anspruch nach Grund und Höhe in Textform anmelden, Sicherheit zu leisten, soweit sie nicht Befriedigung verlangen können. Dieses Recht steht den Gläubigern jedoch nur zu, wenn sie glaubhaft machen, dass durch die Verschmelzung die Erfüllung ihrer Forderung gefährdet wird."
    },
    {
      "date": "2025-10-01",
      "id": "132148",
      "original_text": "Registerbekanntmachung nach dem Umwandlungsgesetz\nBayern Amtsgericht Memmingen HRB 17062\nAL-KO G+H Beteiligungs GmbH – Kötz",
      "type": "Registerbekanntmachung nach dem Umwandlungsgesetz",
      "state": "Bayern",
      "amtsgericht": "Amtsgericht Memmingen",
      "registernummer": "HRB 17062",
      "registerart": "HRB",
      "company_name": "AL-KO G+H Beteiligungs GmbH",
      "company_seat": "Kötz",
      "details": "01.10.2025 (Bekanntmachungsdatum)\n\nBayern Amtsgericht Memmingen HRB 17062\nRegisterbekanntmachung nach dem Umwandlungsgesetz 30.09.2025 (Eintragungsdatum)\n\nAL-KO G+H Beteiligungs GmbH\nGesellschaft mit beschränkter Haftung\nKötz\n\nDen Gläubigern #dv.auswahl(Text=\"Bitte zutreffendes auswählen:\",Eingabe=\n\n\"der an der Verschmelzung beteiligten Rechtsträger ist, wenn sie binnen sechs Monaten nach dem Tag, an dem die Eintragung der Verschmelzung in das Register des Sitzes desjenigen Rechtsträgers, dessen Gläubiger sie sind, nach § 19 Abs. 3 UmwG als bekannt gemacht gilt, ihren Anspruch nach Grund und Höhe in Textform anmelden, Sicherheit zu leisten, soweit sie nicht Befriedigung verlangen können. Dieses Recht steht den Gläubigern jedoch nur zu, wenn sie glaubhaft machen, dass durch die Verschmelzung die Erfüllung ihrer Forderung gefährdet wird.\"|\"Verschmelzung\",\n\n\"der an der Spaltung beteiligten Rechtsträger ist, wenn sie binnen sechs Monaten nach dem Tag, an dem die Eintragung der Spaltung in das Register des Sitzes desjenigen Rechtsträgers, dessen Gläubiger sie sind, nach §§ 125, 19 Abs. 3 UmwG als bekannt gemacht gilt, ihren Anspruch nach Grund und Höhe in Textform anmelden, Sicherheit zu leisten, soweit sie nicht Befriedigung verlangen können. Dieses Recht steht den Gläubigern jedoch nur zu, wenn sie glaubhaft machen, dass durch die Spaltung die Erfüllung ihrer Forderung gefährdet wird.\"|\"Spaltung\",\n\n\"des formwechselnden Rechtsträgers ist, wenn sie binnen sechs Monaten nach dem Tag, an dem die Eintragung des Formwechsels nach § 201 UmwG als bekannt gemacht gilt, ihren Anspruch nach Grund und Höhe in Textform anmelden, Sicherheit zu leisten, soweit sie nicht Befriedigung verlangen können. Dieses Recht steht den Gläubigern jedoch nur zu, wenn sie glaubhaft machen, dass durch den Formwechsel die Erfüllung ihrer Forderung gefährdet wird.\"|\"formwechselnde Umwandlung\",\n\n\"der an der Ausgliederung beteiligten Rechtsträger ist, wenn sie binnen sechs Monaten nach dem Tag, an dem die Eintragung der Ausgliederung in das Register des Sitzes desjenigen Rechtsträgers, dessen Gläubiger sie sind, nach §§ 125, 19 Abs. 3 UmwG als bekannt gemacht gilt, ihren Anspruch nach Grund und Höhe in Textform anmelden, Sicherheit zu leisten, soweit sie nicht Befriedigung verlangen können. Dieses Recht steht den Gläubigern jedoch nur zu, wenn sie glaubhaft machen, dass durch die Ausgliederung die Erfüllung ihrer Forderung gefährdet wird.\"|\"Ausgliederung\")"
    },
    {
      "date": "2025-10-01",
      "id": "132149",
      "original_text": "Registerbekanntmachung nach dem Umwandlungsgesetz\nBayern Amtsgericht Augsburg HRA 21798\nRalf Suiter Sound & Performance e.K. – Meitingen",
      "type": "Registerbekanntmachung nach dem Umwandlungsgesetz",
      "state": "Bayern",
      "amtsgericht": "Amtsgericht Augsburg",
      "registernummer": "HRA 21798",
      "registerart": "HRA",
      "company_name": "Ralf Suiter Sound & Performance e.K.",
      "company_seat": "Meitingen",
      "details": "01.10.2025 (Bekanntmachungsdatum)\n\nBayern Amtsgericht Augsburg HRA 21798\nRegisterbekanntmachung nach dem Umwandlungsgesetz 30.09.2025 (Eintragungsdatum)\n\nRalf Suiter Sound & Performance e.K.\nEinzelkaufmann / Einzelkauffrau\nMeitingen\n\nDen Gläubigern der an der Ausgliederung beteiligten Rechtsträger ist, wenn sie binnen sechs Monaten nach dem Tag, an dem die Eintragung der Ausgliederung in das Register des Sitzes desjenigen Rechtsträgers, dessen Gläubiger sie sind, nach §§ 125, 19 Abs. 3 UmwG als bekannt gemacht gilt, ihren Anspruch nach Grund und Höhe in Textform anmelden, Sicherheit zu leisten, soweit sie nicht Befriedigung verlangen können. Dieses Recht steht den Gläubigern jedoch nur zu, wenn sie glaubhaft machen, dass durch die Ausgliederung die Erfüllung ihrer Forderung gefährdet wird."
    },
    {
      "date": "2025-10-01",
      "id": "132150",
      "original_text": "Registerbekanntmachung nach dem Umwandlungsgesetz\nBayern Amtsgericht München HRB 292893\nTorque III GmbH – München",
      "type": "Registerbekanntmachung nach dem Umwandlungsgesetz",
      "state": "Bayern",
      "amtsgericht": "Amtsgericht München",
      "registernummer": "HRB 292893",
      "registerart": "HRB",
      "company_name": "Torque III GmbH",
      "company_seat": "München",
      "details": "01.10.2025 (Bekanntmachungsdatum)\n\nBayern Amtsgericht München HRB 292893\nRegisterbekanntmachung nach dem Umwandlungsgesetz 30.09.2025 (Eintragungsdatum)\n\nTorque III GmbH\nGesellschaft mit beschränkter Haftung\nMünchen\n\nDen Gläubigern der an der Verschmelzung beteiligten Rechtsträger ist, wenn sie binnen sechs Monaten nach dem Tag, an dem die Eintragung der Verschmelzung in das Register des Sitzes desjenigen Rechtsträgers, dessen Gläubiger sie sind, nach § 19 Abs. 3 UmwG als bekannt gemacht gilt, ihren Anspruch nach Grund und Höhe in Textform anmelden, Sicherheit zu leisten, soweit sie nicht Befriedigung verlangen können. Dieses Recht steht den Gläubigern jedoch nur zu, wenn sie glaubhaft machen, dass durch die Verschmelzung die Erfüllung ihrer Forderung gefährdet wird."
    },
    {
      "date": "2025-10-01",
      "id": "132151",
      "original_text": "Registerbekanntmachung nach dem Umwandlungsgesetz\nBayern Amtsgericht Coburg HRB 6422\nFHH Familie Heinz Holding GmbH – Tettau",
      "type": "Registerbekanntmachung nach dem Umwandlungsgesetz",
      "state": "Bayern",
      "amtsgericht": "Amtsgericht Coburg",
      "registernummer": "HRB 6422",
      "registerart": "HRB",
      "company_name": "FHH Familie Heinz Holding GmbH",
      "company_seat": "Tettau",
      "details": "01.10.2025 (Bekanntmachungsdatum)\n\nBayern Amtsgericht Coburg HRB 6422\nRegisterbekanntmachung nach dem Umwandlungsgesetz 22.09.2025 (Eintragungsdatum)\n\nFHH Familie Heinz Holding GmbH\nGesellschaft mit beschränkter Haftung\nTettau\n\nDen Gläubigern der an der Verschmelzung beteiligten Rechtsträger ist, wenn sie binnen sechs Monaten nach dem Tag, an dem die Eintragung der Verschmelzung in das Register des Sitzes desjenigen Rechtsträgers, dessen Gläubiger sie sind, nach § 19 Abs. 3 UmwG als bekannt gemacht gilt, ihren Anspruch nach Grund und Höhe in Textform anmelden, Sicherheit zu leisten, soweit sie nicht Befriedigung verlangen können. Dieses Recht steht den Gläubigern jedoch nur zu, wenn sie glaubhaft machen, dass durch die Verschmelzung die Erfüllung ihrer Forderung gefährdet wird."
    },
    {
      "date": "2025-10-01",
      "id": "132152",
      "original_text": "Registerbekanntmachung nach dem Umwandlungsgesetz\nBayern Amtsgericht München HRB 304938\nTHE BRAND CONTENT GmbH – München",
      "type": "Registerbekanntmachung nach dem Umwandlungsgesetz",
      "state": "Bayern",
      "amtsgericht": "Amtsgericht München",
      "registernummer": "HRB 304938",
      "registerart": "HRB",
      "company_name": "THE BRAND CONTENT GmbH",
      "company_seat": "München",
      "details": "01.10.2025 (Bekanntmachungsdatum)\n\nBayern Amtsgericht München HRB 304938\nRegisterbekanntmachung nach dem Umwandlungsgesetz 30.09.2025 (Eintragungsdatum)\n\nTHE BRAND CONTENT GmbH\nGesellschaft mit beschränkter Haftung\nMünchen\n\nDen Gläubigern der an der Ausgliederung beteiligten Rechtsträger ist, wenn sie binnen sechs Monaten nach dem Tag, an dem die Eintragung der Ausgliederung in das Register des Sitzes desjenigen Rechtsträgers, dessen Gläubiger sie sind, nach §§ 125, 19 Abs. 3 UmwG als bekannt gemacht gilt, ihren Anspruch nach Grund und Höhe in Textform anmelden, Sicherheit zu leisten, soweit sie nicht Befriedigung verlangen können. Dieses Recht steht den Gläubigern jedoch nur zu, wenn sie glaubhaft machen, dass durch die Ausgliederung die Erfüllung ihrer Forderung gefährdet wird."
    },
    {
      "date": "2025-10-01",
      "id": "132153",
      "original_text": "Löschungsankündigung\nBayern Amtsgericht München HRA 62288\nPKL PRODUKTIONS-KAPAZITÄTEN-LEASING VERMIETUNGS- GESELLSCHAFT für mobile Investitionsgüter mit beschränkter Haftung & Co. BETRIEBS-Kommanditgesellschaft – München",
      "type": "Löschungsankündigung",
      "state": "Bayern",
      "amtsgericht": "Amtsgericht München",
      "registernummer": "HRA 62288",
      "registerart": "HRA",
      "company_name": "PKL PRODUKTIONS-KAPAZITÄTEN-LEASING VERMIETUNGS- GESELLSCHAFT für mobile Investitionsgüter mit beschränkter Haftung & Co. BETRIEBS-Kommanditgesellschaft",
      "company_seat": "München",
      "details": "01.10.2025 (Bekanntmachungsdatum)\n\nBayern Amtsgericht München HRA 62288\nLöschungsankündigung\n\nPKL PRODUKTIONS-KAPAZITÄTEN-LEASING VERMIETUNGS- GESELLSCHAFT für mobile Investitionsgüter mit beschränkter Haftung & Co. BETRIEBS-Kommanditgesellschaft\nKommanditgesellschaft\nMünchen\n\nDas Registergericht beabsichtigt, die im Handelsregister eingetragene Firma wegen Vermögenslosigkeit von Amts wegen nach § 394 FamFG zu löschen. Die Frist zur Erhebung eines Widerspruchs ist auf einen Monat festgesetzt."
    },
    {
      "date": "2025-10-01",
      "id": "132154",
      "original_text": "Registerbekanntmachung nach dem Umwandlungsgesetz\nHamburg Amtsgericht Hamburg HRB 79685\nPATRIZIA Real Assets Kapitalverwaltungsgesellschaft mbH – Hamburg",
      "type": "Registerbekanntmachung nach dem Umwandlungsgesetz",
      "state": "Hamburg",
      "amtsgericht": "Amtsgericht Hamburg",
      "registernummer": "HRB 79685",
      "registerart": "HRB",
      "company_name": "PATRIZIA Real Assets Kapitalverwaltungsgesellschaft mbH",
      "company_seat": "Hamburg",
      "details": "01.10.2025 (Bekanntmachungsdatum)\n\nHamburg Amtsgericht Hamburg HRB 79685\nRegisterbekanntmachung nach dem Umwandlungsgesetz 01.10.2025 (Eintragungsdatum)\n\nPATRIZIA Real Assets Kapitalverwaltungsgesellschaft mbH\nGesellschaft mit beschränkter Haftung\nHamburg\n\nAls nicht eingetragen wird bekannt gemacht:\nDen Gläubigern der an der Verschmelzung beteiligten Gesellschaften ist, wenn sie binnen sechs Monaten nach dem Tag, an dem die Eintragung der Verschmelzung in das Register des Sitzes desjenigen Rechtsträgers, dessen Gläubiger sie sind, nach § 19 Absatz 3 UmwG als bekannt gemacht gilt, ihren Anspruch nach Grund und Höhe schriftlich anmelden, Sicherheit zu leisten, soweit sie nicht Befriedigung verlangen können. Dieses Recht steht den Gläubigern jedoch nur zu, wenn sie glaubhaft machen, dass durch die Verschmelzung die Erfüllung ihrer Forderung gefährdet wird."
    },
    {
      "date": "2025-10-01",
      "id": "132155",
      "original_text": "Registerbekanntmachung nach dem Umwandlungsgesetz\nBerlin Amtsgericht Berlin (Charlottenburg) HRB 190216\nTAT Templiner Auto Transporte GmbH – Berlin",
      "type": "Registerbekanntmachung nach dem Umwandlungsgesetz",
      "state": "Berlin",
      "amtsgericht": "Amtsgericht Berlin (Charlottenburg)",
      "registernummer": "HRB 190216",
      "registerart": "HRB",
      "company_name": "TAT Templiner Auto Transporte GmbH",
      "company_seat": "Berlin",
      "details": "01.10.2025 (Bekanntmachungsdatum)\n\nBerlin Amtsgericht Berlin (Charlottenburg) HRB 190216\nRegisterbekanntmachung nach dem Umwandlungsgesetz 26.09.2025 (Eintragungsdatum)\n\nTAT Templiner Auto Transporte GmbH\nGesellschaft mit beschränkter Haftung\nBerlin\n\nZu Eintragungsnummer 9 vom 26.09.2025 wird als nicht eingetragen veröffentlicht:Den Gläubigern der an der Verschmelzung beteiligten Rechtsträger ist, wenn sie binnen sechs Monaten nach dem Tag, an dem die Eintragung der Verschmelzung in das Register des Sitzes desjenigen Rechtsträgers, dessen Gläubiger sie sind, als bekannt gemacht gilt, ihren Anspruch nach Grund und Höhe schriftlich anmelden, Sicherheit zu leisten, soweit sie nicht Befriedigung verlangen können. Dieses Recht steht den Gläubigern jedoch nur zu, wenn sie glaubhaft machen, dass durch die Verschmelzung die Erfüllung ihrer Forderung gefährdet wird. Das Recht, Sicherheitsleistung zu verlangen, steht Gläubigern nicht zu, die im Falle der Insolvenz ein Recht auf vorzugsweise Befriedigung aus einer Deckungsmasse haben, die nach gesetzlicher Vorschrift zu ihrem Schutz errichtet und staatlich überwacht ist."
    },
    {
      "date": "2025-10-01",
      "id": "132156",
      "original_text": "Registerbekanntmachung nach dem Umwandlungsgesetz\nBerlin Amtsgericht Berlin (Charlottenburg) HRB 276447\nIMPERIAL Base GmbH – Berlin",
      "type": "Registerbekanntmachung nach dem Umwandlungsgesetz",
      "state": "Berlin",
      "amtsgericht": "Amtsgericht Berlin (Charlottenburg)",
      "registernummer": "HRB 276447",
      "registerart": "HRB",
      "company_name": "IMPERIAL Base GmbH",
      "company_seat": "Berlin",
      "details": "01.10.2025 (Bekanntmachungsdatum)\n\nBerlin Amtsgericht Berlin (Charlottenburg) HRB 276447\nRegisterbekanntmachung nach dem Umwandlungsgesetz 30.09.2025 (Eintragungsdatum)\n\nIMPERIAL Base GmbH\nGesellschaft mit beschränkter Haftung\nBerlin\n\nZu Eintragungsnummer 2 vom 30.09.2025 wird als nicht eingetragen veröffentlicht: Den Gläubigern der an der Spaltung beteiligten Rechtsträger ist, wenn sie binnen sechs Monaten nach dem Tag, an dem die Eintragung der Spaltung in das Register des Sitzes desjenigen Rechtsträgers, dessen Gläubiger sie sind, als bekannt gemacht gilt, ihren Anspruch nach Grund und Höhe schriftlich anmelden, Sicherheit zu leisten, soweit sie nicht Befriedigung verlangen können. Dieses Recht steht den Gläubigern jedoch nur zu, wenn sie glaubhaft machen, dass durch die Spaltung die Erfüllung ihrer Forderung gefährdet wird. Das Recht, Sicherheitsleistung zu verlangen, steht Gläubigern nicht zu, die im Falle der Insolvenz ein Recht auf vorzugsweise Befriedigung aus einer Deckungsmasse haben, die nach gesetzlicher Vorschrift zu ihrem Schutz errichtet und staatlich überwacht ist."
    },
    {
      "date": "2025-10-01",
      "id": "132157",
      "original_text": "Registerbekanntmachung nach dem Umwandlungsgesetz\nBerlin Amtsgericht Berlin (Charlottenburg) HRB 276447\nIMPERIAL Base GmbH – Berlin",
      "type": "Registerbekanntmachung nach dem Umwandlungsgesetz",
      "state": "Berlin",
      "amtsgericht": "Amtsgericht Berlin (Charlottenburg)",
      "registernummer": "HRB 276447",
      "registerart": "HRB",
      "company_name": "IMPERIAL Base GmbH",
      "company_seat": "Berlin",
      "details": "01.10.2025 (Bekanntmachungsdatum)\n\nBerlin Amtsgericht Berlin (Charlottenburg) HRB 276447\nRegisterbekanntmachung nach dem Umwandlungsgesetz 30.09.2025 (Eintragungsdatum)\n\nIMPERIAL Base GmbH\nGesellschaft mit beschränkter Haftung\nBerlin\n\nZu Eintragungsnummer 3 vom 30.09.2025 wird als nicht eingetragen veröffentlicht: Den Gläubigern der an der Spaltung beteiligten Rechtsträger ist, wenn sie binnen sechs Monaten nach dem Tag, an dem die Eintragung der Spaltung in das Register des Sitzes desjenigen Rechtsträgers, dessen Gläubiger sie sind, als bekannt gemacht gilt, ihren Anspruch nach Grund und Höhe schriftlich anmelden, Sicherheit zu leisten, soweit sie nicht Befriedigung verlangen können. Dieses Recht steht den Gläubigern jedoch nur zu, wenn sie glaubhaft machen, dass durch die Spaltung die Erfüllung ihrer Forderung gefährdet wird. Das Recht, Sicherheitsleistung zu verlangen, steht Gläubigern nicht zu, die im Falle der Insolvenz ein Recht auf vorzugsweise Befriedigung aus einer Deckungsmasse haben, die nach gesetzlicher Vorschrift zu ihrem Schutz errichtet und staatlich überwacht ist."
    },
    {
      "date": "2025-10-01",
      "id": "132158",
      "original_text": "Löschungsankündigung\nBrandenburg Amtsgericht Potsdam HRB 16046\nStuntcrew Babelsberg GmbH – Potsdam",
      "type": "Löschungsankündigung",
      "state": "Brandenburg",
      "amtsgericht": "Amtsgericht Potsdam",
      "registernummer": "HRB 16046",
      "registerart": "HRB",
      "company_name": "Stuntcrew Babelsberg GmbH",
      "company_seat": "Potsdam",
      "details": "01.10.2025 (Bekanntmachungsdatum)\n\nBrandenburg Amtsgericht Potsdam HRB 16046\nLöschungsankündigung\n\nStuntcrew Babelsberg GmbH\nGesellschaft mit beschränkter Haftung\nPotsdam\n\nBei der nachstehenden Gesellschaft wird das Amtslöschungsverfahren gemäß § 394 FamFG eingeleitet. Widerspruchsfrist: 8 Wochen."
    },
    {
      "date": "2025-10-01",
      "id": "132159",
      "original_text": "Registerbekanntmachung nach dem Umwandlungsgesetz\nBerlin Amtsgericht Berlin (Charlottenburg) HRB 112926\nKaminski + Brendel Hauptstadtmaler GmbH – Berlin",
      "type": "Registerbekanntmachung nach dem Umwandlungsgesetz",
      "state": "Berlin",
      "amtsgericht": "Amtsgericht Berlin (Charlottenburg)",
      "registernummer": "HRB 112926",
      "registerart": "HRB",
      "company_name": "Kaminski + Brendel Hauptstadtmaler GmbH",
      "company_seat": "Berlin",
      "details": "01.10.2025 (Bekanntmachungsdatum)\n\nBerlin Amtsgericht Berlin (Charlottenburg) HRB 112926\nRegisterbekanntmachung nach dem Umwandlungsgesetz 30.09.2025 (Eintragungsdatum)\n\nKaminski + Brendel Hauptstadtmaler GmbH\nGesellschaft mit beschränkter Haftung\nBerlin\n\nZu Eintragungsnummer 38 vom 30.09.2025 wird als nicht eingetragen veröffentlicht:\n\nDen Gläubigern der an der Spaltung beteiligten Rechtsträger ist, wenn sie binnen sechs Monaten nach dem Tag, an dem die Eintragung der Spaltung in das Register des Sitzes desjenigen Rechtsträgers, dessen Gläubiger sie sind, als bekannt gemacht gilt, ihren Anspruch nach Grund und Höhe schriftlich anmelden, Sicherheit zu leisten, soweit sie nicht Befriedigung verlangen können. Dieses Recht steht den Gläubigern jedoch nur zu, wenn sie glaubhaft machen, dass durch die Spaltung die Erfüllung ihrer Forderung gefährdet wird. Das Recht, Sicherheitsleistung zu verlangen, steht Gläubigern nicht zu, die im Falle der Insolvenz ein Recht auf vorzugsweise Befriedigung aus einer Deckungsmasse haben, die nach gesetzlicher Vorschrift zu ihrem Schutz errichtet und staatlich überwacht ist."
    },
    {
      "date": "2025-10-01",
      "id": "132160",
      "original_text": "Registerbekanntmachung nach dem Umwandlungsgesetz\nBaden-Württemberg Amtsgericht Mannheim HRB 422172\nMiethaus DEK Verwaltungs-GmbH – Schwetzingen",
      "type": "Registerbekanntmachung nach dem Umwandlungsgesetz",
      "state": "Baden-Württemberg",
      "amtsgericht": "Amtsgericht Mannheim",
      "registernummer": "HRB 422172",
      "registerart": "HRB",
      "company_name": "Miethaus DEK Verwaltungs-GmbH",
      "company_seat": "Schwetzingen",
      "details": "01.10.2025 (Bekanntmachungsdatum)\n\nBaden-Württemberg Amtsgericht Mannheim HRB 422172\nRegisterbekanntmachung nach dem Umwandlungsgesetz 01.10.2025 (Eintragungsdatum)\n\nMiethaus DEK Verwaltungs-GmbH\nGesellschaft mit beschränkter Haftung\nSchwetzingen\n\nAls nicht eingetragen wird bekanntgemacht:\nDen Gläubigern der an der Verschmelzung beteiligten Rechtsträger ist, wenn sie binnen sechs Monaten nach dem Tag, an dem die Eintragung der Verschmelzung in das Register des Sitzes desjenigen Rechtsträgers, dessen Gläubiger sie sind, nach § 19 Abs. 3 UmwG als bekanntgemacht gilt, ihren Anspruch nach Grund und Höhe schriftlich anmelden, Sicherheit zu leisten, soweit sie nicht Befriedigung verlangen können. Dieses Recht steht den Gläubigern jedoch nur zu, wenn sie glaubhaft machen, dass durch die Verschmelzung die Erfüllung ihrer Forderung gefährdet wird."
    },
    {
      "date": "2025-10-01",
      "id": "132161",
      "original_text": "Registerbekanntmachung nach dem Umwandlungsgesetz\nBaden-Württemberg Amtsgericht Mannheim GnR 330031\nVolksbank Heidelberg-Neckartal eG – Heidelberg",
      "type": "Registerbekanntmachung nach dem Umwandlungsgesetz",
      "state": "Baden-Württemberg",
      "amtsgericht": "Amtsgericht Mannheim",
      "registernummer": "GnR 330031",
      "registerart": "GnR",
      "company_name": "Volksbank Heidelberg-Neckartal eG",
      "company_seat": "Heidelberg",
      "details": "01.10.2025 (Bekanntmachungsdatum)\n\nBaden-Württemberg Amtsgericht Mannheim GnR 330031\nRegisterbekanntmachung nach dem Umwandlungsgesetz 01.10.2025 (Eintragungsdatum)\n\nVolksbank Heidelberg-Neckartal eG\neingetragene Genossenschaft\nHeidelberg\n\nAls nicht eingetragen wird bekanntgemacht:\nDen Gläubigern der an der Verschmelzung beteiligten Rechtsträger ist, wenn sie binnen sechs Monaten nach dem Tag, an dem die Eintragung der Verschmelzung in das Register des Sitzes desjenigen Rechtsträgers, dessen Gläubiger sie sind, nach § 19 Abs. 3 UmwG als bekanntgemacht gilt, ihren Anspruch nach Grund und Höhe schriftlich anmelden, Sicherheit zu leisten, soweit sie nicht Befriedigung verlangen können. Dieses Recht steht den Gläubigern jedoch nur zu, wenn sie glaubhaft machen, dass durch die Verschmelzung die Erfüllung ihrer Forderung gefährdet wird."
    },
    {
      "date": "2025-10-01",
      "id": "132162",
      "original_text": "Registerbekanntmachung nach dem Umwandlungsgesetz\nBerlin Amtsgericht Berlin (Charlottenburg) HRB 250772\nS + T Ristorante und Gastronomie GmbH – Berlin",
      "type": "Registerbekanntmachung nach dem Umwandlungsgesetz",
      "state": "Berlin",
      "amtsgericht": "Amtsgericht Berlin (Charlottenburg)",
      "registernummer": "HRB 250772",
      "registerart": "HRB",
      "company_name": "S + T Ristorante und Gastronomie GmbH",
      "company_seat": "Berlin",
      "details": "01.10.2025 (Bekanntmachungsdatum)\n\nBerlin Amtsgericht Berlin (Charlottenburg) HRB 250772\nRegisterbekanntmachung nach dem Umwandlungsgesetz 30.09.2025 (Eintragungsdatum)\n\nS + T Ristorante und Gastronomie GmbH\nGesellschaft mit beschränkter Haftung\nBerlin\n\nZu Eintragungsnummer 2 vom 30.09.2025 wird als nicht eingetragen veröffentlicht: Den Gläubigern der an der Spaltung beteiligten Rechtsträger ist, wenn sie binnen sechs Monaten nach dem Tag, an dem die Eintragung der Spaltung in das Register des Sitzes desjenigen Rechtsträgers, dessen Gläubiger sie sind, als bekannt gemacht gilt, ihren Anspruch nach Grund und Höhe schriftlich anmelden, Sicherheit zu leisten, soweit sie nicht Befriedigung verlangen können. Dieses Recht steht den Gläubigern jedoch nur zu, wenn sie glaubhaft machen, dass durch die Spaltung die Erfüllung ihrer Forderung gefährdet wird. Das Recht, Sicherheitsleistung zu verlangen, steht Gläubigern nicht zu, die im Falle der Insolvenz ein Recht auf vorzugsweise Befriedigung aus einer Deckungsmasse haben, die nach gesetzlicher Vorschrift zu ihrem Schutz errichtet und staatlich überwacht ist."
    },
    {
      "date": "2025-10-01",
      "id": "132163",
      "original_text": "Registerbekanntmachung nach dem Umwandlungsgesetz\nBerlin Amtsgericht Berlin (Charlottenburg) HRB 180982\nFH Vermögens- und Verwaltungsgesellschaft mbH – Berlin",
      "type": "Registerbekanntmachung nach dem Umwandlungsgesetz",
      "state": "Berlin",
      "amtsgericht": "Amtsgericht Berlin (Charlottenburg)",
      "registernummer": "HRB 180982",
      "registerart": "HRB",
      "company_name": "FH Vermögens- und Verwaltungsgesellschaft mbH",
      "company_seat": "Berlin",
      "details": "01.10.2025 (Bekanntmachungsdatum)\n\nBerlin Amtsgericht Berlin (Charlottenburg) HRB 180982\nRegisterbekanntmachung nach dem Umwandlungsgesetz 30.09.2025 (Eintragungsdatum)\n\nFH Vermögens- und Verwaltungsgesellschaft mbH\nGesellschaft mit beschränkter Haftung\nBerlin\n\nZu Eintragungsnummer 3 vom 30.09.2025 wird als nicht eingetragen veröffentlicht: Den Gläubigern der an der Verschmelzung beteiligten Rechtsträger ist, wenn sie binnen sechs Monaten nach dem Tag, an dem die Eintragung der Verschmelzung in das Register des Sitzes desjenigen Rechtsträgers, dessen Gläubiger sie sind, als bekannt gemacht gilt, ihren Anspruch nach Grund und Höhe schriftlich anmelden, Sicherheit zu leisten, soweit sie nicht Befriedigung verlangen können. Dieses Recht steht den Gläubigern jedoch nur zu, wenn sie glaubhaft machen, dass durch die Verschmelzung die Erfüllung ihrer Forderung gefährdet wird. Das Recht, Sicherheitsleistung zu verlangen, steht Gläubigern nicht zu, die im Falle der Insolvenz ein Recht auf vorzugsweise Befriedigung aus einer Deckungsmasse haben, die nach gesetzlicher Vorschrift zu ihrem Schutz errichtet und staatlich überwacht ist."
    },
    {
      "date": "2025-10-01",
      "id": "132164",
      "original_text": "Löschungsankündigung\nBerlin Amtsgericht Berlin (Charlottenburg) HRB 223030\nFriedenberg UG (haftungsbeschränkt) – Berlin",
      "type": "Löschungsankündigung",
      "state": "Berlin",
      "amtsgericht": "Amtsgericht Berlin (Charlottenburg)",
      "registernummer": "HRB 223030",
      "registerart": "HRB",
      "company_name": "Friedenberg UG (haftungsbeschränkt)",
      "company_seat": "Berlin",
      "details": "01.10.2025 (Bekanntmachungsdatum)\n\nBerlin Amtsgericht Berlin (Charlottenburg) HRB 223030\nLöschungsankündigung\n\nFriedenberg UG (haftungsbeschränkt)\nGesellschaft mit beschränkter Haftung\nBerlin\n\nBei der nachstehenden Gesellschaft wird das Amtslöschungsverfahren gemäß § 394 FamFG eingeleitet. Widerspruchsfrist 6 Wochen"
    },
    {
      "date": "2025-10-01",
      "id": "132165",
      "original_text": "Registerbekanntmachung nach dem Umwandlungsgesetz\nBaden-Württemberg Amtsgericht Mannheim HRB 724147\nYello Solar GmbH – Karlsruhe",
      "type": "Registerbekanntmachung nach dem Umwandlungsgesetz",
      "state": "Baden-Württemberg",
      "amtsgericht": "Amtsgericht Mannheim",
      "registernummer": "HRB 724147",
      "registerart": "HRB",
      "company_name": "Yello Solar GmbH",
      "company_seat": "Karlsruhe",
      "details": "01.10.2025 (Bekanntmachungsdatum)\n\nBaden-Württemberg Amtsgericht Mannheim HRB 724147\nRegisterbekanntmachung nach dem Umwandlungsgesetz 01.10.2025 (Eintragungsdatum)\n\nYello Solar GmbH\nGesellschaft mit beschränkter Haftung\nKarlsruhe\n\nDen Gläubigern der an der Ausgliederung beteiligten Rechtsträger ist, wenn sie binnen sechs Monaten nach dem Tag, an dem die Eintragung der Ausgliederung in das Register des Sitzes desjenigen Rechtsträgers, dessen Gläubiger sie sind, nach § 19 Abs. 3 UmwG als bekanntgemacht gilt, ihren Anspruch nach Grund und Höhe schriftlich anmelden, Sicherheit zu leisten, soweit sie nicht Befriedigung verlangen können. Dieses Recht steht den Gläubigern jedoch nur zu, wenn sie glaubhaft machen, dass durch die Ausgliederung die Erfüllung ihrer Forderung gefährdet wird."
    },
    {
      "date": "2025-10-01",
      "id": "132166",
      "original_text": "Löschungsankündigung\nBaden-Württemberg Amtsgericht Mannheim HRB 740701\nAP Motor Trading UG (haftungsbeschränkt) – Baden-Baden",
      "type": "Löschungsankündigung",
      "state": "Baden-Württemberg",
      "amtsgericht": "Amtsgericht Mannheim",
      "registernummer": "HRB 740701",
      "registerart": "HRB",
      "company_name": "AP Motor Trading UG (haftungsbeschränkt)",
      "company_seat": "Baden-Baden",
      "details": "01.10.2025 (Bekanntmachungsdatum)\n\nBaden-Württemberg Amtsgericht Mannheim HRB 740701\nLöschungsankündigung\n\nAP Motor Trading UG (haftungsbeschränkt)\nGesellschaft mit beschränkter Haftung\nBaden-Baden\n\nDas Gericht beabsichtigt, die Gesellschaft wegen Vermögenslosigkeit im Handelsregister von Amts wegen nach § 394 FamFG zu löschen. Die Frist zur Geltendmachung eines Widerspruchs gegen die beabsichtigte Löschung ist auf einen Monat ab Veröffentlichung bestimmt."
    },
    {
      "date": "2025-10-01",
      "id": "132167",
      "original_text": "Sonstige Registerbekanntmachung\nBerlin Amtsgericht Berlin (Charlottenburg) HRB 84046\nGEHAG GmbH – Berlin",
      "type": "Sonstige Registerbekanntmachung",
      "state": "Berlin",
      "amtsgericht": "Amtsgericht Berlin (Charlottenburg)",
      "registernummer": "HRB 84046",
      "registerart": "HRB",
      "company_name": "GEHAG GmbH",
      "company_seat": "Berlin",
      "details": "01.10.2025 (Bekanntmachungsdatum)\n\nBerlin Amtsgericht Berlin (Charlottenburg) HRB 84046\nSonstige Registerbekanntmachung\n\nGEHAG GmbH\nGesellschaft mit beschränkter Haftung\nBerlin\n\nEs wurde eine neue Liste der Aufsichtsratsmitglieder eingereicht (§52 GmbHG).Als nicht eingetragen wird veröffentlicht:"
    },
    {
      "date": "2025-10-01",
      "id": "132168",
      "original_text": "Einreichung neuer Dokumente\nBaden-Württemberg Amtsgericht Ulm HRB 721339\nGARDENA GmbH – Ulm",
      "type": "Einreichung neuer Dokumente",
      "state": "Baden-Württemberg",
      "amtsgericht": "Amtsgericht Ulm",
      "registernummer": "HRB 721339",
      "registerart": "HRB",
      "company_name": "GARDENA GmbH",
      "company_seat": "Ulm",
      "details": "01.10.2025 (Bekanntmachungsdatum)\n\nBaden-Württemberg Amtsgericht Ulm HRB 721339\nEinreichung neuer Dokumente\n\nGARDENA GmbH\nGesellschaft mit beschränkter Haftung\nUlm\n\nDie Gesellschaft hat am 29.09.2025 die Liste über die Zusammensetzung des Aufsichtsrats zum Handelsregister eingereicht."
    },
    {
      "date": "2025-10-01",
      "id": "132169",
      "original_text": "Registerbekanntmachung nach dem Umwandlungsgesetz\nBaden-Württemberg Amtsgericht Mannheim HRB 748222\nDeutsche Energie Infrastruktur I GmbH – Karlsruhe",
      "type": "Registerbekanntmachung nach dem Umwandlungsgesetz",
      "state": "Baden-Württemberg",
      "amtsgericht": "Amtsgericht Mannheim",
      "registernummer": "HRB 748222",
      "registerart": "HRB",
      "company_name": "Deutsche Energie Infrastruktur I GmbH",
      "company_seat": "Karlsruhe",
      "details": "01.10.2025 (Bekanntmachungsdatum)\n\nBaden-Württemberg Amtsgericht Mannheim HRB 748222\nRegisterbekanntmachung nach dem Umwandlungsgesetz 01.10.2025 (Eintragungsdatum)\n\nDeutsche Energie Infrastruktur I GmbH\nGesellschaft mit beschränkter Haftung\nKarlsruhe\n\nDen Gläubigern der an der Ausgliederung beteiligten Rechtsträger ist, wenn sie binnen sechs Monaten nach dem Tag, an dem die Eintragung der Ausgliederung in das Register des Sitzes desjenigen Rechtsträgers, dessen Gläubiger sie sind, nach § 19 Abs. 3 UmwG als bekanntgemacht gilt, ihren Anspruch nach Grund und Höhe schriftlich anmelden, Sicherheit zu leisten, soweit sie nicht Befriedigung verlangen können. Dieses Recht steht den Gläubigern jedoch nur zu, wenn sie glaubhaft machen, dass durch die Ausgliederung die Erfüllung ihrer Forderung gefährdet wird."
    },
    {
      "date": "2025-10-01",
      "id": "132170",
      "original_text": "Registerbekanntmachung nach dem Umwandlungsgesetz\nBaden-Württemberg Amtsgericht Freiburg GnR 380036\nVolksbank eG – Konstanz",
      "type": "Registerbekanntmachung nach dem Umwandlungsgesetz",
      "state": "Baden-Württemberg",
      "amtsgericht": "Amtsgericht Freiburg",
      "registernummer": "GnR 380036",
      "registerart": "GnR",
      "company_name": "Volksbank eG",
      "company_seat": "Konstanz",
      "details": "01.10.2025 (Bekanntmachungsdatum)\n\nBaden-Württemberg Amtsgericht Freiburg GnR 380036\nRegisterbekanntmachung nach dem Umwandlungsgesetz 01.10.2025 (Eintragungsdatum)\n\nVolksbank eG\neingetragene Genossenschaft\nKonstanz\n\nAls nicht eingetragen wird bekanntgemacht:\nDen Gläubigern der an der Verschmelzung beteiligten Rechtsträger ist, wenn sie binnen sechs Monaten nach dem Tag, an dem die Eintragung der Verschmelzung in das Register des Sitzes desjenigen Rechtsträgers, dessen Gläubiger sie sind, nach § 19 Abs. 3 UmwG als bekanntgemacht gilt, ihren Anspruch nach Grund und Höhe schriftlich anmelden, Sicherheit zu leisten, soweit sie nicht Befriedigung verlangen können. Dieses Recht steht den Gläubigern jedoch nur zu, wenn sie glaubhaft machen, dass durch die Verschmelzung die Erfüllung ihrer Forderung gefährdet wird."
    },
    {
      "date": "2025-10-01",
      "id": "132171",
      "original_text": "Sonstige Registerbekanntmachung\nSchleswig-Holstein Amtsgericht Lübeck HRB 15865\nTRAVE Immobilien GmbH – Sereetz",
      "type": "Sonstige Registerbekanntmachung",
      "state": "Schleswig-Holstein",
      "amtsgericht": "Amtsgericht Lübeck",
      "registernummer": "HRB 15865",
      "registerart": "HRB",
      "company_name": "TRAVE Immobilien GmbH",
      "company_seat": "Sereetz",
      "details": "01.10.2025 (Bekanntmachungsdatum)\n\nSchleswig-Holstein Amtsgericht Lübeck HRB 15865\nSonstige Registerbekanntmachung\n\nTRAVE Immobilien GmbH\nGesellschaft mit beschränkter Haftung\nSereetz\n\nAls nicht eingetragen wird veröffentlicht:\n\nHerrn\nMilan Kotek\nunbekannten Aufenthalts\nals Geschäftsführer\n\nSehr geehrter Herr Kotek,\nin der Handelsregistersache der\n\nTRAVE Immobilien GmbH\n\nergeben sich aus den vorliegenden Unterlagen Anhaltspunkte dafür, dass die Gesellschaft vermögenslos ist:\n\n- vorliegende Mitteilung des Gewerbeamtes (vollständige Geschäftsaufgabe zum 18.03.2024)\n- erfolgloser Vollstreckungsversuch bezüglich des durch Beschluss vom 12.05.2025 festgesetzten Zwangsgeldes\n\nEs ist daher beabsichtigt, die Gesellschaft wegen Vermögenslosigkeit gemäß § 394 FamFG zu löschen.\n\nEs wird eine Frist von zwei Monaten zur Geltendmachung eines Widerspruchs gegen die Löschung, § 394 Abs. 2 S. 1 FamFG, beginnend ab der Veröffentlichung, bestimmt.\n\nNach Fristablauf ohne Widerspruch des Geschäftsführers oder anderer Seite wird die Gesellschaft gelöscht.\n\nGärtner\nDipl.-Rechtspflegerin (FH)"
    },
    {
      "date": "2025-10-01",
      "id": "132172",
      "original_text": "Löschungsankündigung\nSchleswig-Holstein Amtsgericht Lübeck HRB 15865\nTRAVE Immobilien GmbH – Sereetz",
      "type": "Löschungsankündigung",
      "state": "Schleswig-Holstein",
      "amtsgericht": "Amtsgericht Lübeck",
      "registernummer": "HRB 15865",
      "registerart": "HRB",
      "company_name": "TRAVE Immobilien GmbH",
      "company_seat": "Sereetz",
      "details": "01.10.2025 (Bekanntmachungsdatum)\n\nSchleswig-Holstein Amtsgericht Lübeck HRB 15865\nLöschungsankündigung\n\nTRAVE Immobilien GmbH\nGesellschaft mit beschränkter Haftung\nSereetz\n\nEs ist die Löschung der nachstehenden Gesellschaft wegen Vermögenslosigkeit gemäß § 394 FamFG beabsichtigt."
    },
    {
      "date": "2025-10-01",
      "id": "132173",
      "original_text": "Registerbekanntmachung nach dem Umwandlungsgesetz\nHamburg Amtsgericht Hamburg HRB 110583\nKlambt Style-Verlag Verwaltungsgesellschaft mbH – Hamburg",
      "type": "Registerbekanntmachung nach dem Umwandlungsgesetz",
      "state": "Hamburg",
      "amtsgericht": "Amtsgericht Hamburg",
      "registernummer": "HRB 110583",
      "registerart": "HRB",
      "company_name": "Klambt Style-Verlag Verwaltungsgesellschaft mbH",
      "company_seat": "Hamburg",
      "details": "01.10.2025 (Bekanntmachungsdatum)\n\nHamburg Amtsgericht Hamburg HRB 110583\nRegisterbekanntmachung nach dem Umwandlungsgesetz 01.10.2025 (Eintragungsdatum)\n\nKlambt Style-Verlag Verwaltungsgesellschaft mbH\nGesellschaft mit beschränkter Haftung\nHamburg\n\nAls nicht eingetragen wird bekannt gemacht:\nDen Gläubigern der an der Verschmelzung beteiligten Gesellschaften ist, wenn sie binnen sechs Monaten nach dem Tag, an dem die Eintragung der Verschmelzung in das Register des Sitzes desjenigen Rechtsträgers, dessen Gläubiger sie sind, nach § 19 Absatz 3 UmwG als bekannt gemacht gilt, ihren Anspruch nach Grund und Höhe schriftlich anmelden, Sicherheit zu leisten, soweit sie nicht Befriedigung verlangen können. Dieses Recht steht den Gläubigern jedoch nur zu, wenn sie glaubhaft machen, dass durch die Verschmelzung die Erfüllung ihrer Forderung gefährdet wird."
    },
    {
      "date": "2025-10-01",
      "id": "132174",
      "original_text": "Einreichung neuer Dokumente\nHamburg Amtsgericht Hamburg HRB 169560\nHRForward AG – Hamburg",
      "type": "Einreichung neuer Dokumente",
      "state": "Hamburg",
      "amtsgericht": "Amtsgericht Hamburg",
      "registernummer": "HRB 169560",
      "registerart": "HRB",
      "company_name": "HRForward AG",
      "company_seat": "Hamburg",
      "details": "01.10.2025 (Bekanntmachungsdatum)\n\nHamburg Amtsgericht Hamburg HRB 169560\nEinreichung neuer Dokumente 01.10.2025 (Eintragungsdatum)\n\nHRForward AG\nAktiengesellschaft\nHamburg\n\nAls nicht eingetragen wird bekannt gemacht: Liste des Aufsichtsrats wurde eingereicht."
    },
    {
      "date": "2025-10-01",
      "id": "132175",
      "original_text": "Einreichung neuer Dokumente\nSachsen-Anhalt Amtsgericht Stendal HRB 205417\nHallesche Wasser und Stadtwirtschaft GmbH – Halle (Saale)",
      "type": "Einreichung neuer Dokumente",
      "state": "Sachsen-Anhalt",
      "amtsgericht": "Amtsgericht Stendal",
      "registernummer": "HRB 205417",
      "registerart": "HRB",
      "company_name": "Hallesche Wasser und Stadtwirtschaft GmbH",
      "company_seat": "Halle (Saale)",
      "details": "01.10.2025 (Bekanntmachungsdatum)\n\nSachsen-Anhalt Amtsgericht Stendal HRB 205417\nEinreichung neuer Dokumente\n\nHallesche Wasser und Stadtwirtschaft GmbH\nGesellschaft mit beschränkter Haftung\nHalle (Saale)\n\nEine Liste der Mitglieder des Aufsichtsrates wurde zum Handelsregister eingereicht."
    },
    {
      "date": "2025-10-01",
      "id": "132176",
      "original_text": "Löschungsankündigung\nSchleswig-Holstein Amtsgericht Pinneberg HRB 14406\nAkmar UG (haftungsbeschränkt) – Elmshorn",
      "type": "Löschungsankündigung",
      "state": "Schleswig-Holstein",
      "amtsgericht": "Amtsgericht Pinneberg",
      "registernummer": "HRB 14406",
      "registerart": "HRB",
      "company_name": "Akmar UG (haftungsbeschränkt)",
      "company_seat": "Elmshorn",
      "details": "01.10.2025 (Bekanntmachungsdatum)\n\nSchleswig-Holstein Amtsgericht Pinneberg HRB 14406\nLöschungsankündigung\n\nAkmar UG (haftungsbeschränkt)\nGesellschaft mit beschränkter Haftung\nElmshorn\n\nEs ist die Löschung der nachstehenden Gesellschaft wegen Vermögenslosigkeit gemäß § 394 FamFG beabsichtigt. Widerspruchsfrist: 2 Monate."
    },
    {
      "date": "2025-10-01",
      "id": "132177",
      "original_text": "Registerbekanntmachung nach dem Umwandlungsgesetz\nMecklenburg-Vorpommern Amtsgericht Rostock HRB 10938\nDSR Hotel Holding GmbH – Rostock",
      "type": "Registerbekanntmachung nach dem Umwandlungsgesetz",
      "state": "Mecklenburg-Vorpommern",
      "amtsgericht": "Amtsgericht Rostock",
      "registernummer": "HRB 10938",
      "registerart": "HRB",
      "company_name": "DSR Hotel Holding GmbH",
      "company_seat": "Rostock",
      "details": "01.10.2025 (Bekanntmachungsdatum)\n\nMecklenburg-Vorpommern Amtsgericht Rostock HRB 10938\nRegisterbekanntmachung nach dem Umwandlungsgesetz 01.10.2025 (Eintragungsdatum)\n\nDSR Hotel Holding GmbH\nGesellschaft mit beschränkter Haftung\nRostock\n\nDen Gläubigern der an der Verschmelzung beteiligten Rechtsträger ist, wenn sie binnen sechs Monaten nach dem Tag, an dem die Eintragung der Verschmelzung in das Register des Sitzes desjenigen Rechtsträgers, dessen Gläubiger sie sind, nach § 19 Abs. 3 UmwG als bekannt gemacht gilt, ihren Anspruch nach Grund und Höhe in Textform anmelden, Sicherheit zu leisten, soweit sie nicht Befriedigung verlangen können. Dieses Recht steht den Gläubigern jedoch nur zu, wenn sie glaubhaft machen, dass durch die Verschmelzung die Erfüllung der Forderung gefährdet wird."
    },
    {
      "date": "2025-10-01",
      "id": "132178",
      "original_text": "Registerbekanntmachung nach dem Umwandlungsgesetz\nBerlin Amtsgericht Berlin (Charlottenburg) HRB 239179\n11squared Ventures GmbH – Berlin",
      "type": "Registerbekanntmachung nach dem Umwandlungsgesetz",
      "state": "Berlin",
      "amtsgericht": "Amtsgericht Berlin (Charlottenburg)",
      "registernummer": "HRB 239179",
      "registerart": "HRB",
      "company_name": "11squared Ventures GmbH",
      "company_seat": "Berlin",
      "details": "01.10.2025 (Bekanntmachungsdatum)\n\nBerlin Amtsgericht Berlin (Charlottenburg) HRB 239179\nRegisterbekanntmachung nach dem Umwandlungsgesetz 30.09.2025 (Eintragungsdatum)\n\n11squared Ventures GmbH\nGesellschaft mit beschränkter Haftung\nBerlin\n\nZu Eintragungsnummer 4 vom 30.09.2025 wird als nicht eingetragen veröffentlicht:Den Gläubigern der an der Verschmelzung beteiligten Rechtsträger ist, wenn sie binnen sechs Monaten nach dem Tag, an dem die Eintragung der Verschmelzung in das Register des Sitzes desjenigen Rechtsträgers, dessen Gläubiger sie sind, als bekannt gemacht gilt, ihren Anspruch nach Grund und Höhe schriftlich anmelden, Sicherheit zu leisten, soweit sie nicht Befriedigung verlangen können. Dieses Recht steht den Gläubigern jedoch nur zu, wenn sie glaubhaft machen, dass durch die Verschmelzung die Erfüllung ihrer Forderung gefährdet wird. Das Recht, Sicherheitsleistung zu verlangen, steht Gläubigern nicht zu, die im Falle der Insolvenz ein Recht auf vorzugsweise Befriedigung aus einer Deckungsmasse haben, die nach gesetzlicher Vorschrift zu ihrem Schutz errichtet und staatlich überwacht ist."
    },
    {
      "date": "2025-10-01",
      "id": "132179",
      "original_text": "Registerbekanntmachung nach dem Umwandlungsgesetz\nMecklenburg-Vorpommern Amtsgericht Rostock HRB 16586\nDSR Hospitality Verwaltungs GmbH – Rostock",
      "type": "Registerbekanntmachung nach dem Umwandlungsgesetz",
      "state": "Mecklenburg-Vorpommern",
      "amtsgericht": "Amtsgericht Rostock",
      "registernummer": "HRB 16586",
      "registerart": "HRB",
      "company_name": "DSR Hospitality Verwaltungs GmbH",
      "company_seat": "Rostock",
      "details": "01.10.2025 (Bekanntmachungsdatum)\n\nMecklenburg-Vorpommern Amtsgericht Rostock HRB 16586\nRegisterbekanntmachung nach dem Umwandlungsgesetz 01.10.2025 (Eintragungsdatum)\n\nDSR Hospitality Verwaltungs GmbH\nGesellschaft mit beschränkter Haftung\nRostock\n\nDen Gläubigern der an der Verschmelzung beteiligten Rechtsträger ist, wenn sie binnen sechs Monaten nach dem Tag, an dem die Eintragung der Verschmelzung in das Register des Sitzes desjenigen Rechtsträgers, dessen Gläubiger sie sind, nach § 19 Abs. 3 UmwG als bekannt gemacht gilt, ihren Anspruch nach Grund und Höhe in Textform anmelden, Sicherheit zu leisten, soweit sie nicht Befriedigung verlangen können. Dieses Recht steht den Gläubigern jedoch nur zu, wenn sie glaubhaft machen, dass durch die Verschmelzung die Erfüllung der Forderung gefährdet wird."
    },
    {
      "date": "2025-10-01",
      "id": "132180",
      "original_text": "Registerbekanntmachung nach dem Umwandlungsgesetz\nBerlin Amtsgericht Berlin (Charlottenburg) HRB 220202\nPK Venture UG (haftungsbeschränkt) – Berlin",
      "type": "Registerbekanntmachung nach dem Umwandlungsgesetz",
      "state": "Berlin",
      "amtsgericht": "Amtsgericht Berlin (Charlottenburg)",
      "registernummer": "HRB 220202",
      "registerart": "HRB",
      "company_name": "PK Venture UG (haftungsbeschränkt)",
      "company_seat": "Berlin",
      "details": "01.10.2025 (Bekanntmachungsdatum)\n\nBerlin Amtsgericht Berlin (Charlottenburg) HRB 220202\nRegisterbekanntmachung nach dem Umwandlungsgesetz 29.09.2025 (Eintragungsdatum)\n\nPK Venture UG (haftungsbeschränkt)\nGesellschaft mit beschränkter Haftung\nBerlin\n\nZu Eintragungsnummer 3 vom 29.09.2025 wird als nicht eingetragen veröffentlicht:Den Gläubigern der an der Verschmelzung beteiligten Rechtsträger ist, wenn sie binnen sechs Monaten nach dem Tag, an dem die Eintragung der Verschmelzung in das Register des Sitzes desjenigen Rechtsträgers, dessen Gläubiger sie sind, als bekannt gemacht gilt, ihren Anspruch nach Grund und Höhe schriftlich anmelden, Sicherheit zu leisten, soweit sie nicht Befriedigung verlangen können. Dieses Recht steht den Gläubigern jedoch nur zu, wenn sie glaubhaft machen, dass durch die Verschmelzung die Erfüllung ihrer Forderung gefährdet wird. Das Recht, Sicherheitsleistung zu verlangen, steht Gläubigern nicht zu, die im Falle der Insolvenz ein Recht auf vorzugsweise Befriedigung aus einer Deckungsmasse haben, die nach gesetzlicher Vorschrift zu ihrem Schutz errichtet und staatlich überwacht ist."
    },
    {
      "date": "2025-10-01",
      "id": "132181",
      "original_text": "Registerbekanntmachung nach dem Umwandlungsgesetz\nBerlin Amtsgericht Berlin (Charlottenburg) HRB 263636\nPK Real Estate UG (haftungsbeschränkt) – Berlin",
      "type": "Registerbekanntmachung nach dem Umwandlungsgesetz",
      "state": "Berlin",
      "amtsgericht": "Amtsgericht Berlin (Charlottenburg)",
      "registernummer": "HRB 263636",
      "registerart": "HRB",
      "company_name": "PK Real Estate UG (haftungsbeschränkt)",
      "company_seat": "Berlin",
      "details": "01.10.2025 (Bekanntmachungsdatum)\n\nBerlin Amtsgericht Berlin (Charlottenburg) HRB 263636\nRegisterbekanntmachung nach dem Umwandlungsgesetz 29.09.2025 (Eintragungsdatum)\n\nPK Real Estate UG (haftungsbeschränkt)\nGesellschaft mit beschränkter Haftung\nBerlin\n\nZu Eintragungsnummer 2 vom 29.09.2025 wird als nicht eingetragen veröffentlicht:Den Gläubigern der an der Verschmelzung beteiligten Rechtsträger ist, wenn sie binnen sechs Monaten nach dem Tag, an dem die Eintragung der Verschmelzung in das Register des Sitzes desjenigen Rechtsträgers, dessen Gläubiger sie sind, als bekannt gemacht gilt, ihren Anspruch nach Grund und Höhe schriftlich anmelden, Sicherheit zu leisten, soweit sie nicht Befriedigung verlangen können. Dieses Recht steht den Gläubigern jedoch nur zu, wenn sie glaubhaft machen, dass durch die Verschmelzung die Erfüllung ihrer Forderung gefährdet wird. Das Recht, Sicherheitsleistung zu verlangen, steht Gläubigern nicht zu, die im Falle der Insolvenz ein Recht auf vorzugsweise Befriedigung aus einer Deckungsmasse haben, die nach gesetzlicher Vorschrift zu ihrem Schutz errichtet und staatlich überwacht ist."
    },
    {
      "date": "2025-10-01",
      "id": "132182",
      "original_text": "Registerbekanntmachung nach dem Umwandlungsgesetz\nBaden-Württemberg Amtsgericht Stuttgart HRB 14562\nIBM Deutschland GmbH – Ehningen",
      "type": "Registerbekanntmachung nach dem Umwandlungsgesetz",
      "state": "Baden-Württemberg",
      "amtsgericht": "Amtsgericht Stuttgart",
      "registernummer": "HRB 14562",
      "registerart": "HRB",
      "company_name": "IBM Deutschland GmbH",
      "company_seat": "Ehningen",
      "details": "01.10.2025 (Bekanntmachungsdatum)\n\nBaden-Württemberg Amtsgericht Stuttgart HRB 14562\nRegisterbekanntmachung nach dem Umwandlungsgesetz 01.10.2025 (Eintragungsdatum)\n\nIBM Deutschland GmbH\nGesellschaft mit beschränkter Haftung\nEhningen\n\nAls nicht eingetragen wird bekanntgemacht:\nDen Gläubigern der an der Verschmelzung beteiligten Rechtsträger ist, wenn sie binnen sechs Monaten nach dem Tag, an dem die Eintragung der Verschmelzung in das Register des Sitzes desjenigen Rechtsträgers, dessen Gläubiger sie sind, nach § 19 Abs. 3 UmwG als bekanntgemacht gilt, ihren Anspruch nach Grund und Höhe schriftlich anmelden, Sicherheit zu leisten, soweit sie nicht Befriedigung verlangen können. Dieses Recht steht den Gläubigern jedoch nur zu, wenn sie glaubhaft machen, dass durch die Verschmelzung die Erfüllung ihrer Forderung gefährdet wird."
    },
    {
      "date": "2025-10-01",
      "id": "132183",
      "original_text": "Registerbekanntmachung nach dem Umwandlungsgesetz\nBaden-Württemberg Amtsgericht Ulm HRA 729738\nMarco Bäumler e.K. – Gingen an der Fils",
      "type": "Registerbekanntmachung nach dem Umwandlungsgesetz",
      "state": "Baden-Württemberg",
      "amtsgericht": "Amtsgericht Ulm",
      "registernummer": "HRA 729738",
      "registerart": "HRA",
      "company_name": "Marco Bäumler e.K.",
      "company_seat": "Gingen an der Fils",
      "details": "01.10.2025 (Bekanntmachungsdatum)\n\nBaden-Württemberg Amtsgericht Ulm HRA 729738\nRegisterbekanntmachung nach dem Umwandlungsgesetz 30.09.2025 (Eintragungsdatum)\n\nMarco Bäumler e.K.\nEinzelkaufmann / Einzelkauffrau\nGingen an der Fils\n\nAls nicht eingetragen wird bekanntgemacht:\nDen Gläubigern der an der Verschmelzung beteiligten Rechtsträger ist, wenn sie binnen sechs Monaten nach dem Tag, an dem die Eintragung der Verschmelzung in das Register des Sitzes desjenigen Rechtsträgers, dessen Gläubiger sie sind, nach § 19 Abs. 3 UmwG als bekanntgemacht gilt, ihren Anspruch nach Grund und Höhe schriftlich anmelden, Sicherheit zu leisten, soweit sie nicht Befriedigung verlangen können. Dieses Recht steht den Gläubigern jedoch nur zu, wenn sie glaubhaft machen, dass durch die Verschmelzung die Erfüllung ihrer Forderung gefährdet wird."
    },
    {
      "date": "2025-10-01",
      "id": "132184",
      "original_text": "Einreichung neuer Dokumente\nBerlin Amtsgericht Berlin (Charlottenburg) HRB 122131\nSamonig AG – Berlin",
      "type": "Einreichung neuer Dokumente",
      "state": "Berlin",
      "amtsgericht": "Amtsgericht Berlin (Charlottenburg)",
      "registernummer": "HRB 122131",
      "registerart": "HRB",
      "company_name": "Samonig AG",
      "company_seat": "Berlin",
      "details": "01.10.2025 (Bekanntmachungsdatum)\n\nBerlin Amtsgericht Berlin (Charlottenburg) HRB 122131\nEinreichung neuer Dokumente\n\nSamonig AG\nAktiengesellschaft\nBerlin\n\nAls nicht eingetragen wird veröffentlicht: Es wurde eine neue Liste der Aufsichtsratsmitglieder eingereicht (§ 106 AktG)."
    },
    {
      "date": "2025-10-01",
      "id": "132185",
      "original_text": "Einreichung neuer Dokumente\nBaden-Württemberg Amtsgericht Mannheim HRB 707212\nBGV-Versicherung Aktiengesellschaft – Karlsruhe",
      "type": "Einreichung neuer Dokumente",
      "state": "Baden-Württemberg",
      "amtsgericht": "Amtsgericht Mannheim",
      "registernummer": "HRB 707212",
      "registerart": "HRB",
      "company_name": "BGV-Versicherung Aktiengesellschaft",
      "company_seat": "Karlsruhe",
      "details": "01.10.2025 (Bekanntmachungsdatum)\n\nBaden-Württemberg Amtsgericht Mannheim HRB 707212\nEinreichung neuer Dokumente 19.01.2025 (Eintragungsdatum)\n\nBGV-Versicherung Aktiengesellschaft\nAktiengesellschaft\nKarlsruhe\n\nDie Gesellschaft hat am 30.09.2025 die Liste über die Zusammensetzung des Aufsichtsrats zum Handelsregister eingereicht."
    },
    {
      "date": "2025-10-01",
      "id": "132186",
      "original_text": "Registerbekanntmachung nach dem Umwandlungsgesetz\nNordrhein-Westfalen Amtsgericht Coesfeld HRA 3939\nBauunternehmung B. Liesert GmbH & Co. KG – Dülmen",
      "type": "Registerbekanntmachung nach dem Umwandlungsgesetz",
      "state": "Nordrhein-Westfalen",
      "amtsgericht": "Amtsgericht Coesfeld",
      "registernummer": "HRA 3939",
      "registerart": "HRA",
      "company_name": "Bauunternehmung B. Liesert GmbH & Co. KG",
      "company_seat": "Dülmen",
      "details": "01.10.2025 (Bekanntmachungsdatum)\n\nNordrhein-Westfalen Amtsgericht Coesfeld HRA 3939\nRegisterbekanntmachung nach dem Umwandlungsgesetz 25.10.2023 (Eintragungsdatum)\n\nBauunternehmung B. Liesert GmbH & Co. KG\nKommanditgesellschaft\nDülmen\n\nDen Gläubigern der an der Verschmelzung beteiligten Rechtsträger ist, wenn sie binnen sechs Monaten nach dem Tag, an dem die Eintragung der Gesellschaft in das Register des Sitzes /desjenigen Rechtsträgers, dessen Gläubiger/derjenigen Rechtsträger deren Gläubiger sie sind, nach § 19 Absatz 3 UmwG als bekanntgemacht gilt, ihren Anspruch nach Grund und Höhe schriftlich anmelden, Sicherheit zu leisten, soweit sie nicht Befriedigung verlangen können. Dieses Recht steht den Gläubigern jedoch nur zu, wenn sie glaubhaft machen, dass durch die Verschmelzung die Erfüllung ihrer Forderung gefährdet wird."
    },
    {
      "date": "2025-10-01",
      "id": "132187",
      "original_text": "Registerbekanntmachung nach dem Umwandlungsgesetz\nNordrhein-Westfalen Amtsgericht Coesfeld HRA 5215\nJoytex GmbH & Co. KG – Rhede",
      "type": "Registerbekanntmachung nach dem Umwandlungsgesetz",
      "state": "Nordrhein-Westfalen",
      "amtsgericht": "Amtsgericht Coesfeld",
      "registernummer": "HRA 5215",
      "registerart": "HRA",
      "company_name": "Joytex GmbH & Co. KG",
      "company_seat": "Rhede",
      "details": "01.10.2025 (Bekanntmachungsdatum)\n\nNordrhein-Westfalen Amtsgericht Coesfeld HRA 5215\nRegisterbekanntmachung nach dem Umwandlungsgesetz 26.10.2023 (Eintragungsdatum)\n\nJoytex GmbH & Co. KG\nKommanditgesellschaft\nRhede\n\nDen Gläubigern der an der Verschmelzung beteiligten Rechtsträger ist, wenn sie binnen sechs Monaten nach dem Tag, an dem die Eintragung der Gesellschaft in das Register des Sitzes /desjenigen Rechtsträgers, dessen Gläubiger/derjenigen Rechtsträger deren Gläubiger sie sind, nach § 19 Absatz 3 UmwG als bekanntgemacht gilt, ihren Anspruch nach Grund und Höhe schriftlich anmelden, Sicherheit zu leisten, soweit sie nicht Befriedigung verlangen können. Dieses Recht steht den Gläubigern jedoch nur zu, wenn sie glaubhaft machen, dass durch die Verschmelzung die Erfüllung ihrer Forderung gefährdet wird."
    },
    {
      "date": "2025-10-01",
      "id": "132188",
      "original_text": "Registerbekanntmachung nach dem Umwandlungsgesetz\nNordrhein-Westfalen Amtsgericht Coesfeld HRB 8662\nE.T.A. Elektrotechnische Anlagen Papenkort GmbH – Bocholt",
      "type": "Registerbekanntmachung nach dem Umwandlungsgesetz",
      "state": "Nordrhein-Westfalen",
      "amtsgericht": "Amtsgericht Coesfeld",
      "registernummer": "HRB 8662",
      "registerart": "HRB",
      "company_name": "E.T.A. Elektrotechnische Anlagen Papenkort GmbH",
      "company_seat": "Bocholt",
      "details": "01.10.2025 (Bekanntmachungsdatum)\n\nNordrhein-Westfalen Amtsgericht Coesfeld HRB 8662\nRegisterbekanntmachung nach dem Umwandlungsgesetz 30.10.2023 (Eintragungsdatum)\n\nE.T.A. Elektrotechnische Anlagen Papenkort GmbH\nGesellschaft mit beschränkter Haftung\nBocholt\n\nDen Gläubigern der an der Verschmelzung beteiligten Rechtsträger ist, wenn sie binnen sechs Monaten nach dem Tag, an dem die Eintragung der Gesellschaft in das Register des Sitzes /desjenigen Rechtsträgers, dessen Gläubiger/derjenigen Rechtsträger deren Gläubiger sie sind, nach § 19 Absatz 3 UmwG als bekanntgemacht gilt, ihren Anspruch nach Grund und Höhe schriftlich anmelden, Sicherheit zu leisten, soweit sie nicht Befriedigung verlangen können. Dieses Recht steht den Gläubigern jedoch nur zu, wenn sie glaubhaft machen, dass durch die Verschmelzung die Erfüllung ihrer Forderung gefährdet wird."
    },
    {
      "date": "2025-10-01",
      "id": "132189",
      "original_text": "Registerbekanntmachung nach dem Umwandlungsgesetz\nNordrhein-Westfalen Amtsgericht Coesfeld HRB 21599\nCHI - Clever Human Immobilien Verwaltungs GmbH – Ascheberg",
      "type": "Registerbekanntmachung nach dem Umwandlungsgesetz",
      "state": "Nordrhein-Westfalen",
      "amtsgericht": "Amtsgericht Coesfeld",
      "registernummer": "HRB 21599",
      "registerart": "HRB",
      "company_name": "CHI - Clever Human Immobilien Verwaltungs GmbH",
      "company_seat": "Ascheberg",
      "details": "01.10.2025 (Bekanntmachungsdatum)\n\nNordrhein-Westfalen Amtsgericht Coesfeld HRB 21599\nRegisterbekanntmachung nach dem Umwandlungsgesetz 30.10.2023 (Eintragungsdatum)\n\nCHI - Clever Human Immobilien Verwaltungs GmbH\nGesellschaft mit beschränkter Haftung\nAscheberg\n\nDen Gläubigern der an der formwechselnden Umwandlung\nbeteiligten Rechtsträger ist, wenn sie binnen sechs Monaten nach dem Tag, an dem die Eintragung der Gesellschaft in das Register des Sitzes /desjenigen Rechtsträgers, dessen Gläubiger/derjenigen Rechtsträger deren Gläubiger sie sind, nach § 19 Absatz 3 UmwG als bekanntgemacht gilt, ihren Anspruch nach Grund und Höhe schriftlich anmelden, Sicherheit zu leisten, soweit sie nicht Befriedigung verlangen können. Dieses Recht steht den Gläubigern jedoch nur zu, wenn sie glaubhaft machen, dass durch die formwechselnden Umwandlung die Erfüllung ihrer Forderung gefährdet wird"
    },
    {
      "date": "2025-10-01",
      "id": "132190",
      "original_text": "Registerbekanntmachung nach dem Umwandlungsgesetz\nNordrhein-Westfalen Amtsgericht Coesfeld HRB 21377\nTKG GmbH – Havixbeck",
      "type": "Registerbekanntmachung nach dem Umwandlungsgesetz",
      "state": "Nordrhein-Westfalen",
      "amtsgericht": "Amtsgericht Coesfeld",
      "registernummer": "HRB 21377",
      "registerart": "HRB",
      "company_name": "TKG GmbH",
      "company_seat": "Havixbeck",
      "details": "01.10.2025 (Bekanntmachungsdatum)\n\nNordrhein-Westfalen Amtsgericht Coesfeld HRB 21377\nRegisterbekanntmachung nach dem Umwandlungsgesetz 30.10.2023 (Eintragungsdatum)\n\nTKG GmbH\nGesellschaft mit beschränkter Haftung\nHavixbeck\n\nDen Gläubigern der an der Verschmelzung beteiligten Rechtsträger ist, wenn sie binnen sechs Monaten nach dem Tag, an dem die Eintragung der Gesellschaft in das Register des Sitzes /desjenigen Rechtsträgers, dessen Gläubiger/derjenigen Rechtsträger deren Gläubiger sie sind, nach § 19 Absatz 3 UmwG als bekanntgemacht gilt, ihren Anspruch nach Grund und Höhe schriftlich anmelden, Sicherheit zu leisten, soweit sie nicht Befriedigung verlangen können. Dieses Recht steht den Gläubigern jedoch nur zu, wenn sie glaubhaft machen, dass durch die Verschmelzung die Erfüllung ihrer Forderung gefährdet wird."
    },
    {
      "date": "2025-10-01",
      "id": "132191",
      "original_text": "Löschungsankündigung\nNordrhein-Westfalen Amtsgericht Coesfeld HRB 12493\nLemon Erlebnisgastronomie GmbH – Dülmen",
      "type": "Löschungsankündigung",
      "state": "Nordrhein-Westfalen",
      "amtsgericht": "Amtsgericht Coesfeld",
      "registernummer": "HRB 12493",
      "registerart": "HRB",
      "company_name": "Lemon Erlebnisgastronomie GmbH",
      "company_seat": "Dülmen",
      "details": "01.10.2025 (Bekanntmachungsdatum)\n\nNordrhein-Westfalen Amtsgericht Coesfeld HRB 12493\nLöschungsankündigung\n\nLemon Erlebnisgastronomie GmbH\nGesellschaft mit beschränkter Haftung\nDülmen\n\nDas Gericht beabsichtigt, die Gesellschaft gemäß § 394 FamFG wegen Vermögenslosigkeit zu löschen. Es wird zur Erhebung des Widerspruchs eine Frist von 2 Monaten gesetzt."
    },
    {
      "date": "2025-10-01",
      "id": "132192",
      "original_text": "Registerbekanntmachung nach dem Umwandlungsgesetz\nNordrhein-Westfalen Amtsgericht Coesfeld VR 4143\nSozialdienst katholischer Frauen e.V. Dülmen – Dülmen",
      "type": "Registerbekanntmachung nach dem Umwandlungsgesetz",
      "state": "Nordrhein-Westfalen",
      "amtsgericht": "Amtsgericht Coesfeld",
      "registernummer": "VR 4143",
      "registerart": "VR",
      "company_name": "Sozialdienst katholischer Frauen e.V. Dülmen",
      "company_seat": "Dülmen",
      "details": "01.10.2025 (Bekanntmachungsdatum)\n\nNordrhein-Westfalen Amtsgericht Coesfeld VR 4143\nRegisterbekanntmachung nach dem Umwandlungsgesetz 31.10.2023 (Eintragungsdatum)\n\nSozialdienst katholischer Frauen e.V. Dülmen\n???Global.Rechtsform.???\nDülmen\n\nDen Gläubigern der an der Verschmelzung beteiligten Rechtsträgern ist, wenn sie binnen sechs Monaten nach dem Tag, an dem die Eintragung der Verschmelzung in das Register des Sitzes desjenigen Rechtsträgers, dessen Gläubiger sie sind, nach § 19 Absatz 3 UmwG als bekanntgemacht gilt, ihren Anspruch nach Grund und Höhe schriftlich anmelden, Sicherheit zu leisten, soweit sie nicht Befriedigung verlangen können. Dieses Recht steht den Gläubigern jedoch nur zu, wenn sie glaubhaft machen, dass durch die Verschmelzung die Erfüllung ihrer Forderung gefährdet wird."
    },
    {
      "date": "2025-10-01",
      "id": "132193",
      "original_text": "Registerbekanntmachung nach dem Umwandlungsgesetz\nNordrhein-Westfalen Amtsgericht Coesfeld HRB 20379\nLiesert Bauunternehmen GmbH – Dülmen",
      "type": "Registerbekanntmachung nach dem Umwandlungsgesetz",
      "state": "Nordrhein-Westfalen",
      "amtsgericht": "Amtsgericht Coesfeld",
      "registernummer": "HRB 20379",
      "registerart": "HRB",
      "company_name": "Liesert Bauunternehmen GmbH",
      "company_seat": "Dülmen",
      "details": "01.10.2025 (Bekanntmachungsdatum)\n\nNordrhein-Westfalen Amtsgericht Coesfeld HRB 20379\nRegisterbekanntmachung nach dem Umwandlungsgesetz 02.11.2023 (Eintragungsdatum)\n\nLiesert Bauunternehmen GmbH\nGesellschaft mit beschränkter Haftung\nDülmen\n\nDen Gläubigern der an der Verschmelzung beteiligten Rechtsträger ist, wenn sie binnen sechs Monaten nach dem Tag, an dem die Eintragung der Gesellschaft in das Register des Sitzes /desjenigen Rechtsträgers, dessen Gläubiger/derjenigen Rechtsträger deren Gläubiger sie sind, nach § 19 Absatz 3 UmwG als bekanntgemacht gilt, ihren Anspruch nach Grund und Höhe schriftlich anmelden, Sicherheit zu leisten, soweit sie nicht Befriedigung verlangen können. Dieses Recht steht den Gläubigern jedoch nur zu, wenn sie glaubhaft machen, dass durch die Verschmelzung die Erfüllung ihrer Forderung gefährdet wird."
    },
    {
      "date": "2025-10-01",
      "id": "132194",
      "original_text": "Löschungsankündigung\nNordrhein-Westfalen Amtsgericht Coesfeld HRB 19023\ncompany to cloud GmbH – Gescher",
      "type": "Löschungsankündigung",
      "state": "Nordrhein-Westfalen",
      "amtsgericht": "Amtsgericht Coesfeld",
      "registernummer": "HRB 19023",
      "registerart": "HRB",
      "company_name": "company to cloud GmbH",
      "company_seat": "Gescher",
      "details": "01.10.2025 (Bekanntmachungsdatum)\n\nNordrhein-Westfalen Amtsgericht Coesfeld HRB 19023\nLöschungsankündigung\n\ncompany to cloud GmbH\nGesellschaft mit beschränkter Haftung\nGescher\n\nEs ist beabsichtigt, die Gesellschaft gemäß § 394 FamFG wegen Vermögenslosugkeit zu löschen. Die Widerspruchsfrist beträgt einen Monat."
    },
    {
      "date": "2025-10-01",
      "id": "132195",
      "original_text": "Registerbekanntmachung nach dem Umwandlungsgesetz\nNordrhein-Westfalen Amtsgericht Coesfeld HRB 8670\nLebbing automation & drives GmbH – Bocholt",
      "type": "Registerbekanntmachung nach dem Umwandlungsgesetz",
      "state": "Nordrhein-Westfalen",
      "amtsgericht": "Amtsgericht Coesfeld",
      "registernummer": "HRB 8670",
      "registerart": "HRB",
      "company_name": "Lebbing automation & drives GmbH",
      "company_seat": "Bocholt",
      "details": "01.10.2025 (Bekanntmachungsdatum)\n\nNordrhein-Westfalen Amtsgericht Coesfeld HRB 8670\nRegisterbekanntmachung nach dem Umwandlungsgesetz 03.11.2023 (Eintragungsdatum)\n\nLebbing automation & drives GmbH\nGesellschaft mit beschränkter Haftung\nBocholt\n\nDen Gläubigern der an der Verschmelzung beteiligten Rechtsträger ist, wenn sie binnen sechs Monaten nach dem Tag, an dem die Eintragung der Gesellschaft in das Register des Sitzes /desjenigen Rechtsträgers, dessen Gläubiger/derjenigen Rechtsträger deren Gläubiger sie sind, nach § 19 Absatz 3 UmwG als bekanntgemacht gilt, ihren Anspruch nach Grund und Höhe schriftlich anmelden, Sicherheit zu leisten, soweit sie nicht Befriedigung verlangen können. Dieses Recht steht den Gläubigern jedoch nur zu, wenn sie glaubhaft machen, dass durch die Verschmelzung die Erfüllung ihrer Forderung gefährdet wird."
    },
    {
      "date": "2025-10-01",
      "id": "132196",
      "original_text": "Löschungsankündigung\nNordrhein-Westfalen Amtsgericht Coesfeld HRB 15781\nSchu-Wa UG (haftungsbeschränkt) – Bocholt",
      "type": "Löschungsankündigung",
      "state": "Nordrhein-Westfalen",
      "amtsgericht": "Amtsgericht Coesfeld",
      "registernummer": "HRB 15781",
      "registerart": "HRB",
      "company_name": "Schu-Wa UG (haftungsbeschränkt)",
      "company_seat": "Bocholt",
      "details": "01.10.2025 (Bekanntmachungsdatum)\n\nNordrhein-Westfalen Amtsgericht Coesfeld HRB 15781\nLöschungsankündigung\n\nSchu-Wa UG (haftungsbeschränkt)\nGesellschaft mit beschränkter Haftung\nBocholt\n\nDas Gericht beabsichtigt, die Gesellschaft gemäß § 394 FamFG wegen Vermögenslosigkeit zu löschen. Die Widerspruchsfrist beträgt 2 Monate."
    },
    {
      "date": "2025-10-01",
      "id": "132197",
      "original_text": "Löschungsankündigung\nNordrhein-Westfalen Amtsgericht Coesfeld HRB 12493\nLemon Erlebnisgastronomie GmbH – Dülmen",
      "type": "Löschungsankündigung",
      "state": "Nordrhein-Westfalen",
      "amtsgericht": "Amtsgericht Coesfeld",
      "registernummer": "HRB 12493",
      "registerart": "HRB",
      "company_name": "Lemon Erlebnisgastronomie GmbH",
      "company_seat": "Dülmen",
      "details": "01.10.2025 (Bekanntmachungsdatum)\n\nNordrhein-Westfalen Amtsgericht Coesfeld HRB 12493\nLöschungsankündigung\n\nLemon Erlebnisgastronomie GmbH\nGesellschaft mit beschränkter Haftung\nDülmen\n\nDas Gericht beabsichtigt, die Gesellschaft gemäß § 394 FamFG wegen Vermögenslosigkeitr zu löschen. Die Widerspruchsfrist beträgt 2 Monate."
    },
    {
      "date": "2025-10-01",
      "id": "132198",
      "original_text": "Registerbekanntmachung nach dem Umwandlungsgesetz\nHamburg Amtsgericht Hamburg HRB 173288\n1KOMMA5° Hamburg GmbH – Hamburg",
      "type": "Registerbekanntmachung nach dem Umwandlungsgesetz",
      "state": "Hamburg",
      "amtsgericht": "Amtsgericht Hamburg",
      "registernummer": "HRB 173288",
      "registerart": "HRB",
      "company_name": "1KOMMA5° Hamburg GmbH",
      "company_seat": "Hamburg",
      "details": "01.10.2025 (Bekanntmachungsdatum)\n\nHamburg Amtsgericht Hamburg HRB 173288\nRegisterbekanntmachung nach dem Umwandlungsgesetz 01.10.2025 (Eintragungsdatum)\n\n1KOMMA5° Hamburg GmbH\nGesellschaft mit beschränkter Haftung\nHamburg\n\nAls nicht eingetragen wird bekannt gemacht:\nDen Gläubigern der an der Verschmelzung beteiligten Gesellschaften ist, wenn sie binnen sechs Monaten nach dem Tag, an dem die Eintragung der Verschmelzung in das Register des Sitzes desjenigen Rechtsträgers, dessen Gläubiger sie sind, nach § 19 Absatz 3 UmwG als bekannt gemacht gilt, ihren Anspruch nach Grund und Höhe schriftlich anmelden, Sicherheit zu leisten, soweit sie nicht Befriedigung verlangen können. Dieses Recht steht den Gläubigern jedoch nur zu, wenn sie glaubhaft machen, dass durch die Verschmelzung die Erfüllung ihrer Forderung gefährdet wird."
    },
    {
      "date": "2025-10-01",
      "id": "132199",
      "original_text": "Löschungsankündigung\nNordrhein-Westfalen Amtsgericht Coesfeld HRB 17948\nOrdowski Verwaltungsgesellschaft mbH – Raesfeld",
      "type": "Löschungsankündigung",
      "state": "Nordrhein-Westfalen",
      "amtsgericht": "Amtsgericht Coesfeld",
      "registernummer": "HRB 17948",
      "registerart": "HRB",
      "company_name": "Ordowski Verwaltungsgesellschaft mbH",
      "company_seat": "Raesfeld",
      "details": "01.10.2025 (Bekanntmachungsdatum)\n\nNordrhein-Westfalen Amtsgericht Coesfeld HRB 17948\nLöschungsankündigung\n\nOrdowski Verwaltungsgesellschaft mbH\nGesellschaft mit beschränkter Haftung\nRaesfeld\n\nDas Gericht beabsichtigt, die Gesellschaft gemäß § 394 FamFG wegen Vermögenslosigkeit zu löschen. Die Widerspruchsfrist beträgt 2 Monate."
    },
    {
      "date": "2025-10-01",
      "id": "132200",
      "original_text": "Löschungsankündigung\nNordrhein-Westfalen Amtsgericht Coesfeld HRB 12493\nLemon Erlebnisgastronomie GmbH – Dülmen",
      "type": "Löschungsankündigung",
      "state": "Nordrhein-Westfalen",
      "amtsgericht": "Amtsgericht Coesfeld",
      "registernummer": "HRB 12493",
      "registerart": "HRB",
      "company_name": "Lemon Erlebnisgastronomie GmbH",
      "company_seat": "Dülmen",
      "details": "01.10.2025 (Bekanntmachungsdatum)\n\nNordrhein-Westfalen Amtsgericht Coesfeld HRB 12493\nLöschungsankündigung\n\nLemon Erlebnisgastronomie GmbH\nGesellschaft mit beschränkter Haftung\nDülmen\n\nDas Gericht beabsichtigt, die Gesellschaft gemäß § 394 FamFG wegen Vermögenslosigkeit zu löschen. Die Widerspruchsfrist beträgt 2 Monate."
    },
    {
      "date": "2025-10-01",
      "id": "132201",
      "original_text": "Löschungsankündigung\nNordrhein-Westfalen Amtsgericht Coesfeld HRB 17948\nOrdowski Verwaltungsgesellschaft mbH – Raesfeld",
      "type": "Löschungsankündigung",
      "state": "Nordrhein-Westfalen",
      "amtsgericht": "Amtsgericht Coesfeld",
      "registernummer": "HRB 17948",
      "registerart": "HRB",
      "company_name": "Ordowski Verwaltungsgesellschaft mbH",
      "company_seat": "Raesfeld",
      "details": "01.10.2025 (Bekanntmachungsdatum)\n\nNordrhein-Westfalen Amtsgericht Coesfeld HRB 17948\nLöschungsankündigung\n\nOrdowski Verwaltungsgesellschaft mbH\nGesellschaft mit beschränkter Haftung\nRaesfeld\n\nDas Gericht beabsichtigt, die Gesellschaft gemäß § 394 FamFG wegen Vermögenslosigkeit zu löschen. Die Widerspruchsfrist beträgt 2 Monate."
    },
    {
      "date": "2025-10-01",
      "id": "132202",
      "original_text": "Löschungsankündigung\nNordrhein-Westfalen Amtsgericht Coesfeld HRB 17948\nOrdowski Verwaltungsgesellschaft mbH – Raesfeld",
      "type": "Löschungsankündigung",
      "state": "Nordrhein-Westfalen",
      "amtsgericht": "Amtsgericht Coesfeld",
      "registernummer": "HRB 17948",
      "registerart": "HRB",
      "company_name": "Ordowski Verwaltungsgesellschaft mbH",
      "company_seat": "Raesfeld",
      "details": "01.10.2025 (Bekanntmachungsdatum)\n\nNordrhein-Westfalen Amtsgericht Coesfeld HRB 17948\nLöschungsankündigung\n\nOrdowski Verwaltungsgesellschaft mbH\nGesellschaft mit beschränkter Haftung\nRaesfeld\n\nDas Gericht beabsichtigt, die Gesellschaft gemäß § 394 FamFG wegen Vermögenslosigkeit zu löschen. Die Widerspruchsfrist beträgt 2 Monate."
    },
    {
      "date": "2025-10-01",
      "id": "132203",
      "original_text": "Löschungsankündigung\nNordrhein-Westfalen Amtsgericht Coesfeld HRB 12493\nLemon Erlebnisgastronomie GmbH – Dülmen",
      "type": "Löschungsankündigung",
      "state": "Nordrhein-Westfalen",
      "amtsgericht": "Amtsgericht Coesfeld",
      "registernummer": "HRB 12493",
      "registerart": "HRB",
      "company_name": "Lemon Erlebnisgastronomie GmbH",
      "company_seat": "Dülmen",
      "details": "01.10.2025 (Bekanntmachungsdatum)\n\nNordrhein-Westfalen Amtsgericht Coesfeld HRB 12493\nLöschungsankündigung\n\nLemon Erlebnisgastronomie GmbH\nGesellschaft mit beschränkter Haftung\nDülmen\n\nDas Gericht beabsichtigt, die Gesellschaft gemäß § 394 FamFG wegen Vermögenslosigkeit zu löschen. Die Widerspruchsfrist beträgt 2 Monate."
    },
    {
      "date": "2025-10-01",
      "id": "132204",
      "original_text": "Sonstige Registerbekanntmachung\nNordrhein-Westfalen Amtsgericht Coesfeld HRB 2073\nChristophorus Trägergesellschaft mbH – Coesfeld",
      "type": "Sonstige Registerbekanntmachung",
      "state": "Nordrhein-Westfalen",
      "amtsgericht": "Amtsgericht Coesfeld",
      "registernummer": "HRB 2073",
      "registerart": "HRB",
      "company_name": "Christophorus Trägergesellschaft mbH",
      "company_seat": "Coesfeld",
      "details": "01.10.2025 (Bekanntmachungsdatum)\n\nNordrhein-Westfalen Amtsgericht Coesfeld HRB 2073\nSonstige Registerbekanntmachung\n\nChristophorus Trägergesellschaft mbH\nGesellschaft mit beschränkter Haftung\nCoesfeld\n\nDem Registergericht wurde eine Liste der Mitglieder des Aufsichtsrates eingereicht."
    },
    {
      "date": "2025-10-01",
      "id": "132205",
      "original_text": "Sonstige Registerbekanntmachung\nNordrhein-Westfalen Amtsgericht Coesfeld HRB 10477\nKlinik am Schlossgarten Dülmen GmbH – Dülmen",
      "type": "Sonstige Registerbekanntmachung",
      "state": "Nordrhein-Westfalen",
      "amtsgericht": "Amtsgericht Coesfeld",
      "registernummer": "HRB 10477",
      "registerart": "HRB",
      "company_name": "Klinik am Schlossgarten Dülmen GmbH",
      "company_seat": "Dülmen",
      "details": "01.10.2025 (Bekanntmachungsdatum)\n\nNordrhein-Westfalen Amtsgericht Coesfeld HRB 10477\nSonstige Registerbekanntmachung\n\nKlinik am Schlossgarten Dülmen GmbH\nGesellschaft mit beschränkter Haftung\nDülmen\n\nDem Registergericht ist eine Liste der Mitglieder des Aufsichtsrates eingereicht worden."
    },
    {
      "date": "2025-10-01",
      "id": "132206",
      "original_text": "Registerbekanntmachung nach dem Umwandlungsgesetz\nNordrhein-Westfalen Amtsgericht Coesfeld HRB 21381\nWoltering-Sonntag & Holt Versicherungsvermittlungs GmbH – Ahaus",
      "type": "Registerbekanntmachung nach dem Umwandlungsgesetz",
      "state": "Nordrhein-Westfalen",
      "amtsgericht": "Amtsgericht Coesfeld",
      "registernummer": "HRB 21381",
      "registerart": "HRB",
      "company_name": "Woltering-Sonntag & Holt Versicherungsvermittlungs GmbH",
      "company_seat": "Ahaus",
      "details": "01.10.2025 (Bekanntmachungsdatum)\n\nNordrhein-Westfalen Amtsgericht Coesfeld HRB 21381\nRegisterbekanntmachung nach dem Umwandlungsgesetz 07.11.2023 (Eintragungsdatum)\n\nWoltering-Sonntag & Holt Versicherungsvermittlungs GmbH\nGesellschaft mit beschränkter Haftung\nAhaus\n\nDen Gläubigern der an der Ausgliederung beteiligten Rechtsträger ist, wenn sie binnen sechs Monaten nach dem Tag, an dem die Eintragung der Gesellschaft in das Register des Sitzes /desjenigen Rechtsträgers, dessen Gläubiger/derjenigen Rechtsträger deren Gläubiger sie sind, nach § 19 Absatz 3 UmwG als bekanntgemacht gilt, ihren Anspruch nach Grund und Höhe schriftlich anmelden, Sicherheit zu leisten, soweit sie nicht Befriedigung verlangen können. Dieses Recht steht den Gläubigern jedoch nur zu, wenn sie glaubhaft machen, dass durch die Ausgliederung die Erfüllung ihrer Forderung gefährdet wird."
    },
    {
      "date": "2025-10-01",
      "id": "132207",
      "original_text": "Sonstige Registerbekanntmachung\nNordrhein-Westfalen Amtsgericht Coesfeld HRB 10477\nKlinik am Schlossgarten Dülmen GmbH – Dülmen",
      "type": "Sonstige Registerbekanntmachung",
      "state": "Nordrhein-Westfalen",
      "amtsgericht": "Amtsgericht Coesfeld",
      "registernummer": "HRB 10477",
      "registerart": "HRB",
      "company_name": "Klinik am Schlossgarten Dülmen GmbH",
      "company_seat": "Dülmen",
      "details": "01.10.2025 (Bekanntmachungsdatum)\n\nNordrhein-Westfalen Amtsgericht Coesfeld HRB 10477\nSonstige Registerbekanntmachung\n\nKlinik am Schlossgarten Dülmen GmbH\nGesellschaft mit beschränkter Haftung\nDülmen\n\nDem Registergericht wurde eine Liste der Aufsichtsratsmitglieder eingereicht."
    },
    {
      "date": "2025-10-01",
      "id": "132208",
      "original_text": "Sonstige Registerbekanntmachung\nNordrhein-Westfalen Amtsgericht Coesfeld HRB 10477\nKlinik am Schlossgarten Dülmen GmbH – Dülmen",
      "type": "Sonstige Registerbekanntmachung",
      "state": "Nordrhein-Westfalen",
      "amtsgericht": "Amtsgericht Coesfeld",
      "registernummer": "HRB 10477",
      "registerart": "HRB",
      "company_name": "Klinik am Schlossgarten Dülmen GmbH",
      "company_seat": "Dülmen",
      "details": "01.10.2025 (Bekanntmachungsdatum)\n\nNordrhein-Westfalen Amtsgericht Coesfeld HRB 10477\nSonstige Registerbekanntmachung\n\nKlinik am Schlossgarten Dülmen GmbH\nGesellschaft mit beschränkter Haftung\nDülmen\n\nDem Handelsregister wurde eine Liste der Aufsichtsratsmitglieder eingereicht."
    },
    {
      "date": "2025-10-01",
      "id": "132209",
      "original_text": "Sonstige Registerbekanntmachung\nNordrhein-Westfalen Amtsgericht Coesfeld HRB 10477\nKlinik am Schlossgarten Dülmen GmbH – Dülmen",
      "type": "Sonstige Registerbekanntmachung",
      "state": "Nordrhein-Westfalen",
      "amtsgericht": "Amtsgericht Coesfeld",
      "registernummer": "HRB 10477",
      "registerart": "HRB",
      "company_name": "Klinik am Schlossgarten Dülmen GmbH",
      "company_seat": "Dülmen",
      "details": "01.10.2025 (Bekanntmachungsdatum)\n\nNordrhein-Westfalen Amtsgericht Coesfeld HRB 10477\nSonstige Registerbekanntmachung\n\nKlinik am Schlossgarten Dülmen GmbH\nGesellschaft mit beschränkter Haftung\nDülmen\n\nDem Registergericht wurde eine Liste der Aufsichtsratsmitglieder eingereicht"
    },
    {
      "date": "2025-10-01",
      "id": "132210",
      "original_text": "Löschungsankündigung\nNordrhein-Westfalen Amtsgericht Coesfeld HRB 18256\nPHS Deutschland Ltd Zweigniederlassung – London",
      "type": "Löschungsankündigung",
      "state": "Nordrhein-Westfalen",
      "amtsgericht": "Amtsgericht Coesfeld",
      "registernummer": "HRB 18256",
      "registerart": "HRB",
      "company_name": "PHS Deutschland Ltd Zweigniederlassung",
      "company_seat": "London",
      "details": "01.10.2025 (Bekanntmachungsdatum)\n\nNordrhein-Westfalen Amtsgericht Coesfeld HRB 18256\nLöschungsankündigung\n\nPHS Deutschland Ltd Zweigniederlassung\n???Global.Rechtsform.???\nLondon\n\nDas Gericht beabsichtigt, die Gesellschaft gemäß § 395 FamFG zu löschen, weil die Eintragung infolge des am 01.01.2021 wirksam gewordenen Brexit unzulässig geworden ist.\nDie Widerspruchsfrist beträgt 2 Monate."
    },
    {
      "date": "2025-10-01",
      "id": "132211",
      "original_text": "Registerbekanntmachung nach dem Umwandlungsgesetz\nNordrhein-Westfalen Amtsgericht Coesfeld HRA 9521\nBlickfelder GmbH & Co. KG – Billerbeck",
      "type": "Registerbekanntmachung nach dem Umwandlungsgesetz",
      "state": "Nordrhein-Westfalen",
      "amtsgericht": "Amtsgericht Coesfeld",
      "registernummer": "HRA 9521",
      "registerart": "HRA",
      "company_name": "Blickfelder GmbH & Co. KG",
      "company_seat": "Billerbeck",
      "details": "01.10.2025 (Bekanntmachungsdatum)\n\nNordrhein-Westfalen Amtsgericht Coesfeld HRA 9521\nRegisterbekanntmachung nach dem Umwandlungsgesetz 22.11.2023 (Eintragungsdatum)\n\nBlickfelder GmbH & Co. KG\nKommanditgesellschaft\nBillerbeck\n\nDen Gläubigern der an der Verschmelzung beteiligten Rechtsträger ist, wenn sie binnen sechs Monaten nach dem Tag, an dem die Eintragung der Verschmelzung in das Register des Sitzes derjenigen Rechtsträger, deren Gläubiger sie sind, nach § 19 Absatz 3 UmwG als bekanntgemacht gilt, ihren Anspruch nach Grund und Höhe schriftlich anmelden, Sicherheit zu leisten, soweit sie nicht Befriedigung verlangen können. Dieses Recht steht den Gläubigern jedoch nur zu, wenn sie glaubhaft machen, dass durch die Verschmelzung die Erfüllung ihrer Forderung gefährdet wird."
    },
    {
      "date": "2025-10-01",
      "id": "132212",
      "original_text": "Registerbekanntmachung nach dem Umwandlungsgesetz\nNordrhein-Westfalen Amtsgericht Coesfeld HRB 21634\nUWG GmbH – Rhede",
      "type": "Registerbekanntmachung nach dem Umwandlungsgesetz",
      "state": "Nordrhein-Westfalen",
      "amtsgericht": "Amtsgericht Coesfeld",
      "registernummer": "HRB 21634",
      "registerart": "HRB",
      "company_name": "UWG GmbH",
      "company_seat": "Rhede",
      "details": "01.10.2025 (Bekanntmachungsdatum)\n\nNordrhein-Westfalen Amtsgericht Coesfeld HRB 21634\nRegisterbekanntmachung nach dem Umwandlungsgesetz 22.11.2023 (Eintragungsdatum)\n\nUWG GmbH\nGesellschaft mit beschränkter Haftung\nRhede\n\nDen Gläubigern der an der Abspaltung beteiligten Rechtsträger ist, wenn sie binnen sechs Monaten nach dem Tag, an dem die Eintragung der Gesellschaft in das Register des Sitzes /desjenigen Rechtsträgers, dessen Gläubiger/derjenigen Rechtsträger deren Gläubiger sie sind, nach § 19 Absatz 3 UmwG als bekanntgemacht gilt, ihren Anspruch nach Grund und Höhe schriftlich anmelden, Sicherheit zu leisten, soweit sie nicht Befriedigung verlangen können. Dieses Recht steht den Gläubigern jedoch nur zu, wenn sie glaubhaft machen, dass durch die Abspaltung die Erfüllung ihrer Forderung gefährdet wird."
    },
    {
      "date": "2025-10-01",
      "id": "132213",
      "original_text": "Registerbekanntmachung nach dem Umwandlungsgesetz\nNordrhein-Westfalen Amtsgericht Coesfeld HRB 19974\nKuhlmann-Cars Manufaktur GmbH – Heiden",
      "type": "Registerbekanntmachung nach dem Umwandlungsgesetz",
      "state": "Nordrhein-Westfalen",
      "amtsgericht": "Amtsgericht Coesfeld",
      "registernummer": "HRB 19974",
      "registerart": "HRB",
      "company_name": "Kuhlmann-Cars Manufaktur GmbH",
      "company_seat": "Heiden",
      "details": "01.10.2025 (Bekanntmachungsdatum)\n\nNordrhein-Westfalen Amtsgericht Coesfeld HRB 19974\nRegisterbekanntmachung nach dem Umwandlungsgesetz 23.11.2023 (Eintragungsdatum)\n\nKuhlmann-Cars Manufaktur GmbH\nGesellschaft mit beschränkter Haftung\nHeiden\n\nDen Gläubigern der an der Verschmelzung beteiligten Rechtsträger ist, wenn sie binnen sechs Monaten nach dem Tag, an dem die Eintragung der Gesellschaft in das Register des Sitzes /desjenigen Rechtsträgers, dessen Gläubiger/derjenigen Rechtsträger deren Gläubiger sie sind, nach § 19 Absatz 3 UmwG als bekanntgemacht gilt, ihren Anspruch nach Grund und Höhe schriftlich anmelden, Sicherheit zu leisten, soweit sie nicht Befriedigung verlangen können. Dieses Recht steht den Gläubigern jedoch nur zu, wenn sie glaubhaft machen, dass durch die Verschmelzung die Erfüllung ihrer Forderung gefährdet wird."
    },
    {
      "date": "2025-10-01",
      "id": "132214",
      "original_text": "Registerbekanntmachung nach dem Umwandlungsgesetz\nNordrhein-Westfalen Amtsgericht Coesfeld HRB 5211\nKuhlmann-Cars GmbH – Heiden",
      "type": "Registerbekanntmachung nach dem Umwandlungsgesetz",
      "state": "Nordrhein-Westfalen",
      "amtsgericht": "Amtsgericht Coesfeld",
      "registernummer": "HRB 5211",
      "registerart": "HRB",
      "company_name": "Kuhlmann-Cars GmbH",
      "company_seat": "Heiden",
      "details": "01.10.2025 (Bekanntmachungsdatum)\n\nNordrhein-Westfalen Amtsgericht Coesfeld HRB 5211\nRegisterbekanntmachung nach dem Umwandlungsgesetz 30.11.2023 (Eintragungsdatum)\n\nKuhlmann-Cars GmbH\nGesellschaft mit beschränkter Haftung\nHeiden\n\nDen Gläubigern der an der Verschmelzung beteiligten Rechtsträger ist, wenn sie binnen sechs Monaten nach dem Tag, an dem die Eintragung der Gesellschaft in das Register des Sitzes /desjenigen Rechtsträgers, dessen Gläubiger/derjenigen Rechtsträger deren Gläubiger sie sind, nach § 19 Absatz 3 UmwG als bekanntgemacht gilt, ihren Anspruch nach Grund und Höhe schriftlich anmelden, Sicherheit zu leisten, soweit sie nicht Befriedigung verlangen können. Dieses Recht steht den Gläubigern jedoch nur zu, wenn sie glaubhaft machen, dass durch die Verschmelzung die Erfüllung ihrer Forderung gefährdet wird."
    },
    {
      "date": "2025-10-01",
      "id": "132215",
      "original_text": "Registerbekanntmachung nach dem Umwandlungsgesetz\nNordrhein-Westfalen Amtsgericht Coesfeld HRB 17155\nTri-Tech-Solar UG (haftungsbeschränkt) – Stadtlohn",
      "type": "Registerbekanntmachung nach dem Umwandlungsgesetz",
      "state": "Nordrhein-Westfalen",
      "amtsgericht": "Amtsgericht Coesfeld",
      "registernummer": "HRB 17155",
      "registerart": "HRB",
      "company_name": "Tri-Tech-Solar UG (haftungsbeschränkt)",
      "company_seat": "Stadtlohn",
      "details": "01.10.2025 (Bekanntmachungsdatum)\n\nNordrhein-Westfalen Amtsgericht Coesfeld HRB 17155\nRegisterbekanntmachung nach dem Umwandlungsgesetz 06.12.2023 (Eintragungsdatum)\n\nTri-Tech-Solar UG (haftungsbeschränkt)\nGesellschaft mit beschränkter Haftung\nStadtlohn\n\nDen Gläubigern der an der Verschmelzung beteiligten Rechtsträger ist, wenn sie binnen sechs Monaten nach dem Tag, an dem die Eintragung der Gesellschaft in das Register des Sitzes /desjenigen Rechtsträgers, dessen Gläubiger/derjenigen Rechtsträger deren Gläubiger sie sind, nach § 19 Absatz 3 UmwG als bekanntgemacht gilt, ihren Anspruch nach Grund und Höhe schriftlich anmelden, Sicherheit zu leisten, soweit sie nicht Befriedigung verlangen können. Dieses Recht steht den Gläubigern jedoch nur zu, wenn sie glaubhaft machen, dass durch die Verschmelzung die Erfüllung ihrer Forderung gefährdet wird."
    },
    {
      "date": "2025-10-01",
      "id": "132216",
      "original_text": "Registerbekanntmachung nach dem Umwandlungsgesetz\nNordrhein-Westfalen Amtsgericht Coesfeld HRB 10705\nAFS Solar-Lufttechnik Verwaltungs-GmbH – Stadtlohn",
      "type": "Registerbekanntmachung nach dem Umwandlungsgesetz",
      "state": "Nordrhein-Westfalen",
      "amtsgericht": "Amtsgericht Coesfeld",
      "registernummer": "HRB 10705",
      "registerart": "HRB",
      "company_name": "AFS Solar-Lufttechnik Verwaltungs-GmbH",
      "company_seat": "Stadtlohn",
      "details": "01.10.2025 (Bekanntmachungsdatum)\n\nNordrhein-Westfalen Amtsgericht Coesfeld HRB 10705\nRegisterbekanntmachung nach dem Umwandlungsgesetz 06.12.2023 (Eintragungsdatum)\n\nAFS Solar-Lufttechnik Verwaltungs-GmbH\nGesellschaft mit beschränkter Haftung\nStadtlohn\n\nDen Gläubigern der an der Verschmelzung beteiligten Rechtsträger ist, wenn sie binnen sechs Monaten nach dem Tag, an dem die Eintragung der Gesellschaft in das Register des Sitzes /desjenigen Rechtsträgers, dessen Gläubiger/derjenigen Rechtsträger deren Gläubiger sie sind, nach § 19 Absatz 3 UmwG als bekanntgemacht gilt, ihren Anspruch nach Grund und Höhe schriftlich anmelden, Sicherheit zu leisten, soweit sie nicht Befriedigung verlangen können. Dieses Recht steht den Gläubigern jedoch nur zu, wenn sie glaubhaft machen, dass durch die Verschmelzung die Erfüllung ihrer Forderung gefährdet wird."
    },
    {
      "date": "2025-10-01",
      "id": "132217",
      "original_text": "Registerbekanntmachung nach dem Umwandlungsgesetz\nNordrhein-Westfalen Amtsgericht Coesfeld HRA 9763\nSandkuhle GmbH & Co. KG – Ahaus",
      "type": "Registerbekanntmachung nach dem Umwandlungsgesetz",
      "state": "Nordrhein-Westfalen",
      "amtsgericht": "Amtsgericht Coesfeld",
      "registernummer": "HRA 9763",
      "registerart": "HRA",
      "company_name": "Sandkuhle GmbH & Co. KG",
      "company_seat": "Ahaus",
      "details": "01.10.2025 (Bekanntmachungsdatum)\n\nNordrhein-Westfalen Amtsgericht Coesfeld HRA 9763\nRegisterbekanntmachung nach dem Umwandlungsgesetz 07.12.2023 (Eintragungsdatum)\n\nSandkuhle GmbH & Co. KG\nKommanditgesellschaft\nAhaus\n\nDen Gläubigern der an der Ausgliederung beteiligten Rechtsträger ist, wenn sie binnen sechs Monaten nach dem Tag, an dem die Eintragung der Ausgliederung in das Register des Sitzes derjenigen Rechtsträger dessen Gläubiger sie sind, nach § 19 Absatz 3 UmwG als bekanntgemacht gilt, ihren Anspruch nach Grund und Höhe schriftlich anmelden, Sicherheit zu leisten, soweit sie nicht Befriedigung verlangen können. Dieses Recht steht den Gläubigern jedoch nur zu, wenn sie glaubhaft machen, dass durch die Ausgliederung die Erfüllung ihrer Forderung gefährdet wird."
    },
    {
      "date": "2025-10-01",
      "id": "132218",
      "original_text": "Einreichung neuer Dokumente\nNordrhein-Westfalen Amtsgericht Coesfeld HRB 9854\nSt. Ludgerus-Stift Billerbeck gemeinnützige GmbH – Billerbeck",
      "type": "Einreichung neuer Dokumente",
      "state": "Nordrhein-Westfalen",
      "amtsgericht": "Amtsgericht Coesfeld",
      "registernummer": "HRB 9854",
      "registerart": "HRB",
      "company_name": "St. Ludgerus-Stift Billerbeck gemeinnützige GmbH",
      "company_seat": "Billerbeck",
      "details": "01.10.2025 (Bekanntmachungsdatum)\n\nNordrhein-Westfalen Amtsgericht Coesfeld HRB 9854\nEinreichung neuer Dokumente\n\nSt. Ludgerus-Stift Billerbeck gemeinnützige GmbH\nGesellschaft mit beschränkter Haftung\nBillerbeck\n\nDem Registergericht ist eine Liste der Mitglieder des Aufsichtsrates eingereicht worden."
    },
    {
      "date": "2025-10-01",
      "id": "132219",
      "original_text": "Registerbekanntmachung nach dem Umwandlungsgesetz\nNordrhein-Westfalen Amtsgericht Coesfeld HRA 2866\nHermann Sandkuhle e. K. – Ahaus",
      "type": "Registerbekanntmachung nach dem Umwandlungsgesetz",
      "state": "Nordrhein-Westfalen",
      "amtsgericht": "Amtsgericht Coesfeld",
      "registernummer": "HRA 2866",
      "registerart": "HRA",
      "company_name": "Hermann Sandkuhle e. K.",
      "company_seat": "Ahaus",
      "details": "01.10.2025 (Bekanntmachungsdatum)\n\nNordrhein-Westfalen Amtsgericht Coesfeld HRA 2866\nRegisterbekanntmachung nach dem Umwandlungsgesetz 07.12.2023 (Eintragungsdatum)\n\nHermann Sandkuhle e. K.\nEinzelkaufmann\nAhaus\n\nDen Gläubigern der an der Ausgliederung beteiligten Rechtsträger ist, wenn sie binnen sechs Monaten nach dem Tag, an dem die Eintragung der Ausgliederung in das Register des Sitzes derjenigen Rechtsträger dessen Gläubiger sie sind, nach § 19 Absatz 3 UmwG als bekanntgemacht gilt, ihren Anspruch nach Grund und Höhe schriftlich anmelden, Sicherheit zu leisten, soweit sie nicht Befriedigung verlangen können. Dieses Recht steht den Gläubigern jedoch nur zu, wenn sie glaubhaft machen, dass durch die Ausgliederung die Erfüllung ihrer Forderung gefährdet wird."
    },
    {
      "date": "2025-10-01",
      "id": "132220",
      "original_text": "Löschungsankündigung\nNordrhein-Westfalen Amtsgericht Coesfeld HRA 3054\nWessing Bad + Heizung GmbH & Co. KG – Borken",
      "type": "Löschungsankündigung",
      "state": "Nordrhein-Westfalen",
      "amtsgericht": "Amtsgericht Coesfeld",
      "registernummer": "HRA 3054",
      "registerart": "HRA",
      "company_name": "Wessing Bad + Heizung GmbH & Co. KG",
      "company_seat": "Borken",
      "details": "01.10.2025 (Bekanntmachungsdatum)\n\nNordrhein-Westfalen Amtsgericht Coesfeld HRA 3054\nLöschungsankündigung\n\nWessing Bad + Heizung GmbH & Co. KG\nKommanditgesellschaft\nBorken\n\nDas Registergericht beabsichtigt, die im Handelsregister eingetragene Gesellschaft Wessing Bad + Heizung GmbH & Co KG gemäß § 394 Absatz 4, Absatz 1 FamFG wegen Vermögenslosigkeit zu löschen, nachdem das Insolvenzverfahren über das Vermögen der Gesellschaft aufgehoben worden ist und der persönlich haftenden Gesellschafter – die Wessing Bad + Heizung Verwaltungs-GmbH – bereits am 24.11.2022 wegen Vermögenslosigkeit von Amts wegen im Handelsregister gelöscht worden ist. Die Frist zur Erhebung des Widerspruchs gegen die beabsichtigte Löschung von Amts wegen wird auf einen Monat festgesetzt.\nRechtsbehelfsbelehrung: Gegen diese Verfügung kann Widerspruch eingelegt werden. Der Widerspruch ist innerhalb von einem Monat bei dem Amtsgericht Coesfeld, Friedrich-Ebert-Straße 6,, 48653 Coesfeld, einzulegen.\nDer Widerspruch wird durch Einreichung einer Widerspruchsschrift oder zur Niederschrift der Geschäftsstelle des genannten Gerichts eingelegt. Er kann auch zur Niederschrift der Geschäftsstelle eines jeden Amtsgerichts erklärt werden. Die Einlegung kann auch mittels elektronischen Dokuments erfolgen. Informationen zu den weiteren Voraussetzungen zur Signatur und Übermittlung sind auf dem Justizportal des Bundes und der Länder (www.justiz.de) im Themenbereich zur elektronischen Kommunikation zu finden. Eine Einlegung per einfacher E Mail ist unzulässig. Rechtsanwältinnen, Rechtsanwälte, Behörden und juristische Personen des öffentlichen Rechts einschließlich der zur Erfüllung ihrer öffentlichen Aufgaben gebildeten Zusammenschlüsse sind zur Einlegung mittels elektronischen Dokuments verpflichtet."
    },
    {
      "date": "2025-10-01",
      "id": "132221",
      "original_text": "Registerbekanntmachung nach dem Umwandlungsgesetz\nNordrhein-Westfalen Amtsgericht Coesfeld HRA 9930\nMichael Tebbe e.K. – Gronau (Westfalen)",
      "type": "Registerbekanntmachung nach dem Umwandlungsgesetz",
      "state": "Nordrhein-Westfalen",
      "amtsgericht": "Amtsgericht Coesfeld",
      "registernummer": "HRA 9930",
      "registerart": "HRA",
      "company_name": "Michael Tebbe e.K.",
      "company_seat": "Gronau (Westfalen)",
      "details": "01.10.2025 (Bekanntmachungsdatum)\n\nNordrhein-Westfalen Amtsgericht Coesfeld HRA 9930\nRegisterbekanntmachung nach dem Umwandlungsgesetz 26.09.2024 (Eintragungsdatum)\n\nMichael Tebbe e.K.\nEinzelkaufmann\nGronau (Westfalen)\n\nDen Gläubigern der an der Ausgliederung beteiligten Rechtsträger ist, wenn sie binnen sechs Monaten nach dem Tag, an dem die Eintragung der Ausgliederung in das Register des Sitzes desjenigen Rechtsträgers, dessen Gläubiger sie sind, nach § 19 Absatz 3 UmwG als bekanntgemacht gilt, ihren Anspruch nach Grund und Höhe schriftlich anmelden, Sicherheit zu leisten, soweit sie nicht Befriedigung verlangen können. Dieses Recht steht den Gläubigern jedoch nur zu, wenn sie glaubhaft machen, dass durch die Ausgliederung die Erfüllung ihrer Forderung gefährdet wird."
    },
    {
      "date": "2025-10-01",
      "id": "132222",
      "original_text": "Registerbekanntmachung nach dem Umwandlungsgesetz\nNordrhein-Westfalen Amtsgericht Coesfeld HRA 9990\nTebbe GmbH & Co. KG – Gronau",
      "type": "Registerbekanntmachung nach dem Umwandlungsgesetz",
      "state": "Nordrhein-Westfalen",
      "amtsgericht": "Amtsgericht Coesfeld",
      "registernummer": "HRA 9990",
      "registerart": "HRA",
      "company_name": "Tebbe GmbH & Co. KG",
      "company_seat": "Gronau",
      "details": "01.10.2025 (Bekanntmachungsdatum)\n\nNordrhein-Westfalen Amtsgericht Coesfeld HRA 9990\nRegisterbekanntmachung nach dem Umwandlungsgesetz 27.09.2024 (Eintragungsdatum)\n\nTebbe GmbH & Co. KG\nKommanditgesellschaft\nGronau\n\nDen Gläubigern der an der Ausgliederung beteiligten Rechtsträger ist, wenn sie binnen sechs Monaten nach dem Tag, an dem die Eintragung der Ausgliederung in das Register des Sitzes derjenigen Rechtsträger deren Gläubiger sie sind, nach § 19 Absatz 3 UmwG als bekanntgemacht gilt, ihren Anspruch nach Grund und Höhe schriftlich anmelden, Sicherheit zu leisten, soweit sie nicht Befriedigung verlangen können. Dieses Recht steht den Gläubigern jedoch nur zu, wenn sie glaubhaft machen, dass durch die Ausgliederung die Erfüllung ihrer Forderung gefährdet wird."
    },
    {
      "date": "2025-10-01",
      "id": "132223",
      "original_text": "Registerbekanntmachung nach dem Umwandlungsgesetz\nSchleswig-Holstein Amtsgericht Lübeck HRA 11045\nCMIT Systemhaus Mandryka & Mandryka OHG – Bad Schwartau",
      "type": "Registerbekanntmachung nach dem Umwandlungsgesetz",
      "state": "Schleswig-Holstein",
      "amtsgericht": "Amtsgericht Lübeck",
      "registernummer": "HRA 11045",
      "registerart": "HRA",
      "company_name": "CMIT Systemhaus Mandryka & Mandryka OHG",
      "company_seat": "Bad Schwartau",
      "details": "01.10.2025 (Bekanntmachungsdatum)\n\nSchleswig-Holstein Amtsgericht Lübeck HRA 11045\nRegisterbekanntmachung nach dem Umwandlungsgesetz 30.09.2025 (Eintragungsdatum)\n\nCMIT Systemhaus Mandryka & Mandryka OHG\nOffene Handelsgesellschaft\nBad Schwartau\n\nZu Eintragungsnummer 2 vom 30.09.2025 wird als nicht eingetragen veröffentlicht:  Den Gläubigern ist, wenn sie binnen sechs Monaten nach dem Tag, an dem die Eintragung der Umwandlung als bekannt gemacht gilt, ihren Anspruch nach Grund und Höhe schriftlich anmelden, Sicherheit zu leisten, soweit sie nicht Befriedigung verlangen können. Dieses Recht steht den Gläubigern jedoch nur zu, wenn sie glaubhaft machen, dass durch die Umwandlung die Erfüllung ihrer Forderung gefährdet wird."
    },
    {
      "date": "2025-10-01",
      "id": "132224",
      "original_text": "Löschungsankündigung\nBerlin Amtsgericht Berlin (Charlottenburg) HRB 165433\nNetber Deutschland GmbH – Berlin",
      "type": "Löschungsankündigung",
      "state": "Berlin",
      "amtsgericht": "Amtsgericht Berlin (Charlottenburg)",
      "registernummer": "HRB 165433",
      "registerart": "HRB",
      "company_name": "Netber Deutschland GmbH",
      "company_seat": "Berlin",
      "details": "01.10.2025 (Bekanntmachungsdatum)\n\nBerlin Amtsgericht Berlin (Charlottenburg) HRB 165433\nLöschungsankündigung\n\nNetber Deutschland GmbH\nGesellschaft mit beschränkter Haftung\nBerlin\n\nBei der nachstehenden Gesellschaft wird das Amtslöschungsverfahren gemäß § 394 FamFG eingeleitet. Widerspruchsfrist 6 Wochen"
    },
    {
      "date": "2025-10-01",
      "id": "132225",
      "original_text": "Registerbekanntmachung nach dem Umwandlungsgesetz\nNordrhein-Westfalen Amtsgericht Coesfeld HRB 17488\nTen Brinke Grundbesitz Baden-Württemberg GmbH – Bocholt",
      "type": "Registerbekanntmachung nach dem Umwandlungsgesetz",
      "state": "Nordrhein-Westfalen",
      "amtsgericht": "Amtsgericht Coesfeld",
      "registernummer": "HRB 17488",
      "registerart": "HRB",
      "company_name": "Ten Brinke Grundbesitz Baden-Württemberg GmbH",
      "company_seat": "Bocholt",
      "details": "01.10.2025 (Bekanntmachungsdatum)\n\nNordrhein-Westfalen Amtsgericht Coesfeld HRB 17488\nRegisterbekanntmachung nach dem Umwandlungsgesetz 01.10.2025 (Eintragungsdatum)\n\nTen Brinke Grundbesitz Baden-Württemberg GmbH\nGesellschaft mit beschränkter Haftung\nBocholt\n\nDen Gläubigern der an der Verschmelzung beteiligten Rechtsträger ist, wenn sie binnen sechs Monaten nach dem Tag, an dem die Eintragung der Verschmelzung in das Register des Sitzes derjenigen Rechtsträger deren Gläubiger sie sind, nach § 19 Absatz 3 UmwG als bekanntgemacht gilt, ihren Anspruch nach Grund und Höhe schriftlich anmelden, Sicherheit zu leisten, soweit sie nicht Befriedigung verlangen können. Dieses Recht steht den Gläubigern jedoch nur zu, wenn sie glaubhaft machen, dass durch die Verschmelzung die Erfüllung ihrer Forderung gefährdet wird."
    },
    {
      "date": "2025-10-01",
      "id": "132226",
      "original_text": "Registerbekanntmachung nach dem Umwandlungsgesetz\nBaden-Württemberg Amtsgericht Stuttgart HRB 253329\nLEWA GmbH – Leonberg",
      "type": "Registerbekanntmachung nach dem Umwandlungsgesetz",
      "state": "Baden-Württemberg",
      "amtsgericht": "Amtsgericht Stuttgart",
      "registernummer": "HRB 253329",
      "registerart": "HRB",
      "company_name": "LEWA GmbH",
      "company_seat": "Leonberg",
      "details": "01.10.2025 (Bekanntmachungsdatum)\n\nBaden-Württemberg Amtsgericht Stuttgart HRB 253329\nRegisterbekanntmachung nach dem Umwandlungsgesetz 01.10.2025 (Eintragungsdatum)\n\nLEWA GmbH\nGesellschaft mit beschränkter Haftung\nLeonberg\n\nDen Gläubigern der an der Ausgliederung beteiligten Rechtsträger ist, wenn sie binnen sechs Monaten nach dem Tag, an dem die Eintragung der Ausgliederung in das Register des Sitzes desjenigen Rechtsträgers, dessen Gläubiger sie sind, nach § 19 Abs. 3 UmwG als bekanntgemacht gilt, ihren Anspruch nach Grund und Höhe schriftlich anmelden, Sicherheit zu leisten, soweit sie nicht Befriedigung verlangen können. Dieses Recht steht den Gläubigern jedoch nur zu, wenn sie glaubhaft machen, dass durch die Ausgliederung die Erfüllung ihrer Forderung gefährdet wird."
    },
    {
      "date": "2025-10-01",
      "id": "132227",
      "original_text": "Registerbekanntmachung nach dem Umwandlungsgesetz\nBerlin Amtsgericht Berlin (Charlottenburg) HRA 63392\nUra Design e.K. – Berlin",
      "type": "Registerbekanntmachung nach dem Umwandlungsgesetz",
      "state": "Berlin",
      "amtsgericht": "Amtsgericht Berlin (Charlottenburg)",
      "registernummer": "HRA 63392",
      "registerart": "HRA",
      "company_name": "Ura Design e.K.",
      "company_seat": "Berlin",
      "details": "01.10.2025 (Bekanntmachungsdatum)\n\nBerlin Amtsgericht Berlin (Charlottenburg) HRA 63392\nRegisterbekanntmachung nach dem Umwandlungsgesetz 30.09.2025 (Eintragungsdatum)\n\nUra Design e.K.\nEinzelkaufmann / Einzelkauffrau\nBerlin\n\nZu Eintragungsnummer 2 vom 30.09.2025 wird als nicht eingetragen veröffentlicht:\nDen Gläubigern der an der Spaltung beteiligten Rechtsträger ist, wenn sie binnen sechs Monaten nach dem Tag, an dem die Eintragung der Spaltung in das Register des Sitzes desjenigen Rechtsträgers, dessen Gläubiger sie sind, als bekannt gemacht gilt, ihren Anspruch nach Grund und Höhe schriftlich anmelden, Sicherheit zu leisten, soweit sie nicht Befriedigung verlangen können. Dieses Recht steht den Gläubigern jedoch nur zu, wenn sie glaubhaft machen, dass durch die Spaltung die Erfüllung ihrer Forderung gefährdet wird. Das Recht, Sicherheitsleistung zu verlangen, steht Gläubigern nicht zu, die im Falle der Insolvenz ein Recht auf vorzugsweise Befriedigung aus einer Deckungsmasse haben, die nach gesetzlicher Vorschrift zu ihrem Schutz errichtet und staatlich überwacht ist."
    },
    {
      "date": "2025-10-01",
      "id": "132228",
      "original_text": "Registerbekanntmachung nach dem Umwandlungsgesetz\nBerlin Amtsgericht Berlin (Charlottenburg) HRB 279684\nUra Design GmbH – Berlin",
      "type": "Registerbekanntmachung nach dem Umwandlungsgesetz",
      "state": "Berlin",
      "amtsgericht": "Amtsgericht Berlin (Charlottenburg)",
      "registernummer": "HRB 279684",
      "registerart": "HRB",
      "company_name": "Ura Design GmbH",
      "company_seat": "Berlin",
      "details": "01.10.2025 (Bekanntmachungsdatum)\n\nBerlin Amtsgericht Berlin (Charlottenburg) HRB 279684\nRegisterbekanntmachung nach dem Umwandlungsgesetz 30.09.2025 (Eintragungsdatum)\n\nUra Design GmbH\nGesellschaft mit beschränkter Haftung\nBerlin\n\nZu Eintragungsnummer 1 vom 30.09.2025 wird als nicht eingetragen veröffentlicht:\nDen Gläubigern der an der Spaltung beteiligten Rechtsträger ist, wenn sie binnen sechs Monaten nach dem Tag, an dem die Eintragung der Spaltung in das Register des Sitzes desjenigen Rechtsträgers, dessen Gläubiger sie sind, als bekannt gemacht gilt, ihren Anspruch nach Grund und Höhe schriftlich anmelden, Sicherheit zu leisten, soweit sie nicht Befriedigung verlangen können. Dieses Recht steht den Gläubigern jedoch nur zu, wenn sie glaubhaft machen, dass durch die Spaltung die Erfüllung ihrer Forderung gefährdet wird. Das Recht, Sicherheitsleistung zu verlangen, steht Gläubigern nicht zu, die im Falle der Insolvenz ein Recht auf vorzugsweise Befriedigung aus einer Deckungsmasse haben, die nach gesetzlicher Vorschrift zu ihrem Schutz errichtet und staatlich überwacht ist."
    },
    {
      "date": "2025-10-01",
      "id": "132229",
      "original_text": "Registerbekanntmachung nach dem Umwandlungsgesetz\nBaden-Württemberg Amtsgericht Stuttgart HRB 253330\nLEWA Solutions GmbH – Leonberg",
      "type": "Registerbekanntmachung nach dem Umwandlungsgesetz",
      "state": "Baden-Württemberg",
      "amtsgericht": "Amtsgericht Stuttgart",
      "registernummer": "HRB 253330",
      "registerart": "HRB",
      "company_name": "LEWA Solutions GmbH",
      "company_seat": "Leonberg",
      "details": "01.10.2025 (Bekanntmachungsdatum)\n\nBaden-Württemberg Amtsgericht Stuttgart HRB 253330\nRegisterbekanntmachung nach dem Umwandlungsgesetz 01.10.2025 (Eintragungsdatum)\n\nLEWA Solutions GmbH\nGesellschaft mit beschränkter Haftung\nLeonberg\n\nDen Gläubigern der an der Ausgliederung beteiligten Rechtsträger ist, wenn sie binnen sechs Monaten nach dem Tag, an dem die Eintragung der Ausgliederung in das Register des Sitzes desjenigen Rechtsträgers, dessen Gläubiger sie sind, nach § 19 Abs. 3 UmwG als bekanntgemacht gilt, ihren Anspruch nach Grund und Höhe schriftlich anmelden, Sicherheit zu leisten, soweit sie nicht Befriedigung verlangen können. Dieses Recht steht den Gläubigern jedoch nur zu, wenn sie glaubhaft machen, dass durch die Ausgliederung die Erfüllung ihrer Forderung gefährdet wird."
    },
    {
      "date": "2025-10-01",
      "id": "132230",
      "original_text": "Registerbekanntmachung nach dem Umwandlungsgesetz\nBaden-Württemberg Amtsgericht Stuttgart HRB 253330\nLEWA Solutions GmbH – Leonberg",
      "type": "Registerbekanntmachung nach dem Umwandlungsgesetz",
      "state": "Baden-Württemberg",
      "amtsgericht": "Amtsgericht Stuttgart",
      "registernummer": "HRB 253330",
      "registerart": "HRB",
      "company_name": "LEWA Solutions GmbH",
      "company_seat": "Leonberg",
      "details": "01.10.2025 (Bekanntmachungsdatum)\n\nBaden-Württemberg Amtsgericht Stuttgart HRB 253330\nRegisterbekanntmachung nach dem Umwandlungsgesetz 01.10.2025 (Eintragungsdatum)\n\nLEWA Solutions GmbH\nGesellschaft mit beschränkter Haftung\nLeonberg\n\nDen Gläubigern der an der Ausgliederung beteiligten Rechtsträger ist, wenn sie binnen sechs Monaten nach dem Tag, an dem die Eintragung der Ausgliederung in das Register des Sitzes desjenigen Rechtsträgers, dessen Gläubiger sie sind, nach § 19 Abs. 3 UmwG als bekanntgemacht gilt, ihren Anspruch nach Grund und Höhe schriftlich anmelden, Sicherheit zu leisten, soweit sie nicht Befriedigung verlangen können. Dieses Recht steht den Gläubigern jedoch nur zu, wenn sie glaubhaft machen, dass durch die Ausgliederung die Erfüllung ihrer Forderung gefährdet wird."
    },
    {
      "date": "2025-10-01",
      "id": "132231",
      "original_text": "Registerbekanntmachung nach dem Umwandlungsgesetz\nBerlin Amtsgericht Berlin (Charlottenburg) HRB 268124\nMokeco Partners GmbH – Berlin",
      "type": "Registerbekanntmachung nach dem Umwandlungsgesetz",
      "state": "Berlin",
      "amtsgericht": "Amtsgericht Berlin (Charlottenburg)",
      "registernummer": "HRB 268124",
      "registerart": "HRB",
      "company_name": "Mokeco Partners GmbH",
      "company_seat": "Berlin",
      "details": "01.10.2025 (Bekanntmachungsdatum)\n\nBerlin Amtsgericht Berlin (Charlottenburg) HRB 268124\nRegisterbekanntmachung nach dem Umwandlungsgesetz 30.09.2025 (Eintragungsdatum)\n\nMokeco Partners GmbH\nGesellschaft mit beschränkter Haftung\nBerlin\n\nZu Eintragungsnummer 2 vom 30.09.2025 wird als nicht eingetragen veröffentlicht:Den Gläubigern der an der Verschmelzung beteiligten Rechtsträger ist, wenn sie binnen sechs Monaten nach dem Tag, an dem die Eintragung der Verschmelzung in das Register des Sitzes desjenigen Rechtsträgers, dessen Gläubiger sie sind, als bekannt gemacht gilt, ihren Anspruch nach Grund und Höhe schriftlich anmelden, Sicherheit zu leisten, soweit sie nicht Befriedigung verlangen können. Dieses Recht steht den Gläubigern jedoch nur zu, wenn sie glaubhaft machen, dass durch die Verschmelzung die Erfüllung ihrer Forderung gefährdet wird. Das Recht, Sicherheitsleistung zu verlangen, steht Gläubigern nicht zu, die im Falle der Insolvenz ein Recht auf vorzugsweise Befriedigung aus einer Deckungsmasse haben, die nach gesetzlicher Vorschrift zu ihrem Schutz errichtet und staatlich überwacht ist."
    },
    {
      "date": "2025-10-01",
      "id": "132232",
      "original_text": "Registerbekanntmachung nach dem Umwandlungsgesetz\nBerlin Amtsgericht Berlin (Charlottenburg) HRA 61691\nElena Wulfovitch e.Kfr. – Berlin",
      "type": "Registerbekanntmachung nach dem Umwandlungsgesetz",
      "state": "Berlin",
      "amtsgericht": "Amtsgericht Berlin (Charlottenburg)",
      "registernummer": "HRA 61691",
      "registerart": "HRA",
      "company_name": "Elena Wulfovitch e.Kfr.",
      "company_seat": "Berlin",
      "details": "01.10.2025 (Bekanntmachungsdatum)\n\nBerlin Amtsgericht Berlin (Charlottenburg) HRA 61691\nRegisterbekanntmachung nach dem Umwandlungsgesetz 30.09.2025 (Eintragungsdatum)\n\nElena Wulfovitch e.Kfr.\nEinzelkaufmann / Einzelkauffrau\nBerlin\n\nZu Eintragungsnummer 2 vom 30.09.2025 wird als nicht eingetragen veröffentlicht:\nDen Gläubigern der an der Spaltung beteiligten Rechtsträger ist, wenn sie binnen sechs Monaten nach dem Tag, an dem die Eintragung der Spaltung in das Register des Sitzes desjenigen Rechtsträgers, dessen Gläubiger sie sind, als bekannt gemacht gilt, ihren Anspruch nach Grund und Höhe schriftlich anmelden, Sicherheit zu leisten, soweit sie nicht Befriedigung verlangen können. Dieses Recht steht den Gläubigern jedoch nur zu, wenn sie glaubhaft machen, dass durch die Spaltung die Erfüllung ihrer Forderung gefährdet wird. Das Recht, Sicherheitsleistung zu verlangen, steht Gläubigern nicht zu, die im Falle der Insolvenz ein Recht auf vorzugsweise Befriedigung aus einer Deckungsmasse haben, die nach gesetzlicher Vorschrift zu ihrem Schutz errichtet und staatlich überwacht ist."
    },
    {
      "date": "2025-10-01",
      "id": "132233",
      "original_text": "Registerbekanntmachung nach dem Umwandlungsgesetz\nBerlin Amtsgericht Berlin (Charlottenburg) HRB 277315\nLavanda Pflegedienst GmbH – Berlin",
      "type": "Registerbekanntmachung nach dem Umwandlungsgesetz",
      "state": "Berlin",
      "amtsgericht": "Amtsgericht Berlin (Charlottenburg)",
      "registernummer": "HRB 277315",
      "registerart": "HRB",
      "company_name": "Lavanda Pflegedienst GmbH",
      "company_seat": "Berlin",
      "details": "01.10.2025 (Bekanntmachungsdatum)\n\nBerlin Amtsgericht Berlin (Charlottenburg) HRB 277315\nRegisterbekanntmachung nach dem Umwandlungsgesetz 30.09.2025 (Eintragungsdatum)\n\nLavanda Pflegedienst GmbH\nGesellschaft mit beschränkter Haftung\nBerlin\n\nZu Eintragungsnummer 3 vom 30.09.2025 wird als nicht eingetragen veröffentlicht:\nDen Gläubigern der an der Spaltung beteiligten Rechtsträger ist, wenn sie binnen sechs Monaten nach dem Tag, an dem die Eintragung der Spaltung in das Register des Sitzes desjenigen Rechtsträgers, dessen Gläubiger sie sind, als bekannt gemacht gilt, ihren Anspruch nach Grund und Höhe schriftlich anmelden, Sicherheit zu leisten, soweit sie nicht Befriedigung verlangen können. Dieses Recht steht den Gläubigern jedoch nur zu, wenn sie glaubhaft machen, dass durch die Spaltung die Erfüllung ihrer Forderung gefährdet wird. Das Recht, Sicherheitsleistung zu verlangen, steht Gläubigern nicht zu, die im Falle der Insolvenz ein Recht auf vorzugsweise Befriedigung aus einer Deckungsmasse haben, die nach gesetzlicher Vorschrift zu ihrem Schutz errichtet und staatlich überwacht ist."
    },
    {
      "date": "2025-10-01",
      "id": "132234",
      "original_text": "Registerbekanntmachung nach dem Umwandlungsgesetz\nBrandenburg Amtsgericht Cottbus HRB 1909\nLidzba Reinigungsgesellschaft mbH – Cottbus",
      "type": "Registerbekanntmachung nach dem Umwandlungsgesetz",
      "state": "Brandenburg",
      "amtsgericht": "Amtsgericht Cottbus",
      "registernummer": "HRB 1909",
      "registerart": "HRB",
      "company_name": "Lidzba Reinigungsgesellschaft mbH",
      "company_seat": "Cottbus",
      "details": "01.10.2025 (Bekanntmachungsdatum)\n\nBrandenburg Amtsgericht Cottbus HRB 1909\nRegisterbekanntmachung nach dem Umwandlungsgesetz 30.09.2025 (Eintragungsdatum)\n\nLidzba Reinigungsgesellschaft mbH\nGesellschaft mit beschränkter Haftung\nCottbus\n\nAls nicht eingetragen wird veröffentlicht:\nDen Gläubigern der an der Verschmelzung beteiligten Rechtsträger ist, wenn sie binnen sechs Monaten nach dem Tag, an dem die Eintragung der Verschmelzung in das Register des Sitzes desjenigen Rechtsträgers, dessen Gläubiger sie sind, als bekannt gemacht gilt, ihren Anspruch nach Grund und Höhe schriftlich anmelden, Sicherheit zu leisten, soweit sie nicht Befriedigung verlangen können. Dieses Recht steht den Gläubigern jedoch nur zu, wenn sie glaubhaft machen, dass durch die Verschmelzung die Erfüllung ihrer Forderung gefährdet wird"
    },
    {
      "date": "2025-10-01",
      "id": "132235",
      "original_text": "Löschungsankündigung\nSaarland Amtsgericht Saarbrücken HRB 104314\nSaarbrücker Industrieverschrottung UG (haftungsbeschränkt) – Saarbrücken",
      "type": "Löschungsankündigung",
      "state": "Saarland",
      "amtsgericht": "Amtsgericht Saarbrücken",
      "registernummer": "HRB 104314",
      "registerart": "HRB",
      "company_name": "Saarbrücker Industrieverschrottung UG (haftungsbeschränkt)",
      "company_seat": "Saarbrücken",
      "details": "01.10.2025 (Bekanntmachungsdatum)\n\nSaarland Amtsgericht Saarbrücken HRB 104314\nLöschungsankündigung\n\nSaarbrücker Industrieverschrottung UG (haftungsbeschränkt)\nGesellschaft mit beschränkter Haftung\nSaarbrücken\n\nEs ist beabsichtigt, die Gesellschaft von Amts wegen gemäß § 394 FamFG wegen Vermögenslosigkeit zu löschen.\nGegen die Löschung von Amts wegen ist das Rechtsmittel des Widerspruchs statthaft. Der Widerspruch ist binnen einer Frist zwei Monaten beginnend mit dem Tag dieser Veröffentlichung durch Einreichen eines Widerspruchsschreibens -schriftlich oder zur Niederschrift der Geschäftsstelle beim Amtsgericht Saarbrücken, -zentrales Handelsregister-, Mainzerstr.178, 66121 Saarbrücken einzulegen.\nDer Widerspruch muss die Bezeichnung der angefochtenen Löschungsankündigung enthalten sowie die Erklärung, dass Widerspruch eingelegt wird. Er ist vom Widerspruchsführer oder seinem Bevollmächtigten zu unterzeichnen.\nDas Widerspruchsschreiben kann auch in der Form eines elektronischen Dokumentes eingereicht werden, das mit einer qualifizierten elektronischen Signatur nach dem Signaturgesetz versehen sein muss (§§ 14 Abs. 2 FamFG, 130a, 298 ZPO)."
    },
    {
      "date": "2025-10-01",
      "id": "132236",
      "original_text": "Registerbekanntmachung nach dem Umwandlungsgesetz\nBerlin Amtsgericht Berlin (Charlottenburg) HRA 63736\nLeto Bistro e.K. – Berlin",
      "type": "Registerbekanntmachung nach dem Umwandlungsgesetz",
      "state": "Berlin",
      "amtsgericht": "Amtsgericht Berlin (Charlottenburg)",
      "registernummer": "HRA 63736",
      "registerart": "HRA",
      "company_name": "Leto Bistro e.K.",
      "company_seat": "Berlin",
      "details": "01.10.2025 (Bekanntmachungsdatum)\n\nBerlin Amtsgericht Berlin (Charlottenburg) HRA 63736\nRegisterbekanntmachung nach dem Umwandlungsgesetz 30.09.2025 (Eintragungsdatum)\n\nLeto Bistro e.K.\nEinzelkaufmann / Einzelkauffrau\nBerlin\n\nZu Eintragungsnummer 2 vom 30.09.2025 wird als nicht eingetragen veröffentlicht: Den Gläubigern der an der Spaltung beteiligten Rechtsträger ist, wenn sie binnen sechs Monaten nach dem Tag, an dem die Eintragung der Spaltung in das Register des Sitzes desjenigen Rechtsträgers, dessen Gläubiger sie sind, als bekannt gemacht gilt, ihren Anspruch nach Grund und Höhe schriftlich anmelden, Sicherheit zu leisten, soweit sie nicht Befriedigung verlangen können. Dieses Recht steht den Gläubigern jedoch nur zu, wenn sie glaubhaft machen, dass durch die Spaltung die Erfüllung ihrer Forderung gefährdet wird. Das Recht, Sicherheitsleistung zu verlangen, steht Gläubigern nicht zu, die im Falle der Insolvenz ein Recht auf vorzugsweise Befriedigung aus einer Deckungsmasse haben, die nach gesetzlicher Vorschrift zu ihrem Schutz errichtet und staatlich überwacht ist."
    },
    {
      "date": "2025-10-01",
      "id": "132237",
      "original_text": "Registerbekanntmachung nach dem Umwandlungsgesetz\nBaden-Württemberg Amtsgericht Mannheim HRB 755872\nAmbulanter Pflegedienst Pulsus GmbH – Pforzheim",
      "type": "Registerbekanntmachung nach dem Umwandlungsgesetz",
      "state": "Baden-Württemberg",
      "amtsgericht": "Amtsgericht Mannheim",
      "registernummer": "HRB 755872",
      "registerart": "HRB",
      "company_name": "Ambulanter Pflegedienst Pulsus GmbH",
      "company_seat": "Pforzheim",
      "details": "01.10.2025 (Bekanntmachungsdatum)\n\nBaden-Württemberg Amtsgericht Mannheim HRB 755872\nRegisterbekanntmachung nach dem Umwandlungsgesetz 01.10.2025 (Eintragungsdatum)\n\nAmbulanter Pflegedienst Pulsus GmbH\nGesellschaft mit beschränkter Haftung\nPforzheim\n\nDen Gläubigern der an der Ausgliederung beteiligten Rechtsträger ist, wenn sie binnen sechs Monaten nach dem Tag, an dem die Eintragung der Ausgliederung in das Register des Sitzes desjenigen Rechtsträgers, dessen Gläubiger sie sind, nach § 19 Abs. 3 UmwG als bekanntgemacht gilt, ihren Anspruch nach Grund und Höhe schriftlich anmelden, Sicherheit zu leisten, soweit sie nicht Befriedigung verlangen können. Dieses Recht steht den Gläubigern jedoch nur zu, wenn sie glaubhaft machen, dass durch die Ausgliederung die Erfüllung ihrer Forderung gefährdet wird."
    },
    {
      "date": "2025-10-01",
      "id": "132238",
      "original_text": "Registerbekanntmachung nach dem Umwandlungsgesetz\nNordrhein-Westfalen Amtsgericht Coesfeld HRB 21561\nPBC - Projektplanung Bau-Consulting GmbH – Bocholt",
      "type": "Registerbekanntmachung nach dem Umwandlungsgesetz",
      "state": "Nordrhein-Westfalen",
      "amtsgericht": "Amtsgericht Coesfeld",
      "registernummer": "HRB 21561",
      "registerart": "HRB",
      "company_name": "PBC - Projektplanung Bau-Consulting GmbH",
      "company_seat": "Bocholt",
      "details": "01.10.2025 (Bekanntmachungsdatum)\n\nNordrhein-Westfalen Amtsgericht Coesfeld HRB 21561\nRegisterbekanntmachung nach dem Umwandlungsgesetz 01.10.2025 (Eintragungsdatum)\n\nPBC - Projektplanung Bau-Consulting GmbH\nGesellschaft mit beschränkter Haftung\nBocholt\n\nDen Gläubigern der an der Verschmelzung beteiligten Rechtsträger ist, wenn sie binnen sechs Monaten nach dem Tag, an dem die Eintragung der Verschmelzung in das Register des Sitzes derjenigen Rechtsträger deren Gläubiger sie sind, nach § 19 Absatz 3 UmwG als bekanntgemacht gilt, ihren Anspruch nach Grund und Höhe schriftlich anmelden, Sicherheit zu leisten, soweit sie nicht Befriedigung verlangen können. Dieses Recht steht den Gläubigern jedoch nur zu, wenn sie glaubhaft machen, dass durch die Verschmelzung die Erfüllung ihrer Forderung gefährdet wird."
    },
    {
      "date": "2025-10-01",
      "id": "132239",
      "original_text": "Registerbekanntmachung nach dem Umwandlungsgesetz\nBerlin Amtsgericht Berlin (Charlottenburg) HRB 151817\nVungle GmbH – Berlin",
      "type": "Registerbekanntmachung nach dem Umwandlungsgesetz",
      "state": "Berlin",
      "amtsgericht": "Amtsgericht Berlin (Charlottenburg)",
      "registernummer": "HRB 151817",
      "registerart": "HRB",
      "company_name": "Vungle GmbH",
      "company_seat": "Berlin",
      "details": "01.10.2025 (Bekanntmachungsdatum)\n\nBerlin Amtsgericht Berlin (Charlottenburg) HRB 151817\nRegisterbekanntmachung nach dem Umwandlungsgesetz 30.09.2025 (Eintragungsdatum)\n\nVungle GmbH\nGesellschaft mit beschränkter Haftung\nBerlin\n\nZu Eintragungsnummer 10 vom 30.09.2025 wird als nicht eingetragen veröffentlicht: Den Gläubigern der an der Verschmelzung beteiligten Rechtsträger ist, wenn sie binnen sechs Monaten nach dem Tag, an dem die Eintragung der Verschmelzung in das Register des Sitzes desjenigen Rechtsträgers, dessen Gläubiger sie sind, als bekannt gemacht gilt, ihren Anspruch nach Grund und Höhe schriftlich anmelden, Sicherheit zu leisten, soweit sie nicht Befriedigung verlangen können. Dieses Recht steht den Gläubigern jedoch nur zu, wenn sie glaubhaft machen, dass durch die Verschmelzung die Erfüllung ihrer Forderung gefährdet wird. Das Recht, Sicherheitsleistung zu verlangen, steht Gläubigern nicht zu, die im Falle der Insolvenz ein Recht auf vorzugsweise Befriedigung aus einer Deckungsmasse haben, die nach gesetzlicher Vorschrift zu ihrem Schutz errichtet und staatlich überwacht ist."
    },
    {
      "date": "2025-10-01",
      "id": "132240",
      "original_text": "Registerbekanntmachung nach dem Umwandlungsgesetz\nBaden-Württemberg Amtsgericht Stuttgart HRB 331666\nMLS Lanny Produktions GmbH – Bad Wildbad",
      "type": "Registerbekanntmachung nach dem Umwandlungsgesetz",
      "state": "Baden-Württemberg",
      "amtsgericht": "Amtsgericht Stuttgart",
      "registernummer": "HRB 331666",
      "registerart": "HRB",
      "company_name": "MLS Lanny Produktions GmbH",
      "company_seat": "Bad Wildbad",
      "details": "01.10.2025 (Bekanntmachungsdatum)\n\nBaden-Württemberg Amtsgericht Stuttgart HRB 331666\nRegisterbekanntmachung nach dem Umwandlungsgesetz 01.10.2025 (Eintragungsdatum)\n\nMLS Lanny Produktions GmbH\nGesellschaft mit beschränkter Haftung\nBad Wildbad\n\nAls nicht eingetragen wird bekanntgemacht:\nDen Gläubigern der an der Verschmelzung beteiligten Rechtsträger ist, wenn sie binnen sechs Monaten nach dem Tag, an dem die Eintragung der Verschmelzung in das Register des Sitzes desjenigen Rechtsträgers, dessen Gläubiger sie sind, nach § 19 Abs. 3 UmwG als bekanntgemacht gilt, ihren Anspruch nach Grund und Höhe schriftlich anmelden, Sicherheit zu leisten, soweit sie nicht Befriedigung verlangen können. Dieses Recht steht den Gläubigern jedoch nur zu, wenn sie glaubhaft machen, dass durch die Verschmelzung die Erfüllung ihrer Forderung gefährdet wird."
    },
    {
      "date": "2025-10-01",
      "id": "132241",
      "original_text": "Einreichung neuer Dokumente\nHamburg Amtsgericht Hamburg HRB 75492\nLAIQON AG – Hamburg",
      "type": "Einreichung neuer Dokumente",
      "state": "Hamburg",
      "amtsgericht": "Amtsgericht Hamburg",
      "registernummer": "HRB 75492",
      "registerart": "HRB",
      "company_name": "LAIQON AG",
      "company_seat": "Hamburg",
      "details": "01.10.2025 (Bekanntmachungsdatum)\n\nHamburg Amtsgericht Hamburg HRB 75492\nEinreichung neuer Dokumente\n\nLAIQON AG\nAktiengesellschaft\nHamburg\n\nAls nicht eingetragen wird bekannt gemacht: Liste des Aufsichtsrats wurde eingereicht."
    },
    {
      "date": "2025-10-01",
      "id": "132242",
      "original_text": "Registerbekanntmachung nach dem Umwandlungsgesetz\nBaden-Württemberg Amtsgericht Mannheim HRA 712770\nAmbulanter Pflegedienst Pulsus e.K. – Pforzheim",
      "type": "Registerbekanntmachung nach dem Umwandlungsgesetz",
      "state": "Baden-Württemberg",
      "amtsgericht": "Amtsgericht Mannheim",
      "registernummer": "HRA 712770",
      "registerart": "HRA",
      "company_name": "Ambulanter Pflegedienst Pulsus e.K.",
      "company_seat": "Pforzheim",
      "details": "01.10.2025 (Bekanntmachungsdatum)\n\nBaden-Württemberg Amtsgericht Mannheim HRA 712770\nRegisterbekanntmachung nach dem Umwandlungsgesetz 01.10.2025 (Eintragungsdatum)\n\nAmbulanter Pflegedienst Pulsus e.K.\nEinzelkaufmann / Einzelkauffrau\nPforzheim\n\nDen Gläubigern der an der Ausgliederung beteiligten Rechtsträger ist, wenn sie binnen sechs Monaten nach dem Tag, an dem die Eintragung der Ausgliederung in das Register des Sitzes desjenigen Rechtsträgers, dessen Gläubiger sie sind, nach § 19 Abs. 3 UmwG als bekanntgemacht gilt, ihren Anspruch nach Grund und Höhe schriftlich anmelden, Sicherheit zu leisten, soweit sie nicht Befriedigung verlangen können. Dieses Recht steht den Gläubigern jedoch nur zu, wenn sie glaubhaft machen, dass durch die Ausgliederung die Erfüllung ihrer Forderung gefährdet wird."
    },
    {
      "date": "2025-10-01",
      "id": "132243",
      "original_text": "Registerbekanntmachung nach dem Umwandlungsgesetz\nMecklenburg-Vorpommern Amtsgericht Neubrandenburg HRA 2947\nKells Appartements e.K. – Klink",
      "type": "Registerbekanntmachung nach dem Umwandlungsgesetz",
      "state": "Mecklenburg-Vorpommern",
      "amtsgericht": "Amtsgericht Neubrandenburg",
      "registernummer": "HRA 2947",
      "registerart": "HRA",
      "company_name": "Kells Appartements e.K.",
      "company_seat": "Klink",
      "details": "01.10.2025 (Bekanntmachungsdatum)\n\nMecklenburg-Vorpommern Amtsgericht Neubrandenburg HRA 2947\nRegisterbekanntmachung nach dem Umwandlungsgesetz 01.10.2025 (Eintragungsdatum)\n\nKells Appartements e.K.\nEinzelkaufmann / Einzelkauffrau\nKlink\n\nAls nicht eingetragen wird veröffentlicht: Den Gläubigern der an der Ausgliederung beteiligten Rechtsträger ist, wenn sie binnen sechs Monaten nach dem Tag, an dem die Eintragung der Ausgliederung in das Register des Sitzes desjenigen Rechtsträgers, dessen Gläubiger sie sind, nach § 19 Abs. 3 UmwG als bekannt gemacht gilt, ihren Anspruch nach Grund und Höhe in Textform anmelden,\nSicherheit zu leisten, soweit sie nicht Befriedigung verlangen können. Dieses Recht steht den Gläubigern jedoch nur zu, wenn sie glaubhaft machen, dass durch die Ausgliederung die Erfüllung der Forderung gefährdet wird."
    },
    {
      "date": "2025-10-01",
      "id": "132244",
      "original_text": "Registerbekanntmachung nach dem Umwandlungsgesetz\nBerlin Amtsgericht Berlin (Charlottenburg) HRB 270917\nZero One GmbH – Berlin",
      "type": "Registerbekanntmachung nach dem Umwandlungsgesetz",
      "state": "Berlin",
      "amtsgericht": "Amtsgericht Berlin (Charlottenburg)",
      "registernummer": "HRB 270917",
      "registerart": "HRB",
      "company_name": "Zero One GmbH",
      "company_seat": "Berlin",
      "details": "01.10.2025 (Bekanntmachungsdatum)\n\nBerlin Amtsgericht Berlin (Charlottenburg) HRB 270917\nRegisterbekanntmachung nach dem Umwandlungsgesetz 30.09.2025 (Eintragungsdatum)\n\nZero One GmbH\nGesellschaft mit beschränkter Haftung\nBerlin\n\nZu Eintragungsnummer 3 vom 30.09.2025 wird als nicht eingetragen veröffentlicht: Den Gläubigern der an der Spaltung beteiligten Rechtsträger ist, wenn sie binnen sechs Monaten nach dem Tag, an dem die Eintragung der Spaltung in das Register des Sitzes desjenigen Rechtsträgers, dessen Gläubiger sie sind, als bekannt gemacht gilt, ihren Anspruch nach Grund und Höhe schriftlich anmelden, Sicherheit zu leisten, soweit sie nicht Befriedigung verlangen können. Dieses Recht steht den Gläubigern jedoch nur zu, wenn sie glaubhaft machen, dass durch die Spaltung die Erfüllung ihrer Forderung gefährdet wird. Das Recht, Sicherheitsleistung zu verlangen, steht Gläubigern nicht zu, die im Falle der Insolvenz ein Recht auf vorzugsweise Befriedigung aus einer Deckungsmasse haben, die nach gesetzlicher Vorschrift zu ihrem Schutz errichtet und staatlich überwacht ist."
    },
    {
      "date": "2025-10-01",
      "id": "132245",
      "original_text": "Registerbekanntmachung nach dem Umwandlungsgesetz\nBaden-Württemberg Amtsgericht Stuttgart HRB 767566\nCF Hoyerswerda GmbH – Freudenstadt",
      "type": "Registerbekanntmachung nach dem Umwandlungsgesetz",
      "state": "Baden-Württemberg",
      "amtsgericht": "Amtsgericht Stuttgart",
      "registernummer": "HRB 767566",
      "registerart": "HRB",
      "company_name": "CF Hoyerswerda GmbH",
      "company_seat": "Freudenstadt",
      "details": "01.10.2025 (Bekanntmachungsdatum)\n\nBaden-Württemberg Amtsgericht Stuttgart HRB 767566\nRegisterbekanntmachung nach dem Umwandlungsgesetz 01.10.2025 (Eintragungsdatum)\n\nCF Hoyerswerda GmbH\nGesellschaft mit beschränkter Haftung\nFreudenstadt\n\nAls nicht eingetragen wird bekanntgemacht:\nDen Gläubigern der an der Verschmelzung beteiligten Rechtsträger ist, wenn sie binnen sechs Monaten nach dem Tag, an dem die Eintragung der Verschmelzung in das Register des Sitzes desjenigen Rechtsträgers, dessen Gläubiger sie sind, nach § 19 Abs. 3 UmwG als bekanntgemacht gilt, ihren Anspruch nach Grund und Höhe schriftlich anmelden, Sicherheit zu leisten, soweit sie nicht Befriedigung verlangen können. Dieses Recht steht den Gläubigern jedoch nur zu, wenn sie glaubhaft machen, dass durch die Verschmelzung die Erfüllung ihrer Forderung gefährdet wird."
    },
    {
      "date": "2025-10-01",
      "id": "132246",
      "original_text": "Löschungsankündigung\nBaden-Württemberg Amtsgericht Freiburg HRB 718879\nOSD Wohnbau GmbH – Engen",
      "type": "Löschungsankündigung",
      "state": "Baden-Württemberg",
      "amtsgericht": "Amtsgericht Freiburg",
      "registernummer": "HRB 718879",
      "registerart": "HRB",
      "company_name": "OSD Wohnbau GmbH",
      "company_seat": "Engen",
      "details": "01.10.2025 (Bekanntmachungsdatum)\n\nBaden-Württemberg Amtsgericht Freiburg HRB 718879\nLöschungsankündigung\n\nOSD Wohnbau GmbH\nGesellschaft mit beschränkter Haftung\nEngen\n\nDas Gericht beabsichtigt, die Gesellschaft wegen Vermögenslosigkeit im Handelsregister von Amts wegen nach § 394 FamFG zu löschen. Die Frist zur Geltendmachung eines Widerspruchs gegen die beabsichtigte Löschung ist auf einen Monat ab Veröffentlichung bestimmt."
    },
    {
      "date": "2025-10-01",
      "id": "132247",
      "original_text": "Löschungsankündigung\nBrandenburg Amtsgericht Potsdam HRB 31137\n4 Seasons Capital GmbH – Kleinmachnow",
      "type": "Löschungsankündigung",
      "state": "Brandenburg",
      "amtsgericht": "Amtsgericht Potsdam",
      "registernummer": "HRB 31137",
      "registerart": "HRB",
      "company_name": "4 Seasons Capital GmbH",
      "company_seat": "Kleinmachnow",
      "details": "01.10.2025 (Bekanntmachungsdatum)\n\nBrandenburg Amtsgericht Potsdam HRB 31137\nLöschungsankündigung\n\n4 Seasons Capital GmbH\nGesellschaft mit beschränkter Haftung\nKleinmachnow\n\nBei der nachstehenden Gesellschaft wird das Amtslöschungsverfahren gemäß § 394 FamFG eingeleitet. Widerspruchsfrist 8 Wochen."
    },
    {
      "date": "2025-10-01",
      "id": "132248",
      "original_text": "Löschungsankündigung\nBerlin Amtsgericht Berlin (Charlottenburg) HRB 220759\nOcto Service GmbH – Berlin",
      "type": "Löschungsankündigung",
      "state": "Berlin",
      "amtsgericht": "Amtsgericht Berlin (Charlottenburg)",
      "registernummer": "HRB 220759",
      "registerart": "HRB",
      "company_name": "Octo Service GmbH",
      "company_seat": "Berlin",
      "details": "01.10.2025 (Bekanntmachungsdatum)\n\nBerlin Amtsgericht Berlin (Charlottenburg) HRB 220759\nLöschungsankündigung\n\nOcto Service GmbH\nGesellschaft mit beschränkter Haftung\nBerlin\n\nBei der nachstehenden Gesellschaft wird das Amtslöschungsverfahren gemäß § 394 FamFG eingeleitet. Widerspruchsfrist 6 Wochen"
    },
    {
      "date": "2025-10-01",
      "id": "132249",
      "original_text": "Registerbekanntmachung nach dem Umwandlungsgesetz\nBerlin Amtsgericht Berlin (Charlottenburg) HRB 157200\napolino GmbH – Berlin",
      "type": "Registerbekanntmachung nach dem Umwandlungsgesetz",
      "state": "Berlin",
      "amtsgericht": "Amtsgericht Berlin (Charlottenburg)",
      "registernummer": "HRB 157200",
      "registerart": "HRB",
      "company_name": "apolino GmbH",
      "company_seat": "Berlin",
      "details": "01.10.2025 (Bekanntmachungsdatum)\n\nBerlin Amtsgericht Berlin (Charlottenburg) HRB 157200\nRegisterbekanntmachung nach dem Umwandlungsgesetz 29.09.2025 (Eintragungsdatum)\n\napolino GmbH\nGesellschaft mit beschränkter Haftung\nBerlin\n\nZu Eintragungsnummer 2 vom 29.09.2025 wird als nicht eingetragen veröffentlicht:Den Gläubigern der an der Verschmelzung beteiligten Rechtsträger ist, wenn sie binnen sechs Monaten nach dem Tag, an dem die Eintragung der Verschmelzung in das Register des Sitzes desjenigen Rechtsträgers, dessen Gläubiger sie sind, als bekannt gemacht gilt, ihren Anspruch nach Grund und Höhe schriftlich anmelden, Sicherheit zu leisten, soweit sie nicht Befriedigung verlangen können. Dieses Recht steht den Gläubigern jedoch nur zu, wenn sie glaubhaft machen, dass durch die Verschmelzung die Erfüllung ihrer Forderung gefährdet wird. Das Recht, Sicherheitsleistung zu verlangen, steht Gläubigern nicht zu, die im Falle der Insolvenz ein Recht auf vorzugsweise Befriedigung aus einer Deckungsmasse haben, die nach gesetzlicher Vorschrift zu ihrem Schutz errichtet und staatlich überwacht ist."
    },
    {
      "date": "2025-10-01",
      "id": "132250",
      "original_text": "Einreichung neuer Dokumente\nBerlin Amtsgericht Berlin (Charlottenburg) HRB 145836\nLingoda GmbH – Berlin",
      "type": "Einreichung neuer Dokumente",
      "state": "Berlin",
      "amtsgericht": "Amtsgericht Berlin (Charlottenburg)",
      "registernummer": "HRB 145836",
      "registerart": "HRB",
      "company_name": "Lingoda GmbH",
      "company_seat": "Berlin",
      "details": "01.10.2025 (Bekanntmachungsdatum)\n\nBerlin Amtsgericht Berlin (Charlottenburg) HRB 145836\nEinreichung neuer Dokumente\n\nLingoda GmbH\nGesellschaft mit beschränkter Haftung\nBerlin\n\nAls nicht eingetragen wird veröffentlicht:\nEs wurde eine neue Liste der Beiratsmitglieder eingereicht (§52 GmbHG)."
    },
    {
      "date": "2025-10-01",
      "id": "132251",
      "original_text": "Löschungsankündigung\nBerlin Amtsgericht Berlin (Charlottenburg) HRB 206770\nSelim Bau Berlin GmbH – Berlin",
      "type": "Löschungsankündigung",
      "state": "Berlin",
      "amtsgericht": "Amtsgericht Berlin (Charlottenburg)",
      "registernummer": "HRB 206770",
      "registerart": "HRB",
      "company_name": "Selim Bau Berlin GmbH",
      "company_seat": "Berlin",
      "details": "01.10.2025 (Bekanntmachungsdatum)\n\nBerlin Amtsgericht Berlin (Charlottenburg) HRB 206770\nLöschungsankündigung\n\nSelim Bau Berlin GmbH\nGesellschaft mit beschränkter Haftung\nBerlin\n\nBei der nachstehenden Gesellschaft wird das Amtslöschungsverfahren gemäß § 394 FamFG eingeleitet. Widerspruchsfrist 6 Wochen"
    },
    {
      "date": "2025-10-01",
      "id": "132252",
      "original_text": "Registerbekanntmachung nach dem Umwandlungsgesetz\nBerlin Amtsgericht Berlin (Charlottenburg) HRB 213268\nLiftoff Mobile GmbH – Berlin",
      "type": "Registerbekanntmachung nach dem Umwandlungsgesetz",
      "state": "Berlin",
      "amtsgericht": "Amtsgericht Berlin (Charlottenburg)",
      "registernummer": "HRB 213268",
      "registerart": "HRB",
      "company_name": "Liftoff Mobile GmbH",
      "company_seat": "Berlin",
      "details": "01.10.2025 (Bekanntmachungsdatum)\n\nBerlin Amtsgericht Berlin (Charlottenburg) HRB 213268\nRegisterbekanntmachung nach dem Umwandlungsgesetz 30.09.2025 (Eintragungsdatum)\n\nLiftoff Mobile GmbH\nGesellschaft mit beschränkter Haftung\nBerlin\n\nZu Eintragungsnummer 5 vom 30.09.2025 wird als nicht eingetragen veröffentlicht: Den Gläubigern der an der Verschmelzung beteiligten Rechtsträger ist, wenn sie binnen sechs Monaten nach dem Tag, an dem die Eintragung der Verschmelzung in das Register des Sitzes desjenigen Rechtsträgers, dessen Gläubiger sie sind, als bekannt gemacht gilt, ihren Anspruch nach Grund und Höhe schriftlich anmelden, Sicherheit zu leisten, soweit sie nicht Befriedigung verlangen können. Dieses Recht steht den Gläubigern jedoch nur zu, wenn sie glaubhaft machen, dass durch die Verschmelzung die Erfüllung ihrer Forderung gefährdet wird. Das Recht, Sicherheitsleistung zu verlangen, steht Gläubigern nicht zu, die im Falle der Insolvenz ein Recht auf vorzugsweise Befriedigung aus einer Deckungsmasse haben, die nach gesetzlicher Vorschrift zu ihrem Schutz errichtet und staatlich überwacht ist."
    },
    {
      "date": "2025-10-01",
      "id": "132253",
      "original_text": "Registerbekanntmachung nach dem Umwandlungsgesetz\nBerlin Amtsgericht Berlin (Charlottenburg) HRB 103582\nSchmidt & Franke GmbH – Berlin",
      "type": "Registerbekanntmachung nach dem Umwandlungsgesetz",
      "state": "Berlin",
      "amtsgericht": "Amtsgericht Berlin (Charlottenburg)",
      "registernummer": "HRB 103582",
      "registerart": "HRB",
      "company_name": "Schmidt & Franke GmbH",
      "company_seat": "Berlin",
      "details": "01.10.2025 (Bekanntmachungsdatum)\n\nBerlin Amtsgericht Berlin (Charlottenburg) HRB 103582\nRegisterbekanntmachung nach dem Umwandlungsgesetz 29.09.2025 (Eintragungsdatum)\n\nSchmidt & Franke GmbH\nGesellschaft mit beschränkter Haftung\nBerlin\n\nZu Eintragungsnummer 4 vom 29.09.2025 wird als nicht eingetragen veröffentlicht:Den Gläubigern der an der Verschmelzung beteiligten Rechtsträger ist, wenn sie binnen sechs Monaten nach dem Tag, an dem die Eintragung der Verschmelzung in das Register des Sitzes desjenigen Rechtsträgers, dessen Gläubiger sie sind, als bekannt gemacht gilt, ihren Anspruch nach Grund und Höhe schriftlich anmelden, Sicherheit zu leisten, soweit sie nicht Befriedigung verlangen können. Dieses Recht steht den Gläubigern jedoch nur zu, wenn sie glaubhaft machen, dass durch die Verschmelzung die Erfüllung ihrer Forderung gefährdet wird. Das Recht, Sicherheitsleistung zu verlangen, steht Gläubigern nicht zu, die im Falle der Insolvenz ein Recht auf vorzugsweise Befriedigung aus einer Deckungsmasse haben, die nach gesetzlicher Vorschrift zu ihrem Schutz errichtet und staatlich überwacht ist."
    },
    {
      "date": "2025-10-01",
      "id": "132254",
      "original_text": "Einreichung neuer Dokumente\nBaden-Württemberg Amtsgericht Stuttgart HRB 7509\nKunststiftung Baden-Württemberg gGmbH – Stuttgart",
      "type": "Einreichung neuer Dokumente",
      "state": "Baden-Württemberg",
      "amtsgericht": "Amtsgericht Stuttgart",
      "registernummer": "HRB 7509",
      "registerart": "HRB",
      "company_name": "Kunststiftung Baden-Württemberg gGmbH",
      "company_seat": "Stuttgart",
      "details": "01.10.2025 (Bekanntmachungsdatum)\n\nBaden-Württemberg Amtsgericht Stuttgart HRB 7509\nEinreichung neuer Dokumente\n\nKunststiftung Baden-Württemberg gGmbH\nGesellschaft mit beschränkter Haftung\nStuttgart\n\nDie Gesellschaft hat am 23.09.2025 die Liste über die Zusammensetzung des Aufsichtsrats zum Handelsregister eingereicht."
    },
    {
      "date": "2025-10-01",
      "id": "132255",
      "original_text": "Registerbekanntmachung nach dem Umwandlungsgesetz\nSchleswig-Holstein Amtsgericht Lübeck HRB 2284 RE\nDeltron Elektronic GmbH – Reinbek",
      "type": "Registerbekanntmachung nach dem Umwandlungsgesetz",
      "state": "Schleswig-Holstein",
      "amtsgericht": "Amtsgericht Lübeck",
      "registernummer": "HRB 2284 RE",
      "registerart": "HRB",
      "company_name": "Deltron Elektronic GmbH",
      "company_seat": "Reinbek",
      "details": "01.10.2025 (Bekanntmachungsdatum)\n\nSchleswig-Holstein Amtsgericht Lübeck HRB 2284 RE\nRegisterbekanntmachung nach dem Umwandlungsgesetz 01.10.2025 (Eintragungsdatum)\n\nDeltron Elektronic GmbH\nGesellschaft mit beschränkter Haftung\nReinbek\n\nZu Eintragungsnummer 20 vom 01.10.2025 wird als nicht eingetragen veröffentlicht:  Den Gläubigern der an der Verschmelzung beteiligten Rechtsträger ist, wenn sie binnen sechs Monaten nach dem Tag, an dem die Eintragung der Verschmelzung in das Register des Sitzes desjenigen Rechtsträgers, dessen Gläubiger sie sind, als bekannt gemacht gilt, ihren Anspruch nach Grund und Höhe schriftlich anmelden, Sicherheit zu leisten, soweit sie nicht Befriedigung verlangen können. Dieses Recht steht den Gläubigern jedoch nur zu, wenn sie glaubhaft machen, dass durch die Verschmelzung die Erfüllung ihrer Forderung gefährdet wird."
    },
    {
      "date": "2025-10-01",
      "id": "132256",
      "original_text": "Registerbekanntmachung nach dem Umwandlungsgesetz\nSachsen-Anhalt Amtsgericht Stendal HRA 8085\nSpringmann Fuhrbetrieb und Baustoffhandel GmbH & Co. KG – Völpke OT Badeleben",
      "type": "Registerbekanntmachung nach dem Umwandlungsgesetz",
      "state": "Sachsen-Anhalt",
      "amtsgericht": "Amtsgericht Stendal",
      "registernummer": "HRA 8085",
      "registerart": "HRA",
      "company_name": "Springmann Fuhrbetrieb und Baustoffhandel GmbH & Co. KG",
      "company_seat": "Völpke OT Badeleben",
      "details": "01.10.2025 (Bekanntmachungsdatum)\n\nSachsen-Anhalt Amtsgericht Stendal HRA 8085\nRegisterbekanntmachung nach dem Umwandlungsgesetz 01.10.2025 (Eintragungsdatum)\n\nSpringmann Fuhrbetrieb und Baustoffhandel GmbH & Co. KG\nKommanditgesellschaft\nVölpke OT Badeleben\n\nNicht eingetragen:\nDen Gläubigern der an der Ausgliederung beteiligten Rechtsträger ist, wenn sie binnen sechs Monaten nach dem Tag, an dem die Eintragung der Ausgliederung nach §§125, 19 Abs. 3 UmwG als bekanntgemacht gilt, ihren Anspruch nach Grund und Höhe schriftlich anmelden, Sicherheit zu leisten, soweit sie nicht Befriedigung verlangen können. Diese Recht steht ihnen jedoch nur zu, wenn sie glaubhaft machen, dass durch die Ausgliederung die Erfüllung ihrer Forderung gefährdet wird."
    },
    {
      "date": "2025-10-01",
      "id": "132257",
      "original_text": "Registerbekanntmachung nach dem Umwandlungsgesetz\nSachsen-Anhalt Amtsgericht Stendal HRA 8061\nHenning Springmann Fuhrbetrieb und Baustoffhandel e.K. – Völpke",
      "type": "Registerbekanntmachung nach dem Umwandlungsgesetz",
      "state": "Sachsen-Anhalt",
      "amtsgericht": "Amtsgericht Stendal",
      "registernummer": "HRA 8061",
      "registerart": "HRA",
      "company_name": "Henning Springmann Fuhrbetrieb und Baustoffhandel e.K.",
      "company_seat": "Völpke",
      "details": "01.10.2025 (Bekanntmachungsdatum)\n\nSachsen-Anhalt Amtsgericht Stendal HRA 8061\nRegisterbekanntmachung nach dem Umwandlungsgesetz 01.10.2025 (Eintragungsdatum)\n\nHenning Springmann Fuhrbetrieb und Baustoffhandel e.K.\nEinzelkaufmann / Einzelkauffrau\nVölpke\n\nNicht eingetragen:\nDen Gläubigern der an der Ausgliederung beteiligten Rechtsträger ist, wenn sie binnen sechs Monaten nach dem Tag, an dem die Eintragung der Ausgliederung nach §§125, 19 Abs. 3 UmwG als bekanntgemacht gilt, ihren Anspruch nach Grund und Höhe schriftlich anmelden, Sicherheit zu leisten, soweit sie nicht Befriedigung verlangen können. Diese Recht steht ihnen jedoch nur zu, wenn sie glaubhaft machen, dass durch die Ausgliederung die Erfüllung ihrer Forderung gefährdet wird."
    },
    {
      "date": "2025-10-01",
      "id": "132258",
      "original_text": "Registerbekanntmachung nach dem Umwandlungsgesetz\nBaden-Württemberg Amtsgericht Stuttgart HRB 580793\nKuK Entlackungstechnik GmbH – Öhringen",
      "type": "Registerbekanntmachung nach dem Umwandlungsgesetz",
      "state": "Baden-Württemberg",
      "amtsgericht": "Amtsgericht Stuttgart",
      "registernummer": "HRB 580793",
      "registerart": "HRB",
      "company_name": "KuK Entlackungstechnik GmbH",
      "company_seat": "Öhringen",
      "details": "01.10.2025 (Bekanntmachungsdatum)\n\nBaden-Württemberg Amtsgericht Stuttgart HRB 580793\nRegisterbekanntmachung nach dem Umwandlungsgesetz 01.10.2025 (Eintragungsdatum)\n\nKuK Entlackungstechnik GmbH\nGesellschaft mit beschränkter Haftung\nÖhringen\n\nAls nicht eingetragen wird bekanntgemacht:\nDen Gläubigern der an der Verschmelzung beteiligten Rechtsträger ist, wenn sie binnen sechs Monaten nach dem Tag, an dem die Eintragung der Verschmelzung in das Register des Sitzes desjenigen Rechtsträgers, dessen Gläubiger sie sind, nach § 19 Abs. 3 UmwG als bekanntgemacht gilt, ihren Anspruch nach Grund und Höhe schriftlich anmelden, Sicherheit zu leisten, soweit sie nicht Befriedigung verlangen können. Dieses Recht steht den Gläubigern jedoch nur zu, wenn sie glaubhaft machen, dass durch die Verschmelzung die Erfüllung ihrer Forderung gefährdet wird."
    },
    {
      "date": "2025-10-01",
      "id": "132259",
      "original_text": "Registerbekanntmachung nach dem Umwandlungsgesetz\nSchleswig-Holstein Amtsgericht Lübeck HRB 5054\nMACH Aktiengesellschaft – Lübeck",
      "type": "Registerbekanntmachung nach dem Umwandlungsgesetz",
      "state": "Schleswig-Holstein",
      "amtsgericht": "Amtsgericht Lübeck",
      "registernummer": "HRB 5054",
      "registerart": "HRB",
      "company_name": "MACH Aktiengesellschaft",
      "company_seat": "Lübeck",
      "details": "01.10.2025 (Bekanntmachungsdatum)\n\nSchleswig-Holstein Amtsgericht Lübeck HRB 5054\nRegisterbekanntmachung nach dem Umwandlungsgesetz 01.10.2025 (Eintragungsdatum)\n\nMACH Aktiengesellschaft\nAktiengesellschaft\nLübeck\n\nZu Eintragungsnummer 68 vom 01.10.2025 wird als nicht eingetragen veröffentlicht: Den Gläubigern ist, wenn sie binnen sechs Monaten nach dem Tag, an dem die Eintragung der Umwandlung als bekannt gemacht gilt, ihren Anspruch nach Grund und Höhe schriftlich anmelden, Sicherheit zu leisten, soweit sie nicht Befriedigung verlangen können. Dieses Recht steht den Gläubigern jedoch nur zu, wenn sie glaubhaft machen, dass durch die Umwandlung die Erfüllung ihrer Forderung gefährdet wird."
    },
    {
      "date": "2025-10-01",
      "id": "132260",
      "original_text": "Einreichung neuer Dokumente\nBaden-Württemberg Amtsgericht Stuttgart HRB 762524\nKarl Storz Verwaltungs SE – Tuttlingen",
      "type": "Einreichung neuer Dokumente",
      "state": "Baden-Württemberg",
      "amtsgericht": "Amtsgericht Stuttgart",
      "registernummer": "HRB 762524",
      "registerart": "HRB",
      "company_name": "Karl Storz Verwaltungs SE",
      "company_seat": "Tuttlingen",
      "details": "01.10.2025 (Bekanntmachungsdatum)\n\nBaden-Württemberg Amtsgericht Stuttgart HRB 762524\nEinreichung neuer Dokumente\n\nKarl Storz Verwaltungs SE\nEuropäische Aktiengesellschaft (SE)\nTuttlingen\n\nDie Gesellschaft hat am 23.09.2025 die Liste über die Zusammensetzung des Aufsichtsrats zum Handelsregister eingereicht."
    },
    {
      "date": "2025-10-01",
      "id": "132261",
      "original_text": "Sonstige Registerbekanntmachung\nBerlin Amtsgericht Berlin (Charlottenburg) HRB 115346\nCheckout Charlie GmbH – Berlin",
      "type": "Sonstige Registerbekanntmachung",
      "state": "Berlin",
      "amtsgericht": "Amtsgericht Berlin (Charlottenburg)",
      "registernummer": "HRB 115346",
      "registerart": "HRB",
      "company_name": "Checkout Charlie GmbH",
      "company_seat": "Berlin",
      "details": "01.10.2025 (Bekanntmachungsdatum)\n\nBerlin Amtsgericht Berlin (Charlottenburg) HRB 115346\nSonstige Registerbekanntmachung\n\nCheckout Charlie GmbH\nGesellschaft mit beschränkter Haftung\nBerlin\n\nAls nicht eingetragen wird veröffentlicht: Der andere Vertragsteil hat den Gläubigern dieses Rechtsträgers, deren Forderungen begründet worden sind, bevor die Eintragung der Beendigung dieses Vertrages in das Handelsregister nach § 10 des Handelsgesetzbuches als bekannt gemacht gilt, Sicherheit zu leisten, wenn sie sich binnen sechs Monaten nach der Bekanntmachung der Eintragung zu diesem Zweck bei ihm melden. Dieses Recht steht den Gläubigern nicht zu, die im Fall des Insolvenzverfahrens ein Recht auf vorzugsweise Befriedigung aus der Deckungsmasse haben, die nach gesetzlicher Vorschrift zu ihrem Schutz errichtet und staatlich überwacht ist."
    },
    {
      "date": "2025-10-01",
      "id": "132262",
      "original_text": "Registerbekanntmachung nach dem Umwandlungsgesetz\nSchleswig-Holstein Amtsgericht Pinneberg HRB 485\nHarry-Brot GmbH – Schenefeld/Krs. Pinneberg",
      "type": "Registerbekanntmachung nach dem Umwandlungsgesetz",
      "state": "Schleswig-Holstein",
      "amtsgericht": "Amtsgericht Pinneberg",
      "registernummer": "HRB 485",
      "registerart": "HRB",
      "company_name": "Harry-Brot GmbH",
      "company_seat": "Schenefeld/Krs. Pinneberg",
      "details": "01.10.2025 (Bekanntmachungsdatum)\n\nSchleswig-Holstein Amtsgericht Pinneberg HRB 485\nRegisterbekanntmachung nach dem Umwandlungsgesetz 01.10.2025 (Eintragungsdatum)\n\nHarry-Brot GmbH\nGesellschaft mit beschränkter Haftung\nSchenefeld/Krs. Pinneberg\n\nZu Eintragungsnummer 16 vom 01.10.2025 wird als nicht eingetragen veröffentlicht:  Als nicht eingetragen wird veröffentlicht: Den Gläubigern der an der Spaltung beteiligten Rechtsträger ist, wenn sie binnen sechs Monaten nach dem Tag, an dem die Eintragung der Spaltung in das Register des Sitzes desjenigen Rechtsträgers, dessen Gläubiger sie sind, als bekannt gemacht gilt, ihren Anspruch nach Grund und Höhe schriftlich anmelden, Sicherheit zu leisten, soweit sie nicht Befriedigung verlangen können. Dieses Recht steht den Gläubigern jedoch nur zu, wenn sie glaubhaft machen, dass durch die Spaltung die Erfüllung ihrer Forderung gefährdet wird. Das Recht, Sicherheitsleistung zu verlangen, steht Gläubigern nicht zu, die im Falle der Insolvenz ein Recht auf vorzugsweise Befriedigung aus einer Deckungsmasse haben, die nach gesetzlicher Vorschrift zu ihrem Schutz errichtet und staatlich überwacht ist."
    },
    {
      "date": "2025-10-01",
      "id": "132263",
      "original_text": "Registerbekanntmachung nach dem Umwandlungsgesetz\nHamburg Amtsgericht Hamburg HRB 11788\nBerendsohn Aktiengesellschaft – Hamburg",
      "type": "Registerbekanntmachung nach dem Umwandlungsgesetz",
      "state": "Hamburg",
      "amtsgericht": "Amtsgericht Hamburg",
      "registernummer": "HRB 11788",
      "registerart": "HRB",
      "company_name": "Berendsohn Aktiengesellschaft",
      "company_seat": "Hamburg",
      "details": "01.10.2025 (Bekanntmachungsdatum)\n\nHamburg Amtsgericht Hamburg HRB 11788\nRegisterbekanntmachung nach dem Umwandlungsgesetz 01.10.2025 (Eintragungsdatum)\n\nBerendsohn Aktiengesellschaft\nAktiengesellschaft\nHamburg\n\nAls nicht eingetragen wird bekannt gemacht:\nDen Gläubigern der an der Verschmelzung beteiligten Gesellschaften ist, wenn sie binnen sechs Monaten nach dem Tag, an dem die Eintragung der Verschmelzung in das Register des Sitzes derjenigen Rechtsträger deren Gläubiger sie sind, nach § 19 Absatz 3 UmwG als bekannt gemacht gilt, ihren Anspruch nach Grund und Höhe schriftlich anmelden, Sicherheit zu leisten, soweit sie nicht Befriedigung verlangen können. Dieses Recht steht den Gläubigern jedoch nur zu, wenn sie glaubhaft machen, dass durch die Verschmelzung die Erfüllung ihrer Forderung gefährdet wird."
    },
    {
      "date": "2025-10-01",
      "id": "132264",
      "original_text": "Registerbekanntmachung nach dem Umwandlungsgesetz\nHamburg Amtsgericht Hamburg HRB 67849\nEuro-Gesellschaft für Verkaufsförderung mit beschränkter Haftung – Hamburg",
      "type": "Registerbekanntmachung nach dem Umwandlungsgesetz",
      "state": "Hamburg",
      "amtsgericht": "Amtsgericht Hamburg",
      "registernummer": "HRB 67849",
      "registerart": "HRB",
      "company_name": "Euro-Gesellschaft für Verkaufsförderung mit beschränkter Haftung",
      "company_seat": "Hamburg",
      "details": "01.10.2025 (Bekanntmachungsdatum)\n\nHamburg Amtsgericht Hamburg HRB 67849\nRegisterbekanntmachung nach dem Umwandlungsgesetz 01.10.2025 (Eintragungsdatum)\n\nEuro-Gesellschaft für Verkaufsförderung mit beschränkter Haftung\nGesellschaft mit beschränkter Haftung\nHamburg\n\nAls nicht eingetragen wird bekannt gemacht:\nDen Gläubigern der an der Verschmelzung beteiligten Gesellschaften ist, wenn sie binnen sechs Monaten nach dem Tag, an dem die Eintragung der Verschmelzung in das Register des Sitzes desjenigen Rechtsträgers, dessen Gläubiger sie sind, nach § 19 Absatz 3 UmwG als bekannt gemacht gilt, ihren Anspruch nach Grund und Höhe schriftlich anmelden, Sicherheit zu leisten, soweit sie nicht Befriedigung verlangen können. Dieses Recht steht den Gläubigern jedoch nur zu, wenn sie glaubhaft machen, dass durch die Verschmelzung die Erfüllung ihrer Forderung gefährdet wird."
    },
    {
      "date": "2025-10-01",
      "id": "132265",
      "original_text": "Registerbekanntmachung nach dem Umwandlungsgesetz\nHamburg Amtsgericht Hamburg HRB 108936\nKleine & Jockers GmbH – Hamburg",
      "type": "Registerbekanntmachung nach dem Umwandlungsgesetz",
      "state": "Hamburg",
      "amtsgericht": "Amtsgericht Hamburg",
      "registernummer": "HRB 108936",
      "registerart": "HRB",
      "company_name": "Kleine & Jockers GmbH",
      "company_seat": "Hamburg",
      "details": "01.10.2025 (Bekanntmachungsdatum)\n\nHamburg Amtsgericht Hamburg HRB 108936\nRegisterbekanntmachung nach dem Umwandlungsgesetz 01.10.2025 (Eintragungsdatum)\n\nKleine & Jockers GmbH\nGesellschaft mit beschränkter Haftung\nHamburg\n\nAls nicht eingetragen wird bekannt gemacht:\nDen Gläubigern der an der Verschmelzung beteiligten Gesellschaften ist, wenn sie binnen sechs Monaten nach dem Tag, an dem die Eintragung der Verschmelzung in das Register des Sitzes desjenigen Rechtsträgers, dessen Gläubiger sie sind, nach § 19 Absatz 3 UmwG als bekannt gemacht gilt, ihren Anspruch nach Grund und Höhe schriftlich anmelden, Sicherheit zu leisten, soweit sie nicht Befriedigung verlangen können. Dieses Recht steht den Gläubigern jedoch nur zu, wenn sie glaubhaft machen, dass durch die Verschmelzung die Erfüllung ihrer Forderung gefährdet wird."
    },
    {
      "date": "2025-10-01",
      "id": "132266",
      "original_text": "Registerbekanntmachung nach dem Umwandlungsgesetz\nNordrhein-Westfalen Amtsgericht Coesfeld HRA 10040\nTischlerei Cluse GmbH & Co. KG – Borken",
      "type": "Registerbekanntmachung nach dem Umwandlungsgesetz",
      "state": "Nordrhein-Westfalen",
      "amtsgericht": "Amtsgericht Coesfeld",
      "registernummer": "HRA 10040",
      "registerart": "HRA",
      "company_name": "Tischlerei Cluse GmbH & Co. KG",
      "company_seat": "Borken",
      "details": "01.10.2025 (Bekanntmachungsdatum)\n\nNordrhein-Westfalen Amtsgericht Coesfeld HRA 10040\nRegisterbekanntmachung nach dem Umwandlungsgesetz 01.10.2025 (Eintragungsdatum)\n\nTischlerei Cluse GmbH & Co. KG\nKommanditgesellschaft\nBorken\n\nDen Gläubigern der an der Ausgliederung beteiligten Rechtsträger ist, wenn sie binnen sechs Monaten nach dem Tag, an dem die Eintragung der Ausgliederung in das Register des Sitzes desjenigen Rechtsträgers, dessen Gläubiger sie sind, nach § 19 Absatz 3 UmwG als bekanntgemacht gilt, ihren Anspruch nach Grund und Höhe schriftlich anmelden, Sicherheit zu leisten, soweit sie nicht Befriedigung verlangen können. Dieses Recht steht den Gläubigern jedoch nur zu, wenn sie glaubhaft machen, dass durch die Ausgliederung die Erfüllung ihrer Forderung gefährdet wird."
    },
    {
      "date": "2025-10-01",
      "id": "132267",
      "original_text": "Registerbekanntmachung nach dem Umwandlungsgesetz\nBerlin Amtsgericht Berlin (Charlottenburg) HRB 275576\nIMPERIAL Residential GmbH – Berlin",
      "type": "Registerbekanntmachung nach dem Umwandlungsgesetz",
      "state": "Berlin",
      "amtsgericht": "Amtsgericht Berlin (Charlottenburg)",
      "registernummer": "HRB 275576",
      "registerart": "HRB",
      "company_name": "IMPERIAL Residential GmbH",
      "company_seat": "Berlin",
      "details": "01.10.2025 (Bekanntmachungsdatum)\n\nBerlin Amtsgericht Berlin (Charlottenburg) HRB 275576\nRegisterbekanntmachung nach dem Umwandlungsgesetz 30.09.2025 (Eintragungsdatum)\n\nIMPERIAL Residential GmbH\nGesellschaft mit beschränkter Haftung\nBerlin\n\nZu Eintragungsnummer 3 vom 30.09.2025 wird als nicht eingetragen veröffentlicht: Den Gläubigern der an der Spaltung beteiligten Rechtsträger ist, wenn sie binnen sechs Monaten nach dem Tag, an dem die Eintragung der Spaltung in das Register des Sitzes desjenigen Rechtsträgers, dessen Gläubiger sie sind, als bekannt gemacht gilt, ihren Anspruch nach Grund und Höhe schriftlich anmelden, Sicherheit zu leisten, soweit sie nicht Befriedigung verlangen können. Dieses Recht steht den Gläubigern jedoch nur zu, wenn sie glaubhaft machen, dass durch die Spaltung die Erfüllung ihrer Forderung gefährdet wird. Das Recht, Sicherheitsleistung zu verlangen, steht Gläubigern nicht zu, die im Falle der Insolvenz ein Recht auf vorzugsweise Befriedigung aus einer Deckungsmasse haben, die nach gesetzlicher Vorschrift zu ihrem Schutz errichtet und staatlich überwacht ist."
    },
    {
      "date": "2025-10-01",
      "id": "132268",
      "original_text": "Löschungsankündigung\nBrandenburg Amtsgericht Frankfurt/Oder HRB 21195\nM.D. Großhandel GmbH – Woltersdorf",
      "type": "Löschungsankündigung",
      "state": "Brandenburg",
      "amtsgericht": "Amtsgericht Frankfurt/Oder",
      "registernummer": "HRB 21195",
      "registerart": "HRB",
      "company_name": "M.D. Großhandel GmbH",
      "company_seat": "Woltersdorf",
      "details": "01.10.2025 (Bekanntmachungsdatum)\n\nBrandenburg Amtsgericht Frankfurt/Oder HRB 21195\nLöschungsankündigung\n\nM.D. Großhandel GmbH\nGesellschaft mit beschränkter Haftung\nWoltersdorf\n\nBei der nachstehenden Gesellschaft wird das Amtslöschungsverfahren gemäß § 395 FamFG eingeleitet."
    },
    {
      "date": "2025-10-01",
      "id": "132269",
      "original_text": "Löschungsankündigung\nSachsen Amtsgericht Leipzig HRA 15095\nForm Factory Ltd. & Co KG Sachsen – Jesewitz OT Wölpern",
      "type": "Löschungsankündigung",
      "state": "Sachsen",
      "amtsgericht": "Amtsgericht Leipzig",
      "registernummer": "HRA 15095",
      "registerart": "HRA",
      "company_name": "Form Factory Ltd. & Co KG Sachsen",
      "company_seat": "Jesewitz OT Wölpern",
      "details": "01.10.2025 (Bekanntmachungsdatum)\n\nSachsen Amtsgericht Leipzig HRA 15095\nLöschungsankündigung\n\nForm Factory Ltd. & Co KG Sachsen\nKommanditgesellschaft\nJesewitz OT Wölpern\n\nDas Registergericht beabsichtigt, die im Handelsregister eingetragene Firma von Amts wegen nach § 31 Abs. 2 HGB, 393 FamFG zu löschen. Die Frist zur Erhebung eines Widerspruchs gegen die beabsichtigte Löschung wird auf einen Monat festgesetzt."
    },
    {
      "date": "2025-10-01",
      "id": "132270",
      "original_text": "Einreichung neuer Dokumente\nHamburg Amtsgericht Hamburg HRB 23831\nDr. Helmut Greve Bau- und Boden-Aktiengesellschaft – Hamburg",
      "type": "Einreichung neuer Dokumente",
      "state": "Hamburg",
      "amtsgericht": "Amtsgericht Hamburg",
      "registernummer": "HRB 23831",
      "registerart": "HRB",
      "company_name": "Dr. Helmut Greve Bau- und Boden-Aktiengesellschaft",
      "company_seat": "Hamburg",
      "details": "01.10.2025 (Bekanntmachungsdatum)\n\nHamburg Amtsgericht Hamburg HRB 23831\nEinreichung neuer Dokumente\n\nDr. Helmut Greve Bau- und Boden-Aktiengesellschaft\nAktiengesellschaft\nHamburg\n\nAls nicht eingetragen wird bekannt gemacht: Zwei Listen des Aufsichtsrats wurden eingereicht."
    },
    {
      "date": "2025-10-01",
      "id": "132271",
      "original_text": "Löschungsankündigung\nNiedersachsen Amtsgericht Braunschweig HRB 209833\nFalcos Gastro GmbH – Wolfsburg",
      "type": "Löschungsankündigung",
      "state": "Niedersachsen",
      "amtsgericht": "Amtsgericht Braunschweig",
      "registernummer": "HRB 209833",
      "registerart": "HRB",
      "company_name": "Falcos Gastro GmbH",
      "company_seat": "Wolfsburg",
      "details": "01.10.2025 (Bekanntmachungsdatum)\n\nNiedersachsen Amtsgericht Braunschweig HRB 209833\nLöschungsankündigung 01.10.2025 (Eintragungsdatum)\n\nFalcos Gastro GmbH\nGesellschaft mit beschränkter Haftung\nWolfsburg\n\nDas Registergericht beabsichtigt, die Gesellschaft von Amts wegen nach § 394 FamFG zu löschen. Die Frist zur Erhebung eines Widerspruchs ist auf 1 Monat ab dieser Registerbekanntmachung festgesetzt."
    },
    {
      "date": "2025-10-01",
      "id": "132272",
      "original_text": "Registerbekanntmachung nach dem Umwandlungsgesetz\nNiedersachsen Amtsgericht Osnabrück HRA 202081\nBestattungshaus Pingel GmbH & Co. KG – Lingen (Ems)",
      "type": "Registerbekanntmachung nach dem Umwandlungsgesetz",
      "state": "Niedersachsen",
      "amtsgericht": "Amtsgericht Osnabrück",
      "registernummer": "HRA 202081",
      "registerart": "HRA",
      "company_name": "Bestattungshaus Pingel GmbH & Co. KG",
      "company_seat": "Lingen (Ems)",
      "details": "01.10.2025 (Bekanntmachungsdatum)\n\nNiedersachsen Amtsgericht Osnabrück HRA 202081\nRegisterbekanntmachung nach dem Umwandlungsgesetz 01.10.2025 (Eintragungsdatum)\n\nBestattungshaus Pingel GmbH & Co. KG\nKommanditgesellschaft\nLingen (Ems)\n\nDen Gläubigern der an der formwechselnden Umwandlung beteiligten Rechtsträger ist, wenn sie binnen sechs Monaten nach dem Tag, an dem die Eintragung der Umwandlung in das Register des Sitzes desjenigen Rechtsträgers, dessen Gläubiger sie sind, nach § 19 Abs. 3 UmwG als bekannt gemacht gilt, ihren Anspruch nach Grund und Höhe schriftlich anmelden, Sicherheit zu leisten, soweit sie nicht Befriedigung verlangen können. Dieses Recht steht den Gläubigern jedoch nur zu, wenn sie glaubhaft machen, dass durch die formwechselnde Umwandlung die Erfüllung der Forderung gefährdet wird."
    },
    {
      "date": "2025-10-01",
      "id": "132273",
      "original_text": "Registerbekanntmachung nach dem Umwandlungsgesetz\nNiedersachsen Amtsgericht Hildesheim HRA 200377\nJ. Helmke & Co., Inh. Titus Helmke, e.K. – Sarstedt",
      "type": "Registerbekanntmachung nach dem Umwandlungsgesetz",
      "state": "Niedersachsen",
      "amtsgericht": "Amtsgericht Hildesheim",
      "registernummer": "HRA 200377",
      "registerart": "HRA",
      "company_name": "J. Helmke & Co., Inh. Titus Helmke, e.K.",
      "company_seat": "Sarstedt",
      "details": "01.10.2025 (Bekanntmachungsdatum)\n\nNiedersachsen Amtsgericht Hildesheim HRA 200377\nRegisterbekanntmachung nach dem Umwandlungsgesetz 01.10.2025 (Eintragungsdatum)\n\nJ. Helmke & Co., Inh. Titus Helmke, e.K.\nEinzelkaufmann / Einzelkauffrau\nSarstedt\n\nDen Gläubigern der an der Ausgliederung beteiligten Rechtsträger ist, wenn sie binnen sechs Monaten nach dem Tag, an dem die Eintragung der Ausgliederung in das Register des Sitzes desjenigen Rechtsträgers, dessen Gläubiger sie sind, nach § 19 Abs. 3 UmwG als bekannt gemacht gilt, ihren Anspruch nach Grund und Höhe schriftlich anmelden, Sicherheit zu leisten, soweit sie nicht Befriedigung verlangen können. Dieses Recht steht den Gläubigern jedoch nur zu, wenn sie glaubhaft machen, dass durch die Ausgliederung die Erfüllung der Forderung gefährdet wird."
    },
    {
      "date": "2025-10-01",
      "id": "132274",
      "original_text": "Registerbekanntmachung nach dem Umwandlungsgesetz\nNiedersachsen Amtsgericht Lüneburg HRA 100599 früher Amtsgericht Celle\nDrewsen Spezialpapiere GmbH & Co. KG – Lachendorf",
      "type": "Registerbekanntmachung nach dem Umwandlungsgesetz",
      "state": "Niedersachsen",
      "amtsgericht": "Amtsgericht Lüneburg",
      "registernummer": "HRA 100599",
      "registerart": "HRA",
      "company_name": "Drewsen Spezialpapiere GmbH & Co. KG",
      "company_seat": "Lachendorf",
      "former_amtsgericht": "Celle",
      "details": "01.10.2025 (Bekanntmachungsdatum)\n\nNiedersachsen Amtsgericht Lüneburg HRA 100599 früher Amtsgericht Celle\nRegisterbekanntmachung nach dem Umwandlungsgesetz 01.10.2025 (Eintragungsdatum)\n\nDrewsen Spezialpapiere GmbH & Co. KG\nKommanditgesellschaft\nLachendorf\n\nDen Gläubigern der an der Ausgliederung beteiligten Rechtsträger ist, wenn sie binnen sechs Monaten nach dem Tag, an dem die Eintragung der Ausgliederung in das Register des Sitzes desjenigen Rechtsträgers, dessen Gläubiger sie sind, nach § 19 Abs. 3 UmwG als bekannt gemacht gilt, ihren Anspruch nach Grund und Höhe schriftlich anmelden, Sicherheit zu leisten, soweit sie nicht Befriedigung verlangen können. Dieses Recht steht den Gläubigern jedoch nur zu, wenn sie glaubhaft machen, dass durch die Ausgliederung die Erfüllung der Forderung gefährdet wird."
    },
    {
      "date": "2025-10-01",
      "id": "132275",
      "original_text": "Registerbekanntmachung nach dem Umwandlungsgesetz\nNiedersachsen Amtsgericht Walsrode HRB 213051\nPark Objekt GmbH – Ottersberg",
      "type": "Registerbekanntmachung nach dem Umwandlungsgesetz",
      "state": "Niedersachsen",
      "amtsgericht": "Amtsgericht Walsrode",
      "registernummer": "HRB 213051",
      "registerart": "HRB",
      "company_name": "Park Objekt GmbH",
      "company_seat": "Ottersberg",
      "details": "01.10.2025 (Bekanntmachungsdatum)\n\nNiedersachsen Amtsgericht Walsrode HRB 213051\nRegisterbekanntmachung nach dem Umwandlungsgesetz 01.10.2025 (Eintragungsdatum)\n\nPark Objekt GmbH\nGesellschaft mit beschränkter Haftung\nOttersberg\n\nDen Gläubigern der an der formwechselnden Umwandlung beteiligten Rechtsträger ist, wenn sie binnen sechs Monaten nach dem Tag, an dem die Eintragung der Umwandlung in das Register des Sitzes desjenigen Rechtsträgers, dessen Gläubiger sie sind, nach § 19 Abs. 3 UmwG als bekannt gemacht gilt, ihren Anspruch nach Grund und Höhe schriftlich anmelden, Sicherheit zu leisten, soweit sie nicht Befriedigung verlangen können. Dieses Recht steht den Gläubigern jedoch nur zu, wenn sie glaubhaft machen, dass durch die formwechselnde Umwandlung die Erfüllung der Forderung gefährdet wird."
    },
    {
      "date": "2025-10-01",
      "id": "132276",
      "original_text": "Registerbekanntmachung nach dem Umwandlungsgesetz\nNiedersachsen Amtsgericht Hildesheim HRA 203153\nAhrens Raumausstattung GmbH & Co. KG – Edemissen",
      "type": "Registerbekanntmachung nach dem Umwandlungsgesetz",
      "state": "Niedersachsen",
      "amtsgericht": "Amtsgericht Hildesheim",
      "registernummer": "HRA 203153",
      "registerart": "HRA",
      "company_name": "Ahrens Raumausstattung GmbH & Co. KG",
      "company_seat": "Edemissen",
      "details": "01.10.2025 (Bekanntmachungsdatum)\n\nNiedersachsen Amtsgericht Hildesheim HRA 203153\nRegisterbekanntmachung nach dem Umwandlungsgesetz 01.10.2025 (Eintragungsdatum)\n\nAhrens Raumausstattung GmbH & Co. KG\nKommanditgesellschaft\nEdemissen\n\nDen Gläubigern der an der Ausgliederung beteiligten Rechtsträger ist, wenn sie binnen sechs Monaten nach dem Tag, an dem die Eintragung der Ausgliederung in das Register des Sitzes desjenigen Rechtsträgers, dessen Gläubiger sie sind, nach § 19 Abs. 3 UmwG als bekannt gemacht gilt, ihren Anspruch nach Grund und Höhe schriftlich anmelden, Sicherheit zu leisten, soweit sie nicht Befriedigung verlangen können. Dieses Recht steht den Gläubigern jedoch nur zu, wenn sie glaubhaft machen, dass durch die Ausgliederung die Erfüllung der Forderung gefährdet wird."
    },
    {
      "date": "2025-10-01",
      "id": "132277",
      "original_text": "Registerbekanntmachung nach dem Umwandlungsgesetz\nNiedersachsen Amtsgericht Osnabrück HRB 200789\nSmurfit Westrock Melle GmbH – Melle",
      "type": "Registerbekanntmachung nach dem Umwandlungsgesetz",
      "state": "Niedersachsen",
      "amtsgericht": "Amtsgericht Osnabrück",
      "registernummer": "HRB 200789",
      "registerart": "HRB",
      "company_name": "Smurfit Westrock Melle GmbH",
      "company_seat": "Melle",
      "details": "01.10.2025 (Bekanntmachungsdatum)\n\nNiedersachsen Amtsgericht Osnabrück HRB 200789\nRegisterbekanntmachung nach dem Umwandlungsgesetz 01.10.2025 (Eintragungsdatum)\n\nSmurfit Westrock Melle GmbH\nGesellschaft mit beschränkter Haftung\nMelle\n\nDen Gläubigern der an der Verschmelzung beteiligten Rechtsträger ist, wenn sie binnen sechs Monaten nach dem Tag, an dem die Eintragung der Verschmelzung in das Register des Sitzes desjenigen Rechtsträgers, dessen Gläubiger sie sind, nach § 19  Abs.  3 UmwG als bekannt gemacht gilt, ihren Anspruch nach Grund und Höhe schriftlich anmelden, Sicherheit zu leisten, soweit sie nicht Befriedigung verlangen können. Dieses Recht steht den Gläubigern jedoch nur zu, wenn sie glaubhaft machen, dass durch die Verschmelzung die Erfüllung der Forderung gefährdet wird."
    },
    {
      "date": "2025-10-01",
      "id": "132278",
      "original_text": "Registerbekanntmachung nach dem Umwandlungsgesetz\nNiedersachsen Amtsgericht Osnabrück HRB 216512\nMSS Ventures GmbH – Osnabrück",
      "type": "Registerbekanntmachung nach dem Umwandlungsgesetz",
      "state": "Niedersachsen",
      "amtsgericht": "Amtsgericht Osnabrück",
      "registernummer": "HRB 216512",
      "registerart": "HRB",
      "company_name": "MSS Ventures GmbH",
      "company_seat": "Osnabrück",
      "details": "01.10.2025 (Bekanntmachungsdatum)\n\nNiedersachsen Amtsgericht Osnabrück HRB 216512\nRegisterbekanntmachung nach dem Umwandlungsgesetz 01.10.2025 (Eintragungsdatum)\n\nMSS Ventures GmbH\nGesellschaft mit beschränkter Haftung\nOsnabrück\n\nDen Gläubigern der an der Verschmelzung beteiligten Rechtsträger ist, wenn sie binnen sechs Monaten nach dem Tag, an dem die Eintragung der Verschmelzung in das Register des Sitzes desjenigen Rechtsträgers, dessen Gläubiger sie sind, nach § 19  Abs.  3 UmwG als bekannt gemacht gilt, ihren Anspruch nach Grund und Höhe schriftlich anmelden, Sicherheit zu leisten, soweit sie nicht Befriedigung verlangen können. Dieses Recht steht den Gläubigern jedoch nur zu, wenn sie glaubhaft machen, dass durch die Verschmelzung die Erfüllung der Forderung gefährdet wird."
    },
    {
      "date": "2025-10-01",
      "id": "132279",
      "original_text": "Registerbekanntmachung nach dem Umwandlungsgesetz\nNiedersachsen Amtsgericht Hildesheim HRB 209653\nJHC GmbH – Sarstedt",
      "type": "Registerbekanntmachung nach dem Umwandlungsgesetz",
      "state": "Niedersachsen",
      "amtsgericht": "Amtsgericht Hildesheim",
      "registernummer": "HRB 209653",
      "registerart": "HRB",
      "company_name": "JHC GmbH",
      "company_seat": "Sarstedt",
      "details": "01.10.2025 (Bekanntmachungsdatum)\n\nNiedersachsen Amtsgericht Hildesheim HRB 209653\nRegisterbekanntmachung nach dem Umwandlungsgesetz 01.10.2025 (Eintragungsdatum)\n\nJHC GmbH\nGesellschaft mit beschränkter Haftung\nSarstedt\n\nDen Gläubigern der an der Ausgliederung beteiligten Rechtsträger ist, wenn sie binnen sechs Monaten nach dem Tag, an dem die Eintragung der Ausgliederung in das Register des Sitzes desjenigen Rechtsträgers, dessen Gläubiger sie sind, nach § 19 Abs. 3 UmwG als bekannt gemacht gilt, ihren Anspruch nach Grund und Höhe schriftlich anmelden, Sicherheit zu leisten, soweit sie nicht Befriedigung verlangen können. Dieses Recht steht den Gläubigern jedoch nur zu, wenn sie glaubhaft machen, dass durch die Ausgliederung die Erfüllung der Forderung gefährdet wird."
    },
    {
      "date": "2025-10-01",
      "id": "132280",
      "original_text": "Registerbekanntmachung nach dem Umwandlungsgesetz\nNiedersachsen Amtsgericht Hildesheim HRA 100601 früher Amtsgericht Gifhorn\nEinrichtungshaus Hermann Ahrens Inh. Bettina Ahrens e. K. – Edemissen",
      "type": "Registerbekanntmachung nach dem Umwandlungsgesetz",
      "state": "Niedersachsen",
      "amtsgericht": "Amtsgericht Hildesheim",
      "registernummer": "HRA 100601",
      "registerart": "HRA",
      "company_name": "Einrichtungshaus Hermann Ahrens Inh. Bettina Ahrens e. K.",
      "company_seat": "Edemissen",
      "former_amtsgericht": "Gifhorn",
      "details": "01.10.2025 (Bekanntmachungsdatum)\n\nNiedersachsen Amtsgericht Hildesheim HRA 100601 früher Amtsgericht Gifhorn\nRegisterbekanntmachung nach dem Umwandlungsgesetz 01.10.2025 (Eintragungsdatum)\n\nEinrichtungshaus Hermann Ahrens Inh. Bettina Ahrens e. K.\nEinzelkaufmann / Einzelkauffrau\nEdemissen\n\nDen Gläubigern der an der Ausgliederung beteiligten Rechtsträger ist, wenn sie binnen sechs Monaten nach dem Tag, an dem die Eintragung der Ausgliederung in das Register des Sitzes desjenigen Rechtsträgers, dessen Gläubiger sie sind, nach § 19 Abs. 3 UmwG als bekannt gemacht gilt, ihren Anspruch nach Grund und Höhe schriftlich anmelden, Sicherheit zu leisten, soweit sie nicht Befriedigung verlangen können. Dieses Recht steht den Gläubigern jedoch nur zu, wenn sie glaubhaft machen, dass durch die Ausgliederung die Erfüllung der Forderung gefährdet wird."
    },
    {
      "date": "2025-10-01",
      "id": "132281",
      "original_text": "Registerbekanntmachung nach dem Umwandlungsgesetz\nNiedersachsen Amtsgericht Hildesheim HRA 202797\nJens Müller Immobilien GmbH & Co. KG – Lehrte",
      "type": "Registerbekanntmachung nach dem Umwandlungsgesetz",
      "state": "Niedersachsen",
      "amtsgericht": "Amtsgericht Hildesheim",
      "registernummer": "HRA 202797",
      "registerart": "HRA",
      "company_name": "Jens Müller Immobilien GmbH & Co. KG",
      "company_seat": "Lehrte",
      "details": "01.10.2025 (Bekanntmachungsdatum)\n\nNiedersachsen Amtsgericht Hildesheim HRA 202797\nRegisterbekanntmachung nach dem Umwandlungsgesetz 01.10.2025 (Eintragungsdatum)\n\nJens Müller Immobilien GmbH & Co. KG\nKommanditgesellschaft\nLehrte\n\nDen Gläubigern der an der Verschmelzung beteiligten Rechtsträger ist, wenn sie binnen sechs Monaten nach dem Tag, an dem die Eintragung der Verschmelzung in das Register des Sitzes desjenigen Rechtsträgers, dessen Gläubiger sie sind, nach § 19  Abs.  3 UmwG als bekannt gemacht gilt, ihren Anspruch nach Grund und Höhe schriftlich anmelden, Sicherheit zu leisten, soweit sie nicht Befriedigung verlangen können. Dieses Recht steht den Gläubigern jedoch nur zu, wenn sie glaubhaft machen, dass durch die Verschmelzung die Erfüllung der Forderung gefährdet wird."
    },
    {
      "date": "2025-10-01",
      "id": "132282",
      "original_text": "Löschungsankündigung\nNiedersachsen Amtsgericht Lüneburg HRB 211806\nLucacelli Systemgastronomie GmbH – Seevetal",
      "type": "Löschungsankündigung",
      "state": "Niedersachsen",
      "amtsgericht": "Amtsgericht Lüneburg",
      "registernummer": "HRB 211806",
      "registerart": "HRB",
      "company_name": "Lucacelli Systemgastronomie GmbH",
      "company_seat": "Seevetal",
      "details": "01.10.2025 (Bekanntmachungsdatum)\n\nNiedersachsen Amtsgericht Lüneburg HRB 211806\nLöschungsankündigung 13.08.2025 (Eintragungsdatum)\n\nLucacelli Systemgastronomie GmbH\nGesellschaft mit beschränkter Haftung\nSeevetal\n\nDas Registergericht beabsichtigt, die Gesellschaft von Amts wegen nach § 394 FamFG zu löschen. Die Frist zur Erhebung eines Widerspruchs ist auf 1 Monat ab dieser Registerbekanntmachung festgesetzt."
    },
    {
      "date": "2025-10-01",
      "id": "132283",
      "original_text": "Löschungsankündigung\nNiedersachsen Amtsgericht Aurich HRB 205436\nMB Fassadentechnik GmbH – Moormerland",
      "type": "Löschungsankündigung",
      "state": "Niedersachsen",
      "amtsgericht": "Amtsgericht Aurich",
      "registernummer": "HRB 205436",
      "registerart": "HRB",
      "company_name": "MB Fassadentechnik GmbH",
      "company_seat": "Moormerland",
      "details": "01.10.2025 (Bekanntmachungsdatum)\n\nNiedersachsen Amtsgericht Aurich HRB 205436\nLöschungsankündigung 01.10.2025 (Eintragungsdatum)\n\nMB Fassadentechnik GmbH\nGesellschaft mit beschränkter Haftung\nMoormerland\n\nDas Registergericht beabsichtigt, die Gesellschaft von Amts wegen nach § 394 FamFG zu löschen. Die Frist zur Erhebung eines Widerspruchs ist auf 1 Monat ab dieser Registerbekanntmachung festgesetzt."
    },
    {
      "date": "2025-10-01",
      "id": "132284",
      "original_text": "Registerbekanntmachung nach dem Umwandlungsgesetz\nNiedersachsen Amtsgericht Hildesheim HRA 200447\nH. H. GmbH & Co. KG – Sarstedt",
      "type": "Registerbekanntmachung nach dem Umwandlungsgesetz",
      "state": "Niedersachsen",
      "amtsgericht": "Amtsgericht Hildesheim",
      "registernummer": "HRA 200447",
      "registerart": "HRA",
      "company_name": "H. H. GmbH & Co. KG",
      "company_seat": "Sarstedt",
      "details": "01.10.2025 (Bekanntmachungsdatum)\n\nNiedersachsen Amtsgericht Hildesheim HRA 200447\nRegisterbekanntmachung nach dem Umwandlungsgesetz 01.10.2025 (Eintragungsdatum)\n\nH. H. GmbH & Co. KG\nKommanditgesellschaft\nSarstedt\n\nDen Gläubigern der an der Ausgliederung beteiligten Rechtsträger ist, wenn sie binnen sechs Monaten nach dem Tag, an dem die Eintragung der Ausgliederung in das Register des Sitzes desjenigen Rechtsträgers, dessen Gläubiger sie sind, nach § 19 Abs. 3 UmwG als bekannt gemacht gilt, ihren Anspruch nach Grund und Höhe schriftlich anmelden, Sicherheit zu leisten, soweit sie nicht Befriedigung verlangen können. Dieses Recht steht den Gläubigern jedoch nur zu, wenn sie glaubhaft machen, dass durch die Ausgliederung die Erfüllung der Forderung gefährdet wird."
    },
    {
      "date": "2025-10-01",
      "id": "132285",
      "original_text": "Registerbekanntmachung nach dem Umwandlungsgesetz\nNiedersachsen Amtsgericht Hildesheim HRA 200447\nH. H. GmbH & Co. KG – Sarstedt",
      "type": "Registerbekanntmachung nach dem Umwandlungsgesetz",
      "state": "Niedersachsen",
      "amtsgericht": "Amtsgericht Hildesheim",
      "registernummer": "HRA 200447",
      "registerart": "HRA",
      "company_name": "H. H. GmbH & Co. KG",
      "company_seat": "Sarstedt",
      "details": "01.10.2025 (Bekanntmachungsdatum)\n\nNiedersachsen Amtsgericht Hildesheim HRA 200447\nRegisterbekanntmachung nach dem Umwandlungsgesetz 01.10.2025 (Eintragungsdatum)\n\nH. H. GmbH & Co. KG\nKommanditgesellschaft\nSarstedt\n\nDen Gläubigern der an der Ausgliederung beteiligten Rechtsträger ist, wenn sie binnen sechs Monaten nach dem Tag, an dem die Eintragung der Ausgliederung in das Register des Sitzes desjenigen Rechtsträgers, dessen Gläubiger sie sind, nach § 19 Abs. 3 UmwG als bekannt gemacht gilt, ihren Anspruch nach Grund und Höhe schriftlich anmelden, Sicherheit zu leisten, soweit sie nicht Befriedigung verlangen können. Dieses Recht steht den Gläubigern jedoch nur zu, wenn sie glaubhaft machen, dass durch die Ausgliederung die Erfüllung der Forderung gefährdet wird."
    },
    {
      "date": "2025-10-01",
      "id": "132286",
      "original_text": "Registerbekanntmachung nach dem Umwandlungsgesetz\nNiedersachsen Amtsgericht Hildesheim HRB 209653\nJHC GmbH – Sarstedt",
      "type": "Registerbekanntmachung nach dem Umwandlungsgesetz",
      "state": "Niedersachsen",
      "amtsgericht": "Amtsgericht Hildesheim",
      "registernummer": "HRB 209653",
      "registerart": "HRB",
      "company_name": "JHC GmbH",
      "company_seat": "Sarstedt",
      "details": "01.10.2025 (Bekanntmachungsdatum)\n\nNiedersachsen Amtsgericht Hildesheim HRB 209653\nRegisterbekanntmachung nach dem Umwandlungsgesetz 01.10.2025 (Eintragungsdatum)\n\nJHC GmbH\nGesellschaft mit beschränkter Haftung\nSarstedt\n\nDen Gläubigern der an der Ausgliederung beteiligten Rechtsträger ist, wenn sie binnen sechs Monaten nach dem Tag, an dem die Eintragung der Ausgliederung in das Register des Sitzes desjenigen Rechtsträgers, dessen Gläubiger sie sind, nach § 19 Abs. 3 UmwG als bekannt gemacht gilt, ihren Anspruch nach Grund und Höhe schriftlich anmelden, Sicherheit zu leisten, soweit sie nicht Befriedigung verlangen können. Dieses Recht steht den Gläubigern jedoch nur zu, wenn sie glaubhaft machen, dass durch die Ausgliederung die Erfüllung der Forderung gefährdet wird."
    },
    {
      "date": "2025-10-01",
      "id": "132287",
      "original_text": "Registerbekanntmachung nach dem Umwandlungsgesetz\nNiedersachsen Amtsgericht Osnabrück HRA 209736\nElektro Batz GmbH & Co. KG – Spelle",
      "type": "Registerbekanntmachung nach dem Umwandlungsgesetz",
      "state": "Niedersachsen",
      "amtsgericht": "Amtsgericht Osnabrück",
      "registernummer": "HRA 209736",
      "registerart": "HRA",
      "company_name": "Elektro Batz GmbH & Co. KG",
      "company_seat": "Spelle",
      "details": "01.10.2025 (Bekanntmachungsdatum)\n\nNiedersachsen Amtsgericht Osnabrück HRA 209736\nRegisterbekanntmachung nach dem Umwandlungsgesetz 01.10.2025 (Eintragungsdatum)\n\nElektro Batz GmbH & Co. KG\nKommanditgesellschaft\nSpelle\n\nDen Gläubigern der an der Ausgliederung beteiligten Rechtsträger ist, wenn sie binnen sechs Monaten nach dem Tag, an dem die Eintragung der Ausgliederung in das Register des Sitzes desjenigen Rechtsträgers, dessen Gläubiger sie sind, nach § 19 Abs. 3 UmwG als bekannt gemacht gilt, ihren Anspruch nach Grund und Höhe schriftlich anmelden, Sicherheit zu leisten, soweit sie nicht Befriedigung verlangen können. Dieses Recht steht den Gläubigern jedoch nur zu, wenn sie glaubhaft machen, dass durch die Ausgliederung die Erfüllung der Forderung gefährdet wird."
    },
    {
      "date": "2025-10-01",
      "id": "132288",
      "original_text": "Registerbekanntmachung nach dem Umwandlungsgesetz\nNiedersachsen Amtsgericht Hildesheim HRB 209821\nH. M. Handels- und Dienstleistungsgesellschaft mbH – Lehrte",
      "type": "Registerbekanntmachung nach dem Umwandlungsgesetz",
      "state": "Niedersachsen",
      "amtsgericht": "Amtsgericht Hildesheim",
      "registernummer": "HRB 209821",
      "registerart": "HRB",
      "company_name": "H. M. Handels- und Dienstleistungsgesellschaft mbH",
      "company_seat": "Lehrte",
      "details": "01.10.2025 (Bekanntmachungsdatum)\n\nNiedersachsen Amtsgericht Hildesheim HRB 209821\nRegisterbekanntmachung nach dem Umwandlungsgesetz 01.10.2025 (Eintragungsdatum)\n\nH. M. Handels- und Dienstleistungsgesellschaft mbH\nGesellschaft mit beschränkter Haftung\nLehrte\n\nDen Gläubigern der an der Verschmelzung beteiligten Rechtsträger ist, wenn sie binnen sechs Monaten nach dem Tag, an dem die Eintragung der Verschmelzung in das Register des Sitzes desjenigen Rechtsträgers, dessen Gläubiger sie sind, nach § 19  Abs.  3 UmwG als bekannt gemacht gilt, ihren Anspruch nach Grund und Höhe schriftlich anmelden, Sicherheit zu leisten, soweit sie nicht Befriedigung verlangen können. Dieses Recht steht den Gläubigern jedoch nur zu, wenn sie glaubhaft machen, dass durch die Verschmelzung die Erfüllung der Forderung gefährdet wird."
    },
    {
      "date": "2025-10-01",
      "id": "132289",
      "original_text": "Löschungsankündigung\nNiedersachsen Amtsgericht Oldenburg (Oldenburg) HRB 211824\nZweite Bojen Beteiligungs GmbH – Delmenhorst",
      "type": "Löschungsankündigung",
      "state": "Niedersachsen",
      "amtsgericht": "Amtsgericht Oldenburg (Oldenburg)",
      "registernummer": "HRB 211824",
      "registerart": "HRB",
      "company_name": "Zweite Bojen Beteiligungs GmbH",
      "company_seat": "Delmenhorst",
      "details": "01.10.2025 (Bekanntmachungsdatum)\n\nNiedersachsen Amtsgericht Oldenburg (Oldenburg) HRB 211824\nLöschungsankündigung\n\nZweite Bojen Beteiligungs GmbH\nGesellschaft mit beschränkter Haftung\nDelmenhorst\n\nDas Registergericht beabsichtigt, die Gesellschaft von Amts wegen nach § 394 FamFG zu löschen. Die Frist zur Erhebung eines Widerspruchs ist auf 1 Monat ab dieser Registerbekanntmachung festgesetzt."
    },
    {
      "date": "2025-10-01",
      "id": "132290",
      "original_text": "Registerbekanntmachung nach dem Umwandlungsgesetz\nNiedersachsen Amtsgericht Osnabrück HRA 200074\nMarel GmbH & Co. KG – Osnabrück",
      "type": "Registerbekanntmachung nach dem Umwandlungsgesetz",
      "state": "Niedersachsen",
      "amtsgericht": "Amtsgericht Osnabrück",
      "registernummer": "HRA 200074",
      "registerart": "HRA",
      "company_name": "Marel GmbH & Co. KG",
      "company_seat": "Osnabrück",
      "details": "01.10.2025 (Bekanntmachungsdatum)\n\nNiedersachsen Amtsgericht Osnabrück HRA 200074\nRegisterbekanntmachung nach dem Umwandlungsgesetz 01.10.2025 (Eintragungsdatum)\n\nMarel GmbH & Co. KG\nKommanditgesellschaft\nOsnabrück\n\nDen Gläubigern der an der formwechselnden Umwandlung beteiligten Rechtsträger ist, wenn sie binnen sechs Monaten nach dem Tag, an dem die Eintragung der Umwandlung in das Register des Sitzes desjenigen Rechtsträgers, dessen Gläubiger sie sind, nach § 19 Abs. 3 UmwG als bekannt gemacht gilt, ihren Anspruch nach Grund und Höhe schriftlich anmelden, Sicherheit zu leisten, soweit sie nicht Befriedigung verlangen können. Dieses Recht steht den Gläubigern jedoch nur zu, wenn sie glaubhaft machen, dass durch die formwechselnde Umwandlung die Erfüllung der Forderung gefährdet wird."
    },
    {
      "date": "2025-10-01",
      "id": "132291",
      "original_text": "Registerbekanntmachung nach dem Umwandlungsgesetz\nNiedersachsen Amtsgericht Hildesheim HRB 201804\nHELMKE GmbH – Sarstedt",
      "type": "Registerbekanntmachung nach dem Umwandlungsgesetz",
      "state": "Niedersachsen",
      "amtsgericht": "Amtsgericht Hildesheim",
      "registernummer": "HRB 201804",
      "registerart": "HRB",
      "company_name": "HELMKE GmbH",
      "company_seat": "Sarstedt",
      "details": "01.10.2025 (Bekanntmachungsdatum)\n\nNiedersachsen Amtsgericht Hildesheim HRB 201804\nRegisterbekanntmachung nach dem Umwandlungsgesetz 01.10.2025 (Eintragungsdatum)\n\nHELMKE GmbH\nGesellschaft mit beschränkter Haftung\nSarstedt\n\nDen Gläubigern der an der Ausgliederung beteiligten Rechtsträger ist, wenn sie binnen sechs Monaten nach dem Tag, an dem die Eintragung der Ausgliederung in das Register des Sitzes desjenigen Rechtsträgers, dessen Gläubiger sie sind, nach § 19 Abs. 3 UmwG als bekannt gemacht gilt, ihren Anspruch nach Grund und Höhe schriftlich anmelden, Sicherheit zu leisten, soweit sie nicht Befriedigung verlangen können. Dieses Recht steht den Gläubigern jedoch nur zu, wenn sie glaubhaft machen, dass durch die Ausgliederung die Erfüllung der Forderung gefährdet wird."
    },
    {
      "date": "2025-10-01",
      "id": "132292",
      "original_text": "Registerbekanntmachung nach dem Umwandlungsgesetz\nNiedersachsen Amtsgericht Lüneburg HRA 204541\nDrewsen Interim GmbH & Co. KG – Lachendorf",
      "type": "Registerbekanntmachung nach dem Umwandlungsgesetz",
      "state": "Niedersachsen",
      "amtsgericht": "Amtsgericht Lüneburg",
      "registernummer": "HRA 204541",
      "registerart": "HRA",
      "company_name": "Drewsen Interim GmbH & Co. KG",
      "company_seat": "Lachendorf",
      "details": "01.10.2025 (Bekanntmachungsdatum)\n\nNiedersachsen Amtsgericht Lüneburg HRA 204541\nRegisterbekanntmachung nach dem Umwandlungsgesetz 01.10.2025 (Eintragungsdatum)\n\nDrewsen Interim GmbH & Co. KG\nKommanditgesellschaft\nLachendorf\n\nDen Gläubigern der an der Ausgliederung beteiligten Rechtsträger ist, wenn sie binnen sechs Monaten nach dem Tag, an dem die Eintragung der Ausgliederung in das Register des Sitzes desjenigen Rechtsträgers, dessen Gläubiger sie sind, nach § 19 Abs. 3 UmwG als bekannt gemacht gilt, ihren Anspruch nach Grund und Höhe schriftlich anmelden, Sicherheit zu leisten, soweit sie nicht Befriedigung verlangen können. Dieses Recht steht den Gläubigern jedoch nur zu, wenn sie glaubhaft machen, dass durch die Ausgliederung die Erfüllung der Forderung gefährdet wird."
    },
    {
      "date": "2025-10-01",
      "id": "132293",
      "original_text": "Löschungsankündigung\nRheinland-Pfalz Amtsgericht Montabaur HRA 21551\nERDA Service UG (haftungsbeschränkt) & Co. KG – Hundsangen",
      "type": "Löschungsankündigung",
      "state": "Rheinland-Pfalz",
      "amtsgericht": "Amtsgericht Montabaur",
      "registernummer": "HRA 21551",
      "registerart": "HRA",
      "company_name": "ERDA Service UG (haftungsbeschränkt) & Co. KG",
      "company_seat": "Hundsangen",
      "details": "01.10.2025 (Bekanntmachungsdatum)\n\nRheinland-Pfalz Amtsgericht Montabaur HRA 21551\nLöschungsankündigung 23.07.2025 (Eintragungsdatum)\n\nERDA Service UG (haftungsbeschränkt) & Co. KG\nKommanditgesellschaft\nHundsangen\n\nDas Registergericht beabsichtigt die Firma von Amts wegen nach § 394 FamFG zu löschen. Die Frist zur Erhebung eines Widerspruchs ist auf einen Monat festgesetzt."
    },
    {
      "date": "2025-10-01",
      "id": "132294",
      "original_text": "Registerbekanntmachung nach dem Umwandlungsgesetz\nRheinland-Pfalz Amtsgericht Mainz HRA 44945\nRadelli Energie- und Gebäudetechnik GmbH & Co. KG – Appenheim",
      "type": "Registerbekanntmachung nach dem Umwandlungsgesetz",
      "state": "Rheinland-Pfalz",
      "amtsgericht": "Amtsgericht Mainz",
      "registernummer": "HRA 44945",
      "registerart": "HRA",
      "company_name": "Radelli Energie- und Gebäudetechnik GmbH & Co. KG",
      "company_seat": "Appenheim",
      "details": "01.10.2025 (Bekanntmachungsdatum)\n\nRheinland-Pfalz Amtsgericht Mainz HRA 44945\nRegisterbekanntmachung nach dem Umwandlungsgesetz 01.10.2025 (Eintragungsdatum)\n\nRadelli Energie- und Gebäudetechnik GmbH & Co. KG\nKommanditgesellschaft\nAppenheim\n\nAls nicht eingetragen wird veröffentlicht:\nDen Gläubigern der an der Ausgliederung beteiligten Rechtsträger ist, wenn sie binnen sechs Monaten nach dem Tag, an dem die Eintragung der Ausgliederung in das Register des Sitzes desjenigen Rechtsträgers, dessen Gläubiger sie sind, nach § 19 Abs. 3 UmwG als bekannt gemacht gilt, ihren Anspruch nach Grund und Höhe schriftlich anmelden, Sicherheit zu leisten, soweit sie nicht Befriedigung verlangen können. Dieses Recht steht den Gläubigern jedoch nur zu, wenn sie glaubhaft machen, dass durch die Ausgliederung die Erfüllung der Forderung gefährdet wird."
    },
    {
      "date": "2025-10-01",
      "id": "132295",
      "original_text": "Registerbekanntmachung nach dem Umwandlungsgesetz\nRheinland-Pfalz Amtsgericht Mainz HRB 7607\nBiolith Grundstücksverwaltungsgesellschaft mbH – Mainz",
      "type": "Registerbekanntmachung nach dem Umwandlungsgesetz",
      "state": "Rheinland-Pfalz",
      "amtsgericht": "Amtsgericht Mainz",
      "registernummer": "HRB 7607",
      "registerart": "HRB",
      "company_name": "Biolith Grundstücksverwaltungsgesellschaft mbH",
      "company_seat": "Mainz",
      "details": "01.10.2025 (Bekanntmachungsdatum)\n\nRheinland-Pfalz Amtsgericht Mainz HRB 7607\nRegisterbekanntmachung nach dem Umwandlungsgesetz 01.10.2025 (Eintragungsdatum)\n\nBiolith Grundstücksverwaltungsgesellschaft mbH\nGesellschaft mit beschränkter Haftung\nMainz\n\nAls nicht eingetragen wird veröffentlicht:\nDen Gläubigern der an der Verschmelzung beteiligten Rechtsträger ist, wenn sie binnen sechs Monaten nach dem Tag, an dem die Eintragung der Verschmelzung in das Register des Sitzes desjenigen Rechtsträgers, dessen Gläubiger sie sind, nach § 19 Abs. 3 UmwG als bekannt gemacht gilt, ihren Anspruch nach Grund und Höhe schriftlich anmelden, Sicherheit zu leisten, soweit sie nicht Befriedigung verlangen können. Dieses Recht steht den Gläubigern jedoch nur zu, wenn sie glaubhaft machen, dass durch die Verschmelzung die Erfüllung der Forderung gefährdet wird."
    },
    {
      "date": "2025-10-01",
      "id": "132296",
      "original_text": "Registerbekanntmachung nach dem Umwandlungsgesetz\nRheinland-Pfalz Amtsgericht Mainz HRA 44929\nAndreas Radelli Klimatechnik e. K. – Appenheim",
      "type": "Registerbekanntmachung nach dem Umwandlungsgesetz",
      "state": "Rheinland-Pfalz",
      "amtsgericht": "Amtsgericht Mainz",
      "registernummer": "HRA 44929",
      "registerart": "HRA",
      "company_name": "Andreas Radelli Klimatechnik e. K.",
      "company_seat": "Appenheim",
      "details": "01.10.2025 (Bekanntmachungsdatum)\n\nRheinland-Pfalz Amtsgericht Mainz HRA 44929\nRegisterbekanntmachung nach dem Umwandlungsgesetz 01.10.2025 (Eintragungsdatum)\n\nAndreas Radelli Klimatechnik e. K.\nEinzelkaufmann / Einzelkauffrau\nAppenheim\n\nAls nicht eingetragen wird veröffentlicht:\nDen Gläubigern der an der Ausgliederung beteiligten Rechtsträger ist, wenn sie binnen sechs Monaten nach dem Tag, an dem die Eintragung der Ausgliederung in das Register des Sitzes desjenigen Rechtsträgers, dessen Gläubiger sie sind, nach § 19 Abs. 3 UmwG als bekannt gemacht gilt, ihren Anspruch nach Grund und Höhe schriftlich anmelden, Sicherheit zu leisten, soweit sie nicht Befriedigung verlangen können. Dieses Recht steht den Gläubigern jedoch nur zu, wenn sie glaubhaft machen, dass durch die Ausgliederung die Erfüllung der Forderung gefährdet wird."
    },
    {
      "date": "2025-10-01",
      "id": "132297",
      "original_text": "Registerbekanntmachung nach dem Umwandlungsgesetz\nRheinland-Pfalz Amtsgericht Mainz HRB 44216\nManpower Personaldienstleistung GmbH – Mainz",
      "type": "Registerbekanntmachung nach dem Umwandlungsgesetz",
      "state": "Rheinland-Pfalz",
      "amtsgericht": "Amtsgericht Mainz",
      "registernummer": "HRB 44216",
      "registerart": "HRB",
      "company_name": "Manpower Personaldienstleistung GmbH",
      "company_seat": "Mainz",
      "details": "01.10.2025 (Bekanntmachungsdatum)\n\nRheinland-Pfalz Amtsgericht Mainz HRB 44216\nRegisterbekanntmachung nach dem Umwandlungsgesetz 01.10.2025 (Eintragungsdatum)\n\nManpower Personaldienstleistung GmbH\nGesellschaft mit beschränkter Haftung\nMainz\n\nAls nicht eingetragen wird veröffentlicht:\nDen Gläubigern der an Verschmelzung beteiligten Rechtsträger ist, wenn sie binnen sechs Monaten nach dem Tag, an dem die Eintragung der Verschmelzung in das Register des Sitzes desjenigen Rechtsträgers, dessen Gläubiger sie sind, nach § 19 Abs. 3 UmwG als bekannt gemacht gilt, ihren Anspruch nach Grund und Höhe schriftlich anmelden, Sicherheit zu leisten, soweit sie nicht Befriedigung verlangen können. Dieses Recht steht den Gläubigern jedoch nur zu, wenn sie glaubhaft machen, dass durch die Verschmelzung die Erfüllung der Forderung gefährdet wird."
    },
    {
      "date": "2025-10-01",
      "id": "132298",
      "original_text": "Registerbekanntmachung nach dem Umwandlungsgesetz\nRheinland-Pfalz Amtsgericht Koblenz HRB 30153\nbulwiengesa GmbH – Bad Neuenahr-Ahrweiler",
      "type": "Registerbekanntmachung nach dem Umwandlungsgesetz",
      "state": "Rheinland-Pfalz",
      "amtsgericht": "Amtsgericht Koblenz",
      "registernummer": "HRB 30153",
      "registerart": "HRB",
      "company_name": "bulwiengesa GmbH",
      "company_seat": "Bad Neuenahr-Ahrweiler",
      "details": "01.10.2025 (Bekanntmachungsdatum)\n\nRheinland-Pfalz Amtsgericht Koblenz HRB 30153\nRegisterbekanntmachung nach dem Umwandlungsgesetz 01.10.2025 (Eintragungsdatum)\n\nbulwiengesa GmbH\nGesellschaft mit beschränkter Haftung\nBad Neuenahr-Ahrweiler\n\nAls nicht eingetragen wird veröffentlicht: Den Gläubigern der an der Verschmelzung beteiligten Rechtsträger ist, wenn sie binnen sechs Monaten nach dem Tag, an dem die Eintragung der Verschmelzung in das Register des Sitzes desjenigen Rechtsträgers,dessen Gläubiger sie sind, nach § 19 Abs. 3 UmwG als bekannt gemacht gilt, ihren Anspruch nach Grund und Höhe schriftlich anmelden, Sicherheit zu leisten, soweit sie nicht Befriedigung verlangen können. Dieses Recht steht den Gläubigern jedoch nur zu, wenn sie glaubhaft machen, dass durch die Verschmelzung die Erfüllungd er Forderung gefährdet wird."
    },
    {
      "date": "2025-10-01",
      "id": "132299",
      "original_text": "Registerbekanntmachung nach dem Umwandlungsgesetz\nRheinland-Pfalz Amtsgericht Mainz HRB 42934\nManpower Experts GmbH – Mainz",
      "type": "Registerbekanntmachung nach dem Umwandlungsgesetz",
      "state": "Rheinland-Pfalz",
      "amtsgericht": "Amtsgericht Mainz",
      "registernummer": "HRB 42934",
      "registerart": "HRB",
      "company_name": "Manpower Experts GmbH",
      "company_seat": "Mainz",
      "details": "01.10.2025 (Bekanntmachungsdatum)\n\nRheinland-Pfalz Amtsgericht Mainz HRB 42934\nRegisterbekanntmachung nach dem Umwandlungsgesetz 01.10.2025 (Eintragungsdatum)\n\nManpower Experts GmbH\nGesellschaft mit beschränkter Haftung\nMainz\n\nAls nicht eingetragen wird veröffentlicht: Den Gläubigern der an der Verschmelzung beteiligten Rechtsträger ist, wenn sie binnen sechs Monaten nach dem Tag, an dem die Eintragung der Verschmelzung in das Register des Sitzes desjenigen Rechtsträgers, dessen Gläubiger sie sind, nach § 19 Abs. 3 UmwG als bekannt gemacht gilt, ihren Anspruch nach Grund und Höhe schriftlich anmelden, Sicherheit zu leisten, soweit sie nicht Befriedigung verlangen können. Dieses Recht steht den Gläubigern jedoch nur zu, wenn sie glaubhaft machen, dass durch die Verschmelzung die Erfüllung der Forderung gefährdet wird."
    },
    {
      "date": "2025-10-01",
      "id": "132300",
      "original_text": "Registerbekanntmachung nach dem Umwandlungsgesetz\nRheinland-Pfalz Amtsgericht Koblenz HRB 13693\nSprengnetter Property Valuation Finance GmbH – Bad Neuenahr-Ahrweiler",
      "type": "Registerbekanntmachung nach dem Umwandlungsgesetz",
      "state": "Rheinland-Pfalz",
      "amtsgericht": "Amtsgericht Koblenz",
      "registernummer": "HRB 13693",
      "registerart": "HRB",
      "company_name": "Sprengnetter Property Valuation Finance GmbH",
      "company_seat": "Bad Neuenahr-Ahrweiler",
      "details": "01.10.2025 (Bekanntmachungsdatum)\n\nRheinland-Pfalz Amtsgericht Koblenz HRB 13693\nRegisterbekanntmachung nach dem Umwandlungsgesetz 01.10.2025 (Eintragungsdatum)\n\nSprengnetter Property Valuation Finance GmbH\nGesellschaft mit beschränkter Haftung\nBad Neuenahr-Ahrweiler\n\nAls nicht eingetragen wird veröffentlicht: Den Gläubigern der an der Verschmelzung beteiligten Rechtsträger ist, wenn sie binnen sechs Monaten nach dem Tag, an dem die Eintragung der Verschmelzung in das Register des Sitzes desjenigen Rechtsträgers,dessen Gläubiger sie sind, nach § 19 Abs. 3 UmwG als bekannt gemacht gilt, ihren Anspruch nach Grund und Höhe schriftlich anmelden, Sicherheit zu leisten, soweit sie nicht Befriedigung verlangen können. Dieses Recht steht den Gläubigern jedoch nur zu, wenn sie glaubhaft machen, dass durch die Verschmelzung die Erfüllung der Forderung gefährdet wird."
    },
    {
      "date": "2025-10-01",
      "id": "132301",
      "original_text": "Registerbekanntmachung nach dem Umwandlungsgesetz\nNordrhein-Westfalen Amtsgericht Köln HRA 38318\nConesso Pictures, Ricardo Morote e.K. – Köln",
      "type": "Registerbekanntmachung nach dem Umwandlungsgesetz",
      "state": "Nordrhein-Westfalen",
      "amtsgericht": "Amtsgericht Köln",
      "registernummer": "HRA 38318",
      "registerart": "HRA",
      "company_name": "Conesso Pictures, Ricardo Morote e.K.",
      "company_seat": "Köln",
      "details": "01.10.2025 (Bekanntmachungsdatum)\n\nNordrhein-Westfalen Amtsgericht Köln HRA 38318\nRegisterbekanntmachung nach dem Umwandlungsgesetz 01.10.2025 (Eintragungsdatum)\n\nConesso Pictures, Ricardo Morote e.K.\nEinzelkaufmann / Einzelkauffrau\nKöln\n\nDen Gläubigern der an der Ausgliederung beteiligten Rechtsträger ist, wenn sie binnen sechs Monaten nach dem Tag, an dem die Eintragung der Ausgliederung in das Register des Sitzes desjenigen Rechtsträgers, dessen Gläubiger sie sind, nach § 19 Absatz 3 UmwG als bekanntgemacht gilt, ihren Anspruch nach Grund und Höhe schriftlich anmelden, Sicherheit zu leisten, soweit sie nicht Befriedigung verlangen können. Dieses Recht steht den Gläubigern jedoch nur zu, wenn sie glaubhaft machen, dass durch die Ausgliederung die Erfüllung ihrer Forderung gefährdet wird."
    },
    {
      "date": "2025-10-01",
      "id": "132302",
      "original_text": "Registerbekanntmachung nach dem Umwandlungsgesetz\nNordrhein-Westfalen Amtsgericht Hamm HRB 11887\nF&K Dental GmbH – Hamm",
      "type": "Registerbekanntmachung nach dem Umwandlungsgesetz",
      "state": "Nordrhein-Westfalen",
      "amtsgericht": "Amtsgericht Hamm",
      "registernummer": "HRB 11887",
      "registerart": "HRB",
      "company_name": "F&K Dental GmbH",
      "company_seat": "Hamm",
      "details": "01.10.2025 (Bekanntmachungsdatum)\n\nNordrhein-Westfalen Amtsgericht Hamm HRB 11887\nRegisterbekanntmachung nach dem Umwandlungsgesetz 01.10.2025 (Eintragungsdatum)\n\nF&K Dental GmbH\nGesellschaft mit beschränkter Haftung\nHamm\n\nDen Gläubigern der an der Verschmelzung beteiligten Rechtsträger ist, wenn sie binnen sechs Monaten nach dem Tag, an dem die Eintragung der Verschmelzung in das Register des Sitzes derjenigen Rechtsträger deren Gläubiger sie sind, nach § 19 Absatz 3 UmwG als bekanntgemacht gilt, ihren Anspruch nach Grund und Höhe schriftlich anmelden, Sicherheit zu leisten, soweit sie nicht Befriedigung verlangen können. Dieses Recht steht den Gläubigern jedoch nur zu, wenn sie glaubhaft machen, dass durch die Verschmelzung die Erfüllung ihrer Forderung gefährdet wird."
    },
    {
      "date": "2025-10-01",
      "id": "132303",
      "original_text": "Registerbekanntmachung nach dem Umwandlungsgesetz\nNordrhein-Westfalen Amtsgericht Gelsenkirchen HRB 17583\nH.I.G Milan German Bidco GmbH – Gelsenkirchen",
      "type": "Registerbekanntmachung nach dem Umwandlungsgesetz",
      "state": "Nordrhein-Westfalen",
      "amtsgericht": "Amtsgericht Gelsenkirchen",
      "registernummer": "HRB 17583",
      "registerart": "HRB",
      "company_name": "H.I.G Milan German Bidco GmbH",
      "company_seat": "Gelsenkirchen",
      "details": "01.10.2025 (Bekanntmachungsdatum)\n\nNordrhein-Westfalen Amtsgericht Gelsenkirchen HRB 17583\nRegisterbekanntmachung nach dem Umwandlungsgesetz 01.10.2025 (Eintragungsdatum)\n\nH.I.G Milan German Bidco GmbH\nGesellschaft mit beschränkter Haftung\nGelsenkirchen\n\nDen Gläubigern der an der Verschmelzung beteiligten Rechtsträger ist, wenn sie binnen sechs Monaten nach dem Tag, an dem die Eintragung der Verschmelzung in das Register des Sitzes desjenigen Rechtsträgers, dessen Gläubiger sie sind, nach § 19 Absatz 3 UmwG als bekanntgemacht gilt, ihren Anspruch nach Grund und Höhe schriftlich anmelden, Sicherheit zu leisten, soweit sie nicht Befriedigung verlangen können. Dieses Recht steht den Gläubigern jedoch nur zu, wenn sie glaubhaft machen, dass durch die Verschmelzung die Erfüllung ihrer Forderung gefährdet wird."
    },
    {
      "date": "2025-10-01",
      "id": "132304",
      "original_text": "Registerbekanntmachung nach dem Umwandlungsgesetz\nNordrhein-Westfalen Amtsgericht Bad Oeynhausen HRB 13496\nExklusives Küchendesign GmbH – Löhne",
      "type": "Registerbekanntmachung nach dem Umwandlungsgesetz",
      "state": "Nordrhein-Westfalen",
      "amtsgericht": "Amtsgericht Bad Oeynhausen",
      "registernummer": "HRB 13496",
      "registerart": "HRB",
      "company_name": "Exklusives Küchendesign GmbH",
      "company_seat": "Löhne",
      "details": "01.10.2025 (Bekanntmachungsdatum)\n\nNordrhein-Westfalen Amtsgericht Bad Oeynhausen HRB 13496\nRegisterbekanntmachung nach dem Umwandlungsgesetz 01.10.2025 (Eintragungsdatum)\n\nExklusives Küchendesign GmbH\nGesellschaft mit beschränkter Haftung\nLöhne\n\nDen Gläubigern der an der Verschmelzung beteiligten Rechtsträger ist, wenn sie binnen sechs Monaten nach dem Tag, an dem die Eintragung der Verschmelzung in das Register des Sitzes desjenigen Rechtsträgers, dessen Gläubiger sie sind, nach § 19 Absatz 3 UmwG als bekanntgemacht gilt, ihren Anspruch nach Grund und Höhe schriftlich anmelden, Sicherheit zu leisten, soweit sie nicht Befriedigung verlangen können. Dieses Recht steht den Gläubigern jedoch nur zu, wenn sie glaubhaft machen, dass durch die Verschmelzung die Erfüllung ihrer Forderung gefährdet wird."
    },
    {
      "date": "2025-10-01",
      "id": "132305",
      "original_text": "Registerbekanntmachung nach dem Umwandlungsgesetz\nNordrhein-Westfalen Amtsgericht Hamm HRB 6004\nRhenus Archiv Services GmbH – Holzwickede",
      "type": "Registerbekanntmachung nach dem Umwandlungsgesetz",
      "state": "Nordrhein-Westfalen",
      "amtsgericht": "Amtsgericht Hamm",
      "registernummer": "HRB 6004",
      "registerart": "HRB",
      "company_name": "Rhenus Archiv Services GmbH",
      "company_seat": "Holzwickede",
      "details": "01.10.2025 (Bekanntmachungsdatum)\n\nNordrhein-Westfalen Amtsgericht Hamm HRB 6004\nRegisterbekanntmachung nach dem Umwandlungsgesetz 01.10.2025 (Eintragungsdatum)\n\nRhenus Archiv Services GmbH\nGesellschaft mit beschränkter Haftung\nHolzwickede\n\nDen Gläubigern der an der Verschmelzung beteiligten Rechtsträger ist, wenn sie binnen sechs Monaten nach dem Tag, an dem die Eintragung der Verschmelzung in das Register des Sitzes desjenigen Rechtsträgers, dessen Gläubiger sie sind, nach § 19 Absatz 3 UmwG als bekanntgemacht gilt, ihren Anspruch nach Grund und Höhe schriftlich anmelden, Sicherheit zu leisten, soweit sie nicht Befriedigung verlangen können. Dieses Recht steht den Gläubigern jedoch nur zu, wenn sie glaubhaft machen, dass durch die Verschmelzung die Erfüllung ihrer Forderung gefährdet wird."
    },
    {
      "date": "2025-10-01",
      "id": "132306",
      "original_text": "Registerbekanntmachung nach dem Umwandlungsgesetz\nNordrhein-Westfalen Amtsgericht Aachen HRB 27438\nSeven Sigma Ventures GmbH – Aachen",
      "type": "Registerbekanntmachung nach dem Umwandlungsgesetz",
      "state": "Nordrhein-Westfalen",
      "amtsgericht": "Amtsgericht Aachen",
      "registernummer": "HRB 27438",
      "registerart": "HRB",
      "company_name": "Seven Sigma Ventures GmbH",
      "company_seat": "Aachen",
      "details": "01.10.2025 (Bekanntmachungsdatum)\n\nNordrhein-Westfalen Amtsgericht Aachen HRB 27438\nRegisterbekanntmachung nach dem Umwandlungsgesetz 01.10.2025 (Eintragungsdatum)\n\nSeven Sigma Ventures GmbH\nGesellschaft mit beschränkter Haftung\nAachen\n\nDen Gläubigern der an der Verschmelzung beteiligten Rechtsträger ist, wenn sie binnen sechs Monaten nach dem Tag, an dem die Eintragung der Verschmelzung in das Register des Sitzes desjenigen Rechtsträgers, dessen Gläubiger sie sind, nach § 19 Absatz 3 UmwG als bekanntgemacht gilt, ihren Anspruch nach Grund und Höhe schriftlich anmelden, Sicherheit zu leisten, soweit sie nicht Befriedigung verlangen können. Dieses Recht steht den Gläubigern jedoch nur zu, wenn sie glaubhaft machen, dass durch die Verschmelzung die Erfüllung ihrer Forderung gefährdet wird."
    },
    {
      "date": "2025-10-01",
      "id": "132307",
      "original_text": "Registerbekanntmachung nach dem Umwandlungsgesetz\nNordrhein-Westfalen Amtsgericht Köln HRB 75909\nPenny Spedition GmbH – Köln",
      "type": "Registerbekanntmachung nach dem Umwandlungsgesetz",
      "state": "Nordrhein-Westfalen",
      "amtsgericht": "Amtsgericht Köln",
      "registernummer": "HRB 75909",
      "registerart": "HRB",
      "company_name": "Penny Spedition GmbH",
      "company_seat": "Köln",
      "details": "01.10.2025 (Bekanntmachungsdatum)\n\nNordrhein-Westfalen Amtsgericht Köln HRB 75909\nRegisterbekanntmachung nach dem Umwandlungsgesetz 01.10.2025 (Eintragungsdatum)\n\nPenny Spedition GmbH\nGesellschaft mit beschränkter Haftung\nKöln\n\nDen Gläubigern der an der Verschmelzung beteiligten Rechtsträger ist, wenn sie binnen sechs Monaten nach dem Tag, an dem die Eintragung der Verschmelzung in das Register des Sitzes desjenigen Rechtsträgers, dessen Gläubiger sie sind, nach § 19 Absatz 3 UmwG als bekanntgemacht gilt, ihren Anspruch nach Grund und Höhe schriftlich anmelden, Sicherheit zu leisten, soweit sie nicht Befriedigung verlangen können. Dieses Recht steht den Gläubigern jedoch nur zu, wenn sie glaubhaft machen, dass durch die Verschmelzung die Erfüllung ihrer Forderung gefährdet wird."
    },
    {
      "date": "2025-10-01",
      "id": "132308",
      "original_text": "Löschungsankündigung\nNordrhein-Westfalen Amtsgericht Dortmund HRB 24259\nE.G.S. Golf GmbH – Dortmund",
      "type": "Löschungsankündigung",
      "state": "Nordrhein-Westfalen",
      "amtsgericht": "Amtsgericht Dortmund",
      "registernummer": "HRB 24259",
      "registerart": "HRB",
      "company_name": "E.G.S. Golf GmbH",
      "company_seat": "Dortmund",
      "details": "01.10.2025 (Bekanntmachungsdatum)\n\nNordrhein-Westfalen Amtsgericht Dortmund HRB 24259\nLöschungsankündigung\n\nE.G.S. Golf GmbH\nGesellschaft mit beschränkter Haftung\nDortmund\n\nDas Registergericht beabsichtigt die Gesellschaft von Amts wegen nach § 394 FamFG zu löschen. Die Frist zur Erhebung eines Widerspruchs ist auf zwei Monate festgesetzt."
    },
    {
      "date": "2025-10-01",
      "id": "132309",
      "original_text": "Registerbekanntmachung nach dem Umwandlungsgesetz\nNordrhein-Westfalen Amtsgericht Essen HRB 7550\nAtlas Copco Holding GmbH – Essen",
      "type": "Registerbekanntmachung nach dem Umwandlungsgesetz",
      "state": "Nordrhein-Westfalen",
      "amtsgericht": "Amtsgericht Essen",
      "registernummer": "HRB 7550",
      "registerart": "HRB",
      "company_name": "Atlas Copco Holding GmbH",
      "company_seat": "Essen",
      "details": "01.10.2025 (Bekanntmachungsdatum)\n\nNordrhein-Westfalen Amtsgericht Essen HRB 7550\nRegisterbekanntmachung nach dem Umwandlungsgesetz 01.10.2025 (Eintragungsdatum)\n\nAtlas Copco Holding GmbH\nGesellschaft mit beschränkter Haftung\nEssen\n\nDen Gläubigern der an der Verschmelzung beteiligten Rechtsträger ist, wenn sie binnen sechs Monaten nach dem Tag, an dem die Eintragung der Verschmelzung in das Register des Sitzes desjenigen Rechtsträgers, dessen Gläubiger sie sind, nach § 19 Absatz 3 UmwG als bekanntgemacht gilt, ihren Anspruch nach Grund und Höhe schriftlich anmelden, Sicherheit zu leisten, soweit sie nicht Befriedigung verlangen können. Dieses Recht steht den Gläubigern jedoch nur zu, wenn sie glaubhaft machen, dass durch die Verschmelzung die Erfüllung ihrer Forderung gefährdet wird."
    },
    {
      "date": "2025-10-01",
      "id": "132310",
      "original_text": "Registerbekanntmachung nach dem Umwandlungsgesetz\nNordrhein-Westfalen Amtsgericht Bielefeld HRB 44583\nvirtion Services GmbH – Bielefeld",
      "type": "Registerbekanntmachung nach dem Umwandlungsgesetz",
      "state": "Nordrhein-Westfalen",
      "amtsgericht": "Amtsgericht Bielefeld",
      "registernummer": "HRB 44583",
      "registerart": "HRB",
      "company_name": "virtion Services GmbH",
      "company_seat": "Bielefeld",
      "details": "01.10.2025 (Bekanntmachungsdatum)\n\nNordrhein-Westfalen Amtsgericht Bielefeld HRB 44583\nRegisterbekanntmachung nach dem Umwandlungsgesetz 01.10.2025 (Eintragungsdatum)\n\nvirtion Services GmbH\nGesellschaft mit beschränkter Haftung\nBielefeld\n\nDen Gläubigern der an der Verschmelzung beteiligten Rechtsträger ist, wenn sie binnen sechs Monaten nach dem Tag, an dem die Eintragung der Verschmelzung in das Register des Sitzes desjenigen Rechtsträgers, dessen Gläubiger sie sind, nach § 19 Absatz 3 UmwG als bekanntgemacht gilt, ihren Anspruch nach Grund und Höhe schriftlich anmelden, Sicherheit zu leisten, soweit sie nicht Befriedigung verlangen können. Dieses Recht steht den Gläubigern jedoch nur zu, wenn sie glaubhaft machen, dass durch die Verschmelzung die Erfüllung ihrer Forderung gefährdet wird."
    },
    {
      "date": "2025-10-01",
      "id": "132311",
      "original_text": "Registerbekanntmachung nach dem Umwandlungsgesetz\nNordrhein-Westfalen Amtsgericht Düsseldorf HRB 39820\nWPP Media Germany GmbH – Düsseldorf",
      "type": "Registerbekanntmachung nach dem Umwandlungsgesetz",
      "state": "Nordrhein-Westfalen",
      "amtsgericht": "Amtsgericht Düsseldorf",
      "registernummer": "HRB 39820",
      "registerart": "HRB",
      "company_name": "WPP Media Germany GmbH",
      "company_seat": "Düsseldorf",
      "details": "01.10.2025 (Bekanntmachungsdatum)\n\nNordrhein-Westfalen Amtsgericht Düsseldorf HRB 39820\nRegisterbekanntmachung nach dem Umwandlungsgesetz 01.10.2025 (Eintragungsdatum)\n\nWPP Media Germany GmbH\nGesellschaft mit beschränkter Haftung\nDüsseldorf\n\nDen Gläubigern der an der Verschmelzung beteiligten Rechtsträger ist, wenn sie binnen sechs Monaten nach dem Tag, an dem die Eintragung der Verschmelzung in das Register des Sitzes desjenigen Rechtsträgers, dessen Gläubiger sie sind, nach § 19 Absatz 3 UmwG als bekanntgemacht gilt, ihren Anspruch nach Grund und Höhe schriftlich anmelden, Sicherheit zu leisten, soweit sie nicht Befriedigung verlangen können. Dieses Recht steht den Gläubigern jedoch nur zu, wenn sie glaubhaft machen, dass durch die Verschmelzung die Erfüllung ihrer Forderung gefährdet wird."
    },
    {
      "date": "2025-10-01",
      "id": "132312",
      "original_text": "Registerbekanntmachung nach dem Umwandlungsgesetz\nNordrhein-Westfalen Amtsgericht Bad Oeynhausen HRB 7305\nDr. Ostermann & Rüter Rechtsanwaltsgesellschaft mbH – Bünde",
      "type": "Registerbekanntmachung nach dem Umwandlungsgesetz",
      "state": "Nordrhein-Westfalen",
      "amtsgericht": "Amtsgericht Bad Oeynhausen",
      "registernummer": "HRB 7305",
      "registerart": "HRB",
      "company_name": "Dr. Ostermann & Rüter Rechtsanwaltsgesellschaft mbH",
      "company_seat": "Bünde",
      "details": "01.10.2025 (Bekanntmachungsdatum)\n\nNordrhein-Westfalen Amtsgericht Bad Oeynhausen HRB 7305\nRegisterbekanntmachung nach dem Umwandlungsgesetz 01.10.2025 (Eintragungsdatum)\n\nDr. Ostermann & Rüter Rechtsanwaltsgesellschaft mbH\nGesellschaft mit beschränkter Haftung\nBünde\n\nDen Gläubigern der an der formwechselnden Umwandlung beteiligten Rechtsträger ist, wenn sie binnen sechs Monaten nach dem Tag, an dem die Eintragung der formwechselnden Umwandlung in das Register des Sitzes desjenigen Rechtsträgers, dessen Gläubiger sie sind, nach § 19 Absatz 3 UmwG als bekanntgemacht gilt, ihren Anspruch nach Grund und Höhe schriftlich anmelden, Sicherheit zu leisten, soweit sie nicht Befriedigung verlangen können. Dieses Recht steht den Gläubigern jedoch nur zu, wenn sie glaubhaft machen, dass durch die formwechselnden Umwandlung die Erfüllung ihrer Forderung gefährdet wird."
    },
    {
      "date": "2025-10-01",
      "id": "132313",
      "original_text": "Löschungsankündigung\nNordrhein-Westfalen Amtsgericht Siegburg HRB 10925\n1234 AK Waldbröl GmbH – Waldbröl",
      "type": "Löschungsankündigung",
      "state": "Nordrhein-Westfalen",
      "amtsgericht": "Amtsgericht Siegburg",
      "registernummer": "HRB 10925",
      "registerart": "HRB",
      "company_name": "1234 AK Waldbröl GmbH",
      "company_seat": "Waldbröl",
      "details": "01.10.2025 (Bekanntmachungsdatum)\n\nNordrhein-Westfalen Amtsgericht Siegburg HRB 10925\nLöschungsankündigung\n\n1234 AK Waldbröl GmbH\nGesellschaft mit beschränkter Haftung\nWaldbröl\n\nDas Registergericht hat glaubhafte Kenntnis erlangt, dass die Gesellschaft vermögenslos geworden ist, da ein Insolvenzverfahren durchgeführt und nach § 200 InsO aufgehoben wurde.\n\nEs ist daher beabsichtigt, die Gesellschaft nach § 394 FamFG im Handelsregister wegen Vermögenslosigkeit zu löschen.\nEinwände gegen die Löschung sind durch Widerspruch binnen einer Frist von 3 Monaten geltend zu machen, andernfalls die Löschung erfolgen wird.\n\nEinzulegen ist der Widerspruch bei dem Amtsgericht Siegburg, Neue Poststraße 16, 53721 Siegburg, und zwar entweder schriftlich in deutscher Sprache oder mündlich zur Niederschrift der Geschäftsstelle. Der Widerspruch kann auch zur Niederschrift der Geschäftsstelle eines jeden Amtsgerichts abgegeben werden. Der Widerspruch ist binnen der in der Verfügung bestimmten Frist einzulegen. Die Frist ist nur gewahrt, wenn der Widerspruch rechtzeitig bei dem Amtsgericht Siegburg eingeht, auch wenn der Widerspruch zur Niederschrift der Geschäftsstelle eines anderen Amtsgerichts abgegeben wurde. Die Frist beginnt jeweils mit der schriftlichen Bekanntgabe der Verfügung an die Beteiligten. Kann die schriftliche Bekanntgabe an einen Beteiligten nicht bewirkt werden, beginnt die Frist spätestens mit Ablauf von fünf Monaten nach Erlass der Verfügung. Die Bekanntgabe ist entweder durch Zustellung oder am dritten Tage nach Aufgabe zur Post bewirkt. Sofern die Löschung noch nicht erfolgt ist, kann der Widerspruch auch noch nach Ablauf der Frist eingelegt werden. Fällt das Ende der Frist auf einen Sonnabend, einen Sonntag oder einen allgemeinen Feiertag, endet die Frist mit Ablauf des nächsten Werktages. Der Widerspruch ist zu unterzeichnen. Eine Begründung des Widerspruchs ist nicht vorgeschrieben."
    },
    {
      "date": "2025-10-01",
      "id": "132314",
      "original_text": "Löschungsankündigung\nNordrhein-Westfalen Amtsgericht Mönchengladbach HRB 21783\nNo Limit Service UG (haftungsbeschränkt) – Mönchengladbach",
      "type": "Löschungsankündigung",
      "state": "Nordrhein-Westfalen",
      "amtsgericht": "Amtsgericht Mönchengladbach",
      "registernummer": "HRB 21783",
      "registerart": "HRB",
      "company_name": "No Limit Service UG (haftungsbeschränkt)",
      "company_seat": "Mönchengladbach",
      "details": "01.10.2025 (Bekanntmachungsdatum)\n\nNordrhein-Westfalen Amtsgericht Mönchengladbach HRB 21783\nLöschungsankündigung\n\nNo Limit Service UG (haftungsbeschränkt)\nGesellschaft mit beschränkter Haftung\nMönchengladbach\n\nDas Registergericht beabsichtigt die Gesellschaft von Amts wegen nach § 394 FamFG zu löschen. Die Frist zur Erhebung eines Widerspruchs ist auf drei Monate festgesetzt."
    },
    {
      "date": "2025-10-01",
      "id": "132315",
      "original_text": "Registerbekanntmachung nach dem Umwandlungsgesetz\nNordrhein-Westfalen Amtsgericht Paderborn HRA 8130\nKoos GmbH & Co. KG – Paderborn",
      "type": "Registerbekanntmachung nach dem Umwandlungsgesetz",
      "state": "Nordrhein-Westfalen",
      "amtsgericht": "Amtsgericht Paderborn",
      "registernummer": "HRA 8130",
      "registerart": "HRA",
      "company_name": "Koos GmbH & Co. KG",
      "company_seat": "Paderborn",
      "details": "01.10.2025 (Bekanntmachungsdatum)\n\nNordrhein-Westfalen Amtsgericht Paderborn HRA 8130\nRegisterbekanntmachung nach dem Umwandlungsgesetz 01.10.2025 (Eintragungsdatum)\n\nKoos GmbH & Co. KG\nKommanditgesellschaft\nPaderborn\n\nDie Gesellschaft hat Gläubigern, deren Forderungen vor dieser Bekanntmachung begründet worden sind, Sicherheit zu leisten, soweit sie nicht Befriedigung verlangen können, wenn sie sich binnen sechs Monaten zu diesem Zweck melden.Den Gläubigern der an der Ausgliederung beteiligten Rechtsträger ist, wenn sie binnen sechs Monaten nach dem Tag, an dem die Eintragung der Ausgliederung in das Register des Sitzes desjenigen Rechtsträgers, dessen Gläubiger sie sind, nach § 19 Absatz 3 UmwG als bekanntgemacht gilt, ihren Anspruch nach Grund und Höhe schriftlich anmelden, Sicherheit zu leisten, soweit sie nicht Befriedigung verlangen können. Dieses Recht steht den Gläubigern jedoch nur zu, wenn sie glaubhaft machen, dass durch die Ausgliederung die Erfüllung ihrer Forderung gefährdet wird."
    },
    {
      "date": "2025-10-01",
      "id": "132316",
      "original_text": "Registerbekanntmachung nach dem Umwandlungsgesetz\nNordrhein-Westfalen Amtsgericht Köln HRB 104317\nLekkerland SE – Köln",
      "type": "Registerbekanntmachung nach dem Umwandlungsgesetz",
      "state": "Nordrhein-Westfalen",
      "amtsgericht": "Amtsgericht Köln",
      "registernummer": "HRB 104317",
      "registerart": "HRB",
      "company_name": "Lekkerland SE",
      "company_seat": "Köln",
      "details": "01.10.2025 (Bekanntmachungsdatum)\n\nNordrhein-Westfalen Amtsgericht Köln HRB 104317\nRegisterbekanntmachung nach dem Umwandlungsgesetz 01.10.2025 (Eintragungsdatum)\n\nLekkerland SE\nEuropäische Aktiengesellschaft (SE)\nKöln\n\nDen Gläubigern der an der Verschmelzung beteiligten Rechtsträger ist, wenn sie binnen sechs Monaten nach dem Tag, an dem die Eintragung der Verschmelzung in das Register des Sitzes desjenigen Rechtsträgers, dessen Gläubiger sie sind, nach § 19 Absatz 3 UmwG als bekanntgemacht gilt, ihren Anspruch nach Grund und Höhe schriftlich anmelden, Sicherheit zu leisten, soweit sie nicht Befriedigung verlangen können. Dieses Recht steht den Gläubigern jedoch nur zu, wenn sie glaubhaft machen, dass durch die Verschmelzung die Erfüllung ihrer Forderung gefährdet wird."
    },
    {
      "date": "2025-10-01",
      "id": "132317",
      "original_text": "Registerbekanntmachung nach dem Umwandlungsgesetz\nNordrhein-Westfalen Amtsgericht Düsseldorf HRB 88871\nConnex Grundvermögen XI GmbH – Monheim am Rhein",
      "type": "Registerbekanntmachung nach dem Umwandlungsgesetz",
      "state": "Nordrhein-Westfalen",
      "amtsgericht": "Amtsgericht Düsseldorf",
      "registernummer": "HRB 88871",
      "registerart": "HRB",
      "company_name": "Connex Grundvermögen XI GmbH",
      "company_seat": "Monheim am Rhein",
      "details": "01.10.2025 (Bekanntmachungsdatum)\n\nNordrhein-Westfalen Amtsgericht Düsseldorf HRB 88871\nRegisterbekanntmachung nach dem Umwandlungsgesetz 01.10.2025 (Eintragungsdatum)\n\nConnex Grundvermögen XI GmbH\nGesellschaft mit beschränkter Haftung\nMonheim am Rhein\n\nDen Gläubigern der an der Verschmelzung beteiligten Rechtsträger ist, wenn sie binnen sechs Monaten nach dem Tag, an dem die Eintragung der Verschmelzung in das Register des Sitzes desjenigen Rechtsträgers, dessen Gläubiger sie sind, nach § 19 Absatz 3 UmwG als bekanntgemacht gilt, ihren Anspruch nach Grund und Höhe schriftlich anmelden, Sicherheit zu leisten, soweit sie nicht Befriedigung verlangen können. Dieses Recht steht den Gläubigern jedoch nur zu, wenn sie glaubhaft machen, dass durch die Verschmelzung die Erfüllung ihrer Forderung gefährdet wird."
    },
    {
      "date": "2025-10-01",
      "id": "132318",
      "original_text": "Registerbekanntmachung nach dem Umwandlungsgesetz\nNordrhein-Westfalen Amtsgericht Paderborn HRA 8942\nBorgmeier Elektrotechnik e.K. – Borgentreich",
      "type": "Registerbekanntmachung nach dem Umwandlungsgesetz",
      "state": "Nordrhein-Westfalen",
      "amtsgericht": "Amtsgericht Paderborn",
      "registernummer": "HRA 8942",
      "registerart": "HRA",
      "company_name": "Borgmeier Elektrotechnik e.K.",
      "company_seat": "Borgentreich",
      "details": "01.10.2025 (Bekanntmachungsdatum)\n\nNordrhein-Westfalen Amtsgericht Paderborn HRA 8942\nRegisterbekanntmachung nach dem Umwandlungsgesetz 01.10.2025 (Eintragungsdatum)\n\nBorgmeier Elektrotechnik e.K.\nEinzelkaufmann / Einzelkauffrau\nBorgentreich\n\nDen Gläubigern der an der Ausgliederung beteiligten Rechtsträger ist, wenn sie binnen sechs Monaten nach dem Tag, an dem die Eintragung der Ausgliederung in das Register des Sitzes desjenigen Rechtsträgers, dessen Gläubiger sie sind, nach § 19 Absatz 3 UmwG als bekanntgemacht gilt, ihren Anspruch nach Grund und Höhe schriftlich anmelden, Sicherheit zu leisten, soweit sie nicht Befriedigung verlangen können. Dieses Recht steht den Gläubigern jedoch nur zu, wenn sie glaubhaft machen, dass durch die Ausgliederung die Erfüllung ihrer Forderung gefährdet wird."
    },
    {
      "date": "2025-10-01",
      "id": "132319",
      "original_text": "Registerbekanntmachung nach dem Umwandlungsgesetz\nNordrhein-Westfalen Amtsgericht Paderborn HRB 11893\nCombeco GmbH – Paderborn",
      "type": "Registerbekanntmachung nach dem Umwandlungsgesetz",
      "state": "Nordrhein-Westfalen",
      "amtsgericht": "Amtsgericht Paderborn",
      "registernummer": "HRB 11893",
      "registerart": "HRB",
      "company_name": "Combeco GmbH",
      "company_seat": "Paderborn",
      "details": "01.10.2025 (Bekanntmachungsdatum)\n\nNordrhein-Westfalen Amtsgericht Paderborn HRB 11893\nRegisterbekanntmachung nach dem Umwandlungsgesetz 01.10.2025 (Eintragungsdatum)\n\nCombeco GmbH\nGesellschaft mit beschränkter Haftung\nPaderborn\n\nDen Gläubigern der an der Verschmelzung beteiligten Rechtsträger ist, wenn sie binnen sechs Monaten nach dem Tag, an dem die Eintragung der Verschmelzung in das Register des Sitzes desjenigen Rechtsträgers, dessen Gläubiger sie sind, nach § 19 Absatz 3 UmwG als bekanntgemacht gilt, ihren Anspruch nach Grund und Höhe schriftlich anmelden, Sicherheit zu leisten, soweit sie nicht Befriedigung verlangen können. Dieses Recht steht den Gläubigern jedoch nur zu, wenn sie glaubhaft machen, dass durch die Verschmelzung die Erfüllung ihrer Forderung gefährdet wird."
    },
    {
      "date": "2025-10-01",
      "id": "132320",
      "original_text": "Sonstige Registerbekanntmachung\nNordrhein-Westfalen Amtsgericht Bonn HRB 18761\nChefkoch GmbH – Bonn",
      "type": "Sonstige Registerbekanntmachung",
      "state": "Nordrhein-Westfalen",
      "amtsgericht": "Amtsgericht Bonn",
      "registernummer": "HRB 18761",
      "registerart": "HRB",
      "company_name": "Chefkoch GmbH",
      "company_seat": "Bonn",
      "details": "01.10.2025 (Bekanntmachungsdatum)\n\nNordrhein-Westfalen Amtsgericht Bonn HRB 18761\nSonstige Registerbekanntmachung 01.10.2025 (Eintragungsdatum)\n\nChefkoch GmbH\nGesellschaft mit beschränkter Haftung\nBonn\n\nAls nicht eingetragen wird veröffentlicht: Den Gläubigern der Gesellschaft, deren Forderungen begründet worden sind bevor die Eintragung der Beendigung des Beherrschungs- und Gewinnabführungsvertrages  in das Handelsregister nach § 10 des Handelsgesetzbuches als bekanntgemacht gilt, hat der andere Vertragsteil Sicherheit zu leisten, wenn sie sich binnen sechs Monaten nach der Bekanntmachung der Eintragung zu diesem Zweck bei ihm melden."
    },
    {
      "date": "2025-10-01",
      "id": "132321",
      "original_text": "Registerbekanntmachung nach dem Umwandlungsgesetz\nNordrhein-Westfalen Amtsgericht Bochum HRA 8140\nLotto-Tabak-Presse Claudio Costa e.K – Bochum",
      "type": "Registerbekanntmachung nach dem Umwandlungsgesetz",
      "state": "Nordrhein-Westfalen",
      "amtsgericht": "Amtsgericht Bochum",
      "registernummer": "HRA 8140",
      "registerart": "HRA",
      "company_name": "Lotto-Tabak-Presse Claudio Costa e.K",
      "company_seat": "Bochum",
      "details": "01.10.2025 (Bekanntmachungsdatum)\n\nNordrhein-Westfalen Amtsgericht Bochum HRA 8140\nRegisterbekanntmachung nach dem Umwandlungsgesetz 29.09.2025 (Eintragungsdatum)\n\nLotto-Tabak-Presse Claudio Costa e.K\nEinzelkaufmann / Einzelkauffrau\nBochum\n\nDen Gläubigern der an der Ausgliederung beteiligten Rechtsträger ist, wenn sie binnen sechs Monaten nach dem Tag, an dem die Eintragung der Ausgliederung in das Register des Sitzes desjenigen Rechtsträgers, dessen Gläubiger sie sind, nach § 19 Absatz 3 UmwG als bekanntgemacht gilt, ihren Anspruch nach Grund und Höhe schriftlich anmelden, Sicherheit zu leisten, soweit sie nicht Befriedigung verlangen können. Dieses Recht steht den Gläubigern jedoch nur zu, wenn sie glaubhaft machen, dass durch die Ausgliederung die Erfüllung ihrer Forderung gefährdet wird."
    },
    {
      "date": "2025-10-01",
      "id": "132322",
      "original_text": "Registerbekanntmachung nach dem Umwandlungsgesetz\nNordrhein-Westfalen Amtsgericht Hamm HRB 2014\nDentalstudio Fleitmann & Kramen GmbH – Hamm",
      "type": "Registerbekanntmachung nach dem Umwandlungsgesetz",
      "state": "Nordrhein-Westfalen",
      "amtsgericht": "Amtsgericht Hamm",
      "registernummer": "HRB 2014",
      "registerart": "HRB",
      "company_name": "Dentalstudio Fleitmann & Kramen GmbH",
      "company_seat": "Hamm",
      "details": "01.10.2025 (Bekanntmachungsdatum)\n\nNordrhein-Westfalen Amtsgericht Hamm HRB 2014\nRegisterbekanntmachung nach dem Umwandlungsgesetz 01.10.2025 (Eintragungsdatum)\n\nDentalstudio Fleitmann & Kramen GmbH\nGesellschaft mit beschränkter Haftung\nHamm\n\nDen Gläubigern der an der Verschmelzung beteiligten Rechtsträger ist, wenn sie binnen sechs Monaten nach dem Tag, an dem die Eintragung der Verschmelzung in das Register des Sitzes derjenigen Rechtsträger deren Gläubiger sie sind, nach § 19 Absatz 3 UmwG als bekanntgemacht gilt, ihren Anspruch nach Grund und Höhe schriftlich anmelden, Sicherheit zu leisten, soweit sie nicht Befriedigung verlangen können. Dieses Recht steht den Gläubigern jedoch nur zu, wenn sie glaubhaft machen, dass durch die Verschmelzung die Erfüllung ihrer Forderung gefährdet wird."
    },
    {
      "date": "2025-10-01",
      "id": "132323",
      "original_text": "Löschungsankündigung\nNordrhein-Westfalen Amtsgericht Gelsenkirchen HRB 16882\nAutronics UG (haftungsbeschränkt) – Bottrop",
      "type": "Löschungsankündigung",
      "state": "Nordrhein-Westfalen",
      "amtsgericht": "Amtsgericht Gelsenkirchen",
      "registernummer": "HRB 16882",
      "registerart": "HRB",
      "company_name": "Autronics UG (haftungsbeschränkt)",
      "company_seat": "Bottrop",
      "details": "01.10.2025 (Bekanntmachungsdatum)\n\nNordrhein-Westfalen Amtsgericht Gelsenkirchen HRB 16882\nLöschungsankündigung\n\nAutronics UG (haftungsbeschränkt)\nGesellschaft mit beschränkter Haftung\nBottrop\n\nDas Gericht beabsichtigt, die Gesellschaft Autronics UG (haftungsbeschränkt) mit Sitz in Bottrop, HRB 16882 Amtsgericht Gelsenkirchen, wegen Vermögenslosigkeit zu löschen. Hiermit wird denjenigen, die an der Unterlassung der Löschung ein berechtigtes Interesse haben, gem. § 394 Abs. 2 FamFG Gelegenheit gegeben, gegen dieses Vorhaben binnen eines Monats nach dieser Bekanntmachung Widerspruch einzulegen. Der Widerspruch kann schriftlich oder zu Protokoll der Geschäftsstelle erhoben werden"
    },
    {
      "date": "2025-10-01",
      "id": "132324",
      "original_text": "Registerbekanntmachung nach dem Umwandlungsgesetz\nNordrhein-Westfalen Amtsgericht Bielefeld HRB 40374\nvirtion GmbH – Bielefeld",
      "type": "Registerbekanntmachung nach dem Umwandlungsgesetz",
      "state": "Nordrhein-Westfalen",
      "amtsgericht": "Amtsgericht Bielefeld",
      "registernummer": "HRB 40374",
      "registerart": "HRB",
      "company_name": "virtion GmbH",
      "company_seat": "Bielefeld",
      "details": "01.10.2025 (Bekanntmachungsdatum)\n\nNordrhein-Westfalen Amtsgericht Bielefeld HRB 40374\nRegisterbekanntmachung nach dem Umwandlungsgesetz 01.10.2025 (Eintragungsdatum)\n\nvirtion GmbH\nGesellschaft mit beschränkter Haftung\nBielefeld\n\nDen Gläubigern der an der Verschmelzung beteiligten Rechtsträger ist, wenn sie binnen sechs Monaten nach dem Tag, an dem die Eintragung der Verschmelzung in das Register des Sitzes desjenigen Rechtsträgers, dessen Gläubiger sie sind, nach § 19 Absatz 3 UmwG als bekanntgemacht gilt, ihren Anspruch nach Grund und Höhe schriftlich anmelden, Sicherheit zu leisten, soweit sie nicht Befriedigung verlangen können. Dieses Recht steht den Gläubigern jedoch nur zu, wenn sie glaubhaft machen, dass durch die Verschmelzung die Erfüllung ihrer Forderung gefährdet wird."
    },
    {
      "date": "2025-10-01",
      "id": "132325",
      "original_text": "Registerbekanntmachung nach dem Umwandlungsgesetz\nNordrhein-Westfalen Amtsgericht Gelsenkirchen HRB 17465\nBrand Addition GmbH – Gelsenkirchen",
      "type": "Registerbekanntmachung nach dem Umwandlungsgesetz",
      "state": "Nordrhein-Westfalen",
      "amtsgericht": "Amtsgericht Gelsenkirchen",
      "registernummer": "HRB 17465",
      "registerart": "HRB",
      "company_name": "Brand Addition GmbH",
      "company_seat": "Gelsenkirchen",
      "details": "01.10.2025 (Bekanntmachungsdatum)\n\nNordrhein-Westfalen Amtsgericht Gelsenkirchen HRB 17465\nRegisterbekanntmachung nach dem Umwandlungsgesetz 01.10.2025 (Eintragungsdatum)\n\nBrand Addition GmbH\nGesellschaft mit beschränkter Haftung\nGelsenkirchen\n\nDen Gläubigern der an der Verschmelzung beteiligten Rechtsträger ist, wenn sie binnen sechs Monaten nach dem Tag, an dem die Eintragung der Verschmelzung in das Register des Sitzes desjenigen Rechtsträgers, dessen Gläubiger sie sind, nach § 19 Absatz 3 UmwG als bekanntgemacht gilt, ihren Anspruch nach Grund und Höhe schriftlich anmelden, Sicherheit zu leisten, soweit sie nicht Befriedigung verlangen können. Dieses Recht steht den Gläubigern jedoch nur zu, wenn sie glaubhaft machen, dass durch die Verschmelzung die Erfüllung ihrer Forderung gefährdet wird."
    },
    {
      "date": "2025-10-01",
      "id": "132326",
      "original_text": "Registerbekanntmachung nach dem Umwandlungsgesetz\nNordrhein-Westfalen Amtsgericht Köln HRB 27043\nPENNY Markt GmbH – Köln",
      "type": "Registerbekanntmachung nach dem Umwandlungsgesetz",
      "state": "Nordrhein-Westfalen",
      "amtsgericht": "Amtsgericht Köln",
      "registernummer": "HRB 27043",
      "registerart": "HRB",
      "company_name": "PENNY Markt GmbH",
      "company_seat": "Köln",
      "details": "01.10.2025 (Bekanntmachungsdatum)\n\nNordrhein-Westfalen Amtsgericht Köln HRB 27043\nRegisterbekanntmachung nach dem Umwandlungsgesetz 01.10.2025 (Eintragungsdatum)\n\nPENNY Markt GmbH\nGesellschaft mit beschränkter Haftung\nKöln\n\nDen Gläubigern der an der Verschmelzung beteiligten Rechtsträger ist, wenn sie binnen sechs Monaten nach dem Tag, an dem die Eintragung der Verschmelzung in das Register des Sitzes desjenigen Rechtsträgers, dessen Gläubiger sie sind, nach § 19 Absatz 3 UmwG als bekanntgemacht gilt, ihren Anspruch nach Grund und Höhe schriftlich anmelden, Sicherheit zu leisten, soweit sie nicht Befriedigung verlangen können. Dieses Recht steht den Gläubigern jedoch nur zu, wenn sie glaubhaft machen, dass durch die Verschmelzung die Erfüllung ihrer Forderung gefährdet wird."
    },
    {
      "date": "2025-10-01",
      "id": "132327",
      "original_text": "Einreichung neuer Dokumente\nNordrhein-Westfalen Amtsgericht Essen HRB 34423\nthyssenkrupp Decarbon Technologies GmbH – Essen",
      "type": "Einreichung neuer Dokumente",
      "state": "Nordrhein-Westfalen",
      "amtsgericht": "Amtsgericht Essen",
      "registernummer": "HRB 34423",
      "registerart": "HRB",
      "company_name": "thyssenkrupp Decarbon Technologies GmbH",
      "company_seat": "Essen",
      "details": "01.10.2025 (Bekanntmachungsdatum)\n\nNordrhein-Westfalen Amtsgericht Essen HRB 34423\nEinreichung neuer Dokumente\n\nthyssenkrupp Decarbon Technologies GmbH\nGesellschaft mit beschränkter Haftung\nEssen\n\nDem Registergericht ist eine Liste der Mitglieder des Aufsichtsrates eingereicht worden."
    },
    {
      "date": "2025-10-01",
      "id": "132328",
      "original_text": "Registerbekanntmachung nach dem Umwandlungsgesetz\nNordrhein-Westfalen Amtsgericht Bonn HRB 22126\nBetreibergesellschaft Verteilzentrum GmbH – Bonn",
      "type": "Registerbekanntmachung nach dem Umwandlungsgesetz",
      "state": "Nordrhein-Westfalen",
      "amtsgericht": "Amtsgericht Bonn",
      "registernummer": "HRB 22126",
      "registerart": "HRB",
      "company_name": "Betreibergesellschaft Verteilzentrum GmbH",
      "company_seat": "Bonn",
      "details": "01.10.2025 (Bekanntmachungsdatum)\n\nNordrhein-Westfalen Amtsgericht Bonn HRB 22126\nRegisterbekanntmachung nach dem Umwandlungsgesetz 01.10.2025 (Eintragungsdatum)\n\nBetreibergesellschaft Verteilzentrum GmbH\nGesellschaft mit beschränkter Haftung\nBonn\n\nDen Gläubigern der an der formwechselnden Umwandlung beteiligten Rechtsträger ist, wenn sie binnen sechs Monaten nach dem Tag, an dem die Eintragung der formwechselnden Umwandlung in das Register des Sitzes desjenigen Rechtsträgers, dessen Gläubiger sie sind, nach § 19 Absatz 3 UmwG als bekanntgemacht gilt, ihren Anspruch nach Grund und Höhe schriftlich anmelden, Sicherheit zu leisten, soweit sie nicht Befriedigung verlangen können. Dieses Recht steht den Gläubigern jedoch nur zu, wenn sie glaubhaft machen, dass durch die formwechselnden Umwandlung die Erfüllung ihrer Forderung gefährdet wird."
    },
    {
      "date": "2025-10-01",
      "id": "132329",
      "original_text": "Registerbekanntmachung nach dem Umwandlungsgesetz\nNordrhein-Westfalen Amtsgericht Gelsenkirchen HRB 19326\nHamburger Rieger Gelsenkirchen GmbH – Gelsenkirchen",
      "type": "Registerbekanntmachung nach dem Umwandlungsgesetz",
      "state": "Nordrhein-Westfalen",
      "amtsgericht": "Amtsgericht Gelsenkirchen",
      "registernummer": "HRB 19326",
      "registerart": "HRB",
      "company_name": "Hamburger Rieger Gelsenkirchen GmbH",
      "company_seat": "Gelsenkirchen",
      "details": "01.10.2025 (Bekanntmachungsdatum)\n\nNordrhein-Westfalen Amtsgericht Gelsenkirchen HRB 19326\nRegisterbekanntmachung nach dem Umwandlungsgesetz 01.10.2025 (Eintragungsdatum)\n\nHamburger Rieger Gelsenkirchen GmbH\nGesellschaft mit beschränkter Haftung\nGelsenkirchen\n\nDen Gläubigern der an der formwechselnden Umwandlung beteiligten Rechtsträger ist, wenn sie binnen sechs Monaten nach dem Tag, an dem die Eintragung der formwechselnden Umwandlung in das Register des Sitzes desjenigen Rechtsträgers, dessen Gläubiger sie sind, nach § 19 Absatz 3 UmwG als bekanntgemacht gilt, ihren Anspruch nach Grund und Höhe schriftlich anmelden, Sicherheit zu leisten, soweit sie nicht Befriedigung verlangen können. Dieses Recht steht den Gläubigern jedoch nur zu, wenn sie glaubhaft machen, dass durch die formwechselnden Umwandlung die Erfüllung ihrer Forderung gefährdet wird."
    },
    {
      "date": "2025-10-01",
      "id": "132330",
      "original_text": "Registerbekanntmachung nach dem Umwandlungsgesetz\nNordrhein-Westfalen Amtsgericht Hamm HRB 11829\nRhenus Group Sales Services GmbH – Holzwickede",
      "type": "Registerbekanntmachung nach dem Umwandlungsgesetz",
      "state": "Nordrhein-Westfalen",
      "amtsgericht": "Amtsgericht Hamm",
      "registernummer": "HRB 11829",
      "registerart": "HRB",
      "company_name": "Rhenus Group Sales Services GmbH",
      "company_seat": "Holzwickede",
      "details": "01.10.2025 (Bekanntmachungsdatum)\n\nNordrhein-Westfalen Amtsgericht Hamm HRB 11829\nRegisterbekanntmachung nach dem Umwandlungsgesetz 01.10.2025 (Eintragungsdatum)\n\nRhenus Group Sales Services GmbH\nGesellschaft mit beschränkter Haftung\nHolzwickede\n\nDen Gläubigern der an der Abspaltung beteiligten Rechtsträger ist, wenn sie binnen sechs Monaten nach dem Tag, an dem die Eintragung der Abspaltung in das Register des Sitzes desjenigen Rechtsträgers, dessen Gläubiger sie sind, nach § 19 Absatz 3 UmwG als bekanntgemacht gilt, ihren Anspruch nach Grund und Höhe schriftlich anmelden, Sicherheit zu leisten, soweit sie nicht Befriedigung verlangen können. Dieses Recht steht den Gläubigern jedoch nur zu, wenn sie glaubhaft machen, dass durch die Abspaltung die Erfüllung ihrer Forderung gefährdet wird."
    },
    {
      "date": "2025-10-01",
      "id": "132331",
      "original_text": "Einreichung neuer Dokumente\nNordrhein-Westfalen Amtsgericht Siegburg HRB 7043\nWIK-Consult GmbH – Bad Honnef",
      "type": "Einreichung neuer Dokumente",
      "state": "Nordrhein-Westfalen",
      "amtsgericht": "Amtsgericht Siegburg",
      "registernummer": "HRB 7043",
      "registerart": "HRB",
      "company_name": "WIK-Consult GmbH",
      "company_seat": "Bad Honnef",
      "details": "01.10.2025 (Bekanntmachungsdatum)\n\nNordrhein-Westfalen Amtsgericht Siegburg HRB 7043\nEinreichung neuer Dokumente\n\nWIK-Consult GmbH\nGesellschaft mit beschränkter Haftung\nBad Honnef\n\nDem Registergericht ist eine neue Liste der Mitglieder des Aufsichtsrates eingereicht worden."
    },
    {
      "date": "2025-10-01",
      "id": "132332",
      "original_text": "Registerbekanntmachung nach dem Umwandlungsgesetz\nNordrhein-Westfalen Amtsgericht Paderborn HRB 11524\nMatzner GmbH – Anröchte",
      "type": "Registerbekanntmachung nach dem Umwandlungsgesetz",
      "state": "Nordrhein-Westfalen",
      "amtsgericht": "Amtsgericht Paderborn",
      "registernummer": "HRB 11524",
      "registerart": "HRB",
      "company_name": "Matzner GmbH",
      "company_seat": "Anröchte",
      "details": "01.10.2025 (Bekanntmachungsdatum)\n\nNordrhein-Westfalen Amtsgericht Paderborn HRB 11524\nRegisterbekanntmachung nach dem Umwandlungsgesetz 01.10.2025 (Eintragungsdatum)\n\nMatzner GmbH\nGesellschaft mit beschränkter Haftung\nAnröchte\n\nDen Gläubigern der an der Verschmelzung beteiligten Rechtsträger ist, wenn sie binnen sechs Monaten nach dem Tag, an dem die Eintragung der Verschmelzung in das Register des Sitzes desjenigen Rechtsträgers, dessen Gläubiger sie sind, nach § 19 Absatz 3 UmwG als bekanntgemacht gilt, ihren Anspruch nach Grund und Höhe schriftlich anmelden, Sicherheit zu leisten, soweit sie nicht Befriedigung verlangen können. Dieses Recht steht den Gläubigern jedoch nur zu, wenn sie glaubhaft machen, dass durch die Verschmelzung die Erfüllung ihrer Forderung gefährdet wird."
    },
    {
      "date": "2025-10-01",
      "id": "132333",
      "original_text": "Registerbekanntmachung nach dem Umwandlungsgesetz\nNordrhein-Westfalen Amtsgericht Köln HRB 11264\nBlum & Partner Immobilien GmbH – Köln",
      "type": "Registerbekanntmachung nach dem Umwandlungsgesetz",
      "state": "Nordrhein-Westfalen",
      "amtsgericht": "Amtsgericht Köln",
      "registernummer": "HRB 11264",
      "registerart": "HRB",
      "company_name": "Blum & Partner Immobilien GmbH",
      "company_seat": "Köln",
      "details": "01.10.2025 (Bekanntmachungsdatum)\n\nNordrhein-Westfalen Amtsgericht Köln HRB 11264\nRegisterbekanntmachung nach dem Umwandlungsgesetz 01.10.2025 (Eintragungsdatum)\n\nBlum & Partner Immobilien GmbH\nGesellschaft mit beschränkter Haftung\nKöln\n\nDen Gläubigern der an der Abspaltung beteiligten Rechtsträger ist, wenn sie binnen sechs Monaten nach dem Tag, an dem die Eintragung der Abspaltung in das Register des Sitzes desjenigen Rechtsträgers, dessen Gläubiger sie sind, nach § 19 Absatz 3 UmwG als bekanntgemacht gilt, ihren Anspruch nach Grund und Höhe schriftlich anmelden, Sicherheit zu leisten, soweit sie nicht Befriedigung verlangen können. Dieses Recht steht den Gläubigern jedoch nur zu, wenn sie glaubhaft machen, dass durch die Abspaltung die Erfüllung ihrer Forderung gefährdet wird."
    },
    {
      "date": "2025-10-01",
      "id": "132334",
      "original_text": "Registerbekanntmachung nach dem Umwandlungsgesetz\nNordrhein-Westfalen Amtsgericht Duisburg HRB 39572\nMH Maier + Freese GmbH – Duisburg",
      "type": "Registerbekanntmachung nach dem Umwandlungsgesetz",
      "state": "Nordrhein-Westfalen",
      "amtsgericht": "Amtsgericht Duisburg",
      "registernummer": "HRB 39572",
      "registerart": "HRB",
      "company_name": "MH Maier + Freese GmbH",
      "company_seat": "Duisburg",
      "details": "01.10.2025 (Bekanntmachungsdatum)\n\nNordrhein-Westfalen Amtsgericht Duisburg HRB 39572\nRegisterbekanntmachung nach dem Umwandlungsgesetz 01.10.2025 (Eintragungsdatum)\n\nMH Maier + Freese GmbH\nGesellschaft mit beschränkter Haftung\nDuisburg\n\nDem Registergericht ist eine Liste der Mitglieder des Aufsichtsrates eingereicht worden.Die Gesellschaft hat Gläubigern, deren Forderungen vor dieser Bekanntmachung begründet worden sind, Sicherheit zu leisten, soweit sie nicht Befriedigung verlangen können, wenn sie sich binnen sechs Monaten zu diesem Zweck melden."
    },
    {
      "date": "2025-10-01",
      "id": "132335",
      "original_text": "Löschungsankündigung\nNordrhein-Westfalen Amtsgericht Düsseldorf HRB 58658\nMission Freight Germany GmbH – Düsseldorf",
      "type": "Löschungsankündigung",
      "state": "Nordrhein-Westfalen",
      "amtsgericht": "Amtsgericht Düsseldorf",
      "registernummer": "HRB 58658",
      "registerart": "HRB",
      "company_name": "Mission Freight Germany GmbH",
      "company_seat": "Düsseldorf",
      "details": "01.10.2025 (Bekanntmachungsdatum)\n\nNordrhein-Westfalen Amtsgericht Düsseldorf HRB 58658\nLöschungsankündigung\n\nMission Freight Germany GmbH\nGesellschaft mit beschränkter Haftung\nDüsseldorf\n\nDas Registergericht beabsichtigt die Gesellschaft von Amts wegen nach § 394 FamFG zu löschen. Die Frist zur Erhebung eines Widerspruchs ist auf 3 Wochen festgesetzt.\n\nRechtsbehelfsbelehrung:\nDas Widerspruchsrecht steht jedem zu, der an der Unterlassung der Löschung ein berechtigtes Interesse hat. Der Widerspruch ist bei dem Amtsgericht Düsseldorf -Registergericht-, Werdener Straße 1, 40227 Düsseldorf schriftlich in deutscher Sprache oder zur Niederschrift der Geschäftsstelle einzulegen. Der Widerspruch kann auch zur Niederschrift der Geschäftsstelle eines jeden Amtsgerichtes abgegeben werden. Die Einlegung ist auch durch Übertragung eines elektronischen Dokuments an die elektronische Poststelle des Gerichts möglich. Das elektronische Dokument muss für die Bearbeitung durch das Gericht geeignet und mit einer qualifizierten elektronischen Signatur der verantwortenden Person versehen sein oder von der verantwortenden Person signiert und auf einem sicheren Übermittlungsweg gemäß § 130a ZPO nach näherer Maßgabe der Verordnung über die technischen Rahmenbedingungen des elektronischen Rechtsverkehrs und über das besondere elektronische Behördenpostfach (BGBl. I, S.3803) eingereicht werden. Weitere Informationen erhalten Sie auf der Internetseite www.justiz.de.\nDer Widerspruch muss spätestens innerhalb der gesetzten Frist nach dem Datum der Bekanntmachung der Löschungsankündigung bei dem Amtsgericht - Registergericht - Düsseldorf eingegangen sein.  Dies gilt auch dann, wenn der Widerspruch zur Niederschrift der Geschäftsstelle eines anderen Amtsgerichtes abgegeben wurde. Die Frist beginnt mit dem Tage der Bekanntmachung der Löschungsankündigung in dem für die Bekanntmachung der Eintragungen in das Handelsregister bestimmten elektronischen Informations- und Kommunikationssystem nach § 10 des Handelsgesetzbuches. Fällt das Ende der Frist auf einen Sonntag, einen allgemeinen Feiertag oder Sonnabend, so endet die Frist mit Ablauf des nächsten Werktages.\nDer Widerspruch muss die Bezeichnung der angefochtenen Löschungsankündigung sowie die Erklärung enthalten, dass Widerspruch gegen diese Löschungsankündigung eingelegt wird. Er ist zu unterzeichnen und soll begründet werden."
    },
    {
      "date": "2025-10-01",
      "id": "132336",
      "original_text": "Registerbekanntmachung nach dem Umwandlungsgesetz\nNordrhein-Westfalen Amtsgericht Köln HRB 69067\nREWE Group Business Solutions GmbH – Köln",
      "type": "Registerbekanntmachung nach dem Umwandlungsgesetz",
      "state": "Nordrhein-Westfalen",
      "amtsgericht": "Amtsgericht Köln",
      "registernummer": "HRB 69067",
      "registerart": "HRB",
      "company_name": "REWE Group Business Solutions GmbH",
      "company_seat": "Köln",
      "details": "01.10.2025 (Bekanntmachungsdatum)\n\nNordrhein-Westfalen Amtsgericht Köln HRB 69067\nRegisterbekanntmachung nach dem Umwandlungsgesetz 01.10.2025 (Eintragungsdatum)\n\nREWE Group Business Solutions GmbH\nGesellschaft mit beschränkter Haftung\nKöln\n\nDen Gläubigern der an der Abspaltung beteiligten Rechtsträger ist, wenn sie binnen sechs Monaten nach dem Tag, an dem die Eintragung der Abspaltung in das Register des Sitzes desjenigen Rechtsträgers, dessen Gläubiger sie sind, nach § 19 Absatz 3 UmwG als bekanntgemacht gilt, ihren Anspruch nach Grund und Höhe schriftlich anmelden, Sicherheit zu leisten, soweit sie nicht Befriedigung verlangen können. Dieses Recht steht den Gläubigern jedoch nur zu, wenn sie glaubhaft machen, dass durch die Abspaltung die Erfüllung ihrer Forderung gefährdet wird."
    },
    {
      "date": "2025-10-01",
      "id": "132337",
      "original_text": "Registerbekanntmachung nach dem Umwandlungsgesetz\nNordrhein-Westfalen Amtsgericht Duisburg HRA 13508\nMH Maier + Freese GmbH & Co. KG – Duisburg",
      "type": "Registerbekanntmachung nach dem Umwandlungsgesetz",
      "state": "Nordrhein-Westfalen",
      "amtsgericht": "Amtsgericht Duisburg",
      "registernummer": "HRA 13508",
      "registerart": "HRA",
      "company_name": "MH Maier + Freese GmbH & Co. KG",
      "company_seat": "Duisburg",
      "details": "01.10.2025 (Bekanntmachungsdatum)\n\nNordrhein-Westfalen Amtsgericht Duisburg HRA 13508\nRegisterbekanntmachung nach dem Umwandlungsgesetz 01.10.2025 (Eintragungsdatum)\n\nMH Maier + Freese GmbH & Co. KG\nKommanditgesellschaft\nDuisburg\n\nDie Gesellschaft hat Gläubigern, deren Forderungen vor dieser Bekanntmachung begründet worden sind, Sicherheit zu leisten, soweit sie nicht Befriedigung verlangen können, wenn sie sich binnen sechs Monaten zu diesem Zweck melden."
    },
    {
      "date": "2025-10-01",
      "id": "132338",
      "original_text": "Löschungsankündigung\nNordrhein-Westfalen Amtsgericht Bochum HRB 18479\nGIS NRW GmbH – Herne",
      "type": "Löschungsankündigung",
      "state": "Nordrhein-Westfalen",
      "amtsgericht": "Amtsgericht Bochum",
      "registernummer": "HRB 18479",
      "registerart": "HRB",
      "company_name": "GIS NRW GmbH",
      "company_seat": "Herne",
      "details": "01.10.2025 (Bekanntmachungsdatum)\n\nNordrhein-Westfalen Amtsgericht Bochum HRB 18479\nLöschungsankündigung 01.10.2025 (Eintragungsdatum)\n\nGIS NRW GmbH\nGesellschaft mit beschränkter Haftung\nHerne\n\nDas Registergericht beabsichtigt die Gesellschaft von Amts wegen nach § 394 FamFG zu löschen. Die Frist zur Erhebung eines Widerspruchs ist auf drei Monate festgesetzt."
    },
    {
      "date": "2025-10-01",
      "id": "132339",
      "original_text": "Registerbekanntmachung nach dem Umwandlungsgesetz\nNordrhein-Westfalen Amtsgericht Gelsenkirchen HRA 2646\nHamburger Rieger Gelsenkirchen GmbH & Co. KG – Gelsenkirchen",
      "type": "Registerbekanntmachung nach dem Umwandlungsgesetz",
      "state": "Nordrhein-Westfalen",
      "amtsgericht": "Amtsgericht Gelsenkirchen",
      "registernummer": "HRA 2646",
      "registerart": "HRA",
      "company_name": "Hamburger Rieger Gelsenkirchen GmbH & Co. KG",
      "company_seat": "Gelsenkirchen",
      "details": "01.10.2025 (Bekanntmachungsdatum)\n\nNordrhein-Westfalen Amtsgericht Gelsenkirchen HRA 2646\nRegisterbekanntmachung nach dem Umwandlungsgesetz 01.10.2025 (Eintragungsdatum)\n\nHamburger Rieger Gelsenkirchen GmbH & Co. KG\nKommanditgesellschaft\nGelsenkirchen\n\nDen Gläubigern der an der formwechselnden Umwandlung beteiligten Rechtsträger ist, wenn sie binnen sechs Monaten nach dem Tag, an dem die Eintragung der formwechselnden Umwandlung in das Register des Sitzes desjenigen Rechtsträgers, dessen Gläubiger sie sind, nach § 19 Absatz 3 UmwG als bekanntgemacht gilt, ihren Anspruch nach Grund und Höhe schriftlich anmelden, Sicherheit zu leisten, soweit sie nicht Befriedigung verlangen können. Dieses Recht steht den Gläubigern jedoch nur zu, wenn sie glaubhaft machen, dass durch die formwechselnden Umwandlung die Erfüllung ihrer Forderung gefährdet wird."
    },
    {
      "date": "2025-10-01",
      "id": "132340",
      "original_text": "Registerbekanntmachung nach dem Umwandlungsgesetz\nNordrhein-Westfalen Amtsgericht Essen HRB 30999\nE.ON Drive Germany GmbH – Essen",
      "type": "Registerbekanntmachung nach dem Umwandlungsgesetz",
      "state": "Nordrhein-Westfalen",
      "amtsgericht": "Amtsgericht Essen",
      "registernummer": "HRB 30999",
      "registerart": "HRB",
      "company_name": "E.ON Drive Germany GmbH",
      "company_seat": "Essen",
      "details": "01.10.2025 (Bekanntmachungsdatum)\n\nNordrhein-Westfalen Amtsgericht Essen HRB 30999\nRegisterbekanntmachung nach dem Umwandlungsgesetz 01.10.2025 (Eintragungsdatum)\n\nE.ON Drive Germany GmbH\nGesellschaft mit beschränkter Haftung\nEssen\n\nDen Gläubigern der an der Ausgliederung beteiligten Rechtsträger ist, wenn sie binnen sechs Monaten nach dem Tag, an dem die Eintragung der Ausgliederung in das Register des Sitzes desjenigen Rechtsträgers, dessen Gläubiger sie sind, nach § 19 Absatz 3 UmwG als bekanntgemacht gilt, ihren Anspruch nach Grund und Höhe schriftlich anmelden, Sicherheit zu leisten, soweit sie nicht Befriedigung verlangen können. Dieses Recht steht den Gläubigern jedoch nur zu, wenn sie glaubhaft machen, dass durch die Ausgliederung die Erfüllung ihrer Forderung gefährdet wird."
    },
    {
      "date": "2025-10-01",
      "id": "132341",
      "original_text": "Registerbekanntmachung nach dem Umwandlungsgesetz\nNordrhein-Westfalen Amtsgericht Hagen HRA 6637\nFSW Kevin Schwegler e.K. – Hagen",
      "type": "Registerbekanntmachung nach dem Umwandlungsgesetz",
      "state": "Nordrhein-Westfalen",
      "amtsgericht": "Amtsgericht Hagen",
      "registernummer": "HRA 6637",
      "registerart": "HRA",
      "company_name": "FSW Kevin Schwegler e.K.",
      "company_seat": "Hagen",
      "details": "01.10.2025 (Bekanntmachungsdatum)\n\nNordrhein-Westfalen Amtsgericht Hagen HRA 6637\nRegisterbekanntmachung nach dem Umwandlungsgesetz 01.10.2025 (Eintragungsdatum)\n\nFSW Kevin Schwegler e.K.\nEinzelkaufmann / Einzelkauffrau\nHagen\n\nDen Gläubigern der an der Ausgliederung beteiligten Rechtsträger ist, wenn sie binnen sechs Monaten nach dem Tag, an dem die Eintragung der Ausgliederung in das Register des Sitzes desjenigen Rechtsträgers, dessen Gläubiger sie sind, nach § 19 Absatz 3 UmwG als bekanntgemacht gilt, ihren Anspruch nach Grund und Höhe schriftlich anmelden, Sicherheit zu leisten, soweit sie nicht Befriedigung verlangen können. Dieses Recht steht den Gläubigern jedoch nur zu, wenn sie glaubhaft machen, dass durch die Ausgliederung die Erfüllung ihrer Forderung gefährdet wird."
    },
    {
      "date": "2025-10-01",
      "id": "132342",
      "original_text": "Registerbekanntmachung nach dem Umwandlungsgesetz\nNordrhein-Westfalen Amtsgericht Köln HRB 42805\nLekkerland information systems GmbH – Frechen",
      "type": "Registerbekanntmachung nach dem Umwandlungsgesetz",
      "state": "Nordrhein-Westfalen",
      "amtsgericht": "Amtsgericht Köln",
      "registernummer": "HRB 42805",
      "registerart": "HRB",
      "company_name": "Lekkerland information systems GmbH",
      "company_seat": "Frechen",
      "details": "01.10.2025 (Bekanntmachungsdatum)\n\nNordrhein-Westfalen Amtsgericht Köln HRB 42805\nRegisterbekanntmachung nach dem Umwandlungsgesetz 01.10.2025 (Eintragungsdatum)\n\nLekkerland information systems GmbH\nGesellschaft mit beschränkter Haftung\nFrechen\n\nDen Gläubigern der an der Verschmelzung beteiligten Rechtsträger ist, wenn sie binnen sechs Monaten nach dem Tag, an dem die Eintragung der Verschmelzung in das Register des Sitzes desjenigen Rechtsträgers, dessen Gläubiger sie sind, nach § 19 Absatz 3 UmwG als bekanntgemacht gilt, ihren Anspruch nach Grund und Höhe schriftlich anmelden, Sicherheit zu leisten, soweit sie nicht Befriedigung verlangen können. Dieses Recht steht den Gläubigern jedoch nur zu, wenn sie glaubhaft machen, dass durch die Verschmelzung die Erfüllung ihrer Forderung gefährdet wird."
    },
    {
      "date": "2025-10-01",
      "id": "132343",
      "original_text": "Registerbekanntmachung nach dem Umwandlungsgesetz\nNordrhein-Westfalen Amtsgericht Essen HRB 28154\nE.ON Drive GmbH – Essen",
      "type": "Registerbekanntmachung nach dem Umwandlungsgesetz",
      "state": "Nordrhein-Westfalen",
      "amtsgericht": "Amtsgericht Essen",
      "registernummer": "HRB 28154",
      "registerart": "HRB",
      "company_name": "E.ON Drive GmbH",
      "company_seat": "Essen",
      "details": "01.10.2025 (Bekanntmachungsdatum)\n\nNordrhein-Westfalen Amtsgericht Essen HRB 28154\nRegisterbekanntmachung nach dem Umwandlungsgesetz 01.10.2025 (Eintragungsdatum)\n\nE.ON Drive GmbH\nGesellschaft mit beschränkter Haftung\nEssen\n\nDen Gläubigern der an der Ausgliederung beteiligten Rechtsträger ist, wenn sie binnen sechs Monaten nach dem Tag, an dem die Eintragung der Ausgliederung in das Register des Sitzes desjenigen Rechtsträgers, dessen Gläubiger sie sind, nach § 19 Absatz 3 UmwG als bekanntgemacht gilt, ihren Anspruch nach Grund und Höhe schriftlich anmelden, Sicherheit zu leisten, soweit sie nicht Befriedigung verlangen können. Dieses Recht steht den Gläubigern jedoch nur zu, wenn sie glaubhaft machen, dass durch die Ausgliederung die Erfüllung ihrer Forderung gefährdet wird."
    },
    {
      "date": "2025-10-01",
      "id": "132344",
      "original_text": "Löschungsankündigung\nNordrhein-Westfalen Amtsgericht Mönchengladbach HRA 9636\nThomas Steuer e. K. Vermögensverwaltung – Grevenbroich",
      "type": "Löschungsankündigung",
      "state": "Nordrhein-Westfalen",
      "amtsgericht": "Amtsgericht Mönchengladbach",
      "registernummer": "HRA 9636",
      "registerart": "HRA",
      "company_name": "Thomas Steuer e. K. Vermögensverwaltung",
      "company_seat": "Grevenbroich",
      "details": "01.10.2025 (Bekanntmachungsdatum)\n\nNordrhein-Westfalen Amtsgericht Mönchengladbach HRA 9636\nLöschungsankündigung 01.10.2025 (Eintragungsdatum)\n\nThomas Steuer e. K. Vermögensverwaltung\nEinzelkaufmann / Einzelkauffrau\nGrevenbroich\n\nDas Registergericht beabsichtigt, die im Handelsregister eingetragene Firma gemäß\n§ 31 Abs. 2 Satz 2 HGB von Amts wegen zu löschen. Gegen diese Verfügung kann Widerspruch eingelegt werden. Die Frist zur Erhebung eines Widerspruches gegen die beabsichtigte Löschung von Amts wegen ist auf drei Monate festgesetzt."
    },
    {
      "date": "2025-10-01",
      "id": "132345",
      "original_text": "Löschungsankündigung\nNordrhein-Westfalen Amtsgericht Essen HRB 29432\nLB Consulting GmbH – Essen",
      "type": "Löschungsankündigung",
      "state": "Nordrhein-Westfalen",
      "amtsgericht": "Amtsgericht Essen",
      "registernummer": "HRB 29432",
      "registerart": "HRB",
      "company_name": "LB Consulting GmbH",
      "company_seat": "Essen",
      "details": "01.10.2025 (Bekanntmachungsdatum)\n\nNordrhein-Westfalen Amtsgericht Essen HRB 29432\nLöschungsankündigung\n\nLB Consulting GmbH\nGesellschaft mit beschränkter Haftung\nEssen\n\nDas Registergericht beabsichtigt die Gesellschaft von Amts wegen nach § 394 FamFG zu löschen. Die Frist zur Erhebung eines Widerspruchs ist auf einen Monat festgesetzt."
    },
    {
      "date": "2025-10-01",
      "id": "132346",
      "original_text": "Registerbekanntmachung nach dem Umwandlungsgesetz\nNordrhein-Westfalen Amtsgericht Hamm HRB 6004\nRhenus Archiv Services GmbH – Holzwickede",
      "type": "Registerbekanntmachung nach dem Umwandlungsgesetz",
      "state": "Nordrhein-Westfalen",
      "amtsgericht": "Amtsgericht Hamm",
      "registernummer": "HRB 6004",
      "registerart": "HRB",
      "company_name": "Rhenus Archiv Services GmbH",
      "company_seat": "Holzwickede",
      "details": "01.10.2025 (Bekanntmachungsdatum)\n\nNordrhein-Westfalen Amtsgericht Hamm HRB 6004\nRegisterbekanntmachung nach dem Umwandlungsgesetz 01.10.2025 (Eintragungsdatum)\n\nRhenus Archiv Services GmbH\nGesellschaft mit beschränkter Haftung\nHolzwickede\n\nDen Gläubigern der an der Verschmelzung beteiligten Rechtsträger ist, wenn sie binnen sechs Monaten nach dem Tag, an dem die Eintragung der Verschmelzung in das Register des Sitzes desjenigen Rechtsträgers, dessen Gläubiger sie sind, nach § 19 Absatz 3 UmwG als bekanntgemacht gilt, ihren Anspruch nach Grund und Höhe schriftlich anmelden, Sicherheit zu leisten, soweit sie nicht Befriedigung verlangen können. Dieses Recht steht den Gläubigern jedoch nur zu, wenn sie glaubhaft machen, dass durch die Verschmelzung die Erfüllung ihrer Forderung gefährdet wird."
    },
    {
      "date": "2025-10-01",
      "id": "132347",
      "original_text": "Registerbekanntmachung nach dem Umwandlungsgesetz\nNordrhein-Westfalen Amtsgericht Köln HRB 124941\nBlum Immobilien GmbH – Köln",
      "type": "Registerbekanntmachung nach dem Umwandlungsgesetz",
      "state": "Nordrhein-Westfalen",
      "amtsgericht": "Amtsgericht Köln",
      "registernummer": "HRB 124941",
      "registerart": "HRB",
      "company_name": "Blum Immobilien GmbH",
      "company_seat": "Köln",
      "details": "01.10.2025 (Bekanntmachungsdatum)\n\nNordrhein-Westfalen Amtsgericht Köln HRB 124941\nRegisterbekanntmachung nach dem Umwandlungsgesetz 01.10.2025 (Eintragungsdatum)\n\nBlum Immobilien GmbH\nGesellschaft mit beschränkter Haftung\nKöln\n\nDen Gläubigern der an der Abspaltung beteiligten Rechtsträger ist, wenn sie binnen sechs Monaten nach dem Tag, an dem die Eintragung der Abspaltung in das Register des Sitzes desjenigen Rechtsträgers, dessen Gläubiger sie sind, nach § 19 Absatz 3 UmwG als bekanntgemacht gilt, ihren Anspruch nach Grund und Höhe schriftlich anmelden, Sicherheit zu leisten, soweit sie nicht Befriedigung verlangen können. Dieses Recht steht den Gläubigern jedoch nur zu, wenn sie glaubhaft machen, dass durch die Abspaltung die Erfüllung ihrer Forderung gefährdet wird."
    },
    {
      "date": "2025-10-01",
      "id": "132348",
      "original_text": "Registerbekanntmachung nach dem Umwandlungsgesetz\nNordrhein-Westfalen Amtsgericht Düsseldorf HRB 88864\n1&1 Versatel GmbH – Düsseldorf",
      "type": "Registerbekanntmachung nach dem Umwandlungsgesetz",
      "state": "Nordrhein-Westfalen",
      "amtsgericht": "Amtsgericht Düsseldorf",
      "registernummer": "HRB 88864",
      "registerart": "HRB",
      "company_name": "1&1 Versatel GmbH",
      "company_seat": "Düsseldorf",
      "details": "01.10.2025 (Bekanntmachungsdatum)\n\nNordrhein-Westfalen Amtsgericht Düsseldorf HRB 88864\nRegisterbekanntmachung nach dem Umwandlungsgesetz 01.10.2025 (Eintragungsdatum)\n\n1&1 Versatel GmbH\nGesellschaft mit beschränkter Haftung\nDüsseldorf\n\nDen Gläubigern der an der Verschmelzung beteiligten Rechtsträger ist, wenn sie binnen sechs Monaten nach dem Tag, an dem die Eintragung der Verschmelzung in das Register des Sitzes desjenigen Rechtsträgers, dessen Gläubiger sie sind, nach § 19 Absatz 3 UmwG als bekanntgemacht gilt, ihren Anspruch nach Grund und Höhe schriftlich anmelden, Sicherheit zu leisten, soweit sie nicht Befriedigung verlangen können. Dieses Recht steht den Gläubigern jedoch nur zu, wenn sie glaubhaft machen, dass durch die Verschmelzung die Erfüllung ihrer Forderung gefährdet wird."
    },
    {
      "date": "2025-10-01",
      "id": "132349",
      "original_text": "Einreichung neuer Dokumente\nNordrhein-Westfalen Amtsgericht Siegburg HRB 10061\nStadtwerke Sankt Augustin GmbH – Sankt Augustin",
      "type": "Einreichung neuer Dokumente",
      "state": "Nordrhein-Westfalen",
      "amtsgericht": "Amtsgericht Siegburg",
      "registernummer": "HRB 10061",
      "registerart": "HRB",
      "company_name": "Stadtwerke Sankt Augustin GmbH",
      "company_seat": "Sankt Augustin",
      "details": "01.10.2025 (Bekanntmachungsdatum)\n\nNordrhein-Westfalen Amtsgericht Siegburg HRB 10061\nEinreichung neuer Dokumente\n\nStadtwerke Sankt Augustin GmbH\nGesellschaft mit beschränkter Haftung\nSankt Augustin\n\nDem Registergericht ist eine neue Liste der Mitglieder des Aufsichtsrates eingereicht worden."
    },
    {
      "date": "2025-10-01",
      "id": "132350",
      "original_text": "Registerbekanntmachung nach dem Umwandlungsgesetz\nNordrhein-Westfalen Amtsgericht Köln HRB 27043\nPENNY Markt GmbH – Köln",
      "type": "Registerbekanntmachung nach dem Umwandlungsgesetz",
      "state": "Nordrhein-Westfalen",
      "amtsgericht": "Amtsgericht Köln",
      "registernummer": "HRB 27043",
      "registerart": "HRB",
      "company_name": "PENNY Markt GmbH",
      "company_seat": "Köln",
      "details": "01.10.2025 (Bekanntmachungsdatum)\n\nNordrhein-Westfalen Amtsgericht Köln HRB 27043\nRegisterbekanntmachung nach dem Umwandlungsgesetz 01.10.2025 (Eintragungsdatum)\n\nPENNY Markt GmbH\nGesellschaft mit beschränkter Haftung\nKöln\n\nDen Gläubigern der an der Abspaltung beteiligten Rechtsträger ist, wenn sie binnen sechs Monaten nach dem Tag, an dem die Eintragung der Abspaltung in das Register des Sitzes desjenigen Rechtsträgers, dessen Gläubiger sie sind, nach § 19 Absatz 3 UmwG als bekanntgemacht gilt, ihren Anspruch nach Grund und Höhe schriftlich anmelden, Sicherheit zu leisten, soweit sie nicht Befriedigung verlangen können. Dieses Recht steht den Gläubigern jedoch nur zu, wenn sie glaubhaft machen, dass durch die Abspaltung die Erfüllung ihrer Forderung gefährdet wird."
    },
    {
      "date": "2025-10-01",
      "id": "132351",
      "original_text": "Löschungsankündigung\nNordrhein-Westfalen Amtsgericht Siegburg HRB 15143\nFB Waste Recycling GmbH – Nümbrecht",
      "type": "Löschungsankündigung",
      "state": "Nordrhein-Westfalen",
      "amtsgericht": "Amtsgericht Siegburg",
      "registernummer": "HRB 15143",
      "registerart": "HRB",
      "company_name": "FB Waste Recycling GmbH",
      "company_seat": "Nümbrecht",
      "details": "01.10.2025 (Bekanntmachungsdatum)\n\nNordrhein-Westfalen Amtsgericht Siegburg HRB 15143\nLöschungsankündigung\n\nFB Waste Recycling GmbH\nGesellschaft mit beschränkter Haftung\nNümbrecht\n\nDas Registergericht hat glaubhafte Kenntnis erlangt, dass die Gesellschaft vermögenslos geworden ist, da ein Insolvenzverfahren durchgeführt und nach § 200 InsO aufgehoben wurde.\n\nEs ist daher beabsichtigt, die Gesellschaft nach § 394 FamFG im Handelsregister wegen Vermögenslosigkeit zu löschen.\n\nEinwände gegen die Löschung sind durch Widerspruch binnen einer Frist von 3 Monaten geltend zu machen, andernfalls die Löschung erfolgen wird.\n\nEinzulegen ist der Widerspruch bei dem Amtsgericht Siegburg, Neue Poststraße 16, 53721 Siegburg, und zwar entweder schriftlich in deutscher Sprache oder mündlich zur Niederschrift der Geschäftsstelle. Der Widerspruch kann auch zur Niederschrift der Geschäftsstelle eines jeden Amtsgerichts abgegeben werden. Der Widerspruch ist binnen der in der Verfügung bestimmten Frist einzulegen. Die Frist ist nur gewahrt, wenn der Widerspruch rechtzeitig bei dem Amtsgericht Siegburg eingeht, auch wenn der Widerspruch zur Niederschrift der Geschäftsstelle eines anderen Amtsgerichts abgegeben wurde. Die Frist beginnt jeweils mit der schriftlichen Bekanntgabe der Verfügung an die Beteiligten. Kann die schriftliche Bekanntgabe an einen Beteiligten nicht bewirkt werden, beginnt die Frist spätestens mit Ablauf von fünf Monaten nach Erlass der Verfügung. Die Bekanntgabe ist entweder durch Zustellung oder am dritten Tage nach Aufgabe zur Post bewirkt. Sofern die Löschung noch nicht erfolgt ist, kann der Widerspruch auch noch nach Ablauf der Frist eingelegt werden. Fällt das Ende der Frist auf einen Sonnabend, einen Sonntag oder einen allgemeinen Feiertag, endet die Frist mit Ablauf des nächsten Werktages. Der Widerspruch ist zu unterzeichnen. Eine Begründung des Widerspruchs ist nicht vorgeschrieben."
    },
    {
      "date": "2025-10-01",
      "id": "132352",
      "original_text": "Löschungsankündigung\nNordrhein-Westfalen Amtsgericht Dortmund HRA 17666\nWinter Transporte GmbH & Co KG – Dortmund",
      "type": "Löschungsankündigung",
      "state": "Nordrhein-Westfalen",
      "amtsgericht": "Amtsgericht Dortmund",
      "registernummer": "HRA 17666",
      "registerart": "HRA",
      "company_name": "Winter Transporte GmbH & Co KG",
      "company_seat": "Dortmund",
      "details": "01.10.2025 (Bekanntmachungsdatum)\n\nNordrhein-Westfalen Amtsgericht Dortmund HRA 17666\nLöschungsankündigung\n\nWinter Transporte GmbH & Co KG\nKommanditgesellschaft\nDortmund\n\nDas Registergericht beabsichtigt die Firma von Amts wegen nach § 394 FamFG zu löschen. Die Frist zur Erhebung eines Widerspruchs ist auf zwei Monate festgesetzt."
    },
    {
      "date": "2025-10-01",
      "id": "132353",
      "original_text": "Registerbekanntmachung nach dem Umwandlungsgesetz\nNordrhein-Westfalen Amtsgericht Bonn HRB 7811\nWBG Wohnungsbaugesellschaft Bonn mit beschränkter Haftung – Bonn",
      "type": "Registerbekanntmachung nach dem Umwandlungsgesetz",
      "state": "Nordrhein-Westfalen",
      "amtsgericht": "Amtsgericht Bonn",
      "registernummer": "HRB 7811",
      "registerart": "HRB",
      "company_name": "WBG Wohnungsbaugesellschaft Bonn mit beschränkter Haftung",
      "company_seat": "Bonn",
      "details": "01.10.2025 (Bekanntmachungsdatum)\n\nNordrhein-Westfalen Amtsgericht Bonn HRB 7811\nRegisterbekanntmachung nach dem Umwandlungsgesetz 01.10.2025 (Eintragungsdatum)\n\nWBG Wohnungsbaugesellschaft Bonn mit beschränkter Haftung\nGesellschaft mit beschränkter Haftung\nBonn\n\nDen Gläubigern der an der Verschmelzung beteiligten Rechtsträger ist, wenn sie binnen sechs Monaten nach dem Tag, an dem die Eintragung der Verschmelzung in das Register des Sitzes desjenigen Rechtsträgers, dessen Gläubiger sie sind, nach § 19 Absatz 3 UmwG als bekanntgemacht gilt, ihren Anspruch nach Grund und Höhe schriftlich anmelden, Sicherheit zu leisten, soweit sie nicht Befriedigung verlangen können. Dieses Recht steht den Gläubigern jedoch nur zu, wenn sie glaubhaft machen, dass durch die Verschmelzung die Erfüllung ihrer Forderung gefährdet wird."
    },
    {
      "date": "2025-10-01",
      "id": "132354",
      "original_text": "Registerbekanntmachung nach dem Umwandlungsgesetz\nNordrhein-Westfalen Amtsgericht Düsseldorf HRB 88501\nCore Asset Management GmbH – Monheim am Rhein",
      "type": "Registerbekanntmachung nach dem Umwandlungsgesetz",
      "state": "Nordrhein-Westfalen",
      "amtsgericht": "Amtsgericht Düsseldorf",
      "registernummer": "HRB 88501",
      "registerart": "HRB",
      "company_name": "Core Asset Management GmbH",
      "company_seat": "Monheim am Rhein",
      "details": "01.10.2025 (Bekanntmachungsdatum)\n\nNordrhein-Westfalen Amtsgericht Düsseldorf HRB 88501\nRegisterbekanntmachung nach dem Umwandlungsgesetz 01.10.2025 (Eintragungsdatum)\n\nCore Asset Management GmbH\nGesellschaft mit beschränkter Haftung\nMonheim am Rhein\n\nDen Gläubigern der an der Verschmelzung beteiligten Rechtsträger ist, wenn sie binnen sechs Monaten nach dem Tag, an dem die Eintragung der Verschmelzung in das Register des Sitzes desjenigen Rechtsträgers, dessen Gläubiger sie sind, nach § 19 Absatz 3 UmwG als bekanntgemacht gilt, ihren Anspruch nach Grund und Höhe schriftlich anmelden, Sicherheit zu leisten, soweit sie nicht Befriedigung verlangen können. Dieses Recht steht den Gläubigern jedoch nur zu, wenn sie glaubhaft machen, dass durch die Verschmelzung die Erfüllung ihrer Forderung gefährdet wird."
    },
    {
      "date": "2025-10-01",
      "id": "132355",
      "original_text": "Löschungsankündigung\nNordrhein-Westfalen Amtsgericht Bad Oeynhausen HRB 13363\nHälbig Beteiligungs- und Verwaltungs GmbH – Spenge",
      "type": "Löschungsankündigung",
      "state": "Nordrhein-Westfalen",
      "amtsgericht": "Amtsgericht Bad Oeynhausen",
      "registernummer": "HRB 13363",
      "registerart": "HRB",
      "company_name": "Hälbig Beteiligungs- und Verwaltungs GmbH",
      "company_seat": "Spenge",
      "details": "01.10.2025 (Bekanntmachungsdatum)\n\nNordrhein-Westfalen Amtsgericht Bad Oeynhausen HRB 13363\nLöschungsankündigung\n\nHälbig Beteiligungs- und Verwaltungs GmbH\nGesellschaft mit beschränkter Haftung\nSpenge\n\nDas Registergericht beabsichtigt die Gesellschaft von Amts wegen nach § 394 FamFG zu löschen. Die Frist zur Erhebung eines Widerspruchs ist auf einen Monat festgesetzt."
    },
    {
      "date": "2025-10-01",
      "id": "132356",
      "original_text": "Registerbekanntmachung nach dem Umwandlungsgesetz\nNordrhein-Westfalen Amtsgericht Siegen HRB 14378\nHütte Bohrtechnik Gesellschaft mit beschränkter Haftung – Olpe",
      "type": "Registerbekanntmachung nach dem Umwandlungsgesetz",
      "state": "Nordrhein-Westfalen",
      "amtsgericht": "Amtsgericht Siegen",
      "registernummer": "HRB 14378",
      "registerart": "HRB",
      "company_name": "Hütte Bohrtechnik Gesellschaft mit beschränkter Haftung",
      "company_seat": "Olpe",
      "details": "01.10.2025 (Bekanntmachungsdatum)\n\nNordrhein-Westfalen Amtsgericht Siegen HRB 14378\nRegisterbekanntmachung nach dem Umwandlungsgesetz 01.10.2025 (Eintragungsdatum)\n\nHütte Bohrtechnik Gesellschaft mit beschränkter Haftung\nGesellschaft mit beschränkter Haftung\nOlpe\n\nDen Gläubigern der an der Verschmelzung beteiligten Rechtsträger ist, wenn sie binnen sechs Monaten nach dem Tag, an dem die Eintragung der Verschmelzung in das Register des Sitzes derjenigen Rechtsträger deren Gläubiger sie sind, nach § 19 Absatz 3 UmwG als bekanntgemacht gilt, ihren Anspruch nach Grund und Höhe schriftlich anmelden, Sicherheit zu leisten, soweit sie nicht Befriedigung verlangen können. Dieses Recht steht den Gläubigern jedoch nur zu, wenn sie glaubhaft machen, dass durch die Verschmelzung die Erfüllung ihrer Forderung gefährdet wird."
    },
    {
      "date": "2025-10-01",
      "id": "132357",
      "original_text": "Registerbekanntmachung nach dem Umwandlungsgesetz\nNordrhein-Westfalen Amtsgericht Siegen HRB 6767\nHütte Bohrtechnik Gesellschaft mit beschränkter Haftung – Olpe",
      "type": "Registerbekanntmachung nach dem Umwandlungsgesetz",
      "state": "Nordrhein-Westfalen",
      "amtsgericht": "Amtsgericht Siegen",
      "registernummer": "HRB 6767",
      "registerart": "HRB",
      "company_name": "Hütte Bohrtechnik Gesellschaft mit beschränkter Haftung",
      "company_seat": "Olpe",
      "details": "01.10.2025 (Bekanntmachungsdatum)\n\nNordrhein-Westfalen Amtsgericht Siegen HRB 6767\nRegisterbekanntmachung nach dem Umwandlungsgesetz 30.09.2025 (Eintragungsdatum)\n\nHütte Bohrtechnik Gesellschaft mit beschränkter Haftung\nGesellschaft mit beschränkter Haftung\nOlpe\n\nDen Gläubigern der an der Verschmelzung beteiligten Rechtsträger ist, wenn sie binnen sechs Monaten nach dem Tag, an dem die Eintragung der Verschmelzung in das Register des Sitzes derjenigen Rechtsträger deren Gläubiger sie sind, nach § 19 Absatz 3 UmwG als bekanntgemacht gilt, ihren Anspruch nach Grund und Höhe schriftlich anmelden, Sicherheit zu leisten, soweit sie nicht Befriedigung verlangen können. Dieses Recht steht den Gläubigern jedoch nur zu, wenn sie glaubhaft machen, dass durch die Verschmelzung die Erfüllung ihrer Forderung gefährdet wird."
    },
    {
      "date": "2025-10-01",
      "id": "132358",
      "original_text": "Löschungsankündigung\nBrandenburg Amtsgericht Potsdam HRB 36035\nSPECTRA Facility Management GmbH – Teltow",
      "type": "Löschungsankündigung",
      "state": "Brandenburg",
      "amtsgericht": "Amtsgericht Potsdam",
      "registernummer": "HRB 36035",
      "registerart": "HRB",
      "company_name": "SPECTRA Facility Management GmbH",
      "company_seat": "Teltow",
      "details": "01.10.2025 (Bekanntmachungsdatum)\n\nBrandenburg Amtsgericht Potsdam HRB 36035\nLöschungsankündigung\n\nSPECTRA Facility Management GmbH\nGesellschaft mit beschränkter Haftung\nTeltow\n\nBei der nachstehenden Gesellschaft wird das Amtslöschungsverfahren gemäß § 394 FamFG eingeleitet.\nDie Wie´derspruchsfrist beträgt 8 Wochen."
    },
    {
      "date": "2025-10-01",
      "id": "132359",
      "original_text": "Löschungsankündigung\nHessen Amtsgericht Frankfurt am Main HRB 96921\nALUCOBOND Aluminium-Verbundplatte GmbH – Frankfurt am Main",
      "type": "Löschungsankündigung",
      "state": "Hessen",
      "amtsgericht": "Amtsgericht Frankfurt am Main",
      "registernummer": "HRB 96921",
      "registerart": "HRB",
      "company_name": "ALUCOBOND Aluminium-Verbundplatte GmbH",
      "company_seat": "Frankfurt am Main",
      "details": "01.10.2025 (Bekanntmachungsdatum)\n\nHessen Amtsgericht Frankfurt am Main HRB 96921\nLöschungsankündigung\n\nALUCOBOND Aluminium-Verbundplatte GmbH\nGesellschaft mit beschränkter Haftung\nFrankfurt am Main\n\nDas Registergericht beabsichtigt die im Handelsregister eingetragene Gesellschaft von Amts wegen nach § 394 FamFG zu löschen. Die Frist zur Erhebung eines Widerspruchs gegen die beabsichtigte Löschung wird auf 3 Monate festgesetzt."
    },
    {
      "date": "2025-10-01",
      "id": "132360",
      "original_text": "Registerbekanntmachung nach dem Umwandlungsgesetz\nHessen Amtsgericht Offenbach am Main HRB 53051\nMTW Dienstleistungs- und Handelsgesellschaft m.b.H. – Langen (Hessen)",
      "type": "Registerbekanntmachung nach dem Umwandlungsgesetz",
      "state": "Hessen",
      "amtsgericht": "Amtsgericht Offenbach am Main",
      "registernummer": "HRB 53051",
      "registerart": "HRB",
      "company_name": "MTW Dienstleistungs- und Handelsgesellschaft m.b.H.",
      "company_seat": "Langen (Hessen)",
      "details": "01.10.2025 (Bekanntmachungsdatum)\n\nHessen Amtsgericht Offenbach am Main HRB 53051\nRegisterbekanntmachung nach dem Umwandlungsgesetz 01.10.2025 (Eintragungsdatum)\n\nMTW Dienstleistungs- und Handelsgesellschaft m.b.H.\nGesellschaft mit beschränkter Haftung\nLangen (Hessen)\n\nDen Gläubigern der an der Verschmelzung beteiligten Rechtsträger ist, wenn sie binnen sechs Monaten nach dem Tag, an dem die Eintragung der Verschmelzung in das Register des Sitzes desjenigen Rechtsträgers, dessen Gläubiger sie sind, nach § 19 Absatz 3 UmwG bekannt gemacht worden ist, ihren Anspruch nach Grund und Höhe schriftlich anmelden, Sicherheit zu leisten, soweit sie nicht Befriedigung verlangen können. Dieses Recht steht den Gläubigern jedoch nur zu, wenn sie glaubhaft machen, dass durch die Verschmelzung die Erfüllung ihrer Forderung gefährdet wird."
    },
    {
      "date": "2025-10-01",
      "id": "132361",
      "original_text": "Registerbekanntmachung nach dem Umwandlungsgesetz\nHessen Amtsgericht Offenbach am Main HRA 43396\nAdisa Tomic e.K. – Obertshausen",
      "type": "Registerbekanntmachung nach dem Umwandlungsgesetz",
      "state": "Hessen",
      "amtsgericht": "Amtsgericht Offenbach am Main",
      "registernummer": "HRA 43396",
      "registerart": "HRA",
      "company_name": "Adisa Tomic e.K.",
      "company_seat": "Obertshausen",
      "details": "01.10.2025 (Bekanntmachungsdatum)\n\nHessen Amtsgericht Offenbach am Main HRA 43396\nRegisterbekanntmachung nach dem Umwandlungsgesetz 01.10.2025 (Eintragungsdatum)\n\nAdisa Tomic e.K.\nEinzelkaufmann / Einzelkauffrau\nObertshausen\n\nDen Gläubigern der an der Ausgliederung beteiligten Rechtsträger ist, wenn sie binnen sechs Monaten nach dem Tag, an dem die Eintragung der Ausgliederung in das Register des Sitzes desjenigen Rechtsträgers, dessen Gläubiger sie sind, nach §§ 125, 19 Absatz 3 UmwG bekannt gemacht worden ist, ihren Anspruch nach Grund und Höhe schriftlich anmelden, Sicherheit zu leisten, soweit sie nicht Befriedigung verlangen können. Dieses Recht steht den Gläubigern jedoch nur zu, wenn sie glaubhaft machen, dass durch die Ausgliederung die Erfüllung ihrer Forderung gefährdet wird."
    },
    {
      "date": "2025-10-01",
      "id": "132362",
      "original_text": "Registerbekanntmachung nach dem Umwandlungsgesetz\nHessen Amtsgericht Frankfurt am Main HRA 54202\nCosmo Properties 2 (AFP3) B.V. & Co. KG – Frankfurt am Main",
      "type": "Registerbekanntmachung nach dem Umwandlungsgesetz",
      "state": "Hessen",
      "amtsgericht": "Amtsgericht Frankfurt am Main",
      "registernummer": "HRA 54202",
      "registerart": "HRA",
      "company_name": "Cosmo Properties 2 (AFP3) B.V. & Co. KG",
      "company_seat": "Frankfurt am Main",
      "details": "01.10.2025 (Bekanntmachungsdatum)\n\nHessen Amtsgericht Frankfurt am Main HRA 54202\nRegisterbekanntmachung nach dem Umwandlungsgesetz 01.10.2025 (Eintragungsdatum)\n\nCosmo Properties 2 (AFP3) B.V. & Co. KG\nKommanditgesellschaft\nFrankfurt am Main\n\nDen Gläubigern der an der Ausgliederung beteiligten Rechtsträger ist, wenn sie binnen sechs Monaten nach dem Tag, an dem die Eintragung der Ausgliederung in das Register des Sitzes desjenigen Rechtsträgers, dessen Gläubiger sie sind, nach §§ 125, 19 Absatz 3 UmwG bekannt gemacht worden ist, ihren Anspruch nach Grund und Höhe schriftlich anmelden, Sicherheit zu leisten, soweit sie nicht Befriedigung verlangen können. Dieses Recht steht den Gläubigern jedoch nur zu, wenn sie glaubhaft machen, dass durch die Ausgliederung die Erfüllung ihrer Forderung gefährdet wird."
    },
    {
      "date": "2025-10-01",
      "id": "132363",
      "original_text": "Registerbekanntmachung nach dem Umwandlungsgesetz\nHessen Amtsgericht Darmstadt HRB 108382\nKüche4me GmbH – Birkenau",
      "type": "Registerbekanntmachung nach dem Umwandlungsgesetz",
      "state": "Hessen",
      "amtsgericht": "Amtsgericht Darmstadt",
      "registernummer": "HRB 108382",
      "registerart": "HRB",
      "company_name": "Küche4me GmbH",
      "company_seat": "Birkenau",
      "details": "01.10.2025 (Bekanntmachungsdatum)\n\nHessen Amtsgericht Darmstadt HRB 108382\nRegisterbekanntmachung nach dem Umwandlungsgesetz 01.10.2025 (Eintragungsdatum)\n\nKüche4me GmbH\nGesellschaft mit beschränkter Haftung\nBirkenau\n\nDen Gläubigern der an der Abspaltung beteiligten Rechtsträger ist, wenn sie binnen sechs Monaten nach dem Tag, an dem die Eintragung der Abspaltung in das Register des Sitzes derjenigen Rechtsträger deren Gläubiger sie sind, nach §§ 125, 19 Absatz 3 UmwG bekannt gemacht worden ist, ihren Anspruch nach Grund und Höhe schriftlich anmelden, Sicherheit zu leisten, soweit sie nicht Befriedigung verlangen können. Dieses Recht steht den Gläubigern jedoch nur zu, wenn sie glaubhaft machen, dass durch die Abspaltung die Erfüllung ihrer Forderung gefährdet wird."
    },
    {
      "date": "2025-10-01",
      "id": "132364",
      "original_text": "Löschungsankündigung\nHessen Amtsgericht Eschwege HRA 1518\nGrüning Elektro GmbH & Co. KG – Eschwege",
      "type": "Löschungsankündigung",
      "state": "Hessen",
      "amtsgericht": "Amtsgericht Eschwege",
      "registernummer": "HRA 1518",
      "registerart": "HRA",
      "company_name": "Grüning Elektro GmbH & Co. KG",
      "company_seat": "Eschwege",
      "details": "01.10.2025 (Bekanntmachungsdatum)\n\nHessen Amtsgericht Eschwege HRA 1518\nLöschungsankündigung 01.10.2025 (Eintragungsdatum)\n\nGrüning Elektro GmbH & Co. KG\nKommanditgesellschaft\nEschwege\n\nDas Registergericht beabsichtigt die im Handelsregister eingetragene Firma von Amts wegen nach § 394 FamFG zu löschen. Die Frist zur Erhebung eines Widerspruchs gegen die beabsichtigte Löschung wird auf 3 Monate festgesetzt."
    },
    {
      "date": "2025-10-01",
      "id": "132365",
      "original_text": "Sonstige Registerbekanntmachung\nHessen Amtsgericht Fritzlar HRB 11280\nBernecker MediaWare Aktiengesellschaft – Melsungen",
      "type": "Sonstige Registerbekanntmachung",
      "state": "Hessen",
      "amtsgericht": "Amtsgericht Fritzlar",
      "registernummer": "HRB 11280",
      "registerart": "HRB",
      "company_name": "Bernecker MediaWare Aktiengesellschaft",
      "company_seat": "Melsungen",
      "details": "01.10.2025 (Bekanntmachungsdatum)\n\nHessen Amtsgericht Fritzlar HRB 11280\nSonstige Registerbekanntmachung 01.10.2025 (Eintragungsdatum)\n\nBernecker MediaWare Aktiengesellschaft\nAktiengesellschaft\nMelsungen\n\nDen Gläubigern der Gesellschaft, deren Forderungen begründet worden sind, bevor die Eintragung der Beendigung der Verträge in das Handelsregister nach § 10 HGB bekannt gemacht worden ist, ist vom anderen Vertragsteil Sicherheit zu leisten, wenn sie sich binnen sechs Monaten nach dieser Bekanntmachung zu diesem Zweck bei ihm melden."
    },
    {
      "date": "2025-10-01",
      "id": "132366",
      "original_text": "Registerbekanntmachung nach dem Umwandlungsgesetz\nHessen Amtsgericht Offenbach am Main HRB 50926\nEnterpriser GmbH – Dreieich",
      "type": "Registerbekanntmachung nach dem Umwandlungsgesetz",
      "state": "Hessen",
      "amtsgericht": "Amtsgericht Offenbach am Main",
      "registernummer": "HRB 50926",
      "registerart": "HRB",
      "company_name": "Enterpriser GmbH",
      "company_seat": "Dreieich",
      "details": "01.10.2025 (Bekanntmachungsdatum)\n\nHessen Amtsgericht Offenbach am Main HRB 50926\nRegisterbekanntmachung nach dem Umwandlungsgesetz 01.10.2025 (Eintragungsdatum)\n\nEnterpriser GmbH\nGesellschaft mit beschränkter Haftung\nDreieich\n\nDen Gläubigern der an der Verschmelzung beteiligten Rechtsträger ist, wenn sie binnen sechs Monaten nach dem Tag, an dem die Eintragung der Verschmelzung in das Register des Sitzes desjenigen Rechtsträgers, dessen Gläubiger sie sind, nach § 19 Absatz 3 UmwG bekannt gemacht worden ist, ihren Anspruch nach Grund und Höhe schriftlich anmelden, Sicherheit zu leisten, soweit sie nicht Befriedigung verlangen können. Dieses Recht steht den Gläubigern jedoch nur zu, wenn sie glaubhaft machen, dass durch die Verschmelzung die Erfüllung ihrer Forderung gefährdet wird."
    },
    {
      "date": "2025-10-01",
      "id": "132367",
      "original_text": "Registerbekanntmachung nach dem Umwandlungsgesetz\nHessen Amtsgericht Offenbach am Main HRB 51483\nWites GmbH – Langen (Hessen)",
      "type": "Registerbekanntmachung nach dem Umwandlungsgesetz",
      "state": "Hessen",
      "amtsgericht": "Amtsgericht Offenbach am Main",
      "registernummer": "HRB 51483",
      "registerart": "HRB",
      "company_name": "Wites GmbH",
      "company_seat": "Langen (Hessen)",
      "details": "01.10.2025 (Bekanntmachungsdatum)\n\nHessen Amtsgericht Offenbach am Main HRB 51483\nRegisterbekanntmachung nach dem Umwandlungsgesetz 01.10.2025 (Eintragungsdatum)\n\nWites GmbH\nGesellschaft mit beschränkter Haftung\nLangen (Hessen)\n\nDen Gläubigern der an der Verschmelzung beteiligten Rechtsträger ist, wenn sie binnen sechs Monaten nach dem Tag, an dem die Eintragung der Verschmelzung in das Register des Sitzes desjenigen Rechtsträgers, dessen Gläubiger sie sind, nach § 19 Absatz 3 UmwG bekannt gemacht worden ist, ihren Anspruch nach Grund und Höhe schriftlich anmelden, Sicherheit zu leisten, soweit sie nicht Befriedigung verlangen können. Dieses Recht steht den Gläubigern jedoch nur zu, wenn sie glaubhaft machen, dass durch die Verschmelzung die Erfüllung ihrer Forderung gefährdet wird."
    },
    {
      "date": "2025-10-01",
      "id": "132368",
      "original_text": "Registerbekanntmachung nach dem Umwandlungsgesetz\nHessen Amtsgericht Offenbach am Main HRB 51483\nWites GmbH – Langen (Hessen)",
      "type": "Registerbekanntmachung nach dem Umwandlungsgesetz",
      "state": "Hessen",
      "amtsgericht": "Amtsgericht Offenbach am Main",
      "registernummer": "HRB 51483",
      "registerart": "HRB",
      "company_name": "Wites GmbH",
      "company_seat": "Langen (Hessen)",
      "details": "01.10.2025 (Bekanntmachungsdatum)\n\nHessen Amtsgericht Offenbach am Main HRB 51483\nRegisterbekanntmachung nach dem Umwandlungsgesetz 01.10.2025 (Eintragungsdatum)\n\nWites GmbH\nGesellschaft mit beschränkter Haftung\nLangen (Hessen)\n\nDen Gläubigern der an der Verschmelzung beteiligten Rechtsträger ist, wenn sie binnen sechs Monaten nach dem Tag, an dem die Eintragung der Verschmelzung in das Register des Sitzes desjenigen Rechtsträgers, dessen Gläubiger sie sind, nach § 19 Absatz 3 UmwG bekannt gemacht worden ist, ihren Anspruch nach Grund und Höhe schriftlich anmelden, Sicherheit zu leisten, soweit sie nicht Befriedigung verlangen können. Dieses Recht steht den Gläubigern jedoch nur zu, wenn sie glaubhaft machen, dass durch die Verschmelzung die Erfüllung ihrer Forderung gefährdet wird."
    },
    {
      "date": "2025-10-01",
      "id": "132369",
      "original_text": "Registerbekanntmachung nach dem Umwandlungsgesetz\nHessen Amtsgericht Darmstadt HRB 54449\nRüsselsheimer Mobilitätsgesellschaft mbH – Rüsselsheim",
      "type": "Registerbekanntmachung nach dem Umwandlungsgesetz",
      "state": "Hessen",
      "amtsgericht": "Amtsgericht Darmstadt",
      "registernummer": "HRB 54449",
      "registerart": "HRB",
      "company_name": "Rüsselsheimer Mobilitätsgesellschaft mbH",
      "company_seat": "Rüsselsheim",
      "details": "01.10.2025 (Bekanntmachungsdatum)\n\nHessen Amtsgericht Darmstadt HRB 54449\nRegisterbekanntmachung nach dem Umwandlungsgesetz 01.10.2025 (Eintragungsdatum)\n\nRüsselsheimer Mobilitätsgesellschaft mbH\nGesellschaft mit beschränkter Haftung\nRüsselsheim\n\nDen Gläubigern der an der Ausgliederung beteiligten Rechtsträger ist, wenn sie binnen sechs Monaten nach dem Tag, an dem die Eintragung der Ausgliederung in das Register des Sitzes derjenigen Rechtsträger deren Gläubiger sie sind, nach §§ 125, 19 Absatz 3 UmwG bekannt gemacht worden ist, ihren Anspruch nach Grund und Höhe schriftlich anmelden, Sicherheit zu leisten, soweit sie nicht Befriedigung verlangen können. Dieses Recht steht den Gläubigern jedoch nur zu, wenn sie glaubhaft machen, dass durch die Ausgliederung die Erfüllung ihrer Forderung gefährdet wird."
    },
    {
      "date": "2025-10-01",
      "id": "132370",
      "original_text": "Registerbekanntmachung nach dem Umwandlungsgesetz\nHessen Amtsgericht Offenbach am Main HRA 43044\nCWS Healthcare Deutschland GmbH & Co. KG – Dreieich",
      "type": "Registerbekanntmachung nach dem Umwandlungsgesetz",
      "state": "Hessen",
      "amtsgericht": "Amtsgericht Offenbach am Main",
      "registernummer": "HRA 43044",
      "registerart": "HRA",
      "company_name": "CWS Healthcare Deutschland GmbH & Co. KG",
      "company_seat": "Dreieich",
      "details": "01.10.2025 (Bekanntmachungsdatum)\n\nHessen Amtsgericht Offenbach am Main HRA 43044\nRegisterbekanntmachung nach dem Umwandlungsgesetz 01.10.2025 (Eintragungsdatum)\n\nCWS Healthcare Deutschland GmbH & Co. KG\nKommanditgesellschaft\nDreieich\n\nDen Gläubigern der an der Abspaltung beteiligten Rechtsträger ist, wenn sie binnen sechs Monaten nach dem Tag, an dem die Eintragung der Abspaltung in das Register des Sitzes desjenigen Rechtsträgers, dessen Gläubiger sie sind, nach §§ 125, 19 Absatz 3 UmwG bekannt gemacht worden ist, ihren Anspruch nach Grund und Höhe schriftlich anmelden, Sicherheit zu leisten, soweit sie nicht Befriedigung verlangen können. Dieses Recht steht den Gläubigern jedoch nur zu, wenn sie glaubhaft machen, dass durch die Abspaltung die Erfüllung ihrer Forderung gefährdet wird."
    },
    {
      "date": "2025-10-01",
      "id": "132371",
      "original_text": "Registerbekanntmachung nach dem Umwandlungsgesetz\nHessen Amtsgericht Frankfurt am Main HRB 135746\nRadisson Shared Services Centre Deutschland GmbH – Frankfurt am Main",
      "type": "Registerbekanntmachung nach dem Umwandlungsgesetz",
      "state": "Hessen",
      "amtsgericht": "Amtsgericht Frankfurt am Main",
      "registernummer": "HRB 135746",
      "registerart": "HRB",
      "company_name": "Radisson Shared Services Centre Deutschland GmbH",
      "company_seat": "Frankfurt am Main",
      "details": "01.10.2025 (Bekanntmachungsdatum)\n\nHessen Amtsgericht Frankfurt am Main HRB 135746\nRegisterbekanntmachung nach dem Umwandlungsgesetz 01.10.2025 (Eintragungsdatum)\n\nRadisson Shared Services Centre Deutschland GmbH\nGesellschaft mit beschränkter Haftung\nFrankfurt am Main\n\nDen Gläubigern der an der Verschmelzung beteiligten Rechtsträger ist, wenn sie binnen sechs Monaten nach dem Tag, an dem die Eintragung der Verschmelzung in das Register des Sitzes desjenigen Rechtsträgers, dessen Gläubiger sie sind, nach § 19 Absatz 3 UmwG bekannt gemacht worden ist, ihren Anspruch nach Grund und Höhe schriftlich anmelden, Sicherheit zu leisten, soweit sie nicht Befriedigung verlangen können. Dieses Recht steht den Gläubigern jedoch nur zu, wenn sie glaubhaft machen, dass durch die Verschmelzung die Erfüllung ihrer Forderung gefährdet wird."
    },
    {
      "date": "2025-10-01",
      "id": "132372",
      "original_text": "Registerbekanntmachung nach dem Umwandlungsgesetz\nHessen Amtsgericht Offenbach am Main HRA 43548\nOhlenschläger, Gunnar Hendrik Restaurantschiff, Offenbach am Main e.K. – Offenbach am Main",
      "type": "Registerbekanntmachung nach dem Umwandlungsgesetz",
      "state": "Hessen",
      "amtsgericht": "Amtsgericht Offenbach am Main",
      "registernummer": "HRA 43548",
      "registerart": "HRA",
      "company_name": "Ohlenschläger, Gunnar Hendrik Restaurantschiff, Offenbach am Main e.K.",
      "company_seat": "Offenbach am Main",
      "details": "01.10.2025 (Bekanntmachungsdatum)\n\nHessen Amtsgericht Offenbach am Main HRA 43548\nRegisterbekanntmachung nach dem Umwandlungsgesetz 01.10.2025 (Eintragungsdatum)\n\nOhlenschläger, Gunnar Hendrik Restaurantschiff, Offenbach am Main e.K.\nEinzelkaufmann / Einzelkauffrau\nOffenbach am Main\n\nDen Gläubigern der an der Ausgliederung beteiligten Rechtsträger ist, wenn sie binnen sechs Monaten nach dem Tag, an dem die Eintragung der Ausgliederung in das Register des Sitzes desjenigen Rechtsträgers, dessen Gläubiger sie sind, nach §§ 125, 19 Absatz 3 UmwG bekannt gemacht worden ist, ihren Anspruch nach Grund und Höhe schriftlich anmelden, Sicherheit zu leisten, soweit sie nicht Befriedigung verlangen können. Dieses Recht steht den Gläubigern jedoch nur zu, wenn sie glaubhaft machen, dass durch die Ausgliederung die Erfüllung ihrer Forderung gefährdet wird."
    },
    {
      "date": "2025-10-01",
      "id": "132373",
      "original_text": "Registerbekanntmachung nach dem Umwandlungsgesetz\nHessen Amtsgericht Frankfurt am Main HRB 136325\nRadisson Hotels Deutschland GmbH – Frankfurt am Main",
      "type": "Registerbekanntmachung nach dem Umwandlungsgesetz",
      "state": "Hessen",
      "amtsgericht": "Amtsgericht Frankfurt am Main",
      "registernummer": "HRB 136325",
      "registerart": "HRB",
      "company_name": "Radisson Hotels Deutschland GmbH",
      "company_seat": "Frankfurt am Main",
      "details": "01.10.2025 (Bekanntmachungsdatum)\n\nHessen Amtsgericht Frankfurt am Main HRB 136325\nRegisterbekanntmachung nach dem Umwandlungsgesetz 01.10.2025 (Eintragungsdatum)\n\nRadisson Hotels Deutschland GmbH\nGesellschaft mit beschränkter Haftung\nFrankfurt am Main\n\nDen Gläubigern der an der Verschmelzung beteiligten Rechtsträger ist, wenn sie binnen sechs Monaten nach dem Tag, an dem die Eintragung der Verschmelzung in das Register des Sitzes desjenigen Rechtsträgers, dessen Gläubiger sie sind, nach § 19 Absatz 3 UmwG bekannt gemacht worden ist, ihren Anspruch nach Grund und Höhe schriftlich anmelden, Sicherheit zu leisten, soweit sie nicht Befriedigung verlangen können. Dieses Recht steht den Gläubigern jedoch nur zu, wenn sie glaubhaft machen, dass durch die Verschmelzung die Erfüllung ihrer Forderung gefährdet wird."
    },
    {
      "date": "2025-10-01",
      "id": "132374",
      "original_text": "Registerbekanntmachung nach dem Umwandlungsgesetz\nHessen Amtsgericht Frankfurt am Main HRB 135823\nRadisson Sales & Marketing Central Europe GmbH – Frankfurt am Main",
      "type": "Registerbekanntmachung nach dem Umwandlungsgesetz",
      "state": "Hessen",
      "amtsgericht": "Amtsgericht Frankfurt am Main",
      "registernummer": "HRB 135823",
      "registerart": "HRB",
      "company_name": "Radisson Sales & Marketing Central Europe GmbH",
      "company_seat": "Frankfurt am Main",
      "details": "01.10.2025 (Bekanntmachungsdatum)\n\nHessen Amtsgericht Frankfurt am Main HRB 135823\nRegisterbekanntmachung nach dem Umwandlungsgesetz 01.10.2025 (Eintragungsdatum)\n\nRadisson Sales & Marketing Central Europe GmbH\nGesellschaft mit beschränkter Haftung\nFrankfurt am Main\n\nDen Gläubigern der an der Verschmelzung beteiligten Rechtsträger ist, wenn sie binnen sechs Monaten nach dem Tag, an dem die Eintragung der Verschmelzung in das Register des Sitzes desjenigen Rechtsträgers, dessen Gläubiger sie sind, nach § 19 Absatz 3 UmwG bekannt gemacht worden ist, ihren Anspruch nach Grund und Höhe schriftlich anmelden, Sicherheit zu leisten, soweit sie nicht Befriedigung verlangen können. Dieses Recht steht den Gläubigern jedoch nur zu, wenn sie glaubhaft machen, dass durch die Verschmelzung die Erfüllung ihrer Forderung gefährdet wird."
    },
    {
      "date": "2025-10-01",
      "id": "132375",
      "original_text": "Registerbekanntmachung nach dem Umwandlungsgesetz\nHessen Amtsgericht Frankfurt am Main HRB 120020\nData Interchange GmbH – Frankfurt am Main",
      "type": "Registerbekanntmachung nach dem Umwandlungsgesetz",
      "state": "Hessen",
      "amtsgericht": "Amtsgericht Frankfurt am Main",
      "registernummer": "HRB 120020",
      "registerart": "HRB",
      "company_name": "Data Interchange GmbH",
      "company_seat": "Frankfurt am Main",
      "details": "01.10.2025 (Bekanntmachungsdatum)\n\nHessen Amtsgericht Frankfurt am Main HRB 120020\nRegisterbekanntmachung nach dem Umwandlungsgesetz 01.10.2025 (Eintragungsdatum)\n\nData Interchange GmbH\nGesellschaft mit beschränkter Haftung\nFrankfurt am Main\n\nDen Gläubigern der an der Verschmelzung beteiligten Rechtsträger ist, wenn sie binnen sechs Monaten nach dem Tag, an dem die Eintragung der Verschmelzung in das Register des Sitzes desjenigen Rechtsträgers, dessen Gläubiger sie sind, nach § 19 Absatz 3 UmwG bekannt gemacht worden ist, ihren Anspruch nach Grund und Höhe schriftlich anmelden, Sicherheit zu leisten, soweit sie nicht Befriedigung verlangen können. Dieses Recht steht den Gläubigern jedoch nur zu, wenn sie glaubhaft machen, dass durch die Verschmelzung die Erfüllung ihrer Forderung gefährdet wird."
    },
    {
      "date": "2025-10-01",
      "id": "132376",
      "original_text": "Sonstige Registerbekanntmachung\nHessen Amtsgericht Darmstadt VR 1011\nMarine-Verein Darmstadt und Umgebung e.V. – Darmstadt",
      "type": "Sonstige Registerbekanntmachung",
      "state": "Hessen",
      "amtsgericht": "Amtsgericht Darmstadt",
      "registernummer": "VR 1011",
      "registerart": "VR",
      "company_name": "Marine-Verein Darmstadt und Umgebung e.V.",
      "company_seat": "Darmstadt",
      "details": "01.10.2025 (Bekanntmachungsdatum)\n\nHessen Amtsgericht Darmstadt VR 1011\nSonstige Registerbekanntmachung 01.10.2025 (Eintragungsdatum)\n\nMarine-Verein Darmstadt und Umgebung e.V.\neingetragener Verein\nDarmstadt\n\nDer Verein ist aufgelöst."
    },
    {
      "date": "2025-10-01",
      "id": "132377",
      "original_text": "Löschungsankündigung\nHessen Amtsgericht Offenbach am Main HRB 22883\nTECH Touristik-EDV-Consulting Hummel Gesellschaft mit beschränkter Haftung – Seligenstadt (Hessen)",
      "type": "Löschungsankündigung",
      "state": "Hessen",
      "amtsgericht": "Amtsgericht Offenbach am Main",
      "registernummer": "HRB 22883",
      "registerart": "HRB",
      "company_name": "TECH Touristik-EDV-Consulting Hummel Gesellschaft mit beschränkter Haftung",
      "company_seat": "Seligenstadt (Hessen)",
      "details": "01.10.2025 (Bekanntmachungsdatum)\n\nHessen Amtsgericht Offenbach am Main HRB 22883\nLöschungsankündigung\n\nTECH Touristik-EDV-Consulting Hummel Gesellschaft mit beschränkter Haftung\nGesellschaft mit beschränkter Haftung\nSeligenstadt (Hessen)\n\nDas Registergericht beabsichtigt die im Handelsregister eingetragene Gesellschaft von Amts wegen nach § 394 FamFG zu löschen. Die Frist zur Erhebung eines Widerspruchs gegen die beabsichtigte Löschung wird auf 3 Monate festgesetzt."
    },
    {
      "date": "2025-10-01",
      "id": "132378",
      "original_text": "Registerbekanntmachung nach dem Umwandlungsgesetz\nHessen Amtsgericht Darmstadt HRB 83939\nStadtwerke Rüsselsheim GmbH – Rüsselsheim",
      "type": "Registerbekanntmachung nach dem Umwandlungsgesetz",
      "state": "Hessen",
      "amtsgericht": "Amtsgericht Darmstadt",
      "registernummer": "HRB 83939",
      "registerart": "HRB",
      "company_name": "Stadtwerke Rüsselsheim GmbH",
      "company_seat": "Rüsselsheim",
      "details": "01.10.2025 (Bekanntmachungsdatum)\n\nHessen Amtsgericht Darmstadt HRB 83939\nRegisterbekanntmachung nach dem Umwandlungsgesetz 01.10.2025 (Eintragungsdatum)\n\nStadtwerke Rüsselsheim GmbH\nGesellschaft mit beschränkter Haftung\nRüsselsheim\n\nDen Gläubigern der an der Ausgliederung beteiligten Rechtsträger ist, wenn sie binnen sechs Monaten nach dem Tag, an dem die Eintragung der Ausgliederung in das Register des Sitzes derjenigen Rechtsträger deren Gläubiger sie sind, nach §§ 125, 19 Absatz 3 UmwG bekannt gemacht worden ist, ihren Anspruch nach Grund und Höhe schriftlich anmelden, Sicherheit zu leisten, soweit sie nicht Befriedigung verlangen können. Dieses Recht steht den Gläubigern jedoch nur zu, wenn sie glaubhaft machen, dass durch die Ausgliederung die Erfüllung ihrer Forderung gefährdet wird."
    },
    {
      "date": "2025-10-01",
      "id": "132379",
      "original_text": "Löschungsankündigung\nHessen Amtsgericht Eschwege HRB 1104\nGrüning Elektro Beteiligungs GmbH – Eschwege",
      "type": "Löschungsankündigung",
      "state": "Hessen",
      "amtsgericht": "Amtsgericht Eschwege",
      "registernummer": "HRB 1104",
      "registerart": "HRB",
      "company_name": "Grüning Elektro Beteiligungs GmbH",
      "company_seat": "Eschwege",
      "details": "01.10.2025 (Bekanntmachungsdatum)\n\nHessen Amtsgericht Eschwege HRB 1104\nLöschungsankündigung 01.10.2025 (Eintragungsdatum)\n\nGrüning Elektro Beteiligungs GmbH\nGesellschaft mit beschränkter Haftung\nEschwege\n\nDas Registergericht beabsichtigt die im Handelsregister eingetragene Gesellschaft von Amts wegen nach § 394 FamFG zu löschen. Die Frist zur Erhebung eines Widerspruchs gegen die beabsichtigte Löschung wird auf 3 Monate festgesetzt."
    },
    {
      "date": "2025-10-01",
      "id": "132380",
      "original_text": "Registerbekanntmachung nach dem Umwandlungsgesetz\nHessen Amtsgericht Gießen GnR 302\nVolksbank Mittelhessen eG – Gießen",
      "type": "Registerbekanntmachung nach dem Umwandlungsgesetz",
      "state": "Hessen",
      "amtsgericht": "Amtsgericht Gießen",
      "registernummer": "GnR 302",
      "registerart": "GnR",
      "company_name": "Volksbank Mittelhessen eG",
      "company_seat": "Gießen",
      "details": "01.10.2025 (Bekanntmachungsdatum)\n\nHessen Amtsgericht Gießen GnR 302\nRegisterbekanntmachung nach dem Umwandlungsgesetz 01.10.2025 (Eintragungsdatum)\n\nVolksbank Mittelhessen eG\neingetragene Genossenschaft\nGießen\n\nDen Gläubigern der an der Verschmelzung beteiligten Rechtsträger ist, wenn sie binnen sechs Monaten nach dem Tag, an dem die Eintragung der Verschmelzung in das Register des Sitzes desjenigen Rechtsträgers, dessen Gläubiger sie sind, nach § 19 Absatz 3 UmwG bekannt gemacht worden ist, ihren Anspruch nach Grund und Höhe schriftlich anmelden, Sicherheit zu leisten, soweit sie nicht Befriedigung verlangen können. Dieses Recht steht den Gläubigern jedoch nur zu, wenn sie glaubhaft machen, dass durch die Verschmelzung die Erfüllung ihrer Forderung gefährdet wird."
    },
    {
      "date": "2025-10-01",
      "id": "132381",
      "original_text": "Registerbekanntmachung nach dem Umwandlungsgesetz\nHessen Amtsgericht Offenbach am Main HRB 51275\nbcs-people GmbH – Dreieich",
      "type": "Registerbekanntmachung nach dem Umwandlungsgesetz",
      "state": "Hessen",
      "amtsgericht": "Amtsgericht Offenbach am Main",
      "registernummer": "HRB 51275",
      "registerart": "HRB",
      "company_name": "bcs-people GmbH",
      "company_seat": "Dreieich",
      "details": "01.10.2025 (Bekanntmachungsdatum)\n\nHessen Amtsgericht Offenbach am Main HRB 51275\nRegisterbekanntmachung nach dem Umwandlungsgesetz 01.10.2025 (Eintragungsdatum)\n\nbcs-people GmbH\nGesellschaft mit beschränkter Haftung\nDreieich\n\nDen Gläubigern der an der Verschmelzung beteiligten Rechtsträger ist, wenn sie binnen sechs Monaten nach dem Tag, an dem die Eintragung der Verschmelzung in das Register des Sitzes desjenigen Rechtsträgers, dessen Gläubiger sie sind, nach § 19 Absatz 3 UmwG bekannt gemacht worden ist, ihren Anspruch nach Grund und Höhe schriftlich anmelden, Sicherheit zu leisten, soweit sie nicht Befriedigung verlangen können. Dieses Recht steht den Gläubigern jedoch nur zu, wenn sie glaubhaft machen, dass durch die Verschmelzung die Erfüllung ihrer Forderung gefährdet wird."
    },
    {
      "date": "2025-10-01",
      "id": "132382",
      "original_text": "Einreichung neuer Dokumente\nHessen Amtsgericht Frankfurt am Main HRB 94942\n.bieker AG – Frankfurt am Main",
      "type": "Einreichung neuer Dokumente",
      "state": "Hessen",
      "amtsgericht": "Amtsgericht Frankfurt am Main",
      "registernummer": "HRB 94942",
      "registerart": "HRB",
      "company_name": ".bieker AG",
      "company_seat": "Frankfurt am Main",
      "details": "01.10.2025 (Bekanntmachungsdatum)\n\nHessen Amtsgericht Frankfurt am Main HRB 94942\nEinreichung neuer Dokumente\n\n.bieker AG\nAktiengesellschaft\nFrankfurt am Main\n\nDurch eine Änderung in den Personen der Aufsichtsratsmitglieder ist eine Liste der Mitglieder des Aufsichtsrates zum Handelsregister eingereicht worden."
    },
    {
      "date": "2025-10-01",
      "id": "132383",
      "original_text": "Registerbekanntmachung nach dem Umwandlungsgesetz\nHessen Amtsgericht Frankfurt am Main HRB 139058\nRFN Transport GmbH – Frankfurt am Main",
      "type": "Registerbekanntmachung nach dem Umwandlungsgesetz",
      "state": "Hessen",
      "amtsgericht": "Amtsgericht Frankfurt am Main",
      "registernummer": "HRB 139058",
      "registerart": "HRB",
      "company_name": "RFN Transport GmbH",
      "company_seat": "Frankfurt am Main",
      "details": "01.10.2025 (Bekanntmachungsdatum)\n\nHessen Amtsgericht Frankfurt am Main HRB 139058\nRegisterbekanntmachung nach dem Umwandlungsgesetz 01.10.2025 (Eintragungsdatum)\n\nRFN Transport GmbH\nGesellschaft mit beschränkter Haftung\nFrankfurt am Main\n\nDen Gläubigern der an der Ausgliederung beteiligten Rechtsträger ist, wenn sie binnen sechs Monaten nach dem Tag, an dem die Eintragung der Ausgliederung in das Register des Sitzes desjenigen Rechtsträgers, dessen Gläubiger sie sind, nach § 19 Absatz 3 UmwG bekannt gemacht worden ist, ihren Anspruch nach Grund und Höhe schriftlich anmelden, Sicherheit zu leisten, soweit sie nicht Befriedigung verlangen können. Dieses Recht steht den Gläubigern jedoch nur zu, wenn sie glaubhaft machen, dass durch die Ausgliederung die Erfüllung ihrer Forderung gefährdet wird."
    },
    {
      "date": "2025-10-01",
      "id": "132384",
      "original_text": "Sonstige Registerbekanntmachung\nHessen Amtsgericht Frankfurt am Main HRB 52338\nInvestors Marketing AG – Frankfurt am Main",
      "type": "Sonstige Registerbekanntmachung",
      "state": "Hessen",
      "amtsgericht": "Amtsgericht Frankfurt am Main",
      "registernummer": "HRB 52338",
      "registerart": "HRB",
      "company_name": "Investors Marketing AG",
      "company_seat": "Frankfurt am Main",
      "details": "01.10.2025 (Bekanntmachungsdatum)\n\nHessen Amtsgericht Frankfurt am Main HRB 52338\nSonstige Registerbekanntmachung 01.10.2025 (Eintragungsdatum)\n\nInvestors Marketing AG\nAktiengesellschaft\nFrankfurt am Main\n\nDurch eine Änderung in den Personen der Aufsichtsratsmitglieder ist eine Liste der Mitglieder des Aufsichtsrates zum Handelsregister eingereicht worden."
    },
    {
      "date": "2025-10-01",
      "id": "132385",
      "original_text": "Registerbekanntmachung nach dem Umwandlungsgesetz\nHessen Amtsgericht Fritzlar HRB 11280\nBernecker MediaWare Aktiengesellschaft – Melsungen",
      "type": "Registerbekanntmachung nach dem Umwandlungsgesetz",
      "state": "Hessen",
      "amtsgericht": "Amtsgericht Fritzlar",
      "registernummer": "HRB 11280",
      "registerart": "HRB",
      "company_name": "Bernecker MediaWare Aktiengesellschaft",
      "company_seat": "Melsungen",
      "details": "01.10.2025 (Bekanntmachungsdatum)\n\nHessen Amtsgericht Fritzlar HRB 11280\nRegisterbekanntmachung nach dem Umwandlungsgesetz 01.10.2025 (Eintragungsdatum)\n\nBernecker MediaWare Aktiengesellschaft\nAktiengesellschaft\nMelsungen\n\nDen Gläubigern der an der formwechselnden Umwandlung beteiligten Rechtsträger ist, wenn sie binnen sechs Monaten nach dem Tag, an dem die Eintragung der formwechselnden Umwandlung in das Register des Sitzes desjenigen Rechtsträgers, dessen Gläubiger sie sind, nach § 201 UmwG bekannt gemacht worden ist, ihren Anspruch nach Grund und Höhe schriftlich anmelden, Sicherheit zu leisten, soweit sie nicht Befriedigung verlangen können. Dieses Recht steht den Gläubigern jedoch nur zu, wenn sie glaubhaft machen, dass durch die formwechselnden Umwandlung die Erfüllung ihrer Forderung gefährdet wird."
    },
    {
      "date": "2025-10-01",
      "id": "132386",
      "original_text": "Löschungsankündigung\nHessen Amtsgericht Bad Hersfeld HRB 2662\nGesund und Fit UG (haftungsbeschränkt) – Philippsthal",
      "type": "Löschungsankündigung",
      "state": "Hessen",
      "amtsgericht": "Amtsgericht Bad Hersfeld",
      "registernummer": "HRB 2662",
      "registerart": "HRB",
      "company_name": "Gesund und Fit UG (haftungsbeschränkt)",
      "company_seat": "Philippsthal",
      "details": "01.10.2025 (Bekanntmachungsdatum)\n\nHessen Amtsgericht Bad Hersfeld HRB 2662\nLöschungsankündigung\n\nGesund und Fit UG (haftungsbeschränkt)\nGesellschaft mit beschränkter Haftung\nPhilippsthal\n\nDas Registergericht beabsichtigt die im Handelsregister eingetragene Gesellschaft von Amts wegen nach § 394 FamFG zu löschen. Die Frist zur Erhebung eines Widerspruchs gegen die beabsichtigte Löschung wird auf 2 Monate festgesetzt."
    },
    {
      "date": "2025-10-01",
      "id": "132387",
      "original_text": "Registerbekanntmachung nach dem Umwandlungsgesetz\nHessen Amtsgericht Offenbach am Main HRB 57509\nSchmetterling in Hand GmbH – Obertshausen",
      "type": "Registerbekanntmachung nach dem Umwandlungsgesetz",
      "state": "Hessen",
      "amtsgericht": "Amtsgericht Offenbach am Main",
      "registernummer": "HRB 57509",
      "registerart": "HRB",
      "company_name": "Schmetterling in Hand GmbH",
      "company_seat": "Obertshausen",
      "details": "01.10.2025 (Bekanntmachungsdatum)\n\nHessen Amtsgericht Offenbach am Main HRB 57509\nRegisterbekanntmachung nach dem Umwandlungsgesetz 01.10.2025 (Eintragungsdatum)\n\nSchmetterling in Hand GmbH\nGesellschaft mit beschränkter Haftung\nObertshausen\n\nDen Gläubigern der an der Ausgliederung beteiligten Rechtsträger ist, wenn sie binnen sechs Monaten nach dem Tag, an dem die Eintragung der Ausgliederung in das Register des Sitzes desjenigen Rechtsträgers, dessen Gläubiger sie sind, nach §§ 125, 19 Absatz 3 UmwG bekannt gemacht worden ist, ihren Anspruch nach Grund und Höhe schriftlich anmelden, Sicherheit zu leisten, soweit sie nicht Befriedigung verlangen können. Dieses Recht steht den Gläubigern jedoch nur zu, wenn sie glaubhaft machen, dass durch die Ausgliederung die Erfüllung ihrer Forderung gefährdet wird."
    },
    {
      "date": "2025-10-01",
      "id": "132388",
      "original_text": "Registerbekanntmachung nach dem Umwandlungsgesetz\nHessen Amtsgericht Darmstadt HRB 62301\nKüche 4 you GmbH – Viernheim",
      "type": "Registerbekanntmachung nach dem Umwandlungsgesetz",
      "state": "Hessen",
      "amtsgericht": "Amtsgericht Darmstadt",
      "registernummer": "HRB 62301",
      "registerart": "HRB",
      "company_name": "Küche 4 you GmbH",
      "company_seat": "Viernheim",
      "details": "01.10.2025 (Bekanntmachungsdatum)\n\nHessen Amtsgericht Darmstadt HRB 62301\nRegisterbekanntmachung nach dem Umwandlungsgesetz 01.10.2025 (Eintragungsdatum)\n\nKüche 4 you GmbH\nGesellschaft mit beschränkter Haftung\nViernheim\n\nDen Gläubigern der an der Abspaltung beteiligten Rechtsträger ist, wenn sie binnen sechs Monaten nach dem Tag, an dem die Eintragung der Abspaltung in das Register des Sitzes derjenigen Rechtsträger deren Gläubiger sie sind, nach §§ 125, 19 Absatz 3 UmwG bekannt gemacht worden ist, ihren Anspruch nach Grund und Höhe schriftlich anmelden, Sicherheit zu leisten, soweit sie nicht Befriedigung verlangen können. Dieses Recht steht den Gläubigern jedoch nur zu, wenn sie glaubhaft machen, dass durch die Abspaltung die Erfüllung ihrer Forderung gefährdet wird."
    },
    {
      "date": "2025-10-01",
      "id": "132389",
      "original_text": "Registerbekanntmachung nach dem Umwandlungsgesetz\nHessen Amtsgericht Wiesbaden HRB 36129\nRietzkow & Kollegen Assekuranz- und Finanzmakler GmbH – Wiesbaden",
      "type": "Registerbekanntmachung nach dem Umwandlungsgesetz",
      "state": "Hessen",
      "amtsgericht": "Amtsgericht Wiesbaden",
      "registernummer": "HRB 36129",
      "registerart": "HRB",
      "company_name": "Rietzkow & Kollegen Assekuranz- und Finanzmakler GmbH",
      "company_seat": "Wiesbaden",
      "details": "01.10.2025 (Bekanntmachungsdatum)\n\nHessen Amtsgericht Wiesbaden HRB 36129\nRegisterbekanntmachung nach dem Umwandlungsgesetz 01.10.2025 (Eintragungsdatum)\n\nRietzkow & Kollegen Assekuranz- und Finanzmakler GmbH\nGesellschaft mit beschränkter Haftung\nWiesbaden\n\nDen Gläubigern der an der Ausgliederung beteiligten Rechtsträger ist, wenn sie binnen sechs Monaten nach dem Tag, an dem die Eintragung der Ausgliederung in das Register des Sitzes derjenigen Rechtsträger deren Gläubiger sie sind, nach §§ 125, 19 Absatz 3 UmwG bekannt gemacht worden ist, ihren Anspruch nach Grund und Höhe schriftlich anmelden, Sicherheit zu leisten, soweit sie nicht Befriedigung verlangen können. Dieses Recht steht den Gläubigern jedoch nur zu, wenn sie glaubhaft machen, dass durch die Ausgliederung die Erfüllung ihrer Forderung gefährdet wird."
    },
    {
      "date": "2025-10-01",
      "id": "132390",
      "original_text": "Registerbekanntmachung nach dem Umwandlungsgesetz\nHessen Amtsgericht Offenbach am Main HRB 6926\nMetz-Neun Synchron Studio und Verlags GmbH – Offenbach am Main",
      "type": "Registerbekanntmachung nach dem Umwandlungsgesetz",
      "state": "Hessen",
      "amtsgericht": "Amtsgericht Offenbach am Main",
      "registernummer": "HRB 6926",
      "registerart": "HRB",
      "company_name": "Metz-Neun Synchron Studio und Verlags GmbH",
      "company_seat": "Offenbach am Main",
      "details": "01.10.2025 (Bekanntmachungsdatum)\n\nHessen Amtsgericht Offenbach am Main HRB 6926\nRegisterbekanntmachung nach dem Umwandlungsgesetz 01.10.2025 (Eintragungsdatum)\n\nMetz-Neun Synchron Studio und Verlags GmbH\nGesellschaft mit beschränkter Haftung\nOffenbach am Main\n\nDen Gläubigern der an der Ausgliederung beteiligten Rechtsträger ist, wenn sie binnen sechs Monaten nach dem Tag, an dem die Eintragung der Ausgliederung in das Register des Sitzes desjenigen Rechtsträgers, dessen Gläubiger sie sind, nach §§ 125, 19 Absatz 3 UmwG bekannt gemacht worden ist, ihren Anspruch nach Grund und Höhe schriftlich anmelden, Sicherheit zu leisten, soweit sie nicht Befriedigung verlangen können. Dieses Recht steht den Gläubigern jedoch nur zu, wenn sie glaubhaft machen, dass durch die Ausgliederung die Erfüllung ihrer Forderung gefährdet wird."
    },
    {
      "date": "2025-10-01",
      "id": "132391",
      "original_text": "Registerbekanntmachung nach dem Umwandlungsgesetz\nHessen Amtsgericht Frankfurt am Main HRB 129037\nA&W Holding GmbH – Frankfurt am Main",
      "type": "Registerbekanntmachung nach dem Umwandlungsgesetz",
      "state": "Hessen",
      "amtsgericht": "Amtsgericht Frankfurt am Main",
      "registernummer": "HRB 129037",
      "registerart": "HRB",
      "company_name": "A&W Holding GmbH",
      "company_seat": "Frankfurt am Main",
      "details": "01.10.2025 (Bekanntmachungsdatum)\n\nHessen Amtsgericht Frankfurt am Main HRB 129037\nRegisterbekanntmachung nach dem Umwandlungsgesetz 05.09.2025 (Eintragungsdatum)\n\nA&W Holding GmbH\nGesellschaft mit beschränkter Haftung\nFrankfurt am Main\n\nDen Gläubigern der an der Verschmelzung beteiligten Rechtsträger ist, wenn sie binnen sechs Monaten nach dem Tag, an dem die Eintragung der Verschmelzung in das Register des Sitzes desjenigen Rechtsträgers, dessen Gläubiger sie sind, nach § 19 Absatz 3 UmwG bekannt gemacht worden ist, ihren Anspruch nach Grund und Höhe schriftlich anmelden, Sicherheit zu leisten, soweit sie nicht Befriedigung verlangen können. Dieses Recht steht den Gläubigern jedoch nur zu, wenn sie glaubhaft machen, dass durch die Verschmelzung die Erfüllung ihrer Forderung gefährdet wird."
    },
    {
      "date": "2025-10-01",
      "id": "132392",
      "original_text": "Einreichung neuer Dokumente\nHessen Amtsgericht Offenbach am Main HRB 54078\nInnovation Center für IT-Strategie und Projekte AG – Heusenstamm",
      "type": "Einreichung neuer Dokumente",
      "state": "Hessen",
      "amtsgericht": "Amtsgericht Offenbach am Main",
      "registernummer": "HRB 54078",
      "registerart": "HRB",
      "company_name": "Innovation Center für IT-Strategie und Projekte AG",
      "company_seat": "Heusenstamm",
      "details": "01.10.2025 (Bekanntmachungsdatum)\n\nHessen Amtsgericht Offenbach am Main HRB 54078\nEinreichung neuer Dokumente\n\nInnovation Center für IT-Strategie und Projekte AG\nAktiengesellschaft\nHeusenstamm\n\nDurch eine Änderung in den Personen der Aufsichtsratsmitglieder ist eine Liste der Mitglieder des Aufsichtsrates zum Handelsregister eingereicht worden."
    }
  ]
}