{
  "date": "2025-10-20",
  "date_of_scrape": "2025-10-27T18:31:07.385Z",
  "tool_version": "0.2.0",
  "number_of_announcements": 151,
  "announcements": [
    {
      "date": "2025-10-20",
      "id": "134490",
      "original_text": "Einreichung neuer Dokumente\nBaden-Württemberg Amtsgericht Ulm HRB 728272\nALB FILS KLINIKUM SERVICE GmbH – Göppingen",
      "type": "Einreichung neuer Dokumente",
      "state": "Baden-Württemberg",
      "amtsgericht": "Amtsgericht Ulm",
      "registernummer": "HRB 728272",
      "registerart": "HRB",
      "company_name": "ALB FILS KLINIKUM SERVICE GmbH",
      "company_seat": "Göppingen",
      "details": "20.10.2025 (Bekanntmachungsdatum)\n\nBaden-Württemberg Amtsgericht Ulm HRB 728272\nEinreichung neuer Dokumente\n\nALB FILS KLINIKUM SERVICE GmbH\nGesellschaft mit beschränkter Haftung\nGöppingen\n\nDie Gesellschaft hat am 16.10.2025 die Liste über die Zusammensetzung des Aufsichtsrats zum Handelsregister eingereicht."
    },
    {
      "date": "2025-10-20",
      "id": "134491",
      "original_text": "Registerbekanntmachung nach dem Umwandlungsgesetz\nBaden-Württemberg Amtsgericht Stuttgart HRB 738112\nHM Fitness GmbH – Stuttgart",
      "type": "Registerbekanntmachung nach dem Umwandlungsgesetz",
      "state": "Baden-Württemberg",
      "amtsgericht": "Amtsgericht Stuttgart",
      "registernummer": "HRB 738112",
      "registerart": "HRB",
      "company_name": "HM Fitness GmbH",
      "company_seat": "Stuttgart",
      "details": "20.10.2025 (Bekanntmachungsdatum)\n\nBaden-Württemberg Amtsgericht Stuttgart HRB 738112\nRegisterbekanntmachung nach dem Umwandlungsgesetz 20.10.2025 (Eintragungsdatum)\n\nHM Fitness GmbH\nGesellschaft mit beschränkter Haftung\nStuttgart\n\nAls nicht eingetragen wird bekanntgemacht:\nDen Gläubigern der an der Verschmelzung beteiligten Rechtsträger ist, wenn sie binnen sechs Monaten nach dem Tag, an dem die Eintragung der Verschmelzung in das Register des Sitzes desjenigen Rechtsträgers, dessen Gläubiger sie sind, nach § 19 Abs. 3 UmwG als bekanntgemacht gilt, ihren Anspruch nach Grund und Höhe schriftlich anmelden, Sicherheit zu leisten, soweit sie nicht Befriedigung verlangen können. Dieses Recht steht den Gläubigern jedoch nur zu, wenn sie glaubhaft machen, dass durch die Verschmelzung die Erfüllung ihrer Forderung gefährdet wird."
    },
    {
      "date": "2025-10-20",
      "id": "134492",
      "original_text": "Löschungsankündigung\nBaden-Württemberg Amtsgericht Mannheim HRB 731294\nMCS Finanz UG (haftungsbeschränkt) – Walzbachtal",
      "type": "Löschungsankündigung",
      "state": "Baden-Württemberg",
      "amtsgericht": "Amtsgericht Mannheim",
      "registernummer": "HRB 731294",
      "registerart": "HRB",
      "company_name": "MCS Finanz UG (haftungsbeschränkt)",
      "company_seat": "Walzbachtal",
      "details": "20.10.2025 (Bekanntmachungsdatum)\n\nBaden-Württemberg Amtsgericht Mannheim HRB 731294\nLöschungsankündigung\n\nMCS Finanz UG (haftungsbeschränkt)\nGesellschaft mit beschränkter Haftung\nWalzbachtal\n\nDas Gericht beabsichtigt, die Gesellschaft wegen Vermögenslosigkeit im Handelsregister von Amts wegen nach § 394 FamFG zu löschen. Die Frist zur Geltendmachung eines Widerspruchs gegen die beabsichtigte Löschung ist auf einen Monat ab Veröffentlichung bestimmt."
    },
    {
      "date": "2025-10-20",
      "id": "134493",
      "original_text": "Registerbekanntmachung nach dem Umwandlungsgesetz\nBaden-Württemberg Amtsgericht Ulm HRB 501561\nCarl Zeiss Industrielle Messtechnik GmbH – Oberkochen",
      "type": "Registerbekanntmachung nach dem Umwandlungsgesetz",
      "state": "Baden-Württemberg",
      "amtsgericht": "Amtsgericht Ulm",
      "registernummer": "HRB 501561",
      "registerart": "HRB",
      "company_name": "Carl Zeiss Industrielle Messtechnik GmbH",
      "company_seat": "Oberkochen",
      "details": "20.10.2025 (Bekanntmachungsdatum)\n\nBaden-Württemberg Amtsgericht Ulm HRB 501561\nRegisterbekanntmachung nach dem Umwandlungsgesetz 20.10.2025 (Eintragungsdatum)\n\nCarl Zeiss Industrielle Messtechnik GmbH\nGesellschaft mit beschränkter Haftung\nOberkochen\n\nAls nicht eingetragen wird bekanntgemacht:\nDen Gläubigern der an der Verschmelzung beteiligten Rechtsträger ist, wenn sie binnen sechs Monaten nach dem Tag, an dem die Eintragung der Verschmelzung in das Register des Sitzes desjenigen Rechtsträgers, dessen Gläubiger sie sind, nach § 19 Abs. 3 UmwG als bekanntgemacht gilt, ihren Anspruch nach Grund und Höhe schriftlich anmelden, Sicherheit zu leisten, soweit sie nicht Befriedigung verlangen können. Dieses Recht steht den Gläubigern jedoch nur zu, wenn sie glaubhaft machen, dass durch die Verschmelzung die Erfüllung ihrer Forderung gefährdet wird."
    },
    {
      "date": "2025-10-20",
      "id": "134494",
      "original_text": "Registerbekanntmachung nach dem Umwandlungsgesetz\nBaden-Württemberg Amtsgericht Ulm HRB 532269\nCarl Zeiss Optical Components GmbH – Wangen",
      "type": "Registerbekanntmachung nach dem Umwandlungsgesetz",
      "state": "Baden-Württemberg",
      "amtsgericht": "Amtsgericht Ulm",
      "registernummer": "HRB 532269",
      "registerart": "HRB",
      "company_name": "Carl Zeiss Optical Components GmbH",
      "company_seat": "Wangen",
      "details": "20.10.2025 (Bekanntmachungsdatum)\n\nBaden-Württemberg Amtsgericht Ulm HRB 532269\nRegisterbekanntmachung nach dem Umwandlungsgesetz 20.10.2025 (Eintragungsdatum)\n\nCarl Zeiss Optical Components GmbH\nGesellschaft mit beschränkter Haftung\nWangen\n\nAls nicht eingetragen wird bekanntgemacht:\nDen Gläubigern der an der Verschmelzung beteiligten Rechtsträger ist, wenn sie binnen sechs Monaten nach dem Tag, an dem die Eintragung der Verschmelzung in das Register des Sitzes desjenigen Rechtsträgers, dessen Gläubiger sie sind, nach § 19 Abs. 3 UmwG als bekanntgemacht gilt, ihren Anspruch nach Grund und Höhe schriftlich anmelden, Sicherheit zu leisten, soweit sie nicht Befriedigung verlangen können. Dieses Recht steht den Gläubigern jedoch nur zu, wenn sie glaubhaft machen, dass durch die Verschmelzung die Erfüllung ihrer Forderung gefährdet wird."
    },
    {
      "date": "2025-10-20",
      "id": "134495",
      "original_text": "Registerbekanntmachung nach dem Umwandlungsgesetz\nBaden-Württemberg Amtsgericht Stuttgart HRB 796888\nAUDERE Verwaltungs- GmbH – Fellbach",
      "type": "Registerbekanntmachung nach dem Umwandlungsgesetz",
      "state": "Baden-Württemberg",
      "amtsgericht": "Amtsgericht Stuttgart",
      "registernummer": "HRB 796888",
      "registerart": "HRB",
      "company_name": "AUDERE Verwaltungs- GmbH",
      "company_seat": "Fellbach",
      "details": "20.10.2025 (Bekanntmachungsdatum)\n\nBaden-Württemberg Amtsgericht Stuttgart HRB 796888\nRegisterbekanntmachung nach dem Umwandlungsgesetz 20.10.2025 (Eintragungsdatum)\n\nAUDERE Verwaltungs- GmbH\nGesellschaft mit beschränkter Haftung\nFellbach\n\nAls nicht eingetragen wird bekanntgemacht:\nDen Gläubigern der an der Verschmelzung beteiligten Rechtsträger ist, wenn sie binnen sechs Monaten nach dem Tag, an dem die Eintragung der Verschmelzung in das Register des Sitzes desjenigen Rechtsträgers, dessen Gläubiger sie sind, nach § 19 Abs. 3 UmwG als bekanntgemacht gilt, ihren Anspruch nach Grund und Höhe schriftlich anmelden, Sicherheit zu leisten, soweit sie nicht Befriedigung verlangen können. Dieses Recht steht den Gläubigern jedoch nur zu, wenn sie glaubhaft machen, dass durch die Verschmelzung die Erfüllung ihrer Forderung gefährdet wird."
    },
    {
      "date": "2025-10-20",
      "id": "134496",
      "original_text": "Registerbekanntmachung nach dem Umwandlungsgesetz\nBaden-Württemberg Amtsgericht Mannheim HRB 734253\nErnst Automobile Verwaltungsgesellschaft mbH Mannheim – Mannheim",
      "type": "Registerbekanntmachung nach dem Umwandlungsgesetz",
      "state": "Baden-Württemberg",
      "amtsgericht": "Amtsgericht Mannheim",
      "registernummer": "HRB 734253",
      "registerart": "HRB",
      "company_name": "Ernst Automobile Verwaltungsgesellschaft mbH Mannheim",
      "company_seat": "Mannheim",
      "details": "20.10.2025 (Bekanntmachungsdatum)\n\nBaden-Württemberg Amtsgericht Mannheim HRB 734253\nRegisterbekanntmachung nach dem Umwandlungsgesetz 20.10.2025 (Eintragungsdatum)\n\nErnst Automobile Verwaltungsgesellschaft mbH Mannheim\nGesellschaft mit beschränkter Haftung\nMannheim\n\nDen Gläubigern der an der Verschmelzung beteiligten Rechtsträger ist, wenn sie binnen sechs Monaten nach dem Tag, an dem die Eintragung der Verschmelzung in das Register des Sitzes desjenigen Rechtsträgers, dessen Gläubiger sie sind, nach § 19 Abs. 3 UmwG als bekanntgemacht gilt, ihren Anspruch nach Grund und Höhe schriftlich anmelden, Sicherheit zu leisten, soweit sie nicht Befriedigung verlangen können. Dieses Recht steht den Gläubigern jedoch nur zu, wenn sie glaubhaft machen, dass durch die Verschmelzung die Erfüllung ihrer Forderung gefährdet wird."
    },
    {
      "date": "2025-10-20",
      "id": "134497",
      "original_text": "Einreichung neuer Dokumente\nBaden-Württemberg Amtsgericht Mannheim HRB 107865\nKVVH - Karlsruher Versorgungs-, Verkehrs- und Hafen GmbH – Karlsruhe",
      "type": "Einreichung neuer Dokumente",
      "state": "Baden-Württemberg",
      "amtsgericht": "Amtsgericht Mannheim",
      "registernummer": "HRB 107865",
      "registerart": "HRB",
      "company_name": "KVVH - Karlsruher Versorgungs-, Verkehrs- und Hafen GmbH",
      "company_seat": "Karlsruhe",
      "details": "20.10.2025 (Bekanntmachungsdatum)\n\nBaden-Württemberg Amtsgericht Mannheim HRB 107865\nEinreichung neuer Dokumente\n\nKVVH - Karlsruher Versorgungs-, Verkehrs- und Hafen GmbH\nGesellschaft mit beschränkter Haftung\nKarlsruhe\n\nDie Gesellschaft hat am 10.10.2025 die Liste über die Zusammensetzung des Aufsichtsrats zum Handelsregister eingereicht."
    },
    {
      "date": "2025-10-20",
      "id": "134498",
      "original_text": "Registerbekanntmachung nach dem Umwandlungsgesetz\nSchleswig-Holstein Amtsgericht Flensburg HRB 16503\nNature Energy Steinfeld GmbH – Handewitt",
      "type": "Registerbekanntmachung nach dem Umwandlungsgesetz",
      "state": "Schleswig-Holstein",
      "amtsgericht": "Amtsgericht Flensburg",
      "registernummer": "HRB 16503",
      "registerart": "HRB",
      "company_name": "Nature Energy Steinfeld GmbH",
      "company_seat": "Handewitt",
      "details": "20.10.2025 (Bekanntmachungsdatum)\n\nSchleswig-Holstein Amtsgericht Flensburg HRB 16503\nRegisterbekanntmachung nach dem Umwandlungsgesetz 20.10.2025 (Eintragungsdatum)\n\nNature Energy Steinfeld GmbH\nGesellschaft mit beschränkter Haftung\nHandewitt\n\nZu Eintragungsnummer 5 vom 20.10.2025 wird als nicht eingetragen veröffentlicht:\nDen Gläubigern der an der Verschmelzung beteiligten Rechtsträger ist, wenn sie binnen sechs Monaten nach dem Tag, an dem die Eintragung der Verschmelzung in das Register des Sitzes desjenigen Rechtsträgers, dessen Gläubiger sie sind, als bekannt gemacht gilt, ihren Anspruch nach Grund und Höhe in Textform anmelden, Sicherheit zu leisten, soweit sie nicht Befriedigung verlangen können. Dieses Recht steht den Gläubigern jedoch nur zu, wenn sie glaubhaft machen, dass durch die Verschmelzung die Erfüllung ihrer Forderung gefährdet wird."
    },
    {
      "date": "2025-10-20",
      "id": "134499",
      "original_text": "Registerbekanntmachung nach dem Umwandlungsgesetz\nBrandenburg Amtsgericht Neuruppin HRB 13694\nENERTRAG SE – Dauerthal, Gemeinde Schenkenberg",
      "type": "Registerbekanntmachung nach dem Umwandlungsgesetz",
      "state": "Brandenburg",
      "amtsgericht": "Amtsgericht Neuruppin",
      "registernummer": "HRB 13694",
      "registerart": "HRB",
      "company_name": "ENERTRAG SE",
      "company_seat": "Dauerthal, Gemeinde Schenkenberg",
      "details": "20.10.2025 (Bekanntmachungsdatum)\n\nBrandenburg Amtsgericht Neuruppin HRB 13694\nRegisterbekanntmachung nach dem Umwandlungsgesetz 16.10.2025 (Eintragungsdatum)\n\nENERTRAG SE\nEuropäische Aktiengesellschaft (SE)\nDauerthal, Gemeinde Schenkenberg\n\nZu Eintragungsnummer 13 vom 16.10.2025 wird als nicht eingetragen veröffentlicht:\nDen Gläubigern der an der Umwandlung beteiligten Rechtsträger ist, wenn sie binnen sechs Monaten nach dem Tag, an dem die Eintragung der Umwandlung in das Register des Sitzes desjenigen Rechtsträgers, dessen Gläubiger sie sind, als bekannt gemacht gilt, ihren Anspruch nach Grund und Höhe schriftlich anmelden, Sicherheit zu leisten, soweit sie nicht Befriedigung verlangen können. Dieses Recht steht den Gläubigern jedoch nur zu, wenn sie glaubhaft machen, dass durch die Umwandlung die Erfüllung ihrer Forderung gefährdet wird"
    },
    {
      "date": "2025-10-20",
      "id": "134500",
      "original_text": "Löschungsankündigung\nBerlin Amtsgericht Berlin (Charlottenburg) HRB 185763\nMobileStop GmbH – Berlin",
      "type": "Löschungsankündigung",
      "state": "Berlin",
      "amtsgericht": "Amtsgericht Berlin (Charlottenburg)",
      "registernummer": "HRB 185763",
      "registerart": "HRB",
      "company_name": "MobileStop GmbH",
      "company_seat": "Berlin",
      "details": "20.10.2025 (Bekanntmachungsdatum)\n\nBerlin Amtsgericht Berlin (Charlottenburg) HRB 185763\nLöschungsankündigung\n\nMobileStop GmbH\nGesellschaft mit beschränkter Haftung\nBerlin\n\nBei der nachstehenden Gesellschaft wird das Amtslöschungsverfahren gemäß § 394 FamFG eingeleitet. Widerspruchsfrist 6 Wochen"
    },
    {
      "date": "2025-10-20",
      "id": "134501",
      "original_text": "Registerbekanntmachung nach dem Umwandlungsgesetz\nSchleswig-Holstein Amtsgericht Flensburg HRB 9670\nShell Germany Biogas GmbH – Handewitt",
      "type": "Registerbekanntmachung nach dem Umwandlungsgesetz",
      "state": "Schleswig-Holstein",
      "amtsgericht": "Amtsgericht Flensburg",
      "registernummer": "HRB 9670",
      "registerart": "HRB",
      "company_name": "Shell Germany Biogas GmbH",
      "company_seat": "Handewitt",
      "details": "20.10.2025 (Bekanntmachungsdatum)\n\nSchleswig-Holstein Amtsgericht Flensburg HRB 9670\nRegisterbekanntmachung nach dem Umwandlungsgesetz 20.10.2025 (Eintragungsdatum)\n\nShell Germany Biogas GmbH\nGesellschaft mit beschränkter Haftung\nHandewitt\n\nZu Eintragungsnummer 11 vom 20.10.2025 wird als nicht eingetragen veröffentlicht: Den Gläubigern der an der Verschmelzung beteiligten Rechtsträger ist, wenn sie binnen sechs Monaten nach dem Tag, an dem die Eintragung der Verschmelzung in das Register des Sitzes desjenigen Rechtsträgers, dessen Gläubiger sie sind, als bekannt gemacht gilt, ihren Anspruch nach Grund und Höhe in Textform anmelden, Sicherheit zu leisten, soweit sie nicht Befriedigung verlangen können. Dieses Recht steht den Gläubigern jedoch nur zu, wenn sie glaubhaft machen, dass durch die Verschmelzung die Erfüllung ihrer Forderung gefährdet wird."
    },
    {
      "date": "2025-10-20",
      "id": "134502",
      "original_text": "Registerbekanntmachung nach dem Umwandlungsgesetz\nBaden-Württemberg Amtsgericht Mannheim HRB 744202\nThe Dudes of Pforzheim GmbH – Bretten",
      "type": "Registerbekanntmachung nach dem Umwandlungsgesetz",
      "state": "Baden-Württemberg",
      "amtsgericht": "Amtsgericht Mannheim",
      "registernummer": "HRB 744202",
      "registerart": "HRB",
      "company_name": "The Dudes of Pforzheim GmbH",
      "company_seat": "Bretten",
      "details": "20.10.2025 (Bekanntmachungsdatum)\n\nBaden-Württemberg Amtsgericht Mannheim HRB 744202\nRegisterbekanntmachung nach dem Umwandlungsgesetz 20.10.2025 (Eintragungsdatum)\n\nThe Dudes of Pforzheim GmbH\nGesellschaft mit beschränkter Haftung\nBretten\n\nDen Gläubigern der an der Verschmelzung beteiligten Rechtsträger ist, wenn sie binnen sechs Monaten nach dem Tag, an dem die Eintragung der Verschmelzung in das Register des Sitzes desjenigen Rechtsträgers, dessen Gläubiger sie sind, nach § 19 Abs. 3 UmwG als bekanntgemacht gilt, ihren Anspruch nach Grund und Höhe schriftlich anmelden, Sicherheit zu leisten, soweit sie nicht Befriedigung verlangen können. Dieses Recht steht den Gläubigern jedoch nur zu, wenn sie glaubhaft machen, dass durch die Verschmelzung die Erfüllung ihrer Forderung gefährdet wird."
    },
    {
      "date": "2025-10-20",
      "id": "134503",
      "original_text": "Löschungsankündigung\nBaden-Württemberg Amtsgericht Stuttgart HRB 727790\nRemy Automotive Germany GmbH – Leonberg",
      "type": "Löschungsankündigung",
      "state": "Baden-Württemberg",
      "amtsgericht": "Amtsgericht Stuttgart",
      "registernummer": "HRB 727790",
      "registerart": "HRB",
      "company_name": "Remy Automotive Germany GmbH",
      "company_seat": "Leonberg",
      "details": "20.10.2025 (Bekanntmachungsdatum)\n\nBaden-Württemberg Amtsgericht Stuttgart HRB 727790\nLöschungsankündigung\n\nRemy Automotive Germany GmbH\nGesellschaft mit beschränkter Haftung\nLeonberg\n\nAls nicht eingetragen wird bekanntgemacht:\nDas Gericht beabsichtigt, die Gesellschaft wegen Vermögenslosigkeit im Handelsregister von Amts wegen nach § 394 FamFG zu löschen. Die Frist zur Geltendmachung eines Widerspruchs gegen die beabsichtigte Löschung ist auf zwei Monate ab Veröffentlichung bestimmt."
    },
    {
      "date": "2025-10-20",
      "id": "134504",
      "original_text": "Sonstige Registerbekanntmachung\nBerlin Amtsgericht Berlin (Charlottenburg) HRB 234780\nMOP-Musikverlag Hans Sikorski GmbH – Berlin",
      "type": "Sonstige Registerbekanntmachung",
      "state": "Berlin",
      "amtsgericht": "Amtsgericht Berlin (Charlottenburg)",
      "registernummer": "HRB 234780",
      "registerart": "HRB",
      "company_name": "MOP-Musikverlag Hans Sikorski GmbH",
      "company_seat": "Berlin",
      "details": "20.10.2025 (Bekanntmachungsdatum)\n\nBerlin Amtsgericht Berlin (Charlottenburg) HRB 234780\nSonstige Registerbekanntmachung\n\nMOP-Musikverlag Hans Sikorski GmbH\nGesellschaft mit beschränkter Haftung\nBerlin\n\nAls nicht eingetragen wird veröffentlicht: Der andere Vertragsteil hat den Gläubigern dieses Rechtsträgers, deren Forderungen begründet worden sind, bevor die Eintragung der Beendigung dieses Vertrages in das Handelsregister nach § 10 des Handelsgesetzbuches als bekannt gemacht gilt, Sicherheit zu leisten, wenn sie sich binnen sechs Monaten nach der Bekanntmachung der Eintragung zu diesem Zweck bei ihm melden. Dieses Recht steht den Gläubigern nicht zu, die im Fall des Insolvenzverfahrens ein Recht auf vorzugsweise Befriedigung aus der Deckungsmasse haben, die nach gesetzlicher Vorschrift zu ihrem Schutz errichtet und staatlich überwacht ist."
    },
    {
      "date": "2025-10-20",
      "id": "134505",
      "original_text": "Löschungsankündigung\nSaarland Amtsgericht Saarbrücken HRB 6418\nStötzer und Co. Gesellschaft mit beschränkter Haftung – Saarbrücken",
      "type": "Löschungsankündigung",
      "state": "Saarland",
      "amtsgericht": "Amtsgericht Saarbrücken",
      "registernummer": "HRB 6418",
      "registerart": "HRB",
      "company_name": "Stötzer und Co. Gesellschaft mit beschränkter Haftung",
      "company_seat": "Saarbrücken",
      "details": "20.10.2025 (Bekanntmachungsdatum)\n\nSaarland Amtsgericht Saarbrücken HRB 6418\nLöschungsankündigung\n\nStötzer und Co. Gesellschaft mit beschränkter Haftung\nGesellschaft mit beschränkter Haftung\nSaarbrücken\n\nEs ist beabsichtigt, die Gesellschaft von Amts wegen gemäß § 394 FamFG wegen Vermögenslosigkeit zu löschen.\nGegen die Löschung von Amts wegen ist das Rechtsmittel des Widerspruchs statthaft. Der Widerspruch ist binnen einer Frist zwei Monaten beginnend mit dem Tag dieser Veröffentlichung durch Einreichen eines Widerspruchsschreibens -schriftlich oder zur Niederschrift der Geschäftsstelle beim Amtsgericht Saarbrücken, -zentrales Handelsregister-, Mainzer Str.178, 66121 Saarbrücken einzulegen.\nDer Widerspruch muss die Bezeichnung der angefochtenen Löschungsankündigung enthalten sowie die Erklärung, dass Widerspruch eingelegt wird. Er ist vom Widerspruchsführer oder seinem Bevollmächtigten zu unterzeichnen.\nDas Widerspruchsschreiben kann auch in der Form eines elektronischen Dokumentes eingereicht werden, das mit einer qualifizierten elektronischen Signatur nach dem Signaturgesetz versehen sein muss (§§ 14 Abs. 2 FamFG, 130a, 298 ZPO)."
    },
    {
      "date": "2025-10-20",
      "id": "134506",
      "original_text": "Einreichung neuer Dokumente\nBerlin Amtsgericht Berlin (Charlottenburg) HRB 83923\nToll Collect GmbH – Berlin",
      "type": "Einreichung neuer Dokumente",
      "state": "Berlin",
      "amtsgericht": "Amtsgericht Berlin (Charlottenburg)",
      "registernummer": "HRB 83923",
      "registerart": "HRB",
      "company_name": "Toll Collect GmbH",
      "company_seat": "Berlin",
      "details": "20.10.2025 (Bekanntmachungsdatum)\n\nBerlin Amtsgericht Berlin (Charlottenburg) HRB 83923\nEinreichung neuer Dokumente\n\nToll Collect GmbH\nGesellschaft mit beschränkter Haftung\nBerlin\n\nAls nicht eingetragen wird veröffentlicht:\nEs wurde eine neue Liste der Aufsichtsratsmitglieder eingereicht (§52 GmbHG)."
    },
    {
      "date": "2025-10-20",
      "id": "134507",
      "original_text": "Löschungsankündigung\nBaden-Württemberg Amtsgericht Mannheim HRB 10443\nHERITUS 29. Objektgesellschaft mbH – Mannheim",
      "type": "Löschungsankündigung",
      "state": "Baden-Württemberg",
      "amtsgericht": "Amtsgericht Mannheim",
      "registernummer": "HRB 10443",
      "registerart": "HRB",
      "company_name": "HERITUS 29. Objektgesellschaft mbH",
      "company_seat": "Mannheim",
      "details": "20.10.2025 (Bekanntmachungsdatum)\n\nBaden-Württemberg Amtsgericht Mannheim HRB 10443\nLöschungsankündigung 20.10.2025 (Eintragungsdatum)\n\nHERITUS 29. Objektgesellschaft mbH\nGesellschaft mit beschränkter Haftung\nMannheim\n\nDas Gericht beabsichtigt, die Gesellschaft wegen Vermögenslosigkeit im Handelsregister von Amts wegen nach § 394 FamFG zu löschen. Die Frist zur Geltendmachung eines Widerspruchs gegen die beabsichtigte Löschung ist auf einen Monat ab Veröffentlichung bestimmt."
    },
    {
      "date": "2025-10-20",
      "id": "134508",
      "original_text": "Registerbekanntmachung nach dem Umwandlungsgesetz\nBrandenburg Amtsgericht Cottbus HRA 4509\nKling GmbH & Co. KG – Schönefeld",
      "type": "Registerbekanntmachung nach dem Umwandlungsgesetz",
      "state": "Brandenburg",
      "amtsgericht": "Amtsgericht Cottbus",
      "registernummer": "HRA 4509",
      "registerart": "HRA",
      "company_name": "Kling GmbH & Co. KG",
      "company_seat": "Schönefeld",
      "details": "20.10.2025 (Bekanntmachungsdatum)\n\nBrandenburg Amtsgericht Cottbus HRA 4509\nRegisterbekanntmachung nach dem Umwandlungsgesetz 17.10.2025 (Eintragungsdatum)\n\nKling GmbH & Co. KG\nKommanditgesellschaft\nSchönefeld\n\nAls nicht eingetragen wird veröffentlicht:\nDen Gläubigern der an der Umwandlung beteiligten Rechtsträger ist, wenn sie binnen sechs Monaten nach dem Tag, an dem die Eintragung der Umwandlung in das Register des Sitzes desjenigen Rechtsträgers, dessen Gläubiger sie sind, als bekannt gemacht gilt, ihren Anspruch nach Grund und Höhe schriftlich anmelden, Sicherheit zu leisten, soweit sie nicht Befriedigung verlangen können. Dieses Recht steht den Gläubigern jedoch nur zu, wenn sie glaubhaft machen, dass durch die Umwandlung die Erfüllung ihrer Forderung gefährdet wird"
    },
    {
      "date": "2025-10-20",
      "id": "134509",
      "original_text": "Registerbekanntmachung nach dem Umwandlungsgesetz\nBaden-Württemberg Amtsgericht Ulm HRA 729746\nJM - Jooß Mechanik e.K. – Oberkochen",
      "type": "Registerbekanntmachung nach dem Umwandlungsgesetz",
      "state": "Baden-Württemberg",
      "amtsgericht": "Amtsgericht Ulm",
      "registernummer": "HRA 729746",
      "registerart": "HRA",
      "company_name": "JM - Jooß Mechanik e.K.",
      "company_seat": "Oberkochen",
      "details": "20.10.2025 (Bekanntmachungsdatum)\n\nBaden-Württemberg Amtsgericht Ulm HRA 729746\nRegisterbekanntmachung nach dem Umwandlungsgesetz 20.10.2025 (Eintragungsdatum)\n\nJM - Jooß Mechanik e.K.\nEinzelkaufmann / Einzelkauffrau\nOberkochen\n\nAls nicht eingetragen wird bekanntgemacht:\nDen Gläubigern der an der Ausgliederung beteiligten Rechtsträger ist, wenn sie binnen sechs Monaten nach dem Tag, an dem die Eintragung der Ausgliederung in das Register des Sitzes desjenigen Rechtsträgers, dessen Gläubiger sie sind, nach § 19 Abs. 3 UmwG als bekanntgemacht gilt, ihren Anspruch nach Grund und Höhe schriftlich anmelden, Sicherheit zu leisten, soweit sie nicht Befriedigung verlangen können. Dieses Recht steht den Gläubigern jedoch nur zu, wenn sie glaubhaft machen, dass durch die Ausgliederung die Erfüllung ihrer Forderung gefährdet wird."
    },
    {
      "date": "2025-10-20",
      "id": "134510",
      "original_text": "Registerbekanntmachung nach dem Umwandlungsgesetz\nSchleswig-Holstein Amtsgericht Lübeck HRB 15566\nBFS Holding GmbH – Bad Schwartau",
      "type": "Registerbekanntmachung nach dem Umwandlungsgesetz",
      "state": "Schleswig-Holstein",
      "amtsgericht": "Amtsgericht Lübeck",
      "registernummer": "HRB 15566",
      "registerart": "HRB",
      "company_name": "BFS Holding GmbH",
      "company_seat": "Bad Schwartau",
      "details": "20.10.2025 (Bekanntmachungsdatum)\n\nSchleswig-Holstein Amtsgericht Lübeck HRB 15566\nRegisterbekanntmachung nach dem Umwandlungsgesetz 17.10.2025 (Eintragungsdatum)\n\nBFS Holding GmbH\nGesellschaft mit beschränkter Haftung\nBad Schwartau\n\nZu Eintragungsnummer 3 vom 17.10.2025 wird als nicht eingetragen veröffentlicht:  Als nicht eingetragen wird veröffentlicht: Den Gläubigern der an der Verschmelzung beteiligten Rechtsträger ist, wenn sie binnen sechs Monaten nach dem Tag, an dem die Eintragung der Verschmelzung in das Register des Sitzes desjenigen Rechtsträgers, dessen Gläubiger sie sind, als bekannt gemacht gilt, ihren Anspruch nach Grund und Höhe schriftlich anmelden, Sicherheit zu leisten, soweit sie nicht Befriedigung verlangen können. Dieses Recht steht den Gläubigern jedoch nur zu, wenn sie glaubhaft machen, dass durch die Verschmelzung die Erfüllung ihrer Forderung gefährdet wird."
    },
    {
      "date": "2025-10-20",
      "id": "134511",
      "original_text": "Registerbekanntmachung nach dem Umwandlungsgesetz\nBaden-Württemberg Amtsgericht Ulm HRB 750093\nJooß Mechanik GmbH – Oberkochen",
      "type": "Registerbekanntmachung nach dem Umwandlungsgesetz",
      "state": "Baden-Württemberg",
      "amtsgericht": "Amtsgericht Ulm",
      "registernummer": "HRB 750093",
      "registerart": "HRB",
      "company_name": "Jooß Mechanik GmbH",
      "company_seat": "Oberkochen",
      "details": "20.10.2025 (Bekanntmachungsdatum)\n\nBaden-Württemberg Amtsgericht Ulm HRB 750093\nRegisterbekanntmachung nach dem Umwandlungsgesetz 20.10.2025 (Eintragungsdatum)\n\nJooß Mechanik GmbH\nGesellschaft mit beschränkter Haftung\nOberkochen\n\nAls nicht eingetragen wird bekanntgemacht:\nDen Gläubigern der an der Ausgliederung beteiligten Rechtsträger ist, wenn sie binnen sechs Monaten nach dem Tag, an dem die Eintragung der Ausgliederung in das Register des Sitzes desjenigen Rechtsträgers, dessen Gläubiger sie sind, nach § 19 Abs. 3 UmwG als bekanntgemacht gilt, ihren Anspruch nach Grund und Höhe schriftlich anmelden, Sicherheit zu leisten, soweit sie nicht Befriedigung verlangen können. Dieses Recht steht den Gläubigern jedoch nur zu, wenn sie glaubhaft machen, dass durch die Ausgliederung die Erfüllung ihrer Forderung gefährdet wird."
    },
    {
      "date": "2025-10-20",
      "id": "134512",
      "original_text": "Einreichung neuer Dokumente\nBrandenburg Amtsgericht Potsdam HRB 4587\nWohnungsbaugesellschaft mbH Großbeeren – Großbeeren",
      "type": "Einreichung neuer Dokumente",
      "state": "Brandenburg",
      "amtsgericht": "Amtsgericht Potsdam",
      "registernummer": "HRB 4587",
      "registerart": "HRB",
      "company_name": "Wohnungsbaugesellschaft mbH Großbeeren",
      "company_seat": "Großbeeren",
      "details": "20.10.2025 (Bekanntmachungsdatum)\n\nBrandenburg Amtsgericht Potsdam HRB 4587\nEinreichung neuer Dokumente\n\nWohnungsbaugesellschaft mbH Großbeeren\nGesellschaft mit beschränkter Haftung\nGroßbeeren\n\nAls nicht eingetragen wird bekanntgemacht : Eine Liste der Mitglieder des Aufsichtsrates wurde zum Handelsregister eingereicht."
    },
    {
      "date": "2025-10-20",
      "id": "134513",
      "original_text": "Registerbekanntmachung nach dem Umwandlungsgesetz\nBerlin Amtsgericht Berlin (Charlottenburg) HRB 195044\nP300-Investment GmbH – Berlin",
      "type": "Registerbekanntmachung nach dem Umwandlungsgesetz",
      "state": "Berlin",
      "amtsgericht": "Amtsgericht Berlin (Charlottenburg)",
      "registernummer": "HRB 195044",
      "registerart": "HRB",
      "company_name": "P300-Investment GmbH",
      "company_seat": "Berlin",
      "details": "20.10.2025 (Bekanntmachungsdatum)\n\nBerlin Amtsgericht Berlin (Charlottenburg) HRB 195044\nRegisterbekanntmachung nach dem Umwandlungsgesetz 18.10.2025 (Eintragungsdatum)\n\nP300-Investment GmbH\nGesellschaft mit beschränkter Haftung\nBerlin\n\nZu Eintragungsnummer 5 vom 18.10.2025 wird als nicht eingetragen veröffentlicht:Den Gläubigern der an der Verschmelzung beteiligten Rechtsträger ist, wenn sie binnen sechs Monaten nach dem Tag, an dem die Eintragung der Verschmelzung in das Register des Sitzes desjenigen Rechtsträgers, dessen Gläubiger sie sind, als bekannt gemacht gilt, ihren Anspruch nach Grund und Höhe schriftlich anmelden, Sicherheit zu leisten, soweit sie nicht Befriedigung verlangen können. Dieses Recht steht den Gläubigern jedoch nur zu, wenn sie glaubhaft machen, dass durch die Verschmelzung die Erfüllung ihrer Forderung gefährdet wird. Das Recht, Sicherheitsleistung zu verlangen, steht Gläubigern nicht zu, die im Falle der Insolvenz ein Recht auf vorzugsweise Befriedigung aus einer Deckungsmasse haben, die nach gesetzlicher Vorschrift zu ihrem Schutz errichtet und staatlich überwacht ist."
    },
    {
      "date": "2025-10-20",
      "id": "134514",
      "original_text": "Löschungsankündigung\nBaden-Württemberg Amtsgericht Stuttgart HRB 245426\nHPF Befestigungssysteme GmbH – Herrenberg",
      "type": "Löschungsankündigung",
      "state": "Baden-Württemberg",
      "amtsgericht": "Amtsgericht Stuttgart",
      "registernummer": "HRB 245426",
      "registerart": "HRB",
      "company_name": "HPF Befestigungssysteme GmbH",
      "company_seat": "Herrenberg",
      "details": "20.10.2025 (Bekanntmachungsdatum)\n\nBaden-Württemberg Amtsgericht Stuttgart HRB 245426\nLöschungsankündigung 20.10.2025 (Eintragungsdatum)\n\nHPF Befestigungssysteme GmbH\nGesellschaft mit beschränkter Haftung\nHerrenberg\n\nAls nicht eingetragen wird bekanntgemacht:\nDas Gericht beabsichtigt, die Gesellschaft wegen Vermögenslosigkeit im Handelsregister von Amts wegen nach § 394 FamFG zu löschen. Die Frist zur Geltendmachung eines Widerspruchs gegen die beabsichtigte Löschung ist auf zwei Monate ab Veröffentlichung bestimmt."
    },
    {
      "date": "2025-10-20",
      "id": "134515",
      "original_text": "Einreichung neuer Dokumente\nSchleswig-Holstein Amtsgericht Lübeck HRB 5885\nTraveNetz GmbH – Lübeck",
      "type": "Einreichung neuer Dokumente",
      "state": "Schleswig-Holstein",
      "amtsgericht": "Amtsgericht Lübeck",
      "registernummer": "HRB 5885",
      "registerart": "HRB",
      "company_name": "TraveNetz GmbH",
      "company_seat": "Lübeck",
      "details": "20.10.2025 (Bekanntmachungsdatum)\n\nSchleswig-Holstein Amtsgericht Lübeck HRB 5885\nEinreichung neuer Dokumente\n\nTraveNetz GmbH\nGesellschaft mit beschränkter Haftung\nLübeck\n\nAls nicht eingetragen wird veröffentlicht: Die Gesellschaft hat eine aktuelle Liste der Aufsichtsratsmitglieder zum Handelsregister eingereicht."
    },
    {
      "date": "2025-10-20",
      "id": "134516",
      "original_text": "Registerbekanntmachung nach dem Umwandlungsgesetz\nSaarland Amtsgericht Saarbrücken HRA 13224\nRolf Behnke Vermögensverwaltung GmbH & Co. KG – Kirkel",
      "type": "Registerbekanntmachung nach dem Umwandlungsgesetz",
      "state": "Saarland",
      "amtsgericht": "Amtsgericht Saarbrücken",
      "registernummer": "HRA 13224",
      "registerart": "HRA",
      "company_name": "Rolf Behnke Vermögensverwaltung GmbH & Co. KG",
      "company_seat": "Kirkel",
      "details": "20.10.2025 (Bekanntmachungsdatum)\n\nSaarland Amtsgericht Saarbrücken HRA 13224\nRegisterbekanntmachung nach dem Umwandlungsgesetz 20.10.2025 (Eintragungsdatum)\n\nRolf Behnke Vermögensverwaltung GmbH & Co. KG\nKommanditgesellschaft\nKirkel\n\nAls nicht eingetragen wird bekannt gemacht: Den Gläubigern der an der Ausgliederung beteiligten Gesellschaften ist, wenn sie binnen sechs Monaten nach dem Tag, an dem die Eintragung der Ausgliederung in das Register des Sitzes desjenigen Rechtsträgers, dessen Gläubiger sie sind, nach § 19 Absatz 3 UmwG bekannt gemacht worden ist, ihren Anspruch nach Grund und Höhe schriftlich anmelden, Sicherheit zu leisten, soweit sie nicht Befriedigung verlangen können. Dieses Recht steht den Gläubigern jedoch nur zu, wenn sie glaubhaft machen, dass durch die Ausgliederung die Erfüllung ihrer Forderung gefährdet wird."
    },
    {
      "date": "2025-10-20",
      "id": "134517",
      "original_text": "Löschungsankündigung\nBerlin Amtsgericht Berlin (Charlottenburg) HRB 148373\nATB Constructions UG (haftungsbeschränkt) – Berlin",
      "type": "Löschungsankündigung",
      "state": "Berlin",
      "amtsgericht": "Amtsgericht Berlin (Charlottenburg)",
      "registernummer": "HRB 148373",
      "registerart": "HRB",
      "company_name": "ATB Constructions UG (haftungsbeschränkt)",
      "company_seat": "Berlin",
      "details": "20.10.2025 (Bekanntmachungsdatum)\n\nBerlin Amtsgericht Berlin (Charlottenburg) HRB 148373\nLöschungsankündigung\n\nATB Constructions UG (haftungsbeschränkt)\nGesellschaft mit beschränkter Haftung\nBerlin\n\nBei der nachstehenden Gesellschaft wird das Amtslöschungsverfahren gemäß § 394 FamFG eingeleitet. Widerspruchsfrist 6 Wochen"
    },
    {
      "date": "2025-10-20",
      "id": "134518",
      "original_text": "Registerbekanntmachung nach dem Umwandlungsgesetz\nBerlin Amtsgericht Berlin (Charlottenburg) HRA 64511\nOptiker K. Wittig, e.Kfr. – Berlin",
      "type": "Registerbekanntmachung nach dem Umwandlungsgesetz",
      "state": "Berlin",
      "amtsgericht": "Amtsgericht Berlin (Charlottenburg)",
      "registernummer": "HRA 64511",
      "registerart": "HRA",
      "company_name": "Optiker K. Wittig, e.Kfr.",
      "company_seat": "Berlin",
      "details": "20.10.2025 (Bekanntmachungsdatum)\n\nBerlin Amtsgericht Berlin (Charlottenburg) HRA 64511\nRegisterbekanntmachung nach dem Umwandlungsgesetz 17.10.2025 (Eintragungsdatum)\n\nOptiker K. Wittig, e.Kfr.\nEinzelkaufmann / Einzelkauffrau\nBerlin\n\nZu Eintragungsnummer 2 vom 17.10.2025 wird als nicht eingetragen veröffentlicht:Den Gläubigern der an der Verschmelzung beteiligten Rechtsträger ist, wenn sie binnen sechs Monaten nach dem Tag, an dem die Eintragung der Verschmelzung in das Register des Sitzes desjenigen Rechtsträgers, dessen Gläubiger sie sind, als bekannt gemacht gilt, ihren Anspruch nach Grund und Höhe schriftlich anmelden, Sicherheit zu leisten, soweit sie nicht Befriedigung verlangen können. Dieses Recht steht den Gläubigern jedoch nur zu, wenn sie glaubhaft machen, dass durch die Verschmelzung die Erfüllung ihrer Forderung gefährdet wird. Das Recht, Sicherheitsleistung zu verlangen, steht Gläubigern nicht zu, die im Falle der Insolvenz ein Recht auf vorzugsweise Befriedigung aus einer Deckungsmasse haben, die nach gesetzlicher Vorschrift zu ihrem Schutz errichtet und staatlich überwacht ist."
    },
    {
      "date": "2025-10-20",
      "id": "134519",
      "original_text": "Registerbekanntmachung nach dem Umwandlungsgesetz\nBerlin Amtsgericht Berlin (Charlottenburg) HRB 85193\nOptiker Wittig GmbH – Berlin",
      "type": "Registerbekanntmachung nach dem Umwandlungsgesetz",
      "state": "Berlin",
      "amtsgericht": "Amtsgericht Berlin (Charlottenburg)",
      "registernummer": "HRB 85193",
      "registerart": "HRB",
      "company_name": "Optiker Wittig GmbH",
      "company_seat": "Berlin",
      "details": "20.10.2025 (Bekanntmachungsdatum)\n\nBerlin Amtsgericht Berlin (Charlottenburg) HRB 85193\nRegisterbekanntmachung nach dem Umwandlungsgesetz 17.10.2025 (Eintragungsdatum)\n\nOptiker Wittig GmbH\nGesellschaft mit beschränkter Haftung\nBerlin\n\nZu Eintragungsnummer 3 vom 17.10.2025 wird als nicht eingetragen veröffentlicht: Den Gläubigern der an der Verschmelzung beteiligten Rechtsträger ist, wenn sie binnen sechs Monaten nach dem Tag, an dem die Eintragung der Verschmelzung in das Register des Sitzes desjenigen Rechtsträgers, dessen Gläubiger sie sind, als bekannt gemacht gilt, ihren Anspruch nach Grund und Höhe schriftlich anmelden, Sicherheit zu leisten, soweit sie nicht Befriedigung verlangen können. Dieses Recht steht den Gläubigern jedoch nur zu, wenn sie glaubhaft machen, dass durch die Verschmelzung die Erfüllung ihrer Forderung gefährdet wird. Das Recht, Sicherheitsleistung zu verlangen, steht Gläubigern nicht zu, die im Falle der Insolvenz ein Recht auf vorzugsweise Befriedigung aus einer Deckungsmasse haben, die nach gesetzlicher Vorschrift zu ihrem Schutz errichtet und staatlich überwacht ist."
    },
    {
      "date": "2025-10-20",
      "id": "134520",
      "original_text": "Löschungsankündigung\nBerlin Amtsgericht Berlin (Charlottenburg) HRA 57651\nAMP Baumanagement GmbH & Co. KG – Berlin",
      "type": "Löschungsankündigung",
      "state": "Berlin",
      "amtsgericht": "Amtsgericht Berlin (Charlottenburg)",
      "registernummer": "HRA 57651",
      "registerart": "HRA",
      "company_name": "AMP Baumanagement GmbH & Co. KG",
      "company_seat": "Berlin",
      "details": "20.10.2025 (Bekanntmachungsdatum)\n\nBerlin Amtsgericht Berlin (Charlottenburg) HRA 57651\nLöschungsankündigung\n\nAMP Baumanagement GmbH & Co. KG\nKommanditgesellschaft\nBerlin\n\nBei dem nachstehenden Unternehmen / der nachstehenden Gesellschaft wird das Amtslöschungsverfahren gemäß § 31 Abs. 2 HGB eingeleitet. Widerspruchsfrist 2 Monate"
    },
    {
      "date": "2025-10-20",
      "id": "134521",
      "original_text": "Registerbekanntmachung nach dem Umwandlungsgesetz\nSaarland Amtsgericht Saarbrücken HRA 13709\nRolf Behnke Vermietung e.K. Inhaber Rolf Behnke – Kirkel",
      "type": "Registerbekanntmachung nach dem Umwandlungsgesetz",
      "state": "Saarland",
      "amtsgericht": "Amtsgericht Saarbrücken",
      "registernummer": "HRA 13709",
      "registerart": "HRA",
      "company_name": "Rolf Behnke Vermietung e.K. Inhaber Rolf Behnke",
      "company_seat": "Kirkel",
      "details": "20.10.2025 (Bekanntmachungsdatum)\n\nSaarland Amtsgericht Saarbrücken HRA 13709\nRegisterbekanntmachung nach dem Umwandlungsgesetz 20.10.2025 (Eintragungsdatum)\n\nRolf Behnke Vermietung e.K. Inhaber Rolf Behnke\nEinzelkaufmann / Einzelkauffrau\nKirkel\n\nAls nicht eingetragen wird bekannt gemacht: Den Gläubigern der an der Ausgliederung beteiligten Gesellschaften ist, wenn sie binnen sechs Monaten nach dem Tag, an dem die Eintragung der Ausgliederung in das Register des Sitzes desjenigen Rechtsträgers, dessen Gläubiger sie sind, nach § 19 Absatz 3 UmwG bekannt gemacht worden ist, ihren Anspruch nach Grund und Höhe schriftlich anmelden, Sicherheit zu leisten, soweit sie nicht Befriedigung verlangen können. Dieses Recht steht den Gläubigern jedoch nur zu, wenn sie glaubhaft machen, dass durch die Ausgliederung die Erfüllung ihrer Forderung gefährdet wird."
    },
    {
      "date": "2025-10-20",
      "id": "134522",
      "original_text": "Registerbekanntmachung nach dem Umwandlungsgesetz\nHamburg Amtsgericht Hamburg HRA 131874\nJoachim Luserke e.K. – Hamburg",
      "type": "Registerbekanntmachung nach dem Umwandlungsgesetz",
      "state": "Hamburg",
      "amtsgericht": "Amtsgericht Hamburg",
      "registernummer": "HRA 131874",
      "registerart": "HRA",
      "company_name": "Joachim Luserke e.K.",
      "company_seat": "Hamburg",
      "details": "20.10.2025 (Bekanntmachungsdatum)\n\nHamburg Amtsgericht Hamburg HRA 131874\nRegisterbekanntmachung nach dem Umwandlungsgesetz 20.10.2025 (Eintragungsdatum)\n\nJoachim Luserke e.K.\nEinzelkaufmann\nHamburg\n\nAls nicht eingetragen wird bekannt gemacht:\nDen Gläubigern der an der Ausgliederung beteiligten Gesellschaften ist, wenn sie binnen sechs Monaten nach dem Tag, an dem die Eintragung der Ausgliederung in das Register des Sitzes desjenigen Rechtsträgers, dessen Gläubiger sie sind, nach § 19 Absatz 3 UmwG als bekannt gemacht gilt, ihren Anspruch nach Grund und Höhe schriftlich anmelden, Sicherheit zu leisten, soweit sie nicht Befriedigung verlangen können. Dieses Recht steht den Gläubigern jedoch nur zu, wenn sie glaubhaft machen, dass durch die Ausgliederung die Erfüllung ihrer Forderung gefährdet wird."
    },
    {
      "date": "2025-10-20",
      "id": "134523",
      "original_text": "Registerbekanntmachung nach dem Umwandlungsgesetz\nBaden-Württemberg Amtsgericht Mannheim VR 520801\nArbeiterwohlfahrt Kreisverband Rastatt e.V. – Rastatt",
      "type": "Registerbekanntmachung nach dem Umwandlungsgesetz",
      "state": "Baden-Württemberg",
      "amtsgericht": "Amtsgericht Mannheim",
      "registernummer": "VR 520801",
      "registerart": "VR",
      "company_name": "Arbeiterwohlfahrt Kreisverband Rastatt e.V.",
      "company_seat": "Rastatt",
      "details": "20.10.2025 (Bekanntmachungsdatum)\n\nBaden-Württemberg Amtsgericht Mannheim VR 520801\nRegisterbekanntmachung nach dem Umwandlungsgesetz 20.10.2025 (Eintragungsdatum)\n\nArbeiterwohlfahrt Kreisverband Rastatt e.V.\neingetragener Verein\nRastatt\n\nAls nicht eingetragen wird bekanntgemacht:\nDen Gläubigern der an der Verschmelzung beteiligten Rechtsträger ist, wenn sie binnen sechs Monaten nach dem Tag, an dem die Eintragung der Verschmelzung in das Register des Sitzes desjenigen Rechtsträgers, dessen Gläubiger sie sind, nach § 19 Abs. 3 UmwG als bekanntgemacht gilt, ihren Anspruch nach Grund und Höhe schriftlich anmelden, Sicherheit zu leisten, soweit sie nicht Befriedigung verlangen können. Dieses Recht steht den Gläubigern jedoch nur zu, wenn sie glaubhaft machen, dass durch die Verschmelzung die Erfüllung ihrer Forderung gefährdet wird."
    },
    {
      "date": "2025-10-20",
      "id": "134524",
      "original_text": "Einreichung neuer Dokumente\nBaden-Württemberg Amtsgericht Stuttgart HRB 720318\nAnna Haag Stiftung gGmbH – Stuttgart",
      "type": "Einreichung neuer Dokumente",
      "state": "Baden-Württemberg",
      "amtsgericht": "Amtsgericht Stuttgart",
      "registernummer": "HRB 720318",
      "registerart": "HRB",
      "company_name": "Anna Haag Stiftung gGmbH",
      "company_seat": "Stuttgart",
      "details": "20.10.2025 (Bekanntmachungsdatum)\n\nBaden-Württemberg Amtsgericht Stuttgart HRB 720318\nEinreichung neuer Dokumente 20.10.2025 (Eintragungsdatum)\n\nAnna Haag Stiftung gGmbH\nGesellschaft mit beschränkter Haftung\nStuttgart\n\nDie Gesellschaft hat am 17.10.2025 die Liste über die Zusammensetzung des Aufsichtsrats zum Handelsregister eingereicht."
    },
    {
      "date": "2025-10-20",
      "id": "134525",
      "original_text": "Einreichung neuer Dokumente\nBaden-Württemberg Amtsgericht Stuttgart HRB 720318\nAnna Haag Stiftung gGmbH – Stuttgart",
      "type": "Einreichung neuer Dokumente",
      "state": "Baden-Württemberg",
      "amtsgericht": "Amtsgericht Stuttgart",
      "registernummer": "HRB 720318",
      "registerart": "HRB",
      "company_name": "Anna Haag Stiftung gGmbH",
      "company_seat": "Stuttgart",
      "details": "20.10.2025 (Bekanntmachungsdatum)\n\nBaden-Württemberg Amtsgericht Stuttgart HRB 720318\nEinreichung neuer Dokumente 20.10.2025 (Eintragungsdatum)\n\nAnna Haag Stiftung gGmbH\nGesellschaft mit beschränkter Haftung\nStuttgart\n\nDie Gesellschaft hat am 17.10.2025 die Liste über die Zusammensetzung des Aufsichtsrats zum Handelsregister eingereicht."
    },
    {
      "date": "2025-10-20",
      "id": "134526",
      "original_text": "Einreichung neuer Dokumente\nSchleswig-Holstein Amtsgericht Lübeck HRB 4900\nStadtwerke Lübeck Gruppe GmbH – Lübeck",
      "type": "Einreichung neuer Dokumente",
      "state": "Schleswig-Holstein",
      "amtsgericht": "Amtsgericht Lübeck",
      "registernummer": "HRB 4900",
      "registerart": "HRB",
      "company_name": "Stadtwerke Lübeck Gruppe GmbH",
      "company_seat": "Lübeck",
      "details": "20.10.2025 (Bekanntmachungsdatum)\n\nSchleswig-Holstein Amtsgericht Lübeck HRB 4900\nEinreichung neuer Dokumente\n\nStadtwerke Lübeck Gruppe GmbH\nGesellschaft mit beschränkter Haftung\nLübeck\n\nAls nicht eingetragen wird veröffentlicht: Es wurde eine aktuelle Liste der Aufsichtsratsmitglieder zum Handelsregister eingereicht."
    },
    {
      "date": "2025-10-20",
      "id": "134527",
      "original_text": "Registerbekanntmachung nach dem Umwandlungsgesetz\nBaden-Württemberg Amtsgericht Mannheim VR 200489\nArbeiterwohlfahrt Kreisverband Baden-Baden e.V. – Baden-Baden",
      "type": "Registerbekanntmachung nach dem Umwandlungsgesetz",
      "state": "Baden-Württemberg",
      "amtsgericht": "Amtsgericht Mannheim",
      "registernummer": "VR 200489",
      "registerart": "VR",
      "company_name": "Arbeiterwohlfahrt Kreisverband Baden-Baden e.V.",
      "company_seat": "Baden-Baden",
      "details": "20.10.2025 (Bekanntmachungsdatum)\n\nBaden-Württemberg Amtsgericht Mannheim VR 200489\nRegisterbekanntmachung nach dem Umwandlungsgesetz 20.10.2025 (Eintragungsdatum)\n\nArbeiterwohlfahrt Kreisverband Baden-Baden e.V.\neingetragener Verein\nBaden-Baden\n\nAls nicht eingetragen wird bekanntgemacht:\nDen Gläubigern der an der Verschmelzung beteiligten Rechtsträger ist, wenn sie binnen sechs Monaten nach dem Tag, an dem die Eintragung der Verschmelzung in das Register des Sitzes desjenigen Rechtsträgers, dessen Gläubiger sie sind, nach § 19 Abs. 3 UmwG als bekanntgemacht gilt, ihren Anspruch nach Grund und Höhe schriftlich anmelden, Sicherheit zu leisten, soweit sie nicht Befriedigung verlangen können. Dieses Recht steht den Gläubigern jedoch nur zu, wenn sie glaubhaft machen, dass durch die Verschmelzung die Erfüllung ihrer Forderung gefährdet wird."
    },
    {
      "date": "2025-10-20",
      "id": "134528",
      "original_text": "Registerbekanntmachung nach dem Umwandlungsgesetz\nMecklenburg-Vorpommern Amtsgericht Schwerin HRB 14930\nDeckhold Digital GmbH – Lübz",
      "type": "Registerbekanntmachung nach dem Umwandlungsgesetz",
      "state": "Mecklenburg-Vorpommern",
      "amtsgericht": "Amtsgericht Schwerin",
      "registernummer": "HRB 14930",
      "registerart": "HRB",
      "company_name": "Deckhold Digital GmbH",
      "company_seat": "Lübz",
      "details": "20.10.2025 (Bekanntmachungsdatum)\n\nMecklenburg-Vorpommern Amtsgericht Schwerin HRB 14930\nRegisterbekanntmachung nach dem Umwandlungsgesetz 20.10.2025 (Eintragungsdatum)\n\nDeckhold Digital GmbH\nGesellschaft mit beschränkter Haftung\nLübz\n\nDen Gläubigern der an der Verschmelzung beteiligten Gesellschaften ist, wenn sie binnen sechs Monaten nach dem Tag, an dem die Eintragung der Verschmelzungen in das Register des Sitzes desjenigen Rechtsträgers, dessen Gläubiger sie sind, nach § 19 Absatz 3 UmwG als bekanntgemacht gilt, ihren Anspruch nach Grund und Höhe schriftlich anmelden, Sicherheit zu leisten, soweit sie nicht Befriedigung verlangen können. Dieses Recht steht den Gläubigern jedoch nur zu, wenn sie glaubhaft machen, dass durch die Verschmelzung die Erfüllung ihrer Forderung gefährdet wird."
    },
    {
      "date": "2025-10-20",
      "id": "134529",
      "original_text": "Registerbekanntmachung nach dem Umwandlungsgesetz\nMecklenburg-Vorpommern Amtsgericht Schwerin HRB 13486\nDeckhold Beteiligung Eins GmbH – Lübz",
      "type": "Registerbekanntmachung nach dem Umwandlungsgesetz",
      "state": "Mecklenburg-Vorpommern",
      "amtsgericht": "Amtsgericht Schwerin",
      "registernummer": "HRB 13486",
      "registerart": "HRB",
      "company_name": "Deckhold Beteiligung Eins GmbH",
      "company_seat": "Lübz",
      "details": "20.10.2025 (Bekanntmachungsdatum)\n\nMecklenburg-Vorpommern Amtsgericht Schwerin HRB 13486\nRegisterbekanntmachung nach dem Umwandlungsgesetz 20.10.2025 (Eintragungsdatum)\n\nDeckhold Beteiligung Eins GmbH\nGesellschaft mit beschränkter Haftung\nLübz\n\nDen Gläubigern der an der Verschmelzung beteiligten Gesellschaften ist, wenn sie binnen sechs Monaten nach dem Tag, an dem die Eintragung der Verschmelzungen in das Register des Sitzes desjenigen Rechtsträgers, dessen Gläubiger sie sind, nach § 19 Absatz 3 UmwG als bekanntgemacht gilt, ihren Anspruch nach Grund und Höhe schriftlich anmelden, Sicherheit zu leisten, soweit sie nicht Befriedigung verlangen können. Dieses Recht steht den Gläubigern jedoch nur zu, wenn sie glaubhaft machen, dass durch die Verschmelzung die Erfüllung ihrer Forderung gefährdet wird."
    },
    {
      "date": "2025-10-20",
      "id": "134530",
      "original_text": "Registerbekanntmachung nach dem Umwandlungsgesetz\nBerlin Amtsgericht Berlin (Charlottenburg) HRB 229352\nA-T Ventures UG (haftungsbeschränkt) – Berlin",
      "type": "Registerbekanntmachung nach dem Umwandlungsgesetz",
      "state": "Berlin",
      "amtsgericht": "Amtsgericht Berlin (Charlottenburg)",
      "registernummer": "HRB 229352",
      "registerart": "HRB",
      "company_name": "A-T Ventures UG (haftungsbeschränkt)",
      "company_seat": "Berlin",
      "details": "20.10.2025 (Bekanntmachungsdatum)\n\nBerlin Amtsgericht Berlin (Charlottenburg) HRB 229352\nRegisterbekanntmachung nach dem Umwandlungsgesetz 17.10.2025 (Eintragungsdatum)\n\nA-T Ventures UG (haftungsbeschränkt)\nGesellschaft mit beschränkter Haftung\nBerlin\n\nZu Eintragungsnummer 2 vom 17.10.2025 wird als nicht eingetragen veröffentlicht: Den Gläubigern der an der Verschmelzung beteiligten Rechtsträger ist, wenn sie binnen sechs Monaten nach dem Tag, an dem die Eintragung der Verschmelzung in das Register des Sitzes desjenigen Rechtsträgers, dessen Gläubiger sie sind, als bekannt gemacht gilt, ihren Anspruch nach Grund und Höhe schriftlich anmelden, Sicherheit zu leisten, soweit sie nicht Befriedigung verlangen können. Dieses Recht steht den Gläubigern jedoch nur zu, wenn sie glaubhaft machen, dass durch die Verschmelzung die Erfüllung ihrer Forderung gefährdet wird. Das Recht, Sicherheitsleistung zu verlangen, steht Gläubigern nicht zu, die im Falle der Insolvenz ein Recht auf vorzugsweise Befriedigung aus einer Deckungsmasse haben, die nach gesetzlicher Vorschrift zu ihrem Schutz errichtet und staatlich überwacht ist."
    },
    {
      "date": "2025-10-20",
      "id": "134531",
      "original_text": "Registerbekanntmachung nach dem Umwandlungsgesetz\nHamburg Amtsgericht Hamburg HRB 99214\nHWQ Hanse WohnQuartier GmbH – Hamburg",
      "type": "Registerbekanntmachung nach dem Umwandlungsgesetz",
      "state": "Hamburg",
      "amtsgericht": "Amtsgericht Hamburg",
      "registernummer": "HRB 99214",
      "registerart": "HRB",
      "company_name": "HWQ Hanse WohnQuartier GmbH",
      "company_seat": "Hamburg",
      "details": "20.10.2025 (Bekanntmachungsdatum)\n\nHamburg Amtsgericht Hamburg HRB 99214\nRegisterbekanntmachung nach dem Umwandlungsgesetz 20.10.2025 (Eintragungsdatum)\n\nHWQ Hanse WohnQuartier GmbH\nGesellschaft mit beschränkter Haftung\nHamburg\n\nAls nicht eingetragen wird bekannt gemacht:\nDen Gläubigern der an der Ausgliederung beteiligten Gesellschaften ist, wenn sie binnen sechs Monaten nach dem Tag, an dem die Eintragung der Ausgliederung in das Register des Sitzes desjenigen Rechtsträgers, dessen Gläubiger sie sind, nach § 19 Absatz 3 UmwG als bekannt gemacht gilt, ihren Anspruch nach Grund und Höhe schriftlich anmelden, Sicherheit zu leisten, soweit sie nicht Befriedigung verlangen können. Dieses Recht steht den Gläubigern jedoch nur zu, wenn sie glaubhaft machen, dass durch die Ausgliederung die Erfüllung ihrer Forderung gefährdet wird."
    },
    {
      "date": "2025-10-20",
      "id": "134532",
      "original_text": "Einreichung neuer Dokumente\nBrandenburg Amtsgericht Potsdam HRB 1575\nLAND BRANDENBURG LOTTO Gesellschaft mit beschränkter Haftung – Potsdam",
      "type": "Einreichung neuer Dokumente",
      "state": "Brandenburg",
      "amtsgericht": "Amtsgericht Potsdam",
      "registernummer": "HRB 1575",
      "registerart": "HRB",
      "company_name": "LAND BRANDENBURG LOTTO Gesellschaft mit beschränkter Haftung",
      "company_seat": "Potsdam",
      "details": "20.10.2025 (Bekanntmachungsdatum)\n\nBrandenburg Amtsgericht Potsdam HRB 1575\nEinreichung neuer Dokumente\n\nLAND BRANDENBURG LOTTO Gesellschaft mit beschränkter Haftung\nGesellschaft mit beschränkter Haftung\nPotsdam\n\nAls nicht eingetragen wird veröffentlicht:\nEine Liste der Mitglieder des Aufsichtsrates wurde zum Handelsregister eingereicht."
    },
    {
      "date": "2025-10-20",
      "id": "134533",
      "original_text": "Löschungsankündigung\nBerlin Amtsgericht Berlin (Charlottenburg) HRB 160387\nLMPB Immobilientreuhand GmbH – Berlin",
      "type": "Löschungsankündigung",
      "state": "Berlin",
      "amtsgericht": "Amtsgericht Berlin (Charlottenburg)",
      "registernummer": "HRB 160387",
      "registerart": "HRB",
      "company_name": "LMPB Immobilientreuhand GmbH",
      "company_seat": "Berlin",
      "details": "20.10.2025 (Bekanntmachungsdatum)\n\nBerlin Amtsgericht Berlin (Charlottenburg) HRB 160387\nLöschungsankündigung\n\nLMPB Immobilientreuhand GmbH\nGesellschaft mit beschränkter Haftung\nBerlin\n\nBei der nachstehenden Gesellschaft wird das Amtslöschungsverfahren gemäß § 394 FamFG eingeleitet. Widerspruchsfrist 6 Wochen"
    },
    {
      "date": "2025-10-20",
      "id": "134534",
      "original_text": "Löschungsankündigung\nBerlin Amtsgericht Berlin (Charlottenburg) HRB 139692\nKWO - Kanzlei für wirtschaftliche Optimierung - UG (haftungsbeschränkt) – Berlin",
      "type": "Löschungsankündigung",
      "state": "Berlin",
      "amtsgericht": "Amtsgericht Berlin (Charlottenburg)",
      "registernummer": "HRB 139692",
      "registerart": "HRB",
      "company_name": "KWO - Kanzlei für wirtschaftliche Optimierung - UG (haftungsbeschränkt)",
      "company_seat": "Berlin",
      "details": "20.10.2025 (Bekanntmachungsdatum)\n\nBerlin Amtsgericht Berlin (Charlottenburg) HRB 139692\nLöschungsankündigung\n\nKWO - Kanzlei für wirtschaftliche Optimierung - UG (haftungsbeschränkt)\nGesellschaft mit beschränkter Haftung\nBerlin\n\nBei der nachstehenden Gesellschaft wird das Amtslöschungsverfahren gemäß § 394 FamFG eingeleitet. Widerspruchsfrist 6 Wochen"
    },
    {
      "date": "2025-10-20",
      "id": "134535",
      "original_text": "Registerbekanntmachung nach dem Umwandlungsgesetz\nBerlin Amtsgericht Berlin (Charlottenburg) HRA 17347\nHGV Haagen Haus- und Grundstücksverwaltung KG – Berlin",
      "type": "Registerbekanntmachung nach dem Umwandlungsgesetz",
      "state": "Berlin",
      "amtsgericht": "Amtsgericht Berlin (Charlottenburg)",
      "registernummer": "HRA 17347",
      "registerart": "HRA",
      "company_name": "HGV Haagen Haus- und Grundstücksverwaltung KG",
      "company_seat": "Berlin",
      "details": "20.10.2025 (Bekanntmachungsdatum)\n\nBerlin Amtsgericht Berlin (Charlottenburg) HRA 17347\nRegisterbekanntmachung nach dem Umwandlungsgesetz 16.10.2025 (Eintragungsdatum)\n\nHGV Haagen Haus- und Grundstücksverwaltung KG\nKommanditgesellschaft\nBerlin\n\nZu Eintragungsnummer 4 vom 16.10.2025 wird als nicht eingetragen veröffentlicht: HRA 17347 BDen Gläubigern der an der Verschmelzung beteiligten Rechtsträger ist, wenn sie binnen sechs Monaten nach dem Tag, an dem die Eintragung der Verschmelzung in das Register des Sitzes desjenigen Rechtsträgers, dessen Gläubiger sie sind, als bekannt gemacht gilt, ihren Anspruch nach Grund und Höhe schriftlich anmelden, Sicherheit zu leisten, soweit sie nicht Befriedigung verlangen können. Dieses Recht steht den Gläubigern jedoch nur zu, wenn sie glaubhaft machen, dass durch die Verschmelzung die Erfüllung ihrer Forderung gefährdet wird. Das Recht, Sicherheitsleistung zu verlangen, steht Gläubigern nicht zu, die im Falle der Insolvenz ein Recht auf vorzugsweise Befriedigung aus einer Deckungsmasse haben, die nach gesetzlicher Vorschrift zu ihrem Schutz errichtet und staatlich überwacht ist."
    },
    {
      "date": "2025-10-20",
      "id": "134536",
      "original_text": "Löschungsankündigung\nBerlin Amtsgericht Berlin (Charlottenburg) HRB 139671\nWohlfahrt Gastro GmbH – Berlin",
      "type": "Löschungsankündigung",
      "state": "Berlin",
      "amtsgericht": "Amtsgericht Berlin (Charlottenburg)",
      "registernummer": "HRB 139671",
      "registerart": "HRB",
      "company_name": "Wohlfahrt Gastro GmbH",
      "company_seat": "Berlin",
      "details": "20.10.2025 (Bekanntmachungsdatum)\n\nBerlin Amtsgericht Berlin (Charlottenburg) HRB 139671\nLöschungsankündigung\n\nWohlfahrt Gastro GmbH\nGesellschaft mit beschränkter Haftung\nBerlin\n\nBei der nachstehenden Gesellschaft wird das Amtslöschungsverfahren gemäß § 394 FamFG eingeleitet. Widerspruchsfrist 6 Wochen"
    },
    {
      "date": "2025-10-20",
      "id": "134537",
      "original_text": "Löschungsankündigung\nBerlin Amtsgericht Berlin (Charlottenburg) HRB 157902\nDeterra Engineering GmbH – Berlin",
      "type": "Löschungsankündigung",
      "state": "Berlin",
      "amtsgericht": "Amtsgericht Berlin (Charlottenburg)",
      "registernummer": "HRB 157902",
      "registerart": "HRB",
      "company_name": "Deterra Engineering GmbH",
      "company_seat": "Berlin",
      "details": "20.10.2025 (Bekanntmachungsdatum)\n\nBerlin Amtsgericht Berlin (Charlottenburg) HRB 157902\nLöschungsankündigung\n\nDeterra Engineering GmbH\nGesellschaft mit beschränkter Haftung\nBerlin\n\nBei der nachstehenden Gesellschaft wird das Amtslöschungsverfahren gemäß § 394 FamFG eingeleitet. Widerspruchsfrist 6 Wochen"
    },
    {
      "date": "2025-10-20",
      "id": "134538",
      "original_text": "Registerbekanntmachung nach dem Umwandlungsgesetz\nBaden-Württemberg Amtsgericht Ulm HRB 552607\nOMIRA GmbH – Ravensburg",
      "type": "Registerbekanntmachung nach dem Umwandlungsgesetz",
      "state": "Baden-Württemberg",
      "amtsgericht": "Amtsgericht Ulm",
      "registernummer": "HRB 552607",
      "registerart": "HRB",
      "company_name": "OMIRA GmbH",
      "company_seat": "Ravensburg",
      "details": "20.10.2025 (Bekanntmachungsdatum)\n\nBaden-Württemberg Amtsgericht Ulm HRB 552607\nRegisterbekanntmachung nach dem Umwandlungsgesetz 30.09.2025 (Eintragungsdatum)\n\nOMIRA GmbH\nGesellschaft mit beschränkter Haftung\nRavensburg\n\nAls nicht eingetragen wird bekanntgemacht:\nDen Gläubigern der an der Verschmelzung beteiligten Rechtsträger ist, wenn sie binnen sechs Monaten nach dem Tag, an dem die Eintragung der Verschmelzung in das Register des Sitzes desjenigen Rechtsträgers, dessen Gläubiger sie sind, nach § 19 Abs. 3 UmwG als bekanntgemacht gilt, ihren Anspruch nach Grund und Höhe schriftlich anmelden, Sicherheit zu leisten, soweit sie nicht Befriedigung verlangen können. Dieses Recht steht den Gläubigern jedoch nur zu, wenn sie glaubhaft machen, dass durch die Verschmelzung die Erfüllung ihrer Forderung gefährdet wird."
    },
    {
      "date": "2025-10-20",
      "id": "134539",
      "original_text": "Registerbekanntmachung nach dem Umwandlungsgesetz\nBaden-Württemberg Amtsgericht Ulm HRB 552607\nOMIRA GmbH – Ravensburg",
      "type": "Registerbekanntmachung nach dem Umwandlungsgesetz",
      "state": "Baden-Württemberg",
      "amtsgericht": "Amtsgericht Ulm",
      "registernummer": "HRB 552607",
      "registerart": "HRB",
      "company_name": "OMIRA GmbH",
      "company_seat": "Ravensburg",
      "details": "20.10.2025 (Bekanntmachungsdatum)\n\nBaden-Württemberg Amtsgericht Ulm HRB 552607\nRegisterbekanntmachung nach dem Umwandlungsgesetz 20.10.2025 (Eintragungsdatum)\n\nOMIRA GmbH\nGesellschaft mit beschränkter Haftung\nRavensburg\n\n#DV.Auswahl(Text=\"Bitte wählen Sie aus:\",\tEingabe=\n\"#insert(Text=\"VOE_Allgemein\")\"|\"Als nicht eingetragen wird bekanntgemacht:\",\n\"#insert(Text=\"VOE_BKM_Blätter\")\"|\"Bekanntmachungen der Gesellschaft erfolgen...\",\n\"#insert(Text=\"VOE_Aufsichtsrat\")\"|\"Mitglieder des ersten Aufsichtsrats\",\n\"#insert(Text=\"VOE_Sachgründung\")\"|\"Sachgründung\",\n\"#insert(Text=\"VOE_Sacherhöhung\")\"|\"Sacherhöhung\",\n\"#insert(Text=\"VOE_Aufhebung_UV\")\"|\"Aufhebung Unternehmensvertrag\",\n\"#insert(Text=\"VOE_Formwechsel\")\"|\"Formwechsel\",\n\"#insert(Text=\"VOE_Verschmelzung\")\"|\"Verschmelzung\",\n\"#insert(Text=\"VOE_Abspaltung\")\"|\"Abspaltung\",\n\"#insert(Text=\"VOE_Aufspaltung\")\"|\"Aufspaltung\",\n\"#insert(Text=\"VOE_Ausgliederung\")\"|\"Ausgliederung\",\n\"#insert(Text=\"VOE_Vermögensübertragung\")\"|\"Vermögensübertragung\",\n\"#insert(Text=\"Loeschungsankündigung_HR_394\")\"|\"Löschungsankündigung 394 FamFG\",\n\"#insert(Text=\"Loeschungsankündigung_HR_395\")\"|\"Löschungsankündigung 395 FamFG\",\n\"#insert(Text=\"Loeschungsankündigung_HR_397\")\"|\"Löschungsankündigung 397 FamFG\")"
    },
    {
      "date": "2025-10-20",
      "id": "134540",
      "original_text": "Registerbekanntmachung nach dem Umwandlungsgesetz\nBaden-Württemberg Amtsgericht Ulm HRB 552607\nOMIRA GmbH – Ravensburg",
      "type": "Registerbekanntmachung nach dem Umwandlungsgesetz",
      "state": "Baden-Württemberg",
      "amtsgericht": "Amtsgericht Ulm",
      "registernummer": "HRB 552607",
      "registerart": "HRB",
      "company_name": "OMIRA GmbH",
      "company_seat": "Ravensburg",
      "details": "20.10.2025 (Bekanntmachungsdatum)\n\nBaden-Württemberg Amtsgericht Ulm HRB 552607\nRegisterbekanntmachung nach dem Umwandlungsgesetz 20.10.2025 (Eintragungsdatum)\n\nOMIRA GmbH\nGesellschaft mit beschränkter Haftung\nRavensburg\n\nAls nicht eingetragen wird bekanntgemacht:\nDen Gläubigern der an der Verschmelzung beteiligten Rechtsträger ist, wenn sie binnen sechs Monaten nach dem Tag, an dem die Eintragung der Verschmelzung in das Register des Sitzes desjenigen Rechtsträgers, dessen Gläubiger sie sind, nach § 19 Abs. 3 UmwG als bekanntgemacht gilt, ihren Anspruch nach Grund und Höhe schriftlich anmelden, Sicherheit zu leisten, soweit sie nicht Befriedigung verlangen können. Dieses Recht steht den Gläubigern jedoch nur zu, wenn sie glaubhaft machen, dass durch die Verschmelzung die Erfüllung ihrer Forderung gefährdet wird."
    },
    {
      "date": "2025-10-20",
      "id": "134541",
      "original_text": "Einreichung neuer Dokumente\nBaden-Württemberg Amtsgericht Stuttgart HRB 109233\nRheinmetall Automotive AG – Neckarsulm",
      "type": "Einreichung neuer Dokumente",
      "state": "Baden-Württemberg",
      "amtsgericht": "Amtsgericht Stuttgart",
      "registernummer": "HRB 109233",
      "registerart": "HRB",
      "company_name": "Rheinmetall Automotive AG",
      "company_seat": "Neckarsulm",
      "details": "20.10.2025 (Bekanntmachungsdatum)\n\nBaden-Württemberg Amtsgericht Stuttgart HRB 109233\nEinreichung neuer Dokumente 20.10.2025 (Eintragungsdatum)\n\nRheinmetall Automotive AG\nAktiengesellschaft\nNeckarsulm\n\nDie Gesellschaft hat am 18.09.2025 die Liste über die Zusammensetzung des Aufsichtsrats zum Handelsregister eingereicht."
    },
    {
      "date": "2025-10-20",
      "id": "134542",
      "original_text": "Registerbekanntmachung nach dem Umwandlungsgesetz\nBerlin Amtsgericht Berlin (Charlottenburg) HRB 37953\nRAW Value 1 GmbH – Berlin",
      "type": "Registerbekanntmachung nach dem Umwandlungsgesetz",
      "state": "Berlin",
      "amtsgericht": "Amtsgericht Berlin (Charlottenburg)",
      "registernummer": "HRB 37953",
      "registerart": "HRB",
      "company_name": "RAW Value 1 GmbH",
      "company_seat": "Berlin",
      "details": "20.10.2025 (Bekanntmachungsdatum)\n\nBerlin Amtsgericht Berlin (Charlottenburg) HRB 37953\nRegisterbekanntmachung nach dem Umwandlungsgesetz 20.10.2025 (Eintragungsdatum)\n\nRAW Value 1 GmbH\nGesellschaft mit beschränkter Haftung\nBerlin\n\nZu Eintragungsnummer 13 vom 20.10.2025 wird als nicht eingetragen veröffentlicht:\n\nDen Gläubigern der an der Verschmelzung beteiligten Rechtsträger ist, wenn sie binnen sechs Monaten nach dem Tag, an dem die Eintragung der Verschmelzung in das Register des Sitzes desjenigen Rechtsträgers, dessen Gläubiger sie sind, als bekannt gemacht gilt, ihren Anspruch nach Grund und Höhe schriftlich anmelden, Sicherheit zu leisten, soweit sie nicht Befriedigung verlangen können. Dieses Recht steht den Gläubigern jedoch nur zu, wenn sie glaubhaft machen, dass durch die Verschmelzung die Erfüllung ihrer Forderung gefährdet wird. Das Recht, Sicherheitsleistung zu verlangen, steht Gläubigern nicht zu, die im Falle der Insolvenz ein Recht auf vorzugsweise Befriedigung aus einer Deckungsmasse haben, die nach gesetzlicher Vorschrift zu ihrem Schutz errichtet und staatlich überwacht ist."
    },
    {
      "date": "2025-10-20",
      "id": "134543",
      "original_text": "Einreichung neuer Dokumente\nBaden-Württemberg Amtsgericht Stuttgart HRB 20834\nBF.direkt AG – Stuttgart",
      "type": "Einreichung neuer Dokumente",
      "state": "Baden-Württemberg",
      "amtsgericht": "Amtsgericht Stuttgart",
      "registernummer": "HRB 20834",
      "registerart": "HRB",
      "company_name": "BF.direkt AG",
      "company_seat": "Stuttgart",
      "details": "20.10.2025 (Bekanntmachungsdatum)\n\nBaden-Württemberg Amtsgericht Stuttgart HRB 20834\nEinreichung neuer Dokumente\n\nBF.direkt AG\nAktiengesellschaft\nStuttgart\n\nDie Gesellschaft hat am 17.10.2025 die Liste über die Zusammensetzung des Aufsichtsrats zum Handelsregister eingereicht."
    },
    {
      "date": "2025-10-20",
      "id": "134544",
      "original_text": "Registerbekanntmachung nach dem Umwandlungsgesetz\nBerlin Amtsgericht Berlin (Charlottenburg) HRB 114568\nHavelblick Projektgesellschaft mbH – Berlin",
      "type": "Registerbekanntmachung nach dem Umwandlungsgesetz",
      "state": "Berlin",
      "amtsgericht": "Amtsgericht Berlin (Charlottenburg)",
      "registernummer": "HRB 114568",
      "registerart": "HRB",
      "company_name": "Havelblick Projektgesellschaft mbH",
      "company_seat": "Berlin",
      "details": "20.10.2025 (Bekanntmachungsdatum)\n\nBerlin Amtsgericht Berlin (Charlottenburg) HRB 114568\nRegisterbekanntmachung nach dem Umwandlungsgesetz 20.10.2025 (Eintragungsdatum)\n\nHavelblick Projektgesellschaft mbH\nGesellschaft mit beschränkter Haftung\nBerlin\n\nZu Eintragungsnummer 12 vom 20.10.2025 wird als nicht eingetragen veröffentlicht:\n\nDen Gläubigern der an der Verschmelzung beteiligten Rechtsträger ist, wenn sie binnen sechs Monaten nach dem Tag, an dem die Eintragung der Verschmelzung in das Register des Sitzes desjenigen Rechtsträgers, dessen Gläubiger sie sind, als bekannt gemacht gilt, ihren Anspruch nach Grund und Höhe schriftlich anmelden, Sicherheit zu leisten, soweit sie nicht Befriedigung verlangen können. Dieses Recht steht den Gläubigern jedoch nur zu, wenn sie glaubhaft machen, dass durch die Verschmelzung die Erfüllung ihrer Forderung gefährdet wird. Das Recht, Sicherheitsleistung zu verlangen, steht Gläubigern nicht zu, die im Falle der Insolvenz ein Recht auf vorzugsweise Befriedigung aus einer Deckungsmasse haben, die nach gesetzlicher Vorschrift zu ihrem Schutz errichtet und staatlich überwacht ist."
    },
    {
      "date": "2025-10-20",
      "id": "134545",
      "original_text": "Registerbekanntmachung nach dem Umwandlungsgesetz\nBerlin Amtsgericht Berlin (Charlottenburg) HRB 112974\nKondor Wessels Residences GmbH – Berlin",
      "type": "Registerbekanntmachung nach dem Umwandlungsgesetz",
      "state": "Berlin",
      "amtsgericht": "Amtsgericht Berlin (Charlottenburg)",
      "registernummer": "HRB 112974",
      "registerart": "HRB",
      "company_name": "Kondor Wessels Residences GmbH",
      "company_seat": "Berlin",
      "details": "20.10.2025 (Bekanntmachungsdatum)\n\nBerlin Amtsgericht Berlin (Charlottenburg) HRB 112974\nRegisterbekanntmachung nach dem Umwandlungsgesetz 20.10.2025 (Eintragungsdatum)\n\nKondor Wessels Residences GmbH\nGesellschaft mit beschränkter Haftung\nBerlin\n\nZu Eintragungsnummer 10 vom 20.10.2025 wird als nicht eingetragen veröffentlicht:\n\nDen Gläubigern der an der Verschmelzung beteiligten Rechtsträger ist, wenn sie binnen sechs Monaten nach dem Tag, an dem die Eintragung der Verschmelzung in das Register des Sitzes desjenigen Rechtsträgers, dessen Gläubiger sie sind, als bekannt gemacht gilt, ihren Anspruch nach Grund und Höhe schriftlich anmelden, Sicherheit zu leisten, soweit sie nicht Befriedigung verlangen können. Dieses Recht steht den Gläubigern jedoch nur zu, wenn sie glaubhaft machen, dass durch die Verschmelzung die Erfüllung ihrer Forderung gefährdet wird. Das Recht, Sicherheitsleistung zu verlangen, steht Gläubigern nicht zu, die im Falle der Insolvenz ein Recht auf vorzugsweise Befriedigung aus einer Deckungsmasse haben, die nach gesetzlicher Vorschrift zu ihrem Schutz errichtet und staatlich überwacht ist."
    },
    {
      "date": "2025-10-20",
      "id": "134546",
      "original_text": "Registerbekanntmachung nach dem Umwandlungsgesetz\nBerlin Amtsgericht Berlin (Charlottenburg) HRB 125871\nDresdener Straße 110 Projektentwicklung GmbH – Berlin",
      "type": "Registerbekanntmachung nach dem Umwandlungsgesetz",
      "state": "Berlin",
      "amtsgericht": "Amtsgericht Berlin (Charlottenburg)",
      "registernummer": "HRB 125871",
      "registerart": "HRB",
      "company_name": "Dresdener Straße 110 Projektentwicklung GmbH",
      "company_seat": "Berlin",
      "details": "20.10.2025 (Bekanntmachungsdatum)\n\nBerlin Amtsgericht Berlin (Charlottenburg) HRB 125871\nRegisterbekanntmachung nach dem Umwandlungsgesetz 20.10.2025 (Eintragungsdatum)\n\nDresdener Straße 110 Projektentwicklung GmbH\nGesellschaft mit beschränkter Haftung\nBerlin\n\nZu Eintragungsnummer 9 vom 20.10.2025 wird als nicht eingetragen veröffentlicht:\n\nDen Gläubigern der an der Verschmelzung beteiligten Rechtsträger ist, wenn sie binnen sechs Monaten nach dem Tag, an dem die Eintragung der Verschmelzung in das Register des Sitzes desjenigen Rechtsträgers, dessen Gläubiger sie sind, als bekannt gemacht gilt, ihren Anspruch nach Grund und Höhe schriftlich anmelden, Sicherheit zu leisten, soweit sie nicht Befriedigung verlangen können. Dieses Recht steht den Gläubigern jedoch nur zu, wenn sie glaubhaft machen, dass durch die Verschmelzung die Erfüllung ihrer Forderung gefährdet wird. Das Recht, Sicherheitsleistung zu verlangen, steht Gläubigern nicht zu, die im Falle der Insolvenz ein Recht auf vorzugsweise Befriedigung aus einer Deckungsmasse haben, die nach gesetzlicher Vorschrift zu ihrem Schutz errichtet und staatlich überwacht ist."
    },
    {
      "date": "2025-10-20",
      "id": "134547",
      "original_text": "Sonstige Registerbekanntmachung\nBerlin Amtsgericht Berlin (Charlottenburg) HRB 235068\nVelero Management GmbH – Berlin",
      "type": "Sonstige Registerbekanntmachung",
      "state": "Berlin",
      "amtsgericht": "Amtsgericht Berlin (Charlottenburg)",
      "registernummer": "HRB 235068",
      "registerart": "HRB",
      "company_name": "Velero Management GmbH",
      "company_seat": "Berlin",
      "details": "20.10.2025 (Bekanntmachungsdatum)\n\nBerlin Amtsgericht Berlin (Charlottenburg) HRB 235068\nSonstige Registerbekanntmachung\n\nVelero Management GmbH\nGesellschaft mit beschränkter Haftung\nBerlin\n\nAls nicht eingetragen wird veröffentlicht: Es wurde eine neue Liste der Aufsichtsratsmitglieder eingereicht (§52 GmbHG)."
    },
    {
      "date": "2025-10-20",
      "id": "134548",
      "original_text": "Löschungsankündigung\nBrandenburg Amtsgericht Potsdam HRB 27533\nLUMAX AG – Teltow",
      "type": "Löschungsankündigung",
      "state": "Brandenburg",
      "amtsgericht": "Amtsgericht Potsdam",
      "registernummer": "HRB 27533",
      "registerart": "HRB",
      "company_name": "LUMAX AG",
      "company_seat": "Teltow",
      "details": "20.10.2025 (Bekanntmachungsdatum)\n\nBrandenburg Amtsgericht Potsdam HRB 27533\nLöschungsankündigung\n\nLUMAX AG\nRechtsform ausländischen Rechts HRB\nTeltow\n\nBei der nachstehenden Gesellschaft wird das Amtslöschungsverfahren gemäß § 395 FamFG eingeleitet. Widerspruchsfrist: 8 Wochen."
    },
    {
      "date": "2025-10-20",
      "id": "134549",
      "original_text": "Registerbekanntmachung nach dem Umwandlungsgesetz\nBerlin Amtsgericht Berlin (Charlottenburg) HRB 149448\nKondor Wessels J10 GmbH – Berlin",
      "type": "Registerbekanntmachung nach dem Umwandlungsgesetz",
      "state": "Berlin",
      "amtsgericht": "Amtsgericht Berlin (Charlottenburg)",
      "registernummer": "HRB 149448",
      "registerart": "HRB",
      "company_name": "Kondor Wessels J10 GmbH",
      "company_seat": "Berlin",
      "details": "20.10.2025 (Bekanntmachungsdatum)\n\nBerlin Amtsgericht Berlin (Charlottenburg) HRB 149448\nRegisterbekanntmachung nach dem Umwandlungsgesetz 20.10.2025 (Eintragungsdatum)\n\nKondor Wessels J10 GmbH\nGesellschaft mit beschränkter Haftung\nBerlin\n\nZu Eintragungsnummer 9 vom 20.10.2025 wird als nicht eingetragen veröffentlicht:\n\nDen Gläubigern der an der Verschmelzung beteiligten Rechtsträger ist, wenn sie binnen sechs Monaten nach dem Tag, an dem die Eintragung der Verschmelzung in das Register des Sitzes desjenigen Rechtsträgers, dessen Gläubiger sie sind, als bekannt gemacht gilt, ihren Anspruch nach Grund und Höhe schriftlich anmelden, Sicherheit zu leisten, soweit sie nicht Befriedigung verlangen können. Dieses Recht steht den Gläubigern jedoch nur zu, wenn sie glaubhaft machen, dass durch die Verschmelzung die Erfüllung ihrer Forderung gefährdet wird. Das Recht, Sicherheitsleistung zu verlangen, steht Gläubigern nicht zu, die im Falle der Insolvenz ein Recht auf vorzugsweise Befriedigung aus einer Deckungsmasse haben, die nach gesetzlicher Vorschrift zu ihrem Schutz errichtet und staatlich überwacht ist."
    },
    {
      "date": "2025-10-20",
      "id": "134550",
      "original_text": "Registerbekanntmachung nach dem Umwandlungsgesetz\nBaden-Württemberg Amtsgericht Ulm HRB 741806\nAniCura Deutschland GmbH – Ravensburg",
      "type": "Registerbekanntmachung nach dem Umwandlungsgesetz",
      "state": "Baden-Württemberg",
      "amtsgericht": "Amtsgericht Ulm",
      "registernummer": "HRB 741806",
      "registerart": "HRB",
      "company_name": "AniCura Deutschland GmbH",
      "company_seat": "Ravensburg",
      "details": "20.10.2025 (Bekanntmachungsdatum)\n\nBaden-Württemberg Amtsgericht Ulm HRB 741806\nRegisterbekanntmachung nach dem Umwandlungsgesetz 20.10.2025 (Eintragungsdatum)\n\nAniCura Deutschland GmbH\nGesellschaft mit beschränkter Haftung\nRavensburg\n\nAls nicht eingetragen wird bekanntgemacht:\nDen Gläubigern der an der Verschmelzung beteiligten Rechtsträger ist, wenn sie binnen sechs Monaten nach dem Tag, an dem die Eintragung der Verschmelzung in das Register des Sitzes desjenigen Rechtsträgers, dessen Gläubiger sie sind, nach § 19 Abs. 3 UmwG als bekanntgemacht gilt, ihren Anspruch nach Grund und Höhe schriftlich anmelden, Sicherheit zu leisten, soweit sie nicht Befriedigung verlangen können. Dieses Recht steht den Gläubigern jedoch nur zu, wenn sie glaubhaft machen, dass durch die Verschmelzung die Erfüllung ihrer Forderung gefährdet wird."
    },
    {
      "date": "2025-10-20",
      "id": "134551",
      "original_text": "Löschungsankündigung\nBaden-Württemberg Amtsgericht Mannheim GnR 700053\nBadische Holz Energie e.G – Heidelberg",
      "type": "Löschungsankündigung",
      "state": "Baden-Württemberg",
      "amtsgericht": "Amtsgericht Mannheim",
      "registernummer": "GnR 700053",
      "registerart": "GnR",
      "company_name": "Badische Holz Energie e.G",
      "company_seat": "Heidelberg",
      "details": "20.10.2025 (Bekanntmachungsdatum)\n\nBaden-Württemberg Amtsgericht Mannheim GnR 700053\nLöschungsankündigung 20.10.2025 (Eintragungsdatum)\n\nBadische Holz Energie e.G\neingetragene Genossenschaft\nHeidelberg\n\nDas Gericht beabsichtigt, die Genossenschaft wegen Vermögenslosigkeit im Genossenschaftsregister von Amts wegen nach § 394 FamFG zu löschen. Die Frist zur Geltendmachung eines Widerspruchs gegen die beabsichtigte Löschung ist auf einen Monat ab Veröffentlichung bestimmt."
    },
    {
      "date": "2025-10-20",
      "id": "134552",
      "original_text": "Registerbekanntmachung nach dem Umwandlungsgesetz\nBerlin Amtsgericht Berlin (Charlottenburg) HRB 151821\nRiva Vista Verwaltungs GmbH – Berlin",
      "type": "Registerbekanntmachung nach dem Umwandlungsgesetz",
      "state": "Berlin",
      "amtsgericht": "Amtsgericht Berlin (Charlottenburg)",
      "registernummer": "HRB 151821",
      "registerart": "HRB",
      "company_name": "Riva Vista Verwaltungs GmbH",
      "company_seat": "Berlin",
      "details": "20.10.2025 (Bekanntmachungsdatum)\n\nBerlin Amtsgericht Berlin (Charlottenburg) HRB 151821\nRegisterbekanntmachung nach dem Umwandlungsgesetz 20.10.2025 (Eintragungsdatum)\n\nRiva Vista Verwaltungs GmbH\nGesellschaft mit beschränkter Haftung\nBerlin\n\nZu Eintragungsnummer 7 vom 20.10.2025 wird als nicht eingetragen veröffentlicht:\n\nDen Gläubigern der an der Verschmelzung beteiligten Rechtsträger ist, wenn sie binnen sechs Monaten nach dem Tag, an dem die Eintragung der Verschmelzung in das Register des Sitzes desjenigen Rechtsträgers, dessen Gläubiger sie sind, als bekannt gemacht gilt, ihren Anspruch nach Grund und Höhe schriftlich anmelden, Sicherheit zu leisten, soweit sie nicht Befriedigung verlangen können. Dieses Recht steht den Gläubigern jedoch nur zu, wenn sie glaubhaft machen, dass durch die Verschmelzung die Erfüllung ihrer Forderung gefährdet wird. Das Recht, Sicherheitsleistung zu verlangen, steht Gläubigern nicht zu, die im Falle der Insolvenz ein Recht auf vorzugsweise Befriedigung aus einer Deckungsmasse haben, die nach gesetzlicher Vorschrift zu ihrem Schutz errichtet und staatlich überwacht ist."
    },
    {
      "date": "2025-10-20",
      "id": "134553",
      "original_text": "Registerbekanntmachung nach dem Umwandlungsgesetz\nBerlin Amtsgericht Berlin (Charlottenburg) HRB 200980\nKondor Wessels Wohnen München GmbH – Berlin",
      "type": "Registerbekanntmachung nach dem Umwandlungsgesetz",
      "state": "Berlin",
      "amtsgericht": "Amtsgericht Berlin (Charlottenburg)",
      "registernummer": "HRB 200980",
      "registerart": "HRB",
      "company_name": "Kondor Wessels Wohnen München GmbH",
      "company_seat": "Berlin",
      "details": "20.10.2025 (Bekanntmachungsdatum)\n\nBerlin Amtsgericht Berlin (Charlottenburg) HRB 200980\nRegisterbekanntmachung nach dem Umwandlungsgesetz 20.10.2025 (Eintragungsdatum)\n\nKondor Wessels Wohnen München GmbH\nGesellschaft mit beschränkter Haftung\nBerlin\n\nZu Eintragungsnummer 3 vom 20.10.2025 wird als nicht eingetragen veröffentlicht:\n\nDen Gläubigern der an der Verschmelzung beteiligten Rechtsträger ist, wenn sie binnen sechs Monaten nach dem Tag, an dem die Eintragung der Verschmelzung in das Register des Sitzes desjenigen Rechtsträgers, dessen Gläubiger sie sind, als bekannt gemacht gilt, ihren Anspruch nach Grund und Höhe schriftlich anmelden, Sicherheit zu leisten, soweit sie nicht Befriedigung verlangen können. Dieses Recht steht den Gläubigern jedoch nur zu, wenn sie glaubhaft machen, dass durch die Verschmelzung die Erfüllung ihrer Forderung gefährdet wird. Das Recht, Sicherheitsleistung zu verlangen, steht Gläubigern nicht zu, die im Falle der Insolvenz ein Recht auf vorzugsweise Befriedigung aus einer Deckungsmasse haben, die nach gesetzlicher Vorschrift zu ihrem Schutz errichtet und staatlich überwacht ist."
    },
    {
      "date": "2025-10-20",
      "id": "134554",
      "original_text": "Löschungsankündigung\nSchleswig-Holstein Amtsgericht Lübeck HRB 25909\nMehmet Garten- u. Landschaftsbau UG (haftungsbeschränkt) – Delingsdorf",
      "type": "Löschungsankündigung",
      "state": "Schleswig-Holstein",
      "amtsgericht": "Amtsgericht Lübeck",
      "registernummer": "HRB 25909",
      "registerart": "HRB",
      "company_name": "Mehmet Garten- u. Landschaftsbau UG (haftungsbeschränkt)",
      "company_seat": "Delingsdorf",
      "details": "20.10.2025 (Bekanntmachungsdatum)\n\nSchleswig-Holstein Amtsgericht Lübeck HRB 25909\nLöschungsankündigung\n\nMehmet Garten- u. Landschaftsbau UG (haftungsbeschränkt)\nGesellschaft mit beschränkter Haftung\nDelingsdorf\n\nEs ist die Löschung der nachstehenden Gesellschaft wegen Vermögenslosigkeit gemäß § 394 FamFG beabsichtigt. Widerspruchsfrist: 1 Monat."
    },
    {
      "date": "2025-10-20",
      "id": "134555",
      "original_text": "Registerbekanntmachung nach dem Umwandlungsgesetz\nHamburg Amtsgericht Hamburg HRB 194278\nTrupp Sicherheitsgesellschaft mbH – Hamburg",
      "type": "Registerbekanntmachung nach dem Umwandlungsgesetz",
      "state": "Hamburg",
      "amtsgericht": "Amtsgericht Hamburg",
      "registernummer": "HRB 194278",
      "registerart": "HRB",
      "company_name": "Trupp Sicherheitsgesellschaft mbH",
      "company_seat": "Hamburg",
      "details": "20.10.2025 (Bekanntmachungsdatum)\n\nHamburg Amtsgericht Hamburg HRB 194278\nRegisterbekanntmachung nach dem Umwandlungsgesetz 20.10.2025 (Eintragungsdatum)\n\nTrupp Sicherheitsgesellschaft mbH\nGesellschaft mit beschränkter Haftung\nHamburg\n\nAls nicht eingetragen wird bekannt gemacht:\nDen Gläubigern der an der Ausgliederung beteiligten Gesellschaften ist, wenn sie binnen sechs Monaten nach dem Tag, an dem die Eintragung der Ausgliederung in das Register des Sitzes desjenigen Rechtsträgers, dessen Gläubiger sie sind, nach § 19 Absatz 3 UmwG als bekannt gemacht gilt, ihren Anspruch nach Grund und Höhe schriftlich anmelden, Sicherheit zu leisten, soweit sie nicht Befriedigung verlangen können. Dieses Recht steht den Gläubigern jedoch nur zu, wenn sie glaubhaft machen, dass durch die Ausgliederung die Erfüllung ihrer Forderung gefährdet wird."
    },
    {
      "date": "2025-10-20",
      "id": "134556",
      "original_text": "Einreichung neuer Dokumente\nHamburg Amtsgericht Hamburg HRB 69127\nCAS CONCEPTS AND SOLUTIONS Aktiengesellschaft – Hamburg",
      "type": "Einreichung neuer Dokumente",
      "state": "Hamburg",
      "amtsgericht": "Amtsgericht Hamburg",
      "registernummer": "HRB 69127",
      "registerart": "HRB",
      "company_name": "CAS CONCEPTS AND SOLUTIONS Aktiengesellschaft",
      "company_seat": "Hamburg",
      "details": "20.10.2025 (Bekanntmachungsdatum)\n\nHamburg Amtsgericht Hamburg HRB 69127\nEinreichung neuer Dokumente\n\nCAS CONCEPTS AND SOLUTIONS Aktiengesellschaft\nAktiengesellschaft\nHamburg\n\nAls nicht eingetragen wird bekannt gemacht: Liste des Aufsichtsrats wurde eingereicht."
    },
    {
      "date": "2025-10-20",
      "id": "134557",
      "original_text": "Registerbekanntmachung nach dem Umwandlungsgesetz\nHamburg Amtsgericht Hamburg HRA 132649\nSarhangi Security e.K. – Hamburg",
      "type": "Registerbekanntmachung nach dem Umwandlungsgesetz",
      "state": "Hamburg",
      "amtsgericht": "Amtsgericht Hamburg",
      "registernummer": "HRA 132649",
      "registerart": "HRA",
      "company_name": "Sarhangi Security e.K.",
      "company_seat": "Hamburg",
      "details": "20.10.2025 (Bekanntmachungsdatum)\n\nHamburg Amtsgericht Hamburg HRA 132649\nRegisterbekanntmachung nach dem Umwandlungsgesetz 20.10.2025 (Eintragungsdatum)\n\nSarhangi Security e.K.\nEinzelkaufmann\nHamburg\n\nAls nicht eingetragen wird bekannt gemacht:\nDen Gläubigern der an der Ausgliederung beteiligten Rechtsträger ist, wenn sie binnen sechs Monaten nach dem Tag, an dem die Eintragung der Ausgliederung in das Register des Sitzes desjenigen Rechtsträgers, dessen Gläubiger sie sind, nach § 19 Absatz 3 UmwG als bekannt gemacht gilt, ihren Anspruch nach Grund und Höhe schriftlich anmelden, Sicherheit zu leisten, soweit sie nicht Befriedigung verlangen können. Dieses Recht steht den Gläubigern jedoch nur zu, wenn sie glaubhaft machen, dass durch die Ausgliederung die Erfüllung ihrer Forderung gefährdet wird."
    },
    {
      "date": "2025-10-20",
      "id": "134558",
      "original_text": "Einreichung neuer Dokumente\nBerlin Amtsgericht Berlin (Charlottenburg) HRB 163904\nIDEAL Sterbekasse Lebensversicherung AG – Berlin",
      "type": "Einreichung neuer Dokumente",
      "state": "Berlin",
      "amtsgericht": "Amtsgericht Berlin (Charlottenburg)",
      "registernummer": "HRB 163904",
      "registerart": "HRB",
      "company_name": "IDEAL Sterbekasse Lebensversicherung AG",
      "company_seat": "Berlin",
      "details": "20.10.2025 (Bekanntmachungsdatum)\n\nBerlin Amtsgericht Berlin (Charlottenburg) HRB 163904\nEinreichung neuer Dokumente\n\nIDEAL Sterbekasse Lebensversicherung AG\nAktiengesellschaft\nBerlin\n\nAls nicht eingetragen wird veröffentlicht:\nEs wurde eine neue Liste der Aufsichtsratsmitglieder eingereicht (§ 106 AktG)."
    },
    {
      "date": "2025-10-20",
      "id": "134559",
      "original_text": "Löschungsankündigung\nBaden-Württemberg Amtsgericht Stuttgart HRB 742061\nAAS Advanced Automated Systems GmbH – Ditzingen",
      "type": "Löschungsankündigung",
      "state": "Baden-Württemberg",
      "amtsgericht": "Amtsgericht Stuttgart",
      "registernummer": "HRB 742061",
      "registerart": "HRB",
      "company_name": "AAS Advanced Automated Systems GmbH",
      "company_seat": "Ditzingen",
      "details": "20.10.2025 (Bekanntmachungsdatum)\n\nBaden-Württemberg Amtsgericht Stuttgart HRB 742061\nLöschungsankündigung\n\nAAS Advanced Automated Systems GmbH\nGesellschaft mit beschränkter Haftung\nDitzingen\n\nAls nicht eingetragen wird bekanntgemacht:\nDas Gericht beabsichtigt, die Gesellschaft wegen Vermögenslosigkeit im Handelsregister von Amts wegen nach § 394 FamFG zu löschen. Die Frist zur Geltendmachung eines Widerspruchs gegen die beabsichtigte Löschung ist auf zwei Monate ab Veröffentlichung bestimmt."
    },
    {
      "date": "2025-10-20",
      "id": "134560",
      "original_text": "Registerbekanntmachung nach dem Umwandlungsgesetz\nSchleswig-Holstein Amtsgericht Lübeck HRB 15565\nObjekt Ballinstraße Nr. 12 GmbH – Bad Schwartau",
      "type": "Registerbekanntmachung nach dem Umwandlungsgesetz",
      "state": "Schleswig-Holstein",
      "amtsgericht": "Amtsgericht Lübeck",
      "registernummer": "HRB 15565",
      "registerart": "HRB",
      "company_name": "Objekt Ballinstraße Nr. 12 GmbH",
      "company_seat": "Bad Schwartau",
      "details": "20.10.2025 (Bekanntmachungsdatum)\n\nSchleswig-Holstein Amtsgericht Lübeck HRB 15565\nRegisterbekanntmachung nach dem Umwandlungsgesetz 17.10.2025 (Eintragungsdatum)\n\nObjekt Ballinstraße Nr. 12 GmbH\nGesellschaft mit beschränkter Haftung\nBad Schwartau\n\nZu Eintragungsnummer 3 vom 17.10.2025 wird als nicht eingetragen veröffentlicht:  Als nicht eingetragen wird veröffentlicht: Den Gläubigern der an der Verschmelzung beteiligten Rechtsträger ist, wenn sie binnen sechs Monaten nach dem Tag, an dem die Eintragung der Verschmelzung in das Register des Sitzes desjenigen Rechtsträgers, dessen Gläubiger sie sind, als bekannt gemacht gilt, ihren Anspruch nach Grund und Höhe schriftlich anmelden, Sicherheit zu leisten, soweit sie nicht Befriedigung verlangen können. Dieses Recht steht den Gläubigern jedoch nur zu, wenn sie glaubhaft machen, dass durch die Verschmelzung die Erfüllung ihrer Forderung gefährdet wird."
    },
    {
      "date": "2025-10-20",
      "id": "134561",
      "original_text": "Registerbekanntmachung nach dem Umwandlungsgesetz\nSchleswig-Holstein Amtsgericht Lübeck HRB 22027\nAdCon search & find GmbH – Glinde",
      "type": "Registerbekanntmachung nach dem Umwandlungsgesetz",
      "state": "Schleswig-Holstein",
      "amtsgericht": "Amtsgericht Lübeck",
      "registernummer": "HRB 22027",
      "registerart": "HRB",
      "company_name": "AdCon search & find GmbH",
      "company_seat": "Glinde",
      "details": "20.10.2025 (Bekanntmachungsdatum)\n\nSchleswig-Holstein Amtsgericht Lübeck HRB 22027\nRegisterbekanntmachung nach dem Umwandlungsgesetz 20.10.2025 (Eintragungsdatum)\n\nAdCon search & find GmbH\nGesellschaft mit beschränkter Haftung\nGlinde\n\nZu Eintragungsnummer 2 vom 20.10.2025 wird als nicht eingetragen veröffentlicht: Als nicht eingetragen wird veröffentlicht: Den Gläubigern der an der Verschmelzung beteiligten Rechtsträger ist, wenn sie binnen sechs Monaten nach dem Tag, an dem die Eintragung der Verschmelzung in das Register des Sitzes desjenigen Rechtsträgers, dessen Gläubiger sie sind, als bekannt gemacht gilt, ihren Anspruch nach Grund und Höhe schriftlich anmelden, Sicherheit zu leisten, soweit sie nicht Befriedigung verlangen können. Dieses Recht steht den Gläubigern jedoch nur zu, wenn sie glaubhaft machen, dass durch die Verschmelzung die Erfüllung ihrer Forderung gefährdet wird."
    },
    {
      "date": "2025-10-20",
      "id": "134562",
      "original_text": "Registerbekanntmachung nach dem Umwandlungsgesetz\nBaden-Württemberg Amtsgericht Ulm HRB 731816\ni Live Sales GmbH – Aalen",
      "type": "Registerbekanntmachung nach dem Umwandlungsgesetz",
      "state": "Baden-Württemberg",
      "amtsgericht": "Amtsgericht Ulm",
      "registernummer": "HRB 731816",
      "registerart": "HRB",
      "company_name": "i Live Sales GmbH",
      "company_seat": "Aalen",
      "details": "20.10.2025 (Bekanntmachungsdatum)\n\nBaden-Württemberg Amtsgericht Ulm HRB 731816\nRegisterbekanntmachung nach dem Umwandlungsgesetz 20.10.2025 (Eintragungsdatum)\n\ni Live Sales GmbH\nGesellschaft mit beschränkter Haftung\nAalen\n\nAls nicht eingetragen wird bekanntgemacht:\nDen Gläubigern der an der Verschmelzung beteiligten Rechtsträger ist, wenn sie binnen sechs Monaten nach dem Tag, an dem die Eintragung der Verschmelzung in das Register des Sitzes desjenigen Rechtsträgers, dessen Gläubiger sie sind, nach § 19 Abs. 3 UmwG als bekanntgemacht gilt, ihren Anspruch nach Grund und Höhe schriftlich anmelden, Sicherheit zu leisten, soweit sie nicht Befriedigung verlangen können. Dieses Recht steht den Gläubigern jedoch nur zu, wenn sie glaubhaft machen, dass durch die Verschmelzung die Erfüllung ihrer Forderung gefährdet wird."
    },
    {
      "date": "2025-10-20",
      "id": "134563",
      "original_text": "Registerbekanntmachung nach dem Umwandlungsgesetz\nBaden-Württemberg Amtsgericht Ulm HRB 730609\ni-live Bau GmbH – Aalen",
      "type": "Registerbekanntmachung nach dem Umwandlungsgesetz",
      "state": "Baden-Württemberg",
      "amtsgericht": "Amtsgericht Ulm",
      "registernummer": "HRB 730609",
      "registerart": "HRB",
      "company_name": "i-live Bau GmbH",
      "company_seat": "Aalen",
      "details": "20.10.2025 (Bekanntmachungsdatum)\n\nBaden-Württemberg Amtsgericht Ulm HRB 730609\nRegisterbekanntmachung nach dem Umwandlungsgesetz 20.10.2025 (Eintragungsdatum)\n\ni-live Bau GmbH\nGesellschaft mit beschränkter Haftung\nAalen\n\nAls nicht eingetragen wird bekanntgemacht:\nDen Gläubigern der an der Verschmelzung beteiligten Rechtsträger ist, wenn sie binnen sechs Monaten nach dem Tag, an dem die Eintragung der Verschmelzung in das Register des Sitzes desjenigen Rechtsträgers, dessen Gläubiger sie sind, nach § 19 Abs. 3 UmwG als bekanntgemacht gilt, ihren Anspruch nach Grund und Höhe schriftlich anmelden, Sicherheit zu leisten, soweit sie nicht Befriedigung verlangen können. Dieses Recht steht den Gläubigern jedoch nur zu, wenn sie glaubhaft machen, dass durch die Verschmelzung die Erfüllung ihrer Forderung gefährdet wird."
    },
    {
      "date": "2025-10-20",
      "id": "134564",
      "original_text": "Registerbekanntmachung nach dem Umwandlungsgesetz\nSchleswig-Holstein Amtsgericht Lübeck HRB 9686\nSchmelzer Hörsysteme GmbH – Glinde",
      "type": "Registerbekanntmachung nach dem Umwandlungsgesetz",
      "state": "Schleswig-Holstein",
      "amtsgericht": "Amtsgericht Lübeck",
      "registernummer": "HRB 9686",
      "registerart": "HRB",
      "company_name": "Schmelzer Hörsysteme GmbH",
      "company_seat": "Glinde",
      "details": "20.10.2025 (Bekanntmachungsdatum)\n\nSchleswig-Holstein Amtsgericht Lübeck HRB 9686\nRegisterbekanntmachung nach dem Umwandlungsgesetz 17.10.2025 (Eintragungsdatum)\n\nSchmelzer Hörsysteme GmbH\nGesellschaft mit beschränkter Haftung\nGlinde\n\nZu Eintragungsnummer 7 vom 17.10.2025 wird als nicht eingetragen veröffentlicht: Den Gläubigern der an der Verschmelzung beteiligten Rechtsträger ist, wenn sie binnen sechs Monaten nach dem Tag, an dem die Eintragung der Verschmelzung in das Register des Sitzes desjenigen Rechtsträgers, dessen Gläubiger sie sind, als bekannt gemacht gilt, ihren Anspruch nach Grund und Höhe schriftlich anmelden, Sicherheit zu leisten, soweit sie nicht Befriedigung verlangen können. Dieses Recht steht den Gläubigern jedoch nur zu, wenn sie glaubhaft machen, dass durch die Verschmelzung die Erfüllung ihrer Forderung gefährdet wird."
    },
    {
      "date": "2025-10-20",
      "id": "134565",
      "original_text": "Löschungsankündigung\nBerlin Amtsgericht Berlin (Charlottenburg) HRB 206651\nIldiko Bau GmbH – Berlin",
      "type": "Löschungsankündigung",
      "state": "Berlin",
      "amtsgericht": "Amtsgericht Berlin (Charlottenburg)",
      "registernummer": "HRB 206651",
      "registerart": "HRB",
      "company_name": "Ildiko Bau GmbH",
      "company_seat": "Berlin",
      "details": "20.10.2025 (Bekanntmachungsdatum)\n\nBerlin Amtsgericht Berlin (Charlottenburg) HRB 206651\nLöschungsankündigung\n\nIldiko Bau GmbH\nGesellschaft mit beschränkter Haftung\nBerlin\n\nBei der nachstehenden Gesellschaft wird das Amtslöschungsverfahren gemäß § 394 FamFG eingeleitet. Widerspruchsfrist 6 Wochen"
    },
    {
      "date": "2025-10-20",
      "id": "134566",
      "original_text": "Löschungsankündigung\nBrandenburg Amtsgericht Potsdam HRB 26142\nFröhlich Bau-Projekt GmbH – Rangsdorf",
      "type": "Löschungsankündigung",
      "state": "Brandenburg",
      "amtsgericht": "Amtsgericht Potsdam",
      "registernummer": "HRB 26142",
      "registerart": "HRB",
      "company_name": "Fröhlich Bau-Projekt GmbH",
      "company_seat": "Rangsdorf",
      "details": "20.10.2025 (Bekanntmachungsdatum)\n\nBrandenburg Amtsgericht Potsdam HRB 26142\nLöschungsankündigung\n\nFröhlich Bau-Projekt GmbH\nGesellschaft mit beschränkter Haftung\nRangsdorf\n\nBei der nachstehenden Gesellschaft wird das Amtslöschungsverfahren gemäß § 394 FamFG eingeleitet. Widerspruchsfrist: 8 Wochen"
    },
    {
      "date": "2025-10-20",
      "id": "134567",
      "original_text": "Löschungsankündigung\nSachsen Amtsgericht Dresden HRB 36943\nTertius Immorenta GmbH – Großenhain",
      "type": "Löschungsankündigung",
      "state": "Sachsen",
      "amtsgericht": "Amtsgericht Dresden",
      "registernummer": "HRB 36943",
      "registerart": "HRB",
      "company_name": "Tertius Immorenta GmbH",
      "company_seat": "Großenhain",
      "details": "20.10.2025 (Bekanntmachungsdatum)\n\nSachsen Amtsgericht Dresden HRB 36943\nLöschungsankündigung\n\nTertius Immorenta GmbH\nGesellschaft mit beschränkter Haftung\nGroßenhain\n\nDas Registergericht beabsichtigt, die im Handelsregister eingetragene Gesellschaft von Amts wegen nach § 394 FamFG zu löschen. Die Frist zu Erhebung eines Widerspruchs gegen die beabsichtigte Löschung wird auf einen Monat festgesetzt."
    },
    {
      "date": "2025-10-20",
      "id": "134568",
      "original_text": "Löschungsankündigung\nSachsen Amtsgericht Dresden HRB 38619\nsense4energysystems UG (haftungsbeschränkt) – Dresden",
      "type": "Löschungsankündigung",
      "state": "Sachsen",
      "amtsgericht": "Amtsgericht Dresden",
      "registernummer": "HRB 38619",
      "registerart": "HRB",
      "company_name": "sense4energysystems UG (haftungsbeschränkt)",
      "company_seat": "Dresden",
      "details": "20.10.2025 (Bekanntmachungsdatum)\n\nSachsen Amtsgericht Dresden HRB 38619\nLöschungsankündigung\n\nsense4energysystems UG (haftungsbeschränkt)\nGesellschaft mit beschränkter Haftung\nDresden\n\nDas Registergericht beabsichtigt, die im Handelsregister eingetragene Gesellschaft von Amts wegen nach § 394 FamFG zu löschen. Die Frist zu Erhebung eines Widerspruchs gegen die beabsichtigte Löschung wird auf einen Monat festgesetzt."
    },
    {
      "date": "2025-10-20",
      "id": "134569",
      "original_text": "Registerbekanntmachung nach dem Umwandlungsgesetz\nNiedersachsen Amtsgericht Hildesheim HRA 203151\nTanzschule Bodscheller GmbH & Co. KG – Hildesheim",
      "type": "Registerbekanntmachung nach dem Umwandlungsgesetz",
      "state": "Niedersachsen",
      "amtsgericht": "Amtsgericht Hildesheim",
      "registernummer": "HRA 203151",
      "registerart": "HRA",
      "company_name": "Tanzschule Bodscheller GmbH & Co. KG",
      "company_seat": "Hildesheim",
      "details": "20.10.2025 (Bekanntmachungsdatum)\n\nNiedersachsen Amtsgericht Hildesheim HRA 203151\nRegisterbekanntmachung nach dem Umwandlungsgesetz 20.10.2025 (Eintragungsdatum)\n\nTanzschule Bodscheller GmbH & Co. KG\nKommanditgesellschaft\nHildesheim\n\nDen Gläubigern der an der Ausgliederung beteiligten Rechtsträger ist, wenn sie binnen sechs Monaten nach dem Tag, an dem die Eintragung der Ausgliederung in das Register des Sitzes desjenigen Rechtsträgers, dessen Gläubiger sie sind, nach § 19 Abs. 3 UmwG als bekannt gemacht gilt, ihren Anspruch nach Grund und Höhe schriftlich anmelden, Sicherheit zu leisten, soweit sie nicht Befriedigung verlangen können. Dieses Recht steht den Gläubigern jedoch nur zu, wenn sie glaubhaft machen, dass durch die Ausgliederung die Erfüllung der Forderung gefährdet wird."
    },
    {
      "date": "2025-10-20",
      "id": "134570",
      "original_text": "Löschungsankündigung\nNiedersachsen Amtsgericht Osnabrück HRA 202358\nLSP GmbH & Co. KG – Freren",
      "type": "Löschungsankündigung",
      "state": "Niedersachsen",
      "amtsgericht": "Amtsgericht Osnabrück",
      "registernummer": "HRA 202358",
      "registerart": "HRA",
      "company_name": "LSP GmbH & Co. KG",
      "company_seat": "Freren",
      "details": "20.10.2025 (Bekanntmachungsdatum)\n\nNiedersachsen Amtsgericht Osnabrück HRA 202358\nLöschungsankündigung\n\nLSP GmbH & Co. KG\nKommanditgesellschaft\nFreren\n\nDas Registergericht beabsichtigt, die Firma von Amts wegen nach § 394 FamFG wegen Vermögenslosigkeit zu löschen. Die Frist zur Erhebung eines Widerspruchs ist auf 1 Monat ab dieser Registerbekanntmachung festgesetzt."
    },
    {
      "date": "2025-10-20",
      "id": "134571",
      "original_text": "Registerbekanntmachung nach dem Umwandlungsgesetz\nNiedersachsen Amtsgericht Osnabrück HRB 222334\nAGW Elektrotechnik GmbH – Georgsmarienhütte",
      "type": "Registerbekanntmachung nach dem Umwandlungsgesetz",
      "state": "Niedersachsen",
      "amtsgericht": "Amtsgericht Osnabrück",
      "registernummer": "HRB 222334",
      "registerart": "HRB",
      "company_name": "AGW Elektrotechnik GmbH",
      "company_seat": "Georgsmarienhütte",
      "details": "20.10.2025 (Bekanntmachungsdatum)\n\nNiedersachsen Amtsgericht Osnabrück HRB 222334\nRegisterbekanntmachung nach dem Umwandlungsgesetz 20.10.2025 (Eintragungsdatum)\n\nAGW Elektrotechnik GmbH\nGesellschaft mit beschränkter Haftung\nGeorgsmarienhütte\n\nDen Gläubigern der an der formwechselnden Umwandlung beteiligten Rechtsträger ist, wenn sie binnen sechs Monaten nach dem Tag, an dem die Eintragung der Umwandlung in das Register des Sitzes desjenigen Rechtsträgers, dessen Gläubiger sie sind, nach § 19 Abs. 3 UmwG als bekannt gemacht gilt, ihren Anspruch nach Grund und Höhe schriftlich anmelden, Sicherheit zu leisten, soweit sie nicht Befriedigung verlangen können. Dieses Recht steht den Gläubigern jedoch nur zu, wenn sie glaubhaft machen, dass durch die formwechselnde Umwandlung die Erfüllung der Forderung gefährdet wird."
    },
    {
      "date": "2025-10-20",
      "id": "134572",
      "original_text": "Registerbekanntmachung nach dem Umwandlungsgesetz\nNiedersachsen Amtsgericht Walsrode GsR 704\nPowerplant Promotion eGbR – Achim",
      "type": "Registerbekanntmachung nach dem Umwandlungsgesetz",
      "state": "Niedersachsen",
      "amtsgericht": "Amtsgericht Walsrode",
      "registernummer": "GsR 704",
      "registerart": "GsR",
      "company_name": "Powerplant Promotion eGbR",
      "company_seat": "Achim",
      "details": "20.10.2025 (Bekanntmachungsdatum)\n\nNiedersachsen Amtsgericht Walsrode GsR 704\nRegisterbekanntmachung nach dem Umwandlungsgesetz 20.10.2025 (Eintragungsdatum)\n\nPowerplant Promotion eGbR\nGesellschaft bürgerlichen Rechts\nAchim\n\nDen Gläubigern der an der formwechselnden Umwandlung beteiligten Rechtsträger ist, wenn sie binnen sechs Monaten nach dem Tag, an dem die Eintragung der Umwandlung in das Register des Sitzes desjenigen Rechtsträgers, dessen Gläubiger sie sind, nach § 19 Abs. 3 UmwG als bekannt gemacht gilt, ihren Anspruch nach Grund und Höhe schriftlich anmelden, Sicherheit zu leisten, soweit sie nicht Befriedigung verlangen können. Dieses Recht steht den Gläubigern jedoch nur zu, wenn sie glaubhaft machen, dass durch die formwechselnde Umwandlung die Erfüllung der Forderung gefährdet wird."
    },
    {
      "date": "2025-10-20",
      "id": "134573",
      "original_text": "Registerbekanntmachung nach dem Umwandlungsgesetz\nNiedersachsen Amtsgericht Oldenburg (Oldenburg) HRB 221612\nHartwich Holding GmbH – Delmenhorst",
      "type": "Registerbekanntmachung nach dem Umwandlungsgesetz",
      "state": "Niedersachsen",
      "amtsgericht": "Amtsgericht Oldenburg (Oldenburg)",
      "registernummer": "HRB 221612",
      "registerart": "HRB",
      "company_name": "Hartwich Holding GmbH",
      "company_seat": "Delmenhorst",
      "details": "20.10.2025 (Bekanntmachungsdatum)\n\nNiedersachsen Amtsgericht Oldenburg (Oldenburg) HRB 221612\nRegisterbekanntmachung nach dem Umwandlungsgesetz 20.10.2025 (Eintragungsdatum)\n\nHartwich Holding GmbH\nGesellschaft mit beschränkter Haftung\nDelmenhorst\n\nDen Gläubigern der an der Verschmelzung beteiligten Rechtsträger ist, wenn sie binnen sechs Monaten nach dem Tag, an dem die Eintragung der Verschmelzung in das Register des Sitzes desjenigen Rechtsträgers, dessen Gläubiger sie sind, nach § 19  Abs.  3 UmwG als bekannt gemacht gilt, ihren Anspruch nach Grund und Höhe schriftlich anmelden, Sicherheit zu leisten, soweit sie nicht Befriedigung verlangen können. Dieses Recht steht den Gläubigern jedoch nur zu, wenn sie glaubhaft machen, dass durch die Verschmelzung die Erfüllung der Forderung gefährdet wird."
    },
    {
      "date": "2025-10-20",
      "id": "134574",
      "original_text": "Registerbekanntmachung nach dem Umwandlungsgesetz\nNiedersachsen Amtsgericht Walsrode HRB 211757\nPowerplant Promotion GmbH – Achim",
      "type": "Registerbekanntmachung nach dem Umwandlungsgesetz",
      "state": "Niedersachsen",
      "amtsgericht": "Amtsgericht Walsrode",
      "registernummer": "HRB 211757",
      "registerart": "HRB",
      "company_name": "Powerplant Promotion GmbH",
      "company_seat": "Achim",
      "details": "20.10.2025 (Bekanntmachungsdatum)\n\nNiedersachsen Amtsgericht Walsrode HRB 211757\nRegisterbekanntmachung nach dem Umwandlungsgesetz 20.10.2025 (Eintragungsdatum)\n\nPowerplant Promotion GmbH\nGesellschaft mit beschränkter Haftung\nAchim\n\nDen Gläubigern der an der formwechselnden Umwandlung beteiligten Rechtsträger ist, wenn sie binnen sechs Monaten nach dem Tag, an dem die Eintragung der Umwandlung in das Register des Sitzes desjenigen Rechtsträgers, dessen Gläubiger sie sind, nach § 19 Abs. 3 UmwG als bekannt gemacht gilt, ihren Anspruch nach Grund und Höhe schriftlich anmelden, Sicherheit zu leisten, soweit sie nicht Befriedigung verlangen können. Dieses Recht steht den Gläubigern jedoch nur zu, wenn sie glaubhaft machen, dass durch die formwechselnde Umwandlung die Erfüllung der Forderung gefährdet wird."
    },
    {
      "date": "2025-10-20",
      "id": "134575",
      "original_text": "Registerbekanntmachung nach dem Umwandlungsgesetz\nNiedersachsen Amtsgericht Osnabrück HRA 110095 früher Amtsgericht Bad Iburg\nElektro Große-Wördemann GmbH & Co. KG – GM-Hütte",
      "type": "Registerbekanntmachung nach dem Umwandlungsgesetz",
      "state": "Niedersachsen",
      "amtsgericht": "Amtsgericht Osnabrück",
      "registernummer": "HRA 110095",
      "registerart": "HRA",
      "company_name": "Elektro Große-Wördemann GmbH & Co. KG",
      "company_seat": "GM-Hütte",
      "former_amtsgericht": "Bad Iburg",
      "details": "20.10.2025 (Bekanntmachungsdatum)\n\nNiedersachsen Amtsgericht Osnabrück HRA 110095 früher Amtsgericht Bad Iburg\nRegisterbekanntmachung nach dem Umwandlungsgesetz 20.10.2025 (Eintragungsdatum)\n\nElektro Große-Wördemann GmbH & Co. KG\nKommanditgesellschaft\nGM-Hütte\n\nDen Gläubigern der an der formwechselnden Umwandlung beteiligten Rechtsträger ist, wenn sie binnen sechs Monaten nach dem Tag, an dem die Eintragung der Umwandlung in das Register des Sitzes desjenigen Rechtsträgers, dessen Gläubiger sie sind, nach § 19 Abs. 3 UmwG als bekannt gemacht gilt, ihren Anspruch nach Grund und Höhe schriftlich anmelden, Sicherheit zu leisten, soweit sie nicht Befriedigung verlangen können. Dieses Recht steht den Gläubigern jedoch nur zu, wenn sie glaubhaft machen, dass durch die formwechselnde Umwandlung die Erfüllung der Forderung gefährdet wird."
    },
    {
      "date": "2025-10-20",
      "id": "134576",
      "original_text": "Registerbekanntmachung nach dem Umwandlungsgesetz\nNiedersachsen Amtsgericht Osnabrück HRB 222265\nMarel GmbH – Osnabrück",
      "type": "Registerbekanntmachung nach dem Umwandlungsgesetz",
      "state": "Niedersachsen",
      "amtsgericht": "Amtsgericht Osnabrück",
      "registernummer": "HRB 222265",
      "registerart": "HRB",
      "company_name": "Marel GmbH",
      "company_seat": "Osnabrück",
      "details": "20.10.2025 (Bekanntmachungsdatum)\n\nNiedersachsen Amtsgericht Osnabrück HRB 222265\nRegisterbekanntmachung nach dem Umwandlungsgesetz 20.10.2025 (Eintragungsdatum)\n\nMarel GmbH\nGesellschaft mit beschränkter Haftung\nOsnabrück\n\nDen Gläubigern der an der Verschmelzung beteiligten Rechtsträger ist, wenn sie binnen sechs Monaten nach dem Tag, an dem die Eintragung der Verschmelzung in das Register des Sitzes desjenigen Rechtsträgers, dessen Gläubiger sie sind, nach § 19  Abs.  3 UmwG als bekannt gemacht gilt, ihren Anspruch nach Grund und Höhe schriftlich anmelden, Sicherheit zu leisten, soweit sie nicht Befriedigung verlangen können. Dieses Recht steht den Gläubigern jedoch nur zu, wenn sie glaubhaft machen, dass durch die Verschmelzung die Erfüllung der Forderung gefährdet wird."
    },
    {
      "date": "2025-10-20",
      "id": "134577",
      "original_text": "Registerbekanntmachung nach dem Umwandlungsgesetz\nNiedersachsen Amtsgericht Lüneburg HRB 101775 früher Amtsgericht Celle\nKahlke Beteiligungsgesellschaft mbH – Celle",
      "type": "Registerbekanntmachung nach dem Umwandlungsgesetz",
      "state": "Niedersachsen",
      "amtsgericht": "Amtsgericht Lüneburg",
      "registernummer": "HRB 101775",
      "registerart": "HRB",
      "company_name": "Kahlke Beteiligungsgesellschaft mbH",
      "company_seat": "Celle",
      "former_amtsgericht": "Celle",
      "details": "20.10.2025 (Bekanntmachungsdatum)\n\nNiedersachsen Amtsgericht Lüneburg HRB 101775 früher Amtsgericht Celle\nRegisterbekanntmachung nach dem Umwandlungsgesetz 20.10.2025 (Eintragungsdatum)\n\nKahlke Beteiligungsgesellschaft mbH\nGesellschaft mit beschränkter Haftung\nCelle\n\nDen Gläubigern der an der Verschmelzung beteiligten Rechtsträger ist, wenn sie binnen sechs Monaten nach dem Tag, an dem die Eintragung der Verschmelzung in das Register des Sitzes desjenigen Rechtsträgers, dessen Gläubiger sie sind, nach § 19  Abs.  3 UmwG als bekannt gemacht gilt, ihren Anspruch nach Grund und Höhe schriftlich anmelden, Sicherheit zu leisten, soweit sie nicht Befriedigung verlangen können. Dieses Recht steht den Gläubigern jedoch nur zu, wenn sie glaubhaft machen, dass durch die Verschmelzung die Erfüllung der Forderung gefährdet wird."
    },
    {
      "date": "2025-10-20",
      "id": "134578",
      "original_text": "Einreichung neuer Dokumente\nNiedersachsen Amtsgericht Hannover HRB 57893\nexpert Wachstums- und Beteiligungs SE – Langenhagen",
      "type": "Einreichung neuer Dokumente",
      "state": "Niedersachsen",
      "amtsgericht": "Amtsgericht Hannover",
      "registernummer": "HRB 57893",
      "registerart": "HRB",
      "company_name": "expert Wachstums- und Beteiligungs SE",
      "company_seat": "Langenhagen",
      "details": "20.10.2025 (Bekanntmachungsdatum)\n\nNiedersachsen Amtsgericht Hannover HRB 57893\nEinreichung neuer Dokumente\n\nexpert Wachstums- und Beteiligungs SE\nEuropäische Aktiengesellschaft (SE)\nLangenhagen\n\nDie Liste der Mitglieder des Aufsichtsrats wurde beim Registergericht eingereicht."
    },
    {
      "date": "2025-10-20",
      "id": "134579",
      "original_text": "Registerbekanntmachung nach dem Umwandlungsgesetz\nNiedersachsen Amtsgericht Osnabrück HRB 200119\nMarel Management GmbH – Osnabrück",
      "type": "Registerbekanntmachung nach dem Umwandlungsgesetz",
      "state": "Niedersachsen",
      "amtsgericht": "Amtsgericht Osnabrück",
      "registernummer": "HRB 200119",
      "registerart": "HRB",
      "company_name": "Marel Management GmbH",
      "company_seat": "Osnabrück",
      "details": "20.10.2025 (Bekanntmachungsdatum)\n\nNiedersachsen Amtsgericht Osnabrück HRB 200119\nRegisterbekanntmachung nach dem Umwandlungsgesetz 20.10.2025 (Eintragungsdatum)\n\nMarel Management GmbH\nGesellschaft mit beschränkter Haftung\nOsnabrück\n\nDen Gläubigern der an der Verschmelzung beteiligten Rechtsträger ist, wenn sie binnen sechs Monaten nach dem Tag, an dem die Eintragung der Verschmelzung in das Register des Sitzes desjenigen Rechtsträgers, dessen Gläubiger sie sind, nach § 19  Abs.  3 UmwG als bekannt gemacht gilt, ihren Anspruch nach Grund und Höhe schriftlich anmelden, Sicherheit zu leisten, soweit sie nicht Befriedigung verlangen können. Dieses Recht steht den Gläubigern jedoch nur zu, wenn sie glaubhaft machen, dass durch die Verschmelzung die Erfüllung der Forderung gefährdet wird."
    },
    {
      "date": "2025-10-20",
      "id": "134580",
      "original_text": "Registerbekanntmachung nach dem Umwandlungsgesetz\nNiedersachsen Amtsgericht Hannover HRB 205405\nPADMOL MVZ GmbH – Hannover",
      "type": "Registerbekanntmachung nach dem Umwandlungsgesetz",
      "state": "Niedersachsen",
      "amtsgericht": "Amtsgericht Hannover",
      "registernummer": "HRB 205405",
      "registerart": "HRB",
      "company_name": "PADMOL MVZ GmbH",
      "company_seat": "Hannover",
      "details": "20.10.2025 (Bekanntmachungsdatum)\n\nNiedersachsen Amtsgericht Hannover HRB 205405\nRegisterbekanntmachung nach dem Umwandlungsgesetz 20.10.2025 (Eintragungsdatum)\n\nPADMOL MVZ GmbH\nGesellschaft mit beschränkter Haftung\nHannover\n\nDen Gläubigern der an der Verschmelzung beteiligten Rechtsträger ist, wenn sie binnen sechs Monaten nach dem Tag, an dem die Eintragung der Verschmelzung in das Register des Sitzes desjenigen Rechtsträgers, dessen Gläubiger sie sind, nach § 19  Abs.  3 UmwG als bekannt gemacht gilt, ihren Anspruch nach Grund und Höhe schriftlich anmelden, Sicherheit zu leisten, soweit sie nicht Befriedigung verlangen können. Dieses Recht steht den Gläubigern jedoch nur zu, wenn sie glaubhaft machen, dass durch die Verschmelzung die Erfüllung der Forderung gefährdet wird."
    },
    {
      "date": "2025-10-20",
      "id": "134581",
      "original_text": "Registerbekanntmachung nach dem Umwandlungsgesetz\nNiedersachsen Amtsgericht Braunschweig HRB 212569\nAugenärztliche MVZ Holak GmbH – Salzgitter",
      "type": "Registerbekanntmachung nach dem Umwandlungsgesetz",
      "state": "Niedersachsen",
      "amtsgericht": "Amtsgericht Braunschweig",
      "registernummer": "HRB 212569",
      "registerart": "HRB",
      "company_name": "Augenärztliche MVZ Holak GmbH",
      "company_seat": "Salzgitter",
      "details": "20.10.2025 (Bekanntmachungsdatum)\n\nNiedersachsen Amtsgericht Braunschweig HRB 212569\nRegisterbekanntmachung nach dem Umwandlungsgesetz 20.10.2025 (Eintragungsdatum)\n\nAugenärztliche MVZ Holak GmbH\nGesellschaft mit beschränkter Haftung\nSalzgitter\n\nDen Gläubigern der an der formwechselnden Umwandlung beteiligten Rechtsträger ist, wenn sie binnen sechs Monaten nach dem Tag, an dem die Eintragung der Umwandlung in das Register des Sitzes desjenigen Rechtsträgers, dessen Gläubiger sie sind, nach § 19 Abs. 3 UmwG als bekannt gemacht gilt, ihren Anspruch nach Grund und Höhe schriftlich anmelden, Sicherheit zu leisten, soweit sie nicht Befriedigung verlangen können. Dieses Recht steht den Gläubigern jedoch nur zu, wenn sie glaubhaft machen, dass durch die formwechselnde Umwandlung die Erfüllung der Forderung gefährdet wird."
    },
    {
      "date": "2025-10-20",
      "id": "134582",
      "original_text": "Registerbekanntmachung nach dem Umwandlungsgesetz\nNiedersachsen Amtsgericht Hildesheim HRA 203150\nTanzschule Reinhold Bodscheller e.K. – Hildesheim",
      "type": "Registerbekanntmachung nach dem Umwandlungsgesetz",
      "state": "Niedersachsen",
      "amtsgericht": "Amtsgericht Hildesheim",
      "registernummer": "HRA 203150",
      "registerart": "HRA",
      "company_name": "Tanzschule Reinhold Bodscheller e.K.",
      "company_seat": "Hildesheim",
      "details": "20.10.2025 (Bekanntmachungsdatum)\n\nNiedersachsen Amtsgericht Hildesheim HRA 203150\nRegisterbekanntmachung nach dem Umwandlungsgesetz 20.10.2025 (Eintragungsdatum)\n\nTanzschule Reinhold Bodscheller e.K.\nEinzelkaufmann / Einzelkauffrau\nHildesheim\n\nDen Gläubigern der an der Ausgliederung beteiligten Rechtsträger ist, wenn sie binnen sechs Monaten nach dem Tag, an dem die Eintragung der Ausgliederung in das Register des Sitzes desjenigen Rechtsträgers, dessen Gläubiger sie sind, nach § 19 Abs. 3 UmwG als bekannt gemacht gilt, ihren Anspruch nach Grund und Höhe schriftlich anmelden, Sicherheit zu leisten, soweit sie nicht Befriedigung verlangen können. Dieses Recht steht den Gläubigern jedoch nur zu, wenn sie glaubhaft machen, dass durch die Ausgliederung die Erfüllung der Forderung gefährdet wird."
    },
    {
      "date": "2025-10-20",
      "id": "134583",
      "original_text": "Löschungsankündigung\nNiedersachsen Amtsgericht Walsrode HRB 121509\nUNION REISEN Deutschland GmbH – Achim",
      "type": "Löschungsankündigung",
      "state": "Niedersachsen",
      "amtsgericht": "Amtsgericht Walsrode",
      "registernummer": "HRB 121509",
      "registerart": "HRB",
      "company_name": "UNION REISEN Deutschland GmbH",
      "company_seat": "Achim",
      "details": "20.10.2025 (Bekanntmachungsdatum)\n\nNiedersachsen Amtsgericht Walsrode HRB 121509\nLöschungsankündigung\n\nUNION REISEN Deutschland GmbH\nGesellschaft mit beschränkter Haftung\nAchim\n\nDas Registergericht beabsichtigt, die Gesellschaft von Amts wegen nach § 394 FamFG zu löschen. Die Frist zur Erhebung eines Widerspruchs ist auf 1 Monat ab dieser Registerbekanntmachung festgesetzt."
    },
    {
      "date": "2025-10-20",
      "id": "134584",
      "original_text": "Registerbekanntmachung nach dem Umwandlungsgesetz\nNiedersachsen Amtsgericht Hannover HRB 222393\nPaDMoL Service GmbH – Hannover",
      "type": "Registerbekanntmachung nach dem Umwandlungsgesetz",
      "state": "Niedersachsen",
      "amtsgericht": "Amtsgericht Hannover",
      "registernummer": "HRB 222393",
      "registerart": "HRB",
      "company_name": "PaDMoL Service GmbH",
      "company_seat": "Hannover",
      "details": "20.10.2025 (Bekanntmachungsdatum)\n\nNiedersachsen Amtsgericht Hannover HRB 222393\nRegisterbekanntmachung nach dem Umwandlungsgesetz 20.10.2025 (Eintragungsdatum)\n\nPaDMoL Service GmbH\nGesellschaft mit beschränkter Haftung\nHannover\n\nDen Gläubigern der an der Verschmelzung beteiligten Rechtsträger ist, wenn sie binnen sechs Monaten nach dem Tag, an dem die Eintragung der Verschmelzung in das Register des Sitzes desjenigen Rechtsträgers, dessen Gläubiger sie sind, nach § 19  Abs.  3 UmwG als bekannt gemacht gilt, ihren Anspruch nach Grund und Höhe schriftlich anmelden, Sicherheit zu leisten, soweit sie nicht Befriedigung verlangen können. Dieses Recht steht den Gläubigern jedoch nur zu, wenn sie glaubhaft machen, dass durch die Verschmelzung die Erfüllung der Forderung gefährdet wird."
    },
    {
      "date": "2025-10-20",
      "id": "134585",
      "original_text": "Löschungsankündigung\nNiedersachsen Amtsgericht Hildesheim HRB 205133\nGlas G/S Handelsvertretung GmbH – Hehlen",
      "type": "Löschungsankündigung",
      "state": "Niedersachsen",
      "amtsgericht": "Amtsgericht Hildesheim",
      "registernummer": "HRB 205133",
      "registerart": "HRB",
      "company_name": "Glas G/S Handelsvertretung GmbH",
      "company_seat": "Hehlen",
      "details": "20.10.2025 (Bekanntmachungsdatum)\n\nNiedersachsen Amtsgericht Hildesheim HRB 205133\nLöschungsankündigung\n\nGlas G/S Handelsvertretung GmbH\nGesellschaft mit beschränkter Haftung\nHehlen\n\nDas Registergericht beabsichtigt, die Gesellschaft von Amts wegen nach § 394 FamFG zu löschen. Die Frist zur Erhebung eines Widerspruchs ist auf 1 Monat ab dieser Registerbekanntmachung festgesetzt."
    },
    {
      "date": "2025-10-20",
      "id": "134586",
      "original_text": "Löschungsankündigung\nBremen Amtsgericht Bremen HRB 21061\nExcominter GmbH – Bremen",
      "type": "Löschungsankündigung",
      "state": "Bremen",
      "amtsgericht": "Amtsgericht Bremen",
      "registernummer": "HRB 21061",
      "registerart": "HRB",
      "company_name": "Excominter GmbH",
      "company_seat": "Bremen",
      "details": "20.10.2025 (Bekanntmachungsdatum)\n\nBremen Amtsgericht Bremen HRB 21061\nLöschungsankündigung\n\nExcominter GmbH\nGesellschaft mit beschränkter Haftung\nBremen\n\nEs ist beabsichtigt die im Handelsregister eingetragene Gesellschaft von Amts wegen gemäß § 394 FamFG zu löschen. Gegen die Löschung kann beim AG Bremen schriftlich oder zu Protokoll der Geschäftsstelle Widerspruch eingelegt werden. Widerspruchsfrist 4 Wochen."
    },
    {
      "date": "2025-10-20",
      "id": "134587",
      "original_text": "Löschungsankündigung\nBremen Amtsgericht Bremen HRB 28192\nEmpiriko Enterprises GmbH – Bremen",
      "type": "Löschungsankündigung",
      "state": "Bremen",
      "amtsgericht": "Amtsgericht Bremen",
      "registernummer": "HRB 28192",
      "registerart": "HRB",
      "company_name": "Empiriko Enterprises GmbH",
      "company_seat": "Bremen",
      "details": "20.10.2025 (Bekanntmachungsdatum)\n\nBremen Amtsgericht Bremen HRB 28192\nLöschungsankündigung\n\nEmpiriko Enterprises GmbH\nGesellschaft mit beschränkter Haftung\nBremen\n\nEs ist beabsichtigt die im Handelsregister eingetragene Gesellschaft von Amts wegen gemäß § 394 FamFG zu löschen. Gegen die Löschung kann beim AG Bremen schriftlich oder zu Protokoll der Geschäftsstelle Widerspruch eingelegt werden. Widerspruchsfrist 4 Wochen."
    },
    {
      "date": "2025-10-20",
      "id": "134588",
      "original_text": "Einreichung neuer Dokumente\nBremen Amtsgericht Bremen HRB 9430\nBremer Verkehrs- und Beteiligungsgesellschaft mbH – Bremen",
      "type": "Einreichung neuer Dokumente",
      "state": "Bremen",
      "amtsgericht": "Amtsgericht Bremen",
      "registernummer": "HRB 9430",
      "registerart": "HRB",
      "company_name": "Bremer Verkehrs- und Beteiligungsgesellschaft mbH",
      "company_seat": "Bremen",
      "details": "20.10.2025 (Bekanntmachungsdatum)\n\nBremen Amtsgericht Bremen HRB 9430\nEinreichung neuer Dokumente\n\nBremer Verkehrs- und Beteiligungsgesellschaft mbH\nGesellschaft mit beschränkter Haftung\nBremen\n\nAls nicht eingetragen wird bekannt gemacht: Liste des Aufsichtsrats wurde eingereicht."
    },
    {
      "date": "2025-10-20",
      "id": "134589",
      "original_text": "Löschungsankündigung\nBremen Amtsgericht Bremen HRB 32740\nHanseatische Metallgesellschaft m. b. H. – Bremen",
      "type": "Löschungsankündigung",
      "state": "Bremen",
      "amtsgericht": "Amtsgericht Bremen",
      "registernummer": "HRB 32740",
      "registerart": "HRB",
      "company_name": "Hanseatische Metallgesellschaft m. b. H.",
      "company_seat": "Bremen",
      "details": "20.10.2025 (Bekanntmachungsdatum)\n\nBremen Amtsgericht Bremen HRB 32740\nLöschungsankündigung\n\nHanseatische Metallgesellschaft m. b. H.\nGesellschaft mit beschränkter Haftung\nBremen\n\nEs ist beabsichtigt die im Handelsregister eingetragene Gesellschaft von Amts wegen gemäß § 394 FamFG zu löschen. Gegen die Löschung kann beim AG Bremen schriftlich oder zu Protokoll der Geschäftsstelle Widerspruch eingelegt werden. Widerspruchsfrist 4 Wochen."
    },
    {
      "date": "2025-10-20",
      "id": "134590",
      "original_text": "Einreichung neuer Dokumente\nBremen Amtsgericht Bremen HRB 4711\nDeutsche Immobilien Holding Aktiengesellschaft – Bremen",
      "type": "Einreichung neuer Dokumente",
      "state": "Bremen",
      "amtsgericht": "Amtsgericht Bremen",
      "registernummer": "HRB 4711",
      "registerart": "HRB",
      "company_name": "Deutsche Immobilien Holding Aktiengesellschaft",
      "company_seat": "Bremen",
      "details": "20.10.2025 (Bekanntmachungsdatum)\n\nBremen Amtsgericht Bremen HRB 4711\nEinreichung neuer Dokumente\n\nDeutsche Immobilien Holding Aktiengesellschaft\nAktiengesellschaft\nBremen\n\nAls nicht eingetragen wird veröffentlicht: Liste des Aufsichtsrats wurde eingereicht."
    },
    {
      "date": "2025-10-20",
      "id": "134591",
      "original_text": "Registerbekanntmachung nach dem Umwandlungsgesetz\nBremen Amtsgericht Bremen HRB 4711\nDeutsche Immobilien Holding Aktiengesellschaft – Bremen",
      "type": "Registerbekanntmachung nach dem Umwandlungsgesetz",
      "state": "Bremen",
      "amtsgericht": "Amtsgericht Bremen",
      "registernummer": "HRB 4711",
      "registerart": "HRB",
      "company_name": "Deutsche Immobilien Holding Aktiengesellschaft",
      "company_seat": "Bremen",
      "details": "20.10.2025 (Bekanntmachungsdatum)\n\nBremen Amtsgericht Bremen HRB 4711\nRegisterbekanntmachung nach dem Umwandlungsgesetz 17.10.2025 (Eintragungsdatum)\n\nDeutsche Immobilien Holding Aktiengesellschaft\nAktiengesellschaft\nBremen\n\nZu Eintragungsnummer 41 vom 17.10.2025 wird als nicht eingetragen veröffentlicht: Den Gläubigern der an der Verschmelzung beteiligten Rechtsträger ist, wenn sie binnen sechs Monaten nach dem Tag, an dem die Eintragung der Verschmelzung in das Register des Sitzes desjenigen Rechtsträgers, dessen Gläubiger sie sind, als bekannt gemacht gilt, ihren Anspruch nach Grund und Höhe schriftlich anmelden, Sicherheit zu leisten, soweit sie nicht Befriedigung verlangen können. Dieses Recht steht den Gläubigern jedoch nur zu, wenn sie glaubhaft machen, dass durch die Verschmelzung die Erfüllung ihrer Forderung gefährdet wird. Das Recht, Sicherheitsleistung zu verlangen, steht Gläubigern nicht zu, die im Falle der Insolvenz ein Recht auf vorzugsweise Befriedigung aus einer Deckungsmasse haben, die nach gesetzlicher Vorschrift zu ihrem Schutz errichtet und staatlich überwacht ist."
    },
    {
      "date": "2025-10-20",
      "id": "134592",
      "original_text": "Registerbekanntmachung nach dem Umwandlungsgesetz\nBremen Amtsgericht Bremen HRB 4711\nDeutsche Immobilien Holding Aktiengesellschaft – Bremen",
      "type": "Registerbekanntmachung nach dem Umwandlungsgesetz",
      "state": "Bremen",
      "amtsgericht": "Amtsgericht Bremen",
      "registernummer": "HRB 4711",
      "registerart": "HRB",
      "company_name": "Deutsche Immobilien Holding Aktiengesellschaft",
      "company_seat": "Bremen",
      "details": "20.10.2025 (Bekanntmachungsdatum)\n\nBremen Amtsgericht Bremen HRB 4711\nRegisterbekanntmachung nach dem Umwandlungsgesetz 20.10.2025 (Eintragungsdatum)\n\nDeutsche Immobilien Holding Aktiengesellschaft\nAktiengesellschaft\nBremen\n\nZu Eintragungsnummer 42 vom 20.10.2025 wird als nicht eingetragen veröffentlicht: Den Gläubigern der an der Verschmelzung beteiligten Rechtsträger ist, wenn sie binnen sechs Monaten nach dem Tag, an dem die Eintragung der Verschmelzung in das Register des Sitzes desjenigen Rechtsträgers, dessen Gläubiger sie sind, als bekannt gemacht gilt, ihren Anspruch nach Grund und Höhe schriftlich anmelden, Sicherheit zu leisten, soweit sie nicht Befriedigung verlangen können. Dieses Recht steht den Gläubigern jedoch nur zu, wenn sie glaubhaft machen, dass durch die Verschmelzung die Erfüllung ihrer Forderung gefährdet wird. Das Recht, Sicherheitsleistung zu verlangen, steht Gläubigern nicht zu, die im Falle der Insolvenz ein Recht auf vorzugsweise Befriedigung aus einer Deckungsmasse haben, die nach gesetzlicher Vorschrift zu ihrem Schutz errichtet und staatlich überwacht ist."
    },
    {
      "date": "2025-10-20",
      "id": "134593",
      "original_text": "Registerbekanntmachung nach dem Umwandlungsgesetz\nRheinland-Pfalz Amtsgericht Koblenz HRA 23328\nCLM Schiele e.K. – Spessart",
      "type": "Registerbekanntmachung nach dem Umwandlungsgesetz",
      "state": "Rheinland-Pfalz",
      "amtsgericht": "Amtsgericht Koblenz",
      "registernummer": "HRA 23328",
      "registerart": "HRA",
      "company_name": "CLM Schiele e.K.",
      "company_seat": "Spessart",
      "details": "20.10.2025 (Bekanntmachungsdatum)\n\nRheinland-Pfalz Amtsgericht Koblenz HRA 23328\nRegisterbekanntmachung nach dem Umwandlungsgesetz 20.10.2025 (Eintragungsdatum)\n\nCLM Schiele e.K.\nEinzelkaufmann / Einzelkauffrau\nSpessart\n\nAls nicht eingetragen wird veröffentlicht: Den Gläubigern der an der Ausgliederung beteiligten Rechtsträger ist, wenn sie binnen sechs Monaten nac hdem Tag, an dem die Eintragung der Ausgliederung in das Register des Sitzes desjenigen Rechtsträgers,dessen Gläubiger sie sind, nach § 19 Abs. 3 UmwG als bekannt gemacht gilt, ihren Anspruch nach Grund und Höhe schriftlich anmelden, Sicherheit zu leisten, soweit sie nicht Befriedigung verlangen können. Dieses Recht steht den Gläubigern jedoch nur zu, wenn sie glaubhaft machen, dass durch die Ausgliederung die Erfüllung der Forderung gefährdet wird."
    },
    {
      "date": "2025-10-20",
      "id": "134594",
      "original_text": "Einreichung neuer Dokumente\nRheinland-Pfalz Amtsgericht Mainz HRB 23461\nPaX Aktiengesellschaft – Ingelheim am Rhein",
      "type": "Einreichung neuer Dokumente",
      "state": "Rheinland-Pfalz",
      "amtsgericht": "Amtsgericht Mainz",
      "registernummer": "HRB 23461",
      "registerart": "HRB",
      "company_name": "PaX Aktiengesellschaft",
      "company_seat": "Ingelheim am Rhein",
      "details": "20.10.2025 (Bekanntmachungsdatum)\n\nRheinland-Pfalz Amtsgericht Mainz HRB 23461\nEinreichung neuer Dokumente 20.10.2025 (Eintragungsdatum)\n\nPaX Aktiengesellschaft\nAktiengesellschaft\nIngelheim am Rhein\n\nDem Registergericht ist eine neue Liste der Mitglieder des Aufsichtsrates eingereicht worden."
    },
    {
      "date": "2025-10-20",
      "id": "134595",
      "original_text": "Registerbekanntmachung nach dem Umwandlungsgesetz\nRheinland-Pfalz Amtsgericht Wittlich HRA 42104\nBeshoy Matta e. K. – Trier",
      "type": "Registerbekanntmachung nach dem Umwandlungsgesetz",
      "state": "Rheinland-Pfalz",
      "amtsgericht": "Amtsgericht Wittlich",
      "registernummer": "HRA 42104",
      "registerart": "HRA",
      "company_name": "Beshoy Matta e. K.",
      "company_seat": "Trier",
      "details": "20.10.2025 (Bekanntmachungsdatum)\n\nRheinland-Pfalz Amtsgericht Wittlich HRA 42104\nRegisterbekanntmachung nach dem Umwandlungsgesetz 20.10.2025 (Eintragungsdatum)\n\nBeshoy Matta e. K.\nEinzelkaufmann / Einzelkauffrau\nTrier\n\nAls nicht eingetragen wird veröffentlicht: Den Gläubigern der an der Ausgliederung beteiligten Rechtsträger ist, wenn sie binnen sechs Monaten nach dem Tag, an dem die Eintragung der Ausgliederung in das Register des Sitzes desjenigen Rechtsträgers,dessen Gläubiger sie sind, nach § 19 Abs. 3 UmwG als bekannt gemacht gilt, ihren Anspruch nach Grund und Höhe schriftlich anmelden, Sicherheit zu leisten, soweit sie nicht Befriedigung verlangen können. Dieses Recht steht den Gläubigern jedoch nur zu, wenn sie glaubhaft machen, dass durch die Ausgliederung die Erfüllung der Forderung gefährdet wird."
    },
    {
      "date": "2025-10-20",
      "id": "134596",
      "original_text": "Registerbekanntmachung nach dem Umwandlungsgesetz\nRheinland-Pfalz Amtsgericht Koblenz HRB 31415\nCLM Schiele GmbH – Spessart",
      "type": "Registerbekanntmachung nach dem Umwandlungsgesetz",
      "state": "Rheinland-Pfalz",
      "amtsgericht": "Amtsgericht Koblenz",
      "registernummer": "HRB 31415",
      "registerart": "HRB",
      "company_name": "CLM Schiele GmbH",
      "company_seat": "Spessart",
      "details": "20.10.2025 (Bekanntmachungsdatum)\n\nRheinland-Pfalz Amtsgericht Koblenz HRB 31415\nRegisterbekanntmachung nach dem Umwandlungsgesetz 20.10.2025 (Eintragungsdatum)\n\nCLM Schiele GmbH\nGesellschaft mit beschränkter Haftung\nSpessart\n\nAls nicht eingetragen wird veröffentlicht: Den Gläubigern der an der Ausgliederung beteiligten Rechtsträger ist, wenn sie binnen sechs Monaten nach dem Tag, an dem die Eintragung der Ausgliederung in das Register des Sitzes desjenigen Rechtsträgers,dessen Gläubiger sie sind, nach § 19 Abs. 3 UmwG als bekannt gemacht gilt, ihren Anspruch nach Grund und Höhe schriftlich anmelden, Sicherheit zu leisten, soweit sie nicht Befriedigung verlangen können. Dieses Recht steht den Gläubigern jedoch nur zu, wenn sie glaubhaft machen, dass durch die Ausgliederung die Erfüllung der Forderung gefährdet wird."
    },
    {
      "date": "2025-10-20",
      "id": "134597",
      "original_text": "Einreichung neuer Dokumente\nRheinland-Pfalz Amtsgericht Koblenz HRB 10189\nBrohltal-Eisenbahn-Gesellschaft m.b.H. – Niederzissen",
      "type": "Einreichung neuer Dokumente",
      "state": "Rheinland-Pfalz",
      "amtsgericht": "Amtsgericht Koblenz",
      "registernummer": "HRB 10189",
      "registerart": "HRB",
      "company_name": "Brohltal-Eisenbahn-Gesellschaft m.b.H.",
      "company_seat": "Niederzissen",
      "details": "20.10.2025 (Bekanntmachungsdatum)\n\nRheinland-Pfalz Amtsgericht Koblenz HRB 10189\nEinreichung neuer Dokumente\n\nBrohltal-Eisenbahn-Gesellschaft m.b.H.\nGesellschaft mit beschränkter Haftung\nNiederzissen\n\nDem Registergericht ist eine Liste der Mitglieder des Aufsichtsrates eingereicht worden."
    },
    {
      "date": "2025-10-20",
      "id": "134598",
      "original_text": "Registerbekanntmachung nach dem Umwandlungsgesetz\nRheinland-Pfalz Amtsgericht Koblenz HRB 25831\nMeditec Marketingservices im Gesundheitswesen GmbH – Koblenz",
      "type": "Registerbekanntmachung nach dem Umwandlungsgesetz",
      "state": "Rheinland-Pfalz",
      "amtsgericht": "Amtsgericht Koblenz",
      "registernummer": "HRB 25831",
      "registerart": "HRB",
      "company_name": "Meditec Marketingservices im Gesundheitswesen GmbH",
      "company_seat": "Koblenz",
      "details": "20.10.2025 (Bekanntmachungsdatum)\n\nRheinland-Pfalz Amtsgericht Koblenz HRB 25831\nRegisterbekanntmachung nach dem Umwandlungsgesetz 20.10.2025 (Eintragungsdatum)\n\nMeditec Marketingservices im Gesundheitswesen GmbH\nGesellschaft mit beschränkter Haftung\nKoblenz\n\nAls nicht eingetragen wird veröffentlicht: Den Gläubigern der an der Verschmelzung beteiligten Rechtsträger ist, wenn sie binnen sechs Monaten nach dem Tag, an dem die Eintragung der Verschmelzung in das Register des Sitzes desjenigen Rechtsträgers,dessen Gläubiger sie sind, nach § 19 Abs. 3 UmwG als bekannt gemacht gilt, ihren Anspruch nach Grund und Höhe schriftlich anmelden, Sicherheit zu leisten, soweit sie nicht Befriedigung verlangen können. Dieses Recht steht den Gläubigern jedoch nur zu, wenn sie glaubhaft machen, dass durch die Verschmelzung die Erfüllungd er Forderung gefährdet wird."
    },
    {
      "date": "2025-10-20",
      "id": "134599",
      "original_text": "Registerbekanntmachung nach dem Umwandlungsgesetz\nRheinland-Pfalz Amtsgericht Bad Kreuznach HRA 21345\nMarko Schwarz Baumaschinenvermietung e.K. – Idar-Oberstein",
      "type": "Registerbekanntmachung nach dem Umwandlungsgesetz",
      "state": "Rheinland-Pfalz",
      "amtsgericht": "Amtsgericht Bad Kreuznach",
      "registernummer": "HRA 21345",
      "registerart": "HRA",
      "company_name": "Marko Schwarz Baumaschinenvermietung e.K.",
      "company_seat": "Idar-Oberstein",
      "details": "20.10.2025 (Bekanntmachungsdatum)\n\nRheinland-Pfalz Amtsgericht Bad Kreuznach HRA 21345\nRegisterbekanntmachung nach dem Umwandlungsgesetz 20.10.2025 (Eintragungsdatum)\n\nMarko Schwarz Baumaschinenvermietung e.K.\nEinzelkaufmann / Einzelkauffrau\nIdar-Oberstein\n\nAls nicht eingetragen wird veröffentlicht: Den Gläubigern der an der Ausgliederung beteiligten Rechtsträger ist, wenn sie binnen sechs Monaten nach dem Tag, an dem die Eintragung der Ausgliederung in das Register des Sitzes desjenigen Rechtsträgers, dessen Gläubiger sie sind, nach § 19 Abs. 3 UmwG als bekannt gemacht gilt, ihren Anspruch nach Grund und Höhe schriftlich anmelden, Sicherheit zu leisten, soweit sie nicht Befriedigung verlangen können. Dieses Recht steht den Gläubigern jedoch nur zu, wenn sie glaubhaft machen, dass durch die Ausgliederung die Erfüllung der Forderung gefährdet wird."
    },
    {
      "date": "2025-10-20",
      "id": "134600",
      "original_text": "Einreichung neuer Dokumente\nNordrhein-Westfalen Amtsgericht Essen HRB 31673\nBankhaus Bauer Aktiengesellschaft – Essen",
      "type": "Einreichung neuer Dokumente",
      "state": "Nordrhein-Westfalen",
      "amtsgericht": "Amtsgericht Essen",
      "registernummer": "HRB 31673",
      "registerart": "HRB",
      "company_name": "Bankhaus Bauer Aktiengesellschaft",
      "company_seat": "Essen",
      "details": "20.10.2025 (Bekanntmachungsdatum)\n\nNordrhein-Westfalen Amtsgericht Essen HRB 31673\nEinreichung neuer Dokumente\n\nBankhaus Bauer Aktiengesellschaft\nAktiengesellschaft\nEssen\n\nDem Registergericht ist eine neue Liste der Mitglieder des Aufsichtsrates eingereicht worden."
    },
    {
      "date": "2025-10-20",
      "id": "134601",
      "original_text": "Löschungsankündigung\nNordrhein-Westfalen Amtsgericht Dortmund HRA 19088\nDS Autovermietung KG – Castrop-Rauxel",
      "type": "Löschungsankündigung",
      "state": "Nordrhein-Westfalen",
      "amtsgericht": "Amtsgericht Dortmund",
      "registernummer": "HRA 19088",
      "registerart": "HRA",
      "company_name": "DS Autovermietung KG",
      "company_seat": "Castrop-Rauxel",
      "details": "20.10.2025 (Bekanntmachungsdatum)\n\nNordrhein-Westfalen Amtsgericht Dortmund HRA 19088\nLöschungsankündigung\n\nDS Autovermietung KG\nKommanditgesellschaft\nCastrop-Rauxel\n\nDas Registergericht beabsichtigt die Firma von Amts wegen nach § 31 Abs. 2 HGB, 393 FamFG zu löschen. Die Frist zur Erhebung eines Widerspruchs ist auf zwei Monate festgesetzt."
    },
    {
      "date": "2025-10-20",
      "id": "134602",
      "original_text": "Registerbekanntmachung nach dem Umwandlungsgesetz\nNordrhein-Westfalen Amtsgericht Essen HRB 13253\nFinanzInformationsZentrum GmbH – Essen",
      "type": "Registerbekanntmachung nach dem Umwandlungsgesetz",
      "state": "Nordrhein-Westfalen",
      "amtsgericht": "Amtsgericht Essen",
      "registernummer": "HRB 13253",
      "registerart": "HRB",
      "company_name": "FinanzInformationsZentrum GmbH",
      "company_seat": "Essen",
      "details": "20.10.2025 (Bekanntmachungsdatum)\n\nNordrhein-Westfalen Amtsgericht Essen HRB 13253\nRegisterbekanntmachung nach dem Umwandlungsgesetz 20.10.2025 (Eintragungsdatum)\n\nFinanzInformationsZentrum GmbH\nGesellschaft mit beschränkter Haftung\nEssen\n\nDen Gläubigern der an der Verschmelzung beteiligten Rechtsträger ist, wenn sie binnen sechs Monaten nach dem Tag, an dem die Eintragung der Verschmelzung in das Register des Sitzes desjenigen Rechtsträgers, dessen Gläubiger sie sind, nach § 19 Absatz 3 UmwG als bekanntgemacht gilt, ihren Anspruch nach Grund und Höhe schriftlich anmelden, Sicherheit zu leisten, soweit sie nicht Befriedigung verlangen können. Dieses Recht steht den Gläubigern jedoch nur zu, wenn sie glaubhaft machen, dass durch die Verschmelzung die Erfüllung ihrer Forderung gefährdet wird."
    },
    {
      "date": "2025-10-20",
      "id": "134603",
      "original_text": "Registerbekanntmachung nach dem Umwandlungsgesetz\nNordrhein-Westfalen Amtsgericht Dortmund HRB 33322\nCCK Media GmbH – Dortmund",
      "type": "Registerbekanntmachung nach dem Umwandlungsgesetz",
      "state": "Nordrhein-Westfalen",
      "amtsgericht": "Amtsgericht Dortmund",
      "registernummer": "HRB 33322",
      "registerart": "HRB",
      "company_name": "CCK Media GmbH",
      "company_seat": "Dortmund",
      "details": "20.10.2025 (Bekanntmachungsdatum)\n\nNordrhein-Westfalen Amtsgericht Dortmund HRB 33322\nRegisterbekanntmachung nach dem Umwandlungsgesetz 20.10.2025 (Eintragungsdatum)\n\nCCK Media GmbH\nGesellschaft mit beschränkter Haftung\nDortmund\n\nDen Gläubigern der an der Verschmelzung beteiligten Rechtsträger ist, wenn sie binnen sechs Monaten nach dem Tag, an dem die Eintragung der Verschmelzung in das Register des Sitzes desjenigen Rechtsträgers, dessen Gläubiger sie sind, nach § 19 Absatz 3 UmwG als bekanntgemacht gilt, ihren Anspruch nach Grund und Höhe schriftlich anmelden, Sicherheit zu leisten, soweit sie nicht Befriedigung verlangen können. Dieses Recht steht den Gläubigern jedoch nur zu, wenn sie glaubhaft machen, dass durch die Verschmelzung die Erfüllung ihrer Forderung gefährdet wird."
    },
    {
      "date": "2025-10-20",
      "id": "134604",
      "original_text": "Registerbekanntmachung nach dem Umwandlungsgesetz\nNordrhein-Westfalen Amtsgericht Essen HRA 12010\nHOCHTIEF BePo Hessen GmbH & Co. KG – Essen",
      "type": "Registerbekanntmachung nach dem Umwandlungsgesetz",
      "state": "Nordrhein-Westfalen",
      "amtsgericht": "Amtsgericht Essen",
      "registernummer": "HRA 12010",
      "registerart": "HRA",
      "company_name": "HOCHTIEF BePo Hessen GmbH & Co. KG",
      "company_seat": "Essen",
      "details": "20.10.2025 (Bekanntmachungsdatum)\n\nNordrhein-Westfalen Amtsgericht Essen HRA 12010\nRegisterbekanntmachung nach dem Umwandlungsgesetz 20.10.2025 (Eintragungsdatum)\n\nHOCHTIEF BePo Hessen GmbH & Co. KG\nKommanditgesellschaft\nEssen\n\nDen Gläubigern der an der formwechselnden Umwandlung beteiligten Rechtsträger ist, wenn sie binnen sechs Monaten nach dem Tag, an dem die Eintragung der formwechselnden Umwandlung in das Register des Sitzes desjenigen Rechtsträgers, dessen Gläubiger sie sind, nach § 19 Absatz 3 UmwG als bekanntgemacht gilt, ihren Anspruch nach Grund und Höhe schriftlich anmelden, Sicherheit zu leisten, soweit sie nicht Befriedigung verlangen können. Dieses Recht steht den Gläubigern jedoch nur zu, wenn sie glaubhaft machen, dass durch die formwechselnden Umwandlung die Erfüllung ihrer Forderung gefährdet wird."
    },
    {
      "date": "2025-10-20",
      "id": "134605",
      "original_text": "Registerbekanntmachung nach dem Umwandlungsgesetz\nNordrhein-Westfalen Amtsgericht Dortmund HRB 29523\nAriane Seed Labs GmbH – Dortmund",
      "type": "Registerbekanntmachung nach dem Umwandlungsgesetz",
      "state": "Nordrhein-Westfalen",
      "amtsgericht": "Amtsgericht Dortmund",
      "registernummer": "HRB 29523",
      "registerart": "HRB",
      "company_name": "Ariane Seed Labs GmbH",
      "company_seat": "Dortmund",
      "details": "20.10.2025 (Bekanntmachungsdatum)\n\nNordrhein-Westfalen Amtsgericht Dortmund HRB 29523\nRegisterbekanntmachung nach dem Umwandlungsgesetz 20.10.2025 (Eintragungsdatum)\n\nAriane Seed Labs GmbH\nGesellschaft mit beschränkter Haftung\nDortmund\n\nDen Gläubigern der an der Verschmelzung beteiligten Rechtsträger ist, wenn sie binnen sechs Monaten nach dem Tag, an dem die Eintragung der Verschmelzung in das Register des Sitzes derjenigen Rechtsträger deren Gläubiger sie sind, nach § 19 Absatz 3 UmwG als bekanntgemacht gilt, ihren Anspruch nach Grund und Höhe schriftlich anmelden, Sicherheit zu leisten, soweit sie nicht Befriedigung verlangen können. Dieses Recht steht den Gläubigern jedoch nur zu, wenn sie glaubhaft machen, dass durch die Verschmelzung die Erfüllung ihrer Forderung gefährdet wird."
    },
    {
      "date": "2025-10-20",
      "id": "134606",
      "original_text": "Löschungsankündigung\nNordrhein-Westfalen Amtsgericht Neuss HRB 20594\nVesta Gastro GmbH – Neuss",
      "type": "Löschungsankündigung",
      "state": "Nordrhein-Westfalen",
      "amtsgericht": "Amtsgericht Neuss",
      "registernummer": "HRB 20594",
      "registerart": "HRB",
      "company_name": "Vesta Gastro GmbH",
      "company_seat": "Neuss",
      "details": "20.10.2025 (Bekanntmachungsdatum)\n\nNordrhein-Westfalen Amtsgericht Neuss HRB 20594\nLöschungsankündigung 15.10.2025 (Eintragungsdatum)\n\nVesta Gastro GmbH\nGesellschaft mit beschränkter Haftung\nNeuss\n\nDas Registergericht beabsichtigt die Gesellschaft von Amts wegen nach § 394 FamFG zu löschen. Die Frist zur Erhebung eines Widerspruchs ist auf einen Monat festgesetzt. Rechtsbehelfsbelehrung: Gegen diese Verfügung können Sie Widerspruch einlegen. Der Widerspruch ist bei dem Amtsgericht Neuss - Registergericht -, Breite Str. 48, 41460 Neuss schriftlich in deutscher Sprache oder zur Niederschrift der Geschäftsstelle einzulegen. Der Widerspruch kann auch zur Niederschrift der Geschäftsstelle eines jeden Amtsgerichtes abgegeben werden. Die Einlegung ist auch durch Übertragung eines elektronischen Dokuments an die elektronische Poststelle des Gerichts möglich. Das elektronische Dokument muss für die Bearbeitung durch das Gericht geeignet und mit einer qualifizierten elektronischen Signatur der verantwortenden Person versehen sein oder von der verantwortenden Person signiert und auf einem sicheren Übermittlungsweg gemäß § 130a ZPO nach näherer Maßgabe der Verordnung über die technischen Rahmenbedingungen des elektronischen Rechtsverkehrs und über das besondere elektronische Behördenpostfach (BGBl. I, S.3803) eingereicht werden. Weitere Informationen erhalten Sie auf der Internetseite www.justiz.de. Der Widerspruch muss spätestens innerhalb der gesetzten Frist nach der schriftlichen Bekanntgabe der Verfügung bei dem Amtsgericht - Registergericht - Neuss eingegangen sein. Dies gilt auch dann, wenn der Widerspruch zur Niederschrift der Geschäftsstelle eines anderen Amtsgerichtes abgegeben wurde. Die Frist beginnt mit der schriftlichen Bekanntgabe der Verfügung. Die Bekanntgabe ist entweder durch Zustellung oder am dritten Tage nach Aufgabe zur Post bewirkt. Fällt das Ende der Frist auf einen Sonntag, einen allgemeinen Feiertag oder Sonnabend, so endet die Frist mit Ablauf des nächsten Werktages. Der Widerspruch muss die Bezeichnung der angefochtenen Verfügung sowie die Erklärung enthalten, dass Widerspruch gegen diese Verfügung eingelegt wird. Er ist zu unterzeichnen und soll begründet werden."
    },
    {
      "date": "2025-10-20",
      "id": "134607",
      "original_text": "Löschungsankündigung\nNordrhein-Westfalen Amtsgericht Dortmund HRB 25307\nDEXTER vital GmbH – Dortmund",
      "type": "Löschungsankündigung",
      "state": "Nordrhein-Westfalen",
      "amtsgericht": "Amtsgericht Dortmund",
      "registernummer": "HRB 25307",
      "registerart": "HRB",
      "company_name": "DEXTER vital GmbH",
      "company_seat": "Dortmund",
      "details": "20.10.2025 (Bekanntmachungsdatum)\n\nNordrhein-Westfalen Amtsgericht Dortmund HRB 25307\nLöschungsankündigung 20.10.2025 (Eintragungsdatum)\n\nDEXTER vital GmbH\nGesellschaft mit beschränkter Haftung\nDortmund\n\nDas Registergericht beabsichtigt die Gesellschaft von Amts wegen nach § 394 FamFG zu löschen. Die Frist zur Erhebung eines Widerspruchs ist auf zwei Monate festgesetzt."
    },
    {
      "date": "2025-10-20",
      "id": "134608",
      "original_text": "Registerbekanntmachung nach dem Umwandlungsgesetz\nNordrhein-Westfalen Amtsgericht Hagen HRB 9091\nhörconcept Hagen GmbH – Hagen",
      "type": "Registerbekanntmachung nach dem Umwandlungsgesetz",
      "state": "Nordrhein-Westfalen",
      "amtsgericht": "Amtsgericht Hagen",
      "registernummer": "HRB 9091",
      "registerart": "HRB",
      "company_name": "hörconcept Hagen GmbH",
      "company_seat": "Hagen",
      "details": "20.10.2025 (Bekanntmachungsdatum)\n\nNordrhein-Westfalen Amtsgericht Hagen HRB 9091\nRegisterbekanntmachung nach dem Umwandlungsgesetz 20.10.2025 (Eintragungsdatum)\n\nhörconcept Hagen GmbH\nGesellschaft mit beschränkter Haftung\nHagen\n\nDen Gläubigern der an der Verschmelzung beteiligten Rechtsträger ist, wenn sie binnen sechs Monaten nach dem Tag, an dem die Eintragung der Verschmelzung in das Register des Sitzes derjenigen Rechtsträger deren Gläubiger sie sind, nach § 19 Absatz 3 UmwG als bekanntgemacht gilt, ihren Anspruch nach Grund und Höhe schriftlich anmelden, Sicherheit zu leisten, soweit sie nicht Befriedigung verlangen können. Dieses Recht steht den Gläubigern jedoch nur zu, wenn sie glaubhaft machen, dass durch die Verschmelzung die Erfüllung ihrer Forderung gefährdet wird."
    },
    {
      "date": "2025-10-20",
      "id": "134609",
      "original_text": "Registerbekanntmachung nach dem Umwandlungsgesetz\nNordrhein-Westfalen Amtsgericht Arnsberg HRA 5769\nHeizung - Sanitär GÖRDES e. K. Inh. Alexander Schmidt – Schmallenberg",
      "type": "Registerbekanntmachung nach dem Umwandlungsgesetz",
      "state": "Nordrhein-Westfalen",
      "amtsgericht": "Amtsgericht Arnsberg",
      "registernummer": "HRA 5769",
      "registerart": "HRA",
      "company_name": "Heizung - Sanitär GÖRDES e. K. Inh. Alexander Schmidt",
      "company_seat": "Schmallenberg",
      "details": "20.10.2025 (Bekanntmachungsdatum)\n\nNordrhein-Westfalen Amtsgericht Arnsberg HRA 5769\nRegisterbekanntmachung nach dem Umwandlungsgesetz 20.10.2025 (Eintragungsdatum)\n\nHeizung - Sanitär GÖRDES e. K. Inh. Alexander Schmidt\nEinzelkaufmann / Einzelkauffrau\nSchmallenberg\n\nDen Gläubigern der an der Ausgliederung beteiligten Rechtsträger ist, wenn sie binnen sechs Monaten nach dem Tag, an dem die Eintragung der Ausgliederung in das Register des Sitzes desjenigen Rechtsträgers, dessen Gläubiger sie sind, nach § 19 Absatz 3 UmwG als bekanntgemacht gilt, ihren Anspruch nach Grund und Höhe schriftlich anmelden, Sicherheit zu leisten, soweit sie nicht Befriedigung verlangen können. Dieses Recht steht den Gläubigern jedoch nur zu, wenn sie glaubhaft machen, dass durch die Ausgliederung die Erfüllung ihrer Forderung gefährdet wird."
    },
    {
      "date": "2025-10-20",
      "id": "134610",
      "original_text": "Registerbekanntmachung nach dem Umwandlungsgesetz\nNordrhein-Westfalen Amtsgericht Gütersloh HRB 14061\nHartkämper Gartenbau GmbH – Gütersloh",
      "type": "Registerbekanntmachung nach dem Umwandlungsgesetz",
      "state": "Nordrhein-Westfalen",
      "amtsgericht": "Amtsgericht Gütersloh",
      "registernummer": "HRB 14061",
      "registerart": "HRB",
      "company_name": "Hartkämper Gartenbau GmbH",
      "company_seat": "Gütersloh",
      "details": "20.10.2025 (Bekanntmachungsdatum)\n\nNordrhein-Westfalen Amtsgericht Gütersloh HRB 14061\nRegisterbekanntmachung nach dem Umwandlungsgesetz 20.10.2025 (Eintragungsdatum)\n\nHartkämper Gartenbau GmbH\nGesellschaft mit beschränkter Haftung\nGütersloh\n\nDen Gläubigern der an der Ausgliederung beteiligten Rechtsträger ist, wenn sie binnen sechs Monaten nach dem Tag, an dem die Eintragung der Ausgliederung in das Register des Sitzes desjenigen Rechtsträgers, dessen Gläubiger sie sind, nach § 19 Absatz 3 UmwG als bekanntgemacht gilt, ihren Anspruch nach Grund und Höhe schriftlich anmelden, Sicherheit zu leisten, soweit sie nicht Befriedigung verlangen können. Dieses Recht steht den Gläubigern jedoch nur zu, wenn sie glaubhaft machen, dass durch die Ausgliederung die Erfüllung ihrer Forderung gefährdet wird."
    },
    {
      "date": "2025-10-20",
      "id": "134611",
      "original_text": "Registerbekanntmachung nach dem Umwandlungsgesetz\nNordrhein-Westfalen Amtsgericht Bonn GsR 540\nWillms & Schömer eGbR – Euskirchen",
      "type": "Registerbekanntmachung nach dem Umwandlungsgesetz",
      "state": "Nordrhein-Westfalen",
      "amtsgericht": "Amtsgericht Bonn",
      "registernummer": "GsR 540",
      "registerart": "GsR",
      "company_name": "Willms & Schömer eGbR",
      "company_seat": "Euskirchen",
      "details": "20.10.2025 (Bekanntmachungsdatum)\n\nNordrhein-Westfalen Amtsgericht Bonn GsR 540\nRegisterbekanntmachung nach dem Umwandlungsgesetz 20.10.2025 (Eintragungsdatum)\n\nWillms & Schömer eGbR\nGesellschaft bürgerlichen Rechts\nEuskirchen\n\nDen Gläubigern der an der formwechselnden Umwandlung beteiligten Rechtsträger ist, wenn sie binnen sechs Monaten nach dem Tag, an dem die Eintragung der formwechselnden Umwandlung in das Register des Sitzes desjenigen Rechtsträgers, dessen Gläubiger sie sind, nach § 19 Absatz 3 UmwG als bekanntgemacht gilt, ihren Anspruch nach Grund und Höhe schriftlich anmelden, Sicherheit zu leisten, soweit sie nicht Befriedigung verlangen können. Dieses Recht steht den Gläubigern jedoch nur zu, wenn sie glaubhaft machen, dass durch die formwechselnden Umwandlung die Erfüllung ihrer Forderung gefährdet wird."
    },
    {
      "date": "2025-10-20",
      "id": "134612",
      "original_text": "Löschungsankündigung\nNordrhein-Westfalen Amtsgericht Köln HRB 111774\nZK Baudienstleistungs GmbH – Leverkusen",
      "type": "Löschungsankündigung",
      "state": "Nordrhein-Westfalen",
      "amtsgericht": "Amtsgericht Köln",
      "registernummer": "HRB 111774",
      "registerart": "HRB",
      "company_name": "ZK Baudienstleistungs GmbH",
      "company_seat": "Leverkusen",
      "details": "20.10.2025 (Bekanntmachungsdatum)\n\nNordrhein-Westfalen Amtsgericht Köln HRB 111774\nLöschungsankündigung\n\nZK Baudienstleistungs GmbH\nGesellschaft mit beschränkter Haftung\nLeverkusen\n\nDas Registergericht beabsichtigt die Gesellschaft von Amts wegen nach § 394 FamFG zu löschen. Die Frist zur Erhebung eines Widerspruchs ist auf einen Monat festgesetzt."
    },
    {
      "date": "2025-10-20",
      "id": "134613",
      "original_text": "Einreichung neuer Dokumente\nNordrhein-Westfalen Amtsgericht Duisburg HRB 14225\nSWB - Service - Wohnungsvermietungs- und -baugesellschaft mbH – Mülheim an der Ruhr",
      "type": "Einreichung neuer Dokumente",
      "state": "Nordrhein-Westfalen",
      "amtsgericht": "Amtsgericht Duisburg",
      "registernummer": "HRB 14225",
      "registerart": "HRB",
      "company_name": "SWB - Service - Wohnungsvermietungs- und -baugesellschaft mbH",
      "company_seat": "Mülheim an der Ruhr",
      "details": "20.10.2025 (Bekanntmachungsdatum)\n\nNordrhein-Westfalen Amtsgericht Duisburg HRB 14225\nEinreichung neuer Dokumente\n\nSWB - Service - Wohnungsvermietungs- und -baugesellschaft mbH\nGesellschaft mit beschränkter Haftung\nMülheim an der Ruhr\n\nDem Registergericht ist eine Liste der Mitglieder des Aufsichtsrates eingereicht worden."
    },
    {
      "date": "2025-10-20",
      "id": "134614",
      "original_text": "Registerbekanntmachung nach dem Umwandlungsgesetz\nNordrhein-Westfalen Amtsgericht Essen HRB 27694\nHOCHTIEF BePo Hessen GmbH – Essen",
      "type": "Registerbekanntmachung nach dem Umwandlungsgesetz",
      "state": "Nordrhein-Westfalen",
      "amtsgericht": "Amtsgericht Essen",
      "registernummer": "HRB 27694",
      "registerart": "HRB",
      "company_name": "HOCHTIEF BePo Hessen GmbH",
      "company_seat": "Essen",
      "details": "20.10.2025 (Bekanntmachungsdatum)\n\nNordrhein-Westfalen Amtsgericht Essen HRB 27694\nRegisterbekanntmachung nach dem Umwandlungsgesetz 20.10.2025 (Eintragungsdatum)\n\nHOCHTIEF BePo Hessen GmbH\nGesellschaft mit beschränkter Haftung\nEssen\n\nDen Gläubigern der an der formwechselnden Umwandlung beteiligten Rechtsträger ist, wenn sie binnen sechs Monaten nach dem Tag, an dem die Eintragung der formwechselnden Umwandlung in das Register des Sitzes desjenigen Rechtsträgers, dessen Gläubiger sie sind, nach § 19 Absatz 3 UmwG als bekanntgemacht gilt, ihren Anspruch nach Grund und Höhe schriftlich anmelden, Sicherheit zu leisten, soweit sie nicht Befriedigung verlangen können. Dieses Recht steht den Gläubigern jedoch nur zu, wenn sie glaubhaft machen, dass durch die formwechselnden Umwandlung die Erfüllung ihrer Forderung gefährdet wird."
    },
    {
      "date": "2025-10-20",
      "id": "134615",
      "original_text": "Löschungsankündigung\nNordrhein-Westfalen Amtsgericht Neuss HRB 21906\nMedkommerz GmbH – Neuss",
      "type": "Löschungsankündigung",
      "state": "Nordrhein-Westfalen",
      "amtsgericht": "Amtsgericht Neuss",
      "registernummer": "HRB 21906",
      "registerart": "HRB",
      "company_name": "Medkommerz GmbH",
      "company_seat": "Neuss",
      "details": "20.10.2025 (Bekanntmachungsdatum)\n\nNordrhein-Westfalen Amtsgericht Neuss HRB 21906\nLöschungsankündigung 15.10.2025 (Eintragungsdatum)\n\nMedkommerz GmbH\nGesellschaft mit beschränkter Haftung\nNeuss\n\nDas Registergericht beabsichtigt die Gesellschaft von Amts wegen nach § 394 FamFG zu löschen. Die Frist zur Erhebung eines Widerspruchs ist auf einen Monat festgesetzt. Rechtsbehelfsbelehrung: Gegen diese Verfügung können Sie Widerspruch einlegen. Der Widerspruch ist bei dem Amtsgericht Neuss - Registergericht -, Breite Str. 48, 41460 Neuss schriftlich in deutscher Sprache oder zur Niederschrift der Geschäftsstelle einzulegen. Der Widerspruch kann auch zur Niederschrift der Geschäftsstelle eines jeden Amtsgerichtes abgegeben werden. Die Einlegung ist auch durch Übertragung eines elektronischen Dokuments an die elektronische Poststelle des Gerichts möglich. Das elektronische Dokument muss für die Bearbeitung durch das Gericht geeignet und mit einer qualifizierten elektronischen Signatur der verantwortenden Person versehen sein oder von der verantwortenden Person signiert und auf einem sicheren Übermittlungsweg gemäß § 130a ZPO nach näherer Maßgabe der Verordnung über die technischen Rahmenbedingungen des elektronischen Rechtsverkehrs und über das besondere elektronische Behördenpostfach (BGBl. I, S.3803) eingereicht werden. Weitere Informationen erhalten Sie auf der Internetseite www.justiz.de. Der Widerspruch muss spätestens innerhalb der gesetzten Frist nach der schriftlichen Bekanntgabe der Verfügung bei dem Amtsgericht - Registergericht - Neuss eingegangen sein. Dies gilt auch dann, wenn der Widerspruch zur Niederschrift der Geschäftsstelle eines anderen Amtsgerichtes abgegeben wurde. Die Frist beginnt mit der schriftlichen Bekanntgabe der Verfügung. Die Bekanntgabe ist entweder durch Zustellung oder am dritten Tage nach Aufgabe zur Post bewirkt. Fällt das Ende der Frist auf einen Sonntag, einen allgemeinen Feiertag oder Sonnabend, so endet die Frist mit Ablauf des nächsten Werktages. Der Widerspruch muss die Bezeichnung der angefochtenen Verfügung sowie die Erklärung enthalten, dass Widerspruch gegen diese Verfügung eingelegt wird. Er ist zu unterzeichnen und soll begründet werden."
    },
    {
      "date": "2025-10-20",
      "id": "134616",
      "original_text": "Registerbekanntmachung nach dem Umwandlungsgesetz\nNordrhein-Westfalen Amtsgericht Essen PR 5216\ndhs steuerberater wirtschaftsprüfer rechtsanwälte demant homburg schäfer und partner PartG mbB – Lemgo",
      "type": "Registerbekanntmachung nach dem Umwandlungsgesetz",
      "state": "Nordrhein-Westfalen",
      "amtsgericht": "Amtsgericht Essen",
      "registernummer": "PR 5216",
      "registerart": "PR",
      "company_name": "dhs steuerberater wirtschaftsprüfer rechtsanwälte demant homburg schäfer und partner PartG mbB",
      "company_seat": "Lemgo",
      "details": "20.10.2025 (Bekanntmachungsdatum)\n\nNordrhein-Westfalen Amtsgericht Essen PR 5216\nRegisterbekanntmachung nach dem Umwandlungsgesetz 20.10.2025 (Eintragungsdatum)\n\ndhs steuerberater wirtschaftsprüfer rechtsanwälte demant homburg schäfer und partner PartG mbB\nPartnerschaftsgesellschaft\nLemgo\n\nDen Gläubigern der an der Verschmelzung beteiligten Rechtsträger ist, wenn sie binnen sechs Monaten nach dem Tag, an dem die Eintragung der Verschmelzung in das Register des Sitzes desjenigen Rechtsträgers, dessen Gläubiger sie sind, nach § 19 Absatz 3 UmwG als bekanntgemacht gilt, ihren Anspruch nach Grund und Höhe schriftlich anmelden, Sicherheit zu leisten, soweit sie nicht Befriedigung verlangen können. Dieses Recht steht den Gläubigern jedoch nur zu, wenn sie glaubhaft machen, dass durch die Verschmelzung die Erfüllung ihrer Forderung gefährdet wird."
    },
    {
      "date": "2025-10-20",
      "id": "134617",
      "original_text": "Löschungsankündigung\nNordrhein-Westfalen Amtsgericht Duisburg HRA 8047\nConcordia Bau und Boden AG & Co. 6. Immobilien-Fonds-Gesellschaft KG – Oberhausen",
      "type": "Löschungsankündigung",
      "state": "Nordrhein-Westfalen",
      "amtsgericht": "Amtsgericht Duisburg",
      "registernummer": "HRA 8047",
      "registerart": "HRA",
      "company_name": "Concordia Bau und Boden AG & Co. 6. Immobilien-Fonds-Gesellschaft KG",
      "company_seat": "Oberhausen",
      "details": "20.10.2025 (Bekanntmachungsdatum)\n\nNordrhein-Westfalen Amtsgericht Duisburg HRA 8047\nLöschungsankündigung\n\nConcordia Bau und Boden AG & Co. 6. Immobilien-Fonds-Gesellschaft KG\nKommanditgesellschaft\nOberhausen\n\nHRA 8047, Concordia Bau und Boden AG & Co. 6. Immobilien-Fonds-Gesellschaft KG , soll von Amts wegen gemäß §§ 31 Abs. 2, 6 HGB, 393 FamFG gelöscht werden.\nDie Frist zur Erhebung eines Widerspruchs gegen die beabsichtigte Löschung von Amts wegen ist auf drei Monate festgesetzt.\n\nRechtsbehelfsbelehrung\nGegen diese Verfügung können Sie Widerspruch einlegen.\nDer Widerspruch ist bei dem Amtsgericht -Registergericht- Duisburg, Kardinal-Galen-Str. 124-132, 47058 Duisburg, schriftlich in deutscher Sprache oder zur Niederschrift der Geschäftsstelle einzulegen. Der Widerspruch kann auch zur Niederschrift der Geschäftsstelle eines jeden Amtsgerichtes abgegeben werden.\n\nDer Widerspruch muss spätestens innerhalb der gesetzten Frist nach der schriftlichen Bekanntgabe der Verfügung bei dem Amtsgericht Duisburg eingegangen sein. Dies gilt auch dann, wenn der Widerspruch zur Niederschrift der Geschäftsstelle eines anderen Amtsgerichtes abgegeben wurde. Die Frist beginnt mit der schriftlichen Bekanntgabe der Verfügung.\n\nDer Widerspruch muss die Bezeichnung der angefochtenen Verfügung sowie die Erklärung enthalten, dass Widerspruch gegen diese Verfügung eingelegt wird. Er ist zu unterzeichnen und soll begründet werden.\n\nDie Einlegung ist auch durch Übertragung eines elektronischen Dokuments an die elektronische Poststelle des Gerichts möglich. Das elektronische Dokument muss für die Bearbeitung durch das Gericht geeignet und mit einer qualifizierten elektronischen Signatur der verantwortenden Person versehen sein oder von der verantwortenden Person signiert und auf einem sicheren Übermittlungsweg gemäß § 130 a ZPO nach näherer Maßgabe der Verordnung über die technischen Rahmenbedingungen des elektronischen Rechtsverkehrs und über das besondere elektronische Behördenpostfach (BGBl. 2017 I, S. 3803) eingereicht werden. Weitere Informationen erhalten Sie auf der Internetseite www.justiz.de."
    },
    {
      "date": "2025-10-20",
      "id": "134618",
      "original_text": "Löschungsankündigung\nNordrhein-Westfalen Amtsgericht Neuss HRB 19872\nQuickool GmbH – Neuss",
      "type": "Löschungsankündigung",
      "state": "Nordrhein-Westfalen",
      "amtsgericht": "Amtsgericht Neuss",
      "registernummer": "HRB 19872",
      "registerart": "HRB",
      "company_name": "Quickool GmbH",
      "company_seat": "Neuss",
      "details": "20.10.2025 (Bekanntmachungsdatum)\n\nNordrhein-Westfalen Amtsgericht Neuss HRB 19872\nLöschungsankündigung 20.10.2025 (Eintragungsdatum)\n\nQuickool GmbH\nGesellschaft mit beschränkter Haftung\nNeuss\n\nEs ist beabsichtigt, die Gesellschaft wegen Vermögenslosigkeit aufgrund des § 394 Abs. 1 FamFG zu löschen. Frist zur Geltendmachung eines Widerspruchs: 1 Monat.\n\nRechtsbehelfsbelehrung:\nGegen diese Verfügung können Sie Widerspruch einlegen.\nDer Widerspruch ist bei dem Amtsgericht Neuss - Registergericht -, Breite Str. 48, 41460 Neuss schriftlich in deutscher Sprache oder zur Niederschrift der Geschäftsstelle einzulegen.\nDer Widerspruch kann auch zur Niederschrift der Geschäftsstelle eines jeden Amtsgerichtes abgegeben werden.\nDie Einlegung ist auch durch Übertragung eines elektronischen Dokuments an die elektronische Poststelle des Gerichts möglich. Das elektronische Dokument muss für die Bearbeitung durch das Gericht geeignet und mit einer qualifizierten elektronischen Signatur der verantwortenden Person versehen sein oder von der verantwortenden Person signiert und auf einem sicheren Übermittlungsweg gemäß § 130a ZPO nach näherer Maßgabe der Verordnung über die technischen Rahmenbedingungen des elektronischen Rechtsverkehrs und über das besondere elektronische Behördenpostfach (BGBl. I, S.3803) eingereicht werden. Weitere Informationen erhalten Sie auf der Internetseite www.justiz.de.\nDer Widerspruch muss spätestens innerhalb der gesetzten Frist nach der schriftlichen Bekanntgabe der Verfügung bei dem Amtsgericht - Registergericht - Neuss eingegangen sein. Dies gilt auch dann, wenn der Widerspruch zur Niederschrift der Geschäftsstelle eines anderen Amtsgerichtes abgegeben wurde. Die Frist beginnt mit der schriftlichen Bekanntgabe der Verfügung. Die Bekanntgabe ist entweder durch Zustellung oder am dritten Tage nach Aufgabe zur Post bewirkt. Fällt das Ende der Frist auf einen Sonntag, einen allgemeinen Feiertag oder Sonnabend, so endet die Frist mit Ablauf des nächsten Werktages.\n\nDer Widerspruch muss die Bezeichnung der angefochtenen Verfügung sowie die Erklärung enthalten, dass Widerspruch gegen diese Verfügung eingelegt wird. Er ist zu unterzeichnen und soll begründet werden."
    },
    {
      "date": "2025-10-20",
      "id": "134619",
      "original_text": "Registerbekanntmachung nach dem Umwandlungsgesetz\nNordrhein-Westfalen Amtsgericht Duisburg HRA 13734\nAIP GmbH & Co. KG – Oberhausen",
      "type": "Registerbekanntmachung nach dem Umwandlungsgesetz",
      "state": "Nordrhein-Westfalen",
      "amtsgericht": "Amtsgericht Duisburg",
      "registernummer": "HRA 13734",
      "registerart": "HRA",
      "company_name": "AIP GmbH & Co. KG",
      "company_seat": "Oberhausen",
      "details": "20.10.2025 (Bekanntmachungsdatum)\n\nNordrhein-Westfalen Amtsgericht Duisburg HRA 13734\nRegisterbekanntmachung nach dem Umwandlungsgesetz 20.10.2025 (Eintragungsdatum)\n\nAIP GmbH & Co. KG\nKommanditgesellschaft\nOberhausen\n\nDie Gesellschaft hat Gläubigern, deren Forderungen vor dieser Bekanntmachung begründet worden sind, Sicherheit zu leisten, soweit sie nicht Befriedigung verlangen können, wenn sie sich binnen sechs Monaten zu diesem Zweck melden."
    },
    {
      "date": "2025-10-20",
      "id": "134620",
      "original_text": "Registerbekanntmachung nach dem Umwandlungsgesetz\nNordrhein-Westfalen Amtsgericht Bielefeld HRB 46451\nWohnstift Salzburg gGmbH – Bielefeld",
      "type": "Registerbekanntmachung nach dem Umwandlungsgesetz",
      "state": "Nordrhein-Westfalen",
      "amtsgericht": "Amtsgericht Bielefeld",
      "registernummer": "HRB 46451",
      "registerart": "HRB",
      "company_name": "Wohnstift Salzburg gGmbH",
      "company_seat": "Bielefeld",
      "details": "20.10.2025 (Bekanntmachungsdatum)\n\nNordrhein-Westfalen Amtsgericht Bielefeld HRB 46451\nRegisterbekanntmachung nach dem Umwandlungsgesetz 20.10.2025 (Eintragungsdatum)\n\nWohnstift Salzburg gGmbH\nGesellschaft mit beschränkter Haftung\nBielefeld\n\nDen Gläubigern des an der formwechselnden Umwandlung beteiligten Rechtsträgers ist, wenn sie binnen sechs Monaten nach dem Tag, an dem die Eintragung der formwechselnden Umwandlung in das Register des Sitzes desjenigen Rechtsträgers, dessen Gläubiger sie sind, nach § 19 Absatz 3 UmwG als bekanntgemacht gilt, ihren Anspruch nach Grund und Höhe schriftlich anmelden, Sicherheit zu leisten, soweit sie nicht Befriedigung verlangen können. Dieses Recht steht den Gläubigern jedoch nur zu, wenn sie glaubhaft machen, dass durch die formwechselnde Umwandlung die Erfüllung ihrer Forderung gefährdet wird."
    },
    {
      "date": "2025-10-20",
      "id": "134621",
      "original_text": "Löschungsankündigung\nNordrhein-Westfalen Amtsgericht Siegburg HRB 12798\nBackWelt UG (haftungsbeschränkt) – Troisdorf",
      "type": "Löschungsankündigung",
      "state": "Nordrhein-Westfalen",
      "amtsgericht": "Amtsgericht Siegburg",
      "registernummer": "HRB 12798",
      "registerart": "HRB",
      "company_name": "BackWelt UG (haftungsbeschränkt)",
      "company_seat": "Troisdorf",
      "details": "20.10.2025 (Bekanntmachungsdatum)\n\nNordrhein-Westfalen Amtsgericht Siegburg HRB 12798\nLöschungsankündigung\n\nBackWelt UG (haftungsbeschränkt)\nGesellschaft mit beschränkter Haftung\nTroisdorf\n\nDas Registergericht hat glaubhafte Kenntnis erlangt, dass die Gesellschaft vermögenslos geworden ist.\n\nEs ist daher beabsichtigt, die Gesellschaft nach § 394 FamFG im Handelsregister wegen Vermögenslosigkeit zu löschen.\nEinwände gegen die Löschung sind durch Widerspruch binnen einer Frist von 3 Monaten geltend zu machen, andernfalls die Löschung erfolgen wird.\n\nEinzulegen ist der Widerspruch bei dem Amtsgericht Siegburg, Neue Poststraße 16, 53721 Siegburg, und zwar entweder schriftlich in deutscher Sprache oder mündlich zur Niederschrift der Geschäftsstelle. Der Widerspruch kann auch zur Niederschrift der Geschäftsstelle eines jeden Amtsgerichts abgegeben werden. Der Widerspruch ist binnen der in der Verfügung bestimmten Frist einzulegen. Die Frist ist nur gewahrt, wenn der Widerspruch rechtzeitig bei dem Amtsgericht Siegburg eingeht, auch wenn der Widerspruch zur Niederschrift der Geschäftsstelle eines anderen Amtsgerichts abgegeben wurde. Die Frist beginnt jeweils mit der schriftlichen Bekanntgabe der Verfügung an die Beteiligten. Kann die schriftliche Bekanntgabe an einen Beteiligten nicht bewirkt werden, beginnt die Frist spätestens mit Ablauf von fünf Monaten nach Erlass der Verfügung. Die Bekanntgabe ist entweder durch Zustellung oder am dritten Tage nach Aufgabe zur Post bewirkt. Sofern die Löschung noch nicht erfolgt ist, kann der Widerspruch auch noch nach Ablauf der Frist eingelegt werden. Fällt das Ende der Frist auf einen Sonnabend, einen Sonntag oder einen allgemeinen Feiertag, endet die Frist mit Ablauf des nächsten Werktages. Der Widerspruch ist zu unterzeichnen. Eine Begründung des Widerspruchs ist nicht vorgeschrieben."
    },
    {
      "date": "2025-10-20",
      "id": "134622",
      "original_text": "Löschungsankündigung\nNordrhein-Westfalen Amtsgericht Münster HRB 20682\nBCS Dienstleistungen GmbH – Münster",
      "type": "Löschungsankündigung",
      "state": "Nordrhein-Westfalen",
      "amtsgericht": "Amtsgericht Münster",
      "registernummer": "HRB 20682",
      "registerart": "HRB",
      "company_name": "BCS Dienstleistungen GmbH",
      "company_seat": "Münster",
      "details": "20.10.2025 (Bekanntmachungsdatum)\n\nNordrhein-Westfalen Amtsgericht Münster HRB 20682\nLöschungsankündigung\n\nBCS Dienstleistungen GmbH\nGesellschaft mit beschränkter Haftung\nMünster\n\nDas Registergericht beabsichtigt die Gesellschaft von Amts wegen nach § 394 FamFG zu löschen. Die Frist zur Erhebung eines Widerspruchs ist auf einen Monat festgesetzt."
    },
    {
      "date": "2025-10-20",
      "id": "134623",
      "original_text": "Einreichung neuer Dokumente\nNordrhein-Westfalen Amtsgericht Mönchengladbach HRB 4484\nSantander Consumer Holding GmbH – Mönchengladbach",
      "type": "Einreichung neuer Dokumente",
      "state": "Nordrhein-Westfalen",
      "amtsgericht": "Amtsgericht Mönchengladbach",
      "registernummer": "HRB 4484",
      "registerart": "HRB",
      "company_name": "Santander Consumer Holding GmbH",
      "company_seat": "Mönchengladbach",
      "details": "20.10.2025 (Bekanntmachungsdatum)\n\nNordrhein-Westfalen Amtsgericht Mönchengladbach HRB 4484\nEinreichung neuer Dokumente\n\nSantander Consumer Holding GmbH\nGesellschaft mit beschränkter Haftung\nMönchengladbach\n\nDem Registergericht ist eine neue Liste der Mitglieder des Aufsichtsrates eingereicht worden."
    },
    {
      "date": "2025-10-20",
      "id": "134624",
      "original_text": "Löschungsankündigung\nNordrhein-Westfalen Amtsgericht Köln HRB 96045\nCommoda Personal Bau GmbH – Köln",
      "type": "Löschungsankündigung",
      "state": "Nordrhein-Westfalen",
      "amtsgericht": "Amtsgericht Köln",
      "registernummer": "HRB 96045",
      "registerart": "HRB",
      "company_name": "Commoda Personal Bau GmbH",
      "company_seat": "Köln",
      "details": "20.10.2025 (Bekanntmachungsdatum)\n\nNordrhein-Westfalen Amtsgericht Köln HRB 96045\nLöschungsankündigung\n\nCommoda Personal Bau GmbH\nGesellschaft mit beschränkter Haftung\nKöln\n\nDas Registergericht beabsichtigt die Gesellschaft von Amts wegen nach § 394 FamFG zu löschen. Die Frist zur Erhebung eines Widerspruchs ist auf einen Monat festgesetzt."
    },
    {
      "date": "2025-10-20",
      "id": "134625",
      "original_text": "Löschungsankündigung\nNordrhein-Westfalen Amtsgericht Gelsenkirchen HRB 16068\nAutoloft GmbH – Gladbeck",
      "type": "Löschungsankündigung",
      "state": "Nordrhein-Westfalen",
      "amtsgericht": "Amtsgericht Gelsenkirchen",
      "registernummer": "HRB 16068",
      "registerart": "HRB",
      "company_name": "Autoloft GmbH",
      "company_seat": "Gladbeck",
      "details": "20.10.2025 (Bekanntmachungsdatum)\n\nNordrhein-Westfalen Amtsgericht Gelsenkirchen HRB 16068\nLöschungsankündigung\n\nAutoloft GmbH\nGesellschaft mit beschränkter Haftung\nGladbeck\n\nDas Gericht beabsichtigt, die im Handelsregister eingetragene Autoloft GmbH mit Sitz in Gladbeck, HRB 16068, Amtsgericht Gelsenkirchen, wegen Vermögenslosigkeit zu löschen.\nHiermit wird denjenigen, die an der Unterlassung der Löschung ein berechtigtes Interesse haben, gem. § 394 Abs. 2 FamFG Gelegenheit gegeben, gegen dieses Vorhaben binnen eines Monats nach dieser Bekanntmachung Widerspruch einzulegen. Der Widerspruch kann schriftlich oder zu Protokoll der Geschäftsstelle erhoben werden."
    },
    {
      "date": "2025-10-20",
      "id": "134626",
      "original_text": "Registerbekanntmachung nach dem Umwandlungsgesetz\nNordrhein-Westfalen Amtsgericht Duisburg HRB 33599\nAIP GmbH – Oberhausen",
      "type": "Registerbekanntmachung nach dem Umwandlungsgesetz",
      "state": "Nordrhein-Westfalen",
      "amtsgericht": "Amtsgericht Duisburg",
      "registernummer": "HRB 33599",
      "registerart": "HRB",
      "company_name": "AIP GmbH",
      "company_seat": "Oberhausen",
      "details": "20.10.2025 (Bekanntmachungsdatum)\n\nNordrhein-Westfalen Amtsgericht Duisburg HRB 33599\nRegisterbekanntmachung nach dem Umwandlungsgesetz 20.10.2025 (Eintragungsdatum)\n\nAIP GmbH\nGesellschaft mit beschränkter Haftung\nOberhausen\n\nDie Gesellschaft hat Gläubigern, deren Forderungen vor dieser Bekanntmachung begründet worden sind, Sicherheit zu leisten, soweit sie nicht Befriedigung verlangen können, wenn sie sich binnen sechs Monaten zu diesem Zweck melden."
    },
    {
      "date": "2025-10-20",
      "id": "134627",
      "original_text": "Registerbekanntmachung nach dem Umwandlungsgesetz\nNordrhein-Westfalen Amtsgericht Köln HRB 37474\nRadium Lampenwerk Gesellschaft mit beschränkter Haftung – Wipperfürth",
      "type": "Registerbekanntmachung nach dem Umwandlungsgesetz",
      "state": "Nordrhein-Westfalen",
      "amtsgericht": "Amtsgericht Köln",
      "registernummer": "HRB 37474",
      "registerart": "HRB",
      "company_name": "Radium Lampenwerk Gesellschaft mit beschränkter Haftung",
      "company_seat": "Wipperfürth",
      "details": "20.10.2025 (Bekanntmachungsdatum)\n\nNordrhein-Westfalen Amtsgericht Köln HRB 37474\nRegisterbekanntmachung nach dem Umwandlungsgesetz 20.10.2025 (Eintragungsdatum)\n\nRadium Lampenwerk Gesellschaft mit beschränkter Haftung\nGesellschaft mit beschränkter Haftung\nWipperfürth\n\nDen Gläubigern der an der Abspaltung beteiligten Rechtsträger ist, wenn sie binnen sechs Monaten nach dem Tag, an dem die Eintragung der Abspaltung in das Register des Sitzes desjenigen Rechtsträgers, dessen Gläubiger sie sind, nach § 19 Absatz 3 UmwG als bekanntgemacht gilt, ihren Anspruch nach Grund und Höhe schriftlich anmelden, Sicherheit zu leisten, soweit sie nicht Befriedigung verlangen können. Dieses Recht steht den Gläubigern jedoch nur zu, wenn sie glaubhaft machen, dass durch die Abspaltung die Erfüllung ihrer Forderung gefährdet wird."
    },
    {
      "date": "2025-10-20",
      "id": "134628",
      "original_text": "Registerbekanntmachung nach dem Umwandlungsgesetz\nNordrhein-Westfalen Amtsgericht Düsseldorf HRB 65211\nAzerion AG – Düsseldorf",
      "type": "Registerbekanntmachung nach dem Umwandlungsgesetz",
      "state": "Nordrhein-Westfalen",
      "amtsgericht": "Amtsgericht Düsseldorf",
      "registernummer": "HRB 65211",
      "registerart": "HRB",
      "company_name": "Azerion AG",
      "company_seat": "Düsseldorf",
      "details": "20.10.2025 (Bekanntmachungsdatum)\n\nNordrhein-Westfalen Amtsgericht Düsseldorf HRB 65211\nRegisterbekanntmachung nach dem Umwandlungsgesetz 20.10.2025 (Eintragungsdatum)\n\nAzerion AG\nAktiengesellschaft\nDüsseldorf\n\nDen Gläubigern der an der Verschmelzung beteiligten Rechtsträger ist, wenn sie binnen sechs Monaten nach dem Tag, an dem die Eintragung der Verschmelzung in das Register des Sitzes derjenigen Rechtsträger deren Gläubiger sie sind, nach § 19 Absatz 3 UmwG als bekanntgemacht gilt, ihren Anspruch nach Grund und Höhe schriftlich anmelden, Sicherheit zu leisten, soweit sie nicht Befriedigung verlangen können. Dieses Recht steht den Gläubigern jedoch nur zu, wenn sie glaubhaft machen, dass durch die Verschmelzung die Erfüllung ihrer Forderung gefährdet wird."
    },
    {
      "date": "2025-10-20",
      "id": "134629",
      "original_text": "Registerbekanntmachung nach dem Umwandlungsgesetz\nNordrhein-Westfalen Amtsgericht Bielefeld HRB 46450\nFlick Holding GmbH – Bielefeld",
      "type": "Registerbekanntmachung nach dem Umwandlungsgesetz",
      "state": "Nordrhein-Westfalen",
      "amtsgericht": "Amtsgericht Bielefeld",
      "registernummer": "HRB 46450",
      "registerart": "HRB",
      "company_name": "Flick Holding GmbH",
      "company_seat": "Bielefeld",
      "details": "20.10.2025 (Bekanntmachungsdatum)\n\nNordrhein-Westfalen Amtsgericht Bielefeld HRB 46450\nRegisterbekanntmachung nach dem Umwandlungsgesetz 20.10.2025 (Eintragungsdatum)\n\nFlick Holding GmbH\nGesellschaft mit beschränkter Haftung\nBielefeld\n\nDen Gläubigern der an der formwechselnden Umwandlung beteiligten Rechtsträger ist, wenn sie binnen sechs Monaten nach dem Tag, an dem die Eintragung der formwechselnden Umwandlung in das Register des Sitzes desjenigen Rechtsträgers, dessen Gläubiger sie sind, nach § 19 Absatz 3 UmwG als bekanntgemacht gilt, ihren Anspruch nach Grund und Höhe schriftlich anmelden, Sicherheit zu leisten, soweit sie nicht Befriedigung verlangen können. Dieses Recht steht den Gläubigern jedoch nur zu, wenn sie glaubhaft machen, dass durch die formwechselnden Umwandlung die Erfüllung ihrer Forderung gefährdet wird."
    },
    {
      "date": "2025-10-20",
      "id": "134630",
      "original_text": "Registerbekanntmachung nach dem Umwandlungsgesetz\nNordrhein-Westfalen Amtsgericht Köln HRB 125162\nHausverwaltung Jonas Sottek GmbH – Wermelskirchen",
      "type": "Registerbekanntmachung nach dem Umwandlungsgesetz",
      "state": "Nordrhein-Westfalen",
      "amtsgericht": "Amtsgericht Köln",
      "registernummer": "HRB 125162",
      "registerart": "HRB",
      "company_name": "Hausverwaltung Jonas Sottek GmbH",
      "company_seat": "Wermelskirchen",
      "details": "20.10.2025 (Bekanntmachungsdatum)\n\nNordrhein-Westfalen Amtsgericht Köln HRB 125162\nRegisterbekanntmachung nach dem Umwandlungsgesetz 20.10.2025 (Eintragungsdatum)\n\nHausverwaltung Jonas Sottek GmbH\nGesellschaft mit beschränkter Haftung\nWermelskirchen\n\nDen Gläubigern der an der Ausgliederung beteiligten Rechtsträger ist, wenn sie binnen sechs Monaten nach dem Tag, an dem die Eintragung der Ausgliederung in das Register des Sitzes desjenigen Rechtsträgers, dessen Gläubiger sie sind, nach § 19 Absatz 3 UmwG als bekanntgemacht gilt, ihren Anspruch nach Grund und Höhe schriftlich anmelden, Sicherheit zu leisten, soweit sie nicht Befriedigung verlangen können. Dieses Recht steht den Gläubigern jedoch nur zu, wenn sie glaubhaft machen, dass durch die Ausgliederung die Erfüllung ihrer Forderung gefährdet wird."
    },
    {
      "date": "2025-10-20",
      "id": "134631",
      "original_text": "Registerbekanntmachung nach dem Umwandlungsgesetz\nThüringen Amtsgericht Jena HRA 507141\nOctavian Lazur e.K. – Erfurt",
      "type": "Registerbekanntmachung nach dem Umwandlungsgesetz",
      "state": "Thüringen",
      "amtsgericht": "Amtsgericht Jena",
      "registernummer": "HRA 507141",
      "registerart": "HRA",
      "company_name": "Octavian Lazur e.K.",
      "company_seat": "Erfurt",
      "details": "20.10.2025 (Bekanntmachungsdatum)\n\nThüringen Amtsgericht Jena HRA 507141\nRegisterbekanntmachung nach dem Umwandlungsgesetz 20.10.2025 (Eintragungsdatum)\n\nOctavian Lazur e.K.\nEinzelkaufmann / Einzelkauffrau\nErfurt\n\nNicht eingetragen: Den Gläubigern der an der Ausgliederung beteiligten Rechtsträger, ist wenn sie binnen sechs Monaten nach dem Tag, an dem die Eintragung der Ausgliederung in das Register des Sitzes desjenigen Rechtsträgers, dessen Gläubiger sie sind, nach §§125, 19 Abs. 3 UmwG als bekanntgemacht gilt, ihren Anspruch nach Grund und Höhe schriftlich anmelden, Sicherheit zu leisten, soweit sie nicht Befriedigung verlangen können. Dieses Recht steht ihnen jedoch nur zu, wenn sie glaubhaft machen, daß durch die Ausgliederung die Erfüllung ihrer Forderung gefährdet wird."
    },
    {
      "date": "2025-10-20",
      "id": "134632",
      "original_text": "Einreichung neuer Dokumente\nHessen Amtsgericht Darmstadt HRB 53602\nLear Corporation GmbH – Ginsheim-Gustavsburg",
      "type": "Einreichung neuer Dokumente",
      "state": "Hessen",
      "amtsgericht": "Amtsgericht Darmstadt",
      "registernummer": "HRB 53602",
      "registerart": "HRB",
      "company_name": "Lear Corporation GmbH",
      "company_seat": "Ginsheim-Gustavsburg",
      "details": "20.10.2025 (Bekanntmachungsdatum)\n\nHessen Amtsgericht Darmstadt HRB 53602\nEinreichung neuer Dokumente\n\nLear Corporation GmbH\nGesellschaft mit beschränkter Haftung\nGinsheim-Gustavsburg\n\nWegen Änderungen in den Personen der Aufsichtsratsmitglieder ist eine Liste der Mitglieder des Aufsichtsrates zum Handelsregister eingereicht worden."
    },
    {
      "date": "2025-10-20",
      "id": "134633",
      "original_text": "Einreichung neuer Dokumente\nHessen Amtsgericht Frankfurt am Main HRB 71290\nSTADA Arzneimittel Aktiengesellschaft – Bad Vilbel",
      "type": "Einreichung neuer Dokumente",
      "state": "Hessen",
      "amtsgericht": "Amtsgericht Frankfurt am Main",
      "registernummer": "HRB 71290",
      "registerart": "HRB",
      "company_name": "STADA Arzneimittel Aktiengesellschaft",
      "company_seat": "Bad Vilbel",
      "details": "20.10.2025 (Bekanntmachungsdatum)\n\nHessen Amtsgericht Frankfurt am Main HRB 71290\nEinreichung neuer Dokumente\n\nSTADA Arzneimittel Aktiengesellschaft\nAktiengesellschaft\nBad Vilbel\n\nDurch eine Änderung in den Personen der Aufsichtsratsmitglieder ist eine Liste der Mitglieder des Aufsichtsrates zum Handelsregister eingereicht worden."
    },
    {
      "date": "2025-10-20",
      "id": "134634",
      "original_text": "Löschungsankündigung\nHessen Amtsgericht Frankfurt am Main HRB 93815\nQuickstop GmbH – Frankfurt am Main",
      "type": "Löschungsankündigung",
      "state": "Hessen",
      "amtsgericht": "Amtsgericht Frankfurt am Main",
      "registernummer": "HRB 93815",
      "registerart": "HRB",
      "company_name": "Quickstop GmbH",
      "company_seat": "Frankfurt am Main",
      "details": "20.10.2025 (Bekanntmachungsdatum)\n\nHessen Amtsgericht Frankfurt am Main HRB 93815\nLöschungsankündigung 20.10.2025 (Eintragungsdatum)\n\nQuickstop GmbH\nGesellschaft mit beschränkter Haftung\nFrankfurt am Main\n\nDas Registergericht beabsichtigt die im Handelsregister eingetragene Gesellschaft von Amts wegen nach § 394 FamFG zu löschen. Die Frist zur Erhebung eines Widerspruchs gegen die beabsichtigte Löschung wird auf 1 Monat festgesetzt."
    },
    {
      "date": "2025-10-20",
      "id": "134635",
      "original_text": "Einreichung neuer Dokumente\nHessen Amtsgericht Hanau HRB 96802\nEbbecke Solutions AG – Bruchköbel",
      "type": "Einreichung neuer Dokumente",
      "state": "Hessen",
      "amtsgericht": "Amtsgericht Hanau",
      "registernummer": "HRB 96802",
      "registerart": "HRB",
      "company_name": "Ebbecke Solutions AG",
      "company_seat": "Bruchköbel",
      "details": "20.10.2025 (Bekanntmachungsdatum)\n\nHessen Amtsgericht Hanau HRB 96802\nEinreichung neuer Dokumente\n\nEbbecke Solutions AG\nAktiengesellschaft\nBruchköbel\n\nDurch eine Änderung in den Personen der Aufsichtsratsmitglieder ist eine Liste der Mitglieder des Aufsichtsrates zum Handelsregister eingereicht worden."
    },
    {
      "date": "2025-10-20",
      "id": "134636",
      "original_text": "Registerbekanntmachung nach dem Umwandlungsgesetz\nHessen Amtsgericht Bad Homburg v.d.H. HRA 6448\nElektrotechnik Wraase-Will e.K. – Grävenwiesbach",
      "type": "Registerbekanntmachung nach dem Umwandlungsgesetz",
      "state": "Hessen",
      "amtsgericht": "Amtsgericht Bad Homburg v.d.H.",
      "registernummer": "HRA 6448",
      "registerart": "HRA",
      "company_name": "Elektrotechnik Wraase-Will e.K.",
      "company_seat": "Grävenwiesbach",
      "details": "20.10.2025 (Bekanntmachungsdatum)\n\nHessen Amtsgericht Bad Homburg v.d.H. HRA 6448\nRegisterbekanntmachung nach dem Umwandlungsgesetz 20.10.2025 (Eintragungsdatum)\n\nElektrotechnik Wraase-Will e.K.\nEinzelkaufmann / Einzelkauffrau\nGrävenwiesbach\n\nDen Gläubigern der an der Ausgliederung beteiligten Rechtsträger ist, wenn sie binnen sechs Monaten nach dem Tag, an dem die Eintragung der Ausgliederung in das Register des Sitzes desjenigen Rechtsträgers, dessen Gläubiger sie sind, nach §§ 125, 19 Absatz 3 UmwG bekannt gemacht worden ist, ihren Anspruch nach Grund und Höhe schriftlich anmelden, Sicherheit zu leisten, soweit sie nicht Befriedigung verlangen können. Dieses Recht steht den Gläubigern jedoch nur zu, wenn sie glaubhaft machen, dass durch die Ausgliederung die Erfüllung ihrer Forderung gefährdet wird."
    },
    {
      "date": "2025-10-20",
      "id": "134637",
      "original_text": "Registerbekanntmachung nach dem Umwandlungsgesetz\nHessen Amtsgericht Bad Homburg v.d.H. HRB 17213\nElektrotechnik Wraase-Will GmbH – Grävenwiesbach",
      "type": "Registerbekanntmachung nach dem Umwandlungsgesetz",
      "state": "Hessen",
      "amtsgericht": "Amtsgericht Bad Homburg v.d.H.",
      "registernummer": "HRB 17213",
      "registerart": "HRB",
      "company_name": "Elektrotechnik Wraase-Will GmbH",
      "company_seat": "Grävenwiesbach",
      "details": "20.10.2025 (Bekanntmachungsdatum)\n\nHessen Amtsgericht Bad Homburg v.d.H. HRB 17213\nRegisterbekanntmachung nach dem Umwandlungsgesetz 20.10.2025 (Eintragungsdatum)\n\nElektrotechnik Wraase-Will GmbH\nGesellschaft mit beschränkter Haftung\nGrävenwiesbach\n\nDen Gläubigern der an der Ausgliederung beteiligten Rechtsträger ist, wenn sie binnen sechs Monaten nach dem Tag, an dem die Eintragung der Ausgliederung in das Register des Sitzes desjenigen Rechtsträgers, dessen Gläubiger sie sind, nach §§ 125, 19 Absatz 3 UmwG bekannt gemacht worden ist, ihren Anspruch nach Grund und Höhe schriftlich anmelden, Sicherheit zu leisten, soweit sie nicht Befriedigung verlangen können. Dieses Recht steht den Gläubigern jedoch nur zu, wenn sie glaubhaft machen, dass durch die Ausgliederung die Erfüllung ihrer Forderung gefährdet wird."
    },
    {
      "date": "2025-10-20",
      "id": "134638",
      "original_text": "Einreichung neuer Dokumente\nHessen Amtsgericht Offenbach am Main HRB 10999\nESO Offenbacher Dienstleistungsgesellschaft mbH – Offenbach am Main",
      "type": "Einreichung neuer Dokumente",
      "state": "Hessen",
      "amtsgericht": "Amtsgericht Offenbach am Main",
      "registernummer": "HRB 10999",
      "registerart": "HRB",
      "company_name": "ESO Offenbacher Dienstleistungsgesellschaft mbH",
      "company_seat": "Offenbach am Main",
      "details": "20.10.2025 (Bekanntmachungsdatum)\n\nHessen Amtsgericht Offenbach am Main HRB 10999\nEinreichung neuer Dokumente 20.10.2025 (Eintragungsdatum)\n\nESO Offenbacher Dienstleistungsgesellschaft mbH\nGesellschaft mit beschränkter Haftung\nOffenbach am Main\n\nDurch eine Änderung in den Personen der Aufsichtsratsmitglieder ist eine Liste der Mitglieder des Aufsichtsrates zum Handelsregister eingereicht worden."
    },
    {
      "date": "2025-10-20",
      "id": "134639",
      "original_text": "Sonstige Registerbekanntmachung\nHessen Amtsgericht Fritzlar VR 3509\nProject Magic Deutschland – Fritzlar",
      "type": "Sonstige Registerbekanntmachung",
      "state": "Hessen",
      "amtsgericht": "Amtsgericht Fritzlar",
      "registernummer": "VR 3509",
      "registerart": "VR",
      "company_name": "Project Magic Deutschland",
      "company_seat": "Fritzlar",
      "details": "20.10.2025 (Bekanntmachungsdatum)\n\nHessen Amtsgericht Fritzlar VR 3509\nSonstige Registerbekanntmachung 20.10.2025 (Eintragungsdatum)\n\nProject Magic Deutschland\neingetragener Verein\nFritzlar\n\nDer Verein ist aufgelöst."
    },
    {
      "date": "2025-10-20",
      "id": "134640",
      "original_text": "Registerbekanntmachung nach dem Umwandlungsgesetz\nHessen Amtsgericht Frankfurt am Main HRB 52800\nVibrantz GmbH – Frankfurt am Main",
      "type": "Registerbekanntmachung nach dem Umwandlungsgesetz",
      "state": "Hessen",
      "amtsgericht": "Amtsgericht Frankfurt am Main",
      "registernummer": "HRB 52800",
      "registerart": "HRB",
      "company_name": "Vibrantz GmbH",
      "company_seat": "Frankfurt am Main",
      "details": "20.10.2025 (Bekanntmachungsdatum)\n\nHessen Amtsgericht Frankfurt am Main HRB 52800\nRegisterbekanntmachung nach dem Umwandlungsgesetz 20.10.2025 (Eintragungsdatum)\n\nVibrantz GmbH\nGesellschaft mit beschränkter Haftung\nFrankfurt am Main\n\nDen Gläubigern der an der Verschmelzung beteiligten Rechtsträger ist, wenn sie binnen sechs Monaten nach dem Tag, an dem die Eintragung der Verschmelzung in das Register des Sitzes desjenigen Rechtsträgers, dessen Gläubiger sie sind, nach § 19 Absatz 3 UmwG bekannt gemacht worden ist, ihren Anspruch nach Grund und Höhe schriftlich anmelden, Sicherheit zu leisten, soweit sie nicht Befriedigung verlangen können. Dieses Recht steht den Gläubigern jedoch nur zu, wenn sie glaubhaft machen, dass durch die Verschmelzung die Erfüllung ihrer Forderung gefährdet wird."
    }
  ]
}