{
  "date": "2025-10-22",
  "date_of_scrape": "2025-10-27T18:43:16.404Z",
  "tool_version": "0.2.0",
  "number_of_announcements": 150,
  "announcements": [
    {
      "date": "2025-10-22",
      "id": "134817",
      "original_text": "Löschungsankündigung\nBayern Amtsgericht München HRB 262906\nPEGAS Immobilien GmbH – München",
      "type": "Löschungsankündigung",
      "state": "Bayern",
      "amtsgericht": "Amtsgericht München",
      "registernummer": "HRB 262906",
      "registerart": "HRB",
      "company_name": "PEGAS Immobilien GmbH",
      "company_seat": "München",
      "details": "22.10.2025 (Bekanntmachungsdatum)\n\nBayern Amtsgericht München HRB 262906\nLöschungsankündigung 21.10.2025 (Eintragungsdatum)\n\nPEGAS Immobilien GmbH\nGesellschaft mit beschränkter Haftung\nMünchen\n\nDas Registergericht beabsichtigt, die im Handelsregister eingetragene Gesellschaft wegen Vermögenslosigkeit von Amts wegen nach § 394 FamFG zu löschen. Die Frist zur Erhebung eines Widerspruchs ist auf drei Monate festgesetzt."
    },
    {
      "date": "2025-10-22",
      "id": "134818",
      "original_text": "Registerbekanntmachung nach dem Umwandlungsgesetz\nBayern Amtsgericht München HRB 239235\nHashiCorp Germany GmbH – München",
      "type": "Registerbekanntmachung nach dem Umwandlungsgesetz",
      "state": "Bayern",
      "amtsgericht": "Amtsgericht München",
      "registernummer": "HRB 239235",
      "registerart": "HRB",
      "company_name": "HashiCorp Germany GmbH",
      "company_seat": "München",
      "details": "22.10.2025 (Bekanntmachungsdatum)\n\nBayern Amtsgericht München HRB 239235\nRegisterbekanntmachung nach dem Umwandlungsgesetz 21.10.2025 (Eintragungsdatum)\n\nHashiCorp Germany GmbH\nGesellschaft mit beschränkter Haftung\nMünchen\n\nDen Gläubigern der an der Verschmelzung beteiligten Rechtsträger ist, wenn sie binnen sechs Monaten nach dem Tag, an dem die Eintragung der Verschmelzung in das Register des Sitzes desjenigen Rechtsträgers, dessen Gläubiger sie sind, nach § 19 Abs. 3 UmwG als bekannt gemacht gilt, ihren Anspruch nach Grund und Höhe in Textform anmelden, Sicherheit zu leisten, soweit sie nicht Befriedigung verlangen können. Dieses Recht steht den Gläubigern jedoch nur zu, wenn sie glaubhaft machen, dass durch die Verschmelzung die Erfüllung ihrer Forderung gefährdet wird."
    },
    {
      "date": "2025-10-22",
      "id": "134819",
      "original_text": "Löschungsankündigung\nBayern Amtsgericht Augsburg HRB 19145\nATRO GmbH – Augsburg",
      "type": "Löschungsankündigung",
      "state": "Bayern",
      "amtsgericht": "Amtsgericht Augsburg",
      "registernummer": "HRB 19145",
      "registerart": "HRB",
      "company_name": "ATRO GmbH",
      "company_seat": "Augsburg",
      "details": "22.10.2025 (Bekanntmachungsdatum)\n\nBayern Amtsgericht Augsburg HRB 19145\nLöschungsankündigung\n\nATRO GmbH\nGesellschaft mit beschränkter Haftung\nAugsburg\n\nDas Registergericht beabsichtigt, die im Handelsregister eingetragene Gesellschaft wegen Vermögenslosigkeit von Amts wegen nach § 394 FamFG zu löschen. Die Frist zur Erhebung eines Widerspruchs ist auf einen Monat festgesetzt."
    },
    {
      "date": "2025-10-22",
      "id": "134820",
      "original_text": "Registerbekanntmachung nach dem Umwandlungsgesetz\nBayern Amtsgericht Fürth HRB 17679\nder steinbock Nürnberg GmbH – Zirndorf",
      "type": "Registerbekanntmachung nach dem Umwandlungsgesetz",
      "state": "Bayern",
      "amtsgericht": "Amtsgericht Fürth",
      "registernummer": "HRB 17679",
      "registerart": "HRB",
      "company_name": "der steinbock Nürnberg GmbH",
      "company_seat": "Zirndorf",
      "details": "22.10.2025 (Bekanntmachungsdatum)\n\nBayern Amtsgericht Fürth HRB 17679\nRegisterbekanntmachung nach dem Umwandlungsgesetz 21.10.2025 (Eintragungsdatum)\n\nder steinbock Nürnberg GmbH\nGesellschaft mit beschränkter Haftung\nZirndorf\n\nDen Gläubigern der an der Verschmelzung beteiligten Rechtsträger ist, wenn sie binnen sechs Monaten nach dem Tag, an dem die Eintragung der Verschmelzung in das Register des Sitzes desjenigen Rechtsträgers, dessen Gläubiger sie sind, nach § 19 Abs. 3 UmwG als bekannt gemacht gilt, ihren Anspruch nach Grund und Höhe in Textform anmelden, Sicherheit zu leisten, soweit sie nicht Befriedigung verlangen können. Dieses Recht steht den Gläubigern jedoch nur zu, wenn sie glaubhaft machen, dass durch die Verschmelzung die Erfüllung ihrer Forderung gefährdet wird."
    },
    {
      "date": "2025-10-22",
      "id": "134821",
      "original_text": "Einreichung neuer Dokumente\nBayern Amtsgericht Nürnberg HRB 40312\nFABRI AG – Nürnberg",
      "type": "Einreichung neuer Dokumente",
      "state": "Bayern",
      "amtsgericht": "Amtsgericht Nürnberg",
      "registernummer": "HRB 40312",
      "registerart": "HRB",
      "company_name": "FABRI AG",
      "company_seat": "Nürnberg",
      "details": "22.10.2025 (Bekanntmachungsdatum)\n\nBayern Amtsgericht Nürnberg HRB 40312\nEinreichung neuer Dokumente 21.10.2025 (Eintragungsdatum)\n\nFABRI AG\nAktiengesellschaft\nNürnberg\n\nDem Amtsgericht Nürnberg -Registergericht- ist eine Liste der Mitglieder des Aufsichtsrats eingereicht worden, § 106 AktG."
    },
    {
      "date": "2025-10-22",
      "id": "134822",
      "original_text": "Löschungsankündigung\nBayern Amtsgericht Coburg HRB 6216\nBioenergie Brückner UG (haftungsbeschränkt) – Marktgraitz",
      "type": "Löschungsankündigung",
      "state": "Bayern",
      "amtsgericht": "Amtsgericht Coburg",
      "registernummer": "HRB 6216",
      "registerart": "HRB",
      "company_name": "Bioenergie Brückner UG (haftungsbeschränkt)",
      "company_seat": "Marktgraitz",
      "details": "22.10.2025 (Bekanntmachungsdatum)\n\nBayern Amtsgericht Coburg HRB 6216\nLöschungsankündigung 17.10.2025 (Eintragungsdatum)\n\nBioenergie Brückner UG (haftungsbeschränkt)\nGesellschaft mit beschränkter Haftung\nMarktgraitz\n\nDas Registergericht beabsichtigt, die im Handelsregister eingetragene Gesellschaft von Amts wegen nach § 395 FamFG zu löschen. Die Frist zur Erhebung eines Widerspruchs ist auf einen Monat festgesetzt."
    },
    {
      "date": "2025-10-22",
      "id": "134823",
      "original_text": "Einreichung neuer Dokumente\nBayern Amtsgericht Ingolstadt HRB 10454\nAUMOVIO Autonomous Mobility Germany GmbH – Ingolstadt",
      "type": "Einreichung neuer Dokumente",
      "state": "Bayern",
      "amtsgericht": "Amtsgericht Ingolstadt",
      "registernummer": "HRB 10454",
      "registerart": "HRB",
      "company_name": "AUMOVIO Autonomous Mobility Germany GmbH",
      "company_seat": "Ingolstadt",
      "details": "22.10.2025 (Bekanntmachungsdatum)\n\nBayern Amtsgericht Ingolstadt HRB 10454\nEinreichung neuer Dokumente 21.10.2025 (Eintragungsdatum)\n\nAUMOVIO Autonomous Mobility Germany GmbH\nGesellschaft mit beschränkter Haftung\nIngolstadt\n\nDem Amtsgericht Ingolstadt -Registergericht- ist eine Liste der Mitglieder des Aufsichtsrats eingereicht worden, § 52 Abs. 3 S. 2 GmbHG."
    },
    {
      "date": "2025-10-22",
      "id": "134824",
      "original_text": "Löschungsankündigung\nBayern Amtsgericht München HRB 153714\nBazaar de Cologne Grundstücksgesellschaft mbH – München",
      "type": "Löschungsankündigung",
      "state": "Bayern",
      "amtsgericht": "Amtsgericht München",
      "registernummer": "HRB 153714",
      "registerart": "HRB",
      "company_name": "Bazaar de Cologne Grundstücksgesellschaft mbH",
      "company_seat": "München",
      "details": "22.10.2025 (Bekanntmachungsdatum)\n\nBayern Amtsgericht München HRB 153714\nLöschungsankündigung 21.10.2025 (Eintragungsdatum)\n\nBazaar de Cologne Grundstücksgesellschaft mbH\nGesellschaft mit beschränkter Haftung\nMünchen\n\nDas Registergericht beabsichtigt, die im Handelsregister eingetragene Gesellschaft wegen Vermögenslosigkeit von Amts wegen nach § 394 FamFG zu löschen. Die Frist zur Erhebung eines Widerspruchs ist auf drei Monate festgesetzt."
    },
    {
      "date": "2025-10-22",
      "id": "134825",
      "original_text": "Löschungsankündigung\nBayern Amtsgericht Regensburg HRB 15980\niTT Medical Regensburg GmbH – Regensburg",
      "type": "Löschungsankündigung",
      "state": "Bayern",
      "amtsgericht": "Amtsgericht Regensburg",
      "registernummer": "HRB 15980",
      "registerart": "HRB",
      "company_name": "iTT Medical Regensburg GmbH",
      "company_seat": "Regensburg",
      "details": "22.10.2025 (Bekanntmachungsdatum)\n\nBayern Amtsgericht Regensburg HRB 15980\nLöschungsankündigung 21.10.2025 (Eintragungsdatum)\n\niTT Medical Regensburg GmbH\nGesellschaft mit beschränkter Haftung\nRegensburg\n\nDas Registergericht beabsichtigt, den Geschäftsführer Kai-Odin Ahrns von  Amts wegen nach § 395 FamFG wegen nachträglicher Unrichtigkeit aus dem Handelsregister zu löschen.\n\nZur Geltendmachung eines Widerspruchs hiergegen wird Ihnen eine Frist von zwei Monaten ab Bekanntgabe dieses Schreibens bestimmt."
    },
    {
      "date": "2025-10-22",
      "id": "134826",
      "original_text": "Löschungsankündigung\nBayern Amtsgericht Regensburg HRB 10799\nR + W Produktentwicklungs GmbH – Nittendorf",
      "type": "Löschungsankündigung",
      "state": "Bayern",
      "amtsgericht": "Amtsgericht Regensburg",
      "registernummer": "HRB 10799",
      "registerart": "HRB",
      "company_name": "R + W Produktentwicklungs GmbH",
      "company_seat": "Nittendorf",
      "details": "22.10.2025 (Bekanntmachungsdatum)\n\nBayern Amtsgericht Regensburg HRB 10799\nLöschungsankündigung\n\nR + W Produktentwicklungs GmbH\nGesellschaft mit beschränkter Haftung\nNittendorf\n\nDas Registergericht beabsichtigt, die im Handelsregister eingetragene Gesellschaft wegen Vermögenslosigkeit von Amts wegen nach § 394 FamFG zu löschen. Die Frist zur Erhebung eines Widerspruchs ist auf einen Monat festgesetzt."
    },
    {
      "date": "2025-10-22",
      "id": "134827",
      "original_text": "Registerbekanntmachung nach dem Umwandlungsgesetz\nBayern Amtsgericht München HRB 287079\nIMT Bildung Holding GmbH – München",
      "type": "Registerbekanntmachung nach dem Umwandlungsgesetz",
      "state": "Bayern",
      "amtsgericht": "Amtsgericht München",
      "registernummer": "HRB 287079",
      "registerart": "HRB",
      "company_name": "IMT Bildung Holding GmbH",
      "company_seat": "München",
      "details": "22.10.2025 (Bekanntmachungsdatum)\n\nBayern Amtsgericht München HRB 287079\nRegisterbekanntmachung nach dem Umwandlungsgesetz 21.10.2025 (Eintragungsdatum)\n\nIMT Bildung Holding GmbH\nGesellschaft mit beschränkter Haftung\nMünchen\n\nDen Gläubigern der an der Verschmelzung beteiligten Rechtsträger ist, wenn sie binnen sechs Monaten nach dem Tag, an dem die Eintragung der Verschmelzung in das Register des Sitzes desjenigen Rechtsträgers, dessen Gläubiger sie sind, nach § 19 Abs. 3 UmwG als bekannt gemacht gilt, ihren Anspruch nach Grund und Höhe in Textform anmelden, Sicherheit zu leisten, soweit sie nicht Befriedigung verlangen können. Dieses Recht steht den Gläubigern jedoch nur zu, wenn sie glaubhaft machen, dass durch die Verschmelzung die Erfüllung ihrer Forderung gefährdet wird.Den Gläubigern der an der Verschmelzung beteiligten Rechtsträger ist, wenn sie binnen sechs Monaten nach dem Tag, an dem die Eintragung der Verschmelzung in das Register des Sitzes desjenigen Rechtsträgers, dessen Gläubiger sie sind, nach § 19 Abs. 3 UmwG als bekannt gemacht gilt, ihren Anspruch nach Grund und Höhe in Textform anmelden, Sicherheit zu leisten, soweit sie nicht Befriedigung verlangen können. Dieses Recht steht den Gläubigern jedoch nur zu, wenn sie glaubhaft machen, dass durch die Verschmelzung die Erfüllung ihrer Forderung gefährdet wird."
    },
    {
      "date": "2025-10-22",
      "id": "134828",
      "original_text": "Löschungsankündigung\nBayern Amtsgericht München HRB 199805\nPro-Life Solution UG (haftungsbeschränkt) – München",
      "type": "Löschungsankündigung",
      "state": "Bayern",
      "amtsgericht": "Amtsgericht München",
      "registernummer": "HRB 199805",
      "registerart": "HRB",
      "company_name": "Pro-Life Solution UG (haftungsbeschränkt)",
      "company_seat": "München",
      "details": "22.10.2025 (Bekanntmachungsdatum)\n\nBayern Amtsgericht München HRB 199805\nLöschungsankündigung 21.10.2025 (Eintragungsdatum)\n\nPro-Life Solution UG (haftungsbeschränkt)\nGesellschaft mit beschränkter Haftung\nMünchen\n\nDas Registergericht beabsichtigt, die im Handelsregister eingetragene Gesellschaft wegen Vermögenslosigkeit von Amts wegen nach § 394 FamFG zu löschen. Die Frist zur Erhebung eines Widerspruchs ist auf drei Monate festgesetzt."
    },
    {
      "date": "2025-10-22",
      "id": "134829",
      "original_text": "Registerbekanntmachung nach dem Umwandlungsgesetz\nBayern Amtsgericht München HRA 106740\nEnerchange GmbH & Co. KG – München",
      "type": "Registerbekanntmachung nach dem Umwandlungsgesetz",
      "state": "Bayern",
      "amtsgericht": "Amtsgericht München",
      "registernummer": "HRA 106740",
      "registerart": "HRA",
      "company_name": "Enerchange GmbH & Co. KG",
      "company_seat": "München",
      "details": "22.10.2025 (Bekanntmachungsdatum)\n\nBayern Amtsgericht München HRA 106740\nRegisterbekanntmachung nach dem Umwandlungsgesetz 21.10.2025 (Eintragungsdatum)\n\nEnerchange GmbH & Co. KG\nKommanditgesellschaft\nMünchen\n\nDen Gläubigern des formwechselnden Rechtsträgers ist, wenn sie binnen sechs Monaten nach dem Tag, an dem die Eintragung des Formwechsels nach § 201 UmwG als bekannt gemacht gilt, ihren Anspruch nach Grund und Höhe in Textform anmelden, Sicherheit zu leisten, soweit sie nicht Befriedigung verlangen können. Dieses Recht steht den Gläubigern jedoch nur zu, wenn sie glaubhaft machen, dass durch den Formwechsel die Erfüllung ihrer Forderung gefährdet wird."
    },
    {
      "date": "2025-10-22",
      "id": "134830",
      "original_text": "Registerbekanntmachung nach dem Umwandlungsgesetz\nBayern Amtsgericht Augsburg HRA 22057\nWinfried Schweihofer e. K. – Mertingen",
      "type": "Registerbekanntmachung nach dem Umwandlungsgesetz",
      "state": "Bayern",
      "amtsgericht": "Amtsgericht Augsburg",
      "registernummer": "HRA 22057",
      "registerart": "HRA",
      "company_name": "Winfried Schweihofer e. K.",
      "company_seat": "Mertingen",
      "details": "22.10.2025 (Bekanntmachungsdatum)\n\nBayern Amtsgericht Augsburg HRA 22057\nRegisterbekanntmachung nach dem Umwandlungsgesetz 21.10.2025 (Eintragungsdatum)\n\nWinfried Schweihofer e. K.\nEinzelkaufmann / Einzelkauffrau\nMertingen\n\nDen Gläubigern der an der Ausgliederung beteiligten Rechtsträger ist, wenn sie binnen sechs Monaten nach dem Tag, an dem die Eintragung der Ausgliederung in das Register des Sitzes desjenigen Rechtsträgers, dessen Gläubiger sie sind, nach §§ 125, 19 Abs. 3 UmwG als bekannt gemacht gilt, ihren Anspruch nach Grund und Höhe in Textform anmelden, Sicherheit zu leisten, soweit sie nicht Befriedigung verlangen können. Dieses Recht steht den Gläubigern jedoch nur zu, wenn sie glaubhaft machen, dass durch die Ausgliederung die Erfüllung ihrer Forderung gefährdet wird."
    },
    {
      "date": "2025-10-22",
      "id": "134831",
      "original_text": "Registerbekanntmachung nach dem Umwandlungsgesetz\nBayern Amtsgericht Augsburg HRB 41848\nPP Media MidCo GmbH – Kissing",
      "type": "Registerbekanntmachung nach dem Umwandlungsgesetz",
      "state": "Bayern",
      "amtsgericht": "Amtsgericht Augsburg",
      "registernummer": "HRB 41848",
      "registerart": "HRB",
      "company_name": "PP Media MidCo GmbH",
      "company_seat": "Kissing",
      "details": "22.10.2025 (Bekanntmachungsdatum)\n\nBayern Amtsgericht Augsburg HRB 41848\nRegisterbekanntmachung nach dem Umwandlungsgesetz 21.10.2025 (Eintragungsdatum)\n\nPP Media MidCo GmbH\nGesellschaft mit beschränkter Haftung\nKissing\n\nDen Gläubigern der an der Spaltung beteiligten Rechtsträger ist, wenn sie binnen sechs Monaten nach dem Tag, an dem die Eintragung der Spaltung in das Register des Sitzes desjenigen Rechtsträgers, dessen Gläubiger sie sind, nach §§ 125, 19 Abs. 3 UmwG als bekannt gemacht gilt, ihren Anspruch nach Grund und Höhe in Textform anmelden, Sicherheit zu leisten, soweit sie nicht Befriedigung verlangen können. Dieses Recht steht den Gläubigern jedoch nur zu, wenn sie glaubhaft machen, dass durch die Spaltung die Erfüllung ihrer Forderung gefährdet wird."
    },
    {
      "date": "2025-10-22",
      "id": "134832",
      "original_text": "Löschungsankündigung\nBayern Amtsgericht Augsburg HRB 30143\nFußball- Entertainment GmbH – Gessertshausen",
      "type": "Löschungsankündigung",
      "state": "Bayern",
      "amtsgericht": "Amtsgericht Augsburg",
      "registernummer": "HRB 30143",
      "registerart": "HRB",
      "company_name": "Fußball- Entertainment GmbH",
      "company_seat": "Gessertshausen",
      "details": "22.10.2025 (Bekanntmachungsdatum)\n\nBayern Amtsgericht Augsburg HRB 30143\nLöschungsankündigung\n\nFußball- Entertainment GmbH\nGesellschaft mit beschränkter Haftung\nGessertshausen\n\nDas Registergericht beabsichtigt, die im Handelsregister eingetragene Gesellschaft wegen Vermögenslosigkeit von Amts wegen nach § 394 FamFG zu löschen. Die Frist zur Erhebung eines Widerspruchs ist auf einen Monat festgesetzt."
    },
    {
      "date": "2025-10-22",
      "id": "134833",
      "original_text": "Löschungsankündigung\nBayern Amtsgericht München HRB 124678\nCIP Management Consulting GmbH – München",
      "type": "Löschungsankündigung",
      "state": "Bayern",
      "amtsgericht": "Amtsgericht München",
      "registernummer": "HRB 124678",
      "registerart": "HRB",
      "company_name": "CIP Management Consulting GmbH",
      "company_seat": "München",
      "details": "22.10.2025 (Bekanntmachungsdatum)\n\nBayern Amtsgericht München HRB 124678\nLöschungsankündigung\n\nCIP Management Consulting GmbH\nGesellschaft mit beschränkter Haftung\nMünchen\n\nDas Registergericht beabsichtigt, die im Handelsregister eingetragene Gesellschaft wegen Vermögenslosigkeit von Amts wegen nach § 394 FamFG zu löschen. Die Frist zur Erhebung eines Widerspruchs ist auf drei Monate festgesetzt."
    },
    {
      "date": "2025-10-22",
      "id": "134834",
      "original_text": "Löschungsankündigung\nBayern Amtsgericht München HRB 198698\nXclusive Cards GmbH – Grasbrunn",
      "type": "Löschungsankündigung",
      "state": "Bayern",
      "amtsgericht": "Amtsgericht München",
      "registernummer": "HRB 198698",
      "registerart": "HRB",
      "company_name": "Xclusive Cards GmbH",
      "company_seat": "Grasbrunn",
      "details": "22.10.2025 (Bekanntmachungsdatum)\n\nBayern Amtsgericht München HRB 198698\nLöschungsankündigung\n\nXclusive Cards GmbH\nGesellschaft mit beschränkter Haftung\nGrasbrunn\n\nDas Registergericht beabsichtigt, die im Handelsregister eingetragene Gesellschaft wegen Vermögenslosigkeit von Amts wegen nach § 394 FamFG zu löschen. #insert(Text=\"zztb_V_Widerspruchsfrist\")"
    },
    {
      "date": "2025-10-22",
      "id": "134835",
      "original_text": "Einreichung neuer Dokumente\nBayern Amtsgericht München HRB 218515\nTubis AG – München",
      "type": "Einreichung neuer Dokumente",
      "state": "Bayern",
      "amtsgericht": "Amtsgericht München",
      "registernummer": "HRB 218515",
      "registerart": "HRB",
      "company_name": "Tubis AG",
      "company_seat": "München",
      "details": "22.10.2025 (Bekanntmachungsdatum)\n\nBayern Amtsgericht München HRB 218515\nEinreichung neuer Dokumente 21.10.2025 (Eintragungsdatum)\n\nTubis AG\nAktiengesellschaft\nMünchen\n\nDem Amtsgericht München -Registergericht- ist eine Liste der Mitglieder des Aufsichtsrats eingereicht worden, § 106 AktG.Dem Amtsgericht München -Registergericht- ist eine Liste der Mitglieder des Aufsichtsrats eingereicht worden, § 106 AktG."
    },
    {
      "date": "2025-10-22",
      "id": "134836",
      "original_text": "Einreichung neuer Dokumente\nBayern Amtsgericht München HRB 247520\nMAN Truck & Bus SE – München",
      "type": "Einreichung neuer Dokumente",
      "state": "Bayern",
      "amtsgericht": "Amtsgericht München",
      "registernummer": "HRB 247520",
      "registerart": "HRB",
      "company_name": "MAN Truck & Bus SE",
      "company_seat": "München",
      "details": "22.10.2025 (Bekanntmachungsdatum)\n\nBayern Amtsgericht München HRB 247520\nEinreichung neuer Dokumente\n\nMAN Truck & Bus SE\nEuropäische Aktiengesellschaft (SE)\nMünchen\n\nDem Amtsgericht München -Registergericht- ist eine Liste der Mitglieder des Aufsichtsrats eingereicht worden, Art. 9 Abs. 1 Buchst. c (ii) SE-VO i.V.m. § 106 AktG."
    },
    {
      "date": "2025-10-22",
      "id": "134837",
      "original_text": "Einreichung neuer Dokumente\nBayern Amtsgericht Augsburg HRB 14293\nGWS GmbH – Schwabmünchen",
      "type": "Einreichung neuer Dokumente",
      "state": "Bayern",
      "amtsgericht": "Amtsgericht Augsburg",
      "registernummer": "HRB 14293",
      "registerart": "HRB",
      "company_name": "GWS GmbH",
      "company_seat": "Schwabmünchen",
      "details": "22.10.2025 (Bekanntmachungsdatum)\n\nBayern Amtsgericht Augsburg HRB 14293\nEinreichung neuer Dokumente\n\nGWS GmbH\nGesellschaft mit beschränkter Haftung\nSchwabmünchen\n\nDem Amtsgericht Augsburg -Registergericht- ist eine Liste der Mitglieder des Aufsichtsrats eingereicht worden, § 52 Abs. 3 S. 2 GmbHG."
    },
    {
      "date": "2025-10-22",
      "id": "134838",
      "original_text": "Einreichung neuer Dokumente\nBayern Amtsgericht Fürth HRB 9160\ndacore Datenbanksysteme AG – Heroldsberg",
      "type": "Einreichung neuer Dokumente",
      "state": "Bayern",
      "amtsgericht": "Amtsgericht Fürth",
      "registernummer": "HRB 9160",
      "registerart": "HRB",
      "company_name": "dacore Datenbanksysteme AG",
      "company_seat": "Heroldsberg",
      "details": "22.10.2025 (Bekanntmachungsdatum)\n\nBayern Amtsgericht Fürth HRB 9160\nEinreichung neuer Dokumente\n\ndacore Datenbanksysteme AG\nAktiengesellschaft\nHeroldsberg\n\nDem Amtsgericht Fürth -Registergericht- ist eine Liste der Mitglieder des Aufsichtsrats eingereicht worden, § 106 AktG."
    },
    {
      "date": "2025-10-22",
      "id": "134839",
      "original_text": "Registerbekanntmachung nach dem Umwandlungsgesetz\nBayern Amtsgericht Nürnberg HRA 9851\nKonrad Koch, Omnibusunternehmen – Rohr",
      "type": "Registerbekanntmachung nach dem Umwandlungsgesetz",
      "state": "Bayern",
      "amtsgericht": "Amtsgericht Nürnberg",
      "registernummer": "HRA 9851",
      "registerart": "HRA",
      "company_name": "Konrad Koch, Omnibusunternehmen",
      "company_seat": "Rohr",
      "details": "22.10.2025 (Bekanntmachungsdatum)\n\nBayern Amtsgericht Nürnberg HRA 9851\nRegisterbekanntmachung nach dem Umwandlungsgesetz 21.10.2025 (Eintragungsdatum)\n\nKonrad Koch, Omnibusunternehmen\nEinzelkaufmann / Einzelkauffrau\nRohr\n\nDen Gläubigern der an der Ausgliederung beteiligten Rechtsträger ist, wenn sie binnen sechs Monaten nach dem Tag, an dem die Eintragung der Ausgliederung in das Register des Sitzes desjenigen Rechtsträgers, dessen Gläubiger sie sind, nach §§ 125, 19 Abs. 3 UmwG als bekannt gemacht gilt, ihren Anspruch nach Grund und Höhe in Textform anmelden, Sicherheit zu leisten, soweit sie nicht Befriedigung verlangen können. Dieses Recht steht den Gläubigern jedoch nur zu, wenn sie glaubhaft machen, dass durch die Ausgliederung die Erfüllung ihrer Forderung gefährdet wird."
    },
    {
      "date": "2025-10-22",
      "id": "134840",
      "original_text": "Registerbekanntmachung nach dem Umwandlungsgesetz\nBayern Amtsgericht Fürth HRB 19385\nder steinbock Erlangen GmbH – Erlangen",
      "type": "Registerbekanntmachung nach dem Umwandlungsgesetz",
      "state": "Bayern",
      "amtsgericht": "Amtsgericht Fürth",
      "registernummer": "HRB 19385",
      "registerart": "HRB",
      "company_name": "der steinbock Erlangen GmbH",
      "company_seat": "Erlangen",
      "details": "22.10.2025 (Bekanntmachungsdatum)\n\nBayern Amtsgericht Fürth HRB 19385\nRegisterbekanntmachung nach dem Umwandlungsgesetz 21.10.2025 (Eintragungsdatum)\n\nder steinbock Erlangen GmbH\nGesellschaft mit beschränkter Haftung\nErlangen\n\nDen Gläubigern der an der Verschmelzung beteiligten Rechtsträger ist, wenn sie binnen sechs Monaten nach dem Tag, an dem die Eintragung der Verschmelzung in das Register des Sitzes desjenigen Rechtsträgers, dessen Gläubiger sie sind, nach § 19 Abs. 3 UmwG als bekannt gemacht gilt, ihren Anspruch nach Grund und Höhe in Textform anmelden, Sicherheit zu leisten, soweit sie nicht Befriedigung verlangen können. Dieses Recht steht den Gläubigern jedoch nur zu, wenn sie glaubhaft machen, dass durch die Verschmelzung die Erfüllung ihrer Forderung gefährdet wird."
    },
    {
      "date": "2025-10-22",
      "id": "134841",
      "original_text": "Registerbekanntmachung nach dem Umwandlungsgesetz\nBayern Amtsgericht Augsburg HRB 41801\nPP Media Services GmbH – Kissing",
      "type": "Registerbekanntmachung nach dem Umwandlungsgesetz",
      "state": "Bayern",
      "amtsgericht": "Amtsgericht Augsburg",
      "registernummer": "HRB 41801",
      "registerart": "HRB",
      "company_name": "PP Media Services GmbH",
      "company_seat": "Kissing",
      "details": "22.10.2025 (Bekanntmachungsdatum)\n\nBayern Amtsgericht Augsburg HRB 41801\nRegisterbekanntmachung nach dem Umwandlungsgesetz 21.10.2025 (Eintragungsdatum)\n\nPP Media Services GmbH\nGesellschaft mit beschränkter Haftung\nKissing\n\nDen Gläubigern der an der Spaltung beteiligten Rechtsträger ist, wenn sie binnen sechs Monaten nach dem Tag, an dem die Eintragung der Spaltung in das Register des Sitzes desjenigen Rechtsträgers, dessen Gläubiger sie sind, nach §§ 125, 19 Abs. 3 UmwG als bekannt gemacht gilt, ihren Anspruch nach Grund und Höhe in Textform anmelden, Sicherheit zu leisten, soweit sie nicht Befriedigung verlangen können. Dieses Recht steht den Gläubigern jedoch nur zu, wenn sie glaubhaft machen, dass durch die Spaltung die Erfüllung ihrer Forderung gefährdet wird."
    },
    {
      "date": "2025-10-22",
      "id": "134842",
      "original_text": "Registerbekanntmachung nach dem Umwandlungsgesetz\nBayern Amtsgericht Nürnberg HRB 44838\nOmnibus Koch GmbH – Rohr",
      "type": "Registerbekanntmachung nach dem Umwandlungsgesetz",
      "state": "Bayern",
      "amtsgericht": "Amtsgericht Nürnberg",
      "registernummer": "HRB 44838",
      "registerart": "HRB",
      "company_name": "Omnibus Koch GmbH",
      "company_seat": "Rohr",
      "details": "22.10.2025 (Bekanntmachungsdatum)\n\nBayern Amtsgericht Nürnberg HRB 44838\nRegisterbekanntmachung nach dem Umwandlungsgesetz 21.10.2025 (Eintragungsdatum)\n\nOmnibus Koch GmbH\nGesellschaft mit beschränkter Haftung\nRohr\n\nDen Gläubigern der an der Ausgliederung beteiligten Rechtsträger ist, wenn sie binnen sechs Monaten nach dem Tag, an dem die Eintragung der Ausgliederung in das Register des Sitzes desjenigen Rechtsträgers, dessen Gläubiger sie sind, nach §§ 125, 19 Abs. 3 UmwG als bekannt gemacht gilt, ihren Anspruch nach Grund und Höhe in Textform anmelden, Sicherheit zu leisten, soweit sie nicht Befriedigung verlangen können. Dieses Recht steht den Gläubigern jedoch nur zu, wenn sie glaubhaft machen, dass durch die Ausgliederung die Erfüllung ihrer Forderung gefährdet wird."
    },
    {
      "date": "2025-10-22",
      "id": "134843",
      "original_text": "Löschungsankündigung\nBerlin Amtsgericht Berlin (Charlottenburg) HRB 212409\nF.A. Handel GmbH – Berlin",
      "type": "Löschungsankündigung",
      "state": "Berlin",
      "amtsgericht": "Amtsgericht Berlin (Charlottenburg)",
      "registernummer": "HRB 212409",
      "registerart": "HRB",
      "company_name": "F.A. Handel GmbH",
      "company_seat": "Berlin",
      "details": "22.10.2025 (Bekanntmachungsdatum)\n\nBerlin Amtsgericht Berlin (Charlottenburg) HRB 212409\nLöschungsankündigung\n\nF.A. Handel GmbH\nGesellschaft mit beschränkter Haftung\nBerlin\n\nBei der nachstehenden Gesellschaft wird das Amtslöschungsverfahren gemäß § 394 FamFG eingeleitet. Widerspruchsfrist\n6 Wochen."
    },
    {
      "date": "2025-10-22",
      "id": "134844",
      "original_text": "Sonstige Registerbekanntmachung\nBrandenburg Amtsgericht Neuruppin HRB 9308\nFabricius 101. Vermögensverwaltungs GmbH – Liebenwalde",
      "type": "Sonstige Registerbekanntmachung",
      "state": "Brandenburg",
      "amtsgericht": "Amtsgericht Neuruppin",
      "registernummer": "HRB 9308",
      "registerart": "HRB",
      "company_name": "Fabricius 101. Vermögensverwaltungs GmbH",
      "company_seat": "Liebenwalde",
      "details": "22.10.2025 (Bekanntmachungsdatum)\n\nBrandenburg Amtsgericht Neuruppin HRB 9308\nSonstige Registerbekanntmachung\n\nFabricius 101. Vermögensverwaltungs GmbH\nGesellschaft mit beschränkter Haftung\nLiebenwalde\n\nDie vermögenslose Gesellschaft ist auf Grund des § 394 FamFG von Amts wegen gelöscht."
    },
    {
      "date": "2025-10-22",
      "id": "134845",
      "original_text": "Löschungsankündigung\nBaden-Württemberg Amtsgericht Mannheim HRB 747697\nE & A Sicherheit Service UG (haftungsbeschränkt) – Mannheim",
      "type": "Löschungsankündigung",
      "state": "Baden-Württemberg",
      "amtsgericht": "Amtsgericht Mannheim",
      "registernummer": "HRB 747697",
      "registerart": "HRB",
      "company_name": "E & A Sicherheit Service UG (haftungsbeschränkt)",
      "company_seat": "Mannheim",
      "details": "22.10.2025 (Bekanntmachungsdatum)\n\nBaden-Württemberg Amtsgericht Mannheim HRB 747697\nLöschungsankündigung\n\nE & A Sicherheit Service UG (haftungsbeschränkt)\nGesellschaft mit beschränkter Haftung\nMannheim\n\nDas Gericht beabsichtigt, die Gesellschaft wegen Vermögenslosigkeit im Handelsregister von Amts wegen nach § 394 FamFG zu löschen. Die Frist zur Geltendmachung eines Widerspruchs gegen die beabsichtigte Löschung ist auf einen Monat ab Veröffentlichung bestimmt."
    },
    {
      "date": "2025-10-22",
      "id": "134846",
      "original_text": "Registerbekanntmachung nach dem Umwandlungsgesetz\nBaden-Württemberg Amtsgericht Ulm HRB 733728\nAniCura Kleintierspezialisten Ravensburg GmbH – Ravensburg",
      "type": "Registerbekanntmachung nach dem Umwandlungsgesetz",
      "state": "Baden-Württemberg",
      "amtsgericht": "Amtsgericht Ulm",
      "registernummer": "HRB 733728",
      "registerart": "HRB",
      "company_name": "AniCura Kleintierspezialisten Ravensburg GmbH",
      "company_seat": "Ravensburg",
      "details": "22.10.2025 (Bekanntmachungsdatum)\n\nBaden-Württemberg Amtsgericht Ulm HRB 733728\nRegisterbekanntmachung nach dem Umwandlungsgesetz 22.10.2025 (Eintragungsdatum)\n\nAniCura Kleintierspezialisten Ravensburg GmbH\nGesellschaft mit beschränkter Haftung\nRavensburg\n\nAls nicht eingetragen wird bekanntgemacht:\nDen Gläubigern der an der Verschmelzung beteiligten Rechtsträger ist, wenn sie binnen sechs Monaten nach dem Tag, an dem die Eintragung der Verschmelzung in das Register des Sitzes desjenigen Rechtsträgers, dessen Gläubiger sie sind, nach § 19 Abs. 3 UmwG als bekanntgemacht gilt, ihren Anspruch nach Grund und Höhe schriftlich anmelden, Sicherheit zu leisten, soweit sie nicht Befriedigung verlangen können. Dieses Recht steht den Gläubigern jedoch nur zu, wenn sie glaubhaft machen, dass durch die Verschmelzung die Erfüllung ihrer Forderung gefährdet wird."
    },
    {
      "date": "2025-10-22",
      "id": "134847",
      "original_text": "Registerbekanntmachung nach dem Umwandlungsgesetz\nSaarland Amtsgericht Saarbrücken HRB 109842\nRheingold AKTEX Saarbrücken GmbH – Saarbrücken",
      "type": "Registerbekanntmachung nach dem Umwandlungsgesetz",
      "state": "Saarland",
      "amtsgericht": "Amtsgericht Saarbrücken",
      "registernummer": "HRB 109842",
      "registerart": "HRB",
      "company_name": "Rheingold AKTEX Saarbrücken GmbH",
      "company_seat": "Saarbrücken",
      "details": "22.10.2025 (Bekanntmachungsdatum)\n\nSaarland Amtsgericht Saarbrücken HRB 109842\nRegisterbekanntmachung nach dem Umwandlungsgesetz 22.10.2025 (Eintragungsdatum)\n\nRheingold AKTEX Saarbrücken GmbH\nGesellschaft mit beschränkter Haftung\nSaarbrücken\n\nAls nicht eingetragen wird bekannt gemacht: Den Gläubigern der an der Verschmelzung beteiligten Gesellschaften ist, wenn sie binnen sechs Monaten nach dem Tag, an dem die Eintragung der Verschmelzung in das Register des Sitzes desjenigen Rechtsträgers, dessen Gläubiger sie sind, nach § 19 Absatz 3 UmwG bekannt gemacht worden ist, ihren Anspruch nach Grund und Höhe schriftlich anmelden, Sicherheit zu leisten, soweit sie nicht Befriedigung verlangen können. Dieses Recht steht den Gläubigern jedoch nur zu, wenn sie glaubhaft machen, dass durch die Verschmelzung die Erfüllung ihrer Forderung gefährdet wird."
    },
    {
      "date": "2025-10-22",
      "id": "134848",
      "original_text": "Löschungsankündigung\nBaden-Württemberg Amtsgericht Stuttgart HRB 765607\nHerz und Seele Pflegedienst GmbH – Leonberg",
      "type": "Löschungsankündigung",
      "state": "Baden-Württemberg",
      "amtsgericht": "Amtsgericht Stuttgart",
      "registernummer": "HRB 765607",
      "registerart": "HRB",
      "company_name": "Herz und Seele Pflegedienst GmbH",
      "company_seat": "Leonberg",
      "details": "22.10.2025 (Bekanntmachungsdatum)\n\nBaden-Württemberg Amtsgericht Stuttgart HRB 765607\nLöschungsankündigung\n\nHerz und Seele Pflegedienst GmbH\nGesellschaft mit beschränkter Haftung\nLeonberg\n\nDas Gericht beabsichtigt, die Gesellschaft wegen Vermögenslosigkeit im Handelsregister von Amts wegen nach § 394 FamFG zu löschen. Die Frist zur Geltendmachung eines Widerspruchs gegen die beabsichtigte Löschung ist auf zwei Monate ab Veröffentlichung bestimmt."
    },
    {
      "date": "2025-10-22",
      "id": "134849",
      "original_text": "Löschungsankündigung\nHamburg Amtsgericht Hamburg HRA 72110\nCarl C. Franzen Immobilien International – Hamburg",
      "type": "Löschungsankündigung",
      "state": "Hamburg",
      "amtsgericht": "Amtsgericht Hamburg",
      "registernummer": "HRA 72110",
      "registerart": "HRA",
      "company_name": "Carl C. Franzen Immobilien International",
      "company_seat": "Hamburg",
      "details": "22.10.2025 (Bekanntmachungsdatum)\n\nHamburg Amtsgericht Hamburg HRA 72110\nLöschungsankündigung\n\nCarl C. Franzen Immobilien International\nEinzelkaufmann\nHamburg\n\nDas Registergericht beabsichtigt, die im Handelsregister eingetragene Firma von Amts wegen nach § 31 Abs. 2 HBG zu löschen. Die Frist zur Erhebung eines Widerspruchs gegen die beabsichtigte Löschung wird auf 3 Monate festgesetzt."
    },
    {
      "date": "2025-10-22",
      "id": "134850",
      "original_text": "Löschungsankündigung\nMecklenburg-Vorpommern Amtsgericht Rostock HRA 1764\nGüstrower L-M-B GmbH & Co. KG – Güstrow",
      "type": "Löschungsankündigung",
      "state": "Mecklenburg-Vorpommern",
      "amtsgericht": "Amtsgericht Rostock",
      "registernummer": "HRA 1764",
      "registerart": "HRA",
      "company_name": "Güstrower L-M-B GmbH & Co. KG",
      "company_seat": "Güstrow",
      "details": "22.10.2025 (Bekanntmachungsdatum)\n\nMecklenburg-Vorpommern Amtsgericht Rostock HRA 1764\nLöschungsankündigung\n\nGüstrower L-M-B GmbH & Co. KG\nKommanditgesellschaft\nGüstrow\n\nDas Registergericht beabsichtigt, die im Handelsregister eingetragene Gesellschaft von Amts wegen nach § 394 FamFG zu löschen. Die Frist zur Erhebung eines Widerspruchs gegen die beabsichtigte Löschung wird auf drei Monate festgesetzt."
    },
    {
      "date": "2025-10-22",
      "id": "134851",
      "original_text": "Sonstige Registerbekanntmachung\nBaden-Württemberg Amtsgericht Ulm HRB 746549\nAniCura Braunschweig GmbH – Ravensburg",
      "type": "Sonstige Registerbekanntmachung",
      "state": "Baden-Württemberg",
      "amtsgericht": "Amtsgericht Ulm",
      "registernummer": "HRB 746549",
      "registerart": "HRB",
      "company_name": "AniCura Braunschweig GmbH",
      "company_seat": "Ravensburg",
      "details": "22.10.2025 (Bekanntmachungsdatum)\n\nBaden-Württemberg Amtsgericht Ulm HRB 746549\nSonstige Registerbekanntmachung 22.10.2025 (Eintragungsdatum)\n\nAniCura Braunschweig GmbH\nGesellschaft mit beschränkter Haftung\nRavensburg\n\nAls nicht eingetragen wird bekanntgemacht:\nDen Gläubigern der Gesellschaft, deren Forderungen begründet worden sind, bevor die Eintragung der Beendigung des Vertrages in das Handelsregister nach § 10 HGB als bekanntgemacht gilt, ist vom anderen Vertragsteil Sicherheit zu leisten, wenn sie sich binnen sechs Monaten nach der Bekanntmachung zu diesem Zweck bei ihm melden.\nDen Gläubigern der an der Verschmelzung beteiligten Rechtsträger ist, wenn sie binnen sechs Monaten nach dem Tag, an dem die Eintragung der Verschmelzung in das Register des Sitzes desjenigen Rechtsträgers, dessen Gläubiger sie sind, nach § 19 Abs. 3 UmwG als bekanntgemacht gilt, ihren Anspruch nach Grund und Höhe schriftlich anmelden, Sicherheit zu leisten, soweit sie nicht Befriedigung verlangen können. Dieses Recht steht den Gläubigern jedoch nur zu, wenn sie glaubhaft machen, dass durch die Verschmelzung die Erfüllung ihrer Forderung gefährdet wird."
    },
    {
      "date": "2025-10-22",
      "id": "134852",
      "original_text": "Sonstige Registerbekanntmachung\nBaden-Württemberg Amtsgericht Ulm HRB 741439\nAniCura Lörrach GmbH – Ravensburg",
      "type": "Sonstige Registerbekanntmachung",
      "state": "Baden-Württemberg",
      "amtsgericht": "Amtsgericht Ulm",
      "registernummer": "HRB 741439",
      "registerart": "HRB",
      "company_name": "AniCura Lörrach GmbH",
      "company_seat": "Ravensburg",
      "details": "22.10.2025 (Bekanntmachungsdatum)\n\nBaden-Württemberg Amtsgericht Ulm HRB 741439\nSonstige Registerbekanntmachung 22.10.2025 (Eintragungsdatum)\n\nAniCura Lörrach GmbH\nGesellschaft mit beschränkter Haftung\nRavensburg\n\nAls nicht eingetragen wird bekanntgemacht:\nDen Gläubigern der Gesellschaft, deren Forderungen begründet worden sind, bevor die Eintragung der Beendigung des Vertrages in das Handelsregister nach § 10 HGB als bekanntgemacht gilt, ist vom anderen Vertragsteil Sicherheit zu leisten, wenn sie sich binnen sechs Monaten nach der Bekanntmachung zu diesem Zweck bei ihm melden.\nDen Gläubigern der an der Verschmelzung beteiligten Rechtsträger ist, wenn sie binnen sechs Monaten nach dem Tag, an dem die Eintragung der Verschmelzung in das Register des Sitzes desjenigen Rechtsträgers, dessen Gläubiger sie sind, nach § 19 Abs. 3 UmwG als bekanntgemacht gilt, ihren Anspruch nach Grund und Höhe schriftlich anmelden, Sicherheit zu leisten, soweit sie nicht Befriedigung verlangen können. Dieses Recht steht den Gläubigern jedoch nur zu, wenn sie glaubhaft machen, dass durch die Verschmelzung die Erfüllung ihrer Forderung gefährdet wird."
    },
    {
      "date": "2025-10-22",
      "id": "134853",
      "original_text": "Registerbekanntmachung nach dem Umwandlungsgesetz\nSchleswig-Holstein Amtsgericht Kiel HRB 11627\nDS Immobilien Verwaltung GmbH – Bad Segeberg",
      "type": "Registerbekanntmachung nach dem Umwandlungsgesetz",
      "state": "Schleswig-Holstein",
      "amtsgericht": "Amtsgericht Kiel",
      "registernummer": "HRB 11627",
      "registerart": "HRB",
      "company_name": "DS Immobilien Verwaltung GmbH",
      "company_seat": "Bad Segeberg",
      "details": "22.10.2025 (Bekanntmachungsdatum)\n\nSchleswig-Holstein Amtsgericht Kiel HRB 11627\nRegisterbekanntmachung nach dem Umwandlungsgesetz 17.10.2025 (Eintragungsdatum)\n\nDS Immobilien Verwaltung GmbH\nGesellschaft mit beschränkter Haftung\nBad Segeberg\n\nZu Eintragungsnummer 14 vom 17.10.2025 wird als nicht eingetragen veröffentlicht:  Den Gläubigern der an der Verschmelzung beteiligten Rechtsträger ist, wenn sie binnen sechs Monaten nach dem Tag, an dem die Eintragung der Verschmelzung in das Register des Sitzes desjenigen Rechtsträgers, dessen Gläubiger sie sind, nach § 19 Abs. 3 UmwG bekannt gemacht worden ist, ihren Anspruch nach Grund und Höhe schriftlich anmelden, Sicherheit zu leisten, soweit sie nicht Befriedigung verlangen können. Dieses Recht steht den Gläubigern jedoch nur zu, wenn sie glaubhaft machen, dass durch die Verschmelzung die Erfüllung ihrer Forderung gefährdet wird."
    },
    {
      "date": "2025-10-22",
      "id": "134854",
      "original_text": "Einreichung neuer Dokumente\nBerlin Amtsgericht Berlin (Charlottenburg) HRB 156846\nvolders GmbH – Berlin",
      "type": "Einreichung neuer Dokumente",
      "state": "Berlin",
      "amtsgericht": "Amtsgericht Berlin (Charlottenburg)",
      "registernummer": "HRB 156846",
      "registerart": "HRB",
      "company_name": "volders GmbH",
      "company_seat": "Berlin",
      "details": "22.10.2025 (Bekanntmachungsdatum)\n\nBerlin Amtsgericht Berlin (Charlottenburg) HRB 156846\nEinreichung neuer Dokumente\n\nvolders GmbH\nGesellschaft mit beschränkter Haftung\nBerlin\n\nAls nicht eingetragen wird veröffentlicht:\nEs wurde eine neue Liste der Beiratsmitglieder eingereicht (§52 GmbHG)."
    },
    {
      "date": "2025-10-22",
      "id": "134855",
      "original_text": "Löschungsankündigung\nBrandenburg Amtsgericht Potsdam HRB 34329\nABC Remox Leistung GmbH – Nuthe-Urstromtal",
      "type": "Löschungsankündigung",
      "state": "Brandenburg",
      "amtsgericht": "Amtsgericht Potsdam",
      "registernummer": "HRB 34329",
      "registerart": "HRB",
      "company_name": "ABC Remox Leistung GmbH",
      "company_seat": "Nuthe-Urstromtal",
      "details": "22.10.2025 (Bekanntmachungsdatum)\n\nBrandenburg Amtsgericht Potsdam HRB 34329\nLöschungsankündigung\n\nABC Remox Leistung GmbH\nGesellschaft mit beschränkter Haftung\nNuthe-Urstromtal\n\nBei der nachstehenden Gesellschaft wird das Amtslöschungsverfahren gemäß § 394 FamFG eingeleitet. Widerspruchsfrist 8 Wochen."
    },
    {
      "date": "2025-10-22",
      "id": "134856",
      "original_text": "Registerbekanntmachung nach dem Umwandlungsgesetz\nSchleswig-Holstein Amtsgericht Kiel HRB 12659\nTruck-Center Uhl GmbH – Osterrönfeld",
      "type": "Registerbekanntmachung nach dem Umwandlungsgesetz",
      "state": "Schleswig-Holstein",
      "amtsgericht": "Amtsgericht Kiel",
      "registernummer": "HRB 12659",
      "registerart": "HRB",
      "company_name": "Truck-Center Uhl GmbH",
      "company_seat": "Osterrönfeld",
      "details": "22.10.2025 (Bekanntmachungsdatum)\n\nSchleswig-Holstein Amtsgericht Kiel HRB 12659\nRegisterbekanntmachung nach dem Umwandlungsgesetz 22.10.2025 (Eintragungsdatum)\n\nTruck-Center Uhl GmbH\nGesellschaft mit beschränkter Haftung\nOsterrönfeld\n\nZu Eintragungsnummer 5 vom 22.10.2025 wird als nicht eingetragen veröffentlicht:  Den Gläubigern der an der Verschmelzung beteiligten Rechtsträger ist, wenn sie binnen sechs Monaten nach dem Tag, an dem die Eintragung der Verschmelzung in das Register des Sitzes desjenigen Rechtsträgers, dessen Gläubiger sie sind, nach § 19 Abs. 3 UmwG bekannt gemacht worden ist, ihren Anspruch nach Grund und Höhe schriftlich anmelden, Sicherheit zu leisten, soweit sie nicht Befriedigung verlangen können. Dieses Recht steht den Gläubigern jedoch nur zu, wenn sie glaubhaft machen, dass durch die Verschmelzung die Erfüllung ihrer Forderung gefährdet wird."
    },
    {
      "date": "2025-10-22",
      "id": "134857",
      "original_text": "Löschungsankündigung\nSaarland Amtsgericht Saarbrücken HRB 105631\nKonKarla UG (haftungsbeschränkt) – St. Wendel",
      "type": "Löschungsankündigung",
      "state": "Saarland",
      "amtsgericht": "Amtsgericht Saarbrücken",
      "registernummer": "HRB 105631",
      "registerart": "HRB",
      "company_name": "KonKarla UG (haftungsbeschränkt)",
      "company_seat": "St. Wendel",
      "details": "22.10.2025 (Bekanntmachungsdatum)\n\nSaarland Amtsgericht Saarbrücken HRB 105631\nLöschungsankündigung\n\nKonKarla UG (haftungsbeschränkt)\nGesellschaft mit beschränkter Haftung\nSt. Wendel\n\nEs ist beabsichtigt, die Gesellschaft von Amts wegen gemäß § 394 FamFG wegen Vermögenslosigkeit zu löschen.\nGegen die Löschung von Amts wegen ist das Rechtsmittel des Widerspruchs statthaft. Der Widerspruch ist binnen einer Frist zwei Monaten beginnend mit dem Tag dieser Veröffentlichung durch Einreichen eines Widerspruchsschreibens -schriftlich oder zur Niederschrift der Geschäftsstelle beim Amtsgericht Saarbrücken, -zentrales Handelsregister-, Mainzerstr.178, 66121 Saarbrücken einzulegen.\nDer Widerspruch muss die Bezeichnung der angefochtenen Löschungsankündigung enthalten sowie die Erklärung, dass Widerspruch eingelegt wird. Er ist vom Widerspruchsführer oder seinem Bevollmächtigten zu unterzeichnen.\nDas Widerspruchsschreiben kann auch in der Form eines elektronischen Dokumentes eingereicht werden, das mit einer qualifizierten elektronischen Signatur nach dem Signaturgesetz versehen sein muss (§§ 14 Abs. 2 FamFG, 130a, 298 ZPO)."
    },
    {
      "date": "2025-10-22",
      "id": "134858",
      "original_text": "Löschungsankündigung\nBrandenburg Amtsgericht Potsdam HRB 31689\nTrevoxx Baugesellschaft mbH – Zossen",
      "type": "Löschungsankündigung",
      "state": "Brandenburg",
      "amtsgericht": "Amtsgericht Potsdam",
      "registernummer": "HRB 31689",
      "registerart": "HRB",
      "company_name": "Trevoxx Baugesellschaft mbH",
      "company_seat": "Zossen",
      "details": "22.10.2025 (Bekanntmachungsdatum)\n\nBrandenburg Amtsgericht Potsdam HRB 31689\nLöschungsankündigung\n\nTrevoxx Baugesellschaft mbH\nGesellschaft mit beschränkter Haftung\nZossen\n\nBei der nachstehenden Gesellschaft wird das Amtslöschungsverfahren gemäß § 394 FamFG eingeleitet. Widerspruchsfrist 8 Wochen."
    },
    {
      "date": "2025-10-22",
      "id": "134859",
      "original_text": "Löschungsankündigung\nBaden-Württemberg Amtsgericht Freiburg HRB 726675\nKaley GmbH – Todtnau",
      "type": "Löschungsankündigung",
      "state": "Baden-Württemberg",
      "amtsgericht": "Amtsgericht Freiburg",
      "registernummer": "HRB 726675",
      "registerart": "HRB",
      "company_name": "Kaley GmbH",
      "company_seat": "Todtnau",
      "details": "22.10.2025 (Bekanntmachungsdatum)\n\nBaden-Württemberg Amtsgericht Freiburg HRB 726675\nLöschungsankündigung\n\nKaley GmbH\nGesellschaft mit beschränkter Haftung\nTodtnau\n\nDas Gericht beabsichtigt, die Gesellschaft wegen Vermögenslosigkeit im Handelsregister von Amts wegen nach § 394 FamFG zu löschen. Die Frist zur Geltendmachung eines Widerspruchs gegen die beabsichtigte Löschung ist auf einen Monat ab Veröffentlichung bestimmt."
    },
    {
      "date": "2025-10-22",
      "id": "134860",
      "original_text": "Registerbekanntmachung nach dem Umwandlungsgesetz\nBaden-Württemberg Amtsgericht Stuttgart HRB 762873\nMercedes-Benz AG – Stuttgart",
      "type": "Registerbekanntmachung nach dem Umwandlungsgesetz",
      "state": "Baden-Württemberg",
      "amtsgericht": "Amtsgericht Stuttgart",
      "registernummer": "HRB 762873",
      "registerart": "HRB",
      "company_name": "Mercedes-Benz AG",
      "company_seat": "Stuttgart",
      "details": "22.10.2025 (Bekanntmachungsdatum)\n\nBaden-Württemberg Amtsgericht Stuttgart HRB 762873\nRegisterbekanntmachung nach dem Umwandlungsgesetz\n\nMercedes-Benz AG\nAktiengesellschaft\nStuttgart\n\nDie Gesellschaft hat am 21.10.2025 den Entwurf des Verschmelzungsvertrages zwischen \"Mercedes-Benz Mobility AG\", Stuttgart ( Amtsgericht Stuttgart HRB 737788)\nund der hiesigen Gesellschaft (übernehmender Rechtsträger) zum Handelsregister eingereicht."
    },
    {
      "date": "2025-10-22",
      "id": "134861",
      "original_text": "Registerbekanntmachung nach dem Umwandlungsgesetz\nBaden-Württemberg Amtsgericht Stuttgart HRB 798841\nDürr CTS GmbH – Stuttgart",
      "type": "Registerbekanntmachung nach dem Umwandlungsgesetz",
      "state": "Baden-Württemberg",
      "amtsgericht": "Amtsgericht Stuttgart",
      "registernummer": "HRB 798841",
      "registerart": "HRB",
      "company_name": "Dürr CTS GmbH",
      "company_seat": "Stuttgart",
      "details": "22.10.2025 (Bekanntmachungsdatum)\n\nBaden-Württemberg Amtsgericht Stuttgart HRB 798841\nRegisterbekanntmachung nach dem Umwandlungsgesetz 22.10.2025 (Eintragungsdatum)\n\nDürr CTS GmbH\nGesellschaft mit beschränkter Haftung\nStuttgart\n\nAls nicht eingetragen wird bekanntgemacht:  Den Gläubigern der an der Abspaltung beteiligten Rechtsträger ist, wenn sie binnen sechs Monaten nach dem Tag, an dem die Eintragung der Abspaltung in das Register des Sitzes desjenigen Rechtsträgers, dessen Gläubiger sie sind, nach § 19 Abs. 3 UmwG als bekanntgemacht gilt, ihren Anspruch nach Grund und Höhe schriftlich anmelden, Sicherheit zu leisten, soweit sie nicht Befriedigung verlangen können. Dieses Recht steht den Gläubigern jedoch nur zu, wenn sie glaubhaft machen, dass durch die Abspaltung die Erfüllung ihrer Forderung gefährdet wird."
    },
    {
      "date": "2025-10-22",
      "id": "134862",
      "original_text": "Registerbekanntmachung nach dem Umwandlungsgesetz\nBaden-Württemberg Amtsgericht Freiburg HRB 734175\nSamuel Pflegedienst GmbH – Elzach",
      "type": "Registerbekanntmachung nach dem Umwandlungsgesetz",
      "state": "Baden-Württemberg",
      "amtsgericht": "Amtsgericht Freiburg",
      "registernummer": "HRB 734175",
      "registerart": "HRB",
      "company_name": "Samuel Pflegedienst GmbH",
      "company_seat": "Elzach",
      "details": "22.10.2025 (Bekanntmachungsdatum)\n\nBaden-Württemberg Amtsgericht Freiburg HRB 734175\nRegisterbekanntmachung nach dem Umwandlungsgesetz 22.10.2025 (Eintragungsdatum)\n\nSamuel Pflegedienst GmbH\nGesellschaft mit beschränkter Haftung\nElzach\n\nDen Gläubigern der an der Ausgliederung beteiligten Rechtsträger ist, wenn sie binnen sechs Monaten nach dem Tag, an dem die Eintragung der Ausgliederung in das Register des Sitzes desjenigen Rechtsträgers, dessen Gläubiger sie sind, nach § 19 Abs. 3 UmwG als bekanntgemacht gilt, ihren Anspruch nach Grund und Höhe schriftlich anmelden, Sicherheit zu leisten, soweit sie nicht Befriedigung verlangen können. Dieses Recht steht den Gläubigern jedoch nur zu, wenn sie glaubhaft machen, dass durch die Ausgliederung die Erfüllung ihrer Forderung gefährdet wird."
    },
    {
      "date": "2025-10-22",
      "id": "134863",
      "original_text": "Registerbekanntmachung nach dem Umwandlungsgesetz\nBaden-Württemberg Amtsgericht Stuttgart HRB 757705\nDürr Systems AG – Stuttgart",
      "type": "Registerbekanntmachung nach dem Umwandlungsgesetz",
      "state": "Baden-Württemberg",
      "amtsgericht": "Amtsgericht Stuttgart",
      "registernummer": "HRB 757705",
      "registerart": "HRB",
      "company_name": "Dürr Systems AG",
      "company_seat": "Stuttgart",
      "details": "22.10.2025 (Bekanntmachungsdatum)\n\nBaden-Württemberg Amtsgericht Stuttgart HRB 757705\nRegisterbekanntmachung nach dem Umwandlungsgesetz 22.10.2025 (Eintragungsdatum)\n\nDürr Systems AG\nAktiengesellschaft\nStuttgart\n\nAls nicht eingetragen wird bekanntgemacht:\nDen Gläubigern der an der Abspaltung beteiligten Rechtsträger ist, wenn sie binnen sechs Monaten nach dem Tag, an dem die Eintragung der Abspaltung in das Register des Sitzes desjenigen Rechtsträgers, dessen Gläubiger sie sind, nach § 19 Abs. 3 UmwG als bekanntgemacht gilt, ihren Anspruch nach Grund und Höhe schriftlich anmelden, Sicherheit zu leisten, soweit sie nicht Befriedigung verlangen können. Dieses Recht steht den Gläubigern jedoch nur zu, wenn sie glaubhaft machen, dass durch die Abspaltung die Erfüllung ihrer Forderung gefährdet wird."
    },
    {
      "date": "2025-10-22",
      "id": "134864",
      "original_text": "Löschungsankündigung\nBrandenburg Amtsgericht Potsdam HRB 36699\nStein der Weisen UG (haftungsbeschränkt) – Potsdam",
      "type": "Löschungsankündigung",
      "state": "Brandenburg",
      "amtsgericht": "Amtsgericht Potsdam",
      "registernummer": "HRB 36699",
      "registerart": "HRB",
      "company_name": "Stein der Weisen UG (haftungsbeschränkt)",
      "company_seat": "Potsdam",
      "details": "22.10.2025 (Bekanntmachungsdatum)\n\nBrandenburg Amtsgericht Potsdam HRB 36699\nLöschungsankündigung\n\nStein der Weisen UG (haftungsbeschränkt)\nGesellschaft mit beschränkter Haftung\nPotsdam\n\nBei der nachstehenden Gesellschaft wird das Amtslöschungsverfahren gemäß § 394 FamFG eingeleitet. Widerspruchsfrist 8 Wochen."
    },
    {
      "date": "2025-10-22",
      "id": "134865",
      "original_text": "Löschungsankündigung\nBerlin Amtsgericht Berlin (Charlottenburg) HRB 217512\nMondholz GmbH – Berlin",
      "type": "Löschungsankündigung",
      "state": "Berlin",
      "amtsgericht": "Amtsgericht Berlin (Charlottenburg)",
      "registernummer": "HRB 217512",
      "registerart": "HRB",
      "company_name": "Mondholz GmbH",
      "company_seat": "Berlin",
      "details": "22.10.2025 (Bekanntmachungsdatum)\n\nBerlin Amtsgericht Berlin (Charlottenburg) HRB 217512\nLöschungsankündigung\n\nMondholz GmbH\nGesellschaft mit beschränkter Haftung\nBerlin\n\nBei der nachstehenden Gesellschaft wird das Amtslöschungsverfahren gemäß § 394 FamFG eingeleitet. Widerspruchsfrist 6 Wochen"
    },
    {
      "date": "2025-10-22",
      "id": "134866",
      "original_text": "Registerbekanntmachung nach dem Umwandlungsgesetz\nBaden-Württemberg Amtsgericht Freiburg HRA 708883\nSamuel Pflegedienst, ambulanter Pflegedienst - e.K. - – Elzach",
      "type": "Registerbekanntmachung nach dem Umwandlungsgesetz",
      "state": "Baden-Württemberg",
      "amtsgericht": "Amtsgericht Freiburg",
      "registernummer": "HRA 708883",
      "registerart": "HRA",
      "company_name": "Samuel Pflegedienst, ambulanter Pflegedienst - e.K. -",
      "company_seat": "Elzach",
      "details": "22.10.2025 (Bekanntmachungsdatum)\n\nBaden-Württemberg Amtsgericht Freiburg HRA 708883\nRegisterbekanntmachung nach dem Umwandlungsgesetz 22.10.2025 (Eintragungsdatum)\n\nSamuel Pflegedienst, ambulanter Pflegedienst - e.K. -\nEinzelkaufmann / Einzelkauffrau\nElzach\n\nDen Gläubigern der an der Ausgliederung beteiligten Rechtsträger ist, wenn sie binnen sechs Monaten nach dem Tag, an dem die Eintragung der Ausgliederung in das Register des Sitzes desjenigen Rechtsträgers, dessen Gläubiger sie sind, nach § 19 Abs. 3 UmwG als bekanntgemacht gilt, ihren Anspruch nach Grund und Höhe schriftlich anmelden, Sicherheit zu leisten, soweit sie nicht Befriedigung verlangen können. Dieses Recht steht den Gläubigern jedoch nur zu, wenn sie glaubhaft machen, dass durch die Ausgliederung die Erfüllung ihrer Forderung gefährdet wird."
    },
    {
      "date": "2025-10-22",
      "id": "134867",
      "original_text": "Registerbekanntmachung nach dem Umwandlungsgesetz\nSchleswig-Holstein Amtsgericht Lübeck HRB 11488\nurban apes Nord GmbH – Lübeck",
      "type": "Registerbekanntmachung nach dem Umwandlungsgesetz",
      "state": "Schleswig-Holstein",
      "amtsgericht": "Amtsgericht Lübeck",
      "registernummer": "HRB 11488",
      "registerart": "HRB",
      "company_name": "urban apes Nord GmbH",
      "company_seat": "Lübeck",
      "details": "22.10.2025 (Bekanntmachungsdatum)\n\nSchleswig-Holstein Amtsgericht Lübeck HRB 11488\nRegisterbekanntmachung nach dem Umwandlungsgesetz 22.10.2025 (Eintragungsdatum)\n\nurban apes Nord GmbH\nGesellschaft mit beschränkter Haftung\nLübeck\n\nZu Eintragungsnummer 7 vom 22.10.2025 wird als nicht eingetragen veröffentlicht: Den Gläubigern der an der Verschmelzung beteiligten Rechtsträger ist, wenn sie binnen sechs Monaten nach dem Tag, an dem die Eintragung der Verschmelzung in das Register des Sitzes desjenigen Rechtsträgers, dessen Gläubiger sie sind, als bekannt gemacht gilt, ihren Anspruch nach Grund und Höhe schriftlich anmelden, Sicherheit zu leisten, soweit sie nicht Befriedigung verlangen können. Dieses Recht steht den Gläubigern jedoch nur zu, wenn sie glaubhaft machen, dass durch die Verschmelzung die Erfüllung ihrer Forderung gefährdet wird."
    },
    {
      "date": "2025-10-22",
      "id": "134868",
      "original_text": "Registerbekanntmachung nach dem Umwandlungsgesetz\nSchleswig-Holstein Amtsgericht Lübeck HRB 11488\nurban apes Nord GmbH – Lübeck",
      "type": "Registerbekanntmachung nach dem Umwandlungsgesetz",
      "state": "Schleswig-Holstein",
      "amtsgericht": "Amtsgericht Lübeck",
      "registernummer": "HRB 11488",
      "registerart": "HRB",
      "company_name": "urban apes Nord GmbH",
      "company_seat": "Lübeck",
      "details": "22.10.2025 (Bekanntmachungsdatum)\n\nSchleswig-Holstein Amtsgericht Lübeck HRB 11488\nRegisterbekanntmachung nach dem Umwandlungsgesetz 22.10.2025 (Eintragungsdatum)\n\nurban apes Nord GmbH\nGesellschaft mit beschränkter Haftung\nLübeck\n\nZu Eintragungsnummer 8 vom 22.10.2025 wird als nicht eingetragen veröffentlicht: Den Gläubigern der an der Verschmelzung beteiligten Rechtsträger ist, wenn sie binnen sechs Monaten nach dem Tag, an dem die Eintragung der Verschmelzung in das Register des Sitzes desjenigen Rechtsträgers, dessen Gläubiger sie sind, als bekannt gemacht gilt, ihren Anspruch nach Grund und Höhe schriftlich anmelden, Sicherheit zu leisten, soweit sie nicht Befriedigung verlangen können. Dieses Recht steht den Gläubigern jedoch nur zu, wenn sie glaubhaft machen, dass durch die Verschmelzung die Erfüllung ihrer Forderung gefährdet wird."
    },
    {
      "date": "2025-10-22",
      "id": "134869",
      "original_text": "Registerbekanntmachung nach dem Umwandlungsgesetz\nBaden-Württemberg Amtsgericht Stuttgart HRA 742126\nLidl 427 GmbH & Co. KG – Bad Wimpfen",
      "type": "Registerbekanntmachung nach dem Umwandlungsgesetz",
      "state": "Baden-Württemberg",
      "amtsgericht": "Amtsgericht Stuttgart",
      "registernummer": "HRA 742126",
      "registerart": "HRA",
      "company_name": "Lidl 427 GmbH & Co. KG",
      "company_seat": "Bad Wimpfen",
      "details": "22.10.2025 (Bekanntmachungsdatum)\n\nBaden-Württemberg Amtsgericht Stuttgart HRA 742126\nRegisterbekanntmachung nach dem Umwandlungsgesetz 22.10.2025 (Eintragungsdatum)\n\nLidl 427 GmbH & Co. KG\nKommanditgesellschaft\nBad Wimpfen\n\nAls nicht eingetragen wird bekanntgemacht:\nDen Gläubigern der an der Ausgliederung beteiligten Rechtsträger ist, wenn sie binnen sechs Monaten nach dem Tag, an dem die Eintragung der Ausgliederung in das Register des Sitzes desjenigen Rechtsträgers, dessen Gläubiger sie sind, nach § 19 Abs. 3 UmwG als bekanntgemacht gilt, ihren Anspruch nach Grund und Höhe schriftlich anmelden, Sicherheit zu leisten, soweit sie nicht Befriedigung verlangen können. Dieses Recht steht den Gläubigern jedoch nur zu, wenn sie glaubhaft machen, dass durch die Ausgliederung die Erfüllung ihrer Forderung gefährdet wird."
    },
    {
      "date": "2025-10-22",
      "id": "134870",
      "original_text": "Registerbekanntmachung nach dem Umwandlungsgesetz\nThüringen Amtsgericht Jena HRB 511393\nKanngießer Logistik GmbH – Werra-Suhl-Tal",
      "type": "Registerbekanntmachung nach dem Umwandlungsgesetz",
      "state": "Thüringen",
      "amtsgericht": "Amtsgericht Jena",
      "registernummer": "HRB 511393",
      "registerart": "HRB",
      "company_name": "Kanngießer Logistik GmbH",
      "company_seat": "Werra-Suhl-Tal",
      "details": "22.10.2025 (Bekanntmachungsdatum)\n\nThüringen Amtsgericht Jena HRB 511393\nRegisterbekanntmachung nach dem Umwandlungsgesetz 22.10.2025 (Eintragungsdatum)\n\nKanngießer Logistik GmbH\nGesellschaft mit beschränkter Haftung\nWerra-Suhl-Tal\n\nNicht eingetragen: Den Gläubigern der an der Verschmelzung beteiligten Rechtsträger, ist wenn sie binnen sechs Monaten nach dem Tag, an dem die Eintragung der Verschmelzung in das Register des Sitzes desjenigen Rechtsträgers, dessen Gläubiger sie sind,  nach § 19 Abs. 3 UmwG als bekanntgemacht gilt, ihren Anspruch nach Grund und Höhe schriftlich anmelden, Sicherheit zu leisten, soweit sie nicht Befriedigung verlangen können. Dieses Recht steht ihnen jedoch nur zu, wenn sie glaubhaft machen, daß durch die Verschmelzung die Erfüllung ihrer Forderung gefährdet wird."
    },
    {
      "date": "2025-10-22",
      "id": "134871",
      "original_text": "Registerbekanntmachung nach dem Umwandlungsgesetz\nThüringen Amtsgericht Jena HRA 401346\nLeiter Objektgesellschaft mbH & Co. KG – Werra-Suhl-Tal",
      "type": "Registerbekanntmachung nach dem Umwandlungsgesetz",
      "state": "Thüringen",
      "amtsgericht": "Amtsgericht Jena",
      "registernummer": "HRA 401346",
      "registerart": "HRA",
      "company_name": "Leiter Objektgesellschaft mbH & Co. KG",
      "company_seat": "Werra-Suhl-Tal",
      "details": "22.10.2025 (Bekanntmachungsdatum)\n\nThüringen Amtsgericht Jena HRA 401346\nRegisterbekanntmachung nach dem Umwandlungsgesetz 22.10.2025 (Eintragungsdatum)\n\nLeiter Objektgesellschaft mbH & Co. KG\nKommanditgesellschaft\nWerra-Suhl-Tal\n\nNicht eingetragen: Den Gläubigern der an der Verschmelzung beteiligten Rechtsträger, ist wenn sie binnen sechs Monaten nach dem Tag, an dem die Eintragung der Verschmelzung in das Register des Sitzes desjenigen Rechtsträgers, dessen Gläubiger sie sind,  nach § 19 Abs. 3 UmwG als bekanntgemacht gilt, ihren Anspruch nach Grund und Höhe schriftlich anmelden, Sicherheit zu leisten, soweit sie nicht Befriedigung verlangen können. Dieses Recht steht ihnen jedoch nur zu, wenn sie glaubhaft machen, daß durch die Verschmelzung die Erfüllung ihrer Forderung gefährdet wird."
    },
    {
      "date": "2025-10-22",
      "id": "134872",
      "original_text": "Einreichung neuer Dokumente\nBaden-Württemberg Amtsgericht Freiburg HRB 725126\nSWEG Südwestdeutsche Landesverkehrs-GmbH – Lahr",
      "type": "Einreichung neuer Dokumente",
      "state": "Baden-Württemberg",
      "amtsgericht": "Amtsgericht Freiburg",
      "registernummer": "HRB 725126",
      "registerart": "HRB",
      "company_name": "SWEG Südwestdeutsche Landesverkehrs-GmbH",
      "company_seat": "Lahr",
      "details": "22.10.2025 (Bekanntmachungsdatum)\n\nBaden-Württemberg Amtsgericht Freiburg HRB 725126\nEinreichung neuer Dokumente\n\nSWEG Südwestdeutsche Landesverkehrs-GmbH\nGesellschaft mit beschränkter Haftung\nLahr\n\nDie Gesellschaft hat am 21.10.2025 die Liste über die Zusammensetzung des Aufsichtsrats zum Handelsregister eingereicht."
    },
    {
      "date": "2025-10-22",
      "id": "134873",
      "original_text": "Löschungsankündigung\nBrandenburg Amtsgericht Frankfurt/Oder HRB 17549\nMVZ Bernau /Zentrum für ambulantes Operieren B.M.J UG (haftungsbeschränkt) – Hoppegarten",
      "type": "Löschungsankündigung",
      "state": "Brandenburg",
      "amtsgericht": "Amtsgericht Frankfurt/Oder",
      "registernummer": "HRB 17549",
      "registerart": "HRB",
      "company_name": "MVZ Bernau /Zentrum für ambulantes Operieren B.M.J UG (haftungsbeschränkt)",
      "company_seat": "Hoppegarten",
      "details": "22.10.2025 (Bekanntmachungsdatum)\n\nBrandenburg Amtsgericht Frankfurt/Oder HRB 17549\nLöschungsankündigung\n\nMVZ Bernau /Zentrum für ambulantes Operieren B.M.J  UG (haftungsbeschränkt)\nGesellschaft mit beschränkter Haftung\nHoppegarten\n\nBei der nachstehenden Gesellschaft wird das Amtslöschungsverfahren gemäß § 394 Abs. 1 FamFG eingeleitet."
    },
    {
      "date": "2025-10-22",
      "id": "134874",
      "original_text": "Löschungsankündigung\nBerlin Amtsgericht Berlin (Charlottenburg) HRB 163471\nFAZABAU GmbH – Berlin",
      "type": "Löschungsankündigung",
      "state": "Berlin",
      "amtsgericht": "Amtsgericht Berlin (Charlottenburg)",
      "registernummer": "HRB 163471",
      "registerart": "HRB",
      "company_name": "FAZABAU GmbH",
      "company_seat": "Berlin",
      "details": "22.10.2025 (Bekanntmachungsdatum)\n\nBerlin Amtsgericht Berlin (Charlottenburg) HRB 163471\nLöschungsankündigung\n\nFAZABAU GmbH\nGesellschaft mit beschränkter Haftung\nBerlin\n\nBei der nachstehenden Gesellschaft wird das Amtslöschungsverfahren gemäß § 394 FamFG eingeleitet. Widerspruchsfrist 6 Wochen"
    },
    {
      "date": "2025-10-22",
      "id": "134875",
      "original_text": "Löschungsankündigung\nBaden-Württemberg Amtsgericht Mannheim HRB 730135\nPecunia Treuhand Beteiligungs GmbH – Mannheim",
      "type": "Löschungsankündigung",
      "state": "Baden-Württemberg",
      "amtsgericht": "Amtsgericht Mannheim",
      "registernummer": "HRB 730135",
      "registerart": "HRB",
      "company_name": "Pecunia Treuhand Beteiligungs GmbH",
      "company_seat": "Mannheim",
      "details": "22.10.2025 (Bekanntmachungsdatum)\n\nBaden-Württemberg Amtsgericht Mannheim HRB 730135\nLöschungsankündigung\n\nPecunia Treuhand Beteiligungs GmbH\nGesellschaft mit beschränkter Haftung\nMannheim\n\nDas Gericht beabsichtigt, die Eintragung des Geschäftsführers Herrn Florian Gerhard Albert Stichler im Handelsregister wegen des Mangels einer wesentlichen Voraussetzung von Amts wegen nach § 395 FamFG als unzulässig zu löschen. Die Frist zur Geltendmachung eines Widerspruchs gegen die beabsichtigte Löschung ist auf einen Monat ab Veröffentlichung bestimmt."
    },
    {
      "date": "2025-10-22",
      "id": "134876",
      "original_text": "Registerbekanntmachung nach dem Umwandlungsgesetz\nBerlin Amtsgericht Berlin (Charlottenburg) HRB 254617\nKosir Capital GmbH – Berlin",
      "type": "Registerbekanntmachung nach dem Umwandlungsgesetz",
      "state": "Berlin",
      "amtsgericht": "Amtsgericht Berlin (Charlottenburg)",
      "registernummer": "HRB 254617",
      "registerart": "HRB",
      "company_name": "Kosir Capital GmbH",
      "company_seat": "Berlin",
      "details": "22.10.2025 (Bekanntmachungsdatum)\n\nBerlin Amtsgericht Berlin (Charlottenburg) HRB 254617\nRegisterbekanntmachung nach dem Umwandlungsgesetz 21.10.2025 (Eintragungsdatum)\n\nKosir Capital GmbH\nGesellschaft mit beschränkter Haftung\nBerlin\n\nZu Eintragungsnummer 2 vom 21.10.2025 wird als nicht eingetragen veröffentlicht: Den Gläubigern der an der Verschmelzung beteiligten Rechtsträger ist, wenn sie binnen sechs Monaten nach dem Tag, an dem die Eintragung der Verschmelzung in das Register des Sitzes desjenigen Rechtsträgers, dessen Gläubiger sie sind, als bekannt gemacht gilt, ihren Anspruch nach Grund und Höhe schriftlich anmelden, Sicherheit zu leisten, soweit sie nicht Befriedigung verlangen können. Dieses Recht steht den Gläubigern jedoch nur zu, wenn sie glaubhaft machen, dass durch die Verschmelzung die Erfüllung ihrer Forderung gefährdet wird. Das Recht, Sicherheitsleistung zu verlangen, steht Gläubigern nicht zu, die im Falle der Insolvenz ein Recht auf vorzugsweise Befriedigung aus einer Deckungsmasse haben, die nach gesetzlicher Vorschrift zu ihrem Schutz errichtet und staatlich überwacht ist."
    },
    {
      "date": "2025-10-22",
      "id": "134877",
      "original_text": "Registerbekanntmachung nach dem Umwandlungsgesetz\nBaden-Württemberg Amtsgericht Mannheim HRA 711858\nAchim Kraft, Vermietung e.K. – Haßmersheim",
      "type": "Registerbekanntmachung nach dem Umwandlungsgesetz",
      "state": "Baden-Württemberg",
      "amtsgericht": "Amtsgericht Mannheim",
      "registernummer": "HRA 711858",
      "registerart": "HRA",
      "company_name": "Achim Kraft, Vermietung e.K.",
      "company_seat": "Haßmersheim",
      "details": "22.10.2025 (Bekanntmachungsdatum)\n\nBaden-Württemberg Amtsgericht Mannheim HRA 711858\nRegisterbekanntmachung nach dem Umwandlungsgesetz 22.10.2025 (Eintragungsdatum)\n\nAchim Kraft, Vermietung e.K.\nEinzelkaufmann / Einzelkauffrau\nHaßmersheim\n\nAls nicht eingetragen wird bekanntgemacht: Den Gläubigern der an der Ausgliederung beteiligten Rechtsträger ist, wenn sie binnen sechs Monaten nach dem Tag, an dem die Eintragung der Ausgliederung in das Register des Sitzes desjenigen Rechtsträgers, dessen Gläubiger sie sind, nach § 19 Abs. 3 UmwG als bekanntgemacht gilt, ihren Anspruch nach Grund und Höhe schriftlich anmelden, Sicherheit zu leisten, soweit sie nicht Befriedigung verlangen können. Dieses Recht steht den Gläubigern jedoch nur zu, wenn sie glaubhaft machen, dass durch die Ausgliederung die Erfüllung ihrer Forderung gefährdet wird."
    },
    {
      "date": "2025-10-22",
      "id": "134878",
      "original_text": "Registerbekanntmachung nach dem Umwandlungsgesetz\nBaden-Württemberg Amtsgericht Mannheim HRA 712150\nAK Vermögensverwaltung UG (haftungsbeschränkt) & Co. KG – Haßmersheim",
      "type": "Registerbekanntmachung nach dem Umwandlungsgesetz",
      "state": "Baden-Württemberg",
      "amtsgericht": "Amtsgericht Mannheim",
      "registernummer": "HRA 712150",
      "registerart": "HRA",
      "company_name": "AK Vermögensverwaltung UG (haftungsbeschränkt) & Co. KG",
      "company_seat": "Haßmersheim",
      "details": "22.10.2025 (Bekanntmachungsdatum)\n\nBaden-Württemberg Amtsgericht Mannheim HRA 712150\nRegisterbekanntmachung nach dem Umwandlungsgesetz 22.10.2025 (Eintragungsdatum)\n\nAK Vermögensverwaltung UG (haftungsbeschränkt) & Co. KG\nKommanditgesellschaft\nHaßmersheim\n\nDen Gläubigern der an der Ausgliederung beteiligten Rechtsträger ist, wenn sie binnen sechs Monaten nach dem Tag, an dem die Eintragung der Ausgliederung in das Register des Sitzes desjenigen Rechtsträgers, dessen Gläubiger sie sind, nach § 19 Abs. 3 UmwG als bekanntgemacht gilt, ihren Anspruch nach Grund und Höhe schriftlich anmelden, Sicherheit zu leisten, soweit sie nicht Befriedigung verlangen können. Dieses Recht steht den Gläubigern jedoch nur zu, wenn sie glaubhaft machen, dass durch die Ausgliederung die Erfüllung ihrer Forderung gefährdet wird."
    },
    {
      "date": "2025-10-22",
      "id": "134879",
      "original_text": "Registerbekanntmachung nach dem Umwandlungsgesetz\nBaden-Württemberg Amtsgericht Stuttgart HRB 802215\nAmbulanter Pflegedienst IMPULS GmbH – Stuttgart",
      "type": "Registerbekanntmachung nach dem Umwandlungsgesetz",
      "state": "Baden-Württemberg",
      "amtsgericht": "Amtsgericht Stuttgart",
      "registernummer": "HRB 802215",
      "registerart": "HRB",
      "company_name": "Ambulanter Pflegedienst IMPULS GmbH",
      "company_seat": "Stuttgart",
      "details": "22.10.2025 (Bekanntmachungsdatum)\n\nBaden-Württemberg Amtsgericht Stuttgart HRB 802215\nRegisterbekanntmachung nach dem Umwandlungsgesetz 22.10.2025 (Eintragungsdatum)\n\nAmbulanter Pflegedienst IMPULS GmbH\nGesellschaft mit beschränkter Haftung\nStuttgart\n\nDen Gläubigern der an der Ausgliederung beteiligten Rechtsträger ist, wenn sie binnen sechs Monaten nach dem Tag, an dem die Eintragung der Ausgliederung in das Register des Sitzes desjenigen Rechtsträgers, dessen Gläubiger sie sind, nach § 19 Abs. 3 UmwG als bekanntgemacht gilt, ihren Anspruch nach Grund und Höhe schriftlich anmelden, Sicherheit zu leisten, soweit sie nicht Befriedigung verlangen können. Dieses Recht steht den Gläubigern jedoch nur zu, wenn sie glaubhaft machen, dass durch die Ausgliederung die Erfüllung ihrer Forderung gefährdet wird."
    },
    {
      "date": "2025-10-22",
      "id": "134880",
      "original_text": "Registerbekanntmachung nach dem Umwandlungsgesetz\nBaden-Württemberg Amtsgericht Ulm HRA 729803\nFrank Ziegler e.K. – Kuchen",
      "type": "Registerbekanntmachung nach dem Umwandlungsgesetz",
      "state": "Baden-Württemberg",
      "amtsgericht": "Amtsgericht Ulm",
      "registernummer": "HRA 729803",
      "registerart": "HRA",
      "company_name": "Frank Ziegler e.K.",
      "company_seat": "Kuchen",
      "details": "22.10.2025 (Bekanntmachungsdatum)\n\nBaden-Württemberg Amtsgericht Ulm HRA 729803\nRegisterbekanntmachung nach dem Umwandlungsgesetz 22.10.2025 (Eintragungsdatum)\n\nFrank Ziegler e.K.\nEinzelkaufmann / Einzelkauffrau\nKuchen\n\nDen Gläubigern der an der Verschmelzung beteiligten Rechtsträger ist, wenn sie binnen sechs Monaten nach dem Tag, an dem die Eintragung der Verschmelzung in das Register des Sitzes desjenigen Rechtsträgers, dessen Gläubiger sie sind, nach § 19 Abs. 3 UmwG als bekanntgemacht gilt, ihren Anspruch nach Grund und Höhe schriftlich anmelden, Sicherheit zu leisten, soweit sie nicht Befriedigung verlangen können. Dieses Recht steht den Gläubigern jedoch nur zu, wenn sie glaubhaft machen, dass durch die Verschmelzung die Erfüllung ihrer Forderung gefährdet wird."
    },
    {
      "date": "2025-10-22",
      "id": "134881",
      "original_text": "Registerbekanntmachung nach dem Umwandlungsgesetz\nBaden-Württemberg Amtsgericht Ulm HRB 733497\nZiegler UG (haftungsbeschränkt) – Gingen an der Fils",
      "type": "Registerbekanntmachung nach dem Umwandlungsgesetz",
      "state": "Baden-Württemberg",
      "amtsgericht": "Amtsgericht Ulm",
      "registernummer": "HRB 733497",
      "registerart": "HRB",
      "company_name": "Ziegler UG (haftungsbeschränkt)",
      "company_seat": "Gingen an der Fils",
      "details": "22.10.2025 (Bekanntmachungsdatum)\n\nBaden-Württemberg Amtsgericht Ulm HRB 733497\nRegisterbekanntmachung nach dem Umwandlungsgesetz 22.10.2025 (Eintragungsdatum)\n\nZiegler UG (haftungsbeschränkt)\nGesellschaft mit beschränkter Haftung\nGingen an der Fils\n\nAls nicht eingetragen wird bekanntgemacht:\nDen Gläubigern der an der Verschmelzung beteiligten Rechtsträger ist, wenn sie binnen sechs Monaten nach dem Tag, an dem die Eintragung der Verschmelzung in das Register des Sitzes desjenigen Rechtsträgers, dessen Gläubiger sie sind, nach § 19 Abs. 3 UmwG als bekanntgemacht gilt, ihren Anspruch nach Grund und Höhe schriftlich anmelden, Sicherheit zu leisten, soweit sie nicht Befriedigung verlangen können. Dieses Recht steht den Gläubigern jedoch nur zu, wenn sie glaubhaft machen, dass durch die Verschmelzung die Erfüllung ihrer Forderung gefährdet wird."
    },
    {
      "date": "2025-10-22",
      "id": "134882",
      "original_text": "Registerbekanntmachung nach dem Umwandlungsgesetz\nBaden-Württemberg Amtsgericht Stuttgart HRA 742620\nAmbulanter Pflegedienst Loncarevic e.K. – Stuttgart",
      "type": "Registerbekanntmachung nach dem Umwandlungsgesetz",
      "state": "Baden-Württemberg",
      "amtsgericht": "Amtsgericht Stuttgart",
      "registernummer": "HRA 742620",
      "registerart": "HRA",
      "company_name": "Ambulanter Pflegedienst Loncarevic e.K.",
      "company_seat": "Stuttgart",
      "details": "22.10.2025 (Bekanntmachungsdatum)\n\nBaden-Württemberg Amtsgericht Stuttgart HRA 742620\nRegisterbekanntmachung nach dem Umwandlungsgesetz 22.10.2025 (Eintragungsdatum)\n\nAmbulanter Pflegedienst Loncarevic e.K.\nEinzelkaufmann / Einzelkauffrau\nStuttgart\n\nAls nicht eingetragen wird bekanntgemacht:\nDen Gläubigern der an der Ausgliederung beteiligten Rechtsträger ist, wenn sie binnen sechs Monaten nach dem Tag, an dem die Eintragung der Ausgliederung in das Register des Sitzes desjenigen Rechtsträgers, dessen Gläubiger sie sind, nach § 19 Abs. 3 UmwG als bekanntgemacht gilt, ihren Anspruch nach Grund und Höhe schriftlich anmelden, Sicherheit zu leisten, soweit sie nicht Befriedigung verlangen können. Dieses Recht steht den Gläubigern jedoch nur zu, wenn sie glaubhaft machen, dass durch die Ausgliederung die Erfüllung ihrer Forderung gefährdet wird."
    },
    {
      "date": "2025-10-22",
      "id": "134883",
      "original_text": "Einreichung neuer Dokumente\nHamburg Amtsgericht Hamburg HRB 128888\nConceptIF Pensions AG – Hamburg",
      "type": "Einreichung neuer Dokumente",
      "state": "Hamburg",
      "amtsgericht": "Amtsgericht Hamburg",
      "registernummer": "HRB 128888",
      "registerart": "HRB",
      "company_name": "ConceptIF Pensions AG",
      "company_seat": "Hamburg",
      "details": "22.10.2025 (Bekanntmachungsdatum)\n\nHamburg Amtsgericht Hamburg HRB 128888\nEinreichung neuer Dokumente 22.10.2025 (Eintragungsdatum)\n\nConceptIF Pensions AG\nAktiengesellschaft\nHamburg\n\nAls nicht eingetragen wird bekannt gemacht: Liste des Aufsichtsrats wurde eingereicht."
    },
    {
      "date": "2025-10-22",
      "id": "134884",
      "original_text": "Registerbekanntmachung nach dem Umwandlungsgesetz\nBaden-Württemberg Amtsgericht Stuttgart HRA 102788\nKaufland 018 GmbH & Co. KG – Neckarsulm",
      "type": "Registerbekanntmachung nach dem Umwandlungsgesetz",
      "state": "Baden-Württemberg",
      "amtsgericht": "Amtsgericht Stuttgart",
      "registernummer": "HRA 102788",
      "registerart": "HRA",
      "company_name": "Kaufland 018 GmbH & Co. KG",
      "company_seat": "Neckarsulm",
      "details": "22.10.2025 (Bekanntmachungsdatum)\n\nBaden-Württemberg Amtsgericht Stuttgart HRA 102788\nRegisterbekanntmachung nach dem Umwandlungsgesetz 22.10.2025 (Eintragungsdatum)\n\nKaufland 018 GmbH & Co. KG\nKommanditgesellschaft\nNeckarsulm\n\nAls nicht eingetragen wird bekanntgemacht:\nDen Gläubigern der an der Abspaltung beteiligten Rechtsträger ist, wenn sie binnen sechs Monaten nach dem Tag, an dem die Eintragung der Abspaltung in das Register des Sitzes desjenigen Rechtsträgers, dessen Gläubiger sie sind, nach § 19 Abs. 3 UmwG als bekanntgemacht gilt, ihren Anspruch nach Grund und Höhe schriftlich anmelden, Sicherheit zu leisten, soweit sie nicht Befriedigung verlangen können. Dieses Recht steht den Gläubigern jedoch nur zu, wenn sie glaubhaft machen, dass durch die Abspaltung die Erfüllung ihrer Forderung gefährdet wird."
    },
    {
      "date": "2025-10-22",
      "id": "134885",
      "original_text": "Registerbekanntmachung nach dem Umwandlungsgesetz\nBaden-Württemberg Amtsgericht Stuttgart HRA 102788\nKaufland 018 GmbH & Co. KG – Neckarsulm",
      "type": "Registerbekanntmachung nach dem Umwandlungsgesetz",
      "state": "Baden-Württemberg",
      "amtsgericht": "Amtsgericht Stuttgart",
      "registernummer": "HRA 102788",
      "registerart": "HRA",
      "company_name": "Kaufland 018 GmbH & Co. KG",
      "company_seat": "Neckarsulm",
      "details": "22.10.2025 (Bekanntmachungsdatum)\n\nBaden-Württemberg Amtsgericht Stuttgart HRA 102788\nRegisterbekanntmachung nach dem Umwandlungsgesetz 22.10.2025 (Eintragungsdatum)\n\nKaufland 018 GmbH & Co. KG\nKommanditgesellschaft\nNeckarsulm\n\nAls nicht eingetragen wird bekanntgemacht:\nDen Gläubigern der an der Abspaltung beteiligten Rechtsträger ist, wenn sie binnen sechs Monaten nach dem Tag, an dem die Eintragung der Abspaltung in das Register des Sitzes desjenigen Rechtsträgers, dessen Gläubiger sie sind, nach § 19 Abs. 3 UmwG als bekanntgemacht gilt, ihren Anspruch nach Grund und Höhe schriftlich anmelden, Sicherheit zu leisten, soweit sie nicht Befriedigung verlangen können. Dieses Recht steht den Gläubigern jedoch nur zu, wenn sie glaubhaft machen, dass durch die Abspaltung die Erfüllung ihrer Forderung gefährdet wird."
    },
    {
      "date": "2025-10-22",
      "id": "134886",
      "original_text": "Registerbekanntmachung nach dem Umwandlungsgesetz\nBaden-Württemberg Amtsgericht Mannheim HRB 731538\noutput.rocks GmbH – Achern",
      "type": "Registerbekanntmachung nach dem Umwandlungsgesetz",
      "state": "Baden-Württemberg",
      "amtsgericht": "Amtsgericht Mannheim",
      "registernummer": "HRB 731538",
      "registerart": "HRB",
      "company_name": "output.rocks GmbH",
      "company_seat": "Achern",
      "details": "22.10.2025 (Bekanntmachungsdatum)\n\nBaden-Württemberg Amtsgericht Mannheim HRB 731538\nRegisterbekanntmachung nach dem Umwandlungsgesetz 22.10.2025 (Eintragungsdatum)\n\noutput.rocks GmbH\nGesellschaft mit beschränkter Haftung\nAchern\n\nAls nicht eingetragen wird bekanntgemacht: Den Gläubigern der an der Verschmelzung beteiligten Rechtsträger ist, wenn sie binnen sechs Monaten nach dem Tag, an dem die Eintragung der Verschmelzung in das Register des Sitzes desjenigen Rechtsträgers, dessen Gläubiger sie sind, nach § 19 Abs. 3 UmwG als bekanntgemacht gilt, ihren Anspruch nach Grund und Höhe schriftlich anmelden, Sicherheit zu leisten, soweit sie nicht Befriedigung verlangen können. Dieses Recht steht den Gläubigern jedoch nur zu, wenn sie glaubhaft machen, dass durch die Verschmelzung die Erfüllung ihrer Forderung gefährdet wird."
    },
    {
      "date": "2025-10-22",
      "id": "134887",
      "original_text": "Registerbekanntmachung nach dem Umwandlungsgesetz\nSaarland Amtsgericht Saarbrücken HRB 11294\nNORIS Verwaltungsgesellschaft mbH – Blieskastel",
      "type": "Registerbekanntmachung nach dem Umwandlungsgesetz",
      "state": "Saarland",
      "amtsgericht": "Amtsgericht Saarbrücken",
      "registernummer": "HRB 11294",
      "registerart": "HRB",
      "company_name": "NORIS Verwaltungsgesellschaft mbH",
      "company_seat": "Blieskastel",
      "details": "22.10.2025 (Bekanntmachungsdatum)\n\nSaarland Amtsgericht Saarbrücken HRB 11294\nRegisterbekanntmachung nach dem Umwandlungsgesetz 22.10.2025 (Eintragungsdatum)\n\nNORIS Verwaltungsgesellschaft mbH\nGesellschaft mit beschränkter Haftung\nBlieskastel\n\nAls nicht eingetragen wird bekannt gemacht: Den Gläubigern der an der Verschmelzung beteiligten Gesellschaften ist, wenn sie binnen sechs Monaten nach dem Tag, an dem die Eintragung der Verschmelzung in das Register des Sitzes desjenigen Rechtsträgers, dessen Gläubiger sie sind, nach § 19 Absatz 3 UmwG bekannt gemacht worden ist, ihren Anspruch nach Grund und Höhe schriftlich anmelden, Sicherheit zu leisten, soweit sie nicht Befriedigung verlangen können. Dieses Recht steht den Gläubigern jedoch nur zu, wenn sie glaubhaft machen, dass durch die Verschmelzung die Erfüllung ihrer Forderung gefährdet wird."
    },
    {
      "date": "2025-10-22",
      "id": "134888",
      "original_text": "Registerbekanntmachung nach dem Umwandlungsgesetz\nSaarland Amtsgericht Saarbrücken HRB 11177\nHager Systems Beteiligung GmbH – Blieskastel",
      "type": "Registerbekanntmachung nach dem Umwandlungsgesetz",
      "state": "Saarland",
      "amtsgericht": "Amtsgericht Saarbrücken",
      "registernummer": "HRB 11177",
      "registerart": "HRB",
      "company_name": "Hager Systems Beteiligung GmbH",
      "company_seat": "Blieskastel",
      "details": "22.10.2025 (Bekanntmachungsdatum)\n\nSaarland Amtsgericht Saarbrücken HRB 11177\nRegisterbekanntmachung nach dem Umwandlungsgesetz 22.10.2025 (Eintragungsdatum)\n\nHager Systems Beteiligung GmbH\nGesellschaft mit beschränkter Haftung\nBlieskastel\n\nAls nicht eingetragen wird bekannt gemacht: Den Gläubigern der an der Verschmelzung beteiligten Gesellschaften ist, wenn sie binnen sechs Monaten nach dem Tag, an dem die Eintragung der Verschmelzung in das Register des Sitzes desjenigen Rechtsträgers, dessen Gläubiger sie sind, nach § 19 Absatz 3 UmwG bekannt gemacht worden ist, ihren Anspruch nach Grund und Höhe schriftlich anmelden, Sicherheit zu leisten, soweit sie nicht Befriedigung verlangen können. Dieses Recht steht den Gläubigern jedoch nur zu, wenn sie glaubhaft machen, dass durch die Verschmelzung die Erfüllung ihrer Forderung gefährdet wird."
    },
    {
      "date": "2025-10-22",
      "id": "134889",
      "original_text": "Registerbekanntmachung nach dem Umwandlungsgesetz\nBaden-Württemberg Amtsgericht Mannheim HRB 710538\nConUti GmbH – Karlsruhe",
      "type": "Registerbekanntmachung nach dem Umwandlungsgesetz",
      "state": "Baden-Württemberg",
      "amtsgericht": "Amtsgericht Mannheim",
      "registernummer": "HRB 710538",
      "registerart": "HRB",
      "company_name": "ConUti GmbH",
      "company_seat": "Karlsruhe",
      "details": "22.10.2025 (Bekanntmachungsdatum)\n\nBaden-Württemberg Amtsgericht Mannheim HRB 710538\nRegisterbekanntmachung nach dem Umwandlungsgesetz 22.10.2025 (Eintragungsdatum)\n\nConUti GmbH\nGesellschaft mit beschränkter Haftung\nKarlsruhe\n\nAls nicht eingetragen wird bekanntgemacht: Den Gläubigern der an der Verschmelzung beteiligten Rechtsträger ist, wenn sie binnen sechs Monaten nach dem Tag, an dem die Eintragung der Verschmelzung in das Register des Sitzes desjenigen Rechtsträgers, dessen Gläubiger sie sind, nach § 19 Abs. 3 UmwG als bekanntgemacht gilt, ihren Anspruch nach Grund und Höhe schriftlich anmelden, Sicherheit zu leisten, soweit sie nicht Befriedigung verlangen können. Dieses Recht steht den Gläubigern jedoch nur zu, wenn sie glaubhaft machen, dass durch die Verschmelzung die Erfüllung ihrer Forderung gefährdet wird."
    },
    {
      "date": "2025-10-22",
      "id": "134890",
      "original_text": "Registerbekanntmachung nach dem Umwandlungsgesetz\nSaarland Amtsgericht Saarbrücken HRB 16434\nHager SE – Blieskastel",
      "type": "Registerbekanntmachung nach dem Umwandlungsgesetz",
      "state": "Saarland",
      "amtsgericht": "Amtsgericht Saarbrücken",
      "registernummer": "HRB 16434",
      "registerart": "HRB",
      "company_name": "Hager SE",
      "company_seat": "Blieskastel",
      "details": "22.10.2025 (Bekanntmachungsdatum)\n\nSaarland Amtsgericht Saarbrücken HRB 16434\nRegisterbekanntmachung nach dem Umwandlungsgesetz 22.10.2025 (Eintragungsdatum)\n\nHager SE\nEuropäische Aktiengesellschaft (SE)\nBlieskastel\n\nAls nicht eingetragen wird bekannt gemacht: Den Gläubigern der an der Verschmelzung beteiligten Gesellschaften ist, wenn sie binnen sechs Monaten nach dem Tag, an dem die Eintragung der Verschmelzung in das Register des Sitzes desjenigen Rechtsträgers, dessen Gläubiger sie sind, nach § 19 Absatz 3 UmwG bekannt gemacht worden ist, ihren Anspruch nach Grund und Höhe schriftlich anmelden, Sicherheit zu leisten, soweit sie nicht Befriedigung verlangen können. Dieses Recht steht den Gläubigern jedoch nur zu, wenn sie glaubhaft machen, dass durch die Verschmelzung die Erfüllung ihrer Forderung gefährdet wird."
    },
    {
      "date": "2025-10-22",
      "id": "134891",
      "original_text": "Löschungsankündigung\nBerlin Amtsgericht Berlin (Charlottenburg) HRB 132466\nLautier GmbH – Berlin",
      "type": "Löschungsankündigung",
      "state": "Berlin",
      "amtsgericht": "Amtsgericht Berlin (Charlottenburg)",
      "registernummer": "HRB 132466",
      "registerart": "HRB",
      "company_name": "Lautier GmbH",
      "company_seat": "Berlin",
      "details": "22.10.2025 (Bekanntmachungsdatum)\n\nBerlin Amtsgericht Berlin (Charlottenburg) HRB 132466\nLöschungsankündigung\n\nLautier GmbH\nGesellschaft mit beschränkter Haftung\nBerlin\n\nBei der nachstehenden Gesellschaft wird das Amtslöschungsverfahren gemäß § 394 FamFG eingeleitet. Widerspruchsfrist 6 Wochen"
    },
    {
      "date": "2025-10-22",
      "id": "134892",
      "original_text": "Registerbekanntmachung nach dem Umwandlungsgesetz\nBaden-Württemberg Amtsgericht Stuttgart HRB 23198\nBREMER Stuttgart GmbH – Stuttgart",
      "type": "Registerbekanntmachung nach dem Umwandlungsgesetz",
      "state": "Baden-Württemberg",
      "amtsgericht": "Amtsgericht Stuttgart",
      "registernummer": "HRB 23198",
      "registerart": "HRB",
      "company_name": "BREMER Stuttgart GmbH",
      "company_seat": "Stuttgart",
      "details": "22.10.2025 (Bekanntmachungsdatum)\n\nBaden-Württemberg Amtsgericht Stuttgart HRB 23198\nRegisterbekanntmachung nach dem Umwandlungsgesetz 22.10.2025 (Eintragungsdatum)\n\nBREMER Stuttgart GmbH\nGesellschaft mit beschränkter Haftung\nStuttgart\n\nAls nicht eingetragen wird bekanntgemacht:\nDen Gläubigern der an der Verschmelzung beteiligten Rechtsträger ist, wenn sie binnen sechs Monaten nach dem Tag, an dem die Eintragung der Verschmelzung in das Register des Sitzes desjenigen Rechtsträgers, dessen Gläubiger sie sind, nach § 19 Abs. 3 UmwG als bekanntgemacht gilt, ihren Anspruch nach Grund und Höhe schriftlich anmelden, Sicherheit zu leisten, soweit sie nicht Befriedigung verlangen können. Dieses Recht steht den Gläubigern jedoch nur zu, wenn sie glaubhaft machen, dass durch die Verschmelzung die Erfüllung ihrer Forderung gefährdet wird."
    },
    {
      "date": "2025-10-22",
      "id": "134893",
      "original_text": "Löschungsankündigung\nSchleswig-Holstein Amtsgericht Lübeck HRB 24153\nAlpx Commerce UG (haftungsbeschränkt) – Reinbek",
      "type": "Löschungsankündigung",
      "state": "Schleswig-Holstein",
      "amtsgericht": "Amtsgericht Lübeck",
      "registernummer": "HRB 24153",
      "registerart": "HRB",
      "company_name": "Alpx Commerce UG (haftungsbeschränkt)",
      "company_seat": "Reinbek",
      "details": "22.10.2025 (Bekanntmachungsdatum)\n\nSchleswig-Holstein Amtsgericht Lübeck HRB 24153\nLöschungsankündigung\n\nAlpx Commerce UG (haftungsbeschränkt)\nGesellschaft mit beschränkter Haftung\nReinbek\n\nEs ist die Löschung der nachstehenden Gesellschaft wegen Vermögenslosigkeit gemäß § 394 FamFG beabsichtigt. Widerspruchsfrist: 1 Monat."
    },
    {
      "date": "2025-10-22",
      "id": "134894",
      "original_text": "Registerbekanntmachung nach dem Umwandlungsgesetz\nBrandenburg Amtsgericht Neuruppin HRB 7855\nPantonio Ship Management GmbH – Pritzwalk",
      "type": "Registerbekanntmachung nach dem Umwandlungsgesetz",
      "state": "Brandenburg",
      "amtsgericht": "Amtsgericht Neuruppin",
      "registernummer": "HRB 7855",
      "registerart": "HRB",
      "company_name": "Pantonio Ship Management GmbH",
      "company_seat": "Pritzwalk",
      "details": "22.10.2025 (Bekanntmachungsdatum)\n\nBrandenburg Amtsgericht Neuruppin HRB 7855\nRegisterbekanntmachung nach dem Umwandlungsgesetz 22.10.2025 (Eintragungsdatum)\n\nPantonio Ship Management GmbH\nGesellschaft mit beschränkter Haftung\nPritzwalk\n\nZu Eintragungsnummer 23 vom 22.10.2025 wird als nicht eingetragen veröffentlicht:\nDen Gläubigern der an der Umwandlung beteiligten Rechtsträger ist, wenn sie binnen sechs Monaten nach dem Tag, an dem die Eintragung der Umwandlung in das Register des Sitzes desjenigen Rechtsträgers, dessen Gläubiger sie sind, als bekannt gemacht gilt, ihren Anspruch nach Grund und Höhe schriftlich anmelden, Sicherheit zu leisten, soweit sie nicht Befriedigung verlangen können. Dieses Recht steht den Gläubigern jedoch nur zu, wenn sie glaubhaft machen, dass durch die Umwandlung die Erfüllung ihrer Forderung gefährdet wird"
    },
    {
      "date": "2025-10-22",
      "id": "134895",
      "original_text": "Löschungsankündigung\nBerlin Amtsgericht Berlin (Charlottenburg) HRB 241855\nmadello UG (haftungsbeschränkt) – Berlin",
      "type": "Löschungsankündigung",
      "state": "Berlin",
      "amtsgericht": "Amtsgericht Berlin (Charlottenburg)",
      "registernummer": "HRB 241855",
      "registerart": "HRB",
      "company_name": "madello UG (haftungsbeschränkt)",
      "company_seat": "Berlin",
      "details": "22.10.2025 (Bekanntmachungsdatum)\n\nBerlin Amtsgericht Berlin (Charlottenburg) HRB 241855\nLöschungsankündigung\n\nmadello UG (haftungsbeschränkt)\nGesellschaft mit beschränkter Haftung\nBerlin\n\nBei der nachstehenden Gesellschaft wird das Amtslöschungsverfahren gemäß § 394 FamFG eingeleitet. Widerspruchsfrist 6 Wochen"
    },
    {
      "date": "2025-10-22",
      "id": "134896",
      "original_text": "Registerbekanntmachung nach dem Umwandlungsgesetz\nHamburg Amtsgericht Hamburg HRB 169561\nRABOT Charge GmbH – Hamburg",
      "type": "Registerbekanntmachung nach dem Umwandlungsgesetz",
      "state": "Hamburg",
      "amtsgericht": "Amtsgericht Hamburg",
      "registernummer": "HRB 169561",
      "registerart": "HRB",
      "company_name": "RABOT Charge GmbH",
      "company_seat": "Hamburg",
      "details": "22.10.2025 (Bekanntmachungsdatum)\n\nHamburg Amtsgericht Hamburg HRB 169561\nRegisterbekanntmachung nach dem Umwandlungsgesetz 22.10.2025 (Eintragungsdatum)\n\nRABOT Charge GmbH\nGesellschaft mit beschränkter Haftung\nHamburg\n\nAls nicht eingetragen wird bekannt gemacht:\nDen Gläubigern der an der Ausgliederung beteiligten Gesellschaften ist, wenn sie binnen sechs Monaten nach dem Tag, an dem die Eintragung der Ausgliederung in das Register des Sitzes desjenigen Rechtsträgers, dessen Gläubiger sie sind, nach § 19 Absatz 3 UmwG als bekannt gemacht gilt, ihren Anspruch nach Grund und Höhe schriftlich anmelden, Sicherheit zu leisten, soweit sie nicht Befriedigung verlangen können. Dieses Recht steht den Gläubigern jedoch nur zu, wenn sie glaubhaft machen, dass durch die Ausgliederung die Erfüllung ihrer Forderung gefährdet wird."
    },
    {
      "date": "2025-10-22",
      "id": "134897",
      "original_text": "Registerbekanntmachung nach dem Umwandlungsgesetz\nHamburg Amtsgericht Hamburg HRB 194002\nRABOT Energy Beteiligung GmbH – Hamburg",
      "type": "Registerbekanntmachung nach dem Umwandlungsgesetz",
      "state": "Hamburg",
      "amtsgericht": "Amtsgericht Hamburg",
      "registernummer": "HRB 194002",
      "registerart": "HRB",
      "company_name": "RABOT Energy Beteiligung GmbH",
      "company_seat": "Hamburg",
      "details": "22.10.2025 (Bekanntmachungsdatum)\n\nHamburg Amtsgericht Hamburg HRB 194002\nRegisterbekanntmachung nach dem Umwandlungsgesetz 22.10.2025 (Eintragungsdatum)\n\nRABOT Energy Beteiligung GmbH\nGesellschaft mit beschränkter Haftung\nHamburg\n\nAls nicht eingetragen wird bekannt gemacht:\nDen Gläubigern der an der Ausgliederung beteiligten Gesellschaften ist, wenn sie binnen sechs Monaten nach dem Tag, an dem die Eintragung der Ausgliederung in das Register des Sitzes desjenigen Rechtsträgers, dessen Gläubiger sie sind, nach § 19 Absatz 3 UmwG als bekannt gemacht gilt, ihren Anspruch nach Grund und Höhe schriftlich anmelden, Sicherheit zu leisten, soweit sie nicht Befriedigung verlangen können. Dieses Recht steht den Gläubigern jedoch nur zu, wenn sie glaubhaft machen, dass durch die Ausgliederung die Erfüllung ihrer Forderung gefährdet wird."
    },
    {
      "date": "2025-10-22",
      "id": "134898",
      "original_text": "Registerbekanntmachung nach dem Umwandlungsgesetz\nSachsen Amtsgericht Chemnitz HRB 34122\nTeam Feel Good BE.SAFE Test GmbH – Chemnitz",
      "type": "Registerbekanntmachung nach dem Umwandlungsgesetz",
      "state": "Sachsen",
      "amtsgericht": "Amtsgericht Chemnitz",
      "registernummer": "HRB 34122",
      "registerart": "HRB",
      "company_name": "Team Feel Good BE.SAFE Test GmbH",
      "company_seat": "Chemnitz",
      "details": "22.10.2025 (Bekanntmachungsdatum)\n\nSachsen Amtsgericht Chemnitz HRB 34122\nRegisterbekanntmachung nach dem Umwandlungsgesetz 22.10.2025 (Eintragungsdatum)\n\nTeam Feel Good BE.SAFE Test GmbH\nGesellschaft mit beschränkter Haftung\nChemnitz\n\nDen Gläubigern der an der Verschmelzung beteiligten Rechtsträger ist, wenn sie binnen sechs Monaten nach dem Tag, an dem die Eintragung der Verschmelzung in das Register des Sitzes desjenigen Rechtsträgers, dessen Gläubiger sie sind, nach § 19 Abs. 3 UmwG als bekannt gemacht gilt, ihren Anspruch nach Grund und Höhe in Textform anmelden, Sicherheit zu leisten, soweit sie nicht Befriedigung verlangen können. Dieses Recht steht den Gläubigern jedoch nur zu, wenn sie glaubhaft machen, dass durch die Verschmelzung die Erfüllung der Forderung gefährdet wird."
    },
    {
      "date": "2025-10-22",
      "id": "134899",
      "original_text": "Löschungsankündigung\nSachsen Amtsgericht Dresden HRB 30494\nLehmann Immobilien GmbH – Meißen",
      "type": "Löschungsankündigung",
      "state": "Sachsen",
      "amtsgericht": "Amtsgericht Dresden",
      "registernummer": "HRB 30494",
      "registerart": "HRB",
      "company_name": "Lehmann Immobilien GmbH",
      "company_seat": "Meißen",
      "details": "22.10.2025 (Bekanntmachungsdatum)\n\nSachsen Amtsgericht Dresden HRB 30494\nLöschungsankündigung\n\nLehmann Immobilien GmbH\nGesellschaft mit beschränkter Haftung\nMeißen\n\nDas Registergericht beabsichtigt, die im Handelsregister eingetragene Gesellschaft von Amts wegen nach § 394 FamFG zu löschen. Die Frist zu Erhebung eines Widerspruchs gegen die beabsichtigte Löschung wird auf einen Monat festgesetzt."
    },
    {
      "date": "2025-10-22",
      "id": "134900",
      "original_text": "Einreichung neuer Dokumente\nSachsen Amtsgericht Chemnitz HRB 21599\nVerkehrsverbund Mittelsachsen Gesellschaft mit beschränkter Haftung (VMS GmbH) – Chemnitz",
      "type": "Einreichung neuer Dokumente",
      "state": "Sachsen",
      "amtsgericht": "Amtsgericht Chemnitz",
      "registernummer": "HRB 21599",
      "registerart": "HRB",
      "company_name": "Verkehrsverbund Mittelsachsen Gesellschaft mit beschränkter Haftung (VMS GmbH)",
      "company_seat": "Chemnitz",
      "details": "22.10.2025 (Bekanntmachungsdatum)\n\nSachsen Amtsgericht Chemnitz HRB 21599\nEinreichung neuer Dokumente\n\nVerkehrsverbund Mittelsachsen Gesellschaft mit beschränkter Haftung (VMS GmbH)\nGesellschaft mit beschränkter Haftung\nChemnitz\n\nAm 21.10.2025 wurde beim Handelsregister des Amtsgerichts Chemnitz die Liste der Mitglieder des Aufsichtsrats gemäß § 52 GmbHG eingereicht."
    },
    {
      "date": "2025-10-22",
      "id": "134901",
      "original_text": "Registerbekanntmachung nach dem Umwandlungsgesetz\nSachsen Amtsgericht Leipzig HRB 40881\nRRI Verwaltungs GmbH – Leipzig",
      "type": "Registerbekanntmachung nach dem Umwandlungsgesetz",
      "state": "Sachsen",
      "amtsgericht": "Amtsgericht Leipzig",
      "registernummer": "HRB 40881",
      "registerart": "HRB",
      "company_name": "RRI Verwaltungs GmbH",
      "company_seat": "Leipzig",
      "details": "22.10.2025 (Bekanntmachungsdatum)\n\nSachsen Amtsgericht Leipzig HRB 40881\nRegisterbekanntmachung nach dem Umwandlungsgesetz 22.10.2025 (Eintragungsdatum)\n\nRRI Verwaltungs GmbH\nGesellschaft mit beschränkter Haftung\nLeipzig\n\nDen Gläubigern der an der Verschmelzung beteiligten Rechtsträger ist, wenn sie binnen sechs Monaten nach dem Tag, an dem die Eintragung der Verschmelzung in das Register des Sitzes desjenigen Rechtsträgers, dessen Gläubiger sie sind, nach § 19 Abs. 3 UmwG als bekannt gemacht gilt, ihren Anspruch nach Grund und Höhe in Textform anmelden, Sicherheit zu leisten, soweit sie nicht Befriedigung verlangen können. Dieses Recht steht den Gläubigern jedoch nur zu, wenn sie glaubhaft machen, dass durch die Verschmelzung die Erfüllung der Forderung gefährdet wird."
    },
    {
      "date": "2025-10-22",
      "id": "134902",
      "original_text": "Registerbekanntmachung nach dem Umwandlungsgesetz\nSachsen Amtsgericht Leipzig HRB 39987\nR & R Invest GmbH – Leipzig",
      "type": "Registerbekanntmachung nach dem Umwandlungsgesetz",
      "state": "Sachsen",
      "amtsgericht": "Amtsgericht Leipzig",
      "registernummer": "HRB 39987",
      "registerart": "HRB",
      "company_name": "R & R Invest GmbH",
      "company_seat": "Leipzig",
      "details": "22.10.2025 (Bekanntmachungsdatum)\n\nSachsen Amtsgericht Leipzig HRB 39987\nRegisterbekanntmachung nach dem Umwandlungsgesetz 22.10.2025 (Eintragungsdatum)\n\nR & R Invest GmbH\nGesellschaft mit beschränkter Haftung\nLeipzig\n\nDen Gläubigern der an der Verschmelzung beteiligten Rechtsträger ist, wenn sie binnen sechs Monaten nach dem Tag, an dem die Eintragung der Verschmelzung in das Register des Sitzes desjenigen Rechtsträgers, dessen Gläubiger sie sind, nach § 19 Abs. 3 UmwG als bekannt gemacht gilt, ihren Anspruch nach Grund und Höhe in Textform anmelden, Sicherheit zu leisten, soweit sie nicht Befriedigung verlangen können. Dieses Recht steht den Gläubigern jedoch nur zu, wenn sie glaubhaft machen, dass durch die Verschmelzung die Erfüllung der Forderung gefährdet wird."
    },
    {
      "date": "2025-10-22",
      "id": "134903",
      "original_text": "Registerbekanntmachung nach dem Umwandlungsgesetz\nSachsen Amtsgericht Chemnitz HRA 10285\nGreen Island Limited & Co. KG – Chemnitz",
      "type": "Registerbekanntmachung nach dem Umwandlungsgesetz",
      "state": "Sachsen",
      "amtsgericht": "Amtsgericht Chemnitz",
      "registernummer": "HRA 10285",
      "registerart": "HRA",
      "company_name": "Green Island Limited & Co. KG",
      "company_seat": "Chemnitz",
      "details": "22.10.2025 (Bekanntmachungsdatum)\n\nSachsen Amtsgericht Chemnitz HRA 10285\nRegisterbekanntmachung nach dem Umwandlungsgesetz 22.10.2025 (Eintragungsdatum)\n\nGreen Island Limited & Co. KG\nKommanditgesellschaft\nChemnitz\n\nDen Gläubigern der an der Verschmelzung beteiligten Rechtsträger ist, wenn sie binnen sechs Monaten nach dem Tag, an dem die Eintragung der Verschmelzung in das Register des Sitzes desjenigen Rechtsträgers, dessen Gläubiger sie sind, nach § 19 Abs. 3 UmwG als bekannt gemacht gilt, ihren Anspruch nach Grund und Höhe in Textform anmelden, Sicherheit zu leisten, soweit sie nicht Befriedigung verlangen können. Dieses Recht steht den Gläubigern jedoch nur zu, wenn sie glaubhaft machen, dass durch die Verschmelzung die Erfüllung der Forderung gefährdet wird."
    },
    {
      "date": "2025-10-22",
      "id": "134904",
      "original_text": "Registerbekanntmachung nach dem Umwandlungsgesetz\nNiedersachsen Amtsgericht Hildesheim HRA 110181 früher Amtsgericht Alfeld\nRogge GmbH & Co. KG – Alfeld (Leine)",
      "type": "Registerbekanntmachung nach dem Umwandlungsgesetz",
      "state": "Niedersachsen",
      "amtsgericht": "Amtsgericht Hildesheim",
      "registernummer": "HRA 110181",
      "registerart": "HRA",
      "company_name": "Rogge GmbH & Co. KG",
      "company_seat": "Alfeld (Leine)",
      "former_amtsgericht": "Alfeld",
      "details": "22.10.2025 (Bekanntmachungsdatum)\n\nNiedersachsen Amtsgericht Hildesheim HRA 110181 früher Amtsgericht Alfeld\nRegisterbekanntmachung nach dem Umwandlungsgesetz 22.10.2025 (Eintragungsdatum)\n\nRogge GmbH & Co. KG\nKommanditgesellschaft\nAlfeld (Leine)\n\nDen Gläubigern der an der Verschmelzung beteiligten Rechtsträger ist, wenn sie binnen sechs Monaten nach dem Tag, an dem die Eintragung der Verschmelzung in das Register des Sitzes desjenigen Rechtsträgers, dessen Gläubiger sie sind, nach § 19  Abs.  3 UmwG als bekannt gemacht gilt, ihren Anspruch nach Grund und Höhe schriftlich anmelden, Sicherheit zu leisten, soweit sie nicht Befriedigung verlangen können. Dieses Recht steht den Gläubigern jedoch nur zu, wenn sie glaubhaft machen, dass durch die Verschmelzung die Erfüllung der Forderung gefährdet wird."
    },
    {
      "date": "2025-10-22",
      "id": "134905",
      "original_text": "Registerbekanntmachung nach dem Umwandlungsgesetz\nNiedersachsen Amtsgericht Osnabrück HRB 211448\nHelming Tiefbau Service GmbH – Wietmarschen",
      "type": "Registerbekanntmachung nach dem Umwandlungsgesetz",
      "state": "Niedersachsen",
      "amtsgericht": "Amtsgericht Osnabrück",
      "registernummer": "HRB 211448",
      "registerart": "HRB",
      "company_name": "Helming Tiefbau Service GmbH",
      "company_seat": "Wietmarschen",
      "details": "22.10.2025 (Bekanntmachungsdatum)\n\nNiedersachsen Amtsgericht Osnabrück HRB 211448\nRegisterbekanntmachung nach dem Umwandlungsgesetz 22.10.2025 (Eintragungsdatum)\n\nHelming Tiefbau Service GmbH\nGesellschaft mit beschränkter Haftung\nWietmarschen\n\nDen Gläubigern der an der Verschmelzung beteiligten Rechtsträger ist, wenn sie binnen sechs Monaten nach dem Tag, an dem die Eintragung der Verschmelzung in das Register des Sitzes desjenigen Rechtsträgers, dessen Gläubiger sie sind, nach § 19  Abs.  3 UmwG als bekannt gemacht gilt, ihren Anspruch nach Grund und Höhe schriftlich anmelden, Sicherheit zu leisten, soweit sie nicht Befriedigung verlangen können. Dieses Recht steht den Gläubigern jedoch nur zu, wenn sie glaubhaft machen, dass durch die Verschmelzung die Erfüllung der Forderung gefährdet wird."
    },
    {
      "date": "2025-10-22",
      "id": "134906",
      "original_text": "Löschungsankündigung\nNiedersachsen Amtsgericht Osnabrück HRB 122550\nSOLEN Energy GmbH – Meppen",
      "type": "Löschungsankündigung",
      "state": "Niedersachsen",
      "amtsgericht": "Amtsgericht Osnabrück",
      "registernummer": "HRB 122550",
      "registerart": "HRB",
      "company_name": "SOLEN Energy GmbH",
      "company_seat": "Meppen",
      "details": "22.10.2025 (Bekanntmachungsdatum)\n\nNiedersachsen Amtsgericht Osnabrück HRB 122550\nLöschungsankündigung\n\nSOLEN Energy GmbH\nGesellschaft mit beschränkter Haftung\nMeppen\n\nDas Registergericht beabsichtigt, die Gesellschaft von Amts wegen nach § 394 FamFG wegen Vermögenslosigkeit zu löschen. Die Frist zur Erhebung eines Widerspruchs ist auf 1 Monat ab dieser Registerbekanntmachung festgesetzt."
    },
    {
      "date": "2025-10-22",
      "id": "134907",
      "original_text": "Registerbekanntmachung nach dem Umwandlungsgesetz\nNiedersachsen Amtsgericht Stadthagen HRA 200754\nAutomobile A. Görnhardt e.K. – Rodenberg",
      "type": "Registerbekanntmachung nach dem Umwandlungsgesetz",
      "state": "Niedersachsen",
      "amtsgericht": "Amtsgericht Stadthagen",
      "registernummer": "HRA 200754",
      "registerart": "HRA",
      "company_name": "Automobile A. Görnhardt e.K.",
      "company_seat": "Rodenberg",
      "details": "22.10.2025 (Bekanntmachungsdatum)\n\nNiedersachsen Amtsgericht Stadthagen HRA 200754\nRegisterbekanntmachung nach dem Umwandlungsgesetz 20.10.2025 (Eintragungsdatum)\n\nAutomobile A. Görnhardt e.K.\nEinzelkaufmann / Einzelkauffrau\nRodenberg\n\nDen Gläubigern der an der Ausgliederung beteiligten Rechtsträger ist, wenn sie binnen sechs Monaten nach dem Tag, an dem die Eintragung der Ausgliederung in das Register des Sitzes desjenigen Rechtsträgers, dessen Gläubiger sie sind, nach § 19 Abs. 3 UmwG als bekannt gemacht gilt, ihren Anspruch nach Grund und Höhe schriftlich anmelden, Sicherheit zu leisten, soweit sie nicht Befriedigung verlangen können. Dieses Recht steht den Gläubigern jedoch nur zu, wenn sie glaubhaft machen, dass durch die Ausgliederung die Erfüllung der Forderung gefährdet wird."
    },
    {
      "date": "2025-10-22",
      "id": "134908",
      "original_text": "Registerbekanntmachung nach dem Umwandlungsgesetz\nNiedersachsen Amtsgericht Hildesheim HRB 204974\nReviva Holding GmbH – Meine",
      "type": "Registerbekanntmachung nach dem Umwandlungsgesetz",
      "state": "Niedersachsen",
      "amtsgericht": "Amtsgericht Hildesheim",
      "registernummer": "HRB 204974",
      "registerart": "HRB",
      "company_name": "Reviva Holding GmbH",
      "company_seat": "Meine",
      "details": "22.10.2025 (Bekanntmachungsdatum)\n\nNiedersachsen Amtsgericht Hildesheim HRB 204974\nRegisterbekanntmachung nach dem Umwandlungsgesetz 22.10.2025 (Eintragungsdatum)\n\nReviva Holding GmbH\nGesellschaft mit beschränkter Haftung\nMeine\n\nDen Gläubigern der an der Verschmelzung beteiligten Rechtsträger ist, wenn sie binnen sechs Monaten nach dem Tag, an dem die Eintragung der Verschmelzung in das Register des Sitzes desjenigen Rechtsträgers, dessen Gläubiger sie sind, nach § 19  Abs.  3 UmwG als bekannt gemacht gilt, ihren Anspruch nach Grund und Höhe schriftlich anmelden, Sicherheit zu leisten, soweit sie nicht Befriedigung verlangen können. Dieses Recht steht den Gläubigern jedoch nur zu, wenn sie glaubhaft machen, dass durch die Verschmelzung die Erfüllung der Forderung gefährdet wird."
    },
    {
      "date": "2025-10-22",
      "id": "134909",
      "original_text": "Registerbekanntmachung nach dem Umwandlungsgesetz\nNiedersachsen Amtsgericht Stadthagen HRB 202467\nAutomobile A. Görnhardt GmbH – Rodenberg",
      "type": "Registerbekanntmachung nach dem Umwandlungsgesetz",
      "state": "Niedersachsen",
      "amtsgericht": "Amtsgericht Stadthagen",
      "registernummer": "HRB 202467",
      "registerart": "HRB",
      "company_name": "Automobile A. Görnhardt GmbH",
      "company_seat": "Rodenberg",
      "details": "22.10.2025 (Bekanntmachungsdatum)\n\nNiedersachsen Amtsgericht Stadthagen HRB 202467\nRegisterbekanntmachung nach dem Umwandlungsgesetz 20.10.2025 (Eintragungsdatum)\n\nAutomobile A. Görnhardt GmbH\nGesellschaft mit beschränkter Haftung\nRodenberg\n\nDen Gläubigern der an der Ausgliederung beteiligten Rechtsträger ist, wenn sie binnen sechs Monaten nach dem Tag, an dem die Eintragung der Ausgliederung in das Register des Sitzes desjenigen Rechtsträgers, dessen Gläubiger sie sind, nach § 19 Abs. 3 UmwG als bekannt gemacht gilt, ihren Anspruch nach Grund und Höhe schriftlich anmelden, Sicherheit zu leisten, soweit sie nicht Befriedigung verlangen können. Dieses Recht steht den Gläubigern jedoch nur zu, wenn sie glaubhaft machen, dass durch die Ausgliederung die Erfüllung der Forderung gefährdet wird."
    },
    {
      "date": "2025-10-22",
      "id": "134910",
      "original_text": "Registerbekanntmachung nach dem Umwandlungsgesetz\nNiedersachsen Amtsgericht Osnabrück HRA 206093\nAlbers Lackierzentrum GmbH & Co. KG – Papenburg",
      "type": "Registerbekanntmachung nach dem Umwandlungsgesetz",
      "state": "Niedersachsen",
      "amtsgericht": "Amtsgericht Osnabrück",
      "registernummer": "HRA 206093",
      "registerart": "HRA",
      "company_name": "Albers Lackierzentrum GmbH & Co. KG",
      "company_seat": "Papenburg",
      "details": "22.10.2025 (Bekanntmachungsdatum)\n\nNiedersachsen Amtsgericht Osnabrück HRA 206093\nRegisterbekanntmachung nach dem Umwandlungsgesetz 22.10.2025 (Eintragungsdatum)\n\nAlbers Lackierzentrum GmbH & Co. KG\nKommanditgesellschaft\nPapenburg\n\nDen Gläubigern der an der formwechselnden Umwandlung beteiligten Rechtsträger ist, wenn sie binnen sechs Monaten nach dem Tag, an dem die Eintragung der Umwandlung in das Register des Sitzes desjenigen Rechtsträgers, dessen Gläubiger sie sind, nach § 19 Abs. 3 UmwG als bekannt gemacht gilt, ihren Anspruch nach Grund und Höhe schriftlich anmelden, Sicherheit zu leisten, soweit sie nicht Befriedigung verlangen können. Dieses Recht steht den Gläubigern jedoch nur zu, wenn sie glaubhaft machen, dass durch die formwechselnde Umwandlung die Erfüllung der Forderung gefährdet wird."
    },
    {
      "date": "2025-10-22",
      "id": "134911",
      "original_text": "Registerbekanntmachung nach dem Umwandlungsgesetz\nNiedersachsen Amtsgericht Hildesheim HRB 207968\nRogge Gruppe GmbH – Alfeld (Leine)",
      "type": "Registerbekanntmachung nach dem Umwandlungsgesetz",
      "state": "Niedersachsen",
      "amtsgericht": "Amtsgericht Hildesheim",
      "registernummer": "HRB 207968",
      "registerart": "HRB",
      "company_name": "Rogge Gruppe GmbH",
      "company_seat": "Alfeld (Leine)",
      "details": "22.10.2025 (Bekanntmachungsdatum)\n\nNiedersachsen Amtsgericht Hildesheim HRB 207968\nRegisterbekanntmachung nach dem Umwandlungsgesetz 22.10.2025 (Eintragungsdatum)\n\nRogge Gruppe GmbH\nGesellschaft mit beschränkter Haftung\nAlfeld (Leine)\n\nDen Gläubigern der an der Verschmelzung beteiligten Rechtsträger ist, wenn sie binnen sechs Monaten nach dem Tag, an dem die Eintragung der Verschmelzung in das Register des Sitzes desjenigen Rechtsträgers, dessen Gläubiger sie sind, nach § 19  Abs.  3 UmwG als bekannt gemacht gilt, ihren Anspruch nach Grund und Höhe schriftlich anmelden, Sicherheit zu leisten, soweit sie nicht Befriedigung verlangen können. Dieses Recht steht den Gläubigern jedoch nur zu, wenn sie glaubhaft machen, dass durch die Verschmelzung die Erfüllung der Forderung gefährdet wird. Den Gläubigern der an der Verschmelzung beteiligten Rechtsträger ist, wenn sie binnen sechs Monaten nach dem Tag, an dem die Eintragung der Verschmelzung in das Register des Sitzes desjenigen Rechtsträgers, dessen Gläubiger sie sind, nach § 19  Abs.  3 UmwG als bekannt gemacht gilt, ihren Anspruch nach Grund und Höhe schriftlich anmelden, Sicherheit zu leisten, soweit sie nicht Befriedigung verlangen können. Dieses Recht steht den Gläubigern jedoch nur zu, wenn sie glaubhaft machen, dass durch die Verschmelzung die Erfüllung der Forderung gefährdet wird."
    },
    {
      "date": "2025-10-22",
      "id": "134912",
      "original_text": "Registerbekanntmachung nach dem Umwandlungsgesetz\nNiedersachsen Amtsgericht Tostedt HRB 205384\nHOLOTEC GmbH – Regesbostel",
      "type": "Registerbekanntmachung nach dem Umwandlungsgesetz",
      "state": "Niedersachsen",
      "amtsgericht": "Amtsgericht Tostedt",
      "registernummer": "HRB 205384",
      "registerart": "HRB",
      "company_name": "HOLOTEC GmbH",
      "company_seat": "Regesbostel",
      "details": "22.10.2025 (Bekanntmachungsdatum)\n\nNiedersachsen Amtsgericht Tostedt HRB 205384\nRegisterbekanntmachung nach dem Umwandlungsgesetz 22.10.2025 (Eintragungsdatum)\n\nHOLOTEC GmbH\nGesellschaft mit beschränkter Haftung\nRegesbostel\n\nDen Gläubigern der an der Verschmelzung beteiligten Rechtsträger ist, wenn sie binnen sechs Monaten nach dem Tag, an dem die Eintragung der Verschmelzung in das Register des Sitzes desjenigen Rechtsträgers, dessen Gläubiger sie sind, nach § 19  Abs.  3 UmwG als bekannt gemacht gilt, ihren Anspruch nach Grund und Höhe schriftlich anmelden, Sicherheit zu leisten, soweit sie nicht Befriedigung verlangen können. Dieses Recht steht den Gläubigern jedoch nur zu, wenn sie glaubhaft machen, dass durch die Verschmelzung die Erfüllung der Forderung gefährdet wird."
    },
    {
      "date": "2025-10-22",
      "id": "134913",
      "original_text": "Registerbekanntmachung nach dem Umwandlungsgesetz\nNiedersachsen Amtsgericht Osnabrück HRA 201200\nIFD Immobilien, Finanzvermittlung und sonstige Dienstleistung GmbH & Co. KG – Geeste",
      "type": "Registerbekanntmachung nach dem Umwandlungsgesetz",
      "state": "Niedersachsen",
      "amtsgericht": "Amtsgericht Osnabrück",
      "registernummer": "HRA 201200",
      "registerart": "HRA",
      "company_name": "IFD Immobilien, Finanzvermittlung und sonstige Dienstleistung GmbH & Co. KG",
      "company_seat": "Geeste",
      "details": "22.10.2025 (Bekanntmachungsdatum)\n\nNiedersachsen Amtsgericht Osnabrück HRA 201200\nRegisterbekanntmachung nach dem Umwandlungsgesetz 22.10.2025 (Eintragungsdatum)\n\nIFD Immobilien, Finanzvermittlung und sonstige Dienstleistung GmbH & Co. KG\nKommanditgesellschaft\nGeeste\n\nDen Gläubigern der an der formwechselnden Umwandlung beteiligten Rechtsträger ist, wenn sie binnen sechs Monaten nach dem Tag, an dem die Eintragung der Umwandlung in das Register des Sitzes desjenigen Rechtsträgers, dessen Gläubiger sie sind, nach § 19 Abs. 3 UmwG als bekannt gemacht gilt, ihren Anspruch nach Grund und Höhe schriftlich anmelden, Sicherheit zu leisten, soweit sie nicht Befriedigung verlangen können. Dieses Recht steht den Gläubigern jedoch nur zu, wenn sie glaubhaft machen, dass durch die formwechselnde Umwandlung die Erfüllung der Forderung gefährdet wird."
    },
    {
      "date": "2025-10-22",
      "id": "134914",
      "original_text": "Registerbekanntmachung nach dem Umwandlungsgesetz\nNiedersachsen Amtsgericht Hildesheim HRB 204516\nFEMA GmbH – Meine",
      "type": "Registerbekanntmachung nach dem Umwandlungsgesetz",
      "state": "Niedersachsen",
      "amtsgericht": "Amtsgericht Hildesheim",
      "registernummer": "HRB 204516",
      "registerart": "HRB",
      "company_name": "FEMA GmbH",
      "company_seat": "Meine",
      "details": "22.10.2025 (Bekanntmachungsdatum)\n\nNiedersachsen Amtsgericht Hildesheim HRB 204516\nRegisterbekanntmachung nach dem Umwandlungsgesetz 22.10.2025 (Eintragungsdatum)\n\nFEMA GmbH\nGesellschaft mit beschränkter Haftung\nMeine\n\nDen Gläubigern der an der Verschmelzung beteiligten Rechtsträger ist, wenn sie binnen sechs Monaten nach dem Tag, an dem die Eintragung der Verschmelzung in das Register des Sitzes desjenigen Rechtsträgers, dessen Gläubiger sie sind, nach § 19  Abs.  3 UmwG als bekannt gemacht gilt, ihren Anspruch nach Grund und Höhe schriftlich anmelden, Sicherheit zu leisten, soweit sie nicht Befriedigung verlangen können. Dieses Recht steht den Gläubigern jedoch nur zu, wenn sie glaubhaft machen, dass durch die Verschmelzung die Erfüllung der Forderung gefährdet wird."
    },
    {
      "date": "2025-10-22",
      "id": "134915",
      "original_text": "Registerbekanntmachung nach dem Umwandlungsgesetz\nNiedersachsen Amtsgericht Hildesheim VR 200236\nSV Bockenem 2007 e.V. – Bockenem",
      "type": "Registerbekanntmachung nach dem Umwandlungsgesetz",
      "state": "Niedersachsen",
      "amtsgericht": "Amtsgericht Hildesheim",
      "registernummer": "VR 200236",
      "registerart": "VR",
      "company_name": "SV Bockenem 2007 e.V.",
      "company_seat": "Bockenem",
      "details": "22.10.2025 (Bekanntmachungsdatum)\n\nNiedersachsen Amtsgericht Hildesheim VR 200236\nRegisterbekanntmachung nach dem Umwandlungsgesetz 22.10.2025 (Eintragungsdatum)\n\nSV Bockenem 2007 e.V.\neingetragener Verein\nBockenem\n\nDen Gläubigern der an der Verschmelzung beteiligten Rechtsträger ist, wenn sie binnen sechs Monaten nach dem Tag, an dem die Eintragung der Verschmelzung in das Register des Sitzes desjenigen Rechtsträgers, dessen Gläubiger sie sind, nach § 19  Abs.  3 UmwG als bekannt gemacht gilt, ihren Anspruch nach Grund und Höhe schriftlich anmelden, Sicherheit zu leisten, soweit sie nicht Befriedigung verlangen können. Dieses Recht steht den Gläubigern jedoch nur zu, wenn sie glaubhaft machen, dass durch die Verschmelzung die Erfüllung der Forderung gefährdet wird."
    },
    {
      "date": "2025-10-22",
      "id": "134916",
      "original_text": "Löschungsankündigung\nNiedersachsen Amtsgericht Osnabrück HRB 201014\nH. Thien Bau-GmbH – Hilkenbrook",
      "type": "Löschungsankündigung",
      "state": "Niedersachsen",
      "amtsgericht": "Amtsgericht Osnabrück",
      "registernummer": "HRB 201014",
      "registerart": "HRB",
      "company_name": "H. Thien Bau-GmbH",
      "company_seat": "Hilkenbrook",
      "details": "22.10.2025 (Bekanntmachungsdatum)\n\nNiedersachsen Amtsgericht Osnabrück HRB 201014\nLöschungsankündigung\n\nH. Thien Bau-GmbH\nGesellschaft mit beschränkter Haftung\nHilkenbrook\n\nDas Registergericht beabsichtigt, die Gesellschaft von Amts wegen nach § 394 FamFG wegen Vermögenslosigkeit zu löschen. Die Frist zur Erhebung eines Widerspruchs ist auf 1 Monat ab dieser Registerbekanntmachung festgesetzt."
    },
    {
      "date": "2025-10-22",
      "id": "134917",
      "original_text": "Registerbekanntmachung nach dem Umwandlungsgesetz\nNiedersachsen Amtsgericht Tostedt HRB 207018\nSUNAID X GmbH – Geestland",
      "type": "Registerbekanntmachung nach dem Umwandlungsgesetz",
      "state": "Niedersachsen",
      "amtsgericht": "Amtsgericht Tostedt",
      "registernummer": "HRB 207018",
      "registerart": "HRB",
      "company_name": "SUNAID X GmbH",
      "company_seat": "Geestland",
      "details": "22.10.2025 (Bekanntmachungsdatum)\n\nNiedersachsen Amtsgericht Tostedt HRB 207018\nRegisterbekanntmachung nach dem Umwandlungsgesetz 22.10.2025 (Eintragungsdatum)\n\nSUNAID X GmbH\nGesellschaft mit beschränkter Haftung\nGeestland\n\nDen Gläubigern der an der Verschmelzung beteiligten Rechtsträger ist, wenn sie binnen sechs Monaten nach dem Tag, an dem die Eintragung der Verschmelzung in das Register des Sitzes desjenigen Rechtsträgers, dessen Gläubiger sie sind, nach § 19  Abs.  3 UmwG als bekannt gemacht gilt, ihren Anspruch nach Grund und Höhe schriftlich anmelden, Sicherheit zu leisten, soweit sie nicht Befriedigung verlangen können. Dieses Recht steht den Gläubigern jedoch nur zu, wenn sie glaubhaft machen, dass durch die Verschmelzung die Erfüllung der Forderung gefährdet wird."
    },
    {
      "date": "2025-10-22",
      "id": "134918",
      "original_text": "Registerbekanntmachung nach dem Umwandlungsgesetz\nBremen Amtsgericht Bremen HRA 23778\nEntelmann GmbH & Co. KG – Bremen",
      "type": "Registerbekanntmachung nach dem Umwandlungsgesetz",
      "state": "Bremen",
      "amtsgericht": "Amtsgericht Bremen",
      "registernummer": "HRA 23778",
      "registerart": "HRA",
      "company_name": "Entelmann GmbH & Co. KG",
      "company_seat": "Bremen",
      "details": "22.10.2025 (Bekanntmachungsdatum)\n\nBremen Amtsgericht Bremen HRA 23778\nRegisterbekanntmachung nach dem Umwandlungsgesetz 20.10.2025 (Eintragungsdatum)\n\nEntelmann GmbH & Co. KG\nKommanditgesellschaft\nBremen\n\nZu Eintragungsnummer 10 vom 20.10.2025 wird als nicht eingetragen veröffentlicht:  Den Gläubigern der an der Verschmelzung beteiligten Rechtsträger ist, wenn sie binnen sechs Monaten nach dem Tag, an dem die Eintragung der Verschmelzung in das Register des Sitzes desjenigen Rechtsträgers, dessen Gläubiger sie sind, als bekannt gemacht gilt, ihren Anspruch nach Grund und Höhe schriftlich anmelden, Sicherheit zu leisten, soweit sie nicht Befriedigung verlangen können. Dieses Recht steht den Gläubigern jedoch nur zu, wenn sie glaubhaft machen, dass durch die Verschmelzung die Erfüllung ihrer Forderung gefährdet wird. Das Recht, Sicherheitsleistung zu verlangen, steht Gläubigern nicht zu, die im Falle der Insolvenz ein Recht auf vorzugsweise Befriedigung aus einer Deckungsmasse haben, die nach gesetzlicher Vorschrift zu ihrem Schutz errichtet und staatlich überwacht ist."
    },
    {
      "date": "2025-10-22",
      "id": "134919",
      "original_text": "Registerbekanntmachung nach dem Umwandlungsgesetz\nBremen Amtsgericht Bremen HRB 37383\naffinis solutions GmbH – Bremen",
      "type": "Registerbekanntmachung nach dem Umwandlungsgesetz",
      "state": "Bremen",
      "amtsgericht": "Amtsgericht Bremen",
      "registernummer": "HRB 37383",
      "registerart": "HRB",
      "company_name": "affinis solutions GmbH",
      "company_seat": "Bremen",
      "details": "22.10.2025 (Bekanntmachungsdatum)\n\nBremen Amtsgericht Bremen HRB 37383\nRegisterbekanntmachung nach dem Umwandlungsgesetz 20.10.2025 (Eintragungsdatum)\n\naffinis solutions GmbH\nGesellschaft mit beschränkter Haftung\nBremen\n\nZu Eintragungsnummer 18 vom 20.10.2025 wird als nicht eingetragen veröffentlicht: Den Gläubigern der an der Spaltung beteiligten Rechtsträger ist, wenn sie binnen sechs Monaten nach dem Tag, an dem die Eintragung der Spaltung in das Register des Sitzes desjenigen Rechtsträgers, dessen Gläubiger sie sind, als bekannt gemacht gilt, ihren Anspruch nach Grund und Höhe schriftlich anmelden, Sicherheit zu leisten, soweit sie nicht Befriedigung verlangen können. Dieses Recht steht den Gläubigern jedoch nur zu, wenn sie glaubhaft machen, dass durch die Spaltung die Erfüllung ihrer Forderung gefährdet wird. Das Recht, Sicherheitsleistung zu verlangen, steht Gläubigern nicht zu, die im Falle der Insolvenz ein Recht auf vorzugsweise Befriedigung aus einer Deckungsmasse haben, die nach gesetzlicher Vorschrift zu ihrem Schutz errichtet und staatlich überwacht ist."
    },
    {
      "date": "2025-10-22",
      "id": "134920",
      "original_text": "Registerbekanntmachung nach dem Umwandlungsgesetz\nBremen Amtsgericht Bremen VR 2095\nAllgemeiner Turn- und Sportverein Habenhausen e.V. – Bremen",
      "type": "Registerbekanntmachung nach dem Umwandlungsgesetz",
      "state": "Bremen",
      "amtsgericht": "Amtsgericht Bremen",
      "registernummer": "VR 2095",
      "registerart": "VR",
      "company_name": "Allgemeiner Turn- und Sportverein Habenhausen e.V.",
      "company_seat": "Bremen",
      "details": "22.10.2025 (Bekanntmachungsdatum)\n\nBremen Amtsgericht Bremen VR 2095\nRegisterbekanntmachung nach dem Umwandlungsgesetz 21.10.2025 (Eintragungsdatum)\n\nAllgemeiner Turn- und Sportverein Habenhausen e.V.\neingetragener Verein\nBremen\n\nZu Eintragungsnummer 11 vom 21.10.2025 wird als nicht eingetragen veröffentlicht:  Den Gläubigern der an der Verschmelzung beteiligten Rechtsträger ist, wenn sie binnen sechs Monaten nach dem Tag, an dem die Eintragung der Verschmelzung in das Register des Sitzes desjenigen Rechtsträgers, dessen Gläubiger sie sind, als bekannt gemacht gilt, ihren Anspruch nach Grund und Höhe schriftlich anmelden, Sicherheit zu leisten, soweit sie nicht Befriedigung verlangen können. Dieses Recht steht den Gläubigern jedoch nur zu, wenn sie glaubhaft machen, dass durch die Verschmelzung die Erfüllung ihrer Forderung gefährdet wird. Das Recht, Sicherheitsleistung zu verlangen, steht Gläubigern nicht zu, die im Falle der Insolvenz ein Recht auf vorzugsweise Befriedigung aus einer Deckungsmasse haben, die nach gesetzlicher Vorschrift zu ihrem Schutz errichtet und staatlich überwacht ist."
    },
    {
      "date": "2025-10-22",
      "id": "134921",
      "original_text": "Registerbekanntmachung nach dem Umwandlungsgesetz\nBremen Amtsgericht Bremen VR 2276\nPolizei - Sportverein Bremen 1921 e.V. – Bremen",
      "type": "Registerbekanntmachung nach dem Umwandlungsgesetz",
      "state": "Bremen",
      "amtsgericht": "Amtsgericht Bremen",
      "registernummer": "VR 2276",
      "registerart": "VR",
      "company_name": "Polizei - Sportverein Bremen 1921 e.V.",
      "company_seat": "Bremen",
      "details": "22.10.2025 (Bekanntmachungsdatum)\n\nBremen Amtsgericht Bremen VR 2276\nRegisterbekanntmachung nach dem Umwandlungsgesetz 21.10.2025 (Eintragungsdatum)\n\nPolizei - Sportverein Bremen 1921 e.V.\neingetragener Verein\nBremen\n\nZu Eintragungsnummer 11 vom 21.10.2025 wird als nicht eingetragen veröffentlicht:  Den Gläubigern der an der Verschmelzung beteiligten Rechtsträger ist, wenn sie binnen sechs Monaten nach dem Tag, an dem die Eintragung der Verschmelzung in das Register des Sitzes desjenigen Rechtsträgers, dessen Gläubiger sie sind, als bekannt gemacht gilt, ihren Anspruch nach Grund und Höhe schriftlich anmelden, Sicherheit zu leisten, soweit sie nicht Befriedigung verlangen können. Dieses Recht steht den Gläubigern jedoch nur zu, wenn sie glaubhaft machen, dass durch die Verschmelzung die Erfüllung ihrer Forderung gefährdet wird. Das Recht, Sicherheitsleistung zu verlangen, steht Gläubigern nicht zu, die im Falle der Insolvenz ein Recht auf vorzugsweise Befriedigung aus einer Deckungsmasse haben, die nach gesetzlicher Vorschrift zu ihrem Schutz errichtet und staatlich überwacht ist."
    },
    {
      "date": "2025-10-22",
      "id": "134922",
      "original_text": "Löschungsankündigung\nBremen Amtsgericht Bremen HRB 40225\nBiggie B Systemgastronomie Beteiligungs-UG (haftungsbeschränkt) – Bremen",
      "type": "Löschungsankündigung",
      "state": "Bremen",
      "amtsgericht": "Amtsgericht Bremen",
      "registernummer": "HRB 40225",
      "registerart": "HRB",
      "company_name": "Biggie B Systemgastronomie Beteiligungs-UG (haftungsbeschränkt)",
      "company_seat": "Bremen",
      "details": "22.10.2025 (Bekanntmachungsdatum)\n\nBremen Amtsgericht Bremen HRB 40225\nLöschungsankündigung\n\nBiggie B Systemgastronomie Beteiligungs-UG (haftungsbeschränkt)\nGesellschaft mit beschränkter Haftung\nBremen\n\nEs ist beabsichtigt die im Handelsregister eingetragene Gesellschaft von Amts wegen gemäß § 394 FamFG zu löschen. Gegen die Löschung kann beim AG Bremen schriftlich oder zu Protokoll der Geschäftsstelle Widerspruch eingelegt werden. Widerspruchsfrist 4 Wochen."
    },
    {
      "date": "2025-10-22",
      "id": "134923",
      "original_text": "Registerbekanntmachung nach dem Umwandlungsgesetz\nRheinland-Pfalz Amtsgericht Montabaur HRB 20478\nsportsUP GmbH – Höhr-Grenzhausen",
      "type": "Registerbekanntmachung nach dem Umwandlungsgesetz",
      "state": "Rheinland-Pfalz",
      "amtsgericht": "Amtsgericht Montabaur",
      "registernummer": "HRB 20478",
      "registerart": "HRB",
      "company_name": "sportsUP GmbH",
      "company_seat": "Höhr-Grenzhausen",
      "details": "22.10.2025 (Bekanntmachungsdatum)\n\nRheinland-Pfalz Amtsgericht Montabaur HRB 20478\nRegisterbekanntmachung nach dem Umwandlungsgesetz 22.10.2025 (Eintragungsdatum)\n\nsportsUP GmbH\nGesellschaft mit beschränkter Haftung\nHöhr-Grenzhausen\n\nAls nicht eingetragen wird veröffentlicht: Den Gläubigern der an der Verschmelzung beteiligten Rechtsträger ist, wenn sie binnen sechs Monaten nach dem Tag, an dem die Eintragung der Verschmelzung in das Register des Sitzes desjenigen Rechtsträgers,dessen Gläubiger sie sind, nach § 19 Abs. 3 UmwG als bekannt gemacht gilt, ihren Anspruch nach Grund und Höhe schriftlich anmelden, Sicherheit zu leisten, soweit sie nicht Befriedigung verlangen können. Dieses Recht steht den Gläubigern jedoch nur zu, wenn sie glaubhaft machen, dass durch die Verschmelzung die Erfüllungd er Forderung gefährdet wird."
    },
    {
      "date": "2025-10-22",
      "id": "134924",
      "original_text": "Registerbekanntmachung nach dem Umwandlungsgesetz\nRheinland-Pfalz Amtsgericht Mainz HRB 46354\nKUNZE Immobilienverwaltung GmbH – Worms",
      "type": "Registerbekanntmachung nach dem Umwandlungsgesetz",
      "state": "Rheinland-Pfalz",
      "amtsgericht": "Amtsgericht Mainz",
      "registernummer": "HRB 46354",
      "registerart": "HRB",
      "company_name": "KUNZE Immobilienverwaltung GmbH",
      "company_seat": "Worms",
      "details": "22.10.2025 (Bekanntmachungsdatum)\n\nRheinland-Pfalz Amtsgericht Mainz HRB 46354\nRegisterbekanntmachung nach dem Umwandlungsgesetz 22.10.2025 (Eintragungsdatum)\n\nKUNZE Immobilienverwaltung GmbH\nGesellschaft mit beschränkter Haftung\nWorms\n\nAls nicht eingetragen wird veröffentlicht: Den Gläubigern der an der erschmelzung beteiligten Rechtsträger ist, wenn sie binnen sechs Monaten nach dem Tag, an dem die Eintragung der Verschmelzung in das Register des Sitzes desjenigen Rechtsträgers,dessen Gläubiger sie sind, nach § 19 Abs. 3 UmwG als bekannt gemacht gilt, ihren Anspruch nach Grund und Höhe schriftlich anmelden, Sicherheit zu leisten, soweit sie nicht Befriedigung verlangen können. Dieses Recht steht den Gläubigern jedoch nur zu, wenn sie glaubhaft machen, dass durch die Verschmelzung die Erfüllung der Forderung gefährdet wird."
    },
    {
      "date": "2025-10-22",
      "id": "134925",
      "original_text": "Löschungsankündigung\nRheinland-Pfalz Amtsgericht Ludwigshafen a.Rhein (Ludwigshafen) HRB 67122\nLeitenberg Immobilien GmbH – Bobenheim-Roxheim",
      "type": "Löschungsankündigung",
      "state": "Rheinland-Pfalz",
      "amtsgericht": "Amtsgericht Ludwigshafen a.Rhein (Ludwigshafen)",
      "registernummer": "HRB 67122",
      "registerart": "HRB",
      "company_name": "Leitenberg Immobilien GmbH",
      "company_seat": "Bobenheim-Roxheim",
      "details": "22.10.2025 (Bekanntmachungsdatum)\n\nRheinland-Pfalz Amtsgericht Ludwigshafen a.Rhein (Ludwigshafen) HRB 67122\nLöschungsankündigung\n\nLeitenberg Immobilien GmbH\nGesellschaft mit beschränkter Haftung\nBobenheim-Roxheim\n\nDas Registergericht beabsichtigt die Gesellschaft von Amts wegen nach § 394 FamFG zu löschen. Die Frist zur Erhebung eines Widerspruchs ist auf einen Monat festgesetzt."
    },
    {
      "date": "2025-10-22",
      "id": "134926",
      "original_text": "Registerbekanntmachung nach dem Umwandlungsgesetz\nNordrhein-Westfalen Amtsgericht Münster HRB 21101\nsyncoria GmbH – Münster",
      "type": "Registerbekanntmachung nach dem Umwandlungsgesetz",
      "state": "Nordrhein-Westfalen",
      "amtsgericht": "Amtsgericht Münster",
      "registernummer": "HRB 21101",
      "registerart": "HRB",
      "company_name": "syncoria GmbH",
      "company_seat": "Münster",
      "details": "22.10.2025 (Bekanntmachungsdatum)\n\nNordrhein-Westfalen Amtsgericht Münster HRB 21101\nRegisterbekanntmachung nach dem Umwandlungsgesetz 22.10.2025 (Eintragungsdatum)\n\nsyncoria GmbH\nGesellschaft mit beschränkter Haftung\nMünster\n\nDen Gläubigern der an der Verschmelzung beteiligten Rechtsträger ist, wenn sie binnen sechs Monaten nach dem Tag, an dem die Eintragung der Verschmelzung in das Register des Sitzes desjenigen Rechtsträgers, dessen Gläubiger sie sind, nach § 19 Absatz 3 UmwG als bekanntgemacht gilt, ihren Anspruch nach Grund und Höhe schriftlich anmelden, Sicherheit zu leisten, soweit sie nicht Befriedigung verlangen können. Dieses Recht steht den Gläubigern jedoch nur zu, wenn sie glaubhaft machen, dass durch die Verschmelzung die Erfüllung ihrer Forderung gefährdet wird."
    },
    {
      "date": "2025-10-22",
      "id": "134927",
      "original_text": "Einreichung neuer Dokumente\nNordrhein-Westfalen Amtsgericht Iserlohn HRB 10340\nOTTO FUCHS Verwaltungs SE – Meinerzhagen",
      "type": "Einreichung neuer Dokumente",
      "state": "Nordrhein-Westfalen",
      "amtsgericht": "Amtsgericht Iserlohn",
      "registernummer": "HRB 10340",
      "registerart": "HRB",
      "company_name": "OTTO FUCHS Verwaltungs SE",
      "company_seat": "Meinerzhagen",
      "details": "22.10.2025 (Bekanntmachungsdatum)\n\nNordrhein-Westfalen Amtsgericht Iserlohn HRB 10340\nEinreichung neuer Dokumente 22.10.2025 (Eintragungsdatum)\n\nOTTO FUCHS Verwaltungs SE\nEuropäische Aktiengesellschaft (SE)\nMeinerzhagen\n\nDem Registergericht ist eine neue Liste der Mitglieder des Aufsichtsrates eingereicht worden."
    },
    {
      "date": "2025-10-22",
      "id": "134928",
      "original_text": "Einreichung neuer Dokumente\nNordrhein-Westfalen Amtsgericht Iserlohn HRB 10334\nOTTO FUCHS Beteiligungen Verwaltungs SE – Meinerzhagen",
      "type": "Einreichung neuer Dokumente",
      "state": "Nordrhein-Westfalen",
      "amtsgericht": "Amtsgericht Iserlohn",
      "registernummer": "HRB 10334",
      "registerart": "HRB",
      "company_name": "OTTO FUCHS Beteiligungen Verwaltungs SE",
      "company_seat": "Meinerzhagen",
      "details": "22.10.2025 (Bekanntmachungsdatum)\n\nNordrhein-Westfalen Amtsgericht Iserlohn HRB 10334\nEinreichung neuer Dokumente 22.10.2025 (Eintragungsdatum)\n\nOTTO FUCHS Beteiligungen Verwaltungs SE\nEuropäische Aktiengesellschaft (SE)\nMeinerzhagen\n\nDem Registergericht ist eine neue Liste der Mitglieder des Aufsichtsrates eingereicht worden."
    },
    {
      "date": "2025-10-22",
      "id": "134929",
      "original_text": "Löschungsankündigung\nNordrhein-Westfalen Amtsgericht Dortmund HRB 25028\nHülsewiesche & Denninghaus Unternehmergesellschaft (haftungsbeschränkt) – Dortmund",
      "type": "Löschungsankündigung",
      "state": "Nordrhein-Westfalen",
      "amtsgericht": "Amtsgericht Dortmund",
      "registernummer": "HRB 25028",
      "registerart": "HRB",
      "company_name": "Hülsewiesche & Denninghaus Unternehmergesellschaft (haftungsbeschränkt)",
      "company_seat": "Dortmund",
      "details": "22.10.2025 (Bekanntmachungsdatum)\n\nNordrhein-Westfalen Amtsgericht Dortmund HRB 25028\nLöschungsankündigung 22.10.2025 (Eintragungsdatum)\n\nHülsewiesche & Denninghaus Unternehmergesellschaft (haftungsbeschränkt)\nGesellschaft mit beschränkter Haftung\nDortmund\n\nDas Registergericht beabsichtigt die Gesellschaft von Amts wegen nach § 394 FamFG zu löschen. Die Frist zur Erhebung eines Widerspruchs ist auf zwei Monate festgesetzt."
    },
    {
      "date": "2025-10-22",
      "id": "134930",
      "original_text": "Registerbekanntmachung nach dem Umwandlungsgesetz\nNordrhein-Westfalen Amtsgericht Köln HRB 71985\nStar Personal GmbH – Frechen",
      "type": "Registerbekanntmachung nach dem Umwandlungsgesetz",
      "state": "Nordrhein-Westfalen",
      "amtsgericht": "Amtsgericht Köln",
      "registernummer": "HRB 71985",
      "registerart": "HRB",
      "company_name": "Star Personal GmbH",
      "company_seat": "Frechen",
      "details": "22.10.2025 (Bekanntmachungsdatum)\n\nNordrhein-Westfalen Amtsgericht Köln HRB 71985\nRegisterbekanntmachung nach dem Umwandlungsgesetz 22.10.2025 (Eintragungsdatum)\n\nStar Personal GmbH\nGesellschaft mit beschränkter Haftung\nFrechen\n\nDen Gläubigern der an der Verschmelzung beteiligten Rechtsträger ist, wenn sie binnen sechs Monaten nach dem Tag, an dem die Eintragung der Verschmelzung in das Register des Sitzes desjenigen Rechtsträgers, dessen Gläubiger sie sind, nach § 19 Absatz 3 UmwG als bekanntgemacht gilt, ihren Anspruch nach Grund und Höhe schriftlich anmelden, Sicherheit zu leisten, soweit sie nicht Befriedigung verlangen können. Dieses Recht steht den Gläubigern jedoch nur zu, wenn sie glaubhaft machen, dass durch die Verschmelzung die Erfüllung ihrer Forderung gefährdet wird."
    },
    {
      "date": "2025-10-22",
      "id": "134931",
      "original_text": "Sonstige Registerbekanntmachung\nNordrhein-Westfalen Amtsgericht Köln HRB 107937\nSAVANNA Ingredients Beteiligungs GmbH – Elsdorf",
      "type": "Sonstige Registerbekanntmachung",
      "state": "Nordrhein-Westfalen",
      "amtsgericht": "Amtsgericht Köln",
      "registernummer": "HRB 107937",
      "registerart": "HRB",
      "company_name": "SAVANNA Ingredients Beteiligungs GmbH",
      "company_seat": "Elsdorf",
      "details": "22.10.2025 (Bekanntmachungsdatum)\n\nNordrhein-Westfalen Amtsgericht Köln HRB 107937\nSonstige Registerbekanntmachung 22.10.2025 (Eintragungsdatum)\n\nSAVANNA Ingredients Beteiligungs GmbH\nGesellschaft mit beschränkter Haftung\nElsdorf\n\nAls nicht eingetragen wird veröffentlicht: Den Gläubigern der Gesellschaft, deren Forderungen begründet worden sind bevor die Eintragung der Beendigung des Beherrschungs- und Ergebnisabführungsvertrages  in das Handelsregister nach § 10 des Handelsgesetzbuches als bekanntgemacht gilt, hat der andere Vertragsteil Sicherheit zu leisten, wenn sie sich binnen sechs Monaten nach der Bekanntmachung der Eintragung zu diesem Zweck bei ihm melden."
    },
    {
      "date": "2025-10-22",
      "id": "134932",
      "original_text": "Registerbekanntmachung nach dem Umwandlungsgesetz\nNordrhein-Westfalen Amtsgericht Gelsenkirchen HRB 16324\nSTEBLA Immobilien GmbH – Marl",
      "type": "Registerbekanntmachung nach dem Umwandlungsgesetz",
      "state": "Nordrhein-Westfalen",
      "amtsgericht": "Amtsgericht Gelsenkirchen",
      "registernummer": "HRB 16324",
      "registerart": "HRB",
      "company_name": "STEBLA Immobilien GmbH",
      "company_seat": "Marl",
      "details": "22.10.2025 (Bekanntmachungsdatum)\n\nNordrhein-Westfalen Amtsgericht Gelsenkirchen HRB 16324\nRegisterbekanntmachung nach dem Umwandlungsgesetz 22.10.2025 (Eintragungsdatum)\n\nSTEBLA Immobilien GmbH\nGesellschaft mit beschränkter Haftung\nMarl\n\nDen Gläubigern der an der Verschmelzung beteiligten Rechtsträger ist, wenn sie binnen sechs Monaten nach dem Tag, an dem die Eintragung der Verschmelzung in das Register des Sitzes desjenigen Rechtsträgers, dessen Gläubiger sie sind, nach § 19 Absatz 3 UmwG als bekanntgemacht gilt, ihren Anspruch nach Grund und Höhe schriftlich anmelden, Sicherheit zu leisten, soweit sie nicht Befriedigung verlangen können. Dieses Recht steht den Gläubigern jedoch nur zu, wenn sie glaubhaft machen, dass durch die Verschmelzung die Erfüllung ihrer Forderung gefährdet wird."
    },
    {
      "date": "2025-10-22",
      "id": "134933",
      "original_text": "Registerbekanntmachung nach dem Umwandlungsgesetz\nNordrhein-Westfalen Amtsgericht Düsseldorf HRB 95780\nConnex Grundvermögen XXI GmbH – Monheim am Rhein",
      "type": "Registerbekanntmachung nach dem Umwandlungsgesetz",
      "state": "Nordrhein-Westfalen",
      "amtsgericht": "Amtsgericht Düsseldorf",
      "registernummer": "HRB 95780",
      "registerart": "HRB",
      "company_name": "Connex Grundvermögen XXI GmbH",
      "company_seat": "Monheim am Rhein",
      "details": "22.10.2025 (Bekanntmachungsdatum)\n\nNordrhein-Westfalen Amtsgericht Düsseldorf HRB 95780\nRegisterbekanntmachung nach dem Umwandlungsgesetz 22.10.2025 (Eintragungsdatum)\n\nConnex Grundvermögen XXI GmbH\nGesellschaft mit beschränkter Haftung\nMonheim am Rhein\n\nDen Gläubigern der an der Verschmelzung beteiligten Rechtsträger ist, wenn sie binnen sechs Monaten nach dem Tag, an dem die Eintragung der Verschmelzung in das Register des Sitzes desjenigen Rechtsträgers, dessen Gläubiger sie sind, nach § 19 Absatz 3 UmwG als bekanntgemacht gilt, ihren Anspruch nach Grund und Höhe schriftlich anmelden, Sicherheit zu leisten, soweit sie nicht Befriedigung verlangen können. Dieses Recht steht den Gläubigern jedoch nur zu, wenn sie glaubhaft machen, dass durch die Verschmelzung die Erfüllung ihrer Forderung gefährdet wird."
    },
    {
      "date": "2025-10-22",
      "id": "134934",
      "original_text": "Löschungsankündigung\nNordrhein-Westfalen Amtsgericht Krefeld HRB 16995\nLuckyViews.com UG (haftungsbeschränkt) – Grefrath",
      "type": "Löschungsankündigung",
      "state": "Nordrhein-Westfalen",
      "amtsgericht": "Amtsgericht Krefeld",
      "registernummer": "HRB 16995",
      "registerart": "HRB",
      "company_name": "LuckyViews.com UG (haftungsbeschränkt)",
      "company_seat": "Grefrath",
      "details": "22.10.2025 (Bekanntmachungsdatum)\n\nNordrhein-Westfalen Amtsgericht Krefeld HRB 16995\nLöschungsankündigung\n\nLuckyViews.com UG (haftungsbeschränkt)\nGesellschaft mit beschränkter Haftung\nGrefrath\n\nDas Registergericht beabsichtigt die Gesellschaft von Amts wegen nach § 394 FamFG zu löschen. Die Frist zur Erhebung eines Widerspruchs ist auf einen Monat festgesetzt."
    },
    {
      "date": "2025-10-22",
      "id": "134935",
      "original_text": "Registerbekanntmachung nach dem Umwandlungsgesetz\nNordrhein-Westfalen Amtsgericht Köln HRB 118555\nSonnleitner Rheinisch-Bergische Treuhand GmbH Steuerberatungsgesellschaft Rechtsanwaltsgesellschaft – Leichlingen",
      "type": "Registerbekanntmachung nach dem Umwandlungsgesetz",
      "state": "Nordrhein-Westfalen",
      "amtsgericht": "Amtsgericht Köln",
      "registernummer": "HRB 118555",
      "registerart": "HRB",
      "company_name": "Sonnleitner Rheinisch-Bergische Treuhand GmbH Steuerberatungsgesellschaft Rechtsanwaltsgesellschaft",
      "company_seat": "Leichlingen",
      "details": "22.10.2025 (Bekanntmachungsdatum)\n\nNordrhein-Westfalen Amtsgericht Köln HRB 118555\nRegisterbekanntmachung nach dem Umwandlungsgesetz 22.10.2025 (Eintragungsdatum)\n\nSonnleitner Rheinisch-Bergische Treuhand GmbH Steuerberatungsgesellschaft Rechtsanwaltsgesellschaft\nGesellschaft mit beschränkter Haftung\nLeichlingen\n\nDen Gläubigern der an der Verschmelzung beteiligten Rechtsträger ist, wenn sie binnen sechs Monaten nach dem Tag, an dem die Eintragung der Verschmelzung in das Register des Sitzes desjenigen Rechtsträgers, dessen Gläubiger sie sind, nach § 19 Absatz 3 UmwG als bekanntgemacht gilt, ihren Anspruch nach Grund und Höhe schriftlich anmelden, Sicherheit zu leisten, soweit sie nicht Befriedigung verlangen können. Dieses Recht steht den Gläubigern jedoch nur zu, wenn sie glaubhaft machen, dass durch die Verschmelzung die Erfüllung ihrer Forderung gefährdet wird."
    },
    {
      "date": "2025-10-22",
      "id": "134936",
      "original_text": "Einreichung neuer Dokumente\nNordrhein-Westfalen Amtsgericht Düsseldorf HRB 46985\nBayer CropScience Aktiengesellschaft – Monheim am Rhein",
      "type": "Einreichung neuer Dokumente",
      "state": "Nordrhein-Westfalen",
      "amtsgericht": "Amtsgericht Düsseldorf",
      "registernummer": "HRB 46985",
      "registerart": "HRB",
      "company_name": "Bayer CropScience Aktiengesellschaft",
      "company_seat": "Monheim am Rhein",
      "details": "22.10.2025 (Bekanntmachungsdatum)\n\nNordrhein-Westfalen Amtsgericht Düsseldorf HRB 46985\nEinreichung neuer Dokumente\n\nBayer CropScience Aktiengesellschaft\nAktiengesellschaft\nMonheim am Rhein\n\nDem Registergericht ist eine Liste der Mitglieder des Aufsichtsrates eingereicht worden."
    },
    {
      "date": "2025-10-22",
      "id": "134937",
      "original_text": "Registerbekanntmachung nach dem Umwandlungsgesetz\nNordrhein-Westfalen Amtsgericht Köln HRB 109717\nSonnleitner Rheinische Treuhand GmbH Steuerberatungsgesellschaft Rechtsanwaltsgesellschaft – Leichlingen",
      "type": "Registerbekanntmachung nach dem Umwandlungsgesetz",
      "state": "Nordrhein-Westfalen",
      "amtsgericht": "Amtsgericht Köln",
      "registernummer": "HRB 109717",
      "registerart": "HRB",
      "company_name": "Sonnleitner Rheinische Treuhand GmbH Steuerberatungsgesellschaft Rechtsanwaltsgesellschaft",
      "company_seat": "Leichlingen",
      "details": "22.10.2025 (Bekanntmachungsdatum)\n\nNordrhein-Westfalen Amtsgericht Köln HRB 109717\nRegisterbekanntmachung nach dem Umwandlungsgesetz 22.10.2025 (Eintragungsdatum)\n\nSonnleitner Rheinische Treuhand GmbH Steuerberatungsgesellschaft Rechtsanwaltsgesellschaft\nGesellschaft mit beschränkter Haftung\nLeichlingen\n\nDen Gläubigern der an der Verschmelzung beteiligten Rechtsträger ist, wenn sie binnen sechs Monaten nach dem Tag, an dem die Eintragung der Verschmelzung in das Register des Sitzes desjenigen Rechtsträgers, dessen Gläubiger sie sind, nach § 19 Absatz 3 UmwG als bekanntgemacht gilt, ihren Anspruch nach Grund und Höhe schriftlich anmelden, Sicherheit zu leisten, soweit sie nicht Befriedigung verlangen können. Dieses Recht steht den Gläubigern jedoch nur zu, wenn sie glaubhaft machen, dass durch die Verschmelzung die Erfüllung ihrer Forderung gefährdet wird."
    },
    {
      "date": "2025-10-22",
      "id": "134938",
      "original_text": "Registerbekanntmachung nach dem Umwandlungsgesetz\nNordrhein-Westfalen Amtsgericht Köln HRB 34559\nwork InTime GmbH – Frechen",
      "type": "Registerbekanntmachung nach dem Umwandlungsgesetz",
      "state": "Nordrhein-Westfalen",
      "amtsgericht": "Amtsgericht Köln",
      "registernummer": "HRB 34559",
      "registerart": "HRB",
      "company_name": "work InTime GmbH",
      "company_seat": "Frechen",
      "details": "22.10.2025 (Bekanntmachungsdatum)\n\nNordrhein-Westfalen Amtsgericht Köln HRB 34559\nRegisterbekanntmachung nach dem Umwandlungsgesetz 22.10.2025 (Eintragungsdatum)\n\nwork InTime GmbH\nGesellschaft mit beschränkter Haftung\nFrechen\n\nDen Gläubigern der an der Verschmelzung beteiligten Rechtsträger ist, wenn sie binnen sechs Monaten nach dem Tag, an dem die Eintragung der Verschmelzung in das Register des Sitzes desjenigen Rechtsträgers, dessen Gläubiger sie sind, nach § 19 Absatz 3 UmwG als bekanntgemacht gilt, ihren Anspruch nach Grund und Höhe schriftlich anmelden, Sicherheit zu leisten, soweit sie nicht Befriedigung verlangen können. Dieses Recht steht den Gläubigern jedoch nur zu, wenn sie glaubhaft machen, dass durch die Verschmelzung die Erfüllung ihrer Forderung gefährdet wird."
    },
    {
      "date": "2025-10-22",
      "id": "134939",
      "original_text": "Registerbekanntmachung nach dem Umwandlungsgesetz\nNordrhein-Westfalen Amtsgericht Hamm HRA 4574\nMaschmeyer Immobilien GmbH & Co. KG – Bergkamen",
      "type": "Registerbekanntmachung nach dem Umwandlungsgesetz",
      "state": "Nordrhein-Westfalen",
      "amtsgericht": "Amtsgericht Hamm",
      "registernummer": "HRA 4574",
      "registerart": "HRA",
      "company_name": "Maschmeyer Immobilien GmbH & Co. KG",
      "company_seat": "Bergkamen",
      "details": "22.10.2025 (Bekanntmachungsdatum)\n\nNordrhein-Westfalen Amtsgericht Hamm HRA 4574\nRegisterbekanntmachung nach dem Umwandlungsgesetz 17.10.2025 (Eintragungsdatum)\n\nMaschmeyer Immobilien GmbH & Co. KG\nKommanditgesellschaft\nBergkamen\n\nDen Gläubigern der an der Ausgliederung beteiligten Rechtsträger ist, wenn sie binnen sechs Monaten nach dem Tag, an dem die Eintragung der Ausgliederung in das Register des Sitzes desjenigen Rechtsträgers, dessen Gläubiger sie sind, nach § 19 Absatz 3 UmwG als bekanntgemacht gilt, ihren Anspruch nach Grund und Höhe schriftlich anmelden, Sicherheit zu leisten, soweit sie nicht Befriedigung verlangen können. Dieses Recht steht den Gläubigern jedoch nur zu, wenn sie glaubhaft machen, dass durch die Ausgliederung die Erfüllung ihrer Forderung gefährdet wird."
    },
    {
      "date": "2025-10-22",
      "id": "134940",
      "original_text": "Löschungsankündigung\nNordrhein-Westfalen Amtsgericht Iserlohn HRB 8759\nNeveling Verwaltung GmbH – Hemer",
      "type": "Löschungsankündigung",
      "state": "Nordrhein-Westfalen",
      "amtsgericht": "Amtsgericht Iserlohn",
      "registernummer": "HRB 8759",
      "registerart": "HRB",
      "company_name": "Neveling Verwaltung GmbH",
      "company_seat": "Hemer",
      "details": "22.10.2025 (Bekanntmachungsdatum)\n\nNordrhein-Westfalen Amtsgericht Iserlohn HRB 8759\nLöschungsankündigung\n\nNeveling Verwaltung GmbH\nGesellschaft mit beschränkter Haftung\nHemer\n\nDas Registergericht beabsichtigt die Gesellschaft von Amts wegen nach §§ 10 HGB, 394 FamFG zu löschen. Die Frist zur Erhebung eines Widerspruchs ist auf 4 Monate festgesetzt."
    },
    {
      "date": "2025-10-22",
      "id": "134941",
      "original_text": "Registerbekanntmachung nach dem Umwandlungsgesetz\nNordrhein-Westfalen Amtsgericht Gelsenkirchen HRB 16323\nSTEBLA YourSPORTS GmbH – Marl",
      "type": "Registerbekanntmachung nach dem Umwandlungsgesetz",
      "state": "Nordrhein-Westfalen",
      "amtsgericht": "Amtsgericht Gelsenkirchen",
      "registernummer": "HRB 16323",
      "registerart": "HRB",
      "company_name": "STEBLA YourSPORTS GmbH",
      "company_seat": "Marl",
      "details": "22.10.2025 (Bekanntmachungsdatum)\n\nNordrhein-Westfalen Amtsgericht Gelsenkirchen HRB 16323\nRegisterbekanntmachung nach dem Umwandlungsgesetz 22.10.2025 (Eintragungsdatum)\n\nSTEBLA YourSPORTS GmbH\nGesellschaft mit beschränkter Haftung\nMarl\n\nDen Gläubigern der an der Verschmelzung beteiligten Rechtsträger ist, wenn sie binnen sechs Monaten nach dem Tag, an dem die Eintragung der Verschmelzung in das Register des Sitzes desjenigen Rechtsträgers, dessen Gläubiger sie sind, nach § 19 Absatz 3 UmwG als bekanntgemacht gilt, ihren Anspruch nach Grund und Höhe schriftlich anmelden, Sicherheit zu leisten, soweit sie nicht Befriedigung verlangen können. Dieses Recht steht den Gläubigern jedoch nur zu, wenn sie glaubhaft machen, dass durch die Verschmelzung die Erfüllung ihrer Forderung gefährdet wird."
    },
    {
      "date": "2025-10-22",
      "id": "134942",
      "original_text": "Löschungsankündigung\nNordrhein-Westfalen Amtsgericht Dortmund HRB 14628\nWiWo GmbH Wickeder Wohnungsgesellschaft mbH – Dortmund",
      "type": "Löschungsankündigung",
      "state": "Nordrhein-Westfalen",
      "amtsgericht": "Amtsgericht Dortmund",
      "registernummer": "HRB 14628",
      "registerart": "HRB",
      "company_name": "WiWo GmbH Wickeder Wohnungsgesellschaft mbH",
      "company_seat": "Dortmund",
      "details": "22.10.2025 (Bekanntmachungsdatum)\n\nNordrhein-Westfalen Amtsgericht Dortmund HRB 14628\nLöschungsankündigung 22.10.2025 (Eintragungsdatum)\n\nWiWo GmbH Wickeder Wohnungsgesellschaft mbH\nGesellschaft mit beschränkter Haftung\nDortmund\n\nDas Registergericht beabsichtigt die Gesellschaft von Amts wegen nach § 394 FamFG zu löschen. Die Frist zur Erhebung eines Widerspruchs ist auf zwei Monate festgesetzt."
    },
    {
      "date": "2025-10-22",
      "id": "134943",
      "original_text": "Registerbekanntmachung nach dem Umwandlungsgesetz\nNordrhein-Westfalen Amtsgericht Essen HRB 37177\nTVG 1893 GmbH – Essen",
      "type": "Registerbekanntmachung nach dem Umwandlungsgesetz",
      "state": "Nordrhein-Westfalen",
      "amtsgericht": "Amtsgericht Essen",
      "registernummer": "HRB 37177",
      "registerart": "HRB",
      "company_name": "TVG 1893 GmbH",
      "company_seat": "Essen",
      "details": "22.10.2025 (Bekanntmachungsdatum)\n\nNordrhein-Westfalen Amtsgericht Essen HRB 37177\nRegisterbekanntmachung nach dem Umwandlungsgesetz 22.10.2025 (Eintragungsdatum)\n\nTVG 1893 GmbH\nGesellschaft mit beschränkter Haftung\nEssen\n\nDen Gläubigern der an der Ausgliederung beteiligten Rechtsträger ist, wenn sie binnen sechs Monaten nach dem Tag, an dem die Eintragung der Ausgliederung in das Register des Sitzes desjenigen Rechtsträgers, dessen Gläubiger sie sind, nach § 19 Absatz 3 UmwG als bekanntgemacht gilt, ihren Anspruch nach Grund und Höhe schriftlich anmelden, Sicherheit zu leisten, soweit sie nicht Befriedigung verlangen können. Dieses Recht steht den Gläubigern jedoch nur zu, wenn sie glaubhaft machen, dass durch die Ausgliederung die Erfüllung ihrer Forderung gefährdet wird."
    },
    {
      "date": "2025-10-22",
      "id": "134944",
      "original_text": "Löschungsankündigung\nNordrhein-Westfalen Amtsgericht Neuss HRB 21141\nAyKu Deutschland GmbH – Kaarst",
      "type": "Löschungsankündigung",
      "state": "Nordrhein-Westfalen",
      "amtsgericht": "Amtsgericht Neuss",
      "registernummer": "HRB 21141",
      "registerart": "HRB",
      "company_name": "AyKu Deutschland GmbH",
      "company_seat": "Kaarst",
      "details": "22.10.2025 (Bekanntmachungsdatum)\n\nNordrhein-Westfalen Amtsgericht Neuss HRB 21141\nLöschungsankündigung 22.10.2025 (Eintragungsdatum)\n\nAyKu Deutschland GmbH\nGesellschaft mit beschränkter Haftung\nKaarst\n\nDas Registergericht beabsichtigt die Gesellschaft wegen Vermögenslosigkeit aufgrund des § 394 Abs. 1 FamFG zu löschen. Frist zur Geltendmachung eines Widerspruchs: 1 Monat.\nRechtsbehelfsbelehrung:\nGegen diese Verfügung können Sie Widerspruch einlegen.\nDer Widerspruch ist bei dem Amtsgericht Neuss - Registergericht -, Breite Str. 48, 41460 Neuss schriftlich in deutscher Sprache oder zur Niederschrift der Geschäftsstelle einzulegen.\nDer Widerspruch kann auch zur Niederschrift der Geschäftsstelle eines jeden Amtsgerichtes abgegeben werden.\nDie Einlegung ist auch durch Übertragung eines elektronischen Dokuments an die elektronische Poststelle des Gerichts möglich. Das elektronische Dokument muss für die Bearbeitung durch das Gericht geeignet und mit einer qualifizierten elektronischen Signatur der verantwortenden Person versehen sein oder von der verantwortenden Person signiert und auf einem sicheren Übermittlungsweg gemäß § 130a ZPO nach näherer Maßgabe der Verordnung über die technischen Rahmenbedingungen des elektronischen Rechtsverkehrs und über das besondere elektronische Behördenpostfach (BGBl. I, S.3803) eingereicht werden. Weitere Informationen erhalten Sie auf der Internetseite www.justiz.de.\nDer Widerspruch muss spätestens innerhalb der gesetzten Frist nach der schriftlichen Bekanntgabe der Verfügung bei dem Amtsgericht - Registergericht - Neuss eingegangen sein. Dies gilt auch dann, wenn der Widerspruch zur Niederschrift der Geschäftsstelle eines anderen Amtsgerichtes abgegeben wurde. Die Frist beginnt mit der schriftlichen Bekanntgabe der Verfügung. Die Bekanntgabe ist entweder durch Zustellung oder am dritten Tage nach Aufgabe zur Post bewirkt. Fällt das Ende der Frist auf einen Sonntag, einen allgemeinen Feiertag oder Sonnabend, so endet die Frist mit Ablauf des nächsten Werktages.\nDer Widerspruch muss die Bezeichnung der angefochtenen Verfügung sowie die Erklärung enthalten, dass Widerspruch gegen diese Verfügung eingelegt wird. Er ist zu unterzeichnen und soll begründet werden."
    },
    {
      "date": "2025-10-22",
      "id": "134945",
      "original_text": "Registerbekanntmachung nach dem Umwandlungsgesetz\nNordrhein-Westfalen Amtsgericht Köln HRB 57239\npower jobs GmbH – Frechen",
      "type": "Registerbekanntmachung nach dem Umwandlungsgesetz",
      "state": "Nordrhein-Westfalen",
      "amtsgericht": "Amtsgericht Köln",
      "registernummer": "HRB 57239",
      "registerart": "HRB",
      "company_name": "power jobs GmbH",
      "company_seat": "Frechen",
      "details": "22.10.2025 (Bekanntmachungsdatum)\n\nNordrhein-Westfalen Amtsgericht Köln HRB 57239\nRegisterbekanntmachung nach dem Umwandlungsgesetz 22.10.2025 (Eintragungsdatum)\n\npower jobs GmbH\nGesellschaft mit beschränkter Haftung\nFrechen\n\nDen Gläubigern der an der Verschmelzung beteiligten Rechtsträger ist, wenn sie binnen sechs Monaten nach dem Tag, an dem die Eintragung der Verschmelzung in das Register des Sitzes desjenigen Rechtsträgers, dessen Gläubiger sie sind, nach § 19 Absatz 3 UmwG als bekanntgemacht gilt, ihren Anspruch nach Grund und Höhe schriftlich anmelden, Sicherheit zu leisten, soweit sie nicht Befriedigung verlangen können. Dieses Recht steht den Gläubigern jedoch nur zu, wenn sie glaubhaft machen, dass durch die Verschmelzung die Erfüllung ihrer Forderung gefährdet wird."
    },
    {
      "date": "2025-10-22",
      "id": "134946",
      "original_text": "Löschungsankündigung\nNordrhein-Westfalen Amtsgericht Düsseldorf HRB 90516\nWiword International GmbH – Düsseldorf",
      "type": "Löschungsankündigung",
      "state": "Nordrhein-Westfalen",
      "amtsgericht": "Amtsgericht Düsseldorf",
      "registernummer": "HRB 90516",
      "registerart": "HRB",
      "company_name": "Wiword International GmbH",
      "company_seat": "Düsseldorf",
      "details": "22.10.2025 (Bekanntmachungsdatum)\n\nNordrhein-Westfalen Amtsgericht Düsseldorf HRB 90516\nLöschungsankündigung\n\nWiword International GmbH\nGesellschaft mit beschränkter Haftung\nDüsseldorf\n\nDas Registergericht beabsichtigt die Gesellschaft von Amts wegen nach § 394 Abs. 1 FamFG zu löschen. Die Frist zur Erhebung eines Widerspruchs ist auf einen Monat festgesetzt.\n\nRechtsbehelfsbelehrung:\nDas Widerspruchsrecht steht jedem zu, der an der Unterlassung der Löschung ein berechtigtes Interesse hat. Der Widerspruch ist bei dem Amtsgericht Düsseldorf -Registergericht-, Werdener Straße 1, 40227 Düsseldorf schriftlich in deutscher Sprache oder zur Niederschrift der Geschäftsstelle einzulegen. Der Widerspruch kann auch zur Niederschrift der Geschäftsstelle eines jeden Amtsgerichtes abgegeben werden. Die Einlegung ist auch durch Übertragung eines elektronischen Dokuments an die elektronische Poststelle des Gerichts möglich. Das elektronische Dokument muss für die Bearbeitung durch das Gericht geeignet und mit einer qualifizierten elektronischen Signatur der verantwortenden Person versehen sein oder von der verantwortenden Person signiert und auf einem sicheren Übermittlungsweg gemäß § 130a ZPO nach näherer Maßgabe der Verordnung über die technischen Rahmenbedingungen des elektronischen Rechtsverkehrs und über das besondere elektronische Behördenpostfach (BGBl. I, S.3803) eingereicht werden. Weitere Informationen erhalten Sie auf der Internetseite www.justiz.de.\nDer Widerspruch muss spätestens innerhalb der gesetzten Frist nach dem Datum der Bekanntmachung der Löschungsankündigung bei dem Amtsgericht - Registergericht - Düsseldorf eingegangen sein.  Dies gilt auch dann, wenn der Widerspruch zur Niederschrift der Geschäftsstelle eines anderen Amtsgerichtes abgegeben wurde. Die Frist beginnt mit dem Tage der Bekanntmachung der Löschungsankündigung in dem für die Bekanntmachung der Eintragungen in das Handelsregister bestimmten elektronischen Informations- und Kommunikationssystem nach § 10 des Handelsgesetzbuches. Fällt das Ende der Frist auf einen Sonntag, einen allgemeinen Feiertag oder Sonnabend, so endet die Frist mit Ablauf des nächsten Werktages.\nDer Widerspruch muss die Bezeichnung der angefochtenen Löschungsankündigung sowie die Erklärung enthalten, dass Widerspruch gegen diese Löschungsankündigung eingelegt wird. Er ist zu unterzeichnen und soll begründet werden."
    },
    {
      "date": "2025-10-22",
      "id": "134947",
      "original_text": "Registerbekanntmachung nach dem Umwandlungsgesetz\nNordrhein-Westfalen Amtsgericht Köln HRB 54887\nideale-jobs-GmbH – Frechen",
      "type": "Registerbekanntmachung nach dem Umwandlungsgesetz",
      "state": "Nordrhein-Westfalen",
      "amtsgericht": "Amtsgericht Köln",
      "registernummer": "HRB 54887",
      "registerart": "HRB",
      "company_name": "ideale-jobs-GmbH",
      "company_seat": "Frechen",
      "details": "22.10.2025 (Bekanntmachungsdatum)\n\nNordrhein-Westfalen Amtsgericht Köln HRB 54887\nRegisterbekanntmachung nach dem Umwandlungsgesetz 22.10.2025 (Eintragungsdatum)\n\nideale-jobs-GmbH\nGesellschaft mit beschränkter Haftung\nFrechen\n\nDen Gläubigern der an der Verschmelzung beteiligten Rechtsträger ist, wenn sie binnen sechs Monaten nach dem Tag, an dem die Eintragung der Verschmelzung in das Register des Sitzes desjenigen Rechtsträgers, dessen Gläubiger sie sind, nach § 19 Absatz 3 UmwG als bekanntgemacht gilt, ihren Anspruch nach Grund und Höhe schriftlich anmelden, Sicherheit zu leisten, soweit sie nicht Befriedigung verlangen können. Dieses Recht steht den Gläubigern jedoch nur zu, wenn sie glaubhaft machen, dass durch die Verschmelzung die Erfüllung ihrer Forderung gefährdet wird."
    },
    {
      "date": "2025-10-22",
      "id": "134948",
      "original_text": "Registerbekanntmachung nach dem Umwandlungsgesetz\nNordrhein-Westfalen Amtsgericht Köln HRB 90407\nHawk GmbH – Köln",
      "type": "Registerbekanntmachung nach dem Umwandlungsgesetz",
      "state": "Nordrhein-Westfalen",
      "amtsgericht": "Amtsgericht Köln",
      "registernummer": "HRB 90407",
      "registerart": "HRB",
      "company_name": "Hawk GmbH",
      "company_seat": "Köln",
      "details": "22.10.2025 (Bekanntmachungsdatum)\n\nNordrhein-Westfalen Amtsgericht Köln HRB 90407\nRegisterbekanntmachung nach dem Umwandlungsgesetz 22.10.2025 (Eintragungsdatum)\n\nHawk GmbH\nGesellschaft mit beschränkter Haftung\nKöln\n\nDen Gläubigern der an der Verschmelzung beteiligten Rechtsträger ist, wenn sie binnen sechs Monaten nach dem Tag, an dem die Eintragung der Verschmelzung in das Register des Sitzes desjenigen Rechtsträgers, dessen Gläubiger sie sind, nach § 19 Absatz 3 UmwG als bekanntgemacht gilt, ihren Anspruch nach Grund und Höhe schriftlich anmelden, Sicherheit zu leisten, soweit sie nicht Befriedigung verlangen können. Dieses Recht steht den Gläubigern jedoch nur zu, wenn sie glaubhaft machen, dass durch die Verschmelzung die Erfüllung ihrer Forderung gefährdet wird."
    },
    {
      "date": "2025-10-22",
      "id": "134949",
      "original_text": "Registerbekanntmachung nach dem Umwandlungsgesetz\nNordrhein-Westfalen Amtsgericht Bad Oeynhausen HRA 9737\nRFH Chemie GmbH & Co. KG – Bünde",
      "type": "Registerbekanntmachung nach dem Umwandlungsgesetz",
      "state": "Nordrhein-Westfalen",
      "amtsgericht": "Amtsgericht Bad Oeynhausen",
      "registernummer": "HRA 9737",
      "registerart": "HRA",
      "company_name": "RFH Chemie GmbH & Co. KG",
      "company_seat": "Bünde",
      "details": "22.10.2025 (Bekanntmachungsdatum)\n\nNordrhein-Westfalen Amtsgericht Bad Oeynhausen HRA 9737\nRegisterbekanntmachung nach dem Umwandlungsgesetz 22.10.2025 (Eintragungsdatum)\n\nRFH Chemie GmbH & Co. KG\nKommanditgesellschaft\nBünde\n\nDen Gläubigern der an der formwechselnden Umwandlung beteiligten Rechtsträger ist, wenn sie binnen sechs Monaten nach dem Tag, an dem die Eintragung der formwechselnden Umwandlung in das Register des Sitzes desjenigen Rechtsträgers, dessen Gläubiger sie sind, nach § 19 Absatz 3 UmwG als bekanntgemacht gilt, ihren Anspruch nach Grund und Höhe schriftlich anmelden, Sicherheit zu leisten, soweit sie nicht Befriedigung verlangen können. Dieses Recht steht den Gläubigern jedoch nur zu, wenn sie glaubhaft machen, dass durch die formwechselnden Umwandlung die Erfüllung ihrer Forderung gefährdet wird."
    },
    {
      "date": "2025-10-22",
      "id": "134950",
      "original_text": "Registerbekanntmachung nach dem Umwandlungsgesetz\nNordrhein-Westfalen Amtsgericht Bielefeld HRA 17541\nEnis Mendili e.K. – Bielefeld",
      "type": "Registerbekanntmachung nach dem Umwandlungsgesetz",
      "state": "Nordrhein-Westfalen",
      "amtsgericht": "Amtsgericht Bielefeld",
      "registernummer": "HRA 17541",
      "registerart": "HRA",
      "company_name": "Enis Mendili e.K.",
      "company_seat": "Bielefeld",
      "details": "22.10.2025 (Bekanntmachungsdatum)\n\nNordrhein-Westfalen Amtsgericht Bielefeld HRA 17541\nRegisterbekanntmachung nach dem Umwandlungsgesetz 22.10.2025 (Eintragungsdatum)\n\nEnis Mendili e.K.\nEinzelkaufmann / Einzelkauffrau\nBielefeld\n\nDen Gläubigern der an der Ausgliederung beteiligten Rechtsträger ist, wenn sie binnen sechs Monaten nach dem Tag, an dem die Eintragung der Ausgliederung in das Register des Sitzes desjenigen Rechtsträgers, dessen Gläubiger sie sind, nach § 19 Absatz 3 UmwG als bekanntgemacht gilt, ihren Anspruch nach Grund und Höhe schriftlich anmelden, Sicherheit zu leisten, soweit sie nicht Befriedigung verlangen können. Dieses Recht steht den Gläubigern jedoch nur zu, wenn sie glaubhaft machen, dass durch die Ausgliederung die Erfüllung ihrer Forderung gefährdet wird."
    },
    {
      "date": "2025-10-22",
      "id": "134951",
      "original_text": "Einreichung neuer Dokumente\nNordrhein-Westfalen Amtsgericht Bochum HRB 7796\ncampus and more gmbh – Bochum",
      "type": "Einreichung neuer Dokumente",
      "state": "Nordrhein-Westfalen",
      "amtsgericht": "Amtsgericht Bochum",
      "registernummer": "HRB 7796",
      "registerart": "HRB",
      "company_name": "campus and more gmbh",
      "company_seat": "Bochum",
      "details": "22.10.2025 (Bekanntmachungsdatum)\n\nNordrhein-Westfalen Amtsgericht Bochum HRB 7796\nEinreichung neuer Dokumente 17.10.2025 (Eintragungsdatum)\n\ncampus and more gmbh\nGesellschaft mit beschränkter Haftung\nBochum\n\nDem Registergericht ist eine Liste der Mitglieder des Aufsichtsrates eingereicht worden."
    },
    {
      "date": "2025-10-22",
      "id": "134952",
      "original_text": "Registerbekanntmachung nach dem Umwandlungsgesetz\nNordrhein-Westfalen Amtsgericht Essen HRB 37332\nDextraData GRC Technologies GmbH – Essen",
      "type": "Registerbekanntmachung nach dem Umwandlungsgesetz",
      "state": "Nordrhein-Westfalen",
      "amtsgericht": "Amtsgericht Essen",
      "registernummer": "HRB 37332",
      "registerart": "HRB",
      "company_name": "DextraData GRC Technologies GmbH",
      "company_seat": "Essen",
      "details": "22.10.2025 (Bekanntmachungsdatum)\n\nNordrhein-Westfalen Amtsgericht Essen HRB 37332\nRegisterbekanntmachung nach dem Umwandlungsgesetz 22.10.2025 (Eintragungsdatum)\n\nDextraData GRC Technologies GmbH\nGesellschaft mit beschränkter Haftung\nEssen\n\nDen Gläubigern der an der Ausgliederung beteiligten Rechtsträger ist, wenn sie binnen sechs Monaten nach dem Tag, an dem die Eintragung der Ausgliederung in das Register des Sitzes desjenigen Rechtsträgers, dessen Gläubiger sie sind, nach § 19 Absatz 3 UmwG als bekanntgemacht gilt, ihren Anspruch nach Grund und Höhe schriftlich anmelden, Sicherheit zu leisten, soweit sie nicht Befriedigung verlangen können. Dieses Recht steht den Gläubigern jedoch nur zu, wenn sie glaubhaft machen, dass durch die Ausgliederung die Erfüllung ihrer Forderung gefährdet wird."
    },
    {
      "date": "2025-10-22",
      "id": "134953",
      "original_text": "Registerbekanntmachung nach dem Umwandlungsgesetz\nThüringen Amtsgericht Jena HRB 523812\nNTC Fleet GmbH – Erfurt",
      "type": "Registerbekanntmachung nach dem Umwandlungsgesetz",
      "state": "Thüringen",
      "amtsgericht": "Amtsgericht Jena",
      "registernummer": "HRB 523812",
      "registerart": "HRB",
      "company_name": "NTC Fleet GmbH",
      "company_seat": "Erfurt",
      "details": "22.10.2025 (Bekanntmachungsdatum)\n\nThüringen Amtsgericht Jena HRB 523812\nRegisterbekanntmachung nach dem Umwandlungsgesetz 22.10.2025 (Eintragungsdatum)\n\nNTC Fleet GmbH\nGesellschaft mit beschränkter Haftung\nErfurt\n\nNicht eingetragen: Den Gläubigern des formwechselnden  Rechtsträgers, ist wenn sie binnen sechs Monaten nach dem Tag, an dem die Eintragung des Formwechsels nach § 201 UmwG als bekanntgemacht gilt, ihren Anspruch nach Grund und Höhe schriftlich anmelden, Sicherheit zu leisten, soweit sie nicht Befriedigung verlangen können. Dieses Recht steht ihnen jedoch nur zu, wenn sie glaubhaft machen, daß durch den Formwechsel die Erfüllung ihrer Forderung gefährdet wird."
    },
    {
      "date": "2025-10-22",
      "id": "134954",
      "original_text": "Einreichung neuer Dokumente\nThüringen Amtsgericht Jena HRA 506902\nZANGE SPEZIALSCHWEISSEN e.K. – Grammetal",
      "type": "Einreichung neuer Dokumente",
      "state": "Thüringen",
      "amtsgericht": "Amtsgericht Jena",
      "registernummer": "HRA 506902",
      "registerart": "HRA",
      "company_name": "ZANGE SPEZIALSCHWEISSEN e.K.",
      "company_seat": "Grammetal",
      "details": "22.10.2025 (Bekanntmachungsdatum)\n\nThüringen Amtsgericht Jena HRA 506902\nEinreichung neuer Dokumente 22.10.2025 (Eintragungsdatum)\n\nZANGE SPEZIALSCHWEISSEN e.K.\nEinzelkaufmann / Einzelkauffrau\nGrammetal\n\nNicht eingetragen: Den Gläubigern der an der Ausgliederung beteiligten Rechtsträger, ist wenn sie binnen sechs Monaten nach dem Tag, an dem die Eintragung der Ausgliederung in das Register des Sitzes desjenigen Rechtsträgers, dessen Gläubiger sie sind, nach §§125, 19 Abs. 3 UmwG als bekanntgemacht gilt, ihren Anspruch nach Grund und Höhe schriftlich anmelden, Sicherheit zu leisten, soweit sie nicht Befriedigung verlangen können. Dieses Recht steht ihnen jedoch nur zu, wenn sie glaubhaft machen, daß durch die Ausgliederung die Erfüllung ihrer Forderung gefährdet wird."
    },
    {
      "date": "2025-10-22",
      "id": "134955",
      "original_text": "Registerbekanntmachung nach dem Umwandlungsgesetz\nThüringen Amtsgericht Jena HRA 505701\nNTC Fleet GmbH & Co. KG – Erfurt",
      "type": "Registerbekanntmachung nach dem Umwandlungsgesetz",
      "state": "Thüringen",
      "amtsgericht": "Amtsgericht Jena",
      "registernummer": "HRA 505701",
      "registerart": "HRA",
      "company_name": "NTC Fleet GmbH & Co. KG",
      "company_seat": "Erfurt",
      "details": "22.10.2025 (Bekanntmachungsdatum)\n\nThüringen Amtsgericht Jena HRA 505701\nRegisterbekanntmachung nach dem Umwandlungsgesetz 22.10.2025 (Eintragungsdatum)\n\nNTC Fleet GmbH & Co. KG\nKommanditgesellschaft\nErfurt\n\nNicht eingetragen: Den Gläubigern des formwechselnden  Rechtsträgers, ist wenn sie binnen sechs Monaten nach dem Tag, an dem die Eintragung des Formwechsels nach § 201 UmwG als bekanntgemacht gilt, ihren Anspruch nach Grund und Höhe schriftlich anmelden, Sicherheit zu leisten, soweit sie nicht Befriedigung verlangen können. Dieses Recht steht ihnen jedoch nur zu, wenn sie glaubhaft machen, daß durch den Formwechsel die Erfüllung ihrer Forderung gefährdet wird."
    },
    {
      "date": "2025-10-22",
      "id": "134956",
      "original_text": "Registerbekanntmachung nach dem Umwandlungsgesetz\nThüringen Amtsgericht Jena HRB 112226\nFolietec Kunststoffwerk AG – Roßleben-Wiehe",
      "type": "Registerbekanntmachung nach dem Umwandlungsgesetz",
      "state": "Thüringen",
      "amtsgericht": "Amtsgericht Jena",
      "registernummer": "HRB 112226",
      "registerart": "HRB",
      "company_name": "Folietec Kunststoffwerk AG",
      "company_seat": "Roßleben-Wiehe",
      "details": "22.10.2025 (Bekanntmachungsdatum)\n\nThüringen Amtsgericht Jena HRB 112226\nRegisterbekanntmachung nach dem Umwandlungsgesetz 22.10.2025 (Eintragungsdatum)\n\nFolietec Kunststoffwerk AG\nAktiengesellschaft\nRoßleben-Wiehe\n\nNicht eingetragen: Den Gläubigern des formwechselnden  Rechtsträgers, ist wenn sie binnen sechs Monaten nach dem Tag, an dem die Eintragung des Formwechsels nach § 201 UmwG als bekanntgemacht gilt, ihren Anspruch nach Grund und Höhe schriftlich anmelden, Sicherheit zu leisten, soweit sie nicht Befriedigung verlangen können. Dieses Recht steht ihnen jedoch nur zu, wenn sie glaubhaft machen, daß durch den Formwechsel die Erfüllung ihrer Forderung gefährdet wird."
    },
    {
      "date": "2025-10-22",
      "id": "134957",
      "original_text": "Einreichung neuer Dokumente\nHessen Amtsgericht Wetzlar HRB 13\nBosch Thermotechnik GmbH – Wetzlar",
      "type": "Einreichung neuer Dokumente",
      "state": "Hessen",
      "amtsgericht": "Amtsgericht Wetzlar",
      "registernummer": "HRB 13",
      "registerart": "HRB",
      "company_name": "Bosch Thermotechnik GmbH",
      "company_seat": "Wetzlar",
      "details": "22.10.2025 (Bekanntmachungsdatum)\n\nHessen Amtsgericht Wetzlar HRB 13\nEinreichung neuer Dokumente\n\nBosch Thermotechnik GmbH\nGesellschaft mit beschränkter Haftung\nWetzlar\n\nDurch eine Änderung in den Personen der Aufsichtsratsmitglieder ist eine Liste der Mitglieder des Aufsichtsrates zum Handelsregister eingereicht worden."
    },
    {
      "date": "2025-10-22",
      "id": "134958",
      "original_text": "Sonstige Registerbekanntmachung\nHessen Amtsgericht Wiesbaden VR 6487\nVerein zur Förderung der Netzkultur im Rhein-Main Gebiet e.V. (kurz: Netzkultur Rhein-Main e.V.) – Wiesbaden",
      "type": "Sonstige Registerbekanntmachung",
      "state": "Hessen",
      "amtsgericht": "Amtsgericht Wiesbaden",
      "registernummer": "VR 6487",
      "registerart": "VR",
      "company_name": "Verein zur Förderung der Netzkultur im Rhein-Main Gebiet e.V. (kurz: Netzkultur Rhein-Main e.V.)",
      "company_seat": "Wiesbaden",
      "details": "22.10.2025 (Bekanntmachungsdatum)\n\nHessen Amtsgericht Wiesbaden VR 6487\nSonstige Registerbekanntmachung 22.10.2025 (Eintragungsdatum)\n\nVerein zur Förderung der Netzkultur im Rhein-Main Gebiet e.V. (kurz: Netzkultur Rhein-Main e.V.)\neingetragener Verein\nWiesbaden\n\nDer Verein ist aufgelöst."
    },
    {
      "date": "2025-10-22",
      "id": "134959",
      "original_text": "Registerbekanntmachung nach dem Umwandlungsgesetz\nHessen Amtsgericht Frankfurt am Main HRB 122316\nHydro StoreTec AG – Frankfurt am Main",
      "type": "Registerbekanntmachung nach dem Umwandlungsgesetz",
      "state": "Hessen",
      "amtsgericht": "Amtsgericht Frankfurt am Main",
      "registernummer": "HRB 122316",
      "registerart": "HRB",
      "company_name": "Hydro StoreTec AG",
      "company_seat": "Frankfurt am Main",
      "details": "22.10.2025 (Bekanntmachungsdatum)\n\nHessen Amtsgericht Frankfurt am Main HRB 122316\nRegisterbekanntmachung nach dem Umwandlungsgesetz 22.10.2025 (Eintragungsdatum)\n\nHydro StoreTec AG\nAktiengesellschaft\nFrankfurt am Main\n\nDen Gläubigern der an der Verschmelzung beteiligten Rechtsträger ist, wenn sie binnen sechs Monaten nach dem Tag, an dem die Eintragung der Verschmelzung in das Register des Sitzes desjenigen Rechtsträgers, dessen Gläubiger sie sind, nach § 19 Absatz 3 UmwG bekannt gemacht worden ist, ihren Anspruch nach Grund und Höhe schriftlich anmelden, Sicherheit zu leisten, soweit sie nicht Befriedigung verlangen können. Dieses Recht steht den Gläubigern jedoch nur zu, wenn sie glaubhaft machen, dass durch die Verschmelzung die Erfüllung ihrer Forderung gefährdet wird."
    },
    {
      "date": "2025-10-22",
      "id": "134960",
      "original_text": "Registerbekanntmachung nach dem Umwandlungsgesetz\nHessen Amtsgericht Frankfurt am Main HRB 128160\nAMP Advanced Material Processing Germany GmbH – Frankfurt am Main",
      "type": "Registerbekanntmachung nach dem Umwandlungsgesetz",
      "state": "Hessen",
      "amtsgericht": "Amtsgericht Frankfurt am Main",
      "registernummer": "HRB 128160",
      "registerart": "HRB",
      "company_name": "AMP Advanced Material Processing Germany GmbH",
      "company_seat": "Frankfurt am Main",
      "details": "22.10.2025 (Bekanntmachungsdatum)\n\nHessen Amtsgericht Frankfurt am Main HRB 128160\nRegisterbekanntmachung nach dem Umwandlungsgesetz 22.10.2025 (Eintragungsdatum)\n\nAMP Advanced Material Processing Germany GmbH\nGesellschaft mit beschränkter Haftung\nFrankfurt am Main\n\nDen Gläubigern der an der Verschmelzung beteiligten Rechtsträger ist, wenn sie binnen sechs Monaten nach dem Tag, an dem die Eintragung der Verschmelzung in das Register des Sitzes desjenigen Rechtsträgers, dessen Gläubiger sie sind, nach § 19 Absatz 3 UmwG bekannt gemacht worden ist, ihren Anspruch nach Grund und Höhe schriftlich anmelden, Sicherheit zu leisten, soweit sie nicht Befriedigung verlangen können. Dieses Recht steht den Gläubigern jedoch nur zu, wenn sie glaubhaft machen, dass durch die Verschmelzung die Erfüllung ihrer Forderung gefährdet wird."
    },
    {
      "date": "2025-10-22",
      "id": "134961",
      "original_text": "Sonstige Registerbekanntmachung\nHessen Amtsgericht Wiesbaden VR 4077\nHochheimer Schützenclub-Verein für Sportliches und Jagdliches Groß- und Kleinkaliberschießen – Hochheim am Main",
      "type": "Sonstige Registerbekanntmachung",
      "state": "Hessen",
      "amtsgericht": "Amtsgericht Wiesbaden",
      "registernummer": "VR 4077",
      "registerart": "VR",
      "company_name": "Hochheimer Schützenclub-Verein für Sportliches und Jagdliches Groß- und Kleinkaliberschießen",
      "company_seat": "Hochheim am Main",
      "details": "22.10.2025 (Bekanntmachungsdatum)\n\nHessen Amtsgericht Wiesbaden VR 4077\nSonstige Registerbekanntmachung 21.10.2025 (Eintragungsdatum)\n\nHochheimer Schützenclub-Verein für Sportliches und Jagdliches Groß- und Kleinkaliberschießen\neingetragener Verein\nHochheim am Main\n\nDurch rechtskräftigen Beschluss des Amtsgerichts Wiesbaden vom 26.08.2025 ist dem Verein gemäß § 73 BGB die Rechtsfähigkeit entzogen worden."
    },
    {
      "date": "2025-10-22",
      "id": "134962",
      "original_text": "Registerbekanntmachung nach dem Umwandlungsgesetz\nHessen Amtsgericht Gießen HRA 5518\nStefanie Rahn e.K. – Herbstein",
      "type": "Registerbekanntmachung nach dem Umwandlungsgesetz",
      "state": "Hessen",
      "amtsgericht": "Amtsgericht Gießen",
      "registernummer": "HRA 5518",
      "registerart": "HRA",
      "company_name": "Stefanie Rahn e.K.",
      "company_seat": "Herbstein",
      "details": "22.10.2025 (Bekanntmachungsdatum)\n\nHessen Amtsgericht Gießen HRA 5518\nRegisterbekanntmachung nach dem Umwandlungsgesetz 22.10.2025 (Eintragungsdatum)\n\nStefanie Rahn e.K.\nEinzelkaufmann / Einzelkauffrau\nHerbstein\n\nDen Gläubigern der an der Ausgliederung beteiligten Rechtsträger ist, wenn sie binnen sechs Monaten nach dem Tag, an dem die Eintragung der Ausgliederung in das Register des Sitzes desjenigen Rechtsträgers, dessen Gläubiger sie sind, nach §§ 125, 19 Absatz 3 UmwG bekannt gemacht worden ist, ihren Anspruch nach Grund und Höhe schriftlich anmelden, Sicherheit zu leisten, soweit sie nicht Befriedigung verlangen können. Dieses Recht steht den Gläubigern jedoch nur zu, wenn sie glaubhaft machen, dass durch die Ausgliederung die Erfüllung ihrer Forderung gefährdet wird."
    },
    {
      "date": "2025-10-22",
      "id": "134963",
      "original_text": "Registerbekanntmachung nach dem Umwandlungsgesetz\nHessen Amtsgericht Gießen HRA 5530\nd-kontor GmbH & Co. KG – Herbstein",
      "type": "Registerbekanntmachung nach dem Umwandlungsgesetz",
      "state": "Hessen",
      "amtsgericht": "Amtsgericht Gießen",
      "registernummer": "HRA 5530",
      "registerart": "HRA",
      "company_name": "d-kontor GmbH & Co. KG",
      "company_seat": "Herbstein",
      "details": "22.10.2025 (Bekanntmachungsdatum)\n\nHessen Amtsgericht Gießen HRA 5530\nRegisterbekanntmachung nach dem Umwandlungsgesetz 22.10.2025 (Eintragungsdatum)\n\nd-kontor GmbH & Co. KG\nKommanditgesellschaft\nHerbstein\n\nDen Gläubigern der an der Ausgliederung beteiligten Rechtsträger ist, wenn sie binnen sechs Monaten nach dem Tag, an dem die Eintragung der Ausgliederung in das Register des Sitzes desjenigen Rechtsträgers, dessen Gläubiger sie sind, nach §§ 125, 19 Absatz 3 UmwG bekannt gemacht worden ist, ihren Anspruch nach Grund und Höhe schriftlich anmelden, Sicherheit zu leisten, soweit sie nicht Befriedigung verlangen können. Dieses Recht steht den Gläubigern jedoch nur zu, wenn sie glaubhaft machen, dass durch die Ausgliederung die Erfüllung ihrer Forderung gefährdet wird."
    },
    {
      "date": "2025-10-22",
      "id": "134964",
      "original_text": "Registerbekanntmachung nach dem Umwandlungsgesetz\nHessen Amtsgericht Wiesbaden HRA 11842\nBernd Zehner e.K. – Idstein",
      "type": "Registerbekanntmachung nach dem Umwandlungsgesetz",
      "state": "Hessen",
      "amtsgericht": "Amtsgericht Wiesbaden",
      "registernummer": "HRA 11842",
      "registerart": "HRA",
      "company_name": "Bernd Zehner e.K.",
      "company_seat": "Idstein",
      "details": "22.10.2025 (Bekanntmachungsdatum)\n\nHessen Amtsgericht Wiesbaden HRA 11842\nRegisterbekanntmachung nach dem Umwandlungsgesetz 22.10.2025 (Eintragungsdatum)\n\nBernd Zehner e.K.\nEinzelkaufmann / Einzelkauffrau\nIdstein\n\nDen Gläubigern der an der Ausgliederung beteiligten Rechtsträger ist, wenn sie binnen sechs Monaten nach dem Tag, an dem die Eintragung der Ausgliederung in das Register des Sitzes derjenigen Rechtsträger deren Gläubiger sie sind, nach § 201 UmwG bekannt gemacht worden ist, ihren Anspruch nach Grund und Höhe schriftlich anmelden, Sicherheit zu leisten, soweit sie nicht Befriedigung verlangen können. Dieses Recht steht den Gläubigern jedoch nur zu, wenn sie glaubhaft machen, dass durch die Ausgliederung die Erfüllung ihrer Forderung gefährdet wird."
    },
    {
      "date": "2025-10-22",
      "id": "134965",
      "original_text": "Registerbekanntmachung nach dem Umwandlungsgesetz\nHessen Amtsgericht Frankfurt am Main HRB 128161\nAHS Automated Handling Solutions Germany GmbH – Frankfurt am Main",
      "type": "Registerbekanntmachung nach dem Umwandlungsgesetz",
      "state": "Hessen",
      "amtsgericht": "Amtsgericht Frankfurt am Main",
      "registernummer": "HRB 128161",
      "registerart": "HRB",
      "company_name": "AHS Automated Handling Solutions Germany GmbH",
      "company_seat": "Frankfurt am Main",
      "details": "22.10.2025 (Bekanntmachungsdatum)\n\nHessen Amtsgericht Frankfurt am Main HRB 128161\nRegisterbekanntmachung nach dem Umwandlungsgesetz 22.10.2025 (Eintragungsdatum)\n\nAHS Automated Handling Solutions Germany GmbH\nGesellschaft mit beschränkter Haftung\nFrankfurt am Main\n\nDen Gläubigern der an der Verschmelzung beteiligten Rechtsträger ist, wenn sie binnen sechs Monaten nach dem Tag, an dem die Eintragung der Verschmelzung in das Register des Sitzes desjenigen Rechtsträgers, dessen Gläubiger sie sind, nach § 19 Absatz 3 UmwG bekannt gemacht worden ist, ihren Anspruch nach Grund und Höhe schriftlich anmelden, Sicherheit zu leisten, soweit sie nicht Befriedigung verlangen können. Dieses Recht steht den Gläubigern jedoch nur zu, wenn sie glaubhaft machen, dass durch die Verschmelzung die Erfüllung ihrer Forderung gefährdet wird."
    },
    {
      "date": "2025-10-22",
      "id": "134966",
      "original_text": "Registerbekanntmachung nach dem Umwandlungsgesetz\nHessen Amtsgericht Frankfurt am Main HRB 99291\nWentz Beteiligungsverwaltungs - GmbH – Frankfurt am Main",
      "type": "Registerbekanntmachung nach dem Umwandlungsgesetz",
      "state": "Hessen",
      "amtsgericht": "Amtsgericht Frankfurt am Main",
      "registernummer": "HRB 99291",
      "registerart": "HRB",
      "company_name": "Wentz Beteiligungsverwaltungs - GmbH",
      "company_seat": "Frankfurt am Main",
      "details": "22.10.2025 (Bekanntmachungsdatum)\n\nHessen Amtsgericht Frankfurt am Main HRB 99291\nRegisterbekanntmachung nach dem Umwandlungsgesetz 22.10.2025 (Eintragungsdatum)\n\nWentz Beteiligungsverwaltungs - GmbH\nGesellschaft mit beschränkter Haftung\nFrankfurt am Main\n\nDen Gläubigern der an der Verschmelzung beteiligten Rechtsträger ist, wenn sie binnen sechs Monaten nach dem Tag, an dem die Eintragung der Verschmelzung in das Register des Sitzes desjenigen Rechtsträgers, dessen Gläubiger sie sind, nach § 19 Absatz 3 UmwG bekannt gemacht worden ist, ihren Anspruch nach Grund und Höhe schriftlich anmelden, Sicherheit zu leisten, soweit sie nicht Befriedigung verlangen können. Dieses Recht steht den Gläubigern jedoch nur zu, wenn sie glaubhaft machen, dass durch die Verschmelzung die Erfüllung ihrer Forderung gefährdet wird."
    }
  ]
}