{
  "date": "2025-10-15",
  "date_of_scrape": "2025-10-27T18:13:27.250Z",
  "tool_version": "0.2.0",
  "number_of_announcements": 205,
  "announcements": [
    {
      "date": "2025-10-15",
      "id": "133935",
      "original_text": "Registerbekanntmachung nach dem Umwandlungsgesetz\nBayern Amtsgericht Augsburg HRB 40738\nMetallwerkstatt Marquardt GmbH – Dillingen a.d. Donau",
      "type": "Registerbekanntmachung nach dem Umwandlungsgesetz",
      "state": "Bayern",
      "amtsgericht": "Amtsgericht Augsburg",
      "registernummer": "HRB 40738",
      "registerart": "HRB",
      "company_name": "Metallwerkstatt Marquardt GmbH",
      "company_seat": "Dillingen a.d. Donau",
      "details": "15.10.2025 (Bekanntmachungsdatum)\n\nBayern Amtsgericht Augsburg HRB 40738\nRegisterbekanntmachung nach dem Umwandlungsgesetz 14.10.2025 (Eintragungsdatum)\n\nMetallwerkstatt Marquardt GmbH\nGesellschaft mit beschränkter Haftung\nDillingen a.d. Donau\n\nDen Gläubigern der an der Ausgliederung beteiligten Rechtsträger ist, wenn sie binnen sechs Monaten nach dem Tag, an dem die Eintragung der Ausgliederung in das Register des Sitzes desjenigen Rechtsträgers, dessen Gläubiger sie sind, nach §§ 125, 19 Abs. 3 UmwG als bekannt gemacht gilt, ihren Anspruch nach Grund und Höhe in Textform anmelden, Sicherheit zu leisten, soweit sie nicht Befriedigung verlangen können. Dieses Recht steht den Gläubigern jedoch nur zu, wenn sie glaubhaft machen, dass durch die Ausgliederung die Erfüllung ihrer Forderung gefährdet wird."
    },
    {
      "date": "2025-10-15",
      "id": "133936",
      "original_text": "Registerbekanntmachung nach dem Umwandlungsgesetz\nBayern Amtsgericht München HRA 118937\nEnergiepark Maisach West GmbH & Co. KG – München",
      "type": "Registerbekanntmachung nach dem Umwandlungsgesetz",
      "state": "Bayern",
      "amtsgericht": "Amtsgericht München",
      "registernummer": "HRA 118937",
      "registerart": "HRA",
      "company_name": "Energiepark Maisach West GmbH & Co. KG",
      "company_seat": "München",
      "details": "15.10.2025 (Bekanntmachungsdatum)\n\nBayern Amtsgericht München HRA 118937\nRegisterbekanntmachung nach dem Umwandlungsgesetz 14.10.2025 (Eintragungsdatum)\n\nEnergiepark Maisach West GmbH & Co. KG\nKommanditgesellschaft\nMünchen\n\nDen Gläubigern der an der Verschmelzung beteiligten Rechtsträger ist, wenn sie binnen sechs Monaten nach dem Tag, an dem die Eintragung der Verschmelzung in das Register des Sitzes desjenigen Rechtsträgers, dessen Gläubiger sie sind, nach § 19 Abs. 3 UmwG als bekannt gemacht gilt, ihren Anspruch nach Grund und Höhe in Textform anmelden, Sicherheit zu leisten, soweit sie nicht Befriedigung verlangen können. Dieses Recht steht den Gläubigern jedoch nur zu, wenn sie glaubhaft machen, dass durch die Verschmelzung die Erfüllung ihrer Forderung gefährdet wird."
    },
    {
      "date": "2025-10-15",
      "id": "133937",
      "original_text": "Registerbekanntmachung nach dem Umwandlungsgesetz\nBayern Amtsgericht Nürnberg HRB 36858\nDurdun Gastronomie GmbH – Nürnberg",
      "type": "Registerbekanntmachung nach dem Umwandlungsgesetz",
      "state": "Bayern",
      "amtsgericht": "Amtsgericht Nürnberg",
      "registernummer": "HRB 36858",
      "registerart": "HRB",
      "company_name": "Durdun Gastronomie GmbH",
      "company_seat": "Nürnberg",
      "details": "15.10.2025 (Bekanntmachungsdatum)\n\nBayern Amtsgericht Nürnberg HRB 36858\nRegisterbekanntmachung nach dem Umwandlungsgesetz 14.10.2025 (Eintragungsdatum)\n\nDurdun Gastronomie GmbH\nGesellschaft mit beschränkter Haftung\nNürnberg\n\nDen Gläubigern der an der Verschmelzung beteiligten Rechtsträger ist, wenn sie binnen sechs Monaten nach dem Tag, an dem die Eintragung der Verschmelzung in das Register des Sitzes desjenigen Rechtsträgers, dessen Gläubiger sie sind, nach § 19 Abs. 3 UmwG als bekannt gemacht gilt, ihren Anspruch nach Grund und Höhe in Textform anmelden, Sicherheit zu leisten, soweit sie nicht Befriedigung verlangen können. Dieses Recht steht den Gläubigern jedoch nur zu, wenn sie glaubhaft machen, dass durch die Verschmelzung die Erfüllung ihrer Forderung gefährdet wird."
    },
    {
      "date": "2025-10-15",
      "id": "133938",
      "original_text": "Registerbekanntmachung nach dem Umwandlungsgesetz\nBayern Amtsgericht München HRB 282432\nConnex Holding GmbH – Grünwald",
      "type": "Registerbekanntmachung nach dem Umwandlungsgesetz",
      "state": "Bayern",
      "amtsgericht": "Amtsgericht München",
      "registernummer": "HRB 282432",
      "registerart": "HRB",
      "company_name": "Connex Holding GmbH",
      "company_seat": "Grünwald",
      "details": "15.10.2025 (Bekanntmachungsdatum)\n\nBayern Amtsgericht München HRB 282432\nRegisterbekanntmachung nach dem Umwandlungsgesetz 14.10.2025 (Eintragungsdatum)\n\nConnex Holding GmbH\nGesellschaft mit beschränkter Haftung\nGrünwald\n\nDen Gläubigern der an der Verschmelzung beteiligten Rechtsträger ist, wenn sie binnen sechs Monaten nach dem Tag, an dem die Eintragung der Verschmelzung in das Register des Sitzes desjenigen Rechtsträgers, dessen Gläubiger sie sind, nach § 19 Abs. 3 UmwG als bekannt gemacht gilt, ihren Anspruch nach Grund und Höhe in Textform anmelden, Sicherheit zu leisten, soweit sie nicht Befriedigung verlangen können. Dieses Recht steht den Gläubigern jedoch nur zu, wenn sie glaubhaft machen, dass durch die Verschmelzung die Erfüllung ihrer Forderung gefährdet wird."
    },
    {
      "date": "2025-10-15",
      "id": "133939",
      "original_text": "Einreichung neuer Dokumente\nBayern Amtsgericht Aschaffenburg HRB 12928\nEinhorn Verwaltungsgesellschaft mbH – Kleinostheim",
      "type": "Einreichung neuer Dokumente",
      "state": "Bayern",
      "amtsgericht": "Amtsgericht Aschaffenburg",
      "registernummer": "HRB 12928",
      "registerart": "HRB",
      "company_name": "Einhorn Verwaltungsgesellschaft mbH",
      "company_seat": "Kleinostheim",
      "details": "15.10.2025 (Bekanntmachungsdatum)\n\nBayern Amtsgericht Aschaffenburg HRB 12928\nEinreichung neuer Dokumente\n\nEinhorn Verwaltungsgesellschaft mbH\nGesellschaft mit beschränkter Haftung\nKleinostheim\n\nDem Amtsgericht Aschaffenburg -Registergericht- ist eine Liste der Mitglieder des Aufsichtsrats eingereicht worden, § 52 Abs. 3 S. 2 GmbHG."
    },
    {
      "date": "2025-10-15",
      "id": "133940",
      "original_text": "Registerbekanntmachung nach dem Umwandlungsgesetz\nBayern Amtsgericht München HRB 291210\nEmbvest GmbH – München",
      "type": "Registerbekanntmachung nach dem Umwandlungsgesetz",
      "state": "Bayern",
      "amtsgericht": "Amtsgericht München",
      "registernummer": "HRB 291210",
      "registerart": "HRB",
      "company_name": "Embvest GmbH",
      "company_seat": "München",
      "details": "15.10.2025 (Bekanntmachungsdatum)\n\nBayern Amtsgericht München HRB 291210\nRegisterbekanntmachung nach dem Umwandlungsgesetz 14.10.2025 (Eintragungsdatum)\n\nEmbvest GmbH\nGesellschaft mit beschränkter Haftung\nMünchen\n\nDen Gläubigern der an der Verschmelzung beteiligten Rechtsträger ist, wenn sie binnen sechs Monaten nach dem Tag, an dem die Eintragung der Verschmelzung in das Register des Sitzes desjenigen Rechtsträgers, dessen Gläubiger sie sind, nach § 19 Abs. 3 UmwG als bekannt gemacht gilt, ihren Anspruch nach Grund und Höhe in Textform anmelden, Sicherheit zu leisten, soweit sie nicht Befriedigung verlangen können. Dieses Recht steht den Gläubigern jedoch nur zu, wenn sie glaubhaft machen, dass durch die Verschmelzung die Erfüllung ihrer Forderung gefährdet wird."
    },
    {
      "date": "2025-10-15",
      "id": "133941",
      "original_text": "Löschungsankündigung\nBayern Amtsgericht München HRB 228567\nVentsan GmbH – München",
      "type": "Löschungsankündigung",
      "state": "Bayern",
      "amtsgericht": "Amtsgericht München",
      "registernummer": "HRB 228567",
      "registerart": "HRB",
      "company_name": "Ventsan GmbH",
      "company_seat": "München",
      "details": "15.10.2025 (Bekanntmachungsdatum)\n\nBayern Amtsgericht München HRB 228567\nLöschungsankündigung 14.10.2025 (Eintragungsdatum)\n\nVentsan GmbH\nGesellschaft mit beschränkter Haftung\nMünchen\n\nDas Registergericht beabsichtigt, die im Handelsregister eingetragene Gesellschaft wegen Vermögenslosigkeit von Amts wegen nach § 394 FamFG zu löschen. Die Frist zur Erhebung eines Widerspruchs ist auf drei Monate festgesetzt."
    },
    {
      "date": "2025-10-15",
      "id": "133942",
      "original_text": "Einreichung neuer Dokumente\nBayern Amtsgericht München HRB 302922\nBlitz 25-332 SE – München",
      "type": "Einreichung neuer Dokumente",
      "state": "Bayern",
      "amtsgericht": "Amtsgericht München",
      "registernummer": "HRB 302922",
      "registerart": "HRB",
      "company_name": "Blitz 25-332 SE",
      "company_seat": "München",
      "details": "15.10.2025 (Bekanntmachungsdatum)\n\nBayern Amtsgericht München HRB 302922\nEinreichung neuer Dokumente 14.10.2025 (Eintragungsdatum)\n\nBlitz 25-332 SE\nEuropäische Aktiengesellschaft (SE)\nMünchen\n\nDem Amtsgericht München -Registergericht- ist eine Liste der Mitglieder des Aufsichtsrats eingereicht worden, Art. 9 Abs. 1 Buchst. c (ii) SE-VO i.V.m. § 106 AktG."
    },
    {
      "date": "2025-10-15",
      "id": "133943",
      "original_text": "Einreichung neuer Dokumente\nBayern Amtsgericht Nürnberg HRB 41603\namity AG – Nürnberg",
      "type": "Einreichung neuer Dokumente",
      "state": "Bayern",
      "amtsgericht": "Amtsgericht Nürnberg",
      "registernummer": "HRB 41603",
      "registerart": "HRB",
      "company_name": "amity AG",
      "company_seat": "Nürnberg",
      "details": "15.10.2025 (Bekanntmachungsdatum)\n\nBayern Amtsgericht Nürnberg HRB 41603\nEinreichung neuer Dokumente 14.10.2025 (Eintragungsdatum)\n\namity AG\nAktiengesellschaft\nNürnberg\n\nDem Amtsgericht Nürnberg -Registergericht- ist eine Liste der Mitglieder des Aufsichtsrats eingereicht worden, § 106 AktG."
    },
    {
      "date": "2025-10-15",
      "id": "133944",
      "original_text": "Löschungsankündigung\nBayern Amtsgericht Bayreuth HRB 3426\nRetCOM Retail Solutions GmbH – Goldkronach",
      "type": "Löschungsankündigung",
      "state": "Bayern",
      "amtsgericht": "Amtsgericht Bayreuth",
      "registernummer": "HRB 3426",
      "registerart": "HRB",
      "company_name": "RetCOM Retail Solutions GmbH",
      "company_seat": "Goldkronach",
      "details": "15.10.2025 (Bekanntmachungsdatum)\n\nBayern Amtsgericht Bayreuth HRB 3426\nLöschungsankündigung\n\nRetCOM Retail Solutions GmbH\nGesellschaft mit beschränkter Haftung\nGoldkronach\n\nDas Registergericht beabsichtigt, die im Handelsregister eingetragene Gesellschaft wegen Vermögenslosigkeit von Amts wegen nach § 394 FamFG zu löschen. Die Frist zur Erhebung eines Widerspruchs ist auf einen Monat festgesetzt."
    },
    {
      "date": "2025-10-15",
      "id": "133945",
      "original_text": "Registerbekanntmachung nach dem Umwandlungsgesetz\nBayern Amtsgericht Traunstein HRB 19427\nMühldorfer Nutrition AG – Mühldorf a.Inn",
      "type": "Registerbekanntmachung nach dem Umwandlungsgesetz",
      "state": "Bayern",
      "amtsgericht": "Amtsgericht Traunstein",
      "registernummer": "HRB 19427",
      "registerart": "HRB",
      "company_name": "Mühldorfer Nutrition AG",
      "company_seat": "Mühldorf a.Inn",
      "details": "15.10.2025 (Bekanntmachungsdatum)\n\nBayern Amtsgericht Traunstein HRB 19427\nRegisterbekanntmachung nach dem Umwandlungsgesetz 14.10.2025 (Eintragungsdatum)\n\nMühldorfer Nutrition AG\nAktiengesellschaft\nMühldorf a.Inn\n\nDen Gläubigern des formwechselnden Rechtsträgers ist, wenn sie binnen sechs Monaten nach dem Tag, an dem die Eintragung des Formwechsels nach § 201 UmwG als bekannt gemacht gilt, ihren Anspruch nach Grund und Höhe in Textform anmelden, Sicherheit zu leisten, soweit sie nicht Befriedigung verlangen können. Dieses Recht steht den Gläubigern jedoch nur zu, wenn sie glaubhaft machen, dass durch den Formwechsel die Erfüllung ihrer Forderung gefährdet wird."
    },
    {
      "date": "2025-10-15",
      "id": "133946",
      "original_text": "Löschungsankündigung\nBayern Amtsgericht Bayreuth HRB 3639\nConTex Gesellschaft für Personalleasing mbH – Bayreuth",
      "type": "Löschungsankündigung",
      "state": "Bayern",
      "amtsgericht": "Amtsgericht Bayreuth",
      "registernummer": "HRB 3639",
      "registerart": "HRB",
      "company_name": "ConTex Gesellschaft für Personalleasing mbH",
      "company_seat": "Bayreuth",
      "details": "15.10.2025 (Bekanntmachungsdatum)\n\nBayern Amtsgericht Bayreuth HRB 3639\nLöschungsankündigung\n\nConTex Gesellschaft für Personalleasing mbH\nGesellschaft mit beschränkter Haftung\nBayreuth\n\nDas Registergericht beabsichtigt, die im Handelsregister eingetragene Gesellschaft wegen Vermögenslosigkeit von Amts wegen nach § 394 FamFG zu löschen. Die Frist zur Erhebung eines Widerspruchs ist auf sechs Wochen festgesetzt."
    },
    {
      "date": "2025-10-15",
      "id": "133947",
      "original_text": "Einreichung neuer Dokumente\nBayern Amtsgericht München HRB 275673\nKorian Deutschland GmbH – München",
      "type": "Einreichung neuer Dokumente",
      "state": "Bayern",
      "amtsgericht": "Amtsgericht München",
      "registernummer": "HRB 275673",
      "registerart": "HRB",
      "company_name": "Korian Deutschland GmbH",
      "company_seat": "München",
      "details": "15.10.2025 (Bekanntmachungsdatum)\n\nBayern Amtsgericht München HRB 275673\nEinreichung neuer Dokumente 14.10.2025 (Eintragungsdatum)\n\nKorian Deutschland GmbH\nGesellschaft mit beschränkter Haftung\nMünchen\n\nDem Amtsgericht München -Registergericht- ist eine Liste der Mitglieder des Aufsichtsrats eingereicht worden, § 52 Abs. 3 S. 2 GmbHG."
    },
    {
      "date": "2025-10-15",
      "id": "133948",
      "original_text": "Registerbekanntmachung nach dem Umwandlungsgesetz\nBayern Amtsgericht Aschaffenburg HRB 9875\nJakob-Vermögensverwaltung GmbH – Kleinwallstadt",
      "type": "Registerbekanntmachung nach dem Umwandlungsgesetz",
      "state": "Bayern",
      "amtsgericht": "Amtsgericht Aschaffenburg",
      "registernummer": "HRB 9875",
      "registerart": "HRB",
      "company_name": "Jakob-Vermögensverwaltung GmbH",
      "company_seat": "Kleinwallstadt",
      "details": "15.10.2025 (Bekanntmachungsdatum)\n\nBayern Amtsgericht Aschaffenburg HRB 9875\nRegisterbekanntmachung nach dem Umwandlungsgesetz 14.10.2025 (Eintragungsdatum)\n\nJakob-Vermögensverwaltung GmbH\nGesellschaft mit beschränkter Haftung\nKleinwallstadt\n\nDen Gläubigern der an der Spaltung beteiligten Rechtsträger ist, wenn sie binnen sechs Monaten nach dem Tag, an dem die Eintragung der Spaltung in das Register des Sitzes desjenigen Rechtsträgers, dessen Gläubiger sie sind, nach §§ 125, 19 Abs. 3 UmwG als bekannt gemacht gilt, ihren Anspruch nach Grund und Höhe in Textform anmelden, Sicherheit zu leisten, soweit sie nicht Befriedigung verlangen können. Dieses Recht steht den Gläubigern jedoch nur zu, wenn sie glaubhaft machen, dass durch die Spaltung die Erfüllung ihrer Forderung gefährdet wird."
    },
    {
      "date": "2025-10-15",
      "id": "133949",
      "original_text": "Registerbekanntmachung nach dem Umwandlungsgesetz\nBayern Amtsgericht Fürth HRB 7935\nOrgit GmbH – Fürth",
      "type": "Registerbekanntmachung nach dem Umwandlungsgesetz",
      "state": "Bayern",
      "amtsgericht": "Amtsgericht Fürth",
      "registernummer": "HRB 7935",
      "registerart": "HRB",
      "company_name": "Orgit GmbH",
      "company_seat": "Fürth",
      "details": "15.10.2025 (Bekanntmachungsdatum)\n\nBayern Amtsgericht Fürth HRB 7935\nRegisterbekanntmachung nach dem Umwandlungsgesetz 14.10.2025 (Eintragungsdatum)\n\nOrgit GmbH\nGesellschaft mit beschränkter Haftung\nFürth\n\nDen Gläubigern der an der Verschmelzung beteiligten Rechtsträger ist, wenn sie binnen sechs Monaten nach dem Tag, an dem die Eintragung der Verschmelzung in das Register des Sitzes desjenigen Rechtsträgers, dessen Gläubiger sie sind, nach § 19 Abs. 3 UmwG als bekannt gemacht gilt, ihren Anspruch nach Grund und Höhe in Textform anmelden, Sicherheit zu leisten, soweit sie nicht Befriedigung verlangen können. Dieses Recht steht den Gläubigern jedoch nur zu, wenn sie glaubhaft machen, dass durch die Verschmelzung die Erfüllung ihrer Forderung gefährdet wird."
    },
    {
      "date": "2025-10-15",
      "id": "133950",
      "original_text": "Einreichung neuer Dokumente\nBayern Amtsgericht München HRB 121774\nmediantis Aktiengesellschaft – Tutzing",
      "type": "Einreichung neuer Dokumente",
      "state": "Bayern",
      "amtsgericht": "Amtsgericht München",
      "registernummer": "HRB 121774",
      "registerart": "HRB",
      "company_name": "mediantis Aktiengesellschaft",
      "company_seat": "Tutzing",
      "details": "15.10.2025 (Bekanntmachungsdatum)\n\nBayern Amtsgericht München HRB 121774\nEinreichung neuer Dokumente 14.10.2025 (Eintragungsdatum)\n\nmediantis Aktiengesellschaft\nAktiengesellschaft\nTutzing\n\nDem Amtsgericht München -Registergericht- ist eine Liste der Mitglieder des Aufsichtsrats eingereicht worden, § 106 AktG."
    },
    {
      "date": "2025-10-15",
      "id": "133951",
      "original_text": "Einreichung neuer Dokumente\nBayern Amtsgericht München HRB 228434\nPlastic Omnium Automotive Exteriors GmbH – München",
      "type": "Einreichung neuer Dokumente",
      "state": "Bayern",
      "amtsgericht": "Amtsgericht München",
      "registernummer": "HRB 228434",
      "registerart": "HRB",
      "company_name": "Plastic Omnium Automotive Exteriors GmbH",
      "company_seat": "München",
      "details": "15.10.2025 (Bekanntmachungsdatum)\n\nBayern Amtsgericht München HRB 228434\nEinreichung neuer Dokumente\n\nPlastic Omnium Automotive Exteriors GmbH\nGesellschaft mit beschränkter Haftung\nMünchen\n\nDem Amtsgericht München -Registergericht- ist eine Liste der Mitglieder des Aufsichtsrats eingereicht worden, § 52 Abs. 3 S. 2 GmbHG."
    },
    {
      "date": "2025-10-15",
      "id": "133952",
      "original_text": "Registerbekanntmachung nach dem Umwandlungsgesetz\nBayern Amtsgericht München HRB 155321\nF+F Distribution GmbH – München",
      "type": "Registerbekanntmachung nach dem Umwandlungsgesetz",
      "state": "Bayern",
      "amtsgericht": "Amtsgericht München",
      "registernummer": "HRB 155321",
      "registerart": "HRB",
      "company_name": "F+F Distribution GmbH",
      "company_seat": "München",
      "details": "15.10.2025 (Bekanntmachungsdatum)\n\nBayern Amtsgericht München HRB 155321\nRegisterbekanntmachung nach dem Umwandlungsgesetz 14.10.2025 (Eintragungsdatum)\n\nF+F Distribution GmbH\nGesellschaft mit beschränkter Haftung\nMünchen\n\nDen Gläubigern der an der Verschmelzung beteiligten Rechtsträger ist, wenn sie binnen sechs Monaten nach dem Tag, an dem die Eintragung der Verschmelzung in das Register des Sitzes desjenigen Rechtsträgers, dessen Gläubiger sie sind, nach § 19 Abs. 3 UmwG als bekannt gemacht gilt, ihren Anspruch nach Grund und Höhe in Textform anmelden, Sicherheit zu leisten, soweit sie nicht Befriedigung verlangen können. Dieses Recht steht den Gläubigern jedoch nur zu, wenn sie glaubhaft machen, dass durch die Verschmelzung die Erfüllung ihrer Forderung gefährdet wird."
    },
    {
      "date": "2025-10-15",
      "id": "133953",
      "original_text": "Registerbekanntmachung nach dem Umwandlungsgesetz\nBayern Amtsgericht Landshut HRB 5363\nLindner Beteiligungs GmbH – Arnstorf",
      "type": "Registerbekanntmachung nach dem Umwandlungsgesetz",
      "state": "Bayern",
      "amtsgericht": "Amtsgericht Landshut",
      "registernummer": "HRB 5363",
      "registerart": "HRB",
      "company_name": "Lindner Beteiligungs GmbH",
      "company_seat": "Arnstorf",
      "details": "15.10.2025 (Bekanntmachungsdatum)\n\nBayern Amtsgericht Landshut HRB 5363\nRegisterbekanntmachung nach dem Umwandlungsgesetz 13.10.2025 (Eintragungsdatum)\n\nLindner Beteiligungs GmbH\nGesellschaft mit beschränkter Haftung\nArnstorf\n\nDen Gläubigern der an der Verschmelzung beteiligten Rechtsträger ist, wenn sie binnen sechs Monaten nach dem Tag, an dem die Eintragung der Verschmelzung in das Register des Sitzes desjenigen Rechtsträgers, dessen Gläubiger sie sind, nach § 19 Abs. 3 UmwG als bekannt gemacht gilt, ihren Anspruch nach Grund und Höhe in Textform anmelden, Sicherheit zu leisten, soweit sie nicht Befriedigung verlangen können. Dieses Recht steht den Gläubigern jedoch nur zu, wenn sie glaubhaft machen, dass durch die Verschmelzung die Erfüllung ihrer Forderung gefährdet wird."
    },
    {
      "date": "2025-10-15",
      "id": "133954",
      "original_text": "Registerbekanntmachung nach dem Umwandlungsgesetz\nBayern Amtsgericht Landshut HRB 8403\nHans Lindner Familien AG – Arnstorf",
      "type": "Registerbekanntmachung nach dem Umwandlungsgesetz",
      "state": "Bayern",
      "amtsgericht": "Amtsgericht Landshut",
      "registernummer": "HRB 8403",
      "registerart": "HRB",
      "company_name": "Hans Lindner Familien AG",
      "company_seat": "Arnstorf",
      "details": "15.10.2025 (Bekanntmachungsdatum)\n\nBayern Amtsgericht Landshut HRB 8403\nRegisterbekanntmachung nach dem Umwandlungsgesetz 13.10.2025 (Eintragungsdatum)\n\nHans Lindner Familien AG\nAktiengesellschaft\nArnstorf\n\nDen Gläubigern der an der Verschmelzung beteiligten Rechtsträger ist, wenn sie binnen sechs Monaten nach dem Tag, an dem die Eintragung der Verschmelzung in das Register des Sitzes desjenigen Rechtsträgers, dessen Gläubiger sie sind, nach § 19 Abs. 3 UmwG als bekannt gemacht gilt, ihren Anspruch nach Grund und Höhe in Textform anmelden, Sicherheit zu leisten, soweit sie nicht Befriedigung verlangen können. Dieses Recht steht den Gläubigern jedoch nur zu, wenn sie glaubhaft machen, dass durch die Verschmelzung die Erfüllung ihrer Forderung gefährdet wird."
    },
    {
      "date": "2025-10-15",
      "id": "133955",
      "original_text": "Registerbekanntmachung nach dem Umwandlungsgesetz\nBayern Amtsgericht Nürnberg HRA 20464\nDurdun Gastronomie e.K. – Nürnberg",
      "type": "Registerbekanntmachung nach dem Umwandlungsgesetz",
      "state": "Bayern",
      "amtsgericht": "Amtsgericht Nürnberg",
      "registernummer": "HRA 20464",
      "registerart": "HRA",
      "company_name": "Durdun Gastronomie e.K.",
      "company_seat": "Nürnberg",
      "details": "15.10.2025 (Bekanntmachungsdatum)\n\nBayern Amtsgericht Nürnberg HRA 20464\nRegisterbekanntmachung nach dem Umwandlungsgesetz 14.10.2025 (Eintragungsdatum)\n\nDurdun Gastronomie e.K.\nEinzelkaufmann / Einzelkauffrau\nNürnberg\n\nDen Gläubigern der an der Verschmelzung beteiligten Rechtsträger ist, wenn sie binnen sechs Monaten nach dem Tag, an dem die Eintragung der Verschmelzung in das Register des Sitzes desjenigen Rechtsträgers, dessen Gläubiger sie sind, nach § 19 Abs. 3 UmwG als bekannt gemacht gilt, ihren Anspruch nach Grund und Höhe in Textform anmelden, Sicherheit zu leisten, soweit sie nicht Befriedigung verlangen können. Dieses Recht steht den Gläubigern jedoch nur zu, wenn sie glaubhaft machen, dass durch die Verschmelzung die Erfüllung ihrer Forderung gefährdet wird."
    },
    {
      "date": "2025-10-15",
      "id": "133956",
      "original_text": "Sonstige Registerbekanntmachung\nBayern Amtsgericht München HRB 220771\nGenerali Deutschland AG – München",
      "type": "Sonstige Registerbekanntmachung",
      "state": "Bayern",
      "amtsgericht": "Amtsgericht München",
      "registernummer": "HRB 220771",
      "registerart": "HRB",
      "company_name": "Generali Deutschland AG",
      "company_seat": "München",
      "details": "15.10.2025 (Bekanntmachungsdatum)\n\nBayern Amtsgericht München HRB 220771\nSonstige Registerbekanntmachung 14.10.2025 (Eintragungsdatum)\n\nGenerali Deutschland AG\nAktiengesellschaft\nMünchen\n\nDem Amtsgericht München -Registergericht- ist eine Liste der Mitglieder des Aufsichtsrats eingereicht worden, § 106 AktG."
    },
    {
      "date": "2025-10-15",
      "id": "133957",
      "original_text": "Registerbekanntmachung nach dem Umwandlungsgesetz\nBayern Amtsgericht München HRB 293785\nREPRO IMAGE TEAM GmbH – Kirchheim b.München",
      "type": "Registerbekanntmachung nach dem Umwandlungsgesetz",
      "state": "Bayern",
      "amtsgericht": "Amtsgericht München",
      "registernummer": "HRB 293785",
      "registerart": "HRB",
      "company_name": "REPRO IMAGE TEAM GmbH",
      "company_seat": "Kirchheim b.München",
      "details": "15.10.2025 (Bekanntmachungsdatum)\n\nBayern Amtsgericht München HRB 293785\nRegisterbekanntmachung nach dem Umwandlungsgesetz 14.10.2025 (Eintragungsdatum)\n\nREPRO IMAGE TEAM GmbH\nGesellschaft mit beschränkter Haftung\nKirchheim b.München\n\nDen Gläubigern der an der Verschmelzung beteiligten Rechtsträger ist, wenn sie binnen sechs Monaten nach dem Tag, an dem die Eintragung der Verschmelzung in das Register des Sitzes desjenigen Rechtsträgers, dessen Gläubiger sie sind, nach § 19 Abs. 3 UmwG als bekannt gemacht gilt, ihren Anspruch nach Grund und Höhe in Textform anmelden, Sicherheit zu leisten, soweit sie nicht Befriedigung verlangen können. Dieses Recht steht den Gläubigern jedoch nur zu, wenn sie glaubhaft machen, dass durch die Verschmelzung die Erfüllung ihrer Forderung gefährdet wird."
    },
    {
      "date": "2025-10-15",
      "id": "133958",
      "original_text": "Einreichung neuer Dokumente\nBayern Amtsgericht München HRB 256407\nLinde GmbH – Pullach i.Isartal",
      "type": "Einreichung neuer Dokumente",
      "state": "Bayern",
      "amtsgericht": "Amtsgericht München",
      "registernummer": "HRB 256407",
      "registerart": "HRB",
      "company_name": "Linde GmbH",
      "company_seat": "Pullach i.Isartal",
      "details": "15.10.2025 (Bekanntmachungsdatum)\n\nBayern Amtsgericht München HRB 256407\nEinreichung neuer Dokumente\n\nLinde GmbH\nGesellschaft mit beschränkter Haftung\nPullach i.Isartal\n\nDem Amtsgericht München -Registergericht- ist eine Liste der Mitglieder des Aufsichtsrats eingereicht worden, § 52 Abs. 3 S. 2 GmbHG."
    },
    {
      "date": "2025-10-15",
      "id": "133959",
      "original_text": "Registerbekanntmachung nach dem Umwandlungsgesetz\nBayern Amtsgericht Deggendorf HRA 3737\nLex Anlagentechnik e.K. – Prackenbach",
      "type": "Registerbekanntmachung nach dem Umwandlungsgesetz",
      "state": "Bayern",
      "amtsgericht": "Amtsgericht Deggendorf",
      "registernummer": "HRA 3737",
      "registerart": "HRA",
      "company_name": "Lex Anlagentechnik e.K.",
      "company_seat": "Prackenbach",
      "details": "15.10.2025 (Bekanntmachungsdatum)\n\nBayern Amtsgericht Deggendorf HRA 3737\nRegisterbekanntmachung nach dem Umwandlungsgesetz 14.10.2025 (Eintragungsdatum)\n\nLex Anlagentechnik e.K.\nEinzelkaufmann / Einzelkauffrau\nPrackenbach\n\nDen Gläubigern der an der Ausgliederung beteiligten Rechtsträger ist, wenn sie binnen sechs Monaten nach dem Tag, an dem die Eintragung der Ausgliederung in das Register des Sitzes desjenigen Rechtsträgers, dessen Gläubiger sie sind, nach §§ 125, 19 Abs. 3 UmwG als bekannt gemacht gilt, ihren Anspruch nach Grund und Höhe in Textform anmelden, Sicherheit zu leisten, soweit sie nicht Befriedigung verlangen können. Dieses Recht steht den Gläubigern jedoch nur zu, wenn sie glaubhaft machen, dass durch die Ausgliederung die Erfüllung ihrer Forderung gefährdet wird."
    },
    {
      "date": "2025-10-15",
      "id": "133960",
      "original_text": "Registerbekanntmachung nach dem Umwandlungsgesetz\nBayern Amtsgericht Traunstein HRB 34525\nMühldorfer Nutrition GmbH – Mühldorf a.Inn",
      "type": "Registerbekanntmachung nach dem Umwandlungsgesetz",
      "state": "Bayern",
      "amtsgericht": "Amtsgericht Traunstein",
      "registernummer": "HRB 34525",
      "registerart": "HRB",
      "company_name": "Mühldorfer Nutrition GmbH",
      "company_seat": "Mühldorf a.Inn",
      "details": "15.10.2025 (Bekanntmachungsdatum)\n\nBayern Amtsgericht Traunstein HRB 34525\nRegisterbekanntmachung nach dem Umwandlungsgesetz 14.10.2025 (Eintragungsdatum)\n\nMühldorfer Nutrition GmbH\nGesellschaft mit beschränkter Haftung\nMühldorf a.Inn\n\nDen Gläubigern des formwechselnden Rechtsträgers ist, wenn sie binnen sechs Monaten nach dem Tag, an dem die Eintragung des Formwechsels nach § 201 UmwG als bekannt gemacht gilt, ihren Anspruch nach Grund und Höhe in Textform anmelden, Sicherheit zu leisten, soweit sie nicht Befriedigung verlangen können. Dieses Recht steht den Gläubigern jedoch nur zu, wenn sie glaubhaft machen, dass durch den Formwechsel die Erfüllung ihrer Forderung gefährdet wird."
    },
    {
      "date": "2025-10-15",
      "id": "133961",
      "original_text": "Registerbekanntmachung nach dem Umwandlungsgesetz\nBayern Amtsgericht Deggendorf HRA 3738\nLex Anlagentechnik GmbH & Co. KG – Prackenbach",
      "type": "Registerbekanntmachung nach dem Umwandlungsgesetz",
      "state": "Bayern",
      "amtsgericht": "Amtsgericht Deggendorf",
      "registernummer": "HRA 3738",
      "registerart": "HRA",
      "company_name": "Lex Anlagentechnik GmbH & Co. KG",
      "company_seat": "Prackenbach",
      "details": "15.10.2025 (Bekanntmachungsdatum)\n\nBayern Amtsgericht Deggendorf HRA 3738\nRegisterbekanntmachung nach dem Umwandlungsgesetz 14.10.2025 (Eintragungsdatum)\n\nLex Anlagentechnik GmbH & Co. KG\nKommanditgesellschaft\nPrackenbach\n\nDen Gläubigern der an der Ausgliederung beteiligten Rechtsträger ist, wenn sie binnen sechs Monaten nach dem Tag, an dem die Eintragung der Ausgliederung in das Register des Sitzes desjenigen Rechtsträgers, dessen Gläubiger sie sind, nach §§ 125, 19 Abs. 3 UmwG als bekannt gemacht gilt, ihren Anspruch nach Grund und Höhe in Textform anmelden, Sicherheit zu leisten, soweit sie nicht Befriedigung verlangen können. Dieses Recht steht den Gläubigern jedoch nur zu, wenn sie glaubhaft machen, dass durch die Ausgliederung die Erfüllung ihrer Forderung gefährdet wird."
    },
    {
      "date": "2025-10-15",
      "id": "133962",
      "original_text": "Einreichung neuer Dokumente\nBayern Amtsgericht München HRB 100519\nKohlgruber Wohnbau GmbH – Bad Kohlgrub",
      "type": "Einreichung neuer Dokumente",
      "state": "Bayern",
      "amtsgericht": "Amtsgericht München",
      "registernummer": "HRB 100519",
      "registerart": "HRB",
      "company_name": "Kohlgruber Wohnbau GmbH",
      "company_seat": "Bad Kohlgrub",
      "details": "15.10.2025 (Bekanntmachungsdatum)\n\nBayern Amtsgericht München HRB 100519\nEinreichung neuer Dokumente\n\nKohlgruber Wohnbau GmbH\nGesellschaft mit beschränkter Haftung\nBad Kohlgrub\n\nDem Amtsgericht München -Registergericht- ist eine Liste der Mitglieder des Aufsichtsrats eingereicht worden, § 52 Abs. 3 S. 2 GmbHG.Dem Amtsgericht München -Registergericht- ist eine Liste der Mitglieder des Aufsichtsrats eingereicht worden, § 52 Abs. 3 S. 2 GmbHG."
    },
    {
      "date": "2025-10-15",
      "id": "133963",
      "original_text": "Sonstige Registerbekanntmachung\nBayern Amtsgericht Bayreuth HRB 2415\nITM Immobilien GmbH – Bayreuth",
      "type": "Sonstige Registerbekanntmachung",
      "state": "Bayern",
      "amtsgericht": "Amtsgericht Bayreuth",
      "registernummer": "HRB 2415",
      "registerart": "HRB",
      "company_name": "ITM Immobilien GmbH",
      "company_seat": "Bayreuth",
      "details": "15.10.2025 (Bekanntmachungsdatum)\n\nBayern Amtsgericht Bayreuth HRB 2415\nSonstige Registerbekanntmachung 14.10.2025 (Eintragungsdatum)\n\nITM Immobilien GmbH\nGesellschaft mit beschränkter Haftung\nBayreuth\n\nDen Gläubigern der an der Spaltung beteiligten Rechtsträger ist, wenn sie binnen sechs Monaten nach dem Tag, an dem die Eintragung der Spaltung in das Register des Sitzes desjenigen Rechtsträgers, dessen Gläubiger sie sind, nach §§ 125, 19 Abs. 3 UmwG als bekannt gemacht gilt, ihren Anspruch nach Grund und Höhe in Textform anmelden, Sicherheit zu leisten, soweit sie nicht Befriedigung verlangen können. Dieses Recht steht den Gläubigern jedoch nur zu, wenn sie glaubhaft machen, dass durch die Spaltung die Erfüllung ihrer Forderung gefährdet wird."
    },
    {
      "date": "2025-10-15",
      "id": "133964",
      "original_text": "Registerbekanntmachung nach dem Umwandlungsgesetz\nBayern Amtsgericht Augsburg HRA 21826\nMetallwerkstatt Michael Marquardt e. K. – Dillingen a.d.Donau",
      "type": "Registerbekanntmachung nach dem Umwandlungsgesetz",
      "state": "Bayern",
      "amtsgericht": "Amtsgericht Augsburg",
      "registernummer": "HRA 21826",
      "registerart": "HRA",
      "company_name": "Metallwerkstatt Michael Marquardt e. K.",
      "company_seat": "Dillingen a.d.Donau",
      "details": "15.10.2025 (Bekanntmachungsdatum)\n\nBayern Amtsgericht Augsburg HRA 21826\nRegisterbekanntmachung nach dem Umwandlungsgesetz 14.10.2025 (Eintragungsdatum)\n\nMetallwerkstatt Michael Marquardt e. K.\nEinzelkaufmann / Einzelkauffrau\nDillingen a.d.Donau\n\nDen Gläubigern der an der Ausgliederung beteiligten Rechtsträger ist, wenn sie binnen sechs Monaten nach dem Tag, an dem die Eintragung der Ausgliederung in das Register des Sitzes desjenigen Rechtsträgers, dessen Gläubiger sie sind, nach §§ 125, 19 Abs. 3 UmwG als bekannt gemacht gilt, ihren Anspruch nach Grund und Höhe in Textform anmelden, Sicherheit zu leisten, soweit sie nicht Befriedigung verlangen können. Dieses Recht steht den Gläubigern jedoch nur zu, wenn sie glaubhaft machen, dass durch die Ausgliederung die Erfüllung ihrer Forderung gefährdet wird."
    },
    {
      "date": "2025-10-15",
      "id": "133965",
      "original_text": "Sonstige Registerbekanntmachung\nBayern Amtsgericht Bayreuth HRB 8555\nITM Immobilien Bayreuth GmbH – Bayreuth",
      "type": "Sonstige Registerbekanntmachung",
      "state": "Bayern",
      "amtsgericht": "Amtsgericht Bayreuth",
      "registernummer": "HRB 8555",
      "registerart": "HRB",
      "company_name": "ITM Immobilien Bayreuth GmbH",
      "company_seat": "Bayreuth",
      "details": "15.10.2025 (Bekanntmachungsdatum)\n\nBayern Amtsgericht Bayreuth HRB 8555\nSonstige Registerbekanntmachung 14.10.2025 (Eintragungsdatum)\n\nITM Immobilien Bayreuth GmbH\nGesellschaft mit beschränkter Haftung\nBayreuth\n\nDen Gläubigern der an der Spaltung beteiligten Rechtsträger ist, wenn sie binnen sechs Monaten nach dem Tag, an dem die Eintragung der Spaltung in das Register des Sitzes desjenigen Rechtsträgers, dessen Gläubiger sie sind, nach §§ 125, 19 Abs. 3 UmwG als bekannt gemacht gilt, ihren Anspruch nach Grund und Höhe in Textform anmelden, Sicherheit zu leisten, soweit sie nicht Befriedigung verlangen können. Dieses Recht steht den Gläubigern jedoch nur zu, wenn sie glaubhaft machen, dass durch die Spaltung die Erfüllung ihrer Forderung gefährdet wird."
    },
    {
      "date": "2025-10-15",
      "id": "133966",
      "original_text": "Löschungsankündigung\nBerlin Amtsgericht Berlin (Charlottenburg) HRB 185372\nMitkov UG (haftungsbeschränkt) – Berlin",
      "type": "Löschungsankündigung",
      "state": "Berlin",
      "amtsgericht": "Amtsgericht Berlin (Charlottenburg)",
      "registernummer": "HRB 185372",
      "registerart": "HRB",
      "company_name": "Mitkov UG (haftungsbeschränkt)",
      "company_seat": "Berlin",
      "details": "15.10.2025 (Bekanntmachungsdatum)\n\nBerlin Amtsgericht Berlin (Charlottenburg) HRB 185372\nLöschungsankündigung\n\nMitkov UG (haftungsbeschränkt)\nGesellschaft mit beschränkter Haftung\nBerlin\n\nBei der nachstehenden Gesellschaft wird das Amtslöschungsverfahren gemäß § 394 FamFG eingeleitet. Widerspruchsfrist 6 Wochen"
    },
    {
      "date": "2025-10-15",
      "id": "133967",
      "original_text": "Löschungsankündigung\nBaden-Württemberg Amtsgericht Freiburg HRB 731502\nKörperformen Singen GmbH – Singen Hohentwiel",
      "type": "Löschungsankündigung",
      "state": "Baden-Württemberg",
      "amtsgericht": "Amtsgericht Freiburg",
      "registernummer": "HRB 731502",
      "registerart": "HRB",
      "company_name": "Körperformen Singen GmbH",
      "company_seat": "Singen Hohentwiel",
      "details": "15.10.2025 (Bekanntmachungsdatum)\n\nBaden-Württemberg Amtsgericht Freiburg HRB 731502\nLöschungsankündigung\n\nKörperformen Singen GmbH\nGesellschaft mit beschränkter Haftung\nSingen Hohentwiel\n\nDas Gericht beabsichtigt, die Gesellschaft wegen Vermögenslosigkeit im Handelsregister von Amts wegen nach § 394 FamFG zu löschen. Die Frist zur Geltendmachung eines Widerspruchs gegen die beabsichtigte Löschung ist auf einen Monat ab Veröffentlichung bestimmt."
    },
    {
      "date": "2025-10-15",
      "id": "133968",
      "original_text": "Registerbekanntmachung nach dem Umwandlungsgesetz\nSaarland Amtsgericht Saarbrücken HRB 92145\nMONTUM Elektrotechnik GmbH – Schiffweiler",
      "type": "Registerbekanntmachung nach dem Umwandlungsgesetz",
      "state": "Saarland",
      "amtsgericht": "Amtsgericht Saarbrücken",
      "registernummer": "HRB 92145",
      "registerart": "HRB",
      "company_name": "MONTUM Elektrotechnik GmbH",
      "company_seat": "Schiffweiler",
      "details": "15.10.2025 (Bekanntmachungsdatum)\n\nSaarland Amtsgericht Saarbrücken HRB 92145\nRegisterbekanntmachung nach dem Umwandlungsgesetz 15.10.2025 (Eintragungsdatum)\n\nMONTUM Elektrotechnik GmbH\nGesellschaft mit beschränkter Haftung\nSchiffweiler\n\nAls nicht eingetragen wird bekannt gemacht: Den Gläubigern der an der Verschmelzung beteiligten Gesellschaften ist, wenn sie binnen sechs Monaten nach dem Tag, an dem die Eintragung der Verschmelzung in das Register des Sitzes desjenigen Rechtsträgers, dessen Gläubiger sie sind, nach § 19 Absatz 3 UmwG bekannt gemacht worden ist, ihren Anspruch nach Grund und Höhe schriftlich anmelden, Sicherheit zu leisten, soweit sie nicht Befriedigung verlangen können. Dieses Recht steht den Gläubigern jedoch nur zu, wenn sie glaubhaft machen, dass durch die Verschmelzung die Erfüllung ihrer Forderung gefährdet wird."
    },
    {
      "date": "2025-10-15",
      "id": "133969",
      "original_text": "Registerbekanntmachung nach dem Umwandlungsgesetz\nSaarland Amtsgericht Saarbrücken HRB 92218\nEAV Elektro-Anlagen und -Verteilungsbau GmbH – Schiffweiler",
      "type": "Registerbekanntmachung nach dem Umwandlungsgesetz",
      "state": "Saarland",
      "amtsgericht": "Amtsgericht Saarbrücken",
      "registernummer": "HRB 92218",
      "registerart": "HRB",
      "company_name": "EAV Elektro-Anlagen und -Verteilungsbau GmbH",
      "company_seat": "Schiffweiler",
      "details": "15.10.2025 (Bekanntmachungsdatum)\n\nSaarland Amtsgericht Saarbrücken HRB 92218\nRegisterbekanntmachung nach dem Umwandlungsgesetz 15.10.2025 (Eintragungsdatum)\n\nEAV Elektro-Anlagen und -Verteilungsbau GmbH\nGesellschaft mit beschränkter Haftung\nSchiffweiler\n\nAls nicht eingetragen wird bekannt gemacht: Den Gläubigern der an der Verschmelzung beteiligten Gesellschaften ist, wenn sie binnen sechs Monaten nach dem Tag, an dem die Eintragung der Verschmelzung in das Register des Sitzes desjenigen Rechtsträgers, dessen Gläubiger sie sind, nach § 19 Absatz 3 UmwG bekannt gemacht worden ist, ihren Anspruch nach Grund und Höhe schriftlich anmelden, Sicherheit zu leisten, soweit sie nicht Befriedigung verlangen können. Dieses Recht steht den Gläubigern jedoch nur zu, wenn sie glaubhaft machen, dass durch die Verschmelzung die Erfüllung ihrer Forderung gefährdet wird."
    },
    {
      "date": "2025-10-15",
      "id": "133970",
      "original_text": "Löschungsankündigung\nBaden-Württemberg Amtsgericht Stuttgart HRB 8731\nM.B.A. - GmbH Machines and Building Aggregates – Stuttgart",
      "type": "Löschungsankündigung",
      "state": "Baden-Württemberg",
      "amtsgericht": "Amtsgericht Stuttgart",
      "registernummer": "HRB 8731",
      "registerart": "HRB",
      "company_name": "M.B.A. - GmbH Machines and Building Aggregates",
      "company_seat": "Stuttgart",
      "details": "15.10.2025 (Bekanntmachungsdatum)\n\nBaden-Württemberg Amtsgericht Stuttgart HRB 8731\nLöschungsankündigung\n\nM.B.A. - GmbH Machines and Building Aggregates\nGesellschaft mit beschränkter Haftung\nStuttgart\n\nAls nicht eingetragen wird bekanntgemacht:\nDas Gericht beabsichtigt, die Gesellschaft wegen Vermögenslosigkeit im Handelsregister von Amts wegen nach § 394 FamFG zu löschen. Die Frist zur Geltendmachung eines Widerspruchs gegen die beabsichtigte Löschung ist auf zwei Monate ab Veröffentlichung bestimmt."
    },
    {
      "date": "2025-10-15",
      "id": "133971",
      "original_text": "Löschungsankündigung\nBerlin Amtsgericht Berlin (Charlottenburg) HRB 173274\nDynamic BS GmbH – Berlin",
      "type": "Löschungsankündigung",
      "state": "Berlin",
      "amtsgericht": "Amtsgericht Berlin (Charlottenburg)",
      "registernummer": "HRB 173274",
      "registerart": "HRB",
      "company_name": "Dynamic BS GmbH",
      "company_seat": "Berlin",
      "details": "15.10.2025 (Bekanntmachungsdatum)\n\nBerlin Amtsgericht Berlin (Charlottenburg) HRB 173274\nLöschungsankündigung\n\nDynamic BS GmbH\nGesellschaft mit beschränkter Haftung\nBerlin\n\nBei der nachstehenden Gesellschaft wird das Amtslöschungsverfahren gemäß § 394 FamFG eingeleitet. Widerspruchsfrist: 6 Wochen."
    },
    {
      "date": "2025-10-15",
      "id": "133972",
      "original_text": "Einreichung neuer Dokumente\nSaarland Amtsgericht Saarbrücken HRB 3540\nGesellschaft für Arbeit und Qualifizierung im Saarpfalz-Kreis mbH – Homburg",
      "type": "Einreichung neuer Dokumente",
      "state": "Saarland",
      "amtsgericht": "Amtsgericht Saarbrücken",
      "registernummer": "HRB 3540",
      "registerart": "HRB",
      "company_name": "Gesellschaft für Arbeit und Qualifizierung im Saarpfalz-Kreis mbH",
      "company_seat": "Homburg",
      "details": "15.10.2025 (Bekanntmachungsdatum)\n\nSaarland Amtsgericht Saarbrücken HRB 3540\nEinreichung neuer Dokumente 15.10.2025 (Eintragungsdatum)\n\nGesellschaft für Arbeit und Qualifizierung im Saarpfalz-Kreis mbH\nGesellschaft mit beschränkter Haftung\nHomburg\n\nDie Geschäftsführung der Gesellschaft hat eine Liste der Mitglieder des Aufsichtsrats zum Handelsregister eingereicht (§ 52 Abs. 3 Satz 2 GmbHG)."
    },
    {
      "date": "2025-10-15",
      "id": "133973",
      "original_text": "Registerbekanntmachung nach dem Umwandlungsgesetz\nBaden-Württemberg Amtsgericht Stuttgart HRB 796888\nAUDERE Verwaltungs- GmbH – Fellbach",
      "type": "Registerbekanntmachung nach dem Umwandlungsgesetz",
      "state": "Baden-Württemberg",
      "amtsgericht": "Amtsgericht Stuttgart",
      "registernummer": "HRB 796888",
      "registerart": "HRB",
      "company_name": "AUDERE Verwaltungs- GmbH",
      "company_seat": "Fellbach",
      "details": "15.10.2025 (Bekanntmachungsdatum)\n\nBaden-Württemberg Amtsgericht Stuttgart HRB 796888\nRegisterbekanntmachung nach dem Umwandlungsgesetz 15.10.2025 (Eintragungsdatum)\n\nAUDERE Verwaltungs- GmbH\nGesellschaft mit beschränkter Haftung\nFellbach\n\nAls nicht eingetragen wird bekanntgemacht:\nDen Gläubigern der an der Verschmelzung beteiligten Rechtsträger ist, wenn sie binnen sechs Monaten nach dem Tag, an dem die Eintragung der Verschmelzung in das Register des Sitzes desjenigen Rechtsträgers, dessen Gläubiger sie sind, nach § 19 Abs. 3 UmwG als bekanntgemacht gilt, ihren Anspruch nach Grund und Höhe schriftlich anmelden, Sicherheit zu leisten, soweit sie nicht Befriedigung verlangen können. Dieses Recht steht den Gläubigern jedoch nur zu, wenn sie glaubhaft machen, dass durch die Verschmelzung die Erfüllung ihrer Forderung gefährdet wird."
    },
    {
      "date": "2025-10-15",
      "id": "133974",
      "original_text": "Löschungsankündigung\nBerlin Amtsgericht Berlin (Charlottenburg) HRB 204273\nRitual Germany GmbH – Berlin",
      "type": "Löschungsankündigung",
      "state": "Berlin",
      "amtsgericht": "Amtsgericht Berlin (Charlottenburg)",
      "registernummer": "HRB 204273",
      "registerart": "HRB",
      "company_name": "Ritual Germany GmbH",
      "company_seat": "Berlin",
      "details": "15.10.2025 (Bekanntmachungsdatum)\n\nBerlin Amtsgericht Berlin (Charlottenburg) HRB 204273\nLöschungsankündigung\n\nRitual Germany GmbH\nGesellschaft mit beschränkter Haftung\nBerlin\n\nBei der nachstehenden Gesellschaft wird das Amtslöschungsverfahren gemäß § 394 FamFG eingeleitet. Widerspruchsfrist: 6 Wochen."
    },
    {
      "date": "2025-10-15",
      "id": "133975",
      "original_text": "Registerbekanntmachung nach dem Umwandlungsgesetz\nBaden-Württemberg Amtsgericht Mannheim HRB 730817\nOffice Mix GmbH – Mannheim",
      "type": "Registerbekanntmachung nach dem Umwandlungsgesetz",
      "state": "Baden-Württemberg",
      "amtsgericht": "Amtsgericht Mannheim",
      "registernummer": "HRB 730817",
      "registerart": "HRB",
      "company_name": "Office Mix GmbH",
      "company_seat": "Mannheim",
      "details": "15.10.2025 (Bekanntmachungsdatum)\n\nBaden-Württemberg Amtsgericht Mannheim HRB 730817\nRegisterbekanntmachung nach dem Umwandlungsgesetz 15.10.2025 (Eintragungsdatum)\n\nOffice Mix GmbH\nGesellschaft mit beschränkter Haftung\nMannheim\n\nDen Gläubigern der an der Verschmelzung beteiligten Rechtsträger ist, wenn sie binnen sechs Monaten nach dem Tag, an dem die Eintragung der Verschmelzung in das Register des Sitzes desjenigen Rechtsträgers, dessen Gläubiger sie sind, nach § 19 Abs. 3 UmwG als bekanntgemacht gilt, ihren Anspruch nach Grund und Höhe schriftlich anmelden, Sicherheit zu leisten, soweit sie nicht Befriedigung verlangen können. Dieses Recht steht den Gläubigern jedoch nur zu, wenn sie glaubhaft machen, dass durch die Verschmelzung die Erfüllung ihrer Forderung gefährdet wird."
    },
    {
      "date": "2025-10-15",
      "id": "133976",
      "original_text": "Löschungsankündigung\nBerlin Amtsgericht Berlin (Charlottenburg) HRB 174405\nC3M International UG (haftungsbeschränkt) – Berlin",
      "type": "Löschungsankündigung",
      "state": "Berlin",
      "amtsgericht": "Amtsgericht Berlin (Charlottenburg)",
      "registernummer": "HRB 174405",
      "registerart": "HRB",
      "company_name": "C3M International UG (haftungsbeschränkt)",
      "company_seat": "Berlin",
      "details": "15.10.2025 (Bekanntmachungsdatum)\n\nBerlin Amtsgericht Berlin (Charlottenburg) HRB 174405\nLöschungsankündigung\n\nC3M International UG (haftungsbeschränkt)\nGesellschaft mit beschränkter Haftung\nBerlin\n\nBei der nachstehenden Gesellschaft wird das Amtslöschungsverfahren gemäß § 394 FamFG eingeleitet. Widerspruchsfrist\n6 Wochen."
    },
    {
      "date": "2025-10-15",
      "id": "133977",
      "original_text": "Registerbekanntmachung nach dem Umwandlungsgesetz\nHamburg Amtsgericht Hamburg HRB 164731\nIMT Bildung GmbH – Hamburg",
      "type": "Registerbekanntmachung nach dem Umwandlungsgesetz",
      "state": "Hamburg",
      "amtsgericht": "Amtsgericht Hamburg",
      "registernummer": "HRB 164731",
      "registerart": "HRB",
      "company_name": "IMT Bildung GmbH",
      "company_seat": "Hamburg",
      "details": "15.10.2025 (Bekanntmachungsdatum)\n\nHamburg Amtsgericht Hamburg HRB 164731\nRegisterbekanntmachung nach dem Umwandlungsgesetz 15.10.2025 (Eintragungsdatum)\n\nIMT Bildung GmbH\nGesellschaft mit beschränkter Haftung\nHamburg\n\nAls nicht eingetragen wird bekannt gemacht:\nDen Gläubigern der an der Verschmelzung beteiligten Gesellschaften ist, wenn sie binnen sechs Monaten nach dem Tag, an dem die Eintragung der Verschmelzung in das Register des Sitzes desjenigen Rechtsträgers, dessen Gläubiger sie sind, nach § 19 Absatz 3 UmwG als bekannt gemacht gilt, ihren Anspruch nach Grund und Höhe schriftlich anmelden, Sicherheit zu leisten, soweit sie nicht Befriedigung verlangen können. Dieses Recht steht den Gläubigern jedoch nur zu, wenn sie glaubhaft machen, dass durch die Verschmelzung die Erfüllung ihrer Forderung gefährdet wird."
    },
    {
      "date": "2025-10-15",
      "id": "133978",
      "original_text": "Einreichung neuer Dokumente\nSachsen-Anhalt Amtsgericht Stendal HRB 615\nStädtische Wohnungsbaugesellschaft Genthin mbH – Genthin",
      "type": "Einreichung neuer Dokumente",
      "state": "Sachsen-Anhalt",
      "amtsgericht": "Amtsgericht Stendal",
      "registernummer": "HRB 615",
      "registerart": "HRB",
      "company_name": "Städtische Wohnungsbaugesellschaft Genthin mbH",
      "company_seat": "Genthin",
      "details": "15.10.2025 (Bekanntmachungsdatum)\n\nSachsen-Anhalt Amtsgericht Stendal HRB 615\nEinreichung neuer Dokumente\n\nStädtische Wohnungsbaugesellschaft Genthin mbH\nGesellschaft mit beschränkter Haftung\nGenthin\n\nEine Liste der Mitglieder des Aufsichtsrates wurde zum Handelsregister eingereicht."
    },
    {
      "date": "2025-10-15",
      "id": "133979",
      "original_text": "Registerbekanntmachung nach dem Umwandlungsgesetz\nBaden-Württemberg Amtsgericht Stuttgart HRB 782263\nAUDERE GC GmbH – Fellbach",
      "type": "Registerbekanntmachung nach dem Umwandlungsgesetz",
      "state": "Baden-Württemberg",
      "amtsgericht": "Amtsgericht Stuttgart",
      "registernummer": "HRB 782263",
      "registerart": "HRB",
      "company_name": "AUDERE GC GmbH",
      "company_seat": "Fellbach",
      "details": "15.10.2025 (Bekanntmachungsdatum)\n\nBaden-Württemberg Amtsgericht Stuttgart HRB 782263\nRegisterbekanntmachung nach dem Umwandlungsgesetz 15.10.2025 (Eintragungsdatum)\n\nAUDERE GC GmbH\nGesellschaft mit beschränkter Haftung\nFellbach\n\nAls nicht eingetragen wird bekanntgemacht:\nDen Gläubigern der an der Verschmelzung beteiligten Rechtsträger ist, wenn sie binnen sechs Monaten nach dem Tag, an dem die Eintragung der Verschmelzung in das Register des Sitzes desjenigen Rechtsträgers, dessen Gläubiger sie sind, nach § 19 Abs. 3 UmwG als bekanntgemacht gilt, ihren Anspruch nach Grund und Höhe schriftlich anmelden, Sicherheit zu leisten, soweit sie nicht Befriedigung verlangen können. Dieses Recht steht den Gläubigern jedoch nur zu, wenn sie glaubhaft machen, dass durch die Verschmelzung die Erfüllung ihrer Forderung gefährdet wird."
    },
    {
      "date": "2025-10-15",
      "id": "133980",
      "original_text": "Löschungsankündigung\nBerlin Amtsgericht Berlin (Charlottenburg) HRB 245757\nMakobau GmbH – Berlin",
      "type": "Löschungsankündigung",
      "state": "Berlin",
      "amtsgericht": "Amtsgericht Berlin (Charlottenburg)",
      "registernummer": "HRB 245757",
      "registerart": "HRB",
      "company_name": "Makobau GmbH",
      "company_seat": "Berlin",
      "details": "15.10.2025 (Bekanntmachungsdatum)\n\nBerlin Amtsgericht Berlin (Charlottenburg) HRB 245757\nLöschungsankündigung\n\nMakobau GmbH\nGesellschaft mit beschränkter Haftung\nBerlin\n\nBei der nachstehenden Gesellschaft wird das Amtslöschungsverfahren gemäß § 394 FamFG eingeleitet. Widerspruchsfrist 6 Wochen"
    },
    {
      "date": "2025-10-15",
      "id": "133981",
      "original_text": "Registerbekanntmachung nach dem Umwandlungsgesetz\nBerlin Amtsgericht Berlin (Charlottenburg) HRB 280101\nPrime Elements GmbH – Berlin",
      "type": "Registerbekanntmachung nach dem Umwandlungsgesetz",
      "state": "Berlin",
      "amtsgericht": "Amtsgericht Berlin (Charlottenburg)",
      "registernummer": "HRB 280101",
      "registerart": "HRB",
      "company_name": "Prime Elements GmbH",
      "company_seat": "Berlin",
      "details": "15.10.2025 (Bekanntmachungsdatum)\n\nBerlin Amtsgericht Berlin (Charlottenburg) HRB 280101\nRegisterbekanntmachung nach dem Umwandlungsgesetz 13.10.2025 (Eintragungsdatum)\n\nPrime Elements GmbH\nGesellschaft mit beschränkter Haftung\nBerlin\n\nZu Eintragungsnummer 1 vom 13.10.2025 wird als nicht eingetragen veröffentlicht: Den Gläubigern der an der Spaltung beteiligten Rechtsträger ist, wenn sie binnen sechs Monaten nach dem Tag, an dem die Eintragung der Spaltung in das Register des Sitzes desjenigen Rechtsträgers, dessen Gläubiger sie sind, als bekannt gemacht gilt, ihren Anspruch nach Grund und Höhe schriftlich anmelden, Sicherheit zu leisten, soweit sie nicht Befriedigung verlangen können. Dieses Recht steht den Gläubigern jedoch nur zu, wenn sie glaubhaft machen, dass durch die Spaltung die Erfüllung ihrer Forderung gefährdet wird. Das Recht, Sicherheitsleistung zu verlangen, steht Gläubigern nicht zu, die im Falle der Insolvenz ein Recht auf vorzugsweise Befriedigung aus einer Deckungsmasse haben, die nach gesetzlicher Vorschrift zu ihrem Schutz errichtet und staatlich überwacht ist."
    },
    {
      "date": "2025-10-15",
      "id": "133982",
      "original_text": "Einreichung neuer Dokumente\nBerlin Amtsgericht Berlin (Charlottenburg) HRB 117588\nEWN Vermögensanlagen und -beteiligungen Verwaltungsgesellschaft mbH – Berlin",
      "type": "Einreichung neuer Dokumente",
      "state": "Berlin",
      "amtsgericht": "Amtsgericht Berlin (Charlottenburg)",
      "registernummer": "HRB 117588",
      "registerart": "HRB",
      "company_name": "EWN Vermögensanlagen und -beteiligungen Verwaltungsgesellschaft mbH",
      "company_seat": "Berlin",
      "details": "15.10.2025 (Bekanntmachungsdatum)\n\nBerlin Amtsgericht Berlin (Charlottenburg) HRB 117588\nEinreichung neuer Dokumente\n\nEWN Vermögensanlagen und -beteiligungen Verwaltungsgesellschaft mbH\nGesellschaft mit beschränkter Haftung\nBerlin\n\nAls nicht eingetragen wird veröffentlicht: Es wurde eine neue Liste der Beiratsmitglieder eingereicht (§52 II GmbHG)."
    },
    {
      "date": "2025-10-15",
      "id": "133983",
      "original_text": "Registerbekanntmachung nach dem Umwandlungsgesetz\nBaden-Württemberg Amtsgericht Stuttgart GnR 430001\nVolksbank Nordschwarzwald eG – Freudenstadt",
      "type": "Registerbekanntmachung nach dem Umwandlungsgesetz",
      "state": "Baden-Württemberg",
      "amtsgericht": "Amtsgericht Stuttgart",
      "registernummer": "GnR 430001",
      "registerart": "GnR",
      "company_name": "Volksbank Nordschwarzwald eG",
      "company_seat": "Freudenstadt",
      "details": "15.10.2025 (Bekanntmachungsdatum)\n\nBaden-Württemberg Amtsgericht Stuttgart GnR 430001\nRegisterbekanntmachung nach dem Umwandlungsgesetz 15.10.2025 (Eintragungsdatum)\n\nVolksbank Nordschwarzwald eG\neingetragene Genossenschaft\nFreudenstadt\n\nAls nicht eingetragen wird bekanntgemacht:\nDen Gläubigern der an der Verschmelzung beteiligten Rechtsträger ist, wenn sie binnen sechs Monaten nach dem Tag, an dem die Eintragung der Verschmelzung in das Register des Sitzes desjenigen Rechtsträgers, dessen Gläubiger sie sind, nach § 19 Abs. 3 UmwG als bekanntgemacht gilt, ihren Anspruch nach Grund und Höhe schriftlich anmelden, Sicherheit zu leisten, soweit sie nicht Befriedigung verlangen können. Dieses Recht steht den Gläubigern jedoch nur zu, wenn sie glaubhaft machen, dass durch die Verschmelzung die Erfüllung ihrer Forderung gefährdet wird."
    },
    {
      "date": "2025-10-15",
      "id": "133984",
      "original_text": "Registerbekanntmachung nach dem Umwandlungsgesetz\nBaden-Württemberg Amtsgericht Mannheim HRB 704851\nErste Friedrichstadtpassagen GmbH – Heidelberg",
      "type": "Registerbekanntmachung nach dem Umwandlungsgesetz",
      "state": "Baden-Württemberg",
      "amtsgericht": "Amtsgericht Mannheim",
      "registernummer": "HRB 704851",
      "registerart": "HRB",
      "company_name": "Erste Friedrichstadtpassagen GmbH",
      "company_seat": "Heidelberg",
      "details": "15.10.2025 (Bekanntmachungsdatum)\n\nBaden-Württemberg Amtsgericht Mannheim HRB 704851\nRegisterbekanntmachung nach dem Umwandlungsgesetz 15.10.2025 (Eintragungsdatum)\n\nErste Friedrichstadtpassagen GmbH\nGesellschaft mit beschränkter Haftung\nHeidelberg\n\nAls nicht eingetragen wird bekanntgemacht:\nDen Gläubigern der an der Verschmelzung beteiligten Rechtsträger ist, wenn sie binnen sechs Monaten nach dem Tag, an dem die Eintragung der Verschmelzung in das Register des Sitzes desjenigen Rechtsträgers, dessen Gläubiger sie sind, nach § 19 Abs. 3 UmwG als bekanntgemacht gilt, ihren Anspruch nach Grund und Höhe schriftlich anmelden, Sicherheit zu leisten, soweit sie nicht Befriedigung verlangen können. Dieses Recht steht den Gläubigern jedoch nur zu, wenn sie glaubhaft machen, dass durch die Verschmelzung die Erfüllung ihrer Forderung gefährdet wird."
    },
    {
      "date": "2025-10-15",
      "id": "133985",
      "original_text": "Registerbekanntmachung nach dem Umwandlungsgesetz\nBaden-Württemberg Amtsgericht Mannheim HRB 335537\nBlue Eye Capital Heidelberg GmbH – Heidelberg",
      "type": "Registerbekanntmachung nach dem Umwandlungsgesetz",
      "state": "Baden-Württemberg",
      "amtsgericht": "Amtsgericht Mannheim",
      "registernummer": "HRB 335537",
      "registerart": "HRB",
      "company_name": "Blue Eye Capital Heidelberg GmbH",
      "company_seat": "Heidelberg",
      "details": "15.10.2025 (Bekanntmachungsdatum)\n\nBaden-Württemberg Amtsgericht Mannheim HRB 335537\nRegisterbekanntmachung nach dem Umwandlungsgesetz 15.10.2025 (Eintragungsdatum)\n\nBlue Eye Capital Heidelberg GmbH\nGesellschaft mit beschränkter Haftung\nHeidelberg\n\nDen Gläubigern der an der Verschmelzung beteiligten Rechtsträger ist, wenn sie binnen sechs Monaten nach dem Tag, an dem die Eintragung der Verschmelzung in das Register des Sitzes desjenigen Rechtsträgers, dessen Gläubiger sie sind, nach § 19 Abs. 3 UmwG als bekanntgemacht gilt, ihren Anspruch nach Grund und Höhe schriftlich anmelden, Sicherheit zu leisten, soweit sie nicht Befriedigung verlangen können. Dieses Recht steht den Gläubigern jedoch nur zu, wenn sie glaubhaft machen, dass durch die Verschmelzung die Erfüllung ihrer Forderung gefährdet wird."
    },
    {
      "date": "2025-10-15",
      "id": "133986",
      "original_text": "Registerbekanntmachung nach dem Umwandlungsgesetz\nBrandenburg Amtsgericht Cottbus HRB 17664\nVintage 64 Service GmbH – Schulzendorf",
      "type": "Registerbekanntmachung nach dem Umwandlungsgesetz",
      "state": "Brandenburg",
      "amtsgericht": "Amtsgericht Cottbus",
      "registernummer": "HRB 17664",
      "registerart": "HRB",
      "company_name": "Vintage 64 Service GmbH",
      "company_seat": "Schulzendorf",
      "details": "15.10.2025 (Bekanntmachungsdatum)\n\nBrandenburg Amtsgericht Cottbus HRB 17664\nRegisterbekanntmachung nach dem Umwandlungsgesetz 13.10.2025 (Eintragungsdatum)\n\nVintage 64 Service GmbH\nGesellschaft mit beschränkter Haftung\nSchulzendorf\n\nDen Gläubigern der an der Verschmelzung beteiligten Rechtsträger ist, wenn sie binnen sechs Monaten nach dem Tag, an dem die Eintragung der Verschmelzung in das Register des Sitzes desjenigen Rechtsträgers, dessen Gläubiger sie sind, als bekannt gemacht gilt, ihren Anspruch nach Grund und Höhe schriftlich anmelden, Sicherheit zu leisten, soweit sie nicht Befriedigung verlangen können. Dieses Recht steht den Gläubigern jedoch nur zu, wenn sie glaubhaft machen, dass durch die Verschmelzung die Erfüllung ihrer Forderung gefährdet wird."
    },
    {
      "date": "2025-10-15",
      "id": "133987",
      "original_text": "Registerbekanntmachung nach dem Umwandlungsgesetz\nBerlin Amtsgericht Berlin (Charlottenburg) HRB 175753\nDYM Resources GmbH – Berlin",
      "type": "Registerbekanntmachung nach dem Umwandlungsgesetz",
      "state": "Berlin",
      "amtsgericht": "Amtsgericht Berlin (Charlottenburg)",
      "registernummer": "HRB 175753",
      "registerart": "HRB",
      "company_name": "DYM Resources GmbH",
      "company_seat": "Berlin",
      "details": "15.10.2025 (Bekanntmachungsdatum)\n\nBerlin Amtsgericht Berlin (Charlottenburg) HRB 175753\nRegisterbekanntmachung nach dem Umwandlungsgesetz 13.10.2025 (Eintragungsdatum)\n\nDYM Resources GmbH\nGesellschaft mit beschränkter Haftung\nBerlin\n\nZu Eintragungsnummer 7 vom 13.10.2025 wird als nicht eingetragen veröffentlicht: Den Gläubigern der an der Spaltung beteiligten Rechtsträger ist, wenn sie binnen sechs Monaten nach dem Tag, an dem die Eintragung der Spaltung in das Register des Sitzes desjenigen Rechtsträgers, dessen Gläubiger sie sind, als bekannt gemacht gilt, ihren Anspruch nach Grund und Höhe schriftlich anmelden, Sicherheit zu leisten, soweit sie nicht Befriedigung verlangen können. Dieses Recht steht den Gläubigern jedoch nur zu, wenn sie glaubhaft machen, dass durch die Spaltung die Erfüllung ihrer Forderung gefährdet wird. Das Recht, Sicherheitsleistung zu verlangen, steht Gläubigern nicht zu, die im Falle der Insolvenz ein Recht auf vorzugsweise Befriedigung aus einer Deckungsmasse haben, die nach gesetzlicher Vorschrift zu ihrem Schutz errichtet und staatlich überwacht ist."
    },
    {
      "date": "2025-10-15",
      "id": "133988",
      "original_text": "Registerbekanntmachung nach dem Umwandlungsgesetz\nHamburg Amtsgericht Hamburg HRB 193476\nFUNKE Medien National Brands GmbH – Hamburg",
      "type": "Registerbekanntmachung nach dem Umwandlungsgesetz",
      "state": "Hamburg",
      "amtsgericht": "Amtsgericht Hamburg",
      "registernummer": "HRB 193476",
      "registerart": "HRB",
      "company_name": "FUNKE Medien National Brands GmbH",
      "company_seat": "Hamburg",
      "details": "15.10.2025 (Bekanntmachungsdatum)\n\nHamburg Amtsgericht Hamburg HRB 193476\nRegisterbekanntmachung nach dem Umwandlungsgesetz 15.10.2025 (Eintragungsdatum)\n\nFUNKE Medien National Brands GmbH\nGesellschaft mit beschränkter Haftung\nHamburg\n\nAls nicht eingetragen wird bekannt gemacht:\nDen Gläubigern der an der Verschmelzung beteiligten Gesellschaften ist, wenn sie binnen sechs Monaten nach dem Tag, an dem die Eintragung der Verschmelzung in das Register des Sitzes desjenigen Rechtsträgers, dessen Gläubiger sie sind, nach § 19 Absatz 3 UmwG als bekannt gemacht gilt, ihren Anspruch nach Grund und Höhe schriftlich anmelden, Sicherheit zu leisten, soweit sie nicht Befriedigung verlangen können. Dieses Recht steht den Gläubigern jedoch nur zu, wenn sie glaubhaft machen, dass durch die Verschmelzung die Erfüllung ihrer Forderung gefährdet wird."
    },
    {
      "date": "2025-10-15",
      "id": "133989",
      "original_text": "Registerbekanntmachung nach dem Umwandlungsgesetz\nSaarland Amtsgericht Saarbrücken HRB 109841\nRheingold Aktenarchivierung Saarbrücken GmbH – Saarbrücken",
      "type": "Registerbekanntmachung nach dem Umwandlungsgesetz",
      "state": "Saarland",
      "amtsgericht": "Amtsgericht Saarbrücken",
      "registernummer": "HRB 109841",
      "registerart": "HRB",
      "company_name": "Rheingold Aktenarchivierung Saarbrücken GmbH",
      "company_seat": "Saarbrücken",
      "details": "15.10.2025 (Bekanntmachungsdatum)\n\nSaarland Amtsgericht Saarbrücken HRB 109841\nRegisterbekanntmachung nach dem Umwandlungsgesetz 15.10.2025 (Eintragungsdatum)\n\nRheingold Aktenarchivierung Saarbrücken GmbH\nGesellschaft mit beschränkter Haftung\nSaarbrücken\n\nAls nicht eingetragen wird bekannt gemacht: Den Gläubigern der an der Verschmelzung beteiligten Gesellschaften ist, wenn sie binnen sechs Monaten nach dem Tag, an dem die Eintragung der Verschmelzung in das Register des Sitzes desjenigen Rechtsträgers, dessen Gläubiger sie sind, nach § 19 Absatz 3 UmwG bekannt gemacht worden ist, ihren Anspruch nach Grund und Höhe schriftlich anmelden, Sicherheit zu leisten, soweit sie nicht Befriedigung verlangen können. Dieses Recht steht den Gläubigern jedoch nur zu, wenn sie glaubhaft machen, dass durch die Verschmelzung die Erfüllung ihrer Forderung gefährdet wird."
    },
    {
      "date": "2025-10-15",
      "id": "133990",
      "original_text": "Löschungsankündigung\nBerlin Amtsgericht Berlin (Charlottenburg) HRB 246236\nMeine Sanitäter UG (haftungsbeschränkt) – Berlin",
      "type": "Löschungsankündigung",
      "state": "Berlin",
      "amtsgericht": "Amtsgericht Berlin (Charlottenburg)",
      "registernummer": "HRB 246236",
      "registerart": "HRB",
      "company_name": "Meine Sanitäter UG (haftungsbeschränkt)",
      "company_seat": "Berlin",
      "details": "15.10.2025 (Bekanntmachungsdatum)\n\nBerlin Amtsgericht Berlin (Charlottenburg) HRB 246236\nLöschungsankündigung\n\nMeine Sanitäter UG (haftungsbeschränkt)\nGesellschaft mit beschränkter Haftung\nBerlin\n\nBei der nachstehenden Gesellschaft wird das Amtslöschungsverfahren gemäß § 394 FamFG eingeleitet. Widerspruchsfrist: 6 Wochen."
    },
    {
      "date": "2025-10-15",
      "id": "133991",
      "original_text": "Löschungsankündigung\nBerlin Amtsgericht Berlin (Charlottenburg) HRB 263069\nPhoenix Bausanierung GmbH – Berlin",
      "type": "Löschungsankündigung",
      "state": "Berlin",
      "amtsgericht": "Amtsgericht Berlin (Charlottenburg)",
      "registernummer": "HRB 263069",
      "registerart": "HRB",
      "company_name": "Phoenix Bausanierung GmbH",
      "company_seat": "Berlin",
      "details": "15.10.2025 (Bekanntmachungsdatum)\n\nBerlin Amtsgericht Berlin (Charlottenburg) HRB 263069\nLöschungsankündigung\n\nPhoenix Bausanierung GmbH\nGesellschaft mit beschränkter Haftung\nBerlin\n\nBei der nachstehenden Gesellschaft wird das Amtslöschungsverfahren gemäß § 394 FamFG eingeleitet. Widerspruchsfrist: 6 Wochen."
    },
    {
      "date": "2025-10-15",
      "id": "133992",
      "original_text": "Registerbekanntmachung nach dem Umwandlungsgesetz\nBaden-Württemberg Amtsgericht Stuttgart HRB 750476\nUntis Baden-Württemberg GmbH – Gerlingen",
      "type": "Registerbekanntmachung nach dem Umwandlungsgesetz",
      "state": "Baden-Württemberg",
      "amtsgericht": "Amtsgericht Stuttgart",
      "registernummer": "HRB 750476",
      "registerart": "HRB",
      "company_name": "Untis Baden-Württemberg GmbH",
      "company_seat": "Gerlingen",
      "details": "15.10.2025 (Bekanntmachungsdatum)\n\nBaden-Württemberg Amtsgericht Stuttgart HRB 750476\nRegisterbekanntmachung nach dem Umwandlungsgesetz 15.10.2025 (Eintragungsdatum)\n\nUntis Baden-Württemberg GmbH\nGesellschaft mit beschränkter Haftung\nGerlingen\n\nDen Gläubigern dern an der grenzüberschreitenden Verschmelzung beteiligten übernehmenden Rechtsträger ist, wenn sie binnen sechs Monaten nach dem Tag, an dem die Eintragung der Verschmelzung in das Register des Sitzes desjenigen Rechtsträgers, dessen Gläubiger sie sind, nach § 19 Absatz 3 UmwG als bekanntgemacht gilt, ihren Anspruch nach Grund und Höhe schriftlich anmelden, Sicherheit zu leisten, soweit sie nicht Befriedigung verlangen können. Dieses Recht steht den Gläubigern jedoch nur zu, wenn sie glaubhaft machen, dass durch die Verschmelzung die Erfüllung ihrer Forderung gefährdet wird."
    },
    {
      "date": "2025-10-15",
      "id": "133993",
      "original_text": "Löschungsankündigung\nBrandenburg Amtsgericht Neuruppin HRB 9277\nÜber der Spree Projekt GmbH – Liebenwalde",
      "type": "Löschungsankündigung",
      "state": "Brandenburg",
      "amtsgericht": "Amtsgericht Neuruppin",
      "registernummer": "HRB 9277",
      "registerart": "HRB",
      "company_name": "Über der Spree Projekt GmbH",
      "company_seat": "Liebenwalde",
      "details": "15.10.2025 (Bekanntmachungsdatum)\n\nBrandenburg Amtsgericht Neuruppin HRB 9277\nLöschungsankündigung\n\nÜber der Spree Projekt GmbH\nGesellschaft mit beschränkter Haftung\nLiebenwalde\n\nBei der nachstehenden Gesellschaft wird das Amtslöschungsverfahren gemäß § 394 FamFG eingeleitet.\nWiderspruchsfrist: 1 Monat"
    },
    {
      "date": "2025-10-15",
      "id": "133994",
      "original_text": "Registerbekanntmachung nach dem Umwandlungsgesetz\nHamburg Amtsgericht Hamburg HRB 84754\nPINO Pharmazeutische Präparate GmbH – Hamburg",
      "type": "Registerbekanntmachung nach dem Umwandlungsgesetz",
      "state": "Hamburg",
      "amtsgericht": "Amtsgericht Hamburg",
      "registernummer": "HRB 84754",
      "registerart": "HRB",
      "company_name": "PINO Pharmazeutische Präparate GmbH",
      "company_seat": "Hamburg",
      "details": "15.10.2025 (Bekanntmachungsdatum)\n\nHamburg Amtsgericht Hamburg HRB 84754\nRegisterbekanntmachung nach dem Umwandlungsgesetz 15.10.2025 (Eintragungsdatum)\n\nPINO Pharmazeutische Präparate GmbH\nGesellschaft mit beschränkter Haftung\nHamburg\n\nAls nicht eingetragen wird bekannt gemacht:\nDen Gläubigern der an der Abspaltung beteiligten Gesellschaften ist, wenn sie binnen sechs Monaten nach dem Tag, an dem die Eintragung der Abspaltung in das Register des Sitzes desjenigen Rechtsträgers, dessen Gläubiger sie sind, nach § 19 Absatz 3 UmwG als bekannt gemacht gilt, ihren Anspruch nach Grund und Höhe schriftlich anmelden, Sicherheit zu leisten, soweit sie nicht Befriedigung verlangen können. Dieses Recht steht den Gläubigern jedoch nur zu, wenn sie glaubhaft machen, dass durch die Abspaltung die Erfüllung ihrer Forderung gefährdet wird."
    },
    {
      "date": "2025-10-15",
      "id": "133995",
      "original_text": "Registerbekanntmachung nach dem Umwandlungsgesetz\nHamburg Amtsgericht Hamburg HRB 187681\nHa-eS XVII Beteiligungs GmbH – Hamburg",
      "type": "Registerbekanntmachung nach dem Umwandlungsgesetz",
      "state": "Hamburg",
      "amtsgericht": "Amtsgericht Hamburg",
      "registernummer": "HRB 187681",
      "registerart": "HRB",
      "company_name": "Ha-eS XVII Beteiligungs GmbH",
      "company_seat": "Hamburg",
      "details": "15.10.2025 (Bekanntmachungsdatum)\n\nHamburg Amtsgericht Hamburg HRB 187681\nRegisterbekanntmachung nach dem Umwandlungsgesetz 15.10.2025 (Eintragungsdatum)\n\nHa-eS XVII Beteiligungs GmbH\nGesellschaft mit beschränkter Haftung\nHamburg\n\nAls nicht eingetragen wird bekannt gemacht:\nDen Gläubigern der an der Abspaltung beteiligten Gesellschaften ist, wenn sie binnen sechs Monaten nach dem Tag, an dem die Eintragung der Abspaltung in das Register des Sitzes desjenigen Rechtsträgers, dessen Gläubiger sie sind, nach § 19 Absatz 3 UmwG als bekannt gemacht gilt, ihren Anspruch nach Grund und Höhe schriftlich anmelden, Sicherheit zu leisten, soweit sie nicht Befriedigung verlangen können. Dieses Recht steht den Gläubigern jedoch nur zu, wenn sie glaubhaft machen, dass durch die Abspaltung die Erfüllung ihrer Forderung gefährdet wird."
    },
    {
      "date": "2025-10-15",
      "id": "133996",
      "original_text": "Löschungsankündigung\nBerlin Amtsgericht Berlin (Charlottenburg) HRB 126382\nL'OSTE Unternehmergesellschaft (haftungsbeschränkt) – Berlin",
      "type": "Löschungsankündigung",
      "state": "Berlin",
      "amtsgericht": "Amtsgericht Berlin (Charlottenburg)",
      "registernummer": "HRB 126382",
      "registerart": "HRB",
      "company_name": "L'OSTE Unternehmergesellschaft (haftungsbeschränkt)",
      "company_seat": "Berlin",
      "details": "15.10.2025 (Bekanntmachungsdatum)\n\nBerlin Amtsgericht Berlin (Charlottenburg) HRB 126382\nLöschungsankündigung\n\nL'OSTE Unternehmergesellschaft (haftungsbeschränkt)\nGesellschaft mit beschränkter Haftung\nBerlin\n\nBei der nachstehenden Gesellschaft wird das Amtslöschungsverfahren gemäß § 394 FamFG eingeleitet. Widerspruchsfrist 6 Wochen"
    },
    {
      "date": "2025-10-15",
      "id": "133997",
      "original_text": "Registerbekanntmachung nach dem Umwandlungsgesetz\nBaden-Württemberg Amtsgericht Ulm HRB 746918\nQFO - Quendt Family Office GmbH – Essingen",
      "type": "Registerbekanntmachung nach dem Umwandlungsgesetz",
      "state": "Baden-Württemberg",
      "amtsgericht": "Amtsgericht Ulm",
      "registernummer": "HRB 746918",
      "registerart": "HRB",
      "company_name": "QFO - Quendt Family Office GmbH",
      "company_seat": "Essingen",
      "details": "15.10.2025 (Bekanntmachungsdatum)\n\nBaden-Württemberg Amtsgericht Ulm HRB 746918\nRegisterbekanntmachung nach dem Umwandlungsgesetz 15.10.2025 (Eintragungsdatum)\n\nQFO - Quendt Family Office GmbH\nGesellschaft mit beschränkter Haftung\nEssingen\n\nAls nicht eingetragen wird bekanntgemacht:\nDen Gläubigern der an der Verschmelzung beteiligten Rechtsträger ist, wenn sie binnen sechs Monaten nach dem Tag, an dem die Eintragung der Verschmelzung in das Register des Sitzes desjenigen Rechtsträgers, dessen Gläubiger sie sind, nach § 19 Abs. 3 UmwG als bekanntgemacht gilt, ihren Anspruch nach Grund und Höhe schriftlich anmelden, Sicherheit zu leisten, soweit sie nicht Befriedigung verlangen können. Dieses Recht steht den Gläubigern jedoch nur zu, wenn sie glaubhaft machen, dass durch die Verschmelzung die Erfüllung ihrer Forderung gefährdet wird."
    },
    {
      "date": "2025-10-15",
      "id": "133998",
      "original_text": "Registerbekanntmachung nach dem Umwandlungsgesetz\nBaden-Württemberg Amtsgericht Mannheim HRB 704707\nLTG Informationssysteme Holding GmbH – Rastatt",
      "type": "Registerbekanntmachung nach dem Umwandlungsgesetz",
      "state": "Baden-Württemberg",
      "amtsgericht": "Amtsgericht Mannheim",
      "registernummer": "HRB 704707",
      "registerart": "HRB",
      "company_name": "LTG Informationssysteme Holding GmbH",
      "company_seat": "Rastatt",
      "details": "15.10.2025 (Bekanntmachungsdatum)\n\nBaden-Württemberg Amtsgericht Mannheim HRB 704707\nRegisterbekanntmachung nach dem Umwandlungsgesetz 15.10.2025 (Eintragungsdatum)\n\nLTG Informationssysteme Holding GmbH\nGesellschaft mit beschränkter Haftung\nRastatt\n\nDen Gläubigern der an der Verschmelzung beteiligten Rechtsträger ist, wenn sie binnen sechs Monaten nach dem Tag, an dem die Eintragung der Verschmelzung in das Register des Sitzes desjenigen Rechtsträgers, dessen Gläubiger sie sind, nach § 19 Abs. 3 UmwG als bekanntgemacht gilt, ihren Anspruch nach Grund und Höhe schriftlich anmelden, Sicherheit zu leisten, soweit sie nicht Befriedigung verlangen können. Dieses Recht steht den Gläubigern jedoch nur zu, wenn sie glaubhaft machen, dass durch die Verschmelzung die Erfüllung ihrer Forderung gefährdet wird."
    },
    {
      "date": "2025-10-15",
      "id": "133999",
      "original_text": "Registerbekanntmachung nach dem Umwandlungsgesetz\nBaden-Württemberg Amtsgericht Mannheim HRB 737582\nHANNINA GmbH – Mannheim",
      "type": "Registerbekanntmachung nach dem Umwandlungsgesetz",
      "state": "Baden-Württemberg",
      "amtsgericht": "Amtsgericht Mannheim",
      "registernummer": "HRB 737582",
      "registerart": "HRB",
      "company_name": "HANNINA GmbH",
      "company_seat": "Mannheim",
      "details": "15.10.2025 (Bekanntmachungsdatum)\n\nBaden-Württemberg Amtsgericht Mannheim HRB 737582\nRegisterbekanntmachung nach dem Umwandlungsgesetz 15.10.2025 (Eintragungsdatum)\n\nHANNINA GmbH\nGesellschaft mit beschränkter Haftung\nMannheim\n\nDen Gläubigern der an der Verschmelzung beteiligten Rechtsträger ist, wenn sie binnen sechs Monaten nach dem Tag, an dem die Eintragung der Verschmelzung in das Register des Sitzes desjenigen Rechtsträgers, dessen Gläubiger sie sind, nach § 19 Abs. 3 UmwG als bekanntgemacht gilt, ihren Anspruch nach Grund und Höhe schriftlich anmelden, Sicherheit zu leisten, soweit sie nicht Befriedigung verlangen können. Dieses Recht steht den Gläubigern jedoch nur zu, wenn sie glaubhaft machen, dass durch die Verschmelzung die Erfüllung ihrer Forderung gefährdet wird."
    },
    {
      "date": "2025-10-15",
      "id": "134000",
      "original_text": "Löschungsankündigung\nSchleswig-Holstein Amtsgericht Kiel HRA 12019\nLuxoria GmbH & Co. KG – Neumünster",
      "type": "Löschungsankündigung",
      "state": "Schleswig-Holstein",
      "amtsgericht": "Amtsgericht Kiel",
      "registernummer": "HRA 12019",
      "registerart": "HRA",
      "company_name": "Luxoria GmbH & Co. KG",
      "company_seat": "Neumünster",
      "details": "15.10.2025 (Bekanntmachungsdatum)\n\nSchleswig-Holstein Amtsgericht Kiel HRA 12019\nLöschungsankündigung\n\nLuxoria GmbH & Co. KG\nKommanditgesellschaft\nNeumünster\n\nBei der nachstehenden Firma wird das Amtslöschungsverfahren gemäß § 31 Abs. 2 HGB eingeleitet. Widerspruchsfrist: 2 Monate."
    },
    {
      "date": "2025-10-15",
      "id": "134001",
      "original_text": "Löschungsankündigung\nBrandenburg Amtsgericht Potsdam HRB 37620\nService-Welten UG (haftungsbeschränkt) – Zossen",
      "type": "Löschungsankündigung",
      "state": "Brandenburg",
      "amtsgericht": "Amtsgericht Potsdam",
      "registernummer": "HRB 37620",
      "registerart": "HRB",
      "company_name": "Service-Welten UG (haftungsbeschränkt)",
      "company_seat": "Zossen",
      "details": "15.10.2025 (Bekanntmachungsdatum)\n\nBrandenburg Amtsgericht Potsdam HRB 37620\nLöschungsankündigung\n\nService-Welten UG (haftungsbeschränkt)\nGesellschaft mit beschränkter Haftung\nZossen\n\nBei der nachstehenden Gesellschaft wird das Amtslöschungsverfahren gemäß § 394 FamFG eingeleitet. Widerspruchsfrist: 8 Wochen."
    },
    {
      "date": "2025-10-15",
      "id": "134002",
      "original_text": "Registerbekanntmachung nach dem Umwandlungsgesetz\nSchleswig-Holstein Amtsgericht Lübeck HRB 21783\nConvotis Lübeck GmbH – Lübeck",
      "type": "Registerbekanntmachung nach dem Umwandlungsgesetz",
      "state": "Schleswig-Holstein",
      "amtsgericht": "Amtsgericht Lübeck",
      "registernummer": "HRB 21783",
      "registerart": "HRB",
      "company_name": "Convotis Lübeck GmbH",
      "company_seat": "Lübeck",
      "details": "15.10.2025 (Bekanntmachungsdatum)\n\nSchleswig-Holstein Amtsgericht Lübeck HRB 21783\nRegisterbekanntmachung nach dem Umwandlungsgesetz 14.10.2025 (Eintragungsdatum)\n\nConvotis Lübeck GmbH\nGesellschaft mit beschränkter Haftung\nLübeck\n\nZu Eintragungsnummer 13 vom 14.10.2025 wird als nicht eingetragen veröffentlicht:  Den Gläubigern ist, wenn sie binnen sechs Monaten nach dem Tag, an dem die Eintragung der Umwandlung als bekannt gemacht gilt, ihren Anspruch nach Grund und Höhe schriftlich anmelden, Sicherheit zu leisten, soweit sie nicht Befriedigung verlangen können. Dieses Recht steht den Gläubigern jedoch nur zu, wenn sie glaubhaft machen, dass durch die Umwandlung die Erfüllung ihrer Forderung gefährdet wird."
    },
    {
      "date": "2025-10-15",
      "id": "134003",
      "original_text": "Registerbekanntmachung nach dem Umwandlungsgesetz\nBaden-Württemberg Amtsgericht Mannheim HRB 704096\nHVB GmbH – Mannheim",
      "type": "Registerbekanntmachung nach dem Umwandlungsgesetz",
      "state": "Baden-Württemberg",
      "amtsgericht": "Amtsgericht Mannheim",
      "registernummer": "HRB 704096",
      "registerart": "HRB",
      "company_name": "HVB GmbH",
      "company_seat": "Mannheim",
      "details": "15.10.2025 (Bekanntmachungsdatum)\n\nBaden-Württemberg Amtsgericht Mannheim HRB 704096\nRegisterbekanntmachung nach dem Umwandlungsgesetz 15.10.2025 (Eintragungsdatum)\n\nHVB GmbH\nGesellschaft mit beschränkter Haftung\nMannheim\n\nAls nicht eingetragen wird bekanntgemacht:\nDen Gläubigern der an der Verschmelzung beteiligten Rechtsträger ist, wenn sie binnen sechs Monaten nach dem Tag, an dem die Eintragung der Verschmelzung in das Register des Sitzes desjenigen Rechtsträgers, dessen Gläubiger sie sind, nach § 19 Abs. 3 UmwG als bekanntgemacht gilt, ihren Anspruch nach Grund und Höhe schriftlich anmelden, Sicherheit zu leisten, soweit sie nicht Befriedigung verlangen können. Dieses Recht steht den Gläubigern jedoch nur zu, wenn sie glaubhaft machen, dass durch die Verschmelzung die Erfüllung ihrer Forderung gefährdet wird."
    },
    {
      "date": "2025-10-15",
      "id": "134004",
      "original_text": "Registerbekanntmachung nach dem Umwandlungsgesetz\nBaden-Württemberg Amtsgericht Stuttgart HRB 726716\nBecklyn GmbH – Ludwigsburg",
      "type": "Registerbekanntmachung nach dem Umwandlungsgesetz",
      "state": "Baden-Württemberg",
      "amtsgericht": "Amtsgericht Stuttgart",
      "registernummer": "HRB 726716",
      "registerart": "HRB",
      "company_name": "Becklyn GmbH",
      "company_seat": "Ludwigsburg",
      "details": "15.10.2025 (Bekanntmachungsdatum)\n\nBaden-Württemberg Amtsgericht Stuttgart HRB 726716\nRegisterbekanntmachung nach dem Umwandlungsgesetz 15.10.2025 (Eintragungsdatum)\n\nBecklyn GmbH\nGesellschaft mit beschränkter Haftung\nLudwigsburg\n\nAls nicht eingetragen wird bekanntgemacht:\nDen Gläubigern der Gesellschaft, deren Forderungen begründet worden sind, bevor die Eintragung der Beendigung des Vertrages in das Handelsregister nach § 10 HGB als bekanntgemacht gilt, ist vom anderen Vertragsteil Sicherheit zu leisten, wenn sie sich binnen sechs Monaten nach der Bekanntmachung zu diesem Zweck bei ihm melden."
    },
    {
      "date": "2025-10-15",
      "id": "134005",
      "original_text": "Registerbekanntmachung nach dem Umwandlungsgesetz\nBaden-Württemberg Amtsgericht Stuttgart HRB 243356\nenthus GmbH – Böblingen",
      "type": "Registerbekanntmachung nach dem Umwandlungsgesetz",
      "state": "Baden-Württemberg",
      "amtsgericht": "Amtsgericht Stuttgart",
      "registernummer": "HRB 243356",
      "registerart": "HRB",
      "company_name": "enthus GmbH",
      "company_seat": "Böblingen",
      "details": "15.10.2025 (Bekanntmachungsdatum)\n\nBaden-Württemberg Amtsgericht Stuttgart HRB 243356\nRegisterbekanntmachung nach dem Umwandlungsgesetz 15.10.2025 (Eintragungsdatum)\n\nenthus GmbH\nGesellschaft mit beschränkter Haftung\nBöblingen\n\nAls nicht eingetragen wird bekanntgemacht:\nDen Gläubigern der an der Verschmelzung beteiligten Rechtsträger ist, wenn sie binnen sechs Monaten nach dem Tag, an dem die Eintragung der Verschmelzung in das Register des Sitzes desjenigen Rechtsträgers, dessen Gläubiger sie sind, nach § 19 Abs. 3 UmwG als bekanntgemacht gilt, ihren Anspruch nach Grund und Höhe schriftlich anmelden, Sicherheit zu leisten, soweit sie nicht Befriedigung verlangen können. Dieses Recht steht den Gläubigern jedoch nur zu, wenn sie glaubhaft machen, dass durch die Verschmelzung die Erfüllung ihrer Forderung gefährdet wird."
    },
    {
      "date": "2025-10-15",
      "id": "134006",
      "original_text": "Registerbekanntmachung nach dem Umwandlungsgesetz\nBrandenburg Amtsgericht Frankfurt/Oder HRB 21752\nNaturwert Gebäudedienste GmbH – Frankfurt (Oder)",
      "type": "Registerbekanntmachung nach dem Umwandlungsgesetz",
      "state": "Brandenburg",
      "amtsgericht": "Amtsgericht Frankfurt/Oder",
      "registernummer": "HRB 21752",
      "registerart": "HRB",
      "company_name": "Naturwert Gebäudedienste GmbH",
      "company_seat": "Frankfurt (Oder)",
      "details": "15.10.2025 (Bekanntmachungsdatum)\n\nBrandenburg Amtsgericht Frankfurt/Oder HRB 21752\nRegisterbekanntmachung nach dem Umwandlungsgesetz 14.10.2025 (Eintragungsdatum)\n\nNaturwert Gebäudedienste GmbH\nGesellschaft mit beschränkter Haftung\nFrankfurt (Oder)\n\nZu Eintragungsnummer 3 vom 14.10.2025 wird als nicht eingetragen veröffentlicht:\nDen Gläubigern der an der Spaltung beteiligten Rechtsträger ist, wenn sie binnen sechs Monaten nach dem Tag, an dem die Eintragung der Spaltung in das Register des Sitzes desjenigen Rechtsträgers, dessen Gläubiger sie sind, als bekannt gemacht gilt, ihren Anspruch nach Grund und Höhe schriftlich anmelden, Sicherheit zu leisten, soweit sie nicht Befriedigung verlangen können. Dieses Recht steht den Gläubigern jedoch nur zu, wenn sie glaubhaft machen, dass durch die Spaltung die Erfüllung ihrer Forderung gefährdet wird"
    },
    {
      "date": "2025-10-15",
      "id": "134007",
      "original_text": "Sonstige Registerbekanntmachung\nThüringen Amtsgericht Eisenach VR 311074\nGesellschaft für burschenschaftliche Geschichtsforschung e.V. (GfbG) – Eisenach",
      "type": "Sonstige Registerbekanntmachung",
      "state": "Thüringen",
      "amtsgericht": "Amtsgericht Eisenach",
      "registernummer": "VR 311074",
      "registerart": "VR",
      "company_name": "Gesellschaft für burschenschaftliche Geschichtsforschung e.V. (GfbG)",
      "company_seat": "Eisenach",
      "details": "15.10.2025 (Bekanntmachungsdatum)\n\nThüringen Amtsgericht Eisenach VR 311074\nSonstige Registerbekanntmachung 15.10.2025 (Eintragungsdatum)\n\nGesellschaft für burschenschaftliche Geschichtsforschung e.V. (GfbG)\neingetragener Verein\nEisenach"
    },
    {
      "date": "2025-10-15",
      "id": "134008",
      "original_text": "Registerbekanntmachung nach dem Umwandlungsgesetz\nThüringen Amtsgericht Jena HRA 506835\n969 Kyoto, Inh. Anh Tiên Kiêu eK – Jena",
      "type": "Registerbekanntmachung nach dem Umwandlungsgesetz",
      "state": "Thüringen",
      "amtsgericht": "Amtsgericht Jena",
      "registernummer": "HRA 506835",
      "registerart": "HRA",
      "company_name": "969 Kyoto, Inh. Anh Tiên Kiêu eK",
      "company_seat": "Jena",
      "details": "15.10.2025 (Bekanntmachungsdatum)\n\nThüringen Amtsgericht Jena HRA 506835\nRegisterbekanntmachung nach dem Umwandlungsgesetz 15.10.2025 (Eintragungsdatum)\n\n969 Kyoto, Inh. Anh Tiên Kiêu eK\nEinzelkaufmann / Einzelkauffrau\nJena\n\nNicht eingetragen: Den Gläubigern der an der Ausgliederung beteiligten Rechtsträger, ist wenn sie binnen sechs Monaten nach dem Tag, an dem die Eintragung der Ausgliederung in das Register des Sitzes desjenigen Rechtsträgers, dessen Gläubiger sie sind, nach §§125, 19 Abs. 3 UmwG als bekanntgemacht gilt, ihren Anspruch nach Grund und Höhe schriftlich anmelden, Sicherheit zu leisten, soweit sie nicht Befriedigung verlangen können. Dieses Recht steht ihnen jedoch nur zu, wenn sie glaubhaft machen, daß durch die Ausgliederung die Erfüllung ihrer Forderung gefährdet wird."
    },
    {
      "date": "2025-10-15",
      "id": "134009",
      "original_text": "Registerbekanntmachung nach dem Umwandlungsgesetz\nThüringen Amtsgericht Jena HRB 522010\n969 Kyoto GmbH – Jena",
      "type": "Registerbekanntmachung nach dem Umwandlungsgesetz",
      "state": "Thüringen",
      "amtsgericht": "Amtsgericht Jena",
      "registernummer": "HRB 522010",
      "registerart": "HRB",
      "company_name": "969 Kyoto GmbH",
      "company_seat": "Jena",
      "details": "15.10.2025 (Bekanntmachungsdatum)\n\nThüringen Amtsgericht Jena HRB 522010\nRegisterbekanntmachung nach dem Umwandlungsgesetz 15.10.2025 (Eintragungsdatum)\n\n969 Kyoto GmbH\nGesellschaft mit beschränkter Haftung\nJena\n\nNicht eingetragen: Den Gläubigern der an der Ausgliederung beteiligten Rechtsträger, ist wenn sie binnen sechs Monaten nach dem Tag, an dem die Eintragung der Ausgliederung in das Register des Sitzes desjenigen Rechtsträgers, dessen Gläubiger sie sind, nach §§125, 19 Abs. 3 UmwG als bekanntgemacht gilt, ihren Anspruch nach Grund und Höhe schriftlich anmelden, Sicherheit zu leisten, soweit sie nicht Befriedigung verlangen können. Dieses Recht steht ihnen jedoch nur zu, wenn sie glaubhaft machen, daß durch die Ausgliederung die Erfüllung ihrer Forderung gefährdet wird."
    },
    {
      "date": "2025-10-15",
      "id": "134010",
      "original_text": "Sonstige Registerbekanntmachung\nBaden-Württemberg Amtsgericht Freiburg GnR 700169\nVerbund der Fairsicherungsläden eG. – Freiburg im Breisgau",
      "type": "Sonstige Registerbekanntmachung",
      "state": "Baden-Württemberg",
      "amtsgericht": "Amtsgericht Freiburg",
      "registernummer": "GnR 700169",
      "registerart": "GnR",
      "company_name": "Verbund der Fairsicherungsläden eG.",
      "company_seat": "Freiburg im Breisgau",
      "details": "15.10.2025 (Bekanntmachungsdatum)\n\nBaden-Württemberg Amtsgericht Freiburg GnR 700169\nSonstige Registerbekanntmachung 15.10.2025 (Eintragungsdatum)\n\nVerbund der Fairsicherungsläden eG.\neingetragene Genossenschaft\nFreiburg im Breisgau\n\nDie Verpflichtung der Genossen, Nachschüsse zur Insolvenzmasse zu leisten, wurde aufgehoben. Den Gläubigern der Genossenschaft ist, wenn sie sich binnen sechs Monaten nach der Bekanntmachung bei der Genossenschaft zu diesem Zweck melden, Sicherheit zu leisten, soweit sie nicht Befriedigung verlangen können."
    },
    {
      "date": "2025-10-15",
      "id": "134011",
      "original_text": "Registerbekanntmachung nach dem Umwandlungsgesetz\nHamburg Amtsgericht Hamburg HRA 126920\nMabanol Schmierstoffe GmbH & Co. KG – Hamburg",
      "type": "Registerbekanntmachung nach dem Umwandlungsgesetz",
      "state": "Hamburg",
      "amtsgericht": "Amtsgericht Hamburg",
      "registernummer": "HRA 126920",
      "registerart": "HRA",
      "company_name": "Mabanol Schmierstoffe GmbH & Co. KG",
      "company_seat": "Hamburg",
      "details": "15.10.2025 (Bekanntmachungsdatum)\n\nHamburg Amtsgericht Hamburg HRA 126920\nRegisterbekanntmachung nach dem Umwandlungsgesetz 15.10.2025 (Eintragungsdatum)\n\nMabanol Schmierstoffe GmbH & Co. KG\nKommanditgesellschaft\nHamburg\n\nAls nicht eingetragen wird bekannt gemacht:\nDen Gläubigern der an der Abspaltung beteiligten Gesellschaften ist, wenn sie binnen sechs Monaten nach dem Tag, an dem die Eintragung der Abspaltung in das Register des Sitzes desjenigen Rechtsträgers, dessen Gläubiger sie sind, nach § 19 Absatz 3 UmwG als bekannt gemacht gilt, ihren Anspruch nach Grund und Höhe schriftlich anmelden, Sicherheit zu leisten, soweit sie nicht Befriedigung verlangen können. Dieses Recht steht den Gläubigern jedoch nur zu, wenn sie glaubhaft machen, dass durch die Abspaltung die Erfüllung ihrer Forderung gefährdet wird."
    },
    {
      "date": "2025-10-15",
      "id": "134012",
      "original_text": "Löschungsankündigung\nSchleswig-Holstein Amtsgericht Flensburg HRB 10118\nIJW Anlagenbau GmbH – Flensburg",
      "type": "Löschungsankündigung",
      "state": "Schleswig-Holstein",
      "amtsgericht": "Amtsgericht Flensburg",
      "registernummer": "HRB 10118",
      "registerart": "HRB",
      "company_name": "IJW Anlagenbau GmbH",
      "company_seat": "Flensburg",
      "details": "15.10.2025 (Bekanntmachungsdatum)\n\nSchleswig-Holstein Amtsgericht Flensburg HRB 10118\nLöschungsankündigung\n\nIJW Anlagenbau GmbH\nGesellschaft mit beschränkter Haftung\nFlensburg\n\nEs ist die Löschung der nachstehenden Gesellschaft wegen Vermögenslosigkeit gemäß § 394 FamFG beabsichtigt.\nWiderspruchsfrist: 2 Monate"
    },
    {
      "date": "2025-10-15",
      "id": "134013",
      "original_text": "Registerbekanntmachung nach dem Umwandlungsgesetz\nBerlin Amtsgericht Berlin (Charlottenburg) HRB 280102\nPFM Intelligence GmbH – Berlin",
      "type": "Registerbekanntmachung nach dem Umwandlungsgesetz",
      "state": "Berlin",
      "amtsgericht": "Amtsgericht Berlin (Charlottenburg)",
      "registernummer": "HRB 280102",
      "registerart": "HRB",
      "company_name": "PFM Intelligence GmbH",
      "company_seat": "Berlin",
      "details": "15.10.2025 (Bekanntmachungsdatum)\n\nBerlin Amtsgericht Berlin (Charlottenburg) HRB 280102\nRegisterbekanntmachung nach dem Umwandlungsgesetz 13.10.2025 (Eintragungsdatum)\n\nPFM Intelligence GmbH\nGesellschaft mit beschränkter Haftung\nBerlin\n\nZu Eintragungsnummer 1 vom 13.10.2025 wird als nicht eingetragen veröffentlicht:Den Gläubigern der an der Spaltung beteiligten Rechtsträger ist, wenn sie binnen sechs Monaten nach dem Tag, an dem die Eintragung der Spaltung in das Register des Sitzes desjenigen Rechtsträgers, dessen Gläubiger sie sind, als bekannt gemacht gilt, ihren Anspruch nach Grund und Höhe schriftlich anmelden, Sicherheit zu leisten, soweit sie nicht Befriedigung verlangen können. Dieses Recht steht den Gläubigern jedoch nur zu, wenn sie glaubhaft machen, dass durch die Spaltung die Erfüllung ihrer Forderung gefährdet wird. Das Recht, Sicherheitsleistung zu verlangen, steht Gläubigern nicht zu, die im Falle der Insolvenz ein Recht auf vorzugsweise Befriedigung aus einer Deckungsmasse haben, die nach gesetzlicher Vorschrift zu ihrem Schutz errichtet und staatlich überwacht ist."
    },
    {
      "date": "2025-10-15",
      "id": "134014",
      "original_text": "Löschungsankündigung\nBrandenburg Amtsgericht Potsdam HRB 37580\nFlorascape UG (haftungsbeschränkt) – Niederer Fläming",
      "type": "Löschungsankündigung",
      "state": "Brandenburg",
      "amtsgericht": "Amtsgericht Potsdam",
      "registernummer": "HRB 37580",
      "registerart": "HRB",
      "company_name": "Florascape UG (haftungsbeschränkt)",
      "company_seat": "Niederer Fläming",
      "details": "15.10.2025 (Bekanntmachungsdatum)\n\nBrandenburg Amtsgericht Potsdam HRB 37580\nLöschungsankündigung\n\nFlorascape UG (haftungsbeschränkt)\nGesellschaft mit beschränkter Haftung\nNiederer Fläming\n\nBei der nachstehenden Gesellschaft wird das Amtslöschungsverfahren gemäß § 394 FamFG eingeleitet. Widerspruchsfrist: 8 Wochen."
    },
    {
      "date": "2025-10-15",
      "id": "134015",
      "original_text": "Registerbekanntmachung nach dem Umwandlungsgesetz\nBerlin Amtsgericht Berlin (Charlottenburg) HRB 28251\nDilax Intelcom GmbH – Berlin",
      "type": "Registerbekanntmachung nach dem Umwandlungsgesetz",
      "state": "Berlin",
      "amtsgericht": "Amtsgericht Berlin (Charlottenburg)",
      "registernummer": "HRB 28251",
      "registerart": "HRB",
      "company_name": "Dilax Intelcom GmbH",
      "company_seat": "Berlin",
      "details": "15.10.2025 (Bekanntmachungsdatum)\n\nBerlin Amtsgericht Berlin (Charlottenburg) HRB 28251\nRegisterbekanntmachung nach dem Umwandlungsgesetz 13.10.2025 (Eintragungsdatum)\n\nDilax Intelcom GmbH\nGesellschaft mit beschränkter Haftung\nBerlin\n\nZu Eintragungsnummer 29 vom 13.10.2025 wird als nicht eingetragen veröffentlicht:Den Gläubigern der an der Spaltung beteiligten Rechtsträger ist, wenn sie binnen sechs Monaten nach dem Tag, an dem die Eintragung der Spaltung in das Register des Sitzes desjenigen Rechtsträgers, dessen Gläubiger sie sind, als bekannt gemacht gilt, ihren Anspruch nach Grund und Höhe schriftlich anmelden, Sicherheit zu leisten, soweit sie nicht Befriedigung verlangen können. Dieses Recht steht den Gläubigern jedoch nur zu, wenn sie glaubhaft machen, dass durch die Spaltung die Erfüllung ihrer Forderung gefährdet wird. Das Recht, Sicherheitsleistung zu verlangen, steht Gläubigern nicht zu, die im Falle der Insolvenz ein Recht auf vorzugsweise Befriedigung aus einer Deckungsmasse haben, die nach gesetzlicher Vorschrift zu ihrem Schutz errichtet und staatlich überwacht ist."
    },
    {
      "date": "2025-10-15",
      "id": "134016",
      "original_text": "Löschungsankündigung\nSchleswig-Holstein Amtsgericht Pinneberg HRB 14227\nBauausführungen Cetkin UG (haftungsbeschränkt) – Wedel",
      "type": "Löschungsankündigung",
      "state": "Schleswig-Holstein",
      "amtsgericht": "Amtsgericht Pinneberg",
      "registernummer": "HRB 14227",
      "registerart": "HRB",
      "company_name": "Bauausführungen Cetkin UG (haftungsbeschränkt)",
      "company_seat": "Wedel",
      "details": "15.10.2025 (Bekanntmachungsdatum)\n\nSchleswig-Holstein Amtsgericht Pinneberg HRB 14227\nLöschungsankündigung\n\nBauausführungen Cetkin UG (haftungsbeschränkt)\nGesellschaft mit beschränkter Haftung\nWedel\n\nEs ist die Löschung der nachstehenden Gesellschaft wegen Vermögenslosigkeit gemäß § 394 FamFG beabsichtigt. Widerspruchsfrist: 2 Monate."
    },
    {
      "date": "2025-10-15",
      "id": "134017",
      "original_text": "Einreichung neuer Dokumente\nBerlin Amtsgericht Berlin (Charlottenburg) HRB 78448\nDeutsche Energie-Agentur GmbH (dena) – Berlin",
      "type": "Einreichung neuer Dokumente",
      "state": "Berlin",
      "amtsgericht": "Amtsgericht Berlin (Charlottenburg)",
      "registernummer": "HRB 78448",
      "registerart": "HRB",
      "company_name": "Deutsche Energie-Agentur GmbH (dena)",
      "company_seat": "Berlin",
      "details": "15.10.2025 (Bekanntmachungsdatum)\n\nBerlin Amtsgericht Berlin (Charlottenburg) HRB 78448\nEinreichung neuer Dokumente\n\nDeutsche Energie-Agentur GmbH (dena)\nGesellschaft mit beschränkter Haftung\nBerlin\n\nAls nicht eingetragen wird veröffentlicht: Es wurde eine neue Liste der Aufsichtsratsmitglieder eingereicht (§52 GmbHG)."
    },
    {
      "date": "2025-10-15",
      "id": "134018",
      "original_text": "Registerbekanntmachung nach dem Umwandlungsgesetz\nBerlin Amtsgericht Berlin (Charlottenburg) HRA 55740\nBT & UT Family Trust GmbH & Co. KG – Berlin",
      "type": "Registerbekanntmachung nach dem Umwandlungsgesetz",
      "state": "Berlin",
      "amtsgericht": "Amtsgericht Berlin (Charlottenburg)",
      "registernummer": "HRA 55740",
      "registerart": "HRA",
      "company_name": "BT & UT Family Trust GmbH & Co. KG",
      "company_seat": "Berlin",
      "details": "15.10.2025 (Bekanntmachungsdatum)\n\nBerlin Amtsgericht Berlin (Charlottenburg) HRA 55740\nRegisterbekanntmachung nach dem Umwandlungsgesetz 14.10.2025 (Eintragungsdatum)\n\nBT & UT Family Trust GmbH & Co. KG\nKommanditgesellschaft\nBerlin\n\nZu Eintragungsnummer 7 vom 14.10.2025 wird als nicht eingetragen veröffentlicht: Den Gläubigern der an der Verschmelzung beteiligten Rechtsträger ist, wenn sie binnen sechs Monaten nach dem Tag, an dem die Eintragung der Verschmelzung in das Register des Sitzes desjenigen Rechtsträgers, dessen Gläubiger sie sind, als bekannt gemacht gilt, ihren Anspruch nach Grund und Höhe schriftlich anmelden, Sicherheit zu leisten, soweit sie nicht Befriedigung verlangen können. Dieses Recht steht den Gläubigern jedoch nur zu, wenn sie glaubhaft machen, dass durch die Verschmelzung die Erfüllung ihrer Forderung gefährdet wird. Das Recht, Sicherheitsleistung zu verlangen, steht Gläubigern nicht zu, die im Falle der Insolvenz ein Recht auf vorzugsweise Befriedigung aus einer Deckungsmasse haben, die nach gesetzlicher Vorschrift zu ihrem Schutz errichtet und staatlich überwacht ist."
    },
    {
      "date": "2025-10-15",
      "id": "134019",
      "original_text": "Löschungsankündigung\nSchleswig-Holstein Amtsgericht Flensburg HRB 15320\nEK Vermietungs GmbH – Lexgaard",
      "type": "Löschungsankündigung",
      "state": "Schleswig-Holstein",
      "amtsgericht": "Amtsgericht Flensburg",
      "registernummer": "HRB 15320",
      "registerart": "HRB",
      "company_name": "EK Vermietungs GmbH",
      "company_seat": "Lexgaard",
      "details": "15.10.2025 (Bekanntmachungsdatum)\n\nSchleswig-Holstein Amtsgericht Flensburg HRB 15320\nLöschungsankündigung\n\nEK Vermietungs GmbH\nGesellschaft mit beschränkter Haftung\nLexgaard\n\nEs ist die Löschung der nachstehenden Gesellschaft wegen Vermögenslosigkeit gemäß § 394 FamFG beabsichtigt.\nWiderspruchsfrist: 2 Monate"
    },
    {
      "date": "2025-10-15",
      "id": "134020",
      "original_text": "Einreichung neuer Dokumente\nBaden-Württemberg Amtsgericht Freiburg HRB 728548\nKörber Supply Chain Logistics GmbH – Konstanz",
      "type": "Einreichung neuer Dokumente",
      "state": "Baden-Württemberg",
      "amtsgericht": "Amtsgericht Freiburg",
      "registernummer": "HRB 728548",
      "registerart": "HRB",
      "company_name": "Körber Supply Chain Logistics GmbH",
      "company_seat": "Konstanz",
      "details": "15.10.2025 (Bekanntmachungsdatum)\n\nBaden-Württemberg Amtsgericht Freiburg HRB 728548\nEinreichung neuer Dokumente 15.10.2025 (Eintragungsdatum)\n\nKörber Supply Chain Logistics GmbH\nGesellschaft mit beschränkter Haftung\nKonstanz\n\nAls nicht eingetragen wird bekanntgemacht:\nDie Gesellschaft hat am 14.10.2025 die Liste über die Zusammensetzung des Aufsichtsrats zum Handelsregister eingereicht."
    },
    {
      "date": "2025-10-15",
      "id": "134021",
      "original_text": "Registerbekanntmachung nach dem Umwandlungsgesetz\nBerlin Amtsgericht Berlin (Charlottenburg) HRA 55703\nTimm Generations Holding GmbH & Co. KG – Berlin",
      "type": "Registerbekanntmachung nach dem Umwandlungsgesetz",
      "state": "Berlin",
      "amtsgericht": "Amtsgericht Berlin (Charlottenburg)",
      "registernummer": "HRA 55703",
      "registerart": "HRA",
      "company_name": "Timm Generations Holding GmbH & Co. KG",
      "company_seat": "Berlin",
      "details": "15.10.2025 (Bekanntmachungsdatum)\n\nBerlin Amtsgericht Berlin (Charlottenburg) HRA 55703\nRegisterbekanntmachung nach dem Umwandlungsgesetz 14.10.2025 (Eintragungsdatum)\n\nTimm Generations Holding GmbH & Co. KG\nKommanditgesellschaft\nBerlin\n\nZu Eintragungsnummer 7 vom 14.10.2025 wird als nicht eingetragen veröffentlicht: Den Gläubigern der an der Verschmelzung beteiligten Rechtsträger ist, wenn sie binnen sechs Monaten nach dem Tag, an dem die Eintragung der Verschmelzung in das Register des Sitzes desjenigen Rechtsträgers, dessen Gläubiger sie sind, als bekannt gemacht gilt, ihren Anspruch nach Grund und Höhe schriftlich anmelden, Sicherheit zu leisten, soweit sie nicht Befriedigung verlangen können. Dieses Recht steht den Gläubigern jedoch nur zu, wenn sie glaubhaft machen, dass durch die Verschmelzung die Erfüllung ihrer Forderung gefährdet wird. Das Recht, Sicherheitsleistung zu verlangen, steht Gläubigern nicht zu, die im Falle der Insolvenz ein Recht auf vorzugsweise Befriedigung aus einer Deckungsmasse haben, die nach gesetzlicher Vorschrift zu ihrem Schutz errichtet und staatlich überwacht ist."
    },
    {
      "date": "2025-10-15",
      "id": "134022",
      "original_text": "Löschungsankündigung\nBaden-Württemberg Amtsgericht Stuttgart HRB 721176\nNC-Technik Limited – Ohmden",
      "type": "Löschungsankündigung",
      "state": "Baden-Württemberg",
      "amtsgericht": "Amtsgericht Stuttgart",
      "registernummer": "HRB 721176",
      "registerart": "HRB",
      "company_name": "NC-Technik Limited",
      "company_seat": "Ohmden",
      "details": "15.10.2025 (Bekanntmachungsdatum)\n\nBaden-Württemberg Amtsgericht Stuttgart HRB 721176\nLöschungsankündigung\n\nNC-Technik Limited\nRechtsform ausländischen Rechts HRB\nOhmden\n\nDas Gericht beabsichtigt, die Eintragung der Gesellschaft im Handelsregister wegen des Mangels einer wesentlichen Voraussetzung von Amts wegen nach § 395 FamFG als unzulässig zu löschen. Die Frist zur Geltendmachung eines Widerspruchs gegen die beabsichtigte Löschung ist auf einen Monat ab Veröffentlichung bestimmt."
    },
    {
      "date": "2025-10-15",
      "id": "134023",
      "original_text": "Registerbekanntmachung nach dem Umwandlungsgesetz\nSachsen-Anhalt Amtsgericht Stendal HRB 27981\nG+L Energieeffizienz GmbH – Magdeburg",
      "type": "Registerbekanntmachung nach dem Umwandlungsgesetz",
      "state": "Sachsen-Anhalt",
      "amtsgericht": "Amtsgericht Stendal",
      "registernummer": "HRB 27981",
      "registerart": "HRB",
      "company_name": "G+L Energieeffizienz GmbH",
      "company_seat": "Magdeburg",
      "details": "15.10.2025 (Bekanntmachungsdatum)\n\nSachsen-Anhalt Amtsgericht Stendal HRB 27981\nRegisterbekanntmachung nach dem Umwandlungsgesetz 15.10.2025 (Eintragungsdatum)\n\nG+L Energieeffizienz GmbH\nGesellschaft mit beschränkter Haftung\nMagdeburg\n\nNicht eingetragen:\nDen Gläubigern der an der Verschmelzung beteiligten Rechtsträger ist, wenn sie binnen sechs Monaten nach dem Tag, an dem die Eintragung der Verschmelzung nach § 19 Abs. 3 UmwG als bekanntgemacht gilt, ihren Anspruch nach Grund und Höhe schriftlich anmelden, Sicherheit zu leisten, soweit sie nicht Befriedigung verlangen können. Dieses Recht steht ihnen jedoch nur zu, wenn sie glaubhaft machen, dass durch die Verschmelzung die Erfüllung ihrer Forderung gefährdet wird."
    },
    {
      "date": "2025-10-15",
      "id": "134024",
      "original_text": "Registerbekanntmachung nach dem Umwandlungsgesetz\nSachsen-Anhalt Amtsgericht Stendal HRB 24651\nGETEC Wärme & Effizienz GmbH – Magdeburg",
      "type": "Registerbekanntmachung nach dem Umwandlungsgesetz",
      "state": "Sachsen-Anhalt",
      "amtsgericht": "Amtsgericht Stendal",
      "registernummer": "HRB 24651",
      "registerart": "HRB",
      "company_name": "GETEC Wärme & Effizienz GmbH",
      "company_seat": "Magdeburg",
      "details": "15.10.2025 (Bekanntmachungsdatum)\n\nSachsen-Anhalt Amtsgericht Stendal HRB 24651\nRegisterbekanntmachung nach dem Umwandlungsgesetz 15.10.2025 (Eintragungsdatum)\n\nGETEC Wärme & Effizienz GmbH\nGesellschaft mit beschränkter Haftung\nMagdeburg\n\nNicht eingetragen:\nDen Gläubigern der an der Verschmelzung beteiligten Rechtsträger ist, wenn sie binnen sechs Monaten nach dem Tag, an dem die Eintragung der Verschmelzung nach § 19 Abs. 3 UmwG als bekanntgemacht gilt, ihren Anspruch nach Grund und Höhe schriftlich anmelden, Sicherheit zu leisten, soweit sie nicht Befriedigung verlangen können. Dieses Recht steht ihnen jedoch nur zu, wenn sie glaubhaft machen, dass durch die Verschmelzung die Erfüllung ihrer Forderung gefährdet wird."
    },
    {
      "date": "2025-10-15",
      "id": "134025",
      "original_text": "Registerbekanntmachung nach dem Umwandlungsgesetz\nSachsen-Anhalt Amtsgericht Stendal HRB 19423\nTaurus Union GmbH – Sangerhausen",
      "type": "Registerbekanntmachung nach dem Umwandlungsgesetz",
      "state": "Sachsen-Anhalt",
      "amtsgericht": "Amtsgericht Stendal",
      "registernummer": "HRB 19423",
      "registerart": "HRB",
      "company_name": "Taurus Union GmbH",
      "company_seat": "Sangerhausen",
      "details": "15.10.2025 (Bekanntmachungsdatum)\n\nSachsen-Anhalt Amtsgericht Stendal HRB 19423\nRegisterbekanntmachung nach dem Umwandlungsgesetz 15.10.2025 (Eintragungsdatum)\n\nTaurus Union GmbH\nGesellschaft mit beschränkter Haftung\nSangerhausen\n\nDie Gesellschaft ist auf Grund des Verschmelzungsvertrages vom 10.07.2025 mit Nachtrag vom 04.09.2025 sowie der Beschlüsse der Gesellschafterversammlungen vom 10.07.2025 mit der Servicecenter-Mitteldeutschland GmbH mit dem Sitz in Sangerhausen (Amtsgericht Stendal HRB 19659) verschmolzen. Die Verschmelzung ist mit der Eintragung der Verschmelzung in das Handelsregister der übernehmenden Gesellschaft am 15.10.2025 wirksam geworden.Nicht eingetragen: Den Gläubigern der an der Verschmelzung beteiligten Rechtsträger ist, wenn sie binnen sechs Monaten nach dem Tag, an dem die Eintragung der Verschmelzung nach § 19 Abs. 3 UmwG als bekanntgemacht gilt, ihren Anspruch nach Grund und Höhe schriftlich anmelden, Sicherheit zu leisten, soweit sie nicht Befriedigung verlangen können. Dieses Recht steht ihnen jedoch nur zu, wenn sie glaubhaft machen, dass durch die Verschmelzung die Erfüllung ihrer Forderung gefährdet wird."
    },
    {
      "date": "2025-10-15",
      "id": "134026",
      "original_text": "Registerbekanntmachung nach dem Umwandlungsgesetz\nSachsen-Anhalt Amtsgericht Stendal HRB 28601\nG + M energy efficiency GmbH – Magdeburg",
      "type": "Registerbekanntmachung nach dem Umwandlungsgesetz",
      "state": "Sachsen-Anhalt",
      "amtsgericht": "Amtsgericht Stendal",
      "registernummer": "HRB 28601",
      "registerart": "HRB",
      "company_name": "G + M energy efficiency GmbH",
      "company_seat": "Magdeburg",
      "details": "15.10.2025 (Bekanntmachungsdatum)\n\nSachsen-Anhalt Amtsgericht Stendal HRB 28601\nRegisterbekanntmachung nach dem Umwandlungsgesetz 15.10.2025 (Eintragungsdatum)\n\nG + M energy efficiency GmbH\nGesellschaft mit beschränkter Haftung\nMagdeburg\n\nNicht eingetragen:\nDen Gläubigern der an der Verschmelzung beteiligten Rechtsträger ist, wenn sie binnen sechs Monaten nach dem Tag, an dem die Eintragung der Verschmelzung nach § 19 Abs. 3 UmwG als bekanntgemacht gilt, ihren Anspruch nach Grund und Höhe schriftlich anmelden, Sicherheit zu leisten, soweit sie nicht Befriedigung verlangen können. Dieses Recht steht ihnen jedoch nur zu, wenn sie glaubhaft machen, dass durch die Verschmelzung die Erfüllung ihrer Forderung gefährdet wird."
    },
    {
      "date": "2025-10-15",
      "id": "134027",
      "original_text": "Registerbekanntmachung nach dem Umwandlungsgesetz\nSachsen-Anhalt Amtsgericht Stendal HRB 24651\nGETEC Wärme & Effizienz GmbH – Magdeburg",
      "type": "Registerbekanntmachung nach dem Umwandlungsgesetz",
      "state": "Sachsen-Anhalt",
      "amtsgericht": "Amtsgericht Stendal",
      "registernummer": "HRB 24651",
      "registerart": "HRB",
      "company_name": "GETEC Wärme & Effizienz GmbH",
      "company_seat": "Magdeburg",
      "details": "15.10.2025 (Bekanntmachungsdatum)\n\nSachsen-Anhalt Amtsgericht Stendal HRB 24651\nRegisterbekanntmachung nach dem Umwandlungsgesetz 15.10.2025 (Eintragungsdatum)\n\nGETEC Wärme & Effizienz GmbH\nGesellschaft mit beschränkter Haftung\nMagdeburg\n\nNicht eingetragen:\nDen Gläubigern der an der Verschmelzung beteiligten Rechtsträger ist, wenn sie binnen sechs Monaten nach dem Tag, an dem die Eintragung der Verschmelzung nach § 19 Abs. 3 UmwG als bekanntgemacht gilt, ihren Anspruch nach Grund und Höhe schriftlich anmelden, Sicherheit zu leisten, soweit sie nicht Befriedigung verlangen können. Dieses Recht steht ihnen jedoch nur zu, wenn sie glaubhaft machen, dass durch die Verschmelzung die Erfüllung ihrer Forderung gefährdet wird."
    },
    {
      "date": "2025-10-15",
      "id": "134028",
      "original_text": "Registerbekanntmachung nach dem Umwandlungsgesetz\nSachsen-Anhalt Amtsgericht Stendal HRB 19659\nServicecenter-Mitteldeutschland GmbH – Sangerhausen",
      "type": "Registerbekanntmachung nach dem Umwandlungsgesetz",
      "state": "Sachsen-Anhalt",
      "amtsgericht": "Amtsgericht Stendal",
      "registernummer": "HRB 19659",
      "registerart": "HRB",
      "company_name": "Servicecenter-Mitteldeutschland GmbH",
      "company_seat": "Sangerhausen",
      "details": "15.10.2025 (Bekanntmachungsdatum)\n\nSachsen-Anhalt Amtsgericht Stendal HRB 19659\nRegisterbekanntmachung nach dem Umwandlungsgesetz 15.10.2025 (Eintragungsdatum)\n\nServicecenter-Mitteldeutschland GmbH\nGesellschaft mit beschränkter Haftung\nSangerhausen\n\nDie Taurus Union GmbH mit dem Sitz in Sangerhausen (Amtsgericht Stendal HRB 19423) ist aufgrund des Verschmelzungsvertrages vom 10.07.2025 mit Nachtrag vom 04.09.2025 und der Beschlüsse der Gesellschafterversammlungen vom 10.07.2025 mit der Gesellschaft verschmolzen.Nicht eingetragen: Den Gläubigern der an der Verschmelzung beteiligten Rechtsträger ist, wenn sie binnen sechs Monaten nach dem Tag, an dem die Eintragung der Verschmelzung nach § 19 Abs. 3 UmwG als bekanntgemacht gilt, ihren Anspruch nach Grund und Höhe schriftlich anmelden, Sicherheit zu leisten, soweit sie nicht Befriedigung verlangen können. Dieses Recht steht ihnen jedoch nur zu, wenn sie glaubhaft machen, dass durch die Verschmelzung die Erfüllung ihrer Forderung gefährdet wird."
    },
    {
      "date": "2025-10-15",
      "id": "134029",
      "original_text": "Registerbekanntmachung nach dem Umwandlungsgesetz\nSachsen-Anhalt Amtsgericht Stendal HRB 28467\nGETEC smart energy GmbH – Magdeburg",
      "type": "Registerbekanntmachung nach dem Umwandlungsgesetz",
      "state": "Sachsen-Anhalt",
      "amtsgericht": "Amtsgericht Stendal",
      "registernummer": "HRB 28467",
      "registerart": "HRB",
      "company_name": "GETEC smart energy GmbH",
      "company_seat": "Magdeburg",
      "details": "15.10.2025 (Bekanntmachungsdatum)\n\nSachsen-Anhalt Amtsgericht Stendal HRB 28467\nRegisterbekanntmachung nach dem Umwandlungsgesetz 15.10.2025 (Eintragungsdatum)\n\nGETEC smart energy GmbH\nGesellschaft mit beschränkter Haftung\nMagdeburg\n\nDie Gesellschaft ist auf Grund des Verschmelzungsvertrages vom 15.08.2025 sowie der Beschlüsse der Gesellschafterversammlungen vom selben Tag mit der GETEC Wärme & Effizienz GmbH mit dem Sitz in Magdeburg (Amtsgericht Stendal HRB 24651) verschmolzen. Die Verschmelzung wurde am 15.10.2025 in das Handelsregister der übernehmenden Gesellschaft eingetragen. Nicht eingetragen: Den Gläubigern der an der Verschmelzung beteiligten Rechtsträger ist, wenn sie binnen sechs Monaten nach dem Tag, an dem die Eintragung der Verschmelzung nach § 19 Abs. 3 UmwG als bekanntgemacht gilt, ihren Anspruch nach Grund und Höhe schriftlich anmelden, Sicherheit zu leisten, soweit sie nicht Befriedigung verlangen können. Dieses Recht steht ihnen jedoch nur zu, wenn sie glaubhaft machen, dass durch die Verschmelzung die Erfüllung ihrer Forderung gefährdet wird."
    },
    {
      "date": "2025-10-15",
      "id": "134030",
      "original_text": "Registerbekanntmachung nach dem Umwandlungsgesetz\nSachsen-Anhalt Amtsgericht Stendal HRB 24651\nGETEC Wärme & Effizienz GmbH – Magdeburg",
      "type": "Registerbekanntmachung nach dem Umwandlungsgesetz",
      "state": "Sachsen-Anhalt",
      "amtsgericht": "Amtsgericht Stendal",
      "registernummer": "HRB 24651",
      "registerart": "HRB",
      "company_name": "GETEC Wärme & Effizienz GmbH",
      "company_seat": "Magdeburg",
      "details": "15.10.2025 (Bekanntmachungsdatum)\n\nSachsen-Anhalt Amtsgericht Stendal HRB 24651\nRegisterbekanntmachung nach dem Umwandlungsgesetz 15.10.2025 (Eintragungsdatum)\n\nGETEC Wärme & Effizienz GmbH\nGesellschaft mit beschränkter Haftung\nMagdeburg\n\nDie GETEC smart energy GmbH mit dem Sitz in Magdeburg (Amtsgericht Stendal HRB 28467) ist auf Grund des Verschmelzungsvertrages vom 15.08.2025    und der Beschlüsse der Gesellschafterversammlungen vom selben Tag mit der Gesellschaft verschmolzen.Nicht eingetragen: Den Gläubigern der an der Verschmelzung beteiligten Rechtsträger ist, wenn sie binnen sechs Monaten nach dem Tag, an dem die Eintragung der Verschmelzung nach § 19 Abs. 3 UmwG als bekanntgemacht gilt, ihren Anspruch nach Grund und Höhe schriftlich anmelden, Sicherheit zu leisten, soweit sie nicht Befriedigung verlangen können. Dieses Recht steht ihnen jedoch nur zu, wenn sie glaubhaft machen, dass durch die Verschmelzung die Erfüllung ihrer Forderung gefährdet wird."
    },
    {
      "date": "2025-10-15",
      "id": "134031",
      "original_text": "Registerbekanntmachung nach dem Umwandlungsgesetz\nSaarland Amtsgericht Saarbrücken HRA 13518\nYachthafen Merzig Inh. Harald Schäfer e.K. – Merzig",
      "type": "Registerbekanntmachung nach dem Umwandlungsgesetz",
      "state": "Saarland",
      "amtsgericht": "Amtsgericht Saarbrücken",
      "registernummer": "HRA 13518",
      "registerart": "HRA",
      "company_name": "Yachthafen Merzig Inh. Harald Schäfer e.K.",
      "company_seat": "Merzig",
      "details": "15.10.2025 (Bekanntmachungsdatum)\n\nSaarland Amtsgericht Saarbrücken HRA 13518\nRegisterbekanntmachung nach dem Umwandlungsgesetz 15.10.2025 (Eintragungsdatum)\n\nYachthafen Merzig Inh. Harald Schäfer e.K.\nEinzelkaufmann / Einzelkauffrau\nMerzig\n\nAls nicht eingetragen wird bekannt gemacht: Den Gläubigern der an der Ausgliederung beteiligten Gesellschaften ist, wenn sie binnen sechs Monaten nach dem Tag, an dem die Eintragung der Ausgliederung in das Register des Sitzes desjenigen Rechtsträgers, dessen Gläubiger sie sind, nach § 19 Absatz 3 UmwG bekannt gemacht worden ist, ihren Anspruch nach Grund und Höhe schriftlich anmelden, Sicherheit zu leisten, soweit sie nicht Befriedigung verlangen können. Dieses Recht steht den Gläubigern jedoch nur zu, wenn sie glaubhaft machen, dass durch die Ausgliederung die Erfüllung ihrer Forderung gefährdet wird."
    },
    {
      "date": "2025-10-15",
      "id": "134032",
      "original_text": "Registerbekanntmachung nach dem Umwandlungsgesetz\nSaarland Amtsgericht Saarbrücken HRB 103484\nIndustrieservice Schäfer GmbH – Illingen",
      "type": "Registerbekanntmachung nach dem Umwandlungsgesetz",
      "state": "Saarland",
      "amtsgericht": "Amtsgericht Saarbrücken",
      "registernummer": "HRB 103484",
      "registerart": "HRB",
      "company_name": "Industrieservice Schäfer GmbH",
      "company_seat": "Illingen",
      "details": "15.10.2025 (Bekanntmachungsdatum)\n\nSaarland Amtsgericht Saarbrücken HRB 103484\nRegisterbekanntmachung nach dem Umwandlungsgesetz 15.10.2025 (Eintragungsdatum)\n\nIndustrieservice Schäfer GmbH\nGesellschaft mit beschränkter Haftung\nIllingen\n\nAls nicht eingetragen wird bekannt gemacht: Den Gläubigern der an der Ausgliederung beteiligten Gesellschaften ist, wenn sie binnen sechs Monaten nach dem Tag, an dem die Eintragung der Ausgliederung in das Register des Sitzes desjenigen Rechtsträgers, dessen Gläubiger sie sind, nach § 19 Absatz 3 UmwG bekannt gemacht worden ist, ihren Anspruch nach Grund und Höhe schriftlich anmelden, Sicherheit zu leisten, soweit sie nicht Befriedigung verlangen können. Dieses Recht steht den Gläubigern jedoch nur zu, wenn sie glaubhaft machen, dass durch die Ausgliederung die Erfüllung ihrer Forderung gefährdet wird."
    },
    {
      "date": "2025-10-15",
      "id": "134033",
      "original_text": "Löschungsankündigung\nBerlin Amtsgericht Berlin (Charlottenburg) HRB 242558\nTREBA Bau GmbH – Berlin",
      "type": "Löschungsankündigung",
      "state": "Berlin",
      "amtsgericht": "Amtsgericht Berlin (Charlottenburg)",
      "registernummer": "HRB 242558",
      "registerart": "HRB",
      "company_name": "TREBA Bau GmbH",
      "company_seat": "Berlin",
      "details": "15.10.2025 (Bekanntmachungsdatum)\n\nBerlin Amtsgericht Berlin (Charlottenburg) HRB 242558\nLöschungsankündigung\n\nTREBA Bau GmbH\nGesellschaft mit beschränkter Haftung\nBerlin\n\nBei der nachstehenden Gesellschaft wird das Amtslöschungsverfahren gemäß § 394 FamFG eingeleitet. Widerspruchsfrist 6 Wochen"
    },
    {
      "date": "2025-10-15",
      "id": "134034",
      "original_text": "Registerbekanntmachung nach dem Umwandlungsgesetz\nSchleswig-Holstein Amtsgericht Lübeck HRB 20360\nFine Hands Immobilien GmbH – Ahrensburg",
      "type": "Registerbekanntmachung nach dem Umwandlungsgesetz",
      "state": "Schleswig-Holstein",
      "amtsgericht": "Amtsgericht Lübeck",
      "registernummer": "HRB 20360",
      "registerart": "HRB",
      "company_name": "Fine Hands Immobilien GmbH",
      "company_seat": "Ahrensburg",
      "details": "15.10.2025 (Bekanntmachungsdatum)\n\nSchleswig-Holstein Amtsgericht Lübeck HRB 20360\nRegisterbekanntmachung nach dem Umwandlungsgesetz 15.10.2025 (Eintragungsdatum)\n\nFine Hands Immobilien GmbH\nGesellschaft mit beschränkter Haftung\nAhrensburg\n\nZu Eintragungsnummer 2 vom 15.10.2025 wird als nicht eingetragen veröffentlicht:  Als nicht eingetragen wird veröffentlicht: Den Gläubigern der an der Verschmelzung beteiligten Rechtsträger ist, wenn sie binnen sechs Monaten nach dem Tag, an dem die Eintragung der Verschmelzung in das Register des Sitzes desjenigen Rechtsträgers, dessen Gläubiger sie sind, als bekannt gemacht gilt, ihren Anspruch nach Grund und Höhe schriftlich anmelden, Sicherheit zu leisten, soweit sie nicht Befriedigung verlangen können. Dieses Recht steht den Gläubigern jedoch nur zu, wenn sie glaubhaft machen, dass durch die Verschmelzung die Erfüllung ihrer Forderung gefährdet wird."
    },
    {
      "date": "2025-10-15",
      "id": "134035",
      "original_text": "Registerbekanntmachung nach dem Umwandlungsgesetz\nBaden-Württemberg Amtsgericht Stuttgart VR 726954\nlndustrieverein für den Raum Backnang e.V. – Backnang",
      "type": "Registerbekanntmachung nach dem Umwandlungsgesetz",
      "state": "Baden-Württemberg",
      "amtsgericht": "Amtsgericht Stuttgart",
      "registernummer": "VR 726954",
      "registerart": "VR",
      "company_name": "lndustrieverein für den Raum Backnang e.V.",
      "company_seat": "Backnang",
      "details": "15.10.2025 (Bekanntmachungsdatum)\n\nBaden-Württemberg Amtsgericht Stuttgart VR 726954\nRegisterbekanntmachung nach dem Umwandlungsgesetz 15.10.2025 (Eintragungsdatum)\n\nlndustrieverein für den Raum Backnang e.V.\neingetragener Verein\nBacknang\n\nAls nicht eingetragen wird bekanntgemacht:\nDen Gläubigern der an der Verschmelzung beteiligten Rechtsträger ist, wenn sie binnen sechs Monaten nach dem Tag, an dem die Eintragung der Verschmelzung in das Register des Sitzes desjenigen Rechtsträgers, dessen Gläubiger sie sind, nach § 19 Abs. 3 UmwG als bekanntgemacht gilt, ihren Anspruch nach Grund und Höhe schriftlich anmelden, Sicherheit zu leisten, soweit sie nicht Befriedigung verlangen können. Dieses Recht steht den Gläubigern jedoch nur zu, wenn sie glaubhaft machen, dass durch die Verschmelzung die Erfüllung ihrer Forderung gefährdet wird."
    },
    {
      "date": "2025-10-15",
      "id": "134036",
      "original_text": "Löschungsankündigung\nBaden-Württemberg Amtsgericht Mannheim HRB 752534\nSEN Wohnbau GmbH – Mühlacker",
      "type": "Löschungsankündigung",
      "state": "Baden-Württemberg",
      "amtsgericht": "Amtsgericht Mannheim",
      "registernummer": "HRB 752534",
      "registerart": "HRB",
      "company_name": "SEN Wohnbau GmbH",
      "company_seat": "Mühlacker",
      "details": "15.10.2025 (Bekanntmachungsdatum)\n\nBaden-Württemberg Amtsgericht Mannheim HRB 752534\nLöschungsankündigung\n\nSEN Wohnbau GmbH\nGesellschaft mit beschränkter Haftung\nMühlacker\n\nDas Gericht beabsichtigt, die Gesellschaft wegen Vermögenslosigkeit im Handelsregister von Amts wegen nach § 394 FamFG zu löschen. Die Frist zur Geltendmachung eines Widerspruchs gegen die beabsichtigte Löschung ist auf einen Monat ab Veröffentlichung bestimmt."
    },
    {
      "date": "2025-10-15",
      "id": "134037",
      "original_text": "Registerbekanntmachung nach dem Umwandlungsgesetz\nSaarland Amtsgericht Saarbrücken HRB 102465\nLORCA GmbH – Saarbrücken",
      "type": "Registerbekanntmachung nach dem Umwandlungsgesetz",
      "state": "Saarland",
      "amtsgericht": "Amtsgericht Saarbrücken",
      "registernummer": "HRB 102465",
      "registerart": "HRB",
      "company_name": "LORCA GmbH",
      "company_seat": "Saarbrücken",
      "details": "15.10.2025 (Bekanntmachungsdatum)\n\nSaarland Amtsgericht Saarbrücken HRB 102465\nRegisterbekanntmachung nach dem Umwandlungsgesetz\n\nLORCA GmbH\nGesellschaft mit beschränkter Haftung\nSaarbrücken\n\nEs wird darauf hingewiesen, dass der Entwurf des Verschmelzungsplans beim Handelsregister der Gesellschaft eingereicht worden ist.\nAn der grenzüberschreitenden Verschmelzung sind folgende Rechtsträger beteiligt:\nLORCA GmbH, eine Gesellschaft mit beschränkter Haftung nach deutschem Recht mit Sitz in Saarbrücken, Deutschland, mit Geschäftsanschrift: Lebacher Straße 4, 66113 Saarbrücken, Deutschland, eingetragen im Handelsregister des Amtsgerichts Saarbrücken unter der Nummer HRB 102465,\nals übertragende Gesellschaft;\nFINANCIERE LORCA S.A.S., eine vereinfachte Aktiengesellschaft nach französischem Recht (société par actions simplifiées) mit Sitz in Lemud, Frankreich, mit Geschäftsanschrift: Route de Metz, 57580 Lemud, Frankreich, eingetragen im Handels- und Gesellschaftsregister von Metz unter der Nummer 390376 168,\nals übernehmende Gesellschaft.\nAnhörungsrecht der Anteilsinhaber, Gläubiger und Betriebsräte bzw. Arbeitnehmer\nBis spätestens fünf (5) Arbeitstage vor dem Tag der Beurkundung des Verschmelzungsplans können die Anteilsinhaber und (ii) die Gläubiger der an der Verschmelzung beteiligten Gesellschaften Bemerkungen zum Verschmelzungsplan übermitteln.\nSchutz der Gläubiger der Gesellschaft\nDer Gläubiger einer übertragenden Gesellschaft kann verlangen, dass ihm Sicherheit geleistet wird für eine Forderung, die (i) vor der Bekanntmachung des Verschmelzungsplans oder seines Entwurfs entstanden, aber im Zeitpunkt der Bekanntmachung noch nicht fällig geworden ist, und (ii) deren Erfüllung durch die Verschmelzung gefährdet wird. Die Voraussetzungen des vorstehenden Anspruchs sind gegenüber dem zuständigen Gericht glaubhaft zu machen. Der Anspruch auf Sicherheitsleistung erlischt, wenn er nicht innerhalb von drei Monaten ab Bekanntmachung des Verschmelzungsplans gerichtlich geltend gemacht wurde. Geleistete Sicherheiten sind freizugeben, wenn das Verschmelzungsverfahren gescheitert ist. Das ist insbesondere dann der Fall, wenn (i) die Entscheidung des Gerichts über die Ablehnung der Eintragung gemäß § 316 Abs. (1) UmwG rechtskräftig ist, (ii) die Ablehnung der Entscheidung über die Eintragung der Verschmelzung im Register der übernehmenden oder neuen Gesellschaft nicht mehrangefochten werden kann oder (iii) das Verfahren auf Eintragung gemäß § 316 Abs. (1) UmwG oder nach dieser Eintragung das Verfahren auf Eintragung der Verschmelzung im Register der übernehmenden oder neuen Gesellschaft auf andere Weise endgültig beendet worden ist.\nDer Tag der geplanten Beurkundung des Verschmelzungsplans ist der 7. Januar 2026, so dass die Frist nach Absatz a) am 31. Dezember 2025 abläuft.\n\nBemerkungen können schriftlich oder elektronisch unter folgender gemeinsamer Adresse der beteiligten Gesellschaften eingereicht werden:\nLorca GmbH, Lebacher Straße 4, 66113 Saarbrücken.\nDie in Absatz a) genannten Personen können sich ferner kostenlos über ihre Rechte und die Modalitäten deren Ausübung informieren, indem sie sich an die obige Adresse wenden.\nEin Hinweis an den Betriebsrat oder die Arbeitnehmer der an der Verschmelzung beteiligten Gesellschaften ist entbehrlich, da die an der Verschmelzung beteiligten Gesellschaften keinen Betriebsrat und keine Arbeitnehmer haben."
    },
    {
      "date": "2025-10-15",
      "id": "134038",
      "original_text": "Sonstige Registerbekanntmachung\nBaden-Württemberg Amtsgericht Mannheim HRB 6720\nPeG In Dienstleistungen GmbH – Mannheim",
      "type": "Sonstige Registerbekanntmachung",
      "state": "Baden-Württemberg",
      "amtsgericht": "Amtsgericht Mannheim",
      "registernummer": "HRB 6720",
      "registerart": "HRB",
      "company_name": "PeG In Dienstleistungen GmbH",
      "company_seat": "Mannheim",
      "details": "15.10.2025 (Bekanntmachungsdatum)\n\nBaden-Württemberg Amtsgericht Mannheim HRB 6720\nSonstige Registerbekanntmachung\n\nPeG In Dienstleistungen GmbH\nGesellschaft mit beschränkter Haftung\nMannheim\n\nDas Gericht beabsichtigt, die Gesellschaft wegen Vermögenslosigkeit im Handelsregister von Amts wegen nach § 394 FamFG zu löschen. Die Frist zur Geltendmachung eines Widerspruchs gegen die beabsichtigte Löschung ist auf einen Monat ab Veröffentlichung bestimmt."
    },
    {
      "date": "2025-10-15",
      "id": "134039",
      "original_text": "Einreichung neuer Dokumente\nBerlin Amtsgericht Berlin (Charlottenburg) HRB 106287\nAndres Industries AG – Berlin",
      "type": "Einreichung neuer Dokumente",
      "state": "Berlin",
      "amtsgericht": "Amtsgericht Berlin (Charlottenburg)",
      "registernummer": "HRB 106287",
      "registerart": "HRB",
      "company_name": "Andres Industries AG",
      "company_seat": "Berlin",
      "details": "15.10.2025 (Bekanntmachungsdatum)\n\nBerlin Amtsgericht Berlin (Charlottenburg) HRB 106287\nEinreichung neuer Dokumente\n\nAndres Industries AG\nAktiengesellschaft\nBerlin\n\nAls nicht eingetragen wird veröffentlicht: Es wurde eine neue Liste der Aufsichtsratsmitglieder eingereicht (§ 106 AktG)."
    },
    {
      "date": "2025-10-15",
      "id": "134040",
      "original_text": "Registerbekanntmachung nach dem Umwandlungsgesetz\nBrandenburg Amtsgericht Cottbus HRB 17365\nCatalyst Ventures UG (haftungsbeschränkt) – Schönefeld",
      "type": "Registerbekanntmachung nach dem Umwandlungsgesetz",
      "state": "Brandenburg",
      "amtsgericht": "Amtsgericht Cottbus",
      "registernummer": "HRB 17365",
      "registerart": "HRB",
      "company_name": "Catalyst Ventures UG (haftungsbeschränkt)",
      "company_seat": "Schönefeld",
      "details": "15.10.2025 (Bekanntmachungsdatum)\n\nBrandenburg Amtsgericht Cottbus HRB 17365\nRegisterbekanntmachung nach dem Umwandlungsgesetz 15.10.2025 (Eintragungsdatum)\n\nCatalyst Ventures UG (haftungsbeschränkt)\nGesellschaft mit beschränkter Haftung\nSchönefeld\n\nZu Eintragungsnummer 2 vom 15.10.2025 wird als nicht eingetragen veröffentlicht:\nAls nicht eingetragen wird veröffentlicht:\nDen Gläubigern der an der Umwandlung beteiligten Rechtsträger ist, wenn sie binnen sechs Monaten nach dem Tag, an dem die Eintragung der Umwandlung in das Register des Sitzes desjenigen Rechtsträgers, dessen Gläubiger sie sind, als bekannt gemacht gilt, ihren Anspruch nach Grund und Höhe schriftlich anmelden, Sicherheit zu leisten, soweit sie nicht Befriedigung verlangen können. Dieses Recht steht den Gläubigern jedoch nur zu, wenn sie glaubhaft machen, dass durch die Umwandlung die Erfüllung ihrer Forderung gefährdet wird"
    },
    {
      "date": "2025-10-15",
      "id": "134041",
      "original_text": "Löschungsankündigung\nSchleswig-Holstein Amtsgericht Flensburg HRB 495 NI\nJensen Bau GmbH – Risum-Lindholm",
      "type": "Löschungsankündigung",
      "state": "Schleswig-Holstein",
      "amtsgericht": "Amtsgericht Flensburg",
      "registernummer": "HRB 495 NI",
      "registerart": "HRB",
      "company_name": "Jensen Bau GmbH",
      "company_seat": "Risum-Lindholm",
      "details": "15.10.2025 (Bekanntmachungsdatum)\n\nSchleswig-Holstein Amtsgericht Flensburg HRB 495 NI\nLöschungsankündigung\n\nJensen Bau GmbH\nGesellschaft mit beschränkter Haftung\nRisum-Lindholm\n\nEs ist die Löschung der nachstehenden Gesellschaft wegen Vermögenslosigkeit gemäß § 394 FamFG beabsichtigt.\nWiderspruchsfrist: 2 Monate."
    },
    {
      "date": "2025-10-15",
      "id": "134042",
      "original_text": "Registerbekanntmachung nach dem Umwandlungsgesetz\nBrandenburg Amtsgericht Cottbus HRB 16360\nVintage 64 GmbH – Schulzendorf",
      "type": "Registerbekanntmachung nach dem Umwandlungsgesetz",
      "state": "Brandenburg",
      "amtsgericht": "Amtsgericht Cottbus",
      "registernummer": "HRB 16360",
      "registerart": "HRB",
      "company_name": "Vintage 64 GmbH",
      "company_seat": "Schulzendorf",
      "details": "15.10.2025 (Bekanntmachungsdatum)\n\nBrandenburg Amtsgericht Cottbus HRB 16360\nRegisterbekanntmachung nach dem Umwandlungsgesetz 13.10.2025 (Eintragungsdatum)\n\nVintage 64 GmbH\nGesellschaft mit beschränkter Haftung\nSchulzendorf\n\nZu Eintragungsnummer 4 vom 13.10.2025 wird als nicht eingetragen veröffentlicht:\nDen Gläubigern der an der Verschmelzung beteiligten Rechtsträger ist, wenn sie binnen sechs Monaten nach dem Tag, an dem die Eintragung der Verschmelzung in das Register des Sitzes desjenigen Rechtsträgers, dessen Gläubiger sie sind, als bekannt gemacht gilt, ihren Anspruch nach Grund und Höhe schriftlich anmelden, Sicherheit zu leisten, soweit sie nicht Befriedigung verlangen können. Dieses Recht steht den Gläubigern jedoch nur zu, wenn sie glaubhaft machen, dass durch die Verschmelzung die Erfüllung ihrer Forderung gefährdet wird"
    },
    {
      "date": "2025-10-15",
      "id": "134043",
      "original_text": "Registerbekanntmachung nach dem Umwandlungsgesetz\nSachsen Amtsgericht Dresden HRB 39626\nBallhaus Watzke Immobilien GmbH – Dresden",
      "type": "Registerbekanntmachung nach dem Umwandlungsgesetz",
      "state": "Sachsen",
      "amtsgericht": "Amtsgericht Dresden",
      "registernummer": "HRB 39626",
      "registerart": "HRB",
      "company_name": "Ballhaus Watzke Immobilien GmbH",
      "company_seat": "Dresden",
      "details": "15.10.2025 (Bekanntmachungsdatum)\n\nSachsen Amtsgericht Dresden HRB 39626\nRegisterbekanntmachung nach dem Umwandlungsgesetz 15.10.2025 (Eintragungsdatum)\n\nBallhaus Watzke Immobilien GmbH\nGesellschaft mit beschränkter Haftung\nDresden\n\nDen Gläubigern der an der Verschmelzung beteiligten Rechtsträger ist, wenn sie binnen sechs Monaten nach dem Tag, an dem die Eintragung der Verschmelzung in das Register des Sitzes desjenigen Rechtsträgers, dessen Gläubiger sie sind, nach § 19 Abs. 3 UmwG als bekannt gemacht gilt, ihren Anspruch nach Grund und Höhe in Textform anmelden, Sicherheit zu leisten, soweit sie nicht Befriedigung verlangen können. Dieses Recht steht den Gläubigern jedoch nur zu, wenn sie glaubhaft machen, dass durch die Verschmelzung die Erfüllung der Forderung gefährdet wird."
    },
    {
      "date": "2025-10-15",
      "id": "134044",
      "original_text": "Einreichung neuer Dokumente\nSachsen Amtsgericht Dresden HRB 44838\nEnloc AG – Dresden",
      "type": "Einreichung neuer Dokumente",
      "state": "Sachsen",
      "amtsgericht": "Amtsgericht Dresden",
      "registernummer": "HRB 44838",
      "registerart": "HRB",
      "company_name": "Enloc AG",
      "company_seat": "Dresden",
      "details": "15.10.2025 (Bekanntmachungsdatum)\n\nSachsen Amtsgericht Dresden HRB 44838\nEinreichung neuer Dokumente\n\nEnloc AG\nAktiengesellschaft\nDresden\n\nAm 14.10.2025 wurde beim Handelsregister des Amtsgerichts Dresden die Liste der Mitglieder des Aufsichtsrats gemäß § 106 AktG eingereicht."
    },
    {
      "date": "2025-10-15",
      "id": "134045",
      "original_text": "Registerbekanntmachung nach dem Umwandlungsgesetz\nSachsen Amtsgericht Dresden HRB 39629\nGrundbesitzgesellschaft Gröbelstraße mbH – Dresden",
      "type": "Registerbekanntmachung nach dem Umwandlungsgesetz",
      "state": "Sachsen",
      "amtsgericht": "Amtsgericht Dresden",
      "registernummer": "HRB 39629",
      "registerart": "HRB",
      "company_name": "Grundbesitzgesellschaft Gröbelstraße mbH",
      "company_seat": "Dresden",
      "details": "15.10.2025 (Bekanntmachungsdatum)\n\nSachsen Amtsgericht Dresden HRB 39629\nRegisterbekanntmachung nach dem Umwandlungsgesetz 15.10.2025 (Eintragungsdatum)\n\nGrundbesitzgesellschaft Gröbelstraße mbH\nGesellschaft mit beschränkter Haftung\nDresden\n\nDen Gläubigern der an der Verschmelzung beteiligten Rechtsträger ist, wenn sie binnen sechs Monaten nach dem Tag, an dem die Eintragung der Verschmelzung in das Register des Sitzes desjenigen Rechtsträgers, dessen Gläubiger sie sind, nach § 19 Abs. 3 UmwG als bekannt gemacht gilt, ihren Anspruch nach Grund und Höhe in Textform anmelden, Sicherheit zu leisten, soweit sie nicht Befriedigung verlangen können. Dieses Recht steht den Gläubigern jedoch nur zu, wenn sie glaubhaft machen, dass durch die Verschmelzung die Erfüllung der Forderung gefährdet wird."
    },
    {
      "date": "2025-10-15",
      "id": "134046",
      "original_text": "Registerbekanntmachung nach dem Umwandlungsgesetz\nSachsen Amtsgericht Leipzig HRB 35971\nKADER UG (haftungsbeschränkt) – Leipzig",
      "type": "Registerbekanntmachung nach dem Umwandlungsgesetz",
      "state": "Sachsen",
      "amtsgericht": "Amtsgericht Leipzig",
      "registernummer": "HRB 35971",
      "registerart": "HRB",
      "company_name": "KADER UG (haftungsbeschränkt)",
      "company_seat": "Leipzig",
      "details": "15.10.2025 (Bekanntmachungsdatum)\n\nSachsen Amtsgericht Leipzig HRB 35971\nDie Registerbekanntmachung ist nachträglich am 16.10.2025 um 18:00 Uhr gelöscht worden.\nWegen der Einzelheiten und näherer Auskünfte wenden Sie sich bitte an das Amtsgericht Leipzig ."
    },
    {
      "date": "2025-10-15",
      "id": "134047",
      "original_text": "Löschungsankündigung\nSachsen Amtsgericht Dresden HRB 29771\nFleischerei und Partyservice Jakob UG (haftungsbeschränkt) – Waldhufen",
      "type": "Löschungsankündigung",
      "state": "Sachsen",
      "amtsgericht": "Amtsgericht Dresden",
      "registernummer": "HRB 29771",
      "registerart": "HRB",
      "company_name": "Fleischerei und Partyservice Jakob UG (haftungsbeschränkt)",
      "company_seat": "Waldhufen",
      "details": "15.10.2025 (Bekanntmachungsdatum)\n\nSachsen Amtsgericht Dresden HRB 29771\nLöschungsankündigung\n\nFleischerei und Partyservice Jakob UG (haftungsbeschränkt)\nGesellschaft mit beschränkter Haftung\nWaldhufen\n\nDas Registergericht beabsichtigt, die im Handelsregister eingetragene Gesellschaft von Amts wegen nach § 394 FamFG zu löschen. Die Frist zu Erhebung eines Widerspruchs gegen die beabsichtigte Löschung wird auf einen Monat festgesetzt."
    },
    {
      "date": "2025-10-15",
      "id": "134048",
      "original_text": "Löschungsankündigung\nSachsen Amtsgericht Leipzig HRB 29696\nF.C. Asset Management GmbH – Borsdorf",
      "type": "Löschungsankündigung",
      "state": "Sachsen",
      "amtsgericht": "Amtsgericht Leipzig",
      "registernummer": "HRB 29696",
      "registerart": "HRB",
      "company_name": "F.C. Asset Management GmbH",
      "company_seat": "Borsdorf",
      "details": "15.10.2025 (Bekanntmachungsdatum)\n\nSachsen Amtsgericht Leipzig HRB 29696\nLöschungsankündigung\n\nF.C. Asset Management GmbH\nGesellschaft mit beschränkter Haftung\nBorsdorf\n\nDas Registergericht beabsichtigt, die im Handelsregister eingetragene Gesellschaft von Amts wegen nach § 394 FamFG zu löschen. Die Frist zu Erhebung eines Widerspruchs gegen die beabsichtigte Löschung wird auf einen Monat festgesetzt."
    },
    {
      "date": "2025-10-15",
      "id": "134049",
      "original_text": "Registerbekanntmachung nach dem Umwandlungsgesetz\nSachsen Amtsgericht Dresden HRB 14961\nBUDISSA Landmarkt GmbH – Bautzen",
      "type": "Registerbekanntmachung nach dem Umwandlungsgesetz",
      "state": "Sachsen",
      "amtsgericht": "Amtsgericht Dresden",
      "registernummer": "HRB 14961",
      "registerart": "HRB",
      "company_name": "BUDISSA Landmarkt GmbH",
      "company_seat": "Bautzen",
      "details": "15.10.2025 (Bekanntmachungsdatum)\n\nSachsen Amtsgericht Dresden HRB 14961\nRegisterbekanntmachung nach dem Umwandlungsgesetz 15.10.2025 (Eintragungsdatum)\n\nBUDISSA Landmarkt GmbH\nGesellschaft mit beschränkter Haftung\nBautzen\n\nDen Gläubigern der an der Verschmelzung beteiligten Rechtsträger ist, wenn sie binnen sechs Monaten nach dem Tag, an dem die Eintragung der Verschmelzung in das Register des Sitzes desjenigen Rechtsträgers, dessen Gläubiger sie sind, nach § 19 Abs. 3 UmwG als bekannt gemacht gilt, ihren Anspruch nach Grund und Höhe in Textform anmelden, Sicherheit zu leisten, soweit sie nicht Befriedigung verlangen können. Dieses Recht steht den Gläubigern jedoch nur zu, wenn sie glaubhaft machen, dass durch die Verschmelzung die Erfüllung der Forderung gefährdet wird."
    },
    {
      "date": "2025-10-15",
      "id": "134050",
      "original_text": "Löschungsankündigung\nSachsen Amtsgericht Chemnitz HRB 27648\nBowling Center Roter Würfel UG (haftungsbeschränkt) – Plauen",
      "type": "Löschungsankündigung",
      "state": "Sachsen",
      "amtsgericht": "Amtsgericht Chemnitz",
      "registernummer": "HRB 27648",
      "registerart": "HRB",
      "company_name": "Bowling Center Roter Würfel UG (haftungsbeschränkt)",
      "company_seat": "Plauen",
      "details": "15.10.2025 (Bekanntmachungsdatum)\n\nSachsen Amtsgericht Chemnitz HRB 27648\nLöschungsankündigung 15.10.2025 (Eintragungsdatum)\n\nBowling Center Roter Würfel UG (haftungsbeschränkt)\nGesellschaft mit beschränkter Haftung\nPlauen\n\nDas Registergericht beabsichtigt, die im Handelsregister eingetragene Gesellschaft von Amts wegen nach § 394 FamFG zu löschen. Die Frist zu Erhebung eines Widerspruchs gegen die beabsichtigte Löschung wird auf einen Monat festgesetzt."
    },
    {
      "date": "2025-10-15",
      "id": "134051",
      "original_text": "Registerbekanntmachung nach dem Umwandlungsgesetz\nSachsen Amtsgericht Dresden HRB 39744\nBELOR Grundstücksgesellschaft m.b.H. – Dresden",
      "type": "Registerbekanntmachung nach dem Umwandlungsgesetz",
      "state": "Sachsen",
      "amtsgericht": "Amtsgericht Dresden",
      "registernummer": "HRB 39744",
      "registerart": "HRB",
      "company_name": "BELOR Grundstücksgesellschaft m.b.H.",
      "company_seat": "Dresden",
      "details": "15.10.2025 (Bekanntmachungsdatum)\n\nSachsen Amtsgericht Dresden HRB 39744\nRegisterbekanntmachung nach dem Umwandlungsgesetz 15.10.2025 (Eintragungsdatum)\n\nBELOR Grundstücksgesellschaft m.b.H.\nGesellschaft mit beschränkter Haftung\nDresden\n\nDen Gläubigern der an der Verschmelzung beteiligten Rechtsträger ist, wenn sie binnen sechs Monaten nach dem Tag, an dem die Eintragung der Verschmelzung in das Register des Sitzes desjenigen Rechtsträgers, dessen Gläubiger sie sind, nach § 19 Abs. 3 UmwG als bekannt gemacht gilt, ihren Anspruch nach Grund und Höhe in Textform anmelden, Sicherheit zu leisten, soweit sie nicht Befriedigung verlangen können. Dieses Recht steht den Gläubigern jedoch nur zu, wenn sie glaubhaft machen, dass durch die Verschmelzung die Erfüllung der Forderung gefährdet wird."
    },
    {
      "date": "2025-10-15",
      "id": "134052",
      "original_text": "Registerbekanntmachung nach dem Umwandlungsgesetz\nSachsen Amtsgericht Dresden HRB 39744\nBELOR Grundstücksgesellschaft m.b.H. – Dresden",
      "type": "Registerbekanntmachung nach dem Umwandlungsgesetz",
      "state": "Sachsen",
      "amtsgericht": "Amtsgericht Dresden",
      "registernummer": "HRB 39744",
      "registerart": "HRB",
      "company_name": "BELOR Grundstücksgesellschaft m.b.H.",
      "company_seat": "Dresden",
      "details": "15.10.2025 (Bekanntmachungsdatum)\n\nSachsen Amtsgericht Dresden HRB 39744\nRegisterbekanntmachung nach dem Umwandlungsgesetz 15.10.2025 (Eintragungsdatum)\n\nBELOR Grundstücksgesellschaft m.b.H.\nGesellschaft mit beschränkter Haftung\nDresden\n\nDen Gläubigern der an der Verschmelzung beteiligten Rechtsträger ist, wenn sie binnen sechs Monaten nach dem Tag, an dem die Eintragung der Verschmelzung in das Register des Sitzes desjenigen Rechtsträgers, dessen Gläubiger sie sind, nach § 19 Abs. 3 UmwG als bekannt gemacht gilt, ihren Anspruch nach Grund und Höhe in Textform anmelden, Sicherheit zu leisten, soweit sie nicht Befriedigung verlangen können. Dieses Recht steht den Gläubigern jedoch nur zu, wenn sie glaubhaft machen, dass durch die Verschmelzung die Erfüllung der Forderung gefährdet wird."
    },
    {
      "date": "2025-10-15",
      "id": "134053",
      "original_text": "Registerbekanntmachung nach dem Umwandlungsgesetz\nSachsen Amtsgericht Dresden HRB 4129\nBUDISSA Gutshof Baruth GmbH – Malschwitz",
      "type": "Registerbekanntmachung nach dem Umwandlungsgesetz",
      "state": "Sachsen",
      "amtsgericht": "Amtsgericht Dresden",
      "registernummer": "HRB 4129",
      "registerart": "HRB",
      "company_name": "BUDISSA Gutshof Baruth GmbH",
      "company_seat": "Malschwitz",
      "details": "15.10.2025 (Bekanntmachungsdatum)\n\nSachsen Amtsgericht Dresden HRB 4129\nRegisterbekanntmachung nach dem Umwandlungsgesetz 15.10.2025 (Eintragungsdatum)\n\nBUDISSA Gutshof Baruth GmbH\nGesellschaft mit beschränkter Haftung\nMalschwitz\n\nDen Gläubigern der an der Verschmelzung beteiligten Rechtsträger ist, wenn sie binnen sechs Monaten nach dem Tag, an dem die Eintragung der Verschmelzung in das Register des Sitzes desjenigen Rechtsträgers, dessen Gläubiger sie sind, nach § 19 Abs. 3 UmwG als bekannt gemacht gilt, ihren Anspruch nach Grund und Höhe in Textform anmelden, Sicherheit zu leisten, soweit sie nicht Befriedigung verlangen können. Dieses Recht steht den Gläubigern jedoch nur zu, wenn sie glaubhaft machen, dass durch die Verschmelzung die Erfüllung der Forderung gefährdet wird."
    },
    {
      "date": "2025-10-15",
      "id": "134054",
      "original_text": "Löschungsankündigung\nNiedersachsen Amtsgericht Lüneburg HRB 207974\nGNP Gastro GmbH – Stelle",
      "type": "Löschungsankündigung",
      "state": "Niedersachsen",
      "amtsgericht": "Amtsgericht Lüneburg",
      "registernummer": "HRB 207974",
      "registerart": "HRB",
      "company_name": "GNP Gastro GmbH",
      "company_seat": "Stelle",
      "details": "15.10.2025 (Bekanntmachungsdatum)\n\nNiedersachsen Amtsgericht Lüneburg HRB 207974\nLöschungsankündigung\n\nGNP Gastro GmbH\nGesellschaft mit beschränkter Haftung\nStelle\n\nDas Registergericht beabsichtigt, die Gesellschaft von Amts wegen nach § 394 FamFG zu löschen. Die Frist zur Erhebung eines Widerspruchs ist auf 1 Monat ab dieser Registerbekanntmachung festgesetzt."
    },
    {
      "date": "2025-10-15",
      "id": "134055",
      "original_text": "Registerbekanntmachung nach dem Umwandlungsgesetz\nNiedersachsen Amtsgericht Osnabrück HRB 209511\nRalf Klute Immobilien UG (haftungsbeschränkt) – Osnabrück",
      "type": "Registerbekanntmachung nach dem Umwandlungsgesetz",
      "state": "Niedersachsen",
      "amtsgericht": "Amtsgericht Osnabrück",
      "registernummer": "HRB 209511",
      "registerart": "HRB",
      "company_name": "Ralf Klute Immobilien UG (haftungsbeschränkt)",
      "company_seat": "Osnabrück",
      "details": "15.10.2025 (Bekanntmachungsdatum)\n\nNiedersachsen Amtsgericht Osnabrück HRB 209511\nRegisterbekanntmachung nach dem Umwandlungsgesetz 15.10.2025 (Eintragungsdatum)\n\nRalf Klute Immobilien UG (haftungsbeschränkt)\nGesellschaft mit beschränkter Haftung\nOsnabrück\n\nDen Gläubigern der an der Verschmelzung beteiligten Rechtsträger ist, wenn sie binnen sechs Monaten nach dem Tag, an dem die Eintragung der Verschmelzung in das Register des Sitzes desjenigen Rechtsträgers, dessen Gläubiger sie sind, nach § 19  Abs.  3 UmwG als bekannt gemacht gilt, ihren Anspruch nach Grund und Höhe schriftlich anmelden, Sicherheit zu leisten, soweit sie nicht Befriedigung verlangen können. Dieses Recht steht den Gläubigern jedoch nur zu, wenn sie glaubhaft machen, dass durch die Verschmelzung die Erfüllung der Forderung gefährdet wird."
    },
    {
      "date": "2025-10-15",
      "id": "134056",
      "original_text": "Registerbekanntmachung nach dem Umwandlungsgesetz\nNiedersachsen Amtsgericht Osnabrück HRA 209211\nDer Getränkeladen Jürgen Kirk e.K. – Gehrde",
      "type": "Registerbekanntmachung nach dem Umwandlungsgesetz",
      "state": "Niedersachsen",
      "amtsgericht": "Amtsgericht Osnabrück",
      "registernummer": "HRA 209211",
      "registerart": "HRA",
      "company_name": "Der Getränkeladen Jürgen Kirk e.K.",
      "company_seat": "Gehrde",
      "details": "15.10.2025 (Bekanntmachungsdatum)\n\nNiedersachsen Amtsgericht Osnabrück HRA 209211\nRegisterbekanntmachung nach dem Umwandlungsgesetz 15.10.2025 (Eintragungsdatum)\n\nDer Getränkeladen Jürgen Kirk e.K.\nEinzelkaufmann / Einzelkauffrau\nGehrde\n\nDen Gläubigern der an der Ausgliederung beteiligten Rechtsträger ist, wenn sie binnen sechs Monaten nach dem Tag, an dem die Eintragung der Ausgliederung in das Register des Sitzes desjenigen Rechtsträgers, dessen Gläubiger sie sind, nach § 19 Abs. 3 UmwG als bekannt gemacht gilt, ihren Anspruch nach Grund und Höhe schriftlich anmelden, Sicherheit zu leisten, soweit sie nicht Befriedigung verlangen können. Dieses Recht steht den Gläubigern jedoch nur zu, wenn sie glaubhaft machen, dass durch die Ausgliederung die Erfüllung der Forderung gefährdet wird."
    },
    {
      "date": "2025-10-15",
      "id": "134057",
      "original_text": "Löschungsankündigung\nNiedersachsen Amtsgericht Göttingen HRB 205445\nG.S. General System Fertigungs GmbH – Göttingen",
      "type": "Löschungsankündigung",
      "state": "Niedersachsen",
      "amtsgericht": "Amtsgericht Göttingen",
      "registernummer": "HRB 205445",
      "registerart": "HRB",
      "company_name": "G.S. General System Fertigungs GmbH",
      "company_seat": "Göttingen",
      "details": "15.10.2025 (Bekanntmachungsdatum)\n\nNiedersachsen Amtsgericht Göttingen HRB 205445\nLöschungsankündigung\n\nG.S. General System Fertigungs GmbH\nGesellschaft mit beschränkter Haftung\nGöttingen\n\nDas Registergericht beabsichtigt, die Gesellschaft von Amts wegen nach § 394 FamFG zu löschen. Die Frist zur Erhebung eines Widerspruchs ist auf 1 Monat ab dieser Registerbekanntmachung festgesetzt."
    },
    {
      "date": "2025-10-15",
      "id": "134058",
      "original_text": "Registerbekanntmachung nach dem Umwandlungsgesetz\nNiedersachsen Amtsgericht Oldenburg (Oldenburg) HRB 208982\ne+b Erkennen und Bewerten Gesellschaft für wissenschaftliche Studien mbH – Oldenburg",
      "type": "Registerbekanntmachung nach dem Umwandlungsgesetz",
      "state": "Niedersachsen",
      "amtsgericht": "Amtsgericht Oldenburg (Oldenburg)",
      "registernummer": "HRB 208982",
      "registerart": "HRB",
      "company_name": "e+b Erkennen und Bewerten Gesellschaft für wissenschaftliche Studien mbH",
      "company_seat": "Oldenburg",
      "details": "15.10.2025 (Bekanntmachungsdatum)\n\nNiedersachsen Amtsgericht Oldenburg (Oldenburg) HRB 208982\nRegisterbekanntmachung nach dem Umwandlungsgesetz 15.10.2025 (Eintragungsdatum)\n\ne+b Erkennen und Bewerten Gesellschaft für wissenschaftliche Studien mbH\nGesellschaft mit beschränkter Haftung\nOldenburg\n\nDen Gläubigern der an der Verschmelzung beteiligten Rechtsträger ist, wenn sie binnen sechs Monaten nach dem Tag, an dem die Eintragung der Verschmelzung in das Register des Sitzes desjenigen Rechtsträgers, dessen Gläubiger sie sind, nach § 19  Abs.  3 UmwG als bekannt gemacht gilt, ihren Anspruch nach Grund und Höhe schriftlich anmelden, Sicherheit zu leisten, soweit sie nicht Befriedigung verlangen können. Dieses Recht steht den Gläubigern jedoch nur zu, wenn sie glaubhaft machen, dass durch die Verschmelzung die Erfüllung der Forderung gefährdet wird."
    },
    {
      "date": "2025-10-15",
      "id": "134059",
      "original_text": "Registerbekanntmachung nach dem Umwandlungsgesetz\nNiedersachsen Amtsgericht Osnabrück HRA 203136\nEKONZEPT MOBILITY GmbH & Co. KG – Osnabrück",
      "type": "Registerbekanntmachung nach dem Umwandlungsgesetz",
      "state": "Niedersachsen",
      "amtsgericht": "Amtsgericht Osnabrück",
      "registernummer": "HRA 203136",
      "registerart": "HRA",
      "company_name": "EKONZEPT MOBILITY GmbH & Co. KG",
      "company_seat": "Osnabrück",
      "details": "15.10.2025 (Bekanntmachungsdatum)\n\nNiedersachsen Amtsgericht Osnabrück HRA 203136\nRegisterbekanntmachung nach dem Umwandlungsgesetz 15.10.2025 (Eintragungsdatum)\n\nEKONZEPT MOBILITY GmbH & Co. KG\nKommanditgesellschaft\nOsnabrück\n\nDen Gläubigern der an der Verschmelzung beteiligten Rechtsträger ist, wenn sie binnen sechs Monaten nach dem Tag, an dem die Eintragung der Verschmelzung in das Register des Sitzes desjenigen Rechtsträgers, dessen Gläubiger sie sind, nach § 19  Abs.  3 UmwG als bekannt gemacht gilt, ihren Anspruch nach Grund und Höhe schriftlich anmelden, Sicherheit zu leisten, soweit sie nicht Befriedigung verlangen können. Dieses Recht steht den Gläubigern jedoch nur zu, wenn sie glaubhaft machen, dass durch die Verschmelzung die Erfüllung der Forderung gefährdet wird."
    },
    {
      "date": "2025-10-15",
      "id": "134060",
      "original_text": "Registerbekanntmachung nach dem Umwandlungsgesetz\nNiedersachsen Amtsgericht Oldenburg (Oldenburg) HRB 3296\nSKN GmbH – Oldenburg",
      "type": "Registerbekanntmachung nach dem Umwandlungsgesetz",
      "state": "Niedersachsen",
      "amtsgericht": "Amtsgericht Oldenburg (Oldenburg)",
      "registernummer": "HRB 3296",
      "registerart": "HRB",
      "company_name": "SKN GmbH",
      "company_seat": "Oldenburg",
      "details": "15.10.2025 (Bekanntmachungsdatum)\n\nNiedersachsen Amtsgericht Oldenburg (Oldenburg) HRB 3296\nRegisterbekanntmachung nach dem Umwandlungsgesetz 15.10.2025 (Eintragungsdatum)\n\nSKN GmbH\nGesellschaft mit beschränkter Haftung\nOldenburg\n\nDen Gläubigern der an der Verschmelzung beteiligten Rechtsträger ist, wenn sie binnen sechs Monaten nach dem Tag, an dem die Eintragung der Verschmelzung in das Register des Sitzes desjenigen Rechtsträgers, dessen Gläubiger sie sind, nach § 19  Abs.  3 UmwG als bekannt gemacht gilt, ihren Anspruch nach Grund und Höhe schriftlich anmelden, Sicherheit zu leisten, soweit sie nicht Befriedigung verlangen können. Dieses Recht steht den Gläubigern jedoch nur zu, wenn sie glaubhaft machen, dass durch die Verschmelzung die Erfüllung der Forderung gefährdet wird."
    },
    {
      "date": "2025-10-15",
      "id": "134061",
      "original_text": "Löschungsankündigung\nNiedersachsen Amtsgericht Hannover HRB 212091\nlifegoeson.de UG (haftungsbeschränkt) – Hannover",
      "type": "Löschungsankündigung",
      "state": "Niedersachsen",
      "amtsgericht": "Amtsgericht Hannover",
      "registernummer": "HRB 212091",
      "registerart": "HRB",
      "company_name": "lifegoeson.de UG (haftungsbeschränkt)",
      "company_seat": "Hannover",
      "details": "15.10.2025 (Bekanntmachungsdatum)\n\nNiedersachsen Amtsgericht Hannover HRB 212091\nLöschungsankündigung\n\nlifegoeson.de UG (haftungsbeschränkt)\nGesellschaft mit beschränkter Haftung\nHannover\n\nDas Registergericht beabsichtigt, die Gesellschaft von Amts wegen nach § 394 FamFG zu löschen. Die Frist zur Erhebung eines Widerspruchs ist auf 1 Monat ab dieser Registerbekanntmachung festgesetzt."
    },
    {
      "date": "2025-10-15",
      "id": "134062",
      "original_text": "Sonstige Registerbekanntmachung\nNiedersachsen Amtsgericht Hildesheim HRA 202639\nLaue Schweinemast KG – Ummern",
      "type": "Sonstige Registerbekanntmachung",
      "state": "Niedersachsen",
      "amtsgericht": "Amtsgericht Hildesheim",
      "registernummer": "HRA 202639",
      "registerart": "HRA",
      "company_name": "Laue Schweinemast KG",
      "company_seat": "Ummern",
      "details": "15.10.2025 (Bekanntmachungsdatum)\n\nNiedersachsen Amtsgericht Hildesheim HRA 202639\nSonstige Registerbekanntmachung 15.10.2025 (Eintragungsdatum)\n\nLaue Schweinemast KG\nKommanditgesellschaft\nUmmern\n\nDie Firma ist im Handelsregister gelöscht, weil das Unternehmen nach Art und Umfang einen in kaufmännischer Weise eingerichteten Geschäftsbetrieb nicht erfordert."
    },
    {
      "date": "2025-10-15",
      "id": "134063",
      "original_text": "Registerbekanntmachung nach dem Umwandlungsgesetz\nNiedersachsen Amtsgericht Oldenburg (Oldenburg) HRB 5739\nPROPHYMED GmbH – Oldenburg",
      "type": "Registerbekanntmachung nach dem Umwandlungsgesetz",
      "state": "Niedersachsen",
      "amtsgericht": "Amtsgericht Oldenburg (Oldenburg)",
      "registernummer": "HRB 5739",
      "registerart": "HRB",
      "company_name": "PROPHYMED GmbH",
      "company_seat": "Oldenburg",
      "details": "15.10.2025 (Bekanntmachungsdatum)\n\nNiedersachsen Amtsgericht Oldenburg (Oldenburg) HRB 5739\nRegisterbekanntmachung nach dem Umwandlungsgesetz 15.10.2025 (Eintragungsdatum)\n\nPROPHYMED GmbH\nGesellschaft mit beschränkter Haftung\nOldenburg\n\nDen Gläubigern der an der Verschmelzung beteiligten Rechtsträger ist, wenn sie binnen sechs Monaten nach dem Tag, an dem die Eintragung der Verschmelzung in das Register des Sitzes desjenigen Rechtsträgers, dessen Gläubiger sie sind, nach § 19  Abs.  3 UmwG als bekannt gemacht gilt, ihren Anspruch nach Grund und Höhe schriftlich anmelden, Sicherheit zu leisten, soweit sie nicht Befriedigung verlangen können. Dieses Recht steht den Gläubigern jedoch nur zu, wenn sie glaubhaft machen, dass durch die Verschmelzung die Erfüllung der Forderung gefährdet wird."
    },
    {
      "date": "2025-10-15",
      "id": "134064",
      "original_text": "Registerbekanntmachung nach dem Umwandlungsgesetz\nNiedersachsen Amtsgericht Osnabrück HRB 210556\nGugart Immobilien UG (haftungsbeschränkt) – Osnabrück",
      "type": "Registerbekanntmachung nach dem Umwandlungsgesetz",
      "state": "Niedersachsen",
      "amtsgericht": "Amtsgericht Osnabrück",
      "registernummer": "HRB 210556",
      "registerart": "HRB",
      "company_name": "Gugart Immobilien UG (haftungsbeschränkt)",
      "company_seat": "Osnabrück",
      "details": "15.10.2025 (Bekanntmachungsdatum)\n\nNiedersachsen Amtsgericht Osnabrück HRB 210556\nRegisterbekanntmachung nach dem Umwandlungsgesetz 15.10.2025 (Eintragungsdatum)\n\nGugart Immobilien UG (haftungsbeschränkt)\nGesellschaft mit beschränkter Haftung\nOsnabrück\n\nDen Gläubigern der an der Verschmelzung beteiligten Rechtsträger ist, wenn sie binnen sechs Monaten nach dem Tag, an dem die Eintragung der Verschmelzung in das Register des Sitzes desjenigen Rechtsträgers, dessen Gläubiger sie sind, nach § 19  Abs.  3 UmwG als bekannt gemacht gilt, ihren Anspruch nach Grund und Höhe schriftlich anmelden, Sicherheit zu leisten, soweit sie nicht Befriedigung verlangen können. Dieses Recht steht den Gläubigern jedoch nur zu, wenn sie glaubhaft machen, dass durch die Verschmelzung die Erfüllung der Forderung gefährdet wird."
    },
    {
      "date": "2025-10-15",
      "id": "134065",
      "original_text": "Einreichung neuer Dokumente\nNiedersachsen Amtsgericht Hannover HRB 227710\nDREEMS e-mobilities GmbH – Hannover",
      "type": "Einreichung neuer Dokumente",
      "state": "Niedersachsen",
      "amtsgericht": "Amtsgericht Hannover",
      "registernummer": "HRB 227710",
      "registerart": "HRB",
      "company_name": "DREEMS e-mobilities GmbH",
      "company_seat": "Hannover",
      "details": "15.10.2025 (Bekanntmachungsdatum)\n\nNiedersachsen Amtsgericht Hannover HRB 227710\nEinreichung neuer Dokumente\n\nDREEMS e-mobilities GmbH\nGesellschaft mit beschränkter Haftung\nHannover\n\nDer Insolvenzverwalter hat dem Registergericht die Rückkehr zum satzungsgemäßen Geschäftsjahr angezeigt; die Anzeige wurde in den Registerordner eingestellt."
    },
    {
      "date": "2025-10-15",
      "id": "134066",
      "original_text": "Registerbekanntmachung nach dem Umwandlungsgesetz\nBremen Amtsgericht Bremen HRA 30558\nRobert Littmann Immobilien e.K. – Bremen",
      "type": "Registerbekanntmachung nach dem Umwandlungsgesetz",
      "state": "Bremen",
      "amtsgericht": "Amtsgericht Bremen",
      "registernummer": "HRA 30558",
      "registerart": "HRA",
      "company_name": "Robert Littmann Immobilien e.K.",
      "company_seat": "Bremen",
      "details": "15.10.2025 (Bekanntmachungsdatum)\n\nBremen Amtsgericht Bremen HRA 30558\nRegisterbekanntmachung nach dem Umwandlungsgesetz 09.10.2025 (Eintragungsdatum)\n\nRobert Littmann Immobilien e.K.\nEinzelkaufmann / Einzelkauffrau\nBremen\n\nAls nicht eingetragen wird veröffentlicht: Den Gläubigern der an der Spaltung beteiligten Rechtsträger ist, wenn sie binnen sechs Monaten nach dem Tag, an dem die Eintragung der Spaltung in das Register des Sitzes desjenigen Rechtsträgers, dessen Gläubiger sie sind, als bekannt gemacht gilt, ihren Anspruch nach Grund und Höhe schriftlich anmelden, Sicherheit zu leisten, soweit sie nicht Befriedigung verlangen können. Dieses Recht steht den Gläubigern jedoch nur zu, wenn sie glaubhaft machen, dass durch die Spaltung die Erfüllung ihrer Forderung gefährdet wird. Das Recht, Sicherheitsleistung zu verlangen, steht Gläubigern nicht zu, die im Falle der Insolvenz ein Recht auf vorzugsweise Befriedigung aus einer Deckungsmasse haben, die nach gesetzlicher Vorschrift zu ihrem Schutz errichtet und staatlich überwacht ist."
    },
    {
      "date": "2025-10-15",
      "id": "134067",
      "original_text": "Registerbekanntmachung nach dem Umwandlungsgesetz\nBremen Amtsgericht Bremen HRA 30559\nRobert Littmann Finanzen e.K. – Bremen",
      "type": "Registerbekanntmachung nach dem Umwandlungsgesetz",
      "state": "Bremen",
      "amtsgericht": "Amtsgericht Bremen",
      "registernummer": "HRA 30559",
      "registerart": "HRA",
      "company_name": "Robert Littmann Finanzen e.K.",
      "company_seat": "Bremen",
      "details": "15.10.2025 (Bekanntmachungsdatum)\n\nBremen Amtsgericht Bremen HRA 30559\nRegisterbekanntmachung nach dem Umwandlungsgesetz 09.10.2025 (Eintragungsdatum)\n\nRobert Littmann Finanzen e.K.\nEinzelkaufmann / Einzelkauffrau\nBremen\n\nAls nicht eingetragen wird veröffentlicht: Den Gläubigern der an der Spaltung beteiligten Rechtsträger ist, wenn sie binnen sechs Monaten nach dem Tag, an dem die Eintragung der Spaltung in das Register des Sitzes desjenigen Rechtsträgers, dessen Gläubiger sie sind, als bekannt gemacht gilt, ihren Anspruch nach Grund und Höhe schriftlich anmelden, Sicherheit zu leisten, soweit sie nicht Befriedigung verlangen können. Dieses Recht steht den Gläubigern jedoch nur zu, wenn sie glaubhaft machen, dass durch die Spaltung die Erfüllung ihrer Forderung gefährdet wird. Das Recht, Sicherheitsleistung zu verlangen, steht Gläubigern nicht zu, die im Falle der Insolvenz ein Recht auf vorzugsweise Befriedigung aus einer Deckungsmasse haben, die nach gesetzlicher Vorschrift zu ihrem Schutz errichtet und staatlich überwacht ist."
    },
    {
      "date": "2025-10-15",
      "id": "134068",
      "original_text": "Registerbekanntmachung nach dem Umwandlungsgesetz\nBremen Amtsgericht Bremen HRB 41946\nRobert Littmann Immobilien GmbH – Bremen",
      "type": "Registerbekanntmachung nach dem Umwandlungsgesetz",
      "state": "Bremen",
      "amtsgericht": "Amtsgericht Bremen",
      "registernummer": "HRB 41946",
      "registerart": "HRB",
      "company_name": "Robert Littmann Immobilien GmbH",
      "company_seat": "Bremen",
      "details": "15.10.2025 (Bekanntmachungsdatum)\n\nBremen Amtsgericht Bremen HRB 41946\nRegisterbekanntmachung nach dem Umwandlungsgesetz 09.10.2025 (Eintragungsdatum)\n\nRobert Littmann Immobilien GmbH\nGesellschaft mit beschränkter Haftung\nBremen\n\nZu Eintragungsnummer 1 vom 09.10.2025 wird als nicht eingetragen veröffentlicht:  Den Gläubigern der an der Spaltung beteiligten Rechtsträger ist, wenn sie binnen sechs Monaten nach dem Tag, an dem die Eintragung der Spaltung in das Register des Sitzes desjenigen Rechtsträgers, dessen Gläubiger sie sind, als bekannt gemacht gilt, ihren Anspruch nach Grund und Höhe schriftlich anmelden, Sicherheit zu leisten, soweit sie nicht Befriedigung verlangen können. Dieses Recht steht den Gläubigern jedoch nur zu, wenn sie glaubhaft machen, dass durch die Spaltung die Erfüllung ihrer Forderung gefährdet wird. Das Recht, Sicherheitsleistung zu verlangen, steht Gläubigern nicht zu, die im Falle der Insolvenz ein Recht auf vorzugsweise Befriedigung aus einer Deckungsmasse haben, die nach gesetzlicher Vorschrift zu ihrem Schutz errichtet und staatlich überwacht ist."
    },
    {
      "date": "2025-10-15",
      "id": "134069",
      "original_text": "Registerbekanntmachung nach dem Umwandlungsgesetz\nBremen Amtsgericht Bremen HRB 41947\nRobert Littmann Finanzen GmbH – Bremen",
      "type": "Registerbekanntmachung nach dem Umwandlungsgesetz",
      "state": "Bremen",
      "amtsgericht": "Amtsgericht Bremen",
      "registernummer": "HRB 41947",
      "registerart": "HRB",
      "company_name": "Robert Littmann Finanzen GmbH",
      "company_seat": "Bremen",
      "details": "15.10.2025 (Bekanntmachungsdatum)\n\nBremen Amtsgericht Bremen HRB 41947\nRegisterbekanntmachung nach dem Umwandlungsgesetz 09.10.2025 (Eintragungsdatum)\n\nRobert Littmann Finanzen GmbH\nGesellschaft mit beschränkter Haftung\nBremen\n\nZu Eintragungsnummer 1 vom 09.10.2025 wird als nicht eingetragen veröffentlicht:  Den Gläubigern der an der Spaltung beteiligten Rechtsträger ist, wenn sie binnen sechs Monaten nach dem Tag, an dem die Eintragung der Spaltung in das Register des Sitzes desjenigen Rechtsträgers, dessen Gläubiger sie sind, als bekannt gemacht gilt, ihren Anspruch nach Grund und Höhe schriftlich anmelden, Sicherheit zu leisten, soweit sie nicht Befriedigung verlangen können. Dieses Recht steht den Gläubigern jedoch nur zu, wenn sie glaubhaft machen, dass durch die Spaltung die Erfüllung ihrer Forderung gefährdet wird. Das Recht, Sicherheitsleistung zu verlangen, steht Gläubigern nicht zu, die im Falle der Insolvenz ein Recht auf vorzugsweise Befriedigung aus einer Deckungsmasse haben, die nach gesetzlicher Vorschrift zu ihrem Schutz errichtet und staatlich überwacht ist."
    },
    {
      "date": "2025-10-15",
      "id": "134070",
      "original_text": "Löschungsankündigung\nRheinland-Pfalz Amtsgericht Ludwigshafen a.Rhein (Ludwigshafen) HRB 67173\nMegusta Kebap GmbH – Ludwigshafen am Rhein",
      "type": "Löschungsankündigung",
      "state": "Rheinland-Pfalz",
      "amtsgericht": "Amtsgericht Ludwigshafen a.Rhein (Ludwigshafen)",
      "registernummer": "HRB 67173",
      "registerart": "HRB",
      "company_name": "Megusta Kebap GmbH",
      "company_seat": "Ludwigshafen am Rhein",
      "details": "15.10.2025 (Bekanntmachungsdatum)\n\nRheinland-Pfalz Amtsgericht Ludwigshafen a.Rhein (Ludwigshafen) HRB 67173\nLöschungsankündigung\n\nMegusta Kebap GmbH\nGesellschaft mit beschränkter Haftung\nLudwigshafen am Rhein\n\nDas Registergericht beabsichtigt die Gesellschaft von Amts wegen nach § 394 FamFG zu löschen. Die Frist zur Erhebung eines Widerspruchs ist auf einen Monat festgesetzt."
    },
    {
      "date": "2025-10-15",
      "id": "134071",
      "original_text": "Löschungsankündigung\nRheinland-Pfalz Amtsgericht Montabaur HRB 14727\nIngenieurbüro Jungbluth Verwaltungs-GmbH – Leubsdorf",
      "type": "Löschungsankündigung",
      "state": "Rheinland-Pfalz",
      "amtsgericht": "Amtsgericht Montabaur",
      "registernummer": "HRB 14727",
      "registerart": "HRB",
      "company_name": "Ingenieurbüro Jungbluth Verwaltungs-GmbH",
      "company_seat": "Leubsdorf",
      "details": "15.10.2025 (Bekanntmachungsdatum)\n\nRheinland-Pfalz Amtsgericht Montabaur HRB 14727\nLöschungsankündigung\n\nIngenieurbüro Jungbluth Verwaltungs-GmbH\nGesellschaft mit beschränkter Haftung\nLeubsdorf\n\nDas Registergericht beabsichtigt die Gesellschaft von Amts wegen nach § 394 FamFG zu löschen. Die Frist zur Erhebung eines Widerspruchs ist auf einen Monat festgesetzt."
    },
    {
      "date": "2025-10-15",
      "id": "134072",
      "original_text": "Löschungsankündigung\nRheinland-Pfalz Amtsgericht Wittlich HRB 46119\nGebäudereinigung24 UG (haftungsbeschränkt) – Trier",
      "type": "Löschungsankündigung",
      "state": "Rheinland-Pfalz",
      "amtsgericht": "Amtsgericht Wittlich",
      "registernummer": "HRB 46119",
      "registerart": "HRB",
      "company_name": "Gebäudereinigung24 UG (haftungsbeschränkt)",
      "company_seat": "Trier",
      "details": "15.10.2025 (Bekanntmachungsdatum)\n\nRheinland-Pfalz Amtsgericht Wittlich HRB 46119\nLöschungsankündigung 15.10.2025 (Eintragungsdatum)\n\nGebäudereinigung24 UG (haftungsbeschränkt)\nGesellschaft mit beschränkter Haftung\nTrier\n\nDas Registergericht beabsichtigt die Gesellschaft von Amts wegen nach § 394 FamFG zu löschen. Die Frist zur Erhebung eines Widerspruchs ist auf einen Monat festgesetzt."
    },
    {
      "date": "2025-10-15",
      "id": "134073",
      "original_text": "Löschungsankündigung\nRheinland-Pfalz Amtsgericht Montabaur HRB 23127\nCASA TERMICA UG (haftungsbeschränkt) – Burglahr",
      "type": "Löschungsankündigung",
      "state": "Rheinland-Pfalz",
      "amtsgericht": "Amtsgericht Montabaur",
      "registernummer": "HRB 23127",
      "registerart": "HRB",
      "company_name": "CASA TERMICA UG (haftungsbeschränkt)",
      "company_seat": "Burglahr",
      "details": "15.10.2025 (Bekanntmachungsdatum)\n\nRheinland-Pfalz Amtsgericht Montabaur HRB 23127\nLöschungsankündigung\n\nCASA TERMICA UG (haftungsbeschränkt)\nGesellschaft mit beschränkter Haftung\nBurglahr\n\nDas Registergericht beabsichtigt die Gesellschaft von Amts wegen nach § 394 FamFG zu löschen. Die Frist zur Erhebung eines Widerspruchs ist auf einen Monat festgesetzt."
    },
    {
      "date": "2025-10-15",
      "id": "134074",
      "original_text": "Löschungsankündigung\nRheinland-Pfalz Amtsgericht Montabaur HRB 25794\nMiPal GmbH – Dierdorf",
      "type": "Löschungsankündigung",
      "state": "Rheinland-Pfalz",
      "amtsgericht": "Amtsgericht Montabaur",
      "registernummer": "HRB 25794",
      "registerart": "HRB",
      "company_name": "MiPal GmbH",
      "company_seat": "Dierdorf",
      "details": "15.10.2025 (Bekanntmachungsdatum)\n\nRheinland-Pfalz Amtsgericht Montabaur HRB 25794\nLöschungsankündigung\n\nMiPal GmbH\nGesellschaft mit beschränkter Haftung\nDierdorf\n\nDas Registergericht beabsichtigt die Gesellschaft von Amts wegen nach § 394 FamFG zu löschen. Die Frist zur Erhebung eines Widerspruchs ist auf einen Monat festgesetzt."
    },
    {
      "date": "2025-10-15",
      "id": "134075",
      "original_text": "Registerbekanntmachung nach dem Umwandlungsgesetz\nRheinland-Pfalz Amtsgericht Ludwigshafen a.Rhein (Ludwigshafen) HRB 68244\nAniCura Speyer GmbH – Speyer",
      "type": "Registerbekanntmachung nach dem Umwandlungsgesetz",
      "state": "Rheinland-Pfalz",
      "amtsgericht": "Amtsgericht Ludwigshafen a.Rhein (Ludwigshafen)",
      "registernummer": "HRB 68244",
      "registerart": "HRB",
      "company_name": "AniCura Speyer GmbH",
      "company_seat": "Speyer",
      "details": "15.10.2025 (Bekanntmachungsdatum)\n\nRheinland-Pfalz Amtsgericht Ludwigshafen a.Rhein (Ludwigshafen) HRB 68244\nRegisterbekanntmachung nach dem Umwandlungsgesetz 13.10.2025 (Eintragungsdatum)\n\nAniCura Speyer GmbH\nGesellschaft mit beschränkter Haftung\nSpeyer\n\nAls nicht eingetragen wird veröffentlicht: Den Gläubigern der an der Verschmelzung beteiligten Rechtsträger ist, wenn sie binnen sechs Monaten nach dem Tag, an dem die Eintragung der Verschmelzung in das Register des Sitzes desjenigen Rechtsträgers,dessen Gläubiger sie sind, nach § 19 Abs. 3 UmwG als bekannt gemacht gilt, ihren Anspruch nach Grund und Höhe schriftlich anmelden, Sicherheit zu leisten, soweit sie nicht Befriedigung verlangen können. Dieses Recht steht den Gläubigern jedoch nur zu, wenn sie glaubhaft machen, dass durch die Verschmelzung die Erfüllungd er Forderung gefährdet wird."
    },
    {
      "date": "2025-10-15",
      "id": "134076",
      "original_text": "Registerbekanntmachung nach dem Umwandlungsgesetz\nNordrhein-Westfalen Amtsgericht Paderborn HRB 16246\nMSV Holding GmbH – Salzkotten",
      "type": "Registerbekanntmachung nach dem Umwandlungsgesetz",
      "state": "Nordrhein-Westfalen",
      "amtsgericht": "Amtsgericht Paderborn",
      "registernummer": "HRB 16246",
      "registerart": "HRB",
      "company_name": "MSV Holding GmbH",
      "company_seat": "Salzkotten",
      "details": "15.10.2025 (Bekanntmachungsdatum)\n\nNordrhein-Westfalen Amtsgericht Paderborn HRB 16246\nRegisterbekanntmachung nach dem Umwandlungsgesetz 15.10.2025 (Eintragungsdatum)\n\nMSV Holding GmbH\nGesellschaft mit beschränkter Haftung\nSalzkotten\n\nDen Gläubigern der an der Verschmelzung beteiligten Rechtsträger ist, wenn sie binnen sechs Monaten nach dem Tag, an dem die Eintragung der Verschmelzung in das Register des Sitzes desjenigen Rechtsträgers, dessen Gläubiger sie sind, nach § 19 Absatz 3 UmwG als bekanntgemacht gilt, ihren Anspruch nach Grund und Höhe schriftlich anmelden, Sicherheit zu leisten, soweit sie nicht Befriedigung verlangen können. Dieses Recht steht den Gläubigern jedoch nur zu, wenn sie glaubhaft machen, dass durch die Verschmelzung die Erfüllung ihrer Forderung gefährdet wird."
    },
    {
      "date": "2025-10-15",
      "id": "134077",
      "original_text": "Einreichung neuer Dokumente\nNordrhein-Westfalen Amtsgericht Essen HRB 29906\nthyssenkrupp Polysius GmbH – Essen",
      "type": "Einreichung neuer Dokumente",
      "state": "Nordrhein-Westfalen",
      "amtsgericht": "Amtsgericht Essen",
      "registernummer": "HRB 29906",
      "registerart": "HRB",
      "company_name": "thyssenkrupp Polysius GmbH",
      "company_seat": "Essen",
      "details": "15.10.2025 (Bekanntmachungsdatum)\n\nNordrhein-Westfalen Amtsgericht Essen HRB 29906\nEinreichung neuer Dokumente\n\nthyssenkrupp Polysius GmbH\nGesellschaft mit beschränkter Haftung\nEssen\n\nDem Registergericht ist eine neue Liste der Mitglieder des Aufsichtsrates eingereicht worden."
    },
    {
      "date": "2025-10-15",
      "id": "134078",
      "original_text": "Registerbekanntmachung nach dem Umwandlungsgesetz\nNordrhein-Westfalen Amtsgericht Bochum HRB 20510\nKelvion PHE ll GmbH – Bochum",
      "type": "Registerbekanntmachung nach dem Umwandlungsgesetz",
      "state": "Nordrhein-Westfalen",
      "amtsgericht": "Amtsgericht Bochum",
      "registernummer": "HRB 20510",
      "registerart": "HRB",
      "company_name": "Kelvion PHE ll GmbH",
      "company_seat": "Bochum",
      "details": "15.10.2025 (Bekanntmachungsdatum)\n\nNordrhein-Westfalen Amtsgericht Bochum HRB 20510\nRegisterbekanntmachung nach dem Umwandlungsgesetz 14.10.2025 (Eintragungsdatum)\n\nKelvion PHE ll GmbH\nGesellschaft mit beschränkter Haftung\nBochum\n\nDen Gläubigern der an der Abspaltung beteiligten Rechtsträger ist, wenn sie binnen sechs Monaten nach dem Tag, an dem die Eintragung der Abspaltung in das Register des Sitzes desjenigen Rechtsträgers, dessen Gläubiger sie sind, nach § 19 Absatz 3 UmwG als bekanntgemacht gilt, ihren Anspruch nach Grund und Höhe schriftlich anmelden, Sicherheit zu leisten, soweit sie nicht Befriedigung verlangen können. Dieses Recht steht den Gläubigern jedoch nur zu, wenn sie glaubhaft machen, dass durch die Abspaltung die Erfüllung ihrer Forderung gefährdet wird."
    },
    {
      "date": "2025-10-15",
      "id": "134079",
      "original_text": "Registerbekanntmachung nach dem Umwandlungsgesetz\nNordrhein-Westfalen Amtsgericht Essen HRB 15225\nAlgoMed GmbH – Hattingen",
      "type": "Registerbekanntmachung nach dem Umwandlungsgesetz",
      "state": "Nordrhein-Westfalen",
      "amtsgericht": "Amtsgericht Essen",
      "registernummer": "HRB 15225",
      "registerart": "HRB",
      "company_name": "AlgoMed GmbH",
      "company_seat": "Hattingen",
      "details": "15.10.2025 (Bekanntmachungsdatum)\n\nNordrhein-Westfalen Amtsgericht Essen HRB 15225\nRegisterbekanntmachung nach dem Umwandlungsgesetz 15.10.2025 (Eintragungsdatum)\n\nAlgoMed GmbH\nGesellschaft mit beschränkter Haftung\nHattingen\n\nDen Gläubigern der an der Verschmelzung beteiligten Rechtsträger ist, wenn sie binnen sechs Monaten nach dem Tag, an dem die Eintragung der Verschmelzung in das Register des Sitzes derjenigen Rechtsträger deren Gläubiger sie sind, nach § 19 Absatz 3 UmwG als bekanntgemacht gilt, ihren Anspruch nach Grund und Höhe schriftlich anmelden, Sicherheit zu leisten, soweit sie nicht Befriedigung verlangen können. Dieses Recht steht den Gläubigern jedoch nur zu, wenn sie glaubhaft machen, dass durch die Verschmelzung die Erfüllung ihrer Forderung gefährdet wird."
    },
    {
      "date": "2025-10-15",
      "id": "134080",
      "original_text": "Löschungsankündigung\nNordrhein-Westfalen Amtsgericht Gütersloh HRB 8240\nErdwärme Equipment GmbH – Gütersloh",
      "type": "Löschungsankündigung",
      "state": "Nordrhein-Westfalen",
      "amtsgericht": "Amtsgericht Gütersloh",
      "registernummer": "HRB 8240",
      "registerart": "HRB",
      "company_name": "Erdwärme Equipment GmbH",
      "company_seat": "Gütersloh",
      "details": "15.10.2025 (Bekanntmachungsdatum)\n\nNordrhein-Westfalen Amtsgericht Gütersloh HRB 8240\nLöschungsankündigung 15.10.2025 (Eintragungsdatum)\n\nErdwärme Equipment GmbH\nGesellschaft mit beschränkter Haftung\nGütersloh\n\nDas Registergericht beabsichtigt die Gesellschaft von Amts wegen nach § 394 FamFG zu löschen. Die Frist zur Erhebung eines Widerspruchs ist auf einen Monat festgesetzt."
    },
    {
      "date": "2025-10-15",
      "id": "134081",
      "original_text": "Löschungsankündigung\nNordrhein-Westfalen Amtsgericht Neuss HRB 21632\nMeermed GmbH – Neuss",
      "type": "Löschungsankündigung",
      "state": "Nordrhein-Westfalen",
      "amtsgericht": "Amtsgericht Neuss",
      "registernummer": "HRB 21632",
      "registerart": "HRB",
      "company_name": "Meermed GmbH",
      "company_seat": "Neuss",
      "details": "15.10.2025 (Bekanntmachungsdatum)\n\nNordrhein-Westfalen Amtsgericht Neuss HRB 21632\nLöschungsankündigung 15.10.2025 (Eintragungsdatum)\n\nMeermed GmbH\nGesellschaft mit beschränkter Haftung\nNeuss\n\nEs ist beabsichtigt, die Gesellschaft wegen Vermögenslosigkeit aufgrund des § 394 Abs. 1 FamFG zu löschen. Frist zur Geltendmachung eines Widerspruchs: 1 Monat.\n\nRechtsbehelfsbelehrung:\nGegen diese Verfügung können Sie Widerspruch einlegen.\nDer Widerspruch ist bei dem Amtsgericht Neuss - Registergericht -, Breite Str. 48, 41460 Neuss schriftlich in deutscher Sprache oder zur Niederschrift der Geschäftsstelle einzulegen.\nDer Widerspruch kann auch zur Niederschrift der Geschäftsstelle eines jeden Amtsgerichtes abgegeben werden.\nDie Einlegung ist auch durch Übertragung eines elektronischen Dokuments an die elektronische Poststelle des Gerichts möglich. Das elektronische Dokument muss für die Bearbeitung durch das Gericht geeignet und mit einer qualifizierten elektronischen Signatur der verantwortenden Person versehen sein oder von der verantwortenden Person signiert und auf einem sicheren Übermittlungsweg gemäß § 130a ZPO nach näherer Maßgabe der Verordnung über die technischen Rahmenbedingungen des elektronischen Rechtsverkehrs und über das besondere elektronische Behördenpostfach (BGBl. I, S.3803) eingereicht werden. Weitere Informationen erhalten Sie auf der Internetseite www.justiz.de.\nDer Widerspruch muss spätestens innerhalb der gesetzten Frist nach der schriftlichen Bekanntgabe der Verfügung bei dem Amtsgericht - Registergericht - Neuss eingegangen sein. Dies gilt auch dann, wenn der Widerspruch zur Niederschrift der Geschäftsstelle eines anderen Amtsgerichtes abgegeben wurde. Die Frist beginnt mit der schriftlichen Bekanntgabe der Verfügung. Die Bekanntgabe ist entweder durch Zustellung oder am dritten Tage nach Aufgabe zur Post bewirkt. Fällt das Ende der Frist auf einen Sonntag, einen allgemeinen Feiertag oder Sonnabend, so endet die Frist mit Ablauf des nächsten Werktages.\n\nDer Widerspruch muss die Bezeichnung der angefochtenen Verfügung sowie die Erklärung enthalten, dass Widerspruch gegen diese Verfügung eingelegt wird. Er ist zu unterzeichnen und soll begründet werden."
    },
    {
      "date": "2025-10-15",
      "id": "134082",
      "original_text": "Löschungsankündigung\nNordrhein-Westfalen Amtsgericht Wuppertal HRB 32746\nkonzeptier UG (haftungsbeschränkt) – Wuppertal",
      "type": "Löschungsankündigung",
      "state": "Nordrhein-Westfalen",
      "amtsgericht": "Amtsgericht Wuppertal",
      "registernummer": "HRB 32746",
      "registerart": "HRB",
      "company_name": "konzeptier UG (haftungsbeschränkt)",
      "company_seat": "Wuppertal",
      "details": "15.10.2025 (Bekanntmachungsdatum)\n\nNordrhein-Westfalen Amtsgericht Wuppertal HRB 32746\nLöschungsankündigung 07.10.2025 (Eintragungsdatum)\n\nkonzeptier UG (haftungsbeschränkt)\nGesellschaft mit beschränkter Haftung\nWuppertal\n\nDas Registergericht beabsichtigt die Gesellschaft von Amts wegen nach § 394 FamFG zu löschen. Die Frist zur Erhebung eines Widerspruchs ist auf einen Monat festgesetzt."
    },
    {
      "date": "2025-10-15",
      "id": "134083",
      "original_text": "Registerbekanntmachung nach dem Umwandlungsgesetz\nNordrhein-Westfalen Amtsgericht Bad Oeynhausen HRB 20561\nIngenieurbüro Yassine Experts GmbH – Bad Oeynhausen",
      "type": "Registerbekanntmachung nach dem Umwandlungsgesetz",
      "state": "Nordrhein-Westfalen",
      "amtsgericht": "Amtsgericht Bad Oeynhausen",
      "registernummer": "HRB 20561",
      "registerart": "HRB",
      "company_name": "Ingenieurbüro Yassine Experts GmbH",
      "company_seat": "Bad Oeynhausen",
      "details": "15.10.2025 (Bekanntmachungsdatum)\n\nNordrhein-Westfalen Amtsgericht Bad Oeynhausen HRB 20561\nRegisterbekanntmachung nach dem Umwandlungsgesetz 15.10.2025 (Eintragungsdatum)\n\nIngenieurbüro Yassine Experts GmbH\nGesellschaft mit beschränkter Haftung\nBad Oeynhausen\n\nDen Gläubigern der an der formwechselnden Umwandlung beteiligten Rechtsträger ist, wenn sie binnen sechs Monaten nach dem Tag, an dem die Eintragung der formwechselnden Umwandlung in das Register des Sitzes desjenigen Rechtsträgers, dessen Gläubiger sie sind, nach § 19 Absatz 3 UmwG als bekanntgemacht gilt, ihren Anspruch nach Grund und Höhe schriftlich anmelden, Sicherheit zu leisten, soweit sie nicht Befriedigung verlangen können. Dieses Recht steht den Gläubigern jedoch nur zu, wenn sie glaubhaft machen, dass durch die formwechselnden Umwandlung die Erfüllung ihrer Forderung gefährdet wird."
    },
    {
      "date": "2025-10-15",
      "id": "134084",
      "original_text": "Registerbekanntmachung nach dem Umwandlungsgesetz\nNordrhein-Westfalen Amtsgericht Bad Oeynhausen HRB 13829\nHäcker Holding GmbH – Rödinghausen",
      "type": "Registerbekanntmachung nach dem Umwandlungsgesetz",
      "state": "Nordrhein-Westfalen",
      "amtsgericht": "Amtsgericht Bad Oeynhausen",
      "registernummer": "HRB 13829",
      "registerart": "HRB",
      "company_name": "Häcker Holding GmbH",
      "company_seat": "Rödinghausen",
      "details": "15.10.2025 (Bekanntmachungsdatum)\n\nNordrhein-Westfalen Amtsgericht Bad Oeynhausen HRB 13829\nRegisterbekanntmachung nach dem Umwandlungsgesetz 15.10.2025 (Eintragungsdatum)\n\nHäcker Holding GmbH\nGesellschaft mit beschränkter Haftung\nRödinghausen\n\nDen Gläubigern der an der formwechselnden Umwandlung beteiligten Rechtsträger ist, wenn sie binnen sechs Monaten nach dem Tag, an dem die Eintragung der formwechselnden Umwandlung in das Register des Sitzes desjenigen Rechtsträgers, dessen Gläubiger sie sind, nach § 19 Absatz 3 UmwG als bekanntgemacht gilt, ihren Anspruch nach Grund und Höhe schriftlich anmelden, Sicherheit zu leisten, soweit sie nicht Befriedigung verlangen können. Dieses Recht steht den Gläubigern jedoch nur zu, wenn sie glaubhaft machen, dass durch die formwechselnden Umwandlung die Erfüllung ihrer Forderung gefährdet wird."
    },
    {
      "date": "2025-10-15",
      "id": "134085",
      "original_text": "Löschungsankündigung\nNordrhein-Westfalen Amtsgericht Dortmund HRB 26874\nEVT UG (haftungsbeschränkt) – Dortmund",
      "type": "Löschungsankündigung",
      "state": "Nordrhein-Westfalen",
      "amtsgericht": "Amtsgericht Dortmund",
      "registernummer": "HRB 26874",
      "registerart": "HRB",
      "company_name": "EVT UG (haftungsbeschränkt)",
      "company_seat": "Dortmund",
      "details": "15.10.2025 (Bekanntmachungsdatum)\n\nNordrhein-Westfalen Amtsgericht Dortmund HRB 26874\nLöschungsankündigung\n\nEVT UG (haftungsbeschränkt)\nGesellschaft mit beschränkter Haftung\nDortmund\n\nDas Registergericht beabsichtigt die Gesellschaft von Amts wegen nach § 394 FamFG zu löschen. Die Frist zur Erhebung eines Widerspruchs ist auf zwei Monate festgesetzt."
    },
    {
      "date": "2025-10-15",
      "id": "134086",
      "original_text": "Registerbekanntmachung nach dem Umwandlungsgesetz\nNordrhein-Westfalen Amtsgericht Bad Oeynhausen HRB 20562\nRFH Chemie GmbH – Bünde",
      "type": "Registerbekanntmachung nach dem Umwandlungsgesetz",
      "state": "Nordrhein-Westfalen",
      "amtsgericht": "Amtsgericht Bad Oeynhausen",
      "registernummer": "HRB 20562",
      "registerart": "HRB",
      "company_name": "RFH Chemie GmbH",
      "company_seat": "Bünde",
      "details": "15.10.2025 (Bekanntmachungsdatum)\n\nNordrhein-Westfalen Amtsgericht Bad Oeynhausen HRB 20562\nRegisterbekanntmachung nach dem Umwandlungsgesetz 15.10.2025 (Eintragungsdatum)\n\nRFH Chemie GmbH\nGesellschaft mit beschränkter Haftung\nBünde\n\nDen Gläubigern der an der formwechselnden Umwandlung beteiligten Rechtsträger ist, wenn sie binnen sechs Monaten nach dem Tag, an dem die Eintragung der formwechselnden Umwandlung in das Register des Sitzes desjenigen Rechtsträgers, dessen Gläubiger sie sind, nach § 19 Absatz 3 UmwG als bekanntgemacht gilt, ihren Anspruch nach Grund und Höhe schriftlich anmelden, Sicherheit zu leisten, soweit sie nicht Befriedigung verlangen können. Dieses Recht steht den Gläubigern jedoch nur zu, wenn sie glaubhaft machen, dass durch die formwechselnden Umwandlung die Erfüllung ihrer Forderung gefährdet wird."
    },
    {
      "date": "2025-10-15",
      "id": "134087",
      "original_text": "Registerbekanntmachung nach dem Umwandlungsgesetz\nNordrhein-Westfalen Amtsgericht Hamm HRA 4676\nTelefonbuchverlag Rubens GmbH & Co. KG – Unna",
      "type": "Registerbekanntmachung nach dem Umwandlungsgesetz",
      "state": "Nordrhein-Westfalen",
      "amtsgericht": "Amtsgericht Hamm",
      "registernummer": "HRA 4676",
      "registerart": "HRA",
      "company_name": "Telefonbuchverlag Rubens GmbH & Co. KG",
      "company_seat": "Unna",
      "details": "15.10.2025 (Bekanntmachungsdatum)\n\nNordrhein-Westfalen Amtsgericht Hamm HRA 4676\nRegisterbekanntmachung nach dem Umwandlungsgesetz 08.10.2025 (Eintragungsdatum)\n\nTelefonbuchverlag Rubens GmbH & Co. KG\nKommanditgesellschaft\nUnna\n\nDen Gläubigern der an der Abspaltung beteiligten Rechtsträger ist, wenn sie binnen sechs Monaten nach dem Tag, an dem die Eintragung der Abspaltung in das Register des Sitzes desjenigen Rechtsträgers, dessen Gläubiger sie sind, nach § 19 Absatz 3 UmwG als bekanntgemacht gilt, ihren Anspruch nach Grund und Höhe schriftlich anmelden, Sicherheit zu leisten, soweit sie nicht Befriedigung verlangen können. Dieses Recht steht den Gläubigern jedoch nur zu, wenn sie glaubhaft machen, dass durch die Abspaltung die Erfüllung ihrer Forderung gefährdet wird."
    },
    {
      "date": "2025-10-15",
      "id": "134088",
      "original_text": "Registerbekanntmachung nach dem Umwandlungsgesetz\nNordrhein-Westfalen Amtsgericht Paderborn HRB 17092\nHoddenberg-Wind GmbH – Willebadessen",
      "type": "Registerbekanntmachung nach dem Umwandlungsgesetz",
      "state": "Nordrhein-Westfalen",
      "amtsgericht": "Amtsgericht Paderborn",
      "registernummer": "HRB 17092",
      "registerart": "HRB",
      "company_name": "Hoddenberg-Wind GmbH",
      "company_seat": "Willebadessen",
      "details": "15.10.2025 (Bekanntmachungsdatum)\n\nNordrhein-Westfalen Amtsgericht Paderborn HRB 17092\nRegisterbekanntmachung nach dem Umwandlungsgesetz 15.10.2025 (Eintragungsdatum)\n\nHoddenberg-Wind GmbH\nGesellschaft mit beschränkter Haftung\nWillebadessen\n\nDen Gläubigern der an der formwechselnden Umwandlung beteiligten Rechtsträger ist, wenn sie binnen sechs Monaten nach dem Tag, an dem die Eintragung der formwechselnden Umwandlung in das Register des Sitzes desjenigen Rechtsträgers, dessen Gläubiger sie sind, nach § 19 Absatz 3 UmwG als bekanntgemacht gilt, ihren Anspruch nach Grund und Höhe schriftlich anmelden, Sicherheit zu leisten, soweit sie nicht Befriedigung verlangen können. Dieses Recht steht den Gläubigern jedoch nur zu, wenn sie glaubhaft machen, dass durch die formwechselnden Umwandlung die Erfüllung ihrer Forderung gefährdet wird."
    },
    {
      "date": "2025-10-15",
      "id": "134089",
      "original_text": "Registerbekanntmachung nach dem Umwandlungsgesetz\nNordrhein-Westfalen Amtsgericht Krefeld HRB 15225\nSCHIK Transporte GmbH – Krefeld",
      "type": "Registerbekanntmachung nach dem Umwandlungsgesetz",
      "state": "Nordrhein-Westfalen",
      "amtsgericht": "Amtsgericht Krefeld",
      "registernummer": "HRB 15225",
      "registerart": "HRB",
      "company_name": "SCHIK Transporte GmbH",
      "company_seat": "Krefeld",
      "details": "15.10.2025 (Bekanntmachungsdatum)\n\nNordrhein-Westfalen Amtsgericht Krefeld HRB 15225\nRegisterbekanntmachung nach dem Umwandlungsgesetz 15.10.2025 (Eintragungsdatum)\n\nSCHIK Transporte GmbH\nGesellschaft mit beschränkter Haftung\nKrefeld\n\nDen Gläubigern der an der Verschmelzung beteiligten Rechtsträger ist, wenn sie binnen sechs Monaten nach dem Tag, an dem die Eintragung der Verschmelzung in das Register des Sitzes desjenigen Rechtsträgers, dessen Gläubiger sie sind, nach § 19 Absatz 3 UmwG als bekanntgemacht gilt, ihren Anspruch nach Grund und Höhe schriftlich anmelden, Sicherheit zu leisten, soweit sie nicht Befriedigung verlangen können. Dieses Recht steht den Gläubigern jedoch nur zu, wenn sie glaubhaft machen, dass durch die Verschmelzung die Erfüllung ihrer Forderung gefährdet wird."
    },
    {
      "date": "2025-10-15",
      "id": "134090",
      "original_text": "Löschungsankündigung\nNordrhein-Westfalen Amtsgericht Köln HRB 123763\nBalseroni Bau UG (haftungsbeschränkt) – Kerpen",
      "type": "Löschungsankündigung",
      "state": "Nordrhein-Westfalen",
      "amtsgericht": "Amtsgericht Köln",
      "registernummer": "HRB 123763",
      "registerart": "HRB",
      "company_name": "Balseroni Bau UG (haftungsbeschränkt)",
      "company_seat": "Kerpen",
      "details": "15.10.2025 (Bekanntmachungsdatum)\n\nNordrhein-Westfalen Amtsgericht Köln HRB 123763\nLöschungsankündigung\n\nBalseroni Bau UG (haftungsbeschränkt)\nGesellschaft mit beschränkter Haftung\nKerpen\n\nDas Registergericht beabsichtigt die Gesellschaft von Amts wegen nach § 394 FamFG zu löschen. Die Frist zur Erhebung eines Widerspruchs ist auf einen Monat festgesetzt."
    },
    {
      "date": "2025-10-15",
      "id": "134091",
      "original_text": "Löschungsankündigung\nNordrhein-Westfalen Amtsgericht Mönchengladbach HRA 6565\nTC-Besswa Ltd. & Co KG – Mönchengladbach",
      "type": "Löschungsankündigung",
      "state": "Nordrhein-Westfalen",
      "amtsgericht": "Amtsgericht Mönchengladbach",
      "registernummer": "HRA 6565",
      "registerart": "HRA",
      "company_name": "TC-Besswa Ltd. & Co KG",
      "company_seat": "Mönchengladbach",
      "details": "15.10.2025 (Bekanntmachungsdatum)\n\nNordrhein-Westfalen Amtsgericht Mönchengladbach HRA 6565\nLöschungsankündigung 15.10.2025 (Eintragungsdatum)\n\nTC-Besswa Ltd. & Co KG\nKommanditgesellschaft\nMönchengladbach\n\nDas Registergericht beabsichtigt die Firma von Amts wegen gemäß §§ 393 FamFG 6, 31 Abs. 2 HGB zu löschen.\nDagegen kann binnen einer Frist von 8 Wochen ab Zugang dieser Verfügung Widerspruch unter Angabe der Gründe, die gegen eine Amtslöschung sprechen, beim Amtsgericht Mönchengladbach erhoben werden.\nDer Widerspruch kann schriftlich oder zu Protokoll der Geschäftsstelle binnen oben genannter Frist erklärt werden.\nSollte kein Widerspruch beim Registergericht eingehen, wird die Firma von Amts wegen gelöscht."
    },
    {
      "date": "2025-10-15",
      "id": "134092",
      "original_text": "Registerbekanntmachung nach dem Umwandlungsgesetz\nNordrhein-Westfalen Amtsgericht Münster HRB 8441\nKaschwig GmbH – Sendenhorst",
      "type": "Registerbekanntmachung nach dem Umwandlungsgesetz",
      "state": "Nordrhein-Westfalen",
      "amtsgericht": "Amtsgericht Münster",
      "registernummer": "HRB 8441",
      "registerart": "HRB",
      "company_name": "Kaschwig GmbH",
      "company_seat": "Sendenhorst",
      "details": "15.10.2025 (Bekanntmachungsdatum)\n\nNordrhein-Westfalen Amtsgericht Münster HRB 8441\nRegisterbekanntmachung nach dem Umwandlungsgesetz 15.10.2025 (Eintragungsdatum)\n\nKaschwig GmbH\nGesellschaft mit beschränkter Haftung\nSendenhorst\n\nDen Gläubigern der an der Verschmelzung beteiligten Rechtsträger ist, wenn sie binnen sechs Monaten nach dem Tag, an dem die Eintragung der Verschmelzung in das Register des Sitzes desjenigen Rechtsträgers, dessen Gläubiger sie sind, nach § 19 Absatz 3 UmwG als bekanntgemacht gilt, ihren Anspruch nach Grund und Höhe schriftlich anmelden, Sicherheit zu leisten, soweit sie nicht Befriedigung verlangen können. Dieses Recht steht den Gläubigern jedoch nur zu, wenn sie glaubhaft machen, dass durch die Verschmelzung die Erfüllung ihrer Forderung gefährdet wird."
    },
    {
      "date": "2025-10-15",
      "id": "134093",
      "original_text": "Registerbekanntmachung nach dem Umwandlungsgesetz\nNordrhein-Westfalen Amtsgericht Düsseldorf HRA 28415\nPaxos H6 II GmbH & Co. KG – Düsseldorf",
      "type": "Registerbekanntmachung nach dem Umwandlungsgesetz",
      "state": "Nordrhein-Westfalen",
      "amtsgericht": "Amtsgericht Düsseldorf",
      "registernummer": "HRA 28415",
      "registerart": "HRA",
      "company_name": "Paxos H6 II GmbH & Co. KG",
      "company_seat": "Düsseldorf",
      "details": "15.10.2025 (Bekanntmachungsdatum)\n\nNordrhein-Westfalen Amtsgericht Düsseldorf HRA 28415\nRegisterbekanntmachung nach dem Umwandlungsgesetz 15.10.2025 (Eintragungsdatum)\n\nPaxos H6 II GmbH & Co. KG\nKommanditgesellschaft\nDüsseldorf\n\nDen Gläubigern der an der Ausgliederung beteiligten Rechtsträger ist, wenn sie binnen sechs Monaten nach dem Tag, an dem die Eintragung der Ausgliederung in das Register des Sitzes desjenigen Rechtsträgers, dessen Gläubiger sie sind, nach § 19 Absatz 3 UmwG als bekanntgemacht gilt, ihren Anspruch nach Grund und Höhe schriftlich anmelden, Sicherheit zu leisten, soweit sie nicht Befriedigung verlangen können. Dieses Recht steht den Gläubigern jedoch nur zu, wenn sie glaubhaft machen, dass durch die Ausgliederung die Erfüllung ihrer Forderung gefährdet wird."
    },
    {
      "date": "2025-10-15",
      "id": "134094",
      "original_text": "Löschungsankündigung\nNordrhein-Westfalen Amtsgericht Aachen VR 6191\nDobermann-Rettung e.V. – Roetgen",
      "type": "Löschungsankündigung",
      "state": "Nordrhein-Westfalen",
      "amtsgericht": "Amtsgericht Aachen",
      "registernummer": "VR 6191",
      "registerart": "VR",
      "company_name": "Dobermann-Rettung e.V.",
      "company_seat": "Roetgen",
      "details": "15.10.2025 (Bekanntmachungsdatum)\n\nNordrhein-Westfalen Amtsgericht Aachen VR 6191\nLöschungsankündigung\n\nDobermann-Rettung e.V.\neingetragener Verein\nRoetgen\n\nDas Registergericht beabsichtigt, von Amts wegen folgende Eintragung wegen Unzulässigkeit nach § 395 FamFG zu löschen:\n\nEintragung der Schriftführerin Sigrid Heckmann-Mäkler\n\nZur Geltendmachung des Widerspruchs gegen die beabsichtigte Löschung wird hiermit eine Frist von einem Monat ab Veröffentlichung dieser Ankündigung bestimmt.\n\nRechtsbehelfsbelehrung:\n\nGegen diese Verfügung kann Widerspruch eingelegt werden. Zum Widerspruch ist jeder berechtigt, der an der Unterlassung der Löschung ein berechtigtes Interesse hat.\n\nDer Widerspruch ist bei dem Amtsgericht Aachen, Adalbertsteinweg 92, 52070 Aachen schriftlich in deutscher Sprache oder zur Niederschrift der Geschäftsstelle einzulegen. Der Widerspruch kann auch zur Niederschrift der Geschäftsstelle eines jeden Amtsgerichtes abgegeben werden.\n\nDer Widerspruch muss spätestens innerhalb der gesetzten Frist nach der Bekanntgabe der Verfügung bei dem Amtsgericht Aachen eingegangen sein. Dies gilt auch dann, wenn der Widerspruch zur Niederschrift der Geschäftsstelle eines anderen Amtsgerichtes abgegeben wurde. Die Frist beginnt mit der Bekanntgabe der Verfügung durch Veröffentlichung. Fällt das Ende der Frist auf einen Sonntag, einen allgemeinen Feiertag oder Sonnabend, so endet die Frist mit Ablauf des nächsten Werktages.\n\nDer Widerspruch muss die Bezeichnung der angefochtenen Verfügung sowie die Erklärung enthalten, dass Widerspruch gegen diese Verfügung eingelegt wird. Er ist zu unterzeichnen und soll begründet werden.\n\nDie Einlegung ist auch durch Übertragung eines elektronischen Dokuments an die elektronische Poststelle des Gerichts möglich. Das elektronische Dokument muss für die Bearbeitung durch das Gericht geeignet und mit einer qualifizierten elektronischen Signatur der verantwortenden Person versehen sein oder von der verantwortenden Person signiert und auf einem sicheren Übermittlungsweg gemäß § 130 a ZPO nach näherer Maßgabe der Verordnung über die technischen Rahmenbedingungen des elektronischen Rechtsverkehrs und über das besondere elektronische Behördenpostfach (BGBl. I, S. 3803) eingereicht werden. Weitere Informationen erhalten Sie auf der Internetseite www.justiz.de."
    },
    {
      "date": "2025-10-15",
      "id": "134095",
      "original_text": "Registerbekanntmachung nach dem Umwandlungsgesetz\nNordrhein-Westfalen Amtsgericht Essen HRA 12005\nSelection Gabriela Schnieber e.K. – Essen",
      "type": "Registerbekanntmachung nach dem Umwandlungsgesetz",
      "state": "Nordrhein-Westfalen",
      "amtsgericht": "Amtsgericht Essen",
      "registernummer": "HRA 12005",
      "registerart": "HRA",
      "company_name": "Selection Gabriela Schnieber e.K.",
      "company_seat": "Essen",
      "details": "15.10.2025 (Bekanntmachungsdatum)\n\nNordrhein-Westfalen Amtsgericht Essen HRA 12005\nRegisterbekanntmachung nach dem Umwandlungsgesetz 15.10.2025 (Eintragungsdatum)\n\nSelection Gabriela Schnieber e.K.\nEinzelkaufmann / Einzelkauffrau\nEssen\n\nDen Gläubigern der an der Verschmelzung beteiligten Rechtsträger ist, wenn sie binnen sechs Monaten nach dem Tag, an dem die Eintragung der Verschmelzung in das Register des Sitzes desjenigen Rechtsträgers, dessen Gläubiger sie sind, nach § 19 Absatz 3 UmwG als bekanntgemacht gilt, ihren Anspruch nach Grund und Höhe schriftlich anmelden, Sicherheit zu leisten, soweit sie nicht Befriedigung verlangen können. Dieses Recht steht den Gläubigern jedoch nur zu, wenn sie glaubhaft machen, dass durch die Verschmelzung die Erfüllung ihrer Forderung gefährdet wird."
    },
    {
      "date": "2025-10-15",
      "id": "134096",
      "original_text": "Registerbekanntmachung nach dem Umwandlungsgesetz\nNordrhein-Westfalen Amtsgericht Düsseldorf VR 20215 früher Amtsgericht Ratingen\nAero-Club Ratingen e.V. – Ratingen",
      "type": "Registerbekanntmachung nach dem Umwandlungsgesetz",
      "state": "Nordrhein-Westfalen",
      "amtsgericht": "Amtsgericht Düsseldorf",
      "registernummer": "VR 20215",
      "registerart": "VR",
      "company_name": "Aero-Club Ratingen e.V.",
      "company_seat": "Ratingen",
      "former_amtsgericht": "Ratingen",
      "details": "15.10.2025 (Bekanntmachungsdatum)\n\nNordrhein-Westfalen Amtsgericht Düsseldorf VR 20215 früher Amtsgericht Ratingen\nRegisterbekanntmachung nach dem Umwandlungsgesetz 15.10.2025 (Eintragungsdatum)\n\nAero-Club Ratingen e.V.\neingetragener Verein\nRatingen\n\nDen Gläubigern der an der Verschmelzung beteiligten Rechtsträger ist, wenn sie binnen sechs Monaten nach dem Tag, an dem die Eintragung der Verschmelzung in das Register des Sitzes desjenigen Rechtsträgers, dessen Gläubiger sie sind, nach § 19 Absatz 3 UmwG als bekanntgemacht gilt, ihren Anspruch nach Grund und Höhe schriftlich anmelden, Sicherheit zu leisten, soweit sie nicht Befriedigung verlangen können. Dieses Recht steht den Gläubigern jedoch nur zu, wenn sie glaubhaft machen, dass durch die Verschmelzung die Erfüllung ihrer Forderung gefährdet wird."
    },
    {
      "date": "2025-10-15",
      "id": "134097",
      "original_text": "Registerbekanntmachung nach dem Umwandlungsgesetz\nNordrhein-Westfalen Amtsgericht Paderborn HRB 15964\nVigiland GmbH – Paderborn",
      "type": "Registerbekanntmachung nach dem Umwandlungsgesetz",
      "state": "Nordrhein-Westfalen",
      "amtsgericht": "Amtsgericht Paderborn",
      "registernummer": "HRB 15964",
      "registerart": "HRB",
      "company_name": "Vigiland GmbH",
      "company_seat": "Paderborn",
      "details": "15.10.2025 (Bekanntmachungsdatum)\n\nNordrhein-Westfalen Amtsgericht Paderborn HRB 15964\nRegisterbekanntmachung nach dem Umwandlungsgesetz 15.10.2025 (Eintragungsdatum)\n\nVigiland GmbH\nGesellschaft mit beschränkter Haftung\nPaderborn\n\nDen Gläubigern der an der Verschmelzung beteiligten Rechtsträger ist, wenn sie binnen sechs Monaten nach dem Tag, an dem die Eintragung der Verschmelzung in das Register des Sitzes desjenigen Rechtsträgers, dessen Gläubiger sie sind, nach § 19 Absatz 3 UmwG als bekanntgemacht gilt, ihren Anspruch nach Grund und Höhe schriftlich anmelden, Sicherheit zu leisten, soweit sie nicht Befriedigung verlangen können. Dieses Recht steht den Gläubigern jedoch nur zu, wenn sie glaubhaft machen, dass durch die Verschmelzung die Erfüllung ihrer Forderung gefährdet wird."
    },
    {
      "date": "2025-10-15",
      "id": "134098",
      "original_text": "Registerbekanntmachung nach dem Umwandlungsgesetz\nNordrhein-Westfalen Amtsgericht Iserlohn HRA 5725\nTheodor Schulte-Maas e. K. – Neuenrade",
      "type": "Registerbekanntmachung nach dem Umwandlungsgesetz",
      "state": "Nordrhein-Westfalen",
      "amtsgericht": "Amtsgericht Iserlohn",
      "registernummer": "HRA 5725",
      "registerart": "HRA",
      "company_name": "Theodor Schulte-Maas e. K.",
      "company_seat": "Neuenrade",
      "details": "15.10.2025 (Bekanntmachungsdatum)\n\nNordrhein-Westfalen Amtsgericht Iserlohn HRA 5725\nRegisterbekanntmachung nach dem Umwandlungsgesetz 15.10.2025 (Eintragungsdatum)\n\nTheodor Schulte-Maas e. K.\nEinzelkaufmann / Einzelkauffrau\nNeuenrade\n\nDen Gläubigern der an der Ausgliederung beteiligten Rechtsträger ist, wenn sie binnen sechs Monaten nach dem Tag, an dem die Eintragung der Ausgliederung in das Register des Sitzes desjenigen Rechtsträgers, dessen Gläubiger sie sind, nach § 19 Absatz 3 UmwG als bekanntgemacht gilt, ihren Anspruch nach Grund und Höhe schriftlich anmelden, Sicherheit zu leisten, soweit sie nicht Befriedigung verlangen können. Dieses Recht steht den Gläubigern jedoch nur zu, wenn sie glaubhaft machen, dass durch die Ausgliederung die Erfüllung ihrer Forderung gefährdet wird."
    },
    {
      "date": "2025-10-15",
      "id": "134099",
      "original_text": "Registerbekanntmachung nach dem Umwandlungsgesetz\nNordrhein-Westfalen Amtsgericht Düsseldorf HRB 82940\nRuns Sport GmbH – Düsseldorf",
      "type": "Registerbekanntmachung nach dem Umwandlungsgesetz",
      "state": "Nordrhein-Westfalen",
      "amtsgericht": "Amtsgericht Düsseldorf",
      "registernummer": "HRB 82940",
      "registerart": "HRB",
      "company_name": "Runs Sport GmbH",
      "company_seat": "Düsseldorf",
      "details": "15.10.2025 (Bekanntmachungsdatum)\n\nNordrhein-Westfalen Amtsgericht Düsseldorf HRB 82940\nRegisterbekanntmachung nach dem Umwandlungsgesetz 15.10.2025 (Eintragungsdatum)\n\nRuns Sport GmbH\nGesellschaft mit beschränkter Haftung\nDüsseldorf\n\nDen Gläubigern der an der Verschmelzung beteiligten Rechtsträger ist, wenn sie binnen sechs Monaten nach dem Tag, an dem die Eintragung der Verschmelzung in das Register des Sitzes desjenigen Rechtsträgers, dessen Gläubiger sie sind, nach § 19 Absatz 3 UmwG als bekanntgemacht gilt, ihren Anspruch nach Grund und Höhe schriftlich anmelden, Sicherheit zu leisten, soweit sie nicht Befriedigung verlangen können. Dieses Recht steht den Gläubigern jedoch nur zu, wenn sie glaubhaft machen, dass durch die Verschmelzung die Erfüllung ihrer Forderung gefährdet wird."
    },
    {
      "date": "2025-10-15",
      "id": "134100",
      "original_text": "Registerbekanntmachung nach dem Umwandlungsgesetz\nNordrhein-Westfalen Amtsgericht Münster HRB 8377\nR. Kaschwig Schallschutztechnik GmbH – Sendenhorst",
      "type": "Registerbekanntmachung nach dem Umwandlungsgesetz",
      "state": "Nordrhein-Westfalen",
      "amtsgericht": "Amtsgericht Münster",
      "registernummer": "HRB 8377",
      "registerart": "HRB",
      "company_name": "R. Kaschwig Schallschutztechnik GmbH",
      "company_seat": "Sendenhorst",
      "details": "15.10.2025 (Bekanntmachungsdatum)\n\nNordrhein-Westfalen Amtsgericht Münster HRB 8377\nRegisterbekanntmachung nach dem Umwandlungsgesetz\n\nR. Kaschwig Schallschutztechnik GmbH\nGesellschaft mit beschränkter Haftung\nSendenhorst\n\nDen Gläubigern der an der Verschmelzung beteiligten Rechtsträger ist, wenn sie binnen sechs Monaten nach dem Tag, an dem die Eintragung der Verschmelzung in das Register des Sitzes desjenigen Rechtsträgers, dessen Gläubiger sie sind, nach § 19 Absatz 3 UmwG als bekanntgemacht gilt, ihren Anspruch nach Grund und Höhe schriftlich anmelden, Sicherheit zu leisten, soweit sie nicht Befriedigung verlangen können. Dieses Recht steht den Gläubigern jedoch nur zu, wenn sie glaubhaft machen, dass durch die Verschmelzung die Erfüllung ihrer Forderung gefährdet wird."
    },
    {
      "date": "2025-10-15",
      "id": "134101",
      "original_text": "Löschungsankündigung\nNordrhein-Westfalen Amtsgericht Bad Oeynhausen HRB 13113\nSchürmann Energie Beteiligungs-GmbH – Vlotho",
      "type": "Löschungsankündigung",
      "state": "Nordrhein-Westfalen",
      "amtsgericht": "Amtsgericht Bad Oeynhausen",
      "registernummer": "HRB 13113",
      "registerart": "HRB",
      "company_name": "Schürmann Energie Beteiligungs-GmbH",
      "company_seat": "Vlotho",
      "details": "15.10.2025 (Bekanntmachungsdatum)\n\nNordrhein-Westfalen Amtsgericht Bad Oeynhausen HRB 13113\nLöschungsankündigung\n\nSchürmann Energie Beteiligungs-GmbH\nGesellschaft mit beschränkter Haftung\nVlotho\n\nDas Registergericht beabsichtigt die Gesellschaft von Amts wegen nach § 394 FamFG zu löschen. Die Frist zur Erhebung eines Widerspruchs ist auf einen Monat festgesetzt."
    },
    {
      "date": "2025-10-15",
      "id": "134102",
      "original_text": "Registerbekanntmachung nach dem Umwandlungsgesetz\nNordrhein-Westfalen Amtsgericht Düsseldorf HRB 47716\nJüntgen Vermögensverwaltungsgesellschaft mbH – Düsseldorf",
      "type": "Registerbekanntmachung nach dem Umwandlungsgesetz",
      "state": "Nordrhein-Westfalen",
      "amtsgericht": "Amtsgericht Düsseldorf",
      "registernummer": "HRB 47716",
      "registerart": "HRB",
      "company_name": "Jüntgen Vermögensverwaltungsgesellschaft mbH",
      "company_seat": "Düsseldorf",
      "details": "15.10.2025 (Bekanntmachungsdatum)\n\nNordrhein-Westfalen Amtsgericht Düsseldorf HRB 47716\nRegisterbekanntmachung nach dem Umwandlungsgesetz 15.10.2025 (Eintragungsdatum)\n\nJüntgen Vermögensverwaltungsgesellschaft mbH\nGesellschaft mit beschränkter Haftung\nDüsseldorf\n\nDen Gläubigern der an der Verschmelzung beteiligten Rechtsträger ist, wenn sie binnen sechs Monaten nach dem Tag, an dem die Eintragung der Verschmelzung in das Register des Sitzes desjenigen Rechtsträgers, dessen Gläubiger sie sind, nach § 19 Absatz 3 UmwG als bekanntgemacht gilt, ihren Anspruch nach Grund und Höhe schriftlich anmelden, Sicherheit zu leisten, soweit sie nicht Befriedigung verlangen können. Dieses Recht steht den Gläubigern jedoch nur zu, wenn sie glaubhaft machen, dass durch die Verschmelzung die Erfüllung ihrer Forderung gefährdet wird."
    },
    {
      "date": "2025-10-15",
      "id": "134103",
      "original_text": "Löschungsankündigung\nNordrhein-Westfalen Amtsgericht Aachen VR 6191\nDobermann-Rettung e.V. – Roetgen",
      "type": "Löschungsankündigung",
      "state": "Nordrhein-Westfalen",
      "amtsgericht": "Amtsgericht Aachen",
      "registernummer": "VR 6191",
      "registerart": "VR",
      "company_name": "Dobermann-Rettung e.V.",
      "company_seat": "Roetgen",
      "details": "15.10.2025 (Bekanntmachungsdatum)\n\nNordrhein-Westfalen Amtsgericht Aachen VR 6191\nLöschungsankündigung\n\nDobermann-Rettung e.V.\neingetragener Verein\nRoetgen\n\nDas Registergericht beabsichtigt, von Amts wegen folgende Eintragung wegen Unzulässigkeit nach § 395 FamFG zu löschen:\n\n2. Vorsitzende  Nicole Meier\n\nZur Geltendmachung des Widerspruchs gegen die beabsichtigte Löschung wird hiermit eine Frist von einem Monat ab Veröffentlichung dieser Ankündigung bestimmt.\n\nRechtsbehelfsbelehrung:\n\nGegen diese Verfügung kann Widerspruch eingelegt werden. Zum Widerspruch ist jeder berechtigt, der an der Unterlassung der Löschung ein berechtigtes Interesse hat.\n\nDer Widerspruch ist bei dem Amtsgericht Aachen, Adalbertsteinweg 92, 52070 Aachen schriftlich in deutscher Sprache oder zur Niederschrift der Geschäftsstelle einzulegen. Der Widerspruch kann auch zur Niederschrift der Geschäftsstelle eines jeden Amtsgerichtes abgegeben werden.\n\nDer Widerspruch muss spätestens innerhalb der gesetzten Frist nach der Bekanntgabe der Verfügung bei dem Amtsgericht Aachen eingegangen sein. Dies gilt auch dann, wenn der Widerspruch zur Niederschrift der Geschäftsstelle eines anderen Amtsgerichtes abgegeben wurde. Die Frist beginnt mit der Bekanntgabe der Verfügung durch Veröffentlichung. Fällt das Ende der Frist auf einen Sonntag, einen allgemeinen Feiertag oder Sonnabend, so endet die Frist mit Ablauf des nächsten Werktages.\n\nDer Widerspruch muss die Bezeichnung der angefochtenen Verfügung sowie die Erklärung enthalten, dass Widerspruch gegen diese Verfügung eingelegt wird. Er ist zu unterzeichnen und soll begründet werden.\n\nDie Einlegung ist auch durch Übertragung eines elektronischen Dokuments an die elektronische Poststelle des Gerichts möglich. Das elektronische Dokument muss für die Bearbeitung durch das Gericht geeignet und mit einer qualifizierten elektronischen Signatur der verantwortenden Person versehen sein oder von der verantwortenden Person signiert und auf einem sicheren Übermittlungsweg gemäß § 130 a ZPO nach näherer Maßgabe der Verordnung über die technischen Rahmenbedingungen des elektronischen Rechtsverkehrs und über das besondere elektronische Behördenpostfach (BGBl. I, S. 3803) eingereicht werden. Weitere Informationen erhalten Sie auf der Internetseite www.justiz.de."
    },
    {
      "date": "2025-10-15",
      "id": "134104",
      "original_text": "Löschungsankündigung\nNordrhein-Westfalen Amtsgericht Essen HRB 31441\nZGK Straight Line GmbH – Essen",
      "type": "Löschungsankündigung",
      "state": "Nordrhein-Westfalen",
      "amtsgericht": "Amtsgericht Essen",
      "registernummer": "HRB 31441",
      "registerart": "HRB",
      "company_name": "ZGK Straight Line GmbH",
      "company_seat": "Essen",
      "details": "15.10.2025 (Bekanntmachungsdatum)\n\nNordrhein-Westfalen Amtsgericht Essen HRB 31441\nLöschungsankündigung 15.10.2025 (Eintragungsdatum)\n\nZGK Straight Line GmbH\nGesellschaft mit beschränkter Haftung\nEssen\n\nDas Registergericht beabsichtigt die Gesellschaft von Amts wegen nach § 394 FamFG zu löschen. Die Frist zur Erhebung eines Widerspruchs ist auf einen Monat festgesetzt."
    },
    {
      "date": "2025-10-15",
      "id": "134105",
      "original_text": "Registerbekanntmachung nach dem Umwandlungsgesetz\nNordrhein-Westfalen Amtsgericht Duisburg HRB 39489\nGrüne Wohnwelt Projektentwicklung GmbH – Oberhausen",
      "type": "Registerbekanntmachung nach dem Umwandlungsgesetz",
      "state": "Nordrhein-Westfalen",
      "amtsgericht": "Amtsgericht Duisburg",
      "registernummer": "HRB 39489",
      "registerart": "HRB",
      "company_name": "Grüne Wohnwelt Projektentwicklung GmbH",
      "company_seat": "Oberhausen",
      "details": "15.10.2025 (Bekanntmachungsdatum)\n\nNordrhein-Westfalen Amtsgericht Duisburg HRB 39489\nRegisterbekanntmachung nach dem Umwandlungsgesetz 15.10.2025 (Eintragungsdatum)\n\nGrüne Wohnwelt Projektentwicklung GmbH\nGesellschaft mit beschränkter Haftung\nOberhausen\n\nDie Gesellschaft hat Gläubigern, deren Forderungen vor dieser Bekanntmachung begründet worden sind, Sicherheit zu leisten, soweit sie nicht Befriedigung verlangen können, wenn sie sich binnen sechs Monaten zu diesem Zweck melden."
    },
    {
      "date": "2025-10-15",
      "id": "134106",
      "original_text": "Löschungsankündigung\nNordrhein-Westfalen Amtsgericht Dortmund HRB 33616\nSternbad GmbH – Lünen",
      "type": "Löschungsankündigung",
      "state": "Nordrhein-Westfalen",
      "amtsgericht": "Amtsgericht Dortmund",
      "registernummer": "HRB 33616",
      "registerart": "HRB",
      "company_name": "Sternbad GmbH",
      "company_seat": "Lünen",
      "details": "15.10.2025 (Bekanntmachungsdatum)\n\nNordrhein-Westfalen Amtsgericht Dortmund HRB 33616\nLöschungsankündigung\n\nSternbad GmbH\nGesellschaft mit beschränkter Haftung\nLünen\n\nDas Registergericht beabsichtigt die Gesellschaft von Amts wegen nach § 394 FamFG zu löschen. Die Frist zur Erhebung eines Widerspruchs ist auf zwei Monate festgesetzt."
    },
    {
      "date": "2025-10-15",
      "id": "134107",
      "original_text": "Löschungsankündigung\nNordrhein-Westfalen Amtsgericht Köln HRB 104612\nKonzept Finanz GmbH – Leichlingen",
      "type": "Löschungsankündigung",
      "state": "Nordrhein-Westfalen",
      "amtsgericht": "Amtsgericht Köln",
      "registernummer": "HRB 104612",
      "registerart": "HRB",
      "company_name": "Konzept Finanz GmbH",
      "company_seat": "Leichlingen",
      "details": "15.10.2025 (Bekanntmachungsdatum)\n\nNordrhein-Westfalen Amtsgericht Köln HRB 104612\nLöschungsankündigung\n\nKonzept Finanz GmbH\nGesellschaft mit beschränkter Haftung\nLeichlingen\n\nDas Registergericht beabsichtigt die Gesellschaft von Amts wegen nach § 394 FamFG zu löschen. Die Frist zur Erhebung eines Widerspruchs ist auf einen Monat festgesetzt."
    },
    {
      "date": "2025-10-15",
      "id": "134108",
      "original_text": "Registerbekanntmachung nach dem Umwandlungsgesetz\nNordrhein-Westfalen Amtsgericht Paderborn HRA 9012\nHoddenberg-Wind GmbH & Co. KG – Willebadessen",
      "type": "Registerbekanntmachung nach dem Umwandlungsgesetz",
      "state": "Nordrhein-Westfalen",
      "amtsgericht": "Amtsgericht Paderborn",
      "registernummer": "HRA 9012",
      "registerart": "HRA",
      "company_name": "Hoddenberg-Wind GmbH & Co. KG",
      "company_seat": "Willebadessen",
      "details": "15.10.2025 (Bekanntmachungsdatum)\n\nNordrhein-Westfalen Amtsgericht Paderborn HRA 9012\nRegisterbekanntmachung nach dem Umwandlungsgesetz 15.10.2025 (Eintragungsdatum)\n\nHoddenberg-Wind GmbH & Co. KG\nKommanditgesellschaft\nWillebadessen\n\nDen Gläubigern der an der formwechselnden Umwandlung beteiligten Rechtsträger ist, wenn sie binnen sechs Monaten nach dem Tag, an dem die Eintragung der formwechselnden Umwandlung in das Register des Sitzes desjenigen Rechtsträgers, dessen Gläubiger sie sind, nach § 19 Absatz 3 UmwG als bekanntgemacht gilt, ihren Anspruch nach Grund und Höhe schriftlich anmelden, Sicherheit zu leisten, soweit sie nicht Befriedigung verlangen können. Dieses Recht steht den Gläubigern jedoch nur zu, wenn sie glaubhaft machen, dass durch die formwechselnden Umwandlung die Erfüllung ihrer Forderung gefährdet wird."
    },
    {
      "date": "2025-10-15",
      "id": "134109",
      "original_text": "Einreichung neuer Dokumente\nNordrhein-Westfalen Amtsgericht Münster HRB 18647\nWestfälische Medien Holding AG – Münster",
      "type": "Einreichung neuer Dokumente",
      "state": "Nordrhein-Westfalen",
      "amtsgericht": "Amtsgericht Münster",
      "registernummer": "HRB 18647",
      "registerart": "HRB",
      "company_name": "Westfälische Medien Holding AG",
      "company_seat": "Münster",
      "details": "15.10.2025 (Bekanntmachungsdatum)\n\nNordrhein-Westfalen Amtsgericht Münster HRB 18647\nEinreichung neuer Dokumente\n\nWestfälische Medien Holding AG\nAktiengesellschaft\nMünster\n\nDem Registergericht ist eine neue Liste der Mitglieder des Aufsichtsrates eingereicht worden."
    },
    {
      "date": "2025-10-15",
      "id": "134110",
      "original_text": "Einreichung neuer Dokumente\nNordrhein-Westfalen Amtsgericht Duisburg HRB 30511\nMeier AG – Wesel",
      "type": "Einreichung neuer Dokumente",
      "state": "Nordrhein-Westfalen",
      "amtsgericht": "Amtsgericht Duisburg",
      "registernummer": "HRB 30511",
      "registerart": "HRB",
      "company_name": "Meier AG",
      "company_seat": "Wesel",
      "details": "15.10.2025 (Bekanntmachungsdatum)\n\nNordrhein-Westfalen Amtsgericht Duisburg HRB 30511\nEinreichung neuer Dokumente\n\nMeier AG\nAktiengesellschaft\nWesel\n\nDem Registergericht ist eine neue Liste der Mitglieder des Aufsichtsrates eingereicht worden."
    },
    {
      "date": "2025-10-15",
      "id": "134111",
      "original_text": "Registerbekanntmachung nach dem Umwandlungsgesetz\nNordrhein-Westfalen Amtsgericht Bielefeld HRB 46289\naudiowell Hörakustik GmbH – Bielefeld",
      "type": "Registerbekanntmachung nach dem Umwandlungsgesetz",
      "state": "Nordrhein-Westfalen",
      "amtsgericht": "Amtsgericht Bielefeld",
      "registernummer": "HRB 46289",
      "registerart": "HRB",
      "company_name": "audiowell Hörakustik GmbH",
      "company_seat": "Bielefeld",
      "details": "15.10.2025 (Bekanntmachungsdatum)\n\nNordrhein-Westfalen Amtsgericht Bielefeld HRB 46289\nRegisterbekanntmachung nach dem Umwandlungsgesetz 15.10.2025 (Eintragungsdatum)\n\naudiowell Hörakustik GmbH\nGesellschaft mit beschränkter Haftung\nBielefeld\n\nDen Gläubigern der an der Ausgliederung beteiligten Rechtsträger ist, wenn sie binnen sechs Monaten nach dem Tag, an dem die Eintragung der Ausgliederung in das Register des Sitzes desjenigen Rechtsträgers, dessen Gläubiger sie sind, nach § 19 Absatz 3 UmwG als bekanntgemacht gilt, ihren Anspruch nach Grund und Höhe schriftlich anmelden, Sicherheit zu leisten, soweit sie nicht Befriedigung verlangen können. Dieses Recht steht den Gläubigern jedoch nur zu, wenn sie glaubhaft machen, dass durch die Ausgliederung die Erfüllung ihrer Forderung gefährdet wird."
    },
    {
      "date": "2025-10-15",
      "id": "134112",
      "original_text": "Einreichung neuer Dokumente\nNordrhein-Westfalen Amtsgericht Köln HRB 112660\nMK Vermögensverwaltungs-AG – Hückeswagen",
      "type": "Einreichung neuer Dokumente",
      "state": "Nordrhein-Westfalen",
      "amtsgericht": "Amtsgericht Köln",
      "registernummer": "HRB 112660",
      "registerart": "HRB",
      "company_name": "MK Vermögensverwaltungs-AG",
      "company_seat": "Hückeswagen",
      "details": "15.10.2025 (Bekanntmachungsdatum)\n\nNordrhein-Westfalen Amtsgericht Köln HRB 112660\nEinreichung neuer Dokumente\n\nMK Vermögensverwaltungs-AG\nAktiengesellschaft\nHückeswagen\n\nDem Registergericht ist eine neue Liste der Mitglieder des Aufsichtsrates eingereicht worden."
    },
    {
      "date": "2025-10-15",
      "id": "134113",
      "original_text": "Löschungsankündigung\nNordrhein-Westfalen Amtsgericht Mönchengladbach HRB 20522\nAuKo Automobile Kompetenz UG (haftungsbeschränkt) – Grevenbroich",
      "type": "Löschungsankündigung",
      "state": "Nordrhein-Westfalen",
      "amtsgericht": "Amtsgericht Mönchengladbach",
      "registernummer": "HRB 20522",
      "registerart": "HRB",
      "company_name": "AuKo Automobile Kompetenz UG (haftungsbeschränkt)",
      "company_seat": "Grevenbroich",
      "details": "15.10.2025 (Bekanntmachungsdatum)\n\nNordrhein-Westfalen Amtsgericht Mönchengladbach HRB 20522\nLöschungsankündigung\n\nAuKo Automobile Kompetenz UG (haftungsbeschränkt)\nGesellschaft mit beschränkter Haftung\nGrevenbroich\n\nDas Registergericht beabsichtigt, die im Handelsregister eingetragene Gesellschaft gemäß § 394 Absatz 1 FamFG wegen Vermögenslosigkeit von Amts wegen zu löschen. Gegen diese Verfügung kann Widerspruch eingelegt werden. Die Frist zur Erhebung eines Widerspruchs gegen die beabsichtigte Löschung von Amts wegen ist auf drei Monate festgesetzt."
    },
    {
      "date": "2025-10-15",
      "id": "134114",
      "original_text": "Registerbekanntmachung nach dem Umwandlungsgesetz\nNordrhein-Westfalen Amtsgericht Münster HRA 11921\nElektro Service Ahlers e. K. – Drensteinfurt",
      "type": "Registerbekanntmachung nach dem Umwandlungsgesetz",
      "state": "Nordrhein-Westfalen",
      "amtsgericht": "Amtsgericht Münster",
      "registernummer": "HRA 11921",
      "registerart": "HRA",
      "company_name": "Elektro Service Ahlers e. K.",
      "company_seat": "Drensteinfurt",
      "details": "15.10.2025 (Bekanntmachungsdatum)\n\nNordrhein-Westfalen Amtsgericht Münster HRA 11921\nRegisterbekanntmachung nach dem Umwandlungsgesetz 15.10.2025 (Eintragungsdatum)\n\nElektro Service Ahlers e. K.\nEinzelkaufmann / Einzelkauffrau\nDrensteinfurt\n\nDen Gläubigern der an der Ausgliederung beteiligten Rechtsträger ist, wenn sie binnen sechs Monaten nach dem Tag, an dem die Eintragung der Ausgliederung in das Register des Sitzes derjenigen Rechtsträger deren Gläubiger sie sind, nach § 19 Absatz 3 UmwG als bekanntgemacht gilt, ihren Anspruch nach Grund und Höhe schriftlich anmelden, Sicherheit zu leisten, soweit sie nicht Befriedigung verlangen können. Dieses Recht steht den Gläubigern jedoch nur zu, wenn sie glaubhaft machen, dass durch die Ausgliederung die Erfüllung ihrer Forderung gefährdet wird."
    },
    {
      "date": "2025-10-15",
      "id": "134115",
      "original_text": "Registerbekanntmachung nach dem Umwandlungsgesetz\nThüringen Amtsgericht Jena HRA 507179\nAndrè Kaufmann e. K. – Dingelstädt",
      "type": "Registerbekanntmachung nach dem Umwandlungsgesetz",
      "state": "Thüringen",
      "amtsgericht": "Amtsgericht Jena",
      "registernummer": "HRA 507179",
      "registerart": "HRA",
      "company_name": "Andrè Kaufmann e. K.",
      "company_seat": "Dingelstädt",
      "details": "15.10.2025 (Bekanntmachungsdatum)\n\nThüringen Amtsgericht Jena HRA 507179\nRegisterbekanntmachung nach dem Umwandlungsgesetz 15.10.2025 (Eintragungsdatum)\n\nAndrè Kaufmann e. K.\nEinzelkaufmann / Einzelkauffrau\nDingelstädt\n\nNicht eingetragen: Den Gläubigern der an der Ausgliederung beteiligten Rechtsträger, ist wenn sie binnen sechs Monaten nach dem Tag, an dem die Eintragung der Ausgliederung in das Register des Sitzes desjenigen Rechtsträgers, dessen Gläubiger sie sind, nach §§125, 19 Abs. 3 UmwG als bekanntgemacht gilt, ihren Anspruch nach Grund und Höhe schriftlich anmelden, Sicherheit zu leisten, soweit sie nicht Befriedigung verlangen können. Dieses Recht steht ihnen jedoch nur zu, wenn sie glaubhaft machen, daß durch die Ausgliederung die Erfüllung ihrer Forderung gefährdet wird."
    },
    {
      "date": "2025-10-15",
      "id": "134116",
      "original_text": "Registerbekanntmachung nach dem Umwandlungsgesetz\nThüringen Amtsgericht Jena HRB 518544\nGartenstadt Weimar Projekt GmbH – Weimar",
      "type": "Registerbekanntmachung nach dem Umwandlungsgesetz",
      "state": "Thüringen",
      "amtsgericht": "Amtsgericht Jena",
      "registernummer": "HRB 518544",
      "registerart": "HRB",
      "company_name": "Gartenstadt Weimar Projekt GmbH",
      "company_seat": "Weimar",
      "details": "15.10.2025 (Bekanntmachungsdatum)\n\nThüringen Amtsgericht Jena HRB 518544\nRegisterbekanntmachung nach dem Umwandlungsgesetz 15.10.2025 (Eintragungsdatum)\n\nGartenstadt Weimar Projekt GmbH\nGesellschaft mit beschränkter Haftung\nWeimar\n\nNicht eingetragen: Den Gläubigern des formwechselnden  Rechtsträgers, ist wenn sie binnen sechs Monaten nach dem Tag, an dem die Eintragung des Formwechsels nach § 201 UmwG als bekanntgemacht gilt, ihren Anspruch nach Grund und Höhe schriftlich anmelden, Sicherheit zu leisten, soweit sie nicht Befriedigung verlangen können. Dieses Recht steht ihnen jedoch nur zu, wenn sie glaubhaft machen, daß durch den Formwechsel die Erfüllung ihrer Forderung gefährdet wird."
    },
    {
      "date": "2025-10-15",
      "id": "134117",
      "original_text": "Registerbekanntmachung nach dem Umwandlungsgesetz\nHessen Amtsgericht Eschwege HRB 2741\nWerra-Strom GmbH – Witzenhausen",
      "type": "Registerbekanntmachung nach dem Umwandlungsgesetz",
      "state": "Hessen",
      "amtsgericht": "Amtsgericht Eschwege",
      "registernummer": "HRB 2741",
      "registerart": "HRB",
      "company_name": "Werra-Strom GmbH",
      "company_seat": "Witzenhausen",
      "details": "15.10.2025 (Bekanntmachungsdatum)\n\nHessen Amtsgericht Eschwege HRB 2741\nRegisterbekanntmachung nach dem Umwandlungsgesetz 15.10.2025 (Eintragungsdatum)\n\nWerra-Strom GmbH\nGesellschaft mit beschränkter Haftung\nWitzenhausen\n\nIm übrigen wird auf den Verschmelzungsvertrag vom 19.08.2025 Bezug genommen.Den Gläubigern der an der Verschmelzung beteiligten Rechtsträger ist, wenn sie binnen sechs Monaten nach dem Tag, an dem die Eintragung der Verschmelzung in das Register des Sitzes desjenigen Rechtsträgers, dessen Gläubiger sie sind, nach § 19 Absatz 3 UmwG bekannt gemacht worden ist, ihren Anspruch nach Grund und Höhe schriftlich anmelden, Sicherheit zu leisten, soweit sie nicht Befriedigung verlangen können. Dieses Recht steht den Gläubigern jedoch nur zu, wenn sie glaubhaft machen, dass durch die Verschmelzung die Erfüllung ihrer Forderung gefährdet wird."
    },
    {
      "date": "2025-10-15",
      "id": "134118",
      "original_text": "Löschungsankündigung\nHessen Amtsgericht Wiesbaden HRB 27985\nGRUNDWERTE Projekt & Management GmbH – Wiesbaden",
      "type": "Löschungsankündigung",
      "state": "Hessen",
      "amtsgericht": "Amtsgericht Wiesbaden",
      "registernummer": "HRB 27985",
      "registerart": "HRB",
      "company_name": "GRUNDWERTE Projekt & Management GmbH",
      "company_seat": "Wiesbaden",
      "details": "15.10.2025 (Bekanntmachungsdatum)\n\nHessen Amtsgericht Wiesbaden HRB 27985\nLöschungsankündigung\n\nGRUNDWERTE Projekt & Management GmbH\nGesellschaft mit beschränkter Haftung\nWiesbaden\n\nDas Registergericht beabsichtigt die im Handelsregister eingetragene Gesellschaft von Amts wegen nach § 394 FamFG zu löschen. Die Frist zur Erhebung eines Widerspruchs gegen die beabsichtigte Löschung wird auf 3 Monate festgesetzt."
    },
    {
      "date": "2025-10-15",
      "id": "134119",
      "original_text": "Registerbekanntmachung nach dem Umwandlungsgesetz\nHessen Amtsgericht Frankfurt am Main HRA 50311\nManpower GmbH & Co. KG – Frankfurt am Main",
      "type": "Registerbekanntmachung nach dem Umwandlungsgesetz",
      "state": "Hessen",
      "amtsgericht": "Amtsgericht Frankfurt am Main",
      "registernummer": "HRA 50311",
      "registerart": "HRA",
      "company_name": "Manpower GmbH & Co. KG",
      "company_seat": "Frankfurt am Main",
      "details": "15.10.2025 (Bekanntmachungsdatum)\n\nHessen Amtsgericht Frankfurt am Main HRA 50311\nRegisterbekanntmachung nach dem Umwandlungsgesetz 15.10.2025 (Eintragungsdatum)\n\nManpower GmbH & Co. KG\nKommanditgesellschaft\nFrankfurt am Main\n\nDen Gläubigern der an der Verschmelzung beteiligten Rechtsträger ist, wenn sie binnen sechs Monaten nach dem Tag, an dem die Eintragung der Verschmelzung in das Register des Sitzes desjenigen Rechtsträgers, dessen Gläubiger sie sind, nach § 19 Absatz 3 UmwG bekannt gemacht worden ist, ihren Anspruch nach Grund und Höhe schriftlich anmelden, Sicherheit zu leisten, soweit sie nicht Befriedigung verlangen können. Dieses Recht steht den Gläubigern jedoch nur zu, wenn sie glaubhaft machen, dass durch die Verschmelzung die Erfüllung ihrer Forderung gefährdet wird."
    },
    {
      "date": "2025-10-15",
      "id": "134120",
      "original_text": "Löschungsankündigung\nHessen Amtsgericht Offenbach am Main HRB 48505\nP. A. Bau GmbH – Neu-Isenburg",
      "type": "Löschungsankündigung",
      "state": "Hessen",
      "amtsgericht": "Amtsgericht Offenbach am Main",
      "registernummer": "HRB 48505",
      "registerart": "HRB",
      "company_name": "P. A. Bau GmbH",
      "company_seat": "Neu-Isenburg",
      "details": "15.10.2025 (Bekanntmachungsdatum)\n\nHessen Amtsgericht Offenbach am Main HRB 48505\nLöschungsankündigung 15.10.2025 (Eintragungsdatum)\n\nP. A. Bau GmbH\nGesellschaft mit beschränkter Haftung\nNeu-Isenburg\n\nDas Registergericht beabsichtigt die im Handelsregister eingetragene Gesellschaft von Amts wegen nach § 394 FamFG zu löschen. Die Frist zur Erhebung eines Widerspruchs gegen die beabsichtigte Löschung wird auf 3 Monate festgesetzt."
    },
    {
      "date": "2025-10-15",
      "id": "134121",
      "original_text": "Registerbekanntmachung nach dem Umwandlungsgesetz\nHessen Amtsgericht Frankfurt am Main HRA 50311\nManpower GmbH & Co. KG – Frankfurt am Main",
      "type": "Registerbekanntmachung nach dem Umwandlungsgesetz",
      "state": "Hessen",
      "amtsgericht": "Amtsgericht Frankfurt am Main",
      "registernummer": "HRA 50311",
      "registerart": "HRA",
      "company_name": "Manpower GmbH & Co. KG",
      "company_seat": "Frankfurt am Main",
      "details": "15.10.2025 (Bekanntmachungsdatum)\n\nHessen Amtsgericht Frankfurt am Main HRA 50311\nRegisterbekanntmachung nach dem Umwandlungsgesetz 15.10.2025 (Eintragungsdatum)\n\nManpower GmbH & Co. KG\nKommanditgesellschaft\nFrankfurt am Main\n\nDen Gläubigern der an der Verschmelzung beteiligten Rechtsträger ist, wenn sie binnen sechs Monaten nach dem Tag, an dem die Eintragung der Verschmelzung in das Register des Sitzes desjenigen Rechtsträgers, dessen Gläubiger sie sind, nach § 19 Absatz 3 UmwG bekannt gemacht worden ist, ihren Anspruch nach Grund und Höhe schriftlich anmelden, Sicherheit zu leisten, soweit sie nicht Befriedigung verlangen können. Dieses Recht steht den Gläubigern jedoch nur zu, wenn sie glaubhaft machen, dass durch die Verschmelzung die Erfüllung ihrer Forderung gefährdet wird."
    },
    {
      "date": "2025-10-15",
      "id": "134122",
      "original_text": "Löschungsankündigung\nHessen Amtsgericht Hanau HRB 92125\nDuisburg Waterfront GmbH – Gelnhausen",
      "type": "Löschungsankündigung",
      "state": "Hessen",
      "amtsgericht": "Amtsgericht Hanau",
      "registernummer": "HRB 92125",
      "registerart": "HRB",
      "company_name": "Duisburg Waterfront GmbH",
      "company_seat": "Gelnhausen",
      "details": "15.10.2025 (Bekanntmachungsdatum)\n\nHessen Amtsgericht Hanau HRB 92125\nLöschungsankündigung\n\nDuisburg Waterfront GmbH\nGesellschaft mit beschränkter Haftung\nGelnhausen\n\nDas Registergericht beabsichtigt die im Handelsregister eingetragene Gesellschaft von Amts wegen nach § 394 FamFG zu löschen. Die Frist zur Erhebung eines Widerspruchs gegen die beabsichtigte Löschung wird auf 3 Monate festgesetzt."
    },
    {
      "date": "2025-10-15",
      "id": "134123",
      "original_text": "Registerbekanntmachung nach dem Umwandlungsgesetz\nHessen Amtsgericht Eschwege HRA 2940\nStadtwerke Witzenhausen GmbH & Co. KG – Witzenhausen",
      "type": "Registerbekanntmachung nach dem Umwandlungsgesetz",
      "state": "Hessen",
      "amtsgericht": "Amtsgericht Eschwege",
      "registernummer": "HRA 2940",
      "registerart": "HRA",
      "company_name": "Stadtwerke Witzenhausen GmbH & Co. KG",
      "company_seat": "Witzenhausen",
      "details": "15.10.2025 (Bekanntmachungsdatum)\n\nHessen Amtsgericht Eschwege HRA 2940\nRegisterbekanntmachung nach dem Umwandlungsgesetz 15.10.2025 (Eintragungsdatum)\n\nStadtwerke Witzenhausen GmbH & Co. KG\nKommanditgesellschaft\nWitzenhausen\n\nDen Gläubigern der an der Verschmelzung beteiligten Rechtsträger ist, wenn sie binnen sechs Monaten nach dem Tag, an dem die Eintragung der Verschmelzung in das Register des Sitzes desjenigen Rechtsträgers, dessen Gläubiger sie sind, nach § 19 Absatz 3 UmwG bekannt gemacht worden ist, ihren Anspruch nach Grund und Höhe schriftlich anmelden, Sicherheit zu leisten, soweit sie nicht Befriedigung verlangen können. Dieses Recht steht den Gläubigern jedoch nur zu, wenn sie glaubhaft machen, dass durch die Verschmelzung die Erfüllung ihrer Forderung gefährdet wird."
    },
    {
      "date": "2025-10-15",
      "id": "134124",
      "original_text": "Registerbekanntmachung nach dem Umwandlungsgesetz\nHessen Amtsgericht Eschwege HRB 2238\nStadtwerke Witzenhausen GmbH – Witzenhausen",
      "type": "Registerbekanntmachung nach dem Umwandlungsgesetz",
      "state": "Hessen",
      "amtsgericht": "Amtsgericht Eschwege",
      "registernummer": "HRB 2238",
      "registerart": "HRB",
      "company_name": "Stadtwerke Witzenhausen GmbH",
      "company_seat": "Witzenhausen",
      "details": "15.10.2025 (Bekanntmachungsdatum)\n\nHessen Amtsgericht Eschwege HRB 2238\nRegisterbekanntmachung nach dem Umwandlungsgesetz 13.08.2025 (Eintragungsdatum)\n\nStadtwerke Witzenhausen GmbH\nGesellschaft mit beschränkter Haftung\nWitzenhausen\n\nDen Gläubigern der an der formwechselnden Umwandlung beteiligten Rechtsträger ist, wenn sie binnen sechs Monaten nach dem Tag, an dem die Eintragung der formwechselnden Umwandlung in das Register des Sitzes desjenigen Rechtsträgers, dessen Gläubiger sie sind, nach § 201 UmwG bekannt gemacht worden ist, ihren Anspruch nach Grund und Höhe schriftlich anmelden, Sicherheit zu leisten, soweit sie nicht Befriedigung verlangen können. Dieses Recht steht den Gläubigern jedoch nur zu, wenn sie glaubhaft machen, dass durch die formwechselnden Umwandlung die Erfüllung ihrer Forderung gefährdet wird."
    },
    {
      "date": "2025-10-15",
      "id": "134125",
      "original_text": "Registerbekanntmachung nach dem Umwandlungsgesetz\nHessen Amtsgericht Frankfurt am Main HRA 50311\nManpower GmbH & Co. KG – Frankfurt am Main",
      "type": "Registerbekanntmachung nach dem Umwandlungsgesetz",
      "state": "Hessen",
      "amtsgericht": "Amtsgericht Frankfurt am Main",
      "registernummer": "HRA 50311",
      "registerart": "HRA",
      "company_name": "Manpower GmbH & Co. KG",
      "company_seat": "Frankfurt am Main",
      "details": "15.10.2025 (Bekanntmachungsdatum)\n\nHessen Amtsgericht Frankfurt am Main HRA 50311\nRegisterbekanntmachung nach dem Umwandlungsgesetz 15.10.2025 (Eintragungsdatum)\n\nManpower GmbH & Co. KG\nKommanditgesellschaft\nFrankfurt am Main\n\nDen Gläubigern der an der Verschmelzung beteiligten Rechtsträger ist, wenn sie binnen sechs Monaten nach dem Tag, an dem die Eintragung der Verschmelzung in das Register des Sitzes desjenigen Rechtsträgers, dessen Gläubiger sie sind, nach § 19 Absatz 3 UmwG bekannt gemacht worden ist, ihren Anspruch nach Grund und Höhe schriftlich anmelden, Sicherheit zu leisten, soweit sie nicht Befriedigung verlangen können. Dieses Recht steht den Gläubigern jedoch nur zu, wenn sie glaubhaft machen, dass durch die Verschmelzung die Erfüllung ihrer Forderung gefährdet wird."
    },
    {
      "date": "2025-10-15",
      "id": "134126",
      "original_text": "Registerbekanntmachung nach dem Umwandlungsgesetz\nHessen Amtsgericht Frankfurt am Main HRB 139458\nAviationPower GmbH – Frankfurt am Main",
      "type": "Registerbekanntmachung nach dem Umwandlungsgesetz",
      "state": "Hessen",
      "amtsgericht": "Amtsgericht Frankfurt am Main",
      "registernummer": "HRB 139458",
      "registerart": "HRB",
      "company_name": "AviationPower GmbH",
      "company_seat": "Frankfurt am Main",
      "details": "15.10.2025 (Bekanntmachungsdatum)\n\nHessen Amtsgericht Frankfurt am Main HRB 139458\nRegisterbekanntmachung nach dem Umwandlungsgesetz 15.10.2025 (Eintragungsdatum)\n\nAviationPower GmbH\nGesellschaft mit beschränkter Haftung\nFrankfurt am Main\n\nDen Gläubigern der an der Verschmelzung beteiligten Rechtsträger ist, wenn sie binnen sechs Monaten nach dem Tag, an dem die Eintragung der Verschmelzung in das Register des Sitzes desjenigen Rechtsträgers, dessen Gläubiger sie sind, nach § 19 Absatz 3 UmwG bekannt gemacht worden ist, ihren Anspruch nach Grund und Höhe schriftlich anmelden, Sicherheit zu leisten, soweit sie nicht Befriedigung verlangen können. Dieses Recht steht den Gläubigern jedoch nur zu, wenn sie glaubhaft machen, dass durch die Verschmelzung die Erfüllung ihrer Forderung gefährdet wird."
    },
    {
      "date": "2025-10-15",
      "id": "134127",
      "original_text": "Registerbekanntmachung nach dem Umwandlungsgesetz\nHessen Amtsgericht Frankfurt am Main HRA 50311\nManpower GmbH & Co. KG – Frankfurt am Main",
      "type": "Registerbekanntmachung nach dem Umwandlungsgesetz",
      "state": "Hessen",
      "amtsgericht": "Amtsgericht Frankfurt am Main",
      "registernummer": "HRA 50311",
      "registerart": "HRA",
      "company_name": "Manpower GmbH & Co. KG",
      "company_seat": "Frankfurt am Main",
      "details": "15.10.2025 (Bekanntmachungsdatum)\n\nHessen Amtsgericht Frankfurt am Main HRA 50311\nRegisterbekanntmachung nach dem Umwandlungsgesetz 15.10.2025 (Eintragungsdatum)\n\nManpower GmbH & Co. KG\nKommanditgesellschaft\nFrankfurt am Main\n\nDen Gläubigern der an der Verschmelzung beteiligten Rechtsträger ist, wenn sie binnen sechs Monaten nach dem Tag, an dem die Eintragung der Verschmelzung in das Register des Sitzes desjenigen Rechtsträgers, dessen Gläubiger sie sind, nach § 19 Absatz 3 UmwG bekannt gemacht worden ist, ihren Anspruch nach Grund und Höhe schriftlich anmelden, Sicherheit zu leisten, soweit sie nicht Befriedigung verlangen können. Dieses Recht steht den Gläubigern jedoch nur zu, wenn sie glaubhaft machen, dass durch die Verschmelzung die Erfüllung ihrer Forderung gefährdet wird."
    },
    {
      "date": "2025-10-15",
      "id": "134128",
      "original_text": "Registerbekanntmachung nach dem Umwandlungsgesetz\nHessen Amtsgericht Frankfurt am Main HRB 138793\nArcqus Professionals GmbH – Frankfurt am Main",
      "type": "Registerbekanntmachung nach dem Umwandlungsgesetz",
      "state": "Hessen",
      "amtsgericht": "Amtsgericht Frankfurt am Main",
      "registernummer": "HRB 138793",
      "registerart": "HRB",
      "company_name": "Arcqus Professionals GmbH",
      "company_seat": "Frankfurt am Main",
      "details": "15.10.2025 (Bekanntmachungsdatum)\n\nHessen Amtsgericht Frankfurt am Main HRB 138793\nRegisterbekanntmachung nach dem Umwandlungsgesetz 15.10.2025 (Eintragungsdatum)\n\nArcqus Professionals GmbH\nGesellschaft mit beschränkter Haftung\nFrankfurt am Main\n\nDen Gläubigern der an der Verschmelzung beteiligten Rechtsträger ist, wenn sie binnen sechs Monaten nach dem Tag, an dem die Eintragung der Verschmelzung in das Register des Sitzes desjenigen Rechtsträgers, dessen Gläubiger sie sind, nach § 19 Absatz 3 UmwG bekannt gemacht worden ist, ihren Anspruch nach Grund und Höhe schriftlich anmelden, Sicherheit zu leisten, soweit sie nicht Befriedigung verlangen können. Dieses Recht steht den Gläubigern jedoch nur zu, wenn sie glaubhaft machen, dass durch die Verschmelzung die Erfüllung ihrer Forderung gefährdet wird."
    },
    {
      "date": "2025-10-15",
      "id": "134129",
      "original_text": "Löschungsankündigung\nHessen Amtsgericht Offenbach am Main HRA 42226\nrealitätenkanzlei e. K. – Langen (Hessen)",
      "type": "Löschungsankündigung",
      "state": "Hessen",
      "amtsgericht": "Amtsgericht Offenbach am Main",
      "registernummer": "HRA 42226",
      "registerart": "HRA",
      "company_name": "realitätenkanzlei e. K.",
      "company_seat": "Langen (Hessen)",
      "details": "15.10.2025 (Bekanntmachungsdatum)\n\nHessen Amtsgericht Offenbach am Main HRA 42226\nLöschungsankündigung 15.10.2025 (Eintragungsdatum)\n\nrealitätenkanzlei e. K.\nEinzelkaufmann / Einzelkauffrau\nLangen (Hessen)\n\nDas Registergericht beabsichtigt die im Handelsregister eingetragene Gesellschaft von Amts wegen nach § 394 FamFG zu löschen. Die Frist zur Erhebung eines Widerspruchs gegen die beabsichtigte Löschung wird auf 3 Monate festgesetzt."
    },
    {
      "date": "2025-10-15",
      "id": "134130",
      "original_text": "Registerbekanntmachung nach dem Umwandlungsgesetz\nHessen Amtsgericht Frankfurt am Main HRB 139921\nAviationPower TechnicalServices GmbH – Frankfurt am Main",
      "type": "Registerbekanntmachung nach dem Umwandlungsgesetz",
      "state": "Hessen",
      "amtsgericht": "Amtsgericht Frankfurt am Main",
      "registernummer": "HRB 139921",
      "registerart": "HRB",
      "company_name": "AviationPower TechnicalServices GmbH",
      "company_seat": "Frankfurt am Main",
      "details": "15.10.2025 (Bekanntmachungsdatum)\n\nHessen Amtsgericht Frankfurt am Main HRB 139921\nRegisterbekanntmachung nach dem Umwandlungsgesetz 15.10.2025 (Eintragungsdatum)\n\nAviationPower TechnicalServices GmbH\nGesellschaft mit beschränkter Haftung\nFrankfurt am Main\n\nDen Gläubigern der an der Verschmelzung beteiligten Rechtsträger ist, wenn sie binnen sechs Monaten nach dem Tag, an dem die Eintragung der Verschmelzung in das Register des Sitzes desjenigen Rechtsträgers, dessen Gläubiger sie sind, nach § 19 Absatz 3 UmwG bekannt gemacht worden ist, ihren Anspruch nach Grund und Höhe schriftlich anmelden, Sicherheit zu leisten, soweit sie nicht Befriedigung verlangen können. Dieses Recht steht den Gläubigern jedoch nur zu, wenn sie glaubhaft machen, dass durch die Verschmelzung die Erfüllung ihrer Forderung gefährdet wird."
    },
    {
      "date": "2025-10-15",
      "id": "134131",
      "original_text": "Registerbekanntmachung nach dem Umwandlungsgesetz\nHessen Amtsgericht Frankfurt am Main HRA 50311\nManpower GmbH & Co. KG – Frankfurt am Main",
      "type": "Registerbekanntmachung nach dem Umwandlungsgesetz",
      "state": "Hessen",
      "amtsgericht": "Amtsgericht Frankfurt am Main",
      "registernummer": "HRA 50311",
      "registerart": "HRA",
      "company_name": "Manpower GmbH & Co. KG",
      "company_seat": "Frankfurt am Main",
      "details": "15.10.2025 (Bekanntmachungsdatum)\n\nHessen Amtsgericht Frankfurt am Main HRA 50311\nRegisterbekanntmachung nach dem Umwandlungsgesetz 15.10.2025 (Eintragungsdatum)\n\nManpower GmbH & Co. KG\nKommanditgesellschaft\nFrankfurt am Main\n\nDen Gläubigern der an der Verschmelzung beteiligten Rechtsträger ist, wenn sie binnen sechs Monaten nach dem Tag, an dem die Eintragung der Verschmelzung in das Register des Sitzes desjenigen Rechtsträgers, dessen Gläubiger sie sind, nach § 19 Absatz 3 UmwG bekannt gemacht worden ist, ihren Anspruch nach Grund und Höhe schriftlich anmelden, Sicherheit zu leisten, soweit sie nicht Befriedigung verlangen können. Dieses Recht steht den Gläubigern jedoch nur zu, wenn sie glaubhaft machen, dass durch die Verschmelzung die Erfüllung ihrer Forderung gefährdet wird."
    },
    {
      "date": "2025-10-15",
      "id": "134132",
      "original_text": "Registerbekanntmachung nach dem Umwandlungsgesetz\nHessen Amtsgericht Frankfurt am Main HRB 139458\nAviationPower GmbH – Frankfurt am Main",
      "type": "Registerbekanntmachung nach dem Umwandlungsgesetz",
      "state": "Hessen",
      "amtsgericht": "Amtsgericht Frankfurt am Main",
      "registernummer": "HRB 139458",
      "registerart": "HRB",
      "company_name": "AviationPower GmbH",
      "company_seat": "Frankfurt am Main",
      "details": "15.10.2025 (Bekanntmachungsdatum)\n\nHessen Amtsgericht Frankfurt am Main HRB 139458\nRegisterbekanntmachung nach dem Umwandlungsgesetz 15.10.2025 (Eintragungsdatum)\n\nAviationPower GmbH\nGesellschaft mit beschränkter Haftung\nFrankfurt am Main\n\nDen Gläubigern der an der Verschmelzung beteiligten Rechtsträger ist, wenn sie binnen sechs Monaten nach dem Tag, an dem die Eintragung der Verschmelzung in das Register des Sitzes desjenigen Rechtsträgers, dessen Gläubiger sie sind, nach § 19 Absatz 3 UmwG bekannt gemacht worden ist, ihren Anspruch nach Grund und Höhe schriftlich anmelden, Sicherheit zu leisten, soweit sie nicht Befriedigung verlangen können. Dieses Recht steht den Gläubigern jedoch nur zu, wenn sie glaubhaft machen, dass durch die Verschmelzung die Erfüllung ihrer Forderung gefährdet wird."
    },
    {
      "date": "2025-10-15",
      "id": "134133",
      "original_text": "Löschungsankündigung\nHessen Amtsgericht Offenbach am Main HRB 55407\nHarta GmbH – Neu-Isenburg",
      "type": "Löschungsankündigung",
      "state": "Hessen",
      "amtsgericht": "Amtsgericht Offenbach am Main",
      "registernummer": "HRB 55407",
      "registerart": "HRB",
      "company_name": "Harta GmbH",
      "company_seat": "Neu-Isenburg",
      "details": "15.10.2025 (Bekanntmachungsdatum)\n\nHessen Amtsgericht Offenbach am Main HRB 55407\nLöschungsankündigung\n\nHarta GmbH\nGesellschaft mit beschränkter Haftung\nNeu-Isenburg\n\nDas Registergericht beabsichtigt die im Handelsregister eingetragene Gesellschaft von Amts wegen nach § 394 FamFG zu löschen. Die Frist zur Erhebung eines Widerspruchs gegen die beabsichtigte Löschung wird auf 3 Monate festgesetzt."
    },
    {
      "date": "2025-10-15",
      "id": "134134",
      "original_text": "Löschungsankündigung\nHessen Amtsgericht Darmstadt HRB 92703\nTripleCheck GmbH – Darmstadt",
      "type": "Löschungsankündigung",
      "state": "Hessen",
      "amtsgericht": "Amtsgericht Darmstadt",
      "registernummer": "HRB 92703",
      "registerart": "HRB",
      "company_name": "TripleCheck GmbH",
      "company_seat": "Darmstadt",
      "details": "15.10.2025 (Bekanntmachungsdatum)\n\nHessen Amtsgericht Darmstadt HRB 92703\nLöschungsankündigung\n\nTripleCheck GmbH\nGesellschaft mit beschränkter Haftung\nDarmstadt\n\nDas Registergericht beabsichtigt die im Handelsregister eingetragene Gesellschaft von Amts wegen nach § 394 FamFG zu löschen. Die Frist zur Erhebung eines Widerspruchs gegen die beabsichtigte Löschung wird auf 3 Monate festgesetzt."
    },
    {
      "date": "2025-10-15",
      "id": "134135",
      "original_text": "Registerbekanntmachung nach dem Umwandlungsgesetz\nHessen Amtsgericht Kassel HRB 13790\nFr. Richter Rohrleitungsbau GmbH – Kassel",
      "type": "Registerbekanntmachung nach dem Umwandlungsgesetz",
      "state": "Hessen",
      "amtsgericht": "Amtsgericht Kassel",
      "registernummer": "HRB 13790",
      "registerart": "HRB",
      "company_name": "Fr. Richter Rohrleitungsbau GmbH",
      "company_seat": "Kassel",
      "details": "15.10.2025 (Bekanntmachungsdatum)\n\nHessen Amtsgericht Kassel HRB 13790\nRegisterbekanntmachung nach dem Umwandlungsgesetz 15.10.2025 (Eintragungsdatum)\n\nFr. Richter Rohrleitungsbau GmbH\nGesellschaft mit beschränkter Haftung\nKassel\n\nDen Gläubigern der an der Verschmelzung beteiligten Rechtsträger ist, wenn sie binnen sechs Monaten nach dem Tag, an dem die Eintragung der Verschmelzung in das Register des Sitzes desjenigen Rechtsträgers, dessen Gläubiger sie sind, nach § 19 Absatz 3 UmwG bekannt gemacht worden ist, ihren Anspruch nach Grund und Höhe schriftlich anmelden, Sicherheit zu leisten, soweit sie nicht Befriedigung verlangen können. Dieses Recht steht den Gläubigern jedoch nur zu, wenn sie glaubhaft machen, dass durch die Verschmelzung die Erfüllung ihrer Forderung gefährdet wird."
    },
    {
      "date": "2025-10-15",
      "id": "134136",
      "original_text": "Registerbekanntmachung nach dem Umwandlungsgesetz\nHessen Amtsgericht Eschwege HRA 2940\nStadtwerke Witzenhausen GmbH & Co. KG – Witzenhausen",
      "type": "Registerbekanntmachung nach dem Umwandlungsgesetz",
      "state": "Hessen",
      "amtsgericht": "Amtsgericht Eschwege",
      "registernummer": "HRA 2940",
      "registerart": "HRA",
      "company_name": "Stadtwerke Witzenhausen GmbH & Co. KG",
      "company_seat": "Witzenhausen",
      "details": "15.10.2025 (Bekanntmachungsdatum)\n\nHessen Amtsgericht Eschwege HRA 2940\nRegisterbekanntmachung nach dem Umwandlungsgesetz 13.08.2025 (Eintragungsdatum)\n\nStadtwerke Witzenhausen GmbH & Co. KG\nKommanditgesellschaft\nWitzenhausen\n\nDen Gläubigern der an der formwechselnden Umwandlung beteiligten Rechtsträger ist, wenn sie binnen sechs Monaten nach dem Tag, an dem die Eintragung der formwechselnden Umwandlung in das Register des Sitzes desjenigen Rechtsträgers, dessen Gläubiger sie sind, nach § 201 UmwG bekannt gemacht worden ist, ihren Anspruch nach Grund und Höhe schriftlich anmelden, Sicherheit zu leisten, soweit sie nicht Befriedigung verlangen können. Dieses Recht steht den Gläubigern jedoch nur zu, wenn sie glaubhaft machen, dass durch die formwechselnden Umwandlung die Erfüllung ihrer Forderung gefährdet wird."
    },
    {
      "date": "2025-10-15",
      "id": "134137",
      "original_text": "Registerbekanntmachung nach dem Umwandlungsgesetz\nHessen Amtsgericht Frankfurt am Main HRB 123846\nArcqus GmbH – Frankfurt am Main",
      "type": "Registerbekanntmachung nach dem Umwandlungsgesetz",
      "state": "Hessen",
      "amtsgericht": "Amtsgericht Frankfurt am Main",
      "registernummer": "HRB 123846",
      "registerart": "HRB",
      "company_name": "Arcqus GmbH",
      "company_seat": "Frankfurt am Main",
      "details": "15.10.2025 (Bekanntmachungsdatum)\n\nHessen Amtsgericht Frankfurt am Main HRB 123846\nRegisterbekanntmachung nach dem Umwandlungsgesetz 15.10.2025 (Eintragungsdatum)\n\nArcqus GmbH\nGesellschaft mit beschränkter Haftung\nFrankfurt am Main\n\nDen Gläubigern der an der Verschmelzung beteiligten Rechtsträger ist, wenn sie binnen sechs Monaten nach dem Tag, an dem die Eintragung der Verschmelzung in das Register des Sitzes desjenigen Rechtsträgers, dessen Gläubiger sie sind, nach § 19 Absatz 3 UmwG bekannt gemacht worden ist, ihren Anspruch nach Grund und Höhe schriftlich anmelden, Sicherheit zu leisten, soweit sie nicht Befriedigung verlangen können. Dieses Recht steht den Gläubigern jedoch nur zu, wenn sie glaubhaft machen, dass durch die Verschmelzung die Erfüllung ihrer Forderung gefährdet wird."
    },
    {
      "date": "2025-10-15",
      "id": "134138",
      "original_text": "Registerbekanntmachung nach dem Umwandlungsgesetz\nHessen Amtsgericht Frankfurt am Main HRA 50311\nManpower GmbH & Co. KG – Frankfurt am Main",
      "type": "Registerbekanntmachung nach dem Umwandlungsgesetz",
      "state": "Hessen",
      "amtsgericht": "Amtsgericht Frankfurt am Main",
      "registernummer": "HRA 50311",
      "registerart": "HRA",
      "company_name": "Manpower GmbH & Co. KG",
      "company_seat": "Frankfurt am Main",
      "details": "15.10.2025 (Bekanntmachungsdatum)\n\nHessen Amtsgericht Frankfurt am Main HRA 50311\nRegisterbekanntmachung nach dem Umwandlungsgesetz 15.10.2025 (Eintragungsdatum)\n\nManpower GmbH & Co. KG\nKommanditgesellschaft\nFrankfurt am Main\n\nDen Gläubigern der an der Verschmelzung beteiligten Rechtsträger ist, wenn sie binnen sechs Monaten nach dem Tag, an dem die Eintragung der Verschmelzung in das Register des Sitzes desjenigen Rechtsträgers, dessen Gläubiger sie sind, nach § 19 Absatz 3 UmwG bekannt gemacht worden ist, ihren Anspruch nach Grund und Höhe schriftlich anmelden, Sicherheit zu leisten, soweit sie nicht Befriedigung verlangen können. Dieses Recht steht den Gläubigern jedoch nur zu, wenn sie glaubhaft machen, dass durch die Verschmelzung die Erfüllung ihrer Forderung gefährdet wird."
    },
    {
      "date": "2025-10-15",
      "id": "134139",
      "original_text": "Löschungsankündigung\nHessen Amtsgericht Hanau HRB 95992\nCosmos Company GmbH – Hanau",
      "type": "Löschungsankündigung",
      "state": "Hessen",
      "amtsgericht": "Amtsgericht Hanau",
      "registernummer": "HRB 95992",
      "registerart": "HRB",
      "company_name": "Cosmos Company GmbH",
      "company_seat": "Hanau",
      "details": "15.10.2025 (Bekanntmachungsdatum)\n\nHessen Amtsgericht Hanau HRB 95992\nLöschungsankündigung\n\nCosmos Company GmbH\nGesellschaft mit beschränkter Haftung\nHanau\n\nDas Registergericht beabsichtigt die im Handelsregister eingetragene Gesellschaft von Amts wegen nach § 394 FamFG zu löschen. Die Frist zur Erhebung eines Widerspruchs gegen die beabsichtigte Löschung wird auf 3 Monate festgesetzt."
    }
  ]
}