{
  "date": "2025-10-03",
  "date_of_scrape": "2025-10-27T17:03:41.139Z",
  "tool_version": "0.2.0",
  "number_of_announcements": 38,
  "announcements": [
    {
      "date": "2025-10-03",
      "id": "132582",
      "original_text": "Registerbekanntmachung nach dem Umwandlungsgesetz\nBayern Amtsgericht München HRB 225209\nHETA SFP Verwaltung GmbH – München",
      "type": "Registerbekanntmachung nach dem Umwandlungsgesetz",
      "state": "Bayern",
      "amtsgericht": "Amtsgericht München",
      "registernummer": "HRB 225209",
      "registerart": "HRB",
      "company_name": "HETA SFP Verwaltung GmbH",
      "company_seat": "München",
      "details": "03.10.2025 (Bekanntmachungsdatum)\n\nBayern Amtsgericht München HRB 225209\nRegisterbekanntmachung nach dem Umwandlungsgesetz 02.10.2025 (Eintragungsdatum)\n\nHETA SFP Verwaltung GmbH\nGesellschaft mit beschränkter Haftung\nMünchen\n\nDen Gläubigern der an der Verschmelzung beteiligten Rechtsträger ist, wenn sie binnen sechs Monaten nach dem Tag, an dem die Eintragung der Verschmelzung in das Register des Sitzes desjenigen Rechtsträgers, dessen Gläubiger sie sind, nach § 19 Abs. 3 UmwG als bekannt gemacht gilt, ihren Anspruch nach Grund und Höhe in Textform anmelden, Sicherheit zu leisten, soweit sie nicht Befriedigung verlangen können. Dieses Recht steht den Gläubigern jedoch nur zu, wenn sie glaubhaft machen, dass durch die Verschmelzung die Erfüllung ihrer Forderung gefährdet wird."
    },
    {
      "date": "2025-10-03",
      "id": "132583",
      "original_text": "Registerbekanntmachung nach dem Umwandlungsgesetz\nBayern Amtsgericht Nürnberg HRB 36109\nTriathlon Holding GmbH – Pyrbaum OT Seligenporten",
      "type": "Registerbekanntmachung nach dem Umwandlungsgesetz",
      "state": "Bayern",
      "amtsgericht": "Amtsgericht Nürnberg",
      "registernummer": "HRB 36109",
      "registerart": "HRB",
      "company_name": "Triathlon Holding GmbH",
      "company_seat": "Pyrbaum OT Seligenporten",
      "details": "03.10.2025 (Bekanntmachungsdatum)\n\nBayern Amtsgericht Nürnberg HRB 36109\nRegisterbekanntmachung nach dem Umwandlungsgesetz 02.10.2025 (Eintragungsdatum)\n\nTriathlon Holding GmbH\nGesellschaft mit beschränkter Haftung\nPyrbaum OT Seligenporten\n\nDen Gläubigern der an der Verschmelzung beteiligten Rechtsträger ist, wenn sie binnen sechs Monaten nach dem Tag, an dem die Eintragung der Verschmelzung in das Register des Sitzes desjenigen Rechtsträgers, dessen Gläubiger sie sind, nach § 19 Abs. 3 UmwG als bekannt gemacht gilt, ihren Anspruch nach Grund und Höhe in Textform anmelden, Sicherheit zu leisten, soweit sie nicht Befriedigung verlangen können. Dieses Recht steht den Gläubigern jedoch nur zu, wenn sie glaubhaft machen, dass durch die Verschmelzung die Erfüllung ihrer Forderung gefährdet wird."
    },
    {
      "date": "2025-10-03",
      "id": "132584",
      "original_text": "Einreichung neuer Dokumente\nBayern Amtsgericht Aschaffenburg HRB 40\nStadtbau Aschaffenburg GmbH – Aschaffenburg",
      "type": "Einreichung neuer Dokumente",
      "state": "Bayern",
      "amtsgericht": "Amtsgericht Aschaffenburg",
      "registernummer": "HRB 40",
      "registerart": "HRB",
      "company_name": "Stadtbau Aschaffenburg GmbH",
      "company_seat": "Aschaffenburg",
      "details": "03.10.2025 (Bekanntmachungsdatum)\n\nBayern Amtsgericht Aschaffenburg HRB 40\nEinreichung neuer Dokumente\n\nStadtbau Aschaffenburg GmbH\nGesellschaft mit beschränkter Haftung\nAschaffenburg\n\nDem Amtsgericht Aschaffenburg -Registergericht- ist eine Liste der Mitglieder des Aufsichtsrats eingereicht worden, § 52 Abs. 3 S. 2 GmbHG."
    },
    {
      "date": "2025-10-03",
      "id": "132585",
      "original_text": "Registerbekanntmachung nach dem Umwandlungsgesetz\nBayern Amtsgericht München HRA 121613\nMatthias Schwinn e.K. – Grünwald",
      "type": "Registerbekanntmachung nach dem Umwandlungsgesetz",
      "state": "Bayern",
      "amtsgericht": "Amtsgericht München",
      "registernummer": "HRA 121613",
      "registerart": "HRA",
      "company_name": "Matthias Schwinn e.K.",
      "company_seat": "Grünwald",
      "details": "03.10.2025 (Bekanntmachungsdatum)\n\nBayern Amtsgericht München HRA 121613\nRegisterbekanntmachung nach dem Umwandlungsgesetz 02.10.2025 (Eintragungsdatum)\n\nMatthias Schwinn e.K.\nEinzelkaufmann / Einzelkauffrau\nGrünwald\n\nDen Gläubigern der an der Ausgliederung beteiligten Rechtsträger ist, wenn sie binnen sechs Monaten nach dem Tag, an dem die Eintragung der Ausgliederung in das Register des Sitzes desjenigen Rechtsträgers, dessen Gläubiger sie sind, nach §§ 125, 19 Abs. 3 UmwG als bekannt gemacht gilt, ihren Anspruch nach Grund und Höhe in Textform anmelden, Sicherheit zu leisten, soweit sie nicht Befriedigung verlangen können. Dieses Recht steht den Gläubigern jedoch nur zu, wenn sie glaubhaft machen, dass durch die Ausgliederung die Erfüllung ihrer Forderung gefährdet wird."
    },
    {
      "date": "2025-10-03",
      "id": "132586",
      "original_text": "Registerbekanntmachung nach dem Umwandlungsgesetz\nBayern Amtsgericht München HRA 121494\nJoachim Müller e.K. – Bergkirchen",
      "type": "Registerbekanntmachung nach dem Umwandlungsgesetz",
      "state": "Bayern",
      "amtsgericht": "Amtsgericht München",
      "registernummer": "HRA 121494",
      "registerart": "HRA",
      "company_name": "Joachim Müller e.K.",
      "company_seat": "Bergkirchen",
      "details": "03.10.2025 (Bekanntmachungsdatum)\n\nBayern Amtsgericht München HRA 121494\nRegisterbekanntmachung nach dem Umwandlungsgesetz 02.10.2025 (Eintragungsdatum)\n\nJoachim Müller e.K.\nEinzelkaufmann / Einzelkauffrau\nBergkirchen\n\nDen Gläubigern der an der Ausgliederung beteiligten Rechtsträger ist, wenn sie binnen sechs Monaten nach dem Tag, an dem die Eintragung der Ausgliederung in das Register des Sitzes desjenigen Rechtsträgers, dessen Gläubiger sie sind, nach §§ 125, 19 Abs. 3 UmwG als bekannt gemacht gilt, ihren Anspruch nach Grund und Höhe in Textform anmelden, Sicherheit zu leisten, soweit sie nicht Befriedigung verlangen können. Dieses Recht steht den Gläubigern jedoch nur zu, wenn sie glaubhaft machen, dass durch die Ausgliederung die Erfüllung ihrer Forderung gefährdet wird."
    },
    {
      "date": "2025-10-03",
      "id": "132587",
      "original_text": "Sonstige Registerbekanntmachung\nBayern Amtsgericht Ingolstadt GnR 100151\nRaiffeisenbank Lech-Donau eG – Ehekirchen",
      "type": "Sonstige Registerbekanntmachung",
      "state": "Bayern",
      "amtsgericht": "Amtsgericht Ingolstadt",
      "registernummer": "GnR 100151",
      "registerart": "GnR",
      "company_name": "Raiffeisenbank Lech-Donau eG",
      "company_seat": "Ehekirchen",
      "details": "03.10.2025 (Bekanntmachungsdatum)\n\nBayern Amtsgericht Ingolstadt GnR 100151\nSonstige Registerbekanntmachung 02.10.2025 (Eintragungsdatum)\n\nRaiffeisenbank Lech-Donau eG\neingetragene Genossenschaft\nEhekirchen\n\nDen Gläubigern der Genossenschaft ist gemäß §§ 22a i.V.m. 22 GenG, wenn sie sich binnen sechs Monaten nach der Bekanntmachung bei der Genossenschaft zu diesem Zweck melden, Sicherheit zu leisten, soweit sie nicht Befriedigung verlangen können."
    },
    {
      "date": "2025-10-03",
      "id": "132588",
      "original_text": "Registerbekanntmachung nach dem Umwandlungsgesetz\nBayern Amtsgericht Regensburg HRB 13621\nTieto Germany GmbH – Regensburg",
      "type": "Registerbekanntmachung nach dem Umwandlungsgesetz",
      "state": "Bayern",
      "amtsgericht": "Amtsgericht Regensburg",
      "registernummer": "HRB 13621",
      "registerart": "HRB",
      "company_name": "Tieto Germany GmbH",
      "company_seat": "Regensburg",
      "details": "03.10.2025 (Bekanntmachungsdatum)\n\nBayern Amtsgericht Regensburg HRB 13621\nRegisterbekanntmachung nach dem Umwandlungsgesetz 02.10.2025 (Eintragungsdatum)\n\nTieto Germany GmbH\nGesellschaft mit beschränkter Haftung\nRegensburg\n\nDen Gläubigern der an der Verschmelzung beteiligten Rechtsträger ist, wenn sie binnen sechs Monaten nach dem Tag, an dem die Eintragung der Verschmelzung in das Register des Sitzes desjenigen Rechtsträgers, dessen Gläubiger sie sind, nach § 19 Abs. 3 UmwG als bekannt gemacht gilt, ihren Anspruch nach Grund und Höhe in Textform anmelden, Sicherheit zu leisten, soweit sie nicht Befriedigung verlangen können. Dieses Recht steht den Gläubigern jedoch nur zu, wenn sie glaubhaft machen, dass durch die Verschmelzung die Erfüllung ihrer Forderung gefährdet wird."
    },
    {
      "date": "2025-10-03",
      "id": "132589",
      "original_text": "Einreichung neuer Dokumente\nBayern Amtsgericht München HRB 285299\nNTT DATA Deutschland SE – München",
      "type": "Einreichung neuer Dokumente",
      "state": "Bayern",
      "amtsgericht": "Amtsgericht München",
      "registernummer": "HRB 285299",
      "registerart": "HRB",
      "company_name": "NTT DATA Deutschland SE",
      "company_seat": "München",
      "details": "03.10.2025 (Bekanntmachungsdatum)\n\nBayern Amtsgericht München HRB 285299\nEinreichung neuer Dokumente\n\nNTT DATA Deutschland SE\nEuropäische Aktiengesellschaft (SE)\nMünchen\n\nDem Amtsgericht München -Registergericht- ist eine Liste der Mitglieder des Aufsichtsrats eingereicht worden, Art. 9 Abs. 1 Buchst. c (ii) SE-VO i.V.m. § 106 AktG."
    },
    {
      "date": "2025-10-03",
      "id": "132590",
      "original_text": "Einreichung neuer Dokumente\nBayern Amtsgericht Weiden i. d. OPf. HRB 6237\nWITRON Management SE – Parkstein",
      "type": "Einreichung neuer Dokumente",
      "state": "Bayern",
      "amtsgericht": "Amtsgericht Weiden i. d. OPf.",
      "registernummer": "HRB 6237",
      "registerart": "HRB",
      "company_name": "WITRON Management SE",
      "company_seat": "Parkstein",
      "details": "03.10.2025 (Bekanntmachungsdatum)\n\nBayern Amtsgericht Weiden i. d. OPf. HRB 6237\nEinreichung neuer Dokumente 02.10.2025 (Eintragungsdatum)\n\nWITRON Management SE\nEuropäische Aktiengesellschaft (SE)\nParkstein\n\nDem Amtsgericht Weiden i.d.OPf. -Registergericht- ist eine Liste der Mitglieder des Aufsichtsrats eingereicht worden, Art. 9 Abs. 1 Buchst. c (ii) SE-VO i.V.m. § 106 AktG."
    },
    {
      "date": "2025-10-03",
      "id": "132591",
      "original_text": "Registerbekanntmachung nach dem Umwandlungsgesetz\nBayern Amtsgericht Fürth HRB 8247\nHWS Informationssysteme GmbH – Neustadt a.d.Aisch",
      "type": "Registerbekanntmachung nach dem Umwandlungsgesetz",
      "state": "Bayern",
      "amtsgericht": "Amtsgericht Fürth",
      "registernummer": "HRB 8247",
      "registerart": "HRB",
      "company_name": "HWS Informationssysteme GmbH",
      "company_seat": "Neustadt a.d.Aisch",
      "details": "03.10.2025 (Bekanntmachungsdatum)\n\nBayern Amtsgericht Fürth HRB 8247\nRegisterbekanntmachung nach dem Umwandlungsgesetz 02.10.2025 (Eintragungsdatum)\n\nHWS Informationssysteme GmbH\nGesellschaft mit beschränkter Haftung\nNeustadt a.d.Aisch\n\nDen Gläubigern der an der Verschmelzung beteiligten Rechtsträger ist, wenn sie binnen sechs Monaten nach dem Tag, an dem die Eintragung der Verschmelzung in das Register des Sitzes desjenigen Rechtsträgers, dessen Gläubiger sie sind, nach § 19 Abs. 3 UmwG als bekannt gemacht gilt, ihren Anspruch nach Grund und Höhe in Textform anmelden, Sicherheit zu leisten, soweit sie nicht Befriedigung verlangen können. Dieses Recht steht den Gläubigern jedoch nur zu, wenn sie glaubhaft machen, dass durch die Verschmelzung die Erfüllung ihrer Forderung gefährdet wird."
    },
    {
      "date": "2025-10-03",
      "id": "132592",
      "original_text": "Registerbekanntmachung nach dem Umwandlungsgesetz\nBayern Amtsgericht Coburg HRA 4068\nMICHAEL SCHULZ - Immobilien Treuhand und Beratung e.K. – Coburg",
      "type": "Registerbekanntmachung nach dem Umwandlungsgesetz",
      "state": "Bayern",
      "amtsgericht": "Amtsgericht Coburg",
      "registernummer": "HRA 4068",
      "registerart": "HRA",
      "company_name": "MICHAEL SCHULZ - Immobilien Treuhand und Beratung e.K.",
      "company_seat": "Coburg",
      "details": "03.10.2025 (Bekanntmachungsdatum)\n\nBayern Amtsgericht Coburg HRA 4068\nRegisterbekanntmachung nach dem Umwandlungsgesetz 02.10.2025 (Eintragungsdatum)\n\nMICHAEL SCHULZ - Immobilien Treuhand und Beratung e.K.\nEinzelkaufmann / Einzelkauffrau\nCoburg\n\nDen Gläubigern der an der Verschmelzung beteiligten Rechtsträger ist, wenn sie binnen sechs Monaten nach dem Tag, an dem die Eintragung der Verschmelzung in das Register des Sitzes desjenigen Rechtsträgers, dessen Gläubiger sie sind, nach § 19 Abs. 3 UmwG als bekannt gemacht gilt, ihren Anspruch nach Grund und Höhe in Textform anmelden, Sicherheit zu leisten, soweit sie nicht Befriedigung verlangen können. Dieses Recht steht den Gläubigern jedoch nur zu, wenn sie glaubhaft machen, dass durch die Verschmelzung die Erfüllung ihrer Forderung gefährdet wird."
    },
    {
      "date": "2025-10-03",
      "id": "132593",
      "original_text": "Einreichung neuer Dokumente\nBayern Amtsgericht München HRB 300605\nSkySails Wind AG – München",
      "type": "Einreichung neuer Dokumente",
      "state": "Bayern",
      "amtsgericht": "Amtsgericht München",
      "registernummer": "HRB 300605",
      "registerart": "HRB",
      "company_name": "SkySails Wind AG",
      "company_seat": "München",
      "details": "03.10.2025 (Bekanntmachungsdatum)\n\nBayern Amtsgericht München HRB 300605\nEinreichung neuer Dokumente\n\nSkySails Wind AG\nAktiengesellschaft\nMünchen\n\nDem Amtsgericht München -Registergericht- ist eine Liste der Mitglieder des Aufsichtsrats eingereicht worden, § 106 AktG."
    },
    {
      "date": "2025-10-03",
      "id": "132594",
      "original_text": "Registerbekanntmachung nach dem Umwandlungsgesetz\nBayern Amtsgericht München HRB 297859\nRoland Berger Service GmbH & Co. KGaA – München",
      "type": "Registerbekanntmachung nach dem Umwandlungsgesetz",
      "state": "Bayern",
      "amtsgericht": "Amtsgericht München",
      "registernummer": "HRB 297859",
      "registerart": "HRB",
      "company_name": "Roland Berger Service GmbH & Co. KGaA",
      "company_seat": "München",
      "details": "03.10.2025 (Bekanntmachungsdatum)\n\nBayern Amtsgericht München HRB 297859\nRegisterbekanntmachung nach dem Umwandlungsgesetz 02.10.2025 (Eintragungsdatum)\n\nRoland Berger Service GmbH & Co. KGaA\nKommanditgesellschaft auf Aktien\nMünchen\n\nDen Gläubigern der an der Ausgliederung beteiligten Rechtsträger ist, wenn sie binnen sechs Monaten nach dem Tag, an dem die Eintragung der Ausgliederung in das Register des Sitzes desjenigen Rechtsträgers, dessen Gläubiger sie sind, nach §§ 125, 19 Abs. 3 UmwG als bekannt gemacht gilt, ihren Anspruch nach Grund und Höhe in Textform anmelden, Sicherheit zu leisten, soweit sie nicht Befriedigung verlangen können. Dieses Recht steht den Gläubigern jedoch nur zu, wenn sie glaubhaft machen, dass durch die Ausgliederung die Erfüllung ihrer Forderung gefährdet wird."
    },
    {
      "date": "2025-10-03",
      "id": "132595",
      "original_text": "Registerbekanntmachung nach dem Umwandlungsgesetz\nBayern Amtsgericht München HRB 185635\nWSMS Verwaltungs GmbH – Vaterstetten",
      "type": "Registerbekanntmachung nach dem Umwandlungsgesetz",
      "state": "Bayern",
      "amtsgericht": "Amtsgericht München",
      "registernummer": "HRB 185635",
      "registerart": "HRB",
      "company_name": "WSMS Verwaltungs GmbH",
      "company_seat": "Vaterstetten",
      "details": "03.10.2025 (Bekanntmachungsdatum)\n\nBayern Amtsgericht München HRB 185635\nRegisterbekanntmachung nach dem Umwandlungsgesetz 02.10.2025 (Eintragungsdatum)\n\nWSMS Verwaltungs GmbH\nGesellschaft mit beschränkter Haftung\nVaterstetten\n\nDen Gläubigern der an der Verschmelzung beteiligten Rechtsträger ist, wenn sie binnen sechs Monaten nach dem Tag, an dem die Eintragung der Verschmelzung in das Register des Sitzes desjenigen Rechtsträgers, dessen Gläubiger sie sind, nach § 19 Abs. 3 UmwG als bekannt gemacht gilt, ihren Anspruch nach Grund und Höhe in Textform anmelden, Sicherheit zu leisten, soweit sie nicht Befriedigung verlangen können. Dieses Recht steht den Gläubigern jedoch nur zu, wenn sie glaubhaft machen, dass durch die Verschmelzung die Erfüllung ihrer Forderung gefährdet wird."
    },
    {
      "date": "2025-10-03",
      "id": "132596",
      "original_text": "Registerbekanntmachung nach dem Umwandlungsgesetz\nBayern Amtsgericht München HRB 228033\nB.A.S.E. Solution GmbH – Gräfelfing",
      "type": "Registerbekanntmachung nach dem Umwandlungsgesetz",
      "state": "Bayern",
      "amtsgericht": "Amtsgericht München",
      "registernummer": "HRB 228033",
      "registerart": "HRB",
      "company_name": "B.A.S.E. Solution GmbH",
      "company_seat": "Gräfelfing",
      "details": "03.10.2025 (Bekanntmachungsdatum)\n\nBayern Amtsgericht München HRB 228033\nRegisterbekanntmachung nach dem Umwandlungsgesetz 02.10.2025 (Eintragungsdatum)\n\nB.A.S.E. Solution GmbH\nGesellschaft mit beschränkter Haftung\nGräfelfing\n\nDen Gläubigern der an der Verschmelzung beteiligten Rechtsträger ist, wenn sie binnen sechs Monaten nach dem Tag, an dem die Eintragung der Verschmelzung in das Register des Sitzes desjenigen Rechtsträgers, dessen Gläubiger sie sind, nach § 19 Abs. 3 UmwG als bekannt gemacht gilt, ihren Anspruch nach Grund und Höhe in Textform anmelden, Sicherheit zu leisten, soweit sie nicht Befriedigung verlangen können. Dieses Recht steht den Gläubigern jedoch nur zu, wenn sie glaubhaft machen, dass durch die Verschmelzung die Erfüllung ihrer Forderung gefährdet wird."
    },
    {
      "date": "2025-10-03",
      "id": "132597",
      "original_text": "Einreichung neuer Dokumente\nBayern Amtsgericht München HRB 283942\nRoland Berger Holding GmbH & Co. KGaA – München",
      "type": "Einreichung neuer Dokumente",
      "state": "Bayern",
      "amtsgericht": "Amtsgericht München",
      "registernummer": "HRB 283942",
      "registerart": "HRB",
      "company_name": "Roland Berger Holding GmbH & Co. KGaA",
      "company_seat": "München",
      "details": "03.10.2025 (Bekanntmachungsdatum)\n\nBayern Amtsgericht München HRB 283942\nEinreichung neuer Dokumente 02.10.2025 (Eintragungsdatum)\n\nRoland Berger Holding GmbH & Co. KGaA\nKommanditgesellschaft auf Aktien\nMünchen\n\nDem Amtsgericht München -Registergericht- isteine Liste der Mitglieder des Aufsichtsrats eingereicht worden, §§ 278 Abs. 3, 106 AktG."
    },
    {
      "date": "2025-10-03",
      "id": "132598",
      "original_text": "Registerbekanntmachung nach dem Umwandlungsgesetz\nBayern Amtsgericht Memmingen HRB 19740\nHerrmann u. Holzner GmbH – Leipheim",
      "type": "Registerbekanntmachung nach dem Umwandlungsgesetz",
      "state": "Bayern",
      "amtsgericht": "Amtsgericht Memmingen",
      "registernummer": "HRB 19740",
      "registerart": "HRB",
      "company_name": "Herrmann u. Holzner GmbH",
      "company_seat": "Leipheim",
      "details": "03.10.2025 (Bekanntmachungsdatum)\n\nBayern Amtsgericht Memmingen HRB 19740\nRegisterbekanntmachung nach dem Umwandlungsgesetz 02.10.2025 (Eintragungsdatum)\n\nHerrmann u. Holzner GmbH\nGesellschaft mit beschränkter Haftung\nLeipheim\n\nDen Gläubigern der an der Verschmelzung beteiligten Rechtsträger ist, wenn sie binnen sechs Monaten nach dem Tag, an dem die Eintragung der Verschmelzung in das Register des Sitzes desjenigen Rechtsträgers, dessen Gläubiger sie sind, nach § 19 Abs. 3 UmwG als bekannt gemacht gilt, ihren Anspruch nach Grund und Höhe in Textform anmelden, Sicherheit zu leisten, soweit sie nicht Befriedigung verlangen können. Dieses Recht steht den Gläubigern jedoch nur zu, wenn sie glaubhaft machen, dass durch die Verschmelzung die Erfüllung ihrer Forderung gefährdet wird."
    },
    {
      "date": "2025-10-03",
      "id": "132599",
      "original_text": "Registerbekanntmachung nach dem Umwandlungsgesetz\nBayern Amtsgericht Coburg HRB 4711\nVSB Solutions GmbH – Lichtenfels",
      "type": "Registerbekanntmachung nach dem Umwandlungsgesetz",
      "state": "Bayern",
      "amtsgericht": "Amtsgericht Coburg",
      "registernummer": "HRB 4711",
      "registerart": "HRB",
      "company_name": "VSB Solutions GmbH",
      "company_seat": "Lichtenfels",
      "details": "03.10.2025 (Bekanntmachungsdatum)\n\nBayern Amtsgericht Coburg HRB 4711\nRegisterbekanntmachung nach dem Umwandlungsgesetz 22.09.2025 (Eintragungsdatum)\n\nVSB Solutions GmbH\nGesellschaft mit beschränkter Haftung\nLichtenfels\n\nDen Gläubigern der an der Verschmelzung beteiligten Rechtsträger ist, wenn sie binnen sechs Monaten nach dem Tag, an dem die Eintragung der Verschmelzung in das Register des Sitzes desjenigen Rechtsträgers, dessen Gläubiger sie sind, nach § 19 Abs. 3 UmwG als bekannt gemacht gilt, ihren Anspruch nach Grund und Höhe in Textform anmelden, Sicherheit zu leisten, soweit sie nicht Befriedigung verlangen können. Dieses Recht steht den Gläubigern jedoch nur zu, wenn sie glaubhaft machen, dass durch die Verschmelzung die Erfüllung ihrer Forderung gefährdet wird."
    },
    {
      "date": "2025-10-03",
      "id": "132600",
      "original_text": "Einreichung neuer Dokumente\nBayern Amtsgericht Weiden i. d. OPf. HRB 88\nHart Keramik AG – Waldsassen",
      "type": "Einreichung neuer Dokumente",
      "state": "Bayern",
      "amtsgericht": "Amtsgericht Weiden i. d. OPf.",
      "registernummer": "HRB 88",
      "registerart": "HRB",
      "company_name": "Hart Keramik AG",
      "company_seat": "Waldsassen",
      "details": "03.10.2025 (Bekanntmachungsdatum)\n\nBayern Amtsgericht Weiden i. d. OPf. HRB 88\nEinreichung neuer Dokumente 02.10.2025 (Eintragungsdatum)\n\nHart Keramik AG\nAktiengesellschaft\nWaldsassen\n\nDem Amtsgericht Weiden i.d.OPf. -Registergericht- ist eine Liste der Mitglieder des Aufsichtsrats eingereicht worden, § 106 AktG."
    },
    {
      "date": "2025-10-03",
      "id": "132601",
      "original_text": "Registerbekanntmachung nach dem Umwandlungsgesetz\nBayern Amtsgericht München HRB 283942\nRoland Berger partners GmbH & Co. KGaA – München",
      "type": "Registerbekanntmachung nach dem Umwandlungsgesetz",
      "state": "Bayern",
      "amtsgericht": "Amtsgericht München",
      "registernummer": "HRB 283942",
      "registerart": "HRB",
      "company_name": "Roland Berger partners GmbH & Co. KGaA",
      "company_seat": "München",
      "details": "03.10.2025 (Bekanntmachungsdatum)\n\nBayern Amtsgericht München HRB 283942\nRegisterbekanntmachung nach dem Umwandlungsgesetz 02.10.2025 (Eintragungsdatum)\n\nRoland Berger partners GmbH & Co. KGaA\nKommanditgesellschaft auf Aktien\nMünchen\n\nDen Gläubigern der an der Ausgliederung beteiligten Rechtsträger ist, wenn sie binnen sechs Monaten nach dem Tag, an dem die Eintragung der Ausgliederung in das Register des Sitzes desjenigen Rechtsträgers, dessen Gläubiger sie sind, nach §§ 125, 19 Abs. 3 UmwG als bekannt gemacht gilt, ihren Anspruch nach Grund und Höhe in Textform anmelden, Sicherheit zu leisten, soweit sie nicht Befriedigung verlangen können. Dieses Recht steht den Gläubigern jedoch nur zu, wenn sie glaubhaft machen, dass durch die Ausgliederung die Erfüllung ihrer Forderung gefährdet wird."
    },
    {
      "date": "2025-10-03",
      "id": "132602",
      "original_text": "Registerbekanntmachung nach dem Umwandlungsgesetz\nBayern Amtsgericht Memmingen HRB 19740\nHerrmann u. Holzner GmbH – Leipheim",
      "type": "Registerbekanntmachung nach dem Umwandlungsgesetz",
      "state": "Bayern",
      "amtsgericht": "Amtsgericht Memmingen",
      "registernummer": "HRB 19740",
      "registerart": "HRB",
      "company_name": "Herrmann u. Holzner GmbH",
      "company_seat": "Leipheim",
      "details": "03.10.2025 (Bekanntmachungsdatum)\n\nBayern Amtsgericht Memmingen HRB 19740\nRegisterbekanntmachung nach dem Umwandlungsgesetz 02.10.2025 (Eintragungsdatum)\n\nHerrmann u. Holzner GmbH\nGesellschaft mit beschränkter Haftung\nLeipheim\n\nDen Gläubigern der an der Verschmelzung beteiligten Rechtsträger ist, wenn sie binnen sechs Monaten nach dem Tag, an dem die Eintragung der Verschmelzung in das Register des Sitzes desjenigen Rechtsträgers, dessen Gläubiger sie sind, nach § 19 Abs. 3 UmwG als bekannt gemacht gilt, ihren Anspruch nach Grund und Höhe in Textform anmelden, Sicherheit zu leisten, soweit sie nicht Befriedigung verlangen können. Dieses Recht steht den Gläubigern jedoch nur zu, wenn sie glaubhaft machen, dass durch die Verschmelzung die Erfüllung ihrer Forderung gefährdet wird."
    },
    {
      "date": "2025-10-03",
      "id": "132603",
      "original_text": "Löschungsankündigung\nBayern Amtsgericht Nürnberg HRB 31315\nSun168 GmbH – Nürnberg",
      "type": "Löschungsankündigung",
      "state": "Bayern",
      "amtsgericht": "Amtsgericht Nürnberg",
      "registernummer": "HRB 31315",
      "registerart": "HRB",
      "company_name": "Sun168 GmbH",
      "company_seat": "Nürnberg",
      "details": "03.10.2025 (Bekanntmachungsdatum)\n\nBayern Amtsgericht Nürnberg HRB 31315\nLöschungsankündigung\n\nSun168 GmbH\nGesellschaft mit beschränkter Haftung\nNürnberg\n\nDas Registergericht beabsichtigt, die im Handelsregister eingetragene Gesellschaft wegen Vermögenslosigkeit von Amts wegen nach § 394 FamFG zu löschen. Die Frist zur Erhebung eines Widerspruchs ist auf einen Monat festgesetzt."
    },
    {
      "date": "2025-10-03",
      "id": "132604",
      "original_text": "Einreichung neuer Dokumente\nBayern Amtsgericht München HRB 125607\nComTeam AG – Holzkirchen",
      "type": "Einreichung neuer Dokumente",
      "state": "Bayern",
      "amtsgericht": "Amtsgericht München",
      "registernummer": "HRB 125607",
      "registerart": "HRB",
      "company_name": "ComTeam AG",
      "company_seat": "Holzkirchen",
      "details": "03.10.2025 (Bekanntmachungsdatum)\n\nBayern Amtsgericht München HRB 125607\nEinreichung neuer Dokumente\n\nComTeam AG\nAktiengesellschaft\nHolzkirchen\n\nDem Amtsgericht München -Registergericht- ist eine Liste der Mitglieder des Aufsichtsrats eingereicht worden, § 106 AktG."
    },
    {
      "date": "2025-10-03",
      "id": "132605",
      "original_text": "Registerbekanntmachung nach dem Umwandlungsgesetz\nBayern Amtsgericht Coburg HRB 6628\nHorizons RES GmbH – Lichtenfels",
      "type": "Registerbekanntmachung nach dem Umwandlungsgesetz",
      "state": "Bayern",
      "amtsgericht": "Amtsgericht Coburg",
      "registernummer": "HRB 6628",
      "registerart": "HRB",
      "company_name": "Horizons RES GmbH",
      "company_seat": "Lichtenfels",
      "details": "03.10.2025 (Bekanntmachungsdatum)\n\nBayern Amtsgericht Coburg HRB 6628\nRegisterbekanntmachung nach dem Umwandlungsgesetz 02.10.2025 (Eintragungsdatum)\n\nHorizons RES GmbH\nGesellschaft mit beschränkter Haftung\nLichtenfels\n\nDen Gläubigern der an der Verschmelzung beteiligten Rechtsträger ist, wenn sie binnen sechs Monaten nach dem Tag, an dem die Eintragung der Verschmelzung in das Register des Sitzes desjenigen Rechtsträgers, dessen Gläubiger sie sind, nach § 19 Abs. 3 UmwG als bekannt gemacht gilt, ihren Anspruch nach Grund und Höhe in Textform anmelden, Sicherheit zu leisten, soweit sie nicht Befriedigung verlangen können. Dieses Recht steht den Gläubigern jedoch nur zu, wenn sie glaubhaft machen, dass durch die Verschmelzung die Erfüllung ihrer Forderung gefährdet wird."
    },
    {
      "date": "2025-10-03",
      "id": "132606",
      "original_text": "Einreichung neuer Dokumente\nBayern Amtsgericht Regensburg HRB 8522\nams-OSRAM International GmbH – Regensburg",
      "type": "Einreichung neuer Dokumente",
      "state": "Bayern",
      "amtsgericht": "Amtsgericht Regensburg",
      "registernummer": "HRB 8522",
      "registerart": "HRB",
      "company_name": "ams-OSRAM International GmbH",
      "company_seat": "Regensburg",
      "details": "03.10.2025 (Bekanntmachungsdatum)\n\nBayern Amtsgericht Regensburg HRB 8522\nEinreichung neuer Dokumente\n\nams-OSRAM International GmbH\nGesellschaft mit beschränkter Haftung\nRegensburg\n\nDem Amtsgericht Regensburg -Registergericht- ist eine Liste der Mitglieder des Aufsichtsrats eingereicht worden, § 52 Abs. 3 S. 2 GmbHG."
    },
    {
      "date": "2025-10-03",
      "id": "132607",
      "original_text": "Einreichung neuer Dokumente\nBayern Amtsgericht München HRB 247508\nmedondo holding AG – München",
      "type": "Einreichung neuer Dokumente",
      "state": "Bayern",
      "amtsgericht": "Amtsgericht München",
      "registernummer": "HRB 247508",
      "registerart": "HRB",
      "company_name": "medondo holding AG",
      "company_seat": "München",
      "details": "03.10.2025 (Bekanntmachungsdatum)\n\nBayern Amtsgericht München HRB 247508\nEinreichung neuer Dokumente 02.10.2025 (Eintragungsdatum)\n\nmedondo holding AG\nAktiengesellschaft\nMünchen\n\nDem Amtsgericht München -Registergericht- ist eine Liste der Mitglieder des Aufsichtsrats eingereicht worden, § 106 AktG."
    },
    {
      "date": "2025-10-03",
      "id": "132608",
      "original_text": "Einreichung neuer Dokumente\nBayern Amtsgericht Nürnberg HRB 23037\nEXASOL AG – Nürnberg",
      "type": "Einreichung neuer Dokumente",
      "state": "Bayern",
      "amtsgericht": "Amtsgericht Nürnberg",
      "registernummer": "HRB 23037",
      "registerart": "HRB",
      "company_name": "EXASOL AG",
      "company_seat": "Nürnberg",
      "details": "03.10.2025 (Bekanntmachungsdatum)\n\nBayern Amtsgericht Nürnberg HRB 23037\nEinreichung neuer Dokumente 02.10.2025 (Eintragungsdatum)\n\nEXASOL AG\nAktiengesellschaft\nNürnberg\n\nDem Amtsgericht Nürnberg -Registergericht- ist eine Liste der Mitglieder des Aufsichtsrats eingereicht worden, § 106 AktG."
    },
    {
      "date": "2025-10-03",
      "id": "132609",
      "original_text": "Löschungsankündigung\nBayern Amtsgericht München HRB 102836\nRüther / Design GmbH – Unterhaching",
      "type": "Löschungsankündigung",
      "state": "Bayern",
      "amtsgericht": "Amtsgericht München",
      "registernummer": "HRB 102836",
      "registerart": "HRB",
      "company_name": "Rüther / Design GmbH",
      "company_seat": "Unterhaching",
      "details": "03.10.2025 (Bekanntmachungsdatum)\n\nBayern Amtsgericht München HRB 102836\nLöschungsankündigung 01.10.2025 (Eintragungsdatum)\n\nRüther / Design GmbH\nGesellschaft mit beschränkter Haftung\nUnterhaching\n\nDas Registergericht beabsichtigt, die im Handelsregister eingetragene Gesellschaft wegen Vermögenslosigkeit von Amts wegen nach § 394 FamFG zu löschen. Die Frist zur Erhebung eines Widerspruchs ist auf drei Monate festgesetzt."
    },
    {
      "date": "2025-10-03",
      "id": "132610",
      "original_text": "Löschungsankündigung\nBayern Amtsgericht München HRB 294133\nFlexxbau GmbH – München",
      "type": "Löschungsankündigung",
      "state": "Bayern",
      "amtsgericht": "Amtsgericht München",
      "registernummer": "HRB 294133",
      "registerart": "HRB",
      "company_name": "Flexxbau GmbH",
      "company_seat": "München",
      "details": "03.10.2025 (Bekanntmachungsdatum)\n\nBayern Amtsgericht München HRB 294133\nLöschungsankündigung 24.09.2025 (Eintragungsdatum)\n\nFlexxbau GmbH\nGesellschaft mit beschränkter Haftung\nMünchen\n\nDas Registergericht beabsichtigt, die im Handelsregister eingetragene Gesellschaft wegen Vermögenslosigkeit von Amts wegen nach § 394 FamFG zu löschen. Die Frist zur Erhebung eines Widerspruchs ist auf drei Monate festgesetzt."
    },
    {
      "date": "2025-10-03",
      "id": "132611",
      "original_text": "Registerbekanntmachung nach dem Umwandlungsgesetz\nBayern Amtsgericht Memmingen HRB 19745\nDUO Warenvertriebs GmbH – Leipheim",
      "type": "Registerbekanntmachung nach dem Umwandlungsgesetz",
      "state": "Bayern",
      "amtsgericht": "Amtsgericht Memmingen",
      "registernummer": "HRB 19745",
      "registerart": "HRB",
      "company_name": "DUO Warenvertriebs GmbH",
      "company_seat": "Leipheim",
      "details": "03.10.2025 (Bekanntmachungsdatum)\n\nBayern Amtsgericht Memmingen HRB 19745\nRegisterbekanntmachung nach dem Umwandlungsgesetz 02.10.2025 (Eintragungsdatum)\n\nDUO Warenvertriebs GmbH\nGesellschaft mit beschränkter Haftung\nLeipheim\n\nDen Gläubigern der an der Verschmelzung beteiligten Rechtsträger ist, wenn sie binnen sechs Monaten nach dem Tag, an dem die Eintragung der Verschmelzung in das Register des Sitzes desjenigen Rechtsträgers, dessen Gläubiger sie sind, nach § 19 Abs. 3 UmwG als bekannt gemacht gilt, ihren Anspruch nach Grund und Höhe in Textform anmelden, Sicherheit zu leisten, soweit sie nicht Befriedigung verlangen können. Dieses Recht steht den Gläubigern jedoch nur zu, wenn sie glaubhaft machen, dass durch die Verschmelzung die Erfüllung ihrer Forderung gefährdet wird."
    },
    {
      "date": "2025-10-03",
      "id": "132612",
      "original_text": "Registerbekanntmachung nach dem Umwandlungsgesetz\nBayern Amtsgericht Ingolstadt GnR 100151\nRaiffeisenbank Ehekirchen-Oberhausen eG – Ehekirchen",
      "type": "Registerbekanntmachung nach dem Umwandlungsgesetz",
      "state": "Bayern",
      "amtsgericht": "Amtsgericht Ingolstadt",
      "registernummer": "GnR 100151",
      "registerart": "GnR",
      "company_name": "Raiffeisenbank Ehekirchen-Oberhausen eG",
      "company_seat": "Ehekirchen",
      "details": "03.10.2025 (Bekanntmachungsdatum)\n\nBayern Amtsgericht Ingolstadt GnR 100151\nRegisterbekanntmachung nach dem Umwandlungsgesetz 02.10.2025 (Eintragungsdatum)\n\nRaiffeisenbank Ehekirchen-Oberhausen eG\neingetragene Genossenschaft\nEhekirchen\n\nDen Gläubigern der an der Verschmelzung beteiligten Rechtsträger ist, wenn sie binnen sechs Monaten nach dem Tag, an dem die Eintragung der Verschmelzung in das Register des Sitzes desjenigen Rechtsträgers, dessen Gläubiger sie sind, nach § 19 Abs. 3 UmwG als bekannt gemacht gilt, ihren Anspruch nach Grund und Höhe in Textform anmelden, Sicherheit zu leisten, soweit sie nicht Befriedigung verlangen können. Dieses Recht steht den Gläubigern jedoch nur zu, wenn sie glaubhaft machen, dass durch die Verschmelzung die Erfüllung ihrer Forderung gefährdet wird."
    },
    {
      "date": "2025-10-03",
      "id": "132613",
      "original_text": "Einreichung neuer Dokumente\nBayern Amtsgericht Weiden i. d. OPf. HRB 5990\nBAVARIA Management SE – Parkstein",
      "type": "Einreichung neuer Dokumente",
      "state": "Bayern",
      "amtsgericht": "Amtsgericht Weiden i. d. OPf.",
      "registernummer": "HRB 5990",
      "registerart": "HRB",
      "company_name": "BAVARIA Management SE",
      "company_seat": "Parkstein",
      "details": "03.10.2025 (Bekanntmachungsdatum)\n\nBayern Amtsgericht Weiden i. d. OPf. HRB 5990\nEinreichung neuer Dokumente 02.10.2025 (Eintragungsdatum)\n\nBAVARIA Management SE\nEuropäische Aktiengesellschaft (SE)\nParkstein\n\nDem Amtsgericht Weiden i.d.OPf. -Registergericht- ist eine Liste der Mitglieder des Aufsichtsrats eingereicht worden, Art. 9 Abs. 1 Buchst. c (ii) SE-VO i.V.m. § 106 AktG."
    },
    {
      "date": "2025-10-03",
      "id": "132614",
      "original_text": "Registerbekanntmachung nach dem Umwandlungsgesetz\nBayern Amtsgericht Nürnberg HRB 45056\nWäscherei Meyer GmbH – Nürnberg",
      "type": "Registerbekanntmachung nach dem Umwandlungsgesetz",
      "state": "Bayern",
      "amtsgericht": "Amtsgericht Nürnberg",
      "registernummer": "HRB 45056",
      "registerart": "HRB",
      "company_name": "Wäscherei Meyer GmbH",
      "company_seat": "Nürnberg",
      "details": "03.10.2025 (Bekanntmachungsdatum)\n\nBayern Amtsgericht Nürnberg HRB 45056\nRegisterbekanntmachung nach dem Umwandlungsgesetz 02.10.2025 (Eintragungsdatum)\n\nWäscherei Meyer GmbH\nGesellschaft mit beschränkter Haftung\nNürnberg\n\nDen Gläubigern des formwechselnden Rechtsträgers ist, wenn sie binnen sechs Monaten nach dem Tag, an dem die Eintragung des Formwechsels nach § 201 UmwG als bekannt gemacht gilt, ihren Anspruch nach Grund und Höhe in Textform anmelden, Sicherheit zu leisten, soweit sie nicht Befriedigung verlangen können. Dieses Recht steht den Gläubigern jedoch nur zu, wenn sie glaubhaft machen, dass durch den Formwechsel die Erfüllung ihrer Forderung gefährdet wird."
    },
    {
      "date": "2025-10-03",
      "id": "132615",
      "original_text": "Einreichung neuer Dokumente\nBerlin Amtsgericht Berlin (Charlottenburg) HRB 1105\nR.STOCK Aktiengesellschaft – Berlin",
      "type": "Einreichung neuer Dokumente",
      "state": "Berlin",
      "amtsgericht": "Amtsgericht Berlin (Charlottenburg)",
      "registernummer": "HRB 1105",
      "registerart": "HRB",
      "company_name": "R.STOCK Aktiengesellschaft",
      "company_seat": "Berlin",
      "details": "03.10.2025 (Bekanntmachungsdatum)\n\nBerlin Amtsgericht Berlin (Charlottenburg) HRB 1105\nEinreichung neuer Dokumente\n\nR.STOCK Aktiengesellschaft\nAktiengesellschaft\nBerlin\n\nAls nicht eingetragen wird veröffentlicht:Es wurde eine neue Liste der Aufsichtsratsmitglieder eingereicht (§ 106 AktG)."
    },
    {
      "date": "2025-10-03",
      "id": "132616",
      "original_text": "Löschungsankündigung\nBerlin Amtsgericht Berlin (Charlottenburg) HRB 149147\nGSC GameScienceCenter GmbH – Berlin",
      "type": "Löschungsankündigung",
      "state": "Berlin",
      "amtsgericht": "Amtsgericht Berlin (Charlottenburg)",
      "registernummer": "HRB 149147",
      "registerart": "HRB",
      "company_name": "GSC GameScienceCenter GmbH",
      "company_seat": "Berlin",
      "details": "03.10.2025 (Bekanntmachungsdatum)\n\nBerlin Amtsgericht Berlin (Charlottenburg) HRB 149147\nLöschungsankündigung\n\nGSC GameScienceCenter GmbH\nGesellschaft mit beschränkter Haftung\nBerlin\n\nBei der nachstehenden Gesellschaft wird das Amtslöschungsverfahren gemäß § 394 FamFG eingeleitet. Widerspruchsfrist 6 Wochen"
    },
    {
      "date": "2025-10-03",
      "id": "132617",
      "original_text": "Löschungsankündigung\nBerlin Amtsgericht Berlin (Charlottenburg) HRB 175258\nBIOrgano Germany UG (haftungsbeschränkt) – Berlin",
      "type": "Löschungsankündigung",
      "state": "Berlin",
      "amtsgericht": "Amtsgericht Berlin (Charlottenburg)",
      "registernummer": "HRB 175258",
      "registerart": "HRB",
      "company_name": "BIOrgano Germany UG (haftungsbeschränkt)",
      "company_seat": "Berlin",
      "details": "03.10.2025 (Bekanntmachungsdatum)\n\nBerlin Amtsgericht Berlin (Charlottenburg) HRB 175258\nLöschungsankündigung\n\nBIOrgano Germany UG (haftungsbeschränkt)\nGesellschaft mit beschränkter Haftung\nBerlin\n\nBei der nachstehenden Gesellschaft wird das Amtslöschungsverfahren gemäß § 394 FamFG eingeleitet. Widerspruchsfrist 6 Wochen"
    },
    {
      "date": "2025-10-03",
      "id": "132618",
      "original_text": "Registerbekanntmachung nach dem Umwandlungsgesetz\nBaden-Württemberg Amtsgericht Ulm HRB 744598\nDomek GmbH – Niederstotzingen",
      "type": "Registerbekanntmachung nach dem Umwandlungsgesetz",
      "state": "Baden-Württemberg",
      "amtsgericht": "Amtsgericht Ulm",
      "registernummer": "HRB 744598",
      "registerart": "HRB",
      "company_name": "Domek GmbH",
      "company_seat": "Niederstotzingen",
      "details": "03.10.2025 (Bekanntmachungsdatum)\n\nBaden-Württemberg Amtsgericht Ulm HRB 744598\nRegisterbekanntmachung nach dem Umwandlungsgesetz 03.10.2025 (Eintragungsdatum)\n\nDomek GmbH\nGesellschaft mit beschränkter Haftung\nNiederstotzingen\n\nAls nicht eingetragen wird bekanntgemacht:\nDen Gläubigern der an der Verschmelzung beteiligten Rechtsträger ist, wenn sie binnen sechs Monaten nach dem Tag, an dem die Eintragung der Verschmelzung in das Register des Sitzes desjenigen Rechtsträgers, dessen Gläubiger sie sind, nach § 19 Abs. 3 UmwG als bekanntgemacht gilt, ihren Anspruch nach Grund und Höhe schriftlich anmelden, Sicherheit zu leisten, soweit sie nicht Befriedigung verlangen können. Dieses Recht steht den Gläubigern jedoch nur zu, wenn sie glaubhaft machen, dass durch die Verschmelzung die Erfüllung ihrer Forderung gefährdet wird."
    },
    {
      "date": "2025-10-03",
      "id": "132619",
      "original_text": "Registerbekanntmachung nach dem Umwandlungsgesetz\nNordrhein-Westfalen Amtsgericht Münster HRA 12189\nBautenschutz Bernhard Wendt GmbH & Co. KG – Ennigerloh",
      "type": "Registerbekanntmachung nach dem Umwandlungsgesetz",
      "state": "Nordrhein-Westfalen",
      "amtsgericht": "Amtsgericht Münster",
      "registernummer": "HRA 12189",
      "registerart": "HRA",
      "company_name": "Bautenschutz Bernhard Wendt GmbH & Co. KG",
      "company_seat": "Ennigerloh",
      "details": "03.10.2025 (Bekanntmachungsdatum)\n\nNordrhein-Westfalen Amtsgericht Münster HRA 12189\nRegisterbekanntmachung nach dem Umwandlungsgesetz 03.10.2025 (Eintragungsdatum)\n\nBautenschutz Bernhard Wendt GmbH & Co. KG\nKommanditgesellschaft\nEnnigerloh\n\nDen Gläubigern der an der formwechselnden Umwandlung beteiligten Rechtsträger ist, wenn sie binnen sechs Monaten nach dem Tag, an dem die Eintragung der formwechselnden Umwandlung in das Register des Sitzes desjenigen Rechtsträgers, dessen Gläubiger sie sind, nach § 19 Absatz 3 UmwG als bekanntgemacht gilt, ihren Anspruch nach Grund und Höhe schriftlich anmelden, Sicherheit zu leisten, soweit sie nicht Befriedigung verlangen können. Dieses Recht steht den Gläubigern jedoch nur zu, wenn sie glaubhaft machen, dass durch die formwechselnden Umwandlung die Erfüllung ihrer Forderung gefährdet wird."
    }
  ]
}