{
  "date": "2025-02-11",
  "date_of_scrape": "2025-02-12T04:06:28.946Z",
  "tool_version": "0.2.0",
  "number_of_announcements": 107,
  "announcements": [
    {
      "date": "2025-02-11",
      "id": "100941",
      "original_text": "Einreichung neuer Dokumente\nBayern Amtsgericht München HRB 134924\nERR - SYNDICUS Vermögensverwaltungs-AG – Egenhofen",
      "type": "Einreichung neuer Dokumente",
      "state": "Bayern",
      "amtsgericht": "Amtsgericht München",
      "registernummer": "HRB 134924",
      "registerart": "HRB",
      "company_name": "ERR - SYNDICUS Vermögensverwaltungs-AG",
      "company_seat": "Egenhofen",
      "details": "11.02.2025 (Bekanntmachungsdatum)\n\nBayern Amtsgericht München HRB 134924\nEinreichung neuer Dokumente 10.02.2025 (Eintragungsdatum)\n\nERR - SYNDICUS Vermögensverwaltungs-AG\nAktiengesellschaft\nEgenhofen\n\nDem Amtsgericht München -Registergericht- ist eine Liste der Mitglieder des Aufsichtsrats eingereicht worden, § 106 AktG."
    },
    {
      "date": "2025-02-11",
      "id": "100942",
      "original_text": "Registerbekanntmachung nach dem Umwandlungsgesetz\nBayern Amtsgericht Ansbach HRB 5275\nRIKON Verwaltungs-GmbH – Dinkelsbühl",
      "type": "Registerbekanntmachung nach dem Umwandlungsgesetz",
      "state": "Bayern",
      "amtsgericht": "Amtsgericht Ansbach",
      "registernummer": "HRB 5275",
      "registerart": "HRB",
      "company_name": "RIKON Verwaltungs-GmbH",
      "company_seat": "Dinkelsbühl",
      "details": "11.02.2025 (Bekanntmachungsdatum)\n\nBayern Amtsgericht Ansbach HRB 5275\nRegisterbekanntmachung nach dem Umwandlungsgesetz 10.02.2025 (Eintragungsdatum)\n\nRIKON Verwaltungs-GmbH\nGesellschaft mit beschränkter Haftung\nDinkelsbühl\n\nDen Gläubigern der an der Verschmelzung beteiligten Rechtsträger ist, wenn sie binnen sechs Monaten nach dem Tag, an dem die Eintragung der Verschmelzung in das Register des Sitzes desjenigen Rechtsträgers, dessen Gläubiger sie sind, nach § 19 Abs. 3 UmwG als bekannt gemacht gilt, ihren Anspruch nach Grund und Höhe in Textform anmelden, Sicherheit zu leisten, soweit sie nicht Befriedigung verlangen können. Dieses Recht steht den Gläubigern jedoch nur zu, wenn sie glaubhaft machen, dass durch die Verschmelzung die Erfüllung ihrer Forderung gefährdet wird."
    },
    {
      "date": "2025-02-11",
      "id": "100943",
      "original_text": "Löschungsankündigung\nBayern Amtsgericht München HRB 283746\nSonerix UG (haftungsbeschränkt) – München",
      "type": "Löschungsankündigung",
      "state": "Bayern",
      "amtsgericht": "Amtsgericht München",
      "registernummer": "HRB 283746",
      "registerart": "HRB",
      "company_name": "Sonerix UG (haftungsbeschränkt)",
      "company_seat": "München",
      "details": "11.02.2025 (Bekanntmachungsdatum)\n\nBayern Amtsgericht München HRB 283746\nLöschungsankündigung 10.02.2025 (Eintragungsdatum)\n\nSonerix UG (haftungsbeschränkt)\nGesellschaft mit beschränkter Haftung\nMünchen\n\nDas Registergericht beabsichtigt, die im Handelsregister eingetragene Gesellschaft wegen Vermögenslosigkeit von Amts wegen nach § 394 FamFG zu löschen. Die Frist zur Erhebung eines Widerspruchs ist auf drei Monate festgesetzt."
    },
    {
      "date": "2025-02-11",
      "id": "100944",
      "original_text": "Registerbekanntmachung nach dem Umwandlungsgesetz\nBayern Amtsgericht Ansbach HRA 3707\nRIKON GmbH & Co KG – Dinkelsbühl",
      "type": "Registerbekanntmachung nach dem Umwandlungsgesetz",
      "state": "Bayern",
      "amtsgericht": "Amtsgericht Ansbach",
      "registernummer": "HRA 3707",
      "registerart": "HRA",
      "company_name": "RIKON GmbH & Co KG",
      "company_seat": "Dinkelsbühl",
      "details": "11.02.2025 (Bekanntmachungsdatum)\n\nBayern Amtsgericht Ansbach HRA 3707\nRegisterbekanntmachung nach dem Umwandlungsgesetz 10.02.2025 (Eintragungsdatum)\n\nRIKON GmbH & Co KG\nKommanditgesellschaft\nDinkelsbühl\n\nDen Gläubigern der an der Verschmelzung beteiligten Rechtsträger ist, wenn sie binnen sechs Monaten nach dem Tag, an dem die Eintragung der Verschmelzung in das Register des Sitzes desjenigen Rechtsträgers, dessen Gläubiger sie sind, nach § 19 Abs. 3 UmwG als bekannt gemacht gilt, ihren Anspruch nach Grund und Höhe in Textform anmelden, Sicherheit zu leisten, soweit sie nicht Befriedigung verlangen können. Dieses Recht steht den Gläubigern jedoch nur zu, wenn sie glaubhaft machen, dass durch die Verschmelzung die Erfüllung ihrer Forderung gefährdet wird."
    },
    {
      "date": "2025-02-11",
      "id": "100945",
      "original_text": "Einreichung neuer Dokumente\nBayern Amtsgericht Ingolstadt HRB 7176\nIDEENION Automobil AG – Gaimersheim",
      "type": "Einreichung neuer Dokumente",
      "state": "Bayern",
      "amtsgericht": "Amtsgericht Ingolstadt",
      "registernummer": "HRB 7176",
      "registerart": "HRB",
      "company_name": "IDEENION Automobil AG",
      "company_seat": "Gaimersheim",
      "details": "11.02.2025 (Bekanntmachungsdatum)\n\nBayern Amtsgericht Ingolstadt HRB 7176\nEinreichung neuer Dokumente\n\nIDEENION Automobil AG\nAktiengesellschaft\nGaimersheim\n\nDem #Re.Name ist eine Liste der Mitglieder des Aufsichtsrats eingereicht worden, § 106 AktG."
    },
    {
      "date": "2025-02-11",
      "id": "100946",
      "original_text": "Löschungsankündigung\nBayern Amtsgericht Aschaffenburg HRB 17397\nADBatomIT Consulting UG (haftungsbeschränkt) – Aschaffenburg",
      "type": "Löschungsankündigung",
      "state": "Bayern",
      "amtsgericht": "Amtsgericht Aschaffenburg",
      "registernummer": "HRB 17397",
      "registerart": "HRB",
      "company_name": "ADBatomIT Consulting UG (haftungsbeschränkt)",
      "company_seat": "Aschaffenburg",
      "details": "11.02.2025 (Bekanntmachungsdatum)\n\nBayern Amtsgericht Aschaffenburg HRB 17397\nLöschungsankündigung\n\nADBatomIT Consulting UG (haftungsbeschränkt)\nGesellschaft mit beschränkter Haftung\nAschaffenburg\n\nDas Registergericht beabsichtigt, die im Handelsregister eingetragene Gesellschaft wegen Vermögenslosigkeit von Amts wegen nach § 394 FamFG zu löschen. Die Frist zur Erhebung eines Widerspruchs ist auf drei Monate festgesetzt."
    },
    {
      "date": "2025-02-11",
      "id": "100947",
      "original_text": "Löschungsankündigung\nBayern Amtsgericht München HRB 237249\nTalking Loud GmbH – München",
      "type": "Löschungsankündigung",
      "state": "Bayern",
      "amtsgericht": "Amtsgericht München",
      "registernummer": "HRB 237249",
      "registerart": "HRB",
      "company_name": "Talking Loud GmbH",
      "company_seat": "München",
      "details": "11.02.2025 (Bekanntmachungsdatum)\n\nBayern Amtsgericht München HRB 237249\nLöschungsankündigung 10.02.2025 (Eintragungsdatum)\n\nTalking Loud GmbH\nGesellschaft mit beschränkter Haftung\nMünchen\n\nDas Registergericht beabsichtigt, die im Handelsregister eingetragene Gesellschaft wegen Vermögenslosigkeit von Amts wegen nach § 394 FamFG zu löschen. Die Frist zur Erhebung eines Widerspruchs ist auf drei Monate festgesetzt."
    },
    {
      "date": "2025-02-11",
      "id": "100948",
      "original_text": "Löschungsankündigung\nBayern Amtsgericht München HRB 265648\nAS GmbH Bau - Elektro - Gebäudereinigung – Ottobrunn",
      "type": "Löschungsankündigung",
      "state": "Bayern",
      "amtsgericht": "Amtsgericht München",
      "registernummer": "HRB 265648",
      "registerart": "HRB",
      "company_name": "AS GmbH Bau - Elektro - Gebäudereinigung",
      "company_seat": "Ottobrunn",
      "details": "11.02.2025 (Bekanntmachungsdatum)\n\nBayern Amtsgericht München HRB 265648\nLöschungsankündigung 10.02.2025 (Eintragungsdatum)\n\nAS GmbH Bau - Elektro - Gebäudereinigung\nGesellschaft mit beschränkter Haftung\nOttobrunn\n\nDas Registergericht beabsichtigt, die im Handelsregister eingetragene Gesellschaft wegen Vermögenslosigkeit von Amts wegen nach § 394 FamFG zu löschen. Die Frist zur Erhebung eines Widerspruchs ist auf drei Monate festgesetzt."
    },
    {
      "date": "2025-02-11",
      "id": "100949",
      "original_text": "Registerbekanntmachung nach dem Umwandlungsgesetz\nBayern Amtsgericht Fürth HRB 18361\nL´air pur GmbH – Fürth",
      "type": "Registerbekanntmachung nach dem Umwandlungsgesetz",
      "state": "Bayern",
      "amtsgericht": "Amtsgericht Fürth",
      "registernummer": "HRB 18361",
      "registerart": "HRB",
      "company_name": "L´air pur GmbH",
      "company_seat": "Fürth",
      "details": "11.02.2025 (Bekanntmachungsdatum)\n\nBayern Amtsgericht Fürth HRB 18361\nRegisterbekanntmachung nach dem Umwandlungsgesetz 10.02.2025 (Eintragungsdatum)\n\nL´air pur GmbH\nGesellschaft mit beschränkter Haftung\nFürth\n\nDen Gläubigern des formwechselnden Rechtsträgers ist, wenn sie binnen sechs Monaten nach dem Tag, an dem die Eintragung des Formwechsels nach § 201 UmwG als bekannt gemacht gilt, ihren Anspruch nach Grund und Höhe in Textform anmelden, Sicherheit zu leisten, soweit sie nicht Befriedigung verlangen können. Dieses Recht steht den Gläubigern jedoch nur zu, wenn sie glaubhaft machen, dass durch den Formwechsel die Erfüllung ihrer Forderung gefährdet wird."
    },
    {
      "date": "2025-02-11",
      "id": "100950",
      "original_text": "Registerbekanntmachung nach dem Umwandlungsgesetz\nBayern Amtsgericht München PR 1994\nScheid & Partner Steuerberatungsgesellschaft mbB – München",
      "type": "Registerbekanntmachung nach dem Umwandlungsgesetz",
      "state": "Bayern",
      "amtsgericht": "Amtsgericht München",
      "registernummer": "PR 1994",
      "registerart": "PR",
      "company_name": "Scheid & Partner Steuerberatungsgesellschaft mbB",
      "company_seat": "München",
      "details": "11.02.2025 (Bekanntmachungsdatum)\n\nBayern Amtsgericht München PR 1994\nRegisterbekanntmachung nach dem Umwandlungsgesetz 10.02.2025 (Eintragungsdatum)\n\nScheid & Partner Steuerberatungsgesellschaft mbB\nPartnerschaftsgesellschaft\nMünchen\n\nDen Gläubigern der an der Verschmelzung beteiligten Rechtsträger ist, wenn sie binnen sechs Monaten nach dem Tag, an dem die Eintragung der Verschmelzung in das Register des Sitzes desjenigen Rechtsträgers, dessen Gläubiger sie sind, nach § 19 Abs. 3 UmwG als bekannt gemacht gilt, ihren Anspruch nach Grund und Höhe in Textform anmelden, Sicherheit zu leisten, soweit sie nicht Befriedigung verlangen können. Dieses Recht steht den Gläubigern jedoch nur zu, wenn sie glaubhaft machen, dass durch die Verschmelzung die Erfüllung ihrer Forderung gefährdet wird."
    },
    {
      "date": "2025-02-11",
      "id": "100951",
      "original_text": "Einreichung neuer Dokumente\nBayern Amtsgericht München HRB 281374\nSmart Estate Life SE – München",
      "type": "Einreichung neuer Dokumente",
      "state": "Bayern",
      "amtsgericht": "Amtsgericht München",
      "registernummer": "HRB 281374",
      "registerart": "HRB",
      "company_name": "Smart Estate Life SE",
      "company_seat": "München",
      "details": "11.02.2025 (Bekanntmachungsdatum)\n\nBayern Amtsgericht München HRB 281374\nEinreichung neuer Dokumente\n\nSmart Estate Life SE\nEuropäische Aktiengesellschaft (SE)\nMünchen\n\nDem Amtsgericht München -Registergericht- ist eine Liste der Mitglieder des Verwaltungsrats eingereicht worden, Art. 9 Abs. 1 Buchst. c (ii) SE-VO i.V.m. § 106 AktG."
    },
    {
      "date": "2025-02-11",
      "id": "100952",
      "original_text": "Einreichung neuer Dokumente\nBayern Amtsgericht München HRB 268866\nOneconsult Deutschland AG – München",
      "type": "Einreichung neuer Dokumente",
      "state": "Bayern",
      "amtsgericht": "Amtsgericht München",
      "registernummer": "HRB 268866",
      "registerart": "HRB",
      "company_name": "Oneconsult Deutschland AG",
      "company_seat": "München",
      "details": "11.02.2025 (Bekanntmachungsdatum)\n\nBayern Amtsgericht München HRB 268866\nEinreichung neuer Dokumente 10.02.2025 (Eintragungsdatum)\n\nOneconsult Deutschland AG\nAktiengesellschaft\nMünchen\n\nDem Amtsgericht München -Registergericht- ist eine Liste der Mitglieder des Aufsichtsrats eingereicht worden, § 106 AktG."
    },
    {
      "date": "2025-02-11",
      "id": "100953",
      "original_text": "Registerbekanntmachung nach dem Umwandlungsgesetz\nBayern Amtsgericht Traunstein HRB 18350\nOSRAM SL GmbH – Traunreut",
      "type": "Registerbekanntmachung nach dem Umwandlungsgesetz",
      "state": "Bayern",
      "amtsgericht": "Amtsgericht Traunstein",
      "registernummer": "HRB 18350",
      "registerart": "HRB",
      "company_name": "OSRAM SL GmbH",
      "company_seat": "Traunreut",
      "details": "11.02.2025 (Bekanntmachungsdatum)\n\nBayern Amtsgericht Traunstein HRB 18350\nRegisterbekanntmachung nach dem Umwandlungsgesetz 10.02.2025 (Eintragungsdatum)\n\nOSRAM SL GmbH\nGesellschaft mit beschränkter Haftung\nTraunreut\n\nDen Gläubigern der an der Verschmelzung beteiligten Rechtsträger ist, wenn sie binnen sechs Monaten nach dem Tag, an dem die Eintragung der Verschmelzung in das Register des Sitzes desjenigen Rechtsträgers, dessen Gläubiger sie sind, nach § 19 Abs. 3 UmwG als bekannt gemacht gilt, ihren Anspruch nach Grund und Höhe in Textform anmelden, Sicherheit zu leisten, soweit sie nicht Befriedigung verlangen können. Dieses Recht steht den Gläubigern jedoch nur zu, wenn sie glaubhaft machen, dass durch die Verschmelzung die Erfüllung ihrer Forderung gefährdet wird."
    },
    {
      "date": "2025-02-11",
      "id": "100954",
      "original_text": "Sonstige Registerbekanntmachung\nBayern Amtsgericht Memmingen HRB 10496\nNegele Messtechnik GmbH – Egg/Günz",
      "type": "Sonstige Registerbekanntmachung",
      "state": "Bayern",
      "amtsgericht": "Amtsgericht Memmingen",
      "registernummer": "HRB 10496",
      "registerart": "HRB",
      "company_name": "Negele Messtechnik GmbH",
      "company_seat": "Egg/Günz",
      "details": "11.02.2025 (Bekanntmachungsdatum)\n\nBayern Amtsgericht Memmingen HRB 10496\nSonstige Registerbekanntmachung 10.02.2025 (Eintragungsdatum)\n\nNegele Messtechnik GmbH\nGesellschaft mit beschränkter Haftung\nEgg/Günz\n\nDen Gläubigern der Gesellschaft, deren Forderungen begründet worden sind, bevor die Eintragung der Beendigung des Gewinnabführungsvertrages in das Handelsregister nach § 10 des Handelsgesetzbuches als bekanntgemacht gilt, hat der andere Vertragsteil Sicherheit zu leisten, wenn sie sich binnen sechs Monaten nach der Bekanntmachung der Eintragung zu diesem Zweck bei ihm melden."
    },
    {
      "date": "2025-02-11",
      "id": "100955",
      "original_text": "Registerbekanntmachung nach dem Umwandlungsgesetz\nBayern Amtsgericht Bamberg HRB 10709\nFit Panda GmbH – Heroldsbach",
      "type": "Registerbekanntmachung nach dem Umwandlungsgesetz",
      "state": "Bayern",
      "amtsgericht": "Amtsgericht Bamberg",
      "registernummer": "HRB 10709",
      "registerart": "HRB",
      "company_name": "Fit Panda GmbH",
      "company_seat": "Heroldsbach",
      "details": "11.02.2025 (Bekanntmachungsdatum)\n\nBayern Amtsgericht Bamberg HRB 10709\nRegisterbekanntmachung nach dem Umwandlungsgesetz 10.02.2025 (Eintragungsdatum)\n\nFit Panda GmbH\nGesellschaft mit beschränkter Haftung\nHeroldsbach\n\nDen Gläubigern der an der Verschmelzung beteiligten Rechtsträger ist, wenn sie binnen sechs Monaten nach dem Tag, an dem die Eintragung der Verschmelzung in das Register des Sitzes desjenigen Rechtsträgers, dessen Gläubiger sie sind, nach § 19 Abs. 3 UmwG als bekannt gemacht gilt, ihren Anspruch nach Grund und Höhe in Textform anmelden, Sicherheit zu leisten, soweit sie nicht Befriedigung verlangen können. Dieses Recht steht den Gläubigern jedoch nur zu, wenn sie glaubhaft machen, dass durch die Verschmelzung die Erfüllung ihrer Forderung gefährdet wird."
    },
    {
      "date": "2025-02-11",
      "id": "100956",
      "original_text": "Registerbekanntmachung nach dem Umwandlungsgesetz\nBayern Amtsgericht Fürth HRA 12505\nOguz Gayretli e.K. – Fürth",
      "type": "Registerbekanntmachung nach dem Umwandlungsgesetz",
      "state": "Bayern",
      "amtsgericht": "Amtsgericht Fürth",
      "registernummer": "HRA 12505",
      "registerart": "HRA",
      "company_name": "Oguz Gayretli e.K.",
      "company_seat": "Fürth",
      "details": "11.02.2025 (Bekanntmachungsdatum)\n\nBayern Amtsgericht Fürth HRA 12505\nRegisterbekanntmachung nach dem Umwandlungsgesetz 10.02.2025 (Eintragungsdatum)\n\nOguz Gayretli e.K.\nEinzelkaufmann / Einzelkauffrau\nFürth\n\nDen Gläubigern der an der Verschmelzung beteiligten Rechtsträger ist, wenn sie binnen sechs Monaten nach dem Tag, an dem die Eintragung der Verschmelzung in das Register des Sitzes desjenigen Rechtsträgers, dessen Gläubiger sie sind, nach § 19 Abs. 3 UmwG als bekannt gemacht gilt, ihren Anspruch nach Grund und Höhe in Textform anmelden, Sicherheit zu leisten, soweit sie nicht Befriedigung verlangen können. Dieses Recht steht den Gläubigern jedoch nur zu, wenn sie glaubhaft machen, dass durch die Verschmelzung die Erfüllung ihrer Forderung gefährdet wird."
    },
    {
      "date": "2025-02-11",
      "id": "100957",
      "original_text": "Registerbekanntmachung nach dem Umwandlungsgesetz\nBaden-Württemberg Amtsgericht Mannheim HRB 430976\nTRANSCERAM GmbH – Laudenbach",
      "type": "Registerbekanntmachung nach dem Umwandlungsgesetz",
      "state": "Baden-Württemberg",
      "amtsgericht": "Amtsgericht Mannheim",
      "registernummer": "HRB 430976",
      "registerart": "HRB",
      "company_name": "TRANSCERAM GmbH",
      "company_seat": "Laudenbach",
      "details": "11.02.2025 (Bekanntmachungsdatum)\n\nBaden-Württemberg Amtsgericht Mannheim HRB 430976\nRegisterbekanntmachung nach dem Umwandlungsgesetz 11.02.2025 (Eintragungsdatum)\n\nTRANSCERAM GmbH\nGesellschaft mit beschränkter Haftung\nLaudenbach\n\nAls nicht eingetragen wird bekanntgemacht:\nDen Gläubigern der an der Verschmelzung beteiligten Rechtsträger ist, wenn sie binnen sechs Monaten nach dem Tag, an dem die Eintragung der Verschmelzung in das Register des Sitzes desjenigen Rechtsträgers, dessen Gläubiger sie sind, nach § 19 Abs. 3 UmwG als bekanntgemacht gilt, ihren Anspruch nach Grund und Höhe schriftlich anmelden, Sicherheit zu leisten, soweit sie nicht Befriedigung verlangen können. Dieses Recht steht den Gläubigern jedoch nur zu, wenn sie glaubhaft machen, dass durch die Verschmelzung die Erfüllung ihrer Forderung gefährdet wird."
    },
    {
      "date": "2025-02-11",
      "id": "100958",
      "original_text": "Registerbekanntmachung nach dem Umwandlungsgesetz\nBaden-Württemberg Amtsgericht Mannheim HRB 430889\nTransceram GmbH – Laudenbach",
      "type": "Registerbekanntmachung nach dem Umwandlungsgesetz",
      "state": "Baden-Württemberg",
      "amtsgericht": "Amtsgericht Mannheim",
      "registernummer": "HRB 430889",
      "registerart": "HRB",
      "company_name": "Transceram GmbH",
      "company_seat": "Laudenbach",
      "details": "11.02.2025 (Bekanntmachungsdatum)\n\nBaden-Württemberg Amtsgericht Mannheim HRB 430889\nRegisterbekanntmachung nach dem Umwandlungsgesetz 11.02.2025 (Eintragungsdatum)\n\nTransceram GmbH\nGesellschaft mit beschränkter Haftung\nLaudenbach\n\nAls nicht eingetragen wird bekanntgemacht:\nDen Gläubigern der an der Verschmelzung beteiligten Rechtsträger ist, wenn sie binnen sechs Monaten nach dem Tag, an dem die Eintragung der Verschmelzung in das Register des Sitzes desjenigen Rechtsträgers, dessen Gläubiger sie sind, nach § 19 Abs. 3 UmwG als bekanntgemacht gilt, ihren Anspruch nach Grund und Höhe schriftlich (Textform) anmelden, Sicherheit zu leisten, soweit sie nicht Befriedigung verlangen können. Dieses Recht steht den Gläubigern jedoch nur zu, wenn sie glaubhaft machen, dass durch die Verschmelzung die Erfüllung ihrer Forderung gefährdet wird."
    },
    {
      "date": "2025-02-11",
      "id": "100959",
      "original_text": "Löschungsankündigung\nSchleswig-Holstein Amtsgericht Lübeck HRB 17601\nBSW-Büroservice Wreth GmbH – Lübeck",
      "type": "Löschungsankündigung",
      "state": "Schleswig-Holstein",
      "amtsgericht": "Amtsgericht Lübeck",
      "registernummer": "HRB 17601",
      "registerart": "HRB",
      "company_name": "BSW-Büroservice Wreth GmbH",
      "company_seat": "Lübeck",
      "details": "11.02.2025 (Bekanntmachungsdatum)\n\nSchleswig-Holstein Amtsgericht Lübeck HRB 17601\nLöschungsankündigung\n\nBSW-Büroservice Wreth GmbH\nGesellschaft mit beschränkter Haftung\nLübeck\n\nEs ist die Löschung der nachstehenden Gesellschaft wegen Vermögenslosigkeit gemäß § 394 FamFG beabsichtigt."
    },
    {
      "date": "2025-02-11",
      "id": "100960",
      "original_text": "Einreichung neuer Dokumente\nBaden-Württemberg Amtsgericht Freiburg HRB 2332\nCG Car-Garantie Versicherungs-Aktiengesellschaft – Freiburg im Breisgau",
      "type": "Einreichung neuer Dokumente",
      "state": "Baden-Württemberg",
      "amtsgericht": "Amtsgericht Freiburg",
      "registernummer": "HRB 2332",
      "registerart": "HRB",
      "company_name": "CG Car-Garantie Versicherungs-Aktiengesellschaft",
      "company_seat": "Freiburg im Breisgau",
      "details": "11.02.2025 (Bekanntmachungsdatum)\n\nBaden-Württemberg Amtsgericht Freiburg HRB 2332\nEinreichung neuer Dokumente\n\nCG Car-Garantie Versicherungs-Aktiengesellschaft\nAktiengesellschaft\nFreiburg im Breisgau\n\nDie Gesellschaft hat am 10.02.2025 die Liste über die Zusammensetzung des Aufsichtsrats zum Handelsregister eingereicht."
    },
    {
      "date": "2025-02-11",
      "id": "100961",
      "original_text": "Sonstige Registerbekanntmachung\nBrandenburg Amtsgericht Neuruppin HRB 907\nFWG- Fernwärmegesellschaft mit beschränkter Haftung Templin – Templin",
      "type": "Sonstige Registerbekanntmachung",
      "state": "Brandenburg",
      "amtsgericht": "Amtsgericht Neuruppin",
      "registernummer": "HRB 907",
      "registerart": "HRB",
      "company_name": "FWG- Fernwärmegesellschaft mit beschränkter Haftung Templin",
      "company_seat": "Templin",
      "details": "11.02.2025 (Bekanntmachungsdatum)\n\nBrandenburg Amtsgericht Neuruppin HRB 907\nSonstige Registerbekanntmachung\n\nFWG- Fernwärmegesellschaft mit beschränkter Haftung Templin\nGesellschaft mit beschränkter Haftung\nTemplin\n\nAls nicht eingetragen wird veröffentlicht: Eine Liste der Mitglieder des Aufsichtsrates wurde zum Handelsregister eingereicht."
    },
    {
      "date": "2025-02-11",
      "id": "100962",
      "original_text": "Löschungsankündigung\nBrandenburg Amtsgericht Potsdam HRB 28419\nAvanta Fahrdienst UG (haftungsbeschränkt) – Falkensee",
      "type": "Löschungsankündigung",
      "state": "Brandenburg",
      "amtsgericht": "Amtsgericht Potsdam",
      "registernummer": "HRB 28419",
      "registerart": "HRB",
      "company_name": "Avanta Fahrdienst UG (haftungsbeschränkt)",
      "company_seat": "Falkensee",
      "details": "11.02.2025 (Bekanntmachungsdatum)\n\nBrandenburg Amtsgericht Potsdam HRB 28419\nLöschungsankündigung\n\nAvanta Fahrdienst UG (haftungsbeschränkt)\nGesellschaft mit beschränkter Haftung\nFalkensee\n\nBei der nachstehenden Gesellschaft wird das Amtslöschungsverfahren gemäß § 394 FamFG eingeleitet."
    },
    {
      "date": "2025-02-11",
      "id": "100963",
      "original_text": "Löschungsankündigung\nBaden-Württemberg Amtsgericht Stuttgart HRB 761662\nSoEinHaus UG (haftungsbeschränkt) – Sulz am Neckar",
      "type": "Löschungsankündigung",
      "state": "Baden-Württemberg",
      "amtsgericht": "Amtsgericht Stuttgart",
      "registernummer": "HRB 761662",
      "registerart": "HRB",
      "company_name": "SoEinHaus UG (haftungsbeschränkt)",
      "company_seat": "Sulz am Neckar",
      "details": "11.02.2025 (Bekanntmachungsdatum)\n\nBaden-Württemberg Amtsgericht Stuttgart HRB 761662\nLöschungsankündigung\n\nSoEinHaus UG (haftungsbeschränkt)\nGesellschaft mit beschränkter Haftung\nSulz am Neckar\n\nAls nicht eingetragen wird bekanntgemacht:\nDas Gericht beabsichtigt, die Gesellschaft wegen Vermögenslosigkeit im Handelsregister von Amts wegen nach § 394 FamFG zu löschen. Die Frist zur Geltendmachung eines Widerspruchs gegen die beabsichtigte Löschung ist auf zwei Monate ab Veröffentlichung bestimmt."
    },
    {
      "date": "2025-02-11",
      "id": "100964",
      "original_text": "Sonstige Registerbekanntmachung\nMecklenburg-Vorpommern Amtsgericht Rostock HRB 6031\nOase Güstrow GmbH – Güstrow",
      "type": "Sonstige Registerbekanntmachung",
      "state": "Mecklenburg-Vorpommern",
      "amtsgericht": "Amtsgericht Rostock",
      "registernummer": "HRB 6031",
      "registerart": "HRB",
      "company_name": "Oase Güstrow GmbH",
      "company_seat": "Güstrow",
      "details": "11.02.2025 (Bekanntmachungsdatum)\n\nMecklenburg-Vorpommern Amtsgericht Rostock HRB 6031\nSonstige Registerbekanntmachung\n\nOase Güstrow GmbH\nGesellschaft mit beschränkter Haftung\nGüstrow\n\nEine Liste der Mitglieder des Aufsichtsrats ist zum Handelsregister eingereicht worden."
    },
    {
      "date": "2025-02-11",
      "id": "100965",
      "original_text": "Einreichung neuer Dokumente\nBaden-Württemberg Amtsgericht Stuttgart HRB 109233\nRheinmetall Automotive AG – Neckarsulm",
      "type": "Einreichung neuer Dokumente",
      "state": "Baden-Württemberg",
      "amtsgericht": "Amtsgericht Stuttgart",
      "registernummer": "HRB 109233",
      "registerart": "HRB",
      "company_name": "Rheinmetall Automotive AG",
      "company_seat": "Neckarsulm",
      "details": "11.02.2025 (Bekanntmachungsdatum)\n\nBaden-Württemberg Amtsgericht Stuttgart HRB 109233\nEinreichung neuer Dokumente 11.02.2025 (Eintragungsdatum)\n\nRheinmetall Automotive AG\nAktiengesellschaft\nNeckarsulm\n\nDie Gesellschaft hat am 10.02.2025 die Liste über die Zusammensetzung des Aufsichtsrats zum Handelsregister eingereicht."
    },
    {
      "date": "2025-02-11",
      "id": "100966",
      "original_text": "Registerbekanntmachung nach dem Umwandlungsgesetz\nBaden-Württemberg Amtsgericht Freiburg PR 700339\nPilz & Schweizer Steuerberater, Rechtsanwalt PartGmbB – Konstanz",
      "type": "Registerbekanntmachung nach dem Umwandlungsgesetz",
      "state": "Baden-Württemberg",
      "amtsgericht": "Amtsgericht Freiburg",
      "registernummer": "PR 700339",
      "registerart": "PR",
      "company_name": "Pilz & Schweizer Steuerberater, Rechtsanwalt PartGmbB",
      "company_seat": "Konstanz",
      "details": "11.02.2025 (Bekanntmachungsdatum)\n\nBaden-Württemberg Amtsgericht Freiburg PR 700339\nRegisterbekanntmachung nach dem Umwandlungsgesetz 11.02.2025 (Eintragungsdatum)\n\nPilz & Schweizer Steuerberater, Rechtsanwalt PartGmbB\nPartnerschaftsgesellschaft\nKonstanz\n\nAls nicht eingetragen wird bekanntgemacht:\nDen Gläubigern des an dem Formwechsel beteiligten Rechtsträgers ist, wenn sie binnen sechs Monaten nach dem Tag, an dem die Eintragung des Formwechsels in das Register des Sitzes desjenigen Rechtsträgers, dessen Gläubiger sie sind, nach § 19 Abs. 3 UmwG als bekanntgemacht gilt, ihren Anspruch nach Grund und Höhe schriftlich anmelden, Sicherheit zu leisten, soweit sie nicht Befriedigung verlangen können. Dieses Recht steht den Gläubigern jedoch nur zu, wenn sie glaubhaft machen, dass durch den Formwechsel die Erfüllung ihrer Forderung gefährdet wird."
    },
    {
      "date": "2025-02-11",
      "id": "100967",
      "original_text": "Sonstige Registerbekanntmachung\nBaden-Württemberg Amtsgericht Stuttgart HRB 230106\nWeinwelt GmbH – Owen",
      "type": "Sonstige Registerbekanntmachung",
      "state": "Baden-Württemberg",
      "amtsgericht": "Amtsgericht Stuttgart",
      "registernummer": "HRB 230106",
      "registerart": "HRB",
      "company_name": "Weinwelt GmbH",
      "company_seat": "Owen",
      "details": "11.02.2025 (Bekanntmachungsdatum)\n\nBaden-Württemberg Amtsgericht Stuttgart HRB 230106\nSonstige Registerbekanntmachung 11.02.2025 (Eintragungsdatum)\n\nWeinwelt GmbH\nGesellschaft mit beschränkter Haftung\nOwen\n\nAls nicht eingetragen wird bekanntgemacht:\nDen Gläubigern der Gesellschaft, deren Forderungen begründet worden sind, bevor die Eintragung der Beendigung des Vertrages in das Handelsregister nach § 10 HGB als bekanntgemacht gilt, ist vom anderen Vertragsteil Sicherheit zu leisten, wenn sie sich binnen sechs Monaten nach der Bekanntmachung zu diesem Zweck bei ihm melden."
    },
    {
      "date": "2025-02-11",
      "id": "100968",
      "original_text": "Löschungsankündigung\nBaden-Württemberg Amtsgericht Stuttgart HRB 262061\nAndrea Mack GmbH – Waiblingen",
      "type": "Löschungsankündigung",
      "state": "Baden-Württemberg",
      "amtsgericht": "Amtsgericht Stuttgart",
      "registernummer": "HRB 262061",
      "registerart": "HRB",
      "company_name": "Andrea Mack GmbH",
      "company_seat": "Waiblingen",
      "details": "11.02.2025 (Bekanntmachungsdatum)\n\nBaden-Württemberg Amtsgericht Stuttgart HRB 262061\nLöschungsankündigung\n\nAndrea Mack GmbH\nGesellschaft mit beschränkter Haftung\nWaiblingen\n\nAls nicht eingetragen wird bekanntgemacht:\nDas Gericht beabsichtigt, die Gesellschaft wegen Vermögenslosigkeit im Handelsregister von Amts wegen nach § 394 FamFG zu löschen. Die Frist zur Geltendmachung eines Widerspruchs gegen die beabsichtigte Löschung ist auf zwei Monate ab Veröffentlichung bestimmt."
    },
    {
      "date": "2025-02-11",
      "id": "100969",
      "original_text": "Löschungsankündigung\nBaden-Württemberg Amtsgericht Stuttgart HRB 746556\nF+P PLAN-CAD UG (haftungsbeschränkt) – Stuttgart",
      "type": "Löschungsankündigung",
      "state": "Baden-Württemberg",
      "amtsgericht": "Amtsgericht Stuttgart",
      "registernummer": "HRB 746556",
      "registerart": "HRB",
      "company_name": "F+P PLAN-CAD UG (haftungsbeschränkt)",
      "company_seat": "Stuttgart",
      "details": "11.02.2025 (Bekanntmachungsdatum)\n\nBaden-Württemberg Amtsgericht Stuttgart HRB 746556\nLöschungsankündigung\n\nF+P PLAN-CAD UG (haftungsbeschränkt)\nGesellschaft mit beschränkter Haftung\nStuttgart\n\nAls nicht eingetragen wird bekanntgemacht:\nDas Gericht beabsichtigt, die Gesellschaft wegen Vermögenslosigkeit im Handelsregister von Amts wegen nach § 394 FamFG zu löschen. Die Frist zur Geltendmachung eines Widerspruchs gegen die beabsichtigte Löschung ist auf zwei Monate ab Veröffentlichung bestimmt."
    },
    {
      "date": "2025-02-11",
      "id": "100970",
      "original_text": "Registerbekanntmachung nach dem Umwandlungsgesetz\nBaden-Württemberg Amtsgericht Freiburg HRA 708787\nGerd Kleinhans e.K. – Bad Dürrheim",
      "type": "Registerbekanntmachung nach dem Umwandlungsgesetz",
      "state": "Baden-Württemberg",
      "amtsgericht": "Amtsgericht Freiburg",
      "registernummer": "HRA 708787",
      "registerart": "HRA",
      "company_name": "Gerd Kleinhans e.K.",
      "company_seat": "Bad Dürrheim",
      "details": "11.02.2025 (Bekanntmachungsdatum)\n\nBaden-Württemberg Amtsgericht Freiburg HRA 708787\nRegisterbekanntmachung nach dem Umwandlungsgesetz 11.02.2025 (Eintragungsdatum)\n\nGerd Kleinhans e.K.\nEinzelkaufmann / Einzelkauffrau\nBad Dürrheim\n\nAls nicht eingetragen wird bekanntgemacht:\nDen Gläubigern der an der Ausgliederung beteiligten Rechtsträger ist, wenn sie binnen sechs Monaten nach dem Tag, an dem die Eintragung der Ausgliederung in das Register des Sitzes desjenigen Rechtsträgers, dessen Gläubiger sie sind, nach § 19 Abs. 3 UmwG als bekanntgemacht gilt, ihren Anspruch nach Grund und Höhe schriftlich anmelden, Sicherheit zu leisten, soweit sie nicht Befriedigung verlangen können. Dieses Recht steht den Gläubigern jedoch nur zu, wenn sie glaubhaft machen, dass durch die Ausgliederung die Erfüllung ihrer Forderung gefährdet wird."
    },
    {
      "date": "2025-02-11",
      "id": "100971",
      "original_text": "Registerbekanntmachung nach dem Umwandlungsgesetz\nBaden-Württemberg Amtsgericht Freiburg GsR 675\nKleinhans Group eGbR – Bad Dürrheim",
      "type": "Registerbekanntmachung nach dem Umwandlungsgesetz",
      "state": "Baden-Württemberg",
      "amtsgericht": "Amtsgericht Freiburg",
      "registernummer": "GsR 675",
      "registerart": "GsR",
      "company_name": "Kleinhans Group eGbR",
      "company_seat": "Bad Dürrheim",
      "details": "11.02.2025 (Bekanntmachungsdatum)\n\nBaden-Württemberg Amtsgericht Freiburg GsR 675\nRegisterbekanntmachung nach dem Umwandlungsgesetz 11.02.2025 (Eintragungsdatum)\n\nKleinhans Group eGbR\nGesellschaft bürgerlichen Rechts\nBad Dürrheim\n\nDen Gläubigern der an der Ausgliederung beteiligten Rechtsträger ist, wenn sie binnen sechs Monaten nach dem Tag, an dem die Eintragung der Ausgliederung in das Register des Sitzes desjenigen Rechtsträgers, dessen Gläubiger sie sind, nach § 19 Abs. 3 UmwG als bekanntgemacht gilt, ihren Anspruch nach Grund und Höhe schriftlich anmelden, Sicherheit zu leisten, soweit sie nicht Befriedigung verlangen können. Dieses Recht steht den Gläubigern jedoch nur zu, wenn sie glaubhaft machen, dass durch die Ausgliederung die Erfüllung ihrer Forderung gefährdet wird."
    },
    {
      "date": "2025-02-11",
      "id": "100972",
      "original_text": "Löschungsankündigung\nBerlin Amtsgericht Berlin (Charlottenburg) HRB 183791\nM.W. Gerüstbau S&Z UG (haftungsbeschränkt) – Berlin",
      "type": "Löschungsankündigung",
      "state": "Berlin",
      "amtsgericht": "Amtsgericht Berlin (Charlottenburg)",
      "registernummer": "HRB 183791",
      "registerart": "HRB",
      "company_name": "M.W. Gerüstbau S&Z UG (haftungsbeschränkt)",
      "company_seat": "Berlin",
      "details": "11.02.2025 (Bekanntmachungsdatum)\n\nBerlin Amtsgericht Berlin (Charlottenburg) HRB 183791\nLöschungsankündigung\n\nM.W. Gerüstbau S&Z UG (haftungsbeschränkt)\nGesellschaft mit beschränkter Haftung\nBerlin\n\nBei der nachstehenden Gesellschaft wird das Amtslöschungsverfahren gemäß § 394 FamFG eingeleitet. Widerspruchsfrist 6 Wochen"
    },
    {
      "date": "2025-02-11",
      "id": "100973",
      "original_text": "Einreichung neuer Dokumente\nSachsen-Anhalt Amtsgericht Stendal HRB 10914\nBayer Bitterfeld GmbH – Bitterfeld-Wolfen",
      "type": "Einreichung neuer Dokumente",
      "state": "Sachsen-Anhalt",
      "amtsgericht": "Amtsgericht Stendal",
      "registernummer": "HRB 10914",
      "registerart": "HRB",
      "company_name": "Bayer Bitterfeld GmbH",
      "company_seat": "Bitterfeld-Wolfen",
      "details": "11.02.2025 (Bekanntmachungsdatum)\n\nSachsen-Anhalt Amtsgericht Stendal HRB 10914\nEinreichung neuer Dokumente\n\nBayer Bitterfeld GmbH\nGesellschaft mit beschränkter Haftung\nBitterfeld-Wolfen\n\nEine Liste der Mitglieder des Aufsichtsrates wurde zum Handelsregister eingereicht."
    },
    {
      "date": "2025-02-11",
      "id": "100974",
      "original_text": "Registerbekanntmachung nach dem Umwandlungsgesetz\nHamburg Amtsgericht Hamburg HRB 151923\nGetyourdrive GmbH – Hamburg",
      "type": "Registerbekanntmachung nach dem Umwandlungsgesetz",
      "state": "Hamburg",
      "amtsgericht": "Amtsgericht Hamburg",
      "registernummer": "HRB 151923",
      "registerart": "HRB",
      "company_name": "Getyourdrive GmbH",
      "company_seat": "Hamburg",
      "details": "11.02.2025 (Bekanntmachungsdatum)\n\nHamburg Amtsgericht Hamburg HRB 151923\nRegisterbekanntmachung nach dem Umwandlungsgesetz 11.02.2025 (Eintragungsdatum)\n\nGetyourdrive GmbH\nGesellschaft mit beschränkter Haftung\nHamburg\n\nAls nicht eingetragen wird bekannt gemacht:\nDen Gläubigern der an der Verschmelzung beteiligten Gesellschaften ist, wenn sie binnen sechs Monaten nach dem Tag, an dem die Eintragung der Verschmelzung in das Register des Sitzes desjenigen Rechtsträgers, dessen Gläubiger sie sind, nach § 19 Absatz 3 UmwG als bekannt gemacht gilt, ihren Anspruch nach Grund und Höhe schriftlich anmelden, Sicherheit zu leisten, soweit sie nicht Befriedigung verlangen können. Dieses Recht steht den Gläubigern jedoch nur zu, wenn sie glaubhaft machen, dass durch die Verschmelzung die Erfüllung ihrer Forderung gefährdet wird."
    },
    {
      "date": "2025-02-11",
      "id": "100975",
      "original_text": "Löschungsankündigung\nBerlin Amtsgericht Berlin (Charlottenburg) HRB 201849\nPEAK Property and Facility Services GmbH – Berlin",
      "type": "Löschungsankündigung",
      "state": "Berlin",
      "amtsgericht": "Amtsgericht Berlin (Charlottenburg)",
      "registernummer": "HRB 201849",
      "registerart": "HRB",
      "company_name": "PEAK Property and Facility Services GmbH",
      "company_seat": "Berlin",
      "details": "11.02.2025 (Bekanntmachungsdatum)\n\nBerlin Amtsgericht Berlin (Charlottenburg) HRB 201849\nLöschungsankündigung\n\nPEAK Property and Facility Services GmbH\nGesellschaft mit beschränkter Haftung\nBerlin\n\nEs ist beabsichtigt, die Eintragung des Herr Celikkaya, Ilhan als Geschäftsführer im Handelsregister gemäß § 395 FamFG zu löschen. Widerspruchsfrist 2 Wochen"
    },
    {
      "date": "2025-02-11",
      "id": "100976",
      "original_text": "Löschungsankündigung\nBerlin Amtsgericht Berlin (Charlottenburg) HRB 256951\nMAS Projekte GmbH – Berlin",
      "type": "Löschungsankündigung",
      "state": "Berlin",
      "amtsgericht": "Amtsgericht Berlin (Charlottenburg)",
      "registernummer": "HRB 256951",
      "registerart": "HRB",
      "company_name": "MAS Projekte GmbH",
      "company_seat": "Berlin",
      "details": "11.02.2025 (Bekanntmachungsdatum)\n\nBerlin Amtsgericht Berlin (Charlottenburg) HRB 256951\nLöschungsankündigung\n\nMAS Projekte GmbH\nGesellschaft mit beschränkter Haftung\nBerlin\n\nBei der nachstehenden Gesellschaft wird das Amtslöschungsverfahren gemäß § 394 FamFG eingeleitet. Widerspruchsfrist 6 Wochen"
    },
    {
      "date": "2025-02-11",
      "id": "100977",
      "original_text": "Einreichung neuer Dokumente\nBerlin Amtsgericht Berlin (Charlottenburg) HRB 212635\nDigital Rocks GmbH – Berlin",
      "type": "Einreichung neuer Dokumente",
      "state": "Berlin",
      "amtsgericht": "Amtsgericht Berlin (Charlottenburg)",
      "registernummer": "HRB 212635",
      "registerart": "HRB",
      "company_name": "Digital Rocks GmbH",
      "company_seat": "Berlin",
      "details": "11.02.2025 (Bekanntmachungsdatum)\n\nBerlin Amtsgericht Berlin (Charlottenburg) HRB 212635\nEinreichung neuer Dokumente\n\nDigital Rocks GmbH\nGesellschaft mit beschränkter Haftung\nBerlin\n\nAls nicht eingetragen wird veröffentlicht:  Es wurde eine neue Liste der Aufsichtsratsmitglieder eingereicht (§52 GmbHG)."
    },
    {
      "date": "2025-02-11",
      "id": "100978",
      "original_text": "Einreichung neuer Dokumente\nHamburg Amtsgericht Hamburg HRB 149532\nAsklepios Kliniken GmbH & Co. KGaA – Hamburg",
      "type": "Einreichung neuer Dokumente",
      "state": "Hamburg",
      "amtsgericht": "Amtsgericht Hamburg",
      "registernummer": "HRB 149532",
      "registerart": "HRB",
      "company_name": "Asklepios Kliniken GmbH & Co. KGaA",
      "company_seat": "Hamburg",
      "details": "11.02.2025 (Bekanntmachungsdatum)\n\nHamburg Amtsgericht Hamburg HRB 149532\nEinreichung neuer Dokumente\n\nAsklepios Kliniken GmbH & Co. KGaA\nKommanditgesellschaft auf Aktien\nHamburg\n\nAls nicht eingetragen wird bekannt gemacht: Liste des Aufsichtsrats wurde eingereicht."
    },
    {
      "date": "2025-02-11",
      "id": "100979",
      "original_text": "Registerbekanntmachung nach dem Umwandlungsgesetz\nBerlin Amtsgericht Berlin (Charlottenburg) HRB 193946\nEdgeCase Technology GmbH – Berlin",
      "type": "Registerbekanntmachung nach dem Umwandlungsgesetz",
      "state": "Berlin",
      "amtsgericht": "Amtsgericht Berlin (Charlottenburg)",
      "registernummer": "HRB 193946",
      "registerart": "HRB",
      "company_name": "EdgeCase Technology GmbH",
      "company_seat": "Berlin",
      "details": "11.02.2025 (Bekanntmachungsdatum)\n\nBerlin Amtsgericht Berlin (Charlottenburg) HRB 193946\nRegisterbekanntmachung nach dem Umwandlungsgesetz 10.02.2025 (Eintragungsdatum)\n\nEdgeCase Technology GmbH\nGesellschaft mit beschränkter Haftung\nBerlin\n\nZu Eintragungsnummer 5 vom 10.02.2025 wird als nicht eingetragen veröffentlicht: Den Gläubigern der an der Verschmelzung beteiligten Rechtsträger ist, wenn sie binnen sechs Monaten nach dem Tag, an dem die Eintragung der Verschmelzung in das Register des Sitzes desjenigen Rechtsträgers, dessen Gläubiger sie sind, als bekannt gemacht gilt, ihren Anspruch nach Grund und Höhe schriftlich anmelden, Sicherheit zu leisten, soweit sie nicht Befriedigung verlangen können. Dieses Recht steht den Gläubigern jedoch nur zu, wenn sie glaubhaft machen, dass durch die Verschmelzung die Erfüllung ihrer Forderung gefährdet wird. Das Recht, Sicherheitsleistung zu verlangen, steht Gläubigern nicht zu, die im Falle der Insolvenz ein Recht auf vorzugsweise Befriedigung aus einer Deckungsmasse haben, die nach gesetzlicher Vorschrift zu ihrem Schutz errichtet und staatlich überwacht ist."
    },
    {
      "date": "2025-02-11",
      "id": "100980",
      "original_text": "Registerbekanntmachung nach dem Umwandlungsgesetz\nBerlin Amtsgericht Berlin (Charlottenburg) HRB 202334\nF1 Vermögensverwaltung UG (haftungsbeschränkt) – Berlin",
      "type": "Registerbekanntmachung nach dem Umwandlungsgesetz",
      "state": "Berlin",
      "amtsgericht": "Amtsgericht Berlin (Charlottenburg)",
      "registernummer": "HRB 202334",
      "registerart": "HRB",
      "company_name": "F1 Vermögensverwaltung UG (haftungsbeschränkt)",
      "company_seat": "Berlin",
      "details": "11.02.2025 (Bekanntmachungsdatum)\n\nBerlin Amtsgericht Berlin (Charlottenburg) HRB 202334\nRegisterbekanntmachung nach dem Umwandlungsgesetz 10.02.2025 (Eintragungsdatum)\n\nF1 Vermögensverwaltung UG (haftungsbeschränkt)\nGesellschaft mit beschränkter Haftung\nBerlin\n\nZu Eintragungsnummer 5 vom 10.02.2025 wird als nicht eingetragen veröffentlicht: Den Gläubigern der an der Verschmelzung beteiligten Rechtsträger ist, wenn sie binnen sechs Monaten nach dem Tag, an dem die Eintragung der Verschmelzung in das Register des Sitzes desjenigen Rechtsträgers, dessen Gläubiger sie sind, als bekannt gemacht gilt, ihren Anspruch nach Grund und Höhe schriftlich anmelden, Sicherheit zu leisten, soweit sie nicht Befriedigung verlangen können. Dieses Recht steht den Gläubigern jedoch nur zu, wenn sie glaubhaft machen, dass durch die Verschmelzung die Erfüllung ihrer Forderung gefährdet wird. Das Recht, Sicherheitsleistung zu verlangen, steht Gläubigern nicht zu, die im Falle der Insolvenz ein Recht auf vorzugsweise Befriedigung aus einer Deckungsmasse haben, die nach gesetzlicher Vorschrift zu ihrem Schutz errichtet und staatlich überwacht ist."
    },
    {
      "date": "2025-02-11",
      "id": "100981",
      "original_text": "Registerbekanntmachung nach dem Umwandlungsgesetz\nBerlin Amtsgericht Berlin (Charlottenburg) HRB 33028\npluss Personalmanagement Berlin GmbH – Berlin",
      "type": "Registerbekanntmachung nach dem Umwandlungsgesetz",
      "state": "Berlin",
      "amtsgericht": "Amtsgericht Berlin (Charlottenburg)",
      "registernummer": "HRB 33028",
      "registerart": "HRB",
      "company_name": "pluss Personalmanagement Berlin GmbH",
      "company_seat": "Berlin",
      "details": "11.02.2025 (Bekanntmachungsdatum)\n\nBerlin Amtsgericht Berlin (Charlottenburg) HRB 33028\nRegisterbekanntmachung nach dem Umwandlungsgesetz 10.02.2025 (Eintragungsdatum)\n\npluss Personalmanagement Berlin GmbH\nGesellschaft mit beschränkter Haftung\nBerlin\n\nZu Eintragungsnummer 17 vom 10.02.2025 wird als nicht eingetragen veröffentlicht:Den Gläubigern der an der Verschmelzung beteiligten Rechtsträger ist, wenn sie binnen sechs Monaten nach dem Tag, an dem die Eintragung der Verschmelzung in das Register des Sitzes desjenigen Rechtsträgers, dessen Gläubiger sie sind, als bekannt gemacht gilt, ihren Anspruch nach Grund und Höhe schriftlich anmelden, Sicherheit zu leisten, soweit sie nicht Befriedigung verlangen können. Dieses Recht steht den Gläubigern jedoch nur zu, wenn sie glaubhaft machen, dass durch die Verschmelzung die Erfüllung ihrer Forderung gefährdet wird. Das Recht, Sicherheitsleistung zu verlangen, steht Gläubigern nicht zu, die im Falle der Insolvenz ein Recht auf vorzugsweise Befriedigung aus einer Deckungsmasse haben, die nach gesetzlicher Vorschrift zu ihrem Schutz errichtet und staatlich überwacht ist."
    },
    {
      "date": "2025-02-11",
      "id": "100982",
      "original_text": "Registerbekanntmachung nach dem Umwandlungsgesetz\nBerlin Amtsgericht Berlin (Charlottenburg) HRB 179914\nGreenlemon Cosmos Property GmbH – Berlin",
      "type": "Registerbekanntmachung nach dem Umwandlungsgesetz",
      "state": "Berlin",
      "amtsgericht": "Amtsgericht Berlin (Charlottenburg)",
      "registernummer": "HRB 179914",
      "registerart": "HRB",
      "company_name": "Greenlemon Cosmos Property GmbH",
      "company_seat": "Berlin",
      "details": "11.02.2025 (Bekanntmachungsdatum)\n\nBerlin Amtsgericht Berlin (Charlottenburg) HRB 179914\nRegisterbekanntmachung nach dem Umwandlungsgesetz\n\nGreenlemon Cosmos Property GmbH\nGesellschaft mit beschränkter Haftung\nBerlin\n\nAls nicht eingetragen wird veröffentlicht:\n\nDie Gesellschaft hat einen unter dem 06. Februar 2025 beurkundeten Formwechselplan betreffend einen grenzüberschreitenden Formwechsel der Gesellschaft nach Luxemburg bei dem Registergericht eingereicht und die folgenden offenzulegenden Angaben gemacht:\n\nIm Hinblick auf den Inhalt der Bekanntmachung sowie §§ 336, 308 Abs. 1 S. 2 Nr. 1-4 UmwG werden folgende Angaben gemacht:\nFormwechselplan\nDer notariell beurkundete Formwechselplan wurde elektronisch zum Handelsregister eingereicht.\n\nRechtsform, Firma und Sitz der formwechselnden Gesellschaft\nDie Gesellschaft ist eine deutsche Gesellschaft mit beschränkter Haftung unter der Firma Greenlemon Cosmos Property GmbH, errichtet und bestehend nach deutschem Recht, mit Sitz in Berlin, Deutschland, eingetragen im Handelsregister des Amtsgerichts Charlottenburg unter HRB 179914 B.\nDie Gesellschaft soll durch grenzüberschreitenden, identitätswahrenden Formwechsel aufgrund eines Formwechselbeschlusses unter gleichzeitiger Verlegung des Satzungssitzes in eine Gesellschaft mit beschränkter Haftung nach dem Recht des Großherzogtums Luxemburg (société à responsabilité limitée) mit Sitz in Luxemburg, Großherzogtum Luxemburg, umgewandelt werden. Die Gesellschaft wird die Firma Greenlemon Cosmos Property S.à.r.l. führen.\n\nRegister der formwechselnden Gesellschaft\nDie an dem grenzüberschreitenden Formwechsel beteiligte Gesellschaft ist unter HRB 179914 B im Handelsregister des Amtsgerichts Charlottenburg eingetragen.\n\nHinweis an die Anteilsinhaber und Gläubiger\nDem Gesellschafter und den Gläubigern der Gesellschaft wird mitgeteilt, dass sie der Gesellschaft spätestens fünf Tage vor dem Tag der Gesellschafterversammlung Bemerkungen zu dem beim Handelsregister eingereichten Formwechselplan übermitteln können.\n\nHinweis an die zuständigen Betriebsräte und Arbeitnehmer der Gesellschaft\nDie Gesellschaft hat keine Arbeitnehmer und verfügt über keinen Betriebsrat oder eine sonstige Arbeitnehmervertretung.\n\nGläubiger der Gesellschaft\nDie Rechte der Gläubiger der formwechselnden Gesellschaft ergeben sich aus §§ 341, 314 UmwG. Danach ist den Gläubigern der formwechselnden Gesellschaft Sicherheit zu leisten, soweit sie nicht Befriedigung verlangen können, wenn die neue Rechtsform nicht dem deutschen Recht unterliegt. Dieses Recht steht den Gläubigern jedoch nur zu, wenn sie binnen drei Monaten nach dem Tag, an dem der Formwechselplan (oder sein Entwurf) bekannt gemacht worden ist, ihre Ansprüche gerichtlich geltend machen. Dieses Recht auf Sicherheitsleistung steht Gläubigern nur im Hinblick auf solche Forderungen zu, die vor der Bekanntmachung des Formwechselplans oder seines Entwurfs entstanden, aber im Zeitpunkt der Bekanntmachung noch nicht fällig geworden sind, und deren Erfüllung durch den Formwechsel gefährdet wird."
    },
    {
      "date": "2025-02-11",
      "id": "100983",
      "original_text": "Einreichung neuer Dokumente\nSaarland Amtsgericht Saarbrücken HRB 2964\nStadtwerke Homburg GmbH – Homburg",
      "type": "Einreichung neuer Dokumente",
      "state": "Saarland",
      "amtsgericht": "Amtsgericht Saarbrücken",
      "registernummer": "HRB 2964",
      "registerart": "HRB",
      "company_name": "Stadtwerke Homburg GmbH",
      "company_seat": "Homburg",
      "details": "11.02.2025 (Bekanntmachungsdatum)\n\nSaarland Amtsgericht Saarbrücken HRB 2964\nEinreichung neuer Dokumente\n\nStadtwerke Homburg GmbH\nGesellschaft mit beschränkter Haftung\nHomburg\n\nDie Geschäftsführung der Gesellschaft hat eine Liste der Mitglieder des Aufsichtsrats zum Handelsregister eingereicht (§ 52 Abs. 3 Satz 2 GmbHG)."
    },
    {
      "date": "2025-02-11",
      "id": "100984",
      "original_text": "Registerbekanntmachung nach dem Umwandlungsgesetz\nBaden-Württemberg Amtsgericht Stuttgart HRB 778470\nPrimex Service UG (haftungsbeschränkt) – Stuttgart",
      "type": "Registerbekanntmachung nach dem Umwandlungsgesetz",
      "state": "Baden-Württemberg",
      "amtsgericht": "Amtsgericht Stuttgart",
      "registernummer": "HRB 778470",
      "registerart": "HRB",
      "company_name": "Primex Service UG (haftungsbeschränkt)",
      "company_seat": "Stuttgart",
      "details": "11.02.2025 (Bekanntmachungsdatum)\n\nBaden-Württemberg Amtsgericht Stuttgart HRB 778470\nRegisterbekanntmachung nach dem Umwandlungsgesetz 11.02.2025 (Eintragungsdatum)\n\nPrimex Service UG (haftungsbeschränkt)\nGesellschaft mit beschränkter Haftung\nStuttgart\n\nDen Gläubigern der an der Verschmelzung beteiligten Rechtsträger ist, wenn sie binnen sechs Monaten nach dem Tag, an dem die Eintragung der Verschmelzung in das Register des Sitzes desjenigen Rechtsträgers, dessen Gläubiger sie sind, nach § 19 Abs. 3 UmwG als bekanntgemacht gilt, ihren Anspruch nach Grund und Höhe schriftlich anmelden, Sicherheit zu leisten, soweit sie nicht Befriedigung verlangen können. Dieses Recht steht den Gläubigern jedoch nur zu, wenn sie glaubhaft machen, dass durch die Verschmelzung die Erfüllung ihrer Forderung gefährdet wird."
    },
    {
      "date": "2025-02-11",
      "id": "100985",
      "original_text": "Sonstige Registerbekanntmachung\nThüringen Amtsgericht Jena HRB 401122\nBerufsbildungszentrum Nordhausen gemeinnützige Gesellschaft mit beschränkter Haftung – Nordhausen",
      "type": "Sonstige Registerbekanntmachung",
      "state": "Thüringen",
      "amtsgericht": "Amtsgericht Jena",
      "registernummer": "HRB 401122",
      "registerart": "HRB",
      "company_name": "Berufsbildungszentrum Nordhausen gemeinnützige Gesellschaft mit beschränkter Haftung",
      "company_seat": "Nordhausen",
      "details": "11.02.2025 (Bekanntmachungsdatum)\n\nThüringen Amtsgericht Jena HRB 401122\nSonstige Registerbekanntmachung\n\nBerufsbildungszentrum Nordhausen gemeinnützige Gesellschaft mit beschränkter Haftung\nGesellschaft mit beschränkter Haftung\nNordhausen\n\nBekanntmachung gem. § 52 Abs. 3 Satz 2 GmbHG: Aufgrund einer Veränderung in den Personen der Aufsichtsratsmitglieder ist durch die Geschäftsführer eine neue Liste zum Handelsregister eingereicht worden."
    },
    {
      "date": "2025-02-11",
      "id": "100986",
      "original_text": "Löschungsankündigung\nThüringen Amtsgericht Jena HRB 506863\nPBG UG (haftungsbeschränkt) – Zöllnitz",
      "type": "Löschungsankündigung",
      "state": "Thüringen",
      "amtsgericht": "Amtsgericht Jena",
      "registernummer": "HRB 506863",
      "registerart": "HRB",
      "company_name": "PBG UG (haftungsbeschränkt)",
      "company_seat": "Zöllnitz",
      "details": "11.02.2025 (Bekanntmachungsdatum)\n\nThüringen Amtsgericht Jena HRB 506863\nLöschungsankündigung\n\nPBG UG (haftungsbeschränkt)\nGesellschaft mit beschränkter Haftung\nZöllnitz\n\nDas Registergericht beabsichtigt, die im Handelsregister eingetragene Gesellschaft wegen Vermögenslosigkeit nach § 394 FamFG von Amts wegen zu löschen. Die Frist zur Erhebung eines Widerspruchs gegen die beabsichtigte Löschung wird auf 6 Wochen festgesetzt."
    },
    {
      "date": "2025-02-11",
      "id": "100987",
      "original_text": "Löschungsankündigung\nBerlin Amtsgericht Berlin (Charlottenburg) HRB 108812\nUnternehmensgruppe Treuhand Berlin/Brandenburg GmbH – Berlin",
      "type": "Löschungsankündigung",
      "state": "Berlin",
      "amtsgericht": "Amtsgericht Berlin (Charlottenburg)",
      "registernummer": "HRB 108812",
      "registerart": "HRB",
      "company_name": "Unternehmensgruppe Treuhand Berlin/Brandenburg GmbH",
      "company_seat": "Berlin",
      "details": "11.02.2025 (Bekanntmachungsdatum)\n\nBerlin Amtsgericht Berlin (Charlottenburg) HRB 108812\nLöschungsankündigung\n\nUnternehmensgruppe Treuhand Berlin/Brandenburg GmbH\nGesellschaft mit beschränkter Haftung\nBerlin\n\nBei der nachstehenden Gesellschaft wird das Amtslöschungsverfahren gemäß § 394 FamFG eingeleitet. Widerspruchsfrist 6 Wochen"
    },
    {
      "date": "2025-02-11",
      "id": "100988",
      "original_text": "Löschungsankündigung\nBerlin Amtsgericht Berlin (Charlottenburg) HRB 181414\nVIGO Kombucha UG (haftungsbeschränkt) – Berlin",
      "type": "Löschungsankündigung",
      "state": "Berlin",
      "amtsgericht": "Amtsgericht Berlin (Charlottenburg)",
      "registernummer": "HRB 181414",
      "registerart": "HRB",
      "company_name": "VIGO Kombucha UG (haftungsbeschränkt)",
      "company_seat": "Berlin",
      "details": "11.02.2025 (Bekanntmachungsdatum)\n\nBerlin Amtsgericht Berlin (Charlottenburg) HRB 181414\nLöschungsankündigung\n\nVIGO Kombucha UG (haftungsbeschränkt)\nGesellschaft mit beschränkter Haftung\nBerlin\n\nBei der nachstehenden Gesellschaft wird das Amtslöschungsverfahren gemäß § 394 FamFG eingeleitet. Widerspruchsfrist 6 Wochen"
    },
    {
      "date": "2025-02-11",
      "id": "100989",
      "original_text": "Löschungsankündigung\nBaden-Württemberg Amtsgericht Stuttgart HRB 783872\nWohnbau Ditzingen UG (haftungsbeschränkt) – Ditzingen",
      "type": "Löschungsankündigung",
      "state": "Baden-Württemberg",
      "amtsgericht": "Amtsgericht Stuttgart",
      "registernummer": "HRB 783872",
      "registerart": "HRB",
      "company_name": "Wohnbau Ditzingen UG (haftungsbeschränkt)",
      "company_seat": "Ditzingen",
      "details": "11.02.2025 (Bekanntmachungsdatum)\n\nBaden-Württemberg Amtsgericht Stuttgart HRB 783872\nLöschungsankündigung\n\nWohnbau Ditzingen UG (haftungsbeschränkt)\nGesellschaft mit beschränkter Haftung\nDitzingen\n\nDas Gericht beabsichtigt, die Gesellschaft wegen Vermögenslosigkeit im Handelsregister von Amts wegen nach § 394 FamFG zu löschen. Die Frist zur Geltendmachung eines Widerspruchs gegen die beabsichtigte Löschung ist auf zwei Monate ab Veröffentlichung bestimmt"
    },
    {
      "date": "2025-02-11",
      "id": "100990",
      "original_text": "Registerbekanntmachung nach dem Umwandlungsgesetz\nBerlin Amtsgericht Berlin (Charlottenburg) HRB 209447\nSodaSmart GmbH – Berlin",
      "type": "Registerbekanntmachung nach dem Umwandlungsgesetz",
      "state": "Berlin",
      "amtsgericht": "Amtsgericht Berlin (Charlottenburg)",
      "registernummer": "HRB 209447",
      "registerart": "HRB",
      "company_name": "SodaSmart GmbH",
      "company_seat": "Berlin",
      "details": "11.02.2025 (Bekanntmachungsdatum)\n\nBerlin Amtsgericht Berlin (Charlottenburg) HRB 209447\nRegisterbekanntmachung nach dem Umwandlungsgesetz 10.02.2025 (Eintragungsdatum)\n\nSodaSmart GmbH\nGesellschaft mit beschränkter Haftung\nBerlin\n\nZu Eintragungsnummer 4 vom 10.02.2025 wird als nicht eingetragen veröffentlicht:Den Gläubigern der an der Verschmelzung beteiligten Rechtsträger ist, wenn sie binnen sechs Monaten nach dem Tag, an dem die Eintragung der Verschmelzung in das Register des Sitzes desjenigen Rechtsträgers, dessen Gläubiger sie sind, als bekannt gemacht gilt, ihren Anspruch nach Grund und Höhe schriftlich anmelden, Sicherheit zu leisten, soweit sie nicht Befriedigung verlangen können. Dieses Recht steht den Gläubigern jedoch nur zu, wenn sie glaubhaft machen, dass durch die Verschmelzung die Erfüllung ihrer Forderung gefährdet wird. Das Recht, Sicherheitsleistung zu verlangen, steht Gläubigern nicht zu, die im Falle der Insolvenz ein Recht auf vorzugsweise Befriedigung aus einer Deckungsmasse haben, die nach gesetzlicher Vorschrift zu ihrem Schutz errichtet und staatlich überwacht ist."
    },
    {
      "date": "2025-02-11",
      "id": "100991",
      "original_text": "Registerbekanntmachung nach dem Umwandlungsgesetz\nBerlin Amtsgericht Berlin (Charlottenburg) HRB 227167\n10X Ventures GmbH – Berlin",
      "type": "Registerbekanntmachung nach dem Umwandlungsgesetz",
      "state": "Berlin",
      "amtsgericht": "Amtsgericht Berlin (Charlottenburg)",
      "registernummer": "HRB 227167",
      "registerart": "HRB",
      "company_name": "10X Ventures GmbH",
      "company_seat": "Berlin",
      "details": "11.02.2025 (Bekanntmachungsdatum)\n\nBerlin Amtsgericht Berlin (Charlottenburg) HRB 227167\nRegisterbekanntmachung nach dem Umwandlungsgesetz 10.02.2025 (Eintragungsdatum)\n\n10X Ventures GmbH\nGesellschaft mit beschränkter Haftung\nBerlin\n\nZu Eintragungsnummer 4 vom 10.02.2025 wird als nicht eingetragen veröffentlicht:Den Gläubigern der an der Verschmelzung beteiligten Rechtsträger ist, wenn sie binnen sechs Monaten nach dem Tag, an dem die Eintragung der Verschmelzung in das Register des Sitzes desjenigen Rechtsträgers, dessen Gläubiger sie sind, als bekannt gemacht gilt, ihren Anspruch nach Grund und Höhe schriftlich anmelden, Sicherheit zu leisten, soweit sie nicht Befriedigung verlangen können. Dieses Recht steht den Gläubigern jedoch nur zu, wenn sie glaubhaft machen, dass durch die Verschmelzung die Erfüllung ihrer Forderung gefährdet wird. Das Recht, Sicherheitsleistung zu verlangen, steht Gläubigern nicht zu, die im Falle der Insolvenz ein Recht auf vorzugsweise Befriedigung aus einer Deckungsmasse haben, die nach gesetzlicher Vorschrift zu ihrem Schutz errichtet und staatlich überwacht ist."
    },
    {
      "date": "2025-02-11",
      "id": "100992",
      "original_text": "Einreichung neuer Dokumente\nBaden-Württemberg Amtsgericht Stuttgart HRB 762873\nMercedes-Benz AG – Stuttgart",
      "type": "Einreichung neuer Dokumente",
      "state": "Baden-Württemberg",
      "amtsgericht": "Amtsgericht Stuttgart",
      "registernummer": "HRB 762873",
      "registerart": "HRB",
      "company_name": "Mercedes-Benz AG",
      "company_seat": "Stuttgart",
      "details": "11.02.2025 (Bekanntmachungsdatum)\n\nBaden-Württemberg Amtsgericht Stuttgart HRB 762873\nEinreichung neuer Dokumente\n\nMercedes-Benz AG\nAktiengesellschaft\nStuttgart\n\nDie Gesellschaft hat am 11.02.2025  die Liste über die Zusammensetzung des Aufsichtsrats zum Handelsregister eingereicht."
    },
    {
      "date": "2025-02-11",
      "id": "100993",
      "original_text": "Löschungsankündigung\nBaden-Württemberg Amtsgericht Mannheim HRB 731500\nErnst Eisele UG (haftungsbeschränkt) – Mühlacker",
      "type": "Löschungsankündigung",
      "state": "Baden-Württemberg",
      "amtsgericht": "Amtsgericht Mannheim",
      "registernummer": "HRB 731500",
      "registerart": "HRB",
      "company_name": "Ernst Eisele UG (haftungsbeschränkt)",
      "company_seat": "Mühlacker",
      "details": "11.02.2025 (Bekanntmachungsdatum)\n\nBaden-Württemberg Amtsgericht Mannheim HRB 731500\nLöschungsankündigung\n\nErnst Eisele UG (haftungsbeschränkt)\nGesellschaft mit beschränkter Haftung\nMühlacker\n\nDas Gericht beabsichtigt, die Gesellschaft wegen Vermögenslosigkeit im Handelsregister von Amts wegen nach § 394 FamFG zu löschen. Die Frist zur Geltendmachung eines Widerspruchs gegen die beabsichtigte Löschung ist auf einen Monat ab Veröffentlichung bestimmt."
    },
    {
      "date": "2025-02-11",
      "id": "100994",
      "original_text": "Löschungsankündigung\nBerlin Amtsgericht Berlin (Charlottenburg) HRB 118854\nZ E P Aktiengesellschaft – Berlin",
      "type": "Löschungsankündigung",
      "state": "Berlin",
      "amtsgericht": "Amtsgericht Berlin (Charlottenburg)",
      "registernummer": "HRB 118854",
      "registerart": "HRB",
      "company_name": "Z E P Aktiengesellschaft",
      "company_seat": "Berlin",
      "details": "11.02.2025 (Bekanntmachungsdatum)\n\nBerlin Amtsgericht Berlin (Charlottenburg) HRB 118854\nLöschungsankündigung\n\nZ E P Aktiengesellschaft\nAktiengesellschaft\nBerlin\n\nBei der nachstehenden Gesellschaft wird das Amtslöschungsverfahren gemäß § 394 FamFG eingeleitet. Widerspruchsfrist 8 Wochen"
    },
    {
      "date": "2025-02-11",
      "id": "100995",
      "original_text": "Löschungsankündigung\nSchleswig-Holstein Amtsgericht Flensburg HRB 6507\nSvend E. Sørensen Sjølund GmbH – Handewitt",
      "type": "Löschungsankündigung",
      "state": "Schleswig-Holstein",
      "amtsgericht": "Amtsgericht Flensburg",
      "registernummer": "HRB 6507",
      "registerart": "HRB",
      "company_name": "Svend E. Sørensen Sjølund GmbH",
      "company_seat": "Handewitt",
      "details": "11.02.2025 (Bekanntmachungsdatum)\n\nSchleswig-Holstein Amtsgericht Flensburg HRB 6507\nLöschungsankündigung\n\nSvend E. Sørensen Sjølund GmbH\nGesellschaft mit beschränkter Haftung\nHandewitt\n\nEs ist die Löschung der nachstehenden Gesellschaft wegen Vermögenslosigkeit gemäß § 394 FamFG beabsichtigt.\nWiderspruchsfrist: 2 Monate."
    },
    {
      "date": "2025-02-11",
      "id": "100996",
      "original_text": "Löschungsankündigung\nSchleswig-Holstein Amtsgericht Pinneberg HRB 15107\nTWS-Montagen UG (haftungsbeschränkt) – Willenscharen",
      "type": "Löschungsankündigung",
      "state": "Schleswig-Holstein",
      "amtsgericht": "Amtsgericht Pinneberg",
      "registernummer": "HRB 15107",
      "registerart": "HRB",
      "company_name": "TWS-Montagen UG (haftungsbeschränkt)",
      "company_seat": "Willenscharen",
      "details": "11.02.2025 (Bekanntmachungsdatum)\n\nSchleswig-Holstein Amtsgericht Pinneberg HRB 15107\nLöschungsankündigung\n\nTWS-Montagen UG (haftungsbeschränkt)\nGesellschaft mit beschränkter Haftung\nWillenscharen\n\nEs ist die Löschung der nachstehenden Gesellschaft wegen Vermögenslosigkeit gemäß § 394 FamFG beabsichtigt. Widerspruchsfrist: 2 Monate."
    },
    {
      "date": "2025-02-11",
      "id": "100997",
      "original_text": "Löschungsankündigung\nBrandenburg Amtsgericht Frankfurt/Oder HRB 18568\nSFNP GmbH – Frankfurt (Oder)",
      "type": "Löschungsankündigung",
      "state": "Brandenburg",
      "amtsgericht": "Amtsgericht Frankfurt/Oder",
      "registernummer": "HRB 18568",
      "registerart": "HRB",
      "company_name": "SFNP GmbH",
      "company_seat": "Frankfurt (Oder)",
      "details": "11.02.2025 (Bekanntmachungsdatum)\n\nBrandenburg Amtsgericht Frankfurt/Oder HRB 18568\nLöschungsankündigung\n\nSFNP GmbH\nGesellschaft mit beschränkter Haftung\nFrankfurt (Oder)\n\nBei der nachstehenden Gesellschaft wird das Amtslöschungsverfahren gemäß § 394 FamFG eingeleitet."
    },
    {
      "date": "2025-02-11",
      "id": "100998",
      "original_text": "Einreichung neuer Dokumente\nBaden-Württemberg Amtsgericht Stuttgart HRB 757896\nBizerba Management SE – Balingen",
      "type": "Einreichung neuer Dokumente",
      "state": "Baden-Württemberg",
      "amtsgericht": "Amtsgericht Stuttgart",
      "registernummer": "HRB 757896",
      "registerart": "HRB",
      "company_name": "Bizerba Management SE",
      "company_seat": "Balingen",
      "details": "11.02.2025 (Bekanntmachungsdatum)\n\nBaden-Württemberg Amtsgericht Stuttgart HRB 757896\nEinreichung neuer Dokumente\n\nBizerba Management SE\nEuropäische Aktiengesellschaft (SE)\nBalingen\n\nDie Gesellschaft hat am 03.02.2025 die Liste über die Zusammensetzung des Aufsichtsrats zum Handelsregister eingereicht."
    },
    {
      "date": "2025-02-11",
      "id": "100999",
      "original_text": "Löschungsankündigung\nBerlin Amtsgericht Berlin (Charlottenburg) HRB 166424\nJoppSports1 UG (haftungsbeschränkt) – Berlin",
      "type": "Löschungsankündigung",
      "state": "Berlin",
      "amtsgericht": "Amtsgericht Berlin (Charlottenburg)",
      "registernummer": "HRB 166424",
      "registerart": "HRB",
      "company_name": "JoppSports1 UG (haftungsbeschränkt)",
      "company_seat": "Berlin",
      "details": "11.02.2025 (Bekanntmachungsdatum)\n\nBerlin Amtsgericht Berlin (Charlottenburg) HRB 166424\nLöschungsankündigung\n\nJoppSports1 UG (haftungsbeschränkt)\nGesellschaft mit beschränkter Haftung\nBerlin\n\nBei der nachstehenden Gesellschaft wird das Amtslöschungsverfahren gemäß § 394 FamFG eingeleitet. Widerspruchsfrist: 6 Wochen."
    },
    {
      "date": "2025-02-11",
      "id": "101000",
      "original_text": "Registerbekanntmachung nach dem Umwandlungsgesetz\nBaden-Württemberg Amtsgericht Mannheim HRB 361886\nentegra eyrich + appel gmbh – Ettlingen",
      "type": "Registerbekanntmachung nach dem Umwandlungsgesetz",
      "state": "Baden-Württemberg",
      "amtsgericht": "Amtsgericht Mannheim",
      "registernummer": "HRB 361886",
      "registerart": "HRB",
      "company_name": "entegra eyrich + appel gmbh",
      "company_seat": "Ettlingen",
      "details": "11.02.2025 (Bekanntmachungsdatum)\n\nBaden-Württemberg Amtsgericht Mannheim HRB 361886\nRegisterbekanntmachung nach dem Umwandlungsgesetz 11.02.2025 (Eintragungsdatum)\n\nentegra eyrich + appel gmbh\nGesellschaft mit beschränkter Haftung\nEttlingen\n\nAls nicht eingetragen wird bekanntgemacht: Den Gläubigern des an dem Formwechsel beteiligten Rechtsträgers ist, wenn sie binnen sechs Monaten nach dem Tag, an dem die Eintragung des Formwechsels in das Register des Sitzes desjenigen Rechtsträgers, dessen Gläubiger sie sind, nach § 19 Abs. 3 UmwG als bekanntgemacht gilt, ihren Anspruch nach Grund und Höhe schriftlich anmelden, Sicherheit zu leisten, soweit sie nicht Befriedigung verlangen können. Dieses Recht steht den Gläubigern jedoch nur zu, wenn sie glaubhaft machen, dass durch den Formwechsel die Erfüllung ihrer Forderung gefährdet wird."
    },
    {
      "date": "2025-02-11",
      "id": "101001",
      "original_text": "Einreichung neuer Dokumente\nBaden-Württemberg Amtsgericht Stuttgart HRB 754886\nSEG Automotive Germany GmbH – Stuttgart",
      "type": "Einreichung neuer Dokumente",
      "state": "Baden-Württemberg",
      "amtsgericht": "Amtsgericht Stuttgart",
      "registernummer": "HRB 754886",
      "registerart": "HRB",
      "company_name": "SEG Automotive Germany GmbH",
      "company_seat": "Stuttgart",
      "details": "11.02.2025 (Bekanntmachungsdatum)\n\nBaden-Württemberg Amtsgericht Stuttgart HRB 754886\nEinreichung neuer Dokumente\n\nSEG Automotive Germany GmbH\nGesellschaft mit beschränkter Haftung\nStuttgart\n\nDie Gesellschaft hat am 04.02.2025 die Liste über die Zusammensetzung des Aufsichtsrats zum Handelsregister eingereicht."
    },
    {
      "date": "2025-02-11",
      "id": "101002",
      "original_text": "Löschungsankündigung\nSchleswig-Holstein Amtsgericht Flensburg HRB 14954\nCarper.de UG (haftungsbeschränkt) – Maasbüll",
      "type": "Löschungsankündigung",
      "state": "Schleswig-Holstein",
      "amtsgericht": "Amtsgericht Flensburg",
      "registernummer": "HRB 14954",
      "registerart": "HRB",
      "company_name": "Carper.de UG (haftungsbeschränkt)",
      "company_seat": "Maasbüll",
      "details": "11.02.2025 (Bekanntmachungsdatum)\n\nSchleswig-Holstein Amtsgericht Flensburg HRB 14954\nLöschungsankündigung\n\nCarper.de UG (haftungsbeschränkt)\nGesellschaft mit beschränkter Haftung\nMaasbüll\n\nEs ist die Löschung der nachstehenden Gesellschaft wegen Vermögenslosigkeit gemäß § 394 FamFG beabsichtigt.\nWiderspruchsfrist: 2 Monate."
    },
    {
      "date": "2025-02-11",
      "id": "101003",
      "original_text": "Einreichung neuer Dokumente\nBrandenburg Amtsgericht Potsdam HRB 15446\nHavelland Kliniken GmbH – Nauen",
      "type": "Einreichung neuer Dokumente",
      "state": "Brandenburg",
      "amtsgericht": "Amtsgericht Potsdam",
      "registernummer": "HRB 15446",
      "registerart": "HRB",
      "company_name": "Havelland Kliniken GmbH",
      "company_seat": "Nauen",
      "details": "11.02.2025 (Bekanntmachungsdatum)\n\nBrandenburg Amtsgericht Potsdam HRB 15446\nEinreichung neuer Dokumente\n\nHavelland Kliniken GmbH\nGesellschaft mit beschränkter Haftung\nNauen\n\nAls nicht eingetragen wird veröffentlicht: Eine Liste der Mitglieder des Aufsichtsrates wurde zum Handelsregister eingereicht."
    },
    {
      "date": "2025-02-11",
      "id": "101004",
      "original_text": "Einreichung neuer Dokumente\nBaden-Württemberg Amtsgericht Mannheim HRB 730453\nBlackBoar AG – Walldorf",
      "type": "Einreichung neuer Dokumente",
      "state": "Baden-Württemberg",
      "amtsgericht": "Amtsgericht Mannheim",
      "registernummer": "HRB 730453",
      "registerart": "HRB",
      "company_name": "BlackBoar AG",
      "company_seat": "Walldorf",
      "details": "11.02.2025 (Bekanntmachungsdatum)\n\nBaden-Württemberg Amtsgericht Mannheim HRB 730453\nEinreichung neuer Dokumente 11.02.2025 (Eintragungsdatum)\n\nBlackBoar AG\nAktiengesellschaft\nWalldorf\n\nDie Gesellschaft hat am 07.02.2025 die Liste über die Zusammensetzung des Aufsichtsrats zum Handelsregister eingereicht."
    },
    {
      "date": "2025-02-11",
      "id": "101005",
      "original_text": "Löschungsankündigung\nSaarland Amtsgericht Saarbrücken HRB 102443\nFSC GmbH – Saarlouis",
      "type": "Löschungsankündigung",
      "state": "Saarland",
      "amtsgericht": "Amtsgericht Saarbrücken",
      "registernummer": "HRB 102443",
      "registerart": "HRB",
      "company_name": "FSC GmbH",
      "company_seat": "Saarlouis",
      "details": "11.02.2025 (Bekanntmachungsdatum)\n\nSaarland Amtsgericht Saarbrücken HRB 102443\nLöschungsankündigung\n\nFSC GmbH\nGesellschaft mit beschränkter Haftung\nSaarlouis\n\nEs ist beabsichtigt, die Gesellschaft von Amts wegen gemäß § 394 FamFG wegen Vermögenslosigkeit zu löschen.\nGegen die Löschung von Amts wegen ist das Rechtsmittel des Widerspruchs statthaft. Der Widerspruch ist binnen einer Frist zwei Monaten beginnend mit dem Tag dieser Veröffentlichung durch Einreichen eines Widerspruchsschreibens -schriftlich oder zur Niederschrift der Geschäftsstelle beim Amtsgericht Saarbrücken, -zentrales Handelsregister-, Mainzerstr.178, 66121 Saarbrücken einzulegen.\nDer Widerspruch muss die Bezeichnung der angefochtenen Löschungsankündigung enthalten sowie die Erklärung, dass Widerspruch eingelegt wird. Er ist vom Widerspruchsführer oder seinem Bevollmächtigten zu unterzeichnen.\nDas Widerspruchsschreiben kann auch in der Form eines elektronischen Dokumentes eingereicht werden, das mit einer qualifizierten elektronischen Signatur nach dem Signaturgesetz versehen sein muss (§§ 14 Abs. 2 FamFG, 130a, 298 ZPO)."
    },
    {
      "date": "2025-02-11",
      "id": "101006",
      "original_text": "Sonstige Registerbekanntmachung\nSachsen-Anhalt Amtsgericht Stendal VR 20237\nStadtverband der Gartenfreunde Halle/Saale e.V. – Halle (Saale)",
      "type": "Sonstige Registerbekanntmachung",
      "state": "Sachsen-Anhalt",
      "amtsgericht": "Amtsgericht Stendal",
      "registernummer": "VR 20237",
      "registerart": "VR",
      "company_name": "Stadtverband der Gartenfreunde Halle/Saale e.V.",
      "company_seat": "Halle (Saale)",
      "details": "11.02.2025 (Bekanntmachungsdatum)\n\nSachsen-Anhalt Amtsgericht Stendal VR 20237\nSonstige Registerbekanntmachung\n\nStadtverband der Gartenfreunde Halle/Saale e.V.\neingetragener Verein\nHalle (Saale)\n\nDas Registergericht beabsichtigt, die Herren Andreas Klemmstein und Willi Zarbach von Amts wegen gem. § 395 FamFG aus dem Vereinsregister mangels ordnungsgemäßer wirksamer Bestellung zu löschen. Einwendungen sind binnen drei Wochen zu erheben."
    },
    {
      "date": "2025-02-11",
      "id": "101007",
      "original_text": "Löschungsankündigung\nSaarland Amtsgericht Saarbrücken HRB 105245\nEuro-MONTE UG (haftungsbeschränkt) – St. Ingbert",
      "type": "Löschungsankündigung",
      "state": "Saarland",
      "amtsgericht": "Amtsgericht Saarbrücken",
      "registernummer": "HRB 105245",
      "registerart": "HRB",
      "company_name": "Euro-MONTE UG (haftungsbeschränkt)",
      "company_seat": "St. Ingbert",
      "details": "11.02.2025 (Bekanntmachungsdatum)\n\nSaarland Amtsgericht Saarbrücken HRB 105245\nLöschungsankündigung\n\nEuro-MONTE UG (haftungsbeschränkt)\nGesellschaft mit beschränkter Haftung\nSt. Ingbert\n\nEs ist beabsichtigt, die Gesellschaft von Amts wegen gemäß § 394 FamFG wegen Vermögenslosigkeit zu löschen.\nGegen die Löschung von Amts wegen ist das Rechtsmittel des Widerspruchs statthaft. Der Widerspruch ist binnen einer Frist zwei Monaten beginnend mit dem Tag dieser Veröffentlichung durch Einreichen eines Widerspruchsschreibens -schriftlich oder zur Niederschrift der Geschäftsstelle beim Amtsgericht Saarbrücken, -zentrales Handelsregister-, Mainzerstr.178, 66121 Saarbrücken einzulegen.\nDer Widerspruch muss die Bezeichnung der angefochtenen Löschungsankündigung enthalten sowie die Erklärung, dass Widerspruch eingelegt wird. Er ist vom Widerspruchsführer oder seinem Bevollmächtigten zu unterzeichnen.\nDas Widerspruchsschreiben kann auch in der Form eines elektronischen Dokumentes eingereicht werden, das mit einer qualifizierten elektronischen Signatur nach dem Signaturgesetz versehen sein muss (§§ 14 Abs. 2 FamFG, 130a, 298 ZPO)."
    },
    {
      "date": "2025-02-11",
      "id": "101008",
      "original_text": "Löschungsankündigung\nNiedersachsen Amtsgericht Göttingen HRB 200108\nProf. Voss Management Consulting GmbH – Göttingen",
      "type": "Löschungsankündigung",
      "state": "Niedersachsen",
      "amtsgericht": "Amtsgericht Göttingen",
      "registernummer": "HRB 200108",
      "registerart": "HRB",
      "company_name": "Prof. Voss Management Consulting GmbH",
      "company_seat": "Göttingen",
      "details": "11.02.2025 (Bekanntmachungsdatum)\n\nNiedersachsen Amtsgericht Göttingen HRB 200108\nLöschungsankündigung\n\nProf. Voss Management Consulting GmbH\nGesellschaft mit beschränkter Haftung\nGöttingen\n\nDas Registergericht beabsichtigt, die Gesellschaft von Amts wegen nach § 394 FamFG zu löschen. Die Frist zur Erhebung eines Widerspruchs ist auf 1 Monat ab dieser Registerbekanntmachung festgesetzt."
    },
    {
      "date": "2025-02-11",
      "id": "101009",
      "original_text": "Löschungsankündigung\nNiedersachsen Amtsgericht Göttingen HRB 206372\nMaxxi-Mum Handel GmbH – Uslar",
      "type": "Löschungsankündigung",
      "state": "Niedersachsen",
      "amtsgericht": "Amtsgericht Göttingen",
      "registernummer": "HRB 206372",
      "registerart": "HRB",
      "company_name": "Maxxi-Mum Handel GmbH",
      "company_seat": "Uslar",
      "details": "11.02.2025 (Bekanntmachungsdatum)\n\nNiedersachsen Amtsgericht Göttingen HRB 206372\nLöschungsankündigung\n\nMaxxi-Mum Handel GmbH\nGesellschaft mit beschränkter Haftung\nUslar\n\nDas Registergericht beabsichtigt, die Gesellschaft von Amts wegen nach § 394 FamFG zu löschen. Die Frist zur Erhebung eines Widerspruchs ist auf 1 Monat ab dieser Registerbekanntmachung festgesetzt."
    },
    {
      "date": "2025-02-11",
      "id": "101010",
      "original_text": "Löschungsankündigung\nNiedersachsen Amtsgericht Hildesheim HRB 203804\nDelux-Holding UG (haftungsbeschränkt) – Hildesheim",
      "type": "Löschungsankündigung",
      "state": "Niedersachsen",
      "amtsgericht": "Amtsgericht Hildesheim",
      "registernummer": "HRB 203804",
      "registerart": "HRB",
      "company_name": "Delux-Holding UG (haftungsbeschränkt)",
      "company_seat": "Hildesheim",
      "details": "11.02.2025 (Bekanntmachungsdatum)\n\nNiedersachsen Amtsgericht Hildesheim HRB 203804\nLöschungsankündigung\n\nDelux-Holding UG (haftungsbeschränkt)\nGesellschaft mit beschränkter Haftung\nHildesheim\n\nDas Registergericht beabsichtigt, die Gesellschaft von Amts wegen nach § 394 FamFG zu löschen. Die Frist zur Erhebung eines Widerspruchs ist auf 1 Monat ab dieser Registerbekanntmachung festgesetzt."
    },
    {
      "date": "2025-02-11",
      "id": "101011",
      "original_text": "Einreichung neuer Dokumente\nNiedersachsen Amtsgericht Lüneburg HRB 201659\nFlusslandschaft Elbe GmbH – Bleckede",
      "type": "Einreichung neuer Dokumente",
      "state": "Niedersachsen",
      "amtsgericht": "Amtsgericht Lüneburg",
      "registernummer": "HRB 201659",
      "registerart": "HRB",
      "company_name": "Flusslandschaft Elbe GmbH",
      "company_seat": "Bleckede",
      "details": "11.02.2025 (Bekanntmachungsdatum)\n\nNiedersachsen Amtsgericht Lüneburg HRB 201659\nEinreichung neuer Dokumente\n\nFlusslandschaft Elbe GmbH\nGesellschaft mit beschränkter Haftung\nBleckede\n\nDie Liste der Mitglieder des Aufsichtsrats wurde beim Registergericht eingereicht."
    },
    {
      "date": "2025-02-11",
      "id": "101012",
      "original_text": "Löschungsankündigung\nNiedersachsen Amtsgericht Oldenburg (Oldenburg) HRB 213135\nHausservice - G. Georgiev UG (haftungsbeschränkt) – Wilhelmshaven",
      "type": "Löschungsankündigung",
      "state": "Niedersachsen",
      "amtsgericht": "Amtsgericht Oldenburg (Oldenburg)",
      "registernummer": "HRB 213135",
      "registerart": "HRB",
      "company_name": "Hausservice - G. Georgiev UG (haftungsbeschränkt)",
      "company_seat": "Wilhelmshaven",
      "details": "11.02.2025 (Bekanntmachungsdatum)\n\nNiedersachsen Amtsgericht Oldenburg (Oldenburg) HRB 213135\nLöschungsankündigung\n\nHausservice - G. Georgiev UG (haftungsbeschränkt)\nGesellschaft mit beschränkter Haftung\nWilhelmshaven\n\nDas Registergericht beabsichtigt, die Gesellschaft von Amts wegen nach § 394 FamFG zu löschen. Die Frist zur Erhebung eines Widerspruchs ist auf 1 Monat ab dieser Registerbekanntmachung festgesetzt."
    },
    {
      "date": "2025-02-11",
      "id": "101013",
      "original_text": "Löschungsankündigung\nNiedersachsen Amtsgericht Hannover HRB 120913 früher Amtsgericht Burgwedel\nK's World - creative und perfect solutions GmbH – Langenhagen",
      "type": "Löschungsankündigung",
      "state": "Niedersachsen",
      "amtsgericht": "Amtsgericht Hannover",
      "registernummer": "HRB 120913",
      "registerart": "HRB",
      "company_name": "K's World - creative und perfect solutions GmbH",
      "company_seat": "Langenhagen",
      "former_amtsgericht": "Burgwedel",
      "details": "11.02.2025 (Bekanntmachungsdatum)\n\nNiedersachsen Amtsgericht Hannover HRB 120913 früher Amtsgericht Burgwedel\nLöschungsankündigung\n\nK's World - creative und perfect solutions GmbH\nGesellschaft mit beschränkter Haftung\nLangenhagen\n\nHRB 120913:  K's World - creative und perfect solutions GmbH, Langenhagen\nDas Registergericht beabsichtigt, die Gesellschaft von Amts wegen nach § 394 FamFG zu löschen. Die Frist zur Erhebung eines Widerspruchs ist auf 1 Monat ab dieser Registerbekanntmachung festgesetzt."
    },
    {
      "date": "2025-02-11",
      "id": "101014",
      "original_text": "Löschungsankündigung\nNiedersachsen Amtsgericht Braunschweig HRB 207694\nM. Venture Capital II UG (haftungsbeschränkt) – Groß Twülpstedt",
      "type": "Löschungsankündigung",
      "state": "Niedersachsen",
      "amtsgericht": "Amtsgericht Braunschweig",
      "registernummer": "HRB 207694",
      "registerart": "HRB",
      "company_name": "M. Venture Capital II UG (haftungsbeschränkt)",
      "company_seat": "Groß Twülpstedt",
      "details": "11.02.2025 (Bekanntmachungsdatum)\n\nNiedersachsen Amtsgericht Braunschweig HRB 207694\nLöschungsankündigung\n\nM. Venture Capital II UG (haftungsbeschränkt)\nGesellschaft mit beschränkter Haftung\nGroß Twülpstedt\n\nDas Registergericht beabsichtigt, die Gesellschaft von Amts wegen nach § 394 FamFG zu löschen. Die Frist zur Erhebung eines Widerspruchs ist auf 6 Wochen ab dieser Registerbekanntmachung festgesetzt."
    },
    {
      "date": "2025-02-11",
      "id": "101015",
      "original_text": "Löschungsankündigung\nNiedersachsen Amtsgericht Braunschweig HRB 208946\nBISO Holding UG (haftungsbeschränkt) – Seesen",
      "type": "Löschungsankündigung",
      "state": "Niedersachsen",
      "amtsgericht": "Amtsgericht Braunschweig",
      "registernummer": "HRB 208946",
      "registerart": "HRB",
      "company_name": "BISO Holding UG (haftungsbeschränkt)",
      "company_seat": "Seesen",
      "details": "11.02.2025 (Bekanntmachungsdatum)\n\nNiedersachsen Amtsgericht Braunschweig HRB 208946\nLöschungsankündigung\n\nBISO Holding UG (haftungsbeschränkt)\nGesellschaft mit beschränkter Haftung\nSeesen\n\nDas Registergericht beabsichtigt, die Gesellschaft von Amts wegen nach § 394 FamFG zu löschen. Die Frist zur Erhebung eines Widerspruchs ist auf 1 Monat ab dieser Registerbekanntmachung festgesetzt."
    },
    {
      "date": "2025-02-11",
      "id": "101016",
      "original_text": "Registerbekanntmachung nach dem Umwandlungsgesetz\nNiedersachsen Amtsgericht Hannover HRB 209057\nSGI RE Deutschland Holding GmbH – Hannover",
      "type": "Registerbekanntmachung nach dem Umwandlungsgesetz",
      "state": "Niedersachsen",
      "amtsgericht": "Amtsgericht Hannover",
      "registernummer": "HRB 209057",
      "registerart": "HRB",
      "company_name": "SGI RE Deutschland Holding GmbH",
      "company_seat": "Hannover",
      "details": "11.02.2025 (Bekanntmachungsdatum)\n\nNiedersachsen Amtsgericht Hannover HRB 209057\nRegisterbekanntmachung nach dem Umwandlungsgesetz\n\nSGI RE Deutschland Holding GmbH\nGesellschaft mit beschränkter Haftung\nHannover\n\nEs wird darauf hingewiesen, dass ein Entwurf eines Formwechselplans über einen grenzüberschreitenden Formwechsel der SGI RE Deutschland Holding GmbH mit dem Sitz in Hannover (Deutschland) beim Handelsregister eingereicht worden ist.\nDie Gesellschaft soll identitätswahrend in eine Gesellschaft mit beschränkter Haftung nach dem Recht von Liechtenstein unter Sitzverlegung nach Vaduz formgewechselt werden.\n\nDie an dem Formwechsel beteiligte Gesellschaft wird im Zuzugsstaat Liechtenstein folgende Rechtsform, Firma und Sitz haben:\nFirma: SGI RE Holding 1 GmbH, eine Gesellschaft mit beschränkter Haftung nach dem Recht von Liechtenstein.\nSitz: Vaduz, Liechtenstein\n\nDie Anteilsinhaber und die Gläubiger der an dem grenzüberschreitenden Formwechsel beteiligten Gesellschaft werden darauf hingewiesen, dass sie der SGI RE Deutschland Holding GmbH spätestens fünf Arbeitstage vor dem Tag der Beurkundung des Formwechselplans, die am 24.03.2025 stattfinden wird, Bemerkungen zum Formwechselplan übermitteln können.\nDie Bemerkungen können an die SGI RE Deutschland Holding GmbH, z.Hd. Herrn Birger Dehne, übermittelt werden, entweder per Post: Theaterstraße 13, 30159 Hannover, Deutschland oder per Email: bd@capiterra.de."
    },
    {
      "date": "2025-02-11",
      "id": "101017",
      "original_text": "Sonstige Registerbekanntmachung\nRheinland-Pfalz Amtsgericht Ludwigshafen a.Rhein (Ludwigshafen) HRB 67951\nEnergiewerke Dannstadter Höhe GmbH – Dannstadt-Schauernheim",
      "type": "Sonstige Registerbekanntmachung",
      "state": "Rheinland-Pfalz",
      "amtsgericht": "Amtsgericht Ludwigshafen a.Rhein (Ludwigshafen)",
      "registernummer": "HRB 67951",
      "registerart": "HRB",
      "company_name": "Energiewerke Dannstadter Höhe GmbH",
      "company_seat": "Dannstadt-Schauernheim",
      "details": "11.02.2025 (Bekanntmachungsdatum)\n\nRheinland-Pfalz Amtsgericht Ludwigshafen a.Rhein (Ludwigshafen) HRB 67951\nSonstige Registerbekanntmachung\n\nEnergiewerke Dannstadter Höhe GmbH\nGesellschaft mit beschränkter Haftung\nDannstadt-Schauernheim\n\n.Dem Registergericht ist eine neue Liste der Mitglieder des Aufsichtsrates eingereicht worden."
    },
    {
      "date": "2025-02-11",
      "id": "101018",
      "original_text": "Registerbekanntmachung nach dem Umwandlungsgesetz\nRheinland-Pfalz Amtsgericht Mainz HRB 8555\nSCHOTT AG – Mainz;",
      "type": "Registerbekanntmachung nach dem Umwandlungsgesetz",
      "state": "Rheinland-Pfalz",
      "amtsgericht": "Amtsgericht Mainz",
      "registernummer": "HRB 8555",
      "registerart": "HRB",
      "company_name": "SCHOTT AG",
      "company_seat": "Mainz;",
      "details": "11.02.2025 (Bekanntmachungsdatum)\n\nRheinland-Pfalz Amtsgericht Mainz HRB 8555\nRegisterbekanntmachung nach dem Umwandlungsgesetz\n\nSCHOTT AG\nAktiengesellschaft\nMainz;\n\nDem Registergericht ist ein Entwurf eines Vertrages über die geplante Verschmelzung der SCHOTT Finanzierungs- und Verwaltungs GmbH mit Sitz in Mainz (Amtsgericht Mainz HRB 46339) mit der SCHOTT AG mit Sitz in Mainz (Amtsgericht Mainz HRB 8555) eingereicht worden."
    },
    {
      "date": "2025-02-11",
      "id": "101019",
      "original_text": "Einreichung neuer Dokumente\nRheinland-Pfalz Amtsgericht Koblenz HRB 227\nKoblenzer Wohnungsbaugesellschaft mbH – Koblenz",
      "type": "Einreichung neuer Dokumente",
      "state": "Rheinland-Pfalz",
      "amtsgericht": "Amtsgericht Koblenz",
      "registernummer": "HRB 227",
      "registerart": "HRB",
      "company_name": "Koblenzer Wohnungsbaugesellschaft mbH",
      "company_seat": "Koblenz",
      "details": "11.02.2025 (Bekanntmachungsdatum)\n\nRheinland-Pfalz Amtsgericht Koblenz HRB 227\nEinreichung neuer Dokumente\n\nKoblenzer Wohnungsbaugesellschaft mbH\nGesellschaft mit beschränkter Haftung\nKoblenz\n\nDem Registergericht ist eine neue Liste der Mitglieder des Aufsichtsrates eingereicht worden."
    },
    {
      "date": "2025-02-11",
      "id": "101020",
      "original_text": "Sonstige Registerbekanntmachung\nRheinland-Pfalz Amtsgericht Mainz HRB 42425\nG.L. Kayser ImmoPartner GmbH – Mainz",
      "type": "Sonstige Registerbekanntmachung",
      "state": "Rheinland-Pfalz",
      "amtsgericht": "Amtsgericht Mainz",
      "registernummer": "HRB 42425",
      "registerart": "HRB",
      "company_name": "G.L. Kayser ImmoPartner GmbH",
      "company_seat": "Mainz",
      "details": "11.02.2025 (Bekanntmachungsdatum)\n\nRheinland-Pfalz Amtsgericht Mainz HRB 42425\nSonstige Registerbekanntmachung 11.02.2025 (Eintragungsdatum)\n\nG.L. Kayser ImmoPartner GmbH\nGesellschaft mit beschränkter Haftung\nMainz\n\nAls nicht eingetragen wird veröffentlicht: Den Gläubigern der Gesellschaft, deren Forderungen begründet worden sind, bevor die Eintragung der Beendigung des Gewinnabführungsvertrages in das Handelsregister nach § 10 des Handelsgesetzbuches als bekanntgemacht gilt, hat der andere Vertragsteil Sicherheit zu leisten, wenn sie sich binnen sechs Monaten nach der Bekanntmachung der Eintragung zu diesem Zweck bei ihm melden."
    },
    {
      "date": "2025-02-11",
      "id": "101021",
      "original_text": "Löschungsankündigung\nBremen Amtsgericht Bremen HRB 5697\nBARLAGE Unterhaltungselektronik GmbH – Bremen",
      "type": "Löschungsankündigung",
      "state": "Bremen",
      "amtsgericht": "Amtsgericht Bremen",
      "registernummer": "HRB 5697",
      "registerart": "HRB",
      "company_name": "BARLAGE Unterhaltungselektronik GmbH",
      "company_seat": "Bremen",
      "details": "11.02.2025 (Bekanntmachungsdatum)\n\nBremen Amtsgericht Bremen HRB 5697\nLöschungsankündigung\n\nBARLAGE Unterhaltungselektronik GmbH\nGesellschaft mit beschränkter Haftung\nBremen\n\nEs ist beabsichtigt die im Handelsregister eingetragene Gesellschaft von Amts wegen gemäß § 394 FamFG zu löschen. Gegen die Löschung kann beim AG Bremen schriftlich oder zu Protokoll der Geschäftsstelle Widerspruch eingelegt werden. Widerspruchsfrist 4 Wochen."
    },
    {
      "date": "2025-02-11",
      "id": "101022",
      "original_text": "Löschungsankündigung\nBremen Amtsgericht Bremen HRB 35747\nProjektbau Nord GmbH – Bremerhaven",
      "type": "Löschungsankündigung",
      "state": "Bremen",
      "amtsgericht": "Amtsgericht Bremen",
      "registernummer": "HRB 35747",
      "registerart": "HRB",
      "company_name": "Projektbau Nord GmbH",
      "company_seat": "Bremerhaven",
      "details": "11.02.2025 (Bekanntmachungsdatum)\n\nBremen Amtsgericht Bremen HRB 35747\nLöschungsankündigung\n\nProjektbau Nord GmbH\nGesellschaft mit beschränkter Haftung\nBremerhaven\n\nEs ist beabsichtigt die im Handelsregister eingetragene Gesellschaft von Amts wegen gemäß § 394 FamFG zu löschen. Gegen die Löschung kann beim AG Bremen schriftlich oder zu Protokoll der Geschäftsstelle Widerspruch eingelegt werden. Widerspruchsfrist 4 Wochen."
    },
    {
      "date": "2025-02-11",
      "id": "101023",
      "original_text": "Löschungsankündigung\nBremen Amtsgericht Bremen HRB 35855\nWESERSIGMA GmbH – Bremen",
      "type": "Löschungsankündigung",
      "state": "Bremen",
      "amtsgericht": "Amtsgericht Bremen",
      "registernummer": "HRB 35855",
      "registerart": "HRB",
      "company_name": "WESERSIGMA GmbH",
      "company_seat": "Bremen",
      "details": "11.02.2025 (Bekanntmachungsdatum)\n\nBremen Amtsgericht Bremen HRB 35855\nLöschungsankündigung\n\nWESERSIGMA GmbH\nGesellschaft mit beschränkter Haftung\nBremen\n\nEs ist beabsichtigt die im Handelsregister eingetragene Gesellschaft von Amts wegen gemäß § 394 FamFG zu löschen. Gegen die Löschung kann beim AG Bremen schriftlich oder zu Protokoll der Geschäftsstelle Widerspruch eingelegt werden. Widerspruchsfrist 4 Wochen."
    },
    {
      "date": "2025-02-11",
      "id": "101024",
      "original_text": "Löschungsankündigung\nNordrhein-Westfalen Amtsgericht Hagen HRB 8733\nProlamed UG (haftungsbeschränkt) – Hagen",
      "type": "Löschungsankündigung",
      "state": "Nordrhein-Westfalen",
      "amtsgericht": "Amtsgericht Hagen",
      "registernummer": "HRB 8733",
      "registerart": "HRB",
      "company_name": "Prolamed UG (haftungsbeschränkt)",
      "company_seat": "Hagen",
      "details": "11.02.2025 (Bekanntmachungsdatum)\n\nNordrhein-Westfalen Amtsgericht Hagen HRB 8733\nLöschungsankündigung\n\nProlamed UG (haftungsbeschränkt)\nGesellschaft mit beschränkter Haftung\nHagen\n\nDas Registergericht beabsichtigt, die im Handelsregister eingetragene Gesellschaft gemäß § 394 Absatz 1 FamFG wegen Vermögenslosigkeit von Amts wegen zu löschen.  Gegen diese Verfügung kann Widerspruch eingelegt werden. Die Frist zur Erhebung eines Widerspruchs gegen die beabsichtigte Löschung von Amts wegen ist auf drei Monate festgesetzt.\n\nRechtsbehelfsbelehrung:\nGegen diese Verfügung können Sie Widerspruch einlegen.\n\nDer Widerspruch ist bei dem Amtsgericht Hagen, Heinitzstraße 42, 58097 Hagen schriftlich in deutscher Sprache oder zur Niederschrift der Geschäftsstelle einzulegen. Der Widerspruch kann auch zur Niederschrift der Geschäftsstelle eines jeden Amtsgerichtes abgegeben werden.\n\nDer Widerspruch muss spätestens innerhalb der gesetzten Frist bei dem Amtsgericht Hagen eingegangen sein. Dies gilt auch dann, wenn der Widerspruch zur Niederschrift der Geschäftsstelle eines anderen Amtsgerichtes abgegeben wurde. Die Frist beginnt mit der Veröffentlichung. Fällt das Ende der Frist auf einen Sonntag, einen allgemeinen Feiertag oder Sonnabend, so endet die Frist mit Ablauf des nächsten Werktages.\n\nDer Widerspruch muss die Bezeichnung der angefochtenen Verfügung sowie die Erklärung enthalten, dass Widerspruch gegen diese Verfügung eingelegt wird. Er ist zu unterzeichnen und soll begründet werden."
    },
    {
      "date": "2025-02-11",
      "id": "101025",
      "original_text": "Sonstige Registerbekanntmachung\nNordrhein-Westfalen Amtsgericht Düsseldorf HRB 48032\nIFIC Holding AG – Düsseldorf",
      "type": "Sonstige Registerbekanntmachung",
      "state": "Nordrhein-Westfalen",
      "amtsgericht": "Amtsgericht Düsseldorf",
      "registernummer": "HRB 48032",
      "registerart": "HRB",
      "company_name": "IFIC Holding AG",
      "company_seat": "Düsseldorf",
      "details": "11.02.2025 (Bekanntmachungsdatum)\n\nNordrhein-Westfalen Amtsgericht Düsseldorf HRB 48032\nSonstige Registerbekanntmachung 11.02.2025 (Eintragungsdatum)\n\nIFIC Holding AG\nAktiengesellschaft\nDüsseldorf\n\nDem Registergericht ist eine Liste der Mitglieder des Aufsichtsrates eingereicht worden."
    },
    {
      "date": "2025-02-11",
      "id": "101026",
      "original_text": "Einreichung neuer Dokumente\nNordrhein-Westfalen Amtsgericht Wuppertal HRB 14509\nDiakonie im Kirchenkreis Düsseldorf-Mettmann GmbH – Mettmann",
      "type": "Einreichung neuer Dokumente",
      "state": "Nordrhein-Westfalen",
      "amtsgericht": "Amtsgericht Wuppertal",
      "registernummer": "HRB 14509",
      "registerart": "HRB",
      "company_name": "Diakonie im Kirchenkreis Düsseldorf-Mettmann GmbH",
      "company_seat": "Mettmann",
      "details": "11.02.2025 (Bekanntmachungsdatum)\n\nNordrhein-Westfalen Amtsgericht Wuppertal HRB 14509\nEinreichung neuer Dokumente\n\nDiakonie im Kirchenkreis Düsseldorf-Mettmann GmbH\nGesellschaft mit beschränkter Haftung\nMettmann\n\nDem Registergericht ist eine Liste der Mitglieder des Aufsichtsrates eingereicht worden."
    },
    {
      "date": "2025-02-11",
      "id": "101027",
      "original_text": "Registerbekanntmachung nach dem Umwandlungsgesetz\nNordrhein-Westfalen Amtsgericht Bochum HRB 1938\nUrbania Liegenschaftsverwaltungsgesellschaft mit beschränkter Haftung – Bochum",
      "type": "Registerbekanntmachung nach dem Umwandlungsgesetz",
      "state": "Nordrhein-Westfalen",
      "amtsgericht": "Amtsgericht Bochum",
      "registernummer": "HRB 1938",
      "registerart": "HRB",
      "company_name": "Urbania Liegenschaftsverwaltungsgesellschaft mit beschränkter Haftung",
      "company_seat": "Bochum",
      "details": "11.02.2025 (Bekanntmachungsdatum)\n\nNordrhein-Westfalen Amtsgericht Bochum HRB 1938\nRegisterbekanntmachung nach dem Umwandlungsgesetz 10.02.2025 (Eintragungsdatum)\n\nUrbania Liegenschaftsverwaltungsgesellschaft mit beschränkter Haftung\nGesellschaft mit beschränkter Haftung\nBochum\n\nAls nicht eingetragen wird veröffentlicht: Den Gläubigern der Gesellschaft, deren Forderungen begründet worden sind bevor die Eintragung der Beendigung des Beherrschungs- und Gewinnabführungsvertrages  in das Handelsregister nach § 10 des Handelsgesetzbuches als bekanntgemacht gilt, hat der andere Vertragsteil Sicherheit zu leisten, wenn sie sich binnen sechs Monaten nach der Bekanntmachung der Eintragung zu diesem Zweck bei ihm melden."
    },
    {
      "date": "2025-02-11",
      "id": "101028",
      "original_text": "Registerbekanntmachung nach dem Umwandlungsgesetz\nNordrhein-Westfalen Amtsgericht Münster HRB 19045\nDr. Große-Hokamp Steuerberatungsgesellschaft mbH – Münster",
      "type": "Registerbekanntmachung nach dem Umwandlungsgesetz",
      "state": "Nordrhein-Westfalen",
      "amtsgericht": "Amtsgericht Münster",
      "registernummer": "HRB 19045",
      "registerart": "HRB",
      "company_name": "Dr. Große-Hokamp Steuerberatungsgesellschaft mbH",
      "company_seat": "Münster",
      "details": "11.02.2025 (Bekanntmachungsdatum)\n\nNordrhein-Westfalen Amtsgericht Münster HRB 19045\nRegisterbekanntmachung nach dem Umwandlungsgesetz 11.02.2025 (Eintragungsdatum)\n\nDr. Große-Hokamp Steuerberatungsgesellschaft mbH\nGesellschaft mit beschränkter Haftung\nMünster\n\nDen Gläubigern der an der Verschmelzung beteiligten Rechtsträger ist, wenn sie binnen sechs Monaten nach dem Tag, an dem die Eintragung der Verschmelzung in das Register des Sitzes desjenigen Rechtsträgers, dessen Gläubiger sie sind, nach § 19 Absatz 3 UmwG als bekanntgemacht gilt, ihren Anspruch nach Grund und Höhe schriftlich anmelden, Sicherheit zu leisten, soweit sie nicht Befriedigung verlangen können. Dieses Recht steht den Gläubigern jedoch nur zu, wenn sie glaubhaft machen, dass durch die Verschmelzung die Erfüllung ihrer Forderung gefährdet wird."
    },
    {
      "date": "2025-02-11",
      "id": "101029",
      "original_text": "Löschungsankündigung\nNordrhein-Westfalen Amtsgericht Aachen HRB 20085\nFWS GmbH – Wassenberg",
      "type": "Löschungsankündigung",
      "state": "Nordrhein-Westfalen",
      "amtsgericht": "Amtsgericht Aachen",
      "registernummer": "HRB 20085",
      "registerart": "HRB",
      "company_name": "FWS GmbH",
      "company_seat": "Wassenberg",
      "details": "11.02.2025 (Bekanntmachungsdatum)\n\nNordrhein-Westfalen Amtsgericht Aachen HRB 20085\nLöschungsankündigung\n\nFWS GmbH\nGesellschaft mit beschränkter Haftung\nWassenberg\n\nDas Registergericht beabsichtigt, von Amts wegen die Gesellschaft wegen Vermögenslosigkeit nach § 394 FamFG zu löschen, weil das Insolvenzverfahren Amtsgericht Aachen (Az.: 91 IN 317/19) beendet und Vermögen der Gesellschaft nicht mehr erkennbar ist.\n\nZur Geltendmachung des Widerspruchs gegen die beabsichtigte Löschung wird hiermit eine Frist von einem Monat ab Veröffentlichung dieser Ankündigung bestimmt.\n\nRechtsbehelfsbelehrung:\n\nGegen diese Verfügung kann Widerspruch eingelegt werden. Zum Widerspruch ist jeder berechtigt, der an der Unterlassung der Löschung ein berechtigtes Interesse hat.\n\nDer Widerspruch ist bei dem Amtsgericht Aachen, Adalbertsteinweg 92, 52070 Aachen schriftlich in deutscher Sprache oder zur Niederschrift der Geschäftsstelle einzulegen. Der Widerspruch kann auch zur Niederschrift der Geschäftsstelle eines jeden Amtsgerichtes abgegeben werden.\n\nDer Widerspruch muss spätestens innerhalb der gesetzten Frist nach der Bekanntgabe der Verfügung bei dem Amtsgericht Aachen eingegangen sein. Dies gilt auch dann, wenn der Widerspruch zur Niederschrift der Geschäftsstelle eines anderen Amtsgerichtes abgegeben wurde. Die Frist beginnt mit der Bekanntgabe der Verfügung durch Veröffentlichung. Fällt das Ende der Frist auf einen Sonntag, einen allgemeinen Feiertag oder Sonnabend, so endet die Frist mit Ablauf des nächsten Werktages.\n\nDer Widerspruch muss die Bezeichnung der angefochtenen Verfügung sowie die Erklärung enthalten, dass Widerspruch gegen diese Verfügung eingelegt wird. Er ist zu unterzeichnen und soll begründet werden.\n\nDie Einlegung ist auch durch Übertragung eines elektronischen Dokuments an die elektronische Poststelle des Gerichts möglich. Das elektronische Dokument muss für die Bearbeitung durch das Gericht geeignet und mit einer qualifizierten elektronischen Signatur der verantwortenden Person versehen sein oder von der verantwortenden Person signiert und auf einem sicheren Übermittlungsweg gemäß § 130 a ZPO nach näherer Maßgabe der Verordnung über die technischen Rahmenbedingungen des elektronischen Rechtsverkehrs und über das besondere elektronische Behördenpostfach (BGBl. I, S. 3803) eingereicht werden. Weitere Informationen erhalten Sie auf der Internetseite www.justiz.de."
    },
    {
      "date": "2025-02-11",
      "id": "101030",
      "original_text": "Löschungsankündigung\nNordrhein-Westfalen Amtsgericht Krefeld HRB 17879\nVGS Dienstleistung GmbH – Krefeld",
      "type": "Löschungsankündigung",
      "state": "Nordrhein-Westfalen",
      "amtsgericht": "Amtsgericht Krefeld",
      "registernummer": "HRB 17879",
      "registerart": "HRB",
      "company_name": "VGS Dienstleistung GmbH",
      "company_seat": "Krefeld",
      "details": "11.02.2025 (Bekanntmachungsdatum)\n\nNordrhein-Westfalen Amtsgericht Krefeld HRB 17879\nLöschungsankündigung\n\nVGS Dienstleistung GmbH\nGesellschaft mit beschränkter Haftung\nKrefeld\n\nDas Registergericht beabsichtigt die Gesellschaft von Amts wegen nach § 394 FamFG zu löschen. Die Frist zur Erhebung eines Widerspruchs ist auf einen Monat festgesetzt."
    },
    {
      "date": "2025-02-11",
      "id": "101031",
      "original_text": "Registerbekanntmachung nach dem Umwandlungsgesetz\nNordrhein-Westfalen Amtsgericht Bochum HRB 772\ntribus IT GmbH – Bochum",
      "type": "Registerbekanntmachung nach dem Umwandlungsgesetz",
      "state": "Nordrhein-Westfalen",
      "amtsgericht": "Amtsgericht Bochum",
      "registernummer": "HRB 772",
      "registerart": "HRB",
      "company_name": "tribus IT GmbH",
      "company_seat": "Bochum",
      "details": "11.02.2025 (Bekanntmachungsdatum)\n\nNordrhein-Westfalen Amtsgericht Bochum HRB 772\nRegisterbekanntmachung nach dem Umwandlungsgesetz 10.02.2025 (Eintragungsdatum)\n\ntribus IT GmbH\nGesellschaft mit beschränkter Haftung\nBochum\n\nDen Gläubigern der an der Verschmelzung beteiligten Rechtsträger ist, wenn sie binnen sechs Monaten nach dem Tag, an dem die Eintragung der Verschmelzung in das Register des Sitzes desjenigen Rechtsträgers, dessen Gläubiger sie sind, nach § 19 Absatz 3 UmwG als bekanntgemacht gilt, ihren Anspruch nach Grund und Höhe schriftlich anmelden, Sicherheit zu leisten, soweit sie nicht Befriedigung verlangen können. Dieses Recht steht den Gläubigern jedoch nur zu, wenn sie glaubhaft machen, dass durch die Verschmelzung die Erfüllung ihrer Forderung gefährdet wird."
    },
    {
      "date": "2025-02-11",
      "id": "101032",
      "original_text": "Einreichung neuer Dokumente\nNordrhein-Westfalen Amtsgericht Düsseldorf HRB 107876\nHC & S AG – Düsseldorf",
      "type": "Einreichung neuer Dokumente",
      "state": "Nordrhein-Westfalen",
      "amtsgericht": "Amtsgericht Düsseldorf",
      "registernummer": "HRB 107876",
      "registerart": "HRB",
      "company_name": "HC & S AG",
      "company_seat": "Düsseldorf",
      "details": "11.02.2025 (Bekanntmachungsdatum)\n\nNordrhein-Westfalen Amtsgericht Düsseldorf HRB 107876\nEinreichung neuer Dokumente\n\nHC & S AG\nAktiengesellschaft\nDüsseldorf\n\nDem Registergericht ist eine neue Liste der Mitglieder des Aufsichtsrates eingereicht worden."
    },
    {
      "date": "2025-02-11",
      "id": "101033",
      "original_text": "Einreichung neuer Dokumente\nNordrhein-Westfalen Amtsgericht Essen HRB 20157\n11 88 0 Internet Services AG – Essen",
      "type": "Einreichung neuer Dokumente",
      "state": "Nordrhein-Westfalen",
      "amtsgericht": "Amtsgericht Essen",
      "registernummer": "HRB 20157",
      "registerart": "HRB",
      "company_name": "11 88 0 Internet Services AG",
      "company_seat": "Essen",
      "details": "11.02.2025 (Bekanntmachungsdatum)\n\nNordrhein-Westfalen Amtsgericht Essen HRB 20157\nEinreichung neuer Dokumente\n\n11 88 0 Internet Services AG\nAktiengesellschaft\nEssen\n\nDem Registergericht ist eine neue Liste der Mitglieder des Aufsichtsrates eingereicht worden."
    },
    {
      "date": "2025-02-11",
      "id": "101034",
      "original_text": "Einreichung neuer Dokumente\nNordrhein-Westfalen Amtsgericht Mönchengladbach HRB 8885\nS-IBG Immobilien-Beteiligungs-Gesellschaft der Kreissparkasse Heinsberg mbH – Erkelenz",
      "type": "Einreichung neuer Dokumente",
      "state": "Nordrhein-Westfalen",
      "amtsgericht": "Amtsgericht Mönchengladbach",
      "registernummer": "HRB 8885",
      "registerart": "HRB",
      "company_name": "S-IBG Immobilien-Beteiligungs-Gesellschaft der Kreissparkasse Heinsberg mbH",
      "company_seat": "Erkelenz",
      "details": "11.02.2025 (Bekanntmachungsdatum)\n\nNordrhein-Westfalen Amtsgericht Mönchengladbach HRB 8885\nEinreichung neuer Dokumente 11.02.2025 (Eintragungsdatum)\n\nS-IBG Immobilien-Beteiligungs-Gesellschaft der Kreissparkasse Heinsberg mbH\nGesellschaft mit beschränkter Haftung\nErkelenz\n\nDem Registergericht ist eine neue Liste der Mitglieder des Aufsichtsrates eingereicht worden."
    },
    {
      "date": "2025-02-11",
      "id": "101035",
      "original_text": "Löschungsankündigung\nNordrhein-Westfalen Amtsgericht Kleve HRB 16211\nH.D.K. GmbH – Neukirchen-Vluyn",
      "type": "Löschungsankündigung",
      "state": "Nordrhein-Westfalen",
      "amtsgericht": "Amtsgericht Kleve",
      "registernummer": "HRB 16211",
      "registerart": "HRB",
      "company_name": "H.D.K. GmbH",
      "company_seat": "Neukirchen-Vluyn",
      "details": "11.02.2025 (Bekanntmachungsdatum)\n\nNordrhein-Westfalen Amtsgericht Kleve HRB 16211\nLöschungsankündigung\n\nH.D.K. GmbH\nGesellschaft mit beschränkter Haftung\nNeukirchen-Vluyn\n\nDas Registergericht beabsichtigt die Gesellschaft von Amts wegen nach § 394 FamFG zu löschen. Die Frist zur Erhebung eines Widerspruchs ist auf einen Monat festgesetzt."
    },
    {
      "date": "2025-02-11",
      "id": "101036",
      "original_text": "Löschungsankündigung\nNordrhein-Westfalen Amtsgericht Siegburg HRB 13847\nAIF24 UG (haftungsbeschränkt) – Troisdorf",
      "type": "Löschungsankündigung",
      "state": "Nordrhein-Westfalen",
      "amtsgericht": "Amtsgericht Siegburg",
      "registernummer": "HRB 13847",
      "registerart": "HRB",
      "company_name": "AIF24 UG (haftungsbeschränkt)",
      "company_seat": "Troisdorf",
      "details": "11.02.2025 (Bekanntmachungsdatum)\n\nNordrhein-Westfalen Amtsgericht Siegburg HRB 13847\nLöschungsankündigung\n\nAIF24 UG (haftungsbeschränkt)\nGesellschaft mit beschränkter Haftung\nTroisdorf\n\nDas Registergericht hat glaubhafte Kenntnis erlangt, dass die Gesellschaft vermögenslos geworden ist, da ein Insolvenzeröffnungsantrag mangels Masse nach § 26 InsO zurückgewiesen wurde.\n\nEs ist daher beabsichtigt, die Gesellschaft nach § 394 FamFG im Handelsregister wegen Vermögenslosigkeit zu löschen.\n\nEinwände gegen die Löschung sind durch Widerspruch binnen einer Frist von 3 Monaten geltend zu machen, andernfalls die Löschung erfolgen wird.\n\nEinzulegen ist der Widerspruch bei dem Amtsgericht Siegburg, Neue Poststraße 16, 53721 Siegburg, und zwar entweder schriftlich in deutscher Sprache oder mündlich zur Niederschrift der Geschäftsstelle. Der Widerspruch kann auch zur Niederschrift der Geschäftsstelle eines jeden Amtsgerichts abgegeben werden. Der Widerspruch ist binnen der in der Verfügung bestimmten Frist einzulegen. Die Frist ist nur gewahrt, wenn der Widerspruch rechtzeitig bei dem Amtsgericht Siegburg eingeht, auch wenn der Widerspruch zur Niederschrift der Geschäftsstelle eines anderen Amtsgerichts abgegeben wurde. Die Frist beginnt jeweils mit der schriftlichen Bekanntgabe der Verfügung an die Beteiligten. Kann die schriftliche Bekanntgabe an einen Beteiligten nicht bewirkt werden, beginnt die Frist spätestens mit Ablauf von fünf Monaten nach Erlass der Verfügung. Die Bekanntgabe ist entweder durch Zustellung oder am dritten Tage nach Aufgabe zur Post bewirkt. Sofern die Löschung noch nicht erfolgt ist, kann der Widerspruch auch noch nach Ablauf der Frist eingelegt werden. Fällt das Ende der Frist auf einen Sonnabend, einen Sonntag oder einen allgemeinen Feiertag, endet die Frist mit Ablauf des nächsten Werktages. Der Widerspruch ist zu unterzeichnen. Eine Begründung des Widerspruchs ist nicht vorgeschrieben."
    },
    {
      "date": "2025-02-11",
      "id": "101037",
      "original_text": "Löschungsankündigung\nNordrhein-Westfalen Amtsgericht Siegburg HRA 6288\nITC promotion e.K. – Neunkirchen-Seelscheid",
      "type": "Löschungsankündigung",
      "state": "Nordrhein-Westfalen",
      "amtsgericht": "Amtsgericht Siegburg",
      "registernummer": "HRA 6288",
      "registerart": "HRA",
      "company_name": "ITC promotion e.K.",
      "company_seat": "Neunkirchen-Seelscheid",
      "details": "11.02.2025 (Bekanntmachungsdatum)\n\nNordrhein-Westfalen Amtsgericht Siegburg HRA 6288\nLöschungsankündigung\n\nITC promotion e.K.\nEinzelkaufmann / Einzelkauffrau\nNeunkirchen-Seelscheid\n\nDie im hiesigen Handelsregister eingetragene Firma ITC promotion e.K. soll gemäß § 31 Absatz 2 HGB i.V.m. § 393 FamFG von Amts wegen gelöscht werden. Ein etwaiger Widerspruch gegen die beabsichtigte Löschung ist binnen einer Frist von drei Monaten bei dem Registergericht geltend zu machen, anderenfalls wird die Löschung der Firma erfolgen."
    },
    {
      "date": "2025-02-11",
      "id": "101038",
      "original_text": "Löschungsankündigung\nThüringen Amtsgericht Jena HRB 502323\nRASANT Fahrzeug GmbH – Zella-Mehlis",
      "type": "Löschungsankündigung",
      "state": "Thüringen",
      "amtsgericht": "Amtsgericht Jena",
      "registernummer": "HRB 502323",
      "registerart": "HRB",
      "company_name": "RASANT Fahrzeug GmbH",
      "company_seat": "Zella-Mehlis",
      "details": "11.02.2025 (Bekanntmachungsdatum)\n\nThüringen Amtsgericht Jena HRB 502323\nLöschungsankündigung\n\nRASANT Fahrzeug GmbH\nGesellschaft mit beschränkter Haftung\nZella-Mehlis\n\nDas Registergericht beabsichtigt, die im Handelsregister eingetragene Gesellschaft wegen Vermögenslosigkeit nach § 394 FamFG von Amts wegen zu löschen. Die Frist zur Erhebung eines Widerspruchs gegen die beabsichtigte Löschung wird auf 6 Wochen festgesetzt."
    },
    {
      "date": "2025-02-11",
      "id": "101039",
      "original_text": "Registerbekanntmachung nach dem Umwandlungsgesetz\nHessen Amtsgericht Wiesbaden HRA 11771\ngo connecting Ulrike Goßmann e.K. – Wiesbaden",
      "type": "Registerbekanntmachung nach dem Umwandlungsgesetz",
      "state": "Hessen",
      "amtsgericht": "Amtsgericht Wiesbaden",
      "registernummer": "HRA 11771",
      "registerart": "HRA",
      "company_name": "go connecting Ulrike Goßmann e.K.",
      "company_seat": "Wiesbaden",
      "details": "11.02.2025 (Bekanntmachungsdatum)\n\nHessen Amtsgericht Wiesbaden HRA 11771\nRegisterbekanntmachung nach dem Umwandlungsgesetz 11.02.2025 (Eintragungsdatum)\n\ngo connecting Ulrike Goßmann e.K.\nEinzelkaufmann / Einzelkauffrau\nWiesbaden\n\nDen Gläubigern der an der Ausgliederung beteiligten Rechtsträger ist, wenn sie binnen sechs Monaten nach dem Tag, an dem die Eintragung der Ausgliederung in das Register des Sitzes desjenigen Rechtsträgers, dessen Gläubiger sie sind, nach §§ 125, 19 Absatz 3 UmwG bekannt gemacht worden ist, ihren Anspruch nach Grund und Höhe schriftlich anmelden, Sicherheit zu leisten, soweit sie nicht Befriedigung verlangen können. Dieses Recht steht den Gläubigern jedoch nur zu, wenn sie glaubhaft machen, dass durch die Ausgliederung die Erfüllung ihrer Forderung gefährdet wird."
    },
    {
      "date": "2025-02-11",
      "id": "101040",
      "original_text": "Sonstige Registerbekanntmachung\nHessen Amtsgericht Bad Homburg v.d.H. VR 2106\nGütegemeinschaft Wertstoffkette PET-Getränkeverpackungen e.V. – Bad Homburg v. d. Höhe",
      "type": "Sonstige Registerbekanntmachung",
      "state": "Hessen",
      "amtsgericht": "Amtsgericht Bad Homburg v.d.H.",
      "registernummer": "VR 2106",
      "registerart": "VR",
      "company_name": "Gütegemeinschaft Wertstoffkette PET-Getränkeverpackungen e.V.",
      "company_seat": "Bad Homburg v. d. Höhe",
      "details": "11.02.2025 (Bekanntmachungsdatum)\n\nHessen Amtsgericht Bad Homburg v.d.H. VR 2106\nSonstige Registerbekanntmachung 11.02.2025 (Eintragungsdatum)\n\nGütegemeinschaft Wertstoffkette PET-Getränkeverpackungen e.V.\neingetragener Verein\nBad Homburg v. d. Höhe\n\nDer Verein ist aufgelöst."
    },
    {
      "date": "2025-02-11",
      "id": "101041",
      "original_text": "Löschungsankündigung\nHessen Amtsgericht Darmstadt HRB 85898\nCS Kälte-und Klimatechnik GmbH – Brensbach",
      "type": "Löschungsankündigung",
      "state": "Hessen",
      "amtsgericht": "Amtsgericht Darmstadt",
      "registernummer": "HRB 85898",
      "registerart": "HRB",
      "company_name": "CS Kälte-und Klimatechnik GmbH",
      "company_seat": "Brensbach",
      "details": "11.02.2025 (Bekanntmachungsdatum)\n\nHessen Amtsgericht Darmstadt HRB 85898\nLöschungsankündigung\n\nCS Kälte-und Klimatechnik GmbH\nGesellschaft mit beschränkter Haftung\nBrensbach\n\nDas Registergericht beabsichtigt die im Handelsregister eingetragene Gesellschaft von Amts wegen nach § 394 FamFG zu löschen. Die Frist zur Erhebung eines Widerspruchs gegen die beabsichtigte Löschung wird auf 3 Monate festgesetzt."
    },
    {
      "date": "2025-02-11",
      "id": "101042",
      "original_text": "Einreichung neuer Dokumente\nHessen Amtsgericht Frankfurt am Main HRB 97589\nArbireo Capital AG – Frankfurt am Main",
      "type": "Einreichung neuer Dokumente",
      "state": "Hessen",
      "amtsgericht": "Amtsgericht Frankfurt am Main",
      "registernummer": "HRB 97589",
      "registerart": "HRB",
      "company_name": "Arbireo Capital AG",
      "company_seat": "Frankfurt am Main",
      "details": "11.02.2025 (Bekanntmachungsdatum)\n\nHessen Amtsgericht Frankfurt am Main HRB 97589\nEinreichung neuer Dokumente 11.02.2025 (Eintragungsdatum)\n\nArbireo Capital AG\nAktiengesellschaft\nFrankfurt am Main\n\nDurch eine Änderung in den Personen der Aufsichtsratsmitglieder ist eine Liste der Mitglieder des Aufsichtsrates zum Handelsregister eingereicht worden."
    },
    {
      "date": "2025-02-11",
      "id": "101043",
      "original_text": "Einreichung neuer Dokumente\nHessen Amtsgericht Frankfurt am Main HRB 119066\nStandard Profil Automotive GmbH – Eschborn",
      "type": "Einreichung neuer Dokumente",
      "state": "Hessen",
      "amtsgericht": "Amtsgericht Frankfurt am Main",
      "registernummer": "HRB 119066",
      "registerart": "HRB",
      "company_name": "Standard Profil Automotive GmbH",
      "company_seat": "Eschborn",
      "details": "11.02.2025 (Bekanntmachungsdatum)\n\nHessen Amtsgericht Frankfurt am Main HRB 119066\nEinreichung neuer Dokumente\n\nStandard Profil Automotive GmbH\nGesellschaft mit beschränkter Haftung\nEschborn\n\nDurch eine Änderung in den Personen der Aufsichtsratsmitglieder ist eine Liste der Mitglieder des Aufsichtsrates zum Handelsregister eingereicht worden."
    },
    {
      "date": "2025-02-11",
      "id": "101044",
      "original_text": "Löschungsankündigung\nHessen Amtsgericht Frankfurt am Main HRB 97225\nBioconLife AG – Frankfurt am Main",
      "type": "Löschungsankündigung",
      "state": "Hessen",
      "amtsgericht": "Amtsgericht Frankfurt am Main",
      "registernummer": "HRB 97225",
      "registerart": "HRB",
      "company_name": "BioconLife AG",
      "company_seat": "Frankfurt am Main",
      "details": "11.02.2025 (Bekanntmachungsdatum)\n\nHessen Amtsgericht Frankfurt am Main HRB 97225\nLöschungsankündigung\n\nBioconLife AG\nAktiengesellschaft\nFrankfurt am Main\n\nDas Registergericht beabsichtigt die im Handelsregister eingetragene Gesellschaft von Amts wegen nach § 394 FamFG zu löschen. Hiergegen kann innerhalb eines Zeitraumes von 1 Monat nach dieser Veröffentlichung Widerspruch bei dem Amtsgericht Frankfurt am Main eingelegt werden."
    },
    {
      "date": "2025-02-11",
      "id": "101045",
      "original_text": "Einreichung neuer Dokumente\nHessen Amtsgericht Bad Homburg v.d.H. HRB 1585\nAlte Leipziger Versicherung Aktiengesellschaft – Oberursel (Taunus)",
      "type": "Einreichung neuer Dokumente",
      "state": "Hessen",
      "amtsgericht": "Amtsgericht Bad Homburg v.d.H.",
      "registernummer": "HRB 1585",
      "registerart": "HRB",
      "company_name": "Alte Leipziger Versicherung Aktiengesellschaft",
      "company_seat": "Oberursel (Taunus)",
      "details": "11.02.2025 (Bekanntmachungsdatum)\n\nHessen Amtsgericht Bad Homburg v.d.H. HRB 1585\nEinreichung neuer Dokumente\n\nAlte Leipziger Versicherung Aktiengesellschaft\nAktiengesellschaft\nOberursel (Taunus)\n\nDurch eine Änderung in den Personen der Aufsichtsratsmitglieder ist eine Liste der Mitglieder des Aufsichtsrates zum Handelsregister eingereicht worden."
    },
    {
      "date": "2025-02-11",
      "id": "101046",
      "original_text": "Sonstige Registerbekanntmachung\nHessen Amtsgericht Frankfurt am Main HRB 53462\nLagerbox Düsseldorf 2 GmbH – Frankfurt am Main",
      "type": "Sonstige Registerbekanntmachung",
      "state": "Hessen",
      "amtsgericht": "Amtsgericht Frankfurt am Main",
      "registernummer": "HRB 53462",
      "registerart": "HRB",
      "company_name": "Lagerbox Düsseldorf 2 GmbH",
      "company_seat": "Frankfurt am Main",
      "details": "11.02.2025 (Bekanntmachungsdatum)\n\nHessen Amtsgericht Frankfurt am Main HRB 53462\nSonstige Registerbekanntmachung 11.02.2025 (Eintragungsdatum)\n\nLagerbox Düsseldorf 2 GmbH\nGesellschaft mit beschränkter Haftung\nFrankfurt am Main\n\nDie Gesellschaft hat Gläubigern, deren Forderungen vor dieser Bekanntmachung begründet worden sind, Sicherheit zu leisten, soweit sie nicht Befriedigung verlangen können, wenn sie sich binnen sechs Monaten nach dieser Bekanntmachung zu diesem Zweck melden."
    },
    {
      "date": "2025-02-11",
      "id": "101047",
      "original_text": "Sonstige Registerbekanntmachung\nHessen Amtsgericht Kassel VR 5544\nKonflikthilfe Kassel e.V. – Fuldabrück",
      "type": "Sonstige Registerbekanntmachung",
      "state": "Hessen",
      "amtsgericht": "Amtsgericht Kassel",
      "registernummer": "VR 5544",
      "registerart": "VR",
      "company_name": "Konflikthilfe Kassel e.V.",
      "company_seat": "Fuldabrück",
      "details": "11.02.2025 (Bekanntmachungsdatum)\n\nHessen Amtsgericht Kassel VR 5544\nSonstige Registerbekanntmachung 11.02.2025 (Eintragungsdatum)\n\nKonflikthilfe Kassel e.V.\neingetragener Verein\nFuldabrück\n\nDer Verein ist aufgelöst."
    }
  ]
}