{
  "date": "2025-02-22",
  "date_of_scrape": "2025-02-23T04:03:36.257Z",
  "tool_version": "0.2.0",
  "number_of_announcements": 23,
  "announcements": [
    {
      "date": "2025-02-22",
      "id": "102012",
      "original_text": "Registerbekanntmachung nach dem Umwandlungsgesetz\nBayern Amtsgericht Fürth HRA 12516\nSIMBA-DICKIE-Vertriebs-GmbH & Co. KG – Fürth",
      "type": "Registerbekanntmachung nach dem Umwandlungsgesetz",
      "state": "Bayern",
      "amtsgericht": "Amtsgericht Fürth",
      "registernummer": "HRA 12516",
      "registerart": "HRA",
      "company_name": "SIMBA-DICKIE-Vertriebs-GmbH & Co. KG",
      "company_seat": "Fürth",
      "details": "22.02.2025 (Bekanntmachungsdatum)\n\nBayern Amtsgericht Fürth HRA 12516\nRegisterbekanntmachung nach dem Umwandlungsgesetz 21.02.2025 (Eintragungsdatum)\n\nSIMBA-DICKIE-Vertriebs-GmbH & Co. KG\nKommanditgesellschaft\nFürth\n\nDen Gläubigern des formwechselnden Rechtsträgers ist, wenn sie binnen sechs Monaten nach dem Tag, an dem die Eintragung des Formwechsels nach § 201 UmwG als bekannt gemacht gilt, ihren Anspruch nach Grund und Höhe in Textform anmelden, Sicherheit zu leisten, soweit sie nicht Befriedigung verlangen können. Dieses Recht steht den Gläubigern jedoch nur zu, wenn sie glaubhaft machen, dass durch den Formwechsel die Erfüllung ihrer Forderung gefährdet wird."
    },
    {
      "date": "2025-02-22",
      "id": "102013",
      "original_text": "Registerbekanntmachung nach dem Umwandlungsgesetz\nBayern Amtsgericht München HRB 233862\nSpängler GmbH – Unterschleißheim",
      "type": "Registerbekanntmachung nach dem Umwandlungsgesetz",
      "state": "Bayern",
      "amtsgericht": "Amtsgericht München",
      "registernummer": "HRB 233862",
      "registerart": "HRB",
      "company_name": "Spängler GmbH",
      "company_seat": "Unterschleißheim",
      "details": "22.02.2025 (Bekanntmachungsdatum)\n\nBayern Amtsgericht München HRB 233862\nRegisterbekanntmachung nach dem Umwandlungsgesetz 21.02.2025 (Eintragungsdatum)\n\nSpängler GmbH\nGesellschaft mit beschränkter Haftung\nUnterschleißheim\n\nDen Gläubigern der an der Verschmelzung beteiligten Rechtsträger ist, wenn sie binnen sechs Monaten nach dem Tag, an dem die Eintragung der Verschmelzung in das Register des Sitzes desjenigen Rechtsträgers, dessen Gläubiger sie sind, nach § 19 Abs. 3 UmwG als bekannt gemacht gilt, ihren Anspruch nach Grund und Höhe in Textform anmelden, Sicherheit zu leisten, soweit sie nicht Befriedigung verlangen können. Dieses Recht steht den Gläubigern jedoch nur zu, wenn sie glaubhaft machen, dass durch die Verschmelzung die Erfüllung ihrer Forderung gefährdet wird."
    },
    {
      "date": "2025-02-22",
      "id": "102014",
      "original_text": "Registerbekanntmachung nach dem Umwandlungsgesetz\nBayern Amtsgericht München HRB 87386\nEOS GmbH Electro Optical Systems – Krailling",
      "type": "Registerbekanntmachung nach dem Umwandlungsgesetz",
      "state": "Bayern",
      "amtsgericht": "Amtsgericht München",
      "registernummer": "HRB 87386",
      "registerart": "HRB",
      "company_name": "EOS GmbH Electro Optical Systems",
      "company_seat": "Krailling",
      "details": "22.02.2025 (Bekanntmachungsdatum)\n\nBayern Amtsgericht München HRB 87386\nRegisterbekanntmachung nach dem Umwandlungsgesetz 21.02.2025 (Eintragungsdatum)\n\nEOS GmbH Electro Optical Systems\nGesellschaft mit beschränkter Haftung\nKrailling\n\nDen Gläubigern der an der Verschmelzung beteiligten Rechtsträger ist, wenn sie binnen sechs Monaten nach dem Tag, an dem die Eintragung der Verschmelzung in das Register des Sitzes desjenigen Rechtsträgers, dessen Gläubiger sie sind, nach § 19 Abs. 3 UmwG als bekannt gemacht gilt, ihren Anspruch nach Grund und Höhe in Textform anmelden, Sicherheit zu leisten, soweit sie nicht Befriedigung verlangen können. Dieses Recht steht den Gläubigern jedoch nur zu, wenn sie glaubhaft machen, dass durch die Verschmelzung die Erfüllung ihrer Forderung gefährdet wird."
    },
    {
      "date": "2025-02-22",
      "id": "102015",
      "original_text": "Registerbekanntmachung nach dem Umwandlungsgesetz\nBayern Amtsgericht München HRA 42101\nDorst Technologies GmbH & Co. KG – Kochel",
      "type": "Registerbekanntmachung nach dem Umwandlungsgesetz",
      "state": "Bayern",
      "amtsgericht": "Amtsgericht München",
      "registernummer": "HRA 42101",
      "registerart": "HRA",
      "company_name": "Dorst Technologies GmbH & Co. KG",
      "company_seat": "Kochel",
      "details": "22.02.2025 (Bekanntmachungsdatum)\n\nBayern Amtsgericht München HRA 42101\nRegisterbekanntmachung nach dem Umwandlungsgesetz 21.02.2025 (Eintragungsdatum)\n\nDorst Technologies GmbH & Co. KG\nKommanditgesellschaft\nKochel\n\nDen Gläubigern des formwechselnden Rechtsträgers ist, wenn sie binnen sechs Monaten nach dem Tag, an dem die Eintragung des Formwechsels nach § 201 UmwG als bekannt gemacht gilt, ihren Anspruch nach Grund und Höhe in Textform anmelden, Sicherheit zu leisten, soweit sie nicht Befriedigung verlangen können. Dieses Recht steht den Gläubigern jedoch nur zu, wenn sie glaubhaft machen, dass durch den Formwechsel die Erfüllung ihrer Forderung gefährdet wird."
    },
    {
      "date": "2025-02-22",
      "id": "102016",
      "original_text": "Registerbekanntmachung nach dem Umwandlungsgesetz\nBayern Amtsgericht München HRB 178590\nZEDORA 48 Verwaltung GmbH – München",
      "type": "Registerbekanntmachung nach dem Umwandlungsgesetz",
      "state": "Bayern",
      "amtsgericht": "Amtsgericht München",
      "registernummer": "HRB 178590",
      "registerart": "HRB",
      "company_name": "ZEDORA 48 Verwaltung GmbH",
      "company_seat": "München",
      "details": "22.02.2025 (Bekanntmachungsdatum)\n\nBayern Amtsgericht München HRB 178590\nRegisterbekanntmachung nach dem Umwandlungsgesetz 21.02.2025 (Eintragungsdatum)\n\nZEDORA 48 Verwaltung GmbH\nGesellschaft mit beschränkter Haftung\nMünchen\n\nDen Gläubigern der an der Verschmelzung beteiligten Rechtsträger ist, wenn sie binnen sechs Monaten nach dem Tag, an dem die Eintragung der Verschmelzung in das Register des Sitzes desjenigen Rechtsträgers, dessen Gläubiger sie sind, nach § 19 Abs. 3 UmwG als bekannt gemacht gilt, ihren Anspruch nach Grund und Höhe in Textform anmelden, Sicherheit zu leisten, soweit sie nicht Befriedigung verlangen können. Dieses Recht steht den Gläubigern jedoch nur zu, wenn sie glaubhaft machen, dass durch die Verschmelzung die Erfüllung ihrer Forderung gefährdet wird."
    },
    {
      "date": "2025-02-22",
      "id": "102017",
      "original_text": "Registerbekanntmachung nach dem Umwandlungsgesetz\nBayern Amtsgericht München HRB 298588\nMadl & Maetzig Consulting GmbH – München",
      "type": "Registerbekanntmachung nach dem Umwandlungsgesetz",
      "state": "Bayern",
      "amtsgericht": "Amtsgericht München",
      "registernummer": "HRB 298588",
      "registerart": "HRB",
      "company_name": "Madl & Maetzig Consulting GmbH",
      "company_seat": "München",
      "details": "22.02.2025 (Bekanntmachungsdatum)\n\nBayern Amtsgericht München HRB 298588\nRegisterbekanntmachung nach dem Umwandlungsgesetz 21.02.2025 (Eintragungsdatum)\n\nMadl & Maetzig Consulting GmbH\nGesellschaft mit beschränkter Haftung\nMünchen\n\nDen Gläubigern der an der Ausgliederung beteiligten Rechtsträger ist, wenn sie binnen sechs Monaten nach dem Tag, an dem die Eintragung der Ausgliederung in das Register des Sitzes desjenigen Rechtsträgers, dessen Gläubiger sie sind, nach §§ 125, 19 Abs. 3 UmwG als bekannt gemacht gilt, ihren Anspruch nach Grund und Höhe in Textform anmelden, Sicherheit zu leisten, soweit sie nicht Befriedigung verlangen können. Dieses Recht steht den Gläubigern jedoch nur zu, wenn sie glaubhaft machen, dass durch die Ausgliederung die Erfüllung ihrer Forderung gefährdet wird."
    },
    {
      "date": "2025-02-22",
      "id": "102018",
      "original_text": "Registerbekanntmachung nach dem Umwandlungsgesetz\nBayern Amtsgericht München HRB 141115\nSecurifix GmbH – Karlsfeld",
      "type": "Registerbekanntmachung nach dem Umwandlungsgesetz",
      "state": "Bayern",
      "amtsgericht": "Amtsgericht München",
      "registernummer": "HRB 141115",
      "registerart": "HRB",
      "company_name": "Securifix GmbH",
      "company_seat": "Karlsfeld",
      "details": "22.02.2025 (Bekanntmachungsdatum)\n\nBayern Amtsgericht München HRB 141115\nRegisterbekanntmachung nach dem Umwandlungsgesetz 21.02.2025 (Eintragungsdatum)\n\nSecurifix GmbH\nGesellschaft mit beschränkter Haftung\nKarlsfeld\n\nDen Gläubigern der an der Verschmelzung beteiligten Rechtsträger ist, wenn sie binnen sechs Monaten nach dem Tag, an dem die Eintragung der Verschmelzung in das Register des Sitzes desjenigen Rechtsträgers, dessen Gläubiger sie sind, nach § 19 Abs. 3 UmwG als bekannt gemacht gilt, ihren Anspruch nach Grund und Höhe in Textform anmelden, Sicherheit zu leisten, soweit sie nicht Befriedigung verlangen können. Dieses Recht steht den Gläubigern jedoch nur zu, wenn sie glaubhaft machen, dass durch die Verschmelzung die Erfüllung ihrer Forderung gefährdet wird."
    },
    {
      "date": "2025-02-22",
      "id": "102019",
      "original_text": "Einreichung neuer Dokumente\nBayern Amtsgericht München HRB 226203\nexccon AG – München",
      "type": "Einreichung neuer Dokumente",
      "state": "Bayern",
      "amtsgericht": "Amtsgericht München",
      "registernummer": "HRB 226203",
      "registerart": "HRB",
      "company_name": "exccon AG",
      "company_seat": "München",
      "details": "22.02.2025 (Bekanntmachungsdatum)\n\nBayern Amtsgericht München HRB 226203\nEinreichung neuer Dokumente 21.02.2025 (Eintragungsdatum)\n\nexccon AG\nAktiengesellschaft\nMünchen\n\nDem Amtsgericht München -Registergericht- ist eine Liste der Mitglieder des Aufsichtsrats eingereicht worden, § 106 AktG."
    },
    {
      "date": "2025-02-22",
      "id": "102020",
      "original_text": "Registerbekanntmachung nach dem Umwandlungsgesetz\nBayern Amtsgericht München HRB 249375\nSHL Telemedizin GmbH – München",
      "type": "Registerbekanntmachung nach dem Umwandlungsgesetz",
      "state": "Bayern",
      "amtsgericht": "Amtsgericht München",
      "registernummer": "HRB 249375",
      "registerart": "HRB",
      "company_name": "SHL Telemedizin GmbH",
      "company_seat": "München",
      "details": "22.02.2025 (Bekanntmachungsdatum)\n\nBayern Amtsgericht München HRB 249375\nRegisterbekanntmachung nach dem Umwandlungsgesetz 21.02.2025 (Eintragungsdatum)\n\nSHL Telemedizin GmbH\nGesellschaft mit beschränkter Haftung\nMünchen\n\nDen Gläubigern der an der Verschmelzung beteiligten Rechtsträger ist, wenn sie binnen sechs Monaten nach dem Tag, an dem die Eintragung der Verschmelzung in das Register des Sitzes desjenigen Rechtsträgers, dessen Gläubiger sie sind, nach § 19 Abs. 3 UmwG als bekannt gemacht gilt, ihren Anspruch nach Grund und Höhe in Textform anmelden, Sicherheit zu leisten, soweit sie nicht Befriedigung verlangen können. Dieses Recht steht den Gläubigern jedoch nur zu, wenn sie glaubhaft machen, dass durch die Verschmelzung die Erfüllung ihrer Forderung gefährdet wird."
    },
    {
      "date": "2025-02-22",
      "id": "102021",
      "original_text": "Sonstige Registerbekanntmachung\nBayern Amtsgericht München HRB 152835\nSportec Solutions AG – München",
      "type": "Sonstige Registerbekanntmachung",
      "state": "Bayern",
      "amtsgericht": "Amtsgericht München",
      "registernummer": "HRB 152835",
      "registerart": "HRB",
      "company_name": "Sportec Solutions AG",
      "company_seat": "München",
      "details": "22.02.2025 (Bekanntmachungsdatum)\n\nBayern Amtsgericht München HRB 152835\nSonstige Registerbekanntmachung\n\nSportec Solutions AG\nAktiengesellschaft\nMünchen\n\nDem Amtsgericht München -Registergericht- ist eine Liste der Mitglieder des Aufsichtsrats eingereicht worden, § 106 AktG."
    },
    {
      "date": "2025-02-22",
      "id": "102022",
      "original_text": "Registerbekanntmachung nach dem Umwandlungsgesetz\nBayern Amtsgericht München HRB 162433\nGesellschaft für Patientenhilfe DGP mbH – München",
      "type": "Registerbekanntmachung nach dem Umwandlungsgesetz",
      "state": "Bayern",
      "amtsgericht": "Amtsgericht München",
      "registernummer": "HRB 162433",
      "registerart": "HRB",
      "company_name": "Gesellschaft für Patientenhilfe DGP mbH",
      "company_seat": "München",
      "details": "22.02.2025 (Bekanntmachungsdatum)\n\nBayern Amtsgericht München HRB 162433\nRegisterbekanntmachung nach dem Umwandlungsgesetz 21.02.2025 (Eintragungsdatum)\n\nGesellschaft für Patientenhilfe DGP mbH\nGesellschaft mit beschränkter Haftung\nMünchen\n\nDen Gläubigern der an der Verschmelzung beteiligten Rechtsträger ist, wenn sie binnen sechs Monaten nach dem Tag, an dem die Eintragung der Verschmelzung in das Register des Sitzes desjenigen Rechtsträgers, dessen Gläubiger sie sind, nach § 19 Abs. 3 UmwG als bekannt gemacht gilt, ihren Anspruch nach Grund und Höhe in Textform anmelden, Sicherheit zu leisten, soweit sie nicht Befriedigung verlangen können. Dieses Recht steht den Gläubigern jedoch nur zu, wenn sie glaubhaft machen, dass durch die Verschmelzung die Erfüllung ihrer Forderung gefährdet wird."
    },
    {
      "date": "2025-02-22",
      "id": "102023",
      "original_text": "Löschungsankündigung\nBayern Amtsgericht München HRB 222046\nProjekt-Haus UG (haftungsbeschränkt) – München",
      "type": "Löschungsankündigung",
      "state": "Bayern",
      "amtsgericht": "Amtsgericht München",
      "registernummer": "HRB 222046",
      "registerart": "HRB",
      "company_name": "Projekt-Haus UG (haftungsbeschränkt)",
      "company_seat": "München",
      "details": "22.02.2025 (Bekanntmachungsdatum)\n\nBayern Amtsgericht München HRB 222046\nLöschungsankündigung 21.02.2025 (Eintragungsdatum)\n\nProjekt-Haus UG (haftungsbeschränkt)\nGesellschaft mit beschränkter Haftung\nMünchen\n\nDas Registergericht beabsichtigt, die im Handelsregister eingetragene Gesellschaft wegen Vermögenslosigkeit von Amts wegen nach § 394 FamFG zu löschen. Die Frist zur Erhebung eines Widerspruchs ist auf drei Monate festgesetzt."
    },
    {
      "date": "2025-02-22",
      "id": "102024",
      "original_text": "Registerbekanntmachung nach dem Umwandlungsgesetz\nBayern Amtsgericht Fürth HRB 8058\nSIMBA-DICKIE-Vertriebs-GmbH – Fürth",
      "type": "Registerbekanntmachung nach dem Umwandlungsgesetz",
      "state": "Bayern",
      "amtsgericht": "Amtsgericht Fürth",
      "registernummer": "HRB 8058",
      "registerart": "HRB",
      "company_name": "SIMBA-DICKIE-Vertriebs-GmbH",
      "company_seat": "Fürth",
      "details": "22.02.2025 (Bekanntmachungsdatum)\n\nBayern Amtsgericht Fürth HRB 8058\nRegisterbekanntmachung nach dem Umwandlungsgesetz 21.02.2025 (Eintragungsdatum)\n\nSIMBA-DICKIE-Vertriebs-GmbH\nGesellschaft mit beschränkter Haftung\nFürth\n\nDen Gläubigern des formwechselnden Rechtsträgers ist, wenn sie binnen sechs Monaten nach dem Tag, an dem die Eintragung des Formwechsels nach § 201 UmwG als bekannt gemacht gilt, ihren Anspruch nach Grund und Höhe in Textform anmelden, Sicherheit zu leisten, soweit sie nicht Befriedigung verlangen können. Dieses Recht steht den Gläubigern jedoch nur zu, wenn sie glaubhaft machen, dass durch den Formwechsel die Erfüllung ihrer Forderung gefährdet wird."
    },
    {
      "date": "2025-02-22",
      "id": "102025",
      "original_text": "Löschungsankündigung\nBayern Amtsgericht Würzburg HRB 10906\nINDAIN UG (haftungsbeschränkt) – Eibelstadt",
      "type": "Löschungsankündigung",
      "state": "Bayern",
      "amtsgericht": "Amtsgericht Würzburg",
      "registernummer": "HRB 10906",
      "registerart": "HRB",
      "company_name": "INDAIN UG (haftungsbeschränkt)",
      "company_seat": "Eibelstadt",
      "details": "22.02.2025 (Bekanntmachungsdatum)\n\nBayern Amtsgericht Würzburg HRB 10906\nLöschungsankündigung\n\nINDAIN UG (haftungsbeschränkt)\nGesellschaft mit beschränkter Haftung\nEibelstadt\n\nDas Registergericht beabsichtigt, die im Handelsregister eingetragene Gesellschaft wegen Vermögenslosigkeit von Amts wegen nach § 394 FamFG zu löschen.\nDie Widerspruchsfrist wird auf 3 Monate festgesetzt."
    },
    {
      "date": "2025-02-22",
      "id": "102026",
      "original_text": "Einreichung neuer Dokumente\nBayern Amtsgericht Nürnberg HRB 613\nEvangelisches Siedlungswerk in Bayern GmbH – Nürnberg",
      "type": "Einreichung neuer Dokumente",
      "state": "Bayern",
      "amtsgericht": "Amtsgericht Nürnberg",
      "registernummer": "HRB 613",
      "registerart": "HRB",
      "company_name": "Evangelisches Siedlungswerk in Bayern GmbH",
      "company_seat": "Nürnberg",
      "details": "22.02.2025 (Bekanntmachungsdatum)\n\nBayern Amtsgericht Nürnberg HRB 613\nEinreichung neuer Dokumente 21.02.2025 (Eintragungsdatum)\n\nEvangelisches Siedlungswerk in Bayern GmbH\nGesellschaft mit beschränkter Haftung\nNürnberg\n\nDem #Re.Name ist eine Liste der Mitglieder des Aufsichtsrats eingereicht worden, § 52 Abs. 3 S. 2 GmbHG."
    },
    {
      "date": "2025-02-22",
      "id": "102027",
      "original_text": "Sonstige Registerbekanntmachung\nBayern Amtsgericht Nürnberg HRB 21087\nKrankenhaus Rummelsberg GmbH – Schwarzenbruck",
      "type": "Sonstige Registerbekanntmachung",
      "state": "Bayern",
      "amtsgericht": "Amtsgericht Nürnberg",
      "registernummer": "HRB 21087",
      "registerart": "HRB",
      "company_name": "Krankenhaus Rummelsberg GmbH",
      "company_seat": "Schwarzenbruck",
      "details": "22.02.2025 (Bekanntmachungsdatum)\n\nBayern Amtsgericht Nürnberg HRB 21087\nSonstige Registerbekanntmachung\n\nKrankenhaus Rummelsberg GmbH\nGesellschaft mit beschränkter Haftung\nSchwarzenbruck\n\nDem Amtsgericht Nürnberg -Registergericht- ist eine Liste der Mitglieder des Aufsichtsrats eingereicht worden, § 52 Abs. 3 S. 2 GmbHG."
    },
    {
      "date": "2025-02-22",
      "id": "102028",
      "original_text": "Registerbekanntmachung nach dem Umwandlungsgesetz\nBayern Amtsgericht München HRB 209144\nalmeda GmbH – München",
      "type": "Registerbekanntmachung nach dem Umwandlungsgesetz",
      "state": "Bayern",
      "amtsgericht": "Amtsgericht München",
      "registernummer": "HRB 209144",
      "registerart": "HRB",
      "company_name": "almeda GmbH",
      "company_seat": "München",
      "details": "22.02.2025 (Bekanntmachungsdatum)\n\nBayern Amtsgericht München HRB 209144\nRegisterbekanntmachung nach dem Umwandlungsgesetz 21.02.2025 (Eintragungsdatum)\n\nalmeda GmbH\nGesellschaft mit beschränkter Haftung\nMünchen\n\nDen Gläubigern der an der Verschmelzung beteiligten Rechtsträger ist, wenn sie binnen sechs Monaten nach dem Tag, an dem die Eintragung der Verschmelzung in das Register des Sitzes desjenigen Rechtsträgers, dessen Gläubiger sie sind, nach § 19 Abs. 3 UmwG als bekannt gemacht gilt, ihren Anspruch nach Grund und Höhe in Textform anmelden, Sicherheit zu leisten, soweit sie nicht Befriedigung verlangen können. Dieses Recht steht den Gläubigern jedoch nur zu, wenn sie glaubhaft machen, dass durch die Verschmelzung die Erfüllung ihrer Forderung gefährdet wird."
    },
    {
      "date": "2025-02-22",
      "id": "102029",
      "original_text": "Registerbekanntmachung nach dem Umwandlungsgesetz\nBayern Amtsgericht München HRA 120228\nOLOID Solution LLC & Co. KG – München",
      "type": "Registerbekanntmachung nach dem Umwandlungsgesetz",
      "state": "Bayern",
      "amtsgericht": "Amtsgericht München",
      "registernummer": "HRA 120228",
      "registerart": "HRA",
      "company_name": "OLOID Solution LLC & Co. KG",
      "company_seat": "München",
      "details": "22.02.2025 (Bekanntmachungsdatum)\n\nBayern Amtsgericht München HRA 120228\nRegisterbekanntmachung nach dem Umwandlungsgesetz 21.02.2025 (Eintragungsdatum)\n\nOLOID Solution LLC & Co. KG\nKommanditgesellschaft\nMünchen\n\nDen Gläubigern der an der Verschmelzung beteiligten Rechtsträger ist, wenn sie binnen sechs Monaten nach dem Tag, an dem die Eintragung der Verschmelzung in das Register des Sitzes desjenigen Rechtsträgers, dessen Gläubiger sie sind, nach § 19 Abs. 3 UmwG als bekannt gemacht gilt, ihren Anspruch nach Grund und Höhe in Textform anmelden, Sicherheit zu leisten, soweit sie nicht Befriedigung verlangen können. Dieses Recht steht den Gläubigern jedoch nur zu, wenn sie glaubhaft machen, dass durch die Verschmelzung die Erfüllung ihrer Forderung gefährdet wird."
    },
    {
      "date": "2025-02-22",
      "id": "102030",
      "original_text": "Registerbekanntmachung nach dem Umwandlungsgesetz\nBayern Amtsgericht München HRB 201526\nOSRAM GmbH – München",
      "type": "Registerbekanntmachung nach dem Umwandlungsgesetz",
      "state": "Bayern",
      "amtsgericht": "Amtsgericht München",
      "registernummer": "HRB 201526",
      "registerart": "HRB",
      "company_name": "OSRAM GmbH",
      "company_seat": "München",
      "details": "22.02.2025 (Bekanntmachungsdatum)\n\nBayern Amtsgericht München HRB 201526\nRegisterbekanntmachung nach dem Umwandlungsgesetz 21.02.2025 (Eintragungsdatum)\n\nOSRAM GmbH\nGesellschaft mit beschränkter Haftung\nMünchen\n\nDen Gläubigern der an der Verschmelzung beteiligten Rechtsträger ist, wenn sie binnen sechs Monaten nach dem Tag, an dem die Eintragung der Verschmelzung in das Register des Sitzes desjenigen Rechtsträgers, dessen Gläubiger sie sind, nach § 19 Abs. 3 UmwG als bekannt gemacht gilt, ihren Anspruch nach Grund und Höhe in Textform anmelden, Sicherheit zu leisten, soweit sie nicht Befriedigung verlangen können. Dieses Recht steht den Gläubigern jedoch nur zu, wenn sie glaubhaft machen, dass durch die Verschmelzung die Erfüllung ihrer Forderung gefährdet wird."
    },
    {
      "date": "2025-02-22",
      "id": "102031",
      "original_text": "Registerbekanntmachung nach dem Umwandlungsgesetz\nBayern Amtsgericht Deggendorf HRA 3675\nGroß & Vollmar OHG Fitnessstudio – Osterhofen",
      "type": "Registerbekanntmachung nach dem Umwandlungsgesetz",
      "state": "Bayern",
      "amtsgericht": "Amtsgericht Deggendorf",
      "registernummer": "HRA 3675",
      "registerart": "HRA",
      "company_name": "Groß & Vollmar OHG Fitnessstudio",
      "company_seat": "Osterhofen",
      "details": "22.02.2025 (Bekanntmachungsdatum)\n\nBayern Amtsgericht Deggendorf HRA 3675\nRegisterbekanntmachung nach dem Umwandlungsgesetz 21.02.2025 (Eintragungsdatum)\n\nGroß & Vollmar OHG Fitnessstudio\nOffene Handelsgesellschaft\nOsterhofen\n\nDen Gläubigern des formwechselnden Rechtsträgers ist, wenn sie binnen sechs Monaten nach dem Tag, an dem die Eintragung des Formwechsels nach § 201 UmwG als bekannt gemacht gilt, ihren Anspruch nach Grund und Höhe in Textform anmelden, Sicherheit zu leisten, soweit sie nicht Befriedigung verlangen können. Dieses Recht steht den Gläubigern jedoch nur zu, wenn sie glaubhaft machen, dass durch den Formwechsel die Erfüllung ihrer Forderung gefährdet wird."
    },
    {
      "date": "2025-02-22",
      "id": "102032",
      "original_text": "Registerbekanntmachung nach dem Umwandlungsgesetz\nBayern Amtsgericht München HRB 292928\nOpus Holding GmbH – München",
      "type": "Registerbekanntmachung nach dem Umwandlungsgesetz",
      "state": "Bayern",
      "amtsgericht": "Amtsgericht München",
      "registernummer": "HRB 292928",
      "registerart": "HRB",
      "company_name": "Opus Holding GmbH",
      "company_seat": "München",
      "details": "22.02.2025 (Bekanntmachungsdatum)\n\nBayern Amtsgericht München HRB 292928\nRegisterbekanntmachung nach dem Umwandlungsgesetz 21.02.2025 (Eintragungsdatum)\n\nOpus Holding GmbH\nGesellschaft mit beschränkter Haftung\nMünchen\n\nDen Gläubigern der an der Verschmelzung beteiligten Rechtsträger ist, wenn sie binnen sechs Monaten nach dem Tag, an dem die Eintragung der Verschmelzung in das Register des Sitzes desjenigen Rechtsträgers, dessen Gläubiger sie sind, nach § 19 Abs. 3 UmwG als bekannt gemacht gilt, ihren Anspruch nach Grund und Höhe in Textform anmelden, Sicherheit zu leisten, soweit sie nicht Befriedigung verlangen können. Dieses Recht steht den Gläubigern jedoch nur zu, wenn sie glaubhaft machen, dass durch die Verschmelzung die Erfüllung ihrer Forderung gefährdet wird."
    },
    {
      "date": "2025-02-22",
      "id": "102033",
      "original_text": "Einreichung neuer Dokumente\nBayern Amtsgericht München HRB 280734\nmsg health AG – Ismaning",
      "type": "Einreichung neuer Dokumente",
      "state": "Bayern",
      "amtsgericht": "Amtsgericht München",
      "registernummer": "HRB 280734",
      "registerart": "HRB",
      "company_name": "msg health AG",
      "company_seat": "Ismaning",
      "details": "22.02.2025 (Bekanntmachungsdatum)\n\nBayern Amtsgericht München HRB 280734\nEinreichung neuer Dokumente\n\nmsg health AG\nAktiengesellschaft\nIsmaning\n\nDem Amtsgericht München -Registergericht- ist eine Liste der Mitglieder des Aufsichtsrats eingereicht worden, § 106 AktG."
    },
    {
      "date": "2025-02-22",
      "id": "102034",
      "original_text": "Löschungsankündigung\nNiedersachsen Amtsgericht Osnabrück HRB 219102\nNH Performance GmbH – Bad Bentheim",
      "type": "Löschungsankündigung",
      "state": "Niedersachsen",
      "amtsgericht": "Amtsgericht Osnabrück",
      "registernummer": "HRB 219102",
      "registerart": "HRB",
      "company_name": "NH Performance GmbH",
      "company_seat": "Bad Bentheim",
      "details": "22.02.2025 (Bekanntmachungsdatum)\n\nNiedersachsen Amtsgericht Osnabrück HRB 219102\nLöschungsankündigung\n\nNH Performance GmbH\nGesellschaft mit beschränkter Haftung\nBad Bentheim\n\nDas Registergericht beabsichtigt, die Gesellschaft von Amts wegen nach § 394 FamFG wegen Vermögenslosigkeit zu löschen. Die Frist zur Erhebung eines Widerspruchs ist auf 1 Monat ab dieser Registerbekanntmachung festgesetzt."
    }
  ]
}