{
  "date": "2025-02-10",
  "date_of_scrape": "2025-02-11T09:44:27.698Z",
  "tool_version": "0.2.0",
  "number_of_announcements": 94,
  "announcements": [
    {
      "date": "2025-02-10",
      "id": "100847",
      "original_text": "Löschungsankündigung\nBerlin Amtsgericht Berlin (Charlottenburg) HRB 216723\nIF Immo Invest GmbH – Berlin",
      "type": "Löschungsankündigung",
      "state": "Berlin",
      "amtsgericht": "Amtsgericht Berlin (Charlottenburg)",
      "registernummer": "HRB 216723",
      "registerart": "HRB",
      "company_name": "IF Immo Invest GmbH",
      "company_seat": "Berlin",
      "details": "10.02.2025 (Bekanntmachungsdatum)\n\nBerlin Amtsgericht Berlin (Charlottenburg) HRB 216723\nLöschungsankündigung\n\nIF Immo Invest GmbH\nGesellschaft mit beschränkter Haftung\nBerlin\n\nBei der nachstehenden Gesellschaft wird das Amtslöschungsverfahren gemäß § 394 FamFG eingeleitet. Widerspruchsfrist 6 Wochen"
    },
    {
      "date": "2025-02-10",
      "id": "100848",
      "original_text": "Einreichung neuer Dokumente\nBaden-Württemberg Amtsgericht Stuttgart HRB 748803\nDorfkäserei Geifertshofen AG – Bühlerzell",
      "type": "Einreichung neuer Dokumente",
      "state": "Baden-Württemberg",
      "amtsgericht": "Amtsgericht Stuttgart",
      "registernummer": "HRB 748803",
      "registerart": "HRB",
      "company_name": "Dorfkäserei Geifertshofen AG",
      "company_seat": "Bühlerzell",
      "details": "10.02.2025 (Bekanntmachungsdatum)\n\nBaden-Württemberg Amtsgericht Stuttgart HRB 748803\nEinreichung neuer Dokumente 10.02.2025 (Eintragungsdatum)\n\nDorfkäserei Geifertshofen AG\nAktiengesellschaft\nBühlerzell\n\nDie Gesellschaft hat am 14.01.2025 die Liste über die Zusammensetzung des Aufsichtsrats zum Handelsregister eingereicht."
    },
    {
      "date": "2025-02-10",
      "id": "100849",
      "original_text": "Löschungsankündigung\nBrandenburg Amtsgericht Potsdam HRB 31120\nWikri Service GmbH – Zossen",
      "type": "Löschungsankündigung",
      "state": "Brandenburg",
      "amtsgericht": "Amtsgericht Potsdam",
      "registernummer": "HRB 31120",
      "registerart": "HRB",
      "company_name": "Wikri Service GmbH",
      "company_seat": "Zossen",
      "details": "10.02.2025 (Bekanntmachungsdatum)\n\nBrandenburg Amtsgericht Potsdam HRB 31120\nLöschungsankündigung\n\nWikri Service GmbH\nGesellschaft mit beschränkter Haftung\nZossen\n\nBei der nachstehenden Gesellschaft wird das Amtslöschungsverfahren gemäß § 394 FamFG eingeleitet. Widerspruchsfrrist: 8 Wochen."
    },
    {
      "date": "2025-02-10",
      "id": "100850",
      "original_text": "Einreichung neuer Dokumente\nSachsen-Anhalt Amtsgericht Stendal HRB 1483\nWohnungsbaugesellschaft mbH Gardelegen – Gardelegen",
      "type": "Einreichung neuer Dokumente",
      "state": "Sachsen-Anhalt",
      "amtsgericht": "Amtsgericht Stendal",
      "registernummer": "HRB 1483",
      "registerart": "HRB",
      "company_name": "Wohnungsbaugesellschaft mbH Gardelegen",
      "company_seat": "Gardelegen",
      "details": "10.02.2025 (Bekanntmachungsdatum)\n\nSachsen-Anhalt Amtsgericht Stendal HRB 1483\nEinreichung neuer Dokumente\n\nWohnungsbaugesellschaft mbH Gardelegen\nGesellschaft mit beschränkter Haftung\nGardelegen\n\nEine Liste der Mitglieder des Aufsichtsrates wurde zum Handelsregister eingereicht."
    },
    {
      "date": "2025-02-10",
      "id": "100851",
      "original_text": "Einreichung neuer Dokumente\nBaden-Württemberg Amtsgericht Mannheim HRB 728857\nMing Le Sports AG – Heidelberg",
      "type": "Einreichung neuer Dokumente",
      "state": "Baden-Württemberg",
      "amtsgericht": "Amtsgericht Mannheim",
      "registernummer": "HRB 728857",
      "registerart": "HRB",
      "company_name": "Ming Le Sports AG",
      "company_seat": "Heidelberg",
      "details": "10.02.2025 (Bekanntmachungsdatum)\n\nBaden-Württemberg Amtsgericht Mannheim HRB 728857\nEinreichung neuer Dokumente\n\nMing Le Sports AG\nAktiengesellschaft\nHeidelberg\n\nDie Gesellschaft hat am 07.02.2025 die Liste über die Zusammensetzung des Aufsichtsrats zum Handelsregister eingereicht."
    },
    {
      "date": "2025-02-10",
      "id": "100852",
      "original_text": "Einreichung neuer Dokumente\nBaden-Württemberg Amtsgericht Mannheim HRB 202374\nKlinikum Mittelbaden gGmbH – Baden-Baden",
      "type": "Einreichung neuer Dokumente",
      "state": "Baden-Württemberg",
      "amtsgericht": "Amtsgericht Mannheim",
      "registernummer": "HRB 202374",
      "registerart": "HRB",
      "company_name": "Klinikum Mittelbaden gGmbH",
      "company_seat": "Baden-Baden",
      "details": "10.02.2025 (Bekanntmachungsdatum)\n\nBaden-Württemberg Amtsgericht Mannheim HRB 202374\nEinreichung neuer Dokumente\n\nKlinikum Mittelbaden gGmbH\nGesellschaft mit beschränkter Haftung\nBaden-Baden\n\nDie Gesellschaft hat am 07.02.2025 die Liste über die Zusammensetzung des Aufsichtsrats zum Handelsregister eingereicht."
    },
    {
      "date": "2025-02-10",
      "id": "100853",
      "original_text": "Einreichung neuer Dokumente\nBaden-Württemberg Amtsgericht Stuttgart HRB 340975\nKrankenhaus-Service GmbH Schwarzwald – Nagold",
      "type": "Einreichung neuer Dokumente",
      "state": "Baden-Württemberg",
      "amtsgericht": "Amtsgericht Stuttgart",
      "registernummer": "HRB 340975",
      "registerart": "HRB",
      "company_name": "Krankenhaus-Service GmbH Schwarzwald",
      "company_seat": "Nagold",
      "details": "10.02.2025 (Bekanntmachungsdatum)\n\nBaden-Württemberg Amtsgericht Stuttgart HRB 340975\nEinreichung neuer Dokumente\n\nKrankenhaus-Service GmbH Schwarzwald\nGesellschaft mit beschränkter Haftung\nNagold\n\nDie Gesellschaft hat am 08.01.2025 die Liste über die Zusammensetzung des Aufsichtsrats zum Handelsregister eingereicht."
    },
    {
      "date": "2025-02-10",
      "id": "100854",
      "original_text": "Einreichung neuer Dokumente\nBaden-Württemberg Amtsgericht Mannheim HRB 100145\nAlbtal-Verkehrs-Gesellschaft mbH – Karlsruhe",
      "type": "Einreichung neuer Dokumente",
      "state": "Baden-Württemberg",
      "amtsgericht": "Amtsgericht Mannheim",
      "registernummer": "HRB 100145",
      "registerart": "HRB",
      "company_name": "Albtal-Verkehrs-Gesellschaft mbH",
      "company_seat": "Karlsruhe",
      "details": "10.02.2025 (Bekanntmachungsdatum)\n\nBaden-Württemberg Amtsgericht Mannheim HRB 100145\nEinreichung neuer Dokumente\n\nAlbtal-Verkehrs-Gesellschaft mbH\nGesellschaft mit beschränkter Haftung\nKarlsruhe\n\nDie Gesellschaft hat am 07.02.2025 die Liste über die Zusammensetzung des Aufsichtsrats zum Handelsregister eingereicht."
    },
    {
      "date": "2025-02-10",
      "id": "100855",
      "original_text": "Registerbekanntmachung nach dem Umwandlungsgesetz\nSchleswig-Holstein Amtsgericht Kiel HRA 12550\nAutohaus Fischer GmbH & Co. KG – Kaltenkirchen",
      "type": "Registerbekanntmachung nach dem Umwandlungsgesetz",
      "state": "Schleswig-Holstein",
      "amtsgericht": "Amtsgericht Kiel",
      "registernummer": "HRA 12550",
      "registerart": "HRA",
      "company_name": "Autohaus Fischer GmbH & Co. KG",
      "company_seat": "Kaltenkirchen",
      "details": "10.02.2025 (Bekanntmachungsdatum)\n\nSchleswig-Holstein Amtsgericht Kiel HRA 12550\nRegisterbekanntmachung nach dem Umwandlungsgesetz 06.02.2025 (Eintragungsdatum)\n\nAutohaus Fischer GmbH & Co. KG\nKommanditgesellschaft\nKaltenkirchen\n\nZu Eintragungsnummer 3 vom 06.02.2025 wird als nicht eingetragen veröffentlicht:\nDen Gläubigern der an der Spaltung beteiligten Rechtsträger ist, wenn sie binnen sechs Monaten nach dem Tag, an dem die Eintragung der Spaltung in das Register des Sitzes desjenigen Rechtsträgers, dessen Gläubiger sie sind,  bekannt gemacht worden ist, ihren Anspruch nach Grund und Höhe schriftlich anmelden, Sicherheit zu leisten, soweit sie nicht Befriedigung verlangen können. Dieses Recht steht den Gläubigern jedoch nur zu, wenn sie glaubhaft machen, dass durch die Spaltung die Erfüllung ihrer Forderung gefährdet wird."
    },
    {
      "date": "2025-02-10",
      "id": "100856",
      "original_text": "Registerbekanntmachung nach dem Umwandlungsgesetz\nBaden-Württemberg Amtsgericht Freiburg HRB 381258\nVital am See GmbH Sanitätshaus – Konstanz",
      "type": "Registerbekanntmachung nach dem Umwandlungsgesetz",
      "state": "Baden-Württemberg",
      "amtsgericht": "Amtsgericht Freiburg",
      "registernummer": "HRB 381258",
      "registerart": "HRB",
      "company_name": "Vital am See GmbH Sanitätshaus",
      "company_seat": "Konstanz",
      "details": "10.02.2025 (Bekanntmachungsdatum)\n\nBaden-Württemberg Amtsgericht Freiburg HRB 381258\nRegisterbekanntmachung nach dem Umwandlungsgesetz 10.02.2025 (Eintragungsdatum)\n\nVital am See GmbH Sanitätshaus\nGesellschaft mit beschränkter Haftung\nKonstanz\n\nDie Gesellschaft ist mit der \"SC Sanitätshaus Carstens GmbH\" (Amtsgericht Stuttgart, HRB 17645) zur Aufnahme verschmolzen. Den Gläubigern der an der Verschmelzung beteiligten Rechtsträger ist, wenn sie binnen sechs Monaten nach dem Tag, an dem die Eintragung der Verschmelzung in das Register des Sitzes desjenigen Rechtsträgers, dessen Gläubiger sie sind, nach § 19 Abs. 3 UmwG als bekanntgemacht gilt, ihren Anspruch nach Grund und Höhe schriftlich anmelden, Sicherheit zu leisten, soweit sie nicht Befriedigung verlangen können. Dieses Recht steht den Gläubigern jedoch nur zu, wenn sie glaubhaft machen, dass durch die Verschmelzung die Erfüllung ihrer Forderung gefährdet wird."
    },
    {
      "date": "2025-02-10",
      "id": "100857",
      "original_text": "Einreichung neuer Dokumente\nBaden-Württemberg Amtsgericht Freiburg HRB 413629\nGP Grenzach Produktions GmbH – Grenzach-Wyhlen",
      "type": "Einreichung neuer Dokumente",
      "state": "Baden-Württemberg",
      "amtsgericht": "Amtsgericht Freiburg",
      "registernummer": "HRB 413629",
      "registerart": "HRB",
      "company_name": "GP Grenzach Produktions GmbH",
      "company_seat": "Grenzach-Wyhlen",
      "details": "10.02.2025 (Bekanntmachungsdatum)\n\nBaden-Württemberg Amtsgericht Freiburg HRB 413629\nEinreichung neuer Dokumente\n\nGP Grenzach Produktions GmbH\nGesellschaft mit beschränkter Haftung\nGrenzach-Wyhlen\n\nDie Gesellschaft hat am 07.02.2025 die Liste über die Zusammensetzung des Aufsichtsrats zum Handelsregister eingereicht."
    },
    {
      "date": "2025-02-10",
      "id": "100858",
      "original_text": "Löschungsankündigung\nSaarland Amtsgericht Saarbrücken HRA 11162\nTor Service SW UG (haftungsbeschränkt) & Co. KG – Neunkirchen",
      "type": "Löschungsankündigung",
      "state": "Saarland",
      "amtsgericht": "Amtsgericht Saarbrücken",
      "registernummer": "HRA 11162",
      "registerart": "HRA",
      "company_name": "Tor Service SW UG (haftungsbeschränkt) & Co. KG",
      "company_seat": "Neunkirchen",
      "details": "10.02.2025 (Bekanntmachungsdatum)\n\nSaarland Amtsgericht Saarbrücken HRA 11162\nLöschungsankündigung\n\nTor Service SW UG (haftungsbeschränkt) & Co. KG\nKommanditgesellschaft\nNeunkirchen\n\nEs ist beabsichtigt, die Gesellschaft von Amts wegen gemäß § 394 FamFG wegen Vermögenslosigkeit zu löschen.\nGegen die Löschung von Amts wegen ist das Rechtsmittel des Widerspruchs statthaft. Der Widerspruch ist binnen einer Frist von 2 Monaten beginnend mit dem Tag dieser Veröffentlichung durch Einreichen eines Widerspruchsschreibens -schriftlich oder zur Niederschrift der Geschäftsstelle beim Amtsgericht Saarbrücken, -zentrales Handelsregister-, Mainzerstr.178, 66121 Saarbrücken einzulegen.\nDer Widerspruch muss die Bezeichnung der angefochtenen Löschungsankündigung enthalten sowie die Erklärung, dass Widerspruch eingelegt wird. Er ist vom Widerspruchsführer oder seinem Bevollmächtigten zu unterzeichnen.\nDas Widerspruchsschreiben kann auch in der Form eines elektronischen Dokumentes eingereicht werden, das mit einer qualifizierten elektronischen Signatur nach dem Signaturgesetz versehen sein muss (§§ 14 Abs. 2 FamFG, 130a, 298 ZPO)."
    },
    {
      "date": "2025-02-10",
      "id": "100859",
      "original_text": "Registerbekanntmachung nach dem Umwandlungsgesetz\nBrandenburg Amtsgericht Cottbus HRB 16073\nErlebnis-Immobilien Berlin GmbH – Schönefeld",
      "type": "Registerbekanntmachung nach dem Umwandlungsgesetz",
      "state": "Brandenburg",
      "amtsgericht": "Amtsgericht Cottbus",
      "registernummer": "HRB 16073",
      "registerart": "HRB",
      "company_name": "Erlebnis-Immobilien Berlin GmbH",
      "company_seat": "Schönefeld",
      "details": "10.02.2025 (Bekanntmachungsdatum)\n\nBrandenburg Amtsgericht Cottbus HRB 16073\nRegisterbekanntmachung nach dem Umwandlungsgesetz 07.02.2025 (Eintragungsdatum)\n\nErlebnis-Immobilien Berlin GmbH\nGesellschaft mit beschränkter Haftung\nSchönefeld\n\nDen Gläubigern der an der Spaltung beteiligten Rechtsträger ist, wenn sie binnen sechs Monaten nach dem Tag, an dem die Eintragung der Spaltung in das Register des Sitzes desjenigen Rechtsträgers, dessen Gläubiger sie sind, als bekannt gemacht gilt, ihren Anspruch nach Grund und Höhe schriftlich anmelden, Sicherheit zu leisten, soweit sie nicht Befriedigung verlangen können. Dieses Recht steht den Gläubigern jedoch nur zu, wenn sie glaubhaft machen, dass durch die Spaltung die Erfüllung ihrer Forderung gefährdet wird."
    },
    {
      "date": "2025-02-10",
      "id": "100860",
      "original_text": "Einreichung neuer Dokumente\nBaden-Württemberg Amtsgericht Mannheim HRB 719752\nKTG Karlsruhe Tourismus GmbH – Karlsruhe",
      "type": "Einreichung neuer Dokumente",
      "state": "Baden-Württemberg",
      "amtsgericht": "Amtsgericht Mannheim",
      "registernummer": "HRB 719752",
      "registerart": "HRB",
      "company_name": "KTG Karlsruhe Tourismus GmbH",
      "company_seat": "Karlsruhe",
      "details": "10.02.2025 (Bekanntmachungsdatum)\n\nBaden-Württemberg Amtsgericht Mannheim HRB 719752\nEinreichung neuer Dokumente\n\nKTG Karlsruhe Tourismus GmbH\nGesellschaft mit beschränkter Haftung\nKarlsruhe\n\nDie Gesellschaft hat am 06.02.2025 die Liste über die Zusammensetzung des Aufsichtsrats zum Handelsregister eingereicht."
    },
    {
      "date": "2025-02-10",
      "id": "100861",
      "original_text": "Sonstige Registerbekanntmachung\nHamburg Amtsgericht Hamburg HRB 188910\nCircle Eleven Capital AG – Hamburg",
      "type": "Sonstige Registerbekanntmachung",
      "state": "Hamburg",
      "amtsgericht": "Amtsgericht Hamburg",
      "registernummer": "HRB 188910",
      "registerart": "HRB",
      "company_name": "Circle Eleven Capital AG",
      "company_seat": "Hamburg",
      "details": "10.02.2025 (Bekanntmachungsdatum)\n\nHamburg Amtsgericht Hamburg HRB 188910\nSonstige Registerbekanntmachung\n\nCircle Eleven Capital AG\nAktiengesellschaft\nHamburg\n\nAls nicht eingetragen wird bekannt gemacht: Liste des Aufsichtsrats wurde eingereicht."
    },
    {
      "date": "2025-02-10",
      "id": "100862",
      "original_text": "Löschungsankündigung\nSchleswig-Holstein Amtsgericht Flensburg HRB 13308\nBowling and more UG (haftungsbeschränkt) – Leck",
      "type": "Löschungsankündigung",
      "state": "Schleswig-Holstein",
      "amtsgericht": "Amtsgericht Flensburg",
      "registernummer": "HRB 13308",
      "registerart": "HRB",
      "company_name": "Bowling and more UG (haftungsbeschränkt)",
      "company_seat": "Leck",
      "details": "10.02.2025 (Bekanntmachungsdatum)\n\nSchleswig-Holstein Amtsgericht Flensburg HRB 13308\nLöschungsankündigung\n\nBowling and more UG (haftungsbeschränkt)\nGesellschaft mit beschränkter Haftung\nLeck\n\nEs ist die Löschung der nachstehenden Gesellschaft wegen Vermögenslosigkeit gemäß § 394 FamFG beabsichtigt.\nWiderspruchsfrist: 2 Monate."
    },
    {
      "date": "2025-02-10",
      "id": "100863",
      "original_text": "Sonstige Registerbekanntmachung\nMecklenburg-Vorpommern Amtsgericht Neubrandenburg VR 1057\nJunge Europäer e.V. – Demmin",
      "type": "Sonstige Registerbekanntmachung",
      "state": "Mecklenburg-Vorpommern",
      "amtsgericht": "Amtsgericht Neubrandenburg",
      "registernummer": "VR 1057",
      "registerart": "VR",
      "company_name": "Junge Europäer e.V.",
      "company_seat": "Demmin",
      "details": "10.02.2025 (Bekanntmachungsdatum)\n\nMecklenburg-Vorpommern Amtsgericht Neubrandenburg VR 1057\nSonstige Registerbekanntmachung\n\nJunge Europäer e.V.\neingetragener Verein\nDemmin\n\nEs ist beabsichtigt, dem Verein die Rechtsfähigkeit zu entziehen, da nach Mitteilung des Vorstands die Anzahl der Vereinsmitglieder unter drei gesunken ist, § 73 BGB. Einwendungen können binnen eines Monats nach dieser Bekanntmachung beim Amtsgericht - Registergericht- Neubrandenburg, Friedrich- Engels- Ring 16-18, 17033 Neubrandenburg schriftlich oder zu Protokoll der Geschäftsstelle erhoben werden."
    },
    {
      "date": "2025-02-10",
      "id": "100864",
      "original_text": "Löschungsankündigung\nSaarland Amtsgericht Saarbrücken HRB 15759\nLG-INVEST 2 Limited – Wallerfangen",
      "type": "Löschungsankündigung",
      "state": "Saarland",
      "amtsgericht": "Amtsgericht Saarbrücken",
      "registernummer": "HRB 15759",
      "registerart": "HRB",
      "company_name": "LG-INVEST 2 Limited",
      "company_seat": "Wallerfangen",
      "details": "10.02.2025 (Bekanntmachungsdatum)\n\nSaarland Amtsgericht Saarbrücken HRB 15759\nLöschungsankündigung\n\nLG-INVEST 2 Limited\nRechtsform ausländischen Rechts HRB\nWallerfangen\n\nEs ist beabsichtigt, die Gesellschaft von Amts wegen gemäß § 394 FamFG wegen Vermögenslosigkeit zu löschen.\nGegen die Löschung von Amts wegen ist das Rechtsmittel des Widerspruchs statthaft. Der Widerspruch ist binnen einer Frist von 1 Monat beginnend mit dem Tag dieser Veröffentlichung durch Einreichen eines Widerspruchsschreibens -schriftlich oder zur Niederschrift der Geschäftsstelle beim Amtsgericht Saarbrücken, -zentrales Handelsregister-, Mainzerstr.178, 66121 Saarbrücken einzulegen.\nDer Widerspruch muss die Bezeichnung der angefochtenen Löschungsankündigung enthalten sowie die Erklärung, dass Widerspruch eingelegt wird. Er ist vom Widerspruchsführer oder seinem Bevollmächtigten zu unterzeichnen.\nDas Widerspruchsschreiben kann auch in der Form eines elektronischen Dokumentes eingereicht werden, das mit einer qualifizierten elektronischen Signatur nach dem Signaturgesetz versehen sein muss (§§ 14 Abs. 2 FamFG, 130a, 298 ZPO)."
    },
    {
      "date": "2025-02-10",
      "id": "100865",
      "original_text": "Löschungsankündigung\nBerlin Amtsgericht Berlin (Charlottenburg) HRB 181911\nDSAN Deutsche Stiftung Akut- und Notfallmedizin gGmbH – Berlin",
      "type": "Löschungsankündigung",
      "state": "Berlin",
      "amtsgericht": "Amtsgericht Berlin (Charlottenburg)",
      "registernummer": "HRB 181911",
      "registerart": "HRB",
      "company_name": "DSAN Deutsche Stiftung Akut- und Notfallmedizin gGmbH",
      "company_seat": "Berlin",
      "details": "10.02.2025 (Bekanntmachungsdatum)\n\nBerlin Amtsgericht Berlin (Charlottenburg) HRB 181911\nLöschungsankündigung\n\nDSAN Deutsche Stiftung Akut- und Notfallmedizin gGmbH\nGesellschaft mit beschränkter Haftung\nBerlin\n\nBei der nachstehenden Gesellschaft wird das Amtslöschungsverfahren gemäß § 394 FamFG eingeleitet. Widerspruchsfrist 6 Wochen"
    },
    {
      "date": "2025-02-10",
      "id": "100866",
      "original_text": "Einreichung neuer Dokumente\nBaden-Württemberg Amtsgericht Stuttgart HRB 798399\nSüddeutsche-Sozial-Bau SSB AG – Korntal-Münchingen",
      "type": "Einreichung neuer Dokumente",
      "state": "Baden-Württemberg",
      "amtsgericht": "Amtsgericht Stuttgart",
      "registernummer": "HRB 798399",
      "registerart": "HRB",
      "company_name": "Süddeutsche-Sozial-Bau SSB AG",
      "company_seat": "Korntal-Münchingen",
      "details": "10.02.2025 (Bekanntmachungsdatum)\n\nBaden-Württemberg Amtsgericht Stuttgart HRB 798399\nEinreichung neuer Dokumente 10.02.2025 (Eintragungsdatum)\n\nSüddeutsche-Sozial-Bau SSB AG\nAktiengesellschaft\nKorntal-Münchingen\n\nDie Gesellschaft hat am 26.11.2024 die Liste über die Zusammensetzung des Aufsichtsrats zum Handelsregister eingereicht."
    },
    {
      "date": "2025-02-10",
      "id": "100867",
      "original_text": "Registerbekanntmachung nach dem Umwandlungsgesetz\nSaarland Amtsgericht Saarbrücken HRA 13591\nSoul-lis Fashion e.K. – Saarlouis",
      "type": "Registerbekanntmachung nach dem Umwandlungsgesetz",
      "state": "Saarland",
      "amtsgericht": "Amtsgericht Saarbrücken",
      "registernummer": "HRA 13591",
      "registerart": "HRA",
      "company_name": "Soul-lis Fashion e.K.",
      "company_seat": "Saarlouis",
      "details": "10.02.2025 (Bekanntmachungsdatum)\n\nSaarland Amtsgericht Saarbrücken HRA 13591\nRegisterbekanntmachung nach dem Umwandlungsgesetz 10.02.2025 (Eintragungsdatum)\n\nSoul-lis Fashion e.K.\nEinzelkaufmann / Einzelkauffrau\nSaarlouis\n\nAls nicht eingetragen wird bekannt gemacht: Den Gläubigern der an der Ausgliederung beteiligten Gesellschaften ist, wenn sie binnen sechs Monaten nach dem Tag, an dem die Eintragung der Verschmelzung in das Register des Sitzes desjenigen Rechtsträgers, dessen Gläubiger sie sind, nach § 19 Absatz 3 UmwG bekannt gemacht worden ist, ihren Anspruch nach Grund und Höhe schriftlich anmelden, Sicherheit zu leisten, soweit sie nicht Befriedigung verlangen können. Dieses Recht steht den Gläubigern jedoch nur zu, wenn sie glaubhaft machen, dass durch die Ausgliederung die Erfüllung ihrer Forderung gefährdet wird."
    },
    {
      "date": "2025-02-10",
      "id": "100868",
      "original_text": "Registerbekanntmachung nach dem Umwandlungsgesetz\nBaden-Württemberg Amtsgericht Ulm HRA 729351\nJosua Jäger Softwareentwicklung e.K. – Unterstadion",
      "type": "Registerbekanntmachung nach dem Umwandlungsgesetz",
      "state": "Baden-Württemberg",
      "amtsgericht": "Amtsgericht Ulm",
      "registernummer": "HRA 729351",
      "registerart": "HRA",
      "company_name": "Josua Jäger Softwareentwicklung e.K.",
      "company_seat": "Unterstadion",
      "details": "10.02.2025 (Bekanntmachungsdatum)\n\nBaden-Württemberg Amtsgericht Ulm HRA 729351\nRegisterbekanntmachung nach dem Umwandlungsgesetz 10.02.2025 (Eintragungsdatum)\n\nJosua Jäger Softwareentwicklung e.K.\nEinzelkaufmann / Einzelkauffrau\nUnterstadion\n\nAls nicht eingetragen wird bekanntgemacht:\nDen Gläubigern der an der Ausgliederung beteiligten Rechtsträger ist, wenn sie binnen sechs Monaten nach dem Tag, an dem die Eintragung der Ausgliederung in das Register des Sitzes desjenigen Rechtsträgers, dessen Gläubiger sie sind, nach § 19 Abs. 3 UmwG als bekanntgemacht gilt, ihren Anspruch nach Grund und Höhe schriftlich anmelden, Sicherheit zu leisten, soweit sie nicht Befriedigung verlangen können. Dieses Recht steht den Gläubigern jedoch nur zu, wenn sie glaubhaft machen, dass durch die Ausgliederung die Erfüllung ihrer Forderung gefährdet wird."
    },
    {
      "date": "2025-02-10",
      "id": "100869",
      "original_text": "Einreichung neuer Dokumente\nSaarland Amtsgericht Saarbrücken HRB 23304\nStadtwerke Dillingen/Saar GmbH – Dillingen",
      "type": "Einreichung neuer Dokumente",
      "state": "Saarland",
      "amtsgericht": "Amtsgericht Saarbrücken",
      "registernummer": "HRB 23304",
      "registerart": "HRB",
      "company_name": "Stadtwerke Dillingen/Saar GmbH",
      "company_seat": "Dillingen",
      "details": "10.02.2025 (Bekanntmachungsdatum)\n\nSaarland Amtsgericht Saarbrücken HRB 23304\nEinreichung neuer Dokumente\n\nStadtwerke Dillingen/Saar GmbH\nGesellschaft mit beschränkter Haftung\nDillingen\n\nDie Geschäftsführung der Gesellschaft hat eine Liste der Mitglieder des Aufsichtsrats zum Handelsregister eingereicht (§ 52 Abs. 3 Satz 2 GmbHG)."
    },
    {
      "date": "2025-02-10",
      "id": "100870",
      "original_text": "Registerbekanntmachung nach dem Umwandlungsgesetz\nBaden-Württemberg Amtsgericht Ulm HRB 738088\nVoyonic Systems GmbH – Unterstadion",
      "type": "Registerbekanntmachung nach dem Umwandlungsgesetz",
      "state": "Baden-Württemberg",
      "amtsgericht": "Amtsgericht Ulm",
      "registernummer": "HRB 738088",
      "registerart": "HRB",
      "company_name": "Voyonic Systems GmbH",
      "company_seat": "Unterstadion",
      "details": "10.02.2025 (Bekanntmachungsdatum)\n\nBaden-Württemberg Amtsgericht Ulm HRB 738088\nRegisterbekanntmachung nach dem Umwandlungsgesetz 10.02.2025 (Eintragungsdatum)\n\nVoyonic Systems GmbH\nGesellschaft mit beschränkter Haftung\nUnterstadion\n\nAls nicht eingetragen wird bekanntgemacht:\nDen Gläubigern der an der Ausgliederung beteiligten Rechtsträger ist, wenn sie binnen sechs Monaten nach dem Tag, an dem die Eintragung der Ausgliederung in das Register des Sitzes desjenigen Rechtsträgers, dessen Gläubiger sie sind, nach § 19 Abs. 3 UmwG als bekanntgemacht gilt, ihren Anspruch nach Grund und Höhe schriftlich anmelden, Sicherheit zu leisten, soweit sie nicht Befriedigung verlangen können. Dieses Recht steht den Gläubigern jedoch nur zu, wenn sie glaubhaft machen, dass durch die Ausgliederung die Erfüllung ihrer Forderung gefährdet wird."
    },
    {
      "date": "2025-02-10",
      "id": "100871",
      "original_text": "Löschungsankündigung\nBerlin Amtsgericht Berlin (Charlottenburg) HRB 250289\nRGI Rhein Gerüstbau & Industrieservice GmbH – Berlin",
      "type": "Löschungsankündigung",
      "state": "Berlin",
      "amtsgericht": "Amtsgericht Berlin (Charlottenburg)",
      "registernummer": "HRB 250289",
      "registerart": "HRB",
      "company_name": "RGI Rhein Gerüstbau & Industrieservice GmbH",
      "company_seat": "Berlin",
      "details": "10.02.2025 (Bekanntmachungsdatum)\n\nBerlin Amtsgericht Berlin (Charlottenburg) HRB 250289\nLöschungsankündigung\n\nRGI Rhein Gerüstbau & Industrieservice GmbH\nGesellschaft mit beschränkter Haftung\nBerlin\n\nBei der nachstehenden Gesellschaft wird das Amtslöschungsverfahren gemäß § 394 FamFG eingeleitet. Widerspruchsfrist\n6 Wochen."
    },
    {
      "date": "2025-02-10",
      "id": "100872",
      "original_text": "Sonstige Registerbekanntmachung\nBerlin Amtsgericht Berlin (Charlottenburg) HRB 146528\nUmber Solandra Property GmbH – Berlin",
      "type": "Sonstige Registerbekanntmachung",
      "state": "Berlin",
      "amtsgericht": "Amtsgericht Berlin (Charlottenburg)",
      "registernummer": "HRB 146528",
      "registerart": "HRB",
      "company_name": "Umber Solandra Property GmbH",
      "company_seat": "Berlin",
      "details": "10.02.2025 (Bekanntmachungsdatum)\n\nBerlin Amtsgericht Berlin (Charlottenburg) HRB 146528\nSonstige Registerbekanntmachung\n\nUmber Solandra Property GmbH\nGesellschaft mit beschränkter Haftung\nBerlin\n\nAls nicht eingetragen wird veröffentlicht:\nDie Gesellschaft hat einen notariell beurkundeten Formwechselplan vom 06.02.2025 betreffend die grenzüberschreitende Verlegung des Satzungssitzes der Gesellschaft nach Luxemburg gemäß §§ 333 ff. UmwG zum Handelsregister des Amtsgerichts Charlottenburg eingereicht.\nRegister der formwechselnden Gesellschaft: Die an dem grenzüberschreitenden Form wechsel beteiligte Gesellschaft ist unter HRB 146528 B im Handelsregister des Amtsgerichts CharlOttenburg eingetragen.\nHinweis an die Anteilsinhaber und Gläubiger: Dem Gesellschafter und den Gläubigern der Gesellschaft wird mitgeteilt, dass sie der Gesellschaft spätestens fünf Tage vor dem Tag der Gesellschafterversammlung Bemerkungen zu dem beim Handelsregister eingereichten Formwechselplan übermitteln können.\nHinweis an die zuständigen Betriebsräte und Arbeitnehmer der Gesellschaft: Die Gesellschaft hat keine Arbeitnehmer und verfügt über keinen Betriebsrat oder eine sonstige Arbeitnehmervertretung.\nGläubiger der Gesellschaft: Die Rechte der Gläubiger der formwechselnden Gesellschaft ergeben sich aus §§ 341, 314 UmwG. Danach ist den Gläubigern der formwechselnden Gesellschaft Sicherheit zu leisten, soweit sie nicht Befriedigung verlangen können, wenn die neue Rechtsform nicht dem deutschen Recht unterliegt. Dieses Recht steht den Gläubigern jedoch nur zu, wenn sie binnen drei Monaten nach dem Tag, an dem der Formwechselplan (oder sein Entwurf) bekannt gemacht worden ist, ihre Ansprüche gerichtlich geltend machen. Dieses Recht auf Sicherheitsleistung steht Gläubigern nur im Hinblick auf solche Forderungen zu, die vor der Bekanntmachung des Formwechselplans oder seines Entwurfs entstanden, aber im Zeitpunkt der Bekanntmachung noch nicht fällig geworden sind, und deren Erfüllung durch den Form wechsel gefährdet wird."
    },
    {
      "date": "2025-02-10",
      "id": "100873",
      "original_text": "Sonstige Registerbekanntmachung\nThüringen Amtsgericht Jena HRB 202757\nVion Altenburg GmbH – Altenburg",
      "type": "Sonstige Registerbekanntmachung",
      "state": "Thüringen",
      "amtsgericht": "Amtsgericht Jena",
      "registernummer": "HRB 202757",
      "registerart": "HRB",
      "company_name": "Vion Altenburg GmbH",
      "company_seat": "Altenburg",
      "details": "10.02.2025 (Bekanntmachungsdatum)\n\nThüringen Amtsgericht Jena HRB 202757\nSonstige Registerbekanntmachung 10.02.2025 (Eintragungsdatum)\n\nVion Altenburg GmbH\nGesellschaft mit beschränkter Haftung\nAltenburg\n\nNicht eingetragen: Den Gläubigern der Gesellschaft, deren Forderungen begründet worden sind, bevor die Eintragung der Beendigung des Vertrages in das Handelsregister nach § 10 des Handelsgesetzbuches als bekanntgemacht gilt, hat der andere Vertragsteil Sicherheit zu leisten, wenn sie sich binnen sechs Monaten nach der Bekanntmachung der Eintragung zu diesem Zweck bei ihm melden."
    },
    {
      "date": "2025-02-10",
      "id": "100874",
      "original_text": "Löschungsankündigung\nSaarland Amtsgericht Saarbrücken HRB 102669\nT.A.N.A. UG (haftungsbeschränkt) – Neunkirchen",
      "type": "Löschungsankündigung",
      "state": "Saarland",
      "amtsgericht": "Amtsgericht Saarbrücken",
      "registernummer": "HRB 102669",
      "registerart": "HRB",
      "company_name": "T.A.N.A. UG (haftungsbeschränkt)",
      "company_seat": "Neunkirchen",
      "details": "10.02.2025 (Bekanntmachungsdatum)\n\nSaarland Amtsgericht Saarbrücken HRB 102669\nLöschungsankündigung\n\nT.A.N.A. UG (haftungsbeschränkt)\nGesellschaft mit beschränkter Haftung\nNeunkirchen\n\nEs ist beabsichtigt, die Gesellschaft von Amts wegen gemäß § 394 FamFG wegen Vermögenslosigkeit zu löschen.\nGegen die Löschung von Amts wegen ist das Rechtsmittel des Widerspruchs statthaft. Der Widerspruch ist binnen einer Frist drei Monaten beginnend mit dem Tag dieser Veröffentlichung durch Einreichen eines Widerspruchsschreibens -schriftlich oder zur Niederschrift der Geschäftsstelle beim Amtsgericht Saarbrücken, -zentrales Handelsregister-, Mainzerstr.178, 66121 Saarbrücken einzulegen.\nDer Widerspruch muss die Bezeichnung der angefochtenen Löschungsankündigung enthalten sowie die Erklärung, dass Widerspruch eingelegt wird. Er ist vom Widerspruchsführer oder seinem Bevollmächtigten zu unterzeichnen.\nDas Widerspruchsschreiben kann auch in der Form eines elektronischen Dokumentes eingereicht werden, das mit einer qualifizierten elektronischen Signatur nach dem Signaturgesetz versehen sein muss (§§ 14 Abs. 2 FamFG, 130a, 298 ZPO)."
    },
    {
      "date": "2025-02-10",
      "id": "100875",
      "original_text": "Löschungsankündigung\nBaden-Württemberg Amtsgericht Stuttgart HRB 753340\nA. + G. Anlagenbau GmbH – Stuttgart",
      "type": "Löschungsankündigung",
      "state": "Baden-Württemberg",
      "amtsgericht": "Amtsgericht Stuttgart",
      "registernummer": "HRB 753340",
      "registerart": "HRB",
      "company_name": "A. + G. Anlagenbau GmbH",
      "company_seat": "Stuttgart",
      "details": "10.02.2025 (Bekanntmachungsdatum)\n\nBaden-Württemberg Amtsgericht Stuttgart HRB 753340\nLöschungsankündigung\n\nA. + G. Anlagenbau GmbH\nGesellschaft mit beschränkter Haftung\nStuttgart\n\nDas Gericht beabsichtigt, die Gesellschaft wegen Vermögenslosigkeit im Handelsregister von Amts wegen nach § 394 FamFG zu löschen. Die Frist zur Geltendmachung eines Widerspruchs gegen die beabsichtigte Löschung ist auf zwei Monate ab Veröffentlichung bestimmt."
    },
    {
      "date": "2025-02-10",
      "id": "100876",
      "original_text": "Registerbekanntmachung nach dem Umwandlungsgesetz\nBaden-Württemberg Amtsgericht Mannheim HRB 716859\nSpiegel Institut Holding Verwaltungs GmbH – Mannheim",
      "type": "Registerbekanntmachung nach dem Umwandlungsgesetz",
      "state": "Baden-Württemberg",
      "amtsgericht": "Amtsgericht Mannheim",
      "registernummer": "HRB 716859",
      "registerart": "HRB",
      "company_name": "Spiegel Institut Holding Verwaltungs GmbH",
      "company_seat": "Mannheim",
      "details": "10.02.2025 (Bekanntmachungsdatum)\n\nBaden-Württemberg Amtsgericht Mannheim HRB 716859\nRegisterbekanntmachung nach dem Umwandlungsgesetz 10.02.2025 (Eintragungsdatum)\n\nSpiegel Institut Holding Verwaltungs GmbH\nGesellschaft mit beschränkter Haftung\nMannheim\n\nDen Gläubigern der an der Verschmelzung beteiligten Rechtsträger ist, wenn sie binnen sechs Monaten nach dem Tag, an dem die Eintragung der Verschmelzung in das Register des Sitzes desjenigen Rechtsträgers, dessen Gläubiger sie sind, nach § 19 Abs. 3 UmwG als bekanntgemacht gilt, ihren Anspruch nach Grund und Höhe schriftlich anmelden, Sicherheit zu leisten, soweit sie nicht Befriedigung verlangen können. Dieses Recht steht den Gläubigern jedoch nur zu, wenn sie glaubhaft machen, dass durch die Verschmelzung die Erfüllung ihrer Forderung gefährdet wird."
    },
    {
      "date": "2025-02-10",
      "id": "100877",
      "original_text": "Registerbekanntmachung nach dem Umwandlungsgesetz\nBaden-Württemberg Amtsgericht Mannheim HRB 707004\nProf. Dr. Spiegel & Associés GmbH – Brühl",
      "type": "Registerbekanntmachung nach dem Umwandlungsgesetz",
      "state": "Baden-Württemberg",
      "amtsgericht": "Amtsgericht Mannheim",
      "registernummer": "HRB 707004",
      "registerart": "HRB",
      "company_name": "Prof. Dr. Spiegel & Associés GmbH",
      "company_seat": "Brühl",
      "details": "10.02.2025 (Bekanntmachungsdatum)\n\nBaden-Württemberg Amtsgericht Mannheim HRB 707004\nRegisterbekanntmachung nach dem Umwandlungsgesetz 10.02.2025 (Eintragungsdatum)\n\nProf. Dr. Spiegel & Associés GmbH\nGesellschaft mit beschränkter Haftung\nBrühl\n\nAls nicht eingetragen wird bekanntgemacht:\nDen Gläubigern der an der Verschmelzung beteiligten Rechtsträger ist, wenn sie binnen sechs Monaten nach dem Tag, an dem die Eintragung der Verschmelzung in das Register des Sitzes desjenigen Rechtsträgers, dessen Gläubiger sie sind, nach § 19 Abs. 3 UmwG als bekanntgemacht gilt, ihren Anspruch nach Grund und Höhe schriftlich anmelden, Sicherheit zu leisten, soweit sie nicht Befriedigung verlangen können. Dieses Recht steht den Gläubigern jedoch nur zu, wenn sie glaubhaft machen, dass durch die Verschmelzung die Erfüllung ihrer Forderung gefährdet wird."
    },
    {
      "date": "2025-02-10",
      "id": "100878",
      "original_text": "Löschungsankündigung\nBerlin Amtsgericht Berlin (Charlottenburg) HRB 101154\nFNZ Konzept GmbH – Berlin",
      "type": "Löschungsankündigung",
      "state": "Berlin",
      "amtsgericht": "Amtsgericht Berlin (Charlottenburg)",
      "registernummer": "HRB 101154",
      "registerart": "HRB",
      "company_name": "FNZ Konzept GmbH",
      "company_seat": "Berlin",
      "details": "10.02.2025 (Bekanntmachungsdatum)\n\nBerlin Amtsgericht Berlin (Charlottenburg) HRB 101154\nLöschungsankündigung\n\nFNZ Konzept GmbH\nGesellschaft mit beschränkter Haftung\nBerlin\n\nBei der nachstehenden Gesellschaft wird das Amtslöschungsverfahren gemäß § 394 FamFG eingeleitet. Widerspruchsfrist 6 Wochen"
    },
    {
      "date": "2025-02-10",
      "id": "100879",
      "original_text": "Einreichung neuer Dokumente\nBaden-Württemberg Amtsgericht Mannheim HRB 731441\nWasser + Wärme Einkaufs AG – Karlsruhe",
      "type": "Einreichung neuer Dokumente",
      "state": "Baden-Württemberg",
      "amtsgericht": "Amtsgericht Mannheim",
      "registernummer": "HRB 731441",
      "registerart": "HRB",
      "company_name": "Wasser + Wärme Einkaufs AG",
      "company_seat": "Karlsruhe",
      "details": "10.02.2025 (Bekanntmachungsdatum)\n\nBaden-Württemberg Amtsgericht Mannheim HRB 731441\nEinreichung neuer Dokumente\n\nWasser + Wärme Einkaufs AG\nAktiengesellschaft\nKarlsruhe\n\nDie Gesellschaft hat am 16.11.2024 die Liste über die Zusammensetzung des Aufsichtsrats zum Handelsregister eingereicht."
    },
    {
      "date": "2025-02-10",
      "id": "100880",
      "original_text": "Einreichung neuer Dokumente\nBerlin Amtsgericht Berlin (Charlottenburg) HRB 175284\nSunray Verbena Property GmbH – Berlin",
      "type": "Einreichung neuer Dokumente",
      "state": "Berlin",
      "amtsgericht": "Amtsgericht Berlin (Charlottenburg)",
      "registernummer": "HRB 175284",
      "registerart": "HRB",
      "company_name": "Sunray Verbena Property GmbH",
      "company_seat": "Berlin",
      "details": "10.02.2025 (Bekanntmachungsdatum)\n\nBerlin Amtsgericht Berlin (Charlottenburg) HRB 175284\nEinreichung neuer Dokumente\n\nSunray Verbena Property GmbH\nGesellschaft mit beschränkter Haftung\nBerlin\n\nAls nicht eingetragen wird gemäß §§ 336, 308 UmwG, § 10 HGB veröffentlicht: Die Gesellschaft hat einen notariell beurkundeten Formwechselplan vom 06.02.2025 betreffend die grenzüberschreitende Verlegung des Satzungssitzes der Gesellschaft nach Luxemburg gemäß §§ 333 ff. UmwG zum Handelsregister des Amtsgerichts Charlottenburg eingereicht. Die Gesellschaft ist eine deutsche Gesellschaft mit beschränkter Haftung unter der Firma Sunray Verbena Property GmbH, errichtet und bestehend nach deutschem Recht, mit Sitz in Berlin, Deutschland, eingetragen im Handelsregister des Amtsgerichts Charlottenburg unter\nHRB 175284 B. Die Gesellschaft soll durch grenzüberschreitenden, identitätswahrenden Formwechsel aufgrund eines Formwechselbeschlusses unter gleichzeitiger Verlegung des Satzungssitzes in eine Gesellschaft mit beschränkter Haftung nach\ndem Recht des Großherzogtums Luxemburg (société à responsabilité limitée) mit Sitz in Luxemburg, Großherzogtum Luxemburg, umgewandelt werden. Die Gesellschaft wird die Firma Sunray Verbena Property S.à r.l. führen. Die an dem grenzüberschreitenden Formwechsel beteiligte Gesellschaft ist unter HRB 175284 B im Handelsregister des Amtsgerichts Charlottenburg eingetragen.\nDem Gesellschafter und den Gläubigem der Gesellschaft wird mitgeteilt, dass sie der Gesellschaft spätestens fünf Tage vor dem Tag der Gesellschafterversammlung Bemerkungen zu dem beim Handelsregister eingereichten Formwechselplan übermitteln können. Die Gesellschaft hat keine Arbeitnehmer und verfügt über keinen Betriebsrat oder eine sonstige Arbeitnehmervertretung.\nDie Rechte der Gläubiger der formwechselnden Gesellschaft ergeben sich aus §§ 341, 314 UmwG. Danach ist den Gläubigern der formwechselnden Gesellschaft Sicherheit zu leisten, soweit sie nicht Befriedigung verlangen können, wenn die neue Rechtsform nicht dem deutschen Recht unterliegt. Dieses Recht steht den Gläubigern jedoch nur zu, wenn sie binnen drei Monaten nach dem Tag, an dem der Formwechselplan (oder sein Entwurf) bekannt gemacht worden ist, ihre Ansprüche gerichtlich geltend machen. Dieses Recht auf Sicherheitsleistung steht Gläubigern nur im Hinblick auf solche Forderungen zu, die vor der Bekanntmachung des Formwechselplans oder seines Entwurfs entstanden, aber im Zeitpunkt der Bekanntmachung noch nicht fällig geworden sind, und deren Erfüllung durch den Formwechsel gefährdet wird."
    },
    {
      "date": "2025-02-10",
      "id": "100881",
      "original_text": "Registerbekanntmachung nach dem Umwandlungsgesetz\nSaarland Amtsgericht Saarbrücken HRA 21317\nJosef Rupp GmbH & Co KG Sand- und Kiesbaggerei – Dillingen",
      "type": "Registerbekanntmachung nach dem Umwandlungsgesetz",
      "state": "Saarland",
      "amtsgericht": "Amtsgericht Saarbrücken",
      "registernummer": "HRA 21317",
      "registerart": "HRA",
      "company_name": "Josef Rupp GmbH & Co KG Sand- und Kiesbaggerei",
      "company_seat": "Dillingen",
      "details": "10.02.2025 (Bekanntmachungsdatum)\n\nSaarland Amtsgericht Saarbrücken HRA 21317\nRegisterbekanntmachung nach dem Umwandlungsgesetz 10.02.2025 (Eintragungsdatum)\n\nJosef Rupp GmbH & Co KG Sand- und Kiesbaggerei\nKommanditgesellschaft\nDillingen\n\nAls nicht eingetragen wird bekannt gemacht: Den Gläubigern der an der formwechselnden Umwandlung beteiligten Gesellschaften ist, wenn sie binnen sechs Monaten nach dem Tag, an dem die Eintragung der formwechselnden Umwandlung in das Register des Sitzes desjenigen Rechtsträgers, dessen Gläubiger sie sind, nach § 19 Absatz 3 UmwG bekannt gemacht worden ist, ihren Anspruch nach Grund und Höhe schriftlich anmelden, Sicherheit zu leisten, soweit sie nicht Befriedigung verlangen können. Dieses Recht steht den Gläubigern jedoch nur zu, wenn sie glaubhaft machen, dass durch die formwechselnden Umwandlung die Erfüllung ihrer Forderung gefährdet wird."
    },
    {
      "date": "2025-02-10",
      "id": "100882",
      "original_text": "Registerbekanntmachung nach dem Umwandlungsgesetz\nSchleswig-Holstein Amtsgericht Flensburg HRB 1401 NI\nNorddeutsche Verkehrsbetriebe GmbH – Niebüll",
      "type": "Registerbekanntmachung nach dem Umwandlungsgesetz",
      "state": "Schleswig-Holstein",
      "amtsgericht": "Amtsgericht Flensburg",
      "registernummer": "HRB 1401 NI",
      "registerart": "HRB",
      "company_name": "Norddeutsche Verkehrsbetriebe GmbH",
      "company_seat": "Niebüll",
      "details": "10.02.2025 (Bekanntmachungsdatum)\n\nSchleswig-Holstein Amtsgericht Flensburg HRB 1401 NI\nRegisterbekanntmachung nach dem Umwandlungsgesetz 06.02.2025 (Eintragungsdatum)\n\nNorddeutsche Verkehrsbetriebe GmbH\nGesellschaft mit beschränkter Haftung\nNiebüll\n\nZu Eintragungsnummer 22 vom 06.02.2025 wird als nicht eingetragen veröffentlicht:\nDen Gläubigern der an der Verschmelzung beteiligten Rechtsträger ist, wenn sie binnen sechs Monaten nach dem Tag, an dem die Eintragung der Verschmelzung in das Register des Sitzes desjenigen Rechtsträgers, dessen Gläubiger sie sind, als bekannt gemacht gilt, ihren Anspruch nach Grund und Höhe in Textform anmelden, Sicherheit zu leisten, soweit sie nicht Befriedigung verlangen können. Dieses Recht steht den Gläubigern jedoch nur zu, wenn sie glaubhaft machen, dass durch die Verschmelzung die Erfüllung ihrer Forderung gefährdet wird."
    },
    {
      "date": "2025-02-10",
      "id": "100883",
      "original_text": "Löschungsankündigung\nBrandenburg Amtsgericht Cottbus HRB 10180\nTS Technik & Service GmbH Wildau – Wildau",
      "type": "Löschungsankündigung",
      "state": "Brandenburg",
      "amtsgericht": "Amtsgericht Cottbus",
      "registernummer": "HRB 10180",
      "registerart": "HRB",
      "company_name": "TS Technik & Service GmbH Wildau",
      "company_seat": "Wildau",
      "details": "10.02.2025 (Bekanntmachungsdatum)\n\nBrandenburg Amtsgericht Cottbus HRB 10180\nLöschungsankündigung\n\nTS Technik & Service GmbH Wildau\nGesellschaft mit beschränkter Haftung\nWildau\n\nBei der nachstehenden Gesellschaft wird das Amtslöschungsverfahren gemäß § 394 FamFG eingeleitet."
    },
    {
      "date": "2025-02-10",
      "id": "100884",
      "original_text": "Registerbekanntmachung nach dem Umwandlungsgesetz\nSaarland Amtsgericht Saarbrücken HRB 25927\nFranz Wiater GmbH – Dillingen",
      "type": "Registerbekanntmachung nach dem Umwandlungsgesetz",
      "state": "Saarland",
      "amtsgericht": "Amtsgericht Saarbrücken",
      "registernummer": "HRB 25927",
      "registerart": "HRB",
      "company_name": "Franz Wiater GmbH",
      "company_seat": "Dillingen",
      "details": "10.02.2025 (Bekanntmachungsdatum)\n\nSaarland Amtsgericht Saarbrücken HRB 25927\nRegisterbekanntmachung nach dem Umwandlungsgesetz 10.02.2025 (Eintragungsdatum)\n\nFranz Wiater GmbH\nGesellschaft mit beschränkter Haftung\nDillingen\n\nAls nicht eingetragen wird bekannt gemacht: Den Gläubigern der an der Verschmelzung beteiligten Gesellschaften ist, wenn sie binnen sechs Monaten nach dem Tag, an dem die Eintragung der Verschmelzung in das Register des Sitzes desjenigen Rechtsträgers, dessen Gläubiger sie sind, nach § 19 Absatz 3 UmwG bekannt gemacht worden ist, ihren Anspruch nach Grund und Höhe schriftlich anmelden, Sicherheit zu leisten, soweit sie nicht Befriedigung verlangen können. Dieses Recht steht den Gläubigern jedoch nur zu, wenn sie glaubhaft machen, dass durch die Verschmelzung die Erfüllung ihrer Forderung gefährdet wird."
    },
    {
      "date": "2025-02-10",
      "id": "100885",
      "original_text": "Einreichung neuer Dokumente\nBaden-Württemberg Amtsgericht Stuttgart HRB 798399\nSüddeutsche-Sozial-Bau SSB AG – Korntal-Münchingen",
      "type": "Einreichung neuer Dokumente",
      "state": "Baden-Württemberg",
      "amtsgericht": "Amtsgericht Stuttgart",
      "registernummer": "HRB 798399",
      "registerart": "HRB",
      "company_name": "Süddeutsche-Sozial-Bau SSB AG",
      "company_seat": "Korntal-Münchingen",
      "details": "10.02.2025 (Bekanntmachungsdatum)\n\nBaden-Württemberg Amtsgericht Stuttgart HRB 798399\nEinreichung neuer Dokumente\n\nSüddeutsche-Sozial-Bau SSB AG\nAktiengesellschaft\nKorntal-Münchingen\n\nDie Gesellschaft hat am 10.01.2025 die Liste über die Zusammensetzung des Aufsichtsrats zum Handelsregister eingereicht."
    },
    {
      "date": "2025-02-10",
      "id": "100886",
      "original_text": "Einreichung neuer Dokumente\nBaden-Württemberg Amtsgericht Freiburg HRB 371280\nWohnungsbaugesellschaft der Stadt Rheinau GmbH. – Rheinau",
      "type": "Einreichung neuer Dokumente",
      "state": "Baden-Württemberg",
      "amtsgericht": "Amtsgericht Freiburg",
      "registernummer": "HRB 371280",
      "registerart": "HRB",
      "company_name": "Wohnungsbaugesellschaft der Stadt Rheinau GmbH.",
      "company_seat": "Rheinau",
      "details": "10.02.2025 (Bekanntmachungsdatum)\n\nBaden-Württemberg Amtsgericht Freiburg HRB 371280\nEinreichung neuer Dokumente\n\nWohnungsbaugesellschaft der Stadt Rheinau GmbH.\nGesellschaft mit beschränkter Haftung\nRheinau\n\nDie Gesellschaft hat am 07.02.2025 die Liste über die Zusammensetzung des Aufsichtsrats zum Handelsregister eingereicht."
    },
    {
      "date": "2025-02-10",
      "id": "100887",
      "original_text": "Einreichung neuer Dokumente\nBaden-Württemberg Amtsgericht Freiburg HRB 728655\nFreiburger Pflegeschule der DREISAM sozialmedizinische Pflegebetriebe und der DRK Landesschule Baden-Württemberg gGmbH – Freiburg im Breisgau",
      "type": "Einreichung neuer Dokumente",
      "state": "Baden-Württemberg",
      "amtsgericht": "Amtsgericht Freiburg",
      "registernummer": "HRB 728655",
      "registerart": "HRB",
      "company_name": "Freiburger Pflegeschule der DREISAM sozialmedizinische Pflegebetriebe und der DRK Landesschule Baden-Württemberg gGmbH",
      "company_seat": "Freiburg im Breisgau",
      "details": "10.02.2025 (Bekanntmachungsdatum)\n\nBaden-Württemberg Amtsgericht Freiburg HRB 728655\nEinreichung neuer Dokumente 10.02.2025 (Eintragungsdatum)\n\nFreiburger Pflegeschule der DREISAM sozialmedizinische Pflegebetriebe und der DRK Landesschule Baden-Württemberg gGmbH\nGesellschaft mit beschränkter Haftung\nFreiburg im Breisgau\n\nDie Gesellschaft hat am 07.02.2025 die Liste über die Zusammensetzung des Aufsichtsrats zum Handelsregister eingereicht."
    },
    {
      "date": "2025-02-10",
      "id": "100888",
      "original_text": "Löschungsankündigung\nSchleswig-Holstein Amtsgericht Lübeck HRB 263 GE\nCONTEXT-Werbeagentur-Ideen und Lösungen GmbH – Geesthacht",
      "type": "Löschungsankündigung",
      "state": "Schleswig-Holstein",
      "amtsgericht": "Amtsgericht Lübeck",
      "registernummer": "HRB 263 GE",
      "registerart": "HRB",
      "company_name": "CONTEXT-Werbeagentur-Ideen und Lösungen GmbH",
      "company_seat": "Geesthacht",
      "details": "10.02.2025 (Bekanntmachungsdatum)\n\nSchleswig-Holstein Amtsgericht Lübeck HRB 263 GE\nLöschungsankündigung\n\nCONTEXT-Werbeagentur-Ideen und Lösungen GmbH\nGesellschaft mit beschränkter Haftung\nGeesthacht\n\nEs ist die Löschung der nachstehenden Gesellschaft wegen Vermögenslosigkeit gemäß § 394 FamFG beabsichtigt. Widerspruchsfrist: 1 Monat"
    },
    {
      "date": "2025-02-10",
      "id": "100889",
      "original_text": "Einreichung neuer Dokumente\nBaden-Württemberg Amtsgericht Mannheim HRB 201505\nImmobilien Regional Aktiengesellschaft – Baden-Baden",
      "type": "Einreichung neuer Dokumente",
      "state": "Baden-Württemberg",
      "amtsgericht": "Amtsgericht Mannheim",
      "registernummer": "HRB 201505",
      "registerart": "HRB",
      "company_name": "Immobilien Regional Aktiengesellschaft",
      "company_seat": "Baden-Baden",
      "details": "10.02.2025 (Bekanntmachungsdatum)\n\nBaden-Württemberg Amtsgericht Mannheim HRB 201505\nEinreichung neuer Dokumente\n\nImmobilien Regional Aktiengesellschaft\nAktiengesellschaft\nBaden-Baden\n\nDie Gesellschaft hat am 10.02.2025 die Liste über die Zusammensetzung des Aufsichtsrats zum Handelsregister eingereicht."
    },
    {
      "date": "2025-02-10",
      "id": "100890",
      "original_text": "Registerbekanntmachung nach dem Umwandlungsgesetz\nBerlin Amtsgericht Berlin (Charlottenburg) HRB 243718\nnetgo software GmbH – Berlin",
      "type": "Registerbekanntmachung nach dem Umwandlungsgesetz",
      "state": "Berlin",
      "amtsgericht": "Amtsgericht Berlin (Charlottenburg)",
      "registernummer": "HRB 243718",
      "registerart": "HRB",
      "company_name": "netgo software GmbH",
      "company_seat": "Berlin",
      "details": "10.02.2025 (Bekanntmachungsdatum)\n\nBerlin Amtsgericht Berlin (Charlottenburg) HRB 243718\nRegisterbekanntmachung nach dem Umwandlungsgesetz 10.02.2025 (Eintragungsdatum)\n\nnetgo software GmbH\nGesellschaft mit beschränkter Haftung\nBerlin\n\nZu Eintragungsnummer 13 vom 10.02.2025 wird als nicht eingetragen veröffentlicht: Den Gläubigern der an der Spaltung beteiligten Rechtsträger ist, wenn sie binnen sechs Monaten nach dem Tag, an dem die Eintragung der Spaltung in das Register des Sitzes desjenigen Rechtsträgers, dessen Gläubiger sie sind, als bekannt gemacht gilt, ihren Anspruch nach Grund und Höhe schriftlich anmelden, Sicherheit zu leisten, soweit sie nicht Befriedigung verlangen können. Dieses Recht steht den Gläubigern jedoch nur zu, wenn sie glaubhaft machen, dass durch die Spaltung die Erfüllung ihrer Forderung gefährdet wird. Das Recht, Sicherheitsleistung zu verlangen, steht Gläubigern nicht zu, die im Falle der Insolvenz ein Recht auf vorzugsweise Befriedigung aus einer Deckungsmasse haben, die nach gesetzlicher Vorschrift zu ihrem Schutz errichtet und staatlich überwacht ist."
    },
    {
      "date": "2025-02-10",
      "id": "100891",
      "original_text": "Einreichung neuer Dokumente\nBaden-Württemberg Amtsgericht Stuttgart HRB 100920\nStadtwerke Lauffen a.N. GmbH – Lauffen am Neckar",
      "type": "Einreichung neuer Dokumente",
      "state": "Baden-Württemberg",
      "amtsgericht": "Amtsgericht Stuttgart",
      "registernummer": "HRB 100920",
      "registerart": "HRB",
      "company_name": "Stadtwerke Lauffen a.N. GmbH",
      "company_seat": "Lauffen am Neckar",
      "details": "10.02.2025 (Bekanntmachungsdatum)\n\nBaden-Württemberg Amtsgericht Stuttgart HRB 100920\nEinreichung neuer Dokumente\n\nStadtwerke Lauffen a.N. GmbH\nGesellschaft mit beschränkter Haftung\nLauffen am Neckar\n\nDie Gesellschaft hat am 13.12.2024 die Liste über die Zusammensetzung des Aufsichtsrats zum Handelsregister eingereicht."
    },
    {
      "date": "2025-02-10",
      "id": "100892",
      "original_text": "Registerbekanntmachung nach dem Umwandlungsgesetz\nMecklenburg-Vorpommern Amtsgericht Stralsund HRB 5535\nAgrarproduktion Divitz GmbH – Divitz-Spoldershagen",
      "type": "Registerbekanntmachung nach dem Umwandlungsgesetz",
      "state": "Mecklenburg-Vorpommern",
      "amtsgericht": "Amtsgericht Stralsund",
      "registernummer": "HRB 5535",
      "registerart": "HRB",
      "company_name": "Agrarproduktion Divitz GmbH",
      "company_seat": "Divitz-Spoldershagen",
      "details": "10.02.2025 (Bekanntmachungsdatum)\n\nMecklenburg-Vorpommern Amtsgericht Stralsund HRB 5535\nRegisterbekanntmachung nach dem Umwandlungsgesetz 10.02.2025 (Eintragungsdatum)\n\nAgrarproduktion Divitz GmbH\nGesellschaft mit beschränkter Haftung\nDivitz-Spoldershagen\n\nAls nicht eingetragen wird veröffentlicht: Den Gläubigern der an der Verschmelzung beteiligten Rechtsträger ist, wenn sie binnen sechs Monaten nach dem Tag, an dem die Eintragung der Verschmelzung in das Register des Sitzes desjenigen Rechtsträgers, dessen Gläubiger sie sind, nach § 19 Abs. 3 UmwG als bekannt gemacht gilt,\nihren Anspruch nach Grund und Höhe in Textform anmelden, Sicherheit zu leisten, soweit sie nicht Befriedigung verlangen können. Dieses Recht steht den Gläubigern jedoch nur zu, wenn sie glaubhaft machen, dass durch die Verschmelzung die Erfüllung der Forderung gefährdet wird."
    },
    {
      "date": "2025-02-10",
      "id": "100893",
      "original_text": "Registerbekanntmachung nach dem Umwandlungsgesetz\nMecklenburg-Vorpommern Amtsgericht Stralsund HRB 2710 früher Amtsgericht Rostock\nLandwirtschaftsgesellschaft Barth mbH – Barth",
      "type": "Registerbekanntmachung nach dem Umwandlungsgesetz",
      "state": "Mecklenburg-Vorpommern",
      "amtsgericht": "Amtsgericht Stralsund",
      "registernummer": "HRB 2710",
      "registerart": "HRB",
      "company_name": "Landwirtschaftsgesellschaft Barth mbH",
      "company_seat": "Barth",
      "former_amtsgericht": "Rostock",
      "details": "10.02.2025 (Bekanntmachungsdatum)\n\nMecklenburg-Vorpommern Amtsgericht Stralsund HRB 2710 früher Amtsgericht Rostock\nRegisterbekanntmachung nach dem Umwandlungsgesetz 10.02.2025 (Eintragungsdatum)\n\nLandwirtschaftsgesellschaft Barth mbH\nGesellschaft mit beschränkter Haftung\nBarth\n\nAls nicht eingetragen wird veröffentlicht: Den Gläubigern der an der Verschmelzung beteiligten Rechtsträger ist, wenn sie binnen sechs Monaten nach dem Tag, an dem die Eintragung der Verschmelzung in das Register des Sitzes desjenigen Rechtsträgers, dessen Gläubiger sie sind, nach § 19 Abs. 3 UmwG als bekannt gemacht gilt,\nihren Anspruch nach Grund und Höhe in Textform anmelden, Sicherheit zu leisten, soweit sie nicht Befriedigung verlangen können. Dieses Recht steht den Gläubigern jedoch nur zu, wenn sie glaubhaft machen, dass durch die Verschmelzung die Erfüllung der Forderung gefährdet wird."
    },
    {
      "date": "2025-02-10",
      "id": "100894",
      "original_text": "Registerbekanntmachung nach dem Umwandlungsgesetz\nBaden-Württemberg Amtsgericht Mannheim HRB 753550\nCamelot Management Consultants GmbH – Mannheim",
      "type": "Registerbekanntmachung nach dem Umwandlungsgesetz",
      "state": "Baden-Württemberg",
      "amtsgericht": "Amtsgericht Mannheim",
      "registernummer": "HRB 753550",
      "registerart": "HRB",
      "company_name": "Camelot Management Consultants GmbH",
      "company_seat": "Mannheim",
      "details": "10.02.2025 (Bekanntmachungsdatum)\n\nBaden-Württemberg Amtsgericht Mannheim HRB 753550\nRegisterbekanntmachung nach dem Umwandlungsgesetz 10.02.2025 (Eintragungsdatum)\n\nCamelot Management Consultants GmbH\nGesellschaft mit beschränkter Haftung\nMannheim\n\nDen Gläubigern des an dem Formwechsel beteiligten Rechtsträgers ist, wenn sie binnen sechs Monaten nach dem Tag, an dem die Eintragung des Formwechsels in das Register des Sitzes desjenigen Rechtsträgers, dessen Gläubiger sie sind, nach § 19 Abs. 3 UmwG als bekanntgemacht gilt, ihren Anspruch nach Grund und Höhe schriftlich anmelden, Sicherheit zu leisten, soweit sie nicht Befriedigung verlangen können. Dieses Recht steht den Gläubigern jedoch nur zu, wenn sie glaubhaft machen, dass durch den Formwechsel die Erfüllung ihrer Forderung gefährdet wird.\n\nDen Gläubigern des an dem Formwechsel beteiligten Rechtsträgers ist, wenn sie binnen sechs Monaten nach dem Tag, an dem die Eintragung des Formwechsels in das Register des Sitzes desjenigen Rechtsträgers, dessen Gläubiger sie sind, nach § 19 Abs. 3 UmwG als bekanntgemacht gilt, ihren Anspruch nach Grund und Höhe schriftlich anmelden, Sicherheit zu leisten, soweit sie nicht Befriedigung verlangen können. Dieses Recht steht den Gläubigern jedoch nur zu, wenn sie glaubhaft machen, dass durch den Formwechsel die Erfüllung ihrer Forderung gefährdet wird."
    },
    {
      "date": "2025-02-10",
      "id": "100895",
      "original_text": "Löschungsankündigung\nBaden-Württemberg Amtsgericht Freiburg HRB 391339\nS.C.I. de Lahr GmbH – Lahr",
      "type": "Löschungsankündigung",
      "state": "Baden-Württemberg",
      "amtsgericht": "Amtsgericht Freiburg",
      "registernummer": "HRB 391339",
      "registerart": "HRB",
      "company_name": "S.C.I. de Lahr GmbH",
      "company_seat": "Lahr",
      "details": "10.02.2025 (Bekanntmachungsdatum)\n\nBaden-Württemberg Amtsgericht Freiburg HRB 391339\nLöschungsankündigung\n\nS.C.I. de Lahr GmbH\nGesellschaft mit beschränkter Haftung\nLahr\n\nAls nicht eingetragen wird bekanntgemacht:\nDas Gericht beabsichtigt, die Gesellschaft wegen Vermögenslosigkeit im Handelsregister von Amts wegen nach § 394 FamFG zu löschen. Die Frist zur Geltendmachung eines Widerspruchs gegen die beabsichtigte Löschung ist auf einen Monat ab Veröffentlichung bestimmt."
    },
    {
      "date": "2025-02-10",
      "id": "100896",
      "original_text": "Registerbekanntmachung nach dem Umwandlungsgesetz\nBaden-Württemberg Amtsgericht Mannheim HRB 718120\nCamelot Management Consultants AG – Mannheim",
      "type": "Registerbekanntmachung nach dem Umwandlungsgesetz",
      "state": "Baden-Württemberg",
      "amtsgericht": "Amtsgericht Mannheim",
      "registernummer": "HRB 718120",
      "registerart": "HRB",
      "company_name": "Camelot Management Consultants AG",
      "company_seat": "Mannheim",
      "details": "10.02.2025 (Bekanntmachungsdatum)\n\nBaden-Württemberg Amtsgericht Mannheim HRB 718120\nRegisterbekanntmachung nach dem Umwandlungsgesetz 10.02.2025 (Eintragungsdatum)\n\nCamelot Management Consultants AG\nAktiengesellschaft\nMannheim\n\nDen Gläubigern des an dem Formwechsel beteiligten Rechtsträgers ist, wenn sie binnen sechs Monaten nach dem Tag, an dem die Eintragung des Formwechsels in das Register des Sitzes desjenigen Rechtsträgers, dessen Gläubiger sie sind, nach § 19 Abs. 3 UmwG als bekanntgemacht gilt, ihren Anspruch nach Grund und Höhe schriftlich anmelden, Sicherheit zu leisten, soweit sie nicht Befriedigung verlangen können. Dieses Recht steht den Gläubigern jedoch nur zu, wenn sie glaubhaft machen, dass durch den Formwechsel die Erfüllung ihrer Forderung gefährdet wird."
    },
    {
      "date": "2025-02-10",
      "id": "100897",
      "original_text": "Registerbekanntmachung nach dem Umwandlungsgesetz\nSchleswig-Holstein Amtsgericht Lübeck HRB 2714\npluss Personalmanagement Lübeck GmbH – Lübeck",
      "type": "Registerbekanntmachung nach dem Umwandlungsgesetz",
      "state": "Schleswig-Holstein",
      "amtsgericht": "Amtsgericht Lübeck",
      "registernummer": "HRB 2714",
      "registerart": "HRB",
      "company_name": "pluss Personalmanagement Lübeck GmbH",
      "company_seat": "Lübeck",
      "details": "10.02.2025 (Bekanntmachungsdatum)\n\nSchleswig-Holstein Amtsgericht Lübeck HRB 2714\nRegisterbekanntmachung nach dem Umwandlungsgesetz 07.02.2025 (Eintragungsdatum)\n\npluss Personalmanagement Lübeck GmbH\nGesellschaft mit beschränkter Haftung\nLübeck\n\nZu Eintragungsnummer 13 vom 07.02.2025 wird als nicht eingetragen veröffentlicht:\nDen Gläubigern ist, wenn sie binnen sechs Monaten nach dem Tag, an dem die Eintragung der Umwandlung als bekannt gemacht gilt, ihren Anspruch nach Grund und Höhe schriftlich anmelden, Sicherheit zu leisten, soweit sie nicht Befriedigung verlangen können. Dieses Recht steht den Gläubigern jedoch nur zu, wenn sie glaubhaft machen, dass durch die Umwandlung die Erfüllung ihrer Forderung gefährdet wird."
    },
    {
      "date": "2025-02-10",
      "id": "100898",
      "original_text": "Registerbekanntmachung nach dem Umwandlungsgesetz\nBaden-Württemberg Amtsgericht Stuttgart HRB 798423\nMaGeSa GmbH – Stuttgart",
      "type": "Registerbekanntmachung nach dem Umwandlungsgesetz",
      "state": "Baden-Württemberg",
      "amtsgericht": "Amtsgericht Stuttgart",
      "registernummer": "HRB 798423",
      "registerart": "HRB",
      "company_name": "MaGeSa GmbH",
      "company_seat": "Stuttgart",
      "details": "10.02.2025 (Bekanntmachungsdatum)\n\nBaden-Württemberg Amtsgericht Stuttgart HRB 798423\nRegisterbekanntmachung nach dem Umwandlungsgesetz 10.02.2025 (Eintragungsdatum)\n\nMaGeSa GmbH\nGesellschaft mit beschränkter Haftung\nStuttgart\n\nDen Gläubigern des an dem Formwechsel beteiligten Rechtsträgers ist, wenn sie binnen sechs Monaten nach dem Tag, an dem die Eintragung des Formwechsels in das Register des Sitzes desjenigen Rechtsträgers, dessen Gläubiger sie sind, nach § 19 Abs. 3 UmwG als bekanntgemacht gilt, ihren Anspruch nach Grund und Höhe schriftlich anmelden, Sicherheit zu leisten, soweit sie nicht Befriedigung verlangen können. Dieses Recht steht den Gläubigern jedoch nur zu, wenn sie glaubhaft machen, dass durch den Formwechsel die Erfüllung ihrer Forderung gefährdet wird."
    },
    {
      "date": "2025-02-10",
      "id": "100899",
      "original_text": "Registerbekanntmachung nach dem Umwandlungsgesetz\nBaden-Württemberg Amtsgericht Stuttgart HRB 761129\nMaGeSa Aktiengesellschaft – Stuttgart",
      "type": "Registerbekanntmachung nach dem Umwandlungsgesetz",
      "state": "Baden-Württemberg",
      "amtsgericht": "Amtsgericht Stuttgart",
      "registernummer": "HRB 761129",
      "registerart": "HRB",
      "company_name": "MaGeSa Aktiengesellschaft",
      "company_seat": "Stuttgart",
      "details": "10.02.2025 (Bekanntmachungsdatum)\n\nBaden-Württemberg Amtsgericht Stuttgart HRB 761129\nRegisterbekanntmachung nach dem Umwandlungsgesetz 10.02.2025 (Eintragungsdatum)\n\nMaGeSa Aktiengesellschaft\nAktiengesellschaft\nStuttgart\n\nDen Gläubigern des an dem Formwechsel beteiligten Rechtsträgers ist, wenn sie binnen sechs Monaten nach dem Tag, an dem die Eintragung des Formwechsels in das Register des Sitzes desjenigen Rechtsträgers, dessen Gläubiger sie sind, nach § 19 Abs. 3 UmwG als bekanntgemacht gilt, ihren Anspruch nach Grund und Höhe schriftlich anmelden, Sicherheit zu leisten, soweit sie nicht Befriedigung verlangen können. Dieses Recht steht den Gläubigern jedoch nur zu, wenn sie glaubhaft machen, dass durch den Formwechsel die Erfüllung ihrer Forderung gefährdet wird."
    },
    {
      "date": "2025-02-10",
      "id": "100900",
      "original_text": "Sonstige Registerbekanntmachung\nSachsen Amtsgericht Leipzig HRB 17905\nSaxess AG – Leipzig",
      "type": "Sonstige Registerbekanntmachung",
      "state": "Sachsen",
      "amtsgericht": "Amtsgericht Leipzig",
      "registernummer": "HRB 17905",
      "registerart": "HRB",
      "company_name": "Saxess AG",
      "company_seat": "Leipzig",
      "details": "10.02.2025 (Bekanntmachungsdatum)\n\nSachsen Amtsgericht Leipzig HRB 17905\nSonstige Registerbekanntmachung 10.02.2025 (Eintragungsdatum)\n\nSaxess AG\nAktiengesellschaft\nLeipzig\n\nDen Gläubigern der Gesellschaft, deren Forderungen begründet worden sind bevor die Eintragung der Beendigung des Teilgewinnabführungsvertrages in das Handelsregister nach § 10 des Handelsgesetzbuches als bekanntgemacht gilt, hat der andere Vertragsteil Sicherheit zu leisten, wenn sie sich binnen sechs Monaten nach der Bekanntmachung der Eintragung zu diesem Zweck bei ihm melden."
    },
    {
      "date": "2025-02-10",
      "id": "100901",
      "original_text": "Löschungsankündigung\nSachsen Amtsgericht Chemnitz HRB 11910\nFrikoli Miederwaren GmbH – Limbach-Oberfrohna",
      "type": "Löschungsankündigung",
      "state": "Sachsen",
      "amtsgericht": "Amtsgericht Chemnitz",
      "registernummer": "HRB 11910",
      "registerart": "HRB",
      "company_name": "Frikoli Miederwaren GmbH",
      "company_seat": "Limbach-Oberfrohna",
      "details": "10.02.2025 (Bekanntmachungsdatum)\n\nSachsen Amtsgericht Chemnitz HRB 11910\nLöschungsankündigung\n\nFrikoli Miederwaren GmbH\nGesellschaft mit beschränkter Haftung\nLimbach-Oberfrohna\n\nDas Registergericht beabsichtigt, die im Handelsregister eingetragene Gesellschaft von Amts wegen nach § 394 FamFG zu löschen. Die Frist zu Erhebung eines Widerspruchs gegen die beabsichtigte Löschung wird auf einen Monat festgesetzt."
    },
    {
      "date": "2025-02-10",
      "id": "100902",
      "original_text": "Einreichung neuer Dokumente\nSachsen Amtsgericht Dresden HRB 45156\nTRUMPF Sachsen SE – Neukirch/Lausitz",
      "type": "Einreichung neuer Dokumente",
      "state": "Sachsen",
      "amtsgericht": "Amtsgericht Dresden",
      "registernummer": "HRB 45156",
      "registerart": "HRB",
      "company_name": "TRUMPF Sachsen SE",
      "company_seat": "Neukirch/Lausitz",
      "details": "10.02.2025 (Bekanntmachungsdatum)\n\nSachsen Amtsgericht Dresden HRB 45156\nEinreichung neuer Dokumente\n\nTRUMPF Sachsen SE\nEuropäische Aktiengesellschaft (SE)\nNeukirch/Lausitz\n\nAm 07.02.2025 wurde beim Handelsregister des Amtsgerichts Dresden die Liste der Mitglieder des Aufsichtsrats gemäß § 106 AktG eingereicht."
    },
    {
      "date": "2025-02-10",
      "id": "100903",
      "original_text": "Registerbekanntmachung nach dem Umwandlungsgesetz\nBaden-Württemberg Amtsgericht Stuttgart HRB 753330\nBHK Services GmbH – Bietigheim-Bissingen",
      "type": "Registerbekanntmachung nach dem Umwandlungsgesetz",
      "state": "Baden-Württemberg",
      "amtsgericht": "Amtsgericht Stuttgart",
      "registernummer": "HRB 753330",
      "registerart": "HRB",
      "company_name": "BHK Services GmbH",
      "company_seat": "Bietigheim-Bissingen",
      "details": "10.02.2025 (Bekanntmachungsdatum)\n\nBaden-Württemberg Amtsgericht Stuttgart HRB 753330\nRegisterbekanntmachung nach dem Umwandlungsgesetz 10.02.2025 (Eintragungsdatum)\n\nBHK Services GmbH\nGesellschaft mit beschränkter Haftung\nBietigheim-Bissingen\n\nDen Gläubigern der an der Verschmelzung beteiligten Rechtsträger ist, wenn sie binnen sechs Monaten nach dem Tag, an dem die Eintragung der Verschmelzung in das Register des Sitzes desjenigen Rechtsträgers, dessen Gläubiger sie sind, nach § 19 Abs. 3 UmwG als bekanntgemacht gilt, ihren Anspruch nach Grund und Höhe schriftlich anmelden, Sicherheit zu leisten, soweit sie nicht Befriedigung verlangen können. Dieses Recht steht den Gläubigern jedoch nur zu, wenn sie glaubhaft machen, dass durch die Verschmelzung die Erfüllung ihrer Forderung gefährdet wird."
    },
    {
      "date": "2025-02-10",
      "id": "100904",
      "original_text": "Löschungsankündigung\nNiedersachsen Amtsgericht Osnabrück VR 140542\nMangyanen-Mission auf der Insel Mindoro/Philippinen e.V. – Bramsche-Hesepe",
      "type": "Löschungsankündigung",
      "state": "Niedersachsen",
      "amtsgericht": "Amtsgericht Osnabrück",
      "registernummer": "VR 140542",
      "registerart": "VR",
      "company_name": "Mangyanen-Mission auf der Insel Mindoro/Philippinen e.V.",
      "company_seat": "Bramsche-Hesepe",
      "details": "10.02.2025 (Bekanntmachungsdatum)\n\nNiedersachsen Amtsgericht Osnabrück VR 140542\nLöschungsankündigung 10.02.2025 (Eintragungsdatum)\n\nMangyanen-Mission auf der Insel Mindoro/Philippinen e.V.\neingetragener Verein\nBramsche-Hesepe\n\nDas Registergericht beabsichtigt, den Verein von Amts wegen nach § 395 FamFG wegen Wegfalls aller Mitglieder zu löschen. Die Frist zur Erhebung eines Widerspruchs ist auf 1 Monat ab dieser Registerbekanntmachung festgesetzt."
    },
    {
      "date": "2025-02-10",
      "id": "100905",
      "original_text": "Löschungsankündigung\nNiedersachsen Amtsgericht Hannover HRB 210810\nIBG Spedition & Logistik GmbH – Hannover",
      "type": "Löschungsankündigung",
      "state": "Niedersachsen",
      "amtsgericht": "Amtsgericht Hannover",
      "registernummer": "HRB 210810",
      "registerart": "HRB",
      "company_name": "IBG Spedition & Logistik GmbH",
      "company_seat": "Hannover",
      "details": "10.02.2025 (Bekanntmachungsdatum)\n\nNiedersachsen Amtsgericht Hannover HRB 210810\nLöschungsankündigung\n\nIBG Spedition & Logistik GmbH\nGesellschaft mit beschränkter Haftung\nHannover\n\nDas Registergericht beabsichtigt, die Gesellschaft von Amts wegen nach § 394 FamFG zu löschen. Die Frist zur Erhebung eines Widerspruchs ist auf 1 Monat ab dieser Registerbekanntmachung festgesetzt."
    },
    {
      "date": "2025-02-10",
      "id": "100906",
      "original_text": "Registerbekanntmachung nach dem Umwandlungsgesetz\nNiedersachsen Amtsgericht Hildesheim HRB 209214\nZimmerei Brose GmbH – Uetze",
      "type": "Registerbekanntmachung nach dem Umwandlungsgesetz",
      "state": "Niedersachsen",
      "amtsgericht": "Amtsgericht Hildesheim",
      "registernummer": "HRB 209214",
      "registerart": "HRB",
      "company_name": "Zimmerei Brose GmbH",
      "company_seat": "Uetze",
      "details": "10.02.2025 (Bekanntmachungsdatum)\n\nNiedersachsen Amtsgericht Hildesheim HRB 209214\nRegisterbekanntmachung nach dem Umwandlungsgesetz 10.02.2025 (Eintragungsdatum)\n\nZimmerei Brose GmbH\nGesellschaft mit beschränkter Haftung\nUetze\n\nDen Gläubigern der an der Verschmelzung beteiligten Rechtsträger ist, wenn sie binnen sechs Monaten nach dem Tag, an dem die Eintragung der Verschmelzung in das Register des Sitzes desjenigen Rechtsträgers, dessen Gläubiger sie sind, nach § 19  Abs.  3 UmwG als bekannt gemacht gilt, ihren Anspruch nach Grund und Höhe schriftlich anmelden, Sicherheit zu leisten, soweit sie nicht Befriedigung verlangen können. Dieses Recht steht den Gläubigern jedoch nur zu, wenn sie glaubhaft machen, dass durch die Verschmelzung die Erfüllung der Forderung gefährdet wird."
    },
    {
      "date": "2025-02-10",
      "id": "100907",
      "original_text": "Registerbekanntmachung nach dem Umwandlungsgesetz\nRheinland-Pfalz Amtsgericht Wittlich HRA 42007\nPMI KG – Morbach",
      "type": "Registerbekanntmachung nach dem Umwandlungsgesetz",
      "state": "Rheinland-Pfalz",
      "amtsgericht": "Amtsgericht Wittlich",
      "registernummer": "HRA 42007",
      "registerart": "HRA",
      "company_name": "PMI KG",
      "company_seat": "Morbach",
      "details": "10.02.2025 (Bekanntmachungsdatum)\n\nRheinland-Pfalz Amtsgericht Wittlich HRA 42007\nRegisterbekanntmachung nach dem Umwandlungsgesetz 10.02.2025 (Eintragungsdatum)\n\nPMI KG\nKommanditgesellschaft\nMorbach\n\nAls nicht eingetragen wird veröffentlicht: Den Gläubigern der an der Spaltung beteiligten Rechtsträger ist, wenn sie binnen sechs Monaten nach dem Tag, an dem die Eintragung der Spaltung in das Register des Sitzes desjenigen Rechtsträgers, dessen Gläubiger sie sind, nach § 19 Abs. 3 UmwG als bekanntgemacht gilt, ihren Anspruch nach Grund und Höhe schriftlich anmelden, Sicherheit zu leisten, soweit sie nicht Befriedigung verlangen können. Dieses Recht steht den Gläubigern jedoch nur zu, wenn sie glaubhaft machen, dass durch die Spaltung die Erfüllung der Forderung gefährdet wird."
    },
    {
      "date": "2025-02-10",
      "id": "100908",
      "original_text": "Sonstige Registerbekanntmachung\nRheinland-Pfalz Amtsgericht Montabaur HRB 23963\n1&1 Telecommunication SE – Montabaur",
      "type": "Sonstige Registerbekanntmachung",
      "state": "Rheinland-Pfalz",
      "amtsgericht": "Amtsgericht Montabaur",
      "registernummer": "HRB 23963",
      "registerart": "HRB",
      "company_name": "1&1 Telecommunication SE",
      "company_seat": "Montabaur",
      "details": "10.02.2025 (Bekanntmachungsdatum)\n\nRheinland-Pfalz Amtsgericht Montabaur HRB 23963\nSonstige Registerbekanntmachung\n\n1&1 Telecommunication SE\nEuropäische Aktiengesellschaft (SE)\nMontabaur\n\nDem Registergericht ist eine Liste der Mitglieder des Aufsichtsrates eingereicht worden."
    },
    {
      "date": "2025-02-10",
      "id": "100909",
      "original_text": "Löschungsankündigung\nRheinland-Pfalz Amtsgericht Landau HRB 30229\nAutohaus Müller GmbH – Pleisweiler-Oberhofen",
      "type": "Löschungsankündigung",
      "state": "Rheinland-Pfalz",
      "amtsgericht": "Amtsgericht Landau",
      "registernummer": "HRB 30229",
      "registerart": "HRB",
      "company_name": "Autohaus Müller GmbH",
      "company_seat": "Pleisweiler-Oberhofen",
      "details": "10.02.2025 (Bekanntmachungsdatum)\n\nRheinland-Pfalz Amtsgericht Landau HRB 30229\nLöschungsankündigung\n\nAutohaus Müller GmbH\nGesellschaft mit beschränkter Haftung\nPleisweiler-Oberhofen\n\nDas Registergericht beabsichtigt die Gesellschaft von Amts wegen nach § 394 FamFG zu löschen. Die Frist zur Erhebung eines Widerspruchs ist auf einen Monat festgesetzt."
    },
    {
      "date": "2025-02-10",
      "id": "100910",
      "original_text": "Registerbekanntmachung nach dem Umwandlungsgesetz\nBremen Amtsgericht Bremen HRB 38320\nCyber Security Intelligence UG (haftungsbeschränkt) – Bremen",
      "type": "Registerbekanntmachung nach dem Umwandlungsgesetz",
      "state": "Bremen",
      "amtsgericht": "Amtsgericht Bremen",
      "registernummer": "HRB 38320",
      "registerart": "HRB",
      "company_name": "Cyber Security Intelligence UG (haftungsbeschränkt)",
      "company_seat": "Bremen",
      "details": "10.02.2025 (Bekanntmachungsdatum)\n\nBremen Amtsgericht Bremen HRB 38320\nRegisterbekanntmachung nach dem Umwandlungsgesetz 07.02.2025 (Eintragungsdatum)\n\nCyber Security Intelligence UG (haftungsbeschränkt)\nGesellschaft mit beschränkter Haftung\nBremen\n\nZu Eintragungsnummer 4 vom 07.02.2025 wird als nicht eingetragen veröffentlicht:  Als nicht eingetragen wird veröffentlicht: Den Gläubigern der an der Verschmelzung beteiligten Rechtsträger ist, wenn sie binnen sechs Monaten nach dem Tag, an dem die Eintragung der Verschmelzung in das Register des Sitzes desjenigen Rechtsträgers, dessen Gläubiger sie sind, als bekannt gemacht gilt, ihren Anspruch nach Grund und Höhe schriftlich anmelden, Sicherheit zu leisten, soweit sie nicht Befriedigung verlangen können. Dieses Recht steht den Gläubigern jedoch nur zu, wenn sie glaubhaft machen, dass durch die Verschmelzung die Erfüllung ihrer Forderung gefährdet wird. Das Recht, Sicherheitsleistung zu verlangen, steht Gläubigern nicht zu, die im Falle der Insolvenz ein Recht auf vorzugsweise Befriedigung aus einer Deckungsmasse haben, die nach gesetzlicher Vorschrift zu ihrem Schutz errichtet und staatlich überwacht ist."
    },
    {
      "date": "2025-02-10",
      "id": "100911",
      "original_text": "Löschungsankündigung\nBremen Amtsgericht Bremen HRB 31595\nFDS Transporte GmbH – Bremen",
      "type": "Löschungsankündigung",
      "state": "Bremen",
      "amtsgericht": "Amtsgericht Bremen",
      "registernummer": "HRB 31595",
      "registerart": "HRB",
      "company_name": "FDS Transporte GmbH",
      "company_seat": "Bremen",
      "details": "10.02.2025 (Bekanntmachungsdatum)\n\nBremen Amtsgericht Bremen HRB 31595\nLöschungsankündigung\n\nFDS Transporte GmbH\nGesellschaft mit beschränkter Haftung\nBremen\n\nEs ist beabsichtigt die im Handelsregister eingetragene Gesellschaft von Amts wegen gemäß § 394 FamFG zu löschen. Gegen die Löschung kann beim AG Bremen schriftlich oder zu Protokoll der Geschäftsstelle Widerspruch eingelegt werden. Widerspruchsfrist 4 Wochen."
    },
    {
      "date": "2025-02-10",
      "id": "100912",
      "original_text": "Einreichung neuer Dokumente\nBremen Amtsgericht Bremen HRB 30268\nOHB SE – Bremen",
      "type": "Einreichung neuer Dokumente",
      "state": "Bremen",
      "amtsgericht": "Amtsgericht Bremen",
      "registernummer": "HRB 30268",
      "registerart": "HRB",
      "company_name": "OHB SE",
      "company_seat": "Bremen",
      "details": "10.02.2025 (Bekanntmachungsdatum)\n\nBremen Amtsgericht Bremen HRB 30268\nEinreichung neuer Dokumente\n\nOHB SE\nEuropäische Aktiengesellschaft (SE)\nBremen\n\nAls nicht eingetragen wird bekannt gemacht: Liste des Aufsichtsrats wurde eingereicht."
    },
    {
      "date": "2025-02-10",
      "id": "100913",
      "original_text": "Einreichung neuer Dokumente\nNordrhein-Westfalen Amtsgericht Köln HRB 35380\nAZ Augenchirurgische Zentren AG – Köln",
      "type": "Einreichung neuer Dokumente",
      "state": "Nordrhein-Westfalen",
      "amtsgericht": "Amtsgericht Köln",
      "registernummer": "HRB 35380",
      "registerart": "HRB",
      "company_name": "AZ Augenchirurgische Zentren AG",
      "company_seat": "Köln",
      "details": "10.02.2025 (Bekanntmachungsdatum)\n\nNordrhein-Westfalen Amtsgericht Köln HRB 35380\nEinreichung neuer Dokumente 10.02.2025 (Eintragungsdatum)\n\nAZ Augenchirurgische Zentren AG\nAktiengesellschaft\nKöln\n\nDem Registergericht ist eine Liste der Mitglieder des Aufsichtsrates eingereicht worden."
    },
    {
      "date": "2025-02-10",
      "id": "100914",
      "original_text": "Löschungsankündigung\nNordrhein-Westfalen Amtsgericht Köln HRA 12789\nHans Böhne Gewerbe- und Wohnimmobilien KG – Köln",
      "type": "Löschungsankündigung",
      "state": "Nordrhein-Westfalen",
      "amtsgericht": "Amtsgericht Köln",
      "registernummer": "HRA 12789",
      "registerart": "HRA",
      "company_name": "Hans Böhne Gewerbe- und Wohnimmobilien KG",
      "company_seat": "Köln",
      "details": "10.02.2025 (Bekanntmachungsdatum)\n\nNordrhein-Westfalen Amtsgericht Köln HRA 12789\nLöschungsankündigung\n\nHans Böhne Gewerbe- und Wohnimmobilien KG\nKommanditgesellschaft\nKöln\n\nDas Registergericht beabsichtigt nachfolgende Firmen von Amts wegen nach § 31 Abs. 2 HGB zu löschen. Die Frist zur Erhebung eines Widerspruchs ist auf 1 Monat festgesetzt."
    },
    {
      "date": "2025-02-10",
      "id": "100915",
      "original_text": "Löschungsankündigung\nNordrhein-Westfalen Amtsgericht Köln HRB 116996\nCandy Town GmbH – Köln",
      "type": "Löschungsankündigung",
      "state": "Nordrhein-Westfalen",
      "amtsgericht": "Amtsgericht Köln",
      "registernummer": "HRB 116996",
      "registerart": "HRB",
      "company_name": "Candy Town GmbH",
      "company_seat": "Köln",
      "details": "10.02.2025 (Bekanntmachungsdatum)\n\nNordrhein-Westfalen Amtsgericht Köln HRB 116996\nLöschungsankündigung\n\nCandy Town GmbH\nGesellschaft mit beschränkter Haftung\nKöln\n\nDas Registergericht beabsichtigt die Gesellschaft von Amts wegen nach § 394 FamFG zu löschen. Die Frist zur Erhebung eines Widerspruchs ist auf einen Monat festgesetzt."
    },
    {
      "date": "2025-02-10",
      "id": "100916",
      "original_text": "Registerbekanntmachung nach dem Umwandlungsgesetz\nNordrhein-Westfalen Amtsgericht Hagen HRB 10967\nOK Indoor Soccer GmbH – Hagen",
      "type": "Registerbekanntmachung nach dem Umwandlungsgesetz",
      "state": "Nordrhein-Westfalen",
      "amtsgericht": "Amtsgericht Hagen",
      "registernummer": "HRB 10967",
      "registerart": "HRB",
      "company_name": "OK Indoor Soccer GmbH",
      "company_seat": "Hagen",
      "details": "10.02.2025 (Bekanntmachungsdatum)\n\nNordrhein-Westfalen Amtsgericht Hagen HRB 10967\nRegisterbekanntmachung nach dem Umwandlungsgesetz 10.02.2025 (Eintragungsdatum)\n\nOK Indoor Soccer GmbH\nGesellschaft mit beschränkter Haftung\nHagen\n\nDen Gläubigern des formwechselnden Rechtsträgers ist, wenn sie binnen sechs Monaten nach dem Tag, an dem die Eintragung des Formwechsels nach § 201 UmwG als bekannt gemacht gilt, ihren Anspruch nach Grund und Höhe schriftlich anmelden, Sicherheit zu leisten, soweit sie nicht Befriedigung verlangen können. Dieses Recht steht ihnen jedoch nur zu, wenn sie glaubhaft machen, dass durch den Formwechsel  die Erfüllung ihrer Forderung gefährdet wird."
    },
    {
      "date": "2025-02-10",
      "id": "100917",
      "original_text": "Einreichung neuer Dokumente\nNordrhein-Westfalen Amtsgericht Duisburg HRB 5631\nWohndorf Laar Treuhand- und Beteiligungsgesellschaft mit beschränkter Haftung – Duisburg",
      "type": "Einreichung neuer Dokumente",
      "state": "Nordrhein-Westfalen",
      "amtsgericht": "Amtsgericht Duisburg",
      "registernummer": "HRB 5631",
      "registerart": "HRB",
      "company_name": "Wohndorf Laar Treuhand- und Beteiligungsgesellschaft mit beschränkter Haftung",
      "company_seat": "Duisburg",
      "details": "10.02.2025 (Bekanntmachungsdatum)\n\nNordrhein-Westfalen Amtsgericht Duisburg HRB 5631\nEinreichung neuer Dokumente\n\nWohndorf Laar Treuhand- und Beteiligungsgesellschaft mit beschränkter Haftung\nGesellschaft mit beschränkter Haftung\nDuisburg\n\nDem Registergericht ist eine Liste der Mitglieder des Aufsichtsrates eingereicht worden."
    },
    {
      "date": "2025-02-10",
      "id": "100918",
      "original_text": "Registerbekanntmachung nach dem Umwandlungsgesetz\nNordrhein-Westfalen Amtsgericht Paderborn HRB 15464\nDentalAesthetics MVZ GmbH – Paderborn",
      "type": "Registerbekanntmachung nach dem Umwandlungsgesetz",
      "state": "Nordrhein-Westfalen",
      "amtsgericht": "Amtsgericht Paderborn",
      "registernummer": "HRB 15464",
      "registerart": "HRB",
      "company_name": "DentalAesthetics MVZ GmbH",
      "company_seat": "Paderborn",
      "details": "10.02.2025 (Bekanntmachungsdatum)\n\nNordrhein-Westfalen Amtsgericht Paderborn HRB 15464\nRegisterbekanntmachung nach dem Umwandlungsgesetz 10.02.2025 (Eintragungsdatum)\n\nDentalAesthetics MVZ GmbH\nGesellschaft mit beschränkter Haftung\nPaderborn\n\nDen Gläubigern der an der Verschmelzung beteiligten Rechtsträger ist, wenn sie binnen sechs Monaten nach dem Tag, an dem die Eintragung der Verschmelzung in das Register des Sitzes desjenigen Rechtsträgers, dessen Gläubiger sie sind, nach § 19 Absatz 3 UmwG als bekanntgemacht gilt, ihren Anspruch nach Grund und Höhe schriftlich anmelden, Sicherheit zu leisten, soweit sie nicht Befriedigung verlangen können. Dieses Recht steht den Gläubigern jedoch nur zu, wenn sie glaubhaft machen, dass durch die Verschmelzung die Erfüllung ihrer Forderung gefährdet wird."
    },
    {
      "date": "2025-02-10",
      "id": "100919",
      "original_text": "Registerbekanntmachung nach dem Umwandlungsgesetz\nNordrhein-Westfalen Amtsgericht Köln HRB 117740\nTewes Advisory GmbH – Köln",
      "type": "Registerbekanntmachung nach dem Umwandlungsgesetz",
      "state": "Nordrhein-Westfalen",
      "amtsgericht": "Amtsgericht Köln",
      "registernummer": "HRB 117740",
      "registerart": "HRB",
      "company_name": "Tewes Advisory GmbH",
      "company_seat": "Köln",
      "details": "10.02.2025 (Bekanntmachungsdatum)\n\nNordrhein-Westfalen Amtsgericht Köln HRB 117740\nRegisterbekanntmachung nach dem Umwandlungsgesetz 10.02.2025 (Eintragungsdatum)\n\nTewes Advisory GmbH\nGesellschaft mit beschränkter Haftung\nKöln\n\nDen Gläubigern der an der Verschmelzung beteiligten Rechtsträger ist, wenn sie binnen sechs Monaten nach dem Tag, an dem die Eintragung der Verschmelzung in das Register des Sitzes desjenigen Rechtsträgers, dessen Gläubiger sie sind, nach § 19 Absatz 3 UmwG als bekanntgemacht gilt, ihren Anspruch nach Grund und Höhe schriftlich anmelden, Sicherheit zu leisten, soweit sie nicht Befriedigung verlangen können. Dieses Recht steht den Gläubigern jedoch nur zu, wenn sie glaubhaft machen, dass durch die Verschmelzung die Erfüllung ihrer Forderung gefährdet wird."
    },
    {
      "date": "2025-02-10",
      "id": "100920",
      "original_text": "Löschungsankündigung\nNordrhein-Westfalen Amtsgericht Mönchengladbach HRB 18753\nAP INFRA GmbH – Wegberg",
      "type": "Löschungsankündigung",
      "state": "Nordrhein-Westfalen",
      "amtsgericht": "Amtsgericht Mönchengladbach",
      "registernummer": "HRB 18753",
      "registerart": "HRB",
      "company_name": "AP INFRA GmbH",
      "company_seat": "Wegberg",
      "details": "10.02.2025 (Bekanntmachungsdatum)\n\nNordrhein-Westfalen Amtsgericht Mönchengladbach HRB 18753\nLöschungsankündigung\n\nAP INFRA GmbH\nGesellschaft mit beschränkter Haftung\nWegberg\n\nAP INFRA GmbH, Wegberg (Amtsgericht Mönchengladbach, HRB 18753).\nDas Registergericht beabsichtigt, die im Handelsregister eingetragene Gesellschaft gemäß § 394 Absatz 1 FamFG wegen Vermögenslosigkeit von Amts wegen zu löschen. Gegen diese Verfügung kann Widerspruch eingelegt werden. Die Frist zur Erhebung eines Widerspruchs gegen die beabsichtigte Löschung von Amts wegen ist auf drei Monate festgesetzt."
    },
    {
      "date": "2025-02-10",
      "id": "100921",
      "original_text": "Löschungsankündigung\nNordrhein-Westfalen Amtsgericht Dortmund HRB 29622\nBHT UG (haftungsbeschränkt) – Castrop-Rauxel",
      "type": "Löschungsankündigung",
      "state": "Nordrhein-Westfalen",
      "amtsgericht": "Amtsgericht Dortmund",
      "registernummer": "HRB 29622",
      "registerart": "HRB",
      "company_name": "BHT UG (haftungsbeschränkt)",
      "company_seat": "Castrop-Rauxel",
      "details": "10.02.2025 (Bekanntmachungsdatum)\n\nNordrhein-Westfalen Amtsgericht Dortmund HRB 29622\nLöschungsankündigung 10.02.2025 (Eintragungsdatum)\n\nBHT UG (haftungsbeschränkt)\nGesellschaft mit beschränkter Haftung\nCastrop-Rauxel\n\nDas Registergericht beabsichtigt die Gesellschaft von Amts wegen nach § 394 FamFG zu löschen. Die Frist zur Erhebung eines Widerspruchs ist auf zwei Monate festgesetzt."
    },
    {
      "date": "2025-02-10",
      "id": "100922",
      "original_text": "Löschungsankündigung\nNordrhein-Westfalen Amtsgericht Köln HRB 95941\nDTB Diamond Top Brands GmbH – Köln",
      "type": "Löschungsankündigung",
      "state": "Nordrhein-Westfalen",
      "amtsgericht": "Amtsgericht Köln",
      "registernummer": "HRB 95941",
      "registerart": "HRB",
      "company_name": "DTB Diamond Top Brands GmbH",
      "company_seat": "Köln",
      "details": "10.02.2025 (Bekanntmachungsdatum)\n\nNordrhein-Westfalen Amtsgericht Köln HRB 95941\nLöschungsankündigung\n\nDTB Diamond Top Brands GmbH\nGesellschaft mit beschränkter Haftung\nKöln\n\nDas Registergericht beabsichtigt die Gesellschaft von Amts wegen nach § 394 FamFG zu löschen. Die Frist zur Erhebung eines Widerspruchs ist auf einen Monat festgesetzt."
    },
    {
      "date": "2025-02-10",
      "id": "100923",
      "original_text": "Löschungsankündigung\nNordrhein-Westfalen Amtsgericht Düsseldorf HRB 51401\nJohnAlan GmbH – Düsseldorf",
      "type": "Löschungsankündigung",
      "state": "Nordrhein-Westfalen",
      "amtsgericht": "Amtsgericht Düsseldorf",
      "registernummer": "HRB 51401",
      "registerart": "HRB",
      "company_name": "JohnAlan GmbH",
      "company_seat": "Düsseldorf",
      "details": "10.02.2025 (Bekanntmachungsdatum)\n\nNordrhein-Westfalen Amtsgericht Düsseldorf HRB 51401\nLöschungsankündigung\n\nJohnAlan GmbH\nGesellschaft mit beschränkter Haftung\nDüsseldorf\n\nDas Registergericht beabsichtigt die Gesellschaft von Amts wegen nach § 394 FamFG zu löschen. Die Frist zur Erhebung eines Widerspruchs ist auf 3 Wochen festgesetzt.\n\nRechtsbehelfsbelehrung:\nDas Widerspruchsrecht steht jedem zu, der an der Unterlassung der Löschung ein berechtigtes Interesse hat. Der Widerspruch ist bei dem Amtsgericht Düsseldorf -Registergericht-, Werdener Straße 1, 40227 Düsseldorf schriftlich in deutscher Sprache oder zur Niederschrift der Geschäftsstelle einzulegen. Der Widerspruch kann auch zur Niederschrift der Geschäftsstelle eines jeden Amtsgerichtes abgegeben werden. Die Einlegung ist auch durch Übertragung eines elektronischen Dokuments an die elektronische Poststelle des Gerichts möglich. Das elektronische Dokument muss für die Bearbeitung durch das Gericht geeignet und mit einer qualifizierten elektronischen Signatur der verantwortenden Person versehen sein oder von der verantwortenden Person signiert und auf einem sicheren Übermittlungsweg gemäß § 130a ZPO nach näherer Maßgabe der Verordnung über die technischen Rahmenbedingungen des elektronischen Rechtsverkehrs und über das besondere elektronische Behördenpostfach (BGBl. I, S.3803) eingereicht werden. Weitere Informationen erhalten Sie auf der Internetseite www.justiz.de.\nDer Widerspruch muss spätestens innerhalb der gesetzten Frist nach dem Datum der Bekanntmachung der Löschungsankündigung bei dem Amtsgericht - Registergericht - Düsseldorf eingegangen sein.  Dies gilt auch dann, wenn der Widerspruch zur Niederschrift der Geschäftsstelle eines anderen Amtsgerichtes abgegeben wurde. Die Frist beginnt mit dem Tage der Bekanntmachung der Löschungsankündigung in dem für die Bekanntmachung der Eintragungen in das Handelsregister bestimmten elektronischen Informations- und Kommunikationssystem nach § 10 des Handelsgesetzbuches. Fällt das Ende der Frist auf einen Sonntag, einen allgemeinen Feiertag oder Sonnabend, so endet die Frist mit Ablauf des nächsten Werktages.\nDer Widerspruch muss die Bezeichnung der angefochtenen Löschungsankündigung sowie die Erklärung enthalten, dass Widerspruch gegen diese Löschungsankündigung eingelegt wird. Er ist zu unterzeichnen und soll begründet werden."
    },
    {
      "date": "2025-02-10",
      "id": "100924",
      "original_text": "Löschungsankündigung\nNordrhein-Westfalen Amtsgericht Duisburg HRB 29974\nM. Real Estate GmbH – Oberhausen",
      "type": "Löschungsankündigung",
      "state": "Nordrhein-Westfalen",
      "amtsgericht": "Amtsgericht Duisburg",
      "registernummer": "HRB 29974",
      "registerart": "HRB",
      "company_name": "M. Real Estate GmbH",
      "company_seat": "Oberhausen",
      "details": "10.02.2025 (Bekanntmachungsdatum)\n\nNordrhein-Westfalen Amtsgericht Duisburg HRB 29974\nLöschungsankündigung\n\nM. Real Estate GmbH\nGesellschaft mit beschränkter Haftung\nOberhausen\n\nDas Registergericht beabsichtigt, die im Handelsregister eingetragene Gesellschaft M. Real Estate GmbH gemäß § 394 Absatz 1 FamFG wegen Vermögenslosigkeit von Amts wegen zu löschen. Gegen diese Verfügung kann Widerspruch eingelegt werden. Die Frist zur Erhebung eines Widerspruchs gegen die beabsichtigte Löschung von Amts wegen ist auf drei Monate festgesetzt. Rechtsbehelfsbelehrung Der Widerspruch ist bei dem Amtsgericht Duisburg, Kardinal-Galen-Str. 124-132, 47058 Duisburg schriftlich in deutscher Sprache oder zur Niederschrift der Geschäftsstelle einzulegen. Der Widerspruch kann auch zur Niederschrift der Geschäftsstelle eines jeden Amtsgerichtes abgegeben werden. Die Einlegung ist auch durch Übertragung eines elektronischen Dokuments an die elektronische Poststelle des Gerichts möglich. Das elektronische Dokument muss für die Bearbeitung durch das Gericht geeignet und mit einer qualifizierten elektronischen Signatur der verantwortenden Person versehen sein oder von der verantwortenden Person signiert und auf einem sicheren Übermittlungsweg gemäß § 130 a ZPO nach näherer Maßgabe der Verordnung über die technischen Rahmenbedingungen des elektronischen Rechtsverkehrs und über das besondere elektronische Behördenpostfach (BGBl. I, S. 3803) eingereicht werden. Weitere Informationen erhalten Sie auf der Internetseite www.justiz.de <http://www.justiz.de>. Der Widerspruch muss spätestens innerhalb der gesetzten Frist bei dem Amtsgericht Duisburg eingegangen sein. Dies gilt auch dann, wenn der Widerspruch zur Niederschrift der Geschäftsstelle eines anderen Amtsgerichtes abgegeben wurde. Die Frist beginnt mit der Veröffentlichung. Fällt das Ende der Frist auf einen Sonntag, einen allgemeinen Feiertag oder Sonnabend, so endet die Frist mit Ablauf des nächsten Werktages. Der Widerspruch muss die Bezeichnung der angefochtenen Verfügung sowie die Erklärung enthalten, dass Widerspruch gegen diese Verfügung eingelegt wird. Er ist zu unterzeichnen und soll begründet werden."
    },
    {
      "date": "2025-02-10",
      "id": "100925",
      "original_text": "Einreichung neuer Dokumente\nNordrhein-Westfalen Amtsgericht Düsseldorf HRB 8372\nSalzgitter Mannesmann Handel GmbH – Düsseldorf",
      "type": "Einreichung neuer Dokumente",
      "state": "Nordrhein-Westfalen",
      "amtsgericht": "Amtsgericht Düsseldorf",
      "registernummer": "HRB 8372",
      "registerart": "HRB",
      "company_name": "Salzgitter Mannesmann Handel GmbH",
      "company_seat": "Düsseldorf",
      "details": "10.02.2025 (Bekanntmachungsdatum)\n\nNordrhein-Westfalen Amtsgericht Düsseldorf HRB 8372\nEinreichung neuer Dokumente\n\nSalzgitter Mannesmann Handel GmbH\nGesellschaft mit beschränkter Haftung\nDüsseldorf\n\nDem Registergericht ist eine Liste der Mitglieder des Aufsichtsrates eingereicht worden."
    },
    {
      "date": "2025-02-10",
      "id": "100926",
      "original_text": "Löschungsankündigung\nNordrhein-Westfalen Amtsgericht Aachen VR 1345\nRadfahr-Verein 1899 Würselen – Würselen",
      "type": "Löschungsankündigung",
      "state": "Nordrhein-Westfalen",
      "amtsgericht": "Amtsgericht Aachen",
      "registernummer": "VR 1345",
      "registerart": "VR",
      "company_name": "Radfahr-Verein 1899 Würselen",
      "company_seat": "Würselen",
      "details": "10.02.2025 (Bekanntmachungsdatum)\n\nNordrhein-Westfalen Amtsgericht Aachen VR 1345\nLöschungsankündigung\n\nRadfahr-Verein 1899 Würselen\neingetragener Verein\nWürselen\n\nDas Registergericht beabsichtigt, von Amts wegen den Verein wegen Wegfalls aller Mitglieder wegen Unzulässigkeit nach § 395 FamFG zu löschen.\n\nZur Geltendmachung des Widerspruchs gegen die beabsichtigte Löschung wird hiermit eine Frist von einem Monat ab Veröffentlichung dieser Ankündigung bestimmt.\n\nRechtsbehelfsbelehrung:\n\nGegen diese Verfügung kann Widerspruch eingelegt werden. Zum Widerspruch ist jeder berechtigt, der an der Unterlassung der Löschung ein berechtigtes Interesse hat.\n\nDer Widerspruch ist bei dem Amtsgericht Aachen, Adalbertsteinweg 92, 52070 Aachen schriftlich in deutscher Sprache oder zur Niederschrift der Geschäftsstelle einzulegen. Der Widerspruch kann auch zur Niederschrift der Geschäftsstelle eines jeden Amtsgerichtes abgegeben werden.\n\nDer Widerspruch muss spätestens innerhalb der gesetzten Frist nach der Bekanntgabe der Verfügung bei dem Amtsgericht Aachen eingegangen sein. Dies gilt auch dann, wenn der Widerspruch zur Niederschrift der Geschäftsstelle eines anderen Amtsgerichtes abgegeben wurde. Die Frist beginnt mit der Bekanntgabe der Verfügung durch Veröffentlichung. Fällt das Ende der Frist auf einen Sonntag, einen allgemeinen Feiertag oder Sonnabend, so endet die Frist mit Ablauf des nächsten Werktages.\n\nDer Widerspruch muss die Bezeichnung der angefochtenen Verfügung sowie die Erklärung enthalten, dass Widerspruch gegen diese Verfügung eingelegt wird. Er ist zu unterzeichnen und soll begründet werden.\n\nDie Einlegung ist auch durch Übertragung eines elektronischen Dokuments an die elektronische Poststelle des Gerichts möglich. Das elektronische Dokument muss für die Bearbeitung durch das Gericht geeignet und mit einer qualifizierten elektronischen Signatur der verantwortenden Person versehen sein oder von der verantwortenden Person signiert und auf einem sicheren Übermittlungsweg gemäß § 130 a ZPO nach näherer Maßgabe der Verordnung über die technischen Rahmenbedingungen des elektronischen Rechtsverkehrs und über das besondere elektronische Behördenpostfach (BGBl. I, S. 3803) eingereicht werden. Weitere Informationen erhalten Sie auf der Internetseite www.justiz.de."
    },
    {
      "date": "2025-02-10",
      "id": "100927",
      "original_text": "Registerbekanntmachung nach dem Umwandlungsgesetz\nNordrhein-Westfalen Amtsgericht Köln HRB 116622\nTewes Holding GmbH – Köln",
      "type": "Registerbekanntmachung nach dem Umwandlungsgesetz",
      "state": "Nordrhein-Westfalen",
      "amtsgericht": "Amtsgericht Köln",
      "registernummer": "HRB 116622",
      "registerart": "HRB",
      "company_name": "Tewes Holding GmbH",
      "company_seat": "Köln",
      "details": "10.02.2025 (Bekanntmachungsdatum)\n\nNordrhein-Westfalen Amtsgericht Köln HRB 116622\nRegisterbekanntmachung nach dem Umwandlungsgesetz 10.02.2025 (Eintragungsdatum)\n\nTewes Holding GmbH\nGesellschaft mit beschränkter Haftung\nKöln\n\nDen Gläubigern der an der Verschmelzung beteiligten Rechtsträger ist, wenn sie binnen sechs Monaten nach dem Tag, an dem die Eintragung der Verschmelzung in das Register des Sitzes desjenigen Rechtsträgers, dessen Gläubiger sie sind, nach § 19 Absatz 3 UmwG als bekanntgemacht gilt, ihren Anspruch nach Grund und Höhe schriftlich anmelden, Sicherheit zu leisten, soweit sie nicht Befriedigung verlangen können. Dieses Recht steht den Gläubigern jedoch nur zu, wenn sie glaubhaft machen, dass durch die Verschmelzung die Erfüllung ihrer Forderung gefährdet wird."
    },
    {
      "date": "2025-02-10",
      "id": "100928",
      "original_text": "Einreichung neuer Dokumente\nHessen Amtsgericht Frankfurt am Main HRB 113794\npublity AG – Frankfurt am Main",
      "type": "Einreichung neuer Dokumente",
      "state": "Hessen",
      "amtsgericht": "Amtsgericht Frankfurt am Main",
      "registernummer": "HRB 113794",
      "registerart": "HRB",
      "company_name": "publity AG",
      "company_seat": "Frankfurt am Main",
      "details": "10.02.2025 (Bekanntmachungsdatum)\n\nHessen Amtsgericht Frankfurt am Main HRB 113794\nEinreichung neuer Dokumente 10.02.2025 (Eintragungsdatum)\n\npublity AG\nAktiengesellschaft\nFrankfurt am Main\n\nDurch  Änderungen in den Personen der Aufsichtsratsmitglieder sind drei Listen der Mitglieder des Aufsichtsrates zum Handelsregister eingereicht worden."
    },
    {
      "date": "2025-02-10",
      "id": "100929",
      "original_text": "Löschungsankündigung\nHessen Amtsgericht Frankfurt am Main HRB 107231\nAMIKA Consulting UG (haftungsbeschränkt) – Frankfurt am Main",
      "type": "Löschungsankündigung",
      "state": "Hessen",
      "amtsgericht": "Amtsgericht Frankfurt am Main",
      "registernummer": "HRB 107231",
      "registerart": "HRB",
      "company_name": "AMIKA Consulting UG (haftungsbeschränkt)",
      "company_seat": "Frankfurt am Main",
      "details": "10.02.2025 (Bekanntmachungsdatum)\n\nHessen Amtsgericht Frankfurt am Main HRB 107231\nLöschungsankündigung\n\nAMIKA Consulting UG (haftungsbeschränkt)\nGesellschaft mit beschränkter Haftung\nFrankfurt am Main\n\nDas Registergericht beabsichtigt die im Handelsregister eingetragene Gesellschaft von Amts wegen nach § 394 FamFG zu löschen. Hiergegen kann innerhalb eines Zeitraumes von 1 Monat nach dieser Veröffentlichung Widerspruch beim Amtsgericht Frankfurt am Main eingelegt werden."
    },
    {
      "date": "2025-02-10",
      "id": "100930",
      "original_text": "Löschungsankündigung\nHessen Amtsgericht Bad Homburg v.d.H. HRB 13937\nMuga Bau GmbH – Steinbach (Taunus)",
      "type": "Löschungsankündigung",
      "state": "Hessen",
      "amtsgericht": "Amtsgericht Bad Homburg v.d.H.",
      "registernummer": "HRB 13937",
      "registerart": "HRB",
      "company_name": "Muga Bau GmbH",
      "company_seat": "Steinbach (Taunus)",
      "details": "10.02.2025 (Bekanntmachungsdatum)\n\nHessen Amtsgericht Bad Homburg v.d.H. HRB 13937\nLöschungsankündigung 10.02.2025 (Eintragungsdatum)\n\nMuga Bau GmbH\nGesellschaft mit beschränkter Haftung\nSteinbach (Taunus)\n\nDas Registergericht beabsichtigt die im Handelsregister eingetragene Gesellschaft von Amts wegen nach § 394 FamFG zu löschen. Die Frist zur Erhebung eines Widerspruchs gegen die beabsichtigte Löschung wird auf 3 Monate festgesetzt."
    },
    {
      "date": "2025-02-10",
      "id": "100931",
      "original_text": "Sonstige Registerbekanntmachung\nHessen Amtsgericht Frankfurt am Main HRB 72614\nLahmeyer Deutschland GmbH – Bad Vilbel",
      "type": "Sonstige Registerbekanntmachung",
      "state": "Hessen",
      "amtsgericht": "Amtsgericht Frankfurt am Main",
      "registernummer": "HRB 72614",
      "registerart": "HRB",
      "company_name": "Lahmeyer Deutschland GmbH",
      "company_seat": "Bad Vilbel",
      "details": "10.02.2025 (Bekanntmachungsdatum)\n\nHessen Amtsgericht Frankfurt am Main HRB 72614\nSonstige Registerbekanntmachung 29.01.2025 (Eintragungsdatum)\n\nLahmeyer Deutschland GmbH\nGesellschaft mit beschränkter Haftung\nBad Vilbel\n\nDie Gesellschaft hat Gläubigern, deren Forderungen vor dieser Bekanntmachung begründet worden sind, Sicherheit zu leisten, soweit sie nicht Befriedigung verlangen können, wenn sie sich binnen sechs Monaten nach dieser Bekanntmachung zu diesem Zweck melden."
    },
    {
      "date": "2025-02-10",
      "id": "100932",
      "original_text": "Registerbekanntmachung nach dem Umwandlungsgesetz\nHessen Amtsgericht Bad Hersfeld HRA 1965\nRoth Solarenergie GmbH & Co. KG – Rotenburg an der Fulda",
      "type": "Registerbekanntmachung nach dem Umwandlungsgesetz",
      "state": "Hessen",
      "amtsgericht": "Amtsgericht Bad Hersfeld",
      "registernummer": "HRA 1965",
      "registerart": "HRA",
      "company_name": "Roth Solarenergie GmbH & Co. KG",
      "company_seat": "Rotenburg an der Fulda",
      "details": "10.02.2025 (Bekanntmachungsdatum)\n\nHessen Amtsgericht Bad Hersfeld HRA 1965\nRegisterbekanntmachung nach dem Umwandlungsgesetz 10.02.2025 (Eintragungsdatum)\n\nRoth Solarenergie GmbH & Co. KG\nKommanditgesellschaft\nRotenburg an der Fulda\n\nDen Gläubigern der an der Ausgliederung beteiligten Rechtsträger ist, wenn sie binnen sechs Monaten nach dem Tag, an dem die Eintragung der Ausgliederung in das Register des Sitzes desjenigen Rechtsträgers, dessen Gläubiger sie sind, nach §§ 125, 19 Absatz 3 UmwG bekannt gemacht worden ist, ihren Anspruch nach Grund und Höhe schriftlich anmelden, Sicherheit zu leisten, soweit sie nicht Befriedigung verlangen können. Dieses Recht steht den Gläubigern jedoch nur zu, wenn sie glaubhaft machen, dass durch die Ausgliederung die Erfüllung ihrer Forderung gefährdet wird."
    },
    {
      "date": "2025-02-10",
      "id": "100933",
      "original_text": "Löschungsankündigung\nHessen Amtsgericht Offenbach am Main HRB 47990\nR & P Handel - Transport Logistik GmbH – Offenbach am Main",
      "type": "Löschungsankündigung",
      "state": "Hessen",
      "amtsgericht": "Amtsgericht Offenbach am Main",
      "registernummer": "HRB 47990",
      "registerart": "HRB",
      "company_name": "R & P Handel - Transport Logistik GmbH",
      "company_seat": "Offenbach am Main",
      "details": "10.02.2025 (Bekanntmachungsdatum)\n\nHessen Amtsgericht Offenbach am Main HRB 47990\nLöschungsankündigung\n\nR & P Handel - Transport Logistik GmbH\nGesellschaft mit beschränkter Haftung\nOffenbach am Main\n\nDas Registergericht beabsichtigt die im Handelsregister eingetragene Gesellschaft von Amts wegen nach § 394 FamFG zu löschen. Die Frist zur Erhebung eines Widerspruchs gegen die beabsichtigte Löschung wird auf 3 Monate festgesetzt."
    },
    {
      "date": "2025-02-10",
      "id": "100934",
      "original_text": "Registerbekanntmachung nach dem Umwandlungsgesetz\nHessen Amtsgericht Frankfurt am Main HRB 136500\nOCU Express & Logistics GmbH – Frankfurt am Main",
      "type": "Registerbekanntmachung nach dem Umwandlungsgesetz",
      "state": "Hessen",
      "amtsgericht": "Amtsgericht Frankfurt am Main",
      "registernummer": "HRB 136500",
      "registerart": "HRB",
      "company_name": "OCU Express & Logistics GmbH",
      "company_seat": "Frankfurt am Main",
      "details": "10.02.2025 (Bekanntmachungsdatum)\n\nHessen Amtsgericht Frankfurt am Main HRB 136500\nRegisterbekanntmachung nach dem Umwandlungsgesetz 10.02.2025 (Eintragungsdatum)\n\nOCU Express & Logistics GmbH\nGesellschaft mit beschränkter Haftung\nFrankfurt am Main\n\nDen Gläubigern der an der Ausgliederung beteiligten Rechtsträger ist, wenn sie binnen sechs Monaten nach dem Tag, an dem die Eintragung der Ausgliederung in das Register des Sitzes desjenigen Rechtsträgers, dessen Gläubiger sie sind, nach §§ 125, 19 Absatz 3 UmwG bekannt gemacht worden ist, ihren Anspruch nach Grund und Höhe schriftlich anmelden, Sicherheit zu leisten, soweit sie nicht Befriedigung verlangen können. Dieses Recht steht den Gläubigern jedoch nur zu, wenn sie glaubhaft machen, dass durch die Ausgliederung die Erfüllung ihrer Forderung gefährdet wird."
    },
    {
      "date": "2025-02-10",
      "id": "100935",
      "original_text": "Sonstige Registerbekanntmachung\nHessen Amtsgericht Limburg HRB 3848\nKSB-Klinik-Service-Betriebe GmbH – Weilburg",
      "type": "Sonstige Registerbekanntmachung",
      "state": "Hessen",
      "amtsgericht": "Amtsgericht Limburg",
      "registernummer": "HRB 3848",
      "registerart": "HRB",
      "company_name": "KSB-Klinik-Service-Betriebe GmbH",
      "company_seat": "Weilburg",
      "details": "10.02.2025 (Bekanntmachungsdatum)\n\nHessen Amtsgericht Limburg HRB 3848\nSonstige Registerbekanntmachung 10.02.2025 (Eintragungsdatum)\n\nKSB-Klinik-Service-Betriebe GmbH\nGesellschaft mit beschränkter Haftung\nWeilburg\n\nDurch eine Änderung in den Personen der Aufsichtsratsmitglieder ist eine Liste der Mitglieder des Aufsichtsrates zum Handelsregister eingereicht worden."
    },
    {
      "date": "2025-02-10",
      "id": "100936",
      "original_text": "Löschungsankündigung\nHessen Amtsgericht Frankfurt am Main HRB 129348\nSDD GmbH – Frankfurt am Main",
      "type": "Löschungsankündigung",
      "state": "Hessen",
      "amtsgericht": "Amtsgericht Frankfurt am Main",
      "registernummer": "HRB 129348",
      "registerart": "HRB",
      "company_name": "SDD GmbH",
      "company_seat": "Frankfurt am Main",
      "details": "10.02.2025 (Bekanntmachungsdatum)\n\nHessen Amtsgericht Frankfurt am Main HRB 129348\nLöschungsankündigung\n\nSDD GmbH\nGesellschaft mit beschränkter Haftung\nFrankfurt am Main\n\nDas Registergericht beabsichtigt die im Handelsregister eingetragene Gesellschaft von Amts wegen nach § 394 FamFG zu löschen. Die Frist zur Erhebung eines Widerspruchs gegen die beabsichtigte Löschung wird auf 1 Monat festgesetzt."
    },
    {
      "date": "2025-02-10",
      "id": "100937",
      "original_text": "Löschungsankündigung\nHessen Amtsgericht Frankfurt am Main HRB 116665\nJR Mena Bau GmbH – Frankfurt am Main",
      "type": "Löschungsankündigung",
      "state": "Hessen",
      "amtsgericht": "Amtsgericht Frankfurt am Main",
      "registernummer": "HRB 116665",
      "registerart": "HRB",
      "company_name": "JR Mena Bau GmbH",
      "company_seat": "Frankfurt am Main",
      "details": "10.02.2025 (Bekanntmachungsdatum)\n\nHessen Amtsgericht Frankfurt am Main HRB 116665\nLöschungsankündigung 09.02.2025 (Eintragungsdatum)\n\nJR Mena Bau GmbH\nGesellschaft mit beschränkter Haftung\nFrankfurt am Main\n\nDas Registergericht beabsichtigt die im Handelsregister eingetragene Gesellschaft von Amts wegen nach § 394 FamFG zu löschen. Die Frist zur Erhebung eines Widerspruchs gegen die beabsichtigte Löschung wird auf 1 Monat festgesetzt."
    },
    {
      "date": "2025-02-10",
      "id": "100938",
      "original_text": "Löschungsankündigung\nHessen Amtsgericht Darmstadt HRB 104469\nTW Solutions GmbH – Rüsselsheim",
      "type": "Löschungsankündigung",
      "state": "Hessen",
      "amtsgericht": "Amtsgericht Darmstadt",
      "registernummer": "HRB 104469",
      "registerart": "HRB",
      "company_name": "TW Solutions GmbH",
      "company_seat": "Rüsselsheim",
      "details": "10.02.2025 (Bekanntmachungsdatum)\n\nHessen Amtsgericht Darmstadt HRB 104469\nLöschungsankündigung 10.02.2025 (Eintragungsdatum)\n\nTW Solutions GmbH\nGesellschaft mit beschränkter Haftung\nRüsselsheim\n\nDas Registergericht beabsichtigt die im Handelsregister eingetragene Gesellschaft von Amts wegen nach § 394 FamFG zu löschen. Die Frist zur Erhebung eines Widerspruchs gegen die beabsichtigte Löschung wird auf 3 Monate festgesetzt."
    },
    {
      "date": "2025-02-10",
      "id": "100939",
      "original_text": "Löschungsankündigung\nHessen Amtsgericht Hanau HRB 92651\nSenker Dienstleistungs GmbH – Erlensee",
      "type": "Löschungsankündigung",
      "state": "Hessen",
      "amtsgericht": "Amtsgericht Hanau",
      "registernummer": "HRB 92651",
      "registerart": "HRB",
      "company_name": "Senker Dienstleistungs GmbH",
      "company_seat": "Erlensee",
      "details": "10.02.2025 (Bekanntmachungsdatum)\n\nHessen Amtsgericht Hanau HRB 92651\nLöschungsankündigung\n\nSenker Dienstleistungs GmbH\nGesellschaft mit beschränkter Haftung\nErlensee\n\nDas Registergericht beabsichtigt die im Handelsregister eingetragene Gesellschaft von Amts wegen nach § 394 FamFG zu löschen. Die Frist zur Erhebung eines Widerspruchs gegen die beabsichtigte Löschung wird auf 3 Monate festgesetzt."
    },
    {
      "date": "2025-02-10",
      "id": "100940",
      "original_text": "Sonstige Registerbekanntmachung\nHessen Amtsgericht Frankfurt am Main HRB 110139\nRBC Capital Markets (Europe) GmbH – Frankfurt am Main",
      "type": "Sonstige Registerbekanntmachung",
      "state": "Hessen",
      "amtsgericht": "Amtsgericht Frankfurt am Main",
      "registernummer": "HRB 110139",
      "registerart": "HRB",
      "company_name": "RBC Capital Markets (Europe) GmbH",
      "company_seat": "Frankfurt am Main",
      "details": "10.02.2025 (Bekanntmachungsdatum)\n\nHessen Amtsgericht Frankfurt am Main HRB 110139\nSonstige Registerbekanntmachung\n\nRBC Capital Markets (Europe) GmbH\nGesellschaft mit beschränkter Haftung\nFrankfurt am Main\n\nDurch eine Änderung in den Personen der Aufsichtsratsmitglieder ist eine Liste der Mitglieder des Aufsichtsrates zum Handelsregister eingereicht worden."
    }
  ]
}