{
  "date": "2025-02-05",
  "date_of_scrape": "2025-02-06T04:07:36.794Z",
  "tool_version": "0.2.0",
  "number_of_announcements": 127,
  "announcements": [
    {
      "date": "2025-02-05",
      "id": "100460",
      "original_text": "Löschungsankündigung\nBayern Amtsgericht Nürnberg HRB 16929\nBAUER Personalmanagement GmbH – Nürnberg",
      "type": "Löschungsankündigung",
      "state": "Bayern",
      "amtsgericht": "Amtsgericht Nürnberg",
      "registernummer": "HRB 16929",
      "registerart": "HRB",
      "company_name": "BAUER Personalmanagement GmbH",
      "company_seat": "Nürnberg",
      "details": "05.02.2025 (Bekanntmachungsdatum)\n\nBayern Amtsgericht Nürnberg HRB 16929\nLöschungsankündigung\n\nBAUER Personalmanagement GmbH\nGesellschaft mit beschränkter Haftung\nNürnberg\n\nDas Registergericht beabsichtigt, die im Handelsregister eingetragene Gesellschaft wegen Vermögenslosigkeit von Amts wegen nach § 394 FamFG zu löschen. Die Frist zur Erhebung eines Widerspruchs ist auf einen Monat festgesetzt."
    },
    {
      "date": "2025-02-05",
      "id": "100461",
      "original_text": "Einreichung neuer Dokumente\nBayern Amtsgericht Aschaffenburg HRB 6166\nWohnungsbaugesellschaft Stadt Alzenau Gesellschaft mit beschränkter Haftung – Alzenau",
      "type": "Einreichung neuer Dokumente",
      "state": "Bayern",
      "amtsgericht": "Amtsgericht Aschaffenburg",
      "registernummer": "HRB 6166",
      "registerart": "HRB",
      "company_name": "Wohnungsbaugesellschaft Stadt Alzenau Gesellschaft mit beschränkter Haftung",
      "company_seat": "Alzenau",
      "details": "05.02.2025 (Bekanntmachungsdatum)\n\nBayern Amtsgericht Aschaffenburg HRB 6166\nEinreichung neuer Dokumente 04.02.2025 (Eintragungsdatum)\n\nWohnungsbaugesellschaft Stadt Alzenau Gesellschaft mit beschränkter Haftung\nGesellschaft mit beschränkter Haftung\nAlzenau\n\nDem Amtsgericht Aschaffenburg -Registergericht- ist eine Liste der Mitglieder des Aufsichtsrats eingereicht worden, § 52 Abs. 3 S. 2 GmbHG."
    },
    {
      "date": "2025-02-05",
      "id": "100462",
      "original_text": "Löschungsankündigung\nBayern Amtsgericht München HRB 268797\nMietdeinauto MDA GmbH – Grünwald",
      "type": "Löschungsankündigung",
      "state": "Bayern",
      "amtsgericht": "Amtsgericht München",
      "registernummer": "HRB 268797",
      "registerart": "HRB",
      "company_name": "Mietdeinauto MDA GmbH",
      "company_seat": "Grünwald",
      "details": "05.02.2025 (Bekanntmachungsdatum)\n\nBayern Amtsgericht München HRB 268797\nLöschungsankündigung 04.02.2025 (Eintragungsdatum)\n\nMietdeinauto MDA GmbH\nGesellschaft mit beschränkter Haftung\nGrünwald\n\nDas Registergericht beabsichtigt, die im Handelsregister eingetragene Gesellschaft wegen Vermögenslosigkeit von Amts wegen nach § 394 FamFG zu löschen. Die Frist zur Erhebung eines Widerspruchs ist auf drei Monate festgesetzt."
    },
    {
      "date": "2025-02-05",
      "id": "100463",
      "original_text": "Löschungsankündigung\nBayern Amtsgericht München HRB 180164\nRICONS GmbH – Murnau",
      "type": "Löschungsankündigung",
      "state": "Bayern",
      "amtsgericht": "Amtsgericht München",
      "registernummer": "HRB 180164",
      "registerart": "HRB",
      "company_name": "RICONS GmbH",
      "company_seat": "Murnau",
      "details": "05.02.2025 (Bekanntmachungsdatum)\n\nBayern Amtsgericht München HRB 180164\nLöschungsankündigung 04.02.2025 (Eintragungsdatum)\n\nRICONS GmbH\nGesellschaft mit beschränkter Haftung\nMurnau\n\nDas Registergericht beabsichtigt, die im Handelsregister eingetragene Gesellschaft wegen Vermögenslosigkeit von Amts wegen nach § 394 FamFG zu löschen. Die Frist zur Erhebung eines Widerspruchs ist auf drei Monate festgesetzt."
    },
    {
      "date": "2025-02-05",
      "id": "100464",
      "original_text": "Löschungsankündigung\nBayern Amtsgericht München HRB 163087\nBettertracks GmbH – München",
      "type": "Löschungsankündigung",
      "state": "Bayern",
      "amtsgericht": "Amtsgericht München",
      "registernummer": "HRB 163087",
      "registerart": "HRB",
      "company_name": "Bettertracks GmbH",
      "company_seat": "München",
      "details": "05.02.2025 (Bekanntmachungsdatum)\n\nBayern Amtsgericht München HRB 163087\nLöschungsankündigung\n\nBettertracks GmbH\nGesellschaft mit beschränkter Haftung\nMünchen\n\nDas Registergericht beabsichtigt, die im Handelsregister eingetragene Gesellschaft wegen Vermögenslosigkeit von Amts wegen nach § 394 FamFG zu löschen. Die Frist zur Erhebung eines Widerspruchs ist auf drei Monate festgesetzt."
    },
    {
      "date": "2025-02-05",
      "id": "100465",
      "original_text": "Löschungsankündigung\nBayern Amtsgericht Nürnberg HRB 16929\nBAUER Personalmanagement GmbH – Nürnberg",
      "type": "Löschungsankündigung",
      "state": "Bayern",
      "amtsgericht": "Amtsgericht Nürnberg",
      "registernummer": "HRB 16929",
      "registerart": "HRB",
      "company_name": "BAUER Personalmanagement GmbH",
      "company_seat": "Nürnberg",
      "details": "05.02.2025 (Bekanntmachungsdatum)\n\nBayern Amtsgericht Nürnberg HRB 16929\nLöschungsankündigung\n\nBAUER Personalmanagement GmbH\nGesellschaft mit beschränkter Haftung\nNürnberg\n\nDas Registergericht beabsichtigt, die im Handelsregister eingetragene Gesellschaft wegen Vermögenslosigkeit von Amts wegen nach § 394 FamFG zu löschen. Die Frist zur Erhebung eines Widerspruchs ist auf einen Monat festgesetzt."
    },
    {
      "date": "2025-02-05",
      "id": "100466",
      "original_text": "Registerbekanntmachung nach dem Umwandlungsgesetz\nBayern Amtsgericht Nürnberg GsR 342\nBirkholz Oliver, Guess Thomas eGbR – Nürnberg",
      "type": "Registerbekanntmachung nach dem Umwandlungsgesetz",
      "state": "Bayern",
      "amtsgericht": "Amtsgericht Nürnberg",
      "registernummer": "GsR 342",
      "registerart": "GsR",
      "company_name": "Birkholz Oliver, Guess Thomas eGbR",
      "company_seat": "Nürnberg",
      "details": "05.02.2025 (Bekanntmachungsdatum)\n\nBayern Amtsgericht Nürnberg GsR 342\nRegisterbekanntmachung nach dem Umwandlungsgesetz 04.02.2025 (Eintragungsdatum)\n\nBirkholz Oliver, Guess Thomas eGbR\nGesellschaft bürgerlichen Rechts\nNürnberg\n\nDen Gläubigern des formwechselnden Rechtsträgers ist, wenn sie binnen sechs Monaten nach dem Tag, an dem die Eintragung des Formwechsels nach § 201 UmwG als bekannt gemacht gilt, ihren Anspruch nach Grund und Höhe in Textform anmelden, Sicherheit zu leisten, soweit sie nicht Befriedigung verlangen können. Dieses Recht steht den Gläubigern jedoch nur zu, wenn sie glaubhaft machen, dass durch den Formwechsel die Erfüllung ihrer Forderung gefährdet wird."
    },
    {
      "date": "2025-02-05",
      "id": "100467",
      "original_text": "Registerbekanntmachung nach dem Umwandlungsgesetz\nBayern Amtsgericht München HRB 158254\nGFN GmbH – Dachau",
      "type": "Registerbekanntmachung nach dem Umwandlungsgesetz",
      "state": "Bayern",
      "amtsgericht": "Amtsgericht München",
      "registernummer": "HRB 158254",
      "registerart": "HRB",
      "company_name": "GFN GmbH",
      "company_seat": "Dachau",
      "details": "05.02.2025 (Bekanntmachungsdatum)\n\nBayern Amtsgericht München HRB 158254\nRegisterbekanntmachung nach dem Umwandlungsgesetz 04.02.2025 (Eintragungsdatum)\n\nGFN GmbH\nGesellschaft mit beschränkter Haftung\nDachau\n\nDen Gläubigern der an der Verschmelzung beteiligten Rechtsträger ist, wenn sie binnen sechs Monaten nach dem Tag, an dem die Eintragung der Verschmelzung in das Register des Sitzes desjenigen Rechtsträgers, dessen Gläubiger sie sind, nach § 19 Abs. 3 UmwG als bekannt gemacht gilt, ihren Anspruch nach Grund und Höhe in Textform anmelden, Sicherheit zu leisten, soweit sie nicht Befriedigung verlangen können. Dieses Recht steht den Gläubigern jedoch nur zu, wenn sie glaubhaft machen, dass durch die Verschmelzung die Erfüllung ihrer Forderung gefährdet wird."
    },
    {
      "date": "2025-02-05",
      "id": "100468",
      "original_text": "Löschungsankündigung\nBayern Amtsgericht München HRB 265616\nPROFA Bau UG (haftungsbeschränkt) – Isen",
      "type": "Löschungsankündigung",
      "state": "Bayern",
      "amtsgericht": "Amtsgericht München",
      "registernummer": "HRB 265616",
      "registerart": "HRB",
      "company_name": "PROFA Bau UG (haftungsbeschränkt)",
      "company_seat": "Isen",
      "details": "05.02.2025 (Bekanntmachungsdatum)\n\nBayern Amtsgericht München HRB 265616\nLöschungsankündigung 04.02.2025 (Eintragungsdatum)\n\nPROFA Bau UG (haftungsbeschränkt)\nGesellschaft mit beschränkter Haftung\nIsen\n\nDas Registergericht beabsichtigt, die im Handelsregister eingetragene Gesellschaft wegen Vermögenslosigkeit von Amts wegen nach § 394 FamFG zu löschen. Die Frist zur Erhebung eines Widerspruchs ist auf drei Monate festgesetzt."
    },
    {
      "date": "2025-02-05",
      "id": "100469",
      "original_text": "Registerbekanntmachung nach dem Umwandlungsgesetz\nBayern Amtsgericht München HRB 47019\nLexCom Informationssysteme GmbH – München",
      "type": "Registerbekanntmachung nach dem Umwandlungsgesetz",
      "state": "Bayern",
      "amtsgericht": "Amtsgericht München",
      "registernummer": "HRB 47019",
      "registerart": "HRB",
      "company_name": "LexCom Informationssysteme GmbH",
      "company_seat": "München",
      "details": "05.02.2025 (Bekanntmachungsdatum)\n\nBayern Amtsgericht München HRB 47019\nRegisterbekanntmachung nach dem Umwandlungsgesetz 04.02.2025 (Eintragungsdatum)\n\nLexCom Informationssysteme GmbH\nGesellschaft mit beschränkter Haftung\nMünchen\n\nDen Gläubigern der an der Verschmelzung beteiligten Rechtsträger ist, wenn sie binnen sechs Monaten nach dem Tag, an dem die Eintragung der Verschmelzung in das Register des Sitzes desjenigen Rechtsträgers, dessen Gläubiger sie sind, nach § 19 Abs. 3 UmwG als bekannt gemacht gilt, ihren Anspruch nach Grund und Höhe in Textform anmelden, Sicherheit zu leisten, soweit sie nicht Befriedigung verlangen können. Dieses Recht steht den Gläubigern jedoch nur zu, wenn sie glaubhaft machen, dass durch die Verschmelzung die Erfüllung ihrer Forderung gefährdet wird."
    },
    {
      "date": "2025-02-05",
      "id": "100470",
      "original_text": "Einreichung neuer Dokumente\nBayern Amtsgericht München HRB 257119\nAdolf Rosenberger gGmbH – München",
      "type": "Einreichung neuer Dokumente",
      "state": "Bayern",
      "amtsgericht": "Amtsgericht München",
      "registernummer": "HRB 257119",
      "registerart": "HRB",
      "company_name": "Adolf Rosenberger gGmbH",
      "company_seat": "München",
      "details": "05.02.2025 (Bekanntmachungsdatum)\n\nBayern Amtsgericht München HRB 257119\nEinreichung neuer Dokumente 04.02.2025 (Eintragungsdatum)\n\nAdolf Rosenberger gGmbH\nGesellschaft mit beschränkter Haftung\nMünchen\n\nDem Amtsgericht München -Registergericht- ist eine Liste der Mitglieder des Aufsichtsrats eingereicht worden, § 52 Abs. 3 S. 2 GmbHG."
    },
    {
      "date": "2025-02-05",
      "id": "100471",
      "original_text": "Einreichung neuer Dokumente\nBayern Amtsgericht Kempten (Allgäu) HRB 9960\nPrinceps AG – Kaufbeuren",
      "type": "Einreichung neuer Dokumente",
      "state": "Bayern",
      "amtsgericht": "Amtsgericht Kempten (Allgäu)",
      "registernummer": "HRB 9960",
      "registerart": "HRB",
      "company_name": "Princeps AG",
      "company_seat": "Kaufbeuren",
      "details": "05.02.2025 (Bekanntmachungsdatum)\n\nBayern Amtsgericht Kempten (Allgäu) HRB 9960\nEinreichung neuer Dokumente 31.01.2025 (Eintragungsdatum)\n\nPrinceps AG\nAktiengesellschaft\nKaufbeuren\n\nDem Amtsgericht Kempten (Allgäu) -Registergericht- ist eine Liste der Mitglieder des Aufsichtsrats eingereicht worden, § 106 AktG."
    },
    {
      "date": "2025-02-05",
      "id": "100472",
      "original_text": "Registerbekanntmachung nach dem Umwandlungsgesetz\nBayern Amtsgericht München HRB 145536\nGLL Office Europa GmbH – München",
      "type": "Registerbekanntmachung nach dem Umwandlungsgesetz",
      "state": "Bayern",
      "amtsgericht": "Amtsgericht München",
      "registernummer": "HRB 145536",
      "registerart": "HRB",
      "company_name": "GLL Office Europa GmbH",
      "company_seat": "München",
      "details": "05.02.2025 (Bekanntmachungsdatum)\n\nBayern Amtsgericht München HRB 145536\nRegisterbekanntmachung nach dem Umwandlungsgesetz 04.02.2025 (Eintragungsdatum)\n\nGLL Office Europa GmbH\nGesellschaft mit beschränkter Haftung\nMünchen\n\nDen Gläubigern der an der Verschmelzung beteiligten Rechtsträger ist, wenn sie binnen sechs Monaten nach dem Tag, an dem die Eintragung der Verschmelzung in das Register des Sitzes desjenigen Rechtsträgers, dessen Gläubiger sie sind, nach § 19 Abs. 3 UmwG als bekannt gemacht gilt, ihren Anspruch nach Grund und Höhe in Textform anmelden, Sicherheit zu leisten, soweit sie nicht Befriedigung verlangen können. Dieses Recht steht den Gläubigern jedoch nur zu, wenn sie glaubhaft machen, dass durch die Verschmelzung die Erfüllung ihrer Forderung gefährdet wird."
    },
    {
      "date": "2025-02-05",
      "id": "100473",
      "original_text": "Registerbekanntmachung nach dem Umwandlungsgesetz\nBayern Amtsgericht München HRB 207611\nWohn- und Gewerbepark Friedenstal Bernau GmbH – Unterhaching",
      "type": "Registerbekanntmachung nach dem Umwandlungsgesetz",
      "state": "Bayern",
      "amtsgericht": "Amtsgericht München",
      "registernummer": "HRB 207611",
      "registerart": "HRB",
      "company_name": "Wohn- und Gewerbepark Friedenstal Bernau GmbH",
      "company_seat": "Unterhaching",
      "details": "05.02.2025 (Bekanntmachungsdatum)\n\nBayern Amtsgericht München HRB 207611\nRegisterbekanntmachung nach dem Umwandlungsgesetz 04.02.2025 (Eintragungsdatum)\n\nWohn- und Gewerbepark Friedenstal Bernau GmbH\nGesellschaft mit beschränkter Haftung\nUnterhaching\n\nDen Gläubigern der an der Verschmelzung beteiligten Rechtsträger ist, wenn sie binnen sechs Monaten nach dem Tag, an dem die Eintragung der Verschmelzung in das Register des Sitzes desjenigen Rechtsträgers, dessen Gläubiger sie sind, nach § 19 Abs. 3 UmwG als bekannt gemacht gilt, ihren Anspruch nach Grund und Höhe in Textform anmelden, Sicherheit zu leisten, soweit sie nicht Befriedigung verlangen können. Dieses Recht steht den Gläubigern jedoch nur zu, wenn sie glaubhaft machen, dass durch die Verschmelzung die Erfüllung ihrer Forderung gefährdet wird."
    },
    {
      "date": "2025-02-05",
      "id": "100474",
      "original_text": "Einreichung neuer Dokumente\nBayern Amtsgericht München HRB 213050\nVKBit Betrieb GmbH – München",
      "type": "Einreichung neuer Dokumente",
      "state": "Bayern",
      "amtsgericht": "Amtsgericht München",
      "registernummer": "HRB 213050",
      "registerart": "HRB",
      "company_name": "VKBit Betrieb GmbH",
      "company_seat": "München",
      "details": "05.02.2025 (Bekanntmachungsdatum)\n\nBayern Amtsgericht München HRB 213050\nEinreichung neuer Dokumente\n\nVKBit Betrieb GmbH\nGesellschaft mit beschränkter Haftung\nMünchen\n\nDem Amtsgericht München -Registergericht- ist eine Liste der Mitglieder des Aufsichtsrats eingereicht worden, § 52 Abs. 3 S. 2 GmbHG."
    },
    {
      "date": "2025-02-05",
      "id": "100475",
      "original_text": "Einreichung neuer Dokumente\nBayern Amtsgericht Bamberg HRB 7614\nPROJECT Investment AG – Bamberg",
      "type": "Einreichung neuer Dokumente",
      "state": "Bayern",
      "amtsgericht": "Amtsgericht Bamberg",
      "registernummer": "HRB 7614",
      "registerart": "HRB",
      "company_name": "PROJECT Investment AG",
      "company_seat": "Bamberg",
      "details": "05.02.2025 (Bekanntmachungsdatum)\n\nBayern Amtsgericht Bamberg HRB 7614\nEinreichung neuer Dokumente\n\nPROJECT Investment AG\nAktiengesellschaft\nBamberg\n\nDem Amtsgericht Bamberg -Registergericht- ist eine Liste der Mitglieder des Aufsichtsrats eingereicht worden, § 106 AktG."
    },
    {
      "date": "2025-02-05",
      "id": "100476",
      "original_text": "Einreichung neuer Dokumente\nBayern Amtsgericht München HRB 40823\nKarwendelbahn-Aktiengesellschaft – Mittenwald",
      "type": "Einreichung neuer Dokumente",
      "state": "Bayern",
      "amtsgericht": "Amtsgericht München",
      "registernummer": "HRB 40823",
      "registerart": "HRB",
      "company_name": "Karwendelbahn-Aktiengesellschaft",
      "company_seat": "Mittenwald",
      "details": "05.02.2025 (Bekanntmachungsdatum)\n\nBayern Amtsgericht München HRB 40823\nEinreichung neuer Dokumente 04.02.2025 (Eintragungsdatum)\n\nKarwendelbahn-Aktiengesellschaft\nAktiengesellschaft\nMittenwald\n\nDem Amtsgericht München -Registergericht- ist eine Liste der Mitglieder des Aufsichtsrats eingereicht worden, § 106 AktG."
    },
    {
      "date": "2025-02-05",
      "id": "100477",
      "original_text": "Registerbekanntmachung nach dem Umwandlungsgesetz\nBayern Amtsgericht Landshut HRB 8177\nDoris Pinkus Rechtsanwaltsgesellschaft UG (haftungsbeschränkt) – Landshut",
      "type": "Registerbekanntmachung nach dem Umwandlungsgesetz",
      "state": "Bayern",
      "amtsgericht": "Amtsgericht Landshut",
      "registernummer": "HRB 8177",
      "registerart": "HRB",
      "company_name": "Doris Pinkus Rechtsanwaltsgesellschaft UG (haftungsbeschränkt)",
      "company_seat": "Landshut",
      "details": "05.02.2025 (Bekanntmachungsdatum)\n\nBayern Amtsgericht Landshut HRB 8177\nRegisterbekanntmachung nach dem Umwandlungsgesetz 04.02.2025 (Eintragungsdatum)\n\nDoris Pinkus Rechtsanwaltsgesellschaft UG (haftungsbeschränkt)\nGesellschaft mit beschränkter Haftung\nLandshut\n\nDem #Re.Name ist #DV.auswahl(Text=\"Bitte zutreffendes auswählen:\",Eingabe=\"der Entwurf eines Verschmelzungsvertrages\",\"ein Verschmelzungsvertrag\") zwischen der #DV.fa(Text=\"Bitte Firma/Namen des übernehmenden Rechtsträgers eingeben:\"), #DV.si(Text=\"Bitte Sitz des übernehmenden Rechtsträgers eingeben:\") (Amtsgericht #DV.regg(Text=\"Bitte das zust. Registergericht des übernehmenden Rechtsträgers eingeben:\") #insert(Text=\"RegTyp_Auswahl\") #DV.nr(Text=\"Bitte Registernummer des übernehmenden Rechtsträgers eingeben:\")) und der Gesellschaft als übertragendem Rechtsträger zur Einsichtnahme eingereicht worden."
    },
    {
      "date": "2025-02-05",
      "id": "100478",
      "original_text": "Einreichung neuer Dokumente\nBayern Amtsgericht Kempten (Allgäu) HRB 1243\nGWG Lindauer Wohnungsgesellschaft mbH – Lindau (Bodensee)",
      "type": "Einreichung neuer Dokumente",
      "state": "Bayern",
      "amtsgericht": "Amtsgericht Kempten (Allgäu)",
      "registernummer": "HRB 1243",
      "registerart": "HRB",
      "company_name": "GWG Lindauer Wohnungsgesellschaft mbH",
      "company_seat": "Lindau (Bodensee)",
      "details": "05.02.2025 (Bekanntmachungsdatum)\n\nBayern Amtsgericht Kempten (Allgäu) HRB 1243\nEinreichung neuer Dokumente\n\nGWG Lindauer Wohnungsgesellschaft mbH\nGesellschaft mit beschränkter Haftung\nLindau (Bodensee)\n\nDem Amtsgericht Kempten (Allgäu) -Registergericht- ist eine Liste der Mitglieder des Aufsichtsrats eingereicht worden, § 52 Abs. 3 S. 2 GmbHG."
    },
    {
      "date": "2025-02-05",
      "id": "100479",
      "original_text": "Registerbekanntmachung nach dem Umwandlungsgesetz\nBayern Amtsgericht München HRB 217017\nEvantec Holding GmbH – München",
      "type": "Registerbekanntmachung nach dem Umwandlungsgesetz",
      "state": "Bayern",
      "amtsgericht": "Amtsgericht München",
      "registernummer": "HRB 217017",
      "registerart": "HRB",
      "company_name": "Evantec Holding GmbH",
      "company_seat": "München",
      "details": "05.02.2025 (Bekanntmachungsdatum)\n\nBayern Amtsgericht München HRB 217017\nRegisterbekanntmachung nach dem Umwandlungsgesetz 04.02.2025 (Eintragungsdatum)\n\nEvantec Holding GmbH\nGesellschaft mit beschränkter Haftung\nMünchen\n\nDen Gläubigern der an der Verschmelzung beteiligten Rechtsträger ist, wenn sie binnen sechs Monaten nach dem Tag, an dem die Eintragung der Verschmelzung in das Register des Sitzes desjenigen Rechtsträgers, dessen Gläubiger sie sind, nach § 19 Abs. 3 UmwG als bekannt gemacht gilt, ihren Anspruch nach Grund und Höhe in Textform anmelden, Sicherheit zu leisten, soweit sie nicht Befriedigung verlangen können. Dieses Recht steht den Gläubigern jedoch nur zu, wenn sie glaubhaft machen, dass durch die Verschmelzung die Erfüllung ihrer Forderung gefährdet wird."
    },
    {
      "date": "2025-02-05",
      "id": "100480",
      "original_text": "Löschungsankündigung\nBaden-Württemberg Amtsgericht Mannheim HRB 735829\nToprak Holding GmbH – Mannheim",
      "type": "Löschungsankündigung",
      "state": "Baden-Württemberg",
      "amtsgericht": "Amtsgericht Mannheim",
      "registernummer": "HRB 735829",
      "registerart": "HRB",
      "company_name": "Toprak Holding GmbH",
      "company_seat": "Mannheim",
      "details": "05.02.2025 (Bekanntmachungsdatum)\n\nBaden-Württemberg Amtsgericht Mannheim HRB 735829\nLöschungsankündigung 05.02.2025 (Eintragungsdatum)\n\nToprak Holding GmbH\nGesellschaft mit beschränkter Haftung\nMannheim\n\nDas Gericht beabsichtigt, die Gesellschaft wegen Vermögenslosigkeit im Handelsregister von Amts wegen nach § 394 FamFG zu löschen. Die Frist zur Geltendmachung eines Widerspruchs gegen die beabsichtigte Löschung ist auf einen Monat ab Veröffentlichung bestimmt."
    },
    {
      "date": "2025-02-05",
      "id": "100481",
      "original_text": "Registerbekanntmachung nach dem Umwandlungsgesetz\nBaden-Württemberg Amtsgericht Ulm HRB 734583\nFliesen Brand Verwaltungs-GmbH – Crailsheim",
      "type": "Registerbekanntmachung nach dem Umwandlungsgesetz",
      "state": "Baden-Württemberg",
      "amtsgericht": "Amtsgericht Ulm",
      "registernummer": "HRB 734583",
      "registerart": "HRB",
      "company_name": "Fliesen Brand Verwaltungs-GmbH",
      "company_seat": "Crailsheim",
      "details": "05.02.2025 (Bekanntmachungsdatum)\n\nBaden-Württemberg Amtsgericht Ulm HRB 734583\nRegisterbekanntmachung nach dem Umwandlungsgesetz 05.02.2025 (Eintragungsdatum)\n\nFliesen Brand Verwaltungs-GmbH\nGesellschaft mit beschränkter Haftung\nCrailsheim\n\nAls nicht eingetragen wird bekanntgemacht:\nDen Gläubigern der an der Verschmelzung beteiligten Rechtsträger ist, wenn sie binnen sechs Monaten nach dem Tag, an dem die Eintragung der Verschmelzung in das Register des Sitzes desjenigen Rechtsträgers, dessen Gläubiger sie sind, nach § 19 Abs. 3 UmwG als bekanntgemacht gilt, ihren Anspruch nach Grund und Höhe schriftlich anmelden, Sicherheit zu leisten, soweit sie nicht Befriedigung verlangen können. Dieses Recht steht den Gläubigern jedoch nur zu, wenn sie glaubhaft machen, dass durch die Verschmelzung die Erfüllung ihrer Forderung gefährdet wird."
    },
    {
      "date": "2025-02-05",
      "id": "100482",
      "original_text": "Registerbekanntmachung nach dem Umwandlungsgesetz\nBrandenburg Amtsgericht Neuruppin HRB 7849\nLand GmbH Barsikow – Wusterhausen/Dosse OT Barsikow",
      "type": "Registerbekanntmachung nach dem Umwandlungsgesetz",
      "state": "Brandenburg",
      "amtsgericht": "Amtsgericht Neuruppin",
      "registernummer": "HRB 7849",
      "registerart": "HRB",
      "company_name": "Land GmbH Barsikow",
      "company_seat": "Wusterhausen/Dosse OT Barsikow",
      "details": "05.02.2025 (Bekanntmachungsdatum)\n\nBrandenburg Amtsgericht Neuruppin HRB 7849\nRegisterbekanntmachung nach dem Umwandlungsgesetz 04.02.2025 (Eintragungsdatum)\n\nLand GmbH Barsikow\nGesellschaft mit beschränkter Haftung\nWusterhausen/Dosse OT Barsikow\n\nZu Eintragungsnummer 4 vom 04.02.2025 wird als nicht eingetragen veröffentlicht:\nDen Gläubigern der an der Verschmelzung beteiligten Rechtsträger ist, wenn sie binnen sechs Monaten nach dem Tag, an dem die Eintragung der Verschmelzung in das Register des Sitzes desjenigen Rechtsträgers, dessen Gläubiger sie sind, als bekannt gemacht gilt, ihren Anspruch nach Grund und Höhe schriftlich anmelden, Sicherheit zu leisten, soweit sie nicht Befriedigung verlangen können. Dieses Recht steht den Gläubigern jedoch nur zu, wenn sie glaubhaft machen, dass durch die Verschmelzung die Erfüllung ihrer Forderung gefährdet wird"
    },
    {
      "date": "2025-02-05",
      "id": "100483",
      "original_text": "Einreichung neuer Dokumente\nBaden-Württemberg Amtsgericht Stuttgart HRB 380257\nTübinger Zimmertheater, Gesellschaft mit beschränkter Haftung – Tübingen",
      "type": "Einreichung neuer Dokumente",
      "state": "Baden-Württemberg",
      "amtsgericht": "Amtsgericht Stuttgart",
      "registernummer": "HRB 380257",
      "registerart": "HRB",
      "company_name": "Tübinger Zimmertheater, Gesellschaft mit beschränkter Haftung",
      "company_seat": "Tübingen",
      "details": "05.02.2025 (Bekanntmachungsdatum)\n\nBaden-Württemberg Amtsgericht Stuttgart HRB 380257\nEinreichung neuer Dokumente\n\nTübinger Zimmertheater, Gesellschaft mit beschränkter Haftung\nGesellschaft mit beschränkter Haftung\nTübingen\n\nDie Gesellschaft hat am 17.12.2024 die Liste über die Zusammensetzung des Aufsichtsrats zum Handelsregister eingereicht."
    },
    {
      "date": "2025-02-05",
      "id": "100484",
      "original_text": "Löschungsankündigung\nHamburg Amtsgericht Hamburg HRA 96240\nRolf Scholz Transport e.k. – Hamburg",
      "type": "Löschungsankündigung",
      "state": "Hamburg",
      "amtsgericht": "Amtsgericht Hamburg",
      "registernummer": "HRA 96240",
      "registerart": "HRA",
      "company_name": "Rolf Scholz Transport e.k.",
      "company_seat": "Hamburg",
      "details": "05.02.2025 (Bekanntmachungsdatum)\n\nHamburg Amtsgericht Hamburg HRA 96240\nLöschungsankündigung\n\nRolf Scholz Transport e.k.\nEinzelkaufmann\nHamburg\n\nDas Registergericht beabsichtigt, die im Handelsregister eingetragene Firma von Amts wegen nach § 31 Abs. 2 HGB zu löschen. Die Frist zur Erhebung eines Widerspruchs gegen die beabsichtigte Löschung wird auf 3 Monate festgesetzt."
    },
    {
      "date": "2025-02-05",
      "id": "100485",
      "original_text": "Einreichung neuer Dokumente\nBaden-Württemberg Amtsgericht Stuttgart HRB 751119\nMercedes-Benz Versicherung AG – Stuttgart",
      "type": "Einreichung neuer Dokumente",
      "state": "Baden-Württemberg",
      "amtsgericht": "Amtsgericht Stuttgart",
      "registernummer": "HRB 751119",
      "registerart": "HRB",
      "company_name": "Mercedes-Benz Versicherung AG",
      "company_seat": "Stuttgart",
      "details": "05.02.2025 (Bekanntmachungsdatum)\n\nBaden-Württemberg Amtsgericht Stuttgart HRB 751119\nEinreichung neuer Dokumente\n\nMercedes-Benz Versicherung AG\nAktiengesellschaft\nStuttgart\n\nDie Gesellschaft hat am 04.02.2025 die Liste über die Zusammensetzung des Aufsichtsrats zum Handelsregister eingereicht."
    },
    {
      "date": "2025-02-05",
      "id": "100486",
      "original_text": "Sonstige Registerbekanntmachung\nBaden-Württemberg Amtsgericht Freiburg HRB 705638\nOSYPKA AG – Rheinfelden Baden",
      "type": "Sonstige Registerbekanntmachung",
      "state": "Baden-Württemberg",
      "amtsgericht": "Amtsgericht Freiburg",
      "registernummer": "HRB 705638",
      "registerart": "HRB",
      "company_name": "OSYPKA AG",
      "company_seat": "Rheinfelden Baden",
      "details": "05.02.2025 (Bekanntmachungsdatum)\n\nBaden-Württemberg Amtsgericht Freiburg HRB 705638\nSonstige Registerbekanntmachung 04.02.2025 (Eintragungsdatum)\n\nOSYPKA AG\nAktiengesellschaft\nRheinfelden Baden\n\nAls nicht eingetragen wird bekanntgemacht:\nDen Gläubigern der Gesellschaft, deren Forderungen begründet worden sind, bevor die Eintragung der Beendigung des Vertrages in das Handelsregister nach § 10 HGB als bekanntgemacht gilt, ist vom anderen Vertragsteil Sicherheit zu leisten, wenn sie sich binnen sechs Monaten nach der Bekanntmachung zu diesem Zweck bei ihm melden."
    },
    {
      "date": "2025-02-05",
      "id": "100487",
      "original_text": "Löschungsankündigung\nBaden-Württemberg Amtsgericht Ulm HRB 735645\nHermannstadtTrans GmbH – Heidenheim an der Brenz",
      "type": "Löschungsankündigung",
      "state": "Baden-Württemberg",
      "amtsgericht": "Amtsgericht Ulm",
      "registernummer": "HRB 735645",
      "registerart": "HRB",
      "company_name": "HermannstadtTrans GmbH",
      "company_seat": "Heidenheim an der Brenz",
      "details": "05.02.2025 (Bekanntmachungsdatum)\n\nBaden-Württemberg Amtsgericht Ulm HRB 735645\nLöschungsankündigung\n\nHermannstadtTrans GmbH\nGesellschaft mit beschränkter Haftung\nHeidenheim an der Brenz\n\nDas Gericht beabsichtigt, die Gesellschaft wegen Vermögenslosigkeit im Handelsregister von Amts wegen nach § 394 FamFG zu löschen. Die Frist zur Geltendmachung eines Widerspruchs gegen die beabsichtigte Löschung ist auf  einen Monat ab Veröffentlichung bestimmt."
    },
    {
      "date": "2025-02-05",
      "id": "100488",
      "original_text": "Löschungsankündigung\nBaden-Württemberg Amtsgericht Freiburg HRB 724328\nEM Service GmbH – Kehl",
      "type": "Löschungsankündigung",
      "state": "Baden-Württemberg",
      "amtsgericht": "Amtsgericht Freiburg",
      "registernummer": "HRB 724328",
      "registerart": "HRB",
      "company_name": "EM Service GmbH",
      "company_seat": "Kehl",
      "details": "05.02.2025 (Bekanntmachungsdatum)\n\nBaden-Württemberg Amtsgericht Freiburg HRB 724328\nLöschungsankündigung\n\nEM Service GmbH\nGesellschaft mit beschränkter Haftung\nKehl\n\nDas Gericht beabsichtigt, die Gesellschaft wegen Vermögenslosigkeit im Handelsregister von Amts wegen nach § 394 FamFG zu löschen. Die Frist zur Geltendmachung eines Widerspruchs gegen die beabsichtigte Löschung ist auf einen Monat ab Veröffentlichung bestimmt."
    },
    {
      "date": "2025-02-05",
      "id": "100489",
      "original_text": "Registerbekanntmachung nach dem Umwandlungsgesetz\nHamburg Amtsgericht Hamburg HRA 131854\nSK Consulting e.K. – Hamburg",
      "type": "Registerbekanntmachung nach dem Umwandlungsgesetz",
      "state": "Hamburg",
      "amtsgericht": "Amtsgericht Hamburg",
      "registernummer": "HRA 131854",
      "registerart": "HRA",
      "company_name": "SK Consulting e.K.",
      "company_seat": "Hamburg",
      "details": "05.02.2025 (Bekanntmachungsdatum)\n\nHamburg Amtsgericht Hamburg HRA 131854\nRegisterbekanntmachung nach dem Umwandlungsgesetz 05.02.2025 (Eintragungsdatum)\n\nSK Consulting e.K.\nEinzelkaufmann\nHamburg\n\nAls nicht eingetragen wird bekannt gemacht:\nDen Gläubigern der an der Ausgliederung beteiligten Gesellschaften ist, wenn sie binnen sechs Monaten nach dem Tag, an dem die Eintragung der Ausgliederung in das Register des Sitzes desjenigen Rechtsträgers, dessen Gläubiger sie sind, nach § 19 Absatz 3 UmwG als bekannt gemacht gilt, ihren Anspruch nach Grund und Höhe schriftlich anmelden, Sicherheit zu leisten, soweit sie nicht Befriedigung verlangen können. Dieses Recht steht den Gläubigern jedoch nur zu, wenn sie glaubhaft machen, dass durch die Ausgliederung die Erfüllung ihrer Forderung gefährdet wird."
    },
    {
      "date": "2025-02-05",
      "id": "100490",
      "original_text": "Sonstige Registerbekanntmachung\nHamburg Amtsgericht Hamburg HRB 15431\nHGA Capital Grundbesitz und Anlage GmbH – Hamburg",
      "type": "Sonstige Registerbekanntmachung",
      "state": "Hamburg",
      "amtsgericht": "Amtsgericht Hamburg",
      "registernummer": "HRB 15431",
      "registerart": "HRB",
      "company_name": "HGA Capital Grundbesitz und Anlage GmbH",
      "company_seat": "Hamburg",
      "details": "05.02.2025 (Bekanntmachungsdatum)\n\nHamburg Amtsgericht Hamburg HRB 15431\nSonstige Registerbekanntmachung 05.02.2025 (Eintragungsdatum)\n\nHGA Capital Grundbesitz und Anlage GmbH\nGesellschaft mit beschränkter Haftung\nHamburg\n\nAls nicht eingetragen wird bekannt gemacht:  Den Gläubigern der Gesellschaft, deren Forderungen begründet worden sind, bevor die Eintragung der Vertragsbeendigung in das Handelsregister nach § 10 HGB als bekannt gemacht gilt, ist vom anderen Vertragsteil Sicherheit zu leisten, wenn sie sich binnen 6 Monaten nach Bekanntmachung der Eintragung zu diesem Zweck bei ihm melden."
    },
    {
      "date": "2025-02-05",
      "id": "100491",
      "original_text": "Registerbekanntmachung nach dem Umwandlungsgesetz\nHamburg Amtsgericht Hamburg HRB 189376\nSilke Krüger Consulting GmbH – Hamburg",
      "type": "Registerbekanntmachung nach dem Umwandlungsgesetz",
      "state": "Hamburg",
      "amtsgericht": "Amtsgericht Hamburg",
      "registernummer": "HRB 189376",
      "registerart": "HRB",
      "company_name": "Silke Krüger Consulting GmbH",
      "company_seat": "Hamburg",
      "details": "05.02.2025 (Bekanntmachungsdatum)\n\nHamburg Amtsgericht Hamburg HRB 189376\nRegisterbekanntmachung nach dem Umwandlungsgesetz 05.02.2025 (Eintragungsdatum)\n\nSilke Krüger Consulting GmbH\nGesellschaft mit beschränkter Haftung\nHamburg\n\nAls nicht eingetragen wird bekannt gemacht:\nDen Gläubigern der an der Ausgliederung beteiligten Gesellschaften ist, wenn sie binnen sechs Monaten nach dem Tag, an dem die Eintragung der Ausgliederung in das Register des Sitzes desjenigen Rechtsträgers, dessen Gläubiger sie sind, nach § 19 Absatz 3 UmwG als bekannt gemacht gilt, ihren Anspruch nach Grund und Höhe schriftlich anmelden, Sicherheit zu leisten, soweit sie nicht Befriedigung verlangen können. Dieses Recht steht den Gläubigern jedoch nur zu, wenn sie glaubhaft machen, dass durch die Ausgliederung die Erfüllung ihrer Forderung gefährdet wird."
    },
    {
      "date": "2025-02-05",
      "id": "100492",
      "original_text": "Löschungsankündigung\nBaden-Württemberg Amtsgericht Ulm HRB 733989\nLumos Lichttechnik GmbH – Crailsheim",
      "type": "Löschungsankündigung",
      "state": "Baden-Württemberg",
      "amtsgericht": "Amtsgericht Ulm",
      "registernummer": "HRB 733989",
      "registerart": "HRB",
      "company_name": "Lumos Lichttechnik GmbH",
      "company_seat": "Crailsheim",
      "details": "05.02.2025 (Bekanntmachungsdatum)\n\nBaden-Württemberg Amtsgericht Ulm HRB 733989\nLöschungsankündigung\n\nLumos Lichttechnik GmbH\nGesellschaft mit beschränkter Haftung\nCrailsheim\n\nDas Gericht beabsichtigt, die Gesellschaft wegen Vermögenslosigkeit im Handelsregister von Amts wegen nach § 394 FamFG zu löschen. Die Frist zur Geltendmachung eines Widerspruchs gegen die beabsichtigte Löschung ist auf  einen Monat ab Veröffentlichung bestimmt."
    },
    {
      "date": "2025-02-05",
      "id": "100493",
      "original_text": "Löschungsankündigung\nBerlin Amtsgericht Berlin (Charlottenburg) HRB 250665\nMSB Massivbau UG (haftungsbeschränkt) – Berlin",
      "type": "Löschungsankündigung",
      "state": "Berlin",
      "amtsgericht": "Amtsgericht Berlin (Charlottenburg)",
      "registernummer": "HRB 250665",
      "registerart": "HRB",
      "company_name": "MSB Massivbau UG (haftungsbeschränkt)",
      "company_seat": "Berlin",
      "details": "05.02.2025 (Bekanntmachungsdatum)\n\nBerlin Amtsgericht Berlin (Charlottenburg) HRB 250665\nLöschungsankündigung\n\nMSB Massivbau UG (haftungsbeschränkt)\nGesellschaft mit beschränkter Haftung\nBerlin\n\nBei der nachstehenden Gesellschaft wird das Amtslöschungsverfahren gemäß § 394 FamFG eingeleitet. Widerspruchsfrist 6 Wochen"
    },
    {
      "date": "2025-02-05",
      "id": "100494",
      "original_text": "Löschungsankündigung\nSchleswig-Holstein Amtsgericht Kiel HRB 26401\nMerkur - Nordlogistik GmbH – Henstedt-Ulzburg",
      "type": "Löschungsankündigung",
      "state": "Schleswig-Holstein",
      "amtsgericht": "Amtsgericht Kiel",
      "registernummer": "HRB 26401",
      "registerart": "HRB",
      "company_name": "Merkur - Nordlogistik GmbH",
      "company_seat": "Henstedt-Ulzburg",
      "details": "05.02.2025 (Bekanntmachungsdatum)\n\nSchleswig-Holstein Amtsgericht Kiel HRB 26401\nLöschungsankündigung\n\nMerkur - Nordlogistik GmbH\nGesellschaft mit beschränkter Haftung\nHenstedt-Ulzburg\n\nEs ist die Löschung der nachstehenden Gesellschaft wegen Vermögenslosigkeit gemäß § 394 FamFG beabsichtigt. Widerspruchsfrist: 2 Monate."
    },
    {
      "date": "2025-02-05",
      "id": "100495",
      "original_text": "Registerbekanntmachung nach dem Umwandlungsgesetz\nBrandenburg Amtsgericht Neuruppin HRB 14186\nAgrar GmbH Barsikow – Wusterhausen/Dosse",
      "type": "Registerbekanntmachung nach dem Umwandlungsgesetz",
      "state": "Brandenburg",
      "amtsgericht": "Amtsgericht Neuruppin",
      "registernummer": "HRB 14186",
      "registerart": "HRB",
      "company_name": "Agrar GmbH Barsikow",
      "company_seat": "Wusterhausen/Dosse",
      "details": "05.02.2025 (Bekanntmachungsdatum)\n\nBrandenburg Amtsgericht Neuruppin HRB 14186\nRegisterbekanntmachung nach dem Umwandlungsgesetz 04.02.2025 (Eintragungsdatum)\n\nAgrar GmbH Barsikow\nGesellschaft mit beschränkter Haftung\nWusterhausen/Dosse\n\nZu Eintragungsnummer 3 vom 04.02.2025 wird als nicht eingetragen veröffentlicht:\nDen Gläubigern der an der Umwandlung beteiligten Rechtsträger ist, wenn sie binnen sechs Monaten nach dem Tag, an dem die Eintragung der Umwandlung in das Register des Sitzes desjenigen Rechtsträgers, dessen Gläubiger sie sind, als bekannt gemacht gilt, ihren Anspruch nach Grund und Höhe schriftlich anmelden, Sicherheit zu leisten, soweit sie nicht Befriedigung verlangen können. Dieses Recht steht den Gläubigern jedoch nur zu, wenn sie glaubhaft machen, dass durch die Umwandlung die Erfüllung ihrer Forderung gefährdet wird"
    },
    {
      "date": "2025-02-05",
      "id": "100496",
      "original_text": "Sonstige Registerbekanntmachung\nBaden-Württemberg Amtsgericht Mannheim HRB 703190\nMLP Hyp GmbH – Wiesloch",
      "type": "Sonstige Registerbekanntmachung",
      "state": "Baden-Württemberg",
      "amtsgericht": "Amtsgericht Mannheim",
      "registernummer": "HRB 703190",
      "registerart": "HRB",
      "company_name": "MLP Hyp GmbH",
      "company_seat": "Wiesloch",
      "details": "05.02.2025 (Bekanntmachungsdatum)\n\nBaden-Württemberg Amtsgericht Mannheim HRB 703190\nSonstige Registerbekanntmachung\n\nMLP Hyp GmbH\nGesellschaft mit beschränkter Haftung\nWiesloch\n\nDie Gesellschaft hat am 04.02.2025 die Liste über die Zusammensetzung des Aufsichtsrats zum Handelsregister eingereicht."
    },
    {
      "date": "2025-02-05",
      "id": "100497",
      "original_text": "Löschungsankündigung\nBerlin Amtsgericht Berlin (Charlottenburg) HRB 208371\nJW BURRI UG (haftungsbeschränkt) – Berlin",
      "type": "Löschungsankündigung",
      "state": "Berlin",
      "amtsgericht": "Amtsgericht Berlin (Charlottenburg)",
      "registernummer": "HRB 208371",
      "registerart": "HRB",
      "company_name": "JW BURRI UG (haftungsbeschränkt)",
      "company_seat": "Berlin",
      "details": "05.02.2025 (Bekanntmachungsdatum)\n\nBerlin Amtsgericht Berlin (Charlottenburg) HRB 208371\nLöschungsankündigung\n\nJW BURRI UG (haftungsbeschränkt)\nGesellschaft mit beschränkter Haftung\nBerlin\n\nBei der nachstehenden Gesellschaft wird das Amtslöschungsverfahren gemäß § 394 FamFG eingeleitet. Widerspruchsfrist 6 Wochen"
    },
    {
      "date": "2025-02-05",
      "id": "100498",
      "original_text": "Einreichung neuer Dokumente\nBaden-Württemberg Amtsgericht Mannheim HRB 230357\nStadtwerke Bruchsal GmbH – Bruchsal",
      "type": "Einreichung neuer Dokumente",
      "state": "Baden-Württemberg",
      "amtsgericht": "Amtsgericht Mannheim",
      "registernummer": "HRB 230357",
      "registerart": "HRB",
      "company_name": "Stadtwerke Bruchsal GmbH",
      "company_seat": "Bruchsal",
      "details": "05.02.2025 (Bekanntmachungsdatum)\n\nBaden-Württemberg Amtsgericht Mannheim HRB 230357\nEinreichung neuer Dokumente\n\nStadtwerke Bruchsal GmbH\nGesellschaft mit beschränkter Haftung\nBruchsal\n\nDie Gesellschaft hat am 04.02.2025 die Liste über die Zusammensetzung des Aufsichtsrats zum Handelsregister eingereicht."
    },
    {
      "date": "2025-02-05",
      "id": "100499",
      "original_text": "Löschungsankündigung\nBerlin Amtsgericht Berlin (Charlottenburg) HRB 212652\nYIMI GmbH – Berlin",
      "type": "Löschungsankündigung",
      "state": "Berlin",
      "amtsgericht": "Amtsgericht Berlin (Charlottenburg)",
      "registernummer": "HRB 212652",
      "registerart": "HRB",
      "company_name": "YIMI GmbH",
      "company_seat": "Berlin",
      "details": "05.02.2025 (Bekanntmachungsdatum)\n\nBerlin Amtsgericht Berlin (Charlottenburg) HRB 212652\nLöschungsankündigung\n\nYIMI GmbH\nGesellschaft mit beschränkter Haftung\nBerlin\n\nBei der nachstehenden Gesellschaft wird das Amtslöschungsverfahren gemäß § 394 FamFG eingeleitet. Widerspruchsfrist 6 Wochen"
    },
    {
      "date": "2025-02-05",
      "id": "100500",
      "original_text": "Löschungsankündigung\nSchleswig-Holstein Amtsgericht Lübeck HRB 17329\nDOLE GELATO UG (haftungsbeschränkt) – Ahrensbök OT Gnissau",
      "type": "Löschungsankündigung",
      "state": "Schleswig-Holstein",
      "amtsgericht": "Amtsgericht Lübeck",
      "registernummer": "HRB 17329",
      "registerart": "HRB",
      "company_name": "DOLE GELATO UG (haftungsbeschränkt)",
      "company_seat": "Ahrensbök OT Gnissau",
      "details": "05.02.2025 (Bekanntmachungsdatum)\n\nSchleswig-Holstein Amtsgericht Lübeck HRB 17329\nLöschungsankündigung\n\nDOLE GELATO UG (haftungsbeschränkt)\nGesellschaft mit beschränkter Haftung\nAhrensbök OT Gnissau\n\nEs ist die Löschung der nachstehenden Gesellschaft wegen Vermögenslosigkeit gemäß § 394 FamFG beabsichtigt. Widerspruchsfrist: 1 Monat."
    },
    {
      "date": "2025-02-05",
      "id": "100501",
      "original_text": "Löschungsankündigung\nBerlin Amtsgericht Berlin (Charlottenburg) HRB 83015\nK & L Systemhaus GmbH – Berlin",
      "type": "Löschungsankündigung",
      "state": "Berlin",
      "amtsgericht": "Amtsgericht Berlin (Charlottenburg)",
      "registernummer": "HRB 83015",
      "registerart": "HRB",
      "company_name": "K & L Systemhaus GmbH",
      "company_seat": "Berlin",
      "details": "05.02.2025 (Bekanntmachungsdatum)\n\nBerlin Amtsgericht Berlin (Charlottenburg) HRB 83015\nLöschungsankündigung\n\nK & L Systemhaus GmbH\nGesellschaft mit beschränkter Haftung\nBerlin\n\nBei der nachstehenden Gesellschaft wird das Amtslöschungsverfahren gemäß § 394 FamFG eingeleitet. Widerspruchsfrist 6 Wochen"
    },
    {
      "date": "2025-02-05",
      "id": "100502",
      "original_text": "Einreichung neuer Dokumente\nBaden-Württemberg Amtsgericht Stuttgart HRB 736969\nBioenergie Freudenstadt GmbH – Freudenstadt",
      "type": "Einreichung neuer Dokumente",
      "state": "Baden-Württemberg",
      "amtsgericht": "Amtsgericht Stuttgart",
      "registernummer": "HRB 736969",
      "registerart": "HRB",
      "company_name": "Bioenergie Freudenstadt GmbH",
      "company_seat": "Freudenstadt",
      "details": "05.02.2025 (Bekanntmachungsdatum)\n\nBaden-Württemberg Amtsgericht Stuttgart HRB 736969\nEinreichung neuer Dokumente\n\nBioenergie Freudenstadt GmbH\nGesellschaft mit beschränkter Haftung\nFreudenstadt\n\nDie Gesellschaft hat am 21.01.2025 die Liste über die Zusammensetzung des Aufsichtsrats zum Handelsregister eingereicht."
    },
    {
      "date": "2025-02-05",
      "id": "100503",
      "original_text": "Registerbekanntmachung nach dem Umwandlungsgesetz\nHamburg Amtsgericht Hamburg HRB 11716\nThe Robert Stigwood Organisation (Deutschland) G.m.b.H. – Hamburg",
      "type": "Registerbekanntmachung nach dem Umwandlungsgesetz",
      "state": "Hamburg",
      "amtsgericht": "Amtsgericht Hamburg",
      "registernummer": "HRB 11716",
      "registerart": "HRB",
      "company_name": "The Robert Stigwood Organisation (Deutschland) G.m.b.H.",
      "company_seat": "Hamburg",
      "details": "05.02.2025 (Bekanntmachungsdatum)\n\nHamburg Amtsgericht Hamburg HRB 11716\nRegisterbekanntmachung nach dem Umwandlungsgesetz 05.02.2025 (Eintragungsdatum)\n\nThe Robert Stigwood Organisation (Deutschland) G.m.b.H.\nGesellschaft mit beschränkter Haftung\nHamburg\n\nAls nicht eingetragen wird bekannt gemacht:\nDen Gläubigern der an der Verschmelzung beteiligten Gesellschaften ist, wenn sie binnen sechs Monaten nach dem Tag, an dem die Eintragung der Verschmelzung in das Register des Sitzes desjenigen Rechtsträgers, dessen Gläubiger sie sind, nach § 19 Absatz 3 UmwG als bekannt gemacht gilt, ihren Anspruch nach Grund und Höhe schriftlich anmelden, Sicherheit zu leisten, soweit sie nicht Befriedigung verlangen können. Dieses Recht steht den Gläubigern jedoch nur zu, wenn sie glaubhaft machen, dass durch die Verschmelzung die Erfüllung ihrer Forderung gefährdet wird."
    },
    {
      "date": "2025-02-05",
      "id": "100504",
      "original_text": "Registerbekanntmachung nach dem Umwandlungsgesetz\nSchleswig-Holstein Amtsgericht Kiel HRA 12490\nrundum baum e. K., Inh. Folke Nutt-Kauffmann – Stolpe",
      "type": "Registerbekanntmachung nach dem Umwandlungsgesetz",
      "state": "Schleswig-Holstein",
      "amtsgericht": "Amtsgericht Kiel",
      "registernummer": "HRA 12490",
      "registerart": "HRA",
      "company_name": "rundum baum e. K., Inh. Folke Nutt-Kauffmann",
      "company_seat": "Stolpe",
      "details": "05.02.2025 (Bekanntmachungsdatum)\n\nSchleswig-Holstein Amtsgericht Kiel HRA 12490\nRegisterbekanntmachung nach dem Umwandlungsgesetz 05.02.2025 (Eintragungsdatum)\n\nrundum baum e. K., Inh. Folke Nutt-Kauffmann\nEinzelkaufmann / Einzelkauffrau\nStolpe\n\nZu Eintragungsnummer 2 vom 05.02.2025 wird als nicht eingetragen veröffentlicht:\nDen Gläubigern der an der Spaltung beteiligten Rechtsträger ist, wenn sie binnen sechs Monaten nach dem Tag, an dem die Eintragung der Spaltung in das Register des Sitzes desjenigen Rechtsträgers, dessen Gläubiger sie sind,  bekannt gemacht worden ist, ihren Anspruch nach Grund und Höhe schriftlich anmelden, Sicherheit zu leisten, soweit sie nicht Befriedigung verlangen können. Dieses Recht steht den Gläubigern jedoch nur zu, wenn sie glaubhaft machen, dass durch die Spaltung die Erfüllung ihrer Forderung gefährdet wird."
    },
    {
      "date": "2025-02-05",
      "id": "100505",
      "original_text": "Löschungsankündigung\nSaarland Amtsgericht Saarbrücken HRB 109773\nNEOMx UG (haftungsbeschränkt) – Merzig",
      "type": "Löschungsankündigung",
      "state": "Saarland",
      "amtsgericht": "Amtsgericht Saarbrücken",
      "registernummer": "HRB 109773",
      "registerart": "HRB",
      "company_name": "NEOMx UG (haftungsbeschränkt)",
      "company_seat": "Merzig",
      "details": "05.02.2025 (Bekanntmachungsdatum)\n\nSaarland Amtsgericht Saarbrücken HRB 109773\nLöschungsankündigung\n\nNEOMx UG (haftungsbeschränkt)\nGesellschaft mit beschränkter Haftung\nMerzig\n\nEs ist beabsichtigt, die Gesellschaft von Amts wegen gemäß § 394 FamFG wegen Vermögenslosigkeit zu löschen.\nGegen die Löschung von Amts wegen ist das Rechtsmittel des Widerspruchs statthaft. Der Widerspruch ist binnen einer Frist drei Monaten beginnend mit dem Tag dieser Veröffentlichung durch Einreichen eines Widerspruchsschreibens -schriftlich oder zur Niederschrift der Geschäftsstelle beim Amtsgericht Saarbrücken, -zentrales Handelsregister-, Mainzerstr.178, 66121 Saarbrücken einzulegen.\nDer Widerspruch muss die Bezeichnung der angefochtenen Löschungsankündigung enthalten sowie die Erklärung, dass Widerspruch eingelegt wird. Er ist vom Widerspruchsführer oder seinem Bevollmächtigten zu unterzeichnen.\nDas Widerspruchsschreiben kann auch in der Form eines elektronischen Dokumentes eingereicht werden, das mit einer qualifizierten elektronischen Signatur nach dem Signaturgesetz versehen sein muss (§§ 14 Abs. 2 FamFG, 130a, 298 ZPO)."
    },
    {
      "date": "2025-02-05",
      "id": "100506",
      "original_text": "Registerbekanntmachung nach dem Umwandlungsgesetz\nBerlin Amtsgericht Berlin (Charlottenburg) HRB 247469\nN26 AG – Berlin",
      "type": "Registerbekanntmachung nach dem Umwandlungsgesetz",
      "state": "Berlin",
      "amtsgericht": "Amtsgericht Berlin (Charlottenburg)",
      "registernummer": "HRB 247469",
      "registerart": "HRB",
      "company_name": "N26 AG",
      "company_seat": "Berlin",
      "details": "05.02.2025 (Bekanntmachungsdatum)\n\nBerlin Amtsgericht Berlin (Charlottenburg) HRB 247469\nRegisterbekanntmachung nach dem Umwandlungsgesetz 31.01.2025 (Eintragungsdatum)\n\nN26 AG\nAktiengesellschaft\nBerlin\n\nZu Eintragungsnummer 11 vom 31.01.2025 wird als nicht eingetragen veröffentlicht: Den Gläubigern der an der Verschmelzung beteiligten Rechtsträger ist, wenn sie binnen sechs Monaten nach dem Tag, an dem die Eintragung der Verschmelzung in das Register des Sitzes desjenigen Rechtsträgers, dessen Gläubiger sie sind, als bekannt gemacht gilt, ihren Anspruch nach Grund und Höhe schriftlich anmelden, Sicherheit zu leisten, soweit sie nicht Befriedigung verlangen können. Dieses Recht steht den Gläubigern jedoch nur zu, wenn sie glaubhaft machen, dass durch die Verschmelzung die Erfüllung ihrer Forderung gefährdet wird. Das Recht, Sicherheitsleistung zu verlangen, steht Gläubigern nicht zu, die im Falle der Insolvenz ein Recht auf vorzugsweise Befriedigung aus einer Deckungsmasse haben, die nach gesetzlicher Vorschrift zu ihrem Schutz errichtet und staatlich überwacht ist."
    },
    {
      "date": "2025-02-05",
      "id": "100507",
      "original_text": "Löschungsankündigung\nSachsen-Anhalt Amtsgericht Stendal HRB 21277\nWeiß Verwaltungs GmbH – Halle (Saale)",
      "type": "Löschungsankündigung",
      "state": "Sachsen-Anhalt",
      "amtsgericht": "Amtsgericht Stendal",
      "registernummer": "HRB 21277",
      "registerart": "HRB",
      "company_name": "Weiß Verwaltungs GmbH",
      "company_seat": "Halle (Saale)",
      "details": "05.02.2025 (Bekanntmachungsdatum)\n\nSachsen-Anhalt Amtsgericht Stendal HRB 21277\nLöschungsankündigung\n\nWeiß Verwaltungs GmbH\nGesellschaft mit beschränkter Haftung\nHalle (Saale)\n\nDas Registergericht beabsichtigt, nachfolgende im Handelregister eingetragenen Firmen von Amts wegen nach § 394 FamFG zu löschen. Die Frist zu Erhebung eines Widerspruchs wird auf drei Monate festgesetzt."
    },
    {
      "date": "2025-02-05",
      "id": "100508",
      "original_text": "Löschungsankündigung\nBerlin Amtsgericht Berlin (Charlottenburg) HRA 56391\nM&Söhne Metallhandel e.K. – Berlin",
      "type": "Löschungsankündigung",
      "state": "Berlin",
      "amtsgericht": "Amtsgericht Berlin (Charlottenburg)",
      "registernummer": "HRA 56391",
      "registerart": "HRA",
      "company_name": "M&Söhne Metallhandel e.K.",
      "company_seat": "Berlin",
      "details": "05.02.2025 (Bekanntmachungsdatum)\n\nBerlin Amtsgericht Berlin (Charlottenburg) HRA 56391\nLöschungsankündigung\n\nM&Söhne Metallhandel e.K.\nEinzelkaufmann / Einzelkauffrau\nBerlin\n\nBei dem nachstehenden Unternehmen / der nachstehenden Gesellschaft wird das Amtslöschungsverfahren gemäß § 31 Abs. 2 HGB eingeleitet. Widerspruchsfrist 4 Wochen"
    },
    {
      "date": "2025-02-05",
      "id": "100509",
      "original_text": "Löschungsankündigung\nBerlin Amtsgericht Berlin (Charlottenburg) HRB 130132\nMega NFC International Distribution GmbH – Berlin",
      "type": "Löschungsankündigung",
      "state": "Berlin",
      "amtsgericht": "Amtsgericht Berlin (Charlottenburg)",
      "registernummer": "HRB 130132",
      "registerart": "HRB",
      "company_name": "Mega NFC International Distribution GmbH",
      "company_seat": "Berlin",
      "details": "05.02.2025 (Bekanntmachungsdatum)\n\nBerlin Amtsgericht Berlin (Charlottenburg) HRB 130132\nLöschungsankündigung\n\nMega NFC International Distribution GmbH\nGesellschaft mit beschränkter Haftung\nBerlin\n\nBei der nachstehenden Gesellschaft wird das Amtslöschungsverfahren gemäß § 394 FamFG eingeleitet. Widerspruchsfrist 6 Wochen"
    },
    {
      "date": "2025-02-05",
      "id": "100510",
      "original_text": "Registerbekanntmachung nach dem Umwandlungsgesetz\nBerlin Amtsgericht Berlin (Charlottenburg) HRA 13697\nBarteltGLASBerlin GmbH & Co. KG – Berlin",
      "type": "Registerbekanntmachung nach dem Umwandlungsgesetz",
      "state": "Berlin",
      "amtsgericht": "Amtsgericht Berlin (Charlottenburg)",
      "registernummer": "HRA 13697",
      "registerart": "HRA",
      "company_name": "BarteltGLASBerlin GmbH & Co. KG",
      "company_seat": "Berlin",
      "details": "05.02.2025 (Bekanntmachungsdatum)\n\nBerlin Amtsgericht Berlin (Charlottenburg) HRA 13697\nRegisterbekanntmachung nach dem Umwandlungsgesetz 04.02.2025 (Eintragungsdatum)\n\nBarteltGLASBerlin GmbH & Co. KG\nKommanditgesellschaft\nBerlin\n\nZu Eintragungsnummer 8 vom 04.02.2025 wird als nicht eingetragen veröffentlicht:\nDen Gläubigern ist, wenn sie binnen sechs Monaten nach dem Tag, an dem die Eintragung der Umwandlung als bekannt gemacht gilt, ihren Anspruch nach Grund und Höhe schriftlich anmelden, Sicherheit zu leisten, soweit sie nicht Befriedigung verlangen können. Dieses Recht steht den Gläubigern jedoch nur zu, wenn sie glaubhaft machen, dass durch die Umwandlung die Erfüllung ihrer Forderung gefährdet wird. Das Recht, Sicherheitsleistung zu verlangen, steht Gläubigern nicht zu, die im Falle der Insolvenz ein Recht auf vorzugsweise Befriedigung aus einer Deckungsmasse haben, die nach gesetzlicher Vorschrift zu ihrem Schutz errichtet und staatlich überwacht ist."
    },
    {
      "date": "2025-02-05",
      "id": "100511",
      "original_text": "Löschungsankündigung\nThüringen Amtsgericht Jena HRB 509182\nCAII Handels GmbH – Hildburghausen",
      "type": "Löschungsankündigung",
      "state": "Thüringen",
      "amtsgericht": "Amtsgericht Jena",
      "registernummer": "HRB 509182",
      "registerart": "HRB",
      "company_name": "CAII Handels GmbH",
      "company_seat": "Hildburghausen",
      "details": "05.02.2025 (Bekanntmachungsdatum)\n\nThüringen Amtsgericht Jena HRB 509182\nLöschungsankündigung\n\nCAII Handels GmbH\nGesellschaft mit beschränkter Haftung\nHildburghausen\n\nDas Registergericht beabsichtigt, die im Handelsregister eingetragene Gesellschaft wegen Vermögenslosigkeit nach § 394 FamFG von Amts wegen zu löschen. Die Frist zur Erhebung eines Widerspruchs gegen die beabsichtigte Löschung wird auf 6 Wochen festgesetzt."
    },
    {
      "date": "2025-02-05",
      "id": "100512",
      "original_text": "Sonstige Registerbekanntmachung\nThüringen Amtsgericht Jena HRB 513963\nElevion Deutschland Holding GmbH – Jena",
      "type": "Sonstige Registerbekanntmachung",
      "state": "Thüringen",
      "amtsgericht": "Amtsgericht Jena",
      "registernummer": "HRB 513963",
      "registerart": "HRB",
      "company_name": "Elevion Deutschland Holding GmbH",
      "company_seat": "Jena",
      "details": "05.02.2025 (Bekanntmachungsdatum)\n\nThüringen Amtsgericht Jena HRB 513963\nSonstige Registerbekanntmachung 29.01.2025 (Eintragungsdatum)\n\nElevion Deutschland Holding GmbH\nGesellschaft mit beschränkter Haftung\nJena\n\nBekanntmachung gem. § 52 Abs. 3 Satz 2 GmbHG: Aufgrund einer Veränderung in den Personen der Aufsichtsratsmitglieder sind durch die Geschäftsführer zwei neue Listen zum Handelsregister eingereicht worden."
    },
    {
      "date": "2025-02-05",
      "id": "100513",
      "original_text": "Löschungsankündigung\nBrandenburg Amtsgericht Potsdam HRB 23667\nZemke Logistik GmbH Rostock – Havelsee",
      "type": "Löschungsankündigung",
      "state": "Brandenburg",
      "amtsgericht": "Amtsgericht Potsdam",
      "registernummer": "HRB 23667",
      "registerart": "HRB",
      "company_name": "Zemke Logistik GmbH Rostock",
      "company_seat": "Havelsee",
      "details": "05.02.2025 (Bekanntmachungsdatum)\n\nBrandenburg Amtsgericht Potsdam HRB 23667\nLöschungsankündigung\n\nZemke Logistik GmbH Rostock\nGesellschaft mit beschränkter Haftung\nHavelsee\n\nBei der nachstehenden Gesellschaft wird das Amtslöschungsverfahren gemäß § 394 FamFG eingeleitet. Widerspruchsfrist: 8 Wochen"
    },
    {
      "date": "2025-02-05",
      "id": "100514",
      "original_text": "Löschungsankündigung\nBerlin Amtsgericht Berlin (Charlottenburg) HRB 251938\nImperial Trading & Consulting GmbH – Berlin",
      "type": "Löschungsankündigung",
      "state": "Berlin",
      "amtsgericht": "Amtsgericht Berlin (Charlottenburg)",
      "registernummer": "HRB 251938",
      "registerart": "HRB",
      "company_name": "Imperial Trading & Consulting GmbH",
      "company_seat": "Berlin",
      "details": "05.02.2025 (Bekanntmachungsdatum)\n\nBerlin Amtsgericht Berlin (Charlottenburg) HRB 251938\nLöschungsankündigung\n\nImperial Trading & Consulting GmbH\nGesellschaft mit beschränkter Haftung\nBerlin\n\nBei der nachstehenden Gesellschaft wird das Amtslöschungsverfahren gemäß § 394 FamFG eingeleitet. Widerspruchsfrist 6 Wochen"
    },
    {
      "date": "2025-02-05",
      "id": "100515",
      "original_text": "Registerbekanntmachung nach dem Umwandlungsgesetz\nBerlin Amtsgericht Berlin (Charlottenburg) HRB 271798\nBarteltGLASBerlin GmbH – Berlin",
      "type": "Registerbekanntmachung nach dem Umwandlungsgesetz",
      "state": "Berlin",
      "amtsgericht": "Amtsgericht Berlin (Charlottenburg)",
      "registernummer": "HRB 271798",
      "registerart": "HRB",
      "company_name": "BarteltGLASBerlin GmbH",
      "company_seat": "Berlin",
      "details": "05.02.2025 (Bekanntmachungsdatum)\n\nBerlin Amtsgericht Berlin (Charlottenburg) HRB 271798\nRegisterbekanntmachung nach dem Umwandlungsgesetz 04.02.2025 (Eintragungsdatum)\n\nBarteltGLASBerlin GmbH\nGesellschaft mit beschränkter Haftung\nBerlin\n\nZu Eintragungsnummer 1 vom 04.02.2025 wird als nicht eingetragen veröffentlicht:\nDen Gläubigern ist, wenn sie binnen sechs Monaten nach dem Tag, an dem die Eintragung der Umwandlung als bekannt gemacht gilt, ihren Anspruch nach Grund und Höhe schriftlich anmelden, Sicherheit zu leisten, soweit sie nicht Befriedigung verlangen können. Dieses Recht steht den Gläubigern jedoch nur zu, wenn sie glaubhaft machen, dass durch die Umwandlung die Erfüllung ihrer Forderung gefährdet wird. Das Recht, Sicherheitsleistung zu verlangen, steht Gläubigern nicht zu, die im Falle der Insolvenz ein Recht auf vorzugsweise Befriedigung aus einer Deckungsmasse haben, die nach gesetzlicher Vorschrift zu ihrem Schutz errichtet und staatlich überwacht ist."
    },
    {
      "date": "2025-02-05",
      "id": "100516",
      "original_text": "Löschungsankündigung\nSchleswig-Holstein Amtsgericht Pinneberg HRB 7461\nDXP Trading GmbH – Pinneberg",
      "type": "Löschungsankündigung",
      "state": "Schleswig-Holstein",
      "amtsgericht": "Amtsgericht Pinneberg",
      "registernummer": "HRB 7461",
      "registerart": "HRB",
      "company_name": "DXP Trading GmbH",
      "company_seat": "Pinneberg",
      "details": "05.02.2025 (Bekanntmachungsdatum)\n\nSchleswig-Holstein Amtsgericht Pinneberg HRB 7461\nLöschungsankündigung\n\nDXP Trading GmbH\nGesellschaft mit beschränkter Haftung\nPinneberg\n\nEs ist die Löschung der nachstehenden Gesellschaft wegen Vermögenslosigkeit gemäß § 394 FamFG beabsichtigt. Widerspruchsfrist: 2 Monate."
    },
    {
      "date": "2025-02-05",
      "id": "100517",
      "original_text": "Registerbekanntmachung nach dem Umwandlungsgesetz\nSchleswig-Holstein Amtsgericht Kiel HRB 27737\nHypion Motion Lübeck HRS GmbH – Kiel",
      "type": "Registerbekanntmachung nach dem Umwandlungsgesetz",
      "state": "Schleswig-Holstein",
      "amtsgericht": "Amtsgericht Kiel",
      "registernummer": "HRB 27737",
      "registerart": "HRB",
      "company_name": "Hypion Motion Lübeck HRS GmbH",
      "company_seat": "Kiel",
      "details": "05.02.2025 (Bekanntmachungsdatum)\n\nSchleswig-Holstein Amtsgericht Kiel HRB 27737\nRegisterbekanntmachung nach dem Umwandlungsgesetz 04.02.2025 (Eintragungsdatum)\n\nHypion Motion Lübeck HRS GmbH\nGesellschaft mit beschränkter Haftung\nKiel\n\nZu Eintragungsnummer 2 vom 04.02.2025 wird als nicht eingetragen veröffentlicht: Den Gläubigern der an der Verschmelzung beteiligten Rechtsträger ist, wenn sie binnen sechs Monaten nach dem Tag, an dem die Eintragung der Verschmelzung in das Register des Sitzes desjenigen Rechtsträgers, dessen Gläubiger sie sind, nach § 19 Abs. 3 UmwG bekannt gemacht worden ist, ihren Anspruch nach Grund und Höhe schriftlich anmelden, Sicherheit zu leisten, soweit sie nicht Befriedigung verlangen können. Dieses Recht steht den Gläubigern jedoch nur zu, wenn sie glaubhaft machen, dass durch die Verschmelzung die Erfüllung ihrer Forderung gefährdet wird."
    },
    {
      "date": "2025-02-05",
      "id": "100518",
      "original_text": "Einreichung neuer Dokumente\nBaden-Württemberg Amtsgericht Mannheim HRB 231945\nStadtbusverkehr Bruchsal GmbH – Bruchsal",
      "type": "Einreichung neuer Dokumente",
      "state": "Baden-Württemberg",
      "amtsgericht": "Amtsgericht Mannheim",
      "registernummer": "HRB 231945",
      "registerart": "HRB",
      "company_name": "Stadtbusverkehr Bruchsal GmbH",
      "company_seat": "Bruchsal",
      "details": "05.02.2025 (Bekanntmachungsdatum)\n\nBaden-Württemberg Amtsgericht Mannheim HRB 231945\nEinreichung neuer Dokumente\n\nStadtbusverkehr Bruchsal GmbH\nGesellschaft mit beschränkter Haftung\nBruchsal\n\nDie Gesellschaft hat am 04.02.2025 die Liste über die Zusammensetzung des Aufsichtsrats zum Handelsregister eingereicht."
    },
    {
      "date": "2025-02-05",
      "id": "100519",
      "original_text": "Registerbekanntmachung nach dem Umwandlungsgesetz\nSchleswig-Holstein Amtsgericht Kiel HRB 2315 RD\nH. Tank Management GmbH – Rendsburg",
      "type": "Registerbekanntmachung nach dem Umwandlungsgesetz",
      "state": "Schleswig-Holstein",
      "amtsgericht": "Amtsgericht Kiel",
      "registernummer": "HRB 2315 RD",
      "registerart": "HRB",
      "company_name": "H. Tank Management GmbH",
      "company_seat": "Rendsburg",
      "details": "05.02.2025 (Bekanntmachungsdatum)\n\nSchleswig-Holstein Amtsgericht Kiel HRB 2315 RD\nRegisterbekanntmachung nach dem Umwandlungsgesetz 31.01.2025 (Eintragungsdatum)\n\nH. Tank Management GmbH\nGesellschaft mit beschränkter Haftung\nRendsburg\n\nZu Eintragungsnummer 6 vom 31.01.2025 wird als nicht eingetragen veröffentlicht: Den Gläubigern der an der Verschmelzung beteiligten Rechtsträger ist, wenn sie binnen sechs Monaten nach dem Tag, an dem die Eintragung der Verschmelzung in das Register des Sitzes desjenigen Rechtsträgers, dessen Gläubiger sie sind, nach § 19 Abs. 3 UmwG bekannt gemacht worden ist, ihren Anspruch nach Grund und Höhe schriftlich anmelden, Sicherheit zu leisten, soweit sie nicht Befriedigung verlangen können. Dieses Recht steht den Gläubigern jedoch nur zu, wenn sie glaubhaft machen, dass durch die Verschmelzung die Erfüllung ihrer Forderung gefährdet wird.eröffentlicht:"
    },
    {
      "date": "2025-02-05",
      "id": "100520",
      "original_text": "Registerbekanntmachung nach dem Umwandlungsgesetz\nBerlin Amtsgericht Berlin (Charlottenburg) HRB 271693\nN26 SE – Berlin",
      "type": "Registerbekanntmachung nach dem Umwandlungsgesetz",
      "state": "Berlin",
      "amtsgericht": "Amtsgericht Berlin (Charlottenburg)",
      "registernummer": "HRB 271693",
      "registerart": "HRB",
      "company_name": "N26 SE",
      "company_seat": "Berlin",
      "details": "05.02.2025 (Bekanntmachungsdatum)\n\nBerlin Amtsgericht Berlin (Charlottenburg) HRB 271693\nRegisterbekanntmachung nach dem Umwandlungsgesetz 31.01.2025 (Eintragungsdatum)\n\nN26 SE\nEuropäische Aktiengesellschaft (SE)\nBerlin\n\nZu Eintragungsnummer 1 vom 31.01.2025 wird als nicht eingetragen veröffentlicht: Den Gläubigern der an der Verschmelzung beteiligten Rechtsträger ist, wenn sie binnen sechs Monaten nach dem Tag, an dem die Eintragung der Verschmelzung in das Register des Sitzes desjenigen Rechtsträgers, dessen Gläubiger sie sind, als bekannt gemacht gilt, ihren Anspruch nach Grund und Höhe schriftlich anmelden, Sicherheit zu leisten, soweit sie nicht Befriedigung verlangen können. Dieses Recht steht den Gläubigern jedoch nur zu, wenn sie glaubhaft machen, dass durch die Verschmelzung die Erfüllung ihrer Forderung gefährdet wird. Das Recht, Sicherheitsleistung zu verlangen, steht Gläubigern nicht zu, die im Falle der Insolvenz ein Recht auf vorzugsweise Befriedigung aus einer Deckungsmasse haben, die nach gesetzlicher Vorschrift zu ihrem Schutz errichtet und staatlich überwacht ist."
    },
    {
      "date": "2025-02-05",
      "id": "100521",
      "original_text": "Registerbekanntmachung nach dem Umwandlungsgesetz\nBerlin Amtsgericht Berlin (Charlottenburg) HRB 271693\nN26 SE – Berlin",
      "type": "Registerbekanntmachung nach dem Umwandlungsgesetz",
      "state": "Berlin",
      "amtsgericht": "Amtsgericht Berlin (Charlottenburg)",
      "registernummer": "HRB 271693",
      "registerart": "HRB",
      "company_name": "N26 SE",
      "company_seat": "Berlin",
      "details": "05.02.2025 (Bekanntmachungsdatum)\n\nBerlin Amtsgericht Berlin (Charlottenburg) HRB 271693\nRegisterbekanntmachung nach dem Umwandlungsgesetz 31.01.2025 (Eintragungsdatum)\n\nN26 SE\nEuropäische Aktiengesellschaft (SE)\nBerlin\n\nZu Eintragungsnummer 2 vom 31.01.2025 wird als nicht eingetragen veröffentlicht: Den Gläubigern ist, wenn sie binnen sechs Monaten nach dem Tag, an dem die Eintragung der Umwandlung als bekannt gemacht gilt, ihren Anspruch nach Grund und Höhe schriftlich anmelden, Sicherheit zu leisten, soweit sie nicht Befriedigung verlangen können. Dieses Recht steht den Gläubigern jedoch nur zu, wenn sie glaubhaft machen, dass durch die Umwandlung die Erfüllung ihrer Forderung gefährdet wird. Das Recht, Sicherheitsleistung zu verlangen, steht Gläubigern nicht zu, die im Falle der Insolvenz ein Recht auf vorzugsweise Befriedigung aus einer Deckungsmasse haben, die nach gesetzlicher Vorschrift zu ihrem Schutz errichtet und staatlich überwacht ist."
    },
    {
      "date": "2025-02-05",
      "id": "100522",
      "original_text": "Registerbekanntmachung nach dem Umwandlungsgesetz\nBaden-Württemberg Amtsgericht Mannheim HRB 722503\nKajganic Energy Systems GmbH – Mannheim",
      "type": "Registerbekanntmachung nach dem Umwandlungsgesetz",
      "state": "Baden-Württemberg",
      "amtsgericht": "Amtsgericht Mannheim",
      "registernummer": "HRB 722503",
      "registerart": "HRB",
      "company_name": "Kajganic Energy Systems GmbH",
      "company_seat": "Mannheim",
      "details": "05.02.2025 (Bekanntmachungsdatum)\n\nBaden-Württemberg Amtsgericht Mannheim HRB 722503\nRegisterbekanntmachung nach dem Umwandlungsgesetz 05.02.2025 (Eintragungsdatum)\n\nKajganic Energy Systems GmbH\nGesellschaft mit beschränkter Haftung\nMannheim\n\nAls nicht eingetragen wird bekanntgemacht:\nDen Gläubigern der an der Verschmelzung beteiligten Rechtsträger ist, wenn sie binnen sechs Monaten nach dem Tag, an dem die Eintragung der Verschmelzung in das Register des Sitzes desjenigen Rechtsträgers, dessen Gläubiger sie sind, nach § 19 Abs. 3 UmwG als bekanntgemacht gilt, ihren Anspruch nach Grund und Höhe schriftlich anmelden, Sicherheit zu leisten, soweit sie nicht Befriedigung verlangen können. Dieses Recht steht den Gläubigern jedoch nur zu, wenn sie glaubhaft machen, dass durch die Verschmelzung die Erfüllung ihrer Forderung gefährdet wird."
    },
    {
      "date": "2025-02-05",
      "id": "100523",
      "original_text": "Registerbekanntmachung nach dem Umwandlungsgesetz\nBerlin Amtsgericht Berlin (Charlottenburg) HRA 63127\nnur-chicken e.K. – Berlin",
      "type": "Registerbekanntmachung nach dem Umwandlungsgesetz",
      "state": "Berlin",
      "amtsgericht": "Amtsgericht Berlin (Charlottenburg)",
      "registernummer": "HRA 63127",
      "registerart": "HRA",
      "company_name": "nur-chicken e.K.",
      "company_seat": "Berlin",
      "details": "05.02.2025 (Bekanntmachungsdatum)\n\nBerlin Amtsgericht Berlin (Charlottenburg) HRA 63127\nRegisterbekanntmachung nach dem Umwandlungsgesetz 05.02.2025 (Eintragungsdatum)\n\nnur-chicken e.K.\nEinzelkaufmann / Einzelkauffrau\nBerlin\n\nZu Eintragungsnummer 2 vom 05.02.2025 wird als nicht eingetragen veröffentlicht: Den Gläubigern ist, wenn sie binnen sechs Monaten nach dem Tag, an dem die Eintragung der Ausgliederung als bekannt gemacht gilt, ihren Anspruch nach Grund und Höhe schriftlich anmelden, Sicherheit zu leisten, soweit sie nicht Befriedigung verlangen können. Dieses Recht steht den Gläubigern jedoch nur zu, wenn sie glaubhaft machen, dass durch die Ausgliederung die Erfüllung ihrer Forderung gefährdet wird. Das Recht, Sicherheitsleistung zu verlangen, steht Gläubigern nicht zu, die im Falle der Insolvenz ein Recht auf vorzugsweise Befriedigung aus einer Deckungsmasse haben, die nach gesetzlicher Vorschrift zu ihrem Schutz errichtet und staatlich überwacht ist."
    },
    {
      "date": "2025-02-05",
      "id": "100524",
      "original_text": "Registerbekanntmachung nach dem Umwandlungsgesetz\nSachsen-Anhalt Amtsgericht Stendal HRB 6769\nDL Empland GmbH – Bismark (Altmark) OT Dobberkau",
      "type": "Registerbekanntmachung nach dem Umwandlungsgesetz",
      "state": "Sachsen-Anhalt",
      "amtsgericht": "Amtsgericht Stendal",
      "registernummer": "HRB 6769",
      "registerart": "HRB",
      "company_name": "DL Empland GmbH",
      "company_seat": "Bismark (Altmark) OT Dobberkau",
      "details": "05.02.2025 (Bekanntmachungsdatum)\n\nSachsen-Anhalt Amtsgericht Stendal HRB 6769\nRegisterbekanntmachung nach dem Umwandlungsgesetz 05.02.2025 (Eintragungsdatum)\n\nDL Empland GmbH\nGesellschaft mit beschränkter Haftung\nBismark (Altmark)  OT Dobberkau\n\nNicht eingetragen:\nDen Gläubigern der an der Verschmelzung beteiligten Rechtsträger ist, wenn sie binnen sechs Monaten nach dem Tag, an dem die Eintragung der Verschmelzung nach § 19 Abs. 3 UmwG als bekanntgemacht gilt, ihren Anspruch nach Grund und Höhe schriftlich anmelden, Sicherheit zu leisten, soweit sie nicht Befriedigung verlangen können. Dieses Recht steht ihnen jedoch nur zu, wenn sie glaubhaft machen, dass durch die Verschmelzung die Erfüllung ihrer Forderung gefährdet wird."
    },
    {
      "date": "2025-02-05",
      "id": "100525",
      "original_text": "Registerbekanntmachung nach dem Umwandlungsgesetz\nSachsen-Anhalt Amtsgericht Stendal HRB 782\nDobberkauer Landwirte GmbH – Bismark (Altmark)",
      "type": "Registerbekanntmachung nach dem Umwandlungsgesetz",
      "state": "Sachsen-Anhalt",
      "amtsgericht": "Amtsgericht Stendal",
      "registernummer": "HRB 782",
      "registerart": "HRB",
      "company_name": "Dobberkauer Landwirte GmbH",
      "company_seat": "Bismark (Altmark)",
      "details": "05.02.2025 (Bekanntmachungsdatum)\n\nSachsen-Anhalt Amtsgericht Stendal HRB 782\nRegisterbekanntmachung nach dem Umwandlungsgesetz 05.02.2025 (Eintragungsdatum)\n\nDobberkauer Landwirte GmbH\nGesellschaft mit beschränkter Haftung\nBismark (Altmark)\n\nNicht eingetragen:\nDen Gläubigern der an der Verschmelzung beteiligten Rechtsträger ist, wenn sie binnen sechs Monaten nach dem Tag, an dem die Eintragung der Verschmelzung nach § 19 Abs. 3 UmwG als bekanntgemacht gilt, ihren Anspruch nach Grund und Höhe schriftlich anmelden, Sicherheit zu leisten, soweit sie nicht Befriedigung verlangen können. Dieses Recht steht ihnen jedoch nur zu, wenn sie glaubhaft machen, dass durch die Verschmelzung die Erfüllung ihrer Forderung gefährdet wird."
    },
    {
      "date": "2025-02-05",
      "id": "100526",
      "original_text": "Sonstige Registerbekanntmachung\nBerlin Amtsgericht Berlin (Charlottenburg) HRB 111929\nEUROVIA Infra GmbH – Berlin",
      "type": "Sonstige Registerbekanntmachung",
      "state": "Berlin",
      "amtsgericht": "Amtsgericht Berlin (Charlottenburg)",
      "registernummer": "HRB 111929",
      "registerart": "HRB",
      "company_name": "EUROVIA Infra GmbH",
      "company_seat": "Berlin",
      "details": "05.02.2025 (Bekanntmachungsdatum)\n\nBerlin Amtsgericht Berlin (Charlottenburg) HRB 111929\nSonstige Registerbekanntmachung\n\nEUROVIA Infra GmbH\nGesellschaft mit beschränkter Haftung\nBerlin\n\nAls nicht eingetragen wird veröffentlicht: Der andere Vertragsteil hat den Gläubigern dieses Rechtsträgers, deren Forderungen begründet worden sind, bevor die Eintragung der Beendigung dieses Vertrages in das Handelsregister nach § 10 des Handelsgesetzbuches als bekannt gemacht gilt, Sicherheit zu leisten, wenn sie sich binnen sechs Monaten nach der Bekanntmachung der Eintragung zu diesem Zweck bei ihm melden. Dieses Recht steht den Gläubigern nicht zu, die im Fall des Insolvenzverfahrens ein Recht auf vorzugsweise Befriedigung aus der Deckungsmasse haben, die nach gesetzlicher Vorschrift zu ihrem Schutz errichtet und staatlich überwacht ist."
    },
    {
      "date": "2025-02-05",
      "id": "100527",
      "original_text": "Sonstige Registerbekanntmachung\nBerlin Amtsgericht Berlin (Charlottenburg) HRB 111929\nEUROVIA Infra GmbH – Berlin",
      "type": "Sonstige Registerbekanntmachung",
      "state": "Berlin",
      "amtsgericht": "Amtsgericht Berlin (Charlottenburg)",
      "registernummer": "HRB 111929",
      "registerart": "HRB",
      "company_name": "EUROVIA Infra GmbH",
      "company_seat": "Berlin",
      "details": "05.02.2025 (Bekanntmachungsdatum)\n\nBerlin Amtsgericht Berlin (Charlottenburg) HRB 111929\nSonstige Registerbekanntmachung\n\nEUROVIA Infra GmbH\nGesellschaft mit beschränkter Haftung\nBerlin\n\nAls nicht eingetragen wird veröffentlicht: Den Gläubigern der an der Verschmelzung beteiligten Rechtsträger ist, wenn sie binnen sechs Monaten nach dem Tag, an dem die Eintragung der Verschmelzung in das Register des Sitzes desjenigen Rechtsträgers, dessen Gläubiger sie sind, als bekannt gemacht gilt, ihren Anspruch nach Grund und Höhe schriftlich anmelden, Sicherheit zu leisten, soweit sie nicht Befriedigung verlangen können. Dieses Recht steht den Gläubigern jedoch nur zu, wenn sie glaubhaft machen, dass durch die Verschmelzung die Erfüllung ihrer Forderung gefährdet wird. Das Recht, Sicherheitsleistung zu verlangen, steht Gläubigern nicht zu, die im Falle der Insolvenz ein Recht auf vorzugsweise Befriedigung aus einer Deckungsmasse haben, die nach gesetzlicher Vorschrift zu ihrem Schutz errichtet und staatlich überwacht ist."
    },
    {
      "date": "2025-02-05",
      "id": "100528",
      "original_text": "Sonstige Registerbekanntmachung\nBerlin Amtsgericht Berlin (Charlottenburg) HRB 153071\nVIA IMC GmbH Infrastruktur Management Consulting – Berlin",
      "type": "Sonstige Registerbekanntmachung",
      "state": "Berlin",
      "amtsgericht": "Amtsgericht Berlin (Charlottenburg)",
      "registernummer": "HRB 153071",
      "registerart": "HRB",
      "company_name": "VIA IMC GmbH Infrastruktur Management Consulting",
      "company_seat": "Berlin",
      "details": "05.02.2025 (Bekanntmachungsdatum)\n\nBerlin Amtsgericht Berlin (Charlottenburg) HRB 153071\nSonstige Registerbekanntmachung\n\nVIA IMC GmbH Infrastruktur Management Consulting\nGesellschaft mit beschränkter Haftung\nBerlin\n\nAls nicht eingetragen wird veröffentlicht: Den Gläubigern der an der Verschmelzung beteiligten Rechtsträger ist, wenn sie binnen sechs Monaten nach dem Tag, an dem die Eintragung der Verschmelzung in das Register des Sitzes desjenigen Rechtsträgers, dessen Gläubiger sie sind, als bekannt gemacht gilt, ihren Anspruch nach Grund und Höhe schriftlich anmelden, Sicherheit zu leisten, soweit sie nicht Befriedigung verlangen können. Dieses Recht steht den Gläubigern jedoch nur zu, wenn sie glaubhaft machen, dass durch die Verschmelzung die Erfüllung ihrer Forderung gefährdet wird. Das Recht, Sicherheitsleistung zu verlangen, steht Gläubigern nicht zu, die im Falle der Insolvenz ein Recht auf vorzugsweise Befriedigung aus einer Deckungsmasse haben, die nach gesetzlicher Vorschrift zu ihrem Schutz errichtet und staatlich überwacht ist."
    },
    {
      "date": "2025-02-05",
      "id": "100529",
      "original_text": "Registerbekanntmachung nach dem Umwandlungsgesetz\nBaden-Württemberg Amtsgericht Ulm VR 660755\nFreie Evangelische Schule und Kindertagesstätte Heidenheim e.V. – Heidenheim an der Brenz",
      "type": "Registerbekanntmachung nach dem Umwandlungsgesetz",
      "state": "Baden-Württemberg",
      "amtsgericht": "Amtsgericht Ulm",
      "registernummer": "VR 660755",
      "registerart": "VR",
      "company_name": "Freie Evangelische Schule und Kindertagesstätte Heidenheim e.V.",
      "company_seat": "Heidenheim an der Brenz",
      "details": "05.02.2025 (Bekanntmachungsdatum)\n\nBaden-Württemberg Amtsgericht Ulm VR 660755\nRegisterbekanntmachung nach dem Umwandlungsgesetz 05.02.2025 (Eintragungsdatum)\n\nFreie Evangelische Schule und Kindertagesstätte Heidenheim e.V.\neingetragener Verein\nHeidenheim an der Brenz\n\nAls nicht eingetragen wird bekanntgemacht:\nDen Gläubigern der an der Verschmelzung beteiligten Rechtsträger ist, wenn sie binnen sechs Monaten nach dem Tag, an dem die Eintragung der Verschmelzung in das Register des Sitzes desjenigen Rechtsträgers, dessen Gläubiger sie sind, nach § 19 Abs. 3 UmwG als bekanntgemacht gilt, ihren Anspruch nach Grund und Höhe schriftlich anmelden, Sicherheit zu leisten, soweit sie nicht Befriedigung verlangen können. Dieses Recht steht den Gläubigern jedoch nur zu, wenn sie glaubhaft machen, dass durch die Verschmelzung die Erfüllung ihrer Forderung gefährdet wird."
    },
    {
      "date": "2025-02-05",
      "id": "100530",
      "original_text": "Registerbekanntmachung nach dem Umwandlungsgesetz\nBaden-Württemberg Amtsgericht Ulm VR 701091\nBildung und christliche Werte e.V. – Schwäbisch Gmünd",
      "type": "Registerbekanntmachung nach dem Umwandlungsgesetz",
      "state": "Baden-Württemberg",
      "amtsgericht": "Amtsgericht Ulm",
      "registernummer": "VR 701091",
      "registerart": "VR",
      "company_name": "Bildung und christliche Werte e.V.",
      "company_seat": "Schwäbisch Gmünd",
      "details": "05.02.2025 (Bekanntmachungsdatum)\n\nBaden-Württemberg Amtsgericht Ulm VR 701091\nRegisterbekanntmachung nach dem Umwandlungsgesetz 05.02.2025 (Eintragungsdatum)\n\nBildung und christliche Werte e.V.\neingetragener Verein\nSchwäbisch Gmünd\n\nAls nicht eingetragen wird bekanntgemacht:\nDen Gläubigern der an der Verschmelzung beteiligten Rechtsträger ist, wenn sie binnen sechs Monaten nach dem Tag, an dem die Eintragung der Verschmelzung in das Register des Sitzes desjenigen Rechtsträgers, dessen Gläubiger sie sind, nach § 19 Abs. 3 UmwG als bekanntgemacht gilt, ihren Anspruch nach Grund und Höhe schriftlich anmelden, Sicherheit zu leisten, soweit sie nicht Befriedigung verlangen können. Dieses Recht steht den Gläubigern jedoch nur zu, wenn sie glaubhaft machen, dass durch die Verschmelzung die Erfüllung ihrer Forderung gefährdet wird."
    },
    {
      "date": "2025-02-05",
      "id": "100531",
      "original_text": "Registerbekanntmachung nach dem Umwandlungsgesetz\nHamburg Amtsgericht Hamburg HRB 190676\nNeutrahl GmbH – Hamburg",
      "type": "Registerbekanntmachung nach dem Umwandlungsgesetz",
      "state": "Hamburg",
      "amtsgericht": "Amtsgericht Hamburg",
      "registernummer": "HRB 190676",
      "registerart": "HRB",
      "company_name": "Neutrahl GmbH",
      "company_seat": "Hamburg",
      "details": "05.02.2025 (Bekanntmachungsdatum)\n\nHamburg Amtsgericht Hamburg HRB 190676\nRegisterbekanntmachung nach dem Umwandlungsgesetz 05.02.2025 (Eintragungsdatum)\n\nNeutrahl GmbH\nGesellschaft mit beschränkter Haftung\nHamburg\n\nAls nicht eingetragen wird bekannt gemacht:\nDen Gläubigern der an der formwechselnden Umwandlung beteiligten Gesellschaften ist, wenn sie binnen sechs Monaten nach dem Tag, an dem die Eintragung der formwechselnden Umwandlung in das Register des Sitzes desjenigen Rechtsträgers, dessen Gläubiger sie sind, nach § 19 Absatz 3 UmwG als bekannt gemacht gilt, ihren Anspruch nach Grund und Höhe schriftlich anmelden, Sicherheit zu leisten, soweit sie nicht Befriedigung verlangen können. Dieses Recht steht den Gläubigern jedoch nur zu, wenn sie glaubhaft machen, dass durch die formwechselnde Umwandlung die Erfüllung ihrer Forderung gefährdet wird."
    },
    {
      "date": "2025-02-05",
      "id": "100532",
      "original_text": "Registerbekanntmachung nach dem Umwandlungsgesetz\nHamburg Amtsgericht Hamburg HRB 62827\nAhlrep Elektrogroßhandel Aktiengesellschaft – Hamburg",
      "type": "Registerbekanntmachung nach dem Umwandlungsgesetz",
      "state": "Hamburg",
      "amtsgericht": "Amtsgericht Hamburg",
      "registernummer": "HRB 62827",
      "registerart": "HRB",
      "company_name": "Ahlrep Elektrogroßhandel Aktiengesellschaft",
      "company_seat": "Hamburg",
      "details": "05.02.2025 (Bekanntmachungsdatum)\n\nHamburg Amtsgericht Hamburg HRB 62827\nRegisterbekanntmachung nach dem Umwandlungsgesetz 05.02.2025 (Eintragungsdatum)\n\nAhlrep Elektrogroßhandel Aktiengesellschaft\nAktiengesellschaft\nHamburg\n\nAls nicht eingetragen wird bekannt gemacht:\nDen Gläubigern der an der formwechselnden Umwandlung beteiligten Gesellschaften ist, wenn sie binnen sechs Monaten nach dem Tag, an dem die Eintragung der formwechselnden Umwandlung in das Register des Sitzes desjenigen Rechtsträgers, dessen Gläubiger sie sind, nach § 19 Absatz 3 UmwG als bekannt gemacht gilt, ihren Anspruch nach Grund und Höhe schriftlich anmelden, Sicherheit zu leisten, soweit sie nicht Befriedigung verlangen können. Dieses Recht steht den Gläubigern jedoch nur zu, wenn sie glaubhaft machen, dass durch die formwechselnde Umwandlung die Erfüllung ihrer Forderung gefährdet wird."
    },
    {
      "date": "2025-02-05",
      "id": "100533",
      "original_text": "Einreichung neuer Dokumente\nBerlin Amtsgericht Berlin (Charlottenburg) HRB 254440\nF.A.S.T. Future Aviation Simulation Technologies GmbH – Berlin",
      "type": "Einreichung neuer Dokumente",
      "state": "Berlin",
      "amtsgericht": "Amtsgericht Berlin (Charlottenburg)",
      "registernummer": "HRB 254440",
      "registerart": "HRB",
      "company_name": "F.A.S.T. Future Aviation Simulation Technologies GmbH",
      "company_seat": "Berlin",
      "details": "05.02.2025 (Bekanntmachungsdatum)\n\nBerlin Amtsgericht Berlin (Charlottenburg) HRB 254440\nEinreichung neuer Dokumente\n\nF.A.S.T. Future Aviation Simulation Technologies GmbH\nGesellschaft mit beschränkter Haftung\nBerlin\n\nAls nicht eingetragen wird veröffentlicht: Es wurde eine neue Liste der Beiratsmitglieder eingereicht (§52 GmbHG)."
    },
    {
      "date": "2025-02-05",
      "id": "100534",
      "original_text": "Registerbekanntmachung nach dem Umwandlungsgesetz\nHamburg Amtsgericht Hamburg HRB 43935\nplusswerk GmbH – Hamburg",
      "type": "Registerbekanntmachung nach dem Umwandlungsgesetz",
      "state": "Hamburg",
      "amtsgericht": "Amtsgericht Hamburg",
      "registernummer": "HRB 43935",
      "registerart": "HRB",
      "company_name": "plusswerk GmbH",
      "company_seat": "Hamburg",
      "details": "05.02.2025 (Bekanntmachungsdatum)\n\nHamburg Amtsgericht Hamburg HRB 43935\nRegisterbekanntmachung nach dem Umwandlungsgesetz 05.02.2025 (Eintragungsdatum)\n\nplusswerk GmbH\nGesellschaft mit beschränkter Haftung\nHamburg\n\nAls nicht eingetragen wird bekannt gemacht:\nDen Gläubigern der an der Abspaltung beteiligten Gesellschaften ist, wenn sie binnen sechs Monaten nach dem Tag, an dem die Eintragung der Abspaltung in das Register des Sitzes desjenigen Rechtsträgers, dessen Gläubiger sie sind, nach § 19 Absatz 3 UmwG als bekannt gemacht gilt, ihren Anspruch nach Grund und Höhe schriftlich anmelden, Sicherheit zu leisten, soweit sie nicht Befriedigung verlangen können. Dieses Recht steht den Gläubigern jedoch nur zu, wenn sie glaubhaft machen, dass durch die Abspaltung die Erfüllung ihrer Forderung gefährdet wird."
    },
    {
      "date": "2025-02-05",
      "id": "100535",
      "original_text": "Registerbekanntmachung nach dem Umwandlungsgesetz\nHamburg Amtsgericht Hamburg HRB 32257\npluss Personalmanagement GmbH – Hamburg",
      "type": "Registerbekanntmachung nach dem Umwandlungsgesetz",
      "state": "Hamburg",
      "amtsgericht": "Amtsgericht Hamburg",
      "registernummer": "HRB 32257",
      "registerart": "HRB",
      "company_name": "pluss Personalmanagement GmbH",
      "company_seat": "Hamburg",
      "details": "05.02.2025 (Bekanntmachungsdatum)\n\nHamburg Amtsgericht Hamburg HRB 32257\nRegisterbekanntmachung nach dem Umwandlungsgesetz 05.02.2025 (Eintragungsdatum)\n\npluss Personalmanagement GmbH\nGesellschaft mit beschränkter Haftung\nHamburg\n\nAls nicht eingetragen wird bekannt gemacht:\nDen Gläubigern der an der Abspaltung beteiligten Gesellschaften ist, wenn sie binnen sechs Monaten nach dem Tag, an dem die Eintragung der Abspaltung in das Register des Sitzes desjenigen Rechtsträgers, dessen Gläubiger sie sind, nach § 19 Absatz 3 UmwG als bekannt gemacht gilt, ihren Anspruch nach Grund und Höhe schriftlich anmelden, Sicherheit zu leisten, soweit sie nicht Befriedigung verlangen können. Dieses Recht steht den Gläubigern jedoch nur zu, wenn sie glaubhaft machen, dass durch die Abspaltung die Erfüllung ihrer Forderung gefährdet wird."
    },
    {
      "date": "2025-02-05",
      "id": "100536",
      "original_text": "Registerbekanntmachung nach dem Umwandlungsgesetz\nSachsen Amtsgericht Chemnitz HRB 32836\nFreiberg Apartments UG (haftungsbeschränkt) – Freiberg",
      "type": "Registerbekanntmachung nach dem Umwandlungsgesetz",
      "state": "Sachsen",
      "amtsgericht": "Amtsgericht Chemnitz",
      "registernummer": "HRB 32836",
      "registerart": "HRB",
      "company_name": "Freiberg Apartments UG (haftungsbeschränkt)",
      "company_seat": "Freiberg",
      "details": "05.02.2025 (Bekanntmachungsdatum)\n\nSachsen Amtsgericht Chemnitz HRB 32836\nRegisterbekanntmachung nach dem Umwandlungsgesetz 05.02.2025 (Eintragungsdatum)\n\nFreiberg Apartments UG (haftungsbeschränkt)\nGesellschaft mit beschränkter Haftung\nFreiberg\n\nDen Gläubigern der an der Verschmelzung beteiligten Rechtsträger ist, wenn sie binnen sechs Monaten nach dem Tag, an dem die Eintragung der Verschmelzung in das Register des Sitzes desjenigen Rechtsträgers, dessen Gläubiger sie sind, nach § 19 Abs. 3 UmwG als bekannt gemacht gilt, ihren Anspruch nach Grund und Höhe in Textform anmelden, Sicherheit zu leisten, soweit sie nicht Befriedigung verlangen können. Dieses Recht steht den Gläubigern jedoch nur zu, wenn sie glaubhaft machen, dass durch die Verschmelzung die Erfüllung der Forderung gefährdet wird."
    },
    {
      "date": "2025-02-05",
      "id": "100537",
      "original_text": "Löschungsankündigung\nSachsen Amtsgericht Dresden HRB 35159\nH&R Ludo GmbH – Heidenau",
      "type": "Löschungsankündigung",
      "state": "Sachsen",
      "amtsgericht": "Amtsgericht Dresden",
      "registernummer": "HRB 35159",
      "registerart": "HRB",
      "company_name": "H&R Ludo GmbH",
      "company_seat": "Heidenau",
      "details": "05.02.2025 (Bekanntmachungsdatum)\n\nSachsen Amtsgericht Dresden HRB 35159\nLöschungsankündigung\n\nH&R Ludo GmbH\nGesellschaft mit beschränkter Haftung\nHeidenau\n\nDas Registergericht beabsichtigt, die im Handelsregister eingetragene Gesellschaft von Amts wegen nach § 394 FamFG zu löschen. Die Frist zu Erhebung eines Widerspruchs gegen die beabsichtigte Löschung wird auf einen Monat festgesetzt."
    },
    {
      "date": "2025-02-05",
      "id": "100538",
      "original_text": "Löschungsankündigung\nSachsen Amtsgericht Dresden HRB 43302\nNochtschi Gastronomiebetriebs UG (haftungsbeschränkt) – Dresden",
      "type": "Löschungsankündigung",
      "state": "Sachsen",
      "amtsgericht": "Amtsgericht Dresden",
      "registernummer": "HRB 43302",
      "registerart": "HRB",
      "company_name": "Nochtschi Gastronomiebetriebs UG (haftungsbeschränkt)",
      "company_seat": "Dresden",
      "details": "05.02.2025 (Bekanntmachungsdatum)\n\nSachsen Amtsgericht Dresden HRB 43302\nLöschungsankündigung\n\nNochtschi Gastronomiebetriebs UG (haftungsbeschränkt)\nGesellschaft mit beschränkter Haftung\nDresden\n\nDas Registergericht beabsichtigt, die im Handelsregister eingetragene Gesellschaft von Amts wegen nach § 394 FamFG zu löschen. Die Frist zu Erhebung eines Widerspruchs gegen die beabsichtigte Löschung wird auf einen Monat festgesetzt."
    },
    {
      "date": "2025-02-05",
      "id": "100539",
      "original_text": "Löschungsankündigung\nSachsen Amtsgericht Dresden HRB 34988\nGE-Heimrath Unternehmergesellschaft (haftungsbeschränkt) – Dresden",
      "type": "Löschungsankündigung",
      "state": "Sachsen",
      "amtsgericht": "Amtsgericht Dresden",
      "registernummer": "HRB 34988",
      "registerart": "HRB",
      "company_name": "GE-Heimrath Unternehmergesellschaft (haftungsbeschränkt)",
      "company_seat": "Dresden",
      "details": "05.02.2025 (Bekanntmachungsdatum)\n\nSachsen Amtsgericht Dresden HRB 34988\nLöschungsankündigung\n\nGE-Heimrath Unternehmergesellschaft (haftungsbeschränkt)\nGesellschaft mit beschränkter Haftung\nDresden\n\nDas Registergericht beabsichtigt, die im Handelsregister eingetragene Gesellschaft von Amts wegen nach § 394 FamFG zu löschen. Die Frist zu Erhebung eines Widerspruchs gegen die beabsichtigte Löschung wird auf einen Monat festgesetzt."
    },
    {
      "date": "2025-02-05",
      "id": "100540",
      "original_text": "Registerbekanntmachung nach dem Umwandlungsgesetz\nSachsen Amtsgericht Chemnitz HRB 17718\nMarienhöher Direktvermarktung Waldkirchen GmbH – Lengenfeld",
      "type": "Registerbekanntmachung nach dem Umwandlungsgesetz",
      "state": "Sachsen",
      "amtsgericht": "Amtsgericht Chemnitz",
      "registernummer": "HRB 17718",
      "registerart": "HRB",
      "company_name": "Marienhöher Direktvermarktung Waldkirchen GmbH",
      "company_seat": "Lengenfeld",
      "details": "05.02.2025 (Bekanntmachungsdatum)\n\nSachsen Amtsgericht Chemnitz HRB 17718\nRegisterbekanntmachung nach dem Umwandlungsgesetz 05.02.2025 (Eintragungsdatum)\n\nMarienhöher Direktvermarktung Waldkirchen GmbH\nGesellschaft mit beschränkter Haftung\nLengenfeld\n\nDen Gläubigern der an der Verschmelzung beteiligten Rechtsträger ist, wenn sie binnen sechs Monaten nach dem Tag, an dem die Eintragung der Verschmelzung in das Register des Sitzes desjenigen Rechtsträgers, dessen Gläubiger sie sind, nach § 19 Abs. 3 UmwG als bekannt gemacht gilt, ihren Anspruch nach Grund und Höhe in Textform anmelden, Sicherheit zu leisten, soweit sie nicht Befriedigung verlangen können. Dieses Recht steht den Gläubigern jedoch nur zu, wenn sie glaubhaft machen, dass durch die Verschmelzung die Erfüllung der Forderung gefährdet wird."
    },
    {
      "date": "2025-02-05",
      "id": "100541",
      "original_text": "Registerbekanntmachung nach dem Umwandlungsgesetz\nSachsen Amtsgericht Chemnitz HRB 5831\nAgroverwaltungsgesellschaft Waldkirchen mbH – Lengenfeld",
      "type": "Registerbekanntmachung nach dem Umwandlungsgesetz",
      "state": "Sachsen",
      "amtsgericht": "Amtsgericht Chemnitz",
      "registernummer": "HRB 5831",
      "registerart": "HRB",
      "company_name": "Agroverwaltungsgesellschaft Waldkirchen mbH",
      "company_seat": "Lengenfeld",
      "details": "05.02.2025 (Bekanntmachungsdatum)\n\nSachsen Amtsgericht Chemnitz HRB 5831\nRegisterbekanntmachung nach dem Umwandlungsgesetz 05.02.2025 (Eintragungsdatum)\n\nAgroverwaltungsgesellschaft  Waldkirchen mbH\nGesellschaft mit beschränkter Haftung\nLengenfeld\n\nDen Gläubigern der an der Verschmelzung beteiligten Rechtsträger ist, wenn sie binnen sechs Monaten nach dem Tag, an dem die Eintragung der Verschmelzung in das Register des Sitzes desjenigen Rechtsträgers, dessen Gläubiger sie sind, nach § 19 Abs. 3 UmwG als bekannt gemacht gilt, ihren Anspruch nach Grund und Höhe in Textform anmelden, Sicherheit zu leisten, soweit sie nicht Befriedigung verlangen können. Dieses Recht steht den Gläubigern jedoch nur zu, wenn sie glaubhaft machen, dass durch die Verschmelzung die Erfüllung der Forderung gefährdet wird."
    },
    {
      "date": "2025-02-05",
      "id": "100542",
      "original_text": "Registerbekanntmachung nach dem Umwandlungsgesetz\nSachsen Amtsgericht Chemnitz HRB 29269\nIB Gester UG (haftungsbeschränkt) – Chemnitz",
      "type": "Registerbekanntmachung nach dem Umwandlungsgesetz",
      "state": "Sachsen",
      "amtsgericht": "Amtsgericht Chemnitz",
      "registernummer": "HRB 29269",
      "registerart": "HRB",
      "company_name": "IB Gester UG (haftungsbeschränkt)",
      "company_seat": "Chemnitz",
      "details": "05.02.2025 (Bekanntmachungsdatum)\n\nSachsen Amtsgericht Chemnitz HRB 29269\nRegisterbekanntmachung nach dem Umwandlungsgesetz 05.02.2025 (Eintragungsdatum)\n\nIB Gester UG (haftungsbeschränkt)\nGesellschaft mit beschränkter Haftung\nChemnitz\n\nDen Gläubigern der an der Verschmelzung beteiligten Rechtsträger ist, wenn sie binnen sechs Monaten nach dem Tag, an dem die Eintragung der Verschmelzung in das Register des Sitzes desjenigen Rechtsträgers, dessen Gläubiger sie sind, nach § 19 Abs. 3 UmwG als bekannt gemacht gilt, ihren Anspruch nach Grund und Höhe in Textform anmelden, Sicherheit zu leisten, soweit sie nicht Befriedigung verlangen können. Dieses Recht steht den Gläubigern jedoch nur zu, wenn sie glaubhaft machen, dass durch die Verschmelzung die Erfüllung der Forderung gefährdet wird."
    },
    {
      "date": "2025-02-05",
      "id": "100543",
      "original_text": "Löschungsankündigung\nNiedersachsen Amtsgericht Osnabrück HRB 208089\nElektrotechnik Rüschen Verwaltungs GmbH – Sustrum",
      "type": "Löschungsankündigung",
      "state": "Niedersachsen",
      "amtsgericht": "Amtsgericht Osnabrück",
      "registernummer": "HRB 208089",
      "registerart": "HRB",
      "company_name": "Elektrotechnik Rüschen Verwaltungs GmbH",
      "company_seat": "Sustrum",
      "details": "05.02.2025 (Bekanntmachungsdatum)\n\nNiedersachsen Amtsgericht Osnabrück HRB 208089\nLöschungsankündigung\n\nElektrotechnik Rüschen Verwaltungs GmbH\nGesellschaft mit beschränkter Haftung\nSustrum\n\nDas Registergericht beabsichtigt, die Gesellschaft von Amts wegen nach § 394 FamFG wegen Vermögenslosigkeit zu löschen. Die Frist zur Erhebung eines Widerspruchs ist auf 1 Monat ab dieser Registerbekanntmachung festgesetzt."
    },
    {
      "date": "2025-02-05",
      "id": "100544",
      "original_text": "Einreichung neuer Dokumente\nNiedersachsen Amtsgericht Hannover HRB 209295\nGVH - Großraum-Verkehr Hannover GmbH – Hannover",
      "type": "Einreichung neuer Dokumente",
      "state": "Niedersachsen",
      "amtsgericht": "Amtsgericht Hannover",
      "registernummer": "HRB 209295",
      "registerart": "HRB",
      "company_name": "GVH - Großraum-Verkehr Hannover GmbH",
      "company_seat": "Hannover",
      "details": "05.02.2025 (Bekanntmachungsdatum)\n\nNiedersachsen Amtsgericht Hannover HRB 209295\nEinreichung neuer Dokumente\n\nGVH - Großraum-Verkehr Hannover GmbH\nGesellschaft mit beschränkter Haftung\nHannover\n\nDie Liste der Mitglieder des Verbundsausschusses wurde beim Registergericht eingereicht."
    },
    {
      "date": "2025-02-05",
      "id": "100545",
      "original_text": "Löschungsankündigung\nNiedersachsen Amtsgericht Osnabrück HRB 207019\nde Groot GmbH – Bad Bentheim",
      "type": "Löschungsankündigung",
      "state": "Niedersachsen",
      "amtsgericht": "Amtsgericht Osnabrück",
      "registernummer": "HRB 207019",
      "registerart": "HRB",
      "company_name": "de Groot GmbH",
      "company_seat": "Bad Bentheim",
      "details": "05.02.2025 (Bekanntmachungsdatum)\n\nNiedersachsen Amtsgericht Osnabrück HRB 207019\nLöschungsankündigung\n\nde Groot GmbH\nGesellschaft mit beschränkter Haftung\nBad Bentheim\n\nDas Registergericht beabsichtigt, die Gesellschaft von Amts wegen nach § 394 FamFG wegen Vermögenslosigkeit zu löschen. Die Frist zur Erhebung eines Widerspruchs ist auf 1 Monat ab dieser Registerbekanntmachung festgesetzt."
    },
    {
      "date": "2025-02-05",
      "id": "100546",
      "original_text": "Löschungsankündigung\nNiedersachsen Amtsgericht Osnabrück HRB 212783\nHaseTec GmbH – Osnabrück",
      "type": "Löschungsankündigung",
      "state": "Niedersachsen",
      "amtsgericht": "Amtsgericht Osnabrück",
      "registernummer": "HRB 212783",
      "registerart": "HRB",
      "company_name": "HaseTec GmbH",
      "company_seat": "Osnabrück",
      "details": "05.02.2025 (Bekanntmachungsdatum)\n\nNiedersachsen Amtsgericht Osnabrück HRB 212783\nLöschungsankündigung\n\nHaseTec GmbH\nGesellschaft mit beschränkter Haftung\nOsnabrück\n\nDas Registergericht beabsichtigt, die Gesellschaft von Amts wegen nach § 394 FamFG wegen Vermögenslosigkeit zu löschen. Die Frist zur Erhebung eines Widerspruchs ist auf 1 Monat ab dieser Registerbekanntmachung festgesetzt."
    },
    {
      "date": "2025-02-05",
      "id": "100547",
      "original_text": "Löschungsankündigung\nBremen Amtsgericht Bremen HRB 36724\nMD Commerce UG (haftungsbeschränkt) – Bremen",
      "type": "Löschungsankündigung",
      "state": "Bremen",
      "amtsgericht": "Amtsgericht Bremen",
      "registernummer": "HRB 36724",
      "registerart": "HRB",
      "company_name": "MD Commerce UG (haftungsbeschränkt)",
      "company_seat": "Bremen",
      "details": "05.02.2025 (Bekanntmachungsdatum)\n\nBremen Amtsgericht Bremen HRB 36724\nLöschungsankündigung\n\nMD Commerce UG (haftungsbeschränkt)\nGesellschaft mit beschränkter Haftung\nBremen\n\nEs ist beabsichtigt die im Handelsregister eingetragene Gesellschaft von Amts wegen gemäß § 394 FamFG zu löschen. Gegen die Löschung kann beim AG Bremen schriftlich oder zu Protokoll der Geschäftsstelle Widerspruch eingelegt werden. Widerspruchsfrist 4 Wochen."
    },
    {
      "date": "2025-02-05",
      "id": "100548",
      "original_text": "Löschungsankündigung\nBremen Amtsgericht Bremen HRB 37162\nBau und Reinigungsservice Gröningen UG (haftungsbeschränkt) – Bremen",
      "type": "Löschungsankündigung",
      "state": "Bremen",
      "amtsgericht": "Amtsgericht Bremen",
      "registernummer": "HRB 37162",
      "registerart": "HRB",
      "company_name": "Bau und Reinigungsservice Gröningen UG (haftungsbeschränkt)",
      "company_seat": "Bremen",
      "details": "05.02.2025 (Bekanntmachungsdatum)\n\nBremen Amtsgericht Bremen HRB 37162\nLöschungsankündigung\n\nBau und Reinigungsservice Gröningen UG (haftungsbeschränkt)\nGesellschaft mit beschränkter Haftung\nBremen\n\nEs ist beabsichtigt die im Handelsregister eingetragene Gesellschaft von Amts wegen gemäß § 394 FamFG zu löschen. Gegen die Löschung kann beim AG Bremen schriftlich oder zu Protokoll der Geschäftsstelle Widerspruch eingelegt werden. Widerspruchsfrist 4 Wochen."
    },
    {
      "date": "2025-02-05",
      "id": "100549",
      "original_text": "Löschungsankündigung\nRheinland-Pfalz Amtsgericht Montabaur HRB 5415\nKA-WI-TECH Kabel- und Wickeltechnik GmbH – Hamm",
      "type": "Löschungsankündigung",
      "state": "Rheinland-Pfalz",
      "amtsgericht": "Amtsgericht Montabaur",
      "registernummer": "HRB 5415",
      "registerart": "HRB",
      "company_name": "KA-WI-TECH Kabel- und Wickeltechnik GmbH",
      "company_seat": "Hamm",
      "details": "05.02.2025 (Bekanntmachungsdatum)\n\nRheinland-Pfalz Amtsgericht Montabaur HRB 5415\nLöschungsankündigung 13.01.2025 (Eintragungsdatum)\n\nKA-WI-TECH Kabel- und Wickeltechnik GmbH\nGesellschaft mit beschränkter Haftung\nHamm\n\nDas Registergericht beabsichtigt die Gesellschaft von Amts wegen nach § 394 FamFG zu löschen. Die Frist zur Erhebung eines Widerspruchs ist auf einen Monat festgesetzt."
    },
    {
      "date": "2025-02-05",
      "id": "100550",
      "original_text": "Registerbekanntmachung nach dem Umwandlungsgesetz\nRheinland-Pfalz Amtsgericht Koblenz HRB 29614\nEnergy Ventures Holding GmbH – Schwall",
      "type": "Registerbekanntmachung nach dem Umwandlungsgesetz",
      "state": "Rheinland-Pfalz",
      "amtsgericht": "Amtsgericht Koblenz",
      "registernummer": "HRB 29614",
      "registerart": "HRB",
      "company_name": "Energy Ventures Holding GmbH",
      "company_seat": "Schwall",
      "details": "05.02.2025 (Bekanntmachungsdatum)\n\nRheinland-Pfalz Amtsgericht Koblenz HRB 29614\nRegisterbekanntmachung nach dem Umwandlungsgesetz 05.02.2025 (Eintragungsdatum)\n\nEnergy Ventures Holding GmbH\nGesellschaft mit beschränkter Haftung\nSchwall\n\nGläubigern der an der Verschmelzung beteiligten Rechtsträger ist unter den Voraussetzungen des § 22 UmwG Sicherheit zu leisten."
    },
    {
      "date": "2025-02-05",
      "id": "100551",
      "original_text": "Löschungsankündigung\nRheinland-Pfalz Amtsgericht Mainz HRB 44724\nPro`n Sales GmbH – Mainz",
      "type": "Löschungsankündigung",
      "state": "Rheinland-Pfalz",
      "amtsgericht": "Amtsgericht Mainz",
      "registernummer": "HRB 44724",
      "registerart": "HRB",
      "company_name": "Pro`n Sales GmbH",
      "company_seat": "Mainz",
      "details": "05.02.2025 (Bekanntmachungsdatum)\n\nRheinland-Pfalz Amtsgericht Mainz HRB 44724\nLöschungsankündigung\n\nPro`n Sales GmbH\nGesellschaft mit beschränkter Haftung\nMainz\n\nDas Registergericht beabsichtigt die Gesellschaft von Amts wegen nach § 394 FamFG zu löschen. Die Frist zur Erhebung eines Widerspruchs ist auf einen Monat festgesetzt."
    },
    {
      "date": "2025-02-05",
      "id": "100552",
      "original_text": "Löschungsankündigung\nRheinland-Pfalz Amtsgericht Montabaur HRB 27432\nLuT-Euskirchen GmbH – Neuwied",
      "type": "Löschungsankündigung",
      "state": "Rheinland-Pfalz",
      "amtsgericht": "Amtsgericht Montabaur",
      "registernummer": "HRB 27432",
      "registerart": "HRB",
      "company_name": "LuT-Euskirchen GmbH",
      "company_seat": "Neuwied",
      "details": "05.02.2025 (Bekanntmachungsdatum)\n\nRheinland-Pfalz Amtsgericht Montabaur HRB 27432\nLöschungsankündigung 16.11.2022 (Eintragungsdatum)\n\nLuT-Euskirchen GmbH\nGesellschaft mit beschränkter Haftung\nNeuwied\n\nDas Registergericht beabsichtigt die Gesellschaft von Amts wegen nach § 394 FamFG zu löschen. Die Frist zur Erhebung eines Widerspruchs ist auf einen Monat festgesetzt."
    },
    {
      "date": "2025-02-05",
      "id": "100553",
      "original_text": "Sonstige Registerbekanntmachung\nRheinland-Pfalz Amtsgericht Ludwigshafen a.Rhein (Ludwigshafen) HRB 67893\nI.D Abbruch GmbH – Ludwigshafen am Rhein",
      "type": "Sonstige Registerbekanntmachung",
      "state": "Rheinland-Pfalz",
      "amtsgericht": "Amtsgericht Ludwigshafen a.Rhein (Ludwigshafen)",
      "registernummer": "HRB 67893",
      "registerart": "HRB",
      "company_name": "I.D Abbruch GmbH",
      "company_seat": "Ludwigshafen am Rhein",
      "details": "05.02.2025 (Bekanntmachungsdatum)\n\nRheinland-Pfalz Amtsgericht Ludwigshafen a.Rhein (Ludwigshafen) HRB 67893\nSonstige Registerbekanntmachung\n\nI.D Abbruch GmbH\nGesellschaft mit beschränkter Haftung\nLudwigshafen am Rhein\n\nDas am 30.01.2025 eingeleitete Ámtslöschungsverfahren nach § 394 FamFG über die Firma ist infolge Insolvenzeröffnung über die Firma beendet."
    },
    {
      "date": "2025-02-05",
      "id": "100554",
      "original_text": "Sonstige Registerbekanntmachung\nNordrhein-Westfalen Amtsgericht Düsseldorf HRB 96331\nAleva Germany GmbH – Düsseldorf",
      "type": "Sonstige Registerbekanntmachung",
      "state": "Nordrhein-Westfalen",
      "amtsgericht": "Amtsgericht Düsseldorf",
      "registernummer": "HRB 96331",
      "registerart": "HRB",
      "company_name": "Aleva Germany GmbH",
      "company_seat": "Düsseldorf",
      "details": "05.02.2025 (Bekanntmachungsdatum)\n\nNordrhein-Westfalen Amtsgericht Düsseldorf HRB 96331\nSonstige Registerbekanntmachung 05.02.2025 (Eintragungsdatum)\n\nAleva Germany GmbH\nGesellschaft mit beschränkter Haftung\nDüsseldorf\n\nDie Gesellschaft ist aufgelöst. Von Amts wegen eingetragen."
    },
    {
      "date": "2025-02-05",
      "id": "100555",
      "original_text": "Löschungsankündigung\nNordrhein-Westfalen Amtsgericht Düsseldorf HRB 74277\nKrause Service GmbH – Düsseldorf",
      "type": "Löschungsankündigung",
      "state": "Nordrhein-Westfalen",
      "amtsgericht": "Amtsgericht Düsseldorf",
      "registernummer": "HRB 74277",
      "registerart": "HRB",
      "company_name": "Krause Service GmbH",
      "company_seat": "Düsseldorf",
      "details": "05.02.2025 (Bekanntmachungsdatum)\n\nNordrhein-Westfalen Amtsgericht Düsseldorf HRB 74277\nLöschungsankündigung\n\nKrause Service GmbH\nGesellschaft mit beschränkter Haftung\nDüsseldorf\n\nDas Registergericht beabsichtigt die Gesellschaft von Amts wegen nach § 394 FamFG zu löschen. Die Frist zur Erhebung eines Widerspruchs ist auf 3 Wochen festgesetzt.\n\nRechtsbehelfsbelehrung:\nDas Widerspruchsrecht steht jedem zu, der an der Unterlassung der Löschung ein berechtigtes Interesse hat. Der Widerspruch ist bei dem Amtsgericht Düsseldorf -Registergericht-, Werdener Straße 1, 40227 Düsseldorf schriftlich in deutscher Sprache oder zur Niederschrift der Geschäftsstelle einzulegen. Der Widerspruch kann auch zur Niederschrift der Geschäftsstelle eines jeden Amtsgerichtes abgegeben werden. Die Einlegung ist auch durch Übertragung eines elektronischen Dokuments an die elektronische Poststelle des Gerichts möglich. Das elektronische Dokument muss für die Bearbeitung durch das Gericht geeignet und mit einer qualifizierten elektronischen Signatur der verantwortenden Person versehen sein oder von der verantwortenden Person signiert und auf einem sicheren Übermittlungsweg gemäß § 130a ZPO nach näherer Maßgabe der Verordnung über die technischen Rahmenbedingungen des elektronischen Rechtsverkehrs und über das besondere elektronische Behördenpostfach (BGBl. I, S.3803) eingereicht werden. Weitere Informationen erhalten Sie auf der Internetseite www.justiz.de.\nDer Widerspruch muss spätestens innerhalb der gesetzten Frist nach dem Datum der Bekanntmachung der Löschungsankündigung bei dem Amtsgericht - Registergericht - Düsseldorf eingegangen sein.  Dies gilt auch dann, wenn der Widerspruch zur Niederschrift der Geschäftsstelle eines anderen Amtsgerichtes abgegeben wurde. Die Frist beginnt mit dem Tage der Bekanntmachung der Löschungsankündigung in dem für die Bekanntmachung der Eintragungen in das Handelsregister bestimmten elektronischen Informations- und Kommunikationssystem nach § 10 des Handelsgesetzbuches. Fällt das Ende der Frist auf einen Sonntag, einen allgemeinen Feiertag oder Sonnabend, so endet die Frist mit Ablauf des nächsten Werktages.\nDer Widerspruch muss die Bezeichnung der angefochtenen Löschungsankündigung sowie die Erklärung enthalten, dass Widerspruch gegen diese Löschungsankündigung eingelegt wird. Er ist zu unterzeichnen und soll begründet werden."
    },
    {
      "date": "2025-02-05",
      "id": "100556",
      "original_text": "Löschungsankündigung\nNordrhein-Westfalen Amtsgericht Siegburg HRB 11387\nFlugschule KölnBonn GmbH – Sankt Augustin",
      "type": "Löschungsankündigung",
      "state": "Nordrhein-Westfalen",
      "amtsgericht": "Amtsgericht Siegburg",
      "registernummer": "HRB 11387",
      "registerart": "HRB",
      "company_name": "Flugschule KölnBonn GmbH",
      "company_seat": "Sankt Augustin",
      "details": "05.02.2025 (Bekanntmachungsdatum)\n\nNordrhein-Westfalen Amtsgericht Siegburg HRB 11387\nLöschungsankündigung\n\nFlugschule KölnBonn GmbH\nGesellschaft mit beschränkter Haftung\nSankt Augustin\n\nDas Registergericht hat glaubhafte Kenntnis erlangt, dass die Gesellschaft vermögenslos geworden ist.\n\nEs ist daher beabsichtigt, die Gesellschaft nach § 394 FamFG im Handelsregister wegen Vermögenslosigkeit zu löschen.\n\nEinwände gegen die Löschung sind durch Widerspruch binnen einer Frist von 3 Monaten geltend zu machen, andernfalls die Löschung erfolgen wird.\n\nEinzulegen ist der Widerspruch bei dem Amtsgericht Siegburg, Neue Poststraße 16, 53721 Siegburg, und zwar entweder schriftlich in deutscher Sprache oder mündlich zur Niederschrift der Geschäftsstelle. Der Widerspruch kann auch zur Niederschrift der Geschäftsstelle eines jeden Amtsgerichts abgegeben werden. Der Widerspruch ist binnen der in der Verfügung bestimmten Frist einzulegen. Die Frist ist nur gewahrt, wenn der Widerspruch rechtzeitig bei dem Amtsgericht Siegburg eingeht, auch wenn der Widerspruch zur Niederschrift der Geschäftsstelle eines anderen Amtsgerichts abgegeben wurde. Die Frist beginnt jeweils mit der schriftlichen Bekanntgabe der Verfügung an die Beteiligten. Kann die schriftliche Bekanntgabe an einen Beteiligten nicht bewirkt werden, beginnt die Frist spätestens mit Ablauf von fünf Monaten nach Erlass der Verfügung. Die Bekanntgabe ist entweder durch Zustellung oder am dritten Tage nach Aufgabe zur Post bewirkt. Sofern die Löschung noch nicht erfolgt ist, kann der Widerspruch auch noch nach Ablauf der Frist eingelegt werden. Fällt das Ende der Frist auf einen Sonnabend, einen Sonntag oder einen allgemeinen Feiertag, endet die Frist mit Ablauf des nächsten Werktages. Der Widerspruch ist zu unterzeichnen. Eine Begründung des Widerspruchs ist nicht vorgeschrieben."
    },
    {
      "date": "2025-02-05",
      "id": "100557",
      "original_text": "Registerbekanntmachung nach dem Umwandlungsgesetz\nNordrhein-Westfalen Amtsgericht Düsseldorf HRB 81826\nILTS- FORWARDING- Trans & Trade GmbH – Monheim am Rhein",
      "type": "Registerbekanntmachung nach dem Umwandlungsgesetz",
      "state": "Nordrhein-Westfalen",
      "amtsgericht": "Amtsgericht Düsseldorf",
      "registernummer": "HRB 81826",
      "registerart": "HRB",
      "company_name": "ILTS- FORWARDING- Trans & Trade GmbH",
      "company_seat": "Monheim am Rhein",
      "details": "05.02.2025 (Bekanntmachungsdatum)\n\nNordrhein-Westfalen Amtsgericht Düsseldorf HRB 81826\nRegisterbekanntmachung nach dem Umwandlungsgesetz\n\nILTS- FORWARDING- Trans & Trade GmbH\nGesellschaft mit beschränkter Haftung\nMonheim am Rhein\n\nDer Formwechselplan der ILTS- FORWARDING- Trans & Trade GmbH, Monheim am Rhein ist beim Registergericht eingereicht worden. Es ist der grenzüberschreitende Formwechsel der ILTS- FORWARDING- Trans & Trade GmbH, Monheim am Rhein, eingetragen beim Amtsgericht Düsseldorf HRB 81826 beabsichtigt. Weitere Rechtsträger sind nicht beteiligt. Beabsichtigt ist ein Formwechsel in eine Gesellschaft mit beschränkter Haftung nach den Bestimmungen des Liechtensteinischen Personen- und Gesellschaftsrechts (Art. 389 - Art. 427). Die Firma wird geändert in \"ILTS GmbH\" und der Sitz nach Vaduz, Liechtenstein verlegt. Bemerkungen der Anteilsinhaber und der Gläubiger der Gesellschaft können der Gesellschaft innerhalb eines Monats ab der Bekanntmachung übermittelt werden. Hinweise an Arbeitnehmer oder Betriebsräte sind nicht erforderlich, da keine Arbeitsverhältnisse und auch kein Betriebsrat bestehen"
    },
    {
      "date": "2025-02-05",
      "id": "100558",
      "original_text": "Sonstige Registerbekanntmachung\nNordrhein-Westfalen Amtsgericht Bonn HRB 21164\nDeutsche Post Transport GmbH – Bonn",
      "type": "Sonstige Registerbekanntmachung",
      "state": "Nordrhein-Westfalen",
      "amtsgericht": "Amtsgericht Bonn",
      "registernummer": "HRB 21164",
      "registerart": "HRB",
      "company_name": "Deutsche Post Transport GmbH",
      "company_seat": "Bonn",
      "details": "05.02.2025 (Bekanntmachungsdatum)\n\nNordrhein-Westfalen Amtsgericht Bonn HRB 21164\nSonstige Registerbekanntmachung 05.02.2025 (Eintragungsdatum)\n\nDeutsche Post Transport GmbH\nGesellschaft mit beschränkter Haftung\nBonn\n\nAls nicht eingetragen wird veröffentlicht: Den Gläubigern der Gesellschaft, deren Forderungen begründet worden sind bevor die Eintragung der Beendigung des Beherrschungs- und Ergebnisabführungsvertrages  in das Handelsregister nach § 10 des Handelsgesetzbuches als bekanntgemacht gilt, hat der andere Vertragsteil Sicherheit zu leisten, wenn sie sich binnen sechs Monaten nach der Bekanntmachung der Eintragung zu diesem Zweck bei ihm melden."
    },
    {
      "date": "2025-02-05",
      "id": "100559",
      "original_text": "Löschungsankündigung\nNordrhein-Westfalen Amtsgericht Duisburg HRB 33144\nExcellent Trade GmbH – Duisburg",
      "type": "Löschungsankündigung",
      "state": "Nordrhein-Westfalen",
      "amtsgericht": "Amtsgericht Duisburg",
      "registernummer": "HRB 33144",
      "registerart": "HRB",
      "company_name": "Excellent Trade GmbH",
      "company_seat": "Duisburg",
      "details": "05.02.2025 (Bekanntmachungsdatum)\n\nNordrhein-Westfalen Amtsgericht Duisburg HRB 33144\nLöschungsankündigung\n\nExcellent Trade GmbH\nGesellschaft mit beschränkter Haftung\nDuisburg\n\nDas Registergericht beabsichtigt, die im Handelsregister eingetragene Gesellschaft Excellent Trade GmbH gemäß § 394 Absatz 1 FamFG wegen Vermögenslosigkeit von Amts wegen zu löschen. Gegen diese Verfügung kann Widerspruch eingelegt werden. Die Frist zur Erhebung eines Widerspruchs gegen die beabsichtigte Löschung von Amts wegen ist auf drei Monate festgesetzt. Rechtsbehelfsbelehrung Der Widerspruch ist bei dem Amtsgericht Duisburg, Kardinal-Galen-Str. 124-132, 47058 Duisburg schriftlich in deutscher Sprache oder zur Niederschrift der Geschäftsstelle einzulegen. Der Widerspruch kann auch zur Niederschrift der Geschäftsstelle eines jeden Amtsgerichtes abgegeben werden. Die Einlegung ist auch durch Übertragung eines elektronischen Dokuments an die elektronische Poststelle des Gerichts möglich. Das elektronische Dokument muss für die Bearbeitung durch das Gericht geeignet und mit einer qualifizierten elektronischen Signatur der verantwortenden Person versehen sein oder von der verantwortenden Person signiert und auf einem sicheren Übermittlungsweg gemäß § 130 a ZPO nach näherer Maßgabe der Verordnung über die technischen Rahmenbedingungen des elektronischen Rechtsverkehrs und über das besondere elektronische Behördenpostfach (BGBl. I, S. 3803) eingereicht werden. Weitere Informationen erhalten Sie auf der Internetseite www.justiz.de <http://www.justiz.de>. Der Widerspruch muss spätestens innerhalb der gesetzten Frist bei dem Amtsgericht Duisburg eingegangen sein. Dies gilt auch dann, wenn der Widerspruch zur Niederschrift der Geschäftsstelle eines anderen Amtsgerichtes abgegeben wurde. Die Frist beginnt mit der Veröffentlichung. Fällt das Ende der Frist auf einen Sonntag, einen allgemeinen Feiertag oder Sonnabend, so endet die Frist mit Ablauf des nächsten Werktages. Der Widerspruch muss die Bezeichnung der angefochtenen Verfügung sowie die Erklärung enthalten, dass Widerspruch gegen diese Verfügung eingelegt wird. Er ist zu unterzeichnen und soll begründet werden."
    },
    {
      "date": "2025-02-05",
      "id": "100560",
      "original_text": "Einreichung neuer Dokumente\nNordrhein-Westfalen Amtsgericht Bochum HRB 8613 früher Amtsgericht Witten\nVWW Verbund-Wasserwerk Witten Gesellschaft mit beschränkter Haftung – Witten",
      "type": "Einreichung neuer Dokumente",
      "state": "Nordrhein-Westfalen",
      "amtsgericht": "Amtsgericht Bochum",
      "registernummer": "HRB 8613",
      "registerart": "HRB",
      "company_name": "VWW Verbund-Wasserwerk Witten Gesellschaft mit beschränkter Haftung",
      "company_seat": "Witten",
      "former_amtsgericht": "Witten",
      "details": "05.02.2025 (Bekanntmachungsdatum)\n\nNordrhein-Westfalen Amtsgericht Bochum HRB 8613 früher Amtsgericht Witten\nEinreichung neuer Dokumente 05.02.2025 (Eintragungsdatum)\n\nVWW Verbund-Wasserwerk Witten Gesellschaft mit beschränkter Haftung\nGesellschaft mit beschränkter Haftung\nWitten\n\nDem Registergericht ist eine neue Liste der Mitglieder des Aufsichtsrates eingereicht worden."
    },
    {
      "date": "2025-02-05",
      "id": "100561",
      "original_text": "Einreichung neuer Dokumente\nNordrhein-Westfalen Amtsgericht Hamm HRB 5646\nNetzwerk Suchthilfe gemeinnützige GmbH - Arbeitskreis für Jugendhilfe - – Hamm",
      "type": "Einreichung neuer Dokumente",
      "state": "Nordrhein-Westfalen",
      "amtsgericht": "Amtsgericht Hamm",
      "registernummer": "HRB 5646",
      "registerart": "HRB",
      "company_name": "Netzwerk Suchthilfe gemeinnützige GmbH - Arbeitskreis für Jugendhilfe -",
      "company_seat": "Hamm",
      "details": "05.02.2025 (Bekanntmachungsdatum)\n\nNordrhein-Westfalen Amtsgericht Hamm HRB 5646\nEinreichung neuer Dokumente\n\nNetzwerk Suchthilfe gemeinnützige GmbH - Arbeitskreis für Jugendhilfe -\nGesellschaft mit beschränkter Haftung\nHamm\n\nDem Registergericht ist eine neue Liste der Mitglieder des Aufsichtsrates eingereicht worden."
    },
    {
      "date": "2025-02-05",
      "id": "100562",
      "original_text": "Löschungsankündigung\nNordrhein-Westfalen Amtsgericht Duisburg HRB 37743\nDataSolutions UG (haftungsbeschränkt) – Duisburg",
      "type": "Löschungsankündigung",
      "state": "Nordrhein-Westfalen",
      "amtsgericht": "Amtsgericht Duisburg",
      "registernummer": "HRB 37743",
      "registerart": "HRB",
      "company_name": "DataSolutions UG (haftungsbeschränkt)",
      "company_seat": "Duisburg",
      "details": "05.02.2025 (Bekanntmachungsdatum)\n\nNordrhein-Westfalen Amtsgericht Duisburg HRB 37743\nLöschungsankündigung\n\nDataSolutions UG (haftungsbeschränkt)\nGesellschaft mit beschränkter Haftung\nDuisburg\n\nDas Registergericht beabsichtigt, die im Handelsregister unter HRB 37743 eingetragene Gesellschaft DataSolutions UG (haftungsbeschränkt) gemäß § 394 FamFG wegen Vermögenslosigkeit von Amts wegen zu löschen. Gegen diese Verfügung kann Widerspruch eingelegt werden. Die Frist zur Erhebung eines Widerspruchs gegen die beabsichtigte Löschung von Amts wegen ist auf drei Monate festgesetzt. Rechtsbehelfsbelehrung Der Widerspruch ist bei dem Amtsgericht Duisburg, Kardinal-Galen-Str. 124-132, 47058 Duisburg schriftlich in deutscher Sprache oder zur Niederschrift der Geschäftsstelle einzulegen. Der Widerspruch kann auch zur Niederschrift der Geschäftsstelle eines jeden Amtsgerichtes abgegeben werden. Die Einlegung ist auch durch Übertragung eines elektronischen Dokuments an die elektronische Poststelle des Gerichts möglich. Das elektronische Dokument muss für die Bearbeitung durch das Gericht geeignet und mit einer qualifizierten elektronischen Signatur der verantwortenden Person versehen sein oder von der verantwortenden Person signiert und auf einem sicheren Übermittlungsweg gemäß § 130 a ZPO nach näherer Maßgabe der Verordnung über die technischen Rahmenbedingungen des elektronischen Rechtsverkehrs und über das besondere elektronische Behördenpostfach (BGBl. I, S. 3803) eingereicht werden. Weitere Informationen erhalten Sie auf der Internetseite www.justiz.de <http://www.justiz.de>. Der Widerspruch muss spätestens innerhalb der gesetzten Frist bei dem Amtsgericht Duisburg eingegangen sein. Dies gilt auch dann, wenn der Widerspruch zur Niederschrift der Geschäftsstelle eines anderen Amtsgerichtes abgegeben wurde. Die Frist beginnt mit der Veröffentlichung. Fällt das Ende der Frist auf einen Sonntag, einen allgemeinen Feiertag oder Sonnabend, so endet die Frist mit Ablauf des nächsten Werktages. Der Widerspruch muss die Bezeichnung der angefochtenen Verfügung sowie die Erklärung enthalten, dass Widerspruch gegen diese Verfügung eingelegt wird. Er ist zu unterzeichnen und soll begründet werden."
    },
    {
      "date": "2025-02-05",
      "id": "100563",
      "original_text": "Löschungsankündigung\nNordrhein-Westfalen Amtsgericht Wuppertal HRB 30119\nIsaform Verwaltungs-UG (haftungsbeschränkt) – Wuppertal",
      "type": "Löschungsankündigung",
      "state": "Nordrhein-Westfalen",
      "amtsgericht": "Amtsgericht Wuppertal",
      "registernummer": "HRB 30119",
      "registerart": "HRB",
      "company_name": "Isaform Verwaltungs-UG (haftungsbeschränkt)",
      "company_seat": "Wuppertal",
      "details": "05.02.2025 (Bekanntmachungsdatum)\n\nNordrhein-Westfalen Amtsgericht Wuppertal HRB 30119\nLöschungsankündigung 04.02.2025 (Eintragungsdatum)\n\nIsaform Verwaltungs-UG (haftungsbeschränkt)\nGesellschaft mit beschränkter Haftung\nWuppertal\n\nDas Registergericht beabsichtigt  den Unternehmensgegenstand der Gesellschaft von Amts wegen nach § 394 II 2 FamFG zu löschen. Die Frist zur Erhebung eines Widerspruchs ist auf einen Monat festgesetzt."
    },
    {
      "date": "2025-02-05",
      "id": "100564",
      "original_text": "Löschungsankündigung\nNordrhein-Westfalen Amtsgericht Wuppertal HRB 15409\nProdomo Grund GmbH – Remscheid",
      "type": "Löschungsankündigung",
      "state": "Nordrhein-Westfalen",
      "amtsgericht": "Amtsgericht Wuppertal",
      "registernummer": "HRB 15409",
      "registerart": "HRB",
      "company_name": "Prodomo Grund GmbH",
      "company_seat": "Remscheid",
      "details": "05.02.2025 (Bekanntmachungsdatum)\n\nNordrhein-Westfalen Amtsgericht Wuppertal HRB 15409\nLöschungsankündigung 04.02.2025 (Eintragungsdatum)\n\nProdomo Grund GmbH\nGesellschaft mit beschränkter Haftung\nRemscheid\n\nDas Registergericht beabsichtigt die Gesellschaft von Amts wegen nach § 394 FamFG zu löschen. Die Frist zur Erhebung eines Widerspruchs ist auf einen Monat festgesetzt."
    },
    {
      "date": "2025-02-05",
      "id": "100565",
      "original_text": "Löschungsankündigung\nNordrhein-Westfalen Amtsgericht Aachen HRB 12276\nMagnaMedics GmbH – Aachen",
      "type": "Löschungsankündigung",
      "state": "Nordrhein-Westfalen",
      "amtsgericht": "Amtsgericht Aachen",
      "registernummer": "HRB 12276",
      "registerart": "HRB",
      "company_name": "MagnaMedics GmbH",
      "company_seat": "Aachen",
      "details": "05.02.2025 (Bekanntmachungsdatum)\n\nNordrhein-Westfalen Amtsgericht Aachen HRB 12276\nLöschungsankündigung\n\nMagnaMedics GmbH\nGesellschaft mit beschränkter Haftung\nAachen\n\nDas Registergericht beabsichtigt, von Amts wegen die Gesellschaft wegen Vermögenslosigkeit nach § 394 FamFG zu löschen weil das Insolvenzverfahren beendet und Vermögen der Gesellschaft nicht mehr erkennbar ist.\n\nZur Geltendmachung des Widerspruchs gegen die beabsichtigte Löschung wird hiermit eine Frist von einem Monat ab Veröffentlichung dieser Ankündigung bestimmt.\n\nRechtsbehelfsbelehrung:\n\nGegen diese Verfügung kann Widerspruch eingelegt werden. Zum Widerspruch ist jeder berechtigt, der an der Unterlassung der Löschung ein berechtigtes Interesse hat.\n\nDer Widerspruch ist bei dem Amtsgericht Aachen, Adalbertsteinweg 92, 52070 Aachen schriftlich in deutscher Sprache oder zur Niederschrift der Geschäftsstelle einzulegen. Der Widerspruch kann auch zur Niederschrift der Geschäftsstelle eines jeden Amtsgerichtes abgegeben werden.\n\nDer Widerspruch muss spätestens innerhalb der gesetzten Frist nach der Bekanntgabe der Verfügung bei dem Amtsgericht Aachen eingegangen sein. Dies gilt auch dann, wenn der Widerspruch zur Niederschrift der Geschäftsstelle eines anderen Amtsgerichtes abgegeben wurde. Die Frist beginnt mit der Bekanntgabe der Verfügung durch Veröffentlichung. Fällt das Ende der Frist auf einen Sonntag, einen allgemeinen Feiertag oder Sonnabend, so endet die Frist mit Ablauf des nächsten Werktages.\n\nDer Widerspruch muss die Bezeichnung der angefochtenen Verfügung sowie die Erklärung enthalten, dass Widerspruch gegen diese Verfügung eingelegt wird. Er ist zu unterzeichnen und soll begründet werden.\n\nDie Einlegung ist auch durch Übertragung eines elektronischen Dokuments an die elektronische Poststelle des Gerichts möglich. Das elektronische Dokument muss für die Bearbeitung durch das Gericht geeignet und mit einer qualifizierten elektronischen Signatur der verantwortenden Person versehen sein oder von der verantwortenden Person signiert und auf einem sicheren Übermittlungsweg gemäß § 130 a ZPO nach näherer Maßgabe der Verordnung über die technischen Rahmenbedingungen des elektronischen Rechtsverkehrs und über das besondere elektronische Behördenpostfach (BGBl. I, S. 3803) eingereicht werden. Weitere Informationen erhalten Sie auf der Internetseite www.justiz.de."
    },
    {
      "date": "2025-02-05",
      "id": "100566",
      "original_text": "Löschungsankündigung\nNordrhein-Westfalen Amtsgericht Düsseldorf HRB 94746\nSecond Life UG (haftungsbeschränkt) – Düsseldorf",
      "type": "Löschungsankündigung",
      "state": "Nordrhein-Westfalen",
      "amtsgericht": "Amtsgericht Düsseldorf",
      "registernummer": "HRB 94746",
      "registerart": "HRB",
      "company_name": "Second Life UG (haftungsbeschränkt)",
      "company_seat": "Düsseldorf",
      "details": "05.02.2025 (Bekanntmachungsdatum)\n\nNordrhein-Westfalen Amtsgericht Düsseldorf HRB 94746\nLöschungsankündigung\n\nSecond Life UG (haftungsbeschränkt)\nGesellschaft mit beschränkter Haftung\nDüsseldorf\n\nDas Registergericht beabsichtigt die Gesellschaft von Amts wegen nach § 394 FamFG zu löschen. Die Frist zur Erhebung eines Widerspruchs ist auf einen Monat festgesetzt.\n\nRechtsbehelfsbelehrung:\nDas Widerspruchsrecht steht jedem zu, der an der Unterlassung der Löschung ein berechtigtes Interesse hat. Der Widerspruch ist bei dem Amtsgericht Düsseldorf -Registergericht-, Werdener Straße 1, 40227 Düsseldorf schriftlich in deutscher Sprache oder zur Niederschrift der Geschäftsstelle einzulegen. Der Widerspruch kann auch zur Niederschrift der Geschäftsstelle eines jeden Amtsgerichtes abgegeben werden. Die Einlegung ist auch durch Übertragung eines elektronischen Dokuments an die elektronische Poststelle des Gerichts möglich. Das elektronische Dokument muss für die Bearbeitung durch das Gericht geeignet und mit einer qualifizierten elektronischen Signatur der verantwortenden Person versehen sein oder von der verantwortenden Person signiert und auf einem sicheren Übermittlungsweg gemäß § 130a ZPO nach näherer Maßgabe der Verordnung über die technischen Rahmenbedingungen des elektronischen Rechtsverkehrs und über das besondere elektronische Behördenpostfach (BGBl. I, S.3803) eingereicht werden. Weitere Informationen erhalten Sie auf der Internetseite www.justiz.de.\nDer Widerspruch muss spätestens innerhalb der gesetzten Frist nach dem Datum der Bekanntmachung der Löschungsankündigung bei dem Amtsgericht - Registergericht - Düsseldorf eingegangen sein.  Dies gilt auch dann, wenn der Widerspruch zur Niederschrift der Geschäftsstelle eines anderen Amtsgerichtes abgegeben wurde. Die Frist beginnt mit dem Tage der Bekanntmachung der Löschungsankündigung in dem für die Bekanntmachung der Eintragungen in das Handelsregister bestimmten elektronischen Informations- und Kommunikationssystem nach § 10 des Handelsgesetzbuches. Fällt das Ende der Frist auf einen Sonntag, einen allgemeinen Feiertag oder Sonnabend, so endet die Frist mit Ablauf des nächsten Werktages.\nDer Widerspruch muss die Bezeichnung der angefochtenen Löschungsankündigung sowie die Erklärung enthalten, dass Widerspruch gegen diese Löschungsankündigung eingelegt wird. Er ist zu unterzeichnen und soll begründet werden."
    },
    {
      "date": "2025-02-05",
      "id": "100567",
      "original_text": "Registerbekanntmachung nach dem Umwandlungsgesetz\nNordrhein-Westfalen Amtsgericht Düsseldorf HRB 68865\nU.N.P.-Software GmbH – Düsseldorf",
      "type": "Registerbekanntmachung nach dem Umwandlungsgesetz",
      "state": "Nordrhein-Westfalen",
      "amtsgericht": "Amtsgericht Düsseldorf",
      "registernummer": "HRB 68865",
      "registerart": "HRB",
      "company_name": "U.N.P.-Software GmbH",
      "company_seat": "Düsseldorf",
      "details": "05.02.2025 (Bekanntmachungsdatum)\n\nNordrhein-Westfalen Amtsgericht Düsseldorf HRB 68865\nRegisterbekanntmachung nach dem Umwandlungsgesetz 05.02.2025 (Eintragungsdatum)\n\nU.N.P.-Software GmbH\nGesellschaft mit beschränkter Haftung\nDüsseldorf\n\nDen Gläubigern der an der Verschmelzung beteiligten Rechtsträger ist, wenn sie binnen sechs Monaten nach dem Tag, an dem die Eintragung der Verschmelzung in das Register des Sitzes desjenigen Rechtsträgers, dessen Gläubiger sie sind, nach § 19 Absatz 3 UmwG als bekanntgemacht gilt, ihren Anspruch nach Grund und Höhe schriftlich anmelden, Sicherheit zu leisten, soweit sie nicht Befriedigung verlangen können. Dieses Recht steht den Gläubigern jedoch nur zu, wenn sie glaubhaft machen, dass durch die Verschmelzung die Erfüllung ihrer Forderung gefährdet wird."
    },
    {
      "date": "2025-02-05",
      "id": "100568",
      "original_text": "Einreichung neuer Dokumente\nNordrhein-Westfalen Amtsgericht Dortmund HRB 25925\nAmazon Logistik Werne GmbH – Werne",
      "type": "Einreichung neuer Dokumente",
      "state": "Nordrhein-Westfalen",
      "amtsgericht": "Amtsgericht Dortmund",
      "registernummer": "HRB 25925",
      "registerart": "HRB",
      "company_name": "Amazon Logistik Werne GmbH",
      "company_seat": "Werne",
      "details": "05.02.2025 (Bekanntmachungsdatum)\n\nNordrhein-Westfalen Amtsgericht Dortmund HRB 25925\nEinreichung neuer Dokumente\n\nAmazon Logistik Werne GmbH\nGesellschaft mit beschränkter Haftung\nWerne\n\nDem Registergericht ist eine neue Liste der Mitglieder des Aufsichtsrates eingereicht worden."
    },
    {
      "date": "2025-02-05",
      "id": "100569",
      "original_text": "Registerbekanntmachung nach dem Umwandlungsgesetz\nNordrhein-Westfalen Amtsgericht Neuss HRB 17747\nvoestalpine eifeler Vacotec GmbH – Meerbusch",
      "type": "Registerbekanntmachung nach dem Umwandlungsgesetz",
      "state": "Nordrhein-Westfalen",
      "amtsgericht": "Amtsgericht Neuss",
      "registernummer": "HRB 17747",
      "registerart": "HRB",
      "company_name": "voestalpine eifeler Vacotec GmbH",
      "company_seat": "Meerbusch",
      "details": "05.02.2025 (Bekanntmachungsdatum)\n\nNordrhein-Westfalen Amtsgericht Neuss HRB 17747\nRegisterbekanntmachung nach dem Umwandlungsgesetz 05.02.2025 (Eintragungsdatum)\n\nvoestalpine eifeler Vacotec GmbH\nGesellschaft mit beschränkter Haftung\nMeerbusch\n\nDen Gläubigern der an der Verschmelzung beteiligten Rechtsträger ist, wenn sie binnen sechs Monaten nach dem Tag, an dem die Eintragung der Verschmelzung in das Register des Sitzes desjenigen Rechtsträgers, dessen Gläubiger sie sind, nach § 19 Absatz 3 UmwG als bekanntgemacht gilt, ihren Anspruch nach Grund und Höhe schriftlich anmelden, Sicherheit zu leisten, soweit sie nicht Befriedigung verlangen können. Dieses Recht steht den Gläubigern jedoch nur zu, wenn sie glaubhaft machen, dass durch die Verschmelzung die Erfüllung ihrer Forderung gefährdet wird."
    },
    {
      "date": "2025-02-05",
      "id": "100570",
      "original_text": "Löschungsankündigung\nNordrhein-Westfalen Amtsgericht Siegburg HRB 15410\nAdmin 2 UG ((haftungsbeschränkt) – Königswinter",
      "type": "Löschungsankündigung",
      "state": "Nordrhein-Westfalen",
      "amtsgericht": "Amtsgericht Siegburg",
      "registernummer": "HRB 15410",
      "registerart": "HRB",
      "company_name": "Admin 2 UG ((haftungsbeschränkt)",
      "company_seat": "Königswinter",
      "details": "05.02.2025 (Bekanntmachungsdatum)\n\nNordrhein-Westfalen Amtsgericht Siegburg HRB 15410\nLöschungsankündigung\n\nAdmin 2 UG ((haftungsbeschränkt)\nGesellschaft mit beschränkter Haftung\nKönigswinter\n\nDas Registergericht hat glaubhafte Kenntnis erlangt, dass die Gesellschaft vermögenslos geworden ist.\n\nEs ist daher beabsichtigt, die Gesellschaft nach § 394 FamFG im Handelsregister wegen Vermögenslosigkeit zu löschen.\n\nEinwände gegen die Löschung sind durch Widerspruch binnen einer Frist von 3 Monaten geltend zu machen, andernfalls die Löschung erfolgen wird.\n\nEinzulegen ist der Widerspruch bei dem Amtsgericht Siegburg, Neue Poststraße 16, 53721 Siegburg, und zwar entweder schriftlich in deutscher Sprache oder mündlich zur Niederschrift der Geschäftsstelle. Der Widerspruch kann auch zur Niederschrift der Geschäftsstelle eines jeden Amtsgerichts abgegeben werden. Der Widerspruch ist binnen der in der Verfügung bestimmten Frist einzulegen. Die Frist ist nur gewahrt, wenn der Widerspruch rechtzeitig bei dem Amtsgericht Siegburg eingeht, auch wenn der Widerspruch zur Niederschrift der Geschäftsstelle eines anderen Amtsgerichts abgegeben wurde. Die Frist beginnt jeweils mit der schriftlichen Bekanntgabe der Verfügung an die Beteiligten. Kann die schriftliche Bekanntgabe an einen Beteiligten nicht bewirkt werden, beginnt die Frist spätestens mit Ablauf von fünf Monaten nach Erlass der Verfügung. Die Bekanntgabe ist entweder durch Zustellung oder am dritten Tage nach Aufgabe zur Post bewirkt. Sofern die Löschung noch nicht erfolgt ist, kann der Widerspruch auch noch nach Ablauf der Frist eingelegt werden. Fällt das Ende der Frist auf einen Sonnabend, einen Sonntag oder einen allgemeinen Feiertag, endet die Frist mit Ablauf des nächsten Werktages. Der Widerspruch ist zu unterzeichnen. Eine Begründung des Widerspruchs ist nicht vorgeschrieben."
    },
    {
      "date": "2025-02-05",
      "id": "100571",
      "original_text": "Löschungsankündigung\nHessen Amtsgericht Bad Hersfeld HRB 3002\nBootshaus Bad Hersfeld Verwaltungs UG (haftungsbeschränkt) – Bad Hersfeld",
      "type": "Löschungsankündigung",
      "state": "Hessen",
      "amtsgericht": "Amtsgericht Bad Hersfeld",
      "registernummer": "HRB 3002",
      "registerart": "HRB",
      "company_name": "Bootshaus Bad Hersfeld Verwaltungs UG (haftungsbeschränkt)",
      "company_seat": "Bad Hersfeld",
      "details": "05.02.2025 (Bekanntmachungsdatum)\n\nHessen Amtsgericht Bad Hersfeld HRB 3002\nLöschungsankündigung\n\nBootshaus Bad Hersfeld Verwaltungs UG (haftungsbeschränkt)\nGesellschaft mit beschränkter Haftung\nBad Hersfeld\n\nDas Registergericht beabsichtigt die im Handelsregister eingetragene Gesellschaft von Amts wegen nach § 394 FamFG zu löschen. Die Frist zur Erhebung eines Widerspruchs gegen die beabsichtigte Löschung wird auf 6 Wochen festgesetzt."
    },
    {
      "date": "2025-02-05",
      "id": "100572",
      "original_text": "Einreichung neuer Dokumente\nHessen Amtsgericht Frankfurt am Main HRB 7442\nGemeinnütziges Siedlungswerk Gesellschaft mit beschränkter Haftung – Frankfurt am Main",
      "type": "Einreichung neuer Dokumente",
      "state": "Hessen",
      "amtsgericht": "Amtsgericht Frankfurt am Main",
      "registernummer": "HRB 7442",
      "registerart": "HRB",
      "company_name": "Gemeinnütziges Siedlungswerk Gesellschaft mit beschränkter Haftung",
      "company_seat": "Frankfurt am Main",
      "details": "05.02.2025 (Bekanntmachungsdatum)\n\nHessen Amtsgericht Frankfurt am Main HRB 7442\nEinreichung neuer Dokumente\n\nGemeinnütziges Siedlungswerk Gesellschaft mit beschränkter Haftung\nGesellschaft mit beschränkter Haftung\nFrankfurt am Main\n\nDurch eine Änderung in den Personen der Aufsichtsratsmitglieder ist eine Liste der Mitglieder des Aufsichtsrates zum Handelsregister eingereicht worden."
    },
    {
      "date": "2025-02-05",
      "id": "100573",
      "original_text": "Einreichung neuer Dokumente\nHessen Amtsgericht Frankfurt am Main HRB 101346\nVisualVest GmbH – Frankfurt am Main",
      "type": "Einreichung neuer Dokumente",
      "state": "Hessen",
      "amtsgericht": "Amtsgericht Frankfurt am Main",
      "registernummer": "HRB 101346",
      "registerart": "HRB",
      "company_name": "VisualVest GmbH",
      "company_seat": "Frankfurt am Main",
      "details": "05.02.2025 (Bekanntmachungsdatum)\n\nHessen Amtsgericht Frankfurt am Main HRB 101346\nEinreichung neuer Dokumente\n\nVisualVest GmbH\nGesellschaft mit beschränkter Haftung\nFrankfurt am Main\n\nDurch eine Änderung in den Personen der Aufsichtsratsmitglieder ist eine Liste der Mitglieder des Aufsichtsrates zum Handelsregister eingereicht worden."
    },
    {
      "date": "2025-02-05",
      "id": "100574",
      "original_text": "Sonstige Registerbekanntmachung\nHessen Amtsgericht Wetzlar VR 987\nEvangelische Frauenhilfe im Rheinland - Kreisverband Wetzlar/Braunfels e.V. – Wetzlar",
      "type": "Sonstige Registerbekanntmachung",
      "state": "Hessen",
      "amtsgericht": "Amtsgericht Wetzlar",
      "registernummer": "VR 987",
      "registerart": "VR",
      "company_name": "Evangelische Frauenhilfe im Rheinland - Kreisverband Wetzlar/Braunfels e.V.",
      "company_seat": "Wetzlar",
      "details": "05.02.2025 (Bekanntmachungsdatum)\n\nHessen Amtsgericht Wetzlar VR 987\nSonstige Registerbekanntmachung 05.02.2025 (Eintragungsdatum)\n\nEvangelische Frauenhilfe im Rheinland - Kreisverband Wetzlar/Braunfels e.V.\neingetragener Verein\nWetzlar\n\nDer Verein ist aufgelöst."
    },
    {
      "date": "2025-02-05",
      "id": "100575",
      "original_text": "Löschungsankündigung\nHessen Amtsgericht Limburg HRB 5772\nPersonaldirekt GmbH – Weilmünster",
      "type": "Löschungsankündigung",
      "state": "Hessen",
      "amtsgericht": "Amtsgericht Limburg",
      "registernummer": "HRB 5772",
      "registerart": "HRB",
      "company_name": "Personaldirekt GmbH",
      "company_seat": "Weilmünster",
      "details": "05.02.2025 (Bekanntmachungsdatum)\n\nHessen Amtsgericht Limburg HRB 5772\nLöschungsankündigung\n\nPersonaldirekt GmbH\nGesellschaft mit beschränkter Haftung\nWeilmünster\n\nDas Registergericht beabsichtigt die im Handelsregister eingetragene Gesellschaft von Amts wegen nach § 395 FamFG zu löschen. Die Frist zur Erhebung eines Widerspruchs gegen die beabsichtigte Löschung wird auf 3 Monate festgesetzt."
    },
    {
      "date": "2025-02-05",
      "id": "100576",
      "original_text": "Einreichung neuer Dokumente\nHessen Amtsgericht Darmstadt HRB 53602\nLear Corporation GmbH – Ginsheim-Gustavsburg",
      "type": "Einreichung neuer Dokumente",
      "state": "Hessen",
      "amtsgericht": "Amtsgericht Darmstadt",
      "registernummer": "HRB 53602",
      "registerart": "HRB",
      "company_name": "Lear Corporation GmbH",
      "company_seat": "Ginsheim-Gustavsburg",
      "details": "05.02.2025 (Bekanntmachungsdatum)\n\nHessen Amtsgericht Darmstadt HRB 53602\nEinreichung neuer Dokumente\n\nLear Corporation GmbH\nGesellschaft mit beschränkter Haftung\nGinsheim-Gustavsburg\n\nWegen Änderungen in den Personen der Aufsichtsratsmitglieder ist eine Liste der Mitglieder des Aufsichtsrates zum Handelsregister eingereicht worden."
    },
    {
      "date": "2025-02-05",
      "id": "100577",
      "original_text": "Löschungsankündigung\nHessen Amtsgericht Frankfurt am Main HRB 101790\nD.S. BAU - DEKORATION GmbH – Frankfurt am Main",
      "type": "Löschungsankündigung",
      "state": "Hessen",
      "amtsgericht": "Amtsgericht Frankfurt am Main",
      "registernummer": "HRB 101790",
      "registerart": "HRB",
      "company_name": "D.S. BAU - DEKORATION GmbH",
      "company_seat": "Frankfurt am Main",
      "details": "05.02.2025 (Bekanntmachungsdatum)\n\nHessen Amtsgericht Frankfurt am Main HRB 101790\nLöschungsankündigung\n\nD.S. BAU - DEKORATION GmbH\nGesellschaft mit beschränkter Haftung\nFrankfurt am Main\n\nDas Registergericht beabsichtigt die im Handelsregister eingetragene Gesellschaft von Amts wegen nach § 394 FamFG zu löschen. Die Frist zur Erhebung eines Widerspruchs gegen die beabsichtigte Löschung wird auf 1 Monat festgesetzt."
    },
    {
      "date": "2025-02-05",
      "id": "100578",
      "original_text": "Registerbekanntmachung nach dem Umwandlungsgesetz\nHessen Amtsgericht Wiesbaden HRB 17694\nWolfgang Okaty Schreinerei GmbH – Eltville am Rhein",
      "type": "Registerbekanntmachung nach dem Umwandlungsgesetz",
      "state": "Hessen",
      "amtsgericht": "Amtsgericht Wiesbaden",
      "registernummer": "HRB 17694",
      "registerart": "HRB",
      "company_name": "Wolfgang Okaty Schreinerei GmbH",
      "company_seat": "Eltville am Rhein",
      "details": "05.02.2025 (Bekanntmachungsdatum)\n\nHessen Amtsgericht Wiesbaden HRB 17694\nRegisterbekanntmachung nach dem Umwandlungsgesetz 05.02.2025 (Eintragungsdatum)\n\nWolfgang Okaty Schreinerei GmbH\nGesellschaft mit beschränkter Haftung\nEltville am Rhein\n\nDen Gläubigern der an der Verschmelzung beteiligten Rechtsträger ist, wenn sie binnen sechs Monaten nach dem Tag, an dem die Eintragung der Verschmelzung in das Register des Sitzes desjenigen Rechtsträgers, dessen Gläubiger sie sind, nach § 19 Absatz 3 UmwG bekannt gemacht worden ist, ihren Anspruch nach Grund und Höhe schriftlich anmelden, Sicherheit zu leisten, soweit sie nicht Befriedigung verlangen können. Dieses Recht steht den Gläubigern jedoch nur zu, wenn sie glaubhaft machen, dass durch die Verschmelzung die Erfüllung ihrer Forderung gefährdet wird."
    },
    {
      "date": "2025-02-05",
      "id": "100579",
      "original_text": "Löschungsankündigung\nHessen Amtsgericht Bad Hersfeld HRA 1883\nBootshaus Bad Hersfeld UG (haftungsbeschränkt) & Co. KG – Bad Hersfeld",
      "type": "Löschungsankündigung",
      "state": "Hessen",
      "amtsgericht": "Amtsgericht Bad Hersfeld",
      "registernummer": "HRA 1883",
      "registerart": "HRA",
      "company_name": "Bootshaus Bad Hersfeld UG (haftungsbeschränkt) & Co. KG",
      "company_seat": "Bad Hersfeld",
      "details": "05.02.2025 (Bekanntmachungsdatum)\n\nHessen Amtsgericht Bad Hersfeld HRA 1883\nLöschungsankündigung\n\nBootshaus Bad Hersfeld UG (haftungsbeschränkt) & Co. KG\nKommanditgesellschaft\nBad Hersfeld\n\nDas Registergericht beabsichtigt die im Handelsregister eingetragene Firma von Amts wegen nach § 394 FamFG zu löschen. Die Frist zur Erhebung eines Widerspruchs gegen die beabsichtigte Löschung wird auf 6 Wochen festgesetzt."
    },
    {
      "date": "2025-02-05",
      "id": "100580",
      "original_text": "Löschungsankündigung\nHessen Amtsgericht Darmstadt HRB 90875\neLiquidMixer GmbH – Fürth/Odw.",
      "type": "Löschungsankündigung",
      "state": "Hessen",
      "amtsgericht": "Amtsgericht Darmstadt",
      "registernummer": "HRB 90875",
      "registerart": "HRB",
      "company_name": "eLiquidMixer GmbH",
      "company_seat": "Fürth/Odw.",
      "details": "05.02.2025 (Bekanntmachungsdatum)\n\nHessen Amtsgericht Darmstadt HRB 90875\nLöschungsankündigung\n\neLiquidMixer GmbH\nGesellschaft mit beschränkter Haftung\nFürth/Odw.\n\nDas Registergericht beabsichtigt die im Handelsregister eingetragene Gesellschaft von Amts wegen nach § 394 FamFG zu löschen. Die Frist zur Erhebung eines Widerspruchs gegen die beabsichtigte Löschung wird auf 3 Monate festgesetzt."
    },
    {
      "date": "2025-02-05",
      "id": "100581",
      "original_text": "Löschungsankündigung\nHessen Amtsgericht Wiesbaden VR 7416\n\"Inbien\" für Integration, Bildung und Entwicklung e. V. – Wiesbaden",
      "type": "Löschungsankündigung",
      "state": "Hessen",
      "amtsgericht": "Amtsgericht Wiesbaden",
      "registernummer": "VR 7416",
      "registerart": "VR",
      "company_name": "\"Inbien\" für Integration, Bildung und Entwicklung e. V.",
      "company_seat": "Wiesbaden",
      "details": "05.02.2025 (Bekanntmachungsdatum)\n\nHessen Amtsgericht Wiesbaden VR 7416\nLöschungsankündigung 05.02.2025 (Eintragungsdatum)\n\n\"Inbien\" für Integration, Bildung und Entwicklung e. V.\neingetragener Verein\nWiesbaden\n\nDer Verein ist aufgelöst."
    },
    {
      "date": "2025-02-05",
      "id": "100582",
      "original_text": "Sonstige Registerbekanntmachung\nHessen Amtsgericht Fritzlar VR 3822\nHomberg (Efze) Events e.V. – Homberg (Efze)",
      "type": "Sonstige Registerbekanntmachung",
      "state": "Hessen",
      "amtsgericht": "Amtsgericht Fritzlar",
      "registernummer": "VR 3822",
      "registerart": "VR",
      "company_name": "Homberg (Efze) Events e.V.",
      "company_seat": "Homberg (Efze)",
      "details": "05.02.2025 (Bekanntmachungsdatum)\n\nHessen Amtsgericht Fritzlar VR 3822\nSonstige Registerbekanntmachung 05.02.2025 (Eintragungsdatum)\n\nHomberg (Efze) Events e.V.\neingetragener Verein\nHomberg (Efze)\n\nDer Verein ist aufgelöst."
    },
    {
      "date": "2025-02-05",
      "id": "100583",
      "original_text": "Sonstige Registerbekanntmachung\nHessen Amtsgericht Darmstadt HRB 33204\nHabasit GmbH – Eppertshausen",
      "type": "Sonstige Registerbekanntmachung",
      "state": "Hessen",
      "amtsgericht": "Amtsgericht Darmstadt",
      "registernummer": "HRB 33204",
      "registerart": "HRB",
      "company_name": "Habasit GmbH",
      "company_seat": "Eppertshausen",
      "details": "05.02.2025 (Bekanntmachungsdatum)\n\nHessen Amtsgericht Darmstadt HRB 33204\nSonstige Registerbekanntmachung\n\nHabasit GmbH\nGesellschaft mit beschränkter Haftung\nEppertshausen\n\nDurch eine Änderung in den Personen der Aufsichtsratsmitglieder ist eine Liste der Mitglieder des Aufsichtsrates zum Handelsregister eingereicht worden."
    },
    {
      "date": "2025-02-05",
      "id": "100584",
      "original_text": "Registerbekanntmachung nach dem Umwandlungsgesetz\nHessen Amtsgericht Frankfurt am Main HRB 51235\nbrainymotion AG – Eschborn",
      "type": "Registerbekanntmachung nach dem Umwandlungsgesetz",
      "state": "Hessen",
      "amtsgericht": "Amtsgericht Frankfurt am Main",
      "registernummer": "HRB 51235",
      "registerart": "HRB",
      "company_name": "brainymotion AG",
      "company_seat": "Eschborn",
      "details": "05.02.2025 (Bekanntmachungsdatum)\n\nHessen Amtsgericht Frankfurt am Main HRB 51235\nRegisterbekanntmachung nach dem Umwandlungsgesetz 04.02.2025 (Eintragungsdatum)\n\nbrainymotion AG\nAktiengesellschaft\nEschborn\n\nDen Gläubigern der an der formwechselnden Umwandlung beteiligten Rechtsträger ist, wenn sie binnen sechs Monaten nach dem Tag, an dem die Eintragung der formwechselnden Umwandlung in das Register des Sitzes desjenigen Rechtsträgers, dessen Gläubiger sie sind, nach § 201 UmwG bekannt gemacht worden ist, ihren Anspruch nach Grund und Höhe schriftlich anmelden, Sicherheit zu leisten, soweit sie nicht Befriedigung verlangen können. Dieses Recht steht den Gläubigern jedoch nur zu, wenn sie glaubhaft machen, dass durch die formwechselnden Umwandlung die Erfüllung ihrer Forderung gefährdet wird."
    },
    {
      "date": "2025-02-05",
      "id": "100585",
      "original_text": "Registerbekanntmachung nach dem Umwandlungsgesetz\nHessen Amtsgericht Wiesbaden HRB 25884\nOkaty-Hachenberger GmbH – Eltville",
      "type": "Registerbekanntmachung nach dem Umwandlungsgesetz",
      "state": "Hessen",
      "amtsgericht": "Amtsgericht Wiesbaden",
      "registernummer": "HRB 25884",
      "registerart": "HRB",
      "company_name": "Okaty-Hachenberger GmbH",
      "company_seat": "Eltville",
      "details": "05.02.2025 (Bekanntmachungsdatum)\n\nHessen Amtsgericht Wiesbaden HRB 25884\nRegisterbekanntmachung nach dem Umwandlungsgesetz 05.02.2025 (Eintragungsdatum)\n\nOkaty-Hachenberger GmbH\nGesellschaft mit beschränkter Haftung\nEltville\n\nDen Gläubigern der an der Verschmelzung beteiligten Rechtsträger ist, wenn sie binnen sechs Monaten nach dem Tag, an dem die Eintragung der Verschmelzung in das Register des Sitzes desjenigen Rechtsträgers, dessen Gläubiger sie sind, nach § 19 Absatz 3 UmwG bekannt gemacht worden ist, ihren Anspruch nach Grund und Höhe schriftlich anmelden, Sicherheit zu leisten, soweit sie nicht Befriedigung verlangen können. Dieses Recht steht den Gläubigern jedoch nur zu, wenn sie glaubhaft machen, dass durch die Verschmelzung die Erfüllung ihrer Forderung gefährdet wird."
    },
    {
      "date": "2025-02-05",
      "id": "100586",
      "original_text": "Sonstige Registerbekanntmachung\nHessen Amtsgericht Frankfurt am Main HRB 84285\nPEARL GOLD AG – Frankfurt am Main",
      "type": "Sonstige Registerbekanntmachung",
      "state": "Hessen",
      "amtsgericht": "Amtsgericht Frankfurt am Main",
      "registernummer": "HRB 84285",
      "registerart": "HRB",
      "company_name": "PEARL GOLD AG",
      "company_seat": "Frankfurt am Main",
      "details": "05.02.2025 (Bekanntmachungsdatum)\n\nHessen Amtsgericht Frankfurt am Main HRB 84285\nSonstige Registerbekanntmachung 05.02.2025 (Eintragungsdatum)\n\nPEARL GOLD AG\nAktiengesellschaft\nFrankfurt am Main\n\nDurch eine Änderung in den Personen der Aufsichtsratsmitglieder ist eine Liste der Mitglieder des Aufsichtsrates zum Handelsregister eingereicht worden."
    }
  ]
}