{
  "date": "2025-02-03",
  "date_of_scrape": "2025-02-04T04:05:53.132Z",
  "tool_version": "0.2.0",
  "number_of_announcements": 95,
  "announcements": [
    {
      "date": "2025-02-03",
      "id": "100260",
      "original_text": "Löschungsankündigung\nSaarland Amtsgericht Saarbrücken HRB 106544\nObst und Gemüse Dahl UG (haftungsbeschränkt) – Homburg",
      "type": "Löschungsankündigung",
      "state": "Saarland",
      "amtsgericht": "Amtsgericht Saarbrücken",
      "registernummer": "HRB 106544",
      "registerart": "HRB",
      "company_name": "Obst und Gemüse Dahl UG (haftungsbeschränkt)",
      "company_seat": "Homburg",
      "details": "03.02.2025 (Bekanntmachungsdatum)\n\nSaarland Amtsgericht Saarbrücken HRB 106544\nLöschungsankündigung\n\nObst und Gemüse Dahl UG (haftungsbeschränkt)\nGesellschaft mit beschränkter Haftung\nHomburg\n\nEs ist beabsichtigt, die Gesellschaft von Amts wegen gemäß § 394 FamFG wegen Vermögenslosigkeit zu löschen.\nGegen die Löschung von Amts wegen ist das Rechtsmittel des Widerspruchs statthaft. Der Widerspruch ist binnen einer Frist zwei Monaten beginnend mit dem Tag dieser Veröffentlichung durch Einreichen eines Widerspruchsschreibens -schriftlich oder zur Niederschrift der Geschäftsstelle beim Amtsgericht Saarbrücken, -zentrales Handelsregister-, Mainzerstr.178, 66121 Saarbrücken einzulegen.\nDer Widerspruch muss die Bezeichnung der angefochtenen Löschungsankündigung enthalten sowie die Erklärung, dass Widerspruch eingelegt wird. Er ist vom Widerspruchsführer oder seinem Bevollmächtigten zu unterzeichnen.\nDas Widerspruchsschreiben kann auch in der Form eines elektronischen Dokumentes eingereicht werden, das mit einer qualifizierten elektronischen Signatur nach dem Signaturgesetz versehen sein muss (§§ 14 Abs. 2 FamFG, 130a, 298 ZPO)."
    },
    {
      "date": "2025-02-03",
      "id": "100261",
      "original_text": "Einreichung neuer Dokumente\nSchleswig-Holstein Amtsgericht Kiel HRB 26481\nEhret+Klein AG – Kiel",
      "type": "Einreichung neuer Dokumente",
      "state": "Schleswig-Holstein",
      "amtsgericht": "Amtsgericht Kiel",
      "registernummer": "HRB 26481",
      "registerart": "HRB",
      "company_name": "Ehret+Klein AG",
      "company_seat": "Kiel",
      "details": "03.02.2025 (Bekanntmachungsdatum)\n\nSchleswig-Holstein Amtsgericht Kiel HRB 26481\nEinreichung neuer Dokumente\n\nEhret+Klein AG\nAktiengesellschaft\nKiel\n\nAls nicht eingetragen wird veröffentlicht: Eine neue Liste der Aufsichtsratsmitglieder ist eingereicht worden."
    },
    {
      "date": "2025-02-03",
      "id": "100262",
      "original_text": "Sonstige Registerbekanntmachung\nBrandenburg Amtsgericht Potsdam HRB 17970\nGREEN PARK GmbH – Stahnsdorf",
      "type": "Sonstige Registerbekanntmachung",
      "state": "Brandenburg",
      "amtsgericht": "Amtsgericht Potsdam",
      "registernummer": "HRB 17970",
      "registerart": "HRB",
      "company_name": "GREEN PARK GmbH",
      "company_seat": "Stahnsdorf",
      "details": "03.02.2025 (Bekanntmachungsdatum)\n\nBrandenburg Amtsgericht Potsdam HRB 17970\nSonstige Registerbekanntmachung\n\nGREEN PARK GmbH\nGesellschaft mit beschränkter Haftung\nStahnsdorf\n\nAls nicht eingetragen wird veröffentlicht: Den Gläubigern der Gesellschaft, deren Forderungen begründet worden sind, bevor die Eintragung der Beendigung des Vertrages  in das Handelsregister  nach § 10 des Handelsgesetzbuches als bekannt gemacht gilt, hat der andere Vertragsteil Sicherheit zu leisten, wenn sie sich binnen sechs Monaten nach der Bekanntmachung  der Eintragung zu diesem Zweck  bei ihm melden"
    },
    {
      "date": "2025-02-03",
      "id": "100263",
      "original_text": "Löschungsankündigung\nBaden-Württemberg Amtsgericht Ulm HRB 701302\nKlima Flex Wintergarten und Faltwände Gesellschaft mit beschränkter Haftung – Mutlangen",
      "type": "Löschungsankündigung",
      "state": "Baden-Württemberg",
      "amtsgericht": "Amtsgericht Ulm",
      "registernummer": "HRB 701302",
      "registerart": "HRB",
      "company_name": "Klima Flex Wintergarten und Faltwände Gesellschaft mit beschränkter Haftung",
      "company_seat": "Mutlangen",
      "details": "03.02.2025 (Bekanntmachungsdatum)\n\nBaden-Württemberg Amtsgericht Ulm HRB 701302\nLöschungsankündigung\n\nKlima Flex Wintergarten und Faltwände Gesellschaft mit beschränkter Haftung\nGesellschaft mit beschränkter Haftung\nMutlangen\n\nDas Gericht beabsichtigt, die Gesellschaft wegen Vermögenslosigkeit im Handelsregister von Amts wegen nach § 394 FamFG zu löschen. Die Frist zur Geltendmachung eines Widerspruchs gegen die beabsichtigte Löschung ist auf  einen Monat ab Veröffentlichung bestimmt."
    },
    {
      "date": "2025-02-03",
      "id": "100264",
      "original_text": "Sonstige Registerbekanntmachung\nBaden-Württemberg Amtsgericht Stuttgart HRA 260773\nBauhelden Media GmbH & Co. KG – Fellbach",
      "type": "Sonstige Registerbekanntmachung",
      "state": "Baden-Württemberg",
      "amtsgericht": "Amtsgericht Stuttgart",
      "registernummer": "HRA 260773",
      "registerart": "HRA",
      "company_name": "Bauhelden Media GmbH & Co. KG",
      "company_seat": "Fellbach",
      "details": "03.02.2025 (Bekanntmachungsdatum)\n\nBaden-Württemberg Amtsgericht Stuttgart HRA 260773\nSonstige Registerbekanntmachung 03.02.2025 (Eintragungsdatum)\n\nBauhelden Media GmbH & Co. KG\nKommanditgesellschaft\nFellbach\n\nDen Gläubigern der Gesellschaft, deren Forderungen begründet worden sind, bevor die Eintragung der Beendigung des Vertrages in das Handelsregister nach § 10 HGB als bekanntgemacht gilt, ist vom anderen Vertragsteil Sicherheit zu leisten, wenn sie sich binnen sechs Monaten nach der Bekanntmachung zu diesem Zweck bei ihm melden."
    },
    {
      "date": "2025-02-03",
      "id": "100265",
      "original_text": "Sonstige Registerbekanntmachung\nSchleswig-Holstein Amtsgericht Lübeck HRB 18524\nKMC Germany GmbH – Lübeck",
      "type": "Sonstige Registerbekanntmachung",
      "state": "Schleswig-Holstein",
      "amtsgericht": "Amtsgericht Lübeck",
      "registernummer": "HRB 18524",
      "registerart": "HRB",
      "company_name": "KMC Germany GmbH",
      "company_seat": "Lübeck",
      "details": "03.02.2025 (Bekanntmachungsdatum)\n\nSchleswig-Holstein Amtsgericht Lübeck HRB 18524\nSonstige Registerbekanntmachung\n\nKMC Germany GmbH\nGesellschaft mit beschränkter Haftung\nLübeck\n\nAls nicht eingetragen wird veröffentlicht: Ergeben sich aus den mir vorliegenden Unterlagen, nämlich Schreiben des Gewerbeamtes vom 13.11.2024 und 07.01.2025 Anhaltspunkte dafür, dass die Gesellschaft, als deren Geschäftsführer Sie noch eingetragen sind, vermögenslos ist. Ich prüfe daher, ob die Gesellschaft wegen Vermögenslosigkeit gemäß § 394 FamFG zu\nlöschen ist. Ich gebe Ihnen Gelegenheit, dazu binnen einer Frist von 1 Monat Stellung zu nehmen.\nWeiter bitte ich Sie, binnen derselben Frist folgende Auskünfte zu erteilen:\nHat die obige Gesellschaft noch Vermögen? Wenn ja, welche Vermögensgegenstände besitzt sie?\nIst die Gesellschaft Partei eines noch nicht rechtskräftig abgeschlossenen Rechtsstreits?\nFindet sonst noch eine Abwicklung statt?"
    },
    {
      "date": "2025-02-03",
      "id": "100266",
      "original_text": "Registerbekanntmachung nach dem Umwandlungsgesetz\nBaden-Württemberg Amtsgericht Mannheim HRB 734730\nThann`scher Hof UG (haftungsbeschränkt) – Heidelberg",
      "type": "Registerbekanntmachung nach dem Umwandlungsgesetz",
      "state": "Baden-Württemberg",
      "amtsgericht": "Amtsgericht Mannheim",
      "registernummer": "HRB 734730",
      "registerart": "HRB",
      "company_name": "Thann`scher Hof UG (haftungsbeschränkt)",
      "company_seat": "Heidelberg",
      "details": "03.02.2025 (Bekanntmachungsdatum)\n\nBaden-Württemberg Amtsgericht Mannheim HRB 734730\nRegisterbekanntmachung nach dem Umwandlungsgesetz 03.02.2025 (Eintragungsdatum)\n\nThann`scher Hof UG (haftungsbeschränkt)\nGesellschaft mit beschränkter Haftung\nHeidelberg\n\nDen Gläubigern der an der Verschmelzung beteiligten Rechtsträger ist, wenn sie binnen sechs Monaten nach dem Tag, an dem die Eintragung der Verschmelzung in das Register des Sitzes desjenigen Rechtsträgers, dessen Gläubiger sie sind, nach § 19 Abs. 3 UmwG als bekanntgemacht gilt, ihren Anspruch nach Grund und Höhe schriftlich anmelden, Sicherheit zu leisten, soweit sie nicht Befriedigung verlangen können. Dieses Recht steht den Gläubigern jedoch nur zu, wenn sie glaubhaft machen, dass durch die Verschmelzung die Erfüllung ihrer Forderung gefährdet wird."
    },
    {
      "date": "2025-02-03",
      "id": "100267",
      "original_text": "Registerbekanntmachung nach dem Umwandlungsgesetz\nSchleswig-Holstein Amtsgericht Kiel HRB 11577\nComvest Beteiligungsgesellschaft mbH – Rendsburg",
      "type": "Registerbekanntmachung nach dem Umwandlungsgesetz",
      "state": "Schleswig-Holstein",
      "amtsgericht": "Amtsgericht Kiel",
      "registernummer": "HRB 11577",
      "registerart": "HRB",
      "company_name": "Comvest Beteiligungsgesellschaft mbH",
      "company_seat": "Rendsburg",
      "details": "03.02.2025 (Bekanntmachungsdatum)\n\nSchleswig-Holstein Amtsgericht Kiel HRB 11577\nRegisterbekanntmachung nach dem Umwandlungsgesetz 31.01.2025 (Eintragungsdatum)\n\nComvest Beteiligungsgesellschaft mbH\nGesellschaft mit beschränkter Haftung\nRendsburg\n\nZu Eintragungsnummer 2 vom 31.01.2025 wird als nicht eingetragen veröffentlicht: Den Gläubigern der an der Verschmelzung beteiligten Rechtsträger ist, wenn sie binnen sechs Monaten nach dem Tag, an dem die Eintragung der Verschmelzung in das Register des Sitzes desjenigen Rechtsträgers, dessen Gläubiger sie sind, nach § 19 Abs. 3 UmwG bekannt gemacht worden ist, ihren Anspruch nach Grund und Höhe schriftlich anmelden, Sicherheit zu leisten, soweit sie nicht Befriedigung verlangen können. Dieses Recht steht den Gläubigern jedoch nur zu, wenn sie glaubhaft machen, dass durch die Verschmelzung die Erfüllung ihrer Forderung gefährdet wird."
    },
    {
      "date": "2025-02-03",
      "id": "100268",
      "original_text": "Registerbekanntmachung nach dem Umwandlungsgesetz\nSchleswig-Holstein Amtsgericht Kiel HRB 17565\nBDB Maschinen GmbH – Westerrönfeld",
      "type": "Registerbekanntmachung nach dem Umwandlungsgesetz",
      "state": "Schleswig-Holstein",
      "amtsgericht": "Amtsgericht Kiel",
      "registernummer": "HRB 17565",
      "registerart": "HRB",
      "company_name": "BDB Maschinen GmbH",
      "company_seat": "Westerrönfeld",
      "details": "03.02.2025 (Bekanntmachungsdatum)\n\nSchleswig-Holstein Amtsgericht Kiel HRB 17565\nRegisterbekanntmachung nach dem Umwandlungsgesetz 29.01.2025 (Eintragungsdatum)\n\nBDB Maschinen GmbH\nGesellschaft mit beschränkter Haftung\nWesterrönfeld\n\nZu Eintragungsnummer 5 vom 29.01.2025 wird als nicht eingetragen veröffentlicht:  Als nicht eingetragen wird veröffentlicht: Den Gläubigern der an der Verschmelzung beteiligten Rechtsträger ist, wenn sie binnen sechs Monaten nach dem Tag, an dem die Eintragung der Verschmelzung in das Register des Sitzes desjenigen Rechtsträgers, dessen Gläubiger sie sind, nach § 19 Abs. 3 UmwG bekannt gemacht worden ist, ihren Anspruch nach Grund und Höhe schriftlich anmelden, Sicherheit zu leisten, soweit sie nicht Befriedigung verlangen können. Dieses Recht steht den Gläubigern jedoch nur zu, wenn sie glaubhaft machen, dass durch die Verschmelzung die Erfüllung ihrer Forderung gefährdet wird."
    },
    {
      "date": "2025-02-03",
      "id": "100269",
      "original_text": "Löschungsankündigung\nSaarland Amtsgericht Saarbrücken HRB 102996\nPINK Verwaltungs GmbH – Saarbrücken-Dudweiler",
      "type": "Löschungsankündigung",
      "state": "Saarland",
      "amtsgericht": "Amtsgericht Saarbrücken",
      "registernummer": "HRB 102996",
      "registerart": "HRB",
      "company_name": "PINK Verwaltungs GmbH",
      "company_seat": "Saarbrücken-Dudweiler",
      "details": "03.02.2025 (Bekanntmachungsdatum)\n\nSaarland Amtsgericht Saarbrücken HRB 102996\nLöschungsankündigung\n\nPINK Verwaltungs GmbH\nGesellschaft mit beschränkter Haftung\nSaarbrücken-Dudweiler\n\nEs ist beabsichtigt, die Gesellschaft von Amts wegen gemäß § 394 FamFG wegen Vermögenslosigkeit zu löschen.\nGegen die Löschung von Amts wegen ist das Rechtsmittel des Widerspruchs statthaft. Der Widerspruch ist binnen einer Frist von einem Monat beginnend mit dem Tag dieser Veröffentlichung durch Einreichen eines Widerspruchsschreibens -schriftlich oder zur Niederschrift der Geschäftsstelle beim Amtsgericht Saarbrücken, -zentrales Handelsregister-, Mainzerstr.178, 66121 Saarbrücken einzulegen.\nDer Widerspruch muss die Bezeichnung der angefochtenen Löschungsankündigung enthalten sowie die Erklärung, dass Widerspruch eingelegt wird. Er ist vom Widerspruchsführer oder seinem Bevollmächtigten zu unterzeichnen.\nDas Widerspruchsschreiben kann auch in der Form eines elektronischen Dokumentes eingereicht werden, das mit einer qualifizierten elektronischen Signatur nach dem Signaturgesetz versehen sein muss (§§ 14 Abs. 2 FamFG, 130a, 298 ZPO)."
    },
    {
      "date": "2025-02-03",
      "id": "100270",
      "original_text": "Löschungsankündigung\nBrandenburg Amtsgericht Neuruppin HRB 10206\nBCI Bauconzept Immobilien & Beteiligungs GmbH – Angermünde",
      "type": "Löschungsankündigung",
      "state": "Brandenburg",
      "amtsgericht": "Amtsgericht Neuruppin",
      "registernummer": "HRB 10206",
      "registerart": "HRB",
      "company_name": "BCI Bauconzept Immobilien & Beteiligungs GmbH",
      "company_seat": "Angermünde",
      "details": "03.02.2025 (Bekanntmachungsdatum)\n\nBrandenburg Amtsgericht Neuruppin HRB 10206\nLöschungsankündigung\n\nBCI Bauconzept Immobilien & Beteiligungs GmbH\nGesellschaft mit beschränkter Haftung\nAngermünde\n\nBei der nachstehenden Gesellschaft wird das Amtslöschungsverfahren gemäß § 394 FamFG eingeleitet.\nWiderspruchsfrist: 1 Monat"
    },
    {
      "date": "2025-02-03",
      "id": "100271",
      "original_text": "Registerbekanntmachung nach dem Umwandlungsgesetz\nBaden-Württemberg Amtsgericht Stuttgart HRB 243194\nKURZ ZORN MÖSSNER GmbH Wirtschaftsprüfungsgesellschaft – Sindelfingen",
      "type": "Registerbekanntmachung nach dem Umwandlungsgesetz",
      "state": "Baden-Württemberg",
      "amtsgericht": "Amtsgericht Stuttgart",
      "registernummer": "HRB 243194",
      "registerart": "HRB",
      "company_name": "KURZ ZORN MÖSSNER GmbH Wirtschaftsprüfungsgesellschaft",
      "company_seat": "Sindelfingen",
      "details": "03.02.2025 (Bekanntmachungsdatum)\n\nBaden-Württemberg Amtsgericht Stuttgart HRB 243194\nRegisterbekanntmachung nach dem Umwandlungsgesetz 03.02.2025 (Eintragungsdatum)\n\nKURZ ZORN MÖSSNER GmbH Wirtschaftsprüfungsgesellschaft\nGesellschaft mit beschränkter Haftung\nSindelfingen\n\nAls nicht eingetragen wird bekanntgemacht:\nDen Gläubigern der an der Verschmelzung beteiligten Rechtsträger ist, wenn sie binnen sechs Monaten nach dem Tag, an dem die Eintragung der Verschmelzung in das Register des Sitzes desjenigen Rechtsträgers, dessen Gläubiger sie sind, nach § 19 Abs. 3 UmwG als bekanntgemacht gilt, ihren Anspruch nach Grund und Höhe schriftlich anmelden, Sicherheit zu leisten, soweit sie nicht Befriedigung verlangen können. Dieses Recht steht den Gläubigern jedoch nur zu, wenn sie glaubhaft machen, dass durch die Verschmelzung die Erfüllung ihrer Forderung gefährdet wird."
    },
    {
      "date": "2025-02-03",
      "id": "100272",
      "original_text": "Registerbekanntmachung nach dem Umwandlungsgesetz\nBaden-Württemberg Amtsgericht Ulm GsR 1168\nMahler Immobiliengesellschaft Holding Verwaltungs-B.V. & Co. eGbR – Bopfingen",
      "type": "Registerbekanntmachung nach dem Umwandlungsgesetz",
      "state": "Baden-Württemberg",
      "amtsgericht": "Amtsgericht Ulm",
      "registernummer": "GsR 1168",
      "registerart": "GsR",
      "company_name": "Mahler Immobiliengesellschaft Holding Verwaltungs-B.V. & Co. eGbR",
      "company_seat": "Bopfingen",
      "details": "03.02.2025 (Bekanntmachungsdatum)\n\nBaden-Württemberg Amtsgericht Ulm GsR 1168\nRegisterbekanntmachung nach dem Umwandlungsgesetz 03.02.2025 (Eintragungsdatum)\n\nMahler Immobiliengesellschaft Holding Verwaltungs-B.V. & Co. eGbR\nGesellschaft bürgerlichen Rechts\nBopfingen\n\nAls nicht eingetragen wird bekanntgemacht:\nDen Gläubigern des an dem Formwechsel beteiligten Rechtsträgers ist, wenn sie binnen sechs Monaten nach dem Tag, an dem die Eintragung des Formwechsels in das Register des Sitzes desjenigen Rechtsträgers, dessen Gläubiger sie sind, nach § 19 Abs. 3 UmwG als bekanntgemacht gilt, ihren Anspruch nach Grund und Höhe schriftlich anmelden, Sicherheit zu leisten, soweit sie nicht Befriedigung verlangen können. Dieses Recht steht den Gläubigern jedoch nur zu, wenn sie glaubhaft machen, dass durch den Formwechsel die Erfüllung ihrer Forderung gefährdet wird."
    },
    {
      "date": "2025-02-03",
      "id": "100273",
      "original_text": "Registerbekanntmachung nach dem Umwandlungsgesetz\nBaden-Württemberg Amtsgericht Ulm HRB 730008\nMahler Immobiliengesellschaft Holding Verwaltungs-GmbH – Bopfingen",
      "type": "Registerbekanntmachung nach dem Umwandlungsgesetz",
      "state": "Baden-Württemberg",
      "amtsgericht": "Amtsgericht Ulm",
      "registernummer": "HRB 730008",
      "registerart": "HRB",
      "company_name": "Mahler Immobiliengesellschaft Holding Verwaltungs-GmbH",
      "company_seat": "Bopfingen",
      "details": "03.02.2025 (Bekanntmachungsdatum)\n\nBaden-Württemberg Amtsgericht Ulm HRB 730008\nRegisterbekanntmachung nach dem Umwandlungsgesetz 03.02.2025 (Eintragungsdatum)\n\nMahler Immobiliengesellschaft Holding Verwaltungs-GmbH\nGesellschaft mit beschränkter Haftung\nBopfingen\n\nAls nicht eingetragen wird bekanntgemacht:\nDen Gläubigern des an dem Formwechsel beteiligten Rechtsträgers ist, wenn sie binnen sechs Monaten nach dem Tag, an dem die Eintragung des Formwechsels in das Register des Sitzes desjenigen Rechtsträgers, dessen Gläubiger sie sind, nach § 19 Abs. 3 UmwG als bekanntgemacht gilt, ihren Anspruch nach Grund und Höhe schriftlich anmelden, Sicherheit zu leisten, soweit sie nicht Befriedigung verlangen können. Dieses Recht steht den Gläubigern jedoch nur zu, wenn sie glaubhaft machen, dass durch den Formwechsel die Erfüllung ihrer Forderung gefährdet wird."
    },
    {
      "date": "2025-02-03",
      "id": "100274",
      "original_text": "Löschungsankündigung\nBerlin Amtsgericht Berlin (Charlottenburg) HRB 137777\nSocial VR GmbH – Berlin",
      "type": "Löschungsankündigung",
      "state": "Berlin",
      "amtsgericht": "Amtsgericht Berlin (Charlottenburg)",
      "registernummer": "HRB 137777",
      "registerart": "HRB",
      "company_name": "Social VR GmbH",
      "company_seat": "Berlin",
      "details": "03.02.2025 (Bekanntmachungsdatum)\n\nBerlin Amtsgericht Berlin (Charlottenburg) HRB 137777\nLöschungsankündigung\n\nSocial VR GmbH\nGesellschaft mit beschränkter Haftung\nBerlin\n\nBei der nachstehenden Gesellschaft wird das Amtslöschungsverfahren gemäß § 394 FamFG eingeleitet. Widerspruchsfrist 6 Wochen"
    },
    {
      "date": "2025-02-03",
      "id": "100275",
      "original_text": "Registerbekanntmachung nach dem Umwandlungsgesetz\nBrandenburg Amtsgericht Neuruppin HRB 11721\nSchröder Handel und Vermietung GmbH – Brüssow",
      "type": "Registerbekanntmachung nach dem Umwandlungsgesetz",
      "state": "Brandenburg",
      "amtsgericht": "Amtsgericht Neuruppin",
      "registernummer": "HRB 11721",
      "registerart": "HRB",
      "company_name": "Schröder Handel und Vermietung GmbH",
      "company_seat": "Brüssow",
      "details": "03.02.2025 (Bekanntmachungsdatum)\n\nBrandenburg Amtsgericht Neuruppin HRB 11721\nRegisterbekanntmachung nach dem Umwandlungsgesetz 30.01.2025 (Eintragungsdatum)\n\nSchröder Handel und Vermietung GmbH\nGesellschaft mit beschränkter Haftung\nBrüssow\n\nZu Eintragungsnummer 4 vom 30.01.2025 wird als nicht eingetragen veröffentlicht:\nDen Gläubigern der an der Umwandlung beteiligten Rechtsträger ist, wenn sie binnen sechs Monaten nach dem Tag, an dem die Eintragung der Umwandlung in das Register des Sitzes desjenigen Rechtsträgers, dessen Gläubiger sie sind, als bekannt gemacht gilt, ihren Anspruch nach Grund und Höhe schriftlich anmelden, Sicherheit zu leisten, soweit sie nicht Befriedigung verlangen können. Dieses Recht steht den Gläubigern jedoch nur zu, wenn sie glaubhaft machen, dass durch die Umwandlung die Erfüllung ihrer Forderung gefährdet wird"
    },
    {
      "date": "2025-02-03",
      "id": "100276",
      "original_text": "Löschungsankündigung\nSaarland Amtsgericht Saarbrücken HRB 105403\nBaciu Transporte UG (haftungsbeschränkt) – Bous",
      "type": "Löschungsankündigung",
      "state": "Saarland",
      "amtsgericht": "Amtsgericht Saarbrücken",
      "registernummer": "HRB 105403",
      "registerart": "HRB",
      "company_name": "Baciu Transporte UG (haftungsbeschränkt)",
      "company_seat": "Bous",
      "details": "03.02.2025 (Bekanntmachungsdatum)\n\nSaarland Amtsgericht Saarbrücken HRB 105403\nLöschungsankündigung\n\nBaciu Transporte UG (haftungsbeschränkt)\nGesellschaft mit beschränkter Haftung\nBous\n\nEs ist beabsichtigt, die Gesellschaft von Amts wegen gemäß § 394 FamFG wegen Vermögenslosigkeit zu löschen.\nGegen die Löschung von Amts wegen ist das Rechtsmittel des Widerspruchs statthaft. Der Widerspruch ist binnen einer Frist zwei Monaten beginnend mit dem Tag dieser Veröffentlichung durch Einreichen eines Widerspruchsschreibens -schriftlich oder zur Niederschrift der Geschäftsstelle beim Amtsgericht Saarbrücken, -zentrales Handelsregister-, Mainzerstr.178, 66121 Saarbrücken einzulegen.\nDer Widerspruch muss die Bezeichnung der angefochtenen Löschungsankündigung enthalten sowie die Erklärung, dass Widerspruch eingelegt wird. Er ist vom Widerspruchsführer oder seinem Bevollmächtigten zu unterzeichnen.\nDas Widerspruchsschreiben kann auch in der Form eines elektronischen Dokumentes eingereicht werden, das mit einer qualifizierten elektronischen Signatur nach dem Signaturgesetz versehen sein muss (§§ 14 Abs. 2 FamFG, 130a, 298 ZPO)."
    },
    {
      "date": "2025-02-03",
      "id": "100277",
      "original_text": "Löschungsankündigung\nBaden-Württemberg Amtsgericht Mannheim HRA 706515\nViceram GmbH & Co. KG – Heidelberg",
      "type": "Löschungsankündigung",
      "state": "Baden-Württemberg",
      "amtsgericht": "Amtsgericht Mannheim",
      "registernummer": "HRA 706515",
      "registerart": "HRA",
      "company_name": "Viceram GmbH & Co. KG",
      "company_seat": "Heidelberg",
      "details": "03.02.2025 (Bekanntmachungsdatum)\n\nBaden-Württemberg Amtsgericht Mannheim HRA 706515\nLöschungsankündigung\n\nViceram GmbH & Co. KG\nKommanditgesellschaft\nHeidelberg\n\nAls nicht eingetragen wird bekanntgemacht:\nDas Gericht beabsichtigt, die Gesellschaft wegen Vermögenslosigkeit im Handelsregister von Amts wegen nach § 394 FamFG zu löschen. Die Frist zur Geltendmachung eines Widerspruchs gegen die beabsichtigte Löschung ist auf einen Monat ab Veröffentlichung bestimmt."
    },
    {
      "date": "2025-02-03",
      "id": "100278",
      "original_text": "Löschungsankündigung\nBerlin Amtsgericht Berlin (Charlottenburg) HRA 52802\nirotech UG (haftungsbeschränkt) & Co. KG – Berlin",
      "type": "Löschungsankündigung",
      "state": "Berlin",
      "amtsgericht": "Amtsgericht Berlin (Charlottenburg)",
      "registernummer": "HRA 52802",
      "registerart": "HRA",
      "company_name": "irotech UG (haftungsbeschränkt) & Co. KG",
      "company_seat": "Berlin",
      "details": "03.02.2025 (Bekanntmachungsdatum)\n\nBerlin Amtsgericht Berlin (Charlottenburg) HRA 52802\nLöschungsankündigung\n\nirotech UG (haftungsbeschränkt) & Co. KG\nKommanditgesellschaft\nBerlin\n\nBei dem nachstehenden Unternehmen / der nachstehenden Gesellschaft wird das Amtslöschungsverfahren gemäß § 31 Abs. 2 HGB eingeleitet. Widerspruchsfrist 1 Monat"
    },
    {
      "date": "2025-02-03",
      "id": "100279",
      "original_text": "Registerbekanntmachung nach dem Umwandlungsgesetz\nBerlin Amtsgericht Berlin (Charlottenburg) HRA 54206\nWCM Handelsmärkte XVI GmbH & Co. KG – Berlin",
      "type": "Registerbekanntmachung nach dem Umwandlungsgesetz",
      "state": "Berlin",
      "amtsgericht": "Amtsgericht Berlin (Charlottenburg)",
      "registernummer": "HRA 54206",
      "registerart": "HRA",
      "company_name": "WCM Handelsmärkte XVI GmbH & Co. KG",
      "company_seat": "Berlin",
      "details": "03.02.2025 (Bekanntmachungsdatum)\n\nBerlin Amtsgericht Berlin (Charlottenburg) HRA 54206\nRegisterbekanntmachung nach dem Umwandlungsgesetz 29.01.2025 (Eintragungsdatum)\n\nWCM Handelsmärkte XVI GmbH & Co. KG\nKommanditgesellschaft\nBerlin\n\nZu Eintragungsnummer 6 vom 29.01.2025 wird als nicht eingetragen veröffentlicht:Den Gläubigern ist, wenn sie binnen sechs Monaten nach dem Tag, an dem die Eintragung der Umwandlung als bekannt gemacht gilt, ihren Anspruch nach Grund und Höhe schriftlich anmelden, Sicherheit zu leisten, soweit sie nicht Befriedigung verlangen können. Dieses Recht steht den Gläubigern jedoch nur zu, wenn sie glaubhaft machen, dass durch die Umwandlung die Erfüllung ihrer Forderung gefährdet wird. Das Recht, Sicherheitsleistung zu verlangen, steht Gläubigern nicht zu, die im Falle der Insolvenz ein Recht auf vorzugsweise Befriedigung aus einer Deckungsmasse haben, die nach gesetzlicher Vorschrift zu ihrem Schutz errichtet und staatlich überwacht ist."
    },
    {
      "date": "2025-02-03",
      "id": "100280",
      "original_text": "Registerbekanntmachung nach dem Umwandlungsgesetz\nThüringen Amtsgericht Jena HRB 500323\nAgnilaser GmbH – Petersberg",
      "type": "Registerbekanntmachung nach dem Umwandlungsgesetz",
      "state": "Thüringen",
      "amtsgericht": "Amtsgericht Jena",
      "registernummer": "HRB 500323",
      "registerart": "HRB",
      "company_name": "Agnilaser GmbH",
      "company_seat": "Petersberg",
      "details": "03.02.2025 (Bekanntmachungsdatum)\n\nThüringen Amtsgericht Jena HRB 500323\nRegisterbekanntmachung nach dem Umwandlungsgesetz 03.02.2025 (Eintragungsdatum)\n\nAgnilaser GmbH\nGesellschaft mit beschränkter Haftung\nPetersberg\n\nNicht eingetragen: Den Gläubigern der an der Verschmelzung beteiligten Rechtsträger, ist wenn sie binnen sechs Monaten nach dem Tag, an dem die Eintragung der Verschmelzung in das Register des Sitzes desjenigen Rechtsträgers, dessen Gläubiger sie sind,  nach § 19 Abs. 3 UmwG als bekanntgemacht gilt, ihren Anspruch nach Grund und Höhe schriftlich anmelden, Sicherheit zu leisten, soweit sie nicht Befriedigung verlangen können. Dieses Recht steht ihnen jedoch nur zu, wenn sie glaubhaft machen, daß durch die Verschmelzung die Erfüllung ihrer Forderung gefährdet wird."
    },
    {
      "date": "2025-02-03",
      "id": "100281",
      "original_text": "Registerbekanntmachung nach dem Umwandlungsgesetz\nThüringen Amtsgericht Jena HRB 206377\nLaserzentrum Schorcht GmbH – Petersberg",
      "type": "Registerbekanntmachung nach dem Umwandlungsgesetz",
      "state": "Thüringen",
      "amtsgericht": "Amtsgericht Jena",
      "registernummer": "HRB 206377",
      "registerart": "HRB",
      "company_name": "Laserzentrum Schorcht GmbH",
      "company_seat": "Petersberg",
      "details": "03.02.2025 (Bekanntmachungsdatum)\n\nThüringen Amtsgericht Jena HRB 206377\nRegisterbekanntmachung nach dem Umwandlungsgesetz 03.02.2025 (Eintragungsdatum)\n\nLaserzentrum Schorcht GmbH\nGesellschaft mit beschränkter Haftung\nPetersberg\n\nNicht eingetragen: Den Gläubigern der an der Verschmelzung beteiligten Rechtsträger, ist wenn sie binnen sechs Monaten nach dem Tag, an dem die Eintragung der Verschmelzung in das Register des Sitzes desjenigen Rechtsträgers, dessen Gläubiger sie sind,  nach § 19 Abs. 3 UmwG als bekanntgemacht gilt, ihren Anspruch nach Grund und Höhe schriftlich anmelden, Sicherheit zu leisten, soweit sie nicht Befriedigung verlangen können. Dieses Recht steht ihnen jedoch nur zu, wenn sie glaubhaft machen, daß durch die Verschmelzung die Erfüllung ihrer Forderung gefährdet wird."
    },
    {
      "date": "2025-02-03",
      "id": "100282",
      "original_text": "Registerbekanntmachung nach dem Umwandlungsgesetz\nBaden-Württemberg Amtsgericht Stuttgart GsR 2259\nBestattungen Häfner & Züfle eGbR – Stuttgart",
      "type": "Registerbekanntmachung nach dem Umwandlungsgesetz",
      "state": "Baden-Württemberg",
      "amtsgericht": "Amtsgericht Stuttgart",
      "registernummer": "GsR 2259",
      "registerart": "GsR",
      "company_name": "Bestattungen Häfner & Züfle eGbR",
      "company_seat": "Stuttgart",
      "details": "03.02.2025 (Bekanntmachungsdatum)\n\nBaden-Württemberg Amtsgericht Stuttgart GsR 2259\nRegisterbekanntmachung nach dem Umwandlungsgesetz 03.02.2025 (Eintragungsdatum)\n\nBestattungen Häfner & Züfle eGbR\nGesellschaft bürgerlichen Rechts\nStuttgart\n\nAls nicht eingetragen wird bekanntgemacht:\nDen Gläubigern der an der Verschmelzung beteiligten Rechtsträger ist, wenn sie binnen sechs Monaten nach dem Tag, an dem die Eintragung der Verschmelzung in das Register des Sitzes desjenigen Rechtsträgers, dessen Gläubiger sie sind, nach § 19 Abs. 3 UmwG als bekanntgemacht gilt, ihren Anspruch nach Grund und Höhe schriftlich anmelden, Sicherheit zu leisten, soweit sie nicht Befriedigung verlangen können. Dieses Recht steht den Gläubigern jedoch nur zu, wenn sie glaubhaft machen, dass durch die Verschmelzung die Erfüllung ihrer Forderung gefährdet wird."
    },
    {
      "date": "2025-02-03",
      "id": "100283",
      "original_text": "Registerbekanntmachung nach dem Umwandlungsgesetz\nBaden-Württemberg Amtsgericht Stuttgart HRB 797837\nHäfner & Züfle Bestattungen GmbH – Stuttgart",
      "type": "Registerbekanntmachung nach dem Umwandlungsgesetz",
      "state": "Baden-Württemberg",
      "amtsgericht": "Amtsgericht Stuttgart",
      "registernummer": "HRB 797837",
      "registerart": "HRB",
      "company_name": "Häfner & Züfle Bestattungen GmbH",
      "company_seat": "Stuttgart",
      "details": "03.02.2025 (Bekanntmachungsdatum)\n\nBaden-Württemberg Amtsgericht Stuttgart HRB 797837\nRegisterbekanntmachung nach dem Umwandlungsgesetz 03.02.2025 (Eintragungsdatum)\n\nHäfner & Züfle Bestattungen GmbH\nGesellschaft mit beschränkter Haftung\nStuttgart\n\nAls nicht eingetragen wird bekanntgemacht:\nDen Gläubigern der an der Verschmelzung beteiligten Rechtsträger ist, wenn sie binnen sechs Monaten nach dem Tag, an dem die Eintragung der Verschmelzung in das Register des Sitzes desjenigen Rechtsträgers, dessen Gläubiger sie sind, nach § 19 Abs. 3 UmwG als bekanntgemacht gilt, ihren Anspruch nach Grund und Höhe schriftlich anmelden, Sicherheit zu leisten, soweit sie nicht Befriedigung verlangen können. Dieses Recht steht den Gläubigern jedoch nur zu, wenn sie glaubhaft machen, dass durch die Verschmelzung die Erfüllung ihrer Forderung gefährdet wird."
    },
    {
      "date": "2025-02-03",
      "id": "100284",
      "original_text": "Einreichung neuer Dokumente\nSachsen-Anhalt Amtsgericht Stendal HRB 16981\nSSBZ Stadtreinigungs- und Servicebetrieb Zeitz GmbH – Zeitz",
      "type": "Einreichung neuer Dokumente",
      "state": "Sachsen-Anhalt",
      "amtsgericht": "Amtsgericht Stendal",
      "registernummer": "HRB 16981",
      "registerart": "HRB",
      "company_name": "SSBZ Stadtreinigungs- und Servicebetrieb Zeitz GmbH",
      "company_seat": "Zeitz",
      "details": "03.02.2025 (Bekanntmachungsdatum)\n\nSachsen-Anhalt Amtsgericht Stendal HRB 16981\nEinreichung neuer Dokumente\n\nSSBZ Stadtreinigungs- und Servicebetrieb Zeitz GmbH\nGesellschaft mit beschränkter Haftung\nZeitz\n\nEine Liste der Mitglieder des Aufsichtsrates wurde zum Handelsregister eingereicht."
    },
    {
      "date": "2025-02-03",
      "id": "100285",
      "original_text": "Registerbekanntmachung nach dem Umwandlungsgesetz\nBrandenburg Amtsgericht Neuruppin HRA 3744\nPflegedienst Zehdenick e.K. Inhaber: Martti Neumann – Zehdenick",
      "type": "Registerbekanntmachung nach dem Umwandlungsgesetz",
      "state": "Brandenburg",
      "amtsgericht": "Amtsgericht Neuruppin",
      "registernummer": "HRA 3744",
      "registerart": "HRA",
      "company_name": "Pflegedienst Zehdenick e.K. Inhaber: Martti Neumann",
      "company_seat": "Zehdenick",
      "details": "03.02.2025 (Bekanntmachungsdatum)\n\nBrandenburg Amtsgericht Neuruppin HRA 3744\nRegisterbekanntmachung nach dem Umwandlungsgesetz 03.02.2025 (Eintragungsdatum)\n\nPflegedienst Zehdenick e.K. Inhaber: Martti Neumann\nEinzelkaufmann / Einzelkauffrau\nZehdenick\n\nZu Eintragungsnummer 2 vom 03.02.2025 wird als nicht eingetragen veröffentlicht:\nDen Gläubigern der an der Umwandlung beteiligten Rechtsträger ist, wenn sie binnen sechs Monaten nach dem Tag, an dem die Eintragung der Umwandlung in das Register des Sitzes desjenigen Rechtsträgers, dessen Gläubiger sie sind, als bekannt gemacht gilt, ihren Anspruch nach Grund und Höhe schriftlich anmelden, Sicherheit zu leisten, soweit sie nicht Befriedigung verlangen können. Dieses Recht steht den Gläubigern jedoch nur zu, wenn sie glaubhaft machen, dass durch die Umwandlung die Erfüllung ihrer Forderung gefährdet wird"
    },
    {
      "date": "2025-02-03",
      "id": "100286",
      "original_text": "Einreichung neuer Dokumente\nHamburg Amtsgericht Hamburg HRB 121125\nAVW Immobilien AG – Hamburg",
      "type": "Einreichung neuer Dokumente",
      "state": "Hamburg",
      "amtsgericht": "Amtsgericht Hamburg",
      "registernummer": "HRB 121125",
      "registerart": "HRB",
      "company_name": "AVW Immobilien AG",
      "company_seat": "Hamburg",
      "details": "03.02.2025 (Bekanntmachungsdatum)\n\nHamburg Amtsgericht Hamburg HRB 121125\nEinreichung neuer Dokumente 03.02.2025 (Eintragungsdatum)\n\nAVW Immobilien AG\nAktiengesellschaft\nHamburg\n\nAls nicht eingetragen wird bekannt gemacht: Liste des Aufsichtsrats wurde eingereicht."
    },
    {
      "date": "2025-02-03",
      "id": "100287",
      "original_text": "Einreichung neuer Dokumente\nHamburg Amtsgericht Hamburg HRB 98689\nHAMMONIA Schiffsholding AG – Hamburg",
      "type": "Einreichung neuer Dokumente",
      "state": "Hamburg",
      "amtsgericht": "Amtsgericht Hamburg",
      "registernummer": "HRB 98689",
      "registerart": "HRB",
      "company_name": "HAMMONIA Schiffsholding AG",
      "company_seat": "Hamburg",
      "details": "03.02.2025 (Bekanntmachungsdatum)\n\nHamburg Amtsgericht Hamburg HRB 98689\nEinreichung neuer Dokumente\n\nHAMMONIA Schiffsholding AG\nAktiengesellschaft\nHamburg\n\nAls nicht eingetragen wird bekannt gemacht: Liste des Aufsichtsrats wurde eingereicht."
    },
    {
      "date": "2025-02-03",
      "id": "100288",
      "original_text": "Löschungsankündigung\nBerlin Amtsgericht Berlin (Charlottenburg) HRA 57432\nSinestro GmbH & Co. KG – Berlin",
      "type": "Löschungsankündigung",
      "state": "Berlin",
      "amtsgericht": "Amtsgericht Berlin (Charlottenburg)",
      "registernummer": "HRA 57432",
      "registerart": "HRA",
      "company_name": "Sinestro GmbH & Co. KG",
      "company_seat": "Berlin",
      "details": "03.02.2025 (Bekanntmachungsdatum)\n\nBerlin Amtsgericht Berlin (Charlottenburg) HRA 57432\nLöschungsankündigung\n\nSinestro GmbH & Co. KG\nKommanditgesellschaft\nBerlin\n\nBei dem nachstehenden Unternehmen / der nachstehenden Gesellschaft wird das Amtslöschungsverfahren gemäß § 31 Abs. 2 HGB eingeleitet. Widerspruchsfrist 1 Monat"
    },
    {
      "date": "2025-02-03",
      "id": "100289",
      "original_text": "Sonstige Registerbekanntmachung\nBrandenburg Amtsgericht Potsdam HRA 8550\nFuhrbetrieb Zeidler OHG – Brieselang",
      "type": "Sonstige Registerbekanntmachung",
      "state": "Brandenburg",
      "amtsgericht": "Amtsgericht Potsdam",
      "registernummer": "HRA 8550",
      "registerart": "HRA",
      "company_name": "Fuhrbetrieb Zeidler OHG",
      "company_seat": "Brieselang",
      "details": "03.02.2025 (Bekanntmachungsdatum)\n\nBrandenburg Amtsgericht Potsdam HRA 8550\nSonstige Registerbekanntmachung\n\nFuhrbetrieb Zeidler OHG\nOffene Handelsgesellschaft\nBrieselang\n\nAls nicht eingetragen wird veröffentlicht: Die Haftung der Gesellschaft für die im Betriebe des Geschäfts begründeten Verbindlichkeiten des bisherigen Inhabers ist ausgeschlossen."
    },
    {
      "date": "2025-02-03",
      "id": "100290",
      "original_text": "Löschungsankündigung\nBerlin Amtsgericht Berlin (Charlottenburg) HRB 144078\nD.A.M. Service UG (haftungsbeschränkt) – Berlin",
      "type": "Löschungsankündigung",
      "state": "Berlin",
      "amtsgericht": "Amtsgericht Berlin (Charlottenburg)",
      "registernummer": "HRB 144078",
      "registerart": "HRB",
      "company_name": "D.A.M. Service UG (haftungsbeschränkt)",
      "company_seat": "Berlin",
      "details": "03.02.2025 (Bekanntmachungsdatum)\n\nBerlin Amtsgericht Berlin (Charlottenburg) HRB 144078\nLöschungsankündigung\n\nD.A.M. Service UG (haftungsbeschränkt)\nGesellschaft mit beschränkter Haftung\nBerlin\n\nBei der nachstehenden Gesellschaft wird das Amtslöschungsverfahren gemäß § 394 FamFG eingeleitet. Widerspruchsfrist 6 Wochen"
    },
    {
      "date": "2025-02-03",
      "id": "100291",
      "original_text": "Löschungsankündigung\nBaden-Württemberg Amtsgericht Mannheim HRA 706491\nM & K Entertainment UG (haftungsbeschränkt) & Co KG – Buchen Odenwald",
      "type": "Löschungsankündigung",
      "state": "Baden-Württemberg",
      "amtsgericht": "Amtsgericht Mannheim",
      "registernummer": "HRA 706491",
      "registerart": "HRA",
      "company_name": "M & K Entertainment UG (haftungsbeschränkt) & Co KG",
      "company_seat": "Buchen Odenwald",
      "details": "03.02.2025 (Bekanntmachungsdatum)\n\nBaden-Württemberg Amtsgericht Mannheim HRA 706491\nLöschungsankündigung\n\nM & K Entertainment UG (haftungsbeschränkt) & Co KG\nKommanditgesellschaft\nBuchen Odenwald\n\nAls nicht eingetragen wird bekanntgemacht:\nDas Gericht beabsichtigt, die Gesellschaft wegen Vermögenslosigkeit im Handelsregister von Amts wegen nach § 394 FamFG zu löschen. Die Frist zur Geltendmachung eines Widerspruchs gegen die beabsichtigte Löschung ist auf einen Monat ab Veröffentlichung bestimmt."
    },
    {
      "date": "2025-02-03",
      "id": "100292",
      "original_text": "Einreichung neuer Dokumente\nBaden-Württemberg Amtsgericht Mannheim HRB 741455\ntrans-o-flex Express GmbH & Co. KGaA – Weinheim",
      "type": "Einreichung neuer Dokumente",
      "state": "Baden-Württemberg",
      "amtsgericht": "Amtsgericht Mannheim",
      "registernummer": "HRB 741455",
      "registerart": "HRB",
      "company_name": "trans-o-flex Express GmbH & Co. KGaA",
      "company_seat": "Weinheim",
      "details": "03.02.2025 (Bekanntmachungsdatum)\n\nBaden-Württemberg Amtsgericht Mannheim HRB 741455\nEinreichung neuer Dokumente\n\ntrans-o-flex Express GmbH & Co. KGaA\nKommanditgesellschaft auf Aktien\nWeinheim\n\nAm 31.01.2025 hat die Gesellschaft das Versammlungsprotokoll vom 28.01.2025 beim Registergericht eingereicht."
    },
    {
      "date": "2025-02-03",
      "id": "100293",
      "original_text": "Registerbekanntmachung nach dem Umwandlungsgesetz\nBerlin Amtsgericht Berlin (Charlottenburg) HRB 247466\nN26 Bank AG – Berlin",
      "type": "Registerbekanntmachung nach dem Umwandlungsgesetz",
      "state": "Berlin",
      "amtsgericht": "Amtsgericht Berlin (Charlottenburg)",
      "registernummer": "HRB 247466",
      "registerart": "HRB",
      "company_name": "N26 Bank AG",
      "company_seat": "Berlin",
      "details": "03.02.2025 (Bekanntmachungsdatum)\n\nBerlin Amtsgericht Berlin (Charlottenburg) HRB 247466\nRegisterbekanntmachung nach dem Umwandlungsgesetz 31.01.2025 (Eintragungsdatum)\n\nN26 Bank AG\nAktiengesellschaft\nBerlin\n\nZu Eintragungsnummer 11 vom 31.01.2025 wird als nicht eingetragen veröffentlicht: Den Gläubigern der an der Verschmelzung beteiligten Rechtsträger ist, wenn sie binnen sechs Monaten nach dem Tag, an dem die Eintragung der Verschmelzung in das Register des Sitzes desjenigen Rechtsträgers, dessen Gläubiger sie sind, als bekannt gemacht gilt, ihren Anspruch nach Grund und Höhe schriftlich anmelden, Sicherheit zu leisten, soweit sie nicht Befriedigung verlangen können. Dieses Recht steht den Gläubigern jedoch nur zu, wenn sie glaubhaft machen, dass durch die Verschmelzung die Erfüllung ihrer Forderung gefährdet wird. Das Recht, Sicherheitsleistung zu verlangen, steht Gläubigern nicht zu, die im Falle der Insolvenz ein Recht auf vorzugsweise Befriedigung aus einer Deckungsmasse haben, die nach gesetzlicher Vorschrift zu ihrem Schutz errichtet und staatlich überwacht ist."
    },
    {
      "date": "2025-02-03",
      "id": "100294",
      "original_text": "Registerbekanntmachung nach dem Umwandlungsgesetz\nBerlin Amtsgericht Berlin (Charlottenburg) HRB 271697\nN26 Bank SE – Berlin",
      "type": "Registerbekanntmachung nach dem Umwandlungsgesetz",
      "state": "Berlin",
      "amtsgericht": "Amtsgericht Berlin (Charlottenburg)",
      "registernummer": "HRB 271697",
      "registerart": "HRB",
      "company_name": "N26 Bank SE",
      "company_seat": "Berlin",
      "details": "03.02.2025 (Bekanntmachungsdatum)\n\nBerlin Amtsgericht Berlin (Charlottenburg) HRB 271697\nRegisterbekanntmachung nach dem Umwandlungsgesetz 31.01.2025 (Eintragungsdatum)\n\nN26 Bank SE\nEuropäische Aktiengesellschaft (SE)\nBerlin\n\nZu Eintragungsnummer 1 vom 31.01.2025 wird als nicht eingetragen veröffentlicht: Den Gläubigern ist, wenn sie binnen sechs Monaten nach dem Tag, an dem die Eintragung der Umwandlung als bekannt gemacht gilt, ihren Anspruch nach Grund und Höhe schriftlich anmelden, Sicherheit zu leisten, soweit sie nicht Befriedigung verlangen können. Dieses Recht steht den Gläubigern jedoch nur zu, wenn sie glaubhaft machen, dass durch die Umwandlung die Erfüllung ihrer Forderung gefährdet wird. Das Recht, Sicherheitsleistung zu verlangen, steht Gläubigern nicht zu, die im Falle der Insolvenz ein Recht auf vorzugsweise Befriedigung aus einer Deckungsmasse haben, die nach gesetzlicher Vorschrift zu ihrem Schutz errichtet und staatlich überwacht ist.\n\nDen Gläubigern der an der Verschmelzung beteiligten Rechtsträger ist, wenn sie binnen sechs Monaten nach dem Tag, an dem die Eintragung der Verschmelzung in das Register des Sitzes desjenigen Rechtsträgers, dessen Gläubiger sie sind, als bekannt gemacht gilt, ihren Anspruch nach Grund und Höhe schriftlich anmelden, Sicherheit zu leisten, soweit sie nicht Befriedigung verlangen können. Dieses Recht steht den Gläubigern jedoch nur zu, wenn sie glaubhaft machen, dass durch die Verschmelzung die Erfüllung ihrer Forderung gefährdet wird. Das Recht, Sicherheitsleistung zu verlangen, steht Gläubigern nicht zu, die im Falle der Insolvenz ein Recht auf vorzugsweise Befriedigung aus einer Deckungsmasse haben, die nach gesetzlicher Vorschrift zu ihrem Schutz errichtet und staatlich überwacht ist."
    },
    {
      "date": "2025-02-03",
      "id": "100295",
      "original_text": "Registerbekanntmachung nach dem Umwandlungsgesetz\nHamburg Amtsgericht Hamburg HRB 90249\nPaychex Deutschland GmbH – Hamburg",
      "type": "Registerbekanntmachung nach dem Umwandlungsgesetz",
      "state": "Hamburg",
      "amtsgericht": "Amtsgericht Hamburg",
      "registernummer": "HRB 90249",
      "registerart": "HRB",
      "company_name": "Paychex Deutschland GmbH",
      "company_seat": "Hamburg",
      "details": "03.02.2025 (Bekanntmachungsdatum)\n\nHamburg Amtsgericht Hamburg HRB 90249\nRegisterbekanntmachung nach dem Umwandlungsgesetz 03.02.2025 (Eintragungsdatum)\n\nPaychex Deutschland GmbH\nGesellschaft mit beschränkter Haftung\nHamburg\n\nAls nicht eingetragen wird bekannt gemacht:\nDen Gläubigern der an der Verschmelzung beteiligten Gesellschaften ist, wenn sie binnen sechs Monaten nach dem Tag, an dem die Eintragung der Verschmelzung in das Register des Sitzes desjenigen Rechtsträgers, dessen Gläubiger sie sind, nach § 19 Absatz 3 UmwG als bekannt gemacht gilt, ihren Anspruch nach Grund und Höhe schriftlich anmelden, Sicherheit zu leisten, soweit sie nicht Befriedigung verlangen können. Dieses Recht steht den Gläubigern jedoch nur zu, wenn sie glaubhaft machen, dass durch die Verschmelzung die Erfüllung ihrer Forderung gefährdet wird."
    },
    {
      "date": "2025-02-03",
      "id": "100296",
      "original_text": "Registerbekanntmachung nach dem Umwandlungsgesetz\nBaden-Württemberg Amtsgericht Stuttgart HRB 744562\nKURZ ZORN MÖSSNER u. KOLL. WP GMBH Wirtschaftsprüfungsgesellschaft – Sindelfingen",
      "type": "Registerbekanntmachung nach dem Umwandlungsgesetz",
      "state": "Baden-Württemberg",
      "amtsgericht": "Amtsgericht Stuttgart",
      "registernummer": "HRB 744562",
      "registerart": "HRB",
      "company_name": "KURZ ZORN MÖSSNER u. KOLL. WP GMBH Wirtschaftsprüfungsgesellschaft",
      "company_seat": "Sindelfingen",
      "details": "03.02.2025 (Bekanntmachungsdatum)\n\nBaden-Württemberg Amtsgericht Stuttgart HRB 744562\nRegisterbekanntmachung nach dem Umwandlungsgesetz 03.02.2025 (Eintragungsdatum)\n\nKURZ ZORN MÖSSNER u. KOLL. WP GMBH Wirtschaftsprüfungsgesellschaft\nGesellschaft mit beschränkter Haftung\nSindelfingen\n\nAls nicht eingetragen wird bekanntgemacht:\nDen Gläubigern der an der Verschmelzung beteiligten Rechtsträger ist, wenn sie binnen sechs Monaten nach dem Tag, an dem die Eintragung der Verschmelzung in das Register des Sitzes desjenigen Rechtsträgers, dessen Gläubiger sie sind, nach § 19 Abs. 3 UmwG als bekanntgemacht gilt, ihren Anspruch nach Grund und Höhe schriftlich anmelden, Sicherheit zu leisten, soweit sie nicht Befriedigung verlangen können. Dieses Recht steht den Gläubigern jedoch nur zu, wenn sie glaubhaft machen, dass durch die Verschmelzung die Erfüllung ihrer Forderung gefährdet wird."
    },
    {
      "date": "2025-02-03",
      "id": "100297",
      "original_text": "Sonstige Registerbekanntmachung\nMecklenburg-Vorpommern Amtsgericht Rostock HRB 11369\nReriker BildungsArt AG – Rerik",
      "type": "Sonstige Registerbekanntmachung",
      "state": "Mecklenburg-Vorpommern",
      "amtsgericht": "Amtsgericht Rostock",
      "registernummer": "HRB 11369",
      "registerart": "HRB",
      "company_name": "Reriker BildungsArt AG",
      "company_seat": "Rerik",
      "details": "03.02.2025 (Bekanntmachungsdatum)\n\nMecklenburg-Vorpommern Amtsgericht Rostock HRB 11369\nSonstige Registerbekanntmachung\n\nReriker BildungsArt AG\nAktiengesellschaft\nRerik\n\nEine Liste der Mitglieder des Aufsichtsrats ist zum Handelsregister eingereicht worden."
    },
    {
      "date": "2025-02-03",
      "id": "100298",
      "original_text": "Registerbekanntmachung nach dem Umwandlungsgesetz\nSachsen Amtsgericht Dresden HRB 21885\nGörlitzer Höfe GmbH – Görlitz",
      "type": "Registerbekanntmachung nach dem Umwandlungsgesetz",
      "state": "Sachsen",
      "amtsgericht": "Amtsgericht Dresden",
      "registernummer": "HRB 21885",
      "registerart": "HRB",
      "company_name": "Görlitzer Höfe GmbH",
      "company_seat": "Görlitz",
      "details": "03.02.2025 (Bekanntmachungsdatum)\n\nSachsen Amtsgericht Dresden HRB 21885\nRegisterbekanntmachung nach dem Umwandlungsgesetz 03.02.2025 (Eintragungsdatum)\n\nGörlitzer Höfe GmbH\nGesellschaft mit beschränkter Haftung\nGörlitz\n\nDen Gläubigern der an der Verschmelzung beteiligten Rechtsträger ist, wenn sie binnen sechs Monaten nach dem Tag, an dem die Eintragung der Verschmelzung in das Register des Sitzes desjenigen Rechtsträgers, dessen Gläubiger sie sind, nach § 19 Abs. 3 UmwG als bekannt gemacht gilt, ihren Anspruch nach Grund und Höhe in Textform anmelden, Sicherheit zu leisten, soweit sie nicht Befriedigung verlangen können. Dieses Recht steht den Gläubigern jedoch nur zu, wenn sie glaubhaft machen, dass durch die Verschmelzung die Erfüllung der Forderung gefährdet wird."
    },
    {
      "date": "2025-02-03",
      "id": "100299",
      "original_text": "Einreichung neuer Dokumente\nSachsen Amtsgericht Dresden HRB 40974\nGolden Gates Edelmetalle AG – Görlitz",
      "type": "Einreichung neuer Dokumente",
      "state": "Sachsen",
      "amtsgericht": "Amtsgericht Dresden",
      "registernummer": "HRB 40974",
      "registerart": "HRB",
      "company_name": "Golden Gates Edelmetalle AG",
      "company_seat": "Görlitz",
      "details": "03.02.2025 (Bekanntmachungsdatum)\n\nSachsen Amtsgericht Dresden HRB 40974\nEinreichung neuer Dokumente 03.02.2025 (Eintragungsdatum)\n\nGolden Gates Edelmetalle AG\nAktiengesellschaft\nGörlitz\n\nAm 29.01.2025 wurde beim Handelsregister des Amtsgerichts Dresden die Liste der Mitglieder des Aufsichtsrats gemäß § 106 AktG eingereicht."
    },
    {
      "date": "2025-02-03",
      "id": "100300",
      "original_text": "Einreichung neuer Dokumente\nSachsen Amtsgericht Leipzig HRB 20267\nGENIUS AG – Wermsdorf (Sachsen)",
      "type": "Einreichung neuer Dokumente",
      "state": "Sachsen",
      "amtsgericht": "Amtsgericht Leipzig",
      "registernummer": "HRB 20267",
      "registerart": "HRB",
      "company_name": "GENIUS AG",
      "company_seat": "Wermsdorf (Sachsen)",
      "details": "03.02.2025 (Bekanntmachungsdatum)\n\nSachsen Amtsgericht Leipzig HRB 20267\nEinreichung neuer Dokumente\n\nGENIUS AG\nAktiengesellschaft\nWermsdorf (Sachsen)\n\nAm 30.01.2025 wurde beim Handelsregister des Amtsgerichts Leipzig die Liste der Mitglieder des Aufsichtsrats gemäß § 106 AktG eingereicht."
    },
    {
      "date": "2025-02-03",
      "id": "100301",
      "original_text": "Einreichung neuer Dokumente\nSachsen Amtsgericht Chemnitz HRB 31408\nVSTR AG Rodewisch – Rodewisch",
      "type": "Einreichung neuer Dokumente",
      "state": "Sachsen",
      "amtsgericht": "Amtsgericht Chemnitz",
      "registernummer": "HRB 31408",
      "registerart": "HRB",
      "company_name": "VSTR AG Rodewisch",
      "company_seat": "Rodewisch",
      "details": "03.02.2025 (Bekanntmachungsdatum)\n\nSachsen Amtsgericht Chemnitz HRB 31408\nEinreichung neuer Dokumente\n\nVSTR AG Rodewisch\nAktiengesellschaft\nRodewisch\n\nAm 30.01.2025 wurde beim Handelsregister des Amtsgerichts Chemnitz die Liste der Mitglieder des Aufsichtsrats gemäß § 106 AktG eingereicht."
    },
    {
      "date": "2025-02-03",
      "id": "100302",
      "original_text": "Registerbekanntmachung nach dem Umwandlungsgesetz\nSachsen Amtsgericht Dresden HRB 6016\nStadtgut Görlitz GmbH – Görlitz",
      "type": "Registerbekanntmachung nach dem Umwandlungsgesetz",
      "state": "Sachsen",
      "amtsgericht": "Amtsgericht Dresden",
      "registernummer": "HRB 6016",
      "registerart": "HRB",
      "company_name": "Stadtgut Görlitz GmbH",
      "company_seat": "Görlitz",
      "details": "03.02.2025 (Bekanntmachungsdatum)\n\nSachsen Amtsgericht Dresden HRB 6016\nRegisterbekanntmachung nach dem Umwandlungsgesetz 03.02.2025 (Eintragungsdatum)\n\nStadtgut Görlitz GmbH\nGesellschaft mit beschränkter Haftung\nGörlitz\n\nDen Gläubigern der an der Verschmelzung beteiligten Rechtsträger ist, wenn sie binnen sechs Monaten nach dem Tag, an dem die Eintragung der Verschmelzung in das Register des Sitzes desjenigen Rechtsträgers, dessen Gläubiger sie sind, nach § 19 Abs. 3 UmwG als bekannt gemacht gilt, ihren Anspruch nach Grund und Höhe in Textform anmelden, Sicherheit zu leisten, soweit sie nicht Befriedigung verlangen können. Dieses Recht steht den Gläubigern jedoch nur zu, wenn sie glaubhaft machen, dass durch die Verschmelzung die Erfüllung der Forderung gefährdet wird."
    },
    {
      "date": "2025-02-03",
      "id": "100303",
      "original_text": "Einreichung neuer Dokumente\nSachsen Amtsgericht Chemnitz HRB 10959\nFreiberger Stromversorgung GmbH (FSG) – Freiberg",
      "type": "Einreichung neuer Dokumente",
      "state": "Sachsen",
      "amtsgericht": "Amtsgericht Chemnitz",
      "registernummer": "HRB 10959",
      "registerart": "HRB",
      "company_name": "Freiberger Stromversorgung GmbH (FSG)",
      "company_seat": "Freiberg",
      "details": "03.02.2025 (Bekanntmachungsdatum)\n\nSachsen Amtsgericht Chemnitz HRB 10959\nEinreichung neuer Dokumente\n\nFreiberger Stromversorgung GmbH (FSG)\nGesellschaft mit beschränkter Haftung\nFreiberg\n\nAm 31.01.2025 wurde beim Handelsregister des Amtsgerichts Chemnitz die Liste der Mitglieder des Aufsichtsrats gemäß § 52 GmbHG eingereicht."
    },
    {
      "date": "2025-02-03",
      "id": "100304",
      "original_text": "Löschungsankündigung\nSachsen Amtsgericht Leipzig HRB 5103\nIBS Immobilien - Baubetreuung GmbH – Leipzig",
      "type": "Löschungsankündigung",
      "state": "Sachsen",
      "amtsgericht": "Amtsgericht Leipzig",
      "registernummer": "HRB 5103",
      "registerart": "HRB",
      "company_name": "IBS Immobilien - Baubetreuung GmbH",
      "company_seat": "Leipzig",
      "details": "03.02.2025 (Bekanntmachungsdatum)\n\nSachsen Amtsgericht Leipzig HRB 5103\nLöschungsankündigung 03.02.2025 (Eintragungsdatum)\n\nIBS Immobilien - Baubetreuung GmbH\nGesellschaft mit beschränkter Haftung\nLeipzig\n\nDas Registergericht beabsichtigt, die im Handelsregister eingetragene Gesellschaft von Amts wegen nach § 394 FamFG zu löschen. Die Frist zu Erhebung eines Widerspruchs gegen die beabsichtigte Löschung wird auf einen Monat festgesetzt."
    },
    {
      "date": "2025-02-03",
      "id": "100305",
      "original_text": "Sonstige Registerbekanntmachung\nNiedersachsen Amtsgericht Hannover HRB 214679\nMontessori Bildungshaus Hannover gGmbH – Hannover",
      "type": "Sonstige Registerbekanntmachung",
      "state": "Niedersachsen",
      "amtsgericht": "Amtsgericht Hannover",
      "registernummer": "HRB 214679",
      "registerart": "HRB",
      "company_name": "Montessori Bildungshaus Hannover gGmbH",
      "company_seat": "Hannover",
      "details": "03.02.2025 (Bekanntmachungsdatum)\n\nNiedersachsen Amtsgericht Hannover HRB 214679\nSonstige Registerbekanntmachung 03.02.2025 (Eintragungsdatum)\n\nMontessori Bildungshaus Hannover gGmbH\nGesellschaft mit beschränkter Haftung\nHannover\n\nDie Liste der Mitglieder des Aufsichtsrats wurde beim Registergericht eingereicht."
    },
    {
      "date": "2025-02-03",
      "id": "100306",
      "original_text": "Registerbekanntmachung nach dem Umwandlungsgesetz\nNiedersachsen Amtsgericht Tostedt HRA 202910\nLabor Dr. Helle für Lebens- und Arzneimittelforschung GmbH & Co. KG – Geestland - Bad Bederkesa",
      "type": "Registerbekanntmachung nach dem Umwandlungsgesetz",
      "state": "Niedersachsen",
      "amtsgericht": "Amtsgericht Tostedt",
      "registernummer": "HRA 202910",
      "registerart": "HRA",
      "company_name": "Labor Dr. Helle für Lebens- und Arzneimittelforschung GmbH & Co. KG",
      "company_seat": "Geestland - Bad Bederkesa",
      "details": "03.02.2025 (Bekanntmachungsdatum)\n\nNiedersachsen Amtsgericht Tostedt HRA 202910\nRegisterbekanntmachung nach dem Umwandlungsgesetz 03.02.2025 (Eintragungsdatum)\n\nLabor Dr. Helle für Lebens- und Arzneimittelforschung GmbH & Co. KG\nKommanditgesellschaft\nGeestland - Bad Bederkesa\n\nDen Gläubigern der an der formwechselnden Umwandlung beteiligten Rechtsträger ist, wenn sie binnen sechs Monaten nach dem Tag, an dem die Eintragung der Umwandlung in das Register des Sitzes desjenigen Rechtsträgers, dessen Gläubiger sie sind, nach § 19 Abs. 3 UmwG als bekannt gemacht gilt, ihren Anspruch nach Grund und Höhe schriftlich anmelden, Sicherheit zu leisten, soweit sie nicht Befriedigung verlangen können. Dieses Recht steht den Gläubigern jedoch nur zu, wenn sie glaubhaft machen, dass durch die formwechselnde Umwandlung die Erfüllung der Forderung gefährdet wird."
    },
    {
      "date": "2025-02-03",
      "id": "100307",
      "original_text": "Löschungsankündigung\nNiedersachsen Amtsgericht Braunschweig HRB 206310\nFreygeist Events UG (haftungsbeschränkt) – Wolfsburg",
      "type": "Löschungsankündigung",
      "state": "Niedersachsen",
      "amtsgericht": "Amtsgericht Braunschweig",
      "registernummer": "HRB 206310",
      "registerart": "HRB",
      "company_name": "Freygeist Events UG (haftungsbeschränkt)",
      "company_seat": "Wolfsburg",
      "details": "03.02.2025 (Bekanntmachungsdatum)\n\nNiedersachsen Amtsgericht Braunschweig HRB 206310\nLöschungsankündigung\n\nFreygeist Events UG (haftungsbeschränkt)\nGesellschaft mit beschränkter Haftung\nWolfsburg\n\nDas Registergericht beabsichtigt, die Gesellschaft von Amts wegen nach § 394 FamFG zu löschen. Die Frist zur Erhebung eines Widerspruchs ist auf 1 Monat ab dieser Registerbekanntmachung festgesetzt."
    },
    {
      "date": "2025-02-03",
      "id": "100308",
      "original_text": "Registerbekanntmachung nach dem Umwandlungsgesetz\nNiedersachsen Amtsgericht Tostedt HRB 211326\nDr. Helle Grundbesitz GmbH – Nordleda",
      "type": "Registerbekanntmachung nach dem Umwandlungsgesetz",
      "state": "Niedersachsen",
      "amtsgericht": "Amtsgericht Tostedt",
      "registernummer": "HRB 211326",
      "registerart": "HRB",
      "company_name": "Dr. Helle Grundbesitz GmbH",
      "company_seat": "Nordleda",
      "details": "03.02.2025 (Bekanntmachungsdatum)\n\nNiedersachsen Amtsgericht Tostedt HRB 211326\nRegisterbekanntmachung nach dem Umwandlungsgesetz 03.02.2025 (Eintragungsdatum)\n\nDr. Helle Grundbesitz GmbH\nGesellschaft mit beschränkter Haftung\nNordleda\n\nDen Gläubigern der an der formwechselnden Umwandlung beteiligten Rechtsträger ist, wenn sie binnen sechs Monaten nach dem Tag, an dem die Eintragung der Umwandlung in das Register des Sitzes desjenigen Rechtsträgers, dessen Gläubiger sie sind, nach § 19 Abs. 3 UmwG als bekannt gemacht gilt, ihren Anspruch nach Grund und Höhe schriftlich anmelden, Sicherheit zu leisten, soweit sie nicht Befriedigung verlangen können. Dieses Recht steht den Gläubigern jedoch nur zu, wenn sie glaubhaft machen, dass durch die formwechselnde Umwandlung die Erfüllung der Forderung gefährdet wird."
    },
    {
      "date": "2025-02-03",
      "id": "100309",
      "original_text": "Registerbekanntmachung nach dem Umwandlungsgesetz\nNiedersachsen Amtsgericht Lüneburg HRB 212625\nScheer Heizung und Sanitär GmbH – Bleckede",
      "type": "Registerbekanntmachung nach dem Umwandlungsgesetz",
      "state": "Niedersachsen",
      "amtsgericht": "Amtsgericht Lüneburg",
      "registernummer": "HRB 212625",
      "registerart": "HRB",
      "company_name": "Scheer Heizung und Sanitär GmbH",
      "company_seat": "Bleckede",
      "details": "03.02.2025 (Bekanntmachungsdatum)\n\nNiedersachsen Amtsgericht Lüneburg HRB 212625\nRegisterbekanntmachung nach dem Umwandlungsgesetz 03.02.2025 (Eintragungsdatum)\n\nScheer Heizung und Sanitär GmbH\nGesellschaft mit beschränkter Haftung\nBleckede\n\nDen Gläubigern der an der Ausgliederung beteiligten Rechtsträger ist, wenn sie binnen sechs Monaten nach dem Tag, an dem die Eintragung der Ausgliederung in das Register des Sitzes desjenigen Rechtsträgers, dessen Gläubiger sie sind, nach § 19 Abs. 3 UmwG als bekannt gemacht gilt, ihren Anspruch nach Grund und Höhe schriftlich anmelden, Sicherheit zu leisten, soweit sie nicht Befriedigung verlangen können. Dieses Recht steht den Gläubigern jedoch nur zu, wenn sie glaubhaft machen, dass durch die Ausgliederung die Erfüllung der Forderung gefährdet wird."
    },
    {
      "date": "2025-02-03",
      "id": "100310",
      "original_text": "Registerbekanntmachung nach dem Umwandlungsgesetz\nNiedersachsen Amtsgericht Göttingen HRB 204077\nADN Ihr Betriebsarzt GmbH – Göttingen",
      "type": "Registerbekanntmachung nach dem Umwandlungsgesetz",
      "state": "Niedersachsen",
      "amtsgericht": "Amtsgericht Göttingen",
      "registernummer": "HRB 204077",
      "registerart": "HRB",
      "company_name": "ADN Ihr Betriebsarzt GmbH",
      "company_seat": "Göttingen",
      "details": "03.02.2025 (Bekanntmachungsdatum)\n\nNiedersachsen Amtsgericht Göttingen HRB 204077\nRegisterbekanntmachung nach dem Umwandlungsgesetz 03.02.2025 (Eintragungsdatum)\n\nADN Ihr Betriebsarzt GmbH\nGesellschaft mit beschränkter Haftung\nGöttingen\n\nDen Gläubigern der an der Verschmelzung beteiligten Rechtsträger ist, wenn sie binnen sechs Monaten nach dem Tag, an dem die Eintragung der Verschmelzung in das Register des Sitzes desjenigen Rechtsträgers, dessen Gläubiger sie sind, nach § 19  Abs.  3 UmwG als bekannt gemacht gilt, ihren Anspruch nach Grund und Höhe schriftlich anmelden, Sicherheit zu leisten, soweit sie nicht Befriedigung verlangen können. Dieses Recht steht den Gläubigern jedoch nur zu, wenn sie glaubhaft machen, dass durch die Verschmelzung die Erfüllung der Forderung gefährdet wird."
    },
    {
      "date": "2025-02-03",
      "id": "100311",
      "original_text": "Registerbekanntmachung nach dem Umwandlungsgesetz\nNiedersachsen Amtsgericht Lüneburg HRA 204385\nSanitär S. Scheer e.K. – Bleckede",
      "type": "Registerbekanntmachung nach dem Umwandlungsgesetz",
      "state": "Niedersachsen",
      "amtsgericht": "Amtsgericht Lüneburg",
      "registernummer": "HRA 204385",
      "registerart": "HRA",
      "company_name": "Sanitär S. Scheer e.K.",
      "company_seat": "Bleckede",
      "details": "03.02.2025 (Bekanntmachungsdatum)\n\nNiedersachsen Amtsgericht Lüneburg HRA 204385\nRegisterbekanntmachung nach dem Umwandlungsgesetz 03.02.2025 (Eintragungsdatum)\n\nSanitär S. Scheer e.K.\nEinzelkaufmann / Einzelkauffrau\nBleckede\n\nDen Gläubigern der an der Ausgliederung beteiligten Rechtsträger ist, wenn sie binnen sechs Monaten nach dem Tag, an dem die Eintragung der Ausgliederung in das Register des Sitzes desjenigen Rechtsträgers, dessen Gläubiger sie sind, nach § 19 Abs. 3 UmwG als bekannt gemacht gilt, ihren Anspruch nach Grund und Höhe schriftlich anmelden, Sicherheit zu leisten, soweit sie nicht Befriedigung verlangen können. Dieses Recht steht den Gläubigern jedoch nur zu, wenn sie glaubhaft machen, dass durch die Ausgliederung die Erfüllung der Forderung gefährdet wird."
    },
    {
      "date": "2025-02-03",
      "id": "100312",
      "original_text": "Sonstige Registerbekanntmachung\nRheinland-Pfalz Amtsgericht Koblenz HRB 6221\nMEBEDO GmbH – Urmitz",
      "type": "Sonstige Registerbekanntmachung",
      "state": "Rheinland-Pfalz",
      "amtsgericht": "Amtsgericht Koblenz",
      "registernummer": "HRB 6221",
      "registerart": "HRB",
      "company_name": "MEBEDO GmbH",
      "company_seat": "Urmitz",
      "details": "03.02.2025 (Bekanntmachungsdatum)\n\nRheinland-Pfalz Amtsgericht Koblenz HRB 6221\nSonstige Registerbekanntmachung 03.02.2025 (Eintragungsdatum)\n\nMEBEDO GmbH\nGesellschaft mit beschränkter Haftung\nUrmitz\n\nAls nicht eingetragen wird veröffentlicht: Den Gläubigern der Gesellschaft, deren Forderungen begründet worden sind, bevor die Eintragung der Beendigung desGewinnabführungsvertrages in das Handelsregister nach § 10 des Handelsgesetzbuches als bekanntgemacht gilt, hat der andere Vertragsteil Sicherheit zu leisten, wenn sie sich binnen sechs Monaten nach der Bekanntmachung der Eintragung zu diesem Zweck bei ihm melden."
    },
    {
      "date": "2025-02-03",
      "id": "100313",
      "original_text": "Registerbekanntmachung nach dem Umwandlungsgesetz\nRheinland-Pfalz Amtsgericht Mainz HRB 49574\nAirive GmbH – Mainz",
      "type": "Registerbekanntmachung nach dem Umwandlungsgesetz",
      "state": "Rheinland-Pfalz",
      "amtsgericht": "Amtsgericht Mainz",
      "registernummer": "HRB 49574",
      "registerart": "HRB",
      "company_name": "Airive GmbH",
      "company_seat": "Mainz",
      "details": "03.02.2025 (Bekanntmachungsdatum)\n\nRheinland-Pfalz Amtsgericht Mainz HRB 49574\nRegisterbekanntmachung nach dem Umwandlungsgesetz 03.02.2025 (Eintragungsdatum)\n\nAirive GmbH\nGesellschaft mit beschränkter Haftung\nMainz\n\nAls nicht eingetragen wird veröffentlicht: Den Gläubigern der an der Verschmelzung beteiligten Rechtsträger ist, wenn sie binnen sechs Monaten nach dem Tag, an dem die Eintragung der Verschmelzung in das Register des Sitzes desjenigen Rechtsträgers, dessen Gläubiger sie sind, nach § 19 Abs. 3 UmwG als bekannt gemacht gilt, ihren Anspruch nach Grund und Höhe schriftlich anmelden, Sicherheit zu leisten, soweit sie nicht Befriedigung verlangen können. Dieses Recht steht den Gläubigern jedoch nur zu, wenn sie glaubhaft machen, dass durch die Verschmelzung die Erfüllung der Forderung gefährdet wird."
    },
    {
      "date": "2025-02-03",
      "id": "100314",
      "original_text": "Löschungsankündigung\nRheinland-Pfalz Amtsgericht Landau HRB 31051\nExklusiv K & M UG (haftungsbeschränkt) – 76887 Bad Bergzabern",
      "type": "Löschungsankündigung",
      "state": "Rheinland-Pfalz",
      "amtsgericht": "Amtsgericht Landau",
      "registernummer": "HRB 31051",
      "registerart": "HRB",
      "company_name": "Exklusiv K & M UG (haftungsbeschränkt)",
      "company_seat": "76887 Bad Bergzabern",
      "details": "03.02.2025 (Bekanntmachungsdatum)\n\nRheinland-Pfalz Amtsgericht Landau HRB 31051\nLöschungsankündigung\n\nExklusiv K & M UG (haftungsbeschränkt)\nGesellschaft mit beschränkter Haftung\n76887 Bad Bergzabern\n\nDas Registergericht beabsichtigt die Gesellschaft von Amts wegen nach § 394 FamFG zu löschen. Die Frist zur Erhebung eines Widerspruchs ist auf einen Monat festgesetzt."
    },
    {
      "date": "2025-02-03",
      "id": "100315",
      "original_text": "Registerbekanntmachung nach dem Umwandlungsgesetz\nBremen Amtsgericht Bremen HRB 29972\nFunke Bremen GmbH – Bremen",
      "type": "Registerbekanntmachung nach dem Umwandlungsgesetz",
      "state": "Bremen",
      "amtsgericht": "Amtsgericht Bremen",
      "registernummer": "HRB 29972",
      "registerart": "HRB",
      "company_name": "Funke Bremen GmbH",
      "company_seat": "Bremen",
      "details": "03.02.2025 (Bekanntmachungsdatum)\n\nBremen Amtsgericht Bremen HRB 29972\nRegisterbekanntmachung nach dem Umwandlungsgesetz 31.01.2025 (Eintragungsdatum)\n\nFunke Bremen GmbH\nGesellschaft mit beschränkter Haftung\nBremen\n\nZu Eintragungsnummer 10 vom 31.01.2025 wird als nicht eingetragen veröffentlicht:\nDen Gläubigern der an der Verschmelzung beteiligten Rechtsträger ist, wenn sie binnen sechs Monaten nach dem Tag, an dem die Eintragung der Verschmelzung in das Register des Sitzes desjenigen Rechtsträgers, dessen Gläubiger sie sind, als bekannt gemacht gilt, ihren Anspruch nach Grund und Höhe schriftlich anmelden, Sicherheit zu leisten, soweit sie nicht Befriedigung verlangen können. Dieses Recht steht den Gläubigern jedoch nur zu, wenn sie glaubhaft machen, dass durch die Verschmelzung die Erfüllung ihrer Forderung gefährdet wird. Das Recht, Sicherheitsleistung zu verlangen, steht Gläubigern nicht zu, die im Falle der Insolvenz ein Recht auf vorzugsweise Befriedigung aus einer Deckungsmasse haben, die nach gesetzlicher Vorschrift zu ihrem Schutz errichtet und staatlich überwacht ist."
    },
    {
      "date": "2025-02-03",
      "id": "100316",
      "original_text": "Einreichung neuer Dokumente\nNordrhein-Westfalen Amtsgericht Bielefeld HRB 44181\nDr. Oetker Beteiligungen SE – Bielefeld",
      "type": "Einreichung neuer Dokumente",
      "state": "Nordrhein-Westfalen",
      "amtsgericht": "Amtsgericht Bielefeld",
      "registernummer": "HRB 44181",
      "registerart": "HRB",
      "company_name": "Dr. Oetker Beteiligungen SE",
      "company_seat": "Bielefeld",
      "details": "03.02.2025 (Bekanntmachungsdatum)\n\nNordrhein-Westfalen Amtsgericht Bielefeld HRB 44181\nEinreichung neuer Dokumente 03.02.2025 (Eintragungsdatum)\n\nDr. Oetker Beteiligungen SE\nEuropäische Aktiengesellschaft (SE)\nBielefeld\n\nDem Registergericht ist eine Liste der Mitglieder des Aufsichtsrates eingereicht worden."
    },
    {
      "date": "2025-02-03",
      "id": "100317",
      "original_text": "Sonstige Registerbekanntmachung\nNordrhein-Westfalen Amtsgericht Bonn HRB 21897\nDeutsche Post DHL Express Holding GmbH – Bonn",
      "type": "Sonstige Registerbekanntmachung",
      "state": "Nordrhein-Westfalen",
      "amtsgericht": "Amtsgericht Bonn",
      "registernummer": "HRB 21897",
      "registerart": "HRB",
      "company_name": "Deutsche Post DHL Express Holding GmbH",
      "company_seat": "Bonn",
      "details": "03.02.2025 (Bekanntmachungsdatum)\n\nNordrhein-Westfalen Amtsgericht Bonn HRB 21897\nSonstige Registerbekanntmachung 03.02.2025 (Eintragungsdatum)\n\nDeutsche Post DHL Express Holding GmbH\nGesellschaft mit beschränkter Haftung\nBonn\n\nAls nicht eingetragen wird veröffentlicht: Den Gläubigern der Gesellschaft, deren Forderungen begründet worden sind bevor die Eintragung der Beendigung des Beherrschungs- und Gewinnabführungsvertrages  in das Handelsregister nach § 10 des Handelsgesetzbuches als bekanntgemacht gilt, hat der andere Vertragsteil Sicherheit zu leisten, wenn sie sich binnen sechs Monaten nach der Bekanntmachung der Eintragung zu diesem Zweck bei ihm melden."
    },
    {
      "date": "2025-02-03",
      "id": "100318",
      "original_text": "Löschungsankündigung\nNordrhein-Westfalen Amtsgericht Dortmund HRB 35496\nHais Transport GmbH – Lünen",
      "type": "Löschungsankündigung",
      "state": "Nordrhein-Westfalen",
      "amtsgericht": "Amtsgericht Dortmund",
      "registernummer": "HRB 35496",
      "registerart": "HRB",
      "company_name": "Hais Transport GmbH",
      "company_seat": "Lünen",
      "details": "03.02.2025 (Bekanntmachungsdatum)\n\nNordrhein-Westfalen Amtsgericht Dortmund HRB 35496\nLöschungsankündigung\n\nHais Transport GmbH\nGesellschaft mit beschränkter Haftung\nLünen\n\nDas Registergericht beabsichtigt die Gesellschaft von Amts wegen nach § 394 FamFG zu löschen. Die Frist zur Erhebung eines Widerspruchs ist auf #DV.Fr(Text=\"Bitte wählen Sie die Widerspruchsfrist aus!\",Eingabe=\"einen Monat\",\"zwei Monate\",\"drei Monate\",\"#insert(Text=\"Freitext\")\"|\"freier Text\") festgesetzt."
    },
    {
      "date": "2025-02-03",
      "id": "100319",
      "original_text": "Registerbekanntmachung nach dem Umwandlungsgesetz\nNordrhein-Westfalen Amtsgericht Siegen VR 5621 früher Amtsgericht Olpe\nVerein zur Förderung eines christlichen Kindergartens in Hünsborn e.V. – Wenden-Hünsborn",
      "type": "Registerbekanntmachung nach dem Umwandlungsgesetz",
      "state": "Nordrhein-Westfalen",
      "amtsgericht": "Amtsgericht Siegen",
      "registernummer": "VR 5621",
      "registerart": "VR",
      "company_name": "Verein zur Förderung eines christlichen Kindergartens in Hünsborn e.V.",
      "company_seat": "Wenden-Hünsborn",
      "former_amtsgericht": "Olpe",
      "details": "03.02.2025 (Bekanntmachungsdatum)\n\nNordrhein-Westfalen Amtsgericht Siegen VR 5621 früher Amtsgericht Olpe\nRegisterbekanntmachung nach dem Umwandlungsgesetz 03.02.2025 (Eintragungsdatum)\n\nVerein zur Förderung eines christlichen Kindergartens in Hünsborn e.V.\neingetragener Verein\nWenden-Hünsborn\n\nDen Gläubigern der an der Verschmelzung beteiligten Rechtsträger ist, wenn sie binnen sechs Monaten nach dem Tag, an dem die Eintragung der Verschmelzung in das Register des Sitzes derjenigen Rechtsträger deren Gläubiger sie sind, nach § 19 Absatz 3 UmwG als bekanntgemacht gilt, ihren Anspruch nach Grund und Höhe schriftlich anmelden, Sicherheit zu leisten, soweit sie nicht Befriedigung verlangen können. Dieses Recht steht den Gläubigern jedoch nur zu, wenn sie glaubhaft machen, dass durch die Verschmelzung die Erfüllung ihrer Forderung gefährdet wird."
    },
    {
      "date": "2025-02-03",
      "id": "100320",
      "original_text": "Registerbekanntmachung nach dem Umwandlungsgesetz\nNordrhein-Westfalen Amtsgericht Siegen VR 6491\nOttfinger Dorfnest e.V. – Wenden-Ottfingen",
      "type": "Registerbekanntmachung nach dem Umwandlungsgesetz",
      "state": "Nordrhein-Westfalen",
      "amtsgericht": "Amtsgericht Siegen",
      "registernummer": "VR 6491",
      "registerart": "VR",
      "company_name": "Ottfinger Dorfnest e.V.",
      "company_seat": "Wenden-Ottfingen",
      "details": "03.02.2025 (Bekanntmachungsdatum)\n\nNordrhein-Westfalen Amtsgericht Siegen VR 6491\nRegisterbekanntmachung nach dem Umwandlungsgesetz 03.02.2025 (Eintragungsdatum)\n\nOttfinger Dorfnest e.V.\neingetragener Verein\nWenden-Ottfingen\n\nDen Gläubigern der an der Verschmelzung beteiligten Rechtsträger ist, wenn sie binnen sechs Monaten nach dem Tag, an dem die Eintragung der Verschmelzung in das Register des Sitzes derjenigen Rechtsträger deren Gläubiger sie sind, nach § 19 Absatz 3 UmwG als bekanntgemacht gilt, ihren Anspruch nach Grund und Höhe schriftlich anmelden, Sicherheit zu leisten, soweit sie nicht Befriedigung verlangen können. Dieses Recht steht den Gläubigern jedoch nur zu, wenn sie glaubhaft machen, dass durch die Verschmelzung die Erfüllung ihrer Forderung gefährdet wird."
    },
    {
      "date": "2025-02-03",
      "id": "100321",
      "original_text": "Einreichung neuer Dokumente\nNordrhein-Westfalen Amtsgericht Essen HRB 20227\nEvonik Operations GmbH – Essen",
      "type": "Einreichung neuer Dokumente",
      "state": "Nordrhein-Westfalen",
      "amtsgericht": "Amtsgericht Essen",
      "registernummer": "HRB 20227",
      "registerart": "HRB",
      "company_name": "Evonik Operations GmbH",
      "company_seat": "Essen",
      "details": "03.02.2025 (Bekanntmachungsdatum)\n\nNordrhein-Westfalen Amtsgericht Essen HRB 20227\nEinreichung neuer Dokumente\n\nEvonik Operations GmbH\nGesellschaft mit beschränkter Haftung\nEssen\n\nDem Registergericht ist eine neue Liste der Mitglieder des Aufsichtsrates eingereicht worden."
    },
    {
      "date": "2025-02-03",
      "id": "100322",
      "original_text": "Löschungsankündigung\nNordrhein-Westfalen Amtsgericht Neuss HRB 20672\nGrand Classic Meerbusch GmbH – Meerbusch",
      "type": "Löschungsankündigung",
      "state": "Nordrhein-Westfalen",
      "amtsgericht": "Amtsgericht Neuss",
      "registernummer": "HRB 20672",
      "registerart": "HRB",
      "company_name": "Grand Classic Meerbusch GmbH",
      "company_seat": "Meerbusch",
      "details": "03.02.2025 (Bekanntmachungsdatum)\n\nNordrhein-Westfalen Amtsgericht Neuss HRB 20672\nLöschungsankündigung\n\nGrand Classic Meerbusch GmbH\nGesellschaft mit beschränkter Haftung\nMeerbusch\n\nEs ist beabsichtigt, die Gesellschaft wegen Vermögenslosigkeit aufgrund des § 394 Abs. 1 FamFG zu löschen. Frist zur Geltendmachung eines Widerspruchs: 1 Monat.\n\nRechtsbehelfsbelehrung:\nGegen diese Verfügung können Sie Widerspruch einlegen.\nDer Widerspruch ist bei dem Amtsgericht Neuss - Registergericht -, Breite Str. 48, 41460 Neuss schriftlich in deutscher Sprache oder zur Niederschrift der Geschäftsstelle einzulegen.\nDer Widerspruch kann auch zur Niederschrift der Geschäftsstelle eines jeden Amtsgerichtes abgegeben werden.\nDie Einlegung ist auch durch Übertragung eines elektronischen Dokuments an die elektronische Poststelle des Gerichts möglich. Das elektronische Dokument muss für die Bearbeitung durch das Gericht geeignet und mit einer qualifizierten elektronischen Signatur der verantwortenden Person versehen sein oder von der verantwortenden Person signiert und auf einem sicheren Übermittlungsweg gemäß § 130a ZPO nach näherer Maßgabe der Verordnung über die technischen Rahmenbedingungen des elektronischen Rechtsverkehrs und über das besondere elektronische Behördenpostfach (BGBl. I, S.3803) eingereicht werden. Weitere Informationen erhalten Sie auf der Internetseite www.justiz.de.\nDer Widerspruch muss spätestens innerhalb der gesetzten Frist nach der schriftlichen Bekanntgabe der Verfügung bei dem Amtsgericht - Registergericht - Neuss eingegangen sein. Dies gilt auch dann, wenn der Widerspruch zur Niederschrift der Geschäftsstelle eines anderen Amtsgerichtes abgegeben wurde. Die Frist beginnt mit der schriftlichen Bekanntgabe der Verfügung. Die Bekanntgabe ist entweder durch Zustellung oder am dritten Tage nach Aufgabe zur Post bewirkt. Fällt das Ende der Frist auf einen Sonntag, einen allgemeinen Feiertag oder Sonnabend, so endet die Frist mit Ablauf des nächsten Werktages.\n\nDer Widerspruch muss die Bezeichnung der angefochtenen Verfügung sowie die Erklärung enthalten, dass Widerspruch gegen diese Verfügung eingelegt wird. Er ist zu unterzeichnen und soll begründet werden."
    },
    {
      "date": "2025-02-03",
      "id": "100323",
      "original_text": "Sonstige Registerbekanntmachung\nNordrhein-Westfalen Amtsgericht Hamm HRB 5980\nISR-Netcom GmbH – Kamen",
      "type": "Sonstige Registerbekanntmachung",
      "state": "Nordrhein-Westfalen",
      "amtsgericht": "Amtsgericht Hamm",
      "registernummer": "HRB 5980",
      "registerart": "HRB",
      "company_name": "ISR-Netcom GmbH",
      "company_seat": "Kamen",
      "details": "03.02.2025 (Bekanntmachungsdatum)\n\nNordrhein-Westfalen Amtsgericht Hamm HRB 5980\nSonstige Registerbekanntmachung\n\nISR-Netcom GmbH\nGesellschaft mit beschränkter Haftung\nKamen\n\nDem Registergericht ist eine neue Liste der Mitglieder des Aufsichtsrates eingereicht worden."
    },
    {
      "date": "2025-02-03",
      "id": "100324",
      "original_text": "Registerbekanntmachung nach dem Umwandlungsgesetz\nNordrhein-Westfalen Amtsgericht Düsseldorf HRB 107892\nSpin Zero GmbH – Düsseldorf",
      "type": "Registerbekanntmachung nach dem Umwandlungsgesetz",
      "state": "Nordrhein-Westfalen",
      "amtsgericht": "Amtsgericht Düsseldorf",
      "registernummer": "HRB 107892",
      "registerart": "HRB",
      "company_name": "Spin Zero GmbH",
      "company_seat": "Düsseldorf",
      "details": "03.02.2025 (Bekanntmachungsdatum)\n\nNordrhein-Westfalen Amtsgericht Düsseldorf HRB 107892\nRegisterbekanntmachung nach dem Umwandlungsgesetz 03.02.2025 (Eintragungsdatum)\n\nSpin Zero GmbH\nGesellschaft mit beschränkter Haftung\nDüsseldorf\n\nDen Gläubigern der an der Abspaltung beteiligten Rechtsträger ist, wenn sie binnen sechs Monaten nach dem Tag, an dem die Eintragung der Abspaltung in das Register des Sitzes desjenigen Rechtsträgers, dessen Gläubiger sie sind, nach § 19 Absatz 3 UmwG als bekanntgemacht gilt, ihren Anspruch nach Grund und Höhe schriftlich anmelden, Sicherheit zu leisten, soweit sie nicht Befriedigung verlangen können. Dieses Recht steht den Gläubigern jedoch nur zu, wenn sie glaubhaft machen, dass durch die Abspaltung die Erfüllung ihrer Forderung gefährdet wird."
    },
    {
      "date": "2025-02-03",
      "id": "100325",
      "original_text": "Registerbekanntmachung nach dem Umwandlungsgesetz\nNordrhein-Westfalen Amtsgericht Siegen VR 5356 früher Amtsgericht Olpe\nKindergartenverein Wenden-AItenhof e.V. – Wenden-Altenhof",
      "type": "Registerbekanntmachung nach dem Umwandlungsgesetz",
      "state": "Nordrhein-Westfalen",
      "amtsgericht": "Amtsgericht Siegen",
      "registernummer": "VR 5356",
      "registerart": "VR",
      "company_name": "Kindergartenverein Wenden-AItenhof e.V.",
      "company_seat": "Wenden-Altenhof",
      "former_amtsgericht": "Olpe",
      "details": "03.02.2025 (Bekanntmachungsdatum)\n\nNordrhein-Westfalen Amtsgericht Siegen VR 5356 früher Amtsgericht Olpe\nRegisterbekanntmachung nach dem Umwandlungsgesetz 03.02.2025 (Eintragungsdatum)\n\nKindergartenverein Wenden-AItenhof e.V.\neingetragener Verein\nWenden-Altenhof\n\nDen Gläubigern der an der Verschmelzung beteiligten Rechtsträger ist, wenn sie binnen sechs Monaten nach dem Tag, an dem die Eintragung der Verschmelzung in das Register des Sitzes derjenigen Rechtsträger deren Gläubiger sie sind, nach § 19 Absatz 3 UmwG als bekanntgemacht gilt, ihren Anspruch nach Grund und Höhe schriftlich anmelden, Sicherheit zu leisten, soweit sie nicht Befriedigung verlangen können. Dieses Recht steht den Gläubigern jedoch nur zu, wenn sie glaubhaft machen, dass durch die Verschmelzung die Erfüllung ihrer Forderung gefährdet wird."
    },
    {
      "date": "2025-02-03",
      "id": "100326",
      "original_text": "Einreichung neuer Dokumente\nNordrhein-Westfalen Amtsgericht Münster HRB 11178\nDr. Maasjost & Collegen AG – Münster",
      "type": "Einreichung neuer Dokumente",
      "state": "Nordrhein-Westfalen",
      "amtsgericht": "Amtsgericht Münster",
      "registernummer": "HRB 11178",
      "registerart": "HRB",
      "company_name": "Dr. Maasjost & Collegen AG",
      "company_seat": "Münster",
      "details": "03.02.2025 (Bekanntmachungsdatum)\n\nNordrhein-Westfalen Amtsgericht Münster HRB 11178\nEinreichung neuer Dokumente\n\nDr. Maasjost & Collegen AG\nAktiengesellschaft\nMünster\n\nDem Registergericht ist eine neue Liste der Mitglieder des Aufsichtsrates eingereicht worden."
    },
    {
      "date": "2025-02-03",
      "id": "100327",
      "original_text": "Löschungsankündigung\nNordrhein-Westfalen Amtsgericht Düsseldorf HRB 84756\nHarwez GmbH – Düsseldorf",
      "type": "Löschungsankündigung",
      "state": "Nordrhein-Westfalen",
      "amtsgericht": "Amtsgericht Düsseldorf",
      "registernummer": "HRB 84756",
      "registerart": "HRB",
      "company_name": "Harwez GmbH",
      "company_seat": "Düsseldorf",
      "details": "03.02.2025 (Bekanntmachungsdatum)\n\nNordrhein-Westfalen Amtsgericht Düsseldorf HRB 84756\nLöschungsankündigung\n\nHarwez GmbH\nGesellschaft mit beschränkter Haftung\nDüsseldorf\n\nDas Registergericht beabsichtigt die Gesellschaft von Amts wegen nach § 394 FamFG zu löschen. Die Frist zur Erhebung eines Widerspruchs ist auf einen Monat festgesetzt.\n\nRechtsbehelfsbelehrung:\nDas Widerspruchsrecht steht jedem zu, der an der Unterlassung der Löschung ein berechtigtes Interesse hat. Der Widerspruch ist bei dem Amtsgericht Düsseldorf -Registergericht-, Werdener Straße 1, 40227 Düsseldorf schriftlich in deutscher Sprache oder zur Niederschrift der Geschäftsstelle einzulegen. Der Widerspruch kann auch zur Niederschrift der Geschäftsstelle eines jeden Amtsgerichtes abgegeben werden. Die Einlegung ist auch durch Übertragung eines elektronischen Dokuments an die elektronische Poststelle des Gerichts möglich. Das elektronische Dokument muss für die Bearbeitung durch das Gericht geeignet und mit einer qualifizierten elektronischen Signatur der verantwortenden Person versehen sein oder von der verantwortenden Person signiert und auf einem sicheren Übermittlungsweg gemäß § 130a ZPO nach näherer Maßgabe der Verordnung über die technischen Rahmenbedingungen des elektronischen Rechtsverkehrs und über das besondere elektronische Behördenpostfach (BGBl. I, S.3803) eingereicht werden. Weitere Informationen erhalten Sie auf der Internetseite www.justiz.de.\nDer Widerspruch muss spätestens innerhalb der gesetzten Frist nach dem Datum der Bekanntmachung der Löschungsankündigung bei dem Amtsgericht - Registergericht - Düsseldorf eingegangen sein.  Dies gilt auch dann, wenn der Widerspruch zur Niederschrift der Geschäftsstelle eines anderen Amtsgerichtes abgegeben wurde. Die Frist beginnt mit dem Tage der Bekanntmachung der Löschungsankündigung in dem für die Bekanntmachung der Eintragungen in das Handelsregister bestimmten elektronischen Informations- und Kommunikationssystem nach § 10 des Handelsgesetzbuches. Fällt das Ende der Frist auf einen Sonntag, einen allgemeinen Feiertag oder Sonnabend, so endet die Frist mit Ablauf des nächsten Werktages.\nDer Widerspruch muss die Bezeichnung der angefochtenen Löschungsankündigung sowie die Erklärung enthalten, dass Widerspruch gegen diese Löschungsankündigung eingelegt wird. Er ist zu unterzeichnen und soll begründet werden."
    },
    {
      "date": "2025-02-03",
      "id": "100328",
      "original_text": "Löschungsankündigung\nNordrhein-Westfalen Amtsgericht Düsseldorf HRB 96707\nKarl UG (haftungsbeschränkt) – Düsseldorf",
      "type": "Löschungsankündigung",
      "state": "Nordrhein-Westfalen",
      "amtsgericht": "Amtsgericht Düsseldorf",
      "registernummer": "HRB 96707",
      "registerart": "HRB",
      "company_name": "Karl UG (haftungsbeschränkt)",
      "company_seat": "Düsseldorf",
      "details": "03.02.2025 (Bekanntmachungsdatum)\n\nNordrhein-Westfalen Amtsgericht Düsseldorf HRB 96707\nLöschungsankündigung\n\nKarl UG (haftungsbeschränkt)\nGesellschaft mit beschränkter Haftung\nDüsseldorf\n\nDas Registergericht beabsichtigt die Gesellschaft von Amts wegen nach § 394 FamFG zu löschen. Die Frist zur Erhebung eines Widerspruchs ist auf 3 Wochen festgesetzt.\n\nRechtsbehelfsbelehrung:\nDas Widerspruchsrecht steht jedem zu, der an der Unterlassung der Löschung ein berechtigtes Interesse hat. Der Widerspruch ist bei dem Amtsgericht Düsseldorf -Registergericht-, Werdener Straße 1, 40227 Düsseldorf schriftlich in deutscher Sprache oder zur Niederschrift der Geschäftsstelle einzulegen. Der Widerspruch kann auch zur Niederschrift der Geschäftsstelle eines jeden Amtsgerichtes abgegeben werden. Die Einlegung ist auch durch Übertragung eines elektronischen Dokuments an die elektronische Poststelle des Gerichts möglich. Das elektronische Dokument muss für die Bearbeitung durch das Gericht geeignet und mit einer qualifizierten elektronischen Signatur der verantwortenden Person versehen sein oder von der verantwortenden Person signiert und auf einem sicheren Übermittlungsweg gemäß § 130a ZPO nach näherer Maßgabe der Verordnung über die technischen Rahmenbedingungen des elektronischen Rechtsverkehrs und über das besondere elektronische Behördenpostfach (BGBl. I, S.3803) eingereicht werden. Weitere Informationen erhalten Sie auf der Internetseite www.justiz.de.\nDer Widerspruch muss spätestens innerhalb der gesetzten Frist nach dem Datum der Bekanntmachung der Löschungsankündigung bei dem Amtsgericht - Registergericht - Düsseldorf eingegangen sein.  Dies gilt auch dann, wenn der Widerspruch zur Niederschrift der Geschäftsstelle eines anderen Amtsgerichtes abgegeben wurde. Die Frist beginnt mit dem Tage der Bekanntmachung der Löschungsankündigung in dem für die Bekanntmachung der Eintragungen in das Handelsregister bestimmten elektronischen Informations- und Kommunikationssystem nach § 10 des Handelsgesetzbuches. Fällt das Ende der Frist auf einen Sonntag, einen allgemeinen Feiertag oder Sonnabend, so endet die Frist mit Ablauf des nächsten Werktages.\nDer Widerspruch muss die Bezeichnung der angefochtenen Löschungsankündigung sowie die Erklärung enthalten, dass Widerspruch gegen diese Löschungsankündigung eingelegt wird. Er ist zu unterzeichnen und soll begründet werden."
    },
    {
      "date": "2025-02-03",
      "id": "100329",
      "original_text": "Registerbekanntmachung nach dem Umwandlungsgesetz\nNordrhein-Westfalen Amtsgericht Siegen VR 6903\nWendsche Kinder e.V, – Wenden-Hünsborn",
      "type": "Registerbekanntmachung nach dem Umwandlungsgesetz",
      "state": "Nordrhein-Westfalen",
      "amtsgericht": "Amtsgericht Siegen",
      "registernummer": "VR 6903",
      "registerart": "VR",
      "company_name": "Wendsche Kinder e.V,",
      "company_seat": "Wenden-Hünsborn",
      "details": "03.02.2025 (Bekanntmachungsdatum)\n\nNordrhein-Westfalen Amtsgericht Siegen VR 6903\nRegisterbekanntmachung nach dem Umwandlungsgesetz 03.02.2025 (Eintragungsdatum)\n\nWendsche Kinder e.V,\neingetragener Verein\nWenden-Hünsborn\n\nDen Gläubigern der an der Verschmelzung beteiligten Rechtsträger ist, wenn sie binnen sechs Monaten nach dem Tag, an dem die Eintragung der Verschmelzung in das Register des Sitzes derjenigen Rechtsträger deren Gläubiger sie sind, nach § 19 Absatz 3 UmwG als bekanntgemacht gilt, ihren Anspruch nach Grund und Höhe schriftlich anmelden, Sicherheit zu leisten, soweit sie nicht Befriedigung verlangen können. Dieses Recht steht den Gläubigern jedoch nur zu, wenn sie glaubhaft machen, dass durch die Verschmelzung die Erfüllung ihrer Forderung gefährdet wird."
    },
    {
      "date": "2025-02-03",
      "id": "100330",
      "original_text": "Registerbekanntmachung nach dem Umwandlungsgesetz\nNordrhein-Westfalen Amtsgericht Duisburg HRA 13533\nMathias Quint QHSE e.K. – Duisburg",
      "type": "Registerbekanntmachung nach dem Umwandlungsgesetz",
      "state": "Nordrhein-Westfalen",
      "amtsgericht": "Amtsgericht Duisburg",
      "registernummer": "HRA 13533",
      "registerart": "HRA",
      "company_name": "Mathias Quint QHSE e.K.",
      "company_seat": "Duisburg",
      "details": "03.02.2025 (Bekanntmachungsdatum)\n\nNordrhein-Westfalen Amtsgericht Duisburg HRA 13533\nRegisterbekanntmachung nach dem Umwandlungsgesetz 03.02.2025 (Eintragungsdatum)\n\nMathias Quint QHSE e.K.\nEinzelkaufmann / Einzelkauffrau\nDuisburg\n\nDie Gesellschaft hat Gläubigern, deren Forderungen vor dieser Bekanntmachung begründet worden sind, Sicherheit zu leisten, soweit sie nicht Befriedigung verlangen können, wenn sie sich binnen sechs Monaten zu diesem Zweck melden."
    },
    {
      "date": "2025-02-03",
      "id": "100331",
      "original_text": "Löschungsankündigung\nNordrhein-Westfalen Amtsgericht Köln HRB 104979\nL&H Logistic GmbH – Bergisch Gladbach",
      "type": "Löschungsankündigung",
      "state": "Nordrhein-Westfalen",
      "amtsgericht": "Amtsgericht Köln",
      "registernummer": "HRB 104979",
      "registerart": "HRB",
      "company_name": "L&H Logistic GmbH",
      "company_seat": "Bergisch Gladbach",
      "details": "03.02.2025 (Bekanntmachungsdatum)\n\nNordrhein-Westfalen Amtsgericht Köln HRB 104979\nLöschungsankündigung\n\nL&H Logistic GmbH\nGesellschaft mit beschränkter Haftung\nBergisch Gladbach\n\nDas Registergericht beabsichtigt die Gesellschaft von Amts wegen nach § 394 FamFG zu löschen. Die Frist zur Erhebung eines Widerspruchs ist auf zwei Monate festgesetzt."
    },
    {
      "date": "2025-02-03",
      "id": "100332",
      "original_text": "Einreichung neuer Dokumente\nNordrhein-Westfalen Amtsgericht Düsseldorf HRB 37996\nITERGO Informationstechnologie GmbH – Düsseldorf",
      "type": "Einreichung neuer Dokumente",
      "state": "Nordrhein-Westfalen",
      "amtsgericht": "Amtsgericht Düsseldorf",
      "registernummer": "HRB 37996",
      "registerart": "HRB",
      "company_name": "ITERGO Informationstechnologie GmbH",
      "company_seat": "Düsseldorf",
      "details": "03.02.2025 (Bekanntmachungsdatum)\n\nNordrhein-Westfalen Amtsgericht Düsseldorf HRB 37996\nEinreichung neuer Dokumente\n\nITERGO Informationstechnologie GmbH\nGesellschaft mit beschränkter Haftung\nDüsseldorf\n\nDem Registergericht ist eine neue Liste der Mitglieder des Aufsichtsrates eingereicht worden."
    },
    {
      "date": "2025-02-03",
      "id": "100333",
      "original_text": "Registerbekanntmachung nach dem Umwandlungsgesetz\nNordrhein-Westfalen Amtsgericht Bochum HRB 16260\nDeutsche Edelstahlwerke Services GmbH – Witten",
      "type": "Registerbekanntmachung nach dem Umwandlungsgesetz",
      "state": "Nordrhein-Westfalen",
      "amtsgericht": "Amtsgericht Bochum",
      "registernummer": "HRB 16260",
      "registerart": "HRB",
      "company_name": "Deutsche Edelstahlwerke Services GmbH",
      "company_seat": "Witten",
      "details": "03.02.2025 (Bekanntmachungsdatum)\n\nNordrhein-Westfalen Amtsgericht Bochum HRB 16260\nRegisterbekanntmachung nach dem Umwandlungsgesetz 31.01.2025 (Eintragungsdatum)\n\nDeutsche Edelstahlwerke Services GmbH\nGesellschaft mit beschränkter Haftung\nWitten\n\nAls nicht eingetragen wird veröffentlicht: Den Gläubigern der Gesellschaft, deren Forderungen begründet worden sind bevor die Eintragung der Beendigung des Beherrschungsvertrages / Gewinnabführungsvertrages in das Handelsregister nach § 10 des Handelsgesetzbuches als bekanntgemacht gilt, hat der andere Vertragsteil Sicherheit zu leisten, wenn sie sich binnen sechs Monaten nach der Bekanntmachung der Eintragung zu diesem Zweck bei ihm melden."
    },
    {
      "date": "2025-02-03",
      "id": "100334",
      "original_text": "Löschungsankündigung\nNordrhein-Westfalen Amtsgericht Krefeld HRB 19682\nARYA Drinks & Gastronomie GmbH – Krefeld",
      "type": "Löschungsankündigung",
      "state": "Nordrhein-Westfalen",
      "amtsgericht": "Amtsgericht Krefeld",
      "registernummer": "HRB 19682",
      "registerart": "HRB",
      "company_name": "ARYA Drinks & Gastronomie GmbH",
      "company_seat": "Krefeld",
      "details": "03.02.2025 (Bekanntmachungsdatum)\n\nNordrhein-Westfalen Amtsgericht Krefeld HRB 19682\nLöschungsankündigung\n\nARYA Drinks & Gastronomie GmbH\nGesellschaft mit beschränkter Haftung\nKrefeld\n\nDas Registergericht beabsichtigt die Gesellschaft von Amts wegen nach § 394 FamFG zu löschen. Die Frist zur Erhebung eines Widerspruchs ist auf einen Monat festgesetzt."
    },
    {
      "date": "2025-02-03",
      "id": "100335",
      "original_text": "Löschungsankündigung\nNordrhein-Westfalen Amtsgericht Hamm HRB 9145\nWergard GmbH – Hamm",
      "type": "Löschungsankündigung",
      "state": "Nordrhein-Westfalen",
      "amtsgericht": "Amtsgericht Hamm",
      "registernummer": "HRB 9145",
      "registerart": "HRB",
      "company_name": "Wergard GmbH",
      "company_seat": "Hamm",
      "details": "03.02.2025 (Bekanntmachungsdatum)\n\nNordrhein-Westfalen Amtsgericht Hamm HRB 9145\nLöschungsankündigung\n\nWergard GmbH\nGesellschaft mit beschränkter Haftung\nHamm\n\nDas Registergericht beabsichtigt die Gesellschaft von Amts wegen nach § 394 FamFG zu löschen. Die Frist zur Erhebung eines Widerspruchs ist auf drei Monate festgesetzt."
    },
    {
      "date": "2025-02-03",
      "id": "100336",
      "original_text": "Einreichung neuer Dokumente\nNordrhein-Westfalen Amtsgericht Paderborn HRB 6880\nWeser-Diemel-Beton Verwaltungs GmbH – Höxter",
      "type": "Einreichung neuer Dokumente",
      "state": "Nordrhein-Westfalen",
      "amtsgericht": "Amtsgericht Paderborn",
      "registernummer": "HRB 6880",
      "registerart": "HRB",
      "company_name": "Weser-Diemel-Beton Verwaltungs GmbH",
      "company_seat": "Höxter",
      "details": "03.02.2025 (Bekanntmachungsdatum)\n\nNordrhein-Westfalen Amtsgericht Paderborn HRB 6880\nEinreichung neuer Dokumente\n\nWeser-Diemel-Beton Verwaltungs GmbH\nGesellschaft mit beschränkter Haftung\nHöxter\n\nDem Registergericht ist eine neue Liste der Mitglieder des Aufsichtsrates eingereicht worden."
    },
    {
      "date": "2025-02-03",
      "id": "100337",
      "original_text": "Löschungsankündigung\nNordrhein-Westfalen Amtsgericht Köln HRB 96252\nB90 Sales & Services GmbH – Leverkusen",
      "type": "Löschungsankündigung",
      "state": "Nordrhein-Westfalen",
      "amtsgericht": "Amtsgericht Köln",
      "registernummer": "HRB 96252",
      "registerart": "HRB",
      "company_name": "B90 Sales & Services GmbH",
      "company_seat": "Leverkusen",
      "details": "03.02.2025 (Bekanntmachungsdatum)\n\nNordrhein-Westfalen Amtsgericht Köln HRB 96252\nLöschungsankündigung\n\nB90 Sales & Services GmbH\nGesellschaft mit beschränkter Haftung\nLeverkusen\n\nDas Registergericht beabsichtigt die Gesellschaft von Amts wegen nach § 394 FamFG zu löschen. Die Frist zur Erhebung eines Widerspruchs ist auf einen Monat festgesetzt."
    },
    {
      "date": "2025-02-03",
      "id": "100338",
      "original_text": "Registerbekanntmachung nach dem Umwandlungsgesetz\nNordrhein-Westfalen Amtsgericht Duisburg HRB 38704\nMSA + GmbH – Duisburg",
      "type": "Registerbekanntmachung nach dem Umwandlungsgesetz",
      "state": "Nordrhein-Westfalen",
      "amtsgericht": "Amtsgericht Duisburg",
      "registernummer": "HRB 38704",
      "registerart": "HRB",
      "company_name": "MSA + GmbH",
      "company_seat": "Duisburg",
      "details": "03.02.2025 (Bekanntmachungsdatum)\n\nNordrhein-Westfalen Amtsgericht Duisburg HRB 38704\nRegisterbekanntmachung nach dem Umwandlungsgesetz 03.02.2025 (Eintragungsdatum)\n\nMSA + GmbH\nGesellschaft mit beschränkter Haftung\nDuisburg\n\nDie Gesellschaft hat Gläubigern, deren Forderungen vor dieser Bekanntmachung begründet worden sind, Sicherheit zu leisten, soweit sie nicht Befriedigung verlangen können, wenn sie sich binnen sechs Monaten zu diesem Zweck melden."
    },
    {
      "date": "2025-02-03",
      "id": "100339",
      "original_text": "Registerbekanntmachung nach dem Umwandlungsgesetz\nNordrhein-Westfalen Amtsgericht Düsseldorf HRB 58338\nBrûlée GmbH – Düsseldorf",
      "type": "Registerbekanntmachung nach dem Umwandlungsgesetz",
      "state": "Nordrhein-Westfalen",
      "amtsgericht": "Amtsgericht Düsseldorf",
      "registernummer": "HRB 58338",
      "registerart": "HRB",
      "company_name": "Brûlée GmbH",
      "company_seat": "Düsseldorf",
      "details": "03.02.2025 (Bekanntmachungsdatum)\n\nNordrhein-Westfalen Amtsgericht Düsseldorf HRB 58338\nRegisterbekanntmachung nach dem Umwandlungsgesetz 03.02.2025 (Eintragungsdatum)\n\nBrûlée GmbH\nGesellschaft mit beschränkter Haftung\nDüsseldorf\n\nDen Gläubigern der an der Abspaltung beteiligten Rechtsträger ist, wenn sie binnen sechs Monaten nach dem Tag, an dem die Eintragung der Abspaltung in das Register des Sitzes desjenigen Rechtsträgers, dessen Gläubiger sie sind, nach § 19 Absatz 3 UmwG als bekanntgemacht gilt, ihren Anspruch nach Grund und Höhe schriftlich anmelden, Sicherheit zu leisten, soweit sie nicht Befriedigung verlangen können. Dieses Recht steht den Gläubigern jedoch nur zu, wenn sie glaubhaft machen, dass durch die Abspaltung die Erfüllung ihrer Forderung gefährdet wird."
    },
    {
      "date": "2025-02-03",
      "id": "100340",
      "original_text": "Sonstige Registerbekanntmachung\nThüringen Amtsgericht Jena HRB 400823\nWirtschaftsbetriebe Mühlhausen GmbH – Mühlhausen/Thüringen",
      "type": "Sonstige Registerbekanntmachung",
      "state": "Thüringen",
      "amtsgericht": "Amtsgericht Jena",
      "registernummer": "HRB 400823",
      "registerart": "HRB",
      "company_name": "Wirtschaftsbetriebe Mühlhausen GmbH",
      "company_seat": "Mühlhausen/Thüringen",
      "details": "03.02.2025 (Bekanntmachungsdatum)\n\nThüringen Amtsgericht Jena HRB 400823\nSonstige Registerbekanntmachung\n\nWirtschaftsbetriebe Mühlhausen GmbH\nGesellschaft mit beschränkter Haftung\nMühlhausen/Thüringen\n\nBekanntmachung gem. § 52 Abs. 3 Satz 2 GmbHG: Aufgrund einer Veränderung in den Personen der Aufsichtsratsmitglieder ist durch die Geschäftsführer eine neue Liste zum Handelsregister eingereicht worden."
    },
    {
      "date": "2025-02-03",
      "id": "100341",
      "original_text": "Sonstige Registerbekanntmachung\nHessen Amtsgericht Frankfurt am Main HRB 43146\nDataforce Verlagsgesellschaft für Business Informationen mbH – Frankfurt am Main",
      "type": "Sonstige Registerbekanntmachung",
      "state": "Hessen",
      "amtsgericht": "Amtsgericht Frankfurt am Main",
      "registernummer": "HRB 43146",
      "registerart": "HRB",
      "company_name": "Dataforce Verlagsgesellschaft für Business Informationen mbH",
      "company_seat": "Frankfurt am Main",
      "details": "03.02.2025 (Bekanntmachungsdatum)\n\nHessen Amtsgericht Frankfurt am Main HRB 43146\nSonstige Registerbekanntmachung 03.02.2025 (Eintragungsdatum)\n\nDataforce Verlagsgesellschaft für Business Informationen mbH\nGesellschaft mit beschränkter Haftung\nFrankfurt am Main\n\nDen Gläubigern der Gesellschaft, deren Forderungen begründet worden sind, bevor die Eintragung der Beendigung des Vertrags in das Handelsregister nach § 10 HGB bekannt gemacht worden ist, ist vom anderen Vertragsteil Sicherheit zu leisten, wenn sie sich binnen sechs Monaten nach dieser Bekanntmachung zu diesem Zweck bei ihm melden."
    },
    {
      "date": "2025-02-03",
      "id": "100342",
      "original_text": "Sonstige Registerbekanntmachung\nHessen Amtsgericht Limburg VR 1410\nMännergesangverein \"Echo\" – Weilmünster",
      "type": "Sonstige Registerbekanntmachung",
      "state": "Hessen",
      "amtsgericht": "Amtsgericht Limburg",
      "registernummer": "VR 1410",
      "registerart": "VR",
      "company_name": "Männergesangverein \"Echo\"",
      "company_seat": "Weilmünster",
      "details": "03.02.2025 (Bekanntmachungsdatum)\n\nHessen Amtsgericht Limburg VR 1410\nSonstige Registerbekanntmachung 03.02.2025 (Eintragungsdatum)\n\nMännergesangverein \"Echo\"\neingetragener Verein\nWeilmünster\n\nDer Verein ist aufgelöst und liquidationslos erloschen."
    },
    {
      "date": "2025-02-03",
      "id": "100343",
      "original_text": "Löschungsankündigung\nHessen Amtsgericht Frankfurt am Main HRB 74605\nRhein-Main Invest GmbH – Frankfurt am Main",
      "type": "Löschungsankündigung",
      "state": "Hessen",
      "amtsgericht": "Amtsgericht Frankfurt am Main",
      "registernummer": "HRB 74605",
      "registerart": "HRB",
      "company_name": "Rhein-Main Invest GmbH",
      "company_seat": "Frankfurt am Main",
      "details": "03.02.2025 (Bekanntmachungsdatum)\n\nHessen Amtsgericht Frankfurt am Main HRB 74605\nLöschungsankündigung\n\nRhein-Main Invest GmbH\nGesellschaft mit beschränkter Haftung\nFrankfurt am Main\n\nEs ist beabsichtigt die Gesellschaft wegen Vermögenslosigkeit gemäß § 394 FamFG von Amts wegen zu löschen. Hiergegen kann innerhalb eines Monats nach dieser Veröffentlichung Widerspruch bei dem Amtsgericht Frankfurt am Main eingelegt werden."
    },
    {
      "date": "2025-02-03",
      "id": "100344",
      "original_text": "Sonstige Registerbekanntmachung\nHessen Amtsgericht Frankfurt am Main HRB 11634\nGemeinnützige Wohnungsbaugesellschaft Kriftel mit beschränkter Haftung – Kriftel",
      "type": "Sonstige Registerbekanntmachung",
      "state": "Hessen",
      "amtsgericht": "Amtsgericht Frankfurt am Main",
      "registernummer": "HRB 11634",
      "registerart": "HRB",
      "company_name": "Gemeinnützige Wohnungsbaugesellschaft Kriftel mit beschränkter Haftung",
      "company_seat": "Kriftel",
      "details": "03.02.2025 (Bekanntmachungsdatum)\n\nHessen Amtsgericht Frankfurt am Main HRB 11634\nSonstige Registerbekanntmachung 03.02.2025 (Eintragungsdatum)\n\nGemeinnützige Wohnungsbaugesellschaft Kriftel mit beschränkter Haftung\nGesellschaft mit beschränkter Haftung\nKriftel\n\nDurch eine Änderung in den Personen der Aufsichtsratsmitglieder ist eine Liste der Mitglieder des Aufsichtsrates zum Handelsregister eingereicht worden."
    },
    {
      "date": "2025-02-03",
      "id": "100345",
      "original_text": "Sonstige Registerbekanntmachung\nHessen Amtsgericht Wiesbaden VR 4571\nRadsportclub Bad Schwalbach e.V. – Bad Schwalbach",
      "type": "Sonstige Registerbekanntmachung",
      "state": "Hessen",
      "amtsgericht": "Amtsgericht Wiesbaden",
      "registernummer": "VR 4571",
      "registerart": "VR",
      "company_name": "Radsportclub Bad Schwalbach e.V.",
      "company_seat": "Bad Schwalbach",
      "details": "03.02.2025 (Bekanntmachungsdatum)\n\nHessen Amtsgericht Wiesbaden VR 4571\nSonstige Registerbekanntmachung 03.02.2025 (Eintragungsdatum)\n\nRadsportclub Bad Schwalbach e.V.\neingetragener Verein\nBad Schwalbach\n\nDer Verein ist aufgelöst."
    },
    {
      "date": "2025-02-03",
      "id": "100346",
      "original_text": "Sonstige Registerbekanntmachung\nHessen Amtsgericht Bad Homburg v.d.H. VR 2243\nAnanda e. V. – Friedrichsdorf",
      "type": "Sonstige Registerbekanntmachung",
      "state": "Hessen",
      "amtsgericht": "Amtsgericht Bad Homburg v.d.H.",
      "registernummer": "VR 2243",
      "registerart": "VR",
      "company_name": "Ananda e. V.",
      "company_seat": "Friedrichsdorf",
      "details": "03.02.2025 (Bekanntmachungsdatum)\n\nHessen Amtsgericht Bad Homburg v.d.H. VR 2243\nSonstige Registerbekanntmachung 03.02.2025 (Eintragungsdatum)\n\nAnanda e. V.\neingetragener Verein\nFriedrichsdorf\n\nDer Verein ist aufgelöst."
    },
    {
      "date": "2025-02-03",
      "id": "100347",
      "original_text": "Registerbekanntmachung nach dem Umwandlungsgesetz\nHessen Amtsgericht Frankfurt am Main HRB 44420\nemagine GmbH – Frankfurt am Main",
      "type": "Registerbekanntmachung nach dem Umwandlungsgesetz",
      "state": "Hessen",
      "amtsgericht": "Amtsgericht Frankfurt am Main",
      "registernummer": "HRB 44420",
      "registerart": "HRB",
      "company_name": "emagine GmbH",
      "company_seat": "Frankfurt am Main",
      "details": "03.02.2025 (Bekanntmachungsdatum)\n\nHessen Amtsgericht Frankfurt am Main HRB 44420\nRegisterbekanntmachung nach dem Umwandlungsgesetz 03.02.2025 (Eintragungsdatum)\n\nemagine GmbH\nGesellschaft mit beschränkter Haftung\nFrankfurt am Main\n\nDen Gläubigern der an der Verschmelzung beteiligten Rechtsträger ist, wenn sie binnen sechs Monaten nach dem Tag, an dem die Eintragung der Verschmelzung in das Register des Sitzes derjenigen Rechtsträger deren Gläubiger sie sind, nach § 19 Absatz 3 UmwG bekannt gemacht worden ist, ihren Anspruch nach Grund und Höhe schriftlich anmelden, Sicherheit zu leisten, soweit sie nicht Befriedigung verlangen können. Dieses Recht steht den Gläubigern jedoch nur zu, wenn sie glaubhaft machen, dass durch die Verschmelzung die Erfüllung ihrer Forderung gefährdet wird."
    },
    {
      "date": "2025-02-03",
      "id": "100348",
      "original_text": "Einreichung neuer Dokumente\nHessen Amtsgericht Darmstadt HRB 107224\nGHT AG Gleis- Hoch- und Tiefbau – Mühltal",
      "type": "Einreichung neuer Dokumente",
      "state": "Hessen",
      "amtsgericht": "Amtsgericht Darmstadt",
      "registernummer": "HRB 107224",
      "registerart": "HRB",
      "company_name": "GHT AG Gleis- Hoch- und Tiefbau",
      "company_seat": "Mühltal",
      "details": "03.02.2025 (Bekanntmachungsdatum)\n\nHessen Amtsgericht Darmstadt HRB 107224\nEinreichung neuer Dokumente\n\nGHT AG Gleis- Hoch- und Tiefbau\nAktiengesellschaft\nMühltal\n\nDurch eine Änderung in den Personen der Aufsichtsratsmitglieder ist eine Liste der Mitglieder des Aufsichtsrates zum Handelsregister eingereicht worden."
    },
    {
      "date": "2025-02-03",
      "id": "100349",
      "original_text": "Sonstige Registerbekanntmachung\nHessen Amtsgericht Limburg VR 2021\nTOCCATA - Orgelkultur Limburg-Weilburg – Limburg a. d. Lahn",
      "type": "Sonstige Registerbekanntmachung",
      "state": "Hessen",
      "amtsgericht": "Amtsgericht Limburg",
      "registernummer": "VR 2021",
      "registerart": "VR",
      "company_name": "TOCCATA - Orgelkultur Limburg-Weilburg",
      "company_seat": "Limburg a. d. Lahn",
      "details": "03.02.2025 (Bekanntmachungsdatum)\n\nHessen Amtsgericht Limburg VR 2021\nSonstige Registerbekanntmachung 03.02.2025 (Eintragungsdatum)\n\nTOCCATA - Orgelkultur Limburg-Weilburg\neingetragener Verein\nLimburg a. d. Lahn\n\nDer Verein ist aufgelöst."
    },
    {
      "date": "2025-02-03",
      "id": "100350",
      "original_text": "Einreichung neuer Dokumente\nHessen Amtsgericht Darmstadt HRB 85235\nbioXXmed AG – Darmstadt",
      "type": "Einreichung neuer Dokumente",
      "state": "Hessen",
      "amtsgericht": "Amtsgericht Darmstadt",
      "registernummer": "HRB 85235",
      "registerart": "HRB",
      "company_name": "bioXXmed AG",
      "company_seat": "Darmstadt",
      "details": "03.02.2025 (Bekanntmachungsdatum)\n\nHessen Amtsgericht Darmstadt HRB 85235\nEinreichung neuer Dokumente\n\nbioXXmed AG\nAktiengesellschaft\nDarmstadt\n\nDurch eine Änderung in den Personen der Aufsichtsratsmitglieder ist eine Liste der Mitglieder des Aufsichtsrates zum Handelsregister eingereicht worden."
    },
    {
      "date": "2025-02-03",
      "id": "100351",
      "original_text": "Löschungsankündigung\nHessen Amtsgericht Frankfurt am Main HRB 25042\nANALYSIS THE SCENT COMPANY INTERNATIONAL GMBH – Frankfurt am Main",
      "type": "Löschungsankündigung",
      "state": "Hessen",
      "amtsgericht": "Amtsgericht Frankfurt am Main",
      "registernummer": "HRB 25042",
      "registerart": "HRB",
      "company_name": "ANALYSIS THE SCENT COMPANY INTERNATIONAL GMBH",
      "company_seat": "Frankfurt am Main",
      "details": "03.02.2025 (Bekanntmachungsdatum)\n\nHessen Amtsgericht Frankfurt am Main HRB 25042\nLöschungsankündigung\n\nANALYSIS THE SCENT COMPANY INTERNATIONAL GMBH\nGesellschaft mit beschränkter Haftung\nFrankfurt am Main\n\nDas Registergericht beabsichtigt die im Handelsregister eingetragene Gesellschaft von Amts wegen nach § 394 FamFG zu löschen. Die Frist zur Erhebung eines Widerspruchs gegen die beabsichtigte Löschung wird auf 1 Monat festgesetzt."
    },
    {
      "date": "2025-02-03",
      "id": "100352",
      "original_text": "Löschungsankündigung\nHessen Amtsgericht Frankfurt am Main HRB 105105\nX-Direct Group GmbH – Frankfurt am Main",
      "type": "Löschungsankündigung",
      "state": "Hessen",
      "amtsgericht": "Amtsgericht Frankfurt am Main",
      "registernummer": "HRB 105105",
      "registerart": "HRB",
      "company_name": "X-Direct Group GmbH",
      "company_seat": "Frankfurt am Main",
      "details": "03.02.2025 (Bekanntmachungsdatum)\n\nHessen Amtsgericht Frankfurt am Main HRB 105105\nLöschungsankündigung\n\nX-Direct Group GmbH\nGesellschaft mit beschränkter Haftung\nFrankfurt am Main\n\nEs ist beabsichtigt die Gesellschaft wegen Vermögenslosigkeit gemäß § 394 FamFG von Amts wegen zu löschen. Hiergegen kann innerhalb eines Monats nach dieser Veröffentlichung Widerspruch bei dem Amtsgericht Frankfurt am Main eingelegt werden."
    },
    {
      "date": "2025-02-03",
      "id": "100353",
      "original_text": "Löschungsankündigung\nHessen Amtsgericht Frankfurt am Main HRB 72444\nTrinkaus Fachspedition für Jagdtrophäen GmbH – Karben",
      "type": "Löschungsankündigung",
      "state": "Hessen",
      "amtsgericht": "Amtsgericht Frankfurt am Main",
      "registernummer": "HRB 72444",
      "registerart": "HRB",
      "company_name": "Trinkaus Fachspedition für Jagdtrophäen GmbH",
      "company_seat": "Karben",
      "details": "03.02.2025 (Bekanntmachungsdatum)\n\nHessen Amtsgericht Frankfurt am Main HRB 72444\nLöschungsankündigung\n\nTrinkaus Fachspedition für Jagdtrophäen GmbH\nGesellschaft mit beschränkter Haftung\nKarben\n\nDas Registergericht beabsichtigt die im Handelsregister eingetragene Gesellschaft von Amts wegen nach § 394 FamFG zu löschen. Die Frist zur Erhebung eines Widerspruchs gegen die beabsichtigte Löschung wird auf 1 Monat festgesetzt."
    },
    {
      "date": "2025-02-03",
      "id": "100354",
      "original_text": "Sonstige Registerbekanntmachung\nHessen Amtsgericht Eschwege VR 1158\nFremdenverkehrsverein \"Dudenrode\" – Bad Sooden-Allendorf",
      "type": "Sonstige Registerbekanntmachung",
      "state": "Hessen",
      "amtsgericht": "Amtsgericht Eschwege",
      "registernummer": "VR 1158",
      "registerart": "VR",
      "company_name": "Fremdenverkehrsverein \"Dudenrode\"",
      "company_seat": "Bad Sooden-Allendorf",
      "details": "03.02.2025 (Bekanntmachungsdatum)\n\nHessen Amtsgericht Eschwege VR 1158\nSonstige Registerbekanntmachung 03.02.2025 (Eintragungsdatum)\n\nFremdenverkehrsverein \"Dudenrode\"\neingetragener Verein\nBad Sooden-Allendorf\n\nDer Verein ist aufgelöst."
    }
  ]
}