{
  "date": "2025-02-24",
  "date_of_scrape": "2025-02-25T04:06:00.077Z",
  "tool_version": "0.2.0",
  "number_of_announcements": 83,
  "announcements": [
    {
      "date": "2025-02-24",
      "id": "102035",
      "original_text": "Löschungsankündigung\nSaarland Amtsgericht Saarbrücken HRB 9650\nSelltec Gesellschaft für Kommunikationstechnologien mbH – Saarbrücken",
      "type": "Löschungsankündigung",
      "state": "Saarland",
      "amtsgericht": "Amtsgericht Saarbrücken",
      "registernummer": "HRB 9650",
      "registerart": "HRB",
      "company_name": "Selltec Gesellschaft für Kommunikationstechnologien mbH",
      "company_seat": "Saarbrücken",
      "details": "24.02.2025 (Bekanntmachungsdatum)\n\nSaarland Amtsgericht Saarbrücken HRB 9650\nLöschungsankündigung\n\nSelltec Gesellschaft für Kommunikationstechnologien mbH\nGesellschaft mit beschränkter Haftung\nSaarbrücken\n\nEs ist beabsichtigt, die Gesellschaft von Amts wegen gemäß § 394 FamFG wegen Vermögenslosigkeit zu löschen.\nGegen die Löschung von Amts wegen ist das Rechtsmittel des Widerspruchs statthaft. Der Widerspruch ist binnen einer Frist zwei Monaten beginnend mit dem Tag dieser Veröffentlichung durch Einreichen eines Widerspruchsschreibens -schriftlich oder zur Niederschrift der Geschäftsstelle beim Amtsgericht Saarbrücken, -zentrales Handelsregister-, Mainzerstr.178, 66121 Saarbrücken einzulegen.\nDer Widerspruch muss die Bezeichnung der angefochtenen Löschungsankündigung enthalten sowie die Erklärung, dass Widerspruch eingelegt wird. Er ist vom Widerspruchsführer oder seinem Bevollmächtigten zu unterzeichnen.\nDas Widerspruchsschreiben kann auch in der Form eines elektronischen Dokumentes eingereicht werden, das mit einer qualifizierten elektronischen Signatur nach dem Signaturgesetz versehen sein muss (§§ 14 Abs. 2 FamFG, 130a, 298 ZPO)."
    },
    {
      "date": "2025-02-24",
      "id": "102036",
      "original_text": "Registerbekanntmachung nach dem Umwandlungsgesetz\nBerlin Amtsgericht Berlin (Charlottenburg) HRB 167901\nAaron GmbH – Berlin",
      "type": "Registerbekanntmachung nach dem Umwandlungsgesetz",
      "state": "Berlin",
      "amtsgericht": "Amtsgericht Berlin (Charlottenburg)",
      "registernummer": "HRB 167901",
      "registerart": "HRB",
      "company_name": "Aaron GmbH",
      "company_seat": "Berlin",
      "details": "24.02.2025 (Bekanntmachungsdatum)\n\nBerlin Amtsgericht Berlin (Charlottenburg) HRB 167901\nRegisterbekanntmachung nach dem Umwandlungsgesetz 21.02.2025 (Eintragungsdatum)\n\nAaron GmbH\nGesellschaft mit beschränkter Haftung\nBerlin\n\nZu Eintragungsnummer 15 vom 21.02.2025 wird als nicht eingetragen veröffentlicht:\n\nDen Gläubigern der an der Verschmelzung beteiligten Rechtsträger ist, wenn sie binnen sechs Monaten nach dem Tag, an dem die Eintragung der Verschmelzung in das Register des Sitzes desjenigen Rechtsträgers, dessen Gläubiger sie sind, als bekannt gemacht gilt, ihren Anspruch nach Grund und Höhe schriftlich anmelden, Sicherheit zu leisten, soweit sie nicht Befriedigung verlangen können. Dieses Recht steht den Gläubigern jedoch nur zu, wenn sie glaubhaft machen, dass durch die Verschmelzung die Erfüllung ihrer Forderung gefährdet wird. Das Recht, Sicherheitsleistung zu verlangen, steht Gläubigern nicht zu, die im Falle der Insolvenz ein Recht auf vorzugsweise Befriedigung aus einer Deckungsmasse haben, die nach gesetzlicher Vorschrift zu ihrem Schutz errichtet und staatlich überwacht ist."
    },
    {
      "date": "2025-02-24",
      "id": "102037",
      "original_text": "Registerbekanntmachung nach dem Umwandlungsgesetz\nBerlin Amtsgericht Berlin (Charlottenburg) HRB 175963\nDoctolib GmbH – Berlin",
      "type": "Registerbekanntmachung nach dem Umwandlungsgesetz",
      "state": "Berlin",
      "amtsgericht": "Amtsgericht Berlin (Charlottenburg)",
      "registernummer": "HRB 175963",
      "registerart": "HRB",
      "company_name": "Doctolib GmbH",
      "company_seat": "Berlin",
      "details": "24.02.2025 (Bekanntmachungsdatum)\n\nBerlin Amtsgericht Berlin (Charlottenburg) HRB 175963\nRegisterbekanntmachung nach dem Umwandlungsgesetz 21.02.2025 (Eintragungsdatum)\n\nDoctolib GmbH\nGesellschaft mit beschränkter Haftung\nBerlin\n\nZu Eintragungsnummer 11 vom 21.02.2025 wird als nicht eingetragen veröffentlicht:\n\nDen Gläubigern der an der Verschmelzung beteiligten Rechtsträger ist, wenn sie binnen sechs Monaten nach dem Tag, an dem die Eintragung der Verschmelzung in das Register des Sitzes desjenigen Rechtsträgers, dessen Gläubiger sie sind, als bekannt gemacht gilt, ihren Anspruch nach Grund und Höhe schriftlich anmelden, Sicherheit zu leisten, soweit sie nicht Befriedigung verlangen können. Dieses Recht steht den Gläubigern jedoch nur zu, wenn sie glaubhaft machen, dass durch die Verschmelzung die Erfüllung ihrer Forderung gefährdet wird. Das Recht, Sicherheitsleistung zu verlangen, steht Gläubigern nicht zu, die im Falle der Insolvenz ein Recht auf vorzugsweise Befriedigung aus einer Deckungsmasse haben, die nach gesetzlicher Vorschrift zu ihrem Schutz errichtet und staatlich überwacht ist."
    },
    {
      "date": "2025-02-24",
      "id": "102038",
      "original_text": "Löschungsankündigung\nSchleswig-Holstein Amtsgericht Flensburg HRA 7183\nDFK Ferienwohnungen Sylt GmbH & Co. KG – Westerland",
      "type": "Löschungsankündigung",
      "state": "Schleswig-Holstein",
      "amtsgericht": "Amtsgericht Flensburg",
      "registernummer": "HRA 7183",
      "registerart": "HRA",
      "company_name": "DFK Ferienwohnungen Sylt GmbH & Co. KG",
      "company_seat": "Westerland",
      "details": "24.02.2025 (Bekanntmachungsdatum)\n\nSchleswig-Holstein Amtsgericht Flensburg HRA 7183\nLöschungsankündigung\n\nDFK Ferienwohnungen Sylt GmbH & Co. KG\nKommanditgesellschaft\nWesterland\n\nBei der nachstehenden Firma wird das Amtslöschungsverfahren gemäß § 31 Abs. 2 HGB eingeleitet.\nWiderspruchsfrist: 2 Monate."
    },
    {
      "date": "2025-02-24",
      "id": "102039",
      "original_text": "Löschungsankündigung\nSchleswig-Holstein Amtsgericht Lübeck HRB 20963\nBehnke Service GmbH – Lübeck",
      "type": "Löschungsankündigung",
      "state": "Schleswig-Holstein",
      "amtsgericht": "Amtsgericht Lübeck",
      "registernummer": "HRB 20963",
      "registerart": "HRB",
      "company_name": "Behnke Service GmbH",
      "company_seat": "Lübeck",
      "details": "24.02.2025 (Bekanntmachungsdatum)\n\nSchleswig-Holstein Amtsgericht Lübeck HRB 20963\nLöschungsankündigung\n\nBehnke Service GmbH\nGesellschaft mit beschränkter Haftung\nLübeck\n\nEs ist die Löschung der nachstehenden Gesellschaft wegen Vermögenslosigkeit gemäß § 394 FamFG beabsichtigt. Widerspruchsfrist: 1 Monat"
    },
    {
      "date": "2025-02-24",
      "id": "102040",
      "original_text": "Registerbekanntmachung nach dem Umwandlungsgesetz\nBaden-Württemberg Amtsgericht Freiburg HRA 471583\nGraf Hardenberg GmbH & Co. KG – Offenburg",
      "type": "Registerbekanntmachung nach dem Umwandlungsgesetz",
      "state": "Baden-Württemberg",
      "amtsgericht": "Amtsgericht Freiburg",
      "registernummer": "HRA 471583",
      "registerart": "HRA",
      "company_name": "Graf Hardenberg GmbH & Co. KG",
      "company_seat": "Offenburg",
      "details": "24.02.2025 (Bekanntmachungsdatum)\n\nBaden-Württemberg Amtsgericht Freiburg HRA 471583\nRegisterbekanntmachung nach dem Umwandlungsgesetz 24.02.2025 (Eintragungsdatum)\n\nGraf Hardenberg GmbH & Co. KG\nKommanditgesellschaft\nOffenburg\n\nAls nicht eingetragen wird bekanntgemacht:\nDen Gläubigern der an der Verschmelzung beteiligten Rechtsträger ist, wenn sie binnen sechs Monaten nach dem Tag, an dem die Eintragung der Verschmelzung in das Register des Sitzes desjenigen Rechtsträgers, dessen Gläubiger sie sind, nach § 19 Abs. 3 UmwG als bekanntgemacht gilt, ihren Anspruch nach Grund und Höhe schriftlich anmelden, Sicherheit zu leisten, soweit sie nicht Befriedigung verlangen können. Dieses Recht steht den Gläubigern jedoch nur zu, wenn sie glaubhaft machen, dass durch die Verschmelzung die Erfüllung ihrer Forderung gefährdet wird."
    },
    {
      "date": "2025-02-24",
      "id": "102041",
      "original_text": "Registerbekanntmachung nach dem Umwandlungsgesetz\nBaden-Württemberg Amtsgericht Freiburg HRB 722918\nGraf Hardenberg GmbH – Gengenbach",
      "type": "Registerbekanntmachung nach dem Umwandlungsgesetz",
      "state": "Baden-Württemberg",
      "amtsgericht": "Amtsgericht Freiburg",
      "registernummer": "HRB 722918",
      "registerart": "HRB",
      "company_name": "Graf Hardenberg GmbH",
      "company_seat": "Gengenbach",
      "details": "24.02.2025 (Bekanntmachungsdatum)\n\nBaden-Württemberg Amtsgericht Freiburg HRB 722918\nRegisterbekanntmachung nach dem Umwandlungsgesetz 24.02.2025 (Eintragungsdatum)\n\nGraf Hardenberg GmbH\nGesellschaft mit beschränkter Haftung\nGengenbach\n\nDen Gläubigern der an der Verschmelzung beteiligten Rechtsträger ist, wenn sie binnen sechs Monaten nach dem Tag, an dem die Eintragung der Verschmelzung in das Register des Sitzes desjenigen Rechtsträgers, dessen Gläubiger sie sind, nach § 19 Abs. 3 UmwG als bekanntgemacht gilt, ihren Anspruch nach Grund und Höhe schriftlich anmelden, Sicherheit zu leisten, soweit sie nicht Befriedigung verlangen können. Dieses Recht steht den Gläubigern jedoch nur zu, wenn sie glaubhaft machen, dass durch die Verschmelzung die Erfüllung ihrer Forderung gefährdet wird."
    },
    {
      "date": "2025-02-24",
      "id": "102042",
      "original_text": "Registerbekanntmachung nach dem Umwandlungsgesetz\nBaden-Württemberg Amtsgericht Freiburg HRB 722917\nGraf Hardenberg GmbH – Lahr",
      "type": "Registerbekanntmachung nach dem Umwandlungsgesetz",
      "state": "Baden-Württemberg",
      "amtsgericht": "Amtsgericht Freiburg",
      "registernummer": "HRB 722917",
      "registerart": "HRB",
      "company_name": "Graf Hardenberg GmbH",
      "company_seat": "Lahr",
      "details": "24.02.2025 (Bekanntmachungsdatum)\n\nBaden-Württemberg Amtsgericht Freiburg HRB 722917\nRegisterbekanntmachung nach dem Umwandlungsgesetz 24.02.2025 (Eintragungsdatum)\n\nGraf Hardenberg GmbH\nGesellschaft mit beschränkter Haftung\nLahr\n\nDen Gläubigern der an der Verschmelzung beteiligten Rechtsträger ist, wenn sie binnen sechs Monaten nach dem Tag, an dem die Eintragung der Verschmelzung in das Register des Sitzes desjenigen Rechtsträgers, dessen Gläubiger sie sind, nach § 19 Abs. 3 UmwG als bekanntgemacht gilt, ihren Anspruch nach Grund und Höhe schriftlich anmelden, Sicherheit zu leisten, soweit sie nicht Befriedigung verlangen können. Dieses Recht steht den Gläubigern jedoch nur zu, wenn sie glaubhaft machen, dass durch die Verschmelzung die Erfüllung ihrer Forderung gefährdet wird."
    },
    {
      "date": "2025-02-24",
      "id": "102043",
      "original_text": "Registerbekanntmachung nach dem Umwandlungsgesetz\nBaden-Württemberg Amtsgericht Freiburg HRA 702220\nRainer Huber e.K. – Oberkirch",
      "type": "Registerbekanntmachung nach dem Umwandlungsgesetz",
      "state": "Baden-Württemberg",
      "amtsgericht": "Amtsgericht Freiburg",
      "registernummer": "HRA 702220",
      "registerart": "HRA",
      "company_name": "Rainer Huber e.K.",
      "company_seat": "Oberkirch",
      "details": "24.02.2025 (Bekanntmachungsdatum)\n\nBaden-Württemberg Amtsgericht Freiburg HRA 702220\nRegisterbekanntmachung nach dem Umwandlungsgesetz 24.02.2025 (Eintragungsdatum)\n\nRainer Huber e.K.\nEinzelkaufmann / Einzelkauffrau\nOberkirch\n\nAls nicht eingetragen wird bekanntgemacht:\nDen Gläubigern der an der Ausgliederung beteiligten Rechtsträger ist, wenn sie binnen sechs Monaten nach dem Tag, an dem die Eintragung der Ausgliederung in das Register des Sitzes desjenigen Rechtsträgers, dessen Gläubiger sie sind, nach § 19 Abs. 3 UmwG als bekanntgemacht gilt, ihren Anspruch nach Grund und Höhe schriftlich anmelden, Sicherheit zu leisten, soweit sie nicht Befriedigung verlangen können. Dieses Recht steht den Gläubigern jedoch nur zu, wenn sie glaubhaft machen, dass durch die Ausgliederung die Erfüllung ihrer Forderung gefährdet wird."
    },
    {
      "date": "2025-02-24",
      "id": "102044",
      "original_text": "Registerbekanntmachung nach dem Umwandlungsgesetz\nBaden-Württemberg Amtsgericht Freiburg HRA 708831\nRH Besitz GmbH & Co. KG – Oberkirch",
      "type": "Registerbekanntmachung nach dem Umwandlungsgesetz",
      "state": "Baden-Württemberg",
      "amtsgericht": "Amtsgericht Freiburg",
      "registernummer": "HRA 708831",
      "registerart": "HRA",
      "company_name": "RH Besitz GmbH & Co. KG",
      "company_seat": "Oberkirch",
      "details": "24.02.2025 (Bekanntmachungsdatum)\n\nBaden-Württemberg Amtsgericht Freiburg HRA 708831\nRegisterbekanntmachung nach dem Umwandlungsgesetz 24.02.2025 (Eintragungsdatum)\n\nRH Besitz GmbH & Co. KG\nKommanditgesellschaft\nOberkirch\n\nAls nicht eingetragen wird bekanntgemacht:\nDen Gläubigern der an der Ausgliederung beteiligten Rechtsträger ist, wenn sie binnen sechs Monaten nach dem Tag, an dem die Eintragung der Ausgliederung in das Register des Sitzes desjenigen Rechtsträgers, dessen Gläubiger sie sind, nach § 19 Abs. 3 UmwG als bekanntgemacht gilt, ihren Anspruch nach Grund und Höhe schriftlich anmelden, Sicherheit zu leisten, soweit sie nicht Befriedigung verlangen können. Dieses Recht steht den Gläubigern jedoch nur zu, wenn sie glaubhaft machen, dass durch die Ausgliederung die Erfüllung ihrer Forderung gefährdet wird."
    },
    {
      "date": "2025-02-24",
      "id": "102045",
      "original_text": "Registerbekanntmachung nach dem Umwandlungsgesetz\nSchleswig-Holstein Amtsgericht Pinneberg HRA 2455\nSteinmetz Briefumschläge GmbH & Co. KG – Schenefeld/Krs. Pinneberg",
      "type": "Registerbekanntmachung nach dem Umwandlungsgesetz",
      "state": "Schleswig-Holstein",
      "amtsgericht": "Amtsgericht Pinneberg",
      "registernummer": "HRA 2455",
      "registerart": "HRA",
      "company_name": "Steinmetz Briefumschläge GmbH & Co. KG",
      "company_seat": "Schenefeld/Krs. Pinneberg",
      "details": "24.02.2025 (Bekanntmachungsdatum)\n\nSchleswig-Holstein Amtsgericht Pinneberg HRA 2455\nRegisterbekanntmachung nach dem Umwandlungsgesetz 18.02.2025 (Eintragungsdatum)\n\nSteinmetz Briefumschläge GmbH & Co. KG\nKommanditgesellschaft\nSchenefeld/Krs. Pinneberg\n\nZu Eintragungsnummer 11 vom 18.02.2025 wird als nicht eingetragen veröffentlicht: Den Gläubigern der an der Verschmelzung beteiligten Rechtsträger ist, wenn sie binnen sechs Monaten nach dem Tag, an dem die Eintragung der Verschmelzung in das Register des Sitzes desjenigen Rechtsträgers, dessen Gläubiger sie sind, als bekannt gemacht gilt, ihren Anspruch nach Grund und Höhe schriftlich anmelden, Sicherheit zu leisten, soweit sie nicht Befriedigung verlangen können. Dieses Recht steht den Gläubigern jedoch nur zu, wenn sie glaubhaft machen, dass durch die Verschmelzung die Erfüllung ihrer Forderung gefährdet wird. Das Recht, Sicherheitsleistung zu verlangen, steht Gläubigern nicht zu, die im Falle der Insolvenz ein Recht auf vorzugsweise Befriedigung aus einer Deckungsmasse haben, die nach gesetzlicher Vorschrift zu ihrem Schutz errichtet und staatlich überwacht ist."
    },
    {
      "date": "2025-02-24",
      "id": "102046",
      "original_text": "Sonstige Registerbekanntmachung\nBerlin Amtsgericht Berlin (Charlottenburg) HRB 204761\nCosmo Consult LS GmbH – Berlin",
      "type": "Sonstige Registerbekanntmachung",
      "state": "Berlin",
      "amtsgericht": "Amtsgericht Berlin (Charlottenburg)",
      "registernummer": "HRB 204761",
      "registerart": "HRB",
      "company_name": "Cosmo Consult LS GmbH",
      "company_seat": "Berlin",
      "details": "24.02.2025 (Bekanntmachungsdatum)\n\nBerlin Amtsgericht Berlin (Charlottenburg) HRB 204761\nSonstige Registerbekanntmachung\n\nCosmo Consult LS GmbH\nGesellschaft mit beschränkter Haftung\nBerlin\n\nAls nicht eingetragen wird veröffentlicht:  Der andere Vertragsteil hat den Gläubigern dieses Rechtsträgers, deren Forderungen begründet worden sind, bevor die Eintragung der Beendigung dieses Vertrages in das Handelsregister nach § 10 des Handelsgesetzbuches als bekannt gemacht gilt, Sicherheit zu leisten, wenn sie sich binnen sechs Monaten nach der Bekanntmachung der Eintragung zu diesem Zweck bei ihm melden. Dieses Recht steht den Gläubigern nicht zu, die im Fall des Insolvenzverfahrens ein Recht auf vorzugsweise Befriedigung aus der Deckungsmasse haben, die nach gesetzlicher Vorschrift zu ihrem Schutz errichtet und staatlich überwacht ist."
    },
    {
      "date": "2025-02-24",
      "id": "102047",
      "original_text": "Sonstige Registerbekanntmachung\nBerlin Amtsgericht Berlin (Charlottenburg) HRB 125252\nDRV Service GmbH – Berlin",
      "type": "Sonstige Registerbekanntmachung",
      "state": "Berlin",
      "amtsgericht": "Amtsgericht Berlin (Charlottenburg)",
      "registernummer": "HRB 125252",
      "registerart": "HRB",
      "company_name": "DRV Service GmbH",
      "company_seat": "Berlin",
      "details": "24.02.2025 (Bekanntmachungsdatum)\n\nBerlin Amtsgericht Berlin (Charlottenburg) HRB 125252\nSonstige Registerbekanntmachung\n\nDRV Service GmbH\nGesellschaft mit beschränkter Haftung\nBerlin\n\nAls nicht eingetragen wird veröffentlicht:Es wurde eine neue Liste der Aufsichtsratsmitglieder eingereicht (§52 GmbHG)."
    },
    {
      "date": "2025-02-24",
      "id": "102048",
      "original_text": "Löschungsankündigung\nBerlin Amtsgericht Berlin (Charlottenburg) HRB 214428\nExakt Shuttle GmbH – Berlin",
      "type": "Löschungsankündigung",
      "state": "Berlin",
      "amtsgericht": "Amtsgericht Berlin (Charlottenburg)",
      "registernummer": "HRB 214428",
      "registerart": "HRB",
      "company_name": "Exakt Shuttle GmbH",
      "company_seat": "Berlin",
      "details": "24.02.2025 (Bekanntmachungsdatum)\n\nBerlin Amtsgericht Berlin (Charlottenburg) HRB 214428\nLöschungsankündigung\n\nExakt Shuttle GmbH\nGesellschaft mit beschränkter Haftung\nBerlin\n\nBei der nachstehenden Gesellschaft wird das Amtslöschungsverfahren gemäß § 394 FamFG eingeleitet. Widerspruchsfrist 6 Wochen"
    },
    {
      "date": "2025-02-24",
      "id": "102049",
      "original_text": "Registerbekanntmachung nach dem Umwandlungsgesetz\nSchleswig-Holstein Amtsgericht Lübeck HRB 25727\ni+ GmbH – Schwarzenbek",
      "type": "Registerbekanntmachung nach dem Umwandlungsgesetz",
      "state": "Schleswig-Holstein",
      "amtsgericht": "Amtsgericht Lübeck",
      "registernummer": "HRB 25727",
      "registerart": "HRB",
      "company_name": "i+ GmbH",
      "company_seat": "Schwarzenbek",
      "details": "24.02.2025 (Bekanntmachungsdatum)\n\nSchleswig-Holstein Amtsgericht Lübeck HRB 25727\nRegisterbekanntmachung nach dem Umwandlungsgesetz 21.02.2025 (Eintragungsdatum)\n\ni+ GmbH\nGesellschaft mit beschränkter Haftung\nSchwarzenbek\n\nZu Eintragungsnummer 2 vom 21.02.2025 wird als nicht eingetragen veröffentlicht:\nAls nicht eingetragen wird veröffentlicht: Den Gläubigern der an der Verschmelzung beteiligten Rechtsträger ist, wenn sie binnen sechs Monaten nach dem Tag, an dem die Eintragung der Verschmelzung in das Register des Sitzes desjenigen Rechtsträgers, dessen Gläubiger sie sind, als bekannt gemacht gilt, ihren Anspruch nach Grund und Höhe schriftlich anmelden, Sicherheit zu leisten, soweit sie nicht Befriedigung verlangen können. Dieses Recht steht den Gläubigern jedoch nur zu, wenn sie glaubhaft machen, dass durch die Verschmelzung die Erfüllung ihrer Forderung gefährdet wird."
    },
    {
      "date": "2025-02-24",
      "id": "102050",
      "original_text": "Einreichung neuer Dokumente\nBerlin Amtsgericht Berlin (Charlottenburg) HRB 15772\nGRÜN BERLIN GmbH – Berlin",
      "type": "Einreichung neuer Dokumente",
      "state": "Berlin",
      "amtsgericht": "Amtsgericht Berlin (Charlottenburg)",
      "registernummer": "HRB 15772",
      "registerart": "HRB",
      "company_name": "GRÜN BERLIN GmbH",
      "company_seat": "Berlin",
      "details": "24.02.2025 (Bekanntmachungsdatum)\n\nBerlin Amtsgericht Berlin (Charlottenburg) HRB 15772\nEinreichung neuer Dokumente\n\nGRÜN BERLIN GmbH\nGesellschaft mit beschränkter Haftung\nBerlin\n\nAls nicht eingetragen wird veröffentlicht:  Es wurde eine neue Liste der Aufsichtsratsmitglieder eingereicht (§52 GmbHG)."
    },
    {
      "date": "2025-02-24",
      "id": "102051",
      "original_text": "Einreichung neuer Dokumente\nBaden-Württemberg Amtsgericht Freiburg HRB 1117\nFlugplatz Freiburg-Breisgau GmbH – Freiburg im Breisgau",
      "type": "Einreichung neuer Dokumente",
      "state": "Baden-Württemberg",
      "amtsgericht": "Amtsgericht Freiburg",
      "registernummer": "HRB 1117",
      "registerart": "HRB",
      "company_name": "Flugplatz Freiburg-Breisgau GmbH",
      "company_seat": "Freiburg im Breisgau",
      "details": "24.02.2025 (Bekanntmachungsdatum)\n\nBaden-Württemberg Amtsgericht Freiburg HRB 1117\nEinreichung neuer Dokumente\n\nFlugplatz Freiburg-Breisgau GmbH\nGesellschaft mit beschränkter Haftung\nFreiburg im Breisgau\n\nDie Gesellschaft hat am 20.02.2025 die Liste über die Zusammensetzung des Aufsichtsrats zum Handelsregister eingereicht."
    },
    {
      "date": "2025-02-24",
      "id": "102052",
      "original_text": "Registerbekanntmachung nach dem Umwandlungsgesetz\nSchleswig-Holstein Amtsgericht Lübeck HRB 13908\nCanal-Control Holding GmbH – Barsbüttel",
      "type": "Registerbekanntmachung nach dem Umwandlungsgesetz",
      "state": "Schleswig-Holstein",
      "amtsgericht": "Amtsgericht Lübeck",
      "registernummer": "HRB 13908",
      "registerart": "HRB",
      "company_name": "Canal-Control Holding GmbH",
      "company_seat": "Barsbüttel",
      "details": "24.02.2025 (Bekanntmachungsdatum)\n\nSchleswig-Holstein Amtsgericht Lübeck HRB 13908\nRegisterbekanntmachung nach dem Umwandlungsgesetz 21.02.2025 (Eintragungsdatum)\n\nCanal-Control Holding GmbH\nGesellschaft mit beschränkter Haftung\nBarsbüttel\n\nZu Eintragungsnummer 14 vom 21.02.2025 wird als nicht eingetragen veröffentlicht: Den Gläubigern der an der Verschmelzung beteiligten Rechtsträger ist, wenn sie binnen sechs Monaten nach dem Tag, an dem die Eintragung der Verschmelzung in das Register des Sitzes desjenigen Rechtsträgers, dessen Gläubiger sie sind, als bekannt gemacht gilt, ihren Anspruch nach Grund und Höhe schriftlich anmelden, Sicherheit zu leisten, soweit sie nicht Befriedigung verlangen können. Dieses Recht steht den Gläubigern jedoch nur zu, wenn sie glaubhaft machen, dass durch die Verschmelzung die Erfüllung ihrer Forderung gefährdet wird."
    },
    {
      "date": "2025-02-24",
      "id": "102053",
      "original_text": "Registerbekanntmachung nach dem Umwandlungsgesetz\nBaden-Württemberg Amtsgericht Stuttgart HRB 784914\nInternational Metal Service Süd GmbH – Fellbach",
      "type": "Registerbekanntmachung nach dem Umwandlungsgesetz",
      "state": "Baden-Württemberg",
      "amtsgericht": "Amtsgericht Stuttgart",
      "registernummer": "HRB 784914",
      "registerart": "HRB",
      "company_name": "International Metal Service Süd GmbH",
      "company_seat": "Fellbach",
      "details": "24.02.2025 (Bekanntmachungsdatum)\n\nBaden-Württemberg Amtsgericht Stuttgart HRB 784914\nRegisterbekanntmachung nach dem Umwandlungsgesetz 24.02.2025 (Eintragungsdatum)\n\nInternational Metal Service Süd GmbH\nGesellschaft mit beschränkter Haftung\nFellbach\n\nAls nicht eingetragen wird bekanntgemacht:\nDen Gläubigern der an der Verschmelzung beteiligten Rechtsträger ist, wenn sie binnen sechs Monaten nach dem Tag, an dem die Eintragung der Verschmelzung in das Register des Sitzes desjenigen Rechtsträgers, dessen Gläubiger sie sind, nach § 19 Abs. 3 UmwG als bekanntgemacht gilt, ihren Anspruch nach Grund und Höhe schriftlich anmelden, Sicherheit zu leisten, soweit sie nicht Befriedigung verlangen können. Dieses Recht steht den Gläubigern jedoch nur zu, wenn sie glaubhaft machen, dass durch die Verschmelzung die Erfüllung ihrer Forderung gefährdet wird."
    },
    {
      "date": "2025-02-24",
      "id": "102054",
      "original_text": "Einreichung neuer Dokumente\nBaden-Württemberg Amtsgericht Stuttgart HRB 736246\nTriglan Deutschland AG – Sindelfingen",
      "type": "Einreichung neuer Dokumente",
      "state": "Baden-Württemberg",
      "amtsgericht": "Amtsgericht Stuttgart",
      "registernummer": "HRB 736246",
      "registerart": "HRB",
      "company_name": "Triglan Deutschland AG",
      "company_seat": "Sindelfingen",
      "details": "24.02.2025 (Bekanntmachungsdatum)\n\nBaden-Württemberg Amtsgericht Stuttgart HRB 736246\nEinreichung neuer Dokumente 24.02.2025 (Eintragungsdatum)\n\nTriglan Deutschland AG\nAktiengesellschaft\nSindelfingen\n\nDie Gesellschaft hat am 21.02.2025 die Liste über die Zusammensetzung des Aufsichtsrats zum Handelsregister eingereicht."
    },
    {
      "date": "2025-02-24",
      "id": "102055",
      "original_text": "Löschungsankündigung\nBerlin Amtsgericht Berlin (Charlottenburg) HRB 163352\nEMG.Montagen UG (haftungsbeschränkt) – Berlin",
      "type": "Löschungsankündigung",
      "state": "Berlin",
      "amtsgericht": "Amtsgericht Berlin (Charlottenburg)",
      "registernummer": "HRB 163352",
      "registerart": "HRB",
      "company_name": "EMG.Montagen UG (haftungsbeschränkt)",
      "company_seat": "Berlin",
      "details": "24.02.2025 (Bekanntmachungsdatum)\n\nBerlin Amtsgericht Berlin (Charlottenburg) HRB 163352\nLöschungsankündigung\n\nEMG.Montagen UG (haftungsbeschränkt)\nGesellschaft mit beschränkter Haftung\nBerlin\n\nBei der nachstehenden Gesellschaft wird das Amtslöschungsverfahren gemäß § 394 FamFG eingeleitet. Widerspruchsfrist 6 Wochen"
    },
    {
      "date": "2025-02-24",
      "id": "102056",
      "original_text": "Löschungsankündigung\nBaden-Württemberg Amtsgericht Stuttgart HRA 729368\nP1 Gastronomie GmbH + Co. KG – Reutlingen",
      "type": "Löschungsankündigung",
      "state": "Baden-Württemberg",
      "amtsgericht": "Amtsgericht Stuttgart",
      "registernummer": "HRA 729368",
      "registerart": "HRA",
      "company_name": "P1 Gastronomie GmbH + Co. KG",
      "company_seat": "Reutlingen",
      "details": "24.02.2025 (Bekanntmachungsdatum)\n\nBaden-Württemberg Amtsgericht Stuttgart HRA 729368\nLöschungsankündigung\n\nP1 Gastronomie GmbH + Co. KG\nKommanditgesellschaft\nReutlingen\n\nDas Gericht beabsichtigt, die Gesellschaft wegen Vermögenslosigkeit im Handelsregister von Amts wegen nach § 394 FamFG zu löschen. Die Frist zur Geltendmachung eines Widerspruchs gegen die beabsichtigte Löschung ist auf einen Monate ab Veröffentlichung bestimmt."
    },
    {
      "date": "2025-02-24",
      "id": "102057",
      "original_text": "Löschungsankündigung\nSaarland Amtsgericht Saarbrücken HRA 12866\nEnprex e.K. – Saarbrücken",
      "type": "Löschungsankündigung",
      "state": "Saarland",
      "amtsgericht": "Amtsgericht Saarbrücken",
      "registernummer": "HRA 12866",
      "registerart": "HRA",
      "company_name": "Enprex e.K.",
      "company_seat": "Saarbrücken",
      "details": "24.02.2025 (Bekanntmachungsdatum)\n\nSaarland Amtsgericht Saarbrücken HRA 12866\nLöschungsankündigung\n\nEnprex e.K.\nEinzelkaufmann / Einzelkauffrau\nSaarbrücken\n\nEs ist beabsichtigt, die Gesellschaft von Amts wegen gemäß § 393 FamFG zu löschen.\nGegen die Löschung von Amts wegen ist das Rechtsmittel des Widerspruchs statthaft. Der Widerspruch ist binnen einer Frist zwei Monaten beginnend mit dem Tag dieser Veröffentlichung durch Einreichen eines Widerspruchsschreibens -schriftlich oder zur Niederschrift der Geschäftsstelle beim Amtsgericht Saarbrücken, -zentrales Handelsregister-, Mainzerstr.178, 66121 Saarbrücken einzulegen.\nDer Widerspruch muss die Bezeichnung der angefochtenen Löschungsankündigung enthalten sowie die Erklärung, dass Widerspruch eingelegt wird. Er ist vom Widerspruchsführer oder seinem Bevollmächtigten zu unterzeichnen.\nDas Widerspruchsschreiben kann auch in der Form eines elektronischen Dokumentes eingereicht werden, das mit einer qualifizierten elektronischen Signatur nach dem Signaturgesetz versehen sein muss (§§ 14 Abs. 2 FamFG, 130a, 298 ZPO)."
    },
    {
      "date": "2025-02-24",
      "id": "102058",
      "original_text": "Löschungsankündigung\nBrandenburg Amtsgericht Potsdam HRB 24391\nACONsulting GmbH – Niedergörsdorf",
      "type": "Löschungsankündigung",
      "state": "Brandenburg",
      "amtsgericht": "Amtsgericht Potsdam",
      "registernummer": "HRB 24391",
      "registerart": "HRB",
      "company_name": "ACONsulting GmbH",
      "company_seat": "Niedergörsdorf",
      "details": "24.02.2025 (Bekanntmachungsdatum)\n\nBrandenburg Amtsgericht Potsdam HRB 24391\nLöschungsankündigung\n\nACONsulting GmbH\nGesellschaft mit beschränkter Haftung\nNiedergörsdorf\n\nBei der nachstehenden Gesellschaft wird das Amtslöschungsverfahren gemäß § 394 FamFG eingeleitet. Widerspruchsfrist: 8 Wochen"
    },
    {
      "date": "2025-02-24",
      "id": "102059",
      "original_text": "Einreichung neuer Dokumente\nBrandenburg Amtsgericht Frankfurt/Oder HRB 1512\nHELIOS Klinikum Bad Saarow GmbH – Bad Saarow",
      "type": "Einreichung neuer Dokumente",
      "state": "Brandenburg",
      "amtsgericht": "Amtsgericht Frankfurt/Oder",
      "registernummer": "HRB 1512",
      "registerart": "HRB",
      "company_name": "HELIOS Klinikum Bad Saarow GmbH",
      "company_seat": "Bad Saarow",
      "details": "24.02.2025 (Bekanntmachungsdatum)\n\nBrandenburg Amtsgericht Frankfurt/Oder HRB 1512\nEinreichung neuer Dokumente\n\nHELIOS Klinikum Bad Saarow GmbH\nGesellschaft mit beschränkter Haftung\nBad Saarow\n\nAls nicht eingetragen wird veröffentlicht: Die Gesellschaft hat Änderungen im Aufsichtsrat angezeigt."
    },
    {
      "date": "2025-02-24",
      "id": "102060",
      "original_text": "Einreichung neuer Dokumente\nBerlin Amtsgericht Berlin (Charlottenburg) HRB 182671\nELEMENT Insurance AG – Berlin",
      "type": "Einreichung neuer Dokumente",
      "state": "Berlin",
      "amtsgericht": "Amtsgericht Berlin (Charlottenburg)",
      "registernummer": "HRB 182671",
      "registerart": "HRB",
      "company_name": "ELEMENT Insurance AG",
      "company_seat": "Berlin",
      "details": "24.02.2025 (Bekanntmachungsdatum)\n\nBerlin Amtsgericht Berlin (Charlottenburg) HRB 182671\nEinreichung neuer Dokumente\n\nELEMENT Insurance AG\nAktiengesellschaft\nBerlin\n\nAls nicht eingetragen wird veröffentlicht: Es wurde eine neue Liste der Aufsichtsratsmitglieder eingereicht (§ 106 AktG)."
    },
    {
      "date": "2025-02-24",
      "id": "102061",
      "original_text": "Sonstige Registerbekanntmachung\nMecklenburg-Vorpommern Amtsgericht Rostock HRB 2277\nTessiner Wohnungsbaugesellschaft mbH – Tessin",
      "type": "Sonstige Registerbekanntmachung",
      "state": "Mecklenburg-Vorpommern",
      "amtsgericht": "Amtsgericht Rostock",
      "registernummer": "HRB 2277",
      "registerart": "HRB",
      "company_name": "Tessiner Wohnungsbaugesellschaft mbH",
      "company_seat": "Tessin",
      "details": "24.02.2025 (Bekanntmachungsdatum)\n\nMecklenburg-Vorpommern Amtsgericht Rostock HRB 2277\nSonstige Registerbekanntmachung 24.02.2025 (Eintragungsdatum)\n\nTessiner Wohnungsbaugesellschaft mbH\nGesellschaft mit beschränkter Haftung\nTessin\n\nEine Liste der Mitglieder des Aufsichtsrats ist zum Handelsregister eingereicht worden."
    },
    {
      "date": "2025-02-24",
      "id": "102062",
      "original_text": "Löschungsankündigung\nBerlin Amtsgericht Berlin (Charlottenburg) HRB 112793\nrq-Verlag Gesellschaft mit beschränkter Haftung – Berlin",
      "type": "Löschungsankündigung",
      "state": "Berlin",
      "amtsgericht": "Amtsgericht Berlin (Charlottenburg)",
      "registernummer": "HRB 112793",
      "registerart": "HRB",
      "company_name": "rq-Verlag Gesellschaft mit beschränkter Haftung",
      "company_seat": "Berlin",
      "details": "24.02.2025 (Bekanntmachungsdatum)\n\nBerlin Amtsgericht Berlin (Charlottenburg) HRB 112793\nLöschungsankündigung\n\nrq-Verlag Gesellschaft mit beschränkter Haftung\nGesellschaft mit beschränkter Haftung\nBerlin\n\nBei der nachstehenden Gesellschaft wird das Amtslöschungsverfahren gemäß § 394 FamFG eingeleitet. Widerspruchsfrist 6 Wochen."
    },
    {
      "date": "2025-02-24",
      "id": "102063",
      "original_text": "Löschungsankündigung\nBrandenburg Amtsgericht Potsdam HRB 29882\nservice-drone.de GmbH – Brieselang",
      "type": "Löschungsankündigung",
      "state": "Brandenburg",
      "amtsgericht": "Amtsgericht Potsdam",
      "registernummer": "HRB 29882",
      "registerart": "HRB",
      "company_name": "service-drone.de GmbH",
      "company_seat": "Brieselang",
      "details": "24.02.2025 (Bekanntmachungsdatum)\n\nBrandenburg Amtsgericht Potsdam HRB 29882\nLöschungsankündigung\n\nservice-drone.de GmbH\nGesellschaft mit beschränkter Haftung\nBrieselang\n\nBei der nachstehenden Gesellschaft wird das Amtslöschungsverfahren gemäß § 394 FamFG eingeleitet. Widerspruchsfrist: 8 Wochen"
    },
    {
      "date": "2025-02-24",
      "id": "102064",
      "original_text": "Einreichung neuer Dokumente\nMecklenburg-Vorpommern Amtsgericht Schwerin HRB 9389\nFilmLand Mecklenburg-Vorpommern Gemeinnützige Gesellschaft mit beschränkter Haftung – Schwerin",
      "type": "Einreichung neuer Dokumente",
      "state": "Mecklenburg-Vorpommern",
      "amtsgericht": "Amtsgericht Schwerin",
      "registernummer": "HRB 9389",
      "registerart": "HRB",
      "company_name": "FilmLand Mecklenburg-Vorpommern Gemeinnützige Gesellschaft mit beschränkter Haftung",
      "company_seat": "Schwerin",
      "details": "24.02.2025 (Bekanntmachungsdatum)\n\nMecklenburg-Vorpommern Amtsgericht Schwerin HRB 9389\nEinreichung neuer Dokumente 24.02.2025 (Eintragungsdatum)\n\nFilmLand Mecklenburg-Vorpommern Gemeinnützige Gesellschaft mit beschränkter Haftung\nGesellschaft mit beschränkter Haftung\nSchwerin\n\nEine Liste der Mitglieder des Aufsichtsrats ist zum Handelsregister eingereicht worden."
    },
    {
      "date": "2025-02-24",
      "id": "102065",
      "original_text": "Registerbekanntmachung nach dem Umwandlungsgesetz\nNordrhein-Westfalen Amtsgericht Coesfeld HRB 15772\nCrowdpark Entertainment GmbH – Coesfeld",
      "type": "Registerbekanntmachung nach dem Umwandlungsgesetz",
      "state": "Nordrhein-Westfalen",
      "amtsgericht": "Amtsgericht Coesfeld",
      "registernummer": "HRB 15772",
      "registerart": "HRB",
      "company_name": "Crowdpark Entertainment GmbH",
      "company_seat": "Coesfeld",
      "details": "24.02.2025 (Bekanntmachungsdatum)\n\nNordrhein-Westfalen Amtsgericht Coesfeld HRB 15772\nRegisterbekanntmachung nach dem Umwandlungsgesetz 24.02.2025 (Eintragungsdatum)\n\nCrowdpark Entertainment GmbH\nGesellschaft mit beschränkter Haftung\nCoesfeld\n\nDen Gläubigern der an der Verschmelzung beteiligten Rechtsträger ist, wenn sie binnen sechs Monaten nach dem Tag, an dem die Eintragung der Verschmelzung in das Register des Sitzes derjenigen Rechtsträger deren Gläubiger sie sind, nach § 19 Absatz 3 UmwG als bekanntgemacht gilt, ihren Anspruch nach Grund und Höhe schriftlich anmelden, Sicherheit zu leisten, soweit sie nicht Befriedigung verlangen können. Dieses Recht steht den Gläubigern jedoch nur zu, wenn sie glaubhaft machen, dass durch die Verschmelzung die Erfüllung ihrer Forderung gefährdet wird."
    },
    {
      "date": "2025-02-24",
      "id": "102066",
      "original_text": "Löschungsankündigung\nBrandenburg Amtsgericht Potsdam HRB 32302\nDELTA Personalservice GmbH – Zossen",
      "type": "Löschungsankündigung",
      "state": "Brandenburg",
      "amtsgericht": "Amtsgericht Potsdam",
      "registernummer": "HRB 32302",
      "registerart": "HRB",
      "company_name": "DELTA Personalservice GmbH",
      "company_seat": "Zossen",
      "details": "24.02.2025 (Bekanntmachungsdatum)\n\nBrandenburg Amtsgericht Potsdam HRB 32302\nLöschungsankündigung\n\nDELTA Personalservice GmbH\nGesellschaft mit beschränkter Haftung\nZossen\n\nBei der nachstehenden Gesellschaft wird das Amtslöschungsverfahren gemäß § 394 FamFG eingeleitet. Widerspruchsfrist: 8 Wochen"
    },
    {
      "date": "2025-02-24",
      "id": "102067",
      "original_text": "Sonstige Registerbekanntmachung\nBaden-Württemberg Amtsgericht Freiburg HRA 702913\nStadtwerk am See GmbH & Co. KG – Überlingen",
      "type": "Sonstige Registerbekanntmachung",
      "state": "Baden-Württemberg",
      "amtsgericht": "Amtsgericht Freiburg",
      "registernummer": "HRA 702913",
      "registerart": "HRA",
      "company_name": "Stadtwerk am See GmbH & Co. KG",
      "company_seat": "Überlingen",
      "details": "24.02.2025 (Bekanntmachungsdatum)\n\nBaden-Württemberg Amtsgericht Freiburg HRA 702913\nSonstige Registerbekanntmachung\n\nStadtwerk am See GmbH & Co. KG\nKommanditgesellschaft\nÜberlingen\n\nDie Gesellschaft hat am 20.02.2025 die Liste vom 10.02.2025 über die Zusammensetzung des Aufsichtsrats zum Handelsregister eingereicht."
    },
    {
      "date": "2025-02-24",
      "id": "102068",
      "original_text": "Registerbekanntmachung nach dem Umwandlungsgesetz\nBaden-Württemberg Amtsgericht Ulm HRA 729410\nG. Schweizer GmbH & Co. KG – Schwäbisch Gmünd",
      "type": "Registerbekanntmachung nach dem Umwandlungsgesetz",
      "state": "Baden-Württemberg",
      "amtsgericht": "Amtsgericht Ulm",
      "registernummer": "HRA 729410",
      "registerart": "HRA",
      "company_name": "G. Schweizer GmbH & Co. KG",
      "company_seat": "Schwäbisch Gmünd",
      "details": "24.02.2025 (Bekanntmachungsdatum)\n\nBaden-Württemberg Amtsgericht Ulm HRA 729410\nRegisterbekanntmachung nach dem Umwandlungsgesetz 24.02.2025 (Eintragungsdatum)\n\nG. Schweizer GmbH & Co. KG\nKommanditgesellschaft\nSchwäbisch Gmünd\n\nDen Gläubigern der an der Ausgliederung beteiligten Rechtsträger ist, wenn sie binnen sechs Monaten nach dem Tag, an dem die Eintragung der Ausgliederung in das Register des Sitzes desjenigen Rechtsträgers, dessen Gläubiger sie sind, nach § 19 Abs. 3 UmwG als bekanntgemacht gilt, ihren Anspruch nach Grund und Höhe schriftlich anmelden, Sicherheit zu leisten, soweit sie nicht Befriedigung verlangen können. Dieses Recht steht den Gläubigern jedoch nur zu, wenn sie glaubhaft machen, dass durch die Ausgliederung die Erfüllung ihrer Forderung gefährdet wird."
    },
    {
      "date": "2025-02-24",
      "id": "102069",
      "original_text": "Registerbekanntmachung nach dem Umwandlungsgesetz\nBaden-Württemberg Amtsgericht Ulm HRA 729406\nGerhard Schweizer Vermietung e.K. – Schwäbisch Gmünd",
      "type": "Registerbekanntmachung nach dem Umwandlungsgesetz",
      "state": "Baden-Württemberg",
      "amtsgericht": "Amtsgericht Ulm",
      "registernummer": "HRA 729406",
      "registerart": "HRA",
      "company_name": "Gerhard Schweizer Vermietung e.K.",
      "company_seat": "Schwäbisch Gmünd",
      "details": "24.02.2025 (Bekanntmachungsdatum)\n\nBaden-Württemberg Amtsgericht Ulm HRA 729406\nRegisterbekanntmachung nach dem Umwandlungsgesetz 24.02.2025 (Eintragungsdatum)\n\nGerhard Schweizer Vermietung e.K.\nEinzelkaufmann / Einzelkauffrau\nSchwäbisch Gmünd\n\nAls nicht eingetragen wird bekanntgemacht:\nDen Gläubigern der an der Ausgliederung beteiligten Rechtsträger ist, wenn sie binnen sechs Monaten nach dem Tag, an dem die Eintragung der Ausgliederung in das Register des Sitzes desjenigen Rechtsträgers, dessen Gläubiger sie sind, nach § 19 Abs. 3 UmwG als bekanntgemacht gilt, ihren Anspruch nach Grund und Höhe schriftlich anmelden, Sicherheit zu leisten, soweit sie nicht Befriedigung verlangen können. Dieses Recht steht den Gläubigern jedoch nur zu, wenn sie glaubhaft machen, dass durch die Ausgliederung die Erfüllung ihrer Forderung gefährdet wird."
    },
    {
      "date": "2025-02-24",
      "id": "102070",
      "original_text": "Löschungsankündigung\nMecklenburg-Vorpommern Amtsgericht Schwerin HRA 3834\nS & L Immobilien GmbH & Co. KG – Neukloster",
      "type": "Löschungsankündigung",
      "state": "Mecklenburg-Vorpommern",
      "amtsgericht": "Amtsgericht Schwerin",
      "registernummer": "HRA 3834",
      "registerart": "HRA",
      "company_name": "S & L Immobilien GmbH & Co. KG",
      "company_seat": "Neukloster",
      "details": "24.02.2025 (Bekanntmachungsdatum)\n\nMecklenburg-Vorpommern Amtsgericht Schwerin HRA 3834\nLöschungsankündigung\n\nS & L Immobilien GmbH & Co. KG\nKommanditgesellschaft\nNeukloster\n\nDas Registergericht beabsichtigt, die im Handelsregister eingetragene Gesellschaft von Amts wegen nach § 394 FamFG zu löschen. Die Frist zur Erhebung eines Widerspruchs gegen die beabsichtigte Löschung wird auf zwei Monate festgesetzt."
    },
    {
      "date": "2025-02-24",
      "id": "102071",
      "original_text": "Löschungsankündigung\nBrandenburg Amtsgericht Frankfurt/Oder HRB 13431\nPrime Event GmbH – Neuenhagen bei Berlin",
      "type": "Löschungsankündigung",
      "state": "Brandenburg",
      "amtsgericht": "Amtsgericht Frankfurt/Oder",
      "registernummer": "HRB 13431",
      "registerart": "HRB",
      "company_name": "Prime Event GmbH",
      "company_seat": "Neuenhagen bei Berlin",
      "details": "24.02.2025 (Bekanntmachungsdatum)\n\nBrandenburg Amtsgericht Frankfurt/Oder HRB 13431\nLöschungsankündigung\n\nPrime Event GmbH\nGesellschaft mit beschränkter Haftung\nNeuenhagen bei Berlin\n\nBei der nachstehenden Gesellschaft wird das Amtslöschungsverfahren gemäß § 394 FamFG eingeleitet."
    },
    {
      "date": "2025-02-24",
      "id": "102072",
      "original_text": "Sonstige Registerbekanntmachung\nSchleswig-Holstein Amtsgericht Lübeck HRB 20827\nRaul Logistics Hamburg UG (haftungsbeschränkt) – Geesthacht",
      "type": "Sonstige Registerbekanntmachung",
      "state": "Schleswig-Holstein",
      "amtsgericht": "Amtsgericht Lübeck",
      "registernummer": "HRB 20827",
      "registerart": "HRB",
      "company_name": "Raul Logistics Hamburg UG (haftungsbeschränkt)",
      "company_seat": "Geesthacht",
      "details": "24.02.2025 (Bekanntmachungsdatum)\n\nSchleswig-Holstein Amtsgericht Lübeck HRB 20827\nSonstige Registerbekanntmachung\n\nRaul Logistics Hamburg UG (haftungsbeschränkt)\nGesellschaft mit beschränkter Haftung\nGeesthacht\n\nAls nicht eingetragen wird veröffentlicht:\nHerr\nn\nPaul Schleining\n, als GF der Gesellschaft,\nzur Zeit Aufenthalt in der Russischen Föderation:\nSehr geehrter Herr Schleining,\nin der Handelsregistersache\nRaul Logistics Hamburg UG (haftungsbeschränkt)\nergeben sich aus den mir vorliegenden Unterlagen, nämlich Löschungsantrag des Finanzamts Lübeck vom 14.02.2025,\nAnhaltspunkte dafür, dass die Gesellschaft, als deren Geschäftsführer Sie noch eingetragen sind, vermögenslos ist.\nIch prüfe daher, ob die Gesellschaft wegen Vermögenslosigkeit gemäß § 394 FamFG zu löschen ist.\nIch gebe Ihnen Gelegenheit, dazu binnen einer Frist von   1 Monat   Stellung zu nehmen.\nWeiter bitte ich Sie, binnen derselben Frist folgende Auskünfte zu erteilen:\nHat die obige Gesellschaft noch Vermögen? Wenn ja, welche Vermögensgegenstände besitzt sie?\nIst die Gesellschaft Partei eines noch nicht rechtskräftig abgeschlossenen Rechtsstreits?\nFindet sonst noch eine Abwicklung statt?\n\nMit freundlichen Grüßen\nOstermann\nDipl.-Rechtspflegerin (FH)"
    },
    {
      "date": "2025-02-24",
      "id": "102073",
      "original_text": "Löschungsankündigung\nBaden-Württemberg Amtsgericht Mannheim HRA 430984\nKindermann GmbH & Co. Objekt Crottendorf KG – Weinheim",
      "type": "Löschungsankündigung",
      "state": "Baden-Württemberg",
      "amtsgericht": "Amtsgericht Mannheim",
      "registernummer": "HRA 430984",
      "registerart": "HRA",
      "company_name": "Kindermann GmbH & Co. Objekt Crottendorf KG",
      "company_seat": "Weinheim",
      "details": "24.02.2025 (Bekanntmachungsdatum)\n\nBaden-Württemberg Amtsgericht Mannheim HRA 430984\nLöschungsankündigung\n\nKindermann GmbH & Co. Objekt Crottendorf KG\nKommanditgesellschaft\nWeinheim\n\nDas Gericht beabsichtigt, die Gesellschaft wegen Vermögenslosigkeit im Handelsregister von Amts wegen nach § 394 FamFG zu löschen. Die Frist zur Geltendmachung eines Widerspruchs gegen die beabsichtigte Löschung ist auf einen Monat ab Veröffentlichung bestimmt."
    },
    {
      "date": "2025-02-24",
      "id": "102074",
      "original_text": "Löschungsankündigung\nBrandenburg Amtsgericht Potsdam HRB 35906\nPille Bau GmbH – Schönwalde-Glien",
      "type": "Löschungsankündigung",
      "state": "Brandenburg",
      "amtsgericht": "Amtsgericht Potsdam",
      "registernummer": "HRB 35906",
      "registerart": "HRB",
      "company_name": "Pille Bau GmbH",
      "company_seat": "Schönwalde-Glien",
      "details": "24.02.2025 (Bekanntmachungsdatum)\n\nBrandenburg Amtsgericht Potsdam HRB 35906\nLöschungsankündigung\n\nPille Bau GmbH\nGesellschaft mit beschränkter Haftung\nSchönwalde-Glien\n\nBei der nachstehenden Gesellschaft wird das Amtslöschungsverfahren gemäß § 394 FamFG eingeleitet. Widerspruchsfrist: 8 Wochen."
    },
    {
      "date": "2025-02-24",
      "id": "102075",
      "original_text": "Registerbekanntmachung nach dem Umwandlungsgesetz\nSachsen Amtsgericht Chemnitz HRB 30642\nSchmitt Prof. Möhlmann & Collegen Wirtschaftskanzlei - Insolvenzverwalter Aktiengesellschaft – Zwickau",
      "type": "Registerbekanntmachung nach dem Umwandlungsgesetz",
      "state": "Sachsen",
      "amtsgericht": "Amtsgericht Chemnitz",
      "registernummer": "HRB 30642",
      "registerart": "HRB",
      "company_name": "Schmitt Prof. Möhlmann & Collegen Wirtschaftskanzlei - Insolvenzverwalter Aktiengesellschaft",
      "company_seat": "Zwickau",
      "details": "24.02.2025 (Bekanntmachungsdatum)\n\nSachsen Amtsgericht Chemnitz HRB 30642\nRegisterbekanntmachung nach dem Umwandlungsgesetz 24.02.2025 (Eintragungsdatum)\n\nSchmitt Prof. Möhlmann & Collegen Wirtschaftskanzlei - Insolvenzverwalter Aktiengesellschaft\nAktiengesellschaft\nZwickau\n\nDen Gläubigern der an der Umwandlung beteiligten Rechtsträger ist, wenn sie binnen sechs Monaten nach dem Tag, an dem die Eintragung der Umwandlung in das Register des Sitzes desjenigen Rechtsträgers, dessen Gläubiger sie sind, nach § 19 Abs. 3 UmwG als bekannt gemacht gilt, ihren Anspruch nach Grund und Höhe in Textform anmelden, Sicherheit zu leisten, soweit sie nicht Befriedigung verlangen können. Dieses Recht steht den Gläubigern jedoch nur zu, wenn sie glaubhaft machen, dass durch die Umwandlung die Erfüllung der Forderung gefährdet wird."
    },
    {
      "date": "2025-02-24",
      "id": "102076",
      "original_text": "Löschungsankündigung\nSachsen Amtsgericht Dresden HRB 33156\nDGH ZIT Verwaltungs GmbH – Dohna",
      "type": "Löschungsankündigung",
      "state": "Sachsen",
      "amtsgericht": "Amtsgericht Dresden",
      "registernummer": "HRB 33156",
      "registerart": "HRB",
      "company_name": "DGH ZIT Verwaltungs GmbH",
      "company_seat": "Dohna",
      "details": "24.02.2025 (Bekanntmachungsdatum)\n\nSachsen Amtsgericht Dresden HRB 33156\nLöschungsankündigung\n\nDGH ZIT Verwaltungs GmbH\nGesellschaft mit beschränkter Haftung\nDohna\n\nDas Registergericht beabsichtigt, die im Handelsregister eingetragene Gesellschaft von Amts wegen nach § 394 FamFG zu löschen. Die Frist zu Erhebung eines Widerspruchs gegen die beabsichtigte Löschung wird auf einen Monat festgesetzt."
    },
    {
      "date": "2025-02-24",
      "id": "102077",
      "original_text": "Löschungsankündigung\nNiedersachsen Amtsgericht Lüneburg HRB 207295\nOfficemanagement Hänsel UG (haftungsbeschänkt) – Celle",
      "type": "Löschungsankündigung",
      "state": "Niedersachsen",
      "amtsgericht": "Amtsgericht Lüneburg",
      "registernummer": "HRB 207295",
      "registerart": "HRB",
      "company_name": "Officemanagement Hänsel UG (haftungsbeschänkt)",
      "company_seat": "Celle",
      "details": "24.02.2025 (Bekanntmachungsdatum)\n\nNiedersachsen Amtsgericht Lüneburg HRB 207295\nLöschungsankündigung\n\nOfficemanagement Hänsel UG (haftungsbeschänkt)\nGesellschaft mit beschränkter Haftung\nCelle\n\nDas Registergericht beabsichtigt, die Gesellschaft von Amts wegen nach § 394 FamFG zu löschen. Die Frist zur Erhebung eines Widerspruchs ist auf 1 Monat ab dieser Registerbekanntmachung festgesetzt."
    },
    {
      "date": "2025-02-24",
      "id": "102078",
      "original_text": "Löschungsankündigung\nNiedersachsen Amtsgericht Osnabrück HRB 200312\nKonTech-redesign GmbH – Georgsmarienhütte",
      "type": "Löschungsankündigung",
      "state": "Niedersachsen",
      "amtsgericht": "Amtsgericht Osnabrück",
      "registernummer": "HRB 200312",
      "registerart": "HRB",
      "company_name": "KonTech-redesign GmbH",
      "company_seat": "Georgsmarienhütte",
      "details": "24.02.2025 (Bekanntmachungsdatum)\n\nNiedersachsen Amtsgericht Osnabrück HRB 200312\nLöschungsankündigung\n\nKonTech-redesign GmbH\nGesellschaft mit beschränkter Haftung\nGeorgsmarienhütte\n\nDas Registergericht beabsichtigt, die Gesellschaft von Amts wegen nach § 394 FamFG wegen Vermögenslosigkeit zu löschen. Die Frist zur Erhebung eines Widerspruchs ist auf 1 Monat ab dieser Registerbekanntmachung festgesetzt."
    },
    {
      "date": "2025-02-24",
      "id": "102079",
      "original_text": "Löschungsankündigung\nNiedersachsen Amtsgericht Tostedt HRB 210808\nECOM Factory GmbH – Zeven",
      "type": "Löschungsankündigung",
      "state": "Niedersachsen",
      "amtsgericht": "Amtsgericht Tostedt",
      "registernummer": "HRB 210808",
      "registerart": "HRB",
      "company_name": "ECOM Factory GmbH",
      "company_seat": "Zeven",
      "details": "24.02.2025 (Bekanntmachungsdatum)\n\nNiedersachsen Amtsgericht Tostedt HRB 210808\nLöschungsankündigung\n\nECOM Factory GmbH\nGesellschaft mit beschränkter Haftung\nZeven\n\nDas Registergericht beabsichtigt, die Gesellschaft von Amts wegen nach § 394 FamFG zu löschen. Die Frist zur Erhebung eines Widerspruchs ist auf 1 Monat ab dieser Registerbekanntmachung festgesetzt."
    },
    {
      "date": "2025-02-24",
      "id": "102080",
      "original_text": "Löschungsankündigung\nNiedersachsen Amtsgericht Hildesheim HRB 207784\nTEST-E-MOBIL-SARSTEDT UG (haftungsbeschränkt) – Sarstedt",
      "type": "Löschungsankündigung",
      "state": "Niedersachsen",
      "amtsgericht": "Amtsgericht Hildesheim",
      "registernummer": "HRB 207784",
      "registerart": "HRB",
      "company_name": "TEST-E-MOBIL-SARSTEDT UG (haftungsbeschränkt)",
      "company_seat": "Sarstedt",
      "details": "24.02.2025 (Bekanntmachungsdatum)\n\nNiedersachsen Amtsgericht Hildesheim HRB 207784\nLöschungsankündigung\n\nTEST-E-MOBIL-SARSTEDT UG (haftungsbeschränkt)\nGesellschaft mit beschränkter Haftung\nSarstedt\n\nDas Registergericht beabsichtigt, die Gesellschaft von Amts wegen nach § 394 FamFG zu löschen. Die Frist zur Erhebung eines Widerspruchs ist auf 1 Monat ab dieser Registerbekanntmachung festgesetzt."
    },
    {
      "date": "2025-02-24",
      "id": "102081",
      "original_text": "Sonstige Registerbekanntmachung\nNiedersachsen Amtsgericht Göttingen HRB 447\nStädtische Wohnungsbau-GmbH Göttingen – Göttingen",
      "type": "Sonstige Registerbekanntmachung",
      "state": "Niedersachsen",
      "amtsgericht": "Amtsgericht Göttingen",
      "registernummer": "HRB 447",
      "registerart": "HRB",
      "company_name": "Städtische Wohnungsbau-GmbH Göttingen",
      "company_seat": "Göttingen",
      "details": "24.02.2025 (Bekanntmachungsdatum)\n\nNiedersachsen Amtsgericht Göttingen HRB 447\nSonstige Registerbekanntmachung\n\nStädtische Wohnungsbau-GmbH Göttingen\nGesellschaft mit beschränkter Haftung\nGöttingen\n\nDie Liste der Mitglieder des Aufsichtsrats wurde beim Registergericht eingereicht."
    },
    {
      "date": "2025-02-24",
      "id": "102082",
      "original_text": "Löschungsankündigung\nNiedersachsen Amtsgericht Lüneburg HRB 207128\nfirst-class-tex GmbH – Tosterglope",
      "type": "Löschungsankündigung",
      "state": "Niedersachsen",
      "amtsgericht": "Amtsgericht Lüneburg",
      "registernummer": "HRB 207128",
      "registerart": "HRB",
      "company_name": "first-class-tex GmbH",
      "company_seat": "Tosterglope",
      "details": "24.02.2025 (Bekanntmachungsdatum)\n\nNiedersachsen Amtsgericht Lüneburg HRB 207128\nLöschungsankündigung 24.02.2025 (Eintragungsdatum)\n\nfirst-class-tex GmbH\nGesellschaft mit beschränkter Haftung\nTosterglope\n\nDas Registergericht beabsichtigt, die Gesellschaft von Amts wegen nach § 394 FamFG zu löschen. Die Frist zur Erhebung eines Widerspruchs ist auf 1 Monat ab dieser Registerbekanntmachung festgesetzt."
    },
    {
      "date": "2025-02-24",
      "id": "102083",
      "original_text": "Einreichung neuer Dokumente\nBremen Amtsgericht Bremen HRB 20780\nCSM Deutschland GmbH – Bremen",
      "type": "Einreichung neuer Dokumente",
      "state": "Bremen",
      "amtsgericht": "Amtsgericht Bremen",
      "registernummer": "HRB 20780",
      "registerart": "HRB",
      "company_name": "CSM Deutschland GmbH",
      "company_seat": "Bremen",
      "details": "24.02.2025 (Bekanntmachungsdatum)\n\nBremen Amtsgericht Bremen HRB 20780\nEinreichung neuer Dokumente\n\nCSM Deutschland GmbH\nGesellschaft mit beschränkter Haftung\nBremen\n\nAls nicht eingetragen wird bekannt gemacht: Liste des Aufsichtsrats wurde eingereicht."
    },
    {
      "date": "2025-02-24",
      "id": "102084",
      "original_text": "Löschungsankündigung\nNordrhein-Westfalen Amtsgericht Krefeld HRB 13561\nSchmitz & Holtermann GmbH – Krefeld",
      "type": "Löschungsankündigung",
      "state": "Nordrhein-Westfalen",
      "amtsgericht": "Amtsgericht Krefeld",
      "registernummer": "HRB 13561",
      "registerart": "HRB",
      "company_name": "Schmitz & Holtermann GmbH",
      "company_seat": "Krefeld",
      "details": "24.02.2025 (Bekanntmachungsdatum)\n\nNordrhein-Westfalen Amtsgericht Krefeld HRB 13561\nLöschungsankündigung\n\nSchmitz & Holtermann GmbH\nGesellschaft mit beschränkter Haftung\nKrefeld\n\nDas Registergericht beabsichtigt die Gesellschaft von Amts wegen nach § 394 FamFG zu löschen. Die Frist zur Erhebung eines Widerspruchs ist auf einen Monat festgesetzt."
    },
    {
      "date": "2025-02-24",
      "id": "102085",
      "original_text": "Löschungsankündigung\nNordrhein-Westfalen Amtsgericht Bochum HRB 17991\nBab AlTaufir UG (haftungsbeschränkt) – Herne",
      "type": "Löschungsankündigung",
      "state": "Nordrhein-Westfalen",
      "amtsgericht": "Amtsgericht Bochum",
      "registernummer": "HRB 17991",
      "registerart": "HRB",
      "company_name": "Bab AlTaufir UG (haftungsbeschränkt)",
      "company_seat": "Herne",
      "details": "24.02.2025 (Bekanntmachungsdatum)\n\nNordrhein-Westfalen Amtsgericht Bochum HRB 17991\nLöschungsankündigung 25.02.2025 (Eintragungsdatum)\n\nBab AlTaufir UG (haftungsbeschränkt)\nGesellschaft mit beschränkter Haftung\nHerne\n\nDas Registergericht beabsichtigt die Gesellschaft von Amts wegen nach § 394 FamFG zu löschen. Die Frist zur Erhebung eines Widerspruchs ist auf drei Monate festgesetzt."
    },
    {
      "date": "2025-02-24",
      "id": "102086",
      "original_text": "Löschungsankündigung\nNordrhein-Westfalen Amtsgericht Düren HRB 8145\nTHYMOS GmbH – Linnich",
      "type": "Löschungsankündigung",
      "state": "Nordrhein-Westfalen",
      "amtsgericht": "Amtsgericht Düren",
      "registernummer": "HRB 8145",
      "registerart": "HRB",
      "company_name": "THYMOS GmbH",
      "company_seat": "Linnich",
      "details": "24.02.2025 (Bekanntmachungsdatum)\n\nNordrhein-Westfalen Amtsgericht Düren HRB 8145\nLöschungsankündigung\n\nTHYMOS GmbH\nGesellschaft mit beschränkter Haftung\nLinnich\n\nDas Registergericht beabsichtigt die Gesellschaft von Amts wegen nach § 394 FamFG zu löschen. Die Frist zur Erhebung eines Widerspruchs ist auf drei Monate festgesetzt."
    },
    {
      "date": "2025-02-24",
      "id": "102087",
      "original_text": "Löschungsankündigung\nNordrhein-Westfalen Amtsgericht Düsseldorf HRB 29202\nECS Transport-Logistik GmbH – Düsseldorf",
      "type": "Löschungsankündigung",
      "state": "Nordrhein-Westfalen",
      "amtsgericht": "Amtsgericht Düsseldorf",
      "registernummer": "HRB 29202",
      "registerart": "HRB",
      "company_name": "ECS Transport-Logistik GmbH",
      "company_seat": "Düsseldorf",
      "details": "24.02.2025 (Bekanntmachungsdatum)\n\nNordrhein-Westfalen Amtsgericht Düsseldorf HRB 29202\nLöschungsankündigung\n\nECS Transport-Logistik GmbH\nGesellschaft mit beschränkter Haftung\nDüsseldorf\n\nDas Registergericht beabsichtigt die Gesellschaft von Amts wegen nach § 394 FamFG zu löschen. Die Frist zur Erhebung eines Widerspruchs ist auf 3 Wochen festgesetzt.\n\nRechtsbehelfsbelehrung:\nDas Widerspruchsrecht steht jedem zu, der an der Unterlassung der Löschung ein berechtigtes Interesse hat. Der Widerspruch ist bei dem Amtsgericht Düsseldorf -Registergericht-, Werdener Straße 1, 40227 Düsseldorf schriftlich in deutscher Sprache oder zur Niederschrift der Geschäftsstelle einzulegen. Der Widerspruch kann auch zur Niederschrift der Geschäftsstelle eines jeden Amtsgerichtes abgegeben werden. Die Einlegung ist auch durch Übertragung eines elektronischen Dokuments an die elektronische Poststelle des Gerichts möglich. Das elektronische Dokument muss für die Bearbeitung durch das Gericht geeignet und mit einer qualifizierten elektronischen Signatur der verantwortenden Person versehen sein oder von der verantwortenden Person signiert und auf einem sicheren Übermittlungsweg gemäß § 130a ZPO nach näherer Maßgabe der Verordnung über die technischen Rahmenbedingungen des elektronischen Rechtsverkehrs und über das besondere elektronische Behördenpostfach (BGBl. I, S.3803) eingereicht werden. Weitere Informationen erhalten Sie auf der Internetseite www.justiz.de.\nDer Widerspruch muss spätestens innerhalb der gesetzten Frist nach dem Datum der Bekanntmachung der Löschungsankündigung bei dem Amtsgericht - Registergericht - Düsseldorf eingegangen sein.  Dies gilt auch dann, wenn der Widerspruch zur Niederschrift der Geschäftsstelle eines anderen Amtsgerichtes abgegeben wurde. Die Frist beginnt mit dem Tage der Bekanntmachung der Löschungsankündigung in dem für die Bekanntmachung der Eintragungen in das Handelsregister bestimmten elektronischen Informations- und Kommunikationssystem nach § 10 des Handelsgesetzbuches. Fällt das Ende der Frist auf einen Sonntag, einen allgemeinen Feiertag oder Sonnabend, so endet die Frist mit Ablauf des nächsten Werktages.\nDer Widerspruch muss die Bezeichnung der angefochtenen Löschungsankündigung sowie die Erklärung enthalten, dass Widerspruch gegen diese Löschungsankündigung eingelegt wird. Er ist zu unterzeichnen und soll begründet werden."
    },
    {
      "date": "2025-02-24",
      "id": "102088",
      "original_text": "Löschungsankündigung\nNordrhein-Westfalen Amtsgericht Krefeld HRB 19377\nDLV Vermietungs- und Gaststätten GmbH – Krefeld",
      "type": "Löschungsankündigung",
      "state": "Nordrhein-Westfalen",
      "amtsgericht": "Amtsgericht Krefeld",
      "registernummer": "HRB 19377",
      "registerart": "HRB",
      "company_name": "DLV Vermietungs- und Gaststätten GmbH",
      "company_seat": "Krefeld",
      "details": "24.02.2025 (Bekanntmachungsdatum)\n\nNordrhein-Westfalen Amtsgericht Krefeld HRB 19377\nLöschungsankündigung\n\nDLV Vermietungs- und Gaststätten GmbH\nGesellschaft mit beschränkter Haftung\nKrefeld\n\nDas Registergericht beabsichtigt die Gesellschaft von Amts wegen nach § 394 FamFG zu löschen. Die Frist zur Erhebung eines Widerspruchs ist auf einen Monat festgesetzt."
    },
    {
      "date": "2025-02-24",
      "id": "102089",
      "original_text": "Löschungsankündigung\nNordrhein-Westfalen Amtsgericht Krefeld HRB 14370\nMAZi security systems GmbH – Krefeld",
      "type": "Löschungsankündigung",
      "state": "Nordrhein-Westfalen",
      "amtsgericht": "Amtsgericht Krefeld",
      "registernummer": "HRB 14370",
      "registerart": "HRB",
      "company_name": "MAZi security systems GmbH",
      "company_seat": "Krefeld",
      "details": "24.02.2025 (Bekanntmachungsdatum)\n\nNordrhein-Westfalen Amtsgericht Krefeld HRB 14370\nLöschungsankündigung\n\nMAZi security systems GmbH\nGesellschaft mit beschränkter Haftung\nKrefeld\n\nDas Registergericht beabsichtigt die Gesellschaft von Amts wegen nach § 394 FamFG zu löschen. Die Frist zur Erhebung eines Widerspruchs ist auf einen Monat festgesetzt."
    },
    {
      "date": "2025-02-24",
      "id": "102090",
      "original_text": "Löschungsankündigung\nNordrhein-Westfalen Amtsgericht Bad Oeynhausen HRB 15479\nBest Body Performance UG (haftungsbeschränkt) – Hüllhorst",
      "type": "Löschungsankündigung",
      "state": "Nordrhein-Westfalen",
      "amtsgericht": "Amtsgericht Bad Oeynhausen",
      "registernummer": "HRB 15479",
      "registerart": "HRB",
      "company_name": "Best Body Performance UG (haftungsbeschränkt)",
      "company_seat": "Hüllhorst",
      "details": "24.02.2025 (Bekanntmachungsdatum)\n\nNordrhein-Westfalen Amtsgericht Bad Oeynhausen HRB 15479\nLöschungsankündigung\n\nBest Body Performance UG (haftungsbeschränkt)\nGesellschaft mit beschränkter Haftung\nHüllhorst\n\nDas Registergericht beabsichtigt die Gesellschaft von Amts wegen nach § 394 FamFG zu löschen. Die Frist zur Erhebung eines Widerspruchs ist auf einen Monat festgesetzt."
    },
    {
      "date": "2025-02-24",
      "id": "102091",
      "original_text": "Löschungsankündigung\nNordrhein-Westfalen Amtsgericht Köln HRB 86879\nST Gastro GmbH – Radevormwald",
      "type": "Löschungsankündigung",
      "state": "Nordrhein-Westfalen",
      "amtsgericht": "Amtsgericht Köln",
      "registernummer": "HRB 86879",
      "registerart": "HRB",
      "company_name": "ST Gastro GmbH",
      "company_seat": "Radevormwald",
      "details": "24.02.2025 (Bekanntmachungsdatum)\n\nNordrhein-Westfalen Amtsgericht Köln HRB 86879\nLöschungsankündigung\n\nST Gastro GmbH\nGesellschaft mit beschränkter Haftung\nRadevormwald\n\nDas Registergericht beabsichtigt die Gesellschaft von Amts wegen nach § 394 FamFG zu löschen. Die Frist zur Erhebung eines Widerspruchs ist auf einen Monat festgesetzt."
    },
    {
      "date": "2025-02-24",
      "id": "102092",
      "original_text": "Löschungsankündigung\nNordrhein-Westfalen Amtsgericht Gelsenkirchen HRB 15344\nE.M.B. Dienstleistungs-GmbH – Gelsenkirchen",
      "type": "Löschungsankündigung",
      "state": "Nordrhein-Westfalen",
      "amtsgericht": "Amtsgericht Gelsenkirchen",
      "registernummer": "HRB 15344",
      "registerart": "HRB",
      "company_name": "E.M.B. Dienstleistungs-GmbH",
      "company_seat": "Gelsenkirchen",
      "details": "24.02.2025 (Bekanntmachungsdatum)\n\nNordrhein-Westfalen Amtsgericht Gelsenkirchen HRB 15344\nLöschungsankündigung\n\nE.M.B. Dienstleistungs-GmbH\nGesellschaft mit beschränkter Haftung\nGelsenkirchen\n\nDas Gericht beabsichtigt, die Gesellschaft E.M.B. Dienstleistungs-GmbH mit Sitz in Gelsenkirchen, HRB 15344 Amtsgericht Gelsenkirchen, wegen Vermögenslosigkeit zu löschen.\n\nHiermit wird denjenigen, die an der Unterlassung der Löschung ein berechtigtes Interesse haben, gem. § 394 Abs. 2 FamFG Gelegenheit gegeben, gegen dieses Vorhaben binnen eines Monats nach dieser Bekanntmachung Widerspruch einzulegen. Der Widerspruch kann schriftlich oder zu Protokoll der Geschäftsstelle erhoben werden."
    },
    {
      "date": "2025-02-24",
      "id": "102093",
      "original_text": "Registerbekanntmachung nach dem Umwandlungsgesetz\nNordrhein-Westfalen Amtsgericht Paderborn HRA 8870\nDentalAesthetics e.K. – Paderborn",
      "type": "Registerbekanntmachung nach dem Umwandlungsgesetz",
      "state": "Nordrhein-Westfalen",
      "amtsgericht": "Amtsgericht Paderborn",
      "registernummer": "HRA 8870",
      "registerart": "HRA",
      "company_name": "DentalAesthetics e.K.",
      "company_seat": "Paderborn",
      "details": "24.02.2025 (Bekanntmachungsdatum)\n\nNordrhein-Westfalen Amtsgericht Paderborn HRA 8870\nRegisterbekanntmachung nach dem Umwandlungsgesetz 24.02.2025 (Eintragungsdatum)\n\nDentalAesthetics e.K.\nEinzelkaufmann / Einzelkauffrau\nPaderborn\n\nDen Gläubigern der an der Verschmelzung beteiligten Rechtsträger ist, wenn sie binnen sechs Monaten nach dem Tag, an dem die Eintragung der Verschmelzung in das Register des Sitzes desjenigen Rechtsträgers, dessen Gläubiger sie sind, nach § 19 Absatz 3 UmwG als bekanntgemacht gilt, ihren Anspruch nach Grund und Höhe schriftlich anmelden, Sicherheit zu leisten, soweit sie nicht Befriedigung verlangen können. Dieses Recht steht den Gläubigern jedoch nur zu, wenn sie glaubhaft machen, dass durch die Verschmelzung die Erfüllung ihrer Forderung gefährdet wird."
    },
    {
      "date": "2025-02-24",
      "id": "102094",
      "original_text": "Löschungsankündigung\nNordrhein-Westfalen Amtsgericht Neuss HRB 22732\nJP Abbruch UG (haftungsbeschränkt) – Neuss",
      "type": "Löschungsankündigung",
      "state": "Nordrhein-Westfalen",
      "amtsgericht": "Amtsgericht Neuss",
      "registernummer": "HRB 22732",
      "registerart": "HRB",
      "company_name": "JP Abbruch UG (haftungsbeschränkt)",
      "company_seat": "Neuss",
      "details": "24.02.2025 (Bekanntmachungsdatum)\n\nNordrhein-Westfalen Amtsgericht Neuss HRB 22732\nLöschungsankündigung\n\nJP Abbruch UG (haftungsbeschränkt)\nGesellschaft mit beschränkter Haftung\nNeuss\n\nDas Registergericht beabsichtigt die Gesellschaft von Amts wegen nach § 394 FamFG zu löschen. Die Frist zur Erhebung eines Widerspruchs ist auf einen Monat festgesetzt.\nRechtsbehelfsbelehrung:\nGegen diese Verfügung können Sie Widerspruch einlegen.\nDer Widerspruch ist bei dem Amtsgericht Neuss - Registergericht -, Breite Str. 48, 41460 Neuss schriftlich in deutscher Sprache oder zur Niederschrift der Geschäftsstelle einzulegen.\nDer Widerspruch kann auch zur Niederschrift der Geschäftsstelle eines jeden Amtsgerichtes abgegeben werden.\nDie Einlegung ist auch durch Übertragung eines elektronischen Dokuments an die elektronische Poststelle des Gerichts möglich. Das elektronische Dokument muss für die Bearbeitung durch das Gericht geeignet und mit einer qualifizierten Abs. 1 FamFG zu löschen. Frist zur Geltendmachung eines Widerspruchs: 1 Monat.\nelektronischen Signatur der verantwortenden Person versehen sein oder von der verantwortenden Person signiert und auf einem sicheren Übermittlungsweg gemäß § 130a ZPO nach näherer Maßgabe der Verordnung über die technischen Rahmenbedingungen des elektronischen Rechtsverkehrs und über das besondere elektronische Behördenpostfach (BGBl. I, S.3803) eingereicht werden. Weitere Informationen erhalten Sie auf der Internetseite www.justiz.de.\nDer Widerspruch muss spätestens innerhalb der gesetzten Frist nach der schriftlichen Bekanntgabe der Verfügung bei dem Amtsgericht - Registergericht - Neuss eingegangen sein. Dies gilt auch dann, wenn der Widerspruch zur Niederschrift der Geschäftsstelle eines anderen Amtsgerichtes abgegeben wurde. Die Frist beginnt mit der schriftlichen Bekanntgabe der Verfügung. Die Bekanntgabe ist entweder durch Zustellung oder am dritten Tage nach Aufgabe zur Post bewirkt. Fällt das Ende der Frist auf einen Sonntag, einen allgemeinen Feiertag oder Sonnabend, so endet die Frist mit Ablauf des nächsten Werktages.\n\nDer Widerspruch muss die Bezeichnung der angefochtenen Verfügung sowie die Erklärung enthalten, dass Widerspruch gegen diese Verfügung eingelegt wird. Er ist zu unterzeichnen und soll begründet werden."
    },
    {
      "date": "2025-02-24",
      "id": "102095",
      "original_text": "Löschungsankündigung\nNordrhein-Westfalen Amtsgericht Wuppertal HRA 23354\nTherapaedicum Wuppertal GmbH & Co.KG – Wuppertal",
      "type": "Löschungsankündigung",
      "state": "Nordrhein-Westfalen",
      "amtsgericht": "Amtsgericht Wuppertal",
      "registernummer": "HRA 23354",
      "registerart": "HRA",
      "company_name": "Therapaedicum Wuppertal GmbH & Co.KG",
      "company_seat": "Wuppertal",
      "details": "24.02.2025 (Bekanntmachungsdatum)\n\nNordrhein-Westfalen Amtsgericht Wuppertal HRA 23354\nLöschungsankündigung 24.02.2025 (Eintragungsdatum)\n\nTherapaedicum Wuppertal GmbH & Co.KG\nKommanditgesellschaft\nWuppertal\n\nDas Registergericht beabsichtigt die Firma von Amts wegen nach § 393 FamFG zu löschen. Die Frist zur Erhebung eines Widerspruchs ist auf drei Monate festgesetzt."
    },
    {
      "date": "2025-02-24",
      "id": "102096",
      "original_text": "Löschungsankündigung\nNordrhein-Westfalen Amtsgericht Düsseldorf HRB 93960\nCrown Transport GmbH – Düsseldorf",
      "type": "Löschungsankündigung",
      "state": "Nordrhein-Westfalen",
      "amtsgericht": "Amtsgericht Düsseldorf",
      "registernummer": "HRB 93960",
      "registerart": "HRB",
      "company_name": "Crown Transport GmbH",
      "company_seat": "Düsseldorf",
      "details": "24.02.2025 (Bekanntmachungsdatum)\n\nNordrhein-Westfalen Amtsgericht Düsseldorf HRB 93960\nLöschungsankündigung\n\nCrown Transport GmbH\nGesellschaft mit beschränkter Haftung\nDüsseldorf\n\nDas Registergericht beabsichtigt die Gesellschaft von Amts wegen nach § 394 Abs. 1 FamFG zu löschen. Die Frist zur Erhebung eines Widerspruchs ist auf 3 Wochen festgesetzt.\n\nRechtsbehelfsbelehrung:\nDas Widerspruchsrecht steht jedem zu, der an der Unterlassung der Löschung ein berechtigtes Interesse hat. Der Widerspruch ist bei dem Amtsgericht Düsseldorf -Registergericht-, Werdener Straße 1, 40227 Düsseldorf schriftlich in deutscher Sprache oder zur Niederschrift der Geschäftsstelle einzulegen. Der Widerspruch kann auch zur Niederschrift der Geschäftsstelle eines jeden Amtsgerichtes abgegeben werden. Die Einlegung ist auch durch Übertragung eines elektronischen Dokuments an die elektronische Poststelle des Gerichts möglich. Das elektronische Dokument muss für die Bearbeitung durch das Gericht geeignet und mit einer qualifizierten elektronischen Signatur der verantwortenden Person versehen sein oder von der verantwortenden Person signiert und auf einem sicheren Übermittlungsweg gemäß § 130a ZPO nach näherer Maßgabe der Verordnung über die technischen Rahmenbedingungen des elektronischen Rechtsverkehrs und über das besondere elektronische Behördenpostfach (BGBl. I, S.3803) eingereicht werden. Weitere Informationen erhalten Sie auf der Internetseite www.justiz.de.\nDer Widerspruch muss spätestens innerhalb der gesetzten Frist nach dem Datum der Bekanntmachung der Löschungsankündigung bei dem Amtsgericht - Registergericht - Düsseldorf eingegangen sein.  Dies gilt auch dann, wenn der Widerspruch zur Niederschrift der Geschäftsstelle eines anderen Amtsgerichtes abgegeben wurde. Die Frist beginnt mit dem Tage der Bekanntmachung der Löschungsankündigung in dem für die Bekanntmachung der Eintragungen in das Handelsregister bestimmten elektronischen Informations- und Kommunikationssystem nach § 10 des Handelsgesetzbuches. Fällt das Ende der Frist auf einen Sonntag, einen allgemeinen Feiertag oder Sonnabend, so endet die Frist mit Ablauf des nächsten Werktages.\nDer Widerspruch muss die Bezeichnung der angefochtenen Löschungsankündigung sowie die Erklärung enthalten, dass Widerspruch gegen diese Löschungsankündigung eingelegt wird. Er ist zu unterzeichnen und soll begründet werden."
    },
    {
      "date": "2025-02-24",
      "id": "102097",
      "original_text": "Löschungsankündigung\nNordrhein-Westfalen Amtsgericht Wuppertal HRB 33393\nUnitec Industrieservice GmbH – Solingen",
      "type": "Löschungsankündigung",
      "state": "Nordrhein-Westfalen",
      "amtsgericht": "Amtsgericht Wuppertal",
      "registernummer": "HRB 33393",
      "registerart": "HRB",
      "company_name": "Unitec Industrieservice GmbH",
      "company_seat": "Solingen",
      "details": "24.02.2025 (Bekanntmachungsdatum)\n\nNordrhein-Westfalen Amtsgericht Wuppertal HRB 33393\nLöschungsankündigung\n\nUnitec Industrieservice GmbH\nGesellschaft mit beschränkter Haftung\nSolingen\n\nDas Registergericht beabsichtigt die Gesellschaft von Amts wegen nach § 394 FamFG zu löschen. Die Frist zur Erhebung eines Widerspruchs ist auf einen Monat festgesetzt."
    },
    {
      "date": "2025-02-24",
      "id": "102098",
      "original_text": "Löschungsankündigung\nNordrhein-Westfalen Amtsgericht Bonn HRA 7699\nGartencenter A. & S. Beckert KG – Bonn",
      "type": "Löschungsankündigung",
      "state": "Nordrhein-Westfalen",
      "amtsgericht": "Amtsgericht Bonn",
      "registernummer": "HRA 7699",
      "registerart": "HRA",
      "company_name": "Gartencenter A. & S. Beckert KG",
      "company_seat": "Bonn",
      "details": "24.02.2025 (Bekanntmachungsdatum)\n\nNordrhein-Westfalen Amtsgericht Bonn HRA 7699\nLöschungsankündigung\n\nGartencenter A. & S. Beckert KG\nKommanditgesellschaft\nBonn\n\nDas Registergericht beabsichtigt die Firma von Amts wegen nach § 394 FamFG zu löschen. Die Frist zur Erhebung eines Widerspruchs ist auf einen Monat festgesetzt."
    },
    {
      "date": "2025-02-24",
      "id": "102099",
      "original_text": "Löschungsankündigung\nNordrhein-Westfalen Amtsgericht Siegen HRB 12594\nFreund Holding GmbH – Siegen",
      "type": "Löschungsankündigung",
      "state": "Nordrhein-Westfalen",
      "amtsgericht": "Amtsgericht Siegen",
      "registernummer": "HRB 12594",
      "registerart": "HRB",
      "company_name": "Freund Holding GmbH",
      "company_seat": "Siegen",
      "details": "24.02.2025 (Bekanntmachungsdatum)\n\nNordrhein-Westfalen Amtsgericht Siegen HRB 12594\nLöschungsankündigung\n\nFreund Holding GmbH\nGesellschaft mit beschränkter Haftung\nSiegen\n\nDas Registergericht beabsichtigt die Gesellschaft von Amts wegen nach § 394 FamFG zu löschen. Die Frist zur Erhebung eines Widerspruchs ist auf drei Monate festgesetzt."
    },
    {
      "date": "2025-02-24",
      "id": "102100",
      "original_text": "Einreichung neuer Dokumente\nNordrhein-Westfalen Amtsgericht Düsseldorf HRB 80683\nSPIE Germany Switzerland Austria GmbH – Düsseldorf",
      "type": "Einreichung neuer Dokumente",
      "state": "Nordrhein-Westfalen",
      "amtsgericht": "Amtsgericht Düsseldorf",
      "registernummer": "HRB 80683",
      "registerart": "HRB",
      "company_name": "SPIE Germany Switzerland Austria GmbH",
      "company_seat": "Düsseldorf",
      "details": "24.02.2025 (Bekanntmachungsdatum)\n\nNordrhein-Westfalen Amtsgericht Düsseldorf HRB 80683\nEinreichung neuer Dokumente\n\nSPIE Germany Switzerland Austria GmbH\nGesellschaft mit beschränkter Haftung\nDüsseldorf\n\nDem Registergericht ist eine neue Liste der Mitglieder des Aufsichtsrates eingereicht worden."
    },
    {
      "date": "2025-02-24",
      "id": "102101",
      "original_text": "Einreichung neuer Dokumente\nNordrhein-Westfalen Amtsgericht Düsseldorf HRB 4724\nHenkel AG & Co. KGaA – Düsseldorf",
      "type": "Einreichung neuer Dokumente",
      "state": "Nordrhein-Westfalen",
      "amtsgericht": "Amtsgericht Düsseldorf",
      "registernummer": "HRB 4724",
      "registerart": "HRB",
      "company_name": "Henkel AG & Co. KGaA",
      "company_seat": "Düsseldorf",
      "details": "24.02.2025 (Bekanntmachungsdatum)\n\nNordrhein-Westfalen Amtsgericht Düsseldorf HRB 4724\nEinreichung neuer Dokumente\n\nHenkel AG & Co. KGaA\nKommanditgesellschaft auf Aktien\nDüsseldorf\n\nDem Registergericht ist eine neue Liste der Mitglieder des Aufsichtsrates eingereicht worden."
    },
    {
      "date": "2025-02-24",
      "id": "102102",
      "original_text": "Einreichung neuer Dokumente\nNordrhein-Westfalen Amtsgericht Köln HRB 122319\nmira hospitality concepts AG – Köln",
      "type": "Einreichung neuer Dokumente",
      "state": "Nordrhein-Westfalen",
      "amtsgericht": "Amtsgericht Köln",
      "registernummer": "HRB 122319",
      "registerart": "HRB",
      "company_name": "mira hospitality concepts AG",
      "company_seat": "Köln",
      "details": "24.02.2025 (Bekanntmachungsdatum)\n\nNordrhein-Westfalen Amtsgericht Köln HRB 122319\nEinreichung neuer Dokumente 24.02.2025 (Eintragungsdatum)\n\nmira hospitality concepts AG\nAktiengesellschaft\nKöln\n\nDem Registergericht ist eine Liste der Mitglieder des Aufsichtsrates eingereicht worden."
    },
    {
      "date": "2025-02-24",
      "id": "102103",
      "original_text": "Löschungsankündigung\nNordrhein-Westfalen Amtsgericht Kleve HRB 16171\nGFY Trading UG (haftungsbeschränkt) – Kleve",
      "type": "Löschungsankündigung",
      "state": "Nordrhein-Westfalen",
      "amtsgericht": "Amtsgericht Kleve",
      "registernummer": "HRB 16171",
      "registerart": "HRB",
      "company_name": "GFY Trading UG (haftungsbeschränkt)",
      "company_seat": "Kleve",
      "details": "24.02.2025 (Bekanntmachungsdatum)\n\nNordrhein-Westfalen Amtsgericht Kleve HRB 16171\nLöschungsankündigung\n\nGFY Trading UG (haftungsbeschränkt)\nGesellschaft mit beschränkter Haftung\nKleve\n\nDas Registergericht beabsichtigt die Gesellschaft von Amts wegen nach § 394 FamFG zu löschen. Die Frist zur Erhebung eines Widerspruchs ist auf einen Monat festgesetzt."
    },
    {
      "date": "2025-02-24",
      "id": "102104",
      "original_text": "Löschungsankündigung\nNordrhein-Westfalen Amtsgericht Kleve HRA 5070\nSonnenschutz-Maßanfertigung Mohamed e.K. – Moers",
      "type": "Löschungsankündigung",
      "state": "Nordrhein-Westfalen",
      "amtsgericht": "Amtsgericht Kleve",
      "registernummer": "HRA 5070",
      "registerart": "HRA",
      "company_name": "Sonnenschutz-Maßanfertigung Mohamed e.K.",
      "company_seat": "Moers",
      "details": "24.02.2025 (Bekanntmachungsdatum)\n\nNordrhein-Westfalen Amtsgericht Kleve HRA 5070\nLöschungsankündigung 24.02.2025 (Eintragungsdatum)\n\nSonnenschutz-Maßanfertigung Mohamed e.K.\nEinzelkaufmann / Einzelkauffrau\nMoers\n\nDas Registergericht beabsichtigt die Firma von Amts wegen nach § 31 Abs. 2 HGB, § 393 FamFG zu löschen. Die Frist zur Erhebung eines Widerspruchs ist auf einen Monat festgesetzt."
    },
    {
      "date": "2025-02-24",
      "id": "102105",
      "original_text": "Einreichung neuer Dokumente\nThüringen Amtsgericht Jena HRB 203699\nWiedemann'sche Druckerei Aktiengesellschaft – Saalfeld",
      "type": "Einreichung neuer Dokumente",
      "state": "Thüringen",
      "amtsgericht": "Amtsgericht Jena",
      "registernummer": "HRB 203699",
      "registerart": "HRB",
      "company_name": "Wiedemann'sche Druckerei Aktiengesellschaft",
      "company_seat": "Saalfeld",
      "details": "24.02.2025 (Bekanntmachungsdatum)\n\nThüringen Amtsgericht Jena HRB 203699\nEinreichung neuer Dokumente 27.01.2025 (Eintragungsdatum)\n\nWiedemann'sche Druckerei Aktiengesellschaft\nAktiengesellschaft\nSaalfeld\n\nBekanntmachung gem. § 106 AktG: Aufgrund einer Veränderung in den Personen der Aufsichtsratsmitglieder ist durch den Vorstand eine neue Liste zum Handelsregister eingereicht worden."
    },
    {
      "date": "2025-02-24",
      "id": "102106",
      "original_text": "Einreichung neuer Dokumente\nThüringen Amtsgericht Jena HRB 516149\nOVATION AG – Bad Tabarz",
      "type": "Einreichung neuer Dokumente",
      "state": "Thüringen",
      "amtsgericht": "Amtsgericht Jena",
      "registernummer": "HRB 516149",
      "registerart": "HRB",
      "company_name": "OVATION AG",
      "company_seat": "Bad Tabarz",
      "details": "24.02.2025 (Bekanntmachungsdatum)\n\nThüringen Amtsgericht Jena HRB 516149\nEinreichung neuer Dokumente 02.01.2025 (Eintragungsdatum)\n\nOVATION AG\nAktiengesellschaft\nBad Tabarz\n\nBekanntmachung gem. § 106 AktG: Aufgrund einer Veränderung in den Personen der Aufsichtsratsmitglieder ist durch den Vorstand eine neue Liste zum Handelsregister eingereicht worden."
    },
    {
      "date": "2025-02-24",
      "id": "102107",
      "original_text": "Löschungsankündigung\nHessen Amtsgericht Darmstadt HRA 86662\nMarcel Schrom Consulting Ltd. & CO. KG – Babenhausen",
      "type": "Löschungsankündigung",
      "state": "Hessen",
      "amtsgericht": "Amtsgericht Darmstadt",
      "registernummer": "HRA 86662",
      "registerart": "HRA",
      "company_name": "Marcel Schrom Consulting Ltd. & CO. KG",
      "company_seat": "Babenhausen",
      "details": "24.02.2025 (Bekanntmachungsdatum)\n\nHessen Amtsgericht Darmstadt HRA 86662\nLöschungsankündigung 24.02.2025 (Eintragungsdatum)\n\nMarcel Schrom Consulting Ltd. & CO. KG\nKommanditgesellschaft\nBabenhausen\n\nDie oben genannte Firma ist nach hiesiger Erkenntnis erloschen.\n\nGemäß § 31 Abs. 2 HGB soll das Eröschen der Firma von Amts wegen in das Handelsregister einegtragen werden. Von diesem Vorhaben werden die bisherigen Gesellschafter oder deren Rechtsnachfolger auf diesem Wege unterrichtet. Zugleich wird ihnen zur etwaigen Geltendmachung eines Widerspruchs eine Frist von 3 Monaten bestimmt."
    },
    {
      "date": "2025-02-24",
      "id": "102108",
      "original_text": "Sonstige Registerbekanntmachung\nHessen Amtsgericht Frankfurt am Main HRB 114198\nVR Payment GmbH – Frankfurt am Main",
      "type": "Sonstige Registerbekanntmachung",
      "state": "Hessen",
      "amtsgericht": "Amtsgericht Frankfurt am Main",
      "registernummer": "HRB 114198",
      "registerart": "HRB",
      "company_name": "VR Payment GmbH",
      "company_seat": "Frankfurt am Main",
      "details": "24.02.2025 (Bekanntmachungsdatum)\n\nHessen Amtsgericht Frankfurt am Main HRB 114198\nSonstige Registerbekanntmachung 24.02.2025 (Eintragungsdatum)\n\nVR Payment GmbH\nGesellschaft mit beschränkter Haftung\nFrankfurt am Main\n\nDurch eine Änderung in den Personen der Aufsichtsratsmitglieder ist eine Liste der Mitglieder des Aufsichtsrates zum Handelsregister eingereicht worden."
    },
    {
      "date": "2025-02-24",
      "id": "102109",
      "original_text": "Löschungsankündigung\nHessen Amtsgericht Darmstadt HRB 92302\nEurope Team GmbH – Mörfelden-Walldorf",
      "type": "Löschungsankündigung",
      "state": "Hessen",
      "amtsgericht": "Amtsgericht Darmstadt",
      "registernummer": "HRB 92302",
      "registerart": "HRB",
      "company_name": "Europe Team GmbH",
      "company_seat": "Mörfelden-Walldorf",
      "details": "24.02.2025 (Bekanntmachungsdatum)\n\nHessen Amtsgericht Darmstadt HRB 92302\nLöschungsankündigung 22.02.2025 (Eintragungsdatum)\n\nEurope Team GmbH\nGesellschaft mit beschränkter Haftung\nMörfelden-Walldorf\n\nDas Registergericht beabsichtigt die im Handelsregister eingetragene Gesellschaft von Amts wegen nach § 394 FamFG zu löschen. Die Frist zur Erhebung eines Widerspruchs gegen die beabsichtigte Löschung wird auf 3 Monate festgesetzt."
    },
    {
      "date": "2025-02-24",
      "id": "102110",
      "original_text": "Löschungsankündigung\nHessen Amtsgericht Frankfurt am Main HRB 102185\nPowervoice GmbH – Frankfurt am Main",
      "type": "Löschungsankündigung",
      "state": "Hessen",
      "amtsgericht": "Amtsgericht Frankfurt am Main",
      "registernummer": "HRB 102185",
      "registerart": "HRB",
      "company_name": "Powervoice GmbH",
      "company_seat": "Frankfurt am Main",
      "details": "24.02.2025 (Bekanntmachungsdatum)\n\nHessen Amtsgericht Frankfurt am Main HRB 102185\nLöschungsankündigung\n\nPowervoice GmbH\nGesellschaft mit beschränkter Haftung\nFrankfurt am Main\n\nes ist beabsichtigt, Herrn Jin Hee Lee als Liquidator gemäß § 395 FamFG von Amts wegen aus dem  Handelsregister zu löschen, da eine Gewerbeuntersagung des Regierungspräsidium Darmstadt vorliegt.\nHiergegen kann innerhalb eines Zeitraums von einem Monat nach dieser Veröffentlichung  Widerspruch bei dem Amtsgericht Frankfurt am Main eingelegt werden."
    },
    {
      "date": "2025-02-24",
      "id": "102111",
      "original_text": "Sonstige Registerbekanntmachung\nHessen Amtsgericht Kassel VR 3473\nEMEK Solidarität – Kassel",
      "type": "Sonstige Registerbekanntmachung",
      "state": "Hessen",
      "amtsgericht": "Amtsgericht Kassel",
      "registernummer": "VR 3473",
      "registerart": "VR",
      "company_name": "EMEK Solidarität",
      "company_seat": "Kassel",
      "details": "24.02.2025 (Bekanntmachungsdatum)\n\nHessen Amtsgericht Kassel VR 3473\nSonstige Registerbekanntmachung 24.02.2025 (Eintragungsdatum)\n\nEMEK Solidarität\neingetragener Verein\nKassel\n\nDer Verein ist aufgelöst."
    },
    {
      "date": "2025-02-24",
      "id": "102112",
      "original_text": "Einreichung neuer Dokumente\nHessen Amtsgericht Frankfurt am Main HRB 126925\nFraport Facility Services GmbH – Frankfurt am Main",
      "type": "Einreichung neuer Dokumente",
      "state": "Hessen",
      "amtsgericht": "Amtsgericht Frankfurt am Main",
      "registernummer": "HRB 126925",
      "registerart": "HRB",
      "company_name": "Fraport Facility Services GmbH",
      "company_seat": "Frankfurt am Main",
      "details": "24.02.2025 (Bekanntmachungsdatum)\n\nHessen Amtsgericht Frankfurt am Main HRB 126925\nEinreichung neuer Dokumente\n\nFraport Facility Services GmbH\nGesellschaft mit beschränkter Haftung\nFrankfurt am Main\n\nDurch eine Änderung in den Personen der Aufsichtsratsmitglieder ist eine Liste der Mitglieder des Aufsichtsrates zum Handelsregister eingereicht worden."
    },
    {
      "date": "2025-02-24",
      "id": "102113",
      "original_text": "Löschungsankündigung\nHessen Amtsgericht Frankfurt am Main HRB 97665\nAKSA-Bau GmbH – Frankfurt am Main",
      "type": "Löschungsankündigung",
      "state": "Hessen",
      "amtsgericht": "Amtsgericht Frankfurt am Main",
      "registernummer": "HRB 97665",
      "registerart": "HRB",
      "company_name": "AKSA-Bau GmbH",
      "company_seat": "Frankfurt am Main",
      "details": "24.02.2025 (Bekanntmachungsdatum)\n\nHessen Amtsgericht Frankfurt am Main HRB 97665\nLöschungsankündigung 23.02.2025 (Eintragungsdatum)\n\nAKSA-Bau GmbH\nGesellschaft mit beschränkter Haftung\nFrankfurt am Main\n\nDas Registergericht beabsichtigt die im Handelsregister eingetragene Gesellschaft von Amts wegen nach § 394 FamFG zu löschen. Die Frist zur Erhebung eines Widerspruchs gegen die beabsichtigte Löschung wird auf 1 Monat festgesetzt."
    },
    {
      "date": "2025-02-24",
      "id": "102114",
      "original_text": "Löschungsankündigung\nHessen Amtsgericht Darmstadt HRB 98310\nHoppe Dachdeckermeister GmbH – Babenhausen",
      "type": "Löschungsankündigung",
      "state": "Hessen",
      "amtsgericht": "Amtsgericht Darmstadt",
      "registernummer": "HRB 98310",
      "registerart": "HRB",
      "company_name": "Hoppe Dachdeckermeister GmbH",
      "company_seat": "Babenhausen",
      "details": "24.02.2025 (Bekanntmachungsdatum)\n\nHessen Amtsgericht Darmstadt HRB 98310\nLöschungsankündigung\n\nHoppe Dachdeckermeister GmbH\nGesellschaft mit beschränkter Haftung\nBabenhausen\n\nDas Registergericht beabsichtigt die im Handelsregister eingetragene Gesellschaft von Amts wegen nach § 394 FamFG zu löschen. Die Frist zur Erhebung eines Widerspruchs gegen die beabsichtigte Löschung wird auf 3 Monate festgesetzt."
    },
    {
      "date": "2025-02-24",
      "id": "102115",
      "original_text": "Löschungsankündigung\nHessen Amtsgericht Frankfurt am Main HRB 91135\nAKOC-Consult UG (haftungsbeschränkt) – Frankfurt am Main",
      "type": "Löschungsankündigung",
      "state": "Hessen",
      "amtsgericht": "Amtsgericht Frankfurt am Main",
      "registernummer": "HRB 91135",
      "registerart": "HRB",
      "company_name": "AKOC-Consult UG (haftungsbeschränkt)",
      "company_seat": "Frankfurt am Main",
      "details": "24.02.2025 (Bekanntmachungsdatum)\n\nHessen Amtsgericht Frankfurt am Main HRB 91135\nLöschungsankündigung\n\nAKOC-Consult UG (haftungsbeschränkt)\nGesellschaft mit beschränkter Haftung\nFrankfurt am Main\n\nDas Registergericht beabsichtigt die im Handelsregister eingetragene Gesellschaft von Amts wegen nach § 394 FamFG zu löschen. Die Frist zur Erhebung eines Widerspruchs gegen die beabsichtigte Löschung wird auf 1 Monat festgesetzt."
    },
    {
      "date": "2025-02-24",
      "id": "102116",
      "original_text": "Löschungsankündigung\nHessen Amtsgericht Frankfurt am Main HRB 130699\nBATAX GmbH – Frankfurt am Main",
      "type": "Löschungsankündigung",
      "state": "Hessen",
      "amtsgericht": "Amtsgericht Frankfurt am Main",
      "registernummer": "HRB 130699",
      "registerart": "HRB",
      "company_name": "BATAX GmbH",
      "company_seat": "Frankfurt am Main",
      "details": "24.02.2025 (Bekanntmachungsdatum)\n\nHessen Amtsgericht Frankfurt am Main HRB 130699\nLöschungsankündigung\n\nBATAX GmbH\nGesellschaft mit beschränkter Haftung\nFrankfurt am Main\n\nDas Registergericht beabsichtigt die im Handelsregister eingetragene Gesellschaft von Amts wegen nach § 394 FamFG zu löschen. Die Frist zur Erhebung eines Widerspruchs gegen die beabsichtigte Löschung wird auf 1 Monat festgesetzt."
    },
    {
      "date": "2025-02-24",
      "id": "102117",
      "original_text": "Löschungsankündigung\nHessen Amtsgericht Friedberg HRB 10100\nLMGR Holding UG (haftungsbeschränkt) – Butzbach",
      "type": "Löschungsankündigung",
      "state": "Hessen",
      "amtsgericht": "Amtsgericht Friedberg",
      "registernummer": "HRB 10100",
      "registerart": "HRB",
      "company_name": "LMGR Holding UG (haftungsbeschränkt)",
      "company_seat": "Butzbach",
      "details": "24.02.2025 (Bekanntmachungsdatum)\n\nHessen Amtsgericht Friedberg HRB 10100\nLöschungsankündigung\n\nLMGR Holding UG (haftungsbeschränkt)\nGesellschaft mit beschränkter Haftung\nButzbach\n\nDas Registergericht beabsichtigt die im Handelsregister eingetragene Gesellschaft von Amts wegen nach § 394 FamFG zu löschen. Die Frist zur Erhebung eines Widerspruchs gegen die beabsichtigte Löschung wird auf 3 Monate festgesetzt."
    }
  ]
}