{
  "date": "2025-02-20",
  "date_of_scrape": "2025-02-21T04:08:44.833Z",
  "tool_version": "0.2.0",
  "number_of_announcements": 136,
  "announcements": [
    {
      "date": "2025-02-20",
      "id": "101771",
      "original_text": "Registerbekanntmachung nach dem Umwandlungsgesetz\nBayern Amtsgericht München HRB 73108\nPflaum Zahntechnik GmbH – München",
      "type": "Registerbekanntmachung nach dem Umwandlungsgesetz",
      "state": "Bayern",
      "amtsgericht": "Amtsgericht München",
      "registernummer": "HRB 73108",
      "registerart": "HRB",
      "company_name": "Pflaum Zahntechnik GmbH",
      "company_seat": "München",
      "details": "20.02.2025 (Bekanntmachungsdatum)\n\nBayern Amtsgericht München HRB 73108\nRegisterbekanntmachung nach dem Umwandlungsgesetz 19.02.2025 (Eintragungsdatum)\n\nPflaum Zahntechnik GmbH\nGesellschaft mit beschränkter Haftung\nMünchen\n\nDen Gläubigern der an der Verschmelzung beteiligten Rechtsträger ist, wenn sie binnen sechs Monaten nach dem Tag, an dem die Eintragung der Verschmelzung in das Register des Sitzes desjenigen Rechtsträgers, dessen Gläubiger sie sind, nach § 19 Abs. 3 UmwG als bekannt gemacht gilt, ihren Anspruch nach Grund und Höhe in Textform anmelden, Sicherheit zu leisten, soweit sie nicht Befriedigung verlangen können. Dieses Recht steht den Gläubigern jedoch nur zu, wenn sie glaubhaft machen, dass durch die Verschmelzung die Erfüllung ihrer Forderung gefährdet wird."
    },
    {
      "date": "2025-02-20",
      "id": "101772",
      "original_text": "Löschungsankündigung\nBayern Amtsgericht München HRA 115100\nPRIMUS Concept Sachsen-Zittau GmbH & Co. KG – Markt Indersdorf",
      "type": "Löschungsankündigung",
      "state": "Bayern",
      "amtsgericht": "Amtsgericht München",
      "registernummer": "HRA 115100",
      "registerart": "HRA",
      "company_name": "PRIMUS Concept Sachsen-Zittau GmbH & Co. KG",
      "company_seat": "Markt Indersdorf",
      "details": "20.02.2025 (Bekanntmachungsdatum)\n\nBayern Amtsgericht München HRA 115100\nLöschungsankündigung 19.02.2025 (Eintragungsdatum)\n\nPRIMUS Concept Sachsen-Zittau GmbH & Co. KG\nKommanditgesellschaft\nMarkt Indersdorf\n\nDas Registergericht beabsichtigt, die im Handelsregister eingetragene Firma wegen Vermögenslosigkeit von Amts wegen nach § 394 FamFG zu löschen. Die Frist zur Erhebung eines Widerspruchs ist auf drei Monate festgesetzt."
    },
    {
      "date": "2025-02-20",
      "id": "101773",
      "original_text": "Registerbekanntmachung nach dem Umwandlungsgesetz\nBayern Amtsgericht München HRB 217640\nJeannie Vier GmbH – München",
      "type": "Registerbekanntmachung nach dem Umwandlungsgesetz",
      "state": "Bayern",
      "amtsgericht": "Amtsgericht München",
      "registernummer": "HRB 217640",
      "registerart": "HRB",
      "company_name": "Jeannie Vier GmbH",
      "company_seat": "München",
      "details": "20.02.2025 (Bekanntmachungsdatum)\n\nBayern Amtsgericht München HRB 217640\nRegisterbekanntmachung nach dem Umwandlungsgesetz 19.02.2025 (Eintragungsdatum)\n\nJeannie Vier GmbH\nGesellschaft mit beschränkter Haftung\nMünchen\n\nDen Gläubigern der an der Verschmelzung beteiligten Rechtsträger ist, wenn sie binnen sechs Monaten nach dem Tag, an dem die Eintragung der Verschmelzung in das Register des Sitzes desjenigen Rechtsträgers, dessen Gläubiger sie sind, nach § 19 Abs. 3 UmwG als bekannt gemacht gilt, ihren Anspruch nach Grund und Höhe in Textform anmelden, Sicherheit zu leisten, soweit sie nicht Befriedigung verlangen können. Dieses Recht steht den Gläubigern jedoch nur zu, wenn sie glaubhaft machen, dass durch die Verschmelzung die Erfüllung ihrer Forderung gefährdet wird."
    },
    {
      "date": "2025-02-20",
      "id": "101774",
      "original_text": "Registerbekanntmachung nach dem Umwandlungsgesetz\nBayern Amtsgericht München HRB 241556\ncf-parts GmbH – Berg",
      "type": "Registerbekanntmachung nach dem Umwandlungsgesetz",
      "state": "Bayern",
      "amtsgericht": "Amtsgericht München",
      "registernummer": "HRB 241556",
      "registerart": "HRB",
      "company_name": "cf-parts GmbH",
      "company_seat": "Berg",
      "details": "20.02.2025 (Bekanntmachungsdatum)\n\nBayern Amtsgericht München HRB 241556\nRegisterbekanntmachung nach dem Umwandlungsgesetz 19.02.2025 (Eintragungsdatum)\n\ncf-parts GmbH\nGesellschaft mit beschränkter Haftung\nBerg\n\nDen Gläubigern der an der Verschmelzung beteiligten Rechtsträger ist, wenn sie binnen sechs Monaten nach dem Tag, an dem die Eintragung der Verschmelzung in das Register des Sitzes desjenigen Rechtsträgers, dessen Gläubiger sie sind, nach § 19 Abs. 3 UmwG als bekannt gemacht gilt, ihren Anspruch nach Grund und Höhe in Textform anmelden, Sicherheit zu leisten, soweit sie nicht Befriedigung verlangen können. Dieses Recht steht den Gläubigern jedoch nur zu, wenn sie glaubhaft machen, dass durch die Verschmelzung die Erfüllung ihrer Forderung gefährdet wird."
    },
    {
      "date": "2025-02-20",
      "id": "101775",
      "original_text": "Löschungsankündigung\nBayern Amtsgericht Nürnberg HRB 41309\ndresden-loft.de projektierungsgesellschaft UG (haftungsbeschränkt) – Nürnberg",
      "type": "Löschungsankündigung",
      "state": "Bayern",
      "amtsgericht": "Amtsgericht Nürnberg",
      "registernummer": "HRB 41309",
      "registerart": "HRB",
      "company_name": "dresden-loft.de projektierungsgesellschaft UG (haftungsbeschränkt)",
      "company_seat": "Nürnberg",
      "details": "20.02.2025 (Bekanntmachungsdatum)\n\nBayern Amtsgericht Nürnberg HRB 41309\nLöschungsankündigung\n\ndresden-loft.de projektierungsgesellschaft UG (haftungsbeschränkt)\nGesellschaft mit beschränkter Haftung\nNürnberg\n\nDas Registergericht beabsichtigt, die im Handelsregister eingetragene Gesellschaft wegen Vermögenslosigkeit von Amts wegen nach § 394 FamFG zu löschen. Die Frist zur Erhebung eines Widerspruchs ist auf einen Monat festgesetzt."
    },
    {
      "date": "2025-02-20",
      "id": "101776",
      "original_text": "Registerbekanntmachung nach dem Umwandlungsgesetz\nBayern Amtsgericht Nürnberg HRA 19945\nChristian Distler Verpachtung Reithalle e.K. – Leinburg, OT Diepersdorf",
      "type": "Registerbekanntmachung nach dem Umwandlungsgesetz",
      "state": "Bayern",
      "amtsgericht": "Amtsgericht Nürnberg",
      "registernummer": "HRA 19945",
      "registerart": "HRA",
      "company_name": "Christian Distler Verpachtung Reithalle e.K.",
      "company_seat": "Leinburg, OT Diepersdorf",
      "details": "20.02.2025 (Bekanntmachungsdatum)\n\nBayern Amtsgericht Nürnberg HRA 19945\nRegisterbekanntmachung nach dem Umwandlungsgesetz 19.02.2025 (Eintragungsdatum)\n\nChristian Distler Verpachtung Reithalle e.K.\nEinzelkaufmann / Einzelkauffrau\nLeinburg, OT Diepersdorf\n\nDen Gläubigern der an der Ausgliederung beteiligten Rechtsträger ist, wenn sie binnen sechs Monaten nach dem Tag, an dem die Eintragung der Ausgliederung in das Register des Sitzes desjenigen Rechtsträgers, dessen Gläubiger sie sind, nach §§ 125, 19 Abs. 3 UmwG als bekannt gemacht gilt, ihren Anspruch nach Grund und Höhe in Textform anmelden, Sicherheit zu leisten, soweit sie nicht Befriedigung verlangen können. Dieses Recht steht den Gläubigern jedoch nur zu, wenn sie glaubhaft machen, dass durch die Ausgliederung die Erfüllung ihrer Forderung gefährdet wird."
    },
    {
      "date": "2025-02-20",
      "id": "101777",
      "original_text": "Löschungsankündigung\nBayern Amtsgericht Nürnberg HRB 20408\nFBS, Franconia Business Services GmbH – Nürnberg",
      "type": "Löschungsankündigung",
      "state": "Bayern",
      "amtsgericht": "Amtsgericht Nürnberg",
      "registernummer": "HRB 20408",
      "registerart": "HRB",
      "company_name": "FBS, Franconia Business Services GmbH",
      "company_seat": "Nürnberg",
      "details": "20.02.2025 (Bekanntmachungsdatum)\n\nBayern Amtsgericht Nürnberg HRB 20408\nLöschungsankündigung\n\nFBS, Franconia Business Services GmbH\nGesellschaft mit beschränkter Haftung\nNürnberg\n\nDas Registergericht beabsichtigt, die im Handelsregister eingetragene Gesellschaft wegen Vermögenslosigkeit von Amts wegen nach § 394 FamFG zu löschen. Die Frist zur Erhebung eines Widerspruchs ist auf einen Monat festgesetzt."
    },
    {
      "date": "2025-02-20",
      "id": "101778",
      "original_text": "Registerbekanntmachung nach dem Umwandlungsgesetz\nBayern Amtsgericht Nürnberg HRA 19946\nChristian Distler Verpachtung Distlerhof e.K. – Leinburg, OT Diepersdorf",
      "type": "Registerbekanntmachung nach dem Umwandlungsgesetz",
      "state": "Bayern",
      "amtsgericht": "Amtsgericht Nürnberg",
      "registernummer": "HRA 19946",
      "registerart": "HRA",
      "company_name": "Christian Distler Verpachtung Distlerhof e.K.",
      "company_seat": "Leinburg, OT Diepersdorf",
      "details": "20.02.2025 (Bekanntmachungsdatum)\n\nBayern Amtsgericht Nürnberg HRA 19946\nRegisterbekanntmachung nach dem Umwandlungsgesetz 19.02.2025 (Eintragungsdatum)\n\nChristian Distler Verpachtung Distlerhof e.K.\nEinzelkaufmann / Einzelkauffrau\nLeinburg, OT Diepersdorf\n\nDen Gläubigern der an der Ausgliederung beteiligten Rechtsträger ist, wenn sie binnen sechs Monaten nach dem Tag, an dem die Eintragung der Ausgliederung in das Register des Sitzes desjenigen Rechtsträgers, dessen Gläubiger sie sind, nach §§ 125, 19 Abs. 3 UmwG als bekannt gemacht gilt, ihren Anspruch nach Grund und Höhe in Textform anmelden, Sicherheit zu leisten, soweit sie nicht Befriedigung verlangen können. Dieses Recht steht den Gläubigern jedoch nur zu, wenn sie glaubhaft machen, dass durch die Ausgliederung die Erfüllung ihrer Forderung gefährdet wird."
    },
    {
      "date": "2025-02-20",
      "id": "101779",
      "original_text": "Registerbekanntmachung nach dem Umwandlungsgesetz\nBayern Amtsgericht Aschaffenburg HRA 6697\nSK Werbung e.K. – Großheubach",
      "type": "Registerbekanntmachung nach dem Umwandlungsgesetz",
      "state": "Bayern",
      "amtsgericht": "Amtsgericht Aschaffenburg",
      "registernummer": "HRA 6697",
      "registerart": "HRA",
      "company_name": "SK Werbung e.K.",
      "company_seat": "Großheubach",
      "details": "20.02.2025 (Bekanntmachungsdatum)\n\nBayern Amtsgericht Aschaffenburg HRA 6697\nRegisterbekanntmachung nach dem Umwandlungsgesetz 19.02.2025 (Eintragungsdatum)\n\nSK Werbung e.K.\nEinzelkaufmann / Einzelkauffrau\nGroßheubach\n\nDen Gläubigern der an der Verschmelzung beteiligten Rechtsträger ist, wenn sie binnen sechs Monaten nach dem Tag, an dem die Eintragung der Verschmelzung in das Register des Sitzes desjenigen Rechtsträgers, dessen Gläubiger sie sind, nach § 19 Abs. 3 UmwG als bekannt gemacht gilt, ihren Anspruch nach Grund und Höhe in Textform anmelden, Sicherheit zu leisten, soweit sie nicht Befriedigung verlangen können. Dieses Recht steht den Gläubigern jedoch nur zu, wenn sie glaubhaft machen, dass durch die Verschmelzung die Erfüllung ihrer Forderung gefährdet wird."
    },
    {
      "date": "2025-02-20",
      "id": "101780",
      "original_text": "Einreichung neuer Dokumente\nBayern Amtsgericht Landshut HRB 9276\nGKC Dr. Öttl & Partner Dairy and Food Consulting AG – Eching",
      "type": "Einreichung neuer Dokumente",
      "state": "Bayern",
      "amtsgericht": "Amtsgericht Landshut",
      "registernummer": "HRB 9276",
      "registerart": "HRB",
      "company_name": "GKC Dr. Öttl & Partner Dairy and Food Consulting AG",
      "company_seat": "Eching",
      "details": "20.02.2025 (Bekanntmachungsdatum)\n\nBayern Amtsgericht Landshut HRB 9276\nEinreichung neuer Dokumente 19.02.2025 (Eintragungsdatum)\n\nGKC Dr. Öttl & Partner Dairy and Food Consulting AG\nAktiengesellschaft\nEching\n\nDem Amtsgericht Landshut -Registergericht- ist eine Liste der Mitglieder des Aufsichtsrats eingereicht worden, § 106 AktG."
    },
    {
      "date": "2025-02-20",
      "id": "101781",
      "original_text": "Registerbekanntmachung nach dem Umwandlungsgesetz\nBayern Amtsgericht München HRA 120730\nREFINA Vermögensverwaltungs KG – Pullach i. Isartal",
      "type": "Registerbekanntmachung nach dem Umwandlungsgesetz",
      "state": "Bayern",
      "amtsgericht": "Amtsgericht München",
      "registernummer": "HRA 120730",
      "registerart": "HRA",
      "company_name": "REFINA Vermögensverwaltungs KG",
      "company_seat": "Pullach i. Isartal",
      "details": "20.02.2025 (Bekanntmachungsdatum)\n\nBayern Amtsgericht München HRA 120730\nRegisterbekanntmachung nach dem Umwandlungsgesetz 19.02.2025 (Eintragungsdatum)\n\nREFINA Vermögensverwaltungs KG\nKommanditgesellschaft\nPullach i. Isartal\n\nDen Gläubigern des formwechselnden Rechtsträgers ist, wenn sie binnen sechs Monaten nach dem Tag, an dem die Eintragung des Formwechsels nach § 201 UmwG als bekannt gemacht gilt, ihren Anspruch nach Grund und Höhe in Textform anmelden, Sicherheit zu leisten, soweit sie nicht Befriedigung verlangen können. Dieses Recht steht den Gläubigern jedoch nur zu, wenn sie glaubhaft machen, dass durch den Formwechsel die Erfüllung ihrer Forderung gefährdet wird."
    },
    {
      "date": "2025-02-20",
      "id": "101782",
      "original_text": "Registerbekanntmachung nach dem Umwandlungsgesetz\nBayern Amtsgericht München HRB 230759\nConcrete Capital GmbH – München",
      "type": "Registerbekanntmachung nach dem Umwandlungsgesetz",
      "state": "Bayern",
      "amtsgericht": "Amtsgericht München",
      "registernummer": "HRB 230759",
      "registerart": "HRB",
      "company_name": "Concrete Capital GmbH",
      "company_seat": "München",
      "details": "20.02.2025 (Bekanntmachungsdatum)\n\nBayern Amtsgericht München HRB 230759\nRegisterbekanntmachung nach dem Umwandlungsgesetz 19.02.2025 (Eintragungsdatum)\n\nConcrete Capital GmbH\nGesellschaft mit beschränkter Haftung\nMünchen\n\nDen Gläubigern der an der Verschmelzung beteiligten Rechtsträger ist, wenn sie binnen sechs Monaten nach dem Tag, an dem die Eintragung der Verschmelzung in das Register des Sitzes desjenigen Rechtsträgers, dessen Gläubiger sie sind, nach § 19 Abs. 3 UmwG als bekannt gemacht gilt, ihren Anspruch nach Grund und Höhe in Textform anmelden, Sicherheit zu leisten, soweit sie nicht Befriedigung verlangen können. Dieses Recht steht den Gläubigern jedoch nur zu, wenn sie glaubhaft machen, dass durch die Verschmelzung die Erfüllung ihrer Forderung gefährdet wird."
    },
    {
      "date": "2025-02-20",
      "id": "101783",
      "original_text": "Registerbekanntmachung nach dem Umwandlungsgesetz\nBayern Amtsgericht Bamberg HRA 13129\nProjektgesellschaft Germering Wohnen GmbH & Co. KG – Bamberg",
      "type": "Registerbekanntmachung nach dem Umwandlungsgesetz",
      "state": "Bayern",
      "amtsgericht": "Amtsgericht Bamberg",
      "registernummer": "HRA 13129",
      "registerart": "HRA",
      "company_name": "Projektgesellschaft Germering Wohnen GmbH & Co. KG",
      "company_seat": "Bamberg",
      "details": "20.02.2025 (Bekanntmachungsdatum)\n\nBayern Amtsgericht Bamberg HRA 13129\nRegisterbekanntmachung nach dem Umwandlungsgesetz 19.02.2025 (Eintragungsdatum)\n\nProjektgesellschaft Germering Wohnen GmbH & Co. KG\nKommanditgesellschaft\nBamberg\n\nDen Gläubigern der an der Verschmelzung beteiligten Rechtsträger ist, wenn sie binnen sechs Monaten nach dem Tag, an dem die Eintragung der Verschmelzung in das Register des Sitzes desjenigen Rechtsträgers, dessen Gläubiger sie sind, nach § 19 Abs. 3 UmwG als bekannt gemacht gilt, ihren Anspruch nach Grund und Höhe in Textform anmelden, Sicherheit zu leisten, soweit sie nicht Befriedigung verlangen können. Dieses Recht steht den Gläubigern jedoch nur zu, wenn sie glaubhaft machen, dass durch die Verschmelzung die Erfüllung ihrer Forderung gefährdet wird."
    },
    {
      "date": "2025-02-20",
      "id": "101784",
      "original_text": "Registerbekanntmachung nach dem Umwandlungsgesetz\nBayern Amtsgericht München HRB 265307\nLincoln International Germany GmbH – München",
      "type": "Registerbekanntmachung nach dem Umwandlungsgesetz",
      "state": "Bayern",
      "amtsgericht": "Amtsgericht München",
      "registernummer": "HRB 265307",
      "registerart": "HRB",
      "company_name": "Lincoln International Germany GmbH",
      "company_seat": "München",
      "details": "20.02.2025 (Bekanntmachungsdatum)\n\nBayern Amtsgericht München HRB 265307\nRegisterbekanntmachung nach dem Umwandlungsgesetz 19.02.2025 (Eintragungsdatum)\n\nLincoln International Germany GmbH\nGesellschaft mit beschränkter Haftung\nMünchen\n\nDen Gläubigern der an der Verschmelzung beteiligten Rechtsträger ist, wenn sie binnen sechs Monaten nach dem Tag, an dem die Eintragung der Verschmelzung in das Register des Sitzes desjenigen Rechtsträgers, dessen Gläubiger sie sind, nach § 19 Abs. 3 UmwG als bekannt gemacht gilt, ihren Anspruch nach Grund und Höhe in Textform anmelden, Sicherheit zu leisten, soweit sie nicht Befriedigung verlangen können. Dieses Recht steht den Gläubigern jedoch nur zu, wenn sie glaubhaft machen, dass durch die Verschmelzung die Erfüllung ihrer Forderung gefährdet wird."
    },
    {
      "date": "2025-02-20",
      "id": "101785",
      "original_text": "Registerbekanntmachung nach dem Umwandlungsgesetz\nBayern Amtsgericht Nürnberg HRA 19965\nChristian Distler Grundbesitz GmbH & Co. KG – Leinburg",
      "type": "Registerbekanntmachung nach dem Umwandlungsgesetz",
      "state": "Bayern",
      "amtsgericht": "Amtsgericht Nürnberg",
      "registernummer": "HRA 19965",
      "registerart": "HRA",
      "company_name": "Christian Distler Grundbesitz GmbH & Co. KG",
      "company_seat": "Leinburg",
      "details": "20.02.2025 (Bekanntmachungsdatum)\n\nBayern Amtsgericht Nürnberg HRA 19965\nRegisterbekanntmachung nach dem Umwandlungsgesetz 19.02.2025 (Eintragungsdatum)\n\nChristian Distler Grundbesitz GmbH & Co. KG\nKommanditgesellschaft\nLeinburg\n\nDen Gläubigern der an der Ausgliederung beteiligten Rechtsträger ist, wenn sie binnen sechs Monaten nach dem Tag, an dem die Eintragung der Ausgliederung in das Register des Sitzes desjenigen Rechtsträgers, dessen Gläubiger sie sind, nach §§ 125, 19 Abs. 3 UmwG als bekannt gemacht gilt, ihren Anspruch nach Grund und Höhe in Textform anmelden, Sicherheit zu leisten, soweit sie nicht Befriedigung verlangen können. Dieses Recht steht den Gläubigern jedoch nur zu, wenn sie glaubhaft machen, dass durch die Ausgliederung die Erfüllung ihrer Forderung gefährdet wird."
    },
    {
      "date": "2025-02-20",
      "id": "101786",
      "original_text": "Löschungsankündigung\nBayern Amtsgericht München HRA 106203\nPRIMUS Concept Grundbesitz München - Waldperlach GmbH & Co. KG – Markt Indersdorf",
      "type": "Löschungsankündigung",
      "state": "Bayern",
      "amtsgericht": "Amtsgericht München",
      "registernummer": "HRA 106203",
      "registerart": "HRA",
      "company_name": "PRIMUS Concept Grundbesitz München - Waldperlach GmbH & Co. KG",
      "company_seat": "Markt Indersdorf",
      "details": "20.02.2025 (Bekanntmachungsdatum)\n\nBayern Amtsgericht München HRA 106203\nLöschungsankündigung 19.02.2025 (Eintragungsdatum)\n\nPRIMUS Concept Grundbesitz München - Waldperlach GmbH & Co. KG\nKommanditgesellschaft\nMarkt Indersdorf\n\nDas Registergericht beabsichtigt, die im Handelsregister eingetragene Gesellschaft wegen Vermögenslosigkeit von Amts wegen nach § 394 FamFG zu löschen. Die Frist zur Erhebung eines Widerspruchs ist auf drei Monate festgesetzt."
    },
    {
      "date": "2025-02-20",
      "id": "101787",
      "original_text": "Löschungsankündigung\nBayern Amtsgericht Deggendorf HRB 1003\nW.H. Winter GmbH – Metten",
      "type": "Löschungsankündigung",
      "state": "Bayern",
      "amtsgericht": "Amtsgericht Deggendorf",
      "registernummer": "HRB 1003",
      "registerart": "HRB",
      "company_name": "W.H. Winter GmbH",
      "company_seat": "Metten",
      "details": "20.02.2025 (Bekanntmachungsdatum)\n\nBayern Amtsgericht Deggendorf HRB 1003\nLöschungsankündigung\n\nW.H. Winter GmbH\nGesellschaft mit beschränkter Haftung\nMetten\n\nDas Registergericht beabsichtigt, die im Handelsregister eingetragene Gesellschaft wegen Vermögenslosigkeit von Amts wegen nach § 394 FamFG zu löschen. #insert(Text=\"zztb_V_Widerspruchsfrist\")"
    },
    {
      "date": "2025-02-20",
      "id": "101788",
      "original_text": "Registerbekanntmachung nach dem Umwandlungsgesetz\nBayern Amtsgericht Bamberg HRA 12965\nBGW Bayerische Gesellschaft für Wohneigentum Invest mbH & Co. KG – Bamberg",
      "type": "Registerbekanntmachung nach dem Umwandlungsgesetz",
      "state": "Bayern",
      "amtsgericht": "Amtsgericht Bamberg",
      "registernummer": "HRA 12965",
      "registerart": "HRA",
      "company_name": "BGW Bayerische Gesellschaft für Wohneigentum Invest mbH & Co. KG",
      "company_seat": "Bamberg",
      "details": "20.02.2025 (Bekanntmachungsdatum)\n\nBayern Amtsgericht Bamberg HRA 12965\nRegisterbekanntmachung nach dem Umwandlungsgesetz 19.02.2025 (Eintragungsdatum)\n\nBGW Bayerische Gesellschaft für Wohneigentum Invest mbH & Co. KG\nKommanditgesellschaft\nBamberg\n\nDen Gläubigern der an der Verschmelzung beteiligten Rechtsträger ist, wenn sie binnen sechs Monaten nach dem Tag, an dem die Eintragung der Verschmelzung in das Register des Sitzes desjenigen Rechtsträgers, dessen Gläubiger sie sind, nach § 19 Abs. 3 UmwG als bekannt gemacht gilt, ihren Anspruch nach Grund und Höhe in Textform anmelden, Sicherheit zu leisten, soweit sie nicht Befriedigung verlangen können. Dieses Recht steht den Gläubigern jedoch nur zu, wenn sie glaubhaft machen, dass durch die Verschmelzung die Erfüllung ihrer Forderung gefährdet wird."
    },
    {
      "date": "2025-02-20",
      "id": "101789",
      "original_text": "Registerbekanntmachung nach dem Umwandlungsgesetz\nBayern Amtsgericht Aschaffenburg HRB 15558\nSK Werbung GmbH – Großheubach",
      "type": "Registerbekanntmachung nach dem Umwandlungsgesetz",
      "state": "Bayern",
      "amtsgericht": "Amtsgericht Aschaffenburg",
      "registernummer": "HRB 15558",
      "registerart": "HRB",
      "company_name": "SK Werbung GmbH",
      "company_seat": "Großheubach",
      "details": "20.02.2025 (Bekanntmachungsdatum)\n\nBayern Amtsgericht Aschaffenburg HRB 15558\nRegisterbekanntmachung nach dem Umwandlungsgesetz 19.02.2025 (Eintragungsdatum)\n\nSK Werbung GmbH\nGesellschaft mit beschränkter Haftung\nGroßheubach\n\nDen Gläubigern der an der Verschmelzung beteiligten Rechtsträger ist, wenn sie binnen sechs Monaten nach dem Tag, an dem die Eintragung der Verschmelzung in das Register des Sitzes desjenigen Rechtsträgers, dessen Gläubiger sie sind, nach § 19 Abs. 3 UmwG als bekannt gemacht gilt, ihren Anspruch nach Grund und Höhe in Textform anmelden, Sicherheit zu leisten, soweit sie nicht Befriedigung verlangen können. Dieses Recht steht den Gläubigern jedoch nur zu, wenn sie glaubhaft machen, dass durch die Verschmelzung die Erfüllung ihrer Forderung gefährdet wird."
    },
    {
      "date": "2025-02-20",
      "id": "101790",
      "original_text": "Löschungsankündigung\nBayern Amtsgericht Traunstein HRB 26101\nOCCASIO UG (haftungsbeschränkt) – Söchtenau",
      "type": "Löschungsankündigung",
      "state": "Bayern",
      "amtsgericht": "Amtsgericht Traunstein",
      "registernummer": "HRB 26101",
      "registerart": "HRB",
      "company_name": "OCCASIO UG (haftungsbeschränkt)",
      "company_seat": "Söchtenau",
      "details": "20.02.2025 (Bekanntmachungsdatum)\n\nBayern Amtsgericht Traunstein HRB 26101\nLöschungsankündigung 19.02.2025 (Eintragungsdatum)\n\nOCCASIO UG (haftungsbeschränkt)\nGesellschaft mit beschränkter Haftung\nSöchtenau\n\nDas Registergericht beabsichtigt, die im Handelsregister eingetragene Gesellschaft wegen Vermögenslosigkeit von Amts wegen nach § 394 FamFG zu löschen. Die Frist zur Erhebung eines Widerspruchs ist auf einen Monat festgesetzt."
    },
    {
      "date": "2025-02-20",
      "id": "101791",
      "original_text": "Einreichung neuer Dokumente\nSaarland Amtsgericht Saarbrücken HRB 10617\nStadtwerke Saarbrücken Holding GmbH – Saarbrücken",
      "type": "Einreichung neuer Dokumente",
      "state": "Saarland",
      "amtsgericht": "Amtsgericht Saarbrücken",
      "registernummer": "HRB 10617",
      "registerart": "HRB",
      "company_name": "Stadtwerke Saarbrücken Holding GmbH",
      "company_seat": "Saarbrücken",
      "details": "20.02.2025 (Bekanntmachungsdatum)\n\nSaarland Amtsgericht Saarbrücken HRB 10617\nEinreichung neuer Dokumente\n\nStadtwerke Saarbrücken Holding GmbH\nGesellschaft mit beschränkter Haftung\nSaarbrücken\n\nDie Geschäftsführung der Gesellschaft hat eine Liste der Mitglieder des Gesellschafterausschusses zum Handelsregister eingereicht."
    },
    {
      "date": "2025-02-20",
      "id": "101792",
      "original_text": "Löschungsankündigung\nBerlin Amtsgericht Berlin (Charlottenburg) HRB 242286\nPolar Beton Bau GmbH – Berlin",
      "type": "Löschungsankündigung",
      "state": "Berlin",
      "amtsgericht": "Amtsgericht Berlin (Charlottenburg)",
      "registernummer": "HRB 242286",
      "registerart": "HRB",
      "company_name": "Polar Beton Bau GmbH",
      "company_seat": "Berlin",
      "details": "20.02.2025 (Bekanntmachungsdatum)\n\nBerlin Amtsgericht Berlin (Charlottenburg) HRB 242286\nLöschungsankündigung\n\nPolar Beton Bau GmbH\nGesellschaft mit beschränkter Haftung\nBerlin\n\nBei der nachstehenden Gesellschaft wird das Amtslöschungsverfahren gemäß § 394 FamFG eingeleitet. Widerspruchsfrist\n6 Wochen."
    },
    {
      "date": "2025-02-20",
      "id": "101793",
      "original_text": "Einreichung neuer Dokumente\nBaden-Württemberg Amtsgericht Mannheim HRB 8469\nRIXIUS AG – Mannheim",
      "type": "Einreichung neuer Dokumente",
      "state": "Baden-Württemberg",
      "amtsgericht": "Amtsgericht Mannheim",
      "registernummer": "HRB 8469",
      "registerart": "HRB",
      "company_name": "RIXIUS AG",
      "company_seat": "Mannheim",
      "details": "20.02.2025 (Bekanntmachungsdatum)\n\nBaden-Württemberg Amtsgericht Mannheim HRB 8469\nEinreichung neuer Dokumente\n\nRIXIUS AG\nAktiengesellschaft\nMannheim\n\nDie Gesellschaft hat am 27.01.2025 die Liste über die Zusammensetzung des Aufsichtsrats zum Handelsregister eingereicht."
    },
    {
      "date": "2025-02-20",
      "id": "101794",
      "original_text": "Löschungsankündigung\nSaarland Amtsgericht Saarbrücken HRA 13414\nKunsthandel Ernst e.K. – Saarbrücken",
      "type": "Löschungsankündigung",
      "state": "Saarland",
      "amtsgericht": "Amtsgericht Saarbrücken",
      "registernummer": "HRA 13414",
      "registerart": "HRA",
      "company_name": "Kunsthandel Ernst e.K.",
      "company_seat": "Saarbrücken",
      "details": "20.02.2025 (Bekanntmachungsdatum)\n\nSaarland Amtsgericht Saarbrücken HRA 13414\nLöschungsankündigung\n\nKunsthandel Ernst e.K.\nEinzelkaufmann / Einzelkauffrau\nSaarbrücken\n\nEs ist beabsichtigt die Firma von Amts wegen gemäß § 31 Abs 2 HGB zu löschen. Frist für den Widerspruch: 3 Monate."
    },
    {
      "date": "2025-02-20",
      "id": "101795",
      "original_text": "Löschungsankündigung\nBrandenburg Amtsgericht Potsdam HRB 37367\nGabor Malerbetrieb UG (haftungsbeschränkt) – Zossen",
      "type": "Löschungsankündigung",
      "state": "Brandenburg",
      "amtsgericht": "Amtsgericht Potsdam",
      "registernummer": "HRB 37367",
      "registerart": "HRB",
      "company_name": "Gabor Malerbetrieb UG (haftungsbeschränkt)",
      "company_seat": "Zossen",
      "details": "20.02.2025 (Bekanntmachungsdatum)\n\nBrandenburg Amtsgericht Potsdam HRB 37367\nLöschungsankündigung\n\nGabor Malerbetrieb UG (haftungsbeschränkt)\nGesellschaft mit beschränkter Haftung\nZossen\n\nBei der nachstehenden Gesellschaft wird das Amtslöschungsverfahren gemäß § 394 FamFG eingeleitet. Widerspruchsfrist: 8 Wochen"
    },
    {
      "date": "2025-02-20",
      "id": "101796",
      "original_text": "Löschungsankündigung\nBerlin Amtsgericht Berlin (Charlottenburg) HRB 142985\nwestpay GmbH – Berlin",
      "type": "Löschungsankündigung",
      "state": "Berlin",
      "amtsgericht": "Amtsgericht Berlin (Charlottenburg)",
      "registernummer": "HRB 142985",
      "registerart": "HRB",
      "company_name": "westpay GmbH",
      "company_seat": "Berlin",
      "details": "20.02.2025 (Bekanntmachungsdatum)\n\nBerlin Amtsgericht Berlin (Charlottenburg) HRB 142985\nLöschungsankündigung\n\nwestpay GmbH\nGesellschaft mit beschränkter Haftung\nBerlin\n\nBei der nachstehenden Gesellschaft wird das Amtslöschungsverfahren gemäß § 394 FamFG eingeleitet. Widerspruchsfrist 6 Wochen"
    },
    {
      "date": "2025-02-20",
      "id": "101797",
      "original_text": "Registerbekanntmachung nach dem Umwandlungsgesetz\nBaden-Württemberg Amtsgericht Stuttgart VR 727005\nObst- und Gartenbauverein Sachsenheim e.V. – Sachsenheim",
      "type": "Registerbekanntmachung nach dem Umwandlungsgesetz",
      "state": "Baden-Württemberg",
      "amtsgericht": "Amtsgericht Stuttgart",
      "registernummer": "VR 727005",
      "registerart": "VR",
      "company_name": "Obst- und Gartenbauverein Sachsenheim e.V.",
      "company_seat": "Sachsenheim",
      "details": "20.02.2025 (Bekanntmachungsdatum)\n\nBaden-Württemberg Amtsgericht Stuttgart VR 727005\nRegisterbekanntmachung nach dem Umwandlungsgesetz 20.02.2025 (Eintragungsdatum)\n\nObst- und Gartenbauverein Sachsenheim e.V.\neingetragener Verein\nSachsenheim\n\nAls nicht eingetragen wird bekanntgemacht:\nDen Gläubigern der an der Verschmelzung beteiligten Rechtsträger ist, wenn sie binnen sechs Monaten nach dem Tag, an dem die Eintragung der Verschmelzung in das Register des Sitzes desjenigen Rechtsträgers, dessen Gläubiger sie sind, nach § 19 Abs. 3 UmwG als bekanntgemacht gilt, ihren Anspruch nach Grund und Höhe schriftlich anmelden, Sicherheit zu leisten, soweit sie nicht Befriedigung verlangen können. Dieses Recht steht den Gläubigern jedoch nur zu, wenn sie glaubhaft machen, dass durch die Verschmelzung die Erfüllung ihrer Forderung gefährdet wird."
    },
    {
      "date": "2025-02-20",
      "id": "101798",
      "original_text": "Registerbekanntmachung nach dem Umwandlungsgesetz\nBaden-Württemberg Amtsgericht Stuttgart VR 290202\nObst- und Gartenbauverein Kleinsachsenheim e.V. – Sachsenheim",
      "type": "Registerbekanntmachung nach dem Umwandlungsgesetz",
      "state": "Baden-Württemberg",
      "amtsgericht": "Amtsgericht Stuttgart",
      "registernummer": "VR 290202",
      "registerart": "VR",
      "company_name": "Obst- und Gartenbauverein Kleinsachsenheim e.V.",
      "company_seat": "Sachsenheim",
      "details": "20.02.2025 (Bekanntmachungsdatum)\n\nBaden-Württemberg Amtsgericht Stuttgart VR 290202\nRegisterbekanntmachung nach dem Umwandlungsgesetz 20.02.2025 (Eintragungsdatum)\n\nObst- und Gartenbauverein Kleinsachsenheim e.V.\neingetragener Verein\nSachsenheim\n\nDen Gläubigern der an der Verschmelzung beteiligten Rechtsträger ist, wenn sie binnen sechs Monaten nach dem Tag, an dem die Eintragung der Verschmelzung in das Register des Sitzes desjenigen Rechtsträgers, dessen Gläubiger sie sind, nach § 19 Abs. 3 UmwG als bekanntgemacht gilt, ihren Anspruch nach Grund und Höhe schriftlich anmelden, Sicherheit zu leisten, soweit sie nicht Befriedigung verlangen können. Dieses Recht steht den Gläubigern jedoch nur zu, wenn sie glaubhaft machen, dass durch die Verschmelzung die Erfüllung ihrer Forderung gefährdet wird."
    },
    {
      "date": "2025-02-20",
      "id": "101799",
      "original_text": "Registerbekanntmachung nach dem Umwandlungsgesetz\nBaden-Württemberg Amtsgericht Stuttgart VR 290381\nObst- und Gartenbauverein Großsachsenheim e.V. – Sachsenheim",
      "type": "Registerbekanntmachung nach dem Umwandlungsgesetz",
      "state": "Baden-Württemberg",
      "amtsgericht": "Amtsgericht Stuttgart",
      "registernummer": "VR 290381",
      "registerart": "VR",
      "company_name": "Obst- und Gartenbauverein Großsachsenheim e.V.",
      "company_seat": "Sachsenheim",
      "details": "20.02.2025 (Bekanntmachungsdatum)\n\nBaden-Württemberg Amtsgericht Stuttgart VR 290381\nRegisterbekanntmachung nach dem Umwandlungsgesetz 20.02.2025 (Eintragungsdatum)\n\nObst- und Gartenbauverein Großsachsenheim e.V.\neingetragener Verein\nSachsenheim\n\nAls nicht eingetragen wird bekanntgemacht:\nDen Gläubigern der an der Verschmelzung beteiligten Rechtsträger ist, wenn sie binnen sechs Monaten nach dem Tag, an dem die Eintragung der Verschmelzung in das Register des Sitzes desjenigen Rechtsträgers, dessen Gläubiger sie sind, nach § 19 Abs. 3 UmwG als bekanntgemacht gilt, ihren Anspruch nach Grund und Höhe schriftlich anmelden, Sicherheit zu leisten, soweit sie nicht Befriedigung verlangen können. Dieses Recht steht den Gläubigern jedoch nur zu, wenn sie glaubhaft machen, dass durch die Verschmelzung die Erfüllung ihrer Forderung gefährdet wird."
    },
    {
      "date": "2025-02-20",
      "id": "101800",
      "original_text": "Sonstige Registerbekanntmachung\nBrandenburg Amtsgericht Potsdam HRB 8737\npei tel Communications Gesellschaft mit beschränkter Haftung – Teltow",
      "type": "Sonstige Registerbekanntmachung",
      "state": "Brandenburg",
      "amtsgericht": "Amtsgericht Potsdam",
      "registernummer": "HRB 8737",
      "registerart": "HRB",
      "company_name": "pei tel Communications Gesellschaft mit beschränkter Haftung",
      "company_seat": "Teltow",
      "details": "20.02.2025 (Bekanntmachungsdatum)\n\nBrandenburg Amtsgericht Potsdam HRB 8737\nSonstige Registerbekanntmachung\n\npei tel Communications Gesellschaft mit beschränkter Haftung\nGesellschaft mit beschränkter Haftung\nTeltow\n\nAls nicht eingetragen wird veröffentlicht: Den Gläubigern der Gesellschaft, deren Forderungen begründet worden sind, bevor die Eintragung der Beendigung des Vertrages in das Handelsregister  nach § 10 des Handelsgesetzbuches  als bekannt gemacht gilt, hat der andere Vertragsteil Sicherheit zu leisten,  wenn sie sich binnen sechs Monaten nach der Bekanntmachung  der Eintragung zu diesem Zweck bei ihm melden."
    },
    {
      "date": "2025-02-20",
      "id": "101801",
      "original_text": "Löschungsankündigung\nBerlin Amtsgericht Berlin (Charlottenburg) HRB 167178\nVlizzard Ventures UG (haftungsbeschränkt) – Berlin",
      "type": "Löschungsankündigung",
      "state": "Berlin",
      "amtsgericht": "Amtsgericht Berlin (Charlottenburg)",
      "registernummer": "HRB 167178",
      "registerart": "HRB",
      "company_name": "Vlizzard Ventures UG (haftungsbeschränkt)",
      "company_seat": "Berlin",
      "details": "20.02.2025 (Bekanntmachungsdatum)\n\nBerlin Amtsgericht Berlin (Charlottenburg) HRB 167178\nLöschungsankündigung\n\nVlizzard Ventures UG (haftungsbeschränkt)\nGesellschaft mit beschränkter Haftung\nBerlin\n\nBei der nachstehenden Gesellschaft wird das Amtslöschungsverfahren gemäß § 394 FamFG eingeleitet. Widerspruchsfrist 6 Wochen"
    },
    {
      "date": "2025-02-20",
      "id": "101802",
      "original_text": "Registerbekanntmachung nach dem Umwandlungsgesetz\nBaden-Württemberg Amtsgericht Stuttgart HRB 728280\nemagine Flexwork GmbH – Stuttgart",
      "type": "Registerbekanntmachung nach dem Umwandlungsgesetz",
      "state": "Baden-Württemberg",
      "amtsgericht": "Amtsgericht Stuttgart",
      "registernummer": "HRB 728280",
      "registerart": "HRB",
      "company_name": "emagine Flexwork GmbH",
      "company_seat": "Stuttgart",
      "details": "20.02.2025 (Bekanntmachungsdatum)\n\nBaden-Württemberg Amtsgericht Stuttgart HRB 728280\nRegisterbekanntmachung nach dem Umwandlungsgesetz 20.02.2025 (Eintragungsdatum)\n\nemagine Flexwork GmbH\nGesellschaft mit beschränkter Haftung\nStuttgart\n\nAls nicht eingetragen wird bekanntgemacht:\nDen Gläubigern der an der Verschmelzung beteiligten Rechtsträger ist, wenn sie binnen sechs Monaten nach dem Tag, an dem die Eintragung der Verschmelzung in das Register des Sitzes desjenigen Rechtsträgers, dessen Gläubiger sie sind, nach § 19 Abs. 3 UmwG als bekanntgemacht gilt, ihren Anspruch nach Grund und Höhe schriftlich anmelden, Sicherheit zu leisten, soweit sie nicht Befriedigung verlangen können. Dieses Recht steht den Gläubigern jedoch nur zu, wenn sie glaubhaft machen, dass durch die Verschmelzung die Erfüllung ihrer Forderung gefährdet wird."
    },
    {
      "date": "2025-02-20",
      "id": "101803",
      "original_text": "Löschungsankündigung\nBerlin Amtsgericht Berlin (Charlottenburg) HRB 215425\nWalzthöni-Bau-Gebäude Unternehmergesellschaft (haftungsbeschränkt) – Berlin",
      "type": "Löschungsankündigung",
      "state": "Berlin",
      "amtsgericht": "Amtsgericht Berlin (Charlottenburg)",
      "registernummer": "HRB 215425",
      "registerart": "HRB",
      "company_name": "Walzthöni-Bau-Gebäude Unternehmergesellschaft (haftungsbeschränkt)",
      "company_seat": "Berlin",
      "details": "20.02.2025 (Bekanntmachungsdatum)\n\nBerlin Amtsgericht Berlin (Charlottenburg) HRB 215425\nLöschungsankündigung\n\nWalzthöni-Bau-Gebäude Unternehmergesellschaft (haftungsbeschränkt)\nGesellschaft mit beschränkter Haftung\nBerlin\n\nBei der nachstehenden Gesellschaft wird das Amtslöschungsverfahren gemäß § 394 FamFG eingeleitet. Widerspruchsfrist 6 Wochen"
    },
    {
      "date": "2025-02-20",
      "id": "101804",
      "original_text": "Registerbekanntmachung nach dem Umwandlungsgesetz\nSaarland Amtsgericht Saarbrücken HRB 110658\nOKKO Service GmbH – Perl",
      "type": "Registerbekanntmachung nach dem Umwandlungsgesetz",
      "state": "Saarland",
      "amtsgericht": "Amtsgericht Saarbrücken",
      "registernummer": "HRB 110658",
      "registerart": "HRB",
      "company_name": "OKKO Service GmbH",
      "company_seat": "Perl",
      "details": "20.02.2025 (Bekanntmachungsdatum)\n\nSaarland Amtsgericht Saarbrücken HRB 110658\nRegisterbekanntmachung nach dem Umwandlungsgesetz 20.02.2025 (Eintragungsdatum)\n\nOKKO Service GmbH\nGesellschaft mit beschränkter Haftung\nPerl\n\nAls nicht eingetragen wird bekannt gemacht: Den Gläubigern der an der Verschmelzung beteiligten Gesellschaften ist, wenn sie binnen sechs Monaten nach dem Tag, an dem die Eintragung der Verschmelzung in das Register des Sitzes desjenigen Rechtsträgers, dessen Gläubiger sie sind, nach § 19 Absatz 3 UmwG bekannt gemacht worden ist, ihren Anspruch nach Grund und Höhe schriftlich anmelden, Sicherheit zu leisten, soweit sie nicht Befriedigung verlangen können. Dieses Recht steht den Gläubigern jedoch nur zu, wenn sie glaubhaft machen, dass durch die Verschmelzung die Erfüllung ihrer Forderung gefährdet wird."
    },
    {
      "date": "2025-02-20",
      "id": "101805",
      "original_text": "Registerbekanntmachung nach dem Umwandlungsgesetz\nBaden-Württemberg Amtsgericht Mannheim HRB 721848\nAdamantius GmbH – Bruchsal",
      "type": "Registerbekanntmachung nach dem Umwandlungsgesetz",
      "state": "Baden-Württemberg",
      "amtsgericht": "Amtsgericht Mannheim",
      "registernummer": "HRB 721848",
      "registerart": "HRB",
      "company_name": "Adamantius GmbH",
      "company_seat": "Bruchsal",
      "details": "20.02.2025 (Bekanntmachungsdatum)\n\nBaden-Württemberg Amtsgericht Mannheim HRB 721848\nRegisterbekanntmachung nach dem Umwandlungsgesetz 20.02.2025 (Eintragungsdatum)\n\nAdamantius GmbH\nGesellschaft mit beschränkter Haftung\nBruchsal\n\nDen Gläubigern der an der Ausgliederung beteiligten Rechtsträger ist, wenn sie binnen sechs Monaten nach dem Tag, an dem die Eintragung der Ausgliederung in das Register des Sitzes desjenigen Rechtsträgers, dessen Gläubiger sie sind, nach § 19 Abs. 3 UmwG als bekanntgemacht gilt, ihren Anspruch nach Grund und Höhe schriftlich anmelden, Sicherheit zu leisten, soweit sie nicht Befriedigung verlangen können. Dieses Recht steht den Gläubigern jedoch nur zu, wenn sie glaubhaft machen, dass durch die Ausgliederung die Erfüllung ihrer Forderung gefährdet wird."
    },
    {
      "date": "2025-02-20",
      "id": "101806",
      "original_text": "Registerbekanntmachung nach dem Umwandlungsgesetz\nBaden-Württemberg Amtsgericht Mannheim HRA 712228\nStefan Fackelmann e.K. – Bruchsal",
      "type": "Registerbekanntmachung nach dem Umwandlungsgesetz",
      "state": "Baden-Württemberg",
      "amtsgericht": "Amtsgericht Mannheim",
      "registernummer": "HRA 712228",
      "registerart": "HRA",
      "company_name": "Stefan Fackelmann e.K.",
      "company_seat": "Bruchsal",
      "details": "20.02.2025 (Bekanntmachungsdatum)\n\nBaden-Württemberg Amtsgericht Mannheim HRA 712228\nRegisterbekanntmachung nach dem Umwandlungsgesetz 20.02.2025 (Eintragungsdatum)\n\nStefan Fackelmann e.K.\nEinzelkaufmann / Einzelkauffrau\nBruchsal\n\nDen Gläubigern der an der Ausgliederung beteiligten Rechtsträger ist, wenn sie binnen sechs Monaten nach dem Tag, an dem die Eintragung der Ausgliederung in das Register des Sitzes desjenigen Rechtsträgers, dessen Gläubiger sie sind, nach § 19 Abs. 3 UmwG als bekanntgemacht gilt, ihren Anspruch nach Grund und Höhe schriftlich anmelden, Sicherheit zu leisten, soweit sie nicht Befriedigung verlangen können. Dieses Recht steht den Gläubigern jedoch nur zu, wenn sie glaubhaft machen, dass durch die Ausgliederung die Erfüllung ihrer Forderung gefährdet wird."
    },
    {
      "date": "2025-02-20",
      "id": "101807",
      "original_text": "Registerbekanntmachung nach dem Umwandlungsgesetz\nBerlin Amtsgericht Berlin (Charlottenburg) HRA 63718\nJia De e.K. – Berlin",
      "type": "Registerbekanntmachung nach dem Umwandlungsgesetz",
      "state": "Berlin",
      "amtsgericht": "Amtsgericht Berlin (Charlottenburg)",
      "registernummer": "HRA 63718",
      "registerart": "HRA",
      "company_name": "Jia De e.K.",
      "company_seat": "Berlin",
      "details": "20.02.2025 (Bekanntmachungsdatum)\n\nBerlin Amtsgericht Berlin (Charlottenburg) HRA 63718\nRegisterbekanntmachung nach dem Umwandlungsgesetz 19.02.2025 (Eintragungsdatum)\n\nJia De e.K.\nEinzelkaufmann / Einzelkauffrau\nBerlin\n\nZu Eintragungsnummer 2 vom 19.02.2025 wird als nicht eingetragen veröffentlicht:Den Gläubigern ist, wenn sie binnen sechs Monaten nach dem Tag, an dem die Eintragung der Umwandlung als bekannt gemacht gilt, ihren Anspruch nach Grund und Höhe schriftlich anmelden, Sicherheit zu leisten, soweit sie nicht Befriedigung verlangen können. Dieses Recht steht den Gläubigern jedoch nur zu, wenn sie glaubhaft machen, dass durch die Umwandlung die Erfüllung ihrer Forderung gefährdet wird. Das Recht, Sicherheitsleistung zu verlangen, steht Gläubigern nicht zu, die im Falle der Insolvenz ein Recht auf vorzugsweise Befriedigung aus einer Deckungsmasse haben, die nach gesetzlicher Vorschrift zu ihrem Schutz errichtet und staatlich überwacht ist."
    },
    {
      "date": "2025-02-20",
      "id": "101808",
      "original_text": "Registerbekanntmachung nach dem Umwandlungsgesetz\nBerlin Amtsgericht Berlin (Charlottenburg) HRB 93695\nJia De International Trade GmbH – Berlin",
      "type": "Registerbekanntmachung nach dem Umwandlungsgesetz",
      "state": "Berlin",
      "amtsgericht": "Amtsgericht Berlin (Charlottenburg)",
      "registernummer": "HRB 93695",
      "registerart": "HRB",
      "company_name": "Jia De International Trade GmbH",
      "company_seat": "Berlin",
      "details": "20.02.2025 (Bekanntmachungsdatum)\n\nBerlin Amtsgericht Berlin (Charlottenburg) HRB 93695\nRegisterbekanntmachung nach dem Umwandlungsgesetz 19.02.2025 (Eintragungsdatum)\n\nJia De International Trade GmbH\nGesellschaft mit beschränkter Haftung\nBerlin\n\nZu Eintragungsnummer 5 vom 19.02.2025 wird als nicht eingetragen veröffentlicht:Den Gläubigern ist, wenn sie binnen sechs Monaten nach dem Tag, an dem die Eintragung der Umwandlung als bekannt gemacht gilt, ihren Anspruch nach Grund und Höhe schriftlich anmelden, Sicherheit zu leisten, soweit sie nicht Befriedigung verlangen können. Dieses Recht steht den Gläubigern jedoch nur zu, wenn sie glaubhaft machen, dass durch die Umwandlung die Erfüllung ihrer Forderung gefährdet wird. Das Recht, Sicherheitsleistung zu verlangen, steht Gläubigern nicht zu, die im Falle der Insolvenz ein Recht auf vorzugsweise Befriedigung aus einer Deckungsmasse haben, die nach gesetzlicher Vorschrift zu ihrem Schutz errichtet und staatlich überwacht ist."
    },
    {
      "date": "2025-02-20",
      "id": "101809",
      "original_text": "Registerbekanntmachung nach dem Umwandlungsgesetz\nBaden-Württemberg Amtsgericht Mannheim HRB 753661\nReinschmidt und Nagel Asset-Verwaltung GmbH – Stutensee",
      "type": "Registerbekanntmachung nach dem Umwandlungsgesetz",
      "state": "Baden-Württemberg",
      "amtsgericht": "Amtsgericht Mannheim",
      "registernummer": "HRB 753661",
      "registerart": "HRB",
      "company_name": "Reinschmidt und Nagel Asset-Verwaltung GmbH",
      "company_seat": "Stutensee",
      "details": "20.02.2025 (Bekanntmachungsdatum)\n\nBaden-Württemberg Amtsgericht Mannheim HRB 753661\nRegisterbekanntmachung nach dem Umwandlungsgesetz 20.02.2025 (Eintragungsdatum)\n\nReinschmidt und Nagel Asset-Verwaltung GmbH\nGesellschaft mit beschränkter Haftung\nStutensee\n\nAls nicht eingetragen wird bekanntgemacht:\nDen Gläubigern des an dem Formwechsel beteiligten Rechtsträgers ist, wenn sie binnen sechs Monaten nach dem Tag, an dem die Eintragung des Formwechsels in das Register des Sitzes desjenigen Rechtsträgers, dessen Gläubiger sie sind, nach § 19 Abs. 3 UmwG als bekanntgemacht gilt, ihren Anspruch nach Grund und Höhe schriftlich anmelden, Sicherheit zu leisten, soweit sie nicht Befriedigung verlangen können. Dieses Recht steht den Gläubigern jedoch nur zu, wenn sie glaubhaft machen, dass durch den Formwechsel die Erfüllung ihrer Forderung gefährdet wird."
    },
    {
      "date": "2025-02-20",
      "id": "101810",
      "original_text": "Löschungsankündigung\nBrandenburg Amtsgericht Frankfurt/Oder HRB 15653\nFruitstars Franchise GmbH – Bad Saarow",
      "type": "Löschungsankündigung",
      "state": "Brandenburg",
      "amtsgericht": "Amtsgericht Frankfurt/Oder",
      "registernummer": "HRB 15653",
      "registerart": "HRB",
      "company_name": "Fruitstars Franchise GmbH",
      "company_seat": "Bad Saarow",
      "details": "20.02.2025 (Bekanntmachungsdatum)\n\nBrandenburg Amtsgericht Frankfurt/Oder HRB 15653\nLöschungsankündigung\n\nFruitstars Franchise GmbH\nGesellschaft mit beschränkter Haftung\nBad Saarow\n\nBei der nachstehenden Gesellschaft wird das Amtslöschungsverfahren gemäß § 394 FamFG eingeleitet."
    },
    {
      "date": "2025-02-20",
      "id": "101811",
      "original_text": "Registerbekanntmachung nach dem Umwandlungsgesetz\nBaden-Württemberg Amtsgericht Ulm HRB 748943\nThoKno Holding GmbH – Ravensburg",
      "type": "Registerbekanntmachung nach dem Umwandlungsgesetz",
      "state": "Baden-Württemberg",
      "amtsgericht": "Amtsgericht Ulm",
      "registernummer": "HRB 748943",
      "registerart": "HRB",
      "company_name": "ThoKno Holding GmbH",
      "company_seat": "Ravensburg",
      "details": "20.02.2025 (Bekanntmachungsdatum)\n\nBaden-Württemberg Amtsgericht Ulm HRB 748943\nRegisterbekanntmachung nach dem Umwandlungsgesetz 20.02.2025 (Eintragungsdatum)\n\nThoKno Holding GmbH\nGesellschaft mit beschränkter Haftung\nRavensburg\n\nAls nicht eingetragen wird bekanntgemacht:\nDen Gläubigern der an der Abspaltung beteiligten Rechtsträger ist, wenn sie binnen sechs Monaten nach dem Tag, an dem die Eintragung der Abspaltung in das Register des Sitzes desjenigen Rechtsträgers, dessen Gläubiger sie sind, nach § 19 Abs. 3 UmwG als bekanntgemacht gilt, ihren Anspruch nach Grund und Höhe schriftlich anmelden, Sicherheit zu leisten, soweit sie nicht Befriedigung verlangen können. Dieses Recht steht den Gläubigern jedoch nur zu, wenn sie glaubhaft machen, dass durch die Abspaltung die Erfüllung ihrer Forderung gefährdet wird."
    },
    {
      "date": "2025-02-20",
      "id": "101812",
      "original_text": "Registerbekanntmachung nach dem Umwandlungsgesetz\nBaden-Württemberg Amtsgericht Mannheim HRB 751383\nGebäudebetreuung Lehner GmbH – Eggenstein-Leopoldshafen",
      "type": "Registerbekanntmachung nach dem Umwandlungsgesetz",
      "state": "Baden-Württemberg",
      "amtsgericht": "Amtsgericht Mannheim",
      "registernummer": "HRB 751383",
      "registerart": "HRB",
      "company_name": "Gebäudebetreuung Lehner GmbH",
      "company_seat": "Eggenstein-Leopoldshafen",
      "details": "20.02.2025 (Bekanntmachungsdatum)\n\nBaden-Württemberg Amtsgericht Mannheim HRB 751383\nRegisterbekanntmachung nach dem Umwandlungsgesetz 20.02.2025 (Eintragungsdatum)\n\nGebäudebetreuung Lehner GmbH\nGesellschaft mit beschränkter Haftung\nEggenstein-Leopoldshafen\n\nAls nicht eingetragen wird bekanntgemacht:\nDen Gläubigern der an der Ausgliederung beteiligten Rechtsträger ist, wenn sie binnen sechs Monaten nach dem Tag, an dem die Eintragung der Ausgliederung in das Register des Sitzes desjenigen Rechtsträgers, dessen Gläubiger sie sind, nach § 19 Abs. 3 UmwG als bekanntgemacht gilt, ihren Anspruch nach Grund und Höhe schriftlich anmelden, Sicherheit zu leisten, soweit sie nicht Befriedigung verlangen können. Dieses Recht steht den Gläubigern jedoch nur zu, wenn sie glaubhaft machen, dass durch die Ausgliederung die Erfüllung ihrer Forderung gefährdet wird."
    },
    {
      "date": "2025-02-20",
      "id": "101813",
      "original_text": "Registerbekanntmachung nach dem Umwandlungsgesetz\nBaden-Württemberg Amtsgericht Mannheim HRA 711822\nGebäudebetreuung Jürgen Lehner e.K. – Eggenstein-Leopoldshafen",
      "type": "Registerbekanntmachung nach dem Umwandlungsgesetz",
      "state": "Baden-Württemberg",
      "amtsgericht": "Amtsgericht Mannheim",
      "registernummer": "HRA 711822",
      "registerart": "HRA",
      "company_name": "Gebäudebetreuung Jürgen Lehner e.K.",
      "company_seat": "Eggenstein-Leopoldshafen",
      "details": "20.02.2025 (Bekanntmachungsdatum)\n\nBaden-Württemberg Amtsgericht Mannheim HRA 711822\nRegisterbekanntmachung nach dem Umwandlungsgesetz 20.02.2025 (Eintragungsdatum)\n\nGebäudebetreuung Jürgen Lehner e.K.\nEinzelkaufmann / Einzelkauffrau\nEggenstein-Leopoldshafen\n\nDen Gläubigern der an der Ausgliederung beteiligten Rechtsträger ist, wenn sie binnen sechs Monaten nach dem Tag, an dem die Eintragung der Ausgliederung in das Register des Sitzes desjenigen Rechtsträgers, dessen Gläubiger sie sind, nach § 19 Abs. 3 UmwG als bekanntgemacht gilt, ihren Anspruch nach Grund und Höhe schriftlich anmelden, Sicherheit zu leisten, soweit sie nicht Befriedigung verlangen können. Dieses Recht steht den Gläubigern jedoch nur zu, wenn sie glaubhaft machen, dass durch die Ausgliederung die Erfüllung ihrer Forderung gefährdet wird."
    },
    {
      "date": "2025-02-20",
      "id": "101814",
      "original_text": "Registerbekanntmachung nach dem Umwandlungsgesetz\nBaden-Württemberg Amtsgericht Mannheim GsR 666\nHoll-Natek eGbR – Stutensee",
      "type": "Registerbekanntmachung nach dem Umwandlungsgesetz",
      "state": "Baden-Württemberg",
      "amtsgericht": "Amtsgericht Mannheim",
      "registernummer": "GsR 666",
      "registerart": "GsR",
      "company_name": "Holl-Natek eGbR",
      "company_seat": "Stutensee",
      "details": "20.02.2025 (Bekanntmachungsdatum)\n\nBaden-Württemberg Amtsgericht Mannheim GsR 666\nRegisterbekanntmachung nach dem Umwandlungsgesetz 20.02.2025 (Eintragungsdatum)\n\nHoll-Natek eGbR\nGesellschaft bürgerlichen Rechts\nStutensee\n\nAls nicht eingetragen wird bekanntgemacht:\nDen Gläubigern des an dem Formwechsel beteiligten Rechtsträgers ist, wenn sie binnen sechs Monaten nach dem Tag, an dem die Eintragung des Formwechsels in das Register des Sitzes desjenigen Rechtsträgers, dessen Gläubiger sie sind, nach § 19 Abs. 3 UmwG als bekanntgemacht gilt, ihren Anspruch nach Grund und Höhe schriftlich anmelden, Sicherheit zu leisten, soweit sie nicht Befriedigung verlangen können. Dieses Recht steht den Gläubigern jedoch nur zu, wenn sie glaubhaft machen, dass durch den Formwechsel die Erfüllung ihrer Forderung gefährdet wird."
    },
    {
      "date": "2025-02-20",
      "id": "101815",
      "original_text": "Sonstige Registerbekanntmachung\nBerlin Amtsgericht Berlin (Charlottenburg) HRB 272063\nBildungspartner24 GmbH – Berlin",
      "type": "Sonstige Registerbekanntmachung",
      "state": "Berlin",
      "amtsgericht": "Amtsgericht Berlin (Charlottenburg)",
      "registernummer": "HRB 272063",
      "registerart": "HRB",
      "company_name": "Bildungspartner24 GmbH",
      "company_seat": "Berlin",
      "details": "20.02.2025 (Bekanntmachungsdatum)\n\nBerlin Amtsgericht Berlin (Charlottenburg) HRB 272063\nSonstige Registerbekanntmachung\n\nBildungspartner24 GmbH\nGesellschaft mit beschränkter Haftung\nBerlin\n\nAls nicht eingetragen wird veröffentlicht: Der andere Vertragsteil hat den Gläubigern dieses Rechtsträgers, deren Forderungen begründet worden sind, bevor die Eintragung der Beendigung dieses Vertrages in das Handelsregister nach § 10 des Handelsgesetzbuches als bekannt gemacht gilt, Sicherheit zu leisten, wenn sie sich binnen sechs Monaten nach der Bekanntmachung der Eintragung zu diesem Zweck bei ihm melden. Dieses Recht steht den Gläubigern nicht zu, die im Fall des Insolvenzverfahrens ein Recht auf vorzugsweise Befriedigung aus der Deckungsmasse haben, die nach gesetzlicher Vorschrift zu ihrem Schutz errichtet und staatlich überwacht ist."
    },
    {
      "date": "2025-02-20",
      "id": "101816",
      "original_text": "Löschungsankündigung\nBerlin Amtsgericht Berlin (Charlottenburg) HRB 119442\nCBC Betreiber GmbH – Berlin",
      "type": "Löschungsankündigung",
      "state": "Berlin",
      "amtsgericht": "Amtsgericht Berlin (Charlottenburg)",
      "registernummer": "HRB 119442",
      "registerart": "HRB",
      "company_name": "CBC Betreiber GmbH",
      "company_seat": "Berlin",
      "details": "20.02.2025 (Bekanntmachungsdatum)\n\nBerlin Amtsgericht Berlin (Charlottenburg) HRB 119442\nLöschungsankündigung\n\nCBC Betreiber GmbH\nGesellschaft mit beschränkter Haftung\nBerlin\n\nBei der nachstehenden Gesellschaft wird das Amtslöschungsverfahren gemäß § 394 FamFG eingeleitet. Widerspruchsfrist 6 Wochen"
    },
    {
      "date": "2025-02-20",
      "id": "101817",
      "original_text": "Einreichung neuer Dokumente\nBerlin Amtsgericht Berlin (Charlottenburg) HRB 114412\nInternational Psychoanalytic University Berlin gGmbH – Berlin",
      "type": "Einreichung neuer Dokumente",
      "state": "Berlin",
      "amtsgericht": "Amtsgericht Berlin (Charlottenburg)",
      "registernummer": "HRB 114412",
      "registerart": "HRB",
      "company_name": "International Psychoanalytic University Berlin gGmbH",
      "company_seat": "Berlin",
      "details": "20.02.2025 (Bekanntmachungsdatum)\n\nBerlin Amtsgericht Berlin (Charlottenburg) HRB 114412\nEinreichung neuer Dokumente\n\nInternational Psychoanalytic University Berlin gGmbH\nGesellschaft mit beschränkter Haftung\nBerlin\n\nAls nicht eingetragen wird veröffentlicht: Es wurde eine neue Liste der Aufsichtsratsmitglieder eingereicht (§52 GmbHG)."
    },
    {
      "date": "2025-02-20",
      "id": "101818",
      "original_text": "Löschungsankündigung\nBrandenburg Amtsgericht Potsdam HRB 24947\nAuden AG – Potsdam",
      "type": "Löschungsankündigung",
      "state": "Brandenburg",
      "amtsgericht": "Amtsgericht Potsdam",
      "registernummer": "HRB 24947",
      "registerart": "HRB",
      "company_name": "Auden AG",
      "company_seat": "Potsdam",
      "details": "20.02.2025 (Bekanntmachungsdatum)\n\nBrandenburg Amtsgericht Potsdam HRB 24947\nLöschungsankündigung\n\nAuden AG\nAktiengesellschaft\nPotsdam\n\nBei der nachstehenden Gesellschaft wird das Amtslöschungsverfahren gemäß § 394 FamFG eingeleitet. Widerspruchsfrist: 8 Wochen"
    },
    {
      "date": "2025-02-20",
      "id": "101819",
      "original_text": "Registerbekanntmachung nach dem Umwandlungsgesetz\nBaden-Württemberg Amtsgericht Ulm HRA 728940\nFrank Koschinski e.K. – Mietingen",
      "type": "Registerbekanntmachung nach dem Umwandlungsgesetz",
      "state": "Baden-Württemberg",
      "amtsgericht": "Amtsgericht Ulm",
      "registernummer": "HRA 728940",
      "registerart": "HRA",
      "company_name": "Frank Koschinski e.K.",
      "company_seat": "Mietingen",
      "details": "20.02.2025 (Bekanntmachungsdatum)\n\nBaden-Württemberg Amtsgericht Ulm HRA 728940\nRegisterbekanntmachung nach dem Umwandlungsgesetz 20.02.2025 (Eintragungsdatum)\n\nFrank Koschinski e.K.\nEinzelkaufmann / Einzelkauffrau\nMietingen\n\nDen Gläubigern der an der Ausgliederung beteiligten Rechtsträger ist, wenn sie binnen sechs Monaten nach dem Tag, an dem die Eintragung der Ausgliederung in das Register des Sitzes desjenigen Rechtsträgers, dessen Gläubiger sie sind, nach § 19 Abs. 3 UmwG als bekanntgemacht gilt, ihren Anspruch nach Grund und Höhe schriftlich anmelden, Sicherheit zu leisten, soweit sie nicht Befriedigung verlangen können. Dieses Recht steht den Gläubigern jedoch nur zu, wenn sie glaubhaft machen, dass durch die Ausgliederung die Erfüllung ihrer Forderung gefährdet wird."
    },
    {
      "date": "2025-02-20",
      "id": "101820",
      "original_text": "Registerbekanntmachung nach dem Umwandlungsgesetz\nBaden-Württemberg Amtsgericht Ulm HRB 747297\nTiKo-Metalldesign GmbH – Mietingen",
      "type": "Registerbekanntmachung nach dem Umwandlungsgesetz",
      "state": "Baden-Württemberg",
      "amtsgericht": "Amtsgericht Ulm",
      "registernummer": "HRB 747297",
      "registerart": "HRB",
      "company_name": "TiKo-Metalldesign GmbH",
      "company_seat": "Mietingen",
      "details": "20.02.2025 (Bekanntmachungsdatum)\n\nBaden-Württemberg Amtsgericht Ulm HRB 747297\nRegisterbekanntmachung nach dem Umwandlungsgesetz 20.02.2025 (Eintragungsdatum)\n\nTiKo-Metalldesign GmbH\nGesellschaft mit beschränkter Haftung\nMietingen\n\nAls nicht eingetragen wird bekanntgemacht:\nDen Gläubigern der an der Ausgliederung beteiligten Rechtsträger ist, wenn sie binnen sechs Monaten nach dem Tag, an dem die Eintragung der Ausgliederung in das Register des Sitzes desjenigen Rechtsträgers, dessen Gläubiger sie sind, nach § 19 Abs. 3 UmwG als bekanntgemacht gilt, ihren Anspruch nach Grund und Höhe schriftlich anmelden, Sicherheit zu leisten, soweit sie nicht Befriedigung verlangen können. Dieses Recht steht den Gläubigern jedoch nur zu, wenn sie glaubhaft machen, dass durch die Ausgliederung die Erfüllung ihrer Forderung gefährdet wird."
    },
    {
      "date": "2025-02-20",
      "id": "101821",
      "original_text": "Löschungsankündigung\nBaden-Württemberg Amtsgericht Mannheim HRB 701577\nBadenSolar Renewable Energy GmbH – Karlsruhe",
      "type": "Löschungsankündigung",
      "state": "Baden-Württemberg",
      "amtsgericht": "Amtsgericht Mannheim",
      "registernummer": "HRB 701577",
      "registerart": "HRB",
      "company_name": "BadenSolar Renewable Energy GmbH",
      "company_seat": "Karlsruhe",
      "details": "20.02.2025 (Bekanntmachungsdatum)\n\nBaden-Württemberg Amtsgericht Mannheim HRB 701577\nLöschungsankündigung\n\nBadenSolar Renewable Energy GmbH\nGesellschaft mit beschränkter Haftung\nKarlsruhe\n\nDas Gericht beabsichtigt, die Gesellschaft wegen Vermögenslosigkeit im Handelsregister von Amts wegen nach § 394 FamFG zu löschen. Die Frist zur Geltendmachung eines Widerspruchs gegen die beabsichtigte Löschung ist auf einen Monat ab Veröffentlichung bestimmt."
    },
    {
      "date": "2025-02-20",
      "id": "101822",
      "original_text": "Registerbekanntmachung nach dem Umwandlungsgesetz\nSchleswig-Holstein Amtsgericht Kiel HRB 20257\nMVZ Medizinisches Labor Nord GmbH – Kiel",
      "type": "Registerbekanntmachung nach dem Umwandlungsgesetz",
      "state": "Schleswig-Holstein",
      "amtsgericht": "Amtsgericht Kiel",
      "registernummer": "HRB 20257",
      "registerart": "HRB",
      "company_name": "MVZ Medizinisches Labor Nord GmbH",
      "company_seat": "Kiel",
      "details": "20.02.2025 (Bekanntmachungsdatum)\n\nSchleswig-Holstein Amtsgericht Kiel HRB 20257\nRegisterbekanntmachung nach dem Umwandlungsgesetz 20.02.2025 (Eintragungsdatum)\n\nMVZ Medizinisches Labor Nord GmbH\nGesellschaft mit beschränkter Haftung\nKiel\n\nZu Eintragungsnummer 13 vom 20.02.2025 wird als nicht eingetragen veröffentlicht: Den Gläubigern der an der Verschmelzung beteiligten Rechtsträger ist, wenn sie binnen sechs Monaten nach dem Tag, an dem die Eintragung der Verschmelzung in das Register des Sitzes desjenigen Rechtsträgers, dessen Gläubiger sie sind, nach § 19 Abs. 3 UmwG bekannt gemacht worden ist, ihren Anspruch nach Grund und Höhe schriftlich anmelden, Sicherheit zu leisten, soweit sie nicht Befriedigung verlangen können. Dieses Recht steht den Gläubigern jedoch nur zu, wenn sie glaubhaft machen, dass durch die Verschmelzung die Erfüllung ihrer Forderung gefährdet wird."
    },
    {
      "date": "2025-02-20",
      "id": "101823",
      "original_text": "Registerbekanntmachung nach dem Umwandlungsgesetz\nSaarland Amtsgericht Saarbrücken HRB 110781\ninfrateam GmbH – Saarbrücken",
      "type": "Registerbekanntmachung nach dem Umwandlungsgesetz",
      "state": "Saarland",
      "amtsgericht": "Amtsgericht Saarbrücken",
      "registernummer": "HRB 110781",
      "registerart": "HRB",
      "company_name": "infrateam GmbH",
      "company_seat": "Saarbrücken",
      "details": "20.02.2025 (Bekanntmachungsdatum)\n\nSaarland Amtsgericht Saarbrücken HRB 110781\nRegisterbekanntmachung nach dem Umwandlungsgesetz 20.02.2025 (Eintragungsdatum)\n\ninfrateam GmbH\nGesellschaft mit beschränkter Haftung\nSaarbrücken\n\nAls nicht eingetragen wird bekannt gemacht: Den Gläubigern der an der Spaltung beteiligten Gesellschaften ist, wenn sie binnen sechs Monaten nach dem Tag, an dem die Eintragung der Spaltung in das Register des Sitzes desjenigen Rechtsträgers, dessen Gläubiger sie sind, nach § 19 Absatz 3 UmwG bekannt gemacht worden ist, ihren Anspruch nach Grund und Höhe schriftlich anmelden, Sicherheit zu leisten, soweit sie nicht Befriedigung verlangen können. Dieses Recht steht den Gläubigern jedoch nur zu, wenn sie glaubhaft machen, dass durch die Spaltung die Erfüllung ihrer Forderung gefährdet wird."
    },
    {
      "date": "2025-02-20",
      "id": "101824",
      "original_text": "Registerbekanntmachung nach dem Umwandlungsgesetz\nSaarland Amtsgericht Saarbrücken HRB 10241\nSchweitzer GmbH – Saarbrücken",
      "type": "Registerbekanntmachung nach dem Umwandlungsgesetz",
      "state": "Saarland",
      "amtsgericht": "Amtsgericht Saarbrücken",
      "registernummer": "HRB 10241",
      "registerart": "HRB",
      "company_name": "Schweitzer GmbH",
      "company_seat": "Saarbrücken",
      "details": "20.02.2025 (Bekanntmachungsdatum)\n\nSaarland Amtsgericht Saarbrücken HRB 10241\nRegisterbekanntmachung nach dem Umwandlungsgesetz 20.02.2025 (Eintragungsdatum)\n\nSchweitzer GmbH\nGesellschaft mit beschränkter Haftung\nSaarbrücken\n\nAls nicht eingetragen wird bekannt gemacht: Den Gläubigern der an der Spaltung beteiligten Gesellschaften ist, wenn sie binnen sechs Monaten nach dem Tag, an dem die Eintragung der Spaltung in das Register des Sitzes desjenigen Rechtsträgers, dessen Gläubiger sie sind, nach § 19 Absatz 3 UmwG bekannt gemacht worden ist, ihren Anspruch nach Grund und Höhe schriftlich anmelden, Sicherheit zu leisten, soweit sie nicht Befriedigung verlangen können. Dieses Recht steht den Gläubigern jedoch nur zu, wenn sie glaubhaft machen, dass durch die Spaltung die Erfüllung ihrer Forderung gefährdet wird."
    },
    {
      "date": "2025-02-20",
      "id": "101825",
      "original_text": "Löschungsankündigung\nBerlin Amtsgericht Berlin (Charlottenburg) HRB 175403\n4 K UG (haftungsbeschränkt) – Berlin",
      "type": "Löschungsankündigung",
      "state": "Berlin",
      "amtsgericht": "Amtsgericht Berlin (Charlottenburg)",
      "registernummer": "HRB 175403",
      "registerart": "HRB",
      "company_name": "4 K UG (haftungsbeschränkt)",
      "company_seat": "Berlin",
      "details": "20.02.2025 (Bekanntmachungsdatum)\n\nBerlin Amtsgericht Berlin (Charlottenburg) HRB 175403\nLöschungsankündigung\n\n4 K UG (haftungsbeschränkt)\nGesellschaft mit beschränkter Haftung\nBerlin\n\nBei der nachstehenden Gesellschaft wird das Amtslöschungsverfahren gemäß § 394 FamFG eingeleitet. Widerspruchsfrist: 6 Wochen."
    },
    {
      "date": "2025-02-20",
      "id": "101826",
      "original_text": "Löschungsankündigung\nBrandenburg Amtsgericht Potsdam HRB 37086\nFoxplus Bau GmbH – Ludwigsfelde",
      "type": "Löschungsankündigung",
      "state": "Brandenburg",
      "amtsgericht": "Amtsgericht Potsdam",
      "registernummer": "HRB 37086",
      "registerart": "HRB",
      "company_name": "Foxplus Bau GmbH",
      "company_seat": "Ludwigsfelde",
      "details": "20.02.2025 (Bekanntmachungsdatum)\n\nBrandenburg Amtsgericht Potsdam HRB 37086\nLöschungsankündigung\n\nFoxplus Bau GmbH\nGesellschaft mit beschränkter Haftung\nLudwigsfelde\n\nBei der nachstehenden Gesellschaft wird das Amtslöschungsverfahren gemäß § 394 FamFG eingeleitet. Die Widerspruchsfrist beträgt 8 Wochen."
    },
    {
      "date": "2025-02-20",
      "id": "101827",
      "original_text": "Löschungsankündigung\nSachsen Amtsgericht Dresden HRB 27978\nSanitätshaus - Gbureck UG (haftungsbeschränkt) – Hoyerswerda",
      "type": "Löschungsankündigung",
      "state": "Sachsen",
      "amtsgericht": "Amtsgericht Dresden",
      "registernummer": "HRB 27978",
      "registerart": "HRB",
      "company_name": "Sanitätshaus - Gbureck UG (haftungsbeschränkt)",
      "company_seat": "Hoyerswerda",
      "details": "20.02.2025 (Bekanntmachungsdatum)\n\nSachsen Amtsgericht Dresden HRB 27978\nLöschungsankündigung\n\nSanitätshaus - Gbureck UG (haftungsbeschränkt)\nGesellschaft mit beschränkter Haftung\nHoyerswerda\n\nDas Registergericht beabsichtigt, die im Handelsregister eingetragene Gesellschaft von Amts wegen nach § 394 FamFG zu löschen. Die Frist zu Erhebung eines Widerspruchs gegen die beabsichtigte Löschung wird auf einen Monat festgesetzt."
    },
    {
      "date": "2025-02-20",
      "id": "101828",
      "original_text": "Registerbekanntmachung nach dem Umwandlungsgesetz\nSachsen Amtsgericht Leipzig HRB 33372\nBerger-Petsch Mitte GmbH – Leipzig",
      "type": "Registerbekanntmachung nach dem Umwandlungsgesetz",
      "state": "Sachsen",
      "amtsgericht": "Amtsgericht Leipzig",
      "registernummer": "HRB 33372",
      "registerart": "HRB",
      "company_name": "Berger-Petsch Mitte GmbH",
      "company_seat": "Leipzig",
      "details": "20.02.2025 (Bekanntmachungsdatum)\n\nSachsen Amtsgericht Leipzig HRB 33372\nRegisterbekanntmachung nach dem Umwandlungsgesetz 20.02.2025 (Eintragungsdatum)\n\nBerger-Petsch Mitte GmbH\nGesellschaft mit beschränkter Haftung\nLeipzig\n\nDen Gläubigern der an der Verschmelzung beteiligten Rechtsträger ist, wenn sie binnen sechs Monaten nach dem Tag, an dem die Eintragung der Verschmelzung in das Register des Sitzes desjenigen Rechtsträgers, dessen Gläubiger sie sind, nach § 19 Abs. 3 UmwG als bekannt gemacht gilt, ihren Anspruch nach Grund und Höhe in Textform anmelden, Sicherheit zu leisten, soweit sie nicht Befriedigung verlangen können. Dieses Recht steht den Gläubigern jedoch nur zu, wenn sie glaubhaft machen, dass durch die Verschmelzung die Erfüllung der Forderung gefährdet wird."
    },
    {
      "date": "2025-02-20",
      "id": "101829",
      "original_text": "Registerbekanntmachung nach dem Umwandlungsgesetz\nSachsen Amtsgericht Leipzig HRB 28833\nDHG - Deutsche Heumilchgesellschaft mbH – Frohburg",
      "type": "Registerbekanntmachung nach dem Umwandlungsgesetz",
      "state": "Sachsen",
      "amtsgericht": "Amtsgericht Leipzig",
      "registernummer": "HRB 28833",
      "registerart": "HRB",
      "company_name": "DHG - Deutsche Heumilchgesellschaft mbH",
      "company_seat": "Frohburg",
      "details": "20.02.2025 (Bekanntmachungsdatum)\n\nSachsen Amtsgericht Leipzig HRB 28833\nRegisterbekanntmachung nach dem Umwandlungsgesetz 20.02.2025 (Eintragungsdatum)\n\nDHG - Deutsche Heumilchgesellschaft mbH\nGesellschaft mit beschränkter Haftung\nFrohburg\n\nDen Gläubigern der an der Verschmelzung beteiligten Rechtsträger ist, wenn sie binnen sechs Monaten nach dem Tag, an dem die Eintragung der Verschmelzung in das Register des Sitzes desjenigen Rechtsträgers, dessen Gläubiger sie sind, nach § 19 Abs. 3 UmwG als bekannt gemacht gilt, ihren Anspruch nach Grund und Höhe in Textform anmelden, Sicherheit zu leisten, soweit sie nicht Befriedigung verlangen können. Dieses Recht steht den Gläubigern jedoch nur zu, wenn sie glaubhaft machen, dass durch die Verschmelzung die Erfüllung der Forderung gefährdet wird."
    },
    {
      "date": "2025-02-20",
      "id": "101830",
      "original_text": "Löschungsankündigung\nSachsen Amtsgericht Dresden HRB 31462\nDelta Hitec GmbH – Pirna",
      "type": "Löschungsankündigung",
      "state": "Sachsen",
      "amtsgericht": "Amtsgericht Dresden",
      "registernummer": "HRB 31462",
      "registerart": "HRB",
      "company_name": "Delta Hitec GmbH",
      "company_seat": "Pirna",
      "details": "20.02.2025 (Bekanntmachungsdatum)\n\nSachsen Amtsgericht Dresden HRB 31462\nLöschungsankündigung\n\nDelta Hitec GmbH\nGesellschaft mit beschränkter Haftung\nPirna\n\nDas Registergericht beabsichtigt, die im Handelsregister eingetragene Gesellschaft von Amts wegen nach § 394 FamFG zu löschen. Die Frist zu Erhebung eines Widerspruchs gegen die beabsichtigte Löschung wird auf einen Monat festgesetzt."
    },
    {
      "date": "2025-02-20",
      "id": "101831",
      "original_text": "Registerbekanntmachung nach dem Umwandlungsgesetz\nSachsen Amtsgericht Leipzig HRB 42336\nAutomotive Service Leipzig GmbH – Leipzig",
      "type": "Registerbekanntmachung nach dem Umwandlungsgesetz",
      "state": "Sachsen",
      "amtsgericht": "Amtsgericht Leipzig",
      "registernummer": "HRB 42336",
      "registerart": "HRB",
      "company_name": "Automotive Service Leipzig GmbH",
      "company_seat": "Leipzig",
      "details": "20.02.2025 (Bekanntmachungsdatum)\n\nSachsen Amtsgericht Leipzig HRB 42336\nRegisterbekanntmachung nach dem Umwandlungsgesetz 20.02.2025 (Eintragungsdatum)\n\nAutomotive Service Leipzig GmbH\nGesellschaft mit beschränkter Haftung\nLeipzig\n\nDen Gläubigern der an der Verschmelzung beteiligten Rechtsträger ist, wenn sie binnen sechs Monaten nach dem Tag, an dem die Eintragung der Verschmelzung in das Register des Sitzes desjenigen Rechtsträgers, dessen Gläubiger sie sind, nach § 19 Abs. 3 UmwG als bekannt gemacht gilt, ihren Anspruch nach Grund und Höhe in Textform anmelden, Sicherheit zu leisten, soweit sie nicht Befriedigung verlangen können. Dieses Recht steht den Gläubigern jedoch nur zu, wenn sie glaubhaft machen, dass durch die Verschmelzung die Erfüllung der Forderung gefährdet wird."
    },
    {
      "date": "2025-02-20",
      "id": "101832",
      "original_text": "Registerbekanntmachung nach dem Umwandlungsgesetz\nSachsen Amtsgericht Leipzig HRB 33374\nBerger-Petsch West UG (haftungsbeschränkt) – Leipzig",
      "type": "Registerbekanntmachung nach dem Umwandlungsgesetz",
      "state": "Sachsen",
      "amtsgericht": "Amtsgericht Leipzig",
      "registernummer": "HRB 33374",
      "registerart": "HRB",
      "company_name": "Berger-Petsch West UG (haftungsbeschränkt)",
      "company_seat": "Leipzig",
      "details": "20.02.2025 (Bekanntmachungsdatum)\n\nSachsen Amtsgericht Leipzig HRB 33374\nRegisterbekanntmachung nach dem Umwandlungsgesetz 20.02.2025 (Eintragungsdatum)\n\nBerger-Petsch West UG (haftungsbeschränkt)\nGesellschaft mit beschränkter Haftung\nLeipzig\n\nDen Gläubigern der an der Verschmelzung beteiligten Rechtsträger ist, wenn sie binnen sechs Monaten nach dem Tag, an dem die Eintragung der Verschmelzung in das Register des Sitzes desjenigen Rechtsträgers, dessen Gläubiger sie sind, nach § 19 Abs. 3 UmwG als bekannt gemacht gilt, ihren Anspruch nach Grund und Höhe in Textform anmelden, Sicherheit zu leisten, soweit sie nicht Befriedigung verlangen können. Dieses Recht steht den Gläubigern jedoch nur zu, wenn sie glaubhaft machen, dass durch die Verschmelzung die Erfüllung der Forderung gefährdet wird."
    },
    {
      "date": "2025-02-20",
      "id": "101833",
      "original_text": "Registerbekanntmachung nach dem Umwandlungsgesetz\nSachsen Amtsgericht Leipzig GsR 245\nAutomotive Service Leipzig Beckert und Freudenthal eGbR – Leipzig",
      "type": "Registerbekanntmachung nach dem Umwandlungsgesetz",
      "state": "Sachsen",
      "amtsgericht": "Amtsgericht Leipzig",
      "registernummer": "GsR 245",
      "registerart": "GsR",
      "company_name": "Automotive Service Leipzig Beckert und Freudenthal eGbR",
      "company_seat": "Leipzig",
      "details": "20.02.2025 (Bekanntmachungsdatum)\n\nSachsen Amtsgericht Leipzig GsR 245\nRegisterbekanntmachung nach dem Umwandlungsgesetz 20.02.2025 (Eintragungsdatum)\n\nAutomotive Service Leipzig Beckert und Freudenthal eGbR\nGesellschaft bürgerlichen Rechts\nLeipzig\n\nDen Gläubigern der an der Verschmelzung beteiligten Rechtsträger ist, wenn sie binnen sechs Monaten nach dem Tag, an dem die Eintragung der Verschmelzung in das Register des Sitzes desjenigen Rechtsträgers, dessen Gläubiger sie sind, nach § 19 Abs. 3 UmwG als bekannt gemacht gilt, ihren Anspruch nach Grund und Höhe in Textform anmelden, Sicherheit zu leisten, soweit sie nicht Befriedigung verlangen können. Dieses Recht steht den Gläubigern jedoch nur zu, wenn sie glaubhaft machen, dass durch die Verschmelzung die Erfüllung der Forderung gefährdet wird."
    },
    {
      "date": "2025-02-20",
      "id": "101834",
      "original_text": "Registerbekanntmachung nach dem Umwandlungsgesetz\nSachsen Amtsgericht Leipzig HRB 4853\nDITTMANNSDORFER MILCH GmbH – Kitzscher OT Dittmannsdorf",
      "type": "Registerbekanntmachung nach dem Umwandlungsgesetz",
      "state": "Sachsen",
      "amtsgericht": "Amtsgericht Leipzig",
      "registernummer": "HRB 4853",
      "registerart": "HRB",
      "company_name": "DITTMANNSDORFER MILCH GmbH",
      "company_seat": "Kitzscher OT Dittmannsdorf",
      "details": "20.02.2025 (Bekanntmachungsdatum)\n\nSachsen Amtsgericht Leipzig HRB 4853\nRegisterbekanntmachung nach dem Umwandlungsgesetz 20.02.2025 (Eintragungsdatum)\n\nDITTMANNSDORFER MILCH GmbH\nGesellschaft mit beschränkter Haftung\nKitzscher OT Dittmannsdorf\n\nDen Gläubigern der an der Verschmelzung beteiligten Rechtsträger ist, wenn sie binnen sechs Monaten nach dem Tag, an dem die Eintragung der Verschmelzung in das Register des Sitzes desjenigen Rechtsträgers, dessen Gläubiger sie sind, nach § 19 Abs. 3 UmwG als bekannt gemacht gilt, ihren Anspruch nach Grund und Höhe in Textform anmelden, Sicherheit zu leisten, soweit sie nicht Befriedigung verlangen können. Dieses Recht steht den Gläubigern jedoch nur zu, wenn sie glaubhaft machen, dass durch die Verschmelzung die Erfüllung der Forderung gefährdet wird."
    },
    {
      "date": "2025-02-20",
      "id": "101835",
      "original_text": "Löschungsankündigung\nSachsen Amtsgericht Chemnitz HRB 32427\nBackwirtschaft L. & P. Meinel Vertriebs GmbH – Schöneck/Vogtl.",
      "type": "Löschungsankündigung",
      "state": "Sachsen",
      "amtsgericht": "Amtsgericht Chemnitz",
      "registernummer": "HRB 32427",
      "registerart": "HRB",
      "company_name": "Backwirtschaft L. & P. Meinel Vertriebs GmbH",
      "company_seat": "Schöneck/Vogtl.",
      "details": "20.02.2025 (Bekanntmachungsdatum)\n\nSachsen Amtsgericht Chemnitz HRB 32427\nLöschungsankündigung\n\nBackwirtschaft L. & P. Meinel Vertriebs GmbH\nGesellschaft mit beschränkter Haftung\nSchöneck/Vogtl.\n\nDas Registergericht beabsichtigt, die im Handelsregister eingetragene Gesellschaft von Amts wegen nach § 394 FamFG zu löschen. Die Frist zu Erhebung eines Widerspruchs gegen die beabsichtigte Löschung wird auf einen Monat festgesetzt."
    },
    {
      "date": "2025-02-20",
      "id": "101836",
      "original_text": "Löschungsankündigung\nNiedersachsen Amtsgericht Hannover HRB 221161\nMZ Services GmbH – Garbsen",
      "type": "Löschungsankündigung",
      "state": "Niedersachsen",
      "amtsgericht": "Amtsgericht Hannover",
      "registernummer": "HRB 221161",
      "registerart": "HRB",
      "company_name": "MZ Services GmbH",
      "company_seat": "Garbsen",
      "details": "20.02.2025 (Bekanntmachungsdatum)\n\nNiedersachsen Amtsgericht Hannover HRB 221161\nLöschungsankündigung\n\nMZ Services GmbH\nGesellschaft mit beschränkter Haftung\nGarbsen\n\nHRB 221161:   MZ Services GmbH, Garbsen\n\nDas Registergericht beabsichtigt, die Gesellschaft von Amts wegen nach § 394 FamFG zu löschen. Die Frist zur Erhebung eines Widerspruchs ist auf 1 Monat ab dieser Registerbekanntmachung festgesetzt."
    },
    {
      "date": "2025-02-20",
      "id": "101837",
      "original_text": "Löschungsankündigung\nNiedersachsen Amtsgericht Lüneburg HRB 207608\nARCOS Projekt GmbH – Südheide",
      "type": "Löschungsankündigung",
      "state": "Niedersachsen",
      "amtsgericht": "Amtsgericht Lüneburg",
      "registernummer": "HRB 207608",
      "registerart": "HRB",
      "company_name": "ARCOS Projekt GmbH",
      "company_seat": "Südheide",
      "details": "20.02.2025 (Bekanntmachungsdatum)\n\nNiedersachsen Amtsgericht Lüneburg HRB 207608\nLöschungsankündigung\n\nARCOS Projekt GmbH\nGesellschaft mit beschränkter Haftung\nSüdheide\n\nDas Registergericht beabsichtigt, die Gesellschaft von Amts wegen nach § 394 FamFG zu löschen. Die Frist zur Erhebung eines Widerspruchs ist auf 1 Monat ab dieser Registerbekanntmachung festgesetzt."
    },
    {
      "date": "2025-02-20",
      "id": "101838",
      "original_text": "Registerbekanntmachung nach dem Umwandlungsgesetz\nNiedersachsen Amtsgericht Lüneburg HRB 211001\nplan B industrieservice GmbH – Soltau",
      "type": "Registerbekanntmachung nach dem Umwandlungsgesetz",
      "state": "Niedersachsen",
      "amtsgericht": "Amtsgericht Lüneburg",
      "registernummer": "HRB 211001",
      "registerart": "HRB",
      "company_name": "plan B industrieservice GmbH",
      "company_seat": "Soltau",
      "details": "20.02.2025 (Bekanntmachungsdatum)\n\nNiedersachsen Amtsgericht Lüneburg HRB 211001\nRegisterbekanntmachung nach dem Umwandlungsgesetz 20.02.2025 (Eintragungsdatum)\n\nplan B industrieservice GmbH\nGesellschaft mit beschränkter Haftung\nSoltau\n\nDen Gläubigern der an der Verschmelzung beteiligten Rechtsträger ist, wenn sie binnen sechs Monaten nach dem Tag, an dem die Eintragung der Verschmelzung in das Register des Sitzes desjenigen Rechtsträgers, dessen Gläubiger sie sind, nach § 19  Abs.  3 UmwG als bekannt gemacht gilt, ihren Anspruch nach Grund und Höhe schriftlich anmelden, Sicherheit zu leisten, soweit sie nicht Befriedigung verlangen können. Dieses Recht steht den Gläubigern jedoch nur zu, wenn sie glaubhaft machen, dass durch die Verschmelzung die Erfüllung der Forderung gefährdet wird."
    },
    {
      "date": "2025-02-20",
      "id": "101839",
      "original_text": "Löschungsankündigung\nNiedersachsen Amtsgericht Hildesheim HRB 110715 früher Amtsgericht Alfeld\nAutohaus Robert Dörries GmbH – Holzminden",
      "type": "Löschungsankündigung",
      "state": "Niedersachsen",
      "amtsgericht": "Amtsgericht Hildesheim",
      "registernummer": "HRB 110715",
      "registerart": "HRB",
      "company_name": "Autohaus Robert Dörries GmbH",
      "company_seat": "Holzminden",
      "former_amtsgericht": "Alfeld",
      "details": "20.02.2025 (Bekanntmachungsdatum)\n\nNiedersachsen Amtsgericht Hildesheim HRB 110715 früher Amtsgericht Alfeld\nLöschungsankündigung\n\nAutohaus Robert Dörries GmbH\nGesellschaft mit beschränkter Haftung\nHolzminden\n\nDas Registergericht beabsichtigt, die Gesellschaft von Amts wegen nach § 394 FamFG zu löschen. Die Frist zur Erhebung eines Widerspruchs ist auf 1 Monat ab dieser Registerbekanntmachung festgesetzt."
    },
    {
      "date": "2025-02-20",
      "id": "101840",
      "original_text": "Registerbekanntmachung nach dem Umwandlungsgesetz\nNiedersachsen Amtsgericht Osnabrück HRA 202733\nHeuger Betriebs- und Grundstücksverwaltungs GmbH & Co. KG – Glandorf",
      "type": "Registerbekanntmachung nach dem Umwandlungsgesetz",
      "state": "Niedersachsen",
      "amtsgericht": "Amtsgericht Osnabrück",
      "registernummer": "HRA 202733",
      "registerart": "HRA",
      "company_name": "Heuger Betriebs- und Grundstücksverwaltungs GmbH & Co. KG",
      "company_seat": "Glandorf",
      "details": "20.02.2025 (Bekanntmachungsdatum)\n\nNiedersachsen Amtsgericht Osnabrück HRA 202733\nRegisterbekanntmachung nach dem Umwandlungsgesetz 20.02.2025 (Eintragungsdatum)\n\nHeuger Betriebs- und Grundstücksverwaltungs GmbH & Co. KG\nKommanditgesellschaft\nGlandorf\n\nDen Gläubigern der an der Ausgliederung beteiligten Rechtsträger ist, wenn sie binnen sechs Monaten nach dem Tag, an dem die Eintragung der Ausgliederung in das Register des Sitzes desjenigen Rechtsträgers, dessen Gläubiger sie sind, nach § 19 Abs. 3 UmwG als bekannt gemacht gilt, ihren Anspruch nach Grund und Höhe schriftlich anmelden, Sicherheit zu leisten, soweit sie nicht Befriedigung verlangen können. Dieses Recht steht den Gläubigern jedoch nur zu, wenn sie glaubhaft machen, dass durch die Ausgliederung die Erfüllung der Forderung gefährdet wird."
    },
    {
      "date": "2025-02-20",
      "id": "101841",
      "original_text": "Einreichung neuer Dokumente\nNiedersachsen Amtsgericht Hannover HRB 57836\nHallo Taxi 3811 GmbH – Hannover",
      "type": "Einreichung neuer Dokumente",
      "state": "Niedersachsen",
      "amtsgericht": "Amtsgericht Hannover",
      "registernummer": "HRB 57836",
      "registerart": "HRB",
      "company_name": "Hallo Taxi 3811 GmbH",
      "company_seat": "Hannover",
      "details": "20.02.2025 (Bekanntmachungsdatum)\n\nNiedersachsen Amtsgericht Hannover HRB 57836\nEinreichung neuer Dokumente\n\nHallo Taxi 3811 GmbH\nGesellschaft mit beschränkter Haftung\nHannover\n\nDie Liste der Mitglieder des Aufsichtsrats wurde beim Registergericht eingereicht."
    },
    {
      "date": "2025-02-20",
      "id": "101842",
      "original_text": "Sonstige Registerbekanntmachung\nNiedersachsen Amtsgericht Oldenburg (Oldenburg) HRB 200988\nForFarmers Langförden GmbH – Vechta-Langförden",
      "type": "Sonstige Registerbekanntmachung",
      "state": "Niedersachsen",
      "amtsgericht": "Amtsgericht Oldenburg (Oldenburg)",
      "registernummer": "HRB 200988",
      "registerart": "HRB",
      "company_name": "ForFarmers Langförden GmbH",
      "company_seat": "Vechta-Langförden",
      "details": "20.02.2025 (Bekanntmachungsdatum)\n\nNiedersachsen Amtsgericht Oldenburg (Oldenburg) HRB 200988\nSonstige Registerbekanntmachung 20.02.2025 (Eintragungsdatum)\n\nForFarmers Langförden GmbH\nGesellschaft mit beschränkter Haftung\nVechta-Langförden\n\nDen Gläubigern der Gesellschaft, deren Forderungen begründet worden sind, bevor die Eintragung der Beendigung des Vertrages in das Handelsregister nach § 10 HGB als bekanntgemacht gilt, ist vom anderen Vertragsteil Sicherheit zu leisten, wenn sie sich binnen sechs Monaten nach der Bekanntmachung zu diesem Zweck bei ihm melden."
    },
    {
      "date": "2025-02-20",
      "id": "101843",
      "original_text": "Registerbekanntmachung nach dem Umwandlungsgesetz\nNiedersachsen Amtsgericht Lüneburg HRB 200940\nISI Industrie Service International GmbH – Soltau",
      "type": "Registerbekanntmachung nach dem Umwandlungsgesetz",
      "state": "Niedersachsen",
      "amtsgericht": "Amtsgericht Lüneburg",
      "registernummer": "HRB 200940",
      "registerart": "HRB",
      "company_name": "ISI Industrie Service International GmbH",
      "company_seat": "Soltau",
      "details": "20.02.2025 (Bekanntmachungsdatum)\n\nNiedersachsen Amtsgericht Lüneburg HRB 200940\nRegisterbekanntmachung nach dem Umwandlungsgesetz 20.02.2025 (Eintragungsdatum)\n\nISI Industrie Service International GmbH\nGesellschaft mit beschränkter Haftung\nSoltau\n\nDen Gläubigern der an der Verschmelzung beteiligten Rechtsträger ist, wenn sie binnen sechs Monaten nach dem Tag, an dem die Eintragung der Verschmelzung in das Register des Sitzes desjenigen Rechtsträgers, dessen Gläubiger sie sind, nach § 19  Abs.  3 UmwG als bekannt gemacht gilt, ihren Anspruch nach Grund und Höhe schriftlich anmelden, Sicherheit zu leisten, soweit sie nicht Befriedigung verlangen können. Dieses Recht steht den Gläubigern jedoch nur zu, wenn sie glaubhaft machen, dass durch die Verschmelzung die Erfüllung der Forderung gefährdet wird."
    },
    {
      "date": "2025-02-20",
      "id": "101844",
      "original_text": "Löschungsankündigung\nNiedersachsen Amtsgericht Braunschweig HRB 207534\nHaushaltsfee Lehmann UG (haftungsbeschränkt) – Wolfenbüttel",
      "type": "Löschungsankündigung",
      "state": "Niedersachsen",
      "amtsgericht": "Amtsgericht Braunschweig",
      "registernummer": "HRB 207534",
      "registerart": "HRB",
      "company_name": "Haushaltsfee Lehmann UG (haftungsbeschränkt)",
      "company_seat": "Wolfenbüttel",
      "details": "20.02.2025 (Bekanntmachungsdatum)\n\nNiedersachsen Amtsgericht Braunschweig HRB 207534\nLöschungsankündigung\n\nHaushaltsfee Lehmann UG (haftungsbeschränkt)\nGesellschaft mit beschränkter Haftung\nWolfenbüttel\n\nDas Registergericht beabsichtigt, die Gesellschaft von Amts wegen nach § 394 FamFG zu löschen. Die Frist zur Erhebung eines Widerspruchs ist auf 1 Monat ab dieser Registerbekanntmachung festgesetzt."
    },
    {
      "date": "2025-02-20",
      "id": "101845",
      "original_text": "Löschungsankündigung\nNiedersachsen Amtsgericht Tostedt HRB 210216\nHYPERPAD UG (haftungsbeschränkt) – Jork",
      "type": "Löschungsankündigung",
      "state": "Niedersachsen",
      "amtsgericht": "Amtsgericht Tostedt",
      "registernummer": "HRB 210216",
      "registerart": "HRB",
      "company_name": "HYPERPAD UG (haftungsbeschränkt)",
      "company_seat": "Jork",
      "details": "20.02.2025 (Bekanntmachungsdatum)\n\nNiedersachsen Amtsgericht Tostedt HRB 210216\nLöschungsankündigung\n\nHYPERPAD UG (haftungsbeschränkt)\nGesellschaft mit beschränkter Haftung\nJork\n\nDas Registergericht beabsichtigt, die Gesellschaft von Amts wegen nach § 394 FamFG zu löschen. Die Frist zur Erhebung eines Widerspruchs ist auf 1 Monat ab dieser Registerbekanntmachung festgesetzt."
    },
    {
      "date": "2025-02-20",
      "id": "101846",
      "original_text": "Löschungsankündigung\nBremen Amtsgericht Bremen HRB 38958\nM & M Strong GmbH – Bremerhaven",
      "type": "Löschungsankündigung",
      "state": "Bremen",
      "amtsgericht": "Amtsgericht Bremen",
      "registernummer": "HRB 38958",
      "registerart": "HRB",
      "company_name": "M & M Strong GmbH",
      "company_seat": "Bremerhaven",
      "details": "20.02.2025 (Bekanntmachungsdatum)\n\nBremen Amtsgericht Bremen HRB 38958\nLöschungsankündigung\n\nM & M Strong GmbH\nGesellschaft mit beschränkter Haftung\nBremerhaven\n\nEs ist beabsichtigt die im Handelsregister eingetragene Gesellschaft von Amts wegen gemäß § 394 FamFG zu löschen. Gegen die Löschung kann beim AG Bremen schriftlich oder zu Protokoll der Geschäftsstelle Widerspruch eingelegt werden. Widerspruchsfrist 4 Wochen."
    },
    {
      "date": "2025-02-20",
      "id": "101847",
      "original_text": "Löschungsankündigung\nBremen Amtsgericht Bremen HRB 38799\nA.I.S. GmbH – Bremen",
      "type": "Löschungsankündigung",
      "state": "Bremen",
      "amtsgericht": "Amtsgericht Bremen",
      "registernummer": "HRB 38799",
      "registerart": "HRB",
      "company_name": "A.I.S. GmbH",
      "company_seat": "Bremen",
      "details": "20.02.2025 (Bekanntmachungsdatum)\n\nBremen Amtsgericht Bremen HRB 38799\nLöschungsankündigung\n\nA.I.S. GmbH\nGesellschaft mit beschränkter Haftung\nBremen\n\nEs ist beabsichtigt die im Handelsregister eingetragene Gesellschaft von Amts wegen gemäß § 394 FamFG zu löschen. Gegen die Löschung kann beim AG Bremen schriftlich oder zu Protokoll der Geschäftsstelle Widerspruch eingelegt werden. Widerspruchsfrist 4 Wochen."
    },
    {
      "date": "2025-02-20",
      "id": "101848",
      "original_text": "Löschungsankündigung\nBremen Amtsgericht Bremen HRB 33280\nAutohaus Ring GmbH – Bremen",
      "type": "Löschungsankündigung",
      "state": "Bremen",
      "amtsgericht": "Amtsgericht Bremen",
      "registernummer": "HRB 33280",
      "registerart": "HRB",
      "company_name": "Autohaus Ring GmbH",
      "company_seat": "Bremen",
      "details": "20.02.2025 (Bekanntmachungsdatum)\n\nBremen Amtsgericht Bremen HRB 33280\nLöschungsankündigung\n\nAutohaus Ring GmbH\nGesellschaft mit beschränkter Haftung\nBremen\n\nEs ist beabsichtigt die im Handelsregister eingetragene Gesellschaft von Amts wegen gemäß § 394 FamFG zu löschen. Gegen die Löschung kann beim AG Bremen schriftlich oder zu Protokoll der Geschäftsstelle Widerspruch eingelegt werden. Widerspruchsfrist 4 Wochen."
    },
    {
      "date": "2025-02-20",
      "id": "101849",
      "original_text": "Löschungsankündigung\nBremen Amtsgericht Bremen HRB 32374\nLony Event GmbH – Bremen",
      "type": "Löschungsankündigung",
      "state": "Bremen",
      "amtsgericht": "Amtsgericht Bremen",
      "registernummer": "HRB 32374",
      "registerart": "HRB",
      "company_name": "Lony Event GmbH",
      "company_seat": "Bremen",
      "details": "20.02.2025 (Bekanntmachungsdatum)\n\nBremen Amtsgericht Bremen HRB 32374\nLöschungsankündigung\n\nLony Event GmbH\nGesellschaft mit beschränkter Haftung\nBremen\n\nEs ist beabsichtigt die im Handelsregister eingetragene Gesellschaft von Amts wegen gemäß § 394 FamFG zu löschen. Gegen die Löschung kann beim AG Bremen schriftlich oder zu Protokoll der Geschäftsstelle Widerspruch eingelegt werden. Widerspruchsfrist 4 Wochen."
    },
    {
      "date": "2025-02-20",
      "id": "101850",
      "original_text": "Registerbekanntmachung nach dem Umwandlungsgesetz\nRheinland-Pfalz Amtsgericht Kaiserslautern HRB 32236\nHC Digital Services GmbH – Kaiserslautern",
      "type": "Registerbekanntmachung nach dem Umwandlungsgesetz",
      "state": "Rheinland-Pfalz",
      "amtsgericht": "Amtsgericht Kaiserslautern",
      "registernummer": "HRB 32236",
      "registerart": "HRB",
      "company_name": "HC Digital Services GmbH",
      "company_seat": "Kaiserslautern",
      "details": "20.02.2025 (Bekanntmachungsdatum)\n\nRheinland-Pfalz Amtsgericht Kaiserslautern HRB 32236\nRegisterbekanntmachung nach dem Umwandlungsgesetz 20.02.2025 (Eintragungsdatum)\n\nHC Digital Services GmbH\nGesellschaft mit beschränkter Haftung\nKaiserslautern\n\nAls nicht eingetragen wird veröffentlicht: Den Gläubigern der an der Verschmelzung beteiligten Rechtsträger ist, wenn sie binnen sechs Monaten nach dem Tag, an dem die Eintragung der Verschmelzung in das Register des Sitzes desjenigen Rechtsträgers, dessen Gläubiger sie sind, nach § 19 Abs. 3 UmwG als bekannt gemacht gilt, ihren Anspruch nach Grund und Höhe schriftlich anmelden, Sicherheit zu leisten, soweit sie nicht Befriedigung verlangen können. Dieses Recht steht den Gläubigern jedoch nur zu, wenn sie glaubhaft machen, dass durch die Verschmelzung die Erfüllung der Forderung gefährdet wird."
    },
    {
      "date": "2025-02-20",
      "id": "101851",
      "original_text": "Registerbekanntmachung nach dem Umwandlungsgesetz\nRheinland-Pfalz Amtsgericht Mainz HRB 53324\nOMDV GmbH – Worms",
      "type": "Registerbekanntmachung nach dem Umwandlungsgesetz",
      "state": "Rheinland-Pfalz",
      "amtsgericht": "Amtsgericht Mainz",
      "registernummer": "HRB 53324",
      "registerart": "HRB",
      "company_name": "OMDV GmbH",
      "company_seat": "Worms",
      "details": "20.02.2025 (Bekanntmachungsdatum)\n\nRheinland-Pfalz Amtsgericht Mainz HRB 53324\nRegisterbekanntmachung nach dem Umwandlungsgesetz 20.02.2025 (Eintragungsdatum)\n\nOMDV GmbH\nGesellschaft mit beschränkter Haftung\nWorms\n\nAls nicht eingetragen wird veröffentlicht: Den Gläubigern der an der Ausgliederung beteiligten Rechtsträger ist, wenn sie binnen sechs Monaten nac hdem Tag, an dem die Eintragung der Ausgliederung in das Register des Sitzes desjenigen Rechtsträgers,dessen Gläubiger sie sind, nach § 19 Abs. 3 UmwG als bekannt gemacht gilt, ihren Anspruch nach Grund und Höhe schriftlich anmelden, Sicherheit zu leisten, soweit sie nicht Befriedigung verlangen können. Dieses Recht steht den Gläubigern jedoch nur zu, wenn sie glaubhaft machen, dass durch die Ausgliederung die Erfüllung der Forderung gefährdet wird."
    },
    {
      "date": "2025-02-20",
      "id": "101852",
      "original_text": "Löschungsankündigung\nRheinland-Pfalz Amtsgericht Montabaur HRB 22939\nSPS Energy GmbH – Horhausen",
      "type": "Löschungsankündigung",
      "state": "Rheinland-Pfalz",
      "amtsgericht": "Amtsgericht Montabaur",
      "registernummer": "HRB 22939",
      "registerart": "HRB",
      "company_name": "SPS Energy GmbH",
      "company_seat": "Horhausen",
      "details": "20.02.2025 (Bekanntmachungsdatum)\n\nRheinland-Pfalz Amtsgericht Montabaur HRB 22939\nLöschungsankündigung 20.02.2025 (Eintragungsdatum)\n\nSPS Energy GmbH\nGesellschaft mit beschränkter Haftung\nHorhausen\n\nDas Registergericht beabsichtigt die Gesellschaft von Amts wegen nach § 394 FamFG zu löschen. Die Frist zur Erhebung eines Widerspruchs ist auf 1 Monat festgesetzt."
    },
    {
      "date": "2025-02-20",
      "id": "101853",
      "original_text": "Registerbekanntmachung nach dem Umwandlungsgesetz\nRheinland-Pfalz Amtsgericht Kaiserslautern HRB 33343\nChedri LeasFinanz GmbH – Kaiserslautern",
      "type": "Registerbekanntmachung nach dem Umwandlungsgesetz",
      "state": "Rheinland-Pfalz",
      "amtsgericht": "Amtsgericht Kaiserslautern",
      "registernummer": "HRB 33343",
      "registerart": "HRB",
      "company_name": "Chedri LeasFinanz GmbH",
      "company_seat": "Kaiserslautern",
      "details": "20.02.2025 (Bekanntmachungsdatum)\n\nRheinland-Pfalz Amtsgericht Kaiserslautern HRB 33343\nRegisterbekanntmachung nach dem Umwandlungsgesetz 20.02.2025 (Eintragungsdatum)\n\nChedri LeasFinanz GmbH\nGesellschaft mit beschränkter Haftung\nKaiserslautern\n\nAls nicht eingetragen wird veröffentlicht: Den Gläubigern der an der Verschmelzung beteiligten Rechtsträger ist, wenn sie binnen sechs Monaten nach dem Tag, an dem die Eintragung der Verschmelzung in das Register des Sitzes desjenigen Rechtsträgers, dessen Gläubiger sie sind, nach § 19 Abs. 3 UmwG als bekannt gemacht gilt, ihren Anspruch nach Grund und Höhe schriftlich anmelden, Sicherheit zu leisten, soweit sie nicht Befriedigung verlangen können. Dieses Recht steht den Gläubigern jedoch nur zu, wenn sie glaubhaft machen, dass durch die Verschmelzung die Erfüllung der Forderung gefährdet wird."
    },
    {
      "date": "2025-02-20",
      "id": "101854",
      "original_text": "Registerbekanntmachung nach dem Umwandlungsgesetz\nRheinland-Pfalz Amtsgericht Mainz HRA 44753\nOliver Martin - Dienstleistung und Vermittlung e. K. – Worms",
      "type": "Registerbekanntmachung nach dem Umwandlungsgesetz",
      "state": "Rheinland-Pfalz",
      "amtsgericht": "Amtsgericht Mainz",
      "registernummer": "HRA 44753",
      "registerart": "HRA",
      "company_name": "Oliver Martin - Dienstleistung und Vermittlung e. K.",
      "company_seat": "Worms",
      "details": "20.02.2025 (Bekanntmachungsdatum)\n\nRheinland-Pfalz Amtsgericht Mainz HRA 44753\nRegisterbekanntmachung nach dem Umwandlungsgesetz 20.02.2025 (Eintragungsdatum)\n\nOliver Martin - Dienstleistung und Vermittlung e. K.\nEinzelkaufmann / Einzelkauffrau\nWorms\n\nGläubigern der an derAusgliederung beteiligten Rechtsträger ist, wenn sie binnen sechs Monaten nac hdem Tag, an dem die Eintragung der Ausgliederung in das Register des Sitzes desjenigen Rechtsträgers,dessen Gläubiger sie sind, nach § 19 Abs. 3 UmwG als bekannt gemacht gilt, ihren Anspruch nach Grund und Höhe schriftlich anmelden, Sicherheit zu leisten, soweit sie nicht Befriedigung verlangen können. Dieses Recht steht den Gläubigern jedoch nur zu, wenn sie glaubhaft machen, dass durch die Ausgliederung die Erfüllung der Forderung gefährdet wird."
    },
    {
      "date": "2025-02-20",
      "id": "101855",
      "original_text": "Registerbekanntmachung nach dem Umwandlungsgesetz\nNordrhein-Westfalen Amtsgericht Aachen HRB 14602\nQuip Holding GmbH – Baesweiler",
      "type": "Registerbekanntmachung nach dem Umwandlungsgesetz",
      "state": "Nordrhein-Westfalen",
      "amtsgericht": "Amtsgericht Aachen",
      "registernummer": "HRB 14602",
      "registerart": "HRB",
      "company_name": "Quip Holding GmbH",
      "company_seat": "Baesweiler",
      "details": "20.02.2025 (Bekanntmachungsdatum)\n\nNordrhein-Westfalen Amtsgericht Aachen HRB 14602\nRegisterbekanntmachung nach dem Umwandlungsgesetz 20.02.2025 (Eintragungsdatum)\n\nQuip Holding GmbH\nGesellschaft mit beschränkter Haftung\nBaesweiler\n\nDen Gläubigern der an der Verschmelzung beteiligten Rechtsträger ist, wenn sie binnen sechs Monaten nach dem Tag, an dem die Eintragung der Verschmelzung in das Register des Sitzes derjenigen Rechtsträger deren Gläubiger sie sind, nach § 19 Absatz 3 UmwG als bekanntgemacht gilt, ihren Anspruch nach Grund und Höhe schriftlich anmelden, Sicherheit zu leisten, soweit sie nicht Befriedigung verlangen können. Dieses Recht steht den Gläubigern jedoch nur zu, wenn sie glaubhaft machen, dass durch die Verschmelzung die Erfüllung ihrer Forderung gefährdet wird."
    },
    {
      "date": "2025-02-20",
      "id": "101856",
      "original_text": "Registerbekanntmachung nach dem Umwandlungsgesetz\nNordrhein-Westfalen Amtsgericht Siegen HRA 9922\nEEW Offshore Wind Holding GmbH & Co. KG – Erndtebrück",
      "type": "Registerbekanntmachung nach dem Umwandlungsgesetz",
      "state": "Nordrhein-Westfalen",
      "amtsgericht": "Amtsgericht Siegen",
      "registernummer": "HRA 9922",
      "registerart": "HRA",
      "company_name": "EEW Offshore Wind Holding GmbH & Co. KG",
      "company_seat": "Erndtebrück",
      "details": "20.02.2025 (Bekanntmachungsdatum)\n\nNordrhein-Westfalen Amtsgericht Siegen HRA 9922\nRegisterbekanntmachung nach dem Umwandlungsgesetz 20.02.2025 (Eintragungsdatum)\n\nEEW Offshore Wind Holding GmbH & Co. KG\nKommanditgesellschaft\nErndtebrück\n\nDen Gläubigern der an der formwechselnden Umwandlung beteiligten Rechtsträger ist, wenn sie binnen sechs Monaten nach dem Tag, an dem die Eintragung der formwechselnden Umwandlung in das Register des Sitzes desjenigen Rechtsträgers, dessen Gläubiger sie sind, nach § 19 Absatz 3 UmwG als bekanntgemacht gilt, ihren Anspruch nach Grund und Höhe schriftlich anmelden, Sicherheit zu leisten, soweit sie nicht Befriedigung verlangen können. Dieses Recht steht den Gläubigern jedoch nur zu, wenn sie glaubhaft machen, dass durch die formwechselnden Umwandlung die Erfüllung ihrer Forderung gefährdet wird."
    },
    {
      "date": "2025-02-20",
      "id": "101857",
      "original_text": "Einreichung neuer Dokumente\nNordrhein-Westfalen Amtsgericht Bochum HRB 7472\nAral Aktiengesellschaft – Bochum",
      "type": "Einreichung neuer Dokumente",
      "state": "Nordrhein-Westfalen",
      "amtsgericht": "Amtsgericht Bochum",
      "registernummer": "HRB 7472",
      "registerart": "HRB",
      "company_name": "Aral Aktiengesellschaft",
      "company_seat": "Bochum",
      "details": "20.02.2025 (Bekanntmachungsdatum)\n\nNordrhein-Westfalen Amtsgericht Bochum HRB 7472\nEinreichung neuer Dokumente\n\nAral Aktiengesellschaft\nAktiengesellschaft\nBochum\n\nDem Registergericht ist eine neue Liste der Mitglieder des Aufsichtsrates eingereicht worden."
    },
    {
      "date": "2025-02-20",
      "id": "101858",
      "original_text": "Sonstige Registerbekanntmachung\nNordrhein-Westfalen Amtsgericht Lemgo HRB 2864\nDeutsches Rotes Kreuz - Betreuung und Pflege in Lippe gGmbH – Lemgo",
      "type": "Sonstige Registerbekanntmachung",
      "state": "Nordrhein-Westfalen",
      "amtsgericht": "Amtsgericht Lemgo",
      "registernummer": "HRB 2864",
      "registerart": "HRB",
      "company_name": "Deutsches Rotes Kreuz - Betreuung und Pflege in Lippe gGmbH",
      "company_seat": "Lemgo",
      "details": "20.02.2025 (Bekanntmachungsdatum)\n\nNordrhein-Westfalen Amtsgericht Lemgo HRB 2864\nSonstige Registerbekanntmachung\n\nDeutsches Rotes Kreuz - Betreuung und Pflege in Lippe gGmbH\nGesellschaft mit beschränkter Haftung\nLemgo\n\nDem Registergericht ist eine neue Liste der Mitglieder des Aufsichtsrates eingereicht worden."
    },
    {
      "date": "2025-02-20",
      "id": "101859",
      "original_text": "Löschungsankündigung\nNordrhein-Westfalen Amtsgericht Recklinghausen HRB 8580\nLSM Dienstleistung GmbH – Datteln",
      "type": "Löschungsankündigung",
      "state": "Nordrhein-Westfalen",
      "amtsgericht": "Amtsgericht Recklinghausen",
      "registernummer": "HRB 8580",
      "registerart": "HRB",
      "company_name": "LSM Dienstleistung GmbH",
      "company_seat": "Datteln",
      "details": "20.02.2025 (Bekanntmachungsdatum)\n\nNordrhein-Westfalen Amtsgericht Recklinghausen HRB 8580\nLöschungsankündigung\n\nLSM Dienstleistung GmbH\nGesellschaft mit beschränkter Haftung\nDatteln\n\nDas Registergericht beabsichtigt die Gesellschaft von Amts wegen nach § 394 FamFG zu löschen. Die Frist zur Erhebung eines Widerspruchs ist auf zwei Monate festgesetzt."
    },
    {
      "date": "2025-02-20",
      "id": "101860",
      "original_text": "Löschungsankündigung\nNordrhein-Westfalen Amtsgericht Siegen HRB 9894\nDeller GmbH – Siegen",
      "type": "Löschungsankündigung",
      "state": "Nordrhein-Westfalen",
      "amtsgericht": "Amtsgericht Siegen",
      "registernummer": "HRB 9894",
      "registerart": "HRB",
      "company_name": "Deller GmbH",
      "company_seat": "Siegen",
      "details": "20.02.2025 (Bekanntmachungsdatum)\n\nNordrhein-Westfalen Amtsgericht Siegen HRB 9894\nLöschungsankündigung\n\nDeller GmbH\nGesellschaft mit beschränkter Haftung\nSiegen\n\nDas Registergericht beabsichtigt die Gesellschaft von Amts wegen nach § 394 FamFG zu löschen. Die Frist zur Erhebung eines Widerspruchs ist auf drei Monate festgesetzt."
    },
    {
      "date": "2025-02-20",
      "id": "101861",
      "original_text": "Löschungsankündigung\nNordrhein-Westfalen Amtsgericht Düren HRB 7227\nGood Morning UG (haftungsbeschränkt) – Düren",
      "type": "Löschungsankündigung",
      "state": "Nordrhein-Westfalen",
      "amtsgericht": "Amtsgericht Düren",
      "registernummer": "HRB 7227",
      "registerart": "HRB",
      "company_name": "Good Morning UG (haftungsbeschränkt)",
      "company_seat": "Düren",
      "details": "20.02.2025 (Bekanntmachungsdatum)\n\nNordrhein-Westfalen Amtsgericht Düren HRB 7227\nLöschungsankündigung 20.02.2025 (Eintragungsdatum)\n\nGood Morning UG (haftungsbeschränkt)\nGesellschaft mit beschränkter Haftung\nDüren\n\nDas Registergericht beabsichtigt die Gesellschaft von Amts wegen nach § 394 FamFG zu löschen. Die Frist zur Erhebung eines Widerspruchs ist auf drei Monate festgesetzt."
    },
    {
      "date": "2025-02-20",
      "id": "101862",
      "original_text": "Löschungsankündigung\nNordrhein-Westfalen Amtsgericht Düren HRB 5959\nAK Hausbau GmbH – Düren",
      "type": "Löschungsankündigung",
      "state": "Nordrhein-Westfalen",
      "amtsgericht": "Amtsgericht Düren",
      "registernummer": "HRB 5959",
      "registerart": "HRB",
      "company_name": "AK Hausbau GmbH",
      "company_seat": "Düren",
      "details": "20.02.2025 (Bekanntmachungsdatum)\n\nNordrhein-Westfalen Amtsgericht Düren HRB 5959\nLöschungsankündigung\n\nAK Hausbau GmbH\nGesellschaft mit beschränkter Haftung\nDüren\n\nDas Registergericht beabsichtigt die Gesellschaft von Amts wegen nach § 394 FamFG zu löschen. Die Frist zur Erhebung eines Widerspruchs ist auf drei Monate festgesetzt."
    },
    {
      "date": "2025-02-20",
      "id": "101863",
      "original_text": "Löschungsankündigung\nNordrhein-Westfalen Amtsgericht Düren HRB 5959\nAK Hausbau GmbH – Düren",
      "type": "Löschungsankündigung",
      "state": "Nordrhein-Westfalen",
      "amtsgericht": "Amtsgericht Düren",
      "registernummer": "HRB 5959",
      "registerart": "HRB",
      "company_name": "AK Hausbau GmbH",
      "company_seat": "Düren",
      "details": "20.02.2025 (Bekanntmachungsdatum)\n\nNordrhein-Westfalen Amtsgericht Düren HRB 5959\nLöschungsankündigung 20.02.2025 (Eintragungsdatum)\n\nAK Hausbau GmbH\nGesellschaft mit beschränkter Haftung\nDüren\n\nDas Registergericht beabsichtigt die Gesellschaft von Amts wegen nach § 394 FamFG zu löschen. Die Frist zur Erhebung eines Widerspruchs ist auf drei Monate festgesetzt."
    },
    {
      "date": "2025-02-20",
      "id": "101864",
      "original_text": "Einreichung neuer Dokumente\nNordrhein-Westfalen Amtsgericht Köln HRB 20585\nDahlhausen Holding Aktiengesellschaft – Köln",
      "type": "Einreichung neuer Dokumente",
      "state": "Nordrhein-Westfalen",
      "amtsgericht": "Amtsgericht Köln",
      "registernummer": "HRB 20585",
      "registerart": "HRB",
      "company_name": "Dahlhausen Holding Aktiengesellschaft",
      "company_seat": "Köln",
      "details": "20.02.2025 (Bekanntmachungsdatum)\n\nNordrhein-Westfalen Amtsgericht Köln HRB 20585\nEinreichung neuer Dokumente\n\nDahlhausen Holding Aktiengesellschaft\nAktiengesellschaft\nKöln\n\nDem Registergericht ist eine neue Liste der Mitglieder des Aufsichtsrates eingereicht worden."
    },
    {
      "date": "2025-02-20",
      "id": "101865",
      "original_text": "Sonstige Registerbekanntmachung\nNordrhein-Westfalen Amtsgericht Lemgo HRB 5063\nDeutsches Rotes Kreuz - Bevölkerungsschutz und soziale Dienste in Lippe gemeinnützige GmbH – Detmold",
      "type": "Sonstige Registerbekanntmachung",
      "state": "Nordrhein-Westfalen",
      "amtsgericht": "Amtsgericht Lemgo",
      "registernummer": "HRB 5063",
      "registerart": "HRB",
      "company_name": "Deutsches Rotes Kreuz - Bevölkerungsschutz und soziale Dienste in Lippe gemeinnützige GmbH",
      "company_seat": "Detmold",
      "details": "20.02.2025 (Bekanntmachungsdatum)\n\nNordrhein-Westfalen Amtsgericht Lemgo HRB 5063\nSonstige Registerbekanntmachung\n\nDeutsches Rotes Kreuz - Bevölkerungsschutz und soziale Dienste in Lippe gemeinnützige GmbH\nGesellschaft mit beschränkter Haftung\nDetmold\n\nDem Registergericht ist eine neue Liste der Mitglieder des Aufsichtsrates eingereicht worden."
    },
    {
      "date": "2025-02-20",
      "id": "101866",
      "original_text": "Löschungsankündigung\nNordrhein-Westfalen Amtsgericht Köln HRB 68071\nMBE Cologne Engineering GmbH – Köln",
      "type": "Löschungsankündigung",
      "state": "Nordrhein-Westfalen",
      "amtsgericht": "Amtsgericht Köln",
      "registernummer": "HRB 68071",
      "registerart": "HRB",
      "company_name": "MBE Cologne Engineering GmbH",
      "company_seat": "Köln",
      "details": "20.02.2025 (Bekanntmachungsdatum)\n\nNordrhein-Westfalen Amtsgericht Köln HRB 68071\nLöschungsankündigung\n\nMBE Cologne Engineering GmbH\nGesellschaft mit beschränkter Haftung\nKöln\n\nDas Registergericht beabsichtigt die Gesellschaft von Amts wegen nach § 394 FamFG zu löschen. Die Frist zur Erhebung eines Widerspruchs ist auf einen Monat festgesetzt."
    },
    {
      "date": "2025-02-20",
      "id": "101867",
      "original_text": "Löschungsankündigung\nNordrhein-Westfalen Amtsgericht Dortmund HRB 20551\nTaverne Epsilon Service Ltd. – Dortmund",
      "type": "Löschungsankündigung",
      "state": "Nordrhein-Westfalen",
      "amtsgericht": "Amtsgericht Dortmund",
      "registernummer": "HRB 20551",
      "registerart": "HRB",
      "company_name": "Taverne Epsilon Service Ltd.",
      "company_seat": "Dortmund",
      "details": "20.02.2025 (Bekanntmachungsdatum)\n\nNordrhein-Westfalen Amtsgericht Dortmund HRB 20551\nLöschungsankündigung\n\nTaverne Epsilon Service Ltd.\nRechtsform ausländischen Rechts HRB\nDortmund\n\nDas Registergericht beabsichtigt, die Eintragung der Zweigniederlassung der Gesellschaft gemäß § 395 FamFG zu löschen, weil die Voraussetzungen für die Eintragung entfallen sind. Der Status der beim Companie's House in Cardiff registrierten Gesellschaft ist \"dissolved\".  Die Gesellschaft ist damit gelöscht.\nDie Frist zur Erhebung eines Widerspruchs ist auf zwei Monate festgesetzt."
    },
    {
      "date": "2025-02-20",
      "id": "101868",
      "original_text": "Löschungsankündigung\nNordrhein-Westfalen Amtsgericht Köln HRB 75650\nC.I.T.Y. Logistic GmbH – Kerpen",
      "type": "Löschungsankündigung",
      "state": "Nordrhein-Westfalen",
      "amtsgericht": "Amtsgericht Köln",
      "registernummer": "HRB 75650",
      "registerart": "HRB",
      "company_name": "C.I.T.Y. Logistic GmbH",
      "company_seat": "Kerpen",
      "details": "20.02.2025 (Bekanntmachungsdatum)\n\nNordrhein-Westfalen Amtsgericht Köln HRB 75650\nLöschungsankündigung\n\nC.I.T.Y. Logistic GmbH\nGesellschaft mit beschränkter Haftung\nKerpen\n\nDas Registergericht beabsichtigt die Gesellschaft von Amts wegen nach § 394 FamFG zu löschen. Die Frist zur Erhebung eines Widerspruchs ist auf einen Monat festgesetzt."
    },
    {
      "date": "2025-02-20",
      "id": "101869",
      "original_text": "Registerbekanntmachung nach dem Umwandlungsgesetz\nNordrhein-Westfalen Amtsgericht Aachen HRA 10290\nM. Schmitz Baustellenleitung und Transportdienstleistungen e. K. – Gangelt",
      "type": "Registerbekanntmachung nach dem Umwandlungsgesetz",
      "state": "Nordrhein-Westfalen",
      "amtsgericht": "Amtsgericht Aachen",
      "registernummer": "HRA 10290",
      "registerart": "HRA",
      "company_name": "M. Schmitz Baustellenleitung und Transportdienstleistungen e. K.",
      "company_seat": "Gangelt",
      "details": "20.02.2025 (Bekanntmachungsdatum)\n\nNordrhein-Westfalen Amtsgericht Aachen HRA 10290\nRegisterbekanntmachung nach dem Umwandlungsgesetz 20.02.2025 (Eintragungsdatum)\n\nM. Schmitz Baustellenleitung und Transportdienstleistungen e. K.\nEinzelkaufmann / Einzelkauffrau\nGangelt\n\nDen Gläubigern der an der Ausgliederung beteiligten Rechtsträger ist, wenn sie binnen sechs Monaten nach dem Tag, an dem die Eintragung der Ausgliederung in das Register des Sitzes desjenigen Rechtsträgers, dessen Gläubiger sie sind, nach § 19 Absatz 3 UmwG als bekanntgemacht gilt, ihren Anspruch nach Grund und Höhe schriftlich anmelden, Sicherheit zu leisten, soweit sie nicht Befriedigung verlangen können. Dieses Recht steht den Gläubigern jedoch nur zu, wenn sie glaubhaft machen, dass durch die Ausgliederung die Erfüllung ihrer Forderung gefährdet wird."
    },
    {
      "date": "2025-02-20",
      "id": "101870",
      "original_text": "Registerbekanntmachung nach dem Umwandlungsgesetz\nNordrhein-Westfalen Amtsgericht Siegen HRA 10024\nFKS Fachkraft Service und Beratung GmbH & Co. KG – Attendorn",
      "type": "Registerbekanntmachung nach dem Umwandlungsgesetz",
      "state": "Nordrhein-Westfalen",
      "amtsgericht": "Amtsgericht Siegen",
      "registernummer": "HRA 10024",
      "registerart": "HRA",
      "company_name": "FKS Fachkraft Service und Beratung GmbH & Co. KG",
      "company_seat": "Attendorn",
      "details": "20.02.2025 (Bekanntmachungsdatum)\n\nNordrhein-Westfalen Amtsgericht Siegen HRA 10024\nRegisterbekanntmachung nach dem Umwandlungsgesetz 20.02.2025 (Eintragungsdatum)\n\nFKS Fachkraft Service und Beratung GmbH & Co. KG\nKommanditgesellschaft\nAttendorn\n\nDen Gläubigern der an der formwechselnden Umwandlung beteiligten Rechtsträger ist, wenn sie binnen sechs Monaten nach dem Tag, an dem die Eintragung der formwechselnden Umwandlung in das Register des Sitzes desjenigen Rechtsträgers, dessen Gläubiger sie sind, nach § 19 Absatz 3 UmwG als bekanntgemacht gilt, ihren Anspruch nach Grund und Höhe schriftlich anmelden, Sicherheit zu leisten, soweit sie nicht Befriedigung verlangen können. Dieses Recht steht den Gläubigern jedoch nur zu, wenn sie glaubhaft machen, dass durch die formwechselnden Umwandlung die Erfüllung ihrer Forderung gefährdet wird."
    },
    {
      "date": "2025-02-20",
      "id": "101871",
      "original_text": "Registerbekanntmachung nach dem Umwandlungsgesetz\nNordrhein-Westfalen Amtsgericht Münster HRA 12057\nTH Thomas Heuser Bosenberg e. K. – Ahlen",
      "type": "Registerbekanntmachung nach dem Umwandlungsgesetz",
      "state": "Nordrhein-Westfalen",
      "amtsgericht": "Amtsgericht Münster",
      "registernummer": "HRA 12057",
      "registerart": "HRA",
      "company_name": "TH Thomas Heuser Bosenberg e. K.",
      "company_seat": "Ahlen",
      "details": "20.02.2025 (Bekanntmachungsdatum)\n\nNordrhein-Westfalen Amtsgericht Münster HRA 12057\nRegisterbekanntmachung nach dem Umwandlungsgesetz 20.02.2025 (Eintragungsdatum)\n\nTH Thomas Heuser Bosenberg e. K.\nEinzelkaufmann / Einzelkauffrau\nAhlen\n\nDen Gläubigern der an der Verschmelzung beteiligten Rechtsträger ist, wenn sie binnen sechs Monaten nach dem Tag, an dem die Eintragung der Verschmelzung in das Register des Sitzes desjenigen Rechtsträgers, dessen Gläubiger sie sind, nach § 19 Absatz 3 UmwG als bekanntgemacht gilt, ihren Anspruch nach Grund und Höhe schriftlich anmelden, Sicherheit zu leisten, soweit sie nicht Befriedigung verlangen können. Dieses Recht steht den Gläubigern jedoch nur zu, wenn sie glaubhaft machen, dass durch die Verschmelzung die Erfüllung ihrer Forderung gefährdet wird."
    },
    {
      "date": "2025-02-20",
      "id": "101872",
      "original_text": "Löschungsankündigung\nNordrhein-Westfalen Amtsgericht Dortmund HRB 31392\nGreen German Dream UG (haftungsbeschränkt) – Dortmund",
      "type": "Löschungsankündigung",
      "state": "Nordrhein-Westfalen",
      "amtsgericht": "Amtsgericht Dortmund",
      "registernummer": "HRB 31392",
      "registerart": "HRB",
      "company_name": "Green German Dream UG (haftungsbeschränkt)",
      "company_seat": "Dortmund",
      "details": "20.02.2025 (Bekanntmachungsdatum)\n\nNordrhein-Westfalen Amtsgericht Dortmund HRB 31392\nLöschungsankündigung 20.02.2025 (Eintragungsdatum)\n\nGreen German Dream UG (haftungsbeschränkt)\nGesellschaft mit beschränkter Haftung\nDortmund\n\nDas Registergericht beabsichtigt die Gesellschaft von Amts wegen nach § 394 FamFG zu löschen. Die Frist zur Erhebung eines Widerspruchs ist auf zwei Monate festgesetzt."
    },
    {
      "date": "2025-02-20",
      "id": "101873",
      "original_text": "Registerbekanntmachung nach dem Umwandlungsgesetz\nNordrhein-Westfalen Amtsgericht Bochum VR 5401\nSGV Ruhr, Abteilung im Sauerländischen Gebirgsverein e. V. – Bochum",
      "type": "Registerbekanntmachung nach dem Umwandlungsgesetz",
      "state": "Nordrhein-Westfalen",
      "amtsgericht": "Amtsgericht Bochum",
      "registernummer": "VR 5401",
      "registerart": "VR",
      "company_name": "SGV Ruhr, Abteilung im Sauerländischen Gebirgsverein e. V.",
      "company_seat": "Bochum",
      "details": "20.02.2025 (Bekanntmachungsdatum)\n\nNordrhein-Westfalen Amtsgericht Bochum VR 5401\nRegisterbekanntmachung nach dem Umwandlungsgesetz 17.02.2025 (Eintragungsdatum)\n\nSGV Ruhr, Abteilung im Sauerländischen Gebirgsverein e. V.\neingetragener Verein\nBochum\n\nDen Gläubigern der an der Verschmelzung beteiligten Rechtsträger ist, wenn sie binnen sechs Monaten nach dem Tag, an dem die Eintragung der Verschmelzung in das Register des Sitzes derjenigen Rechtsträger deren Gläubiger sie sind, nach § 19 Absatz 3 UmwG als bekanntgemacht gilt, ihren Anspruch nach Grund und Höhe schriftlich anmelden, Sicherheit zu leisten, soweit sie nicht Befriedigung verlangen können. Dieses Recht steht den Gläubigern jedoch nur zu, wenn sie glaubhaft machen, dass durch die Verschmelzung die Erfüllung ihrer Forderung gefährdet wird."
    },
    {
      "date": "2025-02-20",
      "id": "101874",
      "original_text": "Registerbekanntmachung nach dem Umwandlungsgesetz\nNordrhein-Westfalen Amtsgericht Aachen HRB 28369\nquip GmbH – Baesweiler",
      "type": "Registerbekanntmachung nach dem Umwandlungsgesetz",
      "state": "Nordrhein-Westfalen",
      "amtsgericht": "Amtsgericht Aachen",
      "registernummer": "HRB 28369",
      "registerart": "HRB",
      "company_name": "quip GmbH",
      "company_seat": "Baesweiler",
      "details": "20.02.2025 (Bekanntmachungsdatum)\n\nNordrhein-Westfalen Amtsgericht Aachen HRB 28369\nRegisterbekanntmachung nach dem Umwandlungsgesetz 20.02.2025 (Eintragungsdatum)\n\nquip GmbH\nGesellschaft mit beschränkter Haftung\nBaesweiler\n\nDen Gläubigern der an der Verschmelzung beteiligten Rechtsträger ist, wenn sie binnen sechs Monaten nach dem Tag, an dem die Eintragung der Verschmelzung in das Register des Sitzes derjenigen Rechtsträger deren Gläubiger sie sind, nach § 19 Absatz 3 UmwG als bekanntgemacht gilt, ihren Anspruch nach Grund und Höhe schriftlich anmelden, Sicherheit zu leisten, soweit sie nicht Befriedigung verlangen können. Dieses Recht steht den Gläubigern jedoch nur zu, wenn sie glaubhaft machen, dass durch die Verschmelzung die Erfüllung ihrer Forderung gefährdet wird."
    },
    {
      "date": "2025-02-20",
      "id": "101875",
      "original_text": "Einreichung neuer Dokumente\nNordrhein-Westfalen Amtsgericht Köln HRB 73915\nJoblinge gemeinnützige AG Rheinland – Köln",
      "type": "Einreichung neuer Dokumente",
      "state": "Nordrhein-Westfalen",
      "amtsgericht": "Amtsgericht Köln",
      "registernummer": "HRB 73915",
      "registerart": "HRB",
      "company_name": "Joblinge gemeinnützige AG Rheinland",
      "company_seat": "Köln",
      "details": "20.02.2025 (Bekanntmachungsdatum)\n\nNordrhein-Westfalen Amtsgericht Köln HRB 73915\nEinreichung neuer Dokumente\n\nJoblinge gemeinnützige AG Rheinland\nAktiengesellschaft\nKöln\n\nDem Registergericht ist eine Liste der Mitglieder des Aufsichtsrates eingereicht worden."
    },
    {
      "date": "2025-02-20",
      "id": "101876",
      "original_text": "Registerbekanntmachung nach dem Umwandlungsgesetz\nNordrhein-Westfalen Amtsgericht Siegen HRB 9165\nFKS Fachkraft Service und Beratung GmbH – Attendorn",
      "type": "Registerbekanntmachung nach dem Umwandlungsgesetz",
      "state": "Nordrhein-Westfalen",
      "amtsgericht": "Amtsgericht Siegen",
      "registernummer": "HRB 9165",
      "registerart": "HRB",
      "company_name": "FKS Fachkraft Service und Beratung GmbH",
      "company_seat": "Attendorn",
      "details": "20.02.2025 (Bekanntmachungsdatum)\n\nNordrhein-Westfalen Amtsgericht Siegen HRB 9165\nRegisterbekanntmachung nach dem Umwandlungsgesetz 20.02.2025 (Eintragungsdatum)\n\nFKS Fachkraft Service und Beratung GmbH\nGesellschaft mit beschränkter Haftung\nAttendorn\n\nDen Gläubigern der an der formwechselnden Umwandlung beteiligten Rechtsträger ist, wenn sie binnen sechs Monaten nach dem Tag, an dem die Eintragung der formwechselnden Umwandlung in das Register des Sitzes desjenigen Rechtsträgers, dessen Gläubiger sie sind, nach § 19 Absatz 3 UmwG als bekanntgemacht gilt, ihren Anspruch nach Grund und Höhe schriftlich anmelden, Sicherheit zu leisten, soweit sie nicht Befriedigung verlangen können. Dieses Recht steht den Gläubigern jedoch nur zu, wenn sie glaubhaft machen, dass durch die formwechselnden Umwandlung die Erfüllung ihrer Forderung gefährdet wird."
    },
    {
      "date": "2025-02-20",
      "id": "101877",
      "original_text": "Einreichung neuer Dokumente\nNordrhein-Westfalen Amtsgericht Neuss HRB 17169\nCulligan Deutschland GmbH – Neuss",
      "type": "Einreichung neuer Dokumente",
      "state": "Nordrhein-Westfalen",
      "amtsgericht": "Amtsgericht Neuss",
      "registernummer": "HRB 17169",
      "registerart": "HRB",
      "company_name": "Culligan Deutschland GmbH",
      "company_seat": "Neuss",
      "details": "20.02.2025 (Bekanntmachungsdatum)\n\nNordrhein-Westfalen Amtsgericht Neuss HRB 17169\nEinreichung neuer Dokumente 20.02.2025 (Eintragungsdatum)\n\nCulligan Deutschland GmbH\nGesellschaft mit beschränkter Haftung\nNeuss\n\nDem Registergericht ist eine Liste der Mitglieder des Aufsichtsrates eingereicht worden."
    },
    {
      "date": "2025-02-20",
      "id": "101878",
      "original_text": "Löschungsankündigung\nNordrhein-Westfalen Amtsgericht Dortmund HRB 23791\nCasino Lünen GmbH – Dortmund",
      "type": "Löschungsankündigung",
      "state": "Nordrhein-Westfalen",
      "amtsgericht": "Amtsgericht Dortmund",
      "registernummer": "HRB 23791",
      "registerart": "HRB",
      "company_name": "Casino Lünen GmbH",
      "company_seat": "Dortmund",
      "details": "20.02.2025 (Bekanntmachungsdatum)\n\nNordrhein-Westfalen Amtsgericht Dortmund HRB 23791\nLöschungsankündigung\n\nCasino Lünen GmbH\nGesellschaft mit beschränkter Haftung\nDortmund\n\nDas Registergericht beabsichtigt die Gesellschaft von Amts wegen nach § 394 FamFG zu löschen. Die Frist zur Erhebung eines Widerspruchs ist auf zwei Monate festgesetzt."
    },
    {
      "date": "2025-02-20",
      "id": "101879",
      "original_text": "Einreichung neuer Dokumente\nNordrhein-Westfalen Amtsgericht Köln HRB 79422\nconsurio AG – Frechen",
      "type": "Einreichung neuer Dokumente",
      "state": "Nordrhein-Westfalen",
      "amtsgericht": "Amtsgericht Köln",
      "registernummer": "HRB 79422",
      "registerart": "HRB",
      "company_name": "consurio AG",
      "company_seat": "Frechen",
      "details": "20.02.2025 (Bekanntmachungsdatum)\n\nNordrhein-Westfalen Amtsgericht Köln HRB 79422\nEinreichung neuer Dokumente\n\nconsurio AG\nAktiengesellschaft\nFrechen\n\nDem Registergericht ist eine Liste der Mitglieder des Aufsichtsrates eingereicht worden."
    },
    {
      "date": "2025-02-20",
      "id": "101880",
      "original_text": "Löschungsankündigung\nNordrhein-Westfalen Amtsgericht Düren HRB 7377\nSiRo GmbH – Titz",
      "type": "Löschungsankündigung",
      "state": "Nordrhein-Westfalen",
      "amtsgericht": "Amtsgericht Düren",
      "registernummer": "HRB 7377",
      "registerart": "HRB",
      "company_name": "SiRo GmbH",
      "company_seat": "Titz",
      "details": "20.02.2025 (Bekanntmachungsdatum)\n\nNordrhein-Westfalen Amtsgericht Düren HRB 7377\nLöschungsankündigung\n\nSiRo GmbH\nGesellschaft mit beschränkter Haftung\nTitz\n\nDas Registergericht beabsichtigt die Gesellschaft von Amts wegen nach § 394 FamFG zu löschen. Die Frist zur Erhebung eines Widerspruchs ist auf drei Monate festgesetzt."
    },
    {
      "date": "2025-02-20",
      "id": "101881",
      "original_text": "Registerbekanntmachung nach dem Umwandlungsgesetz\nNordrhein-Westfalen Amtsgericht Düsseldorf HRB 93779\nSG Spielstation 2 GmbH – Monheim am Rhein",
      "type": "Registerbekanntmachung nach dem Umwandlungsgesetz",
      "state": "Nordrhein-Westfalen",
      "amtsgericht": "Amtsgericht Düsseldorf",
      "registernummer": "HRB 93779",
      "registerart": "HRB",
      "company_name": "SG Spielstation 2 GmbH",
      "company_seat": "Monheim am Rhein",
      "details": "20.02.2025 (Bekanntmachungsdatum)\n\nNordrhein-Westfalen Amtsgericht Düsseldorf HRB 93779\nRegisterbekanntmachung nach dem Umwandlungsgesetz 20.02.2025 (Eintragungsdatum)\n\nSG Spielstation 2 GmbH\nGesellschaft mit beschränkter Haftung\nMonheim am Rhein\n\nDen Gläubigern der an der Verschmelzung beteiligten Rechtsträger ist, wenn sie binnen sechs Monaten nach dem Tag, an dem die Eintragung der Verschmelzung in das Register des Sitzes desjenigen Rechtsträgers, dessen Gläubiger sie sind, nach § 19 Absatz 3 UmwG als bekanntgemacht gilt, ihren Anspruch nach Grund und Höhe schriftlich anmelden, Sicherheit zu leisten, soweit sie nicht Befriedigung verlangen können. Dieses Recht steht den Gläubigern jedoch nur zu, wenn sie glaubhaft machen, dass durch die Verschmelzung die Erfüllung ihrer Forderung gefährdet wird."
    },
    {
      "date": "2025-02-20",
      "id": "101882",
      "original_text": "Sonstige Registerbekanntmachung\nNordrhein-Westfalen Amtsgericht Düsseldorf HRB 93779\nSG Spielstation 2 GmbH – Monheim am Rhein",
      "type": "Sonstige Registerbekanntmachung",
      "state": "Nordrhein-Westfalen",
      "amtsgericht": "Amtsgericht Düsseldorf",
      "registernummer": "HRB 93779",
      "registerart": "HRB",
      "company_name": "SG Spielstation 2 GmbH",
      "company_seat": "Monheim am Rhein",
      "details": "20.02.2025 (Bekanntmachungsdatum)\n\nNordrhein-Westfalen Amtsgericht Düsseldorf HRB 93779\nSonstige Registerbekanntmachung 20.02.2025 (Eintragungsdatum)\n\nSG Spielstation 2 GmbH\nGesellschaft mit beschränkter Haftung\nMonheim am Rhein\n\nAls nicht eingetragen wird veröffentlicht: Den Gläubigern der Gesellschaft, deren Forderungen begründet worden sind bevor die Eintragung der Beendigung des Gewinnabführungsvertrages  in das Handelsregister nach § 10 des Handelsgesetzbuches als bekanntgemacht gilt, hat der andere Vertragsteil Sicherheit zu leisten, wenn sie sich binnen sechs Monaten nach der Bekanntmachung der Eintragung zu diesem Zweck bei ihm melden."
    },
    {
      "date": "2025-02-20",
      "id": "101883",
      "original_text": "Registerbekanntmachung nach dem Umwandlungsgesetz\nNordrhein-Westfalen Amtsgericht Siegen HRB 14154\nEEW Offshore Wind Holding GmbH – Erndtebrück",
      "type": "Registerbekanntmachung nach dem Umwandlungsgesetz",
      "state": "Nordrhein-Westfalen",
      "amtsgericht": "Amtsgericht Siegen",
      "registernummer": "HRB 14154",
      "registerart": "HRB",
      "company_name": "EEW Offshore Wind Holding GmbH",
      "company_seat": "Erndtebrück",
      "details": "20.02.2025 (Bekanntmachungsdatum)\n\nNordrhein-Westfalen Amtsgericht Siegen HRB 14154\nRegisterbekanntmachung nach dem Umwandlungsgesetz 20.02.2025 (Eintragungsdatum)\n\nEEW Offshore Wind Holding GmbH\nGesellschaft mit beschränkter Haftung\nErndtebrück\n\nDen Gläubigern der an der formwechselnden Umwandlung beteiligten Rechtsträger ist, wenn sie binnen sechs Monaten nach dem Tag, an dem die Eintragung der formwechselnden Umwandlung in das Register des Sitzes desjenigen Rechtsträgers, dessen Gläubiger sie sind, nach § 19 Absatz 3 UmwG als bekanntgemacht gilt, ihren Anspruch nach Grund und Höhe schriftlich anmelden, Sicherheit zu leisten, soweit sie nicht Befriedigung verlangen können. Dieses Recht steht den Gläubigern jedoch nur zu, wenn sie glaubhaft machen, dass durch die formwechselnden Umwandlung die Erfüllung ihrer Forderung gefährdet wird."
    },
    {
      "date": "2025-02-20",
      "id": "101884",
      "original_text": "Registerbekanntmachung nach dem Umwandlungsgesetz\nThüringen Amtsgericht Jena HRA 504042\nReparatur- und Werkzeugschlosserei Behrendt e.K., Inhaber Roger Heinl – Kaltennordheim",
      "type": "Registerbekanntmachung nach dem Umwandlungsgesetz",
      "state": "Thüringen",
      "amtsgericht": "Amtsgericht Jena",
      "registernummer": "HRA 504042",
      "registerart": "HRA",
      "company_name": "Reparatur- und Werkzeugschlosserei Behrendt e.K., Inhaber Roger Heinl",
      "company_seat": "Kaltennordheim",
      "details": "20.02.2025 (Bekanntmachungsdatum)\n\nThüringen Amtsgericht Jena HRA 504042\nRegisterbekanntmachung nach dem Umwandlungsgesetz 20.02.2025 (Eintragungsdatum)\n\nReparatur- und Werkzeugschlosserei Behrendt e.K., Inhaber Roger Heinl\nEinzelkaufmann / Einzelkauffrau\nKaltennordheim\n\nTeile des von dem Einzelkaufmann Heinl, Roger, Ratingen, *13.12.1978  unter der Firma Reparatur- und Werkzeugschlosserei Behrendt e.K., Inhaber Roger Heinl mit dem Sitz in Kaltennordheim betriebene Unternehmens (gesamte Vermögen mit Ausnahme des Grundstücks) sind aus dem Vermögen gemäß Ausgliederungsvertrag vom 09.12.2024 auf die Heinl Metal Works GmbH & Co. KG mit dem Sitz in Kaltennordheim (Amtsgericht Jena HRA 506912) ausgegliedert; Tag der Eintragung: 20.02.2025\nNicht eingetragen: Den Gläubigern der an der Ausgliederung beteiligten Rechtsträger, ist wenn sie binnen sechs Monaten nach dem Tag, an dem die Eintragung der Ausgliederung in das Register des Sitzes desjenigen Rechtsträgers, dessen Gläubiger sie sind, nach §§125, 19 Abs. 3 UmwG als bekanntgemacht gilt, ihren Anspruch nach Grund und Höhe schriftlich anmelden, Sicherheit zu leisten, soweit sie nicht Befriedigung verlangen können. Dieses Recht steht ihnen jedoch nur zu, wenn sie glaubhaft machen, daß durch die Ausgliederung die Erfüllung ihrer Forderung gefährdet wird."
    },
    {
      "date": "2025-02-20",
      "id": "101885",
      "original_text": "Einreichung neuer Dokumente\nThüringen Amtsgericht Jena HRB 302776\nWohnungsbau GmbH der Stadt Schmalkalden – Schmalkalden",
      "type": "Einreichung neuer Dokumente",
      "state": "Thüringen",
      "amtsgericht": "Amtsgericht Jena",
      "registernummer": "HRB 302776",
      "registerart": "HRB",
      "company_name": "Wohnungsbau GmbH der Stadt Schmalkalden",
      "company_seat": "Schmalkalden",
      "details": "20.02.2025 (Bekanntmachungsdatum)\n\nThüringen Amtsgericht Jena HRB 302776\nEinreichung neuer Dokumente\n\nWohnungsbau GmbH der Stadt Schmalkalden\nGesellschaft mit beschränkter Haftung\nSchmalkalden\n\nBekanntmachung gem. § 52 Abs. 3 Satz 2 GmbHG: Aufgrund einer Veränderung in den Personen der Aufsichtsratsmitglieder ist durch die Geschäftsführer eine neue Liste zum Handelsregister eingereicht worden."
    },
    {
      "date": "2025-02-20",
      "id": "101886",
      "original_text": "Löschungsankündigung\nThüringen Amtsgericht Jena HRB 510545\nSHT Solarenergie Hessen Thüringen UG (haftungsbeschränkt) – Eisenach",
      "type": "Löschungsankündigung",
      "state": "Thüringen",
      "amtsgericht": "Amtsgericht Jena",
      "registernummer": "HRB 510545",
      "registerart": "HRB",
      "company_name": "SHT Solarenergie Hessen Thüringen UG (haftungsbeschränkt)",
      "company_seat": "Eisenach",
      "details": "20.02.2025 (Bekanntmachungsdatum)\n\nThüringen Amtsgericht Jena HRB 510545\nLöschungsankündigung\n\nSHT Solarenergie Hessen Thüringen UG (haftungsbeschränkt)\nGesellschaft mit beschränkter Haftung\nEisenach\n\nDas Registergericht beabsichtigt, die im Handelsregister eingetragene Gesellschaft wegen Vermögenslosigkeit nach § 394 FamFG von Amts wegen zu löschen. Die Frist zur Erhebung eines Widerspruchs gegen die beabsichtigte Löschung wird auf 6 Wochen festgesetzt."
    },
    {
      "date": "2025-02-20",
      "id": "101887",
      "original_text": "Einreichung neuer Dokumente\nThüringen Amtsgericht Jena HRB 306543\nBiomasse-Heizkraftwerk Ilmenau GmbH – Ilmenau",
      "type": "Einreichung neuer Dokumente",
      "state": "Thüringen",
      "amtsgericht": "Amtsgericht Jena",
      "registernummer": "HRB 306543",
      "registerart": "HRB",
      "company_name": "Biomasse-Heizkraftwerk Ilmenau GmbH",
      "company_seat": "Ilmenau",
      "details": "20.02.2025 (Bekanntmachungsdatum)\n\nThüringen Amtsgericht Jena HRB 306543\nEinreichung neuer Dokumente 20.02.2025 (Eintragungsdatum)\n\nBiomasse-Heizkraftwerk Ilmenau GmbH\nGesellschaft mit beschränkter Haftung\nIlmenau\n\nBekanntmachung gem. § 52 Abs. 3 Satz 2 GmbHG: Aufgrund einer Veränderung in den Personen der Aufsichtsratsmitglieder ist durch die Geschäftsführer eine neue Liste zum Handelsregister eingereicht worden."
    },
    {
      "date": "2025-02-20",
      "id": "101888",
      "original_text": "Sonstige Registerbekanntmachung\nThüringen Amtsgericht Jena HRB 505805\nSWE Bäder GmbH – Erfurt",
      "type": "Sonstige Registerbekanntmachung",
      "state": "Thüringen",
      "amtsgericht": "Amtsgericht Jena",
      "registernummer": "HRB 505805",
      "registerart": "HRB",
      "company_name": "SWE Bäder GmbH",
      "company_seat": "Erfurt",
      "details": "20.02.2025 (Bekanntmachungsdatum)\n\nThüringen Amtsgericht Jena HRB 505805\nSonstige Registerbekanntmachung\n\nSWE Bäder GmbH\nGesellschaft mit beschränkter Haftung\nErfurt\n\nBekanntmachung gem. § 52 Abs. 3 Satz 2 GmbHG: Aufgrund einer Veränderung in den Personen der Aufsichtsratsmitglieder ist durch die Geschäftsführer eine neue Liste zum Handelsregister eingereicht worden."
    },
    {
      "date": "2025-02-20",
      "id": "101889",
      "original_text": "Registerbekanntmachung nach dem Umwandlungsgesetz\nThüringen Amtsgericht Jena HRA 506912\nHeinl Metal Works GmbH & Co. KG – Kaltennordheim",
      "type": "Registerbekanntmachung nach dem Umwandlungsgesetz",
      "state": "Thüringen",
      "amtsgericht": "Amtsgericht Jena",
      "registernummer": "HRA 506912",
      "registerart": "HRA",
      "company_name": "Heinl Metal Works GmbH & Co. KG",
      "company_seat": "Kaltennordheim",
      "details": "20.02.2025 (Bekanntmachungsdatum)\n\nThüringen Amtsgericht Jena HRA 506912\nRegisterbekanntmachung nach dem Umwandlungsgesetz 20.02.2025 (Eintragungsdatum)\n\nHeinl Metal Works GmbH & Co. KG\nKommanditgesellschaft\nKaltennordheim\n\nDie Gesellschaft hat im Wege der Ausgliederung gemäß Ausgliederungsvertrag vom 09.12.2024 sowie Beschluss ihrer Gesellschafterversammlung vom 09.12.2024 Teile des Vermögens (gesamte Vermögen mit Ausnahme des Grundstücks) des einzelkaufmännischen Unternehmens Reparatur- und Werkzeugschlosserei Behrendt e.K., Inhaber Roger Heinl mit dem Sitz in Kaltennordheim (Amtsgericht Jena HRA 504042) übernommen.Die Ausgliederung ist mit der zeitgleichen Eintragung im Register des Sitzes des übertragenden Rechtsträgers wirksam geworden; Kommanditisten, Mitglieder:\nKommanditist/en:Haftsumme(n) erhöht: Heinl , Roger, Kaltennordheim, *13.12.1978  Haftsumme: 4.000,00 EUR; Tag der Eintragung:  Nicht eingetragen: Den Gläubigern der an der Ausgliederung beteiligten Rechtsträger, ist wenn sie binnen sechs Monaten nach dem Tag, an dem die Eintragung der Ausgliederung in das Register des Sitzes desjenigen Rechtsträgers, dessen Gläubiger sie sind, nach §§125, 19 Abs. 3 UmwG als bekanntgemacht gilt, ihren Anspruch nach Grund und Höhe schriftlich anmelden, Sicherheit zu leisten, soweit sie nicht Befriedigung verlangen können. Dieses Recht steht ihnen jedoch nur zu, wenn sie glaubhaft machen, daß durch die Ausgliederung die Erfüllung ihrer Forderung gefährdet wird.20.02.2025"
    },
    {
      "date": "2025-02-20",
      "id": "101890",
      "original_text": "Löschungsankündigung\nNordrhein-Westfalen Amtsgericht Köln HRB 109598\nRhein HB GmbH – Wesseling",
      "type": "Löschungsankündigung",
      "state": "Nordrhein-Westfalen",
      "amtsgericht": "Amtsgericht Köln",
      "registernummer": "HRB 109598",
      "registerart": "HRB",
      "company_name": "Rhein HB GmbH",
      "company_seat": "Wesseling",
      "details": "20.02.2025 (Bekanntmachungsdatum)\n\nNordrhein-Westfalen Amtsgericht Köln HRB 109598\nLöschungsankündigung\n\nRhein HB GmbH\nGesellschaft mit beschränkter Haftung\nWesseling\n\nDas Registergericht beabsichtigt die Gesellschaft von Amts wegen nach § 394 FamFG zu löschen. Die Frist zur Erhebung eines Widerspruchs ist auf einen Monat festgesetzt."
    },
    {
      "date": "2025-02-20",
      "id": "101891",
      "original_text": "Einreichung neuer Dokumente\nHessen Amtsgericht Darmstadt HRB 98705\nrevaluate AG – Dieburg",
      "type": "Einreichung neuer Dokumente",
      "state": "Hessen",
      "amtsgericht": "Amtsgericht Darmstadt",
      "registernummer": "HRB 98705",
      "registerart": "HRB",
      "company_name": "revaluate AG",
      "company_seat": "Dieburg",
      "details": "20.02.2025 (Bekanntmachungsdatum)\n\nHessen Amtsgericht Darmstadt HRB 98705\nEinreichung neuer Dokumente 20.02.2025 (Eintragungsdatum)\n\nrevaluate AG\nAktiengesellschaft\nDieburg\n\nDurch eine Änderung in den Personen der Aufsichtsratsmitglieder ist eine Liste der Mitglieder des Aufsichtsrates zum Handelsregister eingereicht worden."
    },
    {
      "date": "2025-02-20",
      "id": "101892",
      "original_text": "Registerbekanntmachung nach dem Umwandlungsgesetz\nHessen Amtsgericht Frankfurt am Main HRB 137789\nFinancial Liberty Consulting GmbH – Frankfurt am Main",
      "type": "Registerbekanntmachung nach dem Umwandlungsgesetz",
      "state": "Hessen",
      "amtsgericht": "Amtsgericht Frankfurt am Main",
      "registernummer": "HRB 137789",
      "registerart": "HRB",
      "company_name": "Financial Liberty Consulting GmbH",
      "company_seat": "Frankfurt am Main",
      "details": "20.02.2025 (Bekanntmachungsdatum)\n\nHessen Amtsgericht Frankfurt am Main HRB 137789\nRegisterbekanntmachung nach dem Umwandlungsgesetz 20.02.2025 (Eintragungsdatum)\n\nFinancial Liberty Consulting GmbH\nGesellschaft mit beschränkter Haftung\nFrankfurt am Main\n\nDen Gläubigern der an der formwechselnden Umwandlung beteiligten Rechtsträger ist, wenn sie binnen sechs Monaten nach dem Tag, an dem die Eintragung der formwechselnden Umwandlung in das Register des Sitzes desjenigen Rechtsträgers, dessen Gläubiger sie sind, nach § 201 UmwG bekannt gemacht worden ist, ihren Anspruch nach Grund und Höhe schriftlich anmelden, Sicherheit zu leisten, soweit sie nicht Befriedigung verlangen können. Dieses Recht steht den Gläubigern jedoch nur zu, wenn sie glaubhaft machen, dass durch die formwechselnden Umwandlung die Erfüllung ihrer Forderung gefährdet wird."
    },
    {
      "date": "2025-02-20",
      "id": "101893",
      "original_text": "Einreichung neuer Dokumente\nHessen Amtsgericht Frankfurt am Main HRB 103167\nyouvestor AG – Frankfurt am Main",
      "type": "Einreichung neuer Dokumente",
      "state": "Hessen",
      "amtsgericht": "Amtsgericht Frankfurt am Main",
      "registernummer": "HRB 103167",
      "registerart": "HRB",
      "company_name": "youvestor AG",
      "company_seat": "Frankfurt am Main",
      "details": "20.02.2025 (Bekanntmachungsdatum)\n\nHessen Amtsgericht Frankfurt am Main HRB 103167\nEinreichung neuer Dokumente 20.02.2025 (Eintragungsdatum)\n\nyouvestor AG\nAktiengesellschaft\nFrankfurt am Main\n\nDurch eine Änderung in den Personen der Aufsichtsratsmitglieder ist eine Liste der Mitglieder des Aufsichtsrates zum Handelsregister eingereicht worden."
    },
    {
      "date": "2025-02-20",
      "id": "101894",
      "original_text": "Registerbekanntmachung nach dem Umwandlungsgesetz\nHessen Amtsgericht Gießen HRB 2059\nDexion GmbH – Laubach",
      "type": "Registerbekanntmachung nach dem Umwandlungsgesetz",
      "state": "Hessen",
      "amtsgericht": "Amtsgericht Gießen",
      "registernummer": "HRB 2059",
      "registerart": "HRB",
      "company_name": "Dexion GmbH",
      "company_seat": "Laubach",
      "details": "20.02.2025 (Bekanntmachungsdatum)\n\nHessen Amtsgericht Gießen HRB 2059\nRegisterbekanntmachung nach dem Umwandlungsgesetz 20.02.2025 (Eintragungsdatum)\n\nDexion GmbH\nGesellschaft mit beschränkter Haftung\nLaubach\n\nDen Gläubigern der an der Verschmelzung beteiligten Rechtsträger ist, wenn sie binnen sechs Monaten nach dem Tag, an dem die Eintragung der Verschmelzung in das Register des Sitzes desjenigen Rechtsträgers, dessen Gläubiger sie sind, nach § 19 Absatz 3 UmwG bekannt gemacht worden ist, ihren Anspruch nach Grund und Höhe schriftlich anmelden, Sicherheit zu leisten, soweit sie nicht Befriedigung verlangen können. Dieses Recht steht den Gläubigern jedoch nur zu, wenn sie glaubhaft machen, dass durch die Verschmelzung die Erfüllung ihrer Forderung gefährdet wird."
    },
    {
      "date": "2025-02-20",
      "id": "101895",
      "original_text": "Registerbekanntmachung nach dem Umwandlungsgesetz\nHessen Amtsgericht Frankfurt am Main HRB 94408\nFinancial Liberty Consulting AG – Frankfurt am Main",
      "type": "Registerbekanntmachung nach dem Umwandlungsgesetz",
      "state": "Hessen",
      "amtsgericht": "Amtsgericht Frankfurt am Main",
      "registernummer": "HRB 94408",
      "registerart": "HRB",
      "company_name": "Financial Liberty Consulting AG",
      "company_seat": "Frankfurt am Main",
      "details": "20.02.2025 (Bekanntmachungsdatum)\n\nHessen Amtsgericht Frankfurt am Main HRB 94408\nRegisterbekanntmachung nach dem Umwandlungsgesetz 20.02.2025 (Eintragungsdatum)\n\nFinancial Liberty Consulting AG\nAktiengesellschaft\nFrankfurt am Main\n\nDen Gläubigern der an der formwechselnden Umwandlung beteiligten Rechtsträger ist, wenn sie binnen sechs Monaten nach dem Tag, an dem die Eintragung der formwechselnden Umwandlung in das Register des Sitzes desjenigen Rechtsträgers, dessen Gläubiger sie sind, nach § 201 UmwG bekannt gemacht worden ist, ihren Anspruch nach Grund und Höhe schriftlich anmelden, Sicherheit zu leisten, soweit sie nicht Befriedigung verlangen können. Dieses Recht steht den Gläubigern jedoch nur zu, wenn sie glaubhaft machen, dass durch die formwechselnden Umwandlung die Erfüllung ihrer Forderung gefährdet wird.."
    },
    {
      "date": "2025-02-20",
      "id": "101896",
      "original_text": "Einreichung neuer Dokumente\nHessen Amtsgericht Fulda HRB 6718\nCSS AG – Künzell",
      "type": "Einreichung neuer Dokumente",
      "state": "Hessen",
      "amtsgericht": "Amtsgericht Fulda",
      "registernummer": "HRB 6718",
      "registerart": "HRB",
      "company_name": "CSS AG",
      "company_seat": "Künzell",
      "details": "20.02.2025 (Bekanntmachungsdatum)\n\nHessen Amtsgericht Fulda HRB 6718\nEinreichung neuer Dokumente 20.02.2025 (Eintragungsdatum)\n\nCSS AG\nAktiengesellschaft\nKünzell\n\nDurch eine Änderung in den Personen der Aufsichtsratsmitglieder ist eine Liste der Mitglieder des Aufsichtsrates zum Handelsregister eingereicht worden."
    },
    {
      "date": "2025-02-20",
      "id": "101897",
      "original_text": "Löschungsankündigung\nHessen Amtsgericht Königstein HRB 10541\nGO Arena Hotel Zoo GmbH – Kronberg im Taunus",
      "type": "Löschungsankündigung",
      "state": "Hessen",
      "amtsgericht": "Amtsgericht Königstein",
      "registernummer": "HRB 10541",
      "registerart": "HRB",
      "company_name": "GO Arena Hotel Zoo GmbH",
      "company_seat": "Kronberg im Taunus",
      "details": "20.02.2025 (Bekanntmachungsdatum)\n\nHessen Amtsgericht Königstein HRB 10541\nLöschungsankündigung 20.02.2025 (Eintragungsdatum)\n\nGO Arena Hotel Zoo GmbH\nGesellschaft mit beschränkter Haftung\nKronberg im Taunus\n\nDas Registergericht beabsichtigt die im Handelsregister eingetragene Gesellschaft von Amts wegen nach § 394 FamFG zu löschen. Die Frist zur Erhebung eines Widerspruchs gegen die beabsichtigte Löschung wird auf 3 Monate festgesetzt."
    },
    {
      "date": "2025-02-20",
      "id": "101898",
      "original_text": "Registerbekanntmachung nach dem Umwandlungsgesetz\nHessen Amtsgericht Bad Homburg v.d.H. HRB 4501\nHaarstudio Suchy GmbH – Oberursel (Taunus)",
      "type": "Registerbekanntmachung nach dem Umwandlungsgesetz",
      "state": "Hessen",
      "amtsgericht": "Amtsgericht Bad Homburg v.d.H.",
      "registernummer": "HRB 4501",
      "registerart": "HRB",
      "company_name": "Haarstudio Suchy GmbH",
      "company_seat": "Oberursel (Taunus)",
      "details": "20.02.2025 (Bekanntmachungsdatum)\n\nHessen Amtsgericht Bad Homburg v.d.H. HRB 4501\nRegisterbekanntmachung nach dem Umwandlungsgesetz 20.02.2025 (Eintragungsdatum)\n\nHaarstudio Suchy GmbH\nGesellschaft mit beschränkter Haftung\nOberursel (Taunus)\n\nDen Gläubigern der an der Verschmelzung beteiligten Rechtsträger ist, wenn sie binnen sechs Monaten nach dem Tag, an dem die Eintragung der Verschmelzung in das Register des Sitzes desjenigen Rechtsträgers, dessen Gläubiger sie sind, nach § 19 Absatz 3 UmwG bekannt gemacht worden ist, ihren Anspruch nach Grund und Höhe schriftlich anmelden, Sicherheit zu leisten, soweit sie nicht Befriedigung verlangen können. Dieses Recht steht den Gläubigern jedoch nur zu, wenn sie glaubhaft machen, dass durch die Verschmelzung die Erfüllung ihrer Forderung gefährdet wird."
    },
    {
      "date": "2025-02-20",
      "id": "101899",
      "original_text": "Löschungsankündigung\nHessen Amtsgericht Frankfurt am Main HRB 93631\nClenergen Technology GmbH – Frankfurt am Main",
      "type": "Löschungsankündigung",
      "state": "Hessen",
      "amtsgericht": "Amtsgericht Frankfurt am Main",
      "registernummer": "HRB 93631",
      "registerart": "HRB",
      "company_name": "Clenergen Technology GmbH",
      "company_seat": "Frankfurt am Main",
      "details": "20.02.2025 (Bekanntmachungsdatum)\n\nHessen Amtsgericht Frankfurt am Main HRB 93631\nLöschungsankündigung\n\nClenergen Technology GmbH\nGesellschaft mit beschränkter Haftung\nFrankfurt am Main\n\nDas Registergericht beabsichtigt die im Handelsregister eingetragene Gesellschaft von Amts wegen nach § 394 FamFG zu löschen. Die Frist zur Erhebung eines Widerspruchs gegen die beabsichtigte Löschung wird auf 1 Monate festgesetzt."
    },
    {
      "date": "2025-02-20",
      "id": "101900",
      "original_text": "Einreichung neuer Dokumente\nHessen Amtsgericht Offenbach am Main HRB 57252\nONE Energy Solutions AG – Langen (Hessen)",
      "type": "Einreichung neuer Dokumente",
      "state": "Hessen",
      "amtsgericht": "Amtsgericht Offenbach am Main",
      "registernummer": "HRB 57252",
      "registerart": "HRB",
      "company_name": "ONE Energy Solutions AG",
      "company_seat": "Langen (Hessen)",
      "details": "20.02.2025 (Bekanntmachungsdatum)\n\nHessen Amtsgericht Offenbach am Main HRB 57252\nEinreichung neuer Dokumente\n\nONE Energy Solutions AG\nAktiengesellschaft\nLangen (Hessen)\n\nDurch eine Änderung in den Personen der Aufsichtsratsmitglieder ist eine Liste der Mitglieder des Aufsichtsrates zum Handelsregister eingereicht worden."
    },
    {
      "date": "2025-02-20",
      "id": "101901",
      "original_text": "Registerbekanntmachung nach dem Umwandlungsgesetz\nHessen Amtsgericht Frankfurt am Main HRA 54082\nCapital Land Asset GmbH & Co. KG – Frankfurt am Main",
      "type": "Registerbekanntmachung nach dem Umwandlungsgesetz",
      "state": "Hessen",
      "amtsgericht": "Amtsgericht Frankfurt am Main",
      "registernummer": "HRA 54082",
      "registerart": "HRA",
      "company_name": "Capital Land Asset GmbH & Co. KG",
      "company_seat": "Frankfurt am Main",
      "details": "20.02.2025 (Bekanntmachungsdatum)\n\nHessen Amtsgericht Frankfurt am Main HRA 54082\nRegisterbekanntmachung nach dem Umwandlungsgesetz 20.02.2025 (Eintragungsdatum)\n\nCapital Land Asset GmbH & Co. KG\nKommanditgesellschaft\nFrankfurt am Main\n\nDen Gläubigern der an der formwechselnden Umwandlung beteiligten Rechtsträger ist, wenn sie binnen sechs Monaten nach dem Tag, an dem die Eintragung der formwechselnden Umwandlung in das Register des Sitzes desjenigen Rechtsträgers, dessen Gläubiger sie sind, nach § 201 UmwG bekannt gemacht worden ist, ihren Anspruch nach Grund und Höhe schriftlich anmelden, Sicherheit zu leisten, soweit sie nicht Befriedigung verlangen können. Dieses Recht steht den Gläubigern jedoch nur zu, wenn sie glaubhaft machen, dass durch die formwechselnden Umwandlung die Erfüllung ihrer Forderung gefährdet wird."
    },
    {
      "date": "2025-02-20",
      "id": "101902",
      "original_text": "Löschungsankündigung\nHessen Amtsgericht Darmstadt HRA 22750\nVerkehrsgesellschaft Werner GmbH & Co. KG – Bensheim",
      "type": "Löschungsankündigung",
      "state": "Hessen",
      "amtsgericht": "Amtsgericht Darmstadt",
      "registernummer": "HRA 22750",
      "registerart": "HRA",
      "company_name": "Verkehrsgesellschaft Werner GmbH & Co. KG",
      "company_seat": "Bensheim",
      "details": "20.02.2025 (Bekanntmachungsdatum)\n\nHessen Amtsgericht Darmstadt HRA 22750\nLöschungsankündigung\n\nVerkehrsgesellschaft Werner GmbH & Co. KG\nKommanditgesellschaft\nBensheim\n\nDas Registergericht beabsichtigt die im Handelsregister eingetragene Firma von Amts wegen nach § 394 FamFG zu löschen. Die Frist zur Erhebung eines Widerspruchs gegen die beabsichtigte Löschung wird auf 3 Monate festgesetzt."
    },
    {
      "date": "2025-02-20",
      "id": "101903",
      "original_text": "Registerbekanntmachung nach dem Umwandlungsgesetz\nHessen Amtsgericht Frankfurt am Main HRB 127852\nCapital Land Asset GmbH – Frankfurt am Main",
      "type": "Registerbekanntmachung nach dem Umwandlungsgesetz",
      "state": "Hessen",
      "amtsgericht": "Amtsgericht Frankfurt am Main",
      "registernummer": "HRB 127852",
      "registerart": "HRB",
      "company_name": "Capital Land Asset GmbH",
      "company_seat": "Frankfurt am Main",
      "details": "20.02.2025 (Bekanntmachungsdatum)\n\nHessen Amtsgericht Frankfurt am Main HRB 127852\nRegisterbekanntmachung nach dem Umwandlungsgesetz 20.02.2025 (Eintragungsdatum)\n\nCapital Land Asset GmbH\nGesellschaft mit beschränkter Haftung\nFrankfurt am Main\n\nDen Gläubigern der an der formwechselnden Umwandlung beteiligten Rechtsträger ist, wenn sie binnen sechs Monaten nach dem Tag, an dem die Eintragung der formwechselnden Umwandlung in das Register des Sitzes desjenigen Rechtsträgers, dessen Gläubiger sie sind, nach § 201 UmwG bekannt gemacht worden ist, ihren Anspruch nach Grund und Höhe schriftlich anmelden, Sicherheit zu leisten, soweit sie nicht Befriedigung verlangen können. Dieses Recht steht den Gläubigern jedoch nur zu, wenn sie glaubhaft machen, dass durch die formwechselnden Umwandlung die Erfüllung ihrer Forderung gefährdet wird."
    },
    {
      "date": "2025-02-20",
      "id": "101904",
      "original_text": "Registerbekanntmachung nach dem Umwandlungsgesetz\nHessen Amtsgericht Offenbach am Main HRB 20651\nUllrich & Co. Verwaltungsgesellschaft mbH – Mainhausen",
      "type": "Registerbekanntmachung nach dem Umwandlungsgesetz",
      "state": "Hessen",
      "amtsgericht": "Amtsgericht Offenbach am Main",
      "registernummer": "HRB 20651",
      "registerart": "HRB",
      "company_name": "Ullrich & Co. Verwaltungsgesellschaft mbH",
      "company_seat": "Mainhausen",
      "details": "20.02.2025 (Bekanntmachungsdatum)\n\nHessen Amtsgericht Offenbach am Main HRB 20651\nRegisterbekanntmachung nach dem Umwandlungsgesetz 20.02.2025 (Eintragungsdatum)\n\nUllrich & Co. Verwaltungsgesellschaft mbH\nGesellschaft mit beschränkter Haftung\nMainhausen\n\nDen Gläubigern der an der Verschmelzung beteiligten Rechtsträger ist, wenn sie binnen sechs Monaten nach dem Tag, an dem die Eintragung der Verschmelzung in das Register des Sitzes desjenigen Rechtsträgers, dessen Gläubiger sie sind, nach § 19 Absatz 3 UmwG bekannt gemacht worden ist, ihren Anspruch nach Grund und Höhe schriftlich anmelden, Sicherheit zu leisten, soweit sie nicht Befriedigung verlangen können. Dieses Recht steht den Gläubigern jedoch nur zu, wenn sie glaubhaft machen, dass durch die Verschmelzung die Erfüllung ihrer Forderung gefährdet wird."
    },
    {
      "date": "2025-02-20",
      "id": "101905",
      "original_text": "Sonstige Registerbekanntmachung\nHessen Amtsgericht Frankfurt am Main VR 16742\nTokonoma e.V. – Frankfurt am Main",
      "type": "Sonstige Registerbekanntmachung",
      "state": "Hessen",
      "amtsgericht": "Amtsgericht Frankfurt am Main",
      "registernummer": "VR 16742",
      "registerart": "VR",
      "company_name": "Tokonoma e.V.",
      "company_seat": "Frankfurt am Main",
      "details": "20.02.2025 (Bekanntmachungsdatum)\n\nHessen Amtsgericht Frankfurt am Main VR 16742\nSonstige Registerbekanntmachung 20.02.2025 (Eintragungsdatum)\n\nTokonoma e.V.\neingetragener Verein\nFrankfurt am Main\n\nDer Verein ist aufgelöst."
    },
    {
      "date": "2025-02-20",
      "id": "101906",
      "original_text": "Löschungsankündigung\nHessen Amtsgericht Darmstadt HRB 103082\nIP-IT GmbH – Lorsch",
      "type": "Löschungsankündigung",
      "state": "Hessen",
      "amtsgericht": "Amtsgericht Darmstadt",
      "registernummer": "HRB 103082",
      "registerart": "HRB",
      "company_name": "IP-IT GmbH",
      "company_seat": "Lorsch",
      "details": "20.02.2025 (Bekanntmachungsdatum)\n\nHessen Amtsgericht Darmstadt HRB 103082\nLöschungsankündigung 19.02.2025 (Eintragungsdatum)\n\nIP-IT GmbH\nGesellschaft mit beschränkter Haftung\nLorsch\n\nDas Registergericht beabsichtigt die im Handelsregister eingetragene Gesellschaft von Amts wegen nach § 394 FamFG zu löschen. Die Frist zur Erhebung eines Widerspruchs gegen die beabsichtigte Löschung wird auf 3 Monate festgesetzt."
    }
  ]
}