{
  "date": "2025-02-19",
  "date_of_scrape": "2025-02-20T04:08:47.951Z",
  "tool_version": "0.2.0",
  "number_of_announcements": 123,
  "announcements": [
    {
      "date": "2025-02-19",
      "id": "101648",
      "original_text": "Einreichung neuer Dokumente\nBayern Amtsgericht Traunstein HRB 21026\nmh-four AG – Bad Reichenhall",
      "type": "Einreichung neuer Dokumente",
      "state": "Bayern",
      "amtsgericht": "Amtsgericht Traunstein",
      "registernummer": "HRB 21026",
      "registerart": "HRB",
      "company_name": "mh-four AG",
      "company_seat": "Bad Reichenhall",
      "details": "19.02.2025 (Bekanntmachungsdatum)\n\nBayern Amtsgericht Traunstein HRB 21026\nEinreichung neuer Dokumente 18.02.2025 (Eintragungsdatum)\n\nmh-four AG\nAktiengesellschaft\nBad Reichenhall\n\nDem Amtsgericht Traunstein -Registergericht- ist eine Liste der Mitglieder des Aufsichtsrats eingereicht worden, § 106 AktG."
    },
    {
      "date": "2025-02-19",
      "id": "101649",
      "original_text": "Sonstige Registerbekanntmachung\nBayern Amtsgericht Landshut HRB 3635\nGDS Gesellschaft für Datenverarbeitungssysteme & -support mbH – Landshut",
      "type": "Sonstige Registerbekanntmachung",
      "state": "Bayern",
      "amtsgericht": "Amtsgericht Landshut",
      "registernummer": "HRB 3635",
      "registerart": "HRB",
      "company_name": "GDS Gesellschaft für Datenverarbeitungssysteme & -support mbH",
      "company_seat": "Landshut",
      "details": "19.02.2025 (Bekanntmachungsdatum)\n\nBayern Amtsgericht Landshut HRB 3635\nSonstige Registerbekanntmachung 18.02.2025 (Eintragungsdatum)\n\nGDS Gesellschaft für Datenverarbeitungssysteme & -support mbH\nGesellschaft mit beschränkter Haftung\nLandshut\n\nDen Gläubigern der Gesellschaft, deren Forderungen begründet worden sind, bevor die Eintragung der Beendigung des #DV.art(Text=\"Bitte Art des Vertrages auswählen\",Eingabe=\n\"Beherrschungs- und Gewinnabführungsvertrages\",\n\"Beherrschungsvertrages\",\n\"Gewinnabführungsvertrages\",\n\"Teilgewinnabführungsvertrages\") in das Handelsregister nach § 10 des Handelsgesetzbuches als bekanntgemacht gilt, hat der andere Vertragsteil Sicherheit zu leisten, wenn sie sich binnen sechs Monaten nach der Bekanntmachung der Eintragung zu diesem Zweck bei ihm melden."
    },
    {
      "date": "2025-02-19",
      "id": "101650",
      "original_text": "Registerbekanntmachung nach dem Umwandlungsgesetz\nBayern Amtsgericht München HRB 278000\nMonaco Grund GmbH – München",
      "type": "Registerbekanntmachung nach dem Umwandlungsgesetz",
      "state": "Bayern",
      "amtsgericht": "Amtsgericht München",
      "registernummer": "HRB 278000",
      "registerart": "HRB",
      "company_name": "Monaco Grund GmbH",
      "company_seat": "München",
      "details": "19.02.2025 (Bekanntmachungsdatum)\n\nBayern Amtsgericht München HRB 278000\nRegisterbekanntmachung nach dem Umwandlungsgesetz 18.02.2025 (Eintragungsdatum)\n\nMonaco Grund GmbH\nGesellschaft mit beschränkter Haftung\nMünchen\n\nDen Gläubigern der an der Verschmelzung beteiligten Rechtsträger ist, wenn sie binnen sechs Monaten nach dem Tag, an dem die Eintragung der Verschmelzung in das Register des Sitzes desjenigen Rechtsträgers, dessen Gläubiger sie sind, nach § 19 Abs. 3 UmwG als bekannt gemacht gilt, ihren Anspruch nach Grund und Höhe in Textform anmelden, Sicherheit zu leisten, soweit sie nicht Befriedigung verlangen können. Dieses Recht steht den Gläubigern jedoch nur zu, wenn sie glaubhaft machen, dass durch die Verschmelzung die Erfüllung ihrer Forderung gefährdet wird."
    },
    {
      "date": "2025-02-19",
      "id": "101651",
      "original_text": "Registerbekanntmachung nach dem Umwandlungsgesetz\nBayern Amtsgericht München HRB 185287\nCisco Systems Holding GmbH – Garching b. München",
      "type": "Registerbekanntmachung nach dem Umwandlungsgesetz",
      "state": "Bayern",
      "amtsgericht": "Amtsgericht München",
      "registernummer": "HRB 185287",
      "registerart": "HRB",
      "company_name": "Cisco Systems Holding GmbH",
      "company_seat": "Garching b. München",
      "details": "19.02.2025 (Bekanntmachungsdatum)\n\nBayern Amtsgericht München HRB 185287\nRegisterbekanntmachung nach dem Umwandlungsgesetz 18.02.2025 (Eintragungsdatum)\n\nCisco Systems Holding GmbH\nGesellschaft mit beschränkter Haftung\nGarching b. München\n\nDen Gläubigern der an der Verschmelzung beteiligten Rechtsträger ist, wenn sie binnen sechs Monaten nach dem Tag, an dem die Eintragung der Verschmelzung in das Register des Sitzes desjenigen Rechtsträgers, dessen Gläubiger sie sind, nach § 19 Abs. 3 UmwG als bekannt gemacht gilt, ihren Anspruch nach Grund und Höhe in Textform anmelden, Sicherheit zu leisten, soweit sie nicht Befriedigung verlangen können. Dieses Recht steht den Gläubigern jedoch nur zu, wenn sie glaubhaft machen, dass durch die Verschmelzung die Erfüllung ihrer Forderung gefährdet wird."
    },
    {
      "date": "2025-02-19",
      "id": "101652",
      "original_text": "Registerbekanntmachung nach dem Umwandlungsgesetz\nBayern Amtsgericht München HRB 291383\nA1A Beteiligungen GmbH – München",
      "type": "Registerbekanntmachung nach dem Umwandlungsgesetz",
      "state": "Bayern",
      "amtsgericht": "Amtsgericht München",
      "registernummer": "HRB 291383",
      "registerart": "HRB",
      "company_name": "A1A Beteiligungen GmbH",
      "company_seat": "München",
      "details": "19.02.2025 (Bekanntmachungsdatum)\n\nBayern Amtsgericht München HRB 291383\nRegisterbekanntmachung nach dem Umwandlungsgesetz 18.02.2025 (Eintragungsdatum)\n\nA1A Beteiligungen GmbH\nGesellschaft mit beschränkter Haftung\nMünchen\n\nDen Gläubigern der an der Verschmelzung beteiligten Rechtsträger ist, wenn sie binnen sechs Monaten nach dem Tag, an dem die Eintragung der Verschmelzung in das Register des Sitzes desjenigen Rechtsträgers, dessen Gläubiger sie sind, nach § 19 Abs. 3 UmwG als bekannt gemacht gilt, ihren Anspruch nach Grund und Höhe in Textform anmelden, Sicherheit zu leisten, soweit sie nicht Befriedigung verlangen können. Dieses Recht steht den Gläubigern jedoch nur zu, wenn sie glaubhaft machen, dass durch die Verschmelzung die Erfüllung ihrer Forderung gefährdet wird."
    },
    {
      "date": "2025-02-19",
      "id": "101653",
      "original_text": "Registerbekanntmachung nach dem Umwandlungsgesetz\nBayern Amtsgericht Kempten (Allgäu) HRB 8310\nm & i möbel und ideen gmbH – Durach",
      "type": "Registerbekanntmachung nach dem Umwandlungsgesetz",
      "state": "Bayern",
      "amtsgericht": "Amtsgericht Kempten (Allgäu)",
      "registernummer": "HRB 8310",
      "registerart": "HRB",
      "company_name": "m & i möbel und ideen gmbH",
      "company_seat": "Durach",
      "details": "19.02.2025 (Bekanntmachungsdatum)\n\nBayern Amtsgericht Kempten (Allgäu) HRB 8310\nRegisterbekanntmachung nach dem Umwandlungsgesetz 18.02.2025 (Eintragungsdatum)\n\nm & i möbel und ideen gmbH\nGesellschaft mit beschränkter Haftung\nDurach\n\nDen Gläubigern der an der Verschmelzung beteiligten Rechtsträger ist, wenn sie binnen sechs Monaten nach dem Tag, an dem die Eintragung der Verschmelzung in das Register des Sitzes desjenigen Rechtsträgers, dessen Gläubiger sie sind, nach § 19 Abs. 3 UmwG als bekannt gemacht gilt, ihren Anspruch nach Grund und Höhe in Textform anmelden, Sicherheit zu leisten, soweit sie nicht Befriedigung verlangen können. Dieses Recht steht den Gläubigern jedoch nur zu, wenn sie glaubhaft machen, dass durch die Verschmelzung die Erfüllung ihrer Forderung gefährdet wird."
    },
    {
      "date": "2025-02-19",
      "id": "101654",
      "original_text": "Registerbekanntmachung nach dem Umwandlungsgesetz\nBayern Amtsgericht München HRB 254894\nL & F Management GmbH – Markt Schwaben",
      "type": "Registerbekanntmachung nach dem Umwandlungsgesetz",
      "state": "Bayern",
      "amtsgericht": "Amtsgericht München",
      "registernummer": "HRB 254894",
      "registerart": "HRB",
      "company_name": "L & F Management GmbH",
      "company_seat": "Markt Schwaben",
      "details": "19.02.2025 (Bekanntmachungsdatum)\n\nBayern Amtsgericht München HRB 254894\nRegisterbekanntmachung nach dem Umwandlungsgesetz 18.02.2025 (Eintragungsdatum)\n\nL & F Management GmbH\nGesellschaft mit beschränkter Haftung\nMarkt Schwaben\n\nDen Gläubigern der an der Verschmelzung beteiligten Rechtsträger ist, wenn sie binnen sechs Monaten nach dem Tag, an dem die Eintragung der Verschmelzung in das Register des Sitzes desjenigen Rechtsträgers, dessen Gläubiger sie sind, nach § 19 Abs. 3 UmwG als bekannt gemacht gilt, ihren Anspruch nach Grund und Höhe in Textform anmelden, Sicherheit zu leisten, soweit sie nicht Befriedigung verlangen können. Dieses Recht steht den Gläubigern jedoch nur zu, wenn sie glaubhaft machen, dass durch die Verschmelzung die Erfüllung ihrer Forderung gefährdet wird."
    },
    {
      "date": "2025-02-19",
      "id": "101655",
      "original_text": "Registerbekanntmachung nach dem Umwandlungsgesetz\nBayern Amtsgericht Fürth HRB 16007\nNordkanal 46 Projekt GmbH – Erlangen",
      "type": "Registerbekanntmachung nach dem Umwandlungsgesetz",
      "state": "Bayern",
      "amtsgericht": "Amtsgericht Fürth",
      "registernummer": "HRB 16007",
      "registerart": "HRB",
      "company_name": "Nordkanal 46 Projekt GmbH",
      "company_seat": "Erlangen",
      "details": "19.02.2025 (Bekanntmachungsdatum)\n\nBayern Amtsgericht Fürth HRB 16007\nRegisterbekanntmachung nach dem Umwandlungsgesetz 18.02.2025 (Eintragungsdatum)\n\nNordkanal 46 Projekt GmbH\nGesellschaft mit beschränkter Haftung\nErlangen\n\nDen Gläubigern der an der Verschmelzung beteiligten Rechtsträger ist, wenn sie binnen sechs Monaten nach dem Tag, an dem die Eintragung der Verschmelzung in das Register des Sitzes desjenigen Rechtsträgers, dessen Gläubiger sie sind, nach § 19 Abs. 3 UmwG als bekannt gemacht gilt, ihren Anspruch nach Grund und Höhe in Textform anmelden, Sicherheit zu leisten, soweit sie nicht Befriedigung verlangen können. Dieses Recht steht den Gläubigern jedoch nur zu, wenn sie glaubhaft machen, dass durch die Verschmelzung die Erfüllung ihrer Forderung gefährdet wird."
    },
    {
      "date": "2025-02-19",
      "id": "101656",
      "original_text": "Löschungsankündigung\nBayern Amtsgericht Bayreuth HRB 5703\nWalter Bau Ahorntal GmbH – Ahorntal",
      "type": "Löschungsankündigung",
      "state": "Bayern",
      "amtsgericht": "Amtsgericht Bayreuth",
      "registernummer": "HRB 5703",
      "registerart": "HRB",
      "company_name": "Walter Bau Ahorntal GmbH",
      "company_seat": "Ahorntal",
      "details": "19.02.2025 (Bekanntmachungsdatum)\n\nBayern Amtsgericht Bayreuth HRB 5703\nLöschungsankündigung\n\nWalter Bau Ahorntal GmbH\nGesellschaft mit beschränkter Haftung\nAhorntal\n\nDas Registergericht beabsichtigt, die im Handelsregister eingetragene Gesellschaft wegen Vermögenslosigkeit von Amts wegen nach § 394 FamFG zu löschen. Die Frist zur Erhebung eines Widerspruchs ist auf einen Monat festgesetzt."
    },
    {
      "date": "2025-02-19",
      "id": "101657",
      "original_text": "Löschungsankündigung\nBayern Amtsgericht München HRB 248890\nTerum Asset Management AG – München",
      "type": "Löschungsankündigung",
      "state": "Bayern",
      "amtsgericht": "Amtsgericht München",
      "registernummer": "HRB 248890",
      "registerart": "HRB",
      "company_name": "Terum Asset Management AG",
      "company_seat": "München",
      "details": "19.02.2025 (Bekanntmachungsdatum)\n\nBayern Amtsgericht München HRB 248890\nLöschungsankündigung\n\nTerum Asset Management AG\nAktiengesellschaft\nMünchen\n\nDas Registergericht beabsichtigt, die im Handelsregister eingetragene Gesellschaft wegen Vermögenslosigkeit von Amts wegen nach § 394 FamFG zu löschen. Die Frist zur Erhebung eines Widerspruchs ist auf drei Monate festgesetzt."
    },
    {
      "date": "2025-02-19",
      "id": "101658",
      "original_text": "Löschungsankündigung\nBayern Amtsgericht Augsburg HRB 28637\nNaTeK Verwaltung UG (haftungsbeschränkt) – Graben",
      "type": "Löschungsankündigung",
      "state": "Bayern",
      "amtsgericht": "Amtsgericht Augsburg",
      "registernummer": "HRB 28637",
      "registerart": "HRB",
      "company_name": "NaTeK Verwaltung UG (haftungsbeschränkt)",
      "company_seat": "Graben",
      "details": "19.02.2025 (Bekanntmachungsdatum)\n\nBayern Amtsgericht Augsburg HRB 28637\nLöschungsankündigung 13.02.2025 (Eintragungsdatum)\n\nNaTeK Verwaltung UG (haftungsbeschränkt)\nGesellschaft mit beschränkter Haftung\nGraben"
    },
    {
      "date": "2025-02-19",
      "id": "101659",
      "original_text": "Löschungsankündigung\nBayern Amtsgericht Schweinfurt HRA 9899\nOmega Trading & Service UG (haftungsbeschränkt) & Co. KG – Kolitzheim OT Stammheim",
      "type": "Löschungsankündigung",
      "state": "Bayern",
      "amtsgericht": "Amtsgericht Schweinfurt",
      "registernummer": "HRA 9899",
      "registerart": "HRA",
      "company_name": "Omega Trading & Service UG (haftungsbeschränkt) & Co. KG",
      "company_seat": "Kolitzheim OT Stammheim",
      "details": "19.02.2025 (Bekanntmachungsdatum)\n\nBayern Amtsgericht Schweinfurt HRA 9899\nLöschungsankündigung\n\nOmega Trading & Service UG (haftungsbeschränkt) & Co. KG\nKommanditgesellschaft\nKolitzheim OT Stammheim\n\nDas Registergericht beabsichtigt, die im Handelsregister eingetragene Firma wegen Vermögenslosigkeit von Amts wegen nach § 394 FamFG zu löschen. Die Frist zur Erhebung eines Widerspruchs ist auf einen Monat festgesetzt."
    },
    {
      "date": "2025-02-19",
      "id": "101660",
      "original_text": "Registerbekanntmachung nach dem Umwandlungsgesetz\nBayern Amtsgericht Fürth HRB 766\nBrandstätter GmbH – Zirndorf",
      "type": "Registerbekanntmachung nach dem Umwandlungsgesetz",
      "state": "Bayern",
      "amtsgericht": "Amtsgericht Fürth",
      "registernummer": "HRB 766",
      "registerart": "HRB",
      "company_name": "Brandstätter GmbH",
      "company_seat": "Zirndorf",
      "details": "19.02.2025 (Bekanntmachungsdatum)\n\nBayern Amtsgericht Fürth HRB 766\nRegisterbekanntmachung nach dem Umwandlungsgesetz 18.02.2025 (Eintragungsdatum)\n\nBrandstätter GmbH\nGesellschaft mit beschränkter Haftung\nZirndorf\n\nDen Gläubigern der an der Verschmelzung beteiligten Rechtsträger ist, wenn sie binnen sechs Monaten nach dem Tag, an dem die Eintragung der Verschmelzung in das Register des Sitzes desjenigen Rechtsträgers, dessen Gläubiger sie sind, nach § 19 Abs. 3 UmwG als bekannt gemacht gilt, ihren Anspruch nach Grund und Höhe in Textform anmelden, Sicherheit zu leisten, soweit sie nicht Befriedigung verlangen können. Dieses Recht steht den Gläubigern jedoch nur zu, wenn sie glaubhaft machen, dass durch die Verschmelzung die Erfüllung ihrer Forderung gefährdet wird."
    },
    {
      "date": "2025-02-19",
      "id": "101661",
      "original_text": "Einreichung neuer Dokumente\nBayern Amtsgericht Traunstein HRB 31779\nadvastore SE – Unterwössen",
      "type": "Einreichung neuer Dokumente",
      "state": "Bayern",
      "amtsgericht": "Amtsgericht Traunstein",
      "registernummer": "HRB 31779",
      "registerart": "HRB",
      "company_name": "advastore SE",
      "company_seat": "Unterwössen",
      "details": "19.02.2025 (Bekanntmachungsdatum)\n\nBayern Amtsgericht Traunstein HRB 31779\nEinreichung neuer Dokumente 18.02.2025 (Eintragungsdatum)\n\nadvastore SE\nEuropäische Aktiengesellschaft (SE)\nUnterwössen\n\nDem Amtsgericht Traunstein -Registergericht- ist eine Liste der Mitglieder des Aufsichtsrats eingereicht worden, Art. 9 Abs. 1 Buchst. c (ii) SE-VO i.V.m. § 106 AktG."
    },
    {
      "date": "2025-02-19",
      "id": "101662",
      "original_text": "Registerbekanntmachung nach dem Umwandlungsgesetz\nBayern Amtsgericht Fürth HRA 2190\ngeobra Brandstätter Stiftung & Co. KG. – Zirndorf",
      "type": "Registerbekanntmachung nach dem Umwandlungsgesetz",
      "state": "Bayern",
      "amtsgericht": "Amtsgericht Fürth",
      "registernummer": "HRA 2190",
      "registerart": "HRA",
      "company_name": "geobra Brandstätter Stiftung & Co. KG.",
      "company_seat": "Zirndorf",
      "details": "19.02.2025 (Bekanntmachungsdatum)\n\nBayern Amtsgericht Fürth HRA 2190\nRegisterbekanntmachung nach dem Umwandlungsgesetz 18.02.2025 (Eintragungsdatum)\n\ngeobra Brandstätter Stiftung & Co. KG.\nKommanditgesellschaft\nZirndorf\n\nDen Gläubigern der an der Verschmelzung beteiligten Rechtsträger ist, wenn sie binnen sechs Monaten nach dem Tag, an dem die Eintragung der Verschmelzung in das Register des Sitzes desjenigen Rechtsträgers, dessen Gläubiger sie sind, nach § 19 Abs. 3 UmwG als bekannt gemacht gilt, ihren Anspruch nach Grund und Höhe in Textform anmelden, Sicherheit zu leisten, soweit sie nicht Befriedigung verlangen können. Dieses Recht steht den Gläubigern jedoch nur zu, wenn sie glaubhaft machen, dass durch die Verschmelzung die Erfüllung ihrer Forderung gefährdet wird."
    },
    {
      "date": "2025-02-19",
      "id": "101663",
      "original_text": "Registerbekanntmachung nach dem Umwandlungsgesetz\nBayern Amtsgericht Fürth HRB 11142\nGBI Projektbeteiligung GmbH – Erlangen",
      "type": "Registerbekanntmachung nach dem Umwandlungsgesetz",
      "state": "Bayern",
      "amtsgericht": "Amtsgericht Fürth",
      "registernummer": "HRB 11142",
      "registerart": "HRB",
      "company_name": "GBI Projektbeteiligung GmbH",
      "company_seat": "Erlangen",
      "details": "19.02.2025 (Bekanntmachungsdatum)\n\nBayern Amtsgericht Fürth HRB 11142\nRegisterbekanntmachung nach dem Umwandlungsgesetz 18.02.2025 (Eintragungsdatum)\n\nGBI Projektbeteiligung GmbH\nGesellschaft mit beschränkter Haftung\nErlangen\n\nDen Gläubigern der an der Verschmelzung beteiligten Rechtsträger ist, wenn sie binnen sechs Monaten nach dem Tag, an dem die Eintragung der Verschmelzung in das Register des Sitzes desjenigen Rechtsträgers, dessen Gläubiger sie sind, nach § 19 Abs. 3 UmwG als bekannt gemacht gilt, ihren Anspruch nach Grund und Höhe in Textform anmelden, Sicherheit zu leisten, soweit sie nicht Befriedigung verlangen können. Dieses Recht steht den Gläubigern jedoch nur zu, wenn sie glaubhaft machen, dass durch die Verschmelzung die Erfüllung ihrer Forderung gefährdet wird."
    },
    {
      "date": "2025-02-19",
      "id": "101664",
      "original_text": "Löschungsankündigung\nBayern Amtsgericht München HRB 287568\nMatterhorn Digital UG (haftungsbeschränkt) – München",
      "type": "Löschungsankündigung",
      "state": "Bayern",
      "amtsgericht": "Amtsgericht München",
      "registernummer": "HRB 287568",
      "registerart": "HRB",
      "company_name": "Matterhorn Digital UG (haftungsbeschränkt)",
      "company_seat": "München",
      "details": "19.02.2025 (Bekanntmachungsdatum)\n\nBayern Amtsgericht München HRB 287568\nLöschungsankündigung\n\nMatterhorn Digital UG (haftungsbeschränkt)\nGesellschaft mit beschränkter Haftung\nMünchen\n\nDas Registergericht beabsichtigt, die im Handelsregister eingetragene Gesellschaft wegen Vermögenslosigkeit von Amts wegen nach § 394 FamFG zu löschen. Die Frist zur Erhebung eines Widerspruchs ist auf drei Monate festgesetzt."
    },
    {
      "date": "2025-02-19",
      "id": "101665",
      "original_text": "Einreichung neuer Dokumente\nBaden-Württemberg Amtsgericht Stuttgart HRB 767002\nRoto Frank Fenster- und Türtechnologie GmbH – Leinfelden-Echterdingen",
      "type": "Einreichung neuer Dokumente",
      "state": "Baden-Württemberg",
      "amtsgericht": "Amtsgericht Stuttgart",
      "registernummer": "HRB 767002",
      "registerart": "HRB",
      "company_name": "Roto Frank Fenster- und Türtechnologie GmbH",
      "company_seat": "Leinfelden-Echterdingen",
      "details": "19.02.2025 (Bekanntmachungsdatum)\n\nBaden-Württemberg Amtsgericht Stuttgart HRB 767002\nEinreichung neuer Dokumente\n\nRoto Frank Fenster- und Türtechnologie GmbH\nGesellschaft mit beschränkter Haftung\nLeinfelden-Echterdingen\n\nDie Gesellschaft hat am 17.02.2025 die Liste über die Zusammensetzung des Aufsichtsrats zum Handelsregister eingereicht."
    },
    {
      "date": "2025-02-19",
      "id": "101666",
      "original_text": "Löschungsankündigung\nMecklenburg-Vorpommern Amtsgericht Stralsund HRB 7762\nAKB Montage- und Personaldienst GmbH – Greifswald",
      "type": "Löschungsankündigung",
      "state": "Mecklenburg-Vorpommern",
      "amtsgericht": "Amtsgericht Stralsund",
      "registernummer": "HRB 7762",
      "registerart": "HRB",
      "company_name": "AKB Montage- und Personaldienst GmbH",
      "company_seat": "Greifswald",
      "details": "19.02.2025 (Bekanntmachungsdatum)\n\nMecklenburg-Vorpommern Amtsgericht Stralsund HRB 7762\nLöschungsankündigung\n\nAKB Montage- und Personaldienst GmbH\nGesellschaft mit beschränkter Haftung\nGreifswald\n\nDas Registergericht beabsichtigt, die Firma von Amts wegen nach § 394 FamFG zu löschen. Die Frist zur Erhebung eines Widerspruchs ist auf 1 Monat festgesetzt."
    },
    {
      "date": "2025-02-19",
      "id": "101667",
      "original_text": "Sonstige Registerbekanntmachung\nBaden-Württemberg Amtsgericht Ulm HRB 510515\nNetCom BW GmbH – Ellwangen Jagst",
      "type": "Sonstige Registerbekanntmachung",
      "state": "Baden-Württemberg",
      "amtsgericht": "Amtsgericht Ulm",
      "registernummer": "HRB 510515",
      "registerart": "HRB",
      "company_name": "NetCom BW GmbH",
      "company_seat": "Ellwangen Jagst",
      "details": "19.02.2025 (Bekanntmachungsdatum)\n\nBaden-Württemberg Amtsgericht Ulm HRB 510515\nSonstige Registerbekanntmachung 19.02.2025 (Eintragungsdatum)\n\nNetCom BW GmbH\nGesellschaft mit beschränkter Haftung\nEllwangen Jagst\n\nDie Gesellschaft hat am 29.01.2025 die Liste über die Zusammensetzung des Aufsichtsrats zum Handelsregister eingereicht."
    },
    {
      "date": "2025-02-19",
      "id": "101668",
      "original_text": "Registerbekanntmachung nach dem Umwandlungsgesetz\nBaden-Württemberg Amtsgericht Stuttgart HRB 742385\nPGS Wohngruppen GmbH – Herrenberg",
      "type": "Registerbekanntmachung nach dem Umwandlungsgesetz",
      "state": "Baden-Württemberg",
      "amtsgericht": "Amtsgericht Stuttgart",
      "registernummer": "HRB 742385",
      "registerart": "HRB",
      "company_name": "PGS Wohngruppen GmbH",
      "company_seat": "Herrenberg",
      "details": "19.02.2025 (Bekanntmachungsdatum)\n\nBaden-Württemberg Amtsgericht Stuttgart HRB 742385\nRegisterbekanntmachung nach dem Umwandlungsgesetz 19.02.2025 (Eintragungsdatum)\n\nPGS Wohngruppen GmbH\nGesellschaft mit beschränkter Haftung\nHerrenberg\n\nAls nicht eingetragen wird bekanntgemacht:\nDen Gläubigern der an der Verschmelzung beteiligten Rechtsträger ist, wenn sie binnen sechs Monaten nach dem Tag, an dem die Eintragung der Verschmelzung in das Register des Sitzes desjenigen Rechtsträgers, dessen Gläubiger sie sind, nach § 19 Abs. 3 UmwG als bekanntgemacht gilt, ihren Anspruch nach Grund und Höhe schriftlich anmelden, Sicherheit zu leisten, soweit sie nicht Befriedigung verlangen können. Dieses Recht steht den Gläubigern jedoch nur zu, wenn sie glaubhaft machen, dass durch die Verschmelzung die Erfüllung ihrer Forderung gefährdet wird."
    },
    {
      "date": "2025-02-19",
      "id": "101669",
      "original_text": "Löschungsankündigung\nBrandenburg Amtsgericht Potsdam HRB 5790\nKleinmachnower Grundstückssanierungsgesellschaft mbH – Kleinmachnow",
      "type": "Löschungsankündigung",
      "state": "Brandenburg",
      "amtsgericht": "Amtsgericht Potsdam",
      "registernummer": "HRB 5790",
      "registerart": "HRB",
      "company_name": "Kleinmachnower Grundstückssanierungsgesellschaft mbH",
      "company_seat": "Kleinmachnow",
      "details": "19.02.2025 (Bekanntmachungsdatum)\n\nBrandenburg Amtsgericht Potsdam HRB 5790\nLöschungsankündigung\n\nKleinmachnower Grundstückssanierungsgesellschaft mbH\nGesellschaft mit beschränkter Haftung\nKleinmachnow\n\nBei der nachstehenden Gesellschaft wird das Amtslöschungsverfahren gemäß § 394 FamFG eingeleitet. Widerspruchsfrist: 8 Wochen."
    },
    {
      "date": "2025-02-19",
      "id": "101670",
      "original_text": "Registerbekanntmachung nach dem Umwandlungsgesetz\nBaden-Württemberg Amtsgericht Freiburg GsR 663\nVermögensverwaltung Eschle eGbR – Gengenbach",
      "type": "Registerbekanntmachung nach dem Umwandlungsgesetz",
      "state": "Baden-Württemberg",
      "amtsgericht": "Amtsgericht Freiburg",
      "registernummer": "GsR 663",
      "registerart": "GsR",
      "company_name": "Vermögensverwaltung Eschle eGbR",
      "company_seat": "Gengenbach",
      "details": "19.02.2025 (Bekanntmachungsdatum)\n\nBaden-Württemberg Amtsgericht Freiburg GsR 663\nRegisterbekanntmachung nach dem Umwandlungsgesetz 19.02.2025 (Eintragungsdatum)\n\nVermögensverwaltung Eschle eGbR\nGesellschaft bürgerlichen Rechts\nGengenbach\n\nAls nicht eingetragen wird bekanntgemacht:\nDen Gläubigern des an dem Formwechsel beteiligten Rechtsträgers ist, wenn sie binnen sechs Monaten nach dem Tag, an dem die Eintragung des Formwechsels in das Register des Sitzes desjenigen Rechtsträgers, dessen Gläubiger sie sind, nach § 19 Abs. 3 UmwG als bekanntgemacht gilt, ihren Anspruch nach Grund und Höhe schriftlich anmelden, Sicherheit zu leisten, soweit sie nicht Befriedigung verlangen können. Dieses Recht steht den Gläubigern jedoch nur zu, wenn sie glaubhaft machen, dass durch den Formwechsel die Erfüllung ihrer Forderung gefährdet wird."
    },
    {
      "date": "2025-02-19",
      "id": "101671",
      "original_text": "Registerbekanntmachung nach dem Umwandlungsgesetz\nBaden-Württemberg Amtsgericht Stuttgart HRB 390348\nSomfy GmbH – Rottenburg am Neckar",
      "type": "Registerbekanntmachung nach dem Umwandlungsgesetz",
      "state": "Baden-Württemberg",
      "amtsgericht": "Amtsgericht Stuttgart",
      "registernummer": "HRB 390348",
      "registerart": "HRB",
      "company_name": "Somfy GmbH",
      "company_seat": "Rottenburg am Neckar",
      "details": "19.02.2025 (Bekanntmachungsdatum)\n\nBaden-Württemberg Amtsgericht Stuttgart HRB 390348\nRegisterbekanntmachung nach dem Umwandlungsgesetz 19.02.2025 (Eintragungsdatum)\n\nSomfy GmbH\nGesellschaft mit beschränkter Haftung\nRottenburg am Neckar\n\nAls nicht eingetragen wird bekanntgemacht:\nDen Gläubigern der an der Verschmelzung beteiligten Rechtsträger ist, wenn sie binnen sechs Monaten nach dem Tag, an dem die Eintragung der Verschmelzung in das Register des Sitzes desjenigen Rechtsträgers, dessen Gläubiger sie sind, nach § 19 Abs. 3 UmwG als bekanntgemacht gilt, ihren Anspruch nach Grund und Höhe schriftlich anmelden, Sicherheit zu leisten, soweit sie nicht Befriedigung verlangen können. Dieses Recht steht den Gläubigern jedoch nur zu, wenn sie glaubhaft machen, dass durch die Verschmelzung die Erfüllung ihrer Forderung gefährdet wird."
    },
    {
      "date": "2025-02-19",
      "id": "101672",
      "original_text": "Sonstige Registerbekanntmachung\nSaarland Amtsgericht Saarbrücken HRB 102314\nPflegedienst Nicole GmbH – Homburg",
      "type": "Sonstige Registerbekanntmachung",
      "state": "Saarland",
      "amtsgericht": "Amtsgericht Saarbrücken",
      "registernummer": "HRB 102314",
      "registerart": "HRB",
      "company_name": "Pflegedienst Nicole GmbH",
      "company_seat": "Homburg",
      "details": "19.02.2025 (Bekanntmachungsdatum)\n\nSaarland Amtsgericht Saarbrücken HRB 102314\nSonstige Registerbekanntmachung 19.02.2025 (Eintragungsdatum)\n\nPflegedienst Nicole GmbH\nGesellschaft mit beschränkter Haftung\nHomburg\n\nDen Gläubigern der Gesellschaft, deren Forderungen begründet worden sind, bevor die Eintragung der Beendigung des Vertrags in das Handelsregister nach § 10 des Handelsgesetzbuches als bekanntgemacht gilt, hat der andere Vertragsteil Sicherheit zu leisten, wenn sie sich binnen sechs Monaten nach der Bekanntmachung der Eintragung zu diesem Zweck bei ihm melden."
    },
    {
      "date": "2025-02-19",
      "id": "101673",
      "original_text": "Einreichung neuer Dokumente\nSchleswig-Holstein Amtsgericht Kiel HRB 17777\nSchleswig-Holsteinisches Landestheater und Sinfonieorchester GmbH – Rendsburg",
      "type": "Einreichung neuer Dokumente",
      "state": "Schleswig-Holstein",
      "amtsgericht": "Amtsgericht Kiel",
      "registernummer": "HRB 17777",
      "registerart": "HRB",
      "company_name": "Schleswig-Holsteinisches Landestheater und Sinfonieorchester GmbH",
      "company_seat": "Rendsburg",
      "details": "19.02.2025 (Bekanntmachungsdatum)\n\nSchleswig-Holstein Amtsgericht Kiel HRB 17777\nEinreichung neuer Dokumente\n\nSchleswig-Holsteinisches Landestheater und Sinfonieorchester GmbH\nGesellschaft mit beschränkter Haftung\nRendsburg\n\nAls nicht eingetragen wird veröffentlicht: Eine neue Liste der Aufsichtsratsmitglieder ist eingereicht worden."
    },
    {
      "date": "2025-02-19",
      "id": "101674",
      "original_text": "Einreichung neuer Dokumente\nBrandenburg Amtsgericht Cottbus HRB 9380\nFlughafen Berlin Brandenburg GmbH – Schönefeld",
      "type": "Einreichung neuer Dokumente",
      "state": "Brandenburg",
      "amtsgericht": "Amtsgericht Cottbus",
      "registernummer": "HRB 9380",
      "registerart": "HRB",
      "company_name": "Flughafen Berlin Brandenburg GmbH",
      "company_seat": "Schönefeld",
      "details": "19.02.2025 (Bekanntmachungsdatum)\n\nBrandenburg Amtsgericht Cottbus HRB 9380\nEinreichung neuer Dokumente\n\nFlughafen Berlin Brandenburg GmbH\nGesellschaft mit beschränkter Haftung\nSchönefeld\n\nAls nicht eingetragen wird veröffentlicht: Die Geschäftsführer haben eine Liste der Aufsichtsratsmitglieder gem. § 52 Abs. 2 Satz 2 GmbHG zum Handelsregister eingereicht."
    },
    {
      "date": "2025-02-19",
      "id": "101675",
      "original_text": "Registerbekanntmachung nach dem Umwandlungsgesetz\nSachsen-Anhalt Amtsgericht Stendal GnR 200\nAgrar-Erzeugergemeinschaft Abbendorf eG – Diesdorf",
      "type": "Registerbekanntmachung nach dem Umwandlungsgesetz",
      "state": "Sachsen-Anhalt",
      "amtsgericht": "Amtsgericht Stendal",
      "registernummer": "GnR 200",
      "registerart": "GnR",
      "company_name": "Agrar-Erzeugergemeinschaft Abbendorf eG",
      "company_seat": "Diesdorf",
      "details": "19.02.2025 (Bekanntmachungsdatum)\n\nSachsen-Anhalt Amtsgericht Stendal GnR 200\nRegisterbekanntmachung nach dem Umwandlungsgesetz 19.02.2025 (Eintragungsdatum)\n\nAgrar-Erzeugergemeinschaft Abbendorf eG\neingetragene Genossenschaft\nDiesdorf\n\nAls nicht eingetragen wird veröffentlicht:\n\nDen Gläubigern der Genossenschaft ist, wenn sie sich binnen 6 Monaten nach der Bekanntmachung bei der Genossenschaft zu diesem Zweck melden, Sicherheit zu leisten, soweit sie nicht Befriedigung verlangen können (§ 22 Abs. 1 bis 3 GenG)."
    },
    {
      "date": "2025-02-19",
      "id": "101676",
      "original_text": "Einreichung neuer Dokumente\nBaden-Württemberg Amtsgericht Stuttgart HRB 743447\nEVM Energieversorgung Michelfeld GmbH – Michelfeld",
      "type": "Einreichung neuer Dokumente",
      "state": "Baden-Württemberg",
      "amtsgericht": "Amtsgericht Stuttgart",
      "registernummer": "HRB 743447",
      "registerart": "HRB",
      "company_name": "EVM Energieversorgung Michelfeld GmbH",
      "company_seat": "Michelfeld",
      "details": "19.02.2025 (Bekanntmachungsdatum)\n\nBaden-Württemberg Amtsgericht Stuttgart HRB 743447\nEinreichung neuer Dokumente\n\nEVM Energieversorgung Michelfeld GmbH\nGesellschaft mit beschränkter Haftung\nMichelfeld\n\nDie Gesellschaft hat am 18.02.2025 die Liste über die Zusammensetzung des Aufsichtsrats zum Handelsregister eingereicht."
    },
    {
      "date": "2025-02-19",
      "id": "101677",
      "original_text": "Löschungsankündigung\nSchleswig-Holstein Amtsgericht Pinneberg HRA 8114\nJens Appel Technische Bauelemente e.K. – Elmshorn",
      "type": "Löschungsankündigung",
      "state": "Schleswig-Holstein",
      "amtsgericht": "Amtsgericht Pinneberg",
      "registernummer": "HRA 8114",
      "registerart": "HRA",
      "company_name": "Jens Appel Technische Bauelemente e.K.",
      "company_seat": "Elmshorn",
      "details": "19.02.2025 (Bekanntmachungsdatum)\n\nSchleswig-Holstein Amtsgericht Pinneberg HRA 8114\nLöschungsankündigung\n\nJens Appel Technische Bauelemente e.K.\nEinzelkaufmann / Einzelkauffrau\nElmshorn\n\nBei der nachstehenden Firma wird das Amtslöschungsverfahren gemäß § 31 Abs. 2 HGB eingeleitet. Widerspruchsfrist: 2 Monate."
    },
    {
      "date": "2025-02-19",
      "id": "101678",
      "original_text": "Registerbekanntmachung nach dem Umwandlungsgesetz\nBaden-Württemberg Amtsgericht Stuttgart VR 724806\nJRE Origins e.V. – Neuhausen auf den Fildern",
      "type": "Registerbekanntmachung nach dem Umwandlungsgesetz",
      "state": "Baden-Württemberg",
      "amtsgericht": "Amtsgericht Stuttgart",
      "registernummer": "VR 724806",
      "registerart": "VR",
      "company_name": "JRE Origins e.V.",
      "company_seat": "Neuhausen auf den Fildern",
      "details": "19.02.2025 (Bekanntmachungsdatum)\n\nBaden-Württemberg Amtsgericht Stuttgart VR 724806\nRegisterbekanntmachung nach dem Umwandlungsgesetz 19.02.2025 (Eintragungsdatum)\n\nJRE Origins e.V.\neingetragener Verein\nNeuhausen auf den Fildern\n\nDen Gläubigern der an der Verschmelzung beteiligten Rechtsträger ist, wenn sie binnen sechs Monaten nach dem Tag, an dem die Eintragung der Verschmelzung in das Register des Sitzes desjenigen Rechtsträgers, dessen Gläubiger sie sind, nach § 19 Abs. 3 UmwG als bekanntgemacht gilt, ihren Anspruch nach Grund und Höhe schriftlich anmelden, Sicherheit zu leisten, soweit sie nicht Befriedigung verlangen können. Dieses Recht steht den Gläubigern jedoch nur zu, wenn sie glaubhaft machen, dass durch die Verschmelzung die Erfüllung ihrer Forderung gefährdet wird."
    },
    {
      "date": "2025-02-19",
      "id": "101679",
      "original_text": "Löschungsankündigung\nBaden-Württemberg Amtsgericht Stuttgart HRB 775645\nDie Bestatter UG (haftungsbeschränkt) – Backnang",
      "type": "Löschungsankündigung",
      "state": "Baden-Württemberg",
      "amtsgericht": "Amtsgericht Stuttgart",
      "registernummer": "HRB 775645",
      "registerart": "HRB",
      "company_name": "Die Bestatter UG (haftungsbeschränkt)",
      "company_seat": "Backnang",
      "details": "19.02.2025 (Bekanntmachungsdatum)\n\nBaden-Württemberg Amtsgericht Stuttgart HRB 775645\nLöschungsankündigung 19.02.2025 (Eintragungsdatum)\n\nDie Bestatter UG (haftungsbeschränkt)\nGesellschaft mit beschränkter Haftung\nBacknang\n\nAls nicht eingetragen wird bekanntgemacht:\nDas Gericht beabsichtigt, die Gesellschaft wegen Vermögenslosigkeit im Handelsregister von Amts wegen nach § 394 FamFG zu löschen. Die Frist zur Geltendmachung eines Widerspruchs gegen die beabsichtigte Löschung ist auf zwei Monate ab Veröffentlichung bestimmt."
    },
    {
      "date": "2025-02-19",
      "id": "101680",
      "original_text": "Löschungsankündigung\nBerlin Amtsgericht Berlin (Charlottenburg) HRB 124068\nJeppy - Akustik- und Trockenbau Unternehmergesellschaft (haftungsbeschränkt) – Berlin",
      "type": "Löschungsankündigung",
      "state": "Berlin",
      "amtsgericht": "Amtsgericht Berlin (Charlottenburg)",
      "registernummer": "HRB 124068",
      "registerart": "HRB",
      "company_name": "Jeppy - Akustik- und Trockenbau Unternehmergesellschaft (haftungsbeschränkt)",
      "company_seat": "Berlin",
      "details": "19.02.2025 (Bekanntmachungsdatum)\n\nBerlin Amtsgericht Berlin (Charlottenburg) HRB 124068\nLöschungsankündigung\n\nJeppy - Akustik- und Trockenbau Unternehmergesellschaft (haftungsbeschränkt)\nGesellschaft mit beschränkter Haftung\nBerlin\n\nBei der nachstehenden Gesellschaft wird das Amtslöschungsverfahren gemäß § 394 FamFG eingeleitet. Widerspruchsfrist 6 Wochen"
    },
    {
      "date": "2025-02-19",
      "id": "101681",
      "original_text": "Registerbekanntmachung nach dem Umwandlungsgesetz\nBaden-Württemberg Amtsgericht Stuttgart HRB 798584\nPhysio Blankenhagen GmbH – Schorndorf",
      "type": "Registerbekanntmachung nach dem Umwandlungsgesetz",
      "state": "Baden-Württemberg",
      "amtsgericht": "Amtsgericht Stuttgart",
      "registernummer": "HRB 798584",
      "registerart": "HRB",
      "company_name": "Physio Blankenhagen GmbH",
      "company_seat": "Schorndorf",
      "details": "19.02.2025 (Bekanntmachungsdatum)\n\nBaden-Württemberg Amtsgericht Stuttgart HRB 798584\nRegisterbekanntmachung nach dem Umwandlungsgesetz 19.02.2025 (Eintragungsdatum)\n\nPhysio Blankenhagen GmbH\nGesellschaft mit beschränkter Haftung\nSchorndorf\n\nDen Gläubigern des an dem Formwechsel beteiligten Rechtsträgers ist, wenn sie binnen sechs Monaten nach dem Tag, an dem die Eintragung des Formwechsels in das Register des Sitzes desjenigen Rechtsträgers, dessen Gläubiger sie sind, nach § 19 Abs. 3 UmwG als bekanntgemacht gilt, ihren Anspruch nach Grund und Höhe schriftlich anmelden, Sicherheit zu leisten, soweit sie nicht Befriedigung verlangen können. Dieses Recht steht den Gläubigern jedoch nur zu, wenn sie glaubhaft machen, dass durch den Formwechsel die Erfüllung ihrer Forderung gefährdet wird."
    },
    {
      "date": "2025-02-19",
      "id": "101682",
      "original_text": "Registerbekanntmachung nach dem Umwandlungsgesetz\nBaden-Württemberg Amtsgericht Stuttgart PR 721128\nPhysio Blankenhagen Part mbB – Schorndorf",
      "type": "Registerbekanntmachung nach dem Umwandlungsgesetz",
      "state": "Baden-Württemberg",
      "amtsgericht": "Amtsgericht Stuttgart",
      "registernummer": "PR 721128",
      "registerart": "PR",
      "company_name": "Physio Blankenhagen Part mbB",
      "company_seat": "Schorndorf",
      "details": "19.02.2025 (Bekanntmachungsdatum)\n\nBaden-Württemberg Amtsgericht Stuttgart PR 721128\nRegisterbekanntmachung nach dem Umwandlungsgesetz 19.02.2025 (Eintragungsdatum)\n\nPhysio Blankenhagen Part mbB\nPartnerschaftsgesellschaft\nSchorndorf\n\nDen Gläubigern des an dem Formwechsel beteiligten Rechtsträgers ist, wenn sie binnen sechs Monaten nach dem Tag, an dem die Eintragung des Formwechsels in das Register des Sitzes desjenigen Rechtsträgers, dessen Gläubiger sie sind, nach § 19 Abs. 3 UmwG als bekanntgemacht gilt, ihren Anspruch nach Grund und Höhe schriftlich anmelden, Sicherheit zu leisten, soweit sie nicht Befriedigung verlangen können. Dieses Recht steht den Gläubigern jedoch nur zu, wenn sie glaubhaft machen, dass durch den Formwechsel die Erfüllung ihrer Forderung gefährdet wird."
    },
    {
      "date": "2025-02-19",
      "id": "101683",
      "original_text": "Einreichung neuer Dokumente\nHamburg Amtsgericht Hamburg HRB 89606\nArkwright Consulting AG – Hamburg",
      "type": "Einreichung neuer Dokumente",
      "state": "Hamburg",
      "amtsgericht": "Amtsgericht Hamburg",
      "registernummer": "HRB 89606",
      "registerart": "HRB",
      "company_name": "Arkwright Consulting AG",
      "company_seat": "Hamburg",
      "details": "19.02.2025 (Bekanntmachungsdatum)\n\nHamburg Amtsgericht Hamburg HRB 89606\nEinreichung neuer Dokumente 19.02.2025 (Eintragungsdatum)\n\nArkwright Consulting AG\nAktiengesellschaft\nHamburg\n\nAls nicht eingetragen wird bekannt gemacht: Liste des Aufsichtsrats wurde eingereicht."
    },
    {
      "date": "2025-02-19",
      "id": "101684",
      "original_text": "Löschungsankündigung\nSchleswig-Holstein Amtsgericht Kiel HRB 16862\nOrient fresh NMS GmbH – Neumünster",
      "type": "Löschungsankündigung",
      "state": "Schleswig-Holstein",
      "amtsgericht": "Amtsgericht Kiel",
      "registernummer": "HRB 16862",
      "registerart": "HRB",
      "company_name": "Orient fresh NMS GmbH",
      "company_seat": "Neumünster",
      "details": "19.02.2025 (Bekanntmachungsdatum)\n\nSchleswig-Holstein Amtsgericht Kiel HRB 16862\nLöschungsankündigung\n\nOrient fresh NMS GmbH\nGesellschaft mit beschränkter Haftung\nNeumünster\n\nEs ist die Löschung der nachstehenden Gesellschaft wegen Vermögenslosigkeit gemäß § 394 FamFG beabsichtigt. Widerspruchsfrist: 2 Monate."
    },
    {
      "date": "2025-02-19",
      "id": "101685",
      "original_text": "Einreichung neuer Dokumente\nBaden-Württemberg Amtsgericht Stuttgart HRB 10814\nHafen Stuttgart Gesellschaft mit beschränkter Haftung – Stuttgart",
      "type": "Einreichung neuer Dokumente",
      "state": "Baden-Württemberg",
      "amtsgericht": "Amtsgericht Stuttgart",
      "registernummer": "HRB 10814",
      "registerart": "HRB",
      "company_name": "Hafen Stuttgart Gesellschaft mit beschränkter Haftung",
      "company_seat": "Stuttgart",
      "details": "19.02.2025 (Bekanntmachungsdatum)\n\nBaden-Württemberg Amtsgericht Stuttgart HRB 10814\nEinreichung neuer Dokumente\n\nHafen Stuttgart Gesellschaft mit beschränkter Haftung\nGesellschaft mit beschränkter Haftung\nStuttgart\n\nDie Gesellschaft hat am 18.02.2025 die Liste über die Zusammensetzung des Aufsichtsrats zum Handelsregister eingereicht."
    },
    {
      "date": "2025-02-19",
      "id": "101686",
      "original_text": "Einreichung neuer Dokumente\nThüringen Amtsgericht Jena HRB 106080\nSWE Energie GmbH – Erfurt",
      "type": "Einreichung neuer Dokumente",
      "state": "Thüringen",
      "amtsgericht": "Amtsgericht Jena",
      "registernummer": "HRB 106080",
      "registerart": "HRB",
      "company_name": "SWE Energie GmbH",
      "company_seat": "Erfurt",
      "details": "19.02.2025 (Bekanntmachungsdatum)\n\nThüringen Amtsgericht Jena HRB 106080\nEinreichung neuer Dokumente\n\nSWE Energie GmbH\nGesellschaft mit beschränkter Haftung\nErfurt\n\nBekanntmachung gem. § 52 Abs. 3 Satz 2 GmbHG: Aufgrund einer Veränderung in den Personen der Aufsichtsratsmitglieder ist durch die Geschäftsführer eine neue Liste zum Handelsregister eingereicht worden."
    },
    {
      "date": "2025-02-19",
      "id": "101687",
      "original_text": "Löschungsankündigung\nBerlin Amtsgericht Berlin (Charlottenburg) HRA 51542\nWinterfeldt39 Gaststätten GmbH & Co. KG – Berlin",
      "type": "Löschungsankündigung",
      "state": "Berlin",
      "amtsgericht": "Amtsgericht Berlin (Charlottenburg)",
      "registernummer": "HRA 51542",
      "registerart": "HRA",
      "company_name": "Winterfeldt39 Gaststätten GmbH & Co. KG",
      "company_seat": "Berlin",
      "details": "19.02.2025 (Bekanntmachungsdatum)\n\nBerlin Amtsgericht Berlin (Charlottenburg) HRA 51542\nLöschungsankündigung\n\nWinterfeldt39 Gaststätten GmbH & Co. KG\nKommanditgesellschaft\nBerlin\n\nBei dem nachstehenden Unternehmen / der nachstehenden Gesellschaft wird das Amtslöschungsverfahren gemäß § 31 Abs. 2 HGB eingeleitet. Widerspruchsfrist 1 Monat"
    },
    {
      "date": "2025-02-19",
      "id": "101688",
      "original_text": "Einreichung neuer Dokumente\nBerlin Amtsgericht Berlin (Charlottenburg) HRB 1387\nEisenbahn-Siedlungs-Gesellschaft Berlin mit beschränkter Haftung – Berlin",
      "type": "Einreichung neuer Dokumente",
      "state": "Berlin",
      "amtsgericht": "Amtsgericht Berlin (Charlottenburg)",
      "registernummer": "HRB 1387",
      "registerart": "HRB",
      "company_name": "Eisenbahn-Siedlungs-Gesellschaft Berlin mit beschränkter Haftung",
      "company_seat": "Berlin",
      "details": "19.02.2025 (Bekanntmachungsdatum)\n\nBerlin Amtsgericht Berlin (Charlottenburg) HRB 1387\nEinreichung neuer Dokumente\n\nEisenbahn-Siedlungs-Gesellschaft Berlin mit beschränkter Haftung\nGesellschaft mit beschränkter Haftung\nBerlin\n\nAls nicht eingetragen wird veröffentlicht: Es wurde eine neue Liste der Aufsichtsratsmitglieder eingereicht (§52 GmbHG)."
    },
    {
      "date": "2025-02-19",
      "id": "101689",
      "original_text": "Löschungsankündigung\nBaden-Württemberg Amtsgericht Mannheim HRA 703330\nRAPPSON LIMITED & Co. KG – Heidelberg",
      "type": "Löschungsankündigung",
      "state": "Baden-Württemberg",
      "amtsgericht": "Amtsgericht Mannheim",
      "registernummer": "HRA 703330",
      "registerart": "HRA",
      "company_name": "RAPPSON LIMITED & Co. KG",
      "company_seat": "Heidelberg",
      "details": "19.02.2025 (Bekanntmachungsdatum)\n\nBaden-Württemberg Amtsgericht Mannheim HRA 703330\nLöschungsankündigung\n\nRAPPSON LIMITED & Co. KG\nKommanditgesellschaft\nHeidelberg\n\nDas Gericht beabsichtigt, die Gesellschaft wegen Unzulässigkeit im Handelsregister von Amts wegen nach § 395 FamFG zu löschen. Die Frist zur Geltendmachung eines Widerspruchs gegen die beabsichtigte Löschung ist auf einen Monat ab Veröffentlichung bestimmt."
    },
    {
      "date": "2025-02-19",
      "id": "101690",
      "original_text": "Registerbekanntmachung nach dem Umwandlungsgesetz\nHamburg Amtsgericht Hamburg HRB 181319\nCommertunity B&L GmbH – Hamburg",
      "type": "Registerbekanntmachung nach dem Umwandlungsgesetz",
      "state": "Hamburg",
      "amtsgericht": "Amtsgericht Hamburg",
      "registernummer": "HRB 181319",
      "registerart": "HRB",
      "company_name": "Commertunity B&L GmbH",
      "company_seat": "Hamburg",
      "details": "19.02.2025 (Bekanntmachungsdatum)\n\nHamburg Amtsgericht Hamburg HRB 181319\nRegisterbekanntmachung nach dem Umwandlungsgesetz 19.02.2025 (Eintragungsdatum)\n\nCommertunity B&L GmbH\nGesellschaft mit beschränkter Haftung\nHamburg\n\nAls nicht eingetragen wird bekannt gemacht:\nDen Gläubigern der an der Verschmelzung beteiligten Gesellschaften ist, wenn sie binnen sechs Monaten nach dem Tag, an dem die Eintragung der Verschmelzung in das Register des Sitzes desjenigen Rechtsträgers, dessen Gläubiger sie sind, nach § 19 Absatz 3 UmwG als bekannt gemacht gilt, ihren Anspruch nach Grund und Höhe schriftlich anmelden, Sicherheit zu leisten, soweit sie nicht Befriedigung verlangen können. Dieses Recht steht den Gläubigern jedoch nur zu, wenn sie glaubhaft machen, dass durch die Verschmelzung die Erfüllung ihrer Forderung gefährdet wird."
    },
    {
      "date": "2025-02-19",
      "id": "101691",
      "original_text": "Einreichung neuer Dokumente\nBerlin Amtsgericht Berlin (Charlottenburg) HRB 217945\nMedia Pioneer Publishing AG – Berlin",
      "type": "Einreichung neuer Dokumente",
      "state": "Berlin",
      "amtsgericht": "Amtsgericht Berlin (Charlottenburg)",
      "registernummer": "HRB 217945",
      "registerart": "HRB",
      "company_name": "Media Pioneer Publishing AG",
      "company_seat": "Berlin",
      "details": "19.02.2025 (Bekanntmachungsdatum)\n\nBerlin Amtsgericht Berlin (Charlottenburg) HRB 217945\nEinreichung neuer Dokumente\n\nMedia Pioneer Publishing AG\nAktiengesellschaft\nBerlin\n\nAls nicht eingetragen wird veröffentlicht:\n\nEs wurde eine neue Liste der Aufsichtsratsmitglieder eingereicht (§ 106 AktG)."
    },
    {
      "date": "2025-02-19",
      "id": "101692",
      "original_text": "Sonstige Registerbekanntmachung\nHamburg Amtsgericht Hamburg HRB 171848\nZeppelin Power Systems GmbH – Hamburg",
      "type": "Sonstige Registerbekanntmachung",
      "state": "Hamburg",
      "amtsgericht": "Amtsgericht Hamburg",
      "registernummer": "HRB 171848",
      "registerart": "HRB",
      "company_name": "Zeppelin Power Systems GmbH",
      "company_seat": "Hamburg",
      "details": "19.02.2025 (Bekanntmachungsdatum)\n\nHamburg Amtsgericht Hamburg HRB 171848\nSonstige Registerbekanntmachung\n\nZeppelin Power Systems GmbH\nGesellschaft mit beschränkter Haftung\nHamburg\n\nAls nicht eingetragen wird bekannt gemacht: Liste des Aufsichtsrats wurde eingereicht."
    },
    {
      "date": "2025-02-19",
      "id": "101693",
      "original_text": "Registerbekanntmachung nach dem Umwandlungsgesetz\nBerlin Amtsgericht Berlin (Charlottenburg) GsR 2863\nElektroanlagenbau Kattein eGbR – Berlin",
      "type": "Registerbekanntmachung nach dem Umwandlungsgesetz",
      "state": "Berlin",
      "amtsgericht": "Amtsgericht Berlin (Charlottenburg)",
      "registernummer": "GsR 2863",
      "registerart": "GsR",
      "company_name": "Elektroanlagenbau Kattein eGbR",
      "company_seat": "Berlin",
      "details": "19.02.2025 (Bekanntmachungsdatum)\n\nBerlin Amtsgericht Berlin (Charlottenburg) GsR 2863\nRegisterbekanntmachung nach dem Umwandlungsgesetz 19.02.2025 (Eintragungsdatum)\n\nElektroanlagenbau Kattein eGbR\nGesellschaft bürgerlichen Rechts\nBerlin\n\nZu Eintragungsnummer 1 vom 19.02.2025 wird als nicht eingetragen veröffentlicht:\n\nDen Gläubigern ist, wenn sie binnen sechs Monaten nach dem Tag, an dem die Eintragung der Umwandlung als bekannt gemacht gilt, ihren Anspruch nach Grund und Höhe schriftlich anmelden, Sicherheit zu leisten, soweit sie nicht Befriedigung verlangen können. Dieses Recht steht den Gläubigern jedoch nur zu, wenn sie glaubhaft machen, dass durch die Umwandlung die Erfüllung ihrer Forderung gefährdet wird. Das Recht, Sicherheitsleistung zu verlangen, steht Gläubigern nicht zu, die im Falle der Insolvenz ein Recht auf vorzugsweise Befriedigung aus einer Deckungsmasse haben, die nach gesetzlicher Vorschrift zu ihrem Schutz errichtet und staatlich überwacht ist."
    },
    {
      "date": "2025-02-19",
      "id": "101694",
      "original_text": "Registerbekanntmachung nach dem Umwandlungsgesetz\nNordrhein-Westfalen Amtsgericht Coesfeld HRB 22728\nJobeto Trading GmbH – Olfen",
      "type": "Registerbekanntmachung nach dem Umwandlungsgesetz",
      "state": "Nordrhein-Westfalen",
      "amtsgericht": "Amtsgericht Coesfeld",
      "registernummer": "HRB 22728",
      "registerart": "HRB",
      "company_name": "Jobeto Trading GmbH",
      "company_seat": "Olfen",
      "details": "19.02.2025 (Bekanntmachungsdatum)\n\nNordrhein-Westfalen Amtsgericht Coesfeld HRB 22728\nRegisterbekanntmachung nach dem Umwandlungsgesetz 19.02.2025 (Eintragungsdatum)\n\nJobeto Trading GmbH\nGesellschaft mit beschränkter Haftung\nOlfen\n\nDen Gläubigern der an der Ausgliederung beteiligten Rechtsträger ist, wenn sie binnen sechs Monaten nach dem Tag, an dem die Eintragung der Ausgliederung in das Register des Sitzes derjenigen Rechtsträger deren Gläubiger sie sind, nach § 19 Absatz 3 UmwG als bekanntgemacht gilt, ihren Anspruch nach Grund und Höhe schriftlich anmelden, Sicherheit zu leisten, soweit sie nicht Befriedigung verlangen können. Dieses Recht steht den Gläubigern jedoch nur zu, wenn sie glaubhaft machen, dass durch die Ausgliederung die Erfüllung ihrer Forderung gefährdet wird."
    },
    {
      "date": "2025-02-19",
      "id": "101695",
      "original_text": "Löschungsankündigung\nBerlin Amtsgericht Berlin (Charlottenburg) HRB 65787\nUmwelttechnik Dr. Bartetzko GmbH – Berlin",
      "type": "Löschungsankündigung",
      "state": "Berlin",
      "amtsgericht": "Amtsgericht Berlin (Charlottenburg)",
      "registernummer": "HRB 65787",
      "registerart": "HRB",
      "company_name": "Umwelttechnik Dr. Bartetzko GmbH",
      "company_seat": "Berlin",
      "details": "19.02.2025 (Bekanntmachungsdatum)\n\nBerlin Amtsgericht Berlin (Charlottenburg) HRB 65787\nLöschungsankündigung\n\nUmwelttechnik Dr. Bartetzko GmbH\nGesellschaft mit beschränkter Haftung\nBerlin\n\nBei der nachstehenden Gesellschaft wird das Amtslöschungsverfahren gemäß § 394 FamFG eingeleitet. Widerspruchsfrist 6 Wochen"
    },
    {
      "date": "2025-02-19",
      "id": "101696",
      "original_text": "Registerbekanntmachung nach dem Umwandlungsgesetz\nBerlin Amtsgericht Berlin (Charlottenburg) HRB 13779\nElektroanlagenbau Kattein Gesellschaft mit beschränkter Haftung – Berlin",
      "type": "Registerbekanntmachung nach dem Umwandlungsgesetz",
      "state": "Berlin",
      "amtsgericht": "Amtsgericht Berlin (Charlottenburg)",
      "registernummer": "HRB 13779",
      "registerart": "HRB",
      "company_name": "Elektroanlagenbau Kattein Gesellschaft mit beschränkter Haftung",
      "company_seat": "Berlin",
      "details": "19.02.2025 (Bekanntmachungsdatum)\n\nBerlin Amtsgericht Berlin (Charlottenburg) HRB 13779\nRegisterbekanntmachung nach dem Umwandlungsgesetz 19.02.2025 (Eintragungsdatum)\n\nElektroanlagenbau Kattein Gesellschaft mit beschränkter Haftung\nGesellschaft mit beschränkter Haftung\nBerlin\n\nZu Eintragungsnummer 3 vom 19.02.2025 wird als nicht eingetragen veröffentlicht:\n\nDen Gläubigern ist, wenn sie binnen sechs Monaten nach dem Tag, an dem die Eintragung der Umwandlung als bekannt gemacht gilt, ihren Anspruch nach Grund und Höhe schriftlich anmelden, Sicherheit zu leisten, soweit sie nicht Befriedigung verlangen können. Dieses Recht steht den Gläubigern jedoch nur zu, wenn sie glaubhaft machen, dass durch die Umwandlung die Erfüllung ihrer Forderung gefährdet wird. Das Recht, Sicherheitsleistung zu verlangen, steht Gläubigern nicht zu, die im Falle der Insolvenz ein Recht auf vorzugsweise Befriedigung aus einer Deckungsmasse haben, die nach gesetzlicher Vorschrift zu ihrem Schutz errichtet und staatlich überwacht ist."
    },
    {
      "date": "2025-02-19",
      "id": "101697",
      "original_text": "Löschungsankündigung\nBerlin Amtsgericht Berlin (Charlottenburg) HRA 52686\nsens media UG (haftungsbeschränkt) & Co. KG – Berlin",
      "type": "Löschungsankündigung",
      "state": "Berlin",
      "amtsgericht": "Amtsgericht Berlin (Charlottenburg)",
      "registernummer": "HRA 52686",
      "registerart": "HRA",
      "company_name": "sens media UG (haftungsbeschränkt) & Co. KG",
      "company_seat": "Berlin",
      "details": "19.02.2025 (Bekanntmachungsdatum)\n\nBerlin Amtsgericht Berlin (Charlottenburg) HRA 52686\nLöschungsankündigung\n\nsens media UG (haftungsbeschränkt) & Co. KG\nKommanditgesellschaft\nBerlin\n\nBei dem nachstehenden Unternehmen / der nachstehenden Gesellschaft wird das Amtslöschungsverfahren gemäß § 31 Abs. 2 HGB eingeleitet. Widerspruchsfrist 1 Monat"
    },
    {
      "date": "2025-02-19",
      "id": "101698",
      "original_text": "Registerbekanntmachung nach dem Umwandlungsgesetz\nBaden-Württemberg Amtsgericht Stuttgart HRB 758721\nDATAGROUP SE – Pliezhausen",
      "type": "Registerbekanntmachung nach dem Umwandlungsgesetz",
      "state": "Baden-Württemberg",
      "amtsgericht": "Amtsgericht Stuttgart",
      "registernummer": "HRB 758721",
      "registerart": "HRB",
      "company_name": "DATAGROUP SE",
      "company_seat": "Pliezhausen",
      "details": "19.02.2025 (Bekanntmachungsdatum)\n\nBaden-Württemberg Amtsgericht Stuttgart HRB 758721\nRegisterbekanntmachung nach dem Umwandlungsgesetz 19.02.2025 (Eintragungsdatum)\n\nDATAGROUP SE\nEuropäische Aktiengesellschaft (SE)\nPliezhausen\n\nAls nicht eingetragen wird bekanntgemacht:\nDen Gläubigern der an der Abspaltung beteiligten Rechtsträger ist, wenn sie binnen sechs Monaten nach dem Tag, an dem die Eintragung der Abspaltung in das Register des Sitzes desjenigen Rechtsträgers, dessen Gläubiger sie sind, nach § 19 Abs. 3 UmwG als bekanntgemacht gilt, ihren Anspruch nach Grund und Höhe schriftlich anmelden, Sicherheit zu leisten, soweit sie nicht Befriedigung verlangen können. Dieses Recht steht den Gläubigern jedoch nur zu, wenn sie glaubhaft machen, dass durch die Abspaltung die Erfüllung ihrer Forderung gefährdet wird."
    },
    {
      "date": "2025-02-19",
      "id": "101699",
      "original_text": "Registerbekanntmachung nach dem Umwandlungsgesetz\nHamburg Amtsgericht Hamburg HRA 57239\nKliefoth & Siebert Inh. Denise Rathgeber e. Kfr. – Hamburg",
      "type": "Registerbekanntmachung nach dem Umwandlungsgesetz",
      "state": "Hamburg",
      "amtsgericht": "Amtsgericht Hamburg",
      "registernummer": "HRA 57239",
      "registerart": "HRA",
      "company_name": "Kliefoth & Siebert Inh. Denise Rathgeber e. Kfr.",
      "company_seat": "Hamburg",
      "details": "19.02.2025 (Bekanntmachungsdatum)\n\nHamburg Amtsgericht Hamburg HRA 57239\nRegisterbekanntmachung nach dem Umwandlungsgesetz 19.02.2025 (Eintragungsdatum)\n\nKliefoth & Siebert Inh. Denise Rathgeber e. Kfr.\nEinzelkaufmann\nHamburg\n\nAls nicht eingetragen wird bekannt gemacht:\nDen Gläubigern der an der Ausgliederung beteiligten Gesellschaften ist, wenn sie binnen sechs Monaten nach dem Tag, an dem die Eintragung der Ausgliederung in das Register des Sitzes desjenigen Rechtsträgers, dessen Gläubiger sie sind, nach § 19 Absatz 3 UmwG als bekannt gemacht gilt, ihren Anspruch nach Grund und Höhe schriftlich anmelden, Sicherheit zu leisten, soweit sie nicht Befriedigung verlangen können. Dieses Recht steht den Gläubigern jedoch nur zu, wenn sie glaubhaft machen, dass durch die Ausgliederung die Erfüllung ihrer Forderung gefährdet wird."
    },
    {
      "date": "2025-02-19",
      "id": "101700",
      "original_text": "Registerbekanntmachung nach dem Umwandlungsgesetz\nHamburg Amtsgericht Hamburg HRB 189871\nKliefoth und Siebert GmbH – Hamburg",
      "type": "Registerbekanntmachung nach dem Umwandlungsgesetz",
      "state": "Hamburg",
      "amtsgericht": "Amtsgericht Hamburg",
      "registernummer": "HRB 189871",
      "registerart": "HRB",
      "company_name": "Kliefoth und Siebert GmbH",
      "company_seat": "Hamburg",
      "details": "19.02.2025 (Bekanntmachungsdatum)\n\nHamburg Amtsgericht Hamburg HRB 189871\nRegisterbekanntmachung nach dem Umwandlungsgesetz 19.02.2025 (Eintragungsdatum)\n\nKliefoth und Siebert GmbH\nGesellschaft mit beschränkter Haftung\nHamburg\n\nAls nicht eingetragen wird bekannt gemacht:\nDen Gläubigern der an der Ausgliederung beteiligten Gesellschaften ist, wenn sie binnen sechs Monaten nach dem Tag, an dem die Eintragung der Ausgliederung in das Register des Sitzes desjenigen Rechtsträgers, dessen Gläubiger sie sind, nach § 19 Absatz 3 UmwG als bekannt gemacht gilt, ihren Anspruch nach Grund und Höhe schriftlich anmelden, Sicherheit zu leisten, soweit sie nicht Befriedigung verlangen können. Dieses Recht steht den Gläubigern jedoch nur zu, wenn sie glaubhaft machen, dass durch die Ausgliederung die Erfüllung ihrer Forderung gefährdet wird."
    },
    {
      "date": "2025-02-19",
      "id": "101701",
      "original_text": "Einreichung neuer Dokumente\nHamburg Amtsgericht Hamburg HRB 111011\nDreamlines GmbH – Hamburg",
      "type": "Einreichung neuer Dokumente",
      "state": "Hamburg",
      "amtsgericht": "Amtsgericht Hamburg",
      "registernummer": "HRB 111011",
      "registerart": "HRB",
      "company_name": "Dreamlines GmbH",
      "company_seat": "Hamburg",
      "details": "19.02.2025 (Bekanntmachungsdatum)\n\nHamburg Amtsgericht Hamburg HRB 111011\nEinreichung neuer Dokumente\n\nDreamlines GmbH\nGesellschaft mit beschränkter Haftung\nHamburg\n\nAls nicht eingetragen wird bekannt gemacht: Liste des Beirats wurde eingereicht."
    },
    {
      "date": "2025-02-19",
      "id": "101702",
      "original_text": "Löschungsankündigung\nBerlin Amtsgericht Berlin (Charlottenburg) HRA 52200\nKarl-Marx-Str. 220. KG – Berlin",
      "type": "Löschungsankündigung",
      "state": "Berlin",
      "amtsgericht": "Amtsgericht Berlin (Charlottenburg)",
      "registernummer": "HRA 52200",
      "registerart": "HRA",
      "company_name": "Karl-Marx-Str. 220. KG",
      "company_seat": "Berlin",
      "details": "19.02.2025 (Bekanntmachungsdatum)\n\nBerlin Amtsgericht Berlin (Charlottenburg) HRA 52200\nLöschungsankündigung\n\nKarl-Marx-Str. 220. KG\nKommanditgesellschaft\nBerlin\n\nBei dem nachstehenden Unternehmen / der nachstehenden Gesellschaft wird das Amtslöschungsverfahren gemäß § 31 Abs. 2 HGB eingeleitet. Widerspruchsfrist 1 Monat"
    },
    {
      "date": "2025-02-19",
      "id": "101703",
      "original_text": "Löschungsankündigung\nBrandenburg Amtsgericht Potsdam HRB 26172\nELAN Sports UG (haftungsbeschränkt) – Potsdam",
      "type": "Löschungsankündigung",
      "state": "Brandenburg",
      "amtsgericht": "Amtsgericht Potsdam",
      "registernummer": "HRB 26172",
      "registerart": "HRB",
      "company_name": "ELAN Sports UG (haftungsbeschränkt)",
      "company_seat": "Potsdam",
      "details": "19.02.2025 (Bekanntmachungsdatum)\n\nBrandenburg Amtsgericht Potsdam HRB 26172\nLöschungsankündigung\n\nELAN Sports UG (haftungsbeschränkt)\nGesellschaft mit beschränkter Haftung\nPotsdam\n\nBei der nachstehenden Gesellschaft wird das Amtslöschungsverfahren gemäß § 394 FamFG eingeleitet. Widerspruchsfrist: 8 Wochen"
    },
    {
      "date": "2025-02-19",
      "id": "101704",
      "original_text": "Löschungsankündigung\nMecklenburg-Vorpommern Amtsgericht Rostock HRB 10730\nZAC - Bau GmbH – Schwaan",
      "type": "Löschungsankündigung",
      "state": "Mecklenburg-Vorpommern",
      "amtsgericht": "Amtsgericht Rostock",
      "registernummer": "HRB 10730",
      "registerart": "HRB",
      "company_name": "ZAC - Bau GmbH",
      "company_seat": "Schwaan",
      "details": "19.02.2025 (Bekanntmachungsdatum)\n\nMecklenburg-Vorpommern Amtsgericht Rostock HRB 10730\nLöschungsankündigung\n\nZAC - Bau GmbH\nGesellschaft mit beschränkter Haftung\nSchwaan\n\nDas Registergericht beabsichtigt, die im Handelsregister eingetragene Gesellschaft von Amts wegen nach § 394 FamFG zu löschen. Die Frist zur Erhebung eines Widerspruchs gegen die beabsichtigte Löschung wird auf einen Monat festgesetzt."
    },
    {
      "date": "2025-02-19",
      "id": "101705",
      "original_text": "Sonstige Registerbekanntmachung\nSachsen-Anhalt Amtsgericht Stendal HRB 12138\nWirtschaftsförderungungsgesellschaft Köthen/Anhalt-Bitterfeld mbH – Köthen",
      "type": "Sonstige Registerbekanntmachung",
      "state": "Sachsen-Anhalt",
      "amtsgericht": "Amtsgericht Stendal",
      "registernummer": "HRB 12138",
      "registerart": "HRB",
      "company_name": "Wirtschaftsförderungungsgesellschaft Köthen/Anhalt-Bitterfeld mbH",
      "company_seat": "Köthen",
      "details": "19.02.2025 (Bekanntmachungsdatum)\n\nSachsen-Anhalt Amtsgericht Stendal HRB 12138\nSonstige Registerbekanntmachung\n\nWirtschaftsförderungungsgesellschaft Köthen/Anhalt-Bitterfeld mbH\nGesellschaft mit beschränkter Haftung\nKöthen\n\nEine Liste der Mitglieder des Aufsichtsrates wurde zum Handelsregister eingereicht."
    },
    {
      "date": "2025-02-19",
      "id": "101706",
      "original_text": "Löschungsankündigung\nBerlin Amtsgericht Berlin (Charlottenburg) HRB 206488\nThe Lyon Cars UG (haftungsbeschränkt) – Berlin",
      "type": "Löschungsankündigung",
      "state": "Berlin",
      "amtsgericht": "Amtsgericht Berlin (Charlottenburg)",
      "registernummer": "HRB 206488",
      "registerart": "HRB",
      "company_name": "The Lyon Cars UG (haftungsbeschränkt)",
      "company_seat": "Berlin",
      "details": "19.02.2025 (Bekanntmachungsdatum)\n\nBerlin Amtsgericht Berlin (Charlottenburg) HRB 206488\nLöschungsankündigung\n\nThe Lyon Cars UG (haftungsbeschränkt)\nGesellschaft mit beschränkter Haftung\nBerlin\n\nBei der nachstehenden Gesellschaft wird das Amtslöschungsverfahren gemäß § 394 FamFG eingeleitet. Widerspruchsfrist: 6 Wochen."
    },
    {
      "date": "2025-02-19",
      "id": "101707",
      "original_text": "Einreichung neuer Dokumente\nSaarland Amtsgericht Saarbrücken HRB 5171\nWasserwerk Bliestal Gesellschaft mit beschränkter Haftung Saarbrücken – Saarbrücken",
      "type": "Einreichung neuer Dokumente",
      "state": "Saarland",
      "amtsgericht": "Amtsgericht Saarbrücken",
      "registernummer": "HRB 5171",
      "registerart": "HRB",
      "company_name": "Wasserwerk Bliestal Gesellschaft mit beschränkter Haftung Saarbrücken",
      "company_seat": "Saarbrücken",
      "details": "19.02.2025 (Bekanntmachungsdatum)\n\nSaarland Amtsgericht Saarbrücken HRB 5171\nEinreichung neuer Dokumente\n\nWasserwerk Bliestal Gesellschaft mit beschränkter Haftung Saarbrücken\nGesellschaft mit beschränkter Haftung\nSaarbrücken\n\nDie Geschäftsführung der Gesellschaft hat eine Liste der Mitglieder des Aufsichtsrats zum Handelsregister eingereicht (§ 52 Abs. 3 Satz 2 GmbHG)."
    },
    {
      "date": "2025-02-19",
      "id": "101708",
      "original_text": "Registerbekanntmachung nach dem Umwandlungsgesetz\nSachsen-Anhalt Amtsgericht Stendal HRB 34336\nSchwermer Confiserie GmbH – Weißenfels",
      "type": "Registerbekanntmachung nach dem Umwandlungsgesetz",
      "state": "Sachsen-Anhalt",
      "amtsgericht": "Amtsgericht Stendal",
      "registernummer": "HRB 34336",
      "registerart": "HRB",
      "company_name": "Schwermer Confiserie GmbH",
      "company_seat": "Weißenfels",
      "details": "19.02.2025 (Bekanntmachungsdatum)\n\nSachsen-Anhalt Amtsgericht Stendal HRB 34336\nRegisterbekanntmachung nach dem Umwandlungsgesetz 19.02.2025 (Eintragungsdatum)\n\nSchwermer Confiserie GmbH\nGesellschaft mit beschränkter Haftung\nWeißenfels\n\nNicht eingetragen:\nDen Gläubigern der an der Verschmelzung beteiligten Rechtsträger ist, wenn sie binnen sechs Monaten nach dem Tag, an dem die Eintragung der Verschmelzung nach § 19 Abs. 3 UmwG als bekanntgemacht gilt, ihren Anspruch nach Grund und Höhe schriftlich anmelden, Sicherheit zu leisten, soweit sie nicht Befriedigung verlangen können. Dieses Recht steht ihnen jedoch nur zu, wenn sie glaubhaft machen, dass durch die Verschmelzung die Erfüllung ihrer Forderung gefährdet wird."
    },
    {
      "date": "2025-02-19",
      "id": "101709",
      "original_text": "Registerbekanntmachung nach dem Umwandlungsgesetz\nSachsen-Anhalt Amtsgericht Stendal HRB 113850\nArgenta Schokoladenmanufaktur GmbH – Weißenfels",
      "type": "Registerbekanntmachung nach dem Umwandlungsgesetz",
      "state": "Sachsen-Anhalt",
      "amtsgericht": "Amtsgericht Stendal",
      "registernummer": "HRB 113850",
      "registerart": "HRB",
      "company_name": "Argenta Schokoladenmanufaktur GmbH",
      "company_seat": "Weißenfels",
      "details": "19.02.2025 (Bekanntmachungsdatum)\n\nSachsen-Anhalt Amtsgericht Stendal HRB 113850\nRegisterbekanntmachung nach dem Umwandlungsgesetz 19.02.2025 (Eintragungsdatum)\n\nArgenta Schokoladenmanufaktur GmbH\nGesellschaft mit beschränkter Haftung\nWeißenfels\n\nNicht eingetragen:\nDen Gläubigern der an der Verschmelzung beteiligten Rechtsträger ist, wenn sie binnen sechs Monaten nach dem Tag, an dem die Eintragung der Verschmelzung nach § 19 Abs. 3 UmwG als bekanntgemacht gilt, ihren Anspruch nach Grund und Höhe schriftlich anmelden, Sicherheit zu leisten, soweit sie nicht Befriedigung verlangen können. Dieses Recht steht ihnen jedoch nur zu, wenn sie glaubhaft machen, dass durch die Verschmelzung die Erfüllung ihrer Forderung gefährdet wird."
    },
    {
      "date": "2025-02-19",
      "id": "101710",
      "original_text": "Löschungsankündigung\nSachsen Amtsgericht Leipzig HRB 16698\nITAL Komplettbau GmbH – Leipzig",
      "type": "Löschungsankündigung",
      "state": "Sachsen",
      "amtsgericht": "Amtsgericht Leipzig",
      "registernummer": "HRB 16698",
      "registerart": "HRB",
      "company_name": "ITAL Komplettbau GmbH",
      "company_seat": "Leipzig",
      "details": "19.02.2025 (Bekanntmachungsdatum)\n\nSachsen Amtsgericht Leipzig HRB 16698\nLöschungsankündigung\n\nITAL Komplettbau GmbH\nGesellschaft mit beschränkter Haftung\nLeipzig\n\nDas Registergericht beabsichtigt, die im Handelsregister eingetragene Gesellschaft von Amts wegen nach § 394 FamFG zu löschen. Die Frist zu Erhebung eines Widerspruchs gegen die beabsichtigte Löschung wird auf einen Monat festgesetzt."
    },
    {
      "date": "2025-02-19",
      "id": "101711",
      "original_text": "Einreichung neuer Dokumente\nSachsen Amtsgericht Chemnitz HRB 14303\nFZLO Freizeitstätten GmbH Limbach-Oberfrohna – Limbach-Oberfrohna",
      "type": "Einreichung neuer Dokumente",
      "state": "Sachsen",
      "amtsgericht": "Amtsgericht Chemnitz",
      "registernummer": "HRB 14303",
      "registerart": "HRB",
      "company_name": "FZLO Freizeitstätten GmbH Limbach-Oberfrohna",
      "company_seat": "Limbach-Oberfrohna",
      "details": "19.02.2025 (Bekanntmachungsdatum)\n\nSachsen Amtsgericht Chemnitz HRB 14303\nEinreichung neuer Dokumente\n\nFZLO Freizeitstätten GmbH Limbach-Oberfrohna\nGesellschaft mit beschränkter Haftung\nLimbach-Oberfrohna\n\nAm 18.02.2025 wurde beim Handelsregister des Amtsgerichts Chemnitz die Liste der Mitglieder des Aufsichtsrats gemäß § 52 GmbHG eingereicht."
    },
    {
      "date": "2025-02-19",
      "id": "101712",
      "original_text": "Registerbekanntmachung nach dem Umwandlungsgesetz\nSachsen Amtsgericht Dresden HRB 25352\nGunnebo Markersdorf GmbH – Markersdorf",
      "type": "Registerbekanntmachung nach dem Umwandlungsgesetz",
      "state": "Sachsen",
      "amtsgericht": "Amtsgericht Dresden",
      "registernummer": "HRB 25352",
      "registerart": "HRB",
      "company_name": "Gunnebo Markersdorf GmbH",
      "company_seat": "Markersdorf",
      "details": "19.02.2025 (Bekanntmachungsdatum)\n\nSachsen Amtsgericht Dresden HRB 25352\nRegisterbekanntmachung nach dem Umwandlungsgesetz 19.02.2025 (Eintragungsdatum)\n\nGunnebo Markersdorf GmbH\nGesellschaft mit beschränkter Haftung\nMarkersdorf\n\nDen Gläubigern der an der Verschmelzung beteiligten Rechtsträger ist, wenn sie binnen sechs Monaten nach dem Tag, an dem die Eintragung der Verschmelzung in das Register des Sitzes desjenigen Rechtsträgers, dessen Gläubiger sie sind, nach § 19 Abs. 3 UmwG als bekannt gemacht gilt, ihren Anspruch nach Grund und Höhe in Textform anmelden, Sicherheit zu leisten, soweit sie nicht Befriedigung verlangen können. Dieses Recht steht den Gläubigern jedoch nur zu, wenn sie glaubhaft machen, dass durch die Verschmelzung die Erfüllung der Forderung gefährdet wird."
    },
    {
      "date": "2025-02-19",
      "id": "101713",
      "original_text": "Löschungsankündigung\nSachsen Amtsgericht Chemnitz HRB 34175\nSKS Solarkraft UG (haftungsbeschränkt) – Freiberg",
      "type": "Löschungsankündigung",
      "state": "Sachsen",
      "amtsgericht": "Amtsgericht Chemnitz",
      "registernummer": "HRB 34175",
      "registerart": "HRB",
      "company_name": "SKS Solarkraft UG (haftungsbeschränkt)",
      "company_seat": "Freiberg",
      "details": "19.02.2025 (Bekanntmachungsdatum)\n\nSachsen Amtsgericht Chemnitz HRB 34175\nLöschungsankündigung\n\nSKS Solarkraft UG (haftungsbeschränkt)\nGesellschaft mit beschränkter Haftung\nFreiberg\n\nDas Registergericht beabsichtigt, die im Handelsregister eingetragene Gesellschaft von Amts wegen nach § 394 FamFG zu löschen. Die Frist zu Erhebung eines Widerspruchs gegen die beabsichtigte Löschung wird auf einen Monat festgesetzt."
    },
    {
      "date": "2025-02-19",
      "id": "101714",
      "original_text": "Registerbekanntmachung nach dem Umwandlungsgesetz\nSachsen Amtsgericht Chemnitz HRB 30283\nAM Metals GmbH – Freiberg",
      "type": "Registerbekanntmachung nach dem Umwandlungsgesetz",
      "state": "Sachsen",
      "amtsgericht": "Amtsgericht Chemnitz",
      "registernummer": "HRB 30283",
      "registerart": "HRB",
      "company_name": "AM Metals GmbH",
      "company_seat": "Freiberg",
      "details": "19.02.2025 (Bekanntmachungsdatum)\n\nSachsen Amtsgericht Chemnitz HRB 30283\nRegisterbekanntmachung nach dem Umwandlungsgesetz 19.02.2025 (Eintragungsdatum)\n\nAM Metals GmbH\nGesellschaft mit beschränkter Haftung\nFreiberg\n\nDen Gläubigern der an der Verschmelzung beteiligten Rechtsträger ist, wenn sie binnen sechs Monaten nach dem Tag, an dem die Eintragung der Verschmelzung in das Register des Sitzes desjenigen Rechtsträgers, dessen Gläubiger sie sind, nach § 19 Abs. 3 UmwG als bekannt gemacht gilt, ihren Anspruch nach Grund und Höhe in Textform anmelden, Sicherheit zu leisten, soweit sie nicht Befriedigung verlangen können. Dieses Recht steht den Gläubigern jedoch nur zu, wenn sie glaubhaft machen, dass durch die Verschmelzung die Erfüllung der Forderung gefährdet wird."
    },
    {
      "date": "2025-02-19",
      "id": "101715",
      "original_text": "Löschungsankündigung\nNiedersachsen Amtsgericht Oldenburg (Oldenburg) HRB 200754\nNordica Polstermöbel GmbH – Delmenhorst",
      "type": "Löschungsankündigung",
      "state": "Niedersachsen",
      "amtsgericht": "Amtsgericht Oldenburg (Oldenburg)",
      "registernummer": "HRB 200754",
      "registerart": "HRB",
      "company_name": "Nordica Polstermöbel GmbH",
      "company_seat": "Delmenhorst",
      "details": "19.02.2025 (Bekanntmachungsdatum)\n\nNiedersachsen Amtsgericht Oldenburg (Oldenburg) HRB 200754\nLöschungsankündigung\n\nNordica Polstermöbel GmbH\nGesellschaft mit beschränkter Haftung\nDelmenhorst\n\nDas Registergericht beabsichtigt, die Gesellschaft von Amts wegen nach § 395 FamFG zu löschen. Die Frist zur Erhebung eines Widerspruchs ist auf 1 Monat ab dieser Registerbekanntmachung festgesetzt."
    },
    {
      "date": "2025-02-19",
      "id": "101716",
      "original_text": "Einreichung neuer Dokumente\nNiedersachsen Amtsgericht Osnabrück HRB 131096 früher Amtsgericht Nordhorn\nGVZ Europark Coevorden-Emlichheim GmbH – Laar",
      "type": "Einreichung neuer Dokumente",
      "state": "Niedersachsen",
      "amtsgericht": "Amtsgericht Osnabrück",
      "registernummer": "HRB 131096",
      "registerart": "HRB",
      "company_name": "GVZ Europark Coevorden-Emlichheim GmbH",
      "company_seat": "Laar",
      "former_amtsgericht": "Nordhorn",
      "details": "19.02.2025 (Bekanntmachungsdatum)\n\nNiedersachsen Amtsgericht Osnabrück HRB 131096 früher Amtsgericht Nordhorn\nEinreichung neuer Dokumente\n\nGVZ Europark Coevorden-Emlichheim GmbH\nGesellschaft mit beschränkter Haftung\nLaar\n\nDie Liste der Mitglieder des Aufsichtsrats wurde beim Registergericht eingereicht."
    },
    {
      "date": "2025-02-19",
      "id": "101717",
      "original_text": "Einreichung neuer Dokumente\nNiedersachsen Amtsgericht Osnabrück HRB 214644\nATTENTIUM Capital Management AG – Osnabrück",
      "type": "Einreichung neuer Dokumente",
      "state": "Niedersachsen",
      "amtsgericht": "Amtsgericht Osnabrück",
      "registernummer": "HRB 214644",
      "registerart": "HRB",
      "company_name": "ATTENTIUM Capital Management AG",
      "company_seat": "Osnabrück",
      "details": "19.02.2025 (Bekanntmachungsdatum)\n\nNiedersachsen Amtsgericht Osnabrück HRB 214644\nEinreichung neuer Dokumente 19.02.2025 (Eintragungsdatum)\n\nATTENTIUM Capital Management AG\nAktiengesellschaft\nOsnabrück\n\nDie Liste der Mitglieder des Aufsichtsrats wurde beim Registergericht eingereicht."
    },
    {
      "date": "2025-02-19",
      "id": "101718",
      "original_text": "Registerbekanntmachung nach dem Umwandlungsgesetz\nNiedersachsen Amtsgericht Oldenburg (Oldenburg) HRB 221457\nDr. Härig Umwelt GmbH – Wardenburg",
      "type": "Registerbekanntmachung nach dem Umwandlungsgesetz",
      "state": "Niedersachsen",
      "amtsgericht": "Amtsgericht Oldenburg (Oldenburg)",
      "registernummer": "HRB 221457",
      "registerart": "HRB",
      "company_name": "Dr. Härig Umwelt GmbH",
      "company_seat": "Wardenburg",
      "details": "19.02.2025 (Bekanntmachungsdatum)\n\nNiedersachsen Amtsgericht Oldenburg (Oldenburg) HRB 221457\nRegisterbekanntmachung nach dem Umwandlungsgesetz 18.02.2025 (Eintragungsdatum)\n\nDr. Härig Umwelt GmbH\nGesellschaft mit beschränkter Haftung\nWardenburg\n\nDen Gläubigern der an der Verschmelzung beteiligten Rechtsträger ist, wenn sie binnen sechs Monaten nach dem Tag, an dem die Eintragung der Verschmelzung in das Register des Sitzes desjenigen Rechtsträgers, dessen Gläubiger sie sind, nach § 19  Abs.  3 UmwG als bekannt gemacht gilt, ihren Anspruch nach Grund und Höhe schriftlich anmelden, Sicherheit zu leisten, soweit sie nicht Befriedigung verlangen können. Dieses Recht steht den Gläubigern jedoch nur zu, wenn sie glaubhaft machen, dass durch die Verschmelzung die Erfüllung der Forderung gefährdet wird."
    },
    {
      "date": "2025-02-19",
      "id": "101719",
      "original_text": "Registerbekanntmachung nach dem Umwandlungsgesetz\nNiedersachsen Amtsgericht Oldenburg (Oldenburg) HRA 203185\nKallage GmbH & Co. KG – Vechta",
      "type": "Registerbekanntmachung nach dem Umwandlungsgesetz",
      "state": "Niedersachsen",
      "amtsgericht": "Amtsgericht Oldenburg (Oldenburg)",
      "registernummer": "HRA 203185",
      "registerart": "HRA",
      "company_name": "Kallage GmbH & Co. KG",
      "company_seat": "Vechta",
      "details": "19.02.2025 (Bekanntmachungsdatum)\n\nNiedersachsen Amtsgericht Oldenburg (Oldenburg) HRA 203185\nRegisterbekanntmachung nach dem Umwandlungsgesetz 19.02.2025 (Eintragungsdatum)\n\nKallage GmbH & Co. KG\nKommanditgesellschaft\nVechta\n\nDen Gläubigern der an der formwechselnden Umwandlung beteiligten Rechtsträger ist, wenn sie binnen sechs Monaten nach dem Tag, an dem die Eintragung der Umwandlung in das Register des Sitzes desjenigen Rechtsträgers, dessen Gläubiger sie sind, nach § 19 Abs. 3 UmwG als bekannt gemacht gilt, ihren Anspruch nach Grund und Höhe schriftlich anmelden, Sicherheit zu leisten, soweit sie nicht Befriedigung verlangen können. Dieses Recht steht den Gläubigern jedoch nur zu, wenn sie glaubhaft machen, dass durch die formwechselnde Umwandlung die Erfüllung der Forderung gefährdet wird."
    },
    {
      "date": "2025-02-19",
      "id": "101720",
      "original_text": "Löschungsankündigung\nNiedersachsen Amtsgericht Braunschweig HRB 209943\nWK Wasserstoff GmbH – Bad Harzburg",
      "type": "Löschungsankündigung",
      "state": "Niedersachsen",
      "amtsgericht": "Amtsgericht Braunschweig",
      "registernummer": "HRB 209943",
      "registerart": "HRB",
      "company_name": "WK Wasserstoff GmbH",
      "company_seat": "Bad Harzburg",
      "details": "19.02.2025 (Bekanntmachungsdatum)\n\nNiedersachsen Amtsgericht Braunschweig HRB 209943\nLöschungsankündigung\n\nWK Wasserstoff GmbH\nGesellschaft mit beschränkter Haftung\nBad Harzburg\n\nDas Registergericht beabsichtigt, die Gesellschaft von Amts wegen nach § 394 FamFG zu löschen. Die Frist zur Erhebung eines Widerspruchs ist auf 1 Monat ab dieser Registerbekanntmachung festgesetzt."
    },
    {
      "date": "2025-02-19",
      "id": "101721",
      "original_text": "Löschungsankündigung\nBremen Amtsgericht Bremen HRA 28988\nFC 10. Grundstücks GmbH & Co. KG – Bremen",
      "type": "Löschungsankündigung",
      "state": "Bremen",
      "amtsgericht": "Amtsgericht Bremen",
      "registernummer": "HRA 28988",
      "registerart": "HRA",
      "company_name": "FC 10. Grundstücks GmbH & Co. KG",
      "company_seat": "Bremen",
      "details": "19.02.2025 (Bekanntmachungsdatum)\n\nBremen Amtsgericht Bremen HRA 28988\nLöschungsankündigung\n\nFC 10. Grundstücks GmbH & Co. KG\nKommanditgesellschaft\nBremen\n\nEs ist beabsichtigt die im Handelsregister eingetragene Gesellschaft von Amts wegen gemäß § 394 FamFG zu löschen. Gegen die Löschung kann beim AG Bremen schriftlich oder zu Protokoll der Geschäftsstelle Widerspruch eingelegt werden. Widerspruchsfrist 4 Wochen."
    },
    {
      "date": "2025-02-19",
      "id": "101722",
      "original_text": "Löschungsankündigung\nBremen Amtsgericht Bremen HRB 36182\nFC 10. Verwaltungs GmbH – Bremen",
      "type": "Löschungsankündigung",
      "state": "Bremen",
      "amtsgericht": "Amtsgericht Bremen",
      "registernummer": "HRB 36182",
      "registerart": "HRB",
      "company_name": "FC 10. Verwaltungs GmbH",
      "company_seat": "Bremen",
      "details": "19.02.2025 (Bekanntmachungsdatum)\n\nBremen Amtsgericht Bremen HRB 36182\nLöschungsankündigung\n\nFC 10. Verwaltungs GmbH\nGesellschaft mit beschränkter Haftung\nBremen\n\nEs ist beabsichtigt die im Handelsregister eingetragene Gesellschaft von Amts wegen gemäß § 394 FamFG zu löschen. Gegen die Löschung kann beim AG Bremen schriftlich oder zu Protokoll der Geschäftsstelle Widerspruch eingelegt werden. Widerspruchsfrist 4 Wochen."
    },
    {
      "date": "2025-02-19",
      "id": "101723",
      "original_text": "Löschungsankündigung\nBremen Amtsgericht Bremen HRB 23600\nPPD Privater Postdienst GmbH – Bremen",
      "type": "Löschungsankündigung",
      "state": "Bremen",
      "amtsgericht": "Amtsgericht Bremen",
      "registernummer": "HRB 23600",
      "registerart": "HRB",
      "company_name": "PPD Privater Postdienst GmbH",
      "company_seat": "Bremen",
      "details": "19.02.2025 (Bekanntmachungsdatum)\n\nBremen Amtsgericht Bremen HRB 23600\nLöschungsankündigung\n\nPPD Privater Postdienst GmbH\nGesellschaft mit beschränkter Haftung\nBremen\n\nEs ist beabsichtigt die im Handelsregister eingetragene Gesellschaft von Amts wegen gemäß § 394 FamFG zu löschen. Gegen die Löschung kann beim AG Bremen schriftlich oder zu Protokoll der Geschäftsstelle Widerspruch eingelegt werden. Widerspruchsfrist 4 Wochen."
    },
    {
      "date": "2025-02-19",
      "id": "101724",
      "original_text": "Löschungsankündigung\nBremen Amtsgericht Bremen HRB 35296\nHülk Beteiligungsverwaltung UG (haftungsbeschränkt) – Bremen",
      "type": "Löschungsankündigung",
      "state": "Bremen",
      "amtsgericht": "Amtsgericht Bremen",
      "registernummer": "HRB 35296",
      "registerart": "HRB",
      "company_name": "Hülk Beteiligungsverwaltung UG (haftungsbeschränkt)",
      "company_seat": "Bremen",
      "details": "19.02.2025 (Bekanntmachungsdatum)\n\nBremen Amtsgericht Bremen HRB 35296\nLöschungsankündigung\n\nHülk Beteiligungsverwaltung UG (haftungsbeschränkt)\nGesellschaft mit beschränkter Haftung\nBremen\n\nEs ist beabsichtigt die im Handelsregister eingetragene Gesellschaft von Amts wegen gemäß § 394 FamFG zu löschen. Gegen die Löschung kann beim AG Bremen schriftlich oder zu Protokoll der Geschäftsstelle Widerspruch eingelegt werden. Widerspruchsfrist 4 Wochen."
    },
    {
      "date": "2025-02-19",
      "id": "101725",
      "original_text": "Löschungsankündigung\nBremen Amtsgericht Bremen HRB 35767\nHülk Lacus GmbH – Bremen",
      "type": "Löschungsankündigung",
      "state": "Bremen",
      "amtsgericht": "Amtsgericht Bremen",
      "registernummer": "HRB 35767",
      "registerart": "HRB",
      "company_name": "Hülk Lacus GmbH",
      "company_seat": "Bremen",
      "details": "19.02.2025 (Bekanntmachungsdatum)\n\nBremen Amtsgericht Bremen HRB 35767\nLöschungsankündigung\n\nHülk Lacus GmbH\nGesellschaft mit beschränkter Haftung\nBremen\n\nEs ist beabsichtigt die im Handelsregister eingetragene Gesellschaft von Amts wegen gemäß § 394 FamFG zu löschen. Gegen die Löschung kann beim AG Bremen schriftlich oder zu Protokoll der Geschäftsstelle Widerspruch eingelegt werden. Widerspruchsfrist 4 Wochen."
    },
    {
      "date": "2025-02-19",
      "id": "101726",
      "original_text": "Einreichung neuer Dokumente\nRheinland-Pfalz Amtsgericht Montabaur HRB 23963\n1&1 Telecommunication SE – Montabaur",
      "type": "Einreichung neuer Dokumente",
      "state": "Rheinland-Pfalz",
      "amtsgericht": "Amtsgericht Montabaur",
      "registernummer": "HRB 23963",
      "registerart": "HRB",
      "company_name": "1&1 Telecommunication SE",
      "company_seat": "Montabaur",
      "details": "19.02.2025 (Bekanntmachungsdatum)\n\nRheinland-Pfalz Amtsgericht Montabaur HRB 23963\nEinreichung neuer Dokumente 19.02.2025 (Eintragungsdatum)\n\n1&1 Telecommunication SE\nEuropäische Aktiengesellschaft (SE)\nMontabaur\n\nDem Registergericht ist eine neue Liste der Mitglieder des Aufsichtsrates eingereicht worden."
    },
    {
      "date": "2025-02-19",
      "id": "101727",
      "original_text": "Registerbekanntmachung nach dem Umwandlungsgesetz\nRheinland-Pfalz Amtsgericht Montabaur HRB 29562\nAndreas Saal Maschinenbau GmbH – Montabaur",
      "type": "Registerbekanntmachung nach dem Umwandlungsgesetz",
      "state": "Rheinland-Pfalz",
      "amtsgericht": "Amtsgericht Montabaur",
      "registernummer": "HRB 29562",
      "registerart": "HRB",
      "company_name": "Andreas Saal Maschinenbau GmbH",
      "company_seat": "Montabaur",
      "details": "19.02.2025 (Bekanntmachungsdatum)\n\nRheinland-Pfalz Amtsgericht Montabaur HRB 29562\nRegisterbekanntmachung nach dem Umwandlungsgesetz 19.02.2025 (Eintragungsdatum)\n\nAndreas Saal Maschinenbau GmbH\nGesellschaft mit beschränkter Haftung\nMontabaur\n\nAls nicht eingetragen wird veröffentlicht: Den Gläubigern der an der Ausgliederung beteiligten Rechtsträger ist, wenn sie binnen sechs Monaten nach dem Tag, an dem die Eintragung der Ausgliederung in das Register des Sitzes desjenigen Rechtsträgers, dessen Gläubiger sie sind, nach § 19 Abs. 3 UmwG als bekannt gemacht gilt, ihren Anspruch nach Grund und Höhe schriftlich anmelden, Sicherheit zu leisten, soweit sie nicht Befriedigung verlangen können. Dieses Recht steht den Gläubigern jedoch nur zu, wenn sie glaubhaft machen, dass durch die Ausgliederung die Erfüllung der Forderung gefährdet wird."
    },
    {
      "date": "2025-02-19",
      "id": "101728",
      "original_text": "Löschungsankündigung\nRheinland-Pfalz Amtsgericht Landau HRB 31425\nPalmers GREEN & Irish Pub Betriebsgesellschaft mbH – Landau in der Pfalz",
      "type": "Löschungsankündigung",
      "state": "Rheinland-Pfalz",
      "amtsgericht": "Amtsgericht Landau",
      "registernummer": "HRB 31425",
      "registerart": "HRB",
      "company_name": "Palmers GREEN & Irish Pub Betriebsgesellschaft mbH",
      "company_seat": "Landau in der Pfalz",
      "details": "19.02.2025 (Bekanntmachungsdatum)\n\nRheinland-Pfalz Amtsgericht Landau HRB 31425\nLöschungsankündigung\n\nPalmers GREEN & Irish Pub Betriebsgesellschaft mbH\nGesellschaft mit beschränkter Haftung\nLandau in der Pfalz\n\nDas Registergericht beabsichtigt die Gesellschaft von Amts wegen nach § 394 FamFG zu löschen. Die Frist zur Erhebung eines Widerspruchs ist auf einen Monat festgesetzt."
    },
    {
      "date": "2025-02-19",
      "id": "101729",
      "original_text": "Registerbekanntmachung nach dem Umwandlungsgesetz\nRheinland-Pfalz Amtsgericht Montabaur HRB 1472\nSchmehmann Rohrverformungstechnik GmbH – Bad Marienberg",
      "type": "Registerbekanntmachung nach dem Umwandlungsgesetz",
      "state": "Rheinland-Pfalz",
      "amtsgericht": "Amtsgericht Montabaur",
      "registernummer": "HRB 1472",
      "registerart": "HRB",
      "company_name": "Schmehmann Rohrverformungstechnik GmbH",
      "company_seat": "Bad Marienberg",
      "details": "19.02.2025 (Bekanntmachungsdatum)\n\nRheinland-Pfalz Amtsgericht Montabaur HRB 1472\nRegisterbekanntmachung nach dem Umwandlungsgesetz 19.02.2025 (Eintragungsdatum)\n\nSchmehmann Rohrverformungstechnik GmbH\nGesellschaft mit beschränkter Haftung\nBad Marienberg\n\nAls nicht eingetragen wird veröffentlicht: Den Gläubigern der an der Verschmelzung beteiligten Rechtsträger ist, wenn sie binnen sechs Monaten nach dem Tag, an dem die Eintragung der Verschmelzung in das Register des Sitzes desjenigen Rechtsträgers, dessen Gläubiger sie sind, nach § 19 Abs. 3 UmwG als bekannt gemacht gilt, ihren Anspruch nach Grund und Höhe schriftlich anmelden, Sicherheit zu leisten, soweit sie nicht Befriedigung verlangen können. Dieses Recht steht den Gläubigern jedoch nur zu, wenn sie glaubhaft machen, dass durch die Verschmelzung die Erfüllung der Forderung gefährdet wird."
    },
    {
      "date": "2025-02-19",
      "id": "101730",
      "original_text": "Registerbekanntmachung nach dem Umwandlungsgesetz\nRheinland-Pfalz Amtsgericht Montabaur HRB 1127\nSchmehmann Rohrverformungstechnik GmbH – Bad Marienberg",
      "type": "Registerbekanntmachung nach dem Umwandlungsgesetz",
      "state": "Rheinland-Pfalz",
      "amtsgericht": "Amtsgericht Montabaur",
      "registernummer": "HRB 1127",
      "registerart": "HRB",
      "company_name": "Schmehmann Rohrverformungstechnik GmbH",
      "company_seat": "Bad Marienberg",
      "details": "19.02.2025 (Bekanntmachungsdatum)\n\nRheinland-Pfalz Amtsgericht Montabaur HRB 1127\nRegisterbekanntmachung nach dem Umwandlungsgesetz 19.02.2025 (Eintragungsdatum)\n\nSchmehmann Rohrverformungstechnik GmbH\nGesellschaft mit beschränkter Haftung\nBad Marienberg\n\nAls nicht eingetragen wird veröffentlicht: Den Gläubigern der an der Verschmelzung beteiligten Rechtsträger ist, wenn sie binnen sechs Monaten nach dem Tag, an dem die Eintragung der Verschmelzung in das Register des Sitzes desjenigen Rechtsträgers,dessen Gläubiger sie sind, nach § 19 Abs. 3 UmwG als bekannt gemacht gilt, ihren Anspruch nach Grund und Höhe schriftlich anmelden, Sicherheit zu leisten, soweit sie nicht Befriedigung verlangen können. Dieses Recht steht den Gläubigern jedoch nur zu, wenn sie glaubhaft machen, dass durch die Verschmelzung die Erfüllungd er Forderung gefährdet wird."
    },
    {
      "date": "2025-02-19",
      "id": "101731",
      "original_text": "Löschungsankündigung\nRheinland-Pfalz Amtsgericht Ludwigshafen a.Rhein (Ludwigshafen) HRB 67307\nDawa Handel UG (haftungsbeschränkt) – Ludwigshafen",
      "type": "Löschungsankündigung",
      "state": "Rheinland-Pfalz",
      "amtsgericht": "Amtsgericht Ludwigshafen a.Rhein (Ludwigshafen)",
      "registernummer": "HRB 67307",
      "registerart": "HRB",
      "company_name": "Dawa Handel UG (haftungsbeschränkt)",
      "company_seat": "Ludwigshafen",
      "details": "19.02.2025 (Bekanntmachungsdatum)\n\nRheinland-Pfalz Amtsgericht Ludwigshafen a.Rhein (Ludwigshafen) HRB 67307\nLöschungsankündigung\n\nDawa Handel UG (haftungsbeschränkt)\nGesellschaft mit beschränkter Haftung\nLudwigshafen\n\nDas Registergericht beabsichtigt die Gesellschaft von Amts wegen nach § 394 FamFG zu löschen. Die Frist zur Erhebung eines Widerspruchs ist auf einen Monat festgesetzt."
    },
    {
      "date": "2025-02-19",
      "id": "101732",
      "original_text": "Löschungsankündigung\nRheinland-Pfalz Amtsgericht Ludwigshafen a.Rhein (Ludwigshafen) HRB 68307\nSOHO UG (haftungsbeschränkt) – Ludwigshafen am Rhein",
      "type": "Löschungsankündigung",
      "state": "Rheinland-Pfalz",
      "amtsgericht": "Amtsgericht Ludwigshafen a.Rhein (Ludwigshafen)",
      "registernummer": "HRB 68307",
      "registerart": "HRB",
      "company_name": "SOHO UG (haftungsbeschränkt)",
      "company_seat": "Ludwigshafen am Rhein",
      "details": "19.02.2025 (Bekanntmachungsdatum)\n\nRheinland-Pfalz Amtsgericht Ludwigshafen a.Rhein (Ludwigshafen) HRB 68307\nLöschungsankündigung\n\nSOHO UG (haftungsbeschränkt)\nGesellschaft mit beschränkter Haftung\nLudwigshafen am Rhein\n\nDas Registergericht beabsichtigt die Gesellschaft von Amts wegen nach § 394 FamFG zu löschen. Die Frist zur Erhebung eines Widerspruchs ist auf einen Monat festgesetzt."
    },
    {
      "date": "2025-02-19",
      "id": "101733",
      "original_text": "Löschungsankündigung\nNordrhein-Westfalen Amtsgericht Wuppertal HRA 18018\nKönig & Hohmann und Otto Lübeck GmbH & Co KG – Remscheid",
      "type": "Löschungsankündigung",
      "state": "Nordrhein-Westfalen",
      "amtsgericht": "Amtsgericht Wuppertal",
      "registernummer": "HRA 18018",
      "registerart": "HRA",
      "company_name": "König & Hohmann und Otto Lübeck GmbH & Co KG",
      "company_seat": "Remscheid",
      "details": "19.02.2025 (Bekanntmachungsdatum)\n\nNordrhein-Westfalen Amtsgericht Wuppertal HRA 18018\nLöschungsankündigung\n\nKönig & Hohmann und Otto Lübeck GmbH & Co KG\nKommanditgesellschaft\nRemscheid\n\nDas Registergericht beabsichtigt die Firma von Amts wegen nach § 393 FamFG zu löschen. Die Frist zur Erhebung eines Widerspruchs ist auf drei Monate festgesetzt."
    },
    {
      "date": "2025-02-19",
      "id": "101734",
      "original_text": "Löschungsankündigung\nNordrhein-Westfalen Amtsgericht Siegen HRB 8441\nCarl Schreiber Holding GmbH – Neunkirchen",
      "type": "Löschungsankündigung",
      "state": "Nordrhein-Westfalen",
      "amtsgericht": "Amtsgericht Siegen",
      "registernummer": "HRB 8441",
      "registerart": "HRB",
      "company_name": "Carl Schreiber Holding GmbH",
      "company_seat": "Neunkirchen",
      "details": "19.02.2025 (Bekanntmachungsdatum)\n\nNordrhein-Westfalen Amtsgericht Siegen HRB 8441\nLöschungsankündigung\n\nCarl Schreiber Holding GmbH\nGesellschaft mit beschränkter Haftung\nNeunkirchen\n\nDas Registergericht beabsichtigt die Gesellschaft von Amts wegen nach § 394 FamFG zu löschen. Die Frist zur Erhebung eines Widerspruchs ist auf drei Monate festgesetzt."
    },
    {
      "date": "2025-02-19",
      "id": "101735",
      "original_text": "Löschungsankündigung\nNordrhein-Westfalen Amtsgericht Siegen HRB 8263\nWAGA Galvanotechnik GmbH – Kreuztal-Eichen",
      "type": "Löschungsankündigung",
      "state": "Nordrhein-Westfalen",
      "amtsgericht": "Amtsgericht Siegen",
      "registernummer": "HRB 8263",
      "registerart": "HRB",
      "company_name": "WAGA Galvanotechnik GmbH",
      "company_seat": "Kreuztal-Eichen",
      "details": "19.02.2025 (Bekanntmachungsdatum)\n\nNordrhein-Westfalen Amtsgericht Siegen HRB 8263\nLöschungsankündigung\n\nWAGA Galvanotechnik GmbH\nGesellschaft mit beschränkter Haftung\nKreuztal-Eichen\n\nDas Registergericht beabsichtigt die Gesellschaft von Amts wegen nach § 394 FamFG zu löschen. Die Frist zur Erhebung eines Widerspruchs ist auf drei Monate festgesetzt."
    },
    {
      "date": "2025-02-19",
      "id": "101736",
      "original_text": "Löschungsankündigung\nNordrhein-Westfalen Amtsgericht Siegen HRB 5792\nNT + C Network Training and Consulting GmbH – Siegen",
      "type": "Löschungsankündigung",
      "state": "Nordrhein-Westfalen",
      "amtsgericht": "Amtsgericht Siegen",
      "registernummer": "HRB 5792",
      "registerart": "HRB",
      "company_name": "NT + C Network Training and Consulting GmbH",
      "company_seat": "Siegen",
      "details": "19.02.2025 (Bekanntmachungsdatum)\n\nNordrhein-Westfalen Amtsgericht Siegen HRB 5792\nLöschungsankündigung\n\nNT + C Network Training and Consulting GmbH\nGesellschaft mit beschränkter Haftung\nSiegen\n\nDas Registergericht beabsichtigt die Gesellschaft von Amts wegen nach § 394 FamFG zu löschen. Die Frist zur Erhebung eines Widerspruchs ist auf drei Monate festgesetzt."
    },
    {
      "date": "2025-02-19",
      "id": "101737",
      "original_text": "Registerbekanntmachung nach dem Umwandlungsgesetz\nNordrhein-Westfalen Amtsgericht Paderborn HRB 1046\nOskar Vogel GmbH Güternah- und Fernverkehr – Paderborn",
      "type": "Registerbekanntmachung nach dem Umwandlungsgesetz",
      "state": "Nordrhein-Westfalen",
      "amtsgericht": "Amtsgericht Paderborn",
      "registernummer": "HRB 1046",
      "registerart": "HRB",
      "company_name": "Oskar Vogel GmbH Güternah- und Fernverkehr",
      "company_seat": "Paderborn",
      "details": "19.02.2025 (Bekanntmachungsdatum)\n\nNordrhein-Westfalen Amtsgericht Paderborn HRB 1046\nRegisterbekanntmachung nach dem Umwandlungsgesetz 19.02.2025 (Eintragungsdatum)\n\nOskar Vogel GmbH Güternah- und Fernverkehr\nGesellschaft mit beschränkter Haftung\nPaderborn\n\nDen Gläubigern der an der Abspaltung beteiligten Rechtsträger ist, wenn sie binnen sechs Monaten nach dem Tag, an dem die Eintragung der Abspaltung in das Register des Sitzes desjenigen Rechtsträgers, dessen Gläubiger sie sind, nach § 19 Absatz 3 UmwG als bekanntgemacht gilt, ihren Anspruch nach Grund und Höhe schriftlich anmelden, Sicherheit zu leisten, soweit sie nicht Befriedigung verlangen können. Dieses Recht steht den Gläubigern jedoch nur zu, wenn sie glaubhaft machen, dass durch die Abspaltung die Erfüllung ihrer Forderung gefährdet wird."
    },
    {
      "date": "2025-02-19",
      "id": "101738",
      "original_text": "Löschungsankündigung\nNordrhein-Westfalen Amtsgericht Siegburg HRB 17847\nEcoherb UG (haftungsbeschränkt) – Bad Honnef",
      "type": "Löschungsankündigung",
      "state": "Nordrhein-Westfalen",
      "amtsgericht": "Amtsgericht Siegburg",
      "registernummer": "HRB 17847",
      "registerart": "HRB",
      "company_name": "Ecoherb UG (haftungsbeschränkt)",
      "company_seat": "Bad Honnef",
      "details": "19.02.2025 (Bekanntmachungsdatum)\n\nNordrhein-Westfalen Amtsgericht Siegburg HRB 17847\nLöschungsankündigung\n\nEcoherb UG (haftungsbeschränkt)\nGesellschaft mit beschränkter Haftung\nBad Honnef\n\nDas Registergericht hat glaubhafte Kenntnis erlangt, dass die Gesellschaft vermögenslos geworden ist.\n\nEs ist daher beabsichtigt, die Gesellschaft nach § 394 FamFG im Handelsregister wegen Vermögenslosigkeit zu löschen.\nEinwände gegen die Löschung sind durch Widerspruch binnen einer Frist von 3 Monaten geltend zu machen, andernfalls die Löschung erfolgen wird.\n\nEinzulegen ist der Widerspruch bei dem Amtsgericht Siegburg, Neue Poststraße 16, 53721 Siegburg, und zwar entweder schriftlich in deutscher Sprache oder mündlich zur Niederschrift der Geschäftsstelle. Der Widerspruch kann auch zur Niederschrift der Geschäftsstelle eines jeden Amtsgerichts abgegeben werden. Der Widerspruch ist binnen der in der Verfügung bestimmten Frist einzulegen. Die Frist ist nur gewahrt, wenn der Widerspruch rechtzeitig bei dem Amtsgericht Siegburg eingeht, auch wenn der Widerspruch zur Niederschrift der Geschäftsstelle eines anderen Amtsgerichts abgegeben wurde. Die Frist beginnt jeweils mit der schriftlichen Bekanntgabe der Verfügung an die Beteiligten. Kann die schriftliche Bekanntgabe an einen Beteiligten nicht bewirkt werden, beginnt die Frist spätestens mit Ablauf von fünf Monaten nach Erlass der Verfügung. Die Bekanntgabe ist entweder durch Zustellung oder am dritten Tage nach Aufgabe zur Post bewirkt. Sofern die Löschung noch nicht erfolgt ist, kann der Widerspruch auch noch nach Ablauf der Frist eingelegt werden. Fällt das Ende der Frist auf einen Sonnabend, einen Sonntag oder einen allgemeinen Feiertag, endet die Frist mit Ablauf des nächsten Werktages. Der Widerspruch ist zu unterzeichnen. Eine Begründung des Widerspruchs ist nicht vorgeschrieben."
    },
    {
      "date": "2025-02-19",
      "id": "101739",
      "original_text": "Registerbekanntmachung nach dem Umwandlungsgesetz\nNordrhein-Westfalen Amtsgericht Düren HRB 8711\nPreuss Grundbesitz UG (haftungsbeschränkt) – Nörvenich",
      "type": "Registerbekanntmachung nach dem Umwandlungsgesetz",
      "state": "Nordrhein-Westfalen",
      "amtsgericht": "Amtsgericht Düren",
      "registernummer": "HRB 8711",
      "registerart": "HRB",
      "company_name": "Preuss Grundbesitz UG (haftungsbeschränkt)",
      "company_seat": "Nörvenich",
      "details": "19.02.2025 (Bekanntmachungsdatum)\n\nNordrhein-Westfalen Amtsgericht Düren HRB 8711\nRegisterbekanntmachung nach dem Umwandlungsgesetz 19.02.2025 (Eintragungsdatum)\n\nPreuss Grundbesitz UG (haftungsbeschränkt)\nGesellschaft mit beschränkter Haftung\nNörvenich\n\nDen Gläubigern der an der Verschmelzung beteiligten Rechtsträger ist, wenn sie binnen sechs Monaten nach dem Tag, an dem die Eintragung der Verschmelzung in das Register des Sitzes desjenigen Rechtsträgers, dessen Gläubiger sie sind, nach § 19 Absatz 3 UmwG als bekanntgemacht gilt, ihren Anspruch nach Grund und Höhe schriftlich anmelden, Sicherheit zu leisten, soweit sie nicht Befriedigung verlangen können. Dieses Recht steht den Gläubigern jedoch nur zu, wenn sie glaubhaft machen, dass durch die Verschmelzung die Erfüllung ihrer Forderung gefährdet wird."
    },
    {
      "date": "2025-02-19",
      "id": "101740",
      "original_text": "Löschungsankündigung\nNordrhein-Westfalen Amtsgericht Düren HRB 8283\nBau & Haus GmbH – Linnich",
      "type": "Löschungsankündigung",
      "state": "Nordrhein-Westfalen",
      "amtsgericht": "Amtsgericht Düren",
      "registernummer": "HRB 8283",
      "registerart": "HRB",
      "company_name": "Bau & Haus GmbH",
      "company_seat": "Linnich",
      "details": "19.02.2025 (Bekanntmachungsdatum)\n\nNordrhein-Westfalen Amtsgericht Düren HRB 8283\nLöschungsankündigung\n\nBau & Haus GmbH\nGesellschaft mit beschränkter Haftung\nLinnich\n\nDas Registergericht beabsichtigt die Gesellschaft von Amts wegen nach § 394 FamFG zu löschen. Die Frist zur Erhebung eines Widerspruchs ist auf drei Monate festgesetzt."
    },
    {
      "date": "2025-02-19",
      "id": "101741",
      "original_text": "Löschungsankündigung\nNordrhein-Westfalen Amtsgericht Düsseldorf HRA 15388\nGustav Baum Brunnenbau GmbH & Co. KG. – Ratingen",
      "type": "Löschungsankündigung",
      "state": "Nordrhein-Westfalen",
      "amtsgericht": "Amtsgericht Düsseldorf",
      "registernummer": "HRA 15388",
      "registerart": "HRA",
      "company_name": "Gustav Baum Brunnenbau GmbH & Co. KG.",
      "company_seat": "Ratingen",
      "details": "19.02.2025 (Bekanntmachungsdatum)\n\nNordrhein-Westfalen Amtsgericht Düsseldorf HRA 15388\nLöschungsankündigung\n\nGustav Baum Brunnenbau GmbH & Co. KG.\nKommanditgesellschaft\nRatingen\n\nEs ist beabsichtigt, die Gesellschaft wegen Vermögenslosigkeit aufgrund des § 394 Abs. 4 FamFG zu löschen, da offenbar keine Vermögenswerte mehr vorhanden sind und bereits die persönlich haftende Gesellschafterin wegen Vermögenslosigkeit gelöscht worden ist.\nFrist zur Geltendmachung eines Widerspruchs: 1 Monat.\n\nRechtsbehelfsbelehrung:\nDas Widerspruchsrecht steht jedem zu, der an der Unterlassung der Löschung ein berechtigtes Interesse hat. Der Widerspruch ist bei dem Amtsgericht Düsseldorf -Registergericht-, Werdener Straße 1, 40227 Düsseldorf schriftlich in deutscher Sprache oder zur Niederschrift der Geschäftsstelle einzulegen. Der Widerspruch kann auch zur Niederschrift der Geschäftsstelle eines jeden Amtsgerichtes abgegeben werden. Die Einlegung ist auch durch Übertragung eines elektronischen Dokuments an die elektronische Poststelle des Gerichts möglich. Das elektronische Dokument muss für die Bearbeitung durch das Gericht geeignet und mit einer qualifizierten elektronischen Signatur der verantwortenden Person versehen sein oder von der verantwortenden Person signiert und auf einem sicheren Übermittlungsweg gemäß § 130a ZPO nach näherer Maßgabe der Verordnung über die technischen Rahmenbedingungen des elektronischen Rechtsverkehrs und über das besondere elektronische Behördenpostfach (BGBl. I, S.3803) eingereicht werden. Weitere Informationen erhalten Sie auf der Internetseite www.justiz.de.\nDer Widerspruch muss spätestens innerhalb der gesetzten Frist nach dem Datum der Bekanntmachung der Löschungsankündigung bei dem Amtsgericht - Registergericht - Düsseldorf eingegangen sein.  Dies gilt auch dann, wenn der Widerspruch zur Niederschrift der Geschäftsstelle eines anderen Amtsgerichtes abgegeben wurde. Die Frist beginnt mit dem Tage der Bekanntmachung der Löschungsankündigung in dem für die Bekanntmachung der Eintragungen in das Handelsregister bestimmten elektronischen Informations- und Kommunikationssystem nach § 10 des Handelsgesetzbuches. Fällt das Ende der Frist auf einen Sonntag, einen allgemeinen Feiertag oder Sonnabend, so endet die Frist mit Ablauf des nächsten Werktages.\nDer Widerspruch muss die Bezeichnung der angefochtenen Löschungsankündigung sowie die Erklärung enthalten, dass Widerspruch gegen diese Löschungsankündigung eingelegt wird. Er ist zu unterzeichnen und soll begründet werden."
    },
    {
      "date": "2025-02-19",
      "id": "101742",
      "original_text": "Registerbekanntmachung nach dem Umwandlungsgesetz\nNordrhein-Westfalen Amtsgericht Siegen HRB 12322\nDietmar Heimes Management GmbH – Lennestadt",
      "type": "Registerbekanntmachung nach dem Umwandlungsgesetz",
      "state": "Nordrhein-Westfalen",
      "amtsgericht": "Amtsgericht Siegen",
      "registernummer": "HRB 12322",
      "registerart": "HRB",
      "company_name": "Dietmar Heimes Management GmbH",
      "company_seat": "Lennestadt",
      "details": "19.02.2025 (Bekanntmachungsdatum)\n\nNordrhein-Westfalen Amtsgericht Siegen HRB 12322\nRegisterbekanntmachung nach dem Umwandlungsgesetz 19.02.2025 (Eintragungsdatum)\n\nDietmar Heimes Management GmbH\nGesellschaft mit beschränkter Haftung\nLennestadt\n\nDen Gläubigern der an der Verschmelzung beteiligten Rechtsträger ist, wenn sie binnen sechs Monaten nach dem Tag, an dem die Eintragung der Verschmelzung in das Register des Sitzes desjenigen Rechtsträgers, dessen Gläubiger sie sind, nach § 19 Absatz 3 UmwG als bekanntgemacht gilt, ihren Anspruch nach Grund und Höhe schriftlich anmelden, Sicherheit zu leisten, soweit sie nicht Befriedigung verlangen können. Dieses Recht steht den Gläubigern jedoch nur zu, wenn sie glaubhaft machen, dass durch die Verschmelzung die Erfüllung ihrer Forderung gefährdet wird."
    },
    {
      "date": "2025-02-19",
      "id": "101743",
      "original_text": "Löschungsankündigung\nNordrhein-Westfalen Amtsgericht Wuppertal HRB 34428\nENTERTAIN INDUSTRY LIMITED Zweigniederlassung Deutschland – Velbert",
      "type": "Löschungsankündigung",
      "state": "Nordrhein-Westfalen",
      "amtsgericht": "Amtsgericht Wuppertal",
      "registernummer": "HRB 34428",
      "registerart": "HRB",
      "company_name": "ENTERTAIN INDUSTRY LIMITED Zweigniederlassung Deutschland",
      "company_seat": "Velbert",
      "details": "19.02.2025 (Bekanntmachungsdatum)\n\nNordrhein-Westfalen Amtsgericht Wuppertal HRB 34428\nLöschungsankündigung\n\nENTERTAIN INDUSTRY LIMITED Zweigniederlassung Deutschland\nRechtsform ausländischen Rechts HRB\nVelbert\n\nDas Registergericht beabsichtigt die Gesellschaft von Amts wegen nach § 395 FamFG zu löschen. Die Frist zur Erhebung eines Widerspruchs ist auf drei Monate festgesetzt."
    },
    {
      "date": "2025-02-19",
      "id": "101744",
      "original_text": "Löschungsankündigung\nNordrhein-Westfalen Amtsgericht Kleve HRB 12161\nCo2 NEUTRAAL UG (haftungsbeschränkt) – Kleve",
      "type": "Löschungsankündigung",
      "state": "Nordrhein-Westfalen",
      "amtsgericht": "Amtsgericht Kleve",
      "registernummer": "HRB 12161",
      "registerart": "HRB",
      "company_name": "Co2 NEUTRAAL UG (haftungsbeschränkt)",
      "company_seat": "Kleve",
      "details": "19.02.2025 (Bekanntmachungsdatum)\n\nNordrhein-Westfalen Amtsgericht Kleve HRB 12161\nLöschungsankündigung\n\nCo2 NEUTRAAL UG (haftungsbeschränkt)\nGesellschaft mit beschränkter Haftung\nKleve\n\nlDas Registergericht beabsichtigt die Gesellschaft von Amts wegen nach § 394 FamFG zu löschen. Die Frist zur Erhebung eines Widerspruchs ist auf einen Monat festgesetzt."
    },
    {
      "date": "2025-02-19",
      "id": "101745",
      "original_text": "Registerbekanntmachung nach dem Umwandlungsgesetz\nNordrhein-Westfalen Amtsgericht Paderborn HRB 5730\nDreifaltigkeits-Hospital gem. GmbH – Lippstadt",
      "type": "Registerbekanntmachung nach dem Umwandlungsgesetz",
      "state": "Nordrhein-Westfalen",
      "amtsgericht": "Amtsgericht Paderborn",
      "registernummer": "HRB 5730",
      "registerart": "HRB",
      "company_name": "Dreifaltigkeits-Hospital gem. GmbH",
      "company_seat": "Lippstadt",
      "details": "19.02.2025 (Bekanntmachungsdatum)\n\nNordrhein-Westfalen Amtsgericht Paderborn HRB 5730\nRegisterbekanntmachung nach dem Umwandlungsgesetz 19.02.2025 (Eintragungsdatum)\n\nDreifaltigkeits-Hospital gem. GmbH\nGesellschaft mit beschränkter Haftung\nLippstadt\n\nDen Gläubigern der an der Abspaltung beteiligten Rechtsträger ist, wenn sie binnen sechs Monaten nach dem Tag, an dem die Eintragung der Abspaltung in das Register des Sitzes desjenigen Rechtsträgers, dessen Gläubiger sie sind, nach § 19 Absatz 3 UmwG als bekanntgemacht gilt, ihren Anspruch nach Grund und Höhe schriftlich anmelden, Sicherheit zu leisten, soweit sie nicht Befriedigung verlangen können. Dieses Recht steht den Gläubigern jedoch nur zu, wenn sie glaubhaft machen, dass durch die Abspaltung die Erfüllung ihrer Forderung gefährdet wird."
    },
    {
      "date": "2025-02-19",
      "id": "101746",
      "original_text": "Einreichung neuer Dokumente\nNordrhein-Westfalen Amtsgericht Hamm HRB 557\nDRK-Senioren-Stift Hamm-Mark GmbH – Hamm",
      "type": "Einreichung neuer Dokumente",
      "state": "Nordrhein-Westfalen",
      "amtsgericht": "Amtsgericht Hamm",
      "registernummer": "HRB 557",
      "registerart": "HRB",
      "company_name": "DRK-Senioren-Stift Hamm-Mark GmbH",
      "company_seat": "Hamm",
      "details": "19.02.2025 (Bekanntmachungsdatum)\n\nNordrhein-Westfalen Amtsgericht Hamm HRB 557\nEinreichung neuer Dokumente 19.02.2025 (Eintragungsdatum)\n\nDRK-Senioren-Stift Hamm-Mark GmbH\nGesellschaft mit beschränkter Haftung\nHamm\n\nDem Registergericht ist eine neue Liste der Mitglieder des Aufsichtsrates eingereicht worden."
    },
    {
      "date": "2025-02-19",
      "id": "101747",
      "original_text": "Löschungsankündigung\nNordrhein-Westfalen Amtsgericht Bad Oeynhausen HRB 10604\nHUCKE BERLIN GmbH – Lübbecke",
      "type": "Löschungsankündigung",
      "state": "Nordrhein-Westfalen",
      "amtsgericht": "Amtsgericht Bad Oeynhausen",
      "registernummer": "HRB 10604",
      "registerart": "HRB",
      "company_name": "HUCKE BERLIN GmbH",
      "company_seat": "Lübbecke",
      "details": "19.02.2025 (Bekanntmachungsdatum)\n\nNordrhein-Westfalen Amtsgericht Bad Oeynhausen HRB 10604\nLöschungsankündigung\n\nHUCKE BERLIN GmbH\nGesellschaft mit beschränkter Haftung\nLübbecke\n\nDas Registergericht beabsichtigt die Gesellschaft von Amts wegen nach § 394 FamFG zu löschen. Die Frist zur Erhebung eines Widerspruchs ist auf zwei Monate festgesetzt."
    },
    {
      "date": "2025-02-19",
      "id": "101748",
      "original_text": "Löschungsankündigung\nNordrhein-Westfalen Amtsgericht Dortmund HRB 32950\nHYPO Solutions GmbH – Castrop-Rauxel",
      "type": "Löschungsankündigung",
      "state": "Nordrhein-Westfalen",
      "amtsgericht": "Amtsgericht Dortmund",
      "registernummer": "HRB 32950",
      "registerart": "HRB",
      "company_name": "HYPO Solutions GmbH",
      "company_seat": "Castrop-Rauxel",
      "details": "19.02.2025 (Bekanntmachungsdatum)\n\nNordrhein-Westfalen Amtsgericht Dortmund HRB 32950\nLöschungsankündigung\n\nHYPO Solutions GmbH\nGesellschaft mit beschränkter Haftung\nCastrop-Rauxel\n\nDas Registergericht beabsichtigt die Gesellschaft von Amts wegen nach § 394 FamFG zu löschen. Die Frist zur Erhebung eines Widerspruchs ist auf zwei Monate festgesetzt."
    },
    {
      "date": "2025-02-19",
      "id": "101749",
      "original_text": "Löschungsankündigung\nNordrhein-Westfalen Amtsgericht Siegburg HRB 12858\nEMBO Center GmbH – Eitorf",
      "type": "Löschungsankündigung",
      "state": "Nordrhein-Westfalen",
      "amtsgericht": "Amtsgericht Siegburg",
      "registernummer": "HRB 12858",
      "registerart": "HRB",
      "company_name": "EMBO Center GmbH",
      "company_seat": "Eitorf",
      "details": "19.02.2025 (Bekanntmachungsdatum)\n\nNordrhein-Westfalen Amtsgericht Siegburg HRB 12858\nLöschungsankündigung\n\nEMBO Center GmbH\nGesellschaft mit beschränkter Haftung\nEitorf\n\nDas Registergericht hat glaubhafte Kenntnis erlangt, dass die Gesellschaft vermögenslos geworden ist, da ein Insolvenzverfahren durchgeführt und nach § 200 InsO aufgehoben wurde.\n\nEs ist daher beabsichtigt, die Gesellschaft nach § 394 FamFG im Handelsregister wegen Vermögenslosigkeit zu löschen.\n\nEinwände gegen die Löschung sind durch Widerspruch binnen einer Frist von 3 Monaten geltend zu machen, andernfalls die Löschung erfolgen wird.\n\nEinzulegen ist der Widerspruch bei dem Amtsgericht Siegburg, Neue Poststraße 16, 53721 Siegburg, und zwar entweder schriftlich in deutscher Sprache oder mündlich zur Niederschrift der Geschäftsstelle. Der Widerspruch kann auch zur Niederschrift der Geschäftsstelle eines jeden Amtsgerichts abgegeben werden. Der Widerspruch ist binnen der in der Verfügung bestimmten Frist einzulegen. Die Frist ist nur gewahrt, wenn der Widerspruch rechtzeitig bei dem Amtsgericht Siegburg eingeht, auch wenn der Widerspruch zur Niederschrift der Geschäftsstelle eines anderen Amtsgerichts abgegeben wurde. Die Frist beginnt jeweils mit der schriftlichen Bekanntgabe der Verfügung an die Beteiligten. Kann die schriftliche Bekanntgabe an einen Beteiligten nicht bewirkt werden, beginnt die Frist spätestens mit Ablauf von fünf Monaten nach Erlass der Verfügung. Die Bekanntgabe ist entweder durch Zustellung oder am dritten Tage nach Aufgabe zur Post bewirkt. Sofern die Löschung noch nicht erfolgt ist, kann der Widerspruch auch noch nach Ablauf der Frist eingelegt werden. Fällt das Ende der Frist auf einen Sonnabend, einen Sonntag oder einen allgemeinen Feiertag, endet die Frist mit Ablauf des nächsten Werktages. Der Widerspruch ist zu unterzeichnen. Eine Begründung des Widerspruchs ist nicht vorgeschrieben."
    },
    {
      "date": "2025-02-19",
      "id": "101750",
      "original_text": "Sonstige Registerbekanntmachung\nNordrhein-Westfalen Amtsgericht Düsseldorf HRB 101307\nACM Deutschland Life AG – Düsseldorf",
      "type": "Sonstige Registerbekanntmachung",
      "state": "Nordrhein-Westfalen",
      "amtsgericht": "Amtsgericht Düsseldorf",
      "registernummer": "HRB 101307",
      "registerart": "HRB",
      "company_name": "ACM Deutschland Life AG",
      "company_seat": "Düsseldorf",
      "details": "19.02.2025 (Bekanntmachungsdatum)\n\nNordrhein-Westfalen Amtsgericht Düsseldorf HRB 101307\nSonstige Registerbekanntmachung\n\nACM Deutschland Life AG\nAktiengesellschaft\nDüsseldorf\n\nDem Registergericht ist eine Liste der Mitglieder des Aufsichtsrates eingereicht worden."
    },
    {
      "date": "2025-02-19",
      "id": "101751",
      "original_text": "Löschungsankündigung\nNordrhein-Westfalen Amtsgericht Dortmund HRB 31822\nAtes Bau UG (haftungsbeschränkt) – Dortmund",
      "type": "Löschungsankündigung",
      "state": "Nordrhein-Westfalen",
      "amtsgericht": "Amtsgericht Dortmund",
      "registernummer": "HRB 31822",
      "registerart": "HRB",
      "company_name": "Ates Bau UG (haftungsbeschränkt)",
      "company_seat": "Dortmund",
      "details": "19.02.2025 (Bekanntmachungsdatum)\n\nNordrhein-Westfalen Amtsgericht Dortmund HRB 31822\nLöschungsankündigung 19.02.2025 (Eintragungsdatum)\n\nAtes Bau UG (haftungsbeschränkt)\nGesellschaft mit beschränkter Haftung\nDortmund\n\nDas Registergericht beabsichtigt die Gesellschaft von Amts wegen nach § 394 FamFG zu löschen. Die Frist zur Erhebung eines Widerspruchs ist auf zwei Monate festgesetzt."
    },
    {
      "date": "2025-02-19",
      "id": "101752",
      "original_text": "Löschungsankündigung\nNordrhein-Westfalen Amtsgericht Siegen HRB 12062\nKeil Holding UG (haftungsbeschränkt) – Neunkirchen",
      "type": "Löschungsankündigung",
      "state": "Nordrhein-Westfalen",
      "amtsgericht": "Amtsgericht Siegen",
      "registernummer": "HRB 12062",
      "registerart": "HRB",
      "company_name": "Keil Holding UG (haftungsbeschränkt)",
      "company_seat": "Neunkirchen",
      "details": "19.02.2025 (Bekanntmachungsdatum)\n\nNordrhein-Westfalen Amtsgericht Siegen HRB 12062\nLöschungsankündigung\n\nKeil Holding UG (haftungsbeschränkt)\nGesellschaft mit beschränkter Haftung\nNeunkirchen\n\nDas Registergericht beabsichtigt die Gesellschaft von Amts wegen nach § 394 FamFG zu löschen. Die Frist zur Erhebung eines Widerspruchs ist auf drei Monate festgesetzt."
    },
    {
      "date": "2025-02-19",
      "id": "101753",
      "original_text": "Registerbekanntmachung nach dem Umwandlungsgesetz\nNordrhein-Westfalen Amtsgericht Krefeld HRB 10009\nTopcon Deutschland Medical GmbH – Willich",
      "type": "Registerbekanntmachung nach dem Umwandlungsgesetz",
      "state": "Nordrhein-Westfalen",
      "amtsgericht": "Amtsgericht Krefeld",
      "registernummer": "HRB 10009",
      "registerart": "HRB",
      "company_name": "Topcon Deutschland Medical GmbH",
      "company_seat": "Willich",
      "details": "19.02.2025 (Bekanntmachungsdatum)\n\nNordrhein-Westfalen Amtsgericht Krefeld HRB 10009\nRegisterbekanntmachung nach dem Umwandlungsgesetz\n\nTopcon Deutschland Medical GmbH\nGesellschaft mit beschränkter Haftung\nWillich\n\nDem Registergericht ist der Entwurf eines Verschmelzungsplanes über die geplante Verschmelzung der Gesellschaft mit beschränkter Haftung nach deutschem Recht unter Firma Topcon Deutschland Medical GmbH mit Sitz in Krefeld (Amtsgericht Krefeld, HRB 10009) mit der besloten vennootschap met beperkte aansprakelijkheid unter Firma Topcon Europe Medical B.V. mit Sitz in Rotterdam (niederländische Handelskammer, Nummer 24380056) eingereicht worden.\n\n1 a)\nDie Gesellschafterversammlung, die über die Zustimmung zum Verschmelzungsplan beschließen soll, darf nicht vor Ablauf eines Monats nach der Bekanntmachung des Entwurfs des Verschmelzungsplans durch das Register stattfinden.\n1 b)\nDie Anteilsinhaber und Gläubiger der an der grenzüberschreitenden Verschmelzung beteiligten Gesellschaften erhalten nach § 308 Abs. 1 Nr. 4a UmwG den Hinweis, dass sie spätestens fünf Tage vor dem Tag der Gesellschafterversammlung der jeweiligen Gesellschaft Bemerkungen zum Entwurf des Verschmelzungsplans übermitteln können.\nEs ist geplant, dass die Gesellschaftersammlung einen Monat nach der Bekanntmachung des Entwurfs des Verschmelzungsplans über die Zustimmung zum Verschmelzungsplan beschließt.\nDemnach endet die Übermittlungsfrist und erlischt das Anhörungsrecht im Sinne von § 308 Abs. 1 Nr. 4 UmwG fünf Tage vor jener Gesellschafterversammlung.\n1 c)\nDie zuständigen Betriebsräte der an der grenzüberschreitenden Verschmelzung beteiligten Gesellschaften oder, soweit es keinen Betriebsrat gibt, die Arbeitnehmer der beteiligten Gesellschaften erhalten den Hinweis, dass sie spätestens fünf Arbeitstage vor dem Tag der Gesellschafterversammlung der jeweiligen Gesellschaft Bemerkungen zum Entwurf des Verschmelzungsplans übermitteln können. Es gilt dieselbe Frist wie unter Ziff. 1 b.\n\n2. Die Anschrift, unter der Bemerkungen zum Verschmelzungsplan an Topcon Deutschland Medical GmbH übermittelt werden können, lautet: Topcon Deutschland Medical GmbH Hanns- Martin Schleyer Straße 41, 47877 Willich, Deutschland. E-Mail: Legalnotices ECB@topcon.com\n\n3. Die Anschrift, unter der Bemerkungen zum Verschmelzungsplan an Topcon Europe Medical B.V. übermittelt werden können, lautet: Postbus 145, 2900AC Capelle aan den IJssel, Niederlande. E-Mail: Legalnotices ECB@topcon.com"
    },
    {
      "date": "2025-02-19",
      "id": "101754",
      "original_text": "Löschungsankündigung\nNordrhein-Westfalen Amtsgericht Duisburg HRA 12161\nNASA Gastrokonzept GmbH & Co. KG – Duisburg",
      "type": "Löschungsankündigung",
      "state": "Nordrhein-Westfalen",
      "amtsgericht": "Amtsgericht Duisburg",
      "registernummer": "HRA 12161",
      "registerart": "HRA",
      "company_name": "NASA Gastrokonzept GmbH & Co. KG",
      "company_seat": "Duisburg",
      "details": "19.02.2025 (Bekanntmachungsdatum)\n\nNordrhein-Westfalen Amtsgericht Duisburg HRA 12161\nLöschungsankündigung\n\nNASA Gastrokonzept GmbH & Co. KG\nKommanditgesellschaft\nDuisburg\n\nDie bei dem Amtsgericht Duisburg im Handelsregister unter HRA 12161 eingetragene Gesellschaft NASA Gastrokonzept GmbH soll von Amts wegen gemäß §§ 31 Absatz 2, 6 HGB, § 393 FamFG gelöscht werden, da das Handelsgewerbe nicht mehr ausgeübt wird und eine Anmeldung des Erlöschens der Firma nicht erfolgt ist.  Hiergegen ist der Widerspruch binnen drei Monaten seit Zustellung zulässig. Geht innerhalb der Frist kein Widerspruch ein, wird die Firma gelöscht werden.\nGegen diese Verfügung kann Widerspruch eingelegt werden. Die Frist zur Erhebung eines Widerspruchs gegen die beabsichtigte Löschung von Amts wegen ist auf drei Monate festgesetzt. Rechtsbehelfsbelehrung Der Widerspruch ist bei dem Amtsgericht Duisburg, Kardinal-Galen-Str. 124-132, 47058 Duisburg schriftlich in deutscher Sprache oder zur Niederschrift der Geschäftsstelle einzulegen. Der Widerspruch kann auch zur Niederschrift der Geschäftsstelle eines jeden Amtsgerichtes abgegeben werden. Die Einlegung ist auch durch Übertragung eines elektronischen Dokuments an die elektronische Poststelle des Gerichts möglich. Das elektronische Dokument muss für die Bearbeitung durch das Gericht geeignet und mit einer qualifizierten elektronischen Signatur der verantwortenden Person versehen sein oder von der verantwortenden Person signiert und auf einem sicheren Übermittlungsweg gemäß § 130 a ZPO nach näherer Maßgabe der Verordnung über die technischen Rahmenbedingungen des elektronischen Rechtsverkehrs und über das besondere elektronische Behördenpostfach (BGBl. I, S. 3803) eingereicht werden. Weitere Informationen erhalten Sie auf der Internetseite www.justiz.de <http://www.justiz.de>. Der Widerspruch muss spätestens innerhalb der gesetzten Frist bei dem Amtsgericht Duisburg eingegangen sein. Dies gilt auch dann, wenn der Widerspruch zur Niederschrift der Geschäftsstelle eines anderen Amtsgerichtes abgegeben wurde. Die Frist beginnt mit der Veröffentlichung. Fällt das Ende der Frist auf einen Sonntag, einen allgemeinen Feiertag oder Sonnabend, so endet die Frist mit Ablauf des nächsten Werktages. Der Widerspruch muss die Bezeichnung der angefochtenen Verfügung sowie die Erklärung enthalten, dass Widerspruch gegen diese Verfügung eingelegt wird. Er ist zu unterzeichnen und soll begründet werden."
    },
    {
      "date": "2025-02-19",
      "id": "101755",
      "original_text": "Registerbekanntmachung nach dem Umwandlungsgesetz\nNordrhein-Westfalen Amtsgericht Siegen HRB 5915\nRayonex Biomedical GmbH – Lennestadt",
      "type": "Registerbekanntmachung nach dem Umwandlungsgesetz",
      "state": "Nordrhein-Westfalen",
      "amtsgericht": "Amtsgericht Siegen",
      "registernummer": "HRB 5915",
      "registerart": "HRB",
      "company_name": "Rayonex Biomedical GmbH",
      "company_seat": "Lennestadt",
      "details": "19.02.2025 (Bekanntmachungsdatum)\n\nNordrhein-Westfalen Amtsgericht Siegen HRB 5915\nRegisterbekanntmachung nach dem Umwandlungsgesetz 19.02.2025 (Eintragungsdatum)\n\nRayonex Biomedical GmbH\nGesellschaft mit beschränkter Haftung\nLennestadt\n\nDen Gläubigern der an der Verschmelzung beteiligten Rechtsträger ist, wenn sie binnen sechs Monaten nach dem Tag, an dem die Eintragung der Verschmelzung in das Register des Sitzes desjenigen Rechtsträgers, dessen Gläubiger sie sind, nach § 19 Absatz 3 UmwG als bekanntgemacht gilt, ihren Anspruch nach Grund und Höhe schriftlich anmelden, Sicherheit zu leisten, soweit sie nicht Befriedigung verlangen können. Dieses Recht steht den Gläubigern jedoch nur zu, wenn sie glaubhaft machen, dass durch die Verschmelzung die Erfüllung ihrer Forderung gefährdet wird."
    },
    {
      "date": "2025-02-19",
      "id": "101756",
      "original_text": "Löschungsankündigung\nNordrhein-Westfalen Amtsgericht Neuss HRB 22126\nMPM Auto & Moto GmbH – Korschenbroich",
      "type": "Löschungsankündigung",
      "state": "Nordrhein-Westfalen",
      "amtsgericht": "Amtsgericht Neuss",
      "registernummer": "HRB 22126",
      "registerart": "HRB",
      "company_name": "MPM Auto & Moto GmbH",
      "company_seat": "Korschenbroich",
      "details": "19.02.2025 (Bekanntmachungsdatum)\n\nNordrhein-Westfalen Amtsgericht Neuss HRB 22126\nLöschungsankündigung 18.02.2025 (Eintragungsdatum)\n\nMPM Auto & Moto GmbH\nGesellschaft mit beschränkter Haftung\nKorschenbroich\n\nDas Registergericht beabsichtigt die Gesellschaft von Amts wegen nach § 394 FamFG zu löschen. Die Frist zur Erhebung eines Widerspruchs ist auf einen Monat festgesetzt. Rechtsbehelfsbelehrung: Gegen diese Verfügung können Sie Widerspruch einlegen. Der Widerspruch ist bei dem Amtsgericht Neuss - Registergericht -, Breite Str. 48, 41460 Neuss schriftlich in deutscher Sprache oder zur Niederschrift der Geschäftsstelle einzulegen. Der Widerspruch kann auch zur Niederschrift der Geschäftsstelle eines jeden Amtsgerichtes abgegeben werden. Die Einlegung ist auch durch Übertragung eines elektronischen Dokuments an die elektronische Poststelle des Gerichts möglich. Das elektronische Dokument muss für die Bearbeitung durch das Gericht geeignet und mit einer qualifizierten elektronischen Signatur der verantwortenden Person versehen sein oder von der verantwortenden Person signiert und auf einem sicheren Übermittlungsweg gemäß § 130a ZPO nach näherer Maßgabe der Verordnung über die technischen Rahmenbedingungen des elektronischen Rechtsverkehrs und über das besondere elektronische Behördenpostfach (BGBl. I, S.3803) eingereicht werden. Weitere Informationen erhalten Sie auf der Internetseite www.justiz.de. Der Widerspruch muss spätestens innerhalb der gesetzten Frist nach der schriftlichen Bekanntgabe der Verfügung bei dem Amtsgericht - Registergericht - Neuss eingegangen sein. Dies gilt auch dann, wenn der Widerspruch zur Niederschrift der Geschäftsstelle eines anderen Amtsgerichtes abgegeben wurde. Die Frist beginnt mit der schriftlichen Bekanntgabe der Verfügung. Die Bekanntgabe ist entweder durch Zustellung oder am dritten Tage nach Aufgabe zur Post bewirkt. Fällt das Ende der Frist auf einen Sonntag, einen allgemeinen Feiertag oder Sonnabend, so endet die Frist mit Ablauf des nächsten Werktages. Der Widerspruch muss die Bezeichnung der angefochtenen Verfügung sowie die Erklärung enthalten, dass Widerspruch gegen diese Verfügung eingelegt wird. Er ist zu unterzeichnen und soll begründet werden."
    },
    {
      "date": "2025-02-19",
      "id": "101757",
      "original_text": "Registerbekanntmachung nach dem Umwandlungsgesetz\nNordrhein-Westfalen Amtsgericht Paderborn HRA 7119\nWolle Rödel GmbH & Co. KG – Paderborn",
      "type": "Registerbekanntmachung nach dem Umwandlungsgesetz",
      "state": "Nordrhein-Westfalen",
      "amtsgericht": "Amtsgericht Paderborn",
      "registernummer": "HRA 7119",
      "registerart": "HRA",
      "company_name": "Wolle Rödel GmbH & Co. KG",
      "company_seat": "Paderborn",
      "details": "19.02.2025 (Bekanntmachungsdatum)\n\nNordrhein-Westfalen Amtsgericht Paderborn HRA 7119\nRegisterbekanntmachung nach dem Umwandlungsgesetz 19.02.2025 (Eintragungsdatum)\n\nWolle Rödel GmbH & Co. KG\nKommanditgesellschaft\nPaderborn\n\nDen Gläubigern der an der Verschmelzung beteiligten Rechtsträger ist, wenn sie binnen sechs Monaten nach dem Tag, an dem die Eintragung der Verschmelzung in das Register des Sitzes desjenigen Rechtsträgers, dessen Gläubiger sie sind, nach § 19 Absatz 3 UmwG als bekanntgemacht gilt, ihren Anspruch nach Grund und Höhe schriftlich anmelden, Sicherheit zu leisten, soweit sie nicht Befriedigung verlangen können. Dieses Recht steht den Gläubigern jedoch nur zu, wenn sie glaubhaft machen, dass durch die Verschmelzung die Erfüllung ihrer Forderung gefährdet wird."
    },
    {
      "date": "2025-02-19",
      "id": "101758",
      "original_text": "Löschungsankündigung\nNordrhein-Westfalen Amtsgericht Duisburg HRB 35603\nSaka Bau GmbH – Duisburg",
      "type": "Löschungsankündigung",
      "state": "Nordrhein-Westfalen",
      "amtsgericht": "Amtsgericht Duisburg",
      "registernummer": "HRB 35603",
      "registerart": "HRB",
      "company_name": "Saka Bau GmbH",
      "company_seat": "Duisburg",
      "details": "19.02.2025 (Bekanntmachungsdatum)\n\nNordrhein-Westfalen Amtsgericht Duisburg HRB 35603\nLöschungsankündigung\n\nSaka Bau GmbH\nGesellschaft mit beschränkter Haftung\nDuisburg\n\nDas Registergericht beabsichtigt, die im Handelsregister unter HRB 35603 eingetragene Gesellschaft Saka Bau GmbH  gemäß § 394 FamFG wegen Vermögenslosigkeit von Amts wegen zu löschen. Gegen diese Verfügung kann Widerspruch eingelegt werden. Die Frist zur Erhebung eines Widerspruchs gegen die beabsichtigte Löschung von Amts wegen ist auf drei Monate festgesetzt. Rechtsbehelfsbelehrung Der Widerspruch ist bei dem Amtsgericht Duisburg, Kardinal-Galen-Str. 124-132, 47058 Duisburg schriftlich in deutscher Sprache oder zur Niederschrift der Geschäftsstelle einzulegen. Der Widerspruch kann auch zur Niederschrift der Geschäftsstelle eines jeden Amtsgerichtes abgegeben werden. Die Einlegung ist auch durch Übertragung eines elektronischen Dokuments an die elektronische Poststelle des Gerichts möglich. Das elektronische Dokument muss für die Bearbeitung durch das Gericht geeignet und mit einer qualifizierten elektronischen Signatur der verantwortenden Person versehen sein oder von der verantwortenden Person signiert und auf einem sicheren Übermittlungsweg gemäß § 130 a ZPO nach näherer Maßgabe der Verordnung über die technischen Rahmenbedingungen des elektronischen Rechtsverkehrs und über das besondere elektronische Behördenpostfach (BGBl. I, S. 3803) eingereicht werden. Weitere Informationen erhalten Sie auf der Internetseite www.justiz.de <http://www.justiz.de>. Der Widerspruch muss spätestens innerhalb der gesetzten Frist bei dem Amtsgericht Duisburg eingegangen sein. Dies gilt auch dann, wenn der Widerspruch zur Niederschrift der Geschäftsstelle eines anderen Amtsgerichtes abgegeben wurde. Die Frist beginnt mit der Veröffentlichung. Fällt das Ende der Frist auf einen Sonntag, einen allgemeinen Feiertag oder Sonnabend, so endet die Frist mit Ablauf des nächsten Werktages. Der Widerspruch muss die Bezeichnung der angefochtenen Verfügung sowie die Erklärung enthalten, dass Widerspruch gegen diese Verfügung eingelegt wird. Er ist zu unterzeichnen und soll begründet werden."
    },
    {
      "date": "2025-02-19",
      "id": "101759",
      "original_text": "Löschungsankündigung\nNordrhein-Westfalen Amtsgericht Düsseldorf HRB 83718\nTrade House Two TD GmbH – Düsseldorf",
      "type": "Löschungsankündigung",
      "state": "Nordrhein-Westfalen",
      "amtsgericht": "Amtsgericht Düsseldorf",
      "registernummer": "HRB 83718",
      "registerart": "HRB",
      "company_name": "Trade House Two TD GmbH",
      "company_seat": "Düsseldorf",
      "details": "19.02.2025 (Bekanntmachungsdatum)\n\nNordrhein-Westfalen Amtsgericht Düsseldorf HRB 83718\nLöschungsankündigung\n\nTrade House Two TD GmbH\nGesellschaft mit beschränkter Haftung\nDüsseldorf\n\nDas Registergericht beabsichtigt die Gesellschaft von Amts wegen nach § 394 FamFG zu löschen. Die Frist zur Erhebung eines Widerspruchs ist auf 3 Wochen festgesetzt.\n\nRechtsbehelfsbelehrung:\nDas Widerspruchsrecht steht jedem zu, der an der Unterlassung der Löschung ein berechtigtes Interesse hat. Der Widerspruch ist bei dem Amtsgericht Düsseldorf -Registergericht-, Werdener Straße 1, 40227 Düsseldorf schriftlich in deutscher Sprache oder zur Niederschrift der Geschäftsstelle einzulegen. Der Widerspruch kann auch zur Niederschrift der Geschäftsstelle eines jeden Amtsgerichtes abgegeben werden. Die Einlegung ist auch durch Übertragung eines elektronischen Dokuments an die elektronische Poststelle des Gerichts möglich. Das elektronische Dokument muss für die Bearbeitung durch das Gericht geeignet und mit einer qualifizierten elektronischen Signatur der verantwortenden Person versehen sein oder von der verantwortenden Person signiert und auf einem sicheren Übermittlungsweg gemäß § 130a ZPO nach näherer Maßgabe der Verordnung über die technischen Rahmenbedingungen des elektronischen Rechtsverkehrs und über das besondere elektronische Behördenpostfach (BGBl. I, S.3803) eingereicht werden. Weitere Informationen erhalten Sie auf der Internetseite www.justiz.de.\nDer Widerspruch muss spätestens innerhalb der gesetzten Frist nach dem Datum der Bekanntmachung der Löschungsankündigung bei dem Amtsgericht - Registergericht - Düsseldorf eingegangen sein.  Dies gilt auch dann, wenn der Widerspruch zur Niederschrift der Geschäftsstelle eines anderen Amtsgerichtes abgegeben wurde. Die Frist beginnt mit dem Tage der Bekanntmachung der Löschungsankündigung in dem für die Bekanntmachung der Eintragungen in das Handelsregister bestimmten elektronischen Informations- und Kommunikationssystem nach § 10 des Handelsgesetzbuches. Fällt das Ende der Frist auf einen Sonntag, einen allgemeinen Feiertag oder Sonnabend, so endet die Frist mit Ablauf des nächsten Werktages.\nDer Widerspruch muss die Bezeichnung der angefochtenen Löschungsankündigung sowie die Erklärung enthalten, dass Widerspruch gegen diese Löschungsankündigung eingelegt wird. Er ist zu unterzeichnen und soll begründet werden."
    },
    {
      "date": "2025-02-19",
      "id": "101760",
      "original_text": "Löschungsankündigung\nNordrhein-Westfalen Amtsgericht Hamm HRB 1581\nROETZEL-INGENIEURGESELLSCHAFT MBH – Hamm",
      "type": "Löschungsankündigung",
      "state": "Nordrhein-Westfalen",
      "amtsgericht": "Amtsgericht Hamm",
      "registernummer": "HRB 1581",
      "registerart": "HRB",
      "company_name": "ROETZEL-INGENIEURGESELLSCHAFT MBH",
      "company_seat": "Hamm",
      "details": "19.02.2025 (Bekanntmachungsdatum)\n\nNordrhein-Westfalen Amtsgericht Hamm HRB 1581\nLöschungsankündigung\n\nROETZEL-INGENIEURGESELLSCHAFT MBH\nGesellschaft mit beschränkter Haftung\nHamm\n\nDas Registergericht beabsichtigt die Gesellschaft von Amts wegen nach § 394 FamFG zu löschen. Die Frist zur Erhebung eines Widerspruchs ist auf drei Monate festgesetzt."
    },
    {
      "date": "2025-02-19",
      "id": "101761",
      "original_text": "Löschungsankündigung\nHessen Amtsgericht Frankfurt am Main HRB 110424\nUltraschutz UG (haftungsbeschränkt) – Frankfurt am Main",
      "type": "Löschungsankündigung",
      "state": "Hessen",
      "amtsgericht": "Amtsgericht Frankfurt am Main",
      "registernummer": "HRB 110424",
      "registerart": "HRB",
      "company_name": "Ultraschutz UG (haftungsbeschränkt)",
      "company_seat": "Frankfurt am Main",
      "details": "19.02.2025 (Bekanntmachungsdatum)\n\nHessen Amtsgericht Frankfurt am Main HRB 110424\nLöschungsankündigung\n\nUltraschutz UG (haftungsbeschränkt)\nGesellschaft mit beschränkter Haftung\nFrankfurt am Main\n\nDas Registergericht beabsichtigt die im Handelsregister eingetragene Gesellschaft von Amts wegen nach § 394 FamFG zu löschen. Die Frist zur Erhebung eines Widerspruchs gegen die beabsichtigte Löschung wird auf 1 Monat festgesetzt."
    },
    {
      "date": "2025-02-19",
      "id": "101762",
      "original_text": "Löschungsankündigung\nHessen Amtsgericht Frankfurt am Main HRB 129524\nBusCenter Nord UG (haftungsbeschränkt) – Frankfurt am Main",
      "type": "Löschungsankündigung",
      "state": "Hessen",
      "amtsgericht": "Amtsgericht Frankfurt am Main",
      "registernummer": "HRB 129524",
      "registerart": "HRB",
      "company_name": "BusCenter Nord UG (haftungsbeschränkt)",
      "company_seat": "Frankfurt am Main",
      "details": "19.02.2025 (Bekanntmachungsdatum)\n\nHessen Amtsgericht Frankfurt am Main HRB 129524\nLöschungsankündigung\n\nBusCenter Nord UG (haftungsbeschränkt)\nGesellschaft mit beschränkter Haftung\nFrankfurt am Main\n\nDas Registergericht beabsichtigt die im Handelsregister eingetragene Gesellschaft von Amts wegen nach § 394 FamFG zu löschen. Die Frist zur Erhebung eines Widerspruchs gegen die beabsichtigte Löschung wird auf 1 Monat festgesetzt."
    },
    {
      "date": "2025-02-19",
      "id": "101763",
      "original_text": "Einreichung neuer Dokumente\nHessen Amtsgericht Offenbach am Main HRB 44629\nOffenbacher Fußball-Club Kickers 1901 GmbH – Offenbach am Main",
      "type": "Einreichung neuer Dokumente",
      "state": "Hessen",
      "amtsgericht": "Amtsgericht Offenbach am Main",
      "registernummer": "HRB 44629",
      "registerart": "HRB",
      "company_name": "Offenbacher Fußball-Club Kickers 1901 GmbH",
      "company_seat": "Offenbach am Main",
      "details": "19.02.2025 (Bekanntmachungsdatum)\n\nHessen Amtsgericht Offenbach am Main HRB 44629\nEinreichung neuer Dokumente\n\nOffenbacher Fußball-Club Kickers 1901 GmbH\nGesellschaft mit beschränkter Haftung\nOffenbach am Main\n\nDurch eine Änderung in den Personen der Aufsichtsratsmitglieder ist eine Liste der Mitglieder des Aufsichtsrates zum Handelsregister eingereicht worden."
    },
    {
      "date": "2025-02-19",
      "id": "101764",
      "original_text": "Registerbekanntmachung nach dem Umwandlungsgesetz\nHessen Amtsgericht Königstein HRB 9143\nPARTPRO GmbH – Königstein im Taunus",
      "type": "Registerbekanntmachung nach dem Umwandlungsgesetz",
      "state": "Hessen",
      "amtsgericht": "Amtsgericht Königstein",
      "registernummer": "HRB 9143",
      "registerart": "HRB",
      "company_name": "PARTPRO GmbH",
      "company_seat": "Königstein im Taunus",
      "details": "19.02.2025 (Bekanntmachungsdatum)\n\nHessen Amtsgericht Königstein HRB 9143\nRegisterbekanntmachung nach dem Umwandlungsgesetz 19.02.2025 (Eintragungsdatum)\n\nPARTPRO GmbH\nGesellschaft mit beschränkter Haftung\nKönigstein im Taunus\n\nDen Gläubigern der an der Verschmelzung beteiligten Rechtsträger ist, wenn sie binnen sechs Monaten nach dem Tag, an dem die Eintragung der Verschmelzung in das Register des Sitzes desjenigen Rechtsträgers, dessen Gläubiger sie sind, nach § 19 Absatz 3 UmwG bekannt gemacht worden ist, ihren Anspruch nach Grund und Höhe schriftlich anmelden, Sicherheit zu leisten, soweit sie nicht Befriedigung verlangen können. Dieses Recht steht den Gläubigern jedoch nur zu, wenn sie glaubhaft machen, dass durch die Verschmelzung die Erfüllung ihrer Forderung gefährdet wird."
    },
    {
      "date": "2025-02-19",
      "id": "101765",
      "original_text": "Löschungsankündigung\nHessen Amtsgericht Offenbach am Main HRB 41927\nKautz & Hinkel GmbH – Dreieich",
      "type": "Löschungsankündigung",
      "state": "Hessen",
      "amtsgericht": "Amtsgericht Offenbach am Main",
      "registernummer": "HRB 41927",
      "registerart": "HRB",
      "company_name": "Kautz & Hinkel GmbH",
      "company_seat": "Dreieich",
      "details": "19.02.2025 (Bekanntmachungsdatum)\n\nHessen Amtsgericht Offenbach am Main HRB 41927\nLöschungsankündigung\n\nKautz & Hinkel GmbH\nGesellschaft mit beschränkter Haftung\nDreieich\n\nDas Registergericht beabsichtigt die im Handelsregister eingetragene Gesellschaft von Amts wegen nach § 394 FamFG zu löschen. Die Frist zur Erhebung eines Widerspruchs gegen die beabsichtigte Löschung wird auf 3 Monate festgesetzt."
    },
    {
      "date": "2025-02-19",
      "id": "101766",
      "original_text": "Einreichung neuer Dokumente\nHessen Amtsgericht Offenbach am Main HRB 40169\ntecsis GmbH – Offenbach am Main",
      "type": "Einreichung neuer Dokumente",
      "state": "Hessen",
      "amtsgericht": "Amtsgericht Offenbach am Main",
      "registernummer": "HRB 40169",
      "registerart": "HRB",
      "company_name": "tecsis GmbH",
      "company_seat": "Offenbach am Main",
      "details": "19.02.2025 (Bekanntmachungsdatum)\n\nHessen Amtsgericht Offenbach am Main HRB 40169\nEinreichung neuer Dokumente\n\ntecsis GmbH\nGesellschaft mit beschränkter Haftung\nOffenbach am Main\n\nDurch eine Änderung in den Personen der Aufsichtsratsmitglieder ist eine Liste der Mitglieder des Aufsichtsrates zum Handelsregister eingereicht worden."
    },
    {
      "date": "2025-02-19",
      "id": "101767",
      "original_text": "Registerbekanntmachung nach dem Umwandlungsgesetz\nHessen Amtsgericht Königstein HRA 4263\nIT Consulting Damir Matakovic e.K. – Königstein im Taunus",
      "type": "Registerbekanntmachung nach dem Umwandlungsgesetz",
      "state": "Hessen",
      "amtsgericht": "Amtsgericht Königstein",
      "registernummer": "HRA 4263",
      "registerart": "HRA",
      "company_name": "IT Consulting Damir Matakovic e.K.",
      "company_seat": "Königstein im Taunus",
      "details": "19.02.2025 (Bekanntmachungsdatum)\n\nHessen Amtsgericht Königstein HRA 4263\nRegisterbekanntmachung nach dem Umwandlungsgesetz 19.02.2025 (Eintragungsdatum)\n\nIT Consulting Damir Matakovic e.K.\nEinzelkaufmann / Einzelkauffrau\nKönigstein im Taunus\n\nDen Gläubigern der an der Verschmelzung beteiligten Rechtsträger ist, wenn sie binnen sechs Monaten nach dem Tag, an dem die Eintragung der Verschmelzung in das Register des Sitzes desjenigen Rechtsträgers, dessen Gläubiger sie sind, nach § 19 Absatz 3 UmwG bekannt gemacht worden ist, ihren Anspruch nach Grund und Höhe schriftlich anmelden, Sicherheit zu leisten, soweit sie nicht Befriedigung verlangen können. Dieses Recht steht den Gläubigern jedoch nur zu, wenn sie glaubhaft machen, dass durch die Verschmelzung die Erfüllung ihrer Forderung gefährdet wird."
    },
    {
      "date": "2025-02-19",
      "id": "101768",
      "original_text": "Sonstige Registerbekanntmachung\nHessen Amtsgericht Darmstadt HRB 91290\nDietz Logistik 10. Grundbesitz GmbH – Bensheim",
      "type": "Sonstige Registerbekanntmachung",
      "state": "Hessen",
      "amtsgericht": "Amtsgericht Darmstadt",
      "registernummer": "HRB 91290",
      "registerart": "HRB",
      "company_name": "Dietz Logistik 10. Grundbesitz GmbH",
      "company_seat": "Bensheim",
      "details": "19.02.2025 (Bekanntmachungsdatum)\n\nHessen Amtsgericht Darmstadt HRB 91290\nSonstige Registerbekanntmachung 19.02.2025 (Eintragungsdatum)\n\nDietz Logistik 10. Grundbesitz GmbH\nGesellschaft mit beschränkter Haftung\nBensheim\n\nDen Gläubigern der Gesellschaft, deren Forderungen begründet worden sind, bevor die Eintragung der Beendigung des Vertrags in das Handelsregister nach § 10 HGB bekannt gemacht worden ist, ist vom anderen Vertragsteil Sicherheit zu leisten, wenn sie sich binnen sechs Monaten nach dieser Bekanntmachung zu diesem Zweck bei ihm melden."
    },
    {
      "date": "2025-02-19",
      "id": "101769",
      "original_text": "Löschungsankündigung\nHessen Amtsgericht Frankfurt am Main HRB 122752\nGleisbau FFM GmbH – Frankfurt am Main",
      "type": "Löschungsankündigung",
      "state": "Hessen",
      "amtsgericht": "Amtsgericht Frankfurt am Main",
      "registernummer": "HRB 122752",
      "registerart": "HRB",
      "company_name": "Gleisbau FFM GmbH",
      "company_seat": "Frankfurt am Main",
      "details": "19.02.2025 (Bekanntmachungsdatum)\n\nHessen Amtsgericht Frankfurt am Main HRB 122752\nLöschungsankündigung\n\nGleisbau FFM GmbH\nGesellschaft mit beschränkter Haftung\nFrankfurt am Main\n\nDas Registergericht beabsichtigt die im Handelsregister eingetragene Gesellschaft von Amts wegen nach § 394 FamFG zu löschen. Die Frist zur Erhebung eines Widerspruchs gegen die beabsichtigte Löschung wird auf 1 Monat festgesetzt."
    },
    {
      "date": "2025-02-19",
      "id": "101770",
      "original_text": "Einreichung neuer Dokumente\nHessen Amtsgericht Frankfurt am Main HRB 119629\nEW Discover GmbH – Frankfurt am Main",
      "type": "Einreichung neuer Dokumente",
      "state": "Hessen",
      "amtsgericht": "Amtsgericht Frankfurt am Main",
      "registernummer": "HRB 119629",
      "registerart": "HRB",
      "company_name": "EW Discover GmbH",
      "company_seat": "Frankfurt am Main",
      "details": "19.02.2025 (Bekanntmachungsdatum)\n\nHessen Amtsgericht Frankfurt am Main HRB 119629\nEinreichung neuer Dokumente\n\nEW Discover GmbH\nGesellschaft mit beschränkter Haftung\nFrankfurt am Main\n\nDurch eine Änderung in den Personen der Aufsichtsratsmitglieder ist eine Liste der Mitglieder des Aufsichtsrates zum Handelsregister eingereicht worden."
    }
  ]
}