{
  "date": "2025-02-13",
  "date_of_scrape": "2025-02-14T04:07:30.624Z",
  "tool_version": "0.2.0",
  "number_of_announcements": 122,
  "announcements": [
    {
      "date": "2025-02-13",
      "id": "101193",
      "original_text": "Registerbekanntmachung nach dem Umwandlungsgesetz\nBayern Amtsgericht München HRB 168962\nSenator Hotel-Errichtungs-GmbH – Pöcking",
      "type": "Registerbekanntmachung nach dem Umwandlungsgesetz",
      "state": "Bayern",
      "amtsgericht": "Amtsgericht München",
      "registernummer": "HRB 168962",
      "registerart": "HRB",
      "company_name": "Senator Hotel-Errichtungs-GmbH",
      "company_seat": "Pöcking",
      "details": "13.02.2025 (Bekanntmachungsdatum)\n\nBayern Amtsgericht München HRB 168962\nRegisterbekanntmachung nach dem Umwandlungsgesetz\n\nSenator Hotel-Errichtungs-GmbH\nGesellschaft mit beschränkter Haftung\nPöcking\n\nEs wird darauf hingewiesen, dass ein Formwechselplan oder sein Entwurf über einen grenzüberschreitenden Formwechsel in die Senator Hotel-Errichtungs-GmbH mit Sitz in Wien/Österreich (Gesellschaft mit beschränkter Haftung nach österreichischem Recht) beim Handelsregister eingereicht worden ist.\nDie Anteilsinhaber, die Gläubiger sowie die zuständigen Betriebsräte der an dem grenzüberschreitenden Formwechsel beteiligten Gesellschaft oder, soweit es keinen Betriebsrat gibt, die Arbeitnehmer der an dem grenzüberschreitenden Formwechsel beteiligten Gesellschaft, können der Gesellschaft spätestens fünf Arbeitstage vor dem Tag der Gesellschafterversammlung Bemerkungen zum Formwechselplan übermitteln."
    },
    {
      "date": "2025-02-13",
      "id": "101194",
      "original_text": "Sonstige Registerbekanntmachung\nBayern Amtsgericht Bamberg HRB 893\nEiscafè Lido Dal Fabbro GmbH – Bamberg",
      "type": "Sonstige Registerbekanntmachung",
      "state": "Bayern",
      "amtsgericht": "Amtsgericht Bamberg",
      "registernummer": "HRB 893",
      "registerart": "HRB",
      "company_name": "Eiscafè Lido Dal Fabbro GmbH",
      "company_seat": "Bamberg",
      "details": "13.02.2025 (Bekanntmachungsdatum)\n\nBayern Amtsgericht Bamberg HRB 893\nSonstige Registerbekanntmachung 12.02.2025 (Eintragungsdatum)\n\nEiscafè Lido Dal Fabbro GmbH\nGesellschaft mit beschränkter Haftung\nBamberg\n\nDen Gläubigern der Gesellschaft, deren Forderungen begründet worden sind, bevor die Eintragung der Beendigung des Beherrschungs- und Gewinnabführungsvertrages in das Handelsregister nach § 10 des Handelsgesetzbuches als bekanntgemacht gilt, hat der andere Vertragsteil Sicherheit zu leisten, wenn sie sich binnen sechs Monaten nach der Bekanntmachung der Eintragung zu diesem Zweck bei ihm melden."
    },
    {
      "date": "2025-02-13",
      "id": "101195",
      "original_text": "Löschungsankündigung\nBayern Amtsgericht Hof HRB 6516\nPS Freizeit Erlebnis UG (haftungsbeschränkt) – Hof",
      "type": "Löschungsankündigung",
      "state": "Bayern",
      "amtsgericht": "Amtsgericht Hof",
      "registernummer": "HRB 6516",
      "registerart": "HRB",
      "company_name": "PS Freizeit Erlebnis UG (haftungsbeschränkt)",
      "company_seat": "Hof",
      "details": "13.02.2025 (Bekanntmachungsdatum)\n\nBayern Amtsgericht Hof HRB 6516\nLöschungsankündigung\n\nPS Freizeit Erlebnis UG (haftungsbeschränkt)\nGesellschaft mit beschränkter Haftung\nHof\n\nDas Registergericht beabsichtigt, die im Handelsregister eingetragene Gesellschaft wegen Vermögenslosigkeit von Amts wegen nach § 394 FamFG zu löschen. #insert(Text=\"zztb_V_Widerspruchsfrist\")"
    },
    {
      "date": "2025-02-13",
      "id": "101196",
      "original_text": "Registerbekanntmachung nach dem Umwandlungsgesetz\nBayern Amtsgericht Würzburg HRA 8850\nKLZ Kitzingen GmbH & Co. KG – Kitzingen",
      "type": "Registerbekanntmachung nach dem Umwandlungsgesetz",
      "state": "Bayern",
      "amtsgericht": "Amtsgericht Würzburg",
      "registernummer": "HRA 8850",
      "registerart": "HRA",
      "company_name": "KLZ Kitzingen GmbH & Co. KG",
      "company_seat": "Kitzingen",
      "details": "13.02.2025 (Bekanntmachungsdatum)\n\nBayern Amtsgericht Würzburg HRA 8850\nRegisterbekanntmachung nach dem Umwandlungsgesetz 12.02.2025 (Eintragungsdatum)\n\nKLZ Kitzingen GmbH & Co. KG\nKommanditgesellschaft\nKitzingen\n\nDen Gläubigern der an der Ausgliederung beteiligten Rechtsträger ist, wenn sie binnen sechs Monaten nach dem Tag, an dem die Eintragung der Ausgliederung in das Register des Sitzes desjenigen Rechtsträgers, dessen Gläubiger sie sind, nach §§ 125, 19 Abs. 3 UmwG als bekannt gemacht gilt, ihren Anspruch nach Grund und Höhe in Textform anmelden, Sicherheit zu leisten, soweit sie nicht Befriedigung verlangen können. Dieses Recht steht den Gläubigern jedoch nur zu, wenn sie glaubhaft machen, dass durch die Ausgliederung die Erfüllung ihrer Forderung gefährdet wird."
    },
    {
      "date": "2025-02-13",
      "id": "101197",
      "original_text": "Registerbekanntmachung nach dem Umwandlungsgesetz\nBayern Amtsgericht München HRB 291802\nYSC YOGA SOCIAL CLUB Management & Vertrieb GmbH – München",
      "type": "Registerbekanntmachung nach dem Umwandlungsgesetz",
      "state": "Bayern",
      "amtsgericht": "Amtsgericht München",
      "registernummer": "HRB 291802",
      "registerart": "HRB",
      "company_name": "YSC YOGA SOCIAL CLUB Management & Vertrieb GmbH",
      "company_seat": "München",
      "details": "13.02.2025 (Bekanntmachungsdatum)\n\nBayern Amtsgericht München HRB 291802\nRegisterbekanntmachung nach dem Umwandlungsgesetz 12.02.2025 (Eintragungsdatum)\n\nYSC YOGA SOCIAL CLUB Management & Vertrieb GmbH\nGesellschaft mit beschränkter Haftung\nMünchen\n\nDen Gläubigern der an der Verschmelzung beteiligten Rechtsträger ist, wenn sie binnen sechs Monaten nach dem Tag, an dem die Eintragung der Verschmelzung in das Register des Sitzes desjenigen Rechtsträgers, dessen Gläubiger sie sind, nach § 19 Abs. 3 UmwG als bekannt gemacht gilt, ihren Anspruch nach Grund und Höhe in Textform anmelden, Sicherheit zu leisten, soweit sie nicht Befriedigung verlangen können. Dieses Recht steht den Gläubigern jedoch nur zu, wenn sie glaubhaft machen, dass durch die Verschmelzung die Erfüllung ihrer Forderung gefährdet wird."
    },
    {
      "date": "2025-02-13",
      "id": "101198",
      "original_text": "Löschungsankündigung\nBayern Amtsgericht Passau HRA 12594\nSENDMAX GmbH & Co. KG – Perlesreut",
      "type": "Löschungsankündigung",
      "state": "Bayern",
      "amtsgericht": "Amtsgericht Passau",
      "registernummer": "HRA 12594",
      "registerart": "HRA",
      "company_name": "SENDMAX GmbH & Co. KG",
      "company_seat": "Perlesreut",
      "details": "13.02.2025 (Bekanntmachungsdatum)\n\nBayern Amtsgericht Passau HRA 12594\nLöschungsankündigung\n\nSENDMAX GmbH & Co. KG\nKommanditgesellschaft\nPerlesreut\n\nDas Registergericht beabsichtigt, die im Handelsregister eingetragene Firma wegen Vermögenslosigkeit von Amts wegen nach § 394 FamFG zu löschen. Die Frist zur Erhebung eines Widerspruchs ist auf einen Monat festgesetzt."
    },
    {
      "date": "2025-02-13",
      "id": "101199",
      "original_text": "Löschungsankündigung\nBayern Amtsgericht Fürth HRA 3778\nBekleidungshaus Speier Inhaber Horst Werner Speier e.K. – Bad Windsheim",
      "type": "Löschungsankündigung",
      "state": "Bayern",
      "amtsgericht": "Amtsgericht Fürth",
      "registernummer": "HRA 3778",
      "registerart": "HRA",
      "company_name": "Bekleidungshaus Speier Inhaber Horst Werner Speier e.K.",
      "company_seat": "Bad Windsheim",
      "details": "13.02.2025 (Bekanntmachungsdatum)\n\nBayern Amtsgericht Fürth HRA 3778\nLöschungsankündigung\n\nBekleidungshaus Speier Inhaber Horst Werner Speier e.K.\nEinzelkaufmann / Einzelkauffrau\nBad Windsheim\n\nDas Registergericht beabsichtigt, die im Handelsregister eingetragene Firma von Amts wegen nach § 31 Abs. 2 HGB zu löschen. Die Frist zur Erhebung eines Widerspruchs ist auf einen Monat festgesetzt."
    },
    {
      "date": "2025-02-13",
      "id": "101200",
      "original_text": "Löschungsankündigung\nBayern Amtsgericht Fürth HRA 8399\nCENTROSOLAR Glas GmbH & Co. KG – Fürth",
      "type": "Löschungsankündigung",
      "state": "Bayern",
      "amtsgericht": "Amtsgericht Fürth",
      "registernummer": "HRA 8399",
      "registerart": "HRA",
      "company_name": "CENTROSOLAR Glas GmbH & Co. KG",
      "company_seat": "Fürth",
      "details": "13.02.2025 (Bekanntmachungsdatum)\n\nBayern Amtsgericht Fürth HRA 8399\nLöschungsankündigung\n\nCENTROSOLAR Glas GmbH & Co. KG\nKommanditgesellschaft\nFürth\n\nDas Registergericht beabsichtigt, die im Handelsregister eingetragene Firma wegen Vermögenslosigkeit von Amts wegen nach § 394 Abs. 4 FamFG zu löschen. Die Frist zur Erhebung eines Widerspruchs ist auf einen Monat festgesetzt."
    },
    {
      "date": "2025-02-13",
      "id": "101201",
      "original_text": "Einreichung neuer Dokumente\nBayern Amtsgericht München HRB 173005\nMetechon AG – München",
      "type": "Einreichung neuer Dokumente",
      "state": "Bayern",
      "amtsgericht": "Amtsgericht München",
      "registernummer": "HRB 173005",
      "registerart": "HRB",
      "company_name": "Metechon AG",
      "company_seat": "München",
      "details": "13.02.2025 (Bekanntmachungsdatum)\n\nBayern Amtsgericht München HRB 173005\nEinreichung neuer Dokumente 12.02.2025 (Eintragungsdatum)\n\nMetechon AG\nAktiengesellschaft\nMünchen\n\nDem Amtsgericht München -Registergericht- ist eine Liste der Mitglieder des Aufsichtsrats eingereicht worden, § 106 AktG."
    },
    {
      "date": "2025-02-13",
      "id": "101202",
      "original_text": "Löschungsankündigung\nBayern Amtsgericht Hof HRB 2556\nIMOTEC GmbH, Industriemontagen und Montagetechnik – Hof",
      "type": "Löschungsankündigung",
      "state": "Bayern",
      "amtsgericht": "Amtsgericht Hof",
      "registernummer": "HRB 2556",
      "registerart": "HRB",
      "company_name": "IMOTEC GmbH, Industriemontagen und Montagetechnik",
      "company_seat": "Hof",
      "details": "13.02.2025 (Bekanntmachungsdatum)\n\nBayern Amtsgericht Hof HRB 2556\nLöschungsankündigung\n\nIMOTEC GmbH, Industriemontagen und Montagetechnik\nGesellschaft mit beschränkter Haftung\nHof\n\nDas Registergericht beabsichtigt, die im Handelsregister eingetragene Gesellschaft wegen Vermögenslosigkeit von Amts wegen nach § 394 FamFG zu löschen. #insert(Text=\"zztb_V_Widerspruchsfrist\")"
    },
    {
      "date": "2025-02-13",
      "id": "101203",
      "original_text": "Sonstige Registerbekanntmachung\nBayern Amtsgericht Würzburg HRB 10887\nFLYERALARM Event GmbH – Dettelbach",
      "type": "Sonstige Registerbekanntmachung",
      "state": "Bayern",
      "amtsgericht": "Amtsgericht Würzburg",
      "registernummer": "HRB 10887",
      "registerart": "HRB",
      "company_name": "FLYERALARM Event GmbH",
      "company_seat": "Dettelbach",
      "details": "13.02.2025 (Bekanntmachungsdatum)\n\nBayern Amtsgericht Würzburg HRB 10887\nSonstige Registerbekanntmachung 12.02.2025 (Eintragungsdatum)\n\nFLYERALARM Event GmbH\nGesellschaft mit beschränkter Haftung\nDettelbach\n\nDen Gläubigern der Gesellschaft, deren Forderungen begründet worden sind, bevor die Eintragung der Beendigung des Gewinnabführungsvertrages in das Handelsregister nach § 10 des Handelsgesetzbuches als bekanntgemacht gilt, hat der andere Vertragsteil Sicherheit zu leisten, wenn sie sich binnen sechs Monaten nach der Bekanntmachung der Eintragung zu diesem Zweck bei ihm melden."
    },
    {
      "date": "2025-02-13",
      "id": "101204",
      "original_text": "Registerbekanntmachung nach dem Umwandlungsgesetz\nBayern Amtsgericht Würzburg HRA 5624\nGebäudereinigung Hoffmann, Inhaber Klaus Hoffmann e. K. – Kitzingen",
      "type": "Registerbekanntmachung nach dem Umwandlungsgesetz",
      "state": "Bayern",
      "amtsgericht": "Amtsgericht Würzburg",
      "registernummer": "HRA 5624",
      "registerart": "HRA",
      "company_name": "Gebäudereinigung Hoffmann, Inhaber Klaus Hoffmann e. K.",
      "company_seat": "Kitzingen",
      "details": "13.02.2025 (Bekanntmachungsdatum)\n\nBayern Amtsgericht Würzburg HRA 5624\nRegisterbekanntmachung nach dem Umwandlungsgesetz 12.02.2025 (Eintragungsdatum)\n\nGebäudereinigung Hoffmann, Inhaber Klaus Hoffmann e. K.\nEinzelkaufmann / Einzelkauffrau\nKitzingen\n\nDen Gläubigern der an der Ausgliederung beteiligten Rechtsträger ist, wenn sie binnen sechs Monaten nach dem Tag, an dem die Eintragung der Ausgliederung in das Register des Sitzes desjenigen Rechtsträgers, dessen Gläubiger sie sind, nach §§ 125, 19 Abs. 3 UmwG als bekannt gemacht gilt, ihren Anspruch nach Grund und Höhe in Textform anmelden, Sicherheit zu leisten, soweit sie nicht Befriedigung verlangen können. Dieses Recht steht den Gläubigern jedoch nur zu, wenn sie glaubhaft machen, dass durch die Ausgliederung die Erfüllung ihrer Forderung gefährdet wird."
    },
    {
      "date": "2025-02-13",
      "id": "101205",
      "original_text": "Registerbekanntmachung nach dem Umwandlungsgesetz\nBayern Amtsgericht München HRB 137816\nCatenate Ventures GmbH – München",
      "type": "Registerbekanntmachung nach dem Umwandlungsgesetz",
      "state": "Bayern",
      "amtsgericht": "Amtsgericht München",
      "registernummer": "HRB 137816",
      "registerart": "HRB",
      "company_name": "Catenate Ventures GmbH",
      "company_seat": "München",
      "details": "13.02.2025 (Bekanntmachungsdatum)\n\nBayern Amtsgericht München HRB 137816\nRegisterbekanntmachung nach dem Umwandlungsgesetz 12.02.2025 (Eintragungsdatum)\n\nCatenate Ventures GmbH\nGesellschaft mit beschränkter Haftung\nMünchen\n\nDen Gläubigern der an der Verschmelzung beteiligten Rechtsträger ist, wenn sie binnen sechs Monaten nach dem Tag, an dem die Eintragung der Verschmelzung in das Register des Sitzes desjenigen Rechtsträgers, dessen Gläubiger sie sind, nach § 19 Abs. 3 UmwG als bekannt gemacht gilt, ihren Anspruch nach Grund und Höhe in Textform anmelden, Sicherheit zu leisten, soweit sie nicht Befriedigung verlangen können. Dieses Recht steht den Gläubigern jedoch nur zu, wenn sie glaubhaft machen, dass durch die Verschmelzung die Erfüllung ihrer Forderung gefährdet wird."
    },
    {
      "date": "2025-02-13",
      "id": "101206",
      "original_text": "Registerbekanntmachung nach dem Umwandlungsgesetz\nBayern Amtsgericht München HRB 122857\nMartin Zech GmbH – München",
      "type": "Registerbekanntmachung nach dem Umwandlungsgesetz",
      "state": "Bayern",
      "amtsgericht": "Amtsgericht München",
      "registernummer": "HRB 122857",
      "registerart": "HRB",
      "company_name": "Martin Zech GmbH",
      "company_seat": "München",
      "details": "13.02.2025 (Bekanntmachungsdatum)\n\nBayern Amtsgericht München HRB 122857\nRegisterbekanntmachung nach dem Umwandlungsgesetz 12.02.2025 (Eintragungsdatum)\n\nMartin Zech GmbH\nGesellschaft mit beschränkter Haftung\nMünchen\n\nDen Gläubigern der an der Verschmelzung beteiligten Rechtsträger ist, wenn sie binnen sechs Monaten nach dem Tag, an dem die Eintragung der Verschmelzung in das Register des Sitzes desjenigen Rechtsträgers, dessen Gläubiger sie sind, nach § 19 Abs. 3 UmwG als bekannt gemacht gilt, ihren Anspruch nach Grund und Höhe in Textform anmelden, Sicherheit zu leisten, soweit sie nicht Befriedigung verlangen können. Dieses Recht steht den Gläubigern jedoch nur zu, wenn sie glaubhaft machen, dass durch die Verschmelzung die Erfüllung ihrer Forderung gefährdet wird."
    },
    {
      "date": "2025-02-13",
      "id": "101207",
      "original_text": "Einreichung neuer Dokumente\nBayern Amtsgericht Fürth HRB 15655\nValeo eAutomotive Germany GmbH – Erlangen",
      "type": "Einreichung neuer Dokumente",
      "state": "Bayern",
      "amtsgericht": "Amtsgericht Fürth",
      "registernummer": "HRB 15655",
      "registerart": "HRB",
      "company_name": "Valeo eAutomotive Germany GmbH",
      "company_seat": "Erlangen",
      "details": "13.02.2025 (Bekanntmachungsdatum)\n\nBayern Amtsgericht Fürth HRB 15655\nEinreichung neuer Dokumente\n\nValeo eAutomotive Germany GmbH\nGesellschaft mit beschränkter Haftung\nErlangen\n\nDem Amtsgericht Fürth -Registergericht- ist eine Liste der Mitglieder des Aufsichtsrats eingereicht worden, § 52 Abs. 3 S. 2 GmbHG."
    },
    {
      "date": "2025-02-13",
      "id": "101208",
      "original_text": "Sonstige Registerbekanntmachung\nBayern Amtsgericht München HRB 173005\nMetechon AG – München",
      "type": "Sonstige Registerbekanntmachung",
      "state": "Bayern",
      "amtsgericht": "Amtsgericht München",
      "registernummer": "HRB 173005",
      "registerart": "HRB",
      "company_name": "Metechon AG",
      "company_seat": "München",
      "details": "13.02.2025 (Bekanntmachungsdatum)\n\nBayern Amtsgericht München HRB 173005\nSonstige Registerbekanntmachung 12.02.2025 (Eintragungsdatum)\n\nMetechon AG\nAktiengesellschaft\nMünchen\n\nDen Gläubigern der Gesellschaft, deren Forderungen begründet worden sind, bevor die Eintragung des Beschlusses bekanntgemacht worden ist, ist, wenn sie sich binnen sechs Monaten nach der Bekanntmachung zu diesem Zweck melden, Sicherheit zu leisten, soweit sie nicht Befriedigung verlangen können. Das Recht, Sicherheitsleistung zu verlangen, steht Gläubigern nicht zu, die im Fall des Insolvenzverfahrens ein Recht auf vorzugsweise Befriedigung aus einer Deckungsmasse haben, die nach gesetzlicher Vorschrift zu ihrem Schutz errichtet und staatlich überwacht ist."
    },
    {
      "date": "2025-02-13",
      "id": "101209",
      "original_text": "Einreichung neuer Dokumente\nBayern Amtsgericht München HRB 283862\ntaskforce - Management on Demand AG – München",
      "type": "Einreichung neuer Dokumente",
      "state": "Bayern",
      "amtsgericht": "Amtsgericht München",
      "registernummer": "HRB 283862",
      "registerart": "HRB",
      "company_name": "taskforce - Management on Demand AG",
      "company_seat": "München",
      "details": "13.02.2025 (Bekanntmachungsdatum)\n\nBayern Amtsgericht München HRB 283862\nEinreichung neuer Dokumente 12.02.2025 (Eintragungsdatum)\n\ntaskforce - Management on Demand AG\nAktiengesellschaft\nMünchen\n\nDem Amtsgericht München -Registergericht- ist eine Liste der Mitglieder des Aufsichtsrats eingereicht worden, § 106 AktG."
    },
    {
      "date": "2025-02-13",
      "id": "101210",
      "original_text": "Einreichung neuer Dokumente\nSaarland Amtsgericht Saarbrücken HRB 2945\nHKH Heizkraftwerk Homburg GmbH – Homburg",
      "type": "Einreichung neuer Dokumente",
      "state": "Saarland",
      "amtsgericht": "Amtsgericht Saarbrücken",
      "registernummer": "HRB 2945",
      "registerart": "HRB",
      "company_name": "HKH Heizkraftwerk Homburg GmbH",
      "company_seat": "Homburg",
      "details": "13.02.2025 (Bekanntmachungsdatum)\n\nSaarland Amtsgericht Saarbrücken HRB 2945\nEinreichung neuer Dokumente\n\nHKH Heizkraftwerk Homburg GmbH\nGesellschaft mit beschränkter Haftung\nHomburg\n\nDie Geschäftsführung der Gesellschaft hat eine Liste der Mitglieder des Aufsichtsrats zum Handelsregister eingereicht (§ 52 Abs. 3 Satz 2 GmbHG)."
    },
    {
      "date": "2025-02-13",
      "id": "101211",
      "original_text": "Einreichung neuer Dokumente\nSaarland Amtsgericht Saarbrücken HRB 8949\nStadtwerke Saarbrücken Beteiligungsgesellschaft mbH – Saarbrücken",
      "type": "Einreichung neuer Dokumente",
      "state": "Saarland",
      "amtsgericht": "Amtsgericht Saarbrücken",
      "registernummer": "HRB 8949",
      "registerart": "HRB",
      "company_name": "Stadtwerke Saarbrücken Beteiligungsgesellschaft mbH",
      "company_seat": "Saarbrücken",
      "details": "13.02.2025 (Bekanntmachungsdatum)\n\nSaarland Amtsgericht Saarbrücken HRB 8949\nEinreichung neuer Dokumente\n\nStadtwerke Saarbrücken Beteiligungsgesellschaft mbH\nGesellschaft mit beschränkter Haftung\nSaarbrücken\n\nDie Geschäftsführung der Gesellschaft hat eine Liste der Mitglieder des Aufsichtsrats zum Handelsregister eingereicht (§ 52 Abs. 3 Satz 2 GmbHG)."
    },
    {
      "date": "2025-02-13",
      "id": "101212",
      "original_text": "Registerbekanntmachung nach dem Umwandlungsgesetz\nBaden-Württemberg Amtsgericht Stuttgart HRB 17645\nSC Sanitätshaus Carstens GmbH – Stuttgart",
      "type": "Registerbekanntmachung nach dem Umwandlungsgesetz",
      "state": "Baden-Württemberg",
      "amtsgericht": "Amtsgericht Stuttgart",
      "registernummer": "HRB 17645",
      "registerart": "HRB",
      "company_name": "SC Sanitätshaus Carstens GmbH",
      "company_seat": "Stuttgart",
      "details": "13.02.2025 (Bekanntmachungsdatum)\n\nBaden-Württemberg Amtsgericht Stuttgart HRB 17645\nRegisterbekanntmachung nach dem Umwandlungsgesetz 13.02.2025 (Eintragungsdatum)\n\nSC Sanitätshaus Carstens GmbH\nGesellschaft mit beschränkter Haftung\nStuttgart\n\nAls nicht eingetragen wird bekanntgemacht:\nDen Gläubigern der an der Verschmelzung beteiligten Rechtsträger ist, wenn sie binnen sechs Monaten nach dem Tag, an dem die Eintragung der Verschmelzung in das Register des Sitzes desjenigen Rechtsträgers, dessen Gläubiger sie sind, nach § 19 Abs. 3 UmwG als bekanntgemacht gilt, ihren Anspruch nach Grund und Höhe schriftlich anmelden, Sicherheit zu leisten, soweit sie nicht Befriedigung verlangen können. Dieses Recht steht den Gläubigern jedoch nur zu, wenn sie glaubhaft machen, dass durch die Verschmelzung die Erfüllung ihrer Forderung gefährdet wird."
    },
    {
      "date": "2025-02-13",
      "id": "101213",
      "original_text": "Löschungsankündigung\nSchleswig-Holstein Amtsgericht Lübeck HRB 22647\nINNOVATIVE GLOBAL BUSINESS SOLUTIONS GMBH – Ammersbek",
      "type": "Löschungsankündigung",
      "state": "Schleswig-Holstein",
      "amtsgericht": "Amtsgericht Lübeck",
      "registernummer": "HRB 22647",
      "registerart": "HRB",
      "company_name": "INNOVATIVE GLOBAL BUSINESS SOLUTIONS GMBH",
      "company_seat": "Ammersbek",
      "details": "13.02.2025 (Bekanntmachungsdatum)\n\nSchleswig-Holstein Amtsgericht Lübeck HRB 22647\nLöschungsankündigung\n\nINNOVATIVE GLOBAL BUSINESS SOLUTIONS GMBH\nGesellschaft mit beschränkter Haftung\nAmmersbek\n\nEs ist die Löschung der nachstehenden Gesellschaft wegen Vermögenslosigkeit gemäß § 394 FamFG beabsichtigt. Widerspruchsfrist: 1 Monat."
    },
    {
      "date": "2025-02-13",
      "id": "101214",
      "original_text": "Sonstige Registerbekanntmachung\nBaden-Württemberg Amtsgericht Mannheim HRB 504559\nDENTAURUM International GmbH – Ispringen",
      "type": "Sonstige Registerbekanntmachung",
      "state": "Baden-Württemberg",
      "amtsgericht": "Amtsgericht Mannheim",
      "registernummer": "HRB 504559",
      "registerart": "HRB",
      "company_name": "DENTAURUM International GmbH",
      "company_seat": "Ispringen",
      "details": "13.02.2025 (Bekanntmachungsdatum)\n\nBaden-Württemberg Amtsgericht Mannheim HRB 504559\nSonstige Registerbekanntmachung 13.02.2025 (Eintragungsdatum)\n\nDENTAURUM International GmbH\nGesellschaft mit beschränkter Haftung\nIspringen\n\nDen Gläubigern der Gesellschaft, deren Forderungen begründet worden sind, bevor die Eintragung der Beendigung des Vertrages in das Handelsregister nach § 10 HGB als bekanntgemacht gilt, ist vom anderen Vertragsteil Sicherheit zu leisten, wenn sie sich binnen sechs Monaten nach der Bekanntmachung zu diesem Zweck bei ihm melden."
    },
    {
      "date": "2025-02-13",
      "id": "101215",
      "original_text": "Registerbekanntmachung nach dem Umwandlungsgesetz\nSchleswig-Holstein Amtsgericht Kiel HRB 24592\nGrundhaus Elementbau GmbH – Neuwittenbek",
      "type": "Registerbekanntmachung nach dem Umwandlungsgesetz",
      "state": "Schleswig-Holstein",
      "amtsgericht": "Amtsgericht Kiel",
      "registernummer": "HRB 24592",
      "registerart": "HRB",
      "company_name": "Grundhaus Elementbau GmbH",
      "company_seat": "Neuwittenbek",
      "details": "13.02.2025 (Bekanntmachungsdatum)\n\nSchleswig-Holstein Amtsgericht Kiel HRB 24592\nRegisterbekanntmachung nach dem Umwandlungsgesetz 12.02.2025 (Eintragungsdatum)\n\nGrundhaus Elementbau GmbH\nGesellschaft mit beschränkter Haftung\nNeuwittenbek\n\nZu Eintragungsnummer 3 vom 12.02.2025 wird als nicht eingetragen veröffentlicht: Den Gläubigern der an der Verschmelzung beteiligten Rechtsträger ist, wenn sie binnen sechs Monaten nach dem Tag, an dem die Eintragung der Verschmelzung in das Register des Sitzes desjenigen Rechtsträgers, dessen Gläubiger sie sind, nach § 19 Abs. 3 UmwG bekannt gemacht worden ist, ihren Anspruch nach Grund und Höhe schriftlich anmelden, Sicherheit zu leisten, soweit sie nicht Befriedigung verlangen können. Dieses Recht steht den Gläubigern jedoch nur zu, wenn sie glaubhaft machen, dass durch die Verschmelzung die Erfüllung ihrer Forderung gefährdet wird."
    },
    {
      "date": "2025-02-13",
      "id": "101216",
      "original_text": "Löschungsankündigung\nSachsen-Anhalt Amtsgericht Stendal HRB 32529\nFein Investing GmbH – Könnern",
      "type": "Löschungsankündigung",
      "state": "Sachsen-Anhalt",
      "amtsgericht": "Amtsgericht Stendal",
      "registernummer": "HRB 32529",
      "registerart": "HRB",
      "company_name": "Fein Investing GmbH",
      "company_seat": "Könnern",
      "details": "13.02.2025 (Bekanntmachungsdatum)\n\nSachsen-Anhalt Amtsgericht Stendal HRB 32529\nLöschungsankündigung\n\nFein Investing GmbH\nGesellschaft mit beschränkter Haftung\nKönnern\n\nDas Registergericht beabsichtigt, nachfolgende Gesellschaften wegen Vermögenslosigkeit von Amts wegen nach § 394 FamFG zu löschen. Die Frist zur Erhebung eines Widerspruchs gegen die beabsichtigte Löschung wird auf drei Monate festgesetzt."
    },
    {
      "date": "2025-02-13",
      "id": "101217",
      "original_text": "Einreichung neuer Dokumente\nBaden-Württemberg Amtsgericht Freiburg HRB 722551\nDreiWelten Tourismus GmbH – Bad Dürrheim",
      "type": "Einreichung neuer Dokumente",
      "state": "Baden-Württemberg",
      "amtsgericht": "Amtsgericht Freiburg",
      "registernummer": "HRB 722551",
      "registerart": "HRB",
      "company_name": "DreiWelten Tourismus GmbH",
      "company_seat": "Bad Dürrheim",
      "details": "13.02.2025 (Bekanntmachungsdatum)\n\nBaden-Württemberg Amtsgericht Freiburg HRB 722551\nEinreichung neuer Dokumente 13.02.2025 (Eintragungsdatum)\n\nDreiWelten Tourismus GmbH\nGesellschaft mit beschränkter Haftung\nBad Dürrheim\n\nDie Gesellschaft hat am 11.02.2025 die Liste über die Zusammensetzung des Aufsichtsrats zum Handelsregister eingereicht."
    },
    {
      "date": "2025-02-13",
      "id": "101218",
      "original_text": "Registerbekanntmachung nach dem Umwandlungsgesetz\nBaden-Württemberg Amtsgericht Stuttgart HRB 204800\nART Schaltanlagenbau GmbH – Gerlingen",
      "type": "Registerbekanntmachung nach dem Umwandlungsgesetz",
      "state": "Baden-Württemberg",
      "amtsgericht": "Amtsgericht Stuttgart",
      "registernummer": "HRB 204800",
      "registerart": "HRB",
      "company_name": "ART Schaltanlagenbau GmbH",
      "company_seat": "Gerlingen",
      "details": "13.02.2025 (Bekanntmachungsdatum)\n\nBaden-Württemberg Amtsgericht Stuttgart HRB 204800\nRegisterbekanntmachung nach dem Umwandlungsgesetz 13.02.2025 (Eintragungsdatum)\n\nART Schaltanlagenbau GmbH\nGesellschaft mit beschränkter Haftung\nGerlingen\n\nAls nicht eingetragen wird bekanntgemacht:\nDen Gläubigern der an der Verschmelzung beteiligten Rechtsträger ist, wenn sie binnen sechs Monaten nach dem Tag, an dem die Eintragung der Verschmelzung in das Register des Sitzes desjenigen Rechtsträgers, dessen Gläubiger sie sind, nach § 19 Abs. 3 UmwG als bekanntgemacht gilt, ihren Anspruch nach Grund und Höhe schriftlich anmelden, Sicherheit zu leisten, soweit sie nicht Befriedigung verlangen können. Dieses Recht steht den Gläubigern jedoch nur zu, wenn sie glaubhaft machen, dass durch die Verschmelzung die Erfüllung ihrer Forderung gefährdet wird."
    },
    {
      "date": "2025-02-13",
      "id": "101219",
      "original_text": "Registerbekanntmachung nach dem Umwandlungsgesetz\nBaden-Württemberg Amtsgericht Stuttgart HRB 232000\nBühr Elektro & MSR GmbH – Gerlingen",
      "type": "Registerbekanntmachung nach dem Umwandlungsgesetz",
      "state": "Baden-Württemberg",
      "amtsgericht": "Amtsgericht Stuttgart",
      "registernummer": "HRB 232000",
      "registerart": "HRB",
      "company_name": "Bühr Elektro & MSR GmbH",
      "company_seat": "Gerlingen",
      "details": "13.02.2025 (Bekanntmachungsdatum)\n\nBaden-Württemberg Amtsgericht Stuttgart HRB 232000\nRegisterbekanntmachung nach dem Umwandlungsgesetz 13.02.2025 (Eintragungsdatum)\n\nBühr Elektro & MSR GmbH\nGesellschaft mit beschränkter Haftung\nGerlingen\n\nDen Gläubigern der an der Verschmelzung beteiligten Rechtsträger ist, wenn sie binnen sechs Monaten nach dem Tag, an dem die Eintragung der Verschmelzung in das Register des Sitzes desjenigen Rechtsträgers, dessen Gläubiger sie sind, nach § 19 Abs. 3 UmwG als bekanntgemacht gilt, ihren Anspruch nach Grund und Höhe schriftlich anmelden, Sicherheit zu leisten, soweit sie nicht Befriedigung verlangen können. Dieses Recht steht den Gläubigern jedoch nur zu, wenn sie glaubhaft machen, dass durch die Verschmelzung die Erfüllung ihrer Forderung gefährdet wird."
    },
    {
      "date": "2025-02-13",
      "id": "101220",
      "original_text": "Löschungsankündigung\nBrandenburg Amtsgericht Frankfurt/Oder HRB 12831\nStarTec Gesellschaft für Bau- & Event-Management mbH – Herzfelde",
      "type": "Löschungsankündigung",
      "state": "Brandenburg",
      "amtsgericht": "Amtsgericht Frankfurt/Oder",
      "registernummer": "HRB 12831",
      "registerart": "HRB",
      "company_name": "StarTec Gesellschaft für Bau- & Event-Management mbH",
      "company_seat": "Herzfelde",
      "details": "13.02.2025 (Bekanntmachungsdatum)\n\nBrandenburg Amtsgericht Frankfurt/Oder HRB 12831\nLöschungsankündigung\n\nStarTec Gesellschaft für Bau- & Event-Management mbH\nGesellschaft mit beschränkter Haftung\nHerzfelde\n\nBei der nachstehenden Gesellschaft wird das Amtslöschungsverfahren gemäß § 394 FamFG eingeleitet."
    },
    {
      "date": "2025-02-13",
      "id": "101221",
      "original_text": "Löschungsankündigung\nBaden-Württemberg Amtsgericht Mannheim HRB 714020\nGilbert Elektrotechnik GmbH – Knittlingen",
      "type": "Löschungsankündigung",
      "state": "Baden-Württemberg",
      "amtsgericht": "Amtsgericht Mannheim",
      "registernummer": "HRB 714020",
      "registerart": "HRB",
      "company_name": "Gilbert Elektrotechnik GmbH",
      "company_seat": "Knittlingen",
      "details": "13.02.2025 (Bekanntmachungsdatum)\n\nBaden-Württemberg Amtsgericht Mannheim HRB 714020\nLöschungsankündigung\n\nGilbert Elektrotechnik GmbH\nGesellschaft mit beschränkter Haftung\nKnittlingen\n\nDas Gericht beabsichtigt, die Gesellschaft wegen Vermögenslosigkeit im Handelsregister von Amts wegen nach § 394 FamFG zu löschen. Die Frist zur Geltendmachung eines Widerspruchs gegen die beabsichtigte Löschung ist auf einen Monat ab Veröffentlichung bestimmt."
    },
    {
      "date": "2025-02-13",
      "id": "101222",
      "original_text": "Sonstige Registerbekanntmachung\nSchleswig-Holstein Amtsgericht Lübeck HRB 20382\nSmart Solution Consulting GmbH – Elmenhorst",
      "type": "Sonstige Registerbekanntmachung",
      "state": "Schleswig-Holstein",
      "amtsgericht": "Amtsgericht Lübeck",
      "registernummer": "HRB 20382",
      "registerart": "HRB",
      "company_name": "Smart Solution Consulting GmbH",
      "company_seat": "Elmenhorst",
      "details": "13.02.2025 (Bekanntmachungsdatum)\n\nSchleswig-Holstein Amtsgericht Lübeck HRB 20382\nSonstige Registerbekanntmachung\n\nSmart Solution Consulting GmbH\nGesellschaft mit beschränkter Haftung\nElmenhorst\n\nAls nicht eingetragen wird veröffentlicht: In der Handelsregistersache der Smart Solution Consulting GmbH\nergeben sich aus den vorliegenden Unterlagen Anhaltspunkte dafür, dass die Gesellschaft, als deren Geschäftsführer Sie noch eingetragen sind, vermögenslos ist:\n\nSchreiben des Finanzamtes Stormarn vom 28.01.2025.\n\nIch beabsichtige daher, die Gesellschaft wegen Vermögenslosigkeit gemäß § 394 FamFG zu löschen.\n\nIch bestimme eine Frist von einem Monat zur Geltendmachung eines Widerspruchs gegen die Löschung, § 394 Abs. 2 S. 1 FamFG.\n\nGgf. bitte ich Sie, mir binnen derselben Frist mitzuteilen, ob die genannte Gesellschaft noch Vermögen hat, welche Vermögensgegenstände sie besitzt, ob die Gesellschaft noch Partei eines noch nicht rechtskräftig abgeschlossenen Rechtsstreits ist, ob noch Rückforderungen der Gesellschaft gegenüber dem Finanzamt bestehen, ob die Gesellschaft noch an einer anderen Gesellschaft beteiligt ist, ob Grundbucheintragungen der Gesellschaft bestehen oder ob sonst noch eine Abwicklung stattfindet.\n\nNach Fristablauf ohne Widerspruch von Ihnen oder anderer Seite wird die Gesellschaft gelöscht."
    },
    {
      "date": "2025-02-13",
      "id": "101223",
      "original_text": "Einreichung neuer Dokumente\nSaarland Amtsgericht Saarbrücken HRB 10720\nSaarbahn GmbH – Saarbrücken",
      "type": "Einreichung neuer Dokumente",
      "state": "Saarland",
      "amtsgericht": "Amtsgericht Saarbrücken",
      "registernummer": "HRB 10720",
      "registerart": "HRB",
      "company_name": "Saarbahn GmbH",
      "company_seat": "Saarbrücken",
      "details": "13.02.2025 (Bekanntmachungsdatum)\n\nSaarland Amtsgericht Saarbrücken HRB 10720\nEinreichung neuer Dokumente\n\nSaarbahn GmbH\nGesellschaft mit beschränkter Haftung\nSaarbrücken\n\nDie Geschäftsführung der Gesellschaft hat eine Liste der Mitglieder des Aufsichtsrats zum Handelsregister eingereicht (§ 52 Abs. 3 Satz 2 GmbHG)."
    },
    {
      "date": "2025-02-13",
      "id": "101224",
      "original_text": "Einreichung neuer Dokumente\nBerlin Amtsgericht Berlin (Charlottenburg) HRB 100617\nTransdev GmbH – Berlin",
      "type": "Einreichung neuer Dokumente",
      "state": "Berlin",
      "amtsgericht": "Amtsgericht Berlin (Charlottenburg)",
      "registernummer": "HRB 100617",
      "registerart": "HRB",
      "company_name": "Transdev GmbH",
      "company_seat": "Berlin",
      "details": "13.02.2025 (Bekanntmachungsdatum)\n\nBerlin Amtsgericht Berlin (Charlottenburg) HRB 100617\nEinreichung neuer Dokumente\n\nTransdev GmbH\nGesellschaft mit beschränkter Haftung\nBerlin\n\nAls nicht eingetragen wird veröffentlicht: Es wurde eine neue Liste der Aufsichtsratsmitglieder eingereicht (§52 GmbHG)."
    },
    {
      "date": "2025-02-13",
      "id": "101225",
      "original_text": "Löschungsankündigung\nBrandenburg Amtsgericht Frankfurt/Oder HRB 17272\nR&G Dach & Holzbau UG (haftungsbeschränkt) – Steinhöfel",
      "type": "Löschungsankündigung",
      "state": "Brandenburg",
      "amtsgericht": "Amtsgericht Frankfurt/Oder",
      "registernummer": "HRB 17272",
      "registerart": "HRB",
      "company_name": "R&G Dach & Holzbau UG (haftungsbeschränkt)",
      "company_seat": "Steinhöfel",
      "details": "13.02.2025 (Bekanntmachungsdatum)\n\nBrandenburg Amtsgericht Frankfurt/Oder HRB 17272\nLöschungsankündigung\n\nR&G Dach & Holzbau UG (haftungsbeschränkt)\nGesellschaft mit beschränkter Haftung\nSteinhöfel\n\nBei der nachstehenden Gesellschaft wird das Amtslöschungsverfahren gemäß § 394 FamFG eingeleitet."
    },
    {
      "date": "2025-02-13",
      "id": "101226",
      "original_text": "Löschungsankündigung\nBaden-Württemberg Amtsgericht Mannheim HRB 734546\nRSP 4 Horses UG (haftungsbeschränkt) – Pforzheim",
      "type": "Löschungsankündigung",
      "state": "Baden-Württemberg",
      "amtsgericht": "Amtsgericht Mannheim",
      "registernummer": "HRB 734546",
      "registerart": "HRB",
      "company_name": "RSP 4 Horses UG (haftungsbeschränkt)",
      "company_seat": "Pforzheim",
      "details": "13.02.2025 (Bekanntmachungsdatum)\n\nBaden-Württemberg Amtsgericht Mannheim HRB 734546\nLöschungsankündigung\n\nRSP 4 Horses UG (haftungsbeschränkt)\nGesellschaft mit beschränkter Haftung\nPforzheim\n\nDas Gericht beabsichtigt, die Gesellschaft wegen Vermögenslosigkeit im Handelsregister von Amts wegen nach § 394 FamFG zu löschen. Die Frist zur Geltendmachung eines Widerspruchs gegen die beabsichtigte Löschung ist auf einen Monat ab Veröffentlichung bestimmt."
    },
    {
      "date": "2025-02-13",
      "id": "101227",
      "original_text": "Löschungsankündigung\nBerlin Amtsgericht Berlin (Charlottenburg) HRB 252319\nJonas B. Immobilien Investment GmbH – Berlin",
      "type": "Löschungsankündigung",
      "state": "Berlin",
      "amtsgericht": "Amtsgericht Berlin (Charlottenburg)",
      "registernummer": "HRB 252319",
      "registerart": "HRB",
      "company_name": "Jonas B. Immobilien Investment GmbH",
      "company_seat": "Berlin",
      "details": "13.02.2025 (Bekanntmachungsdatum)\n\nBerlin Amtsgericht Berlin (Charlottenburg) HRB 252319\nLöschungsankündigung\n\nJonas B. Immobilien Investment GmbH\nGesellschaft mit beschränkter Haftung\nBerlin\n\nBei der nachstehenden Gesellschaft wird das Amtslöschungsverfahren gemäß § 394 FamFG eingeleitet. Widerspruchsfrist 6 Wochen"
    },
    {
      "date": "2025-02-13",
      "id": "101228",
      "original_text": "Löschungsankündigung\nThüringen Amtsgericht Jena HRB 111759\nC-TK GmbH – Buttstädt",
      "type": "Löschungsankündigung",
      "state": "Thüringen",
      "amtsgericht": "Amtsgericht Jena",
      "registernummer": "HRB 111759",
      "registerart": "HRB",
      "company_name": "C-TK GmbH",
      "company_seat": "Buttstädt",
      "details": "13.02.2025 (Bekanntmachungsdatum)\n\nThüringen Amtsgericht Jena HRB 111759\nLöschungsankündigung\n\nC-TK GmbH\nGesellschaft mit beschränkter Haftung\nButtstädt\n\nDas Registergericht beabsichtigt, die im Handelsregister eingetragene Gesellschaft wegen Vermögenslosigkeit nach § 394 FamFG von Amts wegen zu löschen. Die Frist zur Erhebung eines Widerspruchs gegen die beabsichtigte Löschung wird auf 6 Wochen festgesetzt."
    },
    {
      "date": "2025-02-13",
      "id": "101229",
      "original_text": "Sonstige Registerbekanntmachung\nThüringen Amtsgericht Gotha VR 141689\nRing deutscher Pfadfinder*innenverbände Thüringen e. V. – Nesse-Apfelstädt",
      "type": "Sonstige Registerbekanntmachung",
      "state": "Thüringen",
      "amtsgericht": "Amtsgericht Gotha",
      "registernummer": "VR 141689",
      "registerart": "VR",
      "company_name": "Ring deutscher Pfadfinder*innenverbände Thüringen e. V.",
      "company_seat": "Nesse-Apfelstädt",
      "details": "13.02.2025 (Bekanntmachungsdatum)\n\nThüringen Amtsgericht Gotha VR 141689\nSonstige Registerbekanntmachung 13.02.2025 (Eintragungsdatum)\n\nRing deutscher Pfadfinder*innenverbände Thüringen e. V.\neingetragener Verein\nNesse-Apfelstädt"
    },
    {
      "date": "2025-02-13",
      "id": "101230",
      "original_text": "Einreichung neuer Dokumente\nThüringen Amtsgericht Jena HRB 102493\nSWE Stadtwerke Erfurt GmbH – Erfurt",
      "type": "Einreichung neuer Dokumente",
      "state": "Thüringen",
      "amtsgericht": "Amtsgericht Jena",
      "registernummer": "HRB 102493",
      "registerart": "HRB",
      "company_name": "SWE Stadtwerke Erfurt GmbH",
      "company_seat": "Erfurt",
      "details": "13.02.2025 (Bekanntmachungsdatum)\n\nThüringen Amtsgericht Jena HRB 102493\nEinreichung neuer Dokumente 13.02.2025 (Eintragungsdatum)\n\nSWE Stadtwerke Erfurt GmbH\nGesellschaft mit beschränkter Haftung\nErfurt\n\nBekanntmachung gem. § 52 Abs. 3 Satz 2 GmbHG: Aufgrund einer Veränderung in den Personen der Aufsichtsratsmitglieder ist durch die Geschäftsführer eine neue Liste zum Handelsregister eingereicht worden."
    },
    {
      "date": "2025-02-13",
      "id": "101231",
      "original_text": "Registerbekanntmachung nach dem Umwandlungsgesetz\nSachsen-Anhalt Amtsgericht Stendal HRB 34960\nLYB Solvent Recycling GmbH – Merseburg",
      "type": "Registerbekanntmachung nach dem Umwandlungsgesetz",
      "state": "Sachsen-Anhalt",
      "amtsgericht": "Amtsgericht Stendal",
      "registernummer": "HRB 34960",
      "registerart": "HRB",
      "company_name": "LYB Solvent Recycling GmbH",
      "company_seat": "Merseburg",
      "details": "13.02.2025 (Bekanntmachungsdatum)\n\nSachsen-Anhalt Amtsgericht Stendal HRB 34960\nRegisterbekanntmachung nach dem Umwandlungsgesetz 13.02.2025 (Eintragungsdatum)\n\nLYB Solvent Recycling GmbH\nGesellschaft mit beschränkter Haftung\nMerseburg\n\nDie APK IP Management GmbH mit dem Sitz in Merseburg (Amtsgericht Stendal HRB 34073) ist auf Grund des Verschmelzungsvertrages vom 10.02.2025  und der Beschlüsse der Gesellschafterversammlungen vom selben Tag mit der Gesellschaft verschmolzen. Nicht eingetragen: Den Gläubigern der an der Verschmelzung beteiligten Rechtsträger ist, wenn sie binnen sechs Monaten nach dem Tag, an dem die Eintragung der Verschmelzung nach § 19 Abs. 3 UmwG als bekanntgemacht gilt, ihren Anspruch nach Grund und Höhe schriftlich anmelden, Sicherheit zu leisten, soweit sie nicht Befriedigung verlangen können. Dieses Recht steht ihnen jedoch nur zu, wenn sie glaubhaft machen, dass durch die Verschmelzung die Erfüllung ihrer Forderung gefährdet wird."
    },
    {
      "date": "2025-02-13",
      "id": "101232",
      "original_text": "Registerbekanntmachung nach dem Umwandlungsgesetz\nSachsen-Anhalt Amtsgericht Stendal HRB 34073\nAPK IP Management GmbH – Merseburg",
      "type": "Registerbekanntmachung nach dem Umwandlungsgesetz",
      "state": "Sachsen-Anhalt",
      "amtsgericht": "Amtsgericht Stendal",
      "registernummer": "HRB 34073",
      "registerart": "HRB",
      "company_name": "APK IP Management GmbH",
      "company_seat": "Merseburg",
      "details": "13.02.2025 (Bekanntmachungsdatum)\n\nSachsen-Anhalt Amtsgericht Stendal HRB 34073\nRegisterbekanntmachung nach dem Umwandlungsgesetz 13.02.2025 (Eintragungsdatum)\n\nAPK IP Management GmbH\nGesellschaft mit beschränkter Haftung\nMerseburg\n\nDie Gesellschaft ist auf Grund des Verschmelzungsvertrages vom 10.02.2025 sowie der Beschlüsse der Gesellschafterversammlungen vom selben Tag mit der LYB Solvent Recycling GmbH mit dem Sitz in Magdeburg (Amtsgericht Stendal HRB 34960) verschmolzen. Die Verschmelzung ist mit der Eintragung der Verschmelzung in das Handelsregister der übernehmenden Gesellschaft am 13.02.2025 wirksam geworden. Nicht eingetragen:\nDen Gläubigern der an der Verschmelzung beteiligten Rechtsträger ist, wenn sie binnen sechs Monaten nach dem Tag, an dem die Eintragung der Verschmelzung nach § 19 Abs. 3 UmwG als bekanntgemacht gilt, ihren Anspruch nach Grund und Höhe schriftlich anmelden, Sicherheit zu leisten, soweit sie nicht Befriedigung verlangen können. Dieses Recht steht ihnen jedoch nur zu, wenn sie glaubhaft machen, dass durch die Verschmelzung die Erfüllung ihrer Forderung gefährdet wird."
    },
    {
      "date": "2025-02-13",
      "id": "101233",
      "original_text": "Einreichung neuer Dokumente\nSachsen-Anhalt Amtsgericht Stendal HRB 34576\nLandesgartenschau Lutherstadt Wittenberg 2027 GmbH – Lutherstadt Wittenberg",
      "type": "Einreichung neuer Dokumente",
      "state": "Sachsen-Anhalt",
      "amtsgericht": "Amtsgericht Stendal",
      "registernummer": "HRB 34576",
      "registerart": "HRB",
      "company_name": "Landesgartenschau Lutherstadt Wittenberg 2027 GmbH",
      "company_seat": "Lutherstadt Wittenberg",
      "details": "13.02.2025 (Bekanntmachungsdatum)\n\nSachsen-Anhalt Amtsgericht Stendal HRB 34576\nEinreichung neuer Dokumente\n\nLandesgartenschau Lutherstadt Wittenberg 2027 GmbH\nGesellschaft mit beschränkter Haftung\nLutherstadt Wittenberg\n\nEine Liste der Mitglieder des Aufsichtsrates wurde zum Handelsregister eingereicht."
    },
    {
      "date": "2025-02-13",
      "id": "101234",
      "original_text": "Registerbekanntmachung nach dem Umwandlungsgesetz\nHamburg Amtsgericht Hamburg HRB 125199\nHTP Friedrichsberger Lofts GmbH – Hamburg",
      "type": "Registerbekanntmachung nach dem Umwandlungsgesetz",
      "state": "Hamburg",
      "amtsgericht": "Amtsgericht Hamburg",
      "registernummer": "HRB 125199",
      "registerart": "HRB",
      "company_name": "HTP Friedrichsberger Lofts GmbH",
      "company_seat": "Hamburg",
      "details": "13.02.2025 (Bekanntmachungsdatum)\n\nHamburg Amtsgericht Hamburg HRB 125199\nRegisterbekanntmachung nach dem Umwandlungsgesetz 13.02.2025 (Eintragungsdatum)\n\nHTP Friedrichsberger Lofts GmbH\nGesellschaft mit beschränkter Haftung\nHamburg\n\nAls nicht eingetragen wird bekannt gemacht:\nDen Gläubigern der an der Verschmelzung beteiligten Gesellschaften ist, wenn sie binnen sechs Monaten nach dem Tag, an dem die Eintragung der Verschmelzung in das Register des Sitzes desjenigen Rechtsträgers, dessen Gläubiger sie sind, nach § 19 Absatz 3 UmwG als bekannt gemacht gilt, ihren Anspruch nach Grund und Höhe schriftlich anmelden, Sicherheit zu leisten, soweit sie nicht Befriedigung verlangen können. Dieses Recht steht den Gläubigern jedoch nur zu, wenn sie glaubhaft machen, dass durch die Verschmelzung die Erfüllung ihrer Forderung gefährdet wird."
    },
    {
      "date": "2025-02-13",
      "id": "101235",
      "original_text": "Löschungsankündigung\nBaden-Württemberg Amtsgericht Freiburg HRB 709357\nSiegler Verwaltungs-GmbH – Überlingen",
      "type": "Löschungsankündigung",
      "state": "Baden-Württemberg",
      "amtsgericht": "Amtsgericht Freiburg",
      "registernummer": "HRB 709357",
      "registerart": "HRB",
      "company_name": "Siegler Verwaltungs-GmbH",
      "company_seat": "Überlingen",
      "details": "13.02.2025 (Bekanntmachungsdatum)\n\nBaden-Württemberg Amtsgericht Freiburg HRB 709357\nLöschungsankündigung\n\nSiegler Verwaltungs-GmbH\nGesellschaft mit beschränkter Haftung\nÜberlingen\n\nDas Gericht beabsichtigt, die Gesellschaft wegen Vermögenslosigkeit im Handelsregister von Amts wegen nach § 394 FamFG zu löschen. Die Frist zur Geltendmachung eines Widerspruchs gegen die beabsichtigte Löschung ist auf einen Monat ab Veröffentlichung bestimmt."
    },
    {
      "date": "2025-02-13",
      "id": "101236",
      "original_text": "Einreichung neuer Dokumente\nSaarland Amtsgericht Saarbrücken HRB 4853\nStadtwerke Saarbrücken Netz AG – Saarbrücken",
      "type": "Einreichung neuer Dokumente",
      "state": "Saarland",
      "amtsgericht": "Amtsgericht Saarbrücken",
      "registernummer": "HRB 4853",
      "registerart": "HRB",
      "company_name": "Stadtwerke Saarbrücken Netz AG",
      "company_seat": "Saarbrücken",
      "details": "13.02.2025 (Bekanntmachungsdatum)\n\nSaarland Amtsgericht Saarbrücken HRB 4853\nEinreichung neuer Dokumente\n\nStadtwerke Saarbrücken Netz AG\nAktiengesellschaft\nSaarbrücken\n\nDer Vorstand der Gesellschaft hat eine Liste der Mitglieder des Aufsichtsrats zum Handelsregister eingereicht (§ 106 AktG)."
    },
    {
      "date": "2025-02-13",
      "id": "101237",
      "original_text": "Registerbekanntmachung nach dem Umwandlungsgesetz\nHamburg Amtsgericht Hamburg HRB 181877\nTdB Beratungs- und Beteiligungs GmbH – Hamburg",
      "type": "Registerbekanntmachung nach dem Umwandlungsgesetz",
      "state": "Hamburg",
      "amtsgericht": "Amtsgericht Hamburg",
      "registernummer": "HRB 181877",
      "registerart": "HRB",
      "company_name": "TdB Beratungs- und Beteiligungs GmbH",
      "company_seat": "Hamburg",
      "details": "13.02.2025 (Bekanntmachungsdatum)\n\nHamburg Amtsgericht Hamburg HRB 181877\nRegisterbekanntmachung nach dem Umwandlungsgesetz 13.02.2025 (Eintragungsdatum)\n\nTdB Beratungs- und Beteiligungs GmbH\nGesellschaft mit beschränkter Haftung\nHamburg\n\nAls nicht eingetragen wird bekannt gemacht:\nDen Gläubigern der an der Verschmelzung beteiligten Gesellschaften ist, wenn sie binnen sechs Monaten nach dem Tag, an dem die Eintragung der Verschmelzung in das Register des Sitzes desjenigen Rechtsträgers, dessen Gläubiger sie sind, nach § 19 Absatz 3 UmwG als bekannt gemacht gilt, ihren Anspruch nach Grund und Höhe schriftlich anmelden, Sicherheit zu leisten, soweit sie nicht Befriedigung verlangen können. Dieses Recht steht den Gläubigern jedoch nur zu, wenn sie glaubhaft machen, dass durch die Verschmelzung die Erfüllung ihrer Forderung gefährdet wird."
    },
    {
      "date": "2025-02-13",
      "id": "101238",
      "original_text": "Registerbekanntmachung nach dem Umwandlungsgesetz\nHamburg Amtsgericht Hamburg HRB 164503\nTHIN Beteiligungs- und Beratungsgesellschaft UG (haftungsbeschränkt) – Hamburg",
      "type": "Registerbekanntmachung nach dem Umwandlungsgesetz",
      "state": "Hamburg",
      "amtsgericht": "Amtsgericht Hamburg",
      "registernummer": "HRB 164503",
      "registerart": "HRB",
      "company_name": "THIN Beteiligungs- und Beratungsgesellschaft UG (haftungsbeschränkt)",
      "company_seat": "Hamburg",
      "details": "13.02.2025 (Bekanntmachungsdatum)\n\nHamburg Amtsgericht Hamburg HRB 164503\nRegisterbekanntmachung nach dem Umwandlungsgesetz 13.02.2025 (Eintragungsdatum)\n\nTHIN Beteiligungs- und Beratungsgesellschaft UG (haftungsbeschränkt)\nGesellschaft mit beschränkter Haftung\nHamburg\n\nAls nicht eingetragen wird bekannt gemacht:\nDen Gläubigern der an der Verschmelzung beteiligten Gesellschaften ist, wenn sie binnen sechs Monaten nach dem Tag, an dem die Eintragung der Verschmelzung in das Register des Sitzes desjenigen Rechtsträgers, dessen Gläubiger sie sind, nach § 19 Absatz 3 UmwG als bekannt gemacht gilt, ihren Anspruch nach Grund und Höhe schriftlich anmelden, Sicherheit zu leisten, soweit sie nicht Befriedigung verlangen können. Dieses Recht steht den Gläubigern jedoch nur zu, wenn sie glaubhaft machen, dass durch die Verschmelzung die Erfüllung ihrer Forderung gefährdet wird."
    },
    {
      "date": "2025-02-13",
      "id": "101239",
      "original_text": "Löschungsankündigung\nBerlin Amtsgericht Berlin (Charlottenburg) HRB 172822\nKofler Kost GmbH – Berlin",
      "type": "Löschungsankündigung",
      "state": "Berlin",
      "amtsgericht": "Amtsgericht Berlin (Charlottenburg)",
      "registernummer": "HRB 172822",
      "registerart": "HRB",
      "company_name": "Kofler Kost GmbH",
      "company_seat": "Berlin",
      "details": "13.02.2025 (Bekanntmachungsdatum)\n\nBerlin Amtsgericht Berlin (Charlottenburg) HRB 172822\nLöschungsankündigung\n\nKofler Kost GmbH\nGesellschaft mit beschränkter Haftung\nBerlin\n\nBei der nachstehenden Gesellschaft wird das Amtslöschungsverfahren gemäß § 394 FamFG eingeleitet. Widerspruchsfrist 6 Wochen"
    },
    {
      "date": "2025-02-13",
      "id": "101240",
      "original_text": "Löschungsankündigung\nBerlin Amtsgericht Berlin (Charlottenburg) HRB 129416\nGehring Unternehmensberatung UG (haftungsbeschränkt) – Berlin",
      "type": "Löschungsankündigung",
      "state": "Berlin",
      "amtsgericht": "Amtsgericht Berlin (Charlottenburg)",
      "registernummer": "HRB 129416",
      "registerart": "HRB",
      "company_name": "Gehring Unternehmensberatung UG (haftungsbeschränkt)",
      "company_seat": "Berlin",
      "details": "13.02.2025 (Bekanntmachungsdatum)\n\nBerlin Amtsgericht Berlin (Charlottenburg) HRB 129416\nLöschungsankündigung\n\nGehring Unternehmensberatung UG (haftungsbeschränkt)\nGesellschaft mit beschränkter Haftung\nBerlin\n\nBei der nachstehenden Gesellschaft wird das Amtslöschungsverfahren gemäß § 394 FamFG eingeleitet. Widerspruchsfrist 6 Wochen"
    },
    {
      "date": "2025-02-13",
      "id": "101241",
      "original_text": "Löschungsankündigung\nSchleswig-Holstein Amtsgericht Lübeck HRB 16744\nelbfonds Verwaltung GmbH – Witzhave",
      "type": "Löschungsankündigung",
      "state": "Schleswig-Holstein",
      "amtsgericht": "Amtsgericht Lübeck",
      "registernummer": "HRB 16744",
      "registerart": "HRB",
      "company_name": "elbfonds Verwaltung GmbH",
      "company_seat": "Witzhave",
      "details": "13.02.2025 (Bekanntmachungsdatum)\n\nSchleswig-Holstein Amtsgericht Lübeck HRB 16744\nLöschungsankündigung\n\nelbfonds Verwaltung GmbH\nGesellschaft mit beschränkter Haftung\nWitzhave\n\nEs ist die Löschung der nachstehenden Gesellschaft wegen Vermögenslosigkeit gemäß § 394 FamFG beabsichtigt."
    },
    {
      "date": "2025-02-13",
      "id": "101242",
      "original_text": "Löschungsankündigung\nSchleswig-Holstein Amtsgericht Lübeck HRB 16441\nTeutonen Development Limited Zweigniederlassung Deutschland – Lübeck",
      "type": "Löschungsankündigung",
      "state": "Schleswig-Holstein",
      "amtsgericht": "Amtsgericht Lübeck",
      "registernummer": "HRB 16441",
      "registerart": "HRB",
      "company_name": "Teutonen Development Limited Zweigniederlassung Deutschland",
      "company_seat": "Lübeck",
      "details": "13.02.2025 (Bekanntmachungsdatum)\n\nSchleswig-Holstein Amtsgericht Lübeck HRB 16441\nLöschungsankündigung\n\nTeutonen Development Limited Zweigniederlassung Deutschland\nRechtsform ausländischen Rechts HRB\nLübeck\n\nEs ist die Löschung der nachstehenden Gesellschaft wegen Vermögenslosigkeit gemäß § 394 FamFG beabsichtigt."
    },
    {
      "date": "2025-02-13",
      "id": "101243",
      "original_text": "Löschungsankündigung\nSchleswig-Holstein Amtsgericht Kiel HRB 26156\nFX Akustik- und Trockenbau UG (haftungsbeschränkt) – Neumünster",
      "type": "Löschungsankündigung",
      "state": "Schleswig-Holstein",
      "amtsgericht": "Amtsgericht Kiel",
      "registernummer": "HRB 26156",
      "registerart": "HRB",
      "company_name": "FX Akustik- und Trockenbau UG (haftungsbeschränkt)",
      "company_seat": "Neumünster",
      "details": "13.02.2025 (Bekanntmachungsdatum)\n\nSchleswig-Holstein Amtsgericht Kiel HRB 26156\nLöschungsankündigung\n\nFX Akustik- und Trockenbau UG (haftungsbeschränkt)\nGesellschaft mit beschränkter Haftung\nNeumünster\n\nEs ist die Löschung der nachstehenden Gesellschaft wegen Vermögenslosigkeit gemäß § 394 FamFG beabsichtigt. Widerspruchsfrist: 2 Monate."
    },
    {
      "date": "2025-02-13",
      "id": "101244",
      "original_text": "Sonstige Registerbekanntmachung\nSchleswig-Holstein Amtsgericht Kiel HRB 26894\nDreamlight Labs GmbH – Stolpe",
      "type": "Sonstige Registerbekanntmachung",
      "state": "Schleswig-Holstein",
      "amtsgericht": "Amtsgericht Kiel",
      "registernummer": "HRB 26894",
      "registerart": "HRB",
      "company_name": "Dreamlight Labs GmbH",
      "company_seat": "Stolpe",
      "details": "13.02.2025 (Bekanntmachungsdatum)\n\nSchleswig-Holstein Amtsgericht Kiel HRB 26894\nSonstige Registerbekanntmachung 11.02.2025 (Eintragungsdatum)\n\nDreamlight Labs GmbH\nGesellschaft mit beschränkter Haftung\nStolpe\n\nZweigniederlassung im Ausland errichtet:\n1.\nDreamlight Labs GmbH Paris/Frankreich (PARIS, 939989687)\nEUID: FR7501.939989687\n105 avenue Raymond Poincaré, Post-Code: 75116, Paris, Frankreich\nVon Amts wegen eingetragen gem. § 13a HGB."
    },
    {
      "date": "2025-02-13",
      "id": "101245",
      "original_text": "Sonstige Registerbekanntmachung\nSachsen-Anhalt Amtsgericht Stendal VR 48277\nArbeiterwohlfahrt Kreisverband Burgenlandkreis e.V.-Hohenmölsen/Zeitz/Weißenfels – Hohenmölsen",
      "type": "Sonstige Registerbekanntmachung",
      "state": "Sachsen-Anhalt",
      "amtsgericht": "Amtsgericht Stendal",
      "registernummer": "VR 48277",
      "registerart": "VR",
      "company_name": "Arbeiterwohlfahrt Kreisverband Burgenlandkreis e.V.-Hohenmölsen/Zeitz/Weißenfels",
      "company_seat": "Hohenmölsen",
      "details": "13.02.2025 (Bekanntmachungsdatum)\n\nSachsen-Anhalt Amtsgericht Stendal VR 48277\nSonstige Registerbekanntmachung\n\nArbeiterwohlfahrt Kreisverband Burgenlandkreis e.V.-Hohenmölsen/Zeitz/Weißenfels\neingetragener Verein\nHohenmölsen\n\nDas Registergericht beabsichtigt, Herrn Rechtsanwalt Christian Graf Brockdorff, geschäftsansässig Potsdam  zum alleinvertretungsberechtigten Notvorstand des Vereins mit einer Befristung von 6 Monaten zu bestellen.\nEtwaige Einwendungen gegen die beabsichtigte Bestellung sind bis zum 17.02.2025 hier einzureichen."
    },
    {
      "date": "2025-02-13",
      "id": "101246",
      "original_text": "Löschungsankündigung\nBerlin Amtsgericht Berlin (Charlottenburg) HRB 174655\nWorkgalaxie UG (haftungsbeschränkt) – Berlin",
      "type": "Löschungsankündigung",
      "state": "Berlin",
      "amtsgericht": "Amtsgericht Berlin (Charlottenburg)",
      "registernummer": "HRB 174655",
      "registerart": "HRB",
      "company_name": "Workgalaxie UG (haftungsbeschränkt)",
      "company_seat": "Berlin",
      "details": "13.02.2025 (Bekanntmachungsdatum)\n\nBerlin Amtsgericht Berlin (Charlottenburg) HRB 174655\nLöschungsankündigung\n\nWorkgalaxie UG (haftungsbeschränkt)\nGesellschaft mit beschränkter Haftung\nBerlin\n\nBei der nachstehenden Gesellschaft wird das Amtslöschungsverfahren gemäß § 394 FamFG eingeleitet. Widerspruchsfrist 6 Wochen"
    },
    {
      "date": "2025-02-13",
      "id": "101247",
      "original_text": "Einreichung neuer Dokumente\nBaden-Württemberg Amtsgericht Mannheim HRB 716402\nKonversionsgesellschaft Heidelberg mbH – Heidelberg",
      "type": "Einreichung neuer Dokumente",
      "state": "Baden-Württemberg",
      "amtsgericht": "Amtsgericht Mannheim",
      "registernummer": "HRB 716402",
      "registerart": "HRB",
      "company_name": "Konversionsgesellschaft Heidelberg mbH",
      "company_seat": "Heidelberg",
      "details": "13.02.2025 (Bekanntmachungsdatum)\n\nBaden-Württemberg Amtsgericht Mannheim HRB 716402\nEinreichung neuer Dokumente\n\nKonversionsgesellschaft Heidelberg mbH\nGesellschaft mit beschränkter Haftung\nHeidelberg\n\nDie Gesellschaft hat am 04.02.2025 die Liste über die Zusammensetzung des Aufsichtsrats zum Handelsregister eingereicht."
    },
    {
      "date": "2025-02-13",
      "id": "101248",
      "original_text": "Einreichung neuer Dokumente\nSachsen Amtsgericht Chemnitz HRB 12893\nSPELO Stadtplanungs- und Entwicklungsgesellschaft Limbach-Oberfrohna mbH – Limbach-Oberfrohna",
      "type": "Einreichung neuer Dokumente",
      "state": "Sachsen",
      "amtsgericht": "Amtsgericht Chemnitz",
      "registernummer": "HRB 12893",
      "registerart": "HRB",
      "company_name": "SPELO Stadtplanungs- und Entwicklungsgesellschaft Limbach-Oberfrohna mbH",
      "company_seat": "Limbach-Oberfrohna",
      "details": "13.02.2025 (Bekanntmachungsdatum)\n\nSachsen Amtsgericht Chemnitz HRB 12893\nEinreichung neuer Dokumente\n\nSPELO Stadtplanungs- und Entwicklungsgesellschaft Limbach-Oberfrohna mbH\nGesellschaft mit beschränkter Haftung\nLimbach-Oberfrohna\n\nAm 12.02.2025 wurde beim Handelsregister des Amtsgerichts Chemnitz die Liste der Mitglieder des Aufsichtsrats gemäß § 52 GmbHG eingereicht."
    },
    {
      "date": "2025-02-13",
      "id": "101249",
      "original_text": "Sonstige Registerbekanntmachung\nSachsen Amtsgericht Leipzig VR 3997\nVolkstheater e.V. – Leipzig",
      "type": "Sonstige Registerbekanntmachung",
      "state": "Sachsen",
      "amtsgericht": "Amtsgericht Leipzig",
      "registernummer": "VR 3997",
      "registerart": "VR",
      "company_name": "Volkstheater e.V.",
      "company_seat": "Leipzig",
      "details": "13.02.2025 (Bekanntmachungsdatum)\n\nSachsen Amtsgericht Leipzig VR 3997\nSonstige Registerbekanntmachung\n\nVolkstheater e.V.\neingetragener Verein\nLeipzig\n\nDas Gericht beabsichtigt, gemäß § 4 Absatz 2 Ziffer 1 der Verordnung über das Vereinsregister das Registerblatt  des Vereins zu schließen, da nach den Ermittlungen des Gerichts sämtliche Mitglieder aus dem Verein ausgeschieden sind. Zur Geltendmachung eines Widerspruchs gegen die beabsichtigte Schließung wird eine Frist von einem Monat nach der Veröffentlichung bestimmt."
    },
    {
      "date": "2025-02-13",
      "id": "101250",
      "original_text": "Löschungsankündigung\nSachsen Amtsgericht Leipzig HRB 37192\nStark Bau GmbH – Leipzig",
      "type": "Löschungsankündigung",
      "state": "Sachsen",
      "amtsgericht": "Amtsgericht Leipzig",
      "registernummer": "HRB 37192",
      "registerart": "HRB",
      "company_name": "Stark Bau GmbH",
      "company_seat": "Leipzig",
      "details": "13.02.2025 (Bekanntmachungsdatum)\n\nSachsen Amtsgericht Leipzig HRB 37192\nLöschungsankündigung\n\nStark Bau GmbH\nGesellschaft mit beschränkter Haftung\nLeipzig\n\nDas Registergericht beabsichtigt, die im Handelsregister eingetragene Gesellschaft von Amts wegen nach § 394 FamFG zu löschen. Die Frist zu Erhebung eines Widerspruchs gegen die beabsichtigte Löschung wird auf einen Monat festgesetzt."
    },
    {
      "date": "2025-02-13",
      "id": "101251",
      "original_text": "Einreichung neuer Dokumente\nSachsen Amtsgericht Chemnitz HRB 20329\nPoliklinik gemeinnützige GmbH Chemnitz – Chemnitz",
      "type": "Einreichung neuer Dokumente",
      "state": "Sachsen",
      "amtsgericht": "Amtsgericht Chemnitz",
      "registernummer": "HRB 20329",
      "registerart": "HRB",
      "company_name": "Poliklinik gemeinnützige GmbH Chemnitz",
      "company_seat": "Chemnitz",
      "details": "13.02.2025 (Bekanntmachungsdatum)\n\nSachsen Amtsgericht Chemnitz HRB 20329\nEinreichung neuer Dokumente\n\nPoliklinik gemeinnützige GmbH Chemnitz\nGesellschaft mit beschränkter Haftung\nChemnitz\n\nAm 11.02.2025 wurde beim Handelsregister des Amtsgerichts Chemnitz die Liste der Mitglieder des Aufsichtsrats gemäß § 52 GmbHG eingereicht."
    },
    {
      "date": "2025-02-13",
      "id": "101252",
      "original_text": "Registerbekanntmachung nach dem Umwandlungsgesetz\nSachsen Amtsgericht Dresden HRB 42780\nUKA Portfolio 67 GmbH – Meißen",
      "type": "Registerbekanntmachung nach dem Umwandlungsgesetz",
      "state": "Sachsen",
      "amtsgericht": "Amtsgericht Dresden",
      "registernummer": "HRB 42780",
      "registerart": "HRB",
      "company_name": "UKA Portfolio 67 GmbH",
      "company_seat": "Meißen",
      "details": "13.02.2025 (Bekanntmachungsdatum)\n\nSachsen Amtsgericht Dresden HRB 42780\nRegisterbekanntmachung nach dem Umwandlungsgesetz 13.02.2025 (Eintragungsdatum)\n\nUKA Portfolio 67 GmbH\nGesellschaft mit beschränkter Haftung\nMeißen\n\nDen Gläubigern der an der Verschmelzung beteiligten Rechtsträger ist, wenn sie binnen sechs Monaten nach dem Tag, an dem die Eintragung der Verschmelzung in das Register des Sitzes desjenigen Rechtsträgers, dessen Gläubiger sie sind, nach § 19 Abs. 3 UmwG als bekannt gemacht gilt, ihren Anspruch nach Grund und Höhe in Textform anmelden, Sicherheit zu leisten, soweit sie nicht Befriedigung verlangen können. Dieses Recht steht den Gläubigern jedoch nur zu, wenn sie glaubhaft machen, dass durch die Verschmelzung die Erfüllung der Forderung gefährdet wird."
    },
    {
      "date": "2025-02-13",
      "id": "101253",
      "original_text": "Einreichung neuer Dokumente\nSachsen Amtsgericht Leipzig HRB 22056\nEuropean Air Transport Leipzig GmbH – Schkeuditz",
      "type": "Einreichung neuer Dokumente",
      "state": "Sachsen",
      "amtsgericht": "Amtsgericht Leipzig",
      "registernummer": "HRB 22056",
      "registerart": "HRB",
      "company_name": "European Air Transport Leipzig GmbH",
      "company_seat": "Schkeuditz",
      "details": "13.02.2025 (Bekanntmachungsdatum)\n\nSachsen Amtsgericht Leipzig HRB 22056\nEinreichung neuer Dokumente\n\nEuropean Air Transport Leipzig GmbH\nGesellschaft mit beschränkter Haftung\nSchkeuditz\n\nAm 11.02.2025 wurde beim Handelsregister des Amtsgerichts Leipzig die Liste der Mitglieder des Aufsichtsrats gemäß § 52 GmbHG eingereicht."
    },
    {
      "date": "2025-02-13",
      "id": "101254",
      "original_text": "Einreichung neuer Dokumente\nSachsen Amtsgericht Chemnitz HRB 19467\nService-Center Technik GmbH am Klinikum Chemnitz – Chemnitz",
      "type": "Einreichung neuer Dokumente",
      "state": "Sachsen",
      "amtsgericht": "Amtsgericht Chemnitz",
      "registernummer": "HRB 19467",
      "registerart": "HRB",
      "company_name": "Service-Center Technik GmbH am Klinikum Chemnitz",
      "company_seat": "Chemnitz",
      "details": "13.02.2025 (Bekanntmachungsdatum)\n\nSachsen Amtsgericht Chemnitz HRB 19467\nEinreichung neuer Dokumente\n\nService-Center Technik GmbH am Klinikum Chemnitz\nGesellschaft mit beschränkter Haftung\nChemnitz\n\nAm 11.02.2025 wurde beim Handelsregister des Amtsgerichts Chemnitz die Liste der Mitglieder des Aufsichtsrats gemäß § 52 GmbHG eingereicht."
    },
    {
      "date": "2025-02-13",
      "id": "101255",
      "original_text": "Registerbekanntmachung nach dem Umwandlungsgesetz\nSachsen Amtsgericht Dresden HRB 45966\nWindpark Drosa Beteiligungs GmbH – Meißen",
      "type": "Registerbekanntmachung nach dem Umwandlungsgesetz",
      "state": "Sachsen",
      "amtsgericht": "Amtsgericht Dresden",
      "registernummer": "HRB 45966",
      "registerart": "HRB",
      "company_name": "Windpark Drosa Beteiligungs GmbH",
      "company_seat": "Meißen",
      "details": "13.02.2025 (Bekanntmachungsdatum)\n\nSachsen Amtsgericht Dresden HRB 45966\nRegisterbekanntmachung nach dem Umwandlungsgesetz 13.02.2025 (Eintragungsdatum)\n\nWindpark Drosa Beteiligungs GmbH\nGesellschaft mit beschränkter Haftung\nMeißen\n\nDen Gläubigern der an der Verschmelzung beteiligten Rechtsträger ist, wenn sie binnen sechs Monaten nach dem Tag, an dem die Eintragung der Verschmelzung in das Register des Sitzes desjenigen Rechtsträgers, dessen Gläubiger sie sind, nach § 19 Abs. 3 UmwG als bekannt gemacht gilt, ihren Anspruch nach Grund und Höhe in Textform anmelden, Sicherheit zu leisten, soweit sie nicht Befriedigung verlangen können. Dieses Recht steht den Gläubigern jedoch nur zu, wenn sie glaubhaft machen, dass durch die Verschmelzung die Erfüllung der Forderung gefährdet wird."
    },
    {
      "date": "2025-02-13",
      "id": "101256",
      "original_text": "Löschungsankündigung\nNiedersachsen Amtsgericht Aurich HRB 200038\nap extrusion AG – Großefehn",
      "type": "Löschungsankündigung",
      "state": "Niedersachsen",
      "amtsgericht": "Amtsgericht Aurich",
      "registernummer": "HRB 200038",
      "registerart": "HRB",
      "company_name": "ap extrusion AG",
      "company_seat": "Großefehn",
      "details": "13.02.2025 (Bekanntmachungsdatum)\n\nNiedersachsen Amtsgericht Aurich HRB 200038\nLöschungsankündigung 13.02.2025 (Eintragungsdatum)\n\nap extrusion AG\nAktiengesellschaft\nGroßefehn\n\nDas Registergericht beabsichtigt, die Gesellschaft von Amts wegen nach § 394 FamFG zu löschen. Die Frist zur Erhebung eines Widerspruchs ist auf 1 Monat ab dieser Registerbekanntmachung festgesetzt."
    },
    {
      "date": "2025-02-13",
      "id": "101257",
      "original_text": "Registerbekanntmachung nach dem Umwandlungsgesetz\nNiedersachsen Amtsgericht Aurich HRB 202358\nMeyerhoff Gebäudetechnik GmbH Heizung Sanitär Elektro – Ostrhauderfehn",
      "type": "Registerbekanntmachung nach dem Umwandlungsgesetz",
      "state": "Niedersachsen",
      "amtsgericht": "Amtsgericht Aurich",
      "registernummer": "HRB 202358",
      "registerart": "HRB",
      "company_name": "Meyerhoff Gebäudetechnik GmbH Heizung Sanitär Elektro",
      "company_seat": "Ostrhauderfehn",
      "details": "13.02.2025 (Bekanntmachungsdatum)\n\nNiedersachsen Amtsgericht Aurich HRB 202358\nRegisterbekanntmachung nach dem Umwandlungsgesetz 13.02.2025 (Eintragungsdatum)\n\nMeyerhoff Gebäudetechnik GmbH Heizung Sanitär Elektro\nGesellschaft mit beschränkter Haftung\nOstrhauderfehn\n\nDen Gläubigern der an der Verschmelzung beteiligten Rechtsträger ist, wenn sie binnen sechs Monaten nach dem Tag, an dem die Eintragung der Verschmelzung in das Register des Sitzes desjenigen Rechtsträgers, dessen Gläubiger sie sind, nach § 19  Abs.  3 UmwG als bekannt gemacht gilt, ihren Anspruch nach Grund und Höhe schriftlich anmelden, Sicherheit zu leisten, soweit sie nicht Befriedigung verlangen können. Dieses Recht steht den Gläubigern jedoch nur zu, wenn sie glaubhaft machen, dass durch die Verschmelzung die Erfüllung der Forderung gefährdet wird.|"
    },
    {
      "date": "2025-02-13",
      "id": "101258",
      "original_text": "Registerbekanntmachung nach dem Umwandlungsgesetz\nNiedersachsen Amtsgericht Aurich HRB 203078\nFehn Service Gebäudetechnik GmbH – Rhauderfehn",
      "type": "Registerbekanntmachung nach dem Umwandlungsgesetz",
      "state": "Niedersachsen",
      "amtsgericht": "Amtsgericht Aurich",
      "registernummer": "HRB 203078",
      "registerart": "HRB",
      "company_name": "Fehn Service Gebäudetechnik GmbH",
      "company_seat": "Rhauderfehn",
      "details": "13.02.2025 (Bekanntmachungsdatum)\n\nNiedersachsen Amtsgericht Aurich HRB 203078\nRegisterbekanntmachung nach dem Umwandlungsgesetz 13.02.2025 (Eintragungsdatum)\n\nFehn Service Gebäudetechnik GmbH\nGesellschaft mit beschränkter Haftung\nRhauderfehn\n\nDen Gläubigern der an der Verschmelzung beteiligten Rechtsträger ist, wenn sie binnen sechs Monaten nach dem Tag, an dem die Eintragung der Verschmelzung in das Register des Sitzes desjenigen Rechtsträgers, dessen Gläubiger sie sind, nach § 19  Abs.  3 UmwG als bekannt gemacht gilt, ihren Anspruch nach Grund und Höhe schriftlich anmelden, Sicherheit zu leisten, soweit sie nicht Befriedigung verlangen können. Dieses Recht steht den Gläubigern jedoch nur zu, wenn sie glaubhaft machen, dass durch die Verschmelzung die Erfüllung der Forderung gefährdet wird."
    },
    {
      "date": "2025-02-13",
      "id": "101259",
      "original_text": "Registerbekanntmachung nach dem Umwandlungsgesetz\nNiedersachsen Amtsgericht Oldenburg (Oldenburg) GsR 47\nB & E Klatte eGbR – Damme",
      "type": "Registerbekanntmachung nach dem Umwandlungsgesetz",
      "state": "Niedersachsen",
      "amtsgericht": "Amtsgericht Oldenburg (Oldenburg)",
      "registernummer": "GsR 47",
      "registerart": "GsR",
      "company_name": "B & E Klatte eGbR",
      "company_seat": "Damme",
      "details": "13.02.2025 (Bekanntmachungsdatum)\n\nNiedersachsen Amtsgericht Oldenburg (Oldenburg) GsR 47\nRegisterbekanntmachung nach dem Umwandlungsgesetz 13.02.2025 (Eintragungsdatum)\n\nB & E Klatte eGbR\nGesellschaft bürgerlichen Rechts\nDamme\n\nDen Gläubigern der an der formwechselnden Umwandlung beteiligten Rechtsträger ist, wenn sie binnen sechs Monaten nach dem Tag, an dem die Eintragung der Umwandlung in das Register des Sitzes desjenigen Rechtsträgers, dessen Gläubiger sie sind, nach § 19 Abs. 3 UmwG als bekannt gemacht gilt, ihren Anspruch nach Grund und Höhe schriftlich anmelden, Sicherheit zu leisten, soweit sie nicht Befriedigung verlangen können. Dieses Recht steht den Gläubigern jedoch nur zu, wenn sie glaubhaft machen, dass durch die formwechselnde Umwandlung die Erfüllung der Forderung gefährdet wird."
    },
    {
      "date": "2025-02-13",
      "id": "101260",
      "original_text": "Löschungsankündigung\nNiedersachsen Amtsgericht Stadthagen HRB 202025\nCustom Worx GmbH – Rinteln",
      "type": "Löschungsankündigung",
      "state": "Niedersachsen",
      "amtsgericht": "Amtsgericht Stadthagen",
      "registernummer": "HRB 202025",
      "registerart": "HRB",
      "company_name": "Custom Worx GmbH",
      "company_seat": "Rinteln",
      "details": "13.02.2025 (Bekanntmachungsdatum)\n\nNiedersachsen Amtsgericht Stadthagen HRB 202025\nLöschungsankündigung\n\nCustom Worx GmbH\nGesellschaft mit beschränkter Haftung\nRinteln\n\nDas Registergericht beabsichtigt, die Gesellschaft von Amts wegen nach § 394 FamFG zu löschen. Die Frist zur Erhebung eines Widerspruchs ist auf 1 Monat ab dieser Registerbekanntmachung festgesetzt."
    },
    {
      "date": "2025-02-13",
      "id": "101261",
      "original_text": "Registerbekanntmachung nach dem Umwandlungsgesetz\nNiedersachsen Amtsgericht Aurich HRB 110821 früher Amtsgericht Leer (Ostfriesland) (Leer)\nNatelberg Gebäudetechnik GmbH – Rhauderfehn",
      "type": "Registerbekanntmachung nach dem Umwandlungsgesetz",
      "state": "Niedersachsen",
      "amtsgericht": "Amtsgericht Aurich",
      "registernummer": "HRB 110821",
      "registerart": "HRB",
      "company_name": "Natelberg Gebäudetechnik GmbH",
      "company_seat": "Rhauderfehn",
      "former_amtsgericht": "Leer (Ostfriesland) (Leer)",
      "details": "13.02.2025 (Bekanntmachungsdatum)\n\nNiedersachsen Amtsgericht Aurich HRB 110821 früher Amtsgericht Leer (Ostfriesland) (Leer)\nRegisterbekanntmachung nach dem Umwandlungsgesetz 13.02.2025 (Eintragungsdatum)\n\nNatelberg Gebäudetechnik GmbH\nGesellschaft mit beschränkter Haftung\nRhauderfehn\n\nDen Gläubigern der an der Verschmelzung beteiligten Rechtsträger ist, wenn sie binnen sechs Monaten nach dem Tag, an dem die Eintragung der Verschmelzung in das Register des Sitzes desjenigen Rechtsträgers, dessen Gläubiger sie sind, nach § 19  Abs.  3 UmwG als bekannt gemacht gilt, ihren Anspruch nach Grund und Höhe schriftlich anmelden, Sicherheit zu leisten, soweit sie nicht Befriedigung verlangen können. Dieses Recht steht den Gläubigern jedoch nur zu, wenn sie glaubhaft machen, dass durch die Verschmelzung die Erfüllung der Forderung gefährdet wird."
    },
    {
      "date": "2025-02-13",
      "id": "101262",
      "original_text": "Einreichung neuer Dokumente\nBremen Amtsgericht Bremen HRB 15474\nArcelorMittal Bremen GmbH – Bremen",
      "type": "Einreichung neuer Dokumente",
      "state": "Bremen",
      "amtsgericht": "Amtsgericht Bremen",
      "registernummer": "HRB 15474",
      "registerart": "HRB",
      "company_name": "ArcelorMittal Bremen GmbH",
      "company_seat": "Bremen",
      "details": "13.02.2025 (Bekanntmachungsdatum)\n\nBremen Amtsgericht Bremen HRB 15474\nEinreichung neuer Dokumente\n\nArcelorMittal Bremen GmbH\nGesellschaft mit beschränkter Haftung\nBremen\n\nAls nicht eingetragen wird veröffentlicht: Liste des Aufsichtsrats wurde eingereicht."
    },
    {
      "date": "2025-02-13",
      "id": "101263",
      "original_text": "Löschungsankündigung\nBremen Amtsgericht Bremen HRB 36904\nMoonshine Express & Logistic GmbH – Bremen",
      "type": "Löschungsankündigung",
      "state": "Bremen",
      "amtsgericht": "Amtsgericht Bremen",
      "registernummer": "HRB 36904",
      "registerart": "HRB",
      "company_name": "Moonshine Express & Logistic GmbH",
      "company_seat": "Bremen",
      "details": "13.02.2025 (Bekanntmachungsdatum)\n\nBremen Amtsgericht Bremen HRB 36904\nLöschungsankündigung\n\nMoonshine Express & Logistic GmbH\nGesellschaft mit beschränkter Haftung\nBremen\n\nEs ist beabsichtigt die im Handelsregister eingetragene Gesellschaft von Amts wegen gemäß § 394 FamFG zu löschen. Gegen die Löschung kann beim AG Bremen schriftlich oder zu Protokoll der Geschäftsstelle Widerspruch eingelegt werden. Widerspruchsfrist 4 Wochen."
    },
    {
      "date": "2025-02-13",
      "id": "101264",
      "original_text": "Löschungsankündigung\nBremen Amtsgericht Bremen HRB 25582\nMarketing und Medien Nordwest Verwaltungs GmbH – Bremen",
      "type": "Löschungsankündigung",
      "state": "Bremen",
      "amtsgericht": "Amtsgericht Bremen",
      "registernummer": "HRB 25582",
      "registerart": "HRB",
      "company_name": "Marketing und Medien Nordwest Verwaltungs GmbH",
      "company_seat": "Bremen",
      "details": "13.02.2025 (Bekanntmachungsdatum)\n\nBremen Amtsgericht Bremen HRB 25582\nLöschungsankündigung\n\nMarketing und Medien Nordwest Verwaltungs GmbH\nGesellschaft mit beschränkter Haftung\nBremen\n\nEs ist beabsichtigt die im Handelsregister eingetragene Gesellschaft von Amts wegen gemäß § 394 FamFG zu löschen. Gegen die Löschung kann beim AG Bremen schriftlich oder zu Protokoll der Geschäftsstelle Widerspruch eingelegt werden. Widerspruchsfrist 4 Wochen."
    },
    {
      "date": "2025-02-13",
      "id": "101265",
      "original_text": "Löschungsankündigung\nRheinland-Pfalz Amtsgericht Landau HRB 33980\nGloria GmbH – Germersheim",
      "type": "Löschungsankündigung",
      "state": "Rheinland-Pfalz",
      "amtsgericht": "Amtsgericht Landau",
      "registernummer": "HRB 33980",
      "registerart": "HRB",
      "company_name": "Gloria GmbH",
      "company_seat": "Germersheim",
      "details": "13.02.2025 (Bekanntmachungsdatum)\n\nRheinland-Pfalz Amtsgericht Landau HRB 33980\nLöschungsankündigung\n\nGloria GmbH\nGesellschaft mit beschränkter Haftung\nGermersheim\n\nDas Registergericht beabsichtigt die Gesellschaft von Amts wegen nach § 394 FamFG zu löschen. Die Frist zur Erhebung eines Widerspruchs ist auf einen Monat festgesetzt."
    },
    {
      "date": "2025-02-13",
      "id": "101266",
      "original_text": "Registerbekanntmachung nach dem Umwandlungsgesetz\nRheinland-Pfalz Amtsgericht Zweibrücken HRB 31460\nAlkoma Verwaltungs UG (haftungsbeschränkt) – Pirmasens",
      "type": "Registerbekanntmachung nach dem Umwandlungsgesetz",
      "state": "Rheinland-Pfalz",
      "amtsgericht": "Amtsgericht Zweibrücken",
      "registernummer": "HRB 31460",
      "registerart": "HRB",
      "company_name": "Alkoma Verwaltungs UG (haftungsbeschränkt)",
      "company_seat": "Pirmasens",
      "details": "13.02.2025 (Bekanntmachungsdatum)\n\nRheinland-Pfalz Amtsgericht Zweibrücken HRB 31460\nRegisterbekanntmachung nach dem Umwandlungsgesetz 05.02.2025 (Eintragungsdatum)\n\nAlkoma Verwaltungs UG (haftungsbeschränkt)\nGesellschaft mit beschränkter Haftung\nPirmasens\n\nAls nicht eingetragen wird veröffentlicht: Den Gläubigern der an der Verschmelzung beteiligten Rechtsträger ist, wenn sie binnen sechs Monaten nach dem Tag, an dem die Eintragung der Verschmelzung in das Register des Sitzes desjenigen Rechtsträgers,dessen Gläubiger sie sind, nach § 19 Abs. 3 UmwG als bekannt gemacht gilt, ihren Anspruch nach Grund und Höhe schriftlich anmelden, Sicherheit zu leisten, soweit sie nicht Befriedigung verlangen können. Dieses Recht steht den Gläubigern jedoch nur zu, wenn sie glaubhaft machen, dass durch die Verschmelzung die Erfüllungd er Forderung gefährdet wird."
    },
    {
      "date": "2025-02-13",
      "id": "101267",
      "original_text": "Einreichung neuer Dokumente\nRheinland-Pfalz Amtsgericht Mainz HRB 8515\nVBG INVEST AG – Mainz",
      "type": "Einreichung neuer Dokumente",
      "state": "Rheinland-Pfalz",
      "amtsgericht": "Amtsgericht Mainz",
      "registernummer": "HRB 8515",
      "registerart": "HRB",
      "company_name": "VBG INVEST AG",
      "company_seat": "Mainz",
      "details": "13.02.2025 (Bekanntmachungsdatum)\n\nRheinland-Pfalz Amtsgericht Mainz HRB 8515\nEinreichung neuer Dokumente\n\nVBG INVEST AG\nAktiengesellschaft\nMainz\n\nDem Registergericht ist eine neue Liste der Mitglieder des Aufsichtsrates eingereicht worden."
    },
    {
      "date": "2025-02-13",
      "id": "101268",
      "original_text": "Registerbekanntmachung nach dem Umwandlungsgesetz\nRheinland-Pfalz Amtsgericht Ludwigshafen a.Rhein (Ludwigshafen) HRB 61725\nIHF GmbH Institut für Herzinfarktforschung – Ludwigshafen",
      "type": "Registerbekanntmachung nach dem Umwandlungsgesetz",
      "state": "Rheinland-Pfalz",
      "amtsgericht": "Amtsgericht Ludwigshafen a.Rhein (Ludwigshafen)",
      "registernummer": "HRB 61725",
      "registerart": "HRB",
      "company_name": "IHF GmbH Institut für Herzinfarktforschung",
      "company_seat": "Ludwigshafen",
      "details": "13.02.2025 (Bekanntmachungsdatum)\n\nRheinland-Pfalz Amtsgericht Ludwigshafen a.Rhein (Ludwigshafen) HRB 61725\nRegisterbekanntmachung nach dem Umwandlungsgesetz 12.02.2025 (Eintragungsdatum)\n\nIHF GmbH Institut für Herzinfarktforschung\nGesellschaft mit beschränkter Haftung\nLudwigshafen\n\nAls nicht eingetragen wird veröffentlicht: Den Gläubigern der an der Verschmelzung beteiligten Rechtsträger ist, wenn sie binnen sechs Monaten nach dem Tag, an dem die Eintragung der Verschmelzung in das Register des Sitzes desjenigen Rechtsträgers,dessen Gläubiger sie sind, nach § 19 Abs. 3 UmwG als bekannt gemacht gilt, ihren Anspruch nach Grund und Höhe schriftlich anmelden, Sicherheit zu leisten, soweit sie nicht Befriedigung verlangen können. Dieses Recht steht den Gläubigern jedoch nur zu, wenn sie glaubhaft machen, dass durch die Verschmelzung die Erfüllungd er Forderung gefährdet wird."
    },
    {
      "date": "2025-02-13",
      "id": "101269",
      "original_text": "Registerbekanntmachung nach dem Umwandlungsgesetz\nRheinland-Pfalz Amtsgericht Ludwigshafen a.Rhein (Ludwigshafen) HRB 69521\nIHF AcquiCo GmbH – Ludwigshafen",
      "type": "Registerbekanntmachung nach dem Umwandlungsgesetz",
      "state": "Rheinland-Pfalz",
      "amtsgericht": "Amtsgericht Ludwigshafen a.Rhein (Ludwigshafen)",
      "registernummer": "HRB 69521",
      "registerart": "HRB",
      "company_name": "IHF AcquiCo GmbH",
      "company_seat": "Ludwigshafen",
      "details": "13.02.2025 (Bekanntmachungsdatum)\n\nRheinland-Pfalz Amtsgericht Ludwigshafen a.Rhein (Ludwigshafen) HRB 69521\nRegisterbekanntmachung nach dem Umwandlungsgesetz 12.02.2025 (Eintragungsdatum)\n\nIHF AcquiCo GmbH\nGesellschaft mit beschränkter Haftung\nLudwigshafen\n\nDen Gläubigern der an der grenzüberschreitenden Verschmelzung beteiligten übernehmenden Rechtsträger ist, wenn sie binnen sechs Monaten nach dem Tag, an dem die Eintragung der Spaltung in das Register des Sitzes desjenigen Rechtsträgers, dessen Gläubiger sie sind, nach § 19 Absatz 3 UmwG als bekanntgemacht gilt, ihren Anspruch nach Grund und Höhe schriftlich anmelden, Sicherheit zu leisten, soweit sie nicht Befriedigung verlangen können.\n\nDieses Recht steht den Gläubigern jedoch nur zu, wenn sie glaubhaft machen, dass durch die Verschmelzung die Erfüllung ihrer Forderung gefährdet wird."
    },
    {
      "date": "2025-02-13",
      "id": "101270",
      "original_text": "Einreichung neuer Dokumente\nRheinland-Pfalz Amtsgericht Mainz HRB 47749\nLBS Immobilien GmbH Südwest – Mainz",
      "type": "Einreichung neuer Dokumente",
      "state": "Rheinland-Pfalz",
      "amtsgericht": "Amtsgericht Mainz",
      "registernummer": "HRB 47749",
      "registerart": "HRB",
      "company_name": "LBS Immobilien GmbH Südwest",
      "company_seat": "Mainz",
      "details": "13.02.2025 (Bekanntmachungsdatum)\n\nRheinland-Pfalz Amtsgericht Mainz HRB 47749\nEinreichung neuer Dokumente\n\nLBS Immobilien GmbH Südwest\nGesellschaft mit beschränkter Haftung\nMainz\n\nDem Registergericht ist eine neue Liste der Mitglieder des Aufsichtsrates eingereicht worden."
    },
    {
      "date": "2025-02-13",
      "id": "101271",
      "original_text": "Löschungsankündigung\nRheinland-Pfalz Amtsgericht Mainz HRB 53285\nNikoto Holding UG (haftungsbeschränkt) – Mainz",
      "type": "Löschungsankündigung",
      "state": "Rheinland-Pfalz",
      "amtsgericht": "Amtsgericht Mainz",
      "registernummer": "HRB 53285",
      "registerart": "HRB",
      "company_name": "Nikoto Holding UG (haftungsbeschränkt)",
      "company_seat": "Mainz",
      "details": "13.02.2025 (Bekanntmachungsdatum)\n\nRheinland-Pfalz Amtsgericht Mainz HRB 53285\nLöschungsankündigung\n\nNikoto Holding UG (haftungsbeschränkt)\nGesellschaft mit beschränkter Haftung\nMainz\n\nDas Registergericht beabsichtigt die Gesellschaft von Amts wegen nach § 394 FamFG zu löschen. Die Frist zur Erhebung eines Widerspruchs ist auf einen Monat festgesetzt."
    },
    {
      "date": "2025-02-13",
      "id": "101272",
      "original_text": "Löschungsankündigung\nNordrhein-Westfalen Amtsgericht Mönchengladbach HRB 18962\nN&E - Vermittlung UG (haftungsbeschränkt) – Grevenbroich",
      "type": "Löschungsankündigung",
      "state": "Nordrhein-Westfalen",
      "amtsgericht": "Amtsgericht Mönchengladbach",
      "registernummer": "HRB 18962",
      "registerart": "HRB",
      "company_name": "N&E - Vermittlung UG (haftungsbeschränkt)",
      "company_seat": "Grevenbroich",
      "details": "13.02.2025 (Bekanntmachungsdatum)\n\nNordrhein-Westfalen Amtsgericht Mönchengladbach HRB 18962\nLöschungsankündigung\n\nN&E - Vermittlung UG (haftungsbeschränkt)\nGesellschaft mit beschränkter Haftung\nGrevenbroich\n\nDas Registergericht beabsichtigt die Gesellschaft von Amts wegen nach § 394 FamFG zu löschen. Die Frist zur Erhebung eines Widerspruchs ist auf drei Monate festgesetzt."
    },
    {
      "date": "2025-02-13",
      "id": "101273",
      "original_text": "Löschungsankündigung\nNordrhein-Westfalen Amtsgericht Mönchengladbach HRB 20220\nPNO-Zentrale UG (haftungsbeschränkt) – Viersen",
      "type": "Löschungsankündigung",
      "state": "Nordrhein-Westfalen",
      "amtsgericht": "Amtsgericht Mönchengladbach",
      "registernummer": "HRB 20220",
      "registerart": "HRB",
      "company_name": "PNO-Zentrale UG (haftungsbeschränkt)",
      "company_seat": "Viersen",
      "details": "13.02.2025 (Bekanntmachungsdatum)\n\nNordrhein-Westfalen Amtsgericht Mönchengladbach HRB 20220\nLöschungsankündigung\n\nPNO-Zentrale UG (haftungsbeschränkt)\nGesellschaft mit beschränkter Haftung\nViersen\n\nDas Registergericht beabsichtigt die Gesellschaft von Amts wegen nach § 394 FamFG zu löschen. Die Frist zur Erhebung eines Widerspruchs ist auf drei Monate festgesetzt."
    },
    {
      "date": "2025-02-13",
      "id": "101274",
      "original_text": "Registerbekanntmachung nach dem Umwandlungsgesetz\nNordrhein-Westfalen Amtsgericht Köln HRB 68024\nOSMAB Verwaltungs GmbH – Rösrath",
      "type": "Registerbekanntmachung nach dem Umwandlungsgesetz",
      "state": "Nordrhein-Westfalen",
      "amtsgericht": "Amtsgericht Köln",
      "registernummer": "HRB 68024",
      "registerart": "HRB",
      "company_name": "OSMAB Verwaltungs GmbH",
      "company_seat": "Rösrath",
      "details": "13.02.2025 (Bekanntmachungsdatum)\n\nNordrhein-Westfalen Amtsgericht Köln HRB 68024\nRegisterbekanntmachung nach dem Umwandlungsgesetz 13.02.2025 (Eintragungsdatum)\n\nOSMAB Verwaltungs GmbH\nGesellschaft mit beschränkter Haftung\nRösrath\n\nDen Gläubigern der an der Verschmelzung beteiligten Rechtsträger ist, wenn sie binnen sechs Monaten nach dem Tag, an dem die Eintragung der Verschmelzung in das Register des Sitzes desjenigen Rechtsträgers, dessen Gläubiger sie sind, nach § 19 Absatz 3 UmwG als bekanntgemacht gilt, ihren Anspruch nach Grund und Höhe schriftlich anmelden, Sicherheit zu leisten, soweit sie nicht Befriedigung verlangen können. Dieses Recht steht den Gläubigern jedoch nur zu, wenn sie glaubhaft machen, dass durch die Verschmelzung die Erfüllung ihrer Forderung gefährdet wird."
    },
    {
      "date": "2025-02-13",
      "id": "101275",
      "original_text": "Löschungsankündigung\nNordrhein-Westfalen Amtsgericht Bochum HRB 18758\nN-RW Bauservice GmbH – Bochum",
      "type": "Löschungsankündigung",
      "state": "Nordrhein-Westfalen",
      "amtsgericht": "Amtsgericht Bochum",
      "registernummer": "HRB 18758",
      "registerart": "HRB",
      "company_name": "N-RW Bauservice GmbH",
      "company_seat": "Bochum",
      "details": "13.02.2025 (Bekanntmachungsdatum)\n\nNordrhein-Westfalen Amtsgericht Bochum HRB 18758\nLöschungsankündigung\n\nN-RW Bauservice GmbH\nGesellschaft mit beschränkter Haftung\nBochum\n\nDas Registergericht beabsichtigt die Gesellschaft von Amts wegen nach § 394 FamFG zu löschen. Die Frist zur Erhebung eines Widerspruchs ist auf drei Monate festgesetzt."
    },
    {
      "date": "2025-02-13",
      "id": "101276",
      "original_text": "Löschungsankündigung\nNordrhein-Westfalen Amtsgericht Dortmund HRB 35107\nSparengel24 Versicherungsmakler UG (haftungsbeschränkt) – Dortmund",
      "type": "Löschungsankündigung",
      "state": "Nordrhein-Westfalen",
      "amtsgericht": "Amtsgericht Dortmund",
      "registernummer": "HRB 35107",
      "registerart": "HRB",
      "company_name": "Sparengel24 Versicherungsmakler UG (haftungsbeschränkt)",
      "company_seat": "Dortmund",
      "details": "13.02.2025 (Bekanntmachungsdatum)\n\nNordrhein-Westfalen Amtsgericht Dortmund HRB 35107\nLöschungsankündigung 13.02.2025 (Eintragungsdatum)\n\nSparengel24 Versicherungsmakler UG (haftungsbeschränkt)\nGesellschaft mit beschränkter Haftung\nDortmund\n\nDas Registergericht beabsichtigt die Gesellschaft von Amts wegen nach § 394 FamFG zu löschen. Die Frist zur Erhebung eines Widerspruchs ist auf zwei Monate festgesetzt."
    },
    {
      "date": "2025-02-13",
      "id": "101277",
      "original_text": "Löschungsankündigung\nNordrhein-Westfalen Amtsgericht Recklinghausen HRB 9122\nCafé Bonjour GmbH – Recklinghausen",
      "type": "Löschungsankündigung",
      "state": "Nordrhein-Westfalen",
      "amtsgericht": "Amtsgericht Recklinghausen",
      "registernummer": "HRB 9122",
      "registerart": "HRB",
      "company_name": "Café Bonjour GmbH",
      "company_seat": "Recklinghausen",
      "details": "13.02.2025 (Bekanntmachungsdatum)\n\nNordrhein-Westfalen Amtsgericht Recklinghausen HRB 9122\nLöschungsankündigung\n\nCafé Bonjour GmbH\nGesellschaft mit beschränkter Haftung\nRecklinghausen\n\nDas Registergericht beabsichtigt die Gesellschaft von Amts wegen nach § 394 FamFG zu löschen. Die Frist zur Erhebung eines Widerspruchs ist auf drei Monate festgesetzt."
    },
    {
      "date": "2025-02-13",
      "id": "101278",
      "original_text": "Registerbekanntmachung nach dem Umwandlungsgesetz\nNordrhein-Westfalen Amtsgericht Düsseldorf HRB 4381\nSteuerberatungsgesellschaft BRS GmbH – Düsseldorf",
      "type": "Registerbekanntmachung nach dem Umwandlungsgesetz",
      "state": "Nordrhein-Westfalen",
      "amtsgericht": "Amtsgericht Düsseldorf",
      "registernummer": "HRB 4381",
      "registerart": "HRB",
      "company_name": "Steuerberatungsgesellschaft BRS GmbH",
      "company_seat": "Düsseldorf",
      "details": "13.02.2025 (Bekanntmachungsdatum)\n\nNordrhein-Westfalen Amtsgericht Düsseldorf HRB 4381\nRegisterbekanntmachung nach dem Umwandlungsgesetz 13.02.2025 (Eintragungsdatum)\n\nSteuerberatungsgesellschaft BRS GmbH\nGesellschaft mit beschränkter Haftung\nDüsseldorf\n\nDen Gläubigern der an der Verschmelzung beteiligten Rechtsträger ist, wenn sie binnen sechs Monaten nach dem Tag, an dem die Eintragung der Verschmelzung in das Register des Sitzes desjenigen Rechtsträgers, dessen Gläubiger sie sind, nach § 19 Absatz 3 UmwG als bekanntgemacht gilt, ihren Anspruch nach Grund und Höhe schriftlich anmelden, Sicherheit zu leisten, soweit sie nicht Befriedigung verlangen können. Dieses Recht steht den Gläubigern jedoch nur zu, wenn sie glaubhaft machen, dass durch die Verschmelzung die Erfüllung ihrer Forderung gefährdet wird."
    },
    {
      "date": "2025-02-13",
      "id": "101279",
      "original_text": "Löschungsankündigung\nNordrhein-Westfalen Amtsgericht Duisburg HRB 34521\nKM Immobilien Wesel UG (haftungsbeschränkt) – Wesel",
      "type": "Löschungsankündigung",
      "state": "Nordrhein-Westfalen",
      "amtsgericht": "Amtsgericht Duisburg",
      "registernummer": "HRB 34521",
      "registerart": "HRB",
      "company_name": "KM Immobilien Wesel UG (haftungsbeschränkt)",
      "company_seat": "Wesel",
      "details": "13.02.2025 (Bekanntmachungsdatum)\n\nNordrhein-Westfalen Amtsgericht Duisburg HRB 34521\nLöschungsankündigung\n\nKM Immobilien Wesel UG (haftungsbeschränkt)\nGesellschaft mit beschränkter Haftung\nWesel\n\nDas Registergericht beabsichtigt, die im Handelsregister unter HRB 34521  eingetragene Gesellschaft KM Immobilien Wesel UG (haftungsbeschränkt)  gemäß § 394 FamFG wegen Vermögenslosigkeit von Amts wegen zu löschen. Gegen diese Verfügung kann Widerspruch eingelegt werden. Die Frist zur Erhebung eines Widerspruchs gegen die beabsichtigte Löschung von Amts wegen ist auf drei Monate festgesetzt. Rechtsbehelfsbelehrung Der Widerspruch ist bei dem Amtsgericht Duisburg, Kardinal-Galen-Str. 124-132, 47058 Duisburg schriftlich in deutscher Sprache oder zur Niederschrift der Geschäftsstelle einzulegen. Der Widerspruch kann auch zur Niederschrift der Geschäftsstelle eines jeden Amtsgerichtes abgegeben werden. Die Einlegung ist auch durch Übertragung eines elektronischen Dokuments an die elektronische Poststelle des Gerichts möglich. Das elektronische Dokument muss für die Bearbeitung durch das Gericht geeignet und mit einer qualifizierten elektronischen Signatur der verantwortenden Person versehen sein oder von der verantwortenden Person signiert und auf einem sicheren Übermittlungsweg gemäß § 130 a ZPO nach näherer Maßgabe der Verordnung über die technischen Rahmenbedingungen des elektronischen Rechtsverkehrs und über das besondere elektronische Behördenpostfach (BGBl. I, S. 3803) eingereicht werden. Weitere Informationen erhalten Sie auf der Internetseite www.justiz.de <http://www.justiz.de>. Der Widerspruch muss spätestens innerhalb der gesetzten Frist bei dem Amtsgericht Duisburg eingegangen sein. Dies gilt auch dann, wenn der Widerspruch zur Niederschrift der Geschäftsstelle eines anderen Amtsgerichtes abgegeben wurde. Die Frist beginnt mit der Veröffentlichung. Fällt das Ende der Frist auf einen Sonntag, einen allgemeinen Feiertag oder Sonnabend, so endet die Frist mit Ablauf des nächsten Werktages. Der Widerspruch muss die Bezeichnung der angefochtenen Verfügung sowie die Erklärung enthalten, dass Widerspruch gegen diese Verfügung eingelegt wird. Er ist zu unterzeichnen und soll begründet werden."
    },
    {
      "date": "2025-02-13",
      "id": "101280",
      "original_text": "Löschungsankündigung\nNordrhein-Westfalen Amtsgericht Krefeld HRB 4948\nCLASS IC Elektronik GmbH – Willich",
      "type": "Löschungsankündigung",
      "state": "Nordrhein-Westfalen",
      "amtsgericht": "Amtsgericht Krefeld",
      "registernummer": "HRB 4948",
      "registerart": "HRB",
      "company_name": "CLASS IC Elektronik GmbH",
      "company_seat": "Willich",
      "details": "13.02.2025 (Bekanntmachungsdatum)\n\nNordrhein-Westfalen Amtsgericht Krefeld HRB 4948\nLöschungsankündigung\n\nCLASS IC Elektronik GmbH\nGesellschaft mit beschränkter Haftung\nWillich\n\nDas Registergericht beabsichtigt die Gesellschaft von Amts wegen nach § 394 FamFG zu löschen. Die Frist zur Erhebung eines Widerspruchs ist auf einen Monat festgesetzt."
    },
    {
      "date": "2025-02-13",
      "id": "101281",
      "original_text": "Löschungsankündigung\nNordrhein-Westfalen Amtsgericht Bad Oeynhausen HRB 8966\nKOCH Consumer GmbH – Espelkamp",
      "type": "Löschungsankündigung",
      "state": "Nordrhein-Westfalen",
      "amtsgericht": "Amtsgericht Bad Oeynhausen",
      "registernummer": "HRB 8966",
      "registerart": "HRB",
      "company_name": "KOCH Consumer GmbH",
      "company_seat": "Espelkamp",
      "details": "13.02.2025 (Bekanntmachungsdatum)\n\nNordrhein-Westfalen Amtsgericht Bad Oeynhausen HRB 8966\nLöschungsankündigung\n\nKOCH Consumer GmbH\nGesellschaft mit beschränkter Haftung\nEspelkamp\n\nDas Registergericht beabsichtigt die Gesellschaft von Amts wegen nach § 394 FamFG zu löschen. Die Frist zur Erhebung eines Widerspruchs ist auf einen Monat festgesetzt."
    },
    {
      "date": "2025-02-13",
      "id": "101282",
      "original_text": "Registerbekanntmachung nach dem Umwandlungsgesetz\nNordrhein-Westfalen Amtsgericht Düsseldorf HRB 73704\nU.N.P. - HRSolutions GmbH – Düsseldorf",
      "type": "Registerbekanntmachung nach dem Umwandlungsgesetz",
      "state": "Nordrhein-Westfalen",
      "amtsgericht": "Amtsgericht Düsseldorf",
      "registernummer": "HRB 73704",
      "registerart": "HRB",
      "company_name": "U.N.P. - HRSolutions GmbH",
      "company_seat": "Düsseldorf",
      "details": "13.02.2025 (Bekanntmachungsdatum)\n\nNordrhein-Westfalen Amtsgericht Düsseldorf HRB 73704\nRegisterbekanntmachung nach dem Umwandlungsgesetz 13.02.2025 (Eintragungsdatum)\n\nU.N.P. - HRSolutions GmbH\nGesellschaft mit beschränkter Haftung\nDüsseldorf\n\nDen Gläubigern der an der Verschmelzung beteiligten Rechtsträger ist, wenn sie binnen sechs Monaten nach dem Tag, an dem die Eintragung der Verschmelzung in das Register des Sitzes desjenigen Rechtsträgers, dessen Gläubiger sie sind, nach § 19 Absatz 3 UmwG als bekanntgemacht gilt, ihren Anspruch nach Grund und Höhe schriftlich anmelden, Sicherheit zu leisten, soweit sie nicht Befriedigung verlangen können. Dieses Recht steht den Gläubigern jedoch nur zu, wenn sie glaubhaft machen, dass durch die Verschmelzung die Erfüllung ihrer Forderung gefährdet wird."
    },
    {
      "date": "2025-02-13",
      "id": "101283",
      "original_text": "Löschungsankündigung\nNordrhein-Westfalen Amtsgericht Münster HRB 12292\nPhoenix Beckum UG (haftungsbeschränkt) – Beckum",
      "type": "Löschungsankündigung",
      "state": "Nordrhein-Westfalen",
      "amtsgericht": "Amtsgericht Münster",
      "registernummer": "HRB 12292",
      "registerart": "HRB",
      "company_name": "Phoenix Beckum UG (haftungsbeschränkt)",
      "company_seat": "Beckum",
      "details": "13.02.2025 (Bekanntmachungsdatum)\n\nNordrhein-Westfalen Amtsgericht Münster HRB 12292\nLöschungsankündigung\n\nPhoenix Beckum UG (haftungsbeschränkt)\nGesellschaft mit beschränkter Haftung\nBeckum\n\nDas Registergericht beabsichtigt die Gesellschaft von Amts wegen nach § 394 FamFG zu löschen. Die Frist zur Erhebung eines Widerspruchs ist auf 3 Wochen festgesetzt.\n\nRechtsbehelfsbelehrung:\n\nGegen diese Verfügung können Sie Widerspruch einlegen.\n\nDer Widerspruch ist bei dem Amtsgericht Münster, Gerichtsstraße 2 bis 6, 48149 Münster schriftlich in deutscher Sprache oder zur Niederschrift der Geschäftsstelle eines jeden Amtsgerichtes abgegeben werden.\nDie Einlegung ist auch durch Übertragung eine elektronischen Dokuments an die elektronische Poststelle des Gerichts möglich. Das elektronische Dokument muss für die Bearbeitung durch das Gericht geeignet und mit einer qualifizierten elektronischen Signatur der verantwortenden Person versehen sein oder von der verantwortenden Person signiert und auf einem sicheren Übermittlungsweg gem. §130a ZPO nach nähere Maßgabe der Verordnung über die technischen Rahmenbedingungen des elektronischen Rechtsverkehrs und über das besondere elektronische Behördenpostfach (BGBI. I. S.3808) eingereicht werden. Weitere Informationen erhalten Sie auf der Internetseite www.justiz.de\n\nDer Widerspruch muss spätestens innerhalb der gesetzten Frist nach der schriftlichen Bekanntgabe der Verfügung bei dem Amtsgericht Münster eingegangen sein. Dies gilt auch dann, wenn der Widerspruch zur Niederschrift der Geschäftsstelle eines anderen Amtsgerichtes abgegeben wurde. Die Frist beginnt mit der schriftlichen Bekanntgabe der Verfügung, spätestens mit Ablauf von fünf Monaten nach Erlass der Verfügung. Die Bekanntgabe ist entweder durch Zustellung oder am dritten Tage nach Aufgabe zur Post bewirkt. Fällt das Ende der First auf einen Sonntag, einen allgemeinen Feiertag oder Sonnabend, so endet die Frist mit Ablauf des nächsten Werktages.\n\nDer Widerspruch muss die Bezeichnung der angefochtenen Verfügung sowie die Erklärung enthalten, dass Widerspruch gegen diese Verfügung eingelegt wird. Er ist zu unterzeichnen und soll begründet werden."
    },
    {
      "date": "2025-02-13",
      "id": "101284",
      "original_text": "Einreichung neuer Dokumente\nNordrhein-Westfalen Amtsgericht Dortmund HRB 21663\nAllegro Effecten AG – Dortmund",
      "type": "Einreichung neuer Dokumente",
      "state": "Nordrhein-Westfalen",
      "amtsgericht": "Amtsgericht Dortmund",
      "registernummer": "HRB 21663",
      "registerart": "HRB",
      "company_name": "Allegro Effecten AG",
      "company_seat": "Dortmund",
      "details": "13.02.2025 (Bekanntmachungsdatum)\n\nNordrhein-Westfalen Amtsgericht Dortmund HRB 21663\nEinreichung neuer Dokumente\n\nAllegro Effecten AG\nAktiengesellschaft\nDortmund\n\nDem Registergericht ist eine neue Liste der Mitglieder des Aufsichtsrates eingereicht worden."
    },
    {
      "date": "2025-02-13",
      "id": "101285",
      "original_text": "Einreichung neuer Dokumente\nNordrhein-Westfalen Amtsgericht Dortmund HRB 21663\nAllegro Effecten AG – Dortmund",
      "type": "Einreichung neuer Dokumente",
      "state": "Nordrhein-Westfalen",
      "amtsgericht": "Amtsgericht Dortmund",
      "registernummer": "HRB 21663",
      "registerart": "HRB",
      "company_name": "Allegro Effecten AG",
      "company_seat": "Dortmund",
      "details": "13.02.2025 (Bekanntmachungsdatum)\n\nNordrhein-Westfalen Amtsgericht Dortmund HRB 21663\nEinreichung neuer Dokumente\n\nAllegro Effecten AG\nAktiengesellschaft\nDortmund\n\nDem Registergericht ist eine neue Liste der Mitglieder des Aufsichtsrates eingereicht worden."
    },
    {
      "date": "2025-02-13",
      "id": "101286",
      "original_text": "Registerbekanntmachung nach dem Umwandlungsgesetz\nNordrhein-Westfalen Amtsgericht Steinfurt VR 20802\nInnenstadtverein Rheine e.V. – Rheine",
      "type": "Registerbekanntmachung nach dem Umwandlungsgesetz",
      "state": "Nordrhein-Westfalen",
      "amtsgericht": "Amtsgericht Steinfurt",
      "registernummer": "VR 20802",
      "registerart": "VR",
      "company_name": "Innenstadtverein Rheine e.V.",
      "company_seat": "Rheine",
      "details": "13.02.2025 (Bekanntmachungsdatum)\n\nNordrhein-Westfalen Amtsgericht Steinfurt VR 20802\nRegisterbekanntmachung nach dem Umwandlungsgesetz 13.02.2025 (Eintragungsdatum)\n\nInnenstadtverein Rheine e.V.\neingetragener Verein\nRheine\n\nDen Gläubigern der an der Verschmelzung beteiligten Rechtsträger ist, wenn sie binnen sechs Monaten nach dem Tag, an dem die Eintragung der Verschmelzung in das Register des Sitzes derjenigen Rechtsträger deren Gläubiger sie sind, nach § 19 Absatz 3 UmwG als bekanntgemacht gilt, ihren Anspruch nach Grund und Höhe schriftlich anmelden, Sicherheit zu leisten, soweit sie nicht Befriedigung verlangen können. Dieses Recht steht den Gläubigern jedoch nur zu, wenn sie glaubhaft machen, dass durch die Verschmelzung die Erfüllung ihrer Forderung gefährdet wird."
    },
    {
      "date": "2025-02-13",
      "id": "101287",
      "original_text": "Löschungsankündigung\nNordrhein-Westfalen Amtsgericht Düsseldorf HRB 76367\nVnus GmbH – Düsseldorf",
      "type": "Löschungsankündigung",
      "state": "Nordrhein-Westfalen",
      "amtsgericht": "Amtsgericht Düsseldorf",
      "registernummer": "HRB 76367",
      "registerart": "HRB",
      "company_name": "Vnus GmbH",
      "company_seat": "Düsseldorf",
      "details": "13.02.2025 (Bekanntmachungsdatum)\n\nNordrhein-Westfalen Amtsgericht Düsseldorf HRB 76367\nLöschungsankündigung\n\nVnus GmbH\nGesellschaft mit beschränkter Haftung\nDüsseldorf\n\nDas Registergericht beabsichtigt die Gesellschaft von Amts wegen nach § 394 FamFG zu löschen. Die Frist zur Erhebung eines Widerspruchs ist auf 3 Wochen festgesetzt.\n\nRechtsbehelfsbelehrung:\nDas Widerspruchsrecht steht jedem zu, der an der Unterlassung der Löschung ein berechtigtes Interesse hat. Der Widerspruch ist bei dem Amtsgericht Düsseldorf -Registergericht-, Werdener Straße 1, 40227 Düsseldorf schriftlich in deutscher Sprache oder zur Niederschrift der Geschäftsstelle einzulegen. Der Widerspruch kann auch zur Niederschrift der Geschäftsstelle eines jeden Amtsgerichtes abgegeben werden. Die Einlegung ist auch durch Übertragung eines elektronischen Dokuments an die elektronische Poststelle des Gerichts möglich. Das elektronische Dokument muss für die Bearbeitung durch das Gericht geeignet und mit einer qualifizierten elektronischen Signatur der verantwortenden Person versehen sein oder von der verantwortenden Person signiert und auf einem sicheren Übermittlungsweg gemäß § 130a ZPO nach näherer Maßgabe der Verordnung über die technischen Rahmenbedingungen des elektronischen Rechtsverkehrs und über das besondere elektronische Behördenpostfach (BGBl. I, S.3803) eingereicht werden. Weitere Informationen erhalten Sie auf der Internetseite www.justiz.de.\nDer Widerspruch muss spätestens innerhalb der gesetzten Frist nach dem Datum der Bekanntmachung der Löschungsankündigung bei dem Amtsgericht - Registergericht - Düsseldorf eingegangen sein.  Dies gilt auch dann, wenn der Widerspruch zur Niederschrift der Geschäftsstelle eines anderen Amtsgerichtes abgegeben wurde. Die Frist beginnt mit dem Tage der Bekanntmachung der Löschungsankündigung in dem für die Bekanntmachung der Eintragungen in das Handelsregister bestimmten elektronischen Informations- und Kommunikationssystem nach § 10 des Handelsgesetzbuches. Fällt das Ende der Frist auf einen Sonntag, einen allgemeinen Feiertag oder Sonnabend, so endet die Frist mit Ablauf des nächsten Werktages.\nDer Widerspruch muss die Bezeichnung der angefochtenen Löschungsankündigung sowie die Erklärung enthalten, dass Widerspruch gegen diese Löschungsankündigung eingelegt wird. Er ist zu unterzeichnen und soll begründet werden."
    },
    {
      "date": "2025-02-13",
      "id": "101288",
      "original_text": "Löschungsankündigung\nNordrhein-Westfalen Amtsgericht Mönchengladbach HRB 12153\nEGM Automotive GmbH – Mönchengladbach",
      "type": "Löschungsankündigung",
      "state": "Nordrhein-Westfalen",
      "amtsgericht": "Amtsgericht Mönchengladbach",
      "registernummer": "HRB 12153",
      "registerart": "HRB",
      "company_name": "EGM Automotive GmbH",
      "company_seat": "Mönchengladbach",
      "details": "13.02.2025 (Bekanntmachungsdatum)\n\nNordrhein-Westfalen Amtsgericht Mönchengladbach HRB 12153\nLöschungsankündigung 13.02.2025 (Eintragungsdatum)\n\nEGM Automotive GmbH\nGesellschaft mit beschränkter Haftung\nMönchengladbach\n\nDas Registergericht beabsichtigt die Gesellschaft von Amts wegen nach § 394 FamFG zu löschen. Die Frist zur Erhebung eines Widerspruchs ist auf drei Monate festgesetzt."
    },
    {
      "date": "2025-02-13",
      "id": "101289",
      "original_text": "Einreichung neuer Dokumente\nNordrhein-Westfalen Amtsgericht Essen HRB 19474\nEvonik Industries AG – Essen",
      "type": "Einreichung neuer Dokumente",
      "state": "Nordrhein-Westfalen",
      "amtsgericht": "Amtsgericht Essen",
      "registernummer": "HRB 19474",
      "registerart": "HRB",
      "company_name": "Evonik Industries AG",
      "company_seat": "Essen",
      "details": "13.02.2025 (Bekanntmachungsdatum)\n\nNordrhein-Westfalen Amtsgericht Essen HRB 19474\nEinreichung neuer Dokumente\n\nEvonik Industries AG\nAktiengesellschaft\nEssen\n\nDem Registergericht ist eine neue Liste der Mitglieder des Aufsichtsrates eingereicht worden."
    },
    {
      "date": "2025-02-13",
      "id": "101290",
      "original_text": "Registerbekanntmachung nach dem Umwandlungsgesetz\nNordrhein-Westfalen Amtsgericht Köln HRB 87005\nGroßbeeren 7 GmbH – Rösrath",
      "type": "Registerbekanntmachung nach dem Umwandlungsgesetz",
      "state": "Nordrhein-Westfalen",
      "amtsgericht": "Amtsgericht Köln",
      "registernummer": "HRB 87005",
      "registerart": "HRB",
      "company_name": "Großbeeren 7 GmbH",
      "company_seat": "Rösrath",
      "details": "13.02.2025 (Bekanntmachungsdatum)\n\nNordrhein-Westfalen Amtsgericht Köln HRB 87005\nRegisterbekanntmachung nach dem Umwandlungsgesetz 13.02.2025 (Eintragungsdatum)\n\nGroßbeeren 7 GmbH\nGesellschaft mit beschränkter Haftung\nRösrath\n\nDen Gläubigern der an der Verschmelzung beteiligten Rechtsträger ist, wenn sie binnen sechs Monaten nach dem Tag, an dem die Eintragung der Verschmelzung in das Register des Sitzes desjenigen Rechtsträgers, dessen Gläubiger sie sind, nach § 19 Absatz 3 UmwG als bekanntgemacht gilt, ihren Anspruch nach Grund und Höhe schriftlich anmelden, Sicherheit zu leisten, soweit sie nicht Befriedigung verlangen können. Dieses Recht steht den Gläubigern jedoch nur zu, wenn sie glaubhaft machen, dass durch die Verschmelzung die Erfüllung ihrer Forderung gefährdet wird."
    },
    {
      "date": "2025-02-13",
      "id": "101291",
      "original_text": "Löschungsankündigung\nNordrhein-Westfalen Amtsgericht Iserlohn HRA 4136\nSUERTE GmbH & Co. KG – Altena",
      "type": "Löschungsankündigung",
      "state": "Nordrhein-Westfalen",
      "amtsgericht": "Amtsgericht Iserlohn",
      "registernummer": "HRA 4136",
      "registerart": "HRA",
      "company_name": "SUERTE GmbH & Co. KG",
      "company_seat": "Altena",
      "details": "13.02.2025 (Bekanntmachungsdatum)\n\nNordrhein-Westfalen Amtsgericht Iserlohn HRA 4136\nLöschungsankündigung\n\nSUERTE GmbH & Co. KG\nKommanditgesellschaft\nAltena\n\nDas Registergericht beabsichtigt die Firma von Amts wegen nach § 394 FamFG zu löschen. Die Frist zur Erhebung eines Widerspruchs ist auf einen Monat festgesetzt."
    },
    {
      "date": "2025-02-13",
      "id": "101292",
      "original_text": "Einreichung neuer Dokumente\nNordrhein-Westfalen Amtsgericht Bonn HRB 14178\nDeutsche Telekom Service GmbH – Bonn",
      "type": "Einreichung neuer Dokumente",
      "state": "Nordrhein-Westfalen",
      "amtsgericht": "Amtsgericht Bonn",
      "registernummer": "HRB 14178",
      "registerart": "HRB",
      "company_name": "Deutsche Telekom Service GmbH",
      "company_seat": "Bonn",
      "details": "13.02.2025 (Bekanntmachungsdatum)\n\nNordrhein-Westfalen Amtsgericht Bonn HRB 14178\nEinreichung neuer Dokumente\n\nDeutsche Telekom Service GmbH\nGesellschaft mit beschränkter Haftung\nBonn\n\nDem Registergericht ist eine neue Liste der Mitglieder des Aufsichtsrates eingereicht worden."
    },
    {
      "date": "2025-02-13",
      "id": "101293",
      "original_text": "Einreichung neuer Dokumente\nNordrhein-Westfalen Amtsgericht Köln HRB 78356\nAxalta Coating Systems Verwaltungs GmbH – Köln",
      "type": "Einreichung neuer Dokumente",
      "state": "Nordrhein-Westfalen",
      "amtsgericht": "Amtsgericht Köln",
      "registernummer": "HRB 78356",
      "registerart": "HRB",
      "company_name": "Axalta Coating Systems Verwaltungs GmbH",
      "company_seat": "Köln",
      "details": "13.02.2025 (Bekanntmachungsdatum)\n\nNordrhein-Westfalen Amtsgericht Köln HRB 78356\nEinreichung neuer Dokumente\n\nAxalta Coating Systems Verwaltungs GmbH\nGesellschaft mit beschränkter Haftung\nKöln\n\nDem Registergericht ist eine Liste der Mitglieder des Aufsichtsrates eingereicht worden."
    },
    {
      "date": "2025-02-13",
      "id": "101294",
      "original_text": "Löschungsankündigung\nNordrhein-Westfalen Amtsgericht Bochum HRB 19562\nMI Service GmbH – Herne",
      "type": "Löschungsankündigung",
      "state": "Nordrhein-Westfalen",
      "amtsgericht": "Amtsgericht Bochum",
      "registernummer": "HRB 19562",
      "registerart": "HRB",
      "company_name": "MI Service GmbH",
      "company_seat": "Herne",
      "details": "13.02.2025 (Bekanntmachungsdatum)\n\nNordrhein-Westfalen Amtsgericht Bochum HRB 19562\nLöschungsankündigung\n\nMI Service GmbH\nGesellschaft mit beschränkter Haftung\nHerne\n\nDas Registergericht beabsichtigt die Gesellschaft von Amts wegen nach § 394 FamFG zu löschen. Die Frist zur Erhebung eines Widerspruchs ist auf drei Monate festgesetzt."
    },
    {
      "date": "2025-02-13",
      "id": "101295",
      "original_text": "Löschungsankündigung\nNordrhein-Westfalen Amtsgericht Köln HRA 26513\nPhilipp Seine Helden GmbH & Co. KG – Leverkusen",
      "type": "Löschungsankündigung",
      "state": "Nordrhein-Westfalen",
      "amtsgericht": "Amtsgericht Köln",
      "registernummer": "HRA 26513",
      "registerart": "HRA",
      "company_name": "Philipp Seine Helden GmbH & Co. KG",
      "company_seat": "Leverkusen",
      "details": "13.02.2025 (Bekanntmachungsdatum)\n\nNordrhein-Westfalen Amtsgericht Köln HRA 26513\nLöschungsankündigung 13.02.2025 (Eintragungsdatum)\n\nPhilipp Seine Helden GmbH & Co. KG\nKommanditgesellschaft\nLeverkusen\n\nDas Registergericht beabsichtigt die Firma von Amts wegen nach § 394 FamFG zu löschen. Die Frist zur Erhebung eines Widerspruchs ist auf einen Monat festgesetzt."
    },
    {
      "date": "2025-02-13",
      "id": "101296",
      "original_text": "Löschungsankündigung\nNordrhein-Westfalen Amtsgericht Siegen HRA 9198\nCERCP GmbH & Co. KG – Siegen",
      "type": "Löschungsankündigung",
      "state": "Nordrhein-Westfalen",
      "amtsgericht": "Amtsgericht Siegen",
      "registernummer": "HRA 9198",
      "registerart": "HRA",
      "company_name": "CERCP GmbH & Co. KG",
      "company_seat": "Siegen",
      "details": "13.02.2025 (Bekanntmachungsdatum)\n\nNordrhein-Westfalen Amtsgericht Siegen HRA 9198\nLöschungsankündigung\n\nCERCP GmbH & Co. KG\nKommanditgesellschaft\nSiegen\n\nDas Registergericht beabsichtigt, die im Handelsregister eingetragene Gesellschaft gemäß § 394 Absatz 1 FamFG wegen Vermögenslosigkeit zu löschen. Gegen diese Verfügung kann Widerspruch eingelegt werden. Die Frist zur Erhebung eines Widerspruchs gegen die beabsichtige Löschung von Amts wegen ist auf einen Monat festgesetzt."
    },
    {
      "date": "2025-02-13",
      "id": "101297",
      "original_text": "Registerbekanntmachung nach dem Umwandlungsgesetz\nNordrhein-Westfalen Amtsgericht Steinfurt VR 21073\nImmobilien- und Standortgemeinschaft Emsquartier e.V. – Rheine",
      "type": "Registerbekanntmachung nach dem Umwandlungsgesetz",
      "state": "Nordrhein-Westfalen",
      "amtsgericht": "Amtsgericht Steinfurt",
      "registernummer": "VR 21073",
      "registerart": "VR",
      "company_name": "Immobilien- und Standortgemeinschaft Emsquartier e.V.",
      "company_seat": "Rheine",
      "details": "13.02.2025 (Bekanntmachungsdatum)\n\nNordrhein-Westfalen Amtsgericht Steinfurt VR 21073\nRegisterbekanntmachung nach dem Umwandlungsgesetz 13.02.2025 (Eintragungsdatum)\n\nImmobilien- und Standortgemeinschaft Emsquartier e.V.\neingetragener Verein\nRheine\n\nDen Gläubigern der an der Verschmelzung beteiligten Rechtsträger ist, wenn sie binnen sechs Monaten nach dem Tag, an dem die Eintragung der Verschmelzung in das Register des Sitzes derjenigen Rechtsträger deren Gläubiger sie sind, nach § 19 Absatz 3 UmwG als bekanntgemacht gilt, ihren Anspruch nach Grund und Höhe schriftlich anmelden, Sicherheit zu leisten, soweit sie nicht Befriedigung verlangen können. Dieses Recht steht den Gläubigern jedoch nur zu, wenn sie glaubhaft machen, dass durch die Verschmelzung die Erfüllung ihrer Forderung gefährdet wird."
    },
    {
      "date": "2025-02-13",
      "id": "101298",
      "original_text": "Registerbekanntmachung nach dem Umwandlungsgesetz\nNordrhein-Westfalen Amtsgericht Steinfurt VR 21027\nHandelsverein Rheine e. V. – Rheine",
      "type": "Registerbekanntmachung nach dem Umwandlungsgesetz",
      "state": "Nordrhein-Westfalen",
      "amtsgericht": "Amtsgericht Steinfurt",
      "registernummer": "VR 21027",
      "registerart": "VR",
      "company_name": "Handelsverein Rheine e. V.",
      "company_seat": "Rheine",
      "details": "13.02.2025 (Bekanntmachungsdatum)\n\nNordrhein-Westfalen Amtsgericht Steinfurt VR 21027\nRegisterbekanntmachung nach dem Umwandlungsgesetz 13.02.2025 (Eintragungsdatum)\n\nHandelsverein Rheine e. V.\neingetragener Verein\nRheine\n\nDen Gläubigern der an der Verschmelzung beteiligten Rechtsträger ist, wenn sie binnen sechs Monaten nach dem Tag, an dem die Eintragung der Verschmelzung in das Register des Sitzes derjenigen Rechtsträger deren Gläubiger sie sind, nach § 19 Absatz 3 UmwG als bekanntgemacht gilt, ihren Anspruch nach Grund und Höhe schriftlich anmelden, Sicherheit zu leisten, soweit sie nicht Befriedigung verlangen können. Dieses Recht steht den Gläubigern jedoch nur zu, wenn sie glaubhaft machen, dass durch die Verschmelzung die Erfüllung ihrer Forderung gefährdet wird."
    },
    {
      "date": "2025-02-13",
      "id": "101299",
      "original_text": "Einreichung neuer Dokumente\nThüringen Amtsgericht Jena HRB 107864\nMeta Wolf AG – Kranichfeld",
      "type": "Einreichung neuer Dokumente",
      "state": "Thüringen",
      "amtsgericht": "Amtsgericht Jena",
      "registernummer": "HRB 107864",
      "registerart": "HRB",
      "company_name": "Meta Wolf AG",
      "company_seat": "Kranichfeld",
      "details": "13.02.2025 (Bekanntmachungsdatum)\n\nThüringen Amtsgericht Jena HRB 107864\nEinreichung neuer Dokumente 01.02.2025 (Eintragungsdatum)\n\nMeta Wolf AG\nAktiengesellschaft\nKranichfeld\n\nBekanntmachung gem. § 106 AktG: Aufgrund einer Veränderung in den Personen der Aufsichtsratsmitglieder ist durch den Vorstand eine neue Liste zum Handelsregister eingereicht worden."
    },
    {
      "date": "2025-02-13",
      "id": "101300",
      "original_text": "Registerbekanntmachung nach dem Umwandlungsgesetz\nBaden-Württemberg Amtsgericht Stuttgart HRB 728280\nemagine Flexwork GmbH – Stuttgart",
      "type": "Registerbekanntmachung nach dem Umwandlungsgesetz",
      "state": "Baden-Württemberg",
      "amtsgericht": "Amtsgericht Stuttgart",
      "registernummer": "HRB 728280",
      "registerart": "HRB",
      "company_name": "emagine Flexwork GmbH",
      "company_seat": "Stuttgart",
      "details": "13.02.2025 (Bekanntmachungsdatum)\n\nBaden-Württemberg Amtsgericht Stuttgart HRB 728280\nRegisterbekanntmachung nach dem Umwandlungsgesetz 13.02.2025 (Eintragungsdatum)\n\nemagine Flexwork GmbH\nGesellschaft mit beschränkter Haftung\nStuttgart\n\nAls nicht eingetragen wird bekanntgemacht:\nDen Gläubigern der an der Verschmelzung beteiligten Rechtsträger ist, wenn sie binnen sechs Monaten nach dem Tag, an dem die Eintragung der Verschmelzung in das Register des Sitzes desjenigen Rechtsträgers, dessen Gläubiger sie sind, nach § 19 Abs. 3 UmwG als bekanntgemacht gilt, ihren Anspruch nach Grund und Höhe schriftlich anmelden, Sicherheit zu leisten, soweit sie nicht Befriedigung verlangen können. Dieses Recht steht den Gläubigern jedoch nur zu, wenn sie glaubhaft machen, dass durch die Verschmelzung die Erfüllung ihrer Forderung gefährdet wird."
    },
    {
      "date": "2025-02-13",
      "id": "101301",
      "original_text": "Löschungsankündigung\nHessen Amtsgericht Limburg HRA 2233\nGO.MEDIA KG – Weilmünster",
      "type": "Löschungsankündigung",
      "state": "Hessen",
      "amtsgericht": "Amtsgericht Limburg",
      "registernummer": "HRA 2233",
      "registerart": "HRA",
      "company_name": "GO.MEDIA KG",
      "company_seat": "Weilmünster",
      "details": "13.02.2025 (Bekanntmachungsdatum)\n\nHessen Amtsgericht Limburg HRA 2233\nLöschungsankündigung\n\nGO.MEDIA KG\nKommanditgesellschaft\nWeilmünster\n\nDas Registergericht beabsichtigt die im Handelsregister eingetragene Firma von Amts wegen nach § 393 FamFG zu löschen. Die Frist zur Erhebung eines Widerspruchs gegen die beabsichtigte Löschung wird auf 3 Monate festgesetzt."
    },
    {
      "date": "2025-02-13",
      "id": "101302",
      "original_text": "Einreichung neuer Dokumente\nHessen Amtsgericht Offenbach am Main HRB 42396\nBiotest Aktiengesellschaft – Dreieich",
      "type": "Einreichung neuer Dokumente",
      "state": "Hessen",
      "amtsgericht": "Amtsgericht Offenbach am Main",
      "registernummer": "HRB 42396",
      "registerart": "HRB",
      "company_name": "Biotest Aktiengesellschaft",
      "company_seat": "Dreieich",
      "details": "13.02.2025 (Bekanntmachungsdatum)\n\nHessen Amtsgericht Offenbach am Main HRB 42396\nEinreichung neuer Dokumente\n\nBiotest Aktiengesellschaft\nAktiengesellschaft\nDreieich\n\nDurch eine Änderung in den Personen der Aufsichtsratsmitglieder ist eine Liste der Mitglieder des Aufsichtsrates zum Handelsregister eingereicht worden."
    },
    {
      "date": "2025-02-13",
      "id": "101303",
      "original_text": "Löschungsankündigung\nHessen Amtsgericht Darmstadt HRB 96797\nPlatinum Travel & Sport UG (haftungsbeschränkt) – Griesheim",
      "type": "Löschungsankündigung",
      "state": "Hessen",
      "amtsgericht": "Amtsgericht Darmstadt",
      "registernummer": "HRB 96797",
      "registerart": "HRB",
      "company_name": "Platinum Travel & Sport UG (haftungsbeschränkt)",
      "company_seat": "Griesheim",
      "details": "13.02.2025 (Bekanntmachungsdatum)\n\nHessen Amtsgericht Darmstadt HRB 96797\nLöschungsankündigung\n\nPlatinum Travel & Sport UG (haftungsbeschränkt)\nGesellschaft mit beschränkter Haftung\nGriesheim\n\nDas Registergericht beabsichtigt die im Handelsregister eingetragene Gesellschaft von Amts wegen nach § 394 FamFG zu löschen. Die Frist zur Erhebung eines Widerspruchs gegen die beabsichtigte Löschung wird auf 3 Monate festgesetzt."
    },
    {
      "date": "2025-02-13",
      "id": "101304",
      "original_text": "Löschungsankündigung\nHessen Amtsgericht Frankfurt am Main HRB 80718\nWohnmobile Rhein Main GmbH – Hattersheim",
      "type": "Löschungsankündigung",
      "state": "Hessen",
      "amtsgericht": "Amtsgericht Frankfurt am Main",
      "registernummer": "HRB 80718",
      "registerart": "HRB",
      "company_name": "Wohnmobile Rhein Main GmbH",
      "company_seat": "Hattersheim",
      "details": "13.02.2025 (Bekanntmachungsdatum)\n\nHessen Amtsgericht Frankfurt am Main HRB 80718\nLöschungsankündigung\n\nWohnmobile Rhein Main GmbH\nGesellschaft mit beschränkter Haftung\nHattersheim\n\nDas Registergericht beabsichtigt die im Handelsregister eingetragene Gesellschaft von Amts wegen nach § 394 FamFG zu löschen. Hiergegen kann innerhalb eines Monats nach dieser Veröffentlichung Widerspruch bei dem Amtsgericht Frankfurt am Main eingelegt werden."
    },
    {
      "date": "2025-02-13",
      "id": "101305",
      "original_text": "Sonstige Registerbekanntmachung\nHessen Amtsgericht Frankfurt am Main HRB 90954\nInterContinental Hotel Berlin GmbH – Frankfurt am Main",
      "type": "Sonstige Registerbekanntmachung",
      "state": "Hessen",
      "amtsgericht": "Amtsgericht Frankfurt am Main",
      "registernummer": "HRB 90954",
      "registerart": "HRB",
      "company_name": "InterContinental Hotel Berlin GmbH",
      "company_seat": "Frankfurt am Main",
      "details": "13.02.2025 (Bekanntmachungsdatum)\n\nHessen Amtsgericht Frankfurt am Main HRB 90954\nSonstige Registerbekanntmachung 13.02.2025 (Eintragungsdatum)\n\nInterContinental Hotel Berlin GmbH\nGesellschaft mit beschränkter Haftung\nFrankfurt am Main\n\nDen Gläubigern der Gesellschaft, deren Forderungen begründet worden sind, bevor die Eintragung der Beendigung des Vertrags in das Handelsregister nach § 10 HGB bekannt gemacht worden ist, ist vom anderen Vertragsteil Sicherheit zu leisten, wenn sie sich binnen sechs Monaten nach dieser Bekanntmachung zu diesem Zweck bei ihm melden."
    },
    {
      "date": "2025-02-13",
      "id": "101306",
      "original_text": "Löschungsankündigung\nHessen Amtsgericht Darmstadt HRB 100024\nINTERSELECTION UG (haftungsbeschränkt) – Raunheim",
      "type": "Löschungsankündigung",
      "state": "Hessen",
      "amtsgericht": "Amtsgericht Darmstadt",
      "registernummer": "HRB 100024",
      "registerart": "HRB",
      "company_name": "INTERSELECTION UG (haftungsbeschränkt)",
      "company_seat": "Raunheim",
      "details": "13.02.2025 (Bekanntmachungsdatum)\n\nHessen Amtsgericht Darmstadt HRB 100024\nLöschungsankündigung 13.02.2025 (Eintragungsdatum)\n\nINTERSELECTION UG (haftungsbeschränkt)\nGesellschaft mit beschränkter Haftung\nRaunheim\n\nDas Registergericht beabsichtigt die im Handelsregister eingetragene Gesellschaft von Amts wegen nach § 394 FamFG zu löschen. Die Frist zur Erhebung eines Widerspruchs gegen die beabsichtigte Löschung wird auf 3 Monate festgesetzt."
    },
    {
      "date": "2025-02-13",
      "id": "101307",
      "original_text": "Sonstige Registerbekanntmachung\nHessen Amtsgericht Bad Hersfeld VR 1488\nGewerbeverein Alheim e.V. – Alheim",
      "type": "Sonstige Registerbekanntmachung",
      "state": "Hessen",
      "amtsgericht": "Amtsgericht Bad Hersfeld",
      "registernummer": "VR 1488",
      "registerart": "VR",
      "company_name": "Gewerbeverein Alheim e.V.",
      "company_seat": "Alheim",
      "details": "13.02.2025 (Bekanntmachungsdatum)\n\nHessen Amtsgericht Bad Hersfeld VR 1488\nSonstige Registerbekanntmachung 13.02.2025 (Eintragungsdatum)\n\nGewerbeverein Alheim e.V.\neingetragener Verein\nAlheim\n\nDer Verein ist aufgelöst."
    },
    {
      "date": "2025-02-13",
      "id": "101308",
      "original_text": "Einreichung neuer Dokumente\nHessen Amtsgericht Frankfurt am Main HRB 35801\nKEBA Gesellschaft für interne Services mbH – Frankfurt am Main",
      "type": "Einreichung neuer Dokumente",
      "state": "Hessen",
      "amtsgericht": "Amtsgericht Frankfurt am Main",
      "registernummer": "HRB 35801",
      "registerart": "HRB",
      "company_name": "KEBA Gesellschaft für interne Services mbH",
      "company_seat": "Frankfurt am Main",
      "details": "13.02.2025 (Bekanntmachungsdatum)\n\nHessen Amtsgericht Frankfurt am Main HRB 35801\nEinreichung neuer Dokumente 11.02.2025 (Eintragungsdatum)\n\nKEBA Gesellschaft für interne Services mbH\nGesellschaft mit beschränkter Haftung\nFrankfurt am Main\n\nDurch eine Änderung in den Personen der Aufsichtsratsmitglieder ist eine Liste der Mitglieder des Aufsichtsrates zum Handelsregister eingereicht worden."
    },
    {
      "date": "2025-02-13",
      "id": "101309",
      "original_text": "Registerbekanntmachung nach dem Umwandlungsgesetz\nHessen Amtsgericht Frankfurt am Main HRA 50734\nPohlmann & Company GmbH & Co. KG – Frankfurt am Main",
      "type": "Registerbekanntmachung nach dem Umwandlungsgesetz",
      "state": "Hessen",
      "amtsgericht": "Amtsgericht Frankfurt am Main",
      "registernummer": "HRA 50734",
      "registerart": "HRA",
      "company_name": "Pohlmann & Company GmbH & Co. KG",
      "company_seat": "Frankfurt am Main",
      "details": "13.02.2025 (Bekanntmachungsdatum)\n\nHessen Amtsgericht Frankfurt am Main HRA 50734\nRegisterbekanntmachung nach dem Umwandlungsgesetz 13.02.2025 (Eintragungsdatum)\n\nPohlmann & Company GmbH & Co. KG\nKommanditgesellschaft\nFrankfurt am Main\n\nDen Gläubigern der an der Verschmelzung beteiligten Rechtsträger ist, wenn sie binnen sechs Monaten nach dem Tag, an dem die Eintragung der Verschmelzung in das Register des Sitzes desjenigen Rechtsträgers, dessen Gläubiger sie sind, nach § 19 Absatz 3 UmwG bekannt gemacht worden ist, ihren Anspruch nach Grund und Höhe schriftlich anmelden, Sicherheit zu leisten, soweit sie nicht Befriedigung verlangen können. Dieses Recht steht den Gläubigern jedoch nur zu, wenn sie glaubhaft machen, dass durch die Verschmelzung die Erfüllung ihrer Forderung gefährdet wird."
    },
    {
      "date": "2025-02-13",
      "id": "101310",
      "original_text": "Löschungsankündigung\nHessen Amtsgericht Fulda HRB 6994\nHirschfelder Parkettstudio GmbH – Künzell",
      "type": "Löschungsankündigung",
      "state": "Hessen",
      "amtsgericht": "Amtsgericht Fulda",
      "registernummer": "HRB 6994",
      "registerart": "HRB",
      "company_name": "Hirschfelder Parkettstudio GmbH",
      "company_seat": "Künzell",
      "details": "13.02.2025 (Bekanntmachungsdatum)\n\nHessen Amtsgericht Fulda HRB 6994\nLöschungsankündigung\n\nHirschfelder Parkettstudio GmbH\nGesellschaft mit beschränkter Haftung\nKünzell\n\nDas Registergericht beabsichtigt die im Handelsregister eingetragene Gesellschaft von Amts wegen nach § 394 FamFG zu löschen. Die Frist zur Erhebung eines Widerspruchs gegen die beabsichtigte Löschung wird auf 3 Monate festgesetzt."
    },
    {
      "date": "2025-02-13",
      "id": "101311",
      "original_text": "Sonstige Registerbekanntmachung\nHessen Amtsgericht Frankfurt am Main HRB 106448\nDreibauten GmbH – Eschborn",
      "type": "Sonstige Registerbekanntmachung",
      "state": "Hessen",
      "amtsgericht": "Amtsgericht Frankfurt am Main",
      "registernummer": "HRB 106448",
      "registerart": "HRB",
      "company_name": "Dreibauten GmbH",
      "company_seat": "Eschborn",
      "details": "13.02.2025 (Bekanntmachungsdatum)\n\nHessen Amtsgericht Frankfurt am Main HRB 106448\nSonstige Registerbekanntmachung 13.02.2025 (Eintragungsdatum)\n\nDreibauten GmbH\nGesellschaft mit beschränkter Haftung\nEschborn\n\nDen Gläubigern der Gesellschaft, deren Forderungen begründet worden sind, bevor die Eintragung der Beendigung des Vertrags in das Handelsregister nach § 10 HGB bekannt gemacht worden ist, ist vom anderen Vertragsteil Sicherheit zu leisten, wenn sie sich binnen sechs Monaten nach dieser Bekanntmachung zu diesem Zweck bei ihm melden."
    },
    {
      "date": "2025-02-13",
      "id": "101312",
      "original_text": "Registerbekanntmachung nach dem Umwandlungsgesetz\nHessen Amtsgericht Frankfurt am Main PR 2682\nPohlmann & Company - Rechtsanwälte PartG mbB – Frankfurt am Main",
      "type": "Registerbekanntmachung nach dem Umwandlungsgesetz",
      "state": "Hessen",
      "amtsgericht": "Amtsgericht Frankfurt am Main",
      "registernummer": "PR 2682",
      "registerart": "PR",
      "company_name": "Pohlmann & Company - Rechtsanwälte PartG mbB",
      "company_seat": "Frankfurt am Main",
      "details": "13.02.2025 (Bekanntmachungsdatum)\n\nHessen Amtsgericht Frankfurt am Main PR 2682\nRegisterbekanntmachung nach dem Umwandlungsgesetz 13.02.2025 (Eintragungsdatum)\n\nPohlmann & Company - Rechtsanwälte PartG mbB\nPartnerschaftsgesellschaft\nFrankfurt am Main\n\nDen Gläubigern der an der Verschmelzung beteiligten Rechtsträger ist, wenn sie binnen sechs Monaten nach dem Tag, an dem die Eintragung der Verschmelzung in das Register des Sitzes desjenigen Rechtsträgers, dessen Gläubiger sie sind, nach § 19 Absatz 3 UmwG bekannt gemacht worden ist, ihren Anspruch nach Grund und Höhe schriftlich anmelden, Sicherheit zu leisten, soweit sie nicht Befriedigung verlangen können. Dieses Recht steht den Gläubigern jedoch nur zu, wenn sie glaubhaft machen, dass durch die Verschmelzung die Erfüllung ihrer Forderung gefährdet wird."
    },
    {
      "date": "2025-02-13",
      "id": "101313",
      "original_text": "Einreichung neuer Dokumente\nHessen Amtsgericht Frankfurt am Main HRB 12394\nDeutsche Gesellschaft für Internationale Zusammenarbeit (GIZ) GmbH – Eschborn und Bonn",
      "type": "Einreichung neuer Dokumente",
      "state": "Hessen",
      "amtsgericht": "Amtsgericht Frankfurt am Main",
      "registernummer": "HRB 12394",
      "registerart": "HRB",
      "company_name": "Deutsche Gesellschaft für Internationale Zusammenarbeit (GIZ) GmbH",
      "company_seat": "Eschborn und Bonn",
      "details": "13.02.2025 (Bekanntmachungsdatum)\n\nHessen Amtsgericht Frankfurt am Main HRB 12394\nEinreichung neuer Dokumente 13.02.2025 (Eintragungsdatum)\n\nDeutsche Gesellschaft für Internationale Zusammenarbeit (GIZ) GmbH\nGesellschaft mit beschränkter Haftung\nEschborn und Bonn\n\nDurch eine Änderung in den Personen der Aufsichtsratsmitglieder ist eine Liste der Mitglieder des Aufsichtsrates zum Handelsregister eingereicht worden."
    },
    {
      "date": "2025-02-13",
      "id": "101314",
      "original_text": "Sonstige Registerbekanntmachung\nHessen Amtsgericht Kassel VR 4195\nFörderverein Sonderpädagogisches Beratungs- und Förderzentrum an der Wilhelm-FiIchner-Schule, Schule für Lernhilfe mit einer Abteilung Sprachheilschule in 34466 Wolfhagen e.V. – Wolfhagen",
      "type": "Sonstige Registerbekanntmachung",
      "state": "Hessen",
      "amtsgericht": "Amtsgericht Kassel",
      "registernummer": "VR 4195",
      "registerart": "VR",
      "company_name": "Förderverein Sonderpädagogisches Beratungs- und Förderzentrum an der Wilhelm-FiIchner-Schule, Schule für Lernhilfe mit einer Abteilung Sprachheilschule in 34466 Wolfhagen e.V.",
      "company_seat": "Wolfhagen",
      "details": "13.02.2025 (Bekanntmachungsdatum)\n\nHessen Amtsgericht Kassel VR 4195\nSonstige Registerbekanntmachung 13.02.2025 (Eintragungsdatum)\n\nFörderverein Sonderpädagogisches Beratungs- und Förderzentrum an der Wilhelm-FiIchner-Schule, Schule für Lernhilfe mit einer Abteilung Sprachheilschule in 34466 Wolfhagen e.V.\neingetragener Verein\nWolfhagen\n\nDer Verein ist aufgelöst."
    }
  ]
}