{
  "date": "2025-02-01",
  "date_of_scrape": "2025-02-02T04:03:52.633Z",
  "tool_version": "0.2.0",
  "number_of_announcements": 19,
  "announcements": [
    {
      "date": "2025-02-01",
      "id": "100240",
      "original_text": "Löschungsankündigung\nBayern Amtsgericht Landshut HRB 7841\nTIMEX Germany UG (haftungsbeschränkt) – Essenbach",
      "type": "Löschungsankündigung",
      "state": "Bayern",
      "amtsgericht": "Amtsgericht Landshut",
      "registernummer": "HRB 7841",
      "registerart": "HRB",
      "company_name": "TIMEX Germany UG (haftungsbeschränkt)",
      "company_seat": "Essenbach",
      "details": "01.02.2025 (Bekanntmachungsdatum)\n\nBayern Amtsgericht Landshut HRB 7841\nLöschungsankündigung\n\nTIMEX Germany UG (haftungsbeschränkt)\nGesellschaft mit beschränkter Haftung\nEssenbach\n\nDas Registergericht beabsichtigt, die im Handelsregister eingetragene Gesellschaft wegen Vermögenslosigkeit von Amts wegen nach § 394 FamFG zu löschen. Die Frist zur Erhebung eines Widerspruchs ist auf einen Monat festgesetzt."
    },
    {
      "date": "2025-02-01",
      "id": "100241",
      "original_text": "Registerbekanntmachung nach dem Umwandlungsgesetz\nBayern Amtsgericht München HRB 153613\nElement1 Media GmbH – München",
      "type": "Registerbekanntmachung nach dem Umwandlungsgesetz",
      "state": "Bayern",
      "amtsgericht": "Amtsgericht München",
      "registernummer": "HRB 153613",
      "registerart": "HRB",
      "company_name": "Element1 Media GmbH",
      "company_seat": "München",
      "details": "01.02.2025 (Bekanntmachungsdatum)\n\nBayern Amtsgericht München HRB 153613\nRegisterbekanntmachung nach dem Umwandlungsgesetz 31.01.2025 (Eintragungsdatum)\n\nElement1 Media GmbH\nGesellschaft mit beschränkter Haftung\nMünchen\n\nDen Gläubigern der an der Verschmelzung beteiligten Rechtsträger ist, wenn sie binnen sechs Monaten nach dem Tag, an dem die Eintragung der Verschmelzung in das Register des Sitzes desjenigen Rechtsträgers, dessen Gläubiger sie sind, nach § 19 Abs. 3 UmwG als bekannt gemacht gilt, ihren Anspruch nach Grund und Höhe in Textform anmelden, Sicherheit zu leisten, soweit sie nicht Befriedigung verlangen können. Dieses Recht steht den Gläubigern jedoch nur zu, wenn sie glaubhaft machen, dass durch die Verschmelzung die Erfüllung ihrer Forderung gefährdet wird."
    },
    {
      "date": "2025-02-01",
      "id": "100242",
      "original_text": "Löschungsankündigung\nBayern Amtsgericht Augsburg HRB 22527\narwe Personal & Invest GmbH – Augsburg",
      "type": "Löschungsankündigung",
      "state": "Bayern",
      "amtsgericht": "Amtsgericht Augsburg",
      "registernummer": "HRB 22527",
      "registerart": "HRB",
      "company_name": "arwe Personal & Invest GmbH",
      "company_seat": "Augsburg",
      "details": "01.02.2025 (Bekanntmachungsdatum)\n\nBayern Amtsgericht Augsburg HRB 22527\nLöschungsankündigung 30.01.2025 (Eintragungsdatum)\n\narwe Personal & Invest GmbH\nGesellschaft mit beschränkter Haftung\nAugsburg\n\nDas Registergericht beabsichtigt, die im Handelsregister eingetragene Gesellschaft wegen Vermögenslosigkeit von Amts wegen nach § 394 FamFG zu löschen. Die Frist zur Erhebung eines Widerspruchs ist auf einen Monat festgesetzt."
    },
    {
      "date": "2025-02-01",
      "id": "100243",
      "original_text": "Sonstige Registerbekanntmachung\nBayern Amtsgericht München HRB 272176\nAuto Acar GmbH – Unterschleißheim",
      "type": "Sonstige Registerbekanntmachung",
      "state": "Bayern",
      "amtsgericht": "Amtsgericht München",
      "registernummer": "HRB 272176",
      "registerart": "HRB",
      "company_name": "Auto Acar GmbH",
      "company_seat": "Unterschleißheim",
      "details": "01.02.2025 (Bekanntmachungsdatum)\n\nBayern Amtsgericht München HRB 272176\nSonstige Registerbekanntmachung 31.01.2025 (Eintragungsdatum)\n\nAuto Acar GmbH\nGesellschaft mit beschränkter Haftung\nUnterschleißheim\n\nDen Gläubigern der Gesellschaft, deren Forderungen begründet worden sind, bevor die Eintragung der Beendigung des Beherrschungs- und Gewinnabführungsvertrages in das Handelsregister nach § 10 des Handelsgesetzbuches als bekanntgemacht gilt, hat der andere Vertragsteil Sicherheit zu leisten, wenn sie sich binnen sechs Monaten nach der Bekanntmachung der Eintragung zu diesem Zweck bei ihm melden."
    },
    {
      "date": "2025-02-01",
      "id": "100244",
      "original_text": "Einreichung neuer Dokumente\nBayern Amtsgericht München HRB 256374\ncosin scientific software AG – München",
      "type": "Einreichung neuer Dokumente",
      "state": "Bayern",
      "amtsgericht": "Amtsgericht München",
      "registernummer": "HRB 256374",
      "registerart": "HRB",
      "company_name": "cosin scientific software AG",
      "company_seat": "München",
      "details": "01.02.2025 (Bekanntmachungsdatum)\n\nBayern Amtsgericht München HRB 256374\nEinreichung neuer Dokumente\n\ncosin scientific software AG\nAktiengesellschaft\nMünchen\n\nDem Amtsgericht München -Registergericht- ist eine Liste der Mitglieder des Aufsichtsrats eingereicht worden, § 106 AktG."
    },
    {
      "date": "2025-02-01",
      "id": "100245",
      "original_text": "Registerbekanntmachung nach dem Umwandlungsgesetz\nBayern Amtsgericht Traunstein HRB 25419\nBSM Ingenieure Verwaltungs GmbH – Traunwalchen",
      "type": "Registerbekanntmachung nach dem Umwandlungsgesetz",
      "state": "Bayern",
      "amtsgericht": "Amtsgericht Traunstein",
      "registernummer": "HRB 25419",
      "registerart": "HRB",
      "company_name": "BSM Ingenieure Verwaltungs GmbH",
      "company_seat": "Traunwalchen",
      "details": "01.02.2025 (Bekanntmachungsdatum)\n\nBayern Amtsgericht Traunstein HRB 25419\nRegisterbekanntmachung nach dem Umwandlungsgesetz 31.01.2025 (Eintragungsdatum)\n\nBSM Ingenieure Verwaltungs GmbH\nGesellschaft mit beschränkter Haftung\nTraunwalchen\n\nDen Gläubigern der an der Verschmelzung beteiligten Rechtsträger ist, wenn sie binnen sechs Monaten nach dem Tag, an dem die Eintragung der Verschmelzung in das Register des Sitzes desjenigen Rechtsträgers, dessen Gläubiger sie sind, nach § 19 Abs. 3 UmwG als bekannt gemacht gilt, ihren Anspruch nach Grund und Höhe in Textform anmelden, Sicherheit zu leisten, soweit sie nicht Befriedigung verlangen können. Dieses Recht steht den Gläubigern jedoch nur zu, wenn sie glaubhaft machen, dass durch die Verschmelzung die Erfüllung ihrer Forderung gefährdet wird."
    },
    {
      "date": "2025-02-01",
      "id": "100246",
      "original_text": "Einreichung neuer Dokumente\nBayern Amtsgericht München HRB 285489\nThe ntertain company AG – München",
      "type": "Einreichung neuer Dokumente",
      "state": "Bayern",
      "amtsgericht": "Amtsgericht München",
      "registernummer": "HRB 285489",
      "registerart": "HRB",
      "company_name": "The ntertain company AG",
      "company_seat": "München",
      "details": "01.02.2025 (Bekanntmachungsdatum)\n\nBayern Amtsgericht München HRB 285489\nEinreichung neuer Dokumente\n\nThe ntertain company AG\nAktiengesellschaft\nMünchen\n\nDem Amtsgericht München -Registergericht- ist eine Liste der Mitglieder des Aufsichtsrats eingereicht worden, § 106 AktG."
    },
    {
      "date": "2025-02-01",
      "id": "100247",
      "original_text": "Einreichung neuer Dokumente\nBayern Amtsgericht München HRB 249726\nCANCOM Managed Services GmbH – München",
      "type": "Einreichung neuer Dokumente",
      "state": "Bayern",
      "amtsgericht": "Amtsgericht München",
      "registernummer": "HRB 249726",
      "registerart": "HRB",
      "company_name": "CANCOM Managed Services GmbH",
      "company_seat": "München",
      "details": "01.02.2025 (Bekanntmachungsdatum)\n\nBayern Amtsgericht München HRB 249726\nEinreichung neuer Dokumente 31.01.2025 (Eintragungsdatum)\n\nCANCOM Managed Services GmbH\nGesellschaft mit beschränkter Haftung\nMünchen\n\nDem Amtsgericht München -Registergericht- ist eine Liste der Mitglieder des Aufsichtsrats eingereicht worden, § 52 Abs. 3 S. 2 GmbHG."
    },
    {
      "date": "2025-02-01",
      "id": "100248",
      "original_text": "Registerbekanntmachung nach dem Umwandlungsgesetz\nBayern Amtsgericht München HRB 275161\nin-tech Holding GmbH – Garching b.München",
      "type": "Registerbekanntmachung nach dem Umwandlungsgesetz",
      "state": "Bayern",
      "amtsgericht": "Amtsgericht München",
      "registernummer": "HRB 275161",
      "registerart": "HRB",
      "company_name": "in-tech Holding GmbH",
      "company_seat": "Garching b.München",
      "details": "01.02.2025 (Bekanntmachungsdatum)\n\nBayern Amtsgericht München HRB 275161\nRegisterbekanntmachung nach dem Umwandlungsgesetz 31.01.2025 (Eintragungsdatum)\n\nin-tech Holding GmbH\nGesellschaft mit beschränkter Haftung\nGarching b.München\n\nDen Gläubigern der an der Verschmelzung beteiligten Rechtsträger ist, wenn sie binnen sechs Monaten nach dem Tag, an dem die Eintragung der Verschmelzung in das Register des Sitzes desjenigen Rechtsträgers, dessen Gläubiger sie sind, nach § 19 Abs. 3 UmwG als bekannt gemacht gilt, ihren Anspruch nach Grund und Höhe in Textform anmelden, Sicherheit zu leisten, soweit sie nicht Befriedigung verlangen können. Dieses Recht steht den Gläubigern jedoch nur zu, wenn sie glaubhaft machen, dass durch die Verschmelzung die Erfüllung ihrer Forderung gefährdet wird."
    },
    {
      "date": "2025-02-01",
      "id": "100249",
      "original_text": "Einreichung neuer Dokumente\nBayern Amtsgericht München HRB 213614\nEnphase Energy Germany AG – München",
      "type": "Einreichung neuer Dokumente",
      "state": "Bayern",
      "amtsgericht": "Amtsgericht München",
      "registernummer": "HRB 213614",
      "registerart": "HRB",
      "company_name": "Enphase Energy Germany AG",
      "company_seat": "München",
      "details": "01.02.2025 (Bekanntmachungsdatum)\n\nBayern Amtsgericht München HRB 213614\nEinreichung neuer Dokumente 31.01.2025 (Eintragungsdatum)\n\nEnphase Energy Germany AG\nAktiengesellschaft\nMünchen\n\nDem Amtsgericht München -Registergericht- ist eine Liste der Mitglieder des Aufsichtsrats eingereicht worden, § 106 AktG."
    },
    {
      "date": "2025-02-01",
      "id": "100250",
      "original_text": "Löschungsankündigung\nBayern Amtsgericht Nürnberg HRB 28413\nBiomir GmbH – Nürnberg",
      "type": "Löschungsankündigung",
      "state": "Bayern",
      "amtsgericht": "Amtsgericht Nürnberg",
      "registernummer": "HRB 28413",
      "registerart": "HRB",
      "company_name": "Biomir GmbH",
      "company_seat": "Nürnberg",
      "details": "01.02.2025 (Bekanntmachungsdatum)\n\nBayern Amtsgericht Nürnberg HRB 28413\nLöschungsankündigung\n\nBiomir GmbH\nGesellschaft mit beschränkter Haftung\nNürnberg\n\nDas Registergericht beabsichtigt, die im Handelsregister eingetragene Gesellschaft wegen Vermögenslosigkeit von Amts wegen nach § 394 FamFG zu löschen. Die Frist zur Erhebung eines Widerspruchs ist auf drei Monate festgesetzt."
    },
    {
      "date": "2025-02-01",
      "id": "100251",
      "original_text": "Löschungsankündigung\nBayern Amtsgericht München HRB 279344\nBTS Reisen GmbH – München",
      "type": "Löschungsankündigung",
      "state": "Bayern",
      "amtsgericht": "Amtsgericht München",
      "registernummer": "HRB 279344",
      "registerart": "HRB",
      "company_name": "BTS Reisen GmbH",
      "company_seat": "München",
      "details": "01.02.2025 (Bekanntmachungsdatum)\n\nBayern Amtsgericht München HRB 279344\nLöschungsankündigung 31.01.2025 (Eintragungsdatum)\n\nBTS Reisen GmbH\nGesellschaft mit beschränkter Haftung\nMünchen\n\nDas Registergericht beabsichtigt, die im Handelsregister eingetragene Gesellschaft von Amts wegen nach § 395 FamFG zu löschen. Die Frist zur Erhebung eines Widerspruchs ist auf drei Monate festgesetzt."
    },
    {
      "date": "2025-02-01",
      "id": "100252",
      "original_text": "Einreichung neuer Dokumente\nBayern Amtsgericht München HRB 175883\nMedizinisches Versorgungszentrum Allgäu Bodensee gemeinnützige GmbH – München",
      "type": "Einreichung neuer Dokumente",
      "state": "Bayern",
      "amtsgericht": "Amtsgericht München",
      "registernummer": "HRB 175883",
      "registerart": "HRB",
      "company_name": "Medizinisches Versorgungszentrum Allgäu Bodensee gemeinnützige GmbH",
      "company_seat": "München",
      "details": "01.02.2025 (Bekanntmachungsdatum)\n\nBayern Amtsgericht München HRB 175883\nEinreichung neuer Dokumente 31.01.2025 (Eintragungsdatum)\n\nMedizinisches Versorgungszentrum Allgäu Bodensee gemeinnützige GmbH\nGesellschaft mit beschränkter Haftung\nMünchen\n\nDem Amtsgericht München -Registergericht- ist eine Liste der Mitglieder des Aufsichtsrats eingereicht worden, § 52 Abs. 3 S. 2 GmbHG."
    },
    {
      "date": "2025-02-01",
      "id": "100253",
      "original_text": "Sonstige Registerbekanntmachung\nBayern Amtsgericht München HRB 280408\nSolar Deutschland DEK GmbH – Unterschleißheim",
      "type": "Sonstige Registerbekanntmachung",
      "state": "Bayern",
      "amtsgericht": "Amtsgericht München",
      "registernummer": "HRB 280408",
      "registerart": "HRB",
      "company_name": "Solar Deutschland DEK GmbH",
      "company_seat": "Unterschleißheim",
      "details": "01.02.2025 (Bekanntmachungsdatum)\n\nBayern Amtsgericht München HRB 280408\nSonstige Registerbekanntmachung 31.01.2025 (Eintragungsdatum)\n\nSolar Deutschland DEK GmbH\nGesellschaft mit beschränkter Haftung\nUnterschleißheim\n\nDen Gläubigern der Gesellschaft, deren Forderungen begründet worden sind, bevor die Eintragung der Beendigung des Beherrschungs- und Gewinnabführungsvertrages in das Handelsregister nach § 10 des Handelsgesetzbuches als bekanntgemacht gilt, hat der andere Vertragsteil Sicherheit zu leisten, wenn sie sich binnen sechs Monaten nach der Bekanntmachung der Eintragung zu diesem Zweck bei ihm melden."
    },
    {
      "date": "2025-02-01",
      "id": "100254",
      "original_text": "Löschungsankündigung\nBayern Amtsgericht Nürnberg HRB 36052\nLily Food GmbH – Nürnberg",
      "type": "Löschungsankündigung",
      "state": "Bayern",
      "amtsgericht": "Amtsgericht Nürnberg",
      "registernummer": "HRB 36052",
      "registerart": "HRB",
      "company_name": "Lily Food GmbH",
      "company_seat": "Nürnberg",
      "details": "01.02.2025 (Bekanntmachungsdatum)\n\nBayern Amtsgericht Nürnberg HRB 36052\nLöschungsankündigung\n\nLily Food GmbH\nGesellschaft mit beschränkter Haftung\nNürnberg\n\nDas Registergericht beabsichtigt, die im Handelsregister eingetragene Gesellschaft wegen Vermögenslosigkeit von Amts wegen nach § 394 FamFG zu löschen. Die Frist zur Erhebung eines Widerspruchs ist auf einen Monat festgesetzt."
    },
    {
      "date": "2025-02-01",
      "id": "100255",
      "original_text": "Registerbekanntmachung nach dem Umwandlungsgesetz\nBayern Amtsgericht Traunstein HRB 33640\nEPC Consulting GmbH – Altenmarkt a.d.Alz",
      "type": "Registerbekanntmachung nach dem Umwandlungsgesetz",
      "state": "Bayern",
      "amtsgericht": "Amtsgericht Traunstein",
      "registernummer": "HRB 33640",
      "registerart": "HRB",
      "company_name": "EPC Consulting GmbH",
      "company_seat": "Altenmarkt a.d.Alz",
      "details": "01.02.2025 (Bekanntmachungsdatum)\n\nBayern Amtsgericht Traunstein HRB 33640\nRegisterbekanntmachung nach dem Umwandlungsgesetz 14.01.2025 (Eintragungsdatum)\n\nEPC Consulting GmbH\nGesellschaft mit beschränkter Haftung\nAltenmarkt a.d.Alz\n\nDen Gläubigern des formwechselnden Rechtsträgers ist, wenn sie binnen sechs Monaten nach dem Tag, an dem die Eintragung des Formwechsels nach § 201 UmwG als bekannt gemacht gilt, ihren Anspruch nach Grund und Höhe in Textform anmelden, Sicherheit zu leisten, soweit sie nicht Befriedigung verlangen können. Dieses Recht steht den Gläubigern jedoch nur zu, wenn sie glaubhaft machen, dass durch den Formwechsel die Erfüllung ihrer Forderung gefährdet wird."
    },
    {
      "date": "2025-02-01",
      "id": "100256",
      "original_text": "Registerbekanntmachung nach dem Umwandlungsgesetz\nBayern Amtsgericht Memmingen HRB 14736\nRapunzel Naturkost GmbH – Legau",
      "type": "Registerbekanntmachung nach dem Umwandlungsgesetz",
      "state": "Bayern",
      "amtsgericht": "Amtsgericht Memmingen",
      "registernummer": "HRB 14736",
      "registerart": "HRB",
      "company_name": "Rapunzel Naturkost GmbH",
      "company_seat": "Legau",
      "details": "01.02.2025 (Bekanntmachungsdatum)\n\nBayern Amtsgericht Memmingen HRB 14736\nRegisterbekanntmachung nach dem Umwandlungsgesetz 31.01.2025 (Eintragungsdatum)\n\nRapunzel Naturkost GmbH\nGesellschaft mit beschränkter Haftung\nLegau\n\nDen Gläubigern des formwechselnden Rechtsträgers ist, wenn sie binnen sechs Monaten nach dem Tag, an dem die Eintragung des Formwechsels nach § 201 UmwG als bekannt gemacht gilt, ihren Anspruch nach Grund und Höhe in Textform anmelden, Sicherheit zu leisten, soweit sie nicht Befriedigung verlangen können. Dieses Recht steht den Gläubigern jedoch nur zu, wenn sie glaubhaft machen, dass durch den Formwechsel die Erfüllung ihrer Forderung gefährdet wird."
    },
    {
      "date": "2025-02-01",
      "id": "100257",
      "original_text": "Einreichung neuer Dokumente\nBayern Amtsgericht München HRB 233618\nMarkel Insurance SE – München",
      "type": "Einreichung neuer Dokumente",
      "state": "Bayern",
      "amtsgericht": "Amtsgericht München",
      "registernummer": "HRB 233618",
      "registerart": "HRB",
      "company_name": "Markel Insurance SE",
      "company_seat": "München",
      "details": "01.02.2025 (Bekanntmachungsdatum)\n\nBayern Amtsgericht München HRB 233618\nEinreichung neuer Dokumente 31.01.2025 (Eintragungsdatum)\n\nMarkel Insurance SE\nEuropäische Aktiengesellschaft (SE)\nMünchen\n\nDem Amtsgericht München -Registergericht- ist eine Liste der Mitglieder des Aufsichtsrats eingereicht worden, Art. 9 Abs. 1 Buchst. c (ii) SE-VO i.V.m. § 106 AktG."
    },
    {
      "date": "2025-02-01",
      "id": "100258",
      "original_text": "Registerbekanntmachung nach dem Umwandlungsgesetz\nBayern Amtsgericht Nürnberg HRB 44086\nSmart Tech Control GmbH – Nürnberg",
      "type": "Registerbekanntmachung nach dem Umwandlungsgesetz",
      "state": "Bayern",
      "amtsgericht": "Amtsgericht Nürnberg",
      "registernummer": "HRB 44086",
      "registerart": "HRB",
      "company_name": "Smart Tech Control GmbH",
      "company_seat": "Nürnberg",
      "details": "01.02.2025 (Bekanntmachungsdatum)\n\nBayern Amtsgericht Nürnberg HRB 44086\nRegisterbekanntmachung nach dem Umwandlungsgesetz 31.01.2025 (Eintragungsdatum)\n\nSmart Tech Control GmbH\nGesellschaft mit beschränkter Haftung\nNürnberg\n\nDen Gläubigern des formwechselnden Rechtsträgers ist, wenn sie binnen sechs Monaten nach dem Tag, an dem die Eintragung des Formwechsels nach § 201 UmwG als bekannt gemacht gilt, ihren Anspruch nach Grund und Höhe in Textform anmelden, Sicherheit zu leisten, soweit sie nicht Befriedigung verlangen können. Dieses Recht steht den Gläubigern jedoch nur zu, wenn sie glaubhaft machen, dass durch den Formwechsel die Erfüllung ihrer Forderung gefährdet wird."
    }
  ]
}