{
  "date": "2025-02-28",
  "date_of_scrape": "2025-03-01T04:07:39.831Z",
  "tool_version": "0.2.0",
  "number_of_announcements": 107,
  "announcements": [
    {
      "date": "2025-02-28",
      "id": "102524",
      "original_text": "Registerbekanntmachung nach dem Umwandlungsgesetz\nBayern Amtsgericht München HRB 300391\nSchneider Digital GmbH – Holzkirchen",
      "type": "Registerbekanntmachung nach dem Umwandlungsgesetz",
      "state": "Bayern",
      "amtsgericht": "Amtsgericht München",
      "registernummer": "HRB 300391",
      "registerart": "HRB",
      "company_name": "Schneider Digital GmbH",
      "company_seat": "Holzkirchen",
      "details": "28.02.2025 (Bekanntmachungsdatum)\n\nBayern Amtsgericht München HRB 300391\nRegisterbekanntmachung nach dem Umwandlungsgesetz 27.02.2025 (Eintragungsdatum)\n\nSchneider Digital GmbH\nGesellschaft mit beschränkter Haftung\nHolzkirchen\n\nDen Gläubigern der an der Ausgliederung beteiligten Rechtsträger ist, wenn sie binnen sechs Monaten nach dem Tag, an dem die Eintragung der Ausgliederung in das Register des Sitzes desjenigen Rechtsträgers, dessen Gläubiger sie sind, nach §§ 125, 19 Abs. 3 UmwG als bekannt gemacht gilt, ihren Anspruch nach Grund und Höhe in Textform anmelden, Sicherheit zu leisten, soweit sie nicht Befriedigung verlangen können. Dieses Recht steht den Gläubigern jedoch nur zu, wenn sie glaubhaft machen, dass durch die Ausgliederung die Erfüllung ihrer Forderung gefährdet wird."
    },
    {
      "date": "2025-02-28",
      "id": "102525",
      "original_text": "Sonstige Registerbekanntmachung\nBayern Amtsgericht Passau HRB 7223\nsolar-pur AG – Saldenburg",
      "type": "Sonstige Registerbekanntmachung",
      "state": "Bayern",
      "amtsgericht": "Amtsgericht Passau",
      "registernummer": "HRB 7223",
      "registerart": "HRB",
      "company_name": "solar-pur AG",
      "company_seat": "Saldenburg",
      "details": "28.02.2025 (Bekanntmachungsdatum)\n\nBayern Amtsgericht Passau HRB 7223\nSonstige Registerbekanntmachung 27.02.2025 (Eintragungsdatum)\n\nsolar-pur AG\nAktiengesellschaft\nSaldenburg\n\nEs ist eine Liste der Mitglieder des Aufsichtsrats eingereicht worden, § 106 AktG."
    },
    {
      "date": "2025-02-28",
      "id": "102526",
      "original_text": "Registerbekanntmachung nach dem Umwandlungsgesetz\nBayern Amtsgericht Würzburg HRB 15499\nPan GmbH – Würzburg",
      "type": "Registerbekanntmachung nach dem Umwandlungsgesetz",
      "state": "Bayern",
      "amtsgericht": "Amtsgericht Würzburg",
      "registernummer": "HRB 15499",
      "registerart": "HRB",
      "company_name": "Pan GmbH",
      "company_seat": "Würzburg",
      "details": "28.02.2025 (Bekanntmachungsdatum)\n\nBayern Amtsgericht Würzburg HRB 15499\nRegisterbekanntmachung nach dem Umwandlungsgesetz 27.02.2025 (Eintragungsdatum)\n\nPan GmbH\nGesellschaft mit beschränkter Haftung\nWürzburg\n\nDen Gläubigern der an der Verschmelzung beteiligten Rechtsträger ist, wenn sie binnen sechs Monaten nach dem Tag, an dem die Eintragung der Verschmelzung in das Register des Sitzes desjenigen Rechtsträgers, dessen Gläubiger sie sind, nach § 19 Abs. 3 UmwG als bekannt gemacht gilt, ihren Anspruch nach Grund und Höhe in Textform anmelden, Sicherheit zu leisten, soweit sie nicht Befriedigung verlangen können. Dieses Recht steht den Gläubigern jedoch nur zu, wenn sie glaubhaft machen, dass durch die Verschmelzung die Erfüllung ihrer Forderung gefährdet wird."
    },
    {
      "date": "2025-02-28",
      "id": "102527",
      "original_text": "Registerbekanntmachung nach dem Umwandlungsgesetz\nBayern Amtsgericht München HRB 147721\nChristian Koenen GmbH – Hohenbrunn",
      "type": "Registerbekanntmachung nach dem Umwandlungsgesetz",
      "state": "Bayern",
      "amtsgericht": "Amtsgericht München",
      "registernummer": "HRB 147721",
      "registerart": "HRB",
      "company_name": "Christian Koenen GmbH",
      "company_seat": "Hohenbrunn",
      "details": "28.02.2025 (Bekanntmachungsdatum)\n\nBayern Amtsgericht München HRB 147721\nRegisterbekanntmachung nach dem Umwandlungsgesetz 27.02.2025 (Eintragungsdatum)\n\nChristian Koenen GmbH\nGesellschaft mit beschränkter Haftung\nHohenbrunn\n\nDen Gläubigern der an der Verschmelzung beteiligten Rechtsträger ist, wenn sie binnen sechs Monaten nach dem Tag, an dem die Eintragung der Verschmelzung in das Register des Sitzes desjenigen Rechtsträgers, dessen Gläubiger sie sind, nach § 19 Abs. 3 UmwG als bekannt gemacht gilt, ihren Anspruch nach Grund und Höhe in Textform anmelden, Sicherheit zu leisten, soweit sie nicht Befriedigung verlangen können. Dieses Recht steht den Gläubigern jedoch nur zu, wenn sie glaubhaft machen, dass durch die Verschmelzung die Erfüllung ihrer Forderung gefährdet wird."
    },
    {
      "date": "2025-02-28",
      "id": "102528",
      "original_text": "Registerbekanntmachung nach dem Umwandlungsgesetz\nBayern Amtsgericht Kempten (Allgäu) HRB 1590\nCONCRETE Rudolph GmbH – Ellhofen, Gemeinde Weiler-Simmerberg",
      "type": "Registerbekanntmachung nach dem Umwandlungsgesetz",
      "state": "Bayern",
      "amtsgericht": "Amtsgericht Kempten (Allgäu)",
      "registernummer": "HRB 1590",
      "registerart": "HRB",
      "company_name": "CONCRETE Rudolph GmbH",
      "company_seat": "Ellhofen, Gemeinde Weiler-Simmerberg",
      "details": "28.02.2025 (Bekanntmachungsdatum)\n\nBayern Amtsgericht Kempten (Allgäu) HRB 1590\nRegisterbekanntmachung nach dem Umwandlungsgesetz 27.02.2025 (Eintragungsdatum)\n\nCONCRETE Rudolph GmbH\nGesellschaft mit beschränkter Haftung\nEllhofen, Gemeinde Weiler-Simmerberg\n\nDen Gläubigern der an der Spaltung beteiligten Rechtsträger ist, wenn sie binnen sechs Monaten nach dem Tag, an dem die Eintragung der Spaltung in das Register des Sitzes desjenigen Rechtsträgers, dessen Gläubiger sie sind, nach §§ 125, 19 Abs. 3 UmwG als bekannt gemacht gilt, ihren Anspruch nach Grund und Höhe in Textform anmelden, Sicherheit zu leisten, soweit sie nicht Befriedigung verlangen können. Dieses Recht steht den Gläubigern jedoch nur zu, wenn sie glaubhaft machen, dass durch die Spaltung die Erfüllung ihrer Forderung gefährdet wird."
    },
    {
      "date": "2025-02-28",
      "id": "102529",
      "original_text": "Registerbekanntmachung nach dem Umwandlungsgesetz\nBayern Amtsgericht Augsburg HRB 34087\nBGV GmbH – Oettingen i.Bay.",
      "type": "Registerbekanntmachung nach dem Umwandlungsgesetz",
      "state": "Bayern",
      "amtsgericht": "Amtsgericht Augsburg",
      "registernummer": "HRB 34087",
      "registerart": "HRB",
      "company_name": "BGV GmbH",
      "company_seat": "Oettingen i.Bay.",
      "details": "28.02.2025 (Bekanntmachungsdatum)\n\nBayern Amtsgericht Augsburg HRB 34087\nRegisterbekanntmachung nach dem Umwandlungsgesetz 27.02.2025 (Eintragungsdatum)\n\nBGV GmbH\nGesellschaft mit beschränkter Haftung\nOettingen i.Bay.\n\nDen Gläubigern des formwechselnden Rechtsträgers ist, wenn sie binnen sechs Monaten nach dem Tag, an dem die Eintragung des Formwechsels nach § 201 UmwG als bekannt gemacht gilt, ihren Anspruch nach Grund und Höhe in Textform anmelden, Sicherheit zu leisten, soweit sie nicht Befriedigung verlangen können. Dieses Recht steht den Gläubigern jedoch nur zu, wenn sie glaubhaft machen, dass durch den Formwechsel die Erfüllung ihrer Forderung gefährdet wird."
    },
    {
      "date": "2025-02-28",
      "id": "102530",
      "original_text": "Registerbekanntmachung nach dem Umwandlungsgesetz\nBayern Amtsgericht München HRB 165062\nct shop GmbH – Tutzing",
      "type": "Registerbekanntmachung nach dem Umwandlungsgesetz",
      "state": "Bayern",
      "amtsgericht": "Amtsgericht München",
      "registernummer": "HRB 165062",
      "registerart": "HRB",
      "company_name": "ct shop GmbH",
      "company_seat": "Tutzing",
      "details": "28.02.2025 (Bekanntmachungsdatum)\n\nBayern Amtsgericht München HRB 165062\nRegisterbekanntmachung nach dem Umwandlungsgesetz 27.02.2025 (Eintragungsdatum)\n\nct shop GmbH\nGesellschaft mit beschränkter Haftung\nTutzing\n\nDen Gläubigern der an der Verschmelzung beteiligten Rechtsträger ist, wenn sie binnen sechs Monaten nach dem Tag, an dem die Eintragung der Verschmelzung in das Register des Sitzes desjenigen Rechtsträgers, dessen Gläubiger sie sind, nach § 19 Abs. 3 UmwG als bekannt gemacht gilt, ihren Anspruch nach Grund und Höhe in Textform anmelden, Sicherheit zu leisten, soweit sie nicht Befriedigung verlangen können. Dieses Recht steht den Gläubigern jedoch nur zu, wenn sie glaubhaft machen, dass durch die Verschmelzung die Erfüllung ihrer Forderung gefährdet wird."
    },
    {
      "date": "2025-02-28",
      "id": "102531",
      "original_text": "Löschungsankündigung\nBayern Amtsgericht Kempten (Allgäu) HRB 14241\nReikartz GmbH – Pfronten",
      "type": "Löschungsankündigung",
      "state": "Bayern",
      "amtsgericht": "Amtsgericht Kempten (Allgäu)",
      "registernummer": "HRB 14241",
      "registerart": "HRB",
      "company_name": "Reikartz GmbH",
      "company_seat": "Pfronten",
      "details": "28.02.2025 (Bekanntmachungsdatum)\n\nBayern Amtsgericht Kempten (Allgäu) HRB 14241\nLöschungsankündigung\n\nReikartz GmbH\nGesellschaft mit beschränkter Haftung\nPfronten\n\nDas Registergericht beabsichtigt, die im Handelsregister eingetragene Gesellschaft wegen Vermögenslosigkeit von Amts wegen nach § 394 FamFG zu löschen. Die Frist zur Erhebung eines Widerspruchs ist auf einen Monat festgesetzt."
    },
    {
      "date": "2025-02-28",
      "id": "102532",
      "original_text": "Löschungsankündigung\nBayern Amtsgericht Passau HRB 3811\nPaul-Plast GmbH – Hauzenberg",
      "type": "Löschungsankündigung",
      "state": "Bayern",
      "amtsgericht": "Amtsgericht Passau",
      "registernummer": "HRB 3811",
      "registerart": "HRB",
      "company_name": "Paul-Plast GmbH",
      "company_seat": "Hauzenberg",
      "details": "28.02.2025 (Bekanntmachungsdatum)\n\nBayern Amtsgericht Passau HRB 3811\nLöschungsankündigung\n\nPaul-Plast GmbH\nGesellschaft mit beschränkter Haftung\nHauzenberg\n\nDas Registergericht beabsichtigt, die im Handelsregister eingetragene Gesellschaft wegen Vermögenslosigkeit von Amts wegen nach § 394 FamFG zu löschen. Die Frist zur Erhebung eines Widerspruchs ist auf einen Monat festgesetzt."
    },
    {
      "date": "2025-02-28",
      "id": "102533",
      "original_text": "Einreichung neuer Dokumente\nBayern Amtsgericht München HRB 42283\nKPMG Bayerische Treuhandgesellschaft Aktiengesellschaft Wirtschaftsprüfungsgesellschaft Steuerberatungsgesellschaft – München",
      "type": "Einreichung neuer Dokumente",
      "state": "Bayern",
      "amtsgericht": "Amtsgericht München",
      "registernummer": "HRB 42283",
      "registerart": "HRB",
      "company_name": "KPMG Bayerische Treuhandgesellschaft Aktiengesellschaft Wirtschaftsprüfungsgesellschaft Steuerberatungsgesellschaft",
      "company_seat": "München",
      "details": "28.02.2025 (Bekanntmachungsdatum)\n\nBayern Amtsgericht München HRB 42283\nEinreichung neuer Dokumente\n\nKPMG Bayerische Treuhandgesellschaft Aktiengesellschaft Wirtschaftsprüfungsgesellschaft Steuerberatungsgesellschaft\nAktiengesellschaft\nMünchen\n\nDem Amtsgericht München -Registergericht- ist eine Liste der Mitglieder des Aufsichtsrats eingereicht worden, § 106 AktG."
    },
    {
      "date": "2025-02-28",
      "id": "102534",
      "original_text": "Löschungsankündigung\nBayern Amtsgericht Nürnberg HRB 16601\nKörber & Riedel Gaststätten GmbH – Nürnberg",
      "type": "Löschungsankündigung",
      "state": "Bayern",
      "amtsgericht": "Amtsgericht Nürnberg",
      "registernummer": "HRB 16601",
      "registerart": "HRB",
      "company_name": "Körber & Riedel Gaststätten GmbH",
      "company_seat": "Nürnberg",
      "details": "28.02.2025 (Bekanntmachungsdatum)\n\nBayern Amtsgericht Nürnberg HRB 16601\nLöschungsankündigung\n\nKörber & Riedel Gaststätten GmbH\nGesellschaft mit beschränkter Haftung\nNürnberg\n\nDas Registergericht beabsichtigt, die im Handelsregister eingetragene Gesellschaft wegen Vermögenslosigkeit von Amts wegen nach § 394 FamFG zu löschen. Die Frist zur Erhebung eines Widerspruchs ist auf einen Monat festgesetzt."
    },
    {
      "date": "2025-02-28",
      "id": "102535",
      "original_text": "Registerbekanntmachung nach dem Umwandlungsgesetz\nBayern Amtsgericht München HRB 246922\ngoetzpartners Holding AG – München",
      "type": "Registerbekanntmachung nach dem Umwandlungsgesetz",
      "state": "Bayern",
      "amtsgericht": "Amtsgericht München",
      "registernummer": "HRB 246922",
      "registerart": "HRB",
      "company_name": "goetzpartners Holding AG",
      "company_seat": "München",
      "details": "28.02.2025 (Bekanntmachungsdatum)\n\nBayern Amtsgericht München HRB 246922\nRegisterbekanntmachung nach dem Umwandlungsgesetz 27.02.2025 (Eintragungsdatum)\n\ngoetzpartners Holding AG\nAktiengesellschaft\nMünchen\n\nDen Gläubigern des formwechselnden Rechtsträgers ist, wenn sie binnen sechs Monaten nach dem Tag, an dem die Eintragung des Formwechsels nach § 201 UmwG als bekannt gemacht gilt, ihren Anspruch nach Grund und Höhe in Textform anmelden, Sicherheit zu leisten, soweit sie nicht Befriedigung verlangen können. Dieses Recht steht den Gläubigern jedoch nur zu, wenn sie glaubhaft machen, dass durch den Formwechsel die Erfüllung ihrer Forderung gefährdet wird."
    },
    {
      "date": "2025-02-28",
      "id": "102536",
      "original_text": "Registerbekanntmachung nach dem Umwandlungsgesetz\nBayern Amtsgericht Aschaffenburg HRB 11981\nIWO Unternehmensberatungs GmbH – Leidersbach",
      "type": "Registerbekanntmachung nach dem Umwandlungsgesetz",
      "state": "Bayern",
      "amtsgericht": "Amtsgericht Aschaffenburg",
      "registernummer": "HRB 11981",
      "registerart": "HRB",
      "company_name": "IWO Unternehmensberatungs GmbH",
      "company_seat": "Leidersbach",
      "details": "28.02.2025 (Bekanntmachungsdatum)\n\nBayern Amtsgericht Aschaffenburg HRB 11981\nRegisterbekanntmachung nach dem Umwandlungsgesetz 27.02.2025 (Eintragungsdatum)\n\nIWO Unternehmensberatungs GmbH\nGesellschaft mit beschränkter Haftung\nLeidersbach\n\nDen Gläubigern der an der Verschmelzung beteiligten Rechtsträger ist, wenn sie binnen sechs Monaten nach dem Tag, an dem die Eintragung der Verschmelzung in das Register des Sitzes desjenigen Rechtsträgers, dessen Gläubiger sie sind, nach § 19 Abs. 3 UmwG als bekannt gemacht gilt, ihren Anspruch nach Grund und Höhe in Textform anmelden, Sicherheit zu leisten, soweit sie nicht Befriedigung verlangen können. Dieses Recht steht den Gläubigern jedoch nur zu, wenn sie glaubhaft machen, dass durch die Verschmelzung die Erfüllung ihrer Forderung gefährdet wird."
    },
    {
      "date": "2025-02-28",
      "id": "102537",
      "original_text": "Registerbekanntmachung nach dem Umwandlungsgesetz\nBayern Amtsgericht Ingolstadt HRB 9198\nVST Immobilien GmbH – Neuburg a. d. Donau",
      "type": "Registerbekanntmachung nach dem Umwandlungsgesetz",
      "state": "Bayern",
      "amtsgericht": "Amtsgericht Ingolstadt",
      "registernummer": "HRB 9198",
      "registerart": "HRB",
      "company_name": "VST Immobilien GmbH",
      "company_seat": "Neuburg a. d. Donau",
      "details": "28.02.2025 (Bekanntmachungsdatum)\n\nBayern Amtsgericht Ingolstadt HRB 9198\nRegisterbekanntmachung nach dem Umwandlungsgesetz 27.02.2025 (Eintragungsdatum)\n\nVST Immobilien GmbH\nGesellschaft mit beschränkter Haftung\nNeuburg a. d. Donau\n\nDen Gläubigern der an der Verschmelzung beteiligten Rechtsträger ist, wenn sie binnen sechs Monaten nach dem Tag, an dem die Eintragung der Verschmelzung in das Register des Sitzes desjenigen Rechtsträgers, dessen Gläubiger sie sind, nach § 19 Abs. 3 UmwG als bekannt gemacht gilt, ihren Anspruch nach Grund und Höhe in Textform anmelden, Sicherheit zu leisten, soweit sie nicht Befriedigung verlangen können. Dieses Recht steht den Gläubigern jedoch nur zu, wenn sie glaubhaft machen, dass durch die Verschmelzung die Erfüllung ihrer Forderung gefährdet wird."
    },
    {
      "date": "2025-02-28",
      "id": "102538",
      "original_text": "Registerbekanntmachung nach dem Umwandlungsgesetz\nBayern Amtsgericht Ingolstadt HRB 6228\nInterpark Immobilien GmbH – Neuburg a. d. Donau",
      "type": "Registerbekanntmachung nach dem Umwandlungsgesetz",
      "state": "Bayern",
      "amtsgericht": "Amtsgericht Ingolstadt",
      "registernummer": "HRB 6228",
      "registerart": "HRB",
      "company_name": "Interpark Immobilien GmbH",
      "company_seat": "Neuburg a. d. Donau",
      "details": "28.02.2025 (Bekanntmachungsdatum)\n\nBayern Amtsgericht Ingolstadt HRB 6228\nRegisterbekanntmachung nach dem Umwandlungsgesetz 27.02.2025 (Eintragungsdatum)\n\nInterpark Immobilien GmbH\nGesellschaft mit beschränkter Haftung\nNeuburg a. d. Donau\n\nDen Gläubigern der an der Verschmelzung beteiligten Rechtsträger ist, wenn sie binnen sechs Monaten nach dem Tag, an dem die Eintragung der Verschmelzung in das Register des Sitzes desjenigen Rechtsträgers, dessen Gläubiger sie sind, nach § 19 Abs. 3 UmwG als bekannt gemacht gilt, ihren Anspruch nach Grund und Höhe in Textform anmelden, Sicherheit zu leisten, soweit sie nicht Befriedigung verlangen können. Dieses Recht steht den Gläubigern jedoch nur zu, wenn sie glaubhaft machen, dass durch die Verschmelzung die Erfüllung ihrer Forderung gefährdet wird."
    },
    {
      "date": "2025-02-28",
      "id": "102539",
      "original_text": "Löschungsankündigung\nBayern Amtsgericht Ingolstadt HRB 11638\nNEO-METRIC GmbH – Ingolstadt",
      "type": "Löschungsankündigung",
      "state": "Bayern",
      "amtsgericht": "Amtsgericht Ingolstadt",
      "registernummer": "HRB 11638",
      "registerart": "HRB",
      "company_name": "NEO-METRIC GmbH",
      "company_seat": "Ingolstadt",
      "details": "28.02.2025 (Bekanntmachungsdatum)\n\nBayern Amtsgericht Ingolstadt HRB 11638\nLöschungsankündigung\n\nNEO-METRIC GmbH\nGesellschaft mit beschränkter Haftung\nIngolstadt\n\nDas Registergericht beabsichtigt, die im Handelsregister eingetragene Gesellschaft wegen Vermögenslosigkeit von Amts wegen nach § 394 FamFG zu löschen. Die Frist zur Erhebung eines Widerspruchs ist auf einen Monat festgesetzt."
    },
    {
      "date": "2025-02-28",
      "id": "102540",
      "original_text": "Registerbekanntmachung nach dem Umwandlungsgesetz\nBayern Amtsgericht München HRB 225675\nMinoa GmbH – Tutzing",
      "type": "Registerbekanntmachung nach dem Umwandlungsgesetz",
      "state": "Bayern",
      "amtsgericht": "Amtsgericht München",
      "registernummer": "HRB 225675",
      "registerart": "HRB",
      "company_name": "Minoa GmbH",
      "company_seat": "Tutzing",
      "details": "28.02.2025 (Bekanntmachungsdatum)\n\nBayern Amtsgericht München HRB 225675\nRegisterbekanntmachung nach dem Umwandlungsgesetz 27.02.2025 (Eintragungsdatum)\n\nMinoa GmbH\nGesellschaft mit beschränkter Haftung\nTutzing\n\nDen Gläubigern der an der Verschmelzung beteiligten Rechtsträger ist, wenn sie binnen sechs Monaten nach dem Tag, an dem die Eintragung der Verschmelzung in das Register des Sitzes desjenigen Rechtsträgers, dessen Gläubiger sie sind, nach § 19 Abs. 3 UmwG als bekannt gemacht gilt, ihren Anspruch nach Grund und Höhe in Textform anmelden, Sicherheit zu leisten, soweit sie nicht Befriedigung verlangen können. Dieses Recht steht den Gläubigern jedoch nur zu, wenn sie glaubhaft machen, dass durch die Verschmelzung die Erfüllung ihrer Forderung gefährdet wird."
    },
    {
      "date": "2025-02-28",
      "id": "102541",
      "original_text": "Sonstige Registerbekanntmachung\nBerlin Amtsgericht Berlin (Charlottenburg) HRB 70378\nStrategis Aktiengesellschaft – Berlin",
      "type": "Sonstige Registerbekanntmachung",
      "state": "Berlin",
      "amtsgericht": "Amtsgericht Berlin (Charlottenburg)",
      "registernummer": "HRB 70378",
      "registerart": "HRB",
      "company_name": "Strategis Aktiengesellschaft",
      "company_seat": "Berlin",
      "details": "28.02.2025 (Bekanntmachungsdatum)\n\nBerlin Amtsgericht Berlin (Charlottenburg) HRB 70378\nSonstige Registerbekanntmachung\n\nStrategis Aktiengesellschaft\nAktiengesellschaft\nBerlin\n\nAls nicht eingetragen wird veröffentlicht:Es wurde eine neue Liste der Aufsichtsratsmitglieder eingereicht (§ 106 AktG)."
    },
    {
      "date": "2025-02-28",
      "id": "102542",
      "original_text": "Löschungsankündigung\nBaden-Württemberg Amtsgericht Ulm HRB 650464\nScheyka Verwaltungs-GmbH – Altheim",
      "type": "Löschungsankündigung",
      "state": "Baden-Württemberg",
      "amtsgericht": "Amtsgericht Ulm",
      "registernummer": "HRB 650464",
      "registerart": "HRB",
      "company_name": "Scheyka Verwaltungs-GmbH",
      "company_seat": "Altheim",
      "details": "28.02.2025 (Bekanntmachungsdatum)\n\nBaden-Württemberg Amtsgericht Ulm HRB 650464\nLöschungsankündigung\n\nScheyka Verwaltungs-GmbH\nGesellschaft mit beschränkter Haftung\nAltheim\n\nAls nicht eingetragen wird bekanntgemacht:\nDas Gericht beabsichtigt, die Gesellschaft wegen Vermögenslosigkeit im Handelsregister von Amts wegen nach § 394 FamFG zu löschen. Die Frist zur Geltendmachung eines Widerspruchs gegen die beabsichtigte Löschung ist auf  einen Monat ab Veröffentlichung bestimmt."
    },
    {
      "date": "2025-02-28",
      "id": "102543",
      "original_text": "Löschungsankündigung\nBrandenburg Amtsgericht Cottbus HRB 1617\nWasser-, Tief- und Kanalbau GmbH Lübben – Lübben (Spreewald)",
      "type": "Löschungsankündigung",
      "state": "Brandenburg",
      "amtsgericht": "Amtsgericht Cottbus",
      "registernummer": "HRB 1617",
      "registerart": "HRB",
      "company_name": "Wasser-, Tief- und Kanalbau GmbH Lübben",
      "company_seat": "Lübben (Spreewald)",
      "details": "28.02.2025 (Bekanntmachungsdatum)\n\nBrandenburg Amtsgericht Cottbus HRB 1617\nLöschungsankündigung\n\nWasser-, Tief- und Kanalbau GmbH Lübben\nGesellschaft mit beschränkter Haftung\nLübben (Spreewald)\n\nEs ist beabsichtigt, die Gesellschaft wegen Vermögenslosigkeit von Amts wegen gemäß § 394 FamFG zu löschen. Wer an der Unterlassung der beabsichtigten Löschung ein berechtigtes Interesse hat, kann gegen die Löschung innerhalb von 1 Monat ab Veröffentlichung dieser Löschungsankündigung unter Angabe von Gründen Widerspruch beim Amtsgericht Cottbus, Gerichtsplatz 2, 03046 Cottbus, zu  HRB 1617 CB erheben."
    },
    {
      "date": "2025-02-28",
      "id": "102544",
      "original_text": "Löschungsankündigung\nBaden-Württemberg Amtsgericht Mannheim HRB 709437\nID Handels GmbH – Sinsheim",
      "type": "Löschungsankündigung",
      "state": "Baden-Württemberg",
      "amtsgericht": "Amtsgericht Mannheim",
      "registernummer": "HRB 709437",
      "registerart": "HRB",
      "company_name": "ID Handels GmbH",
      "company_seat": "Sinsheim",
      "details": "28.02.2025 (Bekanntmachungsdatum)\n\nBaden-Württemberg Amtsgericht Mannheim HRB 709437\nLöschungsankündigung\n\nID Handels GmbH\nGesellschaft mit beschränkter Haftung\nSinsheim\n\nDas Gericht beabsichtigt, die Gesellschaft wegen Vermögenslosigkeit im Handelsregister von Amts wegen nach § 394 FamFG zu löschen. Die Frist zur Geltendmachung eines Widerspruchs gegen die beabsichtigte Löschung ist auf einen Monat ab Veröffentlichung bestimmt."
    },
    {
      "date": "2025-02-28",
      "id": "102545",
      "original_text": "Löschungsankündigung\nBerlin Amtsgericht Berlin (Charlottenburg) HRB 166558\nJoppSports3 UG (haftungsbeschränkt) – Berlin",
      "type": "Löschungsankündigung",
      "state": "Berlin",
      "amtsgericht": "Amtsgericht Berlin (Charlottenburg)",
      "registernummer": "HRB 166558",
      "registerart": "HRB",
      "company_name": "JoppSports3 UG (haftungsbeschränkt)",
      "company_seat": "Berlin",
      "details": "28.02.2025 (Bekanntmachungsdatum)\n\nBerlin Amtsgericht Berlin (Charlottenburg) HRB 166558\nLöschungsankündigung\n\nJoppSports3 UG (haftungsbeschränkt)\nGesellschaft mit beschränkter Haftung\nBerlin\n\nBei der nachstehenden Gesellschaft wird das Amtslöschungsverfahren gemäß § 394 FamFG eingeleitet. Widerspruchsfrist 6 Wochen"
    },
    {
      "date": "2025-02-28",
      "id": "102546",
      "original_text": "Löschungsankündigung\nBaden-Württemberg Amtsgericht Freiburg HRB 707452\nHONOUR Handels GmbH – Emmendingen",
      "type": "Löschungsankündigung",
      "state": "Baden-Württemberg",
      "amtsgericht": "Amtsgericht Freiburg",
      "registernummer": "HRB 707452",
      "registerart": "HRB",
      "company_name": "HONOUR Handels GmbH",
      "company_seat": "Emmendingen",
      "details": "28.02.2025 (Bekanntmachungsdatum)\n\nBaden-Württemberg Amtsgericht Freiburg HRB 707452\nLöschungsankündigung\n\nHONOUR Handels GmbH\nGesellschaft mit beschränkter Haftung\nEmmendingen\n\nDas Gericht beabsichtigt, die Gesellschaft wegen Vermögenslosigkeit im Handelsregister von Amts wegen nach § 394 FamFG zu löschen. Die Frist zur Geltendmachung eines Widerspruchs gegen die beabsichtigte Löschung ist auf einen Monat ab Veröffentlichung bestimmt."
    },
    {
      "date": "2025-02-28",
      "id": "102547",
      "original_text": "Löschungsankündigung\nBerlin Amtsgericht Berlin (Charlottenburg) HRB 163814\nPSJ Bau GmbH – Berlin",
      "type": "Löschungsankündigung",
      "state": "Berlin",
      "amtsgericht": "Amtsgericht Berlin (Charlottenburg)",
      "registernummer": "HRB 163814",
      "registerart": "HRB",
      "company_name": "PSJ Bau GmbH",
      "company_seat": "Berlin",
      "details": "28.02.2025 (Bekanntmachungsdatum)\n\nBerlin Amtsgericht Berlin (Charlottenburg) HRB 163814\nLöschungsankündigung\n\nPSJ Bau GmbH\nGesellschaft mit beschränkter Haftung\nBerlin\n\nBei der nachstehenden Gesellschaft wird das Amtslöschungsverfahren gemäß § 394 FamFG eingeleitet. Widerspruchsfrist 6 Wochen"
    },
    {
      "date": "2025-02-28",
      "id": "102548",
      "original_text": "Löschungsankündigung\nBerlin Amtsgericht Berlin (Charlottenburg) HRB 235575\nBizim Bau Berlin GmbH – Berlin",
      "type": "Löschungsankündigung",
      "state": "Berlin",
      "amtsgericht": "Amtsgericht Berlin (Charlottenburg)",
      "registernummer": "HRB 235575",
      "registerart": "HRB",
      "company_name": "Bizim Bau Berlin GmbH",
      "company_seat": "Berlin",
      "details": "28.02.2025 (Bekanntmachungsdatum)\n\nBerlin Amtsgericht Berlin (Charlottenburg) HRB 235575\nLöschungsankündigung\n\nBizim Bau Berlin  GmbH\nGesellschaft mit beschränkter Haftung\nBerlin\n\nBei der nachstehenden Gesellschaft wird das Amtslöschungsverfahren gemäß § 394 FamFG eingeleitet. Widerspruchsfrist 6 Wochen"
    },
    {
      "date": "2025-02-28",
      "id": "102549",
      "original_text": "Löschungsankündigung\nBerlin Amtsgericht Berlin (Charlottenburg) HRB 186752\nHDC Haus des Champagners GmbH – Berlin",
      "type": "Löschungsankündigung",
      "state": "Berlin",
      "amtsgericht": "Amtsgericht Berlin (Charlottenburg)",
      "registernummer": "HRB 186752",
      "registerart": "HRB",
      "company_name": "HDC Haus des Champagners GmbH",
      "company_seat": "Berlin",
      "details": "28.02.2025 (Bekanntmachungsdatum)\n\nBerlin Amtsgericht Berlin (Charlottenburg) HRB 186752\nLöschungsankündigung\n\nHDC Haus des Champagners GmbH\nGesellschaft mit beschränkter Haftung\nBerlin\n\nBei der nachstehenden Gesellschaft wird das Amtslöschungsverfahren gemäß § 394 FamFG eingeleitet. Widerspruchsfrist 6 Wochen"
    },
    {
      "date": "2025-02-28",
      "id": "102550",
      "original_text": "Löschungsankündigung\nBerlin Amtsgericht Berlin (Charlottenburg) HRB 146381\nIPB Invest Project Berlin GmbH – Berlin",
      "type": "Löschungsankündigung",
      "state": "Berlin",
      "amtsgericht": "Amtsgericht Berlin (Charlottenburg)",
      "registernummer": "HRB 146381",
      "registerart": "HRB",
      "company_name": "IPB Invest Project Berlin GmbH",
      "company_seat": "Berlin",
      "details": "28.02.2025 (Bekanntmachungsdatum)\n\nBerlin Amtsgericht Berlin (Charlottenburg) HRB 146381\nLöschungsankündigung\n\nIPB Invest Project Berlin GmbH\nGesellschaft mit beschränkter Haftung\nBerlin\n\nBei der nachstehenden Gesellschaft wird das Amtslöschungsverfahren gemäß § 394 FamFG eingeleitet. Widerspruchsfrist 6 Wochen"
    },
    {
      "date": "2025-02-28",
      "id": "102551",
      "original_text": "Löschungsankündigung\nBerlin Amtsgericht Berlin (Charlottenburg) HRB 134378\nPushkin Holding UG (haftungsbeschränkt) – Berlin",
      "type": "Löschungsankündigung",
      "state": "Berlin",
      "amtsgericht": "Amtsgericht Berlin (Charlottenburg)",
      "registernummer": "HRB 134378",
      "registerart": "HRB",
      "company_name": "Pushkin Holding UG (haftungsbeschränkt)",
      "company_seat": "Berlin",
      "details": "28.02.2025 (Bekanntmachungsdatum)\n\nBerlin Amtsgericht Berlin (Charlottenburg) HRB 134378\nLöschungsankündigung\n\nPushkin Holding UG (haftungsbeschränkt)\nGesellschaft mit beschränkter Haftung\nBerlin\n\nBei der nachstehenden Gesellschaft wird das Amtslöschungsverfahren gemäß § 394 FamFG eingeleitet. Widerspruchsfrist 6 Wochen"
    },
    {
      "date": "2025-02-28",
      "id": "102552",
      "original_text": "Registerbekanntmachung nach dem Umwandlungsgesetz\nSchleswig-Holstein Amtsgericht Kiel HRB 27859\nCarlshöhe Bauträger GmbH – Damp",
      "type": "Registerbekanntmachung nach dem Umwandlungsgesetz",
      "state": "Schleswig-Holstein",
      "amtsgericht": "Amtsgericht Kiel",
      "registernummer": "HRB 27859",
      "registerart": "HRB",
      "company_name": "Carlshöhe Bauträger GmbH",
      "company_seat": "Damp",
      "details": "28.02.2025 (Bekanntmachungsdatum)\n\nSchleswig-Holstein Amtsgericht Kiel HRB 27859\nRegisterbekanntmachung nach dem Umwandlungsgesetz 27.02.2025 (Eintragungsdatum)\n\nCarlshöhe Bauträger GmbH\nGesellschaft mit beschränkter Haftung\nDamp\n\nZu Eintragungsnummer 1 vom 27.02.2025 wird als nicht eingetragen veröffentlicht: Den Gläubigern ist, wenn sie binnen sechs Monaten nach dem Tag, an dem die Eintragung der Umwandlung bekannt gemacht worden ist, ihren Anspruch nach Grund und Höhe schriftlich anmelden, Sicherheit zu leisten, soweit sie nicht Befriedigung verlangen können. Dieses Recht steht den Gläubigern jedoch nur zu, wenn sie glaubhaft machen, dass durch die Umwandlung die Erfüllung ihrer Forderung gefährdet wird."
    },
    {
      "date": "2025-02-28",
      "id": "102553",
      "original_text": "Registerbekanntmachung nach dem Umwandlungsgesetz\nBaden-Württemberg Amtsgericht Ulm HRB 722668\nGünther + Schramm GmbH – Oberkochen",
      "type": "Registerbekanntmachung nach dem Umwandlungsgesetz",
      "state": "Baden-Württemberg",
      "amtsgericht": "Amtsgericht Ulm",
      "registernummer": "HRB 722668",
      "registerart": "HRB",
      "company_name": "Günther + Schramm GmbH",
      "company_seat": "Oberkochen",
      "details": "28.02.2025 (Bekanntmachungsdatum)\n\nBaden-Württemberg Amtsgericht Ulm HRB 722668\nRegisterbekanntmachung nach dem Umwandlungsgesetz 28.02.2025 (Eintragungsdatum)\n\nGünther + Schramm GmbH\nGesellschaft mit beschränkter Haftung\nOberkochen\n\nAls nicht eingetragen wird bekanntgemacht:\nDen Gläubigern der an der Verschmelzung beteiligten Rechtsträger ist, wenn sie binnen sechs Monaten nach dem Tag, an dem die Eintragung der Verschmelzung in das Register des Sitzes desjenigen Rechtsträgers, dessen Gläubiger sie sind, nach § 19 Abs. 3 UmwG als bekanntgemacht gilt, ihren Anspruch nach Grund und Höhe schriftlich anmelden, Sicherheit zu leisten, soweit sie nicht Befriedigung verlangen können. Dieses Recht steht den Gläubigern jedoch nur zu, wenn sie glaubhaft machen, dass durch die Verschmelzung die Erfüllung ihrer Forderung gefährdet wird."
    },
    {
      "date": "2025-02-28",
      "id": "102554",
      "original_text": "Löschungsankündigung\nBerlin Amtsgericht Berlin (Charlottenburg) HRB 52796\nP & WB Wirtschaftsberatung GmbH – Berlin",
      "type": "Löschungsankündigung",
      "state": "Berlin",
      "amtsgericht": "Amtsgericht Berlin (Charlottenburg)",
      "registernummer": "HRB 52796",
      "registerart": "HRB",
      "company_name": "P & WB Wirtschaftsberatung GmbH",
      "company_seat": "Berlin",
      "details": "28.02.2025 (Bekanntmachungsdatum)\n\nBerlin Amtsgericht Berlin (Charlottenburg) HRB 52796\nLöschungsankündigung\n\nP & WB Wirtschaftsberatung GmbH\nGesellschaft mit beschränkter Haftung\nBerlin\n\nBei der nachstehenden Gesellschaft wird das Amtslöschungsverfahren gemäß § 394 FamFG eingeleitet. Widerspruchsfrist 6 Wochen"
    },
    {
      "date": "2025-02-28",
      "id": "102555",
      "original_text": "Löschungsankündigung\nBerlin Amtsgericht Berlin (Charlottenburg) HRB 245438\nDobridub Bau UG (haftungsbeschränkt) – Berlin",
      "type": "Löschungsankündigung",
      "state": "Berlin",
      "amtsgericht": "Amtsgericht Berlin (Charlottenburg)",
      "registernummer": "HRB 245438",
      "registerart": "HRB",
      "company_name": "Dobridub Bau UG (haftungsbeschränkt)",
      "company_seat": "Berlin",
      "details": "28.02.2025 (Bekanntmachungsdatum)\n\nBerlin Amtsgericht Berlin (Charlottenburg) HRB 245438\nLöschungsankündigung\n\nDobridub Bau UG (haftungsbeschränkt)\nGesellschaft mit beschränkter Haftung\nBerlin\n\nBei der nachstehenden Gesellschaft wird das Amtslöschungsverfahren gemäß § 394 FamFG eingeleitet. Widerspruchsfrist 6 Wochen"
    },
    {
      "date": "2025-02-28",
      "id": "102556",
      "original_text": "Registerbekanntmachung nach dem Umwandlungsgesetz\nBaden-Württemberg Amtsgericht Stuttgart HRB 263370\nAlfred Kärcher Vertriebs-GmbH – Winnenden",
      "type": "Registerbekanntmachung nach dem Umwandlungsgesetz",
      "state": "Baden-Württemberg",
      "amtsgericht": "Amtsgericht Stuttgart",
      "registernummer": "HRB 263370",
      "registerart": "HRB",
      "company_name": "Alfred Kärcher Vertriebs-GmbH",
      "company_seat": "Winnenden",
      "details": "28.02.2025 (Bekanntmachungsdatum)\n\nBaden-Württemberg Amtsgericht Stuttgart HRB 263370\nRegisterbekanntmachung nach dem Umwandlungsgesetz 28.02.2025 (Eintragungsdatum)\n\nAlfred Kärcher Vertriebs-GmbH\nGesellschaft mit beschränkter Haftung\nWinnenden\n\nDen Gläubigern der an der Verschmelzung beteiligten Rechtsträger ist, wenn sie binnen sechs Monaten nach dem Tag, an dem die Eintragung der Verschmelzung in das Register des Sitzes desjenigen Rechtsträgers, dessen Gläubiger sie sind, nach § 19 Abs. 3 UmwG als bekanntgemacht gilt, ihren Anspruch nach Grund und Höhe schriftlich anmelden, Sicherheit zu leisten, soweit sie nicht Befriedigung verlangen können. Dieses Recht steht den Gläubigern jedoch nur zu, wenn sie glaubhaft machen, dass durch die Verschmelzung die Erfüllung ihrer Forderung gefährdet wird."
    },
    {
      "date": "2025-02-28",
      "id": "102557",
      "original_text": "Einreichung neuer Dokumente\nBaden-Württemberg Amtsgericht Stuttgart HRB 766194\nsmartplan AG – Bretzfeld",
      "type": "Einreichung neuer Dokumente",
      "state": "Baden-Württemberg",
      "amtsgericht": "Amtsgericht Stuttgart",
      "registernummer": "HRB 766194",
      "registerart": "HRB",
      "company_name": "smartplan AG",
      "company_seat": "Bretzfeld",
      "details": "28.02.2025 (Bekanntmachungsdatum)\n\nBaden-Württemberg Amtsgericht Stuttgart HRB 766194\nEinreichung neuer Dokumente 28.02.2025 (Eintragungsdatum)\n\nsmartplan AG\nAktiengesellschaft\nBretzfeld\n\nDie Gesellschaft hat am 26.02.2025 die Liste über die Zusammensetzung des Aufsichtsrats zum Handelsregister eingereicht."
    },
    {
      "date": "2025-02-28",
      "id": "102558",
      "original_text": "Registerbekanntmachung nach dem Umwandlungsgesetz\nBerlin Amtsgericht Berlin (Charlottenburg) HRB 150891\nHAGRO Maschinen Vertriebs GmbH – Berlin",
      "type": "Registerbekanntmachung nach dem Umwandlungsgesetz",
      "state": "Berlin",
      "amtsgericht": "Amtsgericht Berlin (Charlottenburg)",
      "registernummer": "HRB 150891",
      "registerart": "HRB",
      "company_name": "HAGRO Maschinen Vertriebs GmbH",
      "company_seat": "Berlin",
      "details": "28.02.2025 (Bekanntmachungsdatum)\n\nBerlin Amtsgericht Berlin (Charlottenburg) HRB 150891\nRegisterbekanntmachung nach dem Umwandlungsgesetz 27.02.2025 (Eintragungsdatum)\n\nHAGRO Maschinen Vertriebs GmbH\nGesellschaft mit beschränkter Haftung\nBerlin\n\nZu Eintragungsnummer 4 vom 27.02.2025 wird als nicht eingetragen veröffentlicht:\nDen Gläubigern der an der Verschmelzung beteiligten Rechtsträger ist, wenn sie binnen sechs Monaten nach dem Tag, an dem die Eintragung der Verschmelzung in das Register des Sitzes desjenigen Rechtsträgers, dessen Gläubiger sie sind, als bekannt gemacht gilt, ihren Anspruch nach Grund und Höhe schriftlich anmelden, Sicherheit zu leisten, soweit sie nicht Befriedigung verlangen können. Dieses Recht steht den Gläubigern jedoch nur zu, wenn sie glaubhaft machen, dass durch die Verschmelzung die Erfüllung ihrer Forderung gefährdet wird. Das Recht, Sicherheitsleistung zu verlangen, steht Gläubigern nicht zu, die im Falle der Insolvenz ein Recht auf vorzugsweise Befriedigung aus einer Deckungsmasse haben, die nach gesetzlicher Vorschrift zu ihrem Schutz errichtet und staatlich überwacht ist."
    },
    {
      "date": "2025-02-28",
      "id": "102559",
      "original_text": "Registerbekanntmachung nach dem Umwandlungsgesetz\nBerlin Amtsgericht Berlin (Charlottenburg) HRB 263419\nGfB - Gesellschaft für Baumanagement GmbH – Berlin",
      "type": "Registerbekanntmachung nach dem Umwandlungsgesetz",
      "state": "Berlin",
      "amtsgericht": "Amtsgericht Berlin (Charlottenburg)",
      "registernummer": "HRB 263419",
      "registerart": "HRB",
      "company_name": "GfB - Gesellschaft für Baumanagement GmbH",
      "company_seat": "Berlin",
      "details": "28.02.2025 (Bekanntmachungsdatum)\n\nBerlin Amtsgericht Berlin (Charlottenburg) HRB 263419\nRegisterbekanntmachung nach dem Umwandlungsgesetz 27.02.2025 (Eintragungsdatum)\n\nGfB - Gesellschaft für Baumanagement GmbH\nGesellschaft mit beschränkter Haftung\nBerlin\n\nZu Eintragungsnummer 3 vom 27.02.2025 wird als nicht eingetragen veröffentlicht:Den Gläubigern der an der Verschmelzung beteiligten Rechtsträger ist, wenn sie binnen sechs Monaten nach dem Tag, an dem die Eintragung der Verschmelzung in das Register des Sitzes desjenigen Rechtsträgers, dessen Gläubiger sie sind, als bekannt gemacht gilt, ihren Anspruch nach Grund und Höhe schriftlich anmelden, Sicherheit zu leisten, soweit sie nicht Befriedigung verlangen können. Dieses Recht steht den Gläubigern jedoch nur zu, wenn sie glaubhaft machen, dass durch die Verschmelzung die Erfüllung ihrer Forderung gefährdet wird. Das Recht, Sicherheitsleistung zu verlangen, steht Gläubigern nicht zu, die im Falle der Insolvenz ein Recht auf vorzugsweise Befriedigung aus einer Deckungsmasse haben, die nach gesetzlicher Vorschrift zu ihrem Schutz errichtet und staatlich überwacht ist."
    },
    {
      "date": "2025-02-28",
      "id": "102560",
      "original_text": "Registerbekanntmachung nach dem Umwandlungsgesetz\nBerlin Amtsgericht Berlin (Charlottenburg) HRB 239980\nGLB Rappenweg München GmbH – Berlin",
      "type": "Registerbekanntmachung nach dem Umwandlungsgesetz",
      "state": "Berlin",
      "amtsgericht": "Amtsgericht Berlin (Charlottenburg)",
      "registernummer": "HRB 239980",
      "registerart": "HRB",
      "company_name": "GLB Rappenweg München GmbH",
      "company_seat": "Berlin",
      "details": "28.02.2025 (Bekanntmachungsdatum)\n\nBerlin Amtsgericht Berlin (Charlottenburg) HRB 239980\nRegisterbekanntmachung nach dem Umwandlungsgesetz 27.02.2025 (Eintragungsdatum)\n\nGLB Rappenweg München GmbH\nGesellschaft mit beschränkter Haftung\nBerlin\n\nZu Eintragungsnummer 7 vom 27.02.2025 wird als nicht eingetragen veröffentlicht: Den Gläubigern ist, wenn sie binnen sechs Monaten nach dem Tag, an dem die Eintragung der Umwandlung als bekannt gemacht gilt, ihren Anspruch nach Grund und Höhe schriftlich anmelden, Sicherheit zu leisten, soweit sie nicht Befriedigung verlangen können. Dieses Recht steht den Gläubigern jedoch nur zu, wenn sie glaubhaft machen, dass durch die Umwandlung die Erfüllung ihrer Forderung gefährdet wird. Das Recht, Sicherheitsleistung zu verlangen, steht Gläubigern nicht zu, die im Falle der Insolvenz ein Recht auf vorzugsweise Befriedigung aus einer Deckungsmasse haben, die nach gesetzlicher Vorschrift zu ihrem Schutz errichtet und staatlich überwacht ist."
    },
    {
      "date": "2025-02-28",
      "id": "102561",
      "original_text": "Löschungsankündigung\nBerlin Amtsgericht Berlin (Charlottenburg) HRB 242403\nOgli Bau GmbH – Berlin",
      "type": "Löschungsankündigung",
      "state": "Berlin",
      "amtsgericht": "Amtsgericht Berlin (Charlottenburg)",
      "registernummer": "HRB 242403",
      "registerart": "HRB",
      "company_name": "Ogli Bau GmbH",
      "company_seat": "Berlin",
      "details": "28.02.2025 (Bekanntmachungsdatum)\n\nBerlin Amtsgericht Berlin (Charlottenburg) HRB 242403\nLöschungsankündigung\n\nOgli Bau GmbH\nGesellschaft mit beschränkter Haftung\nBerlin\n\nBei der nachstehenden Gesellschaft wird das Amtslöschungsverfahren gemäß § 394 FamFG eingeleitet. Widerspruchsfrist 6 Wochen"
    },
    {
      "date": "2025-02-28",
      "id": "102562",
      "original_text": "Löschungsankündigung\nBerlin Amtsgericht Berlin (Charlottenburg) HRB 52416\nBauleitungen Fandrich GmbH – Berlin",
      "type": "Löschungsankündigung",
      "state": "Berlin",
      "amtsgericht": "Amtsgericht Berlin (Charlottenburg)",
      "registernummer": "HRB 52416",
      "registerart": "HRB",
      "company_name": "Bauleitungen Fandrich GmbH",
      "company_seat": "Berlin",
      "details": "28.02.2025 (Bekanntmachungsdatum)\n\nBerlin Amtsgericht Berlin (Charlottenburg) HRB 52416\nLöschungsankündigung\n\nBauleitungen Fandrich GmbH\nGesellschaft mit beschränkter Haftung\nBerlin\n\nBei der nachstehenden Gesellschaft wird das Amtslöschungsverfahren gemäß § 394 FamFG eingeleitet. Widerspruchsfrist 6 Wochen"
    },
    {
      "date": "2025-02-28",
      "id": "102563",
      "original_text": "Registerbekanntmachung nach dem Umwandlungsgesetz\nBaden-Württemberg Amtsgericht Mannheim PR 700048\nEndlich Brauch Hess Rechtsanwälte Steuerberater Partnerschaftsgesellschaft – Mosbach",
      "type": "Registerbekanntmachung nach dem Umwandlungsgesetz",
      "state": "Baden-Württemberg",
      "amtsgericht": "Amtsgericht Mannheim",
      "registernummer": "PR 700048",
      "registerart": "PR",
      "company_name": "Endlich Brauch Hess Rechtsanwälte Steuerberater Partnerschaftsgesellschaft",
      "company_seat": "Mosbach",
      "details": "28.02.2025 (Bekanntmachungsdatum)\n\nBaden-Württemberg Amtsgericht Mannheim PR 700048\nRegisterbekanntmachung nach dem Umwandlungsgesetz 28.02.2025 (Eintragungsdatum)\n\nEndlich Brauch Hess Rechtsanwälte Steuerberater Partnerschaftsgesellschaft\nPartnerschaftsgesellschaft\nMosbach\n\nDen Gläubigern der an der Verschmelzung beteiligten Rechtsträger ist, wenn sie binnen sechs Monaten nach dem Tag, an dem die Eintragung der Verschmelzung in das Register des Sitzes desjenigen Rechtsträgers, dessen Gläubiger sie sind, nach § 19 Abs. 3 UmwG als bekanntgemacht gilt, ihren Anspruch nach Grund und Höhe schriftlich anmelden, Sicherheit zu leisten, soweit sie nicht Befriedigung verlangen können. Dieses Recht steht den Gläubigern jedoch nur zu, wenn sie glaubhaft machen, dass durch die Verschmelzung die Erfüllung ihrer Forderung gefährdet wird."
    },
    {
      "date": "2025-02-28",
      "id": "102564",
      "original_text": "Löschungsankündigung\nBaden-Württemberg Amtsgericht Ulm HRA 650358\nScheyka GmbH & Co. KG – Altheim",
      "type": "Löschungsankündigung",
      "state": "Baden-Württemberg",
      "amtsgericht": "Amtsgericht Ulm",
      "registernummer": "HRA 650358",
      "registerart": "HRA",
      "company_name": "Scheyka GmbH & Co. KG",
      "company_seat": "Altheim",
      "details": "28.02.2025 (Bekanntmachungsdatum)\n\nBaden-Württemberg Amtsgericht Ulm HRA 650358\nLöschungsankündigung\n\nScheyka GmbH & Co. KG\nKommanditgesellschaft\nAltheim\n\nAls nicht eingetragen wird bekanntgemacht:\nDas Gericht beabsichtigt, die Gesellschaft wegen Vermögenslosigkeit im Handelsregister von Amts wegen nach § 394 FamFG zu löschen. Die Frist zur Geltendmachung eines Widerspruchs gegen die beabsichtigte Löschung ist auf  einen Monat ab Veröffentlichung bestimmt."
    },
    {
      "date": "2025-02-28",
      "id": "102565",
      "original_text": "Registerbekanntmachung nach dem Umwandlungsgesetz\nBaden-Württemberg Amtsgericht Mannheim HRB 720942\nKlambt Programmzeitschriften II GmbH – Baden-Baden",
      "type": "Registerbekanntmachung nach dem Umwandlungsgesetz",
      "state": "Baden-Württemberg",
      "amtsgericht": "Amtsgericht Mannheim",
      "registernummer": "HRB 720942",
      "registerart": "HRB",
      "company_name": "Klambt Programmzeitschriften II GmbH",
      "company_seat": "Baden-Baden",
      "details": "28.02.2025 (Bekanntmachungsdatum)\n\nBaden-Württemberg Amtsgericht Mannheim HRB 720942\nRegisterbekanntmachung nach dem Umwandlungsgesetz 28.02.2025 (Eintragungsdatum)\n\nKlambt Programmzeitschriften II GmbH\nGesellschaft mit beschränkter Haftung\nBaden-Baden\n\nDen Gläubigern der an der Verschmelzung beteiligten Rechtsträger ist, wenn sie binnen sechs Monaten nach dem Tag, an dem die Eintragung der Verschmelzung in das Register des Sitzes desjenigen Rechtsträgers, dessen Gläubiger sie sind, nach § 19 Abs. 3 UmwG als bekanntgemacht gilt, ihren Anspruch nach Grund und Höhe schriftlich anmelden, Sicherheit zu leisten, soweit sie nicht Befriedigung verlangen können. Dieses Recht steht den Gläubigern jedoch nur zu, wenn sie glaubhaft machen, dass durch die Verschmelzung die Erfüllung ihrer Forderung gefährdet wird."
    },
    {
      "date": "2025-02-28",
      "id": "102566",
      "original_text": "Registerbekanntmachung nach dem Umwandlungsgesetz\nBaden-Württemberg Amtsgericht Mannheim HRB 713148\nOT-Rechtsanwaltsgesellschaft mbH – Mosbach",
      "type": "Registerbekanntmachung nach dem Umwandlungsgesetz",
      "state": "Baden-Württemberg",
      "amtsgericht": "Amtsgericht Mannheim",
      "registernummer": "HRB 713148",
      "registerart": "HRB",
      "company_name": "OT-Rechtsanwaltsgesellschaft mbH",
      "company_seat": "Mosbach",
      "details": "28.02.2025 (Bekanntmachungsdatum)\n\nBaden-Württemberg Amtsgericht Mannheim HRB 713148\nRegisterbekanntmachung nach dem Umwandlungsgesetz 28.02.2025 (Eintragungsdatum)\n\nOT-Rechtsanwaltsgesellschaft mbH\nGesellschaft mit beschränkter Haftung\nMosbach\n\nDen Gläubigern der an der Verschmelzung beteiligten Rechtsträger ist, wenn sie binnen sechs Monaten nach dem Tag, an dem die Eintragung der Verschmelzung in das Register des Sitzes desjenigen Rechtsträgers, dessen Gläubiger sie sind, nach § 19 Abs. 3 UmwG als bekanntgemacht gilt, ihren Anspruch nach Grund und Höhe schriftlich anmelden, Sicherheit zu leisten, soweit sie nicht Befriedigung verlangen können. Dieses Recht steht den Gläubigern jedoch nur zu, wenn sie glaubhaft machen, dass durch die Verschmelzung die Erfüllung ihrer Forderung gefährdet wird."
    },
    {
      "date": "2025-02-28",
      "id": "102567",
      "original_text": "Registerbekanntmachung nach dem Umwandlungsgesetz\nBaden-Württemberg Amtsgericht Stuttgart HRB 778519\nRAP Trading XXI GmbH – Rottweil",
      "type": "Registerbekanntmachung nach dem Umwandlungsgesetz",
      "state": "Baden-Württemberg",
      "amtsgericht": "Amtsgericht Stuttgart",
      "registernummer": "HRB 778519",
      "registerart": "HRB",
      "company_name": "RAP Trading XXI GmbH",
      "company_seat": "Rottweil",
      "details": "28.02.2025 (Bekanntmachungsdatum)\n\nBaden-Württemberg Amtsgericht Stuttgart HRB 778519\nRegisterbekanntmachung nach dem Umwandlungsgesetz 28.02.2025 (Eintragungsdatum)\n\nRAP Trading XXI GmbH\nGesellschaft mit beschränkter Haftung\nRottweil\n\nAls nicht eingetragen wird bekanntgemacht:\nDen Gläubigern der an der Verschmelzung beteiligten Rechtsträger ist, wenn sie binnen sechs Monaten nach dem Tag, an dem die Eintragung der Verschmelzung in das Register des Sitzes desjenigen Rechtsträgers, dessen Gläubiger sie sind, nach § 19 Abs. 3 UmwG als bekanntgemacht gilt, ihren Anspruch nach Grund und Höhe schriftlich anmelden, Sicherheit zu leisten, soweit sie nicht Befriedigung verlangen können. Dieses Recht steht den Gläubigern jedoch nur zu, wenn sie glaubhaft machen, dass durch die Verschmelzung die Erfüllung ihrer Forderung gefährdet wird."
    },
    {
      "date": "2025-02-28",
      "id": "102568",
      "original_text": "Registerbekanntmachung nach dem Umwandlungsgesetz\nBaden-Württemberg Amtsgericht Mannheim HRB 721186\nKlambt Programmzeitschriften I GmbH – Baden-Baden",
      "type": "Registerbekanntmachung nach dem Umwandlungsgesetz",
      "state": "Baden-Württemberg",
      "amtsgericht": "Amtsgericht Mannheim",
      "registernummer": "HRB 721186",
      "registerart": "HRB",
      "company_name": "Klambt Programmzeitschriften I GmbH",
      "company_seat": "Baden-Baden",
      "details": "28.02.2025 (Bekanntmachungsdatum)\n\nBaden-Württemberg Amtsgericht Mannheim HRB 721186\nRegisterbekanntmachung nach dem Umwandlungsgesetz 28.02.2025 (Eintragungsdatum)\n\nKlambt Programmzeitschriften I GmbH\nGesellschaft mit beschränkter Haftung\nBaden-Baden\n\nAls nicht eingetragen wird bekanntgemacht:\nDen Gläubigern der an der Verschmelzung beteiligten Rechtsträger ist, wenn sie binnen sechs Monaten nach dem Tag, an dem die Eintragung der Verschmelzung in das Register des Sitzes desjenigen Rechtsträgers, dessen Gläubiger sie sind, nach § 19 Abs. 3 UmwG als bekanntgemacht gilt, ihren Anspruch nach Grund und Höhe schriftlich anmelden, Sicherheit zu leisten, soweit sie nicht Befriedigung verlangen können. Dieses Recht steht den Gläubigern jedoch nur zu, wenn sie glaubhaft machen, dass durch die Verschmelzung die Erfüllung ihrer Forderung gefährdet wird."
    },
    {
      "date": "2025-02-28",
      "id": "102569",
      "original_text": "Registerbekanntmachung nach dem Umwandlungsgesetz\nSchleswig-Holstein Amtsgericht Kiel HRA 6292\nCarlshöhe Bauträger GmbH & Co. KG – Damp",
      "type": "Registerbekanntmachung nach dem Umwandlungsgesetz",
      "state": "Schleswig-Holstein",
      "amtsgericht": "Amtsgericht Kiel",
      "registernummer": "HRA 6292",
      "registerart": "HRA",
      "company_name": "Carlshöhe Bauträger GmbH & Co. KG",
      "company_seat": "Damp",
      "details": "28.02.2025 (Bekanntmachungsdatum)\n\nSchleswig-Holstein Amtsgericht Kiel HRA 6292\nRegisterbekanntmachung nach dem Umwandlungsgesetz 27.02.2025 (Eintragungsdatum)\n\nCarlshöhe Bauträger GmbH & Co. KG\nKommanditgesellschaft\nDamp\n\nZu Eintragungsnummer 9 vom 27.02.2025 wird als nicht eingetragen veröffentlicht: Den Gläubigern ist, wenn sie binnen sechs Monaten nach dem Tag, an dem die Eintragung der Umwandlung bekannt gemacht worden ist, ihren Anspruch nach Grund und Höhe schriftlich anmelden, Sicherheit zu leisten, soweit sie nicht Befriedigung verlangen können. Dieses Recht steht den Gläubigern jedoch nur zu, wenn sie glaubhaft machen, dass durch die Umwandlung die Erfüllung ihrer Forderung gefährdet wird."
    },
    {
      "date": "2025-02-28",
      "id": "102570",
      "original_text": "Registerbekanntmachung nach dem Umwandlungsgesetz\nBaden-Württemberg Amtsgericht Mannheim HRB 719139\nKlambt Programmzeitschriften GmbH – Baden-Baden",
      "type": "Registerbekanntmachung nach dem Umwandlungsgesetz",
      "state": "Baden-Württemberg",
      "amtsgericht": "Amtsgericht Mannheim",
      "registernummer": "HRB 719139",
      "registerart": "HRB",
      "company_name": "Klambt Programmzeitschriften GmbH",
      "company_seat": "Baden-Baden",
      "details": "28.02.2025 (Bekanntmachungsdatum)\n\nBaden-Württemberg Amtsgericht Mannheim HRB 719139\nRegisterbekanntmachung nach dem Umwandlungsgesetz 28.02.2025 (Eintragungsdatum)\n\nKlambt Programmzeitschriften GmbH\nGesellschaft mit beschränkter Haftung\nBaden-Baden\n\nDen Gläubigern der an der Verschmelzung beteiligten Rechtsträger ist, wenn sie binnen sechs Monaten nach dem Tag, an dem die Eintragung der Verschmelzung in das Register des Sitzes desjenigen Rechtsträgers, dessen Gläubiger sie sind, nach § 19 Abs. 3 UmwG als bekanntgemacht gilt, ihren Anspruch nach Grund und Höhe schriftlich anmelden, Sicherheit zu leisten, soweit sie nicht Befriedigung verlangen können. Dieses Recht steht den Gläubigern jedoch nur zu, wenn sie glaubhaft machen, dass durch die Verschmelzung die Erfüllung ihrer Forderung gefährdet wird."
    },
    {
      "date": "2025-02-28",
      "id": "102571",
      "original_text": "Registerbekanntmachung nach dem Umwandlungsgesetz\nSachsen-Anhalt Amtsgericht Stendal HRA 8081\nPPM Eckart Baugesellschaft GmbH & Co. KG – Wolmirstedt",
      "type": "Registerbekanntmachung nach dem Umwandlungsgesetz",
      "state": "Sachsen-Anhalt",
      "amtsgericht": "Amtsgericht Stendal",
      "registernummer": "HRA 8081",
      "registerart": "HRA",
      "company_name": "PPM Eckart Baugesellschaft GmbH & Co. KG",
      "company_seat": "Wolmirstedt",
      "details": "28.02.2025 (Bekanntmachungsdatum)\n\nSachsen-Anhalt Amtsgericht Stendal HRA 8081\nRegisterbekanntmachung nach dem Umwandlungsgesetz 28.02.2025 (Eintragungsdatum)\n\nPPM Eckart Baugesellschaft GmbH & Co. KG\nKommanditgesellschaft\nWolmirstedt\n\nNicht eingetragen:\nDen Gläubigern der an der Ausgliederung beteiligten Rechtsträger, ist wenn sie binnen sechs Monaten nach dem Tag, an dem die Eintragung der Ausgliederung nach §§125, 19 Abs. 3 UmwG als bekanntgemacht gilt, ihren Anspruch nach Grund und Höhe schriftlich anmelden, Sicherheit zu leisten, soweit sie nicht Befriedigung verlangen können. Diese Recht steht ihnen jedoch nur zu, wenn sie glaubhaft machen, dass durch die Ausgliederung die Erfüllung ihrer Forderung gefährdet wird."
    },
    {
      "date": "2025-02-28",
      "id": "102572",
      "original_text": "Registerbekanntmachung nach dem Umwandlungsgesetz\nSachsen-Anhalt Amtsgericht Stendal HRA 7959\nPPM Eckart e.K. – Wolmirstedt",
      "type": "Registerbekanntmachung nach dem Umwandlungsgesetz",
      "state": "Sachsen-Anhalt",
      "amtsgericht": "Amtsgericht Stendal",
      "registernummer": "HRA 7959",
      "registerart": "HRA",
      "company_name": "PPM Eckart e.K.",
      "company_seat": "Wolmirstedt",
      "details": "28.02.2025 (Bekanntmachungsdatum)\n\nSachsen-Anhalt Amtsgericht Stendal HRA 7959\nRegisterbekanntmachung nach dem Umwandlungsgesetz 28.02.2025 (Eintragungsdatum)\n\nPPM Eckart e.K.\nEinzelkaufmann / Einzelkauffrau\nWolmirstedt\n\nNicht eingetragen:\nDen Gläubigern der an der Ausgliederung beteiligten Rechtsträger, ist wenn sie binnen sechs Monaten nach dem Tag, an dem die Eintragung der Ausgliederung nach §§125, 19 Abs. 3 UmwG als bekanntgemacht gilt, ihren Anspruch nach Grund und Höhe schriftlich anmelden, Sicherheit zu leisten, soweit sie nicht Befriedigung verlangen können. Diese Recht steht ihnen jedoch nur zu, wenn sie glaubhaft machen, dass durch die Ausgliederung die Erfüllung ihrer Forderung gefährdet wird."
    },
    {
      "date": "2025-02-28",
      "id": "102573",
      "original_text": "Löschungsankündigung\nBrandenburg Amtsgericht Potsdam HRB 6588\nSe-Tra-Log GmbH – Rathenow",
      "type": "Löschungsankündigung",
      "state": "Brandenburg",
      "amtsgericht": "Amtsgericht Potsdam",
      "registernummer": "HRB 6588",
      "registerart": "HRB",
      "company_name": "Se-Tra-Log GmbH",
      "company_seat": "Rathenow",
      "details": "28.02.2025 (Bekanntmachungsdatum)\n\nBrandenburg Amtsgericht Potsdam HRB 6588\nLöschungsankündigung\n\nSe-Tra-Log GmbH\nGesellschaft mit beschränkter Haftung\nRathenow\n\nBei der nachstehenden Gesellschaft wird das Amtslöschungsverfahren gemäß § 394 FamFG eingeleitet. Widerspruchsfrist: 8 Wochen"
    },
    {
      "date": "2025-02-28",
      "id": "102574",
      "original_text": "Löschungsankündigung\nBerlin Amtsgericht Berlin (Charlottenburg) HRB 222462\nAskinCakici Bau & Verwaltungs GmbH – Berlin",
      "type": "Löschungsankündigung",
      "state": "Berlin",
      "amtsgericht": "Amtsgericht Berlin (Charlottenburg)",
      "registernummer": "HRB 222462",
      "registerart": "HRB",
      "company_name": "AskinCakici Bau & Verwaltungs GmbH",
      "company_seat": "Berlin",
      "details": "28.02.2025 (Bekanntmachungsdatum)\n\nBerlin Amtsgericht Berlin (Charlottenburg) HRB 222462\nLöschungsankündigung\n\nAskinCakici Bau & Verwaltungs GmbH\nGesellschaft mit beschränkter Haftung\nBerlin\n\nEs ist beabsichtigt, die Eintragung des GF Askin wegen Mangels einer wesentlichen Voraussetzung gemäß § 395 FamFG von Amts wegen zu löschen. Widerspruchsfrist 2 Wochen"
    },
    {
      "date": "2025-02-28",
      "id": "102575",
      "original_text": "Löschungsankündigung\nBerlin Amtsgericht Berlin (Charlottenburg) HRB 187475\nLinda Bau GmbH – Berlin",
      "type": "Löschungsankündigung",
      "state": "Berlin",
      "amtsgericht": "Amtsgericht Berlin (Charlottenburg)",
      "registernummer": "HRB 187475",
      "registerart": "HRB",
      "company_name": "Linda Bau GmbH",
      "company_seat": "Berlin",
      "details": "28.02.2025 (Bekanntmachungsdatum)\n\nBerlin Amtsgericht Berlin (Charlottenburg) HRB 187475\nLöschungsankündigung\n\nLinda Bau GmbH\nGesellschaft mit beschränkter Haftung\nBerlin\n\nBei der nachstehenden Gesellschaft wird das Amtslöschungsverfahren gemäß § 394 FamFG eingeleitet. Widerspruchsfrist 6 Wochen"
    },
    {
      "date": "2025-02-28",
      "id": "102576",
      "original_text": "Registerbekanntmachung nach dem Umwandlungsgesetz\nBaden-Württemberg Amtsgericht Freiburg HRA 708877\nDogan Dienstleistungen e.K. – Kehl",
      "type": "Registerbekanntmachung nach dem Umwandlungsgesetz",
      "state": "Baden-Württemberg",
      "amtsgericht": "Amtsgericht Freiburg",
      "registernummer": "HRA 708877",
      "registerart": "HRA",
      "company_name": "Dogan Dienstleistungen e.K.",
      "company_seat": "Kehl",
      "details": "28.02.2025 (Bekanntmachungsdatum)\n\nBaden-Württemberg Amtsgericht Freiburg HRA 708877\nRegisterbekanntmachung nach dem Umwandlungsgesetz 28.02.2025 (Eintragungsdatum)\n\nDogan Dienstleistungen e.K.\nEinzelkaufmann / Einzelkauffrau\nKehl\n\nDen Gläubigern der an der Ausgliederung beteiligten Rechtsträger ist, wenn sie binnen sechs Monaten nach dem Tag, an dem die Eintragung der Ausgliederung in das Register des Sitzes desjenigen Rechtsträgers, dessen Gläubiger sie sind, nach §§ 125, 19 Abs. 3 UmwG als bekanntgemacht gilt, ihren Anspruch nach Grund und Höhe schriftlich anmelden, Sicherheit zu leisten, soweit sie nicht Befriedigung verlangen können. Dieses Recht steht den Gläubigern jedoch nur zu, wenn sie glaubhaft machen, dass durch die Ausgliederung die Erfüllung ihrer Forderung gefährdet wird."
    },
    {
      "date": "2025-02-28",
      "id": "102577",
      "original_text": "Registerbekanntmachung nach dem Umwandlungsgesetz\nBaden-Württemberg Amtsgericht Freiburg HRA 471583\nGraf Hardenberg GmbH & Co. KG – Offenburg",
      "type": "Registerbekanntmachung nach dem Umwandlungsgesetz",
      "state": "Baden-Württemberg",
      "amtsgericht": "Amtsgericht Freiburg",
      "registernummer": "HRA 471583",
      "registerart": "HRA",
      "company_name": "Graf Hardenberg GmbH & Co. KG",
      "company_seat": "Offenburg",
      "details": "28.02.2025 (Bekanntmachungsdatum)\n\nBaden-Württemberg Amtsgericht Freiburg HRA 471583\nRegisterbekanntmachung nach dem Umwandlungsgesetz 28.02.2025 (Eintragungsdatum)\n\nGraf Hardenberg GmbH & Co. KG\nKommanditgesellschaft\nOffenburg\n\nAls nicht eingetragen wird bekanntgemacht:\nDen Gläubigern der an der Verschmelzung beteiligten Rechtsträger ist, wenn sie binnen sechs Monaten nach dem Tag, an dem die Eintragung der Verschmelzung in das Register des Sitzes desjenigen Rechtsträgers, dessen Gläubiger sie sind, nach § 19 Abs. 3 UmwG als bekanntgemacht gilt, ihren Anspruch nach Grund und Höhe schriftlich anmelden, Sicherheit zu leisten, soweit sie nicht Befriedigung verlangen können. Dieses Recht steht den Gläubigern jedoch nur zu, wenn sie glaubhaft machen, dass durch die Verschmelzung die Erfüllung ihrer Forderung gefährdet wird."
    },
    {
      "date": "2025-02-28",
      "id": "102578",
      "original_text": "Registerbekanntmachung nach dem Umwandlungsgesetz\nBrandenburg Amtsgericht Cottbus HRB 16318\nSpreewaldfisch GmbH – Peitz",
      "type": "Registerbekanntmachung nach dem Umwandlungsgesetz",
      "state": "Brandenburg",
      "amtsgericht": "Amtsgericht Cottbus",
      "registernummer": "HRB 16318",
      "registerart": "HRB",
      "company_name": "Spreewaldfisch GmbH",
      "company_seat": "Peitz",
      "details": "28.02.2025 (Bekanntmachungsdatum)\n\nBrandenburg Amtsgericht Cottbus HRB 16318\nRegisterbekanntmachung nach dem Umwandlungsgesetz 28.02.2025 (Eintragungsdatum)\n\nSpreewaldfisch GmbH\nGesellschaft mit beschränkter Haftung\nPeitz\n\nZu Eintragungsnummer 3 vom 28.02.2025 wird als nicht eingetragen veröffentlicht:\nDen Gläubigern der an der Verschmelzung beteiligten Rechtsträger ist, wenn sie binnen sechs Monaten nach dem Tag, an dem die Eintragung der Verschmelzung in das Register des Sitzes desjenigen Rechtsträgers, dessen Gläubiger sie sind, als bekannt gemacht gilt, ihren Anspruch nach Grund und Höhe schriftlich anmelden, Sicherheit zu leisten, soweit sie nicht Befriedigung verlangen können. Dieses Recht steht den Gläubigern jedoch nur zu, wenn sie glaubhaft machen, dass durch die Verschmelzung die Erfüllung ihrer Forderung gefährdet wird."
    },
    {
      "date": "2025-02-28",
      "id": "102579",
      "original_text": "Registerbekanntmachung nach dem Umwandlungsgesetz\nBaden-Württemberg Amtsgericht Freiburg HRB 732703\nDogan Dienstleistungen GmbH – Kehl",
      "type": "Registerbekanntmachung nach dem Umwandlungsgesetz",
      "state": "Baden-Württemberg",
      "amtsgericht": "Amtsgericht Freiburg",
      "registernummer": "HRB 732703",
      "registerart": "HRB",
      "company_name": "Dogan Dienstleistungen GmbH",
      "company_seat": "Kehl",
      "details": "28.02.2025 (Bekanntmachungsdatum)\n\nBaden-Württemberg Amtsgericht Freiburg HRB 732703\nRegisterbekanntmachung nach dem Umwandlungsgesetz 28.02.2025 (Eintragungsdatum)\n\nDogan Dienstleistungen GmbH\nGesellschaft mit beschränkter Haftung\nKehl\n\nDen Gläubigern der an der Ausgliederung beteiligten Rechtsträger ist, wenn sie binnen sechs Monaten nach dem Tag, an dem die Eintragung der Ausgliederung in das Register des Sitzes desjenigen Rechtsträgers, dessen Gläubiger sie sind, nach §§ 125, 19 Abs. 3 UmwG als bekanntgemacht gilt, ihren Anspruch nach Grund und Höhe schriftlich anmelden, Sicherheit zu leisten, soweit sie nicht Befriedigung verlangen können. Dieses Recht steht den Gläubigern jedoch nur zu, wenn sie glaubhaft machen, dass durch die Ausgliederung die Erfüllung ihrer Forderung gefährdet wird."
    },
    {
      "date": "2025-02-28",
      "id": "102580",
      "original_text": "Einreichung neuer Dokumente\nThüringen Amtsgericht Jena HRB 501668\nStadtwerke Suhl/Zella-Mehlis Netz GmbH – Suhl",
      "type": "Einreichung neuer Dokumente",
      "state": "Thüringen",
      "amtsgericht": "Amtsgericht Jena",
      "registernummer": "HRB 501668",
      "registerart": "HRB",
      "company_name": "Stadtwerke Suhl/Zella-Mehlis Netz GmbH",
      "company_seat": "Suhl",
      "details": "28.02.2025 (Bekanntmachungsdatum)\n\nThüringen Amtsgericht Jena HRB 501668\nEinreichung neuer Dokumente\n\nStadtwerke Suhl/Zella-Mehlis Netz GmbH\nGesellschaft mit beschränkter Haftung\nSuhl\n\nBekanntmachung gem. § 52 Abs. 3 Satz 2 GmbHG: Aufgrund einer Veränderung in den Personen der Aufsichtsratsmitglieder ist durch die Geschäftsführer eine neue Liste zum Handelsregister eingereicht worden."
    },
    {
      "date": "2025-02-28",
      "id": "102581",
      "original_text": "Einreichung neuer Dokumente\nBerlin Amtsgericht Berlin (Charlottenburg) HRB 180737\nMILES Mobility GmbH – Berlin",
      "type": "Einreichung neuer Dokumente",
      "state": "Berlin",
      "amtsgericht": "Amtsgericht Berlin (Charlottenburg)",
      "registernummer": "HRB 180737",
      "registerart": "HRB",
      "company_name": "MILES Mobility GmbH",
      "company_seat": "Berlin",
      "details": "28.02.2025 (Bekanntmachungsdatum)\n\nBerlin Amtsgericht Berlin (Charlottenburg) HRB 180737\nEinreichung neuer Dokumente\n\nMILES Mobility GmbH\nGesellschaft mit beschränkter Haftung\nBerlin\n\nAls nicht eingetragen wird veröffentlicht: Es wurde eine neue Liste der Beiratsmitglieder eingereicht (§52 GmbHG)."
    },
    {
      "date": "2025-02-28",
      "id": "102582",
      "original_text": "Registerbekanntmachung nach dem Umwandlungsgesetz\nBaden-Württemberg Amtsgericht Mannheim HRB 748043\nDaulto GmbH – Heidelberg",
      "type": "Registerbekanntmachung nach dem Umwandlungsgesetz",
      "state": "Baden-Württemberg",
      "amtsgericht": "Amtsgericht Mannheim",
      "registernummer": "HRB 748043",
      "registerart": "HRB",
      "company_name": "Daulto GmbH",
      "company_seat": "Heidelberg",
      "details": "28.02.2025 (Bekanntmachungsdatum)\n\nBaden-Württemberg Amtsgericht Mannheim HRB 748043\nRegisterbekanntmachung nach dem Umwandlungsgesetz 28.02.2025 (Eintragungsdatum)\n\nDaulto GmbH\nGesellschaft mit beschränkter Haftung\nHeidelberg\n\nDen Gläubigern der an der Verschmelzung beteiligten Rechtsträger ist, wenn sie binnen sechs Monaten nach dem Tag, an dem die Eintragung der Verschmelzung in das Register des Sitzes desjenigen Rechtsträgers, dessen Gläubiger sie sind, nach § 19 Abs. 3 UmwG als bekanntgemacht gilt, ihren Anspruch nach Grund und Höhe schriftlich anmelden, Sicherheit zu leisten, soweit sie nicht Befriedigung verlangen können. Dieses Recht steht den Gläubigern jedoch nur zu, wenn sie glaubhaft machen, dass durch die Verschmelzung die Erfüllung ihrer Forderung gefährdet wird."
    },
    {
      "date": "2025-02-28",
      "id": "102583",
      "original_text": "Registerbekanntmachung nach dem Umwandlungsgesetz\nSachsen-Anhalt Amtsgericht Stendal HRB 23474\nLORD Germany Feinchemie GmbH – Leuna",
      "type": "Registerbekanntmachung nach dem Umwandlungsgesetz",
      "state": "Sachsen-Anhalt",
      "amtsgericht": "Amtsgericht Stendal",
      "registernummer": "HRB 23474",
      "registerart": "HRB",
      "company_name": "LORD Germany Feinchemie GmbH",
      "company_seat": "Leuna",
      "details": "28.02.2025 (Bekanntmachungsdatum)\n\nSachsen-Anhalt Amtsgericht Stendal HRB 23474\nRegisterbekanntmachung nach dem Umwandlungsgesetz 28.02.2025 (Eintragungsdatum)\n\nLORD Germany Feinchemie GmbH\nGesellschaft mit beschränkter Haftung\nLeuna\n\nNicht eingetragen:\nDen Gläubigern der an der Verschmelzung beteiligten Rechtsträger ist, wenn sie binnen sechs Monaten nach dem Tag, an dem die Eintragung der Verschmelzung nach § 19 Abs. 3 UmwG als bekanntgemacht gilt, ihren Anspruch nach Grund und Höhe schriftlich anmelden, Sicherheit zu leisten, soweit sie nicht Befriedigung verlangen können. Dieses Recht steht ihnen jedoch nur zu, wenn sie glaubhaft machen, dass durch die Verschmelzung die Erfüllung ihrer Forderung gefährdet wird."
    },
    {
      "date": "2025-02-28",
      "id": "102584",
      "original_text": "Löschungsankündigung\nBerlin Amtsgericht Berlin (Charlottenburg) HRB 215785\nBayers Taxi GmbH – Berlin",
      "type": "Löschungsankündigung",
      "state": "Berlin",
      "amtsgericht": "Amtsgericht Berlin (Charlottenburg)",
      "registernummer": "HRB 215785",
      "registerart": "HRB",
      "company_name": "Bayers Taxi GmbH",
      "company_seat": "Berlin",
      "details": "28.02.2025 (Bekanntmachungsdatum)\n\nBerlin Amtsgericht Berlin (Charlottenburg) HRB 215785\nLöschungsankündigung\n\nBayers Taxi GmbH\nGesellschaft mit beschränkter Haftung\nBerlin\n\nBei der nachstehenden Gesellschaft wird das Amtslöschungsverfahren gemäß § 394 FamFG eingeleitet. Widerspruchsfrist 6 Wochen"
    },
    {
      "date": "2025-02-28",
      "id": "102585",
      "original_text": "Löschungsankündigung\nBaden-Württemberg Amtsgericht Mannheim HRB 731122\nTortenkarussell GmbH – Ötigheim",
      "type": "Löschungsankündigung",
      "state": "Baden-Württemberg",
      "amtsgericht": "Amtsgericht Mannheim",
      "registernummer": "HRB 731122",
      "registerart": "HRB",
      "company_name": "Tortenkarussell GmbH",
      "company_seat": "Ötigheim",
      "details": "28.02.2025 (Bekanntmachungsdatum)\n\nBaden-Württemberg Amtsgericht Mannheim HRB 731122\nLöschungsankündigung 28.02.2025 (Eintragungsdatum)\n\nTortenkarussell GmbH\nGesellschaft mit beschränkter Haftung\nÖtigheim\n\nDas Gericht beabsichtigt, die Gesellschaft wegen Vermögenslosigkeit im Handelsregister von Amts wegen nach § 394 FamFG zu löschen. Die Frist zur Geltendmachung eines Widerspruchs gegen die beabsichtigte Löschung ist auf einen Monat ab Veröffentlichung bestimmt."
    },
    {
      "date": "2025-02-28",
      "id": "102586",
      "original_text": "Registerbekanntmachung nach dem Umwandlungsgesetz\nBerlin Amtsgericht Berlin (Charlottenburg) HRB 272677\nPrinceps GmbH – Berlin",
      "type": "Registerbekanntmachung nach dem Umwandlungsgesetz",
      "state": "Berlin",
      "amtsgericht": "Amtsgericht Berlin (Charlottenburg)",
      "registernummer": "HRB 272677",
      "registerart": "HRB",
      "company_name": "Princeps GmbH",
      "company_seat": "Berlin",
      "details": "28.02.2025 (Bekanntmachungsdatum)\n\nBerlin Amtsgericht Berlin (Charlottenburg) HRB 272677\nRegisterbekanntmachung nach dem Umwandlungsgesetz 27.02.2025 (Eintragungsdatum)\n\nPrinceps GmbH\nGesellschaft mit beschränkter Haftung\nBerlin\n\nZu Eintragungsnummer 1 vom 27.02.2025 wird als nicht eingetragen veröffentlicht: Den Gläubigern ist, wenn sie binnen sechs Monaten nach dem Tag, an dem die Eintragung der Umwandlung als bekannt gemacht gilt, ihren Anspruch nach Grund und Höhe schriftlich anmelden, Sicherheit zu leisten, soweit sie nicht Befriedigung verlangen können. Dieses Recht steht den Gläubigern jedoch nur zu, wenn sie glaubhaft machen, dass durch die Umwandlung die Erfüllung ihrer Forderung gefährdet wird. Das Recht, Sicherheitsleistung zu verlangen, steht Gläubigern nicht zu, die im Falle der Insolvenz ein Recht auf vorzugsweise Befriedigung aus einer Deckungsmasse haben, die nach gesetzlicher Vorschrift zu ihrem Schutz errichtet und staatlich überwacht ist."
    },
    {
      "date": "2025-02-28",
      "id": "102587",
      "original_text": "Registerbekanntmachung nach dem Umwandlungsgesetz\nBaden-Württemberg Amtsgericht Ulm HRB 729450\nWaldner Labor- und Schuleinrichtungen GmbH – Wangen im Allgäu",
      "type": "Registerbekanntmachung nach dem Umwandlungsgesetz",
      "state": "Baden-Württemberg",
      "amtsgericht": "Amtsgericht Ulm",
      "registernummer": "HRB 729450",
      "registerart": "HRB",
      "company_name": "Waldner Labor- und Schuleinrichtungen GmbH",
      "company_seat": "Wangen im Allgäu",
      "details": "28.02.2025 (Bekanntmachungsdatum)\n\nBaden-Württemberg Amtsgericht Ulm HRB 729450\nRegisterbekanntmachung nach dem Umwandlungsgesetz 28.02.2025 (Eintragungsdatum)\n\nWaldner Labor- und Schuleinrichtungen GmbH\nGesellschaft mit beschränkter Haftung\nWangen im Allgäu\n\nDen Gläubigern der an der Verschmelzung beteiligten Rechtsträger ist, wenn sie binnen sechs Monaten nach dem Tag, an dem die Eintragung der Verschmelzung in das Register des Sitzes desjenigen Rechtsträgers, dessen Gläubiger sie sind, nach § 19 Abs. 3 UmwG als bekanntgemacht gilt, ihren Anspruch nach Grund und Höhe schriftlich anmelden, Sicherheit zu leisten, soweit sie nicht Befriedigung verlangen können. Dieses Recht steht den Gläubigern jedoch nur zu, wenn sie glaubhaft machen, dass durch die Verschmelzung die Erfüllung ihrer Forderung gefährdet wird."
    },
    {
      "date": "2025-02-28",
      "id": "102588",
      "original_text": "Löschungsankündigung\nSchleswig-Holstein Amtsgericht Flensburg HRB 10500\nALP-Service GmbH – Flensburg",
      "type": "Löschungsankündigung",
      "state": "Schleswig-Holstein",
      "amtsgericht": "Amtsgericht Flensburg",
      "registernummer": "HRB 10500",
      "registerart": "HRB",
      "company_name": "ALP-Service GmbH",
      "company_seat": "Flensburg",
      "details": "28.02.2025 (Bekanntmachungsdatum)\n\nSchleswig-Holstein Amtsgericht Flensburg HRB 10500\nLöschungsankündigung\n\nALP-Service GmbH\nGesellschaft mit beschränkter Haftung\nFlensburg\n\nEs ist die Löschung der nachstehenden Gesellschaft wegen Vermögenslosigkeit gemäß § 394 FamFG beabsichtigt.\nWiderspruchsfrist: 2 Monate."
    },
    {
      "date": "2025-02-28",
      "id": "102589",
      "original_text": "Registerbekanntmachung nach dem Umwandlungsgesetz\nBerlin Amtsgericht Berlin (Charlottenburg) HRB 75498\nZum Goldenen Hirschen Berlin Hamburg GmbH – Berlin",
      "type": "Registerbekanntmachung nach dem Umwandlungsgesetz",
      "state": "Berlin",
      "amtsgericht": "Amtsgericht Berlin (Charlottenburg)",
      "registernummer": "HRB 75498",
      "registerart": "HRB",
      "company_name": "Zum Goldenen Hirschen Berlin Hamburg GmbH",
      "company_seat": "Berlin",
      "details": "28.02.2025 (Bekanntmachungsdatum)\n\nBerlin Amtsgericht Berlin (Charlottenburg) HRB 75498\nRegisterbekanntmachung nach dem Umwandlungsgesetz 27.02.2025 (Eintragungsdatum)\n\nZum Goldenen Hirschen Berlin Hamburg GmbH\nGesellschaft mit beschränkter Haftung\nBerlin\n\nZu Eintragungsnummer 16 vom 27.02.2025 wird als nicht eingetragen veröffentlicht: Den Gläubigern der an der Verschmelzung beteiligten Rechtsträger ist, wenn sie binnen sechs Monaten nach dem Tag, an dem die Eintragung der Verschmelzung in das Register des Sitzes desjenigen Rechtsträgers, dessen Gläubiger sie sind, als bekannt gemacht gilt, ihren Anspruch nach Grund und Höhe schriftlich anmelden, Sicherheit zu leisten, soweit sie nicht Befriedigung verlangen können. Dieses Recht steht den Gläubigern jedoch nur zu, wenn sie glaubhaft machen, dass durch die Verschmelzung die Erfüllung ihrer Forderung gefährdet wird. Das Recht, Sicherheitsleistung zu verlangen, steht Gläubigern nicht zu, die im Falle der Insolvenz ein Recht auf vorzugsweise Befriedigung aus einer Deckungsmasse haben, die nach gesetzlicher Vorschrift zu ihrem Schutz errichtet und staatlich überwacht ist."
    },
    {
      "date": "2025-02-28",
      "id": "102590",
      "original_text": "Registerbekanntmachung nach dem Umwandlungsgesetz\nBaden-Württemberg Amtsgericht Freiburg GsR 1060\nPassion Performance eGbR – Kirchzarten",
      "type": "Registerbekanntmachung nach dem Umwandlungsgesetz",
      "state": "Baden-Württemberg",
      "amtsgericht": "Amtsgericht Freiburg",
      "registernummer": "GsR 1060",
      "registerart": "GsR",
      "company_name": "Passion Performance eGbR",
      "company_seat": "Kirchzarten",
      "details": "28.02.2025 (Bekanntmachungsdatum)\n\nBaden-Württemberg Amtsgericht Freiburg GsR 1060\nRegisterbekanntmachung nach dem Umwandlungsgesetz 28.02.2025 (Eintragungsdatum)\n\nPassion Performance eGbR\nGesellschaft bürgerlichen Rechts\nKirchzarten\n\nDie Gesellschaft wurde formwechselnd umgewandelt in die Passion Performance GmbH (Amtsgericht Freiburg, HRB 732704).\nDen Gläubigern des an dem Formwechsel beteiligten Rechtsträgers ist, wenn sie binnen sechs Monaten nach dem Tag, an dem die Eintragung des Formwechsels in das Register des Sitzes desjenigen Rechtsträgers, dessen Gläubiger sie sind, nach § 19 Abs. 3 UmwG als bekanntgemacht gilt, ihren Anspruch nach Grund und Höhe schriftlich anmelden, Sicherheit zu leisten, soweit sie nicht Befriedigung verlangen können. Dieses Recht steht den Gläubigern jedoch nur zu, wenn sie glaubhaft machen, dass durch den Formwechsel die Erfüllung ihrer Forderung gefährdet wird."
    },
    {
      "date": "2025-02-28",
      "id": "102591",
      "original_text": "Registerbekanntmachung nach dem Umwandlungsgesetz\nSachsen Amtsgericht Dresden HRB 9575\nKWD Kupplungswerk Dresden GmbH – Dresden",
      "type": "Registerbekanntmachung nach dem Umwandlungsgesetz",
      "state": "Sachsen",
      "amtsgericht": "Amtsgericht Dresden",
      "registernummer": "HRB 9575",
      "registerart": "HRB",
      "company_name": "KWD Kupplungswerk Dresden GmbH",
      "company_seat": "Dresden",
      "details": "28.02.2025 (Bekanntmachungsdatum)\n\nSachsen Amtsgericht Dresden HRB 9575\nRegisterbekanntmachung nach dem Umwandlungsgesetz 28.02.2025 (Eintragungsdatum)\n\nKWD Kupplungswerk Dresden GmbH\nGesellschaft mit beschränkter Haftung\nDresden\n\nDen Gläubigern der an der Umwandlung beteiligten Rechtsträger ist, wenn sie binnen sechs Monaten nach dem Tag, an dem die Eintragung der Umwandlung in das Register des Sitzes desjenigen Rechtsträgers, dessen Gläubiger sie sind, nach § 19 Abs. 3 UmwG als bekannt gemacht gilt, ihren Anspruch nach Grund und Höhe in Textform anmelden, Sicherheit zu leisten, soweit sie nicht Befriedigung verlangen können. Dieses Recht steht den Gläubigern jedoch nur zu, wenn sie glaubhaft machen, dass durch die Umwandlung die Erfüllung der Forderung gefährdet wird."
    },
    {
      "date": "2025-02-28",
      "id": "102592",
      "original_text": "Löschungsankündigung\nSachsen Amtsgericht Leipzig HRB 28224\nMichael GmbH – Leipzig",
      "type": "Löschungsankündigung",
      "state": "Sachsen",
      "amtsgericht": "Amtsgericht Leipzig",
      "registernummer": "HRB 28224",
      "registerart": "HRB",
      "company_name": "Michael GmbH",
      "company_seat": "Leipzig",
      "details": "28.02.2025 (Bekanntmachungsdatum)\n\nSachsen Amtsgericht Leipzig HRB 28224\nLöschungsankündigung 28.02.2025 (Eintragungsdatum)\n\nMichael GmbH\nGesellschaft mit beschränkter Haftung\nLeipzig\n\nDas Registergericht beabsichtigt, die im Handelsregister eingetragene Gesellschaft von Amts wegen nach § 394 FamFG zu löschen. Die Frist zu Erhebung eines Widerspruchs gegen die beabsichtigte Löschung wird auf einen Monat festgesetzt."
    },
    {
      "date": "2025-02-28",
      "id": "102593",
      "original_text": "Einreichung neuer Dokumente\nSachsen Amtsgericht Dresden HRB 18946\nSchmiedewerke Gröditz GmbH – Gröditz",
      "type": "Einreichung neuer Dokumente",
      "state": "Sachsen",
      "amtsgericht": "Amtsgericht Dresden",
      "registernummer": "HRB 18946",
      "registerart": "HRB",
      "company_name": "Schmiedewerke Gröditz GmbH",
      "company_seat": "Gröditz",
      "details": "28.02.2025 (Bekanntmachungsdatum)\n\nSachsen Amtsgericht Dresden HRB 18946\nEinreichung neuer Dokumente\n\nSchmiedewerke Gröditz GmbH\nGesellschaft mit beschränkter Haftung\nGröditz\n\nAm 27.02.2025 wurde beim Handelsregister des Amtsgerichts Dresden die Liste der Mitglieder des Aufsichtsrats gemäß § 52 GmbHG eingereicht."
    },
    {
      "date": "2025-02-28",
      "id": "102594",
      "original_text": "Löschungsankündigung\nNiedersachsen Amtsgericht Hildesheim HRB 204416\nKfz.-Meisterbetrieb Wand UG (haftungsbeschränkt) – Alfeld (Leine)",
      "type": "Löschungsankündigung",
      "state": "Niedersachsen",
      "amtsgericht": "Amtsgericht Hildesheim",
      "registernummer": "HRB 204416",
      "registerart": "HRB",
      "company_name": "Kfz.-Meisterbetrieb Wand UG (haftungsbeschränkt)",
      "company_seat": "Alfeld (Leine)",
      "details": "28.02.2025 (Bekanntmachungsdatum)\n\nNiedersachsen Amtsgericht Hildesheim HRB 204416\nLöschungsankündigung 26.02.2025 (Eintragungsdatum)\n\nKfz.-Meisterbetrieb Wand UG (haftungsbeschränkt)\nGesellschaft mit beschränkter Haftung\nAlfeld (Leine)\n\nDas Registergericht beabsichtigt, die Gesellschaft von Amts wegen nach § 394 FamFG zu löschen. Die Frist zur Erhebung eines Widerspruchs ist auf 1 Monat ab dieser Registerbekanntmachung festgesetzt."
    },
    {
      "date": "2025-02-28",
      "id": "102595",
      "original_text": "Löschungsankündigung\nNiedersachsen Amtsgericht Aurich HRB 100104 früher Amtsgericht Emden\nECOMP-GmbH, Ingenieurbüro für Mikrowellentechnik und Elektronik – Emden",
      "type": "Löschungsankündigung",
      "state": "Niedersachsen",
      "amtsgericht": "Amtsgericht Aurich",
      "registernummer": "HRB 100104",
      "registerart": "HRB",
      "company_name": "ECOMP-GmbH, Ingenieurbüro für Mikrowellentechnik und Elektronik",
      "company_seat": "Emden",
      "former_amtsgericht": "Emden",
      "details": "28.02.2025 (Bekanntmachungsdatum)\n\nNiedersachsen Amtsgericht Aurich HRB 100104 früher Amtsgericht Emden\nLöschungsankündigung\n\nECOMP-GmbH, Ingenieurbüro für Mikrowellentechnik und Elektronik\nGesellschaft mit beschränkter Haftung\nEmden\n\nDas Registergericht beabsichtigt, die Gesellschaft von Amts wegen nach § 394 FamFG zu löschen. Die Frist zur Erhebung eines Widerspruchs ist auf 1 Monat ab dieser Registerbekanntmachung festgesetzt."
    },
    {
      "date": "2025-02-28",
      "id": "102596",
      "original_text": "Löschungsankündigung\nNiedersachsen Amtsgericht Hildesheim HRB 206371\nAcar Abriss GmbH – Sassenburg",
      "type": "Löschungsankündigung",
      "state": "Niedersachsen",
      "amtsgericht": "Amtsgericht Hildesheim",
      "registernummer": "HRB 206371",
      "registerart": "HRB",
      "company_name": "Acar Abriss GmbH",
      "company_seat": "Sassenburg",
      "details": "28.02.2025 (Bekanntmachungsdatum)\n\nNiedersachsen Amtsgericht Hildesheim HRB 206371\nLöschungsankündigung\n\nAcar Abriss GmbH\nGesellschaft mit beschränkter Haftung\nSassenburg\n\nDas Registergericht beabsichtigt, die Gesellschaft von Amts wegen nach § 394 FamFG zu löschen. Die Frist zur Erhebung eines Widerspruchs ist auf 1 Monat ab dieser Registerbekanntmachung festgesetzt."
    },
    {
      "date": "2025-02-28",
      "id": "102597",
      "original_text": "Löschungsankündigung\nNiedersachsen Amtsgericht Oldenburg (Oldenburg) HRA 206801\nSOZZIE Import & Export e. K. – Oldenburg",
      "type": "Löschungsankündigung",
      "state": "Niedersachsen",
      "amtsgericht": "Amtsgericht Oldenburg (Oldenburg)",
      "registernummer": "HRA 206801",
      "registerart": "HRA",
      "company_name": "SOZZIE Import & Export e. K.",
      "company_seat": "Oldenburg",
      "details": "28.02.2025 (Bekanntmachungsdatum)\n\nNiedersachsen Amtsgericht Oldenburg (Oldenburg) HRA 206801\nLöschungsankündigung\n\nSOZZIE Import & Export e. K.\nEinzelkaufmann / Einzelkauffrau\nOldenburg\n\nDas Registergericht beabsichtigt, die Firma von Amts wegen nach § 31 Abs. 2 Satz 2 HGB, § 393 FamFG zu löschen. Die Frist zur Erhebung eines Widerspruchs ist auf 1 Monat ab dieser Registerbekanntmachung festgesetzt."
    },
    {
      "date": "2025-02-28",
      "id": "102598",
      "original_text": "Löschungsankündigung\nBremen Amtsgericht Bremen HRB 39491\nDiyo Gebäudereinigung GmbH – Bremen",
      "type": "Löschungsankündigung",
      "state": "Bremen",
      "amtsgericht": "Amtsgericht Bremen",
      "registernummer": "HRB 39491",
      "registerart": "HRB",
      "company_name": "Diyo Gebäudereinigung GmbH",
      "company_seat": "Bremen",
      "details": "28.02.2025 (Bekanntmachungsdatum)\n\nBremen Amtsgericht Bremen HRB 39491\nLöschungsankündigung\n\nDiyo Gebäudereinigung GmbH\nGesellschaft mit beschränkter Haftung\nBremen\n\nEs ist beabsichtigt die im Handelsregister eingetragene Gesellschaft von Amts wegen gemäß § 394 FamFG zu löschen. Gegen die Löschung kann beim AG Bremen schriftlich oder zu Protokoll der Geschäftsstelle Widerspruch eingelegt werden. Widerspruchsfrist 4 Wochen."
    },
    {
      "date": "2025-02-28",
      "id": "102599",
      "original_text": "Löschungsankündigung\nRheinland-Pfalz Amtsgericht Zweibrücken HRB 23046\nKnierim GmbH – Pirmasens",
      "type": "Löschungsankündigung",
      "state": "Rheinland-Pfalz",
      "amtsgericht": "Amtsgericht Zweibrücken",
      "registernummer": "HRB 23046",
      "registerart": "HRB",
      "company_name": "Knierim GmbH",
      "company_seat": "Pirmasens",
      "details": "28.02.2025 (Bekanntmachungsdatum)\n\nRheinland-Pfalz Amtsgericht Zweibrücken HRB 23046\nLöschungsankündigung\n\nKnierim GmbH\nGesellschaft mit beschränkter Haftung\nPirmasens\n\nDas Registergericht beabsichtigt die Gesellschaft von Amts wegen nach § 394 FamFG zu löschen. Die Frist zur Erhebung eines Widerspruchs ist auf einen Monat festgesetzt."
    },
    {
      "date": "2025-02-28",
      "id": "102600",
      "original_text": "Registerbekanntmachung nach dem Umwandlungsgesetz\nRheinland-Pfalz Amtsgericht Ludwigshafen a.Rhein (Ludwigshafen) HRA 60704\nNarconet Praxisklinik GmbH & Co. KG – Ludwigshafen",
      "type": "Registerbekanntmachung nach dem Umwandlungsgesetz",
      "state": "Rheinland-Pfalz",
      "amtsgericht": "Amtsgericht Ludwigshafen a.Rhein (Ludwigshafen)",
      "registernummer": "HRA 60704",
      "registerart": "HRA",
      "company_name": "Narconet Praxisklinik GmbH & Co. KG",
      "company_seat": "Ludwigshafen",
      "details": "28.02.2025 (Bekanntmachungsdatum)\n\nRheinland-Pfalz Amtsgericht Ludwigshafen a.Rhein (Ludwigshafen) HRA 60704\nRegisterbekanntmachung nach dem Umwandlungsgesetz 28.02.2025 (Eintragungsdatum)\n\nNarconet Praxisklinik GmbH & Co. KG\nKommanditgesellschaft\nLudwigshafen\n\nAls nicht eingetragen wird veröffentlicht: Den Gläubigern der an der Verschmelzung beteiligten Rechtsträger ist, wenn sie binnen sechs Monaten nach dem Tag, an dem die Eintragung der Verschmelzung in das Register des Sitzes desjenigen Rechtsträgers, dessen Gläubiger sie sind, nach § 19 Abs. 3 UmwG als bekannt gemacht gilt, ihren Anspruch nach Grund und Höhe schriftlich anmelden, Sicherheit zu leisten, soweit sie nicht Befriedigung verlangen können. Dieses Recht steht den Gläubigern jedoch nur zu, wenn sie glaubhaft machen, dass durch die Verschmelzung die Erfüllung der Forderung gefährdet wird."
    },
    {
      "date": "2025-02-28",
      "id": "102601",
      "original_text": "Registerbekanntmachung nach dem Umwandlungsgesetz\nRheinland-Pfalz Amtsgericht Kaiserslautern HRB 32917\nHoko Geschäftsführungs-GmbH – Konken",
      "type": "Registerbekanntmachung nach dem Umwandlungsgesetz",
      "state": "Rheinland-Pfalz",
      "amtsgericht": "Amtsgericht Kaiserslautern",
      "registernummer": "HRB 32917",
      "registerart": "HRB",
      "company_name": "Hoko Geschäftsführungs-GmbH",
      "company_seat": "Konken",
      "details": "28.02.2025 (Bekanntmachungsdatum)\n\nRheinland-Pfalz Amtsgericht Kaiserslautern HRB 32917\nRegisterbekanntmachung nach dem Umwandlungsgesetz 28.02.2025 (Eintragungsdatum)\n\nHoko Geschäftsführungs-GmbH\nGesellschaft mit beschränkter Haftung\nKonken\n\nAls nicht eingetragen wird veröffentlicht: Den Gläubigern der an der Verschmelzung beteiligten Rechtsträger ist, wenn sie binnen sechs Monaten nach dem Tag, an dem die Eintragung der Verschmelzung in das Register des Sitzes desjenigen Rechtsträgers,dessen Gläubiger sie sind, nach § 19 Abs. 3 UmwG als bekannt gemacht gilt, ihren Anspruch nach Grund und Höhe schriftlich anmelden, Sicherheit zu leisten, soweit sie nicht Befriedigung verlangen können. Dieses Recht steht den Gläubigern jedoch nur zu, wenn sie glaubhaft machen, dass durch die Verschmelzung die Erfüllung der Forderung gefährdet wird."
    },
    {
      "date": "2025-02-28",
      "id": "102602",
      "original_text": "Einreichung neuer Dokumente\nRheinland-Pfalz Amtsgericht Ludwigshafen a.Rhein (Ludwigshafen) HRB 42491\nGemeindewerke Haßloch GmbH – Haßloch",
      "type": "Einreichung neuer Dokumente",
      "state": "Rheinland-Pfalz",
      "amtsgericht": "Amtsgericht Ludwigshafen a.Rhein (Ludwigshafen)",
      "registernummer": "HRB 42491",
      "registerart": "HRB",
      "company_name": "Gemeindewerke Haßloch GmbH",
      "company_seat": "Haßloch",
      "details": "28.02.2025 (Bekanntmachungsdatum)\n\nRheinland-Pfalz Amtsgericht Ludwigshafen a.Rhein (Ludwigshafen) HRB 42491\nEinreichung neuer Dokumente\n\nGemeindewerke Haßloch GmbH\nGesellschaft mit beschränkter Haftung\nHaßloch\n\nDem Registergericht ist eine Liste der Mitglieder des Aufsichtsrates eingereicht worden."
    },
    {
      "date": "2025-02-28",
      "id": "102603",
      "original_text": "Registerbekanntmachung nach dem Umwandlungsgesetz\nRheinland-Pfalz Amtsgericht Ludwigshafen a.Rhein (Ludwigshafen) GsR 191\nnarconet rhein-neckar überörtliche Berufsausübungsgemeinschaft Dr. med. Anette Neumeister, Dr. med. Michael Hahn, Dr. med. Jens Schröter, Dr. med. Thomas Friedemann und Dr. med. Volker Mayer eGbR – Ludwigshafen am Rhein",
      "type": "Registerbekanntmachung nach dem Umwandlungsgesetz",
      "state": "Rheinland-Pfalz",
      "amtsgericht": "Amtsgericht Ludwigshafen a.Rhein (Ludwigshafen)",
      "registernummer": "GsR 191",
      "registerart": "GsR",
      "company_name": "narconet rhein-neckar überörtliche Berufsausübungsgemeinschaft Dr. med. Anette Neumeister, Dr. med. Michael Hahn, Dr. med. Jens Schröter, Dr. med. Thomas Friedemann und Dr. med. Volker Mayer eGbR",
      "company_seat": "Ludwigshafen am Rhein",
      "details": "28.02.2025 (Bekanntmachungsdatum)\n\nRheinland-Pfalz Amtsgericht Ludwigshafen a.Rhein (Ludwigshafen) GsR 191\nRegisterbekanntmachung nach dem Umwandlungsgesetz 28.02.2025 (Eintragungsdatum)\n\nnarconet rhein-neckar überörtliche Berufsausübungsgemeinschaft Dr. med. Anette Neumeister, Dr. med. Michael Hahn, Dr. med. Jens Schröter, Dr. med. Thomas Friedemann und Dr. med. Volker Mayer eGbR\nGesellschaft bürgerlichen Rechts\nLudwigshafen am Rhein\n\nAls nicht eingetragen wird veröffentlicht: Den Gläubigern der an der Verschmelzung beteiligten Rechtsträger ist, wenn sie binnen sechs Monaten nach dem Tag, an dem die Eintragung der Verschmelzung in das Register des Sitzes desjenigen Rechtsträgers, dessen Gläubiger sie sind, nach § 19 Abs. 3 UmwG als bekannt gemacht gilt, ihren Anspruch nach Grund und Höhe schriftlich anmelden, Sicherheit zu leisten, soweit sie nicht Befriedigung verlangen können. Dieses Recht steht den Gläubigern jedoch nur zu, wenn sie glaubhaft machen, dass durch die Verschmelzung die Erfüllung der Forderung gefährdet wird."
    },
    {
      "date": "2025-02-28",
      "id": "102604",
      "original_text": "Registerbekanntmachung nach dem Umwandlungsgesetz\nRheinland-Pfalz Amtsgericht Kaiserslautern HRB 32933\nHollinger Geschäftsführungs GmbH – Konken",
      "type": "Registerbekanntmachung nach dem Umwandlungsgesetz",
      "state": "Rheinland-Pfalz",
      "amtsgericht": "Amtsgericht Kaiserslautern",
      "registernummer": "HRB 32933",
      "registerart": "HRB",
      "company_name": "Hollinger Geschäftsführungs GmbH",
      "company_seat": "Konken",
      "details": "28.02.2025 (Bekanntmachungsdatum)\n\nRheinland-Pfalz Amtsgericht Kaiserslautern HRB 32933\nRegisterbekanntmachung nach dem Umwandlungsgesetz 28.02.2025 (Eintragungsdatum)\n\nHollinger Geschäftsführungs GmbH\nGesellschaft mit beschränkter Haftung\nKonken\n\nAls nicht eingetragen wird veröffentlicht: Den Gläubigern der an der Verschmelzung beteiligten Rechtsträger ist, wenn sie binnen sechs Monaten nach dem Tag, an dem die Eintragung der Verschmelzung in das Register des Sitzes desjenigen Rechtsträgers,dessen Gläubiger sie sind, nach § 19 Abs. 3 UmwG als bekannt gemacht gilt, ihren Anspruch nach Grund und Höhe schriftlich anmelden, Sicherheit zu leisten, soweit sie nicht Befriedigung verlangen können. Dieses Recht steht den Gläubigern jedoch nur zu, wenn sie glaubhaft machen, dass durch die Verschmelzung die Erfüllung der Forderung gefährdet wird."
    },
    {
      "date": "2025-02-28",
      "id": "102605",
      "original_text": "Löschungsankündigung\nNordrhein-Westfalen Amtsgericht Recklinghausen VR 1088\nBrieftaubenzüchter RV Recklinghausen-Suderwich e.V. gegr. 1950 – Recklinghausen",
      "type": "Löschungsankündigung",
      "state": "Nordrhein-Westfalen",
      "amtsgericht": "Amtsgericht Recklinghausen",
      "registernummer": "VR 1088",
      "registerart": "VR",
      "company_name": "Brieftaubenzüchter RV Recklinghausen-Suderwich e.V. gegr. 1950",
      "company_seat": "Recklinghausen",
      "details": "28.02.2025 (Bekanntmachungsdatum)\n\nNordrhein-Westfalen Amtsgericht Recklinghausen VR 1088\nLöschungsankündigung\n\nBrieftaubenzüchter RV Recklinghausen-Suderwich e.V. gegr. 1950\neingetragener Verein\nRecklinghausen\n\nDas Registergericht beabsichtigt, den Verein wegen Wegfalls sämtlicher Mitglieder gemäß § 395 FamFG von Amts wegen zu löschen. Die Frist zur Erhebung eines Widerspruchs gegen die beabsichtigte Löschung ist auf drei Monate festgesetzt."
    },
    {
      "date": "2025-02-28",
      "id": "102606",
      "original_text": "Registerbekanntmachung nach dem Umwandlungsgesetz\nNordrhein-Westfalen Amtsgericht Wuppertal HRB 28043\nZWILLING J.A. Henckels Deutschland GmbH – Solingen",
      "type": "Registerbekanntmachung nach dem Umwandlungsgesetz",
      "state": "Nordrhein-Westfalen",
      "amtsgericht": "Amtsgericht Wuppertal",
      "registernummer": "HRB 28043",
      "registerart": "HRB",
      "company_name": "ZWILLING J.A. Henckels Deutschland GmbH",
      "company_seat": "Solingen",
      "details": "28.02.2025 (Bekanntmachungsdatum)\n\nNordrhein-Westfalen Amtsgericht Wuppertal HRB 28043\nRegisterbekanntmachung nach dem Umwandlungsgesetz 28.02.2025 (Eintragungsdatum)\n\nZWILLING J.A. Henckels Deutschland GmbH\nGesellschaft mit beschränkter Haftung\nSolingen\n\nDen Gläubigern der an der Verschmelzung beteiligten Rechtsträger ist, wenn sie binnen sechs Monaten nach dem Tag, an dem die Eintragung der Verschmelzung in das Register des Sitzes desjenigen Rechtsträgers, dessen Gläubiger sie sind, nach § 19 Absatz 3 UmwG als bekanntgemacht gilt, ihren Anspruch nach Grund und Höhe schriftlich anmelden, Sicherheit zu leisten, soweit sie nicht Befriedigung verlangen können. Dieses Recht steht den Gläubigern jedoch nur zu, wenn sie glaubhaft machen, dass durch die Verschmelzung die Erfüllung ihrer Forderung gefährdet wird."
    },
    {
      "date": "2025-02-28",
      "id": "102607",
      "original_text": "Löschungsankündigung\nNordrhein-Westfalen Amtsgericht Düsseldorf HRB 95456\nEuromike GmbH – Düsseldorf",
      "type": "Löschungsankündigung",
      "state": "Nordrhein-Westfalen",
      "amtsgericht": "Amtsgericht Düsseldorf",
      "registernummer": "HRB 95456",
      "registerart": "HRB",
      "company_name": "Euromike GmbH",
      "company_seat": "Düsseldorf",
      "details": "28.02.2025 (Bekanntmachungsdatum)\n\nNordrhein-Westfalen Amtsgericht Düsseldorf HRB 95456\nLöschungsankündigung\n\nEuromike GmbH\nGesellschaft mit beschränkter Haftung\nDüsseldorf\n\nDas Registergericht beabsichtigt die Gesellschaft von Amts wegen nach § 394 Abs. 1 FamFG zu löschen. Die Frist zur Erhebung eines Widerspruchs ist auf 3 Wochen festgesetzt.\n\nRechtsbehelfsbelehrung:\nDas Widerspruchsrecht steht jedem zu, der an der Unterlassung der Löschung ein berechtigtes Interesse hat. Der Widerspruch ist bei dem Amtsgericht Düsseldorf -Registergericht-, Werdener Straße 1, 40227 Düsseldorf schriftlich in deutscher Sprache oder zur Niederschrift der Geschäftsstelle einzulegen. Der Widerspruch kann auch zur Niederschrift der Geschäftsstelle eines jeden Amtsgerichtes abgegeben werden. Die Einlegung ist auch durch Übertragung eines elektronischen Dokuments an die elektronische Poststelle des Gerichts möglich. Das elektronische Dokument muss für die Bearbeitung durch das Gericht geeignet und mit einer qualifizierten elektronischen Signatur der verantwortenden Person versehen sein oder von der verantwortenden Person signiert und auf einem sicheren Übermittlungsweg gemäß § 130a ZPO nach näherer Maßgabe der Verordnung über die technischen Rahmenbedingungen des elektronischen Rechtsverkehrs und über das besondere elektronische Behördenpostfach (BGBl. I, S.3803) eingereicht werden. Weitere Informationen erhalten Sie auf der Internetseite www.justiz.de.\nDer Widerspruch muss spätestens innerhalb der gesetzten Frist nach dem Datum der Bekanntmachung der Löschungsankündigung bei dem Amtsgericht - Registergericht - Düsseldorf eingegangen sein.  Dies gilt auch dann, wenn der Widerspruch zur Niederschrift der Geschäftsstelle eines anderen Amtsgerichtes abgegeben wurde. Die Frist beginnt mit dem Tage der Bekanntmachung der Löschungsankündigung in dem für die Bekanntmachung der Eintragungen in das Handelsregister bestimmten elektronischen Informations- und Kommunikationssystem nach § 10 des Handelsgesetzbuches. Fällt das Ende der Frist auf einen Sonntag, einen allgemeinen Feiertag oder Sonnabend, so endet die Frist mit Ablauf des nächsten Werktages.\nDer Widerspruch muss die Bezeichnung der angefochtenen Löschungsankündigung sowie die Erklärung enthalten, dass Widerspruch gegen diese Löschungsankündigung eingelegt wird. Er ist zu unterzeichnen und soll begründet werden."
    },
    {
      "date": "2025-02-28",
      "id": "102608",
      "original_text": "Registerbekanntmachung nach dem Umwandlungsgesetz\nNordrhein-Westfalen Amtsgericht Düsseldorf HRB 81687\nMAXIMITY GmbH – Düsseldorf",
      "type": "Registerbekanntmachung nach dem Umwandlungsgesetz",
      "state": "Nordrhein-Westfalen",
      "amtsgericht": "Amtsgericht Düsseldorf",
      "registernummer": "HRB 81687",
      "registerart": "HRB",
      "company_name": "MAXIMITY GmbH",
      "company_seat": "Düsseldorf",
      "details": "28.02.2025 (Bekanntmachungsdatum)\n\nNordrhein-Westfalen Amtsgericht Düsseldorf HRB 81687\nRegisterbekanntmachung nach dem Umwandlungsgesetz 28.02.2025 (Eintragungsdatum)\n\nMAXIMITY GmbH\nGesellschaft mit beschränkter Haftung\nDüsseldorf\n\nDen Gläubigern der an der formwechselnden Umwandlung beteiligten Rechtsträger ist, wenn sie binnen sechs Monaten nach dem Tag, an dem die Eintragung der formwechselnden Umwandlung in das Register des Sitzes desjenigen Rechtsträgers, dessen Gläubiger sie sind, nach § 19 Absatz 3 UmwG als bekanntgemacht gilt, ihren Anspruch nach Grund und Höhe schriftlich anmelden, Sicherheit zu leisten, soweit sie nicht Befriedigung verlangen können. Dieses Recht steht den Gläubigern jedoch nur zu, wenn sie glaubhaft machen, dass durch die formwechselnden Umwandlung die Erfüllung ihrer Forderung gefährdet wird."
    },
    {
      "date": "2025-02-28",
      "id": "102609",
      "original_text": "Löschungsankündigung\nNordrhein-Westfalen Amtsgericht Kleve HRB 17851\nJanSen Company GmbH – Rheinberg",
      "type": "Löschungsankündigung",
      "state": "Nordrhein-Westfalen",
      "amtsgericht": "Amtsgericht Kleve",
      "registernummer": "HRB 17851",
      "registerart": "HRB",
      "company_name": "JanSen Company GmbH",
      "company_seat": "Rheinberg",
      "details": "28.02.2025 (Bekanntmachungsdatum)\n\nNordrhein-Westfalen Amtsgericht Kleve HRB 17851\nLöschungsankündigung\n\nJanSen Company GmbH\nGesellschaft mit beschränkter Haftung\nRheinberg\n\nDas Registergericht beabsichtigt die Gesellschaft von Amts wegen nach § 394 FamFG zu löschen. Die Frist zur Erhebung eines Widerspruchs ist auf einen Monat festgesetzt."
    },
    {
      "date": "2025-02-28",
      "id": "102610",
      "original_text": "Löschungsankündigung\nNordrhein-Westfalen Amtsgericht Siegen HRB 9364\nKSP Verwaltungsgesellschaft mbH – Siegen",
      "type": "Löschungsankündigung",
      "state": "Nordrhein-Westfalen",
      "amtsgericht": "Amtsgericht Siegen",
      "registernummer": "HRB 9364",
      "registerart": "HRB",
      "company_name": "KSP Verwaltungsgesellschaft mbH",
      "company_seat": "Siegen",
      "details": "28.02.2025 (Bekanntmachungsdatum)\n\nNordrhein-Westfalen Amtsgericht Siegen HRB 9364\nLöschungsankündigung 24.05.2024 (Eintragungsdatum)\n\nKSP Verwaltungsgesellschaft mbH\nGesellschaft mit beschränkter Haftung\nSiegen\n\nDas Registergericht beabsichtigt die Gesellschaft von Amts wegen nach § 394 FamFG zu löschen. Die Frist zur Erhebung eines Widerspruchs ist auf drei Monate festgesetzt."
    },
    {
      "date": "2025-02-28",
      "id": "102611",
      "original_text": "Registerbekanntmachung nach dem Umwandlungsgesetz\nNordrhein-Westfalen Amtsgericht Düsseldorf HRB 43160\nSchnitzler Gesellschaft mit beschränkter Haftung – Ratingen",
      "type": "Registerbekanntmachung nach dem Umwandlungsgesetz",
      "state": "Nordrhein-Westfalen",
      "amtsgericht": "Amtsgericht Düsseldorf",
      "registernummer": "HRB 43160",
      "registerart": "HRB",
      "company_name": "Schnitzler Gesellschaft mit beschränkter Haftung",
      "company_seat": "Ratingen",
      "details": "28.02.2025 (Bekanntmachungsdatum)\n\nNordrhein-Westfalen Amtsgericht Düsseldorf HRB 43160\nRegisterbekanntmachung nach dem Umwandlungsgesetz 28.02.2025 (Eintragungsdatum)\n\nSchnitzler Gesellschaft mit beschränkter Haftung\nGesellschaft mit beschränkter Haftung\nRatingen\n\nDen Gläubigern der an der Verschmelzung beteiligten Rechtsträger ist, wenn sie binnen sechs Monaten nach dem Tag, an dem die Eintragung der Verschmelzung in das Register des Sitzes desjenigen Rechtsträgers, dessen Gläubiger sie sind, nach § 19 Absatz 3 UmwG als bekanntgemacht gilt, ihren Anspruch nach Grund und Höhe schriftlich anmelden, Sicherheit zu leisten, soweit sie nicht Befriedigung verlangen können. Dieses Recht steht den Gläubigern jedoch nur zu, wenn sie glaubhaft machen, dass durch die Verschmelzung die Erfüllung ihrer Forderung gefährdet wird."
    },
    {
      "date": "2025-02-28",
      "id": "102612",
      "original_text": "Registerbekanntmachung nach dem Umwandlungsgesetz\nNordrhein-Westfalen Amtsgericht Dortmund HRA 19209\nSchwanitz e.K. – Dortmund",
      "type": "Registerbekanntmachung nach dem Umwandlungsgesetz",
      "state": "Nordrhein-Westfalen",
      "amtsgericht": "Amtsgericht Dortmund",
      "registernummer": "HRA 19209",
      "registerart": "HRA",
      "company_name": "Schwanitz e.K.",
      "company_seat": "Dortmund",
      "details": "28.02.2025 (Bekanntmachungsdatum)\n\nNordrhein-Westfalen Amtsgericht Dortmund HRA 19209\nRegisterbekanntmachung nach dem Umwandlungsgesetz 28.02.2025 (Eintragungsdatum)\n\nSchwanitz e.K.\nEinzelkaufmann / Einzelkauffrau\nDortmund\n\nDen Gläubigern der an der Ausgliederung beteiligten Rechtsträger ist, wenn sie binnen sechs Monaten nach dem Tag, an dem die Eintragung der Ausgliederung in das Register des Sitzes desjenigen Rechtsträgers, dessen Gläubiger sie sind, nach § 19 Absatz 3 UmwG als bekanntgemacht gilt, ihren Anspruch nach Grund und Höhe schriftlich anmelden, Sicherheit zu leisten, soweit sie nicht Befriedigung verlangen können. Dieses Recht steht den Gläubigern jedoch nur zu, wenn sie glaubhaft machen, dass durch die Ausgliederung die Erfüllung ihrer Forderung gefährdet wird."
    },
    {
      "date": "2025-02-28",
      "id": "102613",
      "original_text": "Löschungsankündigung\nNordrhein-Westfalen Amtsgericht Kleve HRB 16764\nWomoPark Xanten UG (haftungsbeschränkt) – Xanten",
      "type": "Löschungsankündigung",
      "state": "Nordrhein-Westfalen",
      "amtsgericht": "Amtsgericht Kleve",
      "registernummer": "HRB 16764",
      "registerart": "HRB",
      "company_name": "WomoPark Xanten UG (haftungsbeschränkt)",
      "company_seat": "Xanten",
      "details": "28.02.2025 (Bekanntmachungsdatum)\n\nNordrhein-Westfalen Amtsgericht Kleve HRB 16764\nLöschungsankündigung\n\nWomoPark Xanten UG (haftungsbeschränkt)\nGesellschaft mit beschränkter Haftung\nXanten\n\nDas Registergericht beabsichtigt die Gesellschaft von Amts wegen nach § 394 FamFG zu löschen. Die Frist zur Erhebung eines Widerspruchs ist auf einen Monat festgesetzt."
    },
    {
      "date": "2025-02-28",
      "id": "102614",
      "original_text": "Registerbekanntmachung nach dem Umwandlungsgesetz\nNordrhein-Westfalen Amtsgericht Wuppertal HRB 19323\nZWILLING Trading GmbH – Solingen",
      "type": "Registerbekanntmachung nach dem Umwandlungsgesetz",
      "state": "Nordrhein-Westfalen",
      "amtsgericht": "Amtsgericht Wuppertal",
      "registernummer": "HRB 19323",
      "registerart": "HRB",
      "company_name": "ZWILLING Trading GmbH",
      "company_seat": "Solingen",
      "details": "28.02.2025 (Bekanntmachungsdatum)\n\nNordrhein-Westfalen Amtsgericht Wuppertal HRB 19323\nRegisterbekanntmachung nach dem Umwandlungsgesetz 28.02.2025 (Eintragungsdatum)\n\nZWILLING Trading GmbH\nGesellschaft mit beschränkter Haftung\nSolingen\n\nDen Gläubigern der an der Verschmelzung beteiligten Rechtsträger ist, wenn sie binnen sechs Monaten nach dem Tag, an dem die Eintragung der Verschmelzung in das Register des Sitzes desjenigen Rechtsträgers, dessen Gläubiger sie sind, nach § 19 Absatz 3 UmwG als bekanntgemacht gilt, ihren Anspruch nach Grund und Höhe schriftlich anmelden, Sicherheit zu leisten, soweit sie nicht Befriedigung verlangen können. Dieses Recht steht den Gläubigern jedoch nur zu, wenn sie glaubhaft machen, dass durch die Verschmelzung die Erfüllung ihrer Forderung gefährdet wird."
    },
    {
      "date": "2025-02-28",
      "id": "102615",
      "original_text": "Löschungsankündigung\nNordrhein-Westfalen Amtsgericht Köln HRB 82939\nLöwe Globalhandel Import & Export GmbH – Köln",
      "type": "Löschungsankündigung",
      "state": "Nordrhein-Westfalen",
      "amtsgericht": "Amtsgericht Köln",
      "registernummer": "HRB 82939",
      "registerart": "HRB",
      "company_name": "Löwe Globalhandel Import & Export GmbH",
      "company_seat": "Köln",
      "details": "28.02.2025 (Bekanntmachungsdatum)\n\nNordrhein-Westfalen Amtsgericht Köln HRB 82939\nLöschungsankündigung\n\nLöwe Globalhandel Import & Export GmbH\nGesellschaft mit beschränkter Haftung\nKöln\n\nDas Registergericht beabsichtigt die Gesellschaft von Amts wegen nach § 394 FamFG zu löschen. Die Frist zur Erhebung eines Widerspruchs ist auf einen Monat festgesetzt."
    },
    {
      "date": "2025-02-28",
      "id": "102616",
      "original_text": "Sonstige Registerbekanntmachung\nNordrhein-Westfalen Amtsgericht Köln HRB 103919\nSysfacts AG – Köln",
      "type": "Sonstige Registerbekanntmachung",
      "state": "Nordrhein-Westfalen",
      "amtsgericht": "Amtsgericht Köln",
      "registernummer": "HRB 103919",
      "registerart": "HRB",
      "company_name": "Sysfacts AG",
      "company_seat": "Köln",
      "details": "28.02.2025 (Bekanntmachungsdatum)\n\nNordrhein-Westfalen Amtsgericht Köln HRB 103919\nSonstige Registerbekanntmachung\n\nSysfacts AG\nAktiengesellschaft\nKöln\n\nDem Registergericht ist eine Liste der Mitglieder des Aufsichtsrates eingereicht worden."
    },
    {
      "date": "2025-02-28",
      "id": "102617",
      "original_text": "Löschungsankündigung\nNordrhein-Westfalen Amtsgericht Dortmund HRB 32946\nUgur GmbH – Dortmund",
      "type": "Löschungsankündigung",
      "state": "Nordrhein-Westfalen",
      "amtsgericht": "Amtsgericht Dortmund",
      "registernummer": "HRB 32946",
      "registerart": "HRB",
      "company_name": "Ugur GmbH",
      "company_seat": "Dortmund",
      "details": "28.02.2025 (Bekanntmachungsdatum)\n\nNordrhein-Westfalen Amtsgericht Dortmund HRB 32946\nLöschungsankündigung 28.02.2025 (Eintragungsdatum)\n\nUgur GmbH\nGesellschaft mit beschränkter Haftung\nDortmund\n\nDas Registergericht beabsichtigt die Gesellschaft von Amts wegen nach § 394 FamFG zu löschen. Die Frist zur Erhebung eines Widerspruchs ist auf zwei Monate festgesetzt."
    },
    {
      "date": "2025-02-28",
      "id": "102618",
      "original_text": "Registerbekanntmachung nach dem Umwandlungsgesetz\nNordrhein-Westfalen Amtsgericht Münster HRB 22029\nLIEBERGE GmbH – Warendorf",
      "type": "Registerbekanntmachung nach dem Umwandlungsgesetz",
      "state": "Nordrhein-Westfalen",
      "amtsgericht": "Amtsgericht Münster",
      "registernummer": "HRB 22029",
      "registerart": "HRB",
      "company_name": "LIEBERGE GmbH",
      "company_seat": "Warendorf",
      "details": "28.02.2025 (Bekanntmachungsdatum)\n\nNordrhein-Westfalen Amtsgericht Münster HRB 22029\nRegisterbekanntmachung nach dem Umwandlungsgesetz 28.02.2025 (Eintragungsdatum)\n\nLIEBERGE GmbH\nGesellschaft mit beschränkter Haftung\nWarendorf\n\nDen Gläubigern der an der Ausgliederung beteiligten Rechtsträger ist, wenn sie binnen sechs Monaten nach dem Tag, an dem die Eintragung der Ausgliederung in das Register des Sitzes desjenigen Rechtsträgers, dessen Gläubiger sie sind, nach § 19 Absatz 3 UmwG als bekanntgemacht gilt, ihren Anspruch nach Grund und Höhe schriftlich anmelden, Sicherheit zu leisten, soweit sie nicht Befriedigung verlangen können. Dieses Recht steht den Gläubigern jedoch nur zu, wenn sie glaubhaft machen, dass durch die Ausgliederung die Erfüllung ihrer Forderung gefährdet wird."
    },
    {
      "date": "2025-02-28",
      "id": "102619",
      "original_text": "Sonstige Registerbekanntmachung\nThüringen Amtsgericht Eisenach VR 311068\nKulturverein Eisenach e.V. – Eisenach",
      "type": "Sonstige Registerbekanntmachung",
      "state": "Thüringen",
      "amtsgericht": "Amtsgericht Eisenach",
      "registernummer": "VR 311068",
      "registerart": "VR",
      "company_name": "Kulturverein Eisenach e.V.",
      "company_seat": "Eisenach",
      "details": "28.02.2025 (Bekanntmachungsdatum)\n\nThüringen Amtsgericht Eisenach VR 311068\nSonstige Registerbekanntmachung 28.02.2025 (Eintragungsdatum)\n\nKulturverein Eisenach e.V.\neingetragener Verein\nEisenach\n\nKulturverein Eisenach e.V. Neugründung am 20.10.2024"
    },
    {
      "date": "2025-02-28",
      "id": "102620",
      "original_text": "Registerbekanntmachung nach dem Umwandlungsgesetz\nThüringen Amtsgericht Jena HRB 514043\nCMOS IR GmbH – Erfurt",
      "type": "Registerbekanntmachung nach dem Umwandlungsgesetz",
      "state": "Thüringen",
      "amtsgericht": "Amtsgericht Jena",
      "registernummer": "HRB 514043",
      "registerart": "HRB",
      "company_name": "CMOS IR GmbH",
      "company_seat": "Erfurt",
      "details": "28.02.2025 (Bekanntmachungsdatum)\n\nThüringen Amtsgericht Jena HRB 514043\nRegisterbekanntmachung nach dem Umwandlungsgesetz 28.02.2025 (Eintragungsdatum)\n\nCMOS IR GmbH\nGesellschaft mit beschränkter Haftung\nErfurt\n\nNicht eingetragen: Den Gläubigern der an der Verschmelzung beteiligten Rechtsträger, ist wenn sie binnen sechs Monaten nach dem Tag, an dem die Eintragung der Verschmelzung in das Register des Sitzes desjenigen Rechtsträgers, dessen Gläubiger sie sind,  nach § 19 Abs. 3 UmwG als bekanntgemacht gilt, ihren Anspruch nach Grund und Höhe schriftlich anmelden, Sicherheit zu leisten, soweit sie nicht Befriedigung verlangen können. Dieses Recht steht ihnen jedoch nur zu, wenn sie glaubhaft machen, daß durch die Verschmelzung die Erfüllung ihrer Forderung gefährdet wird."
    },
    {
      "date": "2025-02-28",
      "id": "102621",
      "original_text": "Registerbekanntmachung nach dem Umwandlungsgesetz\nThüringen Amtsgericht Jena HRB 202188\nMicro-Hybrid Electronic GmbH – Hermsdorf",
      "type": "Registerbekanntmachung nach dem Umwandlungsgesetz",
      "state": "Thüringen",
      "amtsgericht": "Amtsgericht Jena",
      "registernummer": "HRB 202188",
      "registerart": "HRB",
      "company_name": "Micro-Hybrid Electronic GmbH",
      "company_seat": "Hermsdorf",
      "details": "28.02.2025 (Bekanntmachungsdatum)\n\nThüringen Amtsgericht Jena HRB 202188\nRegisterbekanntmachung nach dem Umwandlungsgesetz 28.02.2025 (Eintragungsdatum)\n\nMicro-Hybrid Electronic GmbH\nGesellschaft mit beschränkter Haftung\nHermsdorf\n\nNicht eingetragen: Den Gläubigern der an der Verschmelzung beteiligten Rechtsträger, ist wenn sie binnen sechs Monaten nach dem Tag, an dem die Eintragung der Verschmelzung in das Register des Sitzes desjenigen Rechtsträgers, dessen Gläubiger sie sind,  nach § 19 Abs. 3 UmwG als bekanntgemacht gilt, ihren Anspruch nach Grund und Höhe schriftlich anmelden, Sicherheit zu leisten, soweit sie nicht Befriedigung verlangen können. Dieses Recht steht ihnen jedoch nur zu, wenn sie glaubhaft machen, daß durch die Verschmelzung die Erfüllung ihrer Forderung gefährdet wird."
    },
    {
      "date": "2025-02-28",
      "id": "102622",
      "original_text": "Löschungsankündigung\nHessen Amtsgericht Frankfurt am Main HRB 90329\nARTEUS AG – Eschborn",
      "type": "Löschungsankündigung",
      "state": "Hessen",
      "amtsgericht": "Amtsgericht Frankfurt am Main",
      "registernummer": "HRB 90329",
      "registerart": "HRB",
      "company_name": "ARTEUS AG",
      "company_seat": "Eschborn",
      "details": "28.02.2025 (Bekanntmachungsdatum)\n\nHessen Amtsgericht Frankfurt am Main HRB 90329\nLöschungsankündigung\n\nARTEUS AG\nAktiengesellschaft\nEschborn\n\nDas Registergericht beabsichtigt die im Handelsregister eingetragene Gesellschaft von Amts wegen nach § 394 FamFG zu löschen. Hiergegen kann innerhalb eines Zeitraumes von 1 Monat nach dieser Veröffentlichung Widerspruch beim Amtsgericht Frankfurt am Main eingelegt werden."
    },
    {
      "date": "2025-02-28",
      "id": "102623",
      "original_text": "Löschungsankündigung\nHessen Amtsgericht Frankfurt am Main HRB 103958\nACES GmbH – Kriftel",
      "type": "Löschungsankündigung",
      "state": "Hessen",
      "amtsgericht": "Amtsgericht Frankfurt am Main",
      "registernummer": "HRB 103958",
      "registerart": "HRB",
      "company_name": "ACES GmbH",
      "company_seat": "Kriftel",
      "details": "28.02.2025 (Bekanntmachungsdatum)\n\nHessen Amtsgericht Frankfurt am Main HRB 103958\nLöschungsankündigung\n\nACES GmbH\nGesellschaft mit beschränkter Haftung\nKriftel\n\nDas Registergericht beabsichtigt die im Handelsregister eingetragene Gesellschaft von Amts wegen nach § 394 FamFG zu löschen. Die Frist zur Erhebung eines Widerspruchs gegen die beabsichtigte Löschung wird auf 1 Monat festgesetzt."
    },
    {
      "date": "2025-02-28",
      "id": "102624",
      "original_text": "Löschungsankündigung\nHessen Amtsgericht Frankfurt am Main HRB 125391\nDILE Management and Advice UG (haftungsbeschränkt) – Eschborn",
      "type": "Löschungsankündigung",
      "state": "Hessen",
      "amtsgericht": "Amtsgericht Frankfurt am Main",
      "registernummer": "HRB 125391",
      "registerart": "HRB",
      "company_name": "DILE Management and Advice UG (haftungsbeschränkt)",
      "company_seat": "Eschborn",
      "details": "28.02.2025 (Bekanntmachungsdatum)\n\nHessen Amtsgericht Frankfurt am Main HRB 125391\nLöschungsankündigung\n\nDILE Management and Advice UG (haftungsbeschränkt)\nGesellschaft mit beschränkter Haftung\nEschborn\n\nDas Registergericht beabsichtigt die im Handelsregister eingetragene Gesellschaft von Amts wegen nach § 394 FamFG zu löschen. Die Frist zur Erhebung eines Widerspruchs gegen die beabsichtigte Löschung wird auf 1 Monat festgesetzt."
    },
    {
      "date": "2025-02-28",
      "id": "102625",
      "original_text": "Sonstige Registerbekanntmachung\nHessen Amtsgericht Limburg VR 1533\nMännergesangverein \"Harmonie\" Laubuseschbach e.V. – Weilmünster-Laubuseschbach",
      "type": "Sonstige Registerbekanntmachung",
      "state": "Hessen",
      "amtsgericht": "Amtsgericht Limburg",
      "registernummer": "VR 1533",
      "registerart": "VR",
      "company_name": "Männergesangverein \"Harmonie\" Laubuseschbach e.V.",
      "company_seat": "Weilmünster-Laubuseschbach",
      "details": "28.02.2025 (Bekanntmachungsdatum)\n\nHessen Amtsgericht Limburg VR 1533\nSonstige Registerbekanntmachung 28.02.2025 (Eintragungsdatum)\n\nMännergesangverein \"Harmonie\" Laubuseschbach e.V.\neingetragener Verein\nWeilmünster-Laubuseschbach\n\nDer Verein ist aufgelöst."
    },
    {
      "date": "2025-02-28",
      "id": "102626",
      "original_text": "Einreichung neuer Dokumente\nHessen Amtsgericht Frankfurt am Main HRB 54072\nMerz Pharma GmbH & Co. KGaA – Frankfurt am Main",
      "type": "Einreichung neuer Dokumente",
      "state": "Hessen",
      "amtsgericht": "Amtsgericht Frankfurt am Main",
      "registernummer": "HRB 54072",
      "registerart": "HRB",
      "company_name": "Merz Pharma GmbH & Co. KGaA",
      "company_seat": "Frankfurt am Main",
      "details": "28.02.2025 (Bekanntmachungsdatum)\n\nHessen Amtsgericht Frankfurt am Main HRB 54072\nEinreichung neuer Dokumente\n\nMerz Pharma GmbH & Co. KGaA\nKommanditgesellschaft auf Aktien\nFrankfurt am Main\n\nDurch eine Änderung in den Personen der Aufsichtsratsmitglieder ist eine Liste der Mitglieder des Aufsichtsrates zum Handelsregister eingereicht worden."
    },
    {
      "date": "2025-02-28",
      "id": "102627",
      "original_text": "Löschungsankündigung\nHessen Amtsgericht Darmstadt HRB 96533\nDeSino International GmbH – Mörfelden-Walldorf",
      "type": "Löschungsankündigung",
      "state": "Hessen",
      "amtsgericht": "Amtsgericht Darmstadt",
      "registernummer": "HRB 96533",
      "registerart": "HRB",
      "company_name": "DeSino International GmbH",
      "company_seat": "Mörfelden-Walldorf",
      "details": "28.02.2025 (Bekanntmachungsdatum)\n\nHessen Amtsgericht Darmstadt HRB 96533\nLöschungsankündigung\n\nDeSino International GmbH\nGesellschaft mit beschränkter Haftung\nMörfelden-Walldorf\n\nDas Registergericht beabsichtigt die im Handelsregister eingetragene Gesellschaft von Amts wegen nach § 394 FamFG zu löschen. Die Frist zur Erhebung eines Widerspruchs gegen die beabsichtigte Löschung wird auf 3 Monate festgesetzt."
    },
    {
      "date": "2025-02-28",
      "id": "102628",
      "original_text": "Löschungsankündigung\nHessen Amtsgericht Friedberg HRB 10414\nNattermann-Consulting GmbH – Bad Nauheim",
      "type": "Löschungsankündigung",
      "state": "Hessen",
      "amtsgericht": "Amtsgericht Friedberg",
      "registernummer": "HRB 10414",
      "registerart": "HRB",
      "company_name": "Nattermann-Consulting GmbH",
      "company_seat": "Bad Nauheim",
      "details": "28.02.2025 (Bekanntmachungsdatum)\n\nHessen Amtsgericht Friedberg HRB 10414\nLöschungsankündigung\n\nNattermann-Consulting GmbH\nGesellschaft mit beschränkter Haftung\nBad Nauheim\n\nDas Registergericht beabsichtigt die im Handelsregister eingetragene Gesellschaft von Amts wegen nach § 394 FamFG zu löschen. Die Frist zur Erhebung eines Widerspruchs gegen die beabsichtigte Löschung wird auf 3 Monate festgesetzt."
    },
    {
      "date": "2025-02-28",
      "id": "102629",
      "original_text": "Sonstige Registerbekanntmachung\nHessen Amtsgericht Wetzlar VR 971\nHeimat- und Verschönerungsverein Leun e.V. – Leun",
      "type": "Sonstige Registerbekanntmachung",
      "state": "Hessen",
      "amtsgericht": "Amtsgericht Wetzlar",
      "registernummer": "VR 971",
      "registerart": "VR",
      "company_name": "Heimat- und Verschönerungsverein Leun e.V.",
      "company_seat": "Leun",
      "details": "28.02.2025 (Bekanntmachungsdatum)\n\nHessen Amtsgericht Wetzlar VR 971\nSonstige Registerbekanntmachung 28.02.2025 (Eintragungsdatum)\n\nHeimat- und Verschönerungsverein Leun e.V.\neingetragener Verein\nLeun\n\nDer Verein ist aufgelöst."
    },
    {
      "date": "2025-02-28",
      "id": "102630",
      "original_text": "Registerbekanntmachung nach dem Umwandlungsgesetz\nHessen Amtsgericht Wiesbaden GsR 191\niPM-Cloud Hensel und Krauthausen eGbR – Oestrich-Winkel",
      "type": "Registerbekanntmachung nach dem Umwandlungsgesetz",
      "state": "Hessen",
      "amtsgericht": "Amtsgericht Wiesbaden",
      "registernummer": "GsR 191",
      "registerart": "GsR",
      "company_name": "iPM-Cloud Hensel und Krauthausen eGbR",
      "company_seat": "Oestrich-Winkel",
      "details": "28.02.2025 (Bekanntmachungsdatum)\n\nHessen Amtsgericht Wiesbaden GsR 191\nRegisterbekanntmachung nach dem Umwandlungsgesetz 28.02.2025 (Eintragungsdatum)\n\niPM-Cloud Hensel und Krauthausen eGbR\nGesellschaft bürgerlichen Rechts\nOestrich-Winkel\n\nDen Gläubigern der an der formwechselnden Umwandlung beteiligten Rechtsträger ist, wenn sie binnen sechs Monaten nach dem Tag, an dem die Eintragung der formwechselnden Umwandlung in das Register des Sitzes desjenigen Rechtsträgers, dessen Gläubiger sie sind, nach § 201 UmwG bekannt gemacht worden ist, ihren Anspruch nach Grund und Höhe schriftlich anmelden, Sicherheit zu leisten, soweit sie nicht Befriedigung verlangen können. Dieses Recht steht den Gläubigern jedoch nur zu, wenn sie glaubhaft machen, dass durch die formwechselnden Umwandlung die Erfüllung ihrer Forderung gefährdet wird."
    }
  ]
}