{
  "date": "2025-02-18",
  "date_of_scrape": "2025-02-19T04:07:27.828Z",
  "tool_version": "0.2.0",
  "number_of_announcements": 113,
  "announcements": [
    {
      "date": "2025-02-18",
      "id": "101535",
      "original_text": "Löschungsankündigung\nBayern Amtsgericht München HRB 210773\nA.L.S Automobile GmbH – München",
      "type": "Löschungsankündigung",
      "state": "Bayern",
      "amtsgericht": "Amtsgericht München",
      "registernummer": "HRB 210773",
      "registerart": "HRB",
      "company_name": "A.L.S Automobile GmbH",
      "company_seat": "München",
      "details": "18.02.2025 (Bekanntmachungsdatum)\n\nBayern Amtsgericht München HRB 210773\nLöschungsankündigung\n\nA.L.S Automobile GmbH\nGesellschaft mit beschränkter Haftung\nMünchen\n\nDas Registergericht beabsichtigt, die im Handelsregister eingetragene Gesellschaft wegen Vermögenslosigkeit von Amts wegen nach § 394 FamFG zu löschen. Die Frist zur Erhebung eines Widerspruchs ist auf drei Monate festgesetzt."
    },
    {
      "date": "2025-02-18",
      "id": "101536",
      "original_text": "Löschungsankündigung\nBayern Amtsgericht Fürth HRB 18403\nNano International S.A.G. UG (haftungsbeschränkt) – Spardorf",
      "type": "Löschungsankündigung",
      "state": "Bayern",
      "amtsgericht": "Amtsgericht Fürth",
      "registernummer": "HRB 18403",
      "registerart": "HRB",
      "company_name": "Nano International S.A.G. UG (haftungsbeschränkt)",
      "company_seat": "Spardorf",
      "details": "18.02.2025 (Bekanntmachungsdatum)\n\nBayern Amtsgericht Fürth HRB 18403\nLöschungsankündigung\n\nNano International S.A.G. UG (haftungsbeschränkt)\nGesellschaft mit beschränkter Haftung\nSpardorf\n\nDas Registergericht beabsichtigt, die im Handelsregister eingetragene Gesellschaft wegen Vermögenslosigkeit von Amts wegen nach § 394 FamFG zu löschen. Die Frist zur Erhebung eines Widerspruchs ist auf drei Monate festgesetzt."
    },
    {
      "date": "2025-02-18",
      "id": "101537",
      "original_text": "Registerbekanntmachung nach dem Umwandlungsgesetz\nBayern Amtsgericht Kempten (Allgäu) HRB 3992\nReisebüro Reisewelt GmbH – Sonthofen",
      "type": "Registerbekanntmachung nach dem Umwandlungsgesetz",
      "state": "Bayern",
      "amtsgericht": "Amtsgericht Kempten (Allgäu)",
      "registernummer": "HRB 3992",
      "registerart": "HRB",
      "company_name": "Reisebüro Reisewelt GmbH",
      "company_seat": "Sonthofen",
      "details": "18.02.2025 (Bekanntmachungsdatum)\n\nBayern Amtsgericht Kempten (Allgäu) HRB 3992\nRegisterbekanntmachung nach dem Umwandlungsgesetz 16.02.2025 (Eintragungsdatum)\n\nReisebüro Reisewelt GmbH\nGesellschaft mit beschränkter Haftung\nSonthofen\n\nDen Gläubigern der an der Verschmelzung beteiligten Rechtsträger ist, wenn sie binnen sechs Monaten nach dem Tag, an dem die Eintragung der Verschmelzung in das Register des Sitzes desjenigen Rechtsträgers, dessen Gläubiger sie sind, nach § 19 Abs. 3 UmwG als bekannt gemacht gilt, ihren Anspruch nach Grund und Höhe in Textform anmelden, Sicherheit zu leisten, soweit sie nicht Befriedigung verlangen können. Dieses Recht steht den Gläubigern jedoch nur zu, wenn sie glaubhaft machen, dass durch die Verschmelzung die Erfüllung ihrer Forderung gefährdet wird."
    },
    {
      "date": "2025-02-18",
      "id": "101538",
      "original_text": "Registerbekanntmachung nach dem Umwandlungsgesetz\nBayern Amtsgericht Schweinfurt HRA 10316\nLa-Ya Vermögensverwaltung GmbH + Co. KG – Schweinfurt",
      "type": "Registerbekanntmachung nach dem Umwandlungsgesetz",
      "state": "Bayern",
      "amtsgericht": "Amtsgericht Schweinfurt",
      "registernummer": "HRA 10316",
      "registerart": "HRA",
      "company_name": "La-Ya Vermögensverwaltung GmbH + Co. KG",
      "company_seat": "Schweinfurt",
      "details": "18.02.2025 (Bekanntmachungsdatum)\n\nBayern Amtsgericht Schweinfurt HRA 10316\nRegisterbekanntmachung nach dem Umwandlungsgesetz 17.02.2025 (Eintragungsdatum)\n\nLa-Ya Vermögensverwaltung GmbH + Co. KG\nKommanditgesellschaft\nSchweinfurt\n\nDen Gläubigern der an der Verschmelzung beteiligten Rechtsträger ist, wenn sie binnen sechs Monaten nach dem Tag, an dem die Eintragung der Verschmelzung in das Register des Sitzes desjenigen Rechtsträgers, dessen Gläubiger sie sind, nach § 19 Abs. 3 UmwG als bekannt gemacht gilt, ihren Anspruch nach Grund und Höhe in Textform anmelden, Sicherheit zu leisten, soweit sie nicht Befriedigung verlangen können. Dieses Recht steht den Gläubigern jedoch nur zu, wenn sie glaubhaft machen, dass durch die Verschmelzung die Erfüllung ihrer Forderung gefährdet wird."
    },
    {
      "date": "2025-02-18",
      "id": "101539",
      "original_text": "Löschungsankündigung\nBayern Amtsgericht München HRB 274012\nFURLAN PRO UG (haftungsbeschränkt) – München",
      "type": "Löschungsankündigung",
      "state": "Bayern",
      "amtsgericht": "Amtsgericht München",
      "registernummer": "HRB 274012",
      "registerart": "HRB",
      "company_name": "FURLAN PRO UG (haftungsbeschränkt)",
      "company_seat": "München",
      "details": "18.02.2025 (Bekanntmachungsdatum)\n\nBayern Amtsgericht München HRB 274012\nLöschungsankündigung 17.02.2025 (Eintragungsdatum)\n\nFURLAN PRO UG (haftungsbeschränkt)\nGesellschaft mit beschränkter Haftung\nMünchen\n\nDas Registergericht beabsichtigt, die im Handelsregister eingetragene Gesellschaft wegen Vermögenslosigkeit von Amts wegen nach § 394 FamFG zu löschen. Die Frist zur Erhebung eines Widerspruchs ist auf drei Monate festgesetzt."
    },
    {
      "date": "2025-02-18",
      "id": "101540",
      "original_text": "Löschungsankündigung\nBayern Amtsgericht Traunstein HRA 11525\nTrigentis-eCO2heat-süd OHG – Freilassing",
      "type": "Löschungsankündigung",
      "state": "Bayern",
      "amtsgericht": "Amtsgericht Traunstein",
      "registernummer": "HRA 11525",
      "registerart": "HRA",
      "company_name": "Trigentis-eCO2heat-süd OHG",
      "company_seat": "Freilassing",
      "details": "18.02.2025 (Bekanntmachungsdatum)\n\nBayern Amtsgericht Traunstein HRA 11525\nLöschungsankündigung\n\nTrigentis-eCO2heat-süd OHG\nOffene Handelsgesellschaft\nFreilassing\n\nDas Registergericht beabsichtigt, die im Handelsregister eingetragene Firma von Amts wegen nach § 31 Abs. 2 HGB zu löschen. Die Frist zur Erhebung eines Widerspruchs ist auf drei Monate festgesetzt."
    },
    {
      "date": "2025-02-18",
      "id": "101541",
      "original_text": "Registerbekanntmachung nach dem Umwandlungsgesetz\nBayern Amtsgericht Kempten (Allgäu) HRB 5622\nIn Via Reise & Kreuzfahrt GmbH – Burgberg",
      "type": "Registerbekanntmachung nach dem Umwandlungsgesetz",
      "state": "Bayern",
      "amtsgericht": "Amtsgericht Kempten (Allgäu)",
      "registernummer": "HRB 5622",
      "registerart": "HRB",
      "company_name": "In Via Reise & Kreuzfahrt GmbH",
      "company_seat": "Burgberg",
      "details": "18.02.2025 (Bekanntmachungsdatum)\n\nBayern Amtsgericht Kempten (Allgäu) HRB 5622\nRegisterbekanntmachung nach dem Umwandlungsgesetz 16.02.2025 (Eintragungsdatum)\n\nIn Via Reise & Kreuzfahrt GmbH\nGesellschaft mit beschränkter Haftung\nBurgberg\n\nDen Gläubigern der an der Verschmelzung beteiligten Rechtsträger ist, wenn sie binnen sechs Monaten nach dem Tag, an dem die Eintragung der Verschmelzung in das Register des Sitzes desjenigen Rechtsträgers, dessen Gläubiger sie sind, nach § 19 Abs. 3 UmwG als bekannt gemacht gilt, ihren Anspruch nach Grund und Höhe in Textform anmelden, Sicherheit zu leisten, soweit sie nicht Befriedigung verlangen können. Dieses Recht steht den Gläubigern jedoch nur zu, wenn sie glaubhaft machen, dass durch die Verschmelzung die Erfüllung ihrer Forderung gefährdet wird."
    },
    {
      "date": "2025-02-18",
      "id": "101542",
      "original_text": "Löschungsankündigung\nBayern Amtsgericht Fürth HRB 19608\nIL VIKING GmbH – Zirndorf",
      "type": "Löschungsankündigung",
      "state": "Bayern",
      "amtsgericht": "Amtsgericht Fürth",
      "registernummer": "HRB 19608",
      "registerart": "HRB",
      "company_name": "IL VIKING GmbH",
      "company_seat": "Zirndorf",
      "details": "18.02.2025 (Bekanntmachungsdatum)\n\nBayern Amtsgericht Fürth HRB 19608\nLöschungsankündigung\n\nIL VIKING GmbH\nGesellschaft mit beschränkter Haftung\nZirndorf\n\nDas Registergericht beabsichtigt, die im Handelsregister eingetragene Gesellschaft wegen Vermögenslosigkeit von Amts wegen nach § 394 FamFG zu löschen. Die Frist zur Erhebung eines Widerspruchs ist auf drei Monate festgesetzt."
    },
    {
      "date": "2025-02-18",
      "id": "101543",
      "original_text": "Löschungsankündigung\nBayern Amtsgericht Traunstein HRB 23309\nBusiness Wings Private Capital GmbH – Freilassing",
      "type": "Löschungsankündigung",
      "state": "Bayern",
      "amtsgericht": "Amtsgericht Traunstein",
      "registernummer": "HRB 23309",
      "registerart": "HRB",
      "company_name": "Business Wings Private Capital GmbH",
      "company_seat": "Freilassing",
      "details": "18.02.2025 (Bekanntmachungsdatum)\n\nBayern Amtsgericht Traunstein HRB 23309\nLöschungsankündigung\n\nBusiness Wings Private Capital GmbH\nGesellschaft mit beschränkter Haftung\nFreilassing\n\nDas Registergericht beabsichtigt, die im Handelsregister eingetragene Gesellschaft wegen Vermögenslosigkeit von Amts wegen nach § 394 FamFG zu löschen. Die Frist zur Erhebung eines Widerspruchs ist auf drei Monate festgesetzt."
    },
    {
      "date": "2025-02-18",
      "id": "101544",
      "original_text": "Löschungsankündigung\nBayern Amtsgericht Kempten (Allgäu) HRB 15815\nMC Fenster & Türen UG (haftungsbeschränkt) – Buchloe",
      "type": "Löschungsankündigung",
      "state": "Bayern",
      "amtsgericht": "Amtsgericht Kempten (Allgäu)",
      "registernummer": "HRB 15815",
      "registerart": "HRB",
      "company_name": "MC Fenster & Türen UG (haftungsbeschränkt)",
      "company_seat": "Buchloe",
      "details": "18.02.2025 (Bekanntmachungsdatum)\n\nBayern Amtsgericht Kempten (Allgäu) HRB 15815\nLöschungsankündigung\n\nMC Fenster & Türen UG (haftungsbeschränkt)\nGesellschaft mit beschränkter Haftung\nBuchloe\n\nDas Registergericht beabsichtigt, die im Handelsregister eingetragene Gesellschaft wegen Vermögenslosigkeit von Amts wegen nach § 394 FamFG zu löschen. Die Frist zur Erhebung eines Widerspruchs ist auf einen Monat festgesetzt."
    },
    {
      "date": "2025-02-18",
      "id": "101545",
      "original_text": "Registerbekanntmachung nach dem Umwandlungsgesetz\nBayern Amtsgericht Schweinfurt HRA 185\nMezger Holding OHG – Schweinfurt",
      "type": "Registerbekanntmachung nach dem Umwandlungsgesetz",
      "state": "Bayern",
      "amtsgericht": "Amtsgericht Schweinfurt",
      "registernummer": "HRA 185",
      "registerart": "HRA",
      "company_name": "Mezger Holding OHG",
      "company_seat": "Schweinfurt",
      "details": "18.02.2025 (Bekanntmachungsdatum)\n\nBayern Amtsgericht Schweinfurt HRA 185\nRegisterbekanntmachung nach dem Umwandlungsgesetz 17.02.2025 (Eintragungsdatum)\n\nMezger Holding OHG\nOffene Handelsgesellschaft\nSchweinfurt\n\nDen Gläubigern der an der Verschmelzung beteiligten Rechtsträger ist, wenn sie binnen sechs Monaten nach dem Tag, an dem die Eintragung der Verschmelzung in das Register des Sitzes desjenigen Rechtsträgers, dessen Gläubiger sie sind, nach § 19 Abs. 3 UmwG als bekannt gemacht gilt, ihren Anspruch nach Grund und Höhe in Textform anmelden, Sicherheit zu leisten, soweit sie nicht Befriedigung verlangen können. Dieses Recht steht den Gläubigern jedoch nur zu, wenn sie glaubhaft machen, dass durch die Verschmelzung die Erfüllung ihrer Forderung gefährdet wird."
    },
    {
      "date": "2025-02-18",
      "id": "101546",
      "original_text": "Registerbekanntmachung nach dem Umwandlungsgesetz\nBayern Amtsgericht Aschaffenburg HRA 6694\nHöflich e.K. – Großostheim",
      "type": "Registerbekanntmachung nach dem Umwandlungsgesetz",
      "state": "Bayern",
      "amtsgericht": "Amtsgericht Aschaffenburg",
      "registernummer": "HRA 6694",
      "registerart": "HRA",
      "company_name": "Höflich e.K.",
      "company_seat": "Großostheim",
      "details": "18.02.2025 (Bekanntmachungsdatum)\n\nBayern Amtsgericht Aschaffenburg HRA 6694\nRegisterbekanntmachung nach dem Umwandlungsgesetz 17.02.2025 (Eintragungsdatum)\n\nHöflich e.K.\nEinzelkaufmann / Einzelkauffrau\nGroßostheim\n\nDen Gläubigern der an der Verschmelzung beteiligten Rechtsträger ist, wenn sie binnen sechs Monaten nach dem Tag, an dem die Eintragung der Verschmelzung in das Register des Sitzes desjenigen Rechtsträgers, dessen Gläubiger sie sind, nach § 19 Abs. 3 UmwG als bekannt gemacht gilt, ihren Anspruch nach Grund und Höhe in Textform anmelden, Sicherheit zu leisten, soweit sie nicht Befriedigung verlangen können. Dieses Recht steht den Gläubigern jedoch nur zu, wenn sie glaubhaft machen, dass durch die Verschmelzung die Erfüllung ihrer Forderung gefährdet wird."
    },
    {
      "date": "2025-02-18",
      "id": "101547",
      "original_text": "Löschungsankündigung\nSaarland Amtsgericht Saarbrücken HRB 103485\nPIAZZA BAU UG (haftungsbeschränkt) – St. Ingbert",
      "type": "Löschungsankündigung",
      "state": "Saarland",
      "amtsgericht": "Amtsgericht Saarbrücken",
      "registernummer": "HRB 103485",
      "registerart": "HRB",
      "company_name": "PIAZZA BAU UG (haftungsbeschränkt)",
      "company_seat": "St. Ingbert",
      "details": "18.02.2025 (Bekanntmachungsdatum)\n\nSaarland Amtsgericht Saarbrücken HRB 103485\nLöschungsankündigung\n\nPIAZZA BAU UG (haftungsbeschränkt)\nGesellschaft mit beschränkter Haftung\nSt. Ingbert\n\nEs ist beabsichtigt, die Gesellschaft von Amts wegen gemäß § 394 FamFG wegen Vermögenslosigkeit zu löschen.\nGegen die Löschung von Amts wegen ist das Rechtsmittel des Widerspruchs statthaft. Der Widerspruch ist binnen einer Frist zwei Monaten beginnend mit dem Tag dieser Veröffentlichung durch Einreichen eines Widerspruchsschreibens -schriftlich oder zur Niederschrift der Geschäftsstelle beim Amtsgericht Saarbrücken, -zentrales Handelsregister-, Mainzerstr.178, 66121 Saarbrücken einzulegen.\nDer Widerspruch muss die Bezeichnung der angefochtenen Löschungsankündigung enthalten sowie die Erklärung, dass Widerspruch eingelegt wird. Er ist vom Widerspruchsführer oder seinem Bevollmächtigten zu unterzeichnen.\nDas Widerspruchsschreiben kann auch in der Form eines elektronischen Dokumentes eingereicht werden, das mit einer qualifizierten elektronischen Signatur nach dem Signaturgesetz versehen sein muss (§§ 14 Abs. 2 FamFG, 130a, 298 ZPO)."
    },
    {
      "date": "2025-02-18",
      "id": "101548",
      "original_text": "Löschungsankündigung\nBrandenburg Amtsgericht Neuruppin HRB 12868\nREM Lebensmittelgroßhandel GmbH – Mescherin",
      "type": "Löschungsankündigung",
      "state": "Brandenburg",
      "amtsgericht": "Amtsgericht Neuruppin",
      "registernummer": "HRB 12868",
      "registerart": "HRB",
      "company_name": "REM Lebensmittelgroßhandel GmbH",
      "company_seat": "Mescherin",
      "details": "18.02.2025 (Bekanntmachungsdatum)\n\nBrandenburg Amtsgericht Neuruppin HRB 12868\nLöschungsankündigung\n\nREM Lebensmittelgroßhandel GmbH\nGesellschaft mit beschränkter Haftung\nMescherin\n\nBei der nachstehenden Gesellschaft wird das Amtslöschungsverfahren gemäß § 394 FamFG eingeleitet.\nWiderspruchsfrist: 1 Monat"
    },
    {
      "date": "2025-02-18",
      "id": "101549",
      "original_text": "Registerbekanntmachung nach dem Umwandlungsgesetz\nBaden-Württemberg Amtsgericht Freiburg HRB 717313\nMIGO Bauberatung GmbH – Freiburg im Breisgau",
      "type": "Registerbekanntmachung nach dem Umwandlungsgesetz",
      "state": "Baden-Württemberg",
      "amtsgericht": "Amtsgericht Freiburg",
      "registernummer": "HRB 717313",
      "registerart": "HRB",
      "company_name": "MIGO Bauberatung GmbH",
      "company_seat": "Freiburg im Breisgau",
      "details": "18.02.2025 (Bekanntmachungsdatum)\n\nBaden-Württemberg Amtsgericht Freiburg HRB 717313\nRegisterbekanntmachung nach dem Umwandlungsgesetz 18.02.2025 (Eintragungsdatum)\n\nMIGO Bauberatung GmbH\nGesellschaft mit beschränkter Haftung\nFreiburg im Breisgau\n\nAls nicht eingetragen wird bekanntgemacht:\nDen Gläubigern der an der Verschmelzung beteiligten Rechtsträger ist, wenn sie binnen sechs Monaten nach dem Tag, an dem die Eintragung der Verschmelzung in das Register des Sitzes desjenigen Rechtsträgers, dessen Gläubiger sie sind, nach § 19 Abs. 3 UmwG als bekanntgemacht gilt, ihren Anspruch nach Grund und Höhe schriftlich anmelden, Sicherheit zu leisten, soweit sie nicht Befriedigung verlangen können. Dieses Recht steht den Gläubigern jedoch nur zu, wenn sie glaubhaft machen, dass durch die Verschmelzung die Erfüllung ihrer Forderung gefährdet wird."
    },
    {
      "date": "2025-02-18",
      "id": "101550",
      "original_text": "Löschungsankündigung\nSaarland Amtsgericht Saarbrücken HRB 101187\nPV-Line GmbH – Saarbrücken",
      "type": "Löschungsankündigung",
      "state": "Saarland",
      "amtsgericht": "Amtsgericht Saarbrücken",
      "registernummer": "HRB 101187",
      "registerart": "HRB",
      "company_name": "PV-Line GmbH",
      "company_seat": "Saarbrücken",
      "details": "18.02.2025 (Bekanntmachungsdatum)\n\nSaarland Amtsgericht Saarbrücken HRB 101187\nLöschungsankündigung\n\nPV-Line GmbH\nGesellschaft mit beschränkter Haftung\nSaarbrücken\n\nEs ist beabsichtigt, die Gesellschaft von Amts wegen gemäß § 394 FamFG wegen Vermögenslosigkeit zu löschen.\nGegen die Löschung von Amts wegen ist das Rechtsmittel des Widerspruchs statthaft. Der Widerspruch ist binnen einer Frist zwei Monaten beginnend mit dem Tag dieser Veröffentlichung durch Einreichen eines Widerspruchsschreibens -schriftlich oder zur Niederschrift der Geschäftsstelle beim Amtsgericht Saarbrücken, -zentrales Handelsregister-, Mainzerstr.178, 66121 Saarbrücken einzulegen.\nDer Widerspruch muss die Bezeichnung der angefochtenen Löschungsankündigung enthalten sowie die Erklärung, dass Widerspruch eingelegt wird. Er ist vom Widerspruchsführer oder seinem Bevollmächtigten zu unterzeichnen.\nDas Widerspruchsschreiben kann auch in der Form eines elektronischen Dokumentes eingereicht werden, das mit einer qualifizierten elektronischen Signatur nach dem Signaturgesetz versehen sein muss (§§ 14 Abs. 2 FamFG, 130a, 298 ZPO)."
    },
    {
      "date": "2025-02-18",
      "id": "101551",
      "original_text": "Löschungsankündigung\nSchleswig-Holstein Amtsgericht Lübeck HRB 24863\nM.I.C Creativ International GmbH – Ahrensburg",
      "type": "Löschungsankündigung",
      "state": "Schleswig-Holstein",
      "amtsgericht": "Amtsgericht Lübeck",
      "registernummer": "HRB 24863",
      "registerart": "HRB",
      "company_name": "M.I.C Creativ International GmbH",
      "company_seat": "Ahrensburg",
      "details": "18.02.2025 (Bekanntmachungsdatum)\n\nSchleswig-Holstein Amtsgericht Lübeck HRB 24863\nLöschungsankündigung\n\nM.I.C Creativ International GmbH\nGesellschaft mit beschränkter Haftung\nAhrensburg\n\nan Herrn Altan Köz per Veröffentlichung:\n\nin der Handelsregistersache der\nM.I.C Creativ International GmbH\n\nergeben sich aus den hier vorliegenden Unterlagen Anhaltspunkte dafür, dass die Gesellschaft vermögenslos ist: Das zuständige Finanzamt hat am 11.02.2025 die Löschung beantragt.\n\nDas Registergericht beabsichtigt daher, die Gesellschaft wegen Vermögenslosigkeit gemäß § 394 FamFG zu löschen.\n\nEs wird eine Frist von einem Monat zur Geltendmachung eines Widerspruchs gegen die Löschung, § 394 Abs. 2 S. 1 FamFG bestimmt. Nach Fristablauf ohne Widerspruch wird die Gesellschaft gelöscht.\n\nGärtner\nDipl.-Rechtspflegerin (FH)"
    },
    {
      "date": "2025-02-18",
      "id": "101552",
      "original_text": "Löschungsankündigung\nBaden-Württemberg Amtsgericht Stuttgart HRB 756410\nBRANDPIRE UG (haftungsbeschränkt) – Sindelfingen",
      "type": "Löschungsankündigung",
      "state": "Baden-Württemberg",
      "amtsgericht": "Amtsgericht Stuttgart",
      "registernummer": "HRB 756410",
      "registerart": "HRB",
      "company_name": "BRANDPIRE UG (haftungsbeschränkt)",
      "company_seat": "Sindelfingen",
      "details": "18.02.2025 (Bekanntmachungsdatum)\n\nBaden-Württemberg Amtsgericht Stuttgart HRB 756410\nLöschungsankündigung\n\nBRANDPIRE UG (haftungsbeschränkt)\nGesellschaft mit beschränkter Haftung\nSindelfingen\n\nDas Gericht beabsichtigt, die Gesellschaft wegen Vermögenslosigkeit im Handelsregister von Amts wegen nach § 394 FamFG zu löschen. Die Frist zur Geltendmachung eines Widerspruchs gegen die beabsichtigte Löschung ist auf zwei Monate ab Veröffentlichung bestimmt."
    },
    {
      "date": "2025-02-18",
      "id": "101553",
      "original_text": "Einreichung neuer Dokumente\nSachsen-Anhalt Amtsgericht Stendal HRB 29060\nSmart.Region GmbH – Staßfurt",
      "type": "Einreichung neuer Dokumente",
      "state": "Sachsen-Anhalt",
      "amtsgericht": "Amtsgericht Stendal",
      "registernummer": "HRB 29060",
      "registerart": "HRB",
      "company_name": "Smart.Region GmbH",
      "company_seat": "Staßfurt",
      "details": "18.02.2025 (Bekanntmachungsdatum)\n\nSachsen-Anhalt Amtsgericht Stendal HRB 29060\nEinreichung neuer Dokumente\n\nSmart.Region GmbH\nGesellschaft mit beschränkter Haftung\nStaßfurt\n\nEine Liste der Mitglieder des Aufsichtsrates wurde zum Handelsregister eingereicht."
    },
    {
      "date": "2025-02-18",
      "id": "101554",
      "original_text": "Einreichung neuer Dokumente\nSaarland Amtsgericht Saarbrücken HRB 16714\nNetzwerke Saarlouis GmbH – Saarlouis",
      "type": "Einreichung neuer Dokumente",
      "state": "Saarland",
      "amtsgericht": "Amtsgericht Saarbrücken",
      "registernummer": "HRB 16714",
      "registerart": "HRB",
      "company_name": "Netzwerke Saarlouis GmbH",
      "company_seat": "Saarlouis",
      "details": "18.02.2025 (Bekanntmachungsdatum)\n\nSaarland Amtsgericht Saarbrücken HRB 16714\nEinreichung neuer Dokumente\n\nNetzwerke Saarlouis GmbH\nGesellschaft mit beschränkter Haftung\nSaarlouis\n\nDie Geschäftsführung der Gesellschaft hat eine Liste der Mitglieder des Aufsichtsrats zum Handelsregister eingereicht (§ 52 Abs. 3 Satz 2 GmbHG)."
    },
    {
      "date": "2025-02-18",
      "id": "101555",
      "original_text": "Einreichung neuer Dokumente\nBaden-Württemberg Amtsgericht Freiburg HRB 702715\nPrime Energy Invest AG – Weil am Rhein",
      "type": "Einreichung neuer Dokumente",
      "state": "Baden-Württemberg",
      "amtsgericht": "Amtsgericht Freiburg",
      "registernummer": "HRB 702715",
      "registerart": "HRB",
      "company_name": "Prime Energy Invest AG",
      "company_seat": "Weil am Rhein",
      "details": "18.02.2025 (Bekanntmachungsdatum)\n\nBaden-Württemberg Amtsgericht Freiburg HRB 702715\nEinreichung neuer Dokumente\n\nPrime Energy Invest AG\nAktiengesellschaft\nWeil am Rhein\n\nDie Gesellschaft hat am 13.02.2025 die Liste über die Zusammensetzung des Aufsichtsrats zum Handelsregister eingereicht."
    },
    {
      "date": "2025-02-18",
      "id": "101556",
      "original_text": "Registerbekanntmachung nach dem Umwandlungsgesetz\nSachsen-Anhalt Amtsgericht Stendal HRB 34960\nLYB Solvent Recycling GmbH – Merseburg",
      "type": "Registerbekanntmachung nach dem Umwandlungsgesetz",
      "state": "Sachsen-Anhalt",
      "amtsgericht": "Amtsgericht Stendal",
      "registernummer": "HRB 34960",
      "registerart": "HRB",
      "company_name": "LYB Solvent Recycling GmbH",
      "company_seat": "Merseburg",
      "details": "18.02.2025 (Bekanntmachungsdatum)\n\nSachsen-Anhalt Amtsgericht Stendal HRB 34960\nRegisterbekanntmachung nach dem Umwandlungsgesetz 18.02.2025 (Eintragungsdatum)\n\nLYB Solvent Recycling GmbH\nGesellschaft mit beschränkter Haftung\nMerseburg\n\nDie APK Newcycling GmbH mit dem Sitz in Merseburg (Amtsgericht Stendal HRB 33447) ist auf Grund des Verschmelzungsvertrages vom 10.02.2025 und der Beschlüsse der Gesellschafterversammlungen vom selben Tag mit der Gesellschaft verschmolzen. Nicht eingetragen: Den Gläubigern der an der Verschmelzung beteiligten Rechtsträger ist, wenn sie binnen sechs Monaten nach dem Tag, an dem die Eintragung der Verschmelzung nach § 19 Abs. 3 UmwG als bekanntgemacht gilt, ihren Anspruch nach Grund und Höhe schriftlich anmelden, Sicherheit zu leisten, soweit sie nicht Befriedigung verlangen können. Dieses Recht steht ihnen jedoch nur zu, wenn sie glaubhaft machen, dass durch die Verschmelzung die Erfüllung ihrer Forderung gefährdet wird."
    },
    {
      "date": "2025-02-18",
      "id": "101557",
      "original_text": "Registerbekanntmachung nach dem Umwandlungsgesetz\nSachsen-Anhalt Amtsgericht Stendal HRB 33447\nAPK Newcycling GmbH – Merseburg",
      "type": "Registerbekanntmachung nach dem Umwandlungsgesetz",
      "state": "Sachsen-Anhalt",
      "amtsgericht": "Amtsgericht Stendal",
      "registernummer": "HRB 33447",
      "registerart": "HRB",
      "company_name": "APK Newcycling GmbH",
      "company_seat": "Merseburg",
      "details": "18.02.2025 (Bekanntmachungsdatum)\n\nSachsen-Anhalt Amtsgericht Stendal HRB 33447\nRegisterbekanntmachung nach dem Umwandlungsgesetz 18.02.2025 (Eintragungsdatum)\n\nAPK Newcycling GmbH\nGesellschaft mit beschränkter Haftung\nMerseburg\n\nDie Gesellschaft ist auf Grund des Verschmelzungsvertrages vom 10.02.2025 sowie der Beschlüsse der Gesellschafterversammlungen vom selben Tag mit der LYB Solvent Recycling GmbH mit dem Sitz in Merseburg (Amtsgericht Stendal HRB 34960) verschmolzen. Die Verschmelzung ist mit der Eintragung der Verschmelzung in das Handelsregister der übernehmenden Gesellschaft am 18.02.2025 wirksam geworden.Den Gläubigern der an der grenzüberschreitenden Verschmelzung beteiligten übernehmenden Rechtsträger ist, wenn sie binnen sechs Monaten nach dem Tag, an dem die Eintragung der Verschmelzung in das Register des Sitzes desjenigen Rechtsträgers, dessen Gläubiger sie sind, nach § 19 Absatz 3 UmwG als bekanntgemacht gilt, ihren Anspruch nach Grund und Höhe schriftlich anmelden, Sicherheit zu leisten, soweit sie nicht Befriedigung verlangen können.Dieses Recht steht den Gläubigern jedoch nur zu, wenn sie glaubhaft machen, dass durch die Spaltung die Erfüllung ihrer Forderung gefährdet wird."
    },
    {
      "date": "2025-02-18",
      "id": "101558",
      "original_text": "Einreichung neuer Dokumente\nBerlin Amtsgericht Berlin (Charlottenburg) HRB 225909\nLinus Digital Finance AG – Berlin",
      "type": "Einreichung neuer Dokumente",
      "state": "Berlin",
      "amtsgericht": "Amtsgericht Berlin (Charlottenburg)",
      "registernummer": "HRB 225909",
      "registerart": "HRB",
      "company_name": "Linus Digital Finance AG",
      "company_seat": "Berlin",
      "details": "18.02.2025 (Bekanntmachungsdatum)\n\nBerlin Amtsgericht Berlin (Charlottenburg) HRB 225909\nEinreichung neuer Dokumente\n\nLinus Digital Finance AG\nAktiengesellschaft\nBerlin\n\nAls nicht eingetragen wird veröffentlicht:\n\nEs wurde eine neue Liste der Aufsichtsratsmitglieder eingereicht (§ 106 AktG)."
    },
    {
      "date": "2025-02-18",
      "id": "101559",
      "original_text": "Löschungsankündigung\nBerlin Amtsgericht Berlin (Charlottenburg) HRB 228917\nHewa Delivery UG (haftungsbeschränkt) – Berlin",
      "type": "Löschungsankündigung",
      "state": "Berlin",
      "amtsgericht": "Amtsgericht Berlin (Charlottenburg)",
      "registernummer": "HRB 228917",
      "registerart": "HRB",
      "company_name": "Hewa Delivery UG (haftungsbeschränkt)",
      "company_seat": "Berlin",
      "details": "18.02.2025 (Bekanntmachungsdatum)\n\nBerlin Amtsgericht Berlin (Charlottenburg) HRB 228917\nLöschungsankündigung\n\nHewa Delivery UG (haftungsbeschränkt)\nGesellschaft mit beschränkter Haftung\nBerlin\n\nBei der nachstehenden Gesellschaft wird das Amtslöschungsverfahren gemäß § 394 FamFG eingeleitet. Widerspruchsfrist 6 Wochen"
    },
    {
      "date": "2025-02-18",
      "id": "101560",
      "original_text": "Einreichung neuer Dokumente\nBaden-Württemberg Amtsgericht Stuttgart HRB 778168\nTMT SE – Ditzingen",
      "type": "Einreichung neuer Dokumente",
      "state": "Baden-Württemberg",
      "amtsgericht": "Amtsgericht Stuttgart",
      "registernummer": "HRB 778168",
      "registerart": "HRB",
      "company_name": "TMT SE",
      "company_seat": "Ditzingen",
      "details": "18.02.2025 (Bekanntmachungsdatum)\n\nBaden-Württemberg Amtsgericht Stuttgart HRB 778168\nEinreichung neuer Dokumente\n\nTMT SE\nEuropäische Aktiengesellschaft (SE)\nDitzingen\n\nDie Gesellschaft hat am 17.02.2025 die Liste über die Zusammensetzung des Aufsichtsrats zum Handelsregister eingereicht."
    },
    {
      "date": "2025-02-18",
      "id": "101561",
      "original_text": "Registerbekanntmachung nach dem Umwandlungsgesetz\nBaden-Württemberg Amtsgericht Stuttgart HRB 778470\nPrimex Service UG (haftungsbeschränkt) – Stuttgart",
      "type": "Registerbekanntmachung nach dem Umwandlungsgesetz",
      "state": "Baden-Württemberg",
      "amtsgericht": "Amtsgericht Stuttgart",
      "registernummer": "HRB 778470",
      "registerart": "HRB",
      "company_name": "Primex Service UG (haftungsbeschränkt)",
      "company_seat": "Stuttgart",
      "details": "18.02.2025 (Bekanntmachungsdatum)\n\nBaden-Württemberg Amtsgericht Stuttgart HRB 778470\nRegisterbekanntmachung nach dem Umwandlungsgesetz 18.02.2025 (Eintragungsdatum)\n\nPrimex Service UG (haftungsbeschränkt)\nGesellschaft mit beschränkter Haftung\nStuttgart\n\nDen Gläubigern der an der Verschmelzung beteiligten Rechtsträger ist, wenn sie binnen sechs Monaten nach dem Tag, an dem die Eintragung der Verschmelzung in das Register des Sitzes desjenigen Rechtsträgers, dessen Gläubiger sie sind, nach § 19 Abs. 3 UmwG als bekanntgemacht gilt, ihren Anspruch nach Grund und Höhe schriftlich anmelden, Sicherheit zu leisten, soweit sie nicht Befriedigung verlangen können. Dieses Recht steht den Gläubigern jedoch nur zu, wenn sie glaubhaft machen, dass durch die Verschmelzung die Erfüllung ihrer Forderung gefährdet wird."
    },
    {
      "date": "2025-02-18",
      "id": "101562",
      "original_text": "Löschungsankündigung\nSaarland Amtsgericht Saarbrücken HRB 102434\nMAP Management and Project GmbH – Homburg/Saar",
      "type": "Löschungsankündigung",
      "state": "Saarland",
      "amtsgericht": "Amtsgericht Saarbrücken",
      "registernummer": "HRB 102434",
      "registerart": "HRB",
      "company_name": "MAP Management and Project GmbH",
      "company_seat": "Homburg/Saar",
      "details": "18.02.2025 (Bekanntmachungsdatum)\n\nSaarland Amtsgericht Saarbrücken HRB 102434\nLöschungsankündigung\n\nMAP Management and Project GmbH\nGesellschaft mit beschränkter Haftung\nHomburg/Saar\n\nEs ist beabsichtigt, die Gesellschaft von Amts wegen gemäß § 394 FamFG wegen Vermögenslosigkeit zu löschen. Gegen die Löschung von Amts wegen ist das Rechtsmittel des Widerspruchs statthaft. Der Widerspruch ist binnen einer Frist von 2 Monaten beginnend mit dem Tag dieser Veröffentlichung durch Einreichen eines Widerspruchsschreibens -schriftlich oder zur Niederschrift der Geschäftsstelle- beim Amtsgericht Saarbrücken, -zentrales Handelsregister-, Mainzerstr.178, 66121 Saarbrücken einzulegen. Der Widerspruch muss die Bezeichnung der angefochtenen Löschungsankündigung enthalten sowie die Erklärung, dass Widerspruch eingelegt wird. Er ist vom Widerspruchsführer oder seinem Bevollmächtigten zu unterzeichnen."
    },
    {
      "date": "2025-02-18",
      "id": "101563",
      "original_text": "Registerbekanntmachung nach dem Umwandlungsgesetz\nSachsen-Anhalt Amtsgericht Stendal HRB 19987\nMPG Mittelständische Projekt- und Innovationsgesellschaft mbH – Zeitz",
      "type": "Registerbekanntmachung nach dem Umwandlungsgesetz",
      "state": "Sachsen-Anhalt",
      "amtsgericht": "Amtsgericht Stendal",
      "registernummer": "HRB 19987",
      "registerart": "HRB",
      "company_name": "MPG Mittelständische Projekt- und Innovationsgesellschaft mbH",
      "company_seat": "Zeitz",
      "details": "18.02.2025 (Bekanntmachungsdatum)\n\nSachsen-Anhalt Amtsgericht Stendal HRB 19987\nRegisterbekanntmachung nach dem Umwandlungsgesetz 18.02.2025 (Eintragungsdatum)\n\nMPG Mittelständische Projekt- und Innovationsgesellschaft mbH\nGesellschaft mit beschränkter Haftung\nZeitz\n\nDie Gesellschaft ist auf Grund des Verschmelzungsvertrages vom 30.01.2025 sowie des Beschlusses der Gesellschafterversammlung vom selben Tag mit dem Vermögen des Alleingesellschafters Dr. Soult Helmut, Zeitz, *17.03.1959 verschmolzen.Nicht eingetragen:\nDen Gläubigern der an der Verschmelzung beteiligten Rechtsträger ist, wenn sie binnen sechs Monaten nach dem Tag, an dem die Eintragung der Verschmelzung nach § 19 Abs. 3 UmwG als bekanntgemacht gilt, ihren Anspruch nach Grund und Höhe schriftlich anmelden, Sicherheit zu leisten, soweit sie nicht Befriedigung verlangen können. Dieses Recht steht ihnen jedoch nur zu, wenn sie glaubhaft machen, dass durch die Verschmelzung die Erfüllung ihrer Forderung gefährdet wird."
    },
    {
      "date": "2025-02-18",
      "id": "101564",
      "original_text": "Registerbekanntmachung nach dem Umwandlungsgesetz\nNordrhein-Westfalen Amtsgericht Coesfeld HRA 10006\nViktor Schneitler Ebay Shop, An- und Verkauf von Trödel u.a. e.K. – Olfen",
      "type": "Registerbekanntmachung nach dem Umwandlungsgesetz",
      "state": "Nordrhein-Westfalen",
      "amtsgericht": "Amtsgericht Coesfeld",
      "registernummer": "HRA 10006",
      "registerart": "HRA",
      "company_name": "Viktor Schneitler Ebay Shop, An- und Verkauf von Trödel u.a. e.K.",
      "company_seat": "Olfen",
      "details": "18.02.2025 (Bekanntmachungsdatum)\n\nNordrhein-Westfalen Amtsgericht Coesfeld HRA 10006\nRegisterbekanntmachung nach dem Umwandlungsgesetz 18.02.2025 (Eintragungsdatum)\n\nViktor Schneitler Ebay Shop, An- und Verkauf von Trödel u.a. e.K.\nEinzelkaufmann\nOlfen\n\nDen Gläubigern der an der Ausgliederung beteiligten Rechtsträger ist, wenn sie binnen sechs Monaten nach dem Tag, an dem die Eintragung der Ausgliederung in das Register des Sitzes desjenigen Rechtsträgers, dessen Gläubiger sie sind, nach § 19 Absatz 3 UmwG als bekanntgemacht gilt, ihren Anspruch nach Grund und Höhe schriftlich anmelden, Sicherheit zu leisten, soweit sie nicht Befriedigung verlangen können. Dieses Recht steht den Gläubigern jedoch nur zu, wenn sie glaubhaft machen, dass durch die Ausgliederung die Erfüllung ihrer Forderung gefährdet wird."
    },
    {
      "date": "2025-02-18",
      "id": "101565",
      "original_text": "Löschungsankündigung\nSchleswig-Holstein Amtsgericht Flensburg HRB 14984\nKlaar Kiming UG (haftungsbeschränkt) – Sylt",
      "type": "Löschungsankündigung",
      "state": "Schleswig-Holstein",
      "amtsgericht": "Amtsgericht Flensburg",
      "registernummer": "HRB 14984",
      "registerart": "HRB",
      "company_name": "Klaar Kiming UG (haftungsbeschränkt)",
      "company_seat": "Sylt",
      "details": "18.02.2025 (Bekanntmachungsdatum)\n\nSchleswig-Holstein Amtsgericht Flensburg HRB 14984\nLöschungsankündigung\n\nKlaar Kiming UG (haftungsbeschränkt)\nGesellschaft mit beschränkter Haftung\nSylt\n\nEs ist die Löschung der nachstehenden Gesellschaft wegen Vermögenslosigkeit gemäß § 394 FamFG beabsichtigt.\nWiderspruchsfrist: 2 Monate."
    },
    {
      "date": "2025-02-18",
      "id": "101566",
      "original_text": "Löschungsankündigung\nBerlin Amtsgericht Berlin (Charlottenburg) HRA 24627\nImmobilienfonds-Verwaltungs-UG (haftungsbeschränkt) & Co. Florastr. 78/Neue Schönholzer Str. 17 B KG – Berlin",
      "type": "Löschungsankündigung",
      "state": "Berlin",
      "amtsgericht": "Amtsgericht Berlin (Charlottenburg)",
      "registernummer": "HRA 24627",
      "registerart": "HRA",
      "company_name": "Immobilienfonds-Verwaltungs-UG (haftungsbeschränkt) & Co. Florastr. 78/Neue Schönholzer Str. 17 B KG",
      "company_seat": "Berlin",
      "details": "18.02.2025 (Bekanntmachungsdatum)\n\nBerlin Amtsgericht Berlin (Charlottenburg) HRA 24627\nLöschungsankündigung\n\nImmobilienfonds-Verwaltungs-UG (haftungsbeschränkt) & Co. Florastr. 78/Neue Schönholzer Str. 17 B KG\nKommanditgesellschaft\nBerlin\n\nBei dem nachstehenden Unternehmen / der nachstehenden Gesellschaft wird das Amtslöschungsverfahren gemäß § 31 Abs. 2 HGB eingeleitet. Widerspruchsfrist 1 Monat"
    },
    {
      "date": "2025-02-18",
      "id": "101567",
      "original_text": "Registerbekanntmachung nach dem Umwandlungsgesetz\nBaden-Württemberg Amtsgericht Stuttgart HRB 783963\nB&O Projekt GmbH – Freudenstadt",
      "type": "Registerbekanntmachung nach dem Umwandlungsgesetz",
      "state": "Baden-Württemberg",
      "amtsgericht": "Amtsgericht Stuttgart",
      "registernummer": "HRB 783963",
      "registerart": "HRB",
      "company_name": "B&O Projekt GmbH",
      "company_seat": "Freudenstadt",
      "details": "18.02.2025 (Bekanntmachungsdatum)\n\nBaden-Württemberg Amtsgericht Stuttgart HRB 783963\nRegisterbekanntmachung nach dem Umwandlungsgesetz 18.02.2025 (Eintragungsdatum)\n\nB&O Projekt GmbH\nGesellschaft mit beschränkter Haftung\nFreudenstadt\n\nDen Gläubigern der an der Verschmelzung beteiligten Rechtsträger ist, wenn sie binnen sechs Monaten nach dem Tag, an dem die Eintragung der Verschmelzung in das Register des Sitzes desjenigen Rechtsträgers, dessen Gläubiger sie sind, nach § 19 Abs. 3 UmwG als bekanntgemacht gilt, ihren Anspruch nach Grund und Höhe schriftlich anmelden, Sicherheit zu leisten, soweit sie nicht Befriedigung verlangen können. Dieses Recht steht den Gläubigern jedoch nur zu, wenn sie glaubhaft machen, dass durch die Verschmelzung die Erfüllung ihrer Forderung gefährdet wird."
    },
    {
      "date": "2025-02-18",
      "id": "101568",
      "original_text": "Registerbekanntmachung nach dem Umwandlungsgesetz\nHamburg Amtsgericht Hamburg HRA 132006\nJupiter Immobilien GmbH & Co. KG – Hamburg",
      "type": "Registerbekanntmachung nach dem Umwandlungsgesetz",
      "state": "Hamburg",
      "amtsgericht": "Amtsgericht Hamburg",
      "registernummer": "HRA 132006",
      "registerart": "HRA",
      "company_name": "Jupiter Immobilien GmbH & Co. KG",
      "company_seat": "Hamburg",
      "details": "18.02.2025 (Bekanntmachungsdatum)\n\nHamburg Amtsgericht Hamburg HRA 132006\nRegisterbekanntmachung nach dem Umwandlungsgesetz 27.01.2025 (Eintragungsdatum)\n\nJupiter Immobilien GmbH & Co. KG\nKommanditgesellschaft\nHamburg\n\nAls nicht eingetragen wird bekannt gemacht:\nDen Gläubigern der an der formwechselnden Umwandlung beteiligten Gesellschaften ist, wenn sie binnen sechs Monaten nach dem Tag, an dem die Eintragung der formwechselnden Umwandlung in das Register des Sitzes desjenigen Rechtsträgers, dessen Gläubiger sie sind, nach § 19 Absatz 3 UmwG als bekannt gemacht gilt, ihren Anspruch nach Grund und Höhe schriftlich anmelden, Sicherheit zu leisten, soweit sie nicht Befriedigung verlangen können. Dieses Recht steht den Gläubigern jedoch nur zu, wenn sie glaubhaft machen, dass durch die formwechselnde Umwandlung die Erfüllung ihrer Forderung gefährdet wird."
    },
    {
      "date": "2025-02-18",
      "id": "101569",
      "original_text": "Löschungsankündigung\nThüringen Amtsgericht Jena HRB 209493\nADNOVUMTechnologies GmbH – Rositz",
      "type": "Löschungsankündigung",
      "state": "Thüringen",
      "amtsgericht": "Amtsgericht Jena",
      "registernummer": "HRB 209493",
      "registerart": "HRB",
      "company_name": "ADNOVUMTechnologies GmbH",
      "company_seat": "Rositz",
      "details": "18.02.2025 (Bekanntmachungsdatum)\n\nThüringen Amtsgericht Jena HRB 209493\nLöschungsankündigung\n\nADNOVUMTechnologies GmbH\nGesellschaft mit beschränkter Haftung\nRositz\n\nDas Registergericht beabsichtigt, die im Handelsregister eingetragene Gesellschaft wegen Vermögenslosigkeit nach § 394 FamFG von Amts wegen zu löschen. Die Frist zur Erhebung eines Widerspruchs gegen die beabsichtigte Löschung wird auf 6 Wochen festgesetzt."
    },
    {
      "date": "2025-02-18",
      "id": "101570",
      "original_text": "Löschungsankündigung\nThüringen Amtsgericht Jena HRB 513504\nSondershäuser Umweltservice Carmen Hornung UG (haftungsbeschränkt) – Sondershausen",
      "type": "Löschungsankündigung",
      "state": "Thüringen",
      "amtsgericht": "Amtsgericht Jena",
      "registernummer": "HRB 513504",
      "registerart": "HRB",
      "company_name": "Sondershäuser Umweltservice Carmen Hornung UG (haftungsbeschränkt)",
      "company_seat": "Sondershausen",
      "details": "18.02.2025 (Bekanntmachungsdatum)\n\nThüringen Amtsgericht Jena HRB 513504\nLöschungsankündigung\n\nSondershäuser Umweltservice Carmen Hornung UG (haftungsbeschränkt)\nGesellschaft mit beschränkter Haftung\nSondershausen\n\nDas Registergericht beabsichtigt, die im Handelsregister eingetragene Gesellschaft wegen Vermögenslosigkeit nach § 394 FamFG von Amts wegen zu löschen. Die Frist zur Erhebung eines Widerspruchs gegen die beabsichtigte Löschung wird auf 6 Wochen festgesetzt."
    },
    {
      "date": "2025-02-18",
      "id": "101571",
      "original_text": "Löschungsankündigung\nThüringen Amtsgericht Jena HRB 508584\nporta design GmbH – Steinbach-Hallenberg",
      "type": "Löschungsankündigung",
      "state": "Thüringen",
      "amtsgericht": "Amtsgericht Jena",
      "registernummer": "HRB 508584",
      "registerart": "HRB",
      "company_name": "porta design GmbH",
      "company_seat": "Steinbach-Hallenberg",
      "details": "18.02.2025 (Bekanntmachungsdatum)\n\nThüringen Amtsgericht Jena HRB 508584\nLöschungsankündigung\n\nporta design GmbH\nGesellschaft mit beschränkter Haftung\nSteinbach-Hallenberg\n\nDas Registergericht beabsichtigt, die im Handelsregister eingetragene Gesellschaft wegen Vermögenslosigkeit nach § 394 FamFG von Amts wegen zu löschen. Die Frist zur Erhebung eines Widerspruchs gegen die beabsichtigte Löschung wird auf 6 Wochen festgesetzt."
    },
    {
      "date": "2025-02-18",
      "id": "101572",
      "original_text": "Einreichung neuer Dokumente\nThüringen Amtsgericht Jena HRB 104109\nSWE Stadtwirtschaft GmbH – Erfurt",
      "type": "Einreichung neuer Dokumente",
      "state": "Thüringen",
      "amtsgericht": "Amtsgericht Jena",
      "registernummer": "HRB 104109",
      "registerart": "HRB",
      "company_name": "SWE Stadtwirtschaft GmbH",
      "company_seat": "Erfurt",
      "details": "18.02.2025 (Bekanntmachungsdatum)\n\nThüringen Amtsgericht Jena HRB 104109\nEinreichung neuer Dokumente\n\nSWE Stadtwirtschaft GmbH\nGesellschaft mit beschränkter Haftung\nErfurt\n\nBekanntmachung gem. § 52 Abs. 3 Satz 2 GmbHG: Aufgrund einer Veränderung in den Personen der Aufsichtsratsmitglieder ist durch den Geschäftsführer eine neue Liste zum Handelsregister eingereicht worden."
    },
    {
      "date": "2025-02-18",
      "id": "101573",
      "original_text": "Sonstige Registerbekanntmachung\nBrandenburg Amtsgericht Neuruppin HRB 9393\nUckermärkische Rettungsdienstgesellschaft mbH – Prenzlau",
      "type": "Sonstige Registerbekanntmachung",
      "state": "Brandenburg",
      "amtsgericht": "Amtsgericht Neuruppin",
      "registernummer": "HRB 9393",
      "registerart": "HRB",
      "company_name": "Uckermärkische Rettungsdienstgesellschaft mbH",
      "company_seat": "Prenzlau",
      "details": "18.02.2025 (Bekanntmachungsdatum)\n\nBrandenburg Amtsgericht Neuruppin HRB 9393\nSonstige Registerbekanntmachung\n\nUckermärkische Rettungsdienstgesellschaft mbH\nGesellschaft mit beschränkter Haftung\nPrenzlau\n\nAls nicht eingetragen wird veröffentlicht: Eine Liste der Mitglieder des Aufsichtsrates wurde zum Handelsregister eingereicht."
    },
    {
      "date": "2025-02-18",
      "id": "101574",
      "original_text": "Löschungsankündigung\nBrandenburg Amtsgericht Frankfurt/Oder HRB 17481\nCulaccino GmbH – Frankfurt (Oder)",
      "type": "Löschungsankündigung",
      "state": "Brandenburg",
      "amtsgericht": "Amtsgericht Frankfurt/Oder",
      "registernummer": "HRB 17481",
      "registerart": "HRB",
      "company_name": "Culaccino GmbH",
      "company_seat": "Frankfurt (Oder)",
      "details": "18.02.2025 (Bekanntmachungsdatum)\n\nBrandenburg Amtsgericht Frankfurt/Oder HRB 17481\nLöschungsankündigung\n\nCulaccino GmbH\nGesellschaft mit beschränkter Haftung\nFrankfurt (Oder)\n\nBei der nachstehenden Gesellschaft wird das Amtslöschungsverfahren gemäß § 394 FamFG eingeleitet."
    },
    {
      "date": "2025-02-18",
      "id": "101575",
      "original_text": "Löschungsankündigung\nBerlin Amtsgericht Berlin (Charlottenburg) HRB 151852\nWALDYS Bau GmbH – Berlin",
      "type": "Löschungsankündigung",
      "state": "Berlin",
      "amtsgericht": "Amtsgericht Berlin (Charlottenburg)",
      "registernummer": "HRB 151852",
      "registerart": "HRB",
      "company_name": "WALDYS Bau GmbH",
      "company_seat": "Berlin",
      "details": "18.02.2025 (Bekanntmachungsdatum)\n\nBerlin Amtsgericht Berlin (Charlottenburg) HRB 151852\nLöschungsankündigung\n\nWALDYS Bau GmbH\nGesellschaft mit beschränkter Haftung\nBerlin\n\nBei der nachstehenden Gesellschaft wird das Amtslöschungsverfahren gemäß § 394 FamFG eingeleitet. Widerspruchsfrist 6 Wochen"
    },
    {
      "date": "2025-02-18",
      "id": "101576",
      "original_text": "Sonstige Registerbekanntmachung\nBerlin Amtsgericht Berlin (Charlottenburg) HRB 60247\nPRIMA Wohnbauten Privatisierungs-Management GmbH – Berlin",
      "type": "Sonstige Registerbekanntmachung",
      "state": "Berlin",
      "amtsgericht": "Amtsgericht Berlin (Charlottenburg)",
      "registernummer": "HRB 60247",
      "registerart": "HRB",
      "company_name": "PRIMA Wohnbauten Privatisierungs-Management GmbH",
      "company_seat": "Berlin",
      "details": "18.02.2025 (Bekanntmachungsdatum)\n\nBerlin Amtsgericht Berlin (Charlottenburg) HRB 60247\nSonstige Registerbekanntmachung 17.02.2025 (Eintragungsdatum)\n\nPRIMA Wohnbauten Privatisierungs-Management GmbH\nGesellschaft mit beschränkter Haftung\nBerlin\n\nAls nicht eingetragen wird veröffentlicht: Der andere Vertragsteil hat den Gläubigern dieses Rechtsträgers, deren Forderungen begründet worden sind, bevor die Eintragung der Beendigung dieses Vertrages in das Handelsregister nach § 10 des Handelsgesetzbuches als bekannt gemacht gilt, Sicherheit zu leisten, wenn sie sich binnen sechs Monaten nach der Bekanntmachung der Eintragung zu diesem Zweck bei ihm melden. Dieses Recht steht den Gläubigern nicht zu, die im Fall des Insolvenzverfahrens ein Recht auf vorzugsweise Befriedigung aus der Deckungsmasse haben, die nach gesetzlicher Vorschrift zu ihrem Schutz errichtet und staatlich überwacht ist."
    },
    {
      "date": "2025-02-18",
      "id": "101577",
      "original_text": "Löschungsankündigung\nBrandenburg Amtsgericht Cottbus HRB 9553\nGFPE Gesellschaft für Planung und Entwicklung mbH – Eichwalde",
      "type": "Löschungsankündigung",
      "state": "Brandenburg",
      "amtsgericht": "Amtsgericht Cottbus",
      "registernummer": "HRB 9553",
      "registerart": "HRB",
      "company_name": "GFPE Gesellschaft für Planung und Entwicklung mbH",
      "company_seat": "Eichwalde",
      "details": "18.02.2025 (Bekanntmachungsdatum)\n\nBrandenburg Amtsgericht Cottbus HRB 9553\nLöschungsankündigung\n\nGFPE Gesellschaft für Planung und Entwicklung mbH\nGesellschaft mit beschränkter Haftung\nEichwalde\n\nBei der nachstehenden Gesellschaft wird das Amtslöschungsverfahren gemäß § 394 FamFG eingeleitet."
    },
    {
      "date": "2025-02-18",
      "id": "101578",
      "original_text": "Löschungsankündigung\nBrandenburg Amtsgericht Frankfurt/Oder HRB 17472\nHERMEDIC GmbH – Eisenhüttenstadt",
      "type": "Löschungsankündigung",
      "state": "Brandenburg",
      "amtsgericht": "Amtsgericht Frankfurt/Oder",
      "registernummer": "HRB 17472",
      "registerart": "HRB",
      "company_name": "HERMEDIC GmbH",
      "company_seat": "Eisenhüttenstadt",
      "details": "18.02.2025 (Bekanntmachungsdatum)\n\nBrandenburg Amtsgericht Frankfurt/Oder HRB 17472\nLöschungsankündigung\n\nHERMEDIC GmbH\nGesellschaft mit beschränkter Haftung\nEisenhüttenstadt\n\nBei der nachstehenden Gesellschaft wird das Amtslöschungsverfahren gemäß § 394 FamFG eingeleitet."
    },
    {
      "date": "2025-02-18",
      "id": "101579",
      "original_text": "Registerbekanntmachung nach dem Umwandlungsgesetz\nBaden-Württemberg Amtsgericht Stuttgart HRB 783929\nB&O Holding GmbH – Freudenstadt",
      "type": "Registerbekanntmachung nach dem Umwandlungsgesetz",
      "state": "Baden-Württemberg",
      "amtsgericht": "Amtsgericht Stuttgart",
      "registernummer": "HRB 783929",
      "registerart": "HRB",
      "company_name": "B&O Holding GmbH",
      "company_seat": "Freudenstadt",
      "details": "18.02.2025 (Bekanntmachungsdatum)\n\nBaden-Württemberg Amtsgericht Stuttgart HRB 783929\nRegisterbekanntmachung nach dem Umwandlungsgesetz 18.02.2025 (Eintragungsdatum)\n\nB&O Holding GmbH\nGesellschaft mit beschränkter Haftung\nFreudenstadt\n\nDen Gläubigern dern an der grenzüberschreitenden Verschmelzung beteiligten übernehmenden Rechtsträger ist, wenn sie binnen sechs Monaten nach dem Tag, an dem die Eintragung der Verschmelzung in das Register des Sitzes desjenigen Rechtsträgers, dessen Gläubiger sie sind, nach § 19 Absatz 3 UmwG als bekanntgemacht gilt, ihren Anspruch nach Grund und Höhe schriftlich anmelden, Sicherheit zu leisten, soweit sie nicht Befriedigung verlangen können. Dieses Recht steht den Gläubigern jedoch nur zu, wenn sie glaubhaft machen, dass durch die Verschmelzung die Erfüllung ihrer Forderung gefährdet wird."
    },
    {
      "date": "2025-02-18",
      "id": "101580",
      "original_text": "Löschungsankündigung\nSaarland Amtsgericht Saarbrücken HRB 101023\nPANADORO GmbH – Völklingen",
      "type": "Löschungsankündigung",
      "state": "Saarland",
      "amtsgericht": "Amtsgericht Saarbrücken",
      "registernummer": "HRB 101023",
      "registerart": "HRB",
      "company_name": "PANADORO GmbH",
      "company_seat": "Völklingen",
      "details": "18.02.2025 (Bekanntmachungsdatum)\n\nSaarland Amtsgericht Saarbrücken HRB 101023\nLöschungsankündigung\n\nPANADORO GmbH\nGesellschaft mit beschränkter Haftung\nVölklingen\n\nEs ist beabsichtigt, die Gesellschaft von Amts wegen gemäß § 394 FamFG wegen Vermögenslosigkeit zu löschen. Gegen die Löschung von Amts wegen ist das Rechtsmittel des Widerspruchs statthaft. Der Widerspruch ist binnen einer Frist von 3 Monaten beginnend mit dem Tag dieser Veröffentlichung durch Einreichen eines Widerspruchsschreibens -schriftlich oder zur Niederschrift der Geschäftsstelle- beim Amtsgericht Saarbrücken, -zentrales Handelsregister-, Mainzerstr.178, 66121 Saarbrücken einzulegen. Der Widerspruch muss die Bezeichnung der angefochtenen Löschungsankündigung enthalten sowie die Erklärung, dass Widerspruch eingelegt wird. Er ist vom Widerspruchsführer oder seinem Bevollmächtigten zu unterzeichnen.\nDas Widerspruchsschreiben kann auch in der Form eines elektronischen Dokumentes eingereicht werden, das mit einer qualifizierten elektronischen Signatur nach dem Signaturgesetz versehen sein muss (§§ 14 Abs. 2 FamFG, 130a, 298 ZPO)."
    },
    {
      "date": "2025-02-18",
      "id": "101581",
      "original_text": "Löschungsankündigung\nHamburg Amtsgericht Hamburg VR 21549\nAfghan Sportfederation in Europe e.V. – Hamburg",
      "type": "Löschungsankündigung",
      "state": "Hamburg",
      "amtsgericht": "Amtsgericht Hamburg",
      "registernummer": "VR 21549",
      "registerart": "VR",
      "company_name": "Afghan Sportfederation in Europe e.V.",
      "company_seat": "Hamburg",
      "details": "18.02.2025 (Bekanntmachungsdatum)\n\nHamburg Amtsgericht Hamburg VR 21549\nLöschungsankündigung\n\nAfghan Sportfederation in Europe e.V.\neingetragener Verein\nHamburg\n\nDas Registergericht beabsichtigt, den im Vereinsregister eingetragenen Verein von Amts wegen nach § 395 FamFG zu löschen, da nach den angestellten Ermittlungen dieser Verein offenbar nicht mehr besteht. Die Frist zur Erhebung eines Widerspruchs gegen die beabsichtigte Löschung wird auf 3 Monate festgesetzt."
    },
    {
      "date": "2025-02-18",
      "id": "101582",
      "original_text": "Löschungsankündigung\nBerlin Amtsgericht Berlin (Charlottenburg) HRB 164851\nPeace Island GmbH – Berlin",
      "type": "Löschungsankündigung",
      "state": "Berlin",
      "amtsgericht": "Amtsgericht Berlin (Charlottenburg)",
      "registernummer": "HRB 164851",
      "registerart": "HRB",
      "company_name": "Peace Island GmbH",
      "company_seat": "Berlin",
      "details": "18.02.2025 (Bekanntmachungsdatum)\n\nBerlin Amtsgericht Berlin (Charlottenburg) HRB 164851\nLöschungsankündigung\n\nPeace Island GmbH\nGesellschaft mit beschränkter Haftung\nBerlin\n\nBei der nachstehenden Gesellschaft wird das Amtslöschungsverfahren gemäß § 394 FamFG eingeleitet. Widerspruchsfrist 6 Wochen"
    },
    {
      "date": "2025-02-18",
      "id": "101583",
      "original_text": "Registerbekanntmachung nach dem Umwandlungsgesetz\nHamburg Amtsgericht Hamburg HRB 101493\nHenning Thiessen GmbH – Hamburg",
      "type": "Registerbekanntmachung nach dem Umwandlungsgesetz",
      "state": "Hamburg",
      "amtsgericht": "Amtsgericht Hamburg",
      "registernummer": "HRB 101493",
      "registerart": "HRB",
      "company_name": "Henning Thiessen GmbH",
      "company_seat": "Hamburg",
      "details": "18.02.2025 (Bekanntmachungsdatum)\n\nHamburg Amtsgericht Hamburg HRB 101493\nRegisterbekanntmachung nach dem Umwandlungsgesetz 18.02.2025 (Eintragungsdatum)\n\nHenning Thiessen GmbH\nGesellschaft mit beschränkter Haftung\nHamburg\n\nAls nicht eingetragen wird bekannt gemacht:\nDen Gläubigern der an der formwechselnden Umwandlung beteiligten Gesellschaften ist, wenn sie binnen sechs Monaten nach dem Tag, an dem die Eintragung der formwechselnden Umwandlung in das Register des Sitzes desjenigen Rechtsträgers, dessen Gläubiger sie sind, nach § 19 Absatz 3 UmwG als bekannt gemacht gilt, ihren Anspruch nach Grund und Höhe schriftlich anmelden, Sicherheit zu leisten, soweit sie nicht Befriedigung verlangen können. Dieses Recht steht den Gläubigern jedoch nur zu, wenn sie glaubhaft machen, dass durch die formwechselnde Umwandlung die Erfüllung ihrer Forderung gefährdet wird."
    },
    {
      "date": "2025-02-18",
      "id": "101584",
      "original_text": "Sonstige Registerbekanntmachung\nBaden-Württemberg Amtsgericht Mannheim HRB 724829\nALPHA ORDINATUM GmbH – Mannheim",
      "type": "Sonstige Registerbekanntmachung",
      "state": "Baden-Württemberg",
      "amtsgericht": "Amtsgericht Mannheim",
      "registernummer": "HRB 724829",
      "registerart": "HRB",
      "company_name": "ALPHA ORDINATUM GmbH",
      "company_seat": "Mannheim",
      "details": "18.02.2025 (Bekanntmachungsdatum)\n\nBaden-Württemberg Amtsgericht Mannheim HRB 724829\nSonstige Registerbekanntmachung\n\nALPHA ORDINATUM GmbH\nGesellschaft mit beschränkter Haftung\nMannheim\n\nDie Gesellschaft hat am 14.02.2025 die Liste über die Zusammensetzung des Aufsichtsrats zum Handelsregister eingereicht."
    },
    {
      "date": "2025-02-18",
      "id": "101585",
      "original_text": "Löschungsankündigung\nBaden-Württemberg Amtsgericht Stuttgart HRB 21605\nJosef Lorenz GmbH – Stuttgart",
      "type": "Löschungsankündigung",
      "state": "Baden-Württemberg",
      "amtsgericht": "Amtsgericht Stuttgart",
      "registernummer": "HRB 21605",
      "registerart": "HRB",
      "company_name": "Josef Lorenz GmbH",
      "company_seat": "Stuttgart",
      "details": "18.02.2025 (Bekanntmachungsdatum)\n\nBaden-Württemberg Amtsgericht Stuttgart HRB 21605\nLöschungsankündigung\n\nJosef Lorenz GmbH\nGesellschaft mit beschränkter Haftung\nStuttgart\n\nDas Gericht beabsichtigt, die Gesellschaft wegen Vermögenslosigkeit im Handelsregister von Amts wegen nach § 394 FamFG zu löschen. Die Frist zur Geltendmachung eines Widerspruchs gegen die beabsichtigte Löschung ist auf zwei Monate ab Veröffentlichung bestimmt."
    },
    {
      "date": "2025-02-18",
      "id": "101586",
      "original_text": "Registerbekanntmachung nach dem Umwandlungsgesetz\nBaden-Württemberg Amtsgericht Freiburg HRB 550244\nConTest GmbH – Radolfzell am Bodensee",
      "type": "Registerbekanntmachung nach dem Umwandlungsgesetz",
      "state": "Baden-Württemberg",
      "amtsgericht": "Amtsgericht Freiburg",
      "registernummer": "HRB 550244",
      "registerart": "HRB",
      "company_name": "ConTest GmbH",
      "company_seat": "Radolfzell am Bodensee",
      "details": "18.02.2025 (Bekanntmachungsdatum)\n\nBaden-Württemberg Amtsgericht Freiburg HRB 550244\nRegisterbekanntmachung nach dem Umwandlungsgesetz 18.02.2025 (Eintragungsdatum)\n\nConTest GmbH\nGesellschaft mit beschränkter Haftung\nRadolfzell am Bodensee\n\nAls nicht eingetragen wird bekanntgemacht:\nDen Gläubigern der an der Verschmelzung beteiligten Rechtsträger ist, wenn sie binnen sechs Monaten nach dem Tag, an dem die Eintragung der Verschmelzung in das Register des Sitzes desjenigen Rechtsträgers, dessen Gläubiger sie sind, nach § 19 Abs. 3 UmwG als bekanntgemacht gilt, ihren Anspruch nach Grund und Höhe schriftlich anmelden, Sicherheit zu leisten, soweit sie nicht Befriedigung verlangen können. Dieses Recht steht den Gläubigern jedoch nur zu, wenn sie glaubhaft machen, dass durch die Verschmelzung die Erfüllung ihrer Forderung gefährdet wird."
    },
    {
      "date": "2025-02-18",
      "id": "101587",
      "original_text": "Löschungsankündigung\nBrandenburg Amtsgericht Cottbus HRB 148\nGlaswerk Großräschen GmbH i.A. – Großräschen",
      "type": "Löschungsankündigung",
      "state": "Brandenburg",
      "amtsgericht": "Amtsgericht Cottbus",
      "registernummer": "HRB 148",
      "registerart": "HRB",
      "company_name": "Glaswerk Großräschen GmbH i.A.",
      "company_seat": "Großräschen",
      "details": "18.02.2025 (Bekanntmachungsdatum)\n\nBrandenburg Amtsgericht Cottbus HRB 148\nLöschungsankündigung\n\nGlaswerk Großräschen GmbH i.A.\nGesellschaft mit beschränkter Haftung\nGroßräschen\n\nBei der nachstehenden Gesellschaft wird das Amtslöschungsverfahren gemäß § 394 FamFG eingeleitet. Widerspruchsfrist: 1 Monat."
    },
    {
      "date": "2025-02-18",
      "id": "101588",
      "original_text": "Registerbekanntmachung nach dem Umwandlungsgesetz\nSchleswig-Holstein Amtsgericht Kiel HRB 1362 SE\nH+H Deutschland GmbH – Wittenborn",
      "type": "Registerbekanntmachung nach dem Umwandlungsgesetz",
      "state": "Schleswig-Holstein",
      "amtsgericht": "Amtsgericht Kiel",
      "registernummer": "HRB 1362 SE",
      "registerart": "HRB",
      "company_name": "H+H Deutschland GmbH",
      "company_seat": "Wittenborn",
      "details": "18.02.2025 (Bekanntmachungsdatum)\n\nSchleswig-Holstein Amtsgericht Kiel HRB 1362 SE\nRegisterbekanntmachung nach dem Umwandlungsgesetz 17.02.2025 (Eintragungsdatum)\n\nH+H Deutschland GmbH\nGesellschaft mit beschränkter Haftung\nWittenborn\n\nZu Eintragungsnummer 43 vom 17.02.2025 wird als nicht eingetragen veröffentlicht: Den Gläubigern der an der Verschmelzung beteiligten Rechtsträger ist, wenn sie binnen sechs Monaten nach dem Tag, an dem die Eintragung der Verschmelzung in das Register des Sitzes desjenigen Rechtsträgers, dessen Gläubiger sie sind, nach § 19 Abs. 3 UmwG bekannt gemacht worden ist, ihren Anspruch nach Grund und Höhe schriftlich anmelden, Sicherheit zu leisten, soweit sie nicht Befriedigung verlangen können. Dieses Recht steht den Gläubigern jedoch nur zu, wenn sie glaubhaft machen, dass durch die Verschmelzung die Erfüllung ihrer Forderung gefährdet wird."
    },
    {
      "date": "2025-02-18",
      "id": "101589",
      "original_text": "Registerbekanntmachung nach dem Umwandlungsgesetz\nBaden-Württemberg Amtsgericht Mannheim HRB 752526\nEnergieprofi24 GmbH – Walldorf",
      "type": "Registerbekanntmachung nach dem Umwandlungsgesetz",
      "state": "Baden-Württemberg",
      "amtsgericht": "Amtsgericht Mannheim",
      "registernummer": "HRB 752526",
      "registerart": "HRB",
      "company_name": "Energieprofi24 GmbH",
      "company_seat": "Walldorf",
      "details": "18.02.2025 (Bekanntmachungsdatum)\n\nBaden-Württemberg Amtsgericht Mannheim HRB 752526\nRegisterbekanntmachung nach dem Umwandlungsgesetz 18.02.2025 (Eintragungsdatum)\n\nEnergieprofi24 GmbH\nGesellschaft mit beschränkter Haftung\nWalldorf\n\nDen Gläubigern der an der Ausgliederung beteiligten Rechtsträger ist, wenn sie binnen sechs Monaten nach dem Tag, an dem die Eintragung der Ausgliederung in das Register des Sitzes desjenigen Rechtsträgers, dessen Gläubiger sie sind, nach § 19 Abs. 3 UmwG als bekanntgemacht gilt, ihren Anspruch nach Grund und Höhe schriftlich anmelden, Sicherheit zu leisten, soweit sie nicht Befriedigung verlangen können. Dieses Recht steht den Gläubigern jedoch nur zu, wenn sie glaubhaft machen, dass durch die Ausgliederung die Erfüllung ihrer Forderung gefährdet wird."
    },
    {
      "date": "2025-02-18",
      "id": "101590",
      "original_text": "Registerbekanntmachung nach dem Umwandlungsgesetz\nBaden-Württemberg Amtsgericht Mannheim HRA 711774\nPatrick Kowalski e.K. Ihr-Energieprofi.de – Walldorf",
      "type": "Registerbekanntmachung nach dem Umwandlungsgesetz",
      "state": "Baden-Württemberg",
      "amtsgericht": "Amtsgericht Mannheim",
      "registernummer": "HRA 711774",
      "registerart": "HRA",
      "company_name": "Patrick Kowalski e.K. Ihr-Energieprofi.de",
      "company_seat": "Walldorf",
      "details": "18.02.2025 (Bekanntmachungsdatum)\n\nBaden-Württemberg Amtsgericht Mannheim HRA 711774\nRegisterbekanntmachung nach dem Umwandlungsgesetz 18.02.2025 (Eintragungsdatum)\n\nPatrick Kowalski e.K. Ihr-Energieprofi.de\nEinzelkaufmann / Einzelkauffrau\nWalldorf\n\nDen Gläubigern der an der Ausgliederung beteiligten Rechtsträger ist, wenn sie binnen sechs Monaten nach dem Tag, an dem die Eintragung der Ausgliederung in das Register des Sitzes desjenigen Rechtsträgers, dessen Gläubiger sie sind, nach § 19 Abs. 3 UmwG als bekanntgemacht gilt, ihren Anspruch nach Grund und Höhe schriftlich anmelden, Sicherheit zu leisten, soweit sie nicht Befriedigung verlangen können. Dieses Recht steht den Gläubigern jedoch nur zu, wenn sie glaubhaft machen, dass durch die Ausgliederung die Erfüllung ihrer Forderung gefährdet wird."
    },
    {
      "date": "2025-02-18",
      "id": "101591",
      "original_text": "Registerbekanntmachung nach dem Umwandlungsgesetz\nSchleswig-Holstein Amtsgericht Kiel HRB 2792\nBSK-Kuvert Beteiligungsgesellschaft mit beschränkter Haftung – Kiel",
      "type": "Registerbekanntmachung nach dem Umwandlungsgesetz",
      "state": "Schleswig-Holstein",
      "amtsgericht": "Amtsgericht Kiel",
      "registernummer": "HRB 2792",
      "registerart": "HRB",
      "company_name": "BSK-Kuvert Beteiligungsgesellschaft mit beschränkter Haftung",
      "company_seat": "Kiel",
      "details": "18.02.2025 (Bekanntmachungsdatum)\n\nSchleswig-Holstein Amtsgericht Kiel HRB 2792\nRegisterbekanntmachung nach dem Umwandlungsgesetz 17.02.2025 (Eintragungsdatum)\n\nBSK-Kuvert Beteiligungsgesellschaft mit beschränkter Haftung\nGesellschaft mit beschränkter Haftung\nKiel\n\nZu Eintragungsnummer 6 vom 17.02.2025 wird als nicht eingetragen veröffentlicht: Den Gläubigern der an der Verschmelzung beteiligten Rechtsträger ist, wenn sie binnen sechs Monaten nach dem Tag, an dem die Eintragung der Verschmelzung in das Register des Sitzes desjenigen Rechtsträgers, dessen Gläubiger sie sind, nach § 19 Abs. 3 UmwG bekannt gemacht worden ist, ihren Anspruch nach Grund und Höhe schriftlich anmelden, Sicherheit zu leisten, soweit sie nicht Befriedigung verlangen können. Dieses Recht steht den Gläubigern jedoch nur zu, wenn sie glaubhaft machen, dass durch die Verschmelzung die Erfüllung ihrer Forderung gefährdet wird."
    },
    {
      "date": "2025-02-18",
      "id": "101592",
      "original_text": "Registerbekanntmachung nach dem Umwandlungsgesetz\nBaden-Württemberg Amtsgericht Stuttgart HRB 771494\nPGS healthcare GmbH – Herrenberg",
      "type": "Registerbekanntmachung nach dem Umwandlungsgesetz",
      "state": "Baden-Württemberg",
      "amtsgericht": "Amtsgericht Stuttgart",
      "registernummer": "HRB 771494",
      "registerart": "HRB",
      "company_name": "PGS healthcare GmbH",
      "company_seat": "Herrenberg",
      "details": "18.02.2025 (Bekanntmachungsdatum)\n\nBaden-Württemberg Amtsgericht Stuttgart HRB 771494\nRegisterbekanntmachung nach dem Umwandlungsgesetz 18.02.2025 (Eintragungsdatum)\n\nPGS healthcare GmbH\nGesellschaft mit beschränkter Haftung\nHerrenberg\n\nAls nicht eingetragen wird bekanntgemacht:\nDen Gläubigern der an der Verschmelzung beteiligten Rechtsträger ist, wenn sie binnen sechs Monaten nach dem Tag, an dem die Eintragung der Verschmelzung in das Register des Sitzes desjenigen Rechtsträgers, dessen Gläubiger sie sind, nach § 19 Abs. 3 UmwG als bekanntgemacht gilt, ihren Anspruch nach Grund und Höhe schriftlich anmelden, Sicherheit zu leisten, soweit sie nicht Befriedigung verlangen können. Dieses Recht steht den Gläubigern jedoch nur zu, wenn sie glaubhaft machen, dass durch die Verschmelzung die Erfüllung ihrer Forderung gefährdet wird."
    },
    {
      "date": "2025-02-18",
      "id": "101593",
      "original_text": "Löschungsankündigung\nSachsen Amtsgericht Dresden HRB 19669\nR + K Projektentwicklungsgesellschaft mbH – Dresden",
      "type": "Löschungsankündigung",
      "state": "Sachsen",
      "amtsgericht": "Amtsgericht Dresden",
      "registernummer": "HRB 19669",
      "registerart": "HRB",
      "company_name": "R + K Projektentwicklungsgesellschaft mbH",
      "company_seat": "Dresden",
      "details": "18.02.2025 (Bekanntmachungsdatum)\n\nSachsen Amtsgericht Dresden HRB 19669\nLöschungsankündigung\n\nR + K Projektentwicklungsgesellschaft mbH\nGesellschaft mit beschränkter Haftung\nDresden\n\nDas Registergericht beabsichtigt, die im Handelsregister eingetragene Gesellschaft von Amts wegen nach § 394 FamFG zu löschen. Die Frist zu Erhebung eines Widerspruchs gegen die beabsichtigte Löschung wird auf einen Monat festgesetzt."
    },
    {
      "date": "2025-02-18",
      "id": "101594",
      "original_text": "Einreichung neuer Dokumente\nSachsen Amtsgericht Dresden HRB 31509\nRadeberger Auto AG – Radeberg",
      "type": "Einreichung neuer Dokumente",
      "state": "Sachsen",
      "amtsgericht": "Amtsgericht Dresden",
      "registernummer": "HRB 31509",
      "registerart": "HRB",
      "company_name": "Radeberger Auto AG",
      "company_seat": "Radeberg",
      "details": "18.02.2025 (Bekanntmachungsdatum)\n\nSachsen Amtsgericht Dresden HRB 31509\nEinreichung neuer Dokumente 18.02.2025 (Eintragungsdatum)\n\nRadeberger Auto AG\nAktiengesellschaft\nRadeberg\n\nAm 17.02.2025 wurde beim Handelsregister des Amtsgerichts Dresden die Liste der Mitglieder des Aufsichtsrats gemäß § 106 AktG eingereicht."
    },
    {
      "date": "2025-02-18",
      "id": "101595",
      "original_text": "Einreichung neuer Dokumente\nSachsen Amtsgericht Dresden HRB 5600\nRegionalbus Oberlausitz GmbH – Bautzen",
      "type": "Einreichung neuer Dokumente",
      "state": "Sachsen",
      "amtsgericht": "Amtsgericht Dresden",
      "registernummer": "HRB 5600",
      "registerart": "HRB",
      "company_name": "Regionalbus Oberlausitz GmbH",
      "company_seat": "Bautzen",
      "details": "18.02.2025 (Bekanntmachungsdatum)\n\nSachsen Amtsgericht Dresden HRB 5600\nEinreichung neuer Dokumente\n\nRegionalbus Oberlausitz GmbH\nGesellschaft mit beschränkter Haftung\nBautzen\n\nAm 14.02.2025 wurde beim Handelsregister des Amtsgerichts Dresden die Liste der Mitglieder des Aufsichtsrats gemäß § 52 GmbHG eingereicht."
    },
    {
      "date": "2025-02-18",
      "id": "101596",
      "original_text": "Löschungsankündigung\nNiedersachsen Amtsgericht Osnabrück HRB 200961\nO & K Fleisch GmbH – Dissen",
      "type": "Löschungsankündigung",
      "state": "Niedersachsen",
      "amtsgericht": "Amtsgericht Osnabrück",
      "registernummer": "HRB 200961",
      "registerart": "HRB",
      "company_name": "O & K Fleisch GmbH",
      "company_seat": "Dissen",
      "details": "18.02.2025 (Bekanntmachungsdatum)\n\nNiedersachsen Amtsgericht Osnabrück HRB 200961\nLöschungsankündigung\n\nO & K Fleisch GmbH\nGesellschaft mit beschränkter Haftung\nDissen\n\nDas Registergericht beabsichtigt, die Gesellschaft von Amts wegen nach § 394 FamFG wegen Vermögenslosigkeit zu löschen. Die Frist zur Erhebung eines Widerspruchs ist auf 1 Monat ab dieser Registerbekanntmachung festgesetzt."
    },
    {
      "date": "2025-02-18",
      "id": "101597",
      "original_text": "Löschungsankündigung\nNiedersachsen Amtsgericht Osnabrück HRB 216297\nM&M Vertrieb UG (haftungsbeschränkt) – Ankum",
      "type": "Löschungsankündigung",
      "state": "Niedersachsen",
      "amtsgericht": "Amtsgericht Osnabrück",
      "registernummer": "HRB 216297",
      "registerart": "HRB",
      "company_name": "M&M Vertrieb UG (haftungsbeschränkt)",
      "company_seat": "Ankum",
      "details": "18.02.2025 (Bekanntmachungsdatum)\n\nNiedersachsen Amtsgericht Osnabrück HRB 216297\nLöschungsankündigung\n\nM&M Vertrieb UG (haftungsbeschränkt)\nGesellschaft mit beschränkter Haftung\nAnkum\n\nDas Registergericht beabsichtigt, die Gesellschaft von Amts wegen nach § 394 FamFG wegen Vermögenslosigkeit zu löschen. Die Frist zur Erhebung eines Widerspruchs ist auf 1 Monat ab dieser Registerbekanntmachung festgesetzt."
    },
    {
      "date": "2025-02-18",
      "id": "101598",
      "original_text": "Einreichung neuer Dokumente\nNiedersachsen Amtsgericht Lüneburg GnR 200012\nZukunftsgenossen eG – Lüneburg",
      "type": "Einreichung neuer Dokumente",
      "state": "Niedersachsen",
      "amtsgericht": "Amtsgericht Lüneburg",
      "registernummer": "GnR 200012",
      "registerart": "GnR",
      "company_name": "Zukunftsgenossen eG",
      "company_seat": "Lüneburg",
      "details": "18.02.2025 (Bekanntmachungsdatum)\n\nNiedersachsen Amtsgericht Lüneburg GnR 200012\nEinreichung neuer Dokumente 18.02.2025 (Eintragungsdatum)\n\nZukunftsgenossen eG\neingetragene Genossenschaft\nLüneburg\n\nEine aktuelle Liste der Mitglieder des Aufsichtsrats ist zum Genossenschaftsregister eingereicht."
    },
    {
      "date": "2025-02-18",
      "id": "101599",
      "original_text": "Löschungsankündigung\nNiedersachsen Amtsgericht Hildesheim HRB 207466\nCOHC Solution Company Limited by Guarantee Niederlassung Deutschland – Hildesheim",
      "type": "Löschungsankündigung",
      "state": "Niedersachsen",
      "amtsgericht": "Amtsgericht Hildesheim",
      "registernummer": "HRB 207466",
      "registerart": "HRB",
      "company_name": "COHC Solution Company Limited by Guarantee Niederlassung Deutschland",
      "company_seat": "Hildesheim",
      "details": "18.02.2025 (Bekanntmachungsdatum)\n\nNiedersachsen Amtsgericht Hildesheim HRB 207466\nLöschungsankündigung 18.02.2025 (Eintragungsdatum)\n\nCOHC Solution Company Limited by Guarantee Niederlassung Deutschland\nRechtsform ausländischen Rechts HRB\nHildesheim\n\nDas Registergericht beabsichtigt, die Gesellschaft von Amts wegen nach § 394 FamFG zu löschen. Die Frist zur Erhebung eines Widerspruchs ist auf 1 Monat ab dieser Registerbekanntmachung festgesetzt."
    },
    {
      "date": "2025-02-18",
      "id": "101600",
      "original_text": "Löschungsankündigung\nNiedersachsen Amtsgericht Oldenburg (Oldenburg) HRB 209437\nPK Bau GmbH – Brake",
      "type": "Löschungsankündigung",
      "state": "Niedersachsen",
      "amtsgericht": "Amtsgericht Oldenburg (Oldenburg)",
      "registernummer": "HRB 209437",
      "registerart": "HRB",
      "company_name": "PK Bau GmbH",
      "company_seat": "Brake",
      "details": "18.02.2025 (Bekanntmachungsdatum)\n\nNiedersachsen Amtsgericht Oldenburg (Oldenburg) HRB 209437\nLöschungsankündigung\n\nPK Bau GmbH\nGesellschaft mit beschränkter Haftung\nBrake\n\nDas Registergericht beabsichtigt, die Gesellschaft von Amts wegen nach § 394 FamFG zu löschen. Die Frist zur Erhebung eines Widerspruchs ist auf 1 Monat ab dieser Registerbekanntmachung festgesetzt."
    },
    {
      "date": "2025-02-18",
      "id": "101601",
      "original_text": "Sonstige Registerbekanntmachung\nNiedersachsen Amtsgericht Braunschweig HRB 2695\nEurofins Institut Nehring GmbH – Braunschweig",
      "type": "Sonstige Registerbekanntmachung",
      "state": "Niedersachsen",
      "amtsgericht": "Amtsgericht Braunschweig",
      "registernummer": "HRB 2695",
      "registerart": "HRB",
      "company_name": "Eurofins Institut Nehring GmbH",
      "company_seat": "Braunschweig",
      "details": "18.02.2025 (Bekanntmachungsdatum)\n\nNiedersachsen Amtsgericht Braunschweig HRB 2695\nSonstige Registerbekanntmachung 18.02.2025 (Eintragungsdatum)\n\nEurofins Institut Nehring GmbH\nGesellschaft mit beschränkter Haftung\nBraunschweig\n\nDen Gläubigern der Gesellschaft, deren Forderungen begründet worden sind, bevor die Eintragung der Beendigung des Vertrages in das Handelsregister nach § 10 HGB als bekanntgemacht gilt, ist vom anderen Vertragsteil Sicherheit zu leisten, wenn sie sich binnen sechs Monaten nach der Bekanntmachung zu diesem Zweck bei ihm melden."
    },
    {
      "date": "2025-02-18",
      "id": "101602",
      "original_text": "Löschungsankündigung\nNiedersachsen Amtsgericht Hildesheim HRB 207576\nRepomax Verwertungs GmbH – Hildesheim",
      "type": "Löschungsankündigung",
      "state": "Niedersachsen",
      "amtsgericht": "Amtsgericht Hildesheim",
      "registernummer": "HRB 207576",
      "registerart": "HRB",
      "company_name": "Repomax Verwertungs GmbH",
      "company_seat": "Hildesheim",
      "details": "18.02.2025 (Bekanntmachungsdatum)\n\nNiedersachsen Amtsgericht Hildesheim HRB 207576\nLöschungsankündigung 18.02.2025 (Eintragungsdatum)\n\nRepomax Verwertungs GmbH\nGesellschaft mit beschränkter Haftung\nHildesheim\n\nDas Registergericht beabsichtigt, die Gesellschaft von Amts wegen nach § 394 FamFG zu löschen. Die Frist zur Erhebung eines Widerspruchs ist auf 1 Monat ab dieser Registerbekanntmachung festgesetzt."
    },
    {
      "date": "2025-02-18",
      "id": "101603",
      "original_text": "Registerbekanntmachung nach dem Umwandlungsgesetz\nNiedersachsen Amtsgericht Oldenburg (Oldenburg) HRB 3727\nDr.Härig Umwelttechnik GmbH – Wardenburg",
      "type": "Registerbekanntmachung nach dem Umwandlungsgesetz",
      "state": "Niedersachsen",
      "amtsgericht": "Amtsgericht Oldenburg (Oldenburg)",
      "registernummer": "HRB 3727",
      "registerart": "HRB",
      "company_name": "Dr.Härig Umwelttechnik GmbH",
      "company_seat": "Wardenburg",
      "details": "18.02.2025 (Bekanntmachungsdatum)\n\nNiedersachsen Amtsgericht Oldenburg (Oldenburg) HRB 3727\nRegisterbekanntmachung nach dem Umwandlungsgesetz 18.02.2025 (Eintragungsdatum)\n\nDr.Härig Umwelttechnik GmbH\nGesellschaft mit beschränkter Haftung\nWardenburg\n\nDen Gläubigern der an der Verschmelzung beteiligten Rechtsträger ist, wenn sie binnen sechs Monaten nach dem Tag, an dem die Eintragung der Verschmelzung in das Register des Sitzes desjenigen Rechtsträgers, dessen Gläubiger sie sind, nach § 19  Abs.  3 UmwG als bekannt gemacht gilt, ihren Anspruch nach Grund und Höhe schriftlich anmelden, Sicherheit zu leisten, soweit sie nicht Befriedigung verlangen können. Dieses Recht steht den Gläubigern jedoch nur zu, wenn sie glaubhaft machen, dass durch die Verschmelzung die Erfüllung der Forderung gefährdet wird."
    },
    {
      "date": "2025-02-18",
      "id": "101604",
      "original_text": "Löschungsankündigung\nNiedersachsen Amtsgericht Oldenburg (Oldenburg) HRB 200754\nNordica Polstermöbel GmbH – Delmenhorst",
      "type": "Löschungsankündigung",
      "state": "Niedersachsen",
      "amtsgericht": "Amtsgericht Oldenburg (Oldenburg)",
      "registernummer": "HRB 200754",
      "registerart": "HRB",
      "company_name": "Nordica Polstermöbel GmbH",
      "company_seat": "Delmenhorst",
      "details": "18.02.2025 (Bekanntmachungsdatum)\n\nNiedersachsen Amtsgericht Oldenburg (Oldenburg) HRB 200754\nLöschungsankündigung\n\nNordica Polstermöbel GmbH\nGesellschaft mit beschränkter Haftung\nDelmenhorst\n\nDas Registergericht beabsichtigt, die Gesellschaft von Amts wegen nach § 394 FamFG zu löschen. Die Frist zur Erhebung eines Widerspruchs ist auf 1 Monat ab dieser Registerbekanntmachung festgesetzt."
    },
    {
      "date": "2025-02-18",
      "id": "101605",
      "original_text": "Einreichung neuer Dokumente\nNiedersachsen Amtsgericht Braunschweig HRB 200809\nStadtbus Goslar GmbH – Goslar",
      "type": "Einreichung neuer Dokumente",
      "state": "Niedersachsen",
      "amtsgericht": "Amtsgericht Braunschweig",
      "registernummer": "HRB 200809",
      "registerart": "HRB",
      "company_name": "Stadtbus Goslar GmbH",
      "company_seat": "Goslar",
      "details": "18.02.2025 (Bekanntmachungsdatum)\n\nNiedersachsen Amtsgericht Braunschweig HRB 200809\nEinreichung neuer Dokumente 18.02.2025 (Eintragungsdatum)\n\nStadtbus Goslar GmbH\nGesellschaft mit beschränkter Haftung\nGoslar\n\nDie Liste der Mitglieder des Aufsichtsrats wurde beim Registergericht eingereicht."
    },
    {
      "date": "2025-02-18",
      "id": "101606",
      "original_text": "Löschungsankündigung\nRheinland-Pfalz Amtsgericht Wittlich HRB 44814\nIndustriebau Rieder GmbH – Platten",
      "type": "Löschungsankündigung",
      "state": "Rheinland-Pfalz",
      "amtsgericht": "Amtsgericht Wittlich",
      "registernummer": "HRB 44814",
      "registerart": "HRB",
      "company_name": "Industriebau Rieder GmbH",
      "company_seat": "Platten",
      "details": "18.02.2025 (Bekanntmachungsdatum)\n\nRheinland-Pfalz Amtsgericht Wittlich HRB 44814\nLöschungsankündigung\n\nIndustriebau Rieder GmbH\nGesellschaft mit beschränkter Haftung\nPlatten\n\nDas Registergericht beabsichtigt den Geschäftsführer der Gesellschaft, Rainer Nobereit, von Amts wegen nach § 395 FamFG zu löschen. Die Frist zur Erhebung eines Widerspruchs ist auf einen Monat festgesetzt."
    },
    {
      "date": "2025-02-18",
      "id": "101607",
      "original_text": "Einreichung neuer Dokumente\nRheinland-Pfalz Amtsgericht Ludwigshafen a.Rhein (Ludwigshafen) HRB 21892\nWirtschaftsförderungsgesellschaft Frankenthal (Pfalz) mbH – Frankenthal",
      "type": "Einreichung neuer Dokumente",
      "state": "Rheinland-Pfalz",
      "amtsgericht": "Amtsgericht Ludwigshafen a.Rhein (Ludwigshafen)",
      "registernummer": "HRB 21892",
      "registerart": "HRB",
      "company_name": "Wirtschaftsförderungsgesellschaft Frankenthal (Pfalz) mbH",
      "company_seat": "Frankenthal",
      "details": "18.02.2025 (Bekanntmachungsdatum)\n\nRheinland-Pfalz Amtsgericht Ludwigshafen a.Rhein (Ludwigshafen) HRB 21892\nEinreichung neuer Dokumente\n\nWirtschaftsförderungsgesellschaft Frankenthal (Pfalz) mbH\nGesellschaft mit beschränkter Haftung\nFrankenthal\n\nDem Registergericht ist eine neue Liste der Mitglieder des Aufsichtsrates eingereicht worden."
    },
    {
      "date": "2025-02-18",
      "id": "101608",
      "original_text": "Einreichung neuer Dokumente\nRheinland-Pfalz Amtsgericht Mainz HRB 64\nMainzer Aktien-Bierbrauerei Aktiengesellschaft – Mainz",
      "type": "Einreichung neuer Dokumente",
      "state": "Rheinland-Pfalz",
      "amtsgericht": "Amtsgericht Mainz",
      "registernummer": "HRB 64",
      "registerart": "HRB",
      "company_name": "Mainzer Aktien-Bierbrauerei Aktiengesellschaft",
      "company_seat": "Mainz",
      "details": "18.02.2025 (Bekanntmachungsdatum)\n\nRheinland-Pfalz Amtsgericht Mainz HRB 64\nEinreichung neuer Dokumente\n\nMainzer Aktien-Bierbrauerei Aktiengesellschaft\nAktiengesellschaft\nMainz\n\nDem Registergericht ist eine neue Liste der Mitglieder des Aufsichtsrates eingereicht worden."
    },
    {
      "date": "2025-02-18",
      "id": "101609",
      "original_text": "Registerbekanntmachung nach dem Umwandlungsgesetz\nBremen Amtsgericht Bremen HRB 6733\nIpsen Logistics GmbH – Bremen",
      "type": "Registerbekanntmachung nach dem Umwandlungsgesetz",
      "state": "Bremen",
      "amtsgericht": "Amtsgericht Bremen",
      "registernummer": "HRB 6733",
      "registerart": "HRB",
      "company_name": "Ipsen Logistics GmbH",
      "company_seat": "Bremen",
      "details": "18.02.2025 (Bekanntmachungsdatum)\n\nBremen Amtsgericht Bremen HRB 6733\nRegisterbekanntmachung nach dem Umwandlungsgesetz 14.02.2025 (Eintragungsdatum)\n\nIpsen Logistics GmbH\nGesellschaft mit beschränkter Haftung\nBremen\n\nZu Eintragungsnummer 31 vom 14.02.2025 wird als nicht eingetragen veröffentlicht: Den Gläubigern der an der Verschmelzung beteiligten Rechtsträger ist, wenn sie binnen sechs Monaten nach dem Tag, an dem die Eintragung der Verschmelzung in das Register des Sitzes desjenigen Rechtsträgers, dessen Gläubiger sie sind, als bekannt gemacht gilt, ihren Anspruch nach Grund und Höhe schriftlich anmelden, Sicherheit zu leisten, soweit sie nicht Befriedigung verlangen können. Dieses Recht steht den Gläubigern jedoch nur zu, wenn sie glaubhaft machen, dass durch die Verschmelzung die Erfüllung ihrer Forderung gefährdet wird. Das Recht, Sicherheitsleistung zu verlangen, steht Gläubigern nicht zu, die im Falle der Insolvenz ein Recht auf vorzugsweise Befriedigung aus einer Deckungsmasse haben, die nach gesetzlicher Vorschrift zu ihrem Schutz errichtet und staatlich überwacht ist."
    },
    {
      "date": "2025-02-18",
      "id": "101610",
      "original_text": "Registerbekanntmachung nach dem Umwandlungsgesetz\nBremen Amtsgericht Bremen HRB 36522\nIpsen Air Logistics GmbH – Bremen",
      "type": "Registerbekanntmachung nach dem Umwandlungsgesetz",
      "state": "Bremen",
      "amtsgericht": "Amtsgericht Bremen",
      "registernummer": "HRB 36522",
      "registerart": "HRB",
      "company_name": "Ipsen Air Logistics GmbH",
      "company_seat": "Bremen",
      "details": "18.02.2025 (Bekanntmachungsdatum)\n\nBremen Amtsgericht Bremen HRB 36522\nRegisterbekanntmachung nach dem Umwandlungsgesetz 14.02.2025 (Eintragungsdatum)\n\nIpsen Air Logistics GmbH\nGesellschaft mit beschränkter Haftung\nBremen\n\nZu Eintragungsnummer 2 vom 14.02.2025 wird als nicht eingetragen veröffentlicht: Den Gläubigern der an der Verschmelzung beteiligten Rechtsträger ist, wenn sie binnen sechs Monaten nach dem Tag, an dem die Eintragung der Verschmelzung in das Register des Sitzes desjenigen Rechtsträgers, dessen Gläubiger sie sind, als bekannt gemacht gilt, ihren Anspruch nach Grund und Höhe schriftlich anmelden, Sicherheit zu leisten, soweit sie nicht Befriedigung verlangen können. Dieses Recht steht den Gläubigern jedoch nur zu, wenn sie glaubhaft machen, dass durch die Verschmelzung die Erfüllung ihrer Forderung gefährdet wird. Das Recht, Sicherheitsleistung zu verlangen, steht Gläubigern nicht zu, die im Falle der Insolvenz ein Recht auf vorzugsweise Befriedigung aus einer Deckungsmasse haben, die nach gesetzlicher Vorschrift zu ihrem Schutz errichtet und staatlich überwacht ist."
    },
    {
      "date": "2025-02-18",
      "id": "101611",
      "original_text": "Einreichung neuer Dokumente\nNordrhein-Westfalen Amtsgericht Köln HRB 95810\nneues handeln AG – Köln",
      "type": "Einreichung neuer Dokumente",
      "state": "Nordrhein-Westfalen",
      "amtsgericht": "Amtsgericht Köln",
      "registernummer": "HRB 95810",
      "registerart": "HRB",
      "company_name": "neues handeln AG",
      "company_seat": "Köln",
      "details": "18.02.2025 (Bekanntmachungsdatum)\n\nNordrhein-Westfalen Amtsgericht Köln HRB 95810\nEinreichung neuer Dokumente\n\nneues handeln AG\nAktiengesellschaft\nKöln\n\nDem Registergericht ist eine neue Liste der Mitglieder des Aufsichtsrates eingereicht worden."
    },
    {
      "date": "2025-02-18",
      "id": "101612",
      "original_text": "Löschungsankündigung\nNordrhein-Westfalen Amtsgericht Hagen HRB 12401\nAutopark Hagen GmbH – Hagen",
      "type": "Löschungsankündigung",
      "state": "Nordrhein-Westfalen",
      "amtsgericht": "Amtsgericht Hagen",
      "registernummer": "HRB 12401",
      "registerart": "HRB",
      "company_name": "Autopark Hagen GmbH",
      "company_seat": "Hagen",
      "details": "18.02.2025 (Bekanntmachungsdatum)\n\nNordrhein-Westfalen Amtsgericht Hagen HRB 12401\nLöschungsankündigung\n\nAutopark Hagen GmbH\nGesellschaft mit beschränkter Haftung\nHagen\n\nDas Registergericht beabsichtigt, die im Handelsregister eingetragene Gesellschaft gemäß § 394 Absatz 1 FamFG wegen Vermögenslosigkeit von Amts wegen zu löschen.  Gegen diese Verfügung kann Widerspruch eingelegt werden. Die Frist zur Erhebung eines Widerspruchs gegen die beabsichtigte Löschung von Amts wegen ist auf drei Monate festgesetzt.\n\nRechtsbehelfsbelehrung:\nGegen diese Verfügung können Sie Widerspruch einlegen.\n\nDer Widerspruch ist bei dem Amtsgericht Hagen, Heinitzstraße 42, 58097 Hagen schriftlich in deutscher Sprache oder zur Niederschrift der Geschäftsstelle einzulegen. Der Widerspruch kann auch zur Niederschrift der Geschäftsstelle eines jeden Amtsgerichtes abgegeben werden.\n\nDer Widerspruch muss spätestens innerhalb der gesetzten Frist bei dem Amtsgericht Hagen eingegangen sein. Dies gilt auch dann, wenn der Widerspruch zur Niederschrift der Geschäftsstelle eines anderen Amtsgerichtes abgegeben wurde. Die Frist beginnt mit der Veröffentlichung. Fällt das Ende der Frist auf einen Sonntag, einen allgemeinen Feiertag oder Sonnabend, so endet die Frist mit Ablauf des nächsten Werktages.\n\nDer Widerspruch muss die Bezeichnung der angefochtenen Verfügung sowie die Erklärung enthalten, dass Widerspruch gegen diese Verfügung eingelegt wird. Er ist zu unterzeichnen und soll begründet werden."
    },
    {
      "date": "2025-02-18",
      "id": "101613",
      "original_text": "Löschungsankündigung\nNordrhein-Westfalen Amtsgericht Krefeld HRB 18494\nHopar Int. Service GmbH – Nettetal",
      "type": "Löschungsankündigung",
      "state": "Nordrhein-Westfalen",
      "amtsgericht": "Amtsgericht Krefeld",
      "registernummer": "HRB 18494",
      "registerart": "HRB",
      "company_name": "Hopar Int. Service GmbH",
      "company_seat": "Nettetal",
      "details": "18.02.2025 (Bekanntmachungsdatum)\n\nNordrhein-Westfalen Amtsgericht Krefeld HRB 18494\nLöschungsankündigung\n\nHopar Int. Service GmbH\nGesellschaft mit beschränkter Haftung\nNettetal\n\nDas Registergericht beabsichtigt die Gesellschaft von Amts wegen nach § 394 FamFG zu löschen. Die Frist zur Erhebung eines Widerspruchs ist auf einen Monat festgesetzt."
    },
    {
      "date": "2025-02-18",
      "id": "101614",
      "original_text": "Sonstige Registerbekanntmachung\nNordrhein-Westfalen Amtsgericht Köln HRB 48466\nBayer Gastronomie GmbH – Leverkusen",
      "type": "Sonstige Registerbekanntmachung",
      "state": "Nordrhein-Westfalen",
      "amtsgericht": "Amtsgericht Köln",
      "registernummer": "HRB 48466",
      "registerart": "HRB",
      "company_name": "Bayer Gastronomie GmbH",
      "company_seat": "Leverkusen",
      "details": "18.02.2025 (Bekanntmachungsdatum)\n\nNordrhein-Westfalen Amtsgericht Köln HRB 48466\nSonstige Registerbekanntmachung\n\nBayer Gastronomie GmbH\nGesellschaft mit beschränkter Haftung\nLeverkusen\n\nDem Registergericht ist eine Liste der Mitglieder des Aufsichtsrates eingereicht worden."
    },
    {
      "date": "2025-02-18",
      "id": "101615",
      "original_text": "Registerbekanntmachung nach dem Umwandlungsgesetz\nNordrhein-Westfalen Amtsgericht Aachen HRB 5985\napi GmbH – Baesweiler",
      "type": "Registerbekanntmachung nach dem Umwandlungsgesetz",
      "state": "Nordrhein-Westfalen",
      "amtsgericht": "Amtsgericht Aachen",
      "registernummer": "HRB 5985",
      "registerart": "HRB",
      "company_name": "api GmbH",
      "company_seat": "Baesweiler",
      "details": "18.02.2025 (Bekanntmachungsdatum)\n\nNordrhein-Westfalen Amtsgericht Aachen HRB 5985\nRegisterbekanntmachung nach dem Umwandlungsgesetz 18.02.2025 (Eintragungsdatum)\n\napi GmbH\nGesellschaft mit beschränkter Haftung\nBaesweiler\n\nDen Gläubigern der an der Verschmelzung beteiligten Rechtsträger ist, wenn sie binnen sechs Monaten nach dem Tag, an dem die Eintragung der Verschmelzung in das Register des Sitzes derjenigen Rechtsträger deren Gläubiger sie sind, nach § 19 Absatz 3 UmwG als bekanntgemacht gilt, ihren Anspruch nach Grund und Höhe schriftlich anmelden, Sicherheit zu leisten, soweit sie nicht Befriedigung verlangen können. Dieses Recht steht den Gläubigern jedoch nur zu, wenn sie glaubhaft machen, dass durch die Verschmelzung die Erfüllung ihrer Forderung gefährdet wird."
    },
    {
      "date": "2025-02-18",
      "id": "101616",
      "original_text": "Löschungsankündigung\nNordrhein-Westfalen Amtsgericht Dortmund HRB 6371\nVFZ Verlag für Zielgruppeninformationen Verwaltungs GmbH – Dortmund",
      "type": "Löschungsankündigung",
      "state": "Nordrhein-Westfalen",
      "amtsgericht": "Amtsgericht Dortmund",
      "registernummer": "HRB 6371",
      "registerart": "HRB",
      "company_name": "VFZ Verlag für Zielgruppeninformationen Verwaltungs GmbH",
      "company_seat": "Dortmund",
      "details": "18.02.2025 (Bekanntmachungsdatum)\n\nNordrhein-Westfalen Amtsgericht Dortmund HRB 6371\nLöschungsankündigung\n\nVFZ Verlag für Zielgruppeninformationen Verwaltungs GmbH\nGesellschaft mit beschränkter Haftung\nDortmund\n\nDas Registergericht beabsichtigt die Gesellschaft von Amts wegen nach § 394 FamFG zu löschen. Die Frist zur Erhebung eines Widerspruchs ist auf zwei Monate festgesetzt."
    },
    {
      "date": "2025-02-18",
      "id": "101617",
      "original_text": "Einreichung neuer Dokumente\nNordrhein-Westfalen Amtsgericht Düsseldorf HRB 101315\nACM Deutschland Non-Life AG – Düsseldorf",
      "type": "Einreichung neuer Dokumente",
      "state": "Nordrhein-Westfalen",
      "amtsgericht": "Amtsgericht Düsseldorf",
      "registernummer": "HRB 101315",
      "registerart": "HRB",
      "company_name": "ACM Deutschland Non-Life AG",
      "company_seat": "Düsseldorf",
      "details": "18.02.2025 (Bekanntmachungsdatum)\n\nNordrhein-Westfalen Amtsgericht Düsseldorf HRB 101315\nEinreichung neuer Dokumente\n\nACM Deutschland Non-Life AG\nAktiengesellschaft\nDüsseldorf\n\nDem Registergericht ist eine Liste der Mitglieder des Aufsichtsrates eingereicht worden."
    },
    {
      "date": "2025-02-18",
      "id": "101618",
      "original_text": "Registerbekanntmachung nach dem Umwandlungsgesetz\nNordrhein-Westfalen Amtsgericht Bochum VR 2495\nSauerländischer Gebirgsverein, Abteilung Wattenscheid e.V. – Bochum",
      "type": "Registerbekanntmachung nach dem Umwandlungsgesetz",
      "state": "Nordrhein-Westfalen",
      "amtsgericht": "Amtsgericht Bochum",
      "registernummer": "VR 2495",
      "registerart": "VR",
      "company_name": "Sauerländischer Gebirgsverein, Abteilung Wattenscheid e.V.",
      "company_seat": "Bochum",
      "details": "18.02.2025 (Bekanntmachungsdatum)\n\nNordrhein-Westfalen Amtsgericht Bochum VR 2495\nRegisterbekanntmachung nach dem Umwandlungsgesetz 17.02.2025 (Eintragungsdatum)\n\nSauerländischer Gebirgsverein, Abteilung Wattenscheid e.V.\neingetragener Verein\nBochum\n\nDen Gläubigern der an der Verschmelzung beteiligten Rechtsträger ist, wenn sie binnen sechs Monaten nach dem Tag, an dem die Eintragung der Verschmelzung in das Register des Sitzes derjenigen Rechtsträger deren Gläubiger sie sind, nach § 19 Absatz 3 UmwG als bekanntgemacht gilt, ihren Anspruch nach Grund und Höhe schriftlich anmelden, Sicherheit zu leisten, soweit sie nicht Befriedigung verlangen können. Dieses Recht steht den Gläubigern jedoch nur zu, wenn sie glaubhaft machen, dass durch die Verschmelzung die Erfüllung ihrer Forderung gefährdet wird."
    },
    {
      "date": "2025-02-18",
      "id": "101619",
      "original_text": "Löschungsankündigung\nNordrhein-Westfalen Amtsgericht Köln HRB 112707\nVENOB Trading UG (haftungsbeschränkt) – Köln",
      "type": "Löschungsankündigung",
      "state": "Nordrhein-Westfalen",
      "amtsgericht": "Amtsgericht Köln",
      "registernummer": "HRB 112707",
      "registerart": "HRB",
      "company_name": "VENOB Trading UG (haftungsbeschränkt)",
      "company_seat": "Köln",
      "details": "18.02.2025 (Bekanntmachungsdatum)\n\nNordrhein-Westfalen Amtsgericht Köln HRB 112707\nLöschungsankündigung\n\nVENOB Trading UG (haftungsbeschränkt)\nGesellschaft mit beschränkter Haftung\nKöln\n\nDas Registergericht beabsichtigt die Gesellschaft von Amts wegen nach § 394 FamFG zu löschen. Die Frist zur Erhebung eines Widerspruchs ist auf einen Monat festgesetzt."
    },
    {
      "date": "2025-02-18",
      "id": "101620",
      "original_text": "Löschungsankündigung\nNordrhein-Westfalen Amtsgericht Kleve HRB 19946\nMenda Bau GmbH – Kamp-Lintfort",
      "type": "Löschungsankündigung",
      "state": "Nordrhein-Westfalen",
      "amtsgericht": "Amtsgericht Kleve",
      "registernummer": "HRB 19946",
      "registerart": "HRB",
      "company_name": "Menda Bau GmbH",
      "company_seat": "Kamp-Lintfort",
      "details": "18.02.2025 (Bekanntmachungsdatum)\n\nNordrhein-Westfalen Amtsgericht Kleve HRB 19946\nLöschungsankündigung\n\nMenda Bau GmbH\nGesellschaft mit beschränkter Haftung\nKamp-Lintfort\n\nDas Registergericht beabsichtigt die Gesellschaft von Amts wegen nach § 394 FamFG zu löschen. Die Frist zur Erhebung eines Widerspruchs ist auf einen Monat festgesetzt."
    },
    {
      "date": "2025-02-18",
      "id": "101621",
      "original_text": "Löschungsankündigung\nNordrhein-Westfalen Amtsgericht Wuppertal HRB 25474\nA & B Bauingenieure GmbH – Solingen",
      "type": "Löschungsankündigung",
      "state": "Nordrhein-Westfalen",
      "amtsgericht": "Amtsgericht Wuppertal",
      "registernummer": "HRB 25474",
      "registerart": "HRB",
      "company_name": "A & B Bauingenieure GmbH",
      "company_seat": "Solingen",
      "details": "18.02.2025 (Bekanntmachungsdatum)\n\nNordrhein-Westfalen Amtsgericht Wuppertal HRB 25474\nLöschungsankündigung\n\nA & B Bauingenieure GmbH\nGesellschaft mit beschränkter Haftung\nSolingen\n\nDas Registergericht beabsichtigt die Gesellschaft von Amts wegen nach § 394 FamFG zu löschen. Die Frist zur Erhebung eines Widerspruchs ist auf einen Monat festgesetzt."
    },
    {
      "date": "2025-02-18",
      "id": "101622",
      "original_text": "Löschungsankündigung\nNordrhein-Westfalen Amtsgericht Krefeld HRB 17200\nMotorWerk Elektronik Vertrieb GmbH – Willich",
      "type": "Löschungsankündigung",
      "state": "Nordrhein-Westfalen",
      "amtsgericht": "Amtsgericht Krefeld",
      "registernummer": "HRB 17200",
      "registerart": "HRB",
      "company_name": "MotorWerk Elektronik Vertrieb GmbH",
      "company_seat": "Willich",
      "details": "18.02.2025 (Bekanntmachungsdatum)\n\nNordrhein-Westfalen Amtsgericht Krefeld HRB 17200\nLöschungsankündigung\n\nMotorWerk Elektronik Vertrieb GmbH\nGesellschaft mit beschränkter Haftung\nWillich\n\nDas Registergericht beabsichtigt die Gesellschaft von Amts wegen nach § 394 FamFG zu löschen. Die Frist zur Erhebung eines Widerspruchs ist auf einen Monat festgesetzt."
    },
    {
      "date": "2025-02-18",
      "id": "101623",
      "original_text": "Registerbekanntmachung nach dem Umwandlungsgesetz\nNordrhein-Westfalen Amtsgericht Bochum VR 10307 früher Amtsgericht Witten\nSauerländischer Gebirgs-Verein (SGV) Abteilung Witten e.V. – Witten",
      "type": "Registerbekanntmachung nach dem Umwandlungsgesetz",
      "state": "Nordrhein-Westfalen",
      "amtsgericht": "Amtsgericht Bochum",
      "registernummer": "VR 10307",
      "registerart": "VR",
      "company_name": "Sauerländischer Gebirgs-Verein (SGV) Abteilung Witten e.V.",
      "company_seat": "Witten",
      "former_amtsgericht": "Witten",
      "details": "18.02.2025 (Bekanntmachungsdatum)\n\nNordrhein-Westfalen Amtsgericht Bochum VR 10307 früher Amtsgericht Witten\nRegisterbekanntmachung nach dem Umwandlungsgesetz 17.02.2025 (Eintragungsdatum)\n\nSauerländischer Gebirgs-Verein (SGV) Abteilung Witten e.V.\neingetragener Verein\nWitten\n\nDen Gläubigern der an der Verschmelzung beteiligten Rechtsträger ist, wenn sie binnen sechs Monaten nach dem Tag, an dem die Eintragung der Verschmelzung in das Register des Sitzes desjenigen Rechtsträgers, dessen Gläubiger sie sind, nach § 19 Absatz 3 UmwG als bekanntgemacht gilt, ihren Anspruch nach Grund und Höhe schriftlich anmelden, Sicherheit zu leisten, soweit sie nicht Befriedigung verlangen können. Dieses Recht steht den Gläubigern jedoch nur zu, wenn sie glaubhaft machen, dass durch die Verschmelzung die Erfüllung ihrer Forderung gefährdet wird."
    },
    {
      "date": "2025-02-18",
      "id": "101624",
      "original_text": "Registerbekanntmachung nach dem Umwandlungsgesetz\nNordrhein-Westfalen Amtsgericht Gelsenkirchen HRB 17870\nUSL Service GmbH – Bottrop",
      "type": "Registerbekanntmachung nach dem Umwandlungsgesetz",
      "state": "Nordrhein-Westfalen",
      "amtsgericht": "Amtsgericht Gelsenkirchen",
      "registernummer": "HRB 17870",
      "registerart": "HRB",
      "company_name": "USL Service GmbH",
      "company_seat": "Bottrop",
      "details": "18.02.2025 (Bekanntmachungsdatum)\n\nNordrhein-Westfalen Amtsgericht Gelsenkirchen HRB 17870\nRegisterbekanntmachung nach dem Umwandlungsgesetz 18.02.2025 (Eintragungsdatum)\n\nUSL Service GmbH\nGesellschaft mit beschränkter Haftung\nBottrop\n\nDen Gläubigern der an der formwechselnden Umwandlung beteiligten Rechtsträger ist, wenn sie binnen sechs Monaten nach dem Tag, an dem die Eintragung der formwechselnden Umwandlung in das Register des Sitzes desjenigen Rechtsträgers, dessen Gläubiger sie sind, nach § 19 Absatz 3 UmwG als bekanntgemacht gilt, ihren Anspruch nach Grund und Höhe schriftlich anmelden, Sicherheit zu leisten, soweit sie nicht Befriedigung verlangen können. Dieses Recht steht den Gläubigern jedoch nur zu, wenn sie glaubhaft machen, dass durch die formwechselnden Umwandlung die Erfüllung ihrer Forderung gefährdet wird."
    },
    {
      "date": "2025-02-18",
      "id": "101625",
      "original_text": "Einreichung neuer Dokumente\nNordrhein-Westfalen Amtsgericht Hamm HRB 11334\nDRK Ambulante Pflege Hamm gGmbH – Hamm",
      "type": "Einreichung neuer Dokumente",
      "state": "Nordrhein-Westfalen",
      "amtsgericht": "Amtsgericht Hamm",
      "registernummer": "HRB 11334",
      "registerart": "HRB",
      "company_name": "DRK Ambulante Pflege Hamm gGmbH",
      "company_seat": "Hamm",
      "details": "18.02.2025 (Bekanntmachungsdatum)\n\nNordrhein-Westfalen Amtsgericht Hamm HRB 11334\nEinreichung neuer Dokumente 18.02.2025 (Eintragungsdatum)\n\nDRK Ambulante Pflege Hamm gGmbH\nGesellschaft mit beschränkter Haftung\nHamm\n\nDem Registergericht ist eine neue Liste der Mitglieder des Aufsichtsrates eingereicht worden."
    },
    {
      "date": "2025-02-18",
      "id": "101626",
      "original_text": "Löschungsankündigung\nNordrhein-Westfalen Amtsgericht Siegburg HRB 15699\nGürsoy Bauunternehmung UG (haftungsbeschränkt) – Sankt Augustin",
      "type": "Löschungsankündigung",
      "state": "Nordrhein-Westfalen",
      "amtsgericht": "Amtsgericht Siegburg",
      "registernummer": "HRB 15699",
      "registerart": "HRB",
      "company_name": "Gürsoy Bauunternehmung UG (haftungsbeschränkt)",
      "company_seat": "Sankt Augustin",
      "details": "18.02.2025 (Bekanntmachungsdatum)\n\nNordrhein-Westfalen Amtsgericht Siegburg HRB 15699\nLöschungsankündigung\n\nGürsoy Bauunternehmung UG (haftungsbeschränkt)\nGesellschaft mit beschränkter Haftung\nSankt Augustin\n\nDas Registergericht hat glaubhafte Kenntnis erlangt, dass die Gesellschaft vermögenslos geworden ist.\n\nEs ist daher beabsichtigt, die Gesellschaft nach § 394 FamFG im Handelsregister wegen Vermögenslosigkeit zu löschen.\nEinwände gegen die Löschung sind durch Widerspruch binnen einer Frist von 3 Monaten geltend zu machen, andernfalls die Löschung erfolgen wird.\n\nEinzulegen ist der Widerspruch bei dem Amtsgericht Siegburg, Neue Poststraße 16, 53721 Siegburg, und zwar entweder schriftlich in deutscher Sprache oder mündlich zur Niederschrift der Geschäftsstelle. Der Widerspruch kann auch zur Niederschrift der Geschäftsstelle eines jeden Amtsgerichts abgegeben werden. Der Widerspruch ist binnen der in der Verfügung bestimmten Frist einzulegen. Die Frist ist nur gewahrt, wenn der Widerspruch rechtzeitig bei dem Amtsgericht Siegburg eingeht, auch wenn der Widerspruch zur Niederschrift der Geschäftsstelle eines anderen Amtsgerichts abgegeben wurde. Die Frist beginnt jeweils mit der schriftlichen Bekanntgabe der Verfügung an die Beteiligten. Kann die schriftliche Bekanntgabe an einen Beteiligten nicht bewirkt werden, beginnt die Frist spätestens mit Ablauf von fünf Monaten nach Erlass der Verfügung. Die Bekanntgabe ist entweder durch Zustellung oder am dritten Tage nach Aufgabe zur Post bewirkt. Sofern die Löschung noch nicht erfolgt ist, kann der Widerspruch auch noch nach Ablauf der Frist eingelegt werden. Fällt das Ende der Frist auf einen Sonnabend, einen Sonntag oder einen allgemeinen Feiertag, endet die Frist mit Ablauf des nächsten Werktages. Der Widerspruch ist zu unterzeichnen. Eine Begründung des Widerspruchs ist nicht vorgeschrieben."
    },
    {
      "date": "2025-02-18",
      "id": "101627",
      "original_text": "Löschungsankündigung\nNordrhein-Westfalen Amtsgericht Aachen HRB 22404\nDiRaVi UG (haftungsbeschränkt) – Aachen",
      "type": "Löschungsankündigung",
      "state": "Nordrhein-Westfalen",
      "amtsgericht": "Amtsgericht Aachen",
      "registernummer": "HRB 22404",
      "registerart": "HRB",
      "company_name": "DiRaVi UG (haftungsbeschränkt)",
      "company_seat": "Aachen",
      "details": "18.02.2025 (Bekanntmachungsdatum)\n\nNordrhein-Westfalen Amtsgericht Aachen HRB 22404\nLöschungsankündigung\n\nDiRaVi UG (haftungsbeschränkt)\nGesellschaft mit beschränkter Haftung\nAachen\n\nDas Registergericht beabsichtigt, von Amts wegen die Gesellschaft wegen Vermögenslosigkeit nach § 394 FamFG zu löschen, weil das Insolvenzverfahren Amtsgericht Aachen (Az.: 93 IN 146/23) beendet und Vermögen der Gesellschaft nicht mehr erkennbar ist.\n\nZur Geltendmachung des Widerspruchs gegen die beabsichtigte Löschung wird hiermit eine Frist von einem Monat ab Veröffentlichung dieser Ankündigung bestimmt.\n\nRechtsbehelfsbelehrung:\n\nGegen diese Verfügung kann Widerspruch eingelegt werden. Zum Widerspruch ist jeder berechtigt, der an der Unterlassung der Löschung ein berechtigtes Interesse hat.\n\nDer Widerspruch ist bei dem Amtsgericht Aachen, Adalbertsteinweg 92, 52070 Aachen schriftlich in deutscher Sprache oder zur Niederschrift der Geschäftsstelle einzulegen. Der Widerspruch kann auch zur Niederschrift der Geschäftsstelle eines jeden Amtsgerichtes abgegeben werden.\n\nDer Widerspruch muss spätestens innerhalb der gesetzten Frist nach der Bekanntgabe der Verfügung bei dem Amtsgericht Aachen eingegangen sein. Dies gilt auch dann, wenn der Widerspruch zur Niederschrift der Geschäftsstelle eines anderen Amtsgerichtes abgegeben wurde. Die Frist beginnt mit der Bekanntgabe der Verfügung durch Veröffentlichung. Fällt das Ende der Frist auf einen Sonntag, einen allgemeinen Feiertag oder Sonnabend, so endet die Frist mit Ablauf des nächsten Werktages.\n\nDer Widerspruch muss die Bezeichnung der angefochtenen Verfügung sowie die Erklärung enthalten, dass Widerspruch gegen diese Verfügung eingelegt wird. Er ist zu unterzeichnen und soll begründet werden.\n\nDie Einlegung ist auch durch Übertragung eines elektronischen Dokuments an die elektronische Poststelle des Gerichts möglich. Das elektronische Dokument muss für die Bearbeitung durch das Gericht geeignet und mit einer qualifizierten elektronischen Signatur der verantwortenden Person versehen sein oder von der verantwortenden Person signiert und auf einem sicheren Übermittlungsweg gemäß § 130 a ZPO nach näherer Maßgabe der Verordnung über die technischen Rahmenbedingungen des elektronischen Rechtsverkehrs und über das besondere elektronische Behördenpostfach (BGBl. I, S. 3803) eingereicht werden. Weitere Informationen erhalten Sie auf der Internetseite www.justiz.de."
    },
    {
      "date": "2025-02-18",
      "id": "101628",
      "original_text": "Löschungsankündigung\nNordrhein-Westfalen Amtsgericht Köln HRB 119021\nMelius Konstrukt GmbH – Köln",
      "type": "Löschungsankündigung",
      "state": "Nordrhein-Westfalen",
      "amtsgericht": "Amtsgericht Köln",
      "registernummer": "HRB 119021",
      "registerart": "HRB",
      "company_name": "Melius Konstrukt GmbH",
      "company_seat": "Köln",
      "details": "18.02.2025 (Bekanntmachungsdatum)\n\nNordrhein-Westfalen Amtsgericht Köln HRB 119021\nLöschungsankündigung\n\nMelius Konstrukt GmbH\nGesellschaft mit beschränkter Haftung\nKöln\n\nDas Registergericht beabsichtigt die Gesellschaft von Amts wegen nach § 394 FamFG zu löschen. Die Frist zur Erhebung eines Widerspruchs ist auf einen Monat festgesetzt."
    },
    {
      "date": "2025-02-18",
      "id": "101629",
      "original_text": "Registerbekanntmachung nach dem Umwandlungsgesetz\nNordrhein-Westfalen Amtsgericht Gelsenkirchen HRA 6378\nUSL Service GmbH & Co.KG – Bottrop",
      "type": "Registerbekanntmachung nach dem Umwandlungsgesetz",
      "state": "Nordrhein-Westfalen",
      "amtsgericht": "Amtsgericht Gelsenkirchen",
      "registernummer": "HRA 6378",
      "registerart": "HRA",
      "company_name": "USL Service GmbH & Co.KG",
      "company_seat": "Bottrop",
      "details": "18.02.2025 (Bekanntmachungsdatum)\n\nNordrhein-Westfalen Amtsgericht Gelsenkirchen HRA 6378\nRegisterbekanntmachung nach dem Umwandlungsgesetz 18.02.2025 (Eintragungsdatum)\n\nUSL Service GmbH & Co.KG\nKommanditgesellschaft\nBottrop\n\nDen Gläubigern der an der formwechselnden Umwandlung beteiligten Rechtsträger ist, wenn sie binnen sechs Monaten nach dem Tag, an dem die Eintragung der formwechselnden Umwandlung in das Register des Sitzes desjenigen Rechtsträgers, dessen Gläubiger sie sind, nach § 19 Absatz 3 UmwG als bekanntgemacht gilt, ihren Anspruch nach Grund und Höhe schriftlich anmelden, Sicherheit zu leisten, soweit sie nicht Befriedigung verlangen können. Dieses Recht steht den Gläubigern jedoch nur zu, wenn sie glaubhaft machen, dass durch die formwechselnden Umwandlung die Erfüllung ihrer Forderung gefährdet wird."
    },
    {
      "date": "2025-02-18",
      "id": "101630",
      "original_text": "Löschungsankündigung\nNordrhein-Westfalen Amtsgericht Dortmund HRB 28479\nECUEXISS GmbH – Dortmund",
      "type": "Löschungsankündigung",
      "state": "Nordrhein-Westfalen",
      "amtsgericht": "Amtsgericht Dortmund",
      "registernummer": "HRB 28479",
      "registerart": "HRB",
      "company_name": "ECUEXISS GmbH",
      "company_seat": "Dortmund",
      "details": "18.02.2025 (Bekanntmachungsdatum)\n\nNordrhein-Westfalen Amtsgericht Dortmund HRB 28479\nLöschungsankündigung\n\nECUEXISS GmbH\nGesellschaft mit beschränkter Haftung\nDortmund\n\nDas Registergericht beabsichtigt die Gesellschaft von Amts wegen nach § 394 FamFG zu löschen. Die Frist zur Erhebung eines Widerspruchs ist auf zwei Monate festgesetzt."
    },
    {
      "date": "2025-02-18",
      "id": "101631",
      "original_text": "Löschungsankündigung\nNordrhein-Westfalen Amtsgericht Köln HRB 93486\nEu Kontakt UG (haftungsbeschränkt – Köln",
      "type": "Löschungsankündigung",
      "state": "Nordrhein-Westfalen",
      "amtsgericht": "Amtsgericht Köln",
      "registernummer": "HRB 93486",
      "registerart": "HRB",
      "company_name": "Eu Kontakt UG (haftungsbeschränkt",
      "company_seat": "Köln",
      "details": "18.02.2025 (Bekanntmachungsdatum)\n\nNordrhein-Westfalen Amtsgericht Köln HRB 93486\nLöschungsankündigung\n\nEu Kontakt UG (haftungsbeschränkt\nGesellschaft mit beschränkter Haftung\nKöln\n\nDas Registergericht beabsichtigt die Gesellschaft von Amts wegen nach § 394 FamFG zu löschen. Die Frist zur Erhebung eines Widerspruchs ist auf einen Monat festgesetzt."
    },
    {
      "date": "2025-02-18",
      "id": "101632",
      "original_text": "Sonstige Registerbekanntmachung\nNordrhein-Westfalen Amtsgericht Gelsenkirchen HRB 15329\nCasacura Pflegedienst AG – Marl",
      "type": "Sonstige Registerbekanntmachung",
      "state": "Nordrhein-Westfalen",
      "amtsgericht": "Amtsgericht Gelsenkirchen",
      "registernummer": "HRB 15329",
      "registerart": "HRB",
      "company_name": "Casacura Pflegedienst AG",
      "company_seat": "Marl",
      "details": "18.02.2025 (Bekanntmachungsdatum)\n\nNordrhein-Westfalen Amtsgericht Gelsenkirchen HRB 15329\nSonstige Registerbekanntmachung 18.02.2025 (Eintragungsdatum)\n\nCasacura Pflegedienst AG\nAktiengesellschaft\nMarl\n\nDem Registergericht ist eine neue Liste der Mitglieder des Aufsichtsrates eingereicht worden."
    },
    {
      "date": "2025-02-18",
      "id": "101633",
      "original_text": "Löschungsankündigung\nThüringen Amtsgericht Jena HRB 507777\nS-M-S Sport-Motor-Service UG (haftungsbeschränkt) – Eisenberg",
      "type": "Löschungsankündigung",
      "state": "Thüringen",
      "amtsgericht": "Amtsgericht Jena",
      "registernummer": "HRB 507777",
      "registerart": "HRB",
      "company_name": "S-M-S Sport-Motor-Service UG (haftungsbeschränkt)",
      "company_seat": "Eisenberg",
      "details": "18.02.2025 (Bekanntmachungsdatum)\n\nThüringen Amtsgericht Jena HRB 507777\nLöschungsankündigung\n\nS-M-S Sport-Motor-Service UG (haftungsbeschränkt)\nGesellschaft mit beschränkter Haftung\nEisenberg\n\nDas Registergericht beabsichtigt, die im Handelsregister eingetragene Gesellschaft wegen Vermögenslosigkeit nach § 394 FamFG von Amts wegen zu löschen. Die Frist zur Erhebung eines Widerspruchs gegen die beabsichtigte Löschung wird auf 6 Wochen festgesetzt."
    },
    {
      "date": "2025-02-18",
      "id": "101634",
      "original_text": "Einreichung neuer Dokumente\nThüringen Amtsgericht Jena HRB 302409\nStadtwerke Suhl/Zella-Mehlis GmbH – Suhl",
      "type": "Einreichung neuer Dokumente",
      "state": "Thüringen",
      "amtsgericht": "Amtsgericht Jena",
      "registernummer": "HRB 302409",
      "registerart": "HRB",
      "company_name": "Stadtwerke Suhl/Zella-Mehlis GmbH",
      "company_seat": "Suhl",
      "details": "18.02.2025 (Bekanntmachungsdatum)\n\nThüringen Amtsgericht Jena HRB 302409\nEinreichung neuer Dokumente\n\nStadtwerke Suhl/Zella-Mehlis GmbH\nGesellschaft mit beschränkter Haftung\nSuhl\n\nBekanntmachung gem. § 52 Abs. 3 Satz 2 GmbHG: Aufgrund einer Veränderung in den Personen der Aufsichtsratsmitglieder ist durch den Geschäftsführer eine neue Liste zum Handelsregister eingereicht worden."
    },
    {
      "date": "2025-02-18",
      "id": "101635",
      "original_text": "Löschungsankündigung\nHessen Amtsgericht Frankfurt am Main HRB 105033\nSAVA GmbH – Eschborn",
      "type": "Löschungsankündigung",
      "state": "Hessen",
      "amtsgericht": "Amtsgericht Frankfurt am Main",
      "registernummer": "HRB 105033",
      "registerart": "HRB",
      "company_name": "SAVA GmbH",
      "company_seat": "Eschborn",
      "details": "18.02.2025 (Bekanntmachungsdatum)\n\nHessen Amtsgericht Frankfurt am Main HRB 105033\nLöschungsankündigung\n\nSAVA GmbH\nGesellschaft mit beschränkter Haftung\nEschborn\n\nDas Registergericht beabsichtigt die im Handelsregister eingetragene Gesellschaft von Amts wegen nach § 394 FamFG zu löschen. Die Frist zur Erhebung eines Widerspruchs gegen die beabsichtigte Löschung wird auf 1 Monat festgesetzt."
    },
    {
      "date": "2025-02-18",
      "id": "101636",
      "original_text": "Sonstige Registerbekanntmachung\nHessen Amtsgericht Hanau HRB 95143\nME.S Management GmbH – Hanau",
      "type": "Sonstige Registerbekanntmachung",
      "state": "Hessen",
      "amtsgericht": "Amtsgericht Hanau",
      "registernummer": "HRB 95143",
      "registerart": "HRB",
      "company_name": "ME.S Management GmbH",
      "company_seat": "Hanau",
      "details": "18.02.2025 (Bekanntmachungsdatum)\n\nHessen Amtsgericht Hanau HRB 95143\nSonstige Registerbekanntmachung 18.02.2025 (Eintragungsdatum)\n\nME.S Management GmbH\nGesellschaft mit beschränkter Haftung\nHanau\n\nDen Gläubigern der Gesellschaft, deren Forderungen begründet worden sind, bevor die Eintragung der Beendigung des Vertrags in das Handelsregister nach § 10 HGB bekannt gemacht worden ist, ist vom anderen Vertragsteil Sicherheit zu leisten, wenn sie sich binnen sechs Monaten nach dieser Bekanntmachung zu diesem Zweck bei ihm melden."
    },
    {
      "date": "2025-02-18",
      "id": "101637",
      "original_text": "Löschungsankündigung\nHessen Amtsgericht Frankfurt am Main HRB 108752\nTernaer GmbH – Frankfurt am Main",
      "type": "Löschungsankündigung",
      "state": "Hessen",
      "amtsgericht": "Amtsgericht Frankfurt am Main",
      "registernummer": "HRB 108752",
      "registerart": "HRB",
      "company_name": "Ternaer GmbH",
      "company_seat": "Frankfurt am Main",
      "details": "18.02.2025 (Bekanntmachungsdatum)\n\nHessen Amtsgericht Frankfurt am Main HRB 108752\nLöschungsankündigung\n\nTernaer GmbH\nGesellschaft mit beschränkter Haftung\nFrankfurt am Main\n\nDas Registergericht beabsichtigt die im Handelsregister eingetragene Gesellschaft von Amts wegen nach § 394 FamFG zu löschen. Die Frist zur Erhebung eines Widerspruchs gegen die beabsichtigte Löschung wird auf 1 Monat festgesetzt."
    },
    {
      "date": "2025-02-18",
      "id": "101638",
      "original_text": "Löschungsankündigung\nHessen Amtsgericht Frankfurt am Main HRB 107563\nON Creative GmbH – Frankfurt am Main",
      "type": "Löschungsankündigung",
      "state": "Hessen",
      "amtsgericht": "Amtsgericht Frankfurt am Main",
      "registernummer": "HRB 107563",
      "registerart": "HRB",
      "company_name": "ON Creative GmbH",
      "company_seat": "Frankfurt am Main",
      "details": "18.02.2025 (Bekanntmachungsdatum)\n\nHessen Amtsgericht Frankfurt am Main HRB 107563\nLöschungsankündigung 18.02.2025 (Eintragungsdatum)\n\nON Creative GmbH\nGesellschaft mit beschränkter Haftung\nFrankfurt am Main\n\nDas Registergericht beabsichtigt die im Handelsregister eingetragene Gesellschaft von Amts wegen nach § 394 FamFG zu löschen. Die Frist zur Erhebung eines Widerspruchs gegen die beabsichtigte Löschung wird auf 1 Monat festgesetzt."
    },
    {
      "date": "2025-02-18",
      "id": "101639",
      "original_text": "Löschungsankündigung\nHessen Amtsgericht Frankfurt am Main HRB 120456\nEuropean Strategic Investments GmbH – Frankfurt am Main",
      "type": "Löschungsankündigung",
      "state": "Hessen",
      "amtsgericht": "Amtsgericht Frankfurt am Main",
      "registernummer": "HRB 120456",
      "registerart": "HRB",
      "company_name": "European Strategic Investments GmbH",
      "company_seat": "Frankfurt am Main",
      "details": "18.02.2025 (Bekanntmachungsdatum)\n\nHessen Amtsgericht Frankfurt am Main HRB 120456\nLöschungsankündigung\n\nEuropean Strategic Investments GmbH\nGesellschaft mit beschränkter Haftung\nFrankfurt am Main\n\nDas Registergericht beabsichtigt die im Handelsregister eingetragene Gesellschaft von Amts wegen nach § 394 FamFG zu löschen. Die Frist zur Erhebung eines Widerspruchs gegen die beabsichtigte Löschung wird auf 1 Monat festgesetzt."
    },
    {
      "date": "2025-02-18",
      "id": "101640",
      "original_text": "Löschungsankündigung\nHessen Amtsgericht Fritzlar HRB 12204\nCynergy Power GmbH – Felsberg",
      "type": "Löschungsankündigung",
      "state": "Hessen",
      "amtsgericht": "Amtsgericht Fritzlar",
      "registernummer": "HRB 12204",
      "registerart": "HRB",
      "company_name": "Cynergy Power GmbH",
      "company_seat": "Felsberg",
      "details": "18.02.2025 (Bekanntmachungsdatum)\n\nHessen Amtsgericht Fritzlar HRB 12204\nLöschungsankündigung 18.02.2025 (Eintragungsdatum)\n\nCynergy Power GmbH\nGesellschaft mit beschränkter Haftung\nFelsberg\n\nDas Registergericht beabsichtigt die im Handelsregister eingetragene Gesellschaft von Amts wegen nach § 394 FamFG zu löschen. Die Frist zur Erhebung eines Widerspruchs gegen die beabsichtigte Löschung wird auf 3 Monate festgesetzt."
    },
    {
      "date": "2025-02-18",
      "id": "101641",
      "original_text": "Einreichung neuer Dokumente\nHessen Amtsgericht Frankfurt am Main HRB 79744\nKfW IPEX-Bank GmbH – Frankfurt am Main",
      "type": "Einreichung neuer Dokumente",
      "state": "Hessen",
      "amtsgericht": "Amtsgericht Frankfurt am Main",
      "registernummer": "HRB 79744",
      "registerart": "HRB",
      "company_name": "KfW IPEX-Bank GmbH",
      "company_seat": "Frankfurt am Main",
      "details": "18.02.2025 (Bekanntmachungsdatum)\n\nHessen Amtsgericht Frankfurt am Main HRB 79744\nEinreichung neuer Dokumente\n\nKfW IPEX-Bank GmbH\nGesellschaft mit beschränkter Haftung\nFrankfurt am Main\n\nDurch eine Änderung in den Personen der Aufsichtsratsmitglieder ist eine Liste der Mitglieder des Aufsichtsrates zum Handelsregister eingereicht worden."
    },
    {
      "date": "2025-02-18",
      "id": "101642",
      "original_text": "Löschungsankündigung\nHessen Amtsgericht Friedberg HRB 9236\nAK Gastroservice UG (haftungsbeschränkt) – Rosbach v. d. Höhe",
      "type": "Löschungsankündigung",
      "state": "Hessen",
      "amtsgericht": "Amtsgericht Friedberg",
      "registernummer": "HRB 9236",
      "registerart": "HRB",
      "company_name": "AK Gastroservice UG (haftungsbeschränkt)",
      "company_seat": "Rosbach v. d. Höhe",
      "details": "18.02.2025 (Bekanntmachungsdatum)\n\nHessen Amtsgericht Friedberg HRB 9236\nLöschungsankündigung\n\nAK Gastroservice UG (haftungsbeschränkt)\nGesellschaft mit beschränkter Haftung\nRosbach v. d. Höhe\n\nDas Registergericht beabsichtigt die im Handelsregister eingetragene Gesellschaft von Amts wegen nach § 394 FamFG zu löschen. Die Frist zur Erhebung eines Widerspruchs gegen die beabsichtigte Löschung wird auf 3 Monate festgesetzt."
    },
    {
      "date": "2025-02-18",
      "id": "101643",
      "original_text": "Löschungsankündigung\nHessen Amtsgericht Friedberg HRB 9236\nAK Gastroservice UG (haftungsbeschränkt) – Rosbach v. d. Höhe",
      "type": "Löschungsankündigung",
      "state": "Hessen",
      "amtsgericht": "Amtsgericht Friedberg",
      "registernummer": "HRB 9236",
      "registerart": "HRB",
      "company_name": "AK Gastroservice UG (haftungsbeschränkt)",
      "company_seat": "Rosbach v. d. Höhe",
      "details": "18.02.2025 (Bekanntmachungsdatum)\n\nHessen Amtsgericht Friedberg HRB 9236\nLöschungsankündigung\n\nAK Gastroservice UG (haftungsbeschränkt)\nGesellschaft mit beschränkter Haftung\nRosbach v. d. Höhe\n\nDas Registergericht beabsichtigt die im Handelsregister eingetragene Gesellschaft von Amts wegen nach § 394 FamFG zu löschen. Die Frist zur Erhebung eines Widerspruchs gegen die beabsichtigte Löschung wird auf 3 Monate festgesetzt."
    },
    {
      "date": "2025-02-18",
      "id": "101644",
      "original_text": "Sonstige Registerbekanntmachung\nHessen Amtsgericht Wiesbaden VR 7052\nLenzhahner Spaßbühne e.V. – Idstein",
      "type": "Sonstige Registerbekanntmachung",
      "state": "Hessen",
      "amtsgericht": "Amtsgericht Wiesbaden",
      "registernummer": "VR 7052",
      "registerart": "VR",
      "company_name": "Lenzhahner Spaßbühne e.V.",
      "company_seat": "Idstein",
      "details": "18.02.2025 (Bekanntmachungsdatum)\n\nHessen Amtsgericht Wiesbaden VR 7052\nSonstige Registerbekanntmachung 18.02.2025 (Eintragungsdatum)\n\nLenzhahner Spaßbühne e.V.\neingetragener Verein\nIdstein\n\nDer Verein ist aufgelöst."
    },
    {
      "date": "2025-02-18",
      "id": "101645",
      "original_text": "Löschungsankündigung\nHessen Amtsgericht Darmstadt VR 83737\nArbeitskreis Asyl Münster e.V. – Münster",
      "type": "Löschungsankündigung",
      "state": "Hessen",
      "amtsgericht": "Amtsgericht Darmstadt",
      "registernummer": "VR 83737",
      "registerart": "VR",
      "company_name": "Arbeitskreis Asyl Münster e.V.",
      "company_seat": "Münster",
      "details": "18.02.2025 (Bekanntmachungsdatum)\n\nHessen Amtsgericht Darmstadt VR 83737\nLöschungsankündigung 18.02.2025 (Eintragungsdatum)\n\nArbeitskreis Asyl Münster e.V.\neingetragener Verein\nMünster\n\nDer Verein ist aufgelöst."
    },
    {
      "date": "2025-02-18",
      "id": "101646",
      "original_text": "Löschungsankündigung\nHessen Amtsgericht Frankfurt am Main HRA 29737\nFERRERO INDUSTRIAL SERVICES - Gruppo Europeo di Interesse Economico – Frankfurt am Main",
      "type": "Löschungsankündigung",
      "state": "Hessen",
      "amtsgericht": "Amtsgericht Frankfurt am Main",
      "registernummer": "HRA 29737",
      "registerart": "HRA",
      "company_name": "FERRERO INDUSTRIAL SERVICES - Gruppo Europeo di Interesse Economico",
      "company_seat": "Frankfurt am Main",
      "details": "18.02.2025 (Bekanntmachungsdatum)\n\nHessen Amtsgericht Frankfurt am Main HRA 29737\nLöschungsankündigung\n\nFERRERO INDUSTRIAL SERVICES - Gruppo Europeo di Interesse Economico\nEuropäische wirtschaftliche Interessenvereinigung\nFrankfurt am Main\n\nDas Registergericht beabsichtigt die im Handelsregister eingetragene Firma von Amts wegen nach § 395 FamFG zu löschen. Die Frist zur Erhebung eines Widerspruchs gegen die beabsichtigte Löschung wird auf 1 Monat festgesetzt."
    },
    {
      "date": "2025-02-18",
      "id": "101647",
      "original_text": "Löschungsankündigung\nHessen Amtsgericht Limburg HRB 6314\nSMBD GmbH – Bad Camberg",
      "type": "Löschungsankündigung",
      "state": "Hessen",
      "amtsgericht": "Amtsgericht Limburg",
      "registernummer": "HRB 6314",
      "registerart": "HRB",
      "company_name": "SMBD GmbH",
      "company_seat": "Bad Camberg",
      "details": "18.02.2025 (Bekanntmachungsdatum)\n\nHessen Amtsgericht Limburg HRB 6314\nLöschungsankündigung\n\nSMBD GmbH\nGesellschaft mit beschränkter Haftung\nBad Camberg\n\nDas Registergericht beabsichtigt die im Handelsregister eingetragene Gesellschaft von Amts wegen nach § 394 FamFG zu löschen. Die Frist zur Erhebung eines Widerspruchs gegen die beabsichtigte Löschung wird auf 3 Monate festgesetzt."
    }
  ]
}