{
  "date": "2025-02-15",
  "date_of_scrape": "2025-02-16T04:03:15.600Z",
  "tool_version": "0.2.0",
  "number_of_announcements": 17,
  "announcements": [
    {
      "date": "2025-02-15",
      "id": "101418",
      "original_text": "Löschungsankündigung\nBayern Amtsgericht Ingolstadt HRB 11331\nstudio 3 GmbH – Ingolstadt",
      "type": "Löschungsankündigung",
      "state": "Bayern",
      "amtsgericht": "Amtsgericht Ingolstadt",
      "registernummer": "HRB 11331",
      "registerart": "HRB",
      "company_name": "studio 3 GmbH",
      "company_seat": "Ingolstadt",
      "details": "15.02.2025 (Bekanntmachungsdatum)\n\nBayern Amtsgericht Ingolstadt HRB 11331\nLöschungsankündigung\n\nstudio 3 GmbH\nGesellschaft mit beschränkter Haftung\nIngolstadt\n\nDas Registergericht beabsichtigt, die im Handelsregister eingetragene Gesellschaft wegen Vermögenslosigkeit von Amts wegen nach § 394 FamFG zu löschen. Die Frist zur Erhebung eines Widerspruchs ist auf einen Monat festgesetzt."
    },
    {
      "date": "2025-02-15",
      "id": "101419",
      "original_text": "Einreichung neuer Dokumente\nBayern Amtsgericht Regensburg HRB 9570\nknowis AG – Regensburg",
      "type": "Einreichung neuer Dokumente",
      "state": "Bayern",
      "amtsgericht": "Amtsgericht Regensburg",
      "registernummer": "HRB 9570",
      "registerart": "HRB",
      "company_name": "knowis AG",
      "company_seat": "Regensburg",
      "details": "15.02.2025 (Bekanntmachungsdatum)\n\nBayern Amtsgericht Regensburg HRB 9570\nEinreichung neuer Dokumente 14.02.2025 (Eintragungsdatum)\n\nknowis AG\nAktiengesellschaft\nRegensburg\n\nDem Amtsgericht Regensburg -Registergericht- ist eine Liste der Mitglieder des Aufsichtsrats eingereicht worden, § 106 AktG."
    },
    {
      "date": "2025-02-15",
      "id": "101420",
      "original_text": "Registerbekanntmachung nach dem Umwandlungsgesetz\nBayern Amtsgericht Nürnberg HRB 37059\nSANDOS GmbH – Nürnberg",
      "type": "Registerbekanntmachung nach dem Umwandlungsgesetz",
      "state": "Bayern",
      "amtsgericht": "Amtsgericht Nürnberg",
      "registernummer": "HRB 37059",
      "registerart": "HRB",
      "company_name": "SANDOS GmbH",
      "company_seat": "Nürnberg",
      "details": "15.02.2025 (Bekanntmachungsdatum)\n\nBayern Amtsgericht Nürnberg HRB 37059\nRegisterbekanntmachung nach dem Umwandlungsgesetz 14.02.2025 (Eintragungsdatum)\n\nSANDOS GmbH\nGesellschaft mit beschränkter Haftung\nNürnberg\n\nDen Gläubigern der an der Verschmelzung beteiligten Rechtsträger ist, wenn sie binnen sechs Monaten nach dem Tag, an dem die Eintragung der Verschmelzung in das Register des Sitzes desjenigen Rechtsträgers, dessen Gläubiger sie sind, nach § 19 Abs. 3 UmwG als bekannt gemacht gilt, ihren Anspruch nach Grund und Höhe in Textform anmelden, Sicherheit zu leisten, soweit sie nicht Befriedigung verlangen können. Dieses Recht steht den Gläubigern jedoch nur zu, wenn sie glaubhaft machen, dass durch die Verschmelzung die Erfüllung ihrer Forderung gefährdet wird."
    },
    {
      "date": "2025-02-15",
      "id": "101421",
      "original_text": "Einreichung neuer Dokumente\nBayern Amtsgericht München HRB 192992\nImmunoQure AG – München",
      "type": "Einreichung neuer Dokumente",
      "state": "Bayern",
      "amtsgericht": "Amtsgericht München",
      "registernummer": "HRB 192992",
      "registerart": "HRB",
      "company_name": "ImmunoQure AG",
      "company_seat": "München",
      "details": "15.02.2025 (Bekanntmachungsdatum)\n\nBayern Amtsgericht München HRB 192992\nEinreichung neuer Dokumente 14.02.2025 (Eintragungsdatum)\n\nImmunoQure AG\nAktiengesellschaft\nMünchen\n\nDem #Re.Name ist eine Liste der Mitglieder des Aufsichtsrats eingereicht worden, § 106 AktG."
    },
    {
      "date": "2025-02-15",
      "id": "101422",
      "original_text": "Registerbekanntmachung nach dem Umwandlungsgesetz\nBayern Amtsgericht München VR 8537\nNaturFreunde Deutschlands Ortsgruppe München Obersendling-Hochkopf e.V. – München",
      "type": "Registerbekanntmachung nach dem Umwandlungsgesetz",
      "state": "Bayern",
      "amtsgericht": "Amtsgericht München",
      "registernummer": "VR 8537",
      "registerart": "VR",
      "company_name": "NaturFreunde Deutschlands Ortsgruppe München Obersendling-Hochkopf e.V.",
      "company_seat": "München",
      "details": "15.02.2025 (Bekanntmachungsdatum)\n\nBayern Amtsgericht München VR 8537\nRegisterbekanntmachung nach dem Umwandlungsgesetz 14.02.2025 (Eintragungsdatum)\n\nNaturFreunde Deutschlands Ortsgruppe München Obersendling-Hochkopf e.V.\neingetragener Verein\nMünchen\n\nDen Gläubigern der an der Verschmelzung beteiligten Rechtsträger ist, wenn sie binnen sechs Monaten nach dem Tag, an dem die Eintragung der Verschmelzung in das Register des Sitzes desjenigen Rechtsträgers, dessen Gläubiger sie sind, nach § 19 Abs. 3 UmwG als bekannt gemacht gilt, ihren Anspruch nach Grund und Höhe in Textform anmelden, Sicherheit zu leisten, soweit sie nicht Befriedigung verlangen können. Dieses Recht steht den Gläubigern jedoch nur zu, wenn sie glaubhaft machen, dass durch die Verschmelzung die Erfüllung ihrer Forderung gefährdet wird."
    },
    {
      "date": "2025-02-15",
      "id": "101423",
      "original_text": "Registerbekanntmachung nach dem Umwandlungsgesetz\nBayern Amtsgericht München HRB 278818\nreplex GmbH – Garching b.München",
      "type": "Registerbekanntmachung nach dem Umwandlungsgesetz",
      "state": "Bayern",
      "amtsgericht": "Amtsgericht München",
      "registernummer": "HRB 278818",
      "registerart": "HRB",
      "company_name": "replex GmbH",
      "company_seat": "Garching b.München",
      "details": "15.02.2025 (Bekanntmachungsdatum)\n\nBayern Amtsgericht München HRB 278818\nRegisterbekanntmachung nach dem Umwandlungsgesetz 14.02.2025 (Eintragungsdatum)\n\nreplex GmbH\nGesellschaft mit beschränkter Haftung\nGarching b.München\n\nDen Gläubigern der an der Verschmelzung beteiligten Rechtsträger ist, wenn sie binnen sechs Monaten nach dem Tag, an dem die Eintragung der Verschmelzung in das Register des Sitzes desjenigen Rechtsträgers, dessen Gläubiger sie sind, nach § 19 Abs. 3 UmwG als bekannt gemacht gilt, ihren Anspruch nach Grund und Höhe in Textform anmelden, Sicherheit zu leisten, soweit sie nicht Befriedigung verlangen können. Dieses Recht steht den Gläubigern jedoch nur zu, wenn sie glaubhaft machen, dass durch die Verschmelzung die Erfüllung ihrer Forderung gefährdet wird."
    },
    {
      "date": "2025-02-15",
      "id": "101424",
      "original_text": "Registerbekanntmachung nach dem Umwandlungsgesetz\nBayern Amtsgericht Nürnberg HRB 38433\nJD Software Solutions GmbH – Nürnberg",
      "type": "Registerbekanntmachung nach dem Umwandlungsgesetz",
      "state": "Bayern",
      "amtsgericht": "Amtsgericht Nürnberg",
      "registernummer": "HRB 38433",
      "registerart": "HRB",
      "company_name": "JD Software Solutions GmbH",
      "company_seat": "Nürnberg",
      "details": "15.02.2025 (Bekanntmachungsdatum)\n\nBayern Amtsgericht Nürnberg HRB 38433\nRegisterbekanntmachung nach dem Umwandlungsgesetz 14.02.2025 (Eintragungsdatum)\n\nJD Software Solutions GmbH\nGesellschaft mit beschränkter Haftung\nNürnberg\n\nDen Gläubigern der an der Verschmelzung beteiligten Rechtsträger ist, wenn sie binnen sechs Monaten nach dem Tag, an dem die Eintragung der Verschmelzung in das Register des Sitzes desjenigen Rechtsträgers, dessen Gläubiger sie sind, nach § 19 Abs. 3 UmwG als bekannt gemacht gilt, ihren Anspruch nach Grund und Höhe in Textform anmelden, Sicherheit zu leisten, soweit sie nicht Befriedigung verlangen können. Dieses Recht steht den Gläubigern jedoch nur zu, wenn sie glaubhaft machen, dass durch die Verschmelzung die Erfüllung ihrer Forderung gefährdet wird."
    },
    {
      "date": "2025-02-15",
      "id": "101425",
      "original_text": "Löschungsankündigung\nBayern Amtsgericht Fürth HRA 2547\nChr. u. Hs. Röthlingshöfer GmbH & Co. Hoch-, Tief- und Stahlbetonbau – Langenzenn",
      "type": "Löschungsankündigung",
      "state": "Bayern",
      "amtsgericht": "Amtsgericht Fürth",
      "registernummer": "HRA 2547",
      "registerart": "HRA",
      "company_name": "Chr. u. Hs. Röthlingshöfer GmbH & Co. Hoch-, Tief- und Stahlbetonbau",
      "company_seat": "Langenzenn",
      "details": "15.02.2025 (Bekanntmachungsdatum)\n\nBayern Amtsgericht Fürth HRA 2547\nLöschungsankündigung 14.02.2025 (Eintragungsdatum)\n\nChr. u. Hs. Röthlingshöfer GmbH & Co. Hoch-, Tief- und Stahlbetonbau\nKommanditgesellschaft\nLangenzenn\n\nDas Registergericht beabsichtigt, die im Handelsregister eingetragene Gesellschaft wegen Vermögenslosigkeit von Amts wegen nach § 394 FamFG zu löschen. Die Frist zur Erhebung eines Widerspruchs ist auf einen Monat festgesetzt."
    },
    {
      "date": "2025-02-15",
      "id": "101426",
      "original_text": "Registerbekanntmachung nach dem Umwandlungsgesetz\nBayern Amtsgericht München HRA 119080\nFS HR Services Holding GmbH & Co. KG – München",
      "type": "Registerbekanntmachung nach dem Umwandlungsgesetz",
      "state": "Bayern",
      "amtsgericht": "Amtsgericht München",
      "registernummer": "HRA 119080",
      "registerart": "HRA",
      "company_name": "FS HR Services Holding GmbH & Co. KG",
      "company_seat": "München",
      "details": "15.02.2025 (Bekanntmachungsdatum)\n\nBayern Amtsgericht München HRA 119080\nRegisterbekanntmachung nach dem Umwandlungsgesetz 14.02.2025 (Eintragungsdatum)\n\nFS HR Services Holding GmbH & Co. KG\nKommanditgesellschaft\nMünchen\n\nDen Gläubigern der an der Spaltung beteiligten Rechtsträger ist, wenn sie binnen sechs Monaten nach dem Tag, an dem die Eintragung der Spaltung in das Register des Sitzes desjenigen Rechtsträgers, dessen Gläubiger sie sind, nach §§ 125, 19 Abs. 3 UmwG als bekannt gemacht gilt, ihren Anspruch nach Grund und Höhe in Textform anmelden, Sicherheit zu leisten, soweit sie nicht Befriedigung verlangen können. Dieses Recht steht den Gläubigern jedoch nur zu, wenn sie glaubhaft machen, dass durch die Spaltung die Erfüllung ihrer Forderung gefährdet wird."
    },
    {
      "date": "2025-02-15",
      "id": "101427",
      "original_text": "Registerbekanntmachung nach dem Umwandlungsgesetz\nBayern Amtsgericht München HRA 90383\nFIT STAR Holding GmbH & Co. KG – München",
      "type": "Registerbekanntmachung nach dem Umwandlungsgesetz",
      "state": "Bayern",
      "amtsgericht": "Amtsgericht München",
      "registernummer": "HRA 90383",
      "registerart": "HRA",
      "company_name": "FIT STAR Holding GmbH & Co. KG",
      "company_seat": "München",
      "details": "15.02.2025 (Bekanntmachungsdatum)\n\nBayern Amtsgericht München HRA 90383\nRegisterbekanntmachung nach dem Umwandlungsgesetz 14.02.2025 (Eintragungsdatum)\n\nFIT STAR Holding GmbH & Co. KG\nKommanditgesellschaft\nMünchen\n\nDen Gläubigern der an der Spaltung beteiligten Rechtsträger ist, wenn sie binnen sechs Monaten nach dem Tag, an dem die Eintragung der Spaltung in das Register des Sitzes desjenigen Rechtsträgers, dessen Gläubiger sie sind, nach §§ 125, 19 Abs. 3 UmwG als bekannt gemacht gilt, ihren Anspruch nach Grund und Höhe in Textform anmelden, Sicherheit zu leisten, soweit sie nicht Befriedigung verlangen können. Dieses Recht steht den Gläubigern jedoch nur zu, wenn sie glaubhaft machen, dass durch die Spaltung die Erfüllung ihrer Forderung gefährdet wird."
    },
    {
      "date": "2025-02-15",
      "id": "101428",
      "original_text": "Registerbekanntmachung nach dem Umwandlungsgesetz\nBayern Amtsgericht Traunstein HRA 13544\nBergen Haustechnik e.K. – Großkarolinenfeld",
      "type": "Registerbekanntmachung nach dem Umwandlungsgesetz",
      "state": "Bayern",
      "amtsgericht": "Amtsgericht Traunstein",
      "registernummer": "HRA 13544",
      "registerart": "HRA",
      "company_name": "Bergen Haustechnik e.K.",
      "company_seat": "Großkarolinenfeld",
      "details": "15.02.2025 (Bekanntmachungsdatum)\n\nBayern Amtsgericht Traunstein HRA 13544\nRegisterbekanntmachung nach dem Umwandlungsgesetz 14.02.2025 (Eintragungsdatum)\n\nBergen Haustechnik e.K.\nEinzelkaufmann / Einzelkauffrau\nGroßkarolinenfeld\n\nDen Gläubigern der an der Ausgliederung beteiligten Rechtsträger ist, wenn sie binnen sechs Monaten nach dem Tag, an dem die Eintragung der Ausgliederung in das Register des Sitzes desjenigen Rechtsträgers, dessen Gläubiger sie sind, nach §§ 125, 19 Abs. 3 UmwG als bekannt gemacht gilt, ihren Anspruch nach Grund und Höhe in Textform anmelden, Sicherheit zu leisten, soweit sie nicht Befriedigung verlangen können. Dieses Recht steht den Gläubigern jedoch nur zu, wenn sie glaubhaft machen, dass durch die Ausgliederung die Erfüllung ihrer Forderung gefährdet wird."
    },
    {
      "date": "2025-02-15",
      "id": "101429",
      "original_text": "Registerbekanntmachung nach dem Umwandlungsgesetz\nBayern Amtsgericht München HRB 281802\nInvisilux GmbH – München",
      "type": "Registerbekanntmachung nach dem Umwandlungsgesetz",
      "state": "Bayern",
      "amtsgericht": "Amtsgericht München",
      "registernummer": "HRB 281802",
      "registerart": "HRB",
      "company_name": "Invisilux GmbH",
      "company_seat": "München",
      "details": "15.02.2025 (Bekanntmachungsdatum)\n\nBayern Amtsgericht München HRB 281802\nRegisterbekanntmachung nach dem Umwandlungsgesetz\n\nInvisilux GmbH\nGesellschaft mit beschränkter Haftung\nMünchen\n\nEs wird darauf hingewiesen, dass ein Verschmelzungsplan oder sein Entwurf über eine grenzüberschreitende Verschmelzung zur Aufnahme mit der Soonice GmbH mit Sitz in Salzburg, Österreich (Firmenbuch des Landesgericht Salzburg FN 452613 h) (Gesellschaft mit beschränkter Haftung nach österreichischem Recht) als übernehmende Rechtsträgerin beim Handelsregister eingereicht worden ist.\nDie Anteilsinhaber, die Gläubiger sowie die zuständigen Betriebsräte der an der grenzüberschreitenden Verschmelzung beteiligten Gesellschaften oder, soweit es keinen Betriebsrat gibt, die Arbeitnehmer der an der grenzüberschreitenden Verschmelzung beteiligten Gesellschaften, können der jeweiligen Gesellschaft spätestens fünf Arbeitstage vor dem Tag der Gesellschafterversammlung Bemerkungen zum Verschmelzungsplan übermitteln."
    },
    {
      "date": "2025-02-15",
      "id": "101430",
      "original_text": "Registerbekanntmachung nach dem Umwandlungsgesetz\nBayern Amtsgericht Traunstein HRA 1128\nJosef Grätz e.Kfm. – Mühldorf a.Inn",
      "type": "Registerbekanntmachung nach dem Umwandlungsgesetz",
      "state": "Bayern",
      "amtsgericht": "Amtsgericht Traunstein",
      "registernummer": "HRA 1128",
      "registerart": "HRA",
      "company_name": "Josef Grätz e.Kfm.",
      "company_seat": "Mühldorf a.Inn",
      "details": "15.02.2025 (Bekanntmachungsdatum)\n\nBayern Amtsgericht Traunstein HRA 1128\nRegisterbekanntmachung nach dem Umwandlungsgesetz 14.02.2025 (Eintragungsdatum)\n\nJosef Grätz e.Kfm.\nEinzelkaufmann / Einzelkauffrau\nMühldorf a.Inn\n\nDen Gläubigern der an der Ausgliederung beteiligten Rechtsträger ist, wenn sie binnen sechs Monaten nach dem Tag, an dem die Eintragung der Ausgliederung in das Register des Sitzes desjenigen Rechtsträgers, dessen Gläubiger sie sind, nach §§ 125, 19 Abs. 3 UmwG als bekannt gemacht gilt, ihren Anspruch nach Grund und Höhe in Textform anmelden, Sicherheit zu leisten, soweit sie nicht Befriedigung verlangen können. Dieses Recht steht den Gläubigern jedoch nur zu, wenn sie glaubhaft machen, dass durch die Ausgliederung die Erfüllung ihrer Forderung gefährdet wird."
    },
    {
      "date": "2025-02-15",
      "id": "101431",
      "original_text": "Registerbekanntmachung nach dem Umwandlungsgesetz\nBayern Amtsgericht Traunstein HRB 33043\nGetränke Grätz GmbH – Mühldorf a.Inn",
      "type": "Registerbekanntmachung nach dem Umwandlungsgesetz",
      "state": "Bayern",
      "amtsgericht": "Amtsgericht Traunstein",
      "registernummer": "HRB 33043",
      "registerart": "HRB",
      "company_name": "Getränke Grätz GmbH",
      "company_seat": "Mühldorf a.Inn",
      "details": "15.02.2025 (Bekanntmachungsdatum)\n\nBayern Amtsgericht Traunstein HRB 33043\nRegisterbekanntmachung nach dem Umwandlungsgesetz 14.02.2025 (Eintragungsdatum)\n\nGetränke Grätz GmbH\nGesellschaft mit beschränkter Haftung\nMühldorf a.Inn\n\nDen Gläubigern der an der Ausgliederung beteiligten Rechtsträger ist, wenn sie binnen sechs Monaten nach dem Tag, an dem die Eintragung der Ausgliederung in das Register des Sitzes desjenigen Rechtsträgers, dessen Gläubiger sie sind, nach §§ 125, 19 Abs. 3 UmwG als bekannt gemacht gilt, ihren Anspruch nach Grund und Höhe in Textform anmelden, Sicherheit zu leisten, soweit sie nicht Befriedigung verlangen können. Dieses Recht steht den Gläubigern jedoch nur zu, wenn sie glaubhaft machen, dass durch die Ausgliederung die Erfüllung ihrer Forderung gefährdet wird."
    },
    {
      "date": "2025-02-15",
      "id": "101432",
      "original_text": "Löschungsankündigung\nBayern Amtsgericht München HRB 241047\nMünchner Bau GmbH – München",
      "type": "Löschungsankündigung",
      "state": "Bayern",
      "amtsgericht": "Amtsgericht München",
      "registernummer": "HRB 241047",
      "registerart": "HRB",
      "company_name": "Münchner Bau GmbH",
      "company_seat": "München",
      "details": "15.02.2025 (Bekanntmachungsdatum)\n\nBayern Amtsgericht München HRB 241047\nLöschungsankündigung 14.02.2025 (Eintragungsdatum)\n\nMünchner Bau GmbH\nGesellschaft mit beschränkter Haftung\nMünchen\n\nDas Registergericht beabsichtigt, die im Handelsregister eingetragene Gesellschaft wegen Vermögenslosigkeit von Amts wegen nach § 394 FamFG zu löschen. Die Frist zur Erhebung eines Widerspruchs ist auf drei Monate festgesetzt."
    },
    {
      "date": "2025-02-15",
      "id": "101433",
      "original_text": "Löschungsankündigung\nBayern Amtsgericht Hof HRB 246\nKeramik Vertrieb Gesellschaft mit beschränkter Haftung – Selb",
      "type": "Löschungsankündigung",
      "state": "Bayern",
      "amtsgericht": "Amtsgericht Hof",
      "registernummer": "HRB 246",
      "registerart": "HRB",
      "company_name": "Keramik Vertrieb Gesellschaft mit beschränkter Haftung",
      "company_seat": "Selb",
      "details": "15.02.2025 (Bekanntmachungsdatum)\n\nBayern Amtsgericht Hof HRB 246\nLöschungsankündigung\n\nKeramik Vertrieb Gesellschaft mit beschränkter Haftung\nGesellschaft mit beschränkter Haftung\nSelb\n\nDas Registergericht beabsichtigt, die im Handelsregister eingetragene Gesellschaft wegen Vermögenslosigkeit von Amts wegen nach § 394 FamFG zu löschen. Die Frist zur Erhebung eines Widerspruchs ist auf sechs Wochen festgesetzt."
    },
    {
      "date": "2025-02-15",
      "id": "101434",
      "original_text": "Registerbekanntmachung nach dem Umwandlungsgesetz\nBayern Amtsgericht München HRB 254894\nL & F Management GmbH – Markt Schwaben",
      "type": "Registerbekanntmachung nach dem Umwandlungsgesetz",
      "state": "Bayern",
      "amtsgericht": "Amtsgericht München",
      "registernummer": "HRB 254894",
      "registerart": "HRB",
      "company_name": "L & F Management GmbH",
      "company_seat": "Markt Schwaben",
      "details": "15.02.2025 (Bekanntmachungsdatum)\n\nBayern Amtsgericht München HRB 254894\nRegisterbekanntmachung nach dem Umwandlungsgesetz 14.02.2025 (Eintragungsdatum)\n\nL & F Management GmbH\nGesellschaft mit beschränkter Haftung\nMarkt Schwaben\n\nDen Gläubigern der an der Verschmelzung beteiligten Rechtsträger ist, wenn sie binnen sechs Monaten nach dem Tag, an dem die Eintragung der Verschmelzung in das Register des Sitzes desjenigen Rechtsträgers, dessen Gläubiger sie sind, nach § 19 Abs. 3 UmwG als bekannt gemacht gilt, ihren Anspruch nach Grund und Höhe in Textform anmelden, Sicherheit zu leisten, soweit sie nicht Befriedigung verlangen können. Dieses Recht steht den Gläubigern jedoch nur zu, wenn sie glaubhaft machen, dass durch die Verschmelzung die Erfüllung ihrer Forderung gefährdet wird."
    }
  ]
}