{
  "date": "2025-02-04",
  "date_of_scrape": "2025-02-05T04:06:47.897Z",
  "tool_version": "0.2.0",
  "number_of_announcements": 105,
  "announcements": [
    {
      "date": "2025-02-04",
      "id": "100355",
      "original_text": "Registerbekanntmachung nach dem Umwandlungsgesetz\nBayern Amtsgericht München HRB 226685\nHWN XVI GmbH – Grünwald",
      "type": "Registerbekanntmachung nach dem Umwandlungsgesetz",
      "state": "Bayern",
      "amtsgericht": "Amtsgericht München",
      "registernummer": "HRB 226685",
      "registerart": "HRB",
      "company_name": "HWN XVI GmbH",
      "company_seat": "Grünwald",
      "details": "04.02.2025 (Bekanntmachungsdatum)\n\nBayern Amtsgericht München HRB 226685\nRegisterbekanntmachung nach dem Umwandlungsgesetz 03.02.2025 (Eintragungsdatum)\n\nHWN XVI GmbH\nGesellschaft mit beschränkter Haftung\nGrünwald\n\nDen Gläubigern der an der Verschmelzung beteiligten Rechtsträger ist, wenn sie binnen sechs Monaten nach dem Tag, an dem die Eintragung der Verschmelzung in das Register des Sitzes desjenigen Rechtsträgers, dessen Gläubiger sie sind, nach § 19 Abs. 3 UmwG als bekannt gemacht gilt, ihren Anspruch nach Grund und Höhe in Textform anmelden, Sicherheit zu leisten, soweit sie nicht Befriedigung verlangen können. Dieses Recht steht den Gläubigern jedoch nur zu, wenn sie glaubhaft machen, dass durch die Verschmelzung die Erfüllung ihrer Forderung gefährdet wird."
    },
    {
      "date": "2025-02-04",
      "id": "100356",
      "original_text": "Löschungsankündigung\nBayern Amtsgericht München HRB 166170\nEgrensis Aviation AG – München",
      "type": "Löschungsankündigung",
      "state": "Bayern",
      "amtsgericht": "Amtsgericht München",
      "registernummer": "HRB 166170",
      "registerart": "HRB",
      "company_name": "Egrensis Aviation AG",
      "company_seat": "München",
      "details": "04.02.2025 (Bekanntmachungsdatum)\n\nBayern Amtsgericht München HRB 166170\nLöschungsankündigung\n\nEgrensis Aviation AG\nAktiengesellschaft\nMünchen\n\nDas Registergericht beabsichtigt, die im Handelsregister eingetragene Gesellschaft wegen Vermögenslosigkeit von Amts wegen nach § 394 FamFG zu löschen. Die Frist zur Erhebung eines Widerspruchs ist auf drei Monate festgesetzt."
    },
    {
      "date": "2025-02-04",
      "id": "100357",
      "original_text": "Löschungsankündigung\nBayern Amtsgericht Augsburg HRB 34029\nAuto- Genial- Einfach GmbH – Augsburg",
      "type": "Löschungsankündigung",
      "state": "Bayern",
      "amtsgericht": "Amtsgericht Augsburg",
      "registernummer": "HRB 34029",
      "registerart": "HRB",
      "company_name": "Auto- Genial- Einfach GmbH",
      "company_seat": "Augsburg",
      "details": "04.02.2025 (Bekanntmachungsdatum)\n\nBayern Amtsgericht Augsburg HRB 34029\nLöschungsankündigung 03.02.2025 (Eintragungsdatum)\n\nAuto- Genial- Einfach GmbH\nGesellschaft mit beschränkter Haftung\nAugsburg\n\nDas Registergericht beabsichtigt, die im Handelsregister eingetragene Gesellschaft wegen Vermögenslosigkeit von Amts wegen nach § 394 FamFG zu löschen. Die Frist zur Erhebung eines Widerspruchs ist auf einen Monat festgesetzt."
    },
    {
      "date": "2025-02-04",
      "id": "100358",
      "original_text": "Einreichung neuer Dokumente\nBayern Amtsgericht Coburg HRB 3040\nSana Kliniken Oberfranken Coburg GmbH – Coburg",
      "type": "Einreichung neuer Dokumente",
      "state": "Bayern",
      "amtsgericht": "Amtsgericht Coburg",
      "registernummer": "HRB 3040",
      "registerart": "HRB",
      "company_name": "Sana Kliniken Oberfranken Coburg GmbH",
      "company_seat": "Coburg",
      "details": "04.02.2025 (Bekanntmachungsdatum)\n\nBayern Amtsgericht Coburg HRB 3040\nEinreichung neuer Dokumente 03.02.2025 (Eintragungsdatum)\n\nSana Kliniken Oberfranken Coburg GmbH\nGesellschaft mit beschränkter Haftung\nCoburg\n\nDem Amtsgericht Coburg -Registergericht- ist eine Liste der Mitglieder des Aufsichtsrats eingereicht worden, § 52 Abs. 3 S. 2 GmbHG."
    },
    {
      "date": "2025-02-04",
      "id": "100359",
      "original_text": "Löschungsankündigung\nBayern Amtsgericht Hof HRB 4177\nE+M Brunnenbau und Bohrtechnik GmbH – Hof",
      "type": "Löschungsankündigung",
      "state": "Bayern",
      "amtsgericht": "Amtsgericht Hof",
      "registernummer": "HRB 4177",
      "registerart": "HRB",
      "company_name": "E+M Brunnenbau und Bohrtechnik GmbH",
      "company_seat": "Hof",
      "details": "04.02.2025 (Bekanntmachungsdatum)\n\nBayern Amtsgericht Hof HRB 4177\nLöschungsankündigung\n\nE+M Brunnenbau und Bohrtechnik GmbH\nGesellschaft mit beschränkter Haftung\nHof\n\nDas Registergericht beabsichtigt, die im Handelsregister eingetragene Gesellschaft wegen Vermögenslosigkeit von Amts wegen nach § 394 FamFG zu löschen. Die Frist zur Erhebung eines Widerspruchs ist auf sechs Wochen festgesetzt."
    },
    {
      "date": "2025-02-04",
      "id": "100360",
      "original_text": "Registerbekanntmachung nach dem Umwandlungsgesetz\nBayern Amtsgericht München HRB 276528\nSolarpark Stachusried GmbH – Ismaning",
      "type": "Registerbekanntmachung nach dem Umwandlungsgesetz",
      "state": "Bayern",
      "amtsgericht": "Amtsgericht München",
      "registernummer": "HRB 276528",
      "registerart": "HRB",
      "company_name": "Solarpark Stachusried GmbH",
      "company_seat": "Ismaning",
      "details": "04.02.2025 (Bekanntmachungsdatum)\n\nBayern Amtsgericht München HRB 276528\nRegisterbekanntmachung nach dem Umwandlungsgesetz 03.02.2025 (Eintragungsdatum)\n\nSolarpark Stachusried GmbH\nGesellschaft mit beschränkter Haftung\nIsmaning\n\nDen Gläubigern des formwechselnden Rechtsträgers ist, wenn sie binnen sechs Monaten nach dem Tag, an dem die Eintragung des Formwechsels nach § 201 UmwG als bekannt gemacht gilt, ihren Anspruch nach Grund und Höhe in Textform anmelden, Sicherheit zu leisten, soweit sie nicht Befriedigung verlangen können. Dieses Recht steht den Gläubigern jedoch nur zu, wenn sie glaubhaft machen, dass durch den Formwechsel die Erfüllung ihrer Forderung gefährdet wird."
    },
    {
      "date": "2025-02-04",
      "id": "100361",
      "original_text": "Löschungsankündigung\nBayern Amtsgericht München HRB 232883\nEuhua Trade GmbH – München",
      "type": "Löschungsankündigung",
      "state": "Bayern",
      "amtsgericht": "Amtsgericht München",
      "registernummer": "HRB 232883",
      "registerart": "HRB",
      "company_name": "Euhua Trade GmbH",
      "company_seat": "München",
      "details": "04.02.2025 (Bekanntmachungsdatum)\n\nBayern Amtsgericht München HRB 232883\nLöschungsankündigung\n\nEuhua Trade GmbH\nGesellschaft mit beschränkter Haftung\nMünchen\n\nDas Registergericht beabsichtigt, die im Handelsregister eingetragene Gesellschaft wegen Vermögenslosigkeit von Amts wegen nach § 394 FamFG zu löschen. Die Frist zur Erhebung eines Widerspruchs ist auf drei Monate festgesetzt."
    },
    {
      "date": "2025-02-04",
      "id": "100362",
      "original_text": "Registerbekanntmachung nach dem Umwandlungsgesetz\nBayern Amtsgericht München HRB 276526\nSolarpark Zengermoos GmbH – Ismaning",
      "type": "Registerbekanntmachung nach dem Umwandlungsgesetz",
      "state": "Bayern",
      "amtsgericht": "Amtsgericht München",
      "registernummer": "HRB 276526",
      "registerart": "HRB",
      "company_name": "Solarpark Zengermoos GmbH",
      "company_seat": "Ismaning",
      "details": "04.02.2025 (Bekanntmachungsdatum)\n\nBayern Amtsgericht München HRB 276526\nRegisterbekanntmachung nach dem Umwandlungsgesetz 03.02.2025 (Eintragungsdatum)\n\nSolarpark Zengermoos GmbH\nGesellschaft mit beschränkter Haftung\nIsmaning\n\nDen Gläubigern des formwechselnden Rechtsträgers ist, wenn sie binnen sechs Monaten nach dem Tag, an dem die Eintragung des Formwechsels nach § 201 UmwG als bekannt gemacht gilt, ihren Anspruch nach Grund und Höhe in Textform anmelden, Sicherheit zu leisten, soweit sie nicht Befriedigung verlangen können. Dieses Recht steht den Gläubigern jedoch nur zu, wenn sie glaubhaft machen, dass durch den Formwechsel die Erfüllung ihrer Forderung gefährdet wird."
    },
    {
      "date": "2025-02-04",
      "id": "100363",
      "original_text": "Registerbekanntmachung nach dem Umwandlungsgesetz\nBayern Amtsgericht München HRB 260180\nFriedenstal Bernau Betreibergesellschaft mbH – Unterhaching",
      "type": "Registerbekanntmachung nach dem Umwandlungsgesetz",
      "state": "Bayern",
      "amtsgericht": "Amtsgericht München",
      "registernummer": "HRB 260180",
      "registerart": "HRB",
      "company_name": "Friedenstal Bernau Betreibergesellschaft mbH",
      "company_seat": "Unterhaching",
      "details": "04.02.2025 (Bekanntmachungsdatum)\n\nBayern Amtsgericht München HRB 260180\nRegisterbekanntmachung nach dem Umwandlungsgesetz 03.02.2025 (Eintragungsdatum)\n\nFriedenstal Bernau Betreibergesellschaft mbH\nGesellschaft mit beschränkter Haftung\nUnterhaching\n\nDen Gläubigern der an der Verschmelzung beteiligten Rechtsträger ist, wenn sie binnen sechs Monaten nach dem Tag, an dem die Eintragung der Verschmelzung in das Register des Sitzes desjenigen Rechtsträgers, dessen Gläubiger sie sind, nach § 19 Abs. 3 UmwG als bekannt gemacht gilt, ihren Anspruch nach Grund und Höhe in Textform anmelden, Sicherheit zu leisten, soweit sie nicht Befriedigung verlangen können. Dieses Recht steht den Gläubigern jedoch nur zu, wenn sie glaubhaft machen, dass durch die Verschmelzung die Erfüllung ihrer Forderung gefährdet wird."
    },
    {
      "date": "2025-02-04",
      "id": "100364",
      "original_text": "Registerbekanntmachung nach dem Umwandlungsgesetz\nBayern Amtsgericht München HRB 281602\nAURELIUS Advisory AG – München",
      "type": "Registerbekanntmachung nach dem Umwandlungsgesetz",
      "state": "Bayern",
      "amtsgericht": "Amtsgericht München",
      "registernummer": "HRB 281602",
      "registerart": "HRB",
      "company_name": "AURELIUS Advisory AG",
      "company_seat": "München",
      "details": "04.02.2025 (Bekanntmachungsdatum)\n\nBayern Amtsgericht München HRB 281602\nRegisterbekanntmachung nach dem Umwandlungsgesetz 03.02.2025 (Eintragungsdatum)\n\nAURELIUS Advisory AG\nAktiengesellschaft\nMünchen\n\nDen Gläubigern der an der Verschmelzung beteiligten Rechtsträger ist, wenn sie binnen sechs Monaten nach dem Tag, an dem die Eintragung der Verschmelzung in das Register des Sitzes desjenigen Rechtsträgers, dessen Gläubiger sie sind, nach § 19 Abs. 3 UmwG als bekannt gemacht gilt, ihren Anspruch nach Grund und Höhe in Textform anmelden, Sicherheit zu leisten, soweit sie nicht Befriedigung verlangen können. Dieses Recht steht den Gläubigern jedoch nur zu, wenn sie glaubhaft machen, dass durch die Verschmelzung die Erfüllung ihrer Forderung gefährdet wird."
    },
    {
      "date": "2025-02-04",
      "id": "100365",
      "original_text": "Löschungsankündigung\nBayern Amtsgericht München HRA 109874\nKEA252 Ltd. & Co. KG – München",
      "type": "Löschungsankündigung",
      "state": "Bayern",
      "amtsgericht": "Amtsgericht München",
      "registernummer": "HRA 109874",
      "registerart": "HRA",
      "company_name": "KEA252 Ltd. & Co. KG",
      "company_seat": "München",
      "details": "04.02.2025 (Bekanntmachungsdatum)\n\nBayern Amtsgericht München HRA 109874\nLöschungsankündigung\n\nKEA252 Ltd. & Co. KG\nKommanditgesellschaft\nMünchen\n\nDas Registergericht beabsichtigt, die im Handelsregister eingetragene Firma von Amts wegen nach § 31 Abs. 2 HGB zu löschen. Die Frist zur Erhebung eines Widerspruchs ist auf drei Monate festgesetzt."
    },
    {
      "date": "2025-02-04",
      "id": "100366",
      "original_text": "Sonstige Registerbekanntmachung\nBayern Amtsgericht München HRB 174760\nHAWE Hydraulik SE – Aschheim",
      "type": "Sonstige Registerbekanntmachung",
      "state": "Bayern",
      "amtsgericht": "Amtsgericht München",
      "registernummer": "HRB 174760",
      "registerart": "HRB",
      "company_name": "HAWE Hydraulik SE",
      "company_seat": "Aschheim",
      "details": "04.02.2025 (Bekanntmachungsdatum)\n\nBayern Amtsgericht München HRB 174760\nSonstige Registerbekanntmachung 03.02.2025 (Eintragungsdatum)\n\nHAWE Hydraulik SE\nEuropäische Aktiengesellschaft (SE)\nAschheim\n\nDen Gläubigern der Gesellschaft, deren Forderungen begründet worden sind, bevor die Eintragung der Beendigung des Teilgewinnabführungsvertrages in das Handelsregister nach § 10 des Handelsgesetzbuches als bekanntgemacht gilt, hat der andere Vertragsteil Sicherheit zu leisten, wenn sie sich binnen sechs Monaten nach der Bekanntmachung der Eintragung zu diesem Zweck bei ihm melden."
    },
    {
      "date": "2025-02-04",
      "id": "100367",
      "original_text": "Einreichung neuer Dokumente\nBayern Amtsgericht Landshut HRB 1095\nHiller GmbH – Vilsbiburg",
      "type": "Einreichung neuer Dokumente",
      "state": "Bayern",
      "amtsgericht": "Amtsgericht Landshut",
      "registernummer": "HRB 1095",
      "registerart": "HRB",
      "company_name": "Hiller GmbH",
      "company_seat": "Vilsbiburg",
      "details": "04.02.2025 (Bekanntmachungsdatum)\n\nBayern Amtsgericht Landshut HRB 1095\nEinreichung neuer Dokumente\n\nHiller GmbH\nGesellschaft mit beschränkter Haftung\nVilsbiburg\n\nDem Amtsgericht Landshut -Registergericht- ist eine Liste der Mitglieder des Verwaltungsrats eingereicht worden, § 52 Abs. 3 S. 2 GmbHG."
    },
    {
      "date": "2025-02-04",
      "id": "100368",
      "original_text": "Löschungsankündigung\nBayern Amtsgericht München HRA 17112\nBaubetreuung GmbH & Co. KG – München",
      "type": "Löschungsankündigung",
      "state": "Bayern",
      "amtsgericht": "Amtsgericht München",
      "registernummer": "HRA 17112",
      "registerart": "HRA",
      "company_name": "Baubetreuung GmbH & Co. KG",
      "company_seat": "München",
      "details": "04.02.2025 (Bekanntmachungsdatum)\n\nBayern Amtsgericht München HRA 17112\nLöschungsankündigung\n\nBaubetreuung GmbH & Co. KG\nKommanditgesellschaft\nMünchen\n\nDas Registergericht beabsichtigt, die im Handelsregister eingetragene Firma von Amts wegen nach § 31 Abs. 2 HGB zu löschen. Die Frist zur Erhebung eines Widerspruchs ist auf drei Monate festgesetzt."
    },
    {
      "date": "2025-02-04",
      "id": "100369",
      "original_text": "Löschungsankündigung\nBayern Amtsgericht Fürth HRB 18938\nLS Transport & Logistic GmbH – Fürth",
      "type": "Löschungsankündigung",
      "state": "Bayern",
      "amtsgericht": "Amtsgericht Fürth",
      "registernummer": "HRB 18938",
      "registerart": "HRB",
      "company_name": "LS Transport & Logistic GmbH",
      "company_seat": "Fürth",
      "details": "04.02.2025 (Bekanntmachungsdatum)\n\nBayern Amtsgericht Fürth HRB 18938\nLöschungsankündigung\n\nLS Transport & Logistic GmbH\nGesellschaft mit beschränkter Haftung\nFürth\n\nDas Registergericht beabsichtigt, die im Handelsregister eingetragene Gesellschaft wegen Vermögenslosigkeit von Amts wegen nach § 394 FamFG zu löschen. Die Frist zur Erhebung eines Widerspruchs ist auf drei Monate festgesetzt."
    },
    {
      "date": "2025-02-04",
      "id": "100370",
      "original_text": "Einreichung neuer Dokumente\nBayern Amtsgericht München HRB 262\nBY die Bayerische Vorsorge Lebensversicherung a.G. – München",
      "type": "Einreichung neuer Dokumente",
      "state": "Bayern",
      "amtsgericht": "Amtsgericht München",
      "registernummer": "HRB 262",
      "registerart": "HRB",
      "company_name": "BY die Bayerische Vorsorge Lebensversicherung a.G.",
      "company_seat": "München",
      "details": "04.02.2025 (Bekanntmachungsdatum)\n\nBayern Amtsgericht München HRB 262\nEinreichung neuer Dokumente\n\nBY die Bayerische Vorsorge Lebensversicherung a.G.\nVersicherungsverein auf Gegenseitigkeit\nMünchen\n\nDem Amtsgericht München -Registergericht- ist eine Liste der Mitglieder des Aufsichtsrats eingereicht worden, §§ 189 Abs. 3 Satz 1 VAG, 106 AktG."
    },
    {
      "date": "2025-02-04",
      "id": "100371",
      "original_text": "Sonstige Registerbekanntmachung\nBayern Amtsgericht München HRB 280179\nSonnenshop Deutschland DEK GmbH – Unterschleißheim",
      "type": "Sonstige Registerbekanntmachung",
      "state": "Bayern",
      "amtsgericht": "Amtsgericht München",
      "registernummer": "HRB 280179",
      "registerart": "HRB",
      "company_name": "Sonnenshop Deutschland DEK GmbH",
      "company_seat": "Unterschleißheim",
      "details": "04.02.2025 (Bekanntmachungsdatum)\n\nBayern Amtsgericht München HRB 280179\nSonstige Registerbekanntmachung 03.02.2025 (Eintragungsdatum)\n\nSonnenshop Deutschland DEK GmbH\nGesellschaft mit beschränkter Haftung\nUnterschleißheim\n\nDen Gläubigern der Gesellschaft, deren Forderungen begründet worden sind, bevor die Eintragung der Beendigung des #DV.art(Text=\"Bitte Art des Vertrages auswählen\",Eingabe=\n\"Beherrschungs- und Gewinnabführungsvertrages\",\n\"Beherrschungsvertrages\",\n\"Gewinnabführungsvertrages\",\n\"Teilgewinnabführungsvertrages\") in das Handelsregister nach § 10 des Handelsgesetzbuches als bekanntgemacht gilt, hat der andere Vertragsteil Sicherheit zu leisten, wenn sie sich binnen sechs Monaten nach der Bekanntmachung der Eintragung zu diesem Zweck bei ihm melden."
    },
    {
      "date": "2025-02-04",
      "id": "100372",
      "original_text": "Löschungsankündigung\nBayern Amtsgericht Hof HRB 4672\nMoney & More Energieberatung und Gewerbedienstleistungen UG (haftungsbeschränkt) – Hof",
      "type": "Löschungsankündigung",
      "state": "Bayern",
      "amtsgericht": "Amtsgericht Hof",
      "registernummer": "HRB 4672",
      "registerart": "HRB",
      "company_name": "Money & More Energieberatung und Gewerbedienstleistungen UG (haftungsbeschränkt)",
      "company_seat": "Hof",
      "details": "04.02.2025 (Bekanntmachungsdatum)\n\nBayern Amtsgericht Hof HRB 4672\nLöschungsankündigung\n\nMoney & More Energieberatung und Gewerbedienstleistungen UG (haftungsbeschränkt)\nGesellschaft mit beschränkter Haftung\nHof\n\nDas Registergericht beabsichtigt, die im Handelsregister eingetragene Gesellschaft wegen Vermögenslosigkeit von Amts wegen nach § 394 FamFG zu löschen. Die Frist zur Erhebung eines Widerspruchs ist auf sechs Wochen festgesetzt."
    },
    {
      "date": "2025-02-04",
      "id": "100373",
      "original_text": "Registerbekanntmachung nach dem Umwandlungsgesetz\nBayern Amtsgericht München HRB 294902\nSilk Road MidCo GmbH – München",
      "type": "Registerbekanntmachung nach dem Umwandlungsgesetz",
      "state": "Bayern",
      "amtsgericht": "Amtsgericht München",
      "registernummer": "HRB 294902",
      "registerart": "HRB",
      "company_name": "Silk Road MidCo GmbH",
      "company_seat": "München",
      "details": "04.02.2025 (Bekanntmachungsdatum)\n\nBayern Amtsgericht München HRB 294902\nRegisterbekanntmachung nach dem Umwandlungsgesetz 03.02.2025 (Eintragungsdatum)\n\nSilk Road MidCo GmbH\nGesellschaft mit beschränkter Haftung\nMünchen\n\nDen Gläubigern der an der Verschmelzung beteiligten Rechtsträger ist, wenn sie binnen sechs Monaten nach dem Tag, an dem die Eintragung der Verschmelzung in das Register des Sitzes desjenigen Rechtsträgers, dessen Gläubiger sie sind, nach § 19 Abs. 3 UmwG als bekannt gemacht gilt, ihren Anspruch nach Grund und Höhe in Textform anmelden, Sicherheit zu leisten, soweit sie nicht Befriedigung verlangen können. Dieses Recht steht den Gläubigern jedoch nur zu, wenn sie glaubhaft machen, dass durch die Verschmelzung die Erfüllung ihrer Forderung gefährdet wird."
    },
    {
      "date": "2025-02-04",
      "id": "100374",
      "original_text": "Löschungsankündigung\nBayern Amtsgericht Hof HRB 5369\nSENTURIA LIMITED Zweigniederlassung Weißdorf – Weißdorf",
      "type": "Löschungsankündigung",
      "state": "Bayern",
      "amtsgericht": "Amtsgericht Hof",
      "registernummer": "HRB 5369",
      "registerart": "HRB",
      "company_name": "SENTURIA LIMITED Zweigniederlassung Weißdorf",
      "company_seat": "Weißdorf",
      "details": "04.02.2025 (Bekanntmachungsdatum)\n\nBayern Amtsgericht Hof HRB 5369\nLöschungsankündigung\n\nSENTURIA LIMITED Zweigniederlassung Weißdorf\nRechtsform ausländischen Rechts HRB\nWeißdorf\n\nDas Registergericht beabsichtigt, die im Handelsregister eingetragene Gesellschaft von Amts wegen nach § 395 FamFG zu löschen. Die Frist zur Erhebung eines Widerspruchs ist auf sechs Wochen festgesetzt."
    },
    {
      "date": "2025-02-04",
      "id": "100375",
      "original_text": "Löschungsankündigung\nBayern Amtsgericht Bayreuth HRB 4543\nLindenhöfe Elbersberg Verwaltungs GmbH – Pottenstein-Elbersberg",
      "type": "Löschungsankündigung",
      "state": "Bayern",
      "amtsgericht": "Amtsgericht Bayreuth",
      "registernummer": "HRB 4543",
      "registerart": "HRB",
      "company_name": "Lindenhöfe Elbersberg Verwaltungs GmbH",
      "company_seat": "Pottenstein-Elbersberg",
      "details": "04.02.2025 (Bekanntmachungsdatum)\n\nBayern Amtsgericht Bayreuth HRB 4543\nLöschungsankündigung\n\nLindenhöfe Elbersberg Verwaltungs GmbH\nGesellschaft mit beschränkter Haftung\nPottenstein-Elbersberg\n\nDas Registergericht beabsichtigt, die im Handelsregister eingetragene Gesellschaft wegen Vermögenslosigkeit von Amts wegen nach § 394 FamFG zu löschen. Die Frist zur Erhebung eines Widerspruchs ist auf einen Monat festgesetzt."
    },
    {
      "date": "2025-02-04",
      "id": "100376",
      "original_text": "Einreichung neuer Dokumente\nBayern Amtsgericht München HRB 157279\nAmper Kliniken Aktiengesellschaft – Dachau",
      "type": "Einreichung neuer Dokumente",
      "state": "Bayern",
      "amtsgericht": "Amtsgericht München",
      "registernummer": "HRB 157279",
      "registerart": "HRB",
      "company_name": "Amper Kliniken Aktiengesellschaft",
      "company_seat": "Dachau",
      "details": "04.02.2025 (Bekanntmachungsdatum)\n\nBayern Amtsgericht München HRB 157279\nEinreichung neuer Dokumente 03.02.2025 (Eintragungsdatum)\n\nAmper Kliniken Aktiengesellschaft\nAktiengesellschaft\nDachau\n\nDem Amtsgericht München -Registergericht- ist eine Liste der Mitglieder des Aufsichtsrats eingereicht worden, § 106 AktG."
    },
    {
      "date": "2025-02-04",
      "id": "100377",
      "original_text": "Löschungsankündigung\nBerlin Amtsgericht Berlin (Charlottenburg) HRB 134549\nBusinessworx Kagerer Unternehmergesellschaft (haftungsbeschränkt) – Berlin",
      "type": "Löschungsankündigung",
      "state": "Berlin",
      "amtsgericht": "Amtsgericht Berlin (Charlottenburg)",
      "registernummer": "HRB 134549",
      "registerart": "HRB",
      "company_name": "Businessworx Kagerer Unternehmergesellschaft (haftungsbeschränkt)",
      "company_seat": "Berlin",
      "details": "04.02.2025 (Bekanntmachungsdatum)\n\nBerlin Amtsgericht Berlin (Charlottenburg) HRB 134549\nLöschungsankündigung\n\nBusinessworx Kagerer Unternehmergesellschaft (haftungsbeschränkt)\nGesellschaft mit beschränkter Haftung\nBerlin\n\nBei der nachstehenden Gesellschaft wird das Amtslöschungsverfahren gemäß § 394 FamFG eingeleitet. Widerspruchsfrist: 6 Wochen."
    },
    {
      "date": "2025-02-04",
      "id": "100378",
      "original_text": "Löschungsankündigung\nBerlin Amtsgericht Berlin (Charlottenburg) HRB 221452\nMSN Ost UG (haftungsbeschränkt) – Berlin",
      "type": "Löschungsankündigung",
      "state": "Berlin",
      "amtsgericht": "Amtsgericht Berlin (Charlottenburg)",
      "registernummer": "HRB 221452",
      "registerart": "HRB",
      "company_name": "MSN Ost UG (haftungsbeschränkt)",
      "company_seat": "Berlin",
      "details": "04.02.2025 (Bekanntmachungsdatum)\n\nBerlin Amtsgericht Berlin (Charlottenburg) HRB 221452\nLöschungsankündigung\n\nMSN Ost UG (haftungsbeschränkt)\nGesellschaft mit beschränkter Haftung\nBerlin\n\nBei der nachstehenden Gesellschaft wird das Amtslöschungsverfahren gemäß § 394 FamFG eingeleitet. Widerspruchsfrist: 6 Wochen."
    },
    {
      "date": "2025-02-04",
      "id": "100379",
      "original_text": "Sonstige Registerbekanntmachung\nBaden-Württemberg Amtsgericht Mannheim HRB 701200\nErwin Hymer World GmbH – Wertheim",
      "type": "Sonstige Registerbekanntmachung",
      "state": "Baden-Württemberg",
      "amtsgericht": "Amtsgericht Mannheim",
      "registernummer": "HRB 701200",
      "registerart": "HRB",
      "company_name": "Erwin Hymer World GmbH",
      "company_seat": "Wertheim",
      "details": "04.02.2025 (Bekanntmachungsdatum)\n\nBaden-Württemberg Amtsgericht Mannheim HRB 701200\nSonstige Registerbekanntmachung 04.02.2025 (Eintragungsdatum)\n\nErwin Hymer World GmbH\nGesellschaft mit beschränkter Haftung\nWertheim\n\nAls nicht eingetragen wird bekanntgemacht:\nDen Gläubigern der Gesellschaft, deren Forderungen begründet worden sind, bevor die Eintragung der Beendigung des Vertrages in das Handelsregister nach § 10 HGB als bekanntgemacht gilt, ist vom anderen Vertragsteil Sicherheit zu leisten, wenn sie sich binnen sechs Monaten nach der Bekanntmachung zu diesem Zweck bei ihm melden."
    },
    {
      "date": "2025-02-04",
      "id": "100380",
      "original_text": "Einreichung neuer Dokumente\nBaden-Württemberg Amtsgericht Freiburg HRB 712137\nPrimeEnergy Immobilien AG – Weil am Rhein",
      "type": "Einreichung neuer Dokumente",
      "state": "Baden-Württemberg",
      "amtsgericht": "Amtsgericht Freiburg",
      "registernummer": "HRB 712137",
      "registerart": "HRB",
      "company_name": "PrimeEnergy Immobilien AG",
      "company_seat": "Weil am Rhein",
      "details": "04.02.2025 (Bekanntmachungsdatum)\n\nBaden-Württemberg Amtsgericht Freiburg HRB 712137\nEinreichung neuer Dokumente 04.02.2025 (Eintragungsdatum)\n\nPrimeEnergy Immobilien AG\nAktiengesellschaft\nWeil am Rhein\n\nDie Gesellschaft hat am 03.02.2025 die Liste über die Zusammensetzung des Aufsichtsrats zum Handelsregister eingereicht."
    },
    {
      "date": "2025-02-04",
      "id": "100381",
      "original_text": "Registerbekanntmachung nach dem Umwandlungsgesetz\nBaden-Württemberg Amtsgericht Freiburg HRB 724504\nSolid Projekt GmbH – Konstanz",
      "type": "Registerbekanntmachung nach dem Umwandlungsgesetz",
      "state": "Baden-Württemberg",
      "amtsgericht": "Amtsgericht Freiburg",
      "registernummer": "HRB 724504",
      "registerart": "HRB",
      "company_name": "Solid Projekt GmbH",
      "company_seat": "Konstanz",
      "details": "04.02.2025 (Bekanntmachungsdatum)\n\nBaden-Württemberg Amtsgericht Freiburg HRB 724504\nRegisterbekanntmachung nach dem Umwandlungsgesetz 04.02.2025 (Eintragungsdatum)\n\nSolid Projekt GmbH\nGesellschaft mit beschränkter Haftung\nKonstanz\n\nDen Gläubigern der an der Verschmelzung beteiligten Rechtsträger ist, wenn sie binnen sechs Monaten nach dem Tag, an dem die Eintragung der Verschmelzung in das Register des Sitzes desjenigen Rechtsträgers, dessen Gläubiger sie sind, nach § 19 Abs. 3 UmwG als bekanntgemacht gilt, ihren Anspruch nach Grund und Höhe schriftlich anmelden, Sicherheit zu leisten, soweit sie nicht Befriedigung verlangen können. Dieses Recht steht den Gläubigern jedoch nur zu, wenn sie glaubhaft machen, dass durch die Verschmelzung die Erfüllung ihrer Forderung gefährdet wird."
    },
    {
      "date": "2025-02-04",
      "id": "100382",
      "original_text": "Registerbekanntmachung nach dem Umwandlungsgesetz\nBaden-Württemberg Amtsgericht Freiburg HRB 715486\nSolid Immobilienverwaltung GmbH – Konstanz",
      "type": "Registerbekanntmachung nach dem Umwandlungsgesetz",
      "state": "Baden-Württemberg",
      "amtsgericht": "Amtsgericht Freiburg",
      "registernummer": "HRB 715486",
      "registerart": "HRB",
      "company_name": "Solid Immobilienverwaltung GmbH",
      "company_seat": "Konstanz",
      "details": "04.02.2025 (Bekanntmachungsdatum)\n\nBaden-Württemberg Amtsgericht Freiburg HRB 715486\nRegisterbekanntmachung nach dem Umwandlungsgesetz 04.02.2025 (Eintragungsdatum)\n\nSolid Immobilienverwaltung GmbH\nGesellschaft mit beschränkter Haftung\nKonstanz\n\nAls nicht eingetragen wird bekanntgemacht:\nDen Gläubigern der an der Verschmelzung beteiligten Rechtsträger ist, wenn sie binnen sechs Monaten nach dem Tag, an dem die Eintragung der Verschmelzung in das Register des Sitzes desjenigen Rechtsträgers, dessen Gläubiger sie sind, nach § 19 Abs. 3 UmwG als bekanntgemacht gilt, ihren Anspruch nach Grund und Höhe schriftlich anmelden, Sicherheit zu leisten, soweit sie nicht Befriedigung verlangen können. Dieses Recht steht den Gläubigern jedoch nur zu, wenn sie glaubhaft machen, dass durch die Verschmelzung die Erfüllung ihrer Forderung gefährdet wird."
    },
    {
      "date": "2025-02-04",
      "id": "100383",
      "original_text": "Löschungsankündigung\nBaden-Württemberg Amtsgericht Mannheim HRB 721263\nVilla tectona Ambiente GmbH – Mannheim",
      "type": "Löschungsankündigung",
      "state": "Baden-Württemberg",
      "amtsgericht": "Amtsgericht Mannheim",
      "registernummer": "HRB 721263",
      "registerart": "HRB",
      "company_name": "Villa tectona Ambiente GmbH",
      "company_seat": "Mannheim",
      "details": "04.02.2025 (Bekanntmachungsdatum)\n\nBaden-Württemberg Amtsgericht Mannheim HRB 721263\nLöschungsankündigung\n\nVilla tectona Ambiente GmbH\nGesellschaft mit beschränkter Haftung\nMannheim\n\nDas Gericht beabsichtigt, die Gesellschaft wegen Vermögenslosigkeit im Handelsregister von Amts wegen nach § 394 FamFG zu löschen. Die Frist zur Geltendmachung eines Widerspruchs gegen die beabsichtigte Löschung ist auf einen Monat ab Veröffentlichung bestimmt."
    },
    {
      "date": "2025-02-04",
      "id": "100384",
      "original_text": "Einreichung neuer Dokumente\nBaden-Württemberg Amtsgericht Stuttgart HRB 752467\nSDK Süddeutsche Allgemeine Vermögensverwaltung AG – Fellbach",
      "type": "Einreichung neuer Dokumente",
      "state": "Baden-Württemberg",
      "amtsgericht": "Amtsgericht Stuttgart",
      "registernummer": "HRB 752467",
      "registerart": "HRB",
      "company_name": "SDK Süddeutsche Allgemeine Vermögensverwaltung AG",
      "company_seat": "Fellbach",
      "details": "04.02.2025 (Bekanntmachungsdatum)\n\nBaden-Württemberg Amtsgericht Stuttgart HRB 752467\nEinreichung neuer Dokumente\n\nSDK Süddeutsche Allgemeine Vermögensverwaltung AG\nAktiengesellschaft\nFellbach\n\nDie Gesellschaft hat am 28.01.2025 die Liste über die Zusammensetzung des Aufsichtsrats zum Handelsregister eingereicht."
    },
    {
      "date": "2025-02-04",
      "id": "100385",
      "original_text": "Einreichung neuer Dokumente\nSchleswig-Holstein Amtsgericht Flensburg HRB 1569 HU\nCHRISTIAN JENSEN KOLLEG BREKLUM - ökumenische Tagungs- und Bildungsstätte- gGmbH – Breklum",
      "type": "Einreichung neuer Dokumente",
      "state": "Schleswig-Holstein",
      "amtsgericht": "Amtsgericht Flensburg",
      "registernummer": "HRB 1569 HU",
      "registerart": "HRB",
      "company_name": "CHRISTIAN JENSEN KOLLEG BREKLUM - ökumenische Tagungs- und Bildungsstätte- gGmbH",
      "company_seat": "Breklum",
      "details": "04.02.2025 (Bekanntmachungsdatum)\n\nSchleswig-Holstein Amtsgericht Flensburg HRB 1569 HU\nEinreichung neuer Dokumente\n\nCHRISTIAN JENSEN KOLLEG BREKLUM - ökumenische Tagungs- und Bildungsstätte- gGmbH\nGesellschaft mit beschränkter Haftung\nBreklum\n\nNeue Aufsichtsratsliste nach Änderung eingereicht am 03.02.2025."
    },
    {
      "date": "2025-02-04",
      "id": "100386",
      "original_text": "Einreichung neuer Dokumente\nSaarland Amtsgericht Saarbrücken HRB 17782\nStadtwerke Dillingen/Saar Netzgesellschaft mbH – Dillingen/Saar",
      "type": "Einreichung neuer Dokumente",
      "state": "Saarland",
      "amtsgericht": "Amtsgericht Saarbrücken",
      "registernummer": "HRB 17782",
      "registerart": "HRB",
      "company_name": "Stadtwerke Dillingen/Saar Netzgesellschaft mbH",
      "company_seat": "Dillingen/Saar",
      "details": "04.02.2025 (Bekanntmachungsdatum)\n\nSaarland Amtsgericht Saarbrücken HRB 17782\nEinreichung neuer Dokumente\n\nStadtwerke Dillingen/Saar Netzgesellschaft mbH\nGesellschaft mit beschränkter Haftung\nDillingen/Saar\n\nDie Geschäftsführung der Gesellschaft hat eine Liste der Mitglieder des Aufsichtsrats zum Handelsregister eingereicht (§ 52 Abs. 3 Satz 2 GmbHG)."
    },
    {
      "date": "2025-02-04",
      "id": "100387",
      "original_text": "Registerbekanntmachung nach dem Umwandlungsgesetz\nBrandenburg Amtsgericht Potsdam HRA 8533\nCarolina Simm e.Kfr. – Potsdam",
      "type": "Registerbekanntmachung nach dem Umwandlungsgesetz",
      "state": "Brandenburg",
      "amtsgericht": "Amtsgericht Potsdam",
      "registernummer": "HRA 8533",
      "registerart": "HRA",
      "company_name": "Carolina Simm e.Kfr.",
      "company_seat": "Potsdam",
      "details": "04.02.2025 (Bekanntmachungsdatum)\n\nBrandenburg Amtsgericht Potsdam HRA 8533\nRegisterbekanntmachung nach dem Umwandlungsgesetz 03.02.2025 (Eintragungsdatum)\n\nCarolina Simm e.Kfr.\nEinzelkaufmann / Einzelkauffrau\nPotsdam\n\nZu Eintragungsnummer 2 vom 03.02.2025 wird als nicht eingetragen veröffentlicht: Den Gläubigern der an der Ausgliederung beteiligten Rechtsträger ist, wenn sie binnen sechs Monaten nach dem Tag, an dem die Eintragung der Ausgliederung in das Register des Sitzes desjenigen Rechtsträgers, dessen Gläubiger sie sind, als bekannt gemacht gilt, ihren Anspruch nach Grund und Höhe schriftlich anmelden, Sicherheit zu leisten, soweit sie nicht Befriedigung verlangen können. Dieses Recht steht den Gläubigern jedoch nur zu, wenn sie glaubhaft machen, dass durch die Ausgliederung die Erfüllung ihrer Forderung gefährdet wird"
    },
    {
      "date": "2025-02-04",
      "id": "100388",
      "original_text": "Löschungsankündigung\nBaden-Württemberg Amtsgericht Freiburg HRB 381661\nsunways Aktiengesellschaft – Konstanz",
      "type": "Löschungsankündigung",
      "state": "Baden-Württemberg",
      "amtsgericht": "Amtsgericht Freiburg",
      "registernummer": "HRB 381661",
      "registerart": "HRB",
      "company_name": "sunways Aktiengesellschaft",
      "company_seat": "Konstanz",
      "details": "04.02.2025 (Bekanntmachungsdatum)\n\nBaden-Württemberg Amtsgericht Freiburg HRB 381661\nLöschungsankündigung\n\nsunways Aktiengesellschaft\nAktiengesellschaft\nKonstanz\n\nDas Gericht beabsichtigt, die Gesellschaft wegen Vermögenslosigkeit im Handelsregister von Amts wegen nach § 394 FamFG zu löschen. Die Frist zur Geltendmachung eines Widerspruchs gegen die beabsichtigte Löschung ist auf einen Monat ab Veröffentlichung bestimmt."
    },
    {
      "date": "2025-02-04",
      "id": "100389",
      "original_text": "Einreichung neuer Dokumente\nBaden-Württemberg Amtsgericht Mannheim HRB 8853\nPower Plus Communications AG – Mannheim",
      "type": "Einreichung neuer Dokumente",
      "state": "Baden-Württemberg",
      "amtsgericht": "Amtsgericht Mannheim",
      "registernummer": "HRB 8853",
      "registerart": "HRB",
      "company_name": "Power Plus Communications AG",
      "company_seat": "Mannheim",
      "details": "04.02.2025 (Bekanntmachungsdatum)\n\nBaden-Württemberg Amtsgericht Mannheim HRB 8853\nEinreichung neuer Dokumente 28.01.2025 (Eintragungsdatum)\n\nPower Plus Communications AG\nAktiengesellschaft\nMannheim\n\nDie Gesellschaft hat am 28.01.2025 die Liste über die Zusammensetzung des Aufsichtsrats zum Handelsregister eingereicht."
    },
    {
      "date": "2025-02-04",
      "id": "100390",
      "original_text": "Löschungsankündigung\nBerlin Amtsgericht Berlin (Charlottenburg) HRB 247750\nIMMO-Bau GmbH – Berlin",
      "type": "Löschungsankündigung",
      "state": "Berlin",
      "amtsgericht": "Amtsgericht Berlin (Charlottenburg)",
      "registernummer": "HRB 247750",
      "registerart": "HRB",
      "company_name": "IMMO-Bau GmbH",
      "company_seat": "Berlin",
      "details": "04.02.2025 (Bekanntmachungsdatum)\n\nBerlin Amtsgericht Berlin (Charlottenburg) HRB 247750\nLöschungsankündigung\n\nIMMO-Bau GmbH\nGesellschaft mit beschränkter Haftung\nBerlin\n\nBei der nachstehenden Gesellschaft wird das Amtslöschungsverfahren gemäß § 394 FamFG eingeleitet. Widerspruchsfrist 6 Wochen"
    },
    {
      "date": "2025-02-04",
      "id": "100391",
      "original_text": "Registerbekanntmachung nach dem Umwandlungsgesetz\nHamburg Amtsgericht Hamburg HRB 157500\nFSW Erste Verwaltungsgesellschaft mbH – Hamburg",
      "type": "Registerbekanntmachung nach dem Umwandlungsgesetz",
      "state": "Hamburg",
      "amtsgericht": "Amtsgericht Hamburg",
      "registernummer": "HRB 157500",
      "registerart": "HRB",
      "company_name": "FSW Erste Verwaltungsgesellschaft mbH",
      "company_seat": "Hamburg",
      "details": "04.02.2025 (Bekanntmachungsdatum)\n\nHamburg Amtsgericht Hamburg HRB 157500\nRegisterbekanntmachung nach dem Umwandlungsgesetz 04.02.2025 (Eintragungsdatum)\n\nFSW Erste Verwaltungsgesellschaft mbH\nGesellschaft mit beschränkter Haftung\nHamburg\n\nAls nicht eingetragen wird bekannt gemacht:\nDen Gläubigern der an der Verschmelzung beteiligten Gesellschaften ist, wenn sie binnen sechs Monaten nach dem Tag, an dem die Eintragung der Verschmelzung in das Register des Sitzes desjenigen Rechtsträgers, dessen Gläubiger sie sind, nach § 19 Absatz 3 UmwG als bekannt gemacht gilt, ihren Anspruch nach Grund und Höhe schriftlich anmelden, Sicherheit zu leisten, soweit sie nicht Befriedigung verlangen können. Dieses Recht steht den Gläubigern jedoch nur zu, wenn sie glaubhaft machen, dass durch die Verschmelzung die Erfüllung ihrer Forderung gefährdet wird."
    },
    {
      "date": "2025-02-04",
      "id": "100392",
      "original_text": "Registerbekanntmachung nach dem Umwandlungsgesetz\nBerlin Amtsgericht Berlin (Charlottenburg) HRB 111558\nPIABO PR GmbH – Berlin",
      "type": "Registerbekanntmachung nach dem Umwandlungsgesetz",
      "state": "Berlin",
      "amtsgericht": "Amtsgericht Berlin (Charlottenburg)",
      "registernummer": "HRB 111558",
      "registerart": "HRB",
      "company_name": "PIABO PR GmbH",
      "company_seat": "Berlin",
      "details": "04.02.2025 (Bekanntmachungsdatum)\n\nBerlin Amtsgericht Berlin (Charlottenburg) HRB 111558\nRegisterbekanntmachung nach dem Umwandlungsgesetz 04.02.2025 (Eintragungsdatum)\n\nPIABO PR GmbH\nGesellschaft mit beschränkter Haftung\nBerlin\n\nZu Eintragungsnummer 7 vom 04.02.2025 wird als nicht eingetragen veröffentlicht: Den Gläubigern der an der Verschmelzung beteiligten Rechtsträger ist, wenn sie binnen sechs Monaten nach dem Tag, an dem die Eintragung der Verschmelzung in das Register des Sitzes desjenigen Rechtsträgers, dessen Gläubiger sie sind, als bekannt gemacht gilt, ihren Anspruch nach Grund und Höhe schriftlich anmelden, Sicherheit zu leisten, soweit sie nicht Befriedigung verlangen können. Dieses Recht steht den Gläubigern jedoch nur zu, wenn sie glaubhaft machen, dass durch die Verschmelzung die Erfüllung ihrer Forderung gefährdet wird. Das Recht, Sicherheitsleistung zu verlangen, steht Gläubigern nicht zu, die im Falle der Insolvenz ein Recht auf vorzugsweise Befriedigung aus einer Deckungsmasse haben, die nach gesetzlicher Vorschrift zu ihrem Schutz errichtet und staatlich überwacht ist."
    },
    {
      "date": "2025-02-04",
      "id": "100393",
      "original_text": "Einreichung neuer Dokumente\nBerlin Amtsgericht Berlin (Charlottenburg) HRB 78925\nUHY Deutschland AG Wirtschaftsprüfungsgesellschaft – Berlin",
      "type": "Einreichung neuer Dokumente",
      "state": "Berlin",
      "amtsgericht": "Amtsgericht Berlin (Charlottenburg)",
      "registernummer": "HRB 78925",
      "registerart": "HRB",
      "company_name": "UHY Deutschland AG Wirtschaftsprüfungsgesellschaft",
      "company_seat": "Berlin",
      "details": "04.02.2025 (Bekanntmachungsdatum)\n\nBerlin Amtsgericht Berlin (Charlottenburg) HRB 78925\nEinreichung neuer Dokumente\n\nUHY Deutschland AG Wirtschaftsprüfungsgesellschaft\nAktiengesellschaft\nBerlin\n\nAls nicht eingetragen wird veröffentlicht:\n\nEs wurde eine neue Liste der Aufsichtsratsmitglieder eingereicht (§ 106 AktG)."
    },
    {
      "date": "2025-02-04",
      "id": "100394",
      "original_text": "Registerbekanntmachung nach dem Umwandlungsgesetz\nThüringen Amtsgericht Jena HRA 506957\nNorbert Bloß GmbH & Co. KG – Königsee",
      "type": "Registerbekanntmachung nach dem Umwandlungsgesetz",
      "state": "Thüringen",
      "amtsgericht": "Amtsgericht Jena",
      "registernummer": "HRA 506957",
      "registerart": "HRA",
      "company_name": "Norbert Bloß GmbH & Co. KG",
      "company_seat": "Königsee",
      "details": "04.02.2025 (Bekanntmachungsdatum)\n\nThüringen Amtsgericht Jena HRA 506957\nRegisterbekanntmachung nach dem Umwandlungsgesetz 04.02.2025 (Eintragungsdatum)\n\nNorbert Bloß GmbH & Co. KG\nKommanditgesellschaft\nKönigsee\n\nNicht eingetragen: Den Gläubigern der an der Ausgliederung beteiligten Rechtsträger, ist wenn sie binnen sechs Monaten nach dem Tag, an dem die Eintragung der Ausgliederung in das Register des Sitzes desjenigen Rechtsträgers, dessen Gläubiger sie sind, nach §§125, 19 Abs. 3 UmwG als bekanntgemacht gilt, ihren Anspruch nach Grund und Höhe schriftlich anmelden, Sicherheit zu leisten, soweit sie nicht Befriedigung verlangen können. Dieses Recht steht ihnen jedoch nur zu, wenn sie glaubhaft machen, daß durch die Ausgliederung die Erfüllung ihrer Forderung gefährdet wird."
    },
    {
      "date": "2025-02-04",
      "id": "100395",
      "original_text": "Registerbekanntmachung nach dem Umwandlungsgesetz\nThüringen Amtsgericht Jena HRA 506971\nNorbert Bloß Zaun- und Torbau e.K. – Königsee",
      "type": "Registerbekanntmachung nach dem Umwandlungsgesetz",
      "state": "Thüringen",
      "amtsgericht": "Amtsgericht Jena",
      "registernummer": "HRA 506971",
      "registerart": "HRA",
      "company_name": "Norbert Bloß Zaun- und Torbau e.K.",
      "company_seat": "Königsee",
      "details": "04.02.2025 (Bekanntmachungsdatum)\n\nThüringen Amtsgericht Jena HRA 506971\nRegisterbekanntmachung nach dem Umwandlungsgesetz 04.02.2025 (Eintragungsdatum)\n\nNorbert Bloß Zaun- und Torbau e.K.\nEinzelkaufmann / Einzelkauffrau\nKönigsee\n\nNicht eingetragen: Den Gläubigern der an der Ausgliederung beteiligten Rechtsträger, ist wenn sie binnen sechs Monaten nach dem Tag, an dem die Eintragung der Ausgliederung in das Register des Sitzes desjenigen Rechtsträgers, dessen Gläubiger sie sind, nach §§125, 19 Abs. 3 UmwG als bekanntgemacht gilt, ihren Anspruch nach Grund und Höhe schriftlich anmelden, Sicherheit zu leisten, soweit sie nicht Befriedigung verlangen können. Dieses Recht steht ihnen jedoch nur zu, wenn sie glaubhaft machen, daß durch die Ausgliederung die Erfüllung ihrer Forderung gefährdet wird."
    },
    {
      "date": "2025-02-04",
      "id": "100396",
      "original_text": "Sonstige Registerbekanntmachung\nMecklenburg-Vorpommern Amtsgericht Neubrandenburg HRB 3062\nWohnungsbau- und Verwaltungsgesellschaft Demmin Gesellschaft mit beschränkter Haftung – Demmin",
      "type": "Sonstige Registerbekanntmachung",
      "state": "Mecklenburg-Vorpommern",
      "amtsgericht": "Amtsgericht Neubrandenburg",
      "registernummer": "HRB 3062",
      "registerart": "HRB",
      "company_name": "Wohnungsbau- und Verwaltungsgesellschaft Demmin Gesellschaft mit beschränkter Haftung",
      "company_seat": "Demmin",
      "details": "04.02.2025 (Bekanntmachungsdatum)\n\nMecklenburg-Vorpommern Amtsgericht Neubrandenburg HRB 3062\nSonstige Registerbekanntmachung 12.11.2024 (Eintragungsdatum)\n\nWohnungsbau- und Verwaltungsgesellschaft Demmin Gesellschaft mit beschränkter Haftung\nGesellschaft mit beschränkter Haftung\nDemmin\n\nEine Liste der Mitglieder des Aufsichtsrats ist zum Handelsregister eingereicht worden."
    },
    {
      "date": "2025-02-04",
      "id": "100397",
      "original_text": "Löschungsankündigung\nBerlin Amtsgericht Berlin (Charlottenburg) HRB 138280\nMaansim Telecom Finance GmbH – Berlin",
      "type": "Löschungsankündigung",
      "state": "Berlin",
      "amtsgericht": "Amtsgericht Berlin (Charlottenburg)",
      "registernummer": "HRB 138280",
      "registerart": "HRB",
      "company_name": "Maansim Telecom Finance GmbH",
      "company_seat": "Berlin",
      "details": "04.02.2025 (Bekanntmachungsdatum)\n\nBerlin Amtsgericht Berlin (Charlottenburg) HRB 138280\nLöschungsankündigung\n\nMaansim Telecom Finance GmbH\nGesellschaft mit beschränkter Haftung\nBerlin\n\nBei der nachstehenden Gesellschaft wird das Amtslöschungsverfahren gemäß § 394 FamFG eingeleitet. Widerspruchsfrist\n6 Wochen."
    },
    {
      "date": "2025-02-04",
      "id": "100398",
      "original_text": "Löschungsankündigung\nBaden-Württemberg Amtsgericht Mannheim HRB 719105\nIS Industrie Service GmbH – Heidelberg",
      "type": "Löschungsankündigung",
      "state": "Baden-Württemberg",
      "amtsgericht": "Amtsgericht Mannheim",
      "registernummer": "HRB 719105",
      "registerart": "HRB",
      "company_name": "IS Industrie Service GmbH",
      "company_seat": "Heidelberg",
      "details": "04.02.2025 (Bekanntmachungsdatum)\n\nBaden-Württemberg Amtsgericht Mannheim HRB 719105\nLöschungsankündigung\n\nIS Industrie Service GmbH\nGesellschaft mit beschränkter Haftung\nHeidelberg\n\nAls nicht eingetragen wird bekanntgemacht:\nDas Gericht beabsichtigt, die Gesellschaft wegen Vermögenslosigkeit im Handelsregister von Amts wegen nach § 394 FamFG zu löschen. Die Frist zur Geltendmachung eines Widerspruchs gegen die beabsichtigte Löschung ist auf einen Monat ab Veröffentlichung bestimmt."
    },
    {
      "date": "2025-02-04",
      "id": "100399",
      "original_text": "Einreichung neuer Dokumente\nBaden-Württemberg Amtsgericht Freiburg HRB 729440\nBirkenmeier Geschäftsführungs SE – Breisach am Rhein",
      "type": "Einreichung neuer Dokumente",
      "state": "Baden-Württemberg",
      "amtsgericht": "Amtsgericht Freiburg",
      "registernummer": "HRB 729440",
      "registerart": "HRB",
      "company_name": "Birkenmeier Geschäftsführungs SE",
      "company_seat": "Breisach am Rhein",
      "details": "04.02.2025 (Bekanntmachungsdatum)\n\nBaden-Württemberg Amtsgericht Freiburg HRB 729440\nEinreichung neuer Dokumente\n\nBirkenmeier Geschäftsführungs SE\nEuropäische Aktiengesellschaft (SE)\nBreisach am Rhein\n\nDie Gesellschaft hat am 04.02.2025 die Liste über die Zusammensetzung des Aufsichtsrats zum Handelsregister eingereicht."
    },
    {
      "date": "2025-02-04",
      "id": "100400",
      "original_text": "Löschungsankündigung\nBaden-Württemberg Amtsgericht Mannheim HRB 106905\nTRINON TITANIUM GMBH – Karlsruhe",
      "type": "Löschungsankündigung",
      "state": "Baden-Württemberg",
      "amtsgericht": "Amtsgericht Mannheim",
      "registernummer": "HRB 106905",
      "registerart": "HRB",
      "company_name": "TRINON TITANIUM GMBH",
      "company_seat": "Karlsruhe",
      "details": "04.02.2025 (Bekanntmachungsdatum)\n\nBaden-Württemberg Amtsgericht Mannheim HRB 106905\nLöschungsankündigung\n\nTRINON TITANIUM GMBH\nGesellschaft mit beschränkter Haftung\nKarlsruhe\n\nAls nicht eingetragen wird bekanntgemacht:\nDas Gericht beabsichtigt, die Gesellschaft wegen Vermögenslosigkeit im Handelsregister von Amts wegen nach § 394 FamFG zu löschen. Die Frist zur Geltendmachung eines Widerspruchs gegen die beabsichtigte Löschung ist auf einen Monat ab Veröffentlichung bestimmt."
    },
    {
      "date": "2025-02-04",
      "id": "100401",
      "original_text": "Löschungsankündigung\nBaden-Württemberg Amtsgericht Mannheim HRB 341705\nCarLine TUNING GmbH – Sinsheim",
      "type": "Löschungsankündigung",
      "state": "Baden-Württemberg",
      "amtsgericht": "Amtsgericht Mannheim",
      "registernummer": "HRB 341705",
      "registerart": "HRB",
      "company_name": "CarLine TUNING GmbH",
      "company_seat": "Sinsheim",
      "details": "04.02.2025 (Bekanntmachungsdatum)\n\nBaden-Württemberg Amtsgericht Mannheim HRB 341705\nLöschungsankündigung\n\nCarLine TUNING GmbH\nGesellschaft mit beschränkter Haftung\nSinsheim\n\nAls nicht eingetragen wird bekanntgemacht:\nDas Gericht beabsichtigt, die Gesellschaft wegen Vermögenslosigkeit im Handelsregister von Amts wegen nach § 394 FamFG zu löschen. Die Frist zur Geltendmachung eines Widerspruchs gegen die beabsichtigte Löschung ist auf einen Monat ab Veröffentlichung bestimmt."
    },
    {
      "date": "2025-02-04",
      "id": "100402",
      "original_text": "Einreichung neuer Dokumente\nBaden-Württemberg Amtsgericht Mannheim HRB 104941\nArbeitsförderung Karlsruhe gGmbH (afka) – Karlsruhe",
      "type": "Einreichung neuer Dokumente",
      "state": "Baden-Württemberg",
      "amtsgericht": "Amtsgericht Mannheim",
      "registernummer": "HRB 104941",
      "registerart": "HRB",
      "company_name": "Arbeitsförderung Karlsruhe gGmbH (afka)",
      "company_seat": "Karlsruhe",
      "details": "04.02.2025 (Bekanntmachungsdatum)\n\nBaden-Württemberg Amtsgericht Mannheim HRB 104941\nEinreichung neuer Dokumente\n\nArbeitsförderung Karlsruhe gGmbH (afka)\nGesellschaft mit beschränkter Haftung\nKarlsruhe\n\nDie Gesellschaft hat am 03.02.2025 die Liste über die Zusammensetzung des Aufsichtsrats zum Handelsregister eingereicht."
    },
    {
      "date": "2025-02-04",
      "id": "100403",
      "original_text": "Registerbekanntmachung nach dem Umwandlungsgesetz\nBerlin Amtsgericht Berlin (Charlottenburg) HRB 237894\nBildergarten Entertainment GmbH – Berlin",
      "type": "Registerbekanntmachung nach dem Umwandlungsgesetz",
      "state": "Berlin",
      "amtsgericht": "Amtsgericht Berlin (Charlottenburg)",
      "registernummer": "HRB 237894",
      "registerart": "HRB",
      "company_name": "Bildergarten Entertainment GmbH",
      "company_seat": "Berlin",
      "details": "04.02.2025 (Bekanntmachungsdatum)\n\nBerlin Amtsgericht Berlin (Charlottenburg) HRB 237894\nRegisterbekanntmachung nach dem Umwandlungsgesetz 03.02.2025 (Eintragungsdatum)\n\nBildergarten Entertainment GmbH\nGesellschaft mit beschränkter Haftung\nBerlin\n\nZu Eintragungsnummer 4 vom 03.02.2025 wird als nicht eingetragen veröffentlicht:\nDen Gläubigern der an der Verschmelzung beteiligten Rechtsträger ist, wenn sie binnen sechs Monaten nach dem Tag, an dem die Eintragung der Verschmelzung in das Register des Sitzes desjenigen Rechtsträgers, dessen Gläubiger sie sind, als bekannt gemacht gilt, ihren Anspruch nach Grund und Höhe schriftlich anmelden, Sicherheit zu leisten, soweit sie nicht Befriedigung verlangen können. Dieses Recht steht den Gläubigern jedoch nur zu, wenn sie glaubhaft machen, dass durch die Verschmelzung die Erfüllung ihrer Forderung gefährdet wird. Das Recht, Sicherheitsleistung zu verlangen, steht Gläubigern nicht zu, die im Falle der Insolvenz ein Recht auf vorzugsweise Befriedigung aus einer Deckungsmasse haben, die nach gesetzlicher Vorschrift zu ihrem Schutz errichtet und staatlich überwacht ist."
    },
    {
      "date": "2025-02-04",
      "id": "100404",
      "original_text": "Löschungsankündigung\nBerlin Amtsgericht Berlin (Charlottenburg) HRB 238569\nLOGOTRANS 4U GmbH – Berlin",
      "type": "Löschungsankündigung",
      "state": "Berlin",
      "amtsgericht": "Amtsgericht Berlin (Charlottenburg)",
      "registernummer": "HRB 238569",
      "registerart": "HRB",
      "company_name": "LOGOTRANS 4U GmbH",
      "company_seat": "Berlin",
      "details": "04.02.2025 (Bekanntmachungsdatum)\n\nBerlin Amtsgericht Berlin (Charlottenburg) HRB 238569\nLöschungsankündigung\n\nLOGOTRANS 4U GmbH\nGesellschaft mit beschränkter Haftung\nBerlin\n\nBei der nachstehenden Gesellschaft wird das Amtslöschungsverfahren gemäß § 394 FamFG eingeleitet. Widerspruchsfrist 6 Wochen"
    },
    {
      "date": "2025-02-04",
      "id": "100405",
      "original_text": "Registerbekanntmachung nach dem Umwandlungsgesetz\nHamburg Amtsgericht Hamburg HRB 137709\nNette & Wilenius UG (haftungsbeschränkt) – Hamburg",
      "type": "Registerbekanntmachung nach dem Umwandlungsgesetz",
      "state": "Hamburg",
      "amtsgericht": "Amtsgericht Hamburg",
      "registernummer": "HRB 137709",
      "registerart": "HRB",
      "company_name": "Nette & Wilenius UG (haftungsbeschränkt)",
      "company_seat": "Hamburg",
      "details": "04.02.2025 (Bekanntmachungsdatum)\n\nHamburg Amtsgericht Hamburg HRB 137709\nRegisterbekanntmachung nach dem Umwandlungsgesetz 04.02.2025 (Eintragungsdatum)\n\nNette & Wilenius UG (haftungsbeschränkt)\nGesellschaft mit beschränkter Haftung\nHamburg\n\nAls nicht eingetragen wird bekannt gemacht:\nDen Gläubigern der an der Verschmelzung beteiligten Gesellschaften ist, wenn sie binnen sechs Monaten nach dem Tag, an dem die Eintragung der Verschmelzung in das Register des Sitzes desjenigen Rechtsträgers, dessen Gläubiger sie sind, nach § 19 Absatz 3 UmwG als bekannt gemacht gilt, ihren Anspruch nach Grund und Höhe schriftlich anmelden, Sicherheit zu leisten, soweit sie nicht Befriedigung verlangen können. Dieses Recht steht den Gläubigern jedoch nur zu, wenn sie glaubhaft machen, dass durch die Verschmelzung die Erfüllung ihrer Forderung gefährdet wird."
    },
    {
      "date": "2025-02-04",
      "id": "100406",
      "original_text": "Registerbekanntmachung nach dem Umwandlungsgesetz\nHamburg Amtsgericht Hamburg HRB 185794\nUnigital GmbH – Hamburg",
      "type": "Registerbekanntmachung nach dem Umwandlungsgesetz",
      "state": "Hamburg",
      "amtsgericht": "Amtsgericht Hamburg",
      "registernummer": "HRB 185794",
      "registerart": "HRB",
      "company_name": "Unigital GmbH",
      "company_seat": "Hamburg",
      "details": "04.02.2025 (Bekanntmachungsdatum)\n\nHamburg Amtsgericht Hamburg HRB 185794\nRegisterbekanntmachung nach dem Umwandlungsgesetz 04.02.2025 (Eintragungsdatum)\n\nUnigital GmbH\nGesellschaft mit beschränkter Haftung\nHamburg\n\nAls nicht eingetragen wird bekannt gemacht:\nDen Gläubigern der an der Verschmelzung beteiligten Gesellschaften ist, wenn sie binnen sechs Monaten nach dem Tag, an dem die Eintragung der Verschmelzung in das Register des Sitzes desjenigen Rechtsträgers, dessen Gläubiger sie sind, nach § 19 Absatz 3 UmwG als bekannt gemacht gilt, ihren Anspruch nach Grund und Höhe schriftlich anmelden, Sicherheit zu leisten, soweit sie nicht Befriedigung verlangen können. Dieses Recht steht den Gläubigern jedoch nur zu, wenn sie glaubhaft machen, dass durch die Verschmelzung die Erfüllung ihrer Forderung gefährdet wird."
    },
    {
      "date": "2025-02-04",
      "id": "100407",
      "original_text": "Registerbekanntmachung nach dem Umwandlungsgesetz\nBerlin Amtsgericht Berlin (Charlottenburg) HRB 189889\nHavelländer Rosenensemble GmbH – Berlin",
      "type": "Registerbekanntmachung nach dem Umwandlungsgesetz",
      "state": "Berlin",
      "amtsgericht": "Amtsgericht Berlin (Charlottenburg)",
      "registernummer": "HRB 189889",
      "registerart": "HRB",
      "company_name": "Havelländer Rosenensemble GmbH",
      "company_seat": "Berlin",
      "details": "04.02.2025 (Bekanntmachungsdatum)\n\nBerlin Amtsgericht Berlin (Charlottenburg) HRB 189889\nRegisterbekanntmachung nach dem Umwandlungsgesetz 03.02.2025 (Eintragungsdatum)\n\nHavelländer Rosenensemble GmbH\nGesellschaft mit beschränkter Haftung\nBerlin\n\nZu Eintragungsnummer 7 vom 03.02.2025 wird als nicht eingetragen veröffentlicht:\nDer andere Vertragsteil hat den Gläubigern dieses Rechtsträgers, deren Forderungen begründet worden sind, bevor die Eintragung der Beendigung dieses Vertrages in das Handelsregister nach § 10 des Handelsgesetzbuches als bekannt gemacht gilt, Sicherheit zu leisten, wenn sie sich binnen sechs Monaten nach der Bekanntmachung der Eintragung zu diesem Zweck bei ihm melden. Dieses Recht steht den Gläubigern nicht zu, die im Fall des Insolvenzverfahrens ein Recht auf vorzugsweise Befriedigung aus der Deckungsmasse haben, die nach gesetzlicher Vorschrift zu ihrem Schutz errichtet und staatlich überwacht ist."
    },
    {
      "date": "2025-02-04",
      "id": "100408",
      "original_text": "Einreichung neuer Dokumente\nSachsen Amtsgericht Chemnitz HRB 8550\nOelsnitzer Wohnungsbaugesellschaft mbH - OEWOG - – Oelsnitz/Vogtl.",
      "type": "Einreichung neuer Dokumente",
      "state": "Sachsen",
      "amtsgericht": "Amtsgericht Chemnitz",
      "registernummer": "HRB 8550",
      "registerart": "HRB",
      "company_name": "Oelsnitzer Wohnungsbaugesellschaft mbH - OEWOG -",
      "company_seat": "Oelsnitz/Vogtl.",
      "details": "04.02.2025 (Bekanntmachungsdatum)\n\nSachsen Amtsgericht Chemnitz HRB 8550\nEinreichung neuer Dokumente\n\nOelsnitzer Wohnungsbaugesellschaft mbH - OEWOG -\nGesellschaft mit beschränkter Haftung\nOelsnitz/Vogtl.\n\nAm 21.01.2025 wurde beim Handelsregister des Amtsgerichts Chemnitz die Liste der Mitglieder des Aufsichtsrats gemäß § 52 GmbHG eingereicht."
    },
    {
      "date": "2025-02-04",
      "id": "100409",
      "original_text": "Löschungsankündigung\nSachsen Amtsgericht Dresden HRB 17671\nHACA Bedachungen GmbH – Leutersdorf",
      "type": "Löschungsankündigung",
      "state": "Sachsen",
      "amtsgericht": "Amtsgericht Dresden",
      "registernummer": "HRB 17671",
      "registerart": "HRB",
      "company_name": "HACA Bedachungen GmbH",
      "company_seat": "Leutersdorf",
      "details": "04.02.2025 (Bekanntmachungsdatum)\n\nSachsen Amtsgericht Dresden HRB 17671\nLöschungsankündigung\n\nHACA Bedachungen GmbH\nGesellschaft mit beschränkter Haftung\nLeutersdorf\n\nDas Registergericht beabsichtigt, die im Handelsregister eingetragene Gesellschaft von Amts wegen nach § 394 FamFG zu löschen. Die Frist zu Erhebung eines Widerspruchs gegen die beabsichtigte Löschung wird auf einen Monat festgesetzt."
    },
    {
      "date": "2025-02-04",
      "id": "100410",
      "original_text": "Einreichung neuer Dokumente\nSachsen Amtsgericht Leipzig HRB 7969\nRegionalbus Leipzig GmbH – Deuben",
      "type": "Einreichung neuer Dokumente",
      "state": "Sachsen",
      "amtsgericht": "Amtsgericht Leipzig",
      "registernummer": "HRB 7969",
      "registerart": "HRB",
      "company_name": "Regionalbus Leipzig GmbH",
      "company_seat": "Deuben",
      "details": "04.02.2025 (Bekanntmachungsdatum)\n\nSachsen Amtsgericht Leipzig HRB 7969\nEinreichung neuer Dokumente\n\nRegionalbus Leipzig GmbH\nGesellschaft mit beschränkter Haftung\nDeuben\n\nAm 31.01.2025 wurde beim Handelsregister des Amtsgerichts Leipzig die Liste der Mitglieder des Aufsichtsrats gemäß § 52 GmbHG eingereicht."
    },
    {
      "date": "2025-02-04",
      "id": "100411",
      "original_text": "Löschungsankündigung\nNiedersachsen Amtsgericht Braunschweig HRA 201892\nEu Tech Europa Technology e. K. – Braunschweig",
      "type": "Löschungsankündigung",
      "state": "Niedersachsen",
      "amtsgericht": "Amtsgericht Braunschweig",
      "registernummer": "HRA 201892",
      "registerart": "HRA",
      "company_name": "Eu Tech Europa Technology e. K.",
      "company_seat": "Braunschweig",
      "details": "04.02.2025 (Bekanntmachungsdatum)\n\nNiedersachsen Amtsgericht Braunschweig HRA 201892\nLöschungsankündigung\n\nEu Tech Europa Technology e. K.\nEinzelkaufmann / Einzelkauffrau\nBraunschweig\n\nDas Registergericht beabsichtigt, die Firma von Amts wegen nach § 31 Abs. 2 Satz 2 HGB, § 393 FamFG zu löschen. Die Frist zur Erhebung eines Widerspruchs ist auf 1 Monat ab dieser Registerbekanntmachung festgesetzt."
    },
    {
      "date": "2025-02-04",
      "id": "100412",
      "original_text": "Registerbekanntmachung nach dem Umwandlungsgesetz\nNiedersachsen Amtsgericht Braunschweig HRA 203142\nKlaus Hosang Landwirtschaft e.K. – Söllingen",
      "type": "Registerbekanntmachung nach dem Umwandlungsgesetz",
      "state": "Niedersachsen",
      "amtsgericht": "Amtsgericht Braunschweig",
      "registernummer": "HRA 203142",
      "registerart": "HRA",
      "company_name": "Klaus Hosang Landwirtschaft e.K.",
      "company_seat": "Söllingen",
      "details": "04.02.2025 (Bekanntmachungsdatum)\n\nNiedersachsen Amtsgericht Braunschweig HRA 203142\nRegisterbekanntmachung nach dem Umwandlungsgesetz 04.02.2025 (Eintragungsdatum)\n\nKlaus Hosang Landwirtschaft e.K.\nEinzelkaufmann / Einzelkauffrau\nSöllingen\n\nDen Gläubigern der an der Ausgliederung beteiligten Rechtsträger ist, wenn sie binnen sechs Monaten nach dem Tag, an dem die Eintragung der Ausgliederung in das Register des Sitzes desjenigen Rechtsträgers, dessen Gläubiger sie sind, nach § 19 Abs. 3 UmwG als bekannt gemacht gilt, ihren Anspruch nach Grund und Höhe schriftlich anmelden, Sicherheit zu leisten, soweit sie nicht Befriedigung verlangen können. Dieses Recht steht den Gläubigern jedoch nur zu, wenn sie glaubhaft machen, dass durch die Ausgliederung die Erfüllung der Forderung gefährdet wird."
    },
    {
      "date": "2025-02-04",
      "id": "100413",
      "original_text": "Registerbekanntmachung nach dem Umwandlungsgesetz\nNiedersachsen Amtsgericht Hildesheim HRB 209855\nHanseatische Handelskontor Wohnkollektionen GmbH – Wittingen",
      "type": "Registerbekanntmachung nach dem Umwandlungsgesetz",
      "state": "Niedersachsen",
      "amtsgericht": "Amtsgericht Hildesheim",
      "registernummer": "HRB 209855",
      "registerart": "HRB",
      "company_name": "Hanseatische Handelskontor Wohnkollektionen GmbH",
      "company_seat": "Wittingen",
      "details": "04.02.2025 (Bekanntmachungsdatum)\n\nNiedersachsen Amtsgericht Hildesheim HRB 209855\nRegisterbekanntmachung nach dem Umwandlungsgesetz 04.02.2025 (Eintragungsdatum)\n\nHanseatische Handelskontor Wohnkollektionen GmbH\nGesellschaft mit beschränkter Haftung\nWittingen\n\nDen Gläubigern der an der Abspaltung beteiligten Rechtsträger ist, wenn sie binnen sechs Monaten nach dem Tag, an dem die Eintragung der Abspaltung in das Register des Sitzes desjenigen Rechtsträgers, dessen Gläubiger sie sind, nach § 19 Abs. 3 UmwG als bekannt gemacht gilt, ihren Anspruch nach Grund und Höhe schriftlich anmelden, Sicherheit zu leisten, soweit sie nicht Befriedigung verlangen können. Dieses Recht steht den Gläubigern jedoch nur zu, wenn sie glaubhaft machen, dass durch die Abspaltung die Erfüllung der Forderung gefährdet wird."
    },
    {
      "date": "2025-02-04",
      "id": "100414",
      "original_text": "Einreichung neuer Dokumente\nNiedersachsen Amtsgericht Osnabrück HRB 211583\nATTENTIUM AG – Osnabrück",
      "type": "Einreichung neuer Dokumente",
      "state": "Niedersachsen",
      "amtsgericht": "Amtsgericht Osnabrück",
      "registernummer": "HRB 211583",
      "registerart": "HRB",
      "company_name": "ATTENTIUM AG",
      "company_seat": "Osnabrück",
      "details": "04.02.2025 (Bekanntmachungsdatum)\n\nNiedersachsen Amtsgericht Osnabrück HRB 211583\nEinreichung neuer Dokumente\n\nATTENTIUM AG\nAktiengesellschaft\nOsnabrück\n\nDie Liste der Mitglieder des Aufsichtsrats wurde beim Registergericht eingereicht."
    },
    {
      "date": "2025-02-04",
      "id": "100415",
      "original_text": "Registerbekanntmachung nach dem Umwandlungsgesetz\nNiedersachsen Amtsgericht Osnabrück HRB 208563\nArchiBALD Verwaltungs GmbH – Dissen",
      "type": "Registerbekanntmachung nach dem Umwandlungsgesetz",
      "state": "Niedersachsen",
      "amtsgericht": "Amtsgericht Osnabrück",
      "registernummer": "HRB 208563",
      "registerart": "HRB",
      "company_name": "ArchiBALD Verwaltungs GmbH",
      "company_seat": "Dissen",
      "details": "04.02.2025 (Bekanntmachungsdatum)\n\nNiedersachsen Amtsgericht Osnabrück HRB 208563\nRegisterbekanntmachung nach dem Umwandlungsgesetz 04.02.2025 (Eintragungsdatum)\n\nArchiBALD Verwaltungs GmbH\nGesellschaft mit beschränkter Haftung\nDissen\n\nDen Gläubigern der an der Verschmelzung beteiligten Rechtsträger ist, wenn sie binnen sechs Monaten nach dem Tag, an dem die Eintragung der Verschmelzung in das Register des Sitzes desjenigen Rechtsträgers, dessen Gläubiger sie sind, nach § 19  Abs.  3 UmwG als bekannt gemacht gilt, ihren Anspruch nach Grund und Höhe schriftlich anmelden, Sicherheit zu leisten, soweit sie nicht Befriedigung verlangen können. Dieses Recht steht den Gläubigern jedoch nur zu, wenn sie glaubhaft machen, dass durch die Verschmelzung die Erfüllung der Forderung gefährdet wird."
    },
    {
      "date": "2025-02-04",
      "id": "100416",
      "original_text": "Registerbekanntmachung nach dem Umwandlungsgesetz\nNiedersachsen Amtsgericht Hildesheim HRA 200905\nHanseatisches Handelskontor GmbH & Co. Industrievertretungen KG – Wittingen",
      "type": "Registerbekanntmachung nach dem Umwandlungsgesetz",
      "state": "Niedersachsen",
      "amtsgericht": "Amtsgericht Hildesheim",
      "registernummer": "HRA 200905",
      "registerart": "HRA",
      "company_name": "Hanseatisches Handelskontor GmbH & Co. Industrievertretungen KG",
      "company_seat": "Wittingen",
      "details": "04.02.2025 (Bekanntmachungsdatum)\n\nNiedersachsen Amtsgericht Hildesheim HRA 200905\nRegisterbekanntmachung nach dem Umwandlungsgesetz 04.02.2025 (Eintragungsdatum)\n\nHanseatisches Handelskontor GmbH & Co. Industrievertretungen KG\nKommanditgesellschaft\nWittingen\n\nDen Gläubigern der an der Abspaltung beteiligten Rechtsträger ist, wenn sie binnen sechs Monaten nach dem Tag, an dem die Eintragung der Abspaltung in das Register des Sitzes desjenigen Rechtsträgers, dessen Gläubiger sie sind, nach § 19 Abs. 3 UmwG als bekannt gemacht gilt, ihren Anspruch nach Grund und Höhe schriftlich anmelden, Sicherheit zu leisten, soweit sie nicht Befriedigung verlangen können. Dieses Recht steht den Gläubigern jedoch nur zu, wenn sie glaubhaft machen, dass durch die Abspaltung die Erfüllung der Forderung gefährdet wird."
    },
    {
      "date": "2025-02-04",
      "id": "100417",
      "original_text": "Einreichung neuer Dokumente\nNiedersachsen Amtsgericht Hildesheim HRB 2484\nHarzwasserwerke Gesellschaft mit beschränkter Haftung – Hildesheim",
      "type": "Einreichung neuer Dokumente",
      "state": "Niedersachsen",
      "amtsgericht": "Amtsgericht Hildesheim",
      "registernummer": "HRB 2484",
      "registerart": "HRB",
      "company_name": "Harzwasserwerke Gesellschaft mit beschränkter Haftung",
      "company_seat": "Hildesheim",
      "details": "04.02.2025 (Bekanntmachungsdatum)\n\nNiedersachsen Amtsgericht Hildesheim HRB 2484\nEinreichung neuer Dokumente\n\nHarzwasserwerke Gesellschaft mit beschränkter Haftung\nGesellschaft mit beschränkter Haftung\nHildesheim\n\nDie Liste der Mitglieder des Aufsichtsrats wurde beim Registergericht eingereicht."
    },
    {
      "date": "2025-02-04",
      "id": "100418",
      "original_text": "Löschungsankündigung\nNiedersachsen Amtsgericht Göttingen HRB 203954\nMC-TRUCK GmbH – Northeim",
      "type": "Löschungsankündigung",
      "state": "Niedersachsen",
      "amtsgericht": "Amtsgericht Göttingen",
      "registernummer": "HRB 203954",
      "registerart": "HRB",
      "company_name": "MC-TRUCK GmbH",
      "company_seat": "Northeim",
      "details": "04.02.2025 (Bekanntmachungsdatum)\n\nNiedersachsen Amtsgericht Göttingen HRB 203954\nLöschungsankündigung\n\nMC-TRUCK GmbH\nGesellschaft mit beschränkter Haftung\nNortheim\n\nDas Registergericht beabsichtigt, die Gesellschaft von Amts wegen nach § 394 FamFG zu löschen. Die Frist zur Erhebung eines Widerspruchs ist auf 1 Monat ab dieser Registerbekanntmachung festgesetzt."
    },
    {
      "date": "2025-02-04",
      "id": "100419",
      "original_text": "Löschungsankündigung\nNiedersachsen Amtsgericht Lüneburg HRB 209435\nTop Travel 24 UG (haftungsbeschränkt) – Tespe",
      "type": "Löschungsankündigung",
      "state": "Niedersachsen",
      "amtsgericht": "Amtsgericht Lüneburg",
      "registernummer": "HRB 209435",
      "registerart": "HRB",
      "company_name": "Top Travel 24 UG (haftungsbeschränkt)",
      "company_seat": "Tespe",
      "details": "04.02.2025 (Bekanntmachungsdatum)\n\nNiedersachsen Amtsgericht Lüneburg HRB 209435\nLöschungsankündigung\n\nTop Travel 24 UG (haftungsbeschränkt)\nGesellschaft mit beschränkter Haftung\nTespe\n\nDas Registergericht beabsichtigt, die Gesellschaft von Amts wegen nach § 394 FamFG zu löschen. Die Frist zur Erhebung eines Widerspruchs ist auf 1 Monat ab dieser Registerbekanntmachung festgesetzt."
    },
    {
      "date": "2025-02-04",
      "id": "100420",
      "original_text": "Einreichung neuer Dokumente\nNiedersachsen Amtsgericht Stadthagen HRB 2158\nErholungsgebiet Doktor - See Gesellschaft mit beschränkter Haftung – Rinteln",
      "type": "Einreichung neuer Dokumente",
      "state": "Niedersachsen",
      "amtsgericht": "Amtsgericht Stadthagen",
      "registernummer": "HRB 2158",
      "registerart": "HRB",
      "company_name": "Erholungsgebiet Doktor - See Gesellschaft mit beschränkter Haftung",
      "company_seat": "Rinteln",
      "details": "04.02.2025 (Bekanntmachungsdatum)\n\nNiedersachsen Amtsgericht Stadthagen HRB 2158\nEinreichung neuer Dokumente 30.01.2025 (Eintragungsdatum)\n\nErholungsgebiet Doktor - See Gesellschaft mit beschränkter Haftung\nGesellschaft mit beschränkter Haftung\nRinteln\n\nDie Liste der Mitglieder des Aufsichtsrats wurde beim Registergericht eingereicht.Die Liste der Mitglieder des Aufsichtsrats wurde beim Registergericht eingereicht."
    },
    {
      "date": "2025-02-04",
      "id": "100421",
      "original_text": "Registerbekanntmachung nach dem Umwandlungsgesetz\nNiedersachsen Amtsgericht Braunschweig HRA 203163\nADG Agrargesellschaft mbH & Co. KG – Söllingen",
      "type": "Registerbekanntmachung nach dem Umwandlungsgesetz",
      "state": "Niedersachsen",
      "amtsgericht": "Amtsgericht Braunschweig",
      "registernummer": "HRA 203163",
      "registerart": "HRA",
      "company_name": "ADG Agrargesellschaft mbH & Co. KG",
      "company_seat": "Söllingen",
      "details": "04.02.2025 (Bekanntmachungsdatum)\n\nNiedersachsen Amtsgericht Braunschweig HRA 203163\nRegisterbekanntmachung nach dem Umwandlungsgesetz 04.02.2025 (Eintragungsdatum)\n\nADG Agrargesellschaft mbH & Co. KG\nKommanditgesellschaft\nSöllingen\n\nDen Gläubigern der an der Ausgliederung beteiligten Rechtsträger ist, wenn sie binnen sechs Monaten nach dem Tag, an dem die Eintragung der Ausgliederung in das Register des Sitzes desjenigen Rechtsträgers, dessen Gläubiger sie sind, nach § 19 Abs. 3 UmwG als bekannt gemacht gilt, ihren Anspruch nach Grund und Höhe schriftlich anmelden, Sicherheit zu leisten, soweit sie nicht Befriedigung verlangen können. Dieses Recht steht den Gläubigern jedoch nur zu, wenn sie glaubhaft machen, dass durch die Ausgliederung die Erfüllung der Forderung gefährdet wird."
    },
    {
      "date": "2025-02-04",
      "id": "100422",
      "original_text": "Löschungsankündigung\nNiedersachsen Amtsgericht Aurich HRA 200478\nReederei MS \"Global Hermes\" GmbH & Co. KG – Leer",
      "type": "Löschungsankündigung",
      "state": "Niedersachsen",
      "amtsgericht": "Amtsgericht Aurich",
      "registernummer": "HRA 200478",
      "registerart": "HRA",
      "company_name": "Reederei MS \"Global Hermes\" GmbH & Co. KG",
      "company_seat": "Leer",
      "details": "04.02.2025 (Bekanntmachungsdatum)\n\nNiedersachsen Amtsgericht Aurich HRA 200478\nLöschungsankündigung 04.02.2025 (Eintragungsdatum)\n\nReederei MS \"Global Hermes\" GmbH & Co. KG\nKommanditgesellschaft\nLeer\n\nDas Registergericht beabsichtigt, die Firma von Amts wegen nach § 394 FamFG zu löschen. Die Frist zur Erhebung eines Widerspruchs ist auf 1 Monat ab dieser Registerbekanntmachung festgesetzt."
    },
    {
      "date": "2025-02-04",
      "id": "100423",
      "original_text": "Registerbekanntmachung nach dem Umwandlungsgesetz\nNiedersachsen Amtsgericht Osnabrück HRB 219872\nArchiBALD Regalanlagen GmbH – Dissen",
      "type": "Registerbekanntmachung nach dem Umwandlungsgesetz",
      "state": "Niedersachsen",
      "amtsgericht": "Amtsgericht Osnabrück",
      "registernummer": "HRB 219872",
      "registerart": "HRB",
      "company_name": "ArchiBALD Regalanlagen GmbH",
      "company_seat": "Dissen",
      "details": "04.02.2025 (Bekanntmachungsdatum)\n\nNiedersachsen Amtsgericht Osnabrück HRB 219872\nRegisterbekanntmachung nach dem Umwandlungsgesetz 04.02.2025 (Eintragungsdatum)\n\nArchiBALD Regalanlagen GmbH\nGesellschaft mit beschränkter Haftung\nDissen\n\nDen Gläubigern der an der Verschmelzung beteiligten Rechtsträger ist, wenn sie binnen sechs Monaten nach dem Tag, an dem die Eintragung der Verschmelzung in das Register des Sitzes desjenigen Rechtsträgers, dessen Gläubiger sie sind, nach § 19  Abs.  3 UmwG als bekannt gemacht gilt, ihren Anspruch nach Grund und Höhe schriftlich anmelden, Sicherheit zu leisten, soweit sie nicht Befriedigung verlangen können. Dieses Recht steht den Gläubigern jedoch nur zu, wenn sie glaubhaft machen, dass durch die Verschmelzung die Erfüllung der Forderung gefährdet wird."
    },
    {
      "date": "2025-02-04",
      "id": "100424",
      "original_text": "Registerbekanntmachung nach dem Umwandlungsgesetz\nNiedersachsen Amtsgericht Göttingen HRA 202296\nEventbus Südniedersachsen OHG – Nörten-Hardenberg",
      "type": "Registerbekanntmachung nach dem Umwandlungsgesetz",
      "state": "Niedersachsen",
      "amtsgericht": "Amtsgericht Göttingen",
      "registernummer": "HRA 202296",
      "registerart": "HRA",
      "company_name": "Eventbus Südniedersachsen OHG",
      "company_seat": "Nörten-Hardenberg",
      "details": "04.02.2025 (Bekanntmachungsdatum)\n\nNiedersachsen Amtsgericht Göttingen HRA 202296\nRegisterbekanntmachung nach dem Umwandlungsgesetz 04.02.2025 (Eintragungsdatum)\n\nEventbus Südniedersachsen OHG\nOffene Handelsgesellschaft\nNörten-Hardenberg\n\nDen Gläubigern der an der Verschmelzung beteiligten Rechtsträger ist, wenn sie binnen sechs Monaten nach dem Tag, an dem die Eintragung der Verschmelzung in das Register des Sitzes desjenigen Rechtsträgers, dessen Gläubiger sie sind, nach § 19  Abs.  3 UmwG als bekannt gemacht gilt, ihren Anspruch nach Grund und Höhe schriftlich anmelden, Sicherheit zu leisten, soweit sie nicht Befriedigung verlangen können. Dieses Recht steht den Gläubigern jedoch nur zu, wenn sie glaubhaft machen, dass durch die Verschmelzung die Erfüllung der Forderung gefährdet wird."
    },
    {
      "date": "2025-02-04",
      "id": "100425",
      "original_text": "Einreichung neuer Dokumente\nRheinland-Pfalz Amtsgericht Koblenz HRB 23119\nAmazon Koblenz GmbH – Koblenz",
      "type": "Einreichung neuer Dokumente",
      "state": "Rheinland-Pfalz",
      "amtsgericht": "Amtsgericht Koblenz",
      "registernummer": "HRB 23119",
      "registerart": "HRB",
      "company_name": "Amazon Koblenz GmbH",
      "company_seat": "Koblenz",
      "details": "04.02.2025 (Bekanntmachungsdatum)\n\nRheinland-Pfalz Amtsgericht Koblenz HRB 23119\nEinreichung neuer Dokumente\n\nAmazon Koblenz GmbH\nGesellschaft mit beschränkter Haftung\nKoblenz\n\nDem Registergericht ist eine neue Liste der Mitglieder des Aufsichtsrates eingereicht worden."
    },
    {
      "date": "2025-02-04",
      "id": "100426",
      "original_text": "Registerbekanntmachung nach dem Umwandlungsgesetz\nBremen Amtsgericht Bremen HRB 25248\nSchmidtmeyer Verwaltungs GmbH – Bremen",
      "type": "Registerbekanntmachung nach dem Umwandlungsgesetz",
      "state": "Bremen",
      "amtsgericht": "Amtsgericht Bremen",
      "registernummer": "HRB 25248",
      "registerart": "HRB",
      "company_name": "Schmidtmeyer Verwaltungs GmbH",
      "company_seat": "Bremen",
      "details": "04.02.2025 (Bekanntmachungsdatum)\n\nBremen Amtsgericht Bremen HRB 25248\nRegisterbekanntmachung nach dem Umwandlungsgesetz 31.01.2025 (Eintragungsdatum)\n\nSchmidtmeyer Verwaltungs GmbH\nGesellschaft mit beschränkter Haftung\nBremen\n\nZu Eintragungsnummer 4 vom 31.01.2025 wird veröffentlicht: Den Gläubigern der an der Verschmelzung beteiligten Rechtsträger ist, wenn sie binnen sechs Monaten nach dem Tag, an dem die Eintragung der Verschmelzung in das Register des Sitzes desjenigen Rechtsträgers, dessen Gläubiger sie sind, als bekannt gemacht gilt, ihren Anspruch nach Grund und Höhe schriftlich anmelden, Sicherheit zu leisten, soweit sie nicht Befriedigung verlangen können. Dieses Recht steht den Gläubigern jedoch nur zu, wenn sie glaubhaft machen, dass durch die Verschmelzung die Erfüllung ihrer Forderung gefährdet wird. Das Recht, Sicherheitsleistung zu verlangen, steht Gläubigern nicht zu, die im Falle der Insolvenz ein Recht auf vorzugsweise Befriedigung aus einer Deckungsmasse haben, die nach gesetzlicher Vorschrift zu ihrem Schutz errichtet und staatlich überwacht ist."
    },
    {
      "date": "2025-02-04",
      "id": "100427",
      "original_text": "Sonstige Registerbekanntmachung\nRheinland-Pfalz Amtsgericht Koblenz HRB 21437\nTeam-Gerüstbau-Service GmbH – Bad Neuenahr-Ahrweiler",
      "type": "Sonstige Registerbekanntmachung",
      "state": "Rheinland-Pfalz",
      "amtsgericht": "Amtsgericht Koblenz",
      "registernummer": "HRB 21437",
      "registerart": "HRB",
      "company_name": "Team-Gerüstbau-Service GmbH",
      "company_seat": "Bad Neuenahr-Ahrweiler",
      "details": "04.02.2025 (Bekanntmachungsdatum)\n\nRheinland-Pfalz Amtsgericht Koblenz HRB 21437\nSonstige Registerbekanntmachung 04.02.2025 (Eintragungsdatum)\n\nTeam-Gerüstbau-Service GmbH\nGesellschaft mit beschränkter Haftung\nBad Neuenahr-Ahrweiler\n\nAls nicht eingetragen wird veröffentlicht: Den Gläubigern der Gesellschaft, deren Forderungen begründet worden sind, bevor die Eintragung der Beendigung des Beherrschungs- undGewinnabführungsvertrages in das Handelsregister nach § 10 des Handelsgesetzbuches als bekanntgemacht gilt, hat der andere Vertragsteil Sicherheit zu leisten, wenn sie sich binnen sechs Monaten nach der Bekanntmachung der Eintragung zu diesem Zweck bei ihm melden."
    },
    {
      "date": "2025-02-04",
      "id": "100428",
      "original_text": "Einreichung neuer Dokumente\nRheinland-Pfalz Amtsgericht Ludwigshafen a.Rhein (Ludwigshafen) HRB 63285\nPfalzwerke Netz AG – Ludwigshafen/Rhein",
      "type": "Einreichung neuer Dokumente",
      "state": "Rheinland-Pfalz",
      "amtsgericht": "Amtsgericht Ludwigshafen a.Rhein (Ludwigshafen)",
      "registernummer": "HRB 63285",
      "registerart": "HRB",
      "company_name": "Pfalzwerke Netz AG",
      "company_seat": "Ludwigshafen/Rhein",
      "details": "04.02.2025 (Bekanntmachungsdatum)\n\nRheinland-Pfalz Amtsgericht Ludwigshafen a.Rhein (Ludwigshafen) HRB 63285\nEinreichung neuer Dokumente\n\nPfalzwerke Netz AG\nAktiengesellschaft\nLudwigshafen/Rhein\n\nDem Registergericht ist eine neue Liste der Mitglieder des Aufsichtsrates eingereicht worden."
    },
    {
      "date": "2025-02-04",
      "id": "100429",
      "original_text": "Registerbekanntmachung nach dem Umwandlungsgesetz\nRheinland-Pfalz Amtsgericht Koblenz HRB 25090\nDieter Kirstgen GmbH – Mayen",
      "type": "Registerbekanntmachung nach dem Umwandlungsgesetz",
      "state": "Rheinland-Pfalz",
      "amtsgericht": "Amtsgericht Koblenz",
      "registernummer": "HRB 25090",
      "registerart": "HRB",
      "company_name": "Dieter Kirstgen GmbH",
      "company_seat": "Mayen",
      "details": "04.02.2025 (Bekanntmachungsdatum)\n\nRheinland-Pfalz Amtsgericht Koblenz HRB 25090\nRegisterbekanntmachung nach dem Umwandlungsgesetz 04.02.2025 (Eintragungsdatum)\n\nDieter Kirstgen GmbH\nGesellschaft mit beschränkter Haftung\nMayen\n\nAls nicht eingetragen wird veröffentlicht: Den Gläubigern der an der Verschmelzung beteiligten Rechtsträger ist, wenn sie binnen sechs Monaten nach dem Tag, an dem die Eintragung der Verschmelzung in das Register des Sitzes desjenigen Rechtsträgers,dessen Gläubiger sie sind, nach § 19 Abs. 3 UmwG als bekannt gemacht gilt, ihren Anspruch nach Grund und Höhe schriftlich anmelden, Sicherheit zu leisten, soweit sie nicht Befriedigung verlangen können. Dieses Recht steht den Gläubigern jedoch nur zu, wenn sie glaubhaft machen, dass durch die Verschmelzung die Erfüllung der Forderung gefährdet wird."
    },
    {
      "date": "2025-02-04",
      "id": "100430",
      "original_text": "Sonstige Registerbekanntmachung\nRheinland-Pfalz Amtsgericht Koblenz HRB 6745\nDiehl-Mehlhorn Management GmbH – Koblenz",
      "type": "Sonstige Registerbekanntmachung",
      "state": "Rheinland-Pfalz",
      "amtsgericht": "Amtsgericht Koblenz",
      "registernummer": "HRB 6745",
      "registerart": "HRB",
      "company_name": "Diehl-Mehlhorn Management GmbH",
      "company_seat": "Koblenz",
      "details": "04.02.2025 (Bekanntmachungsdatum)\n\nRheinland-Pfalz Amtsgericht Koblenz HRB 6745\nSonstige Registerbekanntmachung 04.02.2025 (Eintragungsdatum)\n\nDiehl-Mehlhorn Management GmbH\nGesellschaft mit beschränkter Haftung\nKoblenz\n\nAls nicht eingetragen wird veröffentlicht: Den Gläubigern der Gesellschaft, deren Forderungen begründet worden sind, bevor die Eintragung der Beendigung desBeherrschungs- undGewinnabführungsvertrages in das Handelsregister nach § 10 des Handelsgesetzbuches als bekanntgemacht gilt, hat der andere Vertragsteil Sicherheit zu leisten, wenn sie sich binnen sechs Monaten nach der Bekanntmachung der Eintragung zu diesem Zweck bei ihm melden."
    },
    {
      "date": "2025-02-04",
      "id": "100431",
      "original_text": "Registerbekanntmachung nach dem Umwandlungsgesetz\nNordrhein-Westfalen Amtsgericht Köln HRA 37315\nThomas Montanes Fernandez e.K. Inhaber Thomas Montanes Fernandez – Köln",
      "type": "Registerbekanntmachung nach dem Umwandlungsgesetz",
      "state": "Nordrhein-Westfalen",
      "amtsgericht": "Amtsgericht Köln",
      "registernummer": "HRA 37315",
      "registerart": "HRA",
      "company_name": "Thomas Montanes Fernandez e.K. Inhaber Thomas Montanes Fernandez",
      "company_seat": "Köln",
      "details": "04.02.2025 (Bekanntmachungsdatum)\n\nNordrhein-Westfalen Amtsgericht Köln HRA 37315\nRegisterbekanntmachung nach dem Umwandlungsgesetz 04.02.2025 (Eintragungsdatum)\n\nThomas Montanes Fernandez e.K. Inhaber Thomas Montanes Fernandez\nEinzelkaufmann / Einzelkauffrau\nKöln\n\nDen Gläubigern der an der Ausgliederung beteiligten Rechtsträger ist, wenn sie binnen sechs Monaten nach dem Tag, an dem die Eintragung der Ausgliederung in das Register des Sitzes derjenigen Rechtsträger deren Gläubiger sie sind, nach § 19 Absatz 3 UmwG als bekanntgemacht gilt, ihren Anspruch nach Grund und Höhe schriftlich anmelden, Sicherheit zu leisten, soweit sie nicht Befriedigung verlangen können. Dieses Recht steht den Gläubigern jedoch nur zu, wenn sie glaubhaft machen, dass durch die Ausgliederung die Erfüllung ihrer Forderung gefährdet wird."
    },
    {
      "date": "2025-02-04",
      "id": "100432",
      "original_text": "Einreichung neuer Dokumente\nNordrhein-Westfalen Amtsgericht Dortmund HRB 26278\nNordrheinische Erdgastransportleitungs-Verwaltungs-GmbH – Dortmund",
      "type": "Einreichung neuer Dokumente",
      "state": "Nordrhein-Westfalen",
      "amtsgericht": "Amtsgericht Dortmund",
      "registernummer": "HRB 26278",
      "registerart": "HRB",
      "company_name": "Nordrheinische Erdgastransportleitungs-Verwaltungs-GmbH",
      "company_seat": "Dortmund",
      "details": "04.02.2025 (Bekanntmachungsdatum)\n\nNordrhein-Westfalen Amtsgericht Dortmund HRB 26278\nEinreichung neuer Dokumente\n\nNordrheinische Erdgastransportleitungs-Verwaltungs-GmbH\nGesellschaft mit beschränkter Haftung\nDortmund\n\nDem Registergericht ist eine neue Liste der Mitglieder des Aufsichtsrates eingereicht worden."
    },
    {
      "date": "2025-02-04",
      "id": "100433",
      "original_text": "Sonstige Registerbekanntmachung\nNordrhein-Westfalen Amtsgericht Köln HRB 94400\nPortfolio Heidenheim I GmbH – Köln",
      "type": "Sonstige Registerbekanntmachung",
      "state": "Nordrhein-Westfalen",
      "amtsgericht": "Amtsgericht Köln",
      "registernummer": "HRB 94400",
      "registerart": "HRB",
      "company_name": "Portfolio Heidenheim I GmbH",
      "company_seat": "Köln",
      "details": "04.02.2025 (Bekanntmachungsdatum)\n\nNordrhein-Westfalen Amtsgericht Köln HRB 94400\nSonstige Registerbekanntmachung 04.02.2025 (Eintragungsdatum)\n\nPortfolio Heidenheim I GmbH\nGesellschaft mit beschränkter Haftung\nKöln\n\nAls nicht eingetragen wird veröffentlicht: Den Gläubigern der Gesellschaft, deren Forderungen begründet worden sind bevor die Eintragung der Beendigung des Gewinnabführungsvertrages  in das Handelsregister nach § 10 des Handelsgesetzbuches als bekanntgemacht gilt, hat der andere Vertragsteil Sicherheit zu leisten, wenn sie sich binnen sechs Monaten nach der Bekanntmachung der Eintragung zu diesem Zweck bei ihm melden."
    },
    {
      "date": "2025-02-04",
      "id": "100434",
      "original_text": "Löschungsankündigung\nNordrhein-Westfalen Amtsgericht Bochum HRB 20371\nA-S-K-Bau UG (haftungsbeschränkt) – Bochum",
      "type": "Löschungsankündigung",
      "state": "Nordrhein-Westfalen",
      "amtsgericht": "Amtsgericht Bochum",
      "registernummer": "HRB 20371",
      "registerart": "HRB",
      "company_name": "A-S-K-Bau UG (haftungsbeschränkt)",
      "company_seat": "Bochum",
      "details": "04.02.2025 (Bekanntmachungsdatum)\n\nNordrhein-Westfalen Amtsgericht Bochum HRB 20371\nLöschungsankündigung\n\nA-S-K-Bau UG (haftungsbeschränkt)\nGesellschaft mit beschränkter Haftung\nBochum\n\nDas Registergericht beabsichtigt die Gesellschaft von Amts wegen nach § 394 FamFG zu löschen. Die Frist zur Erhebung eines Widerspruchs ist auf drei Monate festgesetzt."
    },
    {
      "date": "2025-02-04",
      "id": "100435",
      "original_text": "Löschungsankündigung\nNordrhein-Westfalen Amtsgericht Gelsenkirchen HRA 2916\nDuophon Günther Kaminski – Haltern",
      "type": "Löschungsankündigung",
      "state": "Nordrhein-Westfalen",
      "amtsgericht": "Amtsgericht Gelsenkirchen",
      "registernummer": "HRA 2916",
      "registerart": "HRA",
      "company_name": "Duophon Günther Kaminski",
      "company_seat": "Haltern",
      "details": "04.02.2025 (Bekanntmachungsdatum)\n\nNordrhein-Westfalen Amtsgericht Gelsenkirchen HRA 2916\nLöschungsankündigung\n\nDuophon Günther Kaminski\nEinzelkaufmann / Einzelkauffrau\nHaltern\n\nDas Registergericht beabsichtigt die Firma von Amts wegen nach § 31 Abs. 2 HGB, § 393 FamFG zu löschen. Die Frist zur Erhebung eines Widerspruchs ist auf einen Monat festgesetzt.\n\nRechtsbehelfsbelehrung:\n\nGegen diese Verfügung können Sie Widerspruch einlegen.\n\nDer Widerspruch ist bei dem Amtsgericht Gelsenkirchen, Bochumer Straße 79, 45886 Gelsenkirchen schriftlich in deutscher Sprache oder zur Niederschrift der Geschäftsstelle einzulegen. Der Widerspruch kann auch zur Niederschrift der Geschäftsstelle eines jeden Amtsgerichtes abgegeben werden.\n\nDer Widerspruch muss spätestens innerhalb der gesetzten Frist bei dem Amtsgericht Gelsenkirchen eingegangen sein. Dies gilt auch dann, wenn der Widerspruch zur Niederschrift der Geschäftsstelle eines anderen Amtsgerichtes abgegeben wurde. Die Frist beginnt mit der Veröffentlichung. Fällt das Ende der Frist auf einen Sonntag, einen allgemeinen Feiertag oder Sonnabend, so endet die Frist mit Ablauf des nächsten Werktages.\n\nDer Widerspruch muss die Bezeichnung der angefochtenen Verfügung sowie die Erklärung enthalten, dass Widerspruch gegen diese Verfügung eingelegt wird. Er ist zu unterzeichnen und soll begründet werden.\n\nHinweis zum elektronischen Rechtsverkehr:\nDie Einlegung ist auch durch Übertragung eines elektronischen Dokuments an die elektronische Poststelle des Gerichts möglich. Das elektronische Dokument muss für die Bearbeitung durch das Gericht geeignet und mit einer qualifizierten elektronischen Signatur der verantwortenden Person versehen sein oder von der verantwortenden Person signiert und auf einem sicheren Übermittlungsweg gemäß § 130a ZPO nach näherer Maßgabe der Verordnung über die technischen Rahmenbedingungen des elektronischen Rechtsverkehrs und über das besondere elektronische Behördenpostfach (BGBl. 2017 I, S. 3803) eingereicht werden. Auf die Pflicht zur elektronischen Einreichung durch professionelle Einreicher/innen ab dem 01.01.2022 durch das Gesetz zum Ausbau des elektronischen Rechtsverkehrs mit den Gerichten vom 10. Oktober 2013, das Gesetz zur Einführung der elektronischen Akte in der Justiz und zur weiteren Förderung des elektronischen Rechtsverkehrs vom 5. Juli 2017 und das Gesetz zum Ausbau des elektronischen Rechtsverkehrs mit den Gerichten und zur Änderung weiterer Vorschriften vom 05.10.2021 wird hingewiesen.\nWeitere Informationen erhalten Sie auf der Internetseite www.justiz.de."
    },
    {
      "date": "2025-02-04",
      "id": "100436",
      "original_text": "Löschungsankündigung\nNordrhein-Westfalen Amtsgericht Mönchengladbach HRB 19427\nRicardo GmbH – Grevenbroich",
      "type": "Löschungsankündigung",
      "state": "Nordrhein-Westfalen",
      "amtsgericht": "Amtsgericht Mönchengladbach",
      "registernummer": "HRB 19427",
      "registerart": "HRB",
      "company_name": "Ricardo GmbH",
      "company_seat": "Grevenbroich",
      "details": "04.02.2025 (Bekanntmachungsdatum)\n\nNordrhein-Westfalen Amtsgericht Mönchengladbach HRB 19427\nLöschungsankündigung\n\nRicardo GmbH\nGesellschaft mit beschränkter Haftung\nGrevenbroich\n\nDas Registergericht beabsichtigt die Gesellschaft von Amts wegen nach § 394 FamFG zu löschen. Die Frist zur Erhebung eines Widerspruchs ist auf drei Monate festgesetzt."
    },
    {
      "date": "2025-02-04",
      "id": "100437",
      "original_text": "Löschungsankündigung\nNordrhein-Westfalen Amtsgericht Krefeld HRB 18713\nJN Objektsanierung GmbH – Krefeld",
      "type": "Löschungsankündigung",
      "state": "Nordrhein-Westfalen",
      "amtsgericht": "Amtsgericht Krefeld",
      "registernummer": "HRB 18713",
      "registerart": "HRB",
      "company_name": "JN Objektsanierung GmbH",
      "company_seat": "Krefeld",
      "details": "04.02.2025 (Bekanntmachungsdatum)\n\nNordrhein-Westfalen Amtsgericht Krefeld HRB 18713\nLöschungsankündigung\n\nJN Objektsanierung GmbH\nGesellschaft mit beschränkter Haftung\nKrefeld\n\nDas Registergericht beabsichtigt die Gesellschaft von Amts wegen nach § 394 FamFG zu löschen. Die Frist zur Erhebung eines Widerspruchs ist auf einen Monat festgesetzt."
    },
    {
      "date": "2025-02-04",
      "id": "100438",
      "original_text": "Registerbekanntmachung nach dem Umwandlungsgesetz\nNordrhein-Westfalen Amtsgericht Köln HRB 62502\nITV Studios Germany GmbH – Köln",
      "type": "Registerbekanntmachung nach dem Umwandlungsgesetz",
      "state": "Nordrhein-Westfalen",
      "amtsgericht": "Amtsgericht Köln",
      "registernummer": "HRB 62502",
      "registerart": "HRB",
      "company_name": "ITV Studios Germany GmbH",
      "company_seat": "Köln",
      "details": "04.02.2025 (Bekanntmachungsdatum)\n\nNordrhein-Westfalen Amtsgericht Köln HRB 62502\nRegisterbekanntmachung nach dem Umwandlungsgesetz 04.02.2025 (Eintragungsdatum)\n\nITV Studios Germany GmbH\nGesellschaft mit beschränkter Haftung\nKöln\n\nDen Gläubigern der an der Verschmelzung beteiligten Rechtsträger ist, wenn sie binnen sechs Monaten nach dem Tag, an dem die Eintragung der Verschmelzung in das Register des Sitzes desjenigen Rechtsträgers, dessen Gläubiger sie sind, nach § 19 Absatz 3 UmwG als bekanntgemacht gilt, ihren Anspruch nach Grund und Höhe schriftlich anmelden, Sicherheit zu leisten, soweit sie nicht Befriedigung verlangen können. Dieses Recht steht den Gläubigern jedoch nur zu, wenn sie glaubhaft machen, dass durch die Verschmelzung die Erfüllung ihrer Forderung gefährdet wird."
    },
    {
      "date": "2025-02-04",
      "id": "100439",
      "original_text": "Einreichung neuer Dokumente\nNordrhein-Westfalen Amtsgericht Bad Oeynhausen HRB 1505\nGOLLWITZER-MEIER-KLINIK Gesellschaft mit beschränkter Haftung Bad Oeynhausen – Bad Oeynhausen",
      "type": "Einreichung neuer Dokumente",
      "state": "Nordrhein-Westfalen",
      "amtsgericht": "Amtsgericht Bad Oeynhausen",
      "registernummer": "HRB 1505",
      "registerart": "HRB",
      "company_name": "GOLLWITZER-MEIER-KLINIK Gesellschaft mit beschränkter Haftung Bad Oeynhausen",
      "company_seat": "Bad Oeynhausen",
      "details": "04.02.2025 (Bekanntmachungsdatum)\n\nNordrhein-Westfalen Amtsgericht Bad Oeynhausen HRB 1505\nEinreichung neuer Dokumente\n\nGOLLWITZER-MEIER-KLINIK Gesellschaft mit beschränkter Haftung Bad Oeynhausen\nGesellschaft mit beschränkter Haftung\nBad Oeynhausen\n\nDem Registergericht ist eine neue Liste der Mitglieder des Aufsichtsrates eingereicht worden."
    },
    {
      "date": "2025-02-04",
      "id": "100440",
      "original_text": "Registerbekanntmachung nach dem Umwandlungsgesetz\nNordrhein-Westfalen Amtsgericht Düsseldorf HRB 102591\nGottfried Schultz Beteiligung GmbH – Düsseldorf",
      "type": "Registerbekanntmachung nach dem Umwandlungsgesetz",
      "state": "Nordrhein-Westfalen",
      "amtsgericht": "Amtsgericht Düsseldorf",
      "registernummer": "HRB 102591",
      "registerart": "HRB",
      "company_name": "Gottfried Schultz Beteiligung GmbH",
      "company_seat": "Düsseldorf",
      "details": "04.02.2025 (Bekanntmachungsdatum)\n\nNordrhein-Westfalen Amtsgericht Düsseldorf HRB 102591\nRegisterbekanntmachung nach dem Umwandlungsgesetz 04.02.2025 (Eintragungsdatum)\n\nGottfried Schultz Beteiligung GmbH\nGesellschaft mit beschränkter Haftung\nDüsseldorf\n\nDen Gläubigern der an der Verschmelzung beteiligten Rechtsträger ist, wenn sie binnen sechs Monaten nach dem Tag, an dem die Eintragung der Verschmelzung in das Register des Sitzes desjenigen Rechtsträgers, dessen Gläubiger sie sind, nach § 19 Absatz 3 UmwG als bekanntgemacht gilt, ihren Anspruch nach Grund und Höhe schriftlich anmelden, Sicherheit zu leisten, soweit sie nicht Befriedigung verlangen können. Dieses Recht steht den Gläubigern jedoch nur zu, wenn sie glaubhaft machen, dass durch die Verschmelzung die Erfüllung ihrer Forderung gefährdet wird."
    },
    {
      "date": "2025-02-04",
      "id": "100441",
      "original_text": "Löschungsankündigung\nNordrhein-Westfalen Amtsgericht Düren HRB 7212\nSec4you UG (haftungsbeschränkt) – Düren",
      "type": "Löschungsankündigung",
      "state": "Nordrhein-Westfalen",
      "amtsgericht": "Amtsgericht Düren",
      "registernummer": "HRB 7212",
      "registerart": "HRB",
      "company_name": "Sec4you UG (haftungsbeschränkt)",
      "company_seat": "Düren",
      "details": "04.02.2025 (Bekanntmachungsdatum)\n\nNordrhein-Westfalen Amtsgericht Düren HRB 7212\nLöschungsankündigung\n\nSec4you UG (haftungsbeschränkt)\nGesellschaft mit beschränkter Haftung\nDüren\n\nDas Registergericht beabsichtigt die Gesellschaft von Amts wegen nach § 394 FamFG zu löschen. Die Frist zur Erhebung eines Widerspruchs ist auf drei Monate festgesetzt."
    },
    {
      "date": "2025-02-04",
      "id": "100442",
      "original_text": "Einreichung neuer Dokumente\nNordrhein-Westfalen Amtsgericht Bad Oeynhausen HRB 1915\nKlinik am Rosengarten im Staatsbad Oeynhausen GmbH – Bad Oeynhausen",
      "type": "Einreichung neuer Dokumente",
      "state": "Nordrhein-Westfalen",
      "amtsgericht": "Amtsgericht Bad Oeynhausen",
      "registernummer": "HRB 1915",
      "registerart": "HRB",
      "company_name": "Klinik am Rosengarten im Staatsbad Oeynhausen GmbH",
      "company_seat": "Bad Oeynhausen",
      "details": "04.02.2025 (Bekanntmachungsdatum)\n\nNordrhein-Westfalen Amtsgericht Bad Oeynhausen HRB 1915\nEinreichung neuer Dokumente\n\nKlinik am Rosengarten im Staatsbad Oeynhausen GmbH\nGesellschaft mit beschränkter Haftung\nBad Oeynhausen\n\nDem Registergericht ist eine neue Liste der Mitglieder des Aufsichtsrates eingereicht worden."
    },
    {
      "date": "2025-02-04",
      "id": "100443",
      "original_text": "Einreichung neuer Dokumente\nNordrhein-Westfalen Amtsgericht Düsseldorf HRB 63385\nX-CELL AG – Düsseldorf",
      "type": "Einreichung neuer Dokumente",
      "state": "Nordrhein-Westfalen",
      "amtsgericht": "Amtsgericht Düsseldorf",
      "registernummer": "HRB 63385",
      "registerart": "HRB",
      "company_name": "X-CELL AG",
      "company_seat": "Düsseldorf",
      "details": "04.02.2025 (Bekanntmachungsdatum)\n\nNordrhein-Westfalen Amtsgericht Düsseldorf HRB 63385\nEinreichung neuer Dokumente\n\nX-CELL AG\nAktiengesellschaft\nDüsseldorf\n\nDem Registergericht ist eine Liste der Mitglieder des Aufsichtsrates eingereicht worden."
    },
    {
      "date": "2025-02-04",
      "id": "100444",
      "original_text": "Einreichung neuer Dokumente\nNordrhein-Westfalen Amtsgericht Bonn HRB 18384\nDeutsche Gesellschaft für Internationale Zusammenarbeit (GIZ) GmbH – Bonn und Eschborn",
      "type": "Einreichung neuer Dokumente",
      "state": "Nordrhein-Westfalen",
      "amtsgericht": "Amtsgericht Bonn",
      "registernummer": "HRB 18384",
      "registerart": "HRB",
      "company_name": "Deutsche Gesellschaft für Internationale Zusammenarbeit (GIZ) GmbH",
      "company_seat": "Bonn und Eschborn",
      "details": "04.02.2025 (Bekanntmachungsdatum)\n\nNordrhein-Westfalen Amtsgericht Bonn HRB 18384\nEinreichung neuer Dokumente\n\nDeutsche Gesellschaft für Internationale Zusammenarbeit (GIZ) GmbH\nGesellschaft mit beschränkter Haftung\nBonn und Eschborn\n\nDem Registergericht ist eine neue Liste der Mitglieder des Aufsichtsrates eingereicht worden."
    },
    {
      "date": "2025-02-04",
      "id": "100445",
      "original_text": "Einreichung neuer Dokumente\nNordrhein-Westfalen Amtsgericht Dortmund HRB 23042\nKHS GmbH – Dortmund",
      "type": "Einreichung neuer Dokumente",
      "state": "Nordrhein-Westfalen",
      "amtsgericht": "Amtsgericht Dortmund",
      "registernummer": "HRB 23042",
      "registerart": "HRB",
      "company_name": "KHS GmbH",
      "company_seat": "Dortmund",
      "details": "04.02.2025 (Bekanntmachungsdatum)\n\nNordrhein-Westfalen Amtsgericht Dortmund HRB 23042\nEinreichung neuer Dokumente\n\nKHS GmbH\nGesellschaft mit beschränkter Haftung\nDortmund\n\nDem Registergericht ist eine neue Liste der Mitglieder des Aufsichtsrates eingereicht worden."
    },
    {
      "date": "2025-02-04",
      "id": "100446",
      "original_text": "Löschungsankündigung\nNordrhein-Westfalen Amtsgericht Düsseldorf HRB 72675\nSL Services Germany GmbH – Ratingen",
      "type": "Löschungsankündigung",
      "state": "Nordrhein-Westfalen",
      "amtsgericht": "Amtsgericht Düsseldorf",
      "registernummer": "HRB 72675",
      "registerart": "HRB",
      "company_name": "SL Services Germany GmbH",
      "company_seat": "Ratingen",
      "details": "04.02.2025 (Bekanntmachungsdatum)\n\nNordrhein-Westfalen Amtsgericht Düsseldorf HRB 72675\nLöschungsankündigung\n\nSL Services Germany GmbH\nGesellschaft mit beschränkter Haftung\nRatingen\n\nDas Registergericht beabsichtigt die Gesellschaft von Amts wegen nach § 394 FamFG zu löschen. Die Frist zur Erhebung eines Widerspruchs ist auf 3 Wochen festgesetzt.\n\nRechtsbehelfsbelehrung:\nDas Widerspruchsrecht steht jedem zu, der an der Unterlassung der Löschung ein berechtigtes Interesse hat. Der Widerspruch ist bei dem Amtsgericht Düsseldorf -Registergericht-, Werdener Straße 1, 40227 Düsseldorf schriftlich in deutscher Sprache oder zur Niederschrift der Geschäftsstelle einzulegen. Der Widerspruch kann auch zur Niederschrift der Geschäftsstelle eines jeden Amtsgerichtes abgegeben werden. Die Einlegung ist auch durch Übertragung eines elektronischen Dokuments an die elektronische Poststelle des Gerichts möglich. Das elektronische Dokument muss für die Bearbeitung durch das Gericht geeignet und mit einer qualifizierten elektronischen Signatur der verantwortenden Person versehen sein oder von der verantwortenden Person signiert und auf einem sicheren Übermittlungsweg gemäß § 130a ZPO nach näherer Maßgabe der Verordnung über die technischen Rahmenbedingungen des elektronischen Rechtsverkehrs und über das besondere elektronische Behördenpostfach (BGBl. I, S.3803) eingereicht werden. Weitere Informationen erhalten Sie auf der Internetseite www.justiz.de.\nDer Widerspruch muss spätestens innerhalb der gesetzten Frist nach dem Datum der Bekanntmachung der Löschungsankündigung bei dem Amtsgericht - Registergericht - Düsseldorf eingegangen sein.  Dies gilt auch dann, wenn der Widerspruch zur Niederschrift der Geschäftsstelle eines anderen Amtsgerichtes abgegeben wurde. Die Frist beginnt mit dem Tage der Bekanntmachung der Löschungsankündigung in dem für die Bekanntmachung der Eintragungen in das Handelsregister bestimmten elektronischen Informations- und Kommunikationssystem nach § 10 des Handelsgesetzbuches. Fällt das Ende der Frist auf einen Sonntag, einen allgemeinen Feiertag oder Sonnabend, so endet die Frist mit Ablauf des nächsten Werktages.\nDer Widerspruch muss die Bezeichnung der angefochtenen Löschungsankündigung sowie die Erklärung enthalten, dass Widerspruch gegen diese Löschungsankündigung eingelegt wird. Er ist zu unterzeichnen und soll begründet werden."
    },
    {
      "date": "2025-02-04",
      "id": "100447",
      "original_text": "Registerbekanntmachung nach dem Umwandlungsgesetz\nNordrhein-Westfalen Amtsgericht Essen HRB 36495\nKrayer Therapiezentrum GmbH – Essen",
      "type": "Registerbekanntmachung nach dem Umwandlungsgesetz",
      "state": "Nordrhein-Westfalen",
      "amtsgericht": "Amtsgericht Essen",
      "registernummer": "HRB 36495",
      "registerart": "HRB",
      "company_name": "Krayer Therapiezentrum GmbH",
      "company_seat": "Essen",
      "details": "04.02.2025 (Bekanntmachungsdatum)\n\nNordrhein-Westfalen Amtsgericht Essen HRB 36495\nRegisterbekanntmachung nach dem Umwandlungsgesetz 04.02.2025 (Eintragungsdatum)\n\nKrayer Therapiezentrum GmbH\nGesellschaft mit beschränkter Haftung\nEssen\n\nDen Gläubigern der an der formwechselnden Umwandlung beteiligten Rechtsträger ist, wenn sie binnen sechs Monaten nach dem Tag, an dem die Eintragung der formwechselnden Umwandlung in das Register des Sitzes derjenigen Rechtsträger deren Gläubiger sie sind, nach § 19 Absatz 3 UmwG als bekanntgemacht gilt, ihren Anspruch nach Grund und Höhe schriftlich anmelden, Sicherheit zu leisten, soweit sie nicht Befriedigung verlangen können. Dieses Recht steht den Gläubigern jedoch nur zu, wenn sie glaubhaft machen, dass durch die formwechselnden Umwandlung die Erfüllung ihrer Forderung gefährdet wird."
    },
    {
      "date": "2025-02-04",
      "id": "100448",
      "original_text": "Löschungsankündigung\nNordrhein-Westfalen Amtsgericht Gütersloh HRB 9359\nETL Miller, Spilker & Kollegen GmbH Steuerberatungsgesellschaft – Werther",
      "type": "Löschungsankündigung",
      "state": "Nordrhein-Westfalen",
      "amtsgericht": "Amtsgericht Gütersloh",
      "registernummer": "HRB 9359",
      "registerart": "HRB",
      "company_name": "ETL Miller, Spilker & Kollegen GmbH Steuerberatungsgesellschaft",
      "company_seat": "Werther",
      "details": "04.02.2025 (Bekanntmachungsdatum)\n\nNordrhein-Westfalen Amtsgericht Gütersloh HRB 9359\nLöschungsankündigung\n\nETL Miller, Spilker & Kollegen GmbH Steuerberatungsgesellschaft\nGesellschaft mit beschränkter Haftung\nWerther\n\nDas Registergericht beabsichtigt die Gesellschaft von Amts wegen nach § 394 FamFG zu löschen. Die Frist zur Erhebung eines Widerspruchs ist auf einen Monat festgesetzt."
    },
    {
      "date": "2025-02-04",
      "id": "100449",
      "original_text": "Sonstige Registerbekanntmachung\nNordrhein-Westfalen Amtsgericht Gütersloh GnR 144\nMaschinengenossenschaft Loxten eG – Versmold",
      "type": "Sonstige Registerbekanntmachung",
      "state": "Nordrhein-Westfalen",
      "amtsgericht": "Amtsgericht Gütersloh",
      "registernummer": "GnR 144",
      "registerart": "GnR",
      "company_name": "Maschinengenossenschaft Loxten eG",
      "company_seat": "Versmold",
      "details": "04.02.2025 (Bekanntmachungsdatum)\n\nNordrhein-Westfalen Amtsgericht Gütersloh GnR 144\nSonstige Registerbekanntmachung 04.02.2025 (Eintragungsdatum)\n\nMaschinengenossenschaft Loxten eG\neingetragene Genossenschaft\nVersmold\n\nAls nicht eingetragen wird veröffentlicht: Den Gläubigern der Genossenschaft ist gemäß § 22 GenG, wenn sie sich binnen sechs Monaten nach der Bekanntmachung bei der Genossenschaft  zu diesem Zweck  melden, Sicherheit zu leisten, soweit sie nicht Befriedigung verlangen können."
    },
    {
      "date": "2025-02-04",
      "id": "100450",
      "original_text": "Löschungsankündigung\nNordrhein-Westfalen Amtsgericht Dortmund HRB 31861\nEuroservice GmbH – Dortmund",
      "type": "Löschungsankündigung",
      "state": "Nordrhein-Westfalen",
      "amtsgericht": "Amtsgericht Dortmund",
      "registernummer": "HRB 31861",
      "registerart": "HRB",
      "company_name": "Euroservice GmbH",
      "company_seat": "Dortmund",
      "details": "04.02.2025 (Bekanntmachungsdatum)\n\nNordrhein-Westfalen Amtsgericht Dortmund HRB 31861\nLöschungsankündigung\n\nEuroservice GmbH\nGesellschaft mit beschränkter Haftung\nDortmund\n\nDas Registergericht beabsichtigt die Gesellschaft von Amts wegen nach § 394 FamFG zu löschen. Die Frist zur Erhebung eines Widerspruchs ist auf zwei Monate festgesetzt."
    },
    {
      "date": "2025-02-04",
      "id": "100451",
      "original_text": "Einreichung neuer Dokumente\nNordrhein-Westfalen Amtsgericht Köln HRB 73574\nArt-Invest Real Estate Funds GmbH – Köln",
      "type": "Einreichung neuer Dokumente",
      "state": "Nordrhein-Westfalen",
      "amtsgericht": "Amtsgericht Köln",
      "registernummer": "HRB 73574",
      "registerart": "HRB",
      "company_name": "Art-Invest Real Estate Funds GmbH",
      "company_seat": "Köln",
      "details": "04.02.2025 (Bekanntmachungsdatum)\n\nNordrhein-Westfalen Amtsgericht Köln HRB 73574\nEinreichung neuer Dokumente\n\nArt-Invest Real Estate Funds GmbH\nGesellschaft mit beschränkter Haftung\nKöln\n\nDem Registergericht ist eine neue Liste der Mitglieder des Aufsichtsrates eingereicht worden."
    },
    {
      "date": "2025-02-04",
      "id": "100452",
      "original_text": "Löschungsankündigung\nNordrhein-Westfalen Amtsgericht Kleve HRB 15017\nZE GmbH – Emmerich",
      "type": "Löschungsankündigung",
      "state": "Nordrhein-Westfalen",
      "amtsgericht": "Amtsgericht Kleve",
      "registernummer": "HRB 15017",
      "registerart": "HRB",
      "company_name": "ZE GmbH",
      "company_seat": "Emmerich",
      "details": "04.02.2025 (Bekanntmachungsdatum)\n\nNordrhein-Westfalen Amtsgericht Kleve HRB 15017\nLöschungsankündigung\n\nZE GmbH\nGesellschaft mit beschränkter Haftung\nEmmerich\n\nDas Registergericht beabsichtigt die Gesellschaft von Amts wegen nach § 394 FamFG zu löschen. Die Frist zur Erhebung eines Widerspruchs ist auf einen Monat festgesetzt."
    },
    {
      "date": "2025-02-04",
      "id": "100453",
      "original_text": "Einreichung neuer Dokumente\nNordrhein-Westfalen Amtsgericht Bonn HRB 12577\nKJF - Gemeinnützige Evangelische Gesellschaft für Kind, Jugend und Familie mbH – Bonn",
      "type": "Einreichung neuer Dokumente",
      "state": "Nordrhein-Westfalen",
      "amtsgericht": "Amtsgericht Bonn",
      "registernummer": "HRB 12577",
      "registerart": "HRB",
      "company_name": "KJF - Gemeinnützige Evangelische Gesellschaft für Kind, Jugend und Familie mbH",
      "company_seat": "Bonn",
      "details": "04.02.2025 (Bekanntmachungsdatum)\n\nNordrhein-Westfalen Amtsgericht Bonn HRB 12577\nEinreichung neuer Dokumente\n\nKJF - Gemeinnützige Evangelische Gesellschaft für Kind, Jugend und Familie mbH\nGesellschaft mit beschränkter Haftung\nBonn\n\nDem Registergericht ist eine neue Liste der Mitglieder des Aufsichtsrates eingereicht worden."
    },
    {
      "date": "2025-02-04",
      "id": "100454",
      "original_text": "Löschungsankündigung\nHessen Amtsgericht Wiesbaden HRB 10611\nBillo PR GmbH – Wiesbaden",
      "type": "Löschungsankündigung",
      "state": "Hessen",
      "amtsgericht": "Amtsgericht Wiesbaden",
      "registernummer": "HRB 10611",
      "registerart": "HRB",
      "company_name": "Billo PR GmbH",
      "company_seat": "Wiesbaden",
      "details": "04.02.2025 (Bekanntmachungsdatum)\n\nHessen Amtsgericht Wiesbaden HRB 10611\nLöschungsankündigung\n\nBillo PR GmbH\nGesellschaft mit beschränkter Haftung\nWiesbaden\n\nDas Registergericht beabsichtigt die im Handelsregister eingetragene Gesellschaft von Amts wegen nach § 394 FamFG zu löschen. Die Frist zur Erhebung eines Widerspruchs gegen die beabsichtigte Löschung wird auf 3 Monate festgesetzt."
    },
    {
      "date": "2025-02-04",
      "id": "100455",
      "original_text": "Löschungsankündigung\nHessen Amtsgericht Frankfurt am Main HRB 112999\nBayar GmbH – Frankfurt am Main",
      "type": "Löschungsankündigung",
      "state": "Hessen",
      "amtsgericht": "Amtsgericht Frankfurt am Main",
      "registernummer": "HRB 112999",
      "registerart": "HRB",
      "company_name": "Bayar GmbH",
      "company_seat": "Frankfurt am Main",
      "details": "04.02.2025 (Bekanntmachungsdatum)\n\nHessen Amtsgericht Frankfurt am Main HRB 112999\nLöschungsankündigung\n\nBayar GmbH\nGesellschaft mit beschränkter Haftung\nFrankfurt am Main\n\nDas Registergericht beabsichtigt die im Handelsregister eingetragene Gesellschaft von Amts wegen nach § 394 FamFG zu löschen. Die Frist zur Erhebung eines Widerspruchs gegen die beabsichtigte Löschung wird auf 3 Monate festgesetzt."
    },
    {
      "date": "2025-02-04",
      "id": "100456",
      "original_text": "Löschungsankündigung\nHessen Amtsgericht Darmstadt VR 30917\nVerein für Deutsche Schäferhunde (SV) e.V. Ortsgruppe Babenhausen/Hessen e.V. – Babenhausen",
      "type": "Löschungsankündigung",
      "state": "Hessen",
      "amtsgericht": "Amtsgericht Darmstadt",
      "registernummer": "VR 30917",
      "registerart": "VR",
      "company_name": "Verein für Deutsche Schäferhunde (SV) e.V. Ortsgruppe Babenhausen/Hessen e.V.",
      "company_seat": "Babenhausen",
      "details": "04.02.2025 (Bekanntmachungsdatum)\n\nHessen Amtsgericht Darmstadt VR 30917\nLöschungsankündigung 04.02.2025 (Eintragungsdatum)\n\nVerein für Deutsche Schäferhunde (SV) e.V. Ortsgruppe Babenhausen/Hessen e.V.\neingetragener Verein\nBabenhausen\n\nDer Verein ist aufgelöst."
    },
    {
      "date": "2025-02-04",
      "id": "100457",
      "original_text": "Löschungsankündigung\nHessen Amtsgericht Offenbach am Main HRB 50186\nHatas GmbH – Neu-Isenburg",
      "type": "Löschungsankündigung",
      "state": "Hessen",
      "amtsgericht": "Amtsgericht Offenbach am Main",
      "registernummer": "HRB 50186",
      "registerart": "HRB",
      "company_name": "Hatas GmbH",
      "company_seat": "Neu-Isenburg",
      "details": "04.02.2025 (Bekanntmachungsdatum)\n\nHessen Amtsgericht Offenbach am Main HRB 50186\nLöschungsankündigung\n\nHatas GmbH\nGesellschaft mit beschränkter Haftung\nNeu-Isenburg\n\nDas Registergericht beabsichtigt die im Handelsregister eingetragene Gesellschaft von Amts wegen nach § 394 FamFG zu löschen. Die Frist zur Erhebung eines Widerspruchs gegen die beabsichtigte Löschung wird auf 3 Monate festgesetzt."
    },
    {
      "date": "2025-02-04",
      "id": "100458",
      "original_text": "Löschungsankündigung\nHessen Amtsgericht Frankfurt am Main HRB 105041\nCommodore Büromaschinen UG (haftungsbeschränkt) – Bad Vilbel",
      "type": "Löschungsankündigung",
      "state": "Hessen",
      "amtsgericht": "Amtsgericht Frankfurt am Main",
      "registernummer": "HRB 105041",
      "registerart": "HRB",
      "company_name": "Commodore Büromaschinen UG (haftungsbeschränkt)",
      "company_seat": "Bad Vilbel",
      "details": "04.02.2025 (Bekanntmachungsdatum)\n\nHessen Amtsgericht Frankfurt am Main HRB 105041\nLöschungsankündigung\n\nCommodore Büromaschinen UG (haftungsbeschränkt)\nGesellschaft mit beschränkter Haftung\nBad Vilbel\n\nDas Registergericht beabsichtigt die im Handelsregister eingetragene Gesellschaft von Amts wegen nach § 394 FamFG zu löschen. Die Frist zur Erhebung eines Widerspruchs gegen die beabsichtigte Löschung wird auf 1 Monate festgesetzt."
    },
    {
      "date": "2025-02-04",
      "id": "100459",
      "original_text": "Einreichung neuer Dokumente\nHessen Amtsgericht Darmstadt HRB 53664\nLear Corporation Beteiligungs GmbH – Ginsheim-Gustavsburg",
      "type": "Einreichung neuer Dokumente",
      "state": "Hessen",
      "amtsgericht": "Amtsgericht Darmstadt",
      "registernummer": "HRB 53664",
      "registerart": "HRB",
      "company_name": "Lear Corporation Beteiligungs GmbH",
      "company_seat": "Ginsheim-Gustavsburg",
      "details": "04.02.2025 (Bekanntmachungsdatum)\n\nHessen Amtsgericht Darmstadt HRB 53664\nEinreichung neuer Dokumente\n\nLear Corporation Beteiligungs GmbH\nGesellschaft mit beschränkter Haftung\nGinsheim-Gustavsburg\n\nDurch eine Änderung in den Personen der Aufsichtsratsmitglieder ist eine Liste der Mitglieder des Aufsichtsrates zum Handelsregister eingereicht worden."
    }
  ]
}