{
  "date": "2025-02-25",
  "date_of_scrape": "2025-02-26T04:08:30.421Z",
  "tool_version": "0.2.0",
  "number_of_announcements": 130,
  "announcements": [
    {
      "date": "2025-02-25",
      "id": "102118",
      "original_text": "Registerbekanntmachung nach dem Umwandlungsgesetz\nBayern Amtsgericht München HRB 203587\nLIVIA Industrial Strategies GmbH – München",
      "type": "Registerbekanntmachung nach dem Umwandlungsgesetz",
      "state": "Bayern",
      "amtsgericht": "Amtsgericht München",
      "registernummer": "HRB 203587",
      "registerart": "HRB",
      "company_name": "LIVIA Industrial Strategies GmbH",
      "company_seat": "München",
      "details": "25.02.2025 (Bekanntmachungsdatum)\n\nBayern Amtsgericht München HRB 203587\nRegisterbekanntmachung nach dem Umwandlungsgesetz 24.02.2025 (Eintragungsdatum)\n\nLIVIA Industrial Strategies GmbH\nGesellschaft mit beschränkter Haftung\nMünchen\n\nDen Gläubigern des formwechselnden Rechtsträgers ist, wenn sie binnen sechs Monaten nach dem Tag, an dem die Eintragung des Formwechsels nach § 201 UmwG als bekannt gemacht gilt, ihren Anspruch nach Grund und Höhe in Textform anmelden, Sicherheit zu leisten, soweit sie nicht Befriedigung verlangen können. Dieses Recht steht den Gläubigern jedoch nur zu, wenn sie glaubhaft machen, dass durch den Formwechsel die Erfüllung ihrer Forderung gefährdet wird."
    },
    {
      "date": "2025-02-25",
      "id": "102119",
      "original_text": "Registerbekanntmachung nach dem Umwandlungsgesetz\nBayern Amtsgericht München HRB 253780\nCatalonia BidCo GmbH – München",
      "type": "Registerbekanntmachung nach dem Umwandlungsgesetz",
      "state": "Bayern",
      "amtsgericht": "Amtsgericht München",
      "registernummer": "HRB 253780",
      "registerart": "HRB",
      "company_name": "Catalonia BidCo GmbH",
      "company_seat": "München",
      "details": "25.02.2025 (Bekanntmachungsdatum)\n\nBayern Amtsgericht München HRB 253780\nRegisterbekanntmachung nach dem Umwandlungsgesetz 24.02.2025 (Eintragungsdatum)\n\nCatalonia BidCo GmbH\nGesellschaft mit beschränkter Haftung\nMünchen\n\nDen Gläubigern der an der Verschmelzung beteiligten Rechtsträger ist, wenn sie binnen sechs Monaten nach dem Tag, an dem die Eintragung der Verschmelzung in das Register des Sitzes desjenigen Rechtsträgers, dessen Gläubiger sie sind, nach § 19 Abs. 3 UmwG als bekannt gemacht gilt, ihren Anspruch nach Grund und Höhe in Textform anmelden, Sicherheit zu leisten, soweit sie nicht Befriedigung verlangen können. Dieses Recht steht den Gläubigern jedoch nur zu, wenn sie glaubhaft machen, dass durch die Verschmelzung die Erfüllung ihrer Forderung gefährdet wird."
    },
    {
      "date": "2025-02-25",
      "id": "102120",
      "original_text": "Einreichung neuer Dokumente\nBayern Amtsgericht München HRB 298093\nTradevest Markets AG – München",
      "type": "Einreichung neuer Dokumente",
      "state": "Bayern",
      "amtsgericht": "Amtsgericht München",
      "registernummer": "HRB 298093",
      "registerart": "HRB",
      "company_name": "Tradevest Markets AG",
      "company_seat": "München",
      "details": "25.02.2025 (Bekanntmachungsdatum)\n\nBayern Amtsgericht München HRB 298093\nEinreichung neuer Dokumente 24.02.2025 (Eintragungsdatum)\n\nTradevest Markets AG\nAktiengesellschaft\nMünchen\n\nDem #Re.Name ist eine Liste der Mitglieder des Aufsichtsrats eingereicht worden, § 106 AktG."
    },
    {
      "date": "2025-02-25",
      "id": "102121",
      "original_text": "Registerbekanntmachung nach dem Umwandlungsgesetz\nBayern Amtsgericht München HRB 282835\nSchäfer Investments GmbH – Puchheim",
      "type": "Registerbekanntmachung nach dem Umwandlungsgesetz",
      "state": "Bayern",
      "amtsgericht": "Amtsgericht München",
      "registernummer": "HRB 282835",
      "registerart": "HRB",
      "company_name": "Schäfer Investments GmbH",
      "company_seat": "Puchheim",
      "details": "25.02.2025 (Bekanntmachungsdatum)\n\nBayern Amtsgericht München HRB 282835\nRegisterbekanntmachung nach dem Umwandlungsgesetz 24.02.2025 (Eintragungsdatum)\n\nSchäfer Investments GmbH\nGesellschaft mit beschränkter Haftung\nPuchheim\n\nDen Gläubigern der an der Verschmelzung beteiligten Rechtsträger ist, wenn sie binnen sechs Monaten nach dem Tag, an dem die Eintragung der Verschmelzung in das Register des Sitzes desjenigen Rechtsträgers, dessen Gläubiger sie sind, nach § 19 Abs. 3 UmwG als bekannt gemacht gilt, ihren Anspruch nach Grund und Höhe in Textform anmelden, Sicherheit zu leisten, soweit sie nicht Befriedigung verlangen können. Dieses Recht steht den Gläubigern jedoch nur zu, wenn sie glaubhaft machen, dass durch die Verschmelzung die Erfüllung ihrer Forderung gefährdet wird."
    },
    {
      "date": "2025-02-25",
      "id": "102122",
      "original_text": "Registerbekanntmachung nach dem Umwandlungsgesetz\nBayern Amtsgericht München HRB 195907\nZEDORA 108 Verwaltung GmbH – München",
      "type": "Registerbekanntmachung nach dem Umwandlungsgesetz",
      "state": "Bayern",
      "amtsgericht": "Amtsgericht München",
      "registernummer": "HRB 195907",
      "registerart": "HRB",
      "company_name": "ZEDORA 108 Verwaltung GmbH",
      "company_seat": "München",
      "details": "25.02.2025 (Bekanntmachungsdatum)\n\nBayern Amtsgericht München HRB 195907\nRegisterbekanntmachung nach dem Umwandlungsgesetz 24.02.2025 (Eintragungsdatum)\n\nZEDORA 108 Verwaltung GmbH\nGesellschaft mit beschränkter Haftung\nMünchen\n\nDen Gläubigern der an der Verschmelzung beteiligten Rechtsträger ist, wenn sie binnen sechs Monaten nach dem Tag, an dem die Eintragung der Verschmelzung in das Register des Sitzes desjenigen Rechtsträgers, dessen Gläubiger sie sind, nach § 19 Abs. 3 UmwG als bekannt gemacht gilt, ihren Anspruch nach Grund und Höhe in Textform anmelden, Sicherheit zu leisten, soweit sie nicht Befriedigung verlangen können. Dieses Recht steht den Gläubigern jedoch nur zu, wenn sie glaubhaft machen, dass durch die Verschmelzung die Erfüllung ihrer Forderung gefährdet wird."
    },
    {
      "date": "2025-02-25",
      "id": "102123",
      "original_text": "Registerbekanntmachung nach dem Umwandlungsgesetz\nBayern Amtsgericht München HRB 272352\nJumedi GmbH – München",
      "type": "Registerbekanntmachung nach dem Umwandlungsgesetz",
      "state": "Bayern",
      "amtsgericht": "Amtsgericht München",
      "registernummer": "HRB 272352",
      "registerart": "HRB",
      "company_name": "Jumedi GmbH",
      "company_seat": "München",
      "details": "25.02.2025 (Bekanntmachungsdatum)\n\nBayern Amtsgericht München HRB 272352\nRegisterbekanntmachung nach dem Umwandlungsgesetz 24.02.2025 (Eintragungsdatum)\n\nJumedi GmbH\nGesellschaft mit beschränkter Haftung\nMünchen\n\nDen Gläubigern der an der Verschmelzung beteiligten Rechtsträger ist, wenn sie binnen sechs Monaten nach dem Tag, an dem die Eintragung der Verschmelzung in das Register des Sitzes desjenigen Rechtsträgers, dessen Gläubiger sie sind, nach § 19 Abs. 3 UmwG als bekannt gemacht gilt, ihren Anspruch nach Grund und Höhe in Textform anmelden, Sicherheit zu leisten, soweit sie nicht Befriedigung verlangen können. Dieses Recht steht den Gläubigern jedoch nur zu, wenn sie glaubhaft machen, dass durch die Verschmelzung die Erfüllung ihrer Forderung gefährdet wird."
    },
    {
      "date": "2025-02-25",
      "id": "102124",
      "original_text": "Löschungsankündigung\nBayern Amtsgericht Landshut HRB 1437\nPöllmann GmbH – Adlkofen",
      "type": "Löschungsankündigung",
      "state": "Bayern",
      "amtsgericht": "Amtsgericht Landshut",
      "registernummer": "HRB 1437",
      "registerart": "HRB",
      "company_name": "Pöllmann GmbH",
      "company_seat": "Adlkofen",
      "details": "25.02.2025 (Bekanntmachungsdatum)\n\nBayern Amtsgericht Landshut HRB 1437\nLöschungsankündigung\n\nPöllmann GmbH\nGesellschaft mit beschränkter Haftung\nAdlkofen\n\nDas Registergericht beabsichtigt, die im Handelsregister eingetragene Gesellschaft wegen Vermögenslosigkeit von Amts wegen nach § 394 FamFG zu löschen. Die Frist zur Erhebung eines Widerspruchs ist auf einen Monat festgesetzt."
    },
    {
      "date": "2025-02-25",
      "id": "102125",
      "original_text": "Registerbekanntmachung nach dem Umwandlungsgesetz\nBayern Amtsgericht München HRB 178151\nZEDORA 42 Verwaltung GmbH – München",
      "type": "Registerbekanntmachung nach dem Umwandlungsgesetz",
      "state": "Bayern",
      "amtsgericht": "Amtsgericht München",
      "registernummer": "HRB 178151",
      "registerart": "HRB",
      "company_name": "ZEDORA 42 Verwaltung GmbH",
      "company_seat": "München",
      "details": "25.02.2025 (Bekanntmachungsdatum)\n\nBayern Amtsgericht München HRB 178151\nRegisterbekanntmachung nach dem Umwandlungsgesetz 24.02.2025 (Eintragungsdatum)\n\nZEDORA 42 Verwaltung GmbH\nGesellschaft mit beschränkter Haftung\nMünchen\n\nDen Gläubigern der an der Verschmelzung beteiligten Rechtsträger ist, wenn sie binnen sechs Monaten nach dem Tag, an dem die Eintragung der Verschmelzung in das Register des Sitzes desjenigen Rechtsträgers, dessen Gläubiger sie sind, nach § 19 Abs. 3 UmwG als bekannt gemacht gilt, ihren Anspruch nach Grund und Höhe in Textform anmelden, Sicherheit zu leisten, soweit sie nicht Befriedigung verlangen können. Dieses Recht steht den Gläubigern jedoch nur zu, wenn sie glaubhaft machen, dass durch die Verschmelzung die Erfüllung ihrer Forderung gefährdet wird."
    },
    {
      "date": "2025-02-25",
      "id": "102126",
      "original_text": "Registerbekanntmachung nach dem Umwandlungsgesetz\nBayern Amtsgericht München HRB 171307\npure11 GmbH – Grünwald",
      "type": "Registerbekanntmachung nach dem Umwandlungsgesetz",
      "state": "Bayern",
      "amtsgericht": "Amtsgericht München",
      "registernummer": "HRB 171307",
      "registerart": "HRB",
      "company_name": "pure11 GmbH",
      "company_seat": "Grünwald",
      "details": "25.02.2025 (Bekanntmachungsdatum)\n\nBayern Amtsgericht München HRB 171307\nRegisterbekanntmachung nach dem Umwandlungsgesetz 24.02.2025 (Eintragungsdatum)\n\npure11 GmbH\nGesellschaft mit beschränkter Haftung\nGrünwald\n\nDen Gläubigern der an der Verschmelzung beteiligten Rechtsträger ist, wenn sie binnen sechs Monaten nach dem Tag, an dem die Eintragung der Verschmelzung in das Register des Sitzes desjenigen Rechtsträgers, dessen Gläubiger sie sind, nach § 19 Abs. 3 UmwG als bekannt gemacht gilt, ihren Anspruch nach Grund und Höhe in Textform anmelden, Sicherheit zu leisten, soweit sie nicht Befriedigung verlangen können. Dieses Recht steht den Gläubigern jedoch nur zu, wenn sie glaubhaft machen, dass durch die Verschmelzung die Erfüllung ihrer Forderung gefährdet wird."
    },
    {
      "date": "2025-02-25",
      "id": "102127",
      "original_text": "Löschungsankündigung\nBayern Amtsgericht Bayreuth HRB 4066\nfrank & frei Fränkische Genüsse GmbH – Bayreuth",
      "type": "Löschungsankündigung",
      "state": "Bayern",
      "amtsgericht": "Amtsgericht Bayreuth",
      "registernummer": "HRB 4066",
      "registerart": "HRB",
      "company_name": "frank & frei Fränkische Genüsse GmbH",
      "company_seat": "Bayreuth",
      "details": "25.02.2025 (Bekanntmachungsdatum)\n\nBayern Amtsgericht Bayreuth HRB 4066\nLöschungsankündigung\n\nfrank & frei Fränkische Genüsse GmbH\nGesellschaft mit beschränkter Haftung\nBayreuth\n\nDas Registergericht beabsichtigt, die im Handelsregister eingetragene Gesellschaft wegen Vermögenslosigkeit von Amts wegen nach § 394 FamFG zu löschen. Die Frist zur Erhebung eines Widerspruchs ist auf einen Monat festgesetzt."
    },
    {
      "date": "2025-02-25",
      "id": "102128",
      "original_text": "Registerbekanntmachung nach dem Umwandlungsgesetz\nBayern Amtsgericht Memmingen HRB 21390\nGoldhofer Aktiengesellschaft – Memmingen",
      "type": "Registerbekanntmachung nach dem Umwandlungsgesetz",
      "state": "Bayern",
      "amtsgericht": "Amtsgericht Memmingen",
      "registernummer": "HRB 21390",
      "registerart": "HRB",
      "company_name": "Goldhofer Aktiengesellschaft",
      "company_seat": "Memmingen",
      "details": "25.02.2025 (Bekanntmachungsdatum)\n\nBayern Amtsgericht Memmingen HRB 21390\nRegisterbekanntmachung nach dem Umwandlungsgesetz 24.02.2025 (Eintragungsdatum)\n\nGoldhofer Aktiengesellschaft\nAktiengesellschaft\nMemmingen\n\nDen Gläubigern der an der Verschmelzung beteiligten Rechtsträger ist, wenn sie binnen sechs Monaten nach dem Tag, an dem die Eintragung der Verschmelzung in das Register des Sitzes desjenigen Rechtsträgers, dessen Gläubiger sie sind, nach § 19 Abs. 3 UmwG als bekannt gemacht gilt, ihren Anspruch nach Grund und Höhe in Textform anmelden, Sicherheit zu leisten, soweit sie nicht Befriedigung verlangen können. Dieses Recht steht den Gläubigern jedoch nur zu, wenn sie glaubhaft machen, dass durch die Verschmelzung die Erfüllung ihrer Forderung gefährdet wird."
    },
    {
      "date": "2025-02-25",
      "id": "102129",
      "original_text": "Sonstige Registerbekanntmachung\nBayern Amtsgericht Augsburg HRB 29372\ninos Automationssoftware GmbH – Asbach-Bäumenheim",
      "type": "Sonstige Registerbekanntmachung",
      "state": "Bayern",
      "amtsgericht": "Amtsgericht Augsburg",
      "registernummer": "HRB 29372",
      "registerart": "HRB",
      "company_name": "inos Automationssoftware GmbH",
      "company_seat": "Asbach-Bäumenheim",
      "details": "25.02.2025 (Bekanntmachungsdatum)\n\nBayern Amtsgericht Augsburg HRB 29372\nSonstige Registerbekanntmachung 24.02.2025 (Eintragungsdatum)\n\ninos Automationssoftware GmbH\nGesellschaft mit beschränkter Haftung\nAsbach-Bäumenheim\n\nDen Gläubigern der Gesellschaft, deren Forderungen begründet worden sind, bevor die Eintragung der Beendigung des Gewinnabführungsvertrages in das Handelsregister nach § 10 des Handelsgesetzbuches als bekanntgemacht gilt, hat der andere Vertragsteil Sicherheit zu leisten, wenn sie sich binnen sechs Monaten nach der Bekanntmachung der Eintragung zu diesem Zweck bei ihm melden."
    },
    {
      "date": "2025-02-25",
      "id": "102130",
      "original_text": "Registerbekanntmachung nach dem Umwandlungsgesetz\nBayern Amtsgericht München HRB 63346\nKoenen GmbH – Hohenbrunn",
      "type": "Registerbekanntmachung nach dem Umwandlungsgesetz",
      "state": "Bayern",
      "amtsgericht": "Amtsgericht München",
      "registernummer": "HRB 63346",
      "registerart": "HRB",
      "company_name": "Koenen GmbH",
      "company_seat": "Hohenbrunn",
      "details": "25.02.2025 (Bekanntmachungsdatum)\n\nBayern Amtsgericht München HRB 63346\nRegisterbekanntmachung nach dem Umwandlungsgesetz 24.02.2025 (Eintragungsdatum)\n\nKoenen GmbH\nGesellschaft mit beschränkter Haftung\nHohenbrunn\n\nDen Gläubigern der an der Verschmelzung beteiligten Rechtsträger ist, wenn sie binnen sechs Monaten nach dem Tag, an dem die Eintragung der Verschmelzung in das Register des Sitzes desjenigen Rechtsträgers, dessen Gläubiger sie sind, nach § 19 Abs. 3 UmwG als bekannt gemacht gilt, ihren Anspruch nach Grund und Höhe in Textform anmelden, Sicherheit zu leisten, soweit sie nicht Befriedigung verlangen können. Dieses Recht steht den Gläubigern jedoch nur zu, wenn sie glaubhaft machen, dass durch die Verschmelzung die Erfüllung ihrer Forderung gefährdet wird."
    },
    {
      "date": "2025-02-25",
      "id": "102131",
      "original_text": "Registerbekanntmachung nach dem Umwandlungsgesetz\nBayern Amtsgericht Augsburg HRA 16491\nRuisinger GmbH & Co. KG – Holzheim",
      "type": "Registerbekanntmachung nach dem Umwandlungsgesetz",
      "state": "Bayern",
      "amtsgericht": "Amtsgericht Augsburg",
      "registernummer": "HRA 16491",
      "registerart": "HRA",
      "company_name": "Ruisinger GmbH & Co. KG",
      "company_seat": "Holzheim",
      "details": "25.02.2025 (Bekanntmachungsdatum)\n\nBayern Amtsgericht Augsburg HRA 16491\nRegisterbekanntmachung nach dem Umwandlungsgesetz 24.02.2025 (Eintragungsdatum)\n\nRuisinger GmbH & Co. KG\nKommanditgesellschaft\nHolzheim\n\nDen Gläubigern des formwechselnden Rechtsträgers ist, wenn sie binnen sechs Monaten nach dem Tag, an dem die Eintragung des Formwechsels nach § 201 UmwG als bekannt gemacht gilt, ihren Anspruch nach Grund und Höhe in Textform anmelden, Sicherheit zu leisten, soweit sie nicht Befriedigung verlangen können. Dieses Recht steht den Gläubigern jedoch nur zu, wenn sie glaubhaft machen, dass durch den Formwechsel die Erfüllung ihrer Forderung gefährdet wird."
    },
    {
      "date": "2025-02-25",
      "id": "102132",
      "original_text": "Registerbekanntmachung nach dem Umwandlungsgesetz\nBayern Amtsgericht Regensburg HRB 15890\nVeranstaltung 3B UG (haftungsbeschränkt) – Regenstauf",
      "type": "Registerbekanntmachung nach dem Umwandlungsgesetz",
      "state": "Bayern",
      "amtsgericht": "Amtsgericht Regensburg",
      "registernummer": "HRB 15890",
      "registerart": "HRB",
      "company_name": "Veranstaltung 3B UG (haftungsbeschränkt)",
      "company_seat": "Regenstauf",
      "details": "25.02.2025 (Bekanntmachungsdatum)\n\nBayern Amtsgericht Regensburg HRB 15890\nRegisterbekanntmachung nach dem Umwandlungsgesetz 24.02.2025 (Eintragungsdatum)\n\nVeranstaltung 3B UG (haftungsbeschränkt)\nGesellschaft mit beschränkter Haftung\nRegenstauf\n\nDen Gläubigern der an der Verschmelzung beteiligten Rechtsträger ist, wenn sie binnen sechs Monaten nach dem Tag, an dem die Eintragung der Verschmelzung in das Register des Sitzes desjenigen Rechtsträgers, dessen Gläubiger sie sind, nach § 19 Abs. 3 UmwG als bekannt gemacht gilt, ihren Anspruch nach Grund und Höhe in Textform anmelden, Sicherheit zu leisten, soweit sie nicht Befriedigung verlangen können. Dieses Recht steht den Gläubigern jedoch nur zu, wenn sie glaubhaft machen, dass durch die Verschmelzung die Erfüllung ihrer Forderung gefährdet wird."
    },
    {
      "date": "2025-02-25",
      "id": "102133",
      "original_text": "Registerbekanntmachung nach dem Umwandlungsgesetz\nBayern Amtsgericht Fürth HRB 14768\nGBI Wohnungsbau Omikron GmbH – Erlangen",
      "type": "Registerbekanntmachung nach dem Umwandlungsgesetz",
      "state": "Bayern",
      "amtsgericht": "Amtsgericht Fürth",
      "registernummer": "HRB 14768",
      "registerart": "HRB",
      "company_name": "GBI Wohnungsbau Omikron GmbH",
      "company_seat": "Erlangen",
      "details": "25.02.2025 (Bekanntmachungsdatum)\n\nBayern Amtsgericht Fürth HRB 14768\nRegisterbekanntmachung nach dem Umwandlungsgesetz 24.02.2025 (Eintragungsdatum)\n\nGBI Wohnungsbau Omikron GmbH\nGesellschaft mit beschränkter Haftung\nErlangen\n\nDen Gläubigern der an der Verschmelzung beteiligten Rechtsträger ist, wenn sie binnen sechs Monaten nach dem Tag, an dem die Eintragung der Verschmelzung in das Register des Sitzes desjenigen Rechtsträgers, dessen Gläubiger sie sind, nach § 19 Abs. 3 UmwG als bekannt gemacht gilt, ihren Anspruch nach Grund und Höhe in Textform anmelden, Sicherheit zu leisten, soweit sie nicht Befriedigung verlangen können. Dieses Recht steht den Gläubigern jedoch nur zu, wenn sie glaubhaft machen, dass durch die Verschmelzung die Erfüllung ihrer Forderung gefährdet wird."
    },
    {
      "date": "2025-02-25",
      "id": "102134",
      "original_text": "Registerbekanntmachung nach dem Umwandlungsgesetz\nBayern Amtsgericht Fürth HRB 18897\nAVYS Trading GmbH – Erlangen",
      "type": "Registerbekanntmachung nach dem Umwandlungsgesetz",
      "state": "Bayern",
      "amtsgericht": "Amtsgericht Fürth",
      "registernummer": "HRB 18897",
      "registerart": "HRB",
      "company_name": "AVYS Trading GmbH",
      "company_seat": "Erlangen",
      "details": "25.02.2025 (Bekanntmachungsdatum)\n\nBayern Amtsgericht Fürth HRB 18897\nRegisterbekanntmachung nach dem Umwandlungsgesetz 24.02.2025 (Eintragungsdatum)\n\nAVYS Trading GmbH\nGesellschaft mit beschränkter Haftung\nErlangen\n\nDen Gläubigern der an der Verschmelzung beteiligten Rechtsträger ist, wenn sie binnen sechs Monaten nach dem Tag, an dem die Eintragung der Verschmelzung in das Register des Sitzes desjenigen Rechtsträgers, dessen Gläubiger sie sind, nach § 19 Abs. 3 UmwG als bekannt gemacht gilt, ihren Anspruch nach Grund und Höhe in Textform anmelden, Sicherheit zu leisten, soweit sie nicht Befriedigung verlangen können. Dieses Recht steht den Gläubigern jedoch nur zu, wenn sie glaubhaft machen, dass durch die Verschmelzung die Erfüllung ihrer Forderung gefährdet wird."
    },
    {
      "date": "2025-02-25",
      "id": "102135",
      "original_text": "Registerbekanntmachung nach dem Umwandlungsgesetz\nBayern Amtsgericht München HRB 220029\nKorian Management Grundbesitz GmbH – München",
      "type": "Registerbekanntmachung nach dem Umwandlungsgesetz",
      "state": "Bayern",
      "amtsgericht": "Amtsgericht München",
      "registernummer": "HRB 220029",
      "registerart": "HRB",
      "company_name": "Korian Management Grundbesitz GmbH",
      "company_seat": "München",
      "details": "25.02.2025 (Bekanntmachungsdatum)\n\nBayern Amtsgericht München HRB 220029\nRegisterbekanntmachung nach dem Umwandlungsgesetz\n\nKorian Management Grundbesitz GmbH\nGesellschaft mit beschränkter Haftung\nMünchen\n\nEs wird darauf hingewiesen, dass ein Formwechselplan oder sein Entwurf über einen grenzüberschreitenden Formwechsel der Korian Management Grundbesitz GmbH mit Sitz in München (Gesellschaft mit beschränkter Haftung), eingetragen beim Amtsgericht München unter HRB 220029 in die Clariane Immobilier Allemagne 14 mit Sitz in Paris/Frankreich (Société par Actions Simplifiée - Vereinfachte Aktiengesellschaft nach französischem Recht), welche in das Handelsregister Paris (Greffe du Tribunal de Commerce de Paris) einzutragen ist, beim Handelsregister eingereicht worden ist.\nDie Anteilsinhaber, die Gläubiger sowie die zuständigen Betriebsräte der an dem grenzüberschreitenden Formwechsel beteiligten Gesellschaft oder, soweit es keinen Betriebsrat gibt, die Arbeitnehmer der an dem grenzüberschreitenden Formwechsel beteiligten Gesellschaft, können der Gesellschaft spätestens fünf Arbeitstage vor dem Tag der Gesellschafterversammlung Bemerkungen zum Formwechselplan übermitteln.\n\nDie Bemerkungen sind zu richten an die Korian Management Grundbesitz GmbH, z. H. der Geschäftsführung, Dingolfinger Straße 15, 81673 München."
    },
    {
      "date": "2025-02-25",
      "id": "102136",
      "original_text": "Registerbekanntmachung nach dem Umwandlungsgesetz\nBayern Amtsgericht München HRB 218149\nZEDORA 126 Verwaltung GmbH – München",
      "type": "Registerbekanntmachung nach dem Umwandlungsgesetz",
      "state": "Bayern",
      "amtsgericht": "Amtsgericht München",
      "registernummer": "HRB 218149",
      "registerart": "HRB",
      "company_name": "ZEDORA 126 Verwaltung GmbH",
      "company_seat": "München",
      "details": "25.02.2025 (Bekanntmachungsdatum)\n\nBayern Amtsgericht München HRB 218149\nRegisterbekanntmachung nach dem Umwandlungsgesetz\n\nZEDORA 126 Verwaltung GmbH\nGesellschaft mit beschränkter Haftung\nMünchen\n\nDen Gläubigern der an der Verschmelzung beteiligten Rechtsträger ist, wenn sie binnen sechs Monaten nach dem Tag, an dem die Eintragung der Verschmelzung in das Register des Sitzes desjenigen Rechtsträgers, dessen Gläubiger sie sind, nach § 19 Abs. 3 UmwG als bekannt gemacht gilt, ihren Anspruch nach Grund und Höhe in Textform anmelden, Sicherheit zu leisten, soweit sie nicht Befriedigung verlangen können. Dieses Recht steht den Gläubigern jedoch nur zu, wenn sie glaubhaft machen, dass durch die Verschmelzung die Erfüllung ihrer Forderung gefährdet wird."
    },
    {
      "date": "2025-02-25",
      "id": "102137",
      "original_text": "Registerbekanntmachung nach dem Umwandlungsgesetz\nBayern Amtsgericht München HRA 119990\nFreiberg Apartments LLC & Co. KG – München",
      "type": "Registerbekanntmachung nach dem Umwandlungsgesetz",
      "state": "Bayern",
      "amtsgericht": "Amtsgericht München",
      "registernummer": "HRA 119990",
      "registerart": "HRA",
      "company_name": "Freiberg Apartments LLC & Co. KG",
      "company_seat": "München",
      "details": "25.02.2025 (Bekanntmachungsdatum)\n\nBayern Amtsgericht München HRA 119990\nRegisterbekanntmachung nach dem Umwandlungsgesetz 24.02.2025 (Eintragungsdatum)\n\nFreiberg Apartments LLC & Co. KG\nKommanditgesellschaft\nMünchen\n\nDen Gläubigern der an der Verschmelzung beteiligten Rechtsträger ist, wenn sie binnen sechs Monaten nach dem Tag, an dem die Eintragung der Verschmelzung in das Register des Sitzes desjenigen Rechtsträgers, dessen Gläubiger sie sind, nach § 19 Abs. 3 UmwG als bekannt gemacht gilt, ihren Anspruch nach Grund und Höhe in Textform anmelden, Sicherheit zu leisten, soweit sie nicht Befriedigung verlangen können. Dieses Recht steht den Gläubigern jedoch nur zu, wenn sie glaubhaft machen, dass durch die Verschmelzung die Erfüllung ihrer Forderung gefährdet wird."
    },
    {
      "date": "2025-02-25",
      "id": "102138",
      "original_text": "Löschungsankündigung\nBayern Amtsgericht Nürnberg HRB 42697\nPV-Solar GmbH – Freystadt",
      "type": "Löschungsankündigung",
      "state": "Bayern",
      "amtsgericht": "Amtsgericht Nürnberg",
      "registernummer": "HRB 42697",
      "registerart": "HRB",
      "company_name": "PV-Solar GmbH",
      "company_seat": "Freystadt",
      "details": "25.02.2025 (Bekanntmachungsdatum)\n\nBayern Amtsgericht Nürnberg HRB 42697\nLöschungsankündigung\n\nPV-Solar GmbH\nGesellschaft mit beschränkter Haftung\nFreystadt\n\nDas Registergericht beabsichtigt, die im Handelsregister eingetragene Gesellschaft wegen Vermögenslosigkeit von Amts wegen nach § 394 FamFG zu löschen. Die Frist zur Erhebung eines Widerspruchs ist auf einen Monat festgesetzt."
    },
    {
      "date": "2025-02-25",
      "id": "102139",
      "original_text": "Registerbekanntmachung nach dem Umwandlungsgesetz\nBayern Amtsgericht Memmingen HRB 10871\nGoldhofer Aktiengesellschaft – Memmingen",
      "type": "Registerbekanntmachung nach dem Umwandlungsgesetz",
      "state": "Bayern",
      "amtsgericht": "Amtsgericht Memmingen",
      "registernummer": "HRB 10871",
      "registerart": "HRB",
      "company_name": "Goldhofer Aktiengesellschaft",
      "company_seat": "Memmingen",
      "details": "25.02.2025 (Bekanntmachungsdatum)\n\nBayern Amtsgericht Memmingen HRB 10871\nRegisterbekanntmachung nach dem Umwandlungsgesetz 24.02.2025 (Eintragungsdatum)\n\nGoldhofer Aktiengesellschaft\nAktiengesellschaft\nMemmingen\n\nDen Gläubigern der an der Verschmelzung beteiligten Rechtsträger ist, wenn sie binnen sechs Monaten nach dem Tag, an dem die Eintragung der Verschmelzung in das Register des Sitzes desjenigen Rechtsträgers, dessen Gläubiger sie sind, nach § 19 Abs. 3 UmwG als bekannt gemacht gilt, ihren Anspruch nach Grund und Höhe in Textform anmelden, Sicherheit zu leisten, soweit sie nicht Befriedigung verlangen können. Dieses Recht steht den Gläubigern jedoch nur zu, wenn sie glaubhaft machen, dass durch die Verschmelzung die Erfüllung ihrer Forderung gefährdet wird."
    },
    {
      "date": "2025-02-25",
      "id": "102140",
      "original_text": "Registerbekanntmachung nach dem Umwandlungsgesetz\nBerlin Amtsgericht Berlin (Charlottenburg) HRB 248502\nEvergroup Invest GmbH – Berlin",
      "type": "Registerbekanntmachung nach dem Umwandlungsgesetz",
      "state": "Berlin",
      "amtsgericht": "Amtsgericht Berlin (Charlottenburg)",
      "registernummer": "HRB 248502",
      "registerart": "HRB",
      "company_name": "Evergroup Invest GmbH",
      "company_seat": "Berlin",
      "details": "25.02.2025 (Bekanntmachungsdatum)\n\nBerlin Amtsgericht Berlin (Charlottenburg) HRB 248502\nRegisterbekanntmachung nach dem Umwandlungsgesetz 20.02.2025 (Eintragungsdatum)\n\nEvergroup Invest GmbH\nGesellschaft mit beschränkter Haftung\nBerlin\n\nZu Eintragungsnummer 3 vom 20.02.2025 wird als nicht eingetragen veröffentlicht: Den Gläubigern der an der jeweiligen Verschmelzung beteiligten Rechtsträger ist, wenn sie binnen sechs Monaten nach dem Tag, an dem die Eintragungen der jeweiligen Verschmelzung in das Register des Sitzes desjenigen Rechtsträgers, dessen Gläubiger sie sind, als bekannt gemacht gilt, ihren Anspruch nach Grund und Höhe schriftlich anmelden, Sicherheit zu leisten, soweit sie nicht Befriedigung verlangen können. Dieses Recht steht den Gläubigern jedoch nur zu, wenn sie glaubhaft machen, dass durch die jeweilige Verschmelzung die Erfüllung ihrer Forderung gefährdet wird. Das Recht, Sicherheitsleistung zu verlangen, steht Gläubigern nicht zu, die im Falle der Insolvenz ein Recht auf vorzugsweise Befriedigung aus einer Deckungsmasse haben, die nach gesetzlicher Vorschrift zu ihrem Schutz errichtet und staatlich überwacht ist."
    },
    {
      "date": "2025-02-25",
      "id": "102141",
      "original_text": "Registerbekanntmachung nach dem Umwandlungsgesetz\nBerlin Amtsgericht Berlin (Charlottenburg) HRB 248569\nKorInvest I GmbH – Berlin",
      "type": "Registerbekanntmachung nach dem Umwandlungsgesetz",
      "state": "Berlin",
      "amtsgericht": "Amtsgericht Berlin (Charlottenburg)",
      "registernummer": "HRB 248569",
      "registerart": "HRB",
      "company_name": "KorInvest I GmbH",
      "company_seat": "Berlin",
      "details": "25.02.2025 (Bekanntmachungsdatum)\n\nBerlin Amtsgericht Berlin (Charlottenburg) HRB 248569\nRegisterbekanntmachung nach dem Umwandlungsgesetz 20.02.2025 (Eintragungsdatum)\n\nKorInvest I GmbH\nGesellschaft mit beschränkter Haftung\nBerlin\n\nZu Eintragungsnummer 3 vom 20.02.2025 wird als nicht eingetragen veröffentlicht: Den Gläubigern der an der Verschmelzung beteiligten Rechtsträger ist, wenn sie binnen sechs Monaten nach dem Tag, an dem die Eintragung der Verschmelzung in das Register des Sitzes desjenigen Rechtsträgers, dessen Gläubiger sie sind, als bekannt gemacht gilt, ihren Anspruch nach Grund und Höhe schriftlich anmelden, Sicherheit zu leisten, soweit sie nicht Befriedigung verlangen können. Dieses Recht steht den Gläubigern jedoch nur zu, wenn sie glaubhaft machen, dass durch die Verschmelzung die Erfüllung ihrer Forderung gefährdet wird. Das Recht, Sicherheitsleistung zu verlangen, steht Gläubigern nicht zu, die im Falle der Insolvenz ein Recht auf vorzugsweise Befriedigung aus einer Deckungsmasse haben, die nach gesetzlicher Vorschrift zu ihrem Schutz errichtet und staatlich überwacht ist."
    },
    {
      "date": "2025-02-25",
      "id": "102142",
      "original_text": "Registerbekanntmachung nach dem Umwandlungsgesetz\nBerlin Amtsgericht Berlin (Charlottenburg) HRB 248520\nKorInvest II GmbH – Berlin",
      "type": "Registerbekanntmachung nach dem Umwandlungsgesetz",
      "state": "Berlin",
      "amtsgericht": "Amtsgericht Berlin (Charlottenburg)",
      "registernummer": "HRB 248520",
      "registerart": "HRB",
      "company_name": "KorInvest II GmbH",
      "company_seat": "Berlin",
      "details": "25.02.2025 (Bekanntmachungsdatum)\n\nBerlin Amtsgericht Berlin (Charlottenburg) HRB 248520\nRegisterbekanntmachung nach dem Umwandlungsgesetz 20.02.2025 (Eintragungsdatum)\n\nKorInvest II GmbH\nGesellschaft mit beschränkter Haftung\nBerlin\n\nZu Eintragungsnummer 3 vom 20.02.2025 wird als nicht eingetragen veröffentlicht: Den Gläubigern der an der Verschmelzung beteiligten Rechtsträger ist, wenn sie binnen sechs Monaten nach dem Tag, an dem die Eintragung der Verschmelzung in das Register des Sitzes desjenigen Rechtsträgers, dessen Gläubiger sie sind, als bekannt gemacht gilt, ihren Anspruch nach Grund und Höhe schriftlich anmelden, Sicherheit zu leisten, soweit sie nicht Befriedigung verlangen können. Dieses Recht steht den Gläubigern jedoch nur zu, wenn sie glaubhaft machen, dass durch die Verschmelzung die Erfüllung ihrer Forderung gefährdet wird. Das Recht, Sicherheitsleistung zu verlangen, steht Gläubigern nicht zu, die im Falle der Insolvenz ein Recht auf vorzugsweise Befriedigung aus einer Deckungsmasse haben, die nach gesetzlicher Vorschrift zu ihrem Schutz errichtet und staatlich überwacht ist."
    },
    {
      "date": "2025-02-25",
      "id": "102143",
      "original_text": "Registerbekanntmachung nach dem Umwandlungsgesetz\nBerlin Amtsgericht Berlin (Charlottenburg) HRB 248477\nKorInvest III GmbH – Berlin",
      "type": "Registerbekanntmachung nach dem Umwandlungsgesetz",
      "state": "Berlin",
      "amtsgericht": "Amtsgericht Berlin (Charlottenburg)",
      "registernummer": "HRB 248477",
      "registerart": "HRB",
      "company_name": "KorInvest III GmbH",
      "company_seat": "Berlin",
      "details": "25.02.2025 (Bekanntmachungsdatum)\n\nBerlin Amtsgericht Berlin (Charlottenburg) HRB 248477\nRegisterbekanntmachung nach dem Umwandlungsgesetz 20.02.2025 (Eintragungsdatum)\n\nKorInvest III GmbH\nGesellschaft mit beschränkter Haftung\nBerlin\n\nZu Eintragungsnummer 3 vom 20.02.2025 wird als nicht eingetragen veröffentlicht: Den Gläubigern der an der Verschmelzung beteiligten Rechtsträger ist, wenn sie binnen sechs Monaten nach dem Tag, an dem die Eintragung der Verschmelzung in das Register des Sitzes desjenigen Rechtsträgers, dessen Gläubiger sie sind, als bekannt gemacht gilt, ihren Anspruch nach Grund und Höhe schriftlich anmelden, Sicherheit zu leisten, soweit sie nicht Befriedigung verlangen können. Dieses Recht steht den Gläubigern jedoch nur zu, wenn sie glaubhaft machen, dass durch die Verschmelzung die Erfüllung ihrer Forderung gefährdet wird. Das Recht, Sicherheitsleistung zu verlangen, steht Gläubigern nicht zu, die im Falle der Insolvenz ein Recht auf vorzugsweise Befriedigung aus einer Deckungsmasse haben, die nach gesetzlicher Vorschrift zu ihrem Schutz errichtet und staatlich überwacht ist."
    },
    {
      "date": "2025-02-25",
      "id": "102144",
      "original_text": "Löschungsankündigung\nBerlin Amtsgericht Berlin (Charlottenburg) HRB 148675\nI.M.K. Industriemontage GmbH – Berlin",
      "type": "Löschungsankündigung",
      "state": "Berlin",
      "amtsgericht": "Amtsgericht Berlin (Charlottenburg)",
      "registernummer": "HRB 148675",
      "registerart": "HRB",
      "company_name": "I.M.K. Industriemontage GmbH",
      "company_seat": "Berlin",
      "details": "25.02.2025 (Bekanntmachungsdatum)\n\nBerlin Amtsgericht Berlin (Charlottenburg) HRB 148675\nLöschungsankündigung\n\nI.M.K. Industriemontage GmbH\nGesellschaft mit beschränkter Haftung\nBerlin\n\nBei der nachstehenden Gesellschaft wird das Amtslöschungsverfahren gemäß § 394 FamFG eingeleitet. Widerspruchsfrist 6 Wochen"
    },
    {
      "date": "2025-02-25",
      "id": "102145",
      "original_text": "Löschungsankündigung\nBerlin Amtsgericht Berlin (Charlottenburg) HRB 187688\nMedical Rescue Service Berlin GmbH – Berlin",
      "type": "Löschungsankündigung",
      "state": "Berlin",
      "amtsgericht": "Amtsgericht Berlin (Charlottenburg)",
      "registernummer": "HRB 187688",
      "registerart": "HRB",
      "company_name": "Medical Rescue Service Berlin GmbH",
      "company_seat": "Berlin",
      "details": "25.02.2025 (Bekanntmachungsdatum)\n\nBerlin Amtsgericht Berlin (Charlottenburg) HRB 187688\nLöschungsankündigung\n\nMedical Rescue Service Berlin GmbH\nGesellschaft mit beschränkter Haftung\nBerlin\n\nBei der nachstehenden Gesellschaft wird das Amtslöschungsverfahren gemäß § 394 FamFG eingeleitet. Widerspruchsfrist 6 Wochen"
    },
    {
      "date": "2025-02-25",
      "id": "102146",
      "original_text": "Einreichung neuer Dokumente\nSachsen-Anhalt Amtsgericht Stendal HRB 211520\nMitteldeutscher Verkehrsverbund Gesellschaft mit beschränkter Haftung (MDV) – Halle (Saale)",
      "type": "Einreichung neuer Dokumente",
      "state": "Sachsen-Anhalt",
      "amtsgericht": "Amtsgericht Stendal",
      "registernummer": "HRB 211520",
      "registerart": "HRB",
      "company_name": "Mitteldeutscher Verkehrsverbund Gesellschaft mit beschränkter Haftung (MDV)",
      "company_seat": "Halle (Saale)",
      "details": "25.02.2025 (Bekanntmachungsdatum)\n\nSachsen-Anhalt Amtsgericht Stendal HRB 211520\nEinreichung neuer Dokumente\n\nMitteldeutscher Verkehrsverbund Gesellschaft mit beschränkter Haftung (MDV)\nGesellschaft mit beschränkter Haftung\nHalle (Saale)\n\nEine Liste der Mitglieder des Aufsichtsrates wurde zum Handelsregister eingereicht."
    },
    {
      "date": "2025-02-25",
      "id": "102147",
      "original_text": "Löschungsankündigung\nBerlin Amtsgericht Berlin (Charlottenburg) HRB 177209\n50bikes S.N. UG (haftungsbeschränkt) – Berlin",
      "type": "Löschungsankündigung",
      "state": "Berlin",
      "amtsgericht": "Amtsgericht Berlin (Charlottenburg)",
      "registernummer": "HRB 177209",
      "registerart": "HRB",
      "company_name": "50bikes S.N. UG (haftungsbeschränkt)",
      "company_seat": "Berlin",
      "details": "25.02.2025 (Bekanntmachungsdatum)\n\nBerlin Amtsgericht Berlin (Charlottenburg) HRB 177209\nLöschungsankündigung\n\n50bikes S.N. UG (haftungsbeschränkt)\nGesellschaft mit beschränkter Haftung\nBerlin\n\nBei der nachstehenden Gesellschaft wird das Amtslöschungsverfahren gemäß § 394 FamFG eingeleitet. Widerspruchsfrist 6 Wochen"
    },
    {
      "date": "2025-02-25",
      "id": "102148",
      "original_text": "Löschungsankündigung\nBerlin Amtsgericht Berlin (Charlottenburg) HRB 149619\nDAN Immobilien Invest GmbH – Berlin",
      "type": "Löschungsankündigung",
      "state": "Berlin",
      "amtsgericht": "Amtsgericht Berlin (Charlottenburg)",
      "registernummer": "HRB 149619",
      "registerart": "HRB",
      "company_name": "DAN Immobilien Invest GmbH",
      "company_seat": "Berlin",
      "details": "25.02.2025 (Bekanntmachungsdatum)\n\nBerlin Amtsgericht Berlin (Charlottenburg) HRB 149619\nLöschungsankündigung\n\nDAN Immobilien Invest GmbH\nGesellschaft mit beschränkter Haftung\nBerlin\n\nBei der nachstehenden Gesellschaft wird das Amtslöschungsverfahren gemäß § 394 FamFG eingeleitet. Widerspruchsfrist 6 Wochen"
    },
    {
      "date": "2025-02-25",
      "id": "102149",
      "original_text": "Registerbekanntmachung nach dem Umwandlungsgesetz\nBaden-Württemberg Amtsgericht Ulm HRB 748278\nSeibel Fliesenleger GmbH – Herbrechtingen",
      "type": "Registerbekanntmachung nach dem Umwandlungsgesetz",
      "state": "Baden-Württemberg",
      "amtsgericht": "Amtsgericht Ulm",
      "registernummer": "HRB 748278",
      "registerart": "HRB",
      "company_name": "Seibel Fliesenleger GmbH",
      "company_seat": "Herbrechtingen",
      "details": "25.02.2025 (Bekanntmachungsdatum)\n\nBaden-Württemberg Amtsgericht Ulm HRB 748278\nRegisterbekanntmachung nach dem Umwandlungsgesetz 25.02.2025 (Eintragungsdatum)\n\nSeibel Fliesenleger GmbH\nGesellschaft mit beschränkter Haftung\nHerbrechtingen\n\nAls nicht eingetragen wird bekanntgemacht:\nDen Gläubigern der an der Ausgliederung beteiligten Rechtsträger ist, wenn sie binnen sechs Monaten nach dem Tag, an dem die Eintragung der Ausgliederung in das Register des Sitzes desjenigen Rechtsträgers, dessen Gläubiger sie sind, nach § 19 Abs. 3 UmwG als bekanntgemacht gilt, ihren Anspruch nach Grund und Höhe schriftlich anmelden, Sicherheit zu leisten, soweit sie nicht Befriedigung verlangen können. Dieses Recht steht den Gläubigern jedoch nur zu, wenn sie glaubhaft machen, dass durch die Ausgliederung die Erfüllung ihrer Forderung gefährdet wird."
    },
    {
      "date": "2025-02-25",
      "id": "102150",
      "original_text": "Registerbekanntmachung nach dem Umwandlungsgesetz\nBaden-Württemberg Amtsgericht Ulm HRA 729185\nSergej Seibel Fliesenleger e.K. – Herbrechtingen",
      "type": "Registerbekanntmachung nach dem Umwandlungsgesetz",
      "state": "Baden-Württemberg",
      "amtsgericht": "Amtsgericht Ulm",
      "registernummer": "HRA 729185",
      "registerart": "HRA",
      "company_name": "Sergej Seibel Fliesenleger e.K.",
      "company_seat": "Herbrechtingen",
      "details": "25.02.2025 (Bekanntmachungsdatum)\n\nBaden-Württemberg Amtsgericht Ulm HRA 729185\nRegisterbekanntmachung nach dem Umwandlungsgesetz 25.02.2025 (Eintragungsdatum)\n\nSergej Seibel Fliesenleger e.K.\nEinzelkaufmann / Einzelkauffrau\nHerbrechtingen\n\nAls nicht eingetragen wird bekanntgemacht:\nDen Gläubigern der an der Ausgliederung beteiligten Rechtsträger ist, wenn sie binnen sechs Monaten nach dem Tag, an dem die Eintragung der Ausgliederung in das Register des Sitzes desjenigen Rechtsträgers, dessen Gläubiger sie sind, nach § 19 Abs. 3 UmwG als bekanntgemacht gilt, ihren Anspruch nach Grund und Höhe schriftlich anmelden, Sicherheit zu leisten, soweit sie nicht Befriedigung verlangen können. Dieses Recht steht den Gläubigern jedoch nur zu, wenn sie glaubhaft machen, dass durch die Ausgliederung die Erfüllung ihrer Forderung gefährdet wird."
    },
    {
      "date": "2025-02-25",
      "id": "102151",
      "original_text": "Registerbekanntmachung nach dem Umwandlungsgesetz\nSchleswig-Holstein Amtsgericht Kiel HRB 27840\nGraef Holding GmbH – Kaltenkirchen",
      "type": "Registerbekanntmachung nach dem Umwandlungsgesetz",
      "state": "Schleswig-Holstein",
      "amtsgericht": "Amtsgericht Kiel",
      "registernummer": "HRB 27840",
      "registerart": "HRB",
      "company_name": "Graef Holding GmbH",
      "company_seat": "Kaltenkirchen",
      "details": "25.02.2025 (Bekanntmachungsdatum)\n\nSchleswig-Holstein Amtsgericht Kiel HRB 27840\nRegisterbekanntmachung nach dem Umwandlungsgesetz 21.02.2025 (Eintragungsdatum)\n\nGraef Holding GmbH\nGesellschaft mit beschränkter Haftung\nKaltenkirchen\n\nZu Eintragungsnummer 1 vom 21.02.2025 wird als nicht eingetragen veröffentlicht: Den Gläubigern der an der Spaltung beteiligten Rechtsträger ist, wenn sie binnen sechs Monaten nach dem Tag, an dem die Eintragung der Spaltung in das Register des Sitzes desjenigen Rechtsträgers, dessen Gläubiger sie sind,  bekannt gemacht worden ist, ihren Anspruch nach Grund und Höhe schriftlich anmelden, Sicherheit zu leisten, soweit sie nicht Befriedigung verlangen können. Dieses Recht steht den Gläubigern jedoch nur zu, wenn sie glaubhaft machen, dass durch die Spaltung die Erfüllung ihrer Forderung gefährdet wird."
    },
    {
      "date": "2025-02-25",
      "id": "102152",
      "original_text": "Löschungsankündigung\nSchleswig-Holstein Amtsgericht Flensburg HRB 13171\nIlska Wuppertal GmbH – Flensburg",
      "type": "Löschungsankündigung",
      "state": "Schleswig-Holstein",
      "amtsgericht": "Amtsgericht Flensburg",
      "registernummer": "HRB 13171",
      "registerart": "HRB",
      "company_name": "Ilska Wuppertal GmbH",
      "company_seat": "Flensburg",
      "details": "25.02.2025 (Bekanntmachungsdatum)\n\nSchleswig-Holstein Amtsgericht Flensburg HRB 13171\nLöschungsankündigung\n\nIlska Wuppertal GmbH\nGesellschaft mit beschränkter Haftung\nFlensburg\n\nEs ist die Löschung der nachstehenden Gesellschaft wegen Vermögenslosigkeit gemäß § 394 FamFG beabsichtigt.\nWiderspruchsfrist: 2 Monate."
    },
    {
      "date": "2025-02-25",
      "id": "102153",
      "original_text": "Löschungsankündigung\nBerlin Amtsgericht Berlin (Charlottenburg) HRB 211117\nITB lnstallationstechnik Berlin GmbH – Berlin",
      "type": "Löschungsankündigung",
      "state": "Berlin",
      "amtsgericht": "Amtsgericht Berlin (Charlottenburg)",
      "registernummer": "HRB 211117",
      "registerart": "HRB",
      "company_name": "ITB lnstallationstechnik Berlin GmbH",
      "company_seat": "Berlin",
      "details": "25.02.2025 (Bekanntmachungsdatum)\n\nBerlin Amtsgericht Berlin (Charlottenburg) HRB 211117\nLöschungsankündigung\n\nITB lnstallationstechnik Berlin GmbH\nGesellschaft mit beschränkter Haftung\nBerlin\n\nBei der nachstehenden Gesellschaft wird das Amtslöschungsverfahren gemäß § 394 FamFG eingeleitet. Widerspruchsfrist 6 Wochen"
    },
    {
      "date": "2025-02-25",
      "id": "102154",
      "original_text": "Einreichung neuer Dokumente\nBerlin Amtsgericht Berlin (Charlottenburg) HRB 237567\nGrover Europe SE – Berlin",
      "type": "Einreichung neuer Dokumente",
      "state": "Berlin",
      "amtsgericht": "Amtsgericht Berlin (Charlottenburg)",
      "registernummer": "HRB 237567",
      "registerart": "HRB",
      "company_name": "Grover Europe SE",
      "company_seat": "Berlin",
      "details": "25.02.2025 (Bekanntmachungsdatum)\n\nBerlin Amtsgericht Berlin (Charlottenburg) HRB 237567\nEinreichung neuer Dokumente\n\nGrover Europe SE\nEuropäische Aktiengesellschaft (SE)\nBerlin\n\nAls nicht eingetragen wird veröffentlicht: Es wurde eine neue Liste der Aufsichtsratsmitglieder eingereicht (§ 106 AktG)."
    },
    {
      "date": "2025-02-25",
      "id": "102155",
      "original_text": "Löschungsankündigung\nMecklenburg-Vorpommern Amtsgericht Neubrandenburg HRB 20340\nEuroschmuck GmbH – Röbel",
      "type": "Löschungsankündigung",
      "state": "Mecklenburg-Vorpommern",
      "amtsgericht": "Amtsgericht Neubrandenburg",
      "registernummer": "HRB 20340",
      "registerart": "HRB",
      "company_name": "Euroschmuck GmbH",
      "company_seat": "Röbel",
      "details": "25.02.2025 (Bekanntmachungsdatum)\n\nMecklenburg-Vorpommern Amtsgericht Neubrandenburg HRB 20340\nLöschungsankündigung 25.02.2025 (Eintragungsdatum)\n\nEuroschmuck GmbH\nGesellschaft mit beschränkter Haftung\nRöbel\n\nDas Registergericht beabsichtigt, die im Handelsregister eingetragene Gesellschaft von Amts wegen nach § 394 FamFG zu löschen. Die Frist zur Erhebung eines Widerspruchs gegen die beabsichtigte Löschung wird auf drei Monate festgesetzt."
    },
    {
      "date": "2025-02-25",
      "id": "102156",
      "original_text": "Registerbekanntmachung nach dem Umwandlungsgesetz\nSchleswig-Holstein Amtsgericht Lübeck HRB 23075\nUnicapas Projektentwicklung GmbH – Oldenburg in Holstein",
      "type": "Registerbekanntmachung nach dem Umwandlungsgesetz",
      "state": "Schleswig-Holstein",
      "amtsgericht": "Amtsgericht Lübeck",
      "registernummer": "HRB 23075",
      "registerart": "HRB",
      "company_name": "Unicapas Projektentwicklung GmbH",
      "company_seat": "Oldenburg in Holstein",
      "details": "25.02.2025 (Bekanntmachungsdatum)\n\nSchleswig-Holstein Amtsgericht Lübeck HRB 23075\nRegisterbekanntmachung nach dem Umwandlungsgesetz 24.02.2025 (Eintragungsdatum)\n\nUnicapas Projektentwicklung GmbH\nGesellschaft mit beschränkter Haftung\nOldenburg in Holstein\n\nZu Eintragungsnummer 2 vom 24.02.2025 wird als nicht eingetragen veröffentlicht: Den Gläubigern der an der Verschmelzung beteiligten Rechtsträger ist, wenn sie binnen sechs Monaten nach dem Tag, an dem die Eintragung der Verschmelzung in das Register des Sitzes desjenigen Rechtsträgers, dessen Gläubiger sie sind, als bekannt gemacht gilt, ihren Anspruch nach Grund und Höhe schriftlich anmelden, Sicherheit zu leisten, soweit sie nicht Befriedigung verlangen können. Dieses Recht steht den Gläubigern jedoch nur zu, wenn sie glaubhaft machen, dass durch die Verschmelzung die Erfüllung ihrer Forderung gefährdet wird."
    },
    {
      "date": "2025-02-25",
      "id": "102157",
      "original_text": "Löschungsankündigung\nBerlin Amtsgericht Berlin (Charlottenburg) HRB 204441\nKalem Bau GmbH – Berlin",
      "type": "Löschungsankündigung",
      "state": "Berlin",
      "amtsgericht": "Amtsgericht Berlin (Charlottenburg)",
      "registernummer": "HRB 204441",
      "registerart": "HRB",
      "company_name": "Kalem Bau GmbH",
      "company_seat": "Berlin",
      "details": "25.02.2025 (Bekanntmachungsdatum)\n\nBerlin Amtsgericht Berlin (Charlottenburg) HRB 204441\nLöschungsankündigung\n\nKalem Bau GmbH\nGesellschaft mit beschränkter Haftung\nBerlin\n\nBei der nachstehenden Gesellschaft wird das Amtslöschungsverfahren gemäß § 394 FamFG eingeleitet. Widerspruchsfrist 6 Wochen"
    },
    {
      "date": "2025-02-25",
      "id": "102158",
      "original_text": "Registerbekanntmachung nach dem Umwandlungsgesetz\nSchleswig-Holstein Amtsgericht Kiel HRA 12623\nToni Graef e.K. – Kaltenkirchen",
      "type": "Registerbekanntmachung nach dem Umwandlungsgesetz",
      "state": "Schleswig-Holstein",
      "amtsgericht": "Amtsgericht Kiel",
      "registernummer": "HRA 12623",
      "registerart": "HRA",
      "company_name": "Toni Graef e.K.",
      "company_seat": "Kaltenkirchen",
      "details": "25.02.2025 (Bekanntmachungsdatum)\n\nSchleswig-Holstein Amtsgericht Kiel HRA 12623\nRegisterbekanntmachung nach dem Umwandlungsgesetz 21.02.2025 (Eintragungsdatum)\n\nToni Graef e.K.\nEinzelkaufmann / Einzelkauffrau\nKaltenkirchen\n\nZu Eintragungsnummer 2 vom 21.02.2025 wird als nicht eingetragen veröffentlicht: Den Gläubigern der an der Spaltung beteiligten Rechtsträger ist, wenn sie binnen sechs Monaten nach dem Tag, an dem die Eintragung der Spaltung in das Register des Sitzes desjenigen Rechtsträgers, dessen Gläubiger sie sind,  bekannt gemacht worden ist, ihren Anspruch nach Grund und Höhe schriftlich anmelden, Sicherheit zu leisten, soweit sie nicht Befriedigung verlangen können. Dieses Recht steht den Gläubigern jedoch nur zu, wenn sie glaubhaft machen, dass durch die Spaltung die Erfüllung ihrer Forderung gefährdet wird."
    },
    {
      "date": "2025-02-25",
      "id": "102159",
      "original_text": "Löschungsankündigung\nBerlin Amtsgericht Berlin (Charlottenburg) HRB 221718\nWork up GmbH – Berlin",
      "type": "Löschungsankündigung",
      "state": "Berlin",
      "amtsgericht": "Amtsgericht Berlin (Charlottenburg)",
      "registernummer": "HRB 221718",
      "registerart": "HRB",
      "company_name": "Work up GmbH",
      "company_seat": "Berlin",
      "details": "25.02.2025 (Bekanntmachungsdatum)\n\nBerlin Amtsgericht Berlin (Charlottenburg) HRB 221718\nLöschungsankündigung\n\nWork up GmbH\nGesellschaft mit beschränkter Haftung\nBerlin\n\nBei der nachstehenden Gesellschaft wird das Amtslöschungsverfahren gemäß § 394 FamFG eingeleitet. Widerspruchsfrist 6 Wochen"
    },
    {
      "date": "2025-02-25",
      "id": "102160",
      "original_text": "Einreichung neuer Dokumente\nSaarland Amtsgericht Saarbrücken HRB 102686\nFinanzkonzept Saarpfalz GmbH – Homburg/Saar",
      "type": "Einreichung neuer Dokumente",
      "state": "Saarland",
      "amtsgericht": "Amtsgericht Saarbrücken",
      "registernummer": "HRB 102686",
      "registerart": "HRB",
      "company_name": "Finanzkonzept Saarpfalz GmbH",
      "company_seat": "Homburg/Saar",
      "details": "25.02.2025 (Bekanntmachungsdatum)\n\nSaarland Amtsgericht Saarbrücken HRB 102686\nEinreichung neuer Dokumente\n\nFinanzkonzept Saarpfalz GmbH\nGesellschaft mit beschränkter Haftung\nHomburg/Saar\n\nDie Geschäftsführung der Gesellschaft hat eine Liste der Mitglieder des Aufsichtsrats zum Handelsregister eingereicht (§ 52 Abs. 3 Satz 2 GmbHG)."
    },
    {
      "date": "2025-02-25",
      "id": "102161",
      "original_text": "Löschungsankündigung\nSchleswig-Holstein Amtsgericht Kiel HRA 3381\nNord - Immobilien, Inhaber Wilbert Weinerowski e. Kfm. – Kiel",
      "type": "Löschungsankündigung",
      "state": "Schleswig-Holstein",
      "amtsgericht": "Amtsgericht Kiel",
      "registernummer": "HRA 3381",
      "registerart": "HRA",
      "company_name": "Nord - Immobilien, Inhaber Wilbert Weinerowski e. Kfm.",
      "company_seat": "Kiel",
      "details": "25.02.2025 (Bekanntmachungsdatum)\n\nSchleswig-Holstein Amtsgericht Kiel HRA 3381\nLöschungsankündigung\n\nNord - Immobilien, Inhaber Wilbert Weinerowski e. Kfm.\nEinzelkaufmann / Einzelkauffrau\nKiel\n\nBei der nachstehenden Firma wird das Amtslöschungsverfahren gemäß § 31 Abs. 2 HGB eingeleitet. Widerspruchsfrist: 2 Monate."
    },
    {
      "date": "2025-02-25",
      "id": "102162",
      "original_text": "Sonstige Registerbekanntmachung\nBrandenburg Amtsgericht Neuruppin HRB 703\nWOBA Templin - UM, Wohnungsbaugesellschaft mit beschränkter Haftung – Templin",
      "type": "Sonstige Registerbekanntmachung",
      "state": "Brandenburg",
      "amtsgericht": "Amtsgericht Neuruppin",
      "registernummer": "HRB 703",
      "registerart": "HRB",
      "company_name": "WOBA Templin - UM, Wohnungsbaugesellschaft mit beschränkter Haftung",
      "company_seat": "Templin",
      "details": "25.02.2025 (Bekanntmachungsdatum)\n\nBrandenburg Amtsgericht Neuruppin HRB 703\nSonstige Registerbekanntmachung\n\nWOBA Templin - UM, Wohnungsbaugesellschaft mit beschränkter Haftung\nGesellschaft mit beschränkter Haftung\nTemplin\n\nAls nicht eingetragen wird veröffentlicht: Eine Liste der Mitglieder des Aufsichtsrates wurde zum Handelsregister eingereicht."
    },
    {
      "date": "2025-02-25",
      "id": "102163",
      "original_text": "Löschungsankündigung\nBerlin Amtsgericht Berlin (Charlottenburg) HRB 214297\nHaser Kraft Holding GmbH – Berlin",
      "type": "Löschungsankündigung",
      "state": "Berlin",
      "amtsgericht": "Amtsgericht Berlin (Charlottenburg)",
      "registernummer": "HRB 214297",
      "registerart": "HRB",
      "company_name": "Haser Kraft Holding GmbH",
      "company_seat": "Berlin",
      "details": "25.02.2025 (Bekanntmachungsdatum)\n\nBerlin Amtsgericht Berlin (Charlottenburg) HRB 214297\nLöschungsankündigung\n\nHaser Kraft Holding GmbH\nGesellschaft mit beschränkter Haftung\nBerlin\n\nBei der nachstehenden Gesellschaft wird das Amtslöschungsverfahren gemäß § 394 FamFG eingeleitet. Widerspruchsfrist 6 Wochen"
    },
    {
      "date": "2025-02-25",
      "id": "102164",
      "original_text": "Löschungsankündigung\nBerlin Amtsgericht Berlin (Charlottenburg) HRA 53384\nLSMC Berlin Bus 03 GmbH & Co. KG – Berlin",
      "type": "Löschungsankündigung",
      "state": "Berlin",
      "amtsgericht": "Amtsgericht Berlin (Charlottenburg)",
      "registernummer": "HRA 53384",
      "registerart": "HRA",
      "company_name": "LSMC Berlin Bus 03 GmbH & Co. KG",
      "company_seat": "Berlin",
      "details": "25.02.2025 (Bekanntmachungsdatum)\n\nBerlin Amtsgericht Berlin (Charlottenburg) HRA 53384\nLöschungsankündigung\n\nLSMC Berlin Bus 03 GmbH & Co. KG\nKommanditgesellschaft\nBerlin\n\nBei dem nachstehenden Unternehmen / der nachstehenden Gesellschaft wird das Amtslöschungsverfahren gemäß § 31 Abs. 2 HGB eingeleitet. Widerspruchsfrist 6 Wochen"
    },
    {
      "date": "2025-02-25",
      "id": "102165",
      "original_text": "Löschungsankündigung\nBerlin Amtsgericht Berlin (Charlottenburg) HRB 202274\nPDTC Operating Company GmbH – Berlin",
      "type": "Löschungsankündigung",
      "state": "Berlin",
      "amtsgericht": "Amtsgericht Berlin (Charlottenburg)",
      "registernummer": "HRB 202274",
      "registerart": "HRB",
      "company_name": "PDTC Operating Company GmbH",
      "company_seat": "Berlin",
      "details": "25.02.2025 (Bekanntmachungsdatum)\n\nBerlin Amtsgericht Berlin (Charlottenburg) HRB 202274\nLöschungsankündigung\n\nPDTC Operating Company GmbH\nGesellschaft mit beschränkter Haftung\nBerlin\n\nBei der nachstehenden Gesellschaft wird das Amtslöschungsverfahren gemäß § 394 FamFG eingeleitet. Widerspruchsfrist\n6 Wochen."
    },
    {
      "date": "2025-02-25",
      "id": "102166",
      "original_text": "Löschungsankündigung\nBerlin Amtsgericht Berlin (Charlottenburg) HRB 260754\nA.T.I Baugesellschaft mbH – Berlin",
      "type": "Löschungsankündigung",
      "state": "Berlin",
      "amtsgericht": "Amtsgericht Berlin (Charlottenburg)",
      "registernummer": "HRB 260754",
      "registerart": "HRB",
      "company_name": "A.T.I Baugesellschaft mbH",
      "company_seat": "Berlin",
      "details": "25.02.2025 (Bekanntmachungsdatum)\n\nBerlin Amtsgericht Berlin (Charlottenburg) HRB 260754\nLöschungsankündigung\n\nA.T.I Baugesellschaft mbH\nGesellschaft mit beschränkter Haftung\nBerlin\n\nBei der nachstehenden Gesellschaft wird das Amtslöschungsverfahren gemäß § 394 FamFG eingeleitet. Widerspruchsfrist 6 Wochen"
    },
    {
      "date": "2025-02-25",
      "id": "102167",
      "original_text": "Löschungsankündigung\nBerlin Amtsgericht Berlin (Charlottenburg) HRA 54190\nurban catering solutions hoyer GmbH & Co. KG – Berlin",
      "type": "Löschungsankündigung",
      "state": "Berlin",
      "amtsgericht": "Amtsgericht Berlin (Charlottenburg)",
      "registernummer": "HRA 54190",
      "registerart": "HRA",
      "company_name": "urban catering solutions hoyer GmbH & Co. KG",
      "company_seat": "Berlin",
      "details": "25.02.2025 (Bekanntmachungsdatum)\n\nBerlin Amtsgericht Berlin (Charlottenburg) HRA 54190\nLöschungsankündigung\n\nurban catering solutions hoyer GmbH & Co. KG\nKommanditgesellschaft\nBerlin\n\nBei dem nachstehenden Unternehmen / der nachstehenden Gesellschaft wird das Amtslöschungsverfahren gemäß § 31 Abs. 2 HGB eingeleitet. Widerspruchsfrist 2 Monat"
    },
    {
      "date": "2025-02-25",
      "id": "102168",
      "original_text": "Löschungsankündigung\nBaden-Württemberg Amtsgericht Freiburg HRB 7217\nBioTissue Technologies GmbH – Ihringen",
      "type": "Löschungsankündigung",
      "state": "Baden-Württemberg",
      "amtsgericht": "Amtsgericht Freiburg",
      "registernummer": "HRB 7217",
      "registerart": "HRB",
      "company_name": "BioTissue Technologies GmbH",
      "company_seat": "Ihringen",
      "details": "25.02.2025 (Bekanntmachungsdatum)\n\nBaden-Württemberg Amtsgericht Freiburg HRB 7217\nLöschungsankündigung\n\nBioTissue Technologies GmbH\nGesellschaft mit beschränkter Haftung\nIhringen\n\nDas Gericht beabsichtigt, die Gesellschaft wegen Vermögenslosigkeit im Handelsregister von Amts wegen nach § 394 FamFG zu löschen. Die Frist zur Geltendmachung eines Widerspruchs gegen die beabsichtigte Löschung ist auf einen Monat ab Veröffentlichung bestimmt."
    },
    {
      "date": "2025-02-25",
      "id": "102169",
      "original_text": "Löschungsankündigung\nBrandenburg Amtsgericht Frankfurt/Oder VR 5761\nHüttes eiserne Leute packen`s (HELP) e.V. – Eisenhüttenstadt",
      "type": "Löschungsankündigung",
      "state": "Brandenburg",
      "amtsgericht": "Amtsgericht Frankfurt/Oder",
      "registernummer": "VR 5761",
      "registerart": "VR",
      "company_name": "Hüttes eiserne Leute packen`s (HELP) e.V.",
      "company_seat": "Eisenhüttenstadt",
      "details": "25.02.2025 (Bekanntmachungsdatum)\n\nBrandenburg Amtsgericht Frankfurt/Oder VR 5761\nLöschungsankündigung\n\nHüttes eiserne Leute packen`s (HELP) e.V.\neingetragener Verein\nEisenhüttenstadt\n\nBei der nachstehenden Gesellschaft/dem nachstehenden Verein wird das Amtslöschungsverfahren gemäß § 395 FamFG eingeleitet."
    },
    {
      "date": "2025-02-25",
      "id": "102170",
      "original_text": "Löschungsankündigung\nBrandenburg Amtsgericht Potsdam HRB 25744\nLenk Metallbau UG (haftungsbeschränkt) – Milower Land",
      "type": "Löschungsankündigung",
      "state": "Brandenburg",
      "amtsgericht": "Amtsgericht Potsdam",
      "registernummer": "HRB 25744",
      "registerart": "HRB",
      "company_name": "Lenk Metallbau UG (haftungsbeschränkt)",
      "company_seat": "Milower Land",
      "details": "25.02.2025 (Bekanntmachungsdatum)\n\nBrandenburg Amtsgericht Potsdam HRB 25744\nLöschungsankündigung\n\nLenk Metallbau UG (haftungsbeschränkt)\nGesellschaft mit beschränkter Haftung\nMilower Land\n\nBei der nachstehenden Gesellschaft wird das Amtslöschungsverfahren gemäß § 394 FamFG eingeleitet. Widerspruchsfrist: 8 Wochen"
    },
    {
      "date": "2025-02-25",
      "id": "102171",
      "original_text": "Registerbekanntmachung nach dem Umwandlungsgesetz\nSchleswig-Holstein Amtsgericht Lübeck HRB 5054\nMACH Aktiengesellschaft – Lübeck",
      "type": "Registerbekanntmachung nach dem Umwandlungsgesetz",
      "state": "Schleswig-Holstein",
      "amtsgericht": "Amtsgericht Lübeck",
      "registernummer": "HRB 5054",
      "registerart": "HRB",
      "company_name": "MACH Aktiengesellschaft",
      "company_seat": "Lübeck",
      "details": "25.02.2025 (Bekanntmachungsdatum)\n\nSchleswig-Holstein Amtsgericht Lübeck HRB 5054\nRegisterbekanntmachung nach dem Umwandlungsgesetz 24.02.2025 (Eintragungsdatum)\n\nMACH Aktiengesellschaft\nAktiengesellschaft\nLübeck\n\nZu Eintragungsnummer 61 vom 24.02.2025 wird als nicht eingetragen veröffentlicht: Den Gläubigern der an der Verschmelzung beteiligten Rechtsträger ist, wenn sie binnen sechs Monaten nach dem Tag, an dem die Eintragung der Verschmelzung in das Register des Sitzes desjenigen Rechtsträgers, dessen Gläubiger sie sind, als bekannt gemacht gilt, ihren Anspruch nach Grund und Höhe schriftlich anmelden, Sicherheit zu leisten, soweit sie nicht Befriedigung verlangen können. Dieses Recht steht den Gläubigern jedoch nur zu, wenn sie glaubhaft machen, dass durch die Verschmelzung die Erfüllung ihrer Forderung gefährdet wird."
    },
    {
      "date": "2025-02-25",
      "id": "102172",
      "original_text": "Löschungsankündigung\nBerlin Amtsgericht Berlin (Charlottenburg) HRB 80977\nMutschmann's GmbH – Berlin",
      "type": "Löschungsankündigung",
      "state": "Berlin",
      "amtsgericht": "Amtsgericht Berlin (Charlottenburg)",
      "registernummer": "HRB 80977",
      "registerart": "HRB",
      "company_name": "Mutschmann's GmbH",
      "company_seat": "Berlin",
      "details": "25.02.2025 (Bekanntmachungsdatum)\n\nBerlin Amtsgericht Berlin (Charlottenburg) HRB 80977\nLöschungsankündigung\n\nMutschmann's GmbH\nGesellschaft mit beschränkter Haftung\nBerlin\n\nBei der nachstehenden Gesellschaft wird das Amtslöschungsverfahren gemäß § 394 FamFG eingeleitet. Widerspruchsfrist 6 Wochen"
    },
    {
      "date": "2025-02-25",
      "id": "102173",
      "original_text": "Löschungsankündigung\nBerlin Amtsgericht Berlin (Charlottenburg) HRB 210984\nTeam Kirschner GmbH – Berlin",
      "type": "Löschungsankündigung",
      "state": "Berlin",
      "amtsgericht": "Amtsgericht Berlin (Charlottenburg)",
      "registernummer": "HRB 210984",
      "registerart": "HRB",
      "company_name": "Team Kirschner GmbH",
      "company_seat": "Berlin",
      "details": "25.02.2025 (Bekanntmachungsdatum)\n\nBerlin Amtsgericht Berlin (Charlottenburg) HRB 210984\nLöschungsankündigung\n\nTeam Kirschner GmbH\nGesellschaft mit beschränkter Haftung\nBerlin\n\nBei der nachstehenden Gesellschaft wird das Amtslöschungsverfahren gemäß § 394 FamFG eingeleitet. Widerspruchsfrist 6 Wochen"
    },
    {
      "date": "2025-02-25",
      "id": "102174",
      "original_text": "Registerbekanntmachung nach dem Umwandlungsgesetz\nSchleswig-Holstein Amtsgericht Pinneberg HRB 18794\nGebäudedienst Wiezorrek GmbH – Weddingstedt",
      "type": "Registerbekanntmachung nach dem Umwandlungsgesetz",
      "state": "Schleswig-Holstein",
      "amtsgericht": "Amtsgericht Pinneberg",
      "registernummer": "HRB 18794",
      "registerart": "HRB",
      "company_name": "Gebäudedienst Wiezorrek GmbH",
      "company_seat": "Weddingstedt",
      "details": "25.02.2025 (Bekanntmachungsdatum)\n\nSchleswig-Holstein Amtsgericht Pinneberg HRB 18794\nRegisterbekanntmachung nach dem Umwandlungsgesetz 12.02.2025 (Eintragungsdatum)\n\nGebäudedienst Wiezorrek GmbH\nGesellschaft mit beschränkter Haftung\nWeddingstedt\n\nZu Eintragungsnummer 1 vom 12.02.2025 wird als nicht eingetragen veröffentlicht:  Den Gläubigern ist, wenn sie binnen sechs Monaten nach dem Tag, an dem die Eintragung der Umwandlung als bekannt gemacht gilt, ihren Anspruch nach Grund und Höhe schriftlich anmelden, Sicherheit zu leisten, soweit sie nicht Befriedigung verlangen können. Dieses Recht steht den Gläubigern jedoch nur zu, wenn sie glaubhaft machen, dass durch die Umwandlung die Erfüllung ihrer Forderung gefährdet wird. Das Recht, Sicherheitsleistung zu verlangen, steht Gläubigern nicht zu, die im Falle der Insolvenz ein Recht auf vorzugsweise Befriedigung aus einer Deckungsmasse haben, die nach gesetzlicher Vorschrift zu ihrem Schutz errichtet und staatlich überwacht ist."
    },
    {
      "date": "2025-02-25",
      "id": "102175",
      "original_text": "Löschungsankündigung\nBerlin Amtsgericht Berlin (Charlottenburg) HRB 251985\nAmerican Play Spielhallen GmbH – Berlin",
      "type": "Löschungsankündigung",
      "state": "Berlin",
      "amtsgericht": "Amtsgericht Berlin (Charlottenburg)",
      "registernummer": "HRB 251985",
      "registerart": "HRB",
      "company_name": "American Play Spielhallen GmbH",
      "company_seat": "Berlin",
      "details": "25.02.2025 (Bekanntmachungsdatum)\n\nBerlin Amtsgericht Berlin (Charlottenburg) HRB 251985\nLöschungsankündigung\n\nAmerican Play Spielhallen GmbH\nGesellschaft mit beschränkter Haftung\nBerlin\n\nBei der nachstehenden Gesellschaft wird das Amtslöschungsverfahren gemäß § 394 FamFG eingeleitet. Widerspruchsfrist 6 Wochen"
    },
    {
      "date": "2025-02-25",
      "id": "102176",
      "original_text": "Löschungsankündigung\nBrandenburg Amtsgericht Potsdam HRB 5064\nBK Beteiligungsgesellschaft mbH Kleinmachnow – Kleinmachnow",
      "type": "Löschungsankündigung",
      "state": "Brandenburg",
      "amtsgericht": "Amtsgericht Potsdam",
      "registernummer": "HRB 5064",
      "registerart": "HRB",
      "company_name": "BK Beteiligungsgesellschaft mbH Kleinmachnow",
      "company_seat": "Kleinmachnow",
      "details": "25.02.2025 (Bekanntmachungsdatum)\n\nBrandenburg Amtsgericht Potsdam HRB 5064\nLöschungsankündigung\n\nBK Beteiligungsgesellschaft mbH Kleinmachnow\nGesellschaft mit beschränkter Haftung\nKleinmachnow\n\nBei der nachstehenden Gesellschaft wird das Amtslöschungsverfahren gemäß § 394 FamFG eingeleitet. Widerspruchsfrist: 8 Wochen"
    },
    {
      "date": "2025-02-25",
      "id": "102177",
      "original_text": "Registerbekanntmachung nach dem Umwandlungsgesetz\nBaden-Württemberg Amtsgericht Mannheim HRB 748530\nTaruna Stationeries UG (haftungsbeschränkt) – Heidelberg",
      "type": "Registerbekanntmachung nach dem Umwandlungsgesetz",
      "state": "Baden-Württemberg",
      "amtsgericht": "Amtsgericht Mannheim",
      "registernummer": "HRB 748530",
      "registerart": "HRB",
      "company_name": "Taruna Stationeries UG (haftungsbeschränkt)",
      "company_seat": "Heidelberg",
      "details": "25.02.2025 (Bekanntmachungsdatum)\n\nBaden-Württemberg Amtsgericht Mannheim HRB 748530\nRegisterbekanntmachung nach dem Umwandlungsgesetz 25.02.2025 (Eintragungsdatum)\n\nTaruna Stationeries UG (haftungsbeschränkt)\nGesellschaft mit beschränkter Haftung\nHeidelberg\n\nDen Gläubigern der an der Verschmelzung beteiligten Rechtsträger ist, wenn sie binnen sechs Monaten nach dem Tag, an dem die Eintragung der Verschmelzung in das Register des Sitzes desjenigen Rechtsträgers, dessen Gläubiger sie sind, nach § 19 Abs. 3 UmwG als bekanntgemacht gilt, ihren Anspruch nach Grund und Höhe schriftlich anmelden, Sicherheit zu leisten, soweit sie nicht Befriedigung verlangen können. Dieses Recht steht den Gläubigern jedoch nur zu, wenn sie glaubhaft machen, dass durch die Verschmelzung die Erfüllung ihrer Forderung gefährdet wird."
    },
    {
      "date": "2025-02-25",
      "id": "102178",
      "original_text": "Registerbekanntmachung nach dem Umwandlungsgesetz\nBerlin Amtsgericht Berlin (Charlottenburg) HRB 236292\nBlockBrix GmbH – Berlin",
      "type": "Registerbekanntmachung nach dem Umwandlungsgesetz",
      "state": "Berlin",
      "amtsgericht": "Amtsgericht Berlin (Charlottenburg)",
      "registernummer": "HRB 236292",
      "registerart": "HRB",
      "company_name": "BlockBrix GmbH",
      "company_seat": "Berlin",
      "details": "25.02.2025 (Bekanntmachungsdatum)\n\nBerlin Amtsgericht Berlin (Charlottenburg) HRB 236292\nRegisterbekanntmachung nach dem Umwandlungsgesetz 24.02.2025 (Eintragungsdatum)\n\nBlockBrix GmbH\nGesellschaft mit beschränkter Haftung\nBerlin\n\nZu Eintragungsnummer 2 vom 24.02.2025 wird als nicht eingetragen veröffentlicht: Den Gläubigern ist, wenn sie binnen sechs Monaten nach dem Tag, an dem die Eintragung der Umwandlung als bekannt gemacht gilt, ihren Anspruch nach Grund und Höhe schriftlich anmelden, Sicherheit zu leisten, soweit sie nicht Befriedigung verlangen können. Dieses Recht steht den Gläubigern jedoch nur zu, wenn sie glaubhaft machen, dass durch die Umwandlung die Erfüllung ihrer Forderung gefährdet wird. Das Recht, Sicherheitsleistung zu verlangen, steht Gläubigern nicht zu, die im Falle der Insolvenz ein Recht auf vorzugsweise Befriedigung aus einer Deckungsmasse haben, die nach gesetzlicher Vorschrift zu ihrem Schutz errichtet und staatlich überwacht ist."
    },
    {
      "date": "2025-02-25",
      "id": "102179",
      "original_text": "Löschungsankündigung\nBerlin Amtsgericht Berlin (Charlottenburg) HRA 48130\nRendom GmbH & Co. KG – Berlin",
      "type": "Löschungsankündigung",
      "state": "Berlin",
      "amtsgericht": "Amtsgericht Berlin (Charlottenburg)",
      "registernummer": "HRA 48130",
      "registerart": "HRA",
      "company_name": "Rendom GmbH & Co. KG",
      "company_seat": "Berlin",
      "details": "25.02.2025 (Bekanntmachungsdatum)\n\nBerlin Amtsgericht Berlin (Charlottenburg) HRA 48130\nLöschungsankündigung\n\nRendom GmbH & Co. KG\nKommanditgesellschaft\nBerlin\n\nBei dem nachstehenden Unternehmen / der nachstehenden Gesellschaft wird das Amtslöschungsverfahren gemäß § 31 Abs. 2 HGB eingeleitet. Widerspruchsfrist 2 Monate"
    },
    {
      "date": "2025-02-25",
      "id": "102180",
      "original_text": "Einreichung neuer Dokumente\nSchleswig-Holstein Amtsgericht Lübeck HRB 2330\nEUROIMMUN Medizinische Labordiagnostika AG – Lübeck",
      "type": "Einreichung neuer Dokumente",
      "state": "Schleswig-Holstein",
      "amtsgericht": "Amtsgericht Lübeck",
      "registernummer": "HRB 2330",
      "registerart": "HRB",
      "company_name": "EUROIMMUN Medizinische Labordiagnostika AG",
      "company_seat": "Lübeck",
      "details": "25.02.2025 (Bekanntmachungsdatum)\n\nSchleswig-Holstein Amtsgericht Lübeck HRB 2330\nEinreichung neuer Dokumente\n\nEUROIMMUN Medizinische Labordiagnostika AG\nAktiengesellschaft\nLübeck\n\nAls nicht eingetragen wird veröffentlicht: Die Gesellschaft hat eine aktuelle Liste der Aufsichtsratsmitglieder zum Handelsregister eingereicht."
    },
    {
      "date": "2025-02-25",
      "id": "102181",
      "original_text": "Einreichung neuer Dokumente\nMecklenburg-Vorpommern Amtsgericht Schwerin HRB 14177\nAbfallwirtschaftsgesellschaft Ludwigslust-Parchim mbH – Ludwigslust",
      "type": "Einreichung neuer Dokumente",
      "state": "Mecklenburg-Vorpommern",
      "amtsgericht": "Amtsgericht Schwerin",
      "registernummer": "HRB 14177",
      "registerart": "HRB",
      "company_name": "Abfallwirtschaftsgesellschaft Ludwigslust-Parchim mbH",
      "company_seat": "Ludwigslust",
      "details": "25.02.2025 (Bekanntmachungsdatum)\n\nMecklenburg-Vorpommern Amtsgericht Schwerin HRB 14177\nEinreichung neuer Dokumente 25.02.2025 (Eintragungsdatum)\n\nAbfallwirtschaftsgesellschaft Ludwigslust-Parchim mbH\nGesellschaft mit beschränkter Haftung\nLudwigslust\n\nEine Liste der Mitglieder des Aufsichtsrats ist zum Handelsregister eingereicht worden."
    },
    {
      "date": "2025-02-25",
      "id": "102182",
      "original_text": "Löschungsankündigung\nBerlin Amtsgericht Berlin (Charlottenburg) HRB 108423\nRiemannstraße Berlin Immobilien GmbH – Berlin",
      "type": "Löschungsankündigung",
      "state": "Berlin",
      "amtsgericht": "Amtsgericht Berlin (Charlottenburg)",
      "registernummer": "HRB 108423",
      "registerart": "HRB",
      "company_name": "Riemannstraße Berlin Immobilien GmbH",
      "company_seat": "Berlin",
      "details": "25.02.2025 (Bekanntmachungsdatum)\n\nBerlin Amtsgericht Berlin (Charlottenburg) HRB 108423\nLöschungsankündigung\n\nRiemannstraße Berlin Immobilien GmbH\nGesellschaft mit beschränkter Haftung\nBerlin\n\nBei der nachstehenden Gesellschaft wird das Amtslöschungsverfahren gemäß § 394 FamFG eingeleitet. Widerspruchsfrist: 6 Wochen."
    },
    {
      "date": "2025-02-25",
      "id": "102183",
      "original_text": "Löschungsankündigung\nBaden-Württemberg Amtsgericht Mannheim HRB 715947\n\"sehen was kommt\" Verwaltungs UG (haftungsbeschränkt) – Oftersheim",
      "type": "Löschungsankündigung",
      "state": "Baden-Württemberg",
      "amtsgericht": "Amtsgericht Mannheim",
      "registernummer": "HRB 715947",
      "registerart": "HRB",
      "company_name": "\"sehen was kommt\" Verwaltungs UG (haftungsbeschränkt)",
      "company_seat": "Oftersheim",
      "details": "25.02.2025 (Bekanntmachungsdatum)\n\nBaden-Württemberg Amtsgericht Mannheim HRB 715947\nLöschungsankündigung\n\n\"sehen was kommt\" Verwaltungs UG (haftungsbeschränkt)\nGesellschaft mit beschränkter Haftung\nOftersheim\n\nAls nicht eingetragen wird bekanntgemacht:\nDas Gericht beabsichtigt, die Gesellschaft wegen Vermögenslosigkeit im Handelsregister von Amts wegen nach § 394 FamFG zu löschen. Die Frist zur Geltendmachung eines Widerspruchs gegen die beabsichtigte Löschung ist auf einen Monat ab Veröffentlichung bestimmt."
    },
    {
      "date": "2025-02-25",
      "id": "102184",
      "original_text": "Löschungsankündigung\nSaarland Amtsgericht Saarbrücken HRB 109437\nJanis Dachdecker Service UG (haftungsbeschränkt) – Wadgassen",
      "type": "Löschungsankündigung",
      "state": "Saarland",
      "amtsgericht": "Amtsgericht Saarbrücken",
      "registernummer": "HRB 109437",
      "registerart": "HRB",
      "company_name": "Janis Dachdecker Service UG (haftungsbeschränkt)",
      "company_seat": "Wadgassen",
      "details": "25.02.2025 (Bekanntmachungsdatum)\n\nSaarland Amtsgericht Saarbrücken HRB 109437\nLöschungsankündigung\n\nJanis Dachdecker Service UG (haftungsbeschränkt)\nGesellschaft mit beschränkter Haftung\nWadgassen\n\nEs ist beabsichtigt, die Gesellschaft von Amts wegen gemäß § 394 FamFG wegen Vermögenslosigkeit zu löschen.\nGegen die Löschung von Amts wegen ist das Rechtsmittel des Widerspruchs statthaft. Der Widerspruch ist binnen einer Frist zwei Monaten beginnend mit dem Tag dieser Veröffentlichung durch Einreichen eines Widerspruchsschreibens -schriftlich oder zur Niederschrift der Geschäftsstelle beim Amtsgericht Saarbrücken, -zentrales Handelsregister-, Mainzerstr.178, 66121 Saarbrücken einzulegen.\nDer Widerspruch muss die Bezeichnung der angefochtenen Löschungsankündigung enthalten sowie die Erklärung, dass Widerspruch eingelegt wird. Er ist vom Widerspruchsführer oder seinem Bevollmächtigten zu unterzeichnen.\nDas Widerspruchsschreiben kann auch in der Form eines elektronischen Dokumentes eingereicht werden, das mit einer qualifizierten elektronischen Signatur nach dem Signaturgesetz versehen sein muss (§§ 14 Abs. 2 FamFG, 130a, 298 ZPO)."
    },
    {
      "date": "2025-02-25",
      "id": "102185",
      "original_text": "Registerbekanntmachung nach dem Umwandlungsgesetz\nBaden-Württemberg Amtsgericht Stuttgart HRB 771494\nPGS healthcare GmbH – Herrenberg",
      "type": "Registerbekanntmachung nach dem Umwandlungsgesetz",
      "state": "Baden-Württemberg",
      "amtsgericht": "Amtsgericht Stuttgart",
      "registernummer": "HRB 771494",
      "registerart": "HRB",
      "company_name": "PGS healthcare GmbH",
      "company_seat": "Herrenberg",
      "details": "25.02.2025 (Bekanntmachungsdatum)\n\nBaden-Württemberg Amtsgericht Stuttgart HRB 771494\nRegisterbekanntmachung nach dem Umwandlungsgesetz 25.02.2025 (Eintragungsdatum)\n\nPGS healthcare GmbH\nGesellschaft mit beschränkter Haftung\nHerrenberg\n\nAls nicht eingetragen wird bekanntgemacht:\nDen Gläubigern der an der Verschmelzung beteiligten Rechtsträger ist, wenn sie binnen sechs Monaten nach dem Tag, an dem die Eintragung der Verschmelzung in das Register des Sitzes desjenigen Rechtsträgers, dessen Gläubiger sie sind, nach § 19 Abs. 3 UmwG als bekanntgemacht gilt, ihren Anspruch nach Grund und Höhe schriftlich anmelden, Sicherheit zu leisten, soweit sie nicht Befriedigung verlangen können. Dieses Recht steht den Gläubigern jedoch nur zu, wenn sie glaubhaft machen, dass durch die Verschmelzung die Erfüllung ihrer Forderung gefährdet wird."
    },
    {
      "date": "2025-02-25",
      "id": "102186",
      "original_text": "Registerbekanntmachung nach dem Umwandlungsgesetz\nSchleswig-Holstein Amtsgericht Lübeck HRB 2480\nGreater Union Filmpalast GmbH – Lübeck",
      "type": "Registerbekanntmachung nach dem Umwandlungsgesetz",
      "state": "Schleswig-Holstein",
      "amtsgericht": "Amtsgericht Lübeck",
      "registernummer": "HRB 2480",
      "registerart": "HRB",
      "company_name": "Greater Union Filmpalast GmbH",
      "company_seat": "Lübeck",
      "details": "25.02.2025 (Bekanntmachungsdatum)\n\nSchleswig-Holstein Amtsgericht Lübeck HRB 2480\nRegisterbekanntmachung nach dem Umwandlungsgesetz 25.02.2025 (Eintragungsdatum)\n\nGreater Union Filmpalast GmbH\nGesellschaft mit beschränkter Haftung\nLübeck\n\nZu Eintragungsnummer 12 vom 25.02.2025 wird als nicht eingetragen veröffentlicht: Den Gläubigern der an der Verschmelzung beteiligten Rechtsträger ist, wenn sie binnen sechs Monaten nach dem Tag, an dem die Eintragung der Verschmelzung in das Register des Sitzes desjenigen Rechtsträgers, dessen Gläubiger sie sind, als bekannt gemacht gilt, ihren Anspruch nach Grund und Höhe schriftlich anmelden, Sicherheit zu leisten, soweit sie nicht Befriedigung verlangen können. Dieses Recht steht den Gläubigern jedoch nur zu, wenn sie glaubhaft machen, dass durch die Verschmelzung die Erfüllung ihrer Forderung gefährdet wird."
    },
    {
      "date": "2025-02-25",
      "id": "102187",
      "original_text": "Registerbekanntmachung nach dem Umwandlungsgesetz\nSchleswig-Holstein Amtsgericht Lübeck HRB 16986\nMarco Raddatz GmbH – Ammersbek",
      "type": "Registerbekanntmachung nach dem Umwandlungsgesetz",
      "state": "Schleswig-Holstein",
      "amtsgericht": "Amtsgericht Lübeck",
      "registernummer": "HRB 16986",
      "registerart": "HRB",
      "company_name": "Marco Raddatz GmbH",
      "company_seat": "Ammersbek",
      "details": "25.02.2025 (Bekanntmachungsdatum)\n\nSchleswig-Holstein Amtsgericht Lübeck HRB 16986\nRegisterbekanntmachung nach dem Umwandlungsgesetz 24.02.2025 (Eintragungsdatum)\n\nMarco Raddatz GmbH\nGesellschaft mit beschränkter Haftung\nAmmersbek\n\nZu Eintragungsnummer 2 vom 24.02.2025 wird als nicht eingetragen veröffentlicht: Den Gläubigern der an der Verschmelzung beteiligten Rechtsträger ist, wenn sie binnen sechs Monaten nach dem Tag, an dem die Eintragung der Verschmelzung in das Register des Sitzes desjenigen Rechtsträgers, dessen Gläubiger sie sind, als bekannt gemacht gilt, ihren Anspruch nach Grund und Höhe schriftlich anmelden, Sicherheit zu leisten, soweit sie nicht Befriedigung verlangen können. Dieses Recht steht den Gläubigern jedoch nur zu, wenn sie glaubhaft machen, dass durch die Verschmelzung die Erfüllung ihrer Forderung gefährdet wird."
    },
    {
      "date": "2025-02-25",
      "id": "102188",
      "original_text": "Registerbekanntmachung nach dem Umwandlungsgesetz\nBerlin Amtsgericht Berlin (Charlottenburg) HRB 269886\nCONVIS GmbH – Berlin",
      "type": "Registerbekanntmachung nach dem Umwandlungsgesetz",
      "state": "Berlin",
      "amtsgericht": "Amtsgericht Berlin (Charlottenburg)",
      "registernummer": "HRB 269886",
      "registerart": "HRB",
      "company_name": "CONVIS GmbH",
      "company_seat": "Berlin",
      "details": "25.02.2025 (Bekanntmachungsdatum)\n\nBerlin Amtsgericht Berlin (Charlottenburg) HRB 269886\nRegisterbekanntmachung nach dem Umwandlungsgesetz 25.02.2025 (Eintragungsdatum)\n\nCONVIS GmbH\nGesellschaft mit beschränkter Haftung\nBerlin\n\nZu Eintragungsnummer 4 vom 25.02.2025 wird als nicht eingetragen veröffentlicht:\nDer andere Vertragsteil hat den Gläubigern dieses Rechtsträgers, deren Forderungen begründet worden sind, bevor die Eintragung der Beendigung dieses Vertrages in das Handelsregister nach § 10 des Handelsgesetzbuches als bekannt gemacht gilt, Sicherheit zu leisten, wenn sie sich binnen sechs Monaten nach der Bekanntmachung der Eintragung zu diesem Zweck bei ihm melden. Dieses Recht steht den Gläubigern nicht zu, die im Fall des Insolvenzverfahrens ein Recht auf vorzugsweise Befriedigung aus der Deckungsmasse haben, die nach gesetzlicher Vorschrift zu ihrem Schutz errichtet und staatlich überwacht ist."
    },
    {
      "date": "2025-02-25",
      "id": "102189",
      "original_text": "Löschungsankündigung\nBerlin Amtsgericht Berlin (Charlottenburg) HRB 126642\nPremium Glas UG (haftungsbeschränkt) – Berlin",
      "type": "Löschungsankündigung",
      "state": "Berlin",
      "amtsgericht": "Amtsgericht Berlin (Charlottenburg)",
      "registernummer": "HRB 126642",
      "registerart": "HRB",
      "company_name": "Premium Glas UG (haftungsbeschränkt)",
      "company_seat": "Berlin",
      "details": "25.02.2025 (Bekanntmachungsdatum)\n\nBerlin Amtsgericht Berlin (Charlottenburg) HRB 126642\nLöschungsankündigung\n\nPremium Glas UG (haftungsbeschränkt)\nGesellschaft mit beschränkter Haftung\nBerlin\n\nBei der nachstehenden Gesellschaft wird das Amtslöschungsverfahren gemäß § 394 FamFG eingeleitet. Widerspruchsfrist 6 Wochen"
    },
    {
      "date": "2025-02-25",
      "id": "102190",
      "original_text": "Löschungsankündigung\nBrandenburg Amtsgericht Potsdam HRB 26827\nWernst 3. Bau- und Verwaltungs GmbH – Schönwalde-Glien",
      "type": "Löschungsankündigung",
      "state": "Brandenburg",
      "amtsgericht": "Amtsgericht Potsdam",
      "registernummer": "HRB 26827",
      "registerart": "HRB",
      "company_name": "Wernst 3. Bau- und Verwaltungs GmbH",
      "company_seat": "Schönwalde-Glien",
      "details": "25.02.2025 (Bekanntmachungsdatum)\n\nBrandenburg Amtsgericht Potsdam HRB 26827\nLöschungsankündigung\n\nWernst 3. Bau- und Verwaltungs GmbH\nGesellschaft mit beschränkter Haftung\nSchönwalde-Glien\n\nBei der nachstehenden Gesellschaft wird das Amtslöschungsverfahren gemäß § 394 FamFG eingeleitet. Widerspruchsfrist: 8 Wochen."
    },
    {
      "date": "2025-02-25",
      "id": "102191",
      "original_text": "Löschungsankündigung\nSachsen Amtsgericht Chemnitz HRB 15866\nN-BAU-GMBH Hoch- und Tiefbau – Zwota",
      "type": "Löschungsankündigung",
      "state": "Sachsen",
      "amtsgericht": "Amtsgericht Chemnitz",
      "registernummer": "HRB 15866",
      "registerart": "HRB",
      "company_name": "N-BAU-GMBH Hoch- und Tiefbau",
      "company_seat": "Zwota",
      "details": "25.02.2025 (Bekanntmachungsdatum)\n\nSachsen Amtsgericht Chemnitz HRB 15866\nLöschungsankündigung 25.02.2025 (Eintragungsdatum)\n\nN-BAU-GMBH Hoch- und Tiefbau\nGesellschaft mit beschränkter Haftung\nZwota\n\nDas Registergericht beabsichtigt, die im Handelsregister eingetragene Gesellschaft von Amts wegen nach § 394 FamFG zu löschen. Die Frist zu Erhebung eines Widerspruchs gegen die beabsichtigte Löschung wird auf einen Monat festgesetzt."
    },
    {
      "date": "2025-02-25",
      "id": "102192",
      "original_text": "Einreichung neuer Dokumente\nSachsen Amtsgericht Chemnitz HRB 12122\nGelenauer Wohnungsgesellschaft mbH – Gelenau/Erzgeb.",
      "type": "Einreichung neuer Dokumente",
      "state": "Sachsen",
      "amtsgericht": "Amtsgericht Chemnitz",
      "registernummer": "HRB 12122",
      "registerart": "HRB",
      "company_name": "Gelenauer Wohnungsgesellschaft mbH",
      "company_seat": "Gelenau/Erzgeb.",
      "details": "25.02.2025 (Bekanntmachungsdatum)\n\nSachsen Amtsgericht Chemnitz HRB 12122\nEinreichung neuer Dokumente\n\nGelenauer Wohnungsgesellschaft mbH\nGesellschaft mit beschränkter Haftung\nGelenau/Erzgeb.\n\nAm 24.02.2025 wurde beim Handelsregister des Amtsgerichts Chemnitz die Liste der Mitglieder des Aufsichtsrats gemäß § 52 GmbHG eingereicht."
    },
    {
      "date": "2025-02-25",
      "id": "102193",
      "original_text": "Sonstige Registerbekanntmachung\nSachsen Amtsgericht Chemnitz HRB 30283\nAM Metals GmbH – Freiberg",
      "type": "Sonstige Registerbekanntmachung",
      "state": "Sachsen",
      "amtsgericht": "Amtsgericht Chemnitz",
      "registernummer": "HRB 30283",
      "registerart": "HRB",
      "company_name": "AM Metals GmbH",
      "company_seat": "Freiberg",
      "details": "25.02.2025 (Bekanntmachungsdatum)\n\nSachsen Amtsgericht Chemnitz HRB 30283\nSonstige Registerbekanntmachung 25.02.2025 (Eintragungsdatum)\n\nAM Metals GmbH\nGesellschaft mit beschränkter Haftung\nFreiberg\n\nDen Gläubigern der Gesellschaft, deren Forderungen begründet worden sind bevor die Eintragung der Beendigung des Gewinnabführungsvertrages in das Handelsregister nach § 10 des Handelsgesetzbuches als bekanntgemacht gilt, hat der andere Vertragsteil Sicherheit zu leisten, wenn sie sich binnen sechs Monaten nach der Bekanntmachung der Eintragung zu diesem Zweck bei ihm melden."
    },
    {
      "date": "2025-02-25",
      "id": "102194",
      "original_text": "Löschungsankündigung\nNiedersachsen Amtsgericht Hildesheim HRB 207824\nauxilium potentia - die kraft zur hilfe - UG (haftungsbeschränkt) – Sarstedt",
      "type": "Löschungsankündigung",
      "state": "Niedersachsen",
      "amtsgericht": "Amtsgericht Hildesheim",
      "registernummer": "HRB 207824",
      "registerart": "HRB",
      "company_name": "auxilium potentia - die kraft zur hilfe - UG (haftungsbeschränkt)",
      "company_seat": "Sarstedt",
      "details": "25.02.2025 (Bekanntmachungsdatum)\n\nNiedersachsen Amtsgericht Hildesheim HRB 207824\nLöschungsankündigung\n\nauxilium potentia - die kraft zur hilfe - UG (haftungsbeschränkt)\nGesellschaft mit beschränkter Haftung\nSarstedt\n\nDas Registergericht beabsichtigt, die Gesellschaft von Amts wegen nach § 394 FamFG zu löschen. Die Frist zur Erhebung eines Widerspruchs ist auf 1 Monat ab dieser Registerbekanntmachung festgesetzt."
    },
    {
      "date": "2025-02-25",
      "id": "102195",
      "original_text": "Einreichung neuer Dokumente\nNiedersachsen Amtsgericht Braunschweig HRB 210842\nVolkswagen Financial Services AG – Braunschweig",
      "type": "Einreichung neuer Dokumente",
      "state": "Niedersachsen",
      "amtsgericht": "Amtsgericht Braunschweig",
      "registernummer": "HRB 210842",
      "registerart": "HRB",
      "company_name": "Volkswagen Financial Services AG",
      "company_seat": "Braunschweig",
      "details": "25.02.2025 (Bekanntmachungsdatum)\n\nNiedersachsen Amtsgericht Braunschweig HRB 210842\nEinreichung neuer Dokumente\n\nVolkswagen Financial Services AG\nAktiengesellschaft\nBraunschweig\n\nDie Liste der Mitglieder des Aufsichtsrats wurde beim Registergericht eingereicht."
    },
    {
      "date": "2025-02-25",
      "id": "102196",
      "original_text": "Registerbekanntmachung nach dem Umwandlungsgesetz\nNiedersachsen Amtsgericht Oldenburg (Oldenburg) HRA 3317\nRolf Rabe Verwaltungs- und Beteiligungs GmbH und Co. Kommanditgesellschaft – Hatten",
      "type": "Registerbekanntmachung nach dem Umwandlungsgesetz",
      "state": "Niedersachsen",
      "amtsgericht": "Amtsgericht Oldenburg (Oldenburg)",
      "registernummer": "HRA 3317",
      "registerart": "HRA",
      "company_name": "Rolf Rabe Verwaltungs- und Beteiligungs GmbH und Co. Kommanditgesellschaft",
      "company_seat": "Hatten",
      "details": "25.02.2025 (Bekanntmachungsdatum)\n\nNiedersachsen Amtsgericht Oldenburg (Oldenburg) HRA 3317\nRegisterbekanntmachung nach dem Umwandlungsgesetz 25.02.2025 (Eintragungsdatum)\n\nRolf Rabe Verwaltungs- und Beteiligungs GmbH und Co. Kommanditgesellschaft\nKommanditgesellschaft\nHatten\n\nDen Gläubigern der an der formwechselnden Umwandlung beteiligten Rechtsträger ist, wenn sie binnen sechs Monaten nach dem Tag, an dem die Eintragung der Umwandlung in das Register des Sitzes desjenigen Rechtsträgers, dessen Gläubiger sie sind, nach § 19 Abs. 3 UmwG als bekannt gemacht gilt, ihren Anspruch nach Grund und Höhe schriftlich anmelden, Sicherheit zu leisten, soweit sie nicht Befriedigung verlangen können. Dieses Recht steht den Gläubigern jedoch nur zu, wenn sie glaubhaft machen, dass durch die formwechselnde Umwandlung die Erfüllung der Forderung gefährdet wird."
    },
    {
      "date": "2025-02-25",
      "id": "102197",
      "original_text": "Löschungsankündigung\nNiedersachsen Amtsgericht Tostedt HRB 3759\nI P V Pharma Vertrieb GmbH – Bendestorf",
      "type": "Löschungsankündigung",
      "state": "Niedersachsen",
      "amtsgericht": "Amtsgericht Tostedt",
      "registernummer": "HRB 3759",
      "registerart": "HRB",
      "company_name": "I P V Pharma Vertrieb GmbH",
      "company_seat": "Bendestorf",
      "details": "25.02.2025 (Bekanntmachungsdatum)\n\nNiedersachsen Amtsgericht Tostedt HRB 3759\nLöschungsankündigung 25.02.2025 (Eintragungsdatum)\n\nI P V  Pharma Vertrieb GmbH\nGesellschaft mit beschränkter Haftung\nBendestorf\n\nDas Registergericht beabsichtigt, die Gesellschaft von Amts wegen nach § 394 FamFG zu löschen. Die Frist zur Erhebung eines Widerspruchs ist auf 1 Monat ab dieser Registerbekanntmachung festgesetzt."
    },
    {
      "date": "2025-02-25",
      "id": "102198",
      "original_text": "Einreichung neuer Dokumente\nNiedersachsen Amtsgericht Hannover HRB 6580\nTUI AG – Hannover und Berlin",
      "type": "Einreichung neuer Dokumente",
      "state": "Niedersachsen",
      "amtsgericht": "Amtsgericht Hannover",
      "registernummer": "HRB 6580",
      "registerart": "HRB",
      "company_name": "TUI AG",
      "company_seat": "Hannover und Berlin",
      "details": "25.02.2025 (Bekanntmachungsdatum)\n\nNiedersachsen Amtsgericht Hannover HRB 6580\nEinreichung neuer Dokumente 25.02.2025 (Eintragungsdatum)\n\nTUI AG\nAktiengesellschaft\nHannover und Berlin\n\nDie Liste der Mitglieder des Aufsichtsrats wurde beim Registergericht eingereicht."
    },
    {
      "date": "2025-02-25",
      "id": "102199",
      "original_text": "Einreichung neuer Dokumente\nNiedersachsen Amtsgericht Hildesheim HRB 2484\nHarzwasserwerke Gesellschaft mit beschränkter Haftung – Hildesheim",
      "type": "Einreichung neuer Dokumente",
      "state": "Niedersachsen",
      "amtsgericht": "Amtsgericht Hildesheim",
      "registernummer": "HRB 2484",
      "registerart": "HRB",
      "company_name": "Harzwasserwerke Gesellschaft mit beschränkter Haftung",
      "company_seat": "Hildesheim",
      "details": "25.02.2025 (Bekanntmachungsdatum)\n\nNiedersachsen Amtsgericht Hildesheim HRB 2484\nEinreichung neuer Dokumente\n\nHarzwasserwerke Gesellschaft mit beschränkter Haftung\nGesellschaft mit beschränkter Haftung\nHildesheim\n\nDie Liste der Mitglieder des Aufsichtsrats wurde beim Registergericht eingereicht."
    },
    {
      "date": "2025-02-25",
      "id": "102200",
      "original_text": "Einreichung neuer Dokumente\nRheinland-Pfalz Amtsgericht Ludwigshafen a.Rhein (Ludwigshafen) HRB 5267\nLucura Versicherungs AG – Ludwigshafen/Rh.",
      "type": "Einreichung neuer Dokumente",
      "state": "Rheinland-Pfalz",
      "amtsgericht": "Amtsgericht Ludwigshafen a.Rhein (Ludwigshafen)",
      "registernummer": "HRB 5267",
      "registerart": "HRB",
      "company_name": "Lucura Versicherungs AG",
      "company_seat": "Ludwigshafen/Rh.",
      "details": "25.02.2025 (Bekanntmachungsdatum)\n\nRheinland-Pfalz Amtsgericht Ludwigshafen a.Rhein (Ludwigshafen) HRB 5267\nEinreichung neuer Dokumente\n\nLucura Versicherungs AG\nAktiengesellschaft\nLudwigshafen/Rh.\n\nDem Registergericht ist eine neue Liste der Mitglieder des Aufsichtsrates eingereicht worden."
    },
    {
      "date": "2025-02-25",
      "id": "102201",
      "original_text": "Registerbekanntmachung nach dem Umwandlungsgesetz\nRheinland-Pfalz Amtsgericht Mainz VR 1658\nLeichtathletik-Verband Rheinhessen e.V. – Mainz",
      "type": "Registerbekanntmachung nach dem Umwandlungsgesetz",
      "state": "Rheinland-Pfalz",
      "amtsgericht": "Amtsgericht Mainz",
      "registernummer": "VR 1658",
      "registerart": "VR",
      "company_name": "Leichtathletik-Verband Rheinhessen e.V.",
      "company_seat": "Mainz",
      "details": "25.02.2025 (Bekanntmachungsdatum)\n\nRheinland-Pfalz Amtsgericht Mainz VR 1658\nRegisterbekanntmachung nach dem Umwandlungsgesetz 25.02.2025 (Eintragungsdatum)\n\nLeichtathletik-Verband Rheinhessen e.V.\neingetragener Verein\nMainz\n\nAls nicht eingetragen wird veröffentlicht: Den Gläubigern der an der Verschmelzung beteiligten Rechtsträger ist, wenn sie binnen sechs Monaten nach dem Tag, an dem die Eintragung der Verschmelzung in das Register des Sitzes desjenigen Rechtsträgers,dessen Gläubiger sie sind, nach § 19 Abs. 3 UmwG als bekannt gemacht gilt, ihren Anspruch nach Grund und Höhe schriftlich anmelden, Sicherheit zu leisten, soweit sie nicht Befriedigung verlangen können. Dieses Recht steht den Gläubigern jedoch nur zu, wenn sie glaubhaft machen, dass durch die Verschmelzung die Erfüllung der Forderung gefährdet wird."
    },
    {
      "date": "2025-02-25",
      "id": "102202",
      "original_text": "Löschungsankündigung\nRheinland-Pfalz Amtsgericht Wittlich HRB 12305\nTSE Technische Sicherheits-Einrichtungen für Arbeitsschutz GmbH – Nohn",
      "type": "Löschungsankündigung",
      "state": "Rheinland-Pfalz",
      "amtsgericht": "Amtsgericht Wittlich",
      "registernummer": "HRB 12305",
      "registerart": "HRB",
      "company_name": "TSE Technische Sicherheits-Einrichtungen für Arbeitsschutz GmbH",
      "company_seat": "Nohn",
      "details": "25.02.2025 (Bekanntmachungsdatum)\n\nRheinland-Pfalz Amtsgericht Wittlich HRB 12305\nLöschungsankündigung\n\nTSE Technische Sicherheits-Einrichtungen für Arbeitsschutz GmbH\nGesellschaft mit beschränkter Haftung\nNohn\n\nDas Registergericht beabsichtigt die Gesellschaft von Amts wegen nach § 394 FamFG zu löschen. Die Frist zur Erhebung eines Widerspruchs ist auf einen Monat festgesetzt."
    },
    {
      "date": "2025-02-25",
      "id": "102203",
      "original_text": "Einreichung neuer Dokumente\nRheinland-Pfalz Amtsgericht Landau HRB 31444\nEnergie Südpfalz Shared Service GmbH – Landau in der Pfalz",
      "type": "Einreichung neuer Dokumente",
      "state": "Rheinland-Pfalz",
      "amtsgericht": "Amtsgericht Landau",
      "registernummer": "HRB 31444",
      "registerart": "HRB",
      "company_name": "Energie Südpfalz Shared Service GmbH",
      "company_seat": "Landau in der Pfalz",
      "details": "25.02.2025 (Bekanntmachungsdatum)\n\nRheinland-Pfalz Amtsgericht Landau HRB 31444\nEinreichung neuer Dokumente\n\nEnergie Südpfalz Shared Service GmbH\nGesellschaft mit beschränkter Haftung\nLandau in der Pfalz\n\nDem Registergericht ist eine neue Liste der Mitglieder des Aufsichtsrates eingereicht worden."
    },
    {
      "date": "2025-02-25",
      "id": "102204",
      "original_text": "Registerbekanntmachung nach dem Umwandlungsgesetz\nBremen Amtsgericht Bremen VR 4813\nHaus der Zukunft e.V. – Bremen",
      "type": "Registerbekanntmachung nach dem Umwandlungsgesetz",
      "state": "Bremen",
      "amtsgericht": "Amtsgericht Bremen",
      "registernummer": "VR 4813",
      "registerart": "VR",
      "company_name": "Haus der Zukunft e.V.",
      "company_seat": "Bremen",
      "details": "25.02.2025 (Bekanntmachungsdatum)\n\nBremen Amtsgericht Bremen VR 4813\nRegisterbekanntmachung nach dem Umwandlungsgesetz 21.02.2025 (Eintragungsdatum)\n\nHaus der Zukunft e.V.\neingetragener Verein\nBremen\n\nZu Eintragungsnummer 6 vom 21.02.2025 wird als nicht eingetragen veröffentlicht: Den Gläubigern der an der Verschmelzung beteiligten Rechtsträger ist, wenn sie binnen sechs Monaten nach dem Tag, an dem die Eintragung der Verschmelzung in das Register des Sitzes desjenigen Rechtsträgers, dessen Gläubiger sie sind, als bekannt gemacht gilt, ihren Anspruch nach Grund und Höhe schriftlich anmelden, Sicherheit zu leisten, soweit sie nicht Befriedigung verlangen können. Dieses Recht steht den Gläubigern jedoch nur zu, wenn sie glaubhaft machen, dass durch die Verschmelzung die Erfüllung ihrer Forderung gefährdet wird. Das Recht, Sicherheitsleistung zu verlangen, steht Gläubigern nicht zu, die im Falle der Insolvenz ein Recht auf vorzugsweise Befriedigung aus einer Deckungsmasse haben, die nach gesetzlicher Vorschrift zu ihrem Schutz errichtet und staatlich überwacht ist."
    },
    {
      "date": "2025-02-25",
      "id": "102205",
      "original_text": "Löschungsankündigung\nBremen Amtsgericht Bremen HRB 11960\nALLGRUND Wohnungsverwaltungsgesellschaft mbH – Bremen",
      "type": "Löschungsankündigung",
      "state": "Bremen",
      "amtsgericht": "Amtsgericht Bremen",
      "registernummer": "HRB 11960",
      "registerart": "HRB",
      "company_name": "ALLGRUND Wohnungsverwaltungsgesellschaft mbH",
      "company_seat": "Bremen",
      "details": "25.02.2025 (Bekanntmachungsdatum)\n\nBremen Amtsgericht Bremen HRB 11960\nLöschungsankündigung\n\nALLGRUND Wohnungsverwaltungsgesellschaft mbH\nGesellschaft mit beschränkter Haftung\nBremen\n\nEs ist beabsichtigt die im Handelsregister eingetragene Gesellschaft von Amts wegen gemäß § 394 FamFG zu löschen. Gegen die Löschung kann beim AG Bremen schriftlich oder zu Protokoll der Geschäftsstelle Widerspruch eingelegt werden. Widerspruchsfrist 4 Wochen."
    },
    {
      "date": "2025-02-25",
      "id": "102206",
      "original_text": "Registerbekanntmachung nach dem Umwandlungsgesetz\nBremen Amtsgericht Bremen HRB 26800\nPetri & Eichen, Diakonische Kinder- und Jugendhilfe Bremen gGmbH – Bremen",
      "type": "Registerbekanntmachung nach dem Umwandlungsgesetz",
      "state": "Bremen",
      "amtsgericht": "Amtsgericht Bremen",
      "registernummer": "HRB 26800",
      "registerart": "HRB",
      "company_name": "Petri & Eichen, Diakonische Kinder- und Jugendhilfe Bremen gGmbH",
      "company_seat": "Bremen",
      "details": "25.02.2025 (Bekanntmachungsdatum)\n\nBremen Amtsgericht Bremen HRB 26800\nRegisterbekanntmachung nach dem Umwandlungsgesetz 21.02.2025 (Eintragungsdatum)\n\nPetri & Eichen, Diakonische Kinder- und Jugendhilfe Bremen gGmbH\nGesellschaft mit beschränkter Haftung\nBremen\n\nZu Eintragungsnummer 20 vom 21.02.2025 wird als nicht eingetragen veröffentlicht: Den Gläubigern der an der Verschmelzung beteiligten Rechtsträger ist, wenn sie binnen sechs Monaten nach dem Tag, an dem die Eintragung der Verschmelzung in das Register des Sitzes desjenigen Rechtsträgers, dessen Gläubiger sie sind, als bekannt gemacht gilt, ihren Anspruch nach Grund und Höhe schriftlich anmelden, Sicherheit zu leisten, soweit sie nicht Befriedigung verlangen können. Dieses Recht steht den Gläubigern jedoch nur zu, wenn sie glaubhaft machen, dass durch die Verschmelzung die Erfüllung ihrer Forderung gefährdet wird. Das Recht, Sicherheitsleistung zu verlangen, steht Gläubigern nicht zu, die im Falle der Insolvenz ein Recht auf vorzugsweise Befriedigung aus einer Deckungsmasse haben, die nach gesetzlicher Vorschrift zu ihrem Schutz errichtet und staatlich überwacht ist."
    },
    {
      "date": "2025-02-25",
      "id": "102207",
      "original_text": "Einreichung neuer Dokumente\nRheinland-Pfalz Amtsgericht Koblenz HRB 10289\nRhodius Vermögensverwaltung Gesellschaft mit beschränkter Haftung – Burgbrohl",
      "type": "Einreichung neuer Dokumente",
      "state": "Rheinland-Pfalz",
      "amtsgericht": "Amtsgericht Koblenz",
      "registernummer": "HRB 10289",
      "registerart": "HRB",
      "company_name": "Rhodius Vermögensverwaltung Gesellschaft mit beschränkter Haftung",
      "company_seat": "Burgbrohl",
      "details": "25.02.2025 (Bekanntmachungsdatum)\n\nRheinland-Pfalz Amtsgericht Koblenz HRB 10289\nEinreichung neuer Dokumente\n\nRhodius Vermögensverwaltung Gesellschaft mit beschränkter Haftung\nGesellschaft mit beschränkter Haftung\nBurgbrohl\n\nDem Registergericht ist eine neue Liste der Mitglieder des Aufsichtsrates eingereicht worden."
    },
    {
      "date": "2025-02-25",
      "id": "102208",
      "original_text": "Löschungsankündigung\nNordrhein-Westfalen Amtsgericht Kleve HRB 3830\nHSB Systemhaus GmbH – Kevelaer",
      "type": "Löschungsankündigung",
      "state": "Nordrhein-Westfalen",
      "amtsgericht": "Amtsgericht Kleve",
      "registernummer": "HRB 3830",
      "registerart": "HRB",
      "company_name": "HSB Systemhaus GmbH",
      "company_seat": "Kevelaer",
      "details": "25.02.2025 (Bekanntmachungsdatum)\n\nNordrhein-Westfalen Amtsgericht Kleve HRB 3830\nLöschungsankündigung\n\nHSB Systemhaus GmbH\nGesellschaft mit beschränkter Haftung\nKevelaer\n\nDas Registergericht beabsichtigt die Gesellschaft von Amts wegen nach § 394 FamFG zu löschen. Die Frist zur Erhebung eines Widerspruchs ist auf einen Monat festgesetzt."
    },
    {
      "date": "2025-02-25",
      "id": "102209",
      "original_text": "Löschungsankündigung\nNordrhein-Westfalen Amtsgericht Mönchengladbach HRB 18934\nGartenmönch GmbH – Erkelenz",
      "type": "Löschungsankündigung",
      "state": "Nordrhein-Westfalen",
      "amtsgericht": "Amtsgericht Mönchengladbach",
      "registernummer": "HRB 18934",
      "registerart": "HRB",
      "company_name": "Gartenmönch GmbH",
      "company_seat": "Erkelenz",
      "details": "25.02.2025 (Bekanntmachungsdatum)\n\nNordrhein-Westfalen Amtsgericht Mönchengladbach HRB 18934\nLöschungsankündigung 25.02.2025 (Eintragungsdatum)\n\nGartenmönch GmbH\nGesellschaft mit beschränkter Haftung\nErkelenz\n\nDas Registergericht beabsichtigt die Gesellschaft von Amts wegen nach § 394 FamFG zu löschen. Die Frist zur Erhebung eines Widerspruchs ist auf #DV.Fr(Text=\"Bitte wählen Sie die Widerspruchsfrist aus!\",Eingabe=\"einen Monat\",\"zwei Monate\",\"drei Monate\",\"#insert(Text=\"Freitext\")\"|\"freier Text\") festgesetzt."
    },
    {
      "date": "2025-02-25",
      "id": "102210",
      "original_text": "Einreichung neuer Dokumente\nNordrhein-Westfalen Amtsgericht Iserlohn HRB 5512\nMärkischer Gewerbepark Rosmart GmbH – Altena",
      "type": "Einreichung neuer Dokumente",
      "state": "Nordrhein-Westfalen",
      "amtsgericht": "Amtsgericht Iserlohn",
      "registernummer": "HRB 5512",
      "registerart": "HRB",
      "company_name": "Märkischer Gewerbepark Rosmart GmbH",
      "company_seat": "Altena",
      "details": "25.02.2025 (Bekanntmachungsdatum)\n\nNordrhein-Westfalen Amtsgericht Iserlohn HRB 5512\nEinreichung neuer Dokumente 25.02.2025 (Eintragungsdatum)\n\nMärkischer Gewerbepark Rosmart GmbH\nGesellschaft mit beschränkter Haftung\nAltena\n\nDem Registergericht ist eine neue Liste der Mitglieder des Aufsichtsrates eingereicht worden."
    },
    {
      "date": "2025-02-25",
      "id": "102211",
      "original_text": "Löschungsankündigung\nNordrhein-Westfalen Amtsgericht Krefeld HRB 13896\nCybergate GmbH – Krefeld",
      "type": "Löschungsankündigung",
      "state": "Nordrhein-Westfalen",
      "amtsgericht": "Amtsgericht Krefeld",
      "registernummer": "HRB 13896",
      "registerart": "HRB",
      "company_name": "Cybergate GmbH",
      "company_seat": "Krefeld",
      "details": "25.02.2025 (Bekanntmachungsdatum)\n\nNordrhein-Westfalen Amtsgericht Krefeld HRB 13896\nLöschungsankündigung\n\nCybergate GmbH\nGesellschaft mit beschränkter Haftung\nKrefeld\n\nDas Registergericht beabsichtigt die Gesellschaft von Amts wegen nach § 394 FamFG zu löschen. Die Frist zur Erhebung eines Widerspruchs ist auf einen Monat festgesetzt."
    },
    {
      "date": "2025-02-25",
      "id": "102212",
      "original_text": "Löschungsankündigung\nNordrhein-Westfalen Amtsgericht Kleve HRB 15114\nCraftEmotions GmbH – Kleve",
      "type": "Löschungsankündigung",
      "state": "Nordrhein-Westfalen",
      "amtsgericht": "Amtsgericht Kleve",
      "registernummer": "HRB 15114",
      "registerart": "HRB",
      "company_name": "CraftEmotions GmbH",
      "company_seat": "Kleve",
      "details": "25.02.2025 (Bekanntmachungsdatum)\n\nNordrhein-Westfalen Amtsgericht Kleve HRB 15114\nLöschungsankündigung\n\nCraftEmotions GmbH\nGesellschaft mit beschränkter Haftung\nKleve\n\nDas Registergericht beabsichtigt die Gesellschaft von Amts wegen nach § 394 FamFG zu löschen. Die Frist zur Erhebung eines Widerspruchs ist auf einen Monat festgesetzt."
    },
    {
      "date": "2025-02-25",
      "id": "102213",
      "original_text": "Registerbekanntmachung nach dem Umwandlungsgesetz\nNordrhein-Westfalen Amtsgericht Bonn GsR 79\nFriedrich & Schönenberger Verwaltung und Vermietung GesellschaftbR/eingetragene Gesellschaft bürgerlichen Rechts – Bonn",
      "type": "Registerbekanntmachung nach dem Umwandlungsgesetz",
      "state": "Nordrhein-Westfalen",
      "amtsgericht": "Amtsgericht Bonn",
      "registernummer": "GsR 79",
      "registerart": "GsR",
      "company_name": "Friedrich & Schönenberger Verwaltung und Vermietung GesellschaftbR/eingetragene Gesellschaft bürgerlichen Rechts",
      "company_seat": "Bonn",
      "details": "25.02.2025 (Bekanntmachungsdatum)\n\nNordrhein-Westfalen Amtsgericht Bonn GsR 79\nRegisterbekanntmachung nach dem Umwandlungsgesetz 25.02.2025 (Eintragungsdatum)\n\nFriedrich & Schönenberger Verwaltung und Vermietung GesellschaftbR/eingetragene Gesellschaft bürgerlichen Rechts\nGesellschaft bürgerlichen Rechts\nBonn\n\nDen Gläubigern der an der formwechselnden Umwandlung beteiligten Rechtsträger ist, wenn sie binnen sechs Monaten nach dem Tag, an dem die Eintragung der formwechselnden Umwandlung in das Register des Sitzes desjenigen Rechtsträgers, dessen Gläubiger sie sind, nach § 19 Absatz 3 UmwG als bekanntgemacht gilt, ihren Anspruch nach Grund und Höhe schriftlich anmelden, Sicherheit zu leisten, soweit sie nicht Befriedigung verlangen können. Dieses Recht steht den Gläubigern jedoch nur zu, wenn sie glaubhaft machen, dass durch die formwechselnden Umwandlung die Erfüllung ihrer Forderung gefährdet wird."
    },
    {
      "date": "2025-02-25",
      "id": "102214",
      "original_text": "Löschungsankündigung\nNordrhein-Westfalen Amtsgericht Krefeld HRB 16794\nMGS Global GmbH – Willich",
      "type": "Löschungsankündigung",
      "state": "Nordrhein-Westfalen",
      "amtsgericht": "Amtsgericht Krefeld",
      "registernummer": "HRB 16794",
      "registerart": "HRB",
      "company_name": "MGS Global GmbH",
      "company_seat": "Willich",
      "details": "25.02.2025 (Bekanntmachungsdatum)\n\nNordrhein-Westfalen Amtsgericht Krefeld HRB 16794\nLöschungsankündigung\n\nMGS Global GmbH\nGesellschaft mit beschränkter Haftung\nWillich\n\nDas Registergericht beabsichtigt die Gesellschaft von Amts wegen nach § 394 FamFG zu löschen. Die Frist zur Erhebung eines Widerspruchs ist auf einen Monat festgesetzt."
    },
    {
      "date": "2025-02-25",
      "id": "102215",
      "original_text": "Registerbekanntmachung nach dem Umwandlungsgesetz\nNordrhein-Westfalen Amtsgericht Iserlohn HRB 3754\nMärkisches Werk Gesellschaft mit beschränkter Haftung – Halver i. W.",
      "type": "Registerbekanntmachung nach dem Umwandlungsgesetz",
      "state": "Nordrhein-Westfalen",
      "amtsgericht": "Amtsgericht Iserlohn",
      "registernummer": "HRB 3754",
      "registerart": "HRB",
      "company_name": "Märkisches Werk Gesellschaft mit beschränkter Haftung",
      "company_seat": "Halver i. W.",
      "details": "25.02.2025 (Bekanntmachungsdatum)\n\nNordrhein-Westfalen Amtsgericht Iserlohn HRB 3754\nRegisterbekanntmachung nach dem Umwandlungsgesetz 18.02.2025 (Eintragungsdatum)\n\nMärkisches Werk Gesellschaft mit beschränkter Haftung\nGesellschaft mit beschränkter Haftung\nHalver i. W.\n\nDen Gläubigern der an der Verschmelzung beteiligten Rechtsträger ist, wenn sie binnen sechs Monaten nach dem Tag, an dem die Eintragung der Verschmelzung in das Register des Sitzes desjenigen Rechtsträgers, dessen Gläubiger sie sind, nach § 19 Absatz 3 UmwG als bekanntgemacht gilt, ihren Anspruch nach Grund und Höhe schriftlich anmelden, Sicherheit zu leisten, soweit sie nicht Befriedigung verlangen können. Dieses Recht steht den Gläubigern jedoch nur zu, wenn sie glaubhaft machen, dass durch die Verschmelzung die Erfüllung ihrer Forderung gefährdet wird."
    },
    {
      "date": "2025-02-25",
      "id": "102216",
      "original_text": "Löschungsankündigung\nNordrhein-Westfalen Amtsgericht Aachen HRB 19179\nGimex Großhandel Kleintransporte UG (haftungsbeschränkt) – Aachen",
      "type": "Löschungsankündigung",
      "state": "Nordrhein-Westfalen",
      "amtsgericht": "Amtsgericht Aachen",
      "registernummer": "HRB 19179",
      "registerart": "HRB",
      "company_name": "Gimex Großhandel Kleintransporte UG (haftungsbeschränkt)",
      "company_seat": "Aachen",
      "details": "25.02.2025 (Bekanntmachungsdatum)\n\nNordrhein-Westfalen Amtsgericht Aachen HRB 19179\nLöschungsankündigung\n\nGimex Großhandel Kleintransporte UG (haftungsbeschränkt)\nGesellschaft mit beschränkter Haftung\nAachen\n\nDas Registergericht beabsichtigt, von Amts wegen die Gesellschaft wegen Vermögenslosigkeit nach § 394 FamFG zu löschen, weil das Insolvenzverfahren Amtsgericht Aachen (Az.: 91 IN 308/16) beendet und Vermögen der Gesellschaft nicht mehr erkennbar ist.\n\nZur Geltendmachung des Widerspruchs gegen die beabsichtigte Löschung wird hiermit eine Frist von einem Monat ab Veröffentlichung dieser Ankündigung bestimmt.\n\nRechtsbehelfsbelehrung:\n\nGegen diese Verfügung kann Widerspruch eingelegt werden. Zum Widerspruch ist jeder berechtigt, der an der Unterlassung der Löschung ein berechtigtes Interesse hat.\n\nDer Widerspruch ist bei dem Amtsgericht Aachen, Adalbertsteinweg 92, 52070 Aachen schriftlich in deutscher Sprache oder zur Niederschrift der Geschäftsstelle einzulegen. Der Widerspruch kann auch zur Niederschrift der Geschäftsstelle eines jeden Amtsgerichtes abgegeben werden.\n\nDer Widerspruch muss spätestens innerhalb der gesetzten Frist nach der Bekanntgabe der Verfügung bei dem Amtsgericht Aachen eingegangen sein. Dies gilt auch dann, wenn der Widerspruch zur Niederschrift der Geschäftsstelle eines anderen Amtsgerichtes abgegeben wurde. Die Frist beginnt mit der Bekanntgabe der Verfügung durch Veröffentlichung. Fällt das Ende der Frist auf einen Sonntag, einen allgemeinen Feiertag oder Sonnabend, so endet die Frist mit Ablauf des nächsten Werktages.\n\nDer Widerspruch muss die Bezeichnung der angefochtenen Verfügung sowie die Erklärung enthalten, dass Widerspruch gegen diese Verfügung eingelegt wird. Er ist zu unterzeichnen und soll begründet werden.\n\nDie Einlegung ist auch durch Übertragung eines elektronischen Dokuments an die elektronische Poststelle des Gerichts möglich. Das elektronische Dokument muss für die Bearbeitung durch das Gericht geeignet und mit einer qualifizierten elektronischen Signatur der verantwortenden Person versehen sein oder von der verantwortenden Person signiert und auf einem sicheren Übermittlungsweg gemäß § 130 a ZPO nach näherer Maßgabe der Verordnung über die technischen Rahmenbedingungen des elektronischen Rechtsverkehrs und über das besondere elektronische Behördenpostfach (BGBl. I, S. 3803) eingereicht werden. Weitere Informationen erhalten Sie auf der Internetseite www.justiz.de."
    },
    {
      "date": "2025-02-25",
      "id": "102217",
      "original_text": "Löschungsankündigung\nNordrhein-Westfalen Amtsgericht Duisburg HRB 14197\nO.H. Stinnes Verwaltungsgesellschaft mit beschränkter Haftung – Mülheim an der Ruhr",
      "type": "Löschungsankündigung",
      "state": "Nordrhein-Westfalen",
      "amtsgericht": "Amtsgericht Duisburg",
      "registernummer": "HRB 14197",
      "registerart": "HRB",
      "company_name": "O.H. Stinnes Verwaltungsgesellschaft mit beschränkter Haftung",
      "company_seat": "Mülheim an der Ruhr",
      "details": "25.02.2025 (Bekanntmachungsdatum)\n\nNordrhein-Westfalen Amtsgericht Duisburg HRB 14197\nLöschungsankündigung\n\nO.H. Stinnes Verwaltungsgesellschaft mit beschränkter Haftung\nGesellschaft mit beschränkter Haftung\nMülheim an der Ruhr\n\nHRB 14197:\nO.H. Stinnes Verwaltungsgesellschaft mit beschränkter Haftung,\nMülheim an der Ruhr,\nDuisburger Str. 429, 45478 Mülheim an der Ruhr. Das Registergericht beabsichtigt, die im Handelsregister eingetragene Gesellschaft gemäß § 394 Absatz 1 FamFG wegen Vermögenslosigkeit von Amts wegen zu löschen. Gegen diese Verfügung kann Widerspruch eingelegt werden. Die Frist zur Erhebung eines Widerspruchs gegen die beabsichtigte Löschung von Amts wegen ist auf drei Monate festgesetzt. Rechtsbehelfsbelehrung Der Widerspruch ist bei dem Amtsgericht Duisburg, Kardinal-Galen-Str. 124-132, 47058 Duisburg schriftlich in deutscher Sprache oder zur Niederschrift der Geschäftsstelle einzulegen. Der Widerspruch kann auch zur Niederschrift der Geschäftsstelle eines jeden Amtsgerichtes abgegeben werden. Die Einlegung ist auch durch Übertragung eines elektronischen Dokuments an die elektronische Poststelle des Gerichts möglich. Das elektronische Dokument muss für die Bearbeitung durch das Gericht geeignet und mit einer qualifizierten elektronischen Signatur der verantwortenden Person versehen sein oder von der verantwortenden Person signiert und auf einem sicheren Übermittlungsweg gemäß § 130 a ZPO nach näherer Maßgabe der Verordnung über die technischen Rahmenbedingungen des elektronischen Rechtsverkehrs und über das besondere elektronische Behördenpostfach (BGBl. I, S. 3803) eingereicht werden. Weitere Informationen erhalten Sie auf der Internetseite www.justiz.de <http://www.justiz.de>. Der Widerspruch muss spätestens innerhalb der gesetzten Frist bei dem Amtsgericht Duisburg eingegangen sein. Dies gilt auch dann, wenn der Widerspruch zur Niederschrift der Geschäftsstelle eines anderen Amtsgerichtes abgegeben wurde. Die Frist beginnt mit der Veröffentlichung. Fällt das Ende der Frist auf einen Sonntag, einen allgemeinen Feiertag oder Sonnabend, so endet die Frist mit Ablauf des nächsten Werktages. Der Widerspruch muss die Bezeichnung der angefochtenen Verfügung sowie die Erklärung enthalten, dass Widerspruch gegen diese Verfügung eingelegt wird. Er ist zu unterzeichnen und soll begründet werden."
    },
    {
      "date": "2025-02-25",
      "id": "102218",
      "original_text": "Registerbekanntmachung nach dem Umwandlungsgesetz\nNordrhein-Westfalen Amtsgericht Münster VR 4870\nSUSE-Stand Up Surfen Erleben e.V. – Münster",
      "type": "Registerbekanntmachung nach dem Umwandlungsgesetz",
      "state": "Nordrhein-Westfalen",
      "amtsgericht": "Amtsgericht Münster",
      "registernummer": "VR 4870",
      "registerart": "VR",
      "company_name": "SUSE-Stand Up Surfen Erleben e.V.",
      "company_seat": "Münster",
      "details": "25.02.2025 (Bekanntmachungsdatum)\n\nNordrhein-Westfalen Amtsgericht Münster VR 4870\nRegisterbekanntmachung nach dem Umwandlungsgesetz 25.02.2025 (Eintragungsdatum)\n\nSUSE-Stand Up Surfen Erleben e.V.\neingetragener Verein\nMünster\n\nDen Gläubigern der an der Verschmelzung beteiligten Rechtsträger ist, wenn sie binnen sechs Monaten nach dem Tag, an dem die Eintragung der Verschmelzung in das Register des Sitzes desjenigen Rechtsträgers, dessen Gläubiger sie sind, nach § 19 Absatz 3 UmwG als bekanntgemacht gilt, ihren Anspruch nach Grund und Höhe schriftlich anmelden, Sicherheit zu leisten, soweit sie nicht Befriedigung verlangen können. Dieses Recht steht den Gläubigern jedoch nur zu, wenn sie glaubhaft machen, dass durch die Verschmelzung die Erfüllung ihrer Forderung gefährdet wird."
    },
    {
      "date": "2025-02-25",
      "id": "102219",
      "original_text": "Registerbekanntmachung nach dem Umwandlungsgesetz\nNordrhein-Westfalen Amtsgericht Dortmund HRB 34946\nRenoster GmbH – Lünen",
      "type": "Registerbekanntmachung nach dem Umwandlungsgesetz",
      "state": "Nordrhein-Westfalen",
      "amtsgericht": "Amtsgericht Dortmund",
      "registernummer": "HRB 34946",
      "registerart": "HRB",
      "company_name": "Renoster GmbH",
      "company_seat": "Lünen",
      "details": "25.02.2025 (Bekanntmachungsdatum)\n\nNordrhein-Westfalen Amtsgericht Dortmund HRB 34946\nRegisterbekanntmachung nach dem Umwandlungsgesetz 25.02.2025 (Eintragungsdatum)\n\nRenoster GmbH\nGesellschaft mit beschränkter Haftung\nLünen\n\nDen Gläubigern der an der Verschmelzung beteiligten Rechtsträger ist, wenn sie binnen sechs Monaten nach dem Tag, an dem die Eintragung der Verschmelzung in das Register des Sitzes desjenigen Rechtsträgers, dessen Gläubiger sie sind, nach § 19 Absatz 3 UmwG als bekanntgemacht gilt, ihren Anspruch nach Grund und Höhe schriftlich anmelden, Sicherheit zu leisten, soweit sie nicht Befriedigung verlangen können. Dieses Recht steht den Gläubigern jedoch nur zu, wenn sie glaubhaft machen, dass durch die Verschmelzung die Erfüllung ihrer Forderung gefährdet wird."
    },
    {
      "date": "2025-02-25",
      "id": "102220",
      "original_text": "Sonstige Registerbekanntmachung\nNordrhein-Westfalen Amtsgericht Siegen HRB 7478\nStuckgeschäft Bugacku Gesellschaft mit beschränkter Haftung – Olpe",
      "type": "Sonstige Registerbekanntmachung",
      "state": "Nordrhein-Westfalen",
      "amtsgericht": "Amtsgericht Siegen",
      "registernummer": "HRB 7478",
      "registerart": "HRB",
      "company_name": "Stuckgeschäft Bugacku Gesellschaft mit beschränkter Haftung",
      "company_seat": "Olpe",
      "details": "25.02.2025 (Bekanntmachungsdatum)\n\nNordrhein-Westfalen Amtsgericht Siegen HRB 7478\nSonstige Registerbekanntmachung\n\nStuckgeschäft Bugacku Gesellschaft mit beschränkter Haftung\nGesellschaft mit beschränkter Haftung\nOlpe\n\nDas Registergericht beabsichtigt, den im Handelsregister eingetragenen Geschäftsführer der Gesellschaft gemäß § 395 Abs. 1 FamFG von Amts wegen zu löschen. Die Frist zur Erhebung eines Widerspruchs gegen die beabsichtigte Löschung von Amts wegen ist auf einen Monat festgesetzt."
    },
    {
      "date": "2025-02-25",
      "id": "102221",
      "original_text": "Einreichung neuer Dokumente\nNordrhein-Westfalen Amtsgericht Köln HRB 110044\nZurich Life Legacy Versicherung AG (Deutschland) – Leverkusen",
      "type": "Einreichung neuer Dokumente",
      "state": "Nordrhein-Westfalen",
      "amtsgericht": "Amtsgericht Köln",
      "registernummer": "HRB 110044",
      "registerart": "HRB",
      "company_name": "Zurich Life Legacy Versicherung AG (Deutschland)",
      "company_seat": "Leverkusen",
      "details": "25.02.2025 (Bekanntmachungsdatum)\n\nNordrhein-Westfalen Amtsgericht Köln HRB 110044\nEinreichung neuer Dokumente\n\nZurich Life Legacy Versicherung AG (Deutschland)\nAktiengesellschaft\nLeverkusen\n\nDem Registergericht ist eine neue Liste der Mitglieder des Aufsichtsrates eingereicht worden."
    },
    {
      "date": "2025-02-25",
      "id": "102222",
      "original_text": "Registerbekanntmachung nach dem Umwandlungsgesetz\nNordrhein-Westfalen Amtsgericht Münster VR 2080\nMarine-Jugend-Münster e.V. 1964 – Münster",
      "type": "Registerbekanntmachung nach dem Umwandlungsgesetz",
      "state": "Nordrhein-Westfalen",
      "amtsgericht": "Amtsgericht Münster",
      "registernummer": "VR 2080",
      "registerart": "VR",
      "company_name": "Marine-Jugend-Münster e.V. 1964",
      "company_seat": "Münster",
      "details": "25.02.2025 (Bekanntmachungsdatum)\n\nNordrhein-Westfalen Amtsgericht Münster VR 2080\nRegisterbekanntmachung nach dem Umwandlungsgesetz 25.02.2025 (Eintragungsdatum)\n\nMarine-Jugend-Münster e.V. 1964\neingetragener Verein\nMünster\n\nDen Gläubigern der an der Verschmelzung beteiligten Rechtsträger ist, wenn sie binnen sechs Monaten nach dem Tag, an dem die Eintragung der Verschmelzung in das Register des Sitzes desjenigen Rechtsträgers, dessen Gläubiger sie sind, nach § 19 Absatz 3 UmwG als bekanntgemacht gilt, ihren Anspruch nach Grund und Höhe schriftlich anmelden, Sicherheit zu leisten, soweit sie nicht Befriedigung verlangen können. Dieses Recht steht den Gläubigern jedoch nur zu, wenn sie glaubhaft machen, dass durch die Verschmelzung die Erfüllung ihrer Forderung gefährdet wird."
    },
    {
      "date": "2025-02-25",
      "id": "102223",
      "original_text": "Löschungsankündigung\nNordrhein-Westfalen Amtsgericht Düsseldorf HRB 98307\nInfinity Group GmbH – Monheim am Rhein",
      "type": "Löschungsankündigung",
      "state": "Nordrhein-Westfalen",
      "amtsgericht": "Amtsgericht Düsseldorf",
      "registernummer": "HRB 98307",
      "registerart": "HRB",
      "company_name": "Infinity Group GmbH",
      "company_seat": "Monheim am Rhein",
      "details": "25.02.2025 (Bekanntmachungsdatum)\n\nNordrhein-Westfalen Amtsgericht Düsseldorf HRB 98307\nLöschungsankündigung\n\nInfinity Group GmbH\nGesellschaft mit beschränkter Haftung\nMonheim am Rhein\n\nDas Registergericht beabsichtigt die Gesellschaft von Amts wegen nach § 394 FamFG zu löschen. Die Frist zur Erhebung eines Widerspruchs ist auf 3 Wochen festgesetzt.\n\nRechtsbehelfsbelehrung:\nDas Widerspruchsrecht steht jedem zu, der an der Unterlassung der Löschung ein berechtigtes Interesse hat. Der Widerspruch ist bei dem Amtsgericht Düsseldorf -Registergericht-, Werdener Straße 1, 40227 Düsseldorf schriftlich in deutscher Sprache oder zur Niederschrift der Geschäftsstelle einzulegen. Der Widerspruch kann auch zur Niederschrift der Geschäftsstelle eines jeden Amtsgerichtes abgegeben werden. Die Einlegung ist auch durch Übertragung eines elektronischen Dokuments an die elektronische Poststelle des Gerichts möglich. Das elektronische Dokument muss für die Bearbeitung durch das Gericht geeignet und mit einer qualifizierten elektronischen Signatur der verantwortenden Person versehen sein oder von der verantwortenden Person signiert und auf einem sicheren Übermittlungsweg gemäß § 130a ZPO nach näherer Maßgabe der Verordnung über die technischen Rahmenbedingungen des elektronischen Rechtsverkehrs und über das besondere elektronische Behördenpostfach (BGBl. I, S.3803) eingereicht werden. Weitere Informationen erhalten Sie auf der Internetseite www.justiz.de.\nDer Widerspruch muss spätestens innerhalb der gesetzten Frist nach dem Datum der Bekanntmachung der Löschungsankündigung bei dem Amtsgericht - Registergericht - Düsseldorf eingegangen sein.  Dies gilt auch dann, wenn der Widerspruch zur Niederschrift der Geschäftsstelle eines anderen Amtsgerichtes abgegeben wurde. Die Frist beginnt mit dem Tage der Bekanntmachung der Löschungsankündigung in dem für die Bekanntmachung der Eintragungen in das Handelsregister bestimmten elektronischen Informations- und Kommunikationssystem nach § 10 des Handelsgesetzbuches. Fällt das Ende der Frist auf einen Sonntag, einen allgemeinen Feiertag oder Sonnabend, so endet die Frist mit Ablauf des nächsten Werktages.\nDer Widerspruch muss die Bezeichnung der angefochtenen Löschungsankündigung sowie die Erklärung enthalten, dass Widerspruch gegen diese Löschungsankündigung eingelegt wird. Er ist zu unterzeichnen und soll begründet werden."
    },
    {
      "date": "2025-02-25",
      "id": "102224",
      "original_text": "Registerbekanntmachung nach dem Umwandlungsgesetz\nNordrhein-Westfalen Amtsgericht Dortmund HRB 17477 früher Amtsgericht Lünen\nHUM Gesellschaft für Homecare und Medizintechnik mbH – Lünen",
      "type": "Registerbekanntmachung nach dem Umwandlungsgesetz",
      "state": "Nordrhein-Westfalen",
      "amtsgericht": "Amtsgericht Dortmund",
      "registernummer": "HRB 17477",
      "registerart": "HRB",
      "company_name": "HUM Gesellschaft für Homecare und Medizintechnik mbH",
      "company_seat": "Lünen",
      "former_amtsgericht": "Lünen",
      "details": "25.02.2025 (Bekanntmachungsdatum)\n\nNordrhein-Westfalen Amtsgericht Dortmund HRB 17477 früher Amtsgericht Lünen\nRegisterbekanntmachung nach dem Umwandlungsgesetz 25.02.2025 (Eintragungsdatum)\n\nHUM Gesellschaft für Homecare und Medizintechnik mbH\nGesellschaft mit beschränkter Haftung\nLünen\n\nDen Gläubigern der an der Verschmelzung beteiligten Rechtsträger ist, wenn sie binnen sechs Monaten nach dem Tag, an dem die Eintragung der Verschmelzung in das Register des Sitzes derjenigen Rechtsträger deren Gläubiger sie sind, nach § 19 Absatz 3 UmwG als bekanntgemacht gilt, ihren Anspruch nach Grund und Höhe schriftlich anmelden, Sicherheit zu leisten, soweit sie nicht Befriedigung verlangen können. Dieses Recht steht den Gläubigern jedoch nur zu, wenn sie glaubhaft machen, dass durch die Verschmelzung die Erfüllung ihrer Forderung gefährdet wird."
    },
    {
      "date": "2025-02-25",
      "id": "102225",
      "original_text": "Einreichung neuer Dokumente\nNordrhein-Westfalen Amtsgericht Düsseldorf HRB 58881\nCapgemini Outsourcing Services GmbH – Düsseldorf",
      "type": "Einreichung neuer Dokumente",
      "state": "Nordrhein-Westfalen",
      "amtsgericht": "Amtsgericht Düsseldorf",
      "registernummer": "HRB 58881",
      "registerart": "HRB",
      "company_name": "Capgemini Outsourcing Services GmbH",
      "company_seat": "Düsseldorf",
      "details": "25.02.2025 (Bekanntmachungsdatum)\n\nNordrhein-Westfalen Amtsgericht Düsseldorf HRB 58881\nEinreichung neuer Dokumente\n\nCapgemini Outsourcing Services GmbH\nGesellschaft mit beschränkter Haftung\nDüsseldorf\n\nDem Registergericht ist eine neue Liste der Mitglieder des Aufsichtsrates eingereicht worden."
    },
    {
      "date": "2025-02-25",
      "id": "102226",
      "original_text": "Löschungsankündigung\nNordrhein-Westfalen Amtsgericht Wuppertal HRB 28438\nHELLAS HANDELS GmbH – Wuppertal",
      "type": "Löschungsankündigung",
      "state": "Nordrhein-Westfalen",
      "amtsgericht": "Amtsgericht Wuppertal",
      "registernummer": "HRB 28438",
      "registerart": "HRB",
      "company_name": "HELLAS HANDELS GmbH",
      "company_seat": "Wuppertal",
      "details": "25.02.2025 (Bekanntmachungsdatum)\n\nNordrhein-Westfalen Amtsgericht Wuppertal HRB 28438\nLöschungsankündigung 24.02.2025 (Eintragungsdatum)\n\nHELLAS HANDELS GmbH\nGesellschaft mit beschränkter Haftung\nWuppertal\n\nDas Registergericht beabsichtigt die Gesellschaft von Amts wegen nach § 394 FamFG zu löschen. Die Frist zur Erhebung eines Widerspruchs ist auf einen Monat festgesetzt."
    },
    {
      "date": "2025-02-25",
      "id": "102227",
      "original_text": "Löschungsankündigung\nNordrhein-Westfalen Amtsgericht Paderborn HRB 9222\nBK-Software Beteiligungs-GmbH – Marienmünster",
      "type": "Löschungsankündigung",
      "state": "Nordrhein-Westfalen",
      "amtsgericht": "Amtsgericht Paderborn",
      "registernummer": "HRB 9222",
      "registerart": "HRB",
      "company_name": "BK-Software Beteiligungs-GmbH",
      "company_seat": "Marienmünster",
      "details": "25.02.2025 (Bekanntmachungsdatum)\n\nNordrhein-Westfalen Amtsgericht Paderborn HRB 9222\nLöschungsankündigung\n\nBK-Software Beteiligungs-GmbH\nGesellschaft mit beschränkter Haftung\nMarienmünster\n\nDas Registergericht beabsichtigt die Gesellschaft von Amts wegen nach § 394 FamFG zu löschen. Die Frist zur Erhebung eines Widerspruchs ist auf einen Monat festgesetzt."
    },
    {
      "date": "2025-02-25",
      "id": "102228",
      "original_text": "Löschungsankündigung\nHessen Amtsgericht Darmstadt HRA 86348\nC&S Consulting GmbH & Co. KG – Weiterstadt",
      "type": "Löschungsankündigung",
      "state": "Hessen",
      "amtsgericht": "Amtsgericht Darmstadt",
      "registernummer": "HRA 86348",
      "registerart": "HRA",
      "company_name": "C&S Consulting GmbH & Co. KG",
      "company_seat": "Weiterstadt",
      "details": "25.02.2025 (Bekanntmachungsdatum)\n\nHessen Amtsgericht Darmstadt HRA 86348\nLöschungsankündigung\n\nC&S Consulting GmbH & Co. KG\nKommanditgesellschaft\nWeiterstadt\n\nDas Registergericht beabsichtigt die im Handelsregister eingetragene Firma von Amts wegen nach § 394 FamFG zu löschen. Die Frist zur Erhebung eines Widerspruchs gegen die beabsichtigte Löschung wird auf 3 Monate festgesetzt."
    },
    {
      "date": "2025-02-25",
      "id": "102229",
      "original_text": "Löschungsankündigung\nHessen Amtsgericht Frankfurt am Main HRB 50363\nA-Z Dienste Pfeifer und Pfeifer Meisterbetrieb GmbH – Frankfurt am Main",
      "type": "Löschungsankündigung",
      "state": "Hessen",
      "amtsgericht": "Amtsgericht Frankfurt am Main",
      "registernummer": "HRB 50363",
      "registerart": "HRB",
      "company_name": "A-Z Dienste Pfeifer und Pfeifer Meisterbetrieb GmbH",
      "company_seat": "Frankfurt am Main",
      "details": "25.02.2025 (Bekanntmachungsdatum)\n\nHessen Amtsgericht Frankfurt am Main HRB 50363\nLöschungsankündigung 25.02.2025 (Eintragungsdatum)\n\nA-Z Dienste Pfeifer und Pfeifer Meisterbetrieb GmbH\nGesellschaft mit beschränkter Haftung\nFrankfurt am Main\n\nDas Registergericht beabsichtigt die im Handelsregister eingetragene Gesellschaft von Amts wegen nach § 394 FamFG zu löschen. Die Frist zur Erhebung eines Widerspruchs gegen die beabsichtigte Löschung wird auf 1 Monat festgesetzt."
    },
    {
      "date": "2025-02-25",
      "id": "102230",
      "original_text": "Löschungsankündigung\nHessen Amtsgericht Frankfurt am Main HRB 116439\nAgile Sales Company GmbH – Frankfurt am Main",
      "type": "Löschungsankündigung",
      "state": "Hessen",
      "amtsgericht": "Amtsgericht Frankfurt am Main",
      "registernummer": "HRB 116439",
      "registerart": "HRB",
      "company_name": "Agile Sales Company GmbH",
      "company_seat": "Frankfurt am Main",
      "details": "25.02.2025 (Bekanntmachungsdatum)\n\nHessen Amtsgericht Frankfurt am Main HRB 116439\nLöschungsankündigung\n\nAgile Sales Company GmbH\nGesellschaft mit beschränkter Haftung\nFrankfurt am Main\n\nDas Registergericht beabsichtigt die im Handelsregister eingetragene Gesellschaft von Amts wegen nach § 394 FamFG zu löschen. Die Frist zur Erhebung eines Widerspruchs gegen die beabsichtigte Löschung wird auf 1 Monat festgesetzt."
    },
    {
      "date": "2025-02-25",
      "id": "102231",
      "original_text": "Registerbekanntmachung nach dem Umwandlungsgesetz\nHessen Amtsgericht Darmstadt HRB 55156\nTrapp Holding GmbH – Trebur",
      "type": "Registerbekanntmachung nach dem Umwandlungsgesetz",
      "state": "Hessen",
      "amtsgericht": "Amtsgericht Darmstadt",
      "registernummer": "HRB 55156",
      "registerart": "HRB",
      "company_name": "Trapp Holding GmbH",
      "company_seat": "Trebur",
      "details": "25.02.2025 (Bekanntmachungsdatum)\n\nHessen Amtsgericht Darmstadt HRB 55156\nRegisterbekanntmachung nach dem Umwandlungsgesetz 25.02.2025 (Eintragungsdatum)\n\nTrapp Holding GmbH\nGesellschaft mit beschränkter Haftung\nTrebur\n\nDen Gläubigern der an der Verschmelzung beteiligten Rechtsträger ist, wenn sie binnen sechs Monaten nach dem Tag, an dem die Eintragung der Verschmelzung in das Register des Sitzes desjenigen Rechtsträgers, dessen Gläubiger sie sind, nach § 19 Absatz 3 UmwG bekannt gemacht worden ist, ihren Anspruch nach Grund und Höhe schriftlich anmelden, Sicherheit zu leisten, soweit sie nicht Befriedigung verlangen können. Dieses Recht steht den Gläubigern jedoch nur zu, wenn sie glaubhaft machen, dass durch die Verschmelzung die Erfüllung ihrer Forderung gefährdet wird."
    },
    {
      "date": "2025-02-25",
      "id": "102232",
      "original_text": "Registerbekanntmachung nach dem Umwandlungsgesetz\nHessen Amtsgericht Darmstadt HRB 52527\nDiamond Air Service GmbH – Rüsselsheim",
      "type": "Registerbekanntmachung nach dem Umwandlungsgesetz",
      "state": "Hessen",
      "amtsgericht": "Amtsgericht Darmstadt",
      "registernummer": "HRB 52527",
      "registerart": "HRB",
      "company_name": "Diamond Air Service GmbH",
      "company_seat": "Rüsselsheim",
      "details": "25.02.2025 (Bekanntmachungsdatum)\n\nHessen Amtsgericht Darmstadt HRB 52527\nRegisterbekanntmachung nach dem Umwandlungsgesetz 25.02.2025 (Eintragungsdatum)\n\nDiamond Air Service GmbH\nGesellschaft mit beschränkter Haftung\nRüsselsheim\n\nDen Gläubigern der an der Verschmelzung beteiligten Rechtsträger ist, wenn sie binnen sechs Monaten nach dem Tag, an dem die Eintragung der Verschmelzung in das Register des Sitzes desjenigen Rechtsträgers, dessen Gläubiger sie sind, nach § 19 Absatz 3 UmwG bekannt gemacht worden ist, ihren Anspruch nach Grund und Höhe schriftlich anmelden, Sicherheit zu leisten, soweit sie nicht Befriedigung verlangen können. Dieses Recht steht den Gläubigern jedoch nur zu, wenn sie glaubhaft machen, dass durch die Verschmelzung die Erfüllung ihrer Forderung gefährdet wird."
    },
    {
      "date": "2025-02-25",
      "id": "102233",
      "original_text": "Löschungsankündigung\nHessen Amtsgericht Frankfurt am Main HRB 125139\nARCHIX GmbH – Frankfurt am Main",
      "type": "Löschungsankündigung",
      "state": "Hessen",
      "amtsgericht": "Amtsgericht Frankfurt am Main",
      "registernummer": "HRB 125139",
      "registerart": "HRB",
      "company_name": "ARCHIX GmbH",
      "company_seat": "Frankfurt am Main",
      "details": "25.02.2025 (Bekanntmachungsdatum)\n\nHessen Amtsgericht Frankfurt am Main HRB 125139\nLöschungsankündigung\n\nARCHIX GmbH\nGesellschaft mit beschränkter Haftung\nFrankfurt am Main\n\nDas Registergericht beabsichtigt die im Handelsregister eingetragene Gesellschaft von Amts wegen nach § 394 FamFG zu löschen. Die Frist zur Erhebung eines Widerspruchs gegen die beabsichtigte Löschung wird auf 1 Monate festgesetzt."
    },
    {
      "date": "2025-02-25",
      "id": "102234",
      "original_text": "Registerbekanntmachung nach dem Umwandlungsgesetz\nHessen Amtsgericht Darmstadt HRA 53436\nTMG GmbH & Co. KG – Trebur",
      "type": "Registerbekanntmachung nach dem Umwandlungsgesetz",
      "state": "Hessen",
      "amtsgericht": "Amtsgericht Darmstadt",
      "registernummer": "HRA 53436",
      "registerart": "HRA",
      "company_name": "TMG GmbH & Co. KG",
      "company_seat": "Trebur",
      "details": "25.02.2025 (Bekanntmachungsdatum)\n\nHessen Amtsgericht Darmstadt HRA 53436\nRegisterbekanntmachung nach dem Umwandlungsgesetz 25.02.2025 (Eintragungsdatum)\n\nTMG GmbH & Co. KG\nKommanditgesellschaft\nTrebur\n\nDen Gläubigern der an der Verschmelzung beteiligten Rechtsträger ist, wenn sie binnen sechs Monaten nach dem Tag, an dem die Eintragung der Verschmelzung in das Register des Sitzes desjenigen Rechtsträgers, dessen Gläubiger sie sind, nach § 19 Absatz 3 UmwG bekannt gemacht worden ist, ihren Anspruch nach Grund und Höhe schriftlich anmelden, Sicherheit zu leisten, soweit sie nicht Befriedigung verlangen können. Dieses Recht steht den Gläubigern jedoch nur zu, wenn sie glaubhaft machen, dass durch die Verschmelzung die Erfüllung ihrer Forderung gefährdet wird."
    },
    {
      "date": "2025-02-25",
      "id": "102235",
      "original_text": "Löschungsankündigung\nHessen Amtsgericht Darmstadt HRB 97204\nComplete Management Services GmbH – Kelsterbach",
      "type": "Löschungsankündigung",
      "state": "Hessen",
      "amtsgericht": "Amtsgericht Darmstadt",
      "registernummer": "HRB 97204",
      "registerart": "HRB",
      "company_name": "Complete Management Services GmbH",
      "company_seat": "Kelsterbach",
      "details": "25.02.2025 (Bekanntmachungsdatum)\n\nHessen Amtsgericht Darmstadt HRB 97204\nLöschungsankündigung 25.02.2025 (Eintragungsdatum)\n\nComplete Management Services GmbH\nGesellschaft mit beschränkter Haftung\nKelsterbach\n\nDas Registergericht beabsichtigt die im Handelsregister eingetragene Gesellschaft von Amts wegen nach § 394 FamFG zu löschen. Die Frist zur Erhebung eines Widerspruchs gegen die beabsichtigte Löschung wird auf 3 Monate festgesetzt."
    },
    {
      "date": "2025-02-25",
      "id": "102236",
      "original_text": "Registerbekanntmachung nach dem Umwandlungsgesetz\nHessen Amtsgericht Darmstadt HRB 52527\nDiamond Air Service GmbH – Rüsselsheim",
      "type": "Registerbekanntmachung nach dem Umwandlungsgesetz",
      "state": "Hessen",
      "amtsgericht": "Amtsgericht Darmstadt",
      "registernummer": "HRB 52527",
      "registerart": "HRB",
      "company_name": "Diamond Air Service GmbH",
      "company_seat": "Rüsselsheim",
      "details": "25.02.2025 (Bekanntmachungsdatum)\n\nHessen Amtsgericht Darmstadt HRB 52527\nRegisterbekanntmachung nach dem Umwandlungsgesetz 25.02.2025 (Eintragungsdatum)\n\nDiamond Air Service GmbH\nGesellschaft mit beschränkter Haftung\nRüsselsheim\n\nDen Gläubigern der an der Verschmelzung beteiligten Rechtsträger ist, wenn sie binnen sechs Monaten nach dem Tag, an dem die Eintragung der Verschmelzung in das Register des Sitzes desjenigen Rechtsträgers, dessen Gläubiger sie sind, nach § 19 Absatz 3 UmwG bekannt gemacht worden ist, ihren Anspruch nach Grund und Höhe schriftlich anmelden, Sicherheit zu leisten, soweit sie nicht Befriedigung verlangen können. Dieses Recht steht den Gläubigern jedoch nur zu, wenn sie glaubhaft machen, dass durch die Verschmelzung die Erfüllung ihrer Forderung gefährdet wird."
    },
    {
      "date": "2025-02-25",
      "id": "102237",
      "original_text": "Registerbekanntmachung nach dem Umwandlungsgesetz\nHessen Amtsgericht Darmstadt HRB 54491\nDiamond Technology Center GmbH – Rüsselsheim am Main",
      "type": "Registerbekanntmachung nach dem Umwandlungsgesetz",
      "state": "Hessen",
      "amtsgericht": "Amtsgericht Darmstadt",
      "registernummer": "HRB 54491",
      "registerart": "HRB",
      "company_name": "Diamond Technology Center GmbH",
      "company_seat": "Rüsselsheim am Main",
      "details": "25.02.2025 (Bekanntmachungsdatum)\n\nHessen Amtsgericht Darmstadt HRB 54491\nRegisterbekanntmachung nach dem Umwandlungsgesetz 25.02.2025 (Eintragungsdatum)\n\nDiamond Technology Center GmbH\nGesellschaft mit beschränkter Haftung\nRüsselsheim am Main\n\nDen Gläubigern der an der Verschmelzung beteiligten Rechtsträger ist, wenn sie binnen sechs Monaten nach dem Tag, an dem die Eintragung der Verschmelzung in das Register des Sitzes desjenigen Rechtsträgers, dessen Gläubiger sie sind, nach § 19 Absatz 3 UmwG bekannt gemacht worden ist, ihren Anspruch nach Grund und Höhe schriftlich anmelden, Sicherheit zu leisten, soweit sie nicht Befriedigung verlangen können. Dieses Recht steht den Gläubigern jedoch nur zu, wenn sie glaubhaft machen, dass durch die Verschmelzung die Erfüllung ihrer Forderung gefährdet wird."
    },
    {
      "date": "2025-02-25",
      "id": "102238",
      "original_text": "Löschungsankündigung\nHessen Amtsgericht Frankfurt am Main HRB 103935\nNODA GmbH – Frankfurt am Main",
      "type": "Löschungsankündigung",
      "state": "Hessen",
      "amtsgericht": "Amtsgericht Frankfurt am Main",
      "registernummer": "HRB 103935",
      "registerart": "HRB",
      "company_name": "NODA GmbH",
      "company_seat": "Frankfurt am Main",
      "details": "25.02.2025 (Bekanntmachungsdatum)\n\nHessen Amtsgericht Frankfurt am Main HRB 103935\nLöschungsankündigung\n\nNODA GmbH\nGesellschaft mit beschränkter Haftung\nFrankfurt am Main\n\nDas Registergericht beabsichtigt die im Handelsregister eingetragene Gesellschaft von Amts wegen nach § 394 FamFG zu löschen. Die Frist zur Erhebung eines Widerspruchs gegen die beabsichtigte Löschung wird auf 1 Monat festgesetzt."
    },
    {
      "date": "2025-02-25",
      "id": "102239",
      "original_text": "Sonstige Registerbekanntmachung\nHessen Amtsgericht Frankfurt am Main HRB 120038\nCastolin Eutectic Holding GmbH – Kriftel",
      "type": "Sonstige Registerbekanntmachung",
      "state": "Hessen",
      "amtsgericht": "Amtsgericht Frankfurt am Main",
      "registernummer": "HRB 120038",
      "registerart": "HRB",
      "company_name": "Castolin Eutectic Holding GmbH",
      "company_seat": "Kriftel",
      "details": "25.02.2025 (Bekanntmachungsdatum)\n\nHessen Amtsgericht Frankfurt am Main HRB 120038\nSonstige Registerbekanntmachung\n\nCastolin Eutectic Holding GmbH\nGesellschaft mit beschränkter Haftung\nKriftel\n\nDurch eine Änderung in den Personen der Aufsichtsratsmitglieder ist eine Liste der Mitglieder des Aufsichtsrates zum Handelsregister eingereicht worden."
    },
    {
      "date": "2025-02-25",
      "id": "102240",
      "original_text": "Löschungsankündigung\nHessen Amtsgericht Königstein HRB 9883\nG & A Bau GmbH – Bad Soden am Taunus",
      "type": "Löschungsankündigung",
      "state": "Hessen",
      "amtsgericht": "Amtsgericht Königstein",
      "registernummer": "HRB 9883",
      "registerart": "HRB",
      "company_name": "G & A Bau GmbH",
      "company_seat": "Bad Soden am Taunus",
      "details": "25.02.2025 (Bekanntmachungsdatum)\n\nHessen Amtsgericht Königstein HRB 9883\nLöschungsankündigung 25.02.2025 (Eintragungsdatum)\n\nG & A Bau GmbH\nGesellschaft mit beschränkter Haftung\nBad Soden am Taunus\n\nDas Registergericht beabsichtigt die im Handelsregister eingetragene Gesellschaft von Amts wegen nach § 394 FamFG zu löschen. Die Frist zur Erhebung eines Widerspruchs gegen die beabsichtigte Löschung wird auf 3 Monate festgesetzt."
    },
    {
      "date": "2025-02-25",
      "id": "102241",
      "original_text": "Registerbekanntmachung nach dem Umwandlungsgesetz\nHessen Amtsgericht Gießen HRA 5537\nKristina Zündel e.K. – Gießen",
      "type": "Registerbekanntmachung nach dem Umwandlungsgesetz",
      "state": "Hessen",
      "amtsgericht": "Amtsgericht Gießen",
      "registernummer": "HRA 5537",
      "registerart": "HRA",
      "company_name": "Kristina Zündel e.K.",
      "company_seat": "Gießen",
      "details": "25.02.2025 (Bekanntmachungsdatum)\n\nHessen Amtsgericht Gießen HRA 5537\nRegisterbekanntmachung nach dem Umwandlungsgesetz 25.02.2025 (Eintragungsdatum)\n\nKristina Zündel e.K.\nEinzelkaufmann / Einzelkauffrau\nGießen\n\nDen Gläubigern der an der Ausgliederung beteiligten Rechtsträger ist, wenn sie binnen sechs Monaten nach dem Tag, an dem die Eintragung der Ausgliederung in das Register des Sitzes desjenigen Rechtsträgers, dessen Gläubiger sie sind, nach §§ 125, 19 Absatz 3 UmwG bekannt gemacht worden ist, ihren Anspruch nach Grund und Höhe schriftlich anmelden, Sicherheit zu leisten, soweit sie nicht Befriedigung verlangen können. Dieses Recht steht den Gläubigern jedoch nur zu, wenn sie glaubhaft machen, dass durch die Ausgliederung die Erfüllung ihrer Forderung gefährdet wird."
    },
    {
      "date": "2025-02-25",
      "id": "102242",
      "original_text": "Einreichung neuer Dokumente\nHessen Amtsgericht Darmstadt HRB 5974\nKao Germany GmbH – Darmstadt",
      "type": "Einreichung neuer Dokumente",
      "state": "Hessen",
      "amtsgericht": "Amtsgericht Darmstadt",
      "registernummer": "HRB 5974",
      "registerart": "HRB",
      "company_name": "Kao Germany GmbH",
      "company_seat": "Darmstadt",
      "details": "25.02.2025 (Bekanntmachungsdatum)\n\nHessen Amtsgericht Darmstadt HRB 5974\nEinreichung neuer Dokumente\n\nKao Germany GmbH\nGesellschaft mit beschränkter Haftung\nDarmstadt\n\nWegen Änderungen in den Personen der Aufsichtsratsmitglieder ist eine Liste der Mitglieder des Aufsichtsrates zum Handelsregister eingereicht worden."
    },
    {
      "date": "2025-02-25",
      "id": "102243",
      "original_text": "Löschungsankündigung\nHessen Amtsgericht Frankfurt am Main HRB 130932\nGLAZE Studio UG (haftungsbeschränkt) – Frankfurt am Main",
      "type": "Löschungsankündigung",
      "state": "Hessen",
      "amtsgericht": "Amtsgericht Frankfurt am Main",
      "registernummer": "HRB 130932",
      "registerart": "HRB",
      "company_name": "GLAZE Studio UG (haftungsbeschränkt)",
      "company_seat": "Frankfurt am Main",
      "details": "25.02.2025 (Bekanntmachungsdatum)\n\nHessen Amtsgericht Frankfurt am Main HRB 130932\nLöschungsankündigung\n\nGLAZE Studio UG (haftungsbeschränkt)\nGesellschaft mit beschränkter Haftung\nFrankfurt am Main\n\nDas Registergericht beabsichtigt die im Handelsregister eingetragene Gesellschaft von Amts wegen nach § 394 FamFG zu löschen. Die Frist zur Erhebung eines Widerspruchs gegen die beabsichtigte Löschung wird auf 1 Monate festgesetzt."
    },
    {
      "date": "2025-02-25",
      "id": "102244",
      "original_text": "Registerbekanntmachung nach dem Umwandlungsgesetz\nHessen Amtsgericht Darmstadt HRB 52527\nDiamond Air Service GmbH – Rüsselsheim",
      "type": "Registerbekanntmachung nach dem Umwandlungsgesetz",
      "state": "Hessen",
      "amtsgericht": "Amtsgericht Darmstadt",
      "registernummer": "HRB 52527",
      "registerart": "HRB",
      "company_name": "Diamond Air Service GmbH",
      "company_seat": "Rüsselsheim",
      "details": "25.02.2025 (Bekanntmachungsdatum)\n\nHessen Amtsgericht Darmstadt HRB 52527\nRegisterbekanntmachung nach dem Umwandlungsgesetz 25.02.2025 (Eintragungsdatum)\n\nDiamond Air Service GmbH\nGesellschaft mit beschränkter Haftung\nRüsselsheim\n\nDen Gläubigern der an der Verschmelzung beteiligten Rechtsträger ist, wenn sie binnen sechs Monaten nach dem Tag, an dem die Eintragung der Verschmelzung in das Register des Sitzes desjenigen Rechtsträgers, dessen Gläubiger sie sind, nach § 19 Absatz 3 UmwG bekannt gemacht worden ist, ihren Anspruch nach Grund und Höhe schriftlich anmelden, Sicherheit zu leisten, soweit sie nicht Befriedigung verlangen können. Dieses Recht steht den Gläubigern jedoch nur zu, wenn sie glaubhaft machen, dass durch die Verschmelzung die Erfüllung ihrer Forderung gefährdet wird."
    },
    {
      "date": "2025-02-25",
      "id": "102245",
      "original_text": "Einreichung neuer Dokumente\nHessen Amtsgericht Offenbach am Main HRB 4429\nStadtwerke Offenbach Holding GmbH – Offenbach am Main",
      "type": "Einreichung neuer Dokumente",
      "state": "Hessen",
      "amtsgericht": "Amtsgericht Offenbach am Main",
      "registernummer": "HRB 4429",
      "registerart": "HRB",
      "company_name": "Stadtwerke Offenbach Holding GmbH",
      "company_seat": "Offenbach am Main",
      "details": "25.02.2025 (Bekanntmachungsdatum)\n\nHessen Amtsgericht Offenbach am Main HRB 4429\nEinreichung neuer Dokumente\n\nStadtwerke Offenbach Holding GmbH\nGesellschaft mit beschränkter Haftung\nOffenbach am Main\n\nDurch eine Änderung in den Personen der Aufsichtsratsmitglieder ist eine Liste der Mitglieder des Aufsichtsrates zum Handelsregister eingereicht worden."
    },
    {
      "date": "2025-02-25",
      "id": "102246",
      "original_text": "Einreichung neuer Dokumente\nHessen Amtsgericht Frankfurt am Main HRB 90102\nVR Consultingpartner GmbH – Frankfurt am Main",
      "type": "Einreichung neuer Dokumente",
      "state": "Hessen",
      "amtsgericht": "Amtsgericht Frankfurt am Main",
      "registernummer": "HRB 90102",
      "registerart": "HRB",
      "company_name": "VR Consultingpartner GmbH",
      "company_seat": "Frankfurt am Main",
      "details": "25.02.2025 (Bekanntmachungsdatum)\n\nHessen Amtsgericht Frankfurt am Main HRB 90102\nEinreichung neuer Dokumente 24.02.2025 (Eintragungsdatum)\n\nVR Consultingpartner GmbH\nGesellschaft mit beschränkter Haftung\nFrankfurt am Main\n\nDurch eine Änderung in den Personen der Aufsichtsratsmitglieder ist eine Liste der Mitglieder des Aufsichtsrates zum Handelsregister eingereicht worden."
    },
    {
      "date": "2025-02-25",
      "id": "102247",
      "original_text": "Löschungsankündigung\nHessen Amtsgericht Darmstadt HRB 88748\nAMEDIA GmbH – Büttelborn",
      "type": "Löschungsankündigung",
      "state": "Hessen",
      "amtsgericht": "Amtsgericht Darmstadt",
      "registernummer": "HRB 88748",
      "registerart": "HRB",
      "company_name": "AMEDIA GmbH",
      "company_seat": "Büttelborn",
      "details": "25.02.2025 (Bekanntmachungsdatum)\n\nHessen Amtsgericht Darmstadt HRB 88748\nLöschungsankündigung\n\nAMEDIA GmbH\nGesellschaft mit beschränkter Haftung\nBüttelborn"
    }
  ]
}