{
  "date": "2025-02-12",
  "date_of_scrape": "2025-02-13T04:09:45.538Z",
  "tool_version": "0.2.0",
  "number_of_announcements": 146,
  "announcements": [
    {
      "date": "2025-02-12",
      "id": "101048",
      "original_text": "Einreichung neuer Dokumente\nBayern Amtsgericht Traunstein HRB 275\nDR. JOHANNES HEIDENHAIN GmbH – Traunreut",
      "type": "Einreichung neuer Dokumente",
      "state": "Bayern",
      "amtsgericht": "Amtsgericht Traunstein",
      "registernummer": "HRB 275",
      "registerart": "HRB",
      "company_name": "DR. JOHANNES HEIDENHAIN GmbH",
      "company_seat": "Traunreut",
      "details": "12.02.2025 (Bekanntmachungsdatum)\n\nBayern Amtsgericht Traunstein HRB 275\nEinreichung neuer Dokumente\n\nDR. JOHANNES HEIDENHAIN GmbH\nGesellschaft mit beschränkter Haftung\nTraunreut\n\nDem Amtsgericht Traunstein -Registergericht- ist eine Liste der Mitglieder des Aufsichtsrats eingereicht worden, § 52 Abs. 3 S. 2 GmbHG."
    },
    {
      "date": "2025-02-12",
      "id": "101049",
      "original_text": "Löschungsankündigung\nBayern Amtsgericht Traunstein HRB 29068\nEichental Hotel- und Gastronomiebetriebs GmbH – Prien a.Chiemsee",
      "type": "Löschungsankündigung",
      "state": "Bayern",
      "amtsgericht": "Amtsgericht Traunstein",
      "registernummer": "HRB 29068",
      "registerart": "HRB",
      "company_name": "Eichental Hotel- und Gastronomiebetriebs GmbH",
      "company_seat": "Prien a.Chiemsee",
      "details": "12.02.2025 (Bekanntmachungsdatum)\n\nBayern Amtsgericht Traunstein HRB 29068\nLöschungsankündigung\n\nEichental Hotel- und Gastronomiebetriebs GmbH\nGesellschaft mit beschränkter Haftung\nPrien a.Chiemsee\n\nDas Registergericht beabsichtigt, die im Handelsregister eingetragene Gesellschaft wegen Vermögenslosigkeit von Amts wegen nach § 394 FamFG zu löschen. Die Frist zur Erhebung eines Widerspruchs ist auf drei Monate festgesetzt."
    },
    {
      "date": "2025-02-12",
      "id": "101050",
      "original_text": "Registerbekanntmachung nach dem Umwandlungsgesetz\nBayern Amtsgericht Nürnberg HRB 32059\nFinsterer Solutions Agentur UG (haftungsbeschränkt) – Nürnberg",
      "type": "Registerbekanntmachung nach dem Umwandlungsgesetz",
      "state": "Bayern",
      "amtsgericht": "Amtsgericht Nürnberg",
      "registernummer": "HRB 32059",
      "registerart": "HRB",
      "company_name": "Finsterer Solutions Agentur UG (haftungsbeschränkt)",
      "company_seat": "Nürnberg",
      "details": "12.02.2025 (Bekanntmachungsdatum)\n\nBayern Amtsgericht Nürnberg HRB 32059\nRegisterbekanntmachung nach dem Umwandlungsgesetz 11.02.2025 (Eintragungsdatum)\n\nFinsterer Solutions Agentur UG (haftungsbeschränkt)\nGesellschaft mit beschränkter Haftung\nNürnberg\n\nDen Gläubigern der an der Verschmelzung beteiligten Rechtsträger ist, wenn sie binnen sechs Monaten nach dem Tag, an dem die Eintragung der Verschmelzung in das Register des Sitzes desjenigen Rechtsträgers, dessen Gläubiger sie sind, nach § 19 Abs. 3 UmwG als bekannt gemacht gilt, ihren Anspruch nach Grund und Höhe in Textform anmelden, Sicherheit zu leisten, soweit sie nicht Befriedigung verlangen können. Dieses Recht steht den Gläubigern jedoch nur zu, wenn sie glaubhaft machen, dass durch die Verschmelzung die Erfüllung ihrer Forderung gefährdet wird."
    },
    {
      "date": "2025-02-12",
      "id": "101051",
      "original_text": "Löschungsankündigung\nBayern Amtsgericht Nürnberg HRB 23543\nA-Event BKB GmbH – Nürnberg",
      "type": "Löschungsankündigung",
      "state": "Bayern",
      "amtsgericht": "Amtsgericht Nürnberg",
      "registernummer": "HRB 23543",
      "registerart": "HRB",
      "company_name": "A-Event BKB GmbH",
      "company_seat": "Nürnberg",
      "details": "12.02.2025 (Bekanntmachungsdatum)\n\nBayern Amtsgericht Nürnberg HRB 23543\nLöschungsankündigung\n\nA-Event BKB GmbH\nGesellschaft mit beschränkter Haftung\nNürnberg\n\nDas Registergericht beabsichtigt, die im Handelsregister eingetragene Gesellschaft wegen Vermögenslosigkeit von Amts wegen nach § 394 FamFG zu löschen. Die Frist zur Erhebung eines Widerspruchs ist auf einen Monat festgesetzt."
    },
    {
      "date": "2025-02-12",
      "id": "101052",
      "original_text": "Einreichung neuer Dokumente\nBayern Amtsgericht München HRB 107767\nZeppelin Baumaschinen GmbH – Garching b. München",
      "type": "Einreichung neuer Dokumente",
      "state": "Bayern",
      "amtsgericht": "Amtsgericht München",
      "registernummer": "HRB 107767",
      "registerart": "HRB",
      "company_name": "Zeppelin Baumaschinen GmbH",
      "company_seat": "Garching b. München",
      "details": "12.02.2025 (Bekanntmachungsdatum)\n\nBayern Amtsgericht München HRB 107767\nEinreichung neuer Dokumente\n\nZeppelin Baumaschinen GmbH\nGesellschaft mit beschränkter Haftung\nGarching b. München\n\nDem Amtsgericht München -Registergericht- ist eine Liste der Mitglieder des Aufsichtsrats eingereicht worden, § 52 Abs. 3 S. 2 GmbHG."
    },
    {
      "date": "2025-02-12",
      "id": "101053",
      "original_text": "Registerbekanntmachung nach dem Umwandlungsgesetz\nBayern Amtsgericht Bamberg HRA 13340\nFit Panda Schmidt Glauche e.K. – Heroldsbach",
      "type": "Registerbekanntmachung nach dem Umwandlungsgesetz",
      "state": "Bayern",
      "amtsgericht": "Amtsgericht Bamberg",
      "registernummer": "HRA 13340",
      "registerart": "HRA",
      "company_name": "Fit Panda Schmidt Glauche e.K.",
      "company_seat": "Heroldsbach",
      "details": "12.02.2025 (Bekanntmachungsdatum)\n\nBayern Amtsgericht Bamberg HRA 13340\nRegisterbekanntmachung nach dem Umwandlungsgesetz 11.02.2025 (Eintragungsdatum)\n\nFit Panda Schmidt Glauche e.K.\nEinzelkaufmann / Einzelkauffrau\nHeroldsbach\n\nDen Gläubigern der an der Verschmelzung beteiligten Rechtsträger ist, wenn sie binnen sechs Monaten nach dem Tag, an dem die Eintragung der Verschmelzung in das Register des Sitzes desjenigen Rechtsträgers, dessen Gläubiger sie sind, nach § 19 Abs. 3 UmwG als bekannt gemacht gilt, ihren Anspruch nach Grund und Höhe in Textform anmelden, Sicherheit zu leisten, soweit sie nicht Befriedigung verlangen können. Dieses Recht steht den Gläubigern jedoch nur zu, wenn sie glaubhaft machen, dass durch die Verschmelzung die Erfüllung ihrer Forderung gefährdet wird."
    },
    {
      "date": "2025-02-12",
      "id": "101054",
      "original_text": "Einreichung neuer Dokumente\nBayern Amtsgericht Würzburg HRB 7786\nWürzburg AG Gesellschaft zur Förderung der Region Würzburg – Würzburg",
      "type": "Einreichung neuer Dokumente",
      "state": "Bayern",
      "amtsgericht": "Amtsgericht Würzburg",
      "registernummer": "HRB 7786",
      "registerart": "HRB",
      "company_name": "Würzburg AG Gesellschaft zur Förderung der Region Würzburg",
      "company_seat": "Würzburg",
      "details": "12.02.2025 (Bekanntmachungsdatum)\n\nBayern Amtsgericht Würzburg HRB 7786\nEinreichung neuer Dokumente\n\nWürzburg AG Gesellschaft zur Förderung der Region Würzburg\nAktiengesellschaft\nWürzburg\n\nDem Amtsgericht Würzburg -Registergericht- ist eine Liste der Mitglieder des Aufsichtsrats eingereicht worden, § 106 AktG."
    },
    {
      "date": "2025-02-12",
      "id": "101055",
      "original_text": "Sonstige Registerbekanntmachung\nBayern Amtsgericht Aschaffenburg HRB 17225\nREFORM Grinding Technology GmbH – Aschaffenburg",
      "type": "Sonstige Registerbekanntmachung",
      "state": "Bayern",
      "amtsgericht": "Amtsgericht Aschaffenburg",
      "registernummer": "HRB 17225",
      "registerart": "HRB",
      "company_name": "REFORM Grinding Technology GmbH",
      "company_seat": "Aschaffenburg",
      "details": "12.02.2025 (Bekanntmachungsdatum)\n\nBayern Amtsgericht Aschaffenburg HRB 17225\nSonstige Registerbekanntmachung 11.02.2025 (Eintragungsdatum)\n\nREFORM Grinding Technology GmbH\nGesellschaft mit beschränkter Haftung\nAschaffenburg\n\nDen Gläubigern der Gesellschaft, deren Forderungen begründet worden sind, bevor die Eintragung der Beendigung des Gewinnabführungsvertrages in das Handelsregister nach § 10 des Handelsgesetzbuches als bekanntgemacht gilt, hat der andere Vertragsteil Sicherheit zu leisten, wenn sie sich binnen sechs Monaten nach der Bekanntmachung der Eintragung zu diesem Zweck bei ihm melden."
    },
    {
      "date": "2025-02-12",
      "id": "101056",
      "original_text": "Einreichung neuer Dokumente\nBayern Amtsgericht Passau HRB 9821\nHistory Trader AG – Windorf",
      "type": "Einreichung neuer Dokumente",
      "state": "Bayern",
      "amtsgericht": "Amtsgericht Passau",
      "registernummer": "HRB 9821",
      "registerart": "HRB",
      "company_name": "History Trader AG",
      "company_seat": "Windorf",
      "details": "12.02.2025 (Bekanntmachungsdatum)\n\nBayern Amtsgericht Passau HRB 9821\nEinreichung neuer Dokumente\n\nHistory Trader AG\nAktiengesellschaft\nWindorf\n\nDem #Re.Name ist eine Liste der Mitglieder des Aufsichtsrats eingereicht worden, § 106 AktG."
    },
    {
      "date": "2025-02-12",
      "id": "101057",
      "original_text": "Registerbekanntmachung nach dem Umwandlungsgesetz\nBayern Amtsgericht Bamberg HRB 11126\n4voice AG – Hirschaid",
      "type": "Registerbekanntmachung nach dem Umwandlungsgesetz",
      "state": "Bayern",
      "amtsgericht": "Amtsgericht Bamberg",
      "registernummer": "HRB 11126",
      "registerart": "HRB",
      "company_name": "4voice AG",
      "company_seat": "Hirschaid",
      "details": "12.02.2025 (Bekanntmachungsdatum)\n\nBayern Amtsgericht Bamberg HRB 11126\nRegisterbekanntmachung nach dem Umwandlungsgesetz 11.02.2025 (Eintragungsdatum)\n\n4voice AG\nAktiengesellschaft\nHirschaid\n\nDen Gläubigern des formwechselnden Rechtsträgers ist, wenn sie binnen sechs Monaten nach dem Tag, an dem die Eintragung des Formwechsels nach § 201 UmwG als bekannt gemacht gilt, ihren Anspruch nach Grund und Höhe in Textform anmelden, Sicherheit zu leisten, soweit sie nicht Befriedigung verlangen können. Dieses Recht steht den Gläubigern jedoch nur zu, wenn sie glaubhaft machen, dass durch den Formwechsel die Erfüllung ihrer Forderung gefährdet wird."
    },
    {
      "date": "2025-02-12",
      "id": "101058",
      "original_text": "Löschungsankündigung\nBayern Amtsgericht München HRB 275342\nFacsavar UG (haftungsbeschränkt) – München",
      "type": "Löschungsankündigung",
      "state": "Bayern",
      "amtsgericht": "Amtsgericht München",
      "registernummer": "HRB 275342",
      "registerart": "HRB",
      "company_name": "Facsavar UG (haftungsbeschränkt)",
      "company_seat": "München",
      "details": "12.02.2025 (Bekanntmachungsdatum)\n\nBayern Amtsgericht München HRB 275342\nLöschungsankündigung 11.02.2025 (Eintragungsdatum)\n\nFacsavar UG (haftungsbeschränkt)\nGesellschaft mit beschränkter Haftung\nMünchen\n\nDas Registergericht beabsichtigt, die im Handelsregister eingetragene Gesellschaft wegen Vermögenslosigkeit von Amts wegen nach § 394 FamFG zu löschen. Die Frist zur Erhebung eines Widerspruchs ist auf drei Monate festgesetzt."
    },
    {
      "date": "2025-02-12",
      "id": "101059",
      "original_text": "Registerbekanntmachung nach dem Umwandlungsgesetz\nBayern Amtsgericht München HRB 209067\nCatenate Deutschland GmbH – München",
      "type": "Registerbekanntmachung nach dem Umwandlungsgesetz",
      "state": "Bayern",
      "amtsgericht": "Amtsgericht München",
      "registernummer": "HRB 209067",
      "registerart": "HRB",
      "company_name": "Catenate Deutschland GmbH",
      "company_seat": "München",
      "details": "12.02.2025 (Bekanntmachungsdatum)\n\nBayern Amtsgericht München HRB 209067\nRegisterbekanntmachung nach dem Umwandlungsgesetz 11.02.2025 (Eintragungsdatum)\n\nCatenate Deutschland GmbH\nGesellschaft mit beschränkter Haftung\nMünchen\n\nDen Gläubigern der an der Verschmelzung beteiligten Rechtsträger ist, wenn sie binnen sechs Monaten nach dem Tag, an dem die Eintragung der Verschmelzung in das Register des Sitzes desjenigen Rechtsträgers, dessen Gläubiger sie sind, nach § 19 Abs. 3 UmwG als bekannt gemacht gilt, ihren Anspruch nach Grund und Höhe in Textform anmelden, Sicherheit zu leisten, soweit sie nicht Befriedigung verlangen können. Dieses Recht steht den Gläubigern jedoch nur zu, wenn sie glaubhaft machen, dass durch die Verschmelzung die Erfüllung ihrer Forderung gefährdet wird."
    },
    {
      "date": "2025-02-12",
      "id": "101060",
      "original_text": "Löschungsankündigung\nBayern Amtsgericht Kempten (Allgäu) HRB 15330\nUlrichsdienstleistungen Seeg GmbH – Seeg",
      "type": "Löschungsankündigung",
      "state": "Bayern",
      "amtsgericht": "Amtsgericht Kempten (Allgäu)",
      "registernummer": "HRB 15330",
      "registerart": "HRB",
      "company_name": "Ulrichsdienstleistungen Seeg GmbH",
      "company_seat": "Seeg",
      "details": "12.02.2025 (Bekanntmachungsdatum)\n\nBayern Amtsgericht Kempten (Allgäu) HRB 15330\nLöschungsankündigung\n\nUlrichsdienstleistungen Seeg GmbH\nGesellschaft mit beschränkter Haftung\nSeeg\n\nDas Registergericht beabsichtigt, die im Handelsregister eingetragene Gesellschaft wegen Vermögenslosigkeit von Amts wegen nach § 394 FamFG zu löschen. Die Frist zur Erhebung eines Widerspruchs ist auf einen Monat festgesetzt."
    },
    {
      "date": "2025-02-12",
      "id": "101061",
      "original_text": "Löschungsankündigung\nBayern Amtsgericht Nürnberg HRB 20145\nBGM Computer GmbH – Nürnberg",
      "type": "Löschungsankündigung",
      "state": "Bayern",
      "amtsgericht": "Amtsgericht Nürnberg",
      "registernummer": "HRB 20145",
      "registerart": "HRB",
      "company_name": "BGM Computer GmbH",
      "company_seat": "Nürnberg",
      "details": "12.02.2025 (Bekanntmachungsdatum)\n\nBayern Amtsgericht Nürnberg HRB 20145\nLöschungsankündigung\n\nBGM Computer GmbH\nGesellschaft mit beschränkter Haftung\nNürnberg\n\nDas Registergericht beabsichtigt, die im Handelsregister eingetragene Gesellschaft wegen Vermögenslosigkeit von Amts wegen nach § 394 FamFG zu löschen. Die Frist zur Erhebung eines Widerspruchs ist auf einen Monat festgesetzt."
    },
    {
      "date": "2025-02-12",
      "id": "101062",
      "original_text": "Löschungsankündigung\nBayern Amtsgericht Nürnberg HRB 20145\nBGM Computer GmbH – Nürnberg",
      "type": "Löschungsankündigung",
      "state": "Bayern",
      "amtsgericht": "Amtsgericht Nürnberg",
      "registernummer": "HRB 20145",
      "registerart": "HRB",
      "company_name": "BGM Computer GmbH",
      "company_seat": "Nürnberg",
      "details": "12.02.2025 (Bekanntmachungsdatum)\n\nBayern Amtsgericht Nürnberg HRB 20145\nLöschungsankündigung\n\nBGM Computer GmbH\nGesellschaft mit beschränkter Haftung\nNürnberg\n\nDas Registergericht beabsichtigt, die im Handelsregister eingetragene Gesellschaft wegen Vermögenslosigkeit von Amts wegen nach § 394 FamFG zu löschen. Die Frist zur Erhebung eines Widerspruchs ist auf einen Monat festgesetzt."
    },
    {
      "date": "2025-02-12",
      "id": "101063",
      "original_text": "Einreichung neuer Dokumente\nBayern Amtsgericht Nürnberg HRB 662\nWohnungsbaugesellschaft mbH IDEAL – Nürnberg",
      "type": "Einreichung neuer Dokumente",
      "state": "Bayern",
      "amtsgericht": "Amtsgericht Nürnberg",
      "registernummer": "HRB 662",
      "registerart": "HRB",
      "company_name": "Wohnungsbaugesellschaft mbH IDEAL",
      "company_seat": "Nürnberg",
      "details": "12.02.2025 (Bekanntmachungsdatum)\n\nBayern Amtsgericht Nürnberg HRB 662\nEinreichung neuer Dokumente\n\nWohnungsbaugesellschaft mbH IDEAL\nGesellschaft mit beschränkter Haftung\nNürnberg\n\nDem Amtsgericht Nürnberg -Registergericht- ist eine Liste der Mitglieder des Aufsichtsrats eingereicht worden, § 52 Abs. 3 S. 2 GmbHG."
    },
    {
      "date": "2025-02-12",
      "id": "101064",
      "original_text": "Löschungsankündigung\nBayern Amtsgericht München HRB 287437\nTinapu Company Constantin UG (haftungsbeschränkt) – München",
      "type": "Löschungsankündigung",
      "state": "Bayern",
      "amtsgericht": "Amtsgericht München",
      "registernummer": "HRB 287437",
      "registerart": "HRB",
      "company_name": "Tinapu Company Constantin UG (haftungsbeschränkt)",
      "company_seat": "München",
      "details": "12.02.2025 (Bekanntmachungsdatum)\n\nBayern Amtsgericht München HRB 287437\nLöschungsankündigung 07.02.2025 (Eintragungsdatum)\n\nTinapu Company Constantin UG (haftungsbeschränkt)\nGesellschaft mit beschränkter Haftung\nMünchen\n\nDas Registergericht beabsichtigt, die im Handelsregister eingetragene Gesellschaft wegen Vermögenslosigkeit von Amts wegen nach § 394 FamFG zu löschen. Die Frist zur Erhebung eines Widerspruchs ist auf drei Monate festgesetzt."
    },
    {
      "date": "2025-02-12",
      "id": "101065",
      "original_text": "Löschungsankündigung\nBayern Amtsgericht Hof HRB 5245\nBavaria Trading GmbH – Wunsiedel",
      "type": "Löschungsankündigung",
      "state": "Bayern",
      "amtsgericht": "Amtsgericht Hof",
      "registernummer": "HRB 5245",
      "registerart": "HRB",
      "company_name": "Bavaria Trading GmbH",
      "company_seat": "Wunsiedel",
      "details": "12.02.2025 (Bekanntmachungsdatum)\n\nBayern Amtsgericht Hof HRB 5245\nLöschungsankündigung\n\nBavaria Trading GmbH\nGesellschaft mit beschränkter Haftung\nWunsiedel\n\nDas Registergericht beabsichtigt, die im Handelsregister eingetragene Gesellschaft wegen Vermögenslosigkeit von Amts wegen nach § 394 FamFG zu löschen. Die Frist zur Erhebung eines Widerspruchs ist auf sechs Wochen festgesetzt."
    },
    {
      "date": "2025-02-12",
      "id": "101066",
      "original_text": "Sonstige Registerbekanntmachung\nBaden-Württemberg Amtsgericht Mannheim HRB 8992\nDRK -Blutspendedienst Baden-Württemberg-Hessen gemeinnützige GmbH – Mannheim",
      "type": "Sonstige Registerbekanntmachung",
      "state": "Baden-Württemberg",
      "amtsgericht": "Amtsgericht Mannheim",
      "registernummer": "HRB 8992",
      "registerart": "HRB",
      "company_name": "DRK -Blutspendedienst Baden-Württemberg-Hessen gemeinnützige GmbH",
      "company_seat": "Mannheim",
      "details": "12.02.2025 (Bekanntmachungsdatum)\n\nBaden-Württemberg Amtsgericht Mannheim HRB 8992\nSonstige Registerbekanntmachung\n\nDRK -Blutspendedienst Baden-Württemberg-Hessen gemeinnützige GmbH\nGesellschaft mit beschränkter Haftung\nMannheim\n\nDie Gesellschaft hat am 11.02.2025 die Liste über die Zusammensetzung des Aufsichtsrats zum Handelsregister eingereicht."
    },
    {
      "date": "2025-02-12",
      "id": "101067",
      "original_text": "Sonstige Registerbekanntmachung\nBerlin Amtsgericht Berlin (Charlottenburg) HRB 140319\nKönigstadt Projekt GmbH – Berlin",
      "type": "Sonstige Registerbekanntmachung",
      "state": "Berlin",
      "amtsgericht": "Amtsgericht Berlin (Charlottenburg)",
      "registernummer": "HRB 140319",
      "registerart": "HRB",
      "company_name": "Königstadt Projekt GmbH",
      "company_seat": "Berlin",
      "details": "12.02.2025 (Bekanntmachungsdatum)\n\nBerlin Amtsgericht Berlin (Charlottenburg) HRB 140319\nSonstige Registerbekanntmachung\n\nKönigstadt Projekt GmbH\nGesellschaft mit beschränkter Haftung\nBerlin\n\nAls nicht eingetragen wird veröffentlicht: Den Gläubigern der an der Verschmelzung beteiligten Rechtsträger ist, wenn sie binnen sechs Monaten nach dem Tag, an dem die Eintragung der Verschmelzung in das Register des Sitzes desjenigen Rechtsträgers, dessen Gläubiger sie sind, als bekannt gemacht gilt, ihren Anspruch nach Grund und Höhe schriftlich anmelden, Sicherheit zu leisten, soweit sie nicht Befriedigung verlangen können. Dieses Recht steht den Gläubigern jedoch nur zu, wenn sie glaubhaft machen, dass durch die Verschmelzung die Erfüllung ihrer Forderung gefährdet wird. Das Recht, Sicherheitsleistung zu verlangen, steht Gläubigern nicht zu, die im Falle der Insolvenz ein Recht auf vorzugsweise Befriedigung aus einer Deckungsmasse haben, die nach gesetzlicher Vorschrift zu ihrem Schutz errichtet und staatlich überwacht ist."
    },
    {
      "date": "2025-02-12",
      "id": "101068",
      "original_text": "Registerbekanntmachung nach dem Umwandlungsgesetz\nBerlin Amtsgericht Berlin (Charlottenburg) HRB 1330\nKönigstadt Gesellschaft für Grundstücke und Industrie mbH – Berlin",
      "type": "Registerbekanntmachung nach dem Umwandlungsgesetz",
      "state": "Berlin",
      "amtsgericht": "Amtsgericht Berlin (Charlottenburg)",
      "registernummer": "HRB 1330",
      "registerart": "HRB",
      "company_name": "Königstadt Gesellschaft für Grundstücke und Industrie mbH",
      "company_seat": "Berlin",
      "details": "12.02.2025 (Bekanntmachungsdatum)\n\nBerlin Amtsgericht Berlin (Charlottenburg) HRB 1330\nRegisterbekanntmachung nach dem Umwandlungsgesetz 11.02.2025 (Eintragungsdatum)\n\nKönigstadt Gesellschaft für Grundstücke und Industrie mbH\nGesellschaft mit beschränkter Haftung\nBerlin\n\nZu Eintragungsnummer 27 vom 11.02.2025 wird als nicht eingetragen veröffentlicht:Den Gläubigern der an der Verschmelzung beteiligten Rechtsträger ist, wenn sie binnen sechs Monaten nach dem Tag, an dem die Eintragung der Verschmelzung in das Register des Sitzes desjenigen Rechtsträgers, dessen Gläubiger sie sind, als bekannt gemacht gilt, ihren Anspruch nach Grund und Höhe schriftlich anmelden, Sicherheit zu leisten, soweit sie nicht Befriedigung verlangen können. Dieses Recht steht den Gläubigern jedoch nur zu, wenn sie glaubhaft machen, dass durch die Verschmelzung die Erfüllung ihrer Forderung gefährdet wird. Das Recht, Sicherheitsleistung zu verlangen, steht Gläubigern nicht zu, die im Falle der Insolvenz ein Recht auf vorzugsweise Befriedigung aus einer Deckungsmasse haben, die nach gesetzlicher Vorschrift zu ihrem Schutz errichtet und staatlich überwacht ist."
    },
    {
      "date": "2025-02-12",
      "id": "101069",
      "original_text": "Einreichung neuer Dokumente\nBaden-Württemberg Amtsgericht Ulm HRB 725931\nVARTA Microbattery GmbH – Ellwangen Jagst",
      "type": "Einreichung neuer Dokumente",
      "state": "Baden-Württemberg",
      "amtsgericht": "Amtsgericht Ulm",
      "registernummer": "HRB 725931",
      "registerart": "HRB",
      "company_name": "VARTA Microbattery GmbH",
      "company_seat": "Ellwangen Jagst",
      "details": "12.02.2025 (Bekanntmachungsdatum)\n\nBaden-Württemberg Amtsgericht Ulm HRB 725931\nEinreichung neuer Dokumente\n\nVARTA Microbattery GmbH\nGesellschaft mit beschränkter Haftung\nEllwangen Jagst\n\nDie Gesellschaft hat am 11.02.2025 die Liste über die Zusammensetzung des Aufsichtsrats zum Handelsregister eingereicht."
    },
    {
      "date": "2025-02-12",
      "id": "101070",
      "original_text": "Registerbekanntmachung nach dem Umwandlungsgesetz\nBaden-Württemberg Amtsgericht Mannheim HRB 753560\nWeber4 GmbH – Karlsruhe",
      "type": "Registerbekanntmachung nach dem Umwandlungsgesetz",
      "state": "Baden-Württemberg",
      "amtsgericht": "Amtsgericht Mannheim",
      "registernummer": "HRB 753560",
      "registerart": "HRB",
      "company_name": "Weber4 GmbH",
      "company_seat": "Karlsruhe",
      "details": "12.02.2025 (Bekanntmachungsdatum)\n\nBaden-Württemberg Amtsgericht Mannheim HRB 753560\nRegisterbekanntmachung nach dem Umwandlungsgesetz 12.02.2025 (Eintragungsdatum)\n\nWeber4 GmbH\nGesellschaft mit beschränkter Haftung\nKarlsruhe\n\nAls nicht eingetragen wird bekanntgemacht:\nDen Gläubigern des an dem Formwechsel beteiligten Rechtsträgers ist, wenn sie binnen sechs Monaten nach dem Tag, an dem die Eintragung des Formwechsels in das Register des Sitzes desjenigen Rechtsträgers, dessen Gläubiger sie sind, nach § 19 Abs. 3 UmwG als bekanntgemacht gilt, ihren Anspruch nach Grund und Höhe schriftlich anmelden, Sicherheit zu leisten, soweit sie nicht Befriedigung verlangen können. Dieses Recht steht den Gläubigern jedoch nur zu, wenn sie glaubhaft machen, dass durch den Formwechsel die Erfüllung ihrer Forderung gefährdet wird."
    },
    {
      "date": "2025-02-12",
      "id": "101071",
      "original_text": "Registerbekanntmachung nach dem Umwandlungsgesetz\nBaden-Württemberg Amtsgericht Mannheim GsR 1204\nWeber 4 eGbR – Ettlingen",
      "type": "Registerbekanntmachung nach dem Umwandlungsgesetz",
      "state": "Baden-Württemberg",
      "amtsgericht": "Amtsgericht Mannheim",
      "registernummer": "GsR 1204",
      "registerart": "GsR",
      "company_name": "Weber 4 eGbR",
      "company_seat": "Ettlingen",
      "details": "12.02.2025 (Bekanntmachungsdatum)\n\nBaden-Württemberg Amtsgericht Mannheim GsR 1204\nRegisterbekanntmachung nach dem Umwandlungsgesetz 12.02.2025 (Eintragungsdatum)\n\nWeber 4 eGbR\nGesellschaft bürgerlichen Rechts\nEttlingen\n\nAls nicht eingetragen wird bekanntgemacht:\nDen Gläubigern des an dem Formwechsel beteiligten Rechtsträgers ist, wenn sie binnen sechs Monaten nach dem Tag, an dem die Eintragung des Formwechsels in das Register des Sitzes desjenigen Rechtsträgers, dessen Gläubiger sie sind, nach § 19 Abs. 3 UmwG als bekanntgemacht gilt, ihren Anspruch nach Grund und Höhe schriftlich anmelden, Sicherheit zu leisten, soweit sie nicht Befriedigung verlangen können. Dieses Recht steht den Gläubigern jedoch nur zu, wenn sie glaubhaft machen, dass durch den Formwechsel die Erfüllung ihrer Forderung gefährdet wird."
    },
    {
      "date": "2025-02-12",
      "id": "101072",
      "original_text": "Löschungsankündigung\nHamburg Amtsgericht Hamburg HRA 107778\nPSV Hellespont Dawn GmbH & Co. KG – Hamburg",
      "type": "Löschungsankündigung",
      "state": "Hamburg",
      "amtsgericht": "Amtsgericht Hamburg",
      "registernummer": "HRA 107778",
      "registerart": "HRA",
      "company_name": "PSV Hellespont Dawn GmbH & Co. KG",
      "company_seat": "Hamburg",
      "details": "12.02.2025 (Bekanntmachungsdatum)\n\nHamburg Amtsgericht Hamburg HRA 107778\nLöschungsankündigung\n\nPSV Hellespont Dawn GmbH & Co. KG\nKommanditgesellschaft\nHamburg\n\nDas Registergericht beabsichtigt, die im Handelsregister eingetragene Gesellschaft von Amts wegen nach § 394 Abs. 4 FamFG zu löschen. Die Frist zur Erhebung eines Widerspruchs gegen die beabsichtigte Löschung wird auf 3 Monate festgesetzt."
    },
    {
      "date": "2025-02-12",
      "id": "101073",
      "original_text": "Sonstige Registerbekanntmachung\nSchleswig-Holstein Amtsgericht Flensburg HRB 13121\nPNE Erneuerbare Energien GmbH – Husum",
      "type": "Sonstige Registerbekanntmachung",
      "state": "Schleswig-Holstein",
      "amtsgericht": "Amtsgericht Flensburg",
      "registernummer": "HRB 13121",
      "registerart": "HRB",
      "company_name": "PNE Erneuerbare Energien GmbH",
      "company_seat": "Husum",
      "details": "12.02.2025 (Bekanntmachungsdatum)\n\nSchleswig-Holstein Amtsgericht Flensburg HRB 13121\nSonstige Registerbekanntmachung\n\nPNE Erneuerbare Energien GmbH\nGesellschaft mit beschränkter Haftung\nHusum\n\nAls nicht eingetragen wird veröffentlicht: Der andere Vertragsteil hat den Gläubigern dieses Rechtsträgers, dessen Forderungen begründet worden sind, bevor die Eintragung der Beendigung dieses Vertrages in das Handelsregister nach § 10 des Handelsgesetzbuches als bekannt gemacht gilt, Sicherheit zu leisten, wenn sie sich binnen sechs Monaten nach der Bekanntmachung der Eintragung zu diesem Zweck bei ihm melden."
    },
    {
      "date": "2025-02-12",
      "id": "101074",
      "original_text": "Löschungsankündigung\nBerlin Amtsgericht Berlin (Charlottenburg) HRB 102847\nbobsairport LIMITED NL Berlin – Berlin",
      "type": "Löschungsankündigung",
      "state": "Berlin",
      "amtsgericht": "Amtsgericht Berlin (Charlottenburg)",
      "registernummer": "HRB 102847",
      "registerart": "HRB",
      "company_name": "bobsairport LIMITED NL Berlin",
      "company_seat": "Berlin",
      "details": "12.02.2025 (Bekanntmachungsdatum)\n\nBerlin Amtsgericht Berlin (Charlottenburg) HRB 102847\nLöschungsankündigung\n\nbobsairport LIMITED NL Berlin\nRechtsform ausländischen Rechts HRB\nBerlin\n\nEs ist beabsichtigt, gemäß § 395 FamFG die Eintragung der Zweigniederlassung wegen Fehlens einer wesentlichen Voraussetzung im Handelsregister zu löschen. Widerspruchsfrist: 6 Wochen"
    },
    {
      "date": "2025-02-12",
      "id": "101075",
      "original_text": "Einreichung neuer Dokumente\nSachsen-Anhalt Amtsgericht Stendal HRB 202435\nFlugplatzgesellschaft mbH Halle/Oppin. – Landsberg",
      "type": "Einreichung neuer Dokumente",
      "state": "Sachsen-Anhalt",
      "amtsgericht": "Amtsgericht Stendal",
      "registernummer": "HRB 202435",
      "registerart": "HRB",
      "company_name": "Flugplatzgesellschaft mbH Halle/Oppin.",
      "company_seat": "Landsberg",
      "details": "12.02.2025 (Bekanntmachungsdatum)\n\nSachsen-Anhalt Amtsgericht Stendal HRB 202435\nEinreichung neuer Dokumente\n\nFlugplatzgesellschaft mbH Halle/Oppin.\nGesellschaft mit beschränkter Haftung\nLandsberg\n\nEine Liste der Mitglieder des Aufsichtsrates wurde zum Handelsregister eingereicht."
    },
    {
      "date": "2025-02-12",
      "id": "101076",
      "original_text": "Einreichung neuer Dokumente\nBerlin Amtsgericht Berlin (Charlottenburg) HRB 129210\nGreen Bellium Property GmbH – Berlin",
      "type": "Einreichung neuer Dokumente",
      "state": "Berlin",
      "amtsgericht": "Amtsgericht Berlin (Charlottenburg)",
      "registernummer": "HRB 129210",
      "registerart": "HRB",
      "company_name": "Green Bellium Property GmbH",
      "company_seat": "Berlin",
      "details": "12.02.2025 (Bekanntmachungsdatum)\n\nBerlin Amtsgericht Berlin (Charlottenburg) HRB 129210\nEinreichung neuer Dokumente\n\nGreen Bellium Property GmbH\nGesellschaft mit beschränkter Haftung\nBerlin\n\nAls nicht eingetragen wird veröffentlicht:\n\n1.\nDie Gesellschaft hat einen Formwechselplan zum Handelsregister eingereicht.\n\n2.\nRechtsform, Firma und Sitz der formwechselnden Gesellschaft\nDie Gesellschaft ist eine deutsche Gesellschaft mit beschränkter Haftung unter der Firma Green Bellium Property GmbH, errichtet und bestehend nach deutschem Recht, mit Sitz in Berlin, Deutschland, eingetragen im Handelsregister des Amtsgerichts Charlottenburg unter HRB 129210 B.\nDie Gesellschaft soll durch grenzüberschreitenden, identitätswahrenden Formwechsel aufgrund eines Form Wechselbeschlusses unter gleichzeitiger Verlegung des Satzungssitzes in eine Gesellschaft mit beschränkter Haftung nach dem Recht des Großherzogtums Luxemburg (société à responsabilité limitée) mit Sitz in Luxemburg, Großherzogtum Luxemburg, umgewandelt werden. Die Gesellschaft wird die Firma Green Bellium Property S.à r.l. führen.\n\n3.\nRegister der formwechselnden Gesellschaft\nDie an dem grenzüberschreitenden Formwechsel beteiligte Gesellschaft ist unter HRB 129210 B im Handelsregister des Amtsgerichts Charlottenburg eingetragen.\n\n4.\nHinweis an die Anteilsinhaber und Gläubiger\nDem Gesellschafter und den Gläubigern der Gesellschaft wird mitgeteilt, dass sie der Gesellschaft spätestens fünf Tage vor dem Tag der Gesellschafterversammlung Bemerkungen zu dem beim Handelsregister eingereichten Formwechselplan übermitteln können.\n\n5.\nHinweis an die zuständigen Betriebsräte und Arbeitnehmer der Gesellschaft\nDie Gesellschaft hat keine Arbeitnehmer und verfügt über keinen Betriebsrat oder eine sonstige Arbeitnehmervertretung.\n\n6.\nGläubiger der Gesellschaft\nDie Rechte der Gläubiger der formwechselnden Gesellschaft ergeben sich aus §§ 341, 314 UmwG. Danach ist den Gläubigern der formwechselnden Gesellschaft Sicherheit zu leisten, soweit sie nicht Befriedigung verlangen können, wenn die neue Rechtsform nicht dem deutschen Recht unterliegt. Dieses Recht steht den Gläubigern jedoch nur zu, wenn sie binnen drei Monaten nach dem Tag, an dem der Formwechselplan (oder sein Entwurf) bekannt gemacht worden ist, ihre Ansprüche gerichtlich geltend machen. Dieses Recht auf Sicherheitsleistung steht Gläubigern nur im Hinblick auf solche Forderungen zu, die vor der Bekanntmachung des Formwechselplans oder seines Entwurfs entstanden, aber im Zeitpunkt der Bekanntmachung noch nicht fällig geworden sind, und deren Erfüllung durch den Formwechsel gefährdet wird."
    },
    {
      "date": "2025-02-12",
      "id": "101077",
      "original_text": "Löschungsankündigung\nSchleswig-Holstein Amtsgericht Flensburg HRA 8981\nNEDERA Bauputz & Immobilien GmbH & Co. KG – Flensburg",
      "type": "Löschungsankündigung",
      "state": "Schleswig-Holstein",
      "amtsgericht": "Amtsgericht Flensburg",
      "registernummer": "HRA 8981",
      "registerart": "HRA",
      "company_name": "NEDERA Bauputz & Immobilien GmbH & Co. KG",
      "company_seat": "Flensburg",
      "details": "12.02.2025 (Bekanntmachungsdatum)\n\nSchleswig-Holstein Amtsgericht Flensburg HRA 8981\nLöschungsankündigung\n\nNEDERA Bauputz & Immobilien GmbH & Co. KG\nKommanditgesellschaft\nFlensburg\n\nEs ist die Löschung der nachstehenden Gesellschaft wegen Vermögenslosigkeit gemäß § 394 FamFG beabsichtigt.\nWiderspruchsfrist: 2 Monate."
    },
    {
      "date": "2025-02-12",
      "id": "101078",
      "original_text": "Löschungsankündigung\nBaden-Württemberg Amtsgericht Mannheim HRB 740023\nKaraca Bau GmbH – Mannheim",
      "type": "Löschungsankündigung",
      "state": "Baden-Württemberg",
      "amtsgericht": "Amtsgericht Mannheim",
      "registernummer": "HRB 740023",
      "registerart": "HRB",
      "company_name": "Karaca Bau GmbH",
      "company_seat": "Mannheim",
      "details": "12.02.2025 (Bekanntmachungsdatum)\n\nBaden-Württemberg Amtsgericht Mannheim HRB 740023\nLöschungsankündigung\n\nKaraca Bau GmbH\nGesellschaft mit beschränkter Haftung\nMannheim\n\nDas Gericht beabsichtigt, die Eintragung der Gesellschaft im Handelsregister wegen des Mangels einer wesentlichen Voraussetzung von Amts wegen nach § 395 FamFG als unzulässig zu löschen. Die Frist zur Geltendmachung eines Widerspruchs gegen die beabsichtigte Löschung ist auf einen Monat ab Veröffentlichung bestimmt."
    },
    {
      "date": "2025-02-12",
      "id": "101079",
      "original_text": "Registerbekanntmachung nach dem Umwandlungsgesetz\nBerlin Amtsgericht Berlin (Charlottenburg) HRB 179468\nLightblue Privet Property GmbH – Berlin",
      "type": "Registerbekanntmachung nach dem Umwandlungsgesetz",
      "state": "Berlin",
      "amtsgericht": "Amtsgericht Berlin (Charlottenburg)",
      "registernummer": "HRB 179468",
      "registerart": "HRB",
      "company_name": "Lightblue Privet Property GmbH",
      "company_seat": "Berlin",
      "details": "12.02.2025 (Bekanntmachungsdatum)\n\nBerlin Amtsgericht Berlin (Charlottenburg) HRB 179468\nRegisterbekanntmachung nach dem Umwandlungsgesetz\n\nLightblue Privet Property GmbH\nGesellschaft mit beschränkter Haftung\nBerlin\n\nAls nicht eingetragen wird veröffentlicht: Die Gesellschaft hat einen notariell beurkundeten Formwechselplan vom 06.02.2025 betreffend die grenzüberschreitende Verlegung des Satzungssitzes der Gesellschaft nach Luxemburg gemäß §§ 333 ff. UmwG zum Handelsregister des Amtsgerichts Charlottenburg eingereicht.\nRechtsform, Firma und Sitz der formwechselnden Gesellschaft\nDie Gesellschaft ist eine deutsche Gesellschaft mit beschränkter Haftung unter der Firma Lightblue Privet Property GmbH, errichtet und bestehend nach deutschem Recht, mit Sitz in Berlin, Deutschland, eingetragen im Handelsregister des Amtsgerichts Charlottenburg unter HRB 179468 B.\nDie Gesellschaft soll durch grenzüberschreitenden, identitätswahrenden Formwechsel aufgrund eines Formwechselbeschlusses unter gleichzeitiger Verlegung des Satzungssitzes in eine Gesellschaft mit beschränkter Haftung nach dem Recht des Großherzogtums Luxemburg (société à responsabilité limitée) mit Sitz in Luxemburg, Großherzogtum Luxemburg, umgewandelt werden. Die Gesellschaft wird die Firma Lightblue Privet Property S.à r.l. führen.\nRegister der formwechselnden Gesellschaft\nDie an dem grenzüberschreitenden Formwechsel beteiligte Gesellschaft ist unter HRB 179468 B im Handelsregister des Amtsgerichts Charlottenburg eingetragen.\nHinweis an die Anteilsinhaber und Gläubiger\nDem Gesellschafter und den Gläubigern der Gesellschaft wird mitgeteilt, dass sie der Gesellschaft spätestens fünf Tage vor dem Tag der Gesellschafterversammlung Bemerkungen zu dem beim Handelsregister eingereichten Formwechselplan\nübermitteln können.\nHinweis an die zuständigen Betriebsräte und Arbeitnehmer der Gesellschaft\nDie Gesellschaft hat keine Arbeitnehmer und verfügt über keinen Betriebsrat oder eine sonstige Arbeitnehmervertretung.\nGläubiger der Gesellschaft\nDie Rechte der Gläubiger der formwechselnden Gesellschaft ergeben sich aus §§ 341, 314 UmwG. Danach ist den Gläubigern der formwechselnden Gesellschaft Sicherheit zu leisten, soweit sie nicht Befriedigung verlangen können, wenn die neue Rechtsform nicht dem deutschen Recht unterliegt. Dieses Recht steht den Gläubigern jedoch nur zu, wenn sie binnen drei Monaten nach dem\nTag, an dem der Formwechselplan (oder sein Entwurf) bekannt gemacht worden ist, ihre Ansprüche gerichtlich geltend machen. Dieses Recht auf Sicherheitsleistung steht Gläubigern nur im Hinblick auf solche Forderungen zu, die vor der Bekanntmachung des Formwechselplans oder seines Entwurfs entstanden, aber im Zeitpunkt der Bekanntmachung noch nicht fällig geworden sind,\nund deren Erfüllung durch den Formwechsel gefährdet wird."
    },
    {
      "date": "2025-02-12",
      "id": "101080",
      "original_text": "Registerbekanntmachung nach dem Umwandlungsgesetz\nSaarland Amtsgericht Saarbrücken HRA 13626\nGymHeros OHG – Neunkirchen",
      "type": "Registerbekanntmachung nach dem Umwandlungsgesetz",
      "state": "Saarland",
      "amtsgericht": "Amtsgericht Saarbrücken",
      "registernummer": "HRA 13626",
      "registerart": "HRA",
      "company_name": "GymHeros OHG",
      "company_seat": "Neunkirchen",
      "details": "12.02.2025 (Bekanntmachungsdatum)\n\nSaarland Amtsgericht Saarbrücken HRA 13626\nRegisterbekanntmachung nach dem Umwandlungsgesetz 12.02.2025 (Eintragungsdatum)\n\nGymHeros OHG\nOffene Handelsgesellschaft\nNeunkirchen\n\nAls nicht eingetragen wird bekannt gemacht: Den Gläubigern der am Formwechsel beteiligten Gesellschaften ist, wenn sie binnen sechs Monaten nach dem Tag, an dem die Eintragung der Verschmelzung in das Register des Sitzes desjenigen Rechtsträgers, dessen Gläubiger sie sind, nach § 19 Absatz 3 UmwG bekannt gemacht worden ist, ihren Anspruch nach Grund und Höhe schriftlich anmelden, Sicherheit zu leisten, soweit sie nicht Befriedigung verlangen können. Dieses Recht steht den Gläubigern jedoch nur zu, wenn sie glaubhaft machen, dass durch den Formwechsel die Erfüllung ihrer Forderung gefährdet wird."
    },
    {
      "date": "2025-02-12",
      "id": "101081",
      "original_text": "Löschungsankündigung\nMecklenburg-Vorpommern Amtsgericht Stralsund HRB 21980\nBT Ferienpark GmbH – Fuhlendorf",
      "type": "Löschungsankündigung",
      "state": "Mecklenburg-Vorpommern",
      "amtsgericht": "Amtsgericht Stralsund",
      "registernummer": "HRB 21980",
      "registerart": "HRB",
      "company_name": "BT Ferienpark GmbH",
      "company_seat": "Fuhlendorf",
      "details": "12.02.2025 (Bekanntmachungsdatum)\n\nMecklenburg-Vorpommern Amtsgericht Stralsund HRB 21980\nLöschungsankündigung\n\nBT Ferienpark GmbH\nGesellschaft mit beschränkter Haftung\nFuhlendorf\n\nDas Registergericht beabsichtigt, die Firma von Amts wegen nach § 394 FamFG zu löschen. Die Frist zur Erhebung eines Widerspruchs ist auf 1 Monat festgesetzt."
    },
    {
      "date": "2025-02-12",
      "id": "101082",
      "original_text": "Registerbekanntmachung nach dem Umwandlungsgesetz\nSaarland Amtsgericht Saarbrücken HRB 109087\nGymHeros GmbH – Neunkirchen",
      "type": "Registerbekanntmachung nach dem Umwandlungsgesetz",
      "state": "Saarland",
      "amtsgericht": "Amtsgericht Saarbrücken",
      "registernummer": "HRB 109087",
      "registerart": "HRB",
      "company_name": "GymHeros GmbH",
      "company_seat": "Neunkirchen",
      "details": "12.02.2025 (Bekanntmachungsdatum)\n\nSaarland Amtsgericht Saarbrücken HRB 109087\nRegisterbekanntmachung nach dem Umwandlungsgesetz 12.02.2025 (Eintragungsdatum)\n\nGymHeros GmbH\nGesellschaft mit beschränkter Haftung\nNeunkirchen\n\nAls nicht eingetragen wird bekannt gemacht: Den Gläubigern der am Formwechsel beteiligten Gesellschaften ist, wenn sie binnen sechs Monaten nach dem Tag, an dem die Eintragung der Verschmelzung in das Register des Sitzes desjenigen Rechtsträgers, dessen Gläubiger sie sind, nach § 19 Absatz 3 UmwG bekannt gemacht worden ist, ihren Anspruch nach Grund und Höhe schriftlich anmelden, Sicherheit zu leisten, soweit sie nicht Befriedigung verlangen können. Dieses Recht steht den Gläubigern jedoch nur zu, wenn sie glaubhaft machen, dass durch den Formwechsel die Erfüllung ihrer Forderung gefährdet wird."
    },
    {
      "date": "2025-02-12",
      "id": "101083",
      "original_text": "Löschungsankündigung\nBaden-Württemberg Amtsgericht Mannheim HRB 725150\nMannheimer Fischquelle UG (haftungsbeschränkt) – Mannheim",
      "type": "Löschungsankündigung",
      "state": "Baden-Württemberg",
      "amtsgericht": "Amtsgericht Mannheim",
      "registernummer": "HRB 725150",
      "registerart": "HRB",
      "company_name": "Mannheimer Fischquelle UG (haftungsbeschränkt)",
      "company_seat": "Mannheim",
      "details": "12.02.2025 (Bekanntmachungsdatum)\n\nBaden-Württemberg Amtsgericht Mannheim HRB 725150\nLöschungsankündigung\n\nMannheimer Fischquelle UG (haftungsbeschränkt)\nGesellschaft mit beschränkter Haftung\nMannheim\n\nDas Gericht beabsichtigt, die Gesellschaft wegen Vermögenslosigkeit im Handelsregister von Amts wegen nach § 394 FamFG zu löschen. Die Frist zur Geltendmachung eines Widerspruchs gegen die beabsichtigte Löschung ist auf einen Monat ab Veröffentlichung bestimmt."
    },
    {
      "date": "2025-02-12",
      "id": "101084",
      "original_text": "Einreichung neuer Dokumente\nBerlin Amtsgericht Berlin (Charlottenburg) HRB 200088\nArbeitsmedizinischer Dienst der BG BAU GmbH – Berlin",
      "type": "Einreichung neuer Dokumente",
      "state": "Berlin",
      "amtsgericht": "Amtsgericht Berlin (Charlottenburg)",
      "registernummer": "HRB 200088",
      "registerart": "HRB",
      "company_name": "Arbeitsmedizinischer Dienst der BG BAU GmbH",
      "company_seat": "Berlin",
      "details": "12.02.2025 (Bekanntmachungsdatum)\n\nBerlin Amtsgericht Berlin (Charlottenburg) HRB 200088\nEinreichung neuer Dokumente\n\nArbeitsmedizinischer Dienst der BG BAU GmbH\nGesellschaft mit beschränkter Haftung\nBerlin\n\nAls nicht eingetragen wird veröffentlicht: Es wurde eine neue Liste der Aufsichtsratsmitglieder eingereicht (§52 GmbHG)."
    },
    {
      "date": "2025-02-12",
      "id": "101085",
      "original_text": "Einreichung neuer Dokumente\nBrandenburg Amtsgericht Cottbus HRB 11693\nMercedes-Benz Grund Services GmbH – Schönefeld",
      "type": "Einreichung neuer Dokumente",
      "state": "Brandenburg",
      "amtsgericht": "Amtsgericht Cottbus",
      "registernummer": "HRB 11693",
      "registerart": "HRB",
      "company_name": "Mercedes-Benz Grund Services GmbH",
      "company_seat": "Schönefeld",
      "details": "12.02.2025 (Bekanntmachungsdatum)\n\nBrandenburg Amtsgericht Cottbus HRB 11693\nEinreichung neuer Dokumente\n\nMercedes-Benz Grund Services GmbH\nGesellschaft mit beschränkter Haftung\nSchönefeld\n\nDie aktuelle Liste der Beiratsmitglieder wurde zum Handelsregister gem. § 52 Abs. 3 GmbHG eingereicht."
    },
    {
      "date": "2025-02-12",
      "id": "101086",
      "original_text": "Löschungsankündigung\nBerlin Amtsgericht Berlin (Charlottenburg) HRB 185557\nP & K Komplettbau GmbH – Berlin",
      "type": "Löschungsankündigung",
      "state": "Berlin",
      "amtsgericht": "Amtsgericht Berlin (Charlottenburg)",
      "registernummer": "HRB 185557",
      "registerart": "HRB",
      "company_name": "P & K Komplettbau GmbH",
      "company_seat": "Berlin",
      "details": "12.02.2025 (Bekanntmachungsdatum)\n\nBerlin Amtsgericht Berlin (Charlottenburg) HRB 185557\nLöschungsankündigung\n\nP & K Komplettbau GmbH\nGesellschaft mit beschränkter Haftung\nBerlin\n\nBei der nachstehenden Gesellschaft wird das Amtslöschungsverfahren gemäß § 394 FamFG eingeleitet. Widerspruchsfrist 6 Wochen"
    },
    {
      "date": "2025-02-12",
      "id": "101087",
      "original_text": "Einreichung neuer Dokumente\nBaden-Württemberg Amtsgericht Ulm HRB 630206\nZF Friedrichshafen AG – Friedrichshafen",
      "type": "Einreichung neuer Dokumente",
      "state": "Baden-Württemberg",
      "amtsgericht": "Amtsgericht Ulm",
      "registernummer": "HRB 630206",
      "registerart": "HRB",
      "company_name": "ZF Friedrichshafen AG",
      "company_seat": "Friedrichshafen",
      "details": "12.02.2025 (Bekanntmachungsdatum)\n\nBaden-Württemberg Amtsgericht Ulm HRB 630206\nEinreichung neuer Dokumente 12.02.2025 (Eintragungsdatum)\n\nZF Friedrichshafen AG\nAktiengesellschaft\nFriedrichshafen\n\nDie Gesellschaft hat am 12.02.2025 die Liste über die Zusammensetzung des Aufsichtsrats zum Handelsregister eingereicht."
    },
    {
      "date": "2025-02-12",
      "id": "101088",
      "original_text": "Einreichung neuer Dokumente\nBerlin Amtsgericht Berlin (Charlottenburg) HRB 133246\nTaupe Protea Property GmbH – Berlin",
      "type": "Einreichung neuer Dokumente",
      "state": "Berlin",
      "amtsgericht": "Amtsgericht Berlin (Charlottenburg)",
      "registernummer": "HRB 133246",
      "registerart": "HRB",
      "company_name": "Taupe Protea Property GmbH",
      "company_seat": "Berlin",
      "details": "12.02.2025 (Bekanntmachungsdatum)\n\nBerlin Amtsgericht Berlin (Charlottenburg) HRB 133246\nEinreichung neuer Dokumente\n\nTaupe Protea Property GmbH\nGesellschaft mit beschränkter Haftung\nBerlin\n\nAls nicht eingetragen wird veröffentlicht gem. §§ 336, 308 UmwG, § 10 HGB: Die Gesellschaft hat einen notariell beurkundeten Formwechselplan vom 06.02.2025 betreffend die grenzüberschreitende Verlegung des Satzungssitzes der Gesellschaft nach Luxemburg gemäß §§ 333 ff. UmwG zum Handelsregister des Amtsgerichts Charlottenburg eingereicht.\nDie Gesellschaft ist eine deutsche Gesellschaft mit beschränkter Haftung unter der Firma Taupe Protea Property GmbH, errichtet und bestehend nach deutschem Recht, mit Sitz in Berlin, Deutschland, eingetragen im Handelsregister des Amtsgerichts Charlottenburg unter HRB 133246 B. Die Gesellschaft soll durch grenzüberschreitenden, identitätswahrenden Formwechsel aufgrund eines Formwechselbeschlusses unter gleichzeitiger Verlegung des Satzungssitzes in eine Gesellschaft mit beschränkter Haftung nach dem Recht des Großherzogtums Luxemburg (société à responsabilité limitée) mit Sitz in Luxemburg, Großherzogtum Luxemburg, umgewandelt werden. Die Gesellschaft wird die Firma Taupe Protea Property S.à r.l. führen. Die an dem grenzüberschreitenden Formwechsel beteiligte Gesellschaft ist unter HRB 133246 B im Handelsregister des Amtsgerichts Charlottenburg eingetragen.\nDem Gesellschafter und den Gläubigern der Gesellschaft wird mitgeteilt, dass sie der Gesellschaft spätestens fünf Tage vor dem Tag der Gesellschafterversammlung Bemerkungen zu dem beim Handelsregister eingereichten Formwechselplan übermitteln können. Die Gesellschaft hat keine Arbeitnehmer und verfügt über keinen Betriebsrat oder eine sonstige Arbeitnehmervertretung.\nDie Rechte der Gläubiger der formwechselnden Gesellschaft ergeben sich aus §§ 341, 314 UmwG. Danach ist den Gläubigern der formwechselnden Gesellschaft Sicherheit zu leisten, soweit sie nicht Befriedigung verlangen können, wenn die neue Rechtsform nicht dem deutschen Recht unterliegt. Dieses Recht steht den Gläubigern jedoch nur zu, wenn sie binnen drei Monaten nach dem Tag, an dem der Formwechselplan (oder sein Entwurf) bekannt gemacht worden ist, ihre Ansprüche gerichtlich geltend machen. Dieses Recht auf Sicherheitsleistung steht Gläubigern nur im Hinblick auf solche Forderungen zu, die vor der Bekanntmachung des Formwechselplans oder seines Entwurfs entstanden, aber im Zeitpunkt der Bekanntmachung noch nicht fällig geworden sind, und deren Erfüllung durch den Formwechsel gefährdet wird."
    },
    {
      "date": "2025-02-12",
      "id": "101089",
      "original_text": "Einreichung neuer Dokumente\nBaden-Württemberg Amtsgericht Freiburg HRB 7575\nGreiff Capital Management AG – Freiburg im Breisgau",
      "type": "Einreichung neuer Dokumente",
      "state": "Baden-Württemberg",
      "amtsgericht": "Amtsgericht Freiburg",
      "registernummer": "HRB 7575",
      "registerart": "HRB",
      "company_name": "Greiff Capital Management AG",
      "company_seat": "Freiburg im Breisgau",
      "details": "12.02.2025 (Bekanntmachungsdatum)\n\nBaden-Württemberg Amtsgericht Freiburg HRB 7575\nEinreichung neuer Dokumente 12.02.2025 (Eintragungsdatum)\n\nGreiff Capital Management AG\nAktiengesellschaft\nFreiburg im Breisgau\n\nDie Gesellschaft hat am 11.02.2025 die Liste über die Zusammensetzung des Aufsichtsrats zum Handelsregister eingereicht."
    },
    {
      "date": "2025-02-12",
      "id": "101090",
      "original_text": "Registerbekanntmachung nach dem Umwandlungsgesetz\nSchleswig-Holstein Amtsgericht Kiel HRA 12536\nDachdeckerei Marvin Borkenhagen GmbH & Co. KG – Großenaspe",
      "type": "Registerbekanntmachung nach dem Umwandlungsgesetz",
      "state": "Schleswig-Holstein",
      "amtsgericht": "Amtsgericht Kiel",
      "registernummer": "HRA 12536",
      "registerart": "HRA",
      "company_name": "Dachdeckerei Marvin Borkenhagen GmbH & Co. KG",
      "company_seat": "Großenaspe",
      "details": "12.02.2025 (Bekanntmachungsdatum)\n\nSchleswig-Holstein Amtsgericht Kiel HRA 12536\nRegisterbekanntmachung nach dem Umwandlungsgesetz 11.02.2025 (Eintragungsdatum)\n\nDachdeckerei Marvin Borkenhagen GmbH & Co. KG\nKommanditgesellschaft\nGroßenaspe\n\nZu Eintragungsnummer 2 vom 11.02.2025 wird als nicht eingetragen veröffentlicht: Den Gläubigern der an der Verschmelzung beteiligten Rechtsträger ist, wenn sie binnen sechs Monaten nach dem Tag, an dem die Eintragung der Verschmelzung in das Register des Sitzes desjenigen Rechtsträgers, dessen Gläubiger sie sind, nach § 19 Abs. 3 UmwG bekannt gemacht worden ist, ihren Anspruch nach Grund und Höhe schriftlich anmelden, Sicherheit zu leisten, soweit sie nicht Befriedigung verlangen können. Dieses Recht steht den Gläubigern jedoch nur zu, wenn sie glaubhaft machen, dass durch die Verschmelzung die Erfüllung ihrer Forderung gefährdet wird."
    },
    {
      "date": "2025-02-12",
      "id": "101091",
      "original_text": "Registerbekanntmachung nach dem Umwandlungsgesetz\nBerlin Amtsgericht Berlin (Charlottenburg) HRB 125879\nPurple Bowenia Property GmbH – Berlin",
      "type": "Registerbekanntmachung nach dem Umwandlungsgesetz",
      "state": "Berlin",
      "amtsgericht": "Amtsgericht Berlin (Charlottenburg)",
      "registernummer": "HRB 125879",
      "registerart": "HRB",
      "company_name": "Purple Bowenia Property GmbH",
      "company_seat": "Berlin",
      "details": "12.02.2025 (Bekanntmachungsdatum)\n\nBerlin Amtsgericht Berlin (Charlottenburg) HRB 125879\nRegisterbekanntmachung nach dem Umwandlungsgesetz\n\nPurple Bowenia Property GmbH\nGesellschaft mit beschränkter Haftung\nBerlin\n\nAls nicht eingetragen wird veröffentlicht:\nDie Gesellschaft hat einen unter dem 06. Februar 2025 beurkundeten Formwechselplan betreffend einen grenzüberschreitenden Formwechsel der Gesellschaft nach Luxemburg bei dem Registergericht eingereicht und die folgenden offenzulegenden Angaben gemacht:\n\nFormwechselplan: Der notariell beurkundete Formwechselplan wurde elektronisch zum Handelsregister eingereicht.\nRechtsform, Firma und Sitz der formwechselnden Gesellschaft:\nDie Gesellschaft ist eine deutsche Gesellschaft mit beschränkter Haftung unter der Firma Purple Bowenia Property GmbH, errichtet und bestehend nach deutschem Recht, mit Sitz in Berlin, Deutschland, eingetragen im Handelsregister des Amtsgerichts Charlottenburg unter HRB 125879 B.\n\nDie Gesellschaft soll durch grenzüberschreitenden, identitätswahrenden Formwechsel aufgrund eines Formwechselbeschlusses unter gleichzeitiger Verlegung des Satzungssitzes in eine Gesellschaft mit beschränkter Haftung nach dem Recht des Großherzogtums Luxemburg (société à responsabilité limitée) mit Sitz in Luxemburg, Großherzogtum Luxemburg, umgewandelt werden. Die Gesellschaft wird die Firma Purple Bowenia Property S.à.r.l. führen. Register der formwechselnden Gesellschaft: Die an dem  grenzüberschreitenden Formwechsel beteiligte Gesellschaft ist unter\nHRB 125879 B im Handelsregister des Amtsgerichts Charlottenburg eingetragen. Hinweis an die Anteilsinhaber und Gläubiger: Dem Gesellschafter und den Gläubigern der Gesellschaft wird mitgeteilt, dass sie der Gesellschaft spätestens fünf Tage vor dem Tag der Gesellschafterversammlung Bemerkungen zu dem beim Handelsregister eingereichten Formwechselplan übermitteln können.\n\nHinweis an die zuständigen Betriebsräte und Arbeitnehmer der Gesellschaft: Die Gesellschaft hat keine Arbeitnehmer und verfügt über keinen Betriebsrat oder eine sonstige Arbeitnehmervertretung.\n\nGläubiger der Gesellschaft: Die Rechte der Gläubiger der formwechselnden Gesellschaft ergeben sich aus §§ 341, 314 UmwG. Danach ist den Gläubigern der formwechselnden Gesellschaft Sicherheit zu leisten, soweit sie nicht Befriedigung verlangen können, wenn die neue Rechtsform nicht dem deutschen Recht unterliegt. Dieses Recht steht den Gläubigern jedoch nur zu, wenn sie binnen drei Monaten nach dem Tag, an dem der Formwechselplan (oder sein Entwurf) bekannt gemacht worden ist, ihre Ansprüche gerichtlich geltend machen. Dieses Recht auf Sicherheitsleistung steht Gläubigern nur im Hinblick auf solche Forderungen zu, die vor der Bekanntmachung des Formwechselplans oder seines Entwurfs entstanden, aber im Zeitpunkt der Bekanntmachung noch nicht fällig geworden sind, und deren Erfüllung durch den Formwechsel gefährdet wird."
    },
    {
      "date": "2025-02-12",
      "id": "101092",
      "original_text": "Sonstige Registerbekanntmachung\nSaarland Amtsgericht Saarbrücken HRB 101190\nSchwarzrinderseen Weindorf Betriebs GmbH – Weiskirchen",
      "type": "Sonstige Registerbekanntmachung",
      "state": "Saarland",
      "amtsgericht": "Amtsgericht Saarbrücken",
      "registernummer": "HRB 101190",
      "registerart": "HRB",
      "company_name": "Schwarzrinderseen Weindorf Betriebs GmbH",
      "company_seat": "Weiskirchen",
      "details": "12.02.2025 (Bekanntmachungsdatum)\n\nSaarland Amtsgericht Saarbrücken HRB 101190\nSonstige Registerbekanntmachung 12.02.2025 (Eintragungsdatum)\n\nSchwarzrinderseen Weindorf Betriebs GmbH\nGesellschaft mit beschränkter Haftung\nWeiskirchen\n\nAls nicht eingetragen wird bekannt gemacht: Den Gläubigern der Gesellschaft, deren Forderungen begründet worden sind, bevor die Eintragung der Beendigung des Vertrages in das Handelsregister nach § 10 des HGB als bekanntgemacht gilt, hat der andere Vertragsteil Sicherheit zu leisten, wenn sie sich binnen sechs Monaten nach der Bekanntmachung der Eintragung zu diesem Zwecke bei ihm melden."
    },
    {
      "date": "2025-02-12",
      "id": "101093",
      "original_text": "Einreichung neuer Dokumente\nSaarland Amtsgericht Saarbrücken HRB 12702\nEnergie SaarLorLux AG – Saarbrücken",
      "type": "Einreichung neuer Dokumente",
      "state": "Saarland",
      "amtsgericht": "Amtsgericht Saarbrücken",
      "registernummer": "HRB 12702",
      "registerart": "HRB",
      "company_name": "Energie SaarLorLux AG",
      "company_seat": "Saarbrücken",
      "details": "12.02.2025 (Bekanntmachungsdatum)\n\nSaarland Amtsgericht Saarbrücken HRB 12702\nEinreichung neuer Dokumente\n\nEnergie SaarLorLux AG\nAktiengesellschaft\nSaarbrücken\n\nDer Vorstand der Gesellschaft hat eine Liste der Mitglieder des Aufsichtsrats zum Handelsregister eingereicht (§ 106 AktG)."
    },
    {
      "date": "2025-02-12",
      "id": "101094",
      "original_text": "Einreichung neuer Dokumente\nThüringen Amtsgericht Jena HRB 113628\nSWE UmweltService GmbH – Erfurt",
      "type": "Einreichung neuer Dokumente",
      "state": "Thüringen",
      "amtsgericht": "Amtsgericht Jena",
      "registernummer": "HRB 113628",
      "registerart": "HRB",
      "company_name": "SWE UmweltService GmbH",
      "company_seat": "Erfurt",
      "details": "12.02.2025 (Bekanntmachungsdatum)\n\nThüringen Amtsgericht Jena HRB 113628\nEinreichung neuer Dokumente\n\nSWE UmweltService GmbH\nGesellschaft mit beschränkter Haftung\nErfurt\n\nBekanntmachung gem. § 52 Abs. 3 Satz 2 GmbHG: Aufgrund einer Veränderung in den Personen der Aufsichtsratsmitglieder ist durch die Geschäftsführer eine neue Liste zum Handelsregister eingereicht worden."
    },
    {
      "date": "2025-02-12",
      "id": "101095",
      "original_text": "Sonstige Registerbekanntmachung\nThüringen Amtsgericht Jena HRB 507999\nSmart Commerce S.E. – Jena",
      "type": "Sonstige Registerbekanntmachung",
      "state": "Thüringen",
      "amtsgericht": "Amtsgericht Jena",
      "registernummer": "HRB 507999",
      "registerart": "HRB",
      "company_name": "Smart Commerce S.E.",
      "company_seat": "Jena",
      "details": "12.02.2025 (Bekanntmachungsdatum)\n\nThüringen Amtsgericht Jena HRB 507999\nSonstige Registerbekanntmachung\n\nSmart Commerce S.E.\nEuropäische Aktiengesellschaft (SE)\nJena\n\nBekanntmachung gem. § 106 AktG: Aufgrund einer Veränderung in den Personen der Aufsichtsratsmitglieder ist durch den Vorstand eine neue Liste zum Handelsregister eingereicht worden."
    },
    {
      "date": "2025-02-12",
      "id": "101096",
      "original_text": "Einreichung neuer Dokumente\nThüringen Amtsgericht Jena HRB 106077\nThüWa ThüringenWasser GmbH – Erfurt",
      "type": "Einreichung neuer Dokumente",
      "state": "Thüringen",
      "amtsgericht": "Amtsgericht Jena",
      "registernummer": "HRB 106077",
      "registerart": "HRB",
      "company_name": "ThüWa ThüringenWasser GmbH",
      "company_seat": "Erfurt",
      "details": "12.02.2025 (Bekanntmachungsdatum)\n\nThüringen Amtsgericht Jena HRB 106077\nEinreichung neuer Dokumente\n\nThüWa ThüringenWasser GmbH\nGesellschaft mit beschränkter Haftung\nErfurt\n\nBekanntmachung gem. § 52 Abs. 3 Satz 2 GmbHG: Aufgrund einer Veränderung in den Personen der Aufsichtsratsmitglieder ist durch die Geschäftsführer eine neue Liste zum Handelsregister eingereicht worden."
    },
    {
      "date": "2025-02-12",
      "id": "101097",
      "original_text": "Registerbekanntmachung nach dem Umwandlungsgesetz\nThüringen Amtsgericht Jena HRB 304338\nWohnpark \"Stadtblick\" Beteiligungs GmbH – Unterbreizbach",
      "type": "Registerbekanntmachung nach dem Umwandlungsgesetz",
      "state": "Thüringen",
      "amtsgericht": "Amtsgericht Jena",
      "registernummer": "HRB 304338",
      "registerart": "HRB",
      "company_name": "Wohnpark \"Stadtblick\" Beteiligungs GmbH",
      "company_seat": "Unterbreizbach",
      "details": "12.02.2025 (Bekanntmachungsdatum)\n\nThüringen Amtsgericht Jena HRB 304338\nRegisterbekanntmachung nach dem Umwandlungsgesetz 12.02.2025 (Eintragungsdatum)\n\nWohnpark \"Stadtblick\" Beteiligungs GmbH\nGesellschaft mit beschränkter Haftung\nUnterbreizbach\n\nNicht eingetragen: Den Gläubigern der an der Verschmelzung beteiligten Rechtsträger, ist wenn sie binnen sechs Monaten nach dem Tag, an dem die Eintragung der Verschmelzung in das Register des Sitzes desjenigen Rechtsträgers, dessen Gläubiger sie sind,  nach § 19 Abs. 3 UmwG als bekanntgemacht gilt, ihren Anspruch nach Grund und Höhe schriftlich anmelden, Sicherheit zu leisten, soweit sie nicht Befriedigung verlangen können. Dieses Recht steht ihnen jedoch nur zu, wenn sie glaubhaft machen, daß durch die Verschmelzung die Erfüllung ihrer Forderung gefährdet wird."
    },
    {
      "date": "2025-02-12",
      "id": "101098",
      "original_text": "Sonstige Registerbekanntmachung\nThüringen Amtsgericht Jena HRB 517998\nneurocare group AG – Ilmenau",
      "type": "Sonstige Registerbekanntmachung",
      "state": "Thüringen",
      "amtsgericht": "Amtsgericht Jena",
      "registernummer": "HRB 517998",
      "registerart": "HRB",
      "company_name": "neurocare group AG",
      "company_seat": "Ilmenau",
      "details": "12.02.2025 (Bekanntmachungsdatum)\n\nThüringen Amtsgericht Jena HRB 517998\nSonstige Registerbekanntmachung\n\nneurocare group AG\nAktiengesellschaft\nIlmenau\n\nBekanntmachung gem. § 106 AktG: Aufgrund einer Veränderung in den Personen der Aufsichtsratsmitglieder ist durch den Vorstand eine neue Liste zum Handelsregister eingereicht worden."
    },
    {
      "date": "2025-02-12",
      "id": "101099",
      "original_text": "Einreichung neuer Dokumente\nThüringen Amtsgericht Jena HRB 202956\nBurdo-Bäuerliche Aktiengesellschaft – Tanna",
      "type": "Einreichung neuer Dokumente",
      "state": "Thüringen",
      "amtsgericht": "Amtsgericht Jena",
      "registernummer": "HRB 202956",
      "registerart": "HRB",
      "company_name": "Burdo-Bäuerliche Aktiengesellschaft",
      "company_seat": "Tanna",
      "details": "12.02.2025 (Bekanntmachungsdatum)\n\nThüringen Amtsgericht Jena HRB 202956\nEinreichung neuer Dokumente 12.02.2025 (Eintragungsdatum)\n\nBurdo-Bäuerliche Aktiengesellschaft\nAktiengesellschaft\nTanna\n\nBekanntmachung gem. § 106 AktG: Aufgrund einer Veränderung in den Personen der Aufsichtsratsmitglieder ist durch den Vorstand eine neue Liste zum Handelsregister eingereicht worden."
    },
    {
      "date": "2025-02-12",
      "id": "101100",
      "original_text": "Registerbekanntmachung nach dem Umwandlungsgesetz\nSchleswig-Holstein Amtsgericht Kiel HRA 1152 BB\nErnst Fischer Inh. Kay Fischer e.K. – Kaltenkirchen",
      "type": "Registerbekanntmachung nach dem Umwandlungsgesetz",
      "state": "Schleswig-Holstein",
      "amtsgericht": "Amtsgericht Kiel",
      "registernummer": "HRA 1152 BB",
      "registerart": "HRA",
      "company_name": "Ernst Fischer Inh. Kay Fischer e.K.",
      "company_seat": "Kaltenkirchen",
      "details": "12.02.2025 (Bekanntmachungsdatum)\n\nSchleswig-Holstein Amtsgericht Kiel HRA 1152 BB\nRegisterbekanntmachung nach dem Umwandlungsgesetz 06.02.2025 (Eintragungsdatum)\n\nErnst Fischer Inh. Kay Fischer e.K.\nEinzelkaufmann / Einzelkauffrau\nKaltenkirchen\n\nZu Eintragungsnummer 5 vom 06.02.2025 wird als nicht eingetragen veröffentlicht: Den Gläubigern der an der Spaltung beteiligten Rechtsträger ist, wenn sie binnen sechs Monaten nach dem Tag, an dem die Eintragung der Spaltung in das Register des Sitzes desjenigen Rechtsträgers, dessen Gläubiger sie sind,  bekannt gemacht worden ist, ihren Anspruch nach Grund und Höhe schriftlich anmelden, Sicherheit zu leisten, soweit sie nicht Befriedigung verlangen können. Dieses Recht steht den Gläubigern jedoch nur zu, wenn sie glaubhaft machen, dass durch die Spaltung die Erfüllung ihrer Forderung gefährdet wird."
    },
    {
      "date": "2025-02-12",
      "id": "101101",
      "original_text": "Registerbekanntmachung nach dem Umwandlungsgesetz\nBaden-Württemberg Amtsgericht Stuttgart HRB 772757\nPartInvest Immobilien Beteiligungs GmbH – Vaihingen an der Enz",
      "type": "Registerbekanntmachung nach dem Umwandlungsgesetz",
      "state": "Baden-Württemberg",
      "amtsgericht": "Amtsgericht Stuttgart",
      "registernummer": "HRB 772757",
      "registerart": "HRB",
      "company_name": "PartInvest Immobilien Beteiligungs GmbH",
      "company_seat": "Vaihingen an der Enz",
      "details": "12.02.2025 (Bekanntmachungsdatum)\n\nBaden-Württemberg Amtsgericht Stuttgart HRB 772757\nRegisterbekanntmachung nach dem Umwandlungsgesetz 12.02.2025 (Eintragungsdatum)\n\nPartInvest Immobilien Beteiligungs GmbH\nGesellschaft mit beschränkter Haftung\nVaihingen an der Enz\n\nAls nicht eingetragen wird bekanntgemacht:\nDen Gläubigern der an der Verschmelzung beteiligten Rechtsträger ist, wenn sie binnen sechs Monaten nach dem Tag, an dem die Eintragung der Verschmelzung in das Register des Sitzes desjenigen Rechtsträgers, dessen Gläubiger sie sind, nach § 19 Abs. 3 UmwG als bekanntgemacht gilt, ihren Anspruch nach Grund und Höhe schriftlich anmelden, Sicherheit zu leisten, soweit sie nicht Befriedigung verlangen können. Dieses Recht steht den Gläubigern jedoch nur zu, wenn sie glaubhaft machen, dass durch die Verschmelzung die Erfüllung ihrer Forderung gefährdet wird."
    },
    {
      "date": "2025-02-12",
      "id": "101102",
      "original_text": "Registerbekanntmachung nach dem Umwandlungsgesetz\nSchleswig-Holstein Amtsgericht Kiel HRA 12472\nDachdeckerei Borkenhagen e.K. – Großenaspe",
      "type": "Registerbekanntmachung nach dem Umwandlungsgesetz",
      "state": "Schleswig-Holstein",
      "amtsgericht": "Amtsgericht Kiel",
      "registernummer": "HRA 12472",
      "registerart": "HRA",
      "company_name": "Dachdeckerei Borkenhagen e.K.",
      "company_seat": "Großenaspe",
      "details": "12.02.2025 (Bekanntmachungsdatum)\n\nSchleswig-Holstein Amtsgericht Kiel HRA 12472\nRegisterbekanntmachung nach dem Umwandlungsgesetz 11.02.2025 (Eintragungsdatum)\n\nDachdeckerei Borkenhagen e.K.\nEinzelkaufmann / Einzelkauffrau\nGroßenaspe\n\nZu Eintragungsnummer 2 vom 11.02.2025 wird als nicht eingetragen veröffentlicht: Den Gläubigern der an der Spaltung beteiligten Rechtsträger ist, wenn sie binnen sechs Monaten nach dem Tag, an dem die Eintragung der Spaltung in das Register des Sitzes desjenigen Rechtsträgers, dessen Gläubiger sie sind,  bekannt gemacht worden ist, ihren Anspruch nach Grund und Höhe schriftlich anmelden, Sicherheit zu leisten, soweit sie nicht Befriedigung verlangen können. Dieses Recht steht den Gläubigern jedoch nur zu, wenn sie glaubhaft machen, dass durch die Spaltung die Erfüllung ihrer Forderung gefährdet wird."
    },
    {
      "date": "2025-02-12",
      "id": "101103",
      "original_text": "Sonstige Registerbekanntmachung\nBerlin Amtsgericht Berlin (Charlottenburg) HRB 136070\nSunglow Malope Property GmbH – Berlin",
      "type": "Sonstige Registerbekanntmachung",
      "state": "Berlin",
      "amtsgericht": "Amtsgericht Berlin (Charlottenburg)",
      "registernummer": "HRB 136070",
      "registerart": "HRB",
      "company_name": "Sunglow Malope Property GmbH",
      "company_seat": "Berlin",
      "details": "12.02.2025 (Bekanntmachungsdatum)\n\nBerlin Amtsgericht Berlin (Charlottenburg) HRB 136070\nSonstige Registerbekanntmachung\n\nSunglow Malope Property GmbH\nGesellschaft mit beschränkter Haftung\nBerlin\n\nAls nicht eingetragen wird veröffentlicht:\nDie Gesellschaft hat einen grenzüberschreitenden Formwechselplan zum Handelsregister des Amtsgerichts Charlottenburg eingereicht.\n\n1. Im Hinblick auf den Inhalt der Bekanntmachung sowie §§ 336, 308 Abs. 1 S. 2 Nr. 1-4 UmwG werden folgende Angaben gemacht:\n\n1.1.1 Formwechselplan\nDer notariell beurkundete Formwechselplan wurde elektronisch zum Handelsregister eingereicht.\n\n1.1.2 Rechtsform, Firma und Sitz der formwechselnden Gesellschaft\nDie Gesellschaft ist eine deutsche Gesellschaft mit beschränkter Haftung unter der Firma Sunglow Malope Property GmbH, errichtet und bestehend nach deutschem Recht, mit Sitz in Berlin, Deutschland, eingetragen im Handelsregister des Amtsgerichts Charlottenburg unter HRB 136070 B.\nDie Gesellschaft soll durch grenzüberschreitenden, identitätswahrenden Formwechsel aufgrund eines Formwechselbeschlusses unter gleichzeitiger Verlegung des Satzungssitzes in eine Gesellschaft mit beschränkter Haftung nach dem Recht des Großherzogtums Luxemburg (société à responsabilité limitée) mit Sitz in Luxemburg, Großherzogtum Luxemburg, umgewandelt werden. Die Gesellschaft wird die Firma Sunglow Malope Property S.à r.l. führen.\n\n1.1.3 Register der formwechselnden Gesellschaft\nDie an dem grenzüberschreitenden Formwechsel beteiligte Gesellschaft ist unter HRB 136070 B im Handelsregister des Amtsgerichts Charlottenburg eingetragen.\n\n1.1.4 Hinweis an die Anteilsinhaber und Gläubiger\nDem Gesellschafter und den Gläubigern der Gesellschaft wird mitgeteilt, dass sie der Gesellschaft spätestens fünf Tage vor dem Tag der Gesellschafterversammlung Bemerkungen zu dem beim Handelsregister eingereichten Formwechselplan übermitteln können.\n\n1.1.5 Hinweis an die zuständigen Betriebsräte und Arbeitnehmer der Gesellschaft\nDie Gesellschaft hat keine Arbeitnehmer und verfügt über keinen Betriebsrat oder eine sonstige Arbeitnehmervertretung.\n\n1.1.6 Gläubiger der Gesellschaft\nDie Rechte der Gläubiger der formwechselnden Gesellschaft ergeben sich aus §§ 341, 314 UmwG. Danach ist den Gläubigern der formwechselnden Gesellschaft Sicherheit zu leisten, soweit sie nicht Befriedigung verlangen können, wenn die neue Rechtsform nicht dem deutschen Recht unterliegt. Dieses Recht steht den Gläubigern jedoch nur zu, wenn sie binnen drei Monaten nach dem Tag, an dem der Formwechselplan (oder sein Entwurf) bekannt gemacht worden ist, ihre Ansprüche gerichtlich geltend machen. Dieses Recht auf Sicherheitsleistung steht Gläubigem nur im Hinblick auf solche Forderungen zu, die vor der Bekanntmachung des Formwechselplans oder seines Entwurfs entstanden, aber im Zeitpunkt der Bekanntmachung noch nicht fällig geworden sind, und deren Erfüllung durch den Formwechsel gefährdet wird."
    },
    {
      "date": "2025-02-12",
      "id": "101104",
      "original_text": "Registerbekanntmachung nach dem Umwandlungsgesetz\nBaden-Württemberg Amtsgericht Stuttgart HRA 736940\nPartInvest Immobilien GmbH & Co. KG – Vaihingen an der Enz",
      "type": "Registerbekanntmachung nach dem Umwandlungsgesetz",
      "state": "Baden-Württemberg",
      "amtsgericht": "Amtsgericht Stuttgart",
      "registernummer": "HRA 736940",
      "registerart": "HRA",
      "company_name": "PartInvest Immobilien GmbH & Co. KG",
      "company_seat": "Vaihingen an der Enz",
      "details": "12.02.2025 (Bekanntmachungsdatum)\n\nBaden-Württemberg Amtsgericht Stuttgart HRA 736940\nRegisterbekanntmachung nach dem Umwandlungsgesetz 12.02.2025 (Eintragungsdatum)\n\nPartInvest Immobilien GmbH & Co. KG\nKommanditgesellschaft\nVaihingen an der Enz\n\nAls nicht eingetragen wird bekanntgemacht:\nDen Gläubigern der an der Verschmelzung beteiligten Rechtsträger ist, wenn sie binnen sechs Monaten nach dem Tag, an dem die Eintragung der Verschmelzung in das Register des Sitzes desjenigen Rechtsträgers, dessen Gläubiger sie sind, nach § 19 Abs. 3 UmwG als bekanntgemacht gilt, ihren Anspruch nach Grund und Höhe schriftlich anmelden, Sicherheit zu leisten, soweit sie nicht Befriedigung verlangen können. Dieses Recht steht den Gläubigern jedoch nur zu, wenn sie glaubhaft machen, dass durch die Verschmelzung die Erfüllung ihrer Forderung gefährdet wird."
    },
    {
      "date": "2025-02-12",
      "id": "101105",
      "original_text": "Registerbekanntmachung nach dem Umwandlungsgesetz\nBaden-Württemberg Amtsgericht Stuttgart HRA 734187\nFAVO GmbH & Co. KG – Bönnigheim",
      "type": "Registerbekanntmachung nach dem Umwandlungsgesetz",
      "state": "Baden-Württemberg",
      "amtsgericht": "Amtsgericht Stuttgart",
      "registernummer": "HRA 734187",
      "registerart": "HRA",
      "company_name": "FAVO GmbH & Co. KG",
      "company_seat": "Bönnigheim",
      "details": "12.02.2025 (Bekanntmachungsdatum)\n\nBaden-Württemberg Amtsgericht Stuttgart HRA 734187\nRegisterbekanntmachung nach dem Umwandlungsgesetz 12.02.2025 (Eintragungsdatum)\n\nFAVO GmbH & Co. KG\nKommanditgesellschaft\nBönnigheim\n\nAls nicht eingetragen wird bekanntgemacht:\nDen Gläubigern des an dem Formwechsel beteiligten Rechtsträgers ist, wenn sie binnen sechs Monaten nach dem Tag, an dem die Eintragung des Formwechsels in das Register des Sitzes desjenigen Rechtsträgers, dessen Gläubiger sie sind, nach § 19 Abs. 3 UmwG als bekanntgemacht gilt, ihren Anspruch nach Grund und Höhe schriftlich anmelden, Sicherheit zu leisten, soweit sie nicht Befriedigung verlangen können. Dieses Recht steht den Gläubigern jedoch nur zu, wenn sie glaubhaft machen, dass durch den Formwechsel die Erfüllung ihrer Forderung gefährdet wird."
    },
    {
      "date": "2025-02-12",
      "id": "101106",
      "original_text": "Registerbekanntmachung nach dem Umwandlungsgesetz\nBaden-Württemberg Amtsgericht Stuttgart HRB 798467\nFAVO GmbH – Bönnigheim",
      "type": "Registerbekanntmachung nach dem Umwandlungsgesetz",
      "state": "Baden-Württemberg",
      "amtsgericht": "Amtsgericht Stuttgart",
      "registernummer": "HRB 798467",
      "registerart": "HRB",
      "company_name": "FAVO GmbH",
      "company_seat": "Bönnigheim",
      "details": "12.02.2025 (Bekanntmachungsdatum)\n\nBaden-Württemberg Amtsgericht Stuttgart HRB 798467\nRegisterbekanntmachung nach dem Umwandlungsgesetz 12.02.2025 (Eintragungsdatum)\n\nFAVO GmbH\nGesellschaft mit beschränkter Haftung\nBönnigheim\n\nAls nicht eingetragen wird bekanntgemacht:\nDen Gläubigern des an dem Formwechsel beteiligten Rechtsträgers ist, wenn sie binnen sechs Monaten nach dem Tag, an dem die Eintragung des Formwechsels in das Register des Sitzes desjenigen Rechtsträgers, dessen Gläubiger sie sind, nach § 19 Abs. 3 UmwG als bekanntgemacht gilt, ihren Anspruch nach Grund und Höhe schriftlich anmelden, Sicherheit zu leisten, soweit sie nicht Befriedigung verlangen können. Dieses Recht steht den Gläubigern jedoch nur zu, wenn sie glaubhaft machen, dass durch den Formwechsel die Erfüllung ihrer Forderung gefährdet wird."
    },
    {
      "date": "2025-02-12",
      "id": "101107",
      "original_text": "Löschungsankündigung\nBerlin Amtsgericht Berlin (Charlottenburg) HRB 241633\nParolt GmbH – Berlin",
      "type": "Löschungsankündigung",
      "state": "Berlin",
      "amtsgericht": "Amtsgericht Berlin (Charlottenburg)",
      "registernummer": "HRB 241633",
      "registerart": "HRB",
      "company_name": "Parolt GmbH",
      "company_seat": "Berlin",
      "details": "12.02.2025 (Bekanntmachungsdatum)\n\nBerlin Amtsgericht Berlin (Charlottenburg) HRB 241633\nLöschungsankündigung\n\nParolt GmbH\nGesellschaft mit beschränkter Haftung\nBerlin\n\nBei der nachstehenden Gesellschaft wird das Amtslöschungsverfahren gemäß § 394 FamFG eingeleitet. Widerspruchsfrist 6 Wochen"
    },
    {
      "date": "2025-02-12",
      "id": "101108",
      "original_text": "Löschungsankündigung\nBerlin Amtsgericht Berlin (Charlottenburg) HRB 151065\nVT Dienstleistungen GmbH – Berlin",
      "type": "Löschungsankündigung",
      "state": "Berlin",
      "amtsgericht": "Amtsgericht Berlin (Charlottenburg)",
      "registernummer": "HRB 151065",
      "registerart": "HRB",
      "company_name": "VT Dienstleistungen GmbH",
      "company_seat": "Berlin",
      "details": "12.02.2025 (Bekanntmachungsdatum)\n\nBerlin Amtsgericht Berlin (Charlottenburg) HRB 151065\nLöschungsankündigung\n\nVT Dienstleistungen GmbH\nGesellschaft mit beschränkter Haftung\nBerlin\n\nBei der nachstehenden Gesellschaft wird das Amtslöschungsverfahren gemäß § 394 FamFG eingeleitet. Widerspruchsfrist 6 Wochen"
    },
    {
      "date": "2025-02-12",
      "id": "101109",
      "original_text": "Löschungsankündigung\nNordrhein-Westfalen Amtsgericht Coesfeld HRA 5463\nBecker`s Sportshop Thorsten Becker e. K. – Lüdinghausen",
      "type": "Löschungsankündigung",
      "state": "Nordrhein-Westfalen",
      "amtsgericht": "Amtsgericht Coesfeld",
      "registernummer": "HRA 5463",
      "registerart": "HRA",
      "company_name": "Becker`s Sportshop Thorsten Becker e. K.",
      "company_seat": "Lüdinghausen",
      "details": "12.02.2025 (Bekanntmachungsdatum)\n\nNordrhein-Westfalen Amtsgericht Coesfeld HRA 5463\nLöschungsankündigung\n\nBecker`s Sportshop Thorsten Becker e. K.\nEinzelkaufmann\nLüdinghausen\n\nDas Registergericht beabsichtigt,die Firma gemäß § 31 Abs. 2 Satz 2 HGB, § 393 FamFG von Amts wegen zu löschen.\n\nGegen diese Verfügung kann Widerspruch eingelegt werden. Die Frist zur Erhebung eines Widerspruchs gegen die beabsichtigte Löschung ist auf zwei Monate ab Veröffentlichung festgesetzt.\nDiese Androhung kann mit dem Widerspruch angefochten werden. Er ist innerhalb 2 Monaten bei dem Amtsgericht Coesfeld, Friedrich-Ebert-Straße 6,, 48653 Coesfeld, einzulegen.\nDer Widerspruch wird durch Einreichung einer Widerspruchsschrift oder zur Niederschrift der Geschäftsstelle des genannten Gerichts eingelegt. Er kann auch zur Niederschrift der Geschäftsstelle eines jeden Amtsgerichts erklärt werden. Die Einlegung kann auch mittels elektronischen Dokuments erfolgen. Informationen zu den weiteren Voraussetzungen zur Signatur und Übermittlung sind auf dem Justizportal des Bundes und der Länder (www.justiz.de) im Themenbereich zur elektronischen Kommunikation zu finden. Eine Einlegung per einfacher E Mail ist unzulässig. Rechtsanwältinnen, Rechtsanwälte, Behörden und juristische Personen des öffentlichen Rechts einschließlich der zur Erfüllung ihrer öffentlichen Aufgaben gebildeten Zusammenschlüsse sind zur Einlegung mittels elektronischen Dokuments verpflichtet."
    },
    {
      "date": "2025-02-12",
      "id": "101110",
      "original_text": "Löschungsankündigung\nBerlin Amtsgericht Berlin (Charlottenburg) HRB 204068\nMetropol Limousinen GmbH – Berlin",
      "type": "Löschungsankündigung",
      "state": "Berlin",
      "amtsgericht": "Amtsgericht Berlin (Charlottenburg)",
      "registernummer": "HRB 204068",
      "registerart": "HRB",
      "company_name": "Metropol Limousinen GmbH",
      "company_seat": "Berlin",
      "details": "12.02.2025 (Bekanntmachungsdatum)\n\nBerlin Amtsgericht Berlin (Charlottenburg) HRB 204068\nLöschungsankündigung\n\nMetropol Limousinen GmbH\nGesellschaft mit beschränkter Haftung\nBerlin\n\nBei der nachstehenden Gesellschaft wird das Amtslöschungsverfahren gemäß § 394 FamFG eingeleitet. Widerspruchsfrist 6 Wochen"
    },
    {
      "date": "2025-02-12",
      "id": "101111",
      "original_text": "Löschungsankündigung\nBaden-Württemberg Amtsgericht Mannheim HRB 736010\nBerko Sicherheitstechnik GmbH – Rastatt",
      "type": "Löschungsankündigung",
      "state": "Baden-Württemberg",
      "amtsgericht": "Amtsgericht Mannheim",
      "registernummer": "HRB 736010",
      "registerart": "HRB",
      "company_name": "Berko Sicherheitstechnik GmbH",
      "company_seat": "Rastatt",
      "details": "12.02.2025 (Bekanntmachungsdatum)\n\nBaden-Württemberg Amtsgericht Mannheim HRB 736010\nLöschungsankündigung\n\nBerko Sicherheitstechnik GmbH\nGesellschaft mit beschränkter Haftung\nRastatt\n\nAls nicht eingetragen wird bekanntgemacht:\nDas Gericht beabsichtigt, die Gesellschaft wegen Vermögenslosigkeit im Handelsregister von Amts wegen nach § 394 FamFG zu löschen. Die Frist zur Geltendmachung eines Widerspruchs gegen die beabsichtigte Löschung ist auf einen Monat ab Veröffentlichung bestimmt."
    },
    {
      "date": "2025-02-12",
      "id": "101112",
      "original_text": "Löschungsankündigung\nBerlin Amtsgericht Berlin (Charlottenburg) HRB 167851\nKOLAR AUTOHANDEL GmbH – Berlin",
      "type": "Löschungsankündigung",
      "state": "Berlin",
      "amtsgericht": "Amtsgericht Berlin (Charlottenburg)",
      "registernummer": "HRB 167851",
      "registerart": "HRB",
      "company_name": "KOLAR AUTOHANDEL GmbH",
      "company_seat": "Berlin",
      "details": "12.02.2025 (Bekanntmachungsdatum)\n\nBerlin Amtsgericht Berlin (Charlottenburg) HRB 167851\nLöschungsankündigung\n\nKOLAR AUTOHANDEL GmbH\nGesellschaft mit beschränkter Haftung\nBerlin\n\nBei der nachstehenden Gesellschaft wird das Amtslöschungsverfahren gemäß § 394 FamFG eingeleitet. Widerspruchsfrist 6 Wochen"
    },
    {
      "date": "2025-02-12",
      "id": "101113",
      "original_text": "Registerbekanntmachung nach dem Umwandlungsgesetz\nBaden-Württemberg Amtsgericht Mannheim HRB 753571\nThor Bau Haustechnik Dienstleistungen GmbH – Baden-Baden",
      "type": "Registerbekanntmachung nach dem Umwandlungsgesetz",
      "state": "Baden-Württemberg",
      "amtsgericht": "Amtsgericht Mannheim",
      "registernummer": "HRB 753571",
      "registerart": "HRB",
      "company_name": "Thor Bau Haustechnik Dienstleistungen GmbH",
      "company_seat": "Baden-Baden",
      "details": "12.02.2025 (Bekanntmachungsdatum)\n\nBaden-Württemberg Amtsgericht Mannheim HRB 753571\nRegisterbekanntmachung nach dem Umwandlungsgesetz 12.02.2025 (Eintragungsdatum)\n\nThor Bau Haustechnik Dienstleistungen GmbH\nGesellschaft mit beschränkter Haftung\nBaden-Baden\n\nDen Gläubigern des an dem Formwechsel beteiligten Rechtsträgers ist, wenn sie binnen sechs Monaten nach dem Tag, an dem die Eintragung des Formwechsels in das Register des Sitzes desjenigen Rechtsträgers, dessen Gläubiger sie sind, nach § 19 Abs. 3 UmwG als bekanntgemacht gilt, ihren Anspruch nach Grund und Höhe schriftlich anmelden, Sicherheit zu leisten, soweit sie nicht Befriedigung verlangen können. Dieses Recht steht den Gläubigern jedoch nur zu, wenn sie glaubhaft machen, dass durch den Formwechsel die Erfüllung ihrer Forderung gefährdet wird."
    },
    {
      "date": "2025-02-12",
      "id": "101114",
      "original_text": "Registerbekanntmachung nach dem Umwandlungsgesetz\nBaden-Württemberg Amtsgericht Mannheim GsR 1237\nThor Bau Haustechnik Dienstleistungen eGbR – Baden-Baden",
      "type": "Registerbekanntmachung nach dem Umwandlungsgesetz",
      "state": "Baden-Württemberg",
      "amtsgericht": "Amtsgericht Mannheim",
      "registernummer": "GsR 1237",
      "registerart": "GsR",
      "company_name": "Thor Bau Haustechnik Dienstleistungen eGbR",
      "company_seat": "Baden-Baden",
      "details": "12.02.2025 (Bekanntmachungsdatum)\n\nBaden-Württemberg Amtsgericht Mannheim GsR 1237\nRegisterbekanntmachung nach dem Umwandlungsgesetz 12.02.2025 (Eintragungsdatum)\n\nThor Bau Haustechnik Dienstleistungen eGbR\nGesellschaft bürgerlichen Rechts\nBaden-Baden\n\nDen Gläubigern des an dem Formwechsel beteiligten Rechtsträgers ist, wenn sie binnen sechs Monaten nach dem Tag, an dem die Eintragung des Formwechsels in das Register des Sitzes desjenigen Rechtsträgers, dessen Gläubiger sie sind, nach § 19 Abs. 3 UmwG als bekanntgemacht gilt, ihren Anspruch nach Grund und Höhe schriftlich anmelden, Sicherheit zu leisten, soweit sie nicht Befriedigung verlangen können. Dieses Recht steht den Gläubigern jedoch nur zu, wenn sie glaubhaft machen, dass durch den Formwechsel die Erfüllung ihrer Forderung gefährdet wird."
    },
    {
      "date": "2025-02-12",
      "id": "101115",
      "original_text": "Einreichung neuer Dokumente\nBaden-Württemberg Amtsgericht Stuttgart HRB 105605\nMilchwirtschaftliche Beteiligungs-Aktiengesellschaft – Heilbronn",
      "type": "Einreichung neuer Dokumente",
      "state": "Baden-Württemberg",
      "amtsgericht": "Amtsgericht Stuttgart",
      "registernummer": "HRB 105605",
      "registerart": "HRB",
      "company_name": "Milchwirtschaftliche Beteiligungs-Aktiengesellschaft",
      "company_seat": "Heilbronn",
      "details": "12.02.2025 (Bekanntmachungsdatum)\n\nBaden-Württemberg Amtsgericht Stuttgart HRB 105605\nEinreichung neuer Dokumente\n\nMilchwirtschaftliche Beteiligungs-Aktiengesellschaft\nAktiengesellschaft\nHeilbronn\n\nDie Gesellschaft hat am 23.12.2024 die Liste über die Zusammensetzung des Aufsichtsrats zum Handelsregister eingereicht."
    },
    {
      "date": "2025-02-12",
      "id": "101116",
      "original_text": "Löschungsankündigung\nBerlin Amtsgericht Berlin (Charlottenburg) HRB 253771\nRevera Financial Capital GmbH – Berlin",
      "type": "Löschungsankündigung",
      "state": "Berlin",
      "amtsgericht": "Amtsgericht Berlin (Charlottenburg)",
      "registernummer": "HRB 253771",
      "registerart": "HRB",
      "company_name": "Revera Financial Capital GmbH",
      "company_seat": "Berlin",
      "details": "12.02.2025 (Bekanntmachungsdatum)\n\nBerlin Amtsgericht Berlin (Charlottenburg) HRB 253771\nLöschungsankündigung\n\nRevera Financial Capital GmbH\nGesellschaft mit beschränkter Haftung\nBerlin\n\nBei der nachstehenden Gesellschaft wird das Amtslöschungsverfahren gemäß § 394 FamFG eingeleitet. Widerspruchsfrist 6 Wochen"
    },
    {
      "date": "2025-02-12",
      "id": "101117",
      "original_text": "Registerbekanntmachung nach dem Umwandlungsgesetz\nSchleswig-Holstein Amtsgericht Kiel HRA 11494\nHypion Motion Lübeck GmbH & Co. KG – Kiel",
      "type": "Registerbekanntmachung nach dem Umwandlungsgesetz",
      "state": "Schleswig-Holstein",
      "amtsgericht": "Amtsgericht Kiel",
      "registernummer": "HRA 11494",
      "registerart": "HRA",
      "company_name": "Hypion Motion Lübeck GmbH & Co. KG",
      "company_seat": "Kiel",
      "details": "12.02.2025 (Bekanntmachungsdatum)\n\nSchleswig-Holstein Amtsgericht Kiel HRA 11494\nRegisterbekanntmachung nach dem Umwandlungsgesetz 04.02.2025 (Eintragungsdatum)\n\nHypion Motion Lübeck GmbH & Co. KG\nKommanditgesellschaft\nKiel\n\nZu Eintragungsnummer 2 vom 04.02.2025 wird als nicht eingetragen veröffentlicht: Den Gläubigern der an der Verschmelzung beteiligten Rechtsträger ist, wenn sie binnen sechs Monaten nach dem Tag, an dem die Eintragung der Verschmelzung in das Register des Sitzes desjenigen Rechtsträgers, dessen Gläubiger sie sind, nach § 19 Abs. 3 UmwG bekannt gemacht worden ist, ihren Anspruch nach Grund und Höhe schriftlich anmelden, Sicherheit zu leisten, soweit sie nicht Befriedigung verlangen können. Dieses Recht steht den Gläubigern jedoch nur zu, wenn sie glaubhaft machen, dass durch die Verschmelzung die Erfüllung ihrer Forderung gefährdet wird."
    },
    {
      "date": "2025-02-12",
      "id": "101118",
      "original_text": "Registerbekanntmachung nach dem Umwandlungsgesetz\nBaden-Württemberg Amtsgericht Stuttgart HRB 769893\nHR Path GmbH – Stuttgart",
      "type": "Registerbekanntmachung nach dem Umwandlungsgesetz",
      "state": "Baden-Württemberg",
      "amtsgericht": "Amtsgericht Stuttgart",
      "registernummer": "HRB 769893",
      "registerart": "HRB",
      "company_name": "HR Path GmbH",
      "company_seat": "Stuttgart",
      "details": "12.02.2025 (Bekanntmachungsdatum)\n\nBaden-Württemberg Amtsgericht Stuttgart HRB 769893\nRegisterbekanntmachung nach dem Umwandlungsgesetz 12.02.2025 (Eintragungsdatum)\n\nHR Path GmbH\nGesellschaft mit beschränkter Haftung\nStuttgart\n\nAls nicht eingetragen wird bekanntgemacht:\nDen Gläubigern der an der Verschmelzung beteiligten Rechtsträger ist, wenn sie binnen sechs Monaten nach dem Tag, an dem die Eintragung der Verschmelzung in das Register des Sitzes desjenigen Rechtsträgers, dessen Gläubiger sie sind, nach § 19 Abs. 3 UmwG als bekanntgemacht gilt, ihren Anspruch nach Grund und Höhe schriftlich anmelden, Sicherheit zu leisten, soweit sie nicht Befriedigung verlangen können. Dieses Recht steht den Gläubigern jedoch nur zu, wenn sie glaubhaft machen, dass durch die Verschmelzung die Erfüllung ihrer Forderung gefährdet wird."
    },
    {
      "date": "2025-02-12",
      "id": "101119",
      "original_text": "Löschungsankündigung\nBerlin Amtsgericht Berlin (Charlottenburg) HRB 170537\nITC MorgenStern GmbH – Berlin",
      "type": "Löschungsankündigung",
      "state": "Berlin",
      "amtsgericht": "Amtsgericht Berlin (Charlottenburg)",
      "registernummer": "HRB 170537",
      "registerart": "HRB",
      "company_name": "ITC MorgenStern GmbH",
      "company_seat": "Berlin",
      "details": "12.02.2025 (Bekanntmachungsdatum)\n\nBerlin Amtsgericht Berlin (Charlottenburg) HRB 170537\nLöschungsankündigung\n\nITC MorgenStern GmbH\nGesellschaft mit beschränkter Haftung\nBerlin\n\nBei der nachstehenden Gesellschaft wird das Amtslöschungsverfahren gemäß § 394 FamFG eingeleitet. Widerspruchsfrist: 6 Wochen."
    },
    {
      "date": "2025-02-12",
      "id": "101120",
      "original_text": "Löschungsankündigung\nBaden-Württemberg Amtsgericht Mannheim HRB 744020\nFieseler-Vermögensverwaltungs GmbH – Marxzell",
      "type": "Löschungsankündigung",
      "state": "Baden-Württemberg",
      "amtsgericht": "Amtsgericht Mannheim",
      "registernummer": "HRB 744020",
      "registerart": "HRB",
      "company_name": "Fieseler-Vermögensverwaltungs GmbH",
      "company_seat": "Marxzell",
      "details": "12.02.2025 (Bekanntmachungsdatum)\n\nBaden-Württemberg Amtsgericht Mannheim HRB 744020\nLöschungsankündigung\n\nFieseler-Vermögensverwaltungs GmbH\nGesellschaft mit beschränkter Haftung\nMarxzell\n\nDas Gericht beabsichtigt, die Gesellschaft wegen Vermögenslosigkeit im Handelsregister von Amts wegen nach § 394 FamFG zu löschen. Die Frist zur Geltendmachung eines Widerspruchs gegen die beabsichtigte Löschung ist auf einen Monat ab Veröffentlichung bestimmt."
    },
    {
      "date": "2025-02-12",
      "id": "101121",
      "original_text": "Registerbekanntmachung nach dem Umwandlungsgesetz\nBaden-Württemberg Amtsgericht Ulm HRB 720393\nin.Silva, Gesellschaft für Forst-, Handels- und Logistikdienstleistungen mbH – Leutkirch im Allgäu",
      "type": "Registerbekanntmachung nach dem Umwandlungsgesetz",
      "state": "Baden-Württemberg",
      "amtsgericht": "Amtsgericht Ulm",
      "registernummer": "HRB 720393",
      "registerart": "HRB",
      "company_name": "in.Silva, Gesellschaft für Forst-, Handels- und Logistikdienstleistungen mbH",
      "company_seat": "Leutkirch im Allgäu",
      "details": "12.02.2025 (Bekanntmachungsdatum)\n\nBaden-Württemberg Amtsgericht Ulm HRB 720393\nRegisterbekanntmachung nach dem Umwandlungsgesetz 12.02.2025 (Eintragungsdatum)\n\nin.Silva, Gesellschaft für Forst-, Handels- und Logistikdienstleistungen mbH\nGesellschaft mit beschränkter Haftung\nLeutkirch im Allgäu\n\nAls nicht eingetragen wird bekanntgemacht:\nDen Gläubigern der an der Verschmelzung beteiligten Rechtsträger ist, wenn sie binnen sechs Monaten nach dem Tag, an dem die Eintragung der Verschmelzung in das Register des Sitzes desjenigen Rechtsträgers, dessen Gläubiger sie sind, nach § 19 Abs. 3 UmwG als bekanntgemacht gilt, ihren Anspruch nach Grund und Höhe schriftlich anmelden, Sicherheit zu leisten, soweit sie nicht Befriedigung verlangen können. Dieses Recht steht den Gläubigern jedoch nur zu, wenn sie glaubhaft machen, dass durch die Verschmelzung die Erfüllung ihrer Forderung gefährdet wird."
    },
    {
      "date": "2025-02-12",
      "id": "101122",
      "original_text": "Registerbekanntmachung nach dem Umwandlungsgesetz\nBaden-Württemberg Amtsgericht Ulm HRB 730708\nin.Silva international GmbH – Leutkirch im Allgäu",
      "type": "Registerbekanntmachung nach dem Umwandlungsgesetz",
      "state": "Baden-Württemberg",
      "amtsgericht": "Amtsgericht Ulm",
      "registernummer": "HRB 730708",
      "registerart": "HRB",
      "company_name": "in.Silva international GmbH",
      "company_seat": "Leutkirch im Allgäu",
      "details": "12.02.2025 (Bekanntmachungsdatum)\n\nBaden-Württemberg Amtsgericht Ulm HRB 730708\nRegisterbekanntmachung nach dem Umwandlungsgesetz 12.02.2025 (Eintragungsdatum)\n\nin.Silva international GmbH\nGesellschaft mit beschränkter Haftung\nLeutkirch im Allgäu\n\nAls nicht eingetragen wird bekanntgemacht:\nDen Gläubigern der an der Verschmelzung beteiligten Rechtsträger ist, wenn sie binnen sechs Monaten nach dem Tag, an dem die Eintragung der Verschmelzung in das Register des Sitzes desjenigen Rechtsträgers, dessen Gläubiger sie sind, nach § 19 Abs. 3 UmwG als bekanntgemacht gilt, ihren Anspruch nach Grund und Höhe schriftlich anmelden, Sicherheit zu leisten, soweit sie nicht Befriedigung verlangen können. Dieses Recht steht den Gläubigern jedoch nur zu, wenn sie glaubhaft machen, dass durch die Verschmelzung die Erfüllung ihrer Forderung gefährdet wird."
    },
    {
      "date": "2025-02-12",
      "id": "101123",
      "original_text": "Einreichung neuer Dokumente\nBerlin Amtsgericht Berlin (Charlottenburg) HRB 175497\neClear Aktiengesellschaft – Berlin",
      "type": "Einreichung neuer Dokumente",
      "state": "Berlin",
      "amtsgericht": "Amtsgericht Berlin (Charlottenburg)",
      "registernummer": "HRB 175497",
      "registerart": "HRB",
      "company_name": "eClear Aktiengesellschaft",
      "company_seat": "Berlin",
      "details": "12.02.2025 (Bekanntmachungsdatum)\n\nBerlin Amtsgericht Berlin (Charlottenburg) HRB 175497\nEinreichung neuer Dokumente\n\neClear Aktiengesellschaft\nAktiengesellschaft\nBerlin\n\nAls nicht eingetragen wird veröffentlicht: Es wurde eine neue Liste der Aufsichtsratsmitglieder eingereicht (§ 106 AktG)."
    },
    {
      "date": "2025-02-12",
      "id": "101124",
      "original_text": "Löschungsankündigung\nBerlin Amtsgericht Berlin (Charlottenburg) HRB 207173\nW & M Business UG (haftungsbeschränkt) – Berlin",
      "type": "Löschungsankündigung",
      "state": "Berlin",
      "amtsgericht": "Amtsgericht Berlin (Charlottenburg)",
      "registernummer": "HRB 207173",
      "registerart": "HRB",
      "company_name": "W & M Business UG (haftungsbeschränkt)",
      "company_seat": "Berlin",
      "details": "12.02.2025 (Bekanntmachungsdatum)\n\nBerlin Amtsgericht Berlin (Charlottenburg) HRB 207173\nLöschungsankündigung\n\nW & M Business UG (haftungsbeschränkt)\nGesellschaft mit beschränkter Haftung\nBerlin\n\nBei der nachstehenden Gesellschaft wird das Amtslöschungsverfahren gemäß § 394 FamFG eingeleitet. Widerspruchsfrist 6 Wochen"
    },
    {
      "date": "2025-02-12",
      "id": "101125",
      "original_text": "Einreichung neuer Dokumente\nBaden-Württemberg Amtsgericht Ulm HRB 740135\nSSV Ulm 1846 Fußball GmbH & Co. KGaA – Ulm",
      "type": "Einreichung neuer Dokumente",
      "state": "Baden-Württemberg",
      "amtsgericht": "Amtsgericht Ulm",
      "registernummer": "HRB 740135",
      "registerart": "HRB",
      "company_name": "SSV Ulm 1846 Fußball GmbH & Co. KGaA",
      "company_seat": "Ulm",
      "details": "12.02.2025 (Bekanntmachungsdatum)\n\nBaden-Württemberg Amtsgericht Ulm HRB 740135\nEinreichung neuer Dokumente\n\nSSV Ulm 1846 Fußball GmbH & Co. KGaA\nKommanditgesellschaft auf Aktien\nUlm\n\nDie Gesellschaft hat am 12.02.2025 die Liste über die Zusammensetzung des Aufsichtsrats zum Handelsregister eingereicht."
    },
    {
      "date": "2025-02-12",
      "id": "101126",
      "original_text": "Löschungsankündigung\nBaden-Württemberg Amtsgericht Stuttgart HRB 760957\nSTR-Logistik UG (haftungsbeschränkt) – Stuttgart",
      "type": "Löschungsankündigung",
      "state": "Baden-Württemberg",
      "amtsgericht": "Amtsgericht Stuttgart",
      "registernummer": "HRB 760957",
      "registerart": "HRB",
      "company_name": "STR-Logistik UG (haftungsbeschränkt)",
      "company_seat": "Stuttgart",
      "details": "12.02.2025 (Bekanntmachungsdatum)\n\nBaden-Württemberg Amtsgericht Stuttgart HRB 760957\nLöschungsankündigung\n\nSTR-Logistik UG (haftungsbeschränkt)\nGesellschaft mit beschränkter Haftung\nStuttgart\n\nAls nicht eingetragen wird bekanntgemacht:\nDas Gericht beabsichtigt, die Gesellschaft wegen Vermögenslosigkeit im Handelsregister von Amts wegen nach § 394 FamFG zu löschen. Die Frist zur Geltendmachung eines Widerspruchs gegen die beabsichtigte Löschung ist auf zwei Monate ab Veröffentlichung bestimmt."
    },
    {
      "date": "2025-02-12",
      "id": "101127",
      "original_text": "Löschungsankündigung\nBerlin Amtsgericht Berlin (Charlottenburg) HRB 205798\nO & K Elektro UG (haftungsbeschränkt) – Berlin",
      "type": "Löschungsankündigung",
      "state": "Berlin",
      "amtsgericht": "Amtsgericht Berlin (Charlottenburg)",
      "registernummer": "HRB 205798",
      "registerart": "HRB",
      "company_name": "O & K Elektro UG (haftungsbeschränkt)",
      "company_seat": "Berlin",
      "details": "12.02.2025 (Bekanntmachungsdatum)\n\nBerlin Amtsgericht Berlin (Charlottenburg) HRB 205798\nLöschungsankündigung\n\nO & K Elektro UG (haftungsbeschränkt)\nGesellschaft mit beschränkter Haftung\nBerlin\n\nBei der nachstehenden Gesellschaft wird das Amtslöschungsverfahren gemäß § 394 FamFG eingeleitet. Widerspruchsfrist 6 Wochen"
    },
    {
      "date": "2025-02-12",
      "id": "101128",
      "original_text": "Löschungsankündigung\nBerlin Amtsgericht Berlin (Charlottenburg) HRB 122790\nScandinavian Internet Group Germany GmbH – Berlin",
      "type": "Löschungsankündigung",
      "state": "Berlin",
      "amtsgericht": "Amtsgericht Berlin (Charlottenburg)",
      "registernummer": "HRB 122790",
      "registerart": "HRB",
      "company_name": "Scandinavian Internet Group Germany GmbH",
      "company_seat": "Berlin",
      "details": "12.02.2025 (Bekanntmachungsdatum)\n\nBerlin Amtsgericht Berlin (Charlottenburg) HRB 122790\nLöschungsankündigung\n\nScandinavian Internet Group Germany GmbH\nGesellschaft mit beschränkter Haftung\nBerlin\n\nBei der nachstehenden Gesellschaft wird das Amtslöschungsverfahren gemäß § 394 FamFG eingeleitet. Widerspruchsfrist 6 Wochen"
    },
    {
      "date": "2025-02-12",
      "id": "101129",
      "original_text": "Löschungsankündigung\nBrandenburg Amtsgericht Frankfurt/Oder HRA 2582\nOctagon Car Rentals GmbH & Co. KG – Hoppegarten",
      "type": "Löschungsankündigung",
      "state": "Brandenburg",
      "amtsgericht": "Amtsgericht Frankfurt/Oder",
      "registernummer": "HRA 2582",
      "registerart": "HRA",
      "company_name": "Octagon Car Rentals GmbH & Co. KG",
      "company_seat": "Hoppegarten",
      "details": "12.02.2025 (Bekanntmachungsdatum)\n\nBrandenburg Amtsgericht Frankfurt/Oder HRA 2582\nLöschungsankündigung\n\nOctagon Car Rentals GmbH & Co. KG\nKommanditgesellschaft\nHoppegarten\n\nBei der nachstehenden Gesellschaft wird das Amtslöschungsverfahren gemäß § 394 FamFG eingeleitet."
    },
    {
      "date": "2025-02-12",
      "id": "101130",
      "original_text": "Einreichung neuer Dokumente\nSachsen Amtsgericht Chemnitz HRB 18310\nKlinik Catering Chemnitz GmbH – Chemnitz",
      "type": "Einreichung neuer Dokumente",
      "state": "Sachsen",
      "amtsgericht": "Amtsgericht Chemnitz",
      "registernummer": "HRB 18310",
      "registerart": "HRB",
      "company_name": "Klinik Catering Chemnitz GmbH",
      "company_seat": "Chemnitz",
      "details": "12.02.2025 (Bekanntmachungsdatum)\n\nSachsen Amtsgericht Chemnitz HRB 18310\nEinreichung neuer Dokumente\n\nKlinik Catering Chemnitz GmbH\nGesellschaft mit beschränkter Haftung\nChemnitz\n\nAm 11.02.2025 wurde beim Handelsregister des Amtsgerichts Chemnitz die Liste der Mitglieder des Aufsichtsrats gemäß § 52 GmbHG eingereicht."
    },
    {
      "date": "2025-02-12",
      "id": "101131",
      "original_text": "Registerbekanntmachung nach dem Umwandlungsgesetz\nSachsen Amtsgericht Leipzig HRB 43734\nKraus Kunststoffe GmbH – Markranstädt",
      "type": "Registerbekanntmachung nach dem Umwandlungsgesetz",
      "state": "Sachsen",
      "amtsgericht": "Amtsgericht Leipzig",
      "registernummer": "HRB 43734",
      "registerart": "HRB",
      "company_name": "Kraus Kunststoffe GmbH",
      "company_seat": "Markranstädt",
      "details": "12.02.2025 (Bekanntmachungsdatum)\n\nSachsen Amtsgericht Leipzig HRB 43734\nRegisterbekanntmachung nach dem Umwandlungsgesetz 12.02.2025 (Eintragungsdatum)\n\nKraus Kunststoffe GmbH\nGesellschaft mit beschränkter Haftung\nMarkranstädt\n\nDen Gläubigern der an der Umwandlung beteiligten Rechtsträger ist, wenn sie binnen sechs Monaten nach dem Tag, an dem die Eintragung der Umwandlung in das Register des Sitzes desjenigen Rechtsträgers, dessen Gläubiger sie sind, nach § 19 Abs. 3 UmwG als bekannt gemacht gilt, ihren Anspruch nach Grund und Höhe in Textform anmelden, Sicherheit zu leisten, soweit sie nicht Befriedigung verlangen können. Dieses Recht steht den Gläubigern jedoch nur zu, wenn sie glaubhaft machen, dass durch die Umwandlung die Erfüllung der Forderung gefährdet wird."
    },
    {
      "date": "2025-02-12",
      "id": "101132",
      "original_text": "Registerbekanntmachung nach dem Umwandlungsgesetz\nSachsen Amtsgericht Leipzig GsR 290\nMKV Kunststoffhandel eGbR – Markranstädt",
      "type": "Registerbekanntmachung nach dem Umwandlungsgesetz",
      "state": "Sachsen",
      "amtsgericht": "Amtsgericht Leipzig",
      "registernummer": "GsR 290",
      "registerart": "GsR",
      "company_name": "MKV Kunststoffhandel eGbR",
      "company_seat": "Markranstädt",
      "details": "12.02.2025 (Bekanntmachungsdatum)\n\nSachsen Amtsgericht Leipzig GsR 290\nRegisterbekanntmachung nach dem Umwandlungsgesetz 12.02.2025 (Eintragungsdatum)\n\nMKV Kunststoffhandel eGbR\nGesellschaft bürgerlichen Rechts\nMarkranstädt\n\nDen Gläubigern der an der Umwandlung beteiligten Rechtsträger ist, wenn sie binnen sechs Monaten nach dem Tag, an dem die Eintragung der Umwandlung in das Register des Sitzes desjenigen Rechtsträgers, dessen Gläubiger sie sind, nach § 19 Abs. 3 UmwG als bekannt gemacht gilt, ihren Anspruch nach Grund und Höhe in Textform anmelden, Sicherheit zu leisten, soweit sie nicht Befriedigung verlangen können. Dieses Recht steht den Gläubigern jedoch nur zu, wenn sie glaubhaft machen, dass durch die Umwandlung die Erfüllung der Forderung gefährdet wird."
    },
    {
      "date": "2025-02-12",
      "id": "101133",
      "original_text": "Registerbekanntmachung nach dem Umwandlungsgesetz\nSachsen Amtsgericht Dresden HRA 10368\nUrban Taxibetrieb GmbH & Co. KG – Pirna",
      "type": "Registerbekanntmachung nach dem Umwandlungsgesetz",
      "state": "Sachsen",
      "amtsgericht": "Amtsgericht Dresden",
      "registernummer": "HRA 10368",
      "registerart": "HRA",
      "company_name": "Urban Taxibetrieb GmbH & Co. KG",
      "company_seat": "Pirna",
      "details": "12.02.2025 (Bekanntmachungsdatum)\n\nSachsen Amtsgericht Dresden HRA 10368\nRegisterbekanntmachung nach dem Umwandlungsgesetz 12.02.2025 (Eintragungsdatum)\n\nUrban Taxibetrieb GmbH & Co. KG\nKommanditgesellschaft\nPirna\n\nDen Gläubigern der an der Verschmelzung beteiligten Rechtsträger ist, wenn sie binnen sechs Monaten nach dem Tag, an dem die Eintragung der Verschmelzung in das Register des Sitzes desjenigen Rechtsträgers, dessen Gläubiger sie sind, nach § 19 Abs. 3 UmwG als bekannt gemacht gilt, ihren Anspruch nach Grund und Höhe in Textform anmelden, Sicherheit zu leisten, soweit sie nicht Befriedigung verlangen können. Dieses Recht steht den Gläubigern jedoch nur zu, wenn sie glaubhaft machen, dass durch die Verschmelzung die Erfüllung der Forderung gefährdet wird."
    },
    {
      "date": "2025-02-12",
      "id": "101134",
      "original_text": "Registerbekanntmachung nach dem Umwandlungsgesetz\nSachsen Amtsgericht Dresden HRB 20733\nF & MV Funktaxi- & Mietwagen-Vermittlungs-GmbH – Pirna",
      "type": "Registerbekanntmachung nach dem Umwandlungsgesetz",
      "state": "Sachsen",
      "amtsgericht": "Amtsgericht Dresden",
      "registernummer": "HRB 20733",
      "registerart": "HRB",
      "company_name": "F & MV Funktaxi- & Mietwagen-Vermittlungs-GmbH",
      "company_seat": "Pirna",
      "details": "12.02.2025 (Bekanntmachungsdatum)\n\nSachsen Amtsgericht Dresden HRB 20733\nRegisterbekanntmachung nach dem Umwandlungsgesetz 12.02.2025 (Eintragungsdatum)\n\nF & MV Funktaxi- & Mietwagen-Vermittlungs-GmbH\nGesellschaft mit beschränkter Haftung\nPirna\n\nDen Gläubigern der an der Verschmelzung beteiligten Rechtsträger ist, wenn sie binnen sechs Monaten nach dem Tag, an dem die Eintragung der Verschmelzung in das Register des Sitzes desjenigen Rechtsträgers, dessen Gläubiger sie sind, nach § 19 Abs. 3 UmwG als bekannt gemacht gilt, ihren Anspruch nach Grund und Höhe in Textform anmelden, Sicherheit zu leisten, soweit sie nicht Befriedigung verlangen können. Dieses Recht steht den Gläubigern jedoch nur zu, wenn sie glaubhaft machen, dass durch die Verschmelzung die Erfüllung der Forderung gefährdet wird."
    },
    {
      "date": "2025-02-12",
      "id": "101135",
      "original_text": "Einreichung neuer Dokumente\nSachsen Amtsgericht Chemnitz HRB 17485\nCc Klinik-Verwaltungsgesellschaft Chemnitz mbH – Chemnitz",
      "type": "Einreichung neuer Dokumente",
      "state": "Sachsen",
      "amtsgericht": "Amtsgericht Chemnitz",
      "registernummer": "HRB 17485",
      "registerart": "HRB",
      "company_name": "Cc Klinik-Verwaltungsgesellschaft Chemnitz mbH",
      "company_seat": "Chemnitz",
      "details": "12.02.2025 (Bekanntmachungsdatum)\n\nSachsen Amtsgericht Chemnitz HRB 17485\nEinreichung neuer Dokumente\n\nCc Klinik-Verwaltungsgesellschaft Chemnitz mbH\nGesellschaft mit beschränkter Haftung\nChemnitz\n\nAm 11.02.2025 wurde beim Handelsregister des Amtsgerichts Chemnitz die Liste der Mitglieder des Aufsichtsrats gemäß § 52 GmbHG eingereicht."
    },
    {
      "date": "2025-02-12",
      "id": "101136",
      "original_text": "Löschungsankündigung\nSachsen Amtsgericht Chemnitz HRA 7603\nSC SPORT CONCEPTE Ltd. & Co. KG – Bad Schlema",
      "type": "Löschungsankündigung",
      "state": "Sachsen",
      "amtsgericht": "Amtsgericht Chemnitz",
      "registernummer": "HRA 7603",
      "registerart": "HRA",
      "company_name": "SC SPORT CONCEPTE Ltd. & Co. KG",
      "company_seat": "Bad Schlema",
      "details": "12.02.2025 (Bekanntmachungsdatum)\n\nSachsen Amtsgericht Chemnitz HRA 7603\nLöschungsankündigung\n\nSC SPORT CONCEPTE Ltd. & Co. KG\nKommanditgesellschaft\nBad Schlema\n\nEs ist beabsichtigt, die Firma SC SPORT CONCEPTE Ltd. & Co. KG mit Sitz in Bad Schlema von Amts wegen gemäß §§ 31 Abs. 2 HGB, 393 FamFG zu löschen.\n\nDie Frist zur Erhebung eines Widerspruchs gegen die beabsichtigte Löschung wird auf einen Monat ab Bekanntgabe dieser Verfügung festgesetzt. Der Widerspruch ist beim Amtsgericht Chemnitz schriftlich oder zur Niederschrift der Geschäftsstelle einzulegen."
    },
    {
      "date": "2025-02-12",
      "id": "101137",
      "original_text": "Einreichung neuer Dokumente\nSachsen Amtsgericht Dresden HRB 23255\nOL Physio GmbH – Bautzen",
      "type": "Einreichung neuer Dokumente",
      "state": "Sachsen",
      "amtsgericht": "Amtsgericht Dresden",
      "registernummer": "HRB 23255",
      "registerart": "HRB",
      "company_name": "OL Physio GmbH",
      "company_seat": "Bautzen",
      "details": "12.02.2025 (Bekanntmachungsdatum)\n\nSachsen Amtsgericht Dresden HRB 23255\nEinreichung neuer Dokumente\n\nOL Physio GmbH\nGesellschaft mit beschränkter Haftung\nBautzen\n\nAm 11.01.2025 wurde beim Handelsregister des Amtsgerichts Dresden die Liste der Mitglieder des Aufsichtsrats gemäß § 52 GmbHG eingereicht."
    },
    {
      "date": "2025-02-12",
      "id": "101138",
      "original_text": "Einreichung neuer Dokumente\nSachsen Amtsgericht Chemnitz HRB 22651\nZentrum für Diagnostik GmbH am Klinikum Chemnitz – Chemnitz",
      "type": "Einreichung neuer Dokumente",
      "state": "Sachsen",
      "amtsgericht": "Amtsgericht Chemnitz",
      "registernummer": "HRB 22651",
      "registerart": "HRB",
      "company_name": "Zentrum für Diagnostik GmbH am Klinikum Chemnitz",
      "company_seat": "Chemnitz",
      "details": "12.02.2025 (Bekanntmachungsdatum)\n\nSachsen Amtsgericht Chemnitz HRB 22651\nEinreichung neuer Dokumente\n\nZentrum für Diagnostik GmbH am Klinikum Chemnitz\nGesellschaft mit beschränkter Haftung\nChemnitz\n\nAm 11.02.2025 wurde beim Handelsregister des Amtsgerichts Chemnitz die Liste der Mitglieder des Aufsichtsrats gemäß § 52 GmbHG eingereicht."
    },
    {
      "date": "2025-02-12",
      "id": "101139",
      "original_text": "Einreichung neuer Dokumente\nSachsen Amtsgericht Chemnitz HRB 16831\nKlinikum Chemnitz Logistik- und Wirtschaftsgesellschaft mbH – Chemnitz",
      "type": "Einreichung neuer Dokumente",
      "state": "Sachsen",
      "amtsgericht": "Amtsgericht Chemnitz",
      "registernummer": "HRB 16831",
      "registerart": "HRB",
      "company_name": "Klinikum Chemnitz Logistik- und Wirtschaftsgesellschaft mbH",
      "company_seat": "Chemnitz",
      "details": "12.02.2025 (Bekanntmachungsdatum)\n\nSachsen Amtsgericht Chemnitz HRB 16831\nEinreichung neuer Dokumente\n\nKlinikum Chemnitz Logistik- und Wirtschaftsgesellschaft mbH\nGesellschaft mit beschränkter Haftung\nChemnitz\n\nAm 11.02.2025 wurde beim Handelsregister des Amtsgerichts Chemnitz die Liste der Mitglieder des Aufsichtsrats gemäß § 52 GmbHG eingereicht."
    },
    {
      "date": "2025-02-12",
      "id": "101140",
      "original_text": "Einreichung neuer Dokumente\nSachsen Amtsgericht Chemnitz HRB 9601\nKlinikum Chemnitz gemeinnützige GmbH – Chemnitz",
      "type": "Einreichung neuer Dokumente",
      "state": "Sachsen",
      "amtsgericht": "Amtsgericht Chemnitz",
      "registernummer": "HRB 9601",
      "registerart": "HRB",
      "company_name": "Klinikum Chemnitz gemeinnützige GmbH",
      "company_seat": "Chemnitz",
      "details": "12.02.2025 (Bekanntmachungsdatum)\n\nSachsen Amtsgericht Chemnitz HRB 9601\nEinreichung neuer Dokumente\n\nKlinikum Chemnitz gemeinnützige GmbH\nGesellschaft mit beschränkter Haftung\nChemnitz\n\nAm 11.02.2025 wurde beim Handelsregister des Amtsgerichts Chemnitz die Liste der Mitglieder des Aufsichtsrats gemäß § 52 GmbHG eingereicht."
    },
    {
      "date": "2025-02-12",
      "id": "101141",
      "original_text": "Einreichung neuer Dokumente\nSachsen Amtsgericht Chemnitz HRB 16164\nKlinikum-Chemnitz-Service-Gesellschaft mbH – Chemnitz",
      "type": "Einreichung neuer Dokumente",
      "state": "Sachsen",
      "amtsgericht": "Amtsgericht Chemnitz",
      "registernummer": "HRB 16164",
      "registerart": "HRB",
      "company_name": "Klinikum-Chemnitz-Service-Gesellschaft mbH",
      "company_seat": "Chemnitz",
      "details": "12.02.2025 (Bekanntmachungsdatum)\n\nSachsen Amtsgericht Chemnitz HRB 16164\nEinreichung neuer Dokumente\n\nKlinikum-Chemnitz-Service-Gesellschaft mbH\nGesellschaft mit beschränkter Haftung\nChemnitz\n\nAm 11.02.2025 wurde beim Handelsregister des Amtsgerichts Chemnitz die Liste der Mitglieder des Aufsichtsrats gemäß § 52 GmbHG eingereicht."
    },
    {
      "date": "2025-02-12",
      "id": "101142",
      "original_text": "Einreichung neuer Dokumente\nSachsen Amtsgericht Chemnitz HRB 31521\nRTLL Lewerenz Holding AG – Kirchberg",
      "type": "Einreichung neuer Dokumente",
      "state": "Sachsen",
      "amtsgericht": "Amtsgericht Chemnitz",
      "registernummer": "HRB 31521",
      "registerart": "HRB",
      "company_name": "RTLL Lewerenz Holding AG",
      "company_seat": "Kirchberg",
      "details": "12.02.2025 (Bekanntmachungsdatum)\n\nSachsen Amtsgericht Chemnitz HRB 31521\nEinreichung neuer Dokumente\n\nRTLL Lewerenz Holding AG\nAktiengesellschaft\nKirchberg\n\nAm 11.02.2025 wurde beim Handelsregister des Amtsgerichts Chemnitz die Liste der Mitglieder des Aufsichtsrats gemäß § 106 AktG eingereicht."
    },
    {
      "date": "2025-02-12",
      "id": "101143",
      "original_text": "Registerbekanntmachung nach dem Umwandlungsgesetz\nMecklenburg-Vorpommern Amtsgericht Rostock HRB 15612\nGreentech GmbH – Rostock",
      "type": "Registerbekanntmachung nach dem Umwandlungsgesetz",
      "state": "Mecklenburg-Vorpommern",
      "amtsgericht": "Amtsgericht Rostock",
      "registernummer": "HRB 15612",
      "registerart": "HRB",
      "company_name": "Greentech GmbH",
      "company_seat": "Rostock",
      "details": "12.02.2025 (Bekanntmachungsdatum)\n\nMecklenburg-Vorpommern Amtsgericht Rostock HRB 15612\nRegisterbekanntmachung nach dem Umwandlungsgesetz 12.02.2025 (Eintragungsdatum)\n\nGreentech GmbH\nGesellschaft mit beschränkter Haftung\nRostock\n\nAls nicht eingetragen wird veröffentlicht: Den Gläubigern der an der Verschmelzung beteiligten Rechtsträger ist, wenn sie binnen sechs Monaten nach dem Tag, an dem die Eintragung der Verschmelzung in das Register des Sitzes desjenigen Rechtsträgers, dessen Gläubiger sie sind, nach § 19 Abs. 3 UmwG als bekannt gemacht gilt,\nihren Anspruch nach Grund und Höhe in Textform anmelden, Sicherheit zu leisten, soweit sie nicht Befriedigung verlangen können. Dieses Recht steht den Gläubigern jedoch nur zu, wenn sie glaubhaft machen, dass durch die Verschmelzung die Erfüllung der Forderung gefährdet wird."
    },
    {
      "date": "2025-02-12",
      "id": "101144",
      "original_text": "Löschungsankündigung\nNiedersachsen Amtsgericht Hildesheim HRB 207048\nBetriebsgesellschaft Erikasee UG (haftungsbeschränkt) – Gifhorn",
      "type": "Löschungsankündigung",
      "state": "Niedersachsen",
      "amtsgericht": "Amtsgericht Hildesheim",
      "registernummer": "HRB 207048",
      "registerart": "HRB",
      "company_name": "Betriebsgesellschaft Erikasee UG (haftungsbeschränkt)",
      "company_seat": "Gifhorn",
      "details": "12.02.2025 (Bekanntmachungsdatum)\n\nNiedersachsen Amtsgericht Hildesheim HRB 207048\nLöschungsankündigung\n\nBetriebsgesellschaft Erikasee UG (haftungsbeschränkt)\nGesellschaft mit beschränkter Haftung\nGifhorn\n\nDas Registergericht beabsichtigt, die Gesellschaft von Amts wegen nach § 394 FamFG zu löschen. Die Frist zur Erhebung eines Widerspruchs ist auf 1 Monat ab dieser Registerbekanntmachung festgesetzt."
    },
    {
      "date": "2025-02-12",
      "id": "101145",
      "original_text": "Einreichung neuer Dokumente\nNiedersachsen Amtsgericht Braunschweig HRB 100405 früher Amtsgericht Wolfsburg\nWolfsburg AG – Wolfsburg",
      "type": "Einreichung neuer Dokumente",
      "state": "Niedersachsen",
      "amtsgericht": "Amtsgericht Braunschweig",
      "registernummer": "HRB 100405",
      "registerart": "HRB",
      "company_name": "Wolfsburg AG",
      "company_seat": "Wolfsburg",
      "former_amtsgericht": "Wolfsburg",
      "details": "12.02.2025 (Bekanntmachungsdatum)\n\nNiedersachsen Amtsgericht Braunschweig HRB 100405 früher Amtsgericht Wolfsburg\nEinreichung neuer Dokumente 12.02.2025 (Eintragungsdatum)\n\nWolfsburg AG\nAktiengesellschaft\nWolfsburg\n\nDie Listen der Mitglieder des Aufsichtsrats wurden beim Registergericht eingereicht."
    },
    {
      "date": "2025-02-12",
      "id": "101146",
      "original_text": "Registerbekanntmachung nach dem Umwandlungsgesetz\nNiedersachsen Amtsgericht Hannover HRB 211907\nSGI RE Deutschland Beteiligungsgesellschaft mbH – Hannover",
      "type": "Registerbekanntmachung nach dem Umwandlungsgesetz",
      "state": "Niedersachsen",
      "amtsgericht": "Amtsgericht Hannover",
      "registernummer": "HRB 211907",
      "registerart": "HRB",
      "company_name": "SGI RE Deutschland Beteiligungsgesellschaft mbH",
      "company_seat": "Hannover",
      "details": "12.02.2025 (Bekanntmachungsdatum)\n\nNiedersachsen Amtsgericht Hannover HRB 211907\nRegisterbekanntmachung nach dem Umwandlungsgesetz\n\nSGI RE Deutschland Beteiligungsgesellschaft mbH\nGesellschaft mit beschränkter Haftung\nHannover\n\nEs wird darauf hingewiesen, dass ein Entwurf eines Formwechselplans über einen grenzüberschreitenden Formwechsel der SGI RE Deutschland Beteiligungsgesellschaft mbH mit Sitz in Hannover (Deutschland), eingetragen beim Registergericht Hannover HRB 211907, beim Handelsregister eingereicht worden ist.\nDie Gesellschaft soll identitätswahrend in eine Gesellschaft mit beschränkter Haftung nach dem Recht von Liechtenstein unter Sitzverlegung nach Vaduz formgewechselt werden. Die an dem Formwechsel beteiligte Gesellschaft wird im Zuzugsstaat Liechtenstein folgende Rechtsform, Firma und Sitz haben:                                                SGI RE Deutschland Beteiligungsgesellschaft mbH, eine Gesellschaft mit beschränkter Haftung nach dem Recht von Liechtenstein, mit Sitz in Vaduz, Liechtenstein.\n\nDie Anteilsinhaber und die Gläubiger der an dem grenzüberschreitenden Formwechsel beteiligten Gesellschaft werden darauf hingewiesen, dass sie der SGI RE Deutschland Beteiligungsgesellschaft mbH spätestens fünf Arbeitstage vor dem Tag der Beurkundung des Formwechselplans, die am 24. März 2025 stattfinden wird,  Bemerkungen zum Formwechselplan übermitteln können. Die Bemerkungen können an die SGI RE Deutschland Beteiligungsgesellschaft mbH, z. Hd. Herrn Birger Dehne, übermittelt werden, entweder per Post: Theaterstr. 13, 30159 Hannover, Deutschland oder per E-Mail: bd@capiterra.de.                                                                                                 Die Gesellschaft hat keine Arbeitnehmer und keinen Betriebsrat."
    },
    {
      "date": "2025-02-12",
      "id": "101147",
      "original_text": "Einreichung neuer Dokumente\nNiedersachsen Amtsgericht Braunschweig HRB 7363\nStadtwerke Wolfenbüttel GmbH – Wolfenbüttel",
      "type": "Einreichung neuer Dokumente",
      "state": "Niedersachsen",
      "amtsgericht": "Amtsgericht Braunschweig",
      "registernummer": "HRB 7363",
      "registerart": "HRB",
      "company_name": "Stadtwerke Wolfenbüttel GmbH",
      "company_seat": "Wolfenbüttel",
      "details": "12.02.2025 (Bekanntmachungsdatum)\n\nNiedersachsen Amtsgericht Braunschweig HRB 7363\nEinreichung neuer Dokumente 12.02.2025 (Eintragungsdatum)\n\nStadtwerke Wolfenbüttel GmbH\nGesellschaft mit beschränkter Haftung\nWolfenbüttel\n\nZwei Listen des Aufsichtsrats wurden beim Handelsregister eingereicht."
    },
    {
      "date": "2025-02-12",
      "id": "101148",
      "original_text": "Löschungsankündigung\nNiedersachsen Amtsgericht Hannover HRB 220699\nAXOVISION Capital GmbH – Hannover",
      "type": "Löschungsankündigung",
      "state": "Niedersachsen",
      "amtsgericht": "Amtsgericht Hannover",
      "registernummer": "HRB 220699",
      "registerart": "HRB",
      "company_name": "AXOVISION Capital GmbH",
      "company_seat": "Hannover",
      "details": "12.02.2025 (Bekanntmachungsdatum)\n\nNiedersachsen Amtsgericht Hannover HRB 220699\nLöschungsankündigung\n\nAXOVISION Capital GmbH\nGesellschaft mit beschränkter Haftung\nHannover\n\nHRB 220699, AXOVISION Capital GmbH mit Sitz in Hannover\n\nDas Registergericht beabsichtigt, die Gesellschaft von Amts wegen nach § 394 FamFG zu löschen. Die Frist zur Erhebung eines Widerspruchs ist auf 1 Monat ab dieser Registerbekanntmachung festgesetzt."
    },
    {
      "date": "2025-02-12",
      "id": "101149",
      "original_text": "Löschungsankündigung\nNiedersachsen Amtsgericht Tostedt HRB 210308\nNeo finest Cars GmbH – Zeven",
      "type": "Löschungsankündigung",
      "state": "Niedersachsen",
      "amtsgericht": "Amtsgericht Tostedt",
      "registernummer": "HRB 210308",
      "registerart": "HRB",
      "company_name": "Neo finest Cars GmbH",
      "company_seat": "Zeven",
      "details": "12.02.2025 (Bekanntmachungsdatum)\n\nNiedersachsen Amtsgericht Tostedt HRB 210308\nLöschungsankündigung\n\nNeo finest Cars GmbH\nGesellschaft mit beschränkter Haftung\nZeven\n\nDas Registergericht beabsichtigt, die Gesellschaft von Amts wegen nach § 394 FamFG zu löschen. Die Frist zur Erhebung eines Widerspruchs ist auf 1 Monat ab dieser Registerbekanntmachung festgesetzt."
    },
    {
      "date": "2025-02-12",
      "id": "101150",
      "original_text": "Sonstige Registerbekanntmachung\nRheinland-Pfalz Amtsgericht Wittlich HRB 42755\nTechinox GmbH – Nerdlen",
      "type": "Sonstige Registerbekanntmachung",
      "state": "Rheinland-Pfalz",
      "amtsgericht": "Amtsgericht Wittlich",
      "registernummer": "HRB 42755",
      "registerart": "HRB",
      "company_name": "Techinox GmbH",
      "company_seat": "Nerdlen",
      "details": "12.02.2025 (Bekanntmachungsdatum)\n\nRheinland-Pfalz Amtsgericht Wittlich HRB 42755\nSonstige Registerbekanntmachung 12.02.2025 (Eintragungsdatum)\n\nTechinox GmbH\nGesellschaft mit beschränkter Haftung\nNerdlen\n\nAls nicht eingetragen wird veröffentlicht: Den Gläubigern der Gesellschaft, deren Forderungen begründet worden sind, bevor die Eintragung der Beendigung des Gewinnabführungsvertrages in das Handelsregister nach § 10 des Handelsgesetzbuches als bekanntgemacht gilt, hat der andere Vertragsteil Sicherheit zu leisten, wenn sie sich binnen sechs Monaten nach der Bekanntmachung der Eintragung zu diesem Zweck bei ihm melden."
    },
    {
      "date": "2025-02-12",
      "id": "101151",
      "original_text": "Löschungsankündigung\nRheinland-Pfalz Amtsgericht Mainz HRB 46396\nMD Entertainment GmbH – Osthofen",
      "type": "Löschungsankündigung",
      "state": "Rheinland-Pfalz",
      "amtsgericht": "Amtsgericht Mainz",
      "registernummer": "HRB 46396",
      "registerart": "HRB",
      "company_name": "MD Entertainment GmbH",
      "company_seat": "Osthofen",
      "details": "12.02.2025 (Bekanntmachungsdatum)\n\nRheinland-Pfalz Amtsgericht Mainz HRB 46396\nLöschungsankündigung\n\nMD Entertainment GmbH\nGesellschaft mit beschränkter Haftung\nOsthofen\n\nDas Registergericht beabsichtigt die Gesellschaft von Amts wegen nach § 394 FamFG zu löschen. Die Frist zur Erhebung eines Widerspruchs ist auf einen Monat festgesetzt."
    },
    {
      "date": "2025-02-12",
      "id": "101152",
      "original_text": "Sonstige Registerbekanntmachung\nRheinland-Pfalz Amtsgericht Wittlich HRB 12285\nEifel-Mosel-Zeitung GmbH – Daun",
      "type": "Sonstige Registerbekanntmachung",
      "state": "Rheinland-Pfalz",
      "amtsgericht": "Amtsgericht Wittlich",
      "registernummer": "HRB 12285",
      "registerart": "HRB",
      "company_name": "Eifel-Mosel-Zeitung GmbH",
      "company_seat": "Daun",
      "details": "12.02.2025 (Bekanntmachungsdatum)\n\nRheinland-Pfalz Amtsgericht Wittlich HRB 12285\nSonstige Registerbekanntmachung 12.02.2025 (Eintragungsdatum)\n\nEifel-Mosel-Zeitung GmbH\nGesellschaft mit beschränkter Haftung\nDaun\n\nAls nicht eingetragen wird veröffentlicht: Den Gläubigern der Gesellschaft, deren Forderungen begründet worden sind, bevor die Eintragung der Beendigung des Gewinn-/Ergebnisabführungsvertrages in das Handelsregister nach § 10 des Handelsgesetzbuches als bekanntgemacht gilt, hat der andere Vertragsteil Sicherheit zu leisten, wenn sie sich binnen sechs Monaten nach der Bekanntmachung der Eintragung zu diesem Zweck bei ihm melden."
    },
    {
      "date": "2025-02-12",
      "id": "101153",
      "original_text": "Löschungsankündigung\nBremen Amtsgericht Bremen HRB 37369\nZainsmotion GmbH – Bremen",
      "type": "Löschungsankündigung",
      "state": "Bremen",
      "amtsgericht": "Amtsgericht Bremen",
      "registernummer": "HRB 37369",
      "registerart": "HRB",
      "company_name": "Zainsmotion GmbH",
      "company_seat": "Bremen",
      "details": "12.02.2025 (Bekanntmachungsdatum)\n\nBremen Amtsgericht Bremen HRB 37369\nLöschungsankündigung\n\nZainsmotion GmbH\nGesellschaft mit beschränkter Haftung\nBremen\n\nEs ist beabsichtigt die im Handelsregister eingetragene Gesellschaft von Amts wegen gemäß § 394 FamFG zu löschen. Gegen die Löschung kann beim AG Bremen schriftlich oder zu Protokoll der Geschäftsstelle Widerspruch eingelegt werden. Widerspruchsfrist 4 Wochen."
    },
    {
      "date": "2025-02-12",
      "id": "101154",
      "original_text": "Löschungsankündigung\nBremen Amtsgericht Bremen HRB 37607\nlejodis GmbH – Bremen",
      "type": "Löschungsankündigung",
      "state": "Bremen",
      "amtsgericht": "Amtsgericht Bremen",
      "registernummer": "HRB 37607",
      "registerart": "HRB",
      "company_name": "lejodis GmbH",
      "company_seat": "Bremen",
      "details": "12.02.2025 (Bekanntmachungsdatum)\n\nBremen Amtsgericht Bremen HRB 37607\nLöschungsankündigung\n\nlejodis GmbH\nGesellschaft mit beschränkter Haftung\nBremen\n\nEs ist beabsichtigt die im Handelsregister eingetragene Gesellschaft von Amts wegen gemäß § 394 FamFG zu löschen. Gegen die Löschung kann beim AG Bremen schriftlich oder zu Protokoll der Geschäftsstelle Widerspruch eingelegt werden. Widerspruchsfrist 4 Wochen."
    },
    {
      "date": "2025-02-12",
      "id": "101155",
      "original_text": "Einreichung neuer Dokumente\nNordrhein-Westfalen Amtsgericht Düsseldorf HRB 57104\nUniper Kraftwerke GmbH – Düsseldorf",
      "type": "Einreichung neuer Dokumente",
      "state": "Nordrhein-Westfalen",
      "amtsgericht": "Amtsgericht Düsseldorf",
      "registernummer": "HRB 57104",
      "registerart": "HRB",
      "company_name": "Uniper Kraftwerke GmbH",
      "company_seat": "Düsseldorf",
      "details": "12.02.2025 (Bekanntmachungsdatum)\n\nNordrhein-Westfalen Amtsgericht Düsseldorf HRB 57104\nEinreichung neuer Dokumente 12.02.2025 (Eintragungsdatum)\n\nUniper Kraftwerke GmbH\nGesellschaft mit beschränkter Haftung\nDüsseldorf\n\nDem Registergericht ist eine neue Liste der Mitglieder des Aufsichtsrates eingereicht worden."
    },
    {
      "date": "2025-02-12",
      "id": "101156",
      "original_text": "Löschungsankündigung\nNordrhein-Westfalen Amtsgericht Düsseldorf HRB 90211\nSchulz Fashion Sourcing GmbH – Düsseldorf",
      "type": "Löschungsankündigung",
      "state": "Nordrhein-Westfalen",
      "amtsgericht": "Amtsgericht Düsseldorf",
      "registernummer": "HRB 90211",
      "registerart": "HRB",
      "company_name": "Schulz Fashion Sourcing GmbH",
      "company_seat": "Düsseldorf",
      "details": "12.02.2025 (Bekanntmachungsdatum)\n\nNordrhein-Westfalen Amtsgericht Düsseldorf HRB 90211\nLöschungsankündigung\n\nSchulz Fashion Sourcing GmbH\nGesellschaft mit beschränkter Haftung\nDüsseldorf\n\nDas Registergericht beabsichtigt die Gesellschaft von Amts wegen nach § 394 FamFG zu löschen. Die Frist zur Erhebung eines Widerspruchs ist auf 3 Wochen festgesetzt.\n\nRechtsbehelfsbelehrung:\nDas Widerspruchsrecht steht jedem zu, der an der Unterlassung der Löschung ein berechtigtes Interesse hat. Der Widerspruch ist bei dem Amtsgericht Düsseldorf -Registergericht-, Werdener Straße 1, 40227 Düsseldorf schriftlich in deutscher Sprache oder zur Niederschrift der Geschäftsstelle einzulegen. Der Widerspruch kann auch zur Niederschrift der Geschäftsstelle eines jeden Amtsgerichtes abgegeben werden. Die Einlegung ist auch durch Übertragung eines elektronischen Dokuments an die elektronische Poststelle des Gerichts möglich. Das elektronische Dokument muss für die Bearbeitung durch das Gericht geeignet und mit einer qualifizierten elektronischen Signatur der verantwortenden Person versehen sein oder von der verantwortenden Person signiert und auf einem sicheren Übermittlungsweg gemäß § 130a ZPO nach näherer Maßgabe der Verordnung über die technischen Rahmenbedingungen des elektronischen Rechtsverkehrs und über das besondere elektronische Behördenpostfach (BGBl. I, S.3803) eingereicht werden. Weitere Informationen erhalten Sie auf der Internetseite www.justiz.de.\nDer Widerspruch muss spätestens innerhalb der gesetzten Frist nach dem Datum der Bekanntmachung der Löschungsankündigung bei dem Amtsgericht - Registergericht - Düsseldorf eingegangen sein.  Dies gilt auch dann, wenn der Widerspruch zur Niederschrift der Geschäftsstelle eines anderen Amtsgerichtes abgegeben wurde. Die Frist beginnt mit dem Tage der Bekanntmachung der Löschungsankündigung in dem für die Bekanntmachung der Eintragungen in das Handelsregister bestimmten elektronischen Informations- und Kommunikationssystem nach § 10 des Handelsgesetzbuches. Fällt das Ende der Frist auf einen Sonntag, einen allgemeinen Feiertag oder Sonnabend, so endet die Frist mit Ablauf des nächsten Werktages.\nDer Widerspruch muss die Bezeichnung der angefochtenen Löschungsankündigung sowie die Erklärung enthalten, dass Widerspruch gegen diese Löschungsankündigung eingelegt wird. Er ist zu unterzeichnen und soll begründet werden."
    },
    {
      "date": "2025-02-12",
      "id": "101157",
      "original_text": "Einreichung neuer Dokumente\nNordrhein-Westfalen Amtsgericht Gelsenkirchen HRB 16325\nGelsenkirchener Entwicklungsgesellschaft mbH – Gelsenkirchen",
      "type": "Einreichung neuer Dokumente",
      "state": "Nordrhein-Westfalen",
      "amtsgericht": "Amtsgericht Gelsenkirchen",
      "registernummer": "HRB 16325",
      "registerart": "HRB",
      "company_name": "Gelsenkirchener Entwicklungsgesellschaft mbH",
      "company_seat": "Gelsenkirchen",
      "details": "12.02.2025 (Bekanntmachungsdatum)\n\nNordrhein-Westfalen Amtsgericht Gelsenkirchen HRB 16325\nEinreichung neuer Dokumente\n\nGelsenkirchener Entwicklungsgesellschaft mbH\nGesellschaft mit beschränkter Haftung\nGelsenkirchen\n\nDem Registergericht ist eine Liste der Mitglieder des Aufsichtsrates eingereicht worden."
    },
    {
      "date": "2025-02-12",
      "id": "101158",
      "original_text": "Löschungsankündigung\nNordrhein-Westfalen Amtsgericht Wuppertal HRA 24661\nTaxi4You oHG – Solingen",
      "type": "Löschungsankündigung",
      "state": "Nordrhein-Westfalen",
      "amtsgericht": "Amtsgericht Wuppertal",
      "registernummer": "HRA 24661",
      "registerart": "HRA",
      "company_name": "Taxi4You oHG",
      "company_seat": "Solingen",
      "details": "12.02.2025 (Bekanntmachungsdatum)\n\nNordrhein-Westfalen Amtsgericht Wuppertal HRA 24661\nLöschungsankündigung 12.02.2025 (Eintragungsdatum)\n\nTaxi4You oHG\nOffene Handelsgesellschaft\nSolingen\n\nDas Registergericht beabsichtigt die Firma von Amts wegen nach § 393 FamFG zu löschen. Die Frist zur Erhebung eines Widerspruchs ist auf drei Monate festgesetzt."
    },
    {
      "date": "2025-02-12",
      "id": "101159",
      "original_text": "Registerbekanntmachung nach dem Umwandlungsgesetz\nNordrhein-Westfalen Amtsgericht Paderborn HRB 16868\nContrucky GmbH – Paderborn",
      "type": "Registerbekanntmachung nach dem Umwandlungsgesetz",
      "state": "Nordrhein-Westfalen",
      "amtsgericht": "Amtsgericht Paderborn",
      "registernummer": "HRB 16868",
      "registerart": "HRB",
      "company_name": "Contrucky GmbH",
      "company_seat": "Paderborn",
      "details": "12.02.2025 (Bekanntmachungsdatum)\n\nNordrhein-Westfalen Amtsgericht Paderborn HRB 16868\nRegisterbekanntmachung nach dem Umwandlungsgesetz 12.02.2025 (Eintragungsdatum)\n\nContrucky GmbH\nGesellschaft mit beschränkter Haftung\nPaderborn\n\nDen Gläubigern der an der Abspaltung beteiligten Rechtsträger ist, wenn sie binnen sechs Monaten nach dem Tag, an dem die Eintragung der Abspaltung in das Register des Sitzes desjenigen Rechtsträgers, dessen Gläubiger sie sind, nach § 19 Absatz 3 UmwG als bekanntgemacht gilt, ihren Anspruch nach Grund und Höhe schriftlich anmelden, Sicherheit zu leisten, soweit sie nicht Befriedigung verlangen können. Dieses Recht steht den Gläubigern jedoch nur zu, wenn sie glaubhaft machen, dass durch die Abspaltung die Erfüllung ihrer Forderung gefährdet wird."
    },
    {
      "date": "2025-02-12",
      "id": "101160",
      "original_text": "Löschungsankündigung\nNordrhein-Westfalen Amtsgericht Gütersloh HRB 8222\nSchäfer GmbH – Harsewinkel",
      "type": "Löschungsankündigung",
      "state": "Nordrhein-Westfalen",
      "amtsgericht": "Amtsgericht Gütersloh",
      "registernummer": "HRB 8222",
      "registerart": "HRB",
      "company_name": "Schäfer GmbH",
      "company_seat": "Harsewinkel",
      "details": "12.02.2025 (Bekanntmachungsdatum)\n\nNordrhein-Westfalen Amtsgericht Gütersloh HRB 8222\nLöschungsankündigung 12.02.2025 (Eintragungsdatum)\n\nSchäfer GmbH\nGesellschaft mit beschränkter Haftung\nHarsewinkel\n\nDas Registergericht beabsichtigt die Gesellschaft von Amts wegen nach § 394 FamFG zu löschen. Die Frist zur Erhebung eines Widerspruchs ist auf einen Monat festgesetzt."
    },
    {
      "date": "2025-02-12",
      "id": "101161",
      "original_text": "Registerbekanntmachung nach dem Umwandlungsgesetz\nNordrhein-Westfalen Amtsgericht Bad Oeynhausen HRB 16119\nGesundheitsCentrum Bünde Immobilien GmbH – Bünde",
      "type": "Registerbekanntmachung nach dem Umwandlungsgesetz",
      "state": "Nordrhein-Westfalen",
      "amtsgericht": "Amtsgericht Bad Oeynhausen",
      "registernummer": "HRB 16119",
      "registerart": "HRB",
      "company_name": "GesundheitsCentrum Bünde Immobilien GmbH",
      "company_seat": "Bünde",
      "details": "12.02.2025 (Bekanntmachungsdatum)\n\nNordrhein-Westfalen Amtsgericht Bad Oeynhausen HRB 16119\nRegisterbekanntmachung nach dem Umwandlungsgesetz 12.02.2025 (Eintragungsdatum)\n\nGesundheitsCentrum Bünde Immobilien GmbH\nGesellschaft mit beschränkter Haftung\nBünde\n\nDen Gläubigern der an der Verschmelzung beteiligten Rechtsträger ist, wenn sie binnen sechs Monaten nach dem Tag, an dem die Eintragung der Verschmelzung in das Register des Sitzes derjenigen Rechtsträger deren Gläubiger sie sind, nach § 19 Absatz 3 UmwG als bekanntgemacht gilt, ihren Anspruch nach Grund und Höhe schriftlich anmelden, Sicherheit zu leisten, soweit sie nicht Befriedigung verlangen können. Dieses Recht steht den Gläubigern jedoch nur zu, wenn sie glaubhaft machen, dass durch die Verschmelzung die Erfüllung ihrer Forderung gefährdet wird."
    },
    {
      "date": "2025-02-12",
      "id": "101162",
      "original_text": "Registerbekanntmachung nach dem Umwandlungsgesetz\nNordrhein-Westfalen Amtsgericht Bochum HRB 8047 früher Amtsgericht Witten\nInduclean- Industrieservice GmbH – Witten",
      "type": "Registerbekanntmachung nach dem Umwandlungsgesetz",
      "state": "Nordrhein-Westfalen",
      "amtsgericht": "Amtsgericht Bochum",
      "registernummer": "HRB 8047",
      "registerart": "HRB",
      "company_name": "Induclean- Industrieservice GmbH",
      "company_seat": "Witten",
      "former_amtsgericht": "Witten",
      "details": "12.02.2025 (Bekanntmachungsdatum)\n\nNordrhein-Westfalen Amtsgericht Bochum HRB 8047 früher Amtsgericht Witten\nRegisterbekanntmachung nach dem Umwandlungsgesetz 20.01.2025 (Eintragungsdatum)\n\nInduclean- Industrieservice GmbH\nGesellschaft mit beschränkter Haftung\nWitten\n\nDen Gläubigern der an der formwechselnden Umwandlung beteiligten Rechtsträger ist, wenn sie binnen sechs Monaten nach dem Tag, an dem die Eintragung der formwechselnden Umwandlung in das Register des Sitzes desjenigen Rechtsträgers, dessen Gläubiger sie sind, nach § 19 Absatz 3 UmwG als bekanntgemacht gilt, ihren Anspruch nach Grund und Höhe schriftlich anmelden, Sicherheit zu leisten, soweit sie nicht Befriedigung verlangen können. Dieses Recht steht den Gläubigern jedoch nur zu, wenn sie glaubhaft machen, dass durch die formwechselnden Umwandlung die Erfüllung ihrer Forderung gefährdet wird."
    },
    {
      "date": "2025-02-12",
      "id": "101163",
      "original_text": "Registerbekanntmachung nach dem Umwandlungsgesetz\nNordrhein-Westfalen Amtsgericht Köln HRA 37863\nSaal Consulting oHG – Köln",
      "type": "Registerbekanntmachung nach dem Umwandlungsgesetz",
      "state": "Nordrhein-Westfalen",
      "amtsgericht": "Amtsgericht Köln",
      "registernummer": "HRA 37863",
      "registerart": "HRA",
      "company_name": "Saal Consulting oHG",
      "company_seat": "Köln",
      "details": "12.02.2025 (Bekanntmachungsdatum)\n\nNordrhein-Westfalen Amtsgericht Köln HRA 37863\nRegisterbekanntmachung nach dem Umwandlungsgesetz 12.02.2025 (Eintragungsdatum)\n\nSaal Consulting oHG\nOffene Handelsgesellschaft\nKöln\n\nDen Gläubigern der an der formwechselnden Umwandlung beteiligten Rechtsträger ist, wenn sie binnen sechs Monaten nach dem Tag, an dem die Eintragung der formwechselnden Umwandlung in das Register des Sitzes desjenigen Rechtsträgers, dessen Gläubiger sie sind, nach § 19 Absatz 3 UmwG als bekanntgemacht gilt, ihren Anspruch nach Grund und Höhe schriftlich anmelden, Sicherheit zu leisten, soweit sie nicht Befriedigung verlangen können. Dieses Recht steht den Gläubigern jedoch nur zu, wenn sie glaubhaft machen, dass durch die formwechselnden Umwandlung die Erfüllung ihrer Forderung gefährdet wird."
    },
    {
      "date": "2025-02-12",
      "id": "101164",
      "original_text": "Registerbekanntmachung nach dem Umwandlungsgesetz\nNordrhein-Westfalen Amtsgericht Iserlohn HRB 1527\nSIMU GmbH – Iserlohn",
      "type": "Registerbekanntmachung nach dem Umwandlungsgesetz",
      "state": "Nordrhein-Westfalen",
      "amtsgericht": "Amtsgericht Iserlohn",
      "registernummer": "HRB 1527",
      "registerart": "HRB",
      "company_name": "SIMU GmbH",
      "company_seat": "Iserlohn",
      "details": "12.02.2025 (Bekanntmachungsdatum)\n\nNordrhein-Westfalen Amtsgericht Iserlohn HRB 1527\nRegisterbekanntmachung nach dem Umwandlungsgesetz 10.02.2025 (Eintragungsdatum)\n\nSIMU GmbH\nGesellschaft mit beschränkter Haftung\nIserlohn\n\nDen Gläubigern der an der Verschmelzung beteiligten Rechtsträger ist, wenn sie binnen sechs Monaten nach dem Tag, an dem die Eintragung der Verschmelzung in das Register des Sitzes desjenigen Rechtsträgers, dessen Gläubiger sie sind, nach § 19 Absatz 3 UmwG als bekanntgemacht gilt, ihren Anspruch nach Grund und Höhe schriftlich anmelden, Sicherheit zu leisten, soweit sie nicht Befriedigung verlangen können. Dieses Recht steht den Gläubigern jedoch nur zu, wenn sie glaubhaft machen, dass durch die Verschmelzung die Erfüllung ihrer Forderung gefährdet wird."
    },
    {
      "date": "2025-02-12",
      "id": "101165",
      "original_text": "Einreichung neuer Dokumente\nNordrhein-Westfalen Amtsgericht Düsseldorf HRB 88259\nCoCoNet AG – Düsseldorf",
      "type": "Einreichung neuer Dokumente",
      "state": "Nordrhein-Westfalen",
      "amtsgericht": "Amtsgericht Düsseldorf",
      "registernummer": "HRB 88259",
      "registerart": "HRB",
      "company_name": "CoCoNet AG",
      "company_seat": "Düsseldorf",
      "details": "12.02.2025 (Bekanntmachungsdatum)\n\nNordrhein-Westfalen Amtsgericht Düsseldorf HRB 88259\nEinreichung neuer Dokumente 12.02.2025 (Eintragungsdatum)\n\nCoCoNet AG\nAktiengesellschaft\nDüsseldorf\n\nDem Registergericht ist eine Liste der Mitglieder des Aufsichtsrates eingereicht worden."
    },
    {
      "date": "2025-02-12",
      "id": "101166",
      "original_text": "Registerbekanntmachung nach dem Umwandlungsgesetz\nNordrhein-Westfalen Amtsgericht Münster HRB 21195\nPoultry Europe Trading GmbH – Ostbevern",
      "type": "Registerbekanntmachung nach dem Umwandlungsgesetz",
      "state": "Nordrhein-Westfalen",
      "amtsgericht": "Amtsgericht Münster",
      "registernummer": "HRB 21195",
      "registerart": "HRB",
      "company_name": "Poultry Europe Trading GmbH",
      "company_seat": "Ostbevern",
      "details": "12.02.2025 (Bekanntmachungsdatum)\n\nNordrhein-Westfalen Amtsgericht Münster HRB 21195\nRegisterbekanntmachung nach dem Umwandlungsgesetz\n\nPoultry Europe Trading GmbH\nGesellschaft mit beschränkter Haftung\nOstbevern\n\nDem Registergericht ist der Entwurf eines Verschmelzungsplanes über die geplante Verschmelzung der Gesellschaft mit beschränkter\nHaftung nach deutschem Recht unter Firma Poultry Europe Trading GmbH mit Sitz in Ostbevern (Amtsgericht Münster HRB 21195) mit der Gesellschaft mit beschränkter Haftung nach portugiesischem Recht unter Firma VDB EUROPE FT, UNIPESSOAL LDA, mit Sitz in Lissabon, Portugal, (portugiesisches Handelsregisteramt Nummer 518 440 699) eingereicht worden.\n\nHinweis an\n\na. die Anteilsinhaber und Gläubiger der an der grenzüberschreitenden Verschmelzung beteiligten Gesellschaften sowie\n\nb. die zuständigen Betriebsräte der an der grenzüberschreitenden\nVerschmelzung beteiligten Gesellschaften oder, soweit es keinen Betriebsrat\ngibt, an die Arbeitnehmer der an der grenzüberschreitenden Verschmelzung\nbeteiligten Gesellschaften,\n\ndass sie der jeweiligen Gesellschaft spätestens fünf Arbeitstage vor dem Tag der Gesellschafterversammlung über die Zustimmung zum Verschmelzungsplan bzw. der beabsichtigten Beurkundung des Verschmelzungsplans ihre Bemerkungen zum Verschmelzungsplan übermitteln können.\n\nDie Gesellschafterversammlung des übernehmenden Rechtsträgers VDB EUROPE FT, UNIPESSOAL LDA beabsichtigt, dem Verschmelzungsplan am 04.03.2025 zuzustimmen.\nEin zustimmender Verschmelzungsbeschluss der Gesellschaft als übertragender\nRechtsträger ist gemäß § 312 Abs. (2) in Verbindung mit § 307 Abs. (3) UmwG nicht erforderlich, da sich alle Anteile der übertragenden Gesellschaft in der Hand der übernehmenden Gesellschaft befinden.\nEs ist beabsichtigt, dass der Verschmelzungsplan ebenfalls am 04.03.2025 beurkundet wird.\n\nEtwaige Bemerkungen erfolgen daher fristgerecht, wenn sie bis spätestens zum\n25.02.2025 mitgeteilt werden.\n\nMitteilungen können gerichtet werden an:\n\n- Poultry Europe Trading GmbH: Vossko-Allee 1, 48346 Ostbevern\n\n- VDB EUROPE FT, UNIPESSOAL LDA: Avenida da Liberdade, n° 38, 2° Piso,\n1269-039 Lisboa, Stadt Lissabon, Gemeinde Santo Antonio. Die vollständigen Auskünfte über diese Modalitäten können kostenlos eingeholt werden bei Poultry Europe Trading GmbH: Vossko-Allee 1, 48346 Ostbevern\nVDB EUROPE FT, UNIPESSOAL LDA: Avenida da Liberdade, n° 38, 2° Piso,\n1269-039 Lisboa, Stadt Lissabon, Gemeinde Santo Antonio."
    },
    {
      "date": "2025-02-12",
      "id": "101167",
      "original_text": "Registerbekanntmachung nach dem Umwandlungsgesetz\nNordrhein-Westfalen Amtsgericht Bad Oeynhausen HRB 16350\nStruck Verwaltungsgesellschaft mbH – Bünde",
      "type": "Registerbekanntmachung nach dem Umwandlungsgesetz",
      "state": "Nordrhein-Westfalen",
      "amtsgericht": "Amtsgericht Bad Oeynhausen",
      "registernummer": "HRB 16350",
      "registerart": "HRB",
      "company_name": "Struck Verwaltungsgesellschaft mbH",
      "company_seat": "Bünde",
      "details": "12.02.2025 (Bekanntmachungsdatum)\n\nNordrhein-Westfalen Amtsgericht Bad Oeynhausen HRB 16350\nRegisterbekanntmachung nach dem Umwandlungsgesetz 12.02.2025 (Eintragungsdatum)\n\nStruck Verwaltungsgesellschaft mbH\nGesellschaft mit beschränkter Haftung\nBünde\n\nDen Gläubigern der an der Verschmelzung beteiligten Rechtsträger ist, wenn sie binnen sechs Monaten nach dem Tag, an dem die Eintragung der Verschmelzung in das Register des Sitzes derjenigen Rechtsträger deren Gläubiger sie sind, nach § 19 Absatz 3 UmwG als bekanntgemacht gilt, ihren Anspruch nach Grund und Höhe schriftlich anmelden, Sicherheit zu leisten, soweit sie nicht Befriedigung verlangen können. Dieses Recht steht den Gläubigern jedoch nur zu, wenn sie glaubhaft machen, dass durch die Verschmelzung die Erfüllung ihrer Forderung gefährdet wird."
    },
    {
      "date": "2025-02-12",
      "id": "101168",
      "original_text": "Löschungsankündigung\nNordrhein-Westfalen Amtsgericht Düsseldorf HRB 97986\nKarma Bau GmbH – Düsseldorf",
      "type": "Löschungsankündigung",
      "state": "Nordrhein-Westfalen",
      "amtsgericht": "Amtsgericht Düsseldorf",
      "registernummer": "HRB 97986",
      "registerart": "HRB",
      "company_name": "Karma Bau GmbH",
      "company_seat": "Düsseldorf",
      "details": "12.02.2025 (Bekanntmachungsdatum)\n\nNordrhein-Westfalen Amtsgericht Düsseldorf HRB 97986\nLöschungsankündigung\n\nKarma Bau GmbH\nGesellschaft mit beschränkter Haftung\nDüsseldorf\n\nDas Registergericht beabsichtigt die Gesellschaft von Amts wegen nach § 394 Abs. 1 FamFG zu löschen. Die Frist zur Erhebung eines Widerspruchs ist auf 1 Monat festgesetzt.\n\nRechtsbehelfsbelehrung:\nDas Widerspruchsrecht steht jedem zu, der an der Unterlassung der Löschung ein berechtigtes Interesse hat. Der Widerspruch ist bei dem Amtsgericht Düsseldorf -Registergericht-, Werdener Straße 1, 40227 Düsseldorf schriftlich in deutscher Sprache oder zur Niederschrift der Geschäftsstelle einzulegen. Der Widerspruch kann auch zur Niederschrift der Geschäftsstelle eines jeden Amtsgerichtes abgegeben werden. Die Einlegung ist auch durch Übertragung eines elektronischen Dokuments an die elektronische Poststelle des Gerichts möglich. Das elektronische Dokument muss für die Bearbeitung durch das Gericht geeignet und mit einer qualifizierten elektronischen Signatur der verantwortenden Person versehen sein oder von der verantwortenden Person signiert und auf einem sicheren Übermittlungsweg gemäß § 130a ZPO nach näherer Maßgabe der Verordnung über die technischen Rahmenbedingungen des elektronischen Rechtsverkehrs und über das besondere elektronische Behördenpostfach (BGBl. I, S.3803) eingereicht werden. Weitere Informationen erhalten Sie auf der Internetseite www.justiz.de.\nDer Widerspruch muss spätestens innerhalb der gesetzten Frist nach dem Datum der Bekanntmachung der Löschungsankündigung bei dem Amtsgericht - Registergericht - Düsseldorf eingegangen sein.  Dies gilt auch dann, wenn der Widerspruch zur Niederschrift der Geschäftsstelle eines anderen Amtsgerichtes abgegeben wurde. Die Frist beginnt mit dem Tage der Bekanntmachung der Löschungsankündigung in dem für die Bekanntmachung der Eintragungen in das Handelsregister bestimmten elektronischen Informations- und Kommunikationssystem nach § 10 des Handelsgesetzbuches. Fällt das Ende der Frist auf einen Sonntag, einen allgemeinen Feiertag oder Sonnabend, so endet die Frist mit Ablauf des nächsten Werktages.\nDer Widerspruch muss die Bezeichnung der angefochtenen Löschungsankündigung sowie die Erklärung enthalten, dass Widerspruch gegen diese Löschungsankündigung eingelegt wird. Er ist zu unterzeichnen und soll begründet werden."
    },
    {
      "date": "2025-02-12",
      "id": "101169",
      "original_text": "Einreichung neuer Dokumente\nNordrhein-Westfalen Amtsgericht Hagen HRB 58\nha.ge.we Hagener Gemeinnützige Wohnungsgesellschaft mbH – Hagen",
      "type": "Einreichung neuer Dokumente",
      "state": "Nordrhein-Westfalen",
      "amtsgericht": "Amtsgericht Hagen",
      "registernummer": "HRB 58",
      "registerart": "HRB",
      "company_name": "ha.ge.we Hagener Gemeinnützige Wohnungsgesellschaft mbH",
      "company_seat": "Hagen",
      "details": "12.02.2025 (Bekanntmachungsdatum)\n\nNordrhein-Westfalen Amtsgericht Hagen HRB 58\nEinreichung neuer Dokumente\n\nha.ge.we Hagener Gemeinnützige Wohnungsgesellschaft mbH\nGesellschaft mit beschränkter Haftung\nHagen\n\nDie gesetzlichen Vertreter der Gesellschaft haben eine aktuelle Liste der Aufsichtsratsmitlieder zum Handelsregister eingereicht."
    },
    {
      "date": "2025-02-12",
      "id": "101170",
      "original_text": "Sonstige Registerbekanntmachung\nNordrhein-Westfalen Amtsgericht Düsseldorf HRB 48298\nWENDEpunkt GmbH – Düsseldorf",
      "type": "Sonstige Registerbekanntmachung",
      "state": "Nordrhein-Westfalen",
      "amtsgericht": "Amtsgericht Düsseldorf",
      "registernummer": "HRB 48298",
      "registerart": "HRB",
      "company_name": "WENDEpunkt GmbH",
      "company_seat": "Düsseldorf",
      "details": "12.02.2025 (Bekanntmachungsdatum)\n\nNordrhein-Westfalen Amtsgericht Düsseldorf HRB 48298\nSonstige Registerbekanntmachung 12.02.2025 (Eintragungsdatum)\n\nWENDEpunkt GmbH\nGesellschaft mit beschränkter Haftung\nDüsseldorf\n\nAls nicht eingetragen wird veröffentlicht: Den Gläubigern der Gesellschaft, deren Forderungen begründet worden sind bevor die Eintragung der Beendigung des Gewinnabführungsvertrages  in das Handelsregister nach § 10 des Handelsgesetzbuches als bekanntgemacht gilt, hat der andere Vertragsteil Sicherheit zu leisten, wenn sie sich binnen sechs Monaten nach der Bekanntmachung der Eintragung zu diesem Zweck bei ihm melden."
    },
    {
      "date": "2025-02-12",
      "id": "101171",
      "original_text": "Löschungsankündigung\nNordrhein-Westfalen Amtsgericht Wuppertal HRA 25153\nSeniorenbetreuung mit Herz Ltd. & Co. KG – Erkrath",
      "type": "Löschungsankündigung",
      "state": "Nordrhein-Westfalen",
      "amtsgericht": "Amtsgericht Wuppertal",
      "registernummer": "HRA 25153",
      "registerart": "HRA",
      "company_name": "Seniorenbetreuung mit Herz Ltd. & Co. KG",
      "company_seat": "Erkrath",
      "details": "12.02.2025 (Bekanntmachungsdatum)\n\nNordrhein-Westfalen Amtsgericht Wuppertal HRA 25153\nLöschungsankündigung\n\nSeniorenbetreuung mit Herz Ltd. & Co. KG\nKommanditgesellschaft\nErkrath\n\nDas Registergericht beabsichtigt die Firma von Amts wegen nach § 394 FamFG zu löschen. Die Frist zur Erhebung eines Widerspruchs ist auf drei Monate festgesetzt."
    },
    {
      "date": "2025-02-12",
      "id": "101172",
      "original_text": "Registerbekanntmachung nach dem Umwandlungsgesetz\nNordrhein-Westfalen Amtsgericht Köln HRB 122153\nSaal Consulting GmbH – Köln",
      "type": "Registerbekanntmachung nach dem Umwandlungsgesetz",
      "state": "Nordrhein-Westfalen",
      "amtsgericht": "Amtsgericht Köln",
      "registernummer": "HRB 122153",
      "registerart": "HRB",
      "company_name": "Saal Consulting GmbH",
      "company_seat": "Köln",
      "details": "12.02.2025 (Bekanntmachungsdatum)\n\nNordrhein-Westfalen Amtsgericht Köln HRB 122153\nRegisterbekanntmachung nach dem Umwandlungsgesetz 12.02.2025 (Eintragungsdatum)\n\nSaal Consulting GmbH\nGesellschaft mit beschränkter Haftung\nKöln\n\nDen Gläubigern der an der formwechselnden Umwandlung beteiligten Rechtsträger ist, wenn sie binnen sechs Monaten nach dem Tag, an dem die Eintragung der formwechselnden Umwandlung in das Register des Sitzes desjenigen Rechtsträgers, dessen Gläubiger sie sind, nach § 19 Absatz 3 UmwG als bekanntgemacht gilt, ihren Anspruch nach Grund und Höhe schriftlich anmelden, Sicherheit zu leisten, soweit sie nicht Befriedigung verlangen können. Dieses Recht steht den Gläubigern jedoch nur zu, wenn sie glaubhaft machen, dass durch die formwechselnden Umwandlung die Erfüllung ihrer Forderung gefährdet wird."
    },
    {
      "date": "2025-02-12",
      "id": "101173",
      "original_text": "Löschungsankündigung\nNordrhein-Westfalen Amtsgericht Dortmund HRB 31810\nARC Ambulantes Reha Concept Gesundheitsmobil UG (haftungsbeschränkt) – Castrop-Rauxel",
      "type": "Löschungsankündigung",
      "state": "Nordrhein-Westfalen",
      "amtsgericht": "Amtsgericht Dortmund",
      "registernummer": "HRB 31810",
      "registerart": "HRB",
      "company_name": "ARC Ambulantes Reha Concept Gesundheitsmobil UG (haftungsbeschränkt)",
      "company_seat": "Castrop-Rauxel",
      "details": "12.02.2025 (Bekanntmachungsdatum)\n\nNordrhein-Westfalen Amtsgericht Dortmund HRB 31810\nLöschungsankündigung\n\nARC Ambulantes Reha Concept Gesundheitsmobil UG (haftungsbeschränkt)\nGesellschaft mit beschränkter Haftung\nCastrop-Rauxel\n\nDas Registergericht beabsichtigt die Gesellschaft von Amts wegen nach § 394 FamFG zu löschen. Die Frist zur Erhebung eines Widerspruchs ist auf zwei Monate festgesetzt."
    },
    {
      "date": "2025-02-12",
      "id": "101174",
      "original_text": "Registerbekanntmachung nach dem Umwandlungsgesetz\nNordrhein-Westfalen Amtsgericht Köln HRB 115182\nvolatile earth GmbH – Köln",
      "type": "Registerbekanntmachung nach dem Umwandlungsgesetz",
      "state": "Nordrhein-Westfalen",
      "amtsgericht": "Amtsgericht Köln",
      "registernummer": "HRB 115182",
      "registerart": "HRB",
      "company_name": "volatile earth GmbH",
      "company_seat": "Köln",
      "details": "12.02.2025 (Bekanntmachungsdatum)\n\nNordrhein-Westfalen Amtsgericht Köln HRB 115182\nRegisterbekanntmachung nach dem Umwandlungsgesetz 12.02.2025 (Eintragungsdatum)\n\nvolatile earth GmbH\nGesellschaft mit beschränkter Haftung\nKöln\n\nDen Gläubigern der an der Verschmelzung beteiligten Rechtsträger ist, wenn sie binnen sechs Monaten nach dem Tag, an dem die Eintragung der Verschmelzung in das Register des Sitzes desjenigen Rechtsträgers, dessen Gläubiger sie sind, nach § 19 Absatz 3 UmwG als bekanntgemacht gilt, ihren Anspruch nach Grund und Höhe schriftlich anmelden, Sicherheit zu leisten, soweit sie nicht Befriedigung verlangen können. Dieses Recht steht den Gläubigern jedoch nur zu, wenn sie glaubhaft machen, dass durch die Verschmelzung die Erfüllung ihrer Forderung gefährdet wird."
    },
    {
      "date": "2025-02-12",
      "id": "101175",
      "original_text": "Löschungsankündigung\nNordrhein-Westfalen Amtsgericht Kleve HRB 2229\nN.V. Waarborgmij S.G.W.N. (Zweigniederlassung Deutschland) – Kleve",
      "type": "Löschungsankündigung",
      "state": "Nordrhein-Westfalen",
      "amtsgericht": "Amtsgericht Kleve",
      "registernummer": "HRB 2229",
      "registerart": "HRB",
      "company_name": "N.V. Waarborgmij S.G.W.N. (Zweigniederlassung Deutschland)",
      "company_seat": "Kleve",
      "details": "12.02.2025 (Bekanntmachungsdatum)\n\nNordrhein-Westfalen Amtsgericht Kleve HRB 2229\nLöschungsankündigung\n\nN.V. Waarborgmij S.G.W.N. (Zweigniederlassung Deutschland)\nRechtsform ausländischen Rechts HRB\nKleve\n\ndas Registergericht beabsichtigt, die im Handelsregister eingetragene Gesellschaft gemäß § 395, 398 FamFG (Gesetz über das Verfahren in Familiensachen und in den Angelegenheiten der freiwilligen Gerichtsbarkeit) wegen des Mangels einer wesentlichen Voraussetzung zu löschen. Die Hauptniederlassung der Gesellschaft - die N.V. Waarborgmij S.G.W.N. mit Sitz in Zutphen/Niederlande - ist aus dem niederländischen Handelsregister gelöscht worden.\n\nDie Frist zur Geltendmachung eine Widerspruchs beträgt 1 Monat."
    },
    {
      "date": "2025-02-12",
      "id": "101176",
      "original_text": "Löschungsankündigung\nNordrhein-Westfalen Amtsgericht Wuppertal HRB 25728\nHandyreparaturen-NRW HAAN UG (haftungsbeschränkt) – Haan",
      "type": "Löschungsankündigung",
      "state": "Nordrhein-Westfalen",
      "amtsgericht": "Amtsgericht Wuppertal",
      "registernummer": "HRB 25728",
      "registerart": "HRB",
      "company_name": "Handyreparaturen-NRW HAAN UG (haftungsbeschränkt)",
      "company_seat": "Haan",
      "details": "12.02.2025 (Bekanntmachungsdatum)\n\nNordrhein-Westfalen Amtsgericht Wuppertal HRB 25728\nLöschungsankündigung 11.02.2025 (Eintragungsdatum)\n\nHandyreparaturen-NRW HAAN UG (haftungsbeschränkt)\nGesellschaft mit beschränkter Haftung\nHaan\n\nDas Registergericht beabsichtigt die Gesellschaft von Amts wegen nach § 394 FamFG zu löschen. Die Frist zur Erhebung eines Widerspruchs ist auf einen Monat festgesetzt."
    },
    {
      "date": "2025-02-12",
      "id": "101177",
      "original_text": "Einreichung neuer Dokumente\nBaden-Württemberg Amtsgericht Freiburg HRB 600143\nKur- und Bäder GmbH Bad Dürrheim – Bad Dürrheim",
      "type": "Einreichung neuer Dokumente",
      "state": "Baden-Württemberg",
      "amtsgericht": "Amtsgericht Freiburg",
      "registernummer": "HRB 600143",
      "registerart": "HRB",
      "company_name": "Kur- und Bäder GmbH Bad Dürrheim",
      "company_seat": "Bad Dürrheim",
      "details": "12.02.2025 (Bekanntmachungsdatum)\n\nBaden-Württemberg Amtsgericht Freiburg HRB 600143\nEinreichung neuer Dokumente 12.02.2025 (Eintragungsdatum)\n\nKur- und Bäder GmbH Bad Dürrheim\nGesellschaft mit beschränkter Haftung\nBad Dürrheim\n\nAls nicht eingetragen wird bekanntgemacht:\nDie Gesellschaft hat am 11.02.2025 die Liste über die Zusammensetzung des Aufsichtsrats zum Handelsregister eingereicht."
    },
    {
      "date": "2025-02-12",
      "id": "101178",
      "original_text": "Sonstige Registerbekanntmachung\nThüringen Amtsgericht Jena HRB 301490\nILS Innovative Laborsysteme GmbH – Ilmenau",
      "type": "Sonstige Registerbekanntmachung",
      "state": "Thüringen",
      "amtsgericht": "Amtsgericht Jena",
      "registernummer": "HRB 301490",
      "registerart": "HRB",
      "company_name": "ILS Innovative Laborsysteme GmbH",
      "company_seat": "Ilmenau",
      "details": "12.02.2025 (Bekanntmachungsdatum)\n\nThüringen Amtsgericht Jena HRB 301490\nSonstige Registerbekanntmachung\n\nILS Innovative Laborsysteme GmbH\nGesellschaft mit beschränkter Haftung\nIlmenau\n\nDer Gewinnabführungsvertrag vom  25.09.2017 mit der Gardner Denver Thomas GmbH mit dem Sitz in Fürstenfeldbruck (Amtsgericht München HRB 221449) ist durch Aufhebung zum 31.12.2024 beendet.\nNicht eingetragen: Den Gläubigern der Gesellschaft, deren Forderungen begründet worden sind, bevor die Eintragung der Beendigung des Vertrages in das Handelsregister nach § 10 des Handelsgesetzbuches als bekanntgemacht gilt, hat der andere Vertragsteil Sicherheit zu leisten, wenn sie sich binnen sechs Monaten nach der Bekanntmachung der Eintragung zu diesem Zweck bei ihm melden."
    },
    {
      "date": "2025-02-12",
      "id": "101179",
      "original_text": "Einreichung neuer Dokumente\nThüringen Amtsgericht Jena HRB 501004\nSWE Netz GmbH – Erfurt",
      "type": "Einreichung neuer Dokumente",
      "state": "Thüringen",
      "amtsgericht": "Amtsgericht Jena",
      "registernummer": "HRB 501004",
      "registerart": "HRB",
      "company_name": "SWE Netz GmbH",
      "company_seat": "Erfurt",
      "details": "12.02.2025 (Bekanntmachungsdatum)\n\nThüringen Amtsgericht Jena HRB 501004\nEinreichung neuer Dokumente 01.01.2025 (Eintragungsdatum)\n\nSWE Netz GmbH\nGesellschaft mit beschränkter Haftung\nErfurt\n\nBekanntmachung gem. § 52 Abs. 3 Satz 2 GmbHG: Aufgrund einer Veränderung in den Personen der Aufsichtsratsmitglieder ist durch die Geschäftsführer eine neue Liste zum Handelsregister eingereicht worden."
    },
    {
      "date": "2025-02-12",
      "id": "101180",
      "original_text": "Einreichung neuer Dokumente\nThüringen Amtsgericht Jena HRB 104134\nErfurter Garten- und Ausstellungs gemeinnützige GmbH (ega) – Erfurt",
      "type": "Einreichung neuer Dokumente",
      "state": "Thüringen",
      "amtsgericht": "Amtsgericht Jena",
      "registernummer": "HRB 104134",
      "registerart": "HRB",
      "company_name": "Erfurter Garten- und Ausstellungs gemeinnützige GmbH (ega)",
      "company_seat": "Erfurt",
      "details": "12.02.2025 (Bekanntmachungsdatum)\n\nThüringen Amtsgericht Jena HRB 104134\nEinreichung neuer Dokumente 01.01.2025 (Eintragungsdatum)\n\nErfurter Garten- und Ausstellungs gemeinnützige GmbH (ega)\nGesellschaft mit beschränkter Haftung\nErfurt\n\nBekanntmachung gem. § 52 Abs. 3 Satz 2 GmbHG: Aufgrund einer Veränderung in den Personen der Aufsichtsratsmitglieder ist durch die Geschäftsführer eine neue Liste zum Handelsregister eingereicht worden."
    },
    {
      "date": "2025-02-12",
      "id": "101181",
      "original_text": "Einreichung neuer Dokumente\nHessen Amtsgericht Limburg HRB 3816\nKreiskrankenhaus Weilburg gemeinnützige Gesellschaft mit beschränkter Haftung – Weilburg",
      "type": "Einreichung neuer Dokumente",
      "state": "Hessen",
      "amtsgericht": "Amtsgericht Limburg",
      "registernummer": "HRB 3816",
      "registerart": "HRB",
      "company_name": "Kreiskrankenhaus Weilburg gemeinnützige Gesellschaft mit beschränkter Haftung",
      "company_seat": "Weilburg",
      "details": "12.02.2025 (Bekanntmachungsdatum)\n\nHessen Amtsgericht Limburg HRB 3816\nEinreichung neuer Dokumente\n\nKreiskrankenhaus Weilburg gemeinnützige Gesellschaft mit beschränkter Haftung\nGesellschaft mit beschränkter Haftung\nWeilburg\n\nDurch eine Änderung in den Personen der Aufsichtsratsmitglieder ist eine Liste der Mitglieder des Aufsichtsrates zum Handelsregister eingereicht worden."
    },
    {
      "date": "2025-02-12",
      "id": "101182",
      "original_text": "Registerbekanntmachung nach dem Umwandlungsgesetz\nHessen Amtsgericht Wiesbaden HRB 35570\niPM-Cloud GmbH – Oestrich-Winkel",
      "type": "Registerbekanntmachung nach dem Umwandlungsgesetz",
      "state": "Hessen",
      "amtsgericht": "Amtsgericht Wiesbaden",
      "registernummer": "HRB 35570",
      "registerart": "HRB",
      "company_name": "iPM-Cloud GmbH",
      "company_seat": "Oestrich-Winkel",
      "details": "12.02.2025 (Bekanntmachungsdatum)\n\nHessen Amtsgericht Wiesbaden HRB 35570\nRegisterbekanntmachung nach dem Umwandlungsgesetz 12.02.2025 (Eintragungsdatum)\n\niPM-Cloud GmbH\nGesellschaft mit beschränkter Haftung\nOestrich-Winkel\n\nDen Gläubigern der an der formwechselnden Umwandlung beteiligten Rechtsträger ist, wenn sie binnen sechs Monaten nach dem Tag, an dem die Eintragung der formwechselnden Umwandlung in das Register des Sitzes derjenigen Rechtsträger deren Gläubiger sie sind, nach § 201 UmwG bekannt gemacht worden ist, ihren Anspruch nach Grund und Höhe schriftlich anmelden, Sicherheit zu leisten, soweit sie nicht Befriedigung verlangen können. Dieses Recht steht den Gläubigern jedoch nur zu, wenn sie glaubhaft machen, dass durch die formwechselnden Umwandlung die Erfüllung ihrer Forderung gefährdet wird."
    },
    {
      "date": "2025-02-12",
      "id": "101183",
      "original_text": "Löschungsankündigung\nHessen Amtsgericht Offenbach am Main HRB 52325\nCOMPASS Personalservice GmbH – Offenach am Main",
      "type": "Löschungsankündigung",
      "state": "Hessen",
      "amtsgericht": "Amtsgericht Offenbach am Main",
      "registernummer": "HRB 52325",
      "registerart": "HRB",
      "company_name": "COMPASS Personalservice GmbH",
      "company_seat": "Offenach am Main",
      "details": "12.02.2025 (Bekanntmachungsdatum)\n\nHessen Amtsgericht Offenbach am Main HRB 52325\nLöschungsankündigung\n\nCOMPASS Personalservice GmbH\nGesellschaft mit beschränkter Haftung\nOffenach am Main\n\nDas Registergericht beabsichtigt die im Handelsregister eingetragene Gesellschaft von Amts wegen nach § 394 FamFG zu löschen. Die Frist zur Erhebung eines Widerspruchs gegen die beabsichtigte Löschung wird auf 3 Monate festgesetzt."
    },
    {
      "date": "2025-02-12",
      "id": "101184",
      "original_text": "Löschungsankündigung\nHessen Amtsgericht Offenbach am Main HRB 11615\nZIW GmbH – Offenbach am Main",
      "type": "Löschungsankündigung",
      "state": "Hessen",
      "amtsgericht": "Amtsgericht Offenbach am Main",
      "registernummer": "HRB 11615",
      "registerart": "HRB",
      "company_name": "ZIW GmbH",
      "company_seat": "Offenbach am Main",
      "details": "12.02.2025 (Bekanntmachungsdatum)\n\nHessen Amtsgericht Offenbach am Main HRB 11615\nLöschungsankündigung\n\nZIW GmbH\nGesellschaft mit beschränkter Haftung\nOffenbach am Main\n\nDas Registergericht beabsichtigt die im Handelsregister eingetragene Gesellschaft von Amts wegen nach § 394 FamFG zu löschen. Die Frist zur Erhebung eines Widerspruchs gegen die beabsichtigte Löschung wird auf 3 Monate festgesetzt."
    },
    {
      "date": "2025-02-12",
      "id": "101185",
      "original_text": "Registerbekanntmachung nach dem Umwandlungsgesetz\nHessen Amtsgericht Offenbach am Main HRB 50187\nDVS TECHNOLOGY AG – Dietzenbach",
      "type": "Registerbekanntmachung nach dem Umwandlungsgesetz",
      "state": "Hessen",
      "amtsgericht": "Amtsgericht Offenbach am Main",
      "registernummer": "HRB 50187",
      "registerart": "HRB",
      "company_name": "DVS TECHNOLOGY AG",
      "company_seat": "Dietzenbach",
      "details": "12.02.2025 (Bekanntmachungsdatum)\n\nHessen Amtsgericht Offenbach am Main HRB 50187\nRegisterbekanntmachung nach dem Umwandlungsgesetz 12.02.2025 (Eintragungsdatum)\n\nDVS TECHNOLOGY AG\nAktiengesellschaft\nDietzenbach\n\nDen Gläubigern der an der Verschmelzung beteiligten Rechtsträger ist, wenn sie binnen sechs Monaten nach dem Tag, an dem die Eintragung der Verschmelzung in das Register des Sitzes desjenigen Rechtsträgers, dessen Gläubiger sie sind, nach § 19 Absatz 3 UmwG bekannt gemacht worden ist, ihren Anspruch nach Grund und Höhe schriftlich anmelden, Sicherheit zu leisten, soweit sie nicht Befriedigung verlangen können. Dieses Recht steht den Gläubigern jedoch nur zu, wenn sie glaubhaft machen, dass durch die Verschmelzung die Erfüllung ihrer Forderung gefährdet wird."
    },
    {
      "date": "2025-02-12",
      "id": "101186",
      "original_text": "Sonstige Registerbekanntmachung\nHessen Amtsgericht Frankfurt am Main HRB 102381\nAtruvia AG – Frankfurt am Main",
      "type": "Sonstige Registerbekanntmachung",
      "state": "Hessen",
      "amtsgericht": "Amtsgericht Frankfurt am Main",
      "registernummer": "HRB 102381",
      "registerart": "HRB",
      "company_name": "Atruvia AG",
      "company_seat": "Frankfurt am Main",
      "details": "12.02.2025 (Bekanntmachungsdatum)\n\nHessen Amtsgericht Frankfurt am Main HRB 102381\nSonstige Registerbekanntmachung 12.02.2025 (Eintragungsdatum)\n\nAtruvia AG\nAktiengesellschaft\nFrankfurt am Main\n\nDurch eine Änderung in den Personen der Aufsichtsratsmitglieder ist eine Liste der Mitglieder des Aufsichtsrates zum Handelsregister eingereicht worden."
    },
    {
      "date": "2025-02-12",
      "id": "101187",
      "original_text": "Löschungsankündigung\nHessen Amtsgericht Friedberg HRB 7627\nProconsu UG (haftungsbeschränkt) – Florstadt",
      "type": "Löschungsankündigung",
      "state": "Hessen",
      "amtsgericht": "Amtsgericht Friedberg",
      "registernummer": "HRB 7627",
      "registerart": "HRB",
      "company_name": "Proconsu UG (haftungsbeschränkt)",
      "company_seat": "Florstadt",
      "details": "12.02.2025 (Bekanntmachungsdatum)\n\nHessen Amtsgericht Friedberg HRB 7627\nLöschungsankündigung\n\nProconsu UG (haftungsbeschränkt)\nGesellschaft mit beschränkter Haftung\nFlorstadt\n\nDas Registergericht beabsichtigt die im Handelsregister eingetragene Gesellschaft von Amts wegen nach § 394 FamFG zu löschen. Die Frist zur Erhebung eines Widerspruchs gegen die beabsichtigte Löschung wird auf 3 Monate festgesetzt."
    },
    {
      "date": "2025-02-12",
      "id": "101188",
      "original_text": "Sonstige Registerbekanntmachung\nHessen Amtsgericht Frankfurt am Main HRB 104470\nFrankfurt Airport Retail Verwaltungs GmbH – Frankfurt am Main",
      "type": "Sonstige Registerbekanntmachung",
      "state": "Hessen",
      "amtsgericht": "Amtsgericht Frankfurt am Main",
      "registernummer": "HRB 104470",
      "registerart": "HRB",
      "company_name": "Frankfurt Airport Retail Verwaltungs GmbH",
      "company_seat": "Frankfurt am Main",
      "details": "12.02.2025 (Bekanntmachungsdatum)\n\nHessen Amtsgericht Frankfurt am Main HRB 104470\nSonstige Registerbekanntmachung 12.02.2025 (Eintragungsdatum)\n\nFrankfurt Airport Retail Verwaltungs GmbH\nGesellschaft mit beschränkter Haftung\nFrankfurt am Main\n\nDurch eine Änderung in den Personen der Aufsichtsratsmitglieder ist eine Liste der Mitglieder des Aufsichtsrates zum Handelsregister eingereicht worden."
    },
    {
      "date": "2025-02-12",
      "id": "101189",
      "original_text": "Registerbekanntmachung nach dem Umwandlungsgesetz\nHessen Amtsgericht Offenbach am Main HRB 53893\nDVS Technology Europe GmbH – Dietzenbach",
      "type": "Registerbekanntmachung nach dem Umwandlungsgesetz",
      "state": "Hessen",
      "amtsgericht": "Amtsgericht Offenbach am Main",
      "registernummer": "HRB 53893",
      "registerart": "HRB",
      "company_name": "DVS Technology Europe GmbH",
      "company_seat": "Dietzenbach",
      "details": "12.02.2025 (Bekanntmachungsdatum)\n\nHessen Amtsgericht Offenbach am Main HRB 53893\nRegisterbekanntmachung nach dem Umwandlungsgesetz 12.02.2025 (Eintragungsdatum)\n\nDVS Technology Europe GmbH\nGesellschaft mit beschränkter Haftung\nDietzenbach\n\nDen Gläubigern der an der Verschmelzung beteiligten Rechtsträger ist, wenn sie binnen sechs Monaten nach dem Tag, an dem die Eintragung der Verschmelzung in das Register des Sitzes desjenigen Rechtsträgers, dessen Gläubiger sie sind, nach § 19 Absatz 3 UmwG bekannt gemacht worden ist, ihren Anspruch nach Grund und Höhe schriftlich anmelden, Sicherheit zu leisten, soweit sie nicht Befriedigung verlangen können. Dieses Recht steht den Gläubigern jedoch nur zu, wenn sie glaubhaft machen, dass durch die Verschmelzung die Erfüllung ihrer Forderung gefährdet wird."
    },
    {
      "date": "2025-02-12",
      "id": "101190",
      "original_text": "Sonstige Registerbekanntmachung\nHessen Amtsgericht Wetzlar VR 1233\nDeutsch-Englischer Freundeskreis Lahnau – Lahnau",
      "type": "Sonstige Registerbekanntmachung",
      "state": "Hessen",
      "amtsgericht": "Amtsgericht Wetzlar",
      "registernummer": "VR 1233",
      "registerart": "VR",
      "company_name": "Deutsch-Englischer Freundeskreis Lahnau",
      "company_seat": "Lahnau",
      "details": "12.02.2025 (Bekanntmachungsdatum)\n\nHessen Amtsgericht Wetzlar VR 1233\nSonstige Registerbekanntmachung 12.02.2025 (Eintragungsdatum)\n\nDeutsch-Englischer Freundeskreis Lahnau\neingetragener Verein\nLahnau\n\nDer Verein ist aufgelöst."
    },
    {
      "date": "2025-02-12",
      "id": "101191",
      "original_text": "Löschungsankündigung\nHessen Amtsgericht Offenbach am Main HRB 53930\nPhoenix NetWork GmbH – Offenbach am Main",
      "type": "Löschungsankündigung",
      "state": "Hessen",
      "amtsgericht": "Amtsgericht Offenbach am Main",
      "registernummer": "HRB 53930",
      "registerart": "HRB",
      "company_name": "Phoenix NetWork GmbH",
      "company_seat": "Offenbach am Main",
      "details": "12.02.2025 (Bekanntmachungsdatum)\n\nHessen Amtsgericht Offenbach am Main HRB 53930\nLöschungsankündigung\n\nPhoenix NetWork GmbH\nGesellschaft mit beschränkter Haftung\nOffenbach am Main\n\nDas Registergericht beabsichtigt die im Handelsregister eingetragene Gesellschaft von Amts wegen nach § 394 FamFG zu löschen. Die Frist zur Erhebung eines Widerspruchs gegen die beabsichtigte Löschung wird auf 3 Monate festgesetzt"
    },
    {
      "date": "2025-02-12",
      "id": "101192",
      "original_text": "Löschungsankündigung\nHessen Amtsgericht Frankfurt am Main HRB 125056\nHumbum Ventures UG (haftungsbeschränkt) – Frankfurt am Main",
      "type": "Löschungsankündigung",
      "state": "Hessen",
      "amtsgericht": "Amtsgericht Frankfurt am Main",
      "registernummer": "HRB 125056",
      "registerart": "HRB",
      "company_name": "Humbum Ventures UG (haftungsbeschränkt)",
      "company_seat": "Frankfurt am Main",
      "details": "12.02.2025 (Bekanntmachungsdatum)\n\nHessen Amtsgericht Frankfurt am Main HRB 125056\nLöschungsankündigung\n\nHumbum Ventures UG (haftungsbeschränkt)\nGesellschaft mit beschränkter Haftung\nFrankfurt am Main\n\nDas Registergericht beabsichtigt die im Handelsregister eingetragene Gesellschaft von Amts wegen nach § 394 FamFG zu löschen. Die Frist zur Erhebung eines Widerspruchs gegen die beabsichtigte Löschung wird auf 1 Monat festgesetzt."
    },
    {
      "date": "2025-02-12",
      "id": "72",
      "original_text": "Sonderregisterbekanntmachung OHNE Bezug zum elektr. Register\nSachsen-Anhalt Amtsgericht Stendal\nAltregister Magdeburg HRB 5490\nIndustriewerke Ostfalen GmbH",
      "type": "Sonderregisterbekanntmachung OHNE Bezug zum elektr. Register",
      "state": "Sachsen-Anhalt",
      "amtsgericht": "Amtsgericht Stendal",
      "company_name": "Industriewerke Ostfalen GmbH",
      "sonderegister_referenz": "Altregister Magdeburg HRB 5490",
      "details": "12.02.2025 (Bekanntmachungsdatum)\n\nSachsen-Anhalt Amtsgericht Stendal\nAltregister Magdeburg HRB 5490\nSonderregisterbekanntmachung OHNE Bezug zum elektr. Register\n\nIndustriewerke Ostfalen GmbH\n\nHinsichtlich der o.g. im Handelsregister am gelöschten Gesellschaft ist beabsichtigt, Herrn Rechtsanwalt Lars Rühmland, Magdeburg zum Nachtragsliquidator zu bestellen.\nDer Antrag kann bei berechtigtem Interesse beim Registergericht Stendal eingesehen werden.\nDie Frist zu Einreichung etwaiger Stellungnahmen bzw. Erhebung eines Widerspruchs wird auf 1 Monat festgesetzt."
    }
  ]
}