{
  "date": "2025-02-26",
  "date_of_scrape": "2025-02-27T04:09:58.175Z",
  "tool_version": "0.2.0",
  "number_of_announcements": 163,
  "announcements": [
    {
      "date": "2025-02-26",
      "id": "102248",
      "original_text": "Löschungsankündigung\nBayern Amtsgericht Coburg HRB 6243\nTextiler Wohnbedarf Vogler UG (haftungsbeschränkt) – Neustadt b. Coburg",
      "type": "Löschungsankündigung",
      "state": "Bayern",
      "amtsgericht": "Amtsgericht Coburg",
      "registernummer": "HRB 6243",
      "registerart": "HRB",
      "company_name": "Textiler Wohnbedarf Vogler UG (haftungsbeschränkt)",
      "company_seat": "Neustadt b. Coburg",
      "details": "26.02.2025 (Bekanntmachungsdatum)\n\nBayern Amtsgericht Coburg HRB 6243\nLöschungsankündigung\n\nTextiler Wohnbedarf Vogler UG (haftungsbeschränkt)\nGesellschaft mit beschränkter Haftung\nNeustadt b. Coburg\n\nDas Registergericht beabsichtigt, die im Handelsregister eingetragene Gesellschaft wegen Vermögenslosigkeit von Amts wegen nach § 394 FamFG zu löschen. Die Frist zur Erhebung eines Widerspruchs ist auf sechs Wochen festgesetzt."
    },
    {
      "date": "2025-02-26",
      "id": "102249",
      "original_text": "Einreichung neuer Dokumente\nBayern Amtsgericht München HRB 174791\nneubau kompass AG – München",
      "type": "Einreichung neuer Dokumente",
      "state": "Bayern",
      "amtsgericht": "Amtsgericht München",
      "registernummer": "HRB 174791",
      "registerart": "HRB",
      "company_name": "neubau kompass AG",
      "company_seat": "München",
      "details": "26.02.2025 (Bekanntmachungsdatum)\n\nBayern Amtsgericht München HRB 174791\nEinreichung neuer Dokumente 25.02.2025 (Eintragungsdatum)\n\nneubau kompass AG\nAktiengesellschaft\nMünchen\n\nDem #Re.Name ist eine Liste der Mitglieder des Aufsichtsrats eingereicht worden, § 106 AktG."
    },
    {
      "date": "2025-02-26",
      "id": "102250",
      "original_text": "Registerbekanntmachung nach dem Umwandlungsgesetz\nBayern Amtsgericht München HRB 222224\nZEDORA 127 Verwaltung GmbH – München",
      "type": "Registerbekanntmachung nach dem Umwandlungsgesetz",
      "state": "Bayern",
      "amtsgericht": "Amtsgericht München",
      "registernummer": "HRB 222224",
      "registerart": "HRB",
      "company_name": "ZEDORA 127 Verwaltung GmbH",
      "company_seat": "München",
      "details": "26.02.2025 (Bekanntmachungsdatum)\n\nBayern Amtsgericht München HRB 222224\nRegisterbekanntmachung nach dem Umwandlungsgesetz 25.02.2025 (Eintragungsdatum)\n\nZEDORA 127 Verwaltung GmbH\nGesellschaft mit beschränkter Haftung\nMünchen\n\nDen Gläubigern der an der Verschmelzung beteiligten Rechtsträger ist, wenn sie binnen sechs Monaten nach dem Tag, an dem die Eintragung der Verschmelzung in das Register des Sitzes desjenigen Rechtsträgers, dessen Gläubiger sie sind, nach § 19 Abs. 3 UmwG als bekannt gemacht gilt, ihren Anspruch nach Grund und Höhe in Textform anmelden, Sicherheit zu leisten, soweit sie nicht Befriedigung verlangen können. Dieses Recht steht den Gläubigern jedoch nur zu, wenn sie glaubhaft machen, dass durch die Verschmelzung die Erfüllung ihrer Forderung gefährdet wird."
    },
    {
      "date": "2025-02-26",
      "id": "102251",
      "original_text": "Löschungsankündigung\nBayern Amtsgericht Coburg HRB 221\nKurt Schütz Gesellschaft mit beschränkter Haftung – Lichtenfels",
      "type": "Löschungsankündigung",
      "state": "Bayern",
      "amtsgericht": "Amtsgericht Coburg",
      "registernummer": "HRB 221",
      "registerart": "HRB",
      "company_name": "Kurt Schütz Gesellschaft mit beschränkter Haftung",
      "company_seat": "Lichtenfels",
      "details": "26.02.2025 (Bekanntmachungsdatum)\n\nBayern Amtsgericht Coburg HRB 221\nLöschungsankündigung 25.05.2025 (Eintragungsdatum)\n\nKurt Schütz Gesellschaft mit beschränkter Haftung\nGesellschaft mit beschränkter Haftung\nLichtenfels\n\nDas Registergericht beabsichtigt, die im Handelsregister eingetragene Gesellschaft wegen Vermögenslosigkeit von Amts wegen nach § 394 FamFG zu löschen. Die Frist zur Erhebung eines Widerspruchs ist auf sechs Wochen festgesetzt."
    },
    {
      "date": "2025-02-26",
      "id": "102252",
      "original_text": "Registerbekanntmachung nach dem Umwandlungsgesetz\nBayern Amtsgericht München HRB 222222\nZEDORA 129 Verwaltung GmbH – München",
      "type": "Registerbekanntmachung nach dem Umwandlungsgesetz",
      "state": "Bayern",
      "amtsgericht": "Amtsgericht München",
      "registernummer": "HRB 222222",
      "registerart": "HRB",
      "company_name": "ZEDORA 129 Verwaltung GmbH",
      "company_seat": "München",
      "details": "26.02.2025 (Bekanntmachungsdatum)\n\nBayern Amtsgericht München HRB 222222\nRegisterbekanntmachung nach dem Umwandlungsgesetz 25.02.2025 (Eintragungsdatum)\n\nZEDORA 129 Verwaltung GmbH\nGesellschaft mit beschränkter Haftung\nMünchen\n\nDen Gläubigern der an der Verschmelzung beteiligten Rechtsträger ist, wenn sie binnen sechs Monaten nach dem Tag, an dem die Eintragung der Verschmelzung in das Register des Sitzes desjenigen Rechtsträgers, dessen Gläubiger sie sind, nach § 19 Abs. 3 UmwG als bekannt gemacht gilt, ihren Anspruch nach Grund und Höhe in Textform anmelden, Sicherheit zu leisten, soweit sie nicht Befriedigung verlangen können. Dieses Recht steht den Gläubigern jedoch nur zu, wenn sie glaubhaft machen, dass durch die Verschmelzung die Erfüllung ihrer Forderung gefährdet wird."
    },
    {
      "date": "2025-02-26",
      "id": "102253",
      "original_text": "Registerbekanntmachung nach dem Umwandlungsgesetz\nBayern Amtsgericht Schweinfurt HRA 10643\nSurfgreen.dev - Carl Bednorz Softwareentwicklung e. K. – Schweinfurt",
      "type": "Registerbekanntmachung nach dem Umwandlungsgesetz",
      "state": "Bayern",
      "amtsgericht": "Amtsgericht Schweinfurt",
      "registernummer": "HRA 10643",
      "registerart": "HRA",
      "company_name": "Surfgreen.dev - Carl Bednorz Softwareentwicklung e. K.",
      "company_seat": "Schweinfurt",
      "details": "26.02.2025 (Bekanntmachungsdatum)\n\nBayern Amtsgericht Schweinfurt HRA 10643\nRegisterbekanntmachung nach dem Umwandlungsgesetz 25.02.2025 (Eintragungsdatum)\n\nSurfgreen.dev - Carl Bednorz Softwareentwicklung e. K.\nEinzelkaufmann / Einzelkauffrau\nSchweinfurt\n\nDen Gläubigern der an der Ausgliederung beteiligten Rechtsträger ist, wenn sie binnen sechs Monaten nach dem Tag, an dem die Eintragung der Ausgliederung in das Register des Sitzes desjenigen Rechtsträgers, dessen Gläubiger sie sind, nach §§ 125, 19 Abs. 3 UmwG als bekannt gemacht gilt, ihren Anspruch nach Grund und Höhe in Textform anmelden, Sicherheit zu leisten, soweit sie nicht Befriedigung verlangen können. Dieses Recht steht den Gläubigern jedoch nur zu, wenn sie glaubhaft machen, dass durch die Ausgliederung die Erfüllung ihrer Forderung gefährdet wird."
    },
    {
      "date": "2025-02-26",
      "id": "102254",
      "original_text": "Löschungsankündigung\nBayern Amtsgericht Augsburg HRB 21658\nBrandl Verwaltungs-GmbH – Diedorf",
      "type": "Löschungsankündigung",
      "state": "Bayern",
      "amtsgericht": "Amtsgericht Augsburg",
      "registernummer": "HRB 21658",
      "registerart": "HRB",
      "company_name": "Brandl Verwaltungs-GmbH",
      "company_seat": "Diedorf",
      "details": "26.02.2025 (Bekanntmachungsdatum)\n\nBayern Amtsgericht Augsburg HRB 21658\nLöschungsankündigung\n\nBrandl Verwaltungs-GmbH\nGesellschaft mit beschränkter Haftung\nDiedorf\n\nDas Registergericht beabsichtigt, die im Handelsregister eingetragene Gesellschaft wegen Vermögenslosigkeit von Amts wegen nach § 394 FamFG zu löschen. Die Frist zur Erhebung eines Widerspruchs ist auf einen Monat festgesetzt."
    },
    {
      "date": "2025-02-26",
      "id": "102255",
      "original_text": "Löschungsankündigung\nBayern Amtsgericht Nürnberg HRB 39806\nThaqi Holz- und Bautenschutz UG (haftungsbeschränkt) – Nürnberg",
      "type": "Löschungsankündigung",
      "state": "Bayern",
      "amtsgericht": "Amtsgericht Nürnberg",
      "registernummer": "HRB 39806",
      "registerart": "HRB",
      "company_name": "Thaqi Holz- und Bautenschutz UG (haftungsbeschränkt)",
      "company_seat": "Nürnberg",
      "details": "26.02.2025 (Bekanntmachungsdatum)\n\nBayern Amtsgericht Nürnberg HRB 39806\nLöschungsankündigung\n\nThaqi Holz- und Bautenschutz UG (haftungsbeschränkt)\nGesellschaft mit beschränkter Haftung\nNürnberg\n\nDas Registergericht beabsichtigt, die im Handelsregister eingetragene Gesellschaft wegen Vermögenslosigkeit von Amts wegen nach § 394 FamFG zu löschen. Die Frist zur Erhebung eines Widerspruchs ist auf einen Monat festgesetzt."
    },
    {
      "date": "2025-02-26",
      "id": "102256",
      "original_text": "Löschungsankündigung\nBayern Amtsgericht Traunstein HRB 1244\nHGA Flugzeugvermietungs GmbH – Bad Aibling",
      "type": "Löschungsankündigung",
      "state": "Bayern",
      "amtsgericht": "Amtsgericht Traunstein",
      "registernummer": "HRB 1244",
      "registerart": "HRB",
      "company_name": "HGA Flugzeugvermietungs GmbH",
      "company_seat": "Bad Aibling",
      "details": "26.02.2025 (Bekanntmachungsdatum)\n\nBayern Amtsgericht Traunstein HRB 1244\nLöschungsankündigung\n\nHGA Flugzeugvermietungs GmbH\nGesellschaft mit beschränkter Haftung\nBad Aibling\n\nDas Registergericht beabsichtigt, die im Handelsregister eingetragene Gesellschaft wegen Vermögenslosigkeit von Amts wegen nach § 394 FamFG zu löschen. Die Frist zur Erhebung eines Widerspruchs ist auf drei Monate festgesetzt."
    },
    {
      "date": "2025-02-26",
      "id": "102257",
      "original_text": "Registerbekanntmachung nach dem Umwandlungsgesetz\nBayern Amtsgericht Schweinfurt HRB 9541\nSurfgreen.dev GmbH – Schweinfurt",
      "type": "Registerbekanntmachung nach dem Umwandlungsgesetz",
      "state": "Bayern",
      "amtsgericht": "Amtsgericht Schweinfurt",
      "registernummer": "HRB 9541",
      "registerart": "HRB",
      "company_name": "Surfgreen.dev GmbH",
      "company_seat": "Schweinfurt",
      "details": "26.02.2025 (Bekanntmachungsdatum)\n\nBayern Amtsgericht Schweinfurt HRB 9541\nRegisterbekanntmachung nach dem Umwandlungsgesetz 25.02.2025 (Eintragungsdatum)\n\nSurfgreen.dev GmbH\nGesellschaft mit beschränkter Haftung\nSchweinfurt\n\nDen Gläubigern der an der Ausgliederung beteiligten Rechtsträger ist, wenn sie binnen sechs Monaten nach dem Tag, an dem die Eintragung der Ausgliederung in das Register des Sitzes desjenigen Rechtsträgers, dessen Gläubiger sie sind, nach §§ 125, 19 Abs. 3 UmwG als bekannt gemacht gilt, ihren Anspruch nach Grund und Höhe in Textform anmelden, Sicherheit zu leisten, soweit sie nicht Befriedigung verlangen können. Dieses Recht steht den Gläubigern jedoch nur zu, wenn sie glaubhaft machen, dass durch die Ausgliederung die Erfüllung ihrer Forderung gefährdet wird."
    },
    {
      "date": "2025-02-26",
      "id": "102258",
      "original_text": "Registerbekanntmachung nach dem Umwandlungsgesetz\nBayern Amtsgericht Würzburg HRB 16620\nGIG Beteiligungs-GmbH – Würzburg",
      "type": "Registerbekanntmachung nach dem Umwandlungsgesetz",
      "state": "Bayern",
      "amtsgericht": "Amtsgericht Würzburg",
      "registernummer": "HRB 16620",
      "registerart": "HRB",
      "company_name": "GIG Beteiligungs-GmbH",
      "company_seat": "Würzburg",
      "details": "26.02.2025 (Bekanntmachungsdatum)\n\nBayern Amtsgericht Würzburg HRB 16620\nRegisterbekanntmachung nach dem Umwandlungsgesetz 25.02.2025 (Eintragungsdatum)\n\nGIG Beteiligungs-GmbH\nGesellschaft mit beschränkter Haftung\nWürzburg\n\nDen Gläubigern der an der Verschmelzung beteiligten Rechtsträger ist, wenn sie binnen sechs Monaten nach dem Tag, an dem die Eintragung der Verschmelzung in das Register des Sitzes desjenigen Rechtsträgers, dessen Gläubiger sie sind, nach § 19 Abs. 3 UmwG als bekannt gemacht gilt, ihren Anspruch nach Grund und Höhe in Textform anmelden, Sicherheit zu leisten, soweit sie nicht Befriedigung verlangen können. Dieses Recht steht den Gläubigern jedoch nur zu, wenn sie glaubhaft machen, dass durch die Verschmelzung die Erfüllung ihrer Forderung gefährdet wird."
    },
    {
      "date": "2025-02-26",
      "id": "102259",
      "original_text": "Registerbekanntmachung nach dem Umwandlungsgesetz\nBayern Amtsgericht Schweinfurt HRA 10238\nKFZ Technik Schuhmann e.K. – Bad Brückenau",
      "type": "Registerbekanntmachung nach dem Umwandlungsgesetz",
      "state": "Bayern",
      "amtsgericht": "Amtsgericht Schweinfurt",
      "registernummer": "HRA 10238",
      "registerart": "HRA",
      "company_name": "KFZ Technik Schuhmann e.K.",
      "company_seat": "Bad Brückenau",
      "details": "26.02.2025 (Bekanntmachungsdatum)\n\nBayern Amtsgericht Schweinfurt HRA 10238\nRegisterbekanntmachung nach dem Umwandlungsgesetz 25.02.2025 (Eintragungsdatum)\n\nKFZ Technik Schuhmann e.K.\nEinzelkaufmann / Einzelkauffrau\nBad Brückenau\n\nDen Gläubigern der an der Ausgliederung beteiligten Rechtsträger ist, wenn sie binnen sechs Monaten nach dem Tag, an dem die Eintragung der Ausgliederung in das Register des Sitzes desjenigen Rechtsträgers, dessen Gläubiger sie sind, nach §§ 125, 19 Abs. 3 UmwG als bekannt gemacht gilt, ihren Anspruch nach Grund und Höhe in Textform anmelden, Sicherheit zu leisten, soweit sie nicht Befriedigung verlangen können. Dieses Recht steht den Gläubigern jedoch nur zu, wenn sie glaubhaft machen, dass durch die Ausgliederung die Erfüllung ihrer Forderung gefährdet wird."
    },
    {
      "date": "2025-02-26",
      "id": "102260",
      "original_text": "Löschungsankündigung\nBayern Amtsgericht München HRB 212929\nAtlantik GmbH – München",
      "type": "Löschungsankündigung",
      "state": "Bayern",
      "amtsgericht": "Amtsgericht München",
      "registernummer": "HRB 212929",
      "registerart": "HRB",
      "company_name": "Atlantik GmbH",
      "company_seat": "München",
      "details": "26.02.2025 (Bekanntmachungsdatum)\n\nBayern Amtsgericht München HRB 212929\nLöschungsankündigung 25.02.2025 (Eintragungsdatum)\n\nAtlantik GmbH\nGesellschaft mit beschränkter Haftung\nMünchen\n\nDas Registergericht beabsichtigt, den im Handelsregister eingetragenen Geschäftsführer Zeljko Maksimovic wegen fehlender Eignung nach § 395 FamFG zu löschen. Die Frist zur Erhebung eines Widerspruchs ist auf drei Monate festgesetzt."
    },
    {
      "date": "2025-02-26",
      "id": "102261",
      "original_text": "Registerbekanntmachung nach dem Umwandlungsgesetz\nBayern Amtsgericht Fürth HRB 18072\nGBI Wohnbau 13 GmbH – Erlangen",
      "type": "Registerbekanntmachung nach dem Umwandlungsgesetz",
      "state": "Bayern",
      "amtsgericht": "Amtsgericht Fürth",
      "registernummer": "HRB 18072",
      "registerart": "HRB",
      "company_name": "GBI Wohnbau 13 GmbH",
      "company_seat": "Erlangen",
      "details": "26.02.2025 (Bekanntmachungsdatum)\n\nBayern Amtsgericht Fürth HRB 18072\nRegisterbekanntmachung nach dem Umwandlungsgesetz 25.02.2025 (Eintragungsdatum)\n\nGBI Wohnbau 13 GmbH\nGesellschaft mit beschränkter Haftung\nErlangen\n\nDen Gläubigern der an der Verschmelzung beteiligten Rechtsträger ist, wenn sie binnen sechs Monaten nach dem Tag, an dem die Eintragung der Verschmelzung in das Register des Sitzes desjenigen Rechtsträgers, dessen Gläubiger sie sind, nach § 19 Abs. 3 UmwG als bekannt gemacht gilt, ihren Anspruch nach Grund und Höhe in Textform anmelden, Sicherheit zu leisten, soweit sie nicht Befriedigung verlangen können. Dieses Recht steht den Gläubigern jedoch nur zu, wenn sie glaubhaft machen, dass durch die Verschmelzung die Erfüllung ihrer Forderung gefährdet wird."
    },
    {
      "date": "2025-02-26",
      "id": "102262",
      "original_text": "Registerbekanntmachung nach dem Umwandlungsgesetz\nBayern Amtsgericht München HRB 249375\nSHL Telemedizin GmbH – München",
      "type": "Registerbekanntmachung nach dem Umwandlungsgesetz",
      "state": "Bayern",
      "amtsgericht": "Amtsgericht München",
      "registernummer": "HRB 249375",
      "registerart": "HRB",
      "company_name": "SHL Telemedizin GmbH",
      "company_seat": "München",
      "details": "26.02.2025 (Bekanntmachungsdatum)\n\nBayern Amtsgericht München HRB 249375\nRegisterbekanntmachung nach dem Umwandlungsgesetz 25.02.2025 (Eintragungsdatum)\n\nSHL Telemedizin GmbH\nGesellschaft mit beschränkter Haftung\nMünchen\n\nDen Gläubigern der an der Verschmelzung beteiligten Rechtsträger ist, wenn sie binnen sechs Monaten nach dem Tag, an dem die Eintragung der Verschmelzung in das Register des Sitzes desjenigen Rechtsträgers, dessen Gläubiger sie sind, nach § 19 Abs. 3 UmwG als bekannt gemacht gilt, ihren Anspruch nach Grund und Höhe in Textform anmelden, Sicherheit zu leisten, soweit sie nicht Befriedigung verlangen können. Dieses Recht steht den Gläubigern jedoch nur zu, wenn sie glaubhaft machen, dass durch die Verschmelzung die Erfüllung ihrer Forderung gefährdet wird."
    },
    {
      "date": "2025-02-26",
      "id": "102263",
      "original_text": "Löschungsankündigung\nBayern Amtsgericht Landshut HRB 9048\nHarley Verleih - Ride Your Dream UG (haftungsbeschränkt) – Reisbach",
      "type": "Löschungsankündigung",
      "state": "Bayern",
      "amtsgericht": "Amtsgericht Landshut",
      "registernummer": "HRB 9048",
      "registerart": "HRB",
      "company_name": "Harley Verleih - Ride Your Dream UG (haftungsbeschränkt)",
      "company_seat": "Reisbach",
      "details": "26.02.2025 (Bekanntmachungsdatum)\n\nBayern Amtsgericht Landshut HRB 9048\nLöschungsankündigung\n\nHarley Verleih - Ride Your Dream UG (haftungsbeschränkt)\nGesellschaft mit beschränkter Haftung\nReisbach\n\nDas Registergericht beabsichtigt, die im Handelsregister eingetragene Gesellschaft wegen Vermögenslosigkeit von Amts wegen nach § 394 FamFG zu löschen. Die Frist zur Erhebung eines Widerspruchs ist auf einen Monat festgesetzt."
    },
    {
      "date": "2025-02-26",
      "id": "102264",
      "original_text": "Einreichung neuer Dokumente\nBayern Amtsgericht Nürnberg HRB 35304\nOnestoptransformation AG – Nürnberg",
      "type": "Einreichung neuer Dokumente",
      "state": "Bayern",
      "amtsgericht": "Amtsgericht Nürnberg",
      "registernummer": "HRB 35304",
      "registerart": "HRB",
      "company_name": "Onestoptransformation AG",
      "company_seat": "Nürnberg",
      "details": "26.02.2025 (Bekanntmachungsdatum)\n\nBayern Amtsgericht Nürnberg HRB 35304\nEinreichung neuer Dokumente 25.02.2025 (Eintragungsdatum)\n\nOnestoptransformation AG\nAktiengesellschaft\nNürnberg\n\nDem Amtsgericht Nürnberg -Registergericht- ist eine Liste der Mitglieder des Aufsichtsrats eingereicht worden, § 106 AktG."
    },
    {
      "date": "2025-02-26",
      "id": "102265",
      "original_text": "Registerbekanntmachung nach dem Umwandlungsgesetz\nBayern Amtsgericht Würzburg HRB 17449\nGIG Verwaltungs-UG (haftungsbeschränkt) – Würzburg",
      "type": "Registerbekanntmachung nach dem Umwandlungsgesetz",
      "state": "Bayern",
      "amtsgericht": "Amtsgericht Würzburg",
      "registernummer": "HRB 17449",
      "registerart": "HRB",
      "company_name": "GIG Verwaltungs-UG (haftungsbeschränkt)",
      "company_seat": "Würzburg",
      "details": "26.02.2025 (Bekanntmachungsdatum)\n\nBayern Amtsgericht Würzburg HRB 17449\nRegisterbekanntmachung nach dem Umwandlungsgesetz 25.02.2025 (Eintragungsdatum)\n\nGIG Verwaltungs-UG (haftungsbeschränkt)\nGesellschaft mit beschränkter Haftung\nWürzburg\n\nDen Gläubigern der an der Verschmelzung beteiligten Rechtsträger ist, wenn sie binnen sechs Monaten nach dem Tag, an dem die Eintragung der Verschmelzung in das Register des Sitzes desjenigen Rechtsträgers, dessen Gläubiger sie sind, nach § 19 Abs. 3 UmwG als bekannt gemacht gilt, ihren Anspruch nach Grund und Höhe in Textform anmelden, Sicherheit zu leisten, soweit sie nicht Befriedigung verlangen können. Dieses Recht steht den Gläubigern jedoch nur zu, wenn sie glaubhaft machen, dass durch die Verschmelzung die Erfüllung ihrer Forderung gefährdet wird."
    },
    {
      "date": "2025-02-26",
      "id": "102266",
      "original_text": "Einreichung neuer Dokumente\nBayern Amtsgericht Traunstein HRB 10963\nWirtschaftsförderungsgesellschaft Burghausen mbH – Burghausen",
      "type": "Einreichung neuer Dokumente",
      "state": "Bayern",
      "amtsgericht": "Amtsgericht Traunstein",
      "registernummer": "HRB 10963",
      "registerart": "HRB",
      "company_name": "Wirtschaftsförderungsgesellschaft Burghausen mbH",
      "company_seat": "Burghausen",
      "details": "26.02.2025 (Bekanntmachungsdatum)\n\nBayern Amtsgericht Traunstein HRB 10963\nEinreichung neuer Dokumente 25.02.2025 (Eintragungsdatum)\n\nWirtschaftsförderungsgesellschaft Burghausen mbH\nGesellschaft mit beschränkter Haftung\nBurghausen\n\nDem Amtsgericht Traunstein -Registergericht- ist eine Liste der Mitglieder des Aufsichtsrats eingereicht worden, § 52 Abs. 3 S. 2 GmbHG."
    },
    {
      "date": "2025-02-26",
      "id": "102267",
      "original_text": "Einreichung neuer Dokumente\nBayern Amtsgericht München HRB 241345\nSiemens Energy Management GmbH – München",
      "type": "Einreichung neuer Dokumente",
      "state": "Bayern",
      "amtsgericht": "Amtsgericht München",
      "registernummer": "HRB 241345",
      "registerart": "HRB",
      "company_name": "Siemens Energy Management GmbH",
      "company_seat": "München",
      "details": "26.02.2025 (Bekanntmachungsdatum)\n\nBayern Amtsgericht München HRB 241345\nEinreichung neuer Dokumente\n\nSiemens Energy Management GmbH\nGesellschaft mit beschränkter Haftung\nMünchen\n\nDem Amtsgericht München -Registergericht- ist eine Liste der Mitglieder des Aufsichtsrats eingereicht worden, § 52 Abs. 3 S. 2 GmbHG."
    },
    {
      "date": "2025-02-26",
      "id": "102268",
      "original_text": "Löschungsankündigung\nBayern Amtsgericht München HRB 198393\nAustralian Immigration Solutions UG (haftungsbeschränkt) – München",
      "type": "Löschungsankündigung",
      "state": "Bayern",
      "amtsgericht": "Amtsgericht München",
      "registernummer": "HRB 198393",
      "registerart": "HRB",
      "company_name": "Australian Immigration Solutions UG (haftungsbeschränkt)",
      "company_seat": "München",
      "details": "26.02.2025 (Bekanntmachungsdatum)\n\nBayern Amtsgericht München HRB 198393\nLöschungsankündigung\n\nAustralian Immigration Solutions UG (haftungsbeschränkt)\nGesellschaft mit beschränkter Haftung\nMünchen\n\nDas Registergericht beabsichtigt, die im Handelsregister eingetragene Gesellschaft wegen Vermögenslosigkeit von Amts wegen nach § 394 FamFG zu löschen. Die Frist zur Erhebung eines Widerspruchs ist auf drei Monate festgesetzt."
    },
    {
      "date": "2025-02-26",
      "id": "102269",
      "original_text": "Löschungsankündigung\nBayern Amtsgericht Landshut HRB 13840\nITT GmbH – Gottfrieding",
      "type": "Löschungsankündigung",
      "state": "Bayern",
      "amtsgericht": "Amtsgericht Landshut",
      "registernummer": "HRB 13840",
      "registerart": "HRB",
      "company_name": "ITT GmbH",
      "company_seat": "Gottfrieding",
      "details": "26.02.2025 (Bekanntmachungsdatum)\n\nBayern Amtsgericht Landshut HRB 13840\nLöschungsankündigung\n\nITT GmbH\nGesellschaft mit beschränkter Haftung\nGottfrieding\n\nDas Registergericht beabsichtigt, die im Handelsregister eingetragene Gesellschaft wegen Vermögenslosigkeit von Amts wegen nach § 394 FamFG zu löschen. Die Frist zur Erhebung eines Widerspruchs ist auf einen Monat festgesetzt."
    },
    {
      "date": "2025-02-26",
      "id": "102270",
      "original_text": "Einreichung neuer Dokumente\nBayern Amtsgericht München HRB 241345\nSiemens Energy Management GmbH – München",
      "type": "Einreichung neuer Dokumente",
      "state": "Bayern",
      "amtsgericht": "Amtsgericht München",
      "registernummer": "HRB 241345",
      "registerart": "HRB",
      "company_name": "Siemens Energy Management GmbH",
      "company_seat": "München",
      "details": "26.02.2025 (Bekanntmachungsdatum)\n\nBayern Amtsgericht München HRB 241345\nEinreichung neuer Dokumente\n\nSiemens Energy Management GmbH\nGesellschaft mit beschränkter Haftung\nMünchen\n\nDem Amtsgericht München -Registergericht- ist eine Liste der Mitglieder des Aufsichtsrats eingereicht worden, § 52 Abs. 3 S. 2 GmbHG."
    },
    {
      "date": "2025-02-26",
      "id": "102271",
      "original_text": "Registerbekanntmachung nach dem Umwandlungsgesetz\nBayern Amtsgericht Würzburg HRB 17437\nJCL Verwaltungs-UG (haftungsbeschränkt) – Würzburg",
      "type": "Registerbekanntmachung nach dem Umwandlungsgesetz",
      "state": "Bayern",
      "amtsgericht": "Amtsgericht Würzburg",
      "registernummer": "HRB 17437",
      "registerart": "HRB",
      "company_name": "JCL Verwaltungs-UG (haftungsbeschränkt)",
      "company_seat": "Würzburg",
      "details": "26.02.2025 (Bekanntmachungsdatum)\n\nBayern Amtsgericht Würzburg HRB 17437\nRegisterbekanntmachung nach dem Umwandlungsgesetz 25.02.2025 (Eintragungsdatum)\n\nJCL Verwaltungs-UG (haftungsbeschränkt)\nGesellschaft mit beschränkter Haftung\nWürzburg\n\nDen Gläubigern der an der Verschmelzung beteiligten Rechtsträger ist, wenn sie binnen sechs Monaten nach dem Tag, an dem die Eintragung der Verschmelzung in das Register des Sitzes desjenigen Rechtsträgers, dessen Gläubiger sie sind, nach § 19 Abs. 3 UmwG als bekannt gemacht gilt, ihren Anspruch nach Grund und Höhe in Textform anmelden, Sicherheit zu leisten, soweit sie nicht Befriedigung verlangen können. Dieses Recht steht den Gläubigern jedoch nur zu, wenn sie glaubhaft machen, dass durch die Verschmelzung die Erfüllung ihrer Forderung gefährdet wird."
    },
    {
      "date": "2025-02-26",
      "id": "102272",
      "original_text": "Löschungsankündigung\nBayern Amtsgericht München HRB 280637\nSDS DE Fünfunddreißig Management GmbH – München",
      "type": "Löschungsankündigung",
      "state": "Bayern",
      "amtsgericht": "Amtsgericht München",
      "registernummer": "HRB 280637",
      "registerart": "HRB",
      "company_name": "SDS DE Fünfunddreißig Management GmbH",
      "company_seat": "München",
      "details": "26.02.2025 (Bekanntmachungsdatum)\n\nBayern Amtsgericht München HRB 280637\nLöschungsankündigung 24.02.2025 (Eintragungsdatum)\n\nSDS DE Fünfunddreißig Management GmbH\nGesellschaft mit beschränkter Haftung\nMünchen\n\nDas Registergericht beabsichtigt, die im Handelsregister eingetragene Gesellschaft wegen Vermögenslosigkeit von Amts wegen nach § 394 FamFG zu löschen. Die Frist zur Erhebung eines Widerspruchs ist auf drei Monate festgesetzt. Das Registergericht beabsichtigt, die im Handelsregister eingetragene Firma von Amts wegen nach § 31 Abs. 2 HGB, § 393 FamFG zu löschen. #insert(Text=\"zztb_V_Widerspruchsfrist\")"
    },
    {
      "date": "2025-02-26",
      "id": "102273",
      "original_text": "Registerbekanntmachung nach dem Umwandlungsgesetz\nBayern Amtsgericht München HRB 196221\nDocuWare Europe GmbH – Germering",
      "type": "Registerbekanntmachung nach dem Umwandlungsgesetz",
      "state": "Bayern",
      "amtsgericht": "Amtsgericht München",
      "registernummer": "HRB 196221",
      "registerart": "HRB",
      "company_name": "DocuWare Europe GmbH",
      "company_seat": "Germering",
      "details": "26.02.2025 (Bekanntmachungsdatum)\n\nBayern Amtsgericht München HRB 196221\nRegisterbekanntmachung nach dem Umwandlungsgesetz 25.02.2025 (Eintragungsdatum)\n\nDocuWare Europe GmbH\nGesellschaft mit beschränkter Haftung\nGermering\n\nDen Gläubigern der an der Verschmelzung beteiligten Rechtsträger ist, wenn sie binnen sechs Monaten nach dem Tag, an dem die Eintragung der Verschmelzung in das Register des Sitzes desjenigen Rechtsträgers, dessen Gläubiger sie sind, nach § 19 Abs. 3 UmwG als bekannt gemacht gilt, ihren Anspruch nach Grund und Höhe in Textform anmelden, Sicherheit zu leisten, soweit sie nicht Befriedigung verlangen können. Dieses Recht steht den Gläubigern jedoch nur zu, wenn sie glaubhaft machen, dass durch die Verschmelzung die Erfüllung ihrer Forderung gefährdet wird."
    },
    {
      "date": "2025-02-26",
      "id": "102274",
      "original_text": "Registerbekanntmachung nach dem Umwandlungsgesetz\nBayern Amtsgericht Schweinfurt HRA 10668\nSchuhmann Vermögensverwaltung GmbH & Co. KG – Bad Brückenau",
      "type": "Registerbekanntmachung nach dem Umwandlungsgesetz",
      "state": "Bayern",
      "amtsgericht": "Amtsgericht Schweinfurt",
      "registernummer": "HRA 10668",
      "registerart": "HRA",
      "company_name": "Schuhmann Vermögensverwaltung GmbH & Co. KG",
      "company_seat": "Bad Brückenau",
      "details": "26.02.2025 (Bekanntmachungsdatum)\n\nBayern Amtsgericht Schweinfurt HRA 10668\nRegisterbekanntmachung nach dem Umwandlungsgesetz 25.02.2025 (Eintragungsdatum)\n\nSchuhmann Vermögensverwaltung GmbH & Co. KG\nKommanditgesellschaft\nBad Brückenau\n\nDen Gläubigern der an der Ausgliederung beteiligten Rechtsträger ist, wenn sie binnen sechs Monaten nach dem Tag, an dem die Eintragung der Ausgliederung in das Register des Sitzes desjenigen Rechtsträgers, dessen Gläubiger sie sind, nach §§ 125, 19 Abs. 3 UmwG als bekannt gemacht gilt, ihren Anspruch nach Grund und Höhe in Textform anmelden, Sicherheit zu leisten, soweit sie nicht Befriedigung verlangen können. Dieses Recht steht den Gläubigern jedoch nur zu, wenn sie glaubhaft machen, dass durch die Ausgliederung die Erfüllung ihrer Forderung gefährdet wird."
    },
    {
      "date": "2025-02-26",
      "id": "102275",
      "original_text": "Registerbekanntmachung nach dem Umwandlungsgesetz\nBayern Amtsgericht Fürth HRB 21023\nContext Translations Nbg GmbH – Seukendorf",
      "type": "Registerbekanntmachung nach dem Umwandlungsgesetz",
      "state": "Bayern",
      "amtsgericht": "Amtsgericht Fürth",
      "registernummer": "HRB 21023",
      "registerart": "HRB",
      "company_name": "Context Translations Nbg GmbH",
      "company_seat": "Seukendorf",
      "details": "26.02.2025 (Bekanntmachungsdatum)\n\nBayern Amtsgericht Fürth HRB 21023\nRegisterbekanntmachung nach dem Umwandlungsgesetz 25.02.2025 (Eintragungsdatum)\n\nContext Translations Nbg GmbH\nGesellschaft mit beschränkter Haftung\nSeukendorf\n\nDen Gläubigern der an der Verschmelzung beteiligten Rechtsträger ist, wenn sie binnen sechs Monaten nach dem Tag, an dem die Eintragung der Verschmelzung in das Register des Sitzes desjenigen Rechtsträgers, dessen Gläubiger sie sind, nach § 19 Abs. 3 UmwG als bekannt gemacht gilt, ihren Anspruch nach Grund und Höhe in Textform anmelden, Sicherheit zu leisten, soweit sie nicht Befriedigung verlangen können. Dieses Recht steht den Gläubigern jedoch nur zu, wenn sie glaubhaft machen, dass durch die Verschmelzung die Erfüllung ihrer Forderung gefährdet wird."
    },
    {
      "date": "2025-02-26",
      "id": "102276",
      "original_text": "Registerbekanntmachung nach dem Umwandlungsgesetz\nBayern Amtsgericht Fürth HRB 17585\nGBI Wohnbau 9 GmbH – Erlangen",
      "type": "Registerbekanntmachung nach dem Umwandlungsgesetz",
      "state": "Bayern",
      "amtsgericht": "Amtsgericht Fürth",
      "registernummer": "HRB 17585",
      "registerart": "HRB",
      "company_name": "GBI Wohnbau 9 GmbH",
      "company_seat": "Erlangen",
      "details": "26.02.2025 (Bekanntmachungsdatum)\n\nBayern Amtsgericht Fürth HRB 17585\nRegisterbekanntmachung nach dem Umwandlungsgesetz 25.02.2025 (Eintragungsdatum)\n\nGBI Wohnbau 9 GmbH\nGesellschaft mit beschränkter Haftung\nErlangen\n\nDen Gläubigern #dv.auswahl(Text=\"Bitte zutreffendes auswählen:\",Eingabe=\n\n\"der an der Verschmelzung beteiligten Rechtsträger ist, wenn sie binnen sechs Monaten nach dem Tag, an dem die Eintragung der Verschmelzung in das Register des Sitzes desjenigen Rechtsträgers, dessen Gläubiger sie sind, nach § 19 Abs. 3 UmwG als bekannt gemacht gilt, ihren Anspruch nach Grund und Höhe in Textform anmelden, Sicherheit zu leisten, soweit sie nicht Befriedigung verlangen können. Dieses Recht steht den Gläubigern jedoch nur zu, wenn sie glaubhaft machen, dass durch die Verschmelzung die Erfüllung ihrer Forderung gefährdet wird.\"|\"Verschmelzung\",\n\n\"der an der Spaltung beteiligten Rechtsträger ist, wenn sie binnen sechs Monaten nach dem Tag, an dem die Eintragung der Spaltung in das Register des Sitzes desjenigen Rechtsträgers, dessen Gläubiger sie sind, nach §§ 125, 19 Abs. 3 UmwG als bekannt gemacht gilt, ihren Anspruch nach Grund und Höhe in Textform anmelden, Sicherheit zu leisten, soweit sie nicht Befriedigung verlangen können. Dieses Recht steht den Gläubigern jedoch nur zu, wenn sie glaubhaft machen, dass durch die Spaltung die Erfüllung ihrer Forderung gefährdet wird.\"|\"Spaltung\",\n\n\"des formwechselnden Rechtsträgers ist, wenn sie binnen sechs Monaten nach dem Tag, an dem die Eintragung des Formwechsels nach § 201 UmwG als bekannt gemacht gilt, ihren Anspruch nach Grund und Höhe in Textform anmelden, Sicherheit zu leisten, soweit sie nicht Befriedigung verlangen können. Dieses Recht steht den Gläubigern jedoch nur zu, wenn sie glaubhaft machen, dass durch den Formwechsel die Erfüllung ihrer Forderung gefährdet wird.\"|\"formwechselnde Umwandlung\",\n\n\"der an der Ausgliederung beteiligten Rechtsträger ist, wenn sie binnen sechs Monaten nach dem Tag, an dem die Eintragung der Ausgliederung in das Register des Sitzes desjenigen Rechtsträgers, dessen Gläubiger sie sind, nach §§ 125, 19 Abs. 3 UmwG als bekannt gemacht gilt, ihren Anspruch nach Grund und Höhe in Textform anmelden, Sicherheit zu leisten, soweit sie nicht Befriedigung verlangen können. Dieses Recht steht den Gläubigern jedoch nur zu, wenn sie glaubhaft machen, dass durch die Ausgliederung die Erfüllung ihrer Forderung gefährdet wird.\"|\"Ausgliederung\")"
    },
    {
      "date": "2025-02-26",
      "id": "102277",
      "original_text": "Registerbekanntmachung nach dem Umwandlungsgesetz\nBayern Amtsgericht Würzburg HRB 16619\nJCL Beteiligungs-GmbH – Würzburg",
      "type": "Registerbekanntmachung nach dem Umwandlungsgesetz",
      "state": "Bayern",
      "amtsgericht": "Amtsgericht Würzburg",
      "registernummer": "HRB 16619",
      "registerart": "HRB",
      "company_name": "JCL Beteiligungs-GmbH",
      "company_seat": "Würzburg",
      "details": "26.02.2025 (Bekanntmachungsdatum)\n\nBayern Amtsgericht Würzburg HRB 16619\nRegisterbekanntmachung nach dem Umwandlungsgesetz 25.02.2025 (Eintragungsdatum)\n\nJCL Beteiligungs-GmbH\nGesellschaft mit beschränkter Haftung\nWürzburg\n\nDen Gläubigern der an der Verschmelzung beteiligten Rechtsträger ist, wenn sie binnen sechs Monaten nach dem Tag, an dem die Eintragung der Verschmelzung in das Register des Sitzes desjenigen Rechtsträgers, dessen Gläubiger sie sind, nach § 19 Abs. 3 UmwG als bekannt gemacht gilt, ihren Anspruch nach Grund und Höhe in Textform anmelden, Sicherheit zu leisten, soweit sie nicht Befriedigung verlangen können. Dieses Recht steht den Gläubigern jedoch nur zu, wenn sie glaubhaft machen, dass durch die Verschmelzung die Erfüllung ihrer Forderung gefährdet wird."
    },
    {
      "date": "2025-02-26",
      "id": "102278",
      "original_text": "Einreichung neuer Dokumente\nBrandenburg Amtsgericht Neuruppin HRB 10009\nWohnungsgesellschaft Oder-Welse GmbH – Schwedt/Oder",
      "type": "Einreichung neuer Dokumente",
      "state": "Brandenburg",
      "amtsgericht": "Amtsgericht Neuruppin",
      "registernummer": "HRB 10009",
      "registerart": "HRB",
      "company_name": "Wohnungsgesellschaft Oder-Welse GmbH",
      "company_seat": "Schwedt/Oder",
      "details": "26.02.2025 (Bekanntmachungsdatum)\n\nBrandenburg Amtsgericht Neuruppin HRB 10009\nEinreichung neuer Dokumente\n\nWohnungsgesellschaft Oder-Welse GmbH\nGesellschaft mit beschränkter Haftung\nSchwedt/Oder\n\nAls nicht eingetragen wird veröffentlicht: Eine Liste der Mitglieder des Aufsichtsrates wurde zum Handelsregister eingereicht."
    },
    {
      "date": "2025-02-26",
      "id": "102279",
      "original_text": "Löschungsankündigung\nBerlin Amtsgericht Berlin (Charlottenburg) HRB 167443\nRoyalstern GmbH – Berlin",
      "type": "Löschungsankündigung",
      "state": "Berlin",
      "amtsgericht": "Amtsgericht Berlin (Charlottenburg)",
      "registernummer": "HRB 167443",
      "registerart": "HRB",
      "company_name": "Royalstern GmbH",
      "company_seat": "Berlin",
      "details": "26.02.2025 (Bekanntmachungsdatum)\n\nBerlin Amtsgericht Berlin (Charlottenburg) HRB 167443\nLöschungsankündigung\n\nRoyalstern GmbH\nGesellschaft mit beschränkter Haftung\nBerlin\n\nBei der nachstehenden Gesellschaft wird das Amtslöschungsverfahren gemäß § 394 FamFG eingeleitet. Widerspruchsfrist 6 Wochen"
    },
    {
      "date": "2025-02-26",
      "id": "102280",
      "original_text": "Löschungsankündigung\nBerlin Amtsgericht Berlin (Charlottenburg) HRB 234446\nTaurus VVG GmbH – Berlin",
      "type": "Löschungsankündigung",
      "state": "Berlin",
      "amtsgericht": "Amtsgericht Berlin (Charlottenburg)",
      "registernummer": "HRB 234446",
      "registerart": "HRB",
      "company_name": "Taurus VVG GmbH",
      "company_seat": "Berlin",
      "details": "26.02.2025 (Bekanntmachungsdatum)\n\nBerlin Amtsgericht Berlin (Charlottenburg) HRB 234446\nLöschungsankündigung\n\nTaurus VVG GmbH\nGesellschaft mit beschränkter Haftung\nBerlin\n\nBei der nachstehenden Gesellschaft wird das Amtslöschungsverfahren gemäß § 394 FamFG eingeleitet. Widerspruchsfrist 6 Wochen"
    },
    {
      "date": "2025-02-26",
      "id": "102281",
      "original_text": "Löschungsankündigung\nBerlin Amtsgericht Berlin (Charlottenburg) HRB 216552\nMI-BO Gebäudeservice GmbH – Berlin",
      "type": "Löschungsankündigung",
      "state": "Berlin",
      "amtsgericht": "Amtsgericht Berlin (Charlottenburg)",
      "registernummer": "HRB 216552",
      "registerart": "HRB",
      "company_name": "MI-BO Gebäudeservice GmbH",
      "company_seat": "Berlin",
      "details": "26.02.2025 (Bekanntmachungsdatum)\n\nBerlin Amtsgericht Berlin (Charlottenburg) HRB 216552\nLöschungsankündigung\n\nMI-BO Gebäudeservice GmbH\nGesellschaft mit beschränkter Haftung\nBerlin\n\nBei der nachstehenden Gesellschaft wird das Amtslöschungsverfahren gemäß § 394 FamFG eingeleitet. Widerspruchsfrist 6 Wochen"
    },
    {
      "date": "2025-02-26",
      "id": "102282",
      "original_text": "Löschungsankündigung\nBerlin Amtsgericht Berlin (Charlottenburg) HRB 244028\nConstructione Optimum GmbH – Berlin",
      "type": "Löschungsankündigung",
      "state": "Berlin",
      "amtsgericht": "Amtsgericht Berlin (Charlottenburg)",
      "registernummer": "HRB 244028",
      "registerart": "HRB",
      "company_name": "Constructione Optimum GmbH",
      "company_seat": "Berlin",
      "details": "26.02.2025 (Bekanntmachungsdatum)\n\nBerlin Amtsgericht Berlin (Charlottenburg) HRB 244028\nLöschungsankündigung\n\nConstructione Optimum GmbH\nGesellschaft mit beschränkter Haftung\nBerlin\n\nBei der nachstehenden Gesellschaft wird das Amtslöschungsverfahren gemäß § 394 FamFG eingeleitet. Widerspruchsfrist 6 Wochen"
    },
    {
      "date": "2025-02-26",
      "id": "102283",
      "original_text": "Registerbekanntmachung nach dem Umwandlungsgesetz\nSaarland Amtsgericht Saarbrücken HRA 13552\nDagmar Bungert Agrar und Landschaftspflege e. Kfr. – Namborn",
      "type": "Registerbekanntmachung nach dem Umwandlungsgesetz",
      "state": "Saarland",
      "amtsgericht": "Amtsgericht Saarbrücken",
      "registernummer": "HRA 13552",
      "registerart": "HRA",
      "company_name": "Dagmar Bungert Agrar und Landschaftspflege e. Kfr.",
      "company_seat": "Namborn",
      "details": "26.02.2025 (Bekanntmachungsdatum)\n\nSaarland Amtsgericht Saarbrücken HRA 13552\nRegisterbekanntmachung nach dem Umwandlungsgesetz 26.02.2025 (Eintragungsdatum)\n\nDagmar Bungert Agrar und Landschaftspflege e. Kfr.\nEinzelkaufmann / Einzelkauffrau\nNamborn\n\nAls nicht eingetragen wird bekannt gemacht: Den Gläubigern der an der Ausgliederung beteiligten Gesellschaften ist, wenn sie binnen sechs Monaten nach dem Tag, an dem die Eintragung der Ausgliederung in das Register des Sitzes derjenigen Rechtsträger deren Gläubiger sie sind, nach § 19 Absatz 3 UmwG bekannt gemacht worden ist, ihren Anspruch nach Grund und Höhe schriftlich anmelden, Sicherheit zu leisten, soweit sie nicht Befriedigung verlangen können. Dieses Recht steht den Gläubigern jedoch nur zu, wenn sie glaubhaft machen, dass durch die Ausgliederung die Erfüllung ihrer Forderung gefährdet wird."
    },
    {
      "date": "2025-02-26",
      "id": "102284",
      "original_text": "Registerbekanntmachung nach dem Umwandlungsgesetz\nBaden-Württemberg Amtsgericht Freiburg HRB 732586\nElmer MSR GmbH – March",
      "type": "Registerbekanntmachung nach dem Umwandlungsgesetz",
      "state": "Baden-Württemberg",
      "amtsgericht": "Amtsgericht Freiburg",
      "registernummer": "HRB 732586",
      "registerart": "HRB",
      "company_name": "Elmer MSR GmbH",
      "company_seat": "March",
      "details": "26.02.2025 (Bekanntmachungsdatum)\n\nBaden-Württemberg Amtsgericht Freiburg HRB 732586\nRegisterbekanntmachung nach dem Umwandlungsgesetz 25.02.2025 (Eintragungsdatum)\n\nElmer MSR GmbH\nGesellschaft mit beschränkter Haftung\nMarch\n\nAls nicht eingetragen wird bekanntgemacht:\nDen Gläubigern der an der Ausgliederung beteiligten Rechtsträger ist, wenn sie binnen sechs Monaten nach dem Tag, an dem die Eintragung der Ausgliederung in das Register des Sitzes desjenigen Rechtsträgers, dessen Gläubiger sie sind, nach § 19 Abs. 3 UmwG als bekanntgemacht gilt, ihren Anspruch nach Grund und Höhe schriftlich anmelden, Sicherheit zu leisten, soweit sie nicht Befriedigung verlangen können. Dieses Recht steht den Gläubigern jedoch nur zu, wenn sie glaubhaft machen, dass durch die Ausgliederung die Erfüllung ihrer Forderung gefährdet wird."
    },
    {
      "date": "2025-02-26",
      "id": "102285",
      "original_text": "Registerbekanntmachung nach dem Umwandlungsgesetz\nBaden-Württemberg Amtsgericht Freiburg HRB 724330\nCOVALEST Holding GmbH – Frickingen",
      "type": "Registerbekanntmachung nach dem Umwandlungsgesetz",
      "state": "Baden-Württemberg",
      "amtsgericht": "Amtsgericht Freiburg",
      "registernummer": "HRB 724330",
      "registerart": "HRB",
      "company_name": "COVALEST Holding GmbH",
      "company_seat": "Frickingen",
      "details": "26.02.2025 (Bekanntmachungsdatum)\n\nBaden-Württemberg Amtsgericht Freiburg HRB 724330\nRegisterbekanntmachung nach dem Umwandlungsgesetz 26.02.2025 (Eintragungsdatum)\n\nCOVALEST Holding GmbH\nGesellschaft mit beschränkter Haftung\nFrickingen\n\nAls nicht eingetragen wird bekanntgemacht:\nDen Gläubigern der an der Abspaltung beteiligten Rechtsträger ist, wenn sie binnen sechs Monaten nach dem Tag, an dem die Eintragung der Abspaltung in das Register des Sitzes desjenigen Rechtsträgers, dessen Gläubiger sie sind, nach § 19 Abs. 3 UmwG als bekanntgemacht gilt, ihren Anspruch nach Grund und Höhe schriftlich anmelden, Sicherheit zu leisten, soweit sie nicht Befriedigung verlangen können. Dieses Recht steht den Gläubigern jedoch nur zu, wenn sie glaubhaft machen, dass durch die Abspaltung die Erfüllung ihrer Forderung gefährdet wird."
    },
    {
      "date": "2025-02-26",
      "id": "102286",
      "original_text": "Einreichung neuer Dokumente\nBaden-Württemberg Amtsgericht Stuttgart HRB 361242\nElringKlinger AG – Dettingen an der Erms",
      "type": "Einreichung neuer Dokumente",
      "state": "Baden-Württemberg",
      "amtsgericht": "Amtsgericht Stuttgart",
      "registernummer": "HRB 361242",
      "registerart": "HRB",
      "company_name": "ElringKlinger AG",
      "company_seat": "Dettingen an der Erms",
      "details": "26.02.2025 (Bekanntmachungsdatum)\n\nBaden-Württemberg Amtsgericht Stuttgart HRB 361242\nEinreichung neuer Dokumente\n\nElringKlinger AG\nAktiengesellschaft\nDettingen an der Erms\n\nDie Gesellschaft hat am 25.02.2025 die Liste über die Zusammensetzung des Aufsichtsrats zum Handelsregister eingereicht."
    },
    {
      "date": "2025-02-26",
      "id": "102287",
      "original_text": "Registerbekanntmachung nach dem Umwandlungsgesetz\nBaden-Württemberg Amtsgericht Mannheim HRB 702971\nSunburn Verwaltungs GmbH – Tauberbischofsheim",
      "type": "Registerbekanntmachung nach dem Umwandlungsgesetz",
      "state": "Baden-Württemberg",
      "amtsgericht": "Amtsgericht Mannheim",
      "registernummer": "HRB 702971",
      "registerart": "HRB",
      "company_name": "Sunburn Verwaltungs GmbH",
      "company_seat": "Tauberbischofsheim",
      "details": "26.02.2025 (Bekanntmachungsdatum)\n\nBaden-Württemberg Amtsgericht Mannheim HRB 702971\nRegisterbekanntmachung nach dem Umwandlungsgesetz 26.02.2025 (Eintragungsdatum)\n\nSunburn Verwaltungs GmbH\nGesellschaft mit beschränkter Haftung\nTauberbischofsheim\n\nAls nicht eingetragen wird bekanntgemacht:Den Gläubigern der an der Verschmelzung beteiligten Rechtsträger ist, wenn sie binnen sechs Monaten nach dem Tag, an dem die Eintragung der Verschmelzung in das Register des Sitzes desjenigen Rechtsträgers, dessen Gläubiger sie sind, nach § 19 Abs. 3 UmwG als bekanntgemacht gilt, ihren Anspruch nach Grund und Höhe schriftlich anmelden, Sicherheit zu leisten, soweit sie nicht Befriedigung verlangen können. Dieses Recht steht den Gläubigern jedoch nur zu, wenn sie glaubhaft machen, dass durch die Verschmelzung die Erfüllung ihrer Forderung gefährdet wird."
    },
    {
      "date": "2025-02-26",
      "id": "102288",
      "original_text": "Löschungsankündigung\nBaden-Württemberg Amtsgericht Mannheim HRB 744790\nMARGINEAN TRANSPORTE UG (haftungsbeschränkt) – Malsch",
      "type": "Löschungsankündigung",
      "state": "Baden-Württemberg",
      "amtsgericht": "Amtsgericht Mannheim",
      "registernummer": "HRB 744790",
      "registerart": "HRB",
      "company_name": "MARGINEAN TRANSPORTE UG (haftungsbeschränkt)",
      "company_seat": "Malsch",
      "details": "26.02.2025 (Bekanntmachungsdatum)\n\nBaden-Württemberg Amtsgericht Mannheim HRB 744790\nLöschungsankündigung\n\nMARGINEAN TRANSPORTE UG (haftungsbeschränkt)\nGesellschaft mit beschränkter Haftung\nMalsch\n\nDas Gericht beabsichtigt, die Gesellschaft wegen Vermögenslosigkeit im Handelsregister von Amts wegen nach § 394 FamFG zu löschen. Die Frist zur Geltendmachung eines Widerspruchs gegen die beabsichtigte Löschung ist auf einen Monat ab Veröffentlichung bestimmt."
    },
    {
      "date": "2025-02-26",
      "id": "102289",
      "original_text": "Löschungsankündigung\nBaden-Württemberg Amtsgericht Mannheim HRA 702675\nBilliger-weltweit.de Ltd & Co KG – Rheinmünster",
      "type": "Löschungsankündigung",
      "state": "Baden-Württemberg",
      "amtsgericht": "Amtsgericht Mannheim",
      "registernummer": "HRA 702675",
      "registerart": "HRA",
      "company_name": "Billiger-weltweit.de Ltd & Co KG",
      "company_seat": "Rheinmünster",
      "details": "26.02.2025 (Bekanntmachungsdatum)\n\nBaden-Württemberg Amtsgericht Mannheim HRA 702675\nLöschungsankündigung\n\nBilliger-weltweit.de Ltd & Co KG\nKommanditgesellschaft\nRheinmünster\n\nDas Gericht beabsichtigt, die Gesellschaft im Handelsregister von Amts wegen nach § 31 Absatz 2 HGB zu löschen. Die Frist zur Geltendmachung eines Widerspruchs gegen die beabsichtigte Löschung ist auf einen Monat ab Veröffentlichung bestimmt."
    },
    {
      "date": "2025-02-26",
      "id": "102290",
      "original_text": "Registerbekanntmachung nach dem Umwandlungsgesetz\nBaden-Württemberg Amtsgericht Mannheim HRB 739707\nGOGA GmbH – Mannheim",
      "type": "Registerbekanntmachung nach dem Umwandlungsgesetz",
      "state": "Baden-Württemberg",
      "amtsgericht": "Amtsgericht Mannheim",
      "registernummer": "HRB 739707",
      "registerart": "HRB",
      "company_name": "GOGA GmbH",
      "company_seat": "Mannheim",
      "details": "26.02.2025 (Bekanntmachungsdatum)\n\nBaden-Württemberg Amtsgericht Mannheim HRB 739707\nRegisterbekanntmachung nach dem Umwandlungsgesetz 26.02.2025 (Eintragungsdatum)\n\nGOGA GmbH\nGesellschaft mit beschränkter Haftung\nMannheim\n\nDen Gläubigern der an der Verschmelzung beteiligten Rechtsträger ist, wenn sie binnen sechs Monaten nach dem Tag, an dem die Eintragung der Verschmelzung in das Register des Sitzes desjenigen Rechtsträgers, dessen Gläubiger sie sind, nach § 19 Abs. 3 UmwG als bekanntgemacht gilt, ihren Anspruch nach Grund und Höhe schriftlich anmelden, Sicherheit zu leisten, soweit sie nicht Befriedigung verlangen können. Dieses Recht steht den Gläubigern jedoch nur zu, wenn sie glaubhaft machen, dass durch die Verschmelzung die Erfüllung ihrer Forderung gefährdet wird."
    },
    {
      "date": "2025-02-26",
      "id": "102291",
      "original_text": "Einreichung neuer Dokumente\nBaden-Württemberg Amtsgericht Freiburg HRB 581544\nHELIOS Spital Überlingen GmbH – Überlingen",
      "type": "Einreichung neuer Dokumente",
      "state": "Baden-Württemberg",
      "amtsgericht": "Amtsgericht Freiburg",
      "registernummer": "HRB 581544",
      "registerart": "HRB",
      "company_name": "HELIOS Spital Überlingen GmbH",
      "company_seat": "Überlingen",
      "details": "26.02.2025 (Bekanntmachungsdatum)\n\nBaden-Württemberg Amtsgericht Freiburg HRB 581544\nEinreichung neuer Dokumente 26.02.2025 (Eintragungsdatum)\n\nHELIOS Spital Überlingen GmbH\nGesellschaft mit beschränkter Haftung\nÜberlingen\n\nAls nicht eingetragen wird bekanntgemacht:\nDie Gesellschaft hat am 25.02.2025 die Liste über die Zusammensetzung des Aufsichtsrats zum Handelsregister eingereicht."
    },
    {
      "date": "2025-02-26",
      "id": "102292",
      "original_text": "Registerbekanntmachung nach dem Umwandlungsgesetz\nBaden-Württemberg Amtsgericht Stuttgart HRB 724999\nMACH Finanzplus GmbH – Stuttgart",
      "type": "Registerbekanntmachung nach dem Umwandlungsgesetz",
      "state": "Baden-Württemberg",
      "amtsgericht": "Amtsgericht Stuttgart",
      "registernummer": "HRB 724999",
      "registerart": "HRB",
      "company_name": "MACH Finanzplus GmbH",
      "company_seat": "Stuttgart",
      "details": "26.02.2025 (Bekanntmachungsdatum)\n\nBaden-Württemberg Amtsgericht Stuttgart HRB 724999\nRegisterbekanntmachung nach dem Umwandlungsgesetz 26.02.2025 (Eintragungsdatum)\n\nMACH Finanzplus GmbH\nGesellschaft mit beschränkter Haftung\nStuttgart\n\nAls nicht eingetragen wird bekanntgemacht:\nDen Gläubigern der an der Verschmelzung beteiligten Rechtsträger ist, wenn sie binnen sechs Monaten nach dem Tag, an dem die Eintragung der Verschmelzung in das Register des Sitzes desjenigen Rechtsträgers, dessen Gläubiger sie sind, nach § 19 Abs. 3 UmwG als bekanntgemacht gilt, ihren Anspruch nach Grund und Höhe schriftlich anmelden, Sicherheit zu leisten, soweit sie nicht Befriedigung verlangen können. Dieses Recht steht den Gläubigern jedoch nur zu, wenn sie glaubhaft machen, dass durch die Verschmelzung die Erfüllung ihrer Forderung gefährdet wird."
    },
    {
      "date": "2025-02-26",
      "id": "102293",
      "original_text": "Registerbekanntmachung nach dem Umwandlungsgesetz\nBaden-Württemberg Amtsgericht Stuttgart HRB 480890\nKern-Liebers International GmbH – Schramberg",
      "type": "Registerbekanntmachung nach dem Umwandlungsgesetz",
      "state": "Baden-Württemberg",
      "amtsgericht": "Amtsgericht Stuttgart",
      "registernummer": "HRB 480890",
      "registerart": "HRB",
      "company_name": "Kern-Liebers International GmbH",
      "company_seat": "Schramberg",
      "details": "26.02.2025 (Bekanntmachungsdatum)\n\nBaden-Württemberg Amtsgericht Stuttgart HRB 480890\nRegisterbekanntmachung nach dem Umwandlungsgesetz 26.02.2025 (Eintragungsdatum)\n\nKern-Liebers International GmbH\nGesellschaft mit beschränkter Haftung\nSchramberg\n\nAls nicht eingetragen wird bekanntgemacht:\nDen Gläubigern der an der Verschmelzung beteiligten Rechtsträger ist, wenn sie binnen sechs Monaten nach dem Tag, an dem die Eintragung der Verschmelzung in das Register des Sitzes desjenigen Rechtsträgers, dessen Gläubiger sie sind, nach § 19 Abs. 3 UmwG als bekanntgemacht gilt, ihren Anspruch nach Grund und Höhe schriftlich anmelden, Sicherheit zu leisten, soweit sie nicht Befriedigung verlangen können. Dieses Recht steht den Gläubigern jedoch nur zu, wenn sie glaubhaft machen, dass durch die Verschmelzung die Erfüllung ihrer Forderung gefährdet wird."
    },
    {
      "date": "2025-02-26",
      "id": "102294",
      "original_text": "Einreichung neuer Dokumente\nBaden-Württemberg Amtsgericht Mannheim HRB 715781\nesentri AG – Ettlingen",
      "type": "Einreichung neuer Dokumente",
      "state": "Baden-Württemberg",
      "amtsgericht": "Amtsgericht Mannheim",
      "registernummer": "HRB 715781",
      "registerart": "HRB",
      "company_name": "esentri AG",
      "company_seat": "Ettlingen",
      "details": "26.02.2025 (Bekanntmachungsdatum)\n\nBaden-Württemberg Amtsgericht Mannheim HRB 715781\nEinreichung neuer Dokumente\n\nesentri AG\nAktiengesellschaft\nEttlingen\n\nDie Gesellschaft hat am 25.02.2025 die Liste über die Zusammensetzung des Aufsichtsrats zum Handelsregister eingereicht."
    },
    {
      "date": "2025-02-26",
      "id": "102295",
      "original_text": "Sonstige Registerbekanntmachung\nSchleswig-Holstein Amtsgericht Lübeck HRA 10748\nColumbia1899 Betriebs- und Handels GmbH & Co. KG – Grömitz",
      "type": "Sonstige Registerbekanntmachung",
      "state": "Schleswig-Holstein",
      "amtsgericht": "Amtsgericht Lübeck",
      "registernummer": "HRA 10748",
      "registerart": "HRA",
      "company_name": "Columbia1899 Betriebs- und Handels GmbH & Co. KG",
      "company_seat": "Grömitz",
      "details": "26.02.2025 (Bekanntmachungsdatum)\n\nSchleswig-Holstein Amtsgericht Lübeck HRA 10748\nSonstige Registerbekanntmachung\n\nColumbia1899 Betriebs- und Handels GmbH & Co. KG\nKommanditgesellschaft\nGrömitz\n\nAls nicht eingetragen wird veröffentlicht:\nAmtsgericht Lübeck, Am Burgfeld 7, 23568 Lübeck\n\nColumbia1899 Betriebs- und Handels\nGmbH & Co. KG\nHerrn Matthias Ottosander als Kommanditist\nHasenkamp 24 a\n23743 Grömitz\n\nUnser Zeichen: HRA 10748 HL\n\nDatum: 24.02.2025\n\nSehr geehrte Damen und Herren,\n\nin der Handelsregistersache der\n\nColumbia1899 Betriebs- und Handels GmbH & Co. KG\n\nergeben sich aus den mir vorliegenden Unterlagen Anhaltspunkte dafür, dass die Gesellschaft vermögenslos ist. Die Komplementärin bereits gelöscht.\n\nIch beabsichtige daher, die Gesellschaft von Amts wegen gemäß §§31 II HGB, 394 IV FamFG zu löschen.\n\nIch bestimme eine Frist von einem Monat zur Geltendmachung eines Widerspruchs gegen die Löschung, § 394 Abs. 4FamFG.\n\nWeiter bitte ich Sie, mir binnen derselben Frist mitzuteilen, ob die genannte Gesellschaft noch Vermögen hat, ggf. welche Vermögensgegenstände sie besitzt, ob die Gesellschaft noch Partei eines noch nicht rechtskräftig abgeschlossenen Rechtsstreits ist oder ob sonst noch eine Abwicklung stattfindet.\n\nNach Fristablauf ohne Widerspruch von Ihnen oder anderer Seite wird die Gesellschaft gelöscht.\n\nMit freundlichen Grüßen\nWolski,\nDipl.-Rechtspflegerin (FH)"
    },
    {
      "date": "2025-02-26",
      "id": "102296",
      "original_text": "Löschungsankündigung\nSchleswig-Holstein Amtsgericht Lübeck HRA 10748\nColumbia1899 Betriebs- und Handels GmbH & Co. KG – Grömitz",
      "type": "Löschungsankündigung",
      "state": "Schleswig-Holstein",
      "amtsgericht": "Amtsgericht Lübeck",
      "registernummer": "HRA 10748",
      "registerart": "HRA",
      "company_name": "Columbia1899 Betriebs- und Handels GmbH & Co. KG",
      "company_seat": "Grömitz",
      "details": "26.02.2025 (Bekanntmachungsdatum)\n\nSchleswig-Holstein Amtsgericht Lübeck HRA 10748\nLöschungsankündigung\n\nColumbia1899 Betriebs- und Handels GmbH & Co. KG\nKommanditgesellschaft\nGrömitz\n\nBei der nachstehenden Firma wird das Amtslöschungsverfahren gemäß § 31 Abs. 2 HGB eingeleitet. Widerspruchfrist: 1 Monat."
    },
    {
      "date": "2025-02-26",
      "id": "102297",
      "original_text": "Löschungsankündigung\nBerlin Amtsgericht Berlin (Charlottenburg) HRB 159079\nDeinBa MalerTeam GmbH – Berlin",
      "type": "Löschungsankündigung",
      "state": "Berlin",
      "amtsgericht": "Amtsgericht Berlin (Charlottenburg)",
      "registernummer": "HRB 159079",
      "registerart": "HRB",
      "company_name": "DeinBa MalerTeam GmbH",
      "company_seat": "Berlin",
      "details": "26.02.2025 (Bekanntmachungsdatum)\n\nBerlin Amtsgericht Berlin (Charlottenburg) HRB 159079\nLöschungsankündigung\n\nDeinBa MalerTeam GmbH\nGesellschaft mit beschränkter Haftung\nBerlin\n\nBei der nachstehenden Gesellschaft wird das Amtslöschungsverfahren gemäß § 394 FamFG eingeleitet. Widerspruchsfrist 6 Wochen"
    },
    {
      "date": "2025-02-26",
      "id": "102298",
      "original_text": "Löschungsankündigung\nSchleswig-Holstein Amtsgericht Lübeck HRA 9163\nColumbia1899 GmbH + Co. KG – Grömitz",
      "type": "Löschungsankündigung",
      "state": "Schleswig-Holstein",
      "amtsgericht": "Amtsgericht Lübeck",
      "registernummer": "HRA 9163",
      "registerart": "HRA",
      "company_name": "Columbia1899 GmbH + Co. KG",
      "company_seat": "Grömitz",
      "details": "26.02.2025 (Bekanntmachungsdatum)\n\nSchleswig-Holstein Amtsgericht Lübeck HRA 9163\nLöschungsankündigung\n\nColumbia1899 GmbH + Co. KG\nKommanditgesellschaft\nGrömitz\n\nWird anliegendes Schreiben an die Gesellschaft veröffentlicht:\n\nSehr geehrte Damen und Herren,\n\nin der Handelsregistersache der\nColumbia1899 GmbH + Co. KG\n\nergeben sich aus den mir vorliegenden Unterlagen Anhaltspunkte dafür, dass die Gesellschaft, als deren Geschäftsführer Sie noch eingetragen sind, vermögenslos ist:\n\nDurch rechtskräftigen Beschluss des Amtsgerichts Eutin vom 28.02.2024 wurde das Insolvenzverfahren mangels Masse abgewiesen.\n\nIch beabsichtige daher, die Gesellschaft wegen Vermögenslosigkeit gemäß § 394 FamFG zu löschen.\n\nIch bestimme eine Frist von einem Monat zur Geltendmachung eines Widerspruchs gegen die Löschung, § 394 Abs. 2 S. 1 FamFG.\n\nWeiter bitte ich Sie, mir binnen derselben Frist mitzuteilen, ob die genannte Gesellschaft noch Vermögen hat, ggf. welche Vermögensgegenstände sie besitzt, ob die Gesellschaft noch Partei eines noch nicht rechtskräftig abgeschlossenen Rechtsstreits ist oder ob sonst noch eine Abwicklung stattfindet.\n\nNach Fristablauf ohne Widerspruch von Ihnen oder anderer Seite wird die Gesellschaft gelöscht.\n\nMit freundlichen Grüßen\n\nGärtner\nDipl.-Rechtspflegerin (FH)"
    },
    {
      "date": "2025-02-26",
      "id": "102299",
      "original_text": "Löschungsankündigung\nBerlin Amtsgericht Berlin (Charlottenburg) HRA 33441\nRadde Grundbesitz GmbH & Co. KG – Berlin",
      "type": "Löschungsankündigung",
      "state": "Berlin",
      "amtsgericht": "Amtsgericht Berlin (Charlottenburg)",
      "registernummer": "HRA 33441",
      "registerart": "HRA",
      "company_name": "Radde Grundbesitz GmbH & Co. KG",
      "company_seat": "Berlin",
      "details": "26.02.2025 (Bekanntmachungsdatum)\n\nBerlin Amtsgericht Berlin (Charlottenburg) HRA 33441\nLöschungsankündigung\n\nRadde Grundbesitz GmbH & Co. KG\nKommanditgesellschaft\nBerlin\n\nBei der nachstehenden Gesellschaft wird das Amtslöschungsverfahren gemäß § 394 FamFG eingeleitet. Widerspruchsfrist 6 Wochen"
    },
    {
      "date": "2025-02-26",
      "id": "102300",
      "original_text": "Registerbekanntmachung nach dem Umwandlungsgesetz\nBaden-Württemberg Amtsgericht Mannheim HRA 332108\nJohannes Janssen, Sanitär+Heizung e.K. Inhaber: Wolfgang Wurster – Heidelberg",
      "type": "Registerbekanntmachung nach dem Umwandlungsgesetz",
      "state": "Baden-Württemberg",
      "amtsgericht": "Amtsgericht Mannheim",
      "registernummer": "HRA 332108",
      "registerart": "HRA",
      "company_name": "Johannes Janssen, Sanitär+Heizung e.K. Inhaber: Wolfgang Wurster",
      "company_seat": "Heidelberg",
      "details": "26.02.2025 (Bekanntmachungsdatum)\n\nBaden-Württemberg Amtsgericht Mannheim HRA 332108\nRegisterbekanntmachung nach dem Umwandlungsgesetz 26.02.2025 (Eintragungsdatum)\n\nJohannes Janssen, Sanitär+Heizung e.K. Inhaber: Wolfgang Wurster\nEinzelkaufmann / Einzelkauffrau\nHeidelberg\n\nDen Gläubigern der an der Ausgliederung beteiligten Rechtsträger ist, wenn sie binnen sechs Monaten nach dem Tag, an dem die Eintragung der Ausgliederung in das Register des Sitzes desjenigen Rechtsträgers, dessen Gläubiger sie sind, nach § 19 Abs. 3 UmwG als bekanntgemacht gilt, ihren Anspruch nach Grund und Höhe schriftlich anmelden, Sicherheit zu leisten, soweit sie nicht Befriedigung verlangen können. Dieses Recht steht den Gläubigern jedoch nur zu, wenn sie glaubhaft machen, dass durch die Ausgliederung die Erfüllung ihrer Forderung gefährdet wird."
    },
    {
      "date": "2025-02-26",
      "id": "102301",
      "original_text": "Registerbekanntmachung nach dem Umwandlungsgesetz\nNordrhein-Westfalen Amtsgericht Coesfeld HRB 20613\nWILA Immobilien GmbH – Havixbeck",
      "type": "Registerbekanntmachung nach dem Umwandlungsgesetz",
      "state": "Nordrhein-Westfalen",
      "amtsgericht": "Amtsgericht Coesfeld",
      "registernummer": "HRB 20613",
      "registerart": "HRB",
      "company_name": "WILA Immobilien GmbH",
      "company_seat": "Havixbeck",
      "details": "26.02.2025 (Bekanntmachungsdatum)\n\nNordrhein-Westfalen Amtsgericht Coesfeld HRB 20613\nRegisterbekanntmachung nach dem Umwandlungsgesetz 26.02.2025 (Eintragungsdatum)\n\nWILA Immobilien GmbH\nGesellschaft mit beschränkter Haftung\nHavixbeck\n\nDen Gläubigern des an dem Formwechsel beteiligten Rechtsträgers ist, wenn sie binnen sechs Monaten nach dem Tag, an dem die Eintragung des Formwechsels in das Register des Sitzes derjenigen Rechtsträger deren Gläubiger sie sind, nach § 19 Absatz 3 UmwG als bekanntgemacht gilt, ihren Anspruch nach Grund und Höhe schriftlich anmelden, Sicherheit zu leisten, soweit sie nicht Befriedigung verlangen können. Dieses Recht steht den Gläubigern jedoch nur zu, wenn sie glaubhaft machen, dass durch den Formwechsel die Erfüllung ihrer Forderung gefährdet wird."
    },
    {
      "date": "2025-02-26",
      "id": "102302",
      "original_text": "Löschungsankündigung\nMecklenburg-Vorpommern Amtsgericht Stralsund HRB 4737\nKoSu GmbH – Bandelin",
      "type": "Löschungsankündigung",
      "state": "Mecklenburg-Vorpommern",
      "amtsgericht": "Amtsgericht Stralsund",
      "registernummer": "HRB 4737",
      "registerart": "HRB",
      "company_name": "KoSu GmbH",
      "company_seat": "Bandelin",
      "details": "26.02.2025 (Bekanntmachungsdatum)\n\nMecklenburg-Vorpommern Amtsgericht Stralsund HRB 4737\nLöschungsankündigung\n\nKoSu GmbH\nGesellschaft mit beschränkter Haftung\nBandelin\n\nDas Registergericht beabsichtigt, die im Handelsregister eingetragene Gesellschaft von Amts wegen nach § 394 FamFG zu löschen. Die Frist zur Erhebung eines Widerspruchs gegen die beabsichtigte Löschung wird auf 1 Monat festgesetzt."
    },
    {
      "date": "2025-02-26",
      "id": "102303",
      "original_text": "Löschungsankündigung\nBrandenburg Amtsgericht Potsdam HRB 38638\nACDBS Cybersecurity DE GmbH – Beelitz",
      "type": "Löschungsankündigung",
      "state": "Brandenburg",
      "amtsgericht": "Amtsgericht Potsdam",
      "registernummer": "HRB 38638",
      "registerart": "HRB",
      "company_name": "ACDBS Cybersecurity DE GmbH",
      "company_seat": "Beelitz",
      "details": "26.02.2025 (Bekanntmachungsdatum)\n\nBrandenburg Amtsgericht Potsdam HRB 38638\nLöschungsankündigung\n\nACDBS Cybersecurity DE GmbH\nGesellschaft mit beschränkter Haftung\nBeelitz\n\nBei der nachstehenden Gesellschaft wird das Amtslöschungsverfahren gemäß § 394 FamFG eingeleitet. Widerspruchsfrist: 8 Wochen"
    },
    {
      "date": "2025-02-26",
      "id": "102304",
      "original_text": "Einreichung neuer Dokumente\nBaden-Württemberg Amtsgericht Stuttgart HRB 262636\nStadtwerke Waiblingen GmbH – Waiblingen",
      "type": "Einreichung neuer Dokumente",
      "state": "Baden-Württemberg",
      "amtsgericht": "Amtsgericht Stuttgart",
      "registernummer": "HRB 262636",
      "registerart": "HRB",
      "company_name": "Stadtwerke Waiblingen GmbH",
      "company_seat": "Waiblingen",
      "details": "26.02.2025 (Bekanntmachungsdatum)\n\nBaden-Württemberg Amtsgericht Stuttgart HRB 262636\nEinreichung neuer Dokumente\n\nStadtwerke Waiblingen GmbH\nGesellschaft mit beschränkter Haftung\nWaiblingen\n\nDie Gesellschaft hat am 11.02.2025 die Liste über die Zusammensetzung des Aufsichtsrats zum Handelsregister eingereicht."
    },
    {
      "date": "2025-02-26",
      "id": "102305",
      "original_text": "Einreichung neuer Dokumente\nBerlin Amtsgericht Berlin (Charlottenburg) HRB 34997\nBERLIN-CHEMIE Aktiengesellschaft – Berlin",
      "type": "Einreichung neuer Dokumente",
      "state": "Berlin",
      "amtsgericht": "Amtsgericht Berlin (Charlottenburg)",
      "registernummer": "HRB 34997",
      "registerart": "HRB",
      "company_name": "BERLIN-CHEMIE Aktiengesellschaft",
      "company_seat": "Berlin",
      "details": "26.02.2025 (Bekanntmachungsdatum)\n\nBerlin Amtsgericht Berlin (Charlottenburg) HRB 34997\nEinreichung neuer Dokumente\n\nBERLIN-CHEMIE Aktiengesellschaft\nAktiengesellschaft\nBerlin\n\nAls nicht eingetragen wird veröffentlicht: Es wurde eine neue Liste der Aufsichtsratsmitglieder eingereicht (§ 106 AktG)."
    },
    {
      "date": "2025-02-26",
      "id": "102306",
      "original_text": "Löschungsankündigung\nBrandenburg Amtsgericht Frankfurt/Oder HRB 15312\nProVerve Concept UG (haftungsbeschränkt) – Wandlitz",
      "type": "Löschungsankündigung",
      "state": "Brandenburg",
      "amtsgericht": "Amtsgericht Frankfurt/Oder",
      "registernummer": "HRB 15312",
      "registerart": "HRB",
      "company_name": "ProVerve Concept UG (haftungsbeschränkt)",
      "company_seat": "Wandlitz",
      "details": "26.02.2025 (Bekanntmachungsdatum)\n\nBrandenburg Amtsgericht Frankfurt/Oder HRB 15312\nLöschungsankündigung\n\nProVerve Concept UG (haftungsbeschränkt)\nGesellschaft mit beschränkter Haftung\nWandlitz\n\nBei der nachstehenden Gesellschaft wird das Amtslöschungsverfahren gemäß § 394 FamFG eingeleitet."
    },
    {
      "date": "2025-02-26",
      "id": "102307",
      "original_text": "Löschungsankündigung\nBrandenburg Amtsgericht Potsdam HRB 31630\nB & P Bauunternehmen GmbH – Kloster Lehnin",
      "type": "Löschungsankündigung",
      "state": "Brandenburg",
      "amtsgericht": "Amtsgericht Potsdam",
      "registernummer": "HRB 31630",
      "registerart": "HRB",
      "company_name": "B & P Bauunternehmen GmbH",
      "company_seat": "Kloster Lehnin",
      "details": "26.02.2025 (Bekanntmachungsdatum)\n\nBrandenburg Amtsgericht Potsdam HRB 31630\nLöschungsankündigung\n\nB & P Bauunternehmen GmbH\nGesellschaft mit beschränkter Haftung\nKloster Lehnin\n\nBei der nachstehenden Gesellschaft wird das Amtslöschungsverfahren gemäß § 394 FamFG eingeleitet. Widerspruchsfrist: 8 Wochen."
    },
    {
      "date": "2025-02-26",
      "id": "102308",
      "original_text": "Löschungsankündigung\nBerlin Amtsgericht Berlin (Charlottenburg) HRB 97866\ncenthaus-GmbH – Berlin",
      "type": "Löschungsankündigung",
      "state": "Berlin",
      "amtsgericht": "Amtsgericht Berlin (Charlottenburg)",
      "registernummer": "HRB 97866",
      "registerart": "HRB",
      "company_name": "centhaus-GmbH",
      "company_seat": "Berlin",
      "details": "26.02.2025 (Bekanntmachungsdatum)\n\nBerlin Amtsgericht Berlin (Charlottenburg) HRB 97866\nLöschungsankündigung\n\ncenthaus-GmbH\nGesellschaft mit beschränkter Haftung\nBerlin\n\nBei der nachstehenden Gesellschaft wird das Amtslöschungsverfahren gemäß § 394 FamFG eingeleitet. Widerspruchsfrist 6 Wochen"
    },
    {
      "date": "2025-02-26",
      "id": "102309",
      "original_text": "Löschungsankündigung\nBerlin Amtsgericht Berlin (Charlottenburg) HRB 143737\nAveon KV-Optimierungs GmbH – Berlin",
      "type": "Löschungsankündigung",
      "state": "Berlin",
      "amtsgericht": "Amtsgericht Berlin (Charlottenburg)",
      "registernummer": "HRB 143737",
      "registerart": "HRB",
      "company_name": "Aveon KV-Optimierungs GmbH",
      "company_seat": "Berlin",
      "details": "26.02.2025 (Bekanntmachungsdatum)\n\nBerlin Amtsgericht Berlin (Charlottenburg) HRB 143737\nLöschungsankündigung\n\nAveon KV-Optimierungs GmbH\nGesellschaft mit beschränkter Haftung\nBerlin\n\nBei der nachstehenden Gesellschaft wird das Amtslöschungsverfahren gemäß § 394 FamFG eingeleitet. Widerspruchsfrist 6 Wochen"
    },
    {
      "date": "2025-02-26",
      "id": "102310",
      "original_text": "Löschungsankündigung\nBerlin Amtsgericht Berlin (Charlottenburg) HRB 212864\nKISSINGER TRAVEL CORPORATION (DEUTSCHLAND) GMBH – Berlin",
      "type": "Löschungsankündigung",
      "state": "Berlin",
      "amtsgericht": "Amtsgericht Berlin (Charlottenburg)",
      "registernummer": "HRB 212864",
      "registerart": "HRB",
      "company_name": "KISSINGER TRAVEL CORPORATION (DEUTSCHLAND) GMBH",
      "company_seat": "Berlin",
      "details": "26.02.2025 (Bekanntmachungsdatum)\n\nBerlin Amtsgericht Berlin (Charlottenburg) HRB 212864\nLöschungsankündigung\n\nKISSINGER TRAVEL CORPORATION (DEUTSCHLAND) GMBH\nGesellschaft mit beschränkter Haftung\nBerlin\n\nBei der nachstehenden Gesellschaft wird das Amtslöschungsverfahren gemäß § 394 FamFG eingeleitet. Widerspruchsfrist 6 Wochen"
    },
    {
      "date": "2025-02-26",
      "id": "102311",
      "original_text": "Löschungsankündigung\nBerlin Amtsgericht Berlin (Charlottenburg) HRB 185965\nARES Trockenbau GmbH – Berlin",
      "type": "Löschungsankündigung",
      "state": "Berlin",
      "amtsgericht": "Amtsgericht Berlin (Charlottenburg)",
      "registernummer": "HRB 185965",
      "registerart": "HRB",
      "company_name": "ARES Trockenbau GmbH",
      "company_seat": "Berlin",
      "details": "26.02.2025 (Bekanntmachungsdatum)\n\nBerlin Amtsgericht Berlin (Charlottenburg) HRB 185965\nLöschungsankündigung\n\nARES Trockenbau GmbH\nGesellschaft mit beschränkter Haftung\nBerlin\n\nBei der nachstehenden Gesellschaft wird das Amtslöschungsverfahren gemäß § 394 FamFG eingeleitet. Widerspruchsfrist 6 Wochen"
    },
    {
      "date": "2025-02-26",
      "id": "102312",
      "original_text": "Registerbekanntmachung nach dem Umwandlungsgesetz\nBerlin Amtsgericht Berlin (Charlottenburg) HRB 163774\nSuhrkamp Verlag AG – Berlin",
      "type": "Registerbekanntmachung nach dem Umwandlungsgesetz",
      "state": "Berlin",
      "amtsgericht": "Amtsgericht Berlin (Charlottenburg)",
      "registernummer": "HRB 163774",
      "registerart": "HRB",
      "company_name": "Suhrkamp Verlag AG",
      "company_seat": "Berlin",
      "details": "26.02.2025 (Bekanntmachungsdatum)\n\nBerlin Amtsgericht Berlin (Charlottenburg) HRB 163774\nRegisterbekanntmachung nach dem Umwandlungsgesetz 21.02.2025 (Eintragungsdatum)\n\nSuhrkamp Verlag AG\nAktiengesellschaft\nBerlin\n\nZu Eintragungsnummer 16 vom 21.02.2025 wird als nicht eingetragen veröffentlicht:  Den Gläubigern ist, wenn sie binnen sechs Monaten nach dem Tag, an dem die Eintragung der Umwandlung als bekannt gemacht gilt, ihren Anspruch nach Grund und Höhe schriftlich anmelden, Sicherheit zu leisten, soweit sie nicht Befriedigung verlangen können. Dieses Recht steht den Gläubigern jedoch nur zu, wenn sie glaubhaft machen, dass durch die Umwandlung die Erfüllung ihrer Forderung gefährdet wird. Das Recht, Sicherheitsleistung zu verlangen, steht Gläubigern nicht zu, die im Falle der Insolvenz ein Recht auf vorzugsweise Befriedigung aus einer Deckungsmasse haben, die nach gesetzlicher Vorschrift zu ihrem Schutz errichtet und staatlich überwacht ist."
    },
    {
      "date": "2025-02-26",
      "id": "102313",
      "original_text": "Sonstige Registerbekanntmachung\nThüringen Amtsgericht Eisenach VR 311066\nSallmannshäuser Heimatverein – Gerstungen",
      "type": "Sonstige Registerbekanntmachung",
      "state": "Thüringen",
      "amtsgericht": "Amtsgericht Eisenach",
      "registernummer": "VR 311066",
      "registerart": "VR",
      "company_name": "Sallmannshäuser Heimatverein",
      "company_seat": "Gerstungen",
      "details": "26.02.2025 (Bekanntmachungsdatum)\n\nThüringen Amtsgericht Eisenach VR 311066\nSonstige Registerbekanntmachung 26.02.2025 (Eintragungsdatum)\n\nSallmannshäuser Heimatverein\neingetragener Verein\nGerstungen\n\nSallmannshäuser Heimatverein, Sitz Gerstungen, gegründet am 10.11. 2024."
    },
    {
      "date": "2025-02-26",
      "id": "102314",
      "original_text": "Registerbekanntmachung nach dem Umwandlungsgesetz\nThüringen Amtsgericht Jena GsR 326\nV+S Ingenieurgesellschaft Kette, Haubert eGbR – Erfurt",
      "type": "Registerbekanntmachung nach dem Umwandlungsgesetz",
      "state": "Thüringen",
      "amtsgericht": "Amtsgericht Jena",
      "registernummer": "GsR 326",
      "registerart": "GsR",
      "company_name": "V+S Ingenieurgesellschaft Kette, Haubert eGbR",
      "company_seat": "Erfurt",
      "details": "26.02.2025 (Bekanntmachungsdatum)\n\nThüringen Amtsgericht Jena GsR 326\nRegisterbekanntmachung nach dem Umwandlungsgesetz 26.02.2025 (Eintragungsdatum)\n\nV+S Ingenieurgesellschaft Kette, Haubert eGbR\nGesellschaft bürgerlichen Rechts\nErfurt\n\nNicht eingetragen: Den Gläubigern des formwechselnden  Rechtsträgers, ist wenn sie binnen sechs Monaten nach dem Tag, an dem die Eintragung des Formwechsels nach § 201 UmwG als bekanntgemacht gilt, ihren Anspruch nach Grund und Höhe schriftlich anmelden, Sicherheit zu leisten, soweit sie nicht Befriedigung verlangen können. Dieses Recht steht ihnen jedoch nur zu, wenn sie glaubhaft machen, daß durch den Formwechsel die Erfüllung ihrer Forderung gefährdet wird."
    },
    {
      "date": "2025-02-26",
      "id": "102315",
      "original_text": "Löschungsankündigung\nThüringen Amtsgericht Jena HRB 507732\nRe-Power-Fuel UG (haftungsbeschränkt) – Südeichsfeld",
      "type": "Löschungsankündigung",
      "state": "Thüringen",
      "amtsgericht": "Amtsgericht Jena",
      "registernummer": "HRB 507732",
      "registerart": "HRB",
      "company_name": "Re-Power-Fuel UG (haftungsbeschränkt)",
      "company_seat": "Südeichsfeld",
      "details": "26.02.2025 (Bekanntmachungsdatum)\n\nThüringen Amtsgericht Jena HRB 507732\nLöschungsankündigung\n\nRe-Power-Fuel UG (haftungsbeschränkt)\nGesellschaft mit beschränkter Haftung\nSüdeichsfeld\n\nDas Registergericht beabsichtigt, die im Handelsregister eingetragene Gesellschaft wegen Vermögenslosigkeit nach § 394 FamFG von Amts wegen zu löschen. Die Frist zur Erhebung eines Widerspruchs gegen die beabsichtigte Löschung wird auf 6 Wochen festgesetzt."
    },
    {
      "date": "2025-02-26",
      "id": "102316",
      "original_text": "Löschungsankündigung\nSchleswig-Holstein Amtsgericht Flensburg HRB 12755\nit´s All Classic GmbH – Harrislee",
      "type": "Löschungsankündigung",
      "state": "Schleswig-Holstein",
      "amtsgericht": "Amtsgericht Flensburg",
      "registernummer": "HRB 12755",
      "registerart": "HRB",
      "company_name": "it´s All Classic GmbH",
      "company_seat": "Harrislee",
      "details": "26.02.2025 (Bekanntmachungsdatum)\n\nSchleswig-Holstein Amtsgericht Flensburg HRB 12755\nLöschungsankündigung\n\nit´s All Classic GmbH\nGesellschaft mit beschränkter Haftung\nHarrislee\n\nEs ist die Löschung der nachstehenden Gesellschaft wegen Vermögenslosigkeit gemäß § 394 FamFG beabsichtigt.\nWiderspruchsfrist: 2 Monate."
    },
    {
      "date": "2025-02-26",
      "id": "102317",
      "original_text": "Löschungsankündigung\nBrandenburg Amtsgericht Neuruppin HRB 8385\nFahrenheit GmbH – Perleberg",
      "type": "Löschungsankündigung",
      "state": "Brandenburg",
      "amtsgericht": "Amtsgericht Neuruppin",
      "registernummer": "HRB 8385",
      "registerart": "HRB",
      "company_name": "Fahrenheit GmbH",
      "company_seat": "Perleberg",
      "details": "26.02.2025 (Bekanntmachungsdatum)\n\nBrandenburg Amtsgericht Neuruppin HRB 8385\nLöschungsankündigung\n\nFahrenheit GmbH\nGesellschaft mit beschränkter Haftung\nPerleberg\n\nBei der nachstehenden Gesellschaft wird das Amtslöschungsverfahren gemäß § 394 FamFG eingeleitet.\nWiderspruchsfrist: 1 Monat"
    },
    {
      "date": "2025-02-26",
      "id": "102318",
      "original_text": "Registerbekanntmachung nach dem Umwandlungsgesetz\nBerlin Amtsgericht Berlin (Charlottenburg) HRB 272479\nSuhrkamp Verlag GmbH – Berlin",
      "type": "Registerbekanntmachung nach dem Umwandlungsgesetz",
      "state": "Berlin",
      "amtsgericht": "Amtsgericht Berlin (Charlottenburg)",
      "registernummer": "HRB 272479",
      "registerart": "HRB",
      "company_name": "Suhrkamp Verlag GmbH",
      "company_seat": "Berlin",
      "details": "26.02.2025 (Bekanntmachungsdatum)\n\nBerlin Amtsgericht Berlin (Charlottenburg) HRB 272479\nRegisterbekanntmachung nach dem Umwandlungsgesetz 21.02.2025 (Eintragungsdatum)\n\nSuhrkamp Verlag GmbH\nGesellschaft mit beschränkter Haftung\nBerlin\n\nZu Eintragungsnummer 1 vom 21.02.2025 wird als nicht eingetragen veröffentlicht:  Den Gläubigern ist, wenn sie binnen sechs Monaten nach dem Tag, an dem die Eintragung der Umwandlung als bekannt gemacht gilt, ihren Anspruch nach Grund und Höhe schriftlich anmelden, Sicherheit zu leisten, soweit sie nicht Befriedigung verlangen können. Dieses Recht steht den Gläubigern jedoch nur zu, wenn sie glaubhaft machen, dass durch die Umwandlung die Erfüllung ihrer Forderung gefährdet wird. Das Recht, Sicherheitsleistung zu verlangen, steht Gläubigern nicht zu, die im Falle der Insolvenz ein Recht auf vorzugsweise Befriedigung aus einer Deckungsmasse haben, die nach gesetzlicher Vorschrift zu ihrem Schutz errichtet und staatlich überwacht ist."
    },
    {
      "date": "2025-02-26",
      "id": "102319",
      "original_text": "Einreichung neuer Dokumente\nSchleswig-Holstein Amtsgericht Kiel HRB 1210 NO\nEntwicklungsgesellschaft Norderstedt mbH – Norderstedt",
      "type": "Einreichung neuer Dokumente",
      "state": "Schleswig-Holstein",
      "amtsgericht": "Amtsgericht Kiel",
      "registernummer": "HRB 1210 NO",
      "registerart": "HRB",
      "company_name": "Entwicklungsgesellschaft Norderstedt mbH",
      "company_seat": "Norderstedt",
      "details": "26.02.2025 (Bekanntmachungsdatum)\n\nSchleswig-Holstein Amtsgericht Kiel HRB 1210 NO\nEinreichung neuer Dokumente\n\nEntwicklungsgesellschaft Norderstedt mbH\nGesellschaft mit beschränkter Haftung\nNorderstedt\n\nEine neue Liste der Aufsichtsratsmitglieder ist eingereicht worden."
    },
    {
      "date": "2025-02-26",
      "id": "102320",
      "original_text": "Löschungsankündigung\nSchleswig-Holstein Amtsgericht Flensburg HRB 7572\nZITTI HOPPERS Dienstleistungsgesellschaft mbH – Osterhever",
      "type": "Löschungsankündigung",
      "state": "Schleswig-Holstein",
      "amtsgericht": "Amtsgericht Flensburg",
      "registernummer": "HRB 7572",
      "registerart": "HRB",
      "company_name": "ZITTI HOPPERS Dienstleistungsgesellschaft mbH",
      "company_seat": "Osterhever",
      "details": "26.02.2025 (Bekanntmachungsdatum)\n\nSchleswig-Holstein Amtsgericht Flensburg HRB 7572\nLöschungsankündigung\n\nZITTI HOPPERS Dienstleistungsgesellschaft mbH\nGesellschaft mit beschränkter Haftung\nOsterhever\n\nEs ist die Löschung der nachstehenden Gesellschaft wegen Vermögenslosigkeit gemäß § 394 FamFG beabsichtigt.\nWiderspruchsfrist: 2 Monate."
    },
    {
      "date": "2025-02-26",
      "id": "102321",
      "original_text": "Einreichung neuer Dokumente\nBaden-Württemberg Amtsgericht Freiburg HRB 716673\nHubert Burda Media Holding Geschäftsführung SE – Offenburg",
      "type": "Einreichung neuer Dokumente",
      "state": "Baden-Württemberg",
      "amtsgericht": "Amtsgericht Freiburg",
      "registernummer": "HRB 716673",
      "registerart": "HRB",
      "company_name": "Hubert Burda Media Holding Geschäftsführung SE",
      "company_seat": "Offenburg",
      "details": "26.02.2025 (Bekanntmachungsdatum)\n\nBaden-Württemberg Amtsgericht Freiburg HRB 716673\nEinreichung neuer Dokumente\n\nHubert Burda Media Holding Geschäftsführung SE\nEuropäische Aktiengesellschaft (SE)\nOffenburg\n\nDie Gesellschaft hat am 17.02.2025 die Liste über die Zusammensetzung des Aufsichtsrats zum Handelsregister eingereicht."
    },
    {
      "date": "2025-02-26",
      "id": "102322",
      "original_text": "Registerbekanntmachung nach dem Umwandlungsgesetz\nNordrhein-Westfalen Amtsgericht Coesfeld HRB 10096\nTLC Studio GmbH – Velen",
      "type": "Registerbekanntmachung nach dem Umwandlungsgesetz",
      "state": "Nordrhein-Westfalen",
      "amtsgericht": "Amtsgericht Coesfeld",
      "registernummer": "HRB 10096",
      "registerart": "HRB",
      "company_name": "TLC Studio GmbH",
      "company_seat": "Velen",
      "details": "26.02.2025 (Bekanntmachungsdatum)\n\nNordrhein-Westfalen Amtsgericht Coesfeld HRB 10096\nRegisterbekanntmachung nach dem Umwandlungsgesetz 26.02.2025 (Eintragungsdatum)\n\nTLC Studio GmbH\nGesellschaft mit beschränkter Haftung\nVelen\n\nDen Gläubigern der an der Verschmelzung beteiligten Rechtsträger ist, wenn sie binnen sechs Monaten nach dem Tag, an dem die Eintragung der Verschmelzung in das Register des Sitzes derjenigen Rechtsträger deren Gläubiger sie sind, nach § 19 Absatz 3 UmwG als bekanntgemacht gilt, ihren Anspruch nach Grund und Höhe schriftlich anmelden, Sicherheit zu leisten, soweit sie nicht Befriedigung verlangen können. Dieses Recht steht den Gläubigern jedoch nur zu, wenn sie glaubhaft machen, dass durch die Verschmelzung die Erfüllung ihrer Forderung gefährdet wird."
    },
    {
      "date": "2025-02-26",
      "id": "102323",
      "original_text": "Registerbekanntmachung nach dem Umwandlungsgesetz\nNordrhein-Westfalen Amtsgericht Coesfeld HRB 14485\nFood Foto Factory GmbH – Velen",
      "type": "Registerbekanntmachung nach dem Umwandlungsgesetz",
      "state": "Nordrhein-Westfalen",
      "amtsgericht": "Amtsgericht Coesfeld",
      "registernummer": "HRB 14485",
      "registerart": "HRB",
      "company_name": "Food Foto Factory GmbH",
      "company_seat": "Velen",
      "details": "26.02.2025 (Bekanntmachungsdatum)\n\nNordrhein-Westfalen Amtsgericht Coesfeld HRB 14485\nRegisterbekanntmachung nach dem Umwandlungsgesetz 26.02.2025 (Eintragungsdatum)\n\nFood Foto Factory GmbH\nGesellschaft mit beschränkter Haftung\nVelen\n\nDen Gläubigern der an der Verschmelzung beteiligten Rechtsträger ist, wenn sie binnen sechs Monaten nach dem Tag, an dem die Eintragung der Verschmelzung in das Register des Sitzes derjenigen Rechtsträger deren Gläubiger sie sind, nach § 19 Absatz 3 UmwG als bekanntgemacht gilt, ihren Anspruch nach Grund und Höhe schriftlich anmelden, Sicherheit zu leisten, soweit sie nicht Befriedigung verlangen können. Dieses Recht steht den Gläubigern jedoch nur zu, wenn sie glaubhaft machen, dass durch die Verschmelzung die Erfüllung ihrer Forderung gefährdet wird."
    },
    {
      "date": "2025-02-26",
      "id": "102324",
      "original_text": "Einreichung neuer Dokumente\nSachsen-Anhalt Amtsgericht Stendal HRB 32754\nASG Energie AG – Köthen (Anhalt)",
      "type": "Einreichung neuer Dokumente",
      "state": "Sachsen-Anhalt",
      "amtsgericht": "Amtsgericht Stendal",
      "registernummer": "HRB 32754",
      "registerart": "HRB",
      "company_name": "ASG Energie AG",
      "company_seat": "Köthen (Anhalt)",
      "details": "26.02.2025 (Bekanntmachungsdatum)\n\nSachsen-Anhalt Amtsgericht Stendal HRB 32754\nEinreichung neuer Dokumente\n\nASG Energie AG\nAktiengesellschaft\nKöthen (Anhalt)\n\nEine Liste der Mitglieder des Aufsichtsrates wurde zum Handelsregister eingereicht."
    },
    {
      "date": "2025-02-26",
      "id": "102325",
      "original_text": "Registerbekanntmachung nach dem Umwandlungsgesetz\nSaarland Amtsgericht Saarbrücken HRB 43413\nLEICA - BAU GmbH – Eppelborn",
      "type": "Registerbekanntmachung nach dem Umwandlungsgesetz",
      "state": "Saarland",
      "amtsgericht": "Amtsgericht Saarbrücken",
      "registernummer": "HRB 43413",
      "registerart": "HRB",
      "company_name": "LEICA - BAU GmbH",
      "company_seat": "Eppelborn",
      "details": "26.02.2025 (Bekanntmachungsdatum)\n\nSaarland Amtsgericht Saarbrücken HRB 43413\nRegisterbekanntmachung nach dem Umwandlungsgesetz 26.02.2025 (Eintragungsdatum)\n\nLEICA - BAU GmbH\nGesellschaft mit beschränkter Haftung\nEppelborn\n\nAls nicht eingetragen wird bekannt gemacht: Den Gläubigern der an der Verschmelzung beteiligten Rechtsträgern ist, wenn sie binnen sechs Monaten nach dem Tag, an dem die Eintragung der Verschmelzung in das Register des Sitzes desjenigen Rechtsträgers, dessen Gläubiger sie sind, nach § 19 Absatz 3 UmwG bekannt gemacht worden ist, ihren Anspruch nach Grund und Höhe schriftlich anmelden, Sicherheit zu leisten, soweit sie nicht Befriedigung verlangen können. Dieses Recht steht den Gläubigern jedoch nur zu, wenn sie glaubhaft machen, dass durch die Verschmelzung die Erfüllung ihrer Forderung gefährdet wird."
    },
    {
      "date": "2025-02-26",
      "id": "102326",
      "original_text": "Registerbekanntmachung nach dem Umwandlungsgesetz\nSaarland Amtsgericht Saarbrücken HRA 13630\nLeica-Bau e.K. – Eppelborn",
      "type": "Registerbekanntmachung nach dem Umwandlungsgesetz",
      "state": "Saarland",
      "amtsgericht": "Amtsgericht Saarbrücken",
      "registernummer": "HRA 13630",
      "registerart": "HRA",
      "company_name": "Leica-Bau e.K.",
      "company_seat": "Eppelborn",
      "details": "26.02.2025 (Bekanntmachungsdatum)\n\nSaarland Amtsgericht Saarbrücken HRA 13630\nRegisterbekanntmachung nach dem Umwandlungsgesetz 26.02.2025 (Eintragungsdatum)\n\nLeica-Bau e.K.\nEinzelkaufmann / Einzelkauffrau\nEppelborn\n\nAls nicht eingetragen wird bekannt gemacht: Den Gläubigern der an der Verschmelzung beteiligten Rechtsträgern ist, wenn sie binnen sechs Monaten nach dem Tag, an dem die Eintragung der Verschmelzung in das Register des Sitzes desjenigen Rechtsträgers, dessen Gläubiger sie sind, nach § 19 Absatz 3 UmwG bekannt gemacht worden ist, ihren Anspruch nach Grund und Höhe schriftlich anmelden, Sicherheit zu leisten, soweit sie nicht Befriedigung verlangen können. Dieses Recht steht den Gläubigern jedoch nur zu, wenn sie glaubhaft machen, dass durch die Verschmelzung die Erfüllung ihrer Forderung gefährdet wird."
    },
    {
      "date": "2025-02-26",
      "id": "102327",
      "original_text": "Sonstige Registerbekanntmachung\nBerlin Amtsgericht Berlin (Charlottenburg) HRB 138181\nQyotta GmbH – Berlin",
      "type": "Sonstige Registerbekanntmachung",
      "state": "Berlin",
      "amtsgericht": "Amtsgericht Berlin (Charlottenburg)",
      "registernummer": "HRB 138181",
      "registerart": "HRB",
      "company_name": "Qyotta GmbH",
      "company_seat": "Berlin",
      "details": "26.02.2025 (Bekanntmachungsdatum)\n\nBerlin Amtsgericht Berlin (Charlottenburg) HRB 138181\nSonstige Registerbekanntmachung\n\nQyotta GmbH\nGesellschaft mit beschränkter Haftung\nBerlin\n\nDer andere Vertragsteil hat den Gläubigern dieses Rechtsträgers, deren Forderungen begründet worden sind, bevor die Eintragung der Beendigung dieses Vertrages in das Handelsregister nach § 10 des Handelsgesetzbuches als bekannt gemacht gilt, Sicherheit zu leisten, wenn sie sich binnen sechs Monaten nach der Bekanntmachung der Eintragung zu diesem Zweck bei ihm melden. Dieses Recht steht den Gläubigern nicht zu, die im Fall des Insolvenzverfahrens ein Recht auf vorzugsweise Befriedigung aus der Deckungsmasse haben, die nach gesetzlicher Vorschrift zu ihrem Schutz errichtet und staatlich überwacht ist."
    },
    {
      "date": "2025-02-26",
      "id": "102328",
      "original_text": "Löschungsankündigung\nBerlin Amtsgericht Berlin (Charlottenburg) HRB 182387\nBERLIBIRD UG (haftungsbeschränkt) – Berlin",
      "type": "Löschungsankündigung",
      "state": "Berlin",
      "amtsgericht": "Amtsgericht Berlin (Charlottenburg)",
      "registernummer": "HRB 182387",
      "registerart": "HRB",
      "company_name": "BERLIBIRD UG (haftungsbeschränkt)",
      "company_seat": "Berlin",
      "details": "26.02.2025 (Bekanntmachungsdatum)\n\nBerlin Amtsgericht Berlin (Charlottenburg) HRB 182387\nLöschungsankündigung\n\nBERLIBIRD UG (haftungsbeschränkt)\nGesellschaft mit beschränkter Haftung\nBerlin\n\nBei der nachstehenden Gesellschaft wird das Amtslöschungsverfahren gemäß § 394 FamFG eingeleitet. Widerspruchsfrist 6 Wochen"
    },
    {
      "date": "2025-02-26",
      "id": "102329",
      "original_text": "Registerbekanntmachung nach dem Umwandlungsgesetz\nSchleswig-Holstein Amtsgericht Lübeck HRB 19455\nMultiplex Cinemas Frankfurt Mainzer Landstraße GmbH – Lübeck",
      "type": "Registerbekanntmachung nach dem Umwandlungsgesetz",
      "state": "Schleswig-Holstein",
      "amtsgericht": "Amtsgericht Lübeck",
      "registernummer": "HRB 19455",
      "registerart": "HRB",
      "company_name": "Multiplex Cinemas Frankfurt Mainzer Landstraße GmbH",
      "company_seat": "Lübeck",
      "details": "26.02.2025 (Bekanntmachungsdatum)\n\nSchleswig-Holstein Amtsgericht Lübeck HRB 19455\nRegisterbekanntmachung nach dem Umwandlungsgesetz 25.02.2025 (Eintragungsdatum)\n\nMultiplex Cinemas Frankfurt Mainzer Landstraße GmbH\nGesellschaft mit beschränkter Haftung\nLübeck\n\nZu Eintragungsnummer 3 vom 25.02.2025 wird als nicht eingetragen veröffentlicht:\nAls nicht eingetragen wird veröffentlicht: Den Gläubigern der an der Verschmelzung beteiligten Rechtsträger ist, wenn sie binnen sechs Monaten nach dem Tag, an dem die Eintragung der Verschmelzung in das Register des Sitzes desjenigen Rechtsträgers, dessen Gläubiger sie sind, als bekannt gemacht gilt, ihren Anspruch nach Grund und Höhe schriftlich anmelden, Sicherheit zu leisten, soweit sie nicht Befriedigung verlangen können. Dieses Recht steht den Gläubigern jedoch nur zu, wenn sie glaubhaft machen, dass durch die Verschmelzung die Erfüllung ihrer Forderung gefährdet wird."
    },
    {
      "date": "2025-02-26",
      "id": "102330",
      "original_text": "Löschungsankündigung\nMecklenburg-Vorpommern Amtsgericht Stralsund HRB 20544\nAlte Fischfabrik Appartementhaus Lauterbach GmbH – Rambin",
      "type": "Löschungsankündigung",
      "state": "Mecklenburg-Vorpommern",
      "amtsgericht": "Amtsgericht Stralsund",
      "registernummer": "HRB 20544",
      "registerart": "HRB",
      "company_name": "Alte Fischfabrik Appartementhaus Lauterbach GmbH",
      "company_seat": "Rambin",
      "details": "26.02.2025 (Bekanntmachungsdatum)\n\nMecklenburg-Vorpommern Amtsgericht Stralsund HRB 20544\nLöschungsankündigung 25.02.2025 (Eintragungsdatum)\n\nAlte Fischfabrik Appartementhaus Lauterbach GmbH\nGesellschaft mit beschränkter Haftung\nRambin\n\nDas Registergericht beabsichtigt, die im Handelsregister eingetragene Gesellschaft von Amts wegen nach § 394 FamFG zu löschen. Die Frist zur Erhebung eines Widerspruchs gegen die beabsichtigte Löschung wird auf 1 Monat festgesetzt."
    },
    {
      "date": "2025-02-26",
      "id": "102331",
      "original_text": "Einreichung neuer Dokumente\nBerlin Amtsgericht Berlin (Charlottenburg) HRB 44343\nGASAG AG – Berlin",
      "type": "Einreichung neuer Dokumente",
      "state": "Berlin",
      "amtsgericht": "Amtsgericht Berlin (Charlottenburg)",
      "registernummer": "HRB 44343",
      "registerart": "HRB",
      "company_name": "GASAG AG",
      "company_seat": "Berlin",
      "details": "26.02.2025 (Bekanntmachungsdatum)\n\nBerlin Amtsgericht Berlin (Charlottenburg) HRB 44343\nEinreichung neuer Dokumente\n\nGASAG AG\nAktiengesellschaft\nBerlin\n\nAls nicht eingetragen wird veröffentlicht: Es wurde eine neue Liste der Aufsichtsratsmitglieder eingereicht (§ 106 AktG)."
    },
    {
      "date": "2025-02-26",
      "id": "102332",
      "original_text": "Registerbekanntmachung nach dem Umwandlungsgesetz\nSchleswig-Holstein Amtsgericht Flensburg HRB 15890\nBNS Ventures GmbH – Sylt/OT Tinnum",
      "type": "Registerbekanntmachung nach dem Umwandlungsgesetz",
      "state": "Schleswig-Holstein",
      "amtsgericht": "Amtsgericht Flensburg",
      "registernummer": "HRB 15890",
      "registerart": "HRB",
      "company_name": "BNS Ventures GmbH",
      "company_seat": "Sylt/OT Tinnum",
      "details": "26.02.2025 (Bekanntmachungsdatum)\n\nSchleswig-Holstein Amtsgericht Flensburg HRB 15890\nRegisterbekanntmachung nach dem Umwandlungsgesetz 26.02.2025 (Eintragungsdatum)\n\nBNS Ventures GmbH\nGesellschaft mit beschränkter Haftung\nSylt/OT Tinnum\n\nZu Eintragungsnummer 2 vom 26.02.2025 wird als nicht eingetragen veröffentlicht:\nDen Gläubigern der an der Verschmelzung beteiligten Rechtsträger ist, wenn sie binnen sechs Monaten nach dem Tag, an dem die Eintragung der Verschmelzung in das Register des Sitzes desjenigen Rechtsträgers, dessen Gläubiger sie sind, als bekannt gemacht gilt, ihren Anspruch nach Grund und Höhe schriftlich anmelden, Sicherheit zu leisten, soweit sie nicht Befriedigung verlangen können. Dieses Recht steht den Gläubigern jedoch nur zu, wenn sie glaubhaft machen, dass durch die Verschmelzung die Erfüllung ihrer Forderung gefährdet wird."
    },
    {
      "date": "2025-02-26",
      "id": "102333",
      "original_text": "Löschungsankündigung\nBerlin Amtsgericht Berlin (Charlottenburg) HRB 157725\nINHOLD GmbH – Berlin",
      "type": "Löschungsankündigung",
      "state": "Berlin",
      "amtsgericht": "Amtsgericht Berlin (Charlottenburg)",
      "registernummer": "HRB 157725",
      "registerart": "HRB",
      "company_name": "INHOLD GmbH",
      "company_seat": "Berlin",
      "details": "26.02.2025 (Bekanntmachungsdatum)\n\nBerlin Amtsgericht Berlin (Charlottenburg) HRB 157725\nLöschungsankündigung\n\nINHOLD GmbH\nGesellschaft mit beschränkter Haftung\nBerlin\n\nBei der nachstehenden Gesellschaft wird das Amtslöschungsverfahren gemäß § 394 FamFG eingeleitet. Widerspruchsfrist 6 Wochen"
    },
    {
      "date": "2025-02-26",
      "id": "102334",
      "original_text": "Löschungsankündigung\nBerlin Amtsgericht Berlin (Charlottenburg) HRB 187386\nAutomotive & Building Solutions GmbH – Berlin",
      "type": "Löschungsankündigung",
      "state": "Berlin",
      "amtsgericht": "Amtsgericht Berlin (Charlottenburg)",
      "registernummer": "HRB 187386",
      "registerart": "HRB",
      "company_name": "Automotive & Building Solutions GmbH",
      "company_seat": "Berlin",
      "details": "26.02.2025 (Bekanntmachungsdatum)\n\nBerlin Amtsgericht Berlin (Charlottenburg) HRB 187386\nLöschungsankündigung\n\nAutomotive & Building Solutions GmbH\nGesellschaft mit beschränkter Haftung\nBerlin\n\nBei der nachstehenden Gesellschaft wird das Amtslöschungsverfahren gemäß § 394 FamFG eingeleitet. Widerspruchsfrist: 6 Wochen."
    },
    {
      "date": "2025-02-26",
      "id": "102335",
      "original_text": "Löschungsankündigung\nBrandenburg Amtsgericht Potsdam HRB 26636\nSchmunk GmbH – Nauen",
      "type": "Löschungsankündigung",
      "state": "Brandenburg",
      "amtsgericht": "Amtsgericht Potsdam",
      "registernummer": "HRB 26636",
      "registerart": "HRB",
      "company_name": "Schmunk GmbH",
      "company_seat": "Nauen",
      "details": "26.02.2025 (Bekanntmachungsdatum)\n\nBrandenburg Amtsgericht Potsdam HRB 26636\nLöschungsankündigung\n\nSchmunk GmbH\nGesellschaft mit beschränkter Haftung\nNauen\n\nBei der nachstehenden Gesellschaft wird das Amtslöschungsverfahren gemäß § 394 FamFG eingeleitet. Widerspruchsfrist: 8 Wochen."
    },
    {
      "date": "2025-02-26",
      "id": "102336",
      "original_text": "Löschungsankündigung\nBerlin Amtsgericht Berlin (Charlottenburg) HRB 93481\nPrager Platz Immobilien und Bau GmbH – Berlin",
      "type": "Löschungsankündigung",
      "state": "Berlin",
      "amtsgericht": "Amtsgericht Berlin (Charlottenburg)",
      "registernummer": "HRB 93481",
      "registerart": "HRB",
      "company_name": "Prager Platz Immobilien und Bau GmbH",
      "company_seat": "Berlin",
      "details": "26.02.2025 (Bekanntmachungsdatum)\n\nBerlin Amtsgericht Berlin (Charlottenburg) HRB 93481\nLöschungsankündigung\n\nPrager Platz Immobilien und Bau GmbH\nGesellschaft mit beschränkter Haftung\nBerlin\n\nBei der nachstehenden Gesellschaft wird das Amtslöschungsverfahren gemäß § 394 FamFG eingeleitet. Widerspruchsfrist: 6 Wochen."
    },
    {
      "date": "2025-02-26",
      "id": "102337",
      "original_text": "Löschungsankündigung\nBaden-Württemberg Amtsgericht Ulm HRB 724292\nHydraulic Systems GmbH – Altshausen",
      "type": "Löschungsankündigung",
      "state": "Baden-Württemberg",
      "amtsgericht": "Amtsgericht Ulm",
      "registernummer": "HRB 724292",
      "registerart": "HRB",
      "company_name": "Hydraulic Systems GmbH",
      "company_seat": "Altshausen",
      "details": "26.02.2025 (Bekanntmachungsdatum)\n\nBaden-Württemberg Amtsgericht Ulm HRB 724292\nLöschungsankündigung\n\nHydraulic Systems GmbH\nGesellschaft mit beschränkter Haftung\nAltshausen\n\nDas Gericht beabsichtigt, die Gesellschaft wegen Vermögenslosigkeit im Handelsregister von Amts wegen nach § 394 FamFG zu löschen. Die Frist zur Geltendmachung eines Widerspruchs gegen die beabsichtigte Löschung ist auf  einen Monat ab Veröffentlichung bestimmt."
    },
    {
      "date": "2025-02-26",
      "id": "102338",
      "original_text": "Sonstige Registerbekanntmachung\nBerlin Amtsgericht Berlin (Charlottenburg) HRB 154517\nAxel Springer SE – Berlin",
      "type": "Sonstige Registerbekanntmachung",
      "state": "Berlin",
      "amtsgericht": "Amtsgericht Berlin (Charlottenburg)",
      "registernummer": "HRB 154517",
      "registerart": "HRB",
      "company_name": "Axel Springer SE",
      "company_seat": "Berlin",
      "details": "26.02.2025 (Bekanntmachungsdatum)\n\nBerlin Amtsgericht Berlin (Charlottenburg) HRB 154517\nSonstige Registerbekanntmachung\n\nAxel Springer SE\nEuropäische Aktiengesellschaft (SE)\nBerlin\n\nAls nicht eingetragen wird nach § 10 HGB, §§ 62 Abs. 3 Satz 2, 61 Satz 2 UmwG veröffentlicht:\nDie Gesellschaft hat am 21.02.2025 einen geänderten Entwurf eines Verschmelzungsvertrages gemäß §§ 62 Abs. 3 Satz 2, 61 Satz 2 UmwG mit der Axel Springer Digital Classifieds GmbH (HRB 141922 B) zum Handelsregister eingereicht."
    },
    {
      "date": "2025-02-26",
      "id": "102339",
      "original_text": "Einreichung neuer Dokumente\nBaden-Württemberg Amtsgericht Ulm HRB 552240\nTechnische Werke Schussental Verwaltungs-GmbH – Ravensburg",
      "type": "Einreichung neuer Dokumente",
      "state": "Baden-Württemberg",
      "amtsgericht": "Amtsgericht Ulm",
      "registernummer": "HRB 552240",
      "registerart": "HRB",
      "company_name": "Technische Werke Schussental Verwaltungs-GmbH",
      "company_seat": "Ravensburg",
      "details": "26.02.2025 (Bekanntmachungsdatum)\n\nBaden-Württemberg Amtsgericht Ulm HRB 552240\nEinreichung neuer Dokumente\n\nTechnische Werke Schussental Verwaltungs-GmbH\nGesellschaft mit beschränkter Haftung\nRavensburg\n\nDie Gesellschaft hat am 24.02.2025 die Liste über die Zusammensetzung des Aufsichtsrats zum Handelsregister eingereicht."
    },
    {
      "date": "2025-02-26",
      "id": "102340",
      "original_text": "Sonstige Registerbekanntmachung\nBaden-Württemberg Amtsgericht Ulm HRB 726267\nEGS Erdwärmegesellschaft Schussental mbH – Weingarten",
      "type": "Sonstige Registerbekanntmachung",
      "state": "Baden-Württemberg",
      "amtsgericht": "Amtsgericht Ulm",
      "registernummer": "HRB 726267",
      "registerart": "HRB",
      "company_name": "EGS Erdwärmegesellschaft Schussental mbH",
      "company_seat": "Weingarten",
      "details": "26.02.2025 (Bekanntmachungsdatum)\n\nBaden-Württemberg Amtsgericht Ulm HRB 726267\nSonstige Registerbekanntmachung\n\nEGS Erdwärmegesellschaft Schussental mbH\nGesellschaft mit beschränkter Haftung\nWeingarten\n\nDie Gesellschaft hat am 24.02.2025 die Liste über die Zusammensetzung des Aufsichtsrats zum Handelsregister eingereicht."
    },
    {
      "date": "2025-02-26",
      "id": "102341",
      "original_text": "Registerbekanntmachung nach dem Umwandlungsgesetz\nSachsen Amtsgericht Leipzig HRB 24151\nSAM Sachsen Asset Management GmbH – Leipzig",
      "type": "Registerbekanntmachung nach dem Umwandlungsgesetz",
      "state": "Sachsen",
      "amtsgericht": "Amtsgericht Leipzig",
      "registernummer": "HRB 24151",
      "registerart": "HRB",
      "company_name": "SAM Sachsen Asset Management GmbH",
      "company_seat": "Leipzig",
      "details": "26.02.2025 (Bekanntmachungsdatum)\n\nSachsen Amtsgericht Leipzig HRB 24151\nRegisterbekanntmachung nach dem Umwandlungsgesetz 26.02.2025 (Eintragungsdatum)\n\nSAM Sachsen Asset Management GmbH\nGesellschaft mit beschränkter Haftung\nLeipzig\n\nDen Gläubigern der an der Verschmelzung beteiligten Rechtsträger ist, wenn sie binnen sechs Monaten nach dem Tag, an dem die Eintragung der Verschmelzung in das Register des Sitzes desjenigen Rechtsträgers, dessen Gläubiger sie sind, nach § 19 Abs. 3 UmwG als bekannt gemacht gilt, ihren Anspruch nach Grund und Höhe in Textform anmelden, Sicherheit zu leisten, soweit sie nicht Befriedigung verlangen können. Dieses Recht steht den Gläubigern jedoch nur zu, wenn sie glaubhaft machen, dass durch die Verschmelzung die Erfüllung der Forderung gefährdet wird."
    },
    {
      "date": "2025-02-26",
      "id": "102342",
      "original_text": "Registerbekanntmachung nach dem Umwandlungsgesetz\nSachsen Amtsgericht Dresden HRB 46192\nMade4Drivers GmbH – Dresden",
      "type": "Registerbekanntmachung nach dem Umwandlungsgesetz",
      "state": "Sachsen",
      "amtsgericht": "Amtsgericht Dresden",
      "registernummer": "HRB 46192",
      "registerart": "HRB",
      "company_name": "Made4Drivers GmbH",
      "company_seat": "Dresden",
      "details": "26.02.2025 (Bekanntmachungsdatum)\n\nSachsen Amtsgericht Dresden HRB 46192\nRegisterbekanntmachung nach dem Umwandlungsgesetz 26.02.2025 (Eintragungsdatum)\n\nMade4Drivers GmbH\nGesellschaft mit beschränkter Haftung\nDresden\n\nDen Gläubigern der an der Ausgliederung beteiligten Rechtsträger ist, wenn sie binnen sechs Monaten nach dem Tag, an dem die Eintragung der Ausgliederung in das Register des Sitzes desjenigen Rechtsträgers, dessen Gläubiger sie sind, nach § 19 Abs. 3 UmwG als bekannt gemacht gilt, ihren Anspruch nach Grund und Höhe in Textform anmelden, Sicherheit zu leisten, soweit sie nicht Befriedigung verlangen können. Dieses Recht steht den Gläubigern jedoch nur zu, wenn sie glaubhaft machen, dass durch die Ausgliederung die Erfüllung der Forderung gefährdet wird."
    },
    {
      "date": "2025-02-26",
      "id": "102343",
      "original_text": "Löschungsankündigung\nSachsen Amtsgericht Dresden HRB 41598\nKrone Bau GmbH – Dresden",
      "type": "Löschungsankündigung",
      "state": "Sachsen",
      "amtsgericht": "Amtsgericht Dresden",
      "registernummer": "HRB 41598",
      "registerart": "HRB",
      "company_name": "Krone Bau GmbH",
      "company_seat": "Dresden",
      "details": "26.02.2025 (Bekanntmachungsdatum)\n\nSachsen Amtsgericht Dresden HRB 41598\nLöschungsankündigung\n\nKrone Bau GmbH\nGesellschaft mit beschränkter Haftung\nDresden\n\nDas Registergericht beabsichtigt, die im Handelsregister eingetragene Gesellschaft von Amts wegen nach § 394 FamFG zu löschen. Die Frist zu Erhebung eines Widerspruchs gegen die beabsichtigte Löschung wird auf einen Monat festgesetzt."
    },
    {
      "date": "2025-02-26",
      "id": "102344",
      "original_text": "Löschungsankündigung\nSachsen Amtsgericht Leipzig HRB 17054\nJEKD Gastronomiebetriebs GmbH – Leipzig",
      "type": "Löschungsankündigung",
      "state": "Sachsen",
      "amtsgericht": "Amtsgericht Leipzig",
      "registernummer": "HRB 17054",
      "registerart": "HRB",
      "company_name": "JEKD Gastronomiebetriebs GmbH",
      "company_seat": "Leipzig",
      "details": "26.02.2025 (Bekanntmachungsdatum)\n\nSachsen Amtsgericht Leipzig HRB 17054\nLöschungsankündigung 26.02.2025 (Eintragungsdatum)\n\nJEKD Gastronomiebetriebs GmbH\nGesellschaft mit beschränkter Haftung\nLeipzig\n\nDas Registergericht beabsichtigt, die im Handelsregister eingetragene Gesellschaft von Amts wegen nach § 394 FamFG zu löschen. Die Frist zu Erhebung eines Widerspruchs gegen die beabsichtigte Löschung wird auf einen Monat festgesetzt."
    },
    {
      "date": "2025-02-26",
      "id": "102345",
      "original_text": "Registerbekanntmachung nach dem Umwandlungsgesetz\nSachsen Amtsgericht Dresden HRA 12162\nManuela Schöne - M4D e.K. – Dresden",
      "type": "Registerbekanntmachung nach dem Umwandlungsgesetz",
      "state": "Sachsen",
      "amtsgericht": "Amtsgericht Dresden",
      "registernummer": "HRA 12162",
      "registerart": "HRA",
      "company_name": "Manuela Schöne - M4D e.K.",
      "company_seat": "Dresden",
      "details": "26.02.2025 (Bekanntmachungsdatum)\n\nSachsen Amtsgericht Dresden HRA 12162\nRegisterbekanntmachung nach dem Umwandlungsgesetz 26.02.2025 (Eintragungsdatum)\n\nManuela Schöne - M4D e.K.\nEinzelkaufmann / Einzelkauffrau\nDresden\n\nDen Gläubigern der an der Ausgliederung beteiligten Rechtsträger ist, wenn sie binnen sechs Monaten nach dem Tag, an dem die Eintragung der Ausgliederung in das Register des Sitzes desjenigen Rechtsträgers, dessen Gläubiger sie sind, nach § 19 Abs. 3 UmwG als bekannt gemacht gilt, ihren Anspruch nach Grund und Höhe in Textform anmelden, Sicherheit zu leisten, soweit sie nicht Befriedigung verlangen können. Dieses Recht steht den Gläubigern jedoch nur zu, wenn sie glaubhaft machen, dass durch die Ausgliederung die Erfüllung der Forderung gefährdet wird."
    },
    {
      "date": "2025-02-26",
      "id": "102346",
      "original_text": "Einreichung neuer Dokumente\nSachsen Amtsgericht Chemnitz HRB 8435\nWohnungsverwaltungs- und -baugesellschaft m.b.H. Flöha – Flöha",
      "type": "Einreichung neuer Dokumente",
      "state": "Sachsen",
      "amtsgericht": "Amtsgericht Chemnitz",
      "registernummer": "HRB 8435",
      "registerart": "HRB",
      "company_name": "Wohnungsverwaltungs- und -baugesellschaft m.b.H. Flöha",
      "company_seat": "Flöha",
      "details": "26.02.2025 (Bekanntmachungsdatum)\n\nSachsen Amtsgericht Chemnitz HRB 8435\nEinreichung neuer Dokumente\n\nWohnungsverwaltungs- und -baugesellschaft m.b.H. Flöha\nGesellschaft mit beschränkter Haftung\nFlöha\n\nAm 21.02.2025 wurde beim Handelsregister des Amtsgerichts Chemnitz die Liste der Mitglieder des Aufsichtsrats gemäß § 52 GmbHG eingereicht."
    },
    {
      "date": "2025-02-26",
      "id": "102347",
      "original_text": "Registerbekanntmachung nach dem Umwandlungsgesetz\nNiedersachsen Amtsgericht Lüneburg GsR 741\nA. Grieger eGbR – Bad Bevensen",
      "type": "Registerbekanntmachung nach dem Umwandlungsgesetz",
      "state": "Niedersachsen",
      "amtsgericht": "Amtsgericht Lüneburg",
      "registernummer": "GsR 741",
      "registerart": "GsR",
      "company_name": "A. Grieger eGbR",
      "company_seat": "Bad Bevensen",
      "details": "26.02.2025 (Bekanntmachungsdatum)\n\nNiedersachsen Amtsgericht Lüneburg GsR 741\nRegisterbekanntmachung nach dem Umwandlungsgesetz 26.02.2025 (Eintragungsdatum)\n\nA. Grieger eGbR\nGesellschaft bürgerlichen Rechts\nBad Bevensen\n\nDen Gläubigern der an der formwechselnden Umwandlung beteiligten Rechtsträger ist, wenn sie binnen sechs Monaten nach dem Tag, an dem die Eintragung der Umwandlung in das Register des Sitzes desjenigen Rechtsträgers, dessen Gläubiger sie sind, nach § 19 Abs. 3 UmwG als bekannt gemacht gilt, ihren Anspruch nach Grund und Höhe schriftlich anmelden, Sicherheit zu leisten, soweit sie nicht Befriedigung verlangen können. Dieses Recht steht den Gläubigern jedoch nur zu, wenn sie glaubhaft machen, dass durch die formwechselnde Umwandlung die Erfüllung der Forderung gefährdet wird."
    },
    {
      "date": "2025-02-26",
      "id": "102348",
      "original_text": "Löschungsankündigung\nNiedersachsen Amtsgericht Lüneburg HRB 202814\nOHSU UG (haftungsbeschränkt) – Seevetal",
      "type": "Löschungsankündigung",
      "state": "Niedersachsen",
      "amtsgericht": "Amtsgericht Lüneburg",
      "registernummer": "HRB 202814",
      "registerart": "HRB",
      "company_name": "OHSU UG (haftungsbeschränkt)",
      "company_seat": "Seevetal",
      "details": "26.02.2025 (Bekanntmachungsdatum)\n\nNiedersachsen Amtsgericht Lüneburg HRB 202814\nLöschungsankündigung\n\nOHSU UG (haftungsbeschränkt)\nGesellschaft mit beschränkter Haftung\nSeevetal\n\nDas Registergericht beabsichtigt, die Gesellschaft von Amts wegen nach § 394 FamFG zu löschen. Die Frist zur Erhebung eines Widerspruchs ist auf 3 Wochen ab dieser Registerbekanntmachung festgesetzt."
    },
    {
      "date": "2025-02-26",
      "id": "102349",
      "original_text": "Löschungsankündigung\nNiedersachsen Amtsgericht Osnabrück HRB 217793\nKunert West GmbH – Nordhorn",
      "type": "Löschungsankündigung",
      "state": "Niedersachsen",
      "amtsgericht": "Amtsgericht Osnabrück",
      "registernummer": "HRB 217793",
      "registerart": "HRB",
      "company_name": "Kunert West GmbH",
      "company_seat": "Nordhorn",
      "details": "26.02.2025 (Bekanntmachungsdatum)\n\nNiedersachsen Amtsgericht Osnabrück HRB 217793\nLöschungsankündigung\n\nKunert West GmbH\nGesellschaft mit beschränkter Haftung\nNordhorn\n\nDas Registergericht beabsichtigt, die Gesellschaft von Amts wegen nach § 394 FamFG wegen Vermögenslosigkeit zu löschen. Die Frist zur Erhebung eines Widerspruchs ist auf 1 Monat ab dieser Registerbekanntmachung festgesetzt."
    },
    {
      "date": "2025-02-26",
      "id": "102350",
      "original_text": "Registerbekanntmachung nach dem Umwandlungsgesetz\nNiedersachsen Amtsgericht Lüneburg HRB 120392 früher Amtsgericht Dannenberg (Elbe)\nA. Grieger GmbH – Bad Bevensen",
      "type": "Registerbekanntmachung nach dem Umwandlungsgesetz",
      "state": "Niedersachsen",
      "amtsgericht": "Amtsgericht Lüneburg",
      "registernummer": "HRB 120392",
      "registerart": "HRB",
      "company_name": "A. Grieger GmbH",
      "company_seat": "Bad Bevensen",
      "former_amtsgericht": "Dannenberg (Elbe)",
      "details": "26.02.2025 (Bekanntmachungsdatum)\n\nNiedersachsen Amtsgericht Lüneburg HRB 120392 früher Amtsgericht Dannenberg (Elbe)\nRegisterbekanntmachung nach dem Umwandlungsgesetz 26.02.2025 (Eintragungsdatum)\n\nA. Grieger GmbH\nGesellschaft mit beschränkter Haftung\nBad Bevensen\n\nDen Gläubigern der an der formwechselnden Umwandlung beteiligten Rechtsträger ist, wenn sie binnen sechs Monaten nach dem Tag, an dem die Eintragung der Umwandlung in das Register des Sitzes desjenigen Rechtsträgers, dessen Gläubiger sie sind, nach § 19 Abs. 3 UmwG als bekannt gemacht gilt, ihren Anspruch nach Grund und Höhe schriftlich anmelden, Sicherheit zu leisten, soweit sie nicht Befriedigung verlangen können. Dieses Recht steht den Gläubigern jedoch nur zu, wenn sie glaubhaft machen, dass durch die formwechselnde Umwandlung die Erfüllung der Forderung gefährdet wird."
    },
    {
      "date": "2025-02-26",
      "id": "102351",
      "original_text": "Löschungsankündigung\nNiedersachsen Amtsgericht Braunschweig HRB 209604\nOGS-SHOP UG (haftungsbeschränkt) – Wolfsburg",
      "type": "Löschungsankündigung",
      "state": "Niedersachsen",
      "amtsgericht": "Amtsgericht Braunschweig",
      "registernummer": "HRB 209604",
      "registerart": "HRB",
      "company_name": "OGS-SHOP UG (haftungsbeschränkt)",
      "company_seat": "Wolfsburg",
      "details": "26.02.2025 (Bekanntmachungsdatum)\n\nNiedersachsen Amtsgericht Braunschweig HRB 209604\nLöschungsankündigung\n\nOGS-SHOP UG (haftungsbeschränkt)\nGesellschaft mit beschränkter Haftung\nWolfsburg\n\nDas Registergericht beabsichtigt, die Gesellschaft von Amts wegen nach § 394 FamFG zu löschen. Die Frist zur Erhebung eines Widerspruchs ist auf 1 Monat ab dieser Registerbekanntmachung festgesetzt."
    },
    {
      "date": "2025-02-26",
      "id": "102352",
      "original_text": "Löschungsankündigung\nNiedersachsen Amtsgericht Osnabrück VR 200863\nVerband deutscher Rechtsanwälte und Fachanwälte e.V. – Osnabrück",
      "type": "Löschungsankündigung",
      "state": "Niedersachsen",
      "amtsgericht": "Amtsgericht Osnabrück",
      "registernummer": "VR 200863",
      "registerart": "VR",
      "company_name": "Verband deutscher Rechtsanwälte und Fachanwälte e.V.",
      "company_seat": "Osnabrück",
      "details": "26.02.2025 (Bekanntmachungsdatum)\n\nNiedersachsen Amtsgericht Osnabrück VR 200863\nLöschungsankündigung\n\nVerband deutscher Rechtsanwälte und Fachanwälte e.V.\neingetragener Verein\nOsnabrück\n\nDas Registergericht beabsichtigt, den Verein von Amts wegen nach § 395 FamFG zu löschen. Die Frist zur Erhebung eines Widerspruchs ist auf 1 Monat ab dieser Registerbekanntmachung festgesetzt."
    },
    {
      "date": "2025-02-26",
      "id": "102353",
      "original_text": "Löschungsankündigung\nNiedersachsen Amtsgericht Osnabrück HRB 218420\nFLS Tech Distribution UG (haftungsbeschränkt) – Melle-Neuenkirchen",
      "type": "Löschungsankündigung",
      "state": "Niedersachsen",
      "amtsgericht": "Amtsgericht Osnabrück",
      "registernummer": "HRB 218420",
      "registerart": "HRB",
      "company_name": "FLS Tech Distribution UG (haftungsbeschränkt)",
      "company_seat": "Melle-Neuenkirchen",
      "details": "26.02.2025 (Bekanntmachungsdatum)\n\nNiedersachsen Amtsgericht Osnabrück HRB 218420\nLöschungsankündigung\n\nFLS Tech Distribution UG (haftungsbeschränkt)\nGesellschaft mit beschränkter Haftung\nMelle-Neuenkirchen\n\nDas Registergericht beabsichtigt, die Gesellschaft von Amts wegen nach § 394 FamFG wegen Vermögenslosigkeit zu löschen. Die Frist zur Erhebung eines Widerspruchs ist auf 1 Monat ab dieser Registerbekanntmachung festgesetzt."
    },
    {
      "date": "2025-02-26",
      "id": "102354",
      "original_text": "Löschungsankündigung\nNiedersachsen Amtsgericht Hannover HRB 206980\nSolid Service Solutions GmbH – Springe",
      "type": "Löschungsankündigung",
      "state": "Niedersachsen",
      "amtsgericht": "Amtsgericht Hannover",
      "registernummer": "HRB 206980",
      "registerart": "HRB",
      "company_name": "Solid Service Solutions GmbH",
      "company_seat": "Springe",
      "details": "26.02.2025 (Bekanntmachungsdatum)\n\nNiedersachsen Amtsgericht Hannover HRB 206980\nLöschungsankündigung\n\nSolid Service Solutions GmbH\nGesellschaft mit beschränkter Haftung\nSpringe\n\nDas Registergericht beabsichtigt, die Gesellschaft von Amts wegen nach § 394 FamFG zu löschen. Die Frist zur Erhebung eines Widerspruchs ist auf 1 Monat ab dieser Registerbekanntmachung festgesetzt."
    },
    {
      "date": "2025-02-26",
      "id": "102355",
      "original_text": "Löschungsankündigung\nNiedersachsen Amtsgericht Lüneburg HRB 101716 früher Amtsgericht Celle\nHeinrich Surburg GmbH – Wienhausen",
      "type": "Löschungsankündigung",
      "state": "Niedersachsen",
      "amtsgericht": "Amtsgericht Lüneburg",
      "registernummer": "HRB 101716",
      "registerart": "HRB",
      "company_name": "Heinrich Surburg GmbH",
      "company_seat": "Wienhausen",
      "former_amtsgericht": "Celle",
      "details": "26.02.2025 (Bekanntmachungsdatum)\n\nNiedersachsen Amtsgericht Lüneburg HRB 101716 früher Amtsgericht Celle\nLöschungsankündigung\n\nHeinrich Surburg GmbH\nGesellschaft mit beschränkter Haftung\nWienhausen\n\nDas Registergericht beabsichtigt, die Gesellschaft von Amts wegen nach § 394 FamFG zu löschen. Die Frist zur Erhebung eines Widerspruchs ist auf 1 Monat ab dieser Registerbekanntmachung festgesetzt."
    },
    {
      "date": "2025-02-26",
      "id": "102356",
      "original_text": "Sonstige Registerbekanntmachung\nNiedersachsen Amtsgericht Oldenburg (Oldenburg) HRB 210285\nForFarmers Beelitz GmbH – Vechta-Langförden",
      "type": "Sonstige Registerbekanntmachung",
      "state": "Niedersachsen",
      "amtsgericht": "Amtsgericht Oldenburg (Oldenburg)",
      "registernummer": "HRB 210285",
      "registerart": "HRB",
      "company_name": "ForFarmers Beelitz GmbH",
      "company_seat": "Vechta-Langförden",
      "details": "26.02.2025 (Bekanntmachungsdatum)\n\nNiedersachsen Amtsgericht Oldenburg (Oldenburg) HRB 210285\nSonstige Registerbekanntmachung 26.02.2025 (Eintragungsdatum)\n\nForFarmers Beelitz GmbH\nGesellschaft mit beschränkter Haftung\nVechta-Langförden\n\nDen Gläubigern der Gesellschaft, deren Forderungen begründet worden sind, bevor die Eintragung der Beendigung des Vertrages in das Handelsregister nach § 10 HGB als bekanntgemacht gilt, ist vom anderen Vertragsteil Sicherheit zu leisten, wenn sie sich binnen sechs Monaten nach der Bekanntmachung zu diesem Zweck bei ihm melden."
    },
    {
      "date": "2025-02-26",
      "id": "102357",
      "original_text": "Löschungsankündigung\nBremen Amtsgericht Bremen HRB 30847\nMorisse Hochbautechnik UG (haftungsbeschränkt) – Bremen",
      "type": "Löschungsankündigung",
      "state": "Bremen",
      "amtsgericht": "Amtsgericht Bremen",
      "registernummer": "HRB 30847",
      "registerart": "HRB",
      "company_name": "Morisse Hochbautechnik UG (haftungsbeschränkt)",
      "company_seat": "Bremen",
      "details": "26.02.2025 (Bekanntmachungsdatum)\n\nBremen Amtsgericht Bremen HRB 30847\nLöschungsankündigung\n\nMorisse Hochbautechnik UG (haftungsbeschränkt)\nGesellschaft mit beschränkter Haftung\nBremen\n\nEs ist beabsichtigt die im Handelsregister eingetragene Gesellschaft von Amts wegen gemäß § 394 FamFG zu löschen. Gegen die Löschung kann beim AG Bremen schriftlich oder zu Protokoll der Geschäftsstelle Widerspruch eingelegt werden. Widerspruchsfrist 4 Wochen."
    },
    {
      "date": "2025-02-26",
      "id": "102358",
      "original_text": "Einreichung neuer Dokumente\nBremen Amtsgericht Bremen HRB 35188\nZech Group SE – Bremen",
      "type": "Einreichung neuer Dokumente",
      "state": "Bremen",
      "amtsgericht": "Amtsgericht Bremen",
      "registernummer": "HRB 35188",
      "registerart": "HRB",
      "company_name": "Zech Group SE",
      "company_seat": "Bremen",
      "details": "26.02.2025 (Bekanntmachungsdatum)\n\nBremen Amtsgericht Bremen HRB 35188\nEinreichung neuer Dokumente\n\nZech Group SE\nEuropäische Aktiengesellschaft (SE)\nBremen\n\nAls nicht eingetragen wird bekannt gemacht: Liste des Aufsichtsrats wurde eingereicht."
    },
    {
      "date": "2025-02-26",
      "id": "102359",
      "original_text": "Sonstige Registerbekanntmachung\nRheinland-Pfalz Amtsgericht Kaiserslautern HRB 3879\nGeneral Dynamics European Land Systems-Bridge Systems GmbH – Kaiserslautern",
      "type": "Sonstige Registerbekanntmachung",
      "state": "Rheinland-Pfalz",
      "amtsgericht": "Amtsgericht Kaiserslautern",
      "registernummer": "HRB 3879",
      "registerart": "HRB",
      "company_name": "General Dynamics European Land Systems-Bridge Systems GmbH",
      "company_seat": "Kaiserslautern",
      "details": "26.02.2025 (Bekanntmachungsdatum)\n\nRheinland-Pfalz Amtsgericht Kaiserslautern HRB 3879\nSonstige Registerbekanntmachung 26.02.2025 (Eintragungsdatum)\n\nGeneral Dynamics European Land Systems-Bridge Systems GmbH\nGesellschaft mit beschränkter Haftung\nKaiserslautern\n\nAls nicht eingetragen wird veröffentlicht: Den Gläubigern der Gesellschaft, deren Forderungen begründet worden sind, bevor die Eintragung der Beendigung des Beherrschungsvertrages in das Handelsregister nach § 10 des Handelsgesetzbuches als bekanntgemacht gilt, hat der andere Vertragsteil Sicherheit zu leisten, wenn sie sich binnen sechs Monaten nach der Bekanntmachung der Eintragung zu diesem Zweck bei ihm melden."
    },
    {
      "date": "2025-02-26",
      "id": "102360",
      "original_text": "Sonstige Registerbekanntmachung\nRheinland-Pfalz Amtsgericht Ludwigshafen a.Rhein (Ludwigshafen) HRB 21845\nZigmo Engineering GmbH – Frankenthal",
      "type": "Sonstige Registerbekanntmachung",
      "state": "Rheinland-Pfalz",
      "amtsgericht": "Amtsgericht Ludwigshafen a.Rhein (Ludwigshafen)",
      "registernummer": "HRB 21845",
      "registerart": "HRB",
      "company_name": "Zigmo Engineering GmbH",
      "company_seat": "Frankenthal",
      "details": "26.02.2025 (Bekanntmachungsdatum)\n\nRheinland-Pfalz Amtsgericht Ludwigshafen a.Rhein (Ludwigshafen) HRB 21845\nSonstige Registerbekanntmachung 25.02.2025 (Eintragungsdatum)\n\nZigmo Engineering GmbH\nGesellschaft mit beschränkter Haftung\nFrankenthal\n\nAls nicht eingetragen wird veröffentlicht: Den Gläubigern der Gesellschaft, deren Forderungen begründet worden sind, bevor die Eintragung der Beendigung desGewinnabführungsvertrages in das Handelsregister nach § 10 des Handelsgesetzbuches als bekanntgemacht gilt, hat der andere Vertragsteil Sicherheit zu leisten, wenn sie sich binnen sechs Monaten nach der Bekanntmachung der Eintragung zu diesem Zweck bei ihm melden."
    },
    {
      "date": "2025-02-26",
      "id": "102361",
      "original_text": "Registerbekanntmachung nach dem Umwandlungsgesetz\nRheinland-Pfalz Amtsgericht Mainz GsR 273\nDynamedion eGbR – Mainz",
      "type": "Registerbekanntmachung nach dem Umwandlungsgesetz",
      "state": "Rheinland-Pfalz",
      "amtsgericht": "Amtsgericht Mainz",
      "registernummer": "GsR 273",
      "registerart": "GsR",
      "company_name": "Dynamedion eGbR",
      "company_seat": "Mainz",
      "details": "26.02.2025 (Bekanntmachungsdatum)\n\nRheinland-Pfalz Amtsgericht Mainz GsR 273\nRegisterbekanntmachung nach dem Umwandlungsgesetz 26.02.2025 (Eintragungsdatum)\n\nDynamedion eGbR\nGesellschaft bürgerlichen Rechts\nMainz\n\nAls nicht eingetragen wird veröffentlicht: Den Gläubigern der an der Spaltung beteiligten Rechtsträger ist, wenn sie binnen sechs Monaten nach dem Tag, an dem die Eintragung der Spaltung in das Register des Sitzes desjenigen Rechtsträgers, dessen Gläubiger sie sind, nach § 19 Abs. 3 UmwG als bekanntgemacht gilt, ihren Anspruch nach Grund und Höhe schriftlich anmelden, Sicherheit zu leisten, soweit sie nicht Befriedigung verlangen können. Dieses Recht steht den Gläubigern jedoch nur zu, wenn sie glaubhaft machen, dass durch die Spaltung die Erfüllung der orderung gefährdet wird."
    },
    {
      "date": "2025-02-26",
      "id": "102362",
      "original_text": "Einreichung neuer Dokumente\nRheinland-Pfalz Amtsgericht Mainz HRB 44387\npanem AG – Mainz",
      "type": "Einreichung neuer Dokumente",
      "state": "Rheinland-Pfalz",
      "amtsgericht": "Amtsgericht Mainz",
      "registernummer": "HRB 44387",
      "registerart": "HRB",
      "company_name": "panem AG",
      "company_seat": "Mainz",
      "details": "26.02.2025 (Bekanntmachungsdatum)\n\nRheinland-Pfalz Amtsgericht Mainz HRB 44387\nEinreichung neuer Dokumente\n\npanem AG\nAktiengesellschaft\nMainz\n\nDem Registergericht ist eine neue Liste der Mitglieder des Aufsichtsrates eingereicht worden."
    },
    {
      "date": "2025-02-26",
      "id": "102363",
      "original_text": "Einreichung neuer Dokumente\nNordrhein-Westfalen Amtsgericht Düren HRB 621\nRurtalwerkstätten Lebenshilfe Düren gemeinnützige GmbH – Düren",
      "type": "Einreichung neuer Dokumente",
      "state": "Nordrhein-Westfalen",
      "amtsgericht": "Amtsgericht Düren",
      "registernummer": "HRB 621",
      "registerart": "HRB",
      "company_name": "Rurtalwerkstätten Lebenshilfe Düren gemeinnützige GmbH",
      "company_seat": "Düren",
      "details": "26.02.2025 (Bekanntmachungsdatum)\n\nNordrhein-Westfalen Amtsgericht Düren HRB 621\nEinreichung neuer Dokumente 26.02.2025 (Eintragungsdatum)\n\nRurtalwerkstätten Lebenshilfe Düren gemeinnützige GmbH\nGesellschaft mit beschränkter Haftung\nDüren\n\nDem Registergericht ist eine neue Liste der Mitglieder des Aufsichtsrates eingereicht worden."
    },
    {
      "date": "2025-02-26",
      "id": "102364",
      "original_text": "Löschungsankündigung\nNordrhein-Westfalen Amtsgericht Bonn HRB 16411\nNeziri Baugesellschaft mbH – Bonn",
      "type": "Löschungsankündigung",
      "state": "Nordrhein-Westfalen",
      "amtsgericht": "Amtsgericht Bonn",
      "registernummer": "HRB 16411",
      "registerart": "HRB",
      "company_name": "Neziri Baugesellschaft mbH",
      "company_seat": "Bonn",
      "details": "26.02.2025 (Bekanntmachungsdatum)\n\nNordrhein-Westfalen Amtsgericht Bonn HRB 16411\nLöschungsankündigung\n\nNeziri Baugesellschaft mbH\nGesellschaft mit beschränkter Haftung\nBonn\n\nDas Registergericht beabsichtigt die Gesellschaft von Amts wegen nach § 394 FamFG zu löschen. Die Frist zur Erhebung eines Widerspruchs ist auf einen Monat festgesetzt."
    },
    {
      "date": "2025-02-26",
      "id": "102365",
      "original_text": "Löschungsankündigung\nNordrhein-Westfalen Amtsgericht Gelsenkirchen VR 13739 früher Amtsgericht Dorsten\nVerein zur Förderung und Unterstützung des Luftsports und von den Luftsport betreffenden Kulturwerten in Nordrhein-Westfalen e.V. – Dorsten",
      "type": "Löschungsankündigung",
      "state": "Nordrhein-Westfalen",
      "amtsgericht": "Amtsgericht Gelsenkirchen",
      "registernummer": "VR 13739",
      "registerart": "VR",
      "company_name": "Verein zur Förderung und Unterstützung des Luftsports und von den Luftsport betreffenden Kulturwerten in Nordrhein-Westfalen e.V.",
      "company_seat": "Dorsten",
      "former_amtsgericht": "Dorsten",
      "details": "26.02.2025 (Bekanntmachungsdatum)\n\nNordrhein-Westfalen Amtsgericht Gelsenkirchen VR 13739 früher Amtsgericht Dorsten\nLöschungsankündigung\n\nVerein zur Förderung und Unterstützung des Luftsports und von den Luftsport betreffenden Kulturwerten in Nordrhein-Westfalen e.V.\neingetragener Verein\nDorsten\n\nDas Amtsgericht Gelsenkirchen als Registergericht beabsichtigt, den in seinem Vereinsregister unter der Nr. VR 1379 eingetragenen Verein zur Förderung und Unterstützung des Luftsports und von den Luftsport betreffenden Kulturwerten in Nordrhein-Westfalen e.V. gemäß § 395 FamFG wegen Wegfalls sämtlicher Mitglieder von Amts wegen zu löschen.\n\nEs wird denen, die ein berechtigtes Interesse an der Unterlassung der Löschung haben, zur etwaigen Geltendmachung eines Widerspruchs eine Frist von 1 Monat gesetzt."
    },
    {
      "date": "2025-02-26",
      "id": "102366",
      "original_text": "Einreichung neuer Dokumente\nNordrhein-Westfalen Amtsgericht Köln HRB 100486\nZurich Deutscher Herold Lebensversicherung Aktiengesellschaft – Köln",
      "type": "Einreichung neuer Dokumente",
      "state": "Nordrhein-Westfalen",
      "amtsgericht": "Amtsgericht Köln",
      "registernummer": "HRB 100486",
      "registerart": "HRB",
      "company_name": "Zurich Deutscher Herold Lebensversicherung Aktiengesellschaft",
      "company_seat": "Köln",
      "details": "26.02.2025 (Bekanntmachungsdatum)\n\nNordrhein-Westfalen Amtsgericht Köln HRB 100486\nEinreichung neuer Dokumente\n\nZurich Deutscher Herold Lebensversicherung Aktiengesellschaft\nAktiengesellschaft\nKöln\n\nDem Registergericht ist eine Liste der Mitglieder des Aufsichtsrates eingereicht worden."
    },
    {
      "date": "2025-02-26",
      "id": "102367",
      "original_text": "Löschungsankündigung\nNordrhein-Westfalen Amtsgericht Neuss HRB 20308\nIntermodal Telematics GmbH – Neuss",
      "type": "Löschungsankündigung",
      "state": "Nordrhein-Westfalen",
      "amtsgericht": "Amtsgericht Neuss",
      "registernummer": "HRB 20308",
      "registerart": "HRB",
      "company_name": "Intermodal Telematics GmbH",
      "company_seat": "Neuss",
      "details": "26.02.2025 (Bekanntmachungsdatum)\n\nNordrhein-Westfalen Amtsgericht Neuss HRB 20308\nLöschungsankündigung\n\nIntermodal Telematics GmbH\nGesellschaft mit beschränkter Haftung\nNeuss\n\nHandelsregistersache\nIntermodal Telematics GmbH\nEs ist beabsichtigt, die im Handelsregister eingetragene Gesellschaft gemäß § 394 Absatz 1 FamFG wegen Vermögenslosigkeit von Amts wegen zu löschen.\nFrist zur Geltendmachung eines Widerspruchs: 1 Monat\nRechtsbehelfsbelehrung:\nGegen diese Verfügung können Sie Widerspruch einlegen. Der Widerspruch ist bei dem Amtsgericht Neuss, Breite Straße 48, 41460 Neuss schriftlich in deutscher Sprache oder zur Niederschrift der Geschäftsstelle einzulegen. Der Widerspruch kann auch zur Niederschrift der Geschäftsstelle eines jeden Amtsgerichtes abgegeben werden. Die Einlegung ist auch durch Übertragung eines elektronischen Dokuments an die elektronische Poststelle des Gerichts möglich. Das elektronische Dokument muss für die Bearbeitung durch das Gericht geeignet und mit einer qualifizierten elektronischen Signatur der verantwortenden Person versehen sein oder von der verantwortenden Person signiert und auf einem sicheren Übermittlungsweg gemäß § 130a ZPO nach näherer Maßgabe der Verordnung über die technischen Rahmenbedingungen des elektronischen Rechtsverkehrs und über das besondere elektronische Behördenpostfach (BGBl. I, S.3803) eingereicht werden. Weitere Informationen erhalten Sie auf der Internetseite www.justiz.de.\nDer Widerspruch muss spätestens innerhalb der gesetzten Frist bei dem Amtsgericht Neuss eingegangen sein. Dies gilt auch dann, wenn der Widerspruch zur Niederschrift der Geschäftsstelle eines anderen Amtsgerichtes abgegeben wurde. Die Frist beginnt mit der Veröffentlichung. Fällt das Ende der Frist auf einen Sonntag, einen allgemeinen Feiertag oder Sonnabend, so endet die Frist mit Ablauf des nächsten Werktages. Der Widerspruch muss die Bezeichnung der angefochtenen Verfügung sowie die Erklärung enthalten, dass Widerspruch gegen diese Verfügung eingelegt wird. Er ist zu unterzeichnen und soll begründet werden."
    },
    {
      "date": "2025-02-26",
      "id": "102368",
      "original_text": "Löschungsankündigung\nNordrhein-Westfalen Amtsgericht Krefeld HRB 17594\nADVS Deutschland GmbH – Krefeld",
      "type": "Löschungsankündigung",
      "state": "Nordrhein-Westfalen",
      "amtsgericht": "Amtsgericht Krefeld",
      "registernummer": "HRB 17594",
      "registerart": "HRB",
      "company_name": "ADVS Deutschland GmbH",
      "company_seat": "Krefeld",
      "details": "26.02.2025 (Bekanntmachungsdatum)\n\nNordrhein-Westfalen Amtsgericht Krefeld HRB 17594\nLöschungsankündigung\n\nADVS Deutschland GmbH\nGesellschaft mit beschränkter Haftung\nKrefeld\n\nDas Registergericht beabsichtigt die Gesellschaft von Amts wegen nach § 394 FamFG zu löschen. Die Frist zur Erhebung eines Widerspruchs ist auf einen Monat festgesetzt."
    },
    {
      "date": "2025-02-26",
      "id": "102369",
      "original_text": "Einreichung neuer Dokumente\nNordrhein-Westfalen Amtsgericht Iserlohn HRB 5726\nGrohe AG – Hemer",
      "type": "Einreichung neuer Dokumente",
      "state": "Nordrhein-Westfalen",
      "amtsgericht": "Amtsgericht Iserlohn",
      "registernummer": "HRB 5726",
      "registerart": "HRB",
      "company_name": "Grohe AG",
      "company_seat": "Hemer",
      "details": "26.02.2025 (Bekanntmachungsdatum)\n\nNordrhein-Westfalen Amtsgericht Iserlohn HRB 5726\nEinreichung neuer Dokumente\n\nGrohe AG\nAktiengesellschaft\nHemer\n\nDem Registergericht ist eine neue Liste der Mitglieder des Aufsichtsrates eingereicht worden."
    },
    {
      "date": "2025-02-26",
      "id": "102370",
      "original_text": "Registerbekanntmachung nach dem Umwandlungsgesetz\nNordrhein-Westfalen Amtsgericht Paderborn HRB 10322\nEvangelisches Krankenhaus Lippstadt gemeinnützige GmbH – Lippstadt",
      "type": "Registerbekanntmachung nach dem Umwandlungsgesetz",
      "state": "Nordrhein-Westfalen",
      "amtsgericht": "Amtsgericht Paderborn",
      "registernummer": "HRB 10322",
      "registerart": "HRB",
      "company_name": "Evangelisches Krankenhaus Lippstadt gemeinnützige GmbH",
      "company_seat": "Lippstadt",
      "details": "26.02.2025 (Bekanntmachungsdatum)\n\nNordrhein-Westfalen Amtsgericht Paderborn HRB 10322\nRegisterbekanntmachung nach dem Umwandlungsgesetz 26.02.2025 (Eintragungsdatum)\n\nEvangelisches Krankenhaus Lippstadt gemeinnützige GmbH\nGesellschaft mit beschränkter Haftung\nLippstadt\n\nDen Gläubigern der an der Abspaltung beteiligten Rechtsträger ist, wenn sie binnen sechs Monaten nach dem Tag, an dem die Eintragung der Abspaltung in das Register des Sitzes desjenigen Rechtsträgers, dessen Gläubiger sie sind, nach § 19 Absatz 3 UmwG als bekanntgemacht gilt, ihren Anspruch nach Grund und Höhe schriftlich anmelden, Sicherheit zu leisten, soweit sie nicht Befriedigung verlangen können. Dieses Recht steht den Gläubigern jedoch nur zu, wenn sie glaubhaft machen, dass durch die Abspaltung die Erfüllung ihrer Forderung gefährdet wird."
    },
    {
      "date": "2025-02-26",
      "id": "102371",
      "original_text": "Sonstige Registerbekanntmachung\nNordrhein-Westfalen Amtsgericht Düsseldorf HRB 20937\nGesellschaft Deutscher Krankenhaustag mbH – Düsseldorf",
      "type": "Sonstige Registerbekanntmachung",
      "state": "Nordrhein-Westfalen",
      "amtsgericht": "Amtsgericht Düsseldorf",
      "registernummer": "HRB 20937",
      "registerart": "HRB",
      "company_name": "Gesellschaft Deutscher Krankenhaustag mbH",
      "company_seat": "Düsseldorf",
      "details": "26.02.2025 (Bekanntmachungsdatum)\n\nNordrhein-Westfalen Amtsgericht Düsseldorf HRB 20937\nSonstige Registerbekanntmachung\n\nGesellschaft Deutscher Krankenhaustag mbH\nGesellschaft mit beschränkter Haftung\nDüsseldorf\n\nDem Registergericht ist eine Liste der Mitglieder des Verwaltungsrates eingereicht worden."
    },
    {
      "date": "2025-02-26",
      "id": "102372",
      "original_text": "Sonstige Registerbekanntmachung\nNordrhein-Westfalen Amtsgericht Düsseldorf HRB 54127\nISS Facility Services Holding GmbH – Düsseldorf",
      "type": "Sonstige Registerbekanntmachung",
      "state": "Nordrhein-Westfalen",
      "amtsgericht": "Amtsgericht Düsseldorf",
      "registernummer": "HRB 54127",
      "registerart": "HRB",
      "company_name": "ISS Facility Services Holding GmbH",
      "company_seat": "Düsseldorf",
      "details": "26.02.2025 (Bekanntmachungsdatum)\n\nNordrhein-Westfalen Amtsgericht Düsseldorf HRB 54127\nSonstige Registerbekanntmachung\n\nISS Facility Services Holding GmbH\nGesellschaft mit beschränkter Haftung\nDüsseldorf\n\nDem Registergericht ist eine Liste der Mitglieder des Aufsichtsrates eingereicht worden."
    },
    {
      "date": "2025-02-26",
      "id": "102373",
      "original_text": "Löschungsankündigung\nNordrhein-Westfalen Amtsgericht Essen HRB 25316\nNumberOneRecords UG (haftungsbeschränkt) – Essen",
      "type": "Löschungsankündigung",
      "state": "Nordrhein-Westfalen",
      "amtsgericht": "Amtsgericht Essen",
      "registernummer": "HRB 25316",
      "registerart": "HRB",
      "company_name": "NumberOneRecords UG (haftungsbeschränkt)",
      "company_seat": "Essen",
      "details": "26.02.2025 (Bekanntmachungsdatum)\n\nNordrhein-Westfalen Amtsgericht Essen HRB 25316\nLöschungsankündigung\n\nNumberOneRecords UG (haftungsbeschränkt)\nGesellschaft mit beschränkter Haftung\nEssen\n\nDas Registergericht beabsichtigt die Gesellschaft von Amts wegen nach § 394 FamFG zu löschen. Die Frist zur Erhebung eines Widerspruchs ist auf einen Monat festgesetzt."
    },
    {
      "date": "2025-02-26",
      "id": "102374",
      "original_text": "Löschungsankündigung\nNordrhein-Westfalen Amtsgericht Köln HRA 18566\nPaul Kretzer GmbH & Co. KG – Brühl",
      "type": "Löschungsankündigung",
      "state": "Nordrhein-Westfalen",
      "amtsgericht": "Amtsgericht Köln",
      "registernummer": "HRA 18566",
      "registerart": "HRA",
      "company_name": "Paul Kretzer GmbH & Co. KG",
      "company_seat": "Brühl",
      "details": "26.02.2025 (Bekanntmachungsdatum)\n\nNordrhein-Westfalen Amtsgericht Köln HRA 18566\nLöschungsankündigung 26.02.2025 (Eintragungsdatum)\n\nPaul Kretzer GmbH & Co. KG\nKommanditgesellschaft\nBrühl\n\nDas Registergericht beabsichtigt nachfolgende Firmen von Amts wegen wegen Vermögenslosigkeit nach § 31 Abs. 2 HGB zu löschen. Die Frist zur Erhebung eines Widerspruchs ist auf 1 Monat festgesetzt."
    },
    {
      "date": "2025-02-26",
      "id": "102375",
      "original_text": "Einreichung neuer Dokumente\nNordrhein-Westfalen Amtsgericht Essen HRB 16795\nMedicalContact AG – Essen",
      "type": "Einreichung neuer Dokumente",
      "state": "Nordrhein-Westfalen",
      "amtsgericht": "Amtsgericht Essen",
      "registernummer": "HRB 16795",
      "registerart": "HRB",
      "company_name": "MedicalContact AG",
      "company_seat": "Essen",
      "details": "26.02.2025 (Bekanntmachungsdatum)\n\nNordrhein-Westfalen Amtsgericht Essen HRB 16795\nEinreichung neuer Dokumente\n\nMedicalContact AG\nAktiengesellschaft\nEssen\n\nDem Registergericht ist eine neue Liste der Mitglieder des Aufsichtsrates eingereicht worden."
    },
    {
      "date": "2025-02-26",
      "id": "102376",
      "original_text": "Registerbekanntmachung nach dem Umwandlungsgesetz\nNordrhein-Westfalen Amtsgericht Köln HRB 54441\nC+C Systems GmbH – Köln",
      "type": "Registerbekanntmachung nach dem Umwandlungsgesetz",
      "state": "Nordrhein-Westfalen",
      "amtsgericht": "Amtsgericht Köln",
      "registernummer": "HRB 54441",
      "registerart": "HRB",
      "company_name": "C+C Systems GmbH",
      "company_seat": "Köln",
      "details": "26.02.2025 (Bekanntmachungsdatum)\n\nNordrhein-Westfalen Amtsgericht Köln HRB 54441\nRegisterbekanntmachung nach dem Umwandlungsgesetz 26.02.2025 (Eintragungsdatum)\n\nC+C Systems GmbH\nGesellschaft mit beschränkter Haftung\nKöln\n\nDen Gläubigern der an der Verschmelzung beteiligten Rechtsträger ist, wenn sie binnen sechs Monaten nach dem Tag, an dem die Eintragung der Verschmelzung in das Register des Sitzes desjenigen Rechtsträgers, dessen Gläubiger sie sind, nach § 19 Absatz 3 UmwG als bekanntgemacht gilt, ihren Anspruch nach Grund und Höhe schriftlich anmelden, Sicherheit zu leisten, soweit sie nicht Befriedigung verlangen können. Dieses Recht steht den Gläubigern jedoch nur zu, wenn sie glaubhaft machen, dass durch die Verschmelzung die Erfüllung ihrer Forderung gefährdet wird."
    },
    {
      "date": "2025-02-26",
      "id": "102377",
      "original_text": "Sonstige Registerbekanntmachung\nNordrhein-Westfalen Amtsgericht Köln HRB 119233\nConnect One Digital AG – Köln",
      "type": "Sonstige Registerbekanntmachung",
      "state": "Nordrhein-Westfalen",
      "amtsgericht": "Amtsgericht Köln",
      "registernummer": "HRB 119233",
      "registerart": "HRB",
      "company_name": "Connect One Digital AG",
      "company_seat": "Köln",
      "details": "26.02.2025 (Bekanntmachungsdatum)\n\nNordrhein-Westfalen Amtsgericht Köln HRB 119233\nSonstige Registerbekanntmachung 26.02.2025 (Eintragungsdatum)\n\nConnect One Digital AG\nAktiengesellschaft\nKöln\n\nDem Registergericht ist eine Liste der Mitglieder des Aufsichtsrates eingereicht worden."
    },
    {
      "date": "2025-02-26",
      "id": "102378",
      "original_text": "Löschungsankündigung\nNordrhein-Westfalen Amtsgericht Bielefeld HRB 43374\nBMC-Immo GmbH – Bielefeld",
      "type": "Löschungsankündigung",
      "state": "Nordrhein-Westfalen",
      "amtsgericht": "Amtsgericht Bielefeld",
      "registernummer": "HRB 43374",
      "registerart": "HRB",
      "company_name": "BMC-Immo GmbH",
      "company_seat": "Bielefeld",
      "details": "26.02.2025 (Bekanntmachungsdatum)\n\nNordrhein-Westfalen Amtsgericht Bielefeld HRB 43374\nLöschungsankündigung\n\nBMC-Immo GmbH\nGesellschaft mit beschränkter Haftung\nBielefeld\n\nDas Registergericht beabsichtigt die Gesellschaft von Amts wegen nach § 394 FamFG zu löschen. Die Frist zur Erhebung eines Widerspruchs ist auf 6 Wochen festgesetzt."
    },
    {
      "date": "2025-02-26",
      "id": "102379",
      "original_text": "Registerbekanntmachung nach dem Umwandlungsgesetz\nNordrhein-Westfalen Amtsgericht Köln HRB 68441\naprodi GmbH – Gummersbach",
      "type": "Registerbekanntmachung nach dem Umwandlungsgesetz",
      "state": "Nordrhein-Westfalen",
      "amtsgericht": "Amtsgericht Köln",
      "registernummer": "HRB 68441",
      "registerart": "HRB",
      "company_name": "aprodi GmbH",
      "company_seat": "Gummersbach",
      "details": "26.02.2025 (Bekanntmachungsdatum)\n\nNordrhein-Westfalen Amtsgericht Köln HRB 68441\nRegisterbekanntmachung nach dem Umwandlungsgesetz 26.02.2025 (Eintragungsdatum)\n\naprodi GmbH\nGesellschaft mit beschränkter Haftung\nGummersbach\n\nDen Gläubigern der an der Verschmelzung beteiligten Rechtsträger ist, wenn sie binnen sechs Monaten nach dem Tag, an dem die Eintragung der Verschmelzung in das Register des Sitzes desjenigen Rechtsträgers, dessen Gläubiger sie sind, nach § 19 Absatz 3 UmwG als bekanntgemacht gilt, ihren Anspruch nach Grund und Höhe schriftlich anmelden, Sicherheit zu leisten, soweit sie nicht Befriedigung verlangen können. Dieses Recht steht den Gläubigern jedoch nur zu, wenn sie glaubhaft machen, dass durch die Verschmelzung die Erfüllung ihrer Forderung gefährdet wird."
    },
    {
      "date": "2025-02-26",
      "id": "102380",
      "original_text": "Registerbekanntmachung nach dem Umwandlungsgesetz\nNordrhein-Westfalen Amtsgericht Bad Oeynhausen HRB 12583\nGT-Heliflug GmbH – Porta Westfalica",
      "type": "Registerbekanntmachung nach dem Umwandlungsgesetz",
      "state": "Nordrhein-Westfalen",
      "amtsgericht": "Amtsgericht Bad Oeynhausen",
      "registernummer": "HRB 12583",
      "registerart": "HRB",
      "company_name": "GT-Heliflug GmbH",
      "company_seat": "Porta Westfalica",
      "details": "26.02.2025 (Bekanntmachungsdatum)\n\nNordrhein-Westfalen Amtsgericht Bad Oeynhausen HRB 12583\nRegisterbekanntmachung nach dem Umwandlungsgesetz 26.02.2025 (Eintragungsdatum)\n\nGT-Heliflug GmbH\nGesellschaft mit beschränkter Haftung\nPorta Westfalica\n\nDen Gläubigern der an der Verschmelzung beteiligten Rechtsträger ist, wenn sie binnen sechs Monaten nach dem Tag, an dem die Eintragung der Verschmelzung in das Register des Sitzes desjenigen Rechtsträgers, dessen Gläubiger sie sind, nach § 19 Absatz 3 UmwG als bekanntgemacht gilt, ihren Anspruch nach Grund und Höhe schriftlich anmelden, Sicherheit zu leisten, soweit sie nicht Befriedigung verlangen können. Dieses Recht steht den Gläubigern jedoch nur zu, wenn sie glaubhaft machen, dass durch die Verschmelzung die Erfüllung ihrer Forderung gefährdet wird."
    },
    {
      "date": "2025-02-26",
      "id": "102381",
      "original_text": "Löschungsankündigung\nNordrhein-Westfalen Amtsgericht Köln HRA 35610\nGastro GTX - NR GmbH & Co. KG – Köln",
      "type": "Löschungsankündigung",
      "state": "Nordrhein-Westfalen",
      "amtsgericht": "Amtsgericht Köln",
      "registernummer": "HRA 35610",
      "registerart": "HRA",
      "company_name": "Gastro GTX - NR GmbH & Co. KG",
      "company_seat": "Köln",
      "details": "26.02.2025 (Bekanntmachungsdatum)\n\nNordrhein-Westfalen Amtsgericht Köln HRA 35610\nLöschungsankündigung 26.02.2025 (Eintragungsdatum)\n\nGastro GTX - NR GmbH & Co. KG\nKommanditgesellschaft\nKöln\n\nDas Registergericht beabsichtigt nachfolgende Firmen von Amts wegen wegen Aufgabe des Geschäftsbetriebs nach § 31 Abs. 2 HGB zu löschen. Die Frist zur Erhebung eines Widerspruchs ist auf 4 Wochen festgesetzt."
    },
    {
      "date": "2025-02-26",
      "id": "102382",
      "original_text": "Registerbekanntmachung nach dem Umwandlungsgesetz\nNordrhein-Westfalen Amtsgericht Köln HRB 108706\nAHW Digital Services GmbH – Köln",
      "type": "Registerbekanntmachung nach dem Umwandlungsgesetz",
      "state": "Nordrhein-Westfalen",
      "amtsgericht": "Amtsgericht Köln",
      "registernummer": "HRB 108706",
      "registerart": "HRB",
      "company_name": "AHW Digital Services GmbH",
      "company_seat": "Köln",
      "details": "26.02.2025 (Bekanntmachungsdatum)\n\nNordrhein-Westfalen Amtsgericht Köln HRB 108706\nRegisterbekanntmachung nach dem Umwandlungsgesetz 26.02.2025 (Eintragungsdatum)\n\nAHW Digital Services GmbH\nGesellschaft mit beschränkter Haftung\nKöln\n\nDen Gläubigern der an der Verschmelzung beteiligten Rechtsträger ist, wenn sie binnen sechs Monaten nach dem Tag, an dem die Eintragung der Verschmelzung in das Register des Sitzes desjenigen Rechtsträgers, dessen Gläubiger sie sind, nach § 19 Absatz 3 UmwG als bekanntgemacht gilt, ihren Anspruch nach Grund und Höhe schriftlich anmelden, Sicherheit zu leisten, soweit sie nicht Befriedigung verlangen können. Dieses Recht steht den Gläubigern jedoch nur zu, wenn sie glaubhaft machen, dass durch die Verschmelzung die Erfüllung ihrer Forderung gefährdet wird."
    },
    {
      "date": "2025-02-26",
      "id": "102383",
      "original_text": "Einreichung neuer Dokumente\nNordrhein-Westfalen Amtsgericht Bad Oeynhausen HRB 9336\nAufbaugemeinschaft Espelkamp Gesellschaft m.b.H. – Espelkamp",
      "type": "Einreichung neuer Dokumente",
      "state": "Nordrhein-Westfalen",
      "amtsgericht": "Amtsgericht Bad Oeynhausen",
      "registernummer": "HRB 9336",
      "registerart": "HRB",
      "company_name": "Aufbaugemeinschaft Espelkamp Gesellschaft m.b.H.",
      "company_seat": "Espelkamp",
      "details": "26.02.2025 (Bekanntmachungsdatum)\n\nNordrhein-Westfalen Amtsgericht Bad Oeynhausen HRB 9336\nEinreichung neuer Dokumente\n\nAufbaugemeinschaft Espelkamp Gesellschaft m.b.H.\nGesellschaft mit beschränkter Haftung\nEspelkamp\n\nDem Registergericht ist eine neue Liste der Mitglieder des Aufsichtsrates eingereicht worden."
    },
    {
      "date": "2025-02-26",
      "id": "102384",
      "original_text": "Registerbekanntmachung nach dem Umwandlungsgesetz\nNordrhein-Westfalen Amtsgericht Köln HRB 26718\nHEISOFT Publishing Aktiengesellschaft – Köln",
      "type": "Registerbekanntmachung nach dem Umwandlungsgesetz",
      "state": "Nordrhein-Westfalen",
      "amtsgericht": "Amtsgericht Köln",
      "registernummer": "HRB 26718",
      "registerart": "HRB",
      "company_name": "HEISOFT Publishing Aktiengesellschaft",
      "company_seat": "Köln",
      "details": "26.02.2025 (Bekanntmachungsdatum)\n\nNordrhein-Westfalen Amtsgericht Köln HRB 26718\nRegisterbekanntmachung nach dem Umwandlungsgesetz\n\nHEISOFT Publishing Aktiengesellschaft\nAktiengesellschaft\nKöln\n\nDem Registergericht ist der Entwurf eines Vertrages über die geplante Verschmelzung der dotcomCapital GmbH mit Sitz in Köln (Amtsgericht Köln, HRB 30583) mit der HEISOFT Publishing Aktiengesellschaft, dem die für den 28.03.2025 vorgesehene Hauptversammlung zustimmen soll, eingereicht worden."
    },
    {
      "date": "2025-02-26",
      "id": "102385",
      "original_text": "Löschungsankündigung\nNordrhein-Westfalen Amtsgericht Neuss HRB 18974\nDC Consulting GmbH – Neuss",
      "type": "Löschungsankündigung",
      "state": "Nordrhein-Westfalen",
      "amtsgericht": "Amtsgericht Neuss",
      "registernummer": "HRB 18974",
      "registerart": "HRB",
      "company_name": "DC Consulting GmbH",
      "company_seat": "Neuss",
      "details": "26.02.2025 (Bekanntmachungsdatum)\n\nNordrhein-Westfalen Amtsgericht Neuss HRB 18974\nLöschungsankündigung 25.02.2025 (Eintragungsdatum)\n\nDC Consulting GmbH\nGesellschaft mit beschränkter Haftung\nNeuss\n\nDas Registergericht beabsichtigt die Gesellschaft von Amts wegen nach § 394 FamFG zu löschen. Die Frist zur Erhebung eines Widerspruchs ist auf einen Monat festgesetzt. Rechtsbehelfsbelehrung: Gegen diese Verfügung können Sie Widerspruch einlegen. Der Widerspruch ist bei dem Amtsgericht Neuss - Registergericht -, Breite Str. 48, 41460 Neuss schriftlich in deutscher Sprache oder zur Niederschrift der Geschäftsstelle einzulegen. Der Widerspruch kann auch zur Niederschrift der Geschäftsstelle eines jeden Amtsgerichtes abgegeben werden. Die Einlegung ist auch durch Übertragung eines elektronischen Dokuments an die elektronische Poststelle des Gerichts möglich. Das elektronische Dokument muss für die Bearbeitung durch das Gericht geeignet und mit einer qualifizierten elektronischen Signatur der verantwortenden Person versehen sein oder von der verantwortenden Person signiert und auf einem sicheren Übermittlungsweg gemäß § 130a ZPO nach näherer Maßgabe der Verordnung über die technischen Rahmenbedingungen des elektronischen Rechtsverkehrs und über das besondere elektronische Behördenpostfach (BGBl. I, S.3803) eingereicht werden. Weitere Informationen erhalten Sie auf der Internetseite www.justiz.de. Der Widerspruch muss spätestens innerhalb der gesetzten Frist nach der schriftlichen Bekanntgabe der Verfügung bei dem Amtsgericht - Registergericht - Neuss eingegangen sein. Dies gilt auch dann, wenn der Widerspruch zur Niederschrift der Geschäftsstelle eines anderen Amtsgerichtes abgegeben wurde. Die Frist beginnt mit der schriftlichen Bekanntgabe der Verfügung. Die Bekanntgabe ist entweder durch Zustellung oder am dritten Tage nach Aufgabe zur Post bewirkt. Fällt das Ende der Frist auf einen Sonntag, einen allgemeinen Feiertag oder Sonnabend, so endet die Frist mit Ablauf des nächsten Werktages. Der Widerspruch muss die Bezeichnung der angefochtenen Verfügung sowie die Erklärung enthalten, dass Widerspruch gegen diese Verfügung eingelegt wird. Er ist zu unterzeichnen und soll begründet werden."
    },
    {
      "date": "2025-02-26",
      "id": "102386",
      "original_text": "Einreichung neuer Dokumente\nNordrhein-Westfalen Amtsgericht Essen HRB 35092\nconrizon AG – Essen",
      "type": "Einreichung neuer Dokumente",
      "state": "Nordrhein-Westfalen",
      "amtsgericht": "Amtsgericht Essen",
      "registernummer": "HRB 35092",
      "registerart": "HRB",
      "company_name": "conrizon AG",
      "company_seat": "Essen",
      "details": "26.02.2025 (Bekanntmachungsdatum)\n\nNordrhein-Westfalen Amtsgericht Essen HRB 35092\nEinreichung neuer Dokumente 26.02.2025 (Eintragungsdatum)\n\nconrizon AG\nAktiengesellschaft\nEssen\n\nDem Registergericht ist eine neue Liste der Mitglieder des Aufsichtsrates eingereicht worden."
    },
    {
      "date": "2025-02-26",
      "id": "102387",
      "original_text": "Registerbekanntmachung nach dem Umwandlungsgesetz\nNordrhein-Westfalen Amtsgericht Essen HRB 24458\nAurosan GmbH – Essen",
      "type": "Registerbekanntmachung nach dem Umwandlungsgesetz",
      "state": "Nordrhein-Westfalen",
      "amtsgericht": "Amtsgericht Essen",
      "registernummer": "HRB 24458",
      "registerart": "HRB",
      "company_name": "Aurosan GmbH",
      "company_seat": "Essen",
      "details": "26.02.2025 (Bekanntmachungsdatum)\n\nNordrhein-Westfalen Amtsgericht Essen HRB 24458\nRegisterbekanntmachung nach dem Umwandlungsgesetz 26.02.2025 (Eintragungsdatum)\n\nAurosan GmbH\nGesellschaft mit beschränkter Haftung\nEssen\n\nDen Gläubigern der an der Verschmelzung beteiligten Rechtsträger ist, wenn sie binnen sechs Monaten nach dem Tag, an dem die Eintragung der Verschmelzung in das Register des Sitzes desjenigen Rechtsträgers, dessen Gläubiger sie sind, nach § 19 Absatz 3 UmwG als bekanntgemacht gilt, ihren Anspruch nach Grund und Höhe schriftlich anmelden, Sicherheit zu leisten, soweit sie nicht Befriedigung verlangen können. Dieses Recht steht den Gläubigern jedoch nur zu, wenn sie glaubhaft machen, dass durch die Verschmelzung die Erfüllung ihrer Forderung gefährdet wird."
    },
    {
      "date": "2025-02-26",
      "id": "102388",
      "original_text": "Registerbekanntmachung nach dem Umwandlungsgesetz\nNordrhein-Westfalen Amtsgericht Köln HRA 30058\naprodi GmbH & Co. KG – Gummersbach",
      "type": "Registerbekanntmachung nach dem Umwandlungsgesetz",
      "state": "Nordrhein-Westfalen",
      "amtsgericht": "Amtsgericht Köln",
      "registernummer": "HRA 30058",
      "registerart": "HRA",
      "company_name": "aprodi GmbH & Co. KG",
      "company_seat": "Gummersbach",
      "details": "26.02.2025 (Bekanntmachungsdatum)\n\nNordrhein-Westfalen Amtsgericht Köln HRA 30058\nRegisterbekanntmachung nach dem Umwandlungsgesetz 26.02.2025 (Eintragungsdatum)\n\naprodi GmbH & Co. KG\nKommanditgesellschaft\nGummersbach\n\nDen Gläubigern der an der Verschmelzung beteiligten Rechtsträger ist, wenn sie binnen sechs Monaten nach dem Tag, an dem die Eintragung der Verschmelzung in das Register des Sitzes desjenigen Rechtsträgers, dessen Gläubiger sie sind, nach § 19 Absatz 3 UmwG als bekanntgemacht gilt, ihren Anspruch nach Grund und Höhe schriftlich anmelden, Sicherheit zu leisten, soweit sie nicht Befriedigung verlangen können. Dieses Recht steht den Gläubigern jedoch nur zu, wenn sie glaubhaft machen, dass durch die Verschmelzung die Erfüllung ihrer Forderung gefährdet wird."
    },
    {
      "date": "2025-02-26",
      "id": "102389",
      "original_text": "Löschungsankündigung\nNordrhein-Westfalen Amtsgericht Düren HRB 7882\nElektro Schoeller Verwaltungs- und Beteiligungs- GmbH – Düren",
      "type": "Löschungsankündigung",
      "state": "Nordrhein-Westfalen",
      "amtsgericht": "Amtsgericht Düren",
      "registernummer": "HRB 7882",
      "registerart": "HRB",
      "company_name": "Elektro Schoeller Verwaltungs- und Beteiligungs- GmbH",
      "company_seat": "Düren",
      "details": "26.02.2025 (Bekanntmachungsdatum)\n\nNordrhein-Westfalen Amtsgericht Düren HRB 7882\nLöschungsankündigung 26.02.2025 (Eintragungsdatum)\n\nElektro Schoeller Verwaltungs- und Beteiligungs- GmbH\nGesellschaft mit beschränkter Haftung\nDüren\n\nDas Registergericht beabsichtigt die Gesellschaft von Amts wegen nach § 394 FamFG zu löschen. Die Frist zur Erhebung eines Widerspruchs ist auf drei Monate festgesetzt."
    },
    {
      "date": "2025-02-26",
      "id": "102390",
      "original_text": "Einreichung neuer Dokumente\nThüringen Amtsgericht Jena HRB 509288\nFLoH GmbH – Sollstedt",
      "type": "Einreichung neuer Dokumente",
      "state": "Thüringen",
      "amtsgericht": "Amtsgericht Jena",
      "registernummer": "HRB 509288",
      "registerart": "HRB",
      "company_name": "FLoH GmbH",
      "company_seat": "Sollstedt",
      "details": "26.02.2025 (Bekanntmachungsdatum)\n\nThüringen Amtsgericht Jena HRB 509288\nEinreichung neuer Dokumente\n\nFLoH GmbH\nGesellschaft mit beschränkter Haftung\nSollstedt\n\nBekanntmachung gem. § 52 Abs. 3 Satz 2 GmbHG: Aufgrund einer Veränderung in den Personen der Aufsichtsratsmitglieder ist durch die Geschäftsführer eine neue Liste zum Handelsregister eingereicht worden."
    },
    {
      "date": "2025-02-26",
      "id": "102391",
      "original_text": "Sonstige Registerbekanntmachung\nThüringen Amtsgericht Jena HRB 102199\nDyckerhoff Kieswerk Leubingen GmbH – Sömmerda",
      "type": "Sonstige Registerbekanntmachung",
      "state": "Thüringen",
      "amtsgericht": "Amtsgericht Jena",
      "registernummer": "HRB 102199",
      "registerart": "HRB",
      "company_name": "Dyckerhoff Kieswerk Leubingen GmbH",
      "company_seat": "Sömmerda",
      "details": "26.02.2025 (Bekanntmachungsdatum)\n\nThüringen Amtsgericht Jena HRB 102199\nSonstige Registerbekanntmachung 26.02.2025 (Eintragungsdatum)\n\nDyckerhoff Kieswerk Leubingen GmbH\nGesellschaft mit beschränkter Haftung\nSömmerda\n\nNicht eingetragen: Den Gläubigern der Gesellschaft, deren Forderungen begründet worden sind, bevor die Eintragung der Beendigung des Vertrages in das Handelsregister nach § 10 des Handelsgesetzbuches als bekanntgemacht gilt, hat der andere Vertragsteil Sicherheit zu leisten, wenn sie sich binnen sechs Monaten nach der Bekanntmachung der Eintragung zu diesem Zweck bei ihm melden."
    },
    {
      "date": "2025-02-26",
      "id": "102392",
      "original_text": "Sonstige Registerbekanntmachung\nThüringen Amtsgericht Eisenach VR 311067\nFörderverein Freibad Werra-Suhl-Tal – Werra-Suhl-Tal",
      "type": "Sonstige Registerbekanntmachung",
      "state": "Thüringen",
      "amtsgericht": "Amtsgericht Eisenach",
      "registernummer": "VR 311067",
      "registerart": "VR",
      "company_name": "Förderverein Freibad Werra-Suhl-Tal",
      "company_seat": "Werra-Suhl-Tal",
      "details": "26.02.2025 (Bekanntmachungsdatum)\n\nThüringen Amtsgericht Eisenach VR 311067\nSonstige Registerbekanntmachung 26.02.2025 (Eintragungsdatum)\n\nFörderverein Freibad Werra-Suhl-Tal\neingetragener Verein\nWerra-Suhl-Tal\n\nFörderverein Freibad Werra-Suhl-Tal, gegründet am 18.Sept.2024."
    },
    {
      "date": "2025-02-26",
      "id": "102393",
      "original_text": "Sonstige Registerbekanntmachung\nHessen Amtsgericht Offenbach am Main HRB 2245\nGBO Gemeinnützige Baugesellschaft mbH Offenbach – Offenbach am Main",
      "type": "Sonstige Registerbekanntmachung",
      "state": "Hessen",
      "amtsgericht": "Amtsgericht Offenbach am Main",
      "registernummer": "HRB 2245",
      "registerart": "HRB",
      "company_name": "GBO Gemeinnützige Baugesellschaft mbH Offenbach",
      "company_seat": "Offenbach am Main",
      "details": "26.02.2025 (Bekanntmachungsdatum)\n\nHessen Amtsgericht Offenbach am Main HRB 2245\nSonstige Registerbekanntmachung\n\nGBO Gemeinnützige Baugesellschaft mbH Offenbach\nGesellschaft mit beschränkter Haftung\nOffenbach am Main\n\nDurch eine Änderung in den Personen der Aufsichtsratsmitglieder ist eine Liste der Mitglieder des Aufsichtsrates zum Handelsregister eingereicht worden."
    },
    {
      "date": "2025-02-26",
      "id": "102394",
      "original_text": "Löschungsankündigung\nHessen Amtsgericht Frankfurt am Main HRB 128490\nCan Bau GmbH – Frankfurt am Main",
      "type": "Löschungsankündigung",
      "state": "Hessen",
      "amtsgericht": "Amtsgericht Frankfurt am Main",
      "registernummer": "HRB 128490",
      "registerart": "HRB",
      "company_name": "Can Bau GmbH",
      "company_seat": "Frankfurt am Main",
      "details": "26.02.2025 (Bekanntmachungsdatum)\n\nHessen Amtsgericht Frankfurt am Main HRB 128490\nLöschungsankündigung\n\nCan Bau GmbH\nGesellschaft mit beschränkter Haftung\nFrankfurt am Main\n\nDas Registergericht beabsichtigt die im Handelsregister eingetragene Gesellschaft von Amts wegen nach § 394 FamFG zu löschen. Die Frist zur Erhebung eines Widerspruchs gegen die beabsichtigte Löschung wird auf 1 Monat festgesetzt."
    },
    {
      "date": "2025-02-26",
      "id": "102395",
      "original_text": "Sonstige Registerbekanntmachung\nHessen Amtsgericht Offenbach am Main HRB 40025\nKallisto AG – Heusenstamm",
      "type": "Sonstige Registerbekanntmachung",
      "state": "Hessen",
      "amtsgericht": "Amtsgericht Offenbach am Main",
      "registernummer": "HRB 40025",
      "registerart": "HRB",
      "company_name": "Kallisto AG",
      "company_seat": "Heusenstamm",
      "details": "26.02.2025 (Bekanntmachungsdatum)\n\nHessen Amtsgericht Offenbach am Main HRB 40025\nSonstige Registerbekanntmachung\n\nKallisto AG\nAktiengesellschaft\nHeusenstamm\n\nDurch eine Änderung in den Personen der Aufsichtsratsmitglieder ist eine Liste der Mitglieder des Aufsichtsrates zum Handelsregister eingereicht worden."
    },
    {
      "date": "2025-02-26",
      "id": "102396",
      "original_text": "Löschungsankündigung\nHessen Amtsgericht Frankfurt am Main HRB 93040\nKUKI GmbH – Frankfurt am Main",
      "type": "Löschungsankündigung",
      "state": "Hessen",
      "amtsgericht": "Amtsgericht Frankfurt am Main",
      "registernummer": "HRB 93040",
      "registerart": "HRB",
      "company_name": "KUKI GmbH",
      "company_seat": "Frankfurt am Main",
      "details": "26.02.2025 (Bekanntmachungsdatum)\n\nHessen Amtsgericht Frankfurt am Main HRB 93040\nLöschungsankündigung\n\nKUKI GmbH\nGesellschaft mit beschränkter Haftung\nFrankfurt am Main\n\nDas Registergericht beabsichtigt die im Handelsregister eingetragene Gesellschaft von Amts wegen nach § 394 FamFG zu löschen. Die Frist zur Erhebung eines Widerspruchs gegen die beabsichtigte Löschung wird auf 1 Monat festgesetzt."
    },
    {
      "date": "2025-02-26",
      "id": "102397",
      "original_text": "Registerbekanntmachung nach dem Umwandlungsgesetz\nHessen Amtsgericht Hanau HRB 99626\nEdgeConneX Maintal 1 GmbH – Maintal",
      "type": "Registerbekanntmachung nach dem Umwandlungsgesetz",
      "state": "Hessen",
      "amtsgericht": "Amtsgericht Hanau",
      "registernummer": "HRB 99626",
      "registerart": "HRB",
      "company_name": "EdgeConneX Maintal 1 GmbH",
      "company_seat": "Maintal",
      "details": "26.02.2025 (Bekanntmachungsdatum)\n\nHessen Amtsgericht Hanau HRB 99626\nRegisterbekanntmachung nach dem Umwandlungsgesetz\n\nEdgeConneX Maintal 1 GmbH\nGesellschaft mit beschränkter Haftung\nMaintal\n\nDie Anteilsinhaber, die Gläubiger sowie die zuständigen Betriebsräte der an dem grenzüberschreitenden Formwechsel beteiligten Gesellschaft oder, soweit es keinen Betriebsrat gibt, die Arbeitnehmer der an dem grenzüberschreitenden Formwechsel beteiligten Gesellschaft, können der Gesellschaft spätestens fünf Arbeitstage vor dem Tag der Gesellschafterversammlung Bemerkungen zum Formwechselplan übermitteln."
    },
    {
      "date": "2025-02-26",
      "id": "102398",
      "original_text": "Sonstige Registerbekanntmachung\nHessen Amtsgericht Marburg VR 4927\nEigentümerverein Feriendorf Frankenau – Frankenau",
      "type": "Sonstige Registerbekanntmachung",
      "state": "Hessen",
      "amtsgericht": "Amtsgericht Marburg",
      "registernummer": "VR 4927",
      "registerart": "VR",
      "company_name": "Eigentümerverein Feriendorf Frankenau",
      "company_seat": "Frankenau",
      "details": "26.02.2025 (Bekanntmachungsdatum)\n\nHessen Amtsgericht Marburg VR 4927\nSonstige Registerbekanntmachung 26.02.2025 (Eintragungsdatum)\n\nEigentümerverein Feriendorf Frankenau\neingetragener Verein\nFrankenau\n\nDer Verein ist aufgelöst."
    },
    {
      "date": "2025-02-26",
      "id": "102399",
      "original_text": "Löschungsankündigung\nHessen Amtsgericht Hanau HRB 94971\nMajik GmbH – Hanau",
      "type": "Löschungsankündigung",
      "state": "Hessen",
      "amtsgericht": "Amtsgericht Hanau",
      "registernummer": "HRB 94971",
      "registerart": "HRB",
      "company_name": "Majik GmbH",
      "company_seat": "Hanau",
      "details": "26.02.2025 (Bekanntmachungsdatum)\n\nHessen Amtsgericht Hanau HRB 94971\nLöschungsankündigung\n\nMajik GmbH\nGesellschaft mit beschränkter Haftung\nHanau\n\nDas Registergericht beabsichtigt die im Handelsregister eingetragene Gesellschaft von Amts wegen nach § 394 FamFG zu löschen. Die Frist zur Erhebung eines Widerspruchs gegen die beabsichtigte Löschung wird auf 3 Monate festgesetzt."
    },
    {
      "date": "2025-02-26",
      "id": "102400",
      "original_text": "Sonstige Registerbekanntmachung\nHessen Amtsgericht Wetzlar VR 807\nKleingartenverein Mehlbachtal e.V. – Wetzlar",
      "type": "Sonstige Registerbekanntmachung",
      "state": "Hessen",
      "amtsgericht": "Amtsgericht Wetzlar",
      "registernummer": "VR 807",
      "registerart": "VR",
      "company_name": "Kleingartenverein Mehlbachtal e.V.",
      "company_seat": "Wetzlar",
      "details": "26.02.2025 (Bekanntmachungsdatum)\n\nHessen Amtsgericht Wetzlar VR 807\nSonstige Registerbekanntmachung 26.02.2025 (Eintragungsdatum)\n\nKleingartenverein Mehlbachtal e.V.\neingetragener Verein\nWetzlar\n\nDer Verein ist aufgelöst."
    },
    {
      "date": "2025-02-26",
      "id": "102401",
      "original_text": "Löschungsankündigung\nHessen Amtsgericht Bad Hersfeld HRB 3089\nLoFTfit Bad Hersfeld GmbH – Bad Hersfeld",
      "type": "Löschungsankündigung",
      "state": "Hessen",
      "amtsgericht": "Amtsgericht Bad Hersfeld",
      "registernummer": "HRB 3089",
      "registerart": "HRB",
      "company_name": "LoFTfit Bad Hersfeld GmbH",
      "company_seat": "Bad Hersfeld",
      "details": "26.02.2025 (Bekanntmachungsdatum)\n\nHessen Amtsgericht Bad Hersfeld HRB 3089\nLöschungsankündigung 26.02.2025 (Eintragungsdatum)\n\nLoFTfit Bad Hersfeld GmbH\nGesellschaft mit beschränkter Haftung\nBad Hersfeld\n\nDas Registergericht beabsichtigt die im Handelsregister eingetragene Gesellschaft von Amts wegen nach § 394 FamFG zu löschen. Die Frist zur Erhebung eines Widerspruchs gegen die beabsichtigte Löschung wird auf 6 Wochen festgesetzt."
    },
    {
      "date": "2025-02-26",
      "id": "102402",
      "original_text": "Registerbekanntmachung nach dem Umwandlungsgesetz\nHessen Amtsgericht Frankfurt am Main HRB 131714\nsheego AG – Frankfurt am Main",
      "type": "Registerbekanntmachung nach dem Umwandlungsgesetz",
      "state": "Hessen",
      "amtsgericht": "Amtsgericht Frankfurt am Main",
      "registernummer": "HRB 131714",
      "registerart": "HRB",
      "company_name": "sheego AG",
      "company_seat": "Frankfurt am Main",
      "details": "26.02.2025 (Bekanntmachungsdatum)\n\nHessen Amtsgericht Frankfurt am Main HRB 131714\nRegisterbekanntmachung nach dem Umwandlungsgesetz 26.02.2025 (Eintragungsdatum)\n\nsheego AG\nAktiengesellschaft\nFrankfurt am Main\n\nDen Gläubigern der an der formwechselnden Umwandlung beteiligten Rechtsträger ist, wenn sie binnen sechs Monaten nach dem Tag, an dem die Eintragung der formwechselnden Umwandlung in das Register des Sitzes desjenigen Rechtsträgers, dessen Gläubiger sie sind, nach § 201 UmwG bekannt gemacht worden ist, ihren Anspruch nach Grund und Höhe schriftlich anmelden, Sicherheit zu leisten, soweit sie nicht Befriedigung verlangen können. Dieses Recht steht den Gläubigern jedoch nur zu, wenn sie glaubhaft machen, dass durch die formwechselnden Umwandlung die Erfüllung ihrer Forderung gefährdet wird."
    },
    {
      "date": "2025-02-26",
      "id": "102403",
      "original_text": "Registerbekanntmachung nach dem Umwandlungsgesetz\nHessen Amtsgericht Königstein HRB 12063\nKönigsteiner Raben GmbH – Königstein im Taunus",
      "type": "Registerbekanntmachung nach dem Umwandlungsgesetz",
      "state": "Hessen",
      "amtsgericht": "Amtsgericht Königstein",
      "registernummer": "HRB 12063",
      "registerart": "HRB",
      "company_name": "Königsteiner Raben GmbH",
      "company_seat": "Königstein im Taunus",
      "details": "26.02.2025 (Bekanntmachungsdatum)\n\nHessen Amtsgericht Königstein HRB 12063\nRegisterbekanntmachung nach dem Umwandlungsgesetz 26.02.2025 (Eintragungsdatum)\n\nKönigsteiner Raben GmbH\nGesellschaft mit beschränkter Haftung\nKönigstein im Taunus\n\nDen Gläubigern der an der Ausgliederung beteiligten Rechtsträger ist, wenn sie binnen sechs Monaten nach dem Tag, an dem die Eintragung der Ausgliederung in das Register des Sitzes desjenigen Rechtsträgers, dessen Gläubiger sie sind, nach §§ 125, 19 Absatz 3 UmwG bekannt gemacht worden ist, ihren Anspruch nach Grund und Höhe schriftlich anmelden, Sicherheit zu leisten, soweit sie nicht Befriedigung verlangen können. Dieses Recht steht den Gläubigern jedoch nur zu, wenn sie glaubhaft machen, dass durch die Ausgliederung die Erfüllung ihrer Forderung gefährdet wird."
    },
    {
      "date": "2025-02-26",
      "id": "102404",
      "original_text": "Registerbekanntmachung nach dem Umwandlungsgesetz\nHessen Amtsgericht Bad Homburg v.d.H. HRB 11601\nJefferson Wells GmbH – Bad Homburg v. d Höhe",
      "type": "Registerbekanntmachung nach dem Umwandlungsgesetz",
      "state": "Hessen",
      "amtsgericht": "Amtsgericht Bad Homburg v.d.H.",
      "registernummer": "HRB 11601",
      "registerart": "HRB",
      "company_name": "Jefferson Wells GmbH",
      "company_seat": "Bad Homburg v. d Höhe",
      "details": "26.02.2025 (Bekanntmachungsdatum)\n\nHessen Amtsgericht Bad Homburg v.d.H. HRB 11601\nRegisterbekanntmachung nach dem Umwandlungsgesetz 26.02.2025 (Eintragungsdatum)\n\nJefferson Wells GmbH\nGesellschaft mit beschränkter Haftung\nBad Homburg v. d Höhe\n\nDen Gläubigern der an der Verschmelzung beteiligten Rechtsträger ist, wenn sie binnen sechs Monaten nach dem Tag, an dem die Eintragung der Verschmelzung in das Register des Sitzes desjenigen Rechtsträgers, dessen Gläubiger sie sind, nach § 19 Absatz 3 UmwG bekannt gemacht worden ist, ihren Anspruch nach Grund und Höhe schriftlich anmelden, Sicherheit zu leisten, soweit sie nicht Befriedigung verlangen können. Dieses Recht steht den Gläubigern jedoch nur zu, wenn sie glaubhaft machen, dass durch die Verschmelzung die Erfüllung ihrer Forderung gefährdet wird."
    },
    {
      "date": "2025-02-26",
      "id": "102405",
      "original_text": "Sonstige Registerbekanntmachung\nHessen Amtsgericht Frankfurt am Main HRB 80376\nEURO Kartensysteme GmbH – Frankfurt am Main",
      "type": "Sonstige Registerbekanntmachung",
      "state": "Hessen",
      "amtsgericht": "Amtsgericht Frankfurt am Main",
      "registernummer": "HRB 80376",
      "registerart": "HRB",
      "company_name": "EURO Kartensysteme GmbH",
      "company_seat": "Frankfurt am Main",
      "details": "26.02.2025 (Bekanntmachungsdatum)\n\nHessen Amtsgericht Frankfurt am Main HRB 80376\nSonstige Registerbekanntmachung\n\nEURO Kartensysteme GmbH\nGesellschaft mit beschränkter Haftung\nFrankfurt am Main\n\nDurch eine Änderung in den Personen der Aufsichtsratsmitglieder ist eine Liste der Mitglieder des Aufsichtsrates zum Handelsregister eingereicht worden."
    },
    {
      "date": "2025-02-26",
      "id": "102406",
      "original_text": "Registerbekanntmachung nach dem Umwandlungsgesetz\nHessen Amtsgericht Königstein HRB 5417\nKÖNIGSTEINER UNION Aktiengesellschaft – Königstein im Taunus",
      "type": "Registerbekanntmachung nach dem Umwandlungsgesetz",
      "state": "Hessen",
      "amtsgericht": "Amtsgericht Königstein",
      "registernummer": "HRB 5417",
      "registerart": "HRB",
      "company_name": "KÖNIGSTEINER UNION Aktiengesellschaft",
      "company_seat": "Königstein im Taunus",
      "details": "26.02.2025 (Bekanntmachungsdatum)\n\nHessen Amtsgericht Königstein HRB 5417\nRegisterbekanntmachung nach dem Umwandlungsgesetz 26.02.2025 (Eintragungsdatum)\n\nKÖNIGSTEINER UNION Aktiengesellschaft\nAktiengesellschaft\nKönigstein im Taunus\n\nDen Gläubigern der an der Ausgliederung beteiligten Rechtsträger ist, wenn sie binnen sechs Monaten nach dem Tag, an dem die Eintragung der Ausgliederung in das Register des Sitzes desjenigen Rechtsträgers, dessen Gläubiger sie sind, nach §§ 125, 19 Absatz 3 UmwG bekannt gemacht worden ist, ihren Anspruch nach Grund und Höhe schriftlich anmelden, Sicherheit zu leisten, soweit sie nicht Befriedigung verlangen können. Dieses Recht steht den Gläubigern jedoch nur zu, wenn sie glaubhaft machen, dass durch die Ausgliederung die Erfüllung ihrer Forderung gefährdet wird."
    },
    {
      "date": "2025-02-26",
      "id": "102407",
      "original_text": "Löschungsankündigung\nHessen Amtsgericht Frankfurt am Main HRB 122590\nDR Abbruch & Entkernung UG (haftungsbeschränkt) – Frankfurt am Main",
      "type": "Löschungsankündigung",
      "state": "Hessen",
      "amtsgericht": "Amtsgericht Frankfurt am Main",
      "registernummer": "HRB 122590",
      "registerart": "HRB",
      "company_name": "DR Abbruch & Entkernung UG (haftungsbeschränkt)",
      "company_seat": "Frankfurt am Main",
      "details": "26.02.2025 (Bekanntmachungsdatum)\n\nHessen Amtsgericht Frankfurt am Main HRB 122590\nLöschungsankündigung\n\nDR Abbruch & Entkernung UG (haftungsbeschränkt)\nGesellschaft mit beschränkter Haftung\nFrankfurt am Main\n\nDas Registergericht beabsichtigt die im Handelsregister eingetragene Gesellschaft von Amts wegen nach § 394 FamFG zu löschen. Die Frist zur Erhebung eines Widerspruchs gegen die beabsichtigte Löschung wird auf 1 Monate festgesetzt."
    },
    {
      "date": "2025-02-26",
      "id": "102408",
      "original_text": "Registerbekanntmachung nach dem Umwandlungsgesetz\nHessen Amtsgericht Frankfurt am Main HRB 137862\nsheego GmbH – Frankfurt am Main",
      "type": "Registerbekanntmachung nach dem Umwandlungsgesetz",
      "state": "Hessen",
      "amtsgericht": "Amtsgericht Frankfurt am Main",
      "registernummer": "HRB 137862",
      "registerart": "HRB",
      "company_name": "sheego GmbH",
      "company_seat": "Frankfurt am Main",
      "details": "26.02.2025 (Bekanntmachungsdatum)\n\nHessen Amtsgericht Frankfurt am Main HRB 137862\nRegisterbekanntmachung nach dem Umwandlungsgesetz 26.02.2025 (Eintragungsdatum)\n\nsheego GmbH\nGesellschaft mit beschränkter Haftung\nFrankfurt am Main\n\nDen Gläubigern der an der formwechselnden Umwandlung beteiligten Rechtsträger ist, wenn sie binnen sechs Monaten nach dem Tag, an dem die Eintragung der formwechselnden Umwandlung in das Register des Sitzes desjenigen Rechtsträgers, dessen Gläubiger sie sind, nach § 201 UmwG bekannt gemacht worden ist, ihren Anspruch nach Grund und Höhe schriftlich anmelden, Sicherheit zu leisten, soweit sie nicht Befriedigung verlangen können. Dieses Recht steht den Gläubigern jedoch nur zu, wenn sie glaubhaft machen, dass durch die formwechselnden Umwandlung die Erfüllung ihrer Forderung gefährdet wird."
    },
    {
      "date": "2025-02-26",
      "id": "102409",
      "original_text": "Löschungsankündigung\nBaden-Württemberg Amtsgericht Stuttgart HRB 780123\nFlorian Montage GmbH – Leonberg",
      "type": "Löschungsankündigung",
      "state": "Baden-Württemberg",
      "amtsgericht": "Amtsgericht Stuttgart",
      "registernummer": "HRB 780123",
      "registerart": "HRB",
      "company_name": "Florian Montage GmbH",
      "company_seat": "Leonberg",
      "details": "26.02.2025 (Bekanntmachungsdatum)\n\nBaden-Württemberg Amtsgericht Stuttgart HRB 780123\nLöschungsankündigung 26.02.2025 (Eintragungsdatum)\n\nFlorian Montage GmbH\nGesellschaft mit beschränkter Haftung\nLeonberg\n\nAls nicht eingetragen wird bekanntgemacht:\nDas Gericht beabsichtigt, die Gesellschaft wegen Vermögenslosigkeit im Handelsregister von Amts wegen nach § 394 FamFG zu löschen. Die Frist zur Geltendmachung eines Widerspruchs gegen die beabsichtigte Löschung ist auf zwei Monate ab Veröffentlichung bestimmt."
    },
    {
      "date": "2025-02-26",
      "id": "73",
      "original_text": "Sonderregisterbekanntmachung OHNE Bezug zum elektr. Register\nThüringen Amtsgericht Eisenach\n2AR4/25\nRuhla United e.V.",
      "type": "Sonderregisterbekanntmachung OHNE Bezug zum elektr. Register",
      "state": "Thüringen",
      "amtsgericht": "Amtsgericht Eisenach",
      "company_name": "Ruhla United e.V.",
      "sonderegister_referenz": "2AR4/25",
      "details": "26.02.2025 (Bekanntmachungsdatum)\n\nThüringen Amtsgericht Eisenach\n2AR4/25\nSonderregisterbekanntmachung OHNE Bezug zum elektr. Register\n\nRuhla United e.V.\n\nRuhla United e.V., Sitz: Wutha-Farnroda, OT Mosbach, Gründungsversammlung vom 22.11.202."
    }
  ]
}