{
  "date": "2025-02-06",
  "date_of_scrape": "2025-02-07T04:08:01.631Z",
  "tool_version": "0.2.0",
  "number_of_announcements": 116,
  "announcements": [
    {
      "date": "2025-02-06",
      "id": "100587",
      "original_text": "Registerbekanntmachung nach dem Umwandlungsgesetz\nBayern Amtsgericht München HRB 294902\nSilk Road MidCo GmbH – München",
      "type": "Registerbekanntmachung nach dem Umwandlungsgesetz",
      "state": "Bayern",
      "amtsgericht": "Amtsgericht München",
      "registernummer": "HRB 294902",
      "registerart": "HRB",
      "company_name": "Silk Road MidCo GmbH",
      "company_seat": "München",
      "details": "06.02.2025 (Bekanntmachungsdatum)\n\nBayern Amtsgericht München HRB 294902\nRegisterbekanntmachung nach dem Umwandlungsgesetz 05.02.2025 (Eintragungsdatum)\n\nSilk Road MidCo GmbH\nGesellschaft mit beschränkter Haftung\nMünchen\n\nDen Gläubigern der an der Verschmelzung beteiligten Rechtsträger ist, wenn sie binnen sechs Monaten nach dem Tag, an dem die Eintragung der Verschmelzung in das Register des Sitzes desjenigen Rechtsträgers, dessen Gläubiger sie sind, nach § 19 Abs. 3 UmwG als bekannt gemacht gilt, ihren Anspruch nach Grund und Höhe in Textform anmelden, Sicherheit zu leisten, soweit sie nicht Befriedigung verlangen können. Dieses Recht steht den Gläubigern jedoch nur zu, wenn sie glaubhaft machen, dass durch die Verschmelzung die Erfüllung ihrer Forderung gefährdet wird."
    },
    {
      "date": "2025-02-06",
      "id": "100588",
      "original_text": "Registerbekanntmachung nach dem Umwandlungsgesetz\nBayern Amtsgericht München HRB 270381\nAllgeier Experts Consulting GmbH – München",
      "type": "Registerbekanntmachung nach dem Umwandlungsgesetz",
      "state": "Bayern",
      "amtsgericht": "Amtsgericht München",
      "registernummer": "HRB 270381",
      "registerart": "HRB",
      "company_name": "Allgeier Experts Consulting GmbH",
      "company_seat": "München",
      "details": "06.02.2025 (Bekanntmachungsdatum)\n\nBayern Amtsgericht München HRB 270381\nRegisterbekanntmachung nach dem Umwandlungsgesetz 05.02.2025 (Eintragungsdatum)\n\nAllgeier Experts Consulting GmbH\nGesellschaft mit beschränkter Haftung\nMünchen\n\nDen Gläubigern der an der Verschmelzung beteiligten Rechtsträger ist, wenn sie binnen sechs Monaten nach dem Tag, an dem die Eintragung der Verschmelzung in das Register des Sitzes desjenigen Rechtsträgers, dessen Gläubiger sie sind, nach § 19 Abs. 3 UmwG als bekannt gemacht gilt, ihren Anspruch nach Grund und Höhe in Textform anmelden, Sicherheit zu leisten, soweit sie nicht Befriedigung verlangen können. Dieses Recht steht den Gläubigern jedoch nur zu, wenn sie glaubhaft machen, dass durch die Verschmelzung die Erfüllung ihrer Forderung gefährdet wird."
    },
    {
      "date": "2025-02-06",
      "id": "100589",
      "original_text": "Registerbekanntmachung nach dem Umwandlungsgesetz\nBayern Amtsgericht München HRB 246132\nEncavis AM Komplementär GmbH – Neubiberg",
      "type": "Registerbekanntmachung nach dem Umwandlungsgesetz",
      "state": "Bayern",
      "amtsgericht": "Amtsgericht München",
      "registernummer": "HRB 246132",
      "registerart": "HRB",
      "company_name": "Encavis AM Komplementär GmbH",
      "company_seat": "Neubiberg",
      "details": "06.02.2025 (Bekanntmachungsdatum)\n\nBayern Amtsgericht München HRB 246132\nRegisterbekanntmachung nach dem Umwandlungsgesetz 05.02.2025 (Eintragungsdatum)\n\nEncavis AM Komplementär GmbH\nGesellschaft mit beschränkter Haftung\nNeubiberg\n\nDen Gläubigern der an der Verschmelzung beteiligten Rechtsträger ist, wenn sie binnen sechs Monaten nach dem Tag, an dem die Eintragung der Verschmelzung in das Register des Sitzes desjenigen Rechtsträgers, dessen Gläubiger sie sind, nach § 19 Abs. 3 UmwG als bekannt gemacht gilt, ihren Anspruch nach Grund und Höhe in Textform anmelden, Sicherheit zu leisten, soweit sie nicht Befriedigung verlangen können. Dieses Recht steht den Gläubigern jedoch nur zu, wenn sie glaubhaft machen, dass durch die Verschmelzung die Erfüllung ihrer Forderung gefährdet wird."
    },
    {
      "date": "2025-02-06",
      "id": "100590",
      "original_text": "Registerbekanntmachung nach dem Umwandlungsgesetz\nBayern Amtsgericht Coburg HRB 4759\nMovex Media GmbH – Mitwitz",
      "type": "Registerbekanntmachung nach dem Umwandlungsgesetz",
      "state": "Bayern",
      "amtsgericht": "Amtsgericht Coburg",
      "registernummer": "HRB 4759",
      "registerart": "HRB",
      "company_name": "Movex Media GmbH",
      "company_seat": "Mitwitz",
      "details": "06.02.2025 (Bekanntmachungsdatum)\n\nBayern Amtsgericht Coburg HRB 4759\nRegisterbekanntmachung nach dem Umwandlungsgesetz 04.02.2025 (Eintragungsdatum)\n\nMovex Media GmbH\nGesellschaft mit beschränkter Haftung\nMitwitz\n\nDen Gläubigern der an der Verschmelzung beteiligten Rechtsträger ist, wenn sie binnen sechs Monaten nach dem Tag, an dem die Eintragung der Verschmelzung in das Register des Sitzes desjenigen Rechtsträgers, dessen Gläubiger sie sind, nach § 19 Abs. 3 UmwG als bekannt gemacht gilt, ihren Anspruch nach Grund und Höhe in Textform anmelden, Sicherheit zu leisten, soweit sie nicht Befriedigung verlangen können. Dieses Recht steht den Gläubigern jedoch nur zu, wenn sie glaubhaft machen, dass durch die Verschmelzung die Erfüllung ihrer Forderung gefährdet wird."
    },
    {
      "date": "2025-02-06",
      "id": "100591",
      "original_text": "Löschungsankündigung\nBayern Amtsgericht München HRB 218622\nA & O Unternehmensberatungsgesellschaft mbH – München",
      "type": "Löschungsankündigung",
      "state": "Bayern",
      "amtsgericht": "Amtsgericht München",
      "registernummer": "HRB 218622",
      "registerart": "HRB",
      "company_name": "A & O Unternehmensberatungsgesellschaft mbH",
      "company_seat": "München",
      "details": "06.02.2025 (Bekanntmachungsdatum)\n\nBayern Amtsgericht München HRB 218622\nLöschungsankündigung 05.02.2025 (Eintragungsdatum)\n\nA & O Unternehmensberatungsgesellschaft mbH\nGesellschaft mit beschränkter Haftung\nMünchen\n\nDas Registergericht beabsichtigt, die im Handelsregister eingetragene Gesellschaft wegen Vermögenslosigkeit von Amts wegen nach § 394 FamFG zu löschen. Die Frist zur Erhebung eines Widerspruchs ist auf drei Monate festgesetzt."
    },
    {
      "date": "2025-02-06",
      "id": "100592",
      "original_text": "Sonstige Registerbekanntmachung\nBayern Amtsgericht Bamberg HRB 6100\nVion Bamberg GmbH – Bamberg",
      "type": "Sonstige Registerbekanntmachung",
      "state": "Bayern",
      "amtsgericht": "Amtsgericht Bamberg",
      "registernummer": "HRB 6100",
      "registerart": "HRB",
      "company_name": "Vion Bamberg GmbH",
      "company_seat": "Bamberg",
      "details": "06.02.2025 (Bekanntmachungsdatum)\n\nBayern Amtsgericht Bamberg HRB 6100\nSonstige Registerbekanntmachung 05.02.2025 (Eintragungsdatum)\n\nVion Bamberg GmbH\nGesellschaft mit beschränkter Haftung\nBamberg\n\nDen Gläubigern der Gesellschaft, deren Forderungen begründet worden sind, bevor die Eintragung der Beendigung des Beherrschungsvertrages in das Handelsregister nach § 10 des Handelsgesetzbuches als bekanntgemacht gilt, hat der andere Vertragsteil Sicherheit zu leisten, wenn sie sich binnen sechs Monaten nach der Bekanntmachung der Eintragung zu diesem Zweck bei ihm melden."
    },
    {
      "date": "2025-02-06",
      "id": "100593",
      "original_text": "Sonstige Registerbekanntmachung\nBayern Amtsgericht Bamberg HRB 6100\nVion Bamberg GmbH – Bamberg",
      "type": "Sonstige Registerbekanntmachung",
      "state": "Bayern",
      "amtsgericht": "Amtsgericht Bamberg",
      "registernummer": "HRB 6100",
      "registerart": "HRB",
      "company_name": "Vion Bamberg GmbH",
      "company_seat": "Bamberg",
      "details": "06.02.2025 (Bekanntmachungsdatum)\n\nBayern Amtsgericht Bamberg HRB 6100\nSonstige Registerbekanntmachung 05.02.2025 (Eintragungsdatum)\n\nVion Bamberg GmbH\nGesellschaft mit beschränkter Haftung\nBamberg\n\nDen Gläubigern der Gesellschaft, deren Forderungen begründet worden sind, bevor die Eintragung der Beendigung des Gewinnabführungsvertrages in das Handelsregister nach § 10 des Handelsgesetzbuches als bekanntgemacht gilt, hat der andere Vertragsteil Sicherheit zu leisten, wenn sie sich binnen sechs Monaten nach der Bekanntmachung der Eintragung zu diesem Zweck bei ihm melden."
    },
    {
      "date": "2025-02-06",
      "id": "100594",
      "original_text": "Registerbekanntmachung nach dem Umwandlungsgesetz\nBayern Amtsgericht Landshut HRB 9078\nControl Treuhand GmbH Wirtschaftsprüfungsgesellschaft Steuerberatungsgesellschaft – Landshut",
      "type": "Registerbekanntmachung nach dem Umwandlungsgesetz",
      "state": "Bayern",
      "amtsgericht": "Amtsgericht Landshut",
      "registernummer": "HRB 9078",
      "registerart": "HRB",
      "company_name": "Control Treuhand GmbH Wirtschaftsprüfungsgesellschaft Steuerberatungsgesellschaft",
      "company_seat": "Landshut",
      "details": "06.02.2025 (Bekanntmachungsdatum)\n\nBayern Amtsgericht Landshut HRB 9078\nRegisterbekanntmachung nach dem Umwandlungsgesetz 05.02.2025 (Eintragungsdatum)\n\nControl Treuhand GmbH Wirtschaftsprüfungsgesellschaft Steuerberatungsgesellschaft\nGesellschaft mit beschränkter Haftung\nLandshut\n\nDem #Re.Name ist #DV.auswahl(Text=\"Bitte zutreffendes auswählen:\",Eingabe=\"der Entwurf eines Verschmelzungsvertrages\",\"ein Verschmelzungsvertrag\") zwischen der #DV.fa(Text=\"Bitte Firma/Namen des übernehmenden Rechtsträgers eingeben:\"), #DV.si(Text=\"Bitte Sitz des übernehmenden Rechtsträgers eingeben:\") (Amtsgericht #DV.regg(Text=\"Bitte das zust. Registergericht des übernehmenden Rechtsträgers eingeben:\") #insert(Text=\"RegTyp_Auswahl\") #DV.nr(Text=\"Bitte Registernummer des übernehmenden Rechtsträgers eingeben:\")) und der Gesellschaft als übertragendem Rechtsträger zur Einsichtnahme eingereicht worden."
    },
    {
      "date": "2025-02-06",
      "id": "100595",
      "original_text": "Registerbekanntmachung nach dem Umwandlungsgesetz\nBayern Amtsgericht Hof HRB 4125\nThüga SmartService GmbH – Naila",
      "type": "Registerbekanntmachung nach dem Umwandlungsgesetz",
      "state": "Bayern",
      "amtsgericht": "Amtsgericht Hof",
      "registernummer": "HRB 4125",
      "registerart": "HRB",
      "company_name": "Thüga SmartService GmbH",
      "company_seat": "Naila",
      "details": "06.02.2025 (Bekanntmachungsdatum)\n\nBayern Amtsgericht Hof HRB 4125\nRegisterbekanntmachung nach dem Umwandlungsgesetz 05.02.2025 (Eintragungsdatum)\n\nThüga SmartService GmbH\nGesellschaft mit beschränkter Haftung\nNaila\n\nDen Gläubigern der an der Verschmelzung beteiligten Rechtsträger ist, wenn sie binnen sechs Monaten nach dem Tag, an dem die Eintragung der Verschmelzung in das Register des Sitzes desjenigen Rechtsträgers, dessen Gläubiger sie sind, nach § 19 Abs. 3 UmwG als bekannt gemacht gilt, ihren Anspruch nach Grund und Höhe in Textform anmelden, Sicherheit zu leisten, soweit sie nicht Befriedigung verlangen können. Dieses Recht steht den Gläubigern jedoch nur zu, wenn sie glaubhaft machen, dass durch die Verschmelzung die Erfüllung ihrer Forderung gefährdet wird."
    },
    {
      "date": "2025-02-06",
      "id": "100596",
      "original_text": "Sonstige Registerbekanntmachung\nBayern Amtsgericht Bayreuth HRB 2424\nLoewe Verlag GmbH – Bindlach",
      "type": "Sonstige Registerbekanntmachung",
      "state": "Bayern",
      "amtsgericht": "Amtsgericht Bayreuth",
      "registernummer": "HRB 2424",
      "registerart": "HRB",
      "company_name": "Loewe Verlag GmbH",
      "company_seat": "Bindlach",
      "details": "06.02.2025 (Bekanntmachungsdatum)\n\nBayern Amtsgericht Bayreuth HRB 2424\nSonstige Registerbekanntmachung 05.02.2025 (Eintragungsdatum)\n\nLoewe Verlag GmbH\nGesellschaft mit beschränkter Haftung\nBindlach\n\nDen Gläubigern der an der Verschmelzung beteiligten Rechtsträger ist, wenn sie binnen sechs Monaten nach dem Tag, an dem die Eintragung der Verschmelzung in das Register des Sitzes desjenigen Rechtsträgers, dessen Gläubiger sie sind, nach § 19 Abs. 3 UmwG als bekannt gemacht gilt, ihren Anspruch nach Grund und Höhe in Textform anmelden, Sicherheit zu leisten, soweit sie nicht Befriedigung verlangen können. Dieses Recht steht den Gläubigern jedoch nur zu, wenn sie glaubhaft machen, dass durch die Verschmelzung die Erfüllung ihrer Forderung gefährdet wird."
    },
    {
      "date": "2025-02-06",
      "id": "100597",
      "original_text": "Registerbekanntmachung nach dem Umwandlungsgesetz\nBayern Amtsgericht Nürnberg PR 246\nAppel Spies Vogt Züll Nürnberger Treuhand Partnerschaft Wirtschaftsprüfungsgesellschaft Rechtsanwalt – Nürnberg",
      "type": "Registerbekanntmachung nach dem Umwandlungsgesetz",
      "state": "Bayern",
      "amtsgericht": "Amtsgericht Nürnberg",
      "registernummer": "PR 246",
      "registerart": "PR",
      "company_name": "Appel Spies Vogt Züll Nürnberger Treuhand Partnerschaft Wirtschaftsprüfungsgesellschaft Rechtsanwalt",
      "company_seat": "Nürnberg",
      "details": "06.02.2025 (Bekanntmachungsdatum)\n\nBayern Amtsgericht Nürnberg PR 246\nRegisterbekanntmachung nach dem Umwandlungsgesetz 05.02.2025 (Eintragungsdatum)\n\nAppel Spies Vogt Züll Nürnberger Treuhand Partnerschaft Wirtschaftsprüfungsgesellschaft Rechtsanwalt\nPartnerschaftsgesellschaft\nNürnberg\n\nDen Gläubigern der an der Verschmelzung beteiligten Rechtsträger ist, wenn sie binnen sechs Monaten nach dem Tag, an dem die Eintragung der Verschmelzung in das Register des Sitzes desjenigen Rechtsträgers, dessen Gläubiger sie sind, nach § 19 Abs. 3 UmwG als bekannt gemacht gilt, ihren Anspruch nach Grund und Höhe in Textform anmelden, Sicherheit zu leisten, soweit sie nicht Befriedigung verlangen können. Dieses Recht steht den Gläubigern jedoch nur zu, wenn sie glaubhaft machen, dass durch die Verschmelzung die Erfüllung ihrer Forderung gefährdet wird."
    },
    {
      "date": "2025-02-06",
      "id": "100598",
      "original_text": "Löschungsankündigung\nBayern Amtsgericht Coburg HRB 3345\nFloßanger Holding GmbH – Coburg",
      "type": "Löschungsankündigung",
      "state": "Bayern",
      "amtsgericht": "Amtsgericht Coburg",
      "registernummer": "HRB 3345",
      "registerart": "HRB",
      "company_name": "Floßanger Holding GmbH",
      "company_seat": "Coburg",
      "details": "06.02.2025 (Bekanntmachungsdatum)\n\nBayern Amtsgericht Coburg HRB 3345\nLöschungsankündigung 04.02.2025 (Eintragungsdatum)\n\nFloßanger Holding GmbH\nGesellschaft mit beschränkter Haftung\nCoburg\n\nDas Registergericht beabsichtigt, die im Handelsregister eingetragene Gesellschaft wegen Vermögenslosigkeit von Amts wegen nach § 394 FamFG zu löschen. Die Frist zur Erhebung eines Widerspruchs ist auf sechs Wochen festgesetzt."
    },
    {
      "date": "2025-02-06",
      "id": "100599",
      "original_text": "Registerbekanntmachung nach dem Umwandlungsgesetz\nBayern Amtsgericht Coburg HRB 5025\nDatex-Perfekt Gesellschaft für professionelle Datenerfassung und -verarbeitung mbH – Mitwitz",
      "type": "Registerbekanntmachung nach dem Umwandlungsgesetz",
      "state": "Bayern",
      "amtsgericht": "Amtsgericht Coburg",
      "registernummer": "HRB 5025",
      "registerart": "HRB",
      "company_name": "Datex-Perfekt Gesellschaft für professionelle Datenerfassung und -verarbeitung mbH",
      "company_seat": "Mitwitz",
      "details": "06.02.2025 (Bekanntmachungsdatum)\n\nBayern Amtsgericht Coburg HRB 5025\nRegisterbekanntmachung nach dem Umwandlungsgesetz 04.02.2025 (Eintragungsdatum)\n\nDatex-Perfekt Gesellschaft für professionelle Datenerfassung und -verarbeitung mbH\nGesellschaft mit beschränkter Haftung\nMitwitz\n\nDen Gläubigern der an der Verschmelzung beteiligten Rechtsträger ist, wenn sie binnen sechs Monaten nach dem Tag, an dem die Eintragung der Verschmelzung in das Register des Sitzes desjenigen Rechtsträgers, dessen Gläubiger sie sind, nach § 19 Abs. 3 UmwG als bekannt gemacht gilt, ihren Anspruch nach Grund und Höhe in Textform anmelden, Sicherheit zu leisten, soweit sie nicht Befriedigung verlangen können. Dieses Recht steht den Gläubigern jedoch nur zu, wenn sie glaubhaft machen, dass durch die Verschmelzung die Erfüllung ihrer Forderung gefährdet wird."
    },
    {
      "date": "2025-02-06",
      "id": "100600",
      "original_text": "Sonstige Registerbekanntmachung\nBayern Amtsgericht München HRB 277989\nAgreenery GmbH – Oberhaching",
      "type": "Sonstige Registerbekanntmachung",
      "state": "Bayern",
      "amtsgericht": "Amtsgericht München",
      "registernummer": "HRB 277989",
      "registerart": "HRB",
      "company_name": "Agreenery GmbH",
      "company_seat": "Oberhaching",
      "details": "06.02.2025 (Bekanntmachungsdatum)\n\nBayern Amtsgericht München HRB 277989\nSonstige Registerbekanntmachung 05.02.2025 (Eintragungsdatum)\n\nAgreenery GmbH\nGesellschaft mit beschränkter Haftung\nOberhaching\n\nDen Gläubigern der Gesellschaft, deren Forderungen begründet worden sind, bevor die Eintragung der Beendigung des Beherrschungsvertrages in das Handelsregister nach § 10 des Handelsgesetzbuches als bekanntgemacht gilt, hat der andere Vertragsteil Sicherheit zu leisten, wenn sie sich binnen sechs Monaten nach der Bekanntmachung der Eintragung zu diesem Zweck bei ihm melden."
    },
    {
      "date": "2025-02-06",
      "id": "100601",
      "original_text": "Registerbekanntmachung nach dem Umwandlungsgesetz\nBayern Amtsgericht Nürnberg HRA 20173\nNÜRNBERGER TREUHAND GmbH & Co. KG Wirtschaftsprüfungsgesellschaft Steuerberater Rechtsanwalt – Nürnberg",
      "type": "Registerbekanntmachung nach dem Umwandlungsgesetz",
      "state": "Bayern",
      "amtsgericht": "Amtsgericht Nürnberg",
      "registernummer": "HRA 20173",
      "registerart": "HRA",
      "company_name": "NÜRNBERGER TREUHAND GmbH & Co. KG Wirtschaftsprüfungsgesellschaft Steuerberater Rechtsanwalt",
      "company_seat": "Nürnberg",
      "details": "06.02.2025 (Bekanntmachungsdatum)\n\nBayern Amtsgericht Nürnberg HRA 20173\nRegisterbekanntmachung nach dem Umwandlungsgesetz 05.02.2025 (Eintragungsdatum)\n\nNÜRNBERGER TREUHAND GmbH & Co. KG Wirtschaftsprüfungsgesellschaft Steuerberater Rechtsanwalt\nKommanditgesellschaft\nNürnberg\n\nDen Gläubigern der an der Verschmelzung beteiligten Rechtsträger ist, wenn sie binnen sechs Monaten nach dem Tag, an dem die Eintragung der Verschmelzung in das Register des Sitzes desjenigen Rechtsträgers, dessen Gläubiger sie sind, nach § 19 Abs. 3 UmwG als bekannt gemacht gilt, ihren Anspruch nach Grund und Höhe in Textform anmelden, Sicherheit zu leisten, soweit sie nicht Befriedigung verlangen können. Dieses Recht steht den Gläubigern jedoch nur zu, wenn sie glaubhaft machen, dass durch die Verschmelzung die Erfüllung ihrer Forderung gefährdet wird."
    },
    {
      "date": "2025-02-06",
      "id": "100602",
      "original_text": "Einreichung neuer Dokumente\nBayern Amtsgericht Traunstein HRB 15698\nCOMESTICA AG – Petting",
      "type": "Einreichung neuer Dokumente",
      "state": "Bayern",
      "amtsgericht": "Amtsgericht Traunstein",
      "registernummer": "HRB 15698",
      "registerart": "HRB",
      "company_name": "COMESTICA AG",
      "company_seat": "Petting",
      "details": "06.02.2025 (Bekanntmachungsdatum)\n\nBayern Amtsgericht Traunstein HRB 15698\nEinreichung neuer Dokumente\n\nCOMESTICA AG\nAktiengesellschaft\nPetting\n\nDem Amtsgericht Traunstein -Registergericht- ist eine Liste der Mitglieder des Aufsichtsrats eingereicht worden, § 106 AktG."
    },
    {
      "date": "2025-02-06",
      "id": "100603",
      "original_text": "Registerbekanntmachung nach dem Umwandlungsgesetz\nBayern Amtsgericht Landshut HRB 9648\nWestermeier Treuhand GmbH Wirtschaftsprüfungsgesellschaft Steuerberatungsgesellschaft – Landshut",
      "type": "Registerbekanntmachung nach dem Umwandlungsgesetz",
      "state": "Bayern",
      "amtsgericht": "Amtsgericht Landshut",
      "registernummer": "HRB 9648",
      "registerart": "HRB",
      "company_name": "Westermeier Treuhand GmbH Wirtschaftsprüfungsgesellschaft Steuerberatungsgesellschaft",
      "company_seat": "Landshut",
      "details": "06.02.2025 (Bekanntmachungsdatum)\n\nBayern Amtsgericht Landshut HRB 9648\nRegisterbekanntmachung nach dem Umwandlungsgesetz 05.02.2025 (Eintragungsdatum)\n\nWestermeier Treuhand GmbH Wirtschaftsprüfungsgesellschaft Steuerberatungsgesellschaft\nGesellschaft mit beschränkter Haftung\nLandshut\n\nDen Gläubigern der an der Verschmelzung beteiligten Rechtsträger ist, wenn sie binnen sechs Monaten nach dem Tag, an dem die Eintragung der Verschmelzung in das Register des Sitzes desjenigen Rechtsträgers, dessen Gläubiger sie sind, nach § 19 Abs. 3 UmwG als bekannt gemacht gilt, ihren Anspruch nach Grund und Höhe in Textform anmelden, Sicherheit zu leisten, soweit sie nicht Befriedigung verlangen können. Dieses Recht steht den Gläubigern jedoch nur zu, wenn sie glaubhaft machen, dass durch die Verschmelzung die Erfüllung ihrer Forderung gefährdet wird."
    },
    {
      "date": "2025-02-06",
      "id": "100604",
      "original_text": "Registerbekanntmachung nach dem Umwandlungsgesetz\nBayern Amtsgericht München HRB 215720\nAllgeier Experts GmbH – München",
      "type": "Registerbekanntmachung nach dem Umwandlungsgesetz",
      "state": "Bayern",
      "amtsgericht": "Amtsgericht München",
      "registernummer": "HRB 215720",
      "registerart": "HRB",
      "company_name": "Allgeier Experts GmbH",
      "company_seat": "München",
      "details": "06.02.2025 (Bekanntmachungsdatum)\n\nBayern Amtsgericht München HRB 215720\nRegisterbekanntmachung nach dem Umwandlungsgesetz 05.02.2025 (Eintragungsdatum)\n\nAllgeier Experts GmbH\nGesellschaft mit beschränkter Haftung\nMünchen\n\nDen Gläubigern der an der Verschmelzung beteiligten Rechtsträger ist, wenn sie binnen sechs Monaten nach dem Tag, an dem die Eintragung der Verschmelzung in das Register des Sitzes desjenigen Rechtsträgers, dessen Gläubiger sie sind, nach § 19 Abs. 3 UmwG als bekannt gemacht gilt, ihren Anspruch nach Grund und Höhe in Textform anmelden, Sicherheit zu leisten, soweit sie nicht Befriedigung verlangen können. Dieses Recht steht den Gläubigern jedoch nur zu, wenn sie glaubhaft machen, dass durch die Verschmelzung die Erfüllung ihrer Forderung gefährdet wird."
    },
    {
      "date": "2025-02-06",
      "id": "100605",
      "original_text": "Einreichung neuer Dokumente\nBayern Amtsgericht München HRB 121537\nBaader Bank Aktiengesellschaft – Unterschleißheim",
      "type": "Einreichung neuer Dokumente",
      "state": "Bayern",
      "amtsgericht": "Amtsgericht München",
      "registernummer": "HRB 121537",
      "registerart": "HRB",
      "company_name": "Baader Bank Aktiengesellschaft",
      "company_seat": "Unterschleißheim",
      "details": "06.02.2025 (Bekanntmachungsdatum)\n\nBayern Amtsgericht München HRB 121537\nEinreichung neuer Dokumente 05.02.2025 (Eintragungsdatum)\n\nBaader Bank Aktiengesellschaft\nAktiengesellschaft\nUnterschleißheim\n\nDem Amtsgericht München -Registergericht- ist eine Liste der Mitglieder des Aufsichtsrats eingereicht worden, § 106 AktG."
    },
    {
      "date": "2025-02-06",
      "id": "100606",
      "original_text": "Registerbekanntmachung nach dem Umwandlungsgesetz\nBayern Amtsgericht München HRB 270389\nAllgeier Experts Holding GmbH – München",
      "type": "Registerbekanntmachung nach dem Umwandlungsgesetz",
      "state": "Bayern",
      "amtsgericht": "Amtsgericht München",
      "registernummer": "HRB 270389",
      "registerart": "HRB",
      "company_name": "Allgeier Experts Holding GmbH",
      "company_seat": "München",
      "details": "06.02.2025 (Bekanntmachungsdatum)\n\nBayern Amtsgericht München HRB 270389\nRegisterbekanntmachung nach dem Umwandlungsgesetz\n\nAllgeier Experts Holding GmbH\nGesellschaft mit beschränkter Haftung\nMünchen\n\nDen Gläubigern der an der Verschmelzung beteiligten Rechtsträger ist, wenn sie binnen sechs Monaten nach dem Tag, an dem die Eintragung der Verschmelzung in das Register des Sitzes desjenigen Rechtsträgers, dessen Gläubiger sie sind, nach § 19 Abs. 3 UmwG als bekannt gemacht gilt, ihren Anspruch nach Grund und Höhe in Textform anmelden, Sicherheit zu leisten, soweit sie nicht Befriedigung verlangen können. Dieses Recht steht den Gläubigern jedoch nur zu, wenn sie glaubhaft machen, dass durch die Verschmelzung die Erfüllung ihrer Forderung gefährdet wird. Den Gläubigern der an der Verschmelzung beteiligten Rechtsträger ist, wenn sie binnen sechs Monaten nach dem Tag, an dem die Eintragung der Verschmelzung in das Register des Sitzes desjenigen Rechtsträgers, dessen Gläubiger sie sind, nach § 19 Abs. 3 UmwG als bekannt gemacht gilt, ihren Anspruch nach Grund und Höhe in Textform anmelden, Sicherheit zu leisten, soweit sie nicht Befriedigung verlangen können. Dieses Recht steht den Gläubigern jedoch nur zu, wenn sie glaubhaft machen, dass durch die Verschmelzung die Erfüllung ihrer Forderung gefährdet wird."
    },
    {
      "date": "2025-02-06",
      "id": "100607",
      "original_text": "Löschungsankündigung\nBayern Amtsgericht Landshut HRB 12827\nKikiBau UG (haftungsbeschränkt) – Landshut",
      "type": "Löschungsankündigung",
      "state": "Bayern",
      "amtsgericht": "Amtsgericht Landshut",
      "registernummer": "HRB 12827",
      "registerart": "HRB",
      "company_name": "KikiBau UG (haftungsbeschränkt)",
      "company_seat": "Landshut",
      "details": "06.02.2025 (Bekanntmachungsdatum)\n\nBayern Amtsgericht Landshut HRB 12827\nLöschungsankündigung\n\nKikiBau UG (haftungsbeschränkt)\nGesellschaft mit beschränkter Haftung\nLandshut\n\nDas Registergericht beabsichtigt, die im Handelsregister eingetragene Gesellschaft wegen Vermögenslosigkeit von Amts wegen nach § 394 FamFG zu löschen. Die Frist zur Erhebung eines Widerspruchs ist auf einen Monat festgesetzt."
    },
    {
      "date": "2025-02-06",
      "id": "100608",
      "original_text": "Registerbekanntmachung nach dem Umwandlungsgesetz\nBayern Amtsgericht München HRB 143034\nin-tech GmbH – Garching",
      "type": "Registerbekanntmachung nach dem Umwandlungsgesetz",
      "state": "Bayern",
      "amtsgericht": "Amtsgericht München",
      "registernummer": "HRB 143034",
      "registerart": "HRB",
      "company_name": "in-tech GmbH",
      "company_seat": "Garching",
      "details": "06.02.2025 (Bekanntmachungsdatum)\n\nBayern Amtsgericht München HRB 143034\nRegisterbekanntmachung nach dem Umwandlungsgesetz 05.02.2025 (Eintragungsdatum)\n\nin-tech GmbH\nGesellschaft mit beschränkter Haftung\nGarching\n\nDen Gläubigern der an der Verschmelzung beteiligten Rechtsträger ist, wenn sie binnen sechs Monaten nach dem Tag, an dem die Eintragung der Verschmelzung in das Register des Sitzes desjenigen Rechtsträgers, dessen Gläubiger sie sind, nach § 19 Abs. 3 UmwG als bekannt gemacht gilt, ihren Anspruch nach Grund und Höhe in Textform anmelden, Sicherheit zu leisten, soweit sie nicht Befriedigung verlangen können. Dieses Recht steht den Gläubigern jedoch nur zu, wenn sie glaubhaft machen, dass durch die Verschmelzung die Erfüllung ihrer Forderung gefährdet wird."
    },
    {
      "date": "2025-02-06",
      "id": "100609",
      "original_text": "Sonstige Registerbekanntmachung\nBayern Amtsgericht Bayreuth HRB 2425\ngondolino GmbH – Bindlach",
      "type": "Sonstige Registerbekanntmachung",
      "state": "Bayern",
      "amtsgericht": "Amtsgericht Bayreuth",
      "registernummer": "HRB 2425",
      "registerart": "HRB",
      "company_name": "gondolino GmbH",
      "company_seat": "Bindlach",
      "details": "06.02.2025 (Bekanntmachungsdatum)\n\nBayern Amtsgericht Bayreuth HRB 2425\nSonstige Registerbekanntmachung 05.02.2025 (Eintragungsdatum)\n\ngondolino GmbH\nGesellschaft mit beschränkter Haftung\nBindlach\n\nDen Gläubigern der an der Verschmelzung beteiligten Rechtsträger ist, wenn sie binnen sechs Monaten nach dem Tag, an dem die Eintragung der Verschmelzung in das Register des Sitzes desjenigen Rechtsträgers, dessen Gläubiger sie sind, nach § 19 Abs. 3 UmwG als bekannt gemacht gilt, ihren Anspruch nach Grund und Höhe in Textform anmelden, Sicherheit zu leisten, soweit sie nicht Befriedigung verlangen können. Dieses Recht steht den Gläubigern jedoch nur zu, wenn sie glaubhaft machen, dass durch die Verschmelzung die Erfüllung ihrer Forderung gefährdet wird."
    },
    {
      "date": "2025-02-06",
      "id": "100610",
      "original_text": "Registerbekanntmachung nach dem Umwandlungsgesetz\nBayern Amtsgericht München HRB 213881\nArongo GmbH – Dachau",
      "type": "Registerbekanntmachung nach dem Umwandlungsgesetz",
      "state": "Bayern",
      "amtsgericht": "Amtsgericht München",
      "registernummer": "HRB 213881",
      "registerart": "HRB",
      "company_name": "Arongo GmbH",
      "company_seat": "Dachau",
      "details": "06.02.2025 (Bekanntmachungsdatum)\n\nBayern Amtsgericht München HRB 213881\nRegisterbekanntmachung nach dem Umwandlungsgesetz 05.02.2025 (Eintragungsdatum)\n\nArongo GmbH\nGesellschaft mit beschränkter Haftung\nDachau\n\nDen Gläubigern der an der Verschmelzung beteiligten Rechtsträger ist, wenn sie binnen sechs Monaten nach dem Tag, an dem die Eintragung der Verschmelzung in das Register des Sitzes desjenigen Rechtsträgers, dessen Gläubiger sie sind, nach § 19 Abs. 3 UmwG als bekannt gemacht gilt, ihren Anspruch nach Grund und Höhe in Textform anmelden, Sicherheit zu leisten, soweit sie nicht Befriedigung verlangen können. Dieses Recht steht den Gläubigern jedoch nur zu, wenn sie glaubhaft machen, dass durch die Verschmelzung die Erfüllung ihrer Forderung gefährdet wird."
    },
    {
      "date": "2025-02-06",
      "id": "100611",
      "original_text": "Löschungsankündigung\nBaden-Württemberg Amtsgericht Stuttgart HRB 765179\nG & H Vertriebs-GmbH – Heilbronn",
      "type": "Löschungsankündigung",
      "state": "Baden-Württemberg",
      "amtsgericht": "Amtsgericht Stuttgart",
      "registernummer": "HRB 765179",
      "registerart": "HRB",
      "company_name": "G & H Vertriebs-GmbH",
      "company_seat": "Heilbronn",
      "details": "06.02.2025 (Bekanntmachungsdatum)\n\nBaden-Württemberg Amtsgericht Stuttgart HRB 765179\nLöschungsankündigung\n\nG & H Vertriebs-GmbH\nGesellschaft mit beschränkter Haftung\nHeilbronn\n\nAls nicht eingetragen wird bekanntgemacht:\nDas Gericht beabsichtigt, die Gesellschaft wegen Vermögenslosigkeit im Handelsregister von Amts wegen nach § 394 FamFG zu löschen. Die Frist zur Geltendmachung eines Widerspruchs gegen die beabsichtigte Löschung ist auf zwei Monate ab Veröffentlichung bestimmt."
    },
    {
      "date": "2025-02-06",
      "id": "100612",
      "original_text": "Löschungsankündigung\nHamburg Amtsgericht Hamburg HRA 106098\n\"Rio Dawson\" Schifffahrtsgesellschaft mbH & Co. KG – Hamburg",
      "type": "Löschungsankündigung",
      "state": "Hamburg",
      "amtsgericht": "Amtsgericht Hamburg",
      "registernummer": "HRA 106098",
      "registerart": "HRA",
      "company_name": "\"Rio Dawson\" Schifffahrtsgesellschaft mbH & Co. KG",
      "company_seat": "Hamburg",
      "details": "06.02.2025 (Bekanntmachungsdatum)\n\nHamburg Amtsgericht Hamburg HRA 106098\nLöschungsankündigung\n\n\"Rio Dawson\" Schifffahrtsgesellschaft mbH & Co. KG\nKommanditgesellschaft\nHamburg\n\nDas Registergericht beabsichtigt, die im Handelsregister eingetragene Firma von Amts wegen nach § 31 Abs. 2 HGB zu löschen. Die Frist zur Erhebung eines Widerspruchs gegen die beabsichtigte Löschung wird auf 3 Monate festgesetzt."
    },
    {
      "date": "2025-02-06",
      "id": "100613",
      "original_text": "Einreichung neuer Dokumente\nBrandenburg Amtsgericht Potsdam HRB 19166\nE.ON Energie Dialog GmbH – Potsdam",
      "type": "Einreichung neuer Dokumente",
      "state": "Brandenburg",
      "amtsgericht": "Amtsgericht Potsdam",
      "registernummer": "HRB 19166",
      "registerart": "HRB",
      "company_name": "E.ON Energie Dialog GmbH",
      "company_seat": "Potsdam",
      "details": "06.02.2025 (Bekanntmachungsdatum)\n\nBrandenburg Amtsgericht Potsdam HRB 19166\nEinreichung neuer Dokumente\n\nE.ON Energie Dialog GmbH\nGesellschaft mit beschränkter Haftung\nPotsdam\n\nAls nicht eingetragen wird veröffentlicht: Eine Liste der Mitglieder des Aufsichtsrates wurde zum Handelsregister eingereicht."
    },
    {
      "date": "2025-02-06",
      "id": "100614",
      "original_text": "Sonstige Registerbekanntmachung\nBaden-Württemberg Amtsgericht Stuttgart HRB 775306\nAhrbach Süd GmbH – Schwäbisch Hall",
      "type": "Sonstige Registerbekanntmachung",
      "state": "Baden-Württemberg",
      "amtsgericht": "Amtsgericht Stuttgart",
      "registernummer": "HRB 775306",
      "registerart": "HRB",
      "company_name": "Ahrbach Süd GmbH",
      "company_seat": "Schwäbisch Hall",
      "details": "06.02.2025 (Bekanntmachungsdatum)\n\nBaden-Württemberg Amtsgericht Stuttgart HRB 775306\nSonstige Registerbekanntmachung 06.02.2025 (Eintragungsdatum)\n\nAhrbach Süd GmbH\nGesellschaft mit beschränkter Haftung\nSchwäbisch Hall\n\nAls nicht eingetragen wird bekanntgemacht:\nDen Gläubigern der Gesellschaft, deren Forderungen begründet worden sind, bevor die Eintragung der Beendigung des Vertrages in das Handelsregister nach § 10 HGB als bekanntgemacht gilt, ist vom anderen Vertragsteil Sicherheit zu leisten, wenn sie sich binnen sechs Monaten nach der Bekanntmachung zu diesem Zweck bei ihm melden."
    },
    {
      "date": "2025-02-06",
      "id": "100615",
      "original_text": "Einreichung neuer Dokumente\nBaden-Württemberg Amtsgericht Stuttgart HRB 734176\nStadthalle Reutlingen GmbH – Reutlingen",
      "type": "Einreichung neuer Dokumente",
      "state": "Baden-Württemberg",
      "amtsgericht": "Amtsgericht Stuttgart",
      "registernummer": "HRB 734176",
      "registerart": "HRB",
      "company_name": "Stadthalle Reutlingen GmbH",
      "company_seat": "Reutlingen",
      "details": "06.02.2025 (Bekanntmachungsdatum)\n\nBaden-Württemberg Amtsgericht Stuttgart HRB 734176\nEinreichung neuer Dokumente\n\nStadthalle Reutlingen GmbH\nGesellschaft mit beschränkter Haftung\nReutlingen\n\nDie Gesellschaft hat am 03.02.2025 die Liste über die Zusammensetzung des Aufsichtsrats zum Handelsregister eingereicht."
    },
    {
      "date": "2025-02-06",
      "id": "100616",
      "original_text": "Löschungsankündigung\nSchleswig-Holstein Amtsgericht Lübeck HRB 24891\nISL-Industrieller Service und Logistik GmbH – Lübeck",
      "type": "Löschungsankündigung",
      "state": "Schleswig-Holstein",
      "amtsgericht": "Amtsgericht Lübeck",
      "registernummer": "HRB 24891",
      "registerart": "HRB",
      "company_name": "ISL-Industrieller Service und Logistik GmbH",
      "company_seat": "Lübeck",
      "details": "06.02.2025 (Bekanntmachungsdatum)\n\nSchleswig-Holstein Amtsgericht Lübeck HRB 24891\nLöschungsankündigung\n\nISL-Industrieller Service und Logistik GmbH\nGesellschaft mit beschränkter Haftung\nLübeck\n\nEs ist die Löschung der nachstehenden Gesellschaft wegen Vermögenslosigkeit gemäß § 394 FamFG beabsichtigt."
    },
    {
      "date": "2025-02-06",
      "id": "100617",
      "original_text": "Löschungsankündigung\nBaden-Württemberg Amtsgericht Mannheim HRB 729928\nZ.K. Wohnungsbau GmbH – Hockenheim",
      "type": "Löschungsankündigung",
      "state": "Baden-Württemberg",
      "amtsgericht": "Amtsgericht Mannheim",
      "registernummer": "HRB 729928",
      "registerart": "HRB",
      "company_name": "Z.K. Wohnungsbau GmbH",
      "company_seat": "Hockenheim",
      "details": "06.02.2025 (Bekanntmachungsdatum)\n\nBaden-Württemberg Amtsgericht Mannheim HRB 729928\nLöschungsankündigung\n\nZ.K. Wohnungsbau GmbH\nGesellschaft mit beschränkter Haftung\nHockenheim\n\nDas Gericht beabsichtigt, die Gesellschaft wegen Vermögenslosigkeit im Handelsregister von Amts wegen nach § 394 FamFG zu löschen. Die Frist zur Geltendmachung eines Widerspruchs gegen die beabsichtigte Löschung ist auf einen Monat ab Veröffentlichung bestimmt."
    },
    {
      "date": "2025-02-06",
      "id": "100618",
      "original_text": "Registerbekanntmachung nach dem Umwandlungsgesetz\nHamburg Amtsgericht Hamburg HRB 24006\nS + P Import-Handels-Gesellschaft mit beschränkter Haftung – Hamburg",
      "type": "Registerbekanntmachung nach dem Umwandlungsgesetz",
      "state": "Hamburg",
      "amtsgericht": "Amtsgericht Hamburg",
      "registernummer": "HRB 24006",
      "registerart": "HRB",
      "company_name": "S + P Import-Handels-Gesellschaft mit beschränkter Haftung",
      "company_seat": "Hamburg",
      "details": "06.02.2025 (Bekanntmachungsdatum)\n\nHamburg Amtsgericht Hamburg HRB 24006\nRegisterbekanntmachung nach dem Umwandlungsgesetz 30.12.2024 (Eintragungsdatum)\n\nS + P Import-Handels-Gesellschaft mit beschränkter Haftung\nGesellschaft mit beschränkter Haftung\nHamburg\n\nAls nicht eingetragen wird bekannt gemacht:\nDen Gläubigern der an der Verschmelzung beteiligten Gesellschaften ist, wenn sie binnen sechs Monaten nach dem Tag, an dem die Eintragung der Verschmelzung in das Register des Sitzes desjenigen Rechtsträgers, dessen Gläubiger sie sind, nach § 19 Absatz 3 UmwG als bekannt gemacht gilt, ihren Anspruch nach Grund und Höhe schriftlich anmelden, Sicherheit zu leisten, soweit sie nicht Befriedigung verlangen können. Dieses Recht steht den Gläubigern jedoch nur zu, wenn sie glaubhaft machen, dass durch die Verschmelzung die Erfüllung ihrer Forderung gefährdet wird."
    },
    {
      "date": "2025-02-06",
      "id": "100619",
      "original_text": "Löschungsankündigung\nBerlin Amtsgericht Berlin (Charlottenburg) HRB 197003\nPROPERTY CUP Golf Championship UG (haftungsbeschränkt) – Berlin",
      "type": "Löschungsankündigung",
      "state": "Berlin",
      "amtsgericht": "Amtsgericht Berlin (Charlottenburg)",
      "registernummer": "HRB 197003",
      "registerart": "HRB",
      "company_name": "PROPERTY CUP Golf Championship UG (haftungsbeschränkt)",
      "company_seat": "Berlin",
      "details": "06.02.2025 (Bekanntmachungsdatum)\n\nBerlin Amtsgericht Berlin (Charlottenburg) HRB 197003\nLöschungsankündigung\n\nPROPERTY CUP Golf Championship UG (haftungsbeschränkt)\nGesellschaft mit beschränkter Haftung\nBerlin\n\nBei der nachstehenden Gesellschaft wird das Amtslöschungsverfahren gemäß § 394 FamFG eingeleitet. Widerspruchsfrist 6 Wochen"
    },
    {
      "date": "2025-02-06",
      "id": "100620",
      "original_text": "Registerbekanntmachung nach dem Umwandlungsgesetz\nHamburg Amtsgericht Hamburg HRB 90225\nSmartex GmbH – Hamburg",
      "type": "Registerbekanntmachung nach dem Umwandlungsgesetz",
      "state": "Hamburg",
      "amtsgericht": "Amtsgericht Hamburg",
      "registernummer": "HRB 90225",
      "registerart": "HRB",
      "company_name": "Smartex GmbH",
      "company_seat": "Hamburg",
      "details": "06.02.2025 (Bekanntmachungsdatum)\n\nHamburg Amtsgericht Hamburg HRB 90225\nRegisterbekanntmachung nach dem Umwandlungsgesetz 06.02.2025 (Eintragungsdatum)\n\nSmartex GmbH\nGesellschaft mit beschränkter Haftung\nHamburg\n\nAls nicht eingetragen wird bekannt gemacht:\nDen Gläubigern der an der Verschmelzung beteiligten Rechtsträger ist, wenn sie binnen sechs Monaten nach dem Tag, an dem die Eintragung der Verschmelzung in das Register des Sitzes desjenigen Rechtsträgers, dessen Gläubiger sie sind, nach § 19 Absatz 3 UmwG als bekannt gemacht gilt, ihren Anspruch nach Grund und Höhe schriftlich anmelden, Sicherheit zu leisten, soweit sie nicht Befriedigung verlangen können. Dieses Recht steht den Gläubigern jedoch nur zu, wenn sie glaubhaft machen, dass durch die Verschmelzung die Erfüllung ihrer Forderung gefährdet wird."
    },
    {
      "date": "2025-02-06",
      "id": "100621",
      "original_text": "Einreichung neuer Dokumente\nBrandenburg Amtsgericht Neuruppin HRB 2161\nAWU Abfallwirtschafts-Union Ostprignitz-Ruppin GmbH – Märkisch Linden",
      "type": "Einreichung neuer Dokumente",
      "state": "Brandenburg",
      "amtsgericht": "Amtsgericht Neuruppin",
      "registernummer": "HRB 2161",
      "registerart": "HRB",
      "company_name": "AWU Abfallwirtschafts-Union Ostprignitz-Ruppin GmbH",
      "company_seat": "Märkisch Linden",
      "details": "06.02.2025 (Bekanntmachungsdatum)\n\nBrandenburg Amtsgericht Neuruppin HRB 2161\nEinreichung neuer Dokumente\n\nAWU Abfallwirtschafts-Union Ostprignitz-Ruppin GmbH\nGesellschaft mit beschränkter Haftung\nMärkisch Linden\n\nAls nicht eingetragen wird veröffentlicht: Eine Liste der Mitglieder des Aufsichtsrates wurde zum Handelsregister eingereicht."
    },
    {
      "date": "2025-02-06",
      "id": "100622",
      "original_text": "Einreichung neuer Dokumente\nBrandenburg Amtsgericht Frankfurt/Oder HRB 16777\ntxt AG Rechtsanwaltsgesellschaft – Eisenhüttenstadt",
      "type": "Einreichung neuer Dokumente",
      "state": "Brandenburg",
      "amtsgericht": "Amtsgericht Frankfurt/Oder",
      "registernummer": "HRB 16777",
      "registerart": "HRB",
      "company_name": "txt AG Rechtsanwaltsgesellschaft",
      "company_seat": "Eisenhüttenstadt",
      "details": "06.02.2025 (Bekanntmachungsdatum)\n\nBrandenburg Amtsgericht Frankfurt/Oder HRB 16777\nEinreichung neuer Dokumente\n\ntxt AG Rechtsanwaltsgesellschaft\nAktiengesellschaft\nEisenhüttenstadt\n\nAls nicht eingetragen wird veröffentlicht: Eine Liste der Mitglieder des Aufsichtsrates wurde zum Handelsregister eingereicht."
    },
    {
      "date": "2025-02-06",
      "id": "100623",
      "original_text": "Einreichung neuer Dokumente\nBaden-Württemberg Amtsgericht Mannheim HRB 1742\nMKB Mannheimer Kommunalbeteiligungen GmbH – Mannheim",
      "type": "Einreichung neuer Dokumente",
      "state": "Baden-Württemberg",
      "amtsgericht": "Amtsgericht Mannheim",
      "registernummer": "HRB 1742",
      "registerart": "HRB",
      "company_name": "MKB Mannheimer Kommunalbeteiligungen GmbH",
      "company_seat": "Mannheim",
      "details": "06.02.2025 (Bekanntmachungsdatum)\n\nBaden-Württemberg Amtsgericht Mannheim HRB 1742\nEinreichung neuer Dokumente\n\nMKB Mannheimer Kommunalbeteiligungen GmbH\nGesellschaft mit beschränkter Haftung\nMannheim\n\nDie Gesellschaft hat am 05.02.2025 die Liste über die Zusammensetzung des Aufsichtsrats zum Handelsregister eingereicht."
    },
    {
      "date": "2025-02-06",
      "id": "100624",
      "original_text": "Sonstige Registerbekanntmachung\nBerlin Amtsgericht Berlin (Charlottenburg) HRB 38874\nBeta Systems Software Aktiengesellschaft – Berlin",
      "type": "Sonstige Registerbekanntmachung",
      "state": "Berlin",
      "amtsgericht": "Amtsgericht Berlin (Charlottenburg)",
      "registernummer": "HRB 38874",
      "registerart": "HRB",
      "company_name": "Beta Systems Software Aktiengesellschaft",
      "company_seat": "Berlin",
      "details": "06.02.2025 (Bekanntmachungsdatum)\n\nBerlin Amtsgericht Berlin (Charlottenburg) HRB 38874\nSonstige Registerbekanntmachung\n\nBeta Systems Software Aktiengesellschaft\nAktiengesellschaft\nBerlin\n\nAls nicht eingetragen wird veröffentlicht: Die Gesellschaft hat einen Verschmelzungsvertrag mit der SPARTA AG mit Sitz in Heidelberg, eingetragen im Handelsregister des Amtsgerichts Mannheim unter HRB 739820, als übernehmende Gesellschaft eingereicht."
    },
    {
      "date": "2025-02-06",
      "id": "100625",
      "original_text": "Einreichung neuer Dokumente\nSachsen-Anhalt Amtsgericht Stendal HRB 102104\nBürgschaftsbank Sachsen-Anhalt GmbH – Magdeburg",
      "type": "Einreichung neuer Dokumente",
      "state": "Sachsen-Anhalt",
      "amtsgericht": "Amtsgericht Stendal",
      "registernummer": "HRB 102104",
      "registerart": "HRB",
      "company_name": "Bürgschaftsbank Sachsen-Anhalt GmbH",
      "company_seat": "Magdeburg",
      "details": "06.02.2025 (Bekanntmachungsdatum)\n\nSachsen-Anhalt Amtsgericht Stendal HRB 102104\nEinreichung neuer Dokumente\n\nBürgschaftsbank Sachsen-Anhalt GmbH\nGesellschaft mit beschränkter Haftung\nMagdeburg\n\nEine Liste der Mitglieder des Aufsichtsrates wurde zum Handelsregister eingereicht."
    },
    {
      "date": "2025-02-06",
      "id": "100626",
      "original_text": "Löschungsankündigung\nBerlin Amtsgericht Berlin (Charlottenburg) HRB 139763\nBrillant 1424. GmbH – Berlin",
      "type": "Löschungsankündigung",
      "state": "Berlin",
      "amtsgericht": "Amtsgericht Berlin (Charlottenburg)",
      "registernummer": "HRB 139763",
      "registerart": "HRB",
      "company_name": "Brillant 1424. GmbH",
      "company_seat": "Berlin",
      "details": "06.02.2025 (Bekanntmachungsdatum)\n\nBerlin Amtsgericht Berlin (Charlottenburg) HRB 139763\nLöschungsankündigung\n\nBrillant 1424. GmbH\nGesellschaft mit beschränkter Haftung\nBerlin\n\nBei der nachstehenden Gesellschaft wird das Amtslöschungsverfahren gemäß § 394 FamFG eingeleitet. Widerspruchsfrist 6 Wochen"
    },
    {
      "date": "2025-02-06",
      "id": "100627",
      "original_text": "Einreichung neuer Dokumente\nBerlin Amtsgericht Berlin (Charlottenburg) HRB 161327\nKreuzberger Kinderstiftung gemeinnützige Aktiengesellschaft – Berlin",
      "type": "Einreichung neuer Dokumente",
      "state": "Berlin",
      "amtsgericht": "Amtsgericht Berlin (Charlottenburg)",
      "registernummer": "HRB 161327",
      "registerart": "HRB",
      "company_name": "Kreuzberger Kinderstiftung gemeinnützige Aktiengesellschaft",
      "company_seat": "Berlin",
      "details": "06.02.2025 (Bekanntmachungsdatum)\n\nBerlin Amtsgericht Berlin (Charlottenburg) HRB 161327\nEinreichung neuer Dokumente\n\nKreuzberger Kinderstiftung gemeinnützige Aktiengesellschaft\nAktiengesellschaft\nBerlin\n\nAls nicht eingetragen wird veröffentlicht: Es wurde eine neue Liste der Aufsichtsratsmitglieder eingereicht (§52 GmbHG)."
    },
    {
      "date": "2025-02-06",
      "id": "100628",
      "original_text": "Löschungsankündigung\nMecklenburg-Vorpommern Amtsgericht Stralsund HRB 22496\nDon Camillo und Peppone UG (haftungsbeschränkt) – Stralsund",
      "type": "Löschungsankündigung",
      "state": "Mecklenburg-Vorpommern",
      "amtsgericht": "Amtsgericht Stralsund",
      "registernummer": "HRB 22496",
      "registerart": "HRB",
      "company_name": "Don Camillo und Peppone UG (haftungsbeschränkt)",
      "company_seat": "Stralsund",
      "details": "06.02.2025 (Bekanntmachungsdatum)\n\nMecklenburg-Vorpommern Amtsgericht Stralsund HRB 22496\nLöschungsankündigung 06.02.2025 (Eintragungsdatum)\n\nDon Camillo und Peppone UG (haftungsbeschränkt)\nGesellschaft mit beschränkter Haftung\nStralsund\n\nDas Registergericht beabsichtigt, die im Handelsregister eingetragene Gesellschaft von Amts wegen nach § 394 FamFG zu löschen. Die Frist zur Erhebung eines Widerspruchs gegen die beabsichtigte Löschung wird auf 1 Monat festgesetzt."
    },
    {
      "date": "2025-02-06",
      "id": "100629",
      "original_text": "Löschungsankündigung\nBaden-Württemberg Amtsgericht Ulm HRB 733046\nRegionalanlage GmbH – Wangen im Allgäu",
      "type": "Löschungsankündigung",
      "state": "Baden-Württemberg",
      "amtsgericht": "Amtsgericht Ulm",
      "registernummer": "HRB 733046",
      "registerart": "HRB",
      "company_name": "Regionalanlage GmbH",
      "company_seat": "Wangen im Allgäu",
      "details": "06.02.2025 (Bekanntmachungsdatum)\n\nBaden-Württemberg Amtsgericht Ulm HRB 733046\nLöschungsankündigung\n\nRegionalanlage GmbH\nGesellschaft mit beschränkter Haftung\nWangen im Allgäu\n\nAls nicht eingetragen wird bekanntgemacht:\nDas Gericht beabsichtigt, die Gesellschaft wegen Vermögenslosigkeit im Handelsregister von Amts wegen nach § 394 FamFG zu löschen. Die Frist zur Geltendmachung eines Widerspruchs gegen die beabsichtigte Löschung ist auf  einen Monat ab Veröffentlichung bestimmt."
    },
    {
      "date": "2025-02-06",
      "id": "100630",
      "original_text": "Registerbekanntmachung nach dem Umwandlungsgesetz\nSchleswig-Holstein Amtsgericht Flensburg HRB 76 HU\nNorddeutsche Verkehrsbetriebe GmbH – Husum",
      "type": "Registerbekanntmachung nach dem Umwandlungsgesetz",
      "state": "Schleswig-Holstein",
      "amtsgericht": "Amtsgericht Flensburg",
      "registernummer": "HRB 76 HU",
      "registerart": "HRB",
      "company_name": "Norddeutsche Verkehrsbetriebe GmbH",
      "company_seat": "Husum",
      "details": "06.02.2025 (Bekanntmachungsdatum)\n\nSchleswig-Holstein Amtsgericht Flensburg HRB 76 HU\nRegisterbekanntmachung nach dem Umwandlungsgesetz 06.02.2025 (Eintragungsdatum)\n\nNorddeutsche Verkehrsbetriebe GmbH\nGesellschaft mit beschränkter Haftung\nHusum\n\nZu Eintragungsnummer 20 vom 06.02.2025 wird als nicht eingetragen veröffentlicht: Den Gläubigern der an der Verschmelzung beteiligten Rechtsträger ist, wenn sie binnen sechs Monaten nach dem Tag, an dem die Eintragung der Verschmelzung in das Register des Sitzes desjenigen Rechtsträgers, dessen Gläubiger sie sind, als bekannt gemacht gilt, ihren Anspruch nach Grund und Höhe in Textform anmelden, Sicherheit zu leisten, soweit sie nicht Befriedigung verlangen können. Dieses Recht steht den Gläubigern jedoch nur zu, wenn sie glaubhaft machen, dass durch die Verschmelzung die Erfüllung ihrer Forderung gefährdet wird."
    },
    {
      "date": "2025-02-06",
      "id": "100631",
      "original_text": "Registerbekanntmachung nach dem Umwandlungsgesetz\nSchleswig-Holstein Amtsgericht Lübeck HRB 1373 RZ\nCompanyCheck Deutschland GmbH – Ratzeburg",
      "type": "Registerbekanntmachung nach dem Umwandlungsgesetz",
      "state": "Schleswig-Holstein",
      "amtsgericht": "Amtsgericht Lübeck",
      "registernummer": "HRB 1373 RZ",
      "registerart": "HRB",
      "company_name": "CompanyCheck Deutschland GmbH",
      "company_seat": "Ratzeburg",
      "details": "06.02.2025 (Bekanntmachungsdatum)\n\nSchleswig-Holstein Amtsgericht Lübeck HRB 1373 RZ\nRegisterbekanntmachung nach dem Umwandlungsgesetz 06.02.2025 (Eintragungsdatum)\n\nCompanyCheck Deutschland GmbH\nGesellschaft mit beschränkter Haftung\nRatzeburg\n\nZu Eintragungsnummer 9 vom 06.02.2025 wird als nicht eingetragen veröffentlicht:\nDen Gläubigern der an der Verschmelzung beteiligten Rechtsträger ist, wenn sie binnen sechs Monaten nach dem Tag, an dem die Eintragung der Verschmelzung in das Register des Sitzes desjenigen Rechtsträgers, dessen Gläubiger sie sind, als bekannt gemacht gilt, ihren Anspruch nach Grund und Höhe schriftlich anmelden, Sicherheit zu leisten, soweit sie nicht Befriedigung verlangen können. Dieses Recht steht den Gläubigern jedoch nur zu, wenn sie glaubhaft machen, dass durch die Verschmelzung die Erfüllung ihrer Forderung gefährdet wird."
    },
    {
      "date": "2025-02-06",
      "id": "100632",
      "original_text": "Registerbekanntmachung nach dem Umwandlungsgesetz\nBerlin Amtsgericht Berlin (Charlottenburg) HRB 201963\nHerbold & Kollegen GmbH Steuerberatungsgesellschaft – Berlin",
      "type": "Registerbekanntmachung nach dem Umwandlungsgesetz",
      "state": "Berlin",
      "amtsgericht": "Amtsgericht Berlin (Charlottenburg)",
      "registernummer": "HRB 201963",
      "registerart": "HRB",
      "company_name": "Herbold & Kollegen GmbH Steuerberatungsgesellschaft",
      "company_seat": "Berlin",
      "details": "06.02.2025 (Bekanntmachungsdatum)\n\nBerlin Amtsgericht Berlin (Charlottenburg) HRB 201963\nRegisterbekanntmachung nach dem Umwandlungsgesetz 06.02.2025 (Eintragungsdatum)\n\nHerbold & Kollegen GmbH Steuerberatungsgesellschaft\nGesellschaft mit beschränkter Haftung\nBerlin\n\nZu Eintragungsnummer 5 vom 06.02.2025 wird als nicht eingetragen veröffentlicht:\n\nDen Gläubigern der an der Verschmelzung beteiligten Rechtsträger ist, wenn sie binnen sechs Monaten nach dem Tag, an dem die Eintragung der Verschmelzung in das Register des Sitzes desjenigen Rechtsträgers, dessen Gläubiger sie sind, als bekannt gemacht gilt, ihren Anspruch nach Grund und Höhe schriftlich anmelden, Sicherheit zu leisten, soweit sie nicht Befriedigung verlangen können. Dieses Recht steht den Gläubigern jedoch nur zu, wenn sie glaubhaft machen, dass durch die Verschmelzung die Erfüllung ihrer Forderung gefährdet wird. Das Recht, Sicherheitsleistung zu verlangen, steht Gläubigern nicht zu, die im Falle der Insolvenz ein Recht auf vorzugsweise Befriedigung aus einer Deckungsmasse haben, die nach gesetzlicher Vorschrift zu ihrem Schutz errichtet und staatlich überwacht ist."
    },
    {
      "date": "2025-02-06",
      "id": "100633",
      "original_text": "Registerbekanntmachung nach dem Umwandlungsgesetz\nBerlin Amtsgericht Berlin (Charlottenburg) HRB 271873\nnur-chicken GmbH – Berlin",
      "type": "Registerbekanntmachung nach dem Umwandlungsgesetz",
      "state": "Berlin",
      "amtsgericht": "Amtsgericht Berlin (Charlottenburg)",
      "registernummer": "HRB 271873",
      "registerart": "HRB",
      "company_name": "nur-chicken GmbH",
      "company_seat": "Berlin",
      "details": "06.02.2025 (Bekanntmachungsdatum)\n\nBerlin Amtsgericht Berlin (Charlottenburg) HRB 271873\nRegisterbekanntmachung nach dem Umwandlungsgesetz 05.02.2025 (Eintragungsdatum)\n\nnur-chicken GmbH\nGesellschaft mit beschränkter Haftung\nBerlin\n\nZu Eintragungsnummer 1 vom 05.02.2025 wird als nicht eingetragen veröffentlicht: Den Gläubigern der an der Spaltung beteiligten Rechtsträger ist, wenn sie binnen sechs Monaten nach dem Tag, an dem die Eintragung der Spaltung in das Register des Sitzes desjenigen Rechtsträgers, dessen Gläubiger sie sind, als bekannt gemacht gilt, ihren Anspruch nach Grund und Höhe schriftlich anmelden, Sicherheit zu leisten, soweit sie nicht Befriedigung verlangen können. Dieses Recht steht den Gläubigern jedoch nur zu, wenn sie glaubhaft machen, dass durch die Spaltung die Erfüllung ihrer Forderung gefährdet wird. Das Recht, Sicherheitsleistung zu verlangen, steht Gläubigern nicht zu, die im Falle der Insolvenz ein Recht auf vorzugsweise Befriedigung aus einer Deckungsmasse haben, die nach gesetzlicher Vorschrift zu ihrem Schutz errichtet und staatlich überwacht ist."
    },
    {
      "date": "2025-02-06",
      "id": "100634",
      "original_text": "Registerbekanntmachung nach dem Umwandlungsgesetz\nBerlin Amtsgericht Berlin (Charlottenburg) HRB 67798\nHerbold und Schuller Steuerberatungsgesellschaft mbH – Berlin",
      "type": "Registerbekanntmachung nach dem Umwandlungsgesetz",
      "state": "Berlin",
      "amtsgericht": "Amtsgericht Berlin (Charlottenburg)",
      "registernummer": "HRB 67798",
      "registerart": "HRB",
      "company_name": "Herbold und Schuller Steuerberatungsgesellschaft mbH",
      "company_seat": "Berlin",
      "details": "06.02.2025 (Bekanntmachungsdatum)\n\nBerlin Amtsgericht Berlin (Charlottenburg) HRB 67798\nRegisterbekanntmachung nach dem Umwandlungsgesetz 06.02.2025 (Eintragungsdatum)\n\nHerbold und Schuller Steuerberatungsgesellschaft mbH\nGesellschaft mit beschränkter Haftung\nBerlin\n\nZu Eintragungsnummer 7 vom 06.02.2025 wird als nicht eingetragen veröffentlicht:\n\nDen Gläubigern der an der Verschmelzung beteiligten Rechtsträger ist, wenn sie binnen sechs Monaten nach dem Tag, an dem die Eintragung der Verschmelzung in das Register des Sitzes desjenigen Rechtsträgers, dessen Gläubiger sie sind, als bekannt gemacht gilt, ihren Anspruch nach Grund und Höhe schriftlich anmelden, Sicherheit zu leisten, soweit sie nicht Befriedigung verlangen können. Dieses Recht steht den Gläubigern jedoch nur zu, wenn sie glaubhaft machen, dass durch die Verschmelzung die Erfüllung ihrer Forderung gefährdet wird. Das Recht, Sicherheitsleistung zu verlangen, steht Gläubigern nicht zu, die im Falle der Insolvenz ein Recht auf vorzugsweise Befriedigung aus einer Deckungsmasse haben, die nach gesetzlicher Vorschrift zu ihrem Schutz errichtet und staatlich überwacht ist."
    },
    {
      "date": "2025-02-06",
      "id": "100635",
      "original_text": "Registerbekanntmachung nach dem Umwandlungsgesetz\nSachsen-Anhalt Amtsgericht Stendal HRB 209710\nDAN Schweineproduktion GmbH, Großkayna – Braunsbedra",
      "type": "Registerbekanntmachung nach dem Umwandlungsgesetz",
      "state": "Sachsen-Anhalt",
      "amtsgericht": "Amtsgericht Stendal",
      "registernummer": "HRB 209710",
      "registerart": "HRB",
      "company_name": "DAN Schweineproduktion GmbH, Großkayna",
      "company_seat": "Braunsbedra",
      "details": "06.02.2025 (Bekanntmachungsdatum)\n\nSachsen-Anhalt Amtsgericht Stendal HRB 209710\nRegisterbekanntmachung nach dem Umwandlungsgesetz 06.02.2025 (Eintragungsdatum)\n\nDAN Schweineproduktion GmbH, Großkayna\nGesellschaft mit beschränkter Haftung\nBraunsbedra\n\nNicht eingetragen:\nDen Gläubigern der an der Verschmelzung beteiligten Rechtsträger ist, wenn sie binnen sechs Monaten nach dem Tag, an dem die Eintragung der Verschmelzung nach § 19 Abs. 3 UmwG als bekanntgemacht gilt, ihren Anspruch nach Grund und Höhe schriftlich anmelden, Sicherheit zu leisten, soweit sie nicht Befriedigung verlangen können. Dieses Recht steht ihnen jedoch nur zu, wenn sie glaubhaft machen, dass durch die Verschmelzung die Erfüllung ihrer Forderung gefährdet wird."
    },
    {
      "date": "2025-02-06",
      "id": "100636",
      "original_text": "Registerbekanntmachung nach dem Umwandlungsgesetz\nSachsen-Anhalt Amtsgericht Stendal HRB 208717\nSchmidt Verwaltungs-GmbH Großkayna – Braunsbedra OT Großkayna",
      "type": "Registerbekanntmachung nach dem Umwandlungsgesetz",
      "state": "Sachsen-Anhalt",
      "amtsgericht": "Amtsgericht Stendal",
      "registernummer": "HRB 208717",
      "registerart": "HRB",
      "company_name": "Schmidt Verwaltungs-GmbH Großkayna",
      "company_seat": "Braunsbedra OT Großkayna",
      "details": "06.02.2025 (Bekanntmachungsdatum)\n\nSachsen-Anhalt Amtsgericht Stendal HRB 208717\nRegisterbekanntmachung nach dem Umwandlungsgesetz 06.02.2025 (Eintragungsdatum)\n\nSchmidt Verwaltungs-GmbH Großkayna\nGesellschaft mit beschränkter Haftung\nBraunsbedra OT Großkayna\n\nNicht eingetragen:\nDen Gläubigern der an der Verschmelzung beteiligten Rechtsträger ist, wenn sie binnen sechs Monaten nach dem Tag, an dem die Eintragung der Verschmelzung nach § 19 Abs. 3 UmwG als bekanntgemacht gilt, ihren Anspruch nach Grund und Höhe schriftlich anmelden, Sicherheit zu leisten, soweit sie nicht Befriedigung verlangen können. Dieses Recht steht ihnen jedoch nur zu, wenn sie glaubhaft machen, dass durch die Verschmelzung die Erfüllung ihrer Forderung gefährdet wird."
    },
    {
      "date": "2025-02-06",
      "id": "100637",
      "original_text": "Löschungsankündigung\nBaden-Württemberg Amtsgericht Freiburg HRB 7105\nB & F Dienstleistungs GmbH – Freiburg im Breisgau",
      "type": "Löschungsankündigung",
      "state": "Baden-Württemberg",
      "amtsgericht": "Amtsgericht Freiburg",
      "registernummer": "HRB 7105",
      "registerart": "HRB",
      "company_name": "B & F Dienstleistungs GmbH",
      "company_seat": "Freiburg im Breisgau",
      "details": "06.02.2025 (Bekanntmachungsdatum)\n\nBaden-Württemberg Amtsgericht Freiburg HRB 7105\nLöschungsankündigung\n\nB & F Dienstleistungs GmbH\nGesellschaft mit beschränkter Haftung\nFreiburg im Breisgau\n\nDas Gericht beabsichtigt, die Gesellschaft wegen Vermögenslosigkeit im Handelsregister von Amts wegen nach § 394 FamFG zu löschen. Die Frist zur Geltendmachung eines Widerspruchs gegen die beabsichtigte Löschung ist auf einen Monat ab Veröffentlichung bestimmt."
    },
    {
      "date": "2025-02-06",
      "id": "100638",
      "original_text": "Löschungsankündigung\nBaden-Württemberg Amtsgericht Stuttgart HRB 755741\nAIR MED Stuttgart GmbH – Stuttgart",
      "type": "Löschungsankündigung",
      "state": "Baden-Württemberg",
      "amtsgericht": "Amtsgericht Stuttgart",
      "registernummer": "HRB 755741",
      "registerart": "HRB",
      "company_name": "AIR MED Stuttgart GmbH",
      "company_seat": "Stuttgart",
      "details": "06.02.2025 (Bekanntmachungsdatum)\n\nBaden-Württemberg Amtsgericht Stuttgart HRB 755741\nLöschungsankündigung\n\nAIR MED Stuttgart GmbH\nGesellschaft mit beschränkter Haftung\nStuttgart\n\nDas Gericht beabsichtigt, die Gesellschaft wegen Vermögenslosigkeit im Handelsregister von Amts wegen nach § 394 FamFG zu löschen. Die Frist zur Geltendmachung eines Widerspruchs gegen die beabsichtigte Löschung ist auf zwei Monate ab Veröffentlichung bestimmt."
    },
    {
      "date": "2025-02-06",
      "id": "100639",
      "original_text": "Einreichung neuer Dokumente\nSachsen Amtsgericht Dresden HRB 18594\nACO AutoCenter Oberlausitz AG – Löbau",
      "type": "Einreichung neuer Dokumente",
      "state": "Sachsen",
      "amtsgericht": "Amtsgericht Dresden",
      "registernummer": "HRB 18594",
      "registerart": "HRB",
      "company_name": "ACO AutoCenter Oberlausitz AG",
      "company_seat": "Löbau",
      "details": "06.02.2025 (Bekanntmachungsdatum)\n\nSachsen Amtsgericht Dresden HRB 18594\nEinreichung neuer Dokumente 06.02.2025 (Eintragungsdatum)\n\nACO AutoCenter Oberlausitz AG\nAktiengesellschaft\nLöbau\n\nAm 20.01.2025 und 05.02.2025 wurden beim Handelsregister des Amtsgerichts Dresden die Listen der Mitglieder des Aufsichtsrats gemäß § 106 AktG eingereicht."
    },
    {
      "date": "2025-02-06",
      "id": "100640",
      "original_text": "Einreichung neuer Dokumente\nSachsen Amtsgericht Dresden HRB 21356\nNTT DATA Business Solutions Global Managed Services GmbH – Bautzen",
      "type": "Einreichung neuer Dokumente",
      "state": "Sachsen",
      "amtsgericht": "Amtsgericht Dresden",
      "registernummer": "HRB 21356",
      "registerart": "HRB",
      "company_name": "NTT DATA Business Solutions Global Managed Services GmbH",
      "company_seat": "Bautzen",
      "details": "06.02.2025 (Bekanntmachungsdatum)\n\nSachsen Amtsgericht Dresden HRB 21356\nEinreichung neuer Dokumente\n\nNTT DATA Business Solutions Global Managed Services GmbH\nGesellschaft mit beschränkter Haftung\nBautzen\n\nAm 04.02.2025 wurde beim Handelsregister des Amtsgerichts Dresden die Liste der Mitglieder des Aufsichtsrats gemäß § 52 GmbHG eingereicht."
    },
    {
      "date": "2025-02-06",
      "id": "100641",
      "original_text": "Einreichung neuer Dokumente\nNiedersachsen Amtsgericht Hannover HRB 57585\nITSC GmbH – Hannover",
      "type": "Einreichung neuer Dokumente",
      "state": "Niedersachsen",
      "amtsgericht": "Amtsgericht Hannover",
      "registernummer": "HRB 57585",
      "registerart": "HRB",
      "company_name": "ITSC GmbH",
      "company_seat": "Hannover",
      "details": "06.02.2025 (Bekanntmachungsdatum)\n\nNiedersachsen Amtsgericht Hannover HRB 57585\nEinreichung neuer Dokumente\n\nITSC GmbH\nGesellschaft mit beschränkter Haftung\nHannover\n\nDie Liste der Mitglieder des Aufsichtsrats wurde beim Registergericht eingereicht."
    },
    {
      "date": "2025-02-06",
      "id": "100642",
      "original_text": "Löschungsankündigung\nNiedersachsen Amtsgericht Braunschweig HRB 204866\nDeparso Beteiligungs GmbH – Braunschweig",
      "type": "Löschungsankündigung",
      "state": "Niedersachsen",
      "amtsgericht": "Amtsgericht Braunschweig",
      "registernummer": "HRB 204866",
      "registerart": "HRB",
      "company_name": "Deparso Beteiligungs GmbH",
      "company_seat": "Braunschweig",
      "details": "06.02.2025 (Bekanntmachungsdatum)\n\nNiedersachsen Amtsgericht Braunschweig HRB 204866\nLöschungsankündigung 06.02.2025 (Eintragungsdatum)\n\nDeparso Beteiligungs GmbH\nGesellschaft mit beschränkter Haftung\nBraunschweig\n\nDas Registergericht beabsichtigt, die Gesellschaft von Amts wegen nach § 394 FamFG zu löschen. Die Frist zur Erhebung eines Widerspruchs ist auf 1 Monat ab dieser Registerbekanntmachung festgesetzt."
    },
    {
      "date": "2025-02-06",
      "id": "100643",
      "original_text": "Löschungsankündigung\nNiedersachsen Amtsgericht Aurich HRB 203186\nSMF-Schlosserei Metallbau Fehse UG (haftungsbeschränkt) – Friedeburg",
      "type": "Löschungsankündigung",
      "state": "Niedersachsen",
      "amtsgericht": "Amtsgericht Aurich",
      "registernummer": "HRB 203186",
      "registerart": "HRB",
      "company_name": "SMF-Schlosserei Metallbau Fehse UG (haftungsbeschränkt)",
      "company_seat": "Friedeburg",
      "details": "06.02.2025 (Bekanntmachungsdatum)\n\nNiedersachsen Amtsgericht Aurich HRB 203186\nLöschungsankündigung 06.02.2025 (Eintragungsdatum)\n\nSMF-Schlosserei Metallbau Fehse UG (haftungsbeschränkt)\nGesellschaft mit beschränkter Haftung\nFriedeburg\n\nDas Registergericht beabsichtigt, die Gesellschaft von Amts wegen nach § 394 FamFG zu löschen. Die Frist zur Erhebung eines Widerspruchs ist auf 1 Monat ab dieser Registerbekanntmachung festgesetzt."
    },
    {
      "date": "2025-02-06",
      "id": "100644",
      "original_text": "Registerbekanntmachung nach dem Umwandlungsgesetz\nNiedersachsen Amtsgericht Aurich HRB 207550\nLeda Immoblien VII GmbH – Leer",
      "type": "Registerbekanntmachung nach dem Umwandlungsgesetz",
      "state": "Niedersachsen",
      "amtsgericht": "Amtsgericht Aurich",
      "registernummer": "HRB 207550",
      "registerart": "HRB",
      "company_name": "Leda Immoblien VII GmbH",
      "company_seat": "Leer",
      "details": "06.02.2025 (Bekanntmachungsdatum)\n\nNiedersachsen Amtsgericht Aurich HRB 207550\nRegisterbekanntmachung nach dem Umwandlungsgesetz 06.02.2025 (Eintragungsdatum)\n\nLeda Immoblien VII GmbH\nGesellschaft mit beschränkter Haftung\nLeer\n\nDen Gläubigern der an der formwechselnden Umwandlung beteiligten Rechtsträger ist, wenn sie binnen sechs Monaten nach dem Tag, an dem die Eintragung der Umwandlung in das Register des Sitzes desjenigen Rechtsträgers, dessen Gläubiger sie sind, nach § 19 Abs. 3 UmwG als bekannt gemacht gilt, ihren Anspruch nach Grund und Höhe schriftlich anmelden, Sicherheit zu leisten, soweit sie nicht Befriedigung verlangen können. Dieses Recht steht den Gläubigern jedoch nur zu, wenn sie glaubhaft machen, dass durch die formwechselnde Umwandlung die Erfüllung der Forderung gefährdet wird."
    },
    {
      "date": "2025-02-06",
      "id": "100645",
      "original_text": "Löschungsankündigung\nNiedersachsen Amtsgericht Braunschweig HRB 205853\nFarya Baumaschinen Fabrik GmbH – Braunschweig",
      "type": "Löschungsankündigung",
      "state": "Niedersachsen",
      "amtsgericht": "Amtsgericht Braunschweig",
      "registernummer": "HRB 205853",
      "registerart": "HRB",
      "company_name": "Farya Baumaschinen Fabrik GmbH",
      "company_seat": "Braunschweig",
      "details": "06.02.2025 (Bekanntmachungsdatum)\n\nNiedersachsen Amtsgericht Braunschweig HRB 205853\nLöschungsankündigung\n\nFarya Baumaschinen Fabrik GmbH\nGesellschaft mit beschränkter Haftung\nBraunschweig\n\nDas Registergericht beabsichtigt, die Gesellschaft von Amts wegen nach § 394 FamFG zu löschen. Die Frist zur Erhebung eines Widerspruchs ist auf 1 Monat ab dieser Registerbekanntmachung festgesetzt."
    },
    {
      "date": "2025-02-06",
      "id": "100646",
      "original_text": "Löschungsankündigung\nNiedersachsen Amtsgericht Hannover HRB 200800\nPS Handel Logistik und Transport GmbH – Isernhagen",
      "type": "Löschungsankündigung",
      "state": "Niedersachsen",
      "amtsgericht": "Amtsgericht Hannover",
      "registernummer": "HRB 200800",
      "registerart": "HRB",
      "company_name": "PS Handel Logistik und Transport GmbH",
      "company_seat": "Isernhagen",
      "details": "06.02.2025 (Bekanntmachungsdatum)\n\nNiedersachsen Amtsgericht Hannover HRB 200800\nLöschungsankündigung\n\nPS Handel Logistik und Transport GmbH\nGesellschaft mit beschränkter Haftung\nIsernhagen\n\nDas Registergericht beabsichtigt, die Gesellschaft von Amts wegen nach § 394 FamFG zu löschen. Die Frist zur Erhebung eines Widerspruchs ist auf 1 Monat ab dieser Registerbekanntmachung festgesetzt."
    },
    {
      "date": "2025-02-06",
      "id": "100647",
      "original_text": "Einreichung neuer Dokumente\nNiedersachsen Amtsgericht Braunschweig HRB 100359 früher Amtsgericht Wolfsburg\nKlier Hair Group GmbH – Wolfsburg",
      "type": "Einreichung neuer Dokumente",
      "state": "Niedersachsen",
      "amtsgericht": "Amtsgericht Braunschweig",
      "registernummer": "HRB 100359",
      "registerart": "HRB",
      "company_name": "Klier Hair Group GmbH",
      "company_seat": "Wolfsburg",
      "former_amtsgericht": "Wolfsburg",
      "details": "06.02.2025 (Bekanntmachungsdatum)\n\nNiedersachsen Amtsgericht Braunschweig HRB 100359 früher Amtsgericht Wolfsburg\nEinreichung neuer Dokumente 06.02.2025 (Eintragungsdatum)\n\nKlier Hair Group GmbH\nGesellschaft mit beschränkter Haftung\nWolfsburg\n\nDie Liste der Mitglieder des Aufsichtsrats wurde beim Registergericht eingereicht."
    },
    {
      "date": "2025-02-06",
      "id": "100648",
      "original_text": "Registerbekanntmachung nach dem Umwandlungsgesetz\nNiedersachsen Amtsgericht Walsrode VR 201252\nHeimat- und Geschichtsverein Worpswede e. V. – Worpswede",
      "type": "Registerbekanntmachung nach dem Umwandlungsgesetz",
      "state": "Niedersachsen",
      "amtsgericht": "Amtsgericht Walsrode",
      "registernummer": "VR 201252",
      "registerart": "VR",
      "company_name": "Heimat- und Geschichtsverein Worpswede e. V.",
      "company_seat": "Worpswede",
      "details": "06.02.2025 (Bekanntmachungsdatum)\n\nNiedersachsen Amtsgericht Walsrode VR 201252\nRegisterbekanntmachung nach dem Umwandlungsgesetz 06.02.2025 (Eintragungsdatum)\n\nHeimat- und Geschichtsverein Worpswede e. V.\neingetragener Verein\nWorpswede\n\nDen Gläubigern der an der Verschmelzung beteiligten Rechtsträger ist, wenn sie binnen sechs Monaten nach dem Tag, an dem die Eintragung der Verschmelzung in das Register des Sitzes desjenigen Rechtsträgers, dessen Gläubiger sie sind, nach § 19  Abs.  3 UmwG als bekannt gemacht gilt, ihren Anspruch nach Grund und Höhe schriftlich anmelden, Sicherheit zu leisten, soweit sie nicht Befriedigung verlangen können. Dieses Recht steht den Gläubigern jedoch nur zu, wenn sie glaubhaft machen, dass durch die Verschmelzung die Erfüllung der Forderung gefährdet wird."
    },
    {
      "date": "2025-02-06",
      "id": "100649",
      "original_text": "Registerbekanntmachung nach dem Umwandlungsgesetz\nNiedersachsen Amtsgericht Aurich HRA 202342\nLeda Immobilien VII GmbH & Co. KG – Leer (Ostfriesland)",
      "type": "Registerbekanntmachung nach dem Umwandlungsgesetz",
      "state": "Niedersachsen",
      "amtsgericht": "Amtsgericht Aurich",
      "registernummer": "HRA 202342",
      "registerart": "HRA",
      "company_name": "Leda Immobilien VII GmbH & Co. KG",
      "company_seat": "Leer (Ostfriesland)",
      "details": "06.02.2025 (Bekanntmachungsdatum)\n\nNiedersachsen Amtsgericht Aurich HRA 202342\nRegisterbekanntmachung nach dem Umwandlungsgesetz 06.02.2025 (Eintragungsdatum)\n\nLeda Immobilien VII GmbH & Co. KG\nKommanditgesellschaft\nLeer (Ostfriesland)\n\nDen Gläubigern der an der formwechselnden Umwandlung beteiligten Rechtsträger ist, wenn sie binnen sechs Monaten nach dem Tag, an dem die Eintragung der Umwandlung in das Register des Sitzes desjenigen Rechtsträgers, dessen Gläubiger sie sind, nach § 19 Abs. 3 UmwG als bekannt gemacht gilt, ihren Anspruch nach Grund und Höhe schriftlich anmelden, Sicherheit zu leisten, soweit sie nicht Befriedigung verlangen können. Dieses Recht steht den Gläubigern jedoch nur zu, wenn sie glaubhaft machen, dass durch die formwechselnde Umwandlung die Erfüllung der Forderung gefährdet wird."
    },
    {
      "date": "2025-02-06",
      "id": "100650",
      "original_text": "Registerbekanntmachung nach dem Umwandlungsgesetz\nNiedersachsen Amtsgericht Braunschweig HRB 9077\nEvers Arbeitsschutz GmbH – Braunschweig",
      "type": "Registerbekanntmachung nach dem Umwandlungsgesetz",
      "state": "Niedersachsen",
      "amtsgericht": "Amtsgericht Braunschweig",
      "registernummer": "HRB 9077",
      "registerart": "HRB",
      "company_name": "Evers Arbeitsschutz GmbH",
      "company_seat": "Braunschweig",
      "details": "06.02.2025 (Bekanntmachungsdatum)\n\nNiedersachsen Amtsgericht Braunschweig HRB 9077\nRegisterbekanntmachung nach dem Umwandlungsgesetz 06.02.2025 (Eintragungsdatum)\n\nEvers Arbeitsschutz GmbH\nGesellschaft mit beschränkter Haftung\nBraunschweig\n\nDen Gläubigern der an der Verschmelzung beteiligten Rechtsträger ist, wenn sie binnen sechs Monaten nach dem Tag, an dem die Eintragung der Verschmelzung in das Register des Sitzes desjenigen Rechtsträgers, dessen Gläubiger sie sind, nach § 19  Abs.  3 UmwG als bekannt gemacht gilt, ihren Anspruch nach Grund und Höhe schriftlich anmelden, Sicherheit zu leisten, soweit sie nicht Befriedigung verlangen können. Dieses Recht steht den Gläubigern jedoch nur zu, wenn sie glaubhaft machen, dass durch die Verschmelzung die Erfüllung der Forderung gefährdet wird."
    },
    {
      "date": "2025-02-06",
      "id": "100651",
      "original_text": "Registerbekanntmachung nach dem Umwandlungsgesetz\nNiedersachsen Amtsgericht Walsrode VR 160501\nFindorff-Verein-Worpswede e. V. – Worpswede",
      "type": "Registerbekanntmachung nach dem Umwandlungsgesetz",
      "state": "Niedersachsen",
      "amtsgericht": "Amtsgericht Walsrode",
      "registernummer": "VR 160501",
      "registerart": "VR",
      "company_name": "Findorff-Verein-Worpswede e. V.",
      "company_seat": "Worpswede",
      "details": "06.02.2025 (Bekanntmachungsdatum)\n\nNiedersachsen Amtsgericht Walsrode VR 160501\nRegisterbekanntmachung nach dem Umwandlungsgesetz 06.02.2025 (Eintragungsdatum)\n\nFindorff-Verein-Worpswede e. V.\neingetragener Verein\nWorpswede\n\nDen Gläubigern der an der Verschmelzung beteiligten Rechtsträger ist, wenn sie binnen sechs Monaten nach dem Tag, an dem die Eintragung der Verschmelzung in das Register des Sitzes desjenigen Rechtsträgers, dessen Gläubiger sie sind, nach § 19  Abs.  3 UmwG als bekannt gemacht gilt, ihren Anspruch nach Grund und Höhe schriftlich anmelden, Sicherheit zu leisten, soweit sie nicht Befriedigung verlangen können. Dieses Recht steht den Gläubigern jedoch nur zu, wenn sie glaubhaft machen, dass durch die Verschmelzung die Erfüllung der Forderung gefährdet wird."
    },
    {
      "date": "2025-02-06",
      "id": "100652",
      "original_text": "Löschungsankündigung\nRheinland-Pfalz Amtsgericht Landau HRB 32931\nViefiber UG (haftungsbeschränkt) – Bad Bergzabern",
      "type": "Löschungsankündigung",
      "state": "Rheinland-Pfalz",
      "amtsgericht": "Amtsgericht Landau",
      "registernummer": "HRB 32931",
      "registerart": "HRB",
      "company_name": "Viefiber UG (haftungsbeschränkt)",
      "company_seat": "Bad Bergzabern",
      "details": "06.02.2025 (Bekanntmachungsdatum)\n\nRheinland-Pfalz Amtsgericht Landau HRB 32931\nLöschungsankündigung\n\nViefiber UG (haftungsbeschränkt)\nGesellschaft mit beschränkter Haftung\nBad Bergzabern\n\nDas Registergericht beabsichtigt die Gesellschaft von Amts wegen nach § 394 FamFG zu löschen. Die Frist zur Erhebung eines Widerspruchs ist auf einen Monat festgesetzt."
    },
    {
      "date": "2025-02-06",
      "id": "100653",
      "original_text": "Sonstige Registerbekanntmachung\nNordrhein-Westfalen Amtsgericht Düsseldorf HRB 84316\ntalent::digital GmbH – Düsseldorf",
      "type": "Sonstige Registerbekanntmachung",
      "state": "Nordrhein-Westfalen",
      "amtsgericht": "Amtsgericht Düsseldorf",
      "registernummer": "HRB 84316",
      "registerart": "HRB",
      "company_name": "talent::digital GmbH",
      "company_seat": "Düsseldorf",
      "details": "06.02.2025 (Bekanntmachungsdatum)\n\nNordrhein-Westfalen Amtsgericht Düsseldorf HRB 84316\nSonstige Registerbekanntmachung 06.02.2025 (Eintragungsdatum)\n\ntalent::digital GmbH\nGesellschaft mit beschränkter Haftung\nDüsseldorf\n\nDie Gesellschaft ist aufgelöst. Von Amts wegen eingetragen."
    },
    {
      "date": "2025-02-06",
      "id": "100654",
      "original_text": "Löschungsankündigung\nNordrhein-Westfalen Amtsgericht Duisburg HRB 32301\nKotur Entsorgungstechnik GmbH – Wesel",
      "type": "Löschungsankündigung",
      "state": "Nordrhein-Westfalen",
      "amtsgericht": "Amtsgericht Duisburg",
      "registernummer": "HRB 32301",
      "registerart": "HRB",
      "company_name": "Kotur Entsorgungstechnik GmbH",
      "company_seat": "Wesel",
      "details": "06.02.2025 (Bekanntmachungsdatum)\n\nNordrhein-Westfalen Amtsgericht Duisburg HRB 32301\nLöschungsankündigung\n\nKotur Entsorgungstechnik GmbH\nGesellschaft mit beschränkter Haftung\nWesel\n\nDas Registergericht beabsichtigt, die im Handelsregister unter HRB 32301 eingetragene Gesellschaft Kotur Entsorgungstechnik GmbH  gemäß § 394 FamFG wegen Vermögenslosigkeit von Amts wegen zu löschen. Gegen diese Verfügung kann Widerspruch eingelegt werden. Die Frist zur Erhebung eines Widerspruchs gegen die beabsichtigte Löschung von Amts wegen ist auf drei Monate festgesetzt. Rechtsbehelfsbelehrung Der Widerspruch ist bei dem Amtsgericht Duisburg, Kardinal-Galen-Str. 124-132, 47058 Duisburg schriftlich in deutscher Sprache oder zur Niederschrift der Geschäftsstelle einzulegen. Der Widerspruch kann auch zur Niederschrift der Geschäftsstelle eines jeden Amtsgerichtes abgegeben werden. Die Einlegung ist auch durch Übertragung eines elektronischen Dokuments an die elektronische Poststelle des Gerichts möglich. Das elektronische Dokument muss für die Bearbeitung durch das Gericht geeignet und mit einer qualifizierten elektronischen Signatur der verantwortenden Person versehen sein oder von der verantwortenden Person signiert und auf einem sicheren Übermittlungsweg gemäß § 130 a ZPO nach näherer Maßgabe der Verordnung über die technischen Rahmenbedingungen des elektronischen Rechtsverkehrs und über das besondere elektronische Behördenpostfach (BGBl. I, S. 3803) eingereicht werden. Weitere Informationen erhalten Sie auf der Internetseite www.justiz.de <http://www.justiz.de>. Der Widerspruch muss spätestens innerhalb der gesetzten Frist bei dem Amtsgericht Duisburg eingegangen sein. Dies gilt auch dann, wenn der Widerspruch zur Niederschrift der Geschäftsstelle eines anderen Amtsgerichtes abgegeben wurde. Die Frist beginnt mit der Veröffentlichung. Fällt das Ende der Frist auf einen Sonntag, einen allgemeinen Feiertag oder Sonnabend, so endet die Frist mit Ablauf des nächsten Werktages. Der Widerspruch muss die Bezeichnung der angefochtenen Verfügung sowie die Erklärung enthalten, dass Widerspruch gegen diese Verfügung eingelegt wird. Er ist zu unterzeichnen und soll begründet werden."
    },
    {
      "date": "2025-02-06",
      "id": "100655",
      "original_text": "Registerbekanntmachung nach dem Umwandlungsgesetz\nNordrhein-Westfalen Amtsgericht Bonn HRB 15299\nCuranativ Gesellschaft für alternative Heilmethodik und innovative Therapie mbH – Bonn",
      "type": "Registerbekanntmachung nach dem Umwandlungsgesetz",
      "state": "Nordrhein-Westfalen",
      "amtsgericht": "Amtsgericht Bonn",
      "registernummer": "HRB 15299",
      "registerart": "HRB",
      "company_name": "Curanativ Gesellschaft für alternative Heilmethodik und innovative Therapie mbH",
      "company_seat": "Bonn",
      "details": "06.02.2025 (Bekanntmachungsdatum)\n\nNordrhein-Westfalen Amtsgericht Bonn HRB 15299\nRegisterbekanntmachung nach dem Umwandlungsgesetz 06.02.2025 (Eintragungsdatum)\n\nCuranativ Gesellschaft für alternative Heilmethodik und innovative Therapie mbH\nGesellschaft mit beschränkter Haftung\nBonn\n\nDen Gläubigern der an der Verschmelzung beteiligten Rechtsträger ist, wenn sie binnen sechs Monaten nach dem Tag, an dem die Eintragung der Verschmelzung in das Register des Sitzes desjenigen Rechtsträgers, dessen Gläubiger sie sind, nach § 19 Absatz 3 UmwG als bekanntgemacht gilt, ihren Anspruch nach Grund und Höhe schriftlich anmelden, Sicherheit zu leisten, soweit sie nicht Befriedigung verlangen können. Dieses Recht steht den Gläubigern jedoch nur zu, wenn sie glaubhaft machen, dass durch die Verschmelzung die Erfüllung ihrer Forderung gefährdet wird."
    },
    {
      "date": "2025-02-06",
      "id": "100656",
      "original_text": "Registerbekanntmachung nach dem Umwandlungsgesetz\nNordrhein-Westfalen Amtsgericht Duisburg HRB 9533\nAmalie Sieveking Gesellschaft Duisburg gGmbH – Duisburg",
      "type": "Registerbekanntmachung nach dem Umwandlungsgesetz",
      "state": "Nordrhein-Westfalen",
      "amtsgericht": "Amtsgericht Duisburg",
      "registernummer": "HRB 9533",
      "registerart": "HRB",
      "company_name": "Amalie Sieveking Gesellschaft Duisburg gGmbH",
      "company_seat": "Duisburg",
      "details": "06.02.2025 (Bekanntmachungsdatum)\n\nNordrhein-Westfalen Amtsgericht Duisburg HRB 9533\nRegisterbekanntmachung nach dem Umwandlungsgesetz 06.02.2025 (Eintragungsdatum)\n\nAmalie Sieveking Gesellschaft Duisburg gGmbH\nGesellschaft mit beschränkter Haftung\nDuisburg\n\nDie Gesellschaft hat Gläubigern, deren Forderungen vor dieser Bekanntmachung begründet worden sind, Sicherheit zu leisten, soweit sie nicht Befriedigung verlangen können, wenn sie sich binnen sechs Monaten zu diesem Zweck melden."
    },
    {
      "date": "2025-02-06",
      "id": "100657",
      "original_text": "Einreichung neuer Dokumente\nNordrhein-Westfalen Amtsgericht Essen HRB 33073\nista SE – Essen",
      "type": "Einreichung neuer Dokumente",
      "state": "Nordrhein-Westfalen",
      "amtsgericht": "Amtsgericht Essen",
      "registernummer": "HRB 33073",
      "registerart": "HRB",
      "company_name": "ista SE",
      "company_seat": "Essen",
      "details": "06.02.2025 (Bekanntmachungsdatum)\n\nNordrhein-Westfalen Amtsgericht Essen HRB 33073\nEinreichung neuer Dokumente\n\nista SE\nEuropäische Aktiengesellschaft (SE)\nEssen\n\nDem Registergericht ist eine neue Liste der Mitglieder des Aufsichtsrates eingereicht worden."
    },
    {
      "date": "2025-02-06",
      "id": "100658",
      "original_text": "Registerbekanntmachung nach dem Umwandlungsgesetz\nNordrhein-Westfalen Amtsgericht Düsseldorf HRB 19180\nmicroPLAN SK.NET GmbH – Düsseldorf",
      "type": "Registerbekanntmachung nach dem Umwandlungsgesetz",
      "state": "Nordrhein-Westfalen",
      "amtsgericht": "Amtsgericht Düsseldorf",
      "registernummer": "HRB 19180",
      "registerart": "HRB",
      "company_name": "microPLAN SK.NET GmbH",
      "company_seat": "Düsseldorf",
      "details": "06.02.2025 (Bekanntmachungsdatum)\n\nNordrhein-Westfalen Amtsgericht Düsseldorf HRB 19180\nRegisterbekanntmachung nach dem Umwandlungsgesetz 06.02.2025 (Eintragungsdatum)\n\nmicroPLAN SK.NET GmbH\nGesellschaft mit beschränkter Haftung\nDüsseldorf\n\nDen Gläubigern der an der Verschmelzung beteiligten Rechtsträger ist, wenn sie binnen sechs Monaten nach dem Tag, an dem die Eintragung der Verschmelzung in das Register des Sitzes desjenigen Rechtsträgers, dessen Gläubiger sie sind, nach § 19 Absatz 3 UmwG als bekanntgemacht gilt, ihren Anspruch nach Grund und Höhe schriftlich anmelden, Sicherheit zu leisten, soweit sie nicht Befriedigung verlangen können. Dieses Recht steht den Gläubigern jedoch nur zu, wenn sie glaubhaft machen, dass durch die Verschmelzung die Erfüllung ihrer Forderung gefährdet wird."
    },
    {
      "date": "2025-02-06",
      "id": "100659",
      "original_text": "Löschungsankündigung\nNordrhein-Westfalen Amtsgericht Dortmund HRB 36065\nCames Personalservice GmbH – Dortmund",
      "type": "Löschungsankündigung",
      "state": "Nordrhein-Westfalen",
      "amtsgericht": "Amtsgericht Dortmund",
      "registernummer": "HRB 36065",
      "registerart": "HRB",
      "company_name": "Cames Personalservice GmbH",
      "company_seat": "Dortmund",
      "details": "06.02.2025 (Bekanntmachungsdatum)\n\nNordrhein-Westfalen Amtsgericht Dortmund HRB 36065\nLöschungsankündigung\n\nCames Personalservice GmbH\nGesellschaft mit beschränkter Haftung\nDortmund\n\nDas Registergericht beabsichtigt die Gesellschaft von Amts wegen nach § 394 FamFG zu löschen. Die Frist zur Erhebung eines Widerspruchs ist auf zwei Monate festgesetzt."
    },
    {
      "date": "2025-02-06",
      "id": "100660",
      "original_text": "Registerbekanntmachung nach dem Umwandlungsgesetz\nNordrhein-Westfalen Amtsgericht Köln HRA 34179\nAPM Media GmbH & Co. KG – Köln",
      "type": "Registerbekanntmachung nach dem Umwandlungsgesetz",
      "state": "Nordrhein-Westfalen",
      "amtsgericht": "Amtsgericht Köln",
      "registernummer": "HRA 34179",
      "registerart": "HRA",
      "company_name": "APM Media GmbH & Co. KG",
      "company_seat": "Köln",
      "details": "06.02.2025 (Bekanntmachungsdatum)\n\nNordrhein-Westfalen Amtsgericht Köln HRA 34179\nRegisterbekanntmachung nach dem Umwandlungsgesetz 06.02.2025 (Eintragungsdatum)\n\nAPM Media GmbH & Co. KG\nKommanditgesellschaft\nKöln\n\nDen Gläubigern der an der formwechselnden Umwandlung beteiligten Rechtsträger ist, wenn sie binnen sechs Monaten nach dem Tag, an dem die Eintragung der formwechselnden Umwandlung in das Register des Sitzes desjenigen Rechtsträgers, dessen Gläubiger sie sind, nach § 19 Absatz 3 UmwG als bekanntgemacht gilt, ihren Anspruch nach Grund und Höhe schriftlich anmelden, Sicherheit zu leisten, soweit sie nicht Befriedigung verlangen können. Dieses Recht steht den Gläubigern jedoch nur zu, wenn sie glaubhaft machen, dass durch die formwechselnden Umwandlung die Erfüllung ihrer Forderung gefährdet wird."
    },
    {
      "date": "2025-02-06",
      "id": "100661",
      "original_text": "Löschungsankündigung\nNordrhein-Westfalen Amtsgericht Bonn HRA 1081\nBonner Spedition u. Lagerhaus Hans Steinbüchel – Bonn",
      "type": "Löschungsankündigung",
      "state": "Nordrhein-Westfalen",
      "amtsgericht": "Amtsgericht Bonn",
      "registernummer": "HRA 1081",
      "registerart": "HRA",
      "company_name": "Bonner Spedition u. Lagerhaus Hans Steinbüchel",
      "company_seat": "Bonn",
      "details": "06.02.2025 (Bekanntmachungsdatum)\n\nNordrhein-Westfalen Amtsgericht Bonn HRA 1081\nLöschungsankündigung\n\nBonner Spedition u. Lagerhaus Hans Steinbüchel\nEinzelkaufmann / Einzelkauffrau\nBonn\n\nDas Registergericht beabsichtigt die Firma von Amts wegen nach § 31 Abs. 2 HGB, § 393 FamFG zu löschen. Die Frist zur Erhebung eines Widerspruchs ist auf einen Monat festgesetzt."
    },
    {
      "date": "2025-02-06",
      "id": "100662",
      "original_text": "Registerbekanntmachung nach dem Umwandlungsgesetz\nNordrhein-Westfalen Amtsgericht Gelsenkirchen HRB 1201\nKartoffelgroßhandel Karl-Heinz Stein GmbH – Gelsenkirchen",
      "type": "Registerbekanntmachung nach dem Umwandlungsgesetz",
      "state": "Nordrhein-Westfalen",
      "amtsgericht": "Amtsgericht Gelsenkirchen",
      "registernummer": "HRB 1201",
      "registerart": "HRB",
      "company_name": "Kartoffelgroßhandel Karl-Heinz Stein GmbH",
      "company_seat": "Gelsenkirchen",
      "details": "06.02.2025 (Bekanntmachungsdatum)\n\nNordrhein-Westfalen Amtsgericht Gelsenkirchen HRB 1201\nRegisterbekanntmachung nach dem Umwandlungsgesetz 06.02.2025 (Eintragungsdatum)\n\nKartoffelgroßhandel Karl-Heinz Stein GmbH\nGesellschaft mit beschränkter Haftung\nGelsenkirchen\n\nDen Gläubigern der an der Verschmelzung beteiligten Rechtsträger ist, wenn sie binnen sechs Monaten nach dem Tag, an dem die Eintragung der Verschmelzung in das Register des Sitzes desjenigen Rechtsträgers, dessen Gläubiger sie sind, nach § 19 Absatz 3 UmwG als bekanntgemacht gilt, ihren Anspruch nach Grund und Höhe schriftlich anmelden, Sicherheit zu leisten, soweit sie nicht Befriedigung verlangen können. Dieses Recht steht den Gläubigern jedoch nur zu, wenn sie glaubhaft machen, dass durch die Verschmelzung die Erfüllung ihrer Forderung gefährdet wird."
    },
    {
      "date": "2025-02-06",
      "id": "100663",
      "original_text": "Einreichung neuer Dokumente\nNordrhein-Westfalen Amtsgericht Arnsberg HRB 2366\nburgbad Aktiengesellschaft – Schmallenberg",
      "type": "Einreichung neuer Dokumente",
      "state": "Nordrhein-Westfalen",
      "amtsgericht": "Amtsgericht Arnsberg",
      "registernummer": "HRB 2366",
      "registerart": "HRB",
      "company_name": "burgbad Aktiengesellschaft",
      "company_seat": "Schmallenberg",
      "details": "06.02.2025 (Bekanntmachungsdatum)\n\nNordrhein-Westfalen Amtsgericht Arnsberg HRB 2366\nEinreichung neuer Dokumente\n\nburgbad Aktiengesellschaft\nAktiengesellschaft\nSchmallenberg\n\nDem Registergericht ist eine neue Liste der Mitglieder des Aufsichtsrates eingereicht worden."
    },
    {
      "date": "2025-02-06",
      "id": "100664",
      "original_text": "Registerbekanntmachung nach dem Umwandlungsgesetz\nNordrhein-Westfalen Amtsgericht Köln HRB 64304\nLampe Lagertechnik GmbH – Gummersbach",
      "type": "Registerbekanntmachung nach dem Umwandlungsgesetz",
      "state": "Nordrhein-Westfalen",
      "amtsgericht": "Amtsgericht Köln",
      "registernummer": "HRB 64304",
      "registerart": "HRB",
      "company_name": "Lampe Lagertechnik GmbH",
      "company_seat": "Gummersbach",
      "details": "06.02.2025 (Bekanntmachungsdatum)\n\nNordrhein-Westfalen Amtsgericht Köln HRB 64304\nRegisterbekanntmachung nach dem Umwandlungsgesetz 06.02.2025 (Eintragungsdatum)\n\nLampe Lagertechnik GmbH\nGesellschaft mit beschränkter Haftung\nGummersbach\n\nDen Gläubigern der an der Verschmelzung beteiligten Rechtsträger ist, wenn sie binnen sechs Monaten nach dem Tag, an dem die Eintragung der Verschmelzung in das Register des Sitzes desjenigen Rechtsträgers, dessen Gläubiger sie sind, nach § 19 Absatz 3 UmwG als bekanntgemacht gilt, ihren Anspruch nach Grund und Höhe schriftlich anmelden, Sicherheit zu leisten, soweit sie nicht Befriedigung verlangen können. Dieses Recht steht den Gläubigern jedoch nur zu, wenn sie glaubhaft machen, dass durch die Verschmelzung die Erfüllung ihrer Forderung gefährdet wird."
    },
    {
      "date": "2025-02-06",
      "id": "100665",
      "original_text": "Sonstige Registerbekanntmachung\nNordrhein-Westfalen Amtsgericht Bonn HRB 8709\nDeutsche Post Dialog Solutions GmbH – Bonn",
      "type": "Sonstige Registerbekanntmachung",
      "state": "Nordrhein-Westfalen",
      "amtsgericht": "Amtsgericht Bonn",
      "registernummer": "HRB 8709",
      "registerart": "HRB",
      "company_name": "Deutsche Post Dialog Solutions GmbH",
      "company_seat": "Bonn",
      "details": "06.02.2025 (Bekanntmachungsdatum)\n\nNordrhein-Westfalen Amtsgericht Bonn HRB 8709\nSonstige Registerbekanntmachung 06.02.2025 (Eintragungsdatum)\n\nDeutsche Post Dialog Solutions GmbH\nGesellschaft mit beschränkter Haftung\nBonn\n\nAls nicht eingetragen wird veröffentlicht: Den Gläubigern der Gesellschaft, deren Forderungen begründet worden sind bevor die Eintragung der Beendigung des Beherrschungs- und Gewinnabführungsvertrages  in das Handelsregister nach § 10 des Handelsgesetzbuches als bekanntgemacht gilt, hat der andere Vertragsteil Sicherheit zu leisten, wenn sie sich binnen sechs Monaten nach der Bekanntmachung der Eintragung zu diesem Zweck bei ihm melden."
    },
    {
      "date": "2025-02-06",
      "id": "100666",
      "original_text": "Löschungsankündigung\nNordrhein-Westfalen Amtsgericht Bonn HRB 26245\nKGalinskas UG (haftungsbeschränkt) – Bonn",
      "type": "Löschungsankündigung",
      "state": "Nordrhein-Westfalen",
      "amtsgericht": "Amtsgericht Bonn",
      "registernummer": "HRB 26245",
      "registerart": "HRB",
      "company_name": "KGalinskas UG (haftungsbeschränkt)",
      "company_seat": "Bonn",
      "details": "06.02.2025 (Bekanntmachungsdatum)\n\nNordrhein-Westfalen Amtsgericht Bonn HRB 26245\nLöschungsankündigung\n\nKGalinskas UG (haftungsbeschränkt)\nGesellschaft mit beschränkter Haftung\nBonn\n\nDas Registergericht beabsichtigt die Gesellschaft von Amts wegen nach § 394 FamFG zu löschen. Die Frist zur Erhebung eines Widerspruchs ist auf einen Monat festgesetzt."
    },
    {
      "date": "2025-02-06",
      "id": "100667",
      "original_text": "Löschungsankündigung\nNordrhein-Westfalen Amtsgericht Krefeld HRB 14203\nContainerdirekt24 GmbH – Tönisvorst",
      "type": "Löschungsankündigung",
      "state": "Nordrhein-Westfalen",
      "amtsgericht": "Amtsgericht Krefeld",
      "registernummer": "HRB 14203",
      "registerart": "HRB",
      "company_name": "Containerdirekt24 GmbH",
      "company_seat": "Tönisvorst",
      "details": "06.02.2025 (Bekanntmachungsdatum)\n\nNordrhein-Westfalen Amtsgericht Krefeld HRB 14203\nLöschungsankündigung\n\nContainerdirekt24 GmbH\nGesellschaft mit beschränkter Haftung\nTönisvorst\n\nDas Registergericht beabsichtigt die Gesellschaft von Amts wegen nach § 394 FamFG zu löschen. Die Frist zur Erhebung eines Widerspruchs ist auf einen Monat festgesetzt."
    },
    {
      "date": "2025-02-06",
      "id": "100668",
      "original_text": "Registerbekanntmachung nach dem Umwandlungsgesetz\nNordrhein-Westfalen Amtsgericht Duisburg HRB 25696\nAmalie unterwegs gGmbH – Duisburg",
      "type": "Registerbekanntmachung nach dem Umwandlungsgesetz",
      "state": "Nordrhein-Westfalen",
      "amtsgericht": "Amtsgericht Duisburg",
      "registernummer": "HRB 25696",
      "registerart": "HRB",
      "company_name": "Amalie unterwegs gGmbH",
      "company_seat": "Duisburg",
      "details": "06.02.2025 (Bekanntmachungsdatum)\n\nNordrhein-Westfalen Amtsgericht Duisburg HRB 25696\nRegisterbekanntmachung nach dem Umwandlungsgesetz 06.02.2025 (Eintragungsdatum)\n\nAmalie unterwegs gGmbH\nGesellschaft mit beschränkter Haftung\nDuisburg\n\nDie Gesellschaft hat Gläubigern, deren Forderungen vor dieser Bekanntmachung begründet worden sind, Sicherheit zu leisten, soweit sie nicht Befriedigung verlangen können, wenn sie sich binnen sechs Monaten zu diesem Zweck melden."
    },
    {
      "date": "2025-02-06",
      "id": "100669",
      "original_text": "Registerbekanntmachung nach dem Umwandlungsgesetz\nNordrhein-Westfalen Amtsgericht Essen PR 5327\nKieferorthopädie Paderborn, Dres. Paddenberg Partnerschaft, Kieferorthopäde Zahnärzte – Paderborn",
      "type": "Registerbekanntmachung nach dem Umwandlungsgesetz",
      "state": "Nordrhein-Westfalen",
      "amtsgericht": "Amtsgericht Essen",
      "registernummer": "PR 5327",
      "registerart": "PR",
      "company_name": "Kieferorthopädie Paderborn, Dres. Paddenberg Partnerschaft, Kieferorthopäde Zahnärzte",
      "company_seat": "Paderborn",
      "details": "06.02.2025 (Bekanntmachungsdatum)\n\nNordrhein-Westfalen Amtsgericht Essen PR 5327\nRegisterbekanntmachung nach dem Umwandlungsgesetz 06.02.2025 (Eintragungsdatum)\n\nKieferorthopädie Paderborn, Dres. Paddenberg Partnerschaft, Kieferorthopäde Zahnärzte\nPartnerschaftsgesellschaft\nPaderborn\n\nDen Gläubigern der an der Abspaltung beteiligten Rechtsträger ist, wenn sie binnen sechs Monaten nach dem Tag, an dem die Eintragung der Abspaltung in das Register des Sitzes desjenigen Rechtsträgers, dessen Gläubiger sie sind, nach § 19 Absatz 3 UmwG als bekanntgemacht gilt, ihren Anspruch nach Grund und Höhe schriftlich anmelden, Sicherheit zu leisten, soweit sie nicht Befriedigung verlangen können. Dieses Recht steht den Gläubigern jedoch nur zu, wenn sie glaubhaft machen, dass durch die Abspaltung die Erfüllung ihrer Forderung gefährdet wird."
    },
    {
      "date": "2025-02-06",
      "id": "100670",
      "original_text": "Einreichung neuer Dokumente\nNordrhein-Westfalen Amtsgericht Köln HRB 34201\nMonega Kapitalanlagegesellschaft mbH – Köln",
      "type": "Einreichung neuer Dokumente",
      "state": "Nordrhein-Westfalen",
      "amtsgericht": "Amtsgericht Köln",
      "registernummer": "HRB 34201",
      "registerart": "HRB",
      "company_name": "Monega Kapitalanlagegesellschaft mbH",
      "company_seat": "Köln",
      "details": "06.02.2025 (Bekanntmachungsdatum)\n\nNordrhein-Westfalen Amtsgericht Köln HRB 34201\nEinreichung neuer Dokumente\n\nMonega Kapitalanlagegesellschaft mbH\nGesellschaft mit beschränkter Haftung\nKöln\n\nDem Registergericht ist eine Liste der Mitglieder des Aufsichtsrates eingereicht worden."
    },
    {
      "date": "2025-02-06",
      "id": "100671",
      "original_text": "Löschungsankündigung\nNordrhein-Westfalen Amtsgericht Dortmund HRB 32806\nBREfacility GmbH – Lünen",
      "type": "Löschungsankündigung",
      "state": "Nordrhein-Westfalen",
      "amtsgericht": "Amtsgericht Dortmund",
      "registernummer": "HRB 32806",
      "registerart": "HRB",
      "company_name": "BREfacility GmbH",
      "company_seat": "Lünen",
      "details": "06.02.2025 (Bekanntmachungsdatum)\n\nNordrhein-Westfalen Amtsgericht Dortmund HRB 32806\nLöschungsankündigung\n\nBREfacility GmbH\nGesellschaft mit beschränkter Haftung\nLünen\n\nDas Registergericht beabsichtigt die Gesellschaft von Amts wegen nach § 394 FamFG zu löschen. Die Frist zur Erhebung eines Widerspruchs ist auf zwei Monate festgesetzt."
    },
    {
      "date": "2025-02-06",
      "id": "100672",
      "original_text": "Registerbekanntmachung nach dem Umwandlungsgesetz\nNordrhein-Westfalen Amtsgericht Aachen HRB 18272\nnetconnex GmbH – Stolberg",
      "type": "Registerbekanntmachung nach dem Umwandlungsgesetz",
      "state": "Nordrhein-Westfalen",
      "amtsgericht": "Amtsgericht Aachen",
      "registernummer": "HRB 18272",
      "registerart": "HRB",
      "company_name": "netconnex GmbH",
      "company_seat": "Stolberg",
      "details": "06.02.2025 (Bekanntmachungsdatum)\n\nNordrhein-Westfalen Amtsgericht Aachen HRB 18272\nRegisterbekanntmachung nach dem Umwandlungsgesetz 06.02.2025 (Eintragungsdatum)\n\nnetconnex GmbH\nGesellschaft mit beschränkter Haftung\nStolberg\n\nDen Gläubigern der an der Verschmelzung beteiligten Rechtsträger ist, wenn sie binnen sechs Monaten nach dem Tag, an dem die Eintragung der Verschmelzung in das Register des Sitzes derjenigen Rechtsträger deren Gläubiger sie sind, nach § 19 Absatz 3 UmwG als bekanntgemacht gilt, ihren Anspruch nach Grund und Höhe schriftlich anmelden, Sicherheit zu leisten, soweit sie nicht Befriedigung verlangen können. Dieses Recht steht den Gläubigern jedoch nur zu, wenn sie glaubhaft machen, dass durch die Verschmelzung die Erfüllung ihrer Forderung gefährdet wird."
    },
    {
      "date": "2025-02-06",
      "id": "100673",
      "original_text": "Registerbekanntmachung nach dem Umwandlungsgesetz\nNordrhein-Westfalen Amtsgericht Bonn HRB 26871\nMarcus Leyrer UG (haftungsbeschränkt) – Bonn",
      "type": "Registerbekanntmachung nach dem Umwandlungsgesetz",
      "state": "Nordrhein-Westfalen",
      "amtsgericht": "Amtsgericht Bonn",
      "registernummer": "HRB 26871",
      "registerart": "HRB",
      "company_name": "Marcus Leyrer UG (haftungsbeschränkt)",
      "company_seat": "Bonn",
      "details": "06.02.2025 (Bekanntmachungsdatum)\n\nNordrhein-Westfalen Amtsgericht Bonn HRB 26871\nRegisterbekanntmachung nach dem Umwandlungsgesetz 06.02.2025 (Eintragungsdatum)\n\nMarcus Leyrer UG (haftungsbeschränkt)\nGesellschaft mit beschränkter Haftung\nBonn\n\nDen Gläubigern der an der Verschmelzung beteiligten Rechtsträger ist, wenn sie binnen sechs Monaten nach dem Tag, an dem die Eintragung der Verschmelzung in das Register des Sitzes desjenigen Rechtsträgers, dessen Gläubiger sie sind, nach § 19 Absatz 3 UmwG als bekanntgemacht gilt, ihren Anspruch nach Grund und Höhe schriftlich anmelden, Sicherheit zu leisten, soweit sie nicht Befriedigung verlangen können. Dieses Recht steht den Gläubigern jedoch nur zu, wenn sie glaubhaft machen, dass durch die Verschmelzung die Erfüllung ihrer Forderung gefährdet wird."
    },
    {
      "date": "2025-02-06",
      "id": "100674",
      "original_text": "Registerbekanntmachung nach dem Umwandlungsgesetz\nNordrhein-Westfalen Amtsgericht Hamm HRB 11069\nH2sustain UG (haftungsbeschränkt) – Hamm",
      "type": "Registerbekanntmachung nach dem Umwandlungsgesetz",
      "state": "Nordrhein-Westfalen",
      "amtsgericht": "Amtsgericht Hamm",
      "registernummer": "HRB 11069",
      "registerart": "HRB",
      "company_name": "H2sustain UG (haftungsbeschränkt)",
      "company_seat": "Hamm",
      "details": "06.02.2025 (Bekanntmachungsdatum)\n\nNordrhein-Westfalen Amtsgericht Hamm HRB 11069\nRegisterbekanntmachung nach dem Umwandlungsgesetz 06.02.2025 (Eintragungsdatum)\n\nH2sustain UG (haftungsbeschränkt)\nGesellschaft mit beschränkter Haftung\nHamm\n\nDen Gläubigern der an der Verschmelzung beteiligten Rechtsträger ist, wenn sie binnen sechs Monaten nach dem Tag, an dem die Eintragung der Verschmelzung in das Register des Sitzes derjenigen Rechtsträger deren Gläubiger sie sind, nach § 19 Absatz 3 UmwG als bekanntgemacht gilt, ihren Anspruch nach Grund und Höhe schriftlich anmelden, Sicherheit zu leisten, soweit sie nicht Befriedigung verlangen können. Dieses Recht steht den Gläubigern jedoch nur zu, wenn sie glaubhaft machen, dass durch die Verschmelzung die Erfüllung ihrer Forderung gefährdet wird."
    },
    {
      "date": "2025-02-06",
      "id": "100675",
      "original_text": "Löschungsankündigung\nNordrhein-Westfalen Amtsgericht Düsseldorf HRA 18547\nAltacon Consulting GmbH & Co. KG – Düsseldorf",
      "type": "Löschungsankündigung",
      "state": "Nordrhein-Westfalen",
      "amtsgericht": "Amtsgericht Düsseldorf",
      "registernummer": "HRA 18547",
      "registerart": "HRA",
      "company_name": "Altacon Consulting GmbH & Co. KG",
      "company_seat": "Düsseldorf",
      "details": "06.02.2025 (Bekanntmachungsdatum)\n\nNordrhein-Westfalen Amtsgericht Düsseldorf HRA 18547\nLöschungsankündigung\n\nAltacon Consulting GmbH & Co. KG\nKommanditgesellschaft\nDüsseldorf\n\nDas Registergericht beabsichtigt die Firma von Amts wegen nach § 394 FamFG zu löschen. Die Frist zur Erhebung eines Widerspruchs ist auf einen Monat festgesetzt.\n\nRechtsbehelfsbelehrung:\nDas Widerspruchsrecht steht jedem zu, der an der Unterlassung der Löschung ein berechtigtes Interesse hat. Der Widerspruch ist bei dem Amtsgericht Düsseldorf -Registergericht-, Werdener Straße 1, 40227 Düsseldorf schriftlich in deutscher Sprache oder zur Niederschrift der Geschäftsstelle einzulegen. Der Widerspruch kann auch zur Niederschrift der Geschäftsstelle eines jeden Amtsgerichtes abgegeben werden. Die Einlegung ist auch durch Übertragung eines elektronischen Dokuments an die elektronische Poststelle des Gerichts möglich. Das elektronische Dokument muss für die Bearbeitung durch das Gericht geeignet und mit einer qualifizierten elektronischen Signatur der verantwortenden Person versehen sein oder von der verantwortenden Person signiert und auf einem sicheren Übermittlungsweg gemäß § 130a ZPO nach näherer Maßgabe der Verordnung über die technischen Rahmenbedingungen des elektronischen Rechtsverkehrs und über das besondere elektronische Behördenpostfach (BGBl. I, S.3803) eingereicht werden. Weitere Informationen erhalten Sie auf der Internetseite www.justiz.de.\nDer Widerspruch muss spätestens innerhalb der gesetzten Frist nach dem Datum der Bekanntmachung der Löschungsankündigung bei dem Amtsgericht - Registergericht - Düsseldorf eingegangen sein.  Dies gilt auch dann, wenn der Widerspruch zur Niederschrift der Geschäftsstelle eines anderen Amtsgerichtes abgegeben wurde. Die Frist beginnt mit dem Tage der Bekanntmachung der Löschungsankündigung in dem für die Bekanntmachung der Eintragungen in das Handelsregister bestimmten elektronischen Informations- und Kommunikationssystem nach § 10 des Handelsgesetzbuches. Fällt das Ende der Frist auf einen Sonntag, einen allgemeinen Feiertag oder Sonnabend, so endet die Frist mit Ablauf des nächsten Werktages.\nDer Widerspruch muss die Bezeichnung der angefochtenen Löschungsankündigung sowie die Erklärung enthalten, dass Widerspruch gegen diese Löschungsankündigung eingelegt wird. Er ist zu unterzeichnen und soll begründet werden."
    },
    {
      "date": "2025-02-06",
      "id": "100676",
      "original_text": "Registerbekanntmachung nach dem Umwandlungsgesetz\nNordrhein-Westfalen Amtsgericht Gelsenkirchen HRA 6054\nGebr. Stein GmbH & Co. KG – Gelsenkirchen",
      "type": "Registerbekanntmachung nach dem Umwandlungsgesetz",
      "state": "Nordrhein-Westfalen",
      "amtsgericht": "Amtsgericht Gelsenkirchen",
      "registernummer": "HRA 6054",
      "registerart": "HRA",
      "company_name": "Gebr. Stein GmbH & Co. KG",
      "company_seat": "Gelsenkirchen",
      "details": "06.02.2025 (Bekanntmachungsdatum)\n\nNordrhein-Westfalen Amtsgericht Gelsenkirchen HRA 6054\nRegisterbekanntmachung nach dem Umwandlungsgesetz 06.02.2025 (Eintragungsdatum)\n\nGebr. Stein GmbH & Co. KG\nKommanditgesellschaft\nGelsenkirchen\n\nDen Gläubigern der an der Verschmelzung beteiligten Rechtsträger ist, wenn sie binnen sechs Monaten nach dem Tag, an dem die Eintragung der Verschmelzung in das Register des Sitzes desjenigen Rechtsträgers, dessen Gläubiger sie sind, nach § 19 Absatz 3 UmwG als bekanntgemacht gilt, ihren Anspruch nach Grund und Höhe schriftlich anmelden, Sicherheit zu leisten, soweit sie nicht Befriedigung verlangen können. Dieses Recht steht den Gläubigern jedoch nur zu, wenn sie glaubhaft machen, dass durch die Verschmelzung die Erfüllung ihrer Forderung gefährdet wird."
    },
    {
      "date": "2025-02-06",
      "id": "100677",
      "original_text": "Sonstige Registerbekanntmachung\nNordrhein-Westfalen Amtsgericht Bonn HRB 22126\nBetreibergesellschaft Verteilzentrum GmbH – Bonn",
      "type": "Sonstige Registerbekanntmachung",
      "state": "Nordrhein-Westfalen",
      "amtsgericht": "Amtsgericht Bonn",
      "registernummer": "HRB 22126",
      "registerart": "HRB",
      "company_name": "Betreibergesellschaft Verteilzentrum GmbH",
      "company_seat": "Bonn",
      "details": "06.02.2025 (Bekanntmachungsdatum)\n\nNordrhein-Westfalen Amtsgericht Bonn HRB 22126\nSonstige Registerbekanntmachung 06.02.2025 (Eintragungsdatum)\n\nBetreibergesellschaft Verteilzentrum GmbH\nGesellschaft mit beschränkter Haftung\nBonn\n\nAls nicht eingetragen wird veröffentlicht: Den Gläubigern der Gesellschaft, deren Forderungen begründet worden sind bevor die Eintragung der Beendigung des Beherrschungs- und Ergebnisabführungsvertrages  in das Handelsregister nach § 10 des Handelsgesetzbuches als bekanntgemacht gilt, hat der andere Vertragsteil Sicherheit zu leisten, wenn sie sich binnen sechs Monaten nach der Bekanntmachung der Eintragung zu diesem Zweck bei ihm melden."
    },
    {
      "date": "2025-02-06",
      "id": "100678",
      "original_text": "Löschungsankündigung\nNordrhein-Westfalen Amtsgericht Düsseldorf HRB 92093\nMovere Agency UG (haftungsbeschränkt) – Düsseldorf",
      "type": "Löschungsankündigung",
      "state": "Nordrhein-Westfalen",
      "amtsgericht": "Amtsgericht Düsseldorf",
      "registernummer": "HRB 92093",
      "registerart": "HRB",
      "company_name": "Movere Agency UG (haftungsbeschränkt)",
      "company_seat": "Düsseldorf",
      "details": "06.02.2025 (Bekanntmachungsdatum)\n\nNordrhein-Westfalen Amtsgericht Düsseldorf HRB 92093\nLöschungsankündigung\n\nMovere Agency UG (haftungsbeschränkt)\nGesellschaft mit beschränkter Haftung\nDüsseldorf\n\nDas Registergericht beabsichtigt die Gesellschaft von Amts wegen nach § 394 FamFG zu löschen. Die Frist zur Erhebung eines Widerspruchs ist auf 3 Wochen festgesetzt.\n\nRechtsbehelfsbelehrung:\nDas Widerspruchsrecht steht jedem zu, der an der Unterlassung der Löschung ein berechtigtes Interesse hat. Der Widerspruch ist bei dem Amtsgericht Düsseldorf -Registergericht-, Werdener Straße 1, 40227 Düsseldorf schriftlich in deutscher Sprache oder zur Niederschrift der Geschäftsstelle einzulegen. Der Widerspruch kann auch zur Niederschrift der Geschäftsstelle eines jeden Amtsgerichtes abgegeben werden. Die Einlegung ist auch durch Übertragung eines elektronischen Dokuments an die elektronische Poststelle des Gerichts möglich. Das elektronische Dokument muss für die Bearbeitung durch das Gericht geeignet und mit einer qualifizierten elektronischen Signatur der verantwortenden Person versehen sein oder von der verantwortenden Person signiert und auf einem sicheren Übermittlungsweg gemäß § 130a ZPO nach näherer Maßgabe der Verordnung über die technischen Rahmenbedingungen des elektronischen Rechtsverkehrs und über das besondere elektronische Behördenpostfach (BGBl. I, S.3803) eingereicht werden. Weitere Informationen erhalten Sie auf der Internetseite www.justiz.de.\nDer Widerspruch muss spätestens innerhalb der gesetzten Frist nach dem Datum der Bekanntmachung der Löschungsankündigung bei dem Amtsgericht - Registergericht - Düsseldorf eingegangen sein.  Dies gilt auch dann, wenn der Widerspruch zur Niederschrift der Geschäftsstelle eines anderen Amtsgerichtes abgegeben wurde. Die Frist beginnt mit dem Tage der Bekanntmachung der Löschungsankündigung in dem für die Bekanntmachung der Eintragungen in das Handelsregister bestimmten elektronischen Informations- und Kommunikationssystem nach § 10 des Handelsgesetzbuches. Fällt das Ende der Frist auf einen Sonntag, einen allgemeinen Feiertag oder Sonnabend, so endet die Frist mit Ablauf des nächsten Werktages.\nDer Widerspruch muss die Bezeichnung der angefochtenen Löschungsankündigung sowie die Erklärung enthalten, dass Widerspruch gegen diese Löschungsankündigung eingelegt wird. Er ist zu unterzeichnen und soll begründet werden."
    },
    {
      "date": "2025-02-06",
      "id": "100679",
      "original_text": "Sonstige Registerbekanntmachung\nNordrhein-Westfalen Amtsgericht Gelsenkirchen HRB 3385\nWALPOL GmbH – Gelsenkirchen",
      "type": "Sonstige Registerbekanntmachung",
      "state": "Nordrhein-Westfalen",
      "amtsgericht": "Amtsgericht Gelsenkirchen",
      "registernummer": "HRB 3385",
      "registerart": "HRB",
      "company_name": "WALPOL GmbH",
      "company_seat": "Gelsenkirchen",
      "details": "06.02.2025 (Bekanntmachungsdatum)\n\nNordrhein-Westfalen Amtsgericht Gelsenkirchen HRB 3385\nSonstige Registerbekanntmachung 06.02.2025 (Eintragungsdatum)\n\nWALPOL GmbH\nGesellschaft mit beschränkter Haftung\nGelsenkirchen\n\nAls nicht eingetragen wird veröffentlicht: Den Gläubigern der Gesellschaft, deren Forderungen begründet worden sind bevor die Eintragung der Beendigung des Ergebnisabführungsvertrages in das Handelsregister nach § 10 des Handelsgesetzbuches als bekanntgemacht gilt, hat der andere Vertragsteil Sicherheit zu leisten, wenn sie sich binnen sechs Monaten nach der Bekanntmachung der Eintragung zu diesem Zweck bei ihm melden."
    },
    {
      "date": "2025-02-06",
      "id": "100680",
      "original_text": "Registerbekanntmachung nach dem Umwandlungsgesetz\nNordrhein-Westfalen Amtsgericht Köln HRB 122083\nAPM Holding GmbH – Köln",
      "type": "Registerbekanntmachung nach dem Umwandlungsgesetz",
      "state": "Nordrhein-Westfalen",
      "amtsgericht": "Amtsgericht Köln",
      "registernummer": "HRB 122083",
      "registerart": "HRB",
      "company_name": "APM Holding GmbH",
      "company_seat": "Köln",
      "details": "06.02.2025 (Bekanntmachungsdatum)\n\nNordrhein-Westfalen Amtsgericht Köln HRB 122083\nRegisterbekanntmachung nach dem Umwandlungsgesetz 06.02.2025 (Eintragungsdatum)\n\nAPM Holding GmbH\nGesellschaft mit beschränkter Haftung\nKöln\n\nDen Gläubigern der an der formwechselnden Umwandlung beteiligten Rechtsträger ist, wenn sie binnen sechs Monaten nach dem Tag, an dem die Eintragung der formwechselnden Umwandlung in das Register des Sitzes desjenigen Rechtsträgers, dessen Gläubiger sie sind, nach § 19 Absatz 3 UmwG als bekanntgemacht gilt, ihren Anspruch nach Grund und Höhe schriftlich anmelden, Sicherheit zu leisten, soweit sie nicht Befriedigung verlangen können. Dieses Recht steht den Gläubigern jedoch nur zu, wenn sie glaubhaft machen, dass durch die formwechselnden Umwandlung die Erfüllung ihrer Forderung gefährdet wird."
    },
    {
      "date": "2025-02-06",
      "id": "100681",
      "original_text": "Registerbekanntmachung nach dem Umwandlungsgesetz\nThüringen Amtsgericht Jena HRB 505075\nDVS -Technology GmbH – Krauthausen",
      "type": "Registerbekanntmachung nach dem Umwandlungsgesetz",
      "state": "Thüringen",
      "amtsgericht": "Amtsgericht Jena",
      "registernummer": "HRB 505075",
      "registerart": "HRB",
      "company_name": "DVS -Technology GmbH",
      "company_seat": "Krauthausen",
      "details": "06.02.2025 (Bekanntmachungsdatum)\n\nThüringen Amtsgericht Jena HRB 505075\nRegisterbekanntmachung nach dem Umwandlungsgesetz 06.02.2025 (Eintragungsdatum)\n\nDVS -Technology GmbH\nGesellschaft mit beschränkter Haftung\nKrauthausen\n\nNicht eingetragen: Den Gläubigern der an der Verschmelzung beteiligten Rechtsträger, ist wenn sie binnen sechs Monaten nach dem Tag, an dem die Eintragung der Verschmelzung in das Register des Sitzes desjenigen Rechtsträgers, dessen Gläubiger sie sind,  nach § 19 Abs. 3 UmwG als bekanntgemacht gilt, ihren Anspruch nach Grund und Höhe schriftlich anmelden, Sicherheit zu leisten, soweit sie nicht Befriedigung verlangen können. Dieses Recht steht ihnen jedoch nur zu, wenn sie glaubhaft machen, daß durch die Verschmelzung die Erfüllung ihrer Forderung gefährdet wird."
    },
    {
      "date": "2025-02-06",
      "id": "100682",
      "original_text": "Registerbekanntmachung nach dem Umwandlungsgesetz\nThüringen Amtsgericht Jena HRB 504747\nHEID Beteiligungsgesellschaft mbH – Krauthausen",
      "type": "Registerbekanntmachung nach dem Umwandlungsgesetz",
      "state": "Thüringen",
      "amtsgericht": "Amtsgericht Jena",
      "registernummer": "HRB 504747",
      "registerart": "HRB",
      "company_name": "HEID Beteiligungsgesellschaft mbH",
      "company_seat": "Krauthausen",
      "details": "06.02.2025 (Bekanntmachungsdatum)\n\nThüringen Amtsgericht Jena HRB 504747\nRegisterbekanntmachung nach dem Umwandlungsgesetz 06.02.2025 (Eintragungsdatum)\n\nHEID Beteiligungsgesellschaft mbH\nGesellschaft mit beschränkter Haftung\nKrauthausen\n\nNicht eingetragen: Den Gläubigern der an der Verschmelzung beteiligten Rechtsträger, ist wenn sie binnen sechs Monaten nach dem Tag, an dem die Eintragung der Verschmelzung in das Register des Sitzes desjenigen Rechtsträgers, dessen Gläubiger sie sind,  nach § 19 Abs. 3 UmwG als bekanntgemacht gilt, ihren Anspruch nach Grund und Höhe schriftlich anmelden, Sicherheit zu leisten, soweit sie nicht Befriedigung verlangen können. Dieses Recht steht ihnen jedoch nur zu, wenn sie glaubhaft machen, daß durch die Verschmelzung die Erfüllung ihrer Forderung gefährdet wird."
    },
    {
      "date": "2025-02-06",
      "id": "100683",
      "original_text": "Registerbekanntmachung nach dem Umwandlungsgesetz\nThüringen Amtsgericht Jena HRB 400836\nThüringer Präzisionsfedern GmbH – Ruhla",
      "type": "Registerbekanntmachung nach dem Umwandlungsgesetz",
      "state": "Thüringen",
      "amtsgericht": "Amtsgericht Jena",
      "registernummer": "HRB 400836",
      "registerart": "HRB",
      "company_name": "Thüringer Präzisionsfedern GmbH",
      "company_seat": "Ruhla",
      "details": "06.02.2025 (Bekanntmachungsdatum)\n\nThüringen Amtsgericht Jena HRB 400836\nRegisterbekanntmachung nach dem Umwandlungsgesetz 06.02.2025 (Eintragungsdatum)\n\nThüringer Präzisionsfedern GmbH\nGesellschaft mit beschränkter Haftung\nRuhla\n\nNicht eingetragen: Den Gläubigern der an der Verschmelzung beteiligten Rechtsträger, ist wenn sie binnen sechs Monaten nach dem Tag, an dem die Eintragung der Verschmelzung in das Register des Sitzes desjenigen Rechtsträgers, dessen Gläubiger sie sind,  nach § 19 Abs. 3 UmwG als bekanntgemacht gilt, ihren Anspruch nach Grund und Höhe schriftlich anmelden, Sicherheit zu leisten, soweit sie nicht Befriedigung verlangen können. Dieses Recht steht ihnen jedoch nur zu, wenn sie glaubhaft machen, daß durch die Verschmelzung die Erfüllung ihrer Forderung gefährdet wird."
    },
    {
      "date": "2025-02-06",
      "id": "100684",
      "original_text": "Sonstige Registerbekanntmachung\nHessen Amtsgericht Offenbach am Main VR 4379\nFreizeitteam Kl.-Krotzenburg – Hainburg",
      "type": "Sonstige Registerbekanntmachung",
      "state": "Hessen",
      "amtsgericht": "Amtsgericht Offenbach am Main",
      "registernummer": "VR 4379",
      "registerart": "VR",
      "company_name": "Freizeitteam Kl.-Krotzenburg",
      "company_seat": "Hainburg",
      "details": "06.02.2025 (Bekanntmachungsdatum)\n\nHessen Amtsgericht Offenbach am Main VR 4379\nSonstige Registerbekanntmachung 06.02.2025 (Eintragungsdatum)\n\nFreizeitteam Kl.-Krotzenburg\neingetragener Verein\nHainburg"
    },
    {
      "date": "2025-02-06",
      "id": "100685",
      "original_text": "Löschungsankündigung\nHessen Amtsgericht Frankfurt am Main HRB 123780\nElaxen UG (haftungsbeschränkt) – Frankfurt am Main",
      "type": "Löschungsankündigung",
      "state": "Hessen",
      "amtsgericht": "Amtsgericht Frankfurt am Main",
      "registernummer": "HRB 123780",
      "registerart": "HRB",
      "company_name": "Elaxen UG (haftungsbeschränkt)",
      "company_seat": "Frankfurt am Main",
      "details": "06.02.2025 (Bekanntmachungsdatum)\n\nHessen Amtsgericht Frankfurt am Main HRB 123780\nLöschungsankündigung\n\nElaxen UG (haftungsbeschränkt)\nGesellschaft mit beschränkter Haftung\nFrankfurt am Main\n\nDas Registergericht beabsichtigt die im Handelsregister eingetragene Gesellschaft von Amts wegen nach § 394 FamFG zu löschen. Hiergegen kann innerhalb eines Monats nach dieser Veröffentlichung Widerspruch bei dem Amtsgericht Frankfurt am Main eingelegt werden."
    },
    {
      "date": "2025-02-06",
      "id": "100686",
      "original_text": "Sonstige Registerbekanntmachung\nHessen Amtsgericht Eschwege VR 1933\nMulti-Kulti Sportverein Eschwege e.V. – Eschwege",
      "type": "Sonstige Registerbekanntmachung",
      "state": "Hessen",
      "amtsgericht": "Amtsgericht Eschwege",
      "registernummer": "VR 1933",
      "registerart": "VR",
      "company_name": "Multi-Kulti Sportverein Eschwege e.V.",
      "company_seat": "Eschwege",
      "details": "06.02.2025 (Bekanntmachungsdatum)\n\nHessen Amtsgericht Eschwege VR 1933\nSonstige Registerbekanntmachung 06.02.2025 (Eintragungsdatum)\n\nMulti-Kulti Sportverein Eschwege e.V.\neingetragener Verein\nEschwege\n\nDer Verein ist aufgelöst."
    },
    {
      "date": "2025-02-06",
      "id": "100687",
      "original_text": "Löschungsankündigung\nHessen Amtsgericht Offenbach am Main HRB 54960\nSolis Dienstleistungen GmbH – Offenbach am Main",
      "type": "Löschungsankündigung",
      "state": "Hessen",
      "amtsgericht": "Amtsgericht Offenbach am Main",
      "registernummer": "HRB 54960",
      "registerart": "HRB",
      "company_name": "Solis Dienstleistungen GmbH",
      "company_seat": "Offenbach am Main",
      "details": "06.02.2025 (Bekanntmachungsdatum)\n\nHessen Amtsgericht Offenbach am Main HRB 54960\nLöschungsankündigung\n\nSolis Dienstleistungen GmbH\nGesellschaft mit beschränkter Haftung\nOffenbach am Main\n\nDas Registergericht beabsichtigt die im Handelsregister eingetragene Gesellschaft von Amts wegen nach § 394 FamFG zu löschen. Die Frist zur Erhebung eines Widerspruchs gegen die beabsichtigte Löschung wird auf 3 Monate festgesetzt"
    },
    {
      "date": "2025-02-06",
      "id": "100688",
      "original_text": "Registerbekanntmachung nach dem Umwandlungsgesetz\nHessen Amtsgericht Wetzlar HRB 7363\nKB Toolzz Ost GmbH – Haiger",
      "type": "Registerbekanntmachung nach dem Umwandlungsgesetz",
      "state": "Hessen",
      "amtsgericht": "Amtsgericht Wetzlar",
      "registernummer": "HRB 7363",
      "registerart": "HRB",
      "company_name": "KB Toolzz Ost GmbH",
      "company_seat": "Haiger",
      "details": "06.02.2025 (Bekanntmachungsdatum)\n\nHessen Amtsgericht Wetzlar HRB 7363\nRegisterbekanntmachung nach dem Umwandlungsgesetz 06.02.2025 (Eintragungsdatum)\n\nKB Toolzz Ost GmbH\nGesellschaft mit beschränkter Haftung\nHaiger\n\nDen Gläubigern der an der Verschmelzung beteiligten Rechtsträger ist, wenn sie binnen sechs Monaten nach dem Tag, an dem die Eintragung der Verschmelzung in das Register des Sitzes desjenigen Rechtsträgers, dessen Gläubiger sie sind, nach § 19 Absatz 3 UmwG bekannt gemacht worden ist, ihren Anspruch nach Grund und Höhe schriftlich anmelden, Sicherheit zu leisten, soweit sie nicht Befriedigung verlangen können. Dieses Recht steht den Gläubigern jedoch nur zu, wenn sie glaubhaft machen, dass durch die Verschmelzung die Erfüllung ihrer Forderung gefährdet wird."
    },
    {
      "date": "2025-02-06",
      "id": "100689",
      "original_text": "Registerbekanntmachung nach dem Umwandlungsgesetz\nHessen Amtsgericht Wetzlar HRB 7369\nKB Toolzz Süd GmbH – Haiger",
      "type": "Registerbekanntmachung nach dem Umwandlungsgesetz",
      "state": "Hessen",
      "amtsgericht": "Amtsgericht Wetzlar",
      "registernummer": "HRB 7369",
      "registerart": "HRB",
      "company_name": "KB Toolzz Süd GmbH",
      "company_seat": "Haiger",
      "details": "06.02.2025 (Bekanntmachungsdatum)\n\nHessen Amtsgericht Wetzlar HRB 7369\nRegisterbekanntmachung nach dem Umwandlungsgesetz 06.02.2025 (Eintragungsdatum)\n\nKB Toolzz Süd GmbH\nGesellschaft mit beschränkter Haftung\nHaiger\n\nDen Gläubigern der an der Verschmelzung beteiligten Rechtsträger ist, wenn sie binnen sechs Monaten nach dem Tag, an dem die Eintragung der Verschmelzung in das Register des Sitzes desjenigen Rechtsträgers, dessen Gläubiger sie sind, nach § 19 Absatz 3 UmwG bekannt gemacht worden ist, ihren Anspruch nach Grund und Höhe schriftlich anmelden, Sicherheit zu leisten, soweit sie nicht Befriedigung verlangen können. Dieses Recht steht den Gläubigern jedoch nur zu, wenn sie glaubhaft machen, dass durch die Verschmelzung die Erfüllung ihrer Forderung gefährdet wird."
    },
    {
      "date": "2025-02-06",
      "id": "100690",
      "original_text": "Sonstige Registerbekanntmachung\nHessen Amtsgericht Marburg HRB 6749\nithinx GmbH – Allendorf (Eder)",
      "type": "Sonstige Registerbekanntmachung",
      "state": "Hessen",
      "amtsgericht": "Amtsgericht Marburg",
      "registernummer": "HRB 6749",
      "registerart": "HRB",
      "company_name": "ithinx GmbH",
      "company_seat": "Allendorf (Eder)",
      "details": "06.02.2025 (Bekanntmachungsdatum)\n\nHessen Amtsgericht Marburg HRB 6749\nSonstige Registerbekanntmachung 06.02.2025 (Eintragungsdatum)\n\nithinx GmbH\nGesellschaft mit beschränkter Haftung\nAllendorf (Eder)\n\nDen Gläubigern der Gesellschaft, deren Forderungen begründet worden sind, bevor die Eintragung der Beendigung des Vertrags in das Handelsregister nach § 10 HGB bekannt gemacht worden ist, ist vom anderen Vertragsteil Sicherheit zu leisten, wenn sie sich binnen sechs Monaten nach dieser Bekanntmachung zu diesem Zweck bei ihm melden."
    },
    {
      "date": "2025-02-06",
      "id": "100691",
      "original_text": "Einreichung neuer Dokumente\nHessen Amtsgericht Frankfurt am Main HRB 27664\nMETZLER ASSET MANAGEMENT GMBH – Frankfurt am Main",
      "type": "Einreichung neuer Dokumente",
      "state": "Hessen",
      "amtsgericht": "Amtsgericht Frankfurt am Main",
      "registernummer": "HRB 27664",
      "registerart": "HRB",
      "company_name": "METZLER ASSET MANAGEMENT GMBH",
      "company_seat": "Frankfurt am Main",
      "details": "06.02.2025 (Bekanntmachungsdatum)\n\nHessen Amtsgericht Frankfurt am Main HRB 27664\nEinreichung neuer Dokumente\n\nMETZLER ASSET MANAGEMENT GMBH\nGesellschaft mit beschränkter Haftung\nFrankfurt am Main\n\nDurch eine Änderung in den Personen der Aufsichtsratsmitglieder ist eine Liste der Mitglieder des Aufsichtsrates zum Handelsregister eingereicht worden."
    },
    {
      "date": "2025-02-06",
      "id": "100692",
      "original_text": "Registerbekanntmachung nach dem Umwandlungsgesetz\nHessen Amtsgericht Wetzlar HRB 7360\nKB Toolzz Austria GmbH – Haiger",
      "type": "Registerbekanntmachung nach dem Umwandlungsgesetz",
      "state": "Hessen",
      "amtsgericht": "Amtsgericht Wetzlar",
      "registernummer": "HRB 7360",
      "registerart": "HRB",
      "company_name": "KB Toolzz Austria GmbH",
      "company_seat": "Haiger",
      "details": "06.02.2025 (Bekanntmachungsdatum)\n\nHessen Amtsgericht Wetzlar HRB 7360\nRegisterbekanntmachung nach dem Umwandlungsgesetz 06.02.2025 (Eintragungsdatum)\n\nKB Toolzz Austria GmbH\nGesellschaft mit beschränkter Haftung\nHaiger\n\nDen Gläubigern der an der Verschmelzung beteiligten Rechtsträger ist, wenn sie binnen sechs Monaten nach dem Tag, an dem die Eintragung der Verschmelzung in das Register des Sitzes desjenigen Rechtsträgers, dessen Gläubiger sie sind, nach § 19 Absatz 3 UmwG bekannt gemacht worden ist, ihren Anspruch nach Grund und Höhe schriftlich anmelden, Sicherheit zu leisten, soweit sie nicht Befriedigung verlangen können. Dieses Recht steht den Gläubigern jedoch nur zu, wenn sie glaubhaft machen, dass durch die Verschmelzung die Erfüllung ihrer Forderung gefährdet wird."
    },
    {
      "date": "2025-02-06",
      "id": "100693",
      "original_text": "Registerbekanntmachung nach dem Umwandlungsgesetz\nHessen Amtsgericht Frankfurt am Main HRB 44420\nemagine GmbH – Frankfurt am Main",
      "type": "Registerbekanntmachung nach dem Umwandlungsgesetz",
      "state": "Hessen",
      "amtsgericht": "Amtsgericht Frankfurt am Main",
      "registernummer": "HRB 44420",
      "registerart": "HRB",
      "company_name": "emagine GmbH",
      "company_seat": "Frankfurt am Main",
      "details": "06.02.2025 (Bekanntmachungsdatum)\n\nHessen Amtsgericht Frankfurt am Main HRB 44420\nRegisterbekanntmachung nach dem Umwandlungsgesetz 06.02.2025 (Eintragungsdatum)\n\nemagine GmbH\nGesellschaft mit beschränkter Haftung\nFrankfurt am Main\n\nDen Gläubigern der an der Verschmelzung beteiligten Rechtsträger ist, wenn sie binnen sechs Monaten nach dem Tag, an dem die Eintragung der Verschmelzung in das Register des Sitzes derjenigen Rechtsträger deren Gläubiger sie sind, nach § 19 Absatz 3 UmwG bekannt gemacht worden ist, ihren Anspruch nach Grund und Höhe schriftlich anmelden, Sicherheit zu leisten, soweit sie nicht Befriedigung verlangen können. Dieses Recht steht den Gläubigern jedoch nur zu, wenn sie glaubhaft machen, dass durch die Verschmelzung die Erfüllung ihrer Forderung gefährdet wird."
    },
    {
      "date": "2025-02-06",
      "id": "100694",
      "original_text": "Sonstige Registerbekanntmachung\nHessen Amtsgericht Fritzlar VR 480\nHeimat und Trachtenverein Ermetheis – Niedenstein-Ermetheis",
      "type": "Sonstige Registerbekanntmachung",
      "state": "Hessen",
      "amtsgericht": "Amtsgericht Fritzlar",
      "registernummer": "VR 480",
      "registerart": "VR",
      "company_name": "Heimat und Trachtenverein Ermetheis",
      "company_seat": "Niedenstein-Ermetheis",
      "details": "06.02.2025 (Bekanntmachungsdatum)\n\nHessen Amtsgericht Fritzlar VR 480\nSonstige Registerbekanntmachung 06.02.2025 (Eintragungsdatum)\n\nHeimat und Trachtenverein Ermetheis\neingetragener Verein\nNiedenstein-Ermetheis\n\nDer Verein ist aufgelöst."
    },
    {
      "date": "2025-02-06",
      "id": "100695",
      "original_text": "Löschungsankündigung\nHessen Amtsgericht Frankfurt am Main HRB 52817\nV-Doit Food & More GmbH – Frankfurt am Main",
      "type": "Löschungsankündigung",
      "state": "Hessen",
      "amtsgericht": "Amtsgericht Frankfurt am Main",
      "registernummer": "HRB 52817",
      "registerart": "HRB",
      "company_name": "V-Doit Food & More GmbH",
      "company_seat": "Frankfurt am Main",
      "details": "06.02.2025 (Bekanntmachungsdatum)\n\nHessen Amtsgericht Frankfurt am Main HRB 52817\nLöschungsankündigung 06.02.2025 (Eintragungsdatum)\n\nV-Doit Food & More GmbH\nGesellschaft mit beschränkter Haftung\nFrankfurt am Main\n\nDas Registergericht beabsichtigt die im Handelsregister eingetragene Gesellschaft von Amts wegen nach § 394 FamFG zu löschen. Die Frist zur Erhebung eines Widerspruchs gegen die beabsichtigte Löschung wird auf 1 Monat festgesetzt."
    },
    {
      "date": "2025-02-06",
      "id": "100696",
      "original_text": "Löschungsankündigung\nHessen Amtsgericht Marburg HRB 5683\nRotex Werkzeugmaschinenhandel GmbH – Schwalmstadt",
      "type": "Löschungsankündigung",
      "state": "Hessen",
      "amtsgericht": "Amtsgericht Marburg",
      "registernummer": "HRB 5683",
      "registerart": "HRB",
      "company_name": "Rotex Werkzeugmaschinenhandel GmbH",
      "company_seat": "Schwalmstadt",
      "details": "06.02.2025 (Bekanntmachungsdatum)\n\nHessen Amtsgericht Marburg HRB 5683\nLöschungsankündigung\n\nRotex Werkzeugmaschinenhandel GmbH\nGesellschaft mit beschränkter Haftung\nSchwalmstadt\n\nDas Registergericht beabsichtigt die im Handelsregister eingetragene Gesellschaft von Amts wegen nach § 394 FamFG zu löschen. Die Frist zur Erhebung eines Widerspruchs gegen die beabsichtigte Löschung wird auf 3 Monate festgesetzt."
    },
    {
      "date": "2025-02-06",
      "id": "100697",
      "original_text": "Sonstige Registerbekanntmachung\nHessen Amtsgericht Wiesbaden VR 7411\nWerk e.V. Kunstwerk Handwerk Netzwerk – Wiesbaden",
      "type": "Sonstige Registerbekanntmachung",
      "state": "Hessen",
      "amtsgericht": "Amtsgericht Wiesbaden",
      "registernummer": "VR 7411",
      "registerart": "VR",
      "company_name": "Werk e.V. Kunstwerk Handwerk Netzwerk",
      "company_seat": "Wiesbaden",
      "details": "06.02.2025 (Bekanntmachungsdatum)\n\nHessen Amtsgericht Wiesbaden VR 7411\nSonstige Registerbekanntmachung 06.02.2025 (Eintragungsdatum)\n\nWerk e.V. Kunstwerk Handwerk Netzwerk\neingetragener Verein\nWiesbaden\n\nDer Verein ist aufgelöst."
    },
    {
      "date": "2025-02-06",
      "id": "100698",
      "original_text": "Einreichung neuer Dokumente\nHessen Amtsgericht Fritzlar HRB 8246\nStadtwerke Borken (Hessen) GmbH – Borken (Hessen)",
      "type": "Einreichung neuer Dokumente",
      "state": "Hessen",
      "amtsgericht": "Amtsgericht Fritzlar",
      "registernummer": "HRB 8246",
      "registerart": "HRB",
      "company_name": "Stadtwerke Borken (Hessen) GmbH",
      "company_seat": "Borken (Hessen)",
      "details": "06.02.2025 (Bekanntmachungsdatum)\n\nHessen Amtsgericht Fritzlar HRB 8246\nEinreichung neuer Dokumente 06.02.2025 (Eintragungsdatum)\n\nStadtwerke Borken (Hessen) GmbH\nGesellschaft mit beschränkter Haftung\nBorken (Hessen)\n\nDurch eine Änderung in den Personen der Aufsichtsratsmitglieder ist eine Liste der Mitglieder des Aufsichtsrates zum Handelsregister eingereicht worden."
    },
    {
      "date": "2025-02-06",
      "id": "100699",
      "original_text": "Registerbekanntmachung nach dem Umwandlungsgesetz\nHessen Amtsgericht Wetzlar HRB 7364\nKB Toolzz West GmbH – Haiger",
      "type": "Registerbekanntmachung nach dem Umwandlungsgesetz",
      "state": "Hessen",
      "amtsgericht": "Amtsgericht Wetzlar",
      "registernummer": "HRB 7364",
      "registerart": "HRB",
      "company_name": "KB Toolzz West GmbH",
      "company_seat": "Haiger",
      "details": "06.02.2025 (Bekanntmachungsdatum)\n\nHessen Amtsgericht Wetzlar HRB 7364\nRegisterbekanntmachung nach dem Umwandlungsgesetz 06.02.2025 (Eintragungsdatum)\n\nKB Toolzz West GmbH\nGesellschaft mit beschränkter Haftung\nHaiger\n\nDen Gläubigern der an der Verschmelzung beteiligten Rechtsträger ist, wenn sie binnen sechs Monaten nach dem Tag, an dem die Eintragung der Verschmelzung in das Register des Sitzes desjenigen Rechtsträgers, dessen Gläubiger sie sind, nach § 19 Absatz 3 UmwG bekannt gemacht worden ist, ihren Anspruch nach Grund und Höhe schriftlich anmelden, Sicherheit zu leisten, soweit sie nicht Befriedigung verlangen können. Dieses Recht steht den Gläubigern jedoch nur zu, wenn sie glaubhaft machen, dass durch die Verschmelzung die Erfüllung ihrer Forderung gefährdet wird."
    },
    {
      "date": "2025-02-06",
      "id": "100700",
      "original_text": "Registerbekanntmachung nach dem Umwandlungsgesetz\nHessen Amtsgericht Wetzlar HRB 7623\nFrizz Group 4 Toolzz GmbH – Haiger",
      "type": "Registerbekanntmachung nach dem Umwandlungsgesetz",
      "state": "Hessen",
      "amtsgericht": "Amtsgericht Wetzlar",
      "registernummer": "HRB 7623",
      "registerart": "HRB",
      "company_name": "Frizz Group 4 Toolzz GmbH",
      "company_seat": "Haiger",
      "details": "06.02.2025 (Bekanntmachungsdatum)\n\nHessen Amtsgericht Wetzlar HRB 7623\nRegisterbekanntmachung nach dem Umwandlungsgesetz 06.02.2025 (Eintragungsdatum)\n\nFrizz Group 4 Toolzz GmbH\nGesellschaft mit beschränkter Haftung\nHaiger\n\nDen Gläubigern der an der #DV.UmF(Text=\"Bitte wählen Sie die zutreffende Art nach UmwG aus!\",Eingabe=\"Verschmelzung\",\"Aufspaltung\",\"Abspaltung\",\"Ausgliederung\",\"Vermögensübertragung\",\"formwechselnden Umwandlung\") beteiligten Rechtsträger ist, wenn sie binnen sechs Monaten nach dem Tag, an dem die Eintragung der #DV.UmF in das Register des Sitzes #DV.RTr(Text=\"Bitte wählen Sie aus, ob ein oder mehrere andere Rechtsträger betroffen sind!\",Eingabe=\"desjenigen Rechtsträgers, dessen Gläubiger\",\"derjenigen Rechtsträger deren Gläubiger\") sie sind, nach #DV.Auswahl(Text=\"Bitte wählen Sie die zutreffende Vorschrift aus!\",Eingabe=\"§ 19 Absatz 3 UmwG\"|\"§ 19 Absatz 3 UmwG (=Verschmelzung)\",\"§§ 122a Absatz 2, 19 Absatz 3 UmwG\"|\"§§ 122a Absatz 2, 19 Absatz 3 UmwG (=grenzüberschreitende Verschmelzung)\",\"§§ 125, 19 Absatz 3 UmwG\"|\"§§ 125, 19 Absatz 3 UmwG (=Spaltung)\",\"§ 201 UmwG\"|\"§ 201 UmwG (=Formwechsel)\",\"#insert(Text=\"Freitext\") UmwG\"|\"freie Eingabe\") bekannt gemacht worden ist, ihren Anspruch nach Grund und Höhe schriftlich anmelden, Sicherheit zu leisten, soweit sie nicht Befriedigung verlangen können. Dieses Recht steht den Gläubigern jedoch nur zu, wenn sie glaubhaft machen, dass durch die #DV.UmF die Erfüllung ihrer Forderung gefährdet wird."
    },
    {
      "date": "2025-02-06",
      "id": "100701",
      "original_text": "Sonstige Registerbekanntmachung\nHessen Amtsgericht Fritzlar VR 1254\nTraditionsverein KURHESSEN BRIGADE 5 – Homberg (Efze)",
      "type": "Sonstige Registerbekanntmachung",
      "state": "Hessen",
      "amtsgericht": "Amtsgericht Fritzlar",
      "registernummer": "VR 1254",
      "registerart": "VR",
      "company_name": "Traditionsverein KURHESSEN BRIGADE 5",
      "company_seat": "Homberg (Efze)",
      "details": "06.02.2025 (Bekanntmachungsdatum)\n\nHessen Amtsgericht Fritzlar VR 1254\nSonstige Registerbekanntmachung 06.02.2025 (Eintragungsdatum)\n\nTraditionsverein KURHESSEN BRIGADE 5\neingetragener Verein\nHomberg (Efze)\n\nDer Verein ist aufgelöst."
    },
    {
      "date": "2025-02-06",
      "id": "100702",
      "original_text": "Registerbekanntmachung nach dem Umwandlungsgesetz\nHessen Amtsgericht Frankfurt am Main HRB 44420\nemagine GmbH – Frankfurt am Main",
      "type": "Registerbekanntmachung nach dem Umwandlungsgesetz",
      "state": "Hessen",
      "amtsgericht": "Amtsgericht Frankfurt am Main",
      "registernummer": "HRB 44420",
      "registerart": "HRB",
      "company_name": "emagine GmbH",
      "company_seat": "Frankfurt am Main",
      "details": "06.02.2025 (Bekanntmachungsdatum)\n\nHessen Amtsgericht Frankfurt am Main HRB 44420\nRegisterbekanntmachung nach dem Umwandlungsgesetz 06.02.2025 (Eintragungsdatum)\n\nemagine GmbH\nGesellschaft mit beschränkter Haftung\nFrankfurt am Main\n\nDen Gläubigern der an der Verschmelzung beteiligten Rechtsträger ist, wenn sie binnen sechs Monaten nach dem Tag, an dem die Eintragung der Verschmelzung in das Register des Sitzes derjenigen Rechtsträger deren Gläubiger sie sind, nach § 19 Absatz 3 UmwG bekannt gemacht worden ist, ihren Anspruch nach Grund und Höhe schriftlich anmelden, Sicherheit zu leisten, soweit sie nicht Befriedigung verlangen können. Dieses Recht steht den Gläubigern jedoch nur zu, wenn sie glaubhaft machen, dass durch die Verschmelzung die Erfüllung ihrer Forderung gefährdet wird."
    }
  ]
}