{
  "date": "2025-02-14",
  "date_of_scrape": "2025-02-15T04:06:59.397Z",
  "tool_version": "0.2.0",
  "number_of_announcements": 103,
  "announcements": [
    {
      "date": "2025-02-14",
      "id": "101315",
      "original_text": "Löschungsankündigung\nBayern Amtsgericht Kempten (Allgäu) HRB 14950\nMake me happy 24/7 GmbH – Kempten (Allgäu)",
      "type": "Löschungsankündigung",
      "state": "Bayern",
      "amtsgericht": "Amtsgericht Kempten (Allgäu)",
      "registernummer": "HRB 14950",
      "registerart": "HRB",
      "company_name": "Make me happy 24/7 GmbH",
      "company_seat": "Kempten (Allgäu)",
      "details": "14.02.2025 (Bekanntmachungsdatum)\n\nBayern Amtsgericht Kempten (Allgäu) HRB 14950\nLöschungsankündigung\n\nMake me happy 24/7 GmbH\nGesellschaft mit beschränkter Haftung\nKempten (Allgäu)\n\nDas Registergericht beabsichtigt, die im Handelsregister eingetragene Gesellschaft wegen Vermögenslosigkeit von Amts wegen nach § 394 FamFG zu löschen. Die Frist zur Erhebung eines Widerspruchs ist auf einen Monat festgesetzt."
    },
    {
      "date": "2025-02-14",
      "id": "101316",
      "original_text": "Registerbekanntmachung nach dem Umwandlungsgesetz\nBayern Amtsgericht Augsburg HRB 1040\nMayer & Söhne Verwaltung GmbH – Aichach",
      "type": "Registerbekanntmachung nach dem Umwandlungsgesetz",
      "state": "Bayern",
      "amtsgericht": "Amtsgericht Augsburg",
      "registernummer": "HRB 1040",
      "registerart": "HRB",
      "company_name": "Mayer & Söhne Verwaltung GmbH",
      "company_seat": "Aichach",
      "details": "14.02.2025 (Bekanntmachungsdatum)\n\nBayern Amtsgericht Augsburg HRB 1040\nRegisterbekanntmachung nach dem Umwandlungsgesetz 13.02.2025 (Eintragungsdatum)\n\nMayer & Söhne Verwaltung GmbH\nGesellschaft mit beschränkter Haftung\nAichach\n\nDen Gläubigern der an der Verschmelzung beteiligten Rechtsträger ist, wenn sie binnen sechs Monaten nach dem Tag, an dem die Eintragung der Verschmelzung in das Register des Sitzes desjenigen Rechtsträgers, dessen Gläubiger sie sind, nach § 19 Abs. 3 UmwG als bekannt gemacht gilt, ihren Anspruch nach Grund und Höhe in Textform anmelden, Sicherheit zu leisten, soweit sie nicht Befriedigung verlangen können. Dieses Recht steht den Gläubigern jedoch nur zu, wenn sie glaubhaft machen, dass durch die Verschmelzung die Erfüllung ihrer Forderung gefährdet wird."
    },
    {
      "date": "2025-02-14",
      "id": "101317",
      "original_text": "Löschungsankündigung\nBayern Amtsgericht Kempten (Allgäu) HRB 8910\nAllgäu-PLS GmbH – Kempten (Allgäu)",
      "type": "Löschungsankündigung",
      "state": "Bayern",
      "amtsgericht": "Amtsgericht Kempten (Allgäu)",
      "registernummer": "HRB 8910",
      "registerart": "HRB",
      "company_name": "Allgäu-PLS GmbH",
      "company_seat": "Kempten (Allgäu)",
      "details": "14.02.2025 (Bekanntmachungsdatum)\n\nBayern Amtsgericht Kempten (Allgäu) HRB 8910\nLöschungsankündigung\n\nAllgäu-PLS GmbH\nGesellschaft mit beschränkter Haftung\nKempten (Allgäu)\n\nDas Registergericht beabsichtigt, die im Handelsregister eingetragene Gesellschaft wegen Vermögenslosigkeit von Amts wegen nach § 394 FamFG zu löschen. Die Frist zur Erhebung eines Widerspruchs ist auf einen Monat festgesetzt."
    },
    {
      "date": "2025-02-14",
      "id": "101318",
      "original_text": "Einreichung neuer Dokumente\nBayern Amtsgericht München HRB 228251\nKraussMaffei Group GmbH – Vaterstetten, OT Parsdorf",
      "type": "Einreichung neuer Dokumente",
      "state": "Bayern",
      "amtsgericht": "Amtsgericht München",
      "registernummer": "HRB 228251",
      "registerart": "HRB",
      "company_name": "KraussMaffei Group GmbH",
      "company_seat": "Vaterstetten, OT Parsdorf",
      "details": "14.02.2025 (Bekanntmachungsdatum)\n\nBayern Amtsgericht München HRB 228251\nEinreichung neuer Dokumente 13.02.2025 (Eintragungsdatum)\n\nKraussMaffei Group GmbH\nGesellschaft mit beschränkter Haftung\nVaterstetten, OT Parsdorf\n\nDem Amtsgericht München -Registergericht- ist eine Liste der Mitglieder des Aufsichtsrats eingereicht worden, § 52 Abs. 3 S. 2 GmbHG."
    },
    {
      "date": "2025-02-14",
      "id": "101319",
      "original_text": "Löschungsankündigung\nBayern Amtsgericht München HRB 236001\nMunich Accounting Service GmbH – München",
      "type": "Löschungsankündigung",
      "state": "Bayern",
      "amtsgericht": "Amtsgericht München",
      "registernummer": "HRB 236001",
      "registerart": "HRB",
      "company_name": "Munich Accounting Service GmbH",
      "company_seat": "München",
      "details": "14.02.2025 (Bekanntmachungsdatum)\n\nBayern Amtsgericht München HRB 236001\nLöschungsankündigung 13.02.2025 (Eintragungsdatum)\n\nMunich Accounting Service GmbH\nGesellschaft mit beschränkter Haftung\nMünchen\n\nDas Registergericht beabsichtigt, die im Handelsregister eingetragene Gesellschaft von Amts wegen nach § 395 FamFG zu löschen. Die Frist zur Erhebung eines Widerspruchs ist auf drei Monate festgesetzt."
    },
    {
      "date": "2025-02-14",
      "id": "101320",
      "original_text": "Einreichung neuer Dokumente\nBayern Amtsgericht Nürnberg HRB 25279\nPfleiderer Deutschland GmbH – Neumarkt i.d.OPf.",
      "type": "Einreichung neuer Dokumente",
      "state": "Bayern",
      "amtsgericht": "Amtsgericht Nürnberg",
      "registernummer": "HRB 25279",
      "registerart": "HRB",
      "company_name": "Pfleiderer Deutschland GmbH",
      "company_seat": "Neumarkt i.d.OPf.",
      "details": "14.02.2025 (Bekanntmachungsdatum)\n\nBayern Amtsgericht Nürnberg HRB 25279\nEinreichung neuer Dokumente\n\nPfleiderer Deutschland GmbH\nGesellschaft mit beschränkter Haftung\nNeumarkt i.d.OPf.\n\nDem Amtsgericht Nürnberg -Registergericht- ist eine Liste der Mitglieder des Aufsichtsrats eingereicht worden, § 52 Abs. 3 S. 2 GmbHG."
    },
    {
      "date": "2025-02-14",
      "id": "101321",
      "original_text": "Registerbekanntmachung nach dem Umwandlungsgesetz\nBayern Amtsgericht München HRA 100097\nM.I.V. KG – München",
      "type": "Registerbekanntmachung nach dem Umwandlungsgesetz",
      "state": "Bayern",
      "amtsgericht": "Amtsgericht München",
      "registernummer": "HRA 100097",
      "registerart": "HRA",
      "company_name": "M.I.V. KG",
      "company_seat": "München",
      "details": "14.02.2025 (Bekanntmachungsdatum)\n\nBayern Amtsgericht München HRA 100097\nRegisterbekanntmachung nach dem Umwandlungsgesetz 13.02.2025 (Eintragungsdatum)\n\nM.I.V. KG\nKommanditgesellschaft\nMünchen\n\nDen Gläubigern des formwechselnden Rechtsträgers ist, wenn sie binnen sechs Monaten nach dem Tag, an dem die Eintragung des Formwechsels nach § 201 UmwG als bekannt gemacht gilt, ihren Anspruch nach Grund und Höhe in Textform anmelden, Sicherheit zu leisten, soweit sie nicht Befriedigung verlangen können. Dieses Recht steht den Gläubigern jedoch nur zu, wenn sie glaubhaft machen, dass durch den Formwechsel die Erfüllung ihrer Forderung gefährdet wird."
    },
    {
      "date": "2025-02-14",
      "id": "101322",
      "original_text": "Löschungsankündigung\nBayern Amtsgericht München HRB 232616\nSchutzAktiv Alarm & Sicherheitstechnik GmbH – München",
      "type": "Löschungsankündigung",
      "state": "Bayern",
      "amtsgericht": "Amtsgericht München",
      "registernummer": "HRB 232616",
      "registerart": "HRB",
      "company_name": "SchutzAktiv Alarm & Sicherheitstechnik GmbH",
      "company_seat": "München",
      "details": "14.02.2025 (Bekanntmachungsdatum)\n\nBayern Amtsgericht München HRB 232616\nLöschungsankündigung 13.02.2025 (Eintragungsdatum)\n\nSchutzAktiv Alarm & Sicherheitstechnik GmbH\nGesellschaft mit beschränkter Haftung\nMünchen\n\nDas Registergericht beabsichtigt, die im Handelsregister eingetragene Gesellschaft wegen Vermögenslosigkeit von Amts wegen nach § 394 FamFG zu löschen. Die Frist zur Erhebung eines Widerspruchs ist auf drei Monate festgesetzt."
    },
    {
      "date": "2025-02-14",
      "id": "101323",
      "original_text": "Löschungsankündigung\nBayern Amtsgericht München HRB 222141\nNext Dienstleistung GmbH – München",
      "type": "Löschungsankündigung",
      "state": "Bayern",
      "amtsgericht": "Amtsgericht München",
      "registernummer": "HRB 222141",
      "registerart": "HRB",
      "company_name": "Next Dienstleistung GmbH",
      "company_seat": "München",
      "details": "14.02.2025 (Bekanntmachungsdatum)\n\nBayern Amtsgericht München HRB 222141\nLöschungsankündigung 13.02.2025 (Eintragungsdatum)\n\nNext Dienstleistung GmbH\nGesellschaft mit beschränkter Haftung\nMünchen\n\nDas Registergericht beabsichtigt, die im Handelsregister eingetragene Gesellschaft wegen Vermögenslosigkeit von Amts wegen nach § 394 FamFG zu löschen. Die Frist zur Erhebung eines Widerspruchs ist auf drei Monate festgesetzt."
    },
    {
      "date": "2025-02-14",
      "id": "101324",
      "original_text": "Löschungsankündigung\nBayern Amtsgericht München HRB 234202\nAutohaus Tulling GmbH – Steinhöring",
      "type": "Löschungsankündigung",
      "state": "Bayern",
      "amtsgericht": "Amtsgericht München",
      "registernummer": "HRB 234202",
      "registerart": "HRB",
      "company_name": "Autohaus Tulling GmbH",
      "company_seat": "Steinhöring",
      "details": "14.02.2025 (Bekanntmachungsdatum)\n\nBayern Amtsgericht München HRB 234202\nLöschungsankündigung 13.02.2025 (Eintragungsdatum)\n\nAutohaus Tulling GmbH\nGesellschaft mit beschränkter Haftung\nSteinhöring\n\nDas Registergericht beabsichtigt, den im Handelsregister eingetragenen Geschäftsführer wegen fehlender Eignung nach § 395 FamFG zu löschen. Die Frist zur Erhebung eines Widerspruchs ist auf drei Monate festgesetzt."
    },
    {
      "date": "2025-02-14",
      "id": "101325",
      "original_text": "Löschungsankündigung\nBayern Amtsgericht München HRB 234202\nAutohaus Tulling GmbH – Steinhöring",
      "type": "Löschungsankündigung",
      "state": "Bayern",
      "amtsgericht": "Amtsgericht München",
      "registernummer": "HRB 234202",
      "registerart": "HRB",
      "company_name": "Autohaus Tulling GmbH",
      "company_seat": "Steinhöring",
      "details": "14.02.2025 (Bekanntmachungsdatum)\n\nBayern Amtsgericht München HRB 234202\nLöschungsankündigung 13.02.2025 (Eintragungsdatum)\n\nAutohaus Tulling GmbH\nGesellschaft mit beschränkter Haftung\nSteinhöring\n\nDas Registergericht beabsichtigt, den im Handelsregister eingetragenen Geschäftsführer Stefan Heiny wegen fehlender Eignung nach § 395 FamFG zu löschen. Die Frist zur Erhebung eines Widerspruchs ist auf drei Monate festgesetzt."
    },
    {
      "date": "2025-02-14",
      "id": "101326",
      "original_text": "Löschungsankündigung\nBayern Amtsgericht München HRB 234202\nAutohaus Tulling GmbH – Steinhöring",
      "type": "Löschungsankündigung",
      "state": "Bayern",
      "amtsgericht": "Amtsgericht München",
      "registernummer": "HRB 234202",
      "registerart": "HRB",
      "company_name": "Autohaus Tulling GmbH",
      "company_seat": "Steinhöring",
      "details": "14.02.2025 (Bekanntmachungsdatum)\n\nBayern Amtsgericht München HRB 234202\nLöschungsankündigung 13.02.2025 (Eintragungsdatum)\n\nAutohaus Tulling GmbH\nGesellschaft mit beschränkter Haftung\nSteinhöring\n\nDas Registergericht beabsichtigt, den im Handelsregister eingetragenen Geschäftsführer Simona Heiny wegen fehlender Eignung nach § 395 FamFG zu löschen. Die Frist zur Erhebung eines Widerspruchs ist auf drei Monate festgesetzt."
    },
    {
      "date": "2025-02-14",
      "id": "101327",
      "original_text": "Registerbekanntmachung nach dem Umwandlungsgesetz\nBayern Amtsgericht Augsburg HRB 20931\nHirelgre Medien Verwaltungs GmbH – Aichach",
      "type": "Registerbekanntmachung nach dem Umwandlungsgesetz",
      "state": "Bayern",
      "amtsgericht": "Amtsgericht Augsburg",
      "registernummer": "HRB 20931",
      "registerart": "HRB",
      "company_name": "Hirelgre Medien Verwaltungs GmbH",
      "company_seat": "Aichach",
      "details": "14.02.2025 (Bekanntmachungsdatum)\n\nBayern Amtsgericht Augsburg HRB 20931\nRegisterbekanntmachung nach dem Umwandlungsgesetz 13.02.2025 (Eintragungsdatum)\n\nHirelgre Medien Verwaltungs GmbH\nGesellschaft mit beschränkter Haftung\nAichach\n\nDen Gläubigern der an der Verschmelzung beteiligten Rechtsträger ist, wenn sie binnen sechs Monaten nach dem Tag, an dem die Eintragung der Verschmelzung in das Register des Sitzes desjenigen Rechtsträgers, dessen Gläubiger sie sind, nach § 19 Abs. 3 UmwG als bekannt gemacht gilt, ihren Anspruch nach Grund und Höhe in Textform anmelden, Sicherheit zu leisten, soweit sie nicht Befriedigung verlangen können. Dieses Recht steht den Gläubigern jedoch nur zu, wenn sie glaubhaft machen, dass durch die Verschmelzung die Erfüllung ihrer Forderung gefährdet wird."
    },
    {
      "date": "2025-02-14",
      "id": "101328",
      "original_text": "Löschungsankündigung\nBayern Amtsgericht Coburg HRB 5236\nNecke Möbel GmbH – Schneckenlohe",
      "type": "Löschungsankündigung",
      "state": "Bayern",
      "amtsgericht": "Amtsgericht Coburg",
      "registernummer": "HRB 5236",
      "registerart": "HRB",
      "company_name": "Necke Möbel GmbH",
      "company_seat": "Schneckenlohe",
      "details": "14.02.2025 (Bekanntmachungsdatum)\n\nBayern Amtsgericht Coburg HRB 5236\nLöschungsankündigung 13.02.2025 (Eintragungsdatum)\n\nNecke Möbel GmbH\nGesellschaft mit beschränkter Haftung\nSchneckenlohe\n\nDas Registergericht beabsichtigt, die im Handelsregister eingetragene Gesellschaft wegen Vermögenslosigkeit von Amts wegen nach § 394 FamFG zu löschen. Die Frist zur Erhebung eines Widerspruchs ist auf sechs Wochen festgesetzt."
    },
    {
      "date": "2025-02-14",
      "id": "101329",
      "original_text": "Löschungsankündigung\nBayern Amtsgericht Kempten (Allgäu) HRB 4202\nCambodunum Film GmbH – Dietmannsried",
      "type": "Löschungsankündigung",
      "state": "Bayern",
      "amtsgericht": "Amtsgericht Kempten (Allgäu)",
      "registernummer": "HRB 4202",
      "registerart": "HRB",
      "company_name": "Cambodunum Film GmbH",
      "company_seat": "Dietmannsried",
      "details": "14.02.2025 (Bekanntmachungsdatum)\n\nBayern Amtsgericht Kempten (Allgäu) HRB 4202\nLöschungsankündigung\n\nCambodunum Film GmbH\nGesellschaft mit beschränkter Haftung\nDietmannsried\n\nDas Registergericht beabsichtigt, die im Handelsregister eingetragene Gesellschaft wegen Vermögenslosigkeit von Amts wegen nach § 394 FamFG zu löschen. Die Frist zur Erhebung eines Widerspruchs ist auf einen Monat festgesetzt."
    },
    {
      "date": "2025-02-14",
      "id": "101330",
      "original_text": "Einreichung neuer Dokumente\nSaarland Amtsgericht Saarbrücken HRB 10937\nStadtwerke Saarbrücken Bäder GmbH – Saarbrücken",
      "type": "Einreichung neuer Dokumente",
      "state": "Saarland",
      "amtsgericht": "Amtsgericht Saarbrücken",
      "registernummer": "HRB 10937",
      "registerart": "HRB",
      "company_name": "Stadtwerke Saarbrücken Bäder GmbH",
      "company_seat": "Saarbrücken",
      "details": "14.02.2025 (Bekanntmachungsdatum)\n\nSaarland Amtsgericht Saarbrücken HRB 10937\nEinreichung neuer Dokumente\n\nStadtwerke Saarbrücken Bäder GmbH\nGesellschaft mit beschränkter Haftung\nSaarbrücken\n\nDie Geschäftsführung der Gesellschaft hat eine Liste der Mitglieder des Aufsichtsrats zum Handelsregister eingereicht (§ 52 Abs. 3 Satz 2 GmbHG)."
    },
    {
      "date": "2025-02-14",
      "id": "101331",
      "original_text": "Einreichung neuer Dokumente\nSaarland Amtsgericht Saarbrücken HRB 9731\nSaarbahn Netz GmbH – Saarbrücken",
      "type": "Einreichung neuer Dokumente",
      "state": "Saarland",
      "amtsgericht": "Amtsgericht Saarbrücken",
      "registernummer": "HRB 9731",
      "registerart": "HRB",
      "company_name": "Saarbahn Netz GmbH",
      "company_seat": "Saarbrücken",
      "details": "14.02.2025 (Bekanntmachungsdatum)\n\nSaarland Amtsgericht Saarbrücken HRB 9731\nEinreichung neuer Dokumente\n\nSaarbahn Netz GmbH\nGesellschaft mit beschränkter Haftung\nSaarbrücken\n\nDie Geschäftsführung der Gesellschaft hat eine Liste der Mitglieder des Aufsichtsrats zum Handelsregister eingereicht (§ 52 Abs. 3 Satz 2 GmbHG)."
    },
    {
      "date": "2025-02-14",
      "id": "101332",
      "original_text": "Einreichung neuer Dokumente\nSaarland Amtsgericht Saarbrücken HRB 4837\nStadtwerke Saarbrücken GmbH – Saarbrücken",
      "type": "Einreichung neuer Dokumente",
      "state": "Saarland",
      "amtsgericht": "Amtsgericht Saarbrücken",
      "registernummer": "HRB 4837",
      "registerart": "HRB",
      "company_name": "Stadtwerke Saarbrücken GmbH",
      "company_seat": "Saarbrücken",
      "details": "14.02.2025 (Bekanntmachungsdatum)\n\nSaarland Amtsgericht Saarbrücken HRB 4837\nEinreichung neuer Dokumente\n\nStadtwerke Saarbrücken GmbH\nGesellschaft mit beschränkter Haftung\nSaarbrücken\n\nDie Geschäftsführung der Gesellschaft hat eine Liste der Mitglieder des Aufsichtsrats zum Handelsregister eingereicht (§ 52 Abs. 3 Satz 2 GmbHG)."
    },
    {
      "date": "2025-02-14",
      "id": "101333",
      "original_text": "Löschungsankündigung\nBerlin Amtsgericht Berlin (Charlottenburg) HRB 172820\nrentastic UG (haftungsbeschränkt) – Berlin",
      "type": "Löschungsankündigung",
      "state": "Berlin",
      "amtsgericht": "Amtsgericht Berlin (Charlottenburg)",
      "registernummer": "HRB 172820",
      "registerart": "HRB",
      "company_name": "rentastic UG (haftungsbeschränkt)",
      "company_seat": "Berlin",
      "details": "14.02.2025 (Bekanntmachungsdatum)\n\nBerlin Amtsgericht Berlin (Charlottenburg) HRB 172820\nLöschungsankündigung\n\nrentastic UG (haftungsbeschränkt)\nGesellschaft mit beschränkter Haftung\nBerlin\n\nBei der nachstehenden Gesellschaft wird das Amtslöschungsverfahren gemäß § 394 FamFG eingeleitet. Widerspruchsfrist 6 Wochen"
    },
    {
      "date": "2025-02-14",
      "id": "101334",
      "original_text": "Löschungsankündigung\nSchleswig-Holstein Amtsgericht Lübeck HRB 23057\nHenry Invest GmbH – Wentorf bei Hamburg",
      "type": "Löschungsankündigung",
      "state": "Schleswig-Holstein",
      "amtsgericht": "Amtsgericht Lübeck",
      "registernummer": "HRB 23057",
      "registerart": "HRB",
      "company_name": "Henry Invest GmbH",
      "company_seat": "Wentorf bei Hamburg",
      "details": "14.02.2025 (Bekanntmachungsdatum)\n\nSchleswig-Holstein Amtsgericht Lübeck HRB 23057\nLöschungsankündigung\n\nHenry Invest GmbH\nGesellschaft mit beschränkter Haftung\nWentorf bei Hamburg\n\nEs ist die Löschung der nachstehenden Gesellschaft wegen Vermögenslosigkeit gemäß § 394 FamFG beabsichtigt.\nWiderspruchsfrist: 1 Monat"
    },
    {
      "date": "2025-02-14",
      "id": "101335",
      "original_text": "Einreichung neuer Dokumente\nSaarland Amtsgericht Saarbrücken HRB 4262\nGesellschaft für Straßenbahnen im Saartal Aktiengesellschaft – Saarbrücken",
      "type": "Einreichung neuer Dokumente",
      "state": "Saarland",
      "amtsgericht": "Amtsgericht Saarbrücken",
      "registernummer": "HRB 4262",
      "registerart": "HRB",
      "company_name": "Gesellschaft für Straßenbahnen im Saartal Aktiengesellschaft",
      "company_seat": "Saarbrücken",
      "details": "14.02.2025 (Bekanntmachungsdatum)\n\nSaarland Amtsgericht Saarbrücken HRB 4262\nEinreichung neuer Dokumente\n\nGesellschaft für Straßenbahnen im Saartal Aktiengesellschaft\nAktiengesellschaft\nSaarbrücken\n\nDer Vorstand der Gesellschaft hat eine Liste der Mitglieder des Aufsichtsrats zum Handelsregister eingereicht (§ 106 AktG)."
    },
    {
      "date": "2025-02-14",
      "id": "101336",
      "original_text": "Sonstige Registerbekanntmachung\nBerlin Amtsgericht Berlin (Charlottenburg) HRB 146528\nUmber Solandra Property GmbH – Berlin",
      "type": "Sonstige Registerbekanntmachung",
      "state": "Berlin",
      "amtsgericht": "Amtsgericht Berlin (Charlottenburg)",
      "registernummer": "HRB 146528",
      "registerart": "HRB",
      "company_name": "Umber Solandra Property GmbH",
      "company_seat": "Berlin",
      "details": "14.02.2025 (Bekanntmachungsdatum)\n\nBerlin Amtsgericht Berlin (Charlottenburg) HRB 146528\nSonstige Registerbekanntmachung\n\nUmber Solandra Property GmbH\nGesellschaft mit beschränkter Haftung\nBerlin\n\nAls nicht eingetragen wird in Ergänzung zur Veröffentlichung vom 10.02.2025 veröffentlicht:\nRechtsform, Firma und Sitz der formwechselnden Gesellschaft: Die Gesellschaft ist eine deutsche Gesellschaft mit beschränkter Haftung unter der Firma Umber Solandra Property GmbH, errichtet und bestehend nach deutschem Recht, mit Sitz in Berlin, Deutschland, eingetragen im Handelsregister des Amtsgerichts Charlottenburg unter HRB 146528 B. Die Gesellschaft soll durch grenzüberschreitenden, identitätswahrenden Formwechsel aufgrund eines Form Wechselbeschlusses unter gleichzeitiger Verlegung des Satzungssitzes in eine Gesellschaft mit beschränkter Haftung nach dem Recht des Großherzogtums Luxemburg (société à responsabilité limitée) mit Sitz in Luxemburg, Großherzogtum Luxemburg, umgewandelt werden. Die Gesellschaft wird die Firma Umber Solandra Property S.à.r.l. führen."
    },
    {
      "date": "2025-02-14",
      "id": "101337",
      "original_text": "Löschungsankündigung\nBerlin Amtsgericht Berlin (Charlottenburg) HRB 78479\nL K G - GmbH Lüftung-Klima-Gebäudetechnik – Berlin",
      "type": "Löschungsankündigung",
      "state": "Berlin",
      "amtsgericht": "Amtsgericht Berlin (Charlottenburg)",
      "registernummer": "HRB 78479",
      "registerart": "HRB",
      "company_name": "L K G - GmbH Lüftung-Klima-Gebäudetechnik",
      "company_seat": "Berlin",
      "details": "14.02.2025 (Bekanntmachungsdatum)\n\nBerlin Amtsgericht Berlin (Charlottenburg) HRB 78479\nLöschungsankündigung\n\nL K G - GmbH Lüftung-Klima-Gebäudetechnik\nGesellschaft mit beschränkter Haftung\nBerlin\n\nBei der nachstehenden Gesellschaft wird das Amtslöschungsverfahren gemäß § 394 FamFG eingeleitet. Widerspruchsfrist 6 Wochen"
    },
    {
      "date": "2025-02-14",
      "id": "101338",
      "original_text": "Sonstige Registerbekanntmachung\nHamburg Amtsgericht Hamburg HRB 149252\nargonauten GmbH – Hamburg",
      "type": "Sonstige Registerbekanntmachung",
      "state": "Hamburg",
      "amtsgericht": "Amtsgericht Hamburg",
      "registernummer": "HRB 149252",
      "registerart": "HRB",
      "company_name": "argonauten GmbH",
      "company_seat": "Hamburg",
      "details": "14.02.2025 (Bekanntmachungsdatum)\n\nHamburg Amtsgericht Hamburg HRB 149252\nSonstige Registerbekanntmachung 13.02.2025 (Eintragungsdatum)\n\nargonauten GmbH\nGesellschaft mit beschränkter Haftung\nHamburg\n\nAls nicht eingetragen wird bekannt gemacht: Den Gläubigern der Gesellschaft, deren Forderungen begründet worden sind, bevor die Eintragung der Vertragsbeendigung in das Handelsregister nach § 10 HGB als bekannt gemacht gilt, ist vom anderen Vertragsteil Sicherheit zu leisten, wenn sie sich binnen 6 Monaten nach Bekanntmachung der Eintragung zu diesem Zweck bei ihm melden."
    },
    {
      "date": "2025-02-14",
      "id": "101339",
      "original_text": "Registerbekanntmachung nach dem Umwandlungsgesetz\nSchleswig-Holstein Amtsgericht Pinneberg HRB 15352\nTechnology Center Holding GmbH – Heide",
      "type": "Registerbekanntmachung nach dem Umwandlungsgesetz",
      "state": "Schleswig-Holstein",
      "amtsgericht": "Amtsgericht Pinneberg",
      "registernummer": "HRB 15352",
      "registerart": "HRB",
      "company_name": "Technology Center Holding GmbH",
      "company_seat": "Heide",
      "details": "14.02.2025 (Bekanntmachungsdatum)\n\nSchleswig-Holstein Amtsgericht Pinneberg HRB 15352\nRegisterbekanntmachung nach dem Umwandlungsgesetz 03.02.2025 (Eintragungsdatum)\n\nTechnology Center Holding GmbH\nGesellschaft mit beschränkter Haftung\nHeide\n\nZu Eintragungsnummer 4 vom 03.02.2025 wird als nicht eingetragen veröffentlicht: Den Gläubigern der an der Verschmelzung beteiligten Rechtsträger ist, wenn sie binnen sechs Monaten nach dem Tag, an dem die Eintragung der Verschmelzung in das Register des Sitzes desjenigen Rechtsträgers, dessen Gläubiger sie sind, als bekannt gemacht gilt, ihren Anspruch nach Grund und Höhe schriftlich anmelden, Sicherheit zu leisten, soweit sie nicht Befriedigung verlangen können. Dieses Recht steht den Gläubigern jedoch nur zu, wenn sie glaubhaft machen, dass durch die Verschmelzung die Erfüllung ihrer Forderung gefährdet wird. Das Recht, Sicherheitsleistung zu verlangen, steht Gläubigern nicht zu, die im Falle der Insolvenz ein Recht auf vorzugsweise Befriedigung aus einer Deckungsmasse haben, die nach gesetzlicher Vorschrift zu ihrem Schutz errichtet und staatlich überwacht ist."
    },
    {
      "date": "2025-02-14",
      "id": "101340",
      "original_text": "Registerbekanntmachung nach dem Umwandlungsgesetz\nSchleswig-Holstein Amtsgericht Pinneberg HRB 15352\nTechnology Center Holding GmbH – Heide",
      "type": "Registerbekanntmachung nach dem Umwandlungsgesetz",
      "state": "Schleswig-Holstein",
      "amtsgericht": "Amtsgericht Pinneberg",
      "registernummer": "HRB 15352",
      "registerart": "HRB",
      "company_name": "Technology Center Holding GmbH",
      "company_seat": "Heide",
      "details": "14.02.2025 (Bekanntmachungsdatum)\n\nSchleswig-Holstein Amtsgericht Pinneberg HRB 15352\nRegisterbekanntmachung nach dem Umwandlungsgesetz 13.02.2025 (Eintragungsdatum)\n\nTechnology Center Holding GmbH\nGesellschaft mit beschränkter Haftung\nHeide\n\nZu Eintragungsnummer 5 vom 13.02.2025 wird als nicht eingetragen veröffentlicht: Den Gläubigern der an der Verschmelzung beteiligten Rechtsträger ist, wenn sie binnen sechs Monaten nach dem Tag, an dem die Eintragung der Verschmelzung in das Register des Sitzes desjenigen Rechtsträgers, dessen Gläubiger sie sind, als bekannt gemacht gilt, ihren Anspruch nach Grund und Höhe schriftlich anmelden, Sicherheit zu leisten, soweit sie nicht Befriedigung verlangen können. Dieses Recht steht den Gläubigern jedoch nur zu, wenn sie glaubhaft machen, dass durch die Verschmelzung die Erfüllung ihrer Forderung gefährdet wird. Das Recht, Sicherheitsleistung zu verlangen, steht Gläubigern nicht zu, die im Falle der Insolvenz ein Recht auf vorzugsweise Befriedigung aus einer Deckungsmasse haben, die nach gesetzlicher Vorschrift zu ihrem Schutz errichtet und staatlich überwacht ist."
    },
    {
      "date": "2025-02-14",
      "id": "101341",
      "original_text": "Einreichung neuer Dokumente\nSachsen-Anhalt Amtsgericht Stendal HRB 105250\nHalberstadtwerke GmbH – Halberstadt",
      "type": "Einreichung neuer Dokumente",
      "state": "Sachsen-Anhalt",
      "amtsgericht": "Amtsgericht Stendal",
      "registernummer": "HRB 105250",
      "registerart": "HRB",
      "company_name": "Halberstadtwerke GmbH",
      "company_seat": "Halberstadt",
      "details": "14.02.2025 (Bekanntmachungsdatum)\n\nSachsen-Anhalt Amtsgericht Stendal HRB 105250\nEinreichung neuer Dokumente\n\nHalberstadtwerke GmbH\nGesellschaft mit beschränkter Haftung\nHalberstadt\n\nEine Liste der Mitglieder des Aufsichtsrates wurde zum Handelsregister eingereicht."
    },
    {
      "date": "2025-02-14",
      "id": "101342",
      "original_text": "Sonstige Registerbekanntmachung\nBerlin Amtsgericht Berlin (Charlottenburg) HRB 866\nFUNKE Medien Berlin GmbH – Berlin",
      "type": "Sonstige Registerbekanntmachung",
      "state": "Berlin",
      "amtsgericht": "Amtsgericht Berlin (Charlottenburg)",
      "registernummer": "HRB 866",
      "registerart": "HRB",
      "company_name": "FUNKE Medien Berlin GmbH",
      "company_seat": "Berlin",
      "details": "14.02.2025 (Bekanntmachungsdatum)\n\nBerlin Amtsgericht Berlin (Charlottenburg) HRB 866\nSonstige Registerbekanntmachung 14.02.2025 (Eintragungsdatum)\n\nFUNKE Medien Berlin GmbH\nGesellschaft mit beschränkter Haftung\nBerlin\n\nAls nicht eingetragen wird veröffentlicht: Der andere Vertragsteil hat den Gläubigern dieses Rechtsträgers, deren Forderungen begründet worden sind, bevor die Eintragung der Beendigung dieses Vertrages in das Handelsregister nach § 10 des Handelsgesetzbuches als bekannt gemacht gilt, Sicherheit zu leisten, wenn sie sich binnen sechs Monaten nach der Bekanntmachung der Eintragung zu diesem Zweck bei ihm melden. Dieses Recht steht den Gläubigern nicht zu, die im Fall des Insolvenzverfahrens ein Recht auf vorzugsweise Befriedigung aus der Deckungsmasse haben, die nach gesetzlicher Vorschrift zu ihrem Schutz errichtet und staatlich überwacht ist."
    },
    {
      "date": "2025-02-14",
      "id": "101343",
      "original_text": "Registerbekanntmachung nach dem Umwandlungsgesetz\nBerlin Amtsgericht Berlin (Charlottenburg) HRB 257356\nAltamira Agency UG (haftungsbeschränkt) – Berlin",
      "type": "Registerbekanntmachung nach dem Umwandlungsgesetz",
      "state": "Berlin",
      "amtsgericht": "Amtsgericht Berlin (Charlottenburg)",
      "registernummer": "HRB 257356",
      "registerart": "HRB",
      "company_name": "Altamira Agency UG (haftungsbeschränkt)",
      "company_seat": "Berlin",
      "details": "14.02.2025 (Bekanntmachungsdatum)\n\nBerlin Amtsgericht Berlin (Charlottenburg) HRB 257356\nRegisterbekanntmachung nach dem Umwandlungsgesetz 11.02.2025 (Eintragungsdatum)\n\nAltamira Agency UG (haftungsbeschränkt)\nGesellschaft mit beschränkter Haftung\nBerlin\n\nZu Eintragungsnummer 2 vom 11.02.2025 wird als nicht eingetragen veröffentlicht: Den Gläubigern der an der Verschmelzung beteiligten Rechtsträger ist, wenn sie binnen sechs Monaten nach dem Tag, an dem die Eintragung der Verschmelzung in das Register des Sitzes desjenigen Rechtsträgers, dessen Gläubiger sie sind, als bekannt gemacht gilt, ihren Anspruch nach Grund und Höhe schriftlich anmelden, Sicherheit zu leisten, soweit sie nicht Befriedigung verlangen können. Dieses Recht steht den Gläubigern jedoch nur zu, wenn sie glaubhaft machen, dass durch die Verschmelzung die Erfüllung ihrer Forderung gefährdet wird. Das Recht, Sicherheitsleistung zu verlangen, steht Gläubigern nicht zu, die im Falle der Insolvenz ein Recht auf vorzugsweise Befriedigung aus einer Deckungsmasse haben, die nach gesetzlicher Vorschrift zu ihrem Schutz errichtet und staatlich überwacht ist."
    },
    {
      "date": "2025-02-14",
      "id": "101344",
      "original_text": "Sonstige Registerbekanntmachung\nHamburg Amtsgericht Hamburg HRB 75818\nDHL Solutions GmbH – Hamburg",
      "type": "Sonstige Registerbekanntmachung",
      "state": "Hamburg",
      "amtsgericht": "Amtsgericht Hamburg",
      "registernummer": "HRB 75818",
      "registerart": "HRB",
      "company_name": "DHL Solutions GmbH",
      "company_seat": "Hamburg",
      "details": "14.02.2025 (Bekanntmachungsdatum)\n\nHamburg Amtsgericht Hamburg HRB 75818\nSonstige Registerbekanntmachung 14.02.2025 (Eintragungsdatum)\n\nDHL Solutions GmbH\nGesellschaft mit beschränkter Haftung\nHamburg\n\nAls nicht eingetragen wird bekannt gemacht:  Den Gläubigern der Gesellschaft, deren Forderungen begründet worden sind, bevor die Eintragung der Vertragsbeendigung in das Handelsregister nach § 10 HGB als bekannt gemacht gilt, ist vom anderen Vertragsteil Sicherheit zu leisten, wenn sie sich binnen 6 Monaten nach Bekanntmachung der Eintragung zu diesem Zweck bei ihm melden."
    },
    {
      "date": "2025-02-14",
      "id": "101345",
      "original_text": "Einreichung neuer Dokumente\nBerlin Amtsgericht Berlin (Charlottenburg) HRB 182671\nELEMENT Insurance AG – Berlin",
      "type": "Einreichung neuer Dokumente",
      "state": "Berlin",
      "amtsgericht": "Amtsgericht Berlin (Charlottenburg)",
      "registernummer": "HRB 182671",
      "registerart": "HRB",
      "company_name": "ELEMENT Insurance AG",
      "company_seat": "Berlin",
      "details": "14.02.2025 (Bekanntmachungsdatum)\n\nBerlin Amtsgericht Berlin (Charlottenburg) HRB 182671\nEinreichung neuer Dokumente\n\nELEMENT Insurance AG\nAktiengesellschaft\nBerlin\n\nAls nicht eingetragen wird veröffentlicht: Es wurde eine neue Liste der Aufsichtsratsmitglieder eingereicht (§ 106 AktG)."
    },
    {
      "date": "2025-02-14",
      "id": "101346",
      "original_text": "Einreichung neuer Dokumente\nMecklenburg-Vorpommern Amtsgericht Stralsund HRB 22659\nTierpark Greifswald gGmbH – Greifswald",
      "type": "Einreichung neuer Dokumente",
      "state": "Mecklenburg-Vorpommern",
      "amtsgericht": "Amtsgericht Stralsund",
      "registernummer": "HRB 22659",
      "registerart": "HRB",
      "company_name": "Tierpark Greifswald gGmbH",
      "company_seat": "Greifswald",
      "details": "14.02.2025 (Bekanntmachungsdatum)\n\nMecklenburg-Vorpommern Amtsgericht Stralsund HRB 22659\nEinreichung neuer Dokumente\n\nTierpark Greifswald gGmbH\nGesellschaft mit beschränkter Haftung\nGreifswald\n\nEine Liste der Mitglieder des Aufsichtsrats ist zum Handelsregister eingereicht worden."
    },
    {
      "date": "2025-02-14",
      "id": "101347",
      "original_text": "Registerbekanntmachung nach dem Umwandlungsgesetz\nBerlin Amtsgericht Berlin (Charlottenburg) HRB 103576\nEuropean IT Consultancy EITCO GmbH – Berlin",
      "type": "Registerbekanntmachung nach dem Umwandlungsgesetz",
      "state": "Berlin",
      "amtsgericht": "Amtsgericht Berlin (Charlottenburg)",
      "registernummer": "HRB 103576",
      "registerart": "HRB",
      "company_name": "European IT Consultancy EITCO GmbH",
      "company_seat": "Berlin",
      "details": "14.02.2025 (Bekanntmachungsdatum)\n\nBerlin Amtsgericht Berlin (Charlottenburg) HRB 103576\nRegisterbekanntmachung nach dem Umwandlungsgesetz 14.02.2025 (Eintragungsdatum)\n\nEuropean IT Consultancy EITCO GmbH\nGesellschaft mit beschränkter Haftung\nBerlin\n\nZu Eintragungsnummer 19 vom 14.02.2025 wird als nicht eingetragen veröffentlicht: Den Gläubigern der an der Verschmelzung beteiligten Rechtsträger ist, wenn sie binnen sechs Monaten nach dem Tag, an dem die Eintragung der Verschmelzung in das Register des Sitzes desjenigen Rechtsträgers, dessen Gläubiger sie sind, als bekannt gemacht gilt, ihren Anspruch nach Grund und Höhe schriftlich anmelden, Sicherheit zu leisten, soweit sie nicht Befriedigung verlangen können. Dieses Recht steht den Gläubigern jedoch nur zu, wenn sie glaubhaft machen, dass durch die Verschmelzung die Erfüllung ihrer Forderung gefährdet wird. Das Recht, Sicherheitsleistung zu verlangen, steht Gläubigern nicht zu, die im Falle der Insolvenz ein Recht auf vorzugsweise Befriedigung aus einer Deckungsmasse haben, die nach gesetzlicher Vorschrift zu ihrem Schutz errichtet und staatlich überwacht ist."
    },
    {
      "date": "2025-02-14",
      "id": "101348",
      "original_text": "Einreichung neuer Dokumente\nThüringen Amtsgericht Jena HRB 301968\nIlmenauer Wärmeversorgung GmbH – Ilmenau",
      "type": "Einreichung neuer Dokumente",
      "state": "Thüringen",
      "amtsgericht": "Amtsgericht Jena",
      "registernummer": "HRB 301968",
      "registerart": "HRB",
      "company_name": "Ilmenauer Wärmeversorgung GmbH",
      "company_seat": "Ilmenau",
      "details": "14.02.2025 (Bekanntmachungsdatum)\n\nThüringen Amtsgericht Jena HRB 301968\nEinreichung neuer Dokumente\n\nIlmenauer Wärmeversorgung GmbH\nGesellschaft mit beschränkter Haftung\nIlmenau\n\nBekanntmachung gem. § 52 Abs. 3 Satz 2 GmbHG: Aufgrund einer Veränderung in den Personen der Aufsichtsratsmitglieder ist durch die Geschäftsführer eine neue Liste zum Handelsregister eingereicht worden."
    },
    {
      "date": "2025-02-14",
      "id": "101349",
      "original_text": "Registerbekanntmachung nach dem Umwandlungsgesetz\nThüringen Amtsgericht Jena HRB 511728\nVN Connect GmbH – Saalfeld/Saale",
      "type": "Registerbekanntmachung nach dem Umwandlungsgesetz",
      "state": "Thüringen",
      "amtsgericht": "Amtsgericht Jena",
      "registernummer": "HRB 511728",
      "registerart": "HRB",
      "company_name": "VN Connect GmbH",
      "company_seat": "Saalfeld/Saale",
      "details": "14.02.2025 (Bekanntmachungsdatum)\n\nThüringen Amtsgericht Jena HRB 511728\nRegisterbekanntmachung nach dem Umwandlungsgesetz 14.02.2025 (Eintragungsdatum)\n\nVN Connect GmbH\nGesellschaft mit beschränkter Haftung\nSaalfeld/Saale\n\nNicht eingetragen: Den Gläubigern der an der Verschmelzung beteiligten Rechtsträger, ist wenn sie binnen sechs Monaten nach dem Tag, an dem die Eintragung der Verschmelzung in das Register des Sitzes desjenigen Rechtsträgers, dessen Gläubiger sie sind,  nach § 19 Abs. 3 UmwG als bekanntgemacht gilt, ihren Anspruch nach Grund und Höhe schriftlich anmelden, Sicherheit zu leisten, soweit sie nicht Befriedigung verlangen können. Dieses Recht steht ihnen jedoch nur zu, wenn sie glaubhaft machen, daß durch die Verschmelzung die Erfüllung ihrer Forderung gefährdet wird."
    },
    {
      "date": "2025-02-14",
      "id": "101350",
      "original_text": "Registerbekanntmachung nach dem Umwandlungsgesetz\nThüringen Amtsgericht Jena HRB 504662\nconteQ GmbH – Saalfeld/Saale",
      "type": "Registerbekanntmachung nach dem Umwandlungsgesetz",
      "state": "Thüringen",
      "amtsgericht": "Amtsgericht Jena",
      "registernummer": "HRB 504662",
      "registerart": "HRB",
      "company_name": "conteQ GmbH",
      "company_seat": "Saalfeld/Saale",
      "details": "14.02.2025 (Bekanntmachungsdatum)\n\nThüringen Amtsgericht Jena HRB 504662\nRegisterbekanntmachung nach dem Umwandlungsgesetz 14.02.2025 (Eintragungsdatum)\n\nconteQ GmbH\nGesellschaft mit beschränkter Haftung\nSaalfeld/Saale\n\nNicht eingetragen: Den Gläubigern der an der Verschmelzung beteiligten Rechtsträger, ist wenn sie binnen sechs Monaten nach dem Tag, an dem die Eintragung der Verschmelzung in das Register des Sitzes desjenigen Rechtsträgers, dessen Gläubiger sie sind,  nach § 19 Abs. 3 UmwG als bekanntgemacht gilt, ihren Anspruch nach Grund und Höhe schriftlich anmelden, Sicherheit zu leisten, soweit sie nicht Befriedigung verlangen können. Dieses Recht steht ihnen jedoch nur zu, wenn sie glaubhaft machen, daß durch die Verschmelzung die Erfüllung ihrer Forderung gefährdet wird."
    },
    {
      "date": "2025-02-14",
      "id": "101351",
      "original_text": "Löschungsankündigung\nThüringen Amtsgericht Jena HRB 504379\nRen-ON UG (haftungsbeschränkt) – Löbichau",
      "type": "Löschungsankündigung",
      "state": "Thüringen",
      "amtsgericht": "Amtsgericht Jena",
      "registernummer": "HRB 504379",
      "registerart": "HRB",
      "company_name": "Ren-ON UG (haftungsbeschränkt)",
      "company_seat": "Löbichau",
      "details": "14.02.2025 (Bekanntmachungsdatum)\n\nThüringen Amtsgericht Jena HRB 504379\nLöschungsankündigung\n\nRen-ON UG (haftungsbeschränkt)\nGesellschaft mit beschränkter Haftung\nLöbichau\n\nDas Registergericht beabsichtigt, die im Handelsregister eingetragene Gesellschaft wegen Vermögenslosigkeit nach § 394 FamFG von Amts wegen zu löschen. Die Frist zur Erhebung eines Widerspruchs gegen die beabsichtigte Löschung wird auf 6 Wochen festgesetzt."
    },
    {
      "date": "2025-02-14",
      "id": "101352",
      "original_text": "Löschungsankündigung\nBerlin Amtsgericht Berlin (Charlottenburg) HRB 211124\nI.X. Transport GmbH – Berlin",
      "type": "Löschungsankündigung",
      "state": "Berlin",
      "amtsgericht": "Amtsgericht Berlin (Charlottenburg)",
      "registernummer": "HRB 211124",
      "registerart": "HRB",
      "company_name": "I.X. Transport GmbH",
      "company_seat": "Berlin",
      "details": "14.02.2025 (Bekanntmachungsdatum)\n\nBerlin Amtsgericht Berlin (Charlottenburg) HRB 211124\nLöschungsankündigung\n\nI.X. Transport GmbH\nGesellschaft mit beschränkter Haftung\nBerlin\n\nBei der nachstehenden Gesellschaft wird das Amtslöschungsverfahren gemäß § 394 FamFG eingeleitet. Widerspruchsfrist 6 Wochen"
    },
    {
      "date": "2025-02-14",
      "id": "101353",
      "original_text": "Löschungsankündigung\nBerlin Amtsgericht Berlin (Charlottenburg) HRB 183400\nFNC Darius GmbH – Berlin",
      "type": "Löschungsankündigung",
      "state": "Berlin",
      "amtsgericht": "Amtsgericht Berlin (Charlottenburg)",
      "registernummer": "HRB 183400",
      "registerart": "HRB",
      "company_name": "FNC Darius GmbH",
      "company_seat": "Berlin",
      "details": "14.02.2025 (Bekanntmachungsdatum)\n\nBerlin Amtsgericht Berlin (Charlottenburg) HRB 183400\nLöschungsankündigung\n\nFNC Darius GmbH\nGesellschaft mit beschränkter Haftung\nBerlin\n\nBei der nachstehenden Gesellschaft wird das Amtslöschungsverfahren gemäß § 394 FamFG eingeleitet. Widerspruchsfrist 6 Wochen"
    },
    {
      "date": "2025-02-14",
      "id": "101354",
      "original_text": "Löschungsankündigung\nHamburg Amtsgericht Hamburg HRA 124139\nRE:concept Venture GmbH & Co. KG – Hamburg",
      "type": "Löschungsankündigung",
      "state": "Hamburg",
      "amtsgericht": "Amtsgericht Hamburg",
      "registernummer": "HRA 124139",
      "registerart": "HRA",
      "company_name": "RE:concept Venture GmbH & Co. KG",
      "company_seat": "Hamburg",
      "details": "14.02.2025 (Bekanntmachungsdatum)\n\nHamburg Amtsgericht Hamburg HRA 124139\nLöschungsankündigung\n\nRE:concept Venture GmbH & Co. KG\nKommanditgesellschaft\nHamburg\n\nDas Registergericht beabsichtigt, die im Handelsregister eingetragene Firma von Amts wegen nach § 394 Abs. 4 FamFG zu löschen. Die Frist zur Erhebung eines Widerspruchs gegen die beabsichtigte Löschung wird auf 3 Monate festgesetzt."
    },
    {
      "date": "2025-02-14",
      "id": "101355",
      "original_text": "Registerbekanntmachung nach dem Umwandlungsgesetz\nBaden-Württemberg Amtsgericht Mannheim HRB 753592\nReinschmidt und Nagel GmbH – Stutensee",
      "type": "Registerbekanntmachung nach dem Umwandlungsgesetz",
      "state": "Baden-Württemberg",
      "amtsgericht": "Amtsgericht Mannheim",
      "registernummer": "HRB 753592",
      "registerart": "HRB",
      "company_name": "Reinschmidt und Nagel GmbH",
      "company_seat": "Stutensee",
      "details": "14.02.2025 (Bekanntmachungsdatum)\n\nBaden-Württemberg Amtsgericht Mannheim HRB 753592\nRegisterbekanntmachung nach dem Umwandlungsgesetz 14.02.2025 (Eintragungsdatum)\n\nReinschmidt und Nagel GmbH\nGesellschaft mit beschränkter Haftung\nStutensee\n\nAls nicht eingetragen wird bekanntgemacht:\nDen Gläubigern des an dem Formwechsel beteiligten Rechtsträgers ist, wenn sie binnen sechs Monaten nach dem Tag, an dem die Eintragung des Formwechsels in das Register des Sitzes desjenigen Rechtsträgers, dessen Gläubiger sie sind, nach § 19 Abs. 3 UmwG als bekanntgemacht gilt, ihren Anspruch nach Grund und Höhe schriftlich anmelden, Sicherheit zu leisten, soweit sie nicht Befriedigung verlangen können. Dieses Recht steht den Gläubigern jedoch nur zu, wenn sie glaubhaft machen, dass durch den Formwechsel die Erfüllung ihrer Forderung gefährdet wird."
    },
    {
      "date": "2025-02-14",
      "id": "101356",
      "original_text": "Registerbekanntmachung nach dem Umwandlungsgesetz\nBaden-Württemberg Amtsgericht Mannheim HRB 711251\nRvH GmbH – Baden-Baden",
      "type": "Registerbekanntmachung nach dem Umwandlungsgesetz",
      "state": "Baden-Württemberg",
      "amtsgericht": "Amtsgericht Mannheim",
      "registernummer": "HRB 711251",
      "registerart": "HRB",
      "company_name": "RvH GmbH",
      "company_seat": "Baden-Baden",
      "details": "14.02.2025 (Bekanntmachungsdatum)\n\nBaden-Württemberg Amtsgericht Mannheim HRB 711251\nRegisterbekanntmachung nach dem Umwandlungsgesetz 14.02.2025 (Eintragungsdatum)\n\nRvH GmbH\nGesellschaft mit beschränkter Haftung\nBaden-Baden\n\nAls nicht eingetragen wird bekanntgemacht:\nDen Gläubigern der an der Verschmelzung beteiligten Rechtsträger ist, wenn sie binnen sechs Monaten nach dem Tag, an dem die Eintragung der Verschmelzung in das Register des Sitzes desjenigen Rechtsträgers, dessen Gläubiger sie sind, nach § 19 Abs. 3 UmwG als bekanntgemacht gilt, ihren Anspruch nach Grund und Höhe schriftlich anmelden, Sicherheit zu leisten, soweit sie nicht Befriedigung verlangen können. Dieses Recht steht den Gläubigern jedoch nur zu, wenn sie glaubhaft machen, dass durch die Verschmelzung die Erfüllung ihrer Forderung gefährdet wird."
    },
    {
      "date": "2025-02-14",
      "id": "101357",
      "original_text": "Registerbekanntmachung nach dem Umwandlungsgesetz\nBaden-Württemberg Amtsgericht Mannheim HRB 110242\nWeltevreden GmbH – Baden-Baden",
      "type": "Registerbekanntmachung nach dem Umwandlungsgesetz",
      "state": "Baden-Württemberg",
      "amtsgericht": "Amtsgericht Mannheim",
      "registernummer": "HRB 110242",
      "registerart": "HRB",
      "company_name": "Weltevreden GmbH",
      "company_seat": "Baden-Baden",
      "details": "14.02.2025 (Bekanntmachungsdatum)\n\nBaden-Württemberg Amtsgericht Mannheim HRB 110242\nRegisterbekanntmachung nach dem Umwandlungsgesetz 14.02.2025 (Eintragungsdatum)\n\nWeltevreden GmbH\nGesellschaft mit beschränkter Haftung\nBaden-Baden\n\nDen Gläubigern der an der Verschmelzung beteiligten Rechtsträger ist, wenn sie binnen sechs Monaten nach dem Tag, an dem die Eintragung der Verschmelzung in das Register des Sitzes desjenigen Rechtsträgers, dessen Gläubiger sie sind, nach § 19 Abs. 3 UmwG als bekanntgemacht gilt, ihren Anspruch nach Grund und Höhe schriftlich anmelden, Sicherheit zu leisten, soweit sie nicht Befriedigung verlangen können. Dieses Recht steht den Gläubigern jedoch nur zu, wenn sie glaubhaft machen, dass durch die Verschmelzung die Erfüllung ihrer Forderung gefährdet wird."
    },
    {
      "date": "2025-02-14",
      "id": "101358",
      "original_text": "Einreichung neuer Dokumente\nBaden-Württemberg Amtsgericht Mannheim HRB 504365\nDITABIS Digital Biomedical Imaging Systems AG – Pforzheim",
      "type": "Einreichung neuer Dokumente",
      "state": "Baden-Württemberg",
      "amtsgericht": "Amtsgericht Mannheim",
      "registernummer": "HRB 504365",
      "registerart": "HRB",
      "company_name": "DITABIS Digital Biomedical Imaging Systems AG",
      "company_seat": "Pforzheim",
      "details": "14.02.2025 (Bekanntmachungsdatum)\n\nBaden-Württemberg Amtsgericht Mannheim HRB 504365\nEinreichung neuer Dokumente 14.02.2025 (Eintragungsdatum)\n\nDITABIS Digital Biomedical Imaging Systems AG\nAktiengesellschaft\nPforzheim\n\nDie Gesellschaft hat am 22.01.2025 die Liste über die Zusammensetzung des Aufsichtsrats zum Handelsregister eingereicht."
    },
    {
      "date": "2025-02-14",
      "id": "101359",
      "original_text": "Löschungsankündigung\nBaden-Württemberg Amtsgericht Stuttgart HRB 109191\nWäschereimaschinen Abwicklungsgesellschaft mbH – Heilbronn",
      "type": "Löschungsankündigung",
      "state": "Baden-Württemberg",
      "amtsgericht": "Amtsgericht Stuttgart",
      "registernummer": "HRB 109191",
      "registerart": "HRB",
      "company_name": "Wäschereimaschinen Abwicklungsgesellschaft mbH",
      "company_seat": "Heilbronn",
      "details": "14.02.2025 (Bekanntmachungsdatum)\n\nBaden-Württemberg Amtsgericht Stuttgart HRB 109191\nLöschungsankündigung\n\nWäschereimaschinen Abwicklungsgesellschaft mbH\nGesellschaft mit beschränkter Haftung\nHeilbronn\n\nAls nicht eingetragen wird bekanntgemacht:Das Gericht beabsichtigt, die Gesellschaft wegen Vermögenslosigkeit im Handelsregister von Amts wegen nach § 394 FamFG zu löschen. Die Frist zur Geltendmachung eines Widerspruchs gegen die beabsichtigte Löschung ist auf zwei Monate ab Veröffentlichung bestimmt."
    },
    {
      "date": "2025-02-14",
      "id": "101360",
      "original_text": "Einreichung neuer Dokumente\nBaden-Württemberg Amtsgericht Stuttgart HRB 19360\nMercedes-Benz Group AG – Stuttgart",
      "type": "Einreichung neuer Dokumente",
      "state": "Baden-Württemberg",
      "amtsgericht": "Amtsgericht Stuttgart",
      "registernummer": "HRB 19360",
      "registerart": "HRB",
      "company_name": "Mercedes-Benz Group AG",
      "company_seat": "Stuttgart",
      "details": "14.02.2025 (Bekanntmachungsdatum)\n\nBaden-Württemberg Amtsgericht Stuttgart HRB 19360\nEinreichung neuer Dokumente\n\nMercedes-Benz Group AG\nAktiengesellschaft\nStuttgart\n\nDie Gesellschaft hat am 11.02.2025 die Liste über die Zusammensetzung des Aufsichtsrats zum Handelsregister eingereicht."
    },
    {
      "date": "2025-02-14",
      "id": "101361",
      "original_text": "Einreichung neuer Dokumente\nBaden-Württemberg Amtsgericht Mannheim HRB 231723\nEnergie- und Wasserversorgung Bruchsal GmbH – Bruchsal",
      "type": "Einreichung neuer Dokumente",
      "state": "Baden-Württemberg",
      "amtsgericht": "Amtsgericht Mannheim",
      "registernummer": "HRB 231723",
      "registerart": "HRB",
      "company_name": "Energie- und Wasserversorgung Bruchsal GmbH",
      "company_seat": "Bruchsal",
      "details": "14.02.2025 (Bekanntmachungsdatum)\n\nBaden-Württemberg Amtsgericht Mannheim HRB 231723\nEinreichung neuer Dokumente\n\nEnergie- und Wasserversorgung Bruchsal GmbH\nGesellschaft mit beschränkter Haftung\nBruchsal\n\nDie Gesellschaft hat am 04.02.2025 die Liste über die Zusammensetzung des Aufsichtsrats zum Handelsregister eingereicht."
    },
    {
      "date": "2025-02-14",
      "id": "101362",
      "original_text": "Registerbekanntmachung nach dem Umwandlungsgesetz\nBaden-Württemberg Amtsgericht Mannheim GsR 657\nReinschmidt und Nagel eGbR – Stutensee",
      "type": "Registerbekanntmachung nach dem Umwandlungsgesetz",
      "state": "Baden-Württemberg",
      "amtsgericht": "Amtsgericht Mannheim",
      "registernummer": "GsR 657",
      "registerart": "GsR",
      "company_name": "Reinschmidt und Nagel eGbR",
      "company_seat": "Stutensee",
      "details": "14.02.2025 (Bekanntmachungsdatum)\n\nBaden-Württemberg Amtsgericht Mannheim GsR 657\nRegisterbekanntmachung nach dem Umwandlungsgesetz 14.02.2025 (Eintragungsdatum)\n\nReinschmidt und Nagel eGbR\nGesellschaft bürgerlichen Rechts\nStutensee\n\nAls nicht eingetragen wird bekanntgemacht:\nDen Gläubigern des an dem Formwechsel beteiligten Rechtsträgers ist, wenn sie binnen sechs Monaten nach dem Tag, an dem die Eintragung des Formwechsels in das Register des Sitzes desjenigen Rechtsträgers, dessen Gläubiger sie sind, nach § 19 Abs. 3 UmwG als bekanntgemacht gilt, ihren Anspruch nach Grund und Höhe schriftlich anmelden, Sicherheit zu leisten, soweit sie nicht Befriedigung verlangen können. Dieses Recht steht den Gläubigern jedoch nur zu, wenn sie glaubhaft machen, dass durch den Formwechsel die Erfüllung ihrer Forderung gefährdet wird."
    },
    {
      "date": "2025-02-14",
      "id": "101363",
      "original_text": "Löschungsankündigung\nBaden-Württemberg Amtsgericht Mannheim HRB 731345\nDampferspoint Vapestore GmbH – Wiesloch",
      "type": "Löschungsankündigung",
      "state": "Baden-Württemberg",
      "amtsgericht": "Amtsgericht Mannheim",
      "registernummer": "HRB 731345",
      "registerart": "HRB",
      "company_name": "Dampferspoint Vapestore GmbH",
      "company_seat": "Wiesloch",
      "details": "14.02.2025 (Bekanntmachungsdatum)\n\nBaden-Württemberg Amtsgericht Mannheim HRB 731345\nLöschungsankündigung\n\nDampferspoint Vapestore GmbH\nGesellschaft mit beschränkter Haftung\nWiesloch\n\nDas Gericht beabsichtigt, die Gesellschaft wegen Vermögenslosigkeit im Handelsregister von Amts wegen nach § 394 FamFG zu löschen. Die Frist zur Geltendmachung eines Widerspruchs gegen die beabsichtigte Löschung ist auf einen Monat ab Veröffentlichung bestimmt."
    },
    {
      "date": "2025-02-14",
      "id": "101364",
      "original_text": "Einreichung neuer Dokumente\nBaden-Württemberg Amtsgericht Mannheim HRB 504365\nDITABIS Digital Biomedical Imaging Systems AG – Pforzheim",
      "type": "Einreichung neuer Dokumente",
      "state": "Baden-Württemberg",
      "amtsgericht": "Amtsgericht Mannheim",
      "registernummer": "HRB 504365",
      "registerart": "HRB",
      "company_name": "DITABIS Digital Biomedical Imaging Systems AG",
      "company_seat": "Pforzheim",
      "details": "14.02.2025 (Bekanntmachungsdatum)\n\nBaden-Württemberg Amtsgericht Mannheim HRB 504365\nEinreichung neuer Dokumente 14.02.2025 (Eintragungsdatum)\n\nDITABIS Digital Biomedical Imaging Systems AG\nAktiengesellschaft\nPforzheim\n\nDie Gesellschaft hat am 22.01.2025 die Liste über die Zusammensetzung des Aufsichtsrats zum Handelsregister eingereicht."
    },
    {
      "date": "2025-02-14",
      "id": "101365",
      "original_text": "Löschungsankündigung\nBaden-Württemberg Amtsgericht Stuttgart HRA 222289\nGrundstücksgesellschaft R. + H. Wurster GmbH & Co. KG – Filderstadt",
      "type": "Löschungsankündigung",
      "state": "Baden-Württemberg",
      "amtsgericht": "Amtsgericht Stuttgart",
      "registernummer": "HRA 222289",
      "registerart": "HRA",
      "company_name": "Grundstücksgesellschaft R. + H. Wurster GmbH & Co. KG",
      "company_seat": "Filderstadt",
      "details": "14.02.2025 (Bekanntmachungsdatum)\n\nBaden-Württemberg Amtsgericht Stuttgart HRA 222289\nLöschungsankündigung\n\nGrundstücksgesellschaft R. + H. Wurster GmbH & Co. KG\nKommanditgesellschaft\nFilderstadt\n\nAls nicht eingetragen wird bekanntgemacht:\nDas Gericht beabsichtigt, die Gesellschaft wegen Vermögenslosigkeit im Handelsregister von Amts wegen nach § 394 FamFG zu löschen. Die Frist zur Geltendmachung eines Widerspruchs gegen die beabsichtigte Löschung ist auf zwei Monate ab Veröffentlichung bestimmt."
    },
    {
      "date": "2025-02-14",
      "id": "101366",
      "original_text": "Registerbekanntmachung nach dem Umwandlungsgesetz\nBaden-Württemberg Amtsgericht Ulm HRB 501138\nGunnebo Safe Storage Solutions GmbH – Aalen",
      "type": "Registerbekanntmachung nach dem Umwandlungsgesetz",
      "state": "Baden-Württemberg",
      "amtsgericht": "Amtsgericht Ulm",
      "registernummer": "HRB 501138",
      "registerart": "HRB",
      "company_name": "Gunnebo Safe Storage Solutions GmbH",
      "company_seat": "Aalen",
      "details": "14.02.2025 (Bekanntmachungsdatum)\n\nBaden-Württemberg Amtsgericht Ulm HRB 501138\nRegisterbekanntmachung nach dem Umwandlungsgesetz 14.02.2025 (Eintragungsdatum)\n\nGunnebo Safe Storage Solutions GmbH\nGesellschaft mit beschränkter Haftung\nAalen\n\nAls nicht eingetragen wird bekanntgemacht:\nDen Gläubigern der an der Verschmelzung beteiligten Rechtsträger ist, wenn sie binnen sechs Monaten nach dem Tag, an dem die Eintragung der Verschmelzung in das Register des Sitzes desjenigen Rechtsträgers, dessen Gläubiger sie sind, nach § 19 Abs. 3 UmwG als bekanntgemacht gilt, ihren Anspruch nach Grund und Höhe schriftlich anmelden, Sicherheit zu leisten, soweit sie nicht Befriedigung verlangen können. Dieses Recht steht den Gläubigern jedoch nur zu, wenn sie glaubhaft machen, dass durch die Verschmelzung die Erfüllung ihrer Forderung gefährdet wird."
    },
    {
      "date": "2025-02-14",
      "id": "101367",
      "original_text": "Löschungsankündigung\nBaden-Württemberg Amtsgericht Stuttgart HRB 765188\nMTD Sales Stuttgart GmbH – Stuttgart",
      "type": "Löschungsankündigung",
      "state": "Baden-Württemberg",
      "amtsgericht": "Amtsgericht Stuttgart",
      "registernummer": "HRB 765188",
      "registerart": "HRB",
      "company_name": "MTD Sales Stuttgart GmbH",
      "company_seat": "Stuttgart",
      "details": "14.02.2025 (Bekanntmachungsdatum)\n\nBaden-Württemberg Amtsgericht Stuttgart HRB 765188\nLöschungsankündigung\n\nMTD Sales Stuttgart GmbH\nGesellschaft mit beschränkter Haftung\nStuttgart\n\nAls nicht eingetragen wird bekanntgemacht:\nDas Gericht beabsichtigt, die Gesellschaft wegen Vermögenslosigkeit im Handelsregister von Amts wegen nach § 394 FamFG zu löschen. Die Frist zur Geltendmachung eines Widerspruchs gegen die beabsichtigte Löschung ist auf zwei Monate ab Veröffentlichung bestimmt."
    },
    {
      "date": "2025-02-14",
      "id": "101368",
      "original_text": "Löschungsankündigung\nBaden-Württemberg Amtsgericht Mannheim HRB 742054\nATRUM Bauelemente UG (haftungsbeschränkt) – Mannheim",
      "type": "Löschungsankündigung",
      "state": "Baden-Württemberg",
      "amtsgericht": "Amtsgericht Mannheim",
      "registernummer": "HRB 742054",
      "registerart": "HRB",
      "company_name": "ATRUM Bauelemente UG (haftungsbeschränkt)",
      "company_seat": "Mannheim",
      "details": "14.02.2025 (Bekanntmachungsdatum)\n\nBaden-Württemberg Amtsgericht Mannheim HRB 742054\nLöschungsankündigung\n\nATRUM Bauelemente UG (haftungsbeschränkt)\nGesellschaft mit beschränkter Haftung\nMannheim\n\nDas Gericht beabsichtigt, die Gesellschaft wegen Vermögenslosigkeit im Handelsregister von Amts wegen nach § 394 FamFG zu löschen. Die Frist zur Geltendmachung eines Widerspruchs gegen die beabsichtigte Löschung ist auf einen Monat ab Veröffentlichung bestimmt."
    },
    {
      "date": "2025-02-14",
      "id": "101369",
      "original_text": "Löschungsankündigung\nBaden-Württemberg Amtsgericht Mannheim HRB 717754\nAT Technology Consulting UG (haftungsbeschränkt) – Heidelberg",
      "type": "Löschungsankündigung",
      "state": "Baden-Württemberg",
      "amtsgericht": "Amtsgericht Mannheim",
      "registernummer": "HRB 717754",
      "registerart": "HRB",
      "company_name": "AT Technology Consulting UG (haftungsbeschränkt)",
      "company_seat": "Heidelberg",
      "details": "14.02.2025 (Bekanntmachungsdatum)\n\nBaden-Württemberg Amtsgericht Mannheim HRB 717754\nLöschungsankündigung\n\nAT Technology Consulting UG (haftungsbeschränkt)\nGesellschaft mit beschränkter Haftung\nHeidelberg\n\nDas Gericht beabsichtigt, die Gesellschaft wegen Vermögenslosigkeit im Handelsregister von Amts wegen nach § 394 FamFG zu löschen. Die Frist zur Geltendmachung eines Widerspruchs gegen die beabsichtigte Löschung ist auf einen Monat ab Veröffentlichung bestimmt."
    },
    {
      "date": "2025-02-14",
      "id": "101370",
      "original_text": "Löschungsankündigung\nBaden-Württemberg Amtsgericht Stuttgart HRB 752027\nJ + J Flights UG (haftungsbeschränkt) – Stuttgart",
      "type": "Löschungsankündigung",
      "state": "Baden-Württemberg",
      "amtsgericht": "Amtsgericht Stuttgart",
      "registernummer": "HRB 752027",
      "registerart": "HRB",
      "company_name": "J + J Flights UG (haftungsbeschränkt)",
      "company_seat": "Stuttgart",
      "details": "14.02.2025 (Bekanntmachungsdatum)\n\nBaden-Württemberg Amtsgericht Stuttgart HRB 752027\nLöschungsankündigung\n\nJ + J Flights UG (haftungsbeschränkt)\nGesellschaft mit beschränkter Haftung\nStuttgart\n\nDas Gericht beabsichtigt, die Gesellschaft wegen Vermögenslosigkeit im Handelsregister von Amts wegen nach § 394 FamFG zu löschen. Die Frist zur Geltendmachung eines Widerspruchs gegen die beabsichtigte Löschung ist auf zwei Monate ab Veröffentlichung bestimmt."
    },
    {
      "date": "2025-02-14",
      "id": "101371",
      "original_text": "Einreichung neuer Dokumente\nBaden-Württemberg Amtsgericht Ulm HRB 720891\nReischmann GmbH & Co. KGaA – Ravensburg",
      "type": "Einreichung neuer Dokumente",
      "state": "Baden-Württemberg",
      "amtsgericht": "Amtsgericht Ulm",
      "registernummer": "HRB 720891",
      "registerart": "HRB",
      "company_name": "Reischmann GmbH & Co. KGaA",
      "company_seat": "Ravensburg",
      "details": "14.02.2025 (Bekanntmachungsdatum)\n\nBaden-Württemberg Amtsgericht Ulm HRB 720891\nEinreichung neuer Dokumente 14.02.2025 (Eintragungsdatum)\n\nReischmann GmbH & Co. KGaA\nKommanditgesellschaft auf Aktien\nRavensburg\n\nDie Gesellschaft hat am 13.02.2025 die Liste über die Zusammensetzung des Aufsichtsrats zum Handelsregister eingereicht."
    },
    {
      "date": "2025-02-14",
      "id": "101372",
      "original_text": "Löschungsankündigung\nBaden-Württemberg Amtsgericht Stuttgart HRB 205990\nSoma-tech Teilefertigung GmbH – Freiberg am Neckar",
      "type": "Löschungsankündigung",
      "state": "Baden-Württemberg",
      "amtsgericht": "Amtsgericht Stuttgart",
      "registernummer": "HRB 205990",
      "registerart": "HRB",
      "company_name": "Soma-tech Teilefertigung GmbH",
      "company_seat": "Freiberg am Neckar",
      "details": "14.02.2025 (Bekanntmachungsdatum)\n\nBaden-Württemberg Amtsgericht Stuttgart HRB 205990\nLöschungsankündigung\n\nSoma-tech Teilefertigung GmbH\nGesellschaft mit beschränkter Haftung\nFreiberg am Neckar\n\nAls nicht eingetragen wird bekanntgemacht:\nDas Gericht beabsichtigt, die Gesellschaft wegen Vermögenslosigkeit im Handelsregister von Amts wegen nach § 394 FamFG zu löschen. Die Frist zur Geltendmachung eines Widerspruchs gegen die beabsichtigte Löschung ist auf zwei Monate ab Veröffentlichung bestimmt."
    },
    {
      "date": "2025-02-14",
      "id": "101373",
      "original_text": "Einreichung neuer Dokumente\nBaden-Württemberg Amtsgericht Stuttgart HRB 570105\nBausparkasse Schwäbisch Hall Aktiengesellschaft - Bausparkasse der Volksbanken und Raiffeisenbanken - – Schwäbisch Hall",
      "type": "Einreichung neuer Dokumente",
      "state": "Baden-Württemberg",
      "amtsgericht": "Amtsgericht Stuttgart",
      "registernummer": "HRB 570105",
      "registerart": "HRB",
      "company_name": "Bausparkasse Schwäbisch Hall Aktiengesellschaft - Bausparkasse der Volksbanken und Raiffeisenbanken -",
      "company_seat": "Schwäbisch Hall",
      "details": "14.02.2025 (Bekanntmachungsdatum)\n\nBaden-Württemberg Amtsgericht Stuttgart HRB 570105\nEinreichung neuer Dokumente\n\nBausparkasse Schwäbisch Hall Aktiengesellschaft - Bausparkasse der Volksbanken und Raiffeisenbanken -\nAktiengesellschaft\nSchwäbisch Hall\n\nDie Gesellschaft hat am 13.02.2025 die Liste über die Zusammensetzung des Aufsichtsrats zum Handelsregister eingereicht."
    },
    {
      "date": "2025-02-14",
      "id": "101374",
      "original_text": "Einreichung neuer Dokumente\nBerlin Amtsgericht Berlin (Charlottenburg) HRB 190322\nDeutsche Wohnen SE – Berlin",
      "type": "Einreichung neuer Dokumente",
      "state": "Berlin",
      "amtsgericht": "Amtsgericht Berlin (Charlottenburg)",
      "registernummer": "HRB 190322",
      "registerart": "HRB",
      "company_name": "Deutsche Wohnen SE",
      "company_seat": "Berlin",
      "details": "14.02.2025 (Bekanntmachungsdatum)\n\nBerlin Amtsgericht Berlin (Charlottenburg) HRB 190322\nEinreichung neuer Dokumente\n\nDeutsche Wohnen SE\nEuropäische Aktiengesellschaft (SE)\nBerlin\n\nAls nicht eingetragen wird veröffentlicht: Es wurde eine neue Liste der Aufsichtsratsmitglieder eingereicht (§ 106 AktG)."
    },
    {
      "date": "2025-02-14",
      "id": "101375",
      "original_text": "Löschungsankündigung\nBerlin Amtsgericht Berlin (Charlottenburg) HRB 253426\nSideline Ventures UG (haftungsbeschränkt) – Berlin",
      "type": "Löschungsankündigung",
      "state": "Berlin",
      "amtsgericht": "Amtsgericht Berlin (Charlottenburg)",
      "registernummer": "HRB 253426",
      "registerart": "HRB",
      "company_name": "Sideline Ventures UG (haftungsbeschränkt)",
      "company_seat": "Berlin",
      "details": "14.02.2025 (Bekanntmachungsdatum)\n\nBerlin Amtsgericht Berlin (Charlottenburg) HRB 253426\nLöschungsankündigung\n\nSideline Ventures UG (haftungsbeschränkt)\nGesellschaft mit beschränkter Haftung\nBerlin\n\nBei der nachstehenden Gesellschaft wird das Amtslöschungsverfahren gemäß § 394 FamFG eingeleitet. Widerspruchsfrist: 6 Wochen."
    },
    {
      "date": "2025-02-14",
      "id": "101376",
      "original_text": "Einreichung neuer Dokumente\nSachsen Amtsgericht Chemnitz HRB 14246\nGesellschaft für soziale Betreuung Bona Vita gGmbH – Limbach-Oberfrohna",
      "type": "Einreichung neuer Dokumente",
      "state": "Sachsen",
      "amtsgericht": "Amtsgericht Chemnitz",
      "registernummer": "HRB 14246",
      "registerart": "HRB",
      "company_name": "Gesellschaft für soziale Betreuung Bona Vita gGmbH",
      "company_seat": "Limbach-Oberfrohna",
      "details": "14.02.2025 (Bekanntmachungsdatum)\n\nSachsen Amtsgericht Chemnitz HRB 14246\nEinreichung neuer Dokumente\n\nGesellschaft für soziale Betreuung Bona Vita gGmbH\nGesellschaft mit beschränkter Haftung\nLimbach-Oberfrohna\n\nAm 14.02.2025 wurde beim Handelsregister des Amtsgerichts Chemnitz die Liste der Mitglieder des Aufsichtsrats gemäß § 52 GmbHG eingereicht."
    },
    {
      "date": "2025-02-14",
      "id": "101377",
      "original_text": "Löschungsankündigung\nNiedersachsen Amtsgericht Hannover VR 202768\nROCK YOUR LIFE! Hannover e. V. – Hannover",
      "type": "Löschungsankündigung",
      "state": "Niedersachsen",
      "amtsgericht": "Amtsgericht Hannover",
      "registernummer": "VR 202768",
      "registerart": "VR",
      "company_name": "ROCK YOUR LIFE! Hannover e. V.",
      "company_seat": "Hannover",
      "details": "14.02.2025 (Bekanntmachungsdatum)\n\nNiedersachsen Amtsgericht Hannover VR 202768\nLöschungsankündigung\n\nROCK YOUR LIFE! Hannover e. V.\neingetragener Verein\nHannover\n\nDas Registergericht beabsichtigt, den Verein von Amts wegen auf Grund Wegfalls sämtlicher Mitglieder von Amts wegen zu löschen. Die Frist zur Erhebung eines Widerspruchs ist auf 1 Monat ab dieser Registerbekanntmachung festgesetzt."
    },
    {
      "date": "2025-02-14",
      "id": "101378",
      "original_text": "Löschungsankündigung\nNiedersachsen Amtsgericht Oldenburg (Oldenburg) HRB 207795\nVerwaltung MS \"Berta\" GmbH – Nordenham",
      "type": "Löschungsankündigung",
      "state": "Niedersachsen",
      "amtsgericht": "Amtsgericht Oldenburg (Oldenburg)",
      "registernummer": "HRB 207795",
      "registerart": "HRB",
      "company_name": "Verwaltung MS \"Berta\" GmbH",
      "company_seat": "Nordenham",
      "details": "14.02.2025 (Bekanntmachungsdatum)\n\nNiedersachsen Amtsgericht Oldenburg (Oldenburg) HRB 207795\nLöschungsankündigung\n\nVerwaltung MS \"Berta\" GmbH\nGesellschaft mit beschränkter Haftung\nNordenham\n\nDas Registergericht beabsichtigt, die Gesellschaft von Amts wegen nach § 394 FamFG zu löschen. Die Frist zur Erhebung eines Widerspruchs ist auf 1 Monat ab dieser Registerbekanntmachung festgesetzt."
    },
    {
      "date": "2025-02-14",
      "id": "101379",
      "original_text": "Löschungsankündigung\nNiedersachsen Amtsgericht Tostedt HRB 210038\nRoterm GmbH – Geestland",
      "type": "Löschungsankündigung",
      "state": "Niedersachsen",
      "amtsgericht": "Amtsgericht Tostedt",
      "registernummer": "HRB 210038",
      "registerart": "HRB",
      "company_name": "Roterm GmbH",
      "company_seat": "Geestland",
      "details": "14.02.2025 (Bekanntmachungsdatum)\n\nNiedersachsen Amtsgericht Tostedt HRB 210038\nLöschungsankündigung\n\nRoterm GmbH\nGesellschaft mit beschränkter Haftung\nGeestland\n\nDas Registergericht beabsichtigt, die Gesellschaft von Amts wegen nach § 394 FamFG zu löschen. Die Frist zur Erhebung eines Widerspruchs ist auf 1 Monat ab dieser Registerbekanntmachung festgesetzt."
    },
    {
      "date": "2025-02-14",
      "id": "101380",
      "original_text": "Registerbekanntmachung nach dem Umwandlungsgesetz\nNiedersachsen Amtsgericht Tostedt HRB 120674 früher Amtsgericht Buxtehude\npluss Personalmanagement Buxtehude GmbH – Buxtehude",
      "type": "Registerbekanntmachung nach dem Umwandlungsgesetz",
      "state": "Niedersachsen",
      "amtsgericht": "Amtsgericht Tostedt",
      "registernummer": "HRB 120674",
      "registerart": "HRB",
      "company_name": "pluss Personalmanagement Buxtehude GmbH",
      "company_seat": "Buxtehude",
      "former_amtsgericht": "Buxtehude",
      "details": "14.02.2025 (Bekanntmachungsdatum)\n\nNiedersachsen Amtsgericht Tostedt HRB 120674 früher Amtsgericht Buxtehude\nRegisterbekanntmachung nach dem Umwandlungsgesetz 14.02.2025 (Eintragungsdatum)\n\npluss Personalmanagement Buxtehude GmbH\nGesellschaft mit beschränkter Haftung\nBuxtehude\n\nDen Gläubigern der an der Aufspaltung beteiligten Rechtsträger ist, wenn sie binnen sechs Monaten nach dem Tag, an dem die Eintragung der Aufspaltung in das Register des Sitzes desjenigen Rechtsträgers, dessen Gläubiger sie sind, nach § 19 Abs. 3 UmwG als bekannt gemacht gilt, ihren Anspruch nach Grund und Höhe schriftlich anmelden, Sicherheit zu leisten, soweit sie nicht Befriedigung verlangen können. Dieses Recht steht den Gläubigern jedoch nur zu, wenn sie glaubhaft machen, dass durch die Aufspaltung die Erfüllung der Forderung gefährdet wird."
    },
    {
      "date": "2025-02-14",
      "id": "101381",
      "original_text": "Löschungsankündigung\nNiedersachsen Amtsgericht Braunschweig HRB 205658\nBrötchenblitz UG (haftungsbeschränkt) – Königslutter am Elm",
      "type": "Löschungsankündigung",
      "state": "Niedersachsen",
      "amtsgericht": "Amtsgericht Braunschweig",
      "registernummer": "HRB 205658",
      "registerart": "HRB",
      "company_name": "Brötchenblitz UG (haftungsbeschränkt)",
      "company_seat": "Königslutter am Elm",
      "details": "14.02.2025 (Bekanntmachungsdatum)\n\nNiedersachsen Amtsgericht Braunschweig HRB 205658\nLöschungsankündigung 14.02.2025 (Eintragungsdatum)\n\nBrötchenblitz UG (haftungsbeschränkt)\nGesellschaft mit beschränkter Haftung\nKönigslutter am Elm\n\nDas Registergericht beabsichtigt, die Gesellschaft von Amts wegen nach § 394 FamFG zu löschen. Die Frist zur Erhebung eines Widerspruchs ist auf 1 Monat ab dieser Registerbekanntmachung festgesetzt."
    },
    {
      "date": "2025-02-14",
      "id": "101382",
      "original_text": "Registerbekanntmachung nach dem Umwandlungsgesetz\nNiedersachsen Amtsgericht Hannover HRB 228468\nZafon TopCo GmbH – Neustadt am Rübenberge",
      "type": "Registerbekanntmachung nach dem Umwandlungsgesetz",
      "state": "Niedersachsen",
      "amtsgericht": "Amtsgericht Hannover",
      "registernummer": "HRB 228468",
      "registerart": "HRB",
      "company_name": "Zafon TopCo GmbH",
      "company_seat": "Neustadt am Rübenberge",
      "details": "14.02.2025 (Bekanntmachungsdatum)\n\nNiedersachsen Amtsgericht Hannover HRB 228468\nRegisterbekanntmachung nach dem Umwandlungsgesetz 14.02.2025 (Eintragungsdatum)\n\nZafon TopCo GmbH\nGesellschaft mit beschränkter Haftung\nNeustadt am Rübenberge\n\nDen Gläubigern der an dem grenzüberschreitenden Formwechsel beteiligten Rechtsträgern ist, wenn sie binnen sechs Monaten nach dem Tag, an dem die Eintragung der Verschmelzung in das Register des Sitzes desjenigen Rechtsträgers, dessen Gläubiger sie sind, nach § 19 Absatz 3 UmwG als bekanntgemacht gilt, ihren Anspruch nach Grund und Höhe schriftlich anmelden, Sicherheit zu leisten, soweit sie nicht Befriedigung verlangen können.\n\nDieses Recht steht den Gläubigern jedoch nur zu, wenn sie glaubhaft machen, dass durch den Formwechsel die Erfüllung ihrer Forderung gefährdet wird."
    },
    {
      "date": "2025-02-14",
      "id": "101383",
      "original_text": "Sonstige Registerbekanntmachung\nNiedersachsen Amtsgericht Hannover HRB 223796\nzoo.de shopping community AG – Hannover",
      "type": "Sonstige Registerbekanntmachung",
      "state": "Niedersachsen",
      "amtsgericht": "Amtsgericht Hannover",
      "registernummer": "HRB 223796",
      "registerart": "HRB",
      "company_name": "zoo.de shopping community AG",
      "company_seat": "Hannover",
      "details": "14.02.2025 (Bekanntmachungsdatum)\n\nNiedersachsen Amtsgericht Hannover HRB 223796\nSonstige Registerbekanntmachung\n\nzoo.de shopping community AG\nAktiengesellschaft\nHannover\n\nDie Liste der Mitglieder des Aufsichtsrats wurde beim Registergericht eingereicht."
    },
    {
      "date": "2025-02-14",
      "id": "101384",
      "original_text": "Einreichung neuer Dokumente\nNiedersachsen Amtsgericht Osnabrück HRB 210095\nBernard Krone SE – Spelle",
      "type": "Einreichung neuer Dokumente",
      "state": "Niedersachsen",
      "amtsgericht": "Amtsgericht Osnabrück",
      "registernummer": "HRB 210095",
      "registerart": "HRB",
      "company_name": "Bernard Krone SE",
      "company_seat": "Spelle",
      "details": "14.02.2025 (Bekanntmachungsdatum)\n\nNiedersachsen Amtsgericht Osnabrück HRB 210095\nEinreichung neuer Dokumente\n\nBernard Krone SE\nEuropäische Aktiengesellschaft (SE)\nSpelle\n\nDie Liste der Mitglieder des Aufsichtsrats wurde beim Registergericht eingereicht."
    },
    {
      "date": "2025-02-14",
      "id": "101385",
      "original_text": "Löschungsankündigung\nRheinland-Pfalz Amtsgericht Wittlich HRB 43571\nBL Financial Solutions GmbH – Sehlem",
      "type": "Löschungsankündigung",
      "state": "Rheinland-Pfalz",
      "amtsgericht": "Amtsgericht Wittlich",
      "registernummer": "HRB 43571",
      "registerart": "HRB",
      "company_name": "BL Financial Solutions GmbH",
      "company_seat": "Sehlem",
      "details": "14.02.2025 (Bekanntmachungsdatum)\n\nRheinland-Pfalz Amtsgericht Wittlich HRB 43571\nLöschungsankündigung 14.02.2025 (Eintragungsdatum)\n\nBL Financial Solutions GmbH\nGesellschaft mit beschränkter Haftung\nSehlem\n\nDas Registergericht beabsichtigt die Gesellschaft von Amts wegen nach § 394 FamFG zu löschen. Die Frist zur Erhebung eines Widerspruchs ist auf einen Monat festgesetzt."
    },
    {
      "date": "2025-02-14",
      "id": "101386",
      "original_text": "Löschungsankündigung\nRheinland-Pfalz Amtsgericht Kaiserslautern HRB 32953\nSSP Consulting Unternehmensberatungsgesellschaft mbH – Kaiserslautern",
      "type": "Löschungsankündigung",
      "state": "Rheinland-Pfalz",
      "amtsgericht": "Amtsgericht Kaiserslautern",
      "registernummer": "HRB 32953",
      "registerart": "HRB",
      "company_name": "SSP Consulting Unternehmensberatungsgesellschaft mbH",
      "company_seat": "Kaiserslautern",
      "details": "14.02.2025 (Bekanntmachungsdatum)\n\nRheinland-Pfalz Amtsgericht Kaiserslautern HRB 32953\nLöschungsankündigung\n\nSSP Consulting Unternehmensberatungsgesellschaft mbH\nGesellschaft mit beschränkter Haftung\nKaiserslautern\n\nDas Registergericht beabsichtigt die Gesellschaft von Amts wegen nach § 394 FamFG wegen Vermögenslosigkeit zu löschen. Widerspruch gegen die Löschung kann nur binnen 3 Monaten ab Veröffentlichung dieser Verfügung eingelegt werden."
    },
    {
      "date": "2025-02-14",
      "id": "101387",
      "original_text": "Löschungsankündigung\nRheinland-Pfalz Amtsgericht Kaiserslautern HRB 32763\nFruchttal UG (haftungsbeschränkt) – Kaiserslautern",
      "type": "Löschungsankündigung",
      "state": "Rheinland-Pfalz",
      "amtsgericht": "Amtsgericht Kaiserslautern",
      "registernummer": "HRB 32763",
      "registerart": "HRB",
      "company_name": "Fruchttal UG (haftungsbeschränkt)",
      "company_seat": "Kaiserslautern",
      "details": "14.02.2025 (Bekanntmachungsdatum)\n\nRheinland-Pfalz Amtsgericht Kaiserslautern HRB 32763\nLöschungsankündigung\n\nFruchttal UG (haftungsbeschränkt)\nGesellschaft mit beschränkter Haftung\nKaiserslautern\n\nDas Registergericht beabsichtigt die Gesellschaft von Amts wegen nach § 394 FamFG wegen Vermögenslosigkeit zu löschen. Widerspruch gegen die Löschung kann nur binnen 3 Monaten ab Veröffentlichung dieser Verfügung eingelegt werden."
    },
    {
      "date": "2025-02-14",
      "id": "101388",
      "original_text": "Sonstige Registerbekanntmachung\nRheinland-Pfalz Amtsgericht Kaiserslautern HRB 31763\nPFAFF Industriesysteme und Maschinen GmbH – Kaiserslautern",
      "type": "Sonstige Registerbekanntmachung",
      "state": "Rheinland-Pfalz",
      "amtsgericht": "Amtsgericht Kaiserslautern",
      "registernummer": "HRB 31763",
      "registerart": "HRB",
      "company_name": "PFAFF Industriesysteme und Maschinen GmbH",
      "company_seat": "Kaiserslautern",
      "details": "14.02.2025 (Bekanntmachungsdatum)\n\nRheinland-Pfalz Amtsgericht Kaiserslautern HRB 31763\nSonstige Registerbekanntmachung 14.02.2025 (Eintragungsdatum)\n\nPFAFF Industriesysteme und Maschinen GmbH\nGesellschaft mit beschränkter Haftung\nKaiserslautern\n\nAls nicht eingetragen wird veröffentlicht: Den Gläubigern der Gesellschaft, deren Forderungen begründet worden sind, bevor die Eintragung der Beendigung des Gewinnabführungsvertrages in das Handelsregister nach § 10 des Handelsgesetzbuches als bekanntgemacht gilt, hat der andere Vertragsteil Sicherheit zu leisten, wenn sie sich binnen sechs Monaten nach der Bekanntmachung der Eintragung zu diesem Zweck bei ihm melden."
    },
    {
      "date": "2025-02-14",
      "id": "101389",
      "original_text": "Löschungsankündigung\nRheinland-Pfalz Amtsgericht Mainz HRB 43150\nQSS Obtain & Organize GmbH – Oppenheim",
      "type": "Löschungsankündigung",
      "state": "Rheinland-Pfalz",
      "amtsgericht": "Amtsgericht Mainz",
      "registernummer": "HRB 43150",
      "registerart": "HRB",
      "company_name": "QSS Obtain & Organize GmbH",
      "company_seat": "Oppenheim",
      "details": "14.02.2025 (Bekanntmachungsdatum)\n\nRheinland-Pfalz Amtsgericht Mainz HRB 43150\nLöschungsankündigung\n\nQSS Obtain & Organize GmbH\nGesellschaft mit beschränkter Haftung\nOppenheim\n\nDas Registergericht beabsichtigt die Gesellschaft von Amts wegen nach § 394 FamFG zu löschen. Die Frist zur Erhebung eines Widerspruchs ist auf einen Monat festgesetzt."
    },
    {
      "date": "2025-02-14",
      "id": "101390",
      "original_text": "Einreichung neuer Dokumente\nNordrhein-Westfalen Amtsgericht Bochum HRB 9145 früher Amtsgericht Herne\nEKOCity GmbH – Herne",
      "type": "Einreichung neuer Dokumente",
      "state": "Nordrhein-Westfalen",
      "amtsgericht": "Amtsgericht Bochum",
      "registernummer": "HRB 9145",
      "registerart": "HRB",
      "company_name": "EKOCity GmbH",
      "company_seat": "Herne",
      "former_amtsgericht": "Herne",
      "details": "14.02.2025 (Bekanntmachungsdatum)\n\nNordrhein-Westfalen Amtsgericht Bochum HRB 9145 früher Amtsgericht Herne\nEinreichung neuer Dokumente 13.02.2025 (Eintragungsdatum)\n\nEKOCity GmbH\nGesellschaft mit beschränkter Haftung\nHerne\n\nDem Registergericht ist eine neue Liste der Mitglieder des Aufsichtsrates eingereicht worden."
    },
    {
      "date": "2025-02-14",
      "id": "101391",
      "original_text": "Löschungsankündigung\nNordrhein-Westfalen Amtsgericht Köln HRA 27303\nPEG Projektentwicklungsgesellschaft Aachen GmbH + Co. KG – Köln",
      "type": "Löschungsankündigung",
      "state": "Nordrhein-Westfalen",
      "amtsgericht": "Amtsgericht Köln",
      "registernummer": "HRA 27303",
      "registerart": "HRA",
      "company_name": "PEG Projektentwicklungsgesellschaft Aachen GmbH + Co. KG",
      "company_seat": "Köln",
      "details": "14.02.2025 (Bekanntmachungsdatum)\n\nNordrhein-Westfalen Amtsgericht Köln HRA 27303\nLöschungsankündigung\n\nPEG Projektentwicklungsgesellschaft Aachen GmbH + Co. KG\nKommanditgesellschaft\nKöln\n\nDas Registergericht beabsichtigt die Firma von Amts wegen nach § 394 FamFG zu löschen. Die Frist zur Erhebung eines Widerspruchs ist auf einen Monat festgesetzt."
    },
    {
      "date": "2025-02-14",
      "id": "101392",
      "original_text": "Sonstige Registerbekanntmachung\nNordrhein-Westfalen Amtsgericht Düsseldorf HRB 12073\nÖRAG Rechtsschutzversicherungs-Aktiengesellschaft – Düsseldorf",
      "type": "Sonstige Registerbekanntmachung",
      "state": "Nordrhein-Westfalen",
      "amtsgericht": "Amtsgericht Düsseldorf",
      "registernummer": "HRB 12073",
      "registerart": "HRB",
      "company_name": "ÖRAG Rechtsschutzversicherungs-Aktiengesellschaft",
      "company_seat": "Düsseldorf",
      "details": "14.02.2025 (Bekanntmachungsdatum)\n\nNordrhein-Westfalen Amtsgericht Düsseldorf HRB 12073\nSonstige Registerbekanntmachung\n\nÖRAG Rechtsschutzversicherungs-Aktiengesellschaft\nAktiengesellschaft\nDüsseldorf\n\nDem Registergericht ist eine Liste der Mitglieder des Aufsichtsrates eingereicht worden."
    },
    {
      "date": "2025-02-14",
      "id": "101393",
      "original_text": "Einreichung neuer Dokumente\nNordrhein-Westfalen Amtsgericht Siegburg HRB 7025\nIHC Industrie Handels Center Siebengebirge AG – Königswinter",
      "type": "Einreichung neuer Dokumente",
      "state": "Nordrhein-Westfalen",
      "amtsgericht": "Amtsgericht Siegburg",
      "registernummer": "HRB 7025",
      "registerart": "HRB",
      "company_name": "IHC Industrie Handels Center Siebengebirge AG",
      "company_seat": "Königswinter",
      "details": "14.02.2025 (Bekanntmachungsdatum)\n\nNordrhein-Westfalen Amtsgericht Siegburg HRB 7025\nEinreichung neuer Dokumente\n\nIHC Industrie Handels Center Siebengebirge AG\nAktiengesellschaft\nKönigswinter\n\nDem Registergericht ist eine neue Liste der Mitglieder des Aufsichtsrates eingereicht worden."
    },
    {
      "date": "2025-02-14",
      "id": "101394",
      "original_text": "Löschungsankündigung\nNordrhein-Westfalen Amtsgericht Dortmund HRB 33042\nS&N Konstrukt Bau GmbH – Dortmund",
      "type": "Löschungsankündigung",
      "state": "Nordrhein-Westfalen",
      "amtsgericht": "Amtsgericht Dortmund",
      "registernummer": "HRB 33042",
      "registerart": "HRB",
      "company_name": "S&N Konstrukt Bau GmbH",
      "company_seat": "Dortmund",
      "details": "14.02.2025 (Bekanntmachungsdatum)\n\nNordrhein-Westfalen Amtsgericht Dortmund HRB 33042\nLöschungsankündigung 14.02.2025 (Eintragungsdatum)\n\nS&N Konstrukt Bau GmbH\nGesellschaft mit beschränkter Haftung\nDortmund\n\nDas Registergericht beabsichtigt die Gesellschaft von Amts wegen nach § 394 FamFG zu löschen. Die Frist zur Erhebung eines Widerspruchs ist auf zwei Monate festgesetzt."
    },
    {
      "date": "2025-02-14",
      "id": "101395",
      "original_text": "Registerbekanntmachung nach dem Umwandlungsgesetz\nNordrhein-Westfalen Amtsgericht Hamm HRB 11745\nVillbusch GmbH – Hamm",
      "type": "Registerbekanntmachung nach dem Umwandlungsgesetz",
      "state": "Nordrhein-Westfalen",
      "amtsgericht": "Amtsgericht Hamm",
      "registernummer": "HRB 11745",
      "registerart": "HRB",
      "company_name": "Villbusch GmbH",
      "company_seat": "Hamm",
      "details": "14.02.2025 (Bekanntmachungsdatum)\n\nNordrhein-Westfalen Amtsgericht Hamm HRB 11745\nRegisterbekanntmachung nach dem Umwandlungsgesetz 11.02.2025 (Eintragungsdatum)\n\nVillbusch GmbH\nGesellschaft mit beschränkter Haftung\nHamm\n\nDen Gläubigern der an der Ausgliederung beteiligten Rechtsträger ist, wenn sie binnen sechs Monaten nach dem Tag, an dem die Eintragung der Ausgliederung in das Register des Sitzes derjenigen Rechtsträger deren Gläubiger sie sind, nach § 19 Absatz 3 UmwG als bekanntgemacht gilt, ihren Anspruch nach Grund und Höhe schriftlich anmelden, Sicherheit zu leisten, soweit sie nicht Befriedigung verlangen können. Dieses Recht steht den Gläubigern jedoch nur zu, wenn sie glaubhaft machen, dass durch die Ausgliederung die Erfüllung ihrer Forderung gefährdet wird."
    },
    {
      "date": "2025-02-14",
      "id": "101396",
      "original_text": "Löschungsankündigung\nNordrhein-Westfalen Amtsgericht Dortmund HRB 13952\nD. Wilhelm Verwaltungs-GmbH – Dortmund",
      "type": "Löschungsankündigung",
      "state": "Nordrhein-Westfalen",
      "amtsgericht": "Amtsgericht Dortmund",
      "registernummer": "HRB 13952",
      "registerart": "HRB",
      "company_name": "D. Wilhelm Verwaltungs-GmbH",
      "company_seat": "Dortmund",
      "details": "14.02.2025 (Bekanntmachungsdatum)\n\nNordrhein-Westfalen Amtsgericht Dortmund HRB 13952\nLöschungsankündigung 14.02.2025 (Eintragungsdatum)\n\nD. Wilhelm Verwaltungs-GmbH\nGesellschaft mit beschränkter Haftung\nDortmund\n\nDas Registergericht beabsichtigt die Gesellschaft von Amts wegen nach § 394 FamFG zu löschen. Die Frist zur Erhebung eines Widerspruchs ist auf zwei Monate festgesetzt."
    },
    {
      "date": "2025-02-14",
      "id": "101397",
      "original_text": "Registerbekanntmachung nach dem Umwandlungsgesetz\nNordrhein-Westfalen Amtsgericht Kleve HRB 13627\nAPTIS GmbH – Kalkar",
      "type": "Registerbekanntmachung nach dem Umwandlungsgesetz",
      "state": "Nordrhein-Westfalen",
      "amtsgericht": "Amtsgericht Kleve",
      "registernummer": "HRB 13627",
      "registerart": "HRB",
      "company_name": "APTIS GmbH",
      "company_seat": "Kalkar",
      "details": "14.02.2025 (Bekanntmachungsdatum)\n\nNordrhein-Westfalen Amtsgericht Kleve HRB 13627\nRegisterbekanntmachung nach dem Umwandlungsgesetz 14.02.2025 (Eintragungsdatum)\n\nAPTIS GmbH\nGesellschaft mit beschränkter Haftung\nKalkar\n\nDen Gläubigern der an der formwechselnden Umwandlung beteiligten Rechtsträger ist, wenn sie binnen sechs Monaten nach dem Tag, an dem die Eintragung der formwechselnden Umwandlung in das Register des Sitzes desjenigen Rechtsträgers, dessen Gläubiger sie sind, nach § 19 Absatz 3 UmwG als bekanntgemacht gilt, ihren Anspruch nach Grund und Höhe schriftlich anmelden, Sicherheit zu leisten, soweit sie nicht Befriedigung verlangen können. Dieses Recht steht den Gläubigern jedoch nur zu, wenn sie glaubhaft machen, dass durch die formwechselnden Umwandlung die Erfüllung ihrer Forderung gefährdet wird."
    },
    {
      "date": "2025-02-14",
      "id": "101398",
      "original_text": "Registerbekanntmachung nach dem Umwandlungsgesetz\nNordrhein-Westfalen Amtsgericht Münster HRB 17209\nJungic GmbH – Münster",
      "type": "Registerbekanntmachung nach dem Umwandlungsgesetz",
      "state": "Nordrhein-Westfalen",
      "amtsgericht": "Amtsgericht Münster",
      "registernummer": "HRB 17209",
      "registerart": "HRB",
      "company_name": "Jungic GmbH",
      "company_seat": "Münster",
      "details": "14.02.2025 (Bekanntmachungsdatum)\n\nNordrhein-Westfalen Amtsgericht Münster HRB 17209\nRegisterbekanntmachung nach dem Umwandlungsgesetz 14.02.2025 (Eintragungsdatum)\n\nJungic GmbH\nGesellschaft mit beschränkter Haftung\nMünster\n\nDie Gesellschaft hat Gläubigern, deren Forderungen vor dieser Bekanntmachung begründet worden sind, Sicherheit zu leisten, soweit sie nicht Befriedigung verlangen können, wenn sie sich binnen sechs Monaten zu diesem Zweck melden. Den Gläubigern der an der formwechselnden Umwandlung beteiligten Rechtsträger ist, wenn sie binnen sechs Monaten nach dem Tag, an dem die Eintragung der formwechselnden Umwandlung in das Register des Sitzes desjenigen Rechtsträgers, dessen Gläubiger sie sind, nach § 19 Absatz 3 UmwG als bekanntgemacht gilt, ihren Anspruch nach Grund und Höhe schriftlich anmelden, Sicherheit zu leisten, soweit sie nicht Befriedigung verlangen können. Dieses Recht steht den Gläubigern jedoch nur zu, wenn sie glaubhaft machen, dass durch die formwechselnden Umwandlung die Erfüllung ihrer Forderung gefährdet wird."
    },
    {
      "date": "2025-02-14",
      "id": "101399",
      "original_text": "Löschungsankündigung\nNordrhein-Westfalen Amtsgericht Dortmund HRB 30898\nSchwarz Trading GmbH – Dortmund",
      "type": "Löschungsankündigung",
      "state": "Nordrhein-Westfalen",
      "amtsgericht": "Amtsgericht Dortmund",
      "registernummer": "HRB 30898",
      "registerart": "HRB",
      "company_name": "Schwarz Trading GmbH",
      "company_seat": "Dortmund",
      "details": "14.02.2025 (Bekanntmachungsdatum)\n\nNordrhein-Westfalen Amtsgericht Dortmund HRB 30898\nLöschungsankündigung 14.02.2025 (Eintragungsdatum)\n\nSchwarz Trading GmbH\nGesellschaft mit beschränkter Haftung\nDortmund\n\nDas Registergericht beabsichtigt die Gesellschaft von Amts wegen nach § 394 FamFG zu löschen. Die Frist zur Erhebung eines Widerspruchs ist auf zwei Monate festgesetzt."
    },
    {
      "date": "2025-02-14",
      "id": "101400",
      "original_text": "Löschungsankündigung\nNordrhein-Westfalen Amtsgericht Siegburg HRB 14035\nJanmalen UG (haftungsbeschränkt) – Windeck",
      "type": "Löschungsankündigung",
      "state": "Nordrhein-Westfalen",
      "amtsgericht": "Amtsgericht Siegburg",
      "registernummer": "HRB 14035",
      "registerart": "HRB",
      "company_name": "Janmalen UG (haftungsbeschränkt)",
      "company_seat": "Windeck",
      "details": "14.02.2025 (Bekanntmachungsdatum)\n\nNordrhein-Westfalen Amtsgericht Siegburg HRB 14035\nLöschungsankündigung\n\nJanmalen UG (haftungsbeschränkt)\nGesellschaft mit beschränkter Haftung\nWindeck\n\nDas Registergericht hat glaubhafte Kenntnis erlangt, dass die Gesellschaft vermögenslos geworden ist, da ein Insolvenzeröffnungsantrag mangels Masse nach § 26 InsO zurückgewiesen wurde.\n\nEs ist daher beabsichtigt, die Gesellschaft nach § 394 FamFG im Handelsregister wegen Vermögenslosigkeit zu löschen.\nEinwände gegen die Löschung sind durch Widerspruch binnen einer Frist von 3 Monaten geltend zu machen, andernfalls die Löschung erfolgen wird.\n\nEinzulegen ist der Widerspruch bei dem Amtsgericht Siegburg, Neue Poststraße 16, 53721 Siegburg, und zwar entweder schriftlich in deutscher Sprache oder mündlich zur Niederschrift der Geschäftsstelle. Der Widerspruch kann auch zur Niederschrift der Geschäftsstelle eines jeden Amtsgerichts abgegeben werden. Der Widerspruch ist binnen der in der Verfügung bestimmten Frist einzulegen. Die Frist ist nur gewahrt, wenn der Widerspruch rechtzeitig bei dem Amtsgericht Siegburg eingeht, auch wenn der Widerspruch zur Niederschrift der Geschäftsstelle eines anderen Amtsgerichts abgegeben wurde. Die Frist beginnt jeweils mit der schriftlichen Bekanntgabe der Verfügung an die Beteiligten. Kann die schriftliche Bekanntgabe an einen Beteiligten nicht bewirkt werden, beginnt die Frist spätestens mit Ablauf von fünf Monaten nach Erlass der Verfügung. Die Bekanntgabe ist entweder durch Zustellung oder am dritten Tage nach Aufgabe zur Post bewirkt.\n\nSofern die Löschung noch nicht erfolgt ist, kann der Widerspruch auch noch nach Ablauf der Frist eingelegt werden. Fällt das Ende der Frist auf einen Sonnabend, einen Sonntag oder einen allgemeinen Feiertag, endet die Frist mit Ablauf des nächsten Werktages. Der Widerspruch ist zu unterzeichnen. Eine Begründung des Widerspruchs ist nicht vorgeschrieben."
    },
    {
      "date": "2025-02-14",
      "id": "101401",
      "original_text": "Löschungsankündigung\nNordrhein-Westfalen Amtsgericht Essen HRB 21073\nLUK @ Films GmbH – Essen",
      "type": "Löschungsankündigung",
      "state": "Nordrhein-Westfalen",
      "amtsgericht": "Amtsgericht Essen",
      "registernummer": "HRB 21073",
      "registerart": "HRB",
      "company_name": "LUK @ Films GmbH",
      "company_seat": "Essen",
      "details": "14.02.2025 (Bekanntmachungsdatum)\n\nNordrhein-Westfalen Amtsgericht Essen HRB 21073\nLöschungsankündigung\n\nLUK @ Films GmbH\nGesellschaft mit beschränkter Haftung\nEssen\n\nDas Registergericht beabsichtigt die Gesellschaft von Amts wegen nach § 394 FamFG zu löschen. Die Frist zur Erhebung eines Widerspruchs ist auf einen Monat festgesetzt."
    },
    {
      "date": "2025-02-14",
      "id": "101402",
      "original_text": "Registerbekanntmachung nach dem Umwandlungsgesetz\nNordrhein-Westfalen Amtsgericht Bad Oeynhausen HRB 19170\nKR Kanal- und Rohrtechnik-Verwaltungs GmbH – Bad Oeynhausen",
      "type": "Registerbekanntmachung nach dem Umwandlungsgesetz",
      "state": "Nordrhein-Westfalen",
      "amtsgericht": "Amtsgericht Bad Oeynhausen",
      "registernummer": "HRB 19170",
      "registerart": "HRB",
      "company_name": "KR Kanal- und Rohrtechnik-Verwaltungs GmbH",
      "company_seat": "Bad Oeynhausen",
      "details": "14.02.2025 (Bekanntmachungsdatum)\n\nNordrhein-Westfalen Amtsgericht Bad Oeynhausen HRB 19170\nRegisterbekanntmachung nach dem Umwandlungsgesetz 14.02.2025 (Eintragungsdatum)\n\nKR Kanal- und Rohrtechnik-Verwaltungs GmbH\nGesellschaft mit beschränkter Haftung\nBad Oeynhausen\n\nDen Gläubigern der an der Verschmelzung beteiligten Rechtsträger ist, wenn sie binnen sechs Monaten nach dem Tag, an dem die Eintragung der Verschmelzung in das Register des Sitzes desjenigen Rechtsträgers, dessen Gläubiger sie sind, nach § 19 Absatz 3 UmwG als bekanntgemacht gilt, ihren Anspruch nach Grund und Höhe schriftlich anmelden, Sicherheit zu leisten, soweit sie nicht Befriedigung verlangen können. Dieses Recht steht den Gläubigern jedoch nur zu, wenn sie glaubhaft machen, dass durch die Verschmelzung die Erfüllung ihrer Forderung gefährdet wird."
    },
    {
      "date": "2025-02-14",
      "id": "101403",
      "original_text": "Registerbekanntmachung nach dem Umwandlungsgesetz\nNordrhein-Westfalen Amtsgericht Bonn HRB 15881\nAFC Holding AG – Bonn",
      "type": "Registerbekanntmachung nach dem Umwandlungsgesetz",
      "state": "Nordrhein-Westfalen",
      "amtsgericht": "Amtsgericht Bonn",
      "registernummer": "HRB 15881",
      "registerart": "HRB",
      "company_name": "AFC Holding AG",
      "company_seat": "Bonn",
      "details": "14.02.2025 (Bekanntmachungsdatum)\n\nNordrhein-Westfalen Amtsgericht Bonn HRB 15881\nRegisterbekanntmachung nach dem Umwandlungsgesetz 14.02.2025 (Eintragungsdatum)\n\nAFC Holding AG\nAktiengesellschaft\nBonn\n\nDen Gläubigern der an der formwechselnden Umwandlung beteiligten Rechtsträger ist, wenn sie binnen sechs Monaten nach dem Tag, an dem die Eintragung der formwechselnden Umwandlung in das Register des Sitzes desjenigen Rechtsträgers, dessen Gläubiger sie sind, nach § 19 Absatz 3 UmwG als bekanntgemacht gilt, ihren Anspruch nach Grund und Höhe schriftlich anmelden, Sicherheit zu leisten, soweit sie nicht Befriedigung verlangen können. Dieses Recht steht den Gläubigern jedoch nur zu, wenn sie glaubhaft machen, dass durch die formwechselnden Umwandlung die Erfüllung ihrer Forderung gefährdet wird."
    },
    {
      "date": "2025-02-14",
      "id": "101404",
      "original_text": "Einreichung neuer Dokumente\nBaden-Württemberg Amtsgericht Stuttgart HRB 22937\nMercedes-Benz Bank AG – Stuttgart",
      "type": "Einreichung neuer Dokumente",
      "state": "Baden-Württemberg",
      "amtsgericht": "Amtsgericht Stuttgart",
      "registernummer": "HRB 22937",
      "registerart": "HRB",
      "company_name": "Mercedes-Benz Bank AG",
      "company_seat": "Stuttgart",
      "details": "14.02.2025 (Bekanntmachungsdatum)\n\nBaden-Württemberg Amtsgericht Stuttgart HRB 22937\nEinreichung neuer Dokumente 14.02.2025 (Eintragungsdatum)\n\nMercedes-Benz Bank AG\nAktiengesellschaft\nStuttgart\n\nDie Gesellschaft hat am 13.02.2025 die Liste über die Zusammensetzung des Aufsichtsrats zum Handelsregister eingereicht."
    },
    {
      "date": "2025-02-14",
      "id": "101405",
      "original_text": "Registerbekanntmachung nach dem Umwandlungsgesetz\nHessen Amtsgericht Kassel HRB 14461\nKaleido Beratung GmbH – Immenhausen",
      "type": "Registerbekanntmachung nach dem Umwandlungsgesetz",
      "state": "Hessen",
      "amtsgericht": "Amtsgericht Kassel",
      "registernummer": "HRB 14461",
      "registerart": "HRB",
      "company_name": "Kaleido Beratung GmbH",
      "company_seat": "Immenhausen",
      "details": "14.02.2025 (Bekanntmachungsdatum)\n\nHessen Amtsgericht Kassel HRB 14461\nRegisterbekanntmachung nach dem Umwandlungsgesetz 14.02.2025 (Eintragungsdatum)\n\nKaleido Beratung GmbH\nGesellschaft mit beschränkter Haftung\nImmenhausen\n\nDen Gläubigern der an der Verschmelzung beteiligten Rechtsträger ist, wenn sie binnen sechs Monaten nach dem Tag, an dem die Eintragung der Verschmelzung in das Register des Sitzes desjenigen Rechtsträgers, dessen Gläubiger sie sind, nach § 19 Absatz 3 UmwG bekannt gemacht worden ist, ihren Anspruch nach Grund und Höhe schriftlich anmelden, Sicherheit zu leisten, soweit sie nicht Befriedigung verlangen können. Dieses Recht steht den Gläubigern jedoch nur zu, wenn sie glaubhaft machen, dass durch die Verschmelzung die Erfüllung ihrer Forderung gefährdet wird."
    },
    {
      "date": "2025-02-14",
      "id": "101406",
      "original_text": "Löschungsankündigung\nHessen Amtsgericht Wiesbaden HRA 10919\nCAPCON CONSTRUCT UG (haftungsbeschränkt) & Co. KG – Wiesbaden",
      "type": "Löschungsankündigung",
      "state": "Hessen",
      "amtsgericht": "Amtsgericht Wiesbaden",
      "registernummer": "HRA 10919",
      "registerart": "HRA",
      "company_name": "CAPCON CONSTRUCT UG (haftungsbeschränkt) & Co. KG",
      "company_seat": "Wiesbaden",
      "details": "14.02.2025 (Bekanntmachungsdatum)\n\nHessen Amtsgericht Wiesbaden HRA 10919\nLöschungsankündigung\n\nCAPCON CONSTRUCT UG (haftungsbeschränkt) & Co. KG\nKommanditgesellschaft\nWiesbaden\n\nDas Registergericht beabsichtigt die im Handelsregister eingetragene Firma von Amts wegen nach §§ 6 und 31 Abs. 2 HGB zu löschen. Die Frist zur Erhebung eines Widerspruchs gegen die beabsichtigte Löschung wird auf 3 Monate festgesetzt."
    },
    {
      "date": "2025-02-14",
      "id": "101407",
      "original_text": "Löschungsankündigung\nHessen Amtsgericht Wiesbaden HRA 9694\nDeutsche Denk Mal Liegenschaftsverwaltung UG (haftungsbeschränkt) & Co. KG – Wiesbaden",
      "type": "Löschungsankündigung",
      "state": "Hessen",
      "amtsgericht": "Amtsgericht Wiesbaden",
      "registernummer": "HRA 9694",
      "registerart": "HRA",
      "company_name": "Deutsche Denk Mal Liegenschaftsverwaltung UG (haftungsbeschränkt) & Co. KG",
      "company_seat": "Wiesbaden",
      "details": "14.02.2025 (Bekanntmachungsdatum)\n\nHessen Amtsgericht Wiesbaden HRA 9694\nLöschungsankündigung\n\nDeutsche Denk Mal Liegenschaftsverwaltung UG (haftungsbeschränkt) & Co. KG\nKommanditgesellschaft\nWiesbaden\n\nDas Registergericht beabsichtigt die im Handelsregister eingetragene Firma von Amts wegen nach § 394  Abs. 4 FamFG zu löschen. Die Frist zur Erhebung eines Widerspruchs gegen die beabsichtigte Löschung wird auf 3 Monate festgesetzt."
    },
    {
      "date": "2025-02-14",
      "id": "101408",
      "original_text": "Löschungsankündigung\nHessen Amtsgericht Offenbach am Main HRB 50757\nIB-Projekt GmbH – Rödermark",
      "type": "Löschungsankündigung",
      "state": "Hessen",
      "amtsgericht": "Amtsgericht Offenbach am Main",
      "registernummer": "HRB 50757",
      "registerart": "HRB",
      "company_name": "IB-Projekt GmbH",
      "company_seat": "Rödermark",
      "details": "14.02.2025 (Bekanntmachungsdatum)\n\nHessen Amtsgericht Offenbach am Main HRB 50757\nLöschungsankündigung\n\nIB-Projekt GmbH\nGesellschaft mit beschränkter Haftung\nRödermark\n\nDas Registergericht beabsichtigt die im Handelsregister eingetragene Gesellschaft von Amts wegen nach § 394 FamFG zu löschen. Die Frist zur Erhebung eines Widerspruchs gegen die beabsichtigte Löschung wird auf 3 Monate festgesetzt."
    },
    {
      "date": "2025-02-14",
      "id": "101409",
      "original_text": "Sonstige Registerbekanntmachung\nHessen Amtsgericht Frankfurt am Main HRB 135822\nPlatinum 11. SE – Frankfurt am Main",
      "type": "Sonstige Registerbekanntmachung",
      "state": "Hessen",
      "amtsgericht": "Amtsgericht Frankfurt am Main",
      "registernummer": "HRB 135822",
      "registerart": "HRB",
      "company_name": "Platinum 11. SE",
      "company_seat": "Frankfurt am Main",
      "details": "14.02.2025 (Bekanntmachungsdatum)\n\nHessen Amtsgericht Frankfurt am Main HRB 135822\nSonstige Registerbekanntmachung 14.02.2025 (Eintragungsdatum)\n\nPlatinum 11. SE\nEuropäische Aktiengesellschaft (SE)\nFrankfurt am Main\n\nDurch eine Änderung in den Personen der Aufsichtsratsmitglieder ist eine Liste der Mitglieder des Aufsichtsrates zum Handelsregister eingereicht worden."
    },
    {
      "date": "2025-02-14",
      "id": "101410",
      "original_text": "Löschungsankündigung\nHessen Amtsgericht Offenbach am Main HRB 54247\nBau-Profi Bauprojekt GmbH – Heusenstamm",
      "type": "Löschungsankündigung",
      "state": "Hessen",
      "amtsgericht": "Amtsgericht Offenbach am Main",
      "registernummer": "HRB 54247",
      "registerart": "HRB",
      "company_name": "Bau-Profi Bauprojekt GmbH",
      "company_seat": "Heusenstamm",
      "details": "14.02.2025 (Bekanntmachungsdatum)\n\nHessen Amtsgericht Offenbach am Main HRB 54247\nLöschungsankündigung\n\nBau-Profi Bauprojekt GmbH\nGesellschaft mit beschränkter Haftung\nHeusenstamm\n\nDas Registergericht beabsichtigt die im Handelsregister eingetragene Gesellschaft von Amts wegen nach § 394 FamFG zu löschen. Die Frist zur Erhebung eines Widerspruchs gegen die beabsichtigte Löschung wird auf 3 Monate festgesetzt."
    },
    {
      "date": "2025-02-14",
      "id": "101411",
      "original_text": "Registerbekanntmachung nach dem Umwandlungsgesetz\nHessen Amtsgericht Kassel HRB 15631\nWilhelm Healthcare Consulting UG (haftungsbeschränkt) – Immenhausen",
      "type": "Registerbekanntmachung nach dem Umwandlungsgesetz",
      "state": "Hessen",
      "amtsgericht": "Amtsgericht Kassel",
      "registernummer": "HRB 15631",
      "registerart": "HRB",
      "company_name": "Wilhelm Healthcare Consulting UG (haftungsbeschränkt)",
      "company_seat": "Immenhausen",
      "details": "14.02.2025 (Bekanntmachungsdatum)\n\nHessen Amtsgericht Kassel HRB 15631\nRegisterbekanntmachung nach dem Umwandlungsgesetz 14.02.2025 (Eintragungsdatum)\n\nWilhelm Healthcare Consulting UG (haftungsbeschränkt)\nGesellschaft mit beschränkter Haftung\nImmenhausen\n\nDen Gläubigern der an der Verschmelzung beteiligten Rechtsträger ist, wenn sie binnen sechs Monaten nach dem Tag, an dem die Eintragung der Verschmelzung in das Register des Sitzes desjenigen Rechtsträgers, dessen Gläubiger sie sind, nach § 19 Absatz 3 UmwG bekannt gemacht worden ist, ihren Anspruch nach Grund und Höhe schriftlich anmelden, Sicherheit zu leisten, soweit sie nicht Befriedigung verlangen können. Dieses Recht steht den Gläubigern jedoch nur zu, wenn sie glaubhaft machen, dass durch die Verschmelzung die Erfüllung ihrer Forderung gefährdet wird."
    },
    {
      "date": "2025-02-14",
      "id": "101412",
      "original_text": "Registerbekanntmachung nach dem Umwandlungsgesetz\nHessen Amtsgericht Kassel HRB 20101\nVOLKSWAGEN GROUP Original Teile Logistik, Vertrieb & Services GmbH – Baunatal",
      "type": "Registerbekanntmachung nach dem Umwandlungsgesetz",
      "state": "Hessen",
      "amtsgericht": "Amtsgericht Kassel",
      "registernummer": "HRB 20101",
      "registerart": "HRB",
      "company_name": "VOLKSWAGEN GROUP Original Teile Logistik, Vertrieb & Services GmbH",
      "company_seat": "Baunatal",
      "details": "14.02.2025 (Bekanntmachungsdatum)\n\nHessen Amtsgericht Kassel HRB 20101\nRegisterbekanntmachung nach dem Umwandlungsgesetz 14.02.2025 (Eintragungsdatum)\n\nVOLKSWAGEN GROUP Original Teile Logistik, Vertrieb & Services GmbH\nGesellschaft mit beschränkter Haftung\nBaunatal\n\nDen Gläubigern der an der formwechselnden Umwandlung beteiligten Rechtsträger ist, wenn sie binnen sechs Monaten nach dem Tag, an dem die Eintragung der formwechselnden Umwandlung in das Register des Sitzes desjenigen Rechtsträgers, dessen Gläubiger sie sind, nach § 201 UmwG bekannt gemacht worden ist, ihren Anspruch nach Grund und Höhe schriftlich anmelden, Sicherheit zu leisten, soweit sie nicht Befriedigung verlangen können. Dieses Recht steht den Gläubigern jedoch nur zu, wenn sie glaubhaft machen, dass durch die formwechselnden Umwandlung die Erfüllung ihrer Forderung gefährdet wird."
    },
    {
      "date": "2025-02-14",
      "id": "101413",
      "original_text": "Sonstige Registerbekanntmachung\nHessen Amtsgericht Darmstadt VR 70363\nTischtennisgemeinschaft Brensbach – Brensbach",
      "type": "Sonstige Registerbekanntmachung",
      "state": "Hessen",
      "amtsgericht": "Amtsgericht Darmstadt",
      "registernummer": "VR 70363",
      "registerart": "VR",
      "company_name": "Tischtennisgemeinschaft Brensbach",
      "company_seat": "Brensbach",
      "details": "14.02.2025 (Bekanntmachungsdatum)\n\nHessen Amtsgericht Darmstadt VR 70363\nSonstige Registerbekanntmachung 14.02.2025 (Eintragungsdatum)\n\nTischtennisgemeinschaft Brensbach\neingetragener Verein\nBrensbach\n\nDer Verein ist aufgelöst."
    },
    {
      "date": "2025-02-14",
      "id": "101414",
      "original_text": "Löschungsankündigung\nHessen Amtsgericht Frankfurt am Main HRB 105545\nPeepla GmbH – Frankfurt am Main",
      "type": "Löschungsankündigung",
      "state": "Hessen",
      "amtsgericht": "Amtsgericht Frankfurt am Main",
      "registernummer": "HRB 105545",
      "registerart": "HRB",
      "company_name": "Peepla GmbH",
      "company_seat": "Frankfurt am Main",
      "details": "14.02.2025 (Bekanntmachungsdatum)\n\nHessen Amtsgericht Frankfurt am Main HRB 105545\nLöschungsankündigung\n\nPeepla GmbH\nGesellschaft mit beschränkter Haftung\nFrankfurt am Main\n\nDas Registergericht beabsichtigt die im Handelsregister eingetragene Gesellschaft von Amts wegen nach § 394 FamFG zu löschen. Die Frist zur Erhebung eines Widerspruchs gegen die beabsichtigte Löschung wird auf 1 Monat festgesetzt."
    },
    {
      "date": "2025-02-14",
      "id": "101415",
      "original_text": "Registerbekanntmachung nach dem Umwandlungsgesetz\nHessen Amtsgericht Kassel HRA 16149\nVolkswagen Original Teile Logistik GmbH & Co. KG – Baunatal",
      "type": "Registerbekanntmachung nach dem Umwandlungsgesetz",
      "state": "Hessen",
      "amtsgericht": "Amtsgericht Kassel",
      "registernummer": "HRA 16149",
      "registerart": "HRA",
      "company_name": "Volkswagen Original Teile Logistik GmbH & Co. KG",
      "company_seat": "Baunatal",
      "details": "14.02.2025 (Bekanntmachungsdatum)\n\nHessen Amtsgericht Kassel HRA 16149\nRegisterbekanntmachung nach dem Umwandlungsgesetz 14.02.2025 (Eintragungsdatum)\n\nVolkswagen Original Teile Logistik GmbH & Co. KG\nKommanditgesellschaft\nBaunatal\n\nDen Gläubigern der an der formwechselnden Umwandlung beteiligten Rechtsträger ist, wenn sie binnen sechs Monaten nach dem Tag, an dem die Eintragung der formwechselnden Umwandlung in das Register des Sitzes desjenigen Rechtsträgers, dessen Gläubiger sie sind, nach § 201 UmwG bekannt gemacht worden ist, ihren Anspruch nach Grund und Höhe schriftlich anmelden, Sicherheit zu leisten, soweit sie nicht Befriedigung verlangen können. Dieses Recht steht den Gläubigern jedoch nur zu, wenn sie glaubhaft machen, dass durch die formwechselnden Umwandlung die Erfüllung ihrer Forderung gefährdet wird."
    },
    {
      "date": "2025-02-14",
      "id": "101416",
      "original_text": "Registerbekanntmachung nach dem Umwandlungsgesetz\nHessen Amtsgericht Frankfurt am Main HRB 136465\nLucky Systems GmbH – Eschborn",
      "type": "Registerbekanntmachung nach dem Umwandlungsgesetz",
      "state": "Hessen",
      "amtsgericht": "Amtsgericht Frankfurt am Main",
      "registernummer": "HRB 136465",
      "registerart": "HRB",
      "company_name": "Lucky Systems GmbH",
      "company_seat": "Eschborn",
      "details": "14.02.2025 (Bekanntmachungsdatum)\n\nHessen Amtsgericht Frankfurt am Main HRB 136465\nRegisterbekanntmachung nach dem Umwandlungsgesetz 14.02.2025 (Eintragungsdatum)\n\nLucky Systems GmbH\nGesellschaft mit beschränkter Haftung\nEschborn\n\nDen Gläubigern der an der Ausgliederung beteiligten Rechtsträger ist, wenn sie binnen sechs Monaten nach dem Tag, an dem die Eintragung der Ausgliederung in das Register des Sitzes desjenigen Rechtsträgers, dessen Gläubiger sie sind, nach §§ 125, 19 Absatz 3 UmwG bekannt gemacht worden ist, ihren Anspruch nach Grund und Höhe schriftlich anmelden, Sicherheit zu leisten, soweit sie nicht Befriedigung verlangen können. Dieses Recht steht den Gläubigern jedoch nur zu, wenn sie glaubhaft machen, dass durch die Ausgliederung die Erfüllung ihrer Forderung gefährdet wird."
    },
    {
      "date": "2025-02-14",
      "id": "101417",
      "original_text": "Einreichung neuer Dokumente\nHessen Amtsgericht Hanau HRB 7200\nUmicore Management AG – Hanau",
      "type": "Einreichung neuer Dokumente",
      "state": "Hessen",
      "amtsgericht": "Amtsgericht Hanau",
      "registernummer": "HRB 7200",
      "registerart": "HRB",
      "company_name": "Umicore Management AG",
      "company_seat": "Hanau",
      "details": "14.02.2025 (Bekanntmachungsdatum)\n\nHessen Amtsgericht Hanau HRB 7200\nEinreichung neuer Dokumente\n\nUmicore Management AG\nAktiengesellschaft\nHanau\n\nDurch eine Änderung in den Personen der Aufsichtsratsmitglieder ist eine Liste der Mitglieder des Aufsichtsrates zum Handelsregister eingereicht worden."
    }
  ]
}