{
  "date": "2025-02-17",
  "date_of_scrape": "2025-02-18T04:07:03.209Z",
  "tool_version": "0.2.0",
  "number_of_announcements": 100,
  "announcements": [
    {
      "date": "2025-02-17",
      "id": "101435",
      "original_text": "Einreichung neuer Dokumente\nSaarland Amtsgericht Saarbrücken HRB 74401\nFernwärme-Verbund Saar Gesellschaft mit beschränkter Haftung – Völklingen",
      "type": "Einreichung neuer Dokumente",
      "state": "Saarland",
      "amtsgericht": "Amtsgericht Saarbrücken",
      "registernummer": "HRB 74401",
      "registerart": "HRB",
      "company_name": "Fernwärme-Verbund Saar Gesellschaft mit beschränkter Haftung",
      "company_seat": "Völklingen",
      "details": "17.02.2025 (Bekanntmachungsdatum)\n\nSaarland Amtsgericht Saarbrücken HRB 74401\nEinreichung neuer Dokumente\n\nFernwärme-Verbund Saar Gesellschaft mit beschränkter Haftung\nGesellschaft mit beschränkter Haftung\nVölklingen\n\nDie Geschäftsführung der Gesellschaft hat eine Liste der Mitglieder des Aufsichtsrats zum Handelsregister eingereicht (§ 52 Abs. 3 Satz 2 GmbHG)."
    },
    {
      "date": "2025-02-17",
      "id": "101436",
      "original_text": "Löschungsankündigung\nBaden-Württemberg Amtsgericht Freiburg HRB 714382\nÖzer Versandhandel UG (haftungsbeschränkt) – Kehl",
      "type": "Löschungsankündigung",
      "state": "Baden-Württemberg",
      "amtsgericht": "Amtsgericht Freiburg",
      "registernummer": "HRB 714382",
      "registerart": "HRB",
      "company_name": "Özer Versandhandel UG (haftungsbeschränkt)",
      "company_seat": "Kehl",
      "details": "17.02.2025 (Bekanntmachungsdatum)\n\nBaden-Württemberg Amtsgericht Freiburg HRB 714382\nLöschungsankündigung\n\nÖzer Versandhandel UG (haftungsbeschränkt)\nGesellschaft mit beschränkter Haftung\nKehl\n\nAls nicht eingetragen wird bekanntgemacht:\nDas Gericht beabsichtigt, die Gesellschaft wegen Vermögenslosigkeit im Handelsregister von Amts wegen nach § 394 FamFG zu löschen. Die Frist zur Geltendmachung eines Widerspruchs gegen die beabsichtigte Löschung ist auf einen Monat ab Veröffentlichung bestimmt."
    },
    {
      "date": "2025-02-17",
      "id": "101437",
      "original_text": "Löschungsankündigung\nMecklenburg-Vorpommern Amtsgericht Rostock HRB 15032\nTriphari GmbH – Bad Doberan",
      "type": "Löschungsankündigung",
      "state": "Mecklenburg-Vorpommern",
      "amtsgericht": "Amtsgericht Rostock",
      "registernummer": "HRB 15032",
      "registerart": "HRB",
      "company_name": "Triphari GmbH",
      "company_seat": "Bad Doberan",
      "details": "17.02.2025 (Bekanntmachungsdatum)\n\nMecklenburg-Vorpommern Amtsgericht Rostock HRB 15032\nLöschungsankündigung\n\nTriphari GmbH\nGesellschaft mit beschränkter Haftung\nBad Doberan\n\nDas Registergericht beabsichtigt, die im Handelsregister eingetragene Gesellschaft von Amts wegen nach § 394 FamFG zu löschen. Die Frist zur Erhebung eines Widerspruchs gegen die beabsichtigte Löschung wird auf einen Monat festgesetzt."
    },
    {
      "date": "2025-02-17",
      "id": "101438",
      "original_text": "Einreichung neuer Dokumente\nBerlin Amtsgericht Berlin (Charlottenburg) HRB 33773\nDeutsche Lebensversicherungs-Aktiengesellschaft – Berlin",
      "type": "Einreichung neuer Dokumente",
      "state": "Berlin",
      "amtsgericht": "Amtsgericht Berlin (Charlottenburg)",
      "registernummer": "HRB 33773",
      "registerart": "HRB",
      "company_name": "Deutsche Lebensversicherungs-Aktiengesellschaft",
      "company_seat": "Berlin",
      "details": "17.02.2025 (Bekanntmachungsdatum)\n\nBerlin Amtsgericht Berlin (Charlottenburg) HRB 33773\nEinreichung neuer Dokumente\n\nDeutsche Lebensversicherungs-Aktiengesellschaft\nAktiengesellschaft\nBerlin\n\nAls nicht eingetragen wird veröffentlicht: Es wurde eine neue Liste der Aufsichtsratsmitglieder eingereicht (§ 106 AktG)."
    },
    {
      "date": "2025-02-17",
      "id": "101439",
      "original_text": "Löschungsankündigung\nSchleswig-Holstein Amtsgericht Lübeck HRB 17858\nLASSIE ACADEMY LIMITED – Ratzeburg",
      "type": "Löschungsankündigung",
      "state": "Schleswig-Holstein",
      "amtsgericht": "Amtsgericht Lübeck",
      "registernummer": "HRB 17858",
      "registerart": "HRB",
      "company_name": "LASSIE ACADEMY LIMITED",
      "company_seat": "Ratzeburg",
      "details": "17.02.2025 (Bekanntmachungsdatum)\n\nSchleswig-Holstein Amtsgericht Lübeck HRB 17858\nLöschungsankündigung\n\nLASSIE ACADEMY LIMITED\nRechtsform ausländischen Rechts HRB\nRatzeburg\n\nBei der nachstehenden Gesellschaft wird das Amtslöschungsverfahren gemäß § 395 FamFG eingeleitet.\nWiderspruchsfrsit: 1 Monat"
    },
    {
      "date": "2025-02-17",
      "id": "101440",
      "original_text": "Löschungsankündigung\nSchleswig-Holstein Amtsgericht Lübeck HRB 21231\nHMS UG (haftungsbeschränkt) – Bad Schwartau",
      "type": "Löschungsankündigung",
      "state": "Schleswig-Holstein",
      "amtsgericht": "Amtsgericht Lübeck",
      "registernummer": "HRB 21231",
      "registerart": "HRB",
      "company_name": "HMS UG (haftungsbeschränkt)",
      "company_seat": "Bad Schwartau",
      "details": "17.02.2025 (Bekanntmachungsdatum)\n\nSchleswig-Holstein Amtsgericht Lübeck HRB 21231\nLöschungsankündigung\n\nHMS UG (haftungsbeschränkt)\nGesellschaft mit beschränkter Haftung\nBad Schwartau\n\nEs ist die Löschung der nachstehenden Gesellschaft wegen Vermögenslosigkeit gemäß § 394 FamFG beabsichtigt.\nWiderspruchsfrist: 1 Monat"
    },
    {
      "date": "2025-02-17",
      "id": "101441",
      "original_text": "Sonstige Registerbekanntmachung\nBaden-Württemberg Amtsgericht Mannheim HRB 724065\nHarder Rho GmbH – Hockenheim",
      "type": "Sonstige Registerbekanntmachung",
      "state": "Baden-Württemberg",
      "amtsgericht": "Amtsgericht Mannheim",
      "registernummer": "HRB 724065",
      "registerart": "HRB",
      "company_name": "Harder Rho GmbH",
      "company_seat": "Hockenheim",
      "details": "17.02.2025 (Bekanntmachungsdatum)\n\nBaden-Württemberg Amtsgericht Mannheim HRB 724065\nSonstige Registerbekanntmachung 17.02.2025 (Eintragungsdatum)\n\nHarder Rho GmbH\nGesellschaft mit beschränkter Haftung\nHockenheim\n\nDen Gläubigern der Gesellschaft, deren Forderungen begründet worden sind, bevor die Eintragung der Beendigung des Vertrages in das Handelsregister nach § 10 HGB als bekanntgemacht gilt, ist vom anderen Vertragsteil Sicherheit zu leisten, wenn sie sich binnen sechs Monaten nach der Bekanntmachung zu diesem Zweck bei ihm melden."
    },
    {
      "date": "2025-02-17",
      "id": "101442",
      "original_text": "Löschungsankündigung\nSchleswig-Holstein Amtsgericht Lübeck HRB 22020\nMeincorona-test NJS.com GmbH – Reinbek",
      "type": "Löschungsankündigung",
      "state": "Schleswig-Holstein",
      "amtsgericht": "Amtsgericht Lübeck",
      "registernummer": "HRB 22020",
      "registerart": "HRB",
      "company_name": "Meincorona-test NJS.com GmbH",
      "company_seat": "Reinbek",
      "details": "17.02.2025 (Bekanntmachungsdatum)\n\nSchleswig-Holstein Amtsgericht Lübeck HRB 22020\nLöschungsankündigung\n\nMeincorona-test NJS.com GmbH\nGesellschaft mit beschränkter Haftung\nReinbek\n\nEs wird folgendes Schreiben an die Geschäftsführerin veröffentlicht:\n\nSehr geehrte Frau Scharphuis,\n\nin der Handelsregistersache der\nMeincorona-test NJS.com GmbH\n\nergeben sich aus den mir vorliegenden Unterlagen Anhaltspunkte dafür, dass die Gesellschaft, als deren Geschäftsführerin Sie noch eingetragen sind, vermögenslos ist:\n\nEs ist daher beabsichtigt, die Gesellschaft wegen Vermögenslosigkeit gemäß § 394 FamFG zu löschen.\n\nEs wird eine Frist von zwei Monaten zur Geltendmachung eines Widerspruchs gegen die Löschung bestimmt, § 394 Abs. 2 S. 1 FamFG.\n\nNach Fristablauf ohne Widerspruch von Ihnen oder anderer Seite wird die Gesellschaft gelöscht.\n\noder nach Vereinbarung\nMit freundlichen Grüßen\n\nSchuppenhauer\nDipl.-Rechtspflegerin (FH)"
    },
    {
      "date": "2025-02-17",
      "id": "101443",
      "original_text": "Registerbekanntmachung nach dem Umwandlungsgesetz\nSchleswig-Holstein Amtsgericht Pinneberg HRB 17798\nWorld Wide Green Holding GmbH – Heide",
      "type": "Registerbekanntmachung nach dem Umwandlungsgesetz",
      "state": "Schleswig-Holstein",
      "amtsgericht": "Amtsgericht Pinneberg",
      "registernummer": "HRB 17798",
      "registerart": "HRB",
      "company_name": "World Wide Green Holding GmbH",
      "company_seat": "Heide",
      "details": "17.02.2025 (Bekanntmachungsdatum)\n\nSchleswig-Holstein Amtsgericht Pinneberg HRB 17798\nRegisterbekanntmachung nach dem Umwandlungsgesetz 03.02.2025 (Eintragungsdatum)\n\nWorld Wide Green Holding GmbH\nGesellschaft mit beschränkter Haftung\nHeide\n\nZu Eintragungsnummer 3 vom 03.02.2025 wird als nicht eingetragen veröffentlicht:  Den Gläubigern der an der Verschmelzung beteiligten Rechtsträger ist, wenn sie binnen sechs Monaten nach dem Tag, an dem die Eintragung der Verschmelzung in das Register des Sitzes desjenigen Rechtsträgers, dessen Gläubiger sie sind, als bekannt gemacht gilt, ihren Anspruch nach Grund und Höhe schriftlich anmelden, Sicherheit zu leisten, soweit sie nicht Befriedigung verlangen können. Dieses Recht steht den Gläubigern jedoch nur zu, wenn sie glaubhaft machen, dass durch die Verschmelzung die Erfüllung ihrer Forderung gefährdet wird. Das Recht, Sicherheitsleistung zu verlangen, steht Gläubigern nicht zu, die im Falle der Insolvenz ein Recht auf vorzugsweise Befriedigung aus einer Deckungsmasse haben, die nach gesetzlicher Vorschrift zu ihrem Schutz errichtet und staatlich überwacht ist."
    },
    {
      "date": "2025-02-17",
      "id": "101444",
      "original_text": "Einreichung neuer Dokumente\nBaden-Württemberg Amtsgericht Mannheim HRB 107847\nVBK - Verkehrsbetriebe Karlsruhe GmbH – Karlsruhe",
      "type": "Einreichung neuer Dokumente",
      "state": "Baden-Württemberg",
      "amtsgericht": "Amtsgericht Mannheim",
      "registernummer": "HRB 107847",
      "registerart": "HRB",
      "company_name": "VBK - Verkehrsbetriebe Karlsruhe GmbH",
      "company_seat": "Karlsruhe",
      "details": "17.02.2025 (Bekanntmachungsdatum)\n\nBaden-Württemberg Amtsgericht Mannheim HRB 107847\nEinreichung neuer Dokumente\n\nVBK - Verkehrsbetriebe Karlsruhe GmbH\nGesellschaft mit beschränkter Haftung\nKarlsruhe\n\nDie Gesellschaft hat am 07.02.2025 die Liste über die Zusammensetzung des Aufsichtsrats zum Handelsregister eingereicht."
    },
    {
      "date": "2025-02-17",
      "id": "101445",
      "original_text": "Einreichung neuer Dokumente\nBaden-Württemberg Amtsgericht Mannheim HRB 7331\nUniversitätsklinikum Mannheim GmbH – Mannheim",
      "type": "Einreichung neuer Dokumente",
      "state": "Baden-Württemberg",
      "amtsgericht": "Amtsgericht Mannheim",
      "registernummer": "HRB 7331",
      "registerart": "HRB",
      "company_name": "Universitätsklinikum Mannheim GmbH",
      "company_seat": "Mannheim",
      "details": "17.02.2025 (Bekanntmachungsdatum)\n\nBaden-Württemberg Amtsgericht Mannheim HRB 7331\nEinreichung neuer Dokumente 17.02.2025 (Eintragungsdatum)\n\nUniversitätsklinikum Mannheim GmbH\nGesellschaft mit beschränkter Haftung\nMannheim\n\nAls nicht eingetragen wird bekanntgemacht:\n\nDie Gesellschaft hat am 14.02.2025 die Liste über die Zusammensetzung des Aufsichtsrats zum Handelsregister eingereicht."
    },
    {
      "date": "2025-02-17",
      "id": "101446",
      "original_text": "Löschungsankündigung\nMecklenburg-Vorpommern Amtsgericht Rostock HRB 14887\nBK Rent & Event GmbH – Lalendorf",
      "type": "Löschungsankündigung",
      "state": "Mecklenburg-Vorpommern",
      "amtsgericht": "Amtsgericht Rostock",
      "registernummer": "HRB 14887",
      "registerart": "HRB",
      "company_name": "BK Rent & Event GmbH",
      "company_seat": "Lalendorf",
      "details": "17.02.2025 (Bekanntmachungsdatum)\n\nMecklenburg-Vorpommern Amtsgericht Rostock HRB 14887\nLöschungsankündigung\n\nBK Rent & Event GmbH\nGesellschaft mit beschränkter Haftung\nLalendorf\n\nDas Registergericht beabsichtigt, die im Handelsregister eingetragene Gesellschaft von Amts wegen nach § 394 FamFG zu löschen. Die Frist zur Erhebung eines Widerspruchs gegen die beabsichtigte Löschung wird auf 1 Monat festgesetzt."
    },
    {
      "date": "2025-02-17",
      "id": "101447",
      "original_text": "Einreichung neuer Dokumente\nBerlin Amtsgericht Berlin (Charlottenburg) HRB 170148\nMEDIAN Kliniken GmbH – Berlin",
      "type": "Einreichung neuer Dokumente",
      "state": "Berlin",
      "amtsgericht": "Amtsgericht Berlin (Charlottenburg)",
      "registernummer": "HRB 170148",
      "registerart": "HRB",
      "company_name": "MEDIAN Kliniken GmbH",
      "company_seat": "Berlin",
      "details": "17.02.2025 (Bekanntmachungsdatum)\n\nBerlin Amtsgericht Berlin (Charlottenburg) HRB 170148\nEinreichung neuer Dokumente\n\nMEDIAN Kliniken GmbH\nGesellschaft mit beschränkter Haftung\nBerlin\n\nAls nicht eingetragen wird veröffentlicht:Es wurde eine neue Liste der Aufsichtsratsmitglieder eingereicht (§52 GmbHG)."
    },
    {
      "date": "2025-02-17",
      "id": "101448",
      "original_text": "Löschungsankündigung\nBaden-Württemberg Amtsgericht Stuttgart HRB 744842\nS+S Edelstahlservice UG (haftungsbeschränkt) – Schwaigern",
      "type": "Löschungsankündigung",
      "state": "Baden-Württemberg",
      "amtsgericht": "Amtsgericht Stuttgart",
      "registernummer": "HRB 744842",
      "registerart": "HRB",
      "company_name": "S+S Edelstahlservice UG (haftungsbeschränkt)",
      "company_seat": "Schwaigern",
      "details": "17.02.2025 (Bekanntmachungsdatum)\n\nBaden-Württemberg Amtsgericht Stuttgart HRB 744842\nLöschungsankündigung\n\nS+S Edelstahlservice UG (haftungsbeschränkt)\nGesellschaft mit beschränkter Haftung\nSchwaigern\n\nDas Gericht beabsichtigt, die Gesellschaft wegen Vermögenslosigkeit im Handelsregister von Amts wegen nach § 394 FamFG zu löschen. Die Frist zur Geltendmachung eines Widerspruchs gegen die beabsichtigte Löschung ist auf zwei Monate ab Veröffentlichung bestimmt."
    },
    {
      "date": "2025-02-17",
      "id": "101449",
      "original_text": "Löschungsankündigung\nSaarland Amtsgericht Saarbrücken HRB 102797\nSHS UG (haftungsbeschränkt) – Völklingen",
      "type": "Löschungsankündigung",
      "state": "Saarland",
      "amtsgericht": "Amtsgericht Saarbrücken",
      "registernummer": "HRB 102797",
      "registerart": "HRB",
      "company_name": "SHS UG (haftungsbeschränkt)",
      "company_seat": "Völklingen",
      "details": "17.02.2025 (Bekanntmachungsdatum)\n\nSaarland Amtsgericht Saarbrücken HRB 102797\nLöschungsankündigung\n\nSHS UG (haftungsbeschränkt)\nGesellschaft mit beschränkter Haftung\nVölklingen\n\nEs ist beabsichtigt, die Gesellschaft von Amts wegen gemäß § 394 FamFG wegen Vermögenslosigkeit zu löschen. Gegen die Löschung von Amts wegen ist das Rechtsmittel des Widerspruchs statthaft. Der Widerspruch ist binnen einer Frist von 2 Monaten beginnend mit dem Tag dieser Veröffentlichung durch Einreichen eines Widerspruchsschreibens -schriftlich oder zur Niederschrift der Geschäftsstelle- beim Amtsgericht Saarbrücken, -zentrales Handelsregister-, Mainzerstr.178, 66121 Saarbrücken einzulegen. Der Widerspruch muss die Bezeichnung der angefochtenen Löschungsankündigung enthalten sowie die Erklärung, dass Widerspruch eingelegt wird. Er ist vom Widerspruchsführer oder seinem Bevollmächtigten zu unterzeichnen.\nDas Widerspruchsschreiben kann auch in der Form eines elektronischen Dokumentes eingereicht werden, das mit einer qualifizierten elektronischen Signatur nach dem Signaturgesetz versehen sein muss (§§ 14 Abs. 2 FamFG, 130a, 298 ZPO)."
    },
    {
      "date": "2025-02-17",
      "id": "101450",
      "original_text": "Registerbekanntmachung nach dem Umwandlungsgesetz\nBaden-Württemberg Amtsgericht Stuttgart HRB 764717\nPrimex Holding GmbH – Stuttgart",
      "type": "Registerbekanntmachung nach dem Umwandlungsgesetz",
      "state": "Baden-Württemberg",
      "amtsgericht": "Amtsgericht Stuttgart",
      "registernummer": "HRB 764717",
      "registerart": "HRB",
      "company_name": "Primex Holding GmbH",
      "company_seat": "Stuttgart",
      "details": "17.02.2025 (Bekanntmachungsdatum)\n\nBaden-Württemberg Amtsgericht Stuttgart HRB 764717\nRegisterbekanntmachung nach dem Umwandlungsgesetz 17.02.2025 (Eintragungsdatum)\n\nPrimex Holding GmbH\nGesellschaft mit beschränkter Haftung\nStuttgart\n\nAls nicht eingetragen wird bekanntgemacht:\nDen Gläubigern der an der Verschmelzung beteiligten Rechtsträger ist, wenn sie binnen sechs Monaten nach dem Tag, an dem die Eintragung der Verschmelzung in das Register des Sitzes desjenigen Rechtsträgers, dessen Gläubiger sie sind, nach § 19 Abs. 3 UmwG als bekanntgemacht gilt, ihren Anspruch nach Grund und Höhe schriftlich anmelden, Sicherheit zu leisten, soweit sie nicht Befriedigung verlangen können. Dieses Recht steht den Gläubigern jedoch nur zu, wenn sie glaubhaft machen, dass durch die Verschmelzung die Erfüllung ihrer Forderung gefährdet wird."
    },
    {
      "date": "2025-02-17",
      "id": "101451",
      "original_text": "Einreichung neuer Dokumente\nBaden-Württemberg Amtsgericht Stuttgart HRB 794421\nTRUMPF International Beteiligungs-SE – Ditzingen",
      "type": "Einreichung neuer Dokumente",
      "state": "Baden-Württemberg",
      "amtsgericht": "Amtsgericht Stuttgart",
      "registernummer": "HRB 794421",
      "registerart": "HRB",
      "company_name": "TRUMPF International Beteiligungs-SE",
      "company_seat": "Ditzingen",
      "details": "17.02.2025 (Bekanntmachungsdatum)\n\nBaden-Württemberg Amtsgericht Stuttgart HRB 794421\nEinreichung neuer Dokumente\n\nTRUMPF International Beteiligungs-SE\nEuropäische Aktiengesellschaft (SE)\nDitzingen\n\nDie Gesellschaft hat am 07.02.2025 die Liste über die Zusammensetzung des Aufsichtsrats zum Handelsregister eingereicht."
    },
    {
      "date": "2025-02-17",
      "id": "101452",
      "original_text": "Sonstige Registerbekanntmachung\nBerlin Amtsgericht Berlin (Charlottenburg) VR 8338\nFörderkreis der Evangelischen Kirchengemeinde Am Groß-Glienicker See e.V. – Berlin",
      "type": "Sonstige Registerbekanntmachung",
      "state": "Berlin",
      "amtsgericht": "Amtsgericht Berlin (Charlottenburg)",
      "registernummer": "VR 8338",
      "registerart": "VR",
      "company_name": "Förderkreis der Evangelischen Kirchengemeinde Am Groß-Glienicker See e.V.",
      "company_seat": "Berlin",
      "details": "17.02.2025 (Bekanntmachungsdatum)\n\nBerlin Amtsgericht Berlin (Charlottenburg) VR 8338\nSonstige Registerbekanntmachung 14.02.2025 (Eintragungsdatum)\n\nFörderkreis der Evangelischen Kirchengemeinde Am Groß-Glienicker See e.V.\neingetragener Verein\nBerlin\n\nZu Eintragungsnummer 7 vom 14.02.2025 wird als nicht eingetragen veröffentlich: Den Gläubigern der an der Verschmelzung beteiligten Rechtsträger ist, wenn sie binnen sechs Monaten nach dem Tag, an dem die Eintragung der Verschmelzung in das Register des Sitzes desjenigen Rechtsträgers, dessen Gläubiger sie sind, als bekannt gemacht gilt, ihren Anspruch nach Grund und Höhe schriftlich anmelden, Sicherheit zu leisten, soweit sie nicht Befriedigung verlangen können. Dieses Recht steht den Gläubigern jedoch nur zu, wenn sie glaubhaft machen, dass durch die Verschmelzung die Erfüllung ihrer Forderung gefährdet wird. Das Recht, Sicherheitsleistung zu verlangen, steht Gläubigern nicht zu, die im Falle der Insolvenz ein Recht auf vorzugsweise Befriedigung aus einer Deckungsmasse haben, die nach gesetzlicher Vorschrift zu ihrem Schutz errichtet und staatlich überwacht ist."
    },
    {
      "date": "2025-02-17",
      "id": "101453",
      "original_text": "Sonstige Registerbekanntmachung\nBerlin Amtsgericht Berlin (Charlottenburg) VR 39418\nFreundeskreis Dorfkirche Kladow e.V. – Berlin",
      "type": "Sonstige Registerbekanntmachung",
      "state": "Berlin",
      "amtsgericht": "Amtsgericht Berlin (Charlottenburg)",
      "registernummer": "VR 39418",
      "registerart": "VR",
      "company_name": "Freundeskreis Dorfkirche Kladow e.V.",
      "company_seat": "Berlin",
      "details": "17.02.2025 (Bekanntmachungsdatum)\n\nBerlin Amtsgericht Berlin (Charlottenburg) VR 39418\nSonstige Registerbekanntmachung 14.02.2025 (Eintragungsdatum)\n\nFreundeskreis Dorfkirche Kladow e.V.\neingetragener Verein\nBerlin\n\nZu Eintragungsnummer 3 vom 14.02.2025 wird als nicht eingetragen veröffentlich: Den Gläubigern der an der Verschmelzung beteiligten Rechtsträger ist, wenn sie binnen sechs Monaten nach dem Tag, an dem die Eintragung der Verschmelzung in das Register des Sitzes desjenigen Rechtsträgers, dessen Gläubiger sie sind, als bekannt gemacht gilt, ihren Anspruch nach Grund und Höhe schriftlich anmelden, Sicherheit zu leisten, soweit sie nicht Befriedigung verlangen können. Dieses Recht steht den Gläubigern jedoch nur zu, wenn sie glaubhaft machen, dass durch die Verschmelzung die Erfüllung ihrer Forderung gefährdet wird. Das Recht, Sicherheitsleistung zu verlangen, steht Gläubigern nicht zu, die im Falle der Insolvenz ein Recht auf vorzugsweise Befriedigung aus einer Deckungsmasse haben, die nach gesetzlicher Vorschrift zu ihrem Schutz errichtet und staatlich überwacht ist."
    },
    {
      "date": "2025-02-17",
      "id": "101454",
      "original_text": "Einreichung neuer Dokumente\nSaarland Amtsgericht Saarbrücken HRB 12486\nco. met GmbH – Saarbrücken",
      "type": "Einreichung neuer Dokumente",
      "state": "Saarland",
      "amtsgericht": "Amtsgericht Saarbrücken",
      "registernummer": "HRB 12486",
      "registerart": "HRB",
      "company_name": "co. met GmbH",
      "company_seat": "Saarbrücken",
      "details": "17.02.2025 (Bekanntmachungsdatum)\n\nSaarland Amtsgericht Saarbrücken HRB 12486\nEinreichung neuer Dokumente\n\nco. met GmbH\nGesellschaft mit beschränkter Haftung\nSaarbrücken\n\nDie Geschäftsführung der Gesellschaft hat eine Liste der Mitglieder des Aufsichtsrats zum Handelsregister eingereicht (§ 52 Abs. 3 Satz 2 GmbHG)."
    },
    {
      "date": "2025-02-17",
      "id": "101455",
      "original_text": "Registerbekanntmachung nach dem Umwandlungsgesetz\nThüringen Amtsgericht Jena HRA 401066\nBekleidungFabrik Bessmann Breitenworbis GmbH & Co. KG – Breitenworbis",
      "type": "Registerbekanntmachung nach dem Umwandlungsgesetz",
      "state": "Thüringen",
      "amtsgericht": "Amtsgericht Jena",
      "registernummer": "HRA 401066",
      "registerart": "HRA",
      "company_name": "BekleidungFabrik Bessmann Breitenworbis GmbH & Co. KG",
      "company_seat": "Breitenworbis",
      "details": "17.02.2025 (Bekanntmachungsdatum)\n\nThüringen Amtsgericht Jena HRA 401066\nRegisterbekanntmachung nach dem Umwandlungsgesetz 17.02.2025 (Eintragungsdatum)\n\nBekleidungFabrik Bessmann Breitenworbis GmbH & Co. KG\nKommanditgesellschaft\nBreitenworbis\n\nNicht eingetragen: Den Gläubigern der an der Verschmelzung beteiligten Rechtsträger, ist wenn sie binnen sechs Monaten nach dem Tag, an dem die Eintragung der Verschmelzung in das Register des Sitzes desjenigen Rechtsträgers, dessen Gläubiger sie sind,  nach § 19 Abs. 3 UmwG als bekanntgemacht gilt, ihren Anspruch nach Grund und Höhe schriftlich anmelden, Sicherheit zu leisten, soweit sie nicht Befriedigung verlangen können. Dieses Recht steht ihnen jedoch nur zu, wenn sie glaubhaft machen, daß durch die Verschmelzung die Erfüllung ihrer Forderung gefährdet wird."
    },
    {
      "date": "2025-02-17",
      "id": "101456",
      "original_text": "Registerbekanntmachung nach dem Umwandlungsgesetz\nThüringen Amtsgericht Jena HRB 522453\ntempus software GmbH – Langenwolschendorf",
      "type": "Registerbekanntmachung nach dem Umwandlungsgesetz",
      "state": "Thüringen",
      "amtsgericht": "Amtsgericht Jena",
      "registernummer": "HRB 522453",
      "registerart": "HRB",
      "company_name": "tempus software GmbH",
      "company_seat": "Langenwolschendorf",
      "details": "17.02.2025 (Bekanntmachungsdatum)\n\nThüringen Amtsgericht Jena HRB 522453\nRegisterbekanntmachung nach dem Umwandlungsgesetz 17.02.2025 (Eintragungsdatum)\n\ntempus software GmbH\nGesellschaft mit beschränkter Haftung\nLangenwolschendorf\n\nNicht eingetragen: Den Gläubigern der an der Ausgliederung beteiligten Rechtsträger, ist wenn sie binnen sechs Monaten nach dem Tag, an dem die Eintragung der Ausgliederung in das Register des Sitzes desjenigen Rechtsträgers, dessen Gläubiger sie sind, nach §§125, 19 Abs. 3 UmwG als bekanntgemacht gilt, ihren Anspruch nach Grund und Höhe schriftlich anmelden, Sicherheit zu leisten, soweit sie nicht Befriedigung verlangen können. Dieses Recht steht ihnen jedoch nur zu, wenn sie glaubhaft machen, daß durch die Ausgliederung die Erfüllung ihrer Forderung gefährdet wird."
    },
    {
      "date": "2025-02-17",
      "id": "101457",
      "original_text": "Löschungsankündigung\nBerlin Amtsgericht Berlin (Charlottenburg) HRA 62944\nSpedition Rosendorn GmbH & Co. KG – Berlin",
      "type": "Löschungsankündigung",
      "state": "Berlin",
      "amtsgericht": "Amtsgericht Berlin (Charlottenburg)",
      "registernummer": "HRA 62944",
      "registerart": "HRA",
      "company_name": "Spedition Rosendorn GmbH & Co. KG",
      "company_seat": "Berlin",
      "details": "17.02.2025 (Bekanntmachungsdatum)\n\nBerlin Amtsgericht Berlin (Charlottenburg) HRA 62944\nLöschungsankündigung\n\nSpedition Rosendorn GmbH & Co. KG\nKommanditgesellschaft\nBerlin\n\nBei dem nachstehenden Unternehmen / der nachstehenden Gesellschaft wird das Amtslöschungsverfahren gemäß § 31 Abs. 2 HGB eingeleitet. Widerspruchsfrist 6 Wochen."
    },
    {
      "date": "2025-02-17",
      "id": "101458",
      "original_text": "Löschungsankündigung\nSaarland Amtsgericht Saarbrücken HRB 103738\nFixGold ci Financial GmbH – Völklingen",
      "type": "Löschungsankündigung",
      "state": "Saarland",
      "amtsgericht": "Amtsgericht Saarbrücken",
      "registernummer": "HRB 103738",
      "registerart": "HRB",
      "company_name": "FixGold ci Financial GmbH",
      "company_seat": "Völklingen",
      "details": "17.02.2025 (Bekanntmachungsdatum)\n\nSaarland Amtsgericht Saarbrücken HRB 103738\nLöschungsankündigung\n\nFixGold ci Financial GmbH\nGesellschaft mit beschränkter Haftung\nVölklingen\n\nEs ist beabsichtigt, die Gesellschaft von Amts wegen gemäß § 394 FamFG wegen Vermögenslosigkeit zu löschen.\nGegen die Löschung von Amts wegen ist das Rechtsmittel des Widerspruchs statthaft. Der Widerspruch ist binnen einer Frist zwei Monaten beginnend mit dem Tag dieser Veröffentlichung durch Einreichen eines Widerspruchsschreibens -schriftlich oder zur Niederschrift der Geschäftsstelle beim Amtsgericht Saarbrücken, -zentrales Handelsregister-, Mainzerstr.178, 66121 Saarbrücken einzulegen.\nDer Widerspruch muss die Bezeichnung der angefochtenen Löschungsankündigung enthalten sowie die Erklärung, dass Widerspruch eingelegt wird. Er ist vom Widerspruchsführer oder seinem Bevollmächtigten zu unterzeichnen.\nDas Widerspruchsschreiben kann auch in der Form eines elektronischen Dokumentes eingereicht werden, das mit einer qualifizierten elektronischen Signatur nach dem Signaturgesetz versehen sein muss (§§ 14 Abs. 2 FamFG, 130a, 298 ZPO)."
    },
    {
      "date": "2025-02-17",
      "id": "101459",
      "original_text": "Einreichung neuer Dokumente\nBaden-Württemberg Amtsgericht Stuttgart HRB 361387\nOUTLETCITY AG – Metzingen",
      "type": "Einreichung neuer Dokumente",
      "state": "Baden-Württemberg",
      "amtsgericht": "Amtsgericht Stuttgart",
      "registernummer": "HRB 361387",
      "registerart": "HRB",
      "company_name": "OUTLETCITY AG",
      "company_seat": "Metzingen",
      "details": "17.02.2025 (Bekanntmachungsdatum)\n\nBaden-Württemberg Amtsgericht Stuttgart HRB 361387\nEinreichung neuer Dokumente\n\nOUTLETCITY AG\nAktiengesellschaft\nMetzingen\n\nDie Gesellschaft hat am 13.02.2025 die Liste über die Zusammensetzung des Aufsichtsrats zum Handelsregister eingereicht."
    },
    {
      "date": "2025-02-17",
      "id": "101460",
      "original_text": "Registerbekanntmachung nach dem Umwandlungsgesetz\nBaden-Württemberg Amtsgericht Ulm HRA 728334\nSolarpark Steinbol GmbH & Co. KG – Dornstadt",
      "type": "Registerbekanntmachung nach dem Umwandlungsgesetz",
      "state": "Baden-Württemberg",
      "amtsgericht": "Amtsgericht Ulm",
      "registernummer": "HRA 728334",
      "registerart": "HRA",
      "company_name": "Solarpark Steinbol GmbH & Co. KG",
      "company_seat": "Dornstadt",
      "details": "17.02.2025 (Bekanntmachungsdatum)\n\nBaden-Württemberg Amtsgericht Ulm HRA 728334\nRegisterbekanntmachung nach dem Umwandlungsgesetz 17.02.2025 (Eintragungsdatum)\n\nSolarpark Steinbol GmbH & Co. KG\nKommanditgesellschaft\nDornstadt\n\nAls nicht eingetragen wird bekanntgemacht:\nDen Gläubigern der an der Verschmelzung beteiligten Rechtsträger ist, wenn sie binnen sechs Monaten nach dem Tag, an dem die Eintragung der Verschmelzung in das Register des Sitzes desjenigen Rechtsträgers, dessen Gläubiger sie sind, nach § 19 Abs. 3 UmwG als bekanntgemacht gilt, ihren Anspruch nach Grund und Höhe schriftlich anmelden, Sicherheit zu leisten, soweit sie nicht Befriedigung verlangen können. Dieses Recht steht den Gläubigern jedoch nur zu, wenn sie glaubhaft machen, dass durch die Verschmelzung die Erfüllung ihrer Forderung gefährdet wird."
    },
    {
      "date": "2025-02-17",
      "id": "101461",
      "original_text": "Löschungsankündigung\nSachsen-Anhalt Amtsgericht Stendal VR 723\nFußballförderverein Am Hölzchen e.V. – Stendal",
      "type": "Löschungsankündigung",
      "state": "Sachsen-Anhalt",
      "amtsgericht": "Amtsgericht Stendal",
      "registernummer": "VR 723",
      "registerart": "VR",
      "company_name": "Fußballförderverein Am Hölzchen e.V.",
      "company_seat": "Stendal",
      "details": "17.02.2025 (Bekanntmachungsdatum)\n\nSachsen-Anhalt Amtsgericht Stendal VR 723\nLöschungsankündigung\n\nFußballförderverein Am Hölzchen e.V.\neingetragener Verein\nStendal\n\nDas Registergericht beabsichtigt, nachfolgenden im Vereinsregister eingetragenen Verein von Amts wegen nach § 4 VRV zu löschen. Die Frist zu Erhebung eines Widerspruchs wird auf drei Monate festgesetzt."
    },
    {
      "date": "2025-02-17",
      "id": "101462",
      "original_text": "Löschungsankündigung\nSaarland Amtsgericht Saarbrücken HRB 13303\nKMH Vertriebs GmbH – Völklingen",
      "type": "Löschungsankündigung",
      "state": "Saarland",
      "amtsgericht": "Amtsgericht Saarbrücken",
      "registernummer": "HRB 13303",
      "registerart": "HRB",
      "company_name": "KMH Vertriebs GmbH",
      "company_seat": "Völklingen",
      "details": "17.02.2025 (Bekanntmachungsdatum)\n\nSaarland Amtsgericht Saarbrücken HRB 13303\nLöschungsankündigung\n\nKMH Vertriebs GmbH\nGesellschaft mit beschränkter Haftung\nVölklingen\n\nEs ist beabsichtigt, die Gesellschaft von Amts wegen gemäß § 394 FamFG wegen Vermögenslosigkeit zu löschen.\nGegen die Löschung von Amts wegen ist das Rechtsmittel des Widerspruchs statthaft. Der Widerspruch ist binnen einer Frist zwei Monaten beginnend mit dem Tag dieser Veröffentlichung durch Einreichen eines Widerspruchsschreibens -schriftlich oder zur Niederschrift der Geschäftsstelle beim Amtsgericht Saarbrücken, -zentrales Handelsregister-, Mainzerstr.178, 66121 Saarbrücken einzulegen.\nDer Widerspruch muss die Bezeichnung der angefochtenen Löschungsankündigung enthalten sowie die Erklärung, dass Widerspruch eingelegt wird. Er ist vom Widerspruchsführer oder seinem Bevollmächtigten zu unterzeichnen.\nDas Widerspruchsschreiben kann auch in der Form eines elektronischen Dokumentes eingereicht werden, das mit einer qualifizierten elektronischen Signatur nach dem Signaturgesetz versehen sein muss (§§ 14 Abs. 2 FamFG, 130a, 298 ZPO)."
    },
    {
      "date": "2025-02-17",
      "id": "101463",
      "original_text": "Registerbekanntmachung nach dem Umwandlungsgesetz\nBaden-Württemberg Amtsgericht Ulm HRA 728287\nSolarpark Hetzenfeld GmbH & Co. KG – Dornstadt",
      "type": "Registerbekanntmachung nach dem Umwandlungsgesetz",
      "state": "Baden-Württemberg",
      "amtsgericht": "Amtsgericht Ulm",
      "registernummer": "HRA 728287",
      "registerart": "HRA",
      "company_name": "Solarpark Hetzenfeld GmbH & Co. KG",
      "company_seat": "Dornstadt",
      "details": "17.02.2025 (Bekanntmachungsdatum)\n\nBaden-Württemberg Amtsgericht Ulm HRA 728287\nRegisterbekanntmachung nach dem Umwandlungsgesetz 17.02.2025 (Eintragungsdatum)\n\nSolarpark Hetzenfeld GmbH & Co. KG\nKommanditgesellschaft\nDornstadt\n\nDen Gläubigern der an der Verschmelzung beteiligten Rechtsträger ist, wenn sie binnen sechs Monaten nach dem Tag, an dem die Eintragung der Verschmelzung in das Register des Sitzes desjenigen Rechtsträgers, dessen Gläubiger sie sind, nach § 19 Abs. 3 UmwG als bekanntgemacht gilt, ihren Anspruch nach Grund und Höhe schriftlich anmelden, Sicherheit zu leisten, soweit sie nicht Befriedigung verlangen können. Dieses Recht steht den Gläubigern jedoch nur zu, wenn sie glaubhaft machen, dass durch die Verschmelzung die Erfüllung ihrer Forderung gefährdet wird."
    },
    {
      "date": "2025-02-17",
      "id": "101464",
      "original_text": "Einreichung neuer Dokumente\nBerlin Amtsgericht Berlin (Charlottenburg) HRB 129113\nPink Butea Property GmbH – Berlin",
      "type": "Einreichung neuer Dokumente",
      "state": "Berlin",
      "amtsgericht": "Amtsgericht Berlin (Charlottenburg)",
      "registernummer": "HRB 129113",
      "registerart": "HRB",
      "company_name": "Pink Butea Property GmbH",
      "company_seat": "Berlin",
      "details": "17.02.2025 (Bekanntmachungsdatum)\n\nBerlin Amtsgericht Berlin (Charlottenburg) HRB 129113\nEinreichung neuer Dokumente\n\nPink Butea Property GmbH\nGesellschaft mit beschränkter Haftung\nBerlin\n\nAls nicht eingetragen wird veröffentlicht: Bekanntmachung des Formwechselplans gemäß §§ 336, 308 UmwG, § 10 HGB\nDie Gesellschaft hat einen notariell beurkundeten Formwechselplan vom 06.02.2025 betreffend die grenzüberschreitende Verlegung des Satzungssitzes der Gesellschaft nach Luxemburg gemäß §§ 333 ff. UmwG zum Handelsregister des Amtsgerichts Charlottenburg eingereicht.\n1.1.1 Formwechselplan\nDer notariell beurkundete Formwechselplan wurde elektronisch zum Handelsregister eingereicht.\n1.1.2 Rechtsform, Firma und Sitz der formwechselnden Gesellschaft\nDie Gesellschaft ist eine deutsche Gesellschaft mit beschränkter Haftung unter der Firma Pink Butea Property GmbH, errichtet und bestehend nach deutschem Recht, mit Sitz in Berlin, Deutschland, eingetragen im Handelsregister des Amtsgerichts Charlottenburg unter HRB 129113 B.\nDie Gesellschaft soll durch grenzüberschreitenden, identitätswahrenden Formwechsel aufgrund eines Formwechselbeschlusses unter gleichzeitiger Verlegung des Satzungssitzes in eine Gesellschaft mit beschränkter Haftung nach dem Recht des Großherzogtums Luxemburg (société à responsabilité limitée) mit Sitz in Luxemburg, Großherzogtum Luxemburg, umgewandelt werden. Die Gesellschaft wird die Firma Pink Butea Property S.à r.l. führen.\n1.1.3 Register der formwechselnden Gesellschaft\nDie an dem grenzüberschreitenden Formwechsel beteiligte Gesellschaft ist unter HRB 129113 B im Handelsregister des Amtsgerichts Charlottenburg eingetragen.\n1.1.4 Hinweis an die Anteilsinhaber und Gläubiger\nDem Gesellschafter und den Gläubigern der Gesellschaft wird mitgeteilt, dass sie der Gesellschaft spätestens fünf Tage vor dem Tag der Gesellschafterversammlung Bemerkungen zu dem beim Handelsregister eingereichten Formwechselplan übermitteln können.\n1.1.5 Hinweis an die zuständigen Betriebsräte und Arbeitnehmer der Gesellschaft\nDie Gesellschaft hat keine Arbeitnehmer und verfügt über keinen Betriebsrat oder eine sonstige Arbeitnehmervertretung.\n1.1.6 Gläubiger der Gesellschaft\nDie Rechte der Gläubiger der formwechselnden Gesellschaft ergeben sich aus §§ 341, 314 UmwG. Danach ist den Gläubigern der formwechselnden Gesellschaft Sicherheit zu leisten, soweit sie nicht Befriedigung verlangen können, wenn die neue Rechtsform nicht dem deutschen Recht unterliegt. Dieses Recht steht den Gläubigern jedoch nur zu, wenn sie binnen drei Monaten nach dem Tag, an dem der Formwechselplan (oder sein Entwurf) bekannt gemacht worden ist, ihre Ansprüche gerichtlich geltend machen. Dieses Recht auf Sicherheitsleistung steht Gläubigern nur im Hinblick auf solche Forderungen zu, die vor der Bekanntmachung des Formwechselplans oder seines Entwurfs entstanden, aber im Zeitpunkt der Bekanntmachung noch nicht fällig geworden sind, und deren Erfüllung durch den Formwechsel gefährdet wird."
    },
    {
      "date": "2025-02-17",
      "id": "101465",
      "original_text": "Registerbekanntmachung nach dem Umwandlungsgesetz\nBaden-Württemberg Amtsgericht Ulm HRB 552247\nC`vis Solution GmbH – Ravensburg",
      "type": "Registerbekanntmachung nach dem Umwandlungsgesetz",
      "state": "Baden-Württemberg",
      "amtsgericht": "Amtsgericht Ulm",
      "registernummer": "HRB 552247",
      "registerart": "HRB",
      "company_name": "C`vis Solution GmbH",
      "company_seat": "Ravensburg",
      "details": "17.02.2025 (Bekanntmachungsdatum)\n\nBaden-Württemberg Amtsgericht Ulm HRB 552247\nRegisterbekanntmachung nach dem Umwandlungsgesetz 17.02.2025 (Eintragungsdatum)\n\nC`vis Solution GmbH\nGesellschaft mit beschränkter Haftung\nRavensburg\n\nAls nicht eingetragen wird bekanntgemacht:\nDen Gläubigern der an der Verschmelzung beteiligten Rechtsträger ist, wenn sie binnen sechs Monaten nach dem Tag, an dem die Eintragung der Verschmelzung in das Register des Sitzes desjenigen Rechtsträgers, dessen Gläubiger sie sind, nach § 19 Abs. 3 UmwG als bekanntgemacht gilt, ihren Anspruch nach Grund und Höhe schriftlich anmelden, Sicherheit zu leisten, soweit sie nicht Befriedigung verlangen können. Dieses Recht steht den Gläubigern jedoch nur zu, wenn sie glaubhaft machen, dass durch die Verschmelzung die Erfüllung ihrer Forderung gefährdet wird."
    },
    {
      "date": "2025-02-17",
      "id": "101466",
      "original_text": "Registerbekanntmachung nach dem Umwandlungsgesetz\nBaden-Württemberg Amtsgericht Ulm HRB 745031\nBRAIVO GmbH – Ravensburg",
      "type": "Registerbekanntmachung nach dem Umwandlungsgesetz",
      "state": "Baden-Württemberg",
      "amtsgericht": "Amtsgericht Ulm",
      "registernummer": "HRB 745031",
      "registerart": "HRB",
      "company_name": "BRAIVO GmbH",
      "company_seat": "Ravensburg",
      "details": "17.02.2025 (Bekanntmachungsdatum)\n\nBaden-Württemberg Amtsgericht Ulm HRB 745031\nRegisterbekanntmachung nach dem Umwandlungsgesetz 17.02.2025 (Eintragungsdatum)\n\nBRAIVO GmbH\nGesellschaft mit beschränkter Haftung\nRavensburg\n\nAls nicht eingetragen wird bekanntgemacht:\nDen Gläubigern der an der Verschmelzung beteiligten Rechtsträger ist, wenn sie binnen sechs Monaten nach dem Tag, an dem die Eintragung der Verschmelzung in das Register des Sitzes desjenigen Rechtsträgers, dessen Gläubiger sie sind, nach § 19 Abs. 3 UmwG als bekanntgemacht gilt, ihren Anspruch nach Grund und Höhe schriftlich anmelden, Sicherheit zu leisten, soweit sie nicht Befriedigung verlangen können. Dieses Recht steht den Gläubigern jedoch nur zu, wenn sie glaubhaft machen, dass durch die Verschmelzung die Erfüllung ihrer Forderung gefährdet wird."
    },
    {
      "date": "2025-02-17",
      "id": "101467",
      "original_text": "Einreichung neuer Dokumente\nBaden-Württemberg Amtsgericht Stuttgart HRB 108062\nEisenwerk Würth GmbH – Bad Friedrichshall",
      "type": "Einreichung neuer Dokumente",
      "state": "Baden-Württemberg",
      "amtsgericht": "Amtsgericht Stuttgart",
      "registernummer": "HRB 108062",
      "registerart": "HRB",
      "company_name": "Eisenwerk Würth GmbH",
      "company_seat": "Bad Friedrichshall",
      "details": "17.02.2025 (Bekanntmachungsdatum)\n\nBaden-Württemberg Amtsgericht Stuttgart HRB 108062\nEinreichung neuer Dokumente\n\nEisenwerk Würth GmbH\nGesellschaft mit beschränkter Haftung\nBad Friedrichshall\n\nDie Gesellschaft hat am 06.02.2025 die Liste über die Zusammensetzung des Aufsichtsrats zum Handelsregister eingereicht."
    },
    {
      "date": "2025-02-17",
      "id": "101468",
      "original_text": "Registerbekanntmachung nach dem Umwandlungsgesetz\nBaden-Württemberg Amtsgericht Stuttgart HRB 798068\nBK Kleve Gastronomie GmbH – Rottweil",
      "type": "Registerbekanntmachung nach dem Umwandlungsgesetz",
      "state": "Baden-Württemberg",
      "amtsgericht": "Amtsgericht Stuttgart",
      "registernummer": "HRB 798068",
      "registerart": "HRB",
      "company_name": "BK Kleve Gastronomie GmbH",
      "company_seat": "Rottweil",
      "details": "17.02.2025 (Bekanntmachungsdatum)\n\nBaden-Württemberg Amtsgericht Stuttgart HRB 798068\nRegisterbekanntmachung nach dem Umwandlungsgesetz 17.02.2025 (Eintragungsdatum)\n\nBK Kleve Gastronomie GmbH\nGesellschaft mit beschränkter Haftung\nRottweil\n\nDen Gläubigern der an der Verschmelzung beteiligten Rechtsträger ist, wenn sie binnen sechs Monaten nach dem Tag, an dem die Eintragung der Verschmelzung in das Register des Sitzes desjenigen Rechtsträgers, dessen Gläubiger sie sind, nach § 19 Abs. 3 UmwG als bekanntgemacht gilt, ihren Anspruch nach Grund und Höhe schriftlich anmelden, Sicherheit zu leisten, soweit sie nicht Befriedigung verlangen können. Dieses Recht steht den Gläubigern jedoch nur zu, wenn sie glaubhaft machen, dass durch die Verschmelzung die Erfüllung ihrer Forderung gefährdet wird."
    },
    {
      "date": "2025-02-17",
      "id": "101469",
      "original_text": "Einreichung neuer Dokumente\nBerlin Amtsgericht Berlin (Charlottenburg) HRB 75459\nAWIN AG – Berlin",
      "type": "Einreichung neuer Dokumente",
      "state": "Berlin",
      "amtsgericht": "Amtsgericht Berlin (Charlottenburg)",
      "registernummer": "HRB 75459",
      "registerart": "HRB",
      "company_name": "AWIN AG",
      "company_seat": "Berlin",
      "details": "17.02.2025 (Bekanntmachungsdatum)\n\nBerlin Amtsgericht Berlin (Charlottenburg) HRB 75459\nEinreichung neuer Dokumente\n\nAWIN AG\nAktiengesellschaft\nBerlin\n\nAls nicht eingetragen wird veröffentlicht: Es wurde eine neue Liste der Aufsichtsratsmitglieder eingereicht (§ 106 AktG)."
    },
    {
      "date": "2025-02-17",
      "id": "101470",
      "original_text": "Registerbekanntmachung nach dem Umwandlungsgesetz\nSachsen Amtsgericht Leipzig HRB 31975\nM&L Projektgesellschaft mbH – Leipzig",
      "type": "Registerbekanntmachung nach dem Umwandlungsgesetz",
      "state": "Sachsen",
      "amtsgericht": "Amtsgericht Leipzig",
      "registernummer": "HRB 31975",
      "registerart": "HRB",
      "company_name": "M&L Projektgesellschaft mbH",
      "company_seat": "Leipzig",
      "details": "17.02.2025 (Bekanntmachungsdatum)\n\nSachsen Amtsgericht Leipzig HRB 31975\nRegisterbekanntmachung nach dem Umwandlungsgesetz 17.02.2025 (Eintragungsdatum)\n\nM&L Projektgesellschaft mbH\nGesellschaft mit beschränkter Haftung\nLeipzig\n\nDen Gläubigern der an der Verschmelzung beteiligten Rechtsträger ist, wenn sie binnen sechs Monaten nach dem Tag, an dem die Eintragung der Verschmelzung in das Register des Sitzes desjenigen Rechtsträgers, dessen Gläubiger sie sind, nach § 19 Abs. 3 UmwG als bekannt gemacht gilt, ihren Anspruch nach Grund und Höhe in Textform anmelden, Sicherheit zu leisten, soweit sie nicht Befriedigung verlangen können. Dieses Recht steht den Gläubigern jedoch nur zu, wenn sie glaubhaft machen, dass durch die Verschmelzung die Erfüllung der Forderung gefährdet wird."
    },
    {
      "date": "2025-02-17",
      "id": "101471",
      "original_text": "Sonstige Registerbekanntmachung\nSachsen Amtsgericht Dresden GnR 132\nVolksbank Pirna eG – Pirna",
      "type": "Sonstige Registerbekanntmachung",
      "state": "Sachsen",
      "amtsgericht": "Amtsgericht Dresden",
      "registernummer": "GnR 132",
      "registerart": "GnR",
      "company_name": "Volksbank Pirna eG",
      "company_seat": "Pirna",
      "details": "17.02.2025 (Bekanntmachungsdatum)\n\nSachsen Amtsgericht Dresden GnR 132\nSonstige Registerbekanntmachung 17.02.2025 (Eintragungsdatum)\n\nVolksbank Pirna eG\neingetragene Genossenschaft\nPirna\n\nDen Gläubigern der Genossenschaft ist gemäß § 22 GenG, wenn sie sich binnen sechs Monaten nach der Bekanntmachung bei der Genossenschaft zu diesem Zweck melden, Sicherheit zu leisten, soweit sie nicht Befriedigung verlangen können."
    },
    {
      "date": "2025-02-17",
      "id": "101472",
      "original_text": "Löschungsankündigung\nSachsen Amtsgericht Leipzig VR 5479\nhu toru e.V. – Leipzig",
      "type": "Löschungsankündigung",
      "state": "Sachsen",
      "amtsgericht": "Amtsgericht Leipzig",
      "registernummer": "VR 5479",
      "registerart": "VR",
      "company_name": "hu toru e.V.",
      "company_seat": "Leipzig",
      "details": "17.02.2025 (Bekanntmachungsdatum)\n\nSachsen Amtsgericht Leipzig VR 5479\nLöschungsankündigung\n\nhu toru e.V.\neingetragener Verein\nLeipzig\n\nDas Gericht beabsichtigt, gemäß § 4 Absatz 2 Ziffer 1 der Verordnung über das Vereinsregister das Registerblatt  des Vereins zu schließen, da nach den Ermittlungen des Gerichts sämtliche Mitglieder aus dem Verein ausgeschieden sind. Zur Geltendmachung eines Widerspruchs gegen die beabsichtigte Schließung wird eine Frist von einem Monat nach der Veröffentlichung bestimmt."
    },
    {
      "date": "2025-02-17",
      "id": "101473",
      "original_text": "Löschungsankündigung\nSachsen Amtsgericht Leipzig HRB 41093\niSquare Ventures UG (haftungsbeschränkt) – Leipzig",
      "type": "Löschungsankündigung",
      "state": "Sachsen",
      "amtsgericht": "Amtsgericht Leipzig",
      "registernummer": "HRB 41093",
      "registerart": "HRB",
      "company_name": "iSquare Ventures UG (haftungsbeschränkt)",
      "company_seat": "Leipzig",
      "details": "17.02.2025 (Bekanntmachungsdatum)\n\nSachsen Amtsgericht Leipzig HRB 41093\nLöschungsankündigung\n\niSquare Ventures UG (haftungsbeschränkt)\nGesellschaft mit beschränkter Haftung\nLeipzig\n\nDas Registergericht beabsichtigt, die im Handelsregister eingetragene Gesellschaft von Amts wegen nach § 394 FamFG zu löschen. Die Frist zu Erhebung eines Widerspruchs gegen die beabsichtigte Löschung wird auf einen Monat festgesetzt."
    },
    {
      "date": "2025-02-17",
      "id": "101474",
      "original_text": "Löschungsankündigung\nSachsen Amtsgericht Dresden HRA 5713\nAMW Automatisierungstechnik und Maschinenbau Wendisch GmbH & Co. KG – Freital",
      "type": "Löschungsankündigung",
      "state": "Sachsen",
      "amtsgericht": "Amtsgericht Dresden",
      "registernummer": "HRA 5713",
      "registerart": "HRA",
      "company_name": "AMW Automatisierungstechnik und Maschinenbau Wendisch GmbH & Co. KG",
      "company_seat": "Freital",
      "details": "17.02.2025 (Bekanntmachungsdatum)\n\nSachsen Amtsgericht Dresden HRA 5713\nLöschungsankündigung\n\nAMW Automatisierungstechnik und Maschinenbau Wendisch GmbH & Co. KG\nKommanditgesellschaft\nFreital\n\nDas Registergericht beabsichtigt, die im Handelsregister eingetragene Gesellschaft von Amts wegen nach § 394 FamFG zu löschen. Die Frist zu Erhebung eines Widerspruchs gegen die beabsichtigte Löschung wird auf einen Monat festgesetzt."
    },
    {
      "date": "2025-02-17",
      "id": "101475",
      "original_text": "Registerbekanntmachung nach dem Umwandlungsgesetz\nSachsen Amtsgericht Leipzig HRB 35630\nHackebornstraße Projekt UG (haftungsbeschränkt) – Leipzig",
      "type": "Registerbekanntmachung nach dem Umwandlungsgesetz",
      "state": "Sachsen",
      "amtsgericht": "Amtsgericht Leipzig",
      "registernummer": "HRB 35630",
      "registerart": "HRB",
      "company_name": "Hackebornstraße Projekt UG (haftungsbeschränkt)",
      "company_seat": "Leipzig",
      "details": "17.02.2025 (Bekanntmachungsdatum)\n\nSachsen Amtsgericht Leipzig HRB 35630\nRegisterbekanntmachung nach dem Umwandlungsgesetz 17.02.2025 (Eintragungsdatum)\n\nHackebornstraße Projekt UG (haftungsbeschränkt)\nGesellschaft mit beschränkter Haftung\nLeipzig\n\nDen Gläubigern der an der Verschmelzung beteiligten Rechtsträger ist, wenn sie binnen sechs Monaten nach dem Tag, an dem die Eintragung der Verschmelzung in das Register des Sitzes desjenigen Rechtsträgers, dessen Gläubiger sie sind, nach § 19 Abs. 3 UmwG als bekannt gemacht gilt, ihren Anspruch nach Grund und Höhe in Textform anmelden, Sicherheit zu leisten, soweit sie nicht Befriedigung verlangen können. Dieses Recht steht den Gläubigern jedoch nur zu, wenn sie glaubhaft machen, dass durch die Verschmelzung die Erfüllung der Forderung gefährdet wird."
    },
    {
      "date": "2025-02-17",
      "id": "101476",
      "original_text": "Löschungsankündigung\nSachsen Amtsgericht Leipzig VR 6579\nHilfe für Helfer - Leipzig e.V. – Leipzig",
      "type": "Löschungsankündigung",
      "state": "Sachsen",
      "amtsgericht": "Amtsgericht Leipzig",
      "registernummer": "VR 6579",
      "registerart": "VR",
      "company_name": "Hilfe für Helfer - Leipzig e.V.",
      "company_seat": "Leipzig",
      "details": "17.02.2025 (Bekanntmachungsdatum)\n\nSachsen Amtsgericht Leipzig VR 6579\nLöschungsankündigung\n\nHilfe für Helfer - Leipzig e.V.\neingetragener Verein\nLeipzig\n\nDas Gericht beabsichtigt, gemäß § 4 Absatz 2 Ziffer 1 der Verordnung über das Vereinsregister das Registerblatt  des Vereins zu schließen, da nach den Ermittlungen des Gerichts sämtliche Mitglieder aus dem Verein ausgeschieden sind. Zur Geltendmachung eines Widerspruchs gegen die beabsichtigte Schließung wird eine Frist von einem Monat nach der Veröffentlichung bestimmt."
    },
    {
      "date": "2025-02-17",
      "id": "101477",
      "original_text": "Registerbekanntmachung nach dem Umwandlungsgesetz\nNiedersachsen Amtsgericht Osnabrück HRB 219340\nBIOS Center UG (haftungsbeschränkt) – Wallenhorst",
      "type": "Registerbekanntmachung nach dem Umwandlungsgesetz",
      "state": "Niedersachsen",
      "amtsgericht": "Amtsgericht Osnabrück",
      "registernummer": "HRB 219340",
      "registerart": "HRB",
      "company_name": "BIOS Center UG (haftungsbeschränkt)",
      "company_seat": "Wallenhorst",
      "details": "17.02.2025 (Bekanntmachungsdatum)\n\nNiedersachsen Amtsgericht Osnabrück HRB 219340\nRegisterbekanntmachung nach dem Umwandlungsgesetz 17.02.2025 (Eintragungsdatum)\n\nBIOS Center UG (haftungsbeschränkt)\nGesellschaft mit beschränkter Haftung\nWallenhorst\n\nDen Gläubigern der an der Verschmelzung beteiligten Rechtsträger ist, wenn sie binnen sechs Monaten nach dem Tag, an dem die Eintragung der Verschmelzung in das Register des Sitzes desjenigen Rechtsträgers, dessen Gläubiger sie sind, nach § 19  Abs.  3 UmwG als bekannt gemacht gilt, ihren Anspruch nach Grund und Höhe schriftlich anmelden, Sicherheit zu leisten, soweit sie nicht Befriedigung verlangen können. Dieses Recht steht den Gläubigern jedoch nur zu, wenn sie glaubhaft machen, dass durch die Verschmelzung die Erfüllung der Forderung gefährdet wird."
    },
    {
      "date": "2025-02-17",
      "id": "101478",
      "original_text": "Registerbekanntmachung nach dem Umwandlungsgesetz\nNiedersachsen Amtsgericht Osnabrück HRB 200820\nBIOS Immobilien GmbH – Wallenhorst",
      "type": "Registerbekanntmachung nach dem Umwandlungsgesetz",
      "state": "Niedersachsen",
      "amtsgericht": "Amtsgericht Osnabrück",
      "registernummer": "HRB 200820",
      "registerart": "HRB",
      "company_name": "BIOS Immobilien GmbH",
      "company_seat": "Wallenhorst",
      "details": "17.02.2025 (Bekanntmachungsdatum)\n\nNiedersachsen Amtsgericht Osnabrück HRB 200820\nRegisterbekanntmachung nach dem Umwandlungsgesetz 17.02.2025 (Eintragungsdatum)\n\nBIOS Immobilien GmbH\nGesellschaft mit beschränkter Haftung\nWallenhorst\n\nDen Gläubigern der an der Verschmelzung beteiligten Rechtsträger ist, wenn sie binnen sechs Monaten nach dem Tag, an dem die Eintragung der Verschmelzung in das Register des Sitzes desjenigen Rechtsträgers, dessen Gläubiger sie sind, nach § 19  Abs.  3 UmwG als bekannt gemacht gilt, ihren Anspruch nach Grund und Höhe schriftlich anmelden, Sicherheit zu leisten, soweit sie nicht Befriedigung verlangen können. Dieses Recht steht den Gläubigern jedoch nur zu, wenn sie glaubhaft machen, dass durch die Verschmelzung die Erfüllung der Forderung gefährdet wird."
    },
    {
      "date": "2025-02-17",
      "id": "101479",
      "original_text": "Löschungsankündigung\nNiedersachsen Amtsgericht Osnabrück HRB 205059\nImbiss am Markt M. GmbH – Georgsmarienhütte",
      "type": "Löschungsankündigung",
      "state": "Niedersachsen",
      "amtsgericht": "Amtsgericht Osnabrück",
      "registernummer": "HRB 205059",
      "registerart": "HRB",
      "company_name": "Imbiss am Markt M. GmbH",
      "company_seat": "Georgsmarienhütte",
      "details": "17.02.2025 (Bekanntmachungsdatum)\n\nNiedersachsen Amtsgericht Osnabrück HRB 205059\nLöschungsankündigung\n\nImbiss am Markt M. GmbH\nGesellschaft mit beschränkter Haftung\nGeorgsmarienhütte\n\nDas Registergericht beabsichtigt, die Gesellschaft von Amts wegen nach § 394 FamFG wegen Vermögenslosigkeit zu löschen. Die Frist zur Erhebung eines Widerspruchs ist auf 1 Monat ab dieser Registerbekanntmachung festgesetzt."
    },
    {
      "date": "2025-02-17",
      "id": "101480",
      "original_text": "Löschungsankündigung\nNiedersachsen Amtsgericht Lüneburg HRB 208196\nJürgen Bollacke Speditions GmbH – Seevetal",
      "type": "Löschungsankündigung",
      "state": "Niedersachsen",
      "amtsgericht": "Amtsgericht Lüneburg",
      "registernummer": "HRB 208196",
      "registerart": "HRB",
      "company_name": "Jürgen Bollacke Speditions GmbH",
      "company_seat": "Seevetal",
      "details": "17.02.2025 (Bekanntmachungsdatum)\n\nNiedersachsen Amtsgericht Lüneburg HRB 208196\nLöschungsankündigung\n\nJürgen Bollacke Speditions GmbH\nGesellschaft mit beschränkter Haftung\nSeevetal\n\nDas Registergericht beabsichtigt, die Gesellschaft von Amts wegen nach § 394 FamFG zu löschen. Die Frist zur Erhebung eines Widerspruchs ist auf 1 Monat ab dieser Registerbekanntmachung festgesetzt."
    },
    {
      "date": "2025-02-17",
      "id": "101481",
      "original_text": "Einreichung neuer Dokumente\nNiedersachsen Amtsgericht Lüneburg GnR 200012\nZukunftsgenossen eG – Lüneburg",
      "type": "Einreichung neuer Dokumente",
      "state": "Niedersachsen",
      "amtsgericht": "Amtsgericht Lüneburg",
      "registernummer": "GnR 200012",
      "registerart": "GnR",
      "company_name": "Zukunftsgenossen eG",
      "company_seat": "Lüneburg",
      "details": "17.02.2025 (Bekanntmachungsdatum)\n\nNiedersachsen Amtsgericht Lüneburg GnR 200012\nEinreichung neuer Dokumente 13.02.2025 (Eintragungsdatum)\n\nZukunftsgenossen eG\neingetragene Genossenschaft\nLüneburg\n\nEine aktuelle Liste der Mitglieder des Aufsichtsrats ist zum Genossenschaftsregister eingereicht."
    },
    {
      "date": "2025-02-17",
      "id": "101482",
      "original_text": "Löschungsankündigung\nNiedersachsen Amtsgericht Stadthagen HRB 201017\nKracke die Möbelmanufaktur GmbH – Hülsede",
      "type": "Löschungsankündigung",
      "state": "Niedersachsen",
      "amtsgericht": "Amtsgericht Stadthagen",
      "registernummer": "HRB 201017",
      "registerart": "HRB",
      "company_name": "Kracke die Möbelmanufaktur GmbH",
      "company_seat": "Hülsede",
      "details": "17.02.2025 (Bekanntmachungsdatum)\n\nNiedersachsen Amtsgericht Stadthagen HRB 201017\nLöschungsankündigung\n\nKracke die Möbelmanufaktur GmbH\nGesellschaft mit beschränkter Haftung\nHülsede\n\nDas Registergericht beabsichtigt, die Gesellschaft von Amts wegen nach § 394 FamFG zu löschen. Die Frist zur Erhebung eines Widerspruchs ist auf 1 Monat ab dieser Registerbekanntmachung festgesetzt."
    },
    {
      "date": "2025-02-17",
      "id": "101483",
      "original_text": "Sonstige Registerbekanntmachung\nNiedersachsen Amtsgericht Walsrode HRB 202292\nHeide Sportzentrum Bad Fallingbostel UG (haftungsbeschränkt) – Bad Fallingbostel",
      "type": "Sonstige Registerbekanntmachung",
      "state": "Niedersachsen",
      "amtsgericht": "Amtsgericht Walsrode",
      "registernummer": "HRB 202292",
      "registerart": "HRB",
      "company_name": "Heide Sportzentrum Bad Fallingbostel UG (haftungsbeschränkt)",
      "company_seat": "Bad Fallingbostel",
      "details": "17.02.2025 (Bekanntmachungsdatum)\n\nNiedersachsen Amtsgericht Walsrode HRB 202292\nSonstige Registerbekanntmachung\n\nHeide Sportzentrum Bad Fallingbostel UG (haftungsbeschränkt)\nGesellschaft mit beschränkter Haftung\nBad Fallingbostel\n\nEs ist beabsichtigt, die Gesellschaft wegen Vermögenslosigkeit von Amts wegen im Handelsregister zu löschen (§ 394 FamFG).\nBis zum 19.05.2025 können Sie beim Amtsgericht Walsrode gegen die angekündigte Löschung schriftlich oder zu Protokoll der Geschäftsstelle Widerspruch unter Angabe von Gründen erheben."
    },
    {
      "date": "2025-02-17",
      "id": "101484",
      "original_text": "Einreichung neuer Dokumente\nRheinland-Pfalz Amtsgericht Mainz HRB 23260\nBoehringer Ingelheim Deutschland GmbH – Ingelheim am Rhein",
      "type": "Einreichung neuer Dokumente",
      "state": "Rheinland-Pfalz",
      "amtsgericht": "Amtsgericht Mainz",
      "registernummer": "HRB 23260",
      "registerart": "HRB",
      "company_name": "Boehringer Ingelheim Deutschland GmbH",
      "company_seat": "Ingelheim am Rhein",
      "details": "17.02.2025 (Bekanntmachungsdatum)\n\nRheinland-Pfalz Amtsgericht Mainz HRB 23260\nEinreichung neuer Dokumente\n\nBoehringer Ingelheim Deutschland GmbH\nGesellschaft mit beschränkter Haftung\nIngelheim am Rhein\n\nDem Registergericht ist eine neue Liste der Mitglieder des Aufsichtsrates eingereicht worden."
    },
    {
      "date": "2025-02-17",
      "id": "101485",
      "original_text": "Löschungsankündigung\nRheinland-Pfalz Amtsgericht Mainz HRB 46727\nJK Gesundheit Plus GmbH – Nieder-Olm",
      "type": "Löschungsankündigung",
      "state": "Rheinland-Pfalz",
      "amtsgericht": "Amtsgericht Mainz",
      "registernummer": "HRB 46727",
      "registerart": "HRB",
      "company_name": "JK Gesundheit Plus GmbH",
      "company_seat": "Nieder-Olm",
      "details": "17.02.2025 (Bekanntmachungsdatum)\n\nRheinland-Pfalz Amtsgericht Mainz HRB 46727\nLöschungsankündigung\n\nJK Gesundheit Plus GmbH\nGesellschaft mit beschränkter Haftung\nNieder-Olm\n\nDas Registergericht beabsichtigt die Eintragung des Geschäftsführer Herr Zheng von Amts wegen nach § 395 FamFG zu löschen. Die Frist zur Erhebung eines Widerspruchs ist auf einen Monat festgesetzt."
    },
    {
      "date": "2025-02-17",
      "id": "101486",
      "original_text": "Einreichung neuer Dokumente\nRheinland-Pfalz Amtsgericht Mainz HRB 51099\nSCHOTT Pharma Management AG – Mainz",
      "type": "Einreichung neuer Dokumente",
      "state": "Rheinland-Pfalz",
      "amtsgericht": "Amtsgericht Mainz",
      "registernummer": "HRB 51099",
      "registerart": "HRB",
      "company_name": "SCHOTT Pharma Management AG",
      "company_seat": "Mainz",
      "details": "17.02.2025 (Bekanntmachungsdatum)\n\nRheinland-Pfalz Amtsgericht Mainz HRB 51099\nEinreichung neuer Dokumente\n\nSCHOTT Pharma Management AG\nAktiengesellschaft\nMainz\n\nDem Registergericht ist eine Liste der Mitglieder des Aufsichtsrates eingereicht worden."
    },
    {
      "date": "2025-02-17",
      "id": "101487",
      "original_text": "Sonstige Registerbekanntmachung\nRheinland-Pfalz Amtsgericht Montabaur HRB 25154\nBirkenstock Productions Sachsen GmbH – Linz am Rhein",
      "type": "Sonstige Registerbekanntmachung",
      "state": "Rheinland-Pfalz",
      "amtsgericht": "Amtsgericht Montabaur",
      "registernummer": "HRB 25154",
      "registerart": "HRB",
      "company_name": "Birkenstock Productions Sachsen GmbH",
      "company_seat": "Linz am Rhein",
      "details": "17.02.2025 (Bekanntmachungsdatum)\n\nRheinland-Pfalz Amtsgericht Montabaur HRB 25154\nSonstige Registerbekanntmachung\n\nBirkenstock Productions Sachsen GmbH\nGesellschaft mit beschränkter Haftung\nLinz am Rhein\n\nDem Registergericht ist eine Liste der Mitglieder des Aufsichtsrates eingereicht worden."
    },
    {
      "date": "2025-02-17",
      "id": "101488",
      "original_text": "Löschungsankündigung\nNordrhein-Westfalen Amtsgericht Siegburg HRB 5796\nNieschalke GmbH – Troisdorf",
      "type": "Löschungsankündigung",
      "state": "Nordrhein-Westfalen",
      "amtsgericht": "Amtsgericht Siegburg",
      "registernummer": "HRB 5796",
      "registerart": "HRB",
      "company_name": "Nieschalke GmbH",
      "company_seat": "Troisdorf",
      "details": "17.02.2025 (Bekanntmachungsdatum)\n\nNordrhein-Westfalen Amtsgericht Siegburg HRB 5796\nLöschungsankündigung\n\nNieschalke GmbH\nGesellschaft mit beschränkter Haftung\nTroisdorf\n\nDas Registergericht hat glaubhafte Kenntnis erlangt, dass die Gesellschaft vermögenslos geworden ist, da ein Insolvenzverfahren durchgeführt und nach § 200 InsO aufgehoben wurde.\n\nEs ist daher beabsichtigt, die Gesellschaft nach § 394 FamFG im Handelsregister wegen Vermögenslosigkeit zu löschen. Einwände gegen die Löschung sind durch Widerspruch binnen einer Frist von 3 Monaten geltend zu machen, andernfalls die Löschung erfolgen wird.\n\nEinzulegen ist der Widerspruch bei dem Amtsgericht Siegburg, Neue Poststraße 16, 53721 Siegburg, und zwar entweder schriftlich in deutscher Sprache oder mündlich zur Niederschrift der Geschäftsstelle. Der Widerspruch kann auch zur Niederschrift der Geschäftsstelle eines jeden Amtsgerichts abgegeben werden. Der Widerspruch ist binnen der in der Verfügung bestimmten Frist einzulegen. Die Frist ist nur gewahrt, wenn der Widerspruch rechtzeitig bei dem Amtsgericht Siegburg eingeht, auch wenn der Widerspruch zur Niederschrift der Geschäftsstelle eines anderen Amtsgerichts abgegeben wurde. Die Frist beginnt jeweils mit der schriftlichen Bekanntgabe der Verfügung an die Beteiligten. Kann die schriftliche Bekanntgabe an einen Beteiligten nicht bewirkt werden, beginnt die Frist spätestens mit Ablauf von fünf Monaten nach Erlass der Verfügung. Die Bekanntgabe ist entweder durch Zustellung oder am dritten Tage nach Aufgabe zur Post bewirkt.\n\nSofern die Löschung noch nicht erfolgt ist, kann der Widerspruch auch noch nach Ablauf der Frist eingelegt werden. Fällt das Ende der Frist auf einen Sonnabend, einen Sonntag oder einen allgemeinen Feiertag, endet die Frist mit Ablauf des nächsten Werktages. Der Widerspruch ist zu unterzeichnen. Eine Begründung des Widerspruchs ist nicht vorgeschrieben."
    },
    {
      "date": "2025-02-17",
      "id": "101489",
      "original_text": "Einreichung neuer Dokumente\nNordrhein-Westfalen Amtsgericht Mönchengladbach HRB 8246\nLukson Aktiengesellschaft – Mönchengladbach",
      "type": "Einreichung neuer Dokumente",
      "state": "Nordrhein-Westfalen",
      "amtsgericht": "Amtsgericht Mönchengladbach",
      "registernummer": "HRB 8246",
      "registerart": "HRB",
      "company_name": "Lukson Aktiengesellschaft",
      "company_seat": "Mönchengladbach",
      "details": "17.02.2025 (Bekanntmachungsdatum)\n\nNordrhein-Westfalen Amtsgericht Mönchengladbach HRB 8246\nEinreichung neuer Dokumente 17.02.2025 (Eintragungsdatum)\n\nLukson Aktiengesellschaft\nAktiengesellschaft\nMönchengladbach\n\nDem Registergericht ist eine neue Liste der Mitglieder des Aufsichtsrates eingereicht worden."
    },
    {
      "date": "2025-02-17",
      "id": "101490",
      "original_text": "Löschungsankündigung\nNordrhein-Westfalen Amtsgericht Köln HRB 67028\nXinfeng Handels GmbH – Köln",
      "type": "Löschungsankündigung",
      "state": "Nordrhein-Westfalen",
      "amtsgericht": "Amtsgericht Köln",
      "registernummer": "HRB 67028",
      "registerart": "HRB",
      "company_name": "Xinfeng Handels GmbH",
      "company_seat": "Köln",
      "details": "17.02.2025 (Bekanntmachungsdatum)\n\nNordrhein-Westfalen Amtsgericht Köln HRB 67028\nLöschungsankündigung\n\nXinfeng Handels GmbH\nGesellschaft mit beschränkter Haftung\nKöln\n\nDas Registergericht beabsichtigt die Gesellschaft von Amts wegen nach § 394 FamFG zu löschen. Die Frist zur Erhebung eines Widerspruchs ist auf einen Monat festgesetzt."
    },
    {
      "date": "2025-02-17",
      "id": "101491",
      "original_text": "Löschungsankündigung\nRheinland-Pfalz Amtsgericht Mainz HRB 44621\nCWU GmbH – Mainz",
      "type": "Löschungsankündigung",
      "state": "Rheinland-Pfalz",
      "amtsgericht": "Amtsgericht Mainz",
      "registernummer": "HRB 44621",
      "registerart": "HRB",
      "company_name": "CWU GmbH",
      "company_seat": "Mainz",
      "details": "17.02.2025 (Bekanntmachungsdatum)\n\nRheinland-Pfalz Amtsgericht Mainz HRB 44621\nLöschungsankündigung\n\nCWU GmbH\nGesellschaft mit beschränkter Haftung\nMainz\n\nDas Registergericht beabsichtigt die Gesellschaft von Amts wegen nach § 394 FamFG zu löschen. Die Frist zur Erhebung eines Widerspruchs ist auf einen Monat festgesetzt."
    },
    {
      "date": "2025-02-17",
      "id": "101492",
      "original_text": "Registerbekanntmachung nach dem Umwandlungsgesetz\nNordrhein-Westfalen Amtsgericht Steinfurt HRB 14733\nBlumenthal Capital GmbH – Rheine",
      "type": "Registerbekanntmachung nach dem Umwandlungsgesetz",
      "state": "Nordrhein-Westfalen",
      "amtsgericht": "Amtsgericht Steinfurt",
      "registernummer": "HRB 14733",
      "registerart": "HRB",
      "company_name": "Blumenthal Capital GmbH",
      "company_seat": "Rheine",
      "details": "17.02.2025 (Bekanntmachungsdatum)\n\nNordrhein-Westfalen Amtsgericht Steinfurt HRB 14733\nRegisterbekanntmachung nach dem Umwandlungsgesetz 17.02.2025 (Eintragungsdatum)\n\nBlumenthal Capital GmbH\nGesellschaft mit beschränkter Haftung\nRheine\n\nDen Gläubigern der an der Verschmelzung beteiligten Rechtsträger ist, wenn sie binnen sechs Monaten nach dem Tag, an dem die Eintragung der Verschmelzung in das Register des Sitzes desjenigen Rechtsträgers, dessen Gläubiger sie sind, nach § 19 Absatz 3 UmwG als bekanntgemacht gilt, ihren Anspruch nach Grund und Höhe schriftlich anmelden, Sicherheit zu leisten, soweit sie nicht Befriedigung verlangen können. Dieses Recht steht den Gläubigern jedoch nur zu, wenn sie glaubhaft machen, dass durch die Verschmelzung die Erfüllung ihrer Forderung gefährdet wird."
    },
    {
      "date": "2025-02-17",
      "id": "101493",
      "original_text": "Löschungsankündigung\nNordrhein-Westfalen Amtsgericht Siegburg HRB 16986\nTief- und Leitungsbau MSG Deutschland GmbH – Troisdorf",
      "type": "Löschungsankündigung",
      "state": "Nordrhein-Westfalen",
      "amtsgericht": "Amtsgericht Siegburg",
      "registernummer": "HRB 16986",
      "registerart": "HRB",
      "company_name": "Tief- und Leitungsbau MSG Deutschland GmbH",
      "company_seat": "Troisdorf",
      "details": "17.02.2025 (Bekanntmachungsdatum)\n\nNordrhein-Westfalen Amtsgericht Siegburg HRB 16986\nLöschungsankündigung\n\nTief- und Leitungsbau MSG Deutschland GmbH\nGesellschaft mit beschränkter Haftung\nTroisdorf\n\nDas Registergericht hat glaubhafte Kenntnis erlangt, dass die Gesellschaft vermögenslos geworden ist, da ein Insolvenzeröffnungsantrag mangels Masse nach § 26 InsO zurückgewiesen wurde.\n\nEs ist daher beabsichtigt, die Gesellschaft nach § 394 FamFG im Handelsregister wegen Vermögenslosigkeit zu löschen. Einwände gegen die Löschung sind durch Widerspruch binnen einer Frist von 3 Monaten geltend zu machen, andernfalls die Löschung erfolgen wird.\n\nEinzulegen ist der Widerspruch bei dem Amtsgericht Siegburg, Neue Poststraße 16, 53721 Siegburg, und zwar entweder schriftlich in deutscher Sprache oder mündlich zur Niederschrift der Geschäftsstelle. Der Widerspruch kann auch zur Niederschrift der Geschäftsstelle eines jeden Amtsgerichts abgegeben werden. Der Widerspruch ist binnen der in der Verfügung bestimmten Frist einzulegen. Die Frist ist nur gewahrt, wenn der Widerspruch rechtzeitig bei dem Amtsgericht Siegburg eingeht, auch wenn der Widerspruch zur Niederschrift der Geschäftsstelle eines anderen Amtsgerichts abgegeben wurde. Die Frist beginnt jeweils mit der schriftlichen Bekanntgabe der Verfügung an die Beteiligten. Kann die schriftliche Bekanntgabe an einen Beteiligten nicht bewirkt werden, beginnt die Frist spätestens mit Ablauf von fünf Monaten nach Erlass der Verfügung. Die Bekanntgabe ist entweder durch Zustellung oder am dritten Tage nach Aufgabe zur Post bewirkt.\n\nSofern die Löschung noch nicht erfolgt ist, kann der Widerspruch auch noch nach Ablauf der Frist eingelegt werden. Fällt das Ende der Frist auf einen Sonnabend, einen Sonntag oder einen allgemeinen Feiertag, endet die Frist mit Ablauf des nächsten Werktages. Der Widerspruch ist zu unterzeichnen. Eine Begründung des Widerspruchs ist nicht vorgeschrieben."
    },
    {
      "date": "2025-02-17",
      "id": "101494",
      "original_text": "Registerbekanntmachung nach dem Umwandlungsgesetz\nNordrhein-Westfalen Amtsgericht Gelsenkirchen HRB 18238\nFahrschule Bay GmbH – Gelsenkirchen",
      "type": "Registerbekanntmachung nach dem Umwandlungsgesetz",
      "state": "Nordrhein-Westfalen",
      "amtsgericht": "Amtsgericht Gelsenkirchen",
      "registernummer": "HRB 18238",
      "registerart": "HRB",
      "company_name": "Fahrschule Bay GmbH",
      "company_seat": "Gelsenkirchen",
      "details": "17.02.2025 (Bekanntmachungsdatum)\n\nNordrhein-Westfalen Amtsgericht Gelsenkirchen HRB 18238\nRegisterbekanntmachung nach dem Umwandlungsgesetz 17.02.2025 (Eintragungsdatum)\n\nFahrschule Bay GmbH\nGesellschaft mit beschränkter Haftung\nGelsenkirchen\n\nDen Gläubigern der an der Ausgliederung beteiligten Rechtsträger ist, wenn sie binnen sechs Monaten nach dem Tag, an dem die Eintragung der Ausgliederung in das Register des Sitzes desjenigen Rechtsträgers, dessen Gläubiger sie sind, nach § 19 Absatz 3 UmwG als bekanntgemacht gilt, ihren Anspruch nach Grund und Höhe schriftlich anmelden, Sicherheit zu leisten, soweit sie nicht Befriedigung verlangen können. Dieses Recht steht den Gläubigern jedoch nur zu, wenn sie glaubhaft machen, dass durch die Ausgliederung die Erfüllung ihrer Forderung gefährdet wird."
    },
    {
      "date": "2025-02-17",
      "id": "101495",
      "original_text": "Löschungsankündigung\nNordrhein-Westfalen Amtsgericht Köln HRB 113327\nMobea 24 UG (haftungsbeschränkt) – Köln",
      "type": "Löschungsankündigung",
      "state": "Nordrhein-Westfalen",
      "amtsgericht": "Amtsgericht Köln",
      "registernummer": "HRB 113327",
      "registerart": "HRB",
      "company_name": "Mobea 24 UG (haftungsbeschränkt)",
      "company_seat": "Köln",
      "details": "17.02.2025 (Bekanntmachungsdatum)\n\nNordrhein-Westfalen Amtsgericht Köln HRB 113327\nLöschungsankündigung\n\nMobea 24 UG (haftungsbeschränkt)\nGesellschaft mit beschränkter Haftung\nKöln\n\nDas Registergericht beabsichtigt die Gesellschaft von Amts wegen nach § 394 FamFG zu löschen. Die Frist zur Erhebung eines Widerspruchs ist auf einen Monat festgesetzt."
    },
    {
      "date": "2025-02-17",
      "id": "101496",
      "original_text": "Löschungsankündigung\nNordrhein-Westfalen Amtsgericht Hamm HRA 2271\nGodehardt Markisen GmbH & Co. KG – Unna",
      "type": "Löschungsankündigung",
      "state": "Nordrhein-Westfalen",
      "amtsgericht": "Amtsgericht Hamm",
      "registernummer": "HRA 2271",
      "registerart": "HRA",
      "company_name": "Godehardt Markisen GmbH & Co. KG",
      "company_seat": "Unna",
      "details": "17.02.2025 (Bekanntmachungsdatum)\n\nNordrhein-Westfalen Amtsgericht Hamm HRA 2271\nLöschungsankündigung\n\nGodehardt Markisen GmbH & Co. KG\nKommanditgesellschaft\nUnna\n\nDas Registergericht beabsichtigt die Firma von Amts wegen nach § 394 FamFG zu löschen. Die Frist zur Erhebung eines Widerspruchs ist auf einen Monat festgesetzt."
    },
    {
      "date": "2025-02-17",
      "id": "101497",
      "original_text": "Registerbekanntmachung nach dem Umwandlungsgesetz\nNordrhein-Westfalen Amtsgericht Steinfurt HRB 13959\nWeFin GmbH – Rheine",
      "type": "Registerbekanntmachung nach dem Umwandlungsgesetz",
      "state": "Nordrhein-Westfalen",
      "amtsgericht": "Amtsgericht Steinfurt",
      "registernummer": "HRB 13959",
      "registerart": "HRB",
      "company_name": "WeFin GmbH",
      "company_seat": "Rheine",
      "details": "17.02.2025 (Bekanntmachungsdatum)\n\nNordrhein-Westfalen Amtsgericht Steinfurt HRB 13959\nRegisterbekanntmachung nach dem Umwandlungsgesetz 17.02.2025 (Eintragungsdatum)\n\nWeFin GmbH\nGesellschaft mit beschränkter Haftung\nRheine\n\nDen Gläubigern der an der Verschmelzung beteiligten Rechtsträger ist, wenn sie binnen sechs Monaten nach dem Tag, an dem die Eintragung der Verschmelzung in das Register des Sitzes desjenigen Rechtsträgers, dessen Gläubiger sie sind, nach § 19 Absatz 3 UmwG als bekanntgemacht gilt, ihren Anspruch nach Grund und Höhe schriftlich anmelden, Sicherheit zu leisten, soweit sie nicht Befriedigung verlangen können. Dieses Recht steht den Gläubigern jedoch nur zu, wenn sie glaubhaft machen, dass durch die Verschmelzung die Erfüllung ihrer Forderung gefährdet wird."
    },
    {
      "date": "2025-02-17",
      "id": "101498",
      "original_text": "Registerbekanntmachung nach dem Umwandlungsgesetz\nNordrhein-Westfalen Amtsgericht Düsseldorf HRB 94353\nNFM Deutschland GmbH – Düsseldorf",
      "type": "Registerbekanntmachung nach dem Umwandlungsgesetz",
      "state": "Nordrhein-Westfalen",
      "amtsgericht": "Amtsgericht Düsseldorf",
      "registernummer": "HRB 94353",
      "registerart": "HRB",
      "company_name": "NFM Deutschland GmbH",
      "company_seat": "Düsseldorf",
      "details": "17.02.2025 (Bekanntmachungsdatum)\n\nNordrhein-Westfalen Amtsgericht Düsseldorf HRB 94353\nRegisterbekanntmachung nach dem Umwandlungsgesetz 17.02.2025 (Eintragungsdatum)\n\nNFM Deutschland GmbH\nGesellschaft mit beschränkter Haftung\nDüsseldorf\n\nDen Gläubigern der an der Verschmelzung beteiligten Rechtsträger ist, wenn sie binnen sechs Monaten nach dem Tag, an dem die Eintragung der Verschmelzung in das Register des Sitzes desjenigen Rechtsträgers, dessen Gläubiger sie sind, nach § 19 Absatz 3 UmwG als bekanntgemacht gilt, ihren Anspruch nach Grund und Höhe schriftlich anmelden, Sicherheit zu leisten, soweit sie nicht Befriedigung verlangen können. Dieses Recht steht den Gläubigern jedoch nur zu, wenn sie glaubhaft machen, dass durch die Verschmelzung die Erfüllung ihrer Forderung gefährdet wird."
    },
    {
      "date": "2025-02-17",
      "id": "101499",
      "original_text": "Löschungsankündigung\nNordrhein-Westfalen Amtsgericht Mönchengladbach HRB 15619\nHonour Technik & Service GmbH – Mönchengladbach",
      "type": "Löschungsankündigung",
      "state": "Nordrhein-Westfalen",
      "amtsgericht": "Amtsgericht Mönchengladbach",
      "registernummer": "HRB 15619",
      "registerart": "HRB",
      "company_name": "Honour Technik & Service GmbH",
      "company_seat": "Mönchengladbach",
      "details": "17.02.2025 (Bekanntmachungsdatum)\n\nNordrhein-Westfalen Amtsgericht Mönchengladbach HRB 15619\nLöschungsankündigung\n\nHonour Technik & Service GmbH\nGesellschaft mit beschränkter Haftung\nMönchengladbach\n\nHonour Technik & Service GmbH, Mönchengladbach (Amtsgericht Mönchengladbach, HRB 15619).\nDas Registergericht beabsichtigt, die im Handelsregister eingetragene Gesellschaft gemäß § 394 Absatz 1 FamFG wegen Vermögenslosigkeit von Amts wegen zu löschen. Gegen diese Verfügung kann Widerspruch eingelegt werden. Die Frist zur Erhebung eines Widerspruchs gegen die beabsichtigte Löschung von Amts wegen ist auf drei Monate festgesetzt."
    },
    {
      "date": "2025-02-17",
      "id": "101500",
      "original_text": "Löschungsankündigung\nNordrhein-Westfalen Amtsgericht Düsseldorf HRB 98956\nH-J-P Cateringfahrzeuge und Fahrzeugtechnik UG (haftungsbeschränkt) – Monheim am Rhein",
      "type": "Löschungsankündigung",
      "state": "Nordrhein-Westfalen",
      "amtsgericht": "Amtsgericht Düsseldorf",
      "registernummer": "HRB 98956",
      "registerart": "HRB",
      "company_name": "H-J-P Cateringfahrzeuge und Fahrzeugtechnik UG (haftungsbeschränkt)",
      "company_seat": "Monheim am Rhein",
      "details": "17.02.2025 (Bekanntmachungsdatum)\n\nNordrhein-Westfalen Amtsgericht Düsseldorf HRB 98956\nLöschungsankündigung\n\nH-J-P Cateringfahrzeuge und Fahrzeugtechnik UG (haftungsbeschränkt)\nGesellschaft mit beschränkter Haftung\nMonheim am Rhein\n\nDas Registergericht beabsichtigt die Gesellschaft von Amts wegen nach § 394 Abs. 1 FamFG zu löschen. Die Frist zur Erhebung eines Widerspruchs ist auf einen Monat festgesetzt.\n\nRechtsbehelfsbelehrung:\nDas Widerspruchsrecht steht jedem zu, der an der Unterlassung der Löschung ein berechtigtes Interesse hat. Der Widerspruch ist bei dem Amtsgericht Düsseldorf -Registergericht-, Werdener Straße 1, 40227 Düsseldorf schriftlich in deutscher Sprache oder zur Niederschrift der Geschäftsstelle einzulegen. Der Widerspruch kann auch zur Niederschrift der Geschäftsstelle eines jeden Amtsgerichtes abgegeben werden. Die Einlegung ist auch durch Übertragung eines elektronischen Dokuments an die elektronische Poststelle des Gerichts möglich. Das elektronische Dokument muss für die Bearbeitung durch das Gericht geeignet und mit einer qualifizierten elektronischen Signatur der verantwortenden Person versehen sein oder von der verantwortenden Person signiert und auf einem sicheren Übermittlungsweg gemäß § 130a ZPO nach näherer Maßgabe der Verordnung über die technischen Rahmenbedingungen des elektronischen Rechtsverkehrs und über das besondere elektronische Behördenpostfach (BGBl. I, S.3803) eingereicht werden. Weitere Informationen erhalten Sie auf der Internetseite www.justiz.de.\nDer Widerspruch muss spätestens innerhalb der gesetzten Frist nach dem Datum der Bekanntmachung der Löschungsankündigung bei dem Amtsgericht - Registergericht - Düsseldorf eingegangen sein.  Dies gilt auch dann, wenn der Widerspruch zur Niederschrift der Geschäftsstelle eines anderen Amtsgerichtes abgegeben wurde. Die Frist beginnt mit dem Tage der Bekanntmachung der Löschungsankündigung in dem für die Bekanntmachung der Eintragungen in das Handelsregister bestimmten elektronischen Informations- und Kommunikationssystem nach § 10 des Handelsgesetzbuches. Fällt das Ende der Frist auf einen Sonntag, einen allgemeinen Feiertag oder Sonnabend, so endet die Frist mit Ablauf des nächsten Werktages.\nDer Widerspruch muss die Bezeichnung der angefochtenen Löschungsankündigung sowie die Erklärung enthalten, dass Widerspruch gegen diese Löschungsankündigung eingelegt wird. Er ist zu unterzeichnen und soll begründet werden."
    },
    {
      "date": "2025-02-17",
      "id": "101501",
      "original_text": "Einreichung neuer Dokumente\nNordrhein-Westfalen Amtsgericht Köln HRB 48248\nBayer Aktiengesellschaft – Leverkusen",
      "type": "Einreichung neuer Dokumente",
      "state": "Nordrhein-Westfalen",
      "amtsgericht": "Amtsgericht Köln",
      "registernummer": "HRB 48248",
      "registerart": "HRB",
      "company_name": "Bayer Aktiengesellschaft",
      "company_seat": "Leverkusen",
      "details": "17.02.2025 (Bekanntmachungsdatum)\n\nNordrhein-Westfalen Amtsgericht Köln HRB 48248\nEinreichung neuer Dokumente\n\nBayer Aktiengesellschaft\nAktiengesellschaft\nLeverkusen\n\nDem Registergericht ist eine neue Liste der Mitglieder des Aufsichtsrates eingereicht worden."
    },
    {
      "date": "2025-02-17",
      "id": "101502",
      "original_text": "Einreichung neuer Dokumente\nNordrhein-Westfalen Amtsgericht Köln HRB 54183\nFord-Werke GmbH – Köln",
      "type": "Einreichung neuer Dokumente",
      "state": "Nordrhein-Westfalen",
      "amtsgericht": "Amtsgericht Köln",
      "registernummer": "HRB 54183",
      "registerart": "HRB",
      "company_name": "Ford-Werke GmbH",
      "company_seat": "Köln",
      "details": "17.02.2025 (Bekanntmachungsdatum)\n\nNordrhein-Westfalen Amtsgericht Köln HRB 54183\nEinreichung neuer Dokumente\n\nFord-Werke GmbH\nGesellschaft mit beschränkter Haftung\nKöln\n\nDem Registergericht ist eine neue Liste der Mitglieder des Aufsichtsrates eingereicht worden."
    },
    {
      "date": "2025-02-17",
      "id": "101503",
      "original_text": "Löschungsankündigung\nNordrhein-Westfalen Amtsgericht Bad Oeynhausen HRA 9629\nSchuhwerk Produktion & Handel UG (haftungsbeschränkt) & Co. KG – Löhne",
      "type": "Löschungsankündigung",
      "state": "Nordrhein-Westfalen",
      "amtsgericht": "Amtsgericht Bad Oeynhausen",
      "registernummer": "HRA 9629",
      "registerart": "HRA",
      "company_name": "Schuhwerk Produktion & Handel UG (haftungsbeschränkt) & Co. KG",
      "company_seat": "Löhne",
      "details": "17.02.2025 (Bekanntmachungsdatum)\n\nNordrhein-Westfalen Amtsgericht Bad Oeynhausen HRA 9629\nLöschungsankündigung\n\nSchuhwerk Produktion & Handel UG (haftungsbeschränkt) & Co. KG\nKommanditgesellschaft\nLöhne\n\nDas Registergericht beabsichtigt die Firma von Amts wegen nach § 31 Abs. 2 HGB, § 393 FamFG zu löschen. Die Frist zur Erhebung eines Widerspruchs ist auf einen Monat festgesetzt."
    },
    {
      "date": "2025-02-17",
      "id": "101504",
      "original_text": "Löschungsankündigung\nNordrhein-Westfalen Amtsgericht Paderborn HRB 12128\nBROKER international UG (haftungsbeschränkt) – Brakel",
      "type": "Löschungsankündigung",
      "state": "Nordrhein-Westfalen",
      "amtsgericht": "Amtsgericht Paderborn",
      "registernummer": "HRB 12128",
      "registerart": "HRB",
      "company_name": "BROKER international UG (haftungsbeschränkt)",
      "company_seat": "Brakel",
      "details": "17.02.2025 (Bekanntmachungsdatum)\n\nNordrhein-Westfalen Amtsgericht Paderborn HRB 12128\nLöschungsankündigung\n\nBROKER international UG (haftungsbeschränkt)\nGesellschaft mit beschränkter Haftung\nBrakel\n\nDas Registergericht beabsichtigt die Gesellschaft von Amts wegen nach § 394 FamFG zu löschen. Die Frist zur Erhebung eines Widerspruchs ist auf einen Monat festgesetzt."
    },
    {
      "date": "2025-02-17",
      "id": "101505",
      "original_text": "Einreichung neuer Dokumente\nNordrhein-Westfalen Amtsgericht Paderborn HRB 8747\nMZG Therapie GmbH – Bad Lippspringe",
      "type": "Einreichung neuer Dokumente",
      "state": "Nordrhein-Westfalen",
      "amtsgericht": "Amtsgericht Paderborn",
      "registernummer": "HRB 8747",
      "registerart": "HRB",
      "company_name": "MZG Therapie GmbH",
      "company_seat": "Bad Lippspringe",
      "details": "17.02.2025 (Bekanntmachungsdatum)\n\nNordrhein-Westfalen Amtsgericht Paderborn HRB 8747\nEinreichung neuer Dokumente 17.02.2025 (Eintragungsdatum)\n\nMZG Therapie GmbH\nGesellschaft mit beschränkter Haftung\nBad Lippspringe\n\nDem Registergericht ist eine neue Liste der Mitglieder des Aufsichtsrates eingereicht worden."
    },
    {
      "date": "2025-02-17",
      "id": "101506",
      "original_text": "Registerbekanntmachung nach dem Umwandlungsgesetz\nNordrhein-Westfalen Amtsgericht Düsseldorf HRB 94686\nURE WohnRaum II GmbH – Monheim am Rhein",
      "type": "Registerbekanntmachung nach dem Umwandlungsgesetz",
      "state": "Nordrhein-Westfalen",
      "amtsgericht": "Amtsgericht Düsseldorf",
      "registernummer": "HRB 94686",
      "registerart": "HRB",
      "company_name": "URE WohnRaum II GmbH",
      "company_seat": "Monheim am Rhein",
      "details": "17.02.2025 (Bekanntmachungsdatum)\n\nNordrhein-Westfalen Amtsgericht Düsseldorf HRB 94686\nRegisterbekanntmachung nach dem Umwandlungsgesetz 17.02.2025 (Eintragungsdatum)\n\nURE WohnRaum II GmbH\nGesellschaft mit beschränkter Haftung\nMonheim am Rhein\n\nDen Gläubigern der an der formwechselnden Umwandlung beteiligten Rechtsträger ist, wenn sie binnen sechs Monaten nach dem Tag, an dem die Eintragung der formwechselnden Umwandlung in das Register des Sitzes desjenigen Rechtsträgers, dessen Gläubiger sie sind, nach § 19 Absatz 3 UmwG als bekanntgemacht gilt, ihren Anspruch nach Grund und Höhe schriftlich anmelden, Sicherheit zu leisten, soweit sie nicht Befriedigung verlangen können. Dieses Recht steht den Gläubigern jedoch nur zu, wenn sie glaubhaft machen, dass durch die formwechselnden Umwandlung die Erfüllung ihrer Forderung gefährdet wird."
    },
    {
      "date": "2025-02-17",
      "id": "101507",
      "original_text": "Registerbekanntmachung nach dem Umwandlungsgesetz\nNordrhein-Westfalen Amtsgericht Gelsenkirchen HRA 6294\nFahrschule Mehmet Bay e.K. – Gelsenkirchen",
      "type": "Registerbekanntmachung nach dem Umwandlungsgesetz",
      "state": "Nordrhein-Westfalen",
      "amtsgericht": "Amtsgericht Gelsenkirchen",
      "registernummer": "HRA 6294",
      "registerart": "HRA",
      "company_name": "Fahrschule Mehmet Bay e.K.",
      "company_seat": "Gelsenkirchen",
      "details": "17.02.2025 (Bekanntmachungsdatum)\n\nNordrhein-Westfalen Amtsgericht Gelsenkirchen HRA 6294\nRegisterbekanntmachung nach dem Umwandlungsgesetz 17.02.2025 (Eintragungsdatum)\n\nFahrschule Mehmet Bay e.K.\nEinzelkaufmann / Einzelkauffrau\nGelsenkirchen\n\nDen Gläubigern der an der Ausgliederung beteiligten Rechtsträger ist, wenn sie binnen sechs Monaten nach dem Tag, an dem die Eintragung der Ausgliederung in das Register des Sitzes desjenigen Rechtsträgers, dessen Gläubiger sie sind, nach § 19 Absatz 3 UmwG als bekanntgemacht gilt, ihren Anspruch nach Grund und Höhe schriftlich anmelden, Sicherheit zu leisten, soweit sie nicht Befriedigung verlangen können. Dieses Recht steht den Gläubigern jedoch nur zu, wenn sie glaubhaft machen, dass durch die Ausgliederung die Erfüllung ihrer Forderung gefährdet wird."
    },
    {
      "date": "2025-02-17",
      "id": "101508",
      "original_text": "Löschungsankündigung\nNordrhein-Westfalen Amtsgericht Duisburg HRB 11770\nMCS International GmbH – Dinslaken",
      "type": "Löschungsankündigung",
      "state": "Nordrhein-Westfalen",
      "amtsgericht": "Amtsgericht Duisburg",
      "registernummer": "HRB 11770",
      "registerart": "HRB",
      "company_name": "MCS International GmbH",
      "company_seat": "Dinslaken",
      "details": "17.02.2025 (Bekanntmachungsdatum)\n\nNordrhein-Westfalen Amtsgericht Duisburg HRB 11770\nLöschungsankündigung\n\nMCS International GmbH\nGesellschaft mit beschränkter Haftung\nDinslaken\n\nHRB 11770:\nMCS International GmbH,\nDinslaken, Karlstraße 23-25, 46535 Dinslaken Das Registergericht beabsichtigt, die im Handelsregister eingetragene Gesellschaft gemäß § 394 Absatz 1 FamFG wegen Vermögenslosigkeit von Amts wegen zu löschen. Gegen diese Verfügung kann Widerspruch eingelegt werden. Die Frist zur Erhebung eines Widerspruchs gegen die beabsichtigte Löschung von Amts wegen ist auf drei Monate festgesetzt. Rechtsbehelfsbelehrung Der Widerspruch ist bei dem Amtsgericht Duisburg, Kardinal-Galen-Str. 124-132, 47058 Duisburg schriftlich in deutscher Sprache oder zur Niederschrift der Geschäftsstelle einzulegen. Der Widerspruch kann auch zur Niederschrift der Geschäftsstelle eines jeden Amtsgerichtes abgegeben werden. Die Einlegung ist auch durch Übertragung eines elektronischen Dokuments an die elektronische Poststelle des Gerichts möglich. Das elektronische Dokument muss für die Bearbeitung durch das Gericht geeignet und mit einer qualifizierten elektronischen Signatur der verantwortenden Person versehen sein oder von der verantwortenden Person signiert und auf einem sicheren Übermittlungsweg gemäß § 130 a ZPO nach näherer Maßgabe der Verordnung über die technischen Rahmenbedingungen des elektronischen Rechtsverkehrs und über das besondere elektronische Behördenpostfach (BGBl. I, S. 3803) eingereicht werden. Weitere Informationen erhalten Sie auf der Internetseite www.justiz.de <http://www.justiz.de>. Der Widerspruch muss spätestens innerhalb der gesetzten Frist bei dem Amtsgericht Duisburg eingegangen sein. Dies gilt auch dann, wenn der Widerspruch zur Niederschrift der Geschäftsstelle eines anderen Amtsgerichtes abgegeben wurde. Die Frist beginnt mit der Veröffentlichung. Fällt das Ende der Frist auf einen Sonntag, einen allgemeinen Feiertag oder Sonnabend, so endet die Frist mit Ablauf des nächsten Werktages. Der Widerspruch muss die Bezeichnung der angefochtenen Verfügung sowie die Erklärung enthalten, dass Widerspruch gegen diese Verfügung eingelegt wird. Er ist zu unterzeichnen und soll begründet werden."
    },
    {
      "date": "2025-02-17",
      "id": "101509",
      "original_text": "Einreichung neuer Dokumente\nNordrhein-Westfalen Amtsgericht Düsseldorf HRB 100592\nACM Deutschland AG – Düsseldorf",
      "type": "Einreichung neuer Dokumente",
      "state": "Nordrhein-Westfalen",
      "amtsgericht": "Amtsgericht Düsseldorf",
      "registernummer": "HRB 100592",
      "registerart": "HRB",
      "company_name": "ACM Deutschland AG",
      "company_seat": "Düsseldorf",
      "details": "17.02.2025 (Bekanntmachungsdatum)\n\nNordrhein-Westfalen Amtsgericht Düsseldorf HRB 100592\nEinreichung neuer Dokumente\n\nACM Deutschland AG\nAktiengesellschaft\nDüsseldorf\n\nDem Registergericht ist eine neue Liste der Mitglieder des Aufsichtsrates eingereicht worden."
    },
    {
      "date": "2025-02-17",
      "id": "101510",
      "original_text": "Löschungsankündigung\nNordrhein-Westfalen Amtsgericht Essen HRB 28070\nBIM GmbH – Essen",
      "type": "Löschungsankündigung",
      "state": "Nordrhein-Westfalen",
      "amtsgericht": "Amtsgericht Essen",
      "registernummer": "HRB 28070",
      "registerart": "HRB",
      "company_name": "BIM GmbH",
      "company_seat": "Essen",
      "details": "17.02.2025 (Bekanntmachungsdatum)\n\nNordrhein-Westfalen Amtsgericht Essen HRB 28070\nLöschungsankündigung\n\nBIM GmbH\nGesellschaft mit beschränkter Haftung\nEssen\n\nDas Registergericht beabsichtigt die Gesellschaft von Amts wegen nach § 394 FamFG zu löschen. Die Frist zur Erhebung eines Widerspruchs ist auf einen Monat festgesetzt."
    },
    {
      "date": "2025-02-17",
      "id": "101511",
      "original_text": "Registerbekanntmachung nach dem Umwandlungsgesetz\nHessen Amtsgericht Frankfurt am Main HRB 93864\nunitedsoccer AG – Frankfurt am Main",
      "type": "Registerbekanntmachung nach dem Umwandlungsgesetz",
      "state": "Hessen",
      "amtsgericht": "Amtsgericht Frankfurt am Main",
      "registernummer": "HRB 93864",
      "registerart": "HRB",
      "company_name": "unitedsoccer AG",
      "company_seat": "Frankfurt am Main",
      "details": "17.02.2025 (Bekanntmachungsdatum)\n\nHessen Amtsgericht Frankfurt am Main HRB 93864\nRegisterbekanntmachung nach dem Umwandlungsgesetz 17.02.2025 (Eintragungsdatum)\n\nunitedsoccer AG\nAktiengesellschaft\nFrankfurt am Main\n\nDen Gläubigern der an der Verschmelzung beteiligten Rechtsträger ist, wenn sie binnen sechs Monaten nach dem Tag, an dem die Eintragung der Verschmelzung in das Register des Sitzes desjenigen Rechtsträgers, dessen Gläubiger sie sind, nach § 19 Absatz 3 UmwG bekannt gemacht worden ist, ihren Anspruch nach Grund und Höhe schriftlich anmelden, Sicherheit zu leisten, soweit sie nicht Befriedigung verlangen können. Dieses Recht steht den Gläubigern jedoch nur zu, wenn sie glaubhaft machen, dass durch die Verschmelzung die Erfüllung ihrer Forderung gefährdet wird."
    },
    {
      "date": "2025-02-17",
      "id": "101512",
      "original_text": "Sonstige Registerbekanntmachung\nHessen Amtsgericht Wiesbaden HRB 33920\nDEUTSCHE TREUWERT Wealth Management AG – Wiesbaden",
      "type": "Sonstige Registerbekanntmachung",
      "state": "Hessen",
      "amtsgericht": "Amtsgericht Wiesbaden",
      "registernummer": "HRB 33920",
      "registerart": "HRB",
      "company_name": "DEUTSCHE TREUWERT Wealth Management AG",
      "company_seat": "Wiesbaden",
      "details": "17.02.2025 (Bekanntmachungsdatum)\n\nHessen Amtsgericht Wiesbaden HRB 33920\nSonstige Registerbekanntmachung 17.02.2025 (Eintragungsdatum)\n\nDEUTSCHE TREUWERT Wealth Management AG\nAktiengesellschaft\nWiesbaden\n\nDurch eine Änderung in den Personen der Aufsichtsratsmitglieder ist eine Liste der Mitglieder des Aufsichtsrates zum Handelsregister eingereicht worden."
    },
    {
      "date": "2025-02-17",
      "id": "101513",
      "original_text": "Registerbekanntmachung nach dem Umwandlungsgesetz\nHessen Amtsgericht Frankfurt am Main HRB 72452\nHaus Direkt GmbH – Bad Vilbel",
      "type": "Registerbekanntmachung nach dem Umwandlungsgesetz",
      "state": "Hessen",
      "amtsgericht": "Amtsgericht Frankfurt am Main",
      "registernummer": "HRB 72452",
      "registerart": "HRB",
      "company_name": "Haus Direkt GmbH",
      "company_seat": "Bad Vilbel",
      "details": "17.02.2025 (Bekanntmachungsdatum)\n\nHessen Amtsgericht Frankfurt am Main HRB 72452\nRegisterbekanntmachung nach dem Umwandlungsgesetz 17.02.2025 (Eintragungsdatum)\n\nHaus Direkt GmbH\nGesellschaft mit beschränkter Haftung\nBad Vilbel\n\nDen Gläubigern der an der Verschmelzung beteiligten Rechtsträger ist, wenn sie binnen sechs Monaten nach dem Tag, an dem die Eintragung der Verschmelzung in das Register des Sitzes derjenigen Rechtsträger deren Gläubiger sie sind, nach § 19 Absatz 3 UmwG bekannt gemacht worden ist, ihren Anspruch nach Grund und Höhe schriftlich anmelden, Sicherheit zu leisten, soweit sie nicht Befriedigung verlangen können. Dieses Recht steht den Gläubigern jedoch nur zu, wenn sie glaubhaft machen, dass durch die Verschmelzung die Erfüllung ihrer Forderung gefährdet wird."
    },
    {
      "date": "2025-02-17",
      "id": "101514",
      "original_text": "Löschungsankündigung\nHessen Amtsgericht Frankfurt am Main HRB 92762\nANYTE KABEL GmbH – Frankfurt am Main",
      "type": "Löschungsankündigung",
      "state": "Hessen",
      "amtsgericht": "Amtsgericht Frankfurt am Main",
      "registernummer": "HRB 92762",
      "registerart": "HRB",
      "company_name": "ANYTE KABEL GmbH",
      "company_seat": "Frankfurt am Main",
      "details": "17.02.2025 (Bekanntmachungsdatum)\n\nHessen Amtsgericht Frankfurt am Main HRB 92762\nLöschungsankündigung 15.02.2025 (Eintragungsdatum)\n\nANYTE KABEL GmbH\nGesellschaft mit beschränkter Haftung\nFrankfurt am Main\n\nDas Registergericht beabsichtigt die im Handelsregister eingetragene Gesellschaft von Amts wegen nach § 394 FamFG zu löschen. Die Frist zur Erhebung eines Widerspruchs gegen die beabsichtigte Löschung wird auf 1 Monat festgesetzt."
    },
    {
      "date": "2025-02-17",
      "id": "101515",
      "original_text": "Registerbekanntmachung nach dem Umwandlungsgesetz\nHessen Amtsgericht Frankfurt am Main HRB 105890\nDritte Lotte Beteiligungsgesellschaft mbH – Frankfurt am Main",
      "type": "Registerbekanntmachung nach dem Umwandlungsgesetz",
      "state": "Hessen",
      "amtsgericht": "Amtsgericht Frankfurt am Main",
      "registernummer": "HRB 105890",
      "registerart": "HRB",
      "company_name": "Dritte Lotte Beteiligungsgesellschaft mbH",
      "company_seat": "Frankfurt am Main",
      "details": "17.02.2025 (Bekanntmachungsdatum)\n\nHessen Amtsgericht Frankfurt am Main HRB 105890\nRegisterbekanntmachung nach dem Umwandlungsgesetz 17.02.2025 (Eintragungsdatum)\n\nDritte Lotte Beteiligungsgesellschaft mbH\nGesellschaft mit beschränkter Haftung\nFrankfurt am Main\n\nDen Gläubigern der an der Verschmelzung beteiligten Rechtsträger ist, wenn sie binnen sechs Monaten nach dem Tag, an dem die Eintragung der Verschmelzung in das Register des Sitzes desjenigen Rechtsträgers, dessen Gläubiger sie sind, nach § 19 Absatz 3 UmwG bekannt gemacht worden ist, ihren Anspruch nach Grund und Höhe schriftlich anmelden, Sicherheit zu leisten, soweit sie nicht Befriedigung verlangen können. Dieses Recht steht den Gläubigern jedoch nur zu, wenn sie glaubhaft machen, dass durch die Verschmelzung die Erfüllung ihrer Forderung gefährdet wird."
    },
    {
      "date": "2025-02-17",
      "id": "101516",
      "original_text": "Registerbekanntmachung nach dem Umwandlungsgesetz\nHessen Amtsgericht Frankfurt am Main HRB 106057\nZweite Lotte Beteiligungsgesellschaft mbH – Frankfurt am Main",
      "type": "Registerbekanntmachung nach dem Umwandlungsgesetz",
      "state": "Hessen",
      "amtsgericht": "Amtsgericht Frankfurt am Main",
      "registernummer": "HRB 106057",
      "registerart": "HRB",
      "company_name": "Zweite Lotte Beteiligungsgesellschaft mbH",
      "company_seat": "Frankfurt am Main",
      "details": "17.02.2025 (Bekanntmachungsdatum)\n\nHessen Amtsgericht Frankfurt am Main HRB 106057\nRegisterbekanntmachung nach dem Umwandlungsgesetz 17.02.2025 (Eintragungsdatum)\n\nZweite Lotte Beteiligungsgesellschaft mbH\nGesellschaft mit beschränkter Haftung\nFrankfurt am Main\n\nDen Gläubigern der an der Verschmelzung beteiligten Rechtsträger ist, wenn sie binnen sechs Monaten nach dem Tag, an dem die Eintragung der Verschmelzung in das Register des Sitzes desjenigen Rechtsträgers, dessen Gläubiger sie sind, nach § 19 Absatz 3 UmwG bekannt gemacht worden ist, ihren Anspruch nach Grund und Höhe schriftlich anmelden, Sicherheit zu leisten, soweit sie nicht Befriedigung verlangen können. Dieses Recht steht den Gläubigern jedoch nur zu, wenn sie glaubhaft machen, dass durch die Verschmelzung die Erfüllung ihrer Forderung gefährdet wird."
    },
    {
      "date": "2025-02-17",
      "id": "101517",
      "original_text": "Sonstige Registerbekanntmachung\nHessen Amtsgericht Kassel VR 2222\nFörderverein der Werkakademie für Gestaltung Hessen e.V. – Kassel",
      "type": "Sonstige Registerbekanntmachung",
      "state": "Hessen",
      "amtsgericht": "Amtsgericht Kassel",
      "registernummer": "VR 2222",
      "registerart": "VR",
      "company_name": "Förderverein der Werkakademie für Gestaltung Hessen e.V.",
      "company_seat": "Kassel",
      "details": "17.02.2025 (Bekanntmachungsdatum)\n\nHessen Amtsgericht Kassel VR 2222\nSonstige Registerbekanntmachung 17.02.2025 (Eintragungsdatum)\n\nFörderverein der Werkakademie für Gestaltung Hessen e.V.\neingetragener Verein\nKassel\n\nDer Verein ist aufgelöst."
    },
    {
      "date": "2025-02-17",
      "id": "101518",
      "original_text": "Löschungsankündigung\nHessen Amtsgericht Frankfurt am Main HRB 114067\nFRA-TRANS GmbH – Frankfurt am Main",
      "type": "Löschungsankündigung",
      "state": "Hessen",
      "amtsgericht": "Amtsgericht Frankfurt am Main",
      "registernummer": "HRB 114067",
      "registerart": "HRB",
      "company_name": "FRA-TRANS GmbH",
      "company_seat": "Frankfurt am Main",
      "details": "17.02.2025 (Bekanntmachungsdatum)\n\nHessen Amtsgericht Frankfurt am Main HRB 114067\nLöschungsankündigung 15.02.2025 (Eintragungsdatum)\n\nFRA-TRANS GmbH\nGesellschaft mit beschränkter Haftung\nFrankfurt am Main\n\nDas Registergericht beabsichtigt die im Handelsregister eingetragene Gesellschaft von Amts wegen nach § 394 FamFG zu löschen. Die Frist zur Erhebung eines Widerspruchs gegen die beabsichtigte Löschung wird auf 1 Monat festgesetzt."
    },
    {
      "date": "2025-02-17",
      "id": "101519",
      "original_text": "Sonstige Registerbekanntmachung\nHessen Amtsgericht Limburg VR 1957\nMännergesangverein 1863 Eintracht Edelsberg – Weinbach-Edelsberg",
      "type": "Sonstige Registerbekanntmachung",
      "state": "Hessen",
      "amtsgericht": "Amtsgericht Limburg",
      "registernummer": "VR 1957",
      "registerart": "VR",
      "company_name": "Männergesangverein 1863 Eintracht Edelsberg",
      "company_seat": "Weinbach-Edelsberg",
      "details": "17.02.2025 (Bekanntmachungsdatum)\n\nHessen Amtsgericht Limburg VR 1957\nSonstige Registerbekanntmachung 17.02.2025 (Eintragungsdatum)\n\nMännergesangverein 1863 Eintracht Edelsberg\neingetragener Verein\nWeinbach-Edelsberg\n\nDer Verein ist aufgelöst."
    },
    {
      "date": "2025-02-17",
      "id": "101520",
      "original_text": "Registerbekanntmachung nach dem Umwandlungsgesetz\nHessen Amtsgericht Frankfurt am Main HRB 42619\nRMG Publishing GmbH – Frankfurt am Main",
      "type": "Registerbekanntmachung nach dem Umwandlungsgesetz",
      "state": "Hessen",
      "amtsgericht": "Amtsgericht Frankfurt am Main",
      "registernummer": "HRB 42619",
      "registerart": "HRB",
      "company_name": "RMG Publishing GmbH",
      "company_seat": "Frankfurt am Main",
      "details": "17.02.2025 (Bekanntmachungsdatum)\n\nHessen Amtsgericht Frankfurt am Main HRB 42619\nRegisterbekanntmachung nach dem Umwandlungsgesetz 23.01.2025 (Eintragungsdatum)\n\nRMG Publishing GmbH\nGesellschaft mit beschränkter Haftung\nFrankfurt am Main\n\nDen Gläubigern der an der Verschmelzung beteiligten Rechtsträger ist, wenn sie binnen sechs Monaten nach dem Tag, an dem die Eintragung der Verschmelzung in das Register des Sitzes desjenigen Rechtsträgers, dessen Gläubiger sie sind, nach § 19 Absatz 3 UmwG bekannt gemacht worden ist, ihren Anspruch nach Grund und Höhe schriftlich anmelden, Sicherheit zu leisten, soweit sie nicht Befriedigung verlangen können. Dieses Recht steht den Gläubigern jedoch nur zu, wenn sie glaubhaft machen, dass durch die Verschmelzung die Erfüllung ihrer Forderung gefährdet wird."
    },
    {
      "date": "2025-02-17",
      "id": "101521",
      "original_text": "Löschungsankündigung\nHessen Amtsgericht Frankfurt am Main HRB 116731\nDEZ Deutschland GmbH – Frankfurt am Main",
      "type": "Löschungsankündigung",
      "state": "Hessen",
      "amtsgericht": "Amtsgericht Frankfurt am Main",
      "registernummer": "HRB 116731",
      "registerart": "HRB",
      "company_name": "DEZ Deutschland GmbH",
      "company_seat": "Frankfurt am Main",
      "details": "17.02.2025 (Bekanntmachungsdatum)\n\nHessen Amtsgericht Frankfurt am Main HRB 116731\nLöschungsankündigung\n\nDEZ Deutschland GmbH\nGesellschaft mit beschränkter Haftung\nFrankfurt am Main\n\nDas Registergericht beabsichtigt die im Handelsregister eingetragene Gesellschaft von Amts wegen nach § 394 FamFG zu löschen. Die Frist zur Erhebung eines Widerspruchs gegen die beabsichtigte Löschung wird auf 1 Monate festgesetzt."
    },
    {
      "date": "2025-02-17",
      "id": "101522",
      "original_text": "Löschungsankündigung\nHessen Amtsgericht Offenbach am Main HRB 49387\nMGO Service UG (haftungsbeschränkt) – Offenbach am Main",
      "type": "Löschungsankündigung",
      "state": "Hessen",
      "amtsgericht": "Amtsgericht Offenbach am Main",
      "registernummer": "HRB 49387",
      "registerart": "HRB",
      "company_name": "MGO Service UG (haftungsbeschränkt)",
      "company_seat": "Offenbach am Main",
      "details": "17.02.2025 (Bekanntmachungsdatum)\n\nHessen Amtsgericht Offenbach am Main HRB 49387\nLöschungsankündigung\n\nMGO Service UG (haftungsbeschränkt)\nGesellschaft mit beschränkter Haftung\nOffenbach am Main\n\nDas Registergericht beabsichtigt die im Handelsregister eingetragene Gesellschaft von Amts wegen nach § 394 FamFG zu löschen. Die Frist zur Erhebung eines Widerspruchs gegen die beabsichtigte Löschung wird auf 3 Monate festgesetzt."
    },
    {
      "date": "2025-02-17",
      "id": "101523",
      "original_text": "Einreichung neuer Dokumente\nHessen Amtsgericht Königstein HRB 7798\nUnternehmensBörse Grönig & Kollegen AG – Kelkheim (Taunus)",
      "type": "Einreichung neuer Dokumente",
      "state": "Hessen",
      "amtsgericht": "Amtsgericht Königstein",
      "registernummer": "HRB 7798",
      "registerart": "HRB",
      "company_name": "UnternehmensBörse Grönig & Kollegen AG",
      "company_seat": "Kelkheim (Taunus)",
      "details": "17.02.2025 (Bekanntmachungsdatum)\n\nHessen Amtsgericht Königstein HRB 7798\nEinreichung neuer Dokumente 17.02.2025 (Eintragungsdatum)\n\nUnternehmensBörse Grönig & Kollegen AG\nAktiengesellschaft\nKelkheim (Taunus)\n\nDurch eine Änderung in den Personen der Aufsichtsratsmitglieder ist eine Liste der Mitglieder des Aufsichtsrates zum Handelsregister eingereicht worden."
    },
    {
      "date": "2025-02-17",
      "id": "101524",
      "original_text": "Einreichung neuer Dokumente\nHessen Amtsgericht Frankfurt am Main HRB 88301\nCitigroup Global Markets Europe AG – Frankfurt am Main",
      "type": "Einreichung neuer Dokumente",
      "state": "Hessen",
      "amtsgericht": "Amtsgericht Frankfurt am Main",
      "registernummer": "HRB 88301",
      "registerart": "HRB",
      "company_name": "Citigroup Global Markets Europe AG",
      "company_seat": "Frankfurt am Main",
      "details": "17.02.2025 (Bekanntmachungsdatum)\n\nHessen Amtsgericht Frankfurt am Main HRB 88301\nEinreichung neuer Dokumente 14.02.2025 (Eintragungsdatum)\n\nCitigroup Global Markets Europe AG\nAktiengesellschaft\nFrankfurt am Main\n\nDurch eine Änderung in den Personen der Aufsichtsratsmitglieder ist eine Liste der Mitglieder des Aufsichtsrates zum Handelsregister eingereicht worden."
    },
    {
      "date": "2025-02-17",
      "id": "101525",
      "original_text": "Einreichung neuer Dokumente\nHessen Amtsgericht Frankfurt am Main HRB 91280\nH&O Aurum AG – Frankfurt am Main",
      "type": "Einreichung neuer Dokumente",
      "state": "Hessen",
      "amtsgericht": "Amtsgericht Frankfurt am Main",
      "registernummer": "HRB 91280",
      "registerart": "HRB",
      "company_name": "H&O Aurum AG",
      "company_seat": "Frankfurt am Main",
      "details": "17.02.2025 (Bekanntmachungsdatum)\n\nHessen Amtsgericht Frankfurt am Main HRB 91280\nEinreichung neuer Dokumente 17.02.2025 (Eintragungsdatum)\n\nH&O Aurum AG\nAktiengesellschaft\nFrankfurt am Main\n\nDurch eine Änderung in den Personen der Aufsichtsratsmitglieder ist eine Liste der Mitglieder des Aufsichtsrates zum Handelsregister eingereicht worden."
    },
    {
      "date": "2025-02-17",
      "id": "101526",
      "original_text": "Löschungsankündigung\nHessen Amtsgericht Offenbach am Main HRB 53237\nDone GmbH – Offenbach am Main",
      "type": "Löschungsankündigung",
      "state": "Hessen",
      "amtsgericht": "Amtsgericht Offenbach am Main",
      "registernummer": "HRB 53237",
      "registerart": "HRB",
      "company_name": "Done GmbH",
      "company_seat": "Offenbach am Main",
      "details": "17.02.2025 (Bekanntmachungsdatum)\n\nHessen Amtsgericht Offenbach am Main HRB 53237\nLöschungsankündigung\n\nDone GmbH\nGesellschaft mit beschränkter Haftung\nOffenbach am Main\n\nDas Registergericht beabsichtigt die im Handelsregister eingetragene Gesellschaft von Amts wegen nach § 394 FamFG zu löschen. Die Frist zur Erhebung eines Widerspruchs gegen die beabsichtigte Löschung wird auf 3 Monate festgesetzt."
    },
    {
      "date": "2025-02-17",
      "id": "101527",
      "original_text": "Löschungsankündigung\nHessen Amtsgericht Offenbach am Main HRB 53417\nNeuhofer Haus Bau-Service GmbH – Dreieich",
      "type": "Löschungsankündigung",
      "state": "Hessen",
      "amtsgericht": "Amtsgericht Offenbach am Main",
      "registernummer": "HRB 53417",
      "registerart": "HRB",
      "company_name": "Neuhofer Haus Bau-Service GmbH",
      "company_seat": "Dreieich",
      "details": "17.02.2025 (Bekanntmachungsdatum)\n\nHessen Amtsgericht Offenbach am Main HRB 53417\nLöschungsankündigung\n\nNeuhofer Haus Bau-Service GmbH\nGesellschaft mit beschränkter Haftung\nDreieich\n\nDas Registergericht beabsichtigt die im Handelsregister eingetragene Gesellschaft von Amts wegen nach § 394 FamFG zu löschen. Die Frist zur Erhebung eines Widerspruchs gegen die beabsichtigte Löschung wird auf 3 Monate festgesetzt."
    },
    {
      "date": "2025-02-17",
      "id": "101528",
      "original_text": "Löschungsankündigung\nHessen Amtsgericht Offenbach am Main HRA 41567\nRMT Services GmbH & Co KG – Offenbach am Main",
      "type": "Löschungsankündigung",
      "state": "Hessen",
      "amtsgericht": "Amtsgericht Offenbach am Main",
      "registernummer": "HRA 41567",
      "registerart": "HRA",
      "company_name": "RMT Services GmbH & Co KG",
      "company_seat": "Offenbach am Main",
      "details": "17.02.2025 (Bekanntmachungsdatum)\n\nHessen Amtsgericht Offenbach am Main HRA 41567\nLöschungsankündigung\n\nRMT Services GmbH & Co KG\nKommanditgesellschaft\nOffenbach am Main\n\nDas Registergericht beabsichtigt die im Handelsregister eingetragene Gesellschaft von Amts wegen nach § 394 FamFG zu löschen. Die Frist zur Erhebung eines Widerspruchs gegen die beabsichtigte Löschung wird auf 3 Monate festgesetzt."
    },
    {
      "date": "2025-02-17",
      "id": "101529",
      "original_text": "Löschungsankündigung\nHessen Amtsgericht Offenbach am Main HRB 53269\nMZ Kfz-Teile GmbH – Seligenstadt",
      "type": "Löschungsankündigung",
      "state": "Hessen",
      "amtsgericht": "Amtsgericht Offenbach am Main",
      "registernummer": "HRB 53269",
      "registerart": "HRB",
      "company_name": "MZ Kfz-Teile GmbH",
      "company_seat": "Seligenstadt",
      "details": "17.02.2025 (Bekanntmachungsdatum)\n\nHessen Amtsgericht Offenbach am Main HRB 53269\nLöschungsankündigung\n\nMZ Kfz-Teile GmbH\nGesellschaft mit beschränkter Haftung\nSeligenstadt\n\nDas Registergericht beabsichtigt die im Handelsregister eingetragene Gesellschaft von Amts wegen nach § 394 FamFG zu löschen. Die Frist zur Erhebung eines Widerspruchs gegen die beabsichtigte Löschung wird auf 3 Monate festgesetzt."
    },
    {
      "date": "2025-02-17",
      "id": "101530",
      "original_text": "Sonstige Registerbekanntmachung\nHessen Amtsgericht Königstein VR 789\nTurn- und Sportverein 1882 Königstein/Ts. (TSV) e.V. – Königstein im Taunus",
      "type": "Sonstige Registerbekanntmachung",
      "state": "Hessen",
      "amtsgericht": "Amtsgericht Königstein",
      "registernummer": "VR 789",
      "registerart": "VR",
      "company_name": "Turn- und Sportverein 1882 Königstein/Ts. (TSV) e.V.",
      "company_seat": "Königstein im Taunus",
      "details": "17.02.2025 (Bekanntmachungsdatum)\n\nHessen Amtsgericht Königstein VR 789\nSonstige Registerbekanntmachung 17.02.2025 (Eintragungsdatum)\n\nTurn- und Sportverein 1882 Königstein/Ts. (TSV) e.V.\neingetragener Verein\nKönigstein im Taunus\n\nDer Verein ist aufgelöst."
    },
    {
      "date": "2025-02-17",
      "id": "101531",
      "original_text": "Einreichung neuer Dokumente\nHessen Amtsgericht Frankfurt am Main HRB 85925\nUniversal-Investmentaktiengesellschaft mit Teilgesellschaftsvermögen – Frankfurt am Main",
      "type": "Einreichung neuer Dokumente",
      "state": "Hessen",
      "amtsgericht": "Amtsgericht Frankfurt am Main",
      "registernummer": "HRB 85925",
      "registerart": "HRB",
      "company_name": "Universal-Investmentaktiengesellschaft mit Teilgesellschaftsvermögen",
      "company_seat": "Frankfurt am Main",
      "details": "17.02.2025 (Bekanntmachungsdatum)\n\nHessen Amtsgericht Frankfurt am Main HRB 85925\nEinreichung neuer Dokumente 17.02.2025 (Eintragungsdatum)\n\nUniversal-Investmentaktiengesellschaft mit Teilgesellschaftsvermögen\nAktiengesellschaft\nFrankfurt am Main\n\nDurch eine Änderung in den Personen der Aufsichtsratsmitglieder ist eine Liste der Mitglieder des Aufsichtsrates zum Handelsregister eingereicht worden."
    },
    {
      "date": "2025-02-17",
      "id": "101532",
      "original_text": "Registerbekanntmachung nach dem Umwandlungsgesetz\nHessen Amtsgericht Frankfurt am Main HRB 20424\nUFER Optik + Akustik GmbH – Hofheim am Main",
      "type": "Registerbekanntmachung nach dem Umwandlungsgesetz",
      "state": "Hessen",
      "amtsgericht": "Amtsgericht Frankfurt am Main",
      "registernummer": "HRB 20424",
      "registerart": "HRB",
      "company_name": "UFER Optik + Akustik GmbH",
      "company_seat": "Hofheim am Main",
      "details": "17.02.2025 (Bekanntmachungsdatum)\n\nHessen Amtsgericht Frankfurt am Main HRB 20424\nRegisterbekanntmachung nach dem Umwandlungsgesetz 17.02.2025 (Eintragungsdatum)\n\nUFER Optik + Akustik GmbH\nGesellschaft mit beschränkter Haftung\nHofheim am Main\n\nDen Gläubigern der an der Verschmelzung beteiligten Rechtsträger ist, wenn sie binnen sechs Monaten nach dem Tag, an dem die Eintragung der Verschmelzung in das Register des Sitzes derjenigen Rechtsträger deren Gläubiger sie sind, nach § 19 Absatz 3 UmwG bekannt gemacht worden ist, ihren Anspruch nach Grund und Höhe schriftlich anmelden, Sicherheit zu leisten, soweit sie nicht Befriedigung verlangen können. Dieses Recht steht den Gläubigern jedoch nur zu, wenn sie glaubhaft machen, dass durch die Verschmelzung die Erfüllung ihrer Forderung gefährdet wird."
    },
    {
      "date": "2025-02-17",
      "id": "101533",
      "original_text": "Löschungsankündigung\nHessen Amtsgericht Limburg HRB 5321\nIndigo Investment GmbH – Hadamar",
      "type": "Löschungsankündigung",
      "state": "Hessen",
      "amtsgericht": "Amtsgericht Limburg",
      "registernummer": "HRB 5321",
      "registerart": "HRB",
      "company_name": "Indigo Investment GmbH",
      "company_seat": "Hadamar",
      "details": "17.02.2025 (Bekanntmachungsdatum)\n\nHessen Amtsgericht Limburg HRB 5321\nLöschungsankündigung\n\nIndigo Investment GmbH\nGesellschaft mit beschränkter Haftung\nHadamar\n\nDas Registergericht beabsichtigt die im Handelsregister eingetragene Gesellschaft von Amts wegen nach § 395 FamFG zu löschen. Die Frist zur Erhebung eines Widerspruchs gegen die beabsichtigte Löschung wird auf 2 Monate festgesetzt."
    },
    {
      "date": "2025-02-17",
      "id": "101534",
      "original_text": "Löschungsankündigung\nHessen Amtsgericht Darmstadt HRB 101476\nPdP Logistik GmbH – Raunheim",
      "type": "Löschungsankündigung",
      "state": "Hessen",
      "amtsgericht": "Amtsgericht Darmstadt",
      "registernummer": "HRB 101476",
      "registerart": "HRB",
      "company_name": "PdP Logistik GmbH",
      "company_seat": "Raunheim",
      "details": "17.02.2025 (Bekanntmachungsdatum)\n\nHessen Amtsgericht Darmstadt HRB 101476\nLöschungsankündigung 17.02.2025 (Eintragungsdatum)\n\nPdP Logistik GmbH\nGesellschaft mit beschränkter Haftung\nRaunheim\n\nDas Registergericht beabsichtigt die im Handelsregister eingetragene Gesellschaft von Amts wegen nach § 394 FamFG zu löschen. Die Frist zur Erhebung eines Widerspruchs gegen die beabsichtigte Löschung wird auf 3 Monate festgesetzt."
    }
  ]
}