{
  "date": "2025-02-21",
  "date_of_scrape": "2025-02-22T04:08:00.291Z",
  "tool_version": "0.2.0",
  "number_of_announcements": 105,
  "announcements": [
    {
      "date": "2025-02-21",
      "id": "101907",
      "original_text": "Registerbekanntmachung nach dem Umwandlungsgesetz\nBayern Amtsgericht Weiden i. d. OPf. HRB 4941\nPaules Abbruchwerkzeuge GmbH – Luhe-Wildenau",
      "type": "Registerbekanntmachung nach dem Umwandlungsgesetz",
      "state": "Bayern",
      "amtsgericht": "Amtsgericht Weiden i. d. OPf.",
      "registernummer": "HRB 4941",
      "registerart": "HRB",
      "company_name": "Paules Abbruchwerkzeuge GmbH",
      "company_seat": "Luhe-Wildenau",
      "details": "21.02.2025 (Bekanntmachungsdatum)\n\nBayern Amtsgericht Weiden i. d. OPf. HRB 4941\nRegisterbekanntmachung nach dem Umwandlungsgesetz 20.02.2025 (Eintragungsdatum)\n\nPaules Abbruchwerkzeuge GmbH\nGesellschaft mit beschränkter Haftung\nLuhe-Wildenau\n\nDen Gläubigernder an der Verschmelzung beteiligten Rechtsträger ist, wenn sie binnen sechs Monaten nach dem Tag, an dem die Eintragung der Verschmelzung in das Register des Sitzes desjenigen Rechtsträgers, dessen Gläubiger sie sind, nach § 19 Abs. 3 UmwG als bekannt gemacht gilt, ihren Anspruch nach Grund und Höhe in Textform anmelden, Sicherheit zu leisten, soweit sie nicht Befriedigung verlangen können. Dieses Recht steht den Gläubigern jedoch nur zu, wenn sie glaubhaft machen, dass durch die Verschmelzung die Erfüllung ihrer Forderung gefährdet wird.\"ihrer Forderung gefährdet wird."
    },
    {
      "date": "2025-02-21",
      "id": "101908",
      "original_text": "Registerbekanntmachung nach dem Umwandlungsgesetz\nBayern Amtsgericht München HRB 110162\nCRTM CleanRoomProducts GmbH – Planegg, Ortsteil Martinsried",
      "type": "Registerbekanntmachung nach dem Umwandlungsgesetz",
      "state": "Bayern",
      "amtsgericht": "Amtsgericht München",
      "registernummer": "HRB 110162",
      "registerart": "HRB",
      "company_name": "CRTM CleanRoomProducts GmbH",
      "company_seat": "Planegg, Ortsteil Martinsried",
      "details": "21.02.2025 (Bekanntmachungsdatum)\n\nBayern Amtsgericht München HRB 110162\nRegisterbekanntmachung nach dem Umwandlungsgesetz 20.02.2025 (Eintragungsdatum)\n\nCRTM CleanRoomProducts GmbH\nGesellschaft mit beschränkter Haftung\nPlanegg, Ortsteil Martinsried\n\nDen Gläubigern der an der Verschmelzung beteiligten Rechtsträger ist, wenn sie binnen sechs Monaten nach dem Tag, an dem die Eintragung der Verschmelzung in das Register des Sitzes desjenigen Rechtsträgers, dessen Gläubiger sie sind, nach § 19 Abs. 3 UmwG als bekannt gemacht gilt, ihren Anspruch nach Grund und Höhe in Textform anmelden, Sicherheit zu leisten, soweit sie nicht Befriedigung verlangen können. Dieses Recht steht den Gläubigern jedoch nur zu, wenn sie glaubhaft machen, dass durch die Verschmelzung die Erfüllung ihrer Forderung gefährdet wird."
    },
    {
      "date": "2025-02-21",
      "id": "101909",
      "original_text": "Registerbekanntmachung nach dem Umwandlungsgesetz\nBayern Amtsgericht Deggendorf HRB 2785\nS u. K Hock GmbH – Regen",
      "type": "Registerbekanntmachung nach dem Umwandlungsgesetz",
      "state": "Bayern",
      "amtsgericht": "Amtsgericht Deggendorf",
      "registernummer": "HRB 2785",
      "registerart": "HRB",
      "company_name": "S u. K Hock GmbH",
      "company_seat": "Regen",
      "details": "21.02.2025 (Bekanntmachungsdatum)\n\nBayern Amtsgericht Deggendorf HRB 2785\nRegisterbekanntmachung nach dem Umwandlungsgesetz 20.02.2025 (Eintragungsdatum)\n\nS u. K Hock GmbH\nGesellschaft mit beschränkter Haftung\nRegen\n\nDen Gläubigern der an der Verschmelzung beteiligten Rechtsträger ist, wenn sie binnen sechs Monaten nach dem Tag, an dem die Eintragung der Verschmelzung in das Register des Sitzes desjenigen Rechtsträgers, dessen Gläubiger sie sind, nach § 19 Abs. 3 UmwG als bekannt gemacht gilt, ihren Anspruch nach Grund und Höhe in Textform anmelden, Sicherheit zu leisten, soweit sie nicht Befriedigung verlangen können. Dieses Recht steht den Gläubigern jedoch nur zu, wenn sie glaubhaft machen, dass durch die Verschmelzung die Erfüllung ihrer Forderung gefährdet wird."
    },
    {
      "date": "2025-02-21",
      "id": "101910",
      "original_text": "Registerbekanntmachung nach dem Umwandlungsgesetz\nBayern Amtsgericht Deggendorf HRB 4231\nFR Bayern Technology GmbH – Regen",
      "type": "Registerbekanntmachung nach dem Umwandlungsgesetz",
      "state": "Bayern",
      "amtsgericht": "Amtsgericht Deggendorf",
      "registernummer": "HRB 4231",
      "registerart": "HRB",
      "company_name": "FR Bayern Technology GmbH",
      "company_seat": "Regen",
      "details": "21.02.2025 (Bekanntmachungsdatum)\n\nBayern Amtsgericht Deggendorf HRB 4231\nRegisterbekanntmachung nach dem Umwandlungsgesetz 20.02.2025 (Eintragungsdatum)\n\nFR Bayern Technology GmbH\nGesellschaft mit beschränkter Haftung\nRegen\n\nDen Gläubigern der an der Verschmelzung beteiligten Rechtsträger ist, wenn sie binnen sechs Monaten nach dem Tag, an dem die Eintragung der Verschmelzung in das Register des Sitzes desjenigen Rechtsträgers, dessen Gläubiger sie sind, nach § 19 Abs. 3 UmwG als bekannt gemacht gilt, ihren Anspruch nach Grund und Höhe in Textform anmelden, Sicherheit zu leisten, soweit sie nicht Befriedigung verlangen können. Dieses Recht steht den Gläubigern jedoch nur zu, wenn sie glaubhaft machen, dass durch die Verschmelzung die Erfüllung ihrer Forderung gefährdet wird."
    },
    {
      "date": "2025-02-21",
      "id": "101911",
      "original_text": "Registerbekanntmachung nach dem Umwandlungsgesetz\nBayern Amtsgericht Regensburg HRB 15043\nFM & WEB @ Database GmbH – Schierling",
      "type": "Registerbekanntmachung nach dem Umwandlungsgesetz",
      "state": "Bayern",
      "amtsgericht": "Amtsgericht Regensburg",
      "registernummer": "HRB 15043",
      "registerart": "HRB",
      "company_name": "FM & WEB @ Database GmbH",
      "company_seat": "Schierling",
      "details": "21.02.2025 (Bekanntmachungsdatum)\n\nBayern Amtsgericht Regensburg HRB 15043\nRegisterbekanntmachung nach dem Umwandlungsgesetz 20.02.2025 (Eintragungsdatum)\n\nFM & WEB @ Database GmbH\nGesellschaft mit beschränkter Haftung\nSchierling\n\nDen Gläubigern der an der Verschmelzung beteiligten Rechtsträger ist, wenn sie binnen sechs Monaten nach dem Tag, an dem die Eintragung der Verschmelzung in das Register des Sitzes desjenigen Rechtsträgers, dessen Gläubiger sie sind, nach § 19 Abs. 3 UmwG als bekannt gemacht gilt, ihren Anspruch nach Grund und Höhe in Textform anmelden, Sicherheit zu leisten, soweit sie nicht Befriedigung verlangen können. Dieses Recht steht den Gläubigern jedoch nur zu, wenn sie glaubhaft machen, dass durch die Verschmelzung die Erfüllung ihrer Forderung gefährdet wird."
    },
    {
      "date": "2025-02-21",
      "id": "101912",
      "original_text": "Sonstige Registerbekanntmachung\nBayern Amtsgericht Fürth HRB 18918\nJori-Jori GmbH – Zirndorf",
      "type": "Sonstige Registerbekanntmachung",
      "state": "Bayern",
      "amtsgericht": "Amtsgericht Fürth",
      "registernummer": "HRB 18918",
      "registerart": "HRB",
      "company_name": "Jori-Jori GmbH",
      "company_seat": "Zirndorf",
      "details": "21.02.2025 (Bekanntmachungsdatum)\n\nBayern Amtsgericht Fürth HRB 18918\nSonstige Registerbekanntmachung 18.02.2025 (Eintragungsdatum)\n\nJori-Jori GmbH\nGesellschaft mit beschränkter Haftung\nZirndorf\n\nDie Gesellschaft ist wegen Vermögenslosigkeit gemäß § 394 FamFG gelöscht. Von Amts wegen eingetragen."
    },
    {
      "date": "2025-02-21",
      "id": "101913",
      "original_text": "Einreichung neuer Dokumente\nBayern Amtsgericht München HRB 290957\nMWB AG – München",
      "type": "Einreichung neuer Dokumente",
      "state": "Bayern",
      "amtsgericht": "Amtsgericht München",
      "registernummer": "HRB 290957",
      "registerart": "HRB",
      "company_name": "MWB AG",
      "company_seat": "München",
      "details": "21.02.2025 (Bekanntmachungsdatum)\n\nBayern Amtsgericht München HRB 290957\nEinreichung neuer Dokumente\n\nMWB AG\nAktiengesellschaft\nMünchen\n\nDem Amtsgericht München -Registergericht- ist eine Liste der Mitglieder des Aufsichtsrats eingereicht worden, § 106 AktG."
    },
    {
      "date": "2025-02-21",
      "id": "101914",
      "original_text": "Registerbekanntmachung nach dem Umwandlungsgesetz\nBayern Amtsgericht Nürnberg HRB 31861\nMAXFLEX Software GmbH – Nürnberg",
      "type": "Registerbekanntmachung nach dem Umwandlungsgesetz",
      "state": "Bayern",
      "amtsgericht": "Amtsgericht Nürnberg",
      "registernummer": "HRB 31861",
      "registerart": "HRB",
      "company_name": "MAXFLEX Software GmbH",
      "company_seat": "Nürnberg",
      "details": "21.02.2025 (Bekanntmachungsdatum)\n\nBayern Amtsgericht Nürnberg HRB 31861\nRegisterbekanntmachung nach dem Umwandlungsgesetz 20.02.2025 (Eintragungsdatum)\n\nMAXFLEX Software GmbH\nGesellschaft mit beschränkter Haftung\nNürnberg\n\nDen Gläubigern der an der Verschmelzung beteiligten Rechtsträger ist, wenn sie binnen sechs Monaten nach dem Tag, an dem die Eintragung der Verschmelzung in das Register des Sitzes desjenigen Rechtsträgers, dessen Gläubiger sie sind, nach § 19 Abs. 3 UmwG als bekannt gemacht gilt, ihren Anspruch nach Grund und Höhe in Textform anmelden, Sicherheit zu leisten, soweit sie nicht Befriedigung verlangen können. Dieses Recht steht den Gläubigern jedoch nur zu, wenn sie glaubhaft machen, dass durch die Verschmelzung die Erfüllung ihrer Forderung gefährdet wird."
    },
    {
      "date": "2025-02-21",
      "id": "101915",
      "original_text": "Registerbekanntmachung nach dem Umwandlungsgesetz\nBayern Amtsgericht München HRB 283006\ninnoscripta AG – München",
      "type": "Registerbekanntmachung nach dem Umwandlungsgesetz",
      "state": "Bayern",
      "amtsgericht": "Amtsgericht München",
      "registernummer": "HRB 283006",
      "registerart": "HRB",
      "company_name": "innoscripta AG",
      "company_seat": "München",
      "details": "21.02.2025 (Bekanntmachungsdatum)\n\nBayern Amtsgericht München HRB 283006\nRegisterbekanntmachung nach dem Umwandlungsgesetz 17.02.2025 (Eintragungsdatum)\n\ninnoscripta AG\nAktiengesellschaft\nMünchen\n\nDem Amtsgericht München -Registergericht- ist am 17.02.2025 ein Umwandlungsplan über die geplante Umwandlung der Gesellschaft in eine Europäische Gesellschaft (Societas Europaea (SE)) unter Firma innoscripta SE mit Sitz in München/Bundesrepublik Deutschland eingereicht worden."
    },
    {
      "date": "2025-02-21",
      "id": "101916",
      "original_text": "Registerbekanntmachung nach dem Umwandlungsgesetz\nBayern Amtsgericht Nürnberg HRA 20183\nBS Context Translations Nürnberg e. K. – Nürnberg",
      "type": "Registerbekanntmachung nach dem Umwandlungsgesetz",
      "state": "Bayern",
      "amtsgericht": "Amtsgericht Nürnberg",
      "registernummer": "HRA 20183",
      "registerart": "HRA",
      "company_name": "BS Context Translations Nürnberg e. K.",
      "company_seat": "Nürnberg",
      "details": "21.02.2025 (Bekanntmachungsdatum)\n\nBayern Amtsgericht Nürnberg HRA 20183\nRegisterbekanntmachung nach dem Umwandlungsgesetz 20.02.2025 (Eintragungsdatum)\n\nBS Context Translations Nürnberg e. K.\nEinzelkaufmann / Einzelkauffrau\nNürnberg\n\nDen Gläubigern der an der Ausgliederung beteiligten Rechtsträger ist, wenn sie binnen sechs Monaten nach dem Tag, an dem die Eintragung der Ausgliederung in das Register des Sitzes desjenigen Rechtsträgers, dessen Gläubiger sie sind, nach §§ 125, 19 Abs. 3 UmwG als bekannt gemacht gilt, ihren Anspruch nach Grund und Höhe in Textform anmelden, Sicherheit zu leisten, soweit sie nicht Befriedigung verlangen können. Dieses Recht steht den Gläubigern jedoch nur zu, wenn sie glaubhaft machen, dass durch die Ausgliederung die Erfüllung ihrer Forderung gefährdet wird."
    },
    {
      "date": "2025-02-21",
      "id": "101917",
      "original_text": "Einreichung neuer Dokumente\nBayern Amtsgericht München HRB 247748\nFORTEC Elektronik Aktiengesellschaft – Germering",
      "type": "Einreichung neuer Dokumente",
      "state": "Bayern",
      "amtsgericht": "Amtsgericht München",
      "registernummer": "HRB 247748",
      "registerart": "HRB",
      "company_name": "FORTEC Elektronik Aktiengesellschaft",
      "company_seat": "Germering",
      "details": "21.02.2025 (Bekanntmachungsdatum)\n\nBayern Amtsgericht München HRB 247748\nEinreichung neuer Dokumente 20.02.2025 (Eintragungsdatum)\n\nFORTEC Elektronik Aktiengesellschaft\nAktiengesellschaft\nGermering\n\nDem Amtsgericht München -Registergericht- ist eine Liste der Mitglieder des Aufsichtsrats eingereicht worden, § 106 AktG."
    },
    {
      "date": "2025-02-21",
      "id": "101918",
      "original_text": "Einreichung neuer Dokumente\nBayern Amtsgericht Nürnberg HRB 17412\nN-ERGIE Aktiengesellschaft – Nürnberg",
      "type": "Einreichung neuer Dokumente",
      "state": "Bayern",
      "amtsgericht": "Amtsgericht Nürnberg",
      "registernummer": "HRB 17412",
      "registerart": "HRB",
      "company_name": "N-ERGIE Aktiengesellschaft",
      "company_seat": "Nürnberg",
      "details": "21.02.2025 (Bekanntmachungsdatum)\n\nBayern Amtsgericht Nürnberg HRB 17412\nEinreichung neuer Dokumente 20.02.2025 (Eintragungsdatum)\n\nN-ERGIE Aktiengesellschaft\nAktiengesellschaft\nNürnberg\n\nDem Amtsgericht Nürnberg -Registergericht- ist eine Liste der Mitglieder des Aufsichtsrats eingereicht worden, § 106 AktG."
    },
    {
      "date": "2025-02-21",
      "id": "101919",
      "original_text": "Einreichung neuer Dokumente\nBayern Amtsgericht München HRB 154472\nBristol-Myers Squibb GmbH & Co. KGaA – München",
      "type": "Einreichung neuer Dokumente",
      "state": "Bayern",
      "amtsgericht": "Amtsgericht München",
      "registernummer": "HRB 154472",
      "registerart": "HRB",
      "company_name": "Bristol-Myers Squibb GmbH & Co. KGaA",
      "company_seat": "München",
      "details": "21.02.2025 (Bekanntmachungsdatum)\n\nBayern Amtsgericht München HRB 154472\nEinreichung neuer Dokumente\n\nBristol-Myers Squibb GmbH & Co. KGaA\nKommanditgesellschaft auf Aktien\nMünchen\n\nDem Amtsgericht München -Registergericht- isteine Liste der Mitglieder des Aufsichtsrats eingereicht worden, §§ 278 Abs. 3, 106 AktG."
    },
    {
      "date": "2025-02-21",
      "id": "101920",
      "original_text": "Löschungsankündigung\nBayern Amtsgericht München HRB 233740\nvan Lessen Consulting UG (haftungsbeschränkt) – München",
      "type": "Löschungsankündigung",
      "state": "Bayern",
      "amtsgericht": "Amtsgericht München",
      "registernummer": "HRB 233740",
      "registerart": "HRB",
      "company_name": "van Lessen Consulting UG (haftungsbeschränkt)",
      "company_seat": "München",
      "details": "21.02.2025 (Bekanntmachungsdatum)\n\nBayern Amtsgericht München HRB 233740\nLöschungsankündigung 20.02.2025 (Eintragungsdatum)\n\nvan Lessen Consulting UG (haftungsbeschränkt)\nGesellschaft mit beschränkter Haftung\nMünchen\n\nDas Registergericht beabsichtigt, die im Handelsregister eingetragene Gesellschaft wegen Vermögenslosigkeit von Amts wegen nach § 394 FamFG zu löschen. Die Frist zur Erhebung eines Widerspruchs ist auf drei Monate festgesetzt."
    },
    {
      "date": "2025-02-21",
      "id": "101921",
      "original_text": "Registerbekanntmachung nach dem Umwandlungsgesetz\nBayern Amtsgericht München HRB 182960\nBBC Treuhand- und Steuerberatungsgesellschaft AG – München",
      "type": "Registerbekanntmachung nach dem Umwandlungsgesetz",
      "state": "Bayern",
      "amtsgericht": "Amtsgericht München",
      "registernummer": "HRB 182960",
      "registerart": "HRB",
      "company_name": "BBC Treuhand- und Steuerberatungsgesellschaft AG",
      "company_seat": "München",
      "details": "21.02.2025 (Bekanntmachungsdatum)\n\nBayern Amtsgericht München HRB 182960\nRegisterbekanntmachung nach dem Umwandlungsgesetz 20.02.2025 (Eintragungsdatum)\n\nBBC Treuhand- und Steuerberatungsgesellschaft AG\nAktiengesellschaft\nMünchen\n\nDen Gläubigern der an der Verschmelzung beteiligten Rechtsträger ist, wenn sie binnen sechs Monaten nach dem Tag, an dem die Eintragung der Verschmelzung in das Register des Sitzes desjenigen Rechtsträgers, dessen Gläubiger sie sind, nach § 19 Abs. 3 UmwG als bekannt gemacht gilt, ihren Anspruch nach Grund und Höhe in Textform anmelden, Sicherheit zu leisten, soweit sie nicht Befriedigung verlangen können. Dieses Recht steht den Gläubigern jedoch nur zu, wenn sie glaubhaft machen, dass durch die Verschmelzung die Erfüllung ihrer Forderung gefährdet wird."
    },
    {
      "date": "2025-02-21",
      "id": "101922",
      "original_text": "Registerbekanntmachung nach dem Umwandlungsgesetz\nBayern Amtsgericht München HRB 272352\nJumedi GmbH – München",
      "type": "Registerbekanntmachung nach dem Umwandlungsgesetz",
      "state": "Bayern",
      "amtsgericht": "Amtsgericht München",
      "registernummer": "HRB 272352",
      "registerart": "HRB",
      "company_name": "Jumedi GmbH",
      "company_seat": "München",
      "details": "21.02.2025 (Bekanntmachungsdatum)\n\nBayern Amtsgericht München HRB 272352\nRegisterbekanntmachung nach dem Umwandlungsgesetz 20.02.2025 (Eintragungsdatum)\n\nJumedi GmbH\nGesellschaft mit beschränkter Haftung\nMünchen\n\nDen Gläubigern der an der Verschmelzung beteiligten Rechtsträger ist, wenn sie binnen sechs Monaten nach dem Tag, an dem die Eintragung der Verschmelzung in das Register des Sitzes desjenigen Rechtsträgers, dessen Gläubiger sie sind, nach § 19 Abs. 3 UmwG als bekannt gemacht gilt, ihren Anspruch nach Grund und Höhe in Textform anmelden, Sicherheit zu leisten, soweit sie nicht Befriedigung verlangen können. Dieses Recht steht den Gläubigern jedoch nur zu, wenn sie glaubhaft machen, dass durch die Verschmelzung die Erfüllung ihrer Forderung gefährdet wird."
    },
    {
      "date": "2025-02-21",
      "id": "101923",
      "original_text": "Registerbekanntmachung nach dem Umwandlungsgesetz\nBayern Amtsgericht München HRB 291397\nFAICO Services GmbH – Puchheim",
      "type": "Registerbekanntmachung nach dem Umwandlungsgesetz",
      "state": "Bayern",
      "amtsgericht": "Amtsgericht München",
      "registernummer": "HRB 291397",
      "registerart": "HRB",
      "company_name": "FAICO Services GmbH",
      "company_seat": "Puchheim",
      "details": "21.02.2025 (Bekanntmachungsdatum)\n\nBayern Amtsgericht München HRB 291397\nRegisterbekanntmachung nach dem Umwandlungsgesetz 20.02.2025 (Eintragungsdatum)\n\nFAICO Services GmbH\nGesellschaft mit beschränkter Haftung\nPuchheim\n\nDen Gläubigern der an der Verschmelzung beteiligten Rechtsträger ist, wenn sie binnen sechs Monaten nach dem Tag, an dem die Eintragung der Verschmelzung in das Register des Sitzes desjenigen Rechtsträgers, dessen Gläubiger sie sind, nach § 19 Abs. 3 UmwG als bekannt gemacht gilt, ihren Anspruch nach Grund und Höhe in Textform anmelden, Sicherheit zu leisten, soweit sie nicht Befriedigung verlangen können. Dieses Recht steht den Gläubigern jedoch nur zu, wenn sie glaubhaft machen, dass durch die Verschmelzung die Erfüllung ihrer Forderung gefährdet wird."
    },
    {
      "date": "2025-02-21",
      "id": "101924",
      "original_text": "Einreichung neuer Dokumente\nBayern Amtsgericht Augsburg HRB 40849\nLBA - Liegenschaften und Bauprojekte Altenmünster GmbH – Altenmünster",
      "type": "Einreichung neuer Dokumente",
      "state": "Bayern",
      "amtsgericht": "Amtsgericht Augsburg",
      "registernummer": "HRB 40849",
      "registerart": "HRB",
      "company_name": "LBA - Liegenschaften und Bauprojekte Altenmünster GmbH",
      "company_seat": "Altenmünster",
      "details": "21.02.2025 (Bekanntmachungsdatum)\n\nBayern Amtsgericht Augsburg HRB 40849\nEinreichung neuer Dokumente\n\nLBA - Liegenschaften und Bauprojekte Altenmünster GmbH\nGesellschaft mit beschränkter Haftung\nAltenmünster\n\nDem Amtsgericht Augsburg -Registergericht- ist eine Liste der Mitglieder des Aufsichtsrats eingereicht worden, § 52 Abs. 3 S. 2 GmbHG."
    },
    {
      "date": "2025-02-21",
      "id": "101925",
      "original_text": "Löschungsankündigung\nBayern Amtsgericht München HRB 282272\nCordata UG (haftungsbeschänkt) – München",
      "type": "Löschungsankündigung",
      "state": "Bayern",
      "amtsgericht": "Amtsgericht München",
      "registernummer": "HRB 282272",
      "registerart": "HRB",
      "company_name": "Cordata UG (haftungsbeschänkt)",
      "company_seat": "München",
      "details": "21.02.2025 (Bekanntmachungsdatum)\n\nBayern Amtsgericht München HRB 282272\nLöschungsankündigung\n\nCordata UG (haftungsbeschänkt)\nGesellschaft mit beschränkter Haftung\nMünchen\n\nDas Registergericht beabsichtigt, den im Handelsregister eingetragenen Geschäftsführer  Robert Tomas Zavasnik, geb. 16.07.1972, wegen fehlender Eignung nach § 395 FamFG zu löschen. Die Frist zur Erhebung eines Widerspruchs ist auf drei Monate festgesetzt."
    },
    {
      "date": "2025-02-21",
      "id": "101926",
      "original_text": "Löschungsankündigung\nMecklenburg-Vorpommern Amtsgericht Stralsund HRB 7762\nAKB Montage- und Personaldienst GmbH – Greifswald",
      "type": "Löschungsankündigung",
      "state": "Mecklenburg-Vorpommern",
      "amtsgericht": "Amtsgericht Stralsund",
      "registernummer": "HRB 7762",
      "registerart": "HRB",
      "company_name": "AKB Montage- und Personaldienst GmbH",
      "company_seat": "Greifswald",
      "details": "21.02.2025 (Bekanntmachungsdatum)\n\nMecklenburg-Vorpommern Amtsgericht Stralsund HRB 7762\nLöschungsankündigung\n\nAKB Montage- und Personaldienst GmbH\nGesellschaft mit beschränkter Haftung\nGreifswald\n\nDas Registergericht beabsichtigt, die Firma von Amts wegen nach § 394 FamFG zu löschen. Die Frist zur Erhebung eines Widerspruchs ist auf 1 Monat festgesetzt."
    },
    {
      "date": "2025-02-21",
      "id": "101927",
      "original_text": "Sonstige Registerbekanntmachung\nBrandenburg Amtsgericht Neuruppin HRB 907\nFWG- Fernwärmegesellschaft mit beschränkter Haftung Templin – Templin",
      "type": "Sonstige Registerbekanntmachung",
      "state": "Brandenburg",
      "amtsgericht": "Amtsgericht Neuruppin",
      "registernummer": "HRB 907",
      "registerart": "HRB",
      "company_name": "FWG- Fernwärmegesellschaft mit beschränkter Haftung Templin",
      "company_seat": "Templin",
      "details": "21.02.2025 (Bekanntmachungsdatum)\n\nBrandenburg Amtsgericht Neuruppin HRB 907\nSonstige Registerbekanntmachung\n\nFWG- Fernwärmegesellschaft mit beschränkter Haftung Templin\nGesellschaft mit beschränkter Haftung\nTemplin\n\nAls nicht eingetragen wird veröffentlicht: Eine Liste der Aufsichtsratsmitglieder wurde zum Handelsregister eingereicht."
    },
    {
      "date": "2025-02-21",
      "id": "101928",
      "original_text": "Registerbekanntmachung nach dem Umwandlungsgesetz\nBaden-Württemberg Amtsgericht Mannheim HRB 440684\nMPDV Mikrolab GmbH, Mikroprozessordatenverarbeitung und Mikroprozessorlabor – Mosbach",
      "type": "Registerbekanntmachung nach dem Umwandlungsgesetz",
      "state": "Baden-Württemberg",
      "amtsgericht": "Amtsgericht Mannheim",
      "registernummer": "HRB 440684",
      "registerart": "HRB",
      "company_name": "MPDV Mikrolab GmbH, Mikroprozessordatenverarbeitung und Mikroprozessorlabor",
      "company_seat": "Mosbach",
      "details": "21.02.2025 (Bekanntmachungsdatum)\n\nBaden-Württemberg Amtsgericht Mannheim HRB 440684\nRegisterbekanntmachung nach dem Umwandlungsgesetz 21.02.2025 (Eintragungsdatum)\n\nMPDV Mikrolab GmbH, Mikroprozessordatenverarbeitung und Mikroprozessorlabor\nGesellschaft mit beschränkter Haftung\nMosbach\n\nDen Gläubigern der an der Verschmelzung beteiligten Rechtsträger ist, wenn sie binnen sechs Monaten nach dem Tag, an dem die Eintragung der Verschmelzung in das Register des Sitzes desjenigen Rechtsträgers, dessen Gläubiger sie sind, nach § 19 Abs. 3 UmwG als bekanntgemacht gilt, ihren Anspruch nach Grund und Höhe schriftlich anmelden, Sicherheit zu leisten, soweit sie nicht Befriedigung verlangen können. Dieses Recht steht den Gläubigern jedoch nur zu, wenn sie glaubhaft machen, dass durch die Verschmelzung die Erfüllung ihrer Forderung gefährdet wird."
    },
    {
      "date": "2025-02-21",
      "id": "101929",
      "original_text": "Registerbekanntmachung nach dem Umwandlungsgesetz\nBaden-Württemberg Amtsgericht Mannheim HRB 723292\nPerfect Production GmbH – Mosbach",
      "type": "Registerbekanntmachung nach dem Umwandlungsgesetz",
      "state": "Baden-Württemberg",
      "amtsgericht": "Amtsgericht Mannheim",
      "registernummer": "HRB 723292",
      "registerart": "HRB",
      "company_name": "Perfect Production GmbH",
      "company_seat": "Mosbach",
      "details": "21.02.2025 (Bekanntmachungsdatum)\n\nBaden-Württemberg Amtsgericht Mannheim HRB 723292\nRegisterbekanntmachung nach dem Umwandlungsgesetz 21.02.2025 (Eintragungsdatum)\n\nPerfect Production GmbH\nGesellschaft mit beschränkter Haftung\nMosbach\n\nAls nicht eingetragen wird bekanntgemacht:\nDen Gläubigern der an der Verschmelzung beteiligten Rechtsträger ist, wenn sie binnen sechs Monaten nach dem Tag, an dem die Eintragung der Verschmelzung in das Register des Sitzes desjenigen Rechtsträgers, dessen Gläubiger sie sind, nach § 19 Abs. 3 UmwG als bekanntgemacht gilt, ihren Anspruch nach Grund und Höhe schriftlich anmelden, Sicherheit zu leisten, soweit sie nicht Befriedigung verlangen können. Dieses Recht steht den Gläubigern jedoch nur zu, wenn sie glaubhaft machen, dass durch die Verschmelzung die Erfüllung ihrer Forderung gefährdet wird."
    },
    {
      "date": "2025-02-21",
      "id": "101930",
      "original_text": "Löschungsankündigung\nSachsen-Anhalt Amtsgericht Stendal HRB 25748\nClassic Horse Concept Unternehmergesellschaft (haftungsbeschränkt) – Salzatal",
      "type": "Löschungsankündigung",
      "state": "Sachsen-Anhalt",
      "amtsgericht": "Amtsgericht Stendal",
      "registernummer": "HRB 25748",
      "registerart": "HRB",
      "company_name": "Classic Horse Concept Unternehmergesellschaft (haftungsbeschränkt)",
      "company_seat": "Salzatal",
      "details": "21.02.2025 (Bekanntmachungsdatum)\n\nSachsen-Anhalt Amtsgericht Stendal HRB 25748\nLöschungsankündigung\n\nClassic Horse Concept Unternehmergesellschaft (haftungsbeschränkt)\nGesellschaft mit beschränkter Haftung\nSalzatal\n\nDas Registergericht beabsichtigt, nachfolgende im Handelregister eingetragenen Firmen von Amts wegen nach § 394 FamFG zu löschen. Die Frist zu Erhebung eines Widerspruchs wird auf drei Monate festgesetzt."
    },
    {
      "date": "2025-02-21",
      "id": "101931",
      "original_text": "Registerbekanntmachung nach dem Umwandlungsgesetz\nHamburg Amtsgericht Hamburg HRB 59834\nZum goldenen Hirschen Hamburg GmbH – Hamburg",
      "type": "Registerbekanntmachung nach dem Umwandlungsgesetz",
      "state": "Hamburg",
      "amtsgericht": "Amtsgericht Hamburg",
      "registernummer": "HRB 59834",
      "registerart": "HRB",
      "company_name": "Zum goldenen Hirschen Hamburg GmbH",
      "company_seat": "Hamburg",
      "details": "21.02.2025 (Bekanntmachungsdatum)\n\nHamburg Amtsgericht Hamburg HRB 59834\nRegisterbekanntmachung nach dem Umwandlungsgesetz 20.02.2025 (Eintragungsdatum)\n\nZum goldenen Hirschen Hamburg GmbH\nGesellschaft mit beschränkter Haftung\nHamburg\n\nAls nicht eingetragen wird bekannt gemacht:\nDen Gläubigern der an der Verschmelzung beteiligten Gesellschaften ist, wenn sie binnen sechs Monaten nach dem Tag, an dem die Eintragung der Verschmelzung in das Register des Sitzes desjenigen Rechtsträgers, dessen Gläubiger sie sind, nach § 19 Absatz 3 UmwG als bekannt gemacht gilt, ihren Anspruch nach Grund und Höhe schriftlich anmelden, Sicherheit zu leisten, soweit sie nicht Befriedigung verlangen können. Dieses Recht steht den Gläubigern jedoch nur zu, wenn sie glaubhaft machen, dass durch die Verschmelzung die Erfüllung ihrer Forderung gefährdet wird."
    },
    {
      "date": "2025-02-21",
      "id": "101932",
      "original_text": "Einreichung neuer Dokumente\nBerlin Amtsgericht Berlin (Charlottenburg) HRB 196337\nhome24 SE – Berlin",
      "type": "Einreichung neuer Dokumente",
      "state": "Berlin",
      "amtsgericht": "Amtsgericht Berlin (Charlottenburg)",
      "registernummer": "HRB 196337",
      "registerart": "HRB",
      "company_name": "home24 SE",
      "company_seat": "Berlin",
      "details": "21.02.2025 (Bekanntmachungsdatum)\n\nBerlin Amtsgericht Berlin (Charlottenburg) HRB 196337\nEinreichung neuer Dokumente\n\nhome24 SE\nEuropäische Aktiengesellschaft (SE)\nBerlin\n\nAls nicht eingetragen wird veröffentlicht: Es wurde eine neue Liste der Aufsichtsratsmitglieder eingereicht (§ 106 AktG)."
    },
    {
      "date": "2025-02-21",
      "id": "101933",
      "original_text": "Registerbekanntmachung nach dem Umwandlungsgesetz\nBaden-Württemberg Amtsgericht Mannheim HRA 712445\nJoachim Hammelsbeck e.K. – Mühlacker",
      "type": "Registerbekanntmachung nach dem Umwandlungsgesetz",
      "state": "Baden-Württemberg",
      "amtsgericht": "Amtsgericht Mannheim",
      "registernummer": "HRA 712445",
      "registerart": "HRA",
      "company_name": "Joachim Hammelsbeck e.K.",
      "company_seat": "Mühlacker",
      "details": "21.02.2025 (Bekanntmachungsdatum)\n\nBaden-Württemberg Amtsgericht Mannheim HRA 712445\nRegisterbekanntmachung nach dem Umwandlungsgesetz 21.02.2025 (Eintragungsdatum)\n\nJoachim Hammelsbeck e.K.\nEinzelkaufmann / Einzelkauffrau\nMühlacker\n\nAls nicht eingetragen wird bekanntgemacht:\nDen Gläubigern der an der Verschmelzung beteiligten Rechtsträger ist, wenn sie binnen sechs Monaten nach dem Tag, an dem die Eintragung der Verschmelzung in das Register des Sitzes desjenigen Rechtsträgers, dessen Gläubiger sie sind, nach § 19 Abs. 3 UmwG als bekanntgemacht gilt, ihren Anspruch nach Grund und Höhe schriftlich anmelden, Sicherheit zu leisten, soweit sie nicht Befriedigung verlangen können. Dieses Recht steht den Gläubigern jedoch nur zu, wenn sie glaubhaft machen, dass durch die Verschmelzung die Erfüllung ihrer Forderung gefährdet wird."
    },
    {
      "date": "2025-02-21",
      "id": "101934",
      "original_text": "Einreichung neuer Dokumente\nSchleswig-Holstein Amtsgericht Pinneberg HRB 15739\nÄrztezentrum am Kanal Brunsbüttel gGmbH – Brunsbüttel",
      "type": "Einreichung neuer Dokumente",
      "state": "Schleswig-Holstein",
      "amtsgericht": "Amtsgericht Pinneberg",
      "registernummer": "HRB 15739",
      "registerart": "HRB",
      "company_name": "Ärztezentrum am Kanal Brunsbüttel gGmbH",
      "company_seat": "Brunsbüttel",
      "details": "21.02.2025 (Bekanntmachungsdatum)\n\nSchleswig-Holstein Amtsgericht Pinneberg HRB 15739\nEinreichung neuer Dokumente\n\nÄrztezentrum am Kanal Brunsbüttel gGmbH\nGesellschaft mit beschränkter Haftung\nBrunsbüttel\n\nAls nicht eingetragen wird veröffentlicht: Als nicht eingetragen wird veröffentlicht: Es ist eine neue Liste der Aufsichtsratsmitglieder gemäß § 52 Abs. 3 2 Hs. GmbHG i.V.m. § 10 HGB zum Handelsregister eingereicht worden."
    },
    {
      "date": "2025-02-21",
      "id": "101935",
      "original_text": "Einreichung neuer Dokumente\nBerlin Amtsgericht Berlin (Charlottenburg) HRB 34331\nTLG Berlin Alexanderplatz GmbH – Berlin",
      "type": "Einreichung neuer Dokumente",
      "state": "Berlin",
      "amtsgericht": "Amtsgericht Berlin (Charlottenburg)",
      "registernummer": "HRB 34331",
      "registerart": "HRB",
      "company_name": "TLG Berlin Alexanderplatz GmbH",
      "company_seat": "Berlin",
      "details": "21.02.2025 (Bekanntmachungsdatum)\n\nBerlin Amtsgericht Berlin (Charlottenburg) HRB 34331\nEinreichung neuer Dokumente\n\nTLG Berlin Alexanderplatz GmbH\nGesellschaft mit beschränkter Haftung\nBerlin\n\nAls nicht eingetragen wird veröffentlicht: Dem Registergericht liegt aktuell ein Antrag vom 06.09.2024 von Herrn Silvio Kilian, 01187 Dresden mit folgendem Inhalt vor:\n\nbeantrage ich:\n\nfür die liquidierte Gesellschaft TLG Berlin Alexanderplatz GmbH (HRB 34331) einen Nachtragsliquidator zu bestellen, dessen Wirkungskreis begrenzt sein soll, auf die Abgabe etwaiger grundbuchrechtlicher Erklärungen, insbesondere die Abgabe einer Löschungsbewilligung hinsichtlich eines zugunsten der gelöschten Gesellschaft eingetragenen Vorkaufsrechts beim Grundbuchamt Pirna Grundbuch von Reinhardtsdorf-Schöna Blatt 661 Abt. II lfd. Nr. 1 als Rechtsnachfolger der ursprünglich Begünstigten VEB Ingenieurbetrieb für Anlagen Berlin.\n\nDas Registergericht beabsichtigt zum jetzigen Zeitpunkt, diesem Antrag stattzugeben, soweit nicht binnen einer Frist von einem Monat ab Veröffentlichung Widerspruch erhoben wird. Ein Widerspruch ist entsprechend schriftlich oder elektronisch bei dem Amtsgericht Charlottenburg, DG Hardenbergstraße 31, 10623 Berlin, zum o.g. Aktenzeichen einzureichen. Der Widerspruch ist zu begründen, da eine Berücksichtigung im Verfahren andernfalls nicht erfolgen kann."
    },
    {
      "date": "2025-02-21",
      "id": "101936",
      "original_text": "Löschungsankündigung\nBrandenburg Amtsgericht Potsdam HRA 5929\nDr. Huhnt Pflanzenbaubetriebe GmbH & Co. KG – Nuthe-Urstromtal",
      "type": "Löschungsankündigung",
      "state": "Brandenburg",
      "amtsgericht": "Amtsgericht Potsdam",
      "registernummer": "HRA 5929",
      "registerart": "HRA",
      "company_name": "Dr. Huhnt Pflanzenbaubetriebe GmbH & Co. KG",
      "company_seat": "Nuthe-Urstromtal",
      "details": "21.02.2025 (Bekanntmachungsdatum)\n\nBrandenburg Amtsgericht Potsdam HRA 5929\nLöschungsankündigung\n\nDr. Huhnt Pflanzenbaubetriebe GmbH & Co. KG\nKommanditgesellschaft\nNuthe-Urstromtal\n\nBei der nachstehenden Gesellschaft wird das Amtslöschungsverfahren gemäß § 394 Abs. 4 FamFG eingeleitet."
    },
    {
      "date": "2025-02-21",
      "id": "101937",
      "original_text": "Registerbekanntmachung nach dem Umwandlungsgesetz\nBaden-Württemberg Amtsgericht Mannheim HRB 735144\nHSP STEUER Pforzheim GmbH Steuerberatungsgesellschaft – Pforzheim",
      "type": "Registerbekanntmachung nach dem Umwandlungsgesetz",
      "state": "Baden-Württemberg",
      "amtsgericht": "Amtsgericht Mannheim",
      "registernummer": "HRB 735144",
      "registerart": "HRB",
      "company_name": "HSP STEUER Pforzheim GmbH Steuerberatungsgesellschaft",
      "company_seat": "Pforzheim",
      "details": "21.02.2025 (Bekanntmachungsdatum)\n\nBaden-Württemberg Amtsgericht Mannheim HRB 735144\nRegisterbekanntmachung nach dem Umwandlungsgesetz 21.02.2025 (Eintragungsdatum)\n\nHSP STEUER Pforzheim GmbH Steuerberatungsgesellschaft\nGesellschaft mit beschränkter Haftung\nPforzheim\n\nDen Gläubigern der an der Verschmelzung beteiligten Rechtsträger ist, wenn sie binnen sechs Monaten nach dem Tag, an dem die Eintragung der Verschmelzung in das Register des Sitzes desjenigen Rechtsträgers, dessen Gläubiger sie sind, nach § 19 Abs. 3 UmwG als bekanntgemacht gilt, ihren Anspruch nach Grund und Höhe schriftlich anmelden, Sicherheit zu leisten, soweit sie nicht Befriedigung verlangen können. Dieses Recht steht den Gläubigern jedoch nur zu, wenn sie glaubhaft machen, dass durch die Verschmelzung die Erfüllung ihrer Forderung gefährdet wird."
    },
    {
      "date": "2025-02-21",
      "id": "101938",
      "original_text": "Registerbekanntmachung nach dem Umwandlungsgesetz\nBaden-Württemberg Amtsgericht Mannheim HRB 511241\nJH Werkzeug GmbH – Mühlacker",
      "type": "Registerbekanntmachung nach dem Umwandlungsgesetz",
      "state": "Baden-Württemberg",
      "amtsgericht": "Amtsgericht Mannheim",
      "registernummer": "HRB 511241",
      "registerart": "HRB",
      "company_name": "JH Werkzeug GmbH",
      "company_seat": "Mühlacker",
      "details": "21.02.2025 (Bekanntmachungsdatum)\n\nBaden-Württemberg Amtsgericht Mannheim HRB 511241\nRegisterbekanntmachung nach dem Umwandlungsgesetz 21.02.2025 (Eintragungsdatum)\n\nJH Werkzeug GmbH\nGesellschaft mit beschränkter Haftung\nMühlacker\n\nAls nicht eingetragen wird bekanntgemacht:Den Gläubigern der an der Verschmelzung beteiligten Rechtsträger ist, wenn sie binnen sechs Monaten nach dem Tag, an dem die Eintragung der Verschmelzung in das Register des Sitzes desjenigen Rechtsträgers, dessen Gläubiger sie sind, nach § 19 Abs. 3 UmwG als bekanntgemacht gilt, ihren Anspruch nach Grund und Höhe schriftlich anmelden, Sicherheit zu leisten, soweit sie nicht Befriedigung verlangen können. Dieses Recht steht den Gläubigern jedoch nur zu, wenn sie glaubhaft machen, dass durch die Verschmelzung die Erfüllung ihrer Forderung gefährdet wird."
    },
    {
      "date": "2025-02-21",
      "id": "101939",
      "original_text": "Einreichung neuer Dokumente\nBerlin Amtsgericht Berlin (Charlottenburg) HRB 231672\nMellifera Vierzigste Beteiligungsgesellschaft mbH – Berlin",
      "type": "Einreichung neuer Dokumente",
      "state": "Berlin",
      "amtsgericht": "Amtsgericht Berlin (Charlottenburg)",
      "registernummer": "HRB 231672",
      "registerart": "HRB",
      "company_name": "Mellifera Vierzigste Beteiligungsgesellschaft mbH",
      "company_seat": "Berlin",
      "details": "21.02.2025 (Bekanntmachungsdatum)\n\nBerlin Amtsgericht Berlin (Charlottenburg) HRB 231672\nEinreichung neuer Dokumente\n\nMellifera Vierzigste Beteiligungsgesellschaft mbH\nGesellschaft mit beschränkter Haftung\nBerlin\n\nAls nicht eingetragen wird veröffentlicht: Es wurde eine neue Liste der Beiratsmitglieder eingereicht (§52 GmbHG)."
    },
    {
      "date": "2025-02-21",
      "id": "101940",
      "original_text": "Registerbekanntmachung nach dem Umwandlungsgesetz\nBaden-Württemberg Amtsgericht Mannheim HRB 502210\nHSP STEUER Pforzheim GmbH Steuerberatungsgesellschaft – Pforzheim",
      "type": "Registerbekanntmachung nach dem Umwandlungsgesetz",
      "state": "Baden-Württemberg",
      "amtsgericht": "Amtsgericht Mannheim",
      "registernummer": "HRB 502210",
      "registerart": "HRB",
      "company_name": "HSP STEUER Pforzheim GmbH Steuerberatungsgesellschaft",
      "company_seat": "Pforzheim",
      "details": "21.02.2025 (Bekanntmachungsdatum)\n\nBaden-Württemberg Amtsgericht Mannheim HRB 502210\nRegisterbekanntmachung nach dem Umwandlungsgesetz 21.02.2025 (Eintragungsdatum)\n\nHSP STEUER Pforzheim GmbH Steuerberatungsgesellschaft\nGesellschaft mit beschränkter Haftung\nPforzheim\n\nAls nicht eingetragen wird bekanntgemacht:\nDen Gläubigern der an der Verschmelzung beteiligten Rechtsträger ist, wenn sie binnen sechs Monaten nach dem Tag, an dem die Eintragung der Verschmelzung in das Register des Sitzes desjenigen Rechtsträgers, dessen Gläubiger sie sind, nach § 19 Abs. 3 UmwG als bekanntgemacht gilt, ihren Anspruch nach Grund und Höhe schriftlich anmelden, Sicherheit zu leisten, soweit sie nicht Befriedigung verlangen können. Dieses Recht steht den Gläubigern jedoch nur zu, wenn sie glaubhaft machen, dass durch die Verschmelzung die Erfüllung ihrer Forderung gefährdet wird."
    },
    {
      "date": "2025-02-21",
      "id": "101941",
      "original_text": "Einreichung neuer Dokumente\nBerlin Amtsgericht Berlin (Charlottenburg) HRB 12300\nSiemens Aktiengesellschaft – Berlin und München",
      "type": "Einreichung neuer Dokumente",
      "state": "Berlin",
      "amtsgericht": "Amtsgericht Berlin (Charlottenburg)",
      "registernummer": "HRB 12300",
      "registerart": "HRB",
      "company_name": "Siemens Aktiengesellschaft",
      "company_seat": "Berlin und München",
      "details": "21.02.2025 (Bekanntmachungsdatum)\n\nBerlin Amtsgericht Berlin (Charlottenburg) HRB 12300\nEinreichung neuer Dokumente\n\nSiemens Aktiengesellschaft\nAktiengesellschaft\nBerlin und München\n\nAls nicht eingetragen wird veröffentlicht: Es wurde eine neue Liste der Aufsichtsratsmitglieder eingereicht (§ 106 AktG)."
    },
    {
      "date": "2025-02-21",
      "id": "101942",
      "original_text": "Sonstige Registerbekanntmachung\nBaden-Württemberg Amtsgericht Stuttgart HRB 782942\nPV Reisbach GmbH – Niedernhall",
      "type": "Sonstige Registerbekanntmachung",
      "state": "Baden-Württemberg",
      "amtsgericht": "Amtsgericht Stuttgart",
      "registernummer": "HRB 782942",
      "registerart": "HRB",
      "company_name": "PV Reisbach GmbH",
      "company_seat": "Niedernhall",
      "details": "21.02.2025 (Bekanntmachungsdatum)\n\nBaden-Württemberg Amtsgericht Stuttgart HRB 782942\nSonstige Registerbekanntmachung 21.02.2025 (Eintragungsdatum)\n\nPV Reisbach GmbH\nGesellschaft mit beschränkter Haftung\nNiedernhall\n\nAls nicht eingetragen wird bekanntgemacht:\nDen Gläubigern der Gesellschaft, deren Forderungen begründet worden sind, bevor die Eintragung der Beendigung des Vertrages in das Handelsregister nach § 10 HGB als bekanntgemacht gilt, ist vom anderen Vertragsteil Sicherheit zu leisten, wenn sie sich binnen sechs Monaten nach der Bekanntmachung zu diesem Zweck bei ihm melden."
    },
    {
      "date": "2025-02-21",
      "id": "101943",
      "original_text": "Löschungsankündigung\nBrandenburg Amtsgericht Frankfurt/Oder HRB 13698\nNATURSTEIN u. TERRAZZO Beyer UG (haftungsbeschränkt) – Bernau bei Berlin",
      "type": "Löschungsankündigung",
      "state": "Brandenburg",
      "amtsgericht": "Amtsgericht Frankfurt/Oder",
      "registernummer": "HRB 13698",
      "registerart": "HRB",
      "company_name": "NATURSTEIN u. TERRAZZO Beyer UG (haftungsbeschränkt)",
      "company_seat": "Bernau bei Berlin",
      "details": "21.02.2025 (Bekanntmachungsdatum)\n\nBrandenburg Amtsgericht Frankfurt/Oder HRB 13698\nLöschungsankündigung\n\nNATURSTEIN u. TERRAZZO Beyer UG (haftungsbeschränkt)\nGesellschaft mit beschränkter Haftung\nBernau bei Berlin\n\nBei der nachstehenden Gesellschaft wird das Amtslöschungsverfahren gemäß § 394 FamFG eingeleitet."
    },
    {
      "date": "2025-02-21",
      "id": "101944",
      "original_text": "Einreichung neuer Dokumente\nBaden-Württemberg Amtsgericht Mannheim HRB 719353\nRöchling Beteiligungs SE – Mannheim",
      "type": "Einreichung neuer Dokumente",
      "state": "Baden-Württemberg",
      "amtsgericht": "Amtsgericht Mannheim",
      "registernummer": "HRB 719353",
      "registerart": "HRB",
      "company_name": "Röchling Beteiligungs SE",
      "company_seat": "Mannheim",
      "details": "21.02.2025 (Bekanntmachungsdatum)\n\nBaden-Württemberg Amtsgericht Mannheim HRB 719353\nEinreichung neuer Dokumente 21.02.2025 (Eintragungsdatum)\n\nRöchling Beteiligungs SE\nEuropäische Aktiengesellschaft (SE)\nMannheim\n\nDie Gesellschaft hat am 17.02.2025 die Liste über die Zusammensetzung des Aufsichtsrats zum Handelsregister eingereicht."
    },
    {
      "date": "2025-02-21",
      "id": "101945",
      "original_text": "Löschungsankündigung\nBerlin Amtsgericht Berlin (Charlottenburg) HRB 161986\nGroove Choir UG (haftungsbeschränkt) – Berlin",
      "type": "Löschungsankündigung",
      "state": "Berlin",
      "amtsgericht": "Amtsgericht Berlin (Charlottenburg)",
      "registernummer": "HRB 161986",
      "registerart": "HRB",
      "company_name": "Groove Choir UG (haftungsbeschränkt)",
      "company_seat": "Berlin",
      "details": "21.02.2025 (Bekanntmachungsdatum)\n\nBerlin Amtsgericht Berlin (Charlottenburg) HRB 161986\nLöschungsankündigung\n\nGroove Choir UG (haftungsbeschränkt)\nGesellschaft mit beschränkter Haftung\nBerlin\n\nBei der nachstehenden Gesellschaft wird das Amtslöschungsverfahren gemäß § 394 FamFG eingeleitet. Widerspruchsfrist 6 Wochen"
    },
    {
      "date": "2025-02-21",
      "id": "101946",
      "original_text": "Registerbekanntmachung nach dem Umwandlungsgesetz\nHamburg Amtsgericht Hamburg HRB 108320\nMVZ Medizinisches Labor Nord MLN GmbH – Hamburg",
      "type": "Registerbekanntmachung nach dem Umwandlungsgesetz",
      "state": "Hamburg",
      "amtsgericht": "Amtsgericht Hamburg",
      "registernummer": "HRB 108320",
      "registerart": "HRB",
      "company_name": "MVZ Medizinisches Labor Nord MLN GmbH",
      "company_seat": "Hamburg",
      "details": "21.02.2025 (Bekanntmachungsdatum)\n\nHamburg Amtsgericht Hamburg HRB 108320\nRegisterbekanntmachung nach dem Umwandlungsgesetz 21.02.2025 (Eintragungsdatum)\n\nMVZ Medizinisches Labor Nord MLN GmbH\nGesellschaft mit beschränkter Haftung\nHamburg\n\nAls nicht eingetragen wird bekannt gemacht:\nDen Gläubigern der an der Verschmelzung beteiligten Gesellschaften ist, wenn sie binnen sechs Monaten nach dem Tag, an dem die Eintragung der Verschmelzung in das Register des Sitzes desjenigen Rechtsträgers, dessen Gläubiger sie sind, nach § 19 Absatz 3 UmwG als bekannt gemacht gilt, ihren Anspruch nach Grund und Höhe schriftlich anmelden, Sicherheit zu leisten, soweit sie nicht Befriedigung verlangen können. Dieses Recht steht den Gläubigern jedoch nur zu, wenn sie glaubhaft machen, dass durch die Verschmelzung die Erfüllung ihrer Forderung gefährdet wird."
    },
    {
      "date": "2025-02-21",
      "id": "101947",
      "original_text": "Einreichung neuer Dokumente\nThüringen Amtsgericht Jena HRB 508777\nASB gemeinnützige Service GmbH – Erfurt",
      "type": "Einreichung neuer Dokumente",
      "state": "Thüringen",
      "amtsgericht": "Amtsgericht Jena",
      "registernummer": "HRB 508777",
      "registerart": "HRB",
      "company_name": "ASB gemeinnützige Service GmbH",
      "company_seat": "Erfurt",
      "details": "21.02.2025 (Bekanntmachungsdatum)\n\nThüringen Amtsgericht Jena HRB 508777\nEinreichung neuer Dokumente 21.02.2025 (Eintragungsdatum)\n\nASB gemeinnützige Service GmbH\nGesellschaft mit beschränkter Haftung\nErfurt\n\nBekanntmachung gem. § 52 Abs. 3 Satz 2 GmbHG: Aufgrund einer Veränderung in den Personen der Aufsichtsratsmitglieder ist durch die Geschäftsführer eine neue Liste zum Handelsregister eingereicht worden."
    },
    {
      "date": "2025-02-21",
      "id": "101948",
      "original_text": "Löschungsankündigung\nThüringen Amtsgericht Jena HRB 113954\nGoldbacher Photovoltaik- & Solaranlagen GmbH – Nessetal",
      "type": "Löschungsankündigung",
      "state": "Thüringen",
      "amtsgericht": "Amtsgericht Jena",
      "registernummer": "HRB 113954",
      "registerart": "HRB",
      "company_name": "Goldbacher Photovoltaik- & Solaranlagen GmbH",
      "company_seat": "Nessetal",
      "details": "21.02.2025 (Bekanntmachungsdatum)\n\nThüringen Amtsgericht Jena HRB 113954\nLöschungsankündigung\n\nGoldbacher Photovoltaik- & Solaranlagen GmbH\nGesellschaft mit beschränkter Haftung\nNessetal\n\nDas Registergericht beabsichtigt, die im Handelsregister eingetragene Gesellschaft wegen Vermögenslosigkeit nach § 394 FamFG von Amts wegen zu löschen. Die Frist zur Erhebung eines Widerspruchs gegen die beabsichtigte Löschung wird auf 6 Wochen festgesetzt."
    },
    {
      "date": "2025-02-21",
      "id": "101949",
      "original_text": "Löschungsankündigung\nThüringen Amtsgericht Jena HRB 405636\nAutohaus George & Krüger GmbH – Nordhausen",
      "type": "Löschungsankündigung",
      "state": "Thüringen",
      "amtsgericht": "Amtsgericht Jena",
      "registernummer": "HRB 405636",
      "registerart": "HRB",
      "company_name": "Autohaus George & Krüger GmbH",
      "company_seat": "Nordhausen",
      "details": "21.02.2025 (Bekanntmachungsdatum)\n\nThüringen Amtsgericht Jena HRB 405636\nLöschungsankündigung\n\nAutohaus George & Krüger GmbH\nGesellschaft mit beschränkter Haftung\nNordhausen\n\nDas Registergericht beabsichtigt, die im Handelsregister eingetragene Gesellschaft wegen Vermögenslosigkeit nach § 394 FamFG von Amts wegen zu löschen. Die Frist zur Erhebung eines Widerspruchs gegen die beabsichtigte Löschung wird auf 6 Wochen festgesetzt."
    },
    {
      "date": "2025-02-21",
      "id": "101950",
      "original_text": "Einreichung neuer Dokumente\nThüringen Amtsgericht Jena HRB 103908\nThüringer Landgesellschaft mbH – Erfurt",
      "type": "Einreichung neuer Dokumente",
      "state": "Thüringen",
      "amtsgericht": "Amtsgericht Jena",
      "registernummer": "HRB 103908",
      "registerart": "HRB",
      "company_name": "Thüringer Landgesellschaft mbH",
      "company_seat": "Erfurt",
      "details": "21.02.2025 (Bekanntmachungsdatum)\n\nThüringen Amtsgericht Jena HRB 103908\nEinreichung neuer Dokumente\n\nThüringer Landgesellschaft mbH\nGesellschaft mit beschränkter Haftung\nErfurt\n\nBekanntmachung gem. § 52 Abs. 3 Satz 2 GmbHG: Aufgrund einer Veränderung in den Personen der Aufsichtsratsmitglieder ist durch die Geschäftsführer eine neue Liste zum Handelsregister eingereicht worden."
    },
    {
      "date": "2025-02-21",
      "id": "101951",
      "original_text": "Löschungsankündigung\nThüringen Amtsgericht Jena HRB 109826\nMöschwitzer GmbH – Erfurt",
      "type": "Löschungsankündigung",
      "state": "Thüringen",
      "amtsgericht": "Amtsgericht Jena",
      "registernummer": "HRB 109826",
      "registerart": "HRB",
      "company_name": "Möschwitzer GmbH",
      "company_seat": "Erfurt",
      "details": "21.02.2025 (Bekanntmachungsdatum)\n\nThüringen Amtsgericht Jena HRB 109826\nLöschungsankündigung\n\nMöschwitzer GmbH\nGesellschaft mit beschränkter Haftung\nErfurt\n\nDas Registergericht beabsichtigt, die im Handelsregister eingetragene Gesellschaft wegen Vermögenslosigkeit nach § 394 FamFG von Amts wegen zu löschen. Die Frist zur Erhebung eines Widerspruchs gegen die beabsichtigte Löschung wird auf 6 Wochen festgesetzt."
    },
    {
      "date": "2025-02-21",
      "id": "101952",
      "original_text": "Löschungsankündigung\nBerlin Amtsgericht Berlin (Charlottenburg) HRB 89568\nAm Checkpoint Charlie Verwaltungsgesellschaft mbH – Berlin",
      "type": "Löschungsankündigung",
      "state": "Berlin",
      "amtsgericht": "Amtsgericht Berlin (Charlottenburg)",
      "registernummer": "HRB 89568",
      "registerart": "HRB",
      "company_name": "Am Checkpoint Charlie Verwaltungsgesellschaft mbH",
      "company_seat": "Berlin",
      "details": "21.02.2025 (Bekanntmachungsdatum)\n\nBerlin Amtsgericht Berlin (Charlottenburg) HRB 89568\nLöschungsankündigung\n\nAm Checkpoint Charlie Verwaltungsgesellschaft mbH\nGesellschaft mit beschränkter Haftung\nBerlin\n\nBei der nachstehenden Gesellschaft wird das Amtslöschungsverfahren gemäß § 394 FamFG eingeleitet. Widerspruchsfrist 6 Wochen"
    },
    {
      "date": "2025-02-21",
      "id": "101953",
      "original_text": "Löschungsankündigung\nBerlin Amtsgericht Berlin (Charlottenburg) HRB 204150\nPalica Betriebs GmbH – Berlin",
      "type": "Löschungsankündigung",
      "state": "Berlin",
      "amtsgericht": "Amtsgericht Berlin (Charlottenburg)",
      "registernummer": "HRB 204150",
      "registerart": "HRB",
      "company_name": "Palica Betriebs GmbH",
      "company_seat": "Berlin",
      "details": "21.02.2025 (Bekanntmachungsdatum)\n\nBerlin Amtsgericht Berlin (Charlottenburg) HRB 204150\nLöschungsankündigung\n\nPalica Betriebs GmbH\nGesellschaft mit beschränkter Haftung\nBerlin\n\nBei der nachstehenden Gesellschaft wird das Amtslöschungsverfahren gemäß § 394 FamFG eingeleitet. Widerspruchsfrist 6 Wochen"
    },
    {
      "date": "2025-02-21",
      "id": "101954",
      "original_text": "Registerbekanntmachung nach dem Umwandlungsgesetz\nSachsen Amtsgericht Dresden HRB 27011\nHMT - Herrmann Medizintechnik GmbH – Radebeul",
      "type": "Registerbekanntmachung nach dem Umwandlungsgesetz",
      "state": "Sachsen",
      "amtsgericht": "Amtsgericht Dresden",
      "registernummer": "HRB 27011",
      "registerart": "HRB",
      "company_name": "HMT - Herrmann Medizintechnik GmbH",
      "company_seat": "Radebeul",
      "details": "21.02.2025 (Bekanntmachungsdatum)\n\nSachsen Amtsgericht Dresden HRB 27011\nRegisterbekanntmachung nach dem Umwandlungsgesetz 21.02.2025 (Eintragungsdatum)\n\nHMT - Herrmann Medizintechnik GmbH\nGesellschaft mit beschränkter Haftung\nRadebeul\n\nDen Gläubigern der an der #DV.Auswahl(Text=\"Betreffende Alternative auswählen\",Eingabe=\"Verschmelzung beteiligten Rechtsträger ist, wenn sie binnen sechs Monaten nach dem Tag, an dem die Eintragung der Verschmelzung in das Register des Sitzes desjenigen Rechtsträgers, dessen Gläubiger sie sind, nach § 19 Abs. 3 UmwG als bekannt gemacht gilt, ihren Anspruch nach Grund und Höhe in Textform anmelden, Sicherheit zu leisten, soweit sie nicht Befriedigung verlangen können. Dieses Recht steht den Gläubigern jedoch nur zu, wenn sie glaubhaft machen, dass durch die Verschmelzung die Erfüllung der Forderung gefährdet wird.\"|\"Verschmelzung\",\"Spaltung beteiligten Rechtsträger ist, wenn sie binnen sechs Monaten nach dem Tag, an dem die Eintragung der Spaltung in das Register des Sitzes desjenigen Rechtsträgers, dessen Gläubiger sie sind, nach § 19 Abs. 3 UmwG als bekannt gemacht gilt, ihren Anspruch nach Grund und Höhe in Textform anmelden, Sicherheit zu leisten, soweit sie nicht Befriedigung verlangen können. Dieses Recht steht den Gläubigern jedoch nur zu, wenn sie glaubhaft machen, dass durch die Spaltung die Erfüllung der Forderung gefährdet wird.\"|\"Spaltung\",\"Umwandlung beteiligten Rechtsträger ist, wenn sie binnen sechs Monaten nach dem Tag, an dem die Eintragung der Umwandlung in das Register des Sitzes desjenigen Rechtsträgers, dessen Gläubiger sie sind, nach § 19 Abs. 3 UmwG als bekannt gemacht gilt, ihren Anspruch nach Grund und Höhe in Textform anmelden, Sicherheit zu leisten, soweit sie nicht Befriedigung verlangen können. Dieses Recht steht den Gläubigern jedoch nur zu, wenn sie glaubhaft machen, dass durch die Umwandlung die Erfüllung der Forderung gefährdet wird.\"|\"Umwandlung\",\"Ausgliederung beteiligten Rechtsträger ist, wenn sie binnen sechs Monaten nach dem Tag, an dem die Eintragung der Ausgliederung in das Register des Sitzes desjenigen Rechtsträgers, dessen Gläubiger sie sind, nach § 19 Abs. 3 UmwG als bekannt gemacht gilt, ihren Anspruch nach Grund und Höhe in Textform anmelden, Sicherheit zu leisten, soweit sie nicht Befriedigung verlangen können. Dieses Recht steht den Gläubigern jedoch nur zu, wenn sie glaubhaft machen, dass durch die Ausgliederung die Erfüllung der Forderung gefährdet wird.\"|\"Ausgliederung\")"
    },
    {
      "date": "2025-02-21",
      "id": "101955",
      "original_text": "Löschungsankündigung\nSachsen Amtsgericht Dresden HRA 5388\nAlcatech Service und Vertrieb GmbH & Co. KG – Dresden",
      "type": "Löschungsankündigung",
      "state": "Sachsen",
      "amtsgericht": "Amtsgericht Dresden",
      "registernummer": "HRA 5388",
      "registerart": "HRA",
      "company_name": "Alcatech Service und Vertrieb GmbH & Co. KG",
      "company_seat": "Dresden",
      "details": "21.02.2025 (Bekanntmachungsdatum)\n\nSachsen Amtsgericht Dresden HRA 5388\nLöschungsankündigung\n\nAlcatech Service und Vertrieb GmbH & Co. KG\nKommanditgesellschaft\nDresden\n\nDas Registergericht beabsichtigt, die im Handelsregister eingetragene Gesellschaft von Amts wegen nach § 394 FamFG zu löschen. Die Frist zu Erhebung eines Widerspruchs gegen die beabsichtigte Löschung wird auf einen Monat festgesetzt.Das Registergericht beabsichtigt, die im Handelsregister eingetragene Firma von Amts wegen nach § 31 Abs. 2 HGB, 393 FamFG zu löschen. Die Frist zur Erhebung eines Widerspruchs gegen die beabsichtigte Löschung wird auf einen Monat festgesetzt."
    },
    {
      "date": "2025-02-21",
      "id": "101956",
      "original_text": "Löschungsankündigung\nSachsen Amtsgericht Dresden HRB 33461\nHÄMA - Maschinenbau GmbH – Dresden",
      "type": "Löschungsankündigung",
      "state": "Sachsen",
      "amtsgericht": "Amtsgericht Dresden",
      "registernummer": "HRB 33461",
      "registerart": "HRB",
      "company_name": "HÄMA - Maschinenbau GmbH",
      "company_seat": "Dresden",
      "details": "21.02.2025 (Bekanntmachungsdatum)\n\nSachsen Amtsgericht Dresden HRB 33461\nLöschungsankündigung\n\nHÄMA - Maschinenbau GmbH\nGesellschaft mit beschränkter Haftung\nDresden\n\nDas Registergericht beabsichtigt, die im Handelsregister eingetragene Gesellschaft von Amts wegen nach § 394 FamFG zu löschen. Die Frist zu Erhebung eines Widerspruchs gegen die beabsichtigte Löschung wird auf einen Monat festgesetzt."
    },
    {
      "date": "2025-02-21",
      "id": "101957",
      "original_text": "Einreichung neuer Dokumente\nSachsen Amtsgericht Dresden HRB 37261\nWasser Abwasser Betriebsgesellschaft Radebeul+Coswig mbH – Radebeul",
      "type": "Einreichung neuer Dokumente",
      "state": "Sachsen",
      "amtsgericht": "Amtsgericht Dresden",
      "registernummer": "HRB 37261",
      "registerart": "HRB",
      "company_name": "Wasser Abwasser Betriebsgesellschaft Radebeul+Coswig mbH",
      "company_seat": "Radebeul",
      "details": "21.02.2025 (Bekanntmachungsdatum)\n\nSachsen Amtsgericht Dresden HRB 37261\nEinreichung neuer Dokumente 21.02.2025 (Eintragungsdatum)\n\nWasser Abwasser Betriebsgesellschaft Radebeul+Coswig mbH\nGesellschaft mit beschränkter Haftung\nRadebeul\n\nAm 18.02.2025 wurde beim Handelsregister des Amtsgerichts Dresden die Liste der Mitglieder des Aufsichtsrats gemäß § 52 GmbHG eingereicht."
    },
    {
      "date": "2025-02-21",
      "id": "101958",
      "original_text": "Löschungsankündigung\nSachsen Amtsgericht Dresden HRB 26263\nBau- und Immobilienmanagement in Sachsen GmbH – Bahretal",
      "type": "Löschungsankündigung",
      "state": "Sachsen",
      "amtsgericht": "Amtsgericht Dresden",
      "registernummer": "HRB 26263",
      "registerart": "HRB",
      "company_name": "Bau- und Immobilienmanagement in Sachsen GmbH",
      "company_seat": "Bahretal",
      "details": "21.02.2025 (Bekanntmachungsdatum)\n\nSachsen Amtsgericht Dresden HRB 26263\nLöschungsankündigung\n\nBau- und Immobilienmanagement in Sachsen GmbH\nGesellschaft mit beschränkter Haftung\nBahretal\n\nDas Registergericht beabsichtigt, die im Handelsregister eingetragene Gesellschaft von Amts wegen nach § 394 FamFG zu löschen. Die Frist zu Erhebung eines Widerspruchs gegen die beabsichtigte Löschung wird auf einen Monat festgesetzt."
    },
    {
      "date": "2025-02-21",
      "id": "101959",
      "original_text": "Registerbekanntmachung nach dem Umwandlungsgesetz\nSachsen Amtsgericht Dresden HRB 21014\nSimcron GmbH – Dresden",
      "type": "Registerbekanntmachung nach dem Umwandlungsgesetz",
      "state": "Sachsen",
      "amtsgericht": "Amtsgericht Dresden",
      "registernummer": "HRB 21014",
      "registerart": "HRB",
      "company_name": "Simcron GmbH",
      "company_seat": "Dresden",
      "details": "21.02.2025 (Bekanntmachungsdatum)\n\nSachsen Amtsgericht Dresden HRB 21014\nRegisterbekanntmachung nach dem Umwandlungsgesetz 21.02.2025 (Eintragungsdatum)\n\nSimcron GmbH\nGesellschaft mit beschränkter Haftung\nDresden\n\nDen Gläubigern der an der #DV.Auswahl(Text=\"Betreffende Alternative auswählen\",Eingabe=\"Verschmelzung beteiligten Rechtsträger ist, wenn sie binnen sechs Monaten nach dem Tag, an dem die Eintragung der Verschmelzung in das Register des Sitzes desjenigen Rechtsträgers, dessen Gläubiger sie sind, nach § 19 Abs. 3 UmwG als bekannt gemacht gilt, ihren Anspruch nach Grund und Höhe in Textform anmelden, Sicherheit zu leisten, soweit sie nicht Befriedigung verlangen können. Dieses Recht steht den Gläubigern jedoch nur zu, wenn sie glaubhaft machen, dass durch die Verschmelzung die Erfüllung der Forderung gefährdet wird.\"|\"Verschmelzung\",\"Spaltung beteiligten Rechtsträger ist, wenn sie binnen sechs Monaten nach dem Tag, an dem die Eintragung der Spaltung in das Register des Sitzes desjenigen Rechtsträgers, dessen Gläubiger sie sind, nach § 19 Abs. 3 UmwG als bekannt gemacht gilt, ihren Anspruch nach Grund und Höhe in Textform anmelden, Sicherheit zu leisten, soweit sie nicht Befriedigung verlangen können. Dieses Recht steht den Gläubigern jedoch nur zu, wenn sie glaubhaft machen, dass durch die Spaltung die Erfüllung der Forderung gefährdet wird.\"|\"Spaltung\",\"Umwandlung beteiligten Rechtsträger ist, wenn sie binnen sechs Monaten nach dem Tag, an dem die Eintragung der Umwandlung in das Register des Sitzes desjenigen Rechtsträgers, dessen Gläubiger sie sind, nach § 19 Abs. 3 UmwG als bekannt gemacht gilt, ihren Anspruch nach Grund und Höhe in Textform anmelden, Sicherheit zu leisten, soweit sie nicht Befriedigung verlangen können. Dieses Recht steht den Gläubigern jedoch nur zu, wenn sie glaubhaft machen, dass durch die Umwandlung die Erfüllung der Forderung gefährdet wird.\"|\"Umwandlung\",\"Ausgliederung beteiligten Rechtsträger ist, wenn sie binnen sechs Monaten nach dem Tag, an dem die Eintragung der Ausgliederung in das Register des Sitzes desjenigen Rechtsträgers, dessen Gläubiger sie sind, nach § 19 Abs. 3 UmwG als bekannt gemacht gilt, ihren Anspruch nach Grund und Höhe in Textform anmelden, Sicherheit zu leisten, soweit sie nicht Befriedigung verlangen können. Dieses Recht steht den Gläubigern jedoch nur zu, wenn sie glaubhaft machen, dass durch die Ausgliederung die Erfüllung der Forderung gefährdet wird.\"|\"Ausgliederung\")"
    },
    {
      "date": "2025-02-21",
      "id": "101960",
      "original_text": "Registerbekanntmachung nach dem Umwandlungsgesetz\nSachsen Amtsgericht Dresden HRB 8\nalltrotec GmbH Softwaresystemhaus – Dresden",
      "type": "Registerbekanntmachung nach dem Umwandlungsgesetz",
      "state": "Sachsen",
      "amtsgericht": "Amtsgericht Dresden",
      "registernummer": "HRB 8",
      "registerart": "HRB",
      "company_name": "alltrotec GmbH Softwaresystemhaus",
      "company_seat": "Dresden",
      "details": "21.02.2025 (Bekanntmachungsdatum)\n\nSachsen Amtsgericht Dresden HRB 8\nRegisterbekanntmachung nach dem Umwandlungsgesetz 21.02.2025 (Eintragungsdatum)\n\nalltrotec GmbH Softwaresystemhaus\nGesellschaft mit beschränkter Haftung\nDresden\n\nDen Gläubigern der an der #DV.Auswahl(Text=\"Betreffende Alternative auswählen\",Eingabe=\"Verschmelzung beteiligten Rechtsträger ist, wenn sie binnen sechs Monaten nach dem Tag, an dem die Eintragung der Verschmelzung in das Register des Sitzes desjenigen Rechtsträgers, dessen Gläubiger sie sind, nach § 19 Abs. 3 UmwG als bekannt gemacht gilt, ihren Anspruch nach Grund und Höhe in Textform anmelden, Sicherheit zu leisten, soweit sie nicht Befriedigung verlangen können. Dieses Recht steht den Gläubigern jedoch nur zu, wenn sie glaubhaft machen, dass durch die Verschmelzung die Erfüllung der Forderung gefährdet wird.\"|\"Verschmelzung\",\"Spaltung beteiligten Rechtsträger ist, wenn sie binnen sechs Monaten nach dem Tag, an dem die Eintragung der Spaltung in das Register des Sitzes desjenigen Rechtsträgers, dessen Gläubiger sie sind, nach § 19 Abs. 3 UmwG als bekannt gemacht gilt, ihren Anspruch nach Grund und Höhe in Textform anmelden, Sicherheit zu leisten, soweit sie nicht Befriedigung verlangen können. Dieses Recht steht den Gläubigern jedoch nur zu, wenn sie glaubhaft machen, dass durch die Spaltung die Erfüllung der Forderung gefährdet wird.\"|\"Spaltung\",\"Umwandlung beteiligten Rechtsträger ist, wenn sie binnen sechs Monaten nach dem Tag, an dem die Eintragung der Umwandlung in das Register des Sitzes desjenigen Rechtsträgers, dessen Gläubiger sie sind, nach § 19 Abs. 3 UmwG als bekannt gemacht gilt, ihren Anspruch nach Grund und Höhe in Textform anmelden, Sicherheit zu leisten, soweit sie nicht Befriedigung verlangen können. Dieses Recht steht den Gläubigern jedoch nur zu, wenn sie glaubhaft machen, dass durch die Umwandlung die Erfüllung der Forderung gefährdet wird.\"|\"Umwandlung\",\"Ausgliederung beteiligten Rechtsträger ist, wenn sie binnen sechs Monaten nach dem Tag, an dem die Eintragung der Ausgliederung in das Register des Sitzes desjenigen Rechtsträgers, dessen Gläubiger sie sind, nach § 19 Abs. 3 UmwG als bekannt gemacht gilt, ihren Anspruch nach Grund und Höhe in Textform anmelden, Sicherheit zu leisten, soweit sie nicht Befriedigung verlangen können. Dieses Recht steht den Gläubigern jedoch nur zu, wenn sie glaubhaft machen, dass durch die Ausgliederung die Erfüllung der Forderung gefährdet wird.\"|\"Ausgliederung\")"
    },
    {
      "date": "2025-02-21",
      "id": "101961",
      "original_text": "Registerbekanntmachung nach dem Umwandlungsgesetz\nNiedersachsen Amtsgericht Braunschweig HRA 203248\nHeise Haustechnik GmbH & Co. KG – Braunlage",
      "type": "Registerbekanntmachung nach dem Umwandlungsgesetz",
      "state": "Niedersachsen",
      "amtsgericht": "Amtsgericht Braunschweig",
      "registernummer": "HRA 203248",
      "registerart": "HRA",
      "company_name": "Heise Haustechnik GmbH & Co. KG",
      "company_seat": "Braunlage",
      "details": "21.02.2025 (Bekanntmachungsdatum)\n\nNiedersachsen Amtsgericht Braunschweig HRA 203248\nRegisterbekanntmachung nach dem Umwandlungsgesetz 21.02.2025 (Eintragungsdatum)\n\nHeise Haustechnik GmbH & Co. KG\nKommanditgesellschaft\nBraunlage\n\nDen Gläubigern der an der Ausgliederung beteiligten Rechtsträger ist, wenn sie binnen sechs Monaten nach dem Tag, an dem die Eintragung der Ausgliederung in das Register des Sitzes desjenigen Rechtsträgers, dessen Gläubiger sie sind, nach § 19 Abs. 3 UmwG als bekannt gemacht gilt, ihren Anspruch nach Grund und Höhe schriftlich anmelden, Sicherheit zu leisten, soweit sie nicht Befriedigung verlangen können. Dieses Recht steht den Gläubigern jedoch nur zu, wenn sie glaubhaft machen, dass durch die Ausgliederung die Erfüllung der Forderung gefährdet wird."
    },
    {
      "date": "2025-02-21",
      "id": "101962",
      "original_text": "Registerbekanntmachung nach dem Umwandlungsgesetz\nNiedersachsen Amtsgericht Hannover HRB 204006\ndigit.ly GmbH – Hannover",
      "type": "Registerbekanntmachung nach dem Umwandlungsgesetz",
      "state": "Niedersachsen",
      "amtsgericht": "Amtsgericht Hannover",
      "registernummer": "HRB 204006",
      "registerart": "HRB",
      "company_name": "digit.ly GmbH",
      "company_seat": "Hannover",
      "details": "21.02.2025 (Bekanntmachungsdatum)\n\nNiedersachsen Amtsgericht Hannover HRB 204006\nRegisterbekanntmachung nach dem Umwandlungsgesetz 21.02.2025 (Eintragungsdatum)\n\ndigit.ly GmbH\nGesellschaft mit beschränkter Haftung\nHannover\n\nDen Gläubigern der an der Verschmelzung beteiligten Rechtsträger ist, wenn sie binnen sechs Monaten nach dem Tag, an dem die Eintragung der Verschmelzung in das Register des Sitzes desjenigen Rechtsträgers, dessen Gläubiger sie sind, nach § 19  Abs.  3 UmwG als bekannt gemacht gilt, ihren Anspruch nach Grund und Höhe schriftlich anmelden, Sicherheit zu leisten, soweit sie nicht Befriedigung verlangen können. Dieses Recht steht den Gläubigern jedoch nur zu, wenn sie glaubhaft machen, dass durch die Verschmelzung die Erfüllung der Forderung gefährdet wird."
    },
    {
      "date": "2025-02-21",
      "id": "101963",
      "original_text": "Registerbekanntmachung nach dem Umwandlungsgesetz\nNiedersachsen Amtsgericht Osnabrück HRB 219174\nInternetschlosser GmbH – Uelsen",
      "type": "Registerbekanntmachung nach dem Umwandlungsgesetz",
      "state": "Niedersachsen",
      "amtsgericht": "Amtsgericht Osnabrück",
      "registernummer": "HRB 219174",
      "registerart": "HRB",
      "company_name": "Internetschlosser GmbH",
      "company_seat": "Uelsen",
      "details": "21.02.2025 (Bekanntmachungsdatum)\n\nNiedersachsen Amtsgericht Osnabrück HRB 219174\nRegisterbekanntmachung nach dem Umwandlungsgesetz 21.02.2025 (Eintragungsdatum)\n\nInternetschlosser GmbH\nGesellschaft mit beschränkter Haftung\nUelsen\n\nDen Gläubigern der an der Verschmelzung beteiligten Rechtsträger ist, wenn sie binnen sechs Monaten nach dem Tag, an dem die Eintragung der Verschmelzung in das Register des Sitzes desjenigen Rechtsträgers, dessen Gläubiger sie sind, nach § 19  Abs.  3 UmwG als bekannt gemacht gilt, ihren Anspruch nach Grund und Höhe schriftlich anmelden, Sicherheit zu leisten, soweit sie nicht Befriedigung verlangen können. Dieses Recht steht den Gläubigern jedoch nur zu, wenn sie glaubhaft machen, dass durch die Verschmelzung die Erfüllung der Forderung gefährdet wird."
    },
    {
      "date": "2025-02-21",
      "id": "101964",
      "original_text": "Löschungsankündigung\nNiedersachsen Amtsgericht Braunschweig HRA 8402\nE. Robert Mey, Inhaber Fritz Wolf – Braunschweig",
      "type": "Löschungsankündigung",
      "state": "Niedersachsen",
      "amtsgericht": "Amtsgericht Braunschweig",
      "registernummer": "HRA 8402",
      "registerart": "HRA",
      "company_name": "E. Robert Mey, Inhaber Fritz Wolf",
      "company_seat": "Braunschweig",
      "details": "21.02.2025 (Bekanntmachungsdatum)\n\nNiedersachsen Amtsgericht Braunschweig HRA 8402\nLöschungsankündigung\n\nE. Robert Mey, Inhaber Fritz Wolf\nEinzelkaufmann / Einzelkauffrau\nBraunschweig\n\nDas Registergericht beabsichtigt, die Firma von Amts wegen nach § 31 Abs. 2 Satz 2 HGB, § 393 FamFG zu löschen. Die Frist zur Erhebung eines Widerspruchs ist auf 1 Monat ab dieser Registerbekanntmachung festgesetzt."
    },
    {
      "date": "2025-02-21",
      "id": "101965",
      "original_text": "Löschungsankündigung\nNiedersachsen Amtsgericht Lüneburg HRB 205648\nJippie.Media GmbH – Wietze",
      "type": "Löschungsankündigung",
      "state": "Niedersachsen",
      "amtsgericht": "Amtsgericht Lüneburg",
      "registernummer": "HRB 205648",
      "registerart": "HRB",
      "company_name": "Jippie.Media GmbH",
      "company_seat": "Wietze",
      "details": "21.02.2025 (Bekanntmachungsdatum)\n\nNiedersachsen Amtsgericht Lüneburg HRB 205648\nLöschungsankündigung 21.02.2025 (Eintragungsdatum)\n\nJippie.Media GmbH\nGesellschaft mit beschränkter Haftung\nWietze\n\nDas Registergericht beabsichtigt, die Gesellschaft von Amts wegen nach § 394 FamFG zu löschen. Die Frist zur Erhebung eines Widerspruchs ist auf 1 Monat ab dieser Registerbekanntmachung festgesetzt."
    },
    {
      "date": "2025-02-21",
      "id": "101966",
      "original_text": "Registerbekanntmachung nach dem Umwandlungsgesetz\nNiedersachsen Amtsgericht Braunschweig HRA 203245\nStefan Heise Haustechnik e.K. – Braunlage",
      "type": "Registerbekanntmachung nach dem Umwandlungsgesetz",
      "state": "Niedersachsen",
      "amtsgericht": "Amtsgericht Braunschweig",
      "registernummer": "HRA 203245",
      "registerart": "HRA",
      "company_name": "Stefan Heise Haustechnik e.K.",
      "company_seat": "Braunlage",
      "details": "21.02.2025 (Bekanntmachungsdatum)\n\nNiedersachsen Amtsgericht Braunschweig HRA 203245\nRegisterbekanntmachung nach dem Umwandlungsgesetz 21.02.2025 (Eintragungsdatum)\n\nStefan Heise Haustechnik e.K.\nEinzelkaufmann / Einzelkauffrau\nBraunlage\n\nDen Gläubigern der an der Ausgliederung beteiligten Rechtsträger ist, wenn sie binnen sechs Monaten nach dem Tag, an dem die Eintragung der Ausgliederung in das Register des Sitzes desjenigen Rechtsträgers, dessen Gläubiger sie sind, nach § 19 Abs. 3 UmwG als bekannt gemacht gilt, ihren Anspruch nach Grund und Höhe schriftlich anmelden, Sicherheit zu leisten, soweit sie nicht Befriedigung verlangen können. Dieses Recht steht den Gläubigern jedoch nur zu, wenn sie glaubhaft machen, dass durch die Ausgliederung die Erfüllung der Forderung gefährdet wird."
    },
    {
      "date": "2025-02-21",
      "id": "101967",
      "original_text": "Registerbekanntmachung nach dem Umwandlungsgesetz\nNiedersachsen Amtsgericht Hannover HRB 226368\npingu.web GmbH – Hannover",
      "type": "Registerbekanntmachung nach dem Umwandlungsgesetz",
      "state": "Niedersachsen",
      "amtsgericht": "Amtsgericht Hannover",
      "registernummer": "HRB 226368",
      "registerart": "HRB",
      "company_name": "pingu.web GmbH",
      "company_seat": "Hannover",
      "details": "21.02.2025 (Bekanntmachungsdatum)\n\nNiedersachsen Amtsgericht Hannover HRB 226368\nRegisterbekanntmachung nach dem Umwandlungsgesetz 21.02.2025 (Eintragungsdatum)\n\npingu.web GmbH\nGesellschaft mit beschränkter Haftung\nHannover\n\nDen Gläubigern der an der Verschmelzung beteiligten Rechtsträger ist, wenn sie binnen sechs Monaten nach dem Tag, an dem die Eintragung der Verschmelzung in das Register des Sitzes desjenigen Rechtsträgers, dessen Gläubiger sie sind, nach § 19  Abs.  3 UmwG als bekannt gemacht gilt, ihren Anspruch nach Grund und Höhe schriftlich anmelden, Sicherheit zu leisten, soweit sie nicht Befriedigung verlangen können. Dieses Recht steht den Gläubigern jedoch nur zu, wenn sie glaubhaft machen, dass durch die Verschmelzung die Erfüllung der Forderung gefährdet wird."
    },
    {
      "date": "2025-02-21",
      "id": "101968",
      "original_text": "Löschungsankündigung\nNiedersachsen Amtsgericht Osnabrück HRB 217229\nTS Transporte Verwaltungs UG (haftungsbeschränkt) – Osnabrück",
      "type": "Löschungsankündigung",
      "state": "Niedersachsen",
      "amtsgericht": "Amtsgericht Osnabrück",
      "registernummer": "HRB 217229",
      "registerart": "HRB",
      "company_name": "TS Transporte Verwaltungs UG (haftungsbeschränkt)",
      "company_seat": "Osnabrück",
      "details": "21.02.2025 (Bekanntmachungsdatum)\n\nNiedersachsen Amtsgericht Osnabrück HRB 217229\nLöschungsankündigung\n\nTS Transporte Verwaltungs UG (haftungsbeschränkt)\nGesellschaft mit beschränkter Haftung\nOsnabrück\n\nDas Registergericht beabsichtigt, die Gesellschaft von Amts wegen nach § 394 FamFG wegen Vermögenslosigkeit zu löschen. Die Frist zur Erhebung eines Widerspruchs ist auf 1 Monat ab dieser Registerbekanntmachung festgesetzt."
    },
    {
      "date": "2025-02-21",
      "id": "101969",
      "original_text": "Löschungsankündigung\nNiedersachsen Amtsgericht Lüneburg HRB 100810 früher Amtsgericht Celle\nETS Elektro Technischer Service GmbH Gerrmany – Wietze",
      "type": "Löschungsankündigung",
      "state": "Niedersachsen",
      "amtsgericht": "Amtsgericht Lüneburg",
      "registernummer": "HRB 100810",
      "registerart": "HRB",
      "company_name": "ETS Elektro Technischer Service GmbH Gerrmany",
      "company_seat": "Wietze",
      "former_amtsgericht": "Celle",
      "details": "21.02.2025 (Bekanntmachungsdatum)\n\nNiedersachsen Amtsgericht Lüneburg HRB 100810 früher Amtsgericht Celle\nLöschungsankündigung\n\nETS Elektro Technischer Service GmbH Gerrmany\nGesellschaft mit beschränkter Haftung\nWietze\n\nDas Registergericht beabsichtigt, die Gesellschaft auf Antrag des Finanzamtes nach § 394 FamFG zu löschen. Die Frist zur Erhebung eines Widerspruchs ist auf 3 Monate ab dieser Registerbekanntmachung festgesetzt."
    },
    {
      "date": "2025-02-21",
      "id": "101970",
      "original_text": "Löschungsankündigung\nRheinland-Pfalz Amtsgericht Kaiserslautern HRB 32303\nMonteiro GmbH – Kaiserslautern",
      "type": "Löschungsankündigung",
      "state": "Rheinland-Pfalz",
      "amtsgericht": "Amtsgericht Kaiserslautern",
      "registernummer": "HRB 32303",
      "registerart": "HRB",
      "company_name": "Monteiro GmbH",
      "company_seat": "Kaiserslautern",
      "details": "21.02.2025 (Bekanntmachungsdatum)\n\nRheinland-Pfalz Amtsgericht Kaiserslautern HRB 32303\nLöschungsankündigung 21.02.2025 (Eintragungsdatum)\n\nMonteiro GmbH\nGesellschaft mit beschränkter Haftung\nKaiserslautern\n\nDas Registergericht beabsichtigt die vorgenannte Firma gemäß § 394 FamFG wegen Vermögenslosigkeit zu löschen. Widerspruch gegen die Löschung kann nur binnen 3 Monaten ab Veröffentlichung dieser Verfügung eingelegt werden."
    },
    {
      "date": "2025-02-21",
      "id": "101971",
      "original_text": "Registerbekanntmachung nach dem Umwandlungsgesetz\nRheinland-Pfalz Amtsgericht Ludwigshafen a.Rhein (Ludwigshafen) HRA 62393\nMichael Kief e.K. – Römerberg",
      "type": "Registerbekanntmachung nach dem Umwandlungsgesetz",
      "state": "Rheinland-Pfalz",
      "amtsgericht": "Amtsgericht Ludwigshafen a.Rhein (Ludwigshafen)",
      "registernummer": "HRA 62393",
      "registerart": "HRA",
      "company_name": "Michael Kief e.K.",
      "company_seat": "Römerberg",
      "details": "21.02.2025 (Bekanntmachungsdatum)\n\nRheinland-Pfalz Amtsgericht Ludwigshafen a.Rhein (Ludwigshafen) HRA 62393\nRegisterbekanntmachung nach dem Umwandlungsgesetz 21.02.2025 (Eintragungsdatum)\n\nMichael Kief e.K.\nEinzelkaufmann / Einzelkauffrau\nRömerberg\n\nAls nicht eingetragen wird veröffentlicht: Den Gläubigern der an der Verschmelzung beteiligten Rechtsträger ist, wenn sie binnen sechs Monaten nach dem Tag, an dem die Eintragung der Verschmelzung in das Register des Sitzes desjenigen Rechtsträgers,dessen Gläubiger sie sind, nach § 19 Abs. 3 UmwG als bekannt gemacht gilt, ihren Anspruch nach Grund und Höhe schriftlich anmelden, Sicherheit zu leisten, soweit sie nicht Befriedigung verlangen können. Dieses Recht steht den Gläubigern jedoch nur zu, wenn sie glaubhaft machen, dass durch die Verschmelzung die Erfüllung der Forderung gefährdet wird."
    },
    {
      "date": "2025-02-21",
      "id": "101972",
      "original_text": "Registerbekanntmachung nach dem Umwandlungsgesetz\nRheinland-Pfalz Amtsgericht Ludwigshafen a.Rhein (Ludwigshafen) HRB 53006\nKief GmbH – Römerberg",
      "type": "Registerbekanntmachung nach dem Umwandlungsgesetz",
      "state": "Rheinland-Pfalz",
      "amtsgericht": "Amtsgericht Ludwigshafen a.Rhein (Ludwigshafen)",
      "registernummer": "HRB 53006",
      "registerart": "HRB",
      "company_name": "Kief GmbH",
      "company_seat": "Römerberg",
      "details": "21.02.2025 (Bekanntmachungsdatum)\n\nRheinland-Pfalz Amtsgericht Ludwigshafen a.Rhein (Ludwigshafen) HRB 53006\nRegisterbekanntmachung nach dem Umwandlungsgesetz 21.02.2025 (Eintragungsdatum)\n\nKief GmbH\nGesellschaft mit beschränkter Haftung\nRömerberg\n\nAls nicht eingetragen wird veröffentlicht: Den Gläubigern der an der Verschmelzung beteiligten Rechtsträger ist, wenn sie binnen sechs Monaten nach dem Tag, an dem die Eintragung der Verschmelzung in das Register des Sitzes desjenigen Rechtsträgers,dessen Gläubiger sie sind, nach § 19 Abs. 3 UmwG als bekannt gemacht gilt, ihren Anspruch nach Grund und Höhe schriftlich anmelden, Sicherheit zu leisten, soweit sie nicht Befriedigung verlangen können. Dieses Recht steht den Gläubigern jedoch nur zu, wenn sie glaubhaft machen, dass durch die Verschmelzung die Erfüllung der Forderung gefährdet wird."
    },
    {
      "date": "2025-02-21",
      "id": "101973",
      "original_text": "Löschungsankündigung\nNordrhein-Westfalen Amtsgericht Paderborn HRB 8489\nbeon GmbH – Bad Lippspringe",
      "type": "Löschungsankündigung",
      "state": "Nordrhein-Westfalen",
      "amtsgericht": "Amtsgericht Paderborn",
      "registernummer": "HRB 8489",
      "registerart": "HRB",
      "company_name": "beon GmbH",
      "company_seat": "Bad Lippspringe",
      "details": "21.02.2025 (Bekanntmachungsdatum)\n\nNordrhein-Westfalen Amtsgericht Paderborn HRB 8489\nLöschungsankündigung 21.02.2025 (Eintragungsdatum)\n\nbeon GmbH\nGesellschaft mit beschränkter Haftung\nBad Lippspringe\n\nDas Registergericht beabsichtigt die Gesellschaft von Amts wegen nach § 394 FamFG zu löschen. Die Frist zur Erhebung eines Widerspruchs ist auf einen Monat festgesetzt."
    },
    {
      "date": "2025-02-21",
      "id": "101974",
      "original_text": "Registerbekanntmachung nach dem Umwandlungsgesetz\nNordrhein-Westfalen Amtsgericht Duisburg HRB 17793\nNOVANTIS Service GmbH – Duisburg",
      "type": "Registerbekanntmachung nach dem Umwandlungsgesetz",
      "state": "Nordrhein-Westfalen",
      "amtsgericht": "Amtsgericht Duisburg",
      "registernummer": "HRB 17793",
      "registerart": "HRB",
      "company_name": "NOVANTIS Service GmbH",
      "company_seat": "Duisburg",
      "details": "21.02.2025 (Bekanntmachungsdatum)\n\nNordrhein-Westfalen Amtsgericht Duisburg HRB 17793\nRegisterbekanntmachung nach dem Umwandlungsgesetz 21.02.2025 (Eintragungsdatum)\n\nNOVANTIS Service GmbH\nGesellschaft mit beschränkter Haftung\nDuisburg\n\nDie Gesellschaft hat Gläubigern, deren Forderungen vor dieser Bekanntmachung begründet worden sind, Sicherheit zu leisten, soweit sie nicht Befriedigung verlangen können, wenn sie sich binnen sechs Monaten zu diesem Zweck melden."
    },
    {
      "date": "2025-02-21",
      "id": "101975",
      "original_text": "Registerbekanntmachung nach dem Umwandlungsgesetz\nNordrhein-Westfalen Amtsgericht Paderborn HRA 5327\nidee.Creativmarkt GmbH & Co.KG – Paderborn",
      "type": "Registerbekanntmachung nach dem Umwandlungsgesetz",
      "state": "Nordrhein-Westfalen",
      "amtsgericht": "Amtsgericht Paderborn",
      "registernummer": "HRA 5327",
      "registerart": "HRA",
      "company_name": "idee.Creativmarkt GmbH & Co.KG",
      "company_seat": "Paderborn",
      "details": "21.02.2025 (Bekanntmachungsdatum)\n\nNordrhein-Westfalen Amtsgericht Paderborn HRA 5327\nRegisterbekanntmachung nach dem Umwandlungsgesetz 21.02.2025 (Eintragungsdatum)\n\nidee.Creativmarkt GmbH & Co.KG\nKommanditgesellschaft\nPaderborn\n\nDen Gläubigern der an der Verschmelzung beteiligten Rechtsträger ist, wenn sie binnen sechs Monaten nach dem Tag, an dem die Eintragung der Verschmelzung in das Register des Sitzes desjenigen Rechtsträgers, dessen Gläubiger sie sind, nach § 19 Absatz 3 UmwG als bekanntgemacht gilt, ihren Anspruch nach Grund und Höhe schriftlich anmelden, Sicherheit zu leisten, soweit sie nicht Befriedigung verlangen können. Dieses Recht steht den Gläubigern jedoch nur zu, wenn sie glaubhaft machen, dass durch die Verschmelzung die Erfüllung ihrer Forderung gefährdet wird."
    },
    {
      "date": "2025-02-21",
      "id": "101976",
      "original_text": "Registerbekanntmachung nach dem Umwandlungsgesetz\nNordrhein-Westfalen Amtsgericht Köln HRB 46046\nAVS Verkehrssicherung GmbH – Leverkusen",
      "type": "Registerbekanntmachung nach dem Umwandlungsgesetz",
      "state": "Nordrhein-Westfalen",
      "amtsgericht": "Amtsgericht Köln",
      "registernummer": "HRB 46046",
      "registerart": "HRB",
      "company_name": "AVS Verkehrssicherung GmbH",
      "company_seat": "Leverkusen",
      "details": "21.02.2025 (Bekanntmachungsdatum)\n\nNordrhein-Westfalen Amtsgericht Köln HRB 46046\nRegisterbekanntmachung nach dem Umwandlungsgesetz 21.02.2025 (Eintragungsdatum)\n\nAVS Verkehrssicherung GmbH\nGesellschaft mit beschränkter Haftung\nLeverkusen\n\nDen Gläubigern der an der Verschmelzung beteiligten Rechtsträger ist, wenn sie binnen sechs Monaten nach dem Tag, an dem die Eintragung der Verschmelzung in das Register des Sitzes derjenigen Rechtsträger deren Gläubiger sie sind, nach § 19 Absatz 3 UmwG als bekanntgemacht gilt, ihren Anspruch nach Grund und Höhe schriftlich anmelden, Sicherheit zu leisten, soweit sie nicht Befriedigung verlangen können. Dieses Recht steht den Gläubigern jedoch nur zu, wenn sie glaubhaft machen, dass durch die Verschmelzung die Erfüllung ihrer Forderung gefährdet wird."
    },
    {
      "date": "2025-02-21",
      "id": "101977",
      "original_text": "Registerbekanntmachung nach dem Umwandlungsgesetz\nNordrhein-Westfalen Amtsgericht Köln HRB 33019\nstep GmbH – Köln",
      "type": "Registerbekanntmachung nach dem Umwandlungsgesetz",
      "state": "Nordrhein-Westfalen",
      "amtsgericht": "Amtsgericht Köln",
      "registernummer": "HRB 33019",
      "registerart": "HRB",
      "company_name": "step GmbH",
      "company_seat": "Köln",
      "details": "21.02.2025 (Bekanntmachungsdatum)\n\nNordrhein-Westfalen Amtsgericht Köln HRB 33019\nRegisterbekanntmachung nach dem Umwandlungsgesetz 21.02.2025 (Eintragungsdatum)\n\nstep GmbH\nGesellschaft mit beschränkter Haftung\nKöln\n\nDen Gläubigern der an der Verschmelzung beteiligten Rechtsträger ist, wenn sie binnen sechs Monaten nach dem Tag, an dem die Eintragung der Verschmelzung in das Register des Sitzes derjenigen Rechtsträger deren Gläubiger sie sind, nach § 19 Absatz 3 UmwG als bekanntgemacht gilt, ihren Anspruch nach Grund und Höhe schriftlich anmelden, Sicherheit zu leisten, soweit sie nicht Befriedigung verlangen können. Dieses Recht steht den Gläubigern jedoch nur zu, wenn sie glaubhaft machen, dass durch die Verschmelzung die Erfüllung ihrer Forderung gefährdet wird."
    },
    {
      "date": "2025-02-21",
      "id": "101978",
      "original_text": "Löschungsankündigung\nNordrhein-Westfalen Amtsgericht Siegburg HRB 10787\nKöhn Friseurbetriebs UG (haftungsbeschränkt) – Sankt Augustin",
      "type": "Löschungsankündigung",
      "state": "Nordrhein-Westfalen",
      "amtsgericht": "Amtsgericht Siegburg",
      "registernummer": "HRB 10787",
      "registerart": "HRB",
      "company_name": "Köhn Friseurbetriebs UG (haftungsbeschränkt)",
      "company_seat": "Sankt Augustin",
      "details": "21.02.2025 (Bekanntmachungsdatum)\n\nNordrhein-Westfalen Amtsgericht Siegburg HRB 10787\nLöschungsankündigung\n\nKöhn Friseurbetriebs UG (haftungsbeschränkt)\nGesellschaft mit beschränkter Haftung\nSankt Augustin\n\nDas Registergericht hat glaubhafte Kenntnis erlangt, dass die Gesellschaft vermögenslos geworden ist, da ein Insolvenzverfahren durchgeführt und nach § 200 InsO aufgehoben wurde.\n\nEs ist daher beabsichtigt, die Gesellschaft nach § 394 FamFG im Handelsregister wegen Vermögenslosigkeit zu löschen. Einwände gegen die Löschung sind durch Widerspruch binnen einer Frist von 3 Monaten geltend zu machen, andernfalls die Löschung erfolgen wird.\n\nEinzulegen ist der Widerspruch bei dem Amtsgericht Siegburg, Neue Poststraße 16, 53721 Siegburg, und zwar entweder schriftlich in deutscher Sprache oder mündlich zur Niederschrift der Geschäftsstelle. Der Widerspruch kann auch zur Niederschrift der Geschäftsstelle eines jeden Amtsgerichts abgegeben werden. Der Widerspruch ist binnen der in der Verfügung bestimmten Frist einzulegen. Die Frist ist nur gewahrt, wenn der Widerspruch rechtzeitig bei dem Amtsgericht Siegburg eingeht, auch wenn der Widerspruch zur Niederschrift der Geschäftsstelle eines anderen Amtsgerichts abgegeben wurde. Die Frist beginnt jeweils mit der schriftlichen Bekanntgabe der Verfügung an die Beteiligten. Kann die schriftliche Bekanntgabe an einen Beteiligten nicht bewirkt werden, beginnt die Frist spätestens mit Ablauf von fünf Monaten nach Erlass der Verfügung. Die Bekanntgabe ist entweder durch Zustellung oder am dritten Tage nach Aufgabe zur Post bewirkt. Sofern die Löschung noch nicht erfolgt ist, kann der Widerspruch auch noch nach Ablauf der Frist eingelegt werden. Fällt das Ende der Frist auf einen Sonnabend, einen Sonntag oder einen allgemeinen Feiertag, endet die Frist mit Ablauf des nächsten Werktages. Der Widerspruch ist zu unterzeichnen. Eine Begründung des Widerspruchs ist nicht vorgeschrieben."
    },
    {
      "date": "2025-02-21",
      "id": "101979",
      "original_text": "Löschungsankündigung\nNordrhein-Westfalen Amtsgericht Dortmund HRB 34025\nMartinovic Garten- und Landschaftsbau GmbH – Werne",
      "type": "Löschungsankündigung",
      "state": "Nordrhein-Westfalen",
      "amtsgericht": "Amtsgericht Dortmund",
      "registernummer": "HRB 34025",
      "registerart": "HRB",
      "company_name": "Martinovic Garten- und Landschaftsbau GmbH",
      "company_seat": "Werne",
      "details": "21.02.2025 (Bekanntmachungsdatum)\n\nNordrhein-Westfalen Amtsgericht Dortmund HRB 34025\nLöschungsankündigung\n\nMartinovic Garten- und Landschaftsbau GmbH\nGesellschaft mit beschränkter Haftung\nWerne\n\nDas Registergericht beabsichtigt die Gesellschaft von Amts wegen nach § 394 FamFG zu löschen. Die Frist zur Erhebung eines Widerspruchs ist auf zwei Monate festgesetzt."
    },
    {
      "date": "2025-02-21",
      "id": "101980",
      "original_text": "Löschungsankündigung\nNordrhein-Westfalen Amtsgericht Köln HRB 78218\nSabon Germany GmbH – Köln",
      "type": "Löschungsankündigung",
      "state": "Nordrhein-Westfalen",
      "amtsgericht": "Amtsgericht Köln",
      "registernummer": "HRB 78218",
      "registerart": "HRB",
      "company_name": "Sabon Germany GmbH",
      "company_seat": "Köln",
      "details": "21.02.2025 (Bekanntmachungsdatum)\n\nNordrhein-Westfalen Amtsgericht Köln HRB 78218\nLöschungsankündigung\n\nSabon Germany GmbH\nGesellschaft mit beschränkter Haftung\nKöln\n\nDas Registergericht beabsichtigt, die im Handelsregister eingetragene Gesellschaft gemäß § 394 Absatz 1 FamFG wegen Vermögenslosigkeit von Amts wegen zu löschen. Gegen diese Verfügung kann Widerspruch eingelegt werden. Die Frist zur Erhebung eines Widerspruchs gegen die beabsichtigte Löschung von Amts wegen ist auf einen Monat festgesetzt. Rechtsbehelfsbelehrung: Gegen diese Verfügung können Sie Widerspruch einlegen. Der Widerspruch ist bei dem Amtsgericht Köln, Reichenspergerplatz 1, 50670 Köln schriftlich in deutscher Sprache oder zur Niederschrift der Geschäftsstelle einzulegen. Der Widerspruch kann auch zur Niederschrift der Geschäftsstelle eines jeden Amtsgerichtes abgegeben werden. Die Einlegung ist auch durch Übertragung eines elektronischen Dokuments an die elektronische Poststelle des Gerichts möglich. Das elektronische Dokument muss für die Bearbeitung durch das Gericht geeignet und mit einer qualifizierten elektronischen Signatur der verantwortenden Person versehen sein oder von der verantwortenden Person signiert und auf einem sicheren Übermittlungsweg gemäß § 130a ZPO nach näherer Maßgabe der Verordnung über die technischen Rahmenbedingungen des elektronischen Rechtsverkehrs und über das besondere elektronische Behördenpostfach (BGBl. I, S.3803) eingereicht werden. Weitere Informationen erhalten Sie auf der Internetseite www.justiz.de.Der Widerspruch muss spätestens innerhalb der gesetzten Frist bei dem Amtsgericht Köln eingegangen sein. Dies gilt auch dann, wenn der Widerspruch zur Niederschrift der Geschäftsstelle eines anderen Amtsgerichtes abgegeben wurde. Die Frist beginnt mit der Veröffentlichung. Fällt das Ende der Frist auf einen Sonntag, einen allgemeinen Feiertag oder Sonnabend, so endet die Frist mit Ablauf des nächsten Werktages.\n\nDer Widerspruch muss die Bezeichnung der angefochtenen Verfügung sowie die Erklärung enthalten, dass Widerspruch gegen diese Verfügung eingelegt wird. Er ist zu unterzeichnen und soll begründet werden."
    },
    {
      "date": "2025-02-21",
      "id": "101981",
      "original_text": "Registerbekanntmachung nach dem Umwandlungsgesetz\nNordrhein-Westfalen Amtsgericht Köln HRB 46046\nAVS Verkehrssicherung GmbH – Leverkusen",
      "type": "Registerbekanntmachung nach dem Umwandlungsgesetz",
      "state": "Nordrhein-Westfalen",
      "amtsgericht": "Amtsgericht Köln",
      "registernummer": "HRB 46046",
      "registerart": "HRB",
      "company_name": "AVS Verkehrssicherung GmbH",
      "company_seat": "Leverkusen",
      "details": "21.02.2025 (Bekanntmachungsdatum)\n\nNordrhein-Westfalen Amtsgericht Köln HRB 46046\nRegisterbekanntmachung nach dem Umwandlungsgesetz 21.02.2025 (Eintragungsdatum)\n\nAVS Verkehrssicherung GmbH\nGesellschaft mit beschränkter Haftung\nLeverkusen\n\nDen Gläubigern der an der Verschmelzung beteiligten Rechtsträger ist, wenn sie binnen sechs Monaten nach dem Tag, an dem die Eintragung der Verschmelzung in das Register des Sitzes derjenigen Rechtsträger deren Gläubiger sie sind, nach § 19 Absatz 3 UmwG als bekanntgemacht gilt, ihren Anspruch nach Grund und Höhe schriftlich anmelden, Sicherheit zu leisten, soweit sie nicht Befriedigung verlangen können. Dieses Recht steht den Gläubigern jedoch nur zu, wenn sie glaubhaft machen, dass durch die Verschmelzung die Erfüllung ihrer Forderung gefährdet wird."
    },
    {
      "date": "2025-02-21",
      "id": "101982",
      "original_text": "Sonstige Registerbekanntmachung\nNordrhein-Westfalen Amtsgericht Neuss HRB 8252\nKarin Glasmacher GmbH – Neuss",
      "type": "Sonstige Registerbekanntmachung",
      "state": "Nordrhein-Westfalen",
      "amtsgericht": "Amtsgericht Neuss",
      "registernummer": "HRB 8252",
      "registerart": "HRB",
      "company_name": "Karin Glasmacher GmbH",
      "company_seat": "Neuss",
      "details": "21.02.2025 (Bekanntmachungsdatum)\n\nNordrhein-Westfalen Amtsgericht Neuss HRB 8252\nSonstige Registerbekanntmachung 21.02.2025 (Eintragungsdatum)\n\nKarin Glasmacher GmbH\nGesellschaft mit beschränkter Haftung\nNeuss\n\nAls nicht eingetragen wird veröffentlicht: Den Gläubigern der Gesellschaft, deren Forderungen begründet worden sind bevor die Eintragung der Beendigung des Beherrschungs- und Gewinnabführungsvertrages  in das Handelsregister nach § 10 des Handelsgesetzbuches als bekanntgemacht gilt, hat der andere Vertragsteil Sicherheit zu leisten, wenn sie sich binnen sechs Monaten nach der Bekanntmachung der Eintragung zu diesem Zweck bei ihm melden."
    },
    {
      "date": "2025-02-21",
      "id": "101983",
      "original_text": "Löschungsankündigung\nNordrhein-Westfalen Amtsgericht Hamm HRB 6040\nTLS-N GmbH – Unna",
      "type": "Löschungsankündigung",
      "state": "Nordrhein-Westfalen",
      "amtsgericht": "Amtsgericht Hamm",
      "registernummer": "HRB 6040",
      "registerart": "HRB",
      "company_name": "TLS-N GmbH",
      "company_seat": "Unna",
      "details": "21.02.2025 (Bekanntmachungsdatum)\n\nNordrhein-Westfalen Amtsgericht Hamm HRB 6040\nLöschungsankündigung\n\nTLS-N GmbH\nGesellschaft mit beschränkter Haftung\nUnna\n\nDas Registergericht beabsichtigt die Gesellschaft von Amts wegen nach § 394 FamFG zu löschen. Die Frist zur Erhebung eines Widerspruchs ist auf drei Monate festgesetzt."
    },
    {
      "date": "2025-02-21",
      "id": "101984",
      "original_text": "Löschungsankündigung\nNordrhein-Westfalen Amtsgericht Gelsenkirchen HRB 13480\nKDL Image UG (haftungsbeschränkt) – Dorsten",
      "type": "Löschungsankündigung",
      "state": "Nordrhein-Westfalen",
      "amtsgericht": "Amtsgericht Gelsenkirchen",
      "registernummer": "HRB 13480",
      "registerart": "HRB",
      "company_name": "KDL Image UG (haftungsbeschränkt)",
      "company_seat": "Dorsten",
      "details": "21.02.2025 (Bekanntmachungsdatum)\n\nNordrhein-Westfalen Amtsgericht Gelsenkirchen HRB 13480\nLöschungsankündigung\n\nKDL Image UG (haftungsbeschränkt)\nGesellschaft mit beschränkter Haftung\nDorsten\n\nDas Gericht beabsichtigt, die Gesellschaft KDL Image UG (haftungsbeschränkt) mit Sitz in Dorsten, HRB 13480 Amtsgericht Gelsenkirchen, wegen Vermögenslosigkeit zu löschen.\n\nHiermit wird denjenigen, die an der Unterlassung der Löschung ein berechtigtes Interesse haben, gem. § 394 Abs. 2 FamFG Gelegenheit gegeben, gegen dieses Vorhaben binnen eines Monats nach dieser Bekanntmachung Widerspruch einzulegen. Der Widerspruch kann schriftlich oder zu Protokoll der Geschäftsstelle erhoben werden."
    },
    {
      "date": "2025-02-21",
      "id": "101985",
      "original_text": "Einreichung neuer Dokumente\nNordrhein-Westfalen Amtsgericht Köln HRB 84564\nSiemens Industry Software GmbH – Köln",
      "type": "Einreichung neuer Dokumente",
      "state": "Nordrhein-Westfalen",
      "amtsgericht": "Amtsgericht Köln",
      "registernummer": "HRB 84564",
      "registerart": "HRB",
      "company_name": "Siemens Industry Software GmbH",
      "company_seat": "Köln",
      "details": "21.02.2025 (Bekanntmachungsdatum)\n\nNordrhein-Westfalen Amtsgericht Köln HRB 84564\nEinreichung neuer Dokumente\n\nSiemens Industry Software GmbH\nGesellschaft mit beschränkter Haftung\nKöln\n\nDem Registergericht ist eine Liste der Mitglieder des Aufsichtsrates eingereicht worden."
    },
    {
      "date": "2025-02-21",
      "id": "101986",
      "original_text": "Registerbekanntmachung nach dem Umwandlungsgesetz\nNordrhein-Westfalen Amtsgericht Köln HRB 44857\ndocuscan GmbH – Erftstadt",
      "type": "Registerbekanntmachung nach dem Umwandlungsgesetz",
      "state": "Nordrhein-Westfalen",
      "amtsgericht": "Amtsgericht Köln",
      "registernummer": "HRB 44857",
      "registerart": "HRB",
      "company_name": "docuscan GmbH",
      "company_seat": "Erftstadt",
      "details": "21.02.2025 (Bekanntmachungsdatum)\n\nNordrhein-Westfalen Amtsgericht Köln HRB 44857\nRegisterbekanntmachung nach dem Umwandlungsgesetz 21.02.2025 (Eintragungsdatum)\n\ndocuscan GmbH\nGesellschaft mit beschränkter Haftung\nErftstadt\n\nDen Gläubigern der an der Verschmelzung beteiligten Rechtsträger ist, wenn sie binnen sechs Monaten nach dem Tag, an dem die Eintragung der Verschmelzung in das Register des Sitzes desjenigen Rechtsträgers, dessen Gläubiger sie sind, nach § 19 Absatz 3 UmwG als bekanntgemacht gilt, ihren Anspruch nach Grund und Höhe schriftlich anmelden, Sicherheit zu leisten, soweit sie nicht Befriedigung verlangen können. Dieses Recht steht den Gläubigern jedoch nur zu, wenn sie glaubhaft machen, dass durch die Verschmelzung die Erfüllung ihrer Forderung gefährdet wird."
    },
    {
      "date": "2025-02-21",
      "id": "101987",
      "original_text": "Löschungsankündigung\nNordrhein-Westfalen Amtsgericht Düsseldorf HRA 18902\nGenusshandwerker GmbH & Co. KG – Düsseldorf",
      "type": "Löschungsankündigung",
      "state": "Nordrhein-Westfalen",
      "amtsgericht": "Amtsgericht Düsseldorf",
      "registernummer": "HRA 18902",
      "registerart": "HRA",
      "company_name": "Genusshandwerker GmbH & Co. KG",
      "company_seat": "Düsseldorf",
      "details": "21.02.2025 (Bekanntmachungsdatum)\n\nNordrhein-Westfalen Amtsgericht Düsseldorf HRA 18902\nLöschungsankündigung\n\nGenusshandwerker GmbH & Co. KG\nKommanditgesellschaft\nDüsseldorf\n\nDas Registergericht beabsichtigt die Firma von Amts wegen nach § 394 Abs. 4 FamFG zu löschen, da offenbar keine Vermögenswerte mehr vorhanden sind und bereits die persönlich haftende Gesellschafterin wegen Vermögenslosigkeit gelöscht worden ist. Die Frist zur Erhebung eines Widerspruchs ist auf einen Monat festgesetzt.\n\nRechtsbehelfsbelehrung:\nDas Widerspruchsrecht steht jedem zu, der an der Unterlassung der Löschung ein berechtigtes Interesse hat. Der Widerspruch ist bei dem Amtsgericht Düsseldorf -Registergericht-, Werdener Straße 1, 40227 Düsseldorf schriftlich in deutscher Sprache oder zur Niederschrift der Geschäftsstelle einzulegen. Der Widerspruch kann auch zur Niederschrift der Geschäftsstelle eines jeden Amtsgerichtes abgegeben werden. Die Einlegung ist auch durch Übertragung eines elektronischen Dokuments an die elektronische Poststelle des Gerichts möglich. Das elektronische Dokument muss für die Bearbeitung durch das Gericht geeignet und mit einer qualifizierten elektronischen Signatur der verantwortenden Person versehen sein oder von der verantwortenden Person signiert und auf einem sicheren Übermittlungsweg gemäß § 130a ZPO nach näherer Maßgabe der Verordnung über die technischen Rahmenbedingungen des elektronischen Rechtsverkehrs und über das besondere elektronische Behördenpostfach (BGBl. I, S.3803) eingereicht werden. Weitere Informationen erhalten Sie auf der Internetseite www.justiz.de.\nDer Widerspruch muss spätestens innerhalb der gesetzten Frist nach dem Datum der Bekanntmachung der Löschungsankündigung bei dem Amtsgericht - Registergericht - Düsseldorf eingegangen sein.  Dies gilt auch dann, wenn der Widerspruch zur Niederschrift der Geschäftsstelle eines anderen Amtsgerichtes abgegeben wurde. Die Frist beginnt mit dem Tage der Bekanntmachung der Löschungsankündigung in dem für die Bekanntmachung der Eintragungen in das Handelsregister bestimmten elektronischen Informations- und Kommunikationssystem nach § 10 des Handelsgesetzbuches. Fällt das Ende der Frist auf einen Sonntag, einen allgemeinen Feiertag oder Sonnabend, so endet die Frist mit Ablauf des nächsten Werktages.\nDer Widerspruch muss die Bezeichnung der angefochtenen Löschungsankündigung sowie die Erklärung enthalten, dass Widerspruch gegen diese Löschungsankündigung eingelegt wird. Er ist zu unterzeichnen und soll begründet werden."
    },
    {
      "date": "2025-02-21",
      "id": "101988",
      "original_text": "Einreichung neuer Dokumente\nNordrhein-Westfalen Amtsgericht Köln HRB 63832\nvortuna AG – Köln",
      "type": "Einreichung neuer Dokumente",
      "state": "Nordrhein-Westfalen",
      "amtsgericht": "Amtsgericht Köln",
      "registernummer": "HRB 63832",
      "registerart": "HRB",
      "company_name": "vortuna AG",
      "company_seat": "Köln",
      "details": "21.02.2025 (Bekanntmachungsdatum)\n\nNordrhein-Westfalen Amtsgericht Köln HRB 63832\nEinreichung neuer Dokumente\n\nvortuna AG\nAktiengesellschaft\nKöln\n\nDem Registergericht ist eine Liste der Mitglieder des Aufsichtsrates eingereicht worden."
    },
    {
      "date": "2025-02-21",
      "id": "101989",
      "original_text": "Registerbekanntmachung nach dem Umwandlungsgesetz\nNordrhein-Westfalen Amtsgericht Köln HRB 107241\nBoldCom GmbH – Köln",
      "type": "Registerbekanntmachung nach dem Umwandlungsgesetz",
      "state": "Nordrhein-Westfalen",
      "amtsgericht": "Amtsgericht Köln",
      "registernummer": "HRB 107241",
      "registerart": "HRB",
      "company_name": "BoldCom GmbH",
      "company_seat": "Köln",
      "details": "21.02.2025 (Bekanntmachungsdatum)\n\nNordrhein-Westfalen Amtsgericht Köln HRB 107241\nRegisterbekanntmachung nach dem Umwandlungsgesetz 21.02.2025 (Eintragungsdatum)\n\nBoldCom GmbH\nGesellschaft mit beschränkter Haftung\nKöln\n\nDen Gläubigern der an der Ausgliederung beteiligten Rechtsträger ist, wenn sie binnen sechs Monaten nach dem Tag, an dem die Eintragung der Ausgliederung in das Register des Sitzes desjenigen Rechtsträgers, dessen Gläubiger sie sind, nach § 19 Absatz 3 UmwG als bekanntgemacht gilt, ihren Anspruch nach Grund und Höhe schriftlich anmelden, Sicherheit zu leisten, soweit sie nicht Befriedigung verlangen können. Dieses Recht steht den Gläubigern jedoch nur zu, wenn sie glaubhaft machen, dass durch die Ausgliederung die Erfüllung ihrer Forderung gefährdet wird."
    },
    {
      "date": "2025-02-21",
      "id": "101990",
      "original_text": "Löschungsankündigung\nNordrhein-Westfalen Amtsgericht Köln HRB 94167\nFA Global Bau GmbH – Köln",
      "type": "Löschungsankündigung",
      "state": "Nordrhein-Westfalen",
      "amtsgericht": "Amtsgericht Köln",
      "registernummer": "HRB 94167",
      "registerart": "HRB",
      "company_name": "FA Global Bau GmbH",
      "company_seat": "Köln",
      "details": "21.02.2025 (Bekanntmachungsdatum)\n\nNordrhein-Westfalen Amtsgericht Köln HRB 94167\nLöschungsankündigung\n\nFA Global Bau GmbH\nGesellschaft mit beschränkter Haftung\nKöln\n\nDas Registergericht beabsichtigt, die im Handelsregister eingetragene Gesellschaft gemäß § 394 Absatz 1 FamFG wegen Vermögenslosigkeit von Amts wegen zu löschen. Gegen diese Verfügung kann Widerspruch eingelegt werden. Die Frist zur Erhebung eines Widerspruchs gegen die beabsichtigte Löschung von Amts wegen ist auf einen Monat festgesetzt. Rechtsbehelfsbelehrung: Gegen diese Verfügung können Sie Widerspruch einlegen. Der Widerspruch ist bei dem Amtsgericht Köln, Reichenspergerplatz 1, 50670 Köln schriftlich in deutscher Sprache oder zur Niederschrift der Geschäftsstelle einzulegen. Der Widerspruch kann auch zur Niederschrift der Geschäftsstelle eines jeden Amtsgerichtes abgegeben werden. Die Einlegung ist auch durch Übertragung eines elektronischen Dokuments an die elektronische Poststelle des Gerichts möglich. Das elektronische Dokument muss für die Bearbeitung durch das Gericht geeignet und mit einer qualifizierten elektronischen Signatur der verantwortenden Person versehen sein oder von der verantwortenden Person signiert und auf einem sicheren Übermittlungsweg gemäß § 130a ZPO nach näherer Maßgabe der Verordnung über die technischen Rahmenbedingungen des elektronischen Rechtsverkehrs und über das besondere elektronische Behördenpostfach (BGBl. I, S.3803) eingereicht werden. Weitere Informationen erhalten Sie auf der Internetseite www.justiz.de.Der Widerspruch muss spätestens innerhalb der gesetzten Frist bei dem Amtsgericht Köln eingegangen sein. Dies gilt auch dann, wenn der Widerspruch zur Niederschrift der Geschäftsstelle eines anderen Amtsgerichtes abgegeben wurde. Die Frist beginnt mit der Veröffentlichung. Fällt das Ende der Frist auf einen Sonntag, einen allgemeinen Feiertag oder Sonnabend, so endet die Frist mit Ablauf des nächsten Werktages.\n\nDer Widerspruch muss die Bezeichnung der angefochtenen Verfügung sowie die Erklärung enthalten, dass Widerspruch gegen diese Verfügung eingelegt wird. Er ist zu unterzeichnen und soll begründet werden."
    },
    {
      "date": "2025-02-21",
      "id": "101991",
      "original_text": "Registerbekanntmachung nach dem Umwandlungsgesetz\nNordrhein-Westfalen Amtsgericht Duisburg HRB 17620\nNOVANTIS Gesellschaft für Finanzdienstleistungen mbH – Duisburg",
      "type": "Registerbekanntmachung nach dem Umwandlungsgesetz",
      "state": "Nordrhein-Westfalen",
      "amtsgericht": "Amtsgericht Duisburg",
      "registernummer": "HRB 17620",
      "registerart": "HRB",
      "company_name": "NOVANTIS Gesellschaft für Finanzdienstleistungen mbH",
      "company_seat": "Duisburg",
      "details": "21.02.2025 (Bekanntmachungsdatum)\n\nNordrhein-Westfalen Amtsgericht Duisburg HRB 17620\nRegisterbekanntmachung nach dem Umwandlungsgesetz 21.02.2025 (Eintragungsdatum)\n\nNOVANTIS Gesellschaft für Finanzdienstleistungen mbH\nGesellschaft mit beschränkter Haftung\nDuisburg\n\nDie Gesellschaft hat Gläubigern, deren Forderungen vor dieser Bekanntmachung begründet worden sind, Sicherheit zu leisten, soweit sie nicht Befriedigung verlangen können, wenn sie sich binnen sechs Monaten zu diesem Zweck melden."
    },
    {
      "date": "2025-02-21",
      "id": "101992",
      "original_text": "Löschungsankündigung\nNordrhein-Westfalen Amtsgericht Bad Oeynhausen HRB 5990\nCOM 1 EDV-Systeme GmbH Bad Oeynhausen – Bad Oeynhausen",
      "type": "Löschungsankündigung",
      "state": "Nordrhein-Westfalen",
      "amtsgericht": "Amtsgericht Bad Oeynhausen",
      "registernummer": "HRB 5990",
      "registerart": "HRB",
      "company_name": "COM 1 EDV-Systeme GmbH Bad Oeynhausen",
      "company_seat": "Bad Oeynhausen",
      "details": "21.02.2025 (Bekanntmachungsdatum)\n\nNordrhein-Westfalen Amtsgericht Bad Oeynhausen HRB 5990\nLöschungsankündigung\n\nCOM 1 EDV-Systeme GmbH Bad Oeynhausen\nGesellschaft mit beschränkter Haftung\nBad Oeynhausen\n\nDas Registergericht beabsichtigt die Gesellschaft von Amts wegen nach § 394 FamFG zu löschen. Die Frist zur Erhebung eines Widerspruchs ist auf einen Monat festgesetzt."
    },
    {
      "date": "2025-02-21",
      "id": "101993",
      "original_text": "Registerbekanntmachung nach dem Umwandlungsgesetz\nNordrhein-Westfalen Amtsgericht Düsseldorf HRB 73704\nU.N.P. - HRSolutions GmbH – Düsseldorf",
      "type": "Registerbekanntmachung nach dem Umwandlungsgesetz",
      "state": "Nordrhein-Westfalen",
      "amtsgericht": "Amtsgericht Düsseldorf",
      "registernummer": "HRB 73704",
      "registerart": "HRB",
      "company_name": "U.N.P. - HRSolutions GmbH",
      "company_seat": "Düsseldorf",
      "details": "21.02.2025 (Bekanntmachungsdatum)\n\nNordrhein-Westfalen Amtsgericht Düsseldorf HRB 73704\nRegisterbekanntmachung nach dem Umwandlungsgesetz 21.02.2025 (Eintragungsdatum)\n\nU.N.P. - HRSolutions GmbH\nGesellschaft mit beschränkter Haftung\nDüsseldorf\n\nDen Gläubigern der an der Verschmelzung beteiligten Rechtsträger ist, wenn sie binnen sechs Monaten nach dem Tag, an dem die Eintragung der Verschmelzung in das Register des Sitzes desjenigen Rechtsträgers, dessen Gläubiger sie sind, nach § 19 Absatz 3 UmwG als bekanntgemacht gilt, ihren Anspruch nach Grund und Höhe schriftlich anmelden, Sicherheit zu leisten, soweit sie nicht Befriedigung verlangen können. Dieses Recht steht den Gläubigern jedoch nur zu, wenn sie glaubhaft machen, dass durch die Verschmelzung die Erfüllung ihrer Forderung gefährdet wird."
    },
    {
      "date": "2025-02-21",
      "id": "101994",
      "original_text": "Sonstige Registerbekanntmachung\nNordrhein-Westfalen Amtsgericht Köln HRB 93308\nSTRABAG AG – Köln",
      "type": "Sonstige Registerbekanntmachung",
      "state": "Nordrhein-Westfalen",
      "amtsgericht": "Amtsgericht Köln",
      "registernummer": "HRB 93308",
      "registerart": "HRB",
      "company_name": "STRABAG AG",
      "company_seat": "Köln",
      "details": "21.02.2025 (Bekanntmachungsdatum)\n\nNordrhein-Westfalen Amtsgericht Köln HRB 93308\nSonstige Registerbekanntmachung\n\nSTRABAG AG\nAktiengesellschaft\nKöln\n\nDem Registergericht ist eine Liste der Mitglieder des Aufsichtsrates eingereicht worden."
    },
    {
      "date": "2025-02-21",
      "id": "101995",
      "original_text": "Einreichung neuer Dokumente\nNordrhein-Westfalen Amtsgericht Bonn HRB 10291\nRPG Radiometer physics GmbH – Meckenheim",
      "type": "Einreichung neuer Dokumente",
      "state": "Nordrhein-Westfalen",
      "amtsgericht": "Amtsgericht Bonn",
      "registernummer": "HRB 10291",
      "registerart": "HRB",
      "company_name": "RPG Radiometer physics GmbH",
      "company_seat": "Meckenheim",
      "details": "21.02.2025 (Bekanntmachungsdatum)\n\nNordrhein-Westfalen Amtsgericht Bonn HRB 10291\nEinreichung neuer Dokumente\n\nRPG Radiometer physics GmbH\nGesellschaft mit beschränkter Haftung\nMeckenheim\n\nDem Registergericht ist eine neue Liste der Mitglieder des Aufsichtsrates eingereicht worden."
    },
    {
      "date": "2025-02-21",
      "id": "101996",
      "original_text": "Löschungsankündigung\nNordrhein-Westfalen Amtsgericht Gelsenkirchen VR 2536\nVerein für behinderte Hunde und Katzen e.V. – Haltern am See",
      "type": "Löschungsankündigung",
      "state": "Nordrhein-Westfalen",
      "amtsgericht": "Amtsgericht Gelsenkirchen",
      "registernummer": "VR 2536",
      "registerart": "VR",
      "company_name": "Verein für behinderte Hunde und Katzen e.V.",
      "company_seat": "Haltern am See",
      "details": "21.02.2025 (Bekanntmachungsdatum)\n\nNordrhein-Westfalen Amtsgericht Gelsenkirchen VR 2536\nLöschungsankündigung\n\nVerein für behinderte Hunde und Katzen e.V.\neingetragener Verein\nHaltern am See\n\nDas Registergericht beabsichtigt, den im Vereinsregister eingetragenen Verein gemäß § 395 FamFG von Amts wegen zu löschen.\n\nGegen diese Verfügung kann Widerspruch eingelegt werden. Die Frist zur Erhebung eines Widerspruchs gegen die beabsichtigte Löschung von Amts wegen ist auf einen Monat festgesetzt.\n\nRechtsbehelfsbelehrung:\n\nGegen diese Verfügung können Sie Widerspruch einlegen.\n\nDer Widerspruch ist bei dem Amtsgericht Gelsenkirchen, Bochumer Straße 79, 45886 Gelsenkirchen schriftlich in deutscher Sprache oder zur Niederschrift der Geschäftsstelle einzulegen. Der Widerspruch kann auch zur Niederschrift der Geschäftsstelle eines jeden Amtsgerichtes abgegeben werden.\n\nDer Widerspruch muss spätestens innerhalb der gesetzten Frist bei dem Amtsgericht Gelsenkirchen eingegangen sein. Dies gilt auch dann, wenn der Widerspruch zur Niederschrift der Geschäftsstelle eines anderen Amtsgerichtes abgegeben wurde. Die Frist beginnt mit der Veröffentlichung. Fällt das Ende der Frist auf einen Sonntag, einen allgemeinen Feiertag oder Sonnabend, so endet die Frist mit Ablauf des nächsten Werktages.\n\nDer Widerspruch muss die Bezeichnung der angefochtenen Verfügung sowie die Erklärung enthalten, dass Widerspruch gegen diese Verfügung eingelegt wird. Er ist zu unterzeichnen und soll begründet werden.\n\nHinweis zum elektronischen Rechtsverkehr:\n\nDie Einlegung ist auch durch Übertragung eines elektronischen Dokuments an die elektronische Poststelle des Gerichts möglich. Das elektronische Dokument muss für die Bearbeitung durch das Gericht geeignet und mit einer qualifizierten elektronischen Signatur der verantwortenden Person versehen sein oder von der verantwortenden Person signiert und auf einem sicheren Übermittlungsweg gemäß § 130a ZPO nach näherer Maßgabe der Verordnung über die technischen Rahmenbedingungen des elektronischen Rechtsverkehrs und über das besondere elektronische Behördenpostfach (BGBl. 2017 I, S. 3803) eingereicht werden. Auf die Pflicht zur elektronischen Einreichung durch professionelle Einreicher/innen ab dem 01.01.2022 durch das Gesetz zum Ausbau des elektronischen Rechtsverkehrs mit den Gerichten vom 10. Oktober 2013, das Gesetz zur Einführung der elektronischen Akte in der Justiz und zur weiteren Förderung des elektronischen Rechtsverkehrs vom 5. Juli 2017 und das Gesetz zum Ausbau des elektronischen Rechtsverkehrs mit den Gerichten und zur Änderung weiterer Vorschriften vom 05.10.2021 wird hingewiesen.\nWeitere Informationen erhalten Sie auf der Internetseite www.justiz.de."
    },
    {
      "date": "2025-02-21",
      "id": "101997",
      "original_text": "Registerbekanntmachung nach dem Umwandlungsgesetz\nHessen Amtsgericht Frankfurt am Main HRB 49502\nFTA Finanz-Treuhand AG Wirtschaftsprüfungsgesellschaft – Frankfurt am Main",
      "type": "Registerbekanntmachung nach dem Umwandlungsgesetz",
      "state": "Hessen",
      "amtsgericht": "Amtsgericht Frankfurt am Main",
      "registernummer": "HRB 49502",
      "registerart": "HRB",
      "company_name": "FTA Finanz-Treuhand AG Wirtschaftsprüfungsgesellschaft",
      "company_seat": "Frankfurt am Main",
      "details": "21.02.2025 (Bekanntmachungsdatum)\n\nHessen Amtsgericht Frankfurt am Main HRB 49502\nRegisterbekanntmachung nach dem Umwandlungsgesetz 21.02.2025 (Eintragungsdatum)\n\nFTA Finanz-Treuhand AG Wirtschaftsprüfungsgesellschaft\nAktiengesellschaft\nFrankfurt am Main\n\nDen Gläubigern der an der formwechselnden Umwandlung beteiligten Rechtsträger ist, wenn sie binnen sechs Monaten nach dem Tag, an dem die Eintragung der formwechselnden Umwandlung in das Register des Sitzes desjenigen Rechtsträgers, dessen Gläubiger sie sind, nach § 201 UmwG bekannt gemacht worden ist, ihren Anspruch nach Grund und Höhe schriftlich anmelden, Sicherheit zu leisten, soweit sie nicht Befriedigung verlangen können. Dieses Recht steht den Gläubigern jedoch nur zu, wenn sie glaubhaft machen, dass durch die formwechselnden Umwandlung die Erfüllung ihrer Forderung gefährdet wird."
    },
    {
      "date": "2025-02-21",
      "id": "101998",
      "original_text": "Löschungsankündigung\nHessen Amtsgericht Königstein HRB 6366\nALPHACHEM EUROPE GmbH – Schwalbach am Taunus",
      "type": "Löschungsankündigung",
      "state": "Hessen",
      "amtsgericht": "Amtsgericht Königstein",
      "registernummer": "HRB 6366",
      "registerart": "HRB",
      "company_name": "ALPHACHEM EUROPE GmbH",
      "company_seat": "Schwalbach am Taunus",
      "details": "21.02.2025 (Bekanntmachungsdatum)\n\nHessen Amtsgericht Königstein HRB 6366\nLöschungsankündigung 21.02.2025 (Eintragungsdatum)\n\nALPHACHEM EUROPE GmbH\nGesellschaft mit beschränkter Haftung\nSchwalbach am Taunus\n\nDas Registergericht beabsichtigt die im Handelsregister eingetragene Gesellschaft von Amts wegen nach § 394 FamFG zu löschen. Die Frist zur Erhebung eines Widerspruchs gegen die beabsichtigte Löschung wird auf 3 Monate festgesetzt."
    },
    {
      "date": "2025-02-21",
      "id": "101999",
      "original_text": "Sonstige Registerbekanntmachung\nHessen Amtsgericht Kassel VR 2702\nTheologinnenkonvent in der Ev. Kirche von Kurhessen-Waldeck e.V. – Kassel",
      "type": "Sonstige Registerbekanntmachung",
      "state": "Hessen",
      "amtsgericht": "Amtsgericht Kassel",
      "registernummer": "VR 2702",
      "registerart": "VR",
      "company_name": "Theologinnenkonvent in der Ev. Kirche von Kurhessen-Waldeck e.V.",
      "company_seat": "Kassel",
      "details": "21.02.2025 (Bekanntmachungsdatum)\n\nHessen Amtsgericht Kassel VR 2702\nSonstige Registerbekanntmachung 21.02.2025 (Eintragungsdatum)\n\nTheologinnenkonvent in der Ev. Kirche von Kurhessen-Waldeck e.V.\neingetragener Verein\nKassel\n\nDer Verein ist aufgelöst."
    },
    {
      "date": "2025-02-21",
      "id": "102000",
      "original_text": "Einreichung neuer Dokumente\nHessen Amtsgericht Hanau HRB 3364\nHERAEUS HOLDING Gesellschaft mit beschränkter Haftung – Hanau",
      "type": "Einreichung neuer Dokumente",
      "state": "Hessen",
      "amtsgericht": "Amtsgericht Hanau",
      "registernummer": "HRB 3364",
      "registerart": "HRB",
      "company_name": "HERAEUS HOLDING Gesellschaft mit beschränkter Haftung",
      "company_seat": "Hanau",
      "details": "21.02.2025 (Bekanntmachungsdatum)\n\nHessen Amtsgericht Hanau HRB 3364\nEinreichung neuer Dokumente\n\nHERAEUS HOLDING Gesellschaft mit beschränkter Haftung\nGesellschaft mit beschränkter Haftung\nHanau\n\nDurch eine Änderung in den Personen der Aufsichtsratsmitglieder ist eine Liste der Mitglieder des Aufsichtsrates zum Handelsregister eingereicht worden."
    },
    {
      "date": "2025-02-21",
      "id": "102001",
      "original_text": "Registerbekanntmachung nach dem Umwandlungsgesetz\nHessen Amtsgericht Hanau HRB 98547\nAuvictum Pflege Holding GmbH – Hanau",
      "type": "Registerbekanntmachung nach dem Umwandlungsgesetz",
      "state": "Hessen",
      "amtsgericht": "Amtsgericht Hanau",
      "registernummer": "HRB 98547",
      "registerart": "HRB",
      "company_name": "Auvictum Pflege Holding GmbH",
      "company_seat": "Hanau",
      "details": "21.02.2025 (Bekanntmachungsdatum)\n\nHessen Amtsgericht Hanau HRB 98547\nRegisterbekanntmachung nach dem Umwandlungsgesetz 21.02.2025 (Eintragungsdatum)\n\nAuvictum Pflege Holding GmbH\nGesellschaft mit beschränkter Haftung\nHanau\n\nDen Gläubigern der an der Verschmelzung beteiligten Rechtsträger ist, wenn sie binnen sechs Monaten nach dem Tag, an dem die Eintragung der Verschmelzung in das Register des Sitzes desjenigen Rechtsträgers, dessen Gläubiger sie sind, nach § 19 Absatz 3 UmwG bekannt gemacht worden ist, ihren Anspruch nach Grund und Höhe schriftlich anmelden, Sicherheit zu leisten, soweit sie nicht Befriedigung verlangen können. Dieses Recht steht den Gläubigern jedoch nur zu, wenn sie glaubhaft machen, dass durch die Verschmelzung die Erfüllung ihrer Forderung gefährdet wird."
    },
    {
      "date": "2025-02-21",
      "id": "102002",
      "original_text": "Registerbekanntmachung nach dem Umwandlungsgesetz\nHessen Amtsgericht Frankfurt am Main HRB 105318\nLAC Verwaltungs GmbH – Eschborn",
      "type": "Registerbekanntmachung nach dem Umwandlungsgesetz",
      "state": "Hessen",
      "amtsgericht": "Amtsgericht Frankfurt am Main",
      "registernummer": "HRB 105318",
      "registerart": "HRB",
      "company_name": "LAC Verwaltungs GmbH",
      "company_seat": "Eschborn",
      "details": "21.02.2025 (Bekanntmachungsdatum)\n\nHessen Amtsgericht Frankfurt am Main HRB 105318\nRegisterbekanntmachung nach dem Umwandlungsgesetz 21.02.2025 (Eintragungsdatum)\n\nLAC Verwaltungs GmbH\nGesellschaft mit beschränkter Haftung\nEschborn\n\nDen Gläubigern der an der Verschmelzung beteiligten Rechtsträger ist, wenn sie binnen sechs Monaten nach dem Tag, an dem die Eintragung der Verschmelzung in das Register des Sitzes desjenigen Rechtsträgers, dessen Gläubiger sie sind, nach § 19 Absatz 3 UmwG bekannt gemacht worden ist, ihren Anspruch nach Grund und Höhe schriftlich anmelden, Sicherheit zu leisten, soweit sie nicht Befriedigung verlangen können. Dieses Recht steht den Gläubigern jedoch nur zu, wenn sie glaubhaft machen, dass durch die Verschmelzung die Erfüllung ihrer Forderung gefährdet wird."
    },
    {
      "date": "2025-02-21",
      "id": "102003",
      "original_text": "Sonstige Registerbekanntmachung\nHessen Amtsgericht Fulda HRB 2294\nKlinikum Fulda gAG – Fulda",
      "type": "Sonstige Registerbekanntmachung",
      "state": "Hessen",
      "amtsgericht": "Amtsgericht Fulda",
      "registernummer": "HRB 2294",
      "registerart": "HRB",
      "company_name": "Klinikum Fulda gAG",
      "company_seat": "Fulda",
      "details": "21.02.2025 (Bekanntmachungsdatum)\n\nHessen Amtsgericht Fulda HRB 2294\nSonstige Registerbekanntmachung 21.02.2025 (Eintragungsdatum)\n\nKlinikum Fulda gAG\nAktiengesellschaft\nFulda\n\nDurch eine Änderung in den Personen der Aufsichtsratsmitglieder ist eine Liste der Mitglieder des Aufsichtsrates zum Handelsregister eingereicht worden."
    },
    {
      "date": "2025-02-21",
      "id": "102004",
      "original_text": "Löschungsankündigung\nHessen Amtsgericht Wiesbaden HRB 28334\nMitat Bau GmbH – Wiesbaden",
      "type": "Löschungsankündigung",
      "state": "Hessen",
      "amtsgericht": "Amtsgericht Wiesbaden",
      "registernummer": "HRB 28334",
      "registerart": "HRB",
      "company_name": "Mitat Bau GmbH",
      "company_seat": "Wiesbaden",
      "details": "21.02.2025 (Bekanntmachungsdatum)\n\nHessen Amtsgericht Wiesbaden HRB 28334\nLöschungsankündigung\n\nMitat Bau GmbH\nGesellschaft mit beschränkter Haftung\nWiesbaden\n\nDas Registergericht beabsichtigt die im Handelsregister eingetragene Gesellschaft von Amts wegen nach § 394 FamFG zu löschen. Die Frist zur Erhebung eines Widerspruchs gegen die beabsichtigte Löschung wird auf 3 Monate festgesetzt."
    },
    {
      "date": "2025-02-21",
      "id": "102005",
      "original_text": "Registerbekanntmachung nach dem Umwandlungsgesetz\nHessen Amtsgericht Frankfurt am Main HRB 132671\nLincoln International GmbH – Frankfurt am Main",
      "type": "Registerbekanntmachung nach dem Umwandlungsgesetz",
      "state": "Hessen",
      "amtsgericht": "Amtsgericht Frankfurt am Main",
      "registernummer": "HRB 132671",
      "registerart": "HRB",
      "company_name": "Lincoln International GmbH",
      "company_seat": "Frankfurt am Main",
      "details": "21.02.2025 (Bekanntmachungsdatum)\n\nHessen Amtsgericht Frankfurt am Main HRB 132671\nRegisterbekanntmachung nach dem Umwandlungsgesetz 21.02.2025 (Eintragungsdatum)\n\nLincoln International GmbH\nGesellschaft mit beschränkter Haftung\nFrankfurt am Main\n\nDen Gläubigern der an der Verschmelzung beteiligten Rechtsträger ist, wenn sie binnen sechs Monaten nach dem Tag, an dem die Eintragung der Verschmelzung in das Register des Sitzes desjenigen Rechtsträgers, dessen Gläubiger sie sind, nach § 19 Absatz 3 UmwG bekannt gemacht worden ist, ihren Anspruch nach Grund und Höhe schriftlich anmelden, Sicherheit zu leisten, soweit sie nicht Befriedigung verlangen können. Dieses Recht steht den Gläubigern jedoch nur zu, wenn sie glaubhaft machen, dass durch die Verschmelzung die Erfüllung ihrer Forderung gefährdet wird."
    },
    {
      "date": "2025-02-21",
      "id": "102006",
      "original_text": "Registerbekanntmachung nach dem Umwandlungsgesetz\nHessen Amtsgericht Hanau HRB 98796\nAuvictum AAP GmbH – Hanau",
      "type": "Registerbekanntmachung nach dem Umwandlungsgesetz",
      "state": "Hessen",
      "amtsgericht": "Amtsgericht Hanau",
      "registernummer": "HRB 98796",
      "registerart": "HRB",
      "company_name": "Auvictum AAP GmbH",
      "company_seat": "Hanau",
      "details": "21.02.2025 (Bekanntmachungsdatum)\n\nHessen Amtsgericht Hanau HRB 98796\nRegisterbekanntmachung nach dem Umwandlungsgesetz 21.02.2025 (Eintragungsdatum)\n\nAuvictum AAP GmbH\nGesellschaft mit beschränkter Haftung\nHanau\n\nDen Gläubigern der an der Verschmelzung beteiligten Rechtsträger ist, wenn sie binnen sechs Monaten nach dem Tag, an dem die Eintragung der Verschmelzung in das Register des Sitzes desjenigen Rechtsträgers, dessen Gläubiger sie sind, nach § 19 Absatz 3 UmwG bekannt gemacht worden ist, ihren Anspruch nach Grund und Höhe schriftlich anmelden, Sicherheit zu leisten, soweit sie nicht Befriedigung verlangen können. Dieses Recht steht den Gläubigern jedoch nur zu, wenn sie glaubhaft machen, dass durch die Verschmelzung die Erfüllung ihrer Forderung gefährdet wird."
    },
    {
      "date": "2025-02-21",
      "id": "102007",
      "original_text": "Registerbekanntmachung nach dem Umwandlungsgesetz\nHessen Amtsgericht Hanau HRB 98276\nAuvictum Holding GmbH – Hanau",
      "type": "Registerbekanntmachung nach dem Umwandlungsgesetz",
      "state": "Hessen",
      "amtsgericht": "Amtsgericht Hanau",
      "registernummer": "HRB 98276",
      "registerart": "HRB",
      "company_name": "Auvictum Holding GmbH",
      "company_seat": "Hanau",
      "details": "21.02.2025 (Bekanntmachungsdatum)\n\nHessen Amtsgericht Hanau HRB 98276\nRegisterbekanntmachung nach dem Umwandlungsgesetz 21.02.2025 (Eintragungsdatum)\n\nAuvictum Holding GmbH\nGesellschaft mit beschränkter Haftung\nHanau\n\nDie Gesellschaft hat Gläubigern, deren Forderungen vor dieser Bekanntmachung begründet worden sind, Sicherheit zu leisten, soweit sie nicht Befriedigung verlangen können, wenn sie sich Den Gläubigern der an der Verschmelzung beteiligten Rechtsträger ist, wenn sie binnen sechs Monaten nach dem Tag, an dem die Eintragung der Verschmelzung in das Register des Sitzes desjenigen Rechtsträgers, dessen Gläubiger sie sind, nach § 19 Absatz 3 UmwG bekannt gemacht worden ist, ihren Anspruch nach Grund und Höhe schriftlich anmelden, Sicherheit zu leisten, soweit sie nicht Befriedigung verlangen können. Dieses Recht steht den Gläubigern jedoch nur zu, wenn sie glaubhaft machen, dass durch die Verschmelzung die Erfüllung ihrer Forderung gefährdet wird.binnen sechs Monaten nach dieser Bekanntmachung zu diesem Zweck melden."
    },
    {
      "date": "2025-02-21",
      "id": "102008",
      "original_text": "Registerbekanntmachung nach dem Umwandlungsgesetz\nHessen Amtsgericht Frankfurt am Main HRB 96878\nInvesta Capital Management GmbH – Eschborn",
      "type": "Registerbekanntmachung nach dem Umwandlungsgesetz",
      "state": "Hessen",
      "amtsgericht": "Amtsgericht Frankfurt am Main",
      "registernummer": "HRB 96878",
      "registerart": "HRB",
      "company_name": "Investa Capital Management GmbH",
      "company_seat": "Eschborn",
      "details": "21.02.2025 (Bekanntmachungsdatum)\n\nHessen Amtsgericht Frankfurt am Main HRB 96878\nRegisterbekanntmachung nach dem Umwandlungsgesetz 21.02.2025 (Eintragungsdatum)\n\nInvesta Capital Management GmbH\nGesellschaft mit beschränkter Haftung\nEschborn\n\nDen Gläubigern der an der Verschmelzung beteiligten Rechtsträger ist, wenn sie binnen sechs Monaten nach dem Tag, an dem die Eintragung der Verschmelzung in das Register des Sitzes desjenigen Rechtsträgers, dessen Gläubiger sie sind, nach § 19 Absatz 3 UmwG bekannt gemacht worden ist, ihren Anspruch nach Grund und Höhe schriftlich anmelden, Sicherheit zu leisten, soweit sie nicht Befriedigung verlangen können. Dieses Recht steht den Gläubigern jedoch nur zu, wenn sie glaubhaft machen, dass durch die Verschmelzung die Erfüllung ihrer Forderung gefährdet wird."
    },
    {
      "date": "2025-02-21",
      "id": "102009",
      "original_text": "Registerbekanntmachung nach dem Umwandlungsgesetz\nHessen Amtsgericht Hanau HRB 98276\nAuvictum Holding GmbH – Hanau",
      "type": "Registerbekanntmachung nach dem Umwandlungsgesetz",
      "state": "Hessen",
      "amtsgericht": "Amtsgericht Hanau",
      "registernummer": "HRB 98276",
      "registerart": "HRB",
      "company_name": "Auvictum Holding GmbH",
      "company_seat": "Hanau",
      "details": "21.02.2025 (Bekanntmachungsdatum)\n\nHessen Amtsgericht Hanau HRB 98276\nRegisterbekanntmachung nach dem Umwandlungsgesetz 21.02.2025 (Eintragungsdatum)\n\nAuvictum Holding GmbH\nGesellschaft mit beschränkter Haftung\nHanau\n\nDen Gläubigern der an der Verschmelzung beteiligten Rechtsträger ist, wenn sie binnen sechs Monaten nach dem Tag, an dem die Eintragung der Verschmelzung in das Register des Sitzes desjenigen Rechtsträgers, dessen Gläubiger sie sind, nach § 19 Absatz 3 UmwG bekannt gemacht worden ist, ihren Anspruch nach Grund und Höhe schriftlich anmelden, Sicherheit zu leisten, soweit sie nicht Befriedigung verlangen können. Dieses Recht steht den Gläubigern jedoch nur zu, wenn sie glaubhaft machen, dass durch die Verschmelzung die Erfüllung ihrer Forderung gefährdet wird."
    },
    {
      "date": "2025-02-21",
      "id": "102010",
      "original_text": "Einreichung neuer Dokumente\nHessen Amtsgericht Darmstadt HRB 24948\nSIRONA Dental Systems GmbH – Bensheim",
      "type": "Einreichung neuer Dokumente",
      "state": "Hessen",
      "amtsgericht": "Amtsgericht Darmstadt",
      "registernummer": "HRB 24948",
      "registerart": "HRB",
      "company_name": "SIRONA Dental Systems GmbH",
      "company_seat": "Bensheim",
      "details": "21.02.2025 (Bekanntmachungsdatum)\n\nHessen Amtsgericht Darmstadt HRB 24948\nEinreichung neuer Dokumente 21.02.2025 (Eintragungsdatum)\n\nSIRONA Dental Systems GmbH\nGesellschaft mit beschränkter Haftung\nBensheim\n\nWegen Änderungen in den Personen der Aufsichtsratsmitglieder ist eine Liste der Mitglieder des Aufsichtsrates zum Handelsregister eingereicht worden."
    },
    {
      "date": "2025-02-21",
      "id": "102011",
      "original_text": "Registerbekanntmachung nach dem Umwandlungsgesetz\nHessen Amtsgericht Frankfurt am Main HRB 137810\nFTA Finanz-Treuhand GmbH Wirtschaftsprüfungsgesellschaft – Frankfurt am Man",
      "type": "Registerbekanntmachung nach dem Umwandlungsgesetz",
      "state": "Hessen",
      "amtsgericht": "Amtsgericht Frankfurt am Main",
      "registernummer": "HRB 137810",
      "registerart": "HRB",
      "company_name": "FTA Finanz-Treuhand GmbH Wirtschaftsprüfungsgesellschaft",
      "company_seat": "Frankfurt am Man",
      "details": "21.02.2025 (Bekanntmachungsdatum)\n\nHessen Amtsgericht Frankfurt am Main HRB 137810\nRegisterbekanntmachung nach dem Umwandlungsgesetz 21.02.2025 (Eintragungsdatum)\n\nFTA Finanz-Treuhand GmbH Wirtschaftsprüfungsgesellschaft\nGesellschaft mit beschränkter Haftung\nFrankfurt am Man\n\nDen Gläubigern der an der formwechselnden Umwandlung beteiligten Rechtsträger ist, wenn sie binnen sechs Monaten nach dem Tag, an dem die Eintragung der formwechselnden Umwandlung in das Register des Sitzes desjenigen Rechtsträgers, dessen Gläubiger sie sind, nach § 201 UmwG bekannt gemacht worden ist, ihren Anspruch nach Grund und Höhe schriftlich anmelden, Sicherheit zu leisten, soweit sie nicht Befriedigung verlangen können. Dieses Recht steht den Gläubigern jedoch nur zu, wenn sie glaubhaft machen, dass durch die formwechselnden Umwandlung die Erfüllung ihrer Forderung gefährdet wird."
    }
  ]
}