{
  "date": "2025-02-07",
  "date_of_scrape": "2025-02-08T04:08:47.136Z",
  "tool_version": "0.2.0",
  "number_of_announcements": 127,
  "announcements": [
    {
      "date": "2025-02-07",
      "id": "100703",
      "original_text": "Registerbekanntmachung nach dem Umwandlungsgesetz\nBayern Amtsgericht München HRB 299772\nHeil Gerüstbau GmbH – Dorfen",
      "type": "Registerbekanntmachung nach dem Umwandlungsgesetz",
      "state": "Bayern",
      "amtsgericht": "Amtsgericht München",
      "registernummer": "HRB 299772",
      "registerart": "HRB",
      "company_name": "Heil Gerüstbau GmbH",
      "company_seat": "Dorfen",
      "details": "07.02.2025 (Bekanntmachungsdatum)\n\nBayern Amtsgericht München HRB 299772\nRegisterbekanntmachung nach dem Umwandlungsgesetz 06.02.2025 (Eintragungsdatum)\n\nHeil Gerüstbau GmbH\nGesellschaft mit beschränkter Haftung\nDorfen\n\nDen Gläubigern der an der Ausgliederung beteiligten Rechtsträger ist, wenn sie binnen sechs Monaten nach dem Tag, an dem die Eintragung der Ausgliederung in das Register des Sitzes desjenigen Rechtsträgers, dessen Gläubiger sie sind, nach §§ 125, 19 Abs. 3 UmwG als bekannt gemacht gilt, ihren Anspruch nach Grund und Höhe in Textform anmelden, Sicherheit zu leisten, soweit sie nicht Befriedigung verlangen können. Dieses Recht steht den Gläubigern jedoch nur zu, wenn sie glaubhaft machen, dass durch die Ausgliederung die Erfüllung ihrer Forderung gefährdet wird."
    },
    {
      "date": "2025-02-07",
      "id": "100704",
      "original_text": "Registerbekanntmachung nach dem Umwandlungsgesetz\nBayern Amtsgericht Augsburg HRB 20930\nErhardt + Leimer Automatisierungstechnik GmbH – Augsburg",
      "type": "Registerbekanntmachung nach dem Umwandlungsgesetz",
      "state": "Bayern",
      "amtsgericht": "Amtsgericht Augsburg",
      "registernummer": "HRB 20930",
      "registerart": "HRB",
      "company_name": "Erhardt + Leimer Automatisierungstechnik GmbH",
      "company_seat": "Augsburg",
      "details": "07.02.2025 (Bekanntmachungsdatum)\n\nBayern Amtsgericht Augsburg HRB 20930\nRegisterbekanntmachung nach dem Umwandlungsgesetz 06.02.2025 (Eintragungsdatum)\n\nErhardt + Leimer Automatisierungstechnik GmbH\nGesellschaft mit beschränkter Haftung\nAugsburg\n\nDen Gläubigern der an der Verschmelzung beteiligten Rechtsträger ist, wenn sie binnen sechs Monaten nach dem Tag, an dem die Eintragung der Verschmelzung in das Register des Sitzes desjenigen Rechtsträgers, dessen Gläubiger sie sind, nach § 19 Abs. 3 UmwG als bekannt gemacht gilt, ihren Anspruch nach Grund und Höhe in Textform anmelden, Sicherheit zu leisten, soweit sie nicht Befriedigung verlangen können. Dieses Recht steht den Gläubigern jedoch nur zu, wenn sie glaubhaft machen, dass durch die Verschmelzung die Erfüllung ihrer Forderung gefährdet wird."
    },
    {
      "date": "2025-02-07",
      "id": "100705",
      "original_text": "Löschungsankündigung\nBayern Amtsgericht München HRB 105855\nTEMPLUM Verwaltungsgesellschaft für Haus- und Grundbesitz mbH – Gilching",
      "type": "Löschungsankündigung",
      "state": "Bayern",
      "amtsgericht": "Amtsgericht München",
      "registernummer": "HRB 105855",
      "registerart": "HRB",
      "company_name": "TEMPLUM Verwaltungsgesellschaft für Haus- und Grundbesitz mbH",
      "company_seat": "Gilching",
      "details": "07.02.2025 (Bekanntmachungsdatum)\n\nBayern Amtsgericht München HRB 105855\nLöschungsankündigung 06.02.2025 (Eintragungsdatum)\n\nTEMPLUM Verwaltungsgesellschaft für Haus- und Grundbesitz mbH\nGesellschaft mit beschränkter Haftung\nGilching\n\nDas Registergericht beabsichtigt, die im Handelsregister eingetragene Gesellschaft wegen Vermögenslosigkeit von Amts wegen nach § 394 FamFG zu löschen. Die Frist zur Erhebung eines Widerspruchs ist auf drei Monate festgesetzt."
    },
    {
      "date": "2025-02-07",
      "id": "100706",
      "original_text": "Löschungsankündigung\nBayern Amtsgericht Coburg HRA 5151\nVazquez Immobilienverwaltung GmbH & Co. KG – Weidhausen b.Coburg",
      "type": "Löschungsankündigung",
      "state": "Bayern",
      "amtsgericht": "Amtsgericht Coburg",
      "registernummer": "HRA 5151",
      "registerart": "HRA",
      "company_name": "Vazquez Immobilienverwaltung GmbH & Co. KG",
      "company_seat": "Weidhausen b.Coburg",
      "details": "07.02.2025 (Bekanntmachungsdatum)\n\nBayern Amtsgericht Coburg HRA 5151\nLöschungsankündigung 06.02.2025 (Eintragungsdatum)\n\nVazquez Immobilienverwaltung GmbH & Co. KG\nKommanditgesellschaft\nWeidhausen b.Coburg\n\nDas Registergericht beabsichtigt, die im Handelsregister eingetragene Firma wegen Vermögenslosigkeit von Amts wegen nach § 394 FamFG zu löschen. Die Frist zur Erhebung eines Widerspruchs ist auf einen Monat festgesetzt."
    },
    {
      "date": "2025-02-07",
      "id": "100707",
      "original_text": "Sonstige Registerbekanntmachung\nBayern Amtsgericht Bayreuth HRB 8355\nSachwert Portfolio Consult GmbH – Bayreuth",
      "type": "Sonstige Registerbekanntmachung",
      "state": "Bayern",
      "amtsgericht": "Amtsgericht Bayreuth",
      "registernummer": "HRB 8355",
      "registerart": "HRB",
      "company_name": "Sachwert Portfolio Consult GmbH",
      "company_seat": "Bayreuth",
      "details": "07.02.2025 (Bekanntmachungsdatum)\n\nBayern Amtsgericht Bayreuth HRB 8355\nSonstige Registerbekanntmachung 06.02.2025 (Eintragungsdatum)\n\nSachwert Portfolio Consult GmbH\nGesellschaft mit beschränkter Haftung\nBayreuth\n\nDen Gläubigern des formwechselnden Rechtsträgers ist, wenn sie binnen sechs Monaten nach dem Tag, an dem die Eintragung des Formwechsels nach § 201 UmwG als bekannt gemacht gilt, ihren Anspruch nach Grund und Höhe in Textform anmelden, Sicherheit zu leisten, soweit sie nicht Befriedigung verlangen können. Dieses Recht steht den Gläubigern jedoch nur zu, wenn sie glaubhaft machen, dass durch den Formwechsel die Erfüllung ihrer Forderung gefährdet wird."
    },
    {
      "date": "2025-02-07",
      "id": "100708",
      "original_text": "Registerbekanntmachung nach dem Umwandlungsgesetz\nBayern Amtsgericht Passau GsR 176\nVerkehrsgemeinschaft Landkreis Freyung-Grafenau eGbR – Grainet",
      "type": "Registerbekanntmachung nach dem Umwandlungsgesetz",
      "state": "Bayern",
      "amtsgericht": "Amtsgericht Passau",
      "registernummer": "GsR 176",
      "registerart": "GsR",
      "company_name": "Verkehrsgemeinschaft Landkreis Freyung-Grafenau eGbR",
      "company_seat": "Grainet",
      "details": "07.02.2025 (Bekanntmachungsdatum)\n\nBayern Amtsgericht Passau GsR 176\nRegisterbekanntmachung nach dem Umwandlungsgesetz 06.02.2025 (Eintragungsdatum)\n\nVerkehrsgemeinschaft Landkreis Freyung-Grafenau eGbR\nGesellschaft bürgerlichen Rechts\nGrainet\n\nDen Gläubigern des formwechselnden Rechtsträgers ist, wenn sie binnen sechs Monaten nach dem Tag, an dem die Eintragung des Formwechsels nach § 201 UmwG als bekannt gemacht gilt, ihren Anspruch nach Grund und Höhe in Textform anmelden, Sicherheit zu leisten, soweit sie nicht Befriedigung verlangen können. Dieses Recht steht den Gläubigern jedoch nur zu, wenn sie glaubhaft machen, dass durch den Formwechsel die Erfüllung ihrer Forderung gefährdet wird."
    },
    {
      "date": "2025-02-07",
      "id": "100709",
      "original_text": "Registerbekanntmachung nach dem Umwandlungsgesetz\nBayern Amtsgericht München HRB 269298\nGREENFORCE FUTURE FOOD AG – München",
      "type": "Registerbekanntmachung nach dem Umwandlungsgesetz",
      "state": "Bayern",
      "amtsgericht": "Amtsgericht München",
      "registernummer": "HRB 269298",
      "registerart": "HRB",
      "company_name": "GREENFORCE FUTURE FOOD AG",
      "company_seat": "München",
      "details": "07.02.2025 (Bekanntmachungsdatum)\n\nBayern Amtsgericht München HRB 269298\nRegisterbekanntmachung nach dem Umwandlungsgesetz\n\nGREENFORCE FUTURE FOOD AG\nAktiengesellschaft\nMünchen\n\nDem Amtsgericht München -Registergericht- ist ein Verschmelzungsvertrag zwischen der Gesellschaft als übernehmendem Rechtsträger und der Mondarella GmbH, Berlin (Amtsgericht Charlottenburg HRB 228220 B) zur Einsichtnahme eingereicht worden."
    },
    {
      "date": "2025-02-07",
      "id": "100710",
      "original_text": "Registerbekanntmachung nach dem Umwandlungsgesetz\nBayern Amtsgericht Augsburg HRB 17515\nErhardt + Leimer Elektroanlagen GmbH – Augsburg",
      "type": "Registerbekanntmachung nach dem Umwandlungsgesetz",
      "state": "Bayern",
      "amtsgericht": "Amtsgericht Augsburg",
      "registernummer": "HRB 17515",
      "registerart": "HRB",
      "company_name": "Erhardt + Leimer Elektroanlagen GmbH",
      "company_seat": "Augsburg",
      "details": "07.02.2025 (Bekanntmachungsdatum)\n\nBayern Amtsgericht Augsburg HRB 17515\nRegisterbekanntmachung nach dem Umwandlungsgesetz 06.02.2025 (Eintragungsdatum)\n\nErhardt + Leimer Elektroanlagen GmbH\nGesellschaft mit beschränkter Haftung\nAugsburg\n\nDen Gläubigern der an der Verschmelzung beteiligten Rechtsträger ist, wenn sie binnen sechs Monaten nach dem Tag, an dem die Eintragung der Verschmelzung in das Register des Sitzes desjenigen Rechtsträgers, dessen Gläubiger sie sind, nach § 19 Abs. 3 UmwG als bekannt gemacht gilt, ihren Anspruch nach Grund und Höhe in Textform anmelden, Sicherheit zu leisten, soweit sie nicht Befriedigung verlangen können. Dieses Recht steht den Gläubigern jedoch nur zu, wenn sie glaubhaft machen, dass durch die Verschmelzung die Erfüllung ihrer Forderung gefährdet wird."
    },
    {
      "date": "2025-02-07",
      "id": "100711",
      "original_text": "Einreichung neuer Dokumente\nBayern Amtsgericht München HRB 223332\nAURELIUS WK Management SE – Grünwald",
      "type": "Einreichung neuer Dokumente",
      "state": "Bayern",
      "amtsgericht": "Amtsgericht München",
      "registernummer": "HRB 223332",
      "registerart": "HRB",
      "company_name": "AURELIUS WK Management SE",
      "company_seat": "Grünwald",
      "details": "07.02.2025 (Bekanntmachungsdatum)\n\nBayern Amtsgericht München HRB 223332\nEinreichung neuer Dokumente\n\nAURELIUS WK Management SE\nEuropäische Aktiengesellschaft (SE)\nGrünwald\n\nDem Amtsgericht München -Registergericht- ist eine Liste der Mitglieder des Aufsichtsrats eingereicht worden, Art. 9 Abs. 1 Buchst. c (ii) SE-VO i.V.m. § 106 AktG."
    },
    {
      "date": "2025-02-07",
      "id": "100712",
      "original_text": "Registerbekanntmachung nach dem Umwandlungsgesetz\nBayern Amtsgericht Regensburg HRA 11092\nLarsen Hausverwaltung und Immobilien e.K. – Regensburg",
      "type": "Registerbekanntmachung nach dem Umwandlungsgesetz",
      "state": "Bayern",
      "amtsgericht": "Amtsgericht Regensburg",
      "registernummer": "HRA 11092",
      "registerart": "HRA",
      "company_name": "Larsen Hausverwaltung und Immobilien e.K.",
      "company_seat": "Regensburg",
      "details": "07.02.2025 (Bekanntmachungsdatum)\n\nBayern Amtsgericht Regensburg HRA 11092\nRegisterbekanntmachung nach dem Umwandlungsgesetz 06.02.2025 (Eintragungsdatum)\n\nLarsen Hausverwaltung und Immobilien e.K.\nEinzelkaufmann / Einzelkauffrau\nRegensburg\n\nDen Gläubigern der an der Ausgliederung beteiligten Rechtsträger ist, wenn sie binnen sechs Monaten nach dem Tag, an dem die Eintragung der Ausgliederung in das Register des Sitzes desjenigen Rechtsträgers, dessen Gläubiger sie sind, nach §§ 125, 19 Abs. 3 UmwG als bekannt gemacht gilt, ihren Anspruch nach Grund und Höhe in Textform anmelden, Sicherheit zu leisten, soweit sie nicht Befriedigung verlangen können. Dieses Recht steht den Gläubigern jedoch nur zu, wenn sie glaubhaft machen, dass durch die Ausgliederung die Erfüllung ihrer Forderung gefährdet wird."
    },
    {
      "date": "2025-02-07",
      "id": "100713",
      "original_text": "Registerbekanntmachung nach dem Umwandlungsgesetz\nBayern Amtsgericht Bayreuth HRA 4297\nSachwert Portfolio Consult GmbH & Co. KG – Bayreuth",
      "type": "Registerbekanntmachung nach dem Umwandlungsgesetz",
      "state": "Bayern",
      "amtsgericht": "Amtsgericht Bayreuth",
      "registernummer": "HRA 4297",
      "registerart": "HRA",
      "company_name": "Sachwert Portfolio Consult GmbH & Co. KG",
      "company_seat": "Bayreuth",
      "details": "07.02.2025 (Bekanntmachungsdatum)\n\nBayern Amtsgericht Bayreuth HRA 4297\nRegisterbekanntmachung nach dem Umwandlungsgesetz 06.02.2025 (Eintragungsdatum)\n\nSachwert Portfolio Consult GmbH & Co. KG\nKommanditgesellschaft\nBayreuth\n\nDen Gläubigern des formwechselnden Rechtsträgers ist, wenn sie binnen sechs Monaten nach dem Tag, an dem die Eintragung des Formwechsels nach § 201 UmwG als bekannt gemacht gilt, ihren Anspruch nach Grund und Höhe in Textform anmelden, Sicherheit zu leisten, soweit sie nicht Befriedigung verlangen können. Dieses Recht steht den Gläubigern jedoch nur zu, wenn sie glaubhaft machen, dass durch den Formwechsel die Erfüllung ihrer Forderung gefährdet wird."
    },
    {
      "date": "2025-02-07",
      "id": "100714",
      "original_text": "Einreichung neuer Dokumente\nBayern Amtsgericht München HRB 250707\nKR Holding SE – München",
      "type": "Einreichung neuer Dokumente",
      "state": "Bayern",
      "amtsgericht": "Amtsgericht München",
      "registernummer": "HRB 250707",
      "registerart": "HRB",
      "company_name": "KR Holding SE",
      "company_seat": "München",
      "details": "07.02.2025 (Bekanntmachungsdatum)\n\nBayern Amtsgericht München HRB 250707\nEinreichung neuer Dokumente\n\nKR Holding SE\nEuropäische Aktiengesellschaft (SE)\nMünchen\n\nDem Amtsgericht München -Registergericht- ist eine Liste der Mitglieder des Aufsichtsrats eingereicht worden, Art. 9 Abs. 1 Buchst. c (ii) SE-VO i.V.m. § 106 AktG."
    },
    {
      "date": "2025-02-07",
      "id": "100715",
      "original_text": "Einreichung neuer Dokumente\nBayern Amtsgericht Fürth HRB 14738\nSchaeffler AG – Herzogenaurach",
      "type": "Einreichung neuer Dokumente",
      "state": "Bayern",
      "amtsgericht": "Amtsgericht Fürth",
      "registernummer": "HRB 14738",
      "registerart": "HRB",
      "company_name": "Schaeffler AG",
      "company_seat": "Herzogenaurach",
      "details": "07.02.2025 (Bekanntmachungsdatum)\n\nBayern Amtsgericht Fürth HRB 14738\nEinreichung neuer Dokumente\n\nSchaeffler AG\nAktiengesellschaft\nHerzogenaurach\n\nDem Amtsgericht Fürth -Registergericht- ist eine Liste der Mitglieder des Aufsichtsrats eingereicht worden, § 106 AktG."
    },
    {
      "date": "2025-02-07",
      "id": "100716",
      "original_text": "Löschungsankündigung\nBayern Amtsgericht München HRB 291992\nGreen Perspective UG (haftungsbeschränkt) – München",
      "type": "Löschungsankündigung",
      "state": "Bayern",
      "amtsgericht": "Amtsgericht München",
      "registernummer": "HRB 291992",
      "registerart": "HRB",
      "company_name": "Green Perspective UG (haftungsbeschränkt)",
      "company_seat": "München",
      "details": "07.02.2025 (Bekanntmachungsdatum)\n\nBayern Amtsgericht München HRB 291992\nLöschungsankündigung\n\nGreen Perspective UG (haftungsbeschränkt)\nGesellschaft mit beschränkter Haftung\nMünchen\n\nDas Registergericht beabsichtigt, die im Handelsregister eingetragene Gesellschaft wegen Vermögenslosigkeit von Amts wegen nach § 394 FamFG zu löschen. Die Frist zur Erhebung eines Widerspruchs ist auf drei Monate festgesetzt."
    },
    {
      "date": "2025-02-07",
      "id": "100717",
      "original_text": "Einreichung neuer Dokumente\nBayern Amtsgericht Bayreuth HRB 4923\nTenneT TSO GmbH – Bayreuth",
      "type": "Einreichung neuer Dokumente",
      "state": "Bayern",
      "amtsgericht": "Amtsgericht Bayreuth",
      "registernummer": "HRB 4923",
      "registerart": "HRB",
      "company_name": "TenneT TSO GmbH",
      "company_seat": "Bayreuth",
      "details": "07.02.2025 (Bekanntmachungsdatum)\n\nBayern Amtsgericht Bayreuth HRB 4923\nEinreichung neuer Dokumente\n\nTenneT TSO GmbH\nGesellschaft mit beschränkter Haftung\nBayreuth\n\nDem #Re.Name ist eine Liste der Mitglieder des Aufsichtsrats eingereicht worden, § 52 Abs. 3 S. 2 GmbHG."
    },
    {
      "date": "2025-02-07",
      "id": "100718",
      "original_text": "Einreichung neuer Dokumente\nBayern Amtsgericht München HRB 167849\nShirtinator AG – München",
      "type": "Einreichung neuer Dokumente",
      "state": "Bayern",
      "amtsgericht": "Amtsgericht München",
      "registernummer": "HRB 167849",
      "registerart": "HRB",
      "company_name": "Shirtinator AG",
      "company_seat": "München",
      "details": "07.02.2025 (Bekanntmachungsdatum)\n\nBayern Amtsgericht München HRB 167849\nEinreichung neuer Dokumente\n\nShirtinator AG\nAktiengesellschaft\nMünchen\n\nDem Amtsgericht München -Registergericht- ist eine Liste der Mitglieder des Aufsichtsrats eingereicht worden, § 106 AktG."
    },
    {
      "date": "2025-02-07",
      "id": "100719",
      "original_text": "Registerbekanntmachung nach dem Umwandlungsgesetz\nBayern Amtsgericht Augsburg HRB 31838\nLudwig Verkehrssicherung AG – Untermeitingen",
      "type": "Registerbekanntmachung nach dem Umwandlungsgesetz",
      "state": "Bayern",
      "amtsgericht": "Amtsgericht Augsburg",
      "registernummer": "HRB 31838",
      "registerart": "HRB",
      "company_name": "Ludwig Verkehrssicherung AG",
      "company_seat": "Untermeitingen",
      "details": "07.02.2025 (Bekanntmachungsdatum)\n\nBayern Amtsgericht Augsburg HRB 31838\nRegisterbekanntmachung nach dem Umwandlungsgesetz 06.02.2025 (Eintragungsdatum)\n\nLudwig Verkehrssicherung AG\nAktiengesellschaft\nUntermeitingen\n\nDen Gläubigern der an der Verschmelzung beteiligten Rechtsträger ist, wenn sie binnen sechs Monaten nach dem Tag, an dem die Eintragung der Verschmelzung in das Register des Sitzes desjenigen Rechtsträgers, dessen Gläubiger sie sind, nach § 19 Abs. 3 UmwG als bekannt gemacht gilt, ihren Anspruch nach Grund und Höhe in Textform anmelden, Sicherheit zu leisten, soweit sie nicht Befriedigung verlangen können. Dieses Recht steht den Gläubigern jedoch nur zu, wenn sie glaubhaft machen, dass durch die Verschmelzung die Erfüllung ihrer Forderung gefährdet wird."
    },
    {
      "date": "2025-02-07",
      "id": "100720",
      "original_text": "Löschungsankündigung\nBayern Amtsgericht München HRB 221653\nLion King GmbH – Taufkirchen",
      "type": "Löschungsankündigung",
      "state": "Bayern",
      "amtsgericht": "Amtsgericht München",
      "registernummer": "HRB 221653",
      "registerart": "HRB",
      "company_name": "Lion King GmbH",
      "company_seat": "Taufkirchen",
      "details": "07.02.2025 (Bekanntmachungsdatum)\n\nBayern Amtsgericht München HRB 221653\nLöschungsankündigung 06.02.2025 (Eintragungsdatum)\n\nLion King GmbH\nGesellschaft mit beschränkter Haftung\nTaufkirchen\n\nDas Registergericht beabsichtigt, die im Handelsregister eingetragene Gesellschaft wegen Vermögenslosigkeit von Amts wegen nach § 394 FamFG zu löschen. Die Frist zur Erhebung eines Widerspruchs ist auf drei Monate festgesetzt."
    },
    {
      "date": "2025-02-07",
      "id": "100721",
      "original_text": "Registerbekanntmachung nach dem Umwandlungsgesetz\nBayern Amtsgericht München HRB 221325\nPlastic Holding GmbH – München",
      "type": "Registerbekanntmachung nach dem Umwandlungsgesetz",
      "state": "Bayern",
      "amtsgericht": "Amtsgericht München",
      "registernummer": "HRB 221325",
      "registerart": "HRB",
      "company_name": "Plastic Holding GmbH",
      "company_seat": "München",
      "details": "07.02.2025 (Bekanntmachungsdatum)\n\nBayern Amtsgericht München HRB 221325\nRegisterbekanntmachung nach dem Umwandlungsgesetz 06.02.2025 (Eintragungsdatum)\n\nPlastic Holding GmbH\nGesellschaft mit beschränkter Haftung\nMünchen\n\nDen Gläubigern der an der Verschmelzung beteiligten Rechtsträger ist, wenn sie binnen sechs Monaten nach dem Tag, an dem die Eintragung der Verschmelzung in das Register des Sitzes desjenigen Rechtsträgers, dessen Gläubiger sie sind, nach § 19 Abs. 3 UmwG als bekannt gemacht gilt, ihren Anspruch nach Grund und Höhe in Textform anmelden, Sicherheit zu leisten, soweit sie nicht Befriedigung verlangen können. Dieses Recht steht den Gläubigern jedoch nur zu, wenn sie glaubhaft machen, dass durch die Verschmelzung die Erfüllung ihrer Forderung gefährdet wird."
    },
    {
      "date": "2025-02-07",
      "id": "100722",
      "original_text": "Registerbekanntmachung nach dem Umwandlungsgesetz\nBayern Amtsgericht Passau HRB 12801\nVerkehrsgemeinschaft Landkreis Freyung-Grafenau GmbH – Grainet",
      "type": "Registerbekanntmachung nach dem Umwandlungsgesetz",
      "state": "Bayern",
      "amtsgericht": "Amtsgericht Passau",
      "registernummer": "HRB 12801",
      "registerart": "HRB",
      "company_name": "Verkehrsgemeinschaft Landkreis Freyung-Grafenau GmbH",
      "company_seat": "Grainet",
      "details": "07.02.2025 (Bekanntmachungsdatum)\n\nBayern Amtsgericht Passau HRB 12801\nRegisterbekanntmachung nach dem Umwandlungsgesetz 06.02.2025 (Eintragungsdatum)\n\nVerkehrsgemeinschaft Landkreis Freyung-Grafenau GmbH\nGesellschaft mit beschränkter Haftung\nGrainet\n\nDen Gläubigern des formwechselnden Rechtsträgers ist, wenn sie binnen sechs Monaten nach dem Tag, an dem die Eintragung des Formwechsels nach § 201 UmwG als bekannt gemacht gilt, ihren Anspruch nach Grund und Höhe in Textform anmelden, Sicherheit zu leisten, soweit sie nicht Befriedigung verlangen können. Dieses Recht steht den Gläubigern jedoch nur zu, wenn sie glaubhaft machen, dass durch den Formwechsel die Erfüllung ihrer Forderung gefährdet wird."
    },
    {
      "date": "2025-02-07",
      "id": "100723",
      "original_text": "Sonstige Registerbekanntmachung\nBayern Amtsgericht München HRB 106847\nArchetype Agency GmbH – München",
      "type": "Sonstige Registerbekanntmachung",
      "state": "Bayern",
      "amtsgericht": "Amtsgericht München",
      "registernummer": "HRB 106847",
      "registerart": "HRB",
      "company_name": "Archetype Agency GmbH",
      "company_seat": "München",
      "details": "07.02.2025 (Bekanntmachungsdatum)\n\nBayern Amtsgericht München HRB 106847\nSonstige Registerbekanntmachung 06.02.2025 (Eintragungsdatum)\n\nArchetype Agency GmbH\nGesellschaft mit beschränkter Haftung\nMünchen\n\nDen Gläubigern der Gesellschaft, deren Forderungen begründet worden sind, bevor die Eintragung der Beendigung des Beherrschungs- und Gewinnabführungsvertrages in das Handelsregister nach § 10 des Handelsgesetzbuches als bekanntgemacht gilt, hat der andere Vertragsteil Sicherheit zu leisten, wenn sie sich binnen sechs Monaten nach der Bekanntmachung der Eintragung zu diesem Zweck bei ihm melden."
    },
    {
      "date": "2025-02-07",
      "id": "100724",
      "original_text": "Löschungsankündigung\nBrandenburg Amtsgericht Neuruppin HRB 13158\nBy Andrea & Co. GmbH – Tantow",
      "type": "Löschungsankündigung",
      "state": "Brandenburg",
      "amtsgericht": "Amtsgericht Neuruppin",
      "registernummer": "HRB 13158",
      "registerart": "HRB",
      "company_name": "By Andrea & Co. GmbH",
      "company_seat": "Tantow",
      "details": "07.02.2025 (Bekanntmachungsdatum)\n\nBrandenburg Amtsgericht Neuruppin HRB 13158\nLöschungsankündigung\n\nBy Andrea & Co. GmbH\nGesellschaft mit beschränkter Haftung\nTantow\n\nBei der nachstehenden Gesellschaft wird das Amtslöschungsverfahren gemäß § 394 FamFG eingeleitet.\nWiderspruchsfrist: 1 Monat"
    },
    {
      "date": "2025-02-07",
      "id": "100725",
      "original_text": "Löschungsankündigung\nBerlin Amtsgericht Berlin (Charlottenburg) HRB 212673\nT. Cebe Vermögensverwaltungs GmbH – Berlin",
      "type": "Löschungsankündigung",
      "state": "Berlin",
      "amtsgericht": "Amtsgericht Berlin (Charlottenburg)",
      "registernummer": "HRB 212673",
      "registerart": "HRB",
      "company_name": "T. Cebe Vermögensverwaltungs GmbH",
      "company_seat": "Berlin",
      "details": "07.02.2025 (Bekanntmachungsdatum)\n\nBerlin Amtsgericht Berlin (Charlottenburg) HRB 212673\nLöschungsankündigung\n\nT. Cebe Vermögensverwaltungs GmbH\nGesellschaft mit beschränkter Haftung\nBerlin\n\nBei der nachstehenden Gesellschaft wird das Amtslöschungsverfahren gemäß § 394 FamFG eingeleitet. Widerspruchsfrist 6 Wochen"
    },
    {
      "date": "2025-02-07",
      "id": "100726",
      "original_text": "Registerbekanntmachung nach dem Umwandlungsgesetz\nBaden-Württemberg Amtsgericht Mannheim HRB 753388\nBruker Optik Holding AG – Ettlingen",
      "type": "Registerbekanntmachung nach dem Umwandlungsgesetz",
      "state": "Baden-Württemberg",
      "amtsgericht": "Amtsgericht Mannheim",
      "registernummer": "HRB 753388",
      "registerart": "HRB",
      "company_name": "Bruker Optik Holding AG",
      "company_seat": "Ettlingen",
      "details": "07.02.2025 (Bekanntmachungsdatum)\n\nBaden-Württemberg Amtsgericht Mannheim HRB 753388\nRegisterbekanntmachung nach dem Umwandlungsgesetz\n\nBruker Optik Holding AG\nAktiengesellschaft\nEttlingen\n\nDie Gesellschaft hat am 05.02.2025 den Entwurf des Verschmelzungsvertrages zwischen \"Austria Bruker Optik AG\", Wien (Österreichisches Firmenbuch FN 626922w) und der hiesigen Gesellschaft (übernehmender Rechtsträger) zum Handelsregister eingereicht.\n\nBruker Optik Holding AG\nBekanntmachung gemäß Art. 21 der Verordnung (EG) Nr. 2157/2001 des Rates vom 8. Oktober 2001 (SE-VO)\nbetreffend die Verschmelzung durch Aufnahme der Austria Bruker Optik AG, Wien, Österreich,\nauf die Bruker Optik Holding AG, Ettlingen, Deutschland, unter Umwandlung der Bruker Optik Holding AG in eine SE gemäß Art. 2 Abs. 1 SE-VO\n\n1.\nAn der Verschmelzung sind die Austria Bruker Optik AG, eine Aktiengesellschaft nach österreichischem Recht mit Sitz in Wien, Österreich, als übertragende Gesellschaft und die Bruker Optik Holding AG, eine nach deutschem Recht gegründete Aktiengesellschaft mit Sitz in Ettlingen, Deutschland, als übernehmende Gesellschaft beteiligt.\n\n2.\na)\tDie übertragende Gesellschaft ist eingetragen im Firmenbuch des Handelsgerichts Wien unter der Firmenbuchnummer FN 626922 w.\nb)\tDie übernehmende Gesellschaft ist eingetragen im Handelsregister des Amtsgerichts Mannheim unter der Nummer HRB 753388.\n\n3.\nGemäß Art. 24 Abs. 1 SE-VO findet unter Berücksichtigung des grenzüberschreitenden Charakters der Verschmelzung das Recht des Mitgliedstaats, das jeweils für die sich verschmelzenden Gesellschaften gilt, zum Schutz der Interessen der Gläubiger der sich verschmelzenden Gesellschaften wie bei einer Verschmelzung von Aktiengesellschaften Anwendung.\n\nIm deutschen Recht ist der Gläubigerschutz in § 22 UmwG geregelt. Danach ist den Gläubigern der Bruker Optik Holding AG Sicherheit zu leisten, soweit sie nicht Befriedigung verlangen können, wenn sie binnen sechs Monaten (Art. 24 Abs. 1 SE-VO i.V.m. § 22 UmwG) nach Bekanntmachung der Eintragung (Art. 15 Abs. 2 SE-VO bzw. Art. 28 SE-VO) ihren Anspruch nach Grund und Höhe schriftlich anmelden.\n\nDieses Recht steht den Gläubigern der Bruker Optik Holding AG allerdings nur zu, wenn sie glaubhaft machen, dass durch die Verschmelzung die Erfüllung ihrer Forderung gefährdet wird. Gemäß § 22 Abs. 2 UmwG steht das Recht, Sicherheitsleistung zu verlangen, Gläubigern nicht zu, die im Falle der Insolvenz ein Recht auf vorzugsweise Befriedigung aus einer Deckungsmasse haben, die nach gesetzlichen Vorschriften zu ihrem Schutz errichtet und staatlich überwacht ist.\n\nDie speziellen Gläubigerschutzrechte nach §§ 8, 13 des Gesetzes zur Ausführung der SE-VO (SEAG) finden hier keine Anwendung, weil der künftige Sitz der Bruker Optik Holding SE in Ettlingen, Deutschland, und damit aus deutscher Sicht im Inland sein wird.\n\n4.\nGemäß Art. 24 Abs. 2 SE-VO kann jeder Mitgliedsstaat in Bezug auf die sich verschmelzenden Gesellschaften, die seinem Recht unterliegen, Vorschriften erlassen, um einen angemessenen Schutz der Minderheitsaktionäre, die sich gegen die Verschmelzung ausgesprochen haben, zu gewährleisten.\n\nAktionäre der Bruker Optik Holding AG können gegen den Beschluss der Hauptversammlung der Bruker Optik Holding AG über die Zustimmung zum Verschmelzungsplan für die Verschmelzung durch Aufnahme der Austria Bruker Optik AG als übertragende Gesellschaft auf die Bruker Optik Holding AG als übernehmende Gesellschaft und die Zusammenführung dieser sich verschmelzenden Gesellschaften in einer Europäischen Aktiengesellschaft Nichtigkeits- und Anfechtungsklage erheben.\n\nDie Nichtigkeitsklage muss gemäß § 14 Abs. 1 UmwG binnen eines Monats nach der Beschlussfassung erhoben werden. Sie kann nur auf im Gesetz genannte Nichtigkeitsgründe gestützt werden. Ausschließlich zuständig ist das Landgericht Mannheim als das Landgericht, in dessen Bezirk die Bruker Optik Holding AG ihren Sitz hat.\n\nDie Anfechtungsklage muss ebenso binnen eines Monats nach Beschlussfassung der Hauptversammlung der Bruker Optik Holding AG erhoben werden. Sie kann grundsätzlich auf jede Verletzung des Gesetzes oder der Satzung gestützt werden. Anfechtungsbefugt ist jeder in der Hauptversammlung erschienene Aktionär der Bruker Optik Holding AG, wenn er gegen den Beschluss Widerspruch zur Niederschrift erklärt hat. Nicht erschienene Aktionäre sind nur dann anfechtungsbefugt, wenn sie zu der Hauptversammlung zu Unrecht nicht zugelassen worden sind, die Versammlung nicht ordnungsgemäß einberufen, der Gegenstand der Beschlussfassung nicht ordnungsgemäß bekannt gemacht worden ist, oder soweit die Anfechtungsklage auf das Erlangen von Sondervorteilen, § 243 Abs. 2 AktG, gestützt ist. Ausschließlich zuständig ist für die Anfechtungsklage das Landgericht Mannheim als das Landgericht, in dessen Bezirk die Bruker Optik Holding AG ihren Sitz hat.\n\nWird der Hauptversammlungsbeschluss aufgrund Nichtigkeits- oder Anfechtungsklage durch rechtskräftiges Urteil für nichtig erklärt, entfaltet das Urteil Wirkung gegenüber allen Aktionären sowie den Mitgliedern des Vorstands und des Aufsichtsrats, auch wenn sie nicht Partei sind. Eine Nichtigkeitserklärung des Beschlusses kommt nicht in Betracht, wenn der Beschluss zwischenzeitlich aufgrund eines Freigabeverfahrens nach § 16 Abs. 3 UmwG in das Handelsregister am Sitz der Bruker Optik Holding AG eingetragen und die Verschmelzung dadurch wirksam geworden ist. In diesem Fall wäre die künftige Bruker Optik Holding SE nach § 16 Abs. 3 S. 10 UmwG verpflichtet, dem Antragsgegner des Freigabeverfahrens den Schaden zu ersetzen, der ihm aus der auf dem Freigabebeschluss beruhenden Eintragung der Verschmelzung entstanden ist. Die Beseitigung der Wirkungen der Eintragung der Verschmelzung im Handelsregister am Sitz der Bruker Optik Holding AG bzw. Bruker Optik Holdng SE kann nicht als Schadensersatz verlangt werden.\n\nAktionären der Bruker Optik Holding AG steht kein Barabfindungsrecht nach § 7 SEAG zu. § 7 SEAG setzt voraus, dass die SE ihren Sitz aus deutscher Sicht im Ausland hat. Das ist nicht der Fall, da die Bruker Optik Holding AG übernehmende Gesellschaft ist und der künftige Sitz der Bruker Optik Holding SE in Ettlingen, Deutschland, sein wird.\n\n5.\nUnter folgender Anschrift können kostenlos erschöpfende Auskünfte über die Modalitäten für die Ausübung der Rechte der Gläubiger der Bruker Optik Holding AG eingeholt werden:\nBruker Optik Holding AG\nz. Hd. des Vorstands\nRudolf-Plank-Str. 27\n76275 Ettlingen\nDeutschland\n\n6.\nDie durch die Verschmelzung der Austria Bruker Optik AG auf die Bruker Optik Holding AG entstehende SE wird unter \"Bruker Optik Holding SE\" firmieren und ihren Sitz in Ettlingen, Deutschland, haben."
    },
    {
      "date": "2025-02-07",
      "id": "100727",
      "original_text": "Löschungsankündigung\nSchleswig-Holstein Amtsgericht Flensburg HRB 9473\nNorddeutsche Training und Event Unternehmergesellschaft (haftungsbeschränkt) – Mildstedt",
      "type": "Löschungsankündigung",
      "state": "Schleswig-Holstein",
      "amtsgericht": "Amtsgericht Flensburg",
      "registernummer": "HRB 9473",
      "registerart": "HRB",
      "company_name": "Norddeutsche Training und Event Unternehmergesellschaft (haftungsbeschränkt)",
      "company_seat": "Mildstedt",
      "details": "07.02.2025 (Bekanntmachungsdatum)\n\nSchleswig-Holstein Amtsgericht Flensburg HRB 9473\nLöschungsankündigung\n\nNorddeutsche Training und Event Unternehmergesellschaft (haftungsbeschränkt)\nGesellschaft mit beschränkter Haftung\nMildstedt\n\nEs ist die Löschung der nachstehenden Gesellschaft wegen Vermögenslosigkeit gemäß § 394 FamFG beabsichtigt.\nWiderspruchsfrist: 2 Monate."
    },
    {
      "date": "2025-02-07",
      "id": "100728",
      "original_text": "Löschungsankündigung\nBrandenburg Amtsgericht Potsdam HRB 37123\nFundamental Bauträgergesellschaft mbH – Kleinmachnow",
      "type": "Löschungsankündigung",
      "state": "Brandenburg",
      "amtsgericht": "Amtsgericht Potsdam",
      "registernummer": "HRB 37123",
      "registerart": "HRB",
      "company_name": "Fundamental Bauträgergesellschaft mbH",
      "company_seat": "Kleinmachnow",
      "details": "07.02.2025 (Bekanntmachungsdatum)\n\nBrandenburg Amtsgericht Potsdam HRB 37123\nLöschungsankündigung\n\nFundamental Bauträgergesellschaft mbH\nGesellschaft mit beschränkter Haftung\nKleinmachnow\n\nBei der nachstehenden Gesellschaft wird das Amtslöschungsverfahren gemäß § 394 FamFG eingeleitet. Widerspruchsfrist: 8 Wochen."
    },
    {
      "date": "2025-02-07",
      "id": "100729",
      "original_text": "Einreichung neuer Dokumente\nSachsen-Anhalt Amtsgericht Stendal HRB 10824\nQuellendorfer Agrar Aktiengesellschaft – Südliches Anhalt",
      "type": "Einreichung neuer Dokumente",
      "state": "Sachsen-Anhalt",
      "amtsgericht": "Amtsgericht Stendal",
      "registernummer": "HRB 10824",
      "registerart": "HRB",
      "company_name": "Quellendorfer Agrar Aktiengesellschaft",
      "company_seat": "Südliches Anhalt",
      "details": "07.02.2025 (Bekanntmachungsdatum)\n\nSachsen-Anhalt Amtsgericht Stendal HRB 10824\nEinreichung neuer Dokumente\n\nQuellendorfer Agrar Aktiengesellschaft\nAktiengesellschaft\nSüdliches Anhalt\n\nEine Liste der Mitglieder des Aufsichtsrates wurde zum Handelsregister eingereicht."
    },
    {
      "date": "2025-02-07",
      "id": "100730",
      "original_text": "Löschungsankündigung\nBrandenburg Amtsgericht Potsdam HRB 33410\nFRIES INTELLIGENT ELEKTRIK UG (haftungsbeschränkt) – Werder (Havel)",
      "type": "Löschungsankündigung",
      "state": "Brandenburg",
      "amtsgericht": "Amtsgericht Potsdam",
      "registernummer": "HRB 33410",
      "registerart": "HRB",
      "company_name": "FRIES INTELLIGENT ELEKTRIK UG (haftungsbeschränkt)",
      "company_seat": "Werder (Havel)",
      "details": "07.02.2025 (Bekanntmachungsdatum)\n\nBrandenburg Amtsgericht Potsdam HRB 33410\nLöschungsankündigung\n\nFRIES INTELLIGENT ELEKTRIK UG (haftungsbeschränkt)\nGesellschaft mit beschränkter Haftung\nWerder (Havel)\n\nBei der nachstehenden Gesellschaft wird das Amtslöschungsverfahren gemäß § 394 FamFG eingeleitet. Widerspruchsfrist: 8 Wochen."
    },
    {
      "date": "2025-02-07",
      "id": "100731",
      "original_text": "Registerbekanntmachung nach dem Umwandlungsgesetz\nBaden-Württemberg Amtsgericht Mannheim HRB 738608\nRKW SE – Mannheim",
      "type": "Registerbekanntmachung nach dem Umwandlungsgesetz",
      "state": "Baden-Württemberg",
      "amtsgericht": "Amtsgericht Mannheim",
      "registernummer": "HRB 738608",
      "registerart": "HRB",
      "company_name": "RKW SE",
      "company_seat": "Mannheim",
      "details": "07.02.2025 (Bekanntmachungsdatum)\n\nBaden-Württemberg Amtsgericht Mannheim HRB 738608\nRegisterbekanntmachung nach dem Umwandlungsgesetz 07.02.2025 (Eintragungsdatum)\n\nRKW SE\nEuropäische Aktiengesellschaft (SE)\nMannheim\n\nDen Gläubigern der an der Verschmelzung beteiligten Rechtsträger ist, wenn sie binnen sechs Monaten nach dem Tag, an dem die Eintragung der Verschmelzung in das Register des Sitzes desjenigen Rechtsträgers, dessen Gläubiger sie sind, nach § 19 Abs. 3 UmwG als bekanntgemacht gilt, ihren Anspruch nach Grund und Höhe schriftlich anmelden, Sicherheit zu leisten, soweit sie nicht Befriedigung verlangen können. Dieses Recht steht den Gläubigern jedoch nur zu, wenn sie glaubhaft machen, dass durch die Verschmelzung die Erfüllung ihrer Forderung gefährdet wird."
    },
    {
      "date": "2025-02-07",
      "id": "100732",
      "original_text": "Registerbekanntmachung nach dem Umwandlungsgesetz\nBaden-Württemberg Amtsgericht Mannheim HRB 738655\nRKW Agri Verwaltungs GmbH – Mannheim",
      "type": "Registerbekanntmachung nach dem Umwandlungsgesetz",
      "state": "Baden-Württemberg",
      "amtsgericht": "Amtsgericht Mannheim",
      "registernummer": "HRB 738655",
      "registerart": "HRB",
      "company_name": "RKW Agri Verwaltungs GmbH",
      "company_seat": "Mannheim",
      "details": "07.02.2025 (Bekanntmachungsdatum)\n\nBaden-Württemberg Amtsgericht Mannheim HRB 738655\nRegisterbekanntmachung nach dem Umwandlungsgesetz 07.02.2025 (Eintragungsdatum)\n\nRKW Agri Verwaltungs GmbH\nGesellschaft mit beschränkter Haftung\nMannheim\n\nDen Gläubigern der an der Verschmelzung beteiligten Rechtsträger ist, wenn sie binnen sechs Monaten nach dem Tag, an dem die Eintragung der Verschmelzung in das Register des Sitzes desjenigen Rechtsträgers, dessen Gläubiger sie sind, nach § 19 Abs. 3 UmwG als bekanntgemacht gilt, ihren Anspruch nach Grund und Höhe schriftlich anmelden, Sicherheit zu leisten, soweit sie nicht Befriedigung verlangen können. Dieses Recht steht den Gläubigern jedoch nur zu, wenn sie glaubhaft machen, dass durch die Verschmelzung die Erfüllung ihrer Forderung gefährdet wird."
    },
    {
      "date": "2025-02-07",
      "id": "100733",
      "original_text": "Löschungsankündigung\nSchleswig-Holstein Amtsgericht Kiel HRA 1240 RD\nMBH Möller und Becker Haustechnik GmbH & Co KG – Fockbek",
      "type": "Löschungsankündigung",
      "state": "Schleswig-Holstein",
      "amtsgericht": "Amtsgericht Kiel",
      "registernummer": "HRA 1240 RD",
      "registerart": "HRA",
      "company_name": "MBH Möller und Becker Haustechnik GmbH & Co KG",
      "company_seat": "Fockbek",
      "details": "07.02.2025 (Bekanntmachungsdatum)\n\nSchleswig-Holstein Amtsgericht Kiel HRA 1240 RD\nLöschungsankündigung\n\nMBH Möller und Becker Haustechnik GmbH & Co KG\nKommanditgesellschaft\nFockbek\n\nBei der nachstehenden Firma wird das Amtslöschungsverfahren gemäß § 31 Abs. 2 HGB eingeleitet. Widerspruchsfrist: 2 Monate."
    },
    {
      "date": "2025-02-07",
      "id": "100734",
      "original_text": "Löschungsankündigung\nSchleswig-Holstein Amtsgericht Flensburg HRB 14433\nHilfe zur Pflege GmbH – Schleswig",
      "type": "Löschungsankündigung",
      "state": "Schleswig-Holstein",
      "amtsgericht": "Amtsgericht Flensburg",
      "registernummer": "HRB 14433",
      "registerart": "HRB",
      "company_name": "Hilfe zur Pflege GmbH",
      "company_seat": "Schleswig",
      "details": "07.02.2025 (Bekanntmachungsdatum)\n\nSchleswig-Holstein Amtsgericht Flensburg HRB 14433\nLöschungsankündigung\n\nHilfe zur Pflege GmbH\nGesellschaft mit beschränkter Haftung\nSchleswig\n\nEs ist die Löschung der nachstehenden Gesellschaft wegen Vermögenslosigkeit gemäß § 394 FamFG beabsichtigt.\nWiderspruchsfrist: 2 Monate"
    },
    {
      "date": "2025-02-07",
      "id": "100735",
      "original_text": "Einreichung neuer Dokumente\nBaden-Württemberg Amtsgericht Stuttgart HRB 4830\nLBBW Immobilien Kommunalentwicklung GmbH – Stuttgart",
      "type": "Einreichung neuer Dokumente",
      "state": "Baden-Württemberg",
      "amtsgericht": "Amtsgericht Stuttgart",
      "registernummer": "HRB 4830",
      "registerart": "HRB",
      "company_name": "LBBW Immobilien Kommunalentwicklung GmbH",
      "company_seat": "Stuttgart",
      "details": "07.02.2025 (Bekanntmachungsdatum)\n\nBaden-Württemberg Amtsgericht Stuttgart HRB 4830\nEinreichung neuer Dokumente\n\nLBBW Immobilien Kommunalentwicklung GmbH\nGesellschaft mit beschränkter Haftung\nStuttgart\n\nDie Gesellschaft hat am 05.02.2025 die Liste über die Zusammensetzung des Aufsichtsrats zum Handelsregister eingereicht."
    },
    {
      "date": "2025-02-07",
      "id": "100736",
      "original_text": "Löschungsankündigung\nMecklenburg-Vorpommern Amtsgericht Rostock HRB 15536\nHRO Automobile Milko UG (haftungsbeschränkt) – Broderstorf",
      "type": "Löschungsankündigung",
      "state": "Mecklenburg-Vorpommern",
      "amtsgericht": "Amtsgericht Rostock",
      "registernummer": "HRB 15536",
      "registerart": "HRB",
      "company_name": "HRO Automobile Milko UG (haftungsbeschränkt)",
      "company_seat": "Broderstorf",
      "details": "07.02.2025 (Bekanntmachungsdatum)\n\nMecklenburg-Vorpommern Amtsgericht Rostock HRB 15536\nLöschungsankündigung\n\nHRO Automobile Milko UG (haftungsbeschränkt)\nGesellschaft mit beschränkter Haftung\nBroderstorf\n\nDas Registergericht beabsichtigt, die im Handelsregister eingetragene Gesellschaft von Amts wegen nach § 394 FamFG zu löschen. Die Frist zur Erhebung eines Widerspruchs gegen die beabsichtigte Löschung wird auf einen Monat festgesetzt."
    },
    {
      "date": "2025-02-07",
      "id": "100737",
      "original_text": "Löschungsankündigung\nBerlin Amtsgericht Berlin (Charlottenburg) HRB 214714\nCaptatio GmbH – Berlin",
      "type": "Löschungsankündigung",
      "state": "Berlin",
      "amtsgericht": "Amtsgericht Berlin (Charlottenburg)",
      "registernummer": "HRB 214714",
      "registerart": "HRB",
      "company_name": "Captatio GmbH",
      "company_seat": "Berlin",
      "details": "07.02.2025 (Bekanntmachungsdatum)\n\nBerlin Amtsgericht Berlin (Charlottenburg) HRB 214714\nLöschungsankündigung\n\nCaptatio GmbH\nGesellschaft mit beschränkter Haftung\nBerlin\n\nBei der nachstehenden Gesellschaft wird das Amtslöschungsverfahren gemäß § 394 FamFG eingeleitet. Widerspruchsfrist 6 Wochen"
    },
    {
      "date": "2025-02-07",
      "id": "100738",
      "original_text": "Sonstige Registerbekanntmachung\nBerlin Amtsgericht Berlin (Charlottenburg) HRB 262034\nEckert & Ziegler SE – Berlin",
      "type": "Sonstige Registerbekanntmachung",
      "state": "Berlin",
      "amtsgericht": "Amtsgericht Berlin (Charlottenburg)",
      "registernummer": "HRB 262034",
      "registerart": "HRB",
      "company_name": "Eckert & Ziegler SE",
      "company_seat": "Berlin",
      "details": "07.02.2025 (Bekanntmachungsdatum)\n\nBerlin Amtsgericht Berlin (Charlottenburg) HRB 262034\nSonstige Registerbekanntmachung\n\nEckert & Ziegler SE\nEuropäische Aktiengesellschaft (SE)\nBerlin\n\nAls nicht eingetragen wird veröffentlicht: Es wurde eine neue Liste der Aufsichtsratsmitglieder eingereicht (§ 106 AktG)."
    },
    {
      "date": "2025-02-07",
      "id": "100739",
      "original_text": "Löschungsankündigung\nBerlin Amtsgericht Berlin (Charlottenburg) HRB 227321\nBau-Innovation GmbH – Berlin",
      "type": "Löschungsankündigung",
      "state": "Berlin",
      "amtsgericht": "Amtsgericht Berlin (Charlottenburg)",
      "registernummer": "HRB 227321",
      "registerart": "HRB",
      "company_name": "Bau-Innovation GmbH",
      "company_seat": "Berlin",
      "details": "07.02.2025 (Bekanntmachungsdatum)\n\nBerlin Amtsgericht Berlin (Charlottenburg) HRB 227321\nLöschungsankündigung\n\nBau-Innovation GmbH\nGesellschaft mit beschränkter Haftung\nBerlin\n\nEs ist beabsichtigt, die Eintragung wegen Mangels einer wesentlichen Voraussetzung gemäß § 395 FamFG von Amts wegen zu löschen. Widerspruchsfrist 6 Wochen"
    },
    {
      "date": "2025-02-07",
      "id": "100740",
      "original_text": "Registerbekanntmachung nach dem Umwandlungsgesetz\nBaden-Württemberg Amtsgericht Mannheim HRB 739820\nSPARTA AG – Heidelberg",
      "type": "Registerbekanntmachung nach dem Umwandlungsgesetz",
      "state": "Baden-Württemberg",
      "amtsgericht": "Amtsgericht Mannheim",
      "registernummer": "HRB 739820",
      "registerart": "HRB",
      "company_name": "SPARTA AG",
      "company_seat": "Heidelberg",
      "details": "07.02.2025 (Bekanntmachungsdatum)\n\nBaden-Württemberg Amtsgericht Mannheim HRB 739820\nRegisterbekanntmachung nach dem Umwandlungsgesetz\n\nSPARTA AG\nAktiengesellschaft\nHeidelberg\n\nDie Gesellschaft hat am 05.02.2025 den Entwurf des Verschmelzungsvertrages zwischen \"Beta Systems Software Aktiengesellschaft\", Berlin (Amtsgericht Charlottenburg HRB 38874 B) und der hiesigen Gesellschaft (übernehmender Rechtsträger) zum Handelsregister eingereicht."
    },
    {
      "date": "2025-02-07",
      "id": "100741",
      "original_text": "Löschungsankündigung\nMecklenburg-Vorpommern Amtsgericht Stralsund HRB 974 früher Amtsgericht Rostock\n\"Autohaus Burmeister GmbH\" Vertragshändler Renault – Hohendorf",
      "type": "Löschungsankündigung",
      "state": "Mecklenburg-Vorpommern",
      "amtsgericht": "Amtsgericht Stralsund",
      "registernummer": "HRB 974",
      "registerart": "HRB",
      "company_name": "\"Autohaus Burmeister GmbH\" Vertragshändler Renault",
      "company_seat": "Hohendorf",
      "former_amtsgericht": "Rostock",
      "details": "07.02.2025 (Bekanntmachungsdatum)\n\nMecklenburg-Vorpommern Amtsgericht Stralsund HRB 974 früher Amtsgericht Rostock\nLöschungsankündigung 07.02.2025 (Eintragungsdatum)\n\n\"Autohaus Burmeister GmbH\" Vertragshändler Renault\nGesellschaft mit beschränkter Haftung\nHohendorf\n\nDas Registergericht beabsichtigt, die im Handelsregister eingetragene Gesellschaft von Amts wegen nach § 394 FamFG zu löschen. Die Frist zur Erhebung eines Widerspruchs gegen die beabsichtigte Löschung wird auf 1 Monat festgesetzt."
    },
    {
      "date": "2025-02-07",
      "id": "100742",
      "original_text": "Löschungsankündigung\nBrandenburg Amtsgericht Cottbus HRB 13169\nDATIW UG (haftungsbeschränkt) – Cottbus",
      "type": "Löschungsankündigung",
      "state": "Brandenburg",
      "amtsgericht": "Amtsgericht Cottbus",
      "registernummer": "HRB 13169",
      "registerart": "HRB",
      "company_name": "DATIW UG (haftungsbeschränkt)",
      "company_seat": "Cottbus",
      "details": "07.02.2025 (Bekanntmachungsdatum)\n\nBrandenburg Amtsgericht Cottbus HRB 13169\nLöschungsankündigung\n\nDATIW UG (haftungsbeschränkt)\nGesellschaft mit beschränkter Haftung\nCottbus\n\nBei der nachstehenden Gesellschaft wird das Amtslöschungsverfahren gemäß § 394 FamFG eingeleitet."
    },
    {
      "date": "2025-02-07",
      "id": "100743",
      "original_text": "Löschungsankündigung\nBaden-Württemberg Amtsgericht Freiburg HRB 630714\nSeniorenhilfe Bad Säckingen GmbH – Bad Säckingen",
      "type": "Löschungsankündigung",
      "state": "Baden-Württemberg",
      "amtsgericht": "Amtsgericht Freiburg",
      "registernummer": "HRB 630714",
      "registerart": "HRB",
      "company_name": "Seniorenhilfe Bad Säckingen GmbH",
      "company_seat": "Bad Säckingen",
      "details": "07.02.2025 (Bekanntmachungsdatum)\n\nBaden-Württemberg Amtsgericht Freiburg HRB 630714\nLöschungsankündigung 07.02.2025 (Eintragungsdatum)\n\nSeniorenhilfe Bad Säckingen GmbH\nGesellschaft mit beschränkter Haftung\nBad Säckingen\n\nAls nicht eingetragen wird bekanntgemacht:\nDas Gericht beabsichtigt, die Gesellschaft wegen Vermögenslosigkeit im Handelsregister von Amts wegen nach § 394 FamFG zu löschen. Die Frist zur Geltendmachung eines Widerspruchs gegen die beabsichtigte Löschung ist auf einen Monat ab Veröffentlichung bestimmt."
    },
    {
      "date": "2025-02-07",
      "id": "100744",
      "original_text": "Einreichung neuer Dokumente\nBaden-Württemberg Amtsgericht Stuttgart HRB 754942\nValeo Holding GmbH – Bietigheim-Bissingen",
      "type": "Einreichung neuer Dokumente",
      "state": "Baden-Württemberg",
      "amtsgericht": "Amtsgericht Stuttgart",
      "registernummer": "HRB 754942",
      "registerart": "HRB",
      "company_name": "Valeo Holding GmbH",
      "company_seat": "Bietigheim-Bissingen",
      "details": "07.02.2025 (Bekanntmachungsdatum)\n\nBaden-Württemberg Amtsgericht Stuttgart HRB 754942\nEinreichung neuer Dokumente\n\nValeo Holding GmbH\nGesellschaft mit beschränkter Haftung\nBietigheim-Bissingen\n\nDie Gesellschaft hat am 06.02.2025 die Liste über die Zusammensetzung des Aufsichtsrats zum Handelsregister eingereicht."
    },
    {
      "date": "2025-02-07",
      "id": "100745",
      "original_text": "Registerbekanntmachung nach dem Umwandlungsgesetz\nBaden-Württemberg Amtsgericht Stuttgart HRA 742065\nUlrich Böhler GmbH & Co. KG – Sulzbach an der Murr",
      "type": "Registerbekanntmachung nach dem Umwandlungsgesetz",
      "state": "Baden-Württemberg",
      "amtsgericht": "Amtsgericht Stuttgart",
      "registernummer": "HRA 742065",
      "registerart": "HRA",
      "company_name": "Ulrich Böhler GmbH & Co. KG",
      "company_seat": "Sulzbach an der Murr",
      "details": "07.02.2025 (Bekanntmachungsdatum)\n\nBaden-Württemberg Amtsgericht Stuttgart HRA 742065\nRegisterbekanntmachung nach dem Umwandlungsgesetz 07.02.2025 (Eintragungsdatum)\n\nUlrich Böhler GmbH & Co. KG\nKommanditgesellschaft\nSulzbach an der Murr\n\nDen Gläubigern des an dem Formwechsel beteiligten Rechtsträgers ist, wenn sie binnen sechs Monaten nach dem Tag, an dem die Eintragung des Formwechsels in das Register des Sitzes desjenigen Rechtsträgers, dessen Gläubiger sie sind, nach § 19 Abs. 3 UmwG als bekanntgemacht gilt, ihren Anspruch nach Grund und Höhe schriftlich anmelden, Sicherheit zu leisten, soweit sie nicht Befriedigung verlangen können. Dieses Recht steht den Gläubigern jedoch nur zu, wenn sie glaubhaft machen, dass durch den Formwechsel die Erfüllung ihrer Forderung gefährdet wird."
    },
    {
      "date": "2025-02-07",
      "id": "100746",
      "original_text": "Registerbekanntmachung nach dem Umwandlungsgesetz\nBrandenburg Amtsgericht Cottbus HRB 18519\nH&V Service GmbH – Cottbus",
      "type": "Registerbekanntmachung nach dem Umwandlungsgesetz",
      "state": "Brandenburg",
      "amtsgericht": "Amtsgericht Cottbus",
      "registernummer": "HRB 18519",
      "registerart": "HRB",
      "company_name": "H&V Service GmbH",
      "company_seat": "Cottbus",
      "details": "07.02.2025 (Bekanntmachungsdatum)\n\nBrandenburg Amtsgericht Cottbus HRB 18519\nRegisterbekanntmachung nach dem Umwandlungsgesetz 06.02.2025 (Eintragungsdatum)\n\nH&V Service GmbH\nGesellschaft mit beschränkter Haftung\nCottbus\n\nDen Gläubigern der an der Umwandlung beteiligten Rechtsträger ist, wenn sie binnen sechs Monaten nach dem Tag, an dem die Eintragung der Umwandlung in das Register des Sitzes desjenigen Rechtsträgers, dessen Gläubiger sie sind, als bekannt gemacht gilt, ihren Anspruch nach Grund und Höhe schriftlich anmelden, Sicherheit zu leisten, soweit sie nicht Befriedigung verlangen können. Dieses Recht steht den Gläubigern jedoch nur zu, wenn sie glaubhaft machen, dass durch die Umwandlung die Erfüllung ihrer Forderung gefährdet wird."
    },
    {
      "date": "2025-02-07",
      "id": "100747",
      "original_text": "Registerbekanntmachung nach dem Umwandlungsgesetz\nBaden-Württemberg Amtsgericht Stuttgart HRB 724999\nMACH Finanzplus GmbH – Stuttgart",
      "type": "Registerbekanntmachung nach dem Umwandlungsgesetz",
      "state": "Baden-Württemberg",
      "amtsgericht": "Amtsgericht Stuttgart",
      "registernummer": "HRB 724999",
      "registerart": "HRB",
      "company_name": "MACH Finanzplus GmbH",
      "company_seat": "Stuttgart",
      "details": "07.02.2025 (Bekanntmachungsdatum)\n\nBaden-Württemberg Amtsgericht Stuttgart HRB 724999\nRegisterbekanntmachung nach dem Umwandlungsgesetz 07.02.2025 (Eintragungsdatum)\n\nMACH Finanzplus GmbH\nGesellschaft mit beschränkter Haftung\nStuttgart\n\nAls nicht eingetragen wird bekanntgemacht:\nDen Gläubigern der an der Verschmelzung beteiligten Rechtsträger ist, wenn sie binnen sechs Monaten nach dem Tag, an dem die Eintragung der Verschmelzung in das Register des Sitzes desjenigen Rechtsträgers, dessen Gläubiger sie sind, nach § 19 Abs. 3 UmwG als bekanntgemacht gilt, ihren Anspruch nach Grund und Höhe schriftlich anmelden, Sicherheit zu leisten, soweit sie nicht Befriedigung verlangen können. Dieses Recht steht den Gläubigern jedoch nur zu, wenn sie glaubhaft machen, dass durch die Verschmelzung die Erfüllung ihrer Forderung gefährdet wird."
    },
    {
      "date": "2025-02-07",
      "id": "100748",
      "original_text": "Registerbekanntmachung nach dem Umwandlungsgesetz\nBaden-Württemberg Amtsgericht Stuttgart HRB 270966\nUlrich Böhler GmbH Schlosserei und Blechbearbeitung – Sulzbach an der Murr",
      "type": "Registerbekanntmachung nach dem Umwandlungsgesetz",
      "state": "Baden-Württemberg",
      "amtsgericht": "Amtsgericht Stuttgart",
      "registernummer": "HRB 270966",
      "registerart": "HRB",
      "company_name": "Ulrich Böhler GmbH Schlosserei und Blechbearbeitung",
      "company_seat": "Sulzbach an der Murr",
      "details": "07.02.2025 (Bekanntmachungsdatum)\n\nBaden-Württemberg Amtsgericht Stuttgart HRB 270966\nRegisterbekanntmachung nach dem Umwandlungsgesetz 07.02.2025 (Eintragungsdatum)\n\nUlrich Böhler GmbH Schlosserei und Blechbearbeitung\nGesellschaft mit beschränkter Haftung\nSulzbach an der Murr\n\nDen Gläubigern des an dem Formwechsel beteiligten Rechtsträgers ist, wenn sie binnen sechs Monaten nach dem Tag, an dem die Eintragung des Formwechsels in das Register des Sitzes desjenigen Rechtsträgers, dessen Gläubiger sie sind, nach § 19 Abs. 3 UmwG als bekanntgemacht gilt, ihren Anspruch nach Grund und Höhe schriftlich anmelden, Sicherheit zu leisten, soweit sie nicht Befriedigung verlangen können. Dieses Recht steht den Gläubigern jedoch nur zu, wenn sie glaubhaft machen, dass durch den Formwechsel die Erfüllung ihrer Forderung gefährdet wird."
    },
    {
      "date": "2025-02-07",
      "id": "100749",
      "original_text": "Registerbekanntmachung nach dem Umwandlungsgesetz\nBrandenburg Amtsgericht Cottbus GnR 309\nH&V Service eG – Cottbus",
      "type": "Registerbekanntmachung nach dem Umwandlungsgesetz",
      "state": "Brandenburg",
      "amtsgericht": "Amtsgericht Cottbus",
      "registernummer": "GnR 309",
      "registerart": "GnR",
      "company_name": "H&V Service eG",
      "company_seat": "Cottbus",
      "details": "07.02.2025 (Bekanntmachungsdatum)\n\nBrandenburg Amtsgericht Cottbus GnR 309\nRegisterbekanntmachung nach dem Umwandlungsgesetz 06.02.2025 (Eintragungsdatum)\n\nH&V Service eG\neingetragene Genossenschaft\nCottbus\n\nDen Gläubigern der an der Umwandlung beteiligten Rechtsträger ist, wenn sie binnen sechs Monaten nach dem Tag, an dem die Eintragung der Umwandlung in das Register des Sitzes desjenigen Rechtsträgers, dessen Gläubiger sie sind, als bekannt gemacht gilt, ihren Anspruch nach Grund und Höhe schriftlich anmelden, Sicherheit zu leisten, soweit sie nicht Befriedigung verlangen können. Dieses Recht steht den Gläubigern jedoch nur zu, wenn sie glaubhaft machen, dass durch die Umwandlung die Erfüllung ihrer Forderung gefährdet wird."
    },
    {
      "date": "2025-02-07",
      "id": "100750",
      "original_text": "Einreichung neuer Dokumente\nBaden-Württemberg Amtsgericht Stuttgart HRB 22773\nIQUINOX AG – Stuttgart",
      "type": "Einreichung neuer Dokumente",
      "state": "Baden-Württemberg",
      "amtsgericht": "Amtsgericht Stuttgart",
      "registernummer": "HRB 22773",
      "registerart": "HRB",
      "company_name": "IQUINOX AG",
      "company_seat": "Stuttgart",
      "details": "07.02.2025 (Bekanntmachungsdatum)\n\nBaden-Württemberg Amtsgericht Stuttgart HRB 22773\nEinreichung neuer Dokumente 07.02.2025 (Eintragungsdatum)\n\nIQUINOX AG\nAktiengesellschaft\nStuttgart\n\nDie Gesellschaft hat am 11.12.2024 die Liste über die Zusammensetzung des Aufsichtsrats zum Handelsregister eingereicht."
    },
    {
      "date": "2025-02-07",
      "id": "100751",
      "original_text": "Löschungsankündigung\nBaden-Württemberg Amtsgericht Freiburg HRB 726246\nBeen & Seen GmbH – Weil am Rhein",
      "type": "Löschungsankündigung",
      "state": "Baden-Württemberg",
      "amtsgericht": "Amtsgericht Freiburg",
      "registernummer": "HRB 726246",
      "registerart": "HRB",
      "company_name": "Been & Seen GmbH",
      "company_seat": "Weil am Rhein",
      "details": "07.02.2025 (Bekanntmachungsdatum)\n\nBaden-Württemberg Amtsgericht Freiburg HRB 726246\nLöschungsankündigung 07.02.2025 (Eintragungsdatum)\n\nBeen & Seen GmbH\nGesellschaft mit beschränkter Haftung\nWeil am Rhein\n\nAls nicht eingetragen wird bekanntgemacht:\nDas Gericht beabsichtigt, die Gesellschaft wegen Vermögenslosigkeit im Handelsregister von Amts wegen nach § 394 FamFG zu löschen. Die Frist zur Geltendmachung eines Widerspruchs gegen die beabsichtigte Löschung ist auf einen Monat ab Veröffentlichung bestimmt."
    },
    {
      "date": "2025-02-07",
      "id": "100752",
      "original_text": "Registerbekanntmachung nach dem Umwandlungsgesetz\nBaden-Württemberg Amtsgericht Mannheim GsR 1417\nBechtold & Giugno eGbR – Bad Schönborn",
      "type": "Registerbekanntmachung nach dem Umwandlungsgesetz",
      "state": "Baden-Württemberg",
      "amtsgericht": "Amtsgericht Mannheim",
      "registernummer": "GsR 1417",
      "registerart": "GsR",
      "company_name": "Bechtold & Giugno eGbR",
      "company_seat": "Bad Schönborn",
      "details": "07.02.2025 (Bekanntmachungsdatum)\n\nBaden-Württemberg Amtsgericht Mannheim GsR 1417\nRegisterbekanntmachung nach dem Umwandlungsgesetz 07.02.2025 (Eintragungsdatum)\n\nBechtold & Giugno eGbR\nGesellschaft bürgerlichen Rechts\nBad Schönborn\n\nAls nicht eingetragen wird bekanntgemacht:\nDen Gläubigern des an dem Formwechsel beteiligten Rechtsträgers ist, wenn sie binnen sechs Monaten nach dem Tag, an dem die Eintragung des Formwechsels in das Register des Sitzes desjenigen Rechtsträgers, dessen Gläubiger sie sind, nach § 19 Abs. 3 UmwG als bekanntgemacht gilt, ihren Anspruch nach Grund und Höhe schriftlich anmelden, Sicherheit zu leisten, soweit sie nicht Befriedigung verlangen können. Dieses Recht steht den Gläubigern jedoch nur zu, wenn sie glaubhaft machen, dass durch den Formwechsel die Erfüllung ihrer Forderung gefährdet wird."
    },
    {
      "date": "2025-02-07",
      "id": "100753",
      "original_text": "Registerbekanntmachung nach dem Umwandlungsgesetz\nBaden-Württemberg Amtsgericht Mannheim HRB 726672\nBechtold Tankstellen GmbH – Waghäusel",
      "type": "Registerbekanntmachung nach dem Umwandlungsgesetz",
      "state": "Baden-Württemberg",
      "amtsgericht": "Amtsgericht Mannheim",
      "registernummer": "HRB 726672",
      "registerart": "HRB",
      "company_name": "Bechtold Tankstellen GmbH",
      "company_seat": "Waghäusel",
      "details": "07.02.2025 (Bekanntmachungsdatum)\n\nBaden-Württemberg Amtsgericht Mannheim HRB 726672\nRegisterbekanntmachung nach dem Umwandlungsgesetz 07.02.2025 (Eintragungsdatum)\n\nBechtold Tankstellen GmbH\nGesellschaft mit beschränkter Haftung\nWaghäusel\n\nAls nicht eingetragen wird bekanntgemacht:\nDen Gläubigern des an dem Formwechsel beteiligten Rechtsträgers ist, wenn sie binnen sechs Monaten nach dem Tag, an dem die Eintragung des Formwechsels in das Register des Sitzes desjenigen Rechtsträgers, dessen Gläubiger sie sind, nach § 19 Abs. 3 UmwG als bekanntgemacht gilt, ihren Anspruch nach Grund und Höhe schriftlich anmelden, Sicherheit zu leisten, soweit sie nicht Befriedigung verlangen können. Dieses Recht steht den Gläubigern jedoch nur zu, wenn sie glaubhaft machen, dass durch den Formwechsel die Erfüllung ihrer Forderung gefährdet wird."
    },
    {
      "date": "2025-02-07",
      "id": "100754",
      "original_text": "Sonstige Registerbekanntmachung\nHamburg Amtsgericht Hamburg HRB 83272\nCarlsberg Deutschland Logistik GmbH – Hamburg",
      "type": "Sonstige Registerbekanntmachung",
      "state": "Hamburg",
      "amtsgericht": "Amtsgericht Hamburg",
      "registernummer": "HRB 83272",
      "registerart": "HRB",
      "company_name": "Carlsberg Deutschland Logistik GmbH",
      "company_seat": "Hamburg",
      "details": "07.02.2025 (Bekanntmachungsdatum)\n\nHamburg Amtsgericht Hamburg HRB 83272\nSonstige Registerbekanntmachung\n\nCarlsberg Deutschland Logistik GmbH\nGesellschaft mit beschränkter Haftung\nHamburg\n\nAls nicht eingetragen wird bekannt gemacht: Liste des Aufsichtsrats wurde eingereicht."
    },
    {
      "date": "2025-02-07",
      "id": "100755",
      "original_text": "Registerbekanntmachung nach dem Umwandlungsgesetz\nSchleswig-Holstein Amtsgericht Lübeck HRB 10293\nMARINVENT GmbH – Dassendorf",
      "type": "Registerbekanntmachung nach dem Umwandlungsgesetz",
      "state": "Schleswig-Holstein",
      "amtsgericht": "Amtsgericht Lübeck",
      "registernummer": "HRB 10293",
      "registerart": "HRB",
      "company_name": "MARINVENT GmbH",
      "company_seat": "Dassendorf",
      "details": "07.02.2025 (Bekanntmachungsdatum)\n\nSchleswig-Holstein Amtsgericht Lübeck HRB 10293\nRegisterbekanntmachung nach dem Umwandlungsgesetz 06.02.2025 (Eintragungsdatum)\n\nMARINVENT GmbH\nGesellschaft mit beschränkter Haftung\nDassendorf\n\nZu Eintragungsnummer 2 vom 06.02.2025 wird als nicht eingetragen veröffentli Als nicht eingetragen wird veröffentlicht: Den Gläubigern der an der Verschmelzung beteiligten Rechtsträger ist, wenn sie binnen sechs Monaten nach dem Tag, an dem die Eintragung der Verschmelzung in das Register des Sitzes desjenigen Rechtsträgers, dessen Gläubiger sie sind, als bekannt gemacht gilt, ihren Anspruch nach Grund und Höhe schriftlich anmelden, Sicherheit zu leisten, soweit sie nicht Befriedigung verlangen können. Dieses Recht steht den Gläubigern jedoch nur zu, wenn sie glaubhaft machen, dass durch die Verschmelzung die Erfüllung ihrer Forderung gefährdet wird.cht:"
    },
    {
      "date": "2025-02-07",
      "id": "100756",
      "original_text": "Löschungsankündigung\nBrandenburg Amtsgericht Cottbus HRB 14054\nWhite Steel GmbH – Wildau",
      "type": "Löschungsankündigung",
      "state": "Brandenburg",
      "amtsgericht": "Amtsgericht Cottbus",
      "registernummer": "HRB 14054",
      "registerart": "HRB",
      "company_name": "White Steel GmbH",
      "company_seat": "Wildau",
      "details": "07.02.2025 (Bekanntmachungsdatum)\n\nBrandenburg Amtsgericht Cottbus HRB 14054\nLöschungsankündigung\n\nWhite Steel GmbH\nGesellschaft mit beschränkter Haftung\nWildau\n\nBei der nachstehenden Gesellschaft wird das Amtslöschungsverfahren gemäß § 394 FamFG eingeleitet."
    },
    {
      "date": "2025-02-07",
      "id": "100757",
      "original_text": "Registerbekanntmachung nach dem Umwandlungsgesetz\nSchleswig-Holstein Amtsgericht Lübeck HRB 792 SB\nCHEMTEC Consulting GmbH – Dassendorf",
      "type": "Registerbekanntmachung nach dem Umwandlungsgesetz",
      "state": "Schleswig-Holstein",
      "amtsgericht": "Amtsgericht Lübeck",
      "registernummer": "HRB 792 SB",
      "registerart": "HRB",
      "company_name": "CHEMTEC Consulting GmbH",
      "company_seat": "Dassendorf",
      "details": "07.02.2025 (Bekanntmachungsdatum)\n\nSchleswig-Holstein Amtsgericht Lübeck HRB 792 SB\nRegisterbekanntmachung nach dem Umwandlungsgesetz 06.02.2025 (Eintragungsdatum)\n\nCHEMTEC Consulting GmbH\nGesellschaft mit beschränkter Haftung\nDassendorf\n\nZu Eintragungsnummer 4 vom 06.02.2025 wird als nicht eingetragen veröffentlicht: Als nicht eingetragen wird veröffentlicht: Den Gläubigern der an der Verschmelzung beteiligten Rechtsträger ist, wenn sie binnen sechs Monaten nach dem Tag, an dem die Eintragung der Verschmelzung in das Register des Sitzes desjenigen Rechtsträgers, dessen Gläubiger sie sind, als bekannt gemacht gilt, ihren Anspruch nach Grund und Höhe schriftlich anmelden, Sicherheit zu leisten, soweit sie nicht Befriedigung verlangen können. Dieses Recht steht den Gläubigern jedoch nur zu, wenn sie glaubhaft machen, dass durch die Verschmelzung die Erfüllung ihrer Forderung gefährdet wird."
    },
    {
      "date": "2025-02-07",
      "id": "100758",
      "original_text": "Löschungsankündigung\nBaden-Württemberg Amtsgericht Mannheim HRB 704764\nHvS Immobilienmanagement GmbH – Baden-Baden",
      "type": "Löschungsankündigung",
      "state": "Baden-Württemberg",
      "amtsgericht": "Amtsgericht Mannheim",
      "registernummer": "HRB 704764",
      "registerart": "HRB",
      "company_name": "HvS Immobilienmanagement GmbH",
      "company_seat": "Baden-Baden",
      "details": "07.02.2025 (Bekanntmachungsdatum)\n\nBaden-Württemberg Amtsgericht Mannheim HRB 704764\nLöschungsankündigung\n\nHvS Immobilienmanagement GmbH\nGesellschaft mit beschränkter Haftung\nBaden-Baden\n\nDas Gericht beabsichtigt, die Gesellschaft wegen Vermögenslosigkeit im Handelsregister von Amts wegen nach § 394 FamFG zu löschen. Die Frist zur Geltendmachung eines Widerspruchs gegen die beabsichtigte Löschung ist auf einen Monat ab Veröffentlichung bestimmt."
    },
    {
      "date": "2025-02-07",
      "id": "100759",
      "original_text": "Registerbekanntmachung nach dem Umwandlungsgesetz\nBaden-Württemberg Amtsgericht Stuttgart HRB 763242\nStudio Werner Sobek GmbH – Stuttgart",
      "type": "Registerbekanntmachung nach dem Umwandlungsgesetz",
      "state": "Baden-Württemberg",
      "amtsgericht": "Amtsgericht Stuttgart",
      "registernummer": "HRB 763242",
      "registerart": "HRB",
      "company_name": "Studio Werner Sobek GmbH",
      "company_seat": "Stuttgart",
      "details": "07.02.2025 (Bekanntmachungsdatum)\n\nBaden-Württemberg Amtsgericht Stuttgart HRB 763242\nRegisterbekanntmachung nach dem Umwandlungsgesetz 07.02.2025 (Eintragungsdatum)\n\nStudio Werner Sobek GmbH\nGesellschaft mit beschränkter Haftung\nStuttgart\n\nAls nicht eingetragen wird bekanntgemacht: Den Gläubigern der an der Verschmelzung beteiligten Rechtsträger ist, wenn sie binnen sechs Monaten nach dem Tag, an dem die Eintragung der Verschmelzung in das Register des Sitzes desjenigen Rechtsträgers, dessen Gläubiger sie sind, nach § 19 Abs. 3 UmwG als bekanntgemacht gilt, ihren Anspruch nach Grund und Höhe schriftlich anmelden, Sicherheit zu leisten, soweit sie nicht Befriedigung verlangen können. Dieses Recht steht den Gläubigern jedoch nur zu, wenn sie glaubhaft machen, dass durch die Verschmelzung die Erfüllung ihrer Forderung gefährdet wird."
    },
    {
      "date": "2025-02-07",
      "id": "100760",
      "original_text": "Registerbekanntmachung nach dem Umwandlungsgesetz\nThüringen Amtsgericht Jena HRB 515036\nHK Versicherungsmakler GmbH – Erfurt",
      "type": "Registerbekanntmachung nach dem Umwandlungsgesetz",
      "state": "Thüringen",
      "amtsgericht": "Amtsgericht Jena",
      "registernummer": "HRB 515036",
      "registerart": "HRB",
      "company_name": "HK Versicherungsmakler GmbH",
      "company_seat": "Erfurt",
      "details": "07.02.2025 (Bekanntmachungsdatum)\n\nThüringen Amtsgericht Jena HRB 515036\nRegisterbekanntmachung nach dem Umwandlungsgesetz 07.02.2025 (Eintragungsdatum)\n\nHK Versicherungsmakler GmbH\nGesellschaft mit beschränkter Haftung\nErfurt\n\nNicht eingetragen: Den Gläubigern der an der Verschmelzung beteiligten Rechtsträger, ist wenn sie binnen sechs Monaten nach dem Tag, an dem die Eintragung der Verschmelzung in das Register des Sitzes desjenigen Rechtsträgers, dessen Gläubiger sie sind,  nach § 19 Abs. 3 UmwG als bekanntgemacht gilt, ihren Anspruch nach Grund und Höhe schriftlich anmelden, Sicherheit zu leisten, soweit sie nicht Befriedigung verlangen können. Dieses Recht steht ihnen jedoch nur zu, wenn sie glaubhaft machen, daß durch die Verschmelzung die Erfüllung ihrer Forderung gefährdet wird."
    },
    {
      "date": "2025-02-07",
      "id": "100761",
      "original_text": "Registerbekanntmachung nach dem Umwandlungsgesetz\nBaden-Württemberg Amtsgericht Mannheim HRB 753519\nasknet GmbH – Karlsruhe",
      "type": "Registerbekanntmachung nach dem Umwandlungsgesetz",
      "state": "Baden-Württemberg",
      "amtsgericht": "Amtsgericht Mannheim",
      "registernummer": "HRB 753519",
      "registerart": "HRB",
      "company_name": "asknet GmbH",
      "company_seat": "Karlsruhe",
      "details": "07.02.2025 (Bekanntmachungsdatum)\n\nBaden-Württemberg Amtsgericht Mannheim HRB 753519\nRegisterbekanntmachung nach dem Umwandlungsgesetz 07.02.2025 (Eintragungsdatum)\n\nasknet GmbH\nGesellschaft mit beschränkter Haftung\nKarlsruhe\n\nAls nicht eingetragen wird bekanntgemacht:\nDen Gläubigern des an dem Formwechsel beteiligten Rechtsträgers ist, wenn sie binnen sechs Monaten nach dem Tag, an dem die Eintragung des Formwechsels in das Register des Sitzes desjenigen Rechtsträgers, dessen Gläubiger sie sind, nach § 19 Abs. 3 UmwG als bekanntgemacht gilt, ihren Anspruch nach Grund und Höhe schriftlich anmelden, Sicherheit zu leisten, soweit sie nicht Befriedigung verlangen können. Dieses Recht steht den Gläubigern jedoch nur zu, wenn sie glaubhaft machen, dass durch den Formwechsel die Erfüllung ihrer Forderung gefährdet wird."
    },
    {
      "date": "2025-02-07",
      "id": "100762",
      "original_text": "Registerbekanntmachung nach dem Umwandlungsgesetz\nBrandenburg Amtsgericht Potsdam GnR 498\nSONN'IDYLL Retreats eG – Rathenow",
      "type": "Registerbekanntmachung nach dem Umwandlungsgesetz",
      "state": "Brandenburg",
      "amtsgericht": "Amtsgericht Potsdam",
      "registernummer": "GnR 498",
      "registerart": "GnR",
      "company_name": "SONN'IDYLL Retreats eG",
      "company_seat": "Rathenow",
      "details": "07.02.2025 (Bekanntmachungsdatum)\n\nBrandenburg Amtsgericht Potsdam GnR 498\nRegisterbekanntmachung nach dem Umwandlungsgesetz 07.02.2025 (Eintragungsdatum)\n\nSONN'IDYLL Retreats eG\neingetragene Genossenschaft\nRathenow\n\nZu Eintragungsnummer 2 vom 07.02.2025 wird als nicht eingetragen veröffentlicht:Als nicht eingetragen wird veröffentlicht:\nDen Gläubigern der an der Spaltung beteiligten Rechtsträger ist, wenn sie binnen sechs Monaten nach dem Tag, an dem die Eintragung der Spaltung in das Register des Sitzes desjenigen Rechtsträgers, dessen Gläubiger sie sind, als bekannt gemacht gilt, ihren Anspruch nach Grund und Höhe schriftlich anmelden, Sicherheit zu leisten, soweit sie nicht Befriedigung verlangen können. Dieses Recht steht den Gläubigern jedoch nur zu, wenn sie glaubhaft machen, dass durch die Spaltung die Erfüllung ihrer Forderung gefährdet wird"
    },
    {
      "date": "2025-02-07",
      "id": "100763",
      "original_text": "Registerbekanntmachung nach dem Umwandlungsgesetz\nBaden-Württemberg Amtsgericht Mannheim HRB 108713\nasknet Solutions AG – Karlsruhe",
      "type": "Registerbekanntmachung nach dem Umwandlungsgesetz",
      "state": "Baden-Württemberg",
      "amtsgericht": "Amtsgericht Mannheim",
      "registernummer": "HRB 108713",
      "registerart": "HRB",
      "company_name": "asknet Solutions AG",
      "company_seat": "Karlsruhe",
      "details": "07.02.2025 (Bekanntmachungsdatum)\n\nBaden-Württemberg Amtsgericht Mannheim HRB 108713\nRegisterbekanntmachung nach dem Umwandlungsgesetz 07.02.2025 (Eintragungsdatum)\n\nasknet Solutions AG\nAktiengesellschaft\nKarlsruhe\n\nAls nicht eingetragen wird bekanntgemacht:\nDen Gläubigern des an dem Formwechsel beteiligten Rechtsträgers ist, wenn sie binnen sechs Monaten nach dem Tag, an dem die Eintragung des Formwechsels in das Register des Sitzes desjenigen Rechtsträgers, dessen Gläubiger sie sind, nach § 19 Abs. 3 UmwG als bekanntgemacht gilt, ihren Anspruch nach Grund und Höhe schriftlich anmelden, Sicherheit zu leisten, soweit sie nicht Befriedigung verlangen können. Dieses Recht steht den Gläubigern jedoch nur zu, wenn sie glaubhaft machen, dass durch den Formwechsel die Erfüllung ihrer Forderung gefährdet wird."
    },
    {
      "date": "2025-02-07",
      "id": "100764",
      "original_text": "Sonstige Registerbekanntmachung\nSachsen-Anhalt Amtsgericht Stendal HRB 30732\nECOBAT Solutions Europe GmbH – Hettstedt",
      "type": "Sonstige Registerbekanntmachung",
      "state": "Sachsen-Anhalt",
      "amtsgericht": "Amtsgericht Stendal",
      "registernummer": "HRB 30732",
      "registerart": "HRB",
      "company_name": "ECOBAT Solutions Europe GmbH",
      "company_seat": "Hettstedt",
      "details": "07.02.2025 (Bekanntmachungsdatum)\n\nSachsen-Anhalt Amtsgericht Stendal HRB 30732\nSonstige Registerbekanntmachung 07.02.2025 (Eintragungsdatum)\n\nECOBAT Solutions Europe GmbH\nGesellschaft mit beschränkter Haftung\nHettstedt\n\nNicht eingetragen:\nAls nicht eingetragen wird veröffentlicht: Den Gläubigern der Gesellschaft, deren Forderungen begründet worden sind bevor die Eintragung der Beendigung des #DV.Art(Text=\"Art des Vertrages auswählen\",Eingabe=\"Beherrschungs- und Gewinnabführungsvertrages\",\"Beherrschungsvertrages\",\"Gewinnabführungsvertrages\",\"Teilgewinnabführungsvertrages\")  in das Handelsregister nach § 10 des Handelsgesetzbuches als bekanntgemacht gilt, hat der andere Vertragsteil Sicherheit zu leisten, wenn sie sich binnen sechs Monaten nach der Bekanntmachung der Eintragung zu diesem Zweck bei ihm melden."
    },
    {
      "date": "2025-02-07",
      "id": "100765",
      "original_text": "Einreichung neuer Dokumente\nSchleswig-Holstein Amtsgericht Lübeck HRB 7883\nVersorgungsBetriebe Elbe GmbH – Lauenburg",
      "type": "Einreichung neuer Dokumente",
      "state": "Schleswig-Holstein",
      "amtsgericht": "Amtsgericht Lübeck",
      "registernummer": "HRB 7883",
      "registerart": "HRB",
      "company_name": "VersorgungsBetriebe Elbe GmbH",
      "company_seat": "Lauenburg",
      "details": "07.02.2025 (Bekanntmachungsdatum)\n\nSchleswig-Holstein Amtsgericht Lübeck HRB 7883\nEinreichung neuer Dokumente\n\nVersorgungsBetriebe Elbe GmbH\nGesellschaft mit beschränkter Haftung\nLauenburg\n\nAls nicht eingetragen wird veröffentlicht: Die Gesellschaft hat eine aktuelle Liste der Aufsichtsratsmitglieder zum Handelsregister eingereicht."
    },
    {
      "date": "2025-02-07",
      "id": "100766",
      "original_text": "Registerbekanntmachung nach dem Umwandlungsgesetz\nBrandenburg Amtsgericht Potsdam HRA 8030\nSONN´IDYLL Schönberg e.K. – Rathenow",
      "type": "Registerbekanntmachung nach dem Umwandlungsgesetz",
      "state": "Brandenburg",
      "amtsgericht": "Amtsgericht Potsdam",
      "registernummer": "HRA 8030",
      "registerart": "HRA",
      "company_name": "SONN´IDYLL Schönberg e.K.",
      "company_seat": "Rathenow",
      "details": "07.02.2025 (Bekanntmachungsdatum)\n\nBrandenburg Amtsgericht Potsdam HRA 8030\nRegisterbekanntmachung nach dem Umwandlungsgesetz 07.02.2025 (Eintragungsdatum)\n\nSONN´IDYLL Schönberg e.K.\nEinzelkaufmann / Einzelkauffrau\nRathenow\n\nZu Eintragungsnummer 2 vom 07.02.2025 wird als nicht eingetragen veröffentlicht:\nDen Gläubigern der an der Spaltung beteiligten Rechtsträger ist, wenn sie binnen sechs Monaten nach dem Tag, an dem die Eintragung der Spaltung in das Register des Sitzes desjenigen Rechtsträgers, dessen Gläubiger sie sind, als bekannt gemacht gilt, ihren Anspruch nach Grund und Höhe schriftlich anmelden, Sicherheit zu leisten, soweit sie nicht Befriedigung verlangen können. Dieses Recht steht den Gläubigern jedoch nur zu, wenn sie glaubhaft machen, dass durch die Spaltung die Erfüllung ihrer Forderung gefährdet wird"
    },
    {
      "date": "2025-02-07",
      "id": "100767",
      "original_text": "Einreichung neuer Dokumente\nBaden-Württemberg Amtsgericht Stuttgart HRB 731152\nTK Aufzüge GmbH – Neuhausen auf den Fildern",
      "type": "Einreichung neuer Dokumente",
      "state": "Baden-Württemberg",
      "amtsgericht": "Amtsgericht Stuttgart",
      "registernummer": "HRB 731152",
      "registerart": "HRB",
      "company_name": "TK Aufzüge GmbH",
      "company_seat": "Neuhausen auf den Fildern",
      "details": "07.02.2025 (Bekanntmachungsdatum)\n\nBaden-Württemberg Amtsgericht Stuttgart HRB 731152\nEinreichung neuer Dokumente\n\nTK Aufzüge GmbH\nGesellschaft mit beschränkter Haftung\nNeuhausen auf den Fildern\n\nDie Gesellschaft hat am 31.01.2025 die Liste über die Zusammensetzung des Aufsichtsrats zum Handelsregister eingereicht."
    },
    {
      "date": "2025-02-07",
      "id": "100768",
      "original_text": "Registerbekanntmachung nach dem Umwandlungsgesetz\nHamburg Amtsgericht Hamburg HRB 137295\nHamburg Estate 4. Beteiligungsgesellschaft mbH – Hamburg",
      "type": "Registerbekanntmachung nach dem Umwandlungsgesetz",
      "state": "Hamburg",
      "amtsgericht": "Amtsgericht Hamburg",
      "registernummer": "HRB 137295",
      "registerart": "HRB",
      "company_name": "Hamburg Estate 4. Beteiligungsgesellschaft mbH",
      "company_seat": "Hamburg",
      "details": "07.02.2025 (Bekanntmachungsdatum)\n\nHamburg Amtsgericht Hamburg HRB 137295\nRegisterbekanntmachung nach dem Umwandlungsgesetz 07.02.2025 (Eintragungsdatum)\n\nHamburg Estate 4. Beteiligungsgesellschaft mbH\nGesellschaft mit beschränkter Haftung\nHamburg\n\nAls nicht eingetragen wird bekannt gemacht:\nDen Gläubigern der an der Verschmelzung beteiligten Gesellschaften ist, wenn sie binnen sechs Monaten nach dem Tag, an dem die Eintragung der Verschmelzung in das Register des Sitzes desjenigen Rechtsträgers, dessen Gläubiger sie sind, nach § 19 Absatz 3 UmwG als bekannt gemacht gilt, ihren Anspruch nach Grund und Höhe schriftlich anmelden, Sicherheit zu leisten, soweit sie nicht Befriedigung verlangen können. Dieses Recht steht den Gläubigern jedoch nur zu, wenn sie glaubhaft machen, dass durch die Verschmelzung die Erfüllung ihrer Forderung gefährdet wird."
    },
    {
      "date": "2025-02-07",
      "id": "100769",
      "original_text": "Registerbekanntmachung nach dem Umwandlungsgesetz\nHamburg Amtsgericht Hamburg HRB 149040\nHamburg Estate 5. Beteiligungsgesellschaft mbH – Hamburg",
      "type": "Registerbekanntmachung nach dem Umwandlungsgesetz",
      "state": "Hamburg",
      "amtsgericht": "Amtsgericht Hamburg",
      "registernummer": "HRB 149040",
      "registerart": "HRB",
      "company_name": "Hamburg Estate 5. Beteiligungsgesellschaft mbH",
      "company_seat": "Hamburg",
      "details": "07.02.2025 (Bekanntmachungsdatum)\n\nHamburg Amtsgericht Hamburg HRB 149040\nRegisterbekanntmachung nach dem Umwandlungsgesetz 07.02.2025 (Eintragungsdatum)\n\nHamburg Estate 5. Beteiligungsgesellschaft mbH\nGesellschaft mit beschränkter Haftung\nHamburg\n\nAls nicht eingetragen wird bekannt gemacht:\nDen Gläubigern der an der Verschmelzung beteiligten Gesellschaften ist, wenn sie binnen sechs Monaten nach dem Tag, an dem die Eintragung der Verschmelzung in das Register des Sitzes desjenigen Rechtsträgers, dessen Gläubiger sie sind, nach § 19 Absatz 3 UmwG als bekannt gemacht gilt, ihren Anspruch nach Grund und Höhe schriftlich anmelden, Sicherheit zu leisten, soweit sie nicht Befriedigung verlangen können. Dieses Recht steht den Gläubigern jedoch nur zu, wenn sie glaubhaft machen, dass durch die Verschmelzung die Erfüllung ihrer Forderung gefährdet wird."
    },
    {
      "date": "2025-02-07",
      "id": "100770",
      "original_text": "Einreichung neuer Dokumente\nMecklenburg-Vorpommern Amtsgericht Stralsund HRB 21688\nCheplapharm SE – Greifswald",
      "type": "Einreichung neuer Dokumente",
      "state": "Mecklenburg-Vorpommern",
      "amtsgericht": "Amtsgericht Stralsund",
      "registernummer": "HRB 21688",
      "registerart": "HRB",
      "company_name": "Cheplapharm SE",
      "company_seat": "Greifswald",
      "details": "07.02.2025 (Bekanntmachungsdatum)\n\nMecklenburg-Vorpommern Amtsgericht Stralsund HRB 21688\nEinreichung neuer Dokumente\n\nCheplapharm SE\nEuropäische Aktiengesellschaft (SE)\nGreifswald"
    },
    {
      "date": "2025-02-07",
      "id": "100771",
      "original_text": "Einreichung neuer Dokumente\nMecklenburg-Vorpommern Amtsgericht Stralsund HRB 308 früher Amtsgericht Rostock\nStralsunder Wohnungsbaugesellschaft mbH – Stralsund",
      "type": "Einreichung neuer Dokumente",
      "state": "Mecklenburg-Vorpommern",
      "amtsgericht": "Amtsgericht Stralsund",
      "registernummer": "HRB 308",
      "registerart": "HRB",
      "company_name": "Stralsunder Wohnungsbaugesellschaft mbH",
      "company_seat": "Stralsund",
      "former_amtsgericht": "Rostock",
      "details": "07.02.2025 (Bekanntmachungsdatum)\n\nMecklenburg-Vorpommern Amtsgericht Stralsund HRB 308 früher Amtsgericht Rostock\nEinreichung neuer Dokumente\n\nStralsunder Wohnungsbaugesellschaft mbH\nGesellschaft mit beschränkter Haftung\nStralsund"
    },
    {
      "date": "2025-02-07",
      "id": "100772",
      "original_text": "Löschungsankündigung\nBerlin Amtsgericht Berlin (Charlottenburg) HRB 177680\nKasem Unternehmen GmbH – Berlin",
      "type": "Löschungsankündigung",
      "state": "Berlin",
      "amtsgericht": "Amtsgericht Berlin (Charlottenburg)",
      "registernummer": "HRB 177680",
      "registerart": "HRB",
      "company_name": "Kasem Unternehmen GmbH",
      "company_seat": "Berlin",
      "details": "07.02.2025 (Bekanntmachungsdatum)\n\nBerlin Amtsgericht Berlin (Charlottenburg) HRB 177680\nLöschungsankündigung\n\nKasem Unternehmen GmbH\nGesellschaft mit beschränkter Haftung\nBerlin\n\nBei der nachstehenden Gesellschaft wird das Amtslöschungsverfahren gemäß § 394 FamFG eingeleitet. Widerspruchsfrist 6 Wochen"
    },
    {
      "date": "2025-02-07",
      "id": "100773",
      "original_text": "Registerbekanntmachung nach dem Umwandlungsgesetz\nBerlin Amtsgericht Berlin (Charlottenburg) HRB 271415\nRaisin AG – Berlin",
      "type": "Registerbekanntmachung nach dem Umwandlungsgesetz",
      "state": "Berlin",
      "amtsgericht": "Amtsgericht Berlin (Charlottenburg)",
      "registernummer": "HRB 271415",
      "registerart": "HRB",
      "company_name": "Raisin AG",
      "company_seat": "Berlin",
      "details": "07.02.2025 (Bekanntmachungsdatum)\n\nBerlin Amtsgericht Berlin (Charlottenburg) HRB 271415\nRegisterbekanntmachung nach dem Umwandlungsgesetz 31.01.2025 (Eintragungsdatum)\n\nRaisin AG\nAktiengesellschaft\nBerlin\n\nZu Eintragungsnummer 2 vom 31.01.2025 wird als nicht eingetragen veröffentlicht: Den Gläubigern ist, wenn sie binnen sechs Monaten nach dem Tag, an dem die Eintragung der Umwandlung als bekannt gemacht gilt, ihren Anspruch nach Grund und Höhe schriftlich anmelden, Sicherheit zu leisten, soweit sie nicht Befriedigung verlangen können. Dieses Recht steht den Gläubigern jedoch nur zu, wenn sie glaubhaft machen, dass durch die Umwandlung die Erfüllung ihrer Forderung gefährdet wird. Das Recht, Sicherheitsleistung zu verlangen, steht Gläubigern nicht zu, die im Falle der Insolvenz ein Recht auf vorzugsweise Befriedigung aus einer Deckungsmasse haben, die nach gesetzlicher Vorschrift zu ihrem Schutz errichtet und staatlich überwacht ist."
    },
    {
      "date": "2025-02-07",
      "id": "100774",
      "original_text": "Löschungsankündigung\nSachsen Amtsgericht Chemnitz HRB 20819\nappcos GmbH – Niederwürschnitz",
      "type": "Löschungsankündigung",
      "state": "Sachsen",
      "amtsgericht": "Amtsgericht Chemnitz",
      "registernummer": "HRB 20819",
      "registerart": "HRB",
      "company_name": "appcos GmbH",
      "company_seat": "Niederwürschnitz",
      "details": "07.02.2025 (Bekanntmachungsdatum)\n\nSachsen Amtsgericht Chemnitz HRB 20819\nLöschungsankündigung\n\nappcos GmbH\nGesellschaft mit beschränkter Haftung\nNiederwürschnitz\n\nDas Registergericht beabsichtigt, die im Handelsregister eingetragene Gesellschaft von Amts wegen nach § 394 FamFG zu löschen. Die Frist zu Erhebung eines Widerspruchs gegen die beabsichtigte Löschung wird auf einen Monat festgesetzt."
    },
    {
      "date": "2025-02-07",
      "id": "100775",
      "original_text": "Löschungsankündigung\nSachsen Amtsgericht Leipzig HRB 15074\nWal-Service GmbH – Leipzig",
      "type": "Löschungsankündigung",
      "state": "Sachsen",
      "amtsgericht": "Amtsgericht Leipzig",
      "registernummer": "HRB 15074",
      "registerart": "HRB",
      "company_name": "Wal-Service GmbH",
      "company_seat": "Leipzig",
      "details": "07.02.2025 (Bekanntmachungsdatum)\n\nSachsen Amtsgericht Leipzig HRB 15074\nLöschungsankündigung\n\nWal-Service GmbH\nGesellschaft mit beschränkter Haftung\nLeipzig\n\nDas Registergericht beabsichtigt, die im Handelsregister eingetragene Gesellschaft von Amts wegen nach § 394 FamFG zu löschen. Die Frist zu Erhebung eines Widerspruchs gegen die beabsichtigte Löschung wird auf einen Monat festgesetzt."
    },
    {
      "date": "2025-02-07",
      "id": "100776",
      "original_text": "Löschungsankündigung\nNiedersachsen Amtsgericht Hildesheim HRB 205996\nBerse Consulting GmbH – Lehrte",
      "type": "Löschungsankündigung",
      "state": "Niedersachsen",
      "amtsgericht": "Amtsgericht Hildesheim",
      "registernummer": "HRB 205996",
      "registerart": "HRB",
      "company_name": "Berse Consulting GmbH",
      "company_seat": "Lehrte",
      "details": "07.02.2025 (Bekanntmachungsdatum)\n\nNiedersachsen Amtsgericht Hildesheim HRB 205996\nLöschungsankündigung 07.02.2025 (Eintragungsdatum)\n\nBerse Consulting GmbH\nGesellschaft mit beschränkter Haftung\nLehrte\n\nDas Registergericht beabsichtigt, die Gesellschaft von Amts wegen nach § 394 FamFG zu löschen. Die Frist zur Erhebung eines Widerspruchs ist auf 1 Monat ab dieser Registerbekanntmachung festgesetzt."
    },
    {
      "date": "2025-02-07",
      "id": "100777",
      "original_text": "Registerbekanntmachung nach dem Umwandlungsgesetz\nNiedersachsen Amtsgericht Hildesheim VR 201003\nDeutsches Rotes Kreuz Ortsverein Giesen e.V. – Giesen",
      "type": "Registerbekanntmachung nach dem Umwandlungsgesetz",
      "state": "Niedersachsen",
      "amtsgericht": "Amtsgericht Hildesheim",
      "registernummer": "VR 201003",
      "registerart": "VR",
      "company_name": "Deutsches Rotes Kreuz Ortsverein Giesen e.V.",
      "company_seat": "Giesen",
      "details": "07.02.2025 (Bekanntmachungsdatum)\n\nNiedersachsen Amtsgericht Hildesheim VR 201003\nRegisterbekanntmachung nach dem Umwandlungsgesetz 07.02.2025 (Eintragungsdatum)\n\nDeutsches Rotes Kreuz Ortsverein Giesen e.V.\neingetragener Verein\nGiesen\n\nDen Gläubigern der an der Verschmelzung beteiligten Rechtsträger ist, wenn sie binnen sechs Monaten nach dem Tag, an dem die Eintragung der Verschmelzung in das Register des Sitzes desjenigen Rechtsträgers, dessen Gläubiger sie sind, nach § 19  Abs.  3 UmwG als bekannt gemacht gilt, ihren Anspruch nach Grund und Höhe schriftlich anmelden, Sicherheit zu leisten, soweit sie nicht Befriedigung verlangen können. Dieses Recht steht den Gläubigern jedoch nur zu, wenn sie glaubhaft machen, dass durch die Verschmelzung die Erfüllung der Forderung gefährdet wird."
    },
    {
      "date": "2025-02-07",
      "id": "100778",
      "original_text": "Löschungsankündigung\nNiedersachsen Amtsgericht Osnabrück HRB 217900\nGenio Management und Verwaltung GmbH – Uelsen",
      "type": "Löschungsankündigung",
      "state": "Niedersachsen",
      "amtsgericht": "Amtsgericht Osnabrück",
      "registernummer": "HRB 217900",
      "registerart": "HRB",
      "company_name": "Genio Management und Verwaltung GmbH",
      "company_seat": "Uelsen",
      "details": "07.02.2025 (Bekanntmachungsdatum)\n\nNiedersachsen Amtsgericht Osnabrück HRB 217900\nLöschungsankündigung\n\nGenio Management und Verwaltung GmbH\nGesellschaft mit beschränkter Haftung\nUelsen\n\nDas Registergericht beabsichtigt, die Gesellschaft von Amts wegen nach § 394 FamFG wegen Vermögenslosigkeit zu löschen. Die Frist zur Erhebung eines Widerspruchs ist auf 1 Monat ab dieser Registerbekanntmachung festgesetzt."
    },
    {
      "date": "2025-02-07",
      "id": "100779",
      "original_text": "Registerbekanntmachung nach dem Umwandlungsgesetz\nNiedersachsen Amtsgericht Hildesheim VR 1328\nDeutsches Rotes Kreuz, Ortsverein Sarstedt – Sarstedt",
      "type": "Registerbekanntmachung nach dem Umwandlungsgesetz",
      "state": "Niedersachsen",
      "amtsgericht": "Amtsgericht Hildesheim",
      "registernummer": "VR 1328",
      "registerart": "VR",
      "company_name": "Deutsches Rotes Kreuz, Ortsverein Sarstedt",
      "company_seat": "Sarstedt",
      "details": "07.02.2025 (Bekanntmachungsdatum)\n\nNiedersachsen Amtsgericht Hildesheim VR 1328\nRegisterbekanntmachung nach dem Umwandlungsgesetz 07.02.2025 (Eintragungsdatum)\n\nDeutsches Rotes Kreuz, Ortsverein Sarstedt\neingetragener Verein\nSarstedt\n\nDen Gläubigern der an der Verschmelzung beteiligten Rechtsträger ist, wenn sie binnen sechs Monaten nach dem Tag, an dem die Eintragung der Verschmelzung in das Register des Sitzes desjenigen Rechtsträgers, dessen Gläubiger sie sind, nach § 19  Abs.  3 UmwG als bekannt gemacht gilt, ihren Anspruch nach Grund und Höhe schriftlich anmelden, Sicherheit zu leisten, soweit sie nicht Befriedigung verlangen können. Dieses Recht steht den Gläubigern jedoch nur zu, wenn sie glaubhaft machen, dass durch die Verschmelzung die Erfüllung der Forderung gefährdet wird."
    },
    {
      "date": "2025-02-07",
      "id": "100780",
      "original_text": "Einreichung neuer Dokumente\nNiedersachsen Amtsgericht Oldenburg (Oldenburg) HRB 206561\nGastransport Nord GmbH – Oldenburg",
      "type": "Einreichung neuer Dokumente",
      "state": "Niedersachsen",
      "amtsgericht": "Amtsgericht Oldenburg (Oldenburg)",
      "registernummer": "HRB 206561",
      "registerart": "HRB",
      "company_name": "Gastransport Nord GmbH",
      "company_seat": "Oldenburg",
      "details": "07.02.2025 (Bekanntmachungsdatum)\n\nNiedersachsen Amtsgericht Oldenburg (Oldenburg) HRB 206561\nEinreichung neuer Dokumente\n\nGastransport Nord GmbH\nGesellschaft mit beschränkter Haftung\nOldenburg\n\nDie Liste der Mitglieder des Aufsichtsrats wurde beim Registergericht eingereicht."
    },
    {
      "date": "2025-02-07",
      "id": "100781",
      "original_text": "Löschungsankündigung\nNiedersachsen Amtsgericht Braunschweig HRB 211807\nKJ Holding GmbH – Braunschweig",
      "type": "Löschungsankündigung",
      "state": "Niedersachsen",
      "amtsgericht": "Amtsgericht Braunschweig",
      "registernummer": "HRB 211807",
      "registerart": "HRB",
      "company_name": "KJ Holding GmbH",
      "company_seat": "Braunschweig",
      "details": "07.02.2025 (Bekanntmachungsdatum)\n\nNiedersachsen Amtsgericht Braunschweig HRB 211807\nLöschungsankündigung\n\nKJ Holding GmbH\nGesellschaft mit beschränkter Haftung\nBraunschweig\n\nDas Registergericht beabsichtigt, die Eintragung des Geschäftsführers Herrn Jonas Krake von Amts wegen nach § 395 FamFG zu löschen. Die Frist zur Erhebung eines Widerspruchs ist auf 1 Monat ab dieser Registerbekanntmachung festgesetzt."
    },
    {
      "date": "2025-02-07",
      "id": "100782",
      "original_text": "Registerbekanntmachung nach dem Umwandlungsgesetz\nNiedersachsen Amtsgericht Hildesheim VR 201184\nDeutsches Rotes Kreuz Ortsverein Barnten e.V. – Barnten",
      "type": "Registerbekanntmachung nach dem Umwandlungsgesetz",
      "state": "Niedersachsen",
      "amtsgericht": "Amtsgericht Hildesheim",
      "registernummer": "VR 201184",
      "registerart": "VR",
      "company_name": "Deutsches Rotes Kreuz Ortsverein Barnten e.V.",
      "company_seat": "Barnten",
      "details": "07.02.2025 (Bekanntmachungsdatum)\n\nNiedersachsen Amtsgericht Hildesheim VR 201184\nRegisterbekanntmachung nach dem Umwandlungsgesetz 07.02.2025 (Eintragungsdatum)\n\nDeutsches Rotes Kreuz Ortsverein Barnten e.V.\neingetragener Verein\nBarnten\n\nDen Gläubigern der an der Verschmelzung beteiligten Rechtsträger ist, wenn sie binnen sechs Monaten nach dem Tag, an dem die Eintragung der Verschmelzung in das Register des Sitzes desjenigen Rechtsträgers, dessen Gläubiger sie sind, nach § 19  Abs.  3 UmwG als bekannt gemacht gilt, ihren Anspruch nach Grund und Höhe schriftlich anmelden, Sicherheit zu leisten, soweit sie nicht Befriedigung verlangen können. Dieses Recht steht den Gläubigern jedoch nur zu, wenn sie glaubhaft machen, dass durch die Verschmelzung die Erfüllung der Forderung gefährdet wird."
    },
    {
      "date": "2025-02-07",
      "id": "100783",
      "original_text": "Registerbekanntmachung nach dem Umwandlungsgesetz\nRheinland-Pfalz Amtsgericht Bad Kreuznach HRA 21287\nLulzim Caka Transporte GmbH & Co. KG – Dorsheim",
      "type": "Registerbekanntmachung nach dem Umwandlungsgesetz",
      "state": "Rheinland-Pfalz",
      "amtsgericht": "Amtsgericht Bad Kreuznach",
      "registernummer": "HRA 21287",
      "registerart": "HRA",
      "company_name": "Lulzim Caka Transporte GmbH & Co. KG",
      "company_seat": "Dorsheim",
      "details": "07.02.2025 (Bekanntmachungsdatum)\n\nRheinland-Pfalz Amtsgericht Bad Kreuznach HRA 21287\nRegisterbekanntmachung nach dem Umwandlungsgesetz 07.02.2025 (Eintragungsdatum)\n\nLulzim Caka Transporte GmbH & Co. KG\nKommanditgesellschaft\nDorsheim\n\nAls nicht eingetragen wird veröffentlicht: Den Gläubigern der an der Ausgliederung beteiligten Rechtsträger ist, wenn sie binnen sechs Monaten nach dem Tag, an dem die Eintragung der Ausgliederung in das Register des Sitzes desjenigen Rechtsträgers, dessen Gläubiger sie sind, nach § 19 Abs. 3 UmwG als bekannt gemacht gilt, ihren Anspruch nach Grund und Höhe schriftlich anmelden, Sicherheit zu leisten, soweit sie nicht Befriedigung verlangen können. Dieses Recht steht den Gläubigern jedoch nur zu, wenn sie glaubhaft machen, dass durch die Ausgliederung die Erfüllung der Forderung gefährdet wird."
    },
    {
      "date": "2025-02-07",
      "id": "100784",
      "original_text": "Registerbekanntmachung nach dem Umwandlungsgesetz\nRheinland-Pfalz Amtsgericht Bad Kreuznach HRA 21274\nLulzim Caka e. K. – Dorsheim",
      "type": "Registerbekanntmachung nach dem Umwandlungsgesetz",
      "state": "Rheinland-Pfalz",
      "amtsgericht": "Amtsgericht Bad Kreuznach",
      "registernummer": "HRA 21274",
      "registerart": "HRA",
      "company_name": "Lulzim Caka e. K.",
      "company_seat": "Dorsheim",
      "details": "07.02.2025 (Bekanntmachungsdatum)\n\nRheinland-Pfalz Amtsgericht Bad Kreuznach HRA 21274\nRegisterbekanntmachung nach dem Umwandlungsgesetz 07.02.2025 (Eintragungsdatum)\n\nLulzim Caka e. K.\nEinzelkaufmann / Einzelkauffrau\nDorsheim\n\nAls nicht eingetragen wird veröffentlicht: Den Gläubigern der an der Ausgliederung beteiligten Rechtsträger ist, wenn sie binnen sechs Monaten nach dem Tag, an dem die Eintragung der Ausgliederung in das Register des Sitzes desjenigen Rechtsträgers, dessen Gläubiger sie sind, nach § 19 Abs. 3 UmwG als bekannt gemacht gilt, ihren Anspruch nach Grund und Höhe schriftlich anmelden, Sicherheit zu leisten, soweit sie nicht Befriedigung verlangen können. Dieses Recht steht den Gläubigern jedoch nur zu, wenn sie glaubhaft machen, dass durch die Ausgliederung die Erfüllung der Forderung gefährdet wird."
    },
    {
      "date": "2025-02-07",
      "id": "100785",
      "original_text": "Einreichung neuer Dokumente\nRheinland-Pfalz Amtsgericht Kaiserslautern HRB 3639\nAbita Energie Otterberg GmbH – Kaiserslautern",
      "type": "Einreichung neuer Dokumente",
      "state": "Rheinland-Pfalz",
      "amtsgericht": "Amtsgericht Kaiserslautern",
      "registernummer": "HRB 3639",
      "registerart": "HRB",
      "company_name": "Abita Energie Otterberg GmbH",
      "company_seat": "Kaiserslautern",
      "details": "07.02.2025 (Bekanntmachungsdatum)\n\nRheinland-Pfalz Amtsgericht Kaiserslautern HRB 3639\nEinreichung neuer Dokumente\n\nAbita Energie Otterberg GmbH\nGesellschaft mit beschränkter Haftung\nKaiserslautern\n\nDem Registergericht ist eine neue Liste der Mitglieder des Aufsichtsrates eingereicht worden."
    },
    {
      "date": "2025-02-07",
      "id": "100786",
      "original_text": "Einreichung neuer Dokumente\nNordrhein-Westfalen Amtsgericht Duisburg HRB 38241\nProjektgesellschaft Technologiezentrum Wedau mbH – Duisburg",
      "type": "Einreichung neuer Dokumente",
      "state": "Nordrhein-Westfalen",
      "amtsgericht": "Amtsgericht Duisburg",
      "registernummer": "HRB 38241",
      "registerart": "HRB",
      "company_name": "Projektgesellschaft Technologiezentrum Wedau mbH",
      "company_seat": "Duisburg",
      "details": "07.02.2025 (Bekanntmachungsdatum)\n\nNordrhein-Westfalen Amtsgericht Duisburg HRB 38241\nEinreichung neuer Dokumente\n\nProjektgesellschaft Technologiezentrum Wedau mbH\nGesellschaft mit beschränkter Haftung\nDuisburg\n\nDem Registergericht ist eine Liste der Mitglieder des Aufsichtsrates eingereicht worden."
    },
    {
      "date": "2025-02-07",
      "id": "100787",
      "original_text": "Löschungsankündigung\nNordrhein-Westfalen Amtsgericht Düsseldorf HRB 91278\nhairstyle by aleks Düsseldorf GmbH – Düsseldorf",
      "type": "Löschungsankündigung",
      "state": "Nordrhein-Westfalen",
      "amtsgericht": "Amtsgericht Düsseldorf",
      "registernummer": "HRB 91278",
      "registerart": "HRB",
      "company_name": "hairstyle by aleks Düsseldorf GmbH",
      "company_seat": "Düsseldorf",
      "details": "07.02.2025 (Bekanntmachungsdatum)\n\nNordrhein-Westfalen Amtsgericht Düsseldorf HRB 91278\nLöschungsankündigung\n\nhairstyle by aleks Düsseldorf GmbH\nGesellschaft mit beschränkter Haftung\nDüsseldorf\n\nDas Registergericht beabsichtigt die Gesellschaft von Amts wegen nach § 394 FamFG zu löschen. Die Frist zur Erhebung eines Widerspruchs ist auf 3 Wochen festgesetzt.\n\nRechtsbehelfsbelehrung:\nDas Widerspruchsrecht steht jedem zu, der an der Unterlassung der Löschung ein berechtigtes Interesse hat. Der Widerspruch ist bei dem Amtsgericht Düsseldorf -Registergericht-, Werdener Straße 1, 40227 Düsseldorf schriftlich in deutscher Sprache oder zur Niederschrift der Geschäftsstelle einzulegen. Der Widerspruch kann auch zur Niederschrift der Geschäftsstelle eines jeden Amtsgerichtes abgegeben werden. Die Einlegung ist auch durch Übertragung eines elektronischen Dokuments an die elektronische Poststelle des Gerichts möglich. Das elektronische Dokument muss für die Bearbeitung durch das Gericht geeignet und mit einer qualifizierten elektronischen Signatur der verantwortenden Person versehen sein oder von der verantwortenden Person signiert und auf einem sicheren Übermittlungsweg gemäß § 130a ZPO nach näherer Maßgabe der Verordnung über die technischen Rahmenbedingungen des elektronischen Rechtsverkehrs und über das besondere elektronische Behördenpostfach (BGBl. I, S.3803) eingereicht werden. Weitere Informationen erhalten Sie auf der Internetseite www.justiz.de.\nDer Widerspruch muss spätestens innerhalb der gesetzten Frist nach dem Datum der Bekanntmachung der Löschungsankündigung bei dem Amtsgericht - Registergericht - Düsseldorf eingegangen sein.  Dies gilt auch dann, wenn der Widerspruch zur Niederschrift der Geschäftsstelle eines anderen Amtsgerichtes abgegeben wurde. Die Frist beginnt mit dem Tage der Bekanntmachung der Löschungsankündigung in dem für die Bekanntmachung der Eintragungen in das Handelsregister bestimmten elektronischen Informations- und Kommunikationssystem nach § 10 des Handelsgesetzbuches. Fällt das Ende der Frist auf einen Sonntag, einen allgemeinen Feiertag oder Sonnabend, so endet die Frist mit Ablauf des nächsten Werktages.\nDer Widerspruch muss die Bezeichnung der angefochtenen Löschungsankündigung sowie die Erklärung enthalten, dass Widerspruch gegen diese Löschungsankündigung eingelegt wird. Er ist zu unterzeichnen und soll begründet werden."
    },
    {
      "date": "2025-02-07",
      "id": "100788",
      "original_text": "Sonstige Registerbekanntmachung\nNordrhein-Westfalen Amtsgericht Siegen HRB 6720\nGemeinnützige Gesellschaft der Franziskanerinnen zu Olpe mbH – Olpe",
      "type": "Sonstige Registerbekanntmachung",
      "state": "Nordrhein-Westfalen",
      "amtsgericht": "Amtsgericht Siegen",
      "registernummer": "HRB 6720",
      "registerart": "HRB",
      "company_name": "Gemeinnützige Gesellschaft der Franziskanerinnen zu Olpe mbH",
      "company_seat": "Olpe",
      "details": "07.02.2025 (Bekanntmachungsdatum)\n\nNordrhein-Westfalen Amtsgericht Siegen HRB 6720\nSonstige Registerbekanntmachung\n\nGemeinnützige Gesellschaft der Franziskanerinnen zu Olpe mbH\nGesellschaft mit beschränkter Haftung\nOlpe\n\nDem Registergericht ist eine neue Liste der Mitglieder des Aufsichtsrates eingereicht worden."
    },
    {
      "date": "2025-02-07",
      "id": "100789",
      "original_text": "Löschungsankündigung\nNordrhein-Westfalen Amtsgericht Düsseldorf HRB 96520\nESRLorcy GmbH – Düsseldorf",
      "type": "Löschungsankündigung",
      "state": "Nordrhein-Westfalen",
      "amtsgericht": "Amtsgericht Düsseldorf",
      "registernummer": "HRB 96520",
      "registerart": "HRB",
      "company_name": "ESRLorcy GmbH",
      "company_seat": "Düsseldorf",
      "details": "07.02.2025 (Bekanntmachungsdatum)\n\nNordrhein-Westfalen Amtsgericht Düsseldorf HRB 96520\nLöschungsankündigung\n\nESRLorcy GmbH\nGesellschaft mit beschränkter Haftung\nDüsseldorf\n\nDas Registergericht beabsichtigt die Gesellschaft von Amts wegen nach § 394 Abs. 1 FamFG zu löschen. Die Frist zur Erhebung eines Widerspruchs ist auf 3 Wochen festgesetzt.\n\nRechtsbehelfsbelehrung:\nDas Widerspruchsrecht steht jedem zu, der an der Unterlassung der Löschung ein berechtigtes Interesse hat. Der Widerspruch ist bei dem Amtsgericht Düsseldorf -Registergericht-, Werdener Straße 1, 40227 Düsseldorf schriftlich in deutscher Sprache oder zur Niederschrift der Geschäftsstelle einzulegen. Der Widerspruch kann auch zur Niederschrift der Geschäftsstelle eines jeden Amtsgerichtes abgegeben werden. Die Einlegung ist auch durch Übertragung eines elektronischen Dokuments an die elektronische Poststelle des Gerichts möglich. Das elektronische Dokument muss für die Bearbeitung durch das Gericht geeignet und mit einer qualifizierten elektronischen Signatur der verantwortenden Person versehen sein oder von der verantwortenden Person signiert und auf einem sicheren Übermittlungsweg gemäß § 130a ZPO nach näherer Maßgabe der Verordnung über die technischen Rahmenbedingungen des elektronischen Rechtsverkehrs und über das besondere elektronische Behördenpostfach (BGBl. I, S.3803) eingereicht werden. Weitere Informationen erhalten Sie auf der Internetseite www.justiz.de.\nDer Widerspruch muss spätestens innerhalb der gesetzten Frist nach dem Datum der Bekanntmachung der Löschungsankündigung bei dem Amtsgericht - Registergericht - Düsseldorf eingegangen sein.  Dies gilt auch dann, wenn der Widerspruch zur Niederschrift der Geschäftsstelle eines anderen Amtsgerichtes abgegeben wurde. Die Frist beginnt mit dem Tage der Bekanntmachung der Löschungsankündigung in dem für die Bekanntmachung der Eintragungen in das Handelsregister bestimmten elektronischen Informations- und Kommunikationssystem nach § 10 des Handelsgesetzbuches. Fällt das Ende der Frist auf einen Sonntag, einen allgemeinen Feiertag oder Sonnabend, so endet die Frist mit Ablauf des nächsten Werktages.\nDer Widerspruch muss die Bezeichnung der angefochtenen Löschungsankündigung sowie die Erklärung enthalten, dass Widerspruch gegen diese Löschungsankündigung eingelegt wird. Er ist zu unterzeichnen und soll begründet werden."
    },
    {
      "date": "2025-02-07",
      "id": "100790",
      "original_text": "Löschungsankündigung\nNordrhein-Westfalen Amtsgericht Münster HRB 12499\nMTP mind the process GmbH – Münster",
      "type": "Löschungsankündigung",
      "state": "Nordrhein-Westfalen",
      "amtsgericht": "Amtsgericht Münster",
      "registernummer": "HRB 12499",
      "registerart": "HRB",
      "company_name": "MTP mind the process GmbH",
      "company_seat": "Münster",
      "details": "07.02.2025 (Bekanntmachungsdatum)\n\nNordrhein-Westfalen Amtsgericht Münster HRB 12499\nLöschungsankündigung\n\nMTP mind the process GmbH\nGesellschaft mit beschränkter Haftung\nMünster\n\nDas Registergericht beabsichtigt die Gesellschaft von Amts wegen nach § 394 FamFG zu löschen. Die Frist zur Erhebung eines Widerspruchs ist auf 3 Wochen festgesetzt.\n\nRechtsbehelfsbelehrung:\n\nGegen diese Verfügung können Sie Widerspruch einlegen.\n\nDer Widerspruch ist bei dem Amtsgericht Münster, Gerichtsstraße 2 bis 6, 48149 Münster schriftlich in deutscher Sprache oder zur Niederschrift der Geschäftsstelle eines jeden Amtsgerichtes abgegeben werden.\nDie Einlegung ist auch durch Übertragung eine elektronischen Dokuments an die elektronische Poststelle des Gerichts möglich. Das elektronische Dokument muss für die Bearbeitung durch das Gericht geeignet und mit einer qualifizierten elektronischen Signatur der verantwortenden Person versehen sein oder von der verantwortenden Person signiert und auf einem sicheren Übermittlungsweg gem. §130a ZPO nach nähere Maßgabe der Verordnung über die technischen Rahmenbedingungen des elektronischen Rechtsverkehrs und über das besondere elektronische Behördenpostfach (BGBI. I. S.3808) eingereicht werden. Weitere Informationen erhalten Sie auf der Internetseite www.justiz.de\n\nDer Widerspruch muss spätestens innerhalb der gesetzten Frist nach der schriftlichen Bekanntgabe der Verfügung bei dem Amtsgericht Münster eingegangen sein. Dies gilt auch dann, wenn der Widerspruch zur Niederschrift der Geschäftsstelle eines anderen Amtsgerichtes abgegeben wurde. Die Frist beginnt mit der schriftlichen Bekanntgabe der Verfügung, spätestens mit Ablauf von fünf Monaten nach Erlass der Verfügung. Die Bekanntgabe ist entweder durch Zustellung oder am dritten Tage nach Aufgabe zur Post bewirkt. Fällt das Ende der First auf einen Sonntag, einen allgemeinen Feiertag oder Sonnabend, so endet die Frist mit Ablauf des nächsten Werktages.\n\nDer Widerspruch muss die Bezeichnung der angefochtenen Verfügung sowie die Erklärung enthalten, dass Widerspruch gegen diese Verfügung eingelegt wird. Er ist zu unterzeichnen und soll begründet werden."
    },
    {
      "date": "2025-02-07",
      "id": "100791",
      "original_text": "Löschungsankündigung\nNordrhein-Westfalen Amtsgericht Hagen HRB 12169\nBalz-Mont GmbH – Hagen",
      "type": "Löschungsankündigung",
      "state": "Nordrhein-Westfalen",
      "amtsgericht": "Amtsgericht Hagen",
      "registernummer": "HRB 12169",
      "registerart": "HRB",
      "company_name": "Balz-Mont GmbH",
      "company_seat": "Hagen",
      "details": "07.02.2025 (Bekanntmachungsdatum)\n\nNordrhein-Westfalen Amtsgericht Hagen HRB 12169\nLöschungsankündigung\n\nBalz-Mont GmbH\nGesellschaft mit beschränkter Haftung\nHagen\n\nDas Registergericht beabsichtigt, die im Handelsregister eingetragene Gesellschaft gemäß § 394 Absatz 1 FamFG wegen Vermögenslosigkeit von Amts wegen zu löschen.  Gegen diese Verfügung kann Widerspruch eingelegt werden. Die Frist zur Erhebung eines Widerspruchs gegen die beabsichtigte Löschung von Amts wegen ist auf drei Monate festgesetzt.\n\nRechtsbehelfsbelehrung:\nGegen diese Verfügung können Sie Widerspruch einlegen.\n\nDer Widerspruch ist bei dem Amtsgericht Hagen, Heinitzstraße 42, 58097 Hagen schriftlich in deutscher Sprache oder zur Niederschrift der Geschäftsstelle einzulegen. Der Widerspruch kann auch zur Niederschrift der Geschäftsstelle eines jeden Amtsgerichtes abgegeben werden.\n\nDer Widerspruch muss spätestens innerhalb der gesetzten Frist bei dem Amtsgericht Hagen eingegangen sein. Dies gilt auch dann, wenn der Widerspruch zur Niederschrift der Geschäftsstelle eines anderen Amtsgerichtes abgegeben wurde. Die Frist beginnt mit der Veröffentlichung. Fällt das Ende der Frist auf einen Sonntag, einen allgemeinen Feiertag oder Sonnabend, so endet die Frist mit Ablauf des nächsten Werktages.\n\nDer Widerspruch muss die Bezeichnung der angefochtenen Verfügung sowie die Erklärung enthalten, dass Widerspruch gegen diese Verfügung eingelegt wird. Er ist zu unterzeichnen und soll begründet werden."
    },
    {
      "date": "2025-02-07",
      "id": "100792",
      "original_text": "Registerbekanntmachung nach dem Umwandlungsgesetz\nNordrhein-Westfalen Amtsgericht Krefeld HRA 7216\nKAHLKE Vertrieb GmbH & Co. KG – Kempen",
      "type": "Registerbekanntmachung nach dem Umwandlungsgesetz",
      "state": "Nordrhein-Westfalen",
      "amtsgericht": "Amtsgericht Krefeld",
      "registernummer": "HRA 7216",
      "registerart": "HRA",
      "company_name": "KAHLKE Vertrieb GmbH & Co. KG",
      "company_seat": "Kempen",
      "details": "07.02.2025 (Bekanntmachungsdatum)\n\nNordrhein-Westfalen Amtsgericht Krefeld HRA 7216\nRegisterbekanntmachung nach dem Umwandlungsgesetz 07.02.2025 (Eintragungsdatum)\n\nKAHLKE Vertrieb GmbH & Co. KG\nKommanditgesellschaft\nKempen\n\nDen Gläubigern der an der Verschmelzung beteiligten Rechtsträger ist, wenn sie binnen sechs Monaten nach dem Tag, an dem die Eintragung der Verschmelzung in das Register des Sitzes desjenigen Rechtsträgers, dessen Gläubiger sie sind, nach § 19 Absatz 3 UmwG als bekanntgemacht gilt, ihren Anspruch nach Grund und Höhe schriftlich anmelden, Sicherheit zu leisten, soweit sie nicht Befriedigung verlangen können. Dieses Recht steht den Gläubigern jedoch nur zu, wenn sie glaubhaft machen, dass durch die Verschmelzung die Erfüllung ihrer Forderung gefährdet wird."
    },
    {
      "date": "2025-02-07",
      "id": "100793",
      "original_text": "Löschungsankündigung\nNordrhein-Westfalen Amtsgericht Düsseldorf HRB 79454\nASIL GmbH – Düsseldorf",
      "type": "Löschungsankündigung",
      "state": "Nordrhein-Westfalen",
      "amtsgericht": "Amtsgericht Düsseldorf",
      "registernummer": "HRB 79454",
      "registerart": "HRB",
      "company_name": "ASIL GmbH",
      "company_seat": "Düsseldorf",
      "details": "07.02.2025 (Bekanntmachungsdatum)\n\nNordrhein-Westfalen Amtsgericht Düsseldorf HRB 79454\nLöschungsankündigung\n\nASIL GmbH\nGesellschaft mit beschränkter Haftung\nDüsseldorf\n\nDas Registergericht beabsichtigt die Gesellschaft von Amts wegen nach § 394 FamFG zu löschen. Die Frist zur Erhebung eines Widerspruchs ist auf 3 Wochen festgesetzt.\n\nRechtsbehelfsbelehrung:\nDas Widerspruchsrecht steht jedem zu, der an der Unterlassung der Löschung ein berechtigtes Interesse hat. Der Widerspruch ist bei dem Amtsgericht Düsseldorf -Registergericht-, Werdener Straße 1, 40227 Düsseldorf schriftlich in deutscher Sprache oder zur Niederschrift der Geschäftsstelle einzulegen. Der Widerspruch kann auch zur Niederschrift der Geschäftsstelle eines jeden Amtsgerichtes abgegeben werden. Die Einlegung ist auch durch Übertragung eines elektronischen Dokuments an die elektronische Poststelle des Gerichts möglich. Das elektronische Dokument muss für die Bearbeitung durch das Gericht geeignet und mit einer qualifizierten elektronischen Signatur der verantwortenden Person versehen sein oder von der verantwortenden Person signiert und auf einem sicheren Übermittlungsweg gemäß § 130a ZPO nach näherer Maßgabe der Verordnung über die technischen Rahmenbedingungen des elektronischen Rechtsverkehrs und über das besondere elektronische Behördenpostfach (BGBl. I, S.3803) eingereicht werden. Weitere Informationen erhalten Sie auf der Internetseite www.justiz.de.\nDer Widerspruch muss spätestens innerhalb der gesetzten Frist nach dem Datum der Bekanntmachung der Löschungsankündigung bei dem Amtsgericht - Registergericht - Düsseldorf eingegangen sein.  Dies gilt auch dann, wenn der Widerspruch zur Niederschrift der Geschäftsstelle eines anderen Amtsgerichtes abgegeben wurde. Die Frist beginnt mit dem Tage der Bekanntmachung der Löschungsankündigung in dem für die Bekanntmachung der Eintragungen in das Handelsregister bestimmten elektronischen Informations- und Kommunikationssystem nach § 10 des Handelsgesetzbuches. Fällt das Ende der Frist auf einen Sonntag, einen allgemeinen Feiertag oder Sonnabend, so endet die Frist mit Ablauf des nächsten Werktages.\nDer Widerspruch muss die Bezeichnung der angefochtenen Löschungsankündigung sowie die Erklärung enthalten, dass Widerspruch gegen diese Löschungsankündigung eingelegt wird. Er ist zu unterzeichnen und soll begründet werden."
    },
    {
      "date": "2025-02-07",
      "id": "100794",
      "original_text": "Löschungsankündigung\nNordrhein-Westfalen Amtsgericht Wuppertal HRA 20437\nHermann Moll GmbH & Co. KG – Solingen",
      "type": "Löschungsankündigung",
      "state": "Nordrhein-Westfalen",
      "amtsgericht": "Amtsgericht Wuppertal",
      "registernummer": "HRA 20437",
      "registerart": "HRA",
      "company_name": "Hermann Moll GmbH & Co. KG",
      "company_seat": "Solingen",
      "details": "07.02.2025 (Bekanntmachungsdatum)\n\nNordrhein-Westfalen Amtsgericht Wuppertal HRA 20437\nLöschungsankündigung\n\nHermann Moll GmbH & Co. KG\nKommanditgesellschaft\nSolingen\n\nDas Registergericht beabsichtigt die Firma von Amts wegen nach § 394 FamFG zu löschen. Die Frist zur Erhebung eines Widerspruchs ist auf drei Monate festgesetzt."
    },
    {
      "date": "2025-02-07",
      "id": "100795",
      "original_text": "Löschungsankündigung\nNordrhein-Westfalen Amtsgericht Köln HRA 33127\nHöwel Elektro GmbH & Co. KG – Köln",
      "type": "Löschungsankündigung",
      "state": "Nordrhein-Westfalen",
      "amtsgericht": "Amtsgericht Köln",
      "registernummer": "HRA 33127",
      "registerart": "HRA",
      "company_name": "Höwel Elektro GmbH & Co. KG",
      "company_seat": "Köln",
      "details": "07.02.2025 (Bekanntmachungsdatum)\n\nNordrhein-Westfalen Amtsgericht Köln HRA 33127\nLöschungsankündigung\n\nHöwel Elektro GmbH & Co. KG\nKommanditgesellschaft\nKöln\n\nDas Registergericht beabsichtigt die Firma von Amts wegen nach § 394 FamFG zu löschen. Die Frist zur Erhebung eines Widerspruchs ist auf sechs Wochen festgesetzt."
    },
    {
      "date": "2025-02-07",
      "id": "100796",
      "original_text": "Löschungsankündigung\nNordrhein-Westfalen Amtsgericht Köln HRA 33127\nHöwel Elektro GmbH & Co. KG – Köln",
      "type": "Löschungsankündigung",
      "state": "Nordrhein-Westfalen",
      "amtsgericht": "Amtsgericht Köln",
      "registernummer": "HRA 33127",
      "registerart": "HRA",
      "company_name": "Höwel Elektro GmbH & Co. KG",
      "company_seat": "Köln",
      "details": "07.02.2025 (Bekanntmachungsdatum)\n\nNordrhein-Westfalen Amtsgericht Köln HRA 33127\nLöschungsankündigung\n\nHöwel Elektro GmbH & Co. KG\nKommanditgesellschaft\nKöln\n\nDas Registergericht beabsichtigt die Firma von Amts wegen nach § 394 FamFG zu löschen. Die Frist zur Erhebung eines Widerspruchs ist auf sechs Wochen festgesetzt."
    },
    {
      "date": "2025-02-07",
      "id": "100797",
      "original_text": "Sonstige Registerbekanntmachung\nNordrhein-Westfalen Amtsgericht Gelsenkirchen HRB 5480\nEvonik Logistics Services GmbH – Marl",
      "type": "Sonstige Registerbekanntmachung",
      "state": "Nordrhein-Westfalen",
      "amtsgericht": "Amtsgericht Gelsenkirchen",
      "registernummer": "HRB 5480",
      "registerart": "HRB",
      "company_name": "Evonik Logistics Services GmbH",
      "company_seat": "Marl",
      "details": "07.02.2025 (Bekanntmachungsdatum)\n\nNordrhein-Westfalen Amtsgericht Gelsenkirchen HRB 5480\nSonstige Registerbekanntmachung 07.02.2025 (Eintragungsdatum)\n\nEvonik Logistics Services GmbH\nGesellschaft mit beschränkter Haftung\nMarl\n\nDem Registergericht ist eine neue Liste der Mitglieder des Aufsichtsrates eingereicht worden."
    },
    {
      "date": "2025-02-07",
      "id": "100798",
      "original_text": "Einreichung neuer Dokumente\nNordrhein-Westfalen Amtsgericht Hagen HRB 5608\nthyssenkrupp Bilstein GmbH – Ennepetal",
      "type": "Einreichung neuer Dokumente",
      "state": "Nordrhein-Westfalen",
      "amtsgericht": "Amtsgericht Hagen",
      "registernummer": "HRB 5608",
      "registerart": "HRB",
      "company_name": "thyssenkrupp Bilstein GmbH",
      "company_seat": "Ennepetal",
      "details": "07.02.2025 (Bekanntmachungsdatum)\n\nNordrhein-Westfalen Amtsgericht Hagen HRB 5608\nEinreichung neuer Dokumente\n\nthyssenkrupp Bilstein GmbH\nGesellschaft mit beschränkter Haftung\nEnnepetal\n\nDie gesetzlichen Vertreter der Gesellschaft haben eine aktuelle Lise der Aufsichtsratsmitglieder zum Handelsregister eingereicht."
    },
    {
      "date": "2025-02-07",
      "id": "100799",
      "original_text": "Löschungsankündigung\nNordrhein-Westfalen Amtsgericht Essen HRB 31623\nR.I.Q. Service UG (haftungsbeschränkt) – Essen",
      "type": "Löschungsankündigung",
      "state": "Nordrhein-Westfalen",
      "amtsgericht": "Amtsgericht Essen",
      "registernummer": "HRB 31623",
      "registerart": "HRB",
      "company_name": "R.I.Q. Service UG (haftungsbeschränkt)",
      "company_seat": "Essen",
      "details": "07.02.2025 (Bekanntmachungsdatum)\n\nNordrhein-Westfalen Amtsgericht Essen HRB 31623\nLöschungsankündigung\n\nR.I.Q. Service UG (haftungsbeschränkt)\nGesellschaft mit beschränkter Haftung\nEssen\n\nDas Registergericht beabsichtigt die Gesellschaft von Amts wegen nach § 394 FamFG zu löschen. Die Frist zur Erhebung eines Widerspruchs ist auf einen Monat festgesetzt."
    },
    {
      "date": "2025-02-07",
      "id": "100800",
      "original_text": "Löschungsankündigung\nNordrhein-Westfalen Amtsgericht Wuppertal HRB 4319\nGraf Beteiligungsgesellschaft mbH – Wuppertal",
      "type": "Löschungsankündigung",
      "state": "Nordrhein-Westfalen",
      "amtsgericht": "Amtsgericht Wuppertal",
      "registernummer": "HRB 4319",
      "registerart": "HRB",
      "company_name": "Graf Beteiligungsgesellschaft mbH",
      "company_seat": "Wuppertal",
      "details": "07.02.2025 (Bekanntmachungsdatum)\n\nNordrhein-Westfalen Amtsgericht Wuppertal HRB 4319\nLöschungsankündigung 06.02.2025 (Eintragungsdatum)\n\nGraf Beteiligungsgesellschaft mbH\nGesellschaft mit beschränkter Haftung\nWuppertal\n\nDas Registergericht beabsichtigt die Gesellschaft von Amts wegen nach § 394 FamFG zu löschen. Die Frist zur Erhebung eines Widerspruchs ist auf einen Monat festgesetzt."
    },
    {
      "date": "2025-02-07",
      "id": "100801",
      "original_text": "Einreichung neuer Dokumente\nNordrhein-Westfalen Amtsgericht Bochum HRB 8943\nRuhr-Service AG – Bochum",
      "type": "Einreichung neuer Dokumente",
      "state": "Nordrhein-Westfalen",
      "amtsgericht": "Amtsgericht Bochum",
      "registernummer": "HRB 8943",
      "registerart": "HRB",
      "company_name": "Ruhr-Service AG",
      "company_seat": "Bochum",
      "details": "07.02.2025 (Bekanntmachungsdatum)\n\nNordrhein-Westfalen Amtsgericht Bochum HRB 8943\nEinreichung neuer Dokumente 07.02.2025 (Eintragungsdatum)\n\nRuhr-Service AG\nAktiengesellschaft\nBochum\n\nDem Registergericht ist eine neue Liste der Mitglieder des Aufsichtsrates eingereicht worden."
    },
    {
      "date": "2025-02-07",
      "id": "100802",
      "original_text": "Einreichung neuer Dokumente\nNordrhein-Westfalen Amtsgericht Wuppertal HRB 34922\nFutureSmart Holdings AG – Velbert",
      "type": "Einreichung neuer Dokumente",
      "state": "Nordrhein-Westfalen",
      "amtsgericht": "Amtsgericht Wuppertal",
      "registernummer": "HRB 34922",
      "registerart": "HRB",
      "company_name": "FutureSmart Holdings AG",
      "company_seat": "Velbert",
      "details": "07.02.2025 (Bekanntmachungsdatum)\n\nNordrhein-Westfalen Amtsgericht Wuppertal HRB 34922\nEinreichung neuer Dokumente 07.02.2025 (Eintragungsdatum)\n\nFutureSmart Holdings AG\nAktiengesellschaft\nVelbert\n\nDem Registergericht ist eine neue Liste der Mitglieder des Aufsichtsrates eingereicht worden."
    },
    {
      "date": "2025-02-07",
      "id": "100803",
      "original_text": "Löschungsankündigung\nNordrhein-Westfalen Amtsgericht Düsseldorf HRB 95435\nLAMA UG (haftungsbeschränkt) – Düsseldorf",
      "type": "Löschungsankündigung",
      "state": "Nordrhein-Westfalen",
      "amtsgericht": "Amtsgericht Düsseldorf",
      "registernummer": "HRB 95435",
      "registerart": "HRB",
      "company_name": "LAMA UG (haftungsbeschränkt)",
      "company_seat": "Düsseldorf",
      "details": "07.02.2025 (Bekanntmachungsdatum)\n\nNordrhein-Westfalen Amtsgericht Düsseldorf HRB 95435\nLöschungsankündigung\n\nLAMA UG (haftungsbeschränkt)\nGesellschaft mit beschränkter Haftung\nDüsseldorf\n\nBetr.: LAMA UG (haftungsbeschränkt), Tichauer Weg 11, 40231 Düsseldorf\n\nDas Registergericht beabsichtigt die Gesellschaft von Amts wegen nach § 394 FamFG zu löschen. Die Frist zur Erhebung eines Widerspruchs ist auf 3 Wochen festgesetzt.\n\nRechtsbehelfsbelehrung:\n\nDas Widerspruchsrecht steht jedem zu, der an der Unterlassung der Löschung ein berechtigtes Interesse hat. Der Widerspruch ist bei dem Amtsgericht Düsseldorf -Registergericht-, Werdener Straße 1, 40227 Düsseldorf schriftlich in deutscher Sprache oder zur Niederschrift der Geschäftsstelle einzulegen. Der Widerspruch kann auch zur Niederschrift der Geschäftsstelle eines jeden Amtsgerichtes abgegeben werden. Die Einlegung ist auch durch Übertragung eines elektronischen Dokuments an die elektronische Poststelle des Gerichts möglich. Das elektronische Dokument muss für die Bearbeitung durch das Gericht geeignet und mit einer qualifizierten elektronischen Signatur der verantwortenden Person versehen sein oder von der verantwortenden Person signiert und auf einem sicheren Übermittlungsweg gemäß § 130a ZPO nach näherer Maßgabe der Verordnung über die technischen Rahmenbedingungen des elektronischen Rechtsverkehrs und über das besondere elektronische Behördenpostfach (BGBl. I, S.3803) eingereicht werden. Weitere Informationen erhalten Sie auf der Internetseite www.justiz.de.\nDer Widerspruch muss spätestens innerhalb der gesetzten Frist nach dem Datum der Bekanntmachung der Löschungsankündigung bei dem Amtsgericht - Registergericht - Düsseldorf eingegangen sein.  Dies gilt auch dann, wenn der Widerspruch zur Niederschrift der Geschäftsstelle eines anderen Amtsgerichtes abgegeben wurde. Die Frist beginnt mit dem Tage der Bekanntmachung der Löschungsankündigung in dem für die Bekanntmachung der Eintragungen in das Handelsregister bestimmten elektronischen Informations- und Kommunikationssystem nach § 10 des Handelsgesetzbuches. Fällt das Ende der Frist auf einen Sonntag, einen allgemeinen Feiertag oder Sonnabend, so endet die Frist mit Ablauf des nächsten Werktages.\nDer Widerspruch muss die Bezeichnung der angefochtenen Löschungsankündigung sowie die Erklärung enthalten, dass Widerspruch gegen diese Löschungsankündigung eingelegt wird. Er ist zu unterzeichnen und soll begründet werden."
    },
    {
      "date": "2025-02-07",
      "id": "100804",
      "original_text": "Löschungsankündigung\nNordrhein-Westfalen Amtsgericht Düsseldorf HRB 98607\nVailova Dienstleistungen GmbH – Düsseldorf",
      "type": "Löschungsankündigung",
      "state": "Nordrhein-Westfalen",
      "amtsgericht": "Amtsgericht Düsseldorf",
      "registernummer": "HRB 98607",
      "registerart": "HRB",
      "company_name": "Vailova Dienstleistungen GmbH",
      "company_seat": "Düsseldorf",
      "details": "07.02.2025 (Bekanntmachungsdatum)\n\nNordrhein-Westfalen Amtsgericht Düsseldorf HRB 98607\nLöschungsankündigung\n\nVailova Dienstleistungen GmbH\nGesellschaft mit beschränkter Haftung\nDüsseldorf\n\nDas Registergericht beabsichtigt die Gesellschaft von Amts wegen nach § 394 FamFG zu löschen. Die Frist zur Erhebung eines Widerspruchs ist auf 3 Wochen+ festgesetzt.\n\nRechtsbehelfsbelehrung:\nDas Widerspruchsrecht steht jedem zu, der an der Unterlassung der Löschung ein berechtigtes Interesse hat. Der Widerspruch ist bei dem Amtsgericht Düsseldorf -Registergericht-, Werdener Straße 1, 40227 Düsseldorf schriftlich in deutscher Sprache oder zur Niederschrift der Geschäftsstelle einzulegen. Der Widerspruch kann auch zur Niederschrift der Geschäftsstelle eines jeden Amtsgerichtes abgegeben werden. Die Einlegung ist auch durch Übertragung eines elektronischen Dokuments an die elektronische Poststelle des Gerichts möglich. Das elektronische Dokument muss für die Bearbeitung durch das Gericht geeignet und mit einer qualifizierten elektronischen Signatur der verantwortenden Person versehen sein oder von der verantwortenden Person signiert und auf einem sicheren Übermittlungsweg gemäß § 130a ZPO nach näherer Maßgabe der Verordnung über die technischen Rahmenbedingungen des elektronischen Rechtsverkehrs und über das besondere elektronische Behördenpostfach (BGBl. I, S.3803) eingereicht werden. Weitere Informationen erhalten Sie auf der Internetseite www.justiz.de.\nDer Widerspruch muss spätestens innerhalb der gesetzten Frist nach dem Datum der Bekanntmachung der Löschungsankündigung bei dem Amtsgericht - Registergericht - Düsseldorf eingegangen sein.  Dies gilt auch dann, wenn der Widerspruch zur Niederschrift der Geschäftsstelle eines anderen Amtsgerichtes abgegeben wurde. Die Frist beginnt mit dem Tage der Bekanntmachung der Löschungsankündigung in dem für die Bekanntmachung der Eintragungen in das Handelsregister bestimmten elektronischen Informations- und Kommunikationssystem nach § 10 des Handelsgesetzbuches. Fällt das Ende der Frist auf einen Sonntag, einen allgemeinen Feiertag oder Sonnabend, so endet die Frist mit Ablauf des nächsten Werktages.\nDer Widerspruch muss die Bezeichnung der angefochtenen Löschungsankündigung sowie die Erklärung enthalten, dass Widerspruch gegen diese Löschungsankündigung eingelegt wird. Er ist zu unterzeichnen und soll begründet werden."
    },
    {
      "date": "2025-02-07",
      "id": "100805",
      "original_text": "Registerbekanntmachung nach dem Umwandlungsgesetz\nNordrhein-Westfalen Amtsgericht Krefeld HRB 19217\nKAHLKE Verwaltung GmbH – Kempen",
      "type": "Registerbekanntmachung nach dem Umwandlungsgesetz",
      "state": "Nordrhein-Westfalen",
      "amtsgericht": "Amtsgericht Krefeld",
      "registernummer": "HRB 19217",
      "registerart": "HRB",
      "company_name": "KAHLKE Verwaltung GmbH",
      "company_seat": "Kempen",
      "details": "07.02.2025 (Bekanntmachungsdatum)\n\nNordrhein-Westfalen Amtsgericht Krefeld HRB 19217\nRegisterbekanntmachung nach dem Umwandlungsgesetz 07.02.2025 (Eintragungsdatum)\n\nKAHLKE Verwaltung GmbH\nGesellschaft mit beschränkter Haftung\nKempen\n\nDen Gläubigern der an der Verschmelzung beteiligten Rechtsträger ist, wenn sie binnen sechs Monaten nach dem Tag, an dem die Eintragung der Verschmelzung in das Register des Sitzes desjenigen Rechtsträgers, dessen Gläubiger sie sind, nach § 19 Absatz 3 UmwG als bekanntgemacht gilt, ihren Anspruch nach Grund und Höhe schriftlich anmelden, Sicherheit zu leisten, soweit sie nicht Befriedigung verlangen können. Dieses Recht steht den Gläubigern jedoch nur zu, wenn sie glaubhaft machen, dass durch die Verschmelzung die Erfüllung ihrer Forderung gefährdet wird."
    },
    {
      "date": "2025-02-07",
      "id": "100806",
      "original_text": "Löschungsankündigung\nNordrhein-Westfalen Amtsgericht Hagen HRB 12018\nDR Deutsche Renovierung GmbH – Schwerte",
      "type": "Löschungsankündigung",
      "state": "Nordrhein-Westfalen",
      "amtsgericht": "Amtsgericht Hagen",
      "registernummer": "HRB 12018",
      "registerart": "HRB",
      "company_name": "DR Deutsche Renovierung GmbH",
      "company_seat": "Schwerte",
      "details": "07.02.2025 (Bekanntmachungsdatum)\n\nNordrhein-Westfalen Amtsgericht Hagen HRB 12018\nLöschungsankündigung\n\nDR Deutsche Renovierung GmbH\nGesellschaft mit beschränkter Haftung\nSchwerte\n\nDas Registergericht beabsichtigt, die im Handelsregister eingetragene Gesellschaft gemäß § 394 Absatz 1 FamFG wegen Vermögenslosigkeit von Amts wegen zu löschen.  Gegen diese Verfügung kann Widerspruch eingelegt werden. Die Frist zur Erhebung eines Widerspruchs gegen die beabsichtigte Löschung von Amts wegen ist auf drei Monate festgesetzt.\n\nRechtsbehelfsbelehrung:\nGegen diese Verfügung können Sie Widerspruch einlegen.\n\nDer Widerspruch ist bei dem Amtsgericht Hagen, Heinitzstraße 42, 58097 Hagen schriftlich in deutscher Sprache oder zur Niederschrift der Geschäftsstelle einzulegen. Der Widerspruch kann auch zur Niederschrift der Geschäftsstelle eines jeden Amtsgerichtes abgegeben werden.\n\nDer Widerspruch muss spätestens innerhalb der gesetzten Frist bei dem Amtsgericht Hagen eingegangen sein. Dies gilt auch dann, wenn der Widerspruch zur Niederschrift der Geschäftsstelle eines anderen Amtsgerichtes abgegeben wurde. Die Frist beginnt mit der Veröffentlichung. Fällt das Ende der Frist auf einen Sonntag, einen allgemeinen Feiertag oder Sonnabend, so endet die Frist mit Ablauf des nächsten Werktages.\n\nDer Widerspruch muss die Bezeichnung der angefochtenen Verfügung sowie die Erklärung enthalten, dass Widerspruch gegen diese Verfügung eingelegt wird. Er ist zu unterzeichnen und soll begründet werden."
    },
    {
      "date": "2025-02-07",
      "id": "100807",
      "original_text": "Löschungsankündigung\nNordrhein-Westfalen Amtsgericht Essen HRA 9748\nMgE Mediengruppe Essen GmbH & Co. KG – Essen",
      "type": "Löschungsankündigung",
      "state": "Nordrhein-Westfalen",
      "amtsgericht": "Amtsgericht Essen",
      "registernummer": "HRA 9748",
      "registerart": "HRA",
      "company_name": "MgE Mediengruppe Essen GmbH & Co. KG",
      "company_seat": "Essen",
      "details": "07.02.2025 (Bekanntmachungsdatum)\n\nNordrhein-Westfalen Amtsgericht Essen HRA 9748\nLöschungsankündigung\n\nMgE Mediengruppe Essen GmbH & Co. KG\nKommanditgesellschaft\nEssen\n\nDas Registergericht beabsichtigt die Firma von Amts wegen nach § 31 Absatz 2 Satz 2, § 6 Absatz 1 HGB, § 393 FamFG zu löschen. Die Frist zur Erhebung eines Widerspruchs ist auf einen Monat festgesetzt."
    },
    {
      "date": "2025-02-07",
      "id": "100808",
      "original_text": "Löschungsankündigung\nNordrhein-Westfalen Amtsgericht Krefeld HRB 13688\nDer Seemann GmbH – Krefeld",
      "type": "Löschungsankündigung",
      "state": "Nordrhein-Westfalen",
      "amtsgericht": "Amtsgericht Krefeld",
      "registernummer": "HRB 13688",
      "registerart": "HRB",
      "company_name": "Der Seemann GmbH",
      "company_seat": "Krefeld",
      "details": "07.02.2025 (Bekanntmachungsdatum)\n\nNordrhein-Westfalen Amtsgericht Krefeld HRB 13688\nLöschungsankündigung\n\nDer Seemann GmbH\nGesellschaft mit beschränkter Haftung\nKrefeld\n\nDas Registergericht beabsichtigt die Gesellschaft von Amts wegen nach § 394 FamFG zu löschen. Die Frist zur Erhebung eines Widerspruchs ist auf einen Monat festgesetzt."
    },
    {
      "date": "2025-02-07",
      "id": "100809",
      "original_text": "Sonstige Registerbekanntmachung\nNordrhein-Westfalen Amtsgericht Siegen HRB 8983\nBZW Bildungszentrum Wittgenstein GmbH – Bad Berleburg",
      "type": "Sonstige Registerbekanntmachung",
      "state": "Nordrhein-Westfalen",
      "amtsgericht": "Amtsgericht Siegen",
      "registernummer": "HRB 8983",
      "registerart": "HRB",
      "company_name": "BZW Bildungszentrum Wittgenstein GmbH",
      "company_seat": "Bad Berleburg",
      "details": "07.02.2025 (Bekanntmachungsdatum)\n\nNordrhein-Westfalen Amtsgericht Siegen HRB 8983\nSonstige Registerbekanntmachung\n\nBZW Bildungszentrum Wittgenstein GmbH\nGesellschaft mit beschränkter Haftung\nBad Berleburg\n\nDem Registergericht ist eine neue Liste der Mitglieder des Aufsichtsrates eingereicht worden."
    },
    {
      "date": "2025-02-07",
      "id": "100810",
      "original_text": "Einreichung neuer Dokumente\nHessen Amtsgericht Offenbach am Main HRB 11794\nRMA Rhein-Main Abfall GmbH – Offenbach am Main",
      "type": "Einreichung neuer Dokumente",
      "state": "Hessen",
      "amtsgericht": "Amtsgericht Offenbach am Main",
      "registernummer": "HRB 11794",
      "registerart": "HRB",
      "company_name": "RMA Rhein-Main Abfall GmbH",
      "company_seat": "Offenbach am Main",
      "details": "07.02.2025 (Bekanntmachungsdatum)\n\nHessen Amtsgericht Offenbach am Main HRB 11794\nEinreichung neuer Dokumente 07.02.2025 (Eintragungsdatum)\n\nRMA Rhein-Main Abfall GmbH\nGesellschaft mit beschränkter Haftung\nOffenbach am Main\n\nDurch eine Änderung in den Personen der Aufsichtsratsmitglieder ist eine Liste der Mitglieder des Aufsichtsrates zum Handelsregister eingereicht worden."
    },
    {
      "date": "2025-02-07",
      "id": "100811",
      "original_text": "Registerbekanntmachung nach dem Umwandlungsgesetz\nHessen Amtsgericht Frankfurt am Main HRB 127869\nGrowthUp+ UG (haftungsbeschränkt) – Frankfurt am Main",
      "type": "Registerbekanntmachung nach dem Umwandlungsgesetz",
      "state": "Hessen",
      "amtsgericht": "Amtsgericht Frankfurt am Main",
      "registernummer": "HRB 127869",
      "registerart": "HRB",
      "company_name": "GrowthUp+ UG (haftungsbeschränkt)",
      "company_seat": "Frankfurt am Main",
      "details": "07.02.2025 (Bekanntmachungsdatum)\n\nHessen Amtsgericht Frankfurt am Main HRB 127869\nRegisterbekanntmachung nach dem Umwandlungsgesetz 07.02.2025 (Eintragungsdatum)\n\nGrowthUp+ UG (haftungsbeschränkt)\nGesellschaft mit beschränkter Haftung\nFrankfurt am Main\n\nDen Gläubigern der an der Verschmelzung beteiligten Rechtsträger ist, wenn sie binnen sechs Monaten nach dem Tag, an dem die Eintragung der Verschmelzung in das Register des Sitzes desjenigen Rechtsträgers, dessen Gläubiger sie sind, nach § 19 Absatz 3 UmwG bekannt gemacht worden ist, ihren Anspruch nach Grund und Höhe schriftlich anmelden, Sicherheit zu leisten, soweit sie nicht Befriedigung verlangen können. Dieses Recht steht den Gläubigern jedoch nur zu, wenn sie glaubhaft machen, dass durch die Verschmelzung die Erfüllung ihrer Forderung gefährdet wird."
    },
    {
      "date": "2025-02-07",
      "id": "100812",
      "original_text": "Registerbekanntmachung nach dem Umwandlungsgesetz\nHessen Amtsgericht Wetzlar HRB 9287\nLogFash GmbH – Wetzlar",
      "type": "Registerbekanntmachung nach dem Umwandlungsgesetz",
      "state": "Hessen",
      "amtsgericht": "Amtsgericht Wetzlar",
      "registernummer": "HRB 9287",
      "registerart": "HRB",
      "company_name": "LogFash GmbH",
      "company_seat": "Wetzlar",
      "details": "07.02.2025 (Bekanntmachungsdatum)\n\nHessen Amtsgericht Wetzlar HRB 9287\nRegisterbekanntmachung nach dem Umwandlungsgesetz 07.02.2025 (Eintragungsdatum)\n\nLogFash GmbH\nGesellschaft mit beschränkter Haftung\nWetzlar\n\nDen Gläubigern der an der Verschmelzung beteiligten Rechtsträger ist, wenn sie binnen sechs Monaten nach dem Tag, an dem die Eintragung der Verschmelzung in das Register des Sitzes desjenigen Rechtsträgers, dessen Gläubiger sie sind, nach § 19 Absatz 3 UmwG bekannt gemacht worden ist, ihren Anspruch nach Grund und Höhe schriftlich anmelden, Sicherheit zu leisten, soweit sie nicht Befriedigung verlangen können. Dieses Recht steht den Gläubigern jedoch nur zu, wenn sie glaubhaft machen, dass durch die Verschmelzung die Erfüllung ihrer Forderung gefährdet wird."
    },
    {
      "date": "2025-02-07",
      "id": "100813",
      "original_text": "Registerbekanntmachung nach dem Umwandlungsgesetz\nHessen Amtsgericht Wetzlar HRB 9278\nS.O.F.T. services GmbH – Wetzlar",
      "type": "Registerbekanntmachung nach dem Umwandlungsgesetz",
      "state": "Hessen",
      "amtsgericht": "Amtsgericht Wetzlar",
      "registernummer": "HRB 9278",
      "registerart": "HRB",
      "company_name": "S.O.F.T. services GmbH",
      "company_seat": "Wetzlar",
      "details": "07.02.2025 (Bekanntmachungsdatum)\n\nHessen Amtsgericht Wetzlar HRB 9278\nRegisterbekanntmachung nach dem Umwandlungsgesetz 07.02.2025 (Eintragungsdatum)\n\nS.O.F.T. services GmbH\nGesellschaft mit beschränkter Haftung\nWetzlar\n\nDen Gläubigern der an der Verschmelzung beteiligten Rechtsträger ist, wenn sie binnen sechs Monaten nach dem Tag, an dem die Eintragung der Verschmelzung in das Register des Sitzes desjenigen Rechtsträgers, dessen Gläubiger sie sind, nach § 19 Absatz 3 UmwG bekannt gemacht worden ist, ihren Anspruch nach Grund und Höhe schriftlich anmelden, Sicherheit zu leisten, soweit sie nicht Befriedigung verlangen können. Dieses Recht steht den Gläubigern jedoch nur zu, wenn sie glaubhaft machen, dass durch die Verschmelzung die Erfüllung ihrer Forderung gefährdet wird."
    },
    {
      "date": "2025-02-07",
      "id": "100814",
      "original_text": "Löschungsankündigung\nHessen Amtsgericht Gießen HRB 11637\nPP Processing GmbH – Allendorf (Lumda)",
      "type": "Löschungsankündigung",
      "state": "Hessen",
      "amtsgericht": "Amtsgericht Gießen",
      "registernummer": "HRB 11637",
      "registerart": "HRB",
      "company_name": "PP Processing GmbH",
      "company_seat": "Allendorf (Lumda)",
      "details": "07.02.2025 (Bekanntmachungsdatum)\n\nHessen Amtsgericht Gießen HRB 11637\nLöschungsankündigung\n\nPP Processing GmbH\nGesellschaft mit beschränkter Haftung\nAllendorf (Lumda)\n\nAuf Antrag des Finanzamtes ist beabsichtigt die Gesellschaft wegen Vermögenslosigkeit gem. § 394 FamFG von Amts wegen zu löschen.\n\nHiergegen kann innerhalb von drei Monaten nach dieser Veröffentlichung Widerspruch bei dem Amtsgericht Gießen eingelegt werden.\n\nSollte Widerspruch eingelegt werden, dürfte dies nur mit Begründung erfolgsversprechend sein. Insbesondere sollte vorhandenes Vermögen der Gesellschaft innerhalb der genannten Frist nachgewiesen werden."
    },
    {
      "date": "2025-02-07",
      "id": "100815",
      "original_text": "Registerbekanntmachung nach dem Umwandlungsgesetz\nHessen Amtsgericht Frankfurt am Main HRB 137349\nFrankfurt Opernplatz 2 Beteiligung II GmbH – Frankfurt am Main",
      "type": "Registerbekanntmachung nach dem Umwandlungsgesetz",
      "state": "Hessen",
      "amtsgericht": "Amtsgericht Frankfurt am Main",
      "registernummer": "HRB 137349",
      "registerart": "HRB",
      "company_name": "Frankfurt Opernplatz 2 Beteiligung II GmbH",
      "company_seat": "Frankfurt am Main",
      "details": "07.02.2025 (Bekanntmachungsdatum)\n\nHessen Amtsgericht Frankfurt am Main HRB 137349\nRegisterbekanntmachung nach dem Umwandlungsgesetz 07.02.2025 (Eintragungsdatum)\n\nFrankfurt Opernplatz 2 Beteiligung II GmbH\nGesellschaft mit beschränkter Haftung\nFrankfurt am Main\n\nDen Gläubigern der an der formwechselnden Umwandlung beteiligten Rechtsträger ist, wenn sie binnen sechs Monaten nach dem Tag, an dem die Eintragung der formwechselnden Umwandlung in das Register des Sitzes desjenigen Rechtsträgers, dessen Gläubiger sie sind, nach § 201 UmwG bekannt gemacht worden ist, ihren Anspruch nach Grund und Höhe schriftlich anmelden, Sicherheit zu leisten, soweit sie nicht Befriedigung verlangen können. Dieses Recht steht den Gläubigern jedoch nur zu, wenn sie glaubhaft machen, dass durch die formwechselnden Umwandlung die Erfüllung ihrer Forderung gefährdet wird."
    },
    {
      "date": "2025-02-07",
      "id": "100816",
      "original_text": "Registerbekanntmachung nach dem Umwandlungsgesetz\nHessen Amtsgericht Frankfurt am Main HRB 137348\nFrankfurt Opernplatz 2 Beteiligung I GmbH – Frankfurt am Main",
      "type": "Registerbekanntmachung nach dem Umwandlungsgesetz",
      "state": "Hessen",
      "amtsgericht": "Amtsgericht Frankfurt am Main",
      "registernummer": "HRB 137348",
      "registerart": "HRB",
      "company_name": "Frankfurt Opernplatz 2 Beteiligung I GmbH",
      "company_seat": "Frankfurt am Main",
      "details": "07.02.2025 (Bekanntmachungsdatum)\n\nHessen Amtsgericht Frankfurt am Main HRB 137348\nRegisterbekanntmachung nach dem Umwandlungsgesetz 07.02.2025 (Eintragungsdatum)\n\nFrankfurt Opernplatz 2 Beteiligung I GmbH\nGesellschaft mit beschränkter Haftung\nFrankfurt am Main\n\nDen Gläubigern der an der formwechselnden Umwandlung beteiligten Rechtsträger ist, wenn sie binnen sechs Monaten nach dem Tag, an dem die Eintragung der formwechselnden Umwandlung in das Register des Sitzes desjenigen Rechtsträgers, dessen Gläubiger sie sind, nach § 201 UmwG bekannt gemacht worden ist, ihren Anspruch nach Grund und Höhe schriftlich anmelden, Sicherheit zu leisten, soweit sie nicht Befriedigung verlangen können. Dieses Recht steht den Gläubigern jedoch nur zu, wenn sie glaubhaft machen, dass durch die formwechselnden Umwandlung die Erfüllung ihrer Forderung gefährdet wird."
    },
    {
      "date": "2025-02-07",
      "id": "100817",
      "original_text": "Registerbekanntmachung nach dem Umwandlungsgesetz\nHessen Amtsgericht Frankfurt am Main HRB 101805\nForsthaus Verwaltungs GmbH – Frankfurt am Main",
      "type": "Registerbekanntmachung nach dem Umwandlungsgesetz",
      "state": "Hessen",
      "amtsgericht": "Amtsgericht Frankfurt am Main",
      "registernummer": "HRB 101805",
      "registerart": "HRB",
      "company_name": "Forsthaus Verwaltungs GmbH",
      "company_seat": "Frankfurt am Main",
      "details": "07.02.2025 (Bekanntmachungsdatum)\n\nHessen Amtsgericht Frankfurt am Main HRB 101805\nRegisterbekanntmachung nach dem Umwandlungsgesetz 07.02.2025 (Eintragungsdatum)\n\nForsthaus Verwaltungs GmbH\nGesellschaft mit beschränkter Haftung\nFrankfurt am Main\n\nDen Gläubigern der an der Verschmelzung beteiligten Rechtsträger ist, wenn sie binnen sechs Monaten nach dem Tag, an dem die Eintragung der Verschmelzung in das Register des Sitzes desjenigen Rechtsträgers, dessen Gläubiger sie sind, nach § 19 Absatz 3 UmwG bekannt gemacht worden ist, ihren Anspruch nach Grund und Höhe schriftlich anmelden, Sicherheit zu leisten, soweit sie nicht Befriedigung verlangen können. Dieses Recht steht den Gläubigern jedoch nur zu, wenn sie glaubhaft machen, dass durch die Verschmelzung die Erfüllung ihrer Forderung gefährdet wird."
    },
    {
      "date": "2025-02-07",
      "id": "100818",
      "original_text": "Registerbekanntmachung nach dem Umwandlungsgesetz\nHessen Amtsgericht Frankfurt am Main HRB 105671\nAlCo Verwaltungs GmbH – Frankfurt am Main",
      "type": "Registerbekanntmachung nach dem Umwandlungsgesetz",
      "state": "Hessen",
      "amtsgericht": "Amtsgericht Frankfurt am Main",
      "registernummer": "HRB 105671",
      "registerart": "HRB",
      "company_name": "AlCo Verwaltungs GmbH",
      "company_seat": "Frankfurt am Main",
      "details": "07.02.2025 (Bekanntmachungsdatum)\n\nHessen Amtsgericht Frankfurt am Main HRB 105671\nRegisterbekanntmachung nach dem Umwandlungsgesetz 07.02.2025 (Eintragungsdatum)\n\nAlCo Verwaltungs GmbH\nGesellschaft mit beschränkter Haftung\nFrankfurt am Main\n\nDen Gläubigern der an der Verschmelzung beteiligten Rechtsträger ist, wenn sie binnen sechs Monaten nach dem Tag, an dem die Eintragung der Verschmelzung in das Register des Sitzes desjenigen Rechtsträgers, dessen Gläubiger sie sind, nach § 19 Absatz 3 UmwG bekannt gemacht worden ist, ihren Anspruch nach Grund und Höhe schriftlich anmelden, Sicherheit zu leisten, soweit sie nicht Befriedigung verlangen können. Dieses Recht steht den Gläubigern jedoch nur zu, wenn sie glaubhaft machen, dass durch die Verschmelzung die Erfüllung ihrer Forderung gefährdet wird."
    },
    {
      "date": "2025-02-07",
      "id": "100819",
      "original_text": "Registerbekanntmachung nach dem Umwandlungsgesetz\nHessen Amtsgericht Frankfurt am Main HRA 54065\nFrankfurt Opernplatz 2 Beteiligung II GmbH & Co. KG. – Frankfurt am Main",
      "type": "Registerbekanntmachung nach dem Umwandlungsgesetz",
      "state": "Hessen",
      "amtsgericht": "Amtsgericht Frankfurt am Main",
      "registernummer": "HRA 54065",
      "registerart": "HRA",
      "company_name": "Frankfurt Opernplatz 2 Beteiligung II GmbH & Co. KG.",
      "company_seat": "Frankfurt am Main",
      "details": "07.02.2025 (Bekanntmachungsdatum)\n\nHessen Amtsgericht Frankfurt am Main HRA 54065\nRegisterbekanntmachung nach dem Umwandlungsgesetz 07.02.2025 (Eintragungsdatum)\n\nFrankfurt Opernplatz 2 Beteiligung II GmbH & Co. KG.\nKommanditgesellschaft\nFrankfurt am Main\n\nDen Gläubigern der an der formwechselnden Umwandlung beteiligten Rechtsträger ist, wenn sie binnen sechs Monaten nach dem Tag, an dem die Eintragung der formwechselnden Umwandlung in das Register des Sitzes desjenigen Rechtsträgers, dessen Gläubiger sie sind, nach § 201 UmwG bekannt gemacht worden ist, ihren Anspruch nach Grund und Höhe schriftlich anmelden, Sicherheit zu leisten, soweit sie nicht Befriedigung verlangen können. Dieses Recht steht den Gläubigern jedoch nur zu, wenn sie glaubhaft machen, dass durch die formwechselnden Umwandlung die Erfüllung ihrer Forderung gefährdet wird."
    },
    {
      "date": "2025-02-07",
      "id": "100820",
      "original_text": "Registerbekanntmachung nach dem Umwandlungsgesetz\nHessen Amtsgericht Frankfurt am Main HRB 126584\nConcepts4Leaders GmbH – Frankfurt am Main",
      "type": "Registerbekanntmachung nach dem Umwandlungsgesetz",
      "state": "Hessen",
      "amtsgericht": "Amtsgericht Frankfurt am Main",
      "registernummer": "HRB 126584",
      "registerart": "HRB",
      "company_name": "Concepts4Leaders GmbH",
      "company_seat": "Frankfurt am Main",
      "details": "07.02.2025 (Bekanntmachungsdatum)\n\nHessen Amtsgericht Frankfurt am Main HRB 126584\nRegisterbekanntmachung nach dem Umwandlungsgesetz 07.02.2025 (Eintragungsdatum)\n\nConcepts4Leaders GmbH\nGesellschaft mit beschränkter Haftung\nFrankfurt am Main\n\nDen Gläubigern der an der Verschmelzung beteiligten Rechtsträger ist, wenn sie binnen sechs Monaten nach dem Tag, an dem die Eintragung der Verschmelzung in das Register des Sitzes desjenigen Rechtsträgers, dessen Gläubiger sie sind, nach § 19 Absatz 3 UmwG bekannt gemacht worden ist, ihren Anspruch nach Grund und Höhe schriftlich anmelden, Sicherheit zu leisten, soweit sie nicht Befriedigung verlangen können. Dieses Recht steht den Gläubigern jedoch nur zu, wenn sie glaubhaft machen, dass durch die Verschmelzung die Erfüllung ihrer Forderung gefährdet wird."
    },
    {
      "date": "2025-02-07",
      "id": "100821",
      "original_text": "Registerbekanntmachung nach dem Umwandlungsgesetz\nHessen Amtsgericht Wetzlar HRB 9278\nS.O.F.T. services GmbH – Wetzlar",
      "type": "Registerbekanntmachung nach dem Umwandlungsgesetz",
      "state": "Hessen",
      "amtsgericht": "Amtsgericht Wetzlar",
      "registernummer": "HRB 9278",
      "registerart": "HRB",
      "company_name": "S.O.F.T. services GmbH",
      "company_seat": "Wetzlar",
      "details": "07.02.2025 (Bekanntmachungsdatum)\n\nHessen Amtsgericht Wetzlar HRB 9278\nRegisterbekanntmachung nach dem Umwandlungsgesetz 07.02.2025 (Eintragungsdatum)\n\nS.O.F.T. services GmbH\nGesellschaft mit beschränkter Haftung\nWetzlar\n\nDen Gläubigern der an der Verschmelzung beteiligten Rechtsträger ist, wenn sie binnen sechs Monaten nach dem Tag, an dem die Eintragung der Verschmelzung in das Register des Sitzes desjenigen Rechtsträgers, dessen Gläubiger sie sind, nach § 19 Absatz 3 UmwG bekannt gemacht worden ist, ihren Anspruch nach Grund und Höhe schriftlich anmelden, Sicherheit zu leisten, soweit sie nicht Befriedigung verlangen können. Dieses Recht steht den Gläubigern jedoch nur zu, wenn sie glaubhaft machen, dass durch die Verschmelzung die Erfüllung ihrer Forderung gefährdet wird."
    },
    {
      "date": "2025-02-07",
      "id": "100822",
      "original_text": "Registerbekanntmachung nach dem Umwandlungsgesetz\nHessen Amtsgericht Frankfurt am Main HRA 54066\nFrankfurt Opernplatz 2 Beteiligung I GmbH & Co. KG. – Frankfurt am Main",
      "type": "Registerbekanntmachung nach dem Umwandlungsgesetz",
      "state": "Hessen",
      "amtsgericht": "Amtsgericht Frankfurt am Main",
      "registernummer": "HRA 54066",
      "registerart": "HRA",
      "company_name": "Frankfurt Opernplatz 2 Beteiligung I GmbH & Co. KG.",
      "company_seat": "Frankfurt am Main",
      "details": "07.02.2025 (Bekanntmachungsdatum)\n\nHessen Amtsgericht Frankfurt am Main HRA 54066\nRegisterbekanntmachung nach dem Umwandlungsgesetz 07.02.2025 (Eintragungsdatum)\n\nFrankfurt Opernplatz 2 Beteiligung I GmbH & Co. KG.\nKommanditgesellschaft\nFrankfurt am Main\n\nDen Gläubigern der an der formwechselnden Umwandlung beteiligten Rechtsträger ist, wenn sie binnen sechs Monaten nach dem Tag, an dem die Eintragung der formwechselnden Umwandlung in das Register des Sitzes desjenigen Rechtsträgers, dessen Gläubiger sie sind, nach § 19 Absatz 3 UmwG bekannt gemacht worden ist, ihren Anspruch nach Grund und Höhe schriftlich anmelden, Sicherheit zu leisten, soweit sie nicht Befriedigung verlangen können. Dieses Recht steht den Gläubigern jedoch nur zu, wenn sie glaubhaft machen, dass durch die formwechselnden Umwandlung die Erfüllung ihrer Forderung gefährdet wird."
    },
    {
      "date": "2025-02-07",
      "id": "100823",
      "original_text": "Registerbekanntmachung nach dem Umwandlungsgesetz\nHessen Amtsgericht Frankfurt am Main HRB 124675\nWFV Consulting GmbH – Frankfurt am Main",
      "type": "Registerbekanntmachung nach dem Umwandlungsgesetz",
      "state": "Hessen",
      "amtsgericht": "Amtsgericht Frankfurt am Main",
      "registernummer": "HRB 124675",
      "registerart": "HRB",
      "company_name": "WFV Consulting GmbH",
      "company_seat": "Frankfurt am Main",
      "details": "07.02.2025 (Bekanntmachungsdatum)\n\nHessen Amtsgericht Frankfurt am Main HRB 124675\nRegisterbekanntmachung nach dem Umwandlungsgesetz 07.02.2025 (Eintragungsdatum)\n\nWFV Consulting GmbH\nGesellschaft mit beschränkter Haftung\nFrankfurt am Main\n\nDen Gläubigern der an der Verschmelzung beteiligten Rechtsträger ist, wenn sie binnen sechs Monaten nach dem Tag, an dem die Eintragung der Verschmelzung in das Register des Sitzes desjenigen Rechtsträgers, dessen Gläubiger sie sind, nach § 19 Absatz 3 UmwG bekannt gemacht worden ist, ihren Anspruch nach Grund und Höhe schriftlich anmelden, Sicherheit zu leisten, soweit sie nicht Befriedigung verlangen können. Dieses Recht steht den Gläubigern jedoch nur zu, wenn sie glaubhaft machen, dass durch die Verschmelzung die Erfüllung ihrer Forderung gefährdet wird."
    },
    {
      "date": "2025-02-07",
      "id": "100824",
      "original_text": "Sonstige Registerbekanntmachung\nHessen Amtsgericht Offenbach am Main VR 5669\nNanus – Langen (Hessen)",
      "type": "Sonstige Registerbekanntmachung",
      "state": "Hessen",
      "amtsgericht": "Amtsgericht Offenbach am Main",
      "registernummer": "VR 5669",
      "registerart": "VR",
      "company_name": "Nanus",
      "company_seat": "Langen (Hessen)",
      "details": "07.02.2025 (Bekanntmachungsdatum)\n\nHessen Amtsgericht Offenbach am Main VR 5669\nSonstige Registerbekanntmachung 07.02.2025 (Eintragungsdatum)\n\nNanus\neingetragener Verein\nLangen (Hessen)"
    },
    {
      "date": "2025-02-07",
      "id": "100825",
      "original_text": "Löschungsankündigung\nHessen Amtsgericht Frankfurt am Main HRB 98190\nTech Distribution GmbH – Frankfurt am Main",
      "type": "Löschungsankündigung",
      "state": "Hessen",
      "amtsgericht": "Amtsgericht Frankfurt am Main",
      "registernummer": "HRB 98190",
      "registerart": "HRB",
      "company_name": "Tech Distribution GmbH",
      "company_seat": "Frankfurt am Main",
      "details": "07.02.2025 (Bekanntmachungsdatum)\n\nHessen Amtsgericht Frankfurt am Main HRB 98190\nLöschungsankündigung\n\nTech Distribution GmbH\nGesellschaft mit beschränkter Haftung\nFrankfurt am Main\n\nDas Registergericht beabsichtigt die im Handelsregister eingetragene Gesellschaft von Amts wegen nach § 394 FamFG zu löschen. Die Frist zur Erhebung eines Widerspruchs gegen die beabsichtigte Löschung wird auf 1 Monat festgesetzt."
    },
    {
      "date": "2025-02-07",
      "id": "100826",
      "original_text": "Einreichung neuer Dokumente\nHessen Amtsgericht Frankfurt am Main HRB 121503\nFraSec Services GmbH – Frankfurt am Main",
      "type": "Einreichung neuer Dokumente",
      "state": "Hessen",
      "amtsgericht": "Amtsgericht Frankfurt am Main",
      "registernummer": "HRB 121503",
      "registerart": "HRB",
      "company_name": "FraSec Services GmbH",
      "company_seat": "Frankfurt am Main",
      "details": "07.02.2025 (Bekanntmachungsdatum)\n\nHessen Amtsgericht Frankfurt am Main HRB 121503\nEinreichung neuer Dokumente 05.02.2025 (Eintragungsdatum)\n\nFraSec Services GmbH\nGesellschaft mit beschränkter Haftung\nFrankfurt am Main\n\nDurch eine Änderung in den Personen der Aufsichtsratsmitglieder ist eine Liste der Mitglieder des Aufsichtsrates zum Handelsregister eingereicht worden."
    },
    {
      "date": "2025-02-07",
      "id": "100827",
      "original_text": "Registerbekanntmachung nach dem Umwandlungsgesetz\nHessen Amtsgericht Frankfurt am Main HRB 107071\nWhaleForest Ventures GmbH – Frankfurt am Main",
      "type": "Registerbekanntmachung nach dem Umwandlungsgesetz",
      "state": "Hessen",
      "amtsgericht": "Amtsgericht Frankfurt am Main",
      "registernummer": "HRB 107071",
      "registerart": "HRB",
      "company_name": "WhaleForest Ventures GmbH",
      "company_seat": "Frankfurt am Main",
      "details": "07.02.2025 (Bekanntmachungsdatum)\n\nHessen Amtsgericht Frankfurt am Main HRB 107071\nRegisterbekanntmachung nach dem Umwandlungsgesetz 07.02.2025 (Eintragungsdatum)\n\nWhaleForest Ventures GmbH\nGesellschaft mit beschränkter Haftung\nFrankfurt am Main\n\nDen Gläubigern der an der Verschmelzung beteiligten Rechtsträger ist, wenn sie binnen sechs Monaten nach dem Tag, an dem die Eintragung der Verschmelzung in das Register des Sitzes desjenigen Rechtsträgers, dessen Gläubiger sie sind, nach § 19 Absatz 3 UmwG bekannt gemacht worden ist, ihren Anspruch nach Grund und Höhe schriftlich anmelden, Sicherheit zu leisten, soweit sie nicht Befriedigung verlangen können. Dieses Recht steht den Gläubigern jedoch nur zu, wenn sie glaubhaft machen, dass durch die Verschmelzung die Erfüllung ihrer Forderung gefährdet wird."
    },
    {
      "date": "2025-02-07",
      "id": "100828",
      "original_text": "Einreichung neuer Dokumente\nHessen Amtsgericht Frankfurt am Main HRB 55461\nLOGPAY Financial Services GmbH – Eschborn",
      "type": "Einreichung neuer Dokumente",
      "state": "Hessen",
      "amtsgericht": "Amtsgericht Frankfurt am Main",
      "registernummer": "HRB 55461",
      "registerart": "HRB",
      "company_name": "LOGPAY Financial Services GmbH",
      "company_seat": "Eschborn",
      "details": "07.02.2025 (Bekanntmachungsdatum)\n\nHessen Amtsgericht Frankfurt am Main HRB 55461\nEinreichung neuer Dokumente\n\nLOGPAY Financial Services GmbH\nGesellschaft mit beschränkter Haftung\nEschborn\n\nDurch eine Änderung in den Personen der Aufsichtsratsmitglieder ist eine Liste der Mitglieder des Aufsichtsrates zum Handelsregister eingereicht worden."
    },
    {
      "date": "2025-02-07",
      "id": "100829",
      "original_text": "Einreichung neuer Dokumente\nHessen Amtsgericht Königstein HRB 7057\nScholl Vermögensverwaltung AG – Königstein im Taunus",
      "type": "Einreichung neuer Dokumente",
      "state": "Hessen",
      "amtsgericht": "Amtsgericht Königstein",
      "registernummer": "HRB 7057",
      "registerart": "HRB",
      "company_name": "Scholl Vermögensverwaltung AG",
      "company_seat": "Königstein im Taunus",
      "details": "07.02.2025 (Bekanntmachungsdatum)\n\nHessen Amtsgericht Königstein HRB 7057\nEinreichung neuer Dokumente 07.02.2025 (Eintragungsdatum)\n\nScholl Vermögensverwaltung AG\nAktiengesellschaft\nKönigstein im Taunus\n\nDurch eine Änderung in den Personen der Aufsichtsratsmitglieder ist eine Liste der Mitglieder des Aufsichtsrates zum Handelsregister eingereicht worden."
    }
  ]
}