{
  "date": "2025-02-08",
  "date_of_scrape": "2025-02-09T04:03:01.134Z",
  "tool_version": "0.2.0",
  "number_of_announcements": 17,
  "announcements": [
    {
      "date": "2025-02-08",
      "id": "100830",
      "original_text": "Registerbekanntmachung nach dem Umwandlungsgesetz\nBayern Amtsgericht Ingolstadt HRB 12177\nSchyren Immobilien GmbH – Scheyern",
      "type": "Registerbekanntmachung nach dem Umwandlungsgesetz",
      "state": "Bayern",
      "amtsgericht": "Amtsgericht Ingolstadt",
      "registernummer": "HRB 12177",
      "registerart": "HRB",
      "company_name": "Schyren Immobilien GmbH",
      "company_seat": "Scheyern",
      "details": "08.02.2025 (Bekanntmachungsdatum)\n\nBayern Amtsgericht Ingolstadt HRB 12177\nRegisterbekanntmachung nach dem Umwandlungsgesetz 07.02.2025 (Eintragungsdatum)\n\nSchyren Immobilien GmbH\nGesellschaft mit beschränkter Haftung\nScheyern\n\nDen Gläubigern der an der Ausgliederung beteiligten Rechtsträger ist, wenn sie binnen sechs Monaten nach dem Tag, an dem die Eintragung der Ausgliederung in das Register des Sitzes desjenigen Rechtsträgers, dessen Gläubiger sie sind, nach §§ 125, 19 Abs. 3 UmwG als bekannt gemacht gilt, ihren Anspruch nach Grund und Höhe in Textform anmelden, Sicherheit zu leisten, soweit sie nicht Befriedigung verlangen können. Dieses Recht steht den Gläubigern jedoch nur zu, wenn sie glaubhaft machen, dass durch die Ausgliederung die Erfüllung ihrer Forderung gefährdet wird."
    },
    {
      "date": "2025-02-08",
      "id": "100831",
      "original_text": "Registerbekanntmachung nach dem Umwandlungsgesetz\nBayern Amtsgericht München HRB 97798\nSynergy Microwave Europe Verwaltung GmbH – München",
      "type": "Registerbekanntmachung nach dem Umwandlungsgesetz",
      "state": "Bayern",
      "amtsgericht": "Amtsgericht München",
      "registernummer": "HRB 97798",
      "registerart": "HRB",
      "company_name": "Synergy Microwave Europe Verwaltung GmbH",
      "company_seat": "München",
      "details": "08.02.2025 (Bekanntmachungsdatum)\n\nBayern Amtsgericht München HRB 97798\nRegisterbekanntmachung nach dem Umwandlungsgesetz 07.02.2025 (Eintragungsdatum)\n\nSynergy Microwave Europe Verwaltung GmbH\nGesellschaft mit beschränkter Haftung\nMünchen\n\nDen Gläubigern der an der Verschmelzung beteiligten Rechtsträger ist, wenn sie binnen sechs Monaten nach dem Tag, an dem die Eintragung der Verschmelzung in das Register des Sitzes desjenigen Rechtsträgers, dessen Gläubiger sie sind, nach § 19 Abs. 3 UmwG als bekannt gemacht gilt, ihren Anspruch nach Grund und Höhe in Textform anmelden, Sicherheit zu leisten, soweit sie nicht Befriedigung verlangen können. Dieses Recht steht den Gläubigern jedoch nur zu, wenn sie glaubhaft machen, dass durch die Verschmelzung die Erfüllung ihrer Forderung gefährdet wird."
    },
    {
      "date": "2025-02-08",
      "id": "100832",
      "original_text": "Registerbekanntmachung nach dem Umwandlungsgesetz\nBayern Amtsgericht Passau HRB 1299\nGZ - Diskotheken Verwaltungs GmbH – Innernzell",
      "type": "Registerbekanntmachung nach dem Umwandlungsgesetz",
      "state": "Bayern",
      "amtsgericht": "Amtsgericht Passau",
      "registernummer": "HRB 1299",
      "registerart": "HRB",
      "company_name": "GZ - Diskotheken Verwaltungs GmbH",
      "company_seat": "Innernzell",
      "details": "08.02.2025 (Bekanntmachungsdatum)\n\nBayern Amtsgericht Passau HRB 1299\nRegisterbekanntmachung nach dem Umwandlungsgesetz 07.02.2025 (Eintragungsdatum)\n\nGZ - Diskotheken Verwaltungs GmbH\nGesellschaft mit beschränkter Haftung\nInnernzell\n\nDen Gläubigern der an der Verschmelzung beteiligten Rechtsträger ist, wenn sie binnen sechs Monaten nach dem Tag, an dem die Eintragung der Verschmelzung in das Register des Sitzes desjenigen Rechtsträgers, dessen Gläubiger sie sind, nach § 19 Abs. 3 UmwG als bekannt gemacht gilt, ihren Anspruch nach Grund und Höhe in Textform anmelden, Sicherheit zu leisten, soweit sie nicht Befriedigung verlangen können. Dieses Recht steht den Gläubigern jedoch nur zu, wenn sie glaubhaft machen, dass durch die Verschmelzung die Erfüllung ihrer Forderung gefährdet wird."
    },
    {
      "date": "2025-02-08",
      "id": "100833",
      "original_text": "Registerbekanntmachung nach dem Umwandlungsgesetz\nBayern Amtsgericht Ingolstadt HRA 4259\nLukas Sammetinger e. K. – Pfaffenhofen a.d.Ilm",
      "type": "Registerbekanntmachung nach dem Umwandlungsgesetz",
      "state": "Bayern",
      "amtsgericht": "Amtsgericht Ingolstadt",
      "registernummer": "HRA 4259",
      "registerart": "HRA",
      "company_name": "Lukas Sammetinger e. K.",
      "company_seat": "Pfaffenhofen a.d.Ilm",
      "details": "08.02.2025 (Bekanntmachungsdatum)\n\nBayern Amtsgericht Ingolstadt HRA 4259\nRegisterbekanntmachung nach dem Umwandlungsgesetz 07.02.2025 (Eintragungsdatum)\n\nLukas Sammetinger e. K.\nEinzelkaufmann / Einzelkauffrau\nPfaffenhofen a.d.Ilm\n\nDen Gläubigern der an der Ausgliederung beteiligten Rechtsträger ist, wenn sie binnen sechs Monaten nach dem Tag, an dem die Eintragung der Ausgliederung in das Register des Sitzes desjenigen Rechtsträgers, dessen Gläubiger sie sind, nach §§ 125, 19 Abs. 3 UmwG als bekannt gemacht gilt, ihren Anspruch nach Grund und Höhe in Textform anmelden, Sicherheit zu leisten, soweit sie nicht Befriedigung verlangen können. Dieses Recht steht den Gläubigern jedoch nur zu, wenn sie glaubhaft machen, dass durch die Ausgliederung die Erfüllung ihrer Forderung gefährdet wird."
    },
    {
      "date": "2025-02-08",
      "id": "100834",
      "original_text": "Registerbekanntmachung nach dem Umwandlungsgesetz\nBayern Amtsgericht München HRA 120281\nMartin Neugebauer Maler- und Trockenbau e.K. – Zolling",
      "type": "Registerbekanntmachung nach dem Umwandlungsgesetz",
      "state": "Bayern",
      "amtsgericht": "Amtsgericht München",
      "registernummer": "HRA 120281",
      "registerart": "HRA",
      "company_name": "Martin Neugebauer Maler- und Trockenbau e.K.",
      "company_seat": "Zolling",
      "details": "08.02.2025 (Bekanntmachungsdatum)\n\nBayern Amtsgericht München HRA 120281\nRegisterbekanntmachung nach dem Umwandlungsgesetz 07.02.2025 (Eintragungsdatum)\n\nMartin Neugebauer Maler- und Trockenbau e.K.\nEinzelkaufmann / Einzelkauffrau\nZolling\n\nDen Gläubigern der an der Ausgliederung beteiligten Rechtsträger ist, wenn sie binnen sechs Monaten nach dem Tag, an dem die Eintragung der Ausgliederung in das Register des Sitzes desjenigen Rechtsträgers, dessen Gläubiger sie sind, nach §§ 125, 19 Abs. 3 UmwG als bekannt gemacht gilt, ihren Anspruch nach Grund und Höhe in Textform anmelden, Sicherheit zu leisten, soweit sie nicht Befriedigung verlangen können. Dieses Recht steht den Gläubigern jedoch nur zu, wenn sie glaubhaft machen, dass durch die Ausgliederung die Erfüllung ihrer Forderung gefährdet wird."
    },
    {
      "date": "2025-02-08",
      "id": "100835",
      "original_text": "Sonstige Registerbekanntmachung\nBayern Amtsgericht Aschaffenburg HRB 14118\nElb-Schliff Werkzeugmaschinen GmbH – Aschaffenburg",
      "type": "Sonstige Registerbekanntmachung",
      "state": "Bayern",
      "amtsgericht": "Amtsgericht Aschaffenburg",
      "registernummer": "HRB 14118",
      "registerart": "HRB",
      "company_name": "Elb-Schliff Werkzeugmaschinen GmbH",
      "company_seat": "Aschaffenburg",
      "details": "08.02.2025 (Bekanntmachungsdatum)\n\nBayern Amtsgericht Aschaffenburg HRB 14118\nSonstige Registerbekanntmachung 07.02.2025 (Eintragungsdatum)\n\nElb-Schliff Werkzeugmaschinen GmbH\nGesellschaft mit beschränkter Haftung\nAschaffenburg\n\nDen Gläubigern der Gesellschaft, deren Forderungen begründet worden sind, bevor die Eintragung der Beendigung des Gewinnabführungsvertrages in das Handelsregister nach § 10 des Handelsgesetzbuches als bekanntgemacht gilt, hat der andere Vertragsteil Sicherheit zu leisten, wenn sie sich binnen sechs Monaten nach der Bekanntmachung der Eintragung zu diesem Zweck bei ihm melden."
    },
    {
      "date": "2025-02-08",
      "id": "100836",
      "original_text": "Einreichung neuer Dokumente\nBayern Amtsgericht Regensburg HRB 15542\nHeiQ RAS AG – Regensburg",
      "type": "Einreichung neuer Dokumente",
      "state": "Bayern",
      "amtsgericht": "Amtsgericht Regensburg",
      "registernummer": "HRB 15542",
      "registerart": "HRB",
      "company_name": "HeiQ RAS AG",
      "company_seat": "Regensburg",
      "details": "08.02.2025 (Bekanntmachungsdatum)\n\nBayern Amtsgericht Regensburg HRB 15542\nEinreichung neuer Dokumente\n\nHeiQ RAS AG\nAktiengesellschaft\nRegensburg\n\nDem Amtsgericht Regensburg -Registergericht- ist eine Liste der Mitglieder des Aufsichtsrats eingereicht worden, § 106 AktG."
    },
    {
      "date": "2025-02-08",
      "id": "100837",
      "original_text": "Einreichung neuer Dokumente\nBayern Amtsgericht München HRB 185340\nArabella Hospitality SE – München",
      "type": "Einreichung neuer Dokumente",
      "state": "Bayern",
      "amtsgericht": "Amtsgericht München",
      "registernummer": "HRB 185340",
      "registerart": "HRB",
      "company_name": "Arabella Hospitality SE",
      "company_seat": "München",
      "details": "08.02.2025 (Bekanntmachungsdatum)\n\nBayern Amtsgericht München HRB 185340\nEinreichung neuer Dokumente 07.02.2025 (Eintragungsdatum)\n\nArabella Hospitality SE\nEuropäische Aktiengesellschaft (SE)\nMünchen\n\nDem Amtsgericht München -Registergericht- ist eine Liste der Mitglieder des Aufsichtsrats eingereicht worden, Art. 9 Abs. 1 Buchst. c (ii) SE-VO i.V.m. § 106 AktG."
    },
    {
      "date": "2025-02-08",
      "id": "100838",
      "original_text": "Registerbekanntmachung nach dem Umwandlungsgesetz\nBayern Amtsgericht München HRB 294773\nSilk Road HoldCo GmbH – München",
      "type": "Registerbekanntmachung nach dem Umwandlungsgesetz",
      "state": "Bayern",
      "amtsgericht": "Amtsgericht München",
      "registernummer": "HRB 294773",
      "registerart": "HRB",
      "company_name": "Silk Road HoldCo GmbH",
      "company_seat": "München",
      "details": "08.02.2025 (Bekanntmachungsdatum)\n\nBayern Amtsgericht München HRB 294773\nRegisterbekanntmachung nach dem Umwandlungsgesetz 07.02.2025 (Eintragungsdatum)\n\nSilk Road HoldCo GmbH\nGesellschaft mit beschränkter Haftung\nMünchen\n\nDen Gläubigern der an der Verschmelzung beteiligten Rechtsträger ist, wenn sie binnen sechs Monaten nach dem Tag, an dem die Eintragung der Verschmelzung in das Register des Sitzes desjenigen Rechtsträgers, dessen Gläubiger sie sind, nach § 19 Abs. 3 UmwG als bekannt gemacht gilt, ihren Anspruch nach Grund und Höhe in Textform anmelden, Sicherheit zu leisten, soweit sie nicht Befriedigung verlangen können. Dieses Recht steht den Gläubigern jedoch nur zu, wenn sie glaubhaft machen, dass durch die Verschmelzung die Erfüllung ihrer Forderung gefährdet wird."
    },
    {
      "date": "2025-02-08",
      "id": "100839",
      "original_text": "Registerbekanntmachung nach dem Umwandlungsgesetz\nBayern Amtsgericht Passau HRB 1110\nZaglauer GmbH – Innernzell",
      "type": "Registerbekanntmachung nach dem Umwandlungsgesetz",
      "state": "Bayern",
      "amtsgericht": "Amtsgericht Passau",
      "registernummer": "HRB 1110",
      "registerart": "HRB",
      "company_name": "Zaglauer GmbH",
      "company_seat": "Innernzell",
      "details": "08.02.2025 (Bekanntmachungsdatum)\n\nBayern Amtsgericht Passau HRB 1110\nRegisterbekanntmachung nach dem Umwandlungsgesetz 07.02.2025 (Eintragungsdatum)\n\nZaglauer GmbH\nGesellschaft mit beschränkter Haftung\nInnernzell\n\nDen Gläubigern der an der Verschmelzung beteiligten Rechtsträger ist, wenn sie binnen sechs Monaten nach dem Tag, an dem die Eintragung der Verschmelzung in das Register des Sitzes desjenigen Rechtsträgers, dessen Gläubiger sie sind, nach § 19 Abs. 3 UmwG als bekannt gemacht gilt, ihren Anspruch nach Grund und Höhe in Textform anmelden, Sicherheit zu leisten, soweit sie nicht Befriedigung verlangen können. Dieses Recht steht den Gläubigern jedoch nur zu, wenn sie glaubhaft machen, dass durch die Verschmelzung die Erfüllung ihrer Forderung gefährdet wird."
    },
    {
      "date": "2025-02-08",
      "id": "100840",
      "original_text": "Löschungsankündigung\nBayern Amtsgericht München HRB 259998\nMobility Operations GmbH – Wörth",
      "type": "Löschungsankündigung",
      "state": "Bayern",
      "amtsgericht": "Amtsgericht München",
      "registernummer": "HRB 259998",
      "registerart": "HRB",
      "company_name": "Mobility Operations GmbH",
      "company_seat": "Wörth",
      "details": "08.02.2025 (Bekanntmachungsdatum)\n\nBayern Amtsgericht München HRB 259998\nLöschungsankündigung\n\nMobility Operations GmbH\nGesellschaft mit beschränkter Haftung\nWörth\n\nDas Registergericht beabsichtigt, die im Handelsregister eingetragene Gesellschaft wegen Vermögenslosigkeit von Amts wegen nach § 394 FamFG zu löschen. Die Frist zur Erhebung eines Widerspruchs ist auf drei Monate festgesetzt."
    },
    {
      "date": "2025-02-08",
      "id": "100841",
      "original_text": "Registerbekanntmachung nach dem Umwandlungsgesetz\nBayern Amtsgericht München HRB 188989\nGLL Office Management GmbH – München",
      "type": "Registerbekanntmachung nach dem Umwandlungsgesetz",
      "state": "Bayern",
      "amtsgericht": "Amtsgericht München",
      "registernummer": "HRB 188989",
      "registerart": "HRB",
      "company_name": "GLL Office Management GmbH",
      "company_seat": "München",
      "details": "08.02.2025 (Bekanntmachungsdatum)\n\nBayern Amtsgericht München HRB 188989\nRegisterbekanntmachung nach dem Umwandlungsgesetz 07.02.2025 (Eintragungsdatum)\n\nGLL Office Management GmbH\nGesellschaft mit beschränkter Haftung\nMünchen\n\nDen Gläubigern der an der Verschmelzung beteiligten Rechtsträger ist, wenn sie binnen sechs Monaten nach dem Tag, an dem die Eintragung der Verschmelzung in das Register des Sitzes desjenigen Rechtsträgers, dessen Gläubiger sie sind, nach § 19 Abs. 3 UmwG als bekannt gemacht gilt, ihren Anspruch nach Grund und Höhe in Textform anmelden, Sicherheit zu leisten, soweit sie nicht Befriedigung verlangen können. Dieses Recht steht den Gläubigern jedoch nur zu, wenn sie glaubhaft machen, dass durch die Verschmelzung die Erfüllung ihrer Forderung gefährdet wird."
    },
    {
      "date": "2025-02-08",
      "id": "100842",
      "original_text": "Registerbekanntmachung nach dem Umwandlungsgesetz\nBayern Amtsgericht München HRB 167145\nTempus Arte Verwaltungs GmbH – München",
      "type": "Registerbekanntmachung nach dem Umwandlungsgesetz",
      "state": "Bayern",
      "amtsgericht": "Amtsgericht München",
      "registernummer": "HRB 167145",
      "registerart": "HRB",
      "company_name": "Tempus Arte Verwaltungs GmbH",
      "company_seat": "München",
      "details": "08.02.2025 (Bekanntmachungsdatum)\n\nBayern Amtsgericht München HRB 167145\nRegisterbekanntmachung nach dem Umwandlungsgesetz 07.02.2025 (Eintragungsdatum)\n\nTempus Arte Verwaltungs GmbH\nGesellschaft mit beschränkter Haftung\nMünchen\n\nDen Gläubigern der an der Verschmelzung beteiligten Rechtsträger ist, wenn sie binnen sechs Monaten nach dem Tag, an dem die Eintragung der Verschmelzung in das Register des Sitzes desjenigen Rechtsträgers, dessen Gläubiger sie sind, nach § 19 Abs. 3 UmwG als bekannt gemacht gilt, ihren Anspruch nach Grund und Höhe in Textform anmelden, Sicherheit zu leisten, soweit sie nicht Befriedigung verlangen können. Dieses Recht steht den Gläubigern jedoch nur zu, wenn sie glaubhaft machen, dass durch die Verschmelzung die Erfüllung ihrer Forderung gefährdet wird."
    },
    {
      "date": "2025-02-08",
      "id": "100843",
      "original_text": "Löschungsankündigung\nBayern Amtsgericht München HRA 114921\nPRIMUS Concept Pflegeimmobilien Weisweil GmbH & Co. KG – Markt Indersdorf",
      "type": "Löschungsankündigung",
      "state": "Bayern",
      "amtsgericht": "Amtsgericht München",
      "registernummer": "HRA 114921",
      "registerart": "HRA",
      "company_name": "PRIMUS Concept Pflegeimmobilien Weisweil GmbH & Co. KG",
      "company_seat": "Markt Indersdorf",
      "details": "08.02.2025 (Bekanntmachungsdatum)\n\nBayern Amtsgericht München HRA 114921\nLöschungsankündigung 07.02.2025 (Eintragungsdatum)\n\nPRIMUS Concept Pflegeimmobilien Weisweil GmbH & Co. KG\nKommanditgesellschaft\nMarkt Indersdorf\n\nDas Registergericht beabsichtigt, die im Handelsregister eingetragene Gesellschaft wegen Vermögenslosigkeit von Amts wegen nach § 394 FamFG zu löschen. Die Frist zur Erhebung eines Widerspruchs ist auf 2 Monate festgesetzt."
    },
    {
      "date": "2025-02-08",
      "id": "100844",
      "original_text": "Einreichung neuer Dokumente\nBayern Amtsgericht München HRB 153815\nRodenstock GmbH – München",
      "type": "Einreichung neuer Dokumente",
      "state": "Bayern",
      "amtsgericht": "Amtsgericht München",
      "registernummer": "HRB 153815",
      "registerart": "HRB",
      "company_name": "Rodenstock GmbH",
      "company_seat": "München",
      "details": "08.02.2025 (Bekanntmachungsdatum)\n\nBayern Amtsgericht München HRB 153815\nEinreichung neuer Dokumente\n\nRodenstock GmbH\nGesellschaft mit beschränkter Haftung\nMünchen\n\nDem Amtsgericht München -Registergericht- ist eine Liste der Mitglieder des Aufsichtsrats eingereicht worden, § 52 Abs. 3 S. 2 GmbHG."
    },
    {
      "date": "2025-02-08",
      "id": "100845",
      "original_text": "Einreichung neuer Dokumente\nBayern Amtsgericht Augsburg HRB 22709\nKUKA Aktiengesellschaft – Augsburg",
      "type": "Einreichung neuer Dokumente",
      "state": "Bayern",
      "amtsgericht": "Amtsgericht Augsburg",
      "registernummer": "HRB 22709",
      "registerart": "HRB",
      "company_name": "KUKA Aktiengesellschaft",
      "company_seat": "Augsburg",
      "details": "08.02.2025 (Bekanntmachungsdatum)\n\nBayern Amtsgericht Augsburg HRB 22709\nEinreichung neuer Dokumente 07.02.2025 (Eintragungsdatum)\n\nKUKA Aktiengesellschaft\nAktiengesellschaft\nAugsburg\n\nDem Registergericht Augsburg ist eine Liste der Mitglieder des Aufsichtsrats eingereicht worden, § 106 AktG."
    },
    {
      "date": "2025-02-08",
      "id": "100846",
      "original_text": "Registerbekanntmachung nach dem Umwandlungsgesetz\nBayern Amtsgericht Ingolstadt HRB 12183\nContenta GmbH – Pfaffenhofen a.d.Ilm",
      "type": "Registerbekanntmachung nach dem Umwandlungsgesetz",
      "state": "Bayern",
      "amtsgericht": "Amtsgericht Ingolstadt",
      "registernummer": "HRB 12183",
      "registerart": "HRB",
      "company_name": "Contenta GmbH",
      "company_seat": "Pfaffenhofen a.d.Ilm",
      "details": "08.02.2025 (Bekanntmachungsdatum)\n\nBayern Amtsgericht Ingolstadt HRB 12183\nRegisterbekanntmachung nach dem Umwandlungsgesetz 07.02.2025 (Eintragungsdatum)\n\nContenta GmbH\nGesellschaft mit beschränkter Haftung\nPfaffenhofen a.d.Ilm\n\nDen Gläubigern der an der Ausgliederung beteiligten Rechtsträger ist, wenn sie binnen sechs Monaten nach dem Tag, an dem die Eintragung der Ausgliederung in das Register des Sitzes desjenigen Rechtsträgers, dessen Gläubiger sie sind, nach §§ 125, 19 Abs. 3 UmwG als bekannt gemacht gilt, ihren Anspruch nach Grund und Höhe in Textform anmelden, Sicherheit zu leisten, soweit sie nicht Befriedigung verlangen können. Dieses Recht steht den Gläubigern jedoch nur zu, wenn sie glaubhaft machen, dass durch die Ausgliederung die Erfüllung ihrer Forderung gefährdet wird."
    }
  ]
}