{
  "date": "2025-08-30",
  "date_of_scrape": "2025-08-31T04:10:48.441Z",
  "tool_version": "0.2.0",
  "number_of_announcements": 101,
  "announcements": [
    {
      "date": "2025-08-30",
      "id": "125102",
      "original_text": "Registerbekanntmachung nach dem Umwandlungsgesetz\nBayern Amtsgericht München HRB 303555\nElementis Services GmbH – München",
      "type": "Registerbekanntmachung nach dem Umwandlungsgesetz",
      "state": "Bayern",
      "amtsgericht": "Amtsgericht München",
      "registernummer": "HRB 303555",
      "registerart": "HRB",
      "company_name": "Elementis Services GmbH",
      "company_seat": "München",
      "details": "30.08.2025 (Bekanntmachungsdatum)\n\nBayern Amtsgericht München HRB 303555\nRegisterbekanntmachung nach dem Umwandlungsgesetz 29.08.2025 (Eintragungsdatum)\n\nElementis Services GmbH\nGesellschaft mit beschränkter Haftung\nMünchen\n\nDen Gläubigern der an der Verschmelzung beteiligten Rechtsträger ist, wenn sie binnen sechs Monaten nach dem Tag, an dem die Eintragung der Verschmelzung in das Register des Sitzes desjenigen Rechtsträgers, dessen Gläubiger sie sind, nach § 19 Abs. 3 UmwG als bekannt gemacht gilt, ihren Anspruch nach Grund und Höhe in Textform anmelden, Sicherheit zu leisten, soweit sie nicht Befriedigung verlangen können. Dieses Recht steht den Gläubigern jedoch nur zu, wenn sie glaubhaft machen, dass durch die Verschmelzung die Erfüllung ihrer Forderung gefährdet wird."
    },
    {
      "date": "2025-08-30",
      "id": "125103",
      "original_text": "Registerbekanntmachung nach dem Umwandlungsgesetz\nBayern Amtsgericht Augsburg HRB 22613\nVulcan Energy Engineering GmbH – Augsburg",
      "type": "Registerbekanntmachung nach dem Umwandlungsgesetz",
      "state": "Bayern",
      "amtsgericht": "Amtsgericht Augsburg",
      "registernummer": "HRB 22613",
      "registerart": "HRB",
      "company_name": "Vulcan Energy Engineering GmbH",
      "company_seat": "Augsburg",
      "details": "30.08.2025 (Bekanntmachungsdatum)\n\nBayern Amtsgericht Augsburg HRB 22613\nRegisterbekanntmachung nach dem Umwandlungsgesetz 29.08.2025 (Eintragungsdatum)\n\nVulcan Energy Engineering GmbH\nGesellschaft mit beschränkter Haftung\nAugsburg\n\nDen Gläubigern der an der Verschmelzung beteiligten Rechtsträger ist, wenn sie binnen sechs Monaten nach dem Tag, an dem die Eintragung der Verschmelzung in das Register des Sitzes desjenigen Rechtsträgers, dessen Gläubiger sie sind, nach § 19 Abs. 3 UmwG als bekannt gemacht gilt, ihren Anspruch nach Grund und Höhe in Textform anmelden, Sicherheit zu leisten, soweit sie nicht Befriedigung verlangen können. Dieses Recht steht den Gläubigern jedoch nur zu, wenn sie glaubhaft machen, dass durch die Verschmelzung die Erfüllung ihrer Forderung gefährdet wird."
    },
    {
      "date": "2025-08-30",
      "id": "125104",
      "original_text": "Registerbekanntmachung nach dem Umwandlungsgesetz\nBayern Amtsgericht Schweinfurt VR 10159\nBrieftauben-Transportgemeinschaft Rhön e.V. – Schweinfurt",
      "type": "Registerbekanntmachung nach dem Umwandlungsgesetz",
      "state": "Bayern",
      "amtsgericht": "Amtsgericht Schweinfurt",
      "registernummer": "VR 10159",
      "registerart": "VR",
      "company_name": "Brieftauben-Transportgemeinschaft Rhön e.V.",
      "company_seat": "Schweinfurt",
      "details": "30.08.2025 (Bekanntmachungsdatum)\n\nBayern Amtsgericht Schweinfurt VR 10159\nRegisterbekanntmachung nach dem Umwandlungsgesetz 29.08.2025 (Eintragungsdatum)\n\nBrieftauben-Transportgemeinschaft Rhön e.V.\neingetragener Verein\nSchweinfurt\n\nDen Gläubigern der an der Verschmelzung beteiligten Rechtsträger ist, wenn sie binnen sechs Monaten nach dem Tag, an dem die Eintragung der Verschmelzung in das Register des Sitzes desjenigen Rechtsträgers, dessen Gläubiger sie sind, nach § 19 Abs. 3 UmwG als bekannt gemacht gilt, ihren Anspruch nach Grund und Höhe in Textform anmelden, Sicherheit zu leisten, soweit sie nicht Befriedigung verlangen können. Dieses Recht steht den Gläubigern jedoch nur zu, wenn sie glaubhaft machen, dass durch die Verschmelzung die Erfüllung ihrer Forderung gefährdet wird."
    },
    {
      "date": "2025-08-30",
      "id": "125105",
      "original_text": "Registerbekanntmachung nach dem Umwandlungsgesetz\nBayern Amtsgericht Regensburg HRB 6634\nREMA TIP TOP Süd GmbH – Neutraubling",
      "type": "Registerbekanntmachung nach dem Umwandlungsgesetz",
      "state": "Bayern",
      "amtsgericht": "Amtsgericht Regensburg",
      "registernummer": "HRB 6634",
      "registerart": "HRB",
      "company_name": "REMA TIP TOP Süd GmbH",
      "company_seat": "Neutraubling",
      "details": "30.08.2025 (Bekanntmachungsdatum)\n\nBayern Amtsgericht Regensburg HRB 6634\nRegisterbekanntmachung nach dem Umwandlungsgesetz 29.08.2025 (Eintragungsdatum)\n\nREMA TIP TOP Süd GmbH\nGesellschaft mit beschränkter Haftung\nNeutraubling\n\nDen Gläubigern der an der Verschmelzung beteiligten Rechtsträger ist, wenn sie binnen sechs Monaten nach dem Tag, an dem die Eintragung der Verschmelzung in das Register des Sitzes desjenigen Rechtsträgers, dessen Gläubiger sie sind, nach § 19 Abs. 3 UmwG als bekannt gemacht gilt, ihren Anspruch nach Grund und Höhe in Textform anmelden, Sicherheit zu leisten, soweit sie nicht Befriedigung verlangen können. Dieses Recht steht den Gläubigern jedoch nur zu, wenn sie glaubhaft machen, dass durch die Verschmelzung die Erfüllung ihrer Forderung gefährdet wird."
    },
    {
      "date": "2025-08-30",
      "id": "125106",
      "original_text": "Registerbekanntmachung nach dem Umwandlungsgesetz\nBayern Amtsgericht München HRA 98731\nAIC Hörmann GmbH & Co. KG – Kirchseeon",
      "type": "Registerbekanntmachung nach dem Umwandlungsgesetz",
      "state": "Bayern",
      "amtsgericht": "Amtsgericht München",
      "registernummer": "HRA 98731",
      "registerart": "HRA",
      "company_name": "AIC Hörmann GmbH & Co. KG",
      "company_seat": "Kirchseeon",
      "details": "30.08.2025 (Bekanntmachungsdatum)\n\nBayern Amtsgericht München HRA 98731\nRegisterbekanntmachung nach dem Umwandlungsgesetz 29.08.2025 (Eintragungsdatum)\n\nAIC Hörmann GmbH & Co. KG\nKommanditgesellschaft\nKirchseeon\n\nDen Gläubigern der an der Ausgliederung beteiligten Rechtsträger ist, wenn sie binnen sechs Monaten nach dem Tag, an dem die Eintragung der Ausgliederung in das Register des Sitzes desjenigen Rechtsträgers, dessen Gläubiger sie sind, nach §§ 125, 19 Abs. 3 UmwG als bekannt gemacht gilt, ihren Anspruch nach Grund und Höhe in Textform anmelden, Sicherheit zu leisten, soweit sie nicht Befriedigung verlangen können. Dieses Recht steht den Gläubigern jedoch nur zu, wenn sie glaubhaft machen, dass durch die Ausgliederung die Erfüllung ihrer Forderung gefährdet wird."
    },
    {
      "date": "2025-08-30",
      "id": "125107",
      "original_text": "Registerbekanntmachung nach dem Umwandlungsgesetz\nBayern Amtsgericht Passau HRB 13003\nHerzig Grundbesitz GmbH – Waldkirchen",
      "type": "Registerbekanntmachung nach dem Umwandlungsgesetz",
      "state": "Bayern",
      "amtsgericht": "Amtsgericht Passau",
      "registernummer": "HRB 13003",
      "registerart": "HRB",
      "company_name": "Herzig Grundbesitz GmbH",
      "company_seat": "Waldkirchen",
      "details": "30.08.2025 (Bekanntmachungsdatum)\n\nBayern Amtsgericht Passau HRB 13003\nRegisterbekanntmachung nach dem Umwandlungsgesetz 29.08.2025 (Eintragungsdatum)\n\nHerzig Grundbesitz GmbH\nGesellschaft mit beschränkter Haftung\nWaldkirchen\n\nDen Gläubigern der an der Ausgliederung beteiligten Rechtsträger ist, wenn sie binnen sechs Monaten nach dem Tag, an dem die Eintragung der Ausgliederung in das Register des Sitzes desjenigen Rechtsträgers, dessen Gläubiger sie sind, nach §§ 125, 19 Abs. 3 UmwG als bekannt gemacht gilt, ihren Anspruch nach Grund und Höhe in Textform anmelden, Sicherheit zu leisten, soweit sie nicht Befriedigung verlangen können. Dieses Recht steht den Gläubigern jedoch nur zu, wenn sie glaubhaft machen, dass durch die Ausgliederung die Erfüllung ihrer Forderung gefährdet wird."
    },
    {
      "date": "2025-08-30",
      "id": "125108",
      "original_text": "Registerbekanntmachung nach dem Umwandlungsgesetz\nBayern Amtsgericht München HRB 230256\np property GmbH – München",
      "type": "Registerbekanntmachung nach dem Umwandlungsgesetz",
      "state": "Bayern",
      "amtsgericht": "Amtsgericht München",
      "registernummer": "HRB 230256",
      "registerart": "HRB",
      "company_name": "p property GmbH",
      "company_seat": "München",
      "details": "30.08.2025 (Bekanntmachungsdatum)\n\nBayern Amtsgericht München HRB 230256\nRegisterbekanntmachung nach dem Umwandlungsgesetz 29.08.2025 (Eintragungsdatum)\n\np property GmbH\nGesellschaft mit beschränkter Haftung\nMünchen\n\nDen Gläubigern der an der Verschmelzung beteiligten Rechtsträger ist, wenn sie binnen sechs Monaten nach dem Tag, an dem die Eintragung der Verschmelzung in das Register des Sitzes desjenigen Rechtsträgers, dessen Gläubiger sie sind, nach § 19 Abs. 3 UmwG als bekannt gemacht gilt, ihren Anspruch nach Grund und Höhe in Textform anmelden, Sicherheit zu leisten, soweit sie nicht Befriedigung verlangen können. Dieses Recht steht den Gläubigern jedoch nur zu, wenn sie glaubhaft machen, dass durch die Verschmelzung die Erfüllung ihrer Forderung gefährdet wird."
    },
    {
      "date": "2025-08-30",
      "id": "125109",
      "original_text": "Registerbekanntmachung nach dem Umwandlungsgesetz\nBayern Amtsgericht Passau HRA 14010\nJürgen Herzig Betriebsverpachtung e. K. – Waldkirchen",
      "type": "Registerbekanntmachung nach dem Umwandlungsgesetz",
      "state": "Bayern",
      "amtsgericht": "Amtsgericht Passau",
      "registernummer": "HRA 14010",
      "registerart": "HRA",
      "company_name": "Jürgen Herzig Betriebsverpachtung e. K.",
      "company_seat": "Waldkirchen",
      "details": "30.08.2025 (Bekanntmachungsdatum)\n\nBayern Amtsgericht Passau HRA 14010\nRegisterbekanntmachung nach dem Umwandlungsgesetz 29.08.2025 (Eintragungsdatum)\n\nJürgen Herzig Betriebsverpachtung e. K.\nEinzelkaufmann / Einzelkauffrau\nWaldkirchen\n\nDen Gläubigern der an der Ausgliederung beteiligten Rechtsträger ist, wenn sie binnen sechs Monaten nach dem Tag, an dem die Eintragung der Ausgliederung in das Register des Sitzes desjenigen Rechtsträgers, dessen Gläubiger sie sind, nach §§ 125, 19 Abs. 3 UmwG als bekannt gemacht gilt, ihren Anspruch nach Grund und Höhe in Textform anmelden, Sicherheit zu leisten, soweit sie nicht Befriedigung verlangen können. Dieses Recht steht den Gläubigern jedoch nur zu, wenn sie glaubhaft machen, dass durch die Ausgliederung die Erfüllung ihrer Forderung gefährdet wird."
    },
    {
      "date": "2025-08-30",
      "id": "125110",
      "original_text": "Registerbekanntmachung nach dem Umwandlungsgesetz\nBayern Amtsgericht München HRB 266084\nSara`s Vision GmbH – München",
      "type": "Registerbekanntmachung nach dem Umwandlungsgesetz",
      "state": "Bayern",
      "amtsgericht": "Amtsgericht München",
      "registernummer": "HRB 266084",
      "registerart": "HRB",
      "company_name": "Sara`s Vision GmbH",
      "company_seat": "München",
      "details": "30.08.2025 (Bekanntmachungsdatum)\n\nBayern Amtsgericht München HRB 266084\nRegisterbekanntmachung nach dem Umwandlungsgesetz 29.08.2025 (Eintragungsdatum)\n\nSara`s Vision GmbH\nGesellschaft mit beschränkter Haftung\nMünchen\n\nDen Gläubigern der an der Verschmelzung beteiligten Rechtsträger ist, wenn sie binnen sechs Monaten nach dem Tag, an dem die Eintragung der Verschmelzung in das Register des Sitzes desjenigen Rechtsträgers, dessen Gläubiger sie sind, nach § 19 Abs. 3 UmwG als bekannt gemacht gilt, ihren Anspruch nach Grund und Höhe in Textform anmelden, Sicherheit zu leisten, soweit sie nicht Befriedigung verlangen können. Dieses Recht steht den Gläubigern jedoch nur zu, wenn sie glaubhaft machen, dass durch die Verschmelzung die Erfüllung ihrer Forderung gefährdet wird."
    },
    {
      "date": "2025-08-30",
      "id": "125111",
      "original_text": "Registerbekanntmachung nach dem Umwandlungsgesetz\nBayern Amtsgericht Passau HRB 10652\nder steinbock Passau GmbH – Passau",
      "type": "Registerbekanntmachung nach dem Umwandlungsgesetz",
      "state": "Bayern",
      "amtsgericht": "Amtsgericht Passau",
      "registernummer": "HRB 10652",
      "registerart": "HRB",
      "company_name": "der steinbock Passau GmbH",
      "company_seat": "Passau",
      "details": "30.08.2025 (Bekanntmachungsdatum)\n\nBayern Amtsgericht Passau HRB 10652\nRegisterbekanntmachung nach dem Umwandlungsgesetz 29.08.2025 (Eintragungsdatum)\n\nder steinbock Passau GmbH\nGesellschaft mit beschränkter Haftung\nPassau\n\nDen Gläubigern der an der Verschmelzung beteiligten Rechtsträger ist, wenn sie binnen sechs Monaten nach dem Tag, an dem die Eintragung der Verschmelzung in das Register des Sitzes desjenigen Rechtsträgers, dessen Gläubiger sie sind, nach § 19 Abs. 3 UmwG als bekannt gemacht gilt, ihren Anspruch nach Grund und Höhe in Textform anmelden, Sicherheit zu leisten, soweit sie nicht Befriedigung verlangen können. Dieses Recht steht den Gläubigern jedoch nur zu, wenn sie glaubhaft machen, dass durch die Verschmelzung die Erfüllung ihrer Forderung gefährdet wird."
    },
    {
      "date": "2025-08-30",
      "id": "125112",
      "original_text": "Registerbekanntmachung nach dem Umwandlungsgesetz\nBayern Amtsgericht München HRB 210826\nMVZ für MolekularDiagnostik GmbH – München",
      "type": "Registerbekanntmachung nach dem Umwandlungsgesetz",
      "state": "Bayern",
      "amtsgericht": "Amtsgericht München",
      "registernummer": "HRB 210826",
      "registerart": "HRB",
      "company_name": "MVZ für MolekularDiagnostik GmbH",
      "company_seat": "München",
      "details": "30.08.2025 (Bekanntmachungsdatum)\n\nBayern Amtsgericht München HRB 210826\nRegisterbekanntmachung nach dem Umwandlungsgesetz 29.08.2025 (Eintragungsdatum)\n\nMVZ für MolekularDiagnostik GmbH\nGesellschaft mit beschränkter Haftung\nMünchen\n\nDen Gläubigern der an der Verschmelzung beteiligten Rechtsträger ist, wenn sie binnen sechs Monaten nach dem Tag, an dem die Eintragung der Verschmelzung in das Register des Sitzes desjenigen Rechtsträgers, dessen Gläubiger sie sind, nach § 19 Abs. 3 UmwG als bekannt gemacht gilt, ihren Anspruch nach Grund und Höhe in Textform anmelden, Sicherheit zu leisten, soweit sie nicht Befriedigung verlangen können. Dieses Recht steht den Gläubigern jedoch nur zu, wenn sie glaubhaft machen, dass durch die Verschmelzung die Erfüllung ihrer Forderung gefährdet wird."
    },
    {
      "date": "2025-08-30",
      "id": "125113",
      "original_text": "Registerbekanntmachung nach dem Umwandlungsgesetz\nBayern Amtsgericht München HRB 125610\nAP Solutions GmbH – München",
      "type": "Registerbekanntmachung nach dem Umwandlungsgesetz",
      "state": "Bayern",
      "amtsgericht": "Amtsgericht München",
      "registernummer": "HRB 125610",
      "registerart": "HRB",
      "company_name": "AP Solutions GmbH",
      "company_seat": "München",
      "details": "30.08.2025 (Bekanntmachungsdatum)\n\nBayern Amtsgericht München HRB 125610\nRegisterbekanntmachung nach dem Umwandlungsgesetz 29.08.2025 (Eintragungsdatum)\n\nAP Solutions GmbH\nGesellschaft mit beschränkter Haftung\nMünchen\n\nDen Gläubigern der an den Verschmelzungen beteiligten Rechtsträger ist, wenn sie binnen sechs Monaten nach dem Tag, an dem die Eintragung der Verschmelzung in das Register des Sitzes desjenigen Rechtsträgers, dessen Gläubiger sie sind, nach § 19 Abs. 3 UmwG als bekannt gemacht gilt, ihren Anspruch nach Grund und Höhe in Textform anmelden, Sicherheit zu leisten, soweit sie nicht Befriedigung verlangen können. Dieses Recht steht den Gläubigern jedoch nur zu, wenn sie glaubhaft machen, dass durch die Verschmelzung die Erfüllung ihrer Forderung gefährdet wird."
    },
    {
      "date": "2025-08-30",
      "id": "125114",
      "original_text": "Registerbekanntmachung nach dem Umwandlungsgesetz\nBayern Amtsgericht Regensburg HRB 17178\nKältemittel Bayern GmbH – Lappersdorf",
      "type": "Registerbekanntmachung nach dem Umwandlungsgesetz",
      "state": "Bayern",
      "amtsgericht": "Amtsgericht Regensburg",
      "registernummer": "HRB 17178",
      "registerart": "HRB",
      "company_name": "Kältemittel Bayern GmbH",
      "company_seat": "Lappersdorf",
      "details": "30.08.2025 (Bekanntmachungsdatum)\n\nBayern Amtsgericht Regensburg HRB 17178\nRegisterbekanntmachung nach dem Umwandlungsgesetz 29.08.2025 (Eintragungsdatum)\n\nKältemittel Bayern GmbH\nGesellschaft mit beschränkter Haftung\nLappersdorf\n\nDen Gläubigern der an der Verschmelzung beteiligten Rechtsträger ist, wenn sie binnen sechs Monaten nach dem Tag, an dem die Eintragung der Verschmelzung in das Register des Sitzes desjenigen Rechtsträgers, dessen Gläubiger sie sind, nach § 19 Abs. 3 UmwG als bekannt gemacht gilt, ihren Anspruch nach Grund und Höhe in Textform anmelden, Sicherheit zu leisten, soweit sie nicht Befriedigung verlangen können. Dieses Recht steht den Gläubigern jedoch nur zu, wenn sie glaubhaft machen, dass durch die Verschmelzung die Erfüllung ihrer Forderung gefährdet wird."
    },
    {
      "date": "2025-08-30",
      "id": "125115",
      "original_text": "Registerbekanntmachung nach dem Umwandlungsgesetz\nBayern Amtsgericht München HRB 84111\nGAC Deutschland GmbH – München",
      "type": "Registerbekanntmachung nach dem Umwandlungsgesetz",
      "state": "Bayern",
      "amtsgericht": "Amtsgericht München",
      "registernummer": "HRB 84111",
      "registerart": "HRB",
      "company_name": "GAC Deutschland GmbH",
      "company_seat": "München",
      "details": "30.08.2025 (Bekanntmachungsdatum)\n\nBayern Amtsgericht München HRB 84111\nRegisterbekanntmachung nach dem Umwandlungsgesetz 29.08.2025 (Eintragungsdatum)\n\nGAC Deutschland GmbH\nGesellschaft mit beschränkter Haftung\nMünchen\n\nDen Gläubigern der an der Verschmelzung beteiligten Rechtsträger ist, wenn sie binnen sechs Monaten nach dem Tag, an dem die Eintragung der Verschmelzung in das Register des Sitzes desjenigen Rechtsträgers, dessen Gläubiger sie sind, nach § 19 Abs. 3 UmwG als bekannt gemacht gilt, ihren Anspruch nach Grund und Höhe in Textform anmelden, Sicherheit zu leisten, soweit sie nicht Befriedigung verlangen können. Dieses Recht steht den Gläubigern jedoch nur zu, wenn sie glaubhaft machen, dass durch die Verschmelzung die Erfüllung ihrer Forderung gefährdet wird."
    },
    {
      "date": "2025-08-30",
      "id": "125116",
      "original_text": "Registerbekanntmachung nach dem Umwandlungsgesetz\nBayern Amtsgericht Fürth HRB 18866\nP&P International GmbH – Fürth",
      "type": "Registerbekanntmachung nach dem Umwandlungsgesetz",
      "state": "Bayern",
      "amtsgericht": "Amtsgericht Fürth",
      "registernummer": "HRB 18866",
      "registerart": "HRB",
      "company_name": "P&P International GmbH",
      "company_seat": "Fürth",
      "details": "30.08.2025 (Bekanntmachungsdatum)\n\nBayern Amtsgericht Fürth HRB 18866\nRegisterbekanntmachung nach dem Umwandlungsgesetz 29.08.2025 (Eintragungsdatum)\n\nP&P International GmbH\nGesellschaft mit beschränkter Haftung\nFürth\n\nDen Gläubigern der an der Verschmelzung beteiligten Rechtsträger ist, wenn sie binnen sechs Monaten nach dem Tag, an dem die Eintragung der Verschmelzung in das Register des Sitzes desjenigen Rechtsträgers, dessen Gläubiger sie sind, nach § 19 Abs. 3 UmwG als bekannt gemacht gilt, ihren Anspruch nach Grund und Höhe in Textform anmelden, Sicherheit zu leisten, soweit sie nicht Befriedigung verlangen können. Dieses Recht steht den Gläubigern jedoch nur zu, wenn sie glaubhaft machen, dass durch die Verschmelzung die Erfüllung ihrer Forderung gefährdet wird."
    },
    {
      "date": "2025-08-30",
      "id": "125117",
      "original_text": "Registerbekanntmachung nach dem Umwandlungsgesetz\nBayern Amtsgericht München HRB 200937\nMG-Beteiligungs GmbH – Herrsching a. Ammersee",
      "type": "Registerbekanntmachung nach dem Umwandlungsgesetz",
      "state": "Bayern",
      "amtsgericht": "Amtsgericht München",
      "registernummer": "HRB 200937",
      "registerart": "HRB",
      "company_name": "MG-Beteiligungs GmbH",
      "company_seat": "Herrsching a. Ammersee",
      "details": "30.08.2025 (Bekanntmachungsdatum)\n\nBayern Amtsgericht München HRB 200937\nRegisterbekanntmachung nach dem Umwandlungsgesetz 29.08.2025 (Eintragungsdatum)\n\nMG-Beteiligungs GmbH\nGesellschaft mit beschränkter Haftung\nHerrsching a. Ammersee\n\nDen Gläubigern der an der Verschmelzung beteiligten Rechtsträger ist, wenn sie binnen sechs Monaten nach dem Tag, an dem die Eintragung der Verschmelzung in das Register des Sitzes desjenigen Rechtsträgers, dessen Gläubiger sie sind, nach § 19 Abs. 3 UmwG als bekannt gemacht gilt, ihren Anspruch nach Grund und Höhe in Textform anmelden, Sicherheit zu leisten, soweit sie nicht Befriedigung verlangen können. Dieses Recht steht den Gläubigern jedoch nur zu, wenn sie glaubhaft machen, dass durch die Verschmelzung die Erfüllung ihrer Forderung gefährdet wird."
    },
    {
      "date": "2025-08-30",
      "id": "125118",
      "original_text": "Registerbekanntmachung nach dem Umwandlungsgesetz\nBayern Amtsgericht München HRB 178338\nAlvarez & Marsal Deutschland GmbH – München",
      "type": "Registerbekanntmachung nach dem Umwandlungsgesetz",
      "state": "Bayern",
      "amtsgericht": "Amtsgericht München",
      "registernummer": "HRB 178338",
      "registerart": "HRB",
      "company_name": "Alvarez & Marsal Deutschland GmbH",
      "company_seat": "München",
      "details": "30.08.2025 (Bekanntmachungsdatum)\n\nBayern Amtsgericht München HRB 178338\nRegisterbekanntmachung nach dem Umwandlungsgesetz 29.08.2025 (Eintragungsdatum)\n\nAlvarez & Marsal Deutschland GmbH\nGesellschaft mit beschränkter Haftung\nMünchen\n\nDen Gläubigern der an der Verschmelzung beteiligten Rechtsträger ist, wenn sie binnen sechs Monaten nach dem Tag, an dem die Eintragung der Verschmelzung in das Register des Sitzes desjenigen Rechtsträgers, dessen Gläubiger sie sind, nach § 19 Abs. 3 UmwG als bekannt gemacht gilt, ihren Anspruch nach Grund und Höhe in Textform anmelden, Sicherheit zu leisten, soweit sie nicht Befriedigung verlangen können. Dieses Recht steht den Gläubigern jedoch nur zu, wenn sie glaubhaft machen, dass durch die Verschmelzung die Erfüllung ihrer Forderung gefährdet wird."
    },
    {
      "date": "2025-08-30",
      "id": "125119",
      "original_text": "Registerbekanntmachung nach dem Umwandlungsgesetz\nBayern Amtsgericht Aschaffenburg HRB 14463\nKunkel Holding GmbH – Hösbach",
      "type": "Registerbekanntmachung nach dem Umwandlungsgesetz",
      "state": "Bayern",
      "amtsgericht": "Amtsgericht Aschaffenburg",
      "registernummer": "HRB 14463",
      "registerart": "HRB",
      "company_name": "Kunkel Holding GmbH",
      "company_seat": "Hösbach",
      "details": "30.08.2025 (Bekanntmachungsdatum)\n\nBayern Amtsgericht Aschaffenburg HRB 14463\nRegisterbekanntmachung nach dem Umwandlungsgesetz 29.08.2025 (Eintragungsdatum)\n\nKunkel Holding GmbH\nGesellschaft mit beschränkter Haftung\nHösbach\n\nDen Gläubigern der an der Ausgliederung beteiligten Rechtsträger ist, wenn sie binnen sechs Monaten nach dem Tag, an dem die Eintragung der Ausgliederung in das Register des Sitzes desjenigen Rechtsträgers, dessen Gläubiger sie sind, nach §§ 125, 19 Abs. 3 UmwG als bekannt gemacht gilt, ihren Anspruch nach Grund und Höhe in Textform anmelden, Sicherheit zu leisten, soweit sie nicht Befriedigung verlangen können. Dieses Recht steht den Gläubigern jedoch nur zu, wenn sie glaubhaft machen, dass durch die Ausgliederung die Erfüllung ihrer Forderung gefährdet wird."
    },
    {
      "date": "2025-08-30",
      "id": "125120",
      "original_text": "Registerbekanntmachung nach dem Umwandlungsgesetz\nBayern Amtsgericht München HRB 141876\nunliminet GmbH – Mittelstetten",
      "type": "Registerbekanntmachung nach dem Umwandlungsgesetz",
      "state": "Bayern",
      "amtsgericht": "Amtsgericht München",
      "registernummer": "HRB 141876",
      "registerart": "HRB",
      "company_name": "unliminet GmbH",
      "company_seat": "Mittelstetten",
      "details": "30.08.2025 (Bekanntmachungsdatum)\n\nBayern Amtsgericht München HRB 141876\nRegisterbekanntmachung nach dem Umwandlungsgesetz 29.08.2025 (Eintragungsdatum)\n\nunliminet GmbH\nGesellschaft mit beschränkter Haftung\nMittelstetten\n\nDen Gläubigern der an der Verschmelzung beteiligten Rechtsträger ist, wenn sie binnen sechs Monaten nach dem Tag, an dem die Eintragung der Verschmelzung in das Register des Sitzes desjenigen Rechtsträgers, dessen Gläubiger sie sind, nach § 19 Abs. 3 UmwG als bekannt gemacht gilt, ihren Anspruch nach Grund und Höhe in Textform anmelden, Sicherheit zu leisten, soweit sie nicht Befriedigung verlangen können. Dieses Recht steht den Gläubigern jedoch nur zu, wenn sie glaubhaft machen, dass durch die Verschmelzung die Erfüllung ihrer Forderung gefährdet wird."
    },
    {
      "date": "2025-08-30",
      "id": "125121",
      "original_text": "Registerbekanntmachung nach dem Umwandlungsgesetz\nBayern Amtsgericht München HRB 231254\nCo Living GmbH – Grünwald",
      "type": "Registerbekanntmachung nach dem Umwandlungsgesetz",
      "state": "Bayern",
      "amtsgericht": "Amtsgericht München",
      "registernummer": "HRB 231254",
      "registerart": "HRB",
      "company_name": "Co Living GmbH",
      "company_seat": "Grünwald",
      "details": "30.08.2025 (Bekanntmachungsdatum)\n\nBayern Amtsgericht München HRB 231254\nRegisterbekanntmachung nach dem Umwandlungsgesetz 29.08.2025 (Eintragungsdatum)\n\nCo Living GmbH\nGesellschaft mit beschränkter Haftung\nGrünwald\n\nDen Gläubigern der an der Verschmelzung beteiligten Rechtsträger ist, wenn sie binnen sechs Monaten nach dem Tag, an dem die Eintragung der Verschmelzung in das Register des Sitzes desjenigen Rechtsträgers, dessen Gläubiger sie sind, nach § 19 Abs. 3 UmwG als bekannt gemacht gilt, ihren Anspruch nach Grund und Höhe in Textform anmelden, Sicherheit zu leisten, soweit sie nicht Befriedigung verlangen können. Dieses Recht steht den Gläubigern jedoch nur zu, wenn sie glaubhaft machen, dass durch die Verschmelzung die Erfüllung ihrer Forderung gefährdet wird."
    },
    {
      "date": "2025-08-30",
      "id": "125122",
      "original_text": "Registerbekanntmachung nach dem Umwandlungsgesetz\nBayern Amtsgericht München HRB 274091\nE+K Komplementär GmbH – Starnberg",
      "type": "Registerbekanntmachung nach dem Umwandlungsgesetz",
      "state": "Bayern",
      "amtsgericht": "Amtsgericht München",
      "registernummer": "HRB 274091",
      "registerart": "HRB",
      "company_name": "E+K Komplementär GmbH",
      "company_seat": "Starnberg",
      "details": "30.08.2025 (Bekanntmachungsdatum)\n\nBayern Amtsgericht München HRB 274091\nRegisterbekanntmachung nach dem Umwandlungsgesetz 29.08.2025 (Eintragungsdatum)\n\nE+K Komplementär GmbH\nGesellschaft mit beschränkter Haftung\nStarnberg\n\nDen Gläubigern der an der Verschmelzung beteiligten Rechtsträger ist, wenn sie binnen sechs Monaten nach dem Tag, an dem die Eintragung der Verschmelzung in das Register des Sitzes desjenigen Rechtsträgers, dessen Gläubiger sie sind, nach § 19 Abs. 3 UmwG als bekannt gemacht gilt, ihren Anspruch nach Grund und Höhe in Textform anmelden, Sicherheit zu leisten, soweit sie nicht Befriedigung verlangen können. Dieses Recht steht den Gläubigern jedoch nur zu, wenn sie glaubhaft machen, dass durch die Verschmelzung die Erfüllung ihrer Forderung gefährdet wird."
    },
    {
      "date": "2025-08-30",
      "id": "125123",
      "original_text": "Registerbekanntmachung nach dem Umwandlungsgesetz\nBayern Amtsgericht München HRB 177695\nAP Solutions GmbH – München",
      "type": "Registerbekanntmachung nach dem Umwandlungsgesetz",
      "state": "Bayern",
      "amtsgericht": "Amtsgericht München",
      "registernummer": "HRB 177695",
      "registerart": "HRB",
      "company_name": "AP Solutions GmbH",
      "company_seat": "München",
      "details": "30.08.2025 (Bekanntmachungsdatum)\n\nBayern Amtsgericht München HRB 177695\nRegisterbekanntmachung nach dem Umwandlungsgesetz 29.08.2025 (Eintragungsdatum)\n\nAP Solutions GmbH\nGesellschaft mit beschränkter Haftung\nMünchen\n\nDen Gläubigern der an der Verschmelzung beteiligten Rechtsträger ist, wenn sie binnen sechs Monaten nach dem Tag, an dem die Eintragung der Verschmelzung in das Register des Sitzes desjenigen Rechtsträgers, dessen Gläubiger sie sind, nach § 19 Abs. 3 UmwG als bekannt gemacht gilt, ihren Anspruch nach Grund und Höhe in Textform anmelden, Sicherheit zu leisten, soweit sie nicht Befriedigung verlangen können. Dieses Recht steht den Gläubigern jedoch nur zu, wenn sie glaubhaft machen, dass durch die Verschmelzung die Erfüllung ihrer Forderung gefährdet wird."
    },
    {
      "date": "2025-08-30",
      "id": "125124",
      "original_text": "Registerbekanntmachung nach dem Umwandlungsgesetz\nBayern Amtsgericht Schweinfurt HRB 7414\nthiele brk Steuerberatungsgesellschaft mbH – Bad Brückenau",
      "type": "Registerbekanntmachung nach dem Umwandlungsgesetz",
      "state": "Bayern",
      "amtsgericht": "Amtsgericht Schweinfurt",
      "registernummer": "HRB 7414",
      "registerart": "HRB",
      "company_name": "thiele brk Steuerberatungsgesellschaft mbH",
      "company_seat": "Bad Brückenau",
      "details": "30.08.2025 (Bekanntmachungsdatum)\n\nBayern Amtsgericht Schweinfurt HRB 7414\nRegisterbekanntmachung nach dem Umwandlungsgesetz 29.08.2025 (Eintragungsdatum)\n\nthiele brk Steuerberatungsgesellschaft mbH\nGesellschaft mit beschränkter Haftung\nBad Brückenau\n\nDen Gläubigern der an der Ausgliederung beteiligten Rechtsträger ist, wenn sie binnen sechs Monaten nach dem Tag, an dem die Eintragung der Ausgliederung in das Register des Sitzes desjenigen Rechtsträgers, dessen Gläubiger sie sind, nach §§ 125, 19 Abs. 3 UmwG als bekannt gemacht gilt, ihren Anspruch nach Grund und Höhe in Textform anmelden, Sicherheit zu leisten, soweit sie nicht Befriedigung verlangen können. Dieses Recht steht den Gläubigern jedoch nur zu, wenn sie glaubhaft machen, dass durch die Ausgliederung die Erfüllung ihrer Forderung gefährdet wird."
    },
    {
      "date": "2025-08-30",
      "id": "125125",
      "original_text": "Registerbekanntmachung nach dem Umwandlungsgesetz\nBayern Amtsgericht Ingolstadt HRA 4250\nFunk GmbH & Co. KG – Ingolstadt",
      "type": "Registerbekanntmachung nach dem Umwandlungsgesetz",
      "state": "Bayern",
      "amtsgericht": "Amtsgericht Ingolstadt",
      "registernummer": "HRA 4250",
      "registerart": "HRA",
      "company_name": "Funk GmbH & Co. KG",
      "company_seat": "Ingolstadt",
      "details": "30.08.2025 (Bekanntmachungsdatum)\n\nBayern Amtsgericht Ingolstadt HRA 4250\nRegisterbekanntmachung nach dem Umwandlungsgesetz 29.08.2025 (Eintragungsdatum)\n\nFunk GmbH & Co. KG\nKommanditgesellschaft\nIngolstadt\n\nDen Gläubigern der an der Ausgliederung beteiligten Rechtsträger ist, wenn sie binnen sechs Monaten nach dem Tag, an dem die Eintragung der Ausgliederung in das Register des Sitzes desjenigen Rechtsträgers, dessen Gläubiger sie sind, nach §§ 125, 19 Abs. 3 UmwG als bekannt gemacht gilt, ihren Anspruch nach Grund und Höhe in Textform anmelden, Sicherheit zu leisten, soweit sie nicht Befriedigung verlangen können. Dieses Recht steht den Gläubigern jedoch nur zu, wenn sie glaubhaft machen, dass durch die Ausgliederung die Erfüllung ihrer Forderung gefährdet wird."
    },
    {
      "date": "2025-08-30",
      "id": "125126",
      "original_text": "Registerbekanntmachung nach dem Umwandlungsgesetz\nBayern Amtsgericht München HRB 267052\nCoros Bessemer GmbH – Grünwald",
      "type": "Registerbekanntmachung nach dem Umwandlungsgesetz",
      "state": "Bayern",
      "amtsgericht": "Amtsgericht München",
      "registernummer": "HRB 267052",
      "registerart": "HRB",
      "company_name": "Coros Bessemer GmbH",
      "company_seat": "Grünwald",
      "details": "30.08.2025 (Bekanntmachungsdatum)\n\nBayern Amtsgericht München HRB 267052\nRegisterbekanntmachung nach dem Umwandlungsgesetz 29.08.2025 (Eintragungsdatum)\n\nCoros Bessemer GmbH\nGesellschaft mit beschränkter Haftung\nGrünwald\n\nDen Gläubigern der an der Verschmelzung beteiligten Rechtsträger ist, wenn sie binnen sechs Monaten nach dem Tag, an dem die Eintragung der Verschmelzung in das Register des Sitzes desjenigen Rechtsträgers, dessen Gläubiger sie sind, nach § 19 Abs. 3 UmwG als bekannt gemacht gilt, ihren Anspruch nach Grund und Höhe in Textform anmelden, Sicherheit zu leisten, soweit sie nicht Befriedigung verlangen können. Dieses Recht steht den Gläubigern jedoch nur zu, wenn sie glaubhaft machen, dass durch die Verschmelzung die Erfüllung ihrer Forderung gefährdet wird."
    },
    {
      "date": "2025-08-30",
      "id": "125127",
      "original_text": "Registerbekanntmachung nach dem Umwandlungsgesetz\nBayern Amtsgericht Regensburg HRA 11186\nAutomobile D.S. e.K. – Bad Kötzting",
      "type": "Registerbekanntmachung nach dem Umwandlungsgesetz",
      "state": "Bayern",
      "amtsgericht": "Amtsgericht Regensburg",
      "registernummer": "HRA 11186",
      "registerart": "HRA",
      "company_name": "Automobile D.S. e.K.",
      "company_seat": "Bad Kötzting",
      "details": "30.08.2025 (Bekanntmachungsdatum)\n\nBayern Amtsgericht Regensburg HRA 11186\nRegisterbekanntmachung nach dem Umwandlungsgesetz 29.08.2025 (Eintragungsdatum)\n\nAutomobile D.S. e.K.\nEinzelkaufmann / Einzelkauffrau\nBad Kötzting\n\nDen Gläubigern der an der Ausgliederung beteiligten Rechtsträger ist, wenn sie binnen sechs Monaten nach dem Tag, an dem die Eintragung der Ausgliederung in das Register des Sitzes desjenigen Rechtsträgers, dessen Gläubiger sie sind, nach §§ 125, 19 Abs. 3 UmwG als bekannt gemacht gilt, ihren Anspruch nach Grund und Höhe in Textform anmelden, Sicherheit zu leisten, soweit sie nicht Befriedigung verlangen können. Dieses Recht steht den Gläubigern jedoch nur zu, wenn sie glaubhaft machen, dass durch die Ausgliederung die Erfüllung ihrer Forderung gefährdet wird."
    },
    {
      "date": "2025-08-30",
      "id": "125128",
      "original_text": "Registerbekanntmachung nach dem Umwandlungsgesetz\nBayern Amtsgericht München HRB 158447\nTERRA Immobilien Danhuber GmbH – München",
      "type": "Registerbekanntmachung nach dem Umwandlungsgesetz",
      "state": "Bayern",
      "amtsgericht": "Amtsgericht München",
      "registernummer": "HRB 158447",
      "registerart": "HRB",
      "company_name": "TERRA Immobilien Danhuber GmbH",
      "company_seat": "München",
      "details": "30.08.2025 (Bekanntmachungsdatum)\n\nBayern Amtsgericht München HRB 158447\nRegisterbekanntmachung nach dem Umwandlungsgesetz 29.08.2025 (Eintragungsdatum)\n\nTERRA Immobilien Danhuber GmbH\nGesellschaft mit beschränkter Haftung\nMünchen\n\nDen Gläubigern der an der Verschmelzung beteiligten Rechtsträger ist, wenn sie binnen sechs Monaten nach dem Tag, an dem die Eintragung der Verschmelzung in das Register des Sitzes desjenigen Rechtsträgers, dessen Gläubiger sie sind, nach § 19 Abs. 3 UmwG als bekannt gemacht gilt, ihren Anspruch nach Grund und Höhe in Textform anmelden, Sicherheit zu leisten, soweit sie nicht Befriedigung verlangen können. Dieses Recht steht den Gläubigern jedoch nur zu, wenn sie glaubhaft machen, dass durch die Verschmelzung die Erfüllung ihrer Forderung gefährdet wird."
    },
    {
      "date": "2025-08-30",
      "id": "125129",
      "original_text": "Registerbekanntmachung nach dem Umwandlungsgesetz\nBayern Amtsgericht München HRB 287190\nadGenia GmbH – Moosach",
      "type": "Registerbekanntmachung nach dem Umwandlungsgesetz",
      "state": "Bayern",
      "amtsgericht": "Amtsgericht München",
      "registernummer": "HRB 287190",
      "registerart": "HRB",
      "company_name": "adGenia GmbH",
      "company_seat": "Moosach",
      "details": "30.08.2025 (Bekanntmachungsdatum)\n\nBayern Amtsgericht München HRB 287190\nRegisterbekanntmachung nach dem Umwandlungsgesetz 29.08.2025 (Eintragungsdatum)\n\nadGenia GmbH\nGesellschaft mit beschränkter Haftung\nMoosach\n\nDen Gläubigern der an der Verschmelzung beteiligten Rechtsträger ist, wenn sie binnen sechs Monaten nach dem Tag, an dem die Eintragung der Verschmelzung in das Register des Sitzes desjenigen Rechtsträgers, dessen Gläubiger sie sind, nach § 19 Abs. 3 UmwG als bekannt gemacht gilt, ihren Anspruch nach Grund und Höhe in Textform anmelden, Sicherheit zu leisten, soweit sie nicht Befriedigung verlangen können. Dieses Recht steht den Gläubigern jedoch nur zu, wenn sie glaubhaft machen, dass durch die Verschmelzung die Erfüllung ihrer Forderung gefährdet wird."
    },
    {
      "date": "2025-08-30",
      "id": "125130",
      "original_text": "Registerbekanntmachung nach dem Umwandlungsgesetz\nBayern Amtsgericht Aschaffenburg HRB 12222\nLa petite école UG (haftungsbeschränkt) – Mainaschaff",
      "type": "Registerbekanntmachung nach dem Umwandlungsgesetz",
      "state": "Bayern",
      "amtsgericht": "Amtsgericht Aschaffenburg",
      "registernummer": "HRB 12222",
      "registerart": "HRB",
      "company_name": "La petite école UG (haftungsbeschränkt)",
      "company_seat": "Mainaschaff",
      "details": "30.08.2025 (Bekanntmachungsdatum)\n\nBayern Amtsgericht Aschaffenburg HRB 12222\nRegisterbekanntmachung nach dem Umwandlungsgesetz 29.08.2025 (Eintragungsdatum)\n\nLa petite école UG (haftungsbeschränkt)\nGesellschaft mit beschränkter Haftung\nMainaschaff\n\nDen Gläubigern der an der Verschmelzung beteiligten Rechtsträger ist, wenn sie binnen sechs Monaten nach dem Tag, an dem die Eintragung der Verschmelzung in das Register des Sitzes desjenigen Rechtsträgers, dessen Gläubiger sie sind, nach § 19 Abs. 3 UmwG als bekannt gemacht gilt, ihren Anspruch nach Grund und Höhe in Textform anmelden, Sicherheit zu leisten, soweit sie nicht Befriedigung verlangen können. Dieses Recht steht den Gläubigern jedoch nur zu, wenn sie glaubhaft machen, dass durch die Verschmelzung die Erfüllung ihrer Forderung gefährdet wird."
    },
    {
      "date": "2025-08-30",
      "id": "125131",
      "original_text": "Registerbekanntmachung nach dem Umwandlungsgesetz\nBayern Amtsgericht Ingolstadt HRA 4367\nFunk Besitzunternehmen, Inhaber Manfred Funk e.K. – Ingolstadt",
      "type": "Registerbekanntmachung nach dem Umwandlungsgesetz",
      "state": "Bayern",
      "amtsgericht": "Amtsgericht Ingolstadt",
      "registernummer": "HRA 4367",
      "registerart": "HRA",
      "company_name": "Funk Besitzunternehmen, Inhaber Manfred Funk e.K.",
      "company_seat": "Ingolstadt",
      "details": "30.08.2025 (Bekanntmachungsdatum)\n\nBayern Amtsgericht Ingolstadt HRA 4367\nRegisterbekanntmachung nach dem Umwandlungsgesetz 29.08.2025 (Eintragungsdatum)\n\nFunk Besitzunternehmen, Inhaber Manfred Funk e.K.\nEinzelkaufmann / Einzelkauffrau\nIngolstadt\n\nDen Gläubigern der an der Ausgliederung beteiligten Rechtsträger ist, wenn sie binnen sechs Monaten nach dem Tag, an dem die Eintragung der Ausgliederung in das Register des Sitzes desjenigen Rechtsträgers, dessen Gläubiger sie sind, nach §§ 125, 19 Abs. 3 UmwG als bekannt gemacht gilt, ihren Anspruch nach Grund und Höhe in Textform anmelden, Sicherheit zu leisten, soweit sie nicht Befriedigung verlangen können. Dieses Recht steht den Gläubigern jedoch nur zu, wenn sie glaubhaft machen, dass durch die Ausgliederung die Erfüllung ihrer Forderung gefährdet wird."
    },
    {
      "date": "2025-08-30",
      "id": "125132",
      "original_text": "Registerbekanntmachung nach dem Umwandlungsgesetz\nBayern Amtsgericht München HRB 276273\nCoros Investment XIII GmbH – Grünwald",
      "type": "Registerbekanntmachung nach dem Umwandlungsgesetz",
      "state": "Bayern",
      "amtsgericht": "Amtsgericht München",
      "registernummer": "HRB 276273",
      "registerart": "HRB",
      "company_name": "Coros Investment XIII GmbH",
      "company_seat": "Grünwald",
      "details": "30.08.2025 (Bekanntmachungsdatum)\n\nBayern Amtsgericht München HRB 276273\nRegisterbekanntmachung nach dem Umwandlungsgesetz 29.08.2025 (Eintragungsdatum)\n\nCoros Investment XIII GmbH\nGesellschaft mit beschränkter Haftung\nGrünwald\n\nDen Gläubigern der an der Verschmelzung beteiligten Rechtsträger ist, wenn sie binnen sechs Monaten nach dem Tag, an dem die Eintragung der Verschmelzung in das Register des Sitzes desjenigen Rechtsträgers, dessen Gläubiger sie sind, nach § 19 Abs. 3 UmwG als bekannt gemacht gilt, ihren Anspruch nach Grund und Höhe in Textform anmelden, Sicherheit zu leisten, soweit sie nicht Befriedigung verlangen können. Dieses Recht steht den Gläubigern jedoch nur zu, wenn sie glaubhaft machen, dass durch die Verschmelzung die Erfüllung ihrer Forderung gefährdet wird."
    },
    {
      "date": "2025-08-30",
      "id": "125133",
      "original_text": "Registerbekanntmachung nach dem Umwandlungsgesetz\nBayern Amtsgericht Passau HRA 11681\nAutohaus Zander e.K. – Otterskirchen, Gemeinde Windorf",
      "type": "Registerbekanntmachung nach dem Umwandlungsgesetz",
      "state": "Bayern",
      "amtsgericht": "Amtsgericht Passau",
      "registernummer": "HRA 11681",
      "registerart": "HRA",
      "company_name": "Autohaus Zander e.K.",
      "company_seat": "Otterskirchen, Gemeinde Windorf",
      "details": "30.08.2025 (Bekanntmachungsdatum)\n\nBayern Amtsgericht Passau HRA 11681\nRegisterbekanntmachung nach dem Umwandlungsgesetz 29.08.2025 (Eintragungsdatum)\n\nAutohaus Zander e.K.\nEinzelkaufmann / Einzelkauffrau\nOtterskirchen, Gemeinde Windorf\n\nDen Gläubigern der an der Ausgliederung beteiligten Rechtsträger ist, wenn sie binnen sechs Monaten nach dem Tag, an dem die Eintragung der Ausgliederung in das Register des Sitzes desjenigen Rechtsträgers, dessen Gläubiger sie sind, nach §§ 125, 19 Abs. 3 UmwG als bekannt gemacht gilt, ihren Anspruch nach Grund und Höhe in Textform anmelden, Sicherheit zu leisten, soweit sie nicht Befriedigung verlangen können. Dieses Recht steht den Gläubigern jedoch nur zu, wenn sie glaubhaft machen, dass durch die Ausgliederung die Erfüllung ihrer Forderung gefährdet wird."
    },
    {
      "date": "2025-08-30",
      "id": "125134",
      "original_text": "Registerbekanntmachung nach dem Umwandlungsgesetz\nBayern Amtsgericht München HRB 170643\nVerwaltungsgesellschaft Objekt Neusäß mbH – Grünwald",
      "type": "Registerbekanntmachung nach dem Umwandlungsgesetz",
      "state": "Bayern",
      "amtsgericht": "Amtsgericht München",
      "registernummer": "HRB 170643",
      "registerart": "HRB",
      "company_name": "Verwaltungsgesellschaft Objekt Neusäß mbH",
      "company_seat": "Grünwald",
      "details": "30.08.2025 (Bekanntmachungsdatum)\n\nBayern Amtsgericht München HRB 170643\nRegisterbekanntmachung nach dem Umwandlungsgesetz 29.08.2025 (Eintragungsdatum)\n\nVerwaltungsgesellschaft Objekt Neusäß mbH\nGesellschaft mit beschränkter Haftung\nGrünwald\n\nDen Gläubigern der an der Verschmelzung beteiligten Rechtsträger ist, wenn sie binnen sechs Monaten nach dem Tag, an dem die Eintragung der Verschmelzung in das Register des Sitzes desjenigen Rechtsträgers, dessen Gläubiger sie sind, nach § 19 Abs. 3 UmwG als bekannt gemacht gilt, ihren Anspruch nach Grund und Höhe in Textform anmelden, Sicherheit zu leisten, soweit sie nicht Befriedigung verlangen können. Dieses Recht steht den Gläubigern jedoch nur zu, wenn sie glaubhaft machen, dass durch die Verschmelzung die Erfüllung ihrer Forderung gefährdet wird."
    },
    {
      "date": "2025-08-30",
      "id": "125135",
      "original_text": "Registerbekanntmachung nach dem Umwandlungsgesetz\nBayern Amtsgericht Ingolstadt HRA 4382\nMalerbetrieb Theo Hopp e. K. – Neuburg a.d. Donau",
      "type": "Registerbekanntmachung nach dem Umwandlungsgesetz",
      "state": "Bayern",
      "amtsgericht": "Amtsgericht Ingolstadt",
      "registernummer": "HRA 4382",
      "registerart": "HRA",
      "company_name": "Malerbetrieb Theo Hopp e. K.",
      "company_seat": "Neuburg a.d. Donau",
      "details": "30.08.2025 (Bekanntmachungsdatum)\n\nBayern Amtsgericht Ingolstadt HRA 4382\nRegisterbekanntmachung nach dem Umwandlungsgesetz 29.08.2025 (Eintragungsdatum)\n\nMalerbetrieb Theo Hopp e. K.\nEinzelkaufmann / Einzelkauffrau\nNeuburg a.d. Donau\n\nDen Gläubigern der an der Ausgliederung beteiligten Rechtsträger ist, wenn sie binnen sechs Monaten nach dem Tag, an dem die Eintragung der Ausgliederung in das Register des Sitzes desjenigen Rechtsträgers, dessen Gläubiger sie sind, nach §§ 125, 19 Abs. 3 UmwG als bekannt gemacht gilt, ihren Anspruch nach Grund und Höhe in Textform anmelden, Sicherheit zu leisten, soweit sie nicht Befriedigung verlangen können. Dieses Recht steht den Gläubigern jedoch nur zu, wenn sie glaubhaft machen, dass durch die Ausgliederung die Erfüllung ihrer Forderung gefährdet wird."
    },
    {
      "date": "2025-08-30",
      "id": "125136",
      "original_text": "Registerbekanntmachung nach dem Umwandlungsgesetz\nBayern Amtsgericht München HRB 241361\nOrthoRehaSport Verwaltungs GmbH – München",
      "type": "Registerbekanntmachung nach dem Umwandlungsgesetz",
      "state": "Bayern",
      "amtsgericht": "Amtsgericht München",
      "registernummer": "HRB 241361",
      "registerart": "HRB",
      "company_name": "OrthoRehaSport Verwaltungs GmbH",
      "company_seat": "München",
      "details": "30.08.2025 (Bekanntmachungsdatum)\n\nBayern Amtsgericht München HRB 241361\nRegisterbekanntmachung nach dem Umwandlungsgesetz 29.08.2025 (Eintragungsdatum)\n\nOrthoRehaSport Verwaltungs GmbH\nGesellschaft mit beschränkter Haftung\nMünchen\n\nDen Gläubigern der an der Verschmelzung beteiligten Rechtsträger ist, wenn sie binnen sechs Monaten nach dem Tag, an dem die Eintragung der Verschmelzung in das Register des Sitzes desjenigen Rechtsträgers, dessen Gläubiger sie sind, nach § 19 Abs. 3 UmwG als bekannt gemacht gilt, ihren Anspruch nach Grund und Höhe in Textform anmelden, Sicherheit zu leisten, soweit sie nicht Befriedigung verlangen können. Dieses Recht steht den Gläubigern jedoch nur zu, wenn sie glaubhaft machen, dass durch die Verschmelzung die Erfüllung ihrer Forderung gefährdet wird."
    },
    {
      "date": "2025-08-30",
      "id": "125137",
      "original_text": "Registerbekanntmachung nach dem Umwandlungsgesetz\nBayern Amtsgericht München HRB 303624\nKNETTENBRECH + GURDULIC Süd GmbH – Gräfelfing",
      "type": "Registerbekanntmachung nach dem Umwandlungsgesetz",
      "state": "Bayern",
      "amtsgericht": "Amtsgericht München",
      "registernummer": "HRB 303624",
      "registerart": "HRB",
      "company_name": "KNETTENBRECH + GURDULIC Süd GmbH",
      "company_seat": "Gräfelfing",
      "details": "30.08.2025 (Bekanntmachungsdatum)\n\nBayern Amtsgericht München HRB 303624\nRegisterbekanntmachung nach dem Umwandlungsgesetz 29.08.2025 (Eintragungsdatum)\n\nKNETTENBRECH + GURDULIC Süd GmbH\nGesellschaft mit beschränkter Haftung\nGräfelfing\n\nDen Gläubigern der an der Verschmelzung beteiligten Rechtsträger ist, wenn sie binnen sechs Monaten nach dem Tag, an dem die Eintragung der Verschmelzung in das Register des Sitzes desjenigen Rechtsträgers, dessen Gläubiger sie sind, nach § 19 Abs. 3 UmwG als bekannt gemacht gilt, ihren Anspruch nach Grund und Höhe in Textform anmelden, Sicherheit zu leisten, soweit sie nicht Befriedigung verlangen können. Dieses Recht steht den Gläubigern jedoch nur zu, wenn sie glaubhaft machen, dass durch die Verschmelzung die Erfüllung ihrer Forderung gefährdet wird."
    },
    {
      "date": "2025-08-30",
      "id": "125138",
      "original_text": "Registerbekanntmachung nach dem Umwandlungsgesetz\nBayern Amtsgericht München HRB 267053\nCoros Weißenseer GmbH – Grünwald",
      "type": "Registerbekanntmachung nach dem Umwandlungsgesetz",
      "state": "Bayern",
      "amtsgericht": "Amtsgericht München",
      "registernummer": "HRB 267053",
      "registerart": "HRB",
      "company_name": "Coros Weißenseer GmbH",
      "company_seat": "Grünwald",
      "details": "30.08.2025 (Bekanntmachungsdatum)\n\nBayern Amtsgericht München HRB 267053\nRegisterbekanntmachung nach dem Umwandlungsgesetz 29.08.2025 (Eintragungsdatum)\n\nCoros Weißenseer GmbH\nGesellschaft mit beschränkter Haftung\nGrünwald\n\nDen Gläubigern der an der Verschmelzung beteiligten Rechtsträger ist, wenn sie binnen sechs Monaten nach dem Tag, an dem die Eintragung der Verschmelzung in das Register des Sitzes desjenigen Rechtsträgers, dessen Gläubiger sie sind, nach § 19 Abs. 3 UmwG als bekannt gemacht gilt, ihren Anspruch nach Grund und Höhe in Textform anmelden, Sicherheit zu leisten, soweit sie nicht Befriedigung verlangen können. Dieses Recht steht den Gläubigern jedoch nur zu, wenn sie glaubhaft machen, dass durch die Verschmelzung die Erfüllung ihrer Forderung gefährdet wird."
    },
    {
      "date": "2025-08-30",
      "id": "125139",
      "original_text": "Registerbekanntmachung nach dem Umwandlungsgesetz\nBayern Amtsgericht München HRA 121351\nMüllers Hausmeisterservice KG – Bergkirchen",
      "type": "Registerbekanntmachung nach dem Umwandlungsgesetz",
      "state": "Bayern",
      "amtsgericht": "Amtsgericht München",
      "registernummer": "HRA 121351",
      "registerart": "HRA",
      "company_name": "Müllers Hausmeisterservice KG",
      "company_seat": "Bergkirchen",
      "details": "30.08.2025 (Bekanntmachungsdatum)\n\nBayern Amtsgericht München HRA 121351\nRegisterbekanntmachung nach dem Umwandlungsgesetz 29.08.2025 (Eintragungsdatum)\n\nMüllers Hausmeisterservice KG\nKommanditgesellschaft\nBergkirchen\n\nDen Gläubigern der an der Ausgliederung beteiligten Rechtsträger ist, wenn sie binnen sechs Monaten nach dem Tag, an dem die Eintragung der Ausgliederung in das Register des Sitzes desjenigen Rechtsträgers, dessen Gläubiger sie sind, nach §§ 125, 19 Abs. 3 UmwG als bekannt gemacht gilt, ihren Anspruch nach Grund und Höhe in Textform anmelden, Sicherheit zu leisten, soweit sie nicht Befriedigung verlangen können. Dieses Recht steht den Gläubigern jedoch nur zu, wenn sie glaubhaft machen, dass durch die Ausgliederung die Erfüllung ihrer Forderung gefährdet wird."
    },
    {
      "date": "2025-08-30",
      "id": "125140",
      "original_text": "Registerbekanntmachung nach dem Umwandlungsgesetz\nBayern Amtsgericht München HRB 300262\nHRE Pensions GmbH – München",
      "type": "Registerbekanntmachung nach dem Umwandlungsgesetz",
      "state": "Bayern",
      "amtsgericht": "Amtsgericht München",
      "registernummer": "HRB 300262",
      "registerart": "HRB",
      "company_name": "HRE Pensions GmbH",
      "company_seat": "München",
      "details": "30.08.2025 (Bekanntmachungsdatum)\n\nBayern Amtsgericht München HRB 300262\nRegisterbekanntmachung nach dem Umwandlungsgesetz 29.08.2025 (Eintragungsdatum)\n\nHRE Pensions GmbH\nGesellschaft mit beschränkter Haftung\nMünchen\n\nDen Gläubigern der an der Spaltung beteiligten Rechtsträger ist, wenn sie binnen sechs Monaten nach dem Tag, an dem die Eintragung der Spaltung in das Register des Sitzes desjenigen Rechtsträgers, dessen Gläubiger sie sind, nach §§ 125, 19 Abs. 3 UmwG als bekannt gemacht gilt, ihren Anspruch nach Grund und Höhe in Textform anmelden, Sicherheit zu leisten, soweit sie nicht Befriedigung verlangen können. Dieses Recht steht den Gläubigern jedoch nur zu, wenn sie glaubhaft machen, dass durch die Spaltung die Erfüllung ihrer Forderung gefährdet wird."
    },
    {
      "date": "2025-08-30",
      "id": "125141",
      "original_text": "Registerbekanntmachung nach dem Umwandlungsgesetz\nBayern Amtsgericht Traunstein HRB 7226\nCITY BAU GmbH – Neuötting",
      "type": "Registerbekanntmachung nach dem Umwandlungsgesetz",
      "state": "Bayern",
      "amtsgericht": "Amtsgericht Traunstein",
      "registernummer": "HRB 7226",
      "registerart": "HRB",
      "company_name": "CITY BAU GmbH",
      "company_seat": "Neuötting",
      "details": "30.08.2025 (Bekanntmachungsdatum)\n\nBayern Amtsgericht Traunstein HRB 7226\nRegisterbekanntmachung nach dem Umwandlungsgesetz 29.08.2025 (Eintragungsdatum)\n\nCITY BAU GmbH\nGesellschaft mit beschränkter Haftung\nNeuötting\n\nDen Gläubigern der an der Ausgliederung beteiligten Rechtsträger ist, wenn sie binnen sechs Monaten nach dem Tag, an dem die Eintragung der Ausgliederung in das Register des Sitzes desjenigen Rechtsträgers, dessen Gläubiger sie sind, nach §§ 125, 19 Abs. 3 UmwG als bekannt gemacht gilt, ihren Anspruch nach Grund und Höhe in Textform anmelden, Sicherheit zu leisten, soweit sie nicht Befriedigung verlangen können. Dieses Recht steht den Gläubigern jedoch nur zu, wenn sie glaubhaft machen, dass durch die Ausgliederung die Erfüllung ihrer Forderung gefährdet wird."
    },
    {
      "date": "2025-08-30",
      "id": "125142",
      "original_text": "Registerbekanntmachung nach dem Umwandlungsgesetz\nBayern Amtsgericht Regensburg HRB 14128\nBPE Verwaltungs-GmbH – Regensburg",
      "type": "Registerbekanntmachung nach dem Umwandlungsgesetz",
      "state": "Bayern",
      "amtsgericht": "Amtsgericht Regensburg",
      "registernummer": "HRB 14128",
      "registerart": "HRB",
      "company_name": "BPE Verwaltungs-GmbH",
      "company_seat": "Regensburg",
      "details": "30.08.2025 (Bekanntmachungsdatum)\n\nBayern Amtsgericht Regensburg HRB 14128\nRegisterbekanntmachung nach dem Umwandlungsgesetz 29.08.2025 (Eintragungsdatum)\n\nBPE Verwaltungs-GmbH\nGesellschaft mit beschränkter Haftung\nRegensburg\n\nDen Gläubigern der an der Verschmelzung beteiligten Rechtsträger ist, wenn sie binnen sechs Monaten nach dem Tag, an dem die Eintragung der Verschmelzung in das Register des Sitzes desjenigen Rechtsträgers, dessen Gläubiger sie sind, nach § 19 Abs. 3 UmwG als bekannt gemacht gilt, ihren Anspruch nach Grund und Höhe in Textform anmelden, Sicherheit zu leisten, soweit sie nicht Befriedigung verlangen können. Dieses Recht steht den Gläubigern jedoch nur zu, wenn sie glaubhaft machen, dass durch die Verschmelzung die Erfüllung ihrer Forderung gefährdet wird."
    },
    {
      "date": "2025-08-30",
      "id": "125143",
      "original_text": "Registerbekanntmachung nach dem Umwandlungsgesetz\nBayern Amtsgericht München HRB 269040\nVINOVIT GmbH – Forstinning",
      "type": "Registerbekanntmachung nach dem Umwandlungsgesetz",
      "state": "Bayern",
      "amtsgericht": "Amtsgericht München",
      "registernummer": "HRB 269040",
      "registerart": "HRB",
      "company_name": "VINOVIT GmbH",
      "company_seat": "Forstinning",
      "details": "30.08.2025 (Bekanntmachungsdatum)\n\nBayern Amtsgericht München HRB 269040\nRegisterbekanntmachung nach dem Umwandlungsgesetz 29.08.2025 (Eintragungsdatum)\n\nVINOVIT GmbH\nGesellschaft mit beschränkter Haftung\nForstinning\n\nDen Gläubigern der an der Verschmelzung beteiligten Rechtsträger ist, wenn sie binnen sechs Monaten nach dem Tag, an dem die Eintragung der Verschmelzung in das Register des Sitzes desjenigen Rechtsträgers, dessen Gläubiger sie sind, nach § 19 Abs. 3 UmwG als bekannt gemacht gilt, ihren Anspruch nach Grund und Höhe in Textform anmelden, Sicherheit zu leisten, soweit sie nicht Befriedigung verlangen können. Dieses Recht steht den Gläubigern jedoch nur zu, wenn sie glaubhaft machen, dass durch die Verschmelzung die Erfüllung ihrer Forderung gefährdet wird."
    },
    {
      "date": "2025-08-30",
      "id": "125144",
      "original_text": "Registerbekanntmachung nach dem Umwandlungsgesetz\nBayern Amtsgericht München HRB 256407\nLinde GmbH – Pullach i.Isartal",
      "type": "Registerbekanntmachung nach dem Umwandlungsgesetz",
      "state": "Bayern",
      "amtsgericht": "Amtsgericht München",
      "registernummer": "HRB 256407",
      "registerart": "HRB",
      "company_name": "Linde GmbH",
      "company_seat": "Pullach i.Isartal",
      "details": "30.08.2025 (Bekanntmachungsdatum)\n\nBayern Amtsgericht München HRB 256407\nRegisterbekanntmachung nach dem Umwandlungsgesetz 29.08.2025 (Eintragungsdatum)\n\nLinde GmbH\nGesellschaft mit beschränkter Haftung\nPullach i.Isartal\n\nDen Gläubigern der an der Verschmelzung beteiligten Rechtsträger ist, wenn sie binnen sechs Monaten nach dem Tag, an dem die Eintragung der Verschmelzung in das Register des Sitzes desjenigen Rechtsträgers, dessen Gläubiger sie sind, nach § 19 Abs. 3 UmwG als bekannt gemacht gilt, ihren Anspruch nach Grund und Höhe in Textform anmelden, Sicherheit zu leisten, soweit sie nicht Befriedigung verlangen können. Dieses Recht steht den Gläubigern jedoch nur zu, wenn sie glaubhaft machen, dass durch die Verschmelzung die Erfüllung ihrer Forderung gefährdet wird."
    },
    {
      "date": "2025-08-30",
      "id": "125145",
      "original_text": "Registerbekanntmachung nach dem Umwandlungsgesetz\nBayern Amtsgericht Fürth HRB 11734\nP&P Group GmbH – Fürth",
      "type": "Registerbekanntmachung nach dem Umwandlungsgesetz",
      "state": "Bayern",
      "amtsgericht": "Amtsgericht Fürth",
      "registernummer": "HRB 11734",
      "registerart": "HRB",
      "company_name": "P&P Group GmbH",
      "company_seat": "Fürth",
      "details": "30.08.2025 (Bekanntmachungsdatum)\n\nBayern Amtsgericht Fürth HRB 11734\nRegisterbekanntmachung nach dem Umwandlungsgesetz 29.08.2025 (Eintragungsdatum)\n\nP&P Group GmbH\nGesellschaft mit beschränkter Haftung\nFürth\n\nDen Gläubigern der an der Verschmelzung beteiligten Rechtsträger ist, wenn sie binnen sechs Monaten nach dem Tag, an dem die Eintragung der Verschmelzung in das Register des Sitzes desjenigen Rechtsträgers, dessen Gläubiger sie sind, nach § 19 Abs. 3 UmwG als bekannt gemacht gilt, ihren Anspruch nach Grund und Höhe in Textform anmelden, Sicherheit zu leisten, soweit sie nicht Befriedigung verlangen können. Dieses Recht steht den Gläubigern jedoch nur zu, wenn sie glaubhaft machen, dass durch die Verschmelzung die Erfüllung ihrer Forderung gefährdet wird."
    },
    {
      "date": "2025-08-30",
      "id": "125146",
      "original_text": "Registerbekanntmachung nach dem Umwandlungsgesetz\nBayern Amtsgericht München HRB 177695\nAP Solutions GmbH – München",
      "type": "Registerbekanntmachung nach dem Umwandlungsgesetz",
      "state": "Bayern",
      "amtsgericht": "Amtsgericht München",
      "registernummer": "HRB 177695",
      "registerart": "HRB",
      "company_name": "AP Solutions GmbH",
      "company_seat": "München",
      "details": "30.08.2025 (Bekanntmachungsdatum)\n\nBayern Amtsgericht München HRB 177695\nRegisterbekanntmachung nach dem Umwandlungsgesetz 29.08.2025 (Eintragungsdatum)\n\nAP Solutions GmbH\nGesellschaft mit beschränkter Haftung\nMünchen\n\nDen Gläubigern der an der Verschmelzung beteiligten Rechtsträger ist, wenn sie binnen sechs Monaten nach dem Tag, an dem die Eintragung der Verschmelzung in das Register des Sitzes desjenigen Rechtsträgers, dessen Gläubiger sie sind, nach § 19 Abs. 3 UmwG als bekannt gemacht gilt, ihren Anspruch nach Grund und Höhe in Textform anmelden, Sicherheit zu leisten, soweit sie nicht Befriedigung verlangen können. Dieses Recht steht den Gläubigern jedoch nur zu, wenn sie glaubhaft machen, dass durch die Verschmelzung die Erfüllung ihrer Forderung gefährdet wird."
    },
    {
      "date": "2025-08-30",
      "id": "125147",
      "original_text": "Registerbekanntmachung nach dem Umwandlungsgesetz\nBayern Amtsgericht Regensburg HRB 19913\nRegens-BURGER Gastro GmbH – Regensburg",
      "type": "Registerbekanntmachung nach dem Umwandlungsgesetz",
      "state": "Bayern",
      "amtsgericht": "Amtsgericht Regensburg",
      "registernummer": "HRB 19913",
      "registerart": "HRB",
      "company_name": "Regens-BURGER Gastro GmbH",
      "company_seat": "Regensburg",
      "details": "30.08.2025 (Bekanntmachungsdatum)\n\nBayern Amtsgericht Regensburg HRB 19913\nRegisterbekanntmachung nach dem Umwandlungsgesetz 29.08.2025 (Eintragungsdatum)\n\nRegens-BURGER Gastro GmbH\nGesellschaft mit beschränkter Haftung\nRegensburg\n\nDen Gläubigern der an der Verschmelzung beteiligten Rechtsträger ist, wenn sie binnen sechs Monaten nach dem Tag, an dem die Eintragung der Verschmelzung in das Register des Sitzes desjenigen Rechtsträgers, dessen Gläubiger sie sind, nach § 19 Abs. 3 UmwG als bekannt gemacht gilt, ihren Anspruch nach Grund und Höhe in Textform anmelden, Sicherheit zu leisten, soweit sie nicht Befriedigung verlangen können. Dieses Recht steht den Gläubigern jedoch nur zu, wenn sie glaubhaft machen, dass durch die Verschmelzung die Erfüllung ihrer Forderung gefährdet wird."
    },
    {
      "date": "2025-08-30",
      "id": "125148",
      "original_text": "Registerbekanntmachung nach dem Umwandlungsgesetz\nBayern Amtsgericht München HRB 260580\nSBI Management GmbH – Grünwald",
      "type": "Registerbekanntmachung nach dem Umwandlungsgesetz",
      "state": "Bayern",
      "amtsgericht": "Amtsgericht München",
      "registernummer": "HRB 260580",
      "registerart": "HRB",
      "company_name": "SBI Management GmbH",
      "company_seat": "Grünwald",
      "details": "30.08.2025 (Bekanntmachungsdatum)\n\nBayern Amtsgericht München HRB 260580\nRegisterbekanntmachung nach dem Umwandlungsgesetz 29.08.2025 (Eintragungsdatum)\n\nSBI Management GmbH\nGesellschaft mit beschränkter Haftung\nGrünwald\n\nDen Gläubigern der an der Verschmelzung beteiligten Rechtsträger ist, wenn sie binnen sechs Monaten nach dem Tag, an dem die Eintragung der Verschmelzung in das Register des Sitzes desjenigen Rechtsträgers, dessen Gläubiger sie sind, nach § 19 Abs. 3 UmwG als bekannt gemacht gilt, ihren Anspruch nach Grund und Höhe in Textform anmelden, Sicherheit zu leisten, soweit sie nicht Befriedigung verlangen können. Dieses Recht steht den Gläubigern jedoch nur zu, wenn sie glaubhaft machen, dass durch die Verschmelzung die Erfüllung ihrer Forderung gefährdet wird."
    },
    {
      "date": "2025-08-30",
      "id": "125149",
      "original_text": "Registerbekanntmachung nach dem Umwandlungsgesetz\nBayern Amtsgericht München HRB 270758\nCoros Boxhagener GmbH – Grünwald",
      "type": "Registerbekanntmachung nach dem Umwandlungsgesetz",
      "state": "Bayern",
      "amtsgericht": "Amtsgericht München",
      "registernummer": "HRB 270758",
      "registerart": "HRB",
      "company_name": "Coros Boxhagener GmbH",
      "company_seat": "Grünwald",
      "details": "30.08.2025 (Bekanntmachungsdatum)\n\nBayern Amtsgericht München HRB 270758\nRegisterbekanntmachung nach dem Umwandlungsgesetz 29.08.2025 (Eintragungsdatum)\n\nCoros Boxhagener GmbH\nGesellschaft mit beschränkter Haftung\nGrünwald\n\nDen Gläubigern der an der Verschmelzung beteiligten Rechtsträger ist, wenn sie binnen sechs Monaten nach dem Tag, an dem die Eintragung der Verschmelzung in das Register des Sitzes desjenigen Rechtsträgers, dessen Gläubiger sie sind, nach § 19 Abs. 3 UmwG als bekannt gemacht gilt, ihren Anspruch nach Grund und Höhe in Textform anmelden, Sicherheit zu leisten, soweit sie nicht Befriedigung verlangen können. Dieses Recht steht den Gläubigern jedoch nur zu, wenn sie glaubhaft machen, dass durch die Verschmelzung die Erfüllung ihrer Forderung gefährdet wird."
    },
    {
      "date": "2025-08-30",
      "id": "125150",
      "original_text": "Registerbekanntmachung nach dem Umwandlungsgesetz\nBayern Amtsgericht Traunstein HRA 15150\nBesitzunternehmen Helmut Ecklkofer e. K. – Neuötting",
      "type": "Registerbekanntmachung nach dem Umwandlungsgesetz",
      "state": "Bayern",
      "amtsgericht": "Amtsgericht Traunstein",
      "registernummer": "HRA 15150",
      "registerart": "HRA",
      "company_name": "Besitzunternehmen Helmut Ecklkofer e. K.",
      "company_seat": "Neuötting",
      "details": "30.08.2025 (Bekanntmachungsdatum)\n\nBayern Amtsgericht Traunstein HRA 15150\nRegisterbekanntmachung nach dem Umwandlungsgesetz 29.08.2025 (Eintragungsdatum)\n\nBesitzunternehmen Helmut Ecklkofer e. K.\nEinzelkaufmann / Einzelkauffrau\nNeuötting\n\nDen Gläubigern der an der Ausgliederung beteiligten Rechtsträger ist, wenn sie binnen sechs Monaten nach dem Tag, an dem die Eintragung der Ausgliederung in das Register des Sitzes desjenigen Rechtsträgers, dessen Gläubiger sie sind, nach §§ 125, 19 Abs. 3 UmwG als bekannt gemacht gilt, ihren Anspruch nach Grund und Höhe in Textform anmelden, Sicherheit zu leisten, soweit sie nicht Befriedigung verlangen können. Dieses Recht steht den Gläubigern jedoch nur zu, wenn sie glaubhaft machen, dass durch die Ausgliederung die Erfüllung ihrer Forderung gefährdet wird."
    },
    {
      "date": "2025-08-30",
      "id": "125151",
      "original_text": "Registerbekanntmachung nach dem Umwandlungsgesetz\nBayern Amtsgericht Aschaffenburg HRB 11673\nGeneralunternehmen für Projekt- und Schlüsselfertigbau Verwaltungs GmbH – Eschau",
      "type": "Registerbekanntmachung nach dem Umwandlungsgesetz",
      "state": "Bayern",
      "amtsgericht": "Amtsgericht Aschaffenburg",
      "registernummer": "HRB 11673",
      "registerart": "HRB",
      "company_name": "Generalunternehmen für Projekt- und Schlüsselfertigbau Verwaltungs GmbH",
      "company_seat": "Eschau",
      "details": "30.08.2025 (Bekanntmachungsdatum)\n\nBayern Amtsgericht Aschaffenburg HRB 11673\nRegisterbekanntmachung nach dem Umwandlungsgesetz 29.08.2025 (Eintragungsdatum)\n\nGeneralunternehmen für Projekt- und Schlüsselfertigbau Verwaltungs GmbH\nGesellschaft mit beschränkter Haftung\nEschau\n\nDen Gläubigern der an der Verschmelzung beteiligten Rechtsträger ist, wenn sie binnen sechs Monaten nach dem Tag, an dem die Eintragung der Verschmelzung in das Register des Sitzes desjenigen Rechtsträgers, dessen Gläubiger sie sind, nach § 19 Abs. 3 UmwG als bekannt gemacht gilt, ihren Anspruch nach Grund und Höhe in Textform anmelden, Sicherheit zu leisten, soweit sie nicht Befriedigung verlangen können. Dieses Recht steht den Gläubigern jedoch nur zu, wenn sie glaubhaft machen, dass durch die Verschmelzung die Erfüllung ihrer Forderung gefährdet wird."
    },
    {
      "date": "2025-08-30",
      "id": "125152",
      "original_text": "Registerbekanntmachung nach dem Umwandlungsgesetz\nBayern Amtsgericht Aschaffenburg HRB 18205\nKunkel Genuß GmbH – Hösbach",
      "type": "Registerbekanntmachung nach dem Umwandlungsgesetz",
      "state": "Bayern",
      "amtsgericht": "Amtsgericht Aschaffenburg",
      "registernummer": "HRB 18205",
      "registerart": "HRB",
      "company_name": "Kunkel Genuß GmbH",
      "company_seat": "Hösbach",
      "details": "30.08.2025 (Bekanntmachungsdatum)\n\nBayern Amtsgericht Aschaffenburg HRB 18205\nRegisterbekanntmachung nach dem Umwandlungsgesetz 29.08.2025 (Eintragungsdatum)\n\nKunkel Genuß GmbH\nGesellschaft mit beschränkter Haftung\nHösbach\n\nDen Gläubigern der an der Ausgliederung beteiligten Rechtsträger ist, wenn sie binnen sechs Monaten nach dem Tag, an dem die Eintragung der Ausgliederung in das Register des Sitzes desjenigen Rechtsträgers, dessen Gläubiger sie sind, nach §§ 125, 19 Abs. 3 UmwG als bekannt gemacht gilt, ihren Anspruch nach Grund und Höhe in Textform anmelden, Sicherheit zu leisten, soweit sie nicht Befriedigung verlangen können. Dieses Recht steht den Gläubigern jedoch nur zu, wenn sie glaubhaft machen, dass durch die Ausgliederung die Erfüllung ihrer Forderung gefährdet wird."
    },
    {
      "date": "2025-08-30",
      "id": "125153",
      "original_text": "Registerbekanntmachung nach dem Umwandlungsgesetz\nBayern Amtsgericht Schweinfurt HRA 10736\nKarl-Heinz Thiele Verpachtung e.K. – Schweinfurt",
      "type": "Registerbekanntmachung nach dem Umwandlungsgesetz",
      "state": "Bayern",
      "amtsgericht": "Amtsgericht Schweinfurt",
      "registernummer": "HRA 10736",
      "registerart": "HRA",
      "company_name": "Karl-Heinz Thiele Verpachtung e.K.",
      "company_seat": "Schweinfurt",
      "details": "30.08.2025 (Bekanntmachungsdatum)\n\nBayern Amtsgericht Schweinfurt HRA 10736\nRegisterbekanntmachung nach dem Umwandlungsgesetz 29.08.2025 (Eintragungsdatum)\n\nKarl-Heinz Thiele Verpachtung e.K.\nEinzelkaufmann / Einzelkauffrau\nSchweinfurt\n\nDen Gläubigern der an der Ausgliederung beteiligten Rechtsträger ist, wenn sie binnen sechs Monaten nach dem Tag, an dem die Eintragung der Ausgliederung in das Register des Sitzes desjenigen Rechtsträgers, dessen Gläubiger sie sind, nach §§ 125, 19 Abs. 3 UmwG als bekannt gemacht gilt, ihren Anspruch nach Grund und Höhe in Textform anmelden, Sicherheit zu leisten, soweit sie nicht Befriedigung verlangen können. Dieses Recht steht den Gläubigern jedoch nur zu, wenn sie glaubhaft machen, dass durch die Ausgliederung die Erfüllung ihrer Forderung gefährdet wird."
    },
    {
      "date": "2025-08-30",
      "id": "125154",
      "original_text": "Registerbekanntmachung nach dem Umwandlungsgesetz\nBayern Amtsgericht München HRB 206039\nFrankenberger & Pöhlmann GmbH – Oberhaching",
      "type": "Registerbekanntmachung nach dem Umwandlungsgesetz",
      "state": "Bayern",
      "amtsgericht": "Amtsgericht München",
      "registernummer": "HRB 206039",
      "registerart": "HRB",
      "company_name": "Frankenberger & Pöhlmann GmbH",
      "company_seat": "Oberhaching",
      "details": "30.08.2025 (Bekanntmachungsdatum)\n\nBayern Amtsgericht München HRB 206039\nRegisterbekanntmachung nach dem Umwandlungsgesetz 29.08.2025 (Eintragungsdatum)\n\nFrankenberger & Pöhlmann GmbH\nGesellschaft mit beschränkter Haftung\nOberhaching\n\nDen Gläubigern der an der Verschmelzung beteiligten Rechtsträger ist, wenn sie binnen sechs Monaten nach dem Tag, an dem die Eintragung der Verschmelzung in das Register des Sitzes desjenigen Rechtsträgers, dessen Gläubiger sie sind, nach § 19 Abs. 3 UmwG als bekannt gemacht gilt, ihren Anspruch nach Grund und Höhe in Textform anmelden, Sicherheit zu leisten, soweit sie nicht Befriedigung verlangen können. Dieses Recht steht den Gläubigern jedoch nur zu, wenn sie glaubhaft machen, dass durch die Verschmelzung die Erfüllung ihrer Forderung gefährdet wird."
    },
    {
      "date": "2025-08-30",
      "id": "125155",
      "original_text": "Registerbekanntmachung nach dem Umwandlungsgesetz\nBayern Amtsgericht München HRB 177695\nAP Solutions GmbH – München",
      "type": "Registerbekanntmachung nach dem Umwandlungsgesetz",
      "state": "Bayern",
      "amtsgericht": "Amtsgericht München",
      "registernummer": "HRB 177695",
      "registerart": "HRB",
      "company_name": "AP Solutions GmbH",
      "company_seat": "München",
      "details": "30.08.2025 (Bekanntmachungsdatum)\n\nBayern Amtsgericht München HRB 177695\nRegisterbekanntmachung nach dem Umwandlungsgesetz 29.08.2025 (Eintragungsdatum)\n\nAP Solutions GmbH\nGesellschaft mit beschränkter Haftung\nMünchen\n\nDen Gläubigern der an der Verschmelzung beteiligten Rechtsträger ist, wenn sie binnen sechs Monaten nach dem Tag, an dem die Eintragung der Verschmelzung in das Register des Sitzes desjenigen Rechtsträgers, dessen Gläubiger sie sind, nach § 19 Abs. 3 UmwG als bekannt gemacht gilt, ihren Anspruch nach Grund und Höhe in Textform anmelden, Sicherheit zu leisten, soweit sie nicht Befriedigung verlangen können. Dieses Recht steht den Gläubigern jedoch nur zu, wenn sie glaubhaft machen, dass durch die Verschmelzung die Erfüllung ihrer Forderung gefährdet wird."
    },
    {
      "date": "2025-08-30",
      "id": "125156",
      "original_text": "Registerbekanntmachung nach dem Umwandlungsgesetz\nBayern Amtsgericht Regensburg HRB 19779\nJörg Seeberger GmbH – Regensburg",
      "type": "Registerbekanntmachung nach dem Umwandlungsgesetz",
      "state": "Bayern",
      "amtsgericht": "Amtsgericht Regensburg",
      "registernummer": "HRB 19779",
      "registerart": "HRB",
      "company_name": "Jörg Seeberger GmbH",
      "company_seat": "Regensburg",
      "details": "30.08.2025 (Bekanntmachungsdatum)\n\nBayern Amtsgericht Regensburg HRB 19779\nRegisterbekanntmachung nach dem Umwandlungsgesetz 29.08.2025 (Eintragungsdatum)\n\nJörg Seeberger GmbH\nGesellschaft mit beschränkter Haftung\nRegensburg\n\nDen Gläubigern der an der Verschmelzung beteiligten Rechtsträger ist, wenn sie binnen sechs Monaten nach dem Tag, an dem die Eintragung der Verschmelzung in das Register des Sitzes desjenigen Rechtsträgers, dessen Gläubiger sie sind, nach § 19 Abs. 3 UmwG als bekannt gemacht gilt, ihren Anspruch nach Grund und Höhe in Textform anmelden, Sicherheit zu leisten, soweit sie nicht Befriedigung verlangen können. Dieses Recht steht den Gläubigern jedoch nur zu, wenn sie glaubhaft machen, dass durch die Verschmelzung die Erfüllung ihrer Forderung gefährdet wird."
    },
    {
      "date": "2025-08-30",
      "id": "125157",
      "original_text": "Registerbekanntmachung nach dem Umwandlungsgesetz\nBayern Amtsgericht München HRB 204546\nPASA - UAV Safety Solutions GmbH – Landsberied",
      "type": "Registerbekanntmachung nach dem Umwandlungsgesetz",
      "state": "Bayern",
      "amtsgericht": "Amtsgericht München",
      "registernummer": "HRB 204546",
      "registerart": "HRB",
      "company_name": "PASA - UAV Safety Solutions GmbH",
      "company_seat": "Landsberied",
      "details": "30.08.2025 (Bekanntmachungsdatum)\n\nBayern Amtsgericht München HRB 204546\nRegisterbekanntmachung nach dem Umwandlungsgesetz 29.08.2025 (Eintragungsdatum)\n\nPASA - UAV Safety Solutions GmbH\nGesellschaft mit beschränkter Haftung\nLandsberied\n\nDen Gläubigern der an der Verschmelzung beteiligten Rechtsträger ist, wenn sie binnen sechs Monaten nach dem Tag, an dem die Eintragung der Verschmelzung in das Register des Sitzes desjenigen Rechtsträgers, dessen Gläubiger sie sind, nach § 19 Abs. 3 UmwG als bekannt gemacht gilt, ihren Anspruch nach Grund und Höhe in Textform anmelden, Sicherheit zu leisten, soweit sie nicht Befriedigung verlangen können. Dieses Recht steht den Gläubigern jedoch nur zu, wenn sie glaubhaft machen, dass durch die Verschmelzung die Erfüllung ihrer Forderung gefährdet wird."
    },
    {
      "date": "2025-08-30",
      "id": "125158",
      "original_text": "Registerbekanntmachung nach dem Umwandlungsgesetz\nBayern Amtsgericht München HRB 236397\nTWE Truck Wash Eching GmbH – Grünwald",
      "type": "Registerbekanntmachung nach dem Umwandlungsgesetz",
      "state": "Bayern",
      "amtsgericht": "Amtsgericht München",
      "registernummer": "HRB 236397",
      "registerart": "HRB",
      "company_name": "TWE Truck Wash Eching GmbH",
      "company_seat": "Grünwald",
      "details": "30.08.2025 (Bekanntmachungsdatum)\n\nBayern Amtsgericht München HRB 236397\nRegisterbekanntmachung nach dem Umwandlungsgesetz 29.08.2025 (Eintragungsdatum)\n\nTWE Truck Wash Eching GmbH\nGesellschaft mit beschränkter Haftung\nGrünwald\n\nDen Gläubigern der an der Verschmelzung beteiligten Rechtsträger ist, wenn sie binnen sechs Monaten nach dem Tag, an dem die Eintragung der Verschmelzung in das Register des Sitzes desjenigen Rechtsträgers, dessen Gläubiger sie sind, nach § 19 Abs. 3 UmwG als bekannt gemacht gilt, ihren Anspruch nach Grund und Höhe in Textform anmelden, Sicherheit zu leisten, soweit sie nicht Befriedigung verlangen können. Dieses Recht steht den Gläubigern jedoch nur zu, wenn sie glaubhaft machen, dass durch die Verschmelzung die Erfüllung ihrer Forderung gefährdet wird."
    },
    {
      "date": "2025-08-30",
      "id": "125159",
      "original_text": "Registerbekanntmachung nach dem Umwandlungsgesetz\nBayern Amtsgericht München HRB 201304\nREAL Grundbesitz GmbH – Zorneding",
      "type": "Registerbekanntmachung nach dem Umwandlungsgesetz",
      "state": "Bayern",
      "amtsgericht": "Amtsgericht München",
      "registernummer": "HRB 201304",
      "registerart": "HRB",
      "company_name": "REAL Grundbesitz GmbH",
      "company_seat": "Zorneding",
      "details": "30.08.2025 (Bekanntmachungsdatum)\n\nBayern Amtsgericht München HRB 201304\nRegisterbekanntmachung nach dem Umwandlungsgesetz 29.08.2025 (Eintragungsdatum)\n\nREAL Grundbesitz GmbH\nGesellschaft mit beschränkter Haftung\nZorneding\n\nDen Gläubigern der an der Verschmelzung beteiligten Rechtsträger ist, wenn sie binnen sechs Monaten nach dem Tag, an dem die Eintragung der Verschmelzung in das Register des Sitzes desjenigen Rechtsträgers, dessen Gläubiger sie sind, nach § 19 Abs. 3 UmwG als bekannt gemacht gilt, ihren Anspruch nach Grund und Höhe in Textform anmelden, Sicherheit zu leisten, soweit sie nicht Befriedigung verlangen können. Dieses Recht steht den Gläubigern jedoch nur zu, wenn sie glaubhaft machen, dass durch die Verschmelzung die Erfüllung ihrer Forderung gefährdet wird."
    },
    {
      "date": "2025-08-30",
      "id": "125160",
      "original_text": "Registerbekanntmachung nach dem Umwandlungsgesetz\nBayern Amtsgericht München HRB 294281\nvaluna health GmbH – München",
      "type": "Registerbekanntmachung nach dem Umwandlungsgesetz",
      "state": "Bayern",
      "amtsgericht": "Amtsgericht München",
      "registernummer": "HRB 294281",
      "registerart": "HRB",
      "company_name": "valuna health GmbH",
      "company_seat": "München",
      "details": "30.08.2025 (Bekanntmachungsdatum)\n\nBayern Amtsgericht München HRB 294281\nRegisterbekanntmachung nach dem Umwandlungsgesetz 29.08.2025 (Eintragungsdatum)\n\nvaluna health GmbH\nGesellschaft mit beschränkter Haftung\nMünchen\n\nDen Gläubigern der an der Verschmelzung beteiligten Rechtsträger ist, wenn sie binnen sechs Monaten nach dem Tag, an dem die Eintragung der Verschmelzung in das Register des Sitzes desjenigen Rechtsträgers, dessen Gläubiger sie sind, nach § 19 Abs. 3 UmwG als bekannt gemacht gilt, ihren Anspruch nach Grund und Höhe in Textform anmelden, Sicherheit zu leisten, soweit sie nicht Befriedigung verlangen können. Dieses Recht steht den Gläubigern jedoch nur zu, wenn sie glaubhaft machen, dass durch die Verschmelzung die Erfüllung ihrer Forderung gefährdet wird."
    },
    {
      "date": "2025-08-30",
      "id": "125161",
      "original_text": "Registerbekanntmachung nach dem Umwandlungsgesetz\nBayern Amtsgericht München HRB 218589\ntv.gusto GmbH – München",
      "type": "Registerbekanntmachung nach dem Umwandlungsgesetz",
      "state": "Bayern",
      "amtsgericht": "Amtsgericht München",
      "registernummer": "HRB 218589",
      "registerart": "HRB",
      "company_name": "tv.gusto GmbH",
      "company_seat": "München",
      "details": "30.08.2025 (Bekanntmachungsdatum)\n\nBayern Amtsgericht München HRB 218589\nRegisterbekanntmachung nach dem Umwandlungsgesetz 29.08.2025 (Eintragungsdatum)\n\ntv.gusto GmbH\nGesellschaft mit beschränkter Haftung\nMünchen\n\nDen Gläubigern der an der Verschmelzung beteiligten Rechtsträger ist, wenn sie binnen sechs Monaten nach dem Tag, an dem die Eintragung der Verschmelzung in das Register des Sitzes desjenigen Rechtsträgers, dessen Gläubiger sie sind, nach § 19 Abs. 3 UmwG als bekannt gemacht gilt, ihren Anspruch nach Grund und Höhe in Textform anmelden, Sicherheit zu leisten, soweit sie nicht Befriedigung verlangen können. Dieses Recht steht den Gläubigern jedoch nur zu, wenn sie glaubhaft machen, dass durch die Verschmelzung die Erfüllung ihrer Forderung gefährdet wird."
    },
    {
      "date": "2025-08-30",
      "id": "125162",
      "original_text": "Registerbekanntmachung nach dem Umwandlungsgesetz\nBayern Amtsgericht Regensburg HRB 19948\nBirkenbuben Gastro GmbH – Regensburg",
      "type": "Registerbekanntmachung nach dem Umwandlungsgesetz",
      "state": "Bayern",
      "amtsgericht": "Amtsgericht Regensburg",
      "registernummer": "HRB 19948",
      "registerart": "HRB",
      "company_name": "Birkenbuben Gastro GmbH",
      "company_seat": "Regensburg",
      "details": "30.08.2025 (Bekanntmachungsdatum)\n\nBayern Amtsgericht Regensburg HRB 19948\nRegisterbekanntmachung nach dem Umwandlungsgesetz 29.08.2025 (Eintragungsdatum)\n\nBirkenbuben Gastro GmbH\nGesellschaft mit beschränkter Haftung\nRegensburg\n\nDen Gläubigern der an der Verschmelzung beteiligten Rechtsträger ist, wenn sie binnen sechs Monaten nach dem Tag, an dem die Eintragung der Verschmelzung in das Register des Sitzes desjenigen Rechtsträgers, dessen Gläubiger sie sind, nach § 19 Abs. 3 UmwG als bekannt gemacht gilt, ihren Anspruch nach Grund und Höhe in Textform anmelden, Sicherheit zu leisten, soweit sie nicht Befriedigung verlangen können. Dieses Recht steht den Gläubigern jedoch nur zu, wenn sie glaubhaft machen, dass durch die Verschmelzung die Erfüllung ihrer Forderung gefährdet wird."
    },
    {
      "date": "2025-08-30",
      "id": "125163",
      "original_text": "Registerbekanntmachung nach dem Umwandlungsgesetz\nBayern Amtsgericht Schweinfurt HRB 5237\nThiele Steuerberatungsgesellschaft mbH – Schweinfurt",
      "type": "Registerbekanntmachung nach dem Umwandlungsgesetz",
      "state": "Bayern",
      "amtsgericht": "Amtsgericht Schweinfurt",
      "registernummer": "HRB 5237",
      "registerart": "HRB",
      "company_name": "Thiele Steuerberatungsgesellschaft mbH",
      "company_seat": "Schweinfurt",
      "details": "30.08.2025 (Bekanntmachungsdatum)\n\nBayern Amtsgericht Schweinfurt HRB 5237\nRegisterbekanntmachung nach dem Umwandlungsgesetz 29.08.2025 (Eintragungsdatum)\n\nThiele Steuerberatungsgesellschaft mbH\nGesellschaft mit beschränkter Haftung\nSchweinfurt\n\nDen Gläubigern der an der Ausgliederung beteiligten Rechtsträger ist, wenn sie binnen sechs Monaten nach dem Tag, an dem die Eintragung der Ausgliederung in das Register des Sitzes desjenigen Rechtsträgers, dessen Gläubiger sie sind, nach §§ 125, 19 Abs. 3 UmwG als bekannt gemacht gilt, ihren Anspruch nach Grund und Höhe in Textform anmelden, Sicherheit zu leisten, soweit sie nicht Befriedigung verlangen können. Dieses Recht steht den Gläubigern jedoch nur zu, wenn sie glaubhaft machen, dass durch die Ausgliederung die Erfüllung ihrer Forderung gefährdet wird."
    },
    {
      "date": "2025-08-30",
      "id": "125164",
      "original_text": "Registerbekanntmachung nach dem Umwandlungsgesetz\nBayern Amtsgericht München HRB 240751\nQerkinaj Garten- und Landschaftsbau GmbH – München",
      "type": "Registerbekanntmachung nach dem Umwandlungsgesetz",
      "state": "Bayern",
      "amtsgericht": "Amtsgericht München",
      "registernummer": "HRB 240751",
      "registerart": "HRB",
      "company_name": "Qerkinaj Garten- und Landschaftsbau GmbH",
      "company_seat": "München",
      "details": "30.08.2025 (Bekanntmachungsdatum)\n\nBayern Amtsgericht München HRB 240751\nRegisterbekanntmachung nach dem Umwandlungsgesetz 29.08.2025 (Eintragungsdatum)\n\nQerkinaj Garten- und Landschaftsbau GmbH\nGesellschaft mit beschränkter Haftung\nMünchen\n\nDen Gläubigern der an der Ausgliederung beteiligten Rechtsträger ist, wenn sie binnen sechs Monaten nach dem Tag, an dem die Eintragung der Ausgliederung in das Register des Sitzes desjenigen Rechtsträgers, dessen Gläubiger sie sind, nach §§ 125, 19 Abs. 3 UmwG als bekannt gemacht gilt, ihren Anspruch nach Grund und Höhe in Textform anmelden, Sicherheit zu leisten, soweit sie nicht Befriedigung verlangen können. Dieses Recht steht den Gläubigern jedoch nur zu, wenn sie glaubhaft machen, dass durch die Ausgliederung die Erfüllung ihrer Forderung gefährdet wird."
    },
    {
      "date": "2025-08-30",
      "id": "125165",
      "original_text": "Registerbekanntmachung nach dem Umwandlungsgesetz\nBayern Amtsgericht München HRB 279943\nTion Battery Holding GmbH – München",
      "type": "Registerbekanntmachung nach dem Umwandlungsgesetz",
      "state": "Bayern",
      "amtsgericht": "Amtsgericht München",
      "registernummer": "HRB 279943",
      "registerart": "HRB",
      "company_name": "Tion Battery Holding GmbH",
      "company_seat": "München",
      "details": "30.08.2025 (Bekanntmachungsdatum)\n\nBayern Amtsgericht München HRB 279943\nRegisterbekanntmachung nach dem Umwandlungsgesetz 29.08.2025 (Eintragungsdatum)\n\nTion Battery Holding GmbH\nGesellschaft mit beschränkter Haftung\nMünchen\n\nDen Gläubigern der an der Verschmelzung beteiligten Rechtsträger ist, wenn sie binnen sechs Monaten nach dem Tag, an dem die Eintragung der Verschmelzung in das Register des Sitzes desjenigen Rechtsträgers, dessen Gläubiger sie sind, nach § 19 Abs. 3 UmwG als bekannt gemacht gilt, ihren Anspruch nach Grund und Höhe in Textform anmelden, Sicherheit zu leisten, soweit sie nicht Befriedigung verlangen können. Dieses Recht steht den Gläubigern jedoch nur zu, wenn sie glaubhaft machen, dass durch die Verschmelzung die Erfüllung ihrer Forderung gefährdet wird."
    },
    {
      "date": "2025-08-30",
      "id": "125166",
      "original_text": "Sonstige Registerbekanntmachung\nBayern Amtsgericht München HRB 127959\nWoodmark Consulting Aktiengesellschaft – Grasbrunn",
      "type": "Sonstige Registerbekanntmachung",
      "state": "Bayern",
      "amtsgericht": "Amtsgericht München",
      "registernummer": "HRB 127959",
      "registerart": "HRB",
      "company_name": "Woodmark Consulting Aktiengesellschaft",
      "company_seat": "Grasbrunn",
      "details": "30.08.2025 (Bekanntmachungsdatum)\n\nBayern Amtsgericht München HRB 127959\nSonstige Registerbekanntmachung 29.08.2025 (Eintragungsdatum)\n\nWoodmark Consulting Aktiengesellschaft\nAktiengesellschaft\nGrasbrunn\n\nDen Gläubigern der Gesellschaft, deren Forderungen begründet worden sind, bevor die Eintragung des Beschlusses bekanntgemacht worden ist, ist, wenn sie sich binnen sechs Monaten nach der Bekanntmachung zu diesem Zweck melden, Sicherheit zu leisten, soweit sie nicht Befriedigung verlangen können. Das Recht, Sicherheitsleistung zu verlangen, steht Gläubigern nicht zu, die im Fall des Insolvenzverfahrens ein Recht auf vorzugsweise Befriedigung aus einer Deckungsmasse haben, die nach gesetzlicher Vorschrift zu ihrem Schutz errichtet und staatlich überwacht ist."
    },
    {
      "date": "2025-08-30",
      "id": "125167",
      "original_text": "Registerbekanntmachung nach dem Umwandlungsgesetz\nBayern Amtsgericht Schweinfurt VR 10452\nBrieftauben- Reisevereinigung Münnerstadt e.V. – Münnerstadt",
      "type": "Registerbekanntmachung nach dem Umwandlungsgesetz",
      "state": "Bayern",
      "amtsgericht": "Amtsgericht Schweinfurt",
      "registernummer": "VR 10452",
      "registerart": "VR",
      "company_name": "Brieftauben- Reisevereinigung Münnerstadt e.V.",
      "company_seat": "Münnerstadt",
      "details": "30.08.2025 (Bekanntmachungsdatum)\n\nBayern Amtsgericht Schweinfurt VR 10452\nRegisterbekanntmachung nach dem Umwandlungsgesetz 29.08.2025 (Eintragungsdatum)\n\nBrieftauben- Reisevereinigung Münnerstadt e.V.\neingetragener Verein\nMünnerstadt\n\nDen Gläubigern der an der Verschmelzung beteiligten Rechtsträger ist, wenn sie binnen sechs Monaten nach dem Tag, an dem die Eintragung der Verschmelzung in das Register des Sitzes desjenigen Rechtsträgers, dessen Gläubiger sie sind, nach § 19 Abs. 3 UmwG als bekannt gemacht gilt, ihren Anspruch nach Grund und Höhe in Textform anmelden, Sicherheit zu leisten, soweit sie nicht Befriedigung verlangen können. Dieses Recht steht den Gläubigern jedoch nur zu, wenn sie glaubhaft machen, dass durch die Verschmelzung die Erfüllung ihrer Forderung gefährdet wird."
    },
    {
      "date": "2025-08-30",
      "id": "125168",
      "original_text": "Registerbekanntmachung nach dem Umwandlungsgesetz\nBayern Amtsgericht Fürth HRB 17353\nP&P Objekt ELF GmbH – Fürth",
      "type": "Registerbekanntmachung nach dem Umwandlungsgesetz",
      "state": "Bayern",
      "amtsgericht": "Amtsgericht Fürth",
      "registernummer": "HRB 17353",
      "registerart": "HRB",
      "company_name": "P&P Objekt ELF GmbH",
      "company_seat": "Fürth",
      "details": "30.08.2025 (Bekanntmachungsdatum)\n\nBayern Amtsgericht Fürth HRB 17353\nRegisterbekanntmachung nach dem Umwandlungsgesetz 29.08.2025 (Eintragungsdatum)\n\nP&P Objekt ELF GmbH\nGesellschaft mit beschränkter Haftung\nFürth\n\nDen Gläubigern der an der Verschmelzung beteiligten Rechtsträger ist, wenn sie binnen sechs Monaten nach dem Tag, an dem die Eintragung der Verschmelzung in das Register des Sitzes desjenigen Rechtsträgers, dessen Gläubiger sie sind, nach § 19 Abs. 3 UmwG als bekannt gemacht gilt, ihren Anspruch nach Grund und Höhe in Textform anmelden, Sicherheit zu leisten, soweit sie nicht Befriedigung verlangen können. Dieses Recht steht den Gläubigern jedoch nur zu, wenn sie glaubhaft machen, dass durch die Verschmelzung die Erfüllung ihrer Forderung gefährdet wird."
    },
    {
      "date": "2025-08-30",
      "id": "125169",
      "original_text": "Registerbekanntmachung nach dem Umwandlungsgesetz\nBayern Amtsgericht München HRA 121234\nVitus Hösl e.K. – Neuching",
      "type": "Registerbekanntmachung nach dem Umwandlungsgesetz",
      "state": "Bayern",
      "amtsgericht": "Amtsgericht München",
      "registernummer": "HRA 121234",
      "registerart": "HRA",
      "company_name": "Vitus Hösl e.K.",
      "company_seat": "Neuching",
      "details": "30.08.2025 (Bekanntmachungsdatum)\n\nBayern Amtsgericht München HRA 121234\nRegisterbekanntmachung nach dem Umwandlungsgesetz 29.08.2025 (Eintragungsdatum)\n\nVitus Hösl e.K.\nEinzelkaufmann / Einzelkauffrau\nNeuching\n\nDen Gläubigern der an der Ausgliederung beteiligten Rechtsträger ist, wenn sie binnen sechs Monaten nach dem Tag, an dem die Eintragung der Ausgliederung in das Register des Sitzes desjenigen Rechtsträgers, dessen Gläubiger sie sind, nach §§ 125, 19 Abs. 3 UmwG als bekannt gemacht gilt, ihren Anspruch nach Grund und Höhe in Textform anmelden, Sicherheit zu leisten, soweit sie nicht Befriedigung verlangen können. Dieses Recht steht den Gläubigern jedoch nur zu, wenn sie glaubhaft machen, dass durch die Ausgliederung die Erfüllung ihrer Forderung gefährdet wird."
    },
    {
      "date": "2025-08-30",
      "id": "125170",
      "original_text": "Registerbekanntmachung nach dem Umwandlungsgesetz\nBayern Amtsgericht München HRB 213102\nSenator Executive Search Partners GmbH – München",
      "type": "Registerbekanntmachung nach dem Umwandlungsgesetz",
      "state": "Bayern",
      "amtsgericht": "Amtsgericht München",
      "registernummer": "HRB 213102",
      "registerart": "HRB",
      "company_name": "Senator Executive Search Partners GmbH",
      "company_seat": "München",
      "details": "30.08.2025 (Bekanntmachungsdatum)\n\nBayern Amtsgericht München HRB 213102\nRegisterbekanntmachung nach dem Umwandlungsgesetz 29.08.2025 (Eintragungsdatum)\n\nSenator Executive Search Partners GmbH\nGesellschaft mit beschränkter Haftung\nMünchen\n\nDen Gläubigern der an der Verschmelzung beteiligten Rechtsträger ist, wenn sie binnen sechs Monaten nach dem Tag, an dem die Eintragung der Verschmelzung in das Register des Sitzes desjenigen Rechtsträgers, dessen Gläubiger sie sind, nach § 19 Abs. 3 UmwG als bekannt gemacht gilt, ihren Anspruch nach Grund und Höhe in Textform anmelden, Sicherheit zu leisten, soweit sie nicht Befriedigung verlangen können. Dieses Recht steht den Gläubigern jedoch nur zu, wenn sie glaubhaft machen, dass durch die Verschmelzung die Erfüllung ihrer Forderung gefährdet wird."
    },
    {
      "date": "2025-08-30",
      "id": "125171",
      "original_text": "Registerbekanntmachung nach dem Umwandlungsgesetz\nBayern Amtsgericht München HRB 187843\nAlvarez & Marsal Disputes and Investigations GmbH – München",
      "type": "Registerbekanntmachung nach dem Umwandlungsgesetz",
      "state": "Bayern",
      "amtsgericht": "Amtsgericht München",
      "registernummer": "HRB 187843",
      "registerart": "HRB",
      "company_name": "Alvarez & Marsal Disputes and Investigations GmbH",
      "company_seat": "München",
      "details": "30.08.2025 (Bekanntmachungsdatum)\n\nBayern Amtsgericht München HRB 187843\nRegisterbekanntmachung nach dem Umwandlungsgesetz 29.08.2025 (Eintragungsdatum)\n\nAlvarez & Marsal Disputes and Investigations GmbH\nGesellschaft mit beschränkter Haftung\nMünchen\n\nDen Gläubigern der an der Verschmelzung beteiligten Rechtsträger ist, wenn sie binnen sechs Monaten nach dem Tag, an dem die Eintragung der Verschmelzung in das Register des Sitzes desjenigen Rechtsträgers, dessen Gläubiger sie sind, nach § 19 Abs. 3 UmwG als bekannt gemacht gilt, ihren Anspruch nach Grund und Höhe in Textform anmelden, Sicherheit zu leisten, soweit sie nicht Befriedigung verlangen können. Dieses Recht steht den Gläubigern jedoch nur zu, wenn sie glaubhaft machen, dass durch die Verschmelzung die Erfüllung ihrer Forderung gefährdet wird."
    },
    {
      "date": "2025-08-30",
      "id": "125172",
      "original_text": "Registerbekanntmachung nach dem Umwandlungsgesetz\nBayern Amtsgericht München HRB 288188\nConvotis Munich GmbH – München",
      "type": "Registerbekanntmachung nach dem Umwandlungsgesetz",
      "state": "Bayern",
      "amtsgericht": "Amtsgericht München",
      "registernummer": "HRB 288188",
      "registerart": "HRB",
      "company_name": "Convotis Munich GmbH",
      "company_seat": "München",
      "details": "30.08.2025 (Bekanntmachungsdatum)\n\nBayern Amtsgericht München HRB 288188\nRegisterbekanntmachung nach dem Umwandlungsgesetz 29.08.2025 (Eintragungsdatum)\n\nConvotis Munich GmbH\nGesellschaft mit beschränkter Haftung\nMünchen\n\nDen Gläubigern der an der Verschmelzung beteiligten Rechtsträger ist, wenn sie binnen sechs Monaten nach dem Tag, an dem die Eintragung der Verschmelzung in das Register des Sitzes desjenigen Rechtsträgers, dessen Gläubiger sie sind, nach § 19 Abs. 3 UmwG als bekannt gemacht gilt, ihren Anspruch nach Grund und Höhe in Textform anmelden, Sicherheit zu leisten, soweit sie nicht Befriedigung verlangen können. Dieses Recht steht den Gläubigern jedoch nur zu, wenn sie glaubhaft machen, dass durch die Verschmelzung die Erfüllung ihrer Forderung gefährdet wird."
    },
    {
      "date": "2025-08-30",
      "id": "125173",
      "original_text": "Registerbekanntmachung nach dem Umwandlungsgesetz\nBayern Amtsgericht Weiden i. d. OPf. HRB 2100\nGottfried Neumann GmbH – Pressath",
      "type": "Registerbekanntmachung nach dem Umwandlungsgesetz",
      "state": "Bayern",
      "amtsgericht": "Amtsgericht Weiden i. d. OPf.",
      "registernummer": "HRB 2100",
      "registerart": "HRB",
      "company_name": "Gottfried Neumann GmbH",
      "company_seat": "Pressath",
      "details": "30.08.2025 (Bekanntmachungsdatum)\n\nBayern Amtsgericht Weiden i. d. OPf. HRB 2100\nRegisterbekanntmachung nach dem Umwandlungsgesetz 29.08.2025 (Eintragungsdatum)\n\nGottfried Neumann GmbH\nGesellschaft mit beschränkter Haftung\nPressath\n\nDen Gläubigern der an der Verschmelzung beteiligten Rechtsträger ist, wenn sie binnen sechs Monaten nach dem Tag, an dem die Eintragung der Verschmelzung in das Register des Sitzes desjenigen Rechtsträgers, dessen Gläubiger sie sind, nach § 19 Abs. 3 UmwG als bekannt gemacht gilt, ihren Anspruch nach Grund und Höhe in Textform anmelden, Sicherheit zu leisten, soweit sie nicht Befriedigung verlangen können. Dieses Recht steht den Gläubigern jedoch nur zu, wenn sie glaubhaft machen, dass durch die Verschmelzung die Erfüllung ihrer Forderung gefährdet wird."
    },
    {
      "date": "2025-08-30",
      "id": "125174",
      "original_text": "Registerbekanntmachung nach dem Umwandlungsgesetz\nBayern Amtsgericht München HRB 305179\nLa Poissonnerie Donat & Donat GmbH – Unterföhring",
      "type": "Registerbekanntmachung nach dem Umwandlungsgesetz",
      "state": "Bayern",
      "amtsgericht": "Amtsgericht München",
      "registernummer": "HRB 305179",
      "registerart": "HRB",
      "company_name": "La Poissonnerie Donat & Donat GmbH",
      "company_seat": "Unterföhring",
      "details": "30.08.2025 (Bekanntmachungsdatum)\n\nBayern Amtsgericht München HRB 305179\nRegisterbekanntmachung nach dem Umwandlungsgesetz 29.08.2025 (Eintragungsdatum)\n\nLa Poissonnerie Donat & Donat GmbH\nGesellschaft mit beschränkter Haftung\nUnterföhring\n\nDen Gläubigern des formwechselnden Rechtsträgers ist, wenn sie binnen sechs Monaten nach dem Tag, an dem die Eintragung des Formwechsels nach § 201 UmwG als bekannt gemacht gilt, ihren Anspruch nach Grund und Höhe in Textform anmelden, Sicherheit zu leisten, soweit sie nicht Befriedigung verlangen können. Dieses Recht steht den Gläubigern jedoch nur zu, wenn sie glaubhaft machen, dass durch den Formwechsel die Erfüllung ihrer Forderung gefährdet wird."
    },
    {
      "date": "2025-08-30",
      "id": "125175",
      "original_text": "Registerbekanntmachung nach dem Umwandlungsgesetz\nBayern Amtsgericht Augsburg HRA 22001\nWolfgang Girstenbrei Recycling, Handel und Hausmeisterservice e.K. – Blindheim",
      "type": "Registerbekanntmachung nach dem Umwandlungsgesetz",
      "state": "Bayern",
      "amtsgericht": "Amtsgericht Augsburg",
      "registernummer": "HRA 22001",
      "registerart": "HRA",
      "company_name": "Wolfgang Girstenbrei Recycling, Handel und Hausmeisterservice e.K.",
      "company_seat": "Blindheim",
      "details": "30.08.2025 (Bekanntmachungsdatum)\n\nBayern Amtsgericht Augsburg HRA 22001\nRegisterbekanntmachung nach dem Umwandlungsgesetz 29.08.2025 (Eintragungsdatum)\n\nWolfgang Girstenbrei Recycling, Handel und Hausmeisterservice e.K.\nEinzelkaufmann / Einzelkauffrau\nBlindheim\n\nDen Gläubigern der an der Ausgliederung beteiligten Rechtsträger ist, wenn sie binnen sechs Monaten nach dem Tag, an dem die Eintragung der Ausgliederung in das Register des Sitzes desjenigen Rechtsträgers, dessen Gläubiger sie sind, nach §§ 125, 19 Abs. 3 UmwG als bekannt gemacht gilt, ihren Anspruch nach Grund und Höhe in Textform anmelden, Sicherheit zu leisten, soweit sie nicht Befriedigung verlangen können. Dieses Recht steht den Gläubigern jedoch nur zu, wenn sie glaubhaft machen, dass durch die Ausgliederung die Erfüllung ihrer Forderung gefährdet wird."
    },
    {
      "date": "2025-08-30",
      "id": "125176",
      "original_text": "Registerbekanntmachung nach dem Umwandlungsgesetz\nBayern Amtsgericht München HRB 177695\nAP Solutions GmbH – München",
      "type": "Registerbekanntmachung nach dem Umwandlungsgesetz",
      "state": "Bayern",
      "amtsgericht": "Amtsgericht München",
      "registernummer": "HRB 177695",
      "registerart": "HRB",
      "company_name": "AP Solutions GmbH",
      "company_seat": "München",
      "details": "30.08.2025 (Bekanntmachungsdatum)\n\nBayern Amtsgericht München HRB 177695\nRegisterbekanntmachung nach dem Umwandlungsgesetz 29.08.2025 (Eintragungsdatum)\n\nAP Solutions GmbH\nGesellschaft mit beschränkter Haftung\nMünchen\n\nDen Gläubigern der an der Verschmelzung beteiligten Rechtsträger ist, wenn sie binnen sechs Monaten nach dem Tag, an dem die Eintragung der Verschmelzung in das Register des Sitzes desjenigen Rechtsträgers, dessen Gläubiger sie sind, nach § 19 Abs. 3 UmwG als bekannt gemacht gilt, ihren Anspruch nach Grund und Höhe in Textform anmelden, Sicherheit zu leisten, soweit sie nicht Befriedigung verlangen können. Dieses Recht steht den Gläubigern jedoch nur zu, wenn sie glaubhaft machen, dass durch die Verschmelzung die Erfüllung ihrer Forderung gefährdet wird."
    },
    {
      "date": "2025-08-30",
      "id": "125177",
      "original_text": "Registerbekanntmachung nach dem Umwandlungsgesetz\nBayern Amtsgericht München HRB 211704\nScan Global Logistics Commercial GmbH – Langenbach",
      "type": "Registerbekanntmachung nach dem Umwandlungsgesetz",
      "state": "Bayern",
      "amtsgericht": "Amtsgericht München",
      "registernummer": "HRB 211704",
      "registerart": "HRB",
      "company_name": "Scan Global Logistics Commercial GmbH",
      "company_seat": "Langenbach",
      "details": "30.08.2025 (Bekanntmachungsdatum)\n\nBayern Amtsgericht München HRB 211704\nRegisterbekanntmachung nach dem Umwandlungsgesetz 29.08.2025 (Eintragungsdatum)\n\nScan Global Logistics Commercial GmbH\nGesellschaft mit beschränkter Haftung\nLangenbach\n\nDen Gläubigern der an der Verschmelzung beteiligten Rechtsträger ist, wenn sie binnen sechs Monaten nach dem Tag, an dem die Eintragung der Verschmelzung in das Register des Sitzes desjenigen Rechtsträgers, dessen Gläubiger sie sind, nach § 19 Abs. 3 UmwG als bekannt gemacht gilt, ihren Anspruch nach Grund und Höhe in Textform anmelden, Sicherheit zu leisten, soweit sie nicht Befriedigung verlangen können. Dieses Recht steht den Gläubigern jedoch nur zu, wenn sie glaubhaft machen, dass durch die Verschmelzung die Erfüllung ihrer Forderung gefährdet wird."
    },
    {
      "date": "2025-08-30",
      "id": "125178",
      "original_text": "Registerbekanntmachung nach dem Umwandlungsgesetz\nBayern Amtsgericht Passau HRB 9491\nZander Automobile GmbH – Windorf",
      "type": "Registerbekanntmachung nach dem Umwandlungsgesetz",
      "state": "Bayern",
      "amtsgericht": "Amtsgericht Passau",
      "registernummer": "HRB 9491",
      "registerart": "HRB",
      "company_name": "Zander Automobile GmbH",
      "company_seat": "Windorf",
      "details": "30.08.2025 (Bekanntmachungsdatum)\n\nBayern Amtsgericht Passau HRB 9491\nRegisterbekanntmachung nach dem Umwandlungsgesetz 29.08.2025 (Eintragungsdatum)\n\nZander Automobile GmbH\nGesellschaft mit beschränkter Haftung\nWindorf\n\nDen Gläubigern der an der Ausgliederung beteiligten Rechtsträger ist, wenn sie binnen sechs Monaten nach dem Tag, an dem die Eintragung der Ausgliederung in das Register des Sitzes desjenigen Rechtsträgers, dessen Gläubiger sie sind, nach §§ 125, 19 Abs. 3 UmwG als bekannt gemacht gilt, ihren Anspruch nach Grund und Höhe in Textform anmelden, Sicherheit zu leisten, soweit sie nicht Befriedigung verlangen können. Dieses Recht steht den Gläubigern jedoch nur zu, wenn sie glaubhaft machen, dass durch die Ausgliederung die Erfüllung ihrer Forderung gefährdet wird."
    },
    {
      "date": "2025-08-30",
      "id": "125179",
      "original_text": "Registerbekanntmachung nach dem Umwandlungsgesetz\nBayern Amtsgericht Traunstein HRB 32479\nJosef Sticht KFZ-Technik GmbH – Trostberg",
      "type": "Registerbekanntmachung nach dem Umwandlungsgesetz",
      "state": "Bayern",
      "amtsgericht": "Amtsgericht Traunstein",
      "registernummer": "HRB 32479",
      "registerart": "HRB",
      "company_name": "Josef Sticht KFZ-Technik GmbH",
      "company_seat": "Trostberg",
      "details": "30.08.2025 (Bekanntmachungsdatum)\n\nBayern Amtsgericht Traunstein HRB 32479\nRegisterbekanntmachung nach dem Umwandlungsgesetz 29.08.2025 (Eintragungsdatum)\n\nJosef Sticht KFZ-Technik GmbH\nGesellschaft mit beschränkter Haftung\nTrostberg\n\nDen Gläubigern der an der Ausgliederung beteiligten Rechtsträger ist, wenn sie binnen sechs Monaten nach dem Tag, an dem die Eintragung der Ausgliederung in das Register des Sitzes desjenigen Rechtsträgers, dessen Gläubiger sie sind, nach §§ 125, 19 Abs. 3 UmwG als bekannt gemacht gilt, ihren Anspruch nach Grund und Höhe in Textform anmelden, Sicherheit zu leisten, soweit sie nicht Befriedigung verlangen können. Dieses Recht steht den Gläubigern jedoch nur zu, wenn sie glaubhaft machen, dass durch die Ausgliederung die Erfüllung ihrer Forderung gefährdet wird."
    },
    {
      "date": "2025-08-30",
      "id": "125180",
      "original_text": "Registerbekanntmachung nach dem Umwandlungsgesetz\nBayern Amtsgericht Regensburg HRB 16285\nPalatine GmbH – Regenstauf",
      "type": "Registerbekanntmachung nach dem Umwandlungsgesetz",
      "state": "Bayern",
      "amtsgericht": "Amtsgericht Regensburg",
      "registernummer": "HRB 16285",
      "registerart": "HRB",
      "company_name": "Palatine GmbH",
      "company_seat": "Regenstauf",
      "details": "30.08.2025 (Bekanntmachungsdatum)\n\nBayern Amtsgericht Regensburg HRB 16285\nRegisterbekanntmachung nach dem Umwandlungsgesetz 29.08.2025 (Eintragungsdatum)\n\nPalatine GmbH\nGesellschaft mit beschränkter Haftung\nRegenstauf\n\nDen Gläubigern der an der Verschmelzung beteiligten Rechtsträger ist, wenn sie binnen sechs Monaten nach dem Tag, an dem die Eintragung der Verschmelzung in das Register des Sitzes desjenigen Rechtsträgers, dessen Gläubiger sie sind, nach § 19 Abs. 3 UmwG als bekannt gemacht gilt, ihren Anspruch nach Grund und Höhe in Textform anmelden, Sicherheit zu leisten, soweit sie nicht Befriedigung verlangen können. Dieses Recht steht den Gläubigern jedoch nur zu, wenn sie glaubhaft machen, dass durch die Verschmelzung die Erfüllung ihrer Forderung gefährdet wird."
    },
    {
      "date": "2025-08-30",
      "id": "125181",
      "original_text": "Registerbekanntmachung nach dem Umwandlungsgesetz\nBayern Amtsgericht Ingolstadt HRB 143652\nOptik Scheere GmbH – Wolnzach",
      "type": "Registerbekanntmachung nach dem Umwandlungsgesetz",
      "state": "Bayern",
      "amtsgericht": "Amtsgericht Ingolstadt",
      "registernummer": "HRB 143652",
      "registerart": "HRB",
      "company_name": "Optik Scheere GmbH",
      "company_seat": "Wolnzach",
      "details": "30.08.2025 (Bekanntmachungsdatum)\n\nBayern Amtsgericht Ingolstadt HRB 143652\nRegisterbekanntmachung nach dem Umwandlungsgesetz 29.08.2025 (Eintragungsdatum)\n\nOptik Scheere GmbH\nGesellschaft mit beschränkter Haftung\nWolnzach\n\nDen Gläubigern der an der Verschmelzung beteiligten Rechtsträger ist, wenn sie binnen sechs Monaten nach dem Tag, an dem die Eintragung der Verschmelzung in das Register des Sitzes desjenigen Rechtsträgers, dessen Gläubiger sie sind, nach § 19 Abs. 3 UmwG als bekannt gemacht gilt, ihren Anspruch nach Grund und Höhe in Textform anmelden, Sicherheit zu leisten, soweit sie nicht Befriedigung verlangen können. Dieses Recht steht den Gläubigern jedoch nur zu, wenn sie glaubhaft machen, dass durch die Verschmelzung die Erfüllung ihrer Forderung gefährdet wird."
    },
    {
      "date": "2025-08-30",
      "id": "125182",
      "original_text": "Registerbekanntmachung nach dem Umwandlungsgesetz\nBayern Amtsgericht München HRB 177695\nAP Solutions GmbH – München",
      "type": "Registerbekanntmachung nach dem Umwandlungsgesetz",
      "state": "Bayern",
      "amtsgericht": "Amtsgericht München",
      "registernummer": "HRB 177695",
      "registerart": "HRB",
      "company_name": "AP Solutions GmbH",
      "company_seat": "München",
      "details": "30.08.2025 (Bekanntmachungsdatum)\n\nBayern Amtsgericht München HRB 177695\nRegisterbekanntmachung nach dem Umwandlungsgesetz 29.08.2025 (Eintragungsdatum)\n\nAP Solutions GmbH\nGesellschaft mit beschränkter Haftung\nMünchen\n\nDen Gläubigern der an der Verschmelzung beteiligten Rechtsträger ist, wenn sie binnen sechs Monaten nach dem Tag, an dem die Eintragung der Verschmelzung in das Register des Sitzes desjenigen Rechtsträgers, dessen Gläubiger sie sind, nach § 19 Abs. 3 UmwG als bekannt gemacht gilt, ihren Anspruch nach Grund und Höhe in Textform anmelden, Sicherheit zu leisten, soweit sie nicht Befriedigung verlangen können. Dieses Recht steht den Gläubigern jedoch nur zu, wenn sie glaubhaft machen, dass durch die Verschmelzung die Erfüllung ihrer Forderung gefährdet wird."
    },
    {
      "date": "2025-08-30",
      "id": "125183",
      "original_text": "Registerbekanntmachung nach dem Umwandlungsgesetz\nBayern Amtsgericht München HRB 222706\nSahlberg GmbH – Feldkirchen",
      "type": "Registerbekanntmachung nach dem Umwandlungsgesetz",
      "state": "Bayern",
      "amtsgericht": "Amtsgericht München",
      "registernummer": "HRB 222706",
      "registerart": "HRB",
      "company_name": "Sahlberg GmbH",
      "company_seat": "Feldkirchen",
      "details": "30.08.2025 (Bekanntmachungsdatum)\n\nBayern Amtsgericht München HRB 222706\nRegisterbekanntmachung nach dem Umwandlungsgesetz 29.08.2025 (Eintragungsdatum)\n\nSahlberg GmbH\nGesellschaft mit beschränkter Haftung\nFeldkirchen\n\nDen Gläubigern des formwechselnden Rechtsträgers ist, wenn sie binnen sechs Monaten nach dem Tag, an dem die Eintragung des Formwechsels nach § 201 UmwG als bekannt gemacht gilt, ihren Anspruch nach Grund und Höhe in Textform anmelden, Sicherheit zu leisten, soweit sie nicht Befriedigung verlangen können. Dieses Recht steht den Gläubigern jedoch nur zu, wenn sie glaubhaft machen, dass durch den Formwechsel die Erfüllung ihrer Forderung gefährdet wird."
    },
    {
      "date": "2025-08-30",
      "id": "125184",
      "original_text": "Registerbekanntmachung nach dem Umwandlungsgesetz\nBayern Amtsgericht München HRB 271492\nAniCura Online Germany GmbH – Unterhaching",
      "type": "Registerbekanntmachung nach dem Umwandlungsgesetz",
      "state": "Bayern",
      "amtsgericht": "Amtsgericht München",
      "registernummer": "HRB 271492",
      "registerart": "HRB",
      "company_name": "AniCura Online Germany GmbH",
      "company_seat": "Unterhaching",
      "details": "30.08.2025 (Bekanntmachungsdatum)\n\nBayern Amtsgericht München HRB 271492\nRegisterbekanntmachung nach dem Umwandlungsgesetz 29.08.2025 (Eintragungsdatum)\n\nAniCura Online Germany GmbH\nGesellschaft mit beschränkter Haftung\nUnterhaching\n\nDen Gläubigern der an der Verschmelzung beteiligten Rechtsträger ist, wenn sie binnen sechs Monaten nach dem Tag, an dem die Eintragung der Verschmelzung in das Register des Sitzes desjenigen Rechtsträgers, dessen Gläubiger sie sind, nach § 19 Abs. 3 UmwG als bekannt gemacht gilt, ihren Anspruch nach Grund und Höhe in Textform anmelden, Sicherheit zu leisten, soweit sie nicht Befriedigung verlangen können. Dieses Recht steht den Gläubigern jedoch nur zu, wenn sie glaubhaft machen, dass durch die Verschmelzung die Erfüllung ihrer Forderung gefährdet wird."
    },
    {
      "date": "2025-08-30",
      "id": "125185",
      "original_text": "Registerbekanntmachung nach dem Umwandlungsgesetz\nBayern Amtsgericht Fürth HRB 10745\nP & P Wohnbau Franken GmbH – Fürth",
      "type": "Registerbekanntmachung nach dem Umwandlungsgesetz",
      "state": "Bayern",
      "amtsgericht": "Amtsgericht Fürth",
      "registernummer": "HRB 10745",
      "registerart": "HRB",
      "company_name": "P & P Wohnbau Franken GmbH",
      "company_seat": "Fürth",
      "details": "30.08.2025 (Bekanntmachungsdatum)\n\nBayern Amtsgericht Fürth HRB 10745\nRegisterbekanntmachung nach dem Umwandlungsgesetz 29.08.2025 (Eintragungsdatum)\n\nP & P Wohnbau Franken GmbH\nGesellschaft mit beschränkter Haftung\nFürth\n\nDen Gläubigern der an der Verschmelzung beteiligten Rechtsträger ist, wenn sie binnen sechs Monaten nach dem Tag, an dem die Eintragung der Verschmelzung in das Register des Sitzes desjenigen Rechtsträgers, dessen Gläubiger sie sind, nach § 19 Abs. 3 UmwG als bekannt gemacht gilt, ihren Anspruch nach Grund und Höhe in Textform anmelden, Sicherheit zu leisten, soweit sie nicht Befriedigung verlangen können. Dieses Recht steht den Gläubigern jedoch nur zu, wenn sie glaubhaft machen, dass durch die Verschmelzung die Erfüllung ihrer Forderung gefährdet wird."
    },
    {
      "date": "2025-08-30",
      "id": "125186",
      "original_text": "Registerbekanntmachung nach dem Umwandlungsgesetz\nBayern Amtsgericht Würzburg HRB 5161\nBerthold Bauelemente Verwaltungs GmbH – Arnstein-Neubessingen",
      "type": "Registerbekanntmachung nach dem Umwandlungsgesetz",
      "state": "Bayern",
      "amtsgericht": "Amtsgericht Würzburg",
      "registernummer": "HRB 5161",
      "registerart": "HRB",
      "company_name": "Berthold Bauelemente Verwaltungs GmbH",
      "company_seat": "Arnstein-Neubessingen",
      "details": "30.08.2025 (Bekanntmachungsdatum)\n\nBayern Amtsgericht Würzburg HRB 5161\nRegisterbekanntmachung nach dem Umwandlungsgesetz 29.08.2025 (Eintragungsdatum)\n\nBerthold Bauelemente Verwaltungs GmbH\nGesellschaft mit beschränkter Haftung\nArnstein-Neubessingen\n\nDen Gläubigern der an der Verschmelzung beteiligten Rechtsträger ist, wenn sie binnen sechs Monaten nach dem Tag, an dem die Eintragung der Verschmelzung in das Register des Sitzes desjenigen Rechtsträgers, dessen Gläubiger sie sind, nach § 19 Abs. 3 UmwG als bekannt gemacht gilt, ihren Anspruch nach Grund und Höhe in Textform anmelden, Sicherheit zu leisten, soweit sie nicht Befriedigung verlangen können. Dieses Recht steht den Gläubigern jedoch nur zu, wenn sie glaubhaft machen, dass durch die Verschmelzung die Erfüllung ihrer Forderung gefährdet wird."
    },
    {
      "date": "2025-08-30",
      "id": "125187",
      "original_text": "Registerbekanntmachung nach dem Umwandlungsgesetz\nBayern Amtsgericht München HRB 173089\nDSI Schönbrunn gemeinnützige GmbH – Röhrmoos, Ortsteil Schönbrunn",
      "type": "Registerbekanntmachung nach dem Umwandlungsgesetz",
      "state": "Bayern",
      "amtsgericht": "Amtsgericht München",
      "registernummer": "HRB 173089",
      "registerart": "HRB",
      "company_name": "DSI Schönbrunn gemeinnützige GmbH",
      "company_seat": "Röhrmoos, Ortsteil Schönbrunn",
      "details": "30.08.2025 (Bekanntmachungsdatum)\n\nBayern Amtsgericht München HRB 173089\nRegisterbekanntmachung nach dem Umwandlungsgesetz 29.08.2025 (Eintragungsdatum)\n\nDSI Schönbrunn gemeinnützige GmbH\nGesellschaft mit beschränkter Haftung\nRöhrmoos, Ortsteil Schönbrunn\n\nDen Gläubigern der an der Verschmelzung beteiligten Rechtsträger ist, wenn sie binnen sechs Monaten nach dem Tag, an dem die Eintragung der Verschmelzung in das Register des Sitzes desjenigen Rechtsträgers, dessen Gläubiger sie sind, nach § 19 Abs. 3 UmwG als bekannt gemacht gilt, ihren Anspruch nach Grund und Höhe in Textform anmelden, Sicherheit zu leisten, soweit sie nicht Befriedigung verlangen können. Dieses Recht steht den Gläubigern jedoch nur zu, wenn sie glaubhaft machen, dass durch die Verschmelzung die Erfüllung ihrer Forderung gefährdet wird."
    },
    {
      "date": "2025-08-30",
      "id": "125188",
      "original_text": "Registerbekanntmachung nach dem Umwandlungsgesetz\nBayern Amtsgericht München HRB 291847\nNiederaltenburger Verwaltungs GmbH – Weyarn",
      "type": "Registerbekanntmachung nach dem Umwandlungsgesetz",
      "state": "Bayern",
      "amtsgericht": "Amtsgericht München",
      "registernummer": "HRB 291847",
      "registerart": "HRB",
      "company_name": "Niederaltenburger Verwaltungs GmbH",
      "company_seat": "Weyarn",
      "details": "30.08.2025 (Bekanntmachungsdatum)\n\nBayern Amtsgericht München HRB 291847\nRegisterbekanntmachung nach dem Umwandlungsgesetz 29.08.2025 (Eintragungsdatum)\n\nNiederaltenburger Verwaltungs GmbH\nGesellschaft mit beschränkter Haftung\nWeyarn\n\nDen Gläubigern der an der Verschmelzung beteiligten Rechtsträger ist, wenn sie binnen sechs Monaten nach dem Tag, an dem die Eintragung der Verschmelzung in das Register des Sitzes desjenigen Rechtsträgers, dessen Gläubiger sie sind, nach § 19 Abs. 3 UmwG als bekannt gemacht gilt, ihren Anspruch nach Grund und Höhe in Textform anmelden, Sicherheit zu leisten, soweit sie nicht Befriedigung verlangen können. Dieses Recht steht den Gläubigern jedoch nur zu, wenn sie glaubhaft machen, dass durch die Verschmelzung die Erfüllung ihrer Forderung gefährdet wird."
    },
    {
      "date": "2025-08-30",
      "id": "125189",
      "original_text": "Registerbekanntmachung nach dem Umwandlungsgesetz\nBayern Amtsgericht München HRB 176968\nStern Stewart Capital GmbH – München",
      "type": "Registerbekanntmachung nach dem Umwandlungsgesetz",
      "state": "Bayern",
      "amtsgericht": "Amtsgericht München",
      "registernummer": "HRB 176968",
      "registerart": "HRB",
      "company_name": "Stern Stewart Capital GmbH",
      "company_seat": "München",
      "details": "30.08.2025 (Bekanntmachungsdatum)\n\nBayern Amtsgericht München HRB 176968\nRegisterbekanntmachung nach dem Umwandlungsgesetz 29.08.2025 (Eintragungsdatum)\n\nStern Stewart Capital GmbH\nGesellschaft mit beschränkter Haftung\nMünchen\n\nDen Gläubigern der an der Verschmelzung beteiligten Rechtsträger ist, wenn sie binnen sechs Monaten nach dem Tag, an dem die Eintragung der Verschmelzung in das Register des Sitzes desjenigen Rechtsträgers, dessen Gläubiger sie sind, nach § 19 Abs. 3 UmwG als bekannt gemacht gilt, ihren Anspruch nach Grund und Höhe in Textform anmelden, Sicherheit zu leisten, soweit sie nicht Befriedigung verlangen können. Dieses Recht steht den Gläubigern jedoch nur zu, wenn sie glaubhaft machen, dass durch die Verschmelzung die Erfüllung ihrer Forderung gefährdet wird."
    },
    {
      "date": "2025-08-30",
      "id": "125190",
      "original_text": "Registerbekanntmachung nach dem Umwandlungsgesetz\nBayern Amtsgericht Schweinfurt HRA 10665\nJulius Müller e. K. – Unsleben",
      "type": "Registerbekanntmachung nach dem Umwandlungsgesetz",
      "state": "Bayern",
      "amtsgericht": "Amtsgericht Schweinfurt",
      "registernummer": "HRA 10665",
      "registerart": "HRA",
      "company_name": "Julius Müller e. K.",
      "company_seat": "Unsleben",
      "details": "30.08.2025 (Bekanntmachungsdatum)\n\nBayern Amtsgericht Schweinfurt HRA 10665\nRegisterbekanntmachung nach dem Umwandlungsgesetz 29.08.2025 (Eintragungsdatum)\n\nJulius Müller e. K.\nEinzelkaufmann / Einzelkauffrau\nUnsleben\n\nDen Gläubigern der an der Ausgliederung beteiligten Rechtsträger ist, wenn sie binnen sechs Monaten nach dem Tag, an dem die Eintragung der Ausgliederung in das Register des Sitzes desjenigen Rechtsträgers, dessen Gläubiger sie sind, nach §§ 125, 19 Abs. 3 UmwG als bekannt gemacht gilt, ihren Anspruch nach Grund und Höhe in Textform anmelden, Sicherheit zu leisten, soweit sie nicht Befriedigung verlangen können. Dieses Recht steht den Gläubigern jedoch nur zu, wenn sie glaubhaft machen, dass durch die Ausgliederung die Erfüllung ihrer Forderung gefährdet wird."
    },
    {
      "date": "2025-08-30",
      "id": "125191",
      "original_text": "Registerbekanntmachung nach dem Umwandlungsgesetz\nBayern Amtsgericht Traunstein HRA 14921\nJosef Sticht e.K. – Trostberg",
      "type": "Registerbekanntmachung nach dem Umwandlungsgesetz",
      "state": "Bayern",
      "amtsgericht": "Amtsgericht Traunstein",
      "registernummer": "HRA 14921",
      "registerart": "HRA",
      "company_name": "Josef Sticht e.K.",
      "company_seat": "Trostberg",
      "details": "30.08.2025 (Bekanntmachungsdatum)\n\nBayern Amtsgericht Traunstein HRA 14921\nRegisterbekanntmachung nach dem Umwandlungsgesetz 29.08.2025 (Eintragungsdatum)\n\nJosef Sticht e.K.\nEinzelkaufmann / Einzelkauffrau\nTrostberg\n\nDen Gläubigern der an der Ausgliederung beteiligten Rechtsträger ist, wenn sie binnen sechs Monaten nach dem Tag, an dem die Eintragung der Ausgliederung in das Register des Sitzes desjenigen Rechtsträgers, dessen Gläubiger sie sind, nach §§ 125, 19 Abs. 3 UmwG als bekannt gemacht gilt, ihren Anspruch nach Grund und Höhe in Textform anmelden, Sicherheit zu leisten, soweit sie nicht Befriedigung verlangen können. Dieses Recht steht den Gläubigern jedoch nur zu, wenn sie glaubhaft machen, dass durch die Ausgliederung die Erfüllung ihrer Forderung gefährdet wird."
    },
    {
      "date": "2025-08-30",
      "id": "125192",
      "original_text": "Registerbekanntmachung nach dem Umwandlungsgesetz\nBayern Amtsgericht Ingolstadt HRB 12488\nMalerbetrieb Hopp GmbH – Neuburg a.d.Donau",
      "type": "Registerbekanntmachung nach dem Umwandlungsgesetz",
      "state": "Bayern",
      "amtsgericht": "Amtsgericht Ingolstadt",
      "registernummer": "HRB 12488",
      "registerart": "HRB",
      "company_name": "Malerbetrieb Hopp GmbH",
      "company_seat": "Neuburg a.d.Donau",
      "details": "30.08.2025 (Bekanntmachungsdatum)\n\nBayern Amtsgericht Ingolstadt HRB 12488\nRegisterbekanntmachung nach dem Umwandlungsgesetz 29.08.2025 (Eintragungsdatum)\n\nMalerbetrieb Hopp GmbH\nGesellschaft mit beschränkter Haftung\nNeuburg a.d.Donau\n\nDen Gläubigern der an der Ausgliederung beteiligten Rechtsträger ist, wenn sie binnen sechs Monaten nach dem Tag, an dem die Eintragung der Ausgliederung in das Register des Sitzes desjenigen Rechtsträgers, dessen Gläubiger sie sind, nach §§ 125, 19 Abs. 3 UmwG als bekannt gemacht gilt, ihren Anspruch nach Grund und Höhe in Textform anmelden, Sicherheit zu leisten, soweit sie nicht Befriedigung verlangen können. Dieses Recht steht den Gläubigern jedoch nur zu, wenn sie glaubhaft machen, dass durch die Ausgliederung die Erfüllung ihrer Forderung gefährdet wird."
    },
    {
      "date": "2025-08-30",
      "id": "125193",
      "original_text": "Registerbekanntmachung nach dem Umwandlungsgesetz\nBayern Amtsgericht München HRB 269575\nPNZ B21 Beteiligungs UG (haftungsbeschränkt) – München",
      "type": "Registerbekanntmachung nach dem Umwandlungsgesetz",
      "state": "Bayern",
      "amtsgericht": "Amtsgericht München",
      "registernummer": "HRB 269575",
      "registerart": "HRB",
      "company_name": "PNZ B21 Beteiligungs UG (haftungsbeschränkt)",
      "company_seat": "München",
      "details": "30.08.2025 (Bekanntmachungsdatum)\n\nBayern Amtsgericht München HRB 269575\nRegisterbekanntmachung nach dem Umwandlungsgesetz 29.08.2025 (Eintragungsdatum)\n\nPNZ B21 Beteiligungs UG (haftungsbeschränkt)\nGesellschaft mit beschränkter Haftung\nMünchen\n\nDen Gläubigern der an der Verschmelzung beteiligten Rechtsträger ist, wenn sie binnen sechs Monaten nach dem Tag, an dem die Eintragung der Verschmelzung in das Register des Sitzes desjenigen Rechtsträgers, dessen Gläubiger sie sind, nach § 19 Abs. 3 UmwG als bekannt gemacht gilt, ihren Anspruch nach Grund und Höhe in Textform anmelden, Sicherheit zu leisten, soweit sie nicht Befriedigung verlangen können. Dieses Recht steht den Gläubigern jedoch nur zu, wenn sie glaubhaft machen, dass durch die Verschmelzung die Erfüllung ihrer Forderung gefährdet wird."
    },
    {
      "date": "2025-08-30",
      "id": "125194",
      "original_text": "Einreichung neuer Dokumente\nBayern Amtsgericht Weiden i. d. OPf. HRB 88\nHart Keramik AG – Waldsassen",
      "type": "Einreichung neuer Dokumente",
      "state": "Bayern",
      "amtsgericht": "Amtsgericht Weiden i. d. OPf.",
      "registernummer": "HRB 88",
      "registerart": "HRB",
      "company_name": "Hart Keramik AG",
      "company_seat": "Waldsassen",
      "details": "30.08.2025 (Bekanntmachungsdatum)\n\nBayern Amtsgericht Weiden i. d. OPf. HRB 88\nEinreichung neuer Dokumente 29.08.2025 (Eintragungsdatum)\n\nHart Keramik AG\nAktiengesellschaft\nWaldsassen\n\nDem Amtsgericht Weiden i.d.OPf. -Registergericht- ist eine Liste der Mitglieder des Aufsichtsrats eingereicht worden, § 106 AktG."
    },
    {
      "date": "2025-08-30",
      "id": "125195",
      "original_text": "Registerbekanntmachung nach dem Umwandlungsgesetz\nBayern Amtsgericht München HRA 121230\nMario Arnold Schlüsseldienst München e.K. – München",
      "type": "Registerbekanntmachung nach dem Umwandlungsgesetz",
      "state": "Bayern",
      "amtsgericht": "Amtsgericht München",
      "registernummer": "HRA 121230",
      "registerart": "HRA",
      "company_name": "Mario Arnold Schlüsseldienst München e.K.",
      "company_seat": "München",
      "details": "30.08.2025 (Bekanntmachungsdatum)\n\nBayern Amtsgericht München HRA 121230\nRegisterbekanntmachung nach dem Umwandlungsgesetz 29.08.2025 (Eintragungsdatum)\n\nMario Arnold Schlüsseldienst München e.K.\nEinzelkaufmann / Einzelkauffrau\nMünchen\n\nDen Gläubigern der an der Ausgliederung beteiligten Rechtsträger ist, wenn sie binnen sechs Monaten nach dem Tag, an dem die Eintragung der Ausgliederung in das Register des Sitzes desjenigen Rechtsträgers, dessen Gläubiger sie sind, nach §§ 125, 19 Abs. 3 UmwG als bekannt gemacht gilt, ihren Anspruch nach Grund und Höhe in Textform anmelden, Sicherheit zu leisten, soweit sie nicht Befriedigung verlangen können. Dieses Recht steht den Gläubigern jedoch nur zu, wenn sie glaubhaft machen, dass durch die Ausgliederung die Erfüllung ihrer Forderung gefährdet wird."
    },
    {
      "date": "2025-08-30",
      "id": "125196",
      "original_text": "Einreichung neuer Dokumente\nBayern Amtsgericht München HRB 218515\nTubis AG – München",
      "type": "Einreichung neuer Dokumente",
      "state": "Bayern",
      "amtsgericht": "Amtsgericht München",
      "registernummer": "HRB 218515",
      "registerart": "HRB",
      "company_name": "Tubis AG",
      "company_seat": "München",
      "details": "30.08.2025 (Bekanntmachungsdatum)\n\nBayern Amtsgericht München HRB 218515\nEinreichung neuer Dokumente 29.08.2025 (Eintragungsdatum)\n\nTubis AG\nAktiengesellschaft\nMünchen\n\nDem Amtsgericht München -Registergericht- ist eine Liste der Mitglieder des Aufsichtsrats eingereicht worden, § 106 AktG."
    },
    {
      "date": "2025-08-30",
      "id": "125197",
      "original_text": "Registerbekanntmachung nach dem Umwandlungsgesetz\nBayern Amtsgericht Schweinfurt HRB 9620\nmueller GmbH – Unsleben",
      "type": "Registerbekanntmachung nach dem Umwandlungsgesetz",
      "state": "Bayern",
      "amtsgericht": "Amtsgericht Schweinfurt",
      "registernummer": "HRB 9620",
      "registerart": "HRB",
      "company_name": "mueller GmbH",
      "company_seat": "Unsleben",
      "details": "30.08.2025 (Bekanntmachungsdatum)\n\nBayern Amtsgericht Schweinfurt HRB 9620\nRegisterbekanntmachung nach dem Umwandlungsgesetz 29.08.2025 (Eintragungsdatum)\n\nmueller GmbH\nGesellschaft mit beschränkter Haftung\nUnsleben\n\nDen Gläubigern der an der Ausgliederung beteiligten Rechtsträger ist, wenn sie binnen sechs Monaten nach dem Tag, an dem die Eintragung der Ausgliederung in das Register des Sitzes desjenigen Rechtsträgers, dessen Gläubiger sie sind, nach §§ 125, 19 Abs. 3 UmwG als bekannt gemacht gilt, ihren Anspruch nach Grund und Höhe in Textform anmelden, Sicherheit zu leisten, soweit sie nicht Befriedigung verlangen können. Dieses Recht steht den Gläubigern jedoch nur zu, wenn sie glaubhaft machen, dass durch die Ausgliederung die Erfüllung ihrer Forderung gefährdet wird."
    },
    {
      "date": "2025-08-30",
      "id": "125198",
      "original_text": "Registerbekanntmachung nach dem Umwandlungsgesetz\nBayern Amtsgericht München HRB 177695\nAP Solutions GmbH – München",
      "type": "Registerbekanntmachung nach dem Umwandlungsgesetz",
      "state": "Bayern",
      "amtsgericht": "Amtsgericht München",
      "registernummer": "HRB 177695",
      "registerart": "HRB",
      "company_name": "AP Solutions GmbH",
      "company_seat": "München",
      "details": "30.08.2025 (Bekanntmachungsdatum)\n\nBayern Amtsgericht München HRB 177695\nRegisterbekanntmachung nach dem Umwandlungsgesetz 29.08.2025 (Eintragungsdatum)\n\nAP Solutions GmbH\nGesellschaft mit beschränkter Haftung\nMünchen\n\nDen Gläubigern der an der Verschmelzung beteiligten Rechtsträger ist, wenn sie binnen sechs Monaten nach dem Tag, an dem die Eintragung der Verschmelzung in das Register des Sitzes desjenigen Rechtsträgers, dessen Gläubiger sie sind, nach § 19 Abs. 3 UmwG als bekannt gemacht gilt, ihren Anspruch nach Grund und Höhe in Textform anmelden, Sicherheit zu leisten, soweit sie nicht Befriedigung verlangen können. Dieses Recht steht den Gläubigern jedoch nur zu, wenn sie glaubhaft machen, dass durch die Verschmelzung die Erfüllung ihrer Forderung gefährdet wird."
    },
    {
      "date": "2025-08-30",
      "id": "125199",
      "original_text": "Registerbekanntmachung nach dem Umwandlungsgesetz\nBayern Amtsgericht München HRB 229792\nswissnet MeinHotSpot GmbH – München",
      "type": "Registerbekanntmachung nach dem Umwandlungsgesetz",
      "state": "Bayern",
      "amtsgericht": "Amtsgericht München",
      "registernummer": "HRB 229792",
      "registerart": "HRB",
      "company_name": "swissnet MeinHotSpot GmbH",
      "company_seat": "München",
      "details": "30.08.2025 (Bekanntmachungsdatum)\n\nBayern Amtsgericht München HRB 229792\nRegisterbekanntmachung nach dem Umwandlungsgesetz 29.08.2025 (Eintragungsdatum)\n\nswissnet MeinHotSpot GmbH\nGesellschaft mit beschränkter Haftung\nMünchen\n\nDen Gläubigern der an der Verschmelzung beteiligten Rechtsträger ist, wenn sie binnen sechs Monaten nach dem Tag, an dem die Eintragung der Verschmelzung in das Register des Sitzes desjenigen Rechtsträgers, dessen Gläubiger sie sind, nach § 19 Abs. 3 UmwG als bekannt gemacht gilt, ihren Anspruch nach Grund und Höhe in Textform anmelden, Sicherheit zu leisten, soweit sie nicht Befriedigung verlangen können. Dieses Recht steht den Gläubigern jedoch nur zu, wenn sie glaubhaft machen, dass durch die Verschmelzung die Erfüllung ihrer Forderung gefährdet wird."
    },
    {
      "date": "2025-08-30",
      "id": "125200",
      "original_text": "Registerbekanntmachung nach dem Umwandlungsgesetz\nBayern Amtsgericht Fürth HRB 15504\nPeter Family Office Objekt EINS GmbH – Fürth",
      "type": "Registerbekanntmachung nach dem Umwandlungsgesetz",
      "state": "Bayern",
      "amtsgericht": "Amtsgericht Fürth",
      "registernummer": "HRB 15504",
      "registerart": "HRB",
      "company_name": "Peter Family Office Objekt EINS GmbH",
      "company_seat": "Fürth",
      "details": "30.08.2025 (Bekanntmachungsdatum)\n\nBayern Amtsgericht Fürth HRB 15504\nRegisterbekanntmachung nach dem Umwandlungsgesetz 29.08.2025 (Eintragungsdatum)\n\nPeter Family Office Objekt EINS GmbH\nGesellschaft mit beschränkter Haftung\nFürth\n\nDen Gläubigern #dv.auswahl(Text=\"Bitte zutreffendes auswählen:\",Eingabe=\n\n\"der an der Verschmelzung beteiligten Rechtsträger ist, wenn sie binnen sechs Monaten nach dem Tag, an dem die Eintragung der Verschmelzung in das Register des Sitzes desjenigen Rechtsträgers, dessen Gläubiger sie sind, nach § 19 Abs. 3 UmwG als bekannt gemacht gilt, ihren Anspruch nach Grund und Höhe in Textform anmelden, Sicherheit zu leisten, soweit sie nicht Befriedigung verlangen können. Dieses Recht steht den Gläubigern jedoch nur zu, wenn sie glaubhaft machen, dass durch die Verschmelzung die Erfüllung ihrer Forderung gefährdet wird.\"|\"Verschmelzung\",\n\n\"der an der Spaltung beteiligten Rechtsträger ist, wenn sie binnen sechs Monaten nach dem Tag, an dem die Eintragung der Spaltung in das Register des Sitzes desjenigen Rechtsträgers, dessen Gläubiger sie sind, nach §§ 125, 19 Abs. 3 UmwG als bekannt gemacht gilt, ihren Anspruch nach Grund und Höhe in Textform anmelden, Sicherheit zu leisten, soweit sie nicht Befriedigung verlangen können. Dieses Recht steht den Gläubigern jedoch nur zu, wenn sie glaubhaft machen, dass durch die Spaltung die Erfüllung ihrer Forderung gefährdet wird.\"|\"Spaltung\",\n\n\"des formwechselnden Rechtsträgers ist, wenn sie binnen sechs Monaten nach dem Tag, an dem die Eintragung des Formwechsels nach § 201 UmwG als bekannt gemacht gilt, ihren Anspruch nach Grund und Höhe in Textform anmelden, Sicherheit zu leisten, soweit sie nicht Befriedigung verlangen können. Dieses Recht steht den Gläubigern jedoch nur zu, wenn sie glaubhaft machen, dass durch den Formwechsel die Erfüllung ihrer Forderung gefährdet wird.\"|\"formwechselnde Umwandlung\",\n\n\"der an der Ausgliederung beteiligten Rechtsträger ist, wenn sie binnen sechs Monaten nach dem Tag, an dem die Eintragung der Ausgliederung in das Register des Sitzes desjenigen Rechtsträgers, dessen Gläubiger sie sind, nach §§ 125, 19 Abs. 3 UmwG als bekannt gemacht gilt, ihren Anspruch nach Grund und Höhe in Textform anmelden, Sicherheit zu leisten, soweit sie nicht Befriedigung verlangen können. Dieses Recht steht den Gläubigern jedoch nur zu, wenn sie glaubhaft machen, dass durch die Ausgliederung die Erfüllung ihrer Forderung gefährdet wird.\"|\"Ausgliederung\")"
    },
    {
      "date": "2025-08-30",
      "id": "125201",
      "original_text": "Registerbekanntmachung nach dem Umwandlungsgesetz\nBayern Amtsgericht Fürth HRB 15496\nPeter Family Office Objekt ZWEI GmbH – Fürth",
      "type": "Registerbekanntmachung nach dem Umwandlungsgesetz",
      "state": "Bayern",
      "amtsgericht": "Amtsgericht Fürth",
      "registernummer": "HRB 15496",
      "registerart": "HRB",
      "company_name": "Peter Family Office Objekt ZWEI GmbH",
      "company_seat": "Fürth",
      "details": "30.08.2025 (Bekanntmachungsdatum)\n\nBayern Amtsgericht Fürth HRB 15496\nRegisterbekanntmachung nach dem Umwandlungsgesetz 29.08.2025 (Eintragungsdatum)\n\nPeter Family Office Objekt ZWEI GmbH\nGesellschaft mit beschränkter Haftung\nFürth\n\nDen Gläubigern der an der Verschmelzung beteiligten Rechtsträger ist, wenn sie binnen sechs Monaten nach dem Tag, an dem die Eintragung der Verschmelzung in das Register des Sitzes desjenigen Rechtsträgers, dessen Gläubiger sie sind, nach § 19 Abs. 3 UmwG als bekannt gemacht gilt, ihren Anspruch nach Grund und Höhe in Textform anmelden, Sicherheit zu leisten, soweit sie nicht Befriedigung verlangen können. Dieses Recht steht den Gläubigern jedoch nur zu, wenn sie glaubhaft machen, dass durch die Verschmelzung die Erfüllung ihrer Forderung gefährdet wird."
    },
    {
      "date": "2025-08-30",
      "id": "125202",
      "original_text": "Löschungsankündigung\nNiedersachsen Amtsgericht Hildesheim HRB 202869\nJet-Druck GmbH – Burgdorf",
      "type": "Löschungsankündigung",
      "state": "Niedersachsen",
      "amtsgericht": "Amtsgericht Hildesheim",
      "registernummer": "HRB 202869",
      "registerart": "HRB",
      "company_name": "Jet-Druck GmbH",
      "company_seat": "Burgdorf",
      "details": "30.08.2025 (Bekanntmachungsdatum)\n\nNiedersachsen Amtsgericht Hildesheim HRB 202869\nLöschungsankündigung\n\nJet-Druck GmbH\nGesellschaft mit beschränkter Haftung\nBurgdorf\n\nDas Registergericht beabsichtigt, die Gesellschaft von Amts wegen nach § 394 FamFG zu löschen. Die Frist zur Erhebung eines Widerspruchs ist auf 1 Monat ab dieser Registerbekanntmachung festgesetzt."
    }
  ]
}