{
  "date": "2025-08-06",
  "date_of_scrape": "2025-08-27T11:49:45.025Z",
  "tool_version": "0.2.0",
  "number_of_announcements": 233,
  "announcements": [
    {
      "date": "2025-08-06",
      "id": "119451",
      "original_text": "Registerbekanntmachung nach dem Umwandlungsgesetz\nBayern Amtsgericht Traunstein HRB 30576\nA.I. Fitness GmbH – Rosenheim",
      "type": "Registerbekanntmachung nach dem Umwandlungsgesetz",
      "state": "Bayern",
      "amtsgericht": "Amtsgericht Traunstein",
      "registernummer": "HRB 30576",
      "registerart": "HRB",
      "company_name": "A.I. Fitness GmbH",
      "company_seat": "Rosenheim",
      "details": "06.08.2025 (Bekanntmachungsdatum)\n\nBayern Amtsgericht Traunstein HRB 30576\nRegisterbekanntmachung nach dem Umwandlungsgesetz 05.08.2025 (Eintragungsdatum)\n\nA.I. Fitness GmbH\nGesellschaft mit beschränkter Haftung\nRosenheim\n\nDen Gläubigern der an der Verschmelzung beteiligten Rechtsträger ist, wenn sie binnen sechs Monaten nach dem Tag, an dem die Eintragung der Verschmelzung in das Register des Sitzes desjenigen Rechtsträgers, dessen Gläubiger sie sind, nach § 19 Abs. 3 UmwG als bekannt gemacht gilt, ihren Anspruch nach Grund und Höhe in Textform anmelden, Sicherheit zu leisten, soweit sie nicht Befriedigung verlangen können. Dieses Recht steht den Gläubigern jedoch nur zu, wenn sie glaubhaft machen, dass durch die Verschmelzung die Erfüllung ihrer Forderung gefährdet wird."
    },
    {
      "date": "2025-08-06",
      "id": "119452",
      "original_text": "Registerbekanntmachung nach dem Umwandlungsgesetz\nBayern Amtsgericht München HRB 295247\nFinparx & Bonum GmbH – München",
      "type": "Registerbekanntmachung nach dem Umwandlungsgesetz",
      "state": "Bayern",
      "amtsgericht": "Amtsgericht München",
      "registernummer": "HRB 295247",
      "registerart": "HRB",
      "company_name": "Finparx & Bonum GmbH",
      "company_seat": "München",
      "details": "06.08.2025 (Bekanntmachungsdatum)\n\nBayern Amtsgericht München HRB 295247\nRegisterbekanntmachung nach dem Umwandlungsgesetz 05.08.2025 (Eintragungsdatum)\n\nFinparx & Bonum GmbH\nGesellschaft mit beschränkter Haftung\nMünchen\n\nDen Gläubigern der an der Verschmelzung beteiligten Rechtsträger ist, wenn sie binnen sechs Monaten nach dem Tag, an dem die Eintragung der Verschmelzung in das Register des Sitzes desjenigen Rechtsträgers, dessen Gläubiger sie sind, nach § 19 Abs. 3 UmwG als bekannt gemacht gilt, ihren Anspruch nach Grund und Höhe in Textform anmelden, Sicherheit zu leisten, soweit sie nicht Befriedigung verlangen können. Dieses Recht steht den Gläubigern jedoch nur zu, wenn sie glaubhaft machen, dass durch die Verschmelzung die Erfüllung ihrer Forderung gefährdet wird."
    },
    {
      "date": "2025-08-06",
      "id": "119453",
      "original_text": "Registerbekanntmachung nach dem Umwandlungsgesetz\nBayern Amtsgericht Aschaffenburg HRB 9734\nL4S IT-Systemlösungen GmbH – Aschaffenburg",
      "type": "Registerbekanntmachung nach dem Umwandlungsgesetz",
      "state": "Bayern",
      "amtsgericht": "Amtsgericht Aschaffenburg",
      "registernummer": "HRB 9734",
      "registerart": "HRB",
      "company_name": "L4S IT-Systemlösungen GmbH",
      "company_seat": "Aschaffenburg",
      "details": "06.08.2025 (Bekanntmachungsdatum)\n\nBayern Amtsgericht Aschaffenburg HRB 9734\nRegisterbekanntmachung nach dem Umwandlungsgesetz 05.08.2025 (Eintragungsdatum)\n\nL4S IT-Systemlösungen GmbH\nGesellschaft mit beschränkter Haftung\nAschaffenburg\n\nDen Gläubigern der an der Verschmelzung beteiligten Rechtsträger ist, wenn sie binnen sechs Monaten nach dem Tag, an dem die Eintragung der Verschmelzung in das Register des Sitzes desjenigen Rechtsträgers, dessen Gläubiger sie sind, nach § 19 Abs. 3 UmwG als bekannt gemacht gilt, ihren Anspruch nach Grund und Höhe in Textform anmelden, Sicherheit zu leisten, soweit sie nicht Befriedigung verlangen können. Dieses Recht steht den Gläubigern jedoch nur zu, wenn sie glaubhaft machen, dass durch die Verschmelzung die Erfüllung ihrer Forderung gefährdet wird."
    },
    {
      "date": "2025-08-06",
      "id": "119454",
      "original_text": "Registerbekanntmachung nach dem Umwandlungsgesetz\nBayern Amtsgericht Aschaffenburg HRB 11389\nL4S Academy GmbH – Aschaffenburg",
      "type": "Registerbekanntmachung nach dem Umwandlungsgesetz",
      "state": "Bayern",
      "amtsgericht": "Amtsgericht Aschaffenburg",
      "registernummer": "HRB 11389",
      "registerart": "HRB",
      "company_name": "L4S Academy GmbH",
      "company_seat": "Aschaffenburg",
      "details": "06.08.2025 (Bekanntmachungsdatum)\n\nBayern Amtsgericht Aschaffenburg HRB 11389\nRegisterbekanntmachung nach dem Umwandlungsgesetz 05.08.2025 (Eintragungsdatum)\n\nL4S Academy GmbH\nGesellschaft mit beschränkter Haftung\nAschaffenburg\n\nDen Gläubigern der an der Verschmelzung beteiligten Rechtsträger ist, wenn sie binnen sechs Monaten nach dem Tag, an dem die Eintragung der Verschmelzung in das Register des Sitzes desjenigen Rechtsträgers, dessen Gläubiger sie sind, nach § 19 Abs. 3 UmwG als bekannt gemacht gilt, ihren Anspruch nach Grund und Höhe in Textform anmelden, Sicherheit zu leisten, soweit sie nicht Befriedigung verlangen können. Dieses Recht steht den Gläubigern jedoch nur zu, wenn sie glaubhaft machen, dass durch die Verschmelzung die Erfüllung ihrer Forderung gefährdet wird."
    },
    {
      "date": "2025-08-06",
      "id": "119455",
      "original_text": "Registerbekanntmachung nach dem Umwandlungsgesetz\nBayern Amtsgericht München HRB 238753\nSun Charter GmbH – Wolfratshausen",
      "type": "Registerbekanntmachung nach dem Umwandlungsgesetz",
      "state": "Bayern",
      "amtsgericht": "Amtsgericht München",
      "registernummer": "HRB 238753",
      "registerart": "HRB",
      "company_name": "Sun Charter GmbH",
      "company_seat": "Wolfratshausen",
      "details": "06.08.2025 (Bekanntmachungsdatum)\n\nBayern Amtsgericht München HRB 238753\nRegisterbekanntmachung nach dem Umwandlungsgesetz 05.08.2025 (Eintragungsdatum)\n\nSun Charter GmbH\nGesellschaft mit beschränkter Haftung\nWolfratshausen\n\nDen Gläubigern der an der Verschmelzung beteiligten Rechtsträger ist, wenn sie binnen sechs Monaten nach dem Tag, an dem die Eintragung der Verschmelzung in das Register des Sitzes desjenigen Rechtsträgers, dessen Gläubiger sie sind, nach § 19 Abs. 3 UmwG als bekannt gemacht gilt, ihren Anspruch nach Grund und Höhe in Textform anmelden, Sicherheit zu leisten, soweit sie nicht Befriedigung verlangen können. Dieses Recht steht den Gläubigern jedoch nur zu, wenn sie glaubhaft machen, dass durch die Verschmelzung die Erfüllung ihrer Forderung gefährdet wird."
    },
    {
      "date": "2025-08-06",
      "id": "119456",
      "original_text": "Registerbekanntmachung nach dem Umwandlungsgesetz\nBayern Amtsgericht Würzburg HRB 12082\nDritte Casino Freudenberg GmbH – Waldbrunn",
      "type": "Registerbekanntmachung nach dem Umwandlungsgesetz",
      "state": "Bayern",
      "amtsgericht": "Amtsgericht Würzburg",
      "registernummer": "HRB 12082",
      "registerart": "HRB",
      "company_name": "Dritte Casino Freudenberg GmbH",
      "company_seat": "Waldbrunn",
      "details": "06.08.2025 (Bekanntmachungsdatum)\n\nBayern Amtsgericht Würzburg HRB 12082\nRegisterbekanntmachung nach dem Umwandlungsgesetz 05.08.2025 (Eintragungsdatum)\n\nDritte Casino Freudenberg GmbH\nGesellschaft mit beschränkter Haftung\nWaldbrunn\n\nDen Gläubigern der an der Verschmelzung beteiligten Rechtsträger ist, wenn sie binnen sechs Monaten nach dem Tag, an dem die Eintragung der Verschmelzung in das Register des Sitzes desjenigen Rechtsträgers, dessen Gläubiger sie sind, nach § 19 Abs. 3 UmwG als bekannt gemacht gilt, ihren Anspruch nach Grund und Höhe in Textform anmelden, Sicherheit zu leisten, soweit sie nicht Befriedigung verlangen können. Dieses Recht steht den Gläubigern jedoch nur zu, wenn sie glaubhaft machen, dass durch die Verschmelzung die Erfüllung ihrer Forderung gefährdet wird."
    },
    {
      "date": "2025-08-06",
      "id": "119457",
      "original_text": "Registerbekanntmachung nach dem Umwandlungsgesetz\nBayern Amtsgericht Würzburg HRB 12106\nErste Casino Freudenberg GmbH – Waldbrunn",
      "type": "Registerbekanntmachung nach dem Umwandlungsgesetz",
      "state": "Bayern",
      "amtsgericht": "Amtsgericht Würzburg",
      "registernummer": "HRB 12106",
      "registerart": "HRB",
      "company_name": "Erste Casino Freudenberg GmbH",
      "company_seat": "Waldbrunn",
      "details": "06.08.2025 (Bekanntmachungsdatum)\n\nBayern Amtsgericht Würzburg HRB 12106\nRegisterbekanntmachung nach dem Umwandlungsgesetz 05.08.2025 (Eintragungsdatum)\n\nErste Casino Freudenberg GmbH\nGesellschaft mit beschränkter Haftung\nWaldbrunn\n\nDen Gläubigern der an der Verschmelzung beteiligten Rechtsträger ist, wenn sie binnen sechs Monaten nach dem Tag, an dem die Eintragung der Verschmelzung in das Register des Sitzes desjenigen Rechtsträgers, dessen Gläubiger sie sind, nach § 19 Abs. 3 UmwG als bekannt gemacht gilt, ihren Anspruch nach Grund und Höhe in Textform anmelden, Sicherheit zu leisten, soweit sie nicht Befriedigung verlangen können. Dieses Recht steht den Gläubigern jedoch nur zu, wenn sie glaubhaft machen, dass durch die Verschmelzung die Erfüllung ihrer Forderung gefährdet wird."
    },
    {
      "date": "2025-08-06",
      "id": "119458",
      "original_text": "Registerbekanntmachung nach dem Umwandlungsgesetz\nBayern Amtsgericht Ingolstadt VR 10374\nSchützenverein 1898 Hubertus Untermaxfeld e.V. – Untermaxfeld",
      "type": "Registerbekanntmachung nach dem Umwandlungsgesetz",
      "state": "Bayern",
      "amtsgericht": "Amtsgericht Ingolstadt",
      "registernummer": "VR 10374",
      "registerart": "VR",
      "company_name": "Schützenverein 1898 Hubertus Untermaxfeld e.V.",
      "company_seat": "Untermaxfeld",
      "details": "06.08.2025 (Bekanntmachungsdatum)\n\nBayern Amtsgericht Ingolstadt VR 10374\nRegisterbekanntmachung nach dem Umwandlungsgesetz 05.08.2025 (Eintragungsdatum)\n\nSchützenverein 1898 Hubertus Untermaxfeld e.V.\neingetragener Verein\nUntermaxfeld\n\nDen Gläubigern der an der Verschmelzung beteiligten Rechtsträger ist, wenn sie binnen sechs Monaten nach dem Tag, an dem die Eintragung der Verschmelzung in das Register des Sitzes desjenigen Rechtsträgers, dessen Gläubiger sie sind, nach § 19 Abs. 3 UmwG als bekannt gemacht gilt, ihren Anspruch nach Grund und Höhe in Textform anmelden, Sicherheit zu leisten, soweit sie nicht Befriedigung verlangen können. Dieses Recht steht den Gläubigern jedoch nur zu, wenn sie glaubhaft machen, dass durch die Verschmelzung die Erfüllung ihrer Forderung gefährdet wird."
    },
    {
      "date": "2025-08-06",
      "id": "119459",
      "original_text": "Registerbekanntmachung nach dem Umwandlungsgesetz\nBayern Amtsgericht Aschaffenburg HRB 11625\nMAXTARGET Business Consulting GmbH – Großwallstadt",
      "type": "Registerbekanntmachung nach dem Umwandlungsgesetz",
      "state": "Bayern",
      "amtsgericht": "Amtsgericht Aschaffenburg",
      "registernummer": "HRB 11625",
      "registerart": "HRB",
      "company_name": "MAXTARGET Business Consulting GmbH",
      "company_seat": "Großwallstadt",
      "details": "06.08.2025 (Bekanntmachungsdatum)\n\nBayern Amtsgericht Aschaffenburg HRB 11625\nRegisterbekanntmachung nach dem Umwandlungsgesetz 05.08.2025 (Eintragungsdatum)\n\nMAXTARGET Business Consulting GmbH\nGesellschaft mit beschränkter Haftung\nGroßwallstadt\n\nDen Gläubigern der an der Verschmelzung beteiligten Rechtsträger ist, wenn sie binnen sechs Monaten nach dem Tag, an dem die Eintragung der Verschmelzung in das Register des Sitzes desjenigen Rechtsträgers, dessen Gläubiger sie sind, nach § 19 Abs. 3 UmwG als bekannt gemacht gilt, ihren Anspruch nach Grund und Höhe in Textform anmelden, Sicherheit zu leisten, soweit sie nicht Befriedigung verlangen können. Dieses Recht steht den Gläubigern jedoch nur zu, wenn sie glaubhaft machen, dass durch die Verschmelzung die Erfüllung ihrer Forderung gefährdet wird."
    },
    {
      "date": "2025-08-06",
      "id": "119460",
      "original_text": "Registerbekanntmachung nach dem Umwandlungsgesetz\nBayern Amtsgericht München HRB 252129\nAlpen Elektroanlagen GmbH – Holzkirchen",
      "type": "Registerbekanntmachung nach dem Umwandlungsgesetz",
      "state": "Bayern",
      "amtsgericht": "Amtsgericht München",
      "registernummer": "HRB 252129",
      "registerart": "HRB",
      "company_name": "Alpen Elektroanlagen GmbH",
      "company_seat": "Holzkirchen",
      "details": "06.08.2025 (Bekanntmachungsdatum)\n\nBayern Amtsgericht München HRB 252129\nRegisterbekanntmachung nach dem Umwandlungsgesetz 05.08.2025 (Eintragungsdatum)\n\nAlpen Elektroanlagen GmbH\nGesellschaft mit beschränkter Haftung\nHolzkirchen\n\nDen Gläubigern der an der Verschmelzung beteiligten Rechtsträger ist, wenn sie binnen sechs Monaten nach dem Tag, an dem die Eintragung der Verschmelzung in das Register des Sitzes desjenigen Rechtsträgers, dessen Gläubiger sie sind, nach § 19 Abs. 3 UmwG als bekannt gemacht gilt, ihren Anspruch nach Grund und Höhe in Textform anmelden, Sicherheit zu leisten, soweit sie nicht Befriedigung verlangen können. Dieses Recht steht den Gläubigern jedoch nur zu, wenn sie glaubhaft machen, dass durch die Verschmelzung die Erfüllung ihrer Forderung gefährdet wird."
    },
    {
      "date": "2025-08-06",
      "id": "119461",
      "original_text": "Registerbekanntmachung nach dem Umwandlungsgesetz\nBayern Amtsgericht München HRB 99178\nImmobilien-Hausverwaltungen Kusch GmbH – Germering",
      "type": "Registerbekanntmachung nach dem Umwandlungsgesetz",
      "state": "Bayern",
      "amtsgericht": "Amtsgericht München",
      "registernummer": "HRB 99178",
      "registerart": "HRB",
      "company_name": "Immobilien-Hausverwaltungen Kusch GmbH",
      "company_seat": "Germering",
      "details": "06.08.2025 (Bekanntmachungsdatum)\n\nBayern Amtsgericht München HRB 99178\nRegisterbekanntmachung nach dem Umwandlungsgesetz 05.08.2025 (Eintragungsdatum)\n\nImmobilien-Hausverwaltungen Kusch GmbH\nGesellschaft mit beschränkter Haftung\nGermering\n\nDen Gläubigern der an der Spaltung beteiligten Rechtsträger ist, wenn sie binnen sechs Monaten nach dem Tag, an dem die Eintragung der Spaltung in das Register des Sitzes desjenigen Rechtsträgers, dessen Gläubiger sie sind, nach §§ 125, 19 Abs. 3 UmwG als bekannt gemacht gilt, ihren Anspruch nach Grund und Höhe in Textform anmelden, Sicherheit zu leisten, soweit sie nicht Befriedigung verlangen können. Dieses Recht steht den Gläubigern jedoch nur zu, wenn sie glaubhaft machen, dass durch die Spaltung die Erfüllung ihrer Forderung gefährdet wird."
    },
    {
      "date": "2025-08-06",
      "id": "119462",
      "original_text": "Registerbekanntmachung nach dem Umwandlungsgesetz\nBayern Amtsgericht Ingolstadt VR 10275\nSchützengemeinschaft Maxfeld e.V. – Obermaxfeld",
      "type": "Registerbekanntmachung nach dem Umwandlungsgesetz",
      "state": "Bayern",
      "amtsgericht": "Amtsgericht Ingolstadt",
      "registernummer": "VR 10275",
      "registerart": "VR",
      "company_name": "Schützengemeinschaft Maxfeld e.V.",
      "company_seat": "Obermaxfeld",
      "details": "06.08.2025 (Bekanntmachungsdatum)\n\nBayern Amtsgericht Ingolstadt VR 10275\nRegisterbekanntmachung nach dem Umwandlungsgesetz 05.08.2025 (Eintragungsdatum)\n\nSchützengemeinschaft Maxfeld e.V.\neingetragener Verein\nObermaxfeld\n\nDen Gläubigern der an der Verschmelzung beteiligten Rechtsträger ist, wenn sie binnen sechs Monaten nach dem Tag, an dem die Eintragung der Verschmelzung in das Register des Sitzes desjenigen Rechtsträgers, dessen Gläubiger sie sind, nach § 19 Abs. 3 UmwG als bekannt gemacht gilt, ihren Anspruch nach Grund und Höhe in Textform anmelden, Sicherheit zu leisten, soweit sie nicht Befriedigung verlangen können. Dieses Recht steht den Gläubigern jedoch nur zu, wenn sie glaubhaft machen, dass durch die Verschmelzung die Erfüllung ihrer Forderung gefährdet wird."
    },
    {
      "date": "2025-08-06",
      "id": "119463",
      "original_text": "Registerbekanntmachung nach dem Umwandlungsgesetz\nBayern Amtsgericht Aschaffenburg HRB 2380\nRenostar GmbH – Großwallstadt",
      "type": "Registerbekanntmachung nach dem Umwandlungsgesetz",
      "state": "Bayern",
      "amtsgericht": "Amtsgericht Aschaffenburg",
      "registernummer": "HRB 2380",
      "registerart": "HRB",
      "company_name": "Renostar GmbH",
      "company_seat": "Großwallstadt",
      "details": "06.08.2025 (Bekanntmachungsdatum)\n\nBayern Amtsgericht Aschaffenburg HRB 2380\nRegisterbekanntmachung nach dem Umwandlungsgesetz 05.08.2025 (Eintragungsdatum)\n\nRenostar GmbH\nGesellschaft mit beschränkter Haftung\nGroßwallstadt\n\nDen Gläubigern der an der Verschmelzung beteiligten Rechtsträger ist, wenn sie binnen sechs Monaten nach dem Tag, an dem die Eintragung der Verschmelzung in das Register des Sitzes desjenigen Rechtsträgers, dessen Gläubiger sie sind, nach § 19 Abs. 3 UmwG als bekannt gemacht gilt, ihren Anspruch nach Grund und Höhe in Textform anmelden, Sicherheit zu leisten, soweit sie nicht Befriedigung verlangen können. Dieses Recht steht den Gläubigern jedoch nur zu, wenn sie glaubhaft machen, dass durch die Verschmelzung die Erfüllung ihrer Forderung gefährdet wird."
    },
    {
      "date": "2025-08-06",
      "id": "119464",
      "original_text": "Registerbekanntmachung nach dem Umwandlungsgesetz\nBayern Amtsgericht München HRB 119238\neug Entwicklungsgesellschaft für Umformtechnik und Gießereiwesen mbH – Erding",
      "type": "Registerbekanntmachung nach dem Umwandlungsgesetz",
      "state": "Bayern",
      "amtsgericht": "Amtsgericht München",
      "registernummer": "HRB 119238",
      "registerart": "HRB",
      "company_name": "eug Entwicklungsgesellschaft für Umformtechnik und Gießereiwesen mbH",
      "company_seat": "Erding",
      "details": "06.08.2025 (Bekanntmachungsdatum)\n\nBayern Amtsgericht München HRB 119238\nRegisterbekanntmachung nach dem Umwandlungsgesetz 05.08.2025 (Eintragungsdatum)\n\neug Entwicklungsgesellschaft für Umformtechnik und Gießereiwesen mbH\nGesellschaft mit beschränkter Haftung\nErding\n\nDen Gläubigern der an der Verschmelzung beteiligten Rechtsträger ist, wenn sie binnen sechs Monaten nach dem Tag, an dem die Eintragung der Verschmelzung in das Register des Sitzes desjenigen Rechtsträgers, dessen Gläubiger sie sind, nach § 19 Abs. 3 UmwG als bekannt gemacht gilt, ihren Anspruch nach Grund und Höhe in Textform anmelden, Sicherheit zu leisten, soweit sie nicht Befriedigung verlangen können. Dieses Recht steht den Gläubigern jedoch nur zu, wenn sie glaubhaft machen, dass durch die Verschmelzung die Erfüllung ihrer Forderung gefährdet wird."
    },
    {
      "date": "2025-08-06",
      "id": "119465",
      "original_text": "Registerbekanntmachung nach dem Umwandlungsgesetz\nBayern Amtsgericht Ingolstadt HRB 9369\nAnkurri UG (haftungsbeschränkt) – Ingolstadt",
      "type": "Registerbekanntmachung nach dem Umwandlungsgesetz",
      "state": "Bayern",
      "amtsgericht": "Amtsgericht Ingolstadt",
      "registernummer": "HRB 9369",
      "registerart": "HRB",
      "company_name": "Ankurri UG (haftungsbeschränkt)",
      "company_seat": "Ingolstadt",
      "details": "06.08.2025 (Bekanntmachungsdatum)\n\nBayern Amtsgericht Ingolstadt HRB 9369\nRegisterbekanntmachung nach dem Umwandlungsgesetz 05.08.2025 (Eintragungsdatum)\n\nAnkurri UG (haftungsbeschränkt)\nGesellschaft mit beschränkter Haftung\nIngolstadt\n\nDen Gläubigern der an der Verschmelzung beteiligten Rechtsträger ist, wenn sie binnen sechs Monaten nach dem Tag, an dem die Eintragung der Verschmelzung in das Register des Sitzes desjenigen Rechtsträgers, dessen Gläubiger sie sind, nach § 19 Abs. 3 UmwG als bekannt gemacht gilt, ihren Anspruch nach Grund und Höhe in Textform anmelden, Sicherheit zu leisten, soweit sie nicht Befriedigung verlangen können. Dieses Recht steht den Gläubigern jedoch nur zu, wenn sie glaubhaft machen, dass durch die Verschmelzung die Erfüllung ihrer Forderung gefährdet wird."
    },
    {
      "date": "2025-08-06",
      "id": "119466",
      "original_text": "Registerbekanntmachung nach dem Umwandlungsgesetz\nBayern Amtsgericht Ingolstadt HRB 9373\nSeitle Capital UG (haftungsbeschränkt) – Karlshuld",
      "type": "Registerbekanntmachung nach dem Umwandlungsgesetz",
      "state": "Bayern",
      "amtsgericht": "Amtsgericht Ingolstadt",
      "registernummer": "HRB 9373",
      "registerart": "HRB",
      "company_name": "Seitle Capital UG (haftungsbeschränkt)",
      "company_seat": "Karlshuld",
      "details": "06.08.2025 (Bekanntmachungsdatum)\n\nBayern Amtsgericht Ingolstadt HRB 9373\nRegisterbekanntmachung nach dem Umwandlungsgesetz 05.08.2025 (Eintragungsdatum)\n\nSeitle Capital UG (haftungsbeschränkt)\nGesellschaft mit beschränkter Haftung\nKarlshuld\n\nDen Gläubigern der an der Verschmelzung beteiligten Rechtsträger ist, wenn sie binnen sechs Monaten nach dem Tag, an dem die Eintragung der Verschmelzung in das Register des Sitzes desjenigen Rechtsträgers, dessen Gläubiger sie sind, nach § 19 Abs. 3 UmwG als bekannt gemacht gilt, ihren Anspruch nach Grund und Höhe in Textform anmelden, Sicherheit zu leisten, soweit sie nicht Befriedigung verlangen können. Dieses Recht steht den Gläubigern jedoch nur zu, wenn sie glaubhaft machen, dass durch die Verschmelzung die Erfüllung ihrer Forderung gefährdet wird."
    },
    {
      "date": "2025-08-06",
      "id": "119467",
      "original_text": "Registerbekanntmachung nach dem Umwandlungsgesetz\nBayern Amtsgericht Traunstein HRB 33693\nA.I. Fitness HoldCo GmbH – Rosenheim",
      "type": "Registerbekanntmachung nach dem Umwandlungsgesetz",
      "state": "Bayern",
      "amtsgericht": "Amtsgericht Traunstein",
      "registernummer": "HRB 33693",
      "registerart": "HRB",
      "company_name": "A.I. Fitness HoldCo GmbH",
      "company_seat": "Rosenheim",
      "details": "06.08.2025 (Bekanntmachungsdatum)\n\nBayern Amtsgericht Traunstein HRB 33693\nRegisterbekanntmachung nach dem Umwandlungsgesetz 05.08.2025 (Eintragungsdatum)\n\nA.I. Fitness HoldCo GmbH\nGesellschaft mit beschränkter Haftung\nRosenheim\n\nDen Gläubigern der an der Verschmelzung beteiligten Rechtsträger ist, wenn sie binnen sechs Monaten nach dem Tag, an dem die Eintragung der Verschmelzung in das Register des Sitzes desjenigen Rechtsträgers, dessen Gläubiger sie sind, nach § 19 Abs. 3 UmwG als bekannt gemacht gilt, ihren Anspruch nach Grund und Höhe in Textform anmelden, Sicherheit zu leisten, soweit sie nicht Befriedigung verlangen können. Dieses Recht steht den Gläubigern jedoch nur zu, wenn sie glaubhaft machen, dass durch die Verschmelzung die Erfüllung ihrer Forderung gefährdet wird."
    },
    {
      "date": "2025-08-06",
      "id": "119468",
      "original_text": "Registerbekanntmachung nach dem Umwandlungsgesetz\nBayern Amtsgericht Aschaffenburg HRB 2380\nRenostar GmbH – Großwallstadt",
      "type": "Registerbekanntmachung nach dem Umwandlungsgesetz",
      "state": "Bayern",
      "amtsgericht": "Amtsgericht Aschaffenburg",
      "registernummer": "HRB 2380",
      "registerart": "HRB",
      "company_name": "Renostar GmbH",
      "company_seat": "Großwallstadt",
      "details": "06.08.2025 (Bekanntmachungsdatum)\n\nBayern Amtsgericht Aschaffenburg HRB 2380\nRegisterbekanntmachung nach dem Umwandlungsgesetz 05.08.2025 (Eintragungsdatum)\n\nRenostar GmbH\nGesellschaft mit beschränkter Haftung\nGroßwallstadt\n\nDen Gläubigern der an der Verschmelzung beteiligten Rechtsträger ist, wenn sie binnen sechs Monaten nach dem Tag, an dem die Eintragung der Verschmelzung in das Register des Sitzes desjenigen Rechtsträgers, dessen Gläubiger sie sind, nach § 19 Abs. 3 UmwG als bekannt gemacht gilt, ihren Anspruch nach Grund und Höhe in Textform anmelden, Sicherheit zu leisten, soweit sie nicht Befriedigung verlangen können. Dieses Recht steht den Gläubigern jedoch nur zu, wenn sie glaubhaft machen, dass durch die Verschmelzung die Erfüllung ihrer Forderung gefährdet wird."
    },
    {
      "date": "2025-08-06",
      "id": "119469",
      "original_text": "Löschungsankündigung\nBayern Amtsgericht Bamberg HRB 3504\nELANSYS Heliosch GmbH – Hofheim",
      "type": "Löschungsankündigung",
      "state": "Bayern",
      "amtsgericht": "Amtsgericht Bamberg",
      "registernummer": "HRB 3504",
      "registerart": "HRB",
      "company_name": "ELANSYS Heliosch GmbH",
      "company_seat": "Hofheim",
      "details": "06.08.2025 (Bekanntmachungsdatum)\n\nBayern Amtsgericht Bamberg HRB 3504\nLöschungsankündigung\n\nELANSYS Heliosch GmbH\nGesellschaft mit beschränkter Haftung\nHofheim\n\nDas Registergericht beabsichtigt, die im Handelsregister eingetragene Gesellschaft wegen Vermögenslosigkeit von Amts wegen nach § 394 FamFG zu löschen. Die Frist zur Erhebung eines Widerspruchs ist auf einen Monat festgesetzt."
    },
    {
      "date": "2025-08-06",
      "id": "119470",
      "original_text": "Registerbekanntmachung nach dem Umwandlungsgesetz\nBayern Amtsgericht Ingolstadt HRB 9371\nStarling Solutions UG (haftungsbeschränkt) – Ernsgaden",
      "type": "Registerbekanntmachung nach dem Umwandlungsgesetz",
      "state": "Bayern",
      "amtsgericht": "Amtsgericht Ingolstadt",
      "registernummer": "HRB 9371",
      "registerart": "HRB",
      "company_name": "Starling Solutions UG (haftungsbeschränkt)",
      "company_seat": "Ernsgaden",
      "details": "06.08.2025 (Bekanntmachungsdatum)\n\nBayern Amtsgericht Ingolstadt HRB 9371\nRegisterbekanntmachung nach dem Umwandlungsgesetz 05.08.2025 (Eintragungsdatum)\n\nStarling Solutions UG (haftungsbeschränkt)\nGesellschaft mit beschränkter Haftung\nErnsgaden\n\nDen Gläubigern der an der Verschmelzung beteiligten Rechtsträger ist, wenn sie binnen sechs Monaten nach dem Tag, an dem die Eintragung der Verschmelzung in das Register des Sitzes desjenigen Rechtsträgers, dessen Gläubiger sie sind, nach § 19 Abs. 3 UmwG als bekannt gemacht gilt, ihren Anspruch nach Grund und Höhe in Textform anmelden, Sicherheit zu leisten, soweit sie nicht Befriedigung verlangen können. Dieses Recht steht den Gläubigern jedoch nur zu, wenn sie glaubhaft machen, dass durch die Verschmelzung die Erfüllung ihrer Forderung gefährdet wird."
    },
    {
      "date": "2025-08-06",
      "id": "119471",
      "original_text": "Registerbekanntmachung nach dem Umwandlungsgesetz\nBayern Amtsgericht München GsR 2154\nDeine Physios-am Rotkreuzplatz eGbR – München",
      "type": "Registerbekanntmachung nach dem Umwandlungsgesetz",
      "state": "Bayern",
      "amtsgericht": "Amtsgericht München",
      "registernummer": "GsR 2154",
      "registerart": "GsR",
      "company_name": "Deine Physios-am Rotkreuzplatz eGbR",
      "company_seat": "München",
      "details": "06.08.2025 (Bekanntmachungsdatum)\n\nBayern Amtsgericht München GsR 2154\nRegisterbekanntmachung nach dem Umwandlungsgesetz 05.08.2025 (Eintragungsdatum)\n\nDeine Physios-am Rotkreuzplatz eGbR\nGesellschaft bürgerlichen Rechts\nMünchen\n\nDen Gläubigern des formwechselnden Rechtsträgers ist, wenn sie binnen sechs Monaten nach dem Tag, an dem die Eintragung des Formwechsels nach § 201 UmwG als bekannt gemacht gilt, ihren Anspruch nach Grund und Höhe in Textform anmelden, Sicherheit zu leisten, soweit sie nicht Befriedigung verlangen können. Dieses Recht steht den Gläubigern jedoch nur zu, wenn sie glaubhaft machen, dass durch den Formwechsel die Erfüllung ihrer Forderung gefährdet wird."
    },
    {
      "date": "2025-08-06",
      "id": "119472",
      "original_text": "Registerbekanntmachung nach dem Umwandlungsgesetz\nBayern Amtsgericht München HRB 242301\nDr. Hinner GmbH – München",
      "type": "Registerbekanntmachung nach dem Umwandlungsgesetz",
      "state": "Bayern",
      "amtsgericht": "Amtsgericht München",
      "registernummer": "HRB 242301",
      "registerart": "HRB",
      "company_name": "Dr. Hinner GmbH",
      "company_seat": "München",
      "details": "06.08.2025 (Bekanntmachungsdatum)\n\nBayern Amtsgericht München HRB 242301\nRegisterbekanntmachung nach dem Umwandlungsgesetz 05.08.2025 (Eintragungsdatum)\n\nDr. Hinner GmbH\nGesellschaft mit beschränkter Haftung\nMünchen\n\nDen Gläubigern der an der Verschmelzung beteiligten Rechtsträger ist, wenn sie binnen sechs Monaten nach dem Tag, an dem die Eintragung der Verschmelzung in das Register des Sitzes desjenigen Rechtsträgers, dessen Gläubiger sie sind, nach § 19 Abs. 3 UmwG als bekannt gemacht gilt, ihren Anspruch nach Grund und Höhe in Textform anmelden, Sicherheit zu leisten, soweit sie nicht Befriedigung verlangen können. Dieses Recht steht den Gläubigern jedoch nur zu, wenn sie glaubhaft machen, dass durch die Verschmelzung die Erfüllung ihrer Forderung gefährdet wird."
    },
    {
      "date": "2025-08-06",
      "id": "119473",
      "original_text": "Registerbekanntmachung nach dem Umwandlungsgesetz\nBayern Amtsgericht Aschaffenburg HRB 12115\nRechtsberater Verlagsgesellschaft mbH – Großwallstadt",
      "type": "Registerbekanntmachung nach dem Umwandlungsgesetz",
      "state": "Bayern",
      "amtsgericht": "Amtsgericht Aschaffenburg",
      "registernummer": "HRB 12115",
      "registerart": "HRB",
      "company_name": "Rechtsberater Verlagsgesellschaft mbH",
      "company_seat": "Großwallstadt",
      "details": "06.08.2025 (Bekanntmachungsdatum)\n\nBayern Amtsgericht Aschaffenburg HRB 12115\nRegisterbekanntmachung nach dem Umwandlungsgesetz 05.08.2025 (Eintragungsdatum)\n\nRechtsberater Verlagsgesellschaft mbH\nGesellschaft mit beschränkter Haftung\nGroßwallstadt\n\nDen Gläubigern der an der Verschmelzung beteiligten Rechtsträger ist, wenn sie binnen sechs Monaten nach dem Tag, an dem die Eintragung der Verschmelzung in das Register des Sitzes desjenigen Rechtsträgers, dessen Gläubiger sie sind, nach § 19 Abs. 3 UmwG als bekannt gemacht gilt, ihren Anspruch nach Grund und Höhe in Textform anmelden, Sicherheit zu leisten, soweit sie nicht Befriedigung verlangen können. Dieses Recht steht den Gläubigern jedoch nur zu, wenn sie glaubhaft machen, dass durch die Verschmelzung die Erfüllung ihrer Forderung gefährdet wird."
    },
    {
      "date": "2025-08-06",
      "id": "119474",
      "original_text": "Registerbekanntmachung nach dem Umwandlungsgesetz\nBayern Amtsgericht Memmingen HRA 14296\nFINKEL Grünraum GmbH & Co. KG – Haldenwang",
      "type": "Registerbekanntmachung nach dem Umwandlungsgesetz",
      "state": "Bayern",
      "amtsgericht": "Amtsgericht Memmingen",
      "registernummer": "HRA 14296",
      "registerart": "HRA",
      "company_name": "FINKEL Grünraum GmbH & Co. KG",
      "company_seat": "Haldenwang",
      "details": "06.08.2025 (Bekanntmachungsdatum)\n\nBayern Amtsgericht Memmingen HRA 14296\nRegisterbekanntmachung nach dem Umwandlungsgesetz 05.08.2025 (Eintragungsdatum)\n\nFINKEL Grünraum GmbH & Co. KG\nKommanditgesellschaft\nHaldenwang\n\nDen Gläubigern der an der Ausgliederung beteiligten Rechtsträger ist, wenn sie binnen sechs Monaten nach dem Tag, an dem die Eintragung der Ausgliederung in das Register des Sitzes desjenigen Rechtsträgers, dessen Gläubiger sie sind, nach §§ 125, 19 Abs. 3 UmwG als bekannt gemacht gilt, ihren Anspruch nach Grund und Höhe in Textform anmelden, Sicherheit zu leisten, soweit sie nicht Befriedigung verlangen können. Dieses Recht steht den Gläubigern jedoch nur zu, wenn sie glaubhaft machen, dass durch die Ausgliederung die Erfüllung ihrer Forderung gefährdet wird."
    },
    {
      "date": "2025-08-06",
      "id": "119475",
      "original_text": "Löschungsankündigung\nBayern Amtsgericht München HRB 210621\nKiriakidis Gastronomie GmbH – München",
      "type": "Löschungsankündigung",
      "state": "Bayern",
      "amtsgericht": "Amtsgericht München",
      "registernummer": "HRB 210621",
      "registerart": "HRB",
      "company_name": "Kiriakidis Gastronomie GmbH",
      "company_seat": "München",
      "details": "06.08.2025 (Bekanntmachungsdatum)\n\nBayern Amtsgericht München HRB 210621\nLöschungsankündigung 05.08.2025 (Eintragungsdatum)\n\nKiriakidis Gastronomie GmbH\nGesellschaft mit beschränkter Haftung\nMünchen\n\nDas Registergericht beabsichtigt, die im Handelsregister eingetragene Gesellschaft wegen Vermögenslosigkeit von Amts wegen nach § 394 FamFG zu löschen. Die Frist zur Erhebung eines Widerspruchs ist auf drei Monate festgesetzt."
    },
    {
      "date": "2025-08-06",
      "id": "119476",
      "original_text": "Registerbekanntmachung nach dem Umwandlungsgesetz\nBayern Amtsgericht München HRA 121427\nAlpen Elektroanlagen Bössner e.K. – Holzkirchen",
      "type": "Registerbekanntmachung nach dem Umwandlungsgesetz",
      "state": "Bayern",
      "amtsgericht": "Amtsgericht München",
      "registernummer": "HRA 121427",
      "registerart": "HRA",
      "company_name": "Alpen Elektroanlagen Bössner e.K.",
      "company_seat": "Holzkirchen",
      "details": "06.08.2025 (Bekanntmachungsdatum)\n\nBayern Amtsgericht München HRA 121427\nRegisterbekanntmachung nach dem Umwandlungsgesetz 05.08.2025 (Eintragungsdatum)\n\nAlpen Elektroanlagen Bössner e.K.\nEinzelkaufmann / Einzelkauffrau\nHolzkirchen\n\nDen Gläubigern der an der Verschmelzung beteiligten Rechtsträger ist, wenn sie binnen sechs Monaten nach dem Tag, an dem die Eintragung der Verschmelzung in das Register des Sitzes desjenigen Rechtsträgers, dessen Gläubiger sie sind, nach § 19 Abs. 3 UmwG als bekannt gemacht gilt, ihren Anspruch nach Grund und Höhe in Textform anmelden, Sicherheit zu leisten, soweit sie nicht Befriedigung verlangen können. Dieses Recht steht den Gläubigern jedoch nur zu, wenn sie glaubhaft machen, dass durch die Verschmelzung die Erfüllung ihrer Forderung gefährdet wird."
    },
    {
      "date": "2025-08-06",
      "id": "119477",
      "original_text": "Löschungsankündigung\nBayern Amtsgericht Nürnberg HRB 26223\nGLOBUS MARKETING s.r.o. Zweigniederlassung Nürnberg – Nürnberg",
      "type": "Löschungsankündigung",
      "state": "Bayern",
      "amtsgericht": "Amtsgericht Nürnberg",
      "registernummer": "HRB 26223",
      "registerart": "HRB",
      "company_name": "GLOBUS MARKETING s.r.o. Zweigniederlassung Nürnberg",
      "company_seat": "Nürnberg",
      "details": "06.08.2025 (Bekanntmachungsdatum)\n\nBayern Amtsgericht Nürnberg HRB 26223\nLöschungsankündigung\n\nGLOBUS MARKETING s.r.o. Zweigniederlassung Nürnberg\nRechtsform ausländischen Rechts HRB\nNürnberg\n\nDas Registergericht beabsichtigt, die im Handelsregister eingetragene Gesellschaft von Amts wegen nach § 31 Abs. 2 HGB von Amts wegen zu löschen. Ein etwaiger Widerspruch gegen die beabsichtigte Löschung ist von den Beteiligten innerhalb von einem Monat seit Veröffentlichung zu erhben."
    },
    {
      "date": "2025-08-06",
      "id": "119478",
      "original_text": "Registerbekanntmachung nach dem Umwandlungsgesetz\nBayern Amtsgericht Memmingen HRA 14066\nFINKEL Grünraumgestaltung e.K. – Haldenwang",
      "type": "Registerbekanntmachung nach dem Umwandlungsgesetz",
      "state": "Bayern",
      "amtsgericht": "Amtsgericht Memmingen",
      "registernummer": "HRA 14066",
      "registerart": "HRA",
      "company_name": "FINKEL Grünraumgestaltung e.K.",
      "company_seat": "Haldenwang",
      "details": "06.08.2025 (Bekanntmachungsdatum)\n\nBayern Amtsgericht Memmingen HRA 14066\nRegisterbekanntmachung nach dem Umwandlungsgesetz 05.08.2025 (Eintragungsdatum)\n\nFINKEL Grünraumgestaltung e.K.\nEinzelkaufmann / Einzelkauffrau\nHaldenwang\n\nDen Gläubigern der an der Ausgliederung beteiligten Rechtsträger ist, wenn sie binnen sechs Monaten nach dem Tag, an dem die Eintragung der Ausgliederung in das Register des Sitzes desjenigen Rechtsträgers, dessen Gläubiger sie sind, nach §§ 125, 19 Abs. 3 UmwG als bekannt gemacht gilt, ihren Anspruch nach Grund und Höhe in Textform anmelden, Sicherheit zu leisten, soweit sie nicht Befriedigung verlangen können. Dieses Recht steht den Gläubigern jedoch nur zu, wenn sie glaubhaft machen, dass durch die Ausgliederung die Erfüllung ihrer Forderung gefährdet wird."
    },
    {
      "date": "2025-08-06",
      "id": "119479",
      "original_text": "Sonstige Registerbekanntmachung\nBayern Amtsgericht Bayreuth HRB 5812\nLuft- und Thermotechnik Bayreuth GmbH – Goldkronach",
      "type": "Sonstige Registerbekanntmachung",
      "state": "Bayern",
      "amtsgericht": "Amtsgericht Bayreuth",
      "registernummer": "HRB 5812",
      "registerart": "HRB",
      "company_name": "Luft- und Thermotechnik Bayreuth GmbH",
      "company_seat": "Goldkronach",
      "details": "06.08.2025 (Bekanntmachungsdatum)\n\nBayern Amtsgericht Bayreuth HRB 5812\nSonstige Registerbekanntmachung 05.08.2025 (Eintragungsdatum)\n\nLuft- und Thermotechnik Bayreuth GmbH\nGesellschaft mit beschränkter Haftung\nGoldkronach\n\nDen Gläubigern der an der Verschmelzung beteiligten Rechtsträger ist, wenn sie binnen sechs Monaten nach dem Tag, an dem die Eintragung der Verschmelzung in das Register des Sitzes desjenigen Rechtsträgers, dessen Gläubiger sie sind, nach § 19 Abs. 3 UmwG als bekannt gemacht gilt, ihren Anspruch nach Grund und Höhe in Textform anmelden, Sicherheit zu leisten, soweit sie nicht Befriedigung verlangen können. Dieses Recht steht den Gläubigern jedoch nur zu, wenn sie glaubhaft machen, dass durch die Verschmelzung die Erfüllung ihrer Forderung gefährdet wird."
    },
    {
      "date": "2025-08-06",
      "id": "119480",
      "original_text": "Registerbekanntmachung nach dem Umwandlungsgesetz\nBayern Amtsgericht Nürnberg HRB 39588\nStädtler Logistik GmbH – Nürnberg",
      "type": "Registerbekanntmachung nach dem Umwandlungsgesetz",
      "state": "Bayern",
      "amtsgericht": "Amtsgericht Nürnberg",
      "registernummer": "HRB 39588",
      "registerart": "HRB",
      "company_name": "Städtler Logistik GmbH",
      "company_seat": "Nürnberg",
      "details": "06.08.2025 (Bekanntmachungsdatum)\n\nBayern Amtsgericht Nürnberg HRB 39588\nRegisterbekanntmachung nach dem Umwandlungsgesetz 05.08.2025 (Eintragungsdatum)\n\nStädtler Logistik GmbH\nGesellschaft mit beschränkter Haftung\nNürnberg\n\nDen Gläubigern der an der Verschmelzung beteiligten Rechtsträger ist, wenn sie binnen sechs Monaten nach dem Tag, an dem die Eintragung der Verschmelzung in das Register des Sitzes desjenigen Rechtsträgers, dessen Gläubiger sie sind, nach § 19 Abs. 3 UmwG als bekannt gemacht gilt, ihren Anspruch nach Grund und Höhe in Textform anmelden, Sicherheit zu leisten, soweit sie nicht Befriedigung verlangen können. Dieses Recht steht den Gläubigern jedoch nur zu, wenn sie glaubhaft machen, dass durch die Verschmelzung die Erfüllung ihrer Forderung gefährdet wird."
    },
    {
      "date": "2025-08-06",
      "id": "119481",
      "original_text": "Registerbekanntmachung nach dem Umwandlungsgesetz\nBayern Amtsgericht Nürnberg HRB 24940\nRalmont GmbH – Berngau",
      "type": "Registerbekanntmachung nach dem Umwandlungsgesetz",
      "state": "Bayern",
      "amtsgericht": "Amtsgericht Nürnberg",
      "registernummer": "HRB 24940",
      "registerart": "HRB",
      "company_name": "Ralmont GmbH",
      "company_seat": "Berngau",
      "details": "06.08.2025 (Bekanntmachungsdatum)\n\nBayern Amtsgericht Nürnberg HRB 24940\nRegisterbekanntmachung nach dem Umwandlungsgesetz 05.08.2025 (Eintragungsdatum)\n\nRalmont GmbH\nGesellschaft mit beschränkter Haftung\nBerngau\n\nDen Gläubigern der an der Verschmelzung beteiligten Rechtsträger ist, wenn sie binnen sechs Monaten nach dem Tag, an dem die Eintragung der Verschmelzung in das Register des Sitzes desjenigen Rechtsträgers, dessen Gläubiger sie sind, nach § 19 Abs. 3 UmwG als bekannt gemacht gilt, ihren Anspruch nach Grund und Höhe in Textform anmelden, Sicherheit zu leisten, soweit sie nicht Befriedigung verlangen können. Dieses Recht steht den Gläubigern jedoch nur zu, wenn sie glaubhaft machen, dass durch die Verschmelzung die Erfüllung ihrer Forderung gefährdet wird."
    },
    {
      "date": "2025-08-06",
      "id": "119482",
      "original_text": "Registerbekanntmachung nach dem Umwandlungsgesetz\nBayern Amtsgericht Regensburg HRB 12750\nWaldau & Fuchs Verwaltungs UG (haftungsbeschränkt) – Regensburg",
      "type": "Registerbekanntmachung nach dem Umwandlungsgesetz",
      "state": "Bayern",
      "amtsgericht": "Amtsgericht Regensburg",
      "registernummer": "HRB 12750",
      "registerart": "HRB",
      "company_name": "Waldau & Fuchs Verwaltungs UG (haftungsbeschränkt)",
      "company_seat": "Regensburg",
      "details": "06.08.2025 (Bekanntmachungsdatum)\n\nBayern Amtsgericht Regensburg HRB 12750\nRegisterbekanntmachung nach dem Umwandlungsgesetz 05.08.2025 (Eintragungsdatum)\n\nWaldau & Fuchs Verwaltungs UG (haftungsbeschränkt)\nGesellschaft mit beschränkter Haftung\nRegensburg\n\nDen Gläubigern der an der Verschmelzung beteiligten Rechtsträger ist, wenn sie binnen sechs Monaten nach dem Tag, an dem die Eintragung der Verschmelzung in das Register des Sitzes desjenigen Rechtsträgers, dessen Gläubiger sie sind, nach § 19 Abs. 3 UmwG als bekannt gemacht gilt, ihren Anspruch nach Grund und Höhe in Textform anmelden, Sicherheit zu leisten, soweit sie nicht Befriedigung verlangen können. Dieses Recht steht den Gläubigern jedoch nur zu, wenn sie glaubhaft machen, dass durch die Verschmelzung die Erfüllung ihrer Forderung gefährdet wird."
    },
    {
      "date": "2025-08-06",
      "id": "119483",
      "original_text": "Löschungsankündigung\nBayern Amtsgericht München HRB 253518\nK Bodentechnik GmbH – Starnberg",
      "type": "Löschungsankündigung",
      "state": "Bayern",
      "amtsgericht": "Amtsgericht München",
      "registernummer": "HRB 253518",
      "registerart": "HRB",
      "company_name": "K Bodentechnik GmbH",
      "company_seat": "Starnberg",
      "details": "06.08.2025 (Bekanntmachungsdatum)\n\nBayern Amtsgericht München HRB 253518\nLöschungsankündigung 05.08.2025 (Eintragungsdatum)\n\nK Bodentechnik GmbH\nGesellschaft mit beschränkter Haftung\nStarnberg\n\nDas Registergericht beabsichtigt, die im Handelsregister eingetragene Gesellschaft wegen Vermögenslosigkeit von Amts wegen nach § 394 FamFG zu löschen. Die Frist zur Erhebung eines Widerspruchs ist auf drei Monate festgesetzt."
    },
    {
      "date": "2025-08-06",
      "id": "119484",
      "original_text": "Registerbekanntmachung nach dem Umwandlungsgesetz\nBayern Amtsgericht München HRB 229655\nAloha Poke Gastro GmbH – München",
      "type": "Registerbekanntmachung nach dem Umwandlungsgesetz",
      "state": "Bayern",
      "amtsgericht": "Amtsgericht München",
      "registernummer": "HRB 229655",
      "registerart": "HRB",
      "company_name": "Aloha Poke Gastro GmbH",
      "company_seat": "München",
      "details": "06.08.2025 (Bekanntmachungsdatum)\n\nBayern Amtsgericht München HRB 229655\nRegisterbekanntmachung nach dem Umwandlungsgesetz 05.08.2025 (Eintragungsdatum)\n\nAloha Poke Gastro GmbH\nGesellschaft mit beschränkter Haftung\nMünchen\n\nDen Gläubigern der an der Verschmelzung beteiligten Rechtsträger ist, wenn sie binnen sechs Monaten nach dem Tag, an dem die Eintragung der Verschmelzung in das Register des Sitzes desjenigen Rechtsträgers, dessen Gläubiger sie sind, nach § 19 Abs. 3 UmwG als bekannt gemacht gilt, ihren Anspruch nach Grund und Höhe in Textform anmelden, Sicherheit zu leisten, soweit sie nicht Befriedigung verlangen können. Dieses Recht steht den Gläubigern jedoch nur zu, wenn sie glaubhaft machen, dass durch die Verschmelzung die Erfüllung ihrer Forderung gefährdet wird."
    },
    {
      "date": "2025-08-06",
      "id": "119485",
      "original_text": "Registerbekanntmachung nach dem Umwandlungsgesetz\nBayern Amtsgericht München HRB 216630\nCHECK24 Vergleichsportal Autoteile GmbH – München",
      "type": "Registerbekanntmachung nach dem Umwandlungsgesetz",
      "state": "Bayern",
      "amtsgericht": "Amtsgericht München",
      "registernummer": "HRB 216630",
      "registerart": "HRB",
      "company_name": "CHECK24 Vergleichsportal Autoteile GmbH",
      "company_seat": "München",
      "details": "06.08.2025 (Bekanntmachungsdatum)\n\nBayern Amtsgericht München HRB 216630\nRegisterbekanntmachung nach dem Umwandlungsgesetz 05.08.2025 (Eintragungsdatum)\n\nCHECK24 Vergleichsportal Autoteile GmbH\nGesellschaft mit beschränkter Haftung\nMünchen\n\nDen Gläubigern der an der Spaltung beteiligten Rechtsträger ist, wenn sie binnen sechs Monaten nach dem Tag, an dem die Eintragung der Spaltung in das Register des Sitzes desjenigen Rechtsträgers, dessen Gläubiger sie sind, nach §§ 125, 19 Abs. 3 UmwG als bekannt gemacht gilt, ihren Anspruch nach Grund und Höhe in Textform anmelden, Sicherheit zu leisten, soweit sie nicht Befriedigung verlangen können. Dieses Recht steht den Gläubigern jedoch nur zu, wenn sie glaubhaft machen, dass durch die Spaltung die Erfüllung ihrer Forderung gefährdet wird."
    },
    {
      "date": "2025-08-06",
      "id": "119486",
      "original_text": "Registerbekanntmachung nach dem Umwandlungsgesetz\nBayern Amtsgericht Würzburg HRB 11159\nTKN Deutschland GmbH – Iphofen",
      "type": "Registerbekanntmachung nach dem Umwandlungsgesetz",
      "state": "Bayern",
      "amtsgericht": "Amtsgericht Würzburg",
      "registernummer": "HRB 11159",
      "registerart": "HRB",
      "company_name": "TKN Deutschland GmbH",
      "company_seat": "Iphofen",
      "details": "06.08.2025 (Bekanntmachungsdatum)\n\nBayern Amtsgericht Würzburg HRB 11159\nRegisterbekanntmachung nach dem Umwandlungsgesetz 01.08.2025 (Eintragungsdatum)\n\nTKN Deutschland GmbH\nGesellschaft mit beschränkter Haftung\nIphofen\n\nDen Gläubigern der an der Verschmelzung beteiligten Rechtsträger ist, wenn sie binnen sechs Monaten nach dem Tag, an dem die Eintragung der Verschmelzung in das Register des Sitzes desjenigen Rechtsträgers, dessen Gläubiger sie sind, nach § 19 Abs. 3 UmwG als bekannt gemacht gilt, ihren Anspruch nach Grund und Höhe in Textform anmelden, Sicherheit zu leisten, soweit sie nicht Befriedigung verlangen können. Dieses Recht steht den Gläubigern jedoch nur zu, wenn sie glaubhaft machen, dass durch die Verschmelzung die Erfüllung ihrer Forderung gefährdet wird."
    },
    {
      "date": "2025-08-06",
      "id": "119487",
      "original_text": "Registerbekanntmachung nach dem Umwandlungsgesetz\nBayern Amtsgericht München HRB 163441\nATP sustain GmbH – München",
      "type": "Registerbekanntmachung nach dem Umwandlungsgesetz",
      "state": "Bayern",
      "amtsgericht": "Amtsgericht München",
      "registernummer": "HRB 163441",
      "registerart": "HRB",
      "company_name": "ATP sustain GmbH",
      "company_seat": "München",
      "details": "06.08.2025 (Bekanntmachungsdatum)\n\nBayern Amtsgericht München HRB 163441\nRegisterbekanntmachung nach dem Umwandlungsgesetz 05.08.2025 (Eintragungsdatum)\n\nATP sustain GmbH\nGesellschaft mit beschränkter Haftung\nMünchen\n\nDen Gläubigern der an der Verschmelzung beteiligten Rechtsträger ist, wenn sie binnen sechs Monaten nach dem Tag, an dem die Eintragung der Verschmelzung in das Register des Sitzes desjenigen Rechtsträgers, dessen Gläubiger sie sind, nach § 19 Abs. 3 UmwG als bekannt gemacht gilt, ihren Anspruch nach Grund und Höhe in Textform anmelden, Sicherheit zu leisten, soweit sie nicht Befriedigung verlangen können. Dieses Recht steht den Gläubigern jedoch nur zu, wenn sie glaubhaft machen, dass durch die Verschmelzung die Erfüllung ihrer Forderung gefährdet wird."
    },
    {
      "date": "2025-08-06",
      "id": "119488",
      "original_text": "Registerbekanntmachung nach dem Umwandlungsgesetz\nBayern Amtsgericht München HRB 240788\nVersicherungskammer Rechtsschutz Vertriebs- und Service GmbH – München",
      "type": "Registerbekanntmachung nach dem Umwandlungsgesetz",
      "state": "Bayern",
      "amtsgericht": "Amtsgericht München",
      "registernummer": "HRB 240788",
      "registerart": "HRB",
      "company_name": "Versicherungskammer Rechtsschutz Vertriebs- und Service GmbH",
      "company_seat": "München",
      "details": "06.08.2025 (Bekanntmachungsdatum)\n\nBayern Amtsgericht München HRB 240788\nRegisterbekanntmachung nach dem Umwandlungsgesetz 05.08.2025 (Eintragungsdatum)\n\nVersicherungskammer Rechtsschutz Vertriebs- und Service GmbH\nGesellschaft mit beschränkter Haftung\nMünchen\n\nDen Gläubigern der an der Verschmelzung beteiligten Rechtsträger ist, wenn sie binnen sechs Monaten nach dem Tag, an dem die Eintragung der Verschmelzung in das Register des Sitzes desjenigen Rechtsträgers, dessen Gläubiger sie sind, nach § 19 Abs. 3 UmwG als bekannt gemacht gilt, ihren Anspruch nach Grund und Höhe in Textform anmelden, Sicherheit zu leisten, soweit sie nicht Befriedigung verlangen können. Dieses Recht steht den Gläubigern jedoch nur zu, wenn sie glaubhaft machen, dass durch die Verschmelzung die Erfüllung ihrer Forderung gefährdet wird."
    },
    {
      "date": "2025-08-06",
      "id": "119489",
      "original_text": "Registerbekanntmachung nach dem Umwandlungsgesetz\nBayern Amtsgericht Traunstein HRB 19913\nTeichert Vermögensverwaltungs GmbH – Oberaudorf",
      "type": "Registerbekanntmachung nach dem Umwandlungsgesetz",
      "state": "Bayern",
      "amtsgericht": "Amtsgericht Traunstein",
      "registernummer": "HRB 19913",
      "registerart": "HRB",
      "company_name": "Teichert Vermögensverwaltungs GmbH",
      "company_seat": "Oberaudorf",
      "details": "06.08.2025 (Bekanntmachungsdatum)\n\nBayern Amtsgericht Traunstein HRB 19913\nRegisterbekanntmachung nach dem Umwandlungsgesetz 05.08.2025 (Eintragungsdatum)\n\nTeichert Vermögensverwaltungs GmbH\nGesellschaft mit beschränkter Haftung\nOberaudorf\n\nDen Gläubigern der an der Verschmelzung beteiligten Rechtsträger ist, wenn sie binnen sechs Monaten nach dem Tag, an dem die Eintragung der Verschmelzung in das Register des Sitzes desjenigen Rechtsträgers, dessen Gläubiger sie sind, nach § 19 Abs. 3 UmwG als bekannt gemacht gilt, ihren Anspruch nach Grund und Höhe in Textform anmelden, Sicherheit zu leisten, soweit sie nicht Befriedigung verlangen können. Dieses Recht steht den Gläubigern jedoch nur zu, wenn sie glaubhaft machen, dass durch die Verschmelzung die Erfüllung ihrer Forderung gefährdet wird."
    },
    {
      "date": "2025-08-06",
      "id": "119490",
      "original_text": "Registerbekanntmachung nach dem Umwandlungsgesetz\nBayern Amtsgericht München HRB 295247\nFinparx & Bonum GmbH – München",
      "type": "Registerbekanntmachung nach dem Umwandlungsgesetz",
      "state": "Bayern",
      "amtsgericht": "Amtsgericht München",
      "registernummer": "HRB 295247",
      "registerart": "HRB",
      "company_name": "Finparx & Bonum GmbH",
      "company_seat": "München",
      "details": "06.08.2025 (Bekanntmachungsdatum)\n\nBayern Amtsgericht München HRB 295247\nRegisterbekanntmachung nach dem Umwandlungsgesetz 05.08.2025 (Eintragungsdatum)\n\nFinparx & Bonum GmbH\nGesellschaft mit beschränkter Haftung\nMünchen\n\nDen Gläubigern der an der Verschmelzung beteiligten Rechtsträger ist, wenn sie binnen sechs Monaten nach dem Tag, an dem die Eintragung der Verschmelzung in das Register des Sitzes desjenigen Rechtsträgers, dessen Gläubiger sie sind, nach § 19 Abs. 3 UmwG als bekannt gemacht gilt, ihren Anspruch nach Grund und Höhe in Textform anmelden, Sicherheit zu leisten, soweit sie nicht Befriedigung verlangen können. Dieses Recht steht den Gläubigern jedoch nur zu, wenn sie glaubhaft machen, dass durch die Verschmelzung die Erfüllung ihrer Forderung gefährdet wird."
    },
    {
      "date": "2025-08-06",
      "id": "119491",
      "original_text": "Registerbekanntmachung nach dem Umwandlungsgesetz\nBayern Amtsgericht Würzburg HRB 3714\nHarlekin Spiel- und Unterhaltungsautomaten Betriebsgesellschaft mbH – Waldbrunn",
      "type": "Registerbekanntmachung nach dem Umwandlungsgesetz",
      "state": "Bayern",
      "amtsgericht": "Amtsgericht Würzburg",
      "registernummer": "HRB 3714",
      "registerart": "HRB",
      "company_name": "Harlekin Spiel- und Unterhaltungsautomaten Betriebsgesellschaft mbH",
      "company_seat": "Waldbrunn",
      "details": "06.08.2025 (Bekanntmachungsdatum)\n\nBayern Amtsgericht Würzburg HRB 3714\nRegisterbekanntmachung nach dem Umwandlungsgesetz 05.08.2025 (Eintragungsdatum)\n\nHarlekin Spiel- und Unterhaltungsautomaten Betriebsgesellschaft mbH\nGesellschaft mit beschränkter Haftung\nWaldbrunn\n\nDen Gläubigern der an der Verschmelzung beteiligten Rechtsträger ist, wenn sie binnen sechs Monaten nach dem Tag, an dem die Eintragung der Verschmelzung in das Register des Sitzes desjenigen Rechtsträgers, dessen Gläubiger sie sind, nach § 19 Abs. 3 UmwG als bekannt gemacht gilt, ihren Anspruch nach Grund und Höhe in Textform anmelden, Sicherheit zu leisten, soweit sie nicht Befriedigung verlangen können. Dieses Recht steht den Gläubigern jedoch nur zu, wenn sie glaubhaft machen, dass durch die Verschmelzung die Erfüllung ihrer Forderung gefährdet wird."
    },
    {
      "date": "2025-08-06",
      "id": "119492",
      "original_text": "Registerbekanntmachung nach dem Umwandlungsgesetz\nBayern Amtsgericht Nürnberg HRB 25808\nPTW-Bayern-Vertragshandelsges. mbH – Berngau",
      "type": "Registerbekanntmachung nach dem Umwandlungsgesetz",
      "state": "Bayern",
      "amtsgericht": "Amtsgericht Nürnberg",
      "registernummer": "HRB 25808",
      "registerart": "HRB",
      "company_name": "PTW-Bayern-Vertragshandelsges. mbH",
      "company_seat": "Berngau",
      "details": "06.08.2025 (Bekanntmachungsdatum)\n\nBayern Amtsgericht Nürnberg HRB 25808\nRegisterbekanntmachung nach dem Umwandlungsgesetz 05.08.2025 (Eintragungsdatum)\n\nPTW-Bayern-Vertragshandelsges. mbH\nGesellschaft mit beschränkter Haftung\nBerngau\n\nDen Gläubigern der an der Verschmelzung beteiligten Rechtsträger ist, wenn sie binnen sechs Monaten nach dem Tag, an dem die Eintragung der Verschmelzung in das Register des Sitzes desjenigen Rechtsträgers, dessen Gläubiger sie sind, nach § 19 Abs. 3 UmwG als bekannt gemacht gilt, ihren Anspruch nach Grund und Höhe in Textform anmelden, Sicherheit zu leisten, soweit sie nicht Befriedigung verlangen können. Dieses Recht steht den Gläubigern jedoch nur zu, wenn sie glaubhaft machen, dass durch die Verschmelzung die Erfüllung ihrer Forderung gefährdet wird."
    },
    {
      "date": "2025-08-06",
      "id": "119493",
      "original_text": "Registerbekanntmachung nach dem Umwandlungsgesetz\nBayern Amtsgericht München HRB 266006\nGC Geschäftsführung GmbH – München",
      "type": "Registerbekanntmachung nach dem Umwandlungsgesetz",
      "state": "Bayern",
      "amtsgericht": "Amtsgericht München",
      "registernummer": "HRB 266006",
      "registerart": "HRB",
      "company_name": "GC Geschäftsführung GmbH",
      "company_seat": "München",
      "details": "06.08.2025 (Bekanntmachungsdatum)\n\nBayern Amtsgericht München HRB 266006\nRegisterbekanntmachung nach dem Umwandlungsgesetz 05.08.2025 (Eintragungsdatum)\n\nGC Geschäftsführung GmbH\nGesellschaft mit beschränkter Haftung\nMünchen\n\nDen Gläubigern der an der Verschmelzung beteiligten Rechtsträger ist, wenn sie binnen sechs Monaten nach dem Tag, an dem die Eintragung der Verschmelzung in das Register des Sitzes desjenigen Rechtsträgers, dessen Gläubiger sie sind, nach § 19 Abs. 3 UmwG als bekannt gemacht gilt, ihren Anspruch nach Grund und Höhe in Textform anmelden, Sicherheit zu leisten, soweit sie nicht Befriedigung verlangen können. Dieses Recht steht den Gläubigern jedoch nur zu, wenn sie glaubhaft machen, dass durch die Verschmelzung die Erfüllung ihrer Forderung gefährdet wird."
    },
    {
      "date": "2025-08-06",
      "id": "119494",
      "original_text": "Registerbekanntmachung nach dem Umwandlungsgesetz\nBayern Amtsgericht München HRB 227290\nSinnwell Engineering GmbH – München",
      "type": "Registerbekanntmachung nach dem Umwandlungsgesetz",
      "state": "Bayern",
      "amtsgericht": "Amtsgericht München",
      "registernummer": "HRB 227290",
      "registerart": "HRB",
      "company_name": "Sinnwell Engineering GmbH",
      "company_seat": "München",
      "details": "06.08.2025 (Bekanntmachungsdatum)\n\nBayern Amtsgericht München HRB 227290\nRegisterbekanntmachung nach dem Umwandlungsgesetz 05.08.2025 (Eintragungsdatum)\n\nSinnwell Engineering GmbH\nGesellschaft mit beschränkter Haftung\nMünchen\n\nDen Gläubigern der an der Verschmelzung beteiligten Rechtsträger ist, wenn sie binnen sechs Monaten nach dem Tag, an dem die Eintragung der Verschmelzung in das Register des Sitzes desjenigen Rechtsträgers, dessen Gläubiger sie sind, nach § 19 Abs. 3 UmwG als bekannt gemacht gilt, ihren Anspruch nach Grund und Höhe in Textform anmelden, Sicherheit zu leisten, soweit sie nicht Befriedigung verlangen können. Dieses Recht steht den Gläubigern jedoch nur zu, wenn sie glaubhaft machen, dass durch die Verschmelzung die Erfüllung ihrer Forderung gefährdet wird."
    },
    {
      "date": "2025-08-06",
      "id": "119495",
      "original_text": "Einreichung neuer Dokumente\nBayern Amtsgericht München HRB 67295\nMGH-Münchner Gewerbehof- und Technologiezentrumsgesellschaft mbH – München",
      "type": "Einreichung neuer Dokumente",
      "state": "Bayern",
      "amtsgericht": "Amtsgericht München",
      "registernummer": "HRB 67295",
      "registerart": "HRB",
      "company_name": "MGH-Münchner Gewerbehof- und Technologiezentrumsgesellschaft mbH",
      "company_seat": "München",
      "details": "06.08.2025 (Bekanntmachungsdatum)\n\nBayern Amtsgericht München HRB 67295\nEinreichung neuer Dokumente\n\nMGH-Münchner Gewerbehof- und Technologiezentrumsgesellschaft mbH\nGesellschaft mit beschränkter Haftung\nMünchen\n\nDem #Re.Name ist eine Liste der Mitglieder des Aufsichtsrats eingereicht worden, § 52 Abs. 3 S. 2 GmbHG."
    },
    {
      "date": "2025-08-06",
      "id": "119496",
      "original_text": "Registerbekanntmachung nach dem Umwandlungsgesetz\nBayern Amtsgericht München HRB 242979\nImplanteer GmbH – Gräfelfing",
      "type": "Registerbekanntmachung nach dem Umwandlungsgesetz",
      "state": "Bayern",
      "amtsgericht": "Amtsgericht München",
      "registernummer": "HRB 242979",
      "registerart": "HRB",
      "company_name": "Implanteer GmbH",
      "company_seat": "Gräfelfing",
      "details": "06.08.2025 (Bekanntmachungsdatum)\n\nBayern Amtsgericht München HRB 242979\nRegisterbekanntmachung nach dem Umwandlungsgesetz 05.08.2025 (Eintragungsdatum)\n\nImplanteer GmbH\nGesellschaft mit beschränkter Haftung\nGräfelfing\n\nDen Gläubigern der an der Verschmelzung beteiligten Rechtsträger ist, wenn sie binnen sechs Monaten nach dem Tag, an dem die Eintragung der Verschmelzung in das Register des Sitzes desjenigen Rechtsträgers, dessen Gläubiger sie sind, nach § 19 Abs. 3 UmwG als bekannt gemacht gilt, ihren Anspruch nach Grund und Höhe in Textform anmelden, Sicherheit zu leisten, soweit sie nicht Befriedigung verlangen können. Dieses Recht steht den Gläubigern jedoch nur zu, wenn sie glaubhaft machen, dass durch die Verschmelzung die Erfüllung ihrer Forderung gefährdet wird."
    },
    {
      "date": "2025-08-06",
      "id": "119497",
      "original_text": "Sonstige Registerbekanntmachung\nBayern Amtsgericht München HRB 259536\nSozialkonzept Schulze-Kathrinhof GmbH Betriebsgesellschaft sozialer Einrichtungen – München",
      "type": "Sonstige Registerbekanntmachung",
      "state": "Bayern",
      "amtsgericht": "Amtsgericht München",
      "registernummer": "HRB 259536",
      "registerart": "HRB",
      "company_name": "Sozialkonzept Schulze-Kathrinhof GmbH Betriebsgesellschaft sozialer Einrichtungen",
      "company_seat": "München",
      "details": "06.08.2025 (Bekanntmachungsdatum)\n\nBayern Amtsgericht München HRB 259536\nSonstige Registerbekanntmachung 05.08.2025 (Eintragungsdatum)\n\nSozialkonzept Schulze-Kathrinhof GmbH Betriebsgesellschaft sozialer Einrichtungen\nGesellschaft mit beschränkter Haftung\nMünchen\n\nDen Gläubigern der Gesellschaft, deren Forderungen begründet worden sind, bevor die Eintragung der Beendigung des Beherrschungs- und Gewinnabführungsvertrages in das Handelsregister nach § 10 des Handelsgesetzbuches als bekanntgemacht gilt, hat der andere Vertragsteil Sicherheit zu leisten, wenn sie sich binnen sechs Monaten nach der Bekanntmachung der Eintragung zu diesem Zweck bei ihm melden."
    },
    {
      "date": "2025-08-06",
      "id": "119498",
      "original_text": "Registerbekanntmachung nach dem Umwandlungsgesetz\nBayern Amtsgericht München HRB 238746\nFinparx Holding GmbH – München",
      "type": "Registerbekanntmachung nach dem Umwandlungsgesetz",
      "state": "Bayern",
      "amtsgericht": "Amtsgericht München",
      "registernummer": "HRB 238746",
      "registerart": "HRB",
      "company_name": "Finparx Holding GmbH",
      "company_seat": "München",
      "details": "06.08.2025 (Bekanntmachungsdatum)\n\nBayern Amtsgericht München HRB 238746\nRegisterbekanntmachung nach dem Umwandlungsgesetz 05.08.2025 (Eintragungsdatum)\n\nFinparx Holding GmbH\nGesellschaft mit beschränkter Haftung\nMünchen\n\nDen Gläubigern der an der Verschmelzung beteiligten Rechtsträger ist, wenn sie binnen sechs Monaten nach dem Tag, an dem die Eintragung der Verschmelzung in das Register des Sitzes desjenigen Rechtsträgers, dessen Gläubiger sie sind, nach § 19 Abs. 3 UmwG als bekannt gemacht gilt, ihren Anspruch nach Grund und Höhe in Textform anmelden, Sicherheit zu leisten, soweit sie nicht Befriedigung verlangen können. Dieses Recht steht den Gläubigern jedoch nur zu, wenn sie glaubhaft machen, dass durch die Verschmelzung die Erfüllung ihrer Forderung gefährdet wird."
    },
    {
      "date": "2025-08-06",
      "id": "119499",
      "original_text": "Registerbekanntmachung nach dem Umwandlungsgesetz\nBayern Amtsgericht Würzburg HRB 15657\nBlumhagen Immobilien GmbH – Karlstadt",
      "type": "Registerbekanntmachung nach dem Umwandlungsgesetz",
      "state": "Bayern",
      "amtsgericht": "Amtsgericht Würzburg",
      "registernummer": "HRB 15657",
      "registerart": "HRB",
      "company_name": "Blumhagen Immobilien GmbH",
      "company_seat": "Karlstadt",
      "details": "06.08.2025 (Bekanntmachungsdatum)\n\nBayern Amtsgericht Würzburg HRB 15657\nRegisterbekanntmachung nach dem Umwandlungsgesetz 05.08.2025 (Eintragungsdatum)\n\nBlumhagen Immobilien GmbH\nGesellschaft mit beschränkter Haftung\nKarlstadt\n\nDen Gläubigern der an der Verschmelzung beteiligten Rechtsträger ist, wenn sie binnen sechs Monaten nach dem Tag, an dem die Eintragung der Verschmelzung in das Register des Sitzes desjenigen Rechtsträgers, dessen Gläubiger sie sind, nach § 19 Abs. 3 UmwG als bekannt gemacht gilt, ihren Anspruch nach Grund und Höhe in Textform anmelden, Sicherheit zu leisten, soweit sie nicht Befriedigung verlangen können. Dieses Recht steht den Gläubigern jedoch nur zu, wenn sie glaubhaft machen, dass durch die Verschmelzung die Erfüllung ihrer Forderung gefährdet wird."
    },
    {
      "date": "2025-08-06",
      "id": "119500",
      "original_text": "Einreichung neuer Dokumente\nBayern Amtsgericht Deggendorf HRB 3\nZwiesel Kristallglas Aktiengesellschaft – Zwiesel",
      "type": "Einreichung neuer Dokumente",
      "state": "Bayern",
      "amtsgericht": "Amtsgericht Deggendorf",
      "registernummer": "HRB 3",
      "registerart": "HRB",
      "company_name": "Zwiesel Kristallglas Aktiengesellschaft",
      "company_seat": "Zwiesel",
      "details": "06.08.2025 (Bekanntmachungsdatum)\n\nBayern Amtsgericht Deggendorf HRB 3\nEinreichung neuer Dokumente\n\nZwiesel Kristallglas Aktiengesellschaft\nAktiengesellschaft\nZwiesel\n\nDem Amtsgericht Deggendorf -Registergericht- ist eine Liste der Mitglieder des Aufsichtsrats eingereicht worden, § 106 AktG."
    },
    {
      "date": "2025-08-06",
      "id": "119501",
      "original_text": "Registerbekanntmachung nach dem Umwandlungsgesetz\nBayern Amtsgericht Würzburg HRB 12087\nVierte Casino Freudenberg GmbH – Waldbrunn",
      "type": "Registerbekanntmachung nach dem Umwandlungsgesetz",
      "state": "Bayern",
      "amtsgericht": "Amtsgericht Würzburg",
      "registernummer": "HRB 12087",
      "registerart": "HRB",
      "company_name": "Vierte Casino Freudenberg GmbH",
      "company_seat": "Waldbrunn",
      "details": "06.08.2025 (Bekanntmachungsdatum)\n\nBayern Amtsgericht Würzburg HRB 12087\nRegisterbekanntmachung nach dem Umwandlungsgesetz 05.08.2025 (Eintragungsdatum)\n\nVierte Casino Freudenberg GmbH\nGesellschaft mit beschränkter Haftung\nWaldbrunn\n\nDen Gläubigern der an der Verschmelzung beteiligten Rechtsträger ist, wenn sie binnen sechs Monaten nach dem Tag, an dem die Eintragung der Verschmelzung in das Register des Sitzes desjenigen Rechtsträgers, dessen Gläubiger sie sind, nach § 19 Abs. 3 UmwG als bekannt gemacht gilt, ihren Anspruch nach Grund und Höhe in Textform anmelden, Sicherheit zu leisten, soweit sie nicht Befriedigung verlangen können. Dieses Recht steht den Gläubigern jedoch nur zu, wenn sie glaubhaft machen, dass durch die Verschmelzung die Erfüllung ihrer Forderung gefährdet wird."
    },
    {
      "date": "2025-08-06",
      "id": "119502",
      "original_text": "Registerbekanntmachung nach dem Umwandlungsgesetz\nBayern Amtsgericht Regensburg HRA 9155\nWaldau & Fuchs Projekt OHG – Regensburg",
      "type": "Registerbekanntmachung nach dem Umwandlungsgesetz",
      "state": "Bayern",
      "amtsgericht": "Amtsgericht Regensburg",
      "registernummer": "HRA 9155",
      "registerart": "HRA",
      "company_name": "Waldau & Fuchs Projekt OHG",
      "company_seat": "Regensburg",
      "details": "06.08.2025 (Bekanntmachungsdatum)\n\nBayern Amtsgericht Regensburg HRA 9155\nRegisterbekanntmachung nach dem Umwandlungsgesetz 05.08.2025 (Eintragungsdatum)\n\nWaldau & Fuchs Projekt OHG\nOffene Handelsgesellschaft\nRegensburg\n\nDen Gläubigern der an der Verschmelzung beteiligten Rechtsträger ist, wenn sie binnen sechs Monaten nach dem Tag, an dem die Eintragung der Verschmelzung in das Register des Sitzes desjenigen Rechtsträgers, dessen Gläubiger sie sind, nach § 19 Abs. 3 UmwG als bekannt gemacht gilt, ihren Anspruch nach Grund und Höhe in Textform anmelden, Sicherheit zu leisten, soweit sie nicht Befriedigung verlangen können. Dieses Recht steht den Gläubigern jedoch nur zu, wenn sie glaubhaft machen, dass durch die Verschmelzung die Erfüllung ihrer Forderung gefährdet wird."
    },
    {
      "date": "2025-08-06",
      "id": "119503",
      "original_text": "Registerbekanntmachung nach dem Umwandlungsgesetz\nBayern Amtsgericht München HRB 168016\nSeven.One Entertainment Group GmbH – Unterföhring",
      "type": "Registerbekanntmachung nach dem Umwandlungsgesetz",
      "state": "Bayern",
      "amtsgericht": "Amtsgericht München",
      "registernummer": "HRB 168016",
      "registerart": "HRB",
      "company_name": "Seven.One Entertainment Group GmbH",
      "company_seat": "Unterföhring",
      "details": "06.08.2025 (Bekanntmachungsdatum)\n\nBayern Amtsgericht München HRB 168016\nRegisterbekanntmachung nach dem Umwandlungsgesetz 05.08.2025 (Eintragungsdatum)\n\nSeven.One Entertainment Group GmbH\nGesellschaft mit beschränkter Haftung\nUnterföhring\n\nDen Gläubigern der an der Verschmelzung beteiligten Rechtsträger ist, wenn sie binnen sechs Monaten nach dem Tag, an dem die Eintragung der Verschmelzung in das Register des Sitzes desjenigen Rechtsträgers, dessen Gläubiger sie sind, nach § 19 Abs. 3 UmwG als bekannt gemacht gilt, ihren Anspruch nach Grund und Höhe in Textform anmelden, Sicherheit zu leisten, soweit sie nicht Befriedigung verlangen können. Dieses Recht steht den Gläubigern jedoch nur zu, wenn sie glaubhaft machen, dass durch die Verschmelzung die Erfüllung ihrer Forderung gefährdet wird."
    },
    {
      "date": "2025-08-06",
      "id": "119504",
      "original_text": "Sonstige Registerbekanntmachung\nBayern Amtsgericht München HRB 93618\nSüddeutscher Verlag Hüthig Fachinformationen GmbH – München",
      "type": "Sonstige Registerbekanntmachung",
      "state": "Bayern",
      "amtsgericht": "Amtsgericht München",
      "registernummer": "HRB 93618",
      "registerart": "HRB",
      "company_name": "Süddeutscher Verlag Hüthig Fachinformationen GmbH",
      "company_seat": "München",
      "details": "06.08.2025 (Bekanntmachungsdatum)\n\nBayern Amtsgericht München HRB 93618\nSonstige Registerbekanntmachung 05.08.2025 (Eintragungsdatum)\n\nSüddeutscher Verlag Hüthig Fachinformationen GmbH\nGesellschaft mit beschränkter Haftung\nMünchen\n\nDen Gläubigern der Gesellschaft, deren Forderungen begründet worden sind, bevor die Eintragung der Beendigung des Beherrschungsvertrages in das Handelsregister nach § 10 des Handelsgesetzbuches als bekanntgemacht gilt, hat der andere Vertragsteil Sicherheit zu leisten, wenn sie sich binnen sechs Monaten nach der Bekanntmachung der Eintragung zu diesem Zweck bei ihm melden."
    },
    {
      "date": "2025-08-06",
      "id": "119505",
      "original_text": "Sonstige Registerbekanntmachung\nBayern Amtsgericht München HRB 93618\nSüddeutscher Verlag Hüthig Fachinformationen GmbH – München",
      "type": "Sonstige Registerbekanntmachung",
      "state": "Bayern",
      "amtsgericht": "Amtsgericht München",
      "registernummer": "HRB 93618",
      "registerart": "HRB",
      "company_name": "Süddeutscher Verlag Hüthig Fachinformationen GmbH",
      "company_seat": "München",
      "details": "06.08.2025 (Bekanntmachungsdatum)\n\nBayern Amtsgericht München HRB 93618\nSonstige Registerbekanntmachung 05.08.2025 (Eintragungsdatum)\n\nSüddeutscher Verlag Hüthig Fachinformationen GmbH\nGesellschaft mit beschränkter Haftung\nMünchen\n\nDen Gläubigern der Gesellschaft, deren Forderungen begründet worden sind, bevor die Eintragung der Beendigung des Gewinnabführungsvertrages in das Handelsregister nach § 10 des Handelsgesetzbuches als bekanntgemacht gilt, hat der andere Vertragsteil Sicherheit zu leisten, wenn sie sich binnen sechs Monaten nach der Bekanntmachung der Eintragung zu diesem Zweck bei ihm melden."
    },
    {
      "date": "2025-08-06",
      "id": "119506",
      "original_text": "Registerbekanntmachung nach dem Umwandlungsgesetz\nBayern Amtsgericht Ingolstadt HRB 9478\nMirrads GmbH – Ingolstadt",
      "type": "Registerbekanntmachung nach dem Umwandlungsgesetz",
      "state": "Bayern",
      "amtsgericht": "Amtsgericht Ingolstadt",
      "registernummer": "HRB 9478",
      "registerart": "HRB",
      "company_name": "Mirrads GmbH",
      "company_seat": "Ingolstadt",
      "details": "06.08.2025 (Bekanntmachungsdatum)\n\nBayern Amtsgericht Ingolstadt HRB 9478\nRegisterbekanntmachung nach dem Umwandlungsgesetz 05.08.2025 (Eintragungsdatum)\n\nMirrads GmbH\nGesellschaft mit beschränkter Haftung\nIngolstadt\n\nDen Gläubigern der an der Verschmelzung beteiligten Rechtsträger ist, wenn sie binnen sechs Monaten nach dem Tag, an dem die Eintragung der Verschmelzung in das Register des Sitzes desjenigen Rechtsträgers, dessen Gläubiger sie sind, nach § 19 Abs. 3 UmwG als bekannt gemacht gilt, ihren Anspruch nach Grund und Höhe in Textform anmelden, Sicherheit zu leisten, soweit sie nicht Befriedigung verlangen können. Dieses Recht steht den Gläubigern jedoch nur zu, wenn sie glaubhaft machen, dass durch die Verschmelzung die Erfüllung ihrer Forderung gefährdet wird."
    },
    {
      "date": "2025-08-06",
      "id": "119507",
      "original_text": "Registerbekanntmachung nach dem Umwandlungsgesetz\nBayern Amtsgericht Traunstein HRB 20686\nPEM Systems GmbH – Oberaudorf",
      "type": "Registerbekanntmachung nach dem Umwandlungsgesetz",
      "state": "Bayern",
      "amtsgericht": "Amtsgericht Traunstein",
      "registernummer": "HRB 20686",
      "registerart": "HRB",
      "company_name": "PEM Systems GmbH",
      "company_seat": "Oberaudorf",
      "details": "06.08.2025 (Bekanntmachungsdatum)\n\nBayern Amtsgericht Traunstein HRB 20686\nRegisterbekanntmachung nach dem Umwandlungsgesetz 05.08.2025 (Eintragungsdatum)\n\nPEM Systems GmbH\nGesellschaft mit beschränkter Haftung\nOberaudorf\n\nDen Gläubigern der an der Verschmelzung beteiligten Rechtsträger ist, wenn sie binnen sechs Monaten nach dem Tag, an dem die Eintragung der Verschmelzung in das Register des Sitzes desjenigen Rechtsträgers, dessen Gläubiger sie sind, nach § 19 Abs. 3 UmwG als bekannt gemacht gilt, ihren Anspruch nach Grund und Höhe in Textform anmelden, Sicherheit zu leisten, soweit sie nicht Befriedigung verlangen können. Dieses Recht steht den Gläubigern jedoch nur zu, wenn sie glaubhaft machen, dass durch die Verschmelzung die Erfüllung ihrer Forderung gefährdet wird."
    },
    {
      "date": "2025-08-06",
      "id": "119508",
      "original_text": "Registerbekanntmachung nach dem Umwandlungsgesetz\nBayern Amtsgericht Würzburg HRB 12084\nZweite Casino Freudenberg GmbH – Waldbrunn",
      "type": "Registerbekanntmachung nach dem Umwandlungsgesetz",
      "state": "Bayern",
      "amtsgericht": "Amtsgericht Würzburg",
      "registernummer": "HRB 12084",
      "registerart": "HRB",
      "company_name": "Zweite Casino Freudenberg GmbH",
      "company_seat": "Waldbrunn",
      "details": "06.08.2025 (Bekanntmachungsdatum)\n\nBayern Amtsgericht Würzburg HRB 12084\nRegisterbekanntmachung nach dem Umwandlungsgesetz 05.08.2025 (Eintragungsdatum)\n\nZweite Casino Freudenberg GmbH\nGesellschaft mit beschränkter Haftung\nWaldbrunn\n\nDen Gläubigern der an der Verschmelzung beteiligten Rechtsträger ist, wenn sie binnen sechs Monaten nach dem Tag, an dem die Eintragung der Verschmelzung in das Register des Sitzes desjenigen Rechtsträgers, dessen Gläubiger sie sind, nach § 19 Abs. 3 UmwG als bekannt gemacht gilt, ihren Anspruch nach Grund und Höhe in Textform anmelden, Sicherheit zu leisten, soweit sie nicht Befriedigung verlangen können. Dieses Recht steht den Gläubigern jedoch nur zu, wenn sie glaubhaft machen, dass durch die Verschmelzung die Erfüllung ihrer Forderung gefährdet wird."
    },
    {
      "date": "2025-08-06",
      "id": "119509",
      "original_text": "Registerbekanntmachung nach dem Umwandlungsgesetz\nBayern Amtsgericht München HRB 107767\nZeppelin Baumaschinen GmbH – Garching b. München",
      "type": "Registerbekanntmachung nach dem Umwandlungsgesetz",
      "state": "Bayern",
      "amtsgericht": "Amtsgericht München",
      "registernummer": "HRB 107767",
      "registerart": "HRB",
      "company_name": "Zeppelin Baumaschinen GmbH",
      "company_seat": "Garching b. München",
      "details": "06.08.2025 (Bekanntmachungsdatum)\n\nBayern Amtsgericht München HRB 107767\nRegisterbekanntmachung nach dem Umwandlungsgesetz 05.08.2025 (Eintragungsdatum)\n\nZeppelin Baumaschinen GmbH\nGesellschaft mit beschränkter Haftung\nGarching b. München\n\nDen Gläubigern der an der Verschmelzung beteiligten Rechtsträger ist, wenn sie binnen sechs Monaten nach dem Tag, an dem die Eintragung der Verschmelzung in das Register des Sitzes desjenigen Rechtsträgers, dessen Gläubiger sie sind, nach § 19 Abs. 3 UmwG als bekannt gemacht gilt, ihren Anspruch nach Grund und Höhe in Textform anmelden, Sicherheit zu leisten, soweit sie nicht Befriedigung verlangen können. Dieses Recht steht den Gläubigern jedoch nur zu, wenn sie glaubhaft machen, dass durch die Verschmelzung die Erfüllung ihrer Forderung gefährdet wird."
    },
    {
      "date": "2025-08-06",
      "id": "119510",
      "original_text": "Registerbekanntmachung nach dem Umwandlungsgesetz\nBerlin Amtsgericht Berlin (Charlottenburg) HRB 73708\nnet check GmbH – Berlin",
      "type": "Registerbekanntmachung nach dem Umwandlungsgesetz",
      "state": "Berlin",
      "amtsgericht": "Amtsgericht Berlin (Charlottenburg)",
      "registernummer": "HRB 73708",
      "registerart": "HRB",
      "company_name": "net check GmbH",
      "company_seat": "Berlin",
      "details": "06.08.2025 (Bekanntmachungsdatum)\n\nBerlin Amtsgericht Berlin (Charlottenburg) HRB 73708\nRegisterbekanntmachung nach dem Umwandlungsgesetz 04.08.2025 (Eintragungsdatum)\n\nnet check GmbH\nGesellschaft mit beschränkter Haftung\nBerlin\n\nZu Eintragungsnummer 7 vom 04.08.2025 wird als nicht eingetragen veröffentlicht: Den Gläubigern der an der Verschmelzung beteiligten Rechtsträger ist, wenn sie binnen sechs Monaten nach dem Tag, an dem die Eintragung der Verschmelzung in das Register des Sitzes desjenigen Rechtsträgers, dessen Gläubiger sie sind, als bekannt gemacht gilt, ihren Anspruch nach Grund und Höhe schriftlich anmelden, Sicherheit zu leisten, soweit sie nicht Befriedigung verlangen können. Dieses Recht steht den Gläubigern jedoch nur zu, wenn sie glaubhaft machen, dass durch die Verschmelzung die Erfüllung ihrer Forderung gefährdet wird. Das Recht, Sicherheitsleistung zu verlangen, steht Gläubigern nicht zu, die im Falle der Insolvenz ein Recht auf vorzugsweise Befriedigung aus einer Deckungsmasse haben, die nach gesetzlicher Vorschrift zu ihrem Schutz errichtet und staatlich überwacht ist."
    },
    {
      "date": "2025-08-06",
      "id": "119511",
      "original_text": "Registerbekanntmachung nach dem Umwandlungsgesetz\nBaden-Württemberg Amtsgericht Stuttgart HRA 742093\nM. KAPPEL Entsorgungs GmbH & Co. KG – Fellbach",
      "type": "Registerbekanntmachung nach dem Umwandlungsgesetz",
      "state": "Baden-Württemberg",
      "amtsgericht": "Amtsgericht Stuttgart",
      "registernummer": "HRA 742093",
      "registerart": "HRA",
      "company_name": "M. KAPPEL Entsorgungs GmbH & Co. KG",
      "company_seat": "Fellbach",
      "details": "06.08.2025 (Bekanntmachungsdatum)\n\nBaden-Württemberg Amtsgericht Stuttgart HRA 742093\nRegisterbekanntmachung nach dem Umwandlungsgesetz 06.08.2025 (Eintragungsdatum)\n\nM. KAPPEL Entsorgungs GmbH & Co. KG\nKommanditgesellschaft\nFellbach\n\nAls nicht eingetragen wird bekanntgemacht:\nDen Gläubigern der an der Ausgliederung beteiligten Rechtsträger ist, wenn sie binnen sechs Monaten nach dem Tag, an dem die Eintragung der Ausgliederung in das Register des Sitzes desjenigen Rechtsträgers, dessen Gläubiger sie sind, nach § 19 Abs. 3 UmwG als bekanntgemacht gilt, ihren Anspruch nach Grund und Höhe schriftlich anmelden, Sicherheit zu leisten, soweit sie nicht Befriedigung verlangen können. Dieses Recht steht den Gläubigern jedoch nur zu, wenn sie glaubhaft machen, dass durch die Ausgliederung die Erfüllung ihrer Forderung gefährdet wird."
    },
    {
      "date": "2025-08-06",
      "id": "119512",
      "original_text": "Einreichung neuer Dokumente\nSachsen-Anhalt Amtsgericht Stendal HRB 13786\nJeßnitzer Wohnungsgesellschaft mbH – Raguhn-Jeßnitz",
      "type": "Einreichung neuer Dokumente",
      "state": "Sachsen-Anhalt",
      "amtsgericht": "Amtsgericht Stendal",
      "registernummer": "HRB 13786",
      "registerart": "HRB",
      "company_name": "Jeßnitzer Wohnungsgesellschaft mbH",
      "company_seat": "Raguhn-Jeßnitz",
      "details": "06.08.2025 (Bekanntmachungsdatum)\n\nSachsen-Anhalt Amtsgericht Stendal HRB 13786\nEinreichung neuer Dokumente\n\nJeßnitzer Wohnungsgesellschaft mbH\nGesellschaft mit beschränkter Haftung\nRaguhn-Jeßnitz\n\nEine Liste der Mitglieder des Aufsichtsrates wurde zum Handelsregister eingereicht."
    },
    {
      "date": "2025-08-06",
      "id": "119513",
      "original_text": "Registerbekanntmachung nach dem Umwandlungsgesetz\nBaden-Württemberg Amtsgericht Freiburg HRA 709121\nHotel 3 Könige Familie Echle OHG – Oberwolfach",
      "type": "Registerbekanntmachung nach dem Umwandlungsgesetz",
      "state": "Baden-Württemberg",
      "amtsgericht": "Amtsgericht Freiburg",
      "registernummer": "HRA 709121",
      "registerart": "HRA",
      "company_name": "Hotel 3 Könige Familie Echle OHG",
      "company_seat": "Oberwolfach",
      "details": "06.08.2025 (Bekanntmachungsdatum)\n\nBaden-Württemberg Amtsgericht Freiburg HRA 709121\nRegisterbekanntmachung nach dem Umwandlungsgesetz 06.08.2025 (Eintragungsdatum)\n\nHotel 3 Könige Familie Echle OHG\nOffene Handelsgesellschaft\nOberwolfach\n\nAls nicht eingetragen wird bekanntgemacht:\nDen Gläubigern der an der Ausgliederung beteiligten Rechtsträger ist, wenn sie binnen sechs Monaten nach dem Tag, an dem die Eintragung der Ausgliederung in das Register des Sitzes desjenigen Rechtsträgers, dessen Gläubiger sie sind, nach § 19 Abs. 3 UmwG als bekanntgemacht gilt, ihren Anspruch nach Grund und Höhe schriftlich anmelden, Sicherheit zu leisten, soweit sie nicht Befriedigung verlangen können. Dieses Recht steht den Gläubigern jedoch nur zu, wenn sie glaubhaft machen, dass durch die Ausgliederung die Erfüllung ihrer Forderung gefährdet wird."
    },
    {
      "date": "2025-08-06",
      "id": "119514",
      "original_text": "Registerbekanntmachung nach dem Umwandlungsgesetz\nBaden-Württemberg Amtsgericht Freiburg HRA 709119\nHotel 3 Könige, Inhaber Eduard Echle e.K. – Oberwolfach",
      "type": "Registerbekanntmachung nach dem Umwandlungsgesetz",
      "state": "Baden-Württemberg",
      "amtsgericht": "Amtsgericht Freiburg",
      "registernummer": "HRA 709119",
      "registerart": "HRA",
      "company_name": "Hotel 3 Könige, Inhaber Eduard Echle e.K.",
      "company_seat": "Oberwolfach",
      "details": "06.08.2025 (Bekanntmachungsdatum)\n\nBaden-Württemberg Amtsgericht Freiburg HRA 709119\nRegisterbekanntmachung nach dem Umwandlungsgesetz 06.08.2025 (Eintragungsdatum)\n\nHotel 3 Könige, Inhaber Eduard Echle e.K.\nEinzelkaufmann / Einzelkauffrau\nOberwolfach\n\nAls nicht eingetragen wird bekanntgemacht:\nDen Gläubigern der an der Ausgliederung beteiligten Rechtsträger ist, wenn sie binnen sechs Monaten nach dem Tag, an dem die Eintragung der Ausgliederung in das Register des Sitzes desjenigen Rechtsträgers, dessen Gläubiger sie sind, nach § 19 Abs. 3 UmwG als bekanntgemacht gilt, ihren Anspruch nach Grund und Höhe schriftlich anmelden, Sicherheit zu leisten, soweit sie nicht Befriedigung verlangen können. Dieses Recht steht den Gläubigern jedoch nur zu, wenn sie glaubhaft machen, dass durch die Ausgliederung die Erfüllung ihrer Forderung gefährdet wird."
    },
    {
      "date": "2025-08-06",
      "id": "119515",
      "original_text": "Löschungsankündigung\nBerlin Amtsgericht Berlin (Charlottenburg) HRB 170365\nCARO Bausysteme GmbH – Berlin",
      "type": "Löschungsankündigung",
      "state": "Berlin",
      "amtsgericht": "Amtsgericht Berlin (Charlottenburg)",
      "registernummer": "HRB 170365",
      "registerart": "HRB",
      "company_name": "CARO Bausysteme GmbH",
      "company_seat": "Berlin",
      "details": "06.08.2025 (Bekanntmachungsdatum)\n\nBerlin Amtsgericht Berlin (Charlottenburg) HRB 170365\nLöschungsankündigung\n\nCARO Bausysteme GmbH\nGesellschaft mit beschränkter Haftung\nBerlin\n\nBei der nachstehenden Gesellschaft wird das Amtslöschungsverfahren gemäß § 394 FamFG eingeleitet. Widerspruchsfrist 6 Wochen"
    },
    {
      "date": "2025-08-06",
      "id": "119516",
      "original_text": "Registerbekanntmachung nach dem Umwandlungsgesetz\nBaden-Württemberg Amtsgericht Ulm HRB 720409\nGHB Gesellschaft für Handelsbeteiligungen mbH – Langenburg",
      "type": "Registerbekanntmachung nach dem Umwandlungsgesetz",
      "state": "Baden-Württemberg",
      "amtsgericht": "Amtsgericht Ulm",
      "registernummer": "HRB 720409",
      "registerart": "HRB",
      "company_name": "GHB Gesellschaft für Handelsbeteiligungen mbH",
      "company_seat": "Langenburg",
      "details": "06.08.2025 (Bekanntmachungsdatum)\n\nBaden-Württemberg Amtsgericht Ulm HRB 720409\nRegisterbekanntmachung nach dem Umwandlungsgesetz 06.08.2025 (Eintragungsdatum)\n\nGHB Gesellschaft für Handelsbeteiligungen mbH\nGesellschaft mit beschränkter Haftung\nLangenburg\n\nAls nicht eingetragen wird bekanntgemacht:\nDen Gläubigern der an der Verschmelzung beteiligten Rechtsträger ist, wenn sie binnen sechs Monaten nach dem Tag, an dem die Eintragung der Verschmelzung in das Register des Sitzes desjenigen Rechtsträgers, dessen Gläubiger sie sind, nach § 19 Abs. 3 UmwG als bekanntgemacht gilt, ihren Anspruch nach Grund und Höhe schriftlich anmelden, Sicherheit zu leisten, soweit sie nicht Befriedigung verlangen können. Dieses Recht steht den Gläubigern jedoch nur zu, wenn sie glaubhaft machen, dass durch die Verschmelzung die Erfüllung ihrer Forderung gefährdet wird."
    },
    {
      "date": "2025-08-06",
      "id": "119517",
      "original_text": "Registerbekanntmachung nach dem Umwandlungsgesetz\nBaden-Württemberg Amtsgericht Ulm HRB 742794\nRUSTAB-Geschäftsführung GmbH – Langenburg",
      "type": "Registerbekanntmachung nach dem Umwandlungsgesetz",
      "state": "Baden-Württemberg",
      "amtsgericht": "Amtsgericht Ulm",
      "registernummer": "HRB 742794",
      "registerart": "HRB",
      "company_name": "RUSTAB-Geschäftsführung GmbH",
      "company_seat": "Langenburg",
      "details": "06.08.2025 (Bekanntmachungsdatum)\n\nBaden-Württemberg Amtsgericht Ulm HRB 742794\nRegisterbekanntmachung nach dem Umwandlungsgesetz 06.08.2025 (Eintragungsdatum)\n\nRUSTAB-Geschäftsführung GmbH\nGesellschaft mit beschränkter Haftung\nLangenburg\n\nAls nicht eingetragen wird bekanntgemacht:\nDen Gläubigern der an der Verschmelzung beteiligten Rechtsträger ist, wenn sie binnen sechs Monaten nach dem Tag, an dem die Eintragung der Verschmelzung in das Register des Sitzes desjenigen Rechtsträgers, dessen Gläubiger sie sind, nach § 19 Abs. 3 UmwG als bekanntgemacht gilt, ihren Anspruch nach Grund und Höhe schriftlich anmelden, Sicherheit zu leisten, soweit sie nicht Befriedigung verlangen können. Dieses Recht steht den Gläubigern jedoch nur zu, wenn sie glaubhaft machen, dass durch die Verschmelzung die Erfüllung ihrer Forderung gefährdet wird."
    },
    {
      "date": "2025-08-06",
      "id": "119518",
      "original_text": "Sonstige Registerbekanntmachung\nBaden-Württemberg Amtsgericht Freiburg HRB 300761\nAmexPool AG – Buggingen",
      "type": "Sonstige Registerbekanntmachung",
      "state": "Baden-Württemberg",
      "amtsgericht": "Amtsgericht Freiburg",
      "registernummer": "HRB 300761",
      "registerart": "HRB",
      "company_name": "AmexPool AG",
      "company_seat": "Buggingen",
      "details": "06.08.2025 (Bekanntmachungsdatum)\n\nBaden-Württemberg Amtsgericht Freiburg HRB 300761\nSonstige Registerbekanntmachung\n\nAmexPool AG\nAktiengesellschaft\nBuggingen\n\nDie Gesellschaft hat am 24.07.2025 die Liste über die Zusammensetzung des Aufsichtsrats zum Handelsregister eingereicht."
    },
    {
      "date": "2025-08-06",
      "id": "119519",
      "original_text": "Registerbekanntmachung nach dem Umwandlungsgesetz\nHamburg Amtsgericht Hamburg HRB 119276\nGoldbek Verlag GmbH – Hamburg",
      "type": "Registerbekanntmachung nach dem Umwandlungsgesetz",
      "state": "Hamburg",
      "amtsgericht": "Amtsgericht Hamburg",
      "registernummer": "HRB 119276",
      "registerart": "HRB",
      "company_name": "Goldbek Verlag GmbH",
      "company_seat": "Hamburg",
      "details": "06.08.2025 (Bekanntmachungsdatum)\n\nHamburg Amtsgericht Hamburg HRB 119276\nRegisterbekanntmachung nach dem Umwandlungsgesetz 06.08.2025 (Eintragungsdatum)\n\nGoldbek Verlag GmbH\nGesellschaft mit beschränkter Haftung\nHamburg\n\nAls nicht eingetragen wird bekannt gemacht:\nDen Gläubigern der an der Verschmelzung beteiligten Gesellschaften ist, wenn sie binnen sechs Monaten nach dem Tag, an dem die Eintragung der Verschmelzung in das Register des Sitzes desjenigen Rechtsträgers, dessen Gläubiger sie sind, nach § 19 Absatz 3 UmwG als bekannt gemacht gilt, ihren Anspruch nach Grund und Höhe schriftlich anmelden, Sicherheit zu leisten, soweit sie nicht Befriedigung verlangen können. Dieses Recht steht den Gläubigern jedoch nur zu, wenn sie glaubhaft machen, dass durch die Verschmelzung die Erfüllung ihrer Forderung gefährdet wird."
    },
    {
      "date": "2025-08-06",
      "id": "119520",
      "original_text": "Registerbekanntmachung nach dem Umwandlungsgesetz\nHamburg Amtsgericht Hamburg HRB 137855\nPapiernest GmbH – Hamburg",
      "type": "Registerbekanntmachung nach dem Umwandlungsgesetz",
      "state": "Hamburg",
      "amtsgericht": "Amtsgericht Hamburg",
      "registernummer": "HRB 137855",
      "registerart": "HRB",
      "company_name": "Papiernest GmbH",
      "company_seat": "Hamburg",
      "details": "06.08.2025 (Bekanntmachungsdatum)\n\nHamburg Amtsgericht Hamburg HRB 137855\nRegisterbekanntmachung nach dem Umwandlungsgesetz 06.08.2025 (Eintragungsdatum)\n\nPapiernest GmbH\nGesellschaft mit beschränkter Haftung\nHamburg\n\nAls nicht eingetragen wird bekannt gemacht:\nDen Gläubigern der an der Verschmelzung beteiligten Gesellschaften ist, wenn sie binnen sechs Monaten nach dem Tag, an dem die Eintragung der Verschmelzung in das Register des Sitzes desjenigen Rechtsträgers, dessen Gläubiger sie sind, nach § 19 Absatz 3 UmwG als bekannt gemacht gilt, ihren Anspruch nach Grund und Höhe schriftlich anmelden, Sicherheit zu leisten, soweit sie nicht Befriedigung verlangen können. Dieses Recht steht den Gläubigern jedoch nur zu, wenn sie glaubhaft machen, dass durch die Verschmelzung die Erfüllung ihrer Forderung gefährdet wird."
    },
    {
      "date": "2025-08-06",
      "id": "119521",
      "original_text": "Löschungsankündigung\nBrandenburg Amtsgericht Potsdam HRB 37474\nMARKTSCOUT GmbH – Falkensee",
      "type": "Löschungsankündigung",
      "state": "Brandenburg",
      "amtsgericht": "Amtsgericht Potsdam",
      "registernummer": "HRB 37474",
      "registerart": "HRB",
      "company_name": "MARKTSCOUT GmbH",
      "company_seat": "Falkensee",
      "details": "06.08.2025 (Bekanntmachungsdatum)\n\nBrandenburg Amtsgericht Potsdam HRB 37474\nLöschungsankündigung\n\nMARKTSCOUT GmbH\nGesellschaft mit beschränkter Haftung\nFalkensee\n\nBei der nachstehenden Gesellschaft wird das Amtslöschungsverfahren gemäß § 394 FamFG eingeleitet. Widerspruchsfrist: 8 Wochen."
    },
    {
      "date": "2025-08-06",
      "id": "119522",
      "original_text": "Einreichung neuer Dokumente\nBaden-Württemberg Amtsgericht Freiburg HRB 720460\nLEITWERK AG – Appenweier",
      "type": "Einreichung neuer Dokumente",
      "state": "Baden-Württemberg",
      "amtsgericht": "Amtsgericht Freiburg",
      "registernummer": "HRB 720460",
      "registerart": "HRB",
      "company_name": "LEITWERK AG",
      "company_seat": "Appenweier",
      "details": "06.08.2025 (Bekanntmachungsdatum)\n\nBaden-Württemberg Amtsgericht Freiburg HRB 720460\nEinreichung neuer Dokumente 06.08.2025 (Eintragungsdatum)\n\nLEITWERK AG\nAktiengesellschaft\nAppenweier\n\nDie Gesellschaft hat am 05.08.2025 die Liste über die Zusammensetzung des Aufsichtsrats zum Handelsregister eingereicht."
    },
    {
      "date": "2025-08-06",
      "id": "119523",
      "original_text": "Registerbekanntmachung nach dem Umwandlungsgesetz\nBaden-Württemberg Amtsgericht Mannheim HRA 712700\nSiegfried Hallasch Aufzüge GmbH & Co. KG – Bühl",
      "type": "Registerbekanntmachung nach dem Umwandlungsgesetz",
      "state": "Baden-Württemberg",
      "amtsgericht": "Amtsgericht Mannheim",
      "registernummer": "HRA 712700",
      "registerart": "HRA",
      "company_name": "Siegfried Hallasch Aufzüge GmbH & Co. KG",
      "company_seat": "Bühl",
      "details": "06.08.2025 (Bekanntmachungsdatum)\n\nBaden-Württemberg Amtsgericht Mannheim HRA 712700\nRegisterbekanntmachung nach dem Umwandlungsgesetz 06.08.2025 (Eintragungsdatum)\n\nSiegfried Hallasch Aufzüge GmbH & Co. KG\nKommanditgesellschaft\nBühl\n\nAls nicht eingetragen wird bekanntgemacht:\nDen Gläubigern der an der Ausgliederung beteiligten Rechtsträger ist, wenn sie binnen sechs Monaten nach dem Tag, an dem die Eintragung der Ausgliederung in das Register des Sitzes desjenigen Rechtsträgers, dessen Gläubiger sie sind, nach § 19 Abs. 3 UmwG als bekanntgemacht gilt, ihren Anspruch nach Grund und Höhe schriftlich anmelden, Sicherheit zu leisten, soweit sie nicht Befriedigung verlangen können. Dieses Recht steht den Gläubigern jedoch nur zu, wenn sie glaubhaft machen, dass durch die Ausgliederung die Erfüllung ihrer Forderung gefährdet wird."
    },
    {
      "date": "2025-08-06",
      "id": "119524",
      "original_text": "Registerbekanntmachung nach dem Umwandlungsgesetz\nBerlin Amtsgericht Berlin (Charlottenburg) HRA 8554\nGerhard Wenzel Tiefbauunternehmung GmbH & Co. KG – Berlin",
      "type": "Registerbekanntmachung nach dem Umwandlungsgesetz",
      "state": "Berlin",
      "amtsgericht": "Amtsgericht Berlin (Charlottenburg)",
      "registernummer": "HRA 8554",
      "registerart": "HRA",
      "company_name": "Gerhard Wenzel Tiefbauunternehmung GmbH & Co. KG",
      "company_seat": "Berlin",
      "details": "06.08.2025 (Bekanntmachungsdatum)\n\nBerlin Amtsgericht Berlin (Charlottenburg) HRA 8554\nRegisterbekanntmachung nach dem Umwandlungsgesetz 04.08.2025 (Eintragungsdatum)\n\nGerhard Wenzel Tiefbauunternehmung GmbH & Co. KG\nKommanditgesellschaft\nBerlin\n\nZu Eintragungsnummer 9 vom 04.08.2025 wird als nicht eingetragen veröffentlicht: Den Gläubigern der an der Verschmelzung beteiligten Rechtsträger ist, wenn sie binnen sechs Monaten nach dem Tag, an dem die Eintragung der Verschmelzung in das Register des Sitzes desjenigen Rechtsträgers, dessen Gläubiger sie sind, als bekannt gemacht gilt, ihren Anspruch nach Grund und Höhe schriftlich anmelden, Sicherheit zu leisten, soweit sie nicht Befriedigung verlangen können. Dieses Recht steht den Gläubigern jedoch nur zu, wenn sie glaubhaft machen, dass durch die Verschmelzung die Erfüllung ihrer Forderung gefährdet wird. Das Recht, Sicherheitsleistung zu verlangen, steht Gläubigern nicht zu, die im Falle der Insolvenz ein Recht auf vorzugsweise Befriedigung aus einer Deckungsmasse haben, die nach gesetzlicher Vorschrift zu ihrem Schutz errichtet und staatlich überwacht ist."
    },
    {
      "date": "2025-08-06",
      "id": "119525",
      "original_text": "Registerbekanntmachung nach dem Umwandlungsgesetz\nBerlin Amtsgericht Berlin (Charlottenburg) HRB 90731\nCTG BFP AG Steuerberatungsgesellschaft – Berlin",
      "type": "Registerbekanntmachung nach dem Umwandlungsgesetz",
      "state": "Berlin",
      "amtsgericht": "Amtsgericht Berlin (Charlottenburg)",
      "registernummer": "HRB 90731",
      "registerart": "HRB",
      "company_name": "CTG BFP AG Steuerberatungsgesellschaft",
      "company_seat": "Berlin",
      "details": "06.08.2025 (Bekanntmachungsdatum)\n\nBerlin Amtsgericht Berlin (Charlottenburg) HRB 90731\nRegisterbekanntmachung nach dem Umwandlungsgesetz 05.08.2025 (Eintragungsdatum)\n\nCTG BFP AG Steuerberatungsgesellschaft\nAktiengesellschaft\nBerlin\n\nZu Eintragungsnummer 17 vom 05.08.2025 wird als nicht eingetragen veröffentlicht: Den Gläubigern der an der Verschmelzung beteiligten Rechtsträger ist, wenn sie binnen sechs Monaten nach dem Tag, an dem die Eintragung der Verschmelzung in das Register des Sitzes desjenigen Rechtsträgers, dessen Gläubiger sie sind, als bekannt gemacht gilt, ihren Anspruch nach Grund und Höhe schriftlich anmelden, Sicherheit zu leisten, soweit sie nicht Befriedigung verlangen können. Dieses Recht steht den Gläubigern jedoch nur zu, wenn sie glaubhaft machen, dass durch die Verschmelzung die Erfüllung ihrer Forderung gefährdet wird. Das Recht, Sicherheitsleistung zu verlangen, steht Gläubigern nicht zu, die im Falle der Insolvenz ein Recht auf vorzugsweise Befriedigung aus einer Deckungsmasse haben, die nach gesetzlicher Vorschrift zu ihrem Schutz errichtet und staatlich überwacht ist."
    },
    {
      "date": "2025-08-06",
      "id": "119526",
      "original_text": "Registerbekanntmachung nach dem Umwandlungsgesetz\nBerlin Amtsgericht Berlin (Charlottenburg) HRB 52710\nFAKT Tiefbau Ingenieurleistungen GmbH – Berlin",
      "type": "Registerbekanntmachung nach dem Umwandlungsgesetz",
      "state": "Berlin",
      "amtsgericht": "Amtsgericht Berlin (Charlottenburg)",
      "registernummer": "HRB 52710",
      "registerart": "HRB",
      "company_name": "FAKT Tiefbau Ingenieurleistungen GmbH",
      "company_seat": "Berlin",
      "details": "06.08.2025 (Bekanntmachungsdatum)\n\nBerlin Amtsgericht Berlin (Charlottenburg) HRB 52710\nRegisterbekanntmachung nach dem Umwandlungsgesetz 04.08.2025 (Eintragungsdatum)\n\nFAKT Tiefbau Ingenieurleistungen GmbH\nGesellschaft mit beschränkter Haftung\nBerlin\n\nZu Eintragungsnummer 6 vom 04.08.2025 wird als nicht eingetragen veröffentlicht: Den Gläubigern der an der Verschmelzung beteiligten Rechtsträger ist, wenn sie binnen sechs Monaten nach dem Tag, an dem die Eintragung der Verschmelzung in das Register des Sitzes desjenigen Rechtsträgers, dessen Gläubiger sie sind, als bekannt gemacht gilt, ihren Anspruch nach Grund und Höhe schriftlich anmelden, Sicherheit zu leisten, soweit sie nicht Befriedigung verlangen können. Dieses Recht steht den Gläubigern jedoch nur zu, wenn sie glaubhaft machen, dass durch die Verschmelzung die Erfüllung ihrer Forderung gefährdet wird. Das Recht, Sicherheitsleistung zu verlangen, steht Gläubigern nicht zu, die im Falle der Insolvenz ein Recht auf vorzugsweise Befriedigung aus einer Deckungsmasse haben, die nach gesetzlicher Vorschrift zu ihrem Schutz errichtet und staatlich überwacht ist."
    },
    {
      "date": "2025-08-06",
      "id": "119527",
      "original_text": "Registerbekanntmachung nach dem Umwandlungsgesetz\nBaden-Württemberg Amtsgericht Mannheim HRA 708425\nHallasch Aufzüge e.K. – Bühl",
      "type": "Registerbekanntmachung nach dem Umwandlungsgesetz",
      "state": "Baden-Württemberg",
      "amtsgericht": "Amtsgericht Mannheim",
      "registernummer": "HRA 708425",
      "registerart": "HRA",
      "company_name": "Hallasch Aufzüge e.K.",
      "company_seat": "Bühl",
      "details": "06.08.2025 (Bekanntmachungsdatum)\n\nBaden-Württemberg Amtsgericht Mannheim HRA 708425\nRegisterbekanntmachung nach dem Umwandlungsgesetz 06.08.2025 (Eintragungsdatum)\n\nHallasch Aufzüge e.K.\nEinzelkaufmann / Einzelkauffrau\nBühl\n\nAls nicht eingetragen wird bekanntgemacht:\nDen Gläubigern der an der Ausgliederung beteiligten Rechtsträger ist, wenn sie binnen sechs Monaten nach dem Tag, an dem die Eintragung der Ausgliederung in das Register des Sitzes desjenigen Rechtsträgers, dessen Gläubiger sie sind, nach § 19 Abs. 3 UmwG als bekanntgemacht gilt, ihren Anspruch nach Grund und Höhe schriftlich anmelden, Sicherheit zu leisten, soweit sie nicht Befriedigung verlangen können. Dieses Recht steht den Gläubigern jedoch nur zu, wenn sie glaubhaft machen, dass durch die Ausgliederung die Erfüllung ihrer Forderung gefährdet wird."
    },
    {
      "date": "2025-08-06",
      "id": "119528",
      "original_text": "Löschungsankündigung\nBaden-Württemberg Amtsgericht Stuttgart HRB 771336\nSM-Bau GmbH – Deißlingen",
      "type": "Löschungsankündigung",
      "state": "Baden-Württemberg",
      "amtsgericht": "Amtsgericht Stuttgart",
      "registernummer": "HRB 771336",
      "registerart": "HRB",
      "company_name": "SM-Bau GmbH",
      "company_seat": "Deißlingen",
      "details": "06.08.2025 (Bekanntmachungsdatum)\n\nBaden-Württemberg Amtsgericht Stuttgart HRB 771336\nLöschungsankündigung\n\nSM-Bau GmbH\nGesellschaft mit beschränkter Haftung\nDeißlingen\n\nAls nicht eingetragen wird bekanntgemacht:\nDas Gericht beabsichtigt, die Gesellschaft wegen Vermögenslosigkeit im Handelsregister von Amts wegen nach § 394 FamFG zu löschen. Die Frist zur Geltendmachung eines Widerspruchs gegen die beabsichtigte Löschung ist auf zwei Monate ab Veröffentlichung bestimmt."
    },
    {
      "date": "2025-08-06",
      "id": "119529",
      "original_text": "Registerbekanntmachung nach dem Umwandlungsgesetz\nBaden-Württemberg Amtsgericht Stuttgart HRA 742585\nSchott Pumpen und Elektrotechnik e.K. – Leonberg",
      "type": "Registerbekanntmachung nach dem Umwandlungsgesetz",
      "state": "Baden-Württemberg",
      "amtsgericht": "Amtsgericht Stuttgart",
      "registernummer": "HRA 742585",
      "registerart": "HRA",
      "company_name": "Schott Pumpen und Elektrotechnik e.K.",
      "company_seat": "Leonberg",
      "details": "06.08.2025 (Bekanntmachungsdatum)\n\nBaden-Württemberg Amtsgericht Stuttgart HRA 742585\nRegisterbekanntmachung nach dem Umwandlungsgesetz 06.08.2025 (Eintragungsdatum)\n\nSchott Pumpen und Elektrotechnik e.K.\nEinzelkaufmann / Einzelkauffrau\nLeonberg\n\nAls nicht eingetragen wird bekanntgemacht:\nDen Gläubigern der an der Verschmelzung beteiligten Rechtsträger ist, wenn sie binnen sechs Monaten nach dem Tag, an dem die Eintragung der Verschmelzung in das Register des Sitzes desjenigen Rechtsträgers, dessen Gläubiger sie sind, nach § 19 Abs. 3 UmwG als bekanntgemacht gilt, ihren Anspruch nach Grund und Höhe schriftlich anmelden, Sicherheit zu leisten, soweit sie nicht Befriedigung verlangen können. Dieses Recht steht den Gläubigern jedoch nur zu, wenn sie glaubhaft machen, dass durch die Verschmelzung die Erfüllung ihrer Forderung gefährdet wird."
    },
    {
      "date": "2025-08-06",
      "id": "119530",
      "original_text": "Löschungsankündigung\nBerlin Amtsgericht Berlin (Charlottenburg) HRB 166240\nFactory Licensing GmbH – Berlin",
      "type": "Löschungsankündigung",
      "state": "Berlin",
      "amtsgericht": "Amtsgericht Berlin (Charlottenburg)",
      "registernummer": "HRB 166240",
      "registerart": "HRB",
      "company_name": "Factory Licensing GmbH",
      "company_seat": "Berlin",
      "details": "06.08.2025 (Bekanntmachungsdatum)\n\nBerlin Amtsgericht Berlin (Charlottenburg) HRB 166240\nLöschungsankündigung\n\nFactory Licensing GmbH\nGesellschaft mit beschränkter Haftung\nBerlin\n\nBei der nachstehenden Gesellschaft wird das Amtslöschungsverfahren gemäß § 394 FamFG eingeleitet. Widerspruchsfrist 6 Wochen"
    },
    {
      "date": "2025-08-06",
      "id": "119531",
      "original_text": "Registerbekanntmachung nach dem Umwandlungsgesetz\nBerlin Amtsgericht Berlin (Charlottenburg) HRB 271977\nETL CTG Steuerberatungsgesellschaft mbH – Berlin",
      "type": "Registerbekanntmachung nach dem Umwandlungsgesetz",
      "state": "Berlin",
      "amtsgericht": "Amtsgericht Berlin (Charlottenburg)",
      "registernummer": "HRB 271977",
      "registerart": "HRB",
      "company_name": "ETL CTG Steuerberatungsgesellschaft mbH",
      "company_seat": "Berlin",
      "details": "06.08.2025 (Bekanntmachungsdatum)\n\nBerlin Amtsgericht Berlin (Charlottenburg) HRB 271977\nRegisterbekanntmachung nach dem Umwandlungsgesetz 05.08.2025 (Eintragungsdatum)\n\nETL CTG Steuerberatungsgesellschaft mbH\nGesellschaft mit beschränkter Haftung\nBerlin\n\nZu Eintragungsnummer 3 vom 05.08.2025 wird als nicht eingetragen veröffentlicht: Den Gläubigern der an der Verschmelzung beteiligten Rechtsträger ist, wenn sie binnen sechs Monaten nach dem Tag, an dem die Eintragung der Verschmelzung in das Register des Sitzes desjenigen Rechtsträgers, dessen Gläubiger sie sind, als bekannt gemacht gilt, ihren Anspruch nach Grund und Höhe schriftlich anmelden, Sicherheit zu leisten, soweit sie nicht Befriedigung verlangen können. Dieses Recht steht den Gläubigern jedoch nur zu, wenn sie glaubhaft machen, dass durch die Verschmelzung die Erfüllung ihrer Forderung gefährdet wird. Das Recht, Sicherheitsleistung zu verlangen, steht Gläubigern nicht zu, die im Falle der Insolvenz ein Recht auf vorzugsweise Befriedigung aus einer Deckungsmasse haben, die nach gesetzlicher Vorschrift zu ihrem Schutz errichtet und staatlich überwacht ist."
    },
    {
      "date": "2025-08-06",
      "id": "119532",
      "original_text": "Registerbekanntmachung nach dem Umwandlungsgesetz\nBaden-Württemberg Amtsgericht Stuttgart HRB 250977\nSchott GmbH Pumpen und Elektrotechnik – Leonberg",
      "type": "Registerbekanntmachung nach dem Umwandlungsgesetz",
      "state": "Baden-Württemberg",
      "amtsgericht": "Amtsgericht Stuttgart",
      "registernummer": "HRB 250977",
      "registerart": "HRB",
      "company_name": "Schott GmbH Pumpen und Elektrotechnik",
      "company_seat": "Leonberg",
      "details": "06.08.2025 (Bekanntmachungsdatum)\n\nBaden-Württemberg Amtsgericht Stuttgart HRB 250977\nRegisterbekanntmachung nach dem Umwandlungsgesetz 06.08.2025 (Eintragungsdatum)\n\nSchott GmbH Pumpen und Elektrotechnik\nGesellschaft mit beschränkter Haftung\nLeonberg\n\nDen Gläubigern der an der Verschmelzung beteiligten Rechtsträger ist, wenn sie binnen sechs Monaten nach dem Tag, an dem die Eintragung der Verschmelzung in das Register des Sitzes desjenigen Rechtsträgers, dessen Gläubiger sie sind, nach § 19 Abs. 3 UmwG als bekanntgemacht gilt, ihren Anspruch nach Grund und Höhe schriftlich anmelden, Sicherheit zu leisten, soweit sie nicht Befriedigung verlangen können. Dieses Recht steht den Gläubigern jedoch nur zu, wenn sie glaubhaft machen, dass durch die Verschmelzung die Erfüllung ihrer Forderung gefährdet wird."
    },
    {
      "date": "2025-08-06",
      "id": "119533",
      "original_text": "Registerbekanntmachung nach dem Umwandlungsgesetz\nBaden-Württemberg Amtsgericht Stuttgart HRB 211906\nIngenieurbüro Fritz Spieth Beratende Ingenieure GmbH – Esslingen am Neckar",
      "type": "Registerbekanntmachung nach dem Umwandlungsgesetz",
      "state": "Baden-Württemberg",
      "amtsgericht": "Amtsgericht Stuttgart",
      "registernummer": "HRB 211906",
      "registerart": "HRB",
      "company_name": "Ingenieurbüro Fritz Spieth Beratende Ingenieure GmbH",
      "company_seat": "Esslingen am Neckar",
      "details": "06.08.2025 (Bekanntmachungsdatum)\n\nBaden-Württemberg Amtsgericht Stuttgart HRB 211906\nRegisterbekanntmachung nach dem Umwandlungsgesetz 06.08.2025 (Eintragungsdatum)\n\nIngenieurbüro Fritz Spieth Beratende Ingenieure GmbH\nGesellschaft mit beschränkter Haftung\nEsslingen am Neckar\n\nDen Gläubigern der an der Verschmelzung beteiligten Rechtsträger ist, wenn sie binnen sechs Monaten nach dem Tag, an dem die Eintragung der Verschmelzung in das Register des Sitzes desjenigen Rechtsträgers, dessen Gläubiger sie sind, nach § 19 Abs. 3 UmwG als bekanntgemacht gilt, ihren Anspruch nach Grund und Höhe schriftlich anmelden, Sicherheit zu leisten, soweit sie nicht Befriedigung verlangen können. Dieses Recht steht den Gläubigern jedoch nur zu, wenn sie glaubhaft machen, dass durch die Verschmelzung die Erfüllung ihrer Forderung gefährdet wird."
    },
    {
      "date": "2025-08-06",
      "id": "119534",
      "original_text": "Einreichung neuer Dokumente\nBaden-Württemberg Amtsgericht Stuttgart HRB 730623\nDr. Ing. h.c. F. Porsche Aktiengesellschaft – Stuttgart",
      "type": "Einreichung neuer Dokumente",
      "state": "Baden-Württemberg",
      "amtsgericht": "Amtsgericht Stuttgart",
      "registernummer": "HRB 730623",
      "registerart": "HRB",
      "company_name": "Dr. Ing. h.c. F. Porsche Aktiengesellschaft",
      "company_seat": "Stuttgart",
      "details": "06.08.2025 (Bekanntmachungsdatum)\n\nBaden-Württemberg Amtsgericht Stuttgart HRB 730623\nEinreichung neuer Dokumente 06.08.2025 (Eintragungsdatum)\n\nDr. Ing. h.c. F. Porsche Aktiengesellschaft\nAktiengesellschaft\nStuttgart\n\nDie Gesellschaft hat am 04.08.2025 die Liste über die Zusammensetzung des Aufsichtsrats zum Handelsregister eingereicht."
    },
    {
      "date": "2025-08-06",
      "id": "119535",
      "original_text": "Registerbekanntmachung nach dem Umwandlungsgesetz\nSachsen-Anhalt Amtsgericht Stendal HRB 27954\nSven Sternagel GmbH – Klötze",
      "type": "Registerbekanntmachung nach dem Umwandlungsgesetz",
      "state": "Sachsen-Anhalt",
      "amtsgericht": "Amtsgericht Stendal",
      "registernummer": "HRB 27954",
      "registerart": "HRB",
      "company_name": "Sven Sternagel GmbH",
      "company_seat": "Klötze",
      "details": "06.08.2025 (Bekanntmachungsdatum)\n\nSachsen-Anhalt Amtsgericht Stendal HRB 27954\nRegisterbekanntmachung nach dem Umwandlungsgesetz 06.08.2025 (Eintragungsdatum)\n\nSven Sternagel GmbH\nGesellschaft mit beschränkter Haftung\nKlötze\n\nNicht eingetragen:\nDen Gläubigern der an der Verschmelzung beteiligten Rechtsträger ist, wenn sie binnen sechs Monaten nach dem Tag, an dem die Eintragung der Verschmelzung nach § 19 Abs. 3 UmwG als bekanntgemacht gilt, ihren Anspruch nach Grund und Höhe schriftlich anmelden, Sicherheit zu leisten, soweit sie nicht Befriedigung verlangen können. Dieses Recht steht ihnen jedoch nur zu, wenn sie glaubhaft machen, dass durch die Verschmelzung die Erfüllung ihrer Forderung gefährdet wird."
    },
    {
      "date": "2025-08-06",
      "id": "119536",
      "original_text": "Sonstige Registerbekanntmachung\nHamburg Amtsgericht Hamburg HRB 11168\nSTILL Gesellschaft mit beschränkter Haftung – Hamburg",
      "type": "Sonstige Registerbekanntmachung",
      "state": "Hamburg",
      "amtsgericht": "Amtsgericht Hamburg",
      "registernummer": "HRB 11168",
      "registerart": "HRB",
      "company_name": "STILL Gesellschaft mit beschränkter Haftung",
      "company_seat": "Hamburg",
      "details": "06.08.2025 (Bekanntmachungsdatum)\n\nHamburg Amtsgericht Hamburg HRB 11168\nSonstige Registerbekanntmachung\n\nSTILL Gesellschaft mit beschränkter Haftung\nGesellschaft mit beschränkter Haftung\nHamburg\n\nAls nicht eingetragen wird bekannt gemacht: Liste des Aufsichtsrats wurde eingereicht."
    },
    {
      "date": "2025-08-06",
      "id": "119537",
      "original_text": "Sonstige Registerbekanntmachung\nSchleswig-Holstein Amtsgericht Kiel HRB 7550\nRichter BioLogics Management GmbH – Bovenau",
      "type": "Sonstige Registerbekanntmachung",
      "state": "Schleswig-Holstein",
      "amtsgericht": "Amtsgericht Kiel",
      "registernummer": "HRB 7550",
      "registerart": "HRB",
      "company_name": "Richter BioLogics Management GmbH",
      "company_seat": "Bovenau",
      "details": "06.08.2025 (Bekanntmachungsdatum)\n\nSchleswig-Holstein Amtsgericht Kiel HRB 7550\nSonstige Registerbekanntmachung\n\nRichter BioLogics Management GmbH\nGesellschaft mit beschränkter Haftung\nBovenau\n\nAls nicht eingetragen wird veröffentlicht: Den Gläubigern der an der Verschmelzung beteiligten Rechtsträger ist, wenn sie binnen sechs Monaten nach dem Tag, an dem die Eintragung der Verschmelzung in das Register des Sitzes desjenigen Rechtsträgers, dessen Gläubiger sie sind, nach § 19 Abs. 3 UmwG bekannt gemacht worden ist, ihren Anspruch nach Grund und Höhe schriftlich anmelden, Sicherheit zu leisten, soweit sie nicht Befriedigung verlangen können. Dieses Recht steht den Gläubigern jedoch nur zu, wenn sie glaubhaft machen, dass durch die Verschmelzung die Erfüllung ihrer Forderung gefährdet wird."
    },
    {
      "date": "2025-08-06",
      "id": "119538",
      "original_text": "Sonstige Registerbekanntmachung\nSachsen-Anhalt Amtsgericht Stendal HRB 202008\nFarbe und Heimtex GmbH – Naumburg",
      "type": "Sonstige Registerbekanntmachung",
      "state": "Sachsen-Anhalt",
      "amtsgericht": "Amtsgericht Stendal",
      "registernummer": "HRB 202008",
      "registerart": "HRB",
      "company_name": "Farbe und Heimtex GmbH",
      "company_seat": "Naumburg",
      "details": "06.08.2025 (Bekanntmachungsdatum)\n\nSachsen-Anhalt Amtsgericht Stendal HRB 202008\nSonstige Registerbekanntmachung\n\nFarbe und Heimtex GmbH\nGesellschaft mit beschränkter Haftung\nNaumburg\n\nHinsichtlich der o.g. im Handelsregister am 30.06.2010 gelöschten Gesellschaft ist beabsichtigt, Frau Rechtsanwältin Nina Haverkamp, Kaiser-Wilhelm-Ring 34, 50672 Köln zur Nachtragsliquidatorin mit  beschränktem Wirkungskreis zu bestellen.\nDer Antrag kann bei berechtigtem Interesse beim Registergericht Stendal eingesehen werden.\nDie Frist zu Einreichung etwaiger Stellungnahmen bzw. Erhebung eines Widerspruchs wird auf 1 Monat festgesetzt."
    },
    {
      "date": "2025-08-06",
      "id": "119539",
      "original_text": "Registerbekanntmachung nach dem Umwandlungsgesetz\nBaden-Württemberg Amtsgericht Stuttgart HRB 17278\nExyte Germany GmbH – Stuttgart",
      "type": "Registerbekanntmachung nach dem Umwandlungsgesetz",
      "state": "Baden-Württemberg",
      "amtsgericht": "Amtsgericht Stuttgart",
      "registernummer": "HRB 17278",
      "registerart": "HRB",
      "company_name": "Exyte Germany GmbH",
      "company_seat": "Stuttgart",
      "details": "06.08.2025 (Bekanntmachungsdatum)\n\nBaden-Württemberg Amtsgericht Stuttgart HRB 17278\nRegisterbekanntmachung nach dem Umwandlungsgesetz 06.08.2025 (Eintragungsdatum)\n\nExyte Germany GmbH\nGesellschaft mit beschränkter Haftung\nStuttgart\n\nAls nicht eingetragen wird bekanntgemacht:\nDen Gläubigern der an der Verschmelzung beteiligten Rechtsträger ist, wenn sie binnen sechs Monaten nach dem Tag, an dem die Eintragung der Verschmelzung in das Register des Sitzes desjenigen Rechtsträgers, dessen Gläubiger sie sind, nach § 19 Abs. 3 UmwG als bekanntgemacht gilt, ihren Anspruch nach Grund und Höhe schriftlich anmelden, Sicherheit zu leisten, soweit sie nicht Befriedigung verlangen können. Dieses Recht steht den Gläubigern jedoch nur zu, wenn sie glaubhaft machen, dass durch die Verschmelzung die Erfüllung ihrer Forderung gefährdet wird."
    },
    {
      "date": "2025-08-06",
      "id": "119540",
      "original_text": "Löschungsankündigung\nBaden-Württemberg Amtsgericht Ulm HRB 740422\nHSB GmbH – Wangen im Allgäu",
      "type": "Löschungsankündigung",
      "state": "Baden-Württemberg",
      "amtsgericht": "Amtsgericht Ulm",
      "registernummer": "HRB 740422",
      "registerart": "HRB",
      "company_name": "HSB GmbH",
      "company_seat": "Wangen im Allgäu",
      "details": "06.08.2025 (Bekanntmachungsdatum)\n\nBaden-Württemberg Amtsgericht Ulm HRB 740422\nLöschungsankündigung\n\nHSB GmbH\nGesellschaft mit beschränkter Haftung\nWangen im Allgäu\n\nDas Gericht beabsichtigt, die Gesellschaft wegen Vermögenslosigkeit im Handelsregister von Amts wegen nach § 394 FamFG zu löschen. Die Frist zur Geltendmachung eines Widerspruchs gegen die beabsichtigte Löschung ist auf  einen Monat ab Veröffentlichung bestimmt."
    },
    {
      "date": "2025-08-06",
      "id": "119541",
      "original_text": "Registerbekanntmachung nach dem Umwandlungsgesetz\nBaden-Württemberg Amtsgericht Stuttgart HRA 726688\nSpectra GmbH & Co. KG – Reutlingen",
      "type": "Registerbekanntmachung nach dem Umwandlungsgesetz",
      "state": "Baden-Württemberg",
      "amtsgericht": "Amtsgericht Stuttgart",
      "registernummer": "HRA 726688",
      "registerart": "HRA",
      "company_name": "Spectra GmbH & Co. KG",
      "company_seat": "Reutlingen",
      "details": "06.08.2025 (Bekanntmachungsdatum)\n\nBaden-Württemberg Amtsgericht Stuttgart HRA 726688\nRegisterbekanntmachung nach dem Umwandlungsgesetz 06.08.2025 (Eintragungsdatum)\n\nSpectra GmbH & Co. KG\nKommanditgesellschaft\nReutlingen\n\nAls nicht eingetragen wird bekanntgemacht:\nDen Gläubigern der an der Verschmelzung beteiligten Rechtsträger ist, wenn sie binnen sechs Monaten nach dem Tag, an dem die Eintragung der Verschmelzung in das Register des Sitzes desjenigen Rechtsträgers, dessen Gläubiger sie sind, nach § 19 Abs. 3 UmwG als bekanntgemacht gilt, ihren Anspruch nach Grund und Höhe schriftlich anmelden, Sicherheit zu leisten, soweit sie nicht Befriedigung verlangen können. Dieses Recht steht den Gläubigern jedoch nur zu, wenn sie glaubhaft machen, dass durch die Verschmelzung die Erfüllung ihrer Forderung gefährdet wird."
    },
    {
      "date": "2025-08-06",
      "id": "119542",
      "original_text": "Registerbekanntmachung nach dem Umwandlungsgesetz\nBaden-Württemberg Amtsgericht Stuttgart HRB 225266\nICPDAS-EUROPE GmbH. – Reutlingen",
      "type": "Registerbekanntmachung nach dem Umwandlungsgesetz",
      "state": "Baden-Württemberg",
      "amtsgericht": "Amtsgericht Stuttgart",
      "registernummer": "HRB 225266",
      "registerart": "HRB",
      "company_name": "ICPDAS-EUROPE GmbH.",
      "company_seat": "Reutlingen",
      "details": "06.08.2025 (Bekanntmachungsdatum)\n\nBaden-Württemberg Amtsgericht Stuttgart HRB 225266\nRegisterbekanntmachung nach dem Umwandlungsgesetz 06.08.2025 (Eintragungsdatum)\n\nICPDAS-EUROPE GmbH.\nGesellschaft mit beschränkter Haftung\nReutlingen\n\nAls nicht eingetragen wird bekanntgemacht:\nDen Gläubigern der an der Verschmelzung beteiligten Rechtsträger ist, wenn sie binnen sechs Monaten nach dem Tag, an dem die Eintragung der Verschmelzung in das Register des Sitzes desjenigen Rechtsträgers, dessen Gläubiger sie sind, nach § 19 Abs. 3 UmwG als bekanntgemacht gilt, ihren Anspruch nach Grund und Höhe schriftlich anmelden, Sicherheit zu leisten, soweit sie nicht Befriedigung verlangen können. Dieses Recht steht den Gläubigern jedoch nur zu, wenn sie glaubhaft machen, dass durch die Verschmelzung die Erfüllung ihrer Forderung gefährdet wird."
    },
    {
      "date": "2025-08-06",
      "id": "119543",
      "original_text": "Registerbekanntmachung nach dem Umwandlungsgesetz\nSachsen-Anhalt Amtsgericht Stendal HRB 23423\nAmadys Telecom Germany GmbH – Kabelsketal",
      "type": "Registerbekanntmachung nach dem Umwandlungsgesetz",
      "state": "Sachsen-Anhalt",
      "amtsgericht": "Amtsgericht Stendal",
      "registernummer": "HRB 23423",
      "registerart": "HRB",
      "company_name": "Amadys Telecom Germany GmbH",
      "company_seat": "Kabelsketal",
      "details": "06.08.2025 (Bekanntmachungsdatum)\n\nSachsen-Anhalt Amtsgericht Stendal HRB 23423\nRegisterbekanntmachung nach dem Umwandlungsgesetz 06.08.2025 (Eintragungsdatum)\n\nAmadys Telecom Germany GmbH\nGesellschaft mit beschränkter Haftung\nKabelsketal\n\nDie TSO GmbH mit dem Sitz in Schalksmühle (Amtsgericht Iserlohn HRB 9200) ist auf Grund des Verschmelzungsvertrages vom 30.06.2025 und der Beschlüsse der Gesellschafterversammlungen vom selben Tag mit der Gesellschaft verschmolzen. Nicht eingetragen:Den Gläubigern der an der Verschmelzung beteiligten Rechtsträger ist, wenn sie binnen sechs Monaten nach dem Tag, an dem die Eintragung der Verschmelzung nach § 19 Abs. 3 UmwG als bekanntgemacht gilt, ihren Anspruch nach Grund und Höhe schriftlich anmelden, Sicherheit zu leisten, soweit sie nicht Befriedigung verlangen können. Dieses Recht steht ihnen jedoch nur zu, wenn sie glaubhaft machen, dass durch die Verschmelzung die Erfüllung ihrer Forderung gefährdet wird."
    },
    {
      "date": "2025-08-06",
      "id": "119544",
      "original_text": "Registerbekanntmachung nach dem Umwandlungsgesetz\nBaden-Württemberg Amtsgericht Stuttgart HRB 9830\nRodenbach & Partner Immobilien-Vermittlungs-GmbH – Stuttgart",
      "type": "Registerbekanntmachung nach dem Umwandlungsgesetz",
      "state": "Baden-Württemberg",
      "amtsgericht": "Amtsgericht Stuttgart",
      "registernummer": "HRB 9830",
      "registerart": "HRB",
      "company_name": "Rodenbach & Partner Immobilien-Vermittlungs-GmbH",
      "company_seat": "Stuttgart",
      "details": "06.08.2025 (Bekanntmachungsdatum)\n\nBaden-Württemberg Amtsgericht Stuttgart HRB 9830\nRegisterbekanntmachung nach dem Umwandlungsgesetz 06.08.2025 (Eintragungsdatum)\n\nRodenbach & Partner Immobilien-Vermittlungs-GmbH\nGesellschaft mit beschränkter Haftung\nStuttgart\n\nAls nicht eingetragen wird bekanntgemacht:\nDen Gläubigern der an der Verschmelzung beteiligten Rechtsträger ist, wenn sie binnen sechs Monaten nach dem Tag, an dem die Eintragung der Verschmelzung in das Register des Sitzes desjenigen Rechtsträgers, dessen Gläubiger sie sind, nach § 19 Abs. 3 UmwG als bekanntgemacht gilt, ihren Anspruch nach Grund und Höhe schriftlich anmelden, Sicherheit zu leisten, soweit sie nicht Befriedigung verlangen können. Dieses Recht steht den Gläubigern jedoch nur zu, wenn sie glaubhaft machen, dass durch die Verschmelzung die Erfüllung ihrer Forderung gefährdet wird."
    },
    {
      "date": "2025-08-06",
      "id": "119545",
      "original_text": "Registerbekanntmachung nach dem Umwandlungsgesetz\nBaden-Württemberg Amtsgericht Mannheim HRB 715993\nInternational Plating Project GmbH – Pforzheim",
      "type": "Registerbekanntmachung nach dem Umwandlungsgesetz",
      "state": "Baden-Württemberg",
      "amtsgericht": "Amtsgericht Mannheim",
      "registernummer": "HRB 715993",
      "registerart": "HRB",
      "company_name": "International Plating Project GmbH",
      "company_seat": "Pforzheim",
      "details": "06.08.2025 (Bekanntmachungsdatum)\n\nBaden-Württemberg Amtsgericht Mannheim HRB 715993\nRegisterbekanntmachung nach dem Umwandlungsgesetz 06.08.2025 (Eintragungsdatum)\n\nInternational Plating Project GmbH\nGesellschaft mit beschränkter Haftung\nPforzheim\n\nAls nicht eingetragen wird bekanntgemacht:\nDen Gläubigern der an der Verschmelzung beteiligten Rechtsträger ist, wenn sie binnen sechs Monaten nach dem Tag, an dem die Eintragung der Verschmelzung in das Register des Sitzes desjenigen Rechtsträgers, dessen Gläubiger sie sind, nach § 19 Abs. 3 UmwG als bekanntgemacht gilt, ihren Anspruch nach Grund und Höhe schriftlich anmelden, Sicherheit zu leisten, soweit sie nicht Befriedigung verlangen können. Dieses Recht steht den Gläubigern jedoch nur zu, wenn sie glaubhaft machen, dass durch die Verschmelzung die Erfüllung ihrer Forderung gefährdet wird."
    },
    {
      "date": "2025-08-06",
      "id": "119546",
      "original_text": "Registerbekanntmachung nach dem Umwandlungsgesetz\nBrandenburg Amtsgericht Neuruppin HRA 3934\nFischer Turm OHG – Schwedt/Oder",
      "type": "Registerbekanntmachung nach dem Umwandlungsgesetz",
      "state": "Brandenburg",
      "amtsgericht": "Amtsgericht Neuruppin",
      "registernummer": "HRA 3934",
      "registerart": "HRA",
      "company_name": "Fischer Turm OHG",
      "company_seat": "Schwedt/Oder",
      "details": "06.08.2025 (Bekanntmachungsdatum)\n\nBrandenburg Amtsgericht Neuruppin HRA 3934\nRegisterbekanntmachung nach dem Umwandlungsgesetz 06.08.2025 (Eintragungsdatum)\n\nFischer Turm OHG\nOffene Handelsgesellschaft\nSchwedt/Oder\n\nZu Eintragungsnummer 2 vom 06.08.2025 wird als nicht eingetragen veröffentlicht:\n\nDen Gläubigern der an der Umwandlung beteiligten Rechtsträger ist, wenn sie binnen sechs Monaten nach dem Tag, an dem die Eintragung der Umwandlung in das Register des Sitzes desjenigen Rechtsträgers, dessen Gläubiger sie sind, als bekannt gemacht gilt, ihren Anspruch nach Grund und Höhe schriftlich anmelden, Sicherheit zu leisten, soweit sie nicht Befriedigung verlangen können. Dieses Recht steht den Gläubigern jedoch nur zu, wenn sie glaubhaft machen, dass durch die Umwandlung die Erfüllung ihrer Forderung gefährdet wird"
    },
    {
      "date": "2025-08-06",
      "id": "119547",
      "original_text": "Sonstige Registerbekanntmachung\nBerlin Amtsgericht Berlin (Charlottenburg) HRB 87403\nImmProjekt GmbH – Berlin",
      "type": "Sonstige Registerbekanntmachung",
      "state": "Berlin",
      "amtsgericht": "Amtsgericht Berlin (Charlottenburg)",
      "registernummer": "HRB 87403",
      "registerart": "HRB",
      "company_name": "ImmProjekt GmbH",
      "company_seat": "Berlin",
      "details": "06.08.2025 (Bekanntmachungsdatum)\n\nBerlin Amtsgericht Berlin (Charlottenburg) HRB 87403\nSonstige Registerbekanntmachung\n\nImmProjekt GmbH\nGesellschaft mit beschränkter Haftung\nBerlin\n\nAls nicht eingetragen wird veröffentlicht: Den Gläubigern der an der Verschmelzung beteiligten Rechtsträger ist, wenn sie binnen sechs Monaten nach dem Tag, an dem die Eintragung der Verschmelzung in das Register des Sitzes desjenigen Rechtsträgers, dessen Gläubiger sie sind, als bekannt gemacht gilt, ihren Anspruch nach Grund und Höhe schriftlich anmelden, Sicherheit zu leisten, soweit sie nicht Befriedigung verlangen können. Dieses Recht steht den Gläubigern jedoch nur zu, wenn sie glaubhaft machen, dass durch die Verschmelzung die Erfüllung ihrer Forderung gefährdet wird. Das Recht, Sicherheitsleistung zu verlangen, steht Gläubigern nicht zu, die im Falle der Insolvenz ein Recht auf vorzugsweise Befriedigung aus einer Deckungsmasse haben, die nach gesetzlicher Vorschrift zu ihrem Schutz errichtet und staatlich überwacht ist."
    },
    {
      "date": "2025-08-06",
      "id": "119548",
      "original_text": "Registerbekanntmachung nach dem Umwandlungsgesetz\nBaden-Württemberg Amtsgericht Stuttgart HRB 723326\nSWARCO Traffic Systems GmbH – Unterensingen",
      "type": "Registerbekanntmachung nach dem Umwandlungsgesetz",
      "state": "Baden-Württemberg",
      "amtsgericht": "Amtsgericht Stuttgart",
      "registernummer": "HRB 723326",
      "registerart": "HRB",
      "company_name": "SWARCO Traffic Systems GmbH",
      "company_seat": "Unterensingen",
      "details": "06.08.2025 (Bekanntmachungsdatum)\n\nBaden-Württemberg Amtsgericht Stuttgart HRB 723326\nRegisterbekanntmachung nach dem Umwandlungsgesetz 06.08.2025 (Eintragungsdatum)\n\nSWARCO Traffic Systems GmbH\nGesellschaft mit beschränkter Haftung\nUnterensingen\n\nAls nicht eingetragen wird bekanntgemacht:\nDen Gläubigern der an der Verschmelzung beteiligten Rechtsträger ist, wenn sie binnen sechs Monaten nach dem Tag, an dem die Eintragung der Verschmelzung in das Register des Sitzes desjenigen Rechtsträgers, dessen Gläubiger sie sind, nach § 19 Abs. 3 UmwG als bekanntgemacht gilt, ihren Anspruch nach Grund und Höhe schriftlich anmelden, Sicherheit zu leisten, soweit sie nicht Befriedigung verlangen können. Dieses Recht steht den Gläubigern jedoch nur zu, wenn sie glaubhaft machen, dass durch die Verschmelzung die Erfüllung ihrer Forderung gefährdet wird."
    },
    {
      "date": "2025-08-06",
      "id": "119549",
      "original_text": "Registerbekanntmachung nach dem Umwandlungsgesetz\nBaden-Württemberg Amtsgericht Mannheim HRB 741641\nMassageFee Verwaltungs GmbH – Ubstadt-Weiher",
      "type": "Registerbekanntmachung nach dem Umwandlungsgesetz",
      "state": "Baden-Württemberg",
      "amtsgericht": "Amtsgericht Mannheim",
      "registernummer": "HRB 741641",
      "registerart": "HRB",
      "company_name": "MassageFee Verwaltungs GmbH",
      "company_seat": "Ubstadt-Weiher",
      "details": "06.08.2025 (Bekanntmachungsdatum)\n\nBaden-Württemberg Amtsgericht Mannheim HRB 741641\nRegisterbekanntmachung nach dem Umwandlungsgesetz 06.08.2025 (Eintragungsdatum)\n\nMassageFee Verwaltungs GmbH\nGesellschaft mit beschränkter Haftung\nUbstadt-Weiher\n\nAls nicht eingetragen wird bekanntgemacht: Den Gläubigern der an der Verschmelzung beteiligten Rechtsträger ist, wenn sie binnen sechs Monaten nach dem Tag, an dem die Eintragung der Verschmelzung in das Register des Sitzes desjenigen Rechtsträgers, dessen Gläubiger sie sind, nach § 19 Abs. 3 UmwG als bekanntgemacht gilt, ihren Anspruch nach Grund und Höhe schriftlich anmelden, Sicherheit zu leisten, soweit sie nicht Befriedigung verlangen können. Dieses Recht steht den Gläubigern jedoch nur zu, wenn sie glaubhaft machen, dass durch die Verschmelzung die Erfüllung ihrer Forderung gefährdet wird."
    },
    {
      "date": "2025-08-06",
      "id": "119550",
      "original_text": "Sonstige Registerbekanntmachung\nBerlin Amtsgericht Berlin (Charlottenburg) HRB 123090\nImmProjekt GmbH – Berlin",
      "type": "Sonstige Registerbekanntmachung",
      "state": "Berlin",
      "amtsgericht": "Amtsgericht Berlin (Charlottenburg)",
      "registernummer": "HRB 123090",
      "registerart": "HRB",
      "company_name": "ImmProjekt GmbH",
      "company_seat": "Berlin",
      "details": "06.08.2025 (Bekanntmachungsdatum)\n\nBerlin Amtsgericht Berlin (Charlottenburg) HRB 123090\nSonstige Registerbekanntmachung\n\nImmProjekt GmbH\nGesellschaft mit beschränkter Haftung\nBerlin\n\nAls nicht eingetragen wird veröffentlicht: Den Gläubigern der an der Verschmelzung beteiligten Rechtsträger ist, wenn sie binnen sechs Monaten nach dem Tag, an dem die Eintragung der Verschmelzung in das Register des Sitzes desjenigen Rechtsträgers, dessen Gläubiger sie sind, als bekannt gemacht gilt, ihren Anspruch nach Grund und Höhe schriftlich anmelden, Sicherheit zu leisten, soweit sie nicht Befriedigung verlangen können. Dieses Recht steht den Gläubigern jedoch nur zu, wenn sie glaubhaft machen, dass durch die Verschmelzung die Erfüllung ihrer Forderung gefährdet wird. Das Recht, Sicherheitsleistung zu verlangen, steht Gläubigern nicht zu, die im Falle der Insolvenz ein Recht auf vorzugsweise Befriedigung aus einer Deckungsmasse haben, die nach gesetzlicher Vorschrift zu ihrem Schutz errichtet und staatlich überwacht ist."
    },
    {
      "date": "2025-08-06",
      "id": "119551",
      "original_text": "Registerbekanntmachung nach dem Umwandlungsgesetz\nHamburg Amtsgericht Hamburg HRB 129503\nKottos Beteiligungs GmbH – Hamburg",
      "type": "Registerbekanntmachung nach dem Umwandlungsgesetz",
      "state": "Hamburg",
      "amtsgericht": "Amtsgericht Hamburg",
      "registernummer": "HRB 129503",
      "registerart": "HRB",
      "company_name": "Kottos Beteiligungs GmbH",
      "company_seat": "Hamburg",
      "details": "06.08.2025 (Bekanntmachungsdatum)\n\nHamburg Amtsgericht Hamburg HRB 129503\nRegisterbekanntmachung nach dem Umwandlungsgesetz 06.08.2025 (Eintragungsdatum)\n\nKottos Beteiligungs GmbH\nGesellschaft mit beschränkter Haftung\nHamburg\n\nAls nicht eingetragen wird bekannt gemacht:\nDen Gläubigern der an der Verschmelzung beteiligten Gesellschaften ist, wenn sie binnen sechs Monaten nach dem Tag, an dem die Eintragung der Verschmelzung in das Register des Sitzes desjenigen Rechtsträgers, dessen Gläubiger sie sind, nach § 19 Absatz 3 UmwG als bekannt gemacht gilt, ihren Anspruch nach Grund und Höhe schriftlich anmelden, Sicherheit zu leisten, soweit sie nicht Befriedigung verlangen können. Dieses Recht steht den Gläubigern jedoch nur zu, wenn sie glaubhaft machen, dass durch die Verschmelzung die Erfüllung ihrer Forderung gefährdet wird."
    },
    {
      "date": "2025-08-06",
      "id": "119552",
      "original_text": "Registerbekanntmachung nach dem Umwandlungsgesetz\nBaden-Württemberg Amtsgericht Mannheim HRB 755316\nLenz Energie GmbH – Waibstadt",
      "type": "Registerbekanntmachung nach dem Umwandlungsgesetz",
      "state": "Baden-Württemberg",
      "amtsgericht": "Amtsgericht Mannheim",
      "registernummer": "HRB 755316",
      "registerart": "HRB",
      "company_name": "Lenz Energie GmbH",
      "company_seat": "Waibstadt",
      "details": "06.08.2025 (Bekanntmachungsdatum)\n\nBaden-Württemberg Amtsgericht Mannheim HRB 755316\nRegisterbekanntmachung nach dem Umwandlungsgesetz 06.08.2025 (Eintragungsdatum)\n\nLenz Energie GmbH\nGesellschaft mit beschränkter Haftung\nWaibstadt\n\nAls nicht eingetragen wird bekanntgemacht:\nDen Gläubigern des an dem Formwechsel beteiligten Rechtsträgers ist, wenn sie binnen sechs Monaten nach dem Tag, an dem die Eintragung des Formwechsels in das Register des Sitzes desjenigen Rechtsträgers, dessen Gläubiger sie sind, nach § 19 Abs. 3 UmwG als bekanntgemacht gilt, ihren Anspruch nach Grund und Höhe schriftlich anmelden, Sicherheit zu leisten, soweit sie nicht Befriedigung verlangen können. Dieses Recht steht den Gläubigern jedoch nur zu, wenn sie glaubhaft machen, dass durch den Formwechsel die Erfüllung ihrer Forderung gefährdet wird."
    },
    {
      "date": "2025-08-06",
      "id": "119553",
      "original_text": "Registerbekanntmachung nach dem Umwandlungsgesetz\nBaden-Württemberg Amtsgericht Mannheim HRA 709037\nMassageFee GmbH & Co. KG – Ubstadt-Weiher",
      "type": "Registerbekanntmachung nach dem Umwandlungsgesetz",
      "state": "Baden-Württemberg",
      "amtsgericht": "Amtsgericht Mannheim",
      "registernummer": "HRA 709037",
      "registerart": "HRA",
      "company_name": "MassageFee GmbH & Co. KG",
      "company_seat": "Ubstadt-Weiher",
      "details": "06.08.2025 (Bekanntmachungsdatum)\n\nBaden-Württemberg Amtsgericht Mannheim HRA 709037\nRegisterbekanntmachung nach dem Umwandlungsgesetz 06.08.2025 (Eintragungsdatum)\n\nMassageFee GmbH & Co. KG\nKommanditgesellschaft\nUbstadt-Weiher\n\nDen Gläubigern der an der Verschmelzung beteiligten Rechtsträger ist, wenn sie binnen sechs Monaten nach dem Tag, an dem die Eintragung der Verschmelzung in das Register des Sitzes desjenigen Rechtsträgers, dessen Gläubiger sie sind, nach § 19 Abs. 3 UmwG als bekanntgemacht gilt, ihren Anspruch nach Grund und Höhe schriftlich anmelden, Sicherheit zu leisten, soweit sie nicht Befriedigung verlangen können. Dieses Recht steht den Gläubigern jedoch nur zu, wenn sie glaubhaft machen, dass durch die Verschmelzung die Erfüllung ihrer Forderung gefährdet wird."
    },
    {
      "date": "2025-08-06",
      "id": "119554",
      "original_text": "Registerbekanntmachung nach dem Umwandlungsgesetz\nSaarland Amtsgericht Saarbrücken HRB 13385\nAktivmärkte Hoffmann&Konrad Verwaltungs GmbH – Spiesen-Elversberg",
      "type": "Registerbekanntmachung nach dem Umwandlungsgesetz",
      "state": "Saarland",
      "amtsgericht": "Amtsgericht Saarbrücken",
      "registernummer": "HRB 13385",
      "registerart": "HRB",
      "company_name": "Aktivmärkte Hoffmann&Konrad Verwaltungs GmbH",
      "company_seat": "Spiesen-Elversberg",
      "details": "06.08.2025 (Bekanntmachungsdatum)\n\nSaarland Amtsgericht Saarbrücken HRB 13385\nRegisterbekanntmachung nach dem Umwandlungsgesetz 06.08.2025 (Eintragungsdatum)\n\nAktivmärkte Hoffmann&Konrad Verwaltungs GmbH\nGesellschaft mit beschränkter Haftung\nSpiesen-Elversberg\n\nAls nicht eingetragen wird bekannt gemacht: Den Gläubigern der an der Verschmelzung beteiligten Gesellschaften ist, wenn sie binnen sechs Monaten nach dem Tag, an dem die Eintragung der Verschmelzung in das Register des Sitzes desjenigen Rechtsträgers, dessen Gläubiger sie sind, nach § 19 Absatz 3 UmwG bekannt gemacht worden ist, ihren Anspruch nach Grund und Höhe schriftlich anmelden, Sicherheit zu leisten, soweit sie nicht Befriedigung verlangen können. Dieses Recht steht den Gläubigern jedoch nur zu, wenn sie glaubhaft machen, dass durch die Verschmelzung die Erfüllung ihrer Forderung gefährdet wird."
    },
    {
      "date": "2025-08-06",
      "id": "119555",
      "original_text": "Registerbekanntmachung nach dem Umwandlungsgesetz\nHamburg Amtsgericht Hamburg HRB 136117\nFikensolt GmbH – Hamburg",
      "type": "Registerbekanntmachung nach dem Umwandlungsgesetz",
      "state": "Hamburg",
      "amtsgericht": "Amtsgericht Hamburg",
      "registernummer": "HRB 136117",
      "registerart": "HRB",
      "company_name": "Fikensolt GmbH",
      "company_seat": "Hamburg",
      "details": "06.08.2025 (Bekanntmachungsdatum)\n\nHamburg Amtsgericht Hamburg HRB 136117\nRegisterbekanntmachung nach dem Umwandlungsgesetz 06.08.2025 (Eintragungsdatum)\n\nFikensolt GmbH\nGesellschaft mit beschränkter Haftung\nHamburg\n\nAls nicht eingetragen wird bekannt gemacht:\nDen Gläubigern der an der Abspaltung beteiligten Gesellschaften ist, wenn sie binnen sechs Monaten nach dem Tag, an dem die Eintragung der Abspaltung in das Register des Sitzes desjenigen Rechtsträgers, dessen Gläubiger sie sind, nach § 19 Absatz 3 UmwG als bekannt gemacht gilt, ihren Anspruch nach Grund und Höhe schriftlich anmelden, Sicherheit zu leisten, soweit sie nicht Befriedigung verlangen können. Dieses Recht steht den Gläubigern jedoch nur zu, wenn sie glaubhaft machen, dass durch die Abspaltung die Erfüllung ihrer Forderung gefährdet wird."
    },
    {
      "date": "2025-08-06",
      "id": "119556",
      "original_text": "Löschungsankündigung\nBaden-Württemberg Amtsgericht Ulm HRB 721052\nSchwimmer Zerspanungstechnik Vermietungs- und Beteiligungs GmbH – Essingen",
      "type": "Löschungsankündigung",
      "state": "Baden-Württemberg",
      "amtsgericht": "Amtsgericht Ulm",
      "registernummer": "HRB 721052",
      "registerart": "HRB",
      "company_name": "Schwimmer Zerspanungstechnik Vermietungs- und Beteiligungs GmbH",
      "company_seat": "Essingen",
      "details": "06.08.2025 (Bekanntmachungsdatum)\n\nBaden-Württemberg Amtsgericht Ulm HRB 721052\nLöschungsankündigung\n\nSchwimmer Zerspanungstechnik Vermietungs- und Beteiligungs GmbH\nGesellschaft mit beschränkter Haftung\nEssingen\n\nDas Gericht beabsichtigt, die Gesellschaft wegen Vermögenslosigkeit im Handelsregister von Amts wegen nach § 394 FamFG zu löschen. Die Frist zur Geltendmachung eines Widerspruchs gegen die beabsichtigte Löschung ist auf  einen Monat ab Veröffentlichung bestimmt."
    },
    {
      "date": "2025-08-06",
      "id": "119557",
      "original_text": "Registerbekanntmachung nach dem Umwandlungsgesetz\nBaden-Württemberg Amtsgericht Stuttgart HRB 744264\nEnBW Windkraftprojekte GmbH – Stuttgart",
      "type": "Registerbekanntmachung nach dem Umwandlungsgesetz",
      "state": "Baden-Württemberg",
      "amtsgericht": "Amtsgericht Stuttgart",
      "registernummer": "HRB 744264",
      "registerart": "HRB",
      "company_name": "EnBW Windkraftprojekte GmbH",
      "company_seat": "Stuttgart",
      "details": "06.08.2025 (Bekanntmachungsdatum)\n\nBaden-Württemberg Amtsgericht Stuttgart HRB 744264\nRegisterbekanntmachung nach dem Umwandlungsgesetz 06.08.2025 (Eintragungsdatum)\n\nEnBW Windkraftprojekte GmbH\nGesellschaft mit beschränkter Haftung\nStuttgart\n\nAls nicht eingetragen wird bekanntgemacht:\nDen Gläubigern der an der Verschmelzung beteiligten Rechtsträger ist, wenn sie binnen sechs Monaten nach dem Tag, an dem die Eintragung der Verschmelzung in das Register des Sitzes desjenigen Rechtsträgers, dessen Gläubiger sie sind, nach § 19 Abs. 3 UmwG als bekanntgemacht gilt, ihren Anspruch nach Grund und Höhe schriftlich anmelden, Sicherheit zu leisten, soweit sie nicht Befriedigung verlangen können. Dieses Recht steht den Gläubigern jedoch nur zu, wenn sie glaubhaft machen, dass durch die Verschmelzung die Erfüllung ihrer Forderung gefährdet wird."
    },
    {
      "date": "2025-08-06",
      "id": "119558",
      "original_text": "Registerbekanntmachung nach dem Umwandlungsgesetz\nBaden-Württemberg Amtsgericht Mannheim HRB 341824\nLenz Energie Aktiengesellschaft – Waibstadt",
      "type": "Registerbekanntmachung nach dem Umwandlungsgesetz",
      "state": "Baden-Württemberg",
      "amtsgericht": "Amtsgericht Mannheim",
      "registernummer": "HRB 341824",
      "registerart": "HRB",
      "company_name": "Lenz Energie Aktiengesellschaft",
      "company_seat": "Waibstadt",
      "details": "06.08.2025 (Bekanntmachungsdatum)\n\nBaden-Württemberg Amtsgericht Mannheim HRB 341824\nRegisterbekanntmachung nach dem Umwandlungsgesetz 06.08.2025 (Eintragungsdatum)\n\nLenz Energie Aktiengesellschaft\nAktiengesellschaft\nWaibstadt\n\nAls nicht eingetragen wird bekanntgemacht:\nDen Gläubigern des an dem Formwechsel beteiligten Rechtsträgers ist, wenn sie binnen sechs Monaten nach dem Tag, an dem die Eintragung des Formwechsels in das Register des Sitzes desjenigen Rechtsträgers, dessen Gläubiger sie sind, nach § 19 Abs. 3 UmwG als bekanntgemacht gilt, ihren Anspruch nach Grund und Höhe schriftlich anmelden, Sicherheit zu leisten, soweit sie nicht Befriedigung verlangen können. Dieses Recht steht den Gläubigern jedoch nur zu, wenn sie glaubhaft machen, dass durch den Formwechsel die Erfüllung ihrer Forderung gefährdet wird."
    },
    {
      "date": "2025-08-06",
      "id": "119559",
      "original_text": "Registerbekanntmachung nach dem Umwandlungsgesetz\nSaarland Amtsgericht Saarbrücken HRA 10674\nHoffmann & Konrad OHG – Sulzbach/Saar",
      "type": "Registerbekanntmachung nach dem Umwandlungsgesetz",
      "state": "Saarland",
      "amtsgericht": "Amtsgericht Saarbrücken",
      "registernummer": "HRA 10674",
      "registerart": "HRA",
      "company_name": "Hoffmann & Konrad OHG",
      "company_seat": "Sulzbach/Saar",
      "details": "06.08.2025 (Bekanntmachungsdatum)\n\nSaarland Amtsgericht Saarbrücken HRA 10674\nRegisterbekanntmachung nach dem Umwandlungsgesetz 06.08.2025 (Eintragungsdatum)\n\nHoffmann & Konrad OHG\nOffene Handelsgesellschaft\nSulzbach/Saar\n\nAls nicht eingetragen wird bekannt gemacht: Den Gläubigern der an der Verschmelzung beteiligten Gesellschaften ist, wenn sie binnen sechs Monaten nach dem Tag, an dem die Eintragung der Verschmelzung in das Register des Sitzes desjenigen Rechtsträgers, dessen Gläubiger sie sind, nach § 19 Absatz 3 UmwG bekannt gemacht worden ist, ihren Anspruch nach Grund und Höhe schriftlich anmelden, Sicherheit zu leisten, soweit sie nicht Befriedigung verlangen können. Dieses Recht steht den Gläubigern jedoch nur zu, wenn sie glaubhaft machen, dass durch die Verschmelzung die Erfüllung ihrer Forderung gefährdet wird."
    },
    {
      "date": "2025-08-06",
      "id": "119560",
      "original_text": "Einreichung neuer Dokumente\nThüringen Amtsgericht Jena HRB 209419\nINTERSHOP Communications Aktiengesellschaft – Jena",
      "type": "Einreichung neuer Dokumente",
      "state": "Thüringen",
      "amtsgericht": "Amtsgericht Jena",
      "registernummer": "HRB 209419",
      "registerart": "HRB",
      "company_name": "INTERSHOP Communications Aktiengesellschaft",
      "company_seat": "Jena",
      "details": "06.08.2025 (Bekanntmachungsdatum)\n\nThüringen Amtsgericht Jena HRB 209419\nEinreichung neuer Dokumente 01.08.2025 (Eintragungsdatum)\n\nINTERSHOP Communications Aktiengesellschaft\nAktiengesellschaft\nJena\n\nBekanntmachung gem. § 106 AktG: Aufgrund einer Veränderung in den Personen der Aufsichtsratsmitglieder ist durch den Vorstand eine neue Liste zum Handelsregister eingereicht worden."
    },
    {
      "date": "2025-08-06",
      "id": "119561",
      "original_text": "Löschungsankündigung\nThüringen Amtsgericht Jena HRB 203264\nT I K - Terra Immobilien Kontor GmbH – Gera",
      "type": "Löschungsankündigung",
      "state": "Thüringen",
      "amtsgericht": "Amtsgericht Jena",
      "registernummer": "HRB 203264",
      "registerart": "HRB",
      "company_name": "T I K - Terra Immobilien Kontor GmbH",
      "company_seat": "Gera",
      "details": "06.08.2025 (Bekanntmachungsdatum)\n\nThüringen Amtsgericht Jena HRB 203264\nLöschungsankündigung\n\nT I K - Terra Immobilien Kontor GmbH\nGesellschaft mit beschränkter Haftung\nGera\n\nDas Registergericht beabsichtigt, die im Handelsregister eingetragene Gesellschaft wegen Vermögenslosigkeit nach § 394 FamFG von Amts wegen zu löschen. Die Frist zur Erhebung eines Widerspruchs gegen die beabsichtigte Löschung wird auf 6 Wochen festgesetzt."
    },
    {
      "date": "2025-08-06",
      "id": "119562",
      "original_text": "Einreichung neuer Dokumente\nThüringen Amtsgericht Jena HRB 523059\nOnkoNavi AG – Erfurt",
      "type": "Einreichung neuer Dokumente",
      "state": "Thüringen",
      "amtsgericht": "Amtsgericht Jena",
      "registernummer": "HRB 523059",
      "registerart": "HRB",
      "company_name": "OnkoNavi AG",
      "company_seat": "Erfurt",
      "details": "06.08.2025 (Bekanntmachungsdatum)\n\nThüringen Amtsgericht Jena HRB 523059\nEinreichung neuer Dokumente 06.08.2025 (Eintragungsdatum)\n\nOnkoNavi AG\nAktiengesellschaft\nErfurt\n\nBekanntmachung gem. § 106 AktG: Aufgrund einer Veränderung in den Personen der Aufsichtsratsmitglieder ist durch den Vorstand eine neue Liste zum Handelsregister eingereicht worden."
    },
    {
      "date": "2025-08-06",
      "id": "119563",
      "original_text": "Registerbekanntmachung nach dem Umwandlungsgesetz\nSachsen-Anhalt Amtsgericht Stendal HRB 12344\nLOG ONE GmbH – Lutherstadt Wittenberg",
      "type": "Registerbekanntmachung nach dem Umwandlungsgesetz",
      "state": "Sachsen-Anhalt",
      "amtsgericht": "Amtsgericht Stendal",
      "registernummer": "HRB 12344",
      "registerart": "HRB",
      "company_name": "LOG ONE GmbH",
      "company_seat": "Lutherstadt Wittenberg",
      "details": "06.08.2025 (Bekanntmachungsdatum)\n\nSachsen-Anhalt Amtsgericht Stendal HRB 12344\nRegisterbekanntmachung nach dem Umwandlungsgesetz 06.08.2025 (Eintragungsdatum)\n\nLOG ONE GmbH\nGesellschaft mit beschränkter Haftung\nLutherstadt Wittenberg\n\nNicht eingetragen:\nDen Gläubigern der an der Verschmelzung beteiligten Rechtsträger ist, wenn sie binnen sechs Monaten nach dem Tag, an dem die Eintragung der Verschmelzung nach § 19 Abs. 3 UmwG als bekanntgemacht gilt, ihren Anspruch nach Grund und Höhe schriftlich anmelden, Sicherheit zu leisten, soweit sie nicht Befriedigung verlangen können. Dieses Recht steht ihnen jedoch nur zu, wenn sie glaubhaft machen, dass durch die Verschmelzung die Erfüllung ihrer Forderung gefährdet wird."
    },
    {
      "date": "2025-08-06",
      "id": "119564",
      "original_text": "Löschungsankündigung\nBaden-Württemberg Amtsgericht Freiburg HRB 723231\nCFYB - Care for your body GmbH – Rheinfelden Baden",
      "type": "Löschungsankündigung",
      "state": "Baden-Württemberg",
      "amtsgericht": "Amtsgericht Freiburg",
      "registernummer": "HRB 723231",
      "registerart": "HRB",
      "company_name": "CFYB - Care for your body GmbH",
      "company_seat": "Rheinfelden Baden",
      "details": "06.08.2025 (Bekanntmachungsdatum)\n\nBaden-Württemberg Amtsgericht Freiburg HRB 723231\nLöschungsankündigung\n\nCFYB - Care for your body GmbH\nGesellschaft mit beschränkter Haftung\nRheinfelden Baden\n\nAls nicht eingetragen wird bekanntgemacht:\nDas Gericht beabsichtigt, die Gesellschaft wegen Vermögenslosigkeit im Handelsregister von Amts wegen nach § 394 FamFG zu löschen. Die Frist zur Geltendmachung eines Widerspruchs gegen die beabsichtigte Löschung ist auf einen Monat ab Veröffentlichung bestimmt."
    },
    {
      "date": "2025-08-06",
      "id": "119565",
      "original_text": "Registerbekanntmachung nach dem Umwandlungsgesetz\nBerlin Amtsgericht Berlin (Charlottenburg) HRB 275096\nHypoport Financing GmbH – Berlin",
      "type": "Registerbekanntmachung nach dem Umwandlungsgesetz",
      "state": "Berlin",
      "amtsgericht": "Amtsgericht Berlin (Charlottenburg)",
      "registernummer": "HRB 275096",
      "registerart": "HRB",
      "company_name": "Hypoport Financing GmbH",
      "company_seat": "Berlin",
      "details": "06.08.2025 (Bekanntmachungsdatum)\n\nBerlin Amtsgericht Berlin (Charlottenburg) HRB 275096\nRegisterbekanntmachung nach dem Umwandlungsgesetz 04.08.2025 (Eintragungsdatum)\n\nHypoport Financing GmbH\nGesellschaft mit beschränkter Haftung\nBerlin\n\nZu Eintragungsnummer 2 vom 04.08.2025 wird als nicht eingetragen veröffentlicht: Den Gläubigern ist, wenn sie binnen sechs Monaten nach dem Tag, an dem die Eintragung der Umwandlung als bekannt gemacht gilt, ihren Anspruch nach Grund und Höhe schriftlich anmelden, Sicherheit zu leisten, soweit sie nicht Befriedigung verlangen können. Dieses Recht steht den Gläubigern jedoch nur zu, wenn sie glaubhaft machen, dass durch die Umwandlung die Erfüllung ihrer Forderung gefährdet wird. Das Recht, Sicherheitsleistung zu verlangen, steht Gläubigern nicht zu, die im Falle der Insolvenz ein Recht auf vorzugsweise Befriedigung aus einer Deckungsmasse haben, die nach gesetzlicher Vorschrift zu ihrem Schutz errichtet und staatlich überwacht ist."
    },
    {
      "date": "2025-08-06",
      "id": "119566",
      "original_text": "Löschungsankündigung\nBerlin Amtsgericht Berlin (Charlottenburg) HRB 109678\nUnited Lions Holding GmbH – Berlin",
      "type": "Löschungsankündigung",
      "state": "Berlin",
      "amtsgericht": "Amtsgericht Berlin (Charlottenburg)",
      "registernummer": "HRB 109678",
      "registerart": "HRB",
      "company_name": "United Lions Holding GmbH",
      "company_seat": "Berlin",
      "details": "06.08.2025 (Bekanntmachungsdatum)\n\nBerlin Amtsgericht Berlin (Charlottenburg) HRB 109678\nLöschungsankündigung\n\nUnited Lions Holding GmbH\nGesellschaft mit beschränkter Haftung\nBerlin\n\nBei der nachstehenden Gesellschaft wird das Amtslöschungsverfahren gemäß § 394 FamFG eingeleitet. Widerspruchsfrist 6 Wochen"
    },
    {
      "date": "2025-08-06",
      "id": "119567",
      "original_text": "Registerbekanntmachung nach dem Umwandlungsgesetz\nBaden-Württemberg Amtsgericht Stuttgart HRB 264824\nHS Top Tours GmbH Der Spezialist für Incentive- und Gruppenreisen – Waiblingen",
      "type": "Registerbekanntmachung nach dem Umwandlungsgesetz",
      "state": "Baden-Württemberg",
      "amtsgericht": "Amtsgericht Stuttgart",
      "registernummer": "HRB 264824",
      "registerart": "HRB",
      "company_name": "HS Top Tours GmbH Der Spezialist für Incentive- und Gruppenreisen",
      "company_seat": "Waiblingen",
      "details": "06.08.2025 (Bekanntmachungsdatum)\n\nBaden-Württemberg Amtsgericht Stuttgart HRB 264824\nRegisterbekanntmachung nach dem Umwandlungsgesetz 06.08.2025 (Eintragungsdatum)\n\nHS Top Tours GmbH Der Spezialist für Incentive- und Gruppenreisen\nGesellschaft mit beschränkter Haftung\nWaiblingen\n\nAls nicht eingetragen wird bekanntgemacht:\nDen Gläubigern der an der Verschmelzung beteiligten Rechtsträger ist, wenn sie binnen sechs Monaten nach dem Tag, an dem die Eintragung der Verschmelzung in das Register des Sitzes desjenigen Rechtsträgers, dessen Gläubiger sie sind, nach § 19 Abs. 3 UmwG als bekanntgemacht gilt, ihren Anspruch nach Grund und Höhe schriftlich anmelden, Sicherheit zu leisten, soweit sie nicht Befriedigung verlangen können. Dieses Recht steht den Gläubigern jedoch nur zu, wenn sie glaubhaft machen, dass durch die Verschmelzung die Erfüllung ihrer Forderung gefährdet wird."
    },
    {
      "date": "2025-08-06",
      "id": "119568",
      "original_text": "Registerbekanntmachung nach dem Umwandlungsgesetz\nBerlin Amtsgericht Berlin (Charlottenburg) HRB 209323\n1-2-Better GmbH – Berlin",
      "type": "Registerbekanntmachung nach dem Umwandlungsgesetz",
      "state": "Berlin",
      "amtsgericht": "Amtsgericht Berlin (Charlottenburg)",
      "registernummer": "HRB 209323",
      "registerart": "HRB",
      "company_name": "1-2-Better GmbH",
      "company_seat": "Berlin",
      "details": "06.08.2025 (Bekanntmachungsdatum)\n\nBerlin Amtsgericht Berlin (Charlottenburg) HRB 209323\nRegisterbekanntmachung nach dem Umwandlungsgesetz 06.08.2025 (Eintragungsdatum)\n\n1-2-Better GmbH\nGesellschaft mit beschränkter Haftung\nBerlin\n\nZu Eintragungsnummer 4 vom 06.08.2025 wird als nicht eingetragen veröffentlicht:\n\nDen Gläubigern der an der Verschmelzung beteiligten Rechtsträger ist, wenn sie binnen sechs Monaten nach dem Tag, an dem die Eintragung der Verschmelzung in das Register des Sitzes desjenigen Rechtsträgers, dessen Gläubiger sie sind, als bekannt gemacht gilt, ihren Anspruch nach Grund und Höhe schriftlich anmelden, Sicherheit zu leisten, soweit sie nicht Befriedigung verlangen können. Dieses Recht steht den Gläubigern jedoch nur zu, wenn sie glaubhaft machen, dass durch die Verschmelzung die Erfüllung ihrer Forderung gefährdet wird. Das Recht, Sicherheitsleistung zu verlangen, steht Gläubigern nicht zu, die im Falle der Insolvenz ein Recht auf vorzugsweise Befriedigung aus einer Deckungsmasse haben, die nach gesetzlicher Vorschrift zu ihrem Schutz errichtet und staatlich überwacht ist."
    },
    {
      "date": "2025-08-06",
      "id": "119569",
      "original_text": "Registerbekanntmachung nach dem Umwandlungsgesetz\nBaden-Württemberg Amtsgericht Stuttgart HRB 798003\nFD GmbH – Deizisau",
      "type": "Registerbekanntmachung nach dem Umwandlungsgesetz",
      "state": "Baden-Württemberg",
      "amtsgericht": "Amtsgericht Stuttgart",
      "registernummer": "HRB 798003",
      "registerart": "HRB",
      "company_name": "FD GmbH",
      "company_seat": "Deizisau",
      "details": "06.08.2025 (Bekanntmachungsdatum)\n\nBaden-Württemberg Amtsgericht Stuttgart HRB 798003\nRegisterbekanntmachung nach dem Umwandlungsgesetz 06.08.2025 (Eintragungsdatum)\n\nFD GmbH\nGesellschaft mit beschränkter Haftung\nDeizisau\n\nDen Gläubigern der an der Ausgliederung beteiligten Rechtsträger ist, wenn sie binnen sechs Monaten nach dem Tag, an dem die Eintragung der Ausgliederung in das Register des Sitzes desjenigen Rechtsträgers, dessen Gläubiger sie sind, nach § 19 Abs. 3 UmwG als bekanntgemacht gilt, ihren Anspruch nach Grund und Höhe schriftlich anmelden, Sicherheit zu leisten, soweit sie nicht Befriedigung verlangen können. Dieses Recht steht den Gläubigern jedoch nur zu, wenn sie glaubhaft machen, dass durch die Ausgliederung die Erfüllung ihrer Forderung gefährdet wird."
    },
    {
      "date": "2025-08-06",
      "id": "119570",
      "original_text": "Registerbekanntmachung nach dem Umwandlungsgesetz\nBerlin Amtsgericht Berlin (Charlottenburg) HRB 203939\nBIG PICTURE Venture Capital GmbH – Berlin",
      "type": "Registerbekanntmachung nach dem Umwandlungsgesetz",
      "state": "Berlin",
      "amtsgericht": "Amtsgericht Berlin (Charlottenburg)",
      "registernummer": "HRB 203939",
      "registerart": "HRB",
      "company_name": "BIG PICTURE Venture Capital GmbH",
      "company_seat": "Berlin",
      "details": "06.08.2025 (Bekanntmachungsdatum)\n\nBerlin Amtsgericht Berlin (Charlottenburg) HRB 203939\nRegisterbekanntmachung nach dem Umwandlungsgesetz 06.08.2025 (Eintragungsdatum)\n\nBIG PICTURE Venture Capital GmbH\nGesellschaft mit beschränkter Haftung\nBerlin\n\nZu Eintragungsnummer 3 vom 06.08.2025 wird als nicht eingetragen veröffentlicht:\n\nDen Gläubigern der an der Verschmelzung beteiligten Rechtsträger ist, wenn sie binnen sechs Monaten nach dem Tag, an dem die Eintragung der Verschmelzung in das Register des Sitzes desjenigen Rechtsträgers, dessen Gläubiger sie sind, als bekannt gemacht gilt, ihren Anspruch nach Grund und Höhe schriftlich anmelden, Sicherheit zu leisten, soweit sie nicht Befriedigung verlangen können. Dieses Recht steht den Gläubigern jedoch nur zu, wenn sie glaubhaft machen, dass durch die Verschmelzung die Erfüllung ihrer Forderung gefährdet wird. Das Recht, Sicherheitsleistung zu verlangen, steht Gläubigern nicht zu, die im Falle der Insolvenz ein Recht auf vorzugsweise Befriedigung aus einer Deckungsmasse haben, die nach gesetzlicher Vorschrift zu ihrem Schutz errichtet und staatlich überwacht ist."
    },
    {
      "date": "2025-08-06",
      "id": "119571",
      "original_text": "Registerbekanntmachung nach dem Umwandlungsgesetz\nBaden-Württemberg Amtsgericht Stuttgart HRB 732661\nInduma-Rent GmbH – Stuttgart",
      "type": "Registerbekanntmachung nach dem Umwandlungsgesetz",
      "state": "Baden-Württemberg",
      "amtsgericht": "Amtsgericht Stuttgart",
      "registernummer": "HRB 732661",
      "registerart": "HRB",
      "company_name": "Induma-Rent GmbH",
      "company_seat": "Stuttgart",
      "details": "06.08.2025 (Bekanntmachungsdatum)\n\nBaden-Württemberg Amtsgericht Stuttgart HRB 732661\nRegisterbekanntmachung nach dem Umwandlungsgesetz 06.08.2025 (Eintragungsdatum)\n\nInduma-Rent GmbH\nGesellschaft mit beschränkter Haftung\nStuttgart\n\nAls nicht eingetragen wird bekanntgemacht:\nDen Gläubigern der an der Verschmelzung beteiligten Rechtsträger ist, wenn sie binnen sechs Monaten nach dem Tag, an dem die Eintragung der Verschmelzung in das Register des Sitzes desjenigen Rechtsträgers, dessen Gläubiger sie sind, nach § 19 Abs. 3 UmwG als bekanntgemacht gilt, ihren Anspruch nach Grund und Höhe schriftlich anmelden, Sicherheit zu leisten, soweit sie nicht Befriedigung verlangen können. Dieses Recht steht den Gläubigern jedoch nur zu, wenn sie glaubhaft machen, dass durch die Verschmelzung die Erfüllung ihrer Forderung gefährdet wird."
    },
    {
      "date": "2025-08-06",
      "id": "119572",
      "original_text": "Registerbekanntmachung nach dem Umwandlungsgesetz\nBerlin Amtsgericht Berlin (Charlottenburg) HRB 192897\nesencia GmbH – Berlin",
      "type": "Registerbekanntmachung nach dem Umwandlungsgesetz",
      "state": "Berlin",
      "amtsgericht": "Amtsgericht Berlin (Charlottenburg)",
      "registernummer": "HRB 192897",
      "registerart": "HRB",
      "company_name": "esencia GmbH",
      "company_seat": "Berlin",
      "details": "06.08.2025 (Bekanntmachungsdatum)\n\nBerlin Amtsgericht Berlin (Charlottenburg) HRB 192897\nRegisterbekanntmachung nach dem Umwandlungsgesetz 05.08.2025 (Eintragungsdatum)\n\nesencia GmbH\nGesellschaft mit beschränkter Haftung\nBerlin\n\nZu Eintragungsnummer 2 vom 05.08.2025 wird als nicht eingetragen veröffentlicht:\nDen Gläubigern der an der Verschmelzung beteiligten Rechtsträger ist, wenn sie binnen sechs Monaten nach dem Tag, an dem die Eintragung der Verschmelzung in das Register des Sitzes desjenigen Rechtsträgers, dessen Gläubiger sie sind, als bekannt gemacht gilt, ihren Anspruch nach Grund und Höhe schriftlich anmelden, Sicherheit zu leisten, soweit sie nicht Befriedigung verlangen können. Dieses Recht steht den Gläubigern jedoch nur zu, wenn sie glaubhaft machen, dass durch die Verschmelzung die Erfüllung ihrer Forderung gefährdet wird. Das Recht, Sicherheitsleistung zu verlangen, steht Gläubigern nicht zu, die im Falle der Insolvenz ein Recht auf vorzugsweise Befriedigung aus einer Deckungsmasse haben, die nach gesetzlicher Vorschrift zu ihrem Schutz errichtet und staatlich überwacht ist."
    },
    {
      "date": "2025-08-06",
      "id": "119573",
      "original_text": "Registerbekanntmachung nach dem Umwandlungsgesetz\nBerlin Amtsgericht Berlin (Charlottenburg) HRB 192313\nUlrike Scheuermann GmbH – Berlin",
      "type": "Registerbekanntmachung nach dem Umwandlungsgesetz",
      "state": "Berlin",
      "amtsgericht": "Amtsgericht Berlin (Charlottenburg)",
      "registernummer": "HRB 192313",
      "registerart": "HRB",
      "company_name": "Ulrike Scheuermann GmbH",
      "company_seat": "Berlin",
      "details": "06.08.2025 (Bekanntmachungsdatum)\n\nBerlin Amtsgericht Berlin (Charlottenburg) HRB 192313\nRegisterbekanntmachung nach dem Umwandlungsgesetz 05.08.2025 (Eintragungsdatum)\n\nUlrike Scheuermann GmbH\nGesellschaft mit beschränkter Haftung\nBerlin\n\nZu Eintragungsnummer 3 vom 05.08.2025 wird als nicht eingetragen veröffentlicht:\nDen Gläubigern der an der Verschmelzung beteiligten Rechtsträger ist, wenn sie binnen sechs Monaten nach dem Tag, an dem die Eintragung der Verschmelzung in das Register des Sitzes desjenigen Rechtsträgers, dessen Gläubiger sie sind, als bekannt gemacht gilt, ihren Anspruch nach Grund und Höhe schriftlich anmelden, Sicherheit zu leisten, soweit sie nicht Befriedigung verlangen können. Dieses Recht steht den Gläubigern jedoch nur zu, wenn sie glaubhaft machen, dass durch die Verschmelzung die Erfüllung ihrer Forderung gefährdet wird. Das Recht, Sicherheitsleistung zu verlangen, steht Gläubigern nicht zu, die im Falle der Insolvenz ein Recht auf vorzugsweise Befriedigung aus einer Deckungsmasse haben, die nach gesetzlicher Vorschrift zu ihrem Schutz errichtet und staatlich überwacht ist."
    },
    {
      "date": "2025-08-06",
      "id": "119574",
      "original_text": "Einreichung neuer Dokumente\nBaden-Württemberg Amtsgericht Stuttgart HRB 340975\nKrankenhaus-Service GmbH Schwarzwald – Nagold",
      "type": "Einreichung neuer Dokumente",
      "state": "Baden-Württemberg",
      "amtsgericht": "Amtsgericht Stuttgart",
      "registernummer": "HRB 340975",
      "registerart": "HRB",
      "company_name": "Krankenhaus-Service GmbH Schwarzwald",
      "company_seat": "Nagold",
      "details": "06.08.2025 (Bekanntmachungsdatum)\n\nBaden-Württemberg Amtsgericht Stuttgart HRB 340975\nEinreichung neuer Dokumente\n\nKrankenhaus-Service GmbH Schwarzwald\nGesellschaft mit beschränkter Haftung\nNagold\n\nDie Gesellschaft hat am 04.08.2025 die Liste über die Zusammensetzung des Aufsichtsrats zum Handelsregister eingereicht."
    },
    {
      "date": "2025-08-06",
      "id": "119575",
      "original_text": "Löschungsankündigung\nBrandenburg Amtsgericht Neuruppin HRB 14759\nICA Solution UG (haftungsbeschränkt) – Angermünde",
      "type": "Löschungsankündigung",
      "state": "Brandenburg",
      "amtsgericht": "Amtsgericht Neuruppin",
      "registernummer": "HRB 14759",
      "registerart": "HRB",
      "company_name": "ICA Solution UG (haftungsbeschränkt)",
      "company_seat": "Angermünde",
      "details": "06.08.2025 (Bekanntmachungsdatum)\n\nBrandenburg Amtsgericht Neuruppin HRB 14759\nLöschungsankündigung\n\nICA Solution UG (haftungsbeschränkt)\nGesellschaft mit beschränkter Haftung\nAngermünde\n\nBei der nachstehenden Gesellschaft wird das Amtslöschungsverfahren gemäß § 394 FamFG eingeleitet.\nWiderspruchsfrist: 1 Monat"
    },
    {
      "date": "2025-08-06",
      "id": "119576",
      "original_text": "Registerbekanntmachung nach dem Umwandlungsgesetz\nBaden-Württemberg Amtsgericht Stuttgart HRA 742535\nHKCM Global GmbH & Co. KG – Stuttgart",
      "type": "Registerbekanntmachung nach dem Umwandlungsgesetz",
      "state": "Baden-Württemberg",
      "amtsgericht": "Amtsgericht Stuttgart",
      "registernummer": "HRA 742535",
      "registerart": "HRA",
      "company_name": "HKCM Global GmbH & Co. KG",
      "company_seat": "Stuttgart",
      "details": "06.08.2025 (Bekanntmachungsdatum)\n\nBaden-Württemberg Amtsgericht Stuttgart HRA 742535\nRegisterbekanntmachung nach dem Umwandlungsgesetz 06.08.2025 (Eintragungsdatum)\n\nHKCM Global GmbH & Co. KG\nKommanditgesellschaft\nStuttgart\n\nDen Gläubigern der an der Abspaltung beteiligten Rechtsträger ist, wenn sie binnen sechs Monaten nach dem Tag, an dem die Eintragung der Abspaltung in das Register des Sitzes desjenigen Rechtsträgers, dessen Gläubiger sie sind, nach § 19 Abs. 3 UmwG als bekanntgemacht gilt, ihren Anspruch nach Grund und Höhe schriftlich anmelden, Sicherheit zu leisten, soweit sie nicht Befriedigung verlangen können. Dieses Recht steht den Gläubigern jedoch nur zu, wenn sie glaubhaft machen, dass durch die Abspaltung die Erfüllung ihrer Forderung gefährdet wird."
    },
    {
      "date": "2025-08-06",
      "id": "119577",
      "original_text": "Registerbekanntmachung nach dem Umwandlungsgesetz\nBaden-Württemberg Amtsgericht Stuttgart HRB 759949\nEnBW Windpark Kleinliebringen GmbH – Stuttgart",
      "type": "Registerbekanntmachung nach dem Umwandlungsgesetz",
      "state": "Baden-Württemberg",
      "amtsgericht": "Amtsgericht Stuttgart",
      "registernummer": "HRB 759949",
      "registerart": "HRB",
      "company_name": "EnBW Windpark Kleinliebringen GmbH",
      "company_seat": "Stuttgart",
      "details": "06.08.2025 (Bekanntmachungsdatum)\n\nBaden-Württemberg Amtsgericht Stuttgart HRB 759949\nRegisterbekanntmachung nach dem Umwandlungsgesetz 06.08.2025 (Eintragungsdatum)\n\nEnBW Windpark Kleinliebringen GmbH\nGesellschaft mit beschränkter Haftung\nStuttgart\n\nDen Gläubigern der an der Verschmelzung beteiligten Rechtsträger ist, wenn sie binnen sechs Monaten nach dem Tag, an dem die Eintragung der Verschmelzung in das Register des Sitzes desjenigen Rechtsträgers, dessen Gläubiger sie sind, nach § 19 Abs. 3 UmwG als bekanntgemacht gilt, ihren Anspruch nach Grund und Höhe schriftlich anmelden, Sicherheit zu leisten, soweit sie nicht Befriedigung verlangen können. Dieses Recht steht den Gläubigern jedoch nur zu, wenn sie glaubhaft machen, dass durch die Verschmelzung die Erfüllung ihrer Forderung gefährdet wird."
    },
    {
      "date": "2025-08-06",
      "id": "119578",
      "original_text": "Registerbekanntmachung nach dem Umwandlungsgesetz\nMecklenburg-Vorpommern Amtsgericht Stralsund HRB 2666 früher Amtsgericht Rostock\nIngenieurbüro Voss & Muderack GmbH – Marlow",
      "type": "Registerbekanntmachung nach dem Umwandlungsgesetz",
      "state": "Mecklenburg-Vorpommern",
      "amtsgericht": "Amtsgericht Stralsund",
      "registernummer": "HRB 2666",
      "registerart": "HRB",
      "company_name": "Ingenieurbüro Voss & Muderack GmbH",
      "company_seat": "Marlow",
      "former_amtsgericht": "Rostock",
      "details": "06.08.2025 (Bekanntmachungsdatum)\n\nMecklenburg-Vorpommern Amtsgericht Stralsund HRB 2666 früher Amtsgericht Rostock\nRegisterbekanntmachung nach dem Umwandlungsgesetz 06.08.2025 (Eintragungsdatum)\n\nIngenieurbüro Voss & Muderack GmbH\nGesellschaft mit beschränkter Haftung\nMarlow\n\nAls nicht eingetragen wird veröffentlicht: Den Gläubigern der an der Ausgliederung beteiligten Rechtsträger ist, wenn sie binnen sechs Monaten nach dem Tag, an dem die Eintragung der Ausgliederung in das Register des Sitzes desjenigen Rechtsträgers, dessen Gläubiger sie sind, nach § 19 Abs. 3 UmwG als bekannt gemacht gilt, ihren Anspruch nach Grund und Höhe in Textform anmelden,\nSicherheit zu leisten, soweit sie nicht Befriedigung verlangen können. Dieses Recht steht den Gläubigern jedoch nur zu, wenn sie glaubhaft machen, dass durch die Ausgliederung die Erfüllung der Forderung gefährdet wird."
    },
    {
      "date": "2025-08-06",
      "id": "119579",
      "original_text": "Registerbekanntmachung nach dem Umwandlungsgesetz\nMecklenburg-Vorpommern Amtsgericht Stralsund HRB 22937\nIBVM GmbH – Marlow",
      "type": "Registerbekanntmachung nach dem Umwandlungsgesetz",
      "state": "Mecklenburg-Vorpommern",
      "amtsgericht": "Amtsgericht Stralsund",
      "registernummer": "HRB 22937",
      "registerart": "HRB",
      "company_name": "IBVM GmbH",
      "company_seat": "Marlow",
      "details": "06.08.2025 (Bekanntmachungsdatum)\n\nMecklenburg-Vorpommern Amtsgericht Stralsund HRB 22937\nRegisterbekanntmachung nach dem Umwandlungsgesetz 06.08.2025 (Eintragungsdatum)\n\nIBVM GmbH\nGesellschaft mit beschränkter Haftung\nMarlow\n\nAls nicht eingetragen wird veröffentlicht: Den Gläubigern der an der Ausgliederung beteiligten Rechtsträger ist, wenn sie binnen sechs Monaten nach dem Tag, an dem die Eintragung der Ausgliederung in das Register des Sitzes desjenigen Rechtsträgers, dessen Gläubiger sie sind, nach § 19 Abs. 3 UmwG als bekannt gemacht gilt, ihren Anspruch nach Grund und Höhe in Textform anmelden,\nSicherheit zu leisten, soweit sie nicht Befriedigung verlangen können. Dieses Recht steht den Gläubigern jedoch nur zu, wenn sie glaubhaft machen, dass durch die Ausgliederung die Erfüllung der Forderung gefährdet wird."
    },
    {
      "date": "2025-08-06",
      "id": "119580",
      "original_text": "Löschungsankündigung\nMecklenburg-Vorpommern Amtsgericht Stralsund HRB 8644\nGastmahl am Sund UG (haftungsbeschränkt) – Stralsund",
      "type": "Löschungsankündigung",
      "state": "Mecklenburg-Vorpommern",
      "amtsgericht": "Amtsgericht Stralsund",
      "registernummer": "HRB 8644",
      "registerart": "HRB",
      "company_name": "Gastmahl am Sund UG (haftungsbeschränkt)",
      "company_seat": "Stralsund",
      "details": "06.08.2025 (Bekanntmachungsdatum)\n\nMecklenburg-Vorpommern Amtsgericht Stralsund HRB 8644\nLöschungsankündigung\n\nGastmahl am Sund UG (haftungsbeschränkt)\nGesellschaft mit beschränkter Haftung\nStralsund\n\nDas Registergericht beabsichtigt, die im Handelsregister eingetragene Gesellschaft von Amts wegen nach § 394 FamFG zu löschen. Die Frist zur Erhebung eines Widerspruchs gegen die beabsichtigte Löschung wird auf 1 Monat festgesetzt."
    },
    {
      "date": "2025-08-06",
      "id": "119581",
      "original_text": "Registerbekanntmachung nach dem Umwandlungsgesetz\nBerlin Amtsgericht Berlin (Charlottenburg) HRB 274019\nMähren Holding GmbH – Berlin",
      "type": "Registerbekanntmachung nach dem Umwandlungsgesetz",
      "state": "Berlin",
      "amtsgericht": "Amtsgericht Berlin (Charlottenburg)",
      "registernummer": "HRB 274019",
      "registerart": "HRB",
      "company_name": "Mähren Holding GmbH",
      "company_seat": "Berlin",
      "details": "06.08.2025 (Bekanntmachungsdatum)\n\nBerlin Amtsgericht Berlin (Charlottenburg) HRB 274019\nRegisterbekanntmachung nach dem Umwandlungsgesetz 05.08.2025 (Eintragungsdatum)\n\nMähren Holding GmbH\nGesellschaft mit beschränkter Haftung\nBerlin\n\nZu Eintragungsnummer 2 vom 05.08.2025 wird als nicht eingetragen veröffentlicht: Den Gläubigern der an der Verschmelzung beteiligten Rechtsträger ist, wenn sie binnen sechs Monaten nach dem Tag, an dem die Eintragung der Verschmelzung in das Register des Sitzes desjenigen Rechtsträgers, dessen Gläubiger sie sind, als bekannt gemacht gilt, ihren Anspruch nach Grund und Höhe schriftlich anmelden, Sicherheit zu leisten, soweit sie nicht Befriedigung verlangen können. Dieses Recht steht den Gläubigern jedoch nur zu, wenn sie glaubhaft machen, dass durch die Verschmelzung die Erfüllung ihrer Forderung gefährdet wird. Das Recht, Sicherheitsleistung zu verlangen, steht Gläubigern nicht zu, die im Falle der Insolvenz ein Recht auf vorzugsweise Befriedigung aus einer Deckungsmasse haben, die nach gesetzlicher Vorschrift zu ihrem Schutz errichtet und staatlich überwacht ist."
    },
    {
      "date": "2025-08-06",
      "id": "119582",
      "original_text": "Löschungsankündigung\nMecklenburg-Vorpommern Amtsgericht Stralsund HRB 6100\nHanse Job-Service GmbH – Greifswald",
      "type": "Löschungsankündigung",
      "state": "Mecklenburg-Vorpommern",
      "amtsgericht": "Amtsgericht Stralsund",
      "registernummer": "HRB 6100",
      "registerart": "HRB",
      "company_name": "Hanse Job-Service GmbH",
      "company_seat": "Greifswald",
      "details": "06.08.2025 (Bekanntmachungsdatum)\n\nMecklenburg-Vorpommern Amtsgericht Stralsund HRB 6100\nLöschungsankündigung\n\nHanse Job-Service GmbH\nGesellschaft mit beschränkter Haftung\nGreifswald\n\nDas Registergericht beabsichtigt, die im Handelsregister eingetragene Gesellschaft von Amts wegen nach § 394 FamFG zu löschen. Die Frist zur Erhebung eines Widerspruchs gegen die beabsichtigte Löschung wird auf 1 Monat festgesetzt."
    },
    {
      "date": "2025-08-06",
      "id": "119583",
      "original_text": "Registerbekanntmachung nach dem Umwandlungsgesetz\nBerlin Amtsgericht Berlin (Charlottenburg) HRB 148788\nArea Immobilienmanagement GmbH – Berlin",
      "type": "Registerbekanntmachung nach dem Umwandlungsgesetz",
      "state": "Berlin",
      "amtsgericht": "Amtsgericht Berlin (Charlottenburg)",
      "registernummer": "HRB 148788",
      "registerart": "HRB",
      "company_name": "Area Immobilienmanagement GmbH",
      "company_seat": "Berlin",
      "details": "06.08.2025 (Bekanntmachungsdatum)\n\nBerlin Amtsgericht Berlin (Charlottenburg) HRB 148788\nRegisterbekanntmachung nach dem Umwandlungsgesetz 05.08.2025 (Eintragungsdatum)\n\nArea Immobilienmanagement GmbH\nGesellschaft mit beschränkter Haftung\nBerlin\n\nZu Eintragungsnummer 11 vom 05.08.2025 wird als nicht eingetragen veröffentlicht: Den Gläubigern der an der Verschmelzung beteiligten Rechtsträger ist, wenn sie binnen sechs Monaten nach dem Tag, an dem die Eintragung der Verschmelzung in das Register des Sitzes desjenigen Rechtsträgers, dessen Gläubiger sie sind, als bekannt gemacht gilt, ihren Anspruch nach Grund und Höhe schriftlich anmelden, Sicherheit zu leisten, soweit sie nicht Befriedigung verlangen können. Dieses Recht steht den Gläubigern jedoch nur zu, wenn sie glaubhaft machen, dass durch die Verschmelzung die Erfüllung ihrer Forderung gefährdet wird. Das Recht, Sicherheitsleistung zu verlangen, steht Gläubigern nicht zu, die im Falle der Insolvenz ein Recht auf vorzugsweise Befriedigung aus einer Deckungsmasse haben, die nach gesetzlicher Vorschrift zu ihrem Schutz errichtet und staatlich überwacht ist."
    },
    {
      "date": "2025-08-06",
      "id": "119584",
      "original_text": "Sonstige Registerbekanntmachung\nSchleswig-Holstein Amtsgericht Pinneberg HRB 17942\nAsterix HoldCo AG – Elmshorn",
      "type": "Sonstige Registerbekanntmachung",
      "state": "Schleswig-Holstein",
      "amtsgericht": "Amtsgericht Pinneberg",
      "registernummer": "HRB 17942",
      "registerart": "HRB",
      "company_name": "Asterix HoldCo AG",
      "company_seat": "Elmshorn",
      "details": "06.08.2025 (Bekanntmachungsdatum)\n\nSchleswig-Holstein Amtsgericht Pinneberg HRB 17942\nSonstige Registerbekanntmachung\n\nAsterix HoldCo AG\nAktiengesellschaft\nElmshorn\n\nGemäß § 61 UmwG und Art. 21 der Verordnung (EG) Nr. 2157/2001 des Rates vom 8.10.2001 über das Statut der Europäischen Gesellschaft (SE) wird als nicht eingetragen veröffentlicht:\nEs wird darauf hingewiesen, dass die Asterix HoldCo AG, eine Aktiengesellschaft nach deutschem Recht, mit Sitz in Elmshorn (Deutschland), eingetragen im Handelsregister des Amtsgericht Pinneberg unter HRB 17942 PI, den Entwurf eines Verschmelzungsplans beim Handelsregister des Amtsgerichtes Pinneberg eingereicht hat, wonach die Asterix NewCo S.A., eine Aktiengesellschaft nach luxemburgischen Recht (société anonyme), mit Sitz in Luxemburg (Luxemburg), eingetragen im Handels- und Firmenregister Luxemburgs (Registre de Commerce et des Sociétés, Luxemburg) unter B286011, als übertragende Rechtsträgerin auf die Asterix HoldCo AG als übernehmende Rechtsträgerin verschmolzen werden und die Asterix HoldCo AG dabei die Rechtsform einer Societas Europaea (SE) annehmen soll.\n1. An der Verschmelzung sind beteiligt: 1.1 Als übertragende Gesellschaft die Asterix NewCo S.A., eine Aktiengesellschaft nach luxemburgischen Recht (société anonyme) mit Sitz an der 29, avenue de la Porte-Neuve, L-2227, Luxemburg, Luxemburg. 1.2 Als übernehmende Gesellschaft die Asterix HoldCo AG, eine Aktiengesellschaft nach deutschem Recht mit Sitz in Elmshorn, Deutschland.\n2. Im Hinblick auf die Asterix NewCo S.A. 2.1 Rechtsform, Firma und Sitz der Asterix NewCo S.S. Rechtsform: Aktiengesellschaft nach luxemburgischem Recht (société anonyme) Firma: Asterix NewCo S.A. Sitz: 29, avenue de la Porte-Neuve, L-2227, Luxemburg, Großherzogtum Luxemburg. 2.2 Register, bei dem die in Art. 3 Abs. 2 der Richtlinie 68/151/EWG genannten Urkunden hinterlegt worden sind, sowie die Nummer der Eintragung in das Register Handels- und Firmenregister Luxemburgs (Registre de Commerce et des Sociétés, Luxembourg): B286011. 2.3 Modalitäten für die Ausübung der Rechte der Gläubiger der Asterix NewCo S.A. gemäß Art. 24 SE-VO sowie die Anschrift, unter der erschöpfende Auskünfte über diese Modalitäten kostenlos eingeholt werden können. Gemäß Art. 24 Abs. 1 SE-VO findet zum Schutz der Interessen der Gläubiger der sich verschmelzenden Gesellschaften bei einer Verschmelzung von Aktiengesellschaften unter Berücksichtigung des grenzüberschreitenden Charakters der Verschmelzung das Recht des Mitgliedstaates Anwendung, das jeweils für die sich verschmelzende Gesellschaft gilt. Das somit auf die Asterix NewCo S.A. anzuwendende Recht ist der Gläubigerschutz in Art. 1021-9 des luxemburgischen Gesetzes vom 10. August 1915 über Handelsgesellschaften in seiner jeweils gültigen Fassung (\"Luxembourg Companies Act\"). Nach Art. 1021-9 des Luxembourg Companies Acts haben Gläubiger der Asterix NewCo S.A. ein Recht auf Sicherheitsleistung gegenüber der Asterix NewCo S.A., wenn die folgenden Voraussetzungen gegeben sind: Rechtzeitige Anmeldung: Wenn sich die Gläubiger der Asterix NewCo S.A. innerhalb von zwei Monaten nach Wirksamwerden des Verschmelzungsplans zu diesem Zweck schriftlich anmelden, können sie für die vor diesem Zeitpunkt entstandenen Forderungen angemessene Sicherheit erhalten. Die Verschmelzung wird voraussichtlich am 30. September 2025 wirksam. Gläubiger müssen einen Antrag bei dem Richter stellen, der der Kammer des Bezirksgerichts (tribunal d´arrondissement) für Handelssachen und Eilverfahren (sièganten matière commerciale et comme en matière de référé) vorsitzt, in dessen Bezirk sich der Sitz der Asterix NewCo S.A. befindet und der für Handelssachen und dringende Angelegenheiten zuständig ist. Glaubhaftmachung der Erfüllungsgefährdung: Gläubiger müssen ferner glaubhaft machen, dass durch die Verschmelzung die Befriedigung ihrer Forderung gefährdet wird und dass keine angemessenen Sicherheiten von der Asterix NewCo S.A. geleistet wurden. Kein Recht auf Befriedigung bzw. vorzugsweise Befriedigung: Die Gläubiger haben kein Recht, Sicherheiten zu verlangen, wenn sie bereits über ausreichende Sicherheiten verfügen oder wenn solche Sicherheiten in Anbetracht der finanziellen Lage der Asterix HoldCo SE nach der Verschmelzung nicht erforderlich sind. Anleihegläubiger und Inhaber von mit Sonderrechten ausgestatteten Wertpapieren, außer Aktien: Für Anleihegläubiger der Asterix NewCo S.A. (insbesondere Gläubiger von Wandel-, Options- und Gewinnanleihen) sowie für Inhaber von mit Sonderrechten ausgestatteten Wertpapieren, außer Aktien, gelten ebenfalls die vorstehend beschriebenen Gläubigerschutzrechte. Die Asterix NewCo S.A. hat keine Anleihen oder mit Sonderrechten ausgestattete Wertpapiere begeben. Unter folgender Anschrift können kostenlos erschöpfende Auskünfte über die Modalitäten der Ausübung der Rechte der Gläubiger der Asterix NewCo S.A. eingeholt werden: Asterix NewCo S.A., 29, avenue de la Porte-Neuve, L-2227 Luxemburg, Luxemburg. 2.4 Modalitäten für die Ausübung der Rechte der Minderheitsaktionäre der Asterix NewCo S.A. gemäß Art. 24 SE-VO sowie die Anschrift, unter der erschöpfende Auskünfte über diese Modalitäten kostenlos eingeholt werden können. Die Asterix NewCo S.A. ist eine hundertprozentige Tochtergesellschaft der Asterix HoldCo AG. Deshalb existieren keine Minderheitsaktionäre und ein Barabfindungsangebot entfällt. 2.5 Die für die SE vorgesehene Firma und ihr zukünftiger Sitz Die entstehende SE wird unter \"Asterix HoldCo SE\" firmieren und ihren Sitz in Elmshorn, Deutschland, haben.\n3.Im Hinblick auf die Asterix HoldCo AG 3.1 Rechtsform, Firma und Sitz der Asterix HoldCo AG Rechtsform: Aktiengesellschaft deutschen Rechts Firma: Asterix HoldCo AG Sitz: Elmshorn, Deutschland 3.2 Register, bei dem die in Art. 3 Abs. 2 der Richtlinie 68/151/EWG genannten Urkunden hinterlegt worden sind, sowie die Nummer der Eintragung in das Register Handelsregister des Amtsgerichts Pinneberg, Deutschland, unter HRB 17942 PI 3.3 Modalitäten für die Ausübung der Rechte der Gläubiger der Asterix HoldCo AG gemäß Art. 24 SE-VO sowie die Anschrift, unter der erschöpfende Auskünfte über diese Modalitäten kostenlos eingeholt werden können Gemäß Art. 24 Abs. 1 SE-VO findet zum Schutz der Interessen der Gläubiger der sich verschmelzenden Gesellschaften bei einer Verschmelzung von Aktiengesellschaften unter Berücksichtigung des grenzüberschreitenden Charakters der Verschmelzung das Recht des Mitgliedstaates Anwendung, das jeweils für die sich verschmelzende Gesellschaft gilt. Im somit auf die Asterix HoldCo AG anwendbaren deutschen Recht ist der Gläubigerschutz in § 22 UmwG geregelt. Danach haben Gläubiger der Asterix HoldCo AG gegenüber der Asterix HoldCo SE ein Recht auf Sicherheitsleistung, wenn die folgenden Voraussetzungen gegeben sind: Rechtzeitige Anmeldung: Gläubiger müssen ihren Anspruch binnen sechs Monaten nach dem Tag, an dem die Eintragung der Verschmelzung in das Register des Sitzes der Asterix HoldCo AG nach § 19 Abs. 3 UmwG, § 10 HGB bekanntgemacht worden ist, nach Grund und Höhe schriftlich anzumelden. In der Bekanntmachung der jeweiligen Eintragung sind die Gläubiger auf ihr Recht aus § 22 UmwG hinzuweisen. Glaubhaftmachung der Erfüllungsgefährung: Gläubiger müssen ferner glaubhaft machen, dass durch die Verschmelzung die Erfüllung ihrer Forderung gefährdet wird. Gemäß § 22 Abs. 2 UmwG steht das Recht, Sicherheitsleistung zu verlangen, Gläubigern nicht zu, die im Falle der Insolvenz ein Recht auf vorzugsweise Befriedigung aus eine Deckungsmasse haben, die nach gesetzlichen Vorschriften zu ihrem Schutz errichtet und staatlich überwacht ist. Das Gläubigerschutzrecht in § 22 UmwG i.V.m. Art. 24 Abs. 1 SE-VO ist im Fall einer grenzüberschreitenden Verschmelzung auf die Gläubiger der Asterix HoldCo AG als in Deutschland ansässige Gesellschaft beschränkt. Die Gläubiger der Asterix NewCo S.A. werden durch die Gläubigervorschriften des luxemburgischen Rechts geschützt. Anleihegläubiger und Inhaber von mit Sonderrechten ausgestatteten Wertpapieren, außer Aktien: Für Anleihegläubiger der Asterix HoldCo AG (insbesondere Gläubiger von Wandel-, Options- und Gewinnanleihen) sowie für Inhaber von mit Sonderrechten ausgestatteten Wertpapieren, außer Aktien, gelten ebenfalls die vorstehend beschriebenen Gläubigerschutzrechte. Die Asterix Hold Co AG hat keine Anleihen oder mit Sonderrechten ausgestatteten Wertpapiere begeben. Spezielle Gläubigerschutzrechte nach SEAG: Die speziellen Gläubigerschutzrechte nach den §§ 8, 13 SEAG finden hier keine Anwendung, weil der künftige Sitz der SE aus deutscher Sicht im Inland sein wird. Unter folgender Anschrift können kostenlos erschöpfende Auskünfte über die Modalitäten der Ausübung der Rechte der Gläubiger der Asterix HoldCo AG eingeholt werden: Asterix HoldCo AG, Frau Svenja Wachtel, Werner-von-Siemens-Straße 8, 25337 Elmshorn. 3.4 Modalitäten für die Ausübung der Rechte der Minderheitsaktionäre der Asterix HoldCo AG gemäß Art. 24 SE-VO sowie die Anschrift, unter der erschöpfende Auskünfte über diese Modaltitäten kostenlos eingeholt werden können: Die Asterix HoldCo AG ist eine hundertprozentige Tochtergesellschaft der Asterix Investments S.à.r.l. Deshalb existieren keine Minderheitsaktionäre. 3.5 Die für die SE vorgesehene Firma und ihr zukünftiger Sitz: Die entstehende SE wird unter \"Asterix HoldCo SE\" firmieren und ihren Sitz in Elmshorn, Deutschland, haben."
    },
    {
      "date": "2025-08-06",
      "id": "119585",
      "original_text": "Registerbekanntmachung nach dem Umwandlungsgesetz\nBerlin Amtsgericht Berlin (Charlottenburg) HRB 274019\nMähren Holding GmbH – Berlin",
      "type": "Registerbekanntmachung nach dem Umwandlungsgesetz",
      "state": "Berlin",
      "amtsgericht": "Amtsgericht Berlin (Charlottenburg)",
      "registernummer": "HRB 274019",
      "registerart": "HRB",
      "company_name": "Mähren Holding GmbH",
      "company_seat": "Berlin",
      "details": "06.08.2025 (Bekanntmachungsdatum)\n\nBerlin Amtsgericht Berlin (Charlottenburg) HRB 274019\nRegisterbekanntmachung nach dem Umwandlungsgesetz 05.08.2025 (Eintragungsdatum)\n\nMähren Holding GmbH\nGesellschaft mit beschränkter Haftung\nBerlin\n\nZu Eintragungsnummer 3 vom 05.08.2025 wird als nicht eingetragen veröffentlicht: Den Gläubigern der an der Verschmelzung beteiligten Rechtsträger ist, wenn sie binnen sechs Monaten nach dem Tag, an dem die Eintragung der Verschmelzung in das Register des Sitzes desjenigen Rechtsträgers, dessen Gläubiger sie sind, als bekannt gemacht gilt, ihren Anspruch nach Grund und Höhe schriftlich anmelden, Sicherheit zu leisten, soweit sie nicht Befriedigung verlangen können. Dieses Recht steht den Gläubigern jedoch nur zu, wenn sie glaubhaft machen, dass durch die Verschmelzung die Erfüllung ihrer Forderung gefährdet wird. Das Recht, Sicherheitsleistung zu verlangen, steht Gläubigern nicht zu, die im Falle der Insolvenz ein Recht auf vorzugsweise Befriedigung aus einer Deckungsmasse haben, die nach gesetzlicher Vorschrift zu ihrem Schutz errichtet und staatlich überwacht ist."
    },
    {
      "date": "2025-08-06",
      "id": "119586",
      "original_text": "Registerbekanntmachung nach dem Umwandlungsgesetz\nBerlin Amtsgericht Berlin (Charlottenburg) HRB 268029\nVivest Investment GmbH – Berlin",
      "type": "Registerbekanntmachung nach dem Umwandlungsgesetz",
      "state": "Berlin",
      "amtsgericht": "Amtsgericht Berlin (Charlottenburg)",
      "registernummer": "HRB 268029",
      "registerart": "HRB",
      "company_name": "Vivest Investment GmbH",
      "company_seat": "Berlin",
      "details": "06.08.2025 (Bekanntmachungsdatum)\n\nBerlin Amtsgericht Berlin (Charlottenburg) HRB 268029\nRegisterbekanntmachung nach dem Umwandlungsgesetz 05.08.2025 (Eintragungsdatum)\n\nVivest Investment GmbH\nGesellschaft mit beschränkter Haftung\nBerlin\n\nZu Eintragungsnummer 3 vom 05.08.2025 wird als nicht eingetragen veröffentlicht: Den Gläubigern der an der Verschmelzung beteiligten Rechtsträger ist, wenn sie binnen sechs Monaten nach dem Tag, an dem die Eintragung der Verschmelzung in das Register des Sitzes desjenigen Rechtsträgers, dessen Gläubiger sie sind, als bekannt gemacht gilt, ihren Anspruch nach Grund und Höhe schriftlich anmelden, Sicherheit zu leisten, soweit sie nicht Befriedigung verlangen können. Dieses Recht steht den Gläubigern jedoch nur zu, wenn sie glaubhaft machen, dass durch die Verschmelzung die Erfüllung ihrer Forderung gefährdet wird. Das Recht, Sicherheitsleistung zu verlangen, steht Gläubigern nicht zu, die im Falle der Insolvenz ein Recht auf vorzugsweise Befriedigung aus einer Deckungsmasse haben, die nach gesetzlicher Vorschrift zu ihrem Schutz errichtet und staatlich überwacht ist."
    },
    {
      "date": "2025-08-06",
      "id": "119587",
      "original_text": "Registerbekanntmachung nach dem Umwandlungsgesetz\nBaden-Württemberg Amtsgericht Stuttgart HRB 353147\nTELEMARKT Zentrale Verwaltungs- und Beteiligungsgesellschaft mbH – Reutlingen",
      "type": "Registerbekanntmachung nach dem Umwandlungsgesetz",
      "state": "Baden-Württemberg",
      "amtsgericht": "Amtsgericht Stuttgart",
      "registernummer": "HRB 353147",
      "registerart": "HRB",
      "company_name": "TELEMARKT Zentrale Verwaltungs- und Beteiligungsgesellschaft mbH",
      "company_seat": "Reutlingen",
      "details": "06.08.2025 (Bekanntmachungsdatum)\n\nBaden-Württemberg Amtsgericht Stuttgart HRB 353147\nRegisterbekanntmachung nach dem Umwandlungsgesetz 06.08.2025 (Eintragungsdatum)\n\nTELEMARKT Zentrale Verwaltungs- und Beteiligungsgesellschaft mbH\nGesellschaft mit beschränkter Haftung\nReutlingen\n\nAls nicht eingetragen wird bekanntgemacht:\nDen Gläubigern der an der Verschmelzung beteiligten Rechtsträger ist, wenn sie binnen sechs Monaten nach dem Tag, an dem die Eintragung der Verschmelzung in das Register des Sitzes desjenigen Rechtsträgers, dessen Gläubiger sie sind, nach § 19 Abs. 3 UmwG als bekanntgemacht gilt, ihren Anspruch nach Grund und Höhe schriftlich anmelden, Sicherheit zu leisten, soweit sie nicht Befriedigung verlangen können. Dieses Recht steht den Gläubigern jedoch nur zu, wenn sie glaubhaft machen, dass durch die Verschmelzung die Erfüllung ihrer Forderung gefährdet wird."
    },
    {
      "date": "2025-08-06",
      "id": "119588",
      "original_text": "Einreichung neuer Dokumente\nBaden-Württemberg Amtsgericht Stuttgart HRB 792660\nDeutsche Real Estate Invest AG – Stuttgart",
      "type": "Einreichung neuer Dokumente",
      "state": "Baden-Württemberg",
      "amtsgericht": "Amtsgericht Stuttgart",
      "registernummer": "HRB 792660",
      "registerart": "HRB",
      "company_name": "Deutsche Real Estate Invest AG",
      "company_seat": "Stuttgart",
      "details": "06.08.2025 (Bekanntmachungsdatum)\n\nBaden-Württemberg Amtsgericht Stuttgart HRB 792660\nEinreichung neuer Dokumente\n\nDeutsche Real Estate Invest AG\nAktiengesellschaft\nStuttgart\n\nDie Gesellschaft hat am 01.08.2025 die Liste über die Zusammensetzung des Aufsichtsrats zum Handelsregister eingereicht."
    },
    {
      "date": "2025-08-06",
      "id": "119589",
      "original_text": "Löschungsankündigung\nBaden-Württemberg Amtsgericht Mannheim HRB 726236\nImmo VBV Besitz Verwaltungs UG (haftungsbeschränkt) – Karlsruhe",
      "type": "Löschungsankündigung",
      "state": "Baden-Württemberg",
      "amtsgericht": "Amtsgericht Mannheim",
      "registernummer": "HRB 726236",
      "registerart": "HRB",
      "company_name": "Immo VBV Besitz Verwaltungs UG (haftungsbeschränkt)",
      "company_seat": "Karlsruhe",
      "details": "06.08.2025 (Bekanntmachungsdatum)\n\nBaden-Württemberg Amtsgericht Mannheim HRB 726236\nLöschungsankündigung 06.08.2025 (Eintragungsdatum)\n\nImmo VBV Besitz Verwaltungs UG (haftungsbeschränkt)\nGesellschaft mit beschränkter Haftung\nKarlsruhe\n\nDas Gericht beabsichtigt, die Gesellschaft wegen Vermögenslosigkeit im Handelsregister von Amts wegen nach § 394 FamFG zu löschen. Die Frist zur Geltendmachung eines Widerspruchs gegen die beabsichtigte Löschung ist auf einen Monat ab Veröffentlichung bestimmt."
    },
    {
      "date": "2025-08-06",
      "id": "119590",
      "original_text": "Löschungsankündigung\nBaden-Württemberg Amtsgericht Stuttgart HRB 776472\nCorporate Development GmbH – Stuttgart",
      "type": "Löschungsankündigung",
      "state": "Baden-Württemberg",
      "amtsgericht": "Amtsgericht Stuttgart",
      "registernummer": "HRB 776472",
      "registerart": "HRB",
      "company_name": "Corporate Development GmbH",
      "company_seat": "Stuttgart",
      "details": "06.08.2025 (Bekanntmachungsdatum)\n\nBaden-Württemberg Amtsgericht Stuttgart HRB 776472\nLöschungsankündigung\n\nCorporate Development GmbH\nGesellschaft mit beschränkter Haftung\nStuttgart\n\nAls nicht eingetragen wird bekanntgemacht:\nDas Gericht beabsichtigt, die Gesellschaft wegen Vermögenslosigkeit im Handelsregister von Amts wegen nach § 394 FamFG zu löschen. Die Frist zur Geltendmachung eines Widerspruchs gegen die beabsichtigte Löschung ist auf zwei Monate ab Veröffentlichung bestimmt."
    },
    {
      "date": "2025-08-06",
      "id": "119591",
      "original_text": "Registerbekanntmachung nach dem Umwandlungsgesetz\nSachsen Amtsgericht Dresden HRB 46948\nButze Immobilien GmbH – Pirna",
      "type": "Registerbekanntmachung nach dem Umwandlungsgesetz",
      "state": "Sachsen",
      "amtsgericht": "Amtsgericht Dresden",
      "registernummer": "HRB 46948",
      "registerart": "HRB",
      "company_name": "Butze Immobilien GmbH",
      "company_seat": "Pirna",
      "details": "06.08.2025 (Bekanntmachungsdatum)\n\nSachsen Amtsgericht Dresden HRB 46948\nRegisterbekanntmachung nach dem Umwandlungsgesetz 06.08.2025 (Eintragungsdatum)\n\nButze Immobilien GmbH\nGesellschaft mit beschränkter Haftung\nPirna\n\nDen Gläubigern der an der Ausgliederung beteiligten Rechtsträger ist, wenn sie binnen sechs Monaten nach dem Tag, an dem die Eintragung der Ausgliederung in das Register des Sitzes desjenigen Rechtsträgers, dessen Gläubiger sie sind, nach § 19 Abs. 3 UmwG als bekannt gemacht gilt, ihren Anspruch nach Grund und Höhe in Textform anmelden, Sicherheit zu leisten, soweit sie nicht Befriedigung verlangen können. Dieses Recht steht den Gläubigern jedoch nur zu, wenn sie glaubhaft machen, dass durch die Ausgliederung die Erfüllung der Forderung gefährdet wird."
    },
    {
      "date": "2025-08-06",
      "id": "119592",
      "original_text": "Registerbekanntmachung nach dem Umwandlungsgesetz\nSachsen Amtsgericht Dresden HRA 12299\nPatrick Riedel - Boots + Fahrschule Riedel e. K. – Dresden",
      "type": "Registerbekanntmachung nach dem Umwandlungsgesetz",
      "state": "Sachsen",
      "amtsgericht": "Amtsgericht Dresden",
      "registernummer": "HRA 12299",
      "registerart": "HRA",
      "company_name": "Patrick Riedel - Boots + Fahrschule Riedel e. K.",
      "company_seat": "Dresden",
      "details": "06.08.2025 (Bekanntmachungsdatum)\n\nSachsen Amtsgericht Dresden HRA 12299\nRegisterbekanntmachung nach dem Umwandlungsgesetz 06.08.2025 (Eintragungsdatum)\n\nPatrick Riedel - Boots + Fahrschule Riedel e. K.\nEinzelkaufmann / Einzelkauffrau\nDresden\n\nDen Gläubigern der an der Ausgliederung beteiligten Rechtsträger ist, wenn sie binnen sechs Monaten nach dem Tag, an dem die Eintragung der Ausgliederung in das Register des Sitzes desjenigen Rechtsträgers, dessen Gläubiger sie sind, nach § 19 Abs. 3 UmwG als bekannt gemacht gilt, ihren Anspruch nach Grund und Höhe in Textform anmelden, Sicherheit zu leisten, soweit sie nicht Befriedigung verlangen können. Dieses Recht steht den Gläubigern jedoch nur zu, wenn sie glaubhaft machen, dass durch die Ausgliederung die Erfüllung der Forderung gefährdet wird."
    },
    {
      "date": "2025-08-06",
      "id": "119593",
      "original_text": "Registerbekanntmachung nach dem Umwandlungsgesetz\nSachsen Amtsgericht Dresden HRA 12277\nSven Butze Immobilien/Baudienstleistungen e.K. – Pirna",
      "type": "Registerbekanntmachung nach dem Umwandlungsgesetz",
      "state": "Sachsen",
      "amtsgericht": "Amtsgericht Dresden",
      "registernummer": "HRA 12277",
      "registerart": "HRA",
      "company_name": "Sven Butze Immobilien/Baudienstleistungen e.K.",
      "company_seat": "Pirna",
      "details": "06.08.2025 (Bekanntmachungsdatum)\n\nSachsen Amtsgericht Dresden HRA 12277\nRegisterbekanntmachung nach dem Umwandlungsgesetz 06.08.2025 (Eintragungsdatum)\n\nSven Butze Immobilien/Baudienstleistungen e.K.\nEinzelkaufmann / Einzelkauffrau\nPirna\n\nDen Gläubigern der an der Ausgliederung beteiligten Rechtsträger ist, wenn sie binnen sechs Monaten nach dem Tag, an dem die Eintragung der Ausgliederung in das Register des Sitzes desjenigen Rechtsträgers, dessen Gläubiger sie sind, nach § 19 Abs. 3 UmwG als bekannt gemacht gilt, ihren Anspruch nach Grund und Höhe in Textform anmelden, Sicherheit zu leisten, soweit sie nicht Befriedigung verlangen können. Dieses Recht steht den Gläubigern jedoch nur zu, wenn sie glaubhaft machen, dass durch die Ausgliederung die Erfüllung der Forderung gefährdet wird."
    },
    {
      "date": "2025-08-06",
      "id": "119594",
      "original_text": "Einreichung neuer Dokumente\nSachsen Amtsgericht Dresden HRB 2422\nTechnische Werke Dresden GmbH – Dresden",
      "type": "Einreichung neuer Dokumente",
      "state": "Sachsen",
      "amtsgericht": "Amtsgericht Dresden",
      "registernummer": "HRB 2422",
      "registerart": "HRB",
      "company_name": "Technische Werke Dresden GmbH",
      "company_seat": "Dresden",
      "details": "06.08.2025 (Bekanntmachungsdatum)\n\nSachsen Amtsgericht Dresden HRB 2422\nEinreichung neuer Dokumente\n\nTechnische Werke Dresden GmbH\nGesellschaft mit beschränkter Haftung\nDresden\n\nAm 05.08.2025 wurde beim Handelsregister des Amtsgerichts Dresden die Liste der Mitglieder des Aufsichtsrats gemäß § 52 GmbHG eingereicht."
    },
    {
      "date": "2025-08-06",
      "id": "119595",
      "original_text": "Einreichung neuer Dokumente\nSachsen Amtsgericht Chemnitz HRB 8435\nWohnungsverwaltungs- und -baugesellschaft m.b.H. Flöha – Flöha",
      "type": "Einreichung neuer Dokumente",
      "state": "Sachsen",
      "amtsgericht": "Amtsgericht Chemnitz",
      "registernummer": "HRB 8435",
      "registerart": "HRB",
      "company_name": "Wohnungsverwaltungs- und -baugesellschaft m.b.H. Flöha",
      "company_seat": "Flöha",
      "details": "06.08.2025 (Bekanntmachungsdatum)\n\nSachsen Amtsgericht Chemnitz HRB 8435\nEinreichung neuer Dokumente\n\nWohnungsverwaltungs- und -baugesellschaft m.b.H. Flöha\nGesellschaft mit beschränkter Haftung\nFlöha\n\nAm 03.08.2025 wurde beim Handelsregister des Amtsgerichts Chemnitz die Liste der Mitglieder des Aufsichtsrats gemäß § 52 GmbHG eingereicht."
    },
    {
      "date": "2025-08-06",
      "id": "119596",
      "original_text": "Registerbekanntmachung nach dem Umwandlungsgesetz\nSachsen Amtsgericht Leipzig HRB 12354\nFernwärmenetz Leipzig GmbH – Leipzig",
      "type": "Registerbekanntmachung nach dem Umwandlungsgesetz",
      "state": "Sachsen",
      "amtsgericht": "Amtsgericht Leipzig",
      "registernummer": "HRB 12354",
      "registerart": "HRB",
      "company_name": "Fernwärmenetz Leipzig GmbH",
      "company_seat": "Leipzig",
      "details": "06.08.2025 (Bekanntmachungsdatum)\n\nSachsen Amtsgericht Leipzig HRB 12354\nRegisterbekanntmachung nach dem Umwandlungsgesetz 06.08.2025 (Eintragungsdatum)\n\nFernwärmenetz Leipzig GmbH\nGesellschaft mit beschränkter Haftung\nLeipzig\n\nDen Gläubigern der an der Verschmelzung beteiligten Rechtsträger ist, wenn sie binnen sechs Monaten nach dem Tag, an dem die Eintragung der Verschmelzung in das Register des Sitzes desjenigen Rechtsträgers, dessen Gläubiger sie sind, nach § 19 Abs. 3 UmwG als bekannt gemacht gilt, ihren Anspruch nach Grund und Höhe in Textform anmelden, Sicherheit zu leisten, soweit sie nicht Befriedigung verlangen können. Dieses Recht steht den Gläubigern jedoch nur zu, wenn sie glaubhaft machen, dass durch die Verschmelzung die Erfüllung der Forderung gefährdet wird."
    },
    {
      "date": "2025-08-06",
      "id": "119597",
      "original_text": "Registerbekanntmachung nach dem Umwandlungsgesetz\nSachsen Amtsgericht Dresden HRB 46943\nBoots + Fahrschule Riedel GmbH – Dresden",
      "type": "Registerbekanntmachung nach dem Umwandlungsgesetz",
      "state": "Sachsen",
      "amtsgericht": "Amtsgericht Dresden",
      "registernummer": "HRB 46943",
      "registerart": "HRB",
      "company_name": "Boots + Fahrschule Riedel GmbH",
      "company_seat": "Dresden",
      "details": "06.08.2025 (Bekanntmachungsdatum)\n\nSachsen Amtsgericht Dresden HRB 46943\nRegisterbekanntmachung nach dem Umwandlungsgesetz 06.08.2025 (Eintragungsdatum)\n\nBoots + Fahrschule Riedel GmbH\nGesellschaft mit beschränkter Haftung\nDresden\n\nDen Gläubigern der an der Ausgliederung beteiligten Rechtsträger ist, wenn sie binnen sechs Monaten nach dem Tag, an dem die Eintragung der Ausgliederung in das Register des Sitzes desjenigen Rechtsträgers, dessen Gläubiger sie sind, nach § 19 Abs. 3 UmwG als bekannt gemacht gilt, ihren Anspruch nach Grund und Höhe in Textform anmelden, Sicherheit zu leisten, soweit sie nicht Befriedigung verlangen können. Dieses Recht steht den Gläubigern jedoch nur zu, wenn sie glaubhaft machen, dass durch die Ausgliederung die Erfüllung der Forderung gefährdet wird."
    },
    {
      "date": "2025-08-06",
      "id": "119598",
      "original_text": "Löschungsankündigung\nNiedersachsen Amtsgericht Braunschweig HRB 208154\nEFE GmbH – Salzgitter",
      "type": "Löschungsankündigung",
      "state": "Niedersachsen",
      "amtsgericht": "Amtsgericht Braunschweig",
      "registernummer": "HRB 208154",
      "registerart": "HRB",
      "company_name": "EFE GmbH",
      "company_seat": "Salzgitter",
      "details": "06.08.2025 (Bekanntmachungsdatum)\n\nNiedersachsen Amtsgericht Braunschweig HRB 208154\nLöschungsankündigung\n\nEFE GmbH\nGesellschaft mit beschränkter Haftung\nSalzgitter\n\nDas Registergericht beabsichtigt, die Gesellschaft von Amts wegen nach § 394 FamFG zu löschen. Die Frist zur Erhebung eines Widerspruchs ist auf 1 Monat ab dieser Registerbekanntmachung festgesetzt."
    },
    {
      "date": "2025-08-06",
      "id": "119599",
      "original_text": "Löschungsankündigung\nNiedersachsen Amtsgericht Hildesheim HRB 208862\nstaff2rent GmbH – Peine",
      "type": "Löschungsankündigung",
      "state": "Niedersachsen",
      "amtsgericht": "Amtsgericht Hildesheim",
      "registernummer": "HRB 208862",
      "registerart": "HRB",
      "company_name": "staff2rent GmbH",
      "company_seat": "Peine",
      "details": "06.08.2025 (Bekanntmachungsdatum)\n\nNiedersachsen Amtsgericht Hildesheim HRB 208862\nLöschungsankündigung\n\nstaff2rent GmbH\nGesellschaft mit beschränkter Haftung\nPeine\n\nDas Registergericht beabsichtigt, die Gesellschaft von Amts wegen nach § 394 FamFG zu löschen. Die Frist zur Erhebung eines Widerspruchs ist auf 1 Monat ab dieser Registerbekanntmachung festgesetzt."
    },
    {
      "date": "2025-08-06",
      "id": "119600",
      "original_text": "Registerbekanntmachung nach dem Umwandlungsgesetz\nNiedersachsen Amtsgericht Tostedt HRB 202987\nfahrArt GmbH Fahrtrainings, Events & Fahrprogramme – Buchholz",
      "type": "Registerbekanntmachung nach dem Umwandlungsgesetz",
      "state": "Niedersachsen",
      "amtsgericht": "Amtsgericht Tostedt",
      "registernummer": "HRB 202987",
      "registerart": "HRB",
      "company_name": "fahrArt GmbH Fahrtrainings, Events & Fahrprogramme",
      "company_seat": "Buchholz",
      "details": "06.08.2025 (Bekanntmachungsdatum)\n\nNiedersachsen Amtsgericht Tostedt HRB 202987\nRegisterbekanntmachung nach dem Umwandlungsgesetz 06.08.2025 (Eintragungsdatum)\n\nfahrArt GmbH Fahrtrainings, Events & Fahrprogramme\nGesellschaft mit beschränkter Haftung\nBuchholz\n\nDen Gläubigern der an der Verschmelzung beteiligten Rechtsträger ist, wenn sie binnen sechs Monaten nach dem Tag, an dem die Eintragung der Verschmelzung in das Register des Sitzes desjenigen Rechtsträgers, dessen Gläubiger sie sind, nach § 19  Abs.  3 UmwG als bekannt gemacht gilt, ihren Anspruch nach Grund und Höhe schriftlich anmelden, Sicherheit zu leisten, soweit sie nicht Befriedigung verlangen können. Dieses Recht steht den Gläubigern jedoch nur zu, wenn sie glaubhaft machen, dass durch die Verschmelzung die Erfüllung der Forderung gefährdet wird."
    },
    {
      "date": "2025-08-06",
      "id": "119601",
      "original_text": "Registerbekanntmachung nach dem Umwandlungsgesetz\nNiedersachsen Amtsgericht Hannover HRA 205455\nRehan 2. GmbH & Co. KG – Bad Pyrmont",
      "type": "Registerbekanntmachung nach dem Umwandlungsgesetz",
      "state": "Niedersachsen",
      "amtsgericht": "Amtsgericht Hannover",
      "registernummer": "HRA 205455",
      "registerart": "HRA",
      "company_name": "Rehan 2. GmbH & Co. KG",
      "company_seat": "Bad Pyrmont",
      "details": "06.08.2025 (Bekanntmachungsdatum)\n\nNiedersachsen Amtsgericht Hannover HRA 205455\nRegisterbekanntmachung nach dem Umwandlungsgesetz 06.08.2025 (Eintragungsdatum)\n\nRehan 2. GmbH & Co. KG\nKommanditgesellschaft\nBad Pyrmont\n\nDen Gläubigern der an der Verschmelzung beteiligten Rechtsträger ist, wenn sie binnen sechs Monaten nach dem Tag, an dem die Eintragung der Verschmelzung in das Register des Sitzes desjenigen Rechtsträgers, dessen Gläubiger sie sind, nach § 19  Abs.  3 UmwG als bekannt gemacht gilt, ihren Anspruch nach Grund und Höhe schriftlich anmelden, Sicherheit zu leisten, soweit sie nicht Befriedigung verlangen können. Dieses Recht steht den Gläubigern jedoch nur zu, wenn sie glaubhaft machen, dass durch die Verschmelzung die Erfüllung der Forderung gefährdet wird."
    },
    {
      "date": "2025-08-06",
      "id": "119602",
      "original_text": "Registerbekanntmachung nach dem Umwandlungsgesetz\nNiedersachsen Amtsgericht Osnabrück HRA 206171\nEilting öko Energie GmbH & Co. KG – Lingen",
      "type": "Registerbekanntmachung nach dem Umwandlungsgesetz",
      "state": "Niedersachsen",
      "amtsgericht": "Amtsgericht Osnabrück",
      "registernummer": "HRA 206171",
      "registerart": "HRA",
      "company_name": "Eilting öko Energie GmbH & Co. KG",
      "company_seat": "Lingen",
      "details": "06.08.2025 (Bekanntmachungsdatum)\n\nNiedersachsen Amtsgericht Osnabrück HRA 206171\nRegisterbekanntmachung nach dem Umwandlungsgesetz 31.07.2025 (Eintragungsdatum)\n\nEilting öko Energie GmbH & Co. KG\nKommanditgesellschaft\nLingen\n\nDen Gläubigern der an der Verschmelzung beteiligten Rechtsträger ist, wenn sie binnen sechs Monaten nach dem Tag, an dem die Eintragung der Verschmelzung in das Register des Sitzes desjenigen Rechtsträgers, dessen Gläubiger sie sind, nach § 19  Abs.  3 UmwG als bekannt gemacht gilt, ihren Anspruch nach Grund und Höhe schriftlich anmelden, Sicherheit zu leisten, soweit sie nicht Befriedigung verlangen können. Dieses Recht steht den Gläubigern jedoch nur zu, wenn sie glaubhaft machen, dass durch die Verschmelzung die Erfüllung der Forderung gefährdet wird."
    },
    {
      "date": "2025-08-06",
      "id": "119603",
      "original_text": "Registerbekanntmachung nach dem Umwandlungsgesetz\nNiedersachsen Amtsgericht Hildesheim HRB 101257 früher Amtsgericht Gifhorn\nArobal GmbH für Handel und Dienstleistungen – Peine",
      "type": "Registerbekanntmachung nach dem Umwandlungsgesetz",
      "state": "Niedersachsen",
      "amtsgericht": "Amtsgericht Hildesheim",
      "registernummer": "HRB 101257",
      "registerart": "HRB",
      "company_name": "Arobal GmbH für Handel und Dienstleistungen",
      "company_seat": "Peine",
      "former_amtsgericht": "Gifhorn",
      "details": "06.08.2025 (Bekanntmachungsdatum)\n\nNiedersachsen Amtsgericht Hildesheim HRB 101257 früher Amtsgericht Gifhorn\nRegisterbekanntmachung nach dem Umwandlungsgesetz 06.08.2025 (Eintragungsdatum)\n\nArobal GmbH für Handel und Dienstleistungen\nGesellschaft mit beschränkter Haftung\nPeine\n\nDen Gläubigern der an der Verschmelzung beteiligten Rechtsträger ist, wenn sie binnen sechs Monaten nach dem Tag, an dem die Eintragung der Verschmelzung in das Register des Sitzes desjenigen Rechtsträgers, dessen Gläubiger sie sind, nach § 19  Abs.  3 UmwG als bekannt gemacht gilt, ihren Anspruch nach Grund und Höhe schriftlich anmelden, Sicherheit zu leisten, soweit sie nicht Befriedigung verlangen können. Dieses Recht steht den Gläubigern jedoch nur zu, wenn sie glaubhaft machen, dass durch die Verschmelzung die Erfüllung der Forderung gefährdet wird."
    },
    {
      "date": "2025-08-06",
      "id": "119604",
      "original_text": "Einreichung neuer Dokumente\nNiedersachsen Amtsgericht Hannover HRB 201186\nenercity Netz GmbH – Hannover",
      "type": "Einreichung neuer Dokumente",
      "state": "Niedersachsen",
      "amtsgericht": "Amtsgericht Hannover",
      "registernummer": "HRB 201186",
      "registerart": "HRB",
      "company_name": "enercity Netz GmbH",
      "company_seat": "Hannover",
      "details": "06.08.2025 (Bekanntmachungsdatum)\n\nNiedersachsen Amtsgericht Hannover HRB 201186\nEinreichung neuer Dokumente\n\nenercity Netz GmbH\nGesellschaft mit beschränkter Haftung\nHannover\n\nDie Liste der Mitglieder des Aufsichtsrats wurde beim Registergericht eingereicht."
    },
    {
      "date": "2025-08-06",
      "id": "119605",
      "original_text": "Registerbekanntmachung nach dem Umwandlungsgesetz\nNiedersachsen Amtsgericht Hildesheim HRB 100982 früher Amtsgericht Gifhorn\nL a b o r a g.G.m.b.H für Arbeit und berufliche Bildung – Peine",
      "type": "Registerbekanntmachung nach dem Umwandlungsgesetz",
      "state": "Niedersachsen",
      "amtsgericht": "Amtsgericht Hildesheim",
      "registernummer": "HRB 100982",
      "registerart": "HRB",
      "company_name": "L a b o r a g.G.m.b.H für Arbeit und berufliche Bildung",
      "company_seat": "Peine",
      "former_amtsgericht": "Gifhorn",
      "details": "06.08.2025 (Bekanntmachungsdatum)\n\nNiedersachsen Amtsgericht Hildesheim HRB 100982 früher Amtsgericht Gifhorn\nRegisterbekanntmachung nach dem Umwandlungsgesetz 06.08.2025 (Eintragungsdatum)\n\nL a b o r a   g.G.m.b.H für Arbeit und berufliche Bildung\nGesellschaft mit beschränkter Haftung\nPeine\n\nDen Gläubigern der an der Verschmelzung beteiligten Rechtsträger ist, wenn sie binnen sechs Monaten nach dem Tag, an dem die Eintragung der Verschmelzung in das Register des Sitzes desjenigen Rechtsträgers, dessen Gläubiger sie sind, nach § 19  Abs.  3 UmwG als bekannt gemacht gilt, ihren Anspruch nach Grund und Höhe schriftlich anmelden, Sicherheit zu leisten, soweit sie nicht Befriedigung verlangen können. Dieses Recht steht den Gläubigern jedoch nur zu, wenn sie glaubhaft machen, dass durch die Verschmelzung die Erfüllung der Forderung gefährdet wird."
    },
    {
      "date": "2025-08-06",
      "id": "119606",
      "original_text": "Registerbekanntmachung nach dem Umwandlungsgesetz\nNiedersachsen Amtsgericht Tostedt HRB 209406\nBronsema Handels- und Verwaltungs GmbH – Geestland",
      "type": "Registerbekanntmachung nach dem Umwandlungsgesetz",
      "state": "Niedersachsen",
      "amtsgericht": "Amtsgericht Tostedt",
      "registernummer": "HRB 209406",
      "registerart": "HRB",
      "company_name": "Bronsema Handels- und Verwaltungs GmbH",
      "company_seat": "Geestland",
      "details": "06.08.2025 (Bekanntmachungsdatum)\n\nNiedersachsen Amtsgericht Tostedt HRB 209406\nRegisterbekanntmachung nach dem Umwandlungsgesetz 06.08.2025 (Eintragungsdatum)\n\nBronsema Handels- und Verwaltungs GmbH\nGesellschaft mit beschränkter Haftung\nGeestland\n\nDen Gläubigern der an der formwechselnden Umwandlung beteiligten Rechtsträger ist, wenn sie binnen sechs Monaten nach dem Tag, an dem die Eintragung der Umwandlung in das Register des Sitzes desjenigen Rechtsträgers, dessen Gläubiger sie sind, nach § 19 Abs. 3 UmwG als bekannt gemacht gilt, ihren Anspruch nach Grund und Höhe schriftlich anmelden, Sicherheit zu leisten, soweit sie nicht Befriedigung verlangen können. Dieses Recht steht den Gläubigern jedoch nur zu, wenn sie glaubhaft machen, dass durch die formwechselnde Umwandlung die Erfüllung der Forderung gefährdet wird."
    },
    {
      "date": "2025-08-06",
      "id": "119607",
      "original_text": "Registerbekanntmachung nach dem Umwandlungsgesetz\nNiedersachsen Amtsgericht Hannover HRA 204181\nLBG GmbH & Co. KG – Hameln",
      "type": "Registerbekanntmachung nach dem Umwandlungsgesetz",
      "state": "Niedersachsen",
      "amtsgericht": "Amtsgericht Hannover",
      "registernummer": "HRA 204181",
      "registerart": "HRA",
      "company_name": "LBG GmbH & Co. KG",
      "company_seat": "Hameln",
      "details": "06.08.2025 (Bekanntmachungsdatum)\n\nNiedersachsen Amtsgericht Hannover HRA 204181\nRegisterbekanntmachung nach dem Umwandlungsgesetz 06.08.2025 (Eintragungsdatum)\n\nLBG GmbH & Co. KG\nKommanditgesellschaft\nHameln\n\nDen Gläubigern der an der Verschmelzung beteiligten Rechtsträger ist, wenn sie binnen sechs Monaten nach dem Tag, an dem die Eintragung der Verschmelzung in das Register des Sitzes desjenigen Rechtsträgers, dessen Gläubiger sie sind, nach § 19  Abs.  3 UmwG als bekannt gemacht gilt, ihren Anspruch nach Grund und Höhe schriftlich anmelden, Sicherheit zu leisten, soweit sie nicht Befriedigung verlangen können. Dieses Recht steht den Gläubigern jedoch nur zu, wenn sie glaubhaft machen, dass durch die Verschmelzung die Erfüllung der Forderung gefährdet wird."
    },
    {
      "date": "2025-08-06",
      "id": "119608",
      "original_text": "Registerbekanntmachung nach dem Umwandlungsgesetz\nNiedersachsen Amtsgericht Tostedt HRA 205589\nBronsema Handels- und Verwaltungs UG (haftungsbeschränkt) & Co. KG – Geestland",
      "type": "Registerbekanntmachung nach dem Umwandlungsgesetz",
      "state": "Niedersachsen",
      "amtsgericht": "Amtsgericht Tostedt",
      "registernummer": "HRA 205589",
      "registerart": "HRA",
      "company_name": "Bronsema Handels- und Verwaltungs UG (haftungsbeschränkt) & Co. KG",
      "company_seat": "Geestland",
      "details": "06.08.2025 (Bekanntmachungsdatum)\n\nNiedersachsen Amtsgericht Tostedt HRA 205589\nRegisterbekanntmachung nach dem Umwandlungsgesetz 06.08.2025 (Eintragungsdatum)\n\nBronsema Handels- und Verwaltungs UG (haftungsbeschränkt) & Co. KG\nKommanditgesellschaft\nGeestland\n\nDen Gläubigern der an der formwechselnden Umwandlung beteiligten Rechtsträger ist, wenn sie binnen sechs Monaten nach dem Tag, an dem die Eintragung der Umwandlung in das Register des Sitzes desjenigen Rechtsträgers, dessen Gläubiger sie sind, nach § 19 Abs. 3 UmwG als bekannt gemacht gilt, ihren Anspruch nach Grund und Höhe schriftlich anmelden, Sicherheit zu leisten, soweit sie nicht Befriedigung verlangen können. Dieses Recht steht den Gläubigern jedoch nur zu, wenn sie glaubhaft machen, dass durch die formwechselnde Umwandlung die Erfüllung der Forderung gefährdet wird."
    },
    {
      "date": "2025-08-06",
      "id": "119609",
      "original_text": "Registerbekanntmachung nach dem Umwandlungsgesetz\nNiedersachsen Amtsgericht Tostedt HRA 205590\nfahrArt Fahrtrainings, Events & Fahrprogramme e.K. – Buchholz",
      "type": "Registerbekanntmachung nach dem Umwandlungsgesetz",
      "state": "Niedersachsen",
      "amtsgericht": "Amtsgericht Tostedt",
      "registernummer": "HRA 205590",
      "registerart": "HRA",
      "company_name": "fahrArt Fahrtrainings, Events & Fahrprogramme e.K.",
      "company_seat": "Buchholz",
      "details": "06.08.2025 (Bekanntmachungsdatum)\n\nNiedersachsen Amtsgericht Tostedt HRA 205590\nRegisterbekanntmachung nach dem Umwandlungsgesetz 06.08.2025 (Eintragungsdatum)\n\nfahrArt Fahrtrainings, Events & Fahrprogramme e.K.\nEinzelkaufmann / Einzelkauffrau\nBuchholz\n\nDen Gläubigern der an der Verschmelzung beteiligten Rechtsträger ist, wenn sie binnen sechs Monaten nach dem Tag, an dem die Eintragung der Verschmelzung in das Register des Sitzes desjenigen Rechtsträgers, dessen Gläubiger sie sind, nach § 19  Abs.  3 UmwG als bekannt gemacht gilt, ihren Anspruch nach Grund und Höhe schriftlich anmelden, Sicherheit zu leisten, soweit sie nicht Befriedigung verlangen können. Dieses Recht steht den Gläubigern jedoch nur zu, wenn sie glaubhaft machen, dass durch die Verschmelzung die Erfüllung der Forderung gefährdet wird."
    },
    {
      "date": "2025-08-06",
      "id": "119610",
      "original_text": "Registerbekanntmachung nach dem Umwandlungsgesetz\nRheinland-Pfalz Amtsgericht Landau HRB 1589\nGDI Software GmbH – Landau in der Pfalz",
      "type": "Registerbekanntmachung nach dem Umwandlungsgesetz",
      "state": "Rheinland-Pfalz",
      "amtsgericht": "Amtsgericht Landau",
      "registernummer": "HRB 1589",
      "registerart": "HRB",
      "company_name": "GDI Software GmbH",
      "company_seat": "Landau in der Pfalz",
      "details": "06.08.2025 (Bekanntmachungsdatum)\n\nRheinland-Pfalz Amtsgericht Landau HRB 1589\nRegisterbekanntmachung nach dem Umwandlungsgesetz 06.08.2025 (Eintragungsdatum)\n\nGDI Software GmbH\nGesellschaft mit beschränkter Haftung\nLandau in der Pfalz\n\nAls nicht eingetragen wird veröffentlicht: Den Gläubigern der an der Verschmelzung beteiligten Rechtsträger ist, wenn sie binnen sechs Monaten nach dem Tag, an dem die Eintragung der Verschmelzung in das Register des Sitzes desjenigen Rechtsträgers, dessen Gläubiger sie sind, nach § 19 Abs. 3 UmwG als bekannt gemacht gilt, ihren Anspruch nach Grund und Höhe schriftlich anmelden, Sicherheit zu leisten, soweit sie nicht Befriedigung verlangen können. Dieses Recht steht den Gläubigern jedoch nur zu, wenn sie glaubhaft machen, dass durch die Verschmelzung die Erfüllung der Forderung gefährdet wird."
    },
    {
      "date": "2025-08-06",
      "id": "119611",
      "original_text": "Registerbekanntmachung nach dem Umwandlungsgesetz\nRheinland-Pfalz Amtsgericht Landau HRB 34061\nGDI Services GmbH – Landau in der Pfalz",
      "type": "Registerbekanntmachung nach dem Umwandlungsgesetz",
      "state": "Rheinland-Pfalz",
      "amtsgericht": "Amtsgericht Landau",
      "registernummer": "HRB 34061",
      "registerart": "HRB",
      "company_name": "GDI Services GmbH",
      "company_seat": "Landau in der Pfalz",
      "details": "06.08.2025 (Bekanntmachungsdatum)\n\nRheinland-Pfalz Amtsgericht Landau HRB 34061\nRegisterbekanntmachung nach dem Umwandlungsgesetz 06.08.2025 (Eintragungsdatum)\n\nGDI Services GmbH\nGesellschaft mit beschränkter Haftung\nLandau in der Pfalz\n\nAls nicht eingetragen wird veröffentlicht: Den Gläubigern der an der Verschmelzung beteiligten Rechtsträger ist, wenn sie binnen sechs Monaten nach dem Tag, an dem die Eintragung der Verschmelzung in das Register des Sitzes desjenigen Rechtsträgers, dessen Gläubiger sie sind, nach § 19 Abs. 3 UmwG als bekannt gemacht gilt, ihren Anspruch nach Grund und Höhe schriftlich anmelden, Sicherheit zu leisten, soweit sie nicht Befriedigung verlangen können. Dieses Recht steht den Gläubigern jedoch nur zu, wenn sie glaubhaft machen, dass durch die Verschmelzung die Erfüllung der Forderung gefährdet wird."
    },
    {
      "date": "2025-08-06",
      "id": "119612",
      "original_text": "Löschungsankündigung\nRheinland-Pfalz Amtsgericht Ludwigshafen a.Rhein (Ludwigshafen) HRA 11342\nDügro Restaurant und Cafe Walter KG – Bad Dürkheim",
      "type": "Löschungsankündigung",
      "state": "Rheinland-Pfalz",
      "amtsgericht": "Amtsgericht Ludwigshafen a.Rhein (Ludwigshafen)",
      "registernummer": "HRA 11342",
      "registerart": "HRA",
      "company_name": "Dügro Restaurant und Cafe Walter KG",
      "company_seat": "Bad Dürkheim",
      "details": "06.08.2025 (Bekanntmachungsdatum)\n\nRheinland-Pfalz Amtsgericht Ludwigshafen a.Rhein (Ludwigshafen) HRA 11342\nLöschungsankündigung\n\nDügro Restaurant und Cafe Walter KG\nKommanditgesellschaft\nBad Dürkheim\n\nDas Registergericht beabsichtigt die Firma von Amts wegen nach § 31 Abs. 2 HGB, § 393 FamFG zu löschen. Die Frist zur Erhebung eines Widerspruchs ist auf  einen Monat festgesetzt."
    },
    {
      "date": "2025-08-06",
      "id": "119613",
      "original_text": "Registerbekanntmachung nach dem Umwandlungsgesetz\nRheinland-Pfalz Amtsgericht Koblenz HRA 21982\nflowcraft services GmbH & Co. KG – Brohl-Lützing",
      "type": "Registerbekanntmachung nach dem Umwandlungsgesetz",
      "state": "Rheinland-Pfalz",
      "amtsgericht": "Amtsgericht Koblenz",
      "registernummer": "HRA 21982",
      "registerart": "HRA",
      "company_name": "flowcraft services GmbH & Co. KG",
      "company_seat": "Brohl-Lützing",
      "details": "06.08.2025 (Bekanntmachungsdatum)\n\nRheinland-Pfalz Amtsgericht Koblenz HRA 21982\nRegisterbekanntmachung nach dem Umwandlungsgesetz 06.08.2025 (Eintragungsdatum)\n\nflowcraft services GmbH & Co. KG\nKommanditgesellschaft\nBrohl-Lützing\n\nAls nicht eingetragen wird veröffentlicht: Den Gläubigern der an der Umwandlung beteiligten Rechtsträger ist, wenn sie binnen sechs Monaten nach dem Tag, an dem die Eintragung der Umwandlung in das Register des Sitzes desjenigen Rechtsträgers, dessen Gläubiger sie sind, nach § 19 Abs. 3 UmwG als bekannt gemacht gilt, ihren Anspruch nach Grund und Höhe schriftlich anmelden, Sicherheit zu leisten, soweit sie nicht Befriedigung verlangen können. Dieses Recht steht den Gläubigern jedoch nur zu, wenn sie glaubhaft machen, dass durch die Umwandlung die Erfüllung der Forderung gefährdet wird."
    },
    {
      "date": "2025-08-06",
      "id": "119614",
      "original_text": "Einreichung neuer Dokumente\nRheinland-Pfalz Amtsgericht Koblenz HRB 2870\nCanyon Bicycles GmbH – Koblenz",
      "type": "Einreichung neuer Dokumente",
      "state": "Rheinland-Pfalz",
      "amtsgericht": "Amtsgericht Koblenz",
      "registernummer": "HRB 2870",
      "registerart": "HRB",
      "company_name": "Canyon Bicycles GmbH",
      "company_seat": "Koblenz",
      "details": "06.08.2025 (Bekanntmachungsdatum)\n\nRheinland-Pfalz Amtsgericht Koblenz HRB 2870\nEinreichung neuer Dokumente\n\nCanyon Bicycles GmbH\nGesellschaft mit beschränkter Haftung\nKoblenz\n\nDem Registergericht ist eine neue Liste der Mitglieder des Aufsichtsrates eingereicht worden."
    },
    {
      "date": "2025-08-06",
      "id": "119615",
      "original_text": "Registerbekanntmachung nach dem Umwandlungsgesetz\nBremen Amtsgericht Bremen HRB 25281\nMund + Bruns GmbH – Bremen",
      "type": "Registerbekanntmachung nach dem Umwandlungsgesetz",
      "state": "Bremen",
      "amtsgericht": "Amtsgericht Bremen",
      "registernummer": "HRB 25281",
      "registerart": "HRB",
      "company_name": "Mund + Bruns GmbH",
      "company_seat": "Bremen",
      "details": "06.08.2025 (Bekanntmachungsdatum)\n\nBremen Amtsgericht Bremen HRB 25281\nRegisterbekanntmachung nach dem Umwandlungsgesetz 31.07.2025 (Eintragungsdatum)\n\nMund + Bruns GmbH\nGesellschaft mit beschränkter Haftung\nBremen\n\nZu Eintragungsnummer 12 vom 31.07.2025 wird als nicht eingetragen veröffentlicht:  Den Gläubigern der an der Verschmelzung beteiligten Rechtsträger ist, wenn sie binnen sechs Monaten nach dem Tag, an dem die Eintragung der Verschmelzung in das Register des Sitzes desjenigen Rechtsträgers, dessen Gläubiger sie sind, als bekannt gemacht gilt, ihren Anspruch nach Grund und Höhe schriftlich anmelden, Sicherheit zu leisten, soweit sie nicht Befriedigung verlangen können. Dieses Recht steht den Gläubigern jedoch nur zu, wenn sie glaubhaft machen, dass durch die Verschmelzung die Erfüllung ihrer Forderung gefährdet wird. Das Recht, Sicherheitsleistung zu verlangen, steht Gläubigern nicht zu, die im Falle der Insolvenz ein Recht auf vorzugsweise Befriedigung aus einer Deckungsmasse haben, die nach gesetzlicher Vorschrift zu ihrem Schutz errichtet und staatlich überwacht ist."
    },
    {
      "date": "2025-08-06",
      "id": "119616",
      "original_text": "Registerbekanntmachung nach dem Umwandlungsgesetz\nBremen Amtsgericht Bremen HRB 32055\nMund + Bruns Services GmbH – Bremen",
      "type": "Registerbekanntmachung nach dem Umwandlungsgesetz",
      "state": "Bremen",
      "amtsgericht": "Amtsgericht Bremen",
      "registernummer": "HRB 32055",
      "registerart": "HRB",
      "company_name": "Mund + Bruns Services GmbH",
      "company_seat": "Bremen",
      "details": "06.08.2025 (Bekanntmachungsdatum)\n\nBremen Amtsgericht Bremen HRB 32055\nRegisterbekanntmachung nach dem Umwandlungsgesetz 31.07.2025 (Eintragungsdatum)\n\nMund + Bruns Services GmbH\nGesellschaft mit beschränkter Haftung\nBremen\n\nZu Eintragungsnummer 8 vom 31.07.2025 wird als nicht eingetragen veröffentlicht: Den Gläubigern der an der Verschmelzung beteiligten Rechtsträger ist, wenn sie binnen sechs Monaten nach dem Tag, an dem die Eintragung der Verschmelzung in das Register des Sitzes desjenigen Rechtsträgers, dessen Gläubiger sie sind, als bekannt gemacht gilt, ihren Anspruch nach Grund und Höhe schriftlich anmelden, Sicherheit zu leisten, soweit sie nicht Befriedigung verlangen können. Dieses Recht steht den Gläubigern jedoch nur zu, wenn sie glaubhaft machen, dass durch die Verschmelzung die Erfüllung ihrer Forderung gefährdet wird. Das Recht, Sicherheitsleistung zu verlangen, steht Gläubigern nicht zu, die im Falle der Insolvenz ein Recht auf vorzugsweise Befriedigung aus einer Deckungsmasse haben, die nach gesetzlicher Vorschrift zu ihrem Schutz errichtet und staatlich überwacht ist."
    },
    {
      "date": "2025-08-06",
      "id": "119617",
      "original_text": "Registerbekanntmachung nach dem Umwandlungsgesetz\nBremen Amtsgericht Bremen HRB 40685\nAF Erwerbs GmbH – Bremen",
      "type": "Registerbekanntmachung nach dem Umwandlungsgesetz",
      "state": "Bremen",
      "amtsgericht": "Amtsgericht Bremen",
      "registernummer": "HRB 40685",
      "registerart": "HRB",
      "company_name": "AF Erwerbs GmbH",
      "company_seat": "Bremen",
      "details": "06.08.2025 (Bekanntmachungsdatum)\n\nBremen Amtsgericht Bremen HRB 40685\nRegisterbekanntmachung nach dem Umwandlungsgesetz 01.08.2025 (Eintragungsdatum)\n\nAF Erwerbs GmbH\nGesellschaft mit beschränkter Haftung\nBremen\n\nZu Eintragungsnummer 3 vom 01.08.2025 wird als nicht eingetragen veröffentlicht: Den Gläubigern der an der Verschmelzung beteiligten Rechtsträger ist, wenn sie binnen sechs Monaten nach dem Tag, an dem die Eintragung der Verschmelzung in das Register des Sitzes desjenigen Rechtsträgers, dessen Gläubiger sie sind, als bekannt gemacht gilt, ihren Anspruch nach Grund und Höhe schriftlich anmelden, Sicherheit zu leisten, soweit sie nicht Befriedigung verlangen können. Dieses Recht steht den Gläubigern jedoch nur zu, wenn sie glaubhaft machen, dass durch die Verschmelzung die Erfüllung ihrer Forderung gefährdet wird. Das Recht, Sicherheitsleistung zu verlangen, steht Gläubigern nicht zu, die im Falle der Insolvenz ein Recht auf vorzugsweise Befriedigung aus einer Deckungsmasse haben, die nach gesetzlicher Vorschrift zu ihrem Schutz errichtet und staatlich überwacht ist."
    },
    {
      "date": "2025-08-06",
      "id": "119618",
      "original_text": "Einreichung neuer Dokumente\nBremen Amtsgericht Bremen HRB 32488\nRYTLE GmbH – Bremen",
      "type": "Einreichung neuer Dokumente",
      "state": "Bremen",
      "amtsgericht": "Amtsgericht Bremen",
      "registernummer": "HRB 32488",
      "registerart": "HRB",
      "company_name": "RYTLE GmbH",
      "company_seat": "Bremen",
      "details": "06.08.2025 (Bekanntmachungsdatum)\n\nBremen Amtsgericht Bremen HRB 32488\nEinreichung neuer Dokumente\n\nRYTLE GmbH\nGesellschaft mit beschränkter Haftung\nBremen\n\nAls nicht eingetragen wird veröffentlicht:  Liste des Aufsichtsrats wurde eingereicht."
    },
    {
      "date": "2025-08-06",
      "id": "119619",
      "original_text": "Registerbekanntmachung nach dem Umwandlungsgesetz\nNordrhein-Westfalen Amtsgericht Essen HRB 33887\nKonsocollect GmbH – Essen",
      "type": "Registerbekanntmachung nach dem Umwandlungsgesetz",
      "state": "Nordrhein-Westfalen",
      "amtsgericht": "Amtsgericht Essen",
      "registernummer": "HRB 33887",
      "registerart": "HRB",
      "company_name": "Konsocollect GmbH",
      "company_seat": "Essen",
      "details": "06.08.2025 (Bekanntmachungsdatum)\n\nNordrhein-Westfalen Amtsgericht Essen HRB 33887\nRegisterbekanntmachung nach dem Umwandlungsgesetz 06.08.2025 (Eintragungsdatum)\n\nKonsocollect GmbH\nGesellschaft mit beschränkter Haftung\nEssen\n\nDen Gläubigern der an der Verschmelzung beteiligten Rechtsträger ist, wenn sie binnen sechs Monaten nach dem Tag, an dem die Eintragung der Verschmelzung in das Register des Sitzes desjenigen Rechtsträgers, dessen Gläubiger sie sind, nach § 19 Absatz 3 UmwG als bekanntgemacht gilt, ihren Anspruch nach Grund und Höhe schriftlich anmelden, Sicherheit zu leisten, soweit sie nicht Befriedigung verlangen können. Dieses Recht steht den Gläubigern jedoch nur zu, wenn sie glaubhaft machen, dass durch die Verschmelzung die Erfüllung ihrer Forderung gefährdet wird."
    },
    {
      "date": "2025-08-06",
      "id": "119620",
      "original_text": "Registerbekanntmachung nach dem Umwandlungsgesetz\nNordrhein-Westfalen Amtsgericht Münster HRB 21970\nWinkhaus Verwaltungs SE – Telgte",
      "type": "Registerbekanntmachung nach dem Umwandlungsgesetz",
      "state": "Nordrhein-Westfalen",
      "amtsgericht": "Amtsgericht Münster",
      "registernummer": "HRB 21970",
      "registerart": "HRB",
      "company_name": "Winkhaus Verwaltungs SE",
      "company_seat": "Telgte",
      "details": "06.08.2025 (Bekanntmachungsdatum)\n\nNordrhein-Westfalen Amtsgericht Münster HRB 21970\nRegisterbekanntmachung nach dem Umwandlungsgesetz 06.08.2025 (Eintragungsdatum)\n\nWinkhaus Verwaltungs SE\nEuropäische Aktiengesellschaft (SE)\nTelgte\n\nDen Gläubigern der an der Verschmelzung beteiligten Rechtsträger ist, wenn sie binnen sechs Monaten nach dem Tag, an dem die Eintragung der Verschmelzung in das Register des Sitzes desjenigen Rechtsträgers, dessen Gläubiger sie sind, nach § 19 Absatz 3 UmwG als bekanntgemacht gilt, ihren Anspruch nach Grund und Höhe schriftlich anmelden, Sicherheit zu leisten, soweit sie nicht Befriedigung verlangen können. Dieses Recht steht den Gläubigern jedoch nur zu, wenn sie glaubhaft machen, dass durch die Verschmelzung die Erfüllung ihrer Forderung gefährdet wird."
    },
    {
      "date": "2025-08-06",
      "id": "119621",
      "original_text": "Registerbekanntmachung nach dem Umwandlungsgesetz\nNordrhein-Westfalen Amtsgericht Essen HRB 28523\nDRS Mail Holding GmbH – Essen",
      "type": "Registerbekanntmachung nach dem Umwandlungsgesetz",
      "state": "Nordrhein-Westfalen",
      "amtsgericht": "Amtsgericht Essen",
      "registernummer": "HRB 28523",
      "registerart": "HRB",
      "company_name": "DRS Mail Holding GmbH",
      "company_seat": "Essen",
      "details": "06.08.2025 (Bekanntmachungsdatum)\n\nNordrhein-Westfalen Amtsgericht Essen HRB 28523\nRegisterbekanntmachung nach dem Umwandlungsgesetz 06.08.2025 (Eintragungsdatum)\n\nDRS Mail Holding GmbH\nGesellschaft mit beschränkter Haftung\nEssen\n\nDen Gläubigern der an der Verschmelzung beteiligten Rechtsträger ist, wenn sie binnen sechs Monaten nach dem Tag, an dem die Eintragung der Verschmelzung in das Register des Sitzes derjenigen Rechtsträger deren Gläubiger sie sind, nach § 19 Absatz 3 UmwG als bekanntgemacht gilt, ihren Anspruch nach Grund und Höhe schriftlich anmelden, Sicherheit zu leisten, soweit sie nicht Befriedigung verlangen können. Dieses Recht steht den Gläubigern jedoch nur zu, wenn sie glaubhaft machen, dass durch die Verschmelzung die Erfüllung ihrer Forderung gefährdet wird."
    },
    {
      "date": "2025-08-06",
      "id": "119622",
      "original_text": "Einreichung neuer Dokumente\nNordrhein-Westfalen Amtsgericht Aachen HRB 19385\nWestVerkehr GmbH – Geilenkirchen",
      "type": "Einreichung neuer Dokumente",
      "state": "Nordrhein-Westfalen",
      "amtsgericht": "Amtsgericht Aachen",
      "registernummer": "HRB 19385",
      "registerart": "HRB",
      "company_name": "WestVerkehr GmbH",
      "company_seat": "Geilenkirchen",
      "details": "06.08.2025 (Bekanntmachungsdatum)\n\nNordrhein-Westfalen Amtsgericht Aachen HRB 19385\nEinreichung neuer Dokumente\n\nWestVerkehr GmbH\nGesellschaft mit beschränkter Haftung\nGeilenkirchen\n\nDem Registergericht ist eine neue Liste der Mitglieder des Aufsichtsrates eingereicht worden."
    },
    {
      "date": "2025-08-06",
      "id": "119623",
      "original_text": "Registerbekanntmachung nach dem Umwandlungsgesetz\nNordrhein-Westfalen Amtsgericht Neuss HRB 22791\nGallert Rente UG (haftungsbeschränkt) – Meerbusch",
      "type": "Registerbekanntmachung nach dem Umwandlungsgesetz",
      "state": "Nordrhein-Westfalen",
      "amtsgericht": "Amtsgericht Neuss",
      "registernummer": "HRB 22791",
      "registerart": "HRB",
      "company_name": "Gallert Rente UG (haftungsbeschränkt)",
      "company_seat": "Meerbusch",
      "details": "06.08.2025 (Bekanntmachungsdatum)\n\nNordrhein-Westfalen Amtsgericht Neuss HRB 22791\nRegisterbekanntmachung nach dem Umwandlungsgesetz 06.08.2025 (Eintragungsdatum)\n\nGallert Rente UG (haftungsbeschränkt)\nGesellschaft mit beschränkter Haftung\nMeerbusch\n\nDen Gläubigern der an der Verschmelzung beteiligten Rechtsträger ist, wenn sie binnen sechs Monaten nach dem Tag, an dem die Eintragung der Verschmelzung in das Register des Sitzes desjenigen Rechtsträgers, dessen Gläubiger sie sind, nach § 19 Absatz 3 UmwG als bekanntgemacht gilt, ihren Anspruch nach Grund und Höhe schriftlich anmelden, Sicherheit zu leisten, soweit sie nicht Befriedigung verlangen können. Dieses Recht steht den Gläubigern jedoch nur zu, wenn sie glaubhaft machen, dass durch die Verschmelzung die Erfüllung ihrer Forderung gefährdet wird."
    },
    {
      "date": "2025-08-06",
      "id": "119624",
      "original_text": "Registerbekanntmachung nach dem Umwandlungsgesetz\nNordrhein-Westfalen Amtsgericht Hagen HRB 1458\nJürgens GmbH – Hagen",
      "type": "Registerbekanntmachung nach dem Umwandlungsgesetz",
      "state": "Nordrhein-Westfalen",
      "amtsgericht": "Amtsgericht Hagen",
      "registernummer": "HRB 1458",
      "registerart": "HRB",
      "company_name": "Jürgens GmbH",
      "company_seat": "Hagen",
      "details": "06.08.2025 (Bekanntmachungsdatum)\n\nNordrhein-Westfalen Amtsgericht Hagen HRB 1458\nRegisterbekanntmachung nach dem Umwandlungsgesetz 05.08.2025 (Eintragungsdatum)\n\nJürgens GmbH\nGesellschaft mit beschränkter Haftung\nHagen\n\nDen Gläubigern der an der Verschmelzung beteiligten Rechtsträger ist, wenn sie binnen sechs Monaten nach dem Tag, an dem die Eintragung der Verschmelzung in das Register des Sitzes desjenigen Rechtsträgers, dessen Gläubiger sie sind, nach § 19 Absatz 3 UmwG als bekanntgemacht gilt, ihren Anspruch nach Grund und Höhe schriftlich anmelden, Sicherheit zu leisten, soweit sie nicht Befriedigung verlangen können. Dieses Recht steht den Gläubigern jedoch nur zu, wenn sie glaubhaft machen, dass durch die Verschmelzung die Erfüllung ihrer Forderung gefährdet wird."
    },
    {
      "date": "2025-08-06",
      "id": "119625",
      "original_text": "Registerbekanntmachung nach dem Umwandlungsgesetz\nNordrhein-Westfalen Amtsgericht Düren HRB 9991\nColep Regensburg GmbH – Schleiden",
      "type": "Registerbekanntmachung nach dem Umwandlungsgesetz",
      "state": "Nordrhein-Westfalen",
      "amtsgericht": "Amtsgericht Düren",
      "registernummer": "HRB 9991",
      "registerart": "HRB",
      "company_name": "Colep Regensburg GmbH",
      "company_seat": "Schleiden",
      "details": "06.08.2025 (Bekanntmachungsdatum)\n\nNordrhein-Westfalen Amtsgericht Düren HRB 9991\nRegisterbekanntmachung nach dem Umwandlungsgesetz 06.08.2025 (Eintragungsdatum)\n\nColep Regensburg GmbH\nGesellschaft mit beschränkter Haftung\nSchleiden\n\nDen Gläubigern der an der Verschmelzung beteiligten Rechtsträger ist, wenn sie binnen sechs Monaten nach dem Tag, an dem die Eintragung der Verschmelzung in das Register des Sitzes desjenigen Rechtsträgers, dessen Gläubiger sie sind, nach § 19 Absatz 3 UmwG als bekanntgemacht gilt, ihren Anspruch nach Grund und Höhe schriftlich anmelden, Sicherheit zu leisten, soweit sie nicht Befriedigung verlangen können. Dieses Recht steht den Gläubigern jedoch nur zu, wenn sie glaubhaft machen, dass durch die Verschmelzung die Erfüllung ihrer Forderung gefährdet wird."
    },
    {
      "date": "2025-08-06",
      "id": "119626",
      "original_text": "Einreichung neuer Dokumente\nNordrhein-Westfalen Amtsgericht Recklinghausen HRB 5232\nBRIAG Brillen International AG – Datteln",
      "type": "Einreichung neuer Dokumente",
      "state": "Nordrhein-Westfalen",
      "amtsgericht": "Amtsgericht Recklinghausen",
      "registernummer": "HRB 5232",
      "registerart": "HRB",
      "company_name": "BRIAG Brillen International AG",
      "company_seat": "Datteln",
      "details": "06.08.2025 (Bekanntmachungsdatum)\n\nNordrhein-Westfalen Amtsgericht Recklinghausen HRB 5232\nEinreichung neuer Dokumente 05.08.2025 (Eintragungsdatum)\n\nBRIAG Brillen International AG\nAktiengesellschaft\nDatteln\n\nDem Registergericht ist eine neue Liste der Mitglieder des Aufsichtsrates eingereicht worden."
    },
    {
      "date": "2025-08-06",
      "id": "119627",
      "original_text": "Registerbekanntmachung nach dem Umwandlungsgesetz\nNordrhein-Westfalen Amtsgericht Paderborn GnR 307\nVolksbank Störmede-Westenholz-Hörste eG – Delbrück",
      "type": "Registerbekanntmachung nach dem Umwandlungsgesetz",
      "state": "Nordrhein-Westfalen",
      "amtsgericht": "Amtsgericht Paderborn",
      "registernummer": "GnR 307",
      "registerart": "GnR",
      "company_name": "Volksbank Störmede-Westenholz-Hörste eG",
      "company_seat": "Delbrück",
      "details": "06.08.2025 (Bekanntmachungsdatum)\n\nNordrhein-Westfalen Amtsgericht Paderborn GnR 307\nRegisterbekanntmachung nach dem Umwandlungsgesetz 06.08.2025 (Eintragungsdatum)\n\nVolksbank Störmede-Westenholz-Hörste eG\neingetragene Genossenschaft\nDelbrück\n\nDen Gläubigern der an der Verschmelzung beteiligten Rechtsträger ist, wenn sie binnen sechs Monaten nach dem Tag, an dem die Eintragung der Verschmelzung in das Register des Sitzes desjenigen Rechtsträgers, dessen Gläubiger sie sind, nach § 19 Absatz 3 UmwG als bekanntgemacht gilt, ihren Anspruch nach Grund und Höhe schriftlich anmelden, Sicherheit zu leisten, soweit sie nicht Befriedigung verlangen können. Dieses Recht steht den Gläubigern jedoch nur zu, wenn sie glaubhaft machen, dass durch die Verschmelzung die Erfüllung ihrer Forderung gefährdet wird."
    },
    {
      "date": "2025-08-06",
      "id": "119628",
      "original_text": "Registerbekanntmachung nach dem Umwandlungsgesetz\nNordrhein-Westfalen Amtsgericht Bad Oeynhausen GsR 235\nEric Schneider & Calvin Klusmeier eGbR – Herford",
      "type": "Registerbekanntmachung nach dem Umwandlungsgesetz",
      "state": "Nordrhein-Westfalen",
      "amtsgericht": "Amtsgericht Bad Oeynhausen",
      "registernummer": "GsR 235",
      "registerart": "GsR",
      "company_name": "Eric Schneider & Calvin Klusmeier eGbR",
      "company_seat": "Herford",
      "details": "06.08.2025 (Bekanntmachungsdatum)\n\nNordrhein-Westfalen Amtsgericht Bad Oeynhausen GsR 235\nRegisterbekanntmachung nach dem Umwandlungsgesetz 22.05.2025 (Eintragungsdatum)\n\nEric Schneider & Calvin Klusmeier eGbR\nGesellschaft bürgerlichen Rechts\nHerford\n\nDen Gläubigern der an der formwechselnden Umwandlung beteiligten Rechtsträger ist, wenn sie binnen sechs Monaten nach dem Tag, an dem die Eintragung der formwechselnden Umwandlung in das Register des Sitzes desjenigen Rechtsträgers, dessen Gläubiger sie sind, nach § 19 Absatz 3 UmwG als bekanntgemacht gilt, ihren Anspruch nach Grund und Höhe schriftlich anmelden, Sicherheit zu leisten, soweit sie nicht Befriedigung verlangen können. Dieses Recht steht den Gläubigern jedoch nur zu, wenn sie glaubhaft machen, dass durch die formwechselnden Umwandlung die Erfüllung ihrer Forderung gefährdet wird."
    },
    {
      "date": "2025-08-06",
      "id": "119629",
      "original_text": "Löschungsankündigung\nNordrhein-Westfalen Amtsgericht Düsseldorf HRB 97113\nJuB Bau UG (haftungsbeschränkt) – Düsseldorf",
      "type": "Löschungsankündigung",
      "state": "Nordrhein-Westfalen",
      "amtsgericht": "Amtsgericht Düsseldorf",
      "registernummer": "HRB 97113",
      "registerart": "HRB",
      "company_name": "JuB Bau UG (haftungsbeschränkt)",
      "company_seat": "Düsseldorf",
      "details": "06.08.2025 (Bekanntmachungsdatum)\n\nNordrhein-Westfalen Amtsgericht Düsseldorf HRB 97113\nLöschungsankündigung\n\nJuB Bau UG (haftungsbeschränkt)\nGesellschaft mit beschränkter Haftung\nDüsseldorf\n\nDas Registergericht beabsichtigt die Gesellschaft von Amts wegen nach § 394 FamFG zu löschen. Die Frist zur Erhebung eines Widerspruchs ist auf 3 Wochen festgesetzt.\n\nRechtsbehelfsbelehrung:\nDas Widerspruchsrecht steht jedem zu, der an der Unterlassung der Löschung ein berechtigtes Interesse hat. Der Widerspruch ist bei dem Amtsgericht Düsseldorf -Registergericht-, Werdener Straße 1, 40227 Düsseldorf schriftlich in deutscher Sprache oder zur Niederschrift der Geschäftsstelle einzulegen. Der Widerspruch kann auch zur Niederschrift der Geschäftsstelle eines jeden Amtsgerichtes abgegeben werden. Die Einlegung ist auch durch Übertragung eines elektronischen Dokuments an die elektronische Poststelle des Gerichts möglich. Das elektronische Dokument muss für die Bearbeitung durch das Gericht geeignet und mit einer qualifizierten elektronischen Signatur der verantwortenden Person versehen sein oder von der verantwortenden Person signiert und auf einem sicheren Übermittlungsweg gemäß § 130a ZPO nach näherer Maßgabe der Verordnung über die technischen Rahmenbedingungen des elektronischen Rechtsverkehrs und über das besondere elektronische Behördenpostfach (BGBl. I, S.3803) eingereicht werden. Weitere Informationen erhalten Sie auf der Internetseite www.justiz.de.\nDer Widerspruch muss spätestens innerhalb der gesetzten Frist nach dem Datum der Bekanntmachung der Löschungsankündigung bei dem Amtsgericht - Registergericht - Düsseldorf eingegangen sein.  Dies gilt auch dann, wenn der Widerspruch zur Niederschrift der Geschäftsstelle eines anderen Amtsgerichtes abgegeben wurde. Die Frist beginnt mit dem Tage der Bekanntmachung der Löschungsankündigung in dem für die Bekanntmachung der Eintragungen in das Handelsregister bestimmten elektronischen Informations- und Kommunikationssystem nach § 10 des Handelsgesetzbuches. Fällt das Ende der Frist auf einen Sonntag, einen allgemeinen Feiertag oder Sonnabend, so endet die Frist mit Ablauf des nächsten Werktages.\nDer Widerspruch muss die Bezeichnung der angefochtenen Löschungsankündigung sowie die Erklärung enthalten, dass Widerspruch gegen diese Löschungsankündigung eingelegt wird. Er ist zu unterzeichnen und soll begründet werden."
    },
    {
      "date": "2025-08-06",
      "id": "119630",
      "original_text": "Registerbekanntmachung nach dem Umwandlungsgesetz\nNordrhein-Westfalen Amtsgericht Wuppertal HRA 25774\nformita Unternehmensberatung Schmalbrock e.K. – Mettmann",
      "type": "Registerbekanntmachung nach dem Umwandlungsgesetz",
      "state": "Nordrhein-Westfalen",
      "amtsgericht": "Amtsgericht Wuppertal",
      "registernummer": "HRA 25774",
      "registerart": "HRA",
      "company_name": "formita Unternehmensberatung Schmalbrock e.K.",
      "company_seat": "Mettmann",
      "details": "06.08.2025 (Bekanntmachungsdatum)\n\nNordrhein-Westfalen Amtsgericht Wuppertal HRA 25774\nRegisterbekanntmachung nach dem Umwandlungsgesetz 06.08.2025 (Eintragungsdatum)\n\nformita Unternehmensberatung Schmalbrock e.K.\nEinzelkaufmann / Einzelkauffrau\nMettmann\n\nDen Gläubigern der an der Verschmelzung beteiligten Rechtsträger ist, wenn sie binnen sechs Monaten nach dem Tag, an dem die Eintragung der Verschmelzung in das Register des Sitzes desjenigen Rechtsträgers, dessen Gläubiger sie sind, nach § 19 Absatz 3 UmwG als bekanntgemacht gilt, ihren Anspruch nach Grund und Höhe schriftlich anmelden, Sicherheit zu leisten, soweit sie nicht Befriedigung verlangen können. Dieses Recht steht den Gläubigern jedoch nur zu, wenn sie glaubhaft machen, dass durch die Verschmelzung die Erfüllung ihrer Forderung gefährdet wird."
    },
    {
      "date": "2025-08-06",
      "id": "119631",
      "original_text": "Registerbekanntmachung nach dem Umwandlungsgesetz\nNordrhein-Westfalen Amtsgericht Steinfurt HRA 6035\nDie Netz WG GmbH & Co. KG – Rheine",
      "type": "Registerbekanntmachung nach dem Umwandlungsgesetz",
      "state": "Nordrhein-Westfalen",
      "amtsgericht": "Amtsgericht Steinfurt",
      "registernummer": "HRA 6035",
      "registerart": "HRA",
      "company_name": "Die Netz WG GmbH & Co. KG",
      "company_seat": "Rheine",
      "details": "06.08.2025 (Bekanntmachungsdatum)\n\nNordrhein-Westfalen Amtsgericht Steinfurt HRA 6035\nRegisterbekanntmachung nach dem Umwandlungsgesetz 06.08.2025 (Eintragungsdatum)\n\nDie Netz WG GmbH & Co. KG\nKommanditgesellschaft\nRheine\n\nDen Gläubigern der an der #DV.UmF(Text=\"Bitte wählen Sie die zutreffende Art nach UmwG aus!\",Eingabe=\"Verschmelzung\",\"Aufspaltung\",\"Abspaltung\",\"Ausgliederung\",\"Vermögensübertragung\",\"formwechselnden Umwandlung\") beteiligten Rechtsträger ist, wenn sie binnen sechs Monaten nach dem Tag, an dem die Eintragung der #DV.UmF in das Register des Sitzes #DV.RTr(Text=\"Bitte wählen Sie aus, ob ein oder mehrere andere Rechtsträger betroffen sind!\",Eingabe=\"desjenigen Rechtsträgers, dessen Gläubiger\",\"derjenigen Rechtsträger deren Gläubiger\") sie sind, nach § 19 Absatz 3 UmwG als bekanntgemacht gilt, ihren Anspruch nach Grund und Höhe schriftlich anmelden, Sicherheit zu leisten, soweit sie nicht Befriedigung verlangen können. Dieses Recht steht den Gläubigern jedoch nur zu, wenn sie glaubhaft machen, dass durch die #DV.UmF die Erfüllung ihrer Forderung gefährdet wird."
    },
    {
      "date": "2025-08-06",
      "id": "119632",
      "original_text": "Registerbekanntmachung nach dem Umwandlungsgesetz\nNordrhein-Westfalen Amtsgericht Münster HRB 5245\nsynvert consulting GmbH – Münster",
      "type": "Registerbekanntmachung nach dem Umwandlungsgesetz",
      "state": "Nordrhein-Westfalen",
      "amtsgericht": "Amtsgericht Münster",
      "registernummer": "HRB 5245",
      "registerart": "HRB",
      "company_name": "synvert consulting GmbH",
      "company_seat": "Münster",
      "details": "06.08.2025 (Bekanntmachungsdatum)\n\nNordrhein-Westfalen Amtsgericht Münster HRB 5245\nRegisterbekanntmachung nach dem Umwandlungsgesetz 06.08.2025 (Eintragungsdatum)\n\nsynvert consulting GmbH\nGesellschaft mit beschränkter Haftung\nMünster\n\nDen Gläubigern der an der Verschmelzung beteiligten Rechtsträger ist, wenn sie binnen sechs Monaten nach dem Tag, an dem die Eintragung der Verschmelzung in das Register des Sitzes desjenigen Rechtsträgers, dessen Gläubiger sie sind, nach § 19 Absatz 3 UmwG als bekanntgemacht gilt, ihren Anspruch nach Grund und Höhe schriftlich anmelden, Sicherheit zu leisten, soweit sie nicht Befriedigung verlangen können. Dieses Recht steht den Gläubigern jedoch nur zu, wenn sie glaubhaft machen, dass durch die Verschmelzung die Erfüllung ihrer Forderung gefährdet wird."
    },
    {
      "date": "2025-08-06",
      "id": "119633",
      "original_text": "Löschungsankündigung\nNordrhein-Westfalen Amtsgericht Mönchengladbach HRB 12877\nCubar Europa Gastronomiebetriebe GmbH – Mönchengladbach",
      "type": "Löschungsankündigung",
      "state": "Nordrhein-Westfalen",
      "amtsgericht": "Amtsgericht Mönchengladbach",
      "registernummer": "HRB 12877",
      "registerart": "HRB",
      "company_name": "Cubar Europa Gastronomiebetriebe GmbH",
      "company_seat": "Mönchengladbach",
      "details": "06.08.2025 (Bekanntmachungsdatum)\n\nNordrhein-Westfalen Amtsgericht Mönchengladbach HRB 12877\nLöschungsankündigung\n\nCubar Europa Gastronomiebetriebe GmbH\nGesellschaft mit beschränkter Haftung\nMönchengladbach\n\nCubar Europa Gastronomiebetriebe GmbH, Mönchengladbach (Amtsgericht Mönchengladbach, HRB 12877).\nDas Registergericht beabsichtigt, die im Handelsregister eingetragene Gesellschaft gemäß § 394 Absatz 1 FamFG wegen Vermögenslosigkeit von Amts wegen zu löschen. Gegen diese Verfügung kann Widerspruch eingelegt werden. Die Frist zur Erhebung eines Widerspruchs gegen die beabsichtigte Löschung von Amts wegen ist auf drei Monate festgesetzt."
    },
    {
      "date": "2025-08-06",
      "id": "119634",
      "original_text": "Löschungsankündigung\nNordrhein-Westfalen Amtsgericht Wuppertal HRB 20337\nWebPromotion GmbH – Wuppertal",
      "type": "Löschungsankündigung",
      "state": "Nordrhein-Westfalen",
      "amtsgericht": "Amtsgericht Wuppertal",
      "registernummer": "HRB 20337",
      "registerart": "HRB",
      "company_name": "WebPromotion GmbH",
      "company_seat": "Wuppertal",
      "details": "06.08.2025 (Bekanntmachungsdatum)\n\nNordrhein-Westfalen Amtsgericht Wuppertal HRB 20337\nLöschungsankündigung\n\nWebPromotion GmbH\nGesellschaft mit beschränkter Haftung\nWuppertal\n\nDas Registergericht beabsichtigt die Gesellschaft von Amts wegen nach § 394 FamFG zu löschen. Die Frist zur Erhebung eines Widerspruchs ist auf einen Monat festgesetzt."
    },
    {
      "date": "2025-08-06",
      "id": "119635",
      "original_text": "Registerbekanntmachung nach dem Umwandlungsgesetz\nNordrhein-Westfalen Amtsgericht Düsseldorf HRB 10134\nA.T. Kearney Gesellschaft mit beschränkter Haftung – Düsseldorf",
      "type": "Registerbekanntmachung nach dem Umwandlungsgesetz",
      "state": "Nordrhein-Westfalen",
      "amtsgericht": "Amtsgericht Düsseldorf",
      "registernummer": "HRB 10134",
      "registerart": "HRB",
      "company_name": "A.T. Kearney Gesellschaft mit beschränkter Haftung",
      "company_seat": "Düsseldorf",
      "details": "06.08.2025 (Bekanntmachungsdatum)\n\nNordrhein-Westfalen Amtsgericht Düsseldorf HRB 10134\nRegisterbekanntmachung nach dem Umwandlungsgesetz 06.08.2025 (Eintragungsdatum)\n\nA.T. Kearney Gesellschaft mit beschränkter Haftung\nGesellschaft mit beschränkter Haftung\nDüsseldorf\n\nDen Gläubigern der an der Verschmelzung beteiligten Rechtsträger ist, wenn sie binnen sechs Monaten nach dem Tag, an dem die Eintragung der Verschmelzung in das Register des Sitzes desjenigen Rechtsträgers, dessen Gläubiger sie sind, nach § 19 Absatz 3 UmwG als bekanntgemacht gilt, ihren Anspruch nach Grund und Höhe schriftlich anmelden, Sicherheit zu leisten, soweit sie nicht Befriedigung verlangen können. Dieses Recht steht den Gläubigern jedoch nur zu, wenn sie glaubhaft machen, dass durch die Verschmelzung die Erfüllung ihrer Forderung gefährdet wird."
    },
    {
      "date": "2025-08-06",
      "id": "119636",
      "original_text": "Einreichung neuer Dokumente\nNordrhein-Westfalen Amtsgericht Iserlohn HRB 5292\nVossloh Aktiengesellschaft – Werdohl",
      "type": "Einreichung neuer Dokumente",
      "state": "Nordrhein-Westfalen",
      "amtsgericht": "Amtsgericht Iserlohn",
      "registernummer": "HRB 5292",
      "registerart": "HRB",
      "company_name": "Vossloh Aktiengesellschaft",
      "company_seat": "Werdohl",
      "details": "06.08.2025 (Bekanntmachungsdatum)\n\nNordrhein-Westfalen Amtsgericht Iserlohn HRB 5292\nEinreichung neuer Dokumente 04.08.2025 (Eintragungsdatum)\n\nVossloh Aktiengesellschaft\nAktiengesellschaft\nWerdohl\n\nDem Registergericht ist eine neue Liste der Mitglieder des Aufsichtsrates eingereicht worden."
    },
    {
      "date": "2025-08-06",
      "id": "119637",
      "original_text": "Registerbekanntmachung nach dem Umwandlungsgesetz\nNordrhein-Westfalen Amtsgericht Düsseldorf HRB 71811\nFlyers CNV GmbH – Düsseldorf",
      "type": "Registerbekanntmachung nach dem Umwandlungsgesetz",
      "state": "Nordrhein-Westfalen",
      "amtsgericht": "Amtsgericht Düsseldorf",
      "registernummer": "HRB 71811",
      "registerart": "HRB",
      "company_name": "Flyers CNV GmbH",
      "company_seat": "Düsseldorf",
      "details": "06.08.2025 (Bekanntmachungsdatum)\n\nNordrhein-Westfalen Amtsgericht Düsseldorf HRB 71811\nRegisterbekanntmachung nach dem Umwandlungsgesetz 06.08.2025 (Eintragungsdatum)\n\nFlyers CNV GmbH\nGesellschaft mit beschränkter Haftung\nDüsseldorf\n\nDen Gläubigern der an der Verschmelzung beteiligten Rechtsträger ist, wenn sie binnen sechs Monaten nach dem Tag, an dem die Eintragung der Verschmelzung in das Register des Sitzes desjenigen Rechtsträgers, dessen Gläubiger sie sind, nach § 19 Absatz 3 UmwG als bekanntgemacht gilt, ihren Anspruch nach Grund und Höhe schriftlich anmelden, Sicherheit zu leisten, soweit sie nicht Befriedigung verlangen können. Dieses Recht steht den Gläubigern jedoch nur zu, wenn sie glaubhaft machen, dass durch die Verschmelzung die Erfüllung ihrer Forderung gefährdet wird."
    },
    {
      "date": "2025-08-06",
      "id": "119638",
      "original_text": "Registerbekanntmachung nach dem Umwandlungsgesetz\nNordrhein-Westfalen Amtsgericht Hagen HRB 2786\nDräger MSI GmbH – Hagen",
      "type": "Registerbekanntmachung nach dem Umwandlungsgesetz",
      "state": "Nordrhein-Westfalen",
      "amtsgericht": "Amtsgericht Hagen",
      "registernummer": "HRB 2786",
      "registerart": "HRB",
      "company_name": "Dräger MSI GmbH",
      "company_seat": "Hagen",
      "details": "06.08.2025 (Bekanntmachungsdatum)\n\nNordrhein-Westfalen Amtsgericht Hagen HRB 2786\nRegisterbekanntmachung nach dem Umwandlungsgesetz 05.08.2025 (Eintragungsdatum)\n\nDräger MSI GmbH\nGesellschaft mit beschränkter Haftung\nHagen\n\nDie Gesellschaft hat Gläubigern, deren Forderungen vor dieser Bekanntmachung begründet worden sind, Sicherheit zu leisten, soweit sie nicht Befriedigung verlangen können, wenn sie sich binnen sechs Monaten zu diesem Zweck melden.Den Gläubigern der an der Verschmelzung beteiligten Rechtsträger ist, wenn sie binnen sechs Monaten nach dem Tag, an dem die Eintragung der Verschmelzung in das Register des Sitzes desjenigen Rechtsträgers, dessen Gläubiger sie sind, nach § 19 Absatz 3 UmwG als bekanntgemacht gilt, ihren Anspruch nach Grund und Höhe schriftlich anmelden, Sicherheit zu leisten, soweit sie nicht Befriedigung verlangen können. Dieses Recht steht den Gläubigern jedoch nur zu, wenn sie glaubhaft machen, dass durch die Verschmelzung die Erfüllung ihrer Forderung gefährdet wird."
    },
    {
      "date": "2025-08-06",
      "id": "119639",
      "original_text": "Einreichung neuer Dokumente\nNordrhein-Westfalen Amtsgericht Köln HRB 1005\nDEG-Deutsche Investitions- und Entwicklungsgesellschaft mbH – Köln",
      "type": "Einreichung neuer Dokumente",
      "state": "Nordrhein-Westfalen",
      "amtsgericht": "Amtsgericht Köln",
      "registernummer": "HRB 1005",
      "registerart": "HRB",
      "company_name": "DEG-Deutsche Investitions- und Entwicklungsgesellschaft mbH",
      "company_seat": "Köln",
      "details": "06.08.2025 (Bekanntmachungsdatum)\n\nNordrhein-Westfalen Amtsgericht Köln HRB 1005\nEinreichung neuer Dokumente 06.08.2025 (Eintragungsdatum)\n\nDEG-Deutsche Investitions- und Entwicklungsgesellschaft mbH\nGesellschaft mit beschränkter Haftung\nKöln\n\nDem Registergericht ist eine neue Liste der Mitglieder des Aufsichtsrates eingereicht worden."
    },
    {
      "date": "2025-08-06",
      "id": "119640",
      "original_text": "Registerbekanntmachung nach dem Umwandlungsgesetz\nNordrhein-Westfalen Amtsgericht Steinfurt HRB 13913\nBSM GmbH – Rheine",
      "type": "Registerbekanntmachung nach dem Umwandlungsgesetz",
      "state": "Nordrhein-Westfalen",
      "amtsgericht": "Amtsgericht Steinfurt",
      "registernummer": "HRB 13913",
      "registerart": "HRB",
      "company_name": "BSM GmbH",
      "company_seat": "Rheine",
      "details": "06.08.2025 (Bekanntmachungsdatum)\n\nNordrhein-Westfalen Amtsgericht Steinfurt HRB 13913\nRegisterbekanntmachung nach dem Umwandlungsgesetz 06.08.2025 (Eintragungsdatum)\n\nBSM GmbH\nGesellschaft mit beschränkter Haftung\nRheine\n\nDen Gläubigern der an der Verschmelzung beteiligten Rechtsträger ist, wenn sie binnen sechs Monaten nach dem Tag, an dem die Eintragung der Verschmelzung in das Register des Sitzes desjenigen Rechtsträgers, dessen Gläubiger sie sind, nach § 19 Absatz 3 UmwG als bekanntgemacht gilt, ihren Anspruch nach Grund und Höhe schriftlich anmelden, Sicherheit zu leisten, soweit sie nicht Befriedigung verlangen können. Dieses Recht steht den Gläubigern jedoch nur zu, wenn sie glaubhaft machen, dass durch die Verschmelzung die Erfüllung ihrer Forderung gefährdet wird."
    },
    {
      "date": "2025-08-06",
      "id": "119641",
      "original_text": "Registerbekanntmachung nach dem Umwandlungsgesetz\nNordrhein-Westfalen Amtsgericht Düsseldorf HRB 37894\nSoftware Engineering GmbH – Düsseldorf",
      "type": "Registerbekanntmachung nach dem Umwandlungsgesetz",
      "state": "Nordrhein-Westfalen",
      "amtsgericht": "Amtsgericht Düsseldorf",
      "registernummer": "HRB 37894",
      "registerart": "HRB",
      "company_name": "Software Engineering GmbH",
      "company_seat": "Düsseldorf",
      "details": "06.08.2025 (Bekanntmachungsdatum)\n\nNordrhein-Westfalen Amtsgericht Düsseldorf HRB 37894\nRegisterbekanntmachung nach dem Umwandlungsgesetz 06.08.2025 (Eintragungsdatum)\n\nSoftware Engineering GmbH\nGesellschaft mit beschränkter Haftung\nDüsseldorf\n\nDen Gläubigern der an der Verschmelzung beteiligten Rechtsträger ist, wenn sie binnen sechs Monaten nach dem Tag, an dem die Eintragung der Verschmelzung in das Register des Sitzes desjenigen Rechtsträgers, dessen Gläubiger sie sind, nach § 19 Absatz 3 UmwG als bekanntgemacht gilt, ihren Anspruch nach Grund und Höhe schriftlich anmelden, Sicherheit zu leisten, soweit sie nicht Befriedigung verlangen können. Dieses Recht steht den Gläubigern jedoch nur zu, wenn sie glaubhaft machen, dass durch die Verschmelzung die Erfüllung ihrer Forderung gefährdet wird."
    },
    {
      "date": "2025-08-06",
      "id": "119642",
      "original_text": "Registerbekanntmachung nach dem Umwandlungsgesetz\nNordrhein-Westfalen Amtsgericht Münster HRB 22512\nAug. Winkhaus SE – Telgte",
      "type": "Registerbekanntmachung nach dem Umwandlungsgesetz",
      "state": "Nordrhein-Westfalen",
      "amtsgericht": "Amtsgericht Münster",
      "registernummer": "HRB 22512",
      "registerart": "HRB",
      "company_name": "Aug. Winkhaus SE",
      "company_seat": "Telgte",
      "details": "06.08.2025 (Bekanntmachungsdatum)\n\nNordrhein-Westfalen Amtsgericht Münster HRB 22512\nRegisterbekanntmachung nach dem Umwandlungsgesetz 06.08.2025 (Eintragungsdatum)\n\nAug. Winkhaus SE\nEuropäische Aktiengesellschaft (SE)\nTelgte\n\nDen Gläubigern der an der Verschmelzung beteiligten Rechtsträger ist, wenn sie binnen sechs Monaten nach dem Tag, an dem die Eintragung der Verschmelzung in das Register des Sitzes desjenigen Rechtsträgers, dessen Gläubiger sie sind, nach § 19 Absatz 3 UmwG als bekanntgemacht gilt, ihren Anspruch nach Grund und Höhe schriftlich anmelden, Sicherheit zu leisten, soweit sie nicht Befriedigung verlangen können. Dieses Recht steht den Gläubigern jedoch nur zu, wenn sie glaubhaft machen, dass durch die Verschmelzung die Erfüllung ihrer Forderung gefährdet wird."
    },
    {
      "date": "2025-08-06",
      "id": "119643",
      "original_text": "Löschungsankündigung\nNordrhein-Westfalen Amtsgericht Köln HRB 89251\nFlash Logistik GmbH – Köln",
      "type": "Löschungsankündigung",
      "state": "Nordrhein-Westfalen",
      "amtsgericht": "Amtsgericht Köln",
      "registernummer": "HRB 89251",
      "registerart": "HRB",
      "company_name": "Flash Logistik GmbH",
      "company_seat": "Köln",
      "details": "06.08.2025 (Bekanntmachungsdatum)\n\nNordrhein-Westfalen Amtsgericht Köln HRB 89251\nLöschungsankündigung\n\nFlash Logistik GmbH\nGesellschaft mit beschränkter Haftung\nKöln\n\nDas Registergericht beabsichtigt die Gesellschaft von Amts wegen nach § 394 FamFG zu löschen. Die Frist zur Erhebung eines Widerspruchs ist auf einen Monat festgesetzt."
    },
    {
      "date": "2025-08-06",
      "id": "119644",
      "original_text": "Registerbekanntmachung nach dem Umwandlungsgesetz\nNordrhein-Westfalen Amtsgericht Köln HRB 52498\npfenning solutions GmbH – Frechen",
      "type": "Registerbekanntmachung nach dem Umwandlungsgesetz",
      "state": "Nordrhein-Westfalen",
      "amtsgericht": "Amtsgericht Köln",
      "registernummer": "HRB 52498",
      "registerart": "HRB",
      "company_name": "pfenning solutions GmbH",
      "company_seat": "Frechen",
      "details": "06.08.2025 (Bekanntmachungsdatum)\n\nNordrhein-Westfalen Amtsgericht Köln HRB 52498\nRegisterbekanntmachung nach dem Umwandlungsgesetz 06.08.2025 (Eintragungsdatum)\n\npfenning solutions GmbH\nGesellschaft mit beschränkter Haftung\nFrechen\n\nDen Gläubigern der an der Verschmelzung beteiligten Rechtsträger ist, wenn sie binnen sechs Monaten nach dem Tag, an dem die Eintragung der Verschmelzung in das Register des Sitzes desjenigen Rechtsträgers, dessen Gläubiger sie sind, nach § 19 Absatz 3 UmwG als bekanntgemacht gilt, ihren Anspruch nach Grund und Höhe schriftlich anmelden, Sicherheit zu leisten, soweit sie nicht Befriedigung verlangen können. Dieses Recht steht den Gläubigern jedoch nur zu, wenn sie glaubhaft machen, dass durch die Verschmelzung die Erfüllung ihrer Forderung gefährdet wird."
    },
    {
      "date": "2025-08-06",
      "id": "119645",
      "original_text": "Löschungsankündigung\nNordrhein-Westfalen Amtsgericht Düsseldorf HRB 75113\nMTC GmbH – Düsseldorf",
      "type": "Löschungsankündigung",
      "state": "Nordrhein-Westfalen",
      "amtsgericht": "Amtsgericht Düsseldorf",
      "registernummer": "HRB 75113",
      "registerart": "HRB",
      "company_name": "MTC GmbH",
      "company_seat": "Düsseldorf",
      "details": "06.08.2025 (Bekanntmachungsdatum)\n\nNordrhein-Westfalen Amtsgericht Düsseldorf HRB 75113\nLöschungsankündigung\n\nMTC GmbH\nGesellschaft mit beschränkter Haftung\nDüsseldorf\n\nDas Registergericht beabsichtigt die Gesellschaft von Amts wegen nach § 394 FamFG zu löschen. Die Frist zur Erhebung eines Widerspruchs ist auf 3 Wochen festgesetzt.\n\nRechtsbehelfsbelehrung:\nDas Widerspruchsrecht steht jedem zu, der an der Unterlassung der Löschung ein berechtigtes Interesse hat. Der Widerspruch ist bei dem Amtsgericht Düsseldorf -Registergericht-, Werdener Straße 1, 40227 Düsseldorf schriftlich in deutscher Sprache oder zur Niederschrift der Geschäftsstelle einzulegen. Der Widerspruch kann auch zur Niederschrift der Geschäftsstelle eines jeden Amtsgerichtes abgegeben werden. Die Einlegung ist auch durch Übertragung eines elektronischen Dokuments an die elektronische Poststelle des Gerichts möglich. Das elektronische Dokument muss für die Bearbeitung durch das Gericht geeignet und mit einer qualifizierten elektronischen Signatur der verantwortenden Person versehen sein oder von der verantwortenden Person signiert und auf einem sicheren Übermittlungsweg gemäß § 130a ZPO nach näherer Maßgabe der Verordnung über die technischen Rahmenbedingungen des elektronischen Rechtsverkehrs und über das besondere elektronische Behördenpostfach (BGBl. I, S.3803) eingereicht werden. Weitere Informationen erhalten Sie auf der Internetseite www.justiz.de.\nDer Widerspruch muss spätestens innerhalb der gesetzten Frist nach dem Datum der Bekanntmachung der Löschungsankündigung bei dem Amtsgericht - Registergericht - Düsseldorf eingegangen sein.  Dies gilt auch dann, wenn der Widerspruch zur Niederschrift der Geschäftsstelle eines anderen Amtsgerichtes abgegeben wurde. Die Frist beginnt mit dem Tage der Bekanntmachung der Löschungsankündigung in dem für die Bekanntmachung der Eintragungen in das Handelsregister bestimmten elektronischen Informations- und Kommunikationssystem nach § 10 des Handelsgesetzbuches. Fällt das Ende der Frist auf einen Sonntag, einen allgemeinen Feiertag oder Sonnabend, so endet die Frist mit Ablauf des nächsten Werktages.\nDer Widerspruch muss die Bezeichnung der angefochtenen Löschungsankündigung sowie die Erklärung enthalten, dass Widerspruch gegen diese Löschungsankündigung eingelegt wird. Er ist zu unterzeichnen und soll begründet werden."
    },
    {
      "date": "2025-08-06",
      "id": "119646",
      "original_text": "Registerbekanntmachung nach dem Umwandlungsgesetz\nNordrhein-Westfalen Amtsgericht Düsseldorf HRB 46756\nHANRO Deutschland GmbH – Düsseldorf",
      "type": "Registerbekanntmachung nach dem Umwandlungsgesetz",
      "state": "Nordrhein-Westfalen",
      "amtsgericht": "Amtsgericht Düsseldorf",
      "registernummer": "HRB 46756",
      "registerart": "HRB",
      "company_name": "HANRO Deutschland GmbH",
      "company_seat": "Düsseldorf",
      "details": "06.08.2025 (Bekanntmachungsdatum)\n\nNordrhein-Westfalen Amtsgericht Düsseldorf HRB 46756\nRegisterbekanntmachung nach dem Umwandlungsgesetz 06.08.2025 (Eintragungsdatum)\n\nHANRO Deutschland GmbH\nGesellschaft mit beschränkter Haftung\nDüsseldorf\n\nDen Gläubigern der an der Verschmelzung beteiligten Rechtsträger ist, wenn sie binnen sechs Monaten nach dem Tag, an dem die Eintragung der Verschmelzung in das Register des Sitzes desjenigen Rechtsträgers, dessen Gläubiger sie sind, nach § 19 Absatz 3 UmwG als bekanntgemacht gilt, ihren Anspruch nach Grund und Höhe schriftlich anmelden, Sicherheit zu leisten, soweit sie nicht Befriedigung verlangen können. Dieses Recht steht den Gläubigern jedoch nur zu, wenn sie glaubhaft machen, dass durch die Verschmelzung die Erfüllung ihrer Forderung gefährdet wird."
    },
    {
      "date": "2025-08-06",
      "id": "119647",
      "original_text": "Registerbekanntmachung nach dem Umwandlungsgesetz\nNordrhein-Westfalen Amtsgericht Köln HRB 52498\npfenning solutions GmbH – Frechen",
      "type": "Registerbekanntmachung nach dem Umwandlungsgesetz",
      "state": "Nordrhein-Westfalen",
      "amtsgericht": "Amtsgericht Köln",
      "registernummer": "HRB 52498",
      "registerart": "HRB",
      "company_name": "pfenning solutions GmbH",
      "company_seat": "Frechen",
      "details": "06.08.2025 (Bekanntmachungsdatum)\n\nNordrhein-Westfalen Amtsgericht Köln HRB 52498\nRegisterbekanntmachung nach dem Umwandlungsgesetz 06.08.2025 (Eintragungsdatum)\n\npfenning solutions GmbH\nGesellschaft mit beschränkter Haftung\nFrechen\n\nDen Gläubigern der an der Verschmelzung beteiligten Rechtsträger ist, wenn sie binnen sechs Monaten nach dem Tag, an dem die Eintragung der Verschmelzung in das Register des Sitzes desjenigen Rechtsträgers, dessen Gläubiger sie sind, nach § 19 Absatz 3 UmwG als bekanntgemacht gilt, ihren Anspruch nach Grund und Höhe schriftlich anmelden, Sicherheit zu leisten, soweit sie nicht Befriedigung verlangen können. Dieses Recht steht den Gläubigern jedoch nur zu, wenn sie glaubhaft machen, dass durch die Verschmelzung die Erfüllung ihrer Forderung gefährdet wird."
    },
    {
      "date": "2025-08-06",
      "id": "119648",
      "original_text": "Registerbekanntmachung nach dem Umwandlungsgesetz\nNordrhein-Westfalen Amtsgericht Dortmund HRB 18207 früher Amtsgericht Lünen\nSARVAL GmbH – Selm",
      "type": "Registerbekanntmachung nach dem Umwandlungsgesetz",
      "state": "Nordrhein-Westfalen",
      "amtsgericht": "Amtsgericht Dortmund",
      "registernummer": "HRB 18207",
      "registerart": "HRB",
      "company_name": "SARVAL GmbH",
      "company_seat": "Selm",
      "former_amtsgericht": "Lünen",
      "details": "06.08.2025 (Bekanntmachungsdatum)\n\nNordrhein-Westfalen Amtsgericht Dortmund HRB 18207 früher Amtsgericht Lünen\nRegisterbekanntmachung nach dem Umwandlungsgesetz 06.08.2025 (Eintragungsdatum)\n\nSARVAL GmbH\nGesellschaft mit beschränkter Haftung\nSelm\n\nDen Gläubigern der an der Verschmelzung beteiligten Rechtsträger ist, wenn sie binnen sechs Monaten nach dem Tag, an dem die Eintragung der Verschmelzung in das Register des Sitzes derjenigen Rechtsträger deren Gläubiger sie sind, nach § 19 Absatz 3 UmwG als bekanntgemacht gilt, ihren Anspruch nach Grund und Höhe schriftlich anmelden, Sicherheit zu leisten, soweit sie nicht Befriedigung verlangen können. Dieses Recht steht den Gläubigern jedoch nur zu, wenn sie glaubhaft machen, dass durch die Verschmelzung die Erfüllung ihrer Forderung gefährdet wird."
    },
    {
      "date": "2025-08-06",
      "id": "119649",
      "original_text": "Löschungsankündigung\nNordrhein-Westfalen Amtsgericht Köln HRB 36666\nADEX REISEN GmbH – Köln",
      "type": "Löschungsankündigung",
      "state": "Nordrhein-Westfalen",
      "amtsgericht": "Amtsgericht Köln",
      "registernummer": "HRB 36666",
      "registerart": "HRB",
      "company_name": "ADEX REISEN GmbH",
      "company_seat": "Köln",
      "details": "06.08.2025 (Bekanntmachungsdatum)\n\nNordrhein-Westfalen Amtsgericht Köln HRB 36666\nLöschungsankündigung\n\nADEX REISEN GmbH\nGesellschaft mit beschränkter Haftung\nKöln\n\nDas Registergericht beabsichtigt die Gesellschaft von Amts wegen nach § 394 FamFG zu löschen. Die Frist zur Erhebung eines Widerspruchs ist auf einen Monat festgesetzt."
    },
    {
      "date": "2025-08-06",
      "id": "119650",
      "original_text": "Einreichung neuer Dokumente\nNordrhein-Westfalen Amtsgericht Aachen HRB 4005\nS-UBG Aktiengesellschaft Unternehmensbeteiligungsgesellschaft für die Regionen Aachen, Krefeld und Mönchengladbach – Aachen",
      "type": "Einreichung neuer Dokumente",
      "state": "Nordrhein-Westfalen",
      "amtsgericht": "Amtsgericht Aachen",
      "registernummer": "HRB 4005",
      "registerart": "HRB",
      "company_name": "S-UBG Aktiengesellschaft Unternehmensbeteiligungsgesellschaft für die Regionen Aachen, Krefeld und Mönchengladbach",
      "company_seat": "Aachen",
      "details": "06.08.2025 (Bekanntmachungsdatum)\n\nNordrhein-Westfalen Amtsgericht Aachen HRB 4005\nEinreichung neuer Dokumente\n\nS-UBG Aktiengesellschaft Unternehmensbeteiligungsgesellschaft für die Regionen Aachen, Krefeld und Mönchengladbach\nAktiengesellschaft\nAachen\n\nDem Registergericht ist eine neue Liste der Mitglieder des Aufsichtsrates eingereicht worden."
    },
    {
      "date": "2025-08-06",
      "id": "119651",
      "original_text": "Einreichung neuer Dokumente\nNordrhein-Westfalen Amtsgericht Bielefeld HRB 39359\nBBF-Bielefelder Bäder und Freizeit GmbH – Bielefeld",
      "type": "Einreichung neuer Dokumente",
      "state": "Nordrhein-Westfalen",
      "amtsgericht": "Amtsgericht Bielefeld",
      "registernummer": "HRB 39359",
      "registerart": "HRB",
      "company_name": "BBF-Bielefelder Bäder und Freizeit GmbH",
      "company_seat": "Bielefeld",
      "details": "06.08.2025 (Bekanntmachungsdatum)\n\nNordrhein-Westfalen Amtsgericht Bielefeld HRB 39359\nEinreichung neuer Dokumente 06.08.2025 (Eintragungsdatum)\n\nBBF-Bielefelder Bäder und Freizeit GmbH\nGesellschaft mit beschränkter Haftung\nBielefeld\n\nDem Registergericht ist eine neue Liste der Mitglieder des Aufsichtsrates eingereicht worden."
    },
    {
      "date": "2025-08-06",
      "id": "119652",
      "original_text": "Einreichung neuer Dokumente\nNordrhein-Westfalen Amtsgericht Münster HRB 14034\nCOMPO EXPERT GmbH – Münster",
      "type": "Einreichung neuer Dokumente",
      "state": "Nordrhein-Westfalen",
      "amtsgericht": "Amtsgericht Münster",
      "registernummer": "HRB 14034",
      "registerart": "HRB",
      "company_name": "COMPO EXPERT GmbH",
      "company_seat": "Münster",
      "details": "06.08.2025 (Bekanntmachungsdatum)\n\nNordrhein-Westfalen Amtsgericht Münster HRB 14034\nEinreichung neuer Dokumente\n\nCOMPO EXPERT GmbH\nGesellschaft mit beschränkter Haftung\nMünster\n\nDem Registergericht ist eine neue Liste der Mitglieder des Aufsichtsrates eingereicht worden."
    },
    {
      "date": "2025-08-06",
      "id": "119653",
      "original_text": "Einreichung neuer Dokumente\nNordrhein-Westfalen Amtsgericht Köln HRB 43252\nRenault Deutschland AG – Köln",
      "type": "Einreichung neuer Dokumente",
      "state": "Nordrhein-Westfalen",
      "amtsgericht": "Amtsgericht Köln",
      "registernummer": "HRB 43252",
      "registerart": "HRB",
      "company_name": "Renault Deutschland AG",
      "company_seat": "Köln",
      "details": "06.08.2025 (Bekanntmachungsdatum)\n\nNordrhein-Westfalen Amtsgericht Köln HRB 43252\nEinreichung neuer Dokumente\n\nRenault Deutschland AG\nAktiengesellschaft\nKöln\n\nDem Registergericht ist eine Liste der Mitglieder des Aufsichtsrates eingereicht worden."
    },
    {
      "date": "2025-08-06",
      "id": "119654",
      "original_text": "Registerbekanntmachung nach dem Umwandlungsgesetz\nNordrhein-Westfalen Amtsgericht Düsseldorf HRB 84636\nCS Public GmbH – Düsseldorf",
      "type": "Registerbekanntmachung nach dem Umwandlungsgesetz",
      "state": "Nordrhein-Westfalen",
      "amtsgericht": "Amtsgericht Düsseldorf",
      "registernummer": "HRB 84636",
      "registerart": "HRB",
      "company_name": "CS Public GmbH",
      "company_seat": "Düsseldorf",
      "details": "06.08.2025 (Bekanntmachungsdatum)\n\nNordrhein-Westfalen Amtsgericht Düsseldorf HRB 84636\nRegisterbekanntmachung nach dem Umwandlungsgesetz 06.08.2025 (Eintragungsdatum)\n\nCS Public GmbH\nGesellschaft mit beschränkter Haftung\nDüsseldorf\n\nDen Gläubigern der an der Verschmelzung beteiligten Rechtsträger ist, wenn sie binnen sechs Monaten nach dem Tag, an dem die Eintragung der Verschmelzung in das Register des Sitzes desjenigen Rechtsträgers, dessen Gläubiger sie sind, nach § 19 Absatz 3 UmwG als bekanntgemacht gilt, ihren Anspruch nach Grund und Höhe schriftlich anmelden, Sicherheit zu leisten, soweit sie nicht Befriedigung verlangen können. Dieses Recht steht den Gläubigern jedoch nur zu, wenn sie glaubhaft machen, dass durch die Verschmelzung die Erfüllung ihrer Forderung gefährdet wird."
    },
    {
      "date": "2025-08-06",
      "id": "119655",
      "original_text": "Registerbekanntmachung nach dem Umwandlungsgesetz\nNordrhein-Westfalen Amtsgericht Düsseldorf HRB 69399\nLIVE FAST DIE YOUNG Clothing GmbH – Düsseldorf",
      "type": "Registerbekanntmachung nach dem Umwandlungsgesetz",
      "state": "Nordrhein-Westfalen",
      "amtsgericht": "Amtsgericht Düsseldorf",
      "registernummer": "HRB 69399",
      "registerart": "HRB",
      "company_name": "LIVE FAST DIE YOUNG Clothing GmbH",
      "company_seat": "Düsseldorf",
      "details": "06.08.2025 (Bekanntmachungsdatum)\n\nNordrhein-Westfalen Amtsgericht Düsseldorf HRB 69399\nRegisterbekanntmachung nach dem Umwandlungsgesetz 06.08.2025 (Eintragungsdatum)\n\nLIVE FAST DIE YOUNG Clothing GmbH\nGesellschaft mit beschränkter Haftung\nDüsseldorf\n\nDen Gläubigern der an der Abspaltung beteiligten Rechtsträger ist, wenn sie binnen sechs Monaten nach dem Tag, an dem die Eintragung der Abspaltung in das Register des Sitzes desjenigen Rechtsträgers, dessen Gläubiger sie sind, nach § 19 Absatz 3 UmwG als bekanntgemacht gilt, ihren Anspruch nach Grund und Höhe schriftlich anmelden, Sicherheit zu leisten, soweit sie nicht Befriedigung verlangen können. Dieses Recht steht den Gläubigern jedoch nur zu, wenn sie glaubhaft machen, dass durch die Abspaltung die Erfüllung ihrer Forderung gefährdet wird."
    },
    {
      "date": "2025-08-06",
      "id": "119656",
      "original_text": "Einreichung neuer Dokumente\nNordrhein-Westfalen Amtsgericht Bochum HRB 1\nBochum-Gelsenkirchener Straßenbahnen Aktiengesellschaft – Bochum",
      "type": "Einreichung neuer Dokumente",
      "state": "Nordrhein-Westfalen",
      "amtsgericht": "Amtsgericht Bochum",
      "registernummer": "HRB 1",
      "registerart": "HRB",
      "company_name": "Bochum-Gelsenkirchener Straßenbahnen Aktiengesellschaft",
      "company_seat": "Bochum",
      "details": "06.08.2025 (Bekanntmachungsdatum)\n\nNordrhein-Westfalen Amtsgericht Bochum HRB 1\nEinreichung neuer Dokumente\n\nBochum-Gelsenkirchener Straßenbahnen Aktiengesellschaft\nAktiengesellschaft\nBochum\n\nDem Registergericht ist eine Liste der Mitglieder des Aufsichtsrates eingereicht worden."
    },
    {
      "date": "2025-08-06",
      "id": "119657",
      "original_text": "Registerbekanntmachung nach dem Umwandlungsgesetz\nNordrhein-Westfalen Amtsgericht Düsseldorf HRB 109855\nEhrenstraße 34 GmbH – Düsseldorf",
      "type": "Registerbekanntmachung nach dem Umwandlungsgesetz",
      "state": "Nordrhein-Westfalen",
      "amtsgericht": "Amtsgericht Düsseldorf",
      "registernummer": "HRB 109855",
      "registerart": "HRB",
      "company_name": "Ehrenstraße 34 GmbH",
      "company_seat": "Düsseldorf",
      "details": "06.08.2025 (Bekanntmachungsdatum)\n\nNordrhein-Westfalen Amtsgericht Düsseldorf HRB 109855\nRegisterbekanntmachung nach dem Umwandlungsgesetz 06.08.2025 (Eintragungsdatum)\n\nEhrenstraße 34 GmbH\nGesellschaft mit beschränkter Haftung\nDüsseldorf\n\nDen Gläubigern der an der Abspaltung beteiligten Rechtsträger ist, wenn sie binnen sechs Monaten nach dem Tag, an dem die Eintragung der Abspaltung in das Register des Sitzes desjenigen Rechtsträgers, dessen Gläubiger sie sind, nach § 19 Absatz 3 UmwG als bekanntgemacht gilt, ihren Anspruch nach Grund und Höhe schriftlich anmelden, Sicherheit zu leisten, soweit sie nicht Befriedigung verlangen können. Dieses Recht steht den Gläubigern jedoch nur zu, wenn sie glaubhaft machen, dass durch die Abspaltung die Erfüllung ihrer Forderung gefährdet wird."
    },
    {
      "date": "2025-08-06",
      "id": "119658",
      "original_text": "Registerbekanntmachung nach dem Umwandlungsgesetz\nNordrhein-Westfalen Amtsgericht Wuppertal HRB 35908\nRalf Hausmann Immo GmbH – Remscheid",
      "type": "Registerbekanntmachung nach dem Umwandlungsgesetz",
      "state": "Nordrhein-Westfalen",
      "amtsgericht": "Amtsgericht Wuppertal",
      "registernummer": "HRB 35908",
      "registerart": "HRB",
      "company_name": "Ralf Hausmann Immo GmbH",
      "company_seat": "Remscheid",
      "details": "06.08.2025 (Bekanntmachungsdatum)\n\nNordrhein-Westfalen Amtsgericht Wuppertal HRB 35908\nRegisterbekanntmachung nach dem Umwandlungsgesetz 31.07.2025 (Eintragungsdatum)\n\nRalf Hausmann Immo GmbH\nGesellschaft mit beschränkter Haftung\nRemscheid\n\nDen Gläubigern der an der formwechselnden Umwandlung beteiligten Rechtsträger ist, wenn sie binnen sechs Monaten nach dem Tag, an dem die Eintragung der formwechselnden Umwandlung in das Register des Sitzes desjenigen Rechtsträgers, dessen Gläubiger sie sind, nach § 19 Absatz 3 UmwG als bekanntgemacht gilt, ihren Anspruch nach Grund und Höhe schriftlich anmelden, Sicherheit zu leisten, soweit sie nicht Befriedigung verlangen können. Dieses Recht steht den Gläubigern jedoch nur zu, wenn sie glaubhaft machen, dass durch die formwechselnden Umwandlung die Erfüllung ihrer Forderung gefährdet wird."
    },
    {
      "date": "2025-08-06",
      "id": "119659",
      "original_text": "Einreichung neuer Dokumente\nNordrhein-Westfalen Amtsgericht Dortmund HRB 23169\nDOSU AG Wirtschaftsprüfungsgesellschaft – Dortmund",
      "type": "Einreichung neuer Dokumente",
      "state": "Nordrhein-Westfalen",
      "amtsgericht": "Amtsgericht Dortmund",
      "registernummer": "HRB 23169",
      "registerart": "HRB",
      "company_name": "DOSU AG Wirtschaftsprüfungsgesellschaft",
      "company_seat": "Dortmund",
      "details": "06.08.2025 (Bekanntmachungsdatum)\n\nNordrhein-Westfalen Amtsgericht Dortmund HRB 23169\nEinreichung neuer Dokumente\n\nDOSU AG Wirtschaftsprüfungsgesellschaft\nAktiengesellschaft\nDortmund\n\nDem Registergericht ist eine neue Liste der Mitglieder des Aufsichtsrates eingereicht worden."
    },
    {
      "date": "2025-08-06",
      "id": "119660",
      "original_text": "Registerbekanntmachung nach dem Umwandlungsgesetz\nThüringen Amtsgericht Jena HRB 206265\nSchwerlast Weise GmbH – Mörsdorf",
      "type": "Registerbekanntmachung nach dem Umwandlungsgesetz",
      "state": "Thüringen",
      "amtsgericht": "Amtsgericht Jena",
      "registernummer": "HRB 206265",
      "registerart": "HRB",
      "company_name": "Schwerlast Weise GmbH",
      "company_seat": "Mörsdorf",
      "details": "06.08.2025 (Bekanntmachungsdatum)\n\nThüringen Amtsgericht Jena HRB 206265\nRegisterbekanntmachung nach dem Umwandlungsgesetz 06.08.2025 (Eintragungsdatum)\n\nSchwerlast Weise GmbH\nGesellschaft mit beschränkter Haftung\nMörsdorf\n\nNicht eingetragen: Den Gläubigern der an der Verschmelzung beteiligten Rechtsträger, ist wenn sie binnen sechs Monaten nach dem Tag, an dem die Eintragung der Verschmelzung in das Register des Sitzes desjenigen Rechtsträgers, dessen Gläubiger sie sind,  nach § 19 Abs. 3 UmwG als bekanntgemacht gilt, ihren Anspruch nach Grund und Höhe schriftlich anmelden, Sicherheit zu leisten, soweit sie nicht Befriedigung verlangen können. Dieses Recht steht ihnen jedoch nur zu, wenn sie glaubhaft machen, daß durch die Verschmelzung die Erfüllung ihrer Forderung gefährdet wird."
    },
    {
      "date": "2025-08-06",
      "id": "119661",
      "original_text": "Löschungsankündigung\nThüringen Amtsgericht Jena HRB 502887\nHaustechnik Jung Verwaltungs GmbH – Gangloffsömmern",
      "type": "Löschungsankündigung",
      "state": "Thüringen",
      "amtsgericht": "Amtsgericht Jena",
      "registernummer": "HRB 502887",
      "registerart": "HRB",
      "company_name": "Haustechnik Jung Verwaltungs GmbH",
      "company_seat": "Gangloffsömmern",
      "details": "06.08.2025 (Bekanntmachungsdatum)\n\nThüringen Amtsgericht Jena HRB 502887\nLöschungsankündigung\n\nHaustechnik Jung Verwaltungs GmbH\nGesellschaft mit beschränkter Haftung\nGangloffsömmern\n\nDas Registergericht beabsichtigt, die im Handelsregister eingetragene Gesellschaft wegen Vermögenslosigkeit nach § 394 FamFG von Amts wegen zu löschen. Die Frist zur Erhebung eines Widerspruchs gegen die beabsichtigte Löschung wird auf 6 Wochen festgesetzt."
    },
    {
      "date": "2025-08-06",
      "id": "119662",
      "original_text": "Registerbekanntmachung nach dem Umwandlungsgesetz\nThüringen Amtsgericht Jena HRB 207195\nMaxiMum Krantechnik GmbH – Gera",
      "type": "Registerbekanntmachung nach dem Umwandlungsgesetz",
      "state": "Thüringen",
      "amtsgericht": "Amtsgericht Jena",
      "registernummer": "HRB 207195",
      "registerart": "HRB",
      "company_name": "MaxiMum Krantechnik GmbH",
      "company_seat": "Gera",
      "details": "06.08.2025 (Bekanntmachungsdatum)\n\nThüringen Amtsgericht Jena HRB 207195\nRegisterbekanntmachung nach dem Umwandlungsgesetz 06.08.2025 (Eintragungsdatum)\n\nMaxiMum Krantechnik GmbH\nGesellschaft mit beschränkter Haftung\nGera\n\nNicht eingetragen: Den Gläubigern der an der Verschmelzung beteiligten Rechtsträger, ist wenn sie binnen sechs Monaten nach dem Tag, an dem die Eintragung der Verschmelzung in das Register des Sitzes desjenigen Rechtsträgers, dessen Gläubiger sie sind,  nach § 19 Abs. 3 UmwG als bekanntgemacht gilt, ihren Anspruch nach Grund und Höhe schriftlich anmelden, Sicherheit zu leisten, soweit sie nicht Befriedigung verlangen können. Dieses Recht steht ihnen jedoch nur zu, wenn sie glaubhaft machen, daß durch die Verschmelzung die Erfüllung ihrer Forderung gefährdet wird."
    },
    {
      "date": "2025-08-06",
      "id": "119663",
      "original_text": "Sonstige Registerbekanntmachung\nHamburg Amtsgericht Hamburg HRB 102654\nMARCARD, STEIN & CO AG – Hamburg",
      "type": "Sonstige Registerbekanntmachung",
      "state": "Hamburg",
      "amtsgericht": "Amtsgericht Hamburg",
      "registernummer": "HRB 102654",
      "registerart": "HRB",
      "company_name": "MARCARD, STEIN & CO AG",
      "company_seat": "Hamburg",
      "details": "06.08.2025 (Bekanntmachungsdatum)\n\nHamburg Amtsgericht Hamburg HRB 102654\nSonstige Registerbekanntmachung\n\nMARCARD, STEIN & CO AG\nAktiengesellschaft\nHamburg\n\nAls nicht eingetragen wird bekannt gemacht: Liste des Aufsichtsrats wurde eingereicht."
    },
    {
      "date": "2025-08-06",
      "id": "119664",
      "original_text": "Registerbekanntmachung nach dem Umwandlungsgesetz\nHessen Amtsgericht Frankfurt am Main HRB 135393\nBlitz F24-449 GmbH – Frankfurt am Main",
      "type": "Registerbekanntmachung nach dem Umwandlungsgesetz",
      "state": "Hessen",
      "amtsgericht": "Amtsgericht Frankfurt am Main",
      "registernummer": "HRB 135393",
      "registerart": "HRB",
      "company_name": "Blitz F24-449 GmbH",
      "company_seat": "Frankfurt am Main",
      "details": "06.08.2025 (Bekanntmachungsdatum)\n\nHessen Amtsgericht Frankfurt am Main HRB 135393\nRegisterbekanntmachung nach dem Umwandlungsgesetz 06.08.2025 (Eintragungsdatum)\n\nBlitz F24-449 GmbH\nGesellschaft mit beschränkter Haftung\nFrankfurt am Main\n\nDen Gläubigern der an der Verschmelzung beteiligten Rechtsträger ist, wenn sie binnen sechs Monaten nach dem Tag, an dem die Eintragung der Verschmelzung in das Register des Sitzes desjenigen Rechtsträgers, dessen Gläubiger sie sind, nach § 19 Absatz 3 UmwG bekannt gemacht worden ist, ihren Anspruch nach Grund und Höhe schriftlich anmelden, Sicherheit zu leisten, soweit sie nicht Befriedigung verlangen können. Dieses Recht steht den Gläubigern jedoch nur zu, wenn sie glaubhaft machen, dass durch die Verschmelzung die Erfüllung ihrer Forderung gefährdet wird."
    },
    {
      "date": "2025-08-06",
      "id": "119665",
      "original_text": "Registerbekanntmachung nach dem Umwandlungsgesetz\nHessen Amtsgericht Frankfurt am Main HRB 135394\nBlitz F24-450 GmbH – Frankfurt am Main",
      "type": "Registerbekanntmachung nach dem Umwandlungsgesetz",
      "state": "Hessen",
      "amtsgericht": "Amtsgericht Frankfurt am Main",
      "registernummer": "HRB 135394",
      "registerart": "HRB",
      "company_name": "Blitz F24-450 GmbH",
      "company_seat": "Frankfurt am Main",
      "details": "06.08.2025 (Bekanntmachungsdatum)\n\nHessen Amtsgericht Frankfurt am Main HRB 135394\nRegisterbekanntmachung nach dem Umwandlungsgesetz 06.08.2025 (Eintragungsdatum)\n\nBlitz F24-450 GmbH\nGesellschaft mit beschränkter Haftung\nFrankfurt am Main\n\nDen Gläubigern der an der Verschmelzung beteiligten Rechtsträger ist, wenn sie binnen sechs Monaten nach dem Tag, an dem die Eintragung der Verschmelzung in das Register des Sitzes desjenigen Rechtsträgers, dessen Gläubiger sie sind, nach § 19 Absatz 3 UmwG bekannt gemacht worden ist, ihren Anspruch nach Grund und Höhe schriftlich anmelden, Sicherheit zu leisten, soweit sie nicht Befriedigung verlangen können. Dieses Recht steht den Gläubigern jedoch nur zu, wenn sie glaubhaft machen, dass durch die Verschmelzung die Erfüllung ihrer Forderung gefährdet wird."
    },
    {
      "date": "2025-08-06",
      "id": "119666",
      "original_text": "Registerbekanntmachung nach dem Umwandlungsgesetz\nHessen Amtsgericht Frankfurt am Main HRB 135393\nBlitz F24-449 GmbH – Frankfurt am Main",
      "type": "Registerbekanntmachung nach dem Umwandlungsgesetz",
      "state": "Hessen",
      "amtsgericht": "Amtsgericht Frankfurt am Main",
      "registernummer": "HRB 135393",
      "registerart": "HRB",
      "company_name": "Blitz F24-449 GmbH",
      "company_seat": "Frankfurt am Main",
      "details": "06.08.2025 (Bekanntmachungsdatum)\n\nHessen Amtsgericht Frankfurt am Main HRB 135393\nRegisterbekanntmachung nach dem Umwandlungsgesetz 06.08.2025 (Eintragungsdatum)\n\nBlitz F24-449 GmbH\nGesellschaft mit beschränkter Haftung\nFrankfurt am Main\n\nDen Gläubigern der an der Verschmelzung beteiligten Rechtsträger ist, wenn sie binnen sechs Monaten nach dem Tag, an dem die Eintragung der Verschmelzung in das Register des Sitzes desjenigen Rechtsträgers, dessen Gläubiger sie sind, nach § 19 Absatz 3 UmwG bekannt gemacht worden ist, ihren Anspruch nach Grund und Höhe schriftlich anmelden, Sicherheit zu leisten, soweit sie nicht Befriedigung verlangen können. Dieses Recht steht den Gläubigern jedoch nur zu, wenn sie glaubhaft machen, dass durch die Verschmelzung die Erfüllung ihrer Forderung gefährdet wird."
    },
    {
      "date": "2025-08-06",
      "id": "119667",
      "original_text": "Registerbekanntmachung nach dem Umwandlungsgesetz\nHessen Amtsgericht Frankfurt am Main HRB 106699\nVIVIANUM Ambulante Pflegedienste GmbH – Frankfurt am Main",
      "type": "Registerbekanntmachung nach dem Umwandlungsgesetz",
      "state": "Hessen",
      "amtsgericht": "Amtsgericht Frankfurt am Main",
      "registernummer": "HRB 106699",
      "registerart": "HRB",
      "company_name": "VIVIANUM Ambulante Pflegedienste GmbH",
      "company_seat": "Frankfurt am Main",
      "details": "06.08.2025 (Bekanntmachungsdatum)\n\nHessen Amtsgericht Frankfurt am Main HRB 106699\nRegisterbekanntmachung nach dem Umwandlungsgesetz 06.08.2025 (Eintragungsdatum)\n\nVIVIANUM Ambulante Pflegedienste GmbH\nGesellschaft mit beschränkter Haftung\nFrankfurt am Main\n\nDen Gläubigern der an der Verschmelzung beteiligten Rechtsträger ist, wenn sie binnen sechs Monaten nach dem Tag, an dem die Eintragung der Verschmelzung in das Register des Sitzes desjenigen Rechtsträgers, dessen Gläubiger sie sind, nach § 19 Absatz 3 UmwG bekannt gemacht worden ist, ihren Anspruch nach Grund und Höhe schriftlich anmelden, Sicherheit zu leisten, soweit sie nicht Befriedigung verlangen können. Dieses Recht steht den Gläubigern jedoch nur zu, wenn sie glaubhaft machen, dass durch die Verschmelzung die Erfüllung ihrer Forderung gefährdet wird."
    },
    {
      "date": "2025-08-06",
      "id": "119668",
      "original_text": "Registerbekanntmachung nach dem Umwandlungsgesetz\nHessen Amtsgericht Frankfurt am Main HRB 57206\nDB HR Solutions GmbH – Frankfurt am Main",
      "type": "Registerbekanntmachung nach dem Umwandlungsgesetz",
      "state": "Hessen",
      "amtsgericht": "Amtsgericht Frankfurt am Main",
      "registernummer": "HRB 57206",
      "registerart": "HRB",
      "company_name": "DB HR Solutions GmbH",
      "company_seat": "Frankfurt am Main",
      "details": "06.08.2025 (Bekanntmachungsdatum)\n\nHessen Amtsgericht Frankfurt am Main HRB 57206\nRegisterbekanntmachung nach dem Umwandlungsgesetz 06.08.2025 (Eintragungsdatum)\n\nDB HR Solutions GmbH\nGesellschaft mit beschränkter Haftung\nFrankfurt am Main\n\nDen Gläubigern der an der Verschmelzung beteiligten Rechtsträger ist, wenn sie binnen sechs Monaten nach dem Tag, an dem die Eintragung der Verschmelzung in das Register des Sitzes desjenigen Rechtsträgers, dessen Gläubiger sie sind, nach § 19 Absatz 3 UmwG bekannt gemacht worden ist, ihren Anspruch nach Grund und Höhe schriftlich anmelden, Sicherheit zu leisten, soweit sie nicht Befriedigung verlangen können. Dieses Recht steht den Gläubigern jedoch nur zu, wenn sie glaubhaft machen, dass durch die Verschmelzung die Erfüllung ihrer Forderung gefährdet wird."
    },
    {
      "date": "2025-08-06",
      "id": "119669",
      "original_text": "Einreichung neuer Dokumente\nHessen Amtsgericht Wetzlar HRB 966\nLeica Camera Aktiengesellschaft – Wetzlar",
      "type": "Einreichung neuer Dokumente",
      "state": "Hessen",
      "amtsgericht": "Amtsgericht Wetzlar",
      "registernummer": "HRB 966",
      "registerart": "HRB",
      "company_name": "Leica Camera Aktiengesellschaft",
      "company_seat": "Wetzlar",
      "details": "06.08.2025 (Bekanntmachungsdatum)\n\nHessen Amtsgericht Wetzlar HRB 966\nEinreichung neuer Dokumente 06.08.2025 (Eintragungsdatum)\n\nLeica Camera Aktiengesellschaft\nAktiengesellschaft\nWetzlar\n\nDurch eine Änderung in den Personen der Aufsichtsratsmitglieder ist eine Liste der Mitglieder des Aufsichtsrates zum Handelsregister eingereicht worden."
    },
    {
      "date": "2025-08-06",
      "id": "119670",
      "original_text": "Einreichung neuer Dokumente\nHessen Amtsgericht Hanau HRB 12953\nRegionalverkehr Main-Kinzig GmbH – Gelnhausen",
      "type": "Einreichung neuer Dokumente",
      "state": "Hessen",
      "amtsgericht": "Amtsgericht Hanau",
      "registernummer": "HRB 12953",
      "registerart": "HRB",
      "company_name": "Regionalverkehr Main-Kinzig GmbH",
      "company_seat": "Gelnhausen",
      "details": "06.08.2025 (Bekanntmachungsdatum)\n\nHessen Amtsgericht Hanau HRB 12953\nEinreichung neuer Dokumente\n\nRegionalverkehr Main-Kinzig GmbH\nGesellschaft mit beschränkter Haftung\nGelnhausen\n\nDurch eine Änderung in den Personen der Aufsichtsratsmitglieder ist eine Liste der Mitglieder des Aufsichtsrates zum Handelsregister eingereicht worden."
    },
    {
      "date": "2025-08-06",
      "id": "119671",
      "original_text": "Einreichung neuer Dokumente\nHessen Amtsgericht Kassel HRB 20120\nFinmap AG – Fuldatal",
      "type": "Einreichung neuer Dokumente",
      "state": "Hessen",
      "amtsgericht": "Amtsgericht Kassel",
      "registernummer": "HRB 20120",
      "registerart": "HRB",
      "company_name": "Finmap AG",
      "company_seat": "Fuldatal",
      "details": "06.08.2025 (Bekanntmachungsdatum)\n\nHessen Amtsgericht Kassel HRB 20120\nEinreichung neuer Dokumente\n\nFinmap AG\nAktiengesellschaft\nFuldatal\n\nDurch eine Änderung in den Personen der Aufsichtsratsmitglieder ist eine Liste der Mitglieder des Aufsichtsrates zum Handelsregister eingereicht worden."
    },
    {
      "date": "2025-08-06",
      "id": "119672",
      "original_text": "Sonstige Registerbekanntmachung\nHessen Amtsgericht Frankfurt am Main HRB 80596\nDIC VP Objekt Saalfeld GmbH – Frankfurt am Main",
      "type": "Sonstige Registerbekanntmachung",
      "state": "Hessen",
      "amtsgericht": "Amtsgericht Frankfurt am Main",
      "registernummer": "HRB 80596",
      "registerart": "HRB",
      "company_name": "DIC VP Objekt Saalfeld GmbH",
      "company_seat": "Frankfurt am Main",
      "details": "06.08.2025 (Bekanntmachungsdatum)\n\nHessen Amtsgericht Frankfurt am Main HRB 80596\nSonstige Registerbekanntmachung 06.08.2025 (Eintragungsdatum)\n\nDIC VP Objekt Saalfeld GmbH\nGesellschaft mit beschränkter Haftung\nFrankfurt am Main\n\nDen Gläubigern der Gesellschaft, deren Forderungen begründet worden sind, bevor die Eintragung der Beendigung des Vertrags in das Handelsregister nach § 10 HGB bekannt gemacht worden ist, ist vom anderen Vertragsteil Sicherheit zu leisten, wenn sie sich binnen sechs Monaten nach dieser Bekanntmachung zu diesem Zweck bei ihm melden."
    },
    {
      "date": "2025-08-06",
      "id": "119673",
      "original_text": "Registerbekanntmachung nach dem Umwandlungsgesetz\nHessen Amtsgericht Gießen HRB 11072\nWemakefuture AG – Gießen",
      "type": "Registerbekanntmachung nach dem Umwandlungsgesetz",
      "state": "Hessen",
      "amtsgericht": "Amtsgericht Gießen",
      "registernummer": "HRB 11072",
      "registerart": "HRB",
      "company_name": "Wemakefuture AG",
      "company_seat": "Gießen",
      "details": "06.08.2025 (Bekanntmachungsdatum)\n\nHessen Amtsgericht Gießen HRB 11072\nRegisterbekanntmachung nach dem Umwandlungsgesetz 06.08.2025 (Eintragungsdatum)\n\nWemakefuture AG\nAktiengesellschaft\nGießen\n\nDen Gläubigern der an der Verschmelzung beteiligten Rechtsträger ist, wenn sie binnen sechs Monaten nach dem Tag, an dem die Eintragung der Verschmelzung in das Register des Sitzes desjenigen Rechtsträgers, dessen Gläubiger sie sind, nach § 19 Absatz 3 UmwG bekannt gemacht worden ist, ihren Anspruch nach Grund und Höhe schriftlich anmelden, Sicherheit zu leisten, soweit sie nicht Befriedigung verlangen können. Dieses Recht steht den Gläubigern jedoch nur zu, wenn sie glaubhaft machen, dass durch die Verschmelzung die Erfüllung ihrer Forderung gefährdet wird."
    },
    {
      "date": "2025-08-06",
      "id": "119674",
      "original_text": "Registerbekanntmachung nach dem Umwandlungsgesetz\nHessen Amtsgericht Wiesbaden HRB 28494\nRealotel MUG GmbH – Wiesbaden",
      "type": "Registerbekanntmachung nach dem Umwandlungsgesetz",
      "state": "Hessen",
      "amtsgericht": "Amtsgericht Wiesbaden",
      "registernummer": "HRB 28494",
      "registerart": "HRB",
      "company_name": "Realotel MUG GmbH",
      "company_seat": "Wiesbaden",
      "details": "06.08.2025 (Bekanntmachungsdatum)\n\nHessen Amtsgericht Wiesbaden HRB 28494\nRegisterbekanntmachung nach dem Umwandlungsgesetz 06.08.2025 (Eintragungsdatum)\n\nRealotel MUG GmbH\nGesellschaft mit beschränkter Haftung\nWiesbaden\n\nDen Gläubigern der an der Verschmelzung beteiligten Rechtsträger ist, wenn sie binnen sechs Monaten nach dem Tag, an dem die Eintragung der Verschmelzung in das Register des Sitzes desjenigen Rechtsträgers, dessen Gläubiger sie sind, nach § 19 Absatz 3 UmwG bekannt gemacht worden ist, ihren Anspruch nach Grund und Höhe schriftlich anmelden, Sicherheit zu leisten, soweit sie nicht Befriedigung verlangen können. Dieses Recht steht den Gläubigern jedoch nur zu, wenn sie glaubhaft machen, dass durch die Verschmelzung die Erfüllung ihrer Forderung gefährdet wird."
    },
    {
      "date": "2025-08-06",
      "id": "119675",
      "original_text": "Löschungsankündigung\nHessen Amtsgericht Wiesbaden HRB 28853\nSV Gastronomie GmbH – Wiesbaden",
      "type": "Löschungsankündigung",
      "state": "Hessen",
      "amtsgericht": "Amtsgericht Wiesbaden",
      "registernummer": "HRB 28853",
      "registerart": "HRB",
      "company_name": "SV Gastronomie GmbH",
      "company_seat": "Wiesbaden",
      "details": "06.08.2025 (Bekanntmachungsdatum)\n\nHessen Amtsgericht Wiesbaden HRB 28853\nLöschungsankündigung\n\nSV Gastronomie GmbH\nGesellschaft mit beschränkter Haftung\nWiesbaden\n\nDas Registergericht beabsichtigt die im Handelsregister eingetragene Gesellschaft von Amts wegen nach§ 60 Abs. 1 GmbHG i.V.m. § 394 FamFG zu löschen. Die Frist zur Erhebung eines Widerspruchs gegen die beabsichtigte Löschung wird auf 3 Monate festgesetzt."
    },
    {
      "date": "2025-08-06",
      "id": "119676",
      "original_text": "Einreichung neuer Dokumente\nHessen Amtsgericht Frankfurt am Main HRB 51024\nJSLM AG – Frankfurt am Main",
      "type": "Einreichung neuer Dokumente",
      "state": "Hessen",
      "amtsgericht": "Amtsgericht Frankfurt am Main",
      "registernummer": "HRB 51024",
      "registerart": "HRB",
      "company_name": "JSLM AG",
      "company_seat": "Frankfurt am Main",
      "details": "06.08.2025 (Bekanntmachungsdatum)\n\nHessen Amtsgericht Frankfurt am Main HRB 51024\nEinreichung neuer Dokumente 04.08.2025 (Eintragungsdatum)\n\nJSLM AG\nAktiengesellschaft\nFrankfurt am Main\n\nDurch eine Änderung in den Personen der Aufsichtsratsmitglieder ist eine Liste der Mitglieder des Aufsichtsrates zum Handelsregister eingereicht worden."
    },
    {
      "date": "2025-08-06",
      "id": "119677",
      "original_text": "Einreichung neuer Dokumente\nHessen Amtsgericht Wiesbaden HRB 9592\nAltenhilfe Wiesbaden GmbH – Wiesbaden",
      "type": "Einreichung neuer Dokumente",
      "state": "Hessen",
      "amtsgericht": "Amtsgericht Wiesbaden",
      "registernummer": "HRB 9592",
      "registerart": "HRB",
      "company_name": "Altenhilfe Wiesbaden GmbH",
      "company_seat": "Wiesbaden",
      "details": "06.08.2025 (Bekanntmachungsdatum)\n\nHessen Amtsgericht Wiesbaden HRB 9592\nEinreichung neuer Dokumente\n\nAltenhilfe Wiesbaden GmbH\nGesellschaft mit beschränkter Haftung\nWiesbaden\n\nDurch eine Änderung in den Personen der Aufsichtsratsmitglieder ist eine Liste der Mitglieder des Aufsichtsrates zum Handelsregister eingereicht worden."
    },
    {
      "date": "2025-08-06",
      "id": "119678",
      "original_text": "Löschungsankündigung\nHessen Amtsgericht Frankfurt am Main HRB 132151\nM+Plus UG (haftungsbeschränkt) – Frankfurt am Main",
      "type": "Löschungsankündigung",
      "state": "Hessen",
      "amtsgericht": "Amtsgericht Frankfurt am Main",
      "registernummer": "HRB 132151",
      "registerart": "HRB",
      "company_name": "M+Plus UG (haftungsbeschränkt)",
      "company_seat": "Frankfurt am Main",
      "details": "06.08.2025 (Bekanntmachungsdatum)\n\nHessen Amtsgericht Frankfurt am Main HRB 132151\nLöschungsankündigung 06.08.2025 (Eintragungsdatum)\n\nM+Plus UG (haftungsbeschränkt)\nGesellschaft mit beschränkter Haftung\nFrankfurt am Main\n\nDas Registergericht beabsichtigt die im Handelsregister eingetragene Gesellschaft von Amts wegen nach § 394 FamFG zu löschen. Die Frist zur Erhebung eines Widerspruchs gegen die beabsichtigte Löschung wird auf 1 Monat festgesetzt."
    },
    {
      "date": "2025-08-06",
      "id": "119679",
      "original_text": "Registerbekanntmachung nach dem Umwandlungsgesetz\nHessen Amtsgericht Darmstadt HRB 7114\nFOCUS INFOCOM Gesellschaft für Informatik und Telekommunikation mbH – Darmstadt",
      "type": "Registerbekanntmachung nach dem Umwandlungsgesetz",
      "state": "Hessen",
      "amtsgericht": "Amtsgericht Darmstadt",
      "registernummer": "HRB 7114",
      "registerart": "HRB",
      "company_name": "FOCUS INFOCOM Gesellschaft für Informatik und Telekommunikation mbH",
      "company_seat": "Darmstadt",
      "details": "06.08.2025 (Bekanntmachungsdatum)\n\nHessen Amtsgericht Darmstadt HRB 7114\nRegisterbekanntmachung nach dem Umwandlungsgesetz 06.08.2025 (Eintragungsdatum)\n\nFOCUS INFOCOM Gesellschaft für Informatik und Telekommunikation mbH\nGesellschaft mit beschränkter Haftung\nDarmstadt\n\nDen Gläubigern der an der Verschmelzung beteiligten Rechtsträger ist, wenn sie binnen sechs Monaten nach dem Tag, an dem die Eintragung der Verschmelzung in das Register des Sitzes derjenigen Rechtsträger deren Gläubiger sie sind, nach § 19 Absatz 3 UmwG bekannt gemacht worden ist, ihren Anspruch nach Grund und Höhe schriftlich anmelden, Sicherheit zu leisten, soweit sie nicht Befriedigung verlangen können. Dieses Recht steht den Gläubigern jedoch nur zu, wenn sie glaubhaft machen, dass durch die Verschmelzung die Erfüllung ihrer Forderung gefährdet wird."
    },
    {
      "date": "2025-08-06",
      "id": "119680",
      "original_text": "Sonstige Registerbekanntmachung\nHessen Amtsgericht Wiesbaden VR 7095\nALEVITISCHE GEMEINDE WIESBADEN e.V. – Wiesbaden",
      "type": "Sonstige Registerbekanntmachung",
      "state": "Hessen",
      "amtsgericht": "Amtsgericht Wiesbaden",
      "registernummer": "VR 7095",
      "registerart": "VR",
      "company_name": "ALEVITISCHE GEMEINDE WIESBADEN e.V.",
      "company_seat": "Wiesbaden",
      "details": "06.08.2025 (Bekanntmachungsdatum)\n\nHessen Amtsgericht Wiesbaden VR 7095\nSonstige Registerbekanntmachung 06.08.2025 (Eintragungsdatum)\n\nALEVITISCHE GEMEINDE WIESBADEN e.V.\neingetragener Verein\nWiesbaden\n\nDer Verein ist aufgelöst."
    },
    {
      "date": "2025-08-06",
      "id": "119681",
      "original_text": "Registerbekanntmachung nach dem Umwandlungsgesetz\nHessen Amtsgericht Königstein HRB 11632\nSEBL Holding GmbH – Bad Soden am Taunus",
      "type": "Registerbekanntmachung nach dem Umwandlungsgesetz",
      "state": "Hessen",
      "amtsgericht": "Amtsgericht Königstein",
      "registernummer": "HRB 11632",
      "registerart": "HRB",
      "company_name": "SEBL Holding GmbH",
      "company_seat": "Bad Soden am Taunus",
      "details": "06.08.2025 (Bekanntmachungsdatum)\n\nHessen Amtsgericht Königstein HRB 11632\nRegisterbekanntmachung nach dem Umwandlungsgesetz 06.08.2025 (Eintragungsdatum)\n\nSEBL Holding GmbH\nGesellschaft mit beschränkter Haftung\nBad Soden am Taunus\n\nDen Gläubigern der an der Verschmelzung beteiligten Rechtsträger ist, wenn sie binnen sechs Monaten nach dem Tag, an dem die Eintragung der Verschmelzung in das Register des Sitzes desjenigen Rechtsträgers, dessen Gläubiger sie sind, nach § 19 Absatz 3 UmwG bekannt gemacht worden ist, ihren Anspruch nach Grund und Höhe schriftlich anmelden, Sicherheit zu leisten, soweit sie nicht Befriedigung verlangen können. Dieses Recht steht den Gläubigern jedoch nur zu, wenn sie glaubhaft machen, dass durch die Verschmelzung die Erfüllung ihrer Forderung gefährdet wird."
    },
    {
      "date": "2025-08-06",
      "id": "119682",
      "original_text": "Einreichung neuer Dokumente\nHessen Amtsgericht Gießen HRB 3396\nCURSOR Software AG – Gießen",
      "type": "Einreichung neuer Dokumente",
      "state": "Hessen",
      "amtsgericht": "Amtsgericht Gießen",
      "registernummer": "HRB 3396",
      "registerart": "HRB",
      "company_name": "CURSOR Software AG",
      "company_seat": "Gießen",
      "details": "06.08.2025 (Bekanntmachungsdatum)\n\nHessen Amtsgericht Gießen HRB 3396\nEinreichung neuer Dokumente\n\nCURSOR Software AG\nAktiengesellschaft\nGießen\n\nAufgrund von Änderungen in den Personen der Aufsichtsratsmitglieder ist eine Liste der Mitglieder des Aufsichtsrates zum Handelsregister eingereicht worden."
    },
    {
      "date": "2025-08-06",
      "id": "119683",
      "original_text": "Registerbekanntmachung nach dem Umwandlungsgesetz\nHessen Amtsgericht Frankfurt am Main HRB 30000\nDEUTSCHE BANK AKTIENGESELLSCHAFT – Frankfurt am Main",
      "type": "Registerbekanntmachung nach dem Umwandlungsgesetz",
      "state": "Hessen",
      "amtsgericht": "Amtsgericht Frankfurt am Main",
      "registernummer": "HRB 30000",
      "registerart": "HRB",
      "company_name": "DEUTSCHE BANK AKTIENGESELLSCHAFT",
      "company_seat": "Frankfurt am Main",
      "details": "06.08.2025 (Bekanntmachungsdatum)\n\nHessen Amtsgericht Frankfurt am Main HRB 30000\nRegisterbekanntmachung nach dem Umwandlungsgesetz 06.08.2025 (Eintragungsdatum)\n\nDEUTSCHE BANK AKTIENGESELLSCHAFT\nAktiengesellschaft\nFrankfurt am Main\n\nDen Gläubigern der an der Verschmelzung beteiligten Rechtsträger ist, wenn sie binnen sechs Monaten nach dem Tag, an dem die Eintragung der Verschmelzung in das Register des Sitzes desjenigen Rechtsträgers, dessen Gläubiger sie sind, nach § 19 Absatz 3 UmwG bekannt gemacht worden ist, ihren Anspruch nach Grund und Höhe schriftlich anmelden, Sicherheit zu leisten, soweit sie nicht Befriedigung verlangen können. Dieses Recht steht den Gläubigern jedoch nur zu, wenn sie glaubhaft machen, dass durch die Verschmelzung die Erfüllung ihrer Forderung gefährdet wird."
    }
  ]
}