{
  "date": "2025-08-05",
  "date_of_scrape": "2025-08-27T11:30:57.895Z",
  "tool_version": "0.2.0",
  "number_of_announcements": 257,
  "announcements": [
    {
      "date": "2025-08-05",
      "id": "119194",
      "original_text": "Löschungsankündigung\nBayern Amtsgericht Coburg HRB 1231\nHöllein GmbH – Coburg",
      "type": "Löschungsankündigung",
      "state": "Bayern",
      "amtsgericht": "Amtsgericht Coburg",
      "registernummer": "HRB 1231",
      "registerart": "HRB",
      "company_name": "Höllein GmbH",
      "company_seat": "Coburg",
      "details": "05.08.2025 (Bekanntmachungsdatum)\n\nBayern Amtsgericht Coburg HRB 1231\nLöschungsankündigung\n\nHöllein GmbH\nGesellschaft mit beschränkter Haftung\nCoburg\n\nDas Registergericht beabsichtigt, die im Handelsregister eingetragene Gesellschaft wegen Vermögenslosigkeit von Amts wegen nach § 394 FamFG zu löschen. Die Frist zur Erhebung eines Widerspruchs ist auf sechs Wochen festgesetzt."
    },
    {
      "date": "2025-08-05",
      "id": "119195",
      "original_text": "Einreichung neuer Dokumente\nBayern Amtsgericht Traunstein HRB 31859\nBrückner Maschinenbau GmbH – Siegsdorf",
      "type": "Einreichung neuer Dokumente",
      "state": "Bayern",
      "amtsgericht": "Amtsgericht Traunstein",
      "registernummer": "HRB 31859",
      "registerart": "HRB",
      "company_name": "Brückner Maschinenbau GmbH",
      "company_seat": "Siegsdorf",
      "details": "05.08.2025 (Bekanntmachungsdatum)\n\nBayern Amtsgericht Traunstein HRB 31859\nEinreichung neuer Dokumente\n\nBrückner Maschinenbau GmbH\nGesellschaft mit beschränkter Haftung\nSiegsdorf\n\nDem Amtsgericht Traunstein -Registergericht- ist eine Liste der Mitglieder des Aufsichtsrats eingereicht worden, § 52 Abs. 3 S. 2 GmbHG."
    },
    {
      "date": "2025-08-05",
      "id": "119196",
      "original_text": "Löschungsankündigung\nBayern Amtsgericht München HRB 252308\nClub 49 UG (haftungsbeschränkt) – München",
      "type": "Löschungsankündigung",
      "state": "Bayern",
      "amtsgericht": "Amtsgericht München",
      "registernummer": "HRB 252308",
      "registerart": "HRB",
      "company_name": "Club 49 UG (haftungsbeschränkt)",
      "company_seat": "München",
      "details": "05.08.2025 (Bekanntmachungsdatum)\n\nBayern Amtsgericht München HRB 252308\nLöschungsankündigung 04.08.2025 (Eintragungsdatum)\n\nClub 49 UG (haftungsbeschränkt)\nGesellschaft mit beschränkter Haftung\nMünchen\n\nDas Registergericht beabsichtigt, die im Handelsregister eingetragene Gesellschaft wegen Vermögenslosigkeit von Amts wegen nach § 394 FamFG zu löschen. Die Frist zur Erhebung eines Widerspruchs ist auf drei Monate festgesetzt."
    },
    {
      "date": "2025-08-05",
      "id": "119197",
      "original_text": "Registerbekanntmachung nach dem Umwandlungsgesetz\nBayern Amtsgericht Traunstein HRB 27243\nOptik Kronwinkler GmbH – Burghausen",
      "type": "Registerbekanntmachung nach dem Umwandlungsgesetz",
      "state": "Bayern",
      "amtsgericht": "Amtsgericht Traunstein",
      "registernummer": "HRB 27243",
      "registerart": "HRB",
      "company_name": "Optik Kronwinkler GmbH",
      "company_seat": "Burghausen",
      "details": "05.08.2025 (Bekanntmachungsdatum)\n\nBayern Amtsgericht Traunstein HRB 27243\nRegisterbekanntmachung nach dem Umwandlungsgesetz 04.08.2025 (Eintragungsdatum)\n\nOptik Kronwinkler GmbH\nGesellschaft mit beschränkter Haftung\nBurghausen\n\nDen Gläubigern der an der Verschmelzung beteiligten Rechtsträger ist, wenn sie binnen sechs Monaten nach dem Tag, an dem die Eintragung der Verschmelzung in das Register des Sitzes desjenigen Rechtsträgers, dessen Gläubiger sie sind, nach § 19 Abs. 3 UmwG als bekannt gemacht gilt, ihren Anspruch nach Grund und Höhe in Textform anmelden, Sicherheit zu leisten, soweit sie nicht Befriedigung verlangen können. Dieses Recht steht den Gläubigern jedoch nur zu, wenn sie glaubhaft machen, dass durch die Verschmelzung die Erfüllung ihrer Forderung gefährdet wird."
    },
    {
      "date": "2025-08-05",
      "id": "119198",
      "original_text": "Einreichung neuer Dokumente\nBayern Amtsgericht München HRB 77760\nNucletron Electronic Aktiengesellschaft – München",
      "type": "Einreichung neuer Dokumente",
      "state": "Bayern",
      "amtsgericht": "Amtsgericht München",
      "registernummer": "HRB 77760",
      "registerart": "HRB",
      "company_name": "Nucletron Electronic Aktiengesellschaft",
      "company_seat": "München",
      "details": "05.08.2025 (Bekanntmachungsdatum)\n\nBayern Amtsgericht München HRB 77760\nEinreichung neuer Dokumente\n\nNucletron Electronic Aktiengesellschaft\nAktiengesellschaft\nMünchen\n\nDem Amtsgericht München -Registergericht- ist eine Liste der Mitglieder des Aufsichtsrats eingereicht worden, § 106 AktG."
    },
    {
      "date": "2025-08-05",
      "id": "119199",
      "original_text": "Registerbekanntmachung nach dem Umwandlungsgesetz\nBayern Amtsgericht Traunstein HRB 19351\ntargato.com GmbH – Soyen",
      "type": "Registerbekanntmachung nach dem Umwandlungsgesetz",
      "state": "Bayern",
      "amtsgericht": "Amtsgericht Traunstein",
      "registernummer": "HRB 19351",
      "registerart": "HRB",
      "company_name": "targato.com GmbH",
      "company_seat": "Soyen",
      "details": "05.08.2025 (Bekanntmachungsdatum)\n\nBayern Amtsgericht Traunstein HRB 19351\nRegisterbekanntmachung nach dem Umwandlungsgesetz 03.08.2025 (Eintragungsdatum)\n\ntargato.com GmbH\nGesellschaft mit beschränkter Haftung\nSoyen\n\nDen Gläubigern der an der Verschmelzung beteiligten Rechtsträger ist, wenn sie binnen sechs Monaten nach dem Tag, an dem die Eintragung der Verschmelzung in das Register des Sitzes desjenigen Rechtsträgers, dessen Gläubiger sie sind, nach § 19 Abs. 3 UmwG als bekannt gemacht gilt, ihren Anspruch nach Grund und Höhe in Textform anmelden, Sicherheit zu leisten, soweit sie nicht Befriedigung verlangen können. Dieses Recht steht den Gläubigern jedoch nur zu, wenn sie glaubhaft machen, dass durch die Verschmelzung die Erfüllung ihrer Forderung gefährdet wird."
    },
    {
      "date": "2025-08-05",
      "id": "119200",
      "original_text": "Löschungsankündigung\nBayern Amtsgericht München HRB 163010\nBelcanto Eventmanagement GmbH – München",
      "type": "Löschungsankündigung",
      "state": "Bayern",
      "amtsgericht": "Amtsgericht München",
      "registernummer": "HRB 163010",
      "registerart": "HRB",
      "company_name": "Belcanto Eventmanagement GmbH",
      "company_seat": "München",
      "details": "05.08.2025 (Bekanntmachungsdatum)\n\nBayern Amtsgericht München HRB 163010\nLöschungsankündigung 04.08.2025 (Eintragungsdatum)\n\nBelcanto Eventmanagement GmbH\nGesellschaft mit beschränkter Haftung\nMünchen\n\nDas Registergericht beabsichtigt, die im Handelsregister eingetragene Gesellschaft wegen Vermögenslosigkeit von Amts wegen nach § 394 FamFG zu löschen. Die Frist zur Erhebung eines Widerspruchs ist auf drei Monate festgesetzt."
    },
    {
      "date": "2025-08-05",
      "id": "119201",
      "original_text": "Einreichung neuer Dokumente\nBayern Amtsgericht München HRB 288512\nAXENIO AG – München",
      "type": "Einreichung neuer Dokumente",
      "state": "Bayern",
      "amtsgericht": "Amtsgericht München",
      "registernummer": "HRB 288512",
      "registerart": "HRB",
      "company_name": "AXENIO AG",
      "company_seat": "München",
      "details": "05.08.2025 (Bekanntmachungsdatum)\n\nBayern Amtsgericht München HRB 288512\nEinreichung neuer Dokumente\n\nAXENIO AG\nAktiengesellschaft\nMünchen\n\nDem Amtsgericht München -Registergericht- ist eine Liste der Mitglieder des Aufsichtsrats eingereicht worden, § 106 AktG."
    },
    {
      "date": "2025-08-05",
      "id": "119202",
      "original_text": "Löschungsankündigung\nBayern Amtsgericht München HRB 223908\nRITTER TECH Engineering GmbH – München",
      "type": "Löschungsankündigung",
      "state": "Bayern",
      "amtsgericht": "Amtsgericht München",
      "registernummer": "HRB 223908",
      "registerart": "HRB",
      "company_name": "RITTER TECH Engineering GmbH",
      "company_seat": "München",
      "details": "05.08.2025 (Bekanntmachungsdatum)\n\nBayern Amtsgericht München HRB 223908\nLöschungsankündigung 04.08.2025 (Eintragungsdatum)\n\nRITTER TECH Engineering GmbH\nGesellschaft mit beschränkter Haftung\nMünchen\n\nDas Registergericht beabsichtigt, die im Handelsregister eingetragene Gesellschaft wegen Vermögenslosigkeit von Amts wegen nach § 394 FamFG zu löschen. Die Frist zur Erhebung eines Widerspruchs ist auf drei Monate festgesetzt."
    },
    {
      "date": "2025-08-05",
      "id": "119203",
      "original_text": "Registerbekanntmachung nach dem Umwandlungsgesetz\nBayern Amtsgericht Augsburg HRB 37144\nParmenas GmbH – Augsburg",
      "type": "Registerbekanntmachung nach dem Umwandlungsgesetz",
      "state": "Bayern",
      "amtsgericht": "Amtsgericht Augsburg",
      "registernummer": "HRB 37144",
      "registerart": "HRB",
      "company_name": "Parmenas GmbH",
      "company_seat": "Augsburg",
      "details": "05.08.2025 (Bekanntmachungsdatum)\n\nBayern Amtsgericht Augsburg HRB 37144\nRegisterbekanntmachung nach dem Umwandlungsgesetz 02.08.2025 (Eintragungsdatum)\n\nParmenas GmbH\nGesellschaft mit beschränkter Haftung\nAugsburg\n\nDen Gläubigern der an der Verschmelzung beteiligten Rechtsträger ist, wenn sie binnen sechs Monaten nach dem Tag, an dem die Eintragung der Verschmelzung in das Register des Sitzes desjenigen Rechtsträgers, dessen Gläubiger sie sind, nach § 19 Abs. 3 UmwG als bekannt gemacht gilt, ihren Anspruch nach Grund und Höhe in Textform anmelden, Sicherheit zu leisten, soweit sie nicht Befriedigung verlangen können. Dieses Recht steht den Gläubigern jedoch nur zu, wenn sie glaubhaft machen, dass durch die Verschmelzung die Erfüllung ihrer Forderung gefährdet wird."
    },
    {
      "date": "2025-08-05",
      "id": "119204",
      "original_text": "Registerbekanntmachung nach dem Umwandlungsgesetz\nBayern Amtsgericht Augsburg HRB 28744\nVar Industries GmbH – Friedberg",
      "type": "Registerbekanntmachung nach dem Umwandlungsgesetz",
      "state": "Bayern",
      "amtsgericht": "Amtsgericht Augsburg",
      "registernummer": "HRB 28744",
      "registerart": "HRB",
      "company_name": "Var Industries GmbH",
      "company_seat": "Friedberg",
      "details": "05.08.2025 (Bekanntmachungsdatum)\n\nBayern Amtsgericht Augsburg HRB 28744\nRegisterbekanntmachung nach dem Umwandlungsgesetz 02.08.2025 (Eintragungsdatum)\n\nVar Industries GmbH\nGesellschaft mit beschränkter Haftung\nFriedberg\n\nDen Gläubigern der an der Verschmelzung beteiligten Rechtsträger ist, wenn sie binnen sechs Monaten nach dem Tag, an dem die Eintragung der Verschmelzung in das Register des Sitzes desjenigen Rechtsträgers, dessen Gläubiger sie sind, nach § 19 Abs. 3 UmwG als bekannt gemacht gilt, ihren Anspruch nach Grund und Höhe in Textform anmelden, Sicherheit zu leisten, soweit sie nicht Befriedigung verlangen können. Dieses Recht steht den Gläubigern jedoch nur zu, wenn sie glaubhaft machen, dass durch die Verschmelzung die Erfüllung ihrer Forderung gefährdet wird."
    },
    {
      "date": "2025-08-05",
      "id": "119205",
      "original_text": "Registerbekanntmachung nach dem Umwandlungsgesetz\nBayern Amtsgericht Traunstein HRB 31991\nBauer Elektroanlagen Holding SE – Buchbach",
      "type": "Registerbekanntmachung nach dem Umwandlungsgesetz",
      "state": "Bayern",
      "amtsgericht": "Amtsgericht Traunstein",
      "registernummer": "HRB 31991",
      "registerart": "HRB",
      "company_name": "Bauer Elektroanlagen Holding SE",
      "company_seat": "Buchbach",
      "details": "05.08.2025 (Bekanntmachungsdatum)\n\nBayern Amtsgericht Traunstein HRB 31991\nRegisterbekanntmachung nach dem Umwandlungsgesetz 03.08.2025 (Eintragungsdatum)\n\nBauer Elektroanlagen Holding SE\nEuropäische Aktiengesellschaft (SE)\nBuchbach\n\nDen Gläubigern der an der Spaltung beteiligten Rechtsträger ist, wenn sie binnen sechs Monaten nach dem Tag, an dem die Eintragung der Spaltung in das Register des Sitzes desjenigen Rechtsträgers, dessen Gläubiger sie sind, nach §§ 125, 19 Abs. 3 UmwG als bekannt gemacht gilt, ihren Anspruch nach Grund und Höhe in Textform anmelden, Sicherheit zu leisten, soweit sie nicht Befriedigung verlangen können. Dieses Recht steht den Gläubigern jedoch nur zu, wenn sie glaubhaft machen, dass durch die Spaltung die Erfüllung ihrer Forderung gefährdet wird."
    },
    {
      "date": "2025-08-05",
      "id": "119206",
      "original_text": "Registerbekanntmachung nach dem Umwandlungsgesetz\nBayern Amtsgericht München HRB 302320\nInternetmarketing Bielefeld GmbH – Olching",
      "type": "Registerbekanntmachung nach dem Umwandlungsgesetz",
      "state": "Bayern",
      "amtsgericht": "Amtsgericht München",
      "registernummer": "HRB 302320",
      "registerart": "HRB",
      "company_name": "Internetmarketing Bielefeld GmbH",
      "company_seat": "Olching",
      "details": "05.08.2025 (Bekanntmachungsdatum)\n\nBayern Amtsgericht München HRB 302320\nRegisterbekanntmachung nach dem Umwandlungsgesetz 04.08.2025 (Eintragungsdatum)\n\nInternetmarketing Bielefeld GmbH\nGesellschaft mit beschränkter Haftung\nOlching\n\nDen Gläubigern der an der Verschmelzung beteiligten Rechtsträger ist, wenn sie binnen sechs Monaten nach dem Tag, an dem die Eintragung der Verschmelzung in das Register des Sitzes desjenigen Rechtsträgers, dessen Gläubiger sie sind, nach § 19 Abs. 3 UmwG als bekannt gemacht gilt, ihren Anspruch nach Grund und Höhe in Textform anmelden, Sicherheit zu leisten, soweit sie nicht Befriedigung verlangen können. Dieses Recht steht den Gläubigern jedoch nur zu, wenn sie glaubhaft machen, dass durch die Verschmelzung die Erfüllung ihrer Forderung gefährdet wird."
    },
    {
      "date": "2025-08-05",
      "id": "119207",
      "original_text": "Registerbekanntmachung nach dem Umwandlungsgesetz\nBayern Amtsgericht Traunstein HRB 27243\nOptik Kronwinkler GmbH – Burghausen",
      "type": "Registerbekanntmachung nach dem Umwandlungsgesetz",
      "state": "Bayern",
      "amtsgericht": "Amtsgericht Traunstein",
      "registernummer": "HRB 27243",
      "registerart": "HRB",
      "company_name": "Optik Kronwinkler GmbH",
      "company_seat": "Burghausen",
      "details": "05.08.2025 (Bekanntmachungsdatum)\n\nBayern Amtsgericht Traunstein HRB 27243\nRegisterbekanntmachung nach dem Umwandlungsgesetz 04.08.2025 (Eintragungsdatum)\n\nOptik Kronwinkler GmbH\nGesellschaft mit beschränkter Haftung\nBurghausen\n\nDen Gläubigern der an der Verschmelzung beteiligten Rechtsträger ist, wenn sie binnen sechs Monaten nach dem Tag, an dem die Eintragung der Verschmelzung in das Register des Sitzes desjenigen Rechtsträgers, dessen Gläubiger sie sind, nach § 19 Abs. 3 UmwG als bekannt gemacht gilt, ihren Anspruch nach Grund und Höhe in Textform anmelden, Sicherheit zu leisten, soweit sie nicht Befriedigung verlangen können. Dieses Recht steht den Gläubigern jedoch nur zu, wenn sie glaubhaft machen, dass durch die Verschmelzung die Erfüllung ihrer Forderung gefährdet wird."
    },
    {
      "date": "2025-08-05",
      "id": "119208",
      "original_text": "Registerbekanntmachung nach dem Umwandlungsgesetz\nBayern Amtsgericht Regensburg HRB 17498\nAOG Europe Trading UG (haftungsbeschränkt) – Regensburg",
      "type": "Registerbekanntmachung nach dem Umwandlungsgesetz",
      "state": "Bayern",
      "amtsgericht": "Amtsgericht Regensburg",
      "registernummer": "HRB 17498",
      "registerart": "HRB",
      "company_name": "AOG Europe Trading UG (haftungsbeschränkt)",
      "company_seat": "Regensburg",
      "details": "05.08.2025 (Bekanntmachungsdatum)\n\nBayern Amtsgericht Regensburg HRB 17498\nRegisterbekanntmachung nach dem Umwandlungsgesetz 04.08.2025 (Eintragungsdatum)\n\nAOG Europe Trading UG (haftungsbeschränkt)\nGesellschaft mit beschränkter Haftung\nRegensburg\n\nDen Gläubigern der an der Verschmelzung beteiligten Rechtsträger ist, wenn sie binnen sechs Monaten nach dem Tag, an dem die Eintragung der Verschmelzung in das Register des Sitzes desjenigen Rechtsträgers, dessen Gläubiger sie sind, nach § 19 Abs. 3 UmwG als bekannt gemacht gilt, ihren Anspruch nach Grund und Höhe in Textform anmelden, Sicherheit zu leisten, soweit sie nicht Befriedigung verlangen können. Dieses Recht steht den Gläubigern jedoch nur zu, wenn sie glaubhaft machen, dass durch die Verschmelzung die Erfüllung ihrer Forderung gefährdet wird."
    },
    {
      "date": "2025-08-05",
      "id": "119209",
      "original_text": "Registerbekanntmachung nach dem Umwandlungsgesetz\nBayern Amtsgericht Regensburg HRA 11178\nOttix e.K. – Hemau",
      "type": "Registerbekanntmachung nach dem Umwandlungsgesetz",
      "state": "Bayern",
      "amtsgericht": "Amtsgericht Regensburg",
      "registernummer": "HRA 11178",
      "registerart": "HRA",
      "company_name": "Ottix e.K.",
      "company_seat": "Hemau",
      "details": "05.08.2025 (Bekanntmachungsdatum)\n\nBayern Amtsgericht Regensburg HRA 11178\nRegisterbekanntmachung nach dem Umwandlungsgesetz 04.08.2025 (Eintragungsdatum)\n\nOttix e.K.\nEinzelkaufmann / Einzelkauffrau\nHemau\n\nDen Gläubigern der an der Ausgliederung beteiligten Rechtsträger ist, wenn sie binnen sechs Monaten nach dem Tag, an dem die Eintragung der Ausgliederung in das Register des Sitzes desjenigen Rechtsträgers, dessen Gläubiger sie sind, nach §§ 125, 19 Abs. 3 UmwG als bekannt gemacht gilt, ihren Anspruch nach Grund und Höhe in Textform anmelden, Sicherheit zu leisten, soweit sie nicht Befriedigung verlangen können. Dieses Recht steht den Gläubigern jedoch nur zu, wenn sie glaubhaft machen, dass durch die Ausgliederung die Erfüllung ihrer Forderung gefährdet wird."
    },
    {
      "date": "2025-08-05",
      "id": "119210",
      "original_text": "Registerbekanntmachung nach dem Umwandlungsgesetz\nBayern Amtsgericht München HRB 186038\nGXP Engaged Auditing Services GmbH – München",
      "type": "Registerbekanntmachung nach dem Umwandlungsgesetz",
      "state": "Bayern",
      "amtsgericht": "Amtsgericht München",
      "registernummer": "HRB 186038",
      "registerart": "HRB",
      "company_name": "GXP Engaged Auditing Services GmbH",
      "company_seat": "München",
      "details": "05.08.2025 (Bekanntmachungsdatum)\n\nBayern Amtsgericht München HRB 186038\nRegisterbekanntmachung nach dem Umwandlungsgesetz 04.08.2025 (Eintragungsdatum)\n\nGXP Engaged Auditing Services GmbH\nGesellschaft mit beschränkter Haftung\nMünchen\n\nDen Gläubigern der an der Verschmelzung beteiligten Rechtsträger ist, wenn sie binnen sechs Monaten nach dem Tag, an dem die Eintragung der Verschmelzung in das Register des Sitzes desjenigen Rechtsträgers, dessen Gläubiger sie sind, nach § 19 Abs. 3 UmwG als bekannt gemacht gilt, ihren Anspruch nach Grund und Höhe in Textform anmelden, Sicherheit zu leisten, soweit sie nicht Befriedigung verlangen können. Dieses Recht steht den Gläubigern jedoch nur zu, wenn sie glaubhaft machen, dass durch die Verschmelzung die Erfüllung ihrer Forderung gefährdet wird."
    },
    {
      "date": "2025-08-05",
      "id": "119211",
      "original_text": "Registerbekanntmachung nach dem Umwandlungsgesetz\nBayern Amtsgericht Bamberg HRB 9061\nSB Regnitztal-Ellertal Finanz GmbH – Hirschaid",
      "type": "Registerbekanntmachung nach dem Umwandlungsgesetz",
      "state": "Bayern",
      "amtsgericht": "Amtsgericht Bamberg",
      "registernummer": "HRB 9061",
      "registerart": "HRB",
      "company_name": "SB Regnitztal-Ellertal Finanz GmbH",
      "company_seat": "Hirschaid",
      "details": "05.08.2025 (Bekanntmachungsdatum)\n\nBayern Amtsgericht Bamberg HRB 9061\nRegisterbekanntmachung nach dem Umwandlungsgesetz 04.08.2025 (Eintragungsdatum)\n\nSB Regnitztal-Ellertal Finanz GmbH\nGesellschaft mit beschränkter Haftung\nHirschaid\n\nDen Gläubigern der an der Verschmelzung beteiligten Rechtsträger ist, wenn sie binnen sechs Monaten nach dem Tag, an dem die Eintragung der Verschmelzung in das Register des Sitzes desjenigen Rechtsträgers, dessen Gläubiger sie sind, nach § 19 Abs. 3 UmwG als bekannt gemacht gilt, ihren Anspruch nach Grund und Höhe in Textform anmelden, Sicherheit zu leisten, soweit sie nicht Befriedigung verlangen können. Dieses Recht steht den Gläubigern jedoch nur zu, wenn sie glaubhaft machen, dass durch die Verschmelzung die Erfüllung ihrer Forderung gefährdet wird."
    },
    {
      "date": "2025-08-05",
      "id": "119212",
      "original_text": "Registerbekanntmachung nach dem Umwandlungsgesetz\nBayern Amtsgericht Augsburg HRA 21995\nHarald Diebold GmbH & Co. KG – Gersthofen",
      "type": "Registerbekanntmachung nach dem Umwandlungsgesetz",
      "state": "Bayern",
      "amtsgericht": "Amtsgericht Augsburg",
      "registernummer": "HRA 21995",
      "registerart": "HRA",
      "company_name": "Harald Diebold GmbH & Co. KG",
      "company_seat": "Gersthofen",
      "details": "05.08.2025 (Bekanntmachungsdatum)\n\nBayern Amtsgericht Augsburg HRA 21995\nRegisterbekanntmachung nach dem Umwandlungsgesetz 04.08.2025 (Eintragungsdatum)\n\nHarald Diebold GmbH & Co. KG\nKommanditgesellschaft\nGersthofen\n\nDen Gläubigern der an der Ausgliederung beteiligten Rechtsträger ist, wenn sie binnen sechs Monaten nach dem Tag, an dem die Eintragung der Ausgliederung in das Register des Sitzes desjenigen Rechtsträgers, dessen Gläubiger sie sind, nach §§ 125, 19 Abs. 3 UmwG als bekannt gemacht gilt, ihren Anspruch nach Grund und Höhe in Textform anmelden, Sicherheit zu leisten, soweit sie nicht Befriedigung verlangen können. Dieses Recht steht den Gläubigern jedoch nur zu, wenn sie glaubhaft machen, dass durch die Ausgliederung die Erfüllung ihrer Forderung gefährdet wird."
    },
    {
      "date": "2025-08-05",
      "id": "119213",
      "original_text": "Registerbekanntmachung nach dem Umwandlungsgesetz\nBayern Amtsgericht Traunstein HRB 23099\naktivendo GmbH – Edling",
      "type": "Registerbekanntmachung nach dem Umwandlungsgesetz",
      "state": "Bayern",
      "amtsgericht": "Amtsgericht Traunstein",
      "registernummer": "HRB 23099",
      "registerart": "HRB",
      "company_name": "aktivendo GmbH",
      "company_seat": "Edling",
      "details": "05.08.2025 (Bekanntmachungsdatum)\n\nBayern Amtsgericht Traunstein HRB 23099\nRegisterbekanntmachung nach dem Umwandlungsgesetz 03.08.2025 (Eintragungsdatum)\n\naktivendo GmbH\nGesellschaft mit beschränkter Haftung\nEdling\n\nDen Gläubigern der an der Verschmelzung beteiligten Rechtsträger ist, wenn sie binnen sechs Monaten nach dem Tag, an dem die Eintragung der Verschmelzung in das Register des Sitzes desjenigen Rechtsträgers, dessen Gläubiger sie sind, nach § 19 Abs. 3 UmwG als bekannt gemacht gilt, ihren Anspruch nach Grund und Höhe in Textform anmelden, Sicherheit zu leisten, soweit sie nicht Befriedigung verlangen können. Dieses Recht steht den Gläubigern jedoch nur zu, wenn sie glaubhaft machen, dass durch die Verschmelzung die Erfüllung ihrer Forderung gefährdet wird."
    },
    {
      "date": "2025-08-05",
      "id": "119214",
      "original_text": "Registerbekanntmachung nach dem Umwandlungsgesetz\nBayern Amtsgericht Amberg HRB 564\nEDV-BV GmbH – Nabburg",
      "type": "Registerbekanntmachung nach dem Umwandlungsgesetz",
      "state": "Bayern",
      "amtsgericht": "Amtsgericht Amberg",
      "registernummer": "HRB 564",
      "registerart": "HRB",
      "company_name": "EDV-BV GmbH",
      "company_seat": "Nabburg",
      "details": "05.08.2025 (Bekanntmachungsdatum)\n\nBayern Amtsgericht Amberg HRB 564\nRegisterbekanntmachung nach dem Umwandlungsgesetz 04.08.2025 (Eintragungsdatum)\n\nEDV-BV GmbH\nGesellschaft mit beschränkter Haftung\nNabburg\n\nDen Gläubigern der an der Verschmelzung beteiligten Rechtsträger ist, wenn sie binnen sechs Monaten nach dem Tag, an dem die Eintragung der Verschmelzung in das Register des Sitzes desjenigen Rechtsträgers, dessen Gläubiger sie sind, nach § 19 Abs. 3 UmwG als bekannt gemacht gilt, ihren Anspruch nach Grund und Höhe in Textform anmelden, Sicherheit zu leisten, soweit sie nicht Befriedigung verlangen können. Dieses Recht steht den Gläubigern jedoch nur zu, wenn sie glaubhaft machen, dass durch die Verschmelzung die Erfüllung ihrer Forderung gefährdet wird."
    },
    {
      "date": "2025-08-05",
      "id": "119215",
      "original_text": "Löschungsankündigung\nBayern Amtsgericht München HRB 188001\nCAD Point UG (haftungsbeschränkt) – München",
      "type": "Löschungsankündigung",
      "state": "Bayern",
      "amtsgericht": "Amtsgericht München",
      "registernummer": "HRB 188001",
      "registerart": "HRB",
      "company_name": "CAD Point UG (haftungsbeschränkt)",
      "company_seat": "München",
      "details": "05.08.2025 (Bekanntmachungsdatum)\n\nBayern Amtsgericht München HRB 188001\nLöschungsankündigung 04.08.2025 (Eintragungsdatum)\n\nCAD Point UG (haftungsbeschränkt)\nGesellschaft mit beschränkter Haftung\nMünchen\n\nDas Registergericht beabsichtigt, die im Handelsregister eingetragene Gesellschaft wegen Vermögenslosigkeit von Amts wegen nach § 394 FamFG zu löschen. Die Frist zur Erhebung eines Widerspruchs ist auf drei Monate festgesetzt."
    },
    {
      "date": "2025-08-05",
      "id": "119216",
      "original_text": "Einreichung neuer Dokumente\nBayern Amtsgericht München HRB 285565\nWTS Tax AG – München",
      "type": "Einreichung neuer Dokumente",
      "state": "Bayern",
      "amtsgericht": "Amtsgericht München",
      "registernummer": "HRB 285565",
      "registerart": "HRB",
      "company_name": "WTS Tax AG",
      "company_seat": "München",
      "details": "05.08.2025 (Bekanntmachungsdatum)\n\nBayern Amtsgericht München HRB 285565\nEinreichung neuer Dokumente 04.08.2025 (Eintragungsdatum)\n\nWTS Tax AG\nAktiengesellschaft\nMünchen\n\nDem Amtsgericht München -Registergericht- ist eine Liste der Mitglieder des Aufsichtsrats eingereicht worden, § 106 AktG."
    },
    {
      "date": "2025-08-05",
      "id": "119217",
      "original_text": "Löschungsankündigung\nBayern Amtsgericht München HRB 159600\nErdstrom AG – München",
      "type": "Löschungsankündigung",
      "state": "Bayern",
      "amtsgericht": "Amtsgericht München",
      "registernummer": "HRB 159600",
      "registerart": "HRB",
      "company_name": "Erdstrom AG",
      "company_seat": "München",
      "details": "05.08.2025 (Bekanntmachungsdatum)\n\nBayern Amtsgericht München HRB 159600\nLöschungsankündigung 04.08.2025 (Eintragungsdatum)\n\nErdstrom AG\nAktiengesellschaft\nMünchen\n\nDas Registergericht beabsichtigt, die im Handelsregister eingetragene Gesellschaft wegen Vermögenslosigkeit von Amts wegen nach § 394 FamFG zu löschen. Die Frist zur Erhebung eines Widerspruchs ist auf drei Monate festgesetzt."
    },
    {
      "date": "2025-08-05",
      "id": "119218",
      "original_text": "Registerbekanntmachung nach dem Umwandlungsgesetz\nBayern Amtsgericht Bamberg HRB 4896\nPielsticker & Hornung Versicherungsmakler GmbH – Hirschaid",
      "type": "Registerbekanntmachung nach dem Umwandlungsgesetz",
      "state": "Bayern",
      "amtsgericht": "Amtsgericht Bamberg",
      "registernummer": "HRB 4896",
      "registerart": "HRB",
      "company_name": "Pielsticker & Hornung Versicherungsmakler GmbH",
      "company_seat": "Hirschaid",
      "details": "05.08.2025 (Bekanntmachungsdatum)\n\nBayern Amtsgericht Bamberg HRB 4896\nRegisterbekanntmachung nach dem Umwandlungsgesetz 04.08.2025 (Eintragungsdatum)\n\nPielsticker & Hornung Versicherungsmakler GmbH\nGesellschaft mit beschränkter Haftung\nHirschaid\n\nDen Gläubigern der an der Verschmelzung beteiligten Rechtsträger ist, wenn sie binnen sechs Monaten nach dem Tag, an dem die Eintragung der Verschmelzung in das Register des Sitzes desjenigen Rechtsträgers, dessen Gläubiger sie sind, nach § 19 Abs. 3 UmwG als bekannt gemacht gilt, ihren Anspruch nach Grund und Höhe in Textform anmelden, Sicherheit zu leisten, soweit sie nicht Befriedigung verlangen können. Dieses Recht steht den Gläubigern jedoch nur zu, wenn sie glaubhaft machen, dass durch die Verschmelzung die Erfüllung ihrer Forderung gefährdet wird."
    },
    {
      "date": "2025-08-05",
      "id": "119219",
      "original_text": "Registerbekanntmachung nach dem Umwandlungsgesetz\nBayern Amtsgericht München HRB 200762\nGreen City Energy Wind Service Emsdetten GmbH – München",
      "type": "Registerbekanntmachung nach dem Umwandlungsgesetz",
      "state": "Bayern",
      "amtsgericht": "Amtsgericht München",
      "registernummer": "HRB 200762",
      "registerart": "HRB",
      "company_name": "Green City Energy Wind Service Emsdetten GmbH",
      "company_seat": "München",
      "details": "05.08.2025 (Bekanntmachungsdatum)\n\nBayern Amtsgericht München HRB 200762\nRegisterbekanntmachung nach dem Umwandlungsgesetz 04.08.2025 (Eintragungsdatum)\n\nGreen City Energy Wind Service Emsdetten GmbH\nGesellschaft mit beschränkter Haftung\nMünchen\n\nDen Gläubigern der an der Verschmelzung beteiligten Rechtsträger ist, wenn sie binnen sechs Monaten nach dem Tag, an dem die Eintragung der Verschmelzung in das Register des Sitzes desjenigen Rechtsträgers, dessen Gläubiger sie sind, nach § 19 Abs. 3 UmwG als bekannt gemacht gilt, ihren Anspruch nach Grund und Höhe in Textform anmelden, Sicherheit zu leisten, soweit sie nicht Befriedigung verlangen können. Dieses Recht steht den Gläubigern jedoch nur zu, wenn sie glaubhaft machen, dass durch die Verschmelzung die Erfüllung ihrer Forderung gefährdet wird."
    },
    {
      "date": "2025-08-05",
      "id": "119220",
      "original_text": "Löschungsankündigung\nBayern Amtsgericht Hof HRB 6808\nRollostar UG (haftungsbeschränkt) – Wunsiedel",
      "type": "Löschungsankündigung",
      "state": "Bayern",
      "amtsgericht": "Amtsgericht Hof",
      "registernummer": "HRB 6808",
      "registerart": "HRB",
      "company_name": "Rollostar UG (haftungsbeschränkt)",
      "company_seat": "Wunsiedel",
      "details": "05.08.2025 (Bekanntmachungsdatum)\n\nBayern Amtsgericht Hof HRB 6808\nLöschungsankündigung\n\nRollostar UG (haftungsbeschränkt)\nGesellschaft mit beschränkter Haftung\nWunsiedel\n\nDas Registergericht beabsichtigt, den im Handelsregister eingetragenen Geschäftsführer Ralf Hasselbacher, geb. 25.10.1971, von Amts wegen nach § 395 FamFG zu löschen. Die Frist zur Erhebung eines Widerspruchs ist auf einen Monat festgesetzt."
    },
    {
      "date": "2025-08-05",
      "id": "119221",
      "original_text": "Registerbekanntmachung nach dem Umwandlungsgesetz\nBayern Amtsgericht Bamberg HRB 3280\nAuto Thurn GmbH – Forchheim",
      "type": "Registerbekanntmachung nach dem Umwandlungsgesetz",
      "state": "Bayern",
      "amtsgericht": "Amtsgericht Bamberg",
      "registernummer": "HRB 3280",
      "registerart": "HRB",
      "company_name": "Auto Thurn GmbH",
      "company_seat": "Forchheim",
      "details": "05.08.2025 (Bekanntmachungsdatum)\n\nBayern Amtsgericht Bamberg HRB 3280\nRegisterbekanntmachung nach dem Umwandlungsgesetz 04.08.2025 (Eintragungsdatum)\n\nAuto Thurn GmbH\nGesellschaft mit beschränkter Haftung\nForchheim\n\nDen Gläubigern der an der Verschmelzung beteiligten Rechtsträger ist, wenn sie binnen sechs Monaten nach dem Tag, an dem die Eintragung der Verschmelzung in das Register des Sitzes desjenigen Rechtsträgers, dessen Gläubiger sie sind, nach § 19 Abs. 3 UmwG als bekannt gemacht gilt, ihren Anspruch nach Grund und Höhe in Textform anmelden, Sicherheit zu leisten, soweit sie nicht Befriedigung verlangen können. Dieses Recht steht den Gläubigern jedoch nur zu, wenn sie glaubhaft machen, dass durch die Verschmelzung die Erfüllung ihrer Forderung gefährdet wird."
    },
    {
      "date": "2025-08-05",
      "id": "119222",
      "original_text": "Registerbekanntmachung nach dem Umwandlungsgesetz\nBayern Amtsgericht Kempten (Allgäu) HRA 11661\nAviva Fitness, Inhaberin Barbara Renn e. K. – Blaichach",
      "type": "Registerbekanntmachung nach dem Umwandlungsgesetz",
      "state": "Bayern",
      "amtsgericht": "Amtsgericht Kempten (Allgäu)",
      "registernummer": "HRA 11661",
      "registerart": "HRA",
      "company_name": "Aviva Fitness, Inhaberin Barbara Renn e. K.",
      "company_seat": "Blaichach",
      "details": "05.08.2025 (Bekanntmachungsdatum)\n\nBayern Amtsgericht Kempten (Allgäu) HRA 11661\nRegisterbekanntmachung nach dem Umwandlungsgesetz 03.08.2025 (Eintragungsdatum)\n\nAviva Fitness, Inhaberin Barbara Renn e. K.\nEinzelkaufmann / Einzelkauffrau\nBlaichach\n\nDen Gläubigern der an der Ausgliederung beteiligten Rechtsträger ist, wenn sie binnen sechs Monaten nach dem Tag, an dem die Eintragung der Ausgliederung in das Register des Sitzes desjenigen Rechtsträgers, dessen Gläubiger sie sind, nach §§ 125, 19 Abs. 3 UmwG als bekannt gemacht gilt, ihren Anspruch nach Grund und Höhe in Textform anmelden, Sicherheit zu leisten, soweit sie nicht Befriedigung verlangen können. Dieses Recht steht den Gläubigern jedoch nur zu, wenn sie glaubhaft machen, dass durch die Ausgliederung die Erfüllung ihrer Forderung gefährdet wird."
    },
    {
      "date": "2025-08-05",
      "id": "119223",
      "original_text": "Einreichung neuer Dokumente\nBayern Amtsgericht Schweinfurt HRB 1670\nRHÖN-KLINIKUM Aktiengesellschaft – Bad Neustadt a.d.Saale",
      "type": "Einreichung neuer Dokumente",
      "state": "Bayern",
      "amtsgericht": "Amtsgericht Schweinfurt",
      "registernummer": "HRB 1670",
      "registerart": "HRB",
      "company_name": "RHÖN-KLINIKUM Aktiengesellschaft",
      "company_seat": "Bad Neustadt a.d.Saale",
      "details": "05.08.2025 (Bekanntmachungsdatum)\n\nBayern Amtsgericht Schweinfurt HRB 1670\nEinreichung neuer Dokumente\n\nRHÖN-KLINIKUM Aktiengesellschaft\nAktiengesellschaft\nBad Neustadt a.d.Saale\n\nDem Amtsgericht Schweinfurt -Registergericht- ist eine Liste der Mitglieder des Aufsichtsrats eingereicht worden, § 106 AktG."
    },
    {
      "date": "2025-08-05",
      "id": "119224",
      "original_text": "Registerbekanntmachung nach dem Umwandlungsgesetz\nBayern Amtsgericht München HRB 217120\nSüddeutsche Getränkedistribution GmbH – München",
      "type": "Registerbekanntmachung nach dem Umwandlungsgesetz",
      "state": "Bayern",
      "amtsgericht": "Amtsgericht München",
      "registernummer": "HRB 217120",
      "registerart": "HRB",
      "company_name": "Süddeutsche Getränkedistribution GmbH",
      "company_seat": "München",
      "details": "05.08.2025 (Bekanntmachungsdatum)\n\nBayern Amtsgericht München HRB 217120\nRegisterbekanntmachung nach dem Umwandlungsgesetz 04.08.2025 (Eintragungsdatum)\n\nSüddeutsche Getränkedistribution GmbH\nGesellschaft mit beschränkter Haftung\nMünchen\n\nDen Gläubigern der an der Verschmelzung beteiligten Rechtsträger ist, wenn sie binnen sechs Monaten nach dem Tag, an dem die Eintragung der Verschmelzung in das Register des Sitzes desjenigen Rechtsträgers, dessen Gläubiger sie sind, nach § 19 Abs. 3 UmwG als bekannt gemacht gilt, ihren Anspruch nach Grund und Höhe in Textform anmelden, Sicherheit zu leisten, soweit sie nicht Befriedigung verlangen können. Dieses Recht steht den Gläubigern jedoch nur zu, wenn sie glaubhaft machen, dass durch die Verschmelzung die Erfüllung ihrer Forderung gefährdet wird."
    },
    {
      "date": "2025-08-05",
      "id": "119225",
      "original_text": "Registerbekanntmachung nach dem Umwandlungsgesetz\nBayern Amtsgericht München HRB 42052\nVersicherungskammer Rechtsschutz Vertriebs- und Service GmbH – München",
      "type": "Registerbekanntmachung nach dem Umwandlungsgesetz",
      "state": "Bayern",
      "amtsgericht": "Amtsgericht München",
      "registernummer": "HRB 42052",
      "registerart": "HRB",
      "company_name": "Versicherungskammer Rechtsschutz Vertriebs- und Service GmbH",
      "company_seat": "München",
      "details": "05.08.2025 (Bekanntmachungsdatum)\n\nBayern Amtsgericht München HRB 42052\nRegisterbekanntmachung nach dem Umwandlungsgesetz 04.08.2025 (Eintragungsdatum)\n\nVersicherungskammer Rechtsschutz Vertriebs- und Service GmbH\nGesellschaft mit beschränkter Haftung\nMünchen\n\nDen Gläubigern der an der Verschmelzung beteiligten Rechtsträger ist, wenn sie binnen sechs Monaten nach dem Tag, an dem die Eintragung der Verschmelzung in das Register des Sitzes desjenigen Rechtsträgers, dessen Gläubiger sie sind, nach § 19 Abs. 3 UmwG als bekannt gemacht gilt, ihren Anspruch nach Grund und Höhe in Textform anmelden, Sicherheit zu leisten, soweit sie nicht Befriedigung verlangen können. Dieses Recht steht den Gläubigern jedoch nur zu, wenn sie glaubhaft machen, dass durch die Verschmelzung die Erfüllung ihrer Forderung gefährdet wird."
    },
    {
      "date": "2025-08-05",
      "id": "119226",
      "original_text": "Löschungsankündigung\nBayern Amtsgericht Ingolstadt HRB 5156\nIN Verwaltungs GmbH – Lenting",
      "type": "Löschungsankündigung",
      "state": "Bayern",
      "amtsgericht": "Amtsgericht Ingolstadt",
      "registernummer": "HRB 5156",
      "registerart": "HRB",
      "company_name": "IN Verwaltungs GmbH",
      "company_seat": "Lenting",
      "details": "05.08.2025 (Bekanntmachungsdatum)\n\nBayern Amtsgericht Ingolstadt HRB 5156\nLöschungsankündigung\n\nIN Verwaltungs GmbH\nGesellschaft mit beschränkter Haftung\nLenting\n\nDas Registergericht beabsichtigt, die im Handelsregister eingetragene Gesellschaft wegen Vermögenslosigkeit von Amts wegen nach § 394 FamFG zu löschen. Die Frist zur Erhebung eines Widerspruchs ist auf einen Monat festgesetzt."
    },
    {
      "date": "2025-08-05",
      "id": "119227",
      "original_text": "Einreichung neuer Dokumente\nBayern Amtsgericht München HRB 288350\nBlitz 23-866 SE – München",
      "type": "Einreichung neuer Dokumente",
      "state": "Bayern",
      "amtsgericht": "Amtsgericht München",
      "registernummer": "HRB 288350",
      "registerart": "HRB",
      "company_name": "Blitz 23-866 SE",
      "company_seat": "München",
      "details": "05.08.2025 (Bekanntmachungsdatum)\n\nBayern Amtsgericht München HRB 288350\nEinreichung neuer Dokumente 04.08.2025 (Eintragungsdatum)\n\nBlitz 23-866 SE\nEuropäische Aktiengesellschaft (SE)\nMünchen\n\nDem Amtsgericht München -Registergericht- ist eine Liste der Mitglieder des Verwaltungsrats eingereicht worden, Art. 9 Abs. 1 Buchst. c (ii) SE-VO i.V.m. § 106 AktG."
    },
    {
      "date": "2025-08-05",
      "id": "119228",
      "original_text": "Registerbekanntmachung nach dem Umwandlungsgesetz\nBayern Amtsgericht Kempten (Allgäu) HRB 6702\nElektro Haltmayr Verwaltungs GmbH – Blaichach",
      "type": "Registerbekanntmachung nach dem Umwandlungsgesetz",
      "state": "Bayern",
      "amtsgericht": "Amtsgericht Kempten (Allgäu)",
      "registernummer": "HRB 6702",
      "registerart": "HRB",
      "company_name": "Elektro Haltmayr Verwaltungs GmbH",
      "company_seat": "Blaichach",
      "details": "05.08.2025 (Bekanntmachungsdatum)\n\nBayern Amtsgericht Kempten (Allgäu) HRB 6702\nRegisterbekanntmachung nach dem Umwandlungsgesetz 04.08.2025 (Eintragungsdatum)\n\nElektro Haltmayr Verwaltungs GmbH\nGesellschaft mit beschränkter Haftung\nBlaichach\n\nDen Gläubigern der an der Verschmelzung beteiligten Rechtsträger ist, wenn sie binnen sechs Monaten nach dem Tag, an dem die Eintragung der Verschmelzung in das Register des Sitzes desjenigen Rechtsträgers, dessen Gläubiger sie sind, nach § 19 Abs. 3 UmwG als bekannt gemacht gilt, ihren Anspruch nach Grund und Höhe in Textform anmelden, Sicherheit zu leisten, soweit sie nicht Befriedigung verlangen können. Dieses Recht steht den Gläubigern jedoch nur zu, wenn sie glaubhaft machen, dass durch die Verschmelzung die Erfüllung ihrer Forderung gefährdet wird."
    },
    {
      "date": "2025-08-05",
      "id": "119229",
      "original_text": "Registerbekanntmachung nach dem Umwandlungsgesetz\nBayern Amtsgericht Hof VR 442\nKEB - Katholische Erwachsenenbildung in Stadt und Landkreis Hof e.V. – Hof",
      "type": "Registerbekanntmachung nach dem Umwandlungsgesetz",
      "state": "Bayern",
      "amtsgericht": "Amtsgericht Hof",
      "registernummer": "VR 442",
      "registerart": "VR",
      "company_name": "KEB - Katholische Erwachsenenbildung in Stadt und Landkreis Hof e.V.",
      "company_seat": "Hof",
      "details": "05.08.2025 (Bekanntmachungsdatum)\n\nBayern Amtsgericht Hof VR 442\nRegisterbekanntmachung nach dem Umwandlungsgesetz 04.08.2025 (Eintragungsdatum)\n\nKEB - Katholische Erwachsenenbildung in Stadt und Landkreis Hof e.V.\neingetragener Verein\nHof\n\nDen Gläubigern der an der Verschmelzung beteiligten Rechtsträger ist, wenn sie binnen sechs Monaten nach dem Tag, an dem die Eintragung der Verschmelzung in das Register des Sitzes desjenigen Rechtsträgers, dessen Gläubiger sie sind, nach § 19 Abs. 3 UmwG als bekannt gemacht gilt, ihren Anspruch nach Grund und Höhe in Textform anmelden, Sicherheit zu leisten, soweit sie nicht Befriedigung verlangen können. Dieses Recht steht den Gläubigern jedoch nur zu, wenn sie glaubhaft machen, dass durch die Verschmelzung die Erfüllung ihrer Forderung gefährdet wird."
    },
    {
      "date": "2025-08-05",
      "id": "119230",
      "original_text": "Registerbekanntmachung nach dem Umwandlungsgesetz\nBayern Amtsgericht München HRB 116062\nErwin Weber GmbH – Neufahrn",
      "type": "Registerbekanntmachung nach dem Umwandlungsgesetz",
      "state": "Bayern",
      "amtsgericht": "Amtsgericht München",
      "registernummer": "HRB 116062",
      "registerart": "HRB",
      "company_name": "Erwin Weber GmbH",
      "company_seat": "Neufahrn",
      "details": "05.08.2025 (Bekanntmachungsdatum)\n\nBayern Amtsgericht München HRB 116062\nRegisterbekanntmachung nach dem Umwandlungsgesetz 04.08.2025 (Eintragungsdatum)\n\nErwin Weber GmbH\nGesellschaft mit beschränkter Haftung\nNeufahrn\n\nDen Gläubigern der an der Verschmelzung beteiligten Rechtsträger ist, wenn sie binnen sechs Monaten nach dem Tag, an dem die Eintragung der Verschmelzung in das Register des Sitzes desjenigen Rechtsträgers, dessen Gläubiger sie sind, nach § 19 Abs. 3 UmwG als bekannt gemacht gilt, ihren Anspruch nach Grund und Höhe in Textform anmelden, Sicherheit zu leisten, soweit sie nicht Befriedigung verlangen können. Dieses Recht steht den Gläubigern jedoch nur zu, wenn sie glaubhaft machen, dass durch die Verschmelzung die Erfüllung ihrer Forderung gefährdet wird."
    },
    {
      "date": "2025-08-05",
      "id": "119231",
      "original_text": "Registerbekanntmachung nach dem Umwandlungsgesetz\nBayern Amtsgericht Regensburg HRA 11159\nMaler-Service Lippert e. K. – Regenstauf",
      "type": "Registerbekanntmachung nach dem Umwandlungsgesetz",
      "state": "Bayern",
      "amtsgericht": "Amtsgericht Regensburg",
      "registernummer": "HRA 11159",
      "registerart": "HRA",
      "company_name": "Maler-Service Lippert e. K.",
      "company_seat": "Regenstauf",
      "details": "05.08.2025 (Bekanntmachungsdatum)\n\nBayern Amtsgericht Regensburg HRA 11159\nRegisterbekanntmachung nach dem Umwandlungsgesetz 04.08.2025 (Eintragungsdatum)\n\nMaler-Service Lippert e. K.\nEinzelkaufmann / Einzelkauffrau\nRegenstauf\n\nDen Gläubigern der an der Ausgliederung beteiligten Rechtsträger ist, wenn sie binnen sechs Monaten nach dem Tag, an dem die Eintragung der Ausgliederung in das Register des Sitzes desjenigen Rechtsträgers, dessen Gläubiger sie sind, nach §§ 125, 19 Abs. 3 UmwG als bekannt gemacht gilt, ihren Anspruch nach Grund und Höhe in Textform anmelden, Sicherheit zu leisten, soweit sie nicht Befriedigung verlangen können. Dieses Recht steht den Gläubigern jedoch nur zu, wenn sie glaubhaft machen, dass durch die Ausgliederung die Erfüllung ihrer Forderung gefährdet wird."
    },
    {
      "date": "2025-08-05",
      "id": "119232",
      "original_text": "Registerbekanntmachung nach dem Umwandlungsgesetz\nBayern Amtsgericht München GsR 1449\nRegendantz Starenweg eGbR – München",
      "type": "Registerbekanntmachung nach dem Umwandlungsgesetz",
      "state": "Bayern",
      "amtsgericht": "Amtsgericht München",
      "registernummer": "GsR 1449",
      "registerart": "GsR",
      "company_name": "Regendantz Starenweg eGbR",
      "company_seat": "München",
      "details": "05.08.2025 (Bekanntmachungsdatum)\n\nBayern Amtsgericht München GsR 1449\nRegisterbekanntmachung nach dem Umwandlungsgesetz 04.08.2025 (Eintragungsdatum)\n\nRegendantz Starenweg eGbR\nGesellschaft bürgerlichen Rechts\nMünchen\n\nDen Gläubigern des formwechselnden Rechtsträgers ist, wenn sie binnen sechs Monaten nach dem Tag, an dem die Eintragung des Formwechsels nach § 201 UmwG als bekannt gemacht gilt, ihren Anspruch nach Grund und Höhe in Textform anmelden, Sicherheit zu leisten, soweit sie nicht Befriedigung verlangen können. Dieses Recht steht den Gläubigern jedoch nur zu, wenn sie glaubhaft machen, dass durch den Formwechsel die Erfüllung ihrer Forderung gefährdet wird."
    },
    {
      "date": "2025-08-05",
      "id": "119233",
      "original_text": "Löschungsankündigung\nBayern Amtsgericht Nürnberg HRB 32919\nALLES RUND UMS HAUS STÖCKER UG (haftungsbeschränkt) – Winkelhaid",
      "type": "Löschungsankündigung",
      "state": "Bayern",
      "amtsgericht": "Amtsgericht Nürnberg",
      "registernummer": "HRB 32919",
      "registerart": "HRB",
      "company_name": "ALLES RUND UMS HAUS STÖCKER UG (haftungsbeschränkt)",
      "company_seat": "Winkelhaid",
      "details": "05.08.2025 (Bekanntmachungsdatum)\n\nBayern Amtsgericht Nürnberg HRB 32919\nLöschungsankündigung\n\nALLES RUND UMS HAUS STÖCKER UG (haftungsbeschränkt)\nGesellschaft mit beschränkter Haftung\nWinkelhaid\n\nDas Registergericht beabsichtigt, die im Handelsregister eingetragene Gesellschaft wegen Vermögenslosigkeit von Amts wegen nach § 394 FamFG zu löschen. Die Frist zur Erhebung eines Widerspruchs ist auf einen Monat festgesetzt."
    },
    {
      "date": "2025-08-05",
      "id": "119234",
      "original_text": "Registerbekanntmachung nach dem Umwandlungsgesetz\nBayern Amtsgericht München HRB 278320\nENTRO Service GmbH – München",
      "type": "Registerbekanntmachung nach dem Umwandlungsgesetz",
      "state": "Bayern",
      "amtsgericht": "Amtsgericht München",
      "registernummer": "HRB 278320",
      "registerart": "HRB",
      "company_name": "ENTRO Service GmbH",
      "company_seat": "München",
      "details": "05.08.2025 (Bekanntmachungsdatum)\n\nBayern Amtsgericht München HRB 278320\nRegisterbekanntmachung nach dem Umwandlungsgesetz 04.08.2025 (Eintragungsdatum)\n\nENTRO Service GmbH\nGesellschaft mit beschränkter Haftung\nMünchen\n\nDen Gläubigern der an der Verschmelzung beteiligten Rechtsträger ist, wenn sie binnen sechs Monaten nach dem Tag, an dem die Eintragung der Verschmelzung in das Register des Sitzes desjenigen Rechtsträgers, dessen Gläubiger sie sind, nach § 19 Abs. 3 UmwG als bekannt gemacht gilt, ihren Anspruch nach Grund und Höhe in Textform anmelden, Sicherheit zu leisten, soweit sie nicht Befriedigung verlangen können. Dieses Recht steht den Gläubigern jedoch nur zu, wenn sie glaubhaft machen, dass durch die Verschmelzung die Erfüllung ihrer Forderung gefährdet wird."
    },
    {
      "date": "2025-08-05",
      "id": "119235",
      "original_text": "Registerbekanntmachung nach dem Umwandlungsgesetz\nBayern Amtsgericht Kempten (Allgäu) HRB 18143\nAviva Social Club GmbH – Blaichach",
      "type": "Registerbekanntmachung nach dem Umwandlungsgesetz",
      "state": "Bayern",
      "amtsgericht": "Amtsgericht Kempten (Allgäu)",
      "registernummer": "HRB 18143",
      "registerart": "HRB",
      "company_name": "Aviva Social Club GmbH",
      "company_seat": "Blaichach",
      "details": "05.08.2025 (Bekanntmachungsdatum)\n\nBayern Amtsgericht Kempten (Allgäu) HRB 18143\nRegisterbekanntmachung nach dem Umwandlungsgesetz 03.08.2025 (Eintragungsdatum)\n\nAviva Social Club GmbH\nGesellschaft mit beschränkter Haftung\nBlaichach\n\nDen Gläubigern der an der Ausgliederung beteiligten Rechtsträger ist, wenn sie binnen sechs Monaten nach dem Tag, an dem die Eintragung der Ausgliederung in das Register des Sitzes desjenigen Rechtsträgers, dessen Gläubiger sie sind, nach §§ 125, 19 Abs. 3 UmwG als bekannt gemacht gilt, ihren Anspruch nach Grund und Höhe in Textform anmelden, Sicherheit zu leisten, soweit sie nicht Befriedigung verlangen können. Dieses Recht steht den Gläubigern jedoch nur zu, wenn sie glaubhaft machen, dass durch die Ausgliederung die Erfüllung ihrer Forderung gefährdet wird."
    },
    {
      "date": "2025-08-05",
      "id": "119236",
      "original_text": "Registerbekanntmachung nach dem Umwandlungsgesetz\nBayern Amtsgericht Augsburg HRA 21808\nHarald Diebold Beratungen e.K. – Gersthofen",
      "type": "Registerbekanntmachung nach dem Umwandlungsgesetz",
      "state": "Bayern",
      "amtsgericht": "Amtsgericht Augsburg",
      "registernummer": "HRA 21808",
      "registerart": "HRA",
      "company_name": "Harald Diebold Beratungen e.K.",
      "company_seat": "Gersthofen",
      "details": "05.08.2025 (Bekanntmachungsdatum)\n\nBayern Amtsgericht Augsburg HRA 21808\nRegisterbekanntmachung nach dem Umwandlungsgesetz 04.08.2025 (Eintragungsdatum)\n\nHarald Diebold Beratungen e.K.\nEinzelkaufmann / Einzelkauffrau\nGersthofen\n\nDen Gläubigern der an der Ausgliederung beteiligten Rechtsträger ist, wenn sie binnen sechs Monaten nach dem Tag, an dem die Eintragung der Ausgliederung in das Register des Sitzes desjenigen Rechtsträgers, dessen Gläubiger sie sind, nach §§ 125, 19 Abs. 3 UmwG als bekannt gemacht gilt, ihren Anspruch nach Grund und Höhe in Textform anmelden, Sicherheit zu leisten, soweit sie nicht Befriedigung verlangen können. Dieses Recht steht den Gläubigern jedoch nur zu, wenn sie glaubhaft machen, dass durch die Ausgliederung die Erfüllung ihrer Forderung gefährdet wird."
    },
    {
      "date": "2025-08-05",
      "id": "119237",
      "original_text": "Registerbekanntmachung nach dem Umwandlungsgesetz\nBayern Amtsgericht Augsburg HRB 37147\nParmenas Verwaltungs GmbH – Augsburg",
      "type": "Registerbekanntmachung nach dem Umwandlungsgesetz",
      "state": "Bayern",
      "amtsgericht": "Amtsgericht Augsburg",
      "registernummer": "HRB 37147",
      "registerart": "HRB",
      "company_name": "Parmenas Verwaltungs GmbH",
      "company_seat": "Augsburg",
      "details": "05.08.2025 (Bekanntmachungsdatum)\n\nBayern Amtsgericht Augsburg HRB 37147\nRegisterbekanntmachung nach dem Umwandlungsgesetz 02.08.2025 (Eintragungsdatum)\n\nParmenas Verwaltungs GmbH\nGesellschaft mit beschränkter Haftung\nAugsburg\n\nDen Gläubigern der an der Verschmelzung beteiligten Rechtsträger ist, wenn sie binnen sechs Monaten nach dem Tag, an dem die Eintragung der Verschmelzung in das Register des Sitzes desjenigen Rechtsträgers, dessen Gläubiger sie sind, nach § 19 Abs. 3 UmwG als bekannt gemacht gilt, ihren Anspruch nach Grund und Höhe in Textform anmelden, Sicherheit zu leisten, soweit sie nicht Befriedigung verlangen können. Dieses Recht steht den Gläubigern jedoch nur zu, wenn sie glaubhaft machen, dass durch die Verschmelzung die Erfüllung ihrer Forderung gefährdet wird."
    },
    {
      "date": "2025-08-05",
      "id": "119238",
      "original_text": "Registerbekanntmachung nach dem Umwandlungsgesetz\nBayern Amtsgericht München HRB 284181\nSPIE SPECTADES GmbH – München",
      "type": "Registerbekanntmachung nach dem Umwandlungsgesetz",
      "state": "Bayern",
      "amtsgericht": "Amtsgericht München",
      "registernummer": "HRB 284181",
      "registerart": "HRB",
      "company_name": "SPIE SPECTADES GmbH",
      "company_seat": "München",
      "details": "05.08.2025 (Bekanntmachungsdatum)\n\nBayern Amtsgericht München HRB 284181\nRegisterbekanntmachung nach dem Umwandlungsgesetz 04.08.2025 (Eintragungsdatum)\n\nSPIE SPECTADES GmbH\nGesellschaft mit beschränkter Haftung\nMünchen\n\nDen Gläubigern der an der Spaltung beteiligten Rechtsträger ist, wenn sie binnen sechs Monaten nach dem Tag, an dem die Eintragung der Spaltung in das Register des Sitzes desjenigen Rechtsträgers, dessen Gläubiger sie sind, nach §§ 125, 19 Abs. 3 UmwG als bekannt gemacht gilt, ihren Anspruch nach Grund und Höhe in Textform anmelden, Sicherheit zu leisten, soweit sie nicht Befriedigung verlangen können. Dieses Recht steht den Gläubigern jedoch nur zu, wenn sie glaubhaft machen, dass durch die Spaltung die Erfüllung ihrer Forderung gefährdet wird."
    },
    {
      "date": "2025-08-05",
      "id": "119239",
      "original_text": "Registerbekanntmachung nach dem Umwandlungsgesetz\nBayern Amtsgericht München HRA 120956\nDIEAUTOKAUFBERATER e.K. – Grünwald",
      "type": "Registerbekanntmachung nach dem Umwandlungsgesetz",
      "state": "Bayern",
      "amtsgericht": "Amtsgericht München",
      "registernummer": "HRA 120956",
      "registerart": "HRA",
      "company_name": "DIEAUTOKAUFBERATER e.K.",
      "company_seat": "Grünwald",
      "details": "05.08.2025 (Bekanntmachungsdatum)\n\nBayern Amtsgericht München HRA 120956\nRegisterbekanntmachung nach dem Umwandlungsgesetz 04.08.2025 (Eintragungsdatum)\n\nDIEAUTOKAUFBERATER e.K.\nEinzelkaufmann / Einzelkauffrau\nGrünwald\n\nDen Gläubigern der an der Ausgliederung beteiligten Rechtsträger ist, wenn sie binnen sechs Monaten nach dem Tag, an dem die Eintragung der Ausgliederung in das Register des Sitzes desjenigen Rechtsträgers, dessen Gläubiger sie sind, nach §§ 125, 19 Abs. 3 UmwG als bekannt gemacht gilt, ihren Anspruch nach Grund und Höhe in Textform anmelden, Sicherheit zu leisten, soweit sie nicht Befriedigung verlangen können. Dieses Recht steht den Gläubigern jedoch nur zu, wenn sie glaubhaft machen, dass durch die Ausgliederung die Erfüllung ihrer Forderung gefährdet wird."
    },
    {
      "date": "2025-08-05",
      "id": "119240",
      "original_text": "Registerbekanntmachung nach dem Umwandlungsgesetz\nBayern Amtsgericht München HRB 283846\nISP Global GmbH – München",
      "type": "Registerbekanntmachung nach dem Umwandlungsgesetz",
      "state": "Bayern",
      "amtsgericht": "Amtsgericht München",
      "registernummer": "HRB 283846",
      "registerart": "HRB",
      "company_name": "ISP Global GmbH",
      "company_seat": "München",
      "details": "05.08.2025 (Bekanntmachungsdatum)\n\nBayern Amtsgericht München HRB 283846\nRegisterbekanntmachung nach dem Umwandlungsgesetz 04.08.2025 (Eintragungsdatum)\n\nISP Global GmbH\nGesellschaft mit beschränkter Haftung\nMünchen\n\nDen Gläubigern der an der Verschmelzung beteiligten Rechtsträger ist, wenn sie binnen sechs Monaten nach dem Tag, an dem die Eintragung der Verschmelzung in das Register des Sitzes desjenigen Rechtsträgers, dessen Gläubiger sie sind, nach § 19 Abs. 3 UmwG als bekannt gemacht gilt, ihren Anspruch nach Grund und Höhe in Textform anmelden, Sicherheit zu leisten, soweit sie nicht Befriedigung verlangen können. Dieses Recht steht den Gläubigern jedoch nur zu, wenn sie glaubhaft machen, dass durch die Verschmelzung die Erfüllung ihrer Forderung gefährdet wird."
    },
    {
      "date": "2025-08-05",
      "id": "119241",
      "original_text": "Registerbekanntmachung nach dem Umwandlungsgesetz\nBayern Amtsgericht Traunstein HRB 32972\nTectum Immobilien GmbH – Buchbach",
      "type": "Registerbekanntmachung nach dem Umwandlungsgesetz",
      "state": "Bayern",
      "amtsgericht": "Amtsgericht Traunstein",
      "registernummer": "HRB 32972",
      "registerart": "HRB",
      "company_name": "Tectum Immobilien GmbH",
      "company_seat": "Buchbach",
      "details": "05.08.2025 (Bekanntmachungsdatum)\n\nBayern Amtsgericht Traunstein HRB 32972\nRegisterbekanntmachung nach dem Umwandlungsgesetz 03.08.2025 (Eintragungsdatum)\n\nTectum Immobilien GmbH\nGesellschaft mit beschränkter Haftung\nBuchbach\n\nDen Gläubigern der an der Spaltung beteiligten Rechtsträger ist, wenn sie binnen sechs Monaten nach dem Tag, an dem die Eintragung der Spaltung in das Register des Sitzes desjenigen Rechtsträgers, dessen Gläubiger sie sind, nach §§ 125, 19 Abs. 3 UmwG als bekannt gemacht gilt, ihren Anspruch nach Grund und Höhe in Textform anmelden, Sicherheit zu leisten, soweit sie nicht Befriedigung verlangen können. Dieses Recht steht den Gläubigern jedoch nur zu, wenn sie glaubhaft machen, dass durch die Spaltung die Erfüllung ihrer Forderung gefährdet wird."
    },
    {
      "date": "2025-08-05",
      "id": "119242",
      "original_text": "Registerbekanntmachung nach dem Umwandlungsgesetz\nBayern Amtsgericht München HRA 121253\nERAIKIN Gebäudedienstleistungen LLC & Co. KG – München",
      "type": "Registerbekanntmachung nach dem Umwandlungsgesetz",
      "state": "Bayern",
      "amtsgericht": "Amtsgericht München",
      "registernummer": "HRA 121253",
      "registerart": "HRA",
      "company_name": "ERAIKIN Gebäudedienstleistungen LLC & Co. KG",
      "company_seat": "München",
      "details": "05.08.2025 (Bekanntmachungsdatum)\n\nBayern Amtsgericht München HRA 121253\nRegisterbekanntmachung nach dem Umwandlungsgesetz 04.08.2025 (Eintragungsdatum)\n\nERAIKIN Gebäudedienstleistungen LLC & Co. KG\nKommanditgesellschaft\nMünchen\n\nDen Gläubigern der an der Verschmelzung beteiligten Rechtsträger ist, wenn sie binnen sechs Monaten nach dem Tag, an dem die Eintragung der Verschmelzung in das Register des Sitzes desjenigen Rechtsträgers, dessen Gläubiger sie sind, nach § 19 Abs. 3 UmwG als bekannt gemacht gilt, ihren Anspruch nach Grund und Höhe in Textform anmelden, Sicherheit zu leisten, soweit sie nicht Befriedigung verlangen können. Dieses Recht steht den Gläubigern jedoch nur zu, wenn sie glaubhaft machen, dass durch die Verschmelzung die Erfüllung ihrer Forderung gefährdet wird."
    },
    {
      "date": "2025-08-05",
      "id": "119243",
      "original_text": "Registerbekanntmachung nach dem Umwandlungsgesetz\nBayern Amtsgericht München HRB 285378\nIU Teaching Services 6 GmbH – München",
      "type": "Registerbekanntmachung nach dem Umwandlungsgesetz",
      "state": "Bayern",
      "amtsgericht": "Amtsgericht München",
      "registernummer": "HRB 285378",
      "registerart": "HRB",
      "company_name": "IU Teaching Services 6 GmbH",
      "company_seat": "München",
      "details": "05.08.2025 (Bekanntmachungsdatum)\n\nBayern Amtsgericht München HRB 285378\nRegisterbekanntmachung nach dem Umwandlungsgesetz 04.08.2025 (Eintragungsdatum)\n\nIU Teaching Services 6 GmbH\nGesellschaft mit beschränkter Haftung\nMünchen\n\nDen Gläubigern der an der Verschmelzung beteiligten Rechtsträger ist, wenn sie binnen sechs Monaten nach dem Tag, an dem die Eintragung der Verschmelzung in das Register des Sitzes desjenigen Rechtsträgers, dessen Gläubiger sie sind, nach § 19 Abs. 3 UmwG als bekannt gemacht gilt, ihren Anspruch nach Grund und Höhe in Textform anmelden, Sicherheit zu leisten, soweit sie nicht Befriedigung verlangen können. Dieses Recht steht den Gläubigern jedoch nur zu, wenn sie glaubhaft machen, dass durch die Verschmelzung die Erfüllung ihrer Forderung gefährdet wird."
    },
    {
      "date": "2025-08-05",
      "id": "119244",
      "original_text": "Löschungsankündigung\nBerlin Amtsgericht Berlin (Charlottenburg) HRB 203714\nDobre Gebäudereinigung UG (haftungsbeschränkt) – Berlin",
      "type": "Löschungsankündigung",
      "state": "Berlin",
      "amtsgericht": "Amtsgericht Berlin (Charlottenburg)",
      "registernummer": "HRB 203714",
      "registerart": "HRB",
      "company_name": "Dobre Gebäudereinigung UG (haftungsbeschränkt)",
      "company_seat": "Berlin",
      "details": "05.08.2025 (Bekanntmachungsdatum)\n\nBerlin Amtsgericht Berlin (Charlottenburg) HRB 203714\nLöschungsankündigung\n\nDobre Gebäudereinigung UG (haftungsbeschränkt)\nGesellschaft mit beschränkter Haftung\nBerlin\n\nBei der nachstehenden Gesellschaft wird das Amtslöschungsverfahren gemäß § 394 FamFG eingeleitet. Widerspruchsfrist 6 Wochen"
    },
    {
      "date": "2025-08-05",
      "id": "119245",
      "original_text": "Einreichung neuer Dokumente\nBaden-Württemberg Amtsgericht Freiburg HRB 712144\nwvib Schwarzwald AG – Freiburg im Breisgau",
      "type": "Einreichung neuer Dokumente",
      "state": "Baden-Württemberg",
      "amtsgericht": "Amtsgericht Freiburg",
      "registernummer": "HRB 712144",
      "registerart": "HRB",
      "company_name": "wvib Schwarzwald AG",
      "company_seat": "Freiburg im Breisgau",
      "details": "05.08.2025 (Bekanntmachungsdatum)\n\nBaden-Württemberg Amtsgericht Freiburg HRB 712144\nEinreichung neuer Dokumente 05.08.2025 (Eintragungsdatum)\n\nwvib Schwarzwald AG\nAktiengesellschaft\nFreiburg im Breisgau\n\nAls nicht eingetragen wird bekanntgemacht:\nDie Gesellschaft hat am 04.08.2025 die Liste über die Zusammensetzung des Aufsichtsrats zum Handelsregister eingereicht."
    },
    {
      "date": "2025-08-05",
      "id": "119246",
      "original_text": "Registerbekanntmachung nach dem Umwandlungsgesetz\nBaden-Württemberg Amtsgericht Mannheim HRB 730195\nWEISS.Cube GmbH – Buchen",
      "type": "Registerbekanntmachung nach dem Umwandlungsgesetz",
      "state": "Baden-Württemberg",
      "amtsgericht": "Amtsgericht Mannheim",
      "registernummer": "HRB 730195",
      "registerart": "HRB",
      "company_name": "WEISS.Cube GmbH",
      "company_seat": "Buchen",
      "details": "05.08.2025 (Bekanntmachungsdatum)\n\nBaden-Württemberg Amtsgericht Mannheim HRB 730195\nRegisterbekanntmachung nach dem Umwandlungsgesetz 05.08.2025 (Eintragungsdatum)\n\nWEISS.Cube GmbH\nGesellschaft mit beschränkter Haftung\nBuchen\n\nAls nicht eingetragen wird bekanntgemacht:\nDen Gläubigern der an der Verschmelzung beteiligten Rechtsträger ist, wenn sie binnen sechs Monaten nach dem Tag, an dem die Eintragung der Verschmelzung in das Register des Sitzes desjenigen Rechtsträgers, dessen Gläubiger sie sind, nach § 19 Abs. 3 UmwG als bekanntgemacht gilt, ihren Anspruch nach Grund und Höhe schriftlich anmelden, Sicherheit zu leisten, soweit sie nicht Befriedigung verlangen können. Dieses Recht steht den Gläubigern jedoch nur zu, wenn sie glaubhaft machen, dass durch die Verschmelzung die Erfüllung ihrer Forderung gefährdet wird."
    },
    {
      "date": "2025-08-05",
      "id": "119247",
      "original_text": "Registerbekanntmachung nach dem Umwandlungsgesetz\nBaden-Württemberg Amtsgericht Mannheim HRB 9175\nEurovan Deutschland GmbH – Mannheim",
      "type": "Registerbekanntmachung nach dem Umwandlungsgesetz",
      "state": "Baden-Württemberg",
      "amtsgericht": "Amtsgericht Mannheim",
      "registernummer": "HRB 9175",
      "registerart": "HRB",
      "company_name": "Eurovan Deutschland GmbH",
      "company_seat": "Mannheim",
      "details": "05.08.2025 (Bekanntmachungsdatum)\n\nBaden-Württemberg Amtsgericht Mannheim HRB 9175\nRegisterbekanntmachung nach dem Umwandlungsgesetz 05.08.2025 (Eintragungsdatum)\n\nEurovan Deutschland GmbH\nGesellschaft mit beschränkter Haftung\nMannheim\n\nAls nicht eingetragen wird bekanntgemacht:\nDen Gläubigern der an der Verschmelzung beteiligten Rechtsträger ist, wenn sie binnen sechs Monaten nach dem Tag, an dem die Eintragung der Verschmelzung in das Register des Sitzes desjenigen Rechtsträgers, dessen Gläubiger sie sind, nach § 19 Abs. 3 UmwG als bekanntgemacht gilt, ihren Anspruch nach Grund und Höhe schriftlich anmelden, Sicherheit zu leisten, soweit sie nicht Befriedigung verlangen können. Dieses Recht steht den Gläubigern jedoch nur zu, wenn sie glaubhaft machen, dass durch die Verschmelzung die Erfüllung ihrer Forderung gefährdet wird."
    },
    {
      "date": "2025-08-05",
      "id": "119248",
      "original_text": "Registerbekanntmachung nach dem Umwandlungsgesetz\nBaden-Württemberg Amtsgericht Mannheim HRB 460231\nWEISS GmbH – Buchen Odenwald",
      "type": "Registerbekanntmachung nach dem Umwandlungsgesetz",
      "state": "Baden-Württemberg",
      "amtsgericht": "Amtsgericht Mannheim",
      "registernummer": "HRB 460231",
      "registerart": "HRB",
      "company_name": "WEISS GmbH",
      "company_seat": "Buchen Odenwald",
      "details": "05.08.2025 (Bekanntmachungsdatum)\n\nBaden-Württemberg Amtsgericht Mannheim HRB 460231\nRegisterbekanntmachung nach dem Umwandlungsgesetz 05.08.2025 (Eintragungsdatum)\n\nWEISS GmbH\nGesellschaft mit beschränkter Haftung\nBuchen Odenwald\n\nDen Gläubigern der an der Verschmelzung beteiligten Rechtsträger ist, wenn sie binnen sechs Monaten nach dem Tag, an dem die Eintragung der Verschmelzung in das Register des Sitzes desjenigen Rechtsträgers, dessen Gläubiger sie sind, nach § 19 Abs. 3 UmwG als bekanntgemacht gilt, ihren Anspruch nach Grund und Höhe schriftlich anmelden, Sicherheit zu leisten, soweit sie nicht Befriedigung verlangen können. Dieses Recht steht den Gläubigern jedoch nur zu, wenn sie glaubhaft machen, dass durch die Verschmelzung die Erfüllung ihrer Forderung gefährdet wird."
    },
    {
      "date": "2025-08-05",
      "id": "119249",
      "original_text": "Registerbekanntmachung nach dem Umwandlungsgesetz\nBaden-Württemberg Amtsgericht Mannheim HRB 108209\ns'Badisch Brauhaus Braugesellschaft mbH – Karlsruhe",
      "type": "Registerbekanntmachung nach dem Umwandlungsgesetz",
      "state": "Baden-Württemberg",
      "amtsgericht": "Amtsgericht Mannheim",
      "registernummer": "HRB 108209",
      "registerart": "HRB",
      "company_name": "s'Badisch Brauhaus Braugesellschaft mbH",
      "company_seat": "Karlsruhe",
      "details": "05.08.2025 (Bekanntmachungsdatum)\n\nBaden-Württemberg Amtsgericht Mannheim HRB 108209\nRegisterbekanntmachung nach dem Umwandlungsgesetz 05.08.2025 (Eintragungsdatum)\n\ns'Badisch Brauhaus Braugesellschaft mbH\nGesellschaft mit beschränkter Haftung\nKarlsruhe\n\nDen Gläubigern der an der Verschmelzung beteiligten Rechtsträger ist, wenn sie binnen sechs Monaten nach dem Tag, an dem die Eintragung der Verschmelzung in das Register des Sitzes desjenigen Rechtsträgers, dessen Gläubiger sie sind, nach § 19 Abs. 3 UmwG als bekanntgemacht gilt, ihren Anspruch nach Grund und Höhe schriftlich anmelden, Sicherheit zu leisten, soweit sie nicht Befriedigung verlangen können. Dieses Recht steht den Gläubigern jedoch nur zu, wenn sie glaubhaft machen, dass durch die Verschmelzung die Erfüllung ihrer Forderung gefährdet wird."
    },
    {
      "date": "2025-08-05",
      "id": "119250",
      "original_text": "Registerbekanntmachung nach dem Umwandlungsgesetz\nBaden-Württemberg Amtsgericht Mannheim HRB 102890\nAAAA Hotelwelt GmbH – Karlsruhe",
      "type": "Registerbekanntmachung nach dem Umwandlungsgesetz",
      "state": "Baden-Württemberg",
      "amtsgericht": "Amtsgericht Mannheim",
      "registernummer": "HRB 102890",
      "registerart": "HRB",
      "company_name": "AAAA Hotelwelt GmbH",
      "company_seat": "Karlsruhe",
      "details": "05.08.2025 (Bekanntmachungsdatum)\n\nBaden-Württemberg Amtsgericht Mannheim HRB 102890\nRegisterbekanntmachung nach dem Umwandlungsgesetz 05.08.2025 (Eintragungsdatum)\n\nAAAA Hotelwelt GmbH\nGesellschaft mit beschränkter Haftung\nKarlsruhe\n\nAls nicht eingetragen wird bekanntgemacht:\nDen Gläubigern der an der Verschmelzung beteiligten Rechtsträger ist, wenn sie binnen sechs Monaten nach dem Tag, an dem die Eintragung der Verschmelzung in das Register des Sitzes desjenigen Rechtsträgers, dessen Gläubiger sie sind, nach § 19 Abs. 3 UmwG als bekanntgemacht gilt, ihren Anspruch nach Grund und Höhe schriftlich anmelden, Sicherheit zu leisten, soweit sie nicht Befriedigung verlangen können. Dieses Recht steht den Gläubigern jedoch nur zu, wenn sie glaubhaft machen, dass durch die Verschmelzung die Erfüllung ihrer Forderung gefährdet wird."
    },
    {
      "date": "2025-08-05",
      "id": "119251",
      "original_text": "Registerbekanntmachung nach dem Umwandlungsgesetz\nBaden-Württemberg Amtsgericht Freiburg HRB 391507\nSteBa-Tec GmbH – Lahr",
      "type": "Registerbekanntmachung nach dem Umwandlungsgesetz",
      "state": "Baden-Württemberg",
      "amtsgericht": "Amtsgericht Freiburg",
      "registernummer": "HRB 391507",
      "registerart": "HRB",
      "company_name": "SteBa-Tec GmbH",
      "company_seat": "Lahr",
      "details": "05.08.2025 (Bekanntmachungsdatum)\n\nBaden-Württemberg Amtsgericht Freiburg HRB 391507\nRegisterbekanntmachung nach dem Umwandlungsgesetz 05.08.2025 (Eintragungsdatum)\n\nSteBa-Tec GmbH\nGesellschaft mit beschränkter Haftung\nLahr\n\nAls nicht eingetragen wird bekanntgemacht:\nDen Gläubigern der an der Verschmelzung beteiligten Rechtsträger ist, wenn sie binnen sechs Monaten nach dem Tag, an dem die Eintragung der Verschmelzung in das Register des Sitzes desjenigen Rechtsträgers, dessen Gläubiger sie sind, nach § 19 Abs. 3 UmwG als bekanntgemacht gilt, ihren Anspruch nach Grund und Höhe schriftlich anmelden, Sicherheit zu leisten, soweit sie nicht Befriedigung verlangen können. Dieses Recht steht den Gläubigern jedoch nur zu, wenn sie glaubhaft machen, dass durch die Verschmelzung die Erfüllung ihrer Forderung gefährdet wird."
    },
    {
      "date": "2025-08-05",
      "id": "119252",
      "original_text": "Registerbekanntmachung nach dem Umwandlungsgesetz\nBerlin Amtsgericht Berlin (Charlottenburg) HRB 201665\nFTI-Andersch digital GmbH – Berlin",
      "type": "Registerbekanntmachung nach dem Umwandlungsgesetz",
      "state": "Berlin",
      "amtsgericht": "Amtsgericht Berlin (Charlottenburg)",
      "registernummer": "HRB 201665",
      "registerart": "HRB",
      "company_name": "FTI-Andersch digital GmbH",
      "company_seat": "Berlin",
      "details": "05.08.2025 (Bekanntmachungsdatum)\n\nBerlin Amtsgericht Berlin (Charlottenburg) HRB 201665\nRegisterbekanntmachung nach dem Umwandlungsgesetz 04.08.2025 (Eintragungsdatum)\n\nFTI-Andersch digital GmbH\nGesellschaft mit beschränkter Haftung\nBerlin\n\nZu Eintragungsnummer 9 vom 04.08.2025 wird als nicht eingetragen veröffentlicht: Den Gläubigern der an der Verschmelzung beteiligten Rechtsträger ist, wenn sie binnen sechs Monaten nach dem Tag, an dem die Eintragung der Verschmelzung in das Register des Sitzes desjenigen Rechtsträgers, dessen Gläubiger sie sind, als bekannt gemacht gilt, ihren Anspruch nach Grund und Höhe schriftlich anmelden, Sicherheit zu leisten, soweit sie nicht Befriedigung verlangen können. Dieses Recht steht den Gläubigern jedoch nur zu, wenn sie glaubhaft machen, dass durch die Verschmelzung die Erfüllung ihrer Forderung gefährdet wird. Das Recht, Sicherheitsleistung zu verlangen, steht Gläubigern nicht zu, die im Falle der Insolvenz ein Recht auf vorzugsweise Befriedigung aus einer Deckungsmasse haben, die nach gesetzlicher Vorschrift zu ihrem Schutz errichtet und staatlich überwacht ist."
    },
    {
      "date": "2025-08-05",
      "id": "119253",
      "original_text": "Registerbekanntmachung nach dem Umwandlungsgesetz\nBerlin Amtsgericht Berlin (Charlottenburg) GsR 3503\nSchell & Heininger UG (haftungsbeschränkt) & Co. eGbR – Berlin",
      "type": "Registerbekanntmachung nach dem Umwandlungsgesetz",
      "state": "Berlin",
      "amtsgericht": "Amtsgericht Berlin (Charlottenburg)",
      "registernummer": "GsR 3503",
      "registerart": "GsR",
      "company_name": "Schell & Heininger UG (haftungsbeschränkt) & Co. eGbR",
      "company_seat": "Berlin",
      "details": "05.08.2025 (Bekanntmachungsdatum)\n\nBerlin Amtsgericht Berlin (Charlottenburg) GsR 3503\nRegisterbekanntmachung nach dem Umwandlungsgesetz 04.08.2025 (Eintragungsdatum)\n\nSchell & Heininger UG (haftungsbeschränkt) & Co. eGbR\nGesellschaft bürgerlichen Rechts\nBerlin\n\nZu Eintragungsnummer 2 vom 04.08.2025 wird als nicht eingetragen veröffentlicht: Den Gläubigern ist, wenn sie binnen sechs Monaten nach dem Tag, an dem die Eintragung der Umwandlung als bekannt gemacht gilt, ihren Anspruch nach Grund und Höhe schriftlich anmelden, Sicherheit zu leisten, soweit sie nicht Befriedigung verlangen können. Dieses Recht steht den Gläubigern jedoch nur zu, wenn sie glaubhaft machen, dass durch die Umwandlung die Erfüllung ihrer Forderung gefährdet wird. Das Recht, Sicherheitsleistung zu verlangen, steht Gläubigern nicht zu, die im Falle der Insolvenz ein Recht auf vorzugsweise Befriedigung aus einer Deckungsmasse haben, die nach gesetzlicher Vorschrift zu ihrem Schutz errichtet und staatlich überwacht ist."
    },
    {
      "date": "2025-08-05",
      "id": "119254",
      "original_text": "Registerbekanntmachung nach dem Umwandlungsgesetz\nBerlin Amtsgericht Berlin (Charlottenburg) HRB 277771\nScalantec GmbH – Berlin",
      "type": "Registerbekanntmachung nach dem Umwandlungsgesetz",
      "state": "Berlin",
      "amtsgericht": "Amtsgericht Berlin (Charlottenburg)",
      "registernummer": "HRB 277771",
      "registerart": "HRB",
      "company_name": "Scalantec GmbH",
      "company_seat": "Berlin",
      "details": "05.08.2025 (Bekanntmachungsdatum)\n\nBerlin Amtsgericht Berlin (Charlottenburg) HRB 277771\nRegisterbekanntmachung nach dem Umwandlungsgesetz 04.08.2025 (Eintragungsdatum)\n\nScalantec GmbH\nGesellschaft mit beschränkter Haftung\nBerlin\n\nZu Eintragungsnummer 1 vom 04.08.2025 wird als nicht eingetragen veröffentlicht: Den Gläubigern ist, wenn sie binnen sechs Monaten nach dem Tag, an dem die Eintragung der Umwandlung als bekannt gemacht gilt, ihren Anspruch nach Grund und Höhe schriftlich anmelden, Sicherheit zu leisten, soweit sie nicht Befriedigung verlangen können. Dieses Recht steht den Gläubigern jedoch nur zu, wenn sie glaubhaft machen, dass durch die Umwandlung die Erfüllung ihrer Forderung gefährdet wird. Das Recht, Sicherheitsleistung zu verlangen, steht Gläubigern nicht zu, die im Falle der Insolvenz ein Recht auf vorzugsweise Befriedigung aus einer Deckungsmasse haben, die nach gesetzlicher Vorschrift zu ihrem Schutz errichtet und staatlich überwacht ist."
    },
    {
      "date": "2025-08-05",
      "id": "119255",
      "original_text": "Einreichung neuer Dokumente\nBaden-Württemberg Amtsgericht Mannheim HRB 107847\nVBK - Verkehrsbetriebe Karlsruhe GmbH – Karlsruhe",
      "type": "Einreichung neuer Dokumente",
      "state": "Baden-Württemberg",
      "amtsgericht": "Amtsgericht Mannheim",
      "registernummer": "HRB 107847",
      "registerart": "HRB",
      "company_name": "VBK - Verkehrsbetriebe Karlsruhe GmbH",
      "company_seat": "Karlsruhe",
      "details": "05.08.2025 (Bekanntmachungsdatum)\n\nBaden-Württemberg Amtsgericht Mannheim HRB 107847\nEinreichung neuer Dokumente\n\nVBK - Verkehrsbetriebe Karlsruhe GmbH\nGesellschaft mit beschränkter Haftung\nKarlsruhe\n\nDie Gesellschaft hat am 31.07.2025 die Liste über die Zusammensetzung des Aufsichtsrats zum Handelsregister eingereicht."
    },
    {
      "date": "2025-08-05",
      "id": "119256",
      "original_text": "Registerbekanntmachung nach dem Umwandlungsgesetz\nSchleswig-Holstein Amtsgericht Flensburg HRA 6751\nGP JOULE Service GmbH & Co. KG – Reußenköge",
      "type": "Registerbekanntmachung nach dem Umwandlungsgesetz",
      "state": "Schleswig-Holstein",
      "amtsgericht": "Amtsgericht Flensburg",
      "registernummer": "HRA 6751",
      "registerart": "HRA",
      "company_name": "GP JOULE Service GmbH & Co. KG",
      "company_seat": "Reußenköge",
      "details": "05.08.2025 (Bekanntmachungsdatum)\n\nSchleswig-Holstein Amtsgericht Flensburg HRA 6751\nRegisterbekanntmachung nach dem Umwandlungsgesetz 01.08.2025 (Eintragungsdatum)\n\nGP JOULE Service GmbH & Co. KG\nKommanditgesellschaft\nReußenköge\n\nZu Eintragungsnummer 15 vom 01.08.2025 wird als nicht eingetragen veröffentlicht: Den Gläubigern der an der Verschmelzung beteiligten Rechtsträger ist, wenn sie binnen sechs Monaten nach dem Tag, an dem die Eintragung der Verschmelzung in das Register des Sitzes desjenigen Rechtsträgers, dessen Gläubiger sie sind, als bekannt gemacht gilt, ihren Anspruch nach Grund und Höhe schriftlich anmelden, Sicherheit zu leisten, soweit sie nicht Befriedigung verlangen können. Dieses Recht steht den Gläubigern jedoch nur zu, wenn sie glaubhaft machen, dass durch die Verschmelzung die Erfüllung ihrer Forderung gefährdet wird. Das Recht, Sicherheitsleistung zu verlangen, steht Gläubigern nicht zu, die im Falle der Insolvenz ein Recht auf vorzugsweise Befriedigung aus einer Deckungsmasse haben, die nach gesetzlicher Vorschrift zu ihrem Schutz errichtet und staatlich überwacht ist."
    },
    {
      "date": "2025-08-05",
      "id": "119257",
      "original_text": "Löschungsankündigung\nBaden-Württemberg Amtsgericht Stuttgart HRB 737635\nBE.ST PROJECT UG (haftungsbeschränkt) – Esslingen am Neckar",
      "type": "Löschungsankündigung",
      "state": "Baden-Württemberg",
      "amtsgericht": "Amtsgericht Stuttgart",
      "registernummer": "HRB 737635",
      "registerart": "HRB",
      "company_name": "BE.ST PROJECT UG (haftungsbeschränkt)",
      "company_seat": "Esslingen am Neckar",
      "details": "05.08.2025 (Bekanntmachungsdatum)\n\nBaden-Württemberg Amtsgericht Stuttgart HRB 737635\nLöschungsankündigung\n\nBE.ST PROJECT UG (haftungsbeschränkt)\nGesellschaft mit beschränkter Haftung\nEsslingen am Neckar\n\nAls nicht eingetragen wird bekanntgemacht:\nDas Gericht beabsichtigt, die Gesellschaft wegen Vermögenslosigkeit im Handelsregister von Amts wegen nach § 394 FamFG zu löschen. Die Frist zur Geltendmachung eines Widerspruchs gegen die beabsichtigte Löschung ist auf zwei Monate ab Veröffentlichung bestimmt."
    },
    {
      "date": "2025-08-05",
      "id": "119258",
      "original_text": "Löschungsankündigung\nBerlin Amtsgericht Berlin (Charlottenburg) HRB 200255\nILKO-Bauausführungen GmbH – Berlin",
      "type": "Löschungsankündigung",
      "state": "Berlin",
      "amtsgericht": "Amtsgericht Berlin (Charlottenburg)",
      "registernummer": "HRB 200255",
      "registerart": "HRB",
      "company_name": "ILKO-Bauausführungen GmbH",
      "company_seat": "Berlin",
      "details": "05.08.2025 (Bekanntmachungsdatum)\n\nBerlin Amtsgericht Berlin (Charlottenburg) HRB 200255\nLöschungsankündigung\n\nILKO-Bauausführungen GmbH\nGesellschaft mit beschränkter Haftung\nBerlin\n\nBei der nachstehenden Gesellschaft wird das Amtslöschungsverfahren gemäß § 394 FamFG eingeleitet. Widerspruchsfrist 6 Wochen"
    },
    {
      "date": "2025-08-05",
      "id": "119259",
      "original_text": "Registerbekanntmachung nach dem Umwandlungsgesetz\nBaden-Württemberg Amtsgericht Stuttgart HRB 762877\nMercedes-Benz Vermögens- und Beteiligungsgesellschaft mbH – Stuttgart",
      "type": "Registerbekanntmachung nach dem Umwandlungsgesetz",
      "state": "Baden-Württemberg",
      "amtsgericht": "Amtsgericht Stuttgart",
      "registernummer": "HRB 762877",
      "registerart": "HRB",
      "company_name": "Mercedes-Benz Vermögens- und Beteiligungsgesellschaft mbH",
      "company_seat": "Stuttgart",
      "details": "05.08.2025 (Bekanntmachungsdatum)\n\nBaden-Württemberg Amtsgericht Stuttgart HRB 762877\nRegisterbekanntmachung nach dem Umwandlungsgesetz 05.08.2025 (Eintragungsdatum)\n\nMercedes-Benz Vermögens- und Beteiligungsgesellschaft mbH\nGesellschaft mit beschränkter Haftung\nStuttgart\n\nDen Gläubigern der an der Verschmelzung beteiligten Rechtsträger ist, wenn sie binnen sechs Monaten nach dem Tag, an dem die Eintragung der Verschmelzung in das Register des Sitzes desjenigen Rechtsträgers, dessen Gläubiger sie sind, nach § 19 Abs. 3 UmwG als bekanntgemacht gilt, ihren Anspruch nach Grund und Höhe schriftlich anmelden, Sicherheit zu leisten, soweit sie nicht Befriedigung verlangen können. Dieses Recht steht den Gläubigern jedoch nur zu, wenn sie glaubhaft machen, dass durch die Verschmelzung die Erfüllung ihrer Forderung gefährdet wird."
    },
    {
      "date": "2025-08-05",
      "id": "119260",
      "original_text": "Registerbekanntmachung nach dem Umwandlungsgesetz\nMecklenburg-Vorpommern Amtsgericht Neubrandenburg HRB 304\nSmurfit Westrock Wellpappenwerk Waren GmbH – Waren",
      "type": "Registerbekanntmachung nach dem Umwandlungsgesetz",
      "state": "Mecklenburg-Vorpommern",
      "amtsgericht": "Amtsgericht Neubrandenburg",
      "registernummer": "HRB 304",
      "registerart": "HRB",
      "company_name": "Smurfit Westrock Wellpappenwerk Waren GmbH",
      "company_seat": "Waren",
      "details": "05.08.2025 (Bekanntmachungsdatum)\n\nMecklenburg-Vorpommern Amtsgericht Neubrandenburg HRB 304\nRegisterbekanntmachung nach dem Umwandlungsgesetz 30.07.2025 (Eintragungsdatum)\n\nSmurfit Westrock Wellpappenwerk Waren GmbH\nGesellschaft mit beschränkter Haftung\nWaren\n\nAls nicht eingetragen wird veröffentlicht: Den Gläubigern der an der Verschmelzung beteiligten Rechtsträger ist, wenn sie binnen sechs Monaten nach dem Tag, an dem die Eintragung der Verschmelzung in das Register des Sitzes desjenigen Rechtsträgers, dessen Gläubiger sie sind, nach § 19 Abs. 3 UmwG als bekannt gemacht gilt,\nihren Anspruch nach Grund und Höhe in Textform anmelden, Sicherheit zu leisten, soweit sie nicht Befriedigung verlangen können. Dieses Recht steht den Gläubigern jedoch nur zu, wenn sie glaubhaft machen, dass durch die Verschmelzung die Erfüllung der Forderung gefährdet wird."
    },
    {
      "date": "2025-08-05",
      "id": "119261",
      "original_text": "Einreichung neuer Dokumente\nBaden-Württemberg Amtsgericht Stuttgart HRB 799207\nElektrobau Mulfingen GmbH & Co. KGaA – Mulfingen",
      "type": "Einreichung neuer Dokumente",
      "state": "Baden-Württemberg",
      "amtsgericht": "Amtsgericht Stuttgart",
      "registernummer": "HRB 799207",
      "registerart": "HRB",
      "company_name": "Elektrobau Mulfingen GmbH & Co. KGaA",
      "company_seat": "Mulfingen",
      "details": "05.08.2025 (Bekanntmachungsdatum)\n\nBaden-Württemberg Amtsgericht Stuttgart HRB 799207\nEinreichung neuer Dokumente\n\nElektrobau Mulfingen GmbH & Co. KGaA\nKommanditgesellschaft auf Aktien\nMulfingen\n\nDie Gesellschaft hat am 01.08.2025 die Liste über die Zusammensetzung des Aufsichtsrats zum Handelsregister eingereicht."
    },
    {
      "date": "2025-08-05",
      "id": "119262",
      "original_text": "Einreichung neuer Dokumente\nBaden-Württemberg Amtsgericht Stuttgart HRB 23122\nDIE CREW AG – Stuttgart",
      "type": "Einreichung neuer Dokumente",
      "state": "Baden-Württemberg",
      "amtsgericht": "Amtsgericht Stuttgart",
      "registernummer": "HRB 23122",
      "registerart": "HRB",
      "company_name": "DIE CREW AG",
      "company_seat": "Stuttgart",
      "details": "05.08.2025 (Bekanntmachungsdatum)\n\nBaden-Württemberg Amtsgericht Stuttgart HRB 23122\nEinreichung neuer Dokumente\n\nDIE CREW AG\nAktiengesellschaft\nStuttgart\n\nDie Gesellschaft hat am 04.08.2025 die Liste über die Zusammensetzung des Aufsichtsrats zum Handelsregister eingereicht."
    },
    {
      "date": "2025-08-05",
      "id": "119263",
      "original_text": "Registerbekanntmachung nach dem Umwandlungsgesetz\nBrandenburg Amtsgericht Cottbus HRB 14168\nMarina Plaue Grundstücksgesellschaft mbH – Schönefeld",
      "type": "Registerbekanntmachung nach dem Umwandlungsgesetz",
      "state": "Brandenburg",
      "amtsgericht": "Amtsgericht Cottbus",
      "registernummer": "HRB 14168",
      "registerart": "HRB",
      "company_name": "Marina Plaue Grundstücksgesellschaft mbH",
      "company_seat": "Schönefeld",
      "details": "05.08.2025 (Bekanntmachungsdatum)\n\nBrandenburg Amtsgericht Cottbus HRB 14168\nRegisterbekanntmachung nach dem Umwandlungsgesetz 04.08.2025 (Eintragungsdatum)\n\nMarina Plaue Grundstücksgesellschaft mbH\nGesellschaft mit beschränkter Haftung\nSchönefeld\n\nZu Eintragungsnummer 4 vom 04.08.2025 wird als nicht eingetragen veröffentlicht:\nDen Gläubigern der an der Spaltung beteiligten Rechtsträger ist, wenn sie binnen sechs Monaten nach dem Tag, an dem die Eintragung der Spaltung in das Register des Sitzes desjenigen Rechtsträgers, dessen Gläubiger sie sind, als bekannt gemacht gilt, ihren Anspruch nach Grund und Höhe schriftlich anmelden, Sicherheit zu leisten, soweit sie nicht Befriedigung verlangen können. Dieses Recht steht den Gläubigern jedoch nur zu, wenn sie glaubhaft machen, dass durch die Spaltung die Erfüllung ihrer Forderung gefährdet wird."
    },
    {
      "date": "2025-08-05",
      "id": "119264",
      "original_text": "Löschungsankündigung\nBaden-Württemberg Amtsgericht Stuttgart HRA 728899\nA. E. R. Fresco GmbH & Co. KG – Öhringen",
      "type": "Löschungsankündigung",
      "state": "Baden-Württemberg",
      "amtsgericht": "Amtsgericht Stuttgart",
      "registernummer": "HRA 728899",
      "registerart": "HRA",
      "company_name": "A. E. R. Fresco GmbH & Co. KG",
      "company_seat": "Öhringen",
      "details": "05.08.2025 (Bekanntmachungsdatum)\n\nBaden-Württemberg Amtsgericht Stuttgart HRA 728899\nLöschungsankündigung\n\nA. E. R. Fresco GmbH & Co. KG\nKommanditgesellschaft\nÖhringen\n\nAls nicht eingetragen wird bekanntgemacht:\nDas Gericht beabsichtigt, die Gesellschaft wegen Vermögenslosigkeit im Handelsregister von Amts wegen nach § 394 FamFG zu löschen. Die Frist zur Geltendmachung eines Widerspruchs gegen die beabsichtigte Löschung ist auf zwei Monate ab Veröffentlichung bestimmt."
    },
    {
      "date": "2025-08-05",
      "id": "119265",
      "original_text": "Löschungsankündigung\nSchleswig-Holstein Amtsgericht Lübeck HRA 10138\nBootshuus GmbH + Co. KG – Grömitz",
      "type": "Löschungsankündigung",
      "state": "Schleswig-Holstein",
      "amtsgericht": "Amtsgericht Lübeck",
      "registernummer": "HRA 10138",
      "registerart": "HRA",
      "company_name": "Bootshuus GmbH + Co. KG",
      "company_seat": "Grömitz",
      "details": "05.08.2025 (Bekanntmachungsdatum)\n\nSchleswig-Holstein Amtsgericht Lübeck HRA 10138\nLöschungsankündigung\n\nBootshuus GmbH + Co. KG\nKommanditgesellschaft\nGrömitz\n\nper Veröffentlich an Herrn Matthias Ottosander\n\nSehr geehrte Damen und Herren,\n\nin der Handelsregistersache der\n\nBootshuus GmbH + Co. KG\n\nergeben sich aus den mir vorliegenden Unterlagen Anhaltspunkte dafür, dass die Gesellschaft, als deren persönlich haftendenden Gesellschafter die Bootshuus Verwaltungs GmbH eingetragen ist, als deren Geschäftsführer Sie eingetragen sind, vermögenslos ist:\n\nBeschluss des Amtsgerichts Eutin vom 05.06.2025 über die Einstellung des Insolvenzverfahrens mangels Masse gemäß § 207 I InsO.\n\nIch beabsichtige daher, die Gesellschaft wegen Vermögenslosigkeit gemäß § 394 FamFG zu löschen.\n\nIch bestimme eine Frist von einem Monat zur Geltendmachung eines Widerspruchs gegen die Löschung, § 394 Abs. 2 S. 1 FamFG.\n\nWeiter bitte ich Sie, mir binnen derselben Frist mitzuteilen, ob die genannte Gesellschaft noch Vermögen hat, ggf. welche Vermögensgegenstände sie besitzt, ob die Gesellschaft noch Partei eines noch nicht rechtskräftig abgeschlossenen Rechtsstreits ist oder ob sonst noch eine Abwicklung stattfindet.\n\nNach Fristablauf ohne Widerspruch von Ihnen oder anderer Seite wird die Gesellschaft gelöscht.\n\nMit freundlichen Grüßen\n\nOstermann\nDipl.-Rechtspflegerin (FH)\n\nAuf Anordnung\n\nHill, Justizobersekretärin"
    },
    {
      "date": "2025-08-05",
      "id": "119266",
      "original_text": "Registerbekanntmachung nach dem Umwandlungsgesetz\nHamburg Amtsgericht Hamburg HRB 143299\nAIDAradio GmbH – Hamburg",
      "type": "Registerbekanntmachung nach dem Umwandlungsgesetz",
      "state": "Hamburg",
      "amtsgericht": "Amtsgericht Hamburg",
      "registernummer": "HRB 143299",
      "registerart": "HRB",
      "company_name": "AIDAradio GmbH",
      "company_seat": "Hamburg",
      "details": "05.08.2025 (Bekanntmachungsdatum)\n\nHamburg Amtsgericht Hamburg HRB 143299\nRegisterbekanntmachung nach dem Umwandlungsgesetz 05.08.2025 (Eintragungsdatum)\n\nAIDAradio GmbH\nGesellschaft mit beschränkter Haftung\nHamburg\n\nAls nicht eingetragen wird bekannt gemacht:\nDen Gläubigern der an der Verschmelzung beteiligten Gesellschaften ist, wenn sie binnen sechs Monaten nach dem Tag, an dem die Eintragung der Verschmelzung in das Register des Sitzes desjenigen Rechtsträgers, dessen Gläubiger sie sind, nach § 19 Absatz 3 UmwG als bekannt gemacht gilt, ihren Anspruch nach Grund und Höhe schriftlich anmelden, Sicherheit zu leisten, soweit sie nicht Befriedigung verlangen können. Dieses Recht steht den Gläubigern jedoch nur zu, wenn sie glaubhaft machen, dass durch die Verschmelzung die Erfüllung ihrer Forderung gefährdet wird."
    },
    {
      "date": "2025-08-05",
      "id": "119267",
      "original_text": "Registerbekanntmachung nach dem Umwandlungsgesetz\nBaden-Württemberg Amtsgericht Stuttgart HRB 110\nEd. Züblin Aktiengesellschaft – Stuttgart",
      "type": "Registerbekanntmachung nach dem Umwandlungsgesetz",
      "state": "Baden-Württemberg",
      "amtsgericht": "Amtsgericht Stuttgart",
      "registernummer": "HRB 110",
      "registerart": "HRB",
      "company_name": "Ed. Züblin Aktiengesellschaft",
      "company_seat": "Stuttgart",
      "details": "05.08.2025 (Bekanntmachungsdatum)\n\nBaden-Württemberg Amtsgericht Stuttgart HRB 110\nRegisterbekanntmachung nach dem Umwandlungsgesetz 05.08.2025 (Eintragungsdatum)\n\nEd. Züblin Aktiengesellschaft\nAktiengesellschaft\nStuttgart\n\nDen Gläubigern der an der Verschmelzung beteiligten Rechtsträger ist, wenn sie binnen sechs Monaten nach dem Tag, an dem die Eintragung der Verschmelzung in das Register des Sitzes desjenigen Rechtsträgers, dessen Gläubiger sie sind, nach § 19 Abs. 3 UmwG als bekanntgemacht gilt, ihren Anspruch nach Grund und Höhe schriftlich anmelden, Sicherheit zu leisten, soweit sie nicht Befriedigung verlangen können. Dieses Recht steht den Gläubigern jedoch nur zu, wenn sie glaubhaft machen, dass durch die Verschmelzung die Erfüllung ihrer Forderung gefährdet wird."
    },
    {
      "date": "2025-08-05",
      "id": "119268",
      "original_text": "Löschungsankündigung\nBerlin Amtsgericht Berlin (Charlottenburg) HRB 183784\nEridanus GmbH – Berlin",
      "type": "Löschungsankündigung",
      "state": "Berlin",
      "amtsgericht": "Amtsgericht Berlin (Charlottenburg)",
      "registernummer": "HRB 183784",
      "registerart": "HRB",
      "company_name": "Eridanus GmbH",
      "company_seat": "Berlin",
      "details": "05.08.2025 (Bekanntmachungsdatum)\n\nBerlin Amtsgericht Berlin (Charlottenburg) HRB 183784\nLöschungsankündigung\n\nEridanus GmbH\nGesellschaft mit beschränkter Haftung\nBerlin\n\nBei der nachstehenden Gesellschaft wird das Amtslöschungsverfahren gemäß § 394 FamFG eingeleitet. Widerspruchsfrist 6 Wochen"
    },
    {
      "date": "2025-08-05",
      "id": "119269",
      "original_text": "Sonstige Registerbekanntmachung\nBrandenburg Amtsgericht Frankfurt/Oder HRB 21266\nKrastev Handelsgesellschaft mbH – Strausberg",
      "type": "Sonstige Registerbekanntmachung",
      "state": "Brandenburg",
      "amtsgericht": "Amtsgericht Frankfurt/Oder",
      "registernummer": "HRB 21266",
      "registerart": "HRB",
      "company_name": "Krastev Handelsgesellschaft mbH",
      "company_seat": "Strausberg",
      "details": "05.08.2025 (Bekanntmachungsdatum)\n\nBrandenburg Amtsgericht Frankfurt/Oder HRB 21266\nSonstige Registerbekanntmachung 04.08.2025 (Eintragungsdatum)\n\nKrastev Handelsgesellschaft mbH\nGesellschaft mit beschränkter Haftung\nStrausberg\n\nAls nicht eingetragen wird veröffentlicht:\nDen Gläubigern der an der Spaltung beteiligten Rechtsträger ist, wenn sie binnen sechs Monaten nach dem Tag, an dem die Eintragung der Spaltung in das Register des Sitzes desjenigen Rechtsträgers, dessen Gläubiger sie sind, als bekannt gemacht gilt, ihren Anspruch nach Grund und Höhe schriftlich anmelden, Sicherheit zu leisten, soweit sie nicht Befriedigung verlangen können. Dieses Recht steht den Gläubigern jedoch nur zu, wenn sie glaubhaft machen, dass durch die Spaltung die Erfüllung ihrer Forderung gefährdet wird"
    },
    {
      "date": "2025-08-05",
      "id": "119270",
      "original_text": "Löschungsankündigung\nBerlin Amtsgericht Berlin (Charlottenburg) HRB 189751\nHF Leasing GmbH – Berlin",
      "type": "Löschungsankündigung",
      "state": "Berlin",
      "amtsgericht": "Amtsgericht Berlin (Charlottenburg)",
      "registernummer": "HRB 189751",
      "registerart": "HRB",
      "company_name": "HF Leasing GmbH",
      "company_seat": "Berlin",
      "details": "05.08.2025 (Bekanntmachungsdatum)\n\nBerlin Amtsgericht Berlin (Charlottenburg) HRB 189751\nLöschungsankündigung\n\nHF Leasing GmbH\nGesellschaft mit beschränkter Haftung\nBerlin\n\nBei der nachstehenden Gesellschaft wird das Amtslöschungsverfahren gemäß § 394 FamFG eingeleitet. Widerspruchsfrist 6 Wochen"
    },
    {
      "date": "2025-08-05",
      "id": "119271",
      "original_text": "Löschungsankündigung\nBrandenburg Amtsgericht Potsdam HRB 33411\nMalereibetrieb Sauer GmbH – Borkheide",
      "type": "Löschungsankündigung",
      "state": "Brandenburg",
      "amtsgericht": "Amtsgericht Potsdam",
      "registernummer": "HRB 33411",
      "registerart": "HRB",
      "company_name": "Malereibetrieb Sauer GmbH",
      "company_seat": "Borkheide",
      "details": "05.08.2025 (Bekanntmachungsdatum)\n\nBrandenburg Amtsgericht Potsdam HRB 33411\nLöschungsankündigung\n\nMalereibetrieb Sauer GmbH\nGesellschaft mit beschränkter Haftung\nBorkheide\n\nBei der nachstehenden Gesellschaft wird das Amtslöschungsverfahren gemäß § 394 FamFG eingeleitet."
    },
    {
      "date": "2025-08-05",
      "id": "119272",
      "original_text": "Einreichung neuer Dokumente\nBaden-Württemberg Amtsgericht Mannheim HRB 100288\nSWB Sparkassen-Wohnbau GmbH – Karlsruhe",
      "type": "Einreichung neuer Dokumente",
      "state": "Baden-Württemberg",
      "amtsgericht": "Amtsgericht Mannheim",
      "registernummer": "HRB 100288",
      "registerart": "HRB",
      "company_name": "SWB Sparkassen-Wohnbau GmbH",
      "company_seat": "Karlsruhe",
      "details": "05.08.2025 (Bekanntmachungsdatum)\n\nBaden-Württemberg Amtsgericht Mannheim HRB 100288\nEinreichung neuer Dokumente\n\nSWB Sparkassen-Wohnbau GmbH\nGesellschaft mit beschränkter Haftung\nKarlsruhe\n\nDie Gesellschaft hat am 31.07.2025 die Liste über die Zusammensetzung des Aufsichtsrats zum Handelsregister eingereicht."
    },
    {
      "date": "2025-08-05",
      "id": "119273",
      "original_text": "Registerbekanntmachung nach dem Umwandlungsgesetz\nHamburg Amtsgericht Hamburg HRB 164194\nAZ Verwaltung und Service GmbH – Hamburg",
      "type": "Registerbekanntmachung nach dem Umwandlungsgesetz",
      "state": "Hamburg",
      "amtsgericht": "Amtsgericht Hamburg",
      "registernummer": "HRB 164194",
      "registerart": "HRB",
      "company_name": "AZ Verwaltung und Service GmbH",
      "company_seat": "Hamburg",
      "details": "05.08.2025 (Bekanntmachungsdatum)\n\nHamburg Amtsgericht Hamburg HRB 164194\nRegisterbekanntmachung nach dem Umwandlungsgesetz 05.08.2025 (Eintragungsdatum)\n\nAZ Verwaltung und Service GmbH\nGesellschaft mit beschränkter Haftung\nHamburg\n\nAls nicht eingetragen wird bekannt gemacht:\nDen Gläubigern der an der Verschmelzung beteiligten Gesellschaften ist, wenn sie binnen sechs Monaten nach dem Tag, an dem die Eintragung der Verschmelzung in das Register des Sitzes desjenigen Rechtsträgers, dessen Gläubiger sie sind, nach § 19 Absatz 3 UmwG als bekannt gemacht gilt, ihren Anspruch nach Grund und Höhe schriftlich anmelden, Sicherheit zu leisten, soweit sie nicht Befriedigung verlangen können. Dieses Recht steht den Gläubigern jedoch nur zu, wenn sie glaubhaft machen, dass durch die Verschmelzung die Erfüllung ihrer Forderung gefährdet wird."
    },
    {
      "date": "2025-08-05",
      "id": "119274",
      "original_text": "Registerbekanntmachung nach dem Umwandlungsgesetz\nHamburg Amtsgericht Hamburg HRB 179112\nremedium MVZ GmbH – Hamburg",
      "type": "Registerbekanntmachung nach dem Umwandlungsgesetz",
      "state": "Hamburg",
      "amtsgericht": "Amtsgericht Hamburg",
      "registernummer": "HRB 179112",
      "registerart": "HRB",
      "company_name": "remedium MVZ GmbH",
      "company_seat": "Hamburg",
      "details": "05.08.2025 (Bekanntmachungsdatum)\n\nHamburg Amtsgericht Hamburg HRB 179112\nRegisterbekanntmachung nach dem Umwandlungsgesetz 05.08.2025 (Eintragungsdatum)\n\nremedium MVZ GmbH\nGesellschaft mit beschränkter Haftung\nHamburg\n\nAls nicht eingetragen wird bekannt gemacht:\nDen Gläubigern der an der Verschmelzung beteiligten Gesellschaften ist, wenn sie binnen sechs Monaten nach dem Tag, an dem die Eintragung der Verschmelzung in das Register des Sitzes desjenigen Rechtsträgers, dessen Gläubiger sie sind, nach § 19 Absatz 3 UmwG als bekannt gemacht gilt, ihren Anspruch nach Grund und Höhe schriftlich anmelden, Sicherheit zu leisten, soweit sie nicht Befriedigung verlangen können. Dieses Recht steht den Gläubigern jedoch nur zu, wenn sie glaubhaft machen, dass durch die Verschmelzung die Erfüllung ihrer Forderung gefährdet wird."
    },
    {
      "date": "2025-08-05",
      "id": "119275",
      "original_text": "Registerbekanntmachung nach dem Umwandlungsgesetz\nBerlin Amtsgericht Berlin (Charlottenburg) HRB 233784\nMünchener Baugesellschaft mbH – Berlin",
      "type": "Registerbekanntmachung nach dem Umwandlungsgesetz",
      "state": "Berlin",
      "amtsgericht": "Amtsgericht Berlin (Charlottenburg)",
      "registernummer": "HRB 233784",
      "registerart": "HRB",
      "company_name": "Münchener Baugesellschaft mbH",
      "company_seat": "Berlin",
      "details": "05.08.2025 (Bekanntmachungsdatum)\n\nBerlin Amtsgericht Berlin (Charlottenburg) HRB 233784\nRegisterbekanntmachung nach dem Umwandlungsgesetz 04.08.2025 (Eintragungsdatum)\n\nMünchener Baugesellschaft mbH\nGesellschaft mit beschränkter Haftung\nBerlin\n\nZu Eintragungsnummer 26 vom 04.08.2025 wird als nicht eingetragen veröffentlicht: Den Gläubigern der an der Verschmelzung beteiligten Rechtsträger ist, wenn sie binnen sechs Monaten nach dem Tag, an dem die Eintragung der Verschmelzung in das Register des Sitzes desjenigen Rechtsträgers, dessen Gläubiger sie sind, als bekannt gemacht gilt, ihren Anspruch nach Grund und Höhe schriftlich anmelden, Sicherheit zu leisten, soweit sie nicht Befriedigung verlangen können. Dieses Recht steht den Gläubigern jedoch nur zu, wenn sie glaubhaft machen, dass durch die Verschmelzung die Erfüllung ihrer Forderung gefährdet wird. Das Recht, Sicherheitsleistung zu verlangen, steht Gläubigern nicht zu, die im Falle der Insolvenz ein Recht auf vorzugsweise Befriedigung aus einer Deckungsmasse haben, die nach gesetzlicher Vorschrift zu ihrem Schutz errichtet und staatlich überwacht ist."
    },
    {
      "date": "2025-08-05",
      "id": "119276",
      "original_text": "Einreichung neuer Dokumente\nBrandenburg Amtsgericht Neuruppin HRB 7060\nInKom Neuruppin- Gesellschaft für kommunale Dienstleistungen GmbH – Neuruppin",
      "type": "Einreichung neuer Dokumente",
      "state": "Brandenburg",
      "amtsgericht": "Amtsgericht Neuruppin",
      "registernummer": "HRB 7060",
      "registerart": "HRB",
      "company_name": "InKom Neuruppin- Gesellschaft für kommunale Dienstleistungen GmbH",
      "company_seat": "Neuruppin",
      "details": "05.08.2025 (Bekanntmachungsdatum)\n\nBrandenburg Amtsgericht Neuruppin HRB 7060\nEinreichung neuer Dokumente\n\nInKom Neuruppin- Gesellschaft für kommunale Dienstleistungen GmbH\nGesellschaft mit beschränkter Haftung\nNeuruppin\n\nAls nicht eingetragen wird veröffentlicht: Eine Liste der Mitglieder des Aufsichtsrates wurde zum Handelsregister eingereicht."
    },
    {
      "date": "2025-08-05",
      "id": "119277",
      "original_text": "Registerbekanntmachung nach dem Umwandlungsgesetz\nHamburg Amtsgericht Hamburg HRB 154296\nFonds 8 AvR Bremen Verwaltungs GmbH – Hamburg",
      "type": "Registerbekanntmachung nach dem Umwandlungsgesetz",
      "state": "Hamburg",
      "amtsgericht": "Amtsgericht Hamburg",
      "registernummer": "HRB 154296",
      "registerart": "HRB",
      "company_name": "Fonds 8 AvR Bremen Verwaltungs GmbH",
      "company_seat": "Hamburg",
      "details": "05.08.2025 (Bekanntmachungsdatum)\n\nHamburg Amtsgericht Hamburg HRB 154296\nRegisterbekanntmachung nach dem Umwandlungsgesetz 05.08.2025 (Eintragungsdatum)\n\nFonds 8 AvR Bremen Verwaltungs GmbH\nGesellschaft mit beschränkter Haftung\nHamburg\n\nAls nicht eingetragen wird bekannt gemacht:\nDen Gläubigern der an der Verschmelzung beteiligten Gesellschaften ist, wenn sie binnen sechs Monaten nach dem Tag, an dem die Eintragung der Verschmelzung in das Register des Sitzes desjenigen Rechtsträgers, dessen Gläubiger sie sind, nach § 19 Absatz 3 UmwG als bekannt gemacht gilt, ihren Anspruch nach Grund und Höhe schriftlich anmelden, Sicherheit zu leisten, soweit sie nicht Befriedigung verlangen können. Dieses Recht steht den Gläubigern jedoch nur zu, wenn sie glaubhaft machen, dass durch die Verschmelzung die Erfüllung ihrer Forderung gefährdet wird."
    },
    {
      "date": "2025-08-05",
      "id": "119278",
      "original_text": "Registerbekanntmachung nach dem Umwandlungsgesetz\nHamburg Amtsgericht Hamburg HRB 149317\nAviaRent MikroQuartier 2 GmbH – Hamburg",
      "type": "Registerbekanntmachung nach dem Umwandlungsgesetz",
      "state": "Hamburg",
      "amtsgericht": "Amtsgericht Hamburg",
      "registernummer": "HRB 149317",
      "registerart": "HRB",
      "company_name": "AviaRent MikroQuartier 2 GmbH",
      "company_seat": "Hamburg",
      "details": "05.08.2025 (Bekanntmachungsdatum)\n\nHamburg Amtsgericht Hamburg HRB 149317\nRegisterbekanntmachung nach dem Umwandlungsgesetz 05.08.2025 (Eintragungsdatum)\n\nAviaRent MikroQuartier 2 GmbH\nGesellschaft mit beschränkter Haftung\nHamburg\n\nAls nicht eingetragen wird bekannt gemacht:\nDen Gläubigern der an der Verschmelzung beteiligten Gesellschaften ist, wenn sie binnen sechs Monaten nach dem Tag, an dem die Eintragung der Verschmelzung in das Register des Sitzes desjenigen Rechtsträgers, dessen Gläubiger sie sind, nach § 19 Absatz 3 UmwG als bekannt gemacht gilt, ihren Anspruch nach Grund und Höhe schriftlich anmelden, Sicherheit zu leisten, soweit sie nicht Befriedigung verlangen können. Dieses Recht steht den Gläubigern jedoch nur zu, wenn sie glaubhaft machen, dass durch die Verschmelzung die Erfüllung ihrer Forderung gefährdet wird."
    },
    {
      "date": "2025-08-05",
      "id": "119279",
      "original_text": "Registerbekanntmachung nach dem Umwandlungsgesetz\nBaden-Württemberg Amtsgericht Stuttgart HRA 742584\nSB Digits GmbH & Co. KG – Neckarsulm",
      "type": "Registerbekanntmachung nach dem Umwandlungsgesetz",
      "state": "Baden-Württemberg",
      "amtsgericht": "Amtsgericht Stuttgart",
      "registernummer": "HRA 742584",
      "registerart": "HRA",
      "company_name": "SB Digits GmbH & Co. KG",
      "company_seat": "Neckarsulm",
      "details": "05.08.2025 (Bekanntmachungsdatum)\n\nBaden-Württemberg Amtsgericht Stuttgart HRA 742584\nRegisterbekanntmachung nach dem Umwandlungsgesetz 05.08.2025 (Eintragungsdatum)\n\nSB Digits GmbH & Co. KG\nKommanditgesellschaft\nNeckarsulm\n\nAls nicht eingetragen wird bekanntgemacht:\nDen Gläubigern der an der Abspaltung beteiligten Rechtsträger ist, wenn sie binnen sechs Monaten nach dem Tag, an dem die Eintragung der Abspaltung in das Register des Sitzes desjenigen Rechtsträgers, dessen Gläubiger sie sind, nach § 19 Abs. 3 UmwG als bekanntgemacht gilt, ihren Anspruch nach Grund und Höhe schriftlich anmelden, Sicherheit zu leisten, soweit sie nicht Befriedigung verlangen können. Dieses Recht steht den Gläubigern jedoch nur zu, wenn sie glaubhaft machen, dass durch die Abspaltung die Erfüllung ihrer Forderung gefährdet wird."
    },
    {
      "date": "2025-08-05",
      "id": "119280",
      "original_text": "Registerbekanntmachung nach dem Umwandlungsgesetz\nBrandenburg Amtsgericht Neuruppin HRB 11892\nAMU Schwedt GmbH – Schwedt/Oder",
      "type": "Registerbekanntmachung nach dem Umwandlungsgesetz",
      "state": "Brandenburg",
      "amtsgericht": "Amtsgericht Neuruppin",
      "registernummer": "HRB 11892",
      "registerart": "HRB",
      "company_name": "AMU Schwedt GmbH",
      "company_seat": "Schwedt/Oder",
      "details": "05.08.2025 (Bekanntmachungsdatum)\n\nBrandenburg Amtsgericht Neuruppin HRB 11892\nRegisterbekanntmachung nach dem Umwandlungsgesetz 04.08.2025 (Eintragungsdatum)\n\nAMU Schwedt GmbH\nGesellschaft mit beschränkter Haftung\nSchwedt/Oder\n\nZu Eintragungsnummer 4 vom 04.08.2025 wird als nicht eingetragen veröffentlicht:\n\nDen Gläubigern der an der Umwandlung beteiligten Rechtsträger ist, wenn sie binnen sechs Monaten nach dem Tag, an dem die Eintragung der Umwandlung in das Register des Sitzes desjenigen Rechtsträgers, dessen Gläubiger sie sind, als bekannt gemacht gilt, ihren Anspruch nach Grund und Höhe schriftlich anmelden, Sicherheit zu leisten, soweit sie nicht Befriedigung verlangen können. Dieses Recht steht den Gläubigern jedoch nur zu, wenn sie glaubhaft machen, dass durch die Umwandlung die Erfüllung ihrer Forderung gefährdet wird"
    },
    {
      "date": "2025-08-05",
      "id": "119281",
      "original_text": "Registerbekanntmachung nach dem Umwandlungsgesetz\nBrandenburg Amtsgericht Frankfurt/Oder HRA 3071\nEggersdorfer Schweinezucht, Inhaber Elbert Pieter Hennipman e.K. – Müncheberg",
      "type": "Registerbekanntmachung nach dem Umwandlungsgesetz",
      "state": "Brandenburg",
      "amtsgericht": "Amtsgericht Frankfurt/Oder",
      "registernummer": "HRA 3071",
      "registerart": "HRA",
      "company_name": "Eggersdorfer Schweinezucht, Inhaber Elbert Pieter Hennipman e.K.",
      "company_seat": "Müncheberg",
      "details": "05.08.2025 (Bekanntmachungsdatum)\n\nBrandenburg Amtsgericht Frankfurt/Oder HRA 3071\nRegisterbekanntmachung nach dem Umwandlungsgesetz 04.08.2025 (Eintragungsdatum)\n\nEggersdorfer Schweinezucht, Inhaber Elbert Pieter Hennipman e.K.\nEinzelkaufmann / Einzelkauffrau\nMüncheberg\n\nZu Eintragungsnummer 4 vom 04.08.2025 wird als nicht eingetragen veröffentlicht: Als nicht eingetragen wird veröffentlicht:\nDen Gläubigern der an der Umwandlung beteiligten Rechtsträger ist, wenn sie binnen sechs Monaten nach dem Tag, an dem die Eintragung der Umwandlung in das Register des Sitzes desjenigen Rechtsträgers, dessen Gläubiger sie sind, als bekannt gemacht gilt, ihren Anspruch nach Grund und Höhe schriftlich anmelden, Sicherheit zu leisten, soweit sie nicht Befriedigung verlangen können. Dieses Recht steht den Gläubigern jedoch nur zu, wenn sie glaubhaft machen, dass durch die Umwandlung die Erfüllung ihrer Forderung gefährdet wird"
    },
    {
      "date": "2025-08-05",
      "id": "119282",
      "original_text": "Registerbekanntmachung nach dem Umwandlungsgesetz\nBaden-Württemberg Amtsgericht Stuttgart HRA 721997\nSB Dienstleistung KG – Neckarsulm",
      "type": "Registerbekanntmachung nach dem Umwandlungsgesetz",
      "state": "Baden-Württemberg",
      "amtsgericht": "Amtsgericht Stuttgart",
      "registernummer": "HRA 721997",
      "registerart": "HRA",
      "company_name": "SB Dienstleistung KG",
      "company_seat": "Neckarsulm",
      "details": "05.08.2025 (Bekanntmachungsdatum)\n\nBaden-Württemberg Amtsgericht Stuttgart HRA 721997\nRegisterbekanntmachung nach dem Umwandlungsgesetz 05.08.2025 (Eintragungsdatum)\n\nSB Dienstleistung KG\nKommanditgesellschaft\nNeckarsulm\n\nAls nicht eingetragen wird bekanntgemacht:\nDen Gläubigern der an der Abspaltung beteiligten Rechtsträger ist, wenn sie binnen sechs Monaten nach dem Tag, an dem die Eintragung der Abspaltung in das Register des Sitzes desjenigen Rechtsträgers, dessen Gläubiger sie sind, nach § 19 Abs. 3 UmwG als bekanntgemacht gilt, ihren Anspruch nach Grund und Höhe schriftlich anmelden, Sicherheit zu leisten, soweit sie nicht Befriedigung verlangen können. Dieses Recht steht den Gläubigern jedoch nur zu, wenn sie glaubhaft machen, dass durch die Abspaltung die Erfüllung ihrer Forderung gefährdet wird."
    },
    {
      "date": "2025-08-05",
      "id": "119283",
      "original_text": "Einreichung neuer Dokumente\nBaden-Württemberg Amtsgericht Stuttgart GnR 399\nFLÜWO Bauen Wohnen eG – Stuttgart",
      "type": "Einreichung neuer Dokumente",
      "state": "Baden-Württemberg",
      "amtsgericht": "Amtsgericht Stuttgart",
      "registernummer": "GnR 399",
      "registerart": "GnR",
      "company_name": "FLÜWO Bauen Wohnen eG",
      "company_seat": "Stuttgart",
      "details": "05.08.2025 (Bekanntmachungsdatum)\n\nBaden-Württemberg Amtsgericht Stuttgart GnR 399\nEinreichung neuer Dokumente\n\nFLÜWO Bauen Wohnen eG\neingetragene Genossenschaft\nStuttgart\n\nDie Gesellschaft hat am 01.08.2025 die Liste über die Zusammensetzung des Aufsichtsrats zum Handelsregister eingereicht."
    },
    {
      "date": "2025-08-05",
      "id": "119284",
      "original_text": "Registerbekanntmachung nach dem Umwandlungsgesetz\nSchleswig-Holstein Amtsgericht Pinneberg HRB 5795\nForstbaumschulen Kuphaldt GmbH – Rellingen",
      "type": "Registerbekanntmachung nach dem Umwandlungsgesetz",
      "state": "Schleswig-Holstein",
      "amtsgericht": "Amtsgericht Pinneberg",
      "registernummer": "HRB 5795",
      "registerart": "HRB",
      "company_name": "Forstbaumschulen Kuphaldt GmbH",
      "company_seat": "Rellingen",
      "details": "05.08.2025 (Bekanntmachungsdatum)\n\nSchleswig-Holstein Amtsgericht Pinneberg HRB 5795\nRegisterbekanntmachung nach dem Umwandlungsgesetz 04.08.2025 (Eintragungsdatum)\n\nForstbaumschulen Kuphaldt GmbH\nGesellschaft mit beschränkter Haftung\nRellingen\n\nZu Eintragungsnummer 3 vom 04.08.2025 wird als nicht eingetragen veröffentlicht:  Als nicht eingetragen wird veröffentlicht: Den Gläubigern der an der Verschmelzung beteiligten Rechtsträger ist, wenn sie binnen sechs Monaten nach dem Tag, an dem die Eintragung der Verschmelzung in das Register des Sitzes desjenigen Rechtsträgers, dessen Gläubiger sie sind, als bekannt gemacht gilt, ihren Anspruch nach Grund und Höhe schriftlich anmelden, Sicherheit zu leisten, soweit sie nicht Befriedigung verlangen können. Dieses Recht steht den Gläubigern jedoch nur zu, wenn sie glaubhaft machen, dass durch die Verschmelzung die Erfüllung ihrer Forderung gefährdet wird. Das Recht, Sicherheitsleistung zu verlangen, steht Gläubigern nicht zu, die im Falle der Insolvenz ein Recht auf vorzugsweise Befriedigung aus einer Deckungsmasse haben, die nach gesetzlicher Vorschrift zu ihrem Schutz errichtet und staatlich überwacht ist."
    },
    {
      "date": "2025-08-05",
      "id": "119285",
      "original_text": "Löschungsankündigung\nBerlin Amtsgericht Berlin (Charlottenburg) HRB 186082\nMirza Y. Bau UG (haftungsbeschränkt) – Berlin",
      "type": "Löschungsankündigung",
      "state": "Berlin",
      "amtsgericht": "Amtsgericht Berlin (Charlottenburg)",
      "registernummer": "HRB 186082",
      "registerart": "HRB",
      "company_name": "Mirza Y. Bau UG (haftungsbeschränkt)",
      "company_seat": "Berlin",
      "details": "05.08.2025 (Bekanntmachungsdatum)\n\nBerlin Amtsgericht Berlin (Charlottenburg) HRB 186082\nLöschungsankündigung\n\nMirza Y. Bau UG (haftungsbeschränkt)\nGesellschaft mit beschränkter Haftung\nBerlin\n\nBei der nachstehenden Gesellschaft wird das Amtslöschungsverfahren gemäß § 394 FamFG eingeleitet. Widerspruchsfrist 6 Wochen"
    },
    {
      "date": "2025-08-05",
      "id": "119286",
      "original_text": "Registerbekanntmachung nach dem Umwandlungsgesetz\nThüringen Amtsgericht Jena HRB 501798\nGUD GERAER Umweltdienste Verwaltungs-GmbH – Gera",
      "type": "Registerbekanntmachung nach dem Umwandlungsgesetz",
      "state": "Thüringen",
      "amtsgericht": "Amtsgericht Jena",
      "registernummer": "HRB 501798",
      "registerart": "HRB",
      "company_name": "GUD GERAER Umweltdienste Verwaltungs-GmbH",
      "company_seat": "Gera",
      "details": "05.08.2025 (Bekanntmachungsdatum)\n\nThüringen Amtsgericht Jena HRB 501798\nRegisterbekanntmachung nach dem Umwandlungsgesetz 05.08.2025 (Eintragungsdatum)\n\nGUD GERAER Umweltdienste Verwaltungs-GmbH\nGesellschaft mit beschränkter Haftung\nGera\n\nNicht eingetragen: Den Gläubigern der an der Verschmelzung beteiligten Rechtsträger, ist wenn sie binnen sechs Monaten nach dem Tag, an dem die Eintragung der Verschmelzung in das Register des Sitzes desjenigen Rechtsträgers, dessen Gläubiger sie sind,  nach § 19 Abs. 3 UmwG als bekanntgemacht gilt, ihren Anspruch nach Grund und Höhe schriftlich anmelden, Sicherheit zu leisten, soweit sie nicht Befriedigung verlangen können. Dieses Recht steht ihnen jedoch nur zu, wenn sie glaubhaft machen, daß durch die Verschmelzung die Erfüllung ihrer Forderung gefährdet wird."
    },
    {
      "date": "2025-08-05",
      "id": "119287",
      "original_text": "Einreichung neuer Dokumente\nThüringen Amtsgericht Jena HRB 111272\nGeratherm Medical AG – Geratal",
      "type": "Einreichung neuer Dokumente",
      "state": "Thüringen",
      "amtsgericht": "Amtsgericht Jena",
      "registernummer": "HRB 111272",
      "registerart": "HRB",
      "company_name": "Geratherm Medical AG",
      "company_seat": "Geratal",
      "details": "05.08.2025 (Bekanntmachungsdatum)\n\nThüringen Amtsgericht Jena HRB 111272\nEinreichung neuer Dokumente\n\nGeratherm Medical AG\nAktiengesellschaft\nGeratal\n\nBekanntmachung gem. § 106 AktG: Aufgrund einer Veränderung in den Personen der Aufsichtsratsmitglieder ist durch den Vorstand eine neue Liste zum Handelsregister eingereicht worden."
    },
    {
      "date": "2025-08-05",
      "id": "119288",
      "original_text": "Löschungsankündigung\nBerlin Amtsgericht Berlin (Charlottenburg) HRB 201075\ncarTab UG (haftungsbeschränkt) – Berlin",
      "type": "Löschungsankündigung",
      "state": "Berlin",
      "amtsgericht": "Amtsgericht Berlin (Charlottenburg)",
      "registernummer": "HRB 201075",
      "registerart": "HRB",
      "company_name": "carTab UG (haftungsbeschränkt)",
      "company_seat": "Berlin",
      "details": "05.08.2025 (Bekanntmachungsdatum)\n\nBerlin Amtsgericht Berlin (Charlottenburg) HRB 201075\nLöschungsankündigung\n\ncarTab UG (haftungsbeschränkt)\nGesellschaft mit beschränkter Haftung\nBerlin\n\nBei der nachstehenden Gesellschaft wird das Amtslöschungsverfahren gemäß § 394 FamFG eingeleitet. Widerspruchsfrist 6 Wochen"
    },
    {
      "date": "2025-08-05",
      "id": "119289",
      "original_text": "Einreichung neuer Dokumente\nBaden-Württemberg Amtsgericht Stuttgart HRB 720915\nKlinikverbund Südwest gGmbH – Böblingen",
      "type": "Einreichung neuer Dokumente",
      "state": "Baden-Württemberg",
      "amtsgericht": "Amtsgericht Stuttgart",
      "registernummer": "HRB 720915",
      "registerart": "HRB",
      "company_name": "Klinikverbund Südwest gGmbH",
      "company_seat": "Böblingen",
      "details": "05.08.2025 (Bekanntmachungsdatum)\n\nBaden-Württemberg Amtsgericht Stuttgart HRB 720915\nEinreichung neuer Dokumente\n\nKlinikverbund Südwest gGmbH\nGesellschaft mit beschränkter Haftung\nBöblingen\n\nDie Gesellschaft hat am 04.08.2025 die Liste über die Zusammensetzung des Aufsichtsrats zum Handelsregister eingereicht."
    },
    {
      "date": "2025-08-05",
      "id": "119290",
      "original_text": "Löschungsankündigung\nBerlin Amtsgericht Berlin (Charlottenburg) HRB 182032\nDRG - Deichgraf Restaurantgesellschaft mbH – Berlin",
      "type": "Löschungsankündigung",
      "state": "Berlin",
      "amtsgericht": "Amtsgericht Berlin (Charlottenburg)",
      "registernummer": "HRB 182032",
      "registerart": "HRB",
      "company_name": "DRG - Deichgraf Restaurantgesellschaft mbH",
      "company_seat": "Berlin",
      "details": "05.08.2025 (Bekanntmachungsdatum)\n\nBerlin Amtsgericht Berlin (Charlottenburg) HRB 182032\nLöschungsankündigung\n\nDRG - Deichgraf Restaurantgesellschaft mbH\nGesellschaft mit beschränkter Haftung\nBerlin\n\nBei der nachstehenden Gesellschaft wird das Amtslöschungsverfahren gemäß § 394 FamFG eingeleitet. Widerspruchsfrist 6 Wochen"
    },
    {
      "date": "2025-08-05",
      "id": "119291",
      "original_text": "Registerbekanntmachung nach dem Umwandlungsgesetz\nBaden-Württemberg Amtsgericht Stuttgart HRB 763058\nMercedes-Benz Beteiligungsgesellschaft mbH – Stuttgart",
      "type": "Registerbekanntmachung nach dem Umwandlungsgesetz",
      "state": "Baden-Württemberg",
      "amtsgericht": "Amtsgericht Stuttgart",
      "registernummer": "HRB 763058",
      "registerart": "HRB",
      "company_name": "Mercedes-Benz Beteiligungsgesellschaft mbH",
      "company_seat": "Stuttgart",
      "details": "05.08.2025 (Bekanntmachungsdatum)\n\nBaden-Württemberg Amtsgericht Stuttgart HRB 763058\nRegisterbekanntmachung nach dem Umwandlungsgesetz 05.08.2025 (Eintragungsdatum)\n\nMercedes-Benz Beteiligungsgesellschaft mbH\nGesellschaft mit beschränkter Haftung\nStuttgart\n\nAls nicht eingetragen wird bekanntgemacht:\nDen Gläubigern der an der Verschmelzung beteiligten Rechtsträger ist, wenn sie binnen sechs Monaten nach dem Tag, an dem die Eintragung der Verschmelzung in das Register des Sitzes desjenigen Rechtsträgers, dessen Gläubiger sie sind, nach § 19 Abs. 3 UmwG als bekanntgemacht gilt, ihren Anspruch nach Grund und Höhe schriftlich anmelden, Sicherheit zu leisten, soweit sie nicht Befriedigung verlangen können. Dieses Recht steht den Gläubigern jedoch nur zu, wenn sie glaubhaft machen, dass durch die Verschmelzung die Erfüllung ihrer Forderung gefährdet wird."
    },
    {
      "date": "2025-08-05",
      "id": "119292",
      "original_text": "Löschungsankündigung\nSaarland Amtsgericht Saarbrücken HRB 3598\nReco-Bausysteme GmbH – Homburg",
      "type": "Löschungsankündigung",
      "state": "Saarland",
      "amtsgericht": "Amtsgericht Saarbrücken",
      "registernummer": "HRB 3598",
      "registerart": "HRB",
      "company_name": "Reco-Bausysteme GmbH",
      "company_seat": "Homburg",
      "details": "05.08.2025 (Bekanntmachungsdatum)\n\nSaarland Amtsgericht Saarbrücken HRB 3598\nLöschungsankündigung\n\nReco-Bausysteme GmbH\nGesellschaft mit beschränkter Haftung\nHomburg\n\nEs ist beabsichtigt, die Gesellschaft von Amts wegen gemäß § 394 FamFG wegen Vermögenslosigkeit zu löschen.\nGegen die Löschung von Amts wegen ist das Rechtsmittel des Widerspruchs statthaft. Der Widerspruch ist binnen einer Frist drei Monaten beginnend mit dem Tag dieser Veröffentlichung durch Einreichen eines Widerspruchsschreibens -schriftlich oder zur Niederschrift der Geschäftsstelle beim Amtsgericht Saarbrücken, -zentrales Handelsregister-, Mainzerstr.178, 66121 Saarbrücken einzulegen.\nDer Widerspruch muss die Bezeichnung der angefochtenen Löschungsankündigung enthalten sowie die Erklärung, dass Widerspruch eingelegt wird. Er ist vom Widerspruchsführer oder seinem Bevollmächtigten zu unterzeichnen.\nDas Widerspruchsschreiben kann auch in der Form eines elektronischen Dokumentes eingereicht werden, das mit einer qualifizierten elektronischen Signatur nach dem Signaturgesetz versehen sein muss (§§ 14 Abs. 2 FamFG, 130a, 298 ZPO)."
    },
    {
      "date": "2025-08-05",
      "id": "119293",
      "original_text": "Registerbekanntmachung nach dem Umwandlungsgesetz\nBrandenburg Amtsgericht Cottbus HRA 4416\nThomas Völkel e.K. – Schönefeld",
      "type": "Registerbekanntmachung nach dem Umwandlungsgesetz",
      "state": "Brandenburg",
      "amtsgericht": "Amtsgericht Cottbus",
      "registernummer": "HRA 4416",
      "registerart": "HRA",
      "company_name": "Thomas Völkel e.K.",
      "company_seat": "Schönefeld",
      "details": "05.08.2025 (Bekanntmachungsdatum)\n\nBrandenburg Amtsgericht Cottbus HRA 4416\nRegisterbekanntmachung nach dem Umwandlungsgesetz 01.08.2025 (Eintragungsdatum)\n\nThomas Völkel e.K.\nEinzelkaufmann / Einzelkauffrau\nSchönefeld\n\nAls nicht eingetragen wird veröffentlicht:\nDen Gläubigern der an der Spaltung beteiligten Rechtsträger ist, wenn sie binnen sechs Monaten nach dem Tag, an dem die Eintragung der Spaltung in das Register des Sitzes desjenigen Rechtsträgers, dessen Gläubiger sie sind, als bekannt gemacht gilt, ihren Anspruch nach Grund und Höhe schriftlich anmelden, Sicherheit zu leisten, soweit sie nicht Befriedigung verlangen können. Dieses Recht steht den Gläubigern jedoch nur zu, wenn sie glaubhaft machen, dass durch die Spaltung die Erfüllung ihrer Forderung gefährdet wird"
    },
    {
      "date": "2025-08-05",
      "id": "119294",
      "original_text": "Registerbekanntmachung nach dem Umwandlungsgesetz\nHamburg Amtsgericht Hamburg HRA 69043\nAUSTRALIA Grundstücksgesellschaft Wessel & Co. (GmbH & Co.) – Hamburg",
      "type": "Registerbekanntmachung nach dem Umwandlungsgesetz",
      "state": "Hamburg",
      "amtsgericht": "Amtsgericht Hamburg",
      "registernummer": "HRA 69043",
      "registerart": "HRA",
      "company_name": "AUSTRALIA Grundstücksgesellschaft Wessel & Co. (GmbH & Co.)",
      "company_seat": "Hamburg",
      "details": "05.08.2025 (Bekanntmachungsdatum)\n\nHamburg Amtsgericht Hamburg HRA 69043\nRegisterbekanntmachung nach dem Umwandlungsgesetz 05.08.2025 (Eintragungsdatum)\n\nAUSTRALIA Grundstücksgesellschaft Wessel & Co. (GmbH & Co.)\nKommanditgesellschaft\nHamburg\n\nAls nicht eingetragen wird bekannt gemacht:\nDen Gläubigern der an der formwechselnden Umwandlung beteiligten Gesellschaften ist, wenn sie binnen sechs Monaten nach dem Tag, an dem die Eintragung der formwechselnden Umwandlung in das Register des Sitzes desjenigen Rechtsträgers, dessen Gläubiger sie sind, nach § 19 Absatz 3 UmwG als bekannt gemacht gilt, ihren Anspruch nach Grund und Höhe schriftlich anmelden, Sicherheit zu leisten, soweit sie nicht Befriedigung verlangen können. Dieses Recht steht den Gläubigern jedoch nur zu, wenn sie glaubhaft machen, dass durch die formwechselnde Umwandlung die Erfüllung ihrer Forderung gefährdet wird."
    },
    {
      "date": "2025-08-05",
      "id": "119295",
      "original_text": "Einreichung neuer Dokumente\nBerlin Amtsgericht Berlin (Charlottenburg) HRB 79833\nECOVIS Audit AG Wirtschaftsprüfungsgesellschaft – Berlin",
      "type": "Einreichung neuer Dokumente",
      "state": "Berlin",
      "amtsgericht": "Amtsgericht Berlin (Charlottenburg)",
      "registernummer": "HRB 79833",
      "registerart": "HRB",
      "company_name": "ECOVIS Audit AG Wirtschaftsprüfungsgesellschaft",
      "company_seat": "Berlin",
      "details": "05.08.2025 (Bekanntmachungsdatum)\n\nBerlin Amtsgericht Berlin (Charlottenburg) HRB 79833\nEinreichung neuer Dokumente\n\nECOVIS Audit AG Wirtschaftsprüfungsgesellschaft\nAktiengesellschaft\nBerlin\n\nAls nicht eingetragen wird veröffentlicht:\nEs wurde eine neue Liste der Aufsichtsratsmitglieder eingereicht (§ 106 AktG)."
    },
    {
      "date": "2025-08-05",
      "id": "119296",
      "original_text": "Sonstige Registerbekanntmachung\nBerlin Amtsgericht Berlin (Charlottenburg) HRB 225092\nNYALA Digital Asset AG – Berlin",
      "type": "Sonstige Registerbekanntmachung",
      "state": "Berlin",
      "amtsgericht": "Amtsgericht Berlin (Charlottenburg)",
      "registernummer": "HRB 225092",
      "registerart": "HRB",
      "company_name": "NYALA Digital Asset AG",
      "company_seat": "Berlin",
      "details": "05.08.2025 (Bekanntmachungsdatum)\n\nBerlin Amtsgericht Berlin (Charlottenburg) HRB 225092\nSonstige Registerbekanntmachung\n\nNYALA Digital Asset AG\nAktiengesellschaft\nBerlin\n\nAls nicht eingetragen wird veröffentlicht: Es wurde eine neue Liste der Aufsichtsratsmitglieder eingereicht (§ 106 AktG)."
    },
    {
      "date": "2025-08-05",
      "id": "119297",
      "original_text": "Registerbekanntmachung nach dem Umwandlungsgesetz\nBrandenburg Amtsgericht Neuruppin HRB 12843\nMenzer Finanzkontor GmbH – Stechlin",
      "type": "Registerbekanntmachung nach dem Umwandlungsgesetz",
      "state": "Brandenburg",
      "amtsgericht": "Amtsgericht Neuruppin",
      "registernummer": "HRB 12843",
      "registerart": "HRB",
      "company_name": "Menzer Finanzkontor GmbH",
      "company_seat": "Stechlin",
      "details": "05.08.2025 (Bekanntmachungsdatum)\n\nBrandenburg Amtsgericht Neuruppin HRB 12843\nRegisterbekanntmachung nach dem Umwandlungsgesetz 04.08.2025 (Eintragungsdatum)\n\nMenzer Finanzkontor GmbH\nGesellschaft mit beschränkter Haftung\nStechlin\n\nZu Eintragungsnummer 4 vom 04.08.2025 wird als nicht eingetragen veröffentlicht:\n\nDen Gläubigern der an der Umwandlung beteiligten Rechtsträger ist, wenn sie binnen sechs Monaten nach dem Tag, an dem die Eintragung der Umwandlung in das Register des Sitzes desjenigen Rechtsträgers, dessen Gläubiger sie sind, als bekannt gemacht gilt, ihren Anspruch nach Grund und Höhe schriftlich anmelden, Sicherheit zu leisten, soweit sie nicht Befriedigung verlangen können. Dieses Recht steht den Gläubigern jedoch nur zu, wenn sie glaubhaft machen, dass durch die Umwandlung die Erfüllung ihrer Forderung gefährdet wird"
    },
    {
      "date": "2025-08-05",
      "id": "119298",
      "original_text": "Registerbekanntmachung nach dem Umwandlungsgesetz\nBaden-Württemberg Amtsgericht Stuttgart HRB 721601\nKemmler Industriebau GmbH – Tübingen",
      "type": "Registerbekanntmachung nach dem Umwandlungsgesetz",
      "state": "Baden-Württemberg",
      "amtsgericht": "Amtsgericht Stuttgart",
      "registernummer": "HRB 721601",
      "registerart": "HRB",
      "company_name": "Kemmler Industriebau GmbH",
      "company_seat": "Tübingen",
      "details": "05.08.2025 (Bekanntmachungsdatum)\n\nBaden-Württemberg Amtsgericht Stuttgart HRB 721601\nRegisterbekanntmachung nach dem Umwandlungsgesetz 05.08.2025 (Eintragungsdatum)\n\nKemmler Industriebau GmbH\nGesellschaft mit beschränkter Haftung\nTübingen\n\nAls nicht eingetragen wird bekanntgemacht:\nDen Gläubigern der an der Verschmelzung beteiligten Rechtsträger ist, wenn sie binnen sechs Monaten nach dem Tag, an dem die Eintragung der Verschmelzung in das Register des Sitzes desjenigen Rechtsträgers, dessen Gläubiger sie sind, nach § 19 Abs. 3 UmwG als bekanntgemacht gilt, ihren Anspruch nach Grund und Höhe schriftlich anmelden, Sicherheit zu leisten, soweit sie nicht Befriedigung verlangen können. Dieses Recht steht den Gläubigern jedoch nur zu, wenn sie glaubhaft machen, dass durch die Verschmelzung die Erfüllung ihrer Forderung gefährdet wird."
    },
    {
      "date": "2025-08-05",
      "id": "119299",
      "original_text": "Registerbekanntmachung nach dem Umwandlungsgesetz\nBaden-Württemberg Amtsgericht Mannheim HRB 460231\nWEISS GmbH – Buchen Odenwald",
      "type": "Registerbekanntmachung nach dem Umwandlungsgesetz",
      "state": "Baden-Württemberg",
      "amtsgericht": "Amtsgericht Mannheim",
      "registernummer": "HRB 460231",
      "registerart": "HRB",
      "company_name": "WEISS GmbH",
      "company_seat": "Buchen Odenwald",
      "details": "05.08.2025 (Bekanntmachungsdatum)\n\nBaden-Württemberg Amtsgericht Mannheim HRB 460231\nRegisterbekanntmachung nach dem Umwandlungsgesetz 05.08.2025 (Eintragungsdatum)\n\nWEISS GmbH\nGesellschaft mit beschränkter Haftung\nBuchen Odenwald\n\nDen Gläubigern der an der Verschmelzung beteiligten Rechtsträger ist, wenn sie binnen sechs Monaten nach dem Tag, an dem die Eintragung der Verschmelzung in das Register des Sitzes desjenigen Rechtsträgers, dessen Gläubiger sie sind, nach § 19 Abs. 3 UmwG als bekanntgemacht gilt, ihren Anspruch nach Grund und Höhe schriftlich anmelden, Sicherheit zu leisten, soweit sie nicht Befriedigung verlangen können. Dieses Recht steht den Gläubigern jedoch nur zu, wenn sie glaubhaft machen, dass durch die Verschmelzung die Erfüllung ihrer Forderung gefährdet wird."
    },
    {
      "date": "2025-08-05",
      "id": "119300",
      "original_text": "Registerbekanntmachung nach dem Umwandlungsgesetz\nBerlin Amtsgericht Berlin (Charlottenburg) HRB 204247\nStadt. Land. Bad. GmbH – Berlin",
      "type": "Registerbekanntmachung nach dem Umwandlungsgesetz",
      "state": "Berlin",
      "amtsgericht": "Amtsgericht Berlin (Charlottenburg)",
      "registernummer": "HRB 204247",
      "registerart": "HRB",
      "company_name": "Stadt. Land. Bad. GmbH",
      "company_seat": "Berlin",
      "details": "05.08.2025 (Bekanntmachungsdatum)\n\nBerlin Amtsgericht Berlin (Charlottenburg) HRB 204247\nRegisterbekanntmachung nach dem Umwandlungsgesetz 04.08.2025 (Eintragungsdatum)\n\nStadt. Land. Bad. GmbH\nGesellschaft mit beschränkter Haftung\nBerlin\n\nZu Eintragungsnummer 5 vom 04.08.2025 wird als nicht eingetragen veröffentlicht:Den Gläubigern der an der Verschmelzung beteiligten Rechtsträger ist, wenn sie binnen sechs Monaten nach dem Tag, an dem die Eintragung der Verschmelzung in das Register des Sitzes desjenigen Rechtsträgers, dessen Gläubiger sie sind, als bekannt gemacht gilt, ihren Anspruch nach Grund und Höhe schriftlich anmelden, Sicherheit zu leisten, soweit sie nicht Befriedigung verlangen können. Dieses Recht steht den Gläubigern jedoch nur zu, wenn sie glaubhaft machen, dass durch die Verschmelzung die Erfüllung ihrer Forderung gefährdet wird. Das Recht, Sicherheitsleistung zu verlangen, steht Gläubigern nicht zu, die im Falle der Insolvenz ein Recht auf vorzugsweise Befriedigung aus einer Deckungsmasse haben, die nach gesetzlicher Vorschrift zu ihrem Schutz errichtet und staatlich überwacht ist."
    },
    {
      "date": "2025-08-05",
      "id": "119301",
      "original_text": "Registerbekanntmachung nach dem Umwandlungsgesetz\nSaarland Amtsgericht Saarbrücken HRB 101846\nSK Holding GmbH – Saarbrücken",
      "type": "Registerbekanntmachung nach dem Umwandlungsgesetz",
      "state": "Saarland",
      "amtsgericht": "Amtsgericht Saarbrücken",
      "registernummer": "HRB 101846",
      "registerart": "HRB",
      "company_name": "SK Holding GmbH",
      "company_seat": "Saarbrücken",
      "details": "05.08.2025 (Bekanntmachungsdatum)\n\nSaarland Amtsgericht Saarbrücken HRB 101846\nRegisterbekanntmachung nach dem Umwandlungsgesetz 05.08.2025 (Eintragungsdatum)\n\nSK Holding GmbH\nGesellschaft mit beschränkter Haftung\nSaarbrücken\n\nAls nicht eingetragen wird bekannt gemacht: Den Gläubigern der an der Verschmelzung beteiligten Gesellschaften ist, wenn sie binnen sechs Monaten nach dem Tag, an dem die Eintragung der Verschmelzung in das Register des Sitzes desjenigen Rechtsträgers, dessen Gläubiger sie sind, nach § 19 Absatz 3 UmwG bekannt gemacht worden ist, ihren Anspruch nach Grund und Höhe schriftlich anmelden, Sicherheit zu leisten, soweit sie nicht Befriedigung verlangen können. Dieses Recht steht den Gläubigern jedoch nur zu, wenn sie glaubhaft machen, dass durch die Verschmelzung die Erfüllung ihrer Forderung gefährdet wird."
    },
    {
      "date": "2025-08-05",
      "id": "119302",
      "original_text": "Registerbekanntmachung nach dem Umwandlungsgesetz\nNordrhein-Westfalen Amtsgericht Coesfeld HRA 10039\nRalf Schramm gewerbliche Vermietung e.K. – Reken",
      "type": "Registerbekanntmachung nach dem Umwandlungsgesetz",
      "state": "Nordrhein-Westfalen",
      "amtsgericht": "Amtsgericht Coesfeld",
      "registernummer": "HRA 10039",
      "registerart": "HRA",
      "company_name": "Ralf Schramm gewerbliche Vermietung e.K.",
      "company_seat": "Reken",
      "details": "05.08.2025 (Bekanntmachungsdatum)\n\nNordrhein-Westfalen Amtsgericht Coesfeld HRA 10039\nRegisterbekanntmachung nach dem Umwandlungsgesetz 04.08.2025 (Eintragungsdatum)\n\nRalf Schramm gewerbliche Vermietung e.K.\nEinzelkaufmann\nReken\n\nDen Gläubigern der an der Ausgliederung beteiligten Rechtsträger ist, wenn sie binnen sechs Monaten nach dem Tag, an dem die Eintragung der Ausgliederung in das Register des Sitzes desjenigen Rechtsträgers, dessen Gläubiger sie sind, nach § 19 Absatz 3 UmwG als bekanntgemacht gilt, ihren Anspruch nach Grund und Höhe schriftlich anmelden, Sicherheit zu leisten, soweit sie nicht Befriedigung verlangen können. Dieses Recht steht den Gläubigern jedoch nur zu, wenn sie glaubhaft machen, dass durch die Ausgliederung die Erfüllung ihrer Forderung gefährdet wird."
    },
    {
      "date": "2025-08-05",
      "id": "119303",
      "original_text": "Registerbekanntmachung nach dem Umwandlungsgesetz\nBerlin Amtsgericht Berlin (Charlottenburg) HRB 52748\nKurt Wegscheider Versicherungsmakler GmbH – Berlin",
      "type": "Registerbekanntmachung nach dem Umwandlungsgesetz",
      "state": "Berlin",
      "amtsgericht": "Amtsgericht Berlin (Charlottenburg)",
      "registernummer": "HRB 52748",
      "registerart": "HRB",
      "company_name": "Kurt Wegscheider Versicherungsmakler GmbH",
      "company_seat": "Berlin",
      "details": "05.08.2025 (Bekanntmachungsdatum)\n\nBerlin Amtsgericht Berlin (Charlottenburg) HRB 52748\nRegisterbekanntmachung nach dem Umwandlungsgesetz 05.08.2025 (Eintragungsdatum)\n\nKurt Wegscheider Versicherungsmakler GmbH\nGesellschaft mit beschränkter Haftung\nBerlin\n\nZu Eintragungsnummer 10 vom 05.08.2025 wird als nicht eingetragen veröffentlicht:\n\nDen Gläubigern der an der Verschmelzung beteiligten Rechtsträger ist, wenn sie binnen sechs Monaten nach dem Tag, an dem die Eintragung der Verschmelzung in das Register des Sitzes desjenigen Rechtsträgers, dessen Gläubiger sie sind, als bekannt gemacht gilt, ihren Anspruch nach Grund und Höhe schriftlich anmelden, Sicherheit zu leisten, soweit sie nicht Befriedigung verlangen können. Dieses Recht steht den Gläubigern jedoch nur zu, wenn sie glaubhaft machen, dass durch die Verschmelzung die Erfüllung ihrer Forderung gefährdet wird. Das Recht, Sicherheitsleistung zu verlangen, steht Gläubigern nicht zu, die im Falle der Insolvenz ein Recht auf vorzugsweise Befriedigung aus einer Deckungsmasse haben, die nach gesetzlicher Vorschrift zu ihrem Schutz errichtet und staatlich überwacht ist."
    },
    {
      "date": "2025-08-05",
      "id": "119304",
      "original_text": "Registerbekanntmachung nach dem Umwandlungsgesetz\nSaarland Amtsgericht Saarbrücken HRB 8868\nSBG Unternehmensberatung GmbH – Saarbrücken",
      "type": "Registerbekanntmachung nach dem Umwandlungsgesetz",
      "state": "Saarland",
      "amtsgericht": "Amtsgericht Saarbrücken",
      "registernummer": "HRB 8868",
      "registerart": "HRB",
      "company_name": "SBG Unternehmensberatung GmbH",
      "company_seat": "Saarbrücken",
      "details": "05.08.2025 (Bekanntmachungsdatum)\n\nSaarland Amtsgericht Saarbrücken HRB 8868\nRegisterbekanntmachung nach dem Umwandlungsgesetz 05.08.2025 (Eintragungsdatum)\n\nSBG Unternehmensberatung GmbH\nGesellschaft mit beschränkter Haftung\nSaarbrücken\n\nAls nicht eingetragen wird bekannt gemacht: Den Gläubigern der an der Verschmelzung beteiligten Gesellschaften ist, wenn sie binnen sechs Monaten nach dem Tag, an dem die Eintragung der Verschmelzung in das Register des Sitzes desjenigen Rechtsträgers, dessen Gläubiger sie sind, nach § 19 Absatz 3 UmwG bekannt gemacht worden ist, ihren Anspruch nach Grund und Höhe schriftlich anmelden, Sicherheit zu leisten, soweit sie nicht Befriedigung verlangen können. Dieses Recht steht den Gläubigern jedoch nur zu, wenn sie glaubhaft machen, dass durch die Verschmelzung die Erfüllung ihrer Forderung gefährdet wird."
    },
    {
      "date": "2025-08-05",
      "id": "119305",
      "original_text": "Registerbekanntmachung nach dem Umwandlungsgesetz\nBerlin Amtsgericht Berlin (Charlottenburg) HRB 195168\nadamas venture GmbH – Berlin",
      "type": "Registerbekanntmachung nach dem Umwandlungsgesetz",
      "state": "Berlin",
      "amtsgericht": "Amtsgericht Berlin (Charlottenburg)",
      "registernummer": "HRB 195168",
      "registerart": "HRB",
      "company_name": "adamas venture GmbH",
      "company_seat": "Berlin",
      "details": "05.08.2025 (Bekanntmachungsdatum)\n\nBerlin Amtsgericht Berlin (Charlottenburg) HRB 195168\nRegisterbekanntmachung nach dem Umwandlungsgesetz 04.08.2025 (Eintragungsdatum)\n\nadamas venture GmbH\nGesellschaft mit beschränkter Haftung\nBerlin\n\nZu Eintragungsnummer 3 vom 04.08.2025 wird als nicht eingetragen veröffentlicht:Den Gläubigern der an der Verschmelzung beteiligten Rechtsträger ist, wenn sie binnen sechs Monaten nach dem Tag, an dem die Eintragung der Verschmelzung in das Register des Sitzes desjenigen Rechtsträgers, dessen Gläubiger sie sind, als bekannt gemacht gilt, ihren Anspruch nach Grund und Höhe schriftlich anmelden, Sicherheit zu leisten, soweit sie nicht Befriedigung verlangen können. Dieses Recht steht den Gläubigern jedoch nur zu, wenn sie glaubhaft machen, dass durch die Verschmelzung die Erfüllung ihrer Forderung gefährdet wird. Das Recht, Sicherheitsleistung zu verlangen, steht Gläubigern nicht zu, die im Falle der Insolvenz ein Recht auf vorzugsweise Befriedigung aus einer Deckungsmasse haben, die nach gesetzlicher Vorschrift zu ihrem Schutz errichtet und staatlich überwacht ist."
    },
    {
      "date": "2025-08-05",
      "id": "119306",
      "original_text": "Registerbekanntmachung nach dem Umwandlungsgesetz\nBerlin Amtsgericht Berlin (Charlottenburg) HRB 53311\nMüller & Sohn Versicherungsmakler GmbH – Berlin",
      "type": "Registerbekanntmachung nach dem Umwandlungsgesetz",
      "state": "Berlin",
      "amtsgericht": "Amtsgericht Berlin (Charlottenburg)",
      "registernummer": "HRB 53311",
      "registerart": "HRB",
      "company_name": "Müller & Sohn Versicherungsmakler GmbH",
      "company_seat": "Berlin",
      "details": "05.08.2025 (Bekanntmachungsdatum)\n\nBerlin Amtsgericht Berlin (Charlottenburg) HRB 53311\nRegisterbekanntmachung nach dem Umwandlungsgesetz 05.08.2025 (Eintragungsdatum)\n\nMüller & Sohn Versicherungsmakler GmbH\nGesellschaft mit beschränkter Haftung\nBerlin\n\nZu Eintragungsnummer 7 vom 05.08.2025 wird als nicht eingetragen veröffentlicht:\n\nDen Gläubigern der an der Verschmelzung beteiligten Rechtsträger ist, wenn sie binnen sechs Monaten nach dem Tag, an dem die Eintragung der Verschmelzung in das Register des Sitzes desjenigen Rechtsträgers, dessen Gläubiger sie sind, als bekannt gemacht gilt, ihren Anspruch nach Grund und Höhe schriftlich anmelden, Sicherheit zu leisten, soweit sie nicht Befriedigung verlangen können. Dieses Recht steht den Gläubigern jedoch nur zu, wenn sie glaubhaft machen, dass durch die Verschmelzung die Erfüllung ihrer Forderung gefährdet wird. Das Recht, Sicherheitsleistung zu verlangen, steht Gläubigern nicht zu, die im Falle der Insolvenz ein Recht auf vorzugsweise Befriedigung aus einer Deckungsmasse haben, die nach gesetzlicher Vorschrift zu ihrem Schutz errichtet und staatlich überwacht ist."
    },
    {
      "date": "2025-08-05",
      "id": "119307",
      "original_text": "Registerbekanntmachung nach dem Umwandlungsgesetz\nNordrhein-Westfalen Amtsgericht Coesfeld HRB 9692\nGlaswerk Türsysteme GmbH – Bocholt",
      "type": "Registerbekanntmachung nach dem Umwandlungsgesetz",
      "state": "Nordrhein-Westfalen",
      "amtsgericht": "Amtsgericht Coesfeld",
      "registernummer": "HRB 9692",
      "registerart": "HRB",
      "company_name": "Glaswerk Türsysteme GmbH",
      "company_seat": "Bocholt",
      "details": "05.08.2025 (Bekanntmachungsdatum)\n\nNordrhein-Westfalen Amtsgericht Coesfeld HRB 9692\nRegisterbekanntmachung nach dem Umwandlungsgesetz 05.08.2025 (Eintragungsdatum)\n\nGlaswerk Türsysteme GmbH\nGesellschaft mit beschränkter Haftung\nBocholt\n\nDen Gläubigern der an der Verschmelzung beteiligten Rechtsträger ist, wenn sie binnen sechs Monaten nach dem Tag, an dem die Eintragung der Verschmelzung in das Register des Sitzes derjenigen Rechtsträger deren Gläubiger sie sind, nach § 19 Absatz 3 UmwG als bekanntgemacht gilt, ihren Anspruch nach Grund und Höhe schriftlich anmelden, Sicherheit zu leisten, soweit sie nicht Befriedigung verlangen können. Dieses Recht steht den Gläubigern jedoch nur zu, wenn sie glaubhaft machen, dass durch die Verschmelzung die Erfüllung ihrer Forderung gefährdet wird."
    },
    {
      "date": "2025-08-05",
      "id": "119308",
      "original_text": "Registerbekanntmachung nach dem Umwandlungsgesetz\nHamburg Amtsgericht Hamburg HRB 180071\nAquila Clean Energy GmbH – Hamburg",
      "type": "Registerbekanntmachung nach dem Umwandlungsgesetz",
      "state": "Hamburg",
      "amtsgericht": "Amtsgericht Hamburg",
      "registernummer": "HRB 180071",
      "registerart": "HRB",
      "company_name": "Aquila Clean Energy GmbH",
      "company_seat": "Hamburg",
      "details": "05.08.2025 (Bekanntmachungsdatum)\n\nHamburg Amtsgericht Hamburg HRB 180071\nRegisterbekanntmachung nach dem Umwandlungsgesetz 05.08.2025 (Eintragungsdatum)\n\nAquila Clean Energy GmbH\nGesellschaft mit beschränkter Haftung\nHamburg\n\nAls nicht eingetragen wird bekannt gemacht:\nDen Gläubigern der an der Verschmelzung beteiligten Gesellschaften ist, wenn sie binnen sechs Monaten nach dem Tag, an dem die Eintragung der Verschmelzung in das Register des Sitzes desjenigen Rechtsträgers, dessen Gläubiger sie sind, nach § 19 Absatz 3 UmwG als bekannt gemacht gilt, ihren Anspruch nach Grund und Höhe schriftlich anmelden, Sicherheit zu leisten, soweit sie nicht Befriedigung verlangen können. Dieses Recht steht den Gläubigern jedoch nur zu, wenn sie glaubhaft machen, dass durch die Verschmelzung die Erfüllung ihrer Forderung gefährdet wird."
    },
    {
      "date": "2025-08-05",
      "id": "119309",
      "original_text": "Sonstige Registerbekanntmachung\nHamburg Amtsgericht Hamburg HRB 154180\nENERPARC Solar Invest 169 GmbH – Hamburg",
      "type": "Sonstige Registerbekanntmachung",
      "state": "Hamburg",
      "amtsgericht": "Amtsgericht Hamburg",
      "registernummer": "HRB 154180",
      "registerart": "HRB",
      "company_name": "ENERPARC Solar Invest 169 GmbH",
      "company_seat": "Hamburg",
      "details": "05.08.2025 (Bekanntmachungsdatum)\n\nHamburg Amtsgericht Hamburg HRB 154180\nSonstige Registerbekanntmachung 05.08.2025 (Eintragungsdatum)\n\nENERPARC Solar Invest 169 GmbH\nGesellschaft mit beschränkter Haftung\nHamburg\n\nAls nicht eingetragen wird bekannt gemacht:  Den Gläubigern der Gesellschaft, deren Forderungen begründet worden sind, bevor die Eintragung der Vertragsbeendigung in das Handelsregister nach § 10 HGB als bekannt gemacht gilt, ist vom anderen Vertragsteil Sicherheit zu leisten, wenn sie sich binnen 6 Monaten nach Bekanntmachung der Eintragung zu diesem Zweck bei ihm melden."
    },
    {
      "date": "2025-08-05",
      "id": "119310",
      "original_text": "Sonstige Registerbekanntmachung\nHamburg Amtsgericht Hamburg HRB 166103\nENERPARC Solar Invest 229 GmbH – Hamburg",
      "type": "Sonstige Registerbekanntmachung",
      "state": "Hamburg",
      "amtsgericht": "Amtsgericht Hamburg",
      "registernummer": "HRB 166103",
      "registerart": "HRB",
      "company_name": "ENERPARC Solar Invest 229 GmbH",
      "company_seat": "Hamburg",
      "details": "05.08.2025 (Bekanntmachungsdatum)\n\nHamburg Amtsgericht Hamburg HRB 166103\nSonstige Registerbekanntmachung 05.08.2025 (Eintragungsdatum)\n\nENERPARC Solar Invest 229 GmbH\nGesellschaft mit beschränkter Haftung\nHamburg\n\nAls nicht eingetragen wird bekannt gemacht:  Den Gläubigern der Gesellschaft, deren Forderungen begründet worden sind, bevor die Eintragung der Vertragsbeendigung in das Handelsregister nach § 10 HGB als bekannt gemacht gilt, ist vom anderen Vertragsteil Sicherheit zu leisten, wenn sie sich binnen 6 Monaten nach Bekanntmachung der Eintragung zu diesem Zweck bei ihm melden."
    },
    {
      "date": "2025-08-05",
      "id": "119311",
      "original_text": "Registerbekanntmachung nach dem Umwandlungsgesetz\nHamburg Amtsgericht Hamburg HRB 165004\nAQ ENRG GmbH – Hamburg",
      "type": "Registerbekanntmachung nach dem Umwandlungsgesetz",
      "state": "Hamburg",
      "amtsgericht": "Amtsgericht Hamburg",
      "registernummer": "HRB 165004",
      "registerart": "HRB",
      "company_name": "AQ ENRG GmbH",
      "company_seat": "Hamburg",
      "details": "05.08.2025 (Bekanntmachungsdatum)\n\nHamburg Amtsgericht Hamburg HRB 165004\nRegisterbekanntmachung nach dem Umwandlungsgesetz 05.08.2025 (Eintragungsdatum)\n\nAQ ENRG GmbH\nGesellschaft mit beschränkter Haftung\nHamburg\n\nAls nicht eingetragen wird bekannt gemacht:\nDen Gläubigern der an der Verschmelzung beteiligten Gesellschaften ist, wenn sie binnen sechs Monaten nach dem Tag, an dem die Eintragung der Verschmelzung in das Register des Sitzes desjenigen Rechtsträgers, dessen Gläubiger sie sind, nach § 19 Absatz 3 UmwG als bekannt gemacht gilt, ihren Anspruch nach Grund und Höhe schriftlich anmelden, Sicherheit zu leisten, soweit sie nicht Befriedigung verlangen können. Dieses Recht steht den Gläubigern jedoch nur zu, wenn sie glaubhaft machen, dass durch die Verschmelzung die Erfüllung ihrer Forderung gefährdet wird."
    },
    {
      "date": "2025-08-05",
      "id": "119312",
      "original_text": "Sonstige Registerbekanntmachung\nHamburg Amtsgericht Hamburg HRB 165800\nENERPARC Solar Invest 192 GmbH – Hamburg",
      "type": "Sonstige Registerbekanntmachung",
      "state": "Hamburg",
      "amtsgericht": "Amtsgericht Hamburg",
      "registernummer": "HRB 165800",
      "registerart": "HRB",
      "company_name": "ENERPARC Solar Invest 192 GmbH",
      "company_seat": "Hamburg",
      "details": "05.08.2025 (Bekanntmachungsdatum)\n\nHamburg Amtsgericht Hamburg HRB 165800\nSonstige Registerbekanntmachung 05.08.2025 (Eintragungsdatum)\n\nENERPARC Solar Invest 192 GmbH\nGesellschaft mit beschränkter Haftung\nHamburg\n\nAls nicht eingetragen wird bekannt gemacht:  Den Gläubigern der Gesellschaft, deren Forderungen begründet worden sind, bevor die Eintragung der Vertragsbeendigung in das Handelsregister nach § 10 HGB als bekannt gemacht gilt, ist vom anderen Vertragsteil Sicherheit zu leisten, wenn sie sich binnen 6 Monaten nach Bekanntmachung der Eintragung zu diesem Zweck bei ihm melden."
    },
    {
      "date": "2025-08-05",
      "id": "119313",
      "original_text": "Löschungsankündigung\nSchleswig-Holstein Amtsgericht Flensburg HRB 11072\nZweites Magellan Reedereikontor Beteiligungsgesellschaft mbH – Sylt",
      "type": "Löschungsankündigung",
      "state": "Schleswig-Holstein",
      "amtsgericht": "Amtsgericht Flensburg",
      "registernummer": "HRB 11072",
      "registerart": "HRB",
      "company_name": "Zweites Magellan Reedereikontor Beteiligungsgesellschaft mbH",
      "company_seat": "Sylt",
      "details": "05.08.2025 (Bekanntmachungsdatum)\n\nSchleswig-Holstein Amtsgericht Flensburg HRB 11072\nLöschungsankündigung\n\nZweites Magellan Reedereikontor Beteiligungsgesellschaft mbH\nGesellschaft mit beschränkter Haftung\nSylt\n\nEs ist die Löschung der nachstehenden Gesellschaft wegen Vermögenslosigkeit gemäß § 394 FamFG beabsichtigt.\n\nWiderspruchsfrist: 2 Monate."
    },
    {
      "date": "2025-08-05",
      "id": "119314",
      "original_text": "Registerbekanntmachung nach dem Umwandlungsgesetz\nBaden-Württemberg Amtsgericht Stuttgart HRA 741868\nDürnsteiner Entsorgung (Inh. Roger Kappel) e.K. – Neckartailfingen",
      "type": "Registerbekanntmachung nach dem Umwandlungsgesetz",
      "state": "Baden-Württemberg",
      "amtsgericht": "Amtsgericht Stuttgart",
      "registernummer": "HRA 741868",
      "registerart": "HRA",
      "company_name": "Dürnsteiner Entsorgung (Inh. Roger Kappel) e.K.",
      "company_seat": "Neckartailfingen",
      "details": "05.08.2025 (Bekanntmachungsdatum)\n\nBaden-Württemberg Amtsgericht Stuttgart HRA 741868\nRegisterbekanntmachung nach dem Umwandlungsgesetz 05.08.2025 (Eintragungsdatum)\n\nDürnsteiner Entsorgung (Inh. Roger Kappel) e.K.\nEinzelkaufmann / Einzelkauffrau\nNeckartailfingen\n\nAls nicht eingetragen wird bekanntgemacht:\nDen Gläubigern der an der Ausgliederung beteiligten Rechtsträger ist, wenn sie binnen sechs Monaten nach dem Tag, an dem die Eintragung der Ausgliederung in das Register des Sitzes desjenigen Rechtsträgers, dessen Gläubiger sie sind, nach § 19 Abs. 3 UmwG als bekanntgemacht gilt, ihren Anspruch nach Grund und Höhe schriftlich anmelden, Sicherheit zu leisten, soweit sie nicht Befriedigung verlangen können. Dieses Recht steht den Gläubigern jedoch nur zu, wenn sie glaubhaft machen, dass durch die Ausgliederung die Erfüllung ihrer Forderung gefährdet wird."
    },
    {
      "date": "2025-08-05",
      "id": "119315",
      "original_text": "Sonstige Registerbekanntmachung\nHamburg Amtsgericht Hamburg HRB 161029\nEG Deutschland Food Services GmbH – Hamburg",
      "type": "Sonstige Registerbekanntmachung",
      "state": "Hamburg",
      "amtsgericht": "Amtsgericht Hamburg",
      "registernummer": "HRB 161029",
      "registerart": "HRB",
      "company_name": "EG Deutschland Food Services GmbH",
      "company_seat": "Hamburg",
      "details": "05.08.2025 (Bekanntmachungsdatum)\n\nHamburg Amtsgericht Hamburg HRB 161029\nSonstige Registerbekanntmachung 05.08.2025 (Eintragungsdatum)\n\nEG Deutschland Food Services GmbH\nGesellschaft mit beschränkter Haftung\nHamburg\n\nAls nicht eingetragen wird bekannt gemacht:  Den Gläubigern der Gesellschaft, deren Forderungen begründet worden sind, bevor die Eintragung der Vertragsbeendigung in das Handelsregister nach § 10 HGB als bekannt gemacht gilt, ist vom anderen Vertragsteil Sicherheit zu leisten, wenn sie sich binnen 6 Monaten nach Bekanntmachung der Eintragung zu diesem Zweck bei ihm melden."
    },
    {
      "date": "2025-08-05",
      "id": "119316",
      "original_text": "Einreichung neuer Dokumente\nBaden-Württemberg Amtsgericht Stuttgart HRB 222\nStuttgarter Lebensversicherung a.G. – Stuttgart",
      "type": "Einreichung neuer Dokumente",
      "state": "Baden-Württemberg",
      "amtsgericht": "Amtsgericht Stuttgart",
      "registernummer": "HRB 222",
      "registerart": "HRB",
      "company_name": "Stuttgarter Lebensversicherung a.G.",
      "company_seat": "Stuttgart",
      "details": "05.08.2025 (Bekanntmachungsdatum)\n\nBaden-Württemberg Amtsgericht Stuttgart HRB 222\nEinreichung neuer Dokumente\n\nStuttgarter Lebensversicherung a.G.\nVersicherungsverein auf Gegenseitigkeit\nStuttgart\n\nDie Gesellschaft hat am 04.08.2025 die Liste über die Zusammensetzung des Aufsichtsrats zum Handelsregister eingereicht."
    },
    {
      "date": "2025-08-05",
      "id": "119317",
      "original_text": "Registerbekanntmachung nach dem Umwandlungsgesetz\nBerlin Amtsgericht Berlin (Charlottenburg) HRB 157256\nIPlytics GmbH – Berlin",
      "type": "Registerbekanntmachung nach dem Umwandlungsgesetz",
      "state": "Berlin",
      "amtsgericht": "Amtsgericht Berlin (Charlottenburg)",
      "registernummer": "HRB 157256",
      "registerart": "HRB",
      "company_name": "IPlytics GmbH",
      "company_seat": "Berlin",
      "details": "05.08.2025 (Bekanntmachungsdatum)\n\nBerlin Amtsgericht Berlin (Charlottenburg) HRB 157256\nRegisterbekanntmachung nach dem Umwandlungsgesetz 04.08.2025 (Eintragungsdatum)\n\nIPlytics GmbH\nGesellschaft mit beschränkter Haftung\nBerlin\n\nZu Eintragungsnummer 5 vom 04.08.2025 wird als nicht eingetragen veröffentlicht: Den Gläubigern der an der Verschmelzung beteiligten Rechtsträger ist, wenn sie binnen sechs Monaten nach dem Tag, an dem die Eintragung der Verschmelzung in das Register des Sitzes desjenigen Rechtsträgers, dessen Gläubiger sie sind, als bekannt gemacht gilt, ihren Anspruch nach Grund und Höhe schriftlich anmelden, Sicherheit zu leisten, soweit sie nicht Befriedigung verlangen können. Dieses Recht steht den Gläubigern jedoch nur zu, wenn sie glaubhaft machen, dass durch die Verschmelzung die Erfüllung ihrer Forderung gefährdet wird. Das Recht, Sicherheitsleistung zu verlangen, steht Gläubigern nicht zu, die im Falle der Insolvenz ein Recht auf vorzugsweise Befriedigung aus einer Deckungsmasse haben, die nach gesetzlicher Vorschrift zu ihrem Schutz errichtet und staatlich überwacht ist."
    },
    {
      "date": "2025-08-05",
      "id": "119318",
      "original_text": "Registerbekanntmachung nach dem Umwandlungsgesetz\nHamburg Amtsgericht Hamburg HRB 113314\nEDEKA DIGITAL GmbH – Hamburg",
      "type": "Registerbekanntmachung nach dem Umwandlungsgesetz",
      "state": "Hamburg",
      "amtsgericht": "Amtsgericht Hamburg",
      "registernummer": "HRB 113314",
      "registerart": "HRB",
      "company_name": "EDEKA DIGITAL GmbH",
      "company_seat": "Hamburg",
      "details": "05.08.2025 (Bekanntmachungsdatum)\n\nHamburg Amtsgericht Hamburg HRB 113314\nRegisterbekanntmachung nach dem Umwandlungsgesetz 05.08.2025 (Eintragungsdatum)\n\nEDEKA DIGITAL GmbH\nGesellschaft mit beschränkter Haftung\nHamburg\n\nAls nicht eingetragen wird bekannt gemacht:\nDen Gläubigern der an der Verschmelzung beteiligten Gesellschaften ist, wenn sie binnen sechs Monaten nach dem Tag, an dem die Eintragung der Verschmelzung in das Register des Sitzes desjenigen Rechtsträgers, dessen Gläubiger sie sind, nach § 19 Absatz 3 UmwG als bekannt gemacht gilt, ihren Anspruch nach Grund und Höhe schriftlich anmelden, Sicherheit zu leisten, soweit sie nicht Befriedigung verlangen können. Dieses Recht steht den Gläubigern jedoch nur zu, wenn sie glaubhaft machen, dass durch die Verschmelzung die Erfüllung ihrer Forderung gefährdet wird."
    },
    {
      "date": "2025-08-05",
      "id": "119319",
      "original_text": "Registerbekanntmachung nach dem Umwandlungsgesetz\nHamburg Amtsgericht Hamburg HRB 90516\nEDEKA Verwaltungs- und Beteiligungs GmbH – Hamburg",
      "type": "Registerbekanntmachung nach dem Umwandlungsgesetz",
      "state": "Hamburg",
      "amtsgericht": "Amtsgericht Hamburg",
      "registernummer": "HRB 90516",
      "registerart": "HRB",
      "company_name": "EDEKA Verwaltungs- und Beteiligungs GmbH",
      "company_seat": "Hamburg",
      "details": "05.08.2025 (Bekanntmachungsdatum)\n\nHamburg Amtsgericht Hamburg HRB 90516\nRegisterbekanntmachung nach dem Umwandlungsgesetz 05.08.2025 (Eintragungsdatum)\n\nEDEKA Verwaltungs- und Beteiligungs GmbH\nGesellschaft mit beschränkter Haftung\nHamburg\n\nAls nicht eingetragen wird bekannt gemacht:\nDen Gläubigern der an der Verschmelzung beteiligten Gesellschaften ist, wenn sie binnen sechs Monaten nach dem Tag, an dem die Eintragung der Verschmelzung in das Register des Sitzes desjenigen Rechtsträgers, dessen Gläubiger sie sind, nach § 19 Absatz 3 UmwG als bekannt gemacht gilt, ihren Anspruch nach Grund und Höhe schriftlich anmelden, Sicherheit zu leisten, soweit sie nicht Befriedigung verlangen können. Dieses Recht steht den Gläubigern jedoch nur zu, wenn sie glaubhaft machen, dass durch die Verschmelzung die Erfüllung ihrer Forderung gefährdet wird."
    },
    {
      "date": "2025-08-05",
      "id": "119320",
      "original_text": "Registerbekanntmachung nach dem Umwandlungsgesetz\nHamburg Amtsgericht Hamburg HRB 161235\nfoodstarter GmbH – Hamburg",
      "type": "Registerbekanntmachung nach dem Umwandlungsgesetz",
      "state": "Hamburg",
      "amtsgericht": "Amtsgericht Hamburg",
      "registernummer": "HRB 161235",
      "registerart": "HRB",
      "company_name": "foodstarter GmbH",
      "company_seat": "Hamburg",
      "details": "05.08.2025 (Bekanntmachungsdatum)\n\nHamburg Amtsgericht Hamburg HRB 161235\nRegisterbekanntmachung nach dem Umwandlungsgesetz 05.08.2025 (Eintragungsdatum)\n\nfoodstarter GmbH\nGesellschaft mit beschränkter Haftung\nHamburg\n\nAls nicht eingetragen wird bekannt gemacht:\nDen Gläubigern der an der Verschmelzung beteiligten Gesellschaften ist, wenn sie binnen sechs Monaten nach dem Tag, an dem die Eintragung der Verschmelzung in das Register des Sitzes desjenigen Rechtsträgers, dessen Gläubiger sie sind, nach § 19 Absatz 3 UmwG als bekannt gemacht gilt, ihren Anspruch nach Grund und Höhe schriftlich anmelden, Sicherheit zu leisten, soweit sie nicht Befriedigung verlangen können. Dieses Recht steht den Gläubigern jedoch nur zu, wenn sie glaubhaft machen, dass durch die Verschmelzung die Erfüllung ihrer Forderung gefährdet wird."
    },
    {
      "date": "2025-08-05",
      "id": "119321",
      "original_text": "Registerbekanntmachung nach dem Umwandlungsgesetz\nHamburg Amtsgericht Hamburg HRB 121449\nEDEKA ZENTRALE Handel und Produktion GmbH – Hamburg",
      "type": "Registerbekanntmachung nach dem Umwandlungsgesetz",
      "state": "Hamburg",
      "amtsgericht": "Amtsgericht Hamburg",
      "registernummer": "HRB 121449",
      "registerart": "HRB",
      "company_name": "EDEKA ZENTRALE Handel und Produktion GmbH",
      "company_seat": "Hamburg",
      "details": "05.08.2025 (Bekanntmachungsdatum)\n\nHamburg Amtsgericht Hamburg HRB 121449\nRegisterbekanntmachung nach dem Umwandlungsgesetz 05.08.2025 (Eintragungsdatum)\n\nEDEKA ZENTRALE Handel und Produktion GmbH\nGesellschaft mit beschränkter Haftung\nHamburg\n\nAls nicht eingetragen wird bekannt gemacht:\nDen Gläubigern der an der Verschmelzung beteiligten Gesellschaften ist, wenn sie binnen sechs Monaten nach dem Tag, an dem die Eintragung der Verschmelzung in das Register des Sitzes desjenigen Rechtsträgers, dessen Gläubiger sie sind, nach § 19 Absatz 3 UmwG als bekannt gemacht gilt, ihren Anspruch nach Grund und Höhe schriftlich anmelden, Sicherheit zu leisten, soweit sie nicht Befriedigung verlangen können. Dieses Recht steht den Gläubigern jedoch nur zu, wenn sie glaubhaft machen, dass durch die Verschmelzung die Erfüllung ihrer Forderung gefährdet wird."
    },
    {
      "date": "2025-08-05",
      "id": "119322",
      "original_text": "Registerbekanntmachung nach dem Umwandlungsgesetz\nHamburg Amtsgericht Hamburg HRB 120975\nSIMOL Verwaltung GmbH – Hamburg",
      "type": "Registerbekanntmachung nach dem Umwandlungsgesetz",
      "state": "Hamburg",
      "amtsgericht": "Amtsgericht Hamburg",
      "registernummer": "HRB 120975",
      "registerart": "HRB",
      "company_name": "SIMOL Verwaltung GmbH",
      "company_seat": "Hamburg",
      "details": "05.08.2025 (Bekanntmachungsdatum)\n\nHamburg Amtsgericht Hamburg HRB 120975\nRegisterbekanntmachung nach dem Umwandlungsgesetz 05.08.2025 (Eintragungsdatum)\n\nSIMOL Verwaltung GmbH\nGesellschaft mit beschränkter Haftung\nHamburg\n\nAls nicht eingetragen wird bekannt gemacht:\nDen Gläubigern der an der Verschmelzung beteiligten Gesellschaften ist, wenn sie binnen sechs Monaten nach dem Tag, an dem die Eintragung der Verschmelzung in das Register des Sitzes desjenigen Rechtsträgers, dessen Gläubiger sie sind, nach § 19 Absatz 3 UmwG als bekannt gemacht gilt, ihren Anspruch nach Grund und Höhe schriftlich anmelden, Sicherheit zu leisten, soweit sie nicht Befriedigung verlangen können. Dieses Recht steht den Gläubigern jedoch nur zu, wenn sie glaubhaft machen, dass durch die Verschmelzung die Erfüllung ihrer Forderung gefährdet wird."
    },
    {
      "date": "2025-08-05",
      "id": "119323",
      "original_text": "Registerbekanntmachung nach dem Umwandlungsgesetz\nNordrhein-Westfalen Amtsgericht Coesfeld HRB 9637\nBod´or KTM GmbH – Bocholt",
      "type": "Registerbekanntmachung nach dem Umwandlungsgesetz",
      "state": "Nordrhein-Westfalen",
      "amtsgericht": "Amtsgericht Coesfeld",
      "registernummer": "HRB 9637",
      "registerart": "HRB",
      "company_name": "Bod´or KTM GmbH",
      "company_seat": "Bocholt",
      "details": "05.08.2025 (Bekanntmachungsdatum)\n\nNordrhein-Westfalen Amtsgericht Coesfeld HRB 9637\nRegisterbekanntmachung nach dem Umwandlungsgesetz 05.08.2025 (Eintragungsdatum)\n\nBod´or KTM GmbH\nGesellschaft mit beschränkter Haftung\nBocholt\n\nDen Gläubigern der an der Verschmelzung beteiligten Rechtsträger ist, wenn sie binnen sechs Monaten nach dem Tag, an dem die Eintragung der Verschmelzung in das Register des Sitzes desjenigen Rechtsträgers, dessen Gläubiger sie sind, nach § 19 Absatz 3 UmwG als bekanntgemacht gilt, ihren Anspruch nach Grund und Höhe schriftlich anmelden, Sicherheit zu leisten, soweit sie nicht Befriedigung verlangen können. Dieses Recht steht den Gläubigern jedoch nur zu, wenn sie glaubhaft machen, dass durch die Verschmelzung die Erfüllung ihrer Forderung gefährdet wird."
    },
    {
      "date": "2025-08-05",
      "id": "119324",
      "original_text": "Registerbekanntmachung nach dem Umwandlungsgesetz\nNordrhein-Westfalen Amtsgericht Coesfeld HRB 13493\nKÜCHENHAUS AHAUS GmbH – Ahaus",
      "type": "Registerbekanntmachung nach dem Umwandlungsgesetz",
      "state": "Nordrhein-Westfalen",
      "amtsgericht": "Amtsgericht Coesfeld",
      "registernummer": "HRB 13493",
      "registerart": "HRB",
      "company_name": "KÜCHENHAUS AHAUS GmbH",
      "company_seat": "Ahaus",
      "details": "05.08.2025 (Bekanntmachungsdatum)\n\nNordrhein-Westfalen Amtsgericht Coesfeld HRB 13493\nRegisterbekanntmachung nach dem Umwandlungsgesetz 05.08.2025 (Eintragungsdatum)\n\nKÜCHENHAUS AHAUS GmbH\nGesellschaft mit beschränkter Haftung\nAhaus\n\nDen Gläubigern der an der Verschmelzung beteiligten Rechtsträger ist, wenn sie binnen sechs Monaten nach dem Tag, an dem die Eintragung der Verschmelzung in das Register des Sitzes derjenigen Rechtsträger deren Gläubiger sie sind, nach § 19 Absatz 3 UmwG als bekanntgemacht gilt, ihren Anspruch nach Grund und Höhe schriftlich anmelden, Sicherheit zu leisten, soweit sie nicht Befriedigung verlangen können. Dieses Recht steht den Gläubigern jedoch nur zu, wenn sie glaubhaft machen, dass durch die Verschmelzung die Erfüllung ihrer Forderung gefährdet wird."
    },
    {
      "date": "2025-08-05",
      "id": "119325",
      "original_text": "Registerbekanntmachung nach dem Umwandlungsgesetz\nNordrhein-Westfalen Amtsgericht Coesfeld HRB 13350\nTGN Werkstatt-Technik UG (haftungsbeschränkt) – Nottuln",
      "type": "Registerbekanntmachung nach dem Umwandlungsgesetz",
      "state": "Nordrhein-Westfalen",
      "amtsgericht": "Amtsgericht Coesfeld",
      "registernummer": "HRB 13350",
      "registerart": "HRB",
      "company_name": "TGN Werkstatt-Technik UG (haftungsbeschränkt)",
      "company_seat": "Nottuln",
      "details": "05.08.2025 (Bekanntmachungsdatum)\n\nNordrhein-Westfalen Amtsgericht Coesfeld HRB 13350\nRegisterbekanntmachung nach dem Umwandlungsgesetz 05.08.2025 (Eintragungsdatum)\n\nTGN Werkstatt-Technik UG (haftungsbeschränkt)\nGesellschaft mit beschränkter Haftung\nNottuln\n\nDen Gläubigern der an der Verschmelzung beteiligten Rechtsträger ist, wenn sie binnen sechs Monaten nach dem Tag, an dem die Eintragung der Verschmelzung in das Register des Sitzes derjenigen Rechtsträger deren Gläubiger sie sind, nach § 19 Absatz 3 UmwG als bekanntgemacht gilt, ihren Anspruch nach Grund und Höhe schriftlich anmelden, Sicherheit zu leisten, soweit sie nicht Befriedigung verlangen können. Dieses Recht steht den Gläubigern jedoch nur zu, wenn sie glaubhaft machen, dass durch die Verschmelzung die Erfüllung ihrer Forderung gefährdet wird."
    },
    {
      "date": "2025-08-05",
      "id": "119326",
      "original_text": "Registerbekanntmachung nach dem Umwandlungsgesetz\nNordrhein-Westfalen Amtsgericht Coesfeld HRA 3505\nGeorg Lensing GmbH & Co. KG – Reken",
      "type": "Registerbekanntmachung nach dem Umwandlungsgesetz",
      "state": "Nordrhein-Westfalen",
      "amtsgericht": "Amtsgericht Coesfeld",
      "registernummer": "HRA 3505",
      "registerart": "HRA",
      "company_name": "Georg Lensing GmbH & Co. KG",
      "company_seat": "Reken",
      "details": "05.08.2025 (Bekanntmachungsdatum)\n\nNordrhein-Westfalen Amtsgericht Coesfeld HRA 3505\nRegisterbekanntmachung nach dem Umwandlungsgesetz 04.08.2025 (Eintragungsdatum)\n\nGeorg Lensing GmbH & Co. KG\nKommanditgesellschaft\nReken\n\nDen Gläubigern der an der Ausgliederung beteiligten Rechtsträger ist, wenn sie binnen sechs Monaten nach dem Tag, an dem die Eintragung der Ausgliederung in das Register des Sitzes desjenigen Rechtsträgers, dessen Gläubiger sie sind, nach § 19 Absatz 3 UmwG als bekanntgemacht gilt, ihren Anspruch nach Grund und Höhe schriftlich anmelden, Sicherheit zu leisten, soweit sie nicht Befriedigung verlangen können. Dieses Recht steht den Gläubigern jedoch nur zu, wenn sie glaubhaft machen, dass durch die Ausgliederung die Erfüllung ihrer Forderung gefährdet wird."
    },
    {
      "date": "2025-08-05",
      "id": "119327",
      "original_text": "Registerbekanntmachung nach dem Umwandlungsgesetz\nSchleswig-Holstein Amtsgericht Lübeck HRB 16249\nGrüner Immobilien GmbH – Scharbeutz",
      "type": "Registerbekanntmachung nach dem Umwandlungsgesetz",
      "state": "Schleswig-Holstein",
      "amtsgericht": "Amtsgericht Lübeck",
      "registernummer": "HRB 16249",
      "registerart": "HRB",
      "company_name": "Grüner Immobilien GmbH",
      "company_seat": "Scharbeutz",
      "details": "05.08.2025 (Bekanntmachungsdatum)\n\nSchleswig-Holstein Amtsgericht Lübeck HRB 16249\nRegisterbekanntmachung nach dem Umwandlungsgesetz 04.08.2025 (Eintragungsdatum)\n\nGrüner Immobilien GmbH\nGesellschaft mit beschränkter Haftung\nScharbeutz\n\nZu Eintragungsnummer 4 vom 04.08.2025 wird als nicht eingetragen veröffentlicht:  Den Gläubigern der an der Verschmelzung beteiligten Rechtsträger ist, wenn sie binnen sechs Monaten nach dem Tag, an dem die Eintragung der Verschmelzung in das Register des Sitzes desjenigen Rechtsträgers, dessen Gläubiger sie sind, als bekannt gemacht gilt, ihren Anspruch nach Grund und Höhe schriftlich anmelden, Sicherheit zu leisten, soweit sie nicht Befriedigung verlangen können. Dieses Recht steht den Gläubigern jedoch nur zu, wenn sie glaubhaft machen, dass durch die Verschmelzung die Erfüllung ihrer Forderung gefährdet wird."
    },
    {
      "date": "2025-08-05",
      "id": "119328",
      "original_text": "Registerbekanntmachung nach dem Umwandlungsgesetz\nNordrhein-Westfalen Amtsgericht Coesfeld HRB 4903\nd.velop AG – Gescher",
      "type": "Registerbekanntmachung nach dem Umwandlungsgesetz",
      "state": "Nordrhein-Westfalen",
      "amtsgericht": "Amtsgericht Coesfeld",
      "registernummer": "HRB 4903",
      "registerart": "HRB",
      "company_name": "d.velop AG",
      "company_seat": "Gescher",
      "details": "05.08.2025 (Bekanntmachungsdatum)\n\nNordrhein-Westfalen Amtsgericht Coesfeld HRB 4903\nRegisterbekanntmachung nach dem Umwandlungsgesetz 05.08.2025 (Eintragungsdatum)\n\nd.velop AG\nAktiengesellschaft\nGescher\n\nDen Gläubigern der an der Verschmelzung beteiligten Rechtsträger ist, wenn sie binnen sechs Monaten nach dem Tag, an dem die Eintragung der Verschmelzung in das Register des Sitzes derjenigen Rechtsträger deren Gläubiger sie sind, nach § 19 Absatz 3 UmwG als bekanntgemacht gilt, ihren Anspruch nach Grund und Höhe schriftlich anmelden, Sicherheit zu leisten, soweit sie nicht Befriedigung verlangen können. Dieses Recht steht den Gläubigern jedoch nur zu, wenn sie glaubhaft machen, dass durch die Verschmelzung die Erfüllung ihrer Forderung gefährdet wird."
    },
    {
      "date": "2025-08-05",
      "id": "119329",
      "original_text": "Sonstige Registerbekanntmachung\nMecklenburg-Vorpommern Amtsgericht Schwerin HRB 14381\nprovidata GmbH – Schwerin",
      "type": "Sonstige Registerbekanntmachung",
      "state": "Mecklenburg-Vorpommern",
      "amtsgericht": "Amtsgericht Schwerin",
      "registernummer": "HRB 14381",
      "registerart": "HRB",
      "company_name": "providata GmbH",
      "company_seat": "Schwerin",
      "details": "05.08.2025 (Bekanntmachungsdatum)\n\nMecklenburg-Vorpommern Amtsgericht Schwerin HRB 14381\nSonstige Registerbekanntmachung 05.08.2025 (Eintragungsdatum)\n\nprovidata GmbH\nGesellschaft mit beschränkter Haftung\nSchwerin\n\nEine Liste der Mitglieder des Aufsichtsrats ist zum Handelsregister eingereicht worden."
    },
    {
      "date": "2025-08-05",
      "id": "119330",
      "original_text": "Registerbekanntmachung nach dem Umwandlungsgesetz\nNordrhein-Westfalen Amtsgericht Coesfeld HRB 19930\nEXACT Fitness GmbH – Coesfeld",
      "type": "Registerbekanntmachung nach dem Umwandlungsgesetz",
      "state": "Nordrhein-Westfalen",
      "amtsgericht": "Amtsgericht Coesfeld",
      "registernummer": "HRB 19930",
      "registerart": "HRB",
      "company_name": "EXACT Fitness GmbH",
      "company_seat": "Coesfeld",
      "details": "05.08.2025 (Bekanntmachungsdatum)\n\nNordrhein-Westfalen Amtsgericht Coesfeld HRB 19930\nRegisterbekanntmachung nach dem Umwandlungsgesetz 05.08.2025 (Eintragungsdatum)\n\nEXACT Fitness GmbH\nGesellschaft mit beschränkter Haftung\nCoesfeld\n\nDen Gläubigern der an der Verschmelzung beteiligten Rechtsträger ist, wenn sie binnen sechs Monaten nach dem Tag, an dem die Eintragung der Verschmelzung in das Register des Sitzes derjenigen Rechtsträger deren Gläubiger sie sind, nach § 19 Absatz 3 UmwG als bekanntgemacht gilt, ihren Anspruch nach Grund und Höhe schriftlich anmelden, Sicherheit zu leisten, soweit sie nicht Befriedigung verlangen können. Dieses Recht steht den Gläubigern jedoch nur zu, wenn sie glaubhaft machen, dass durch die Verschmelzung die Erfüllung ihrer Forderung gefährdet wird."
    },
    {
      "date": "2025-08-05",
      "id": "119331",
      "original_text": "Registerbekanntmachung nach dem Umwandlungsgesetz\nSchleswig-Holstein Amtsgericht Lübeck HRB 14751\nGrüner Wohnen GmbH – Scharbeutz",
      "type": "Registerbekanntmachung nach dem Umwandlungsgesetz",
      "state": "Schleswig-Holstein",
      "amtsgericht": "Amtsgericht Lübeck",
      "registernummer": "HRB 14751",
      "registerart": "HRB",
      "company_name": "Grüner Wohnen GmbH",
      "company_seat": "Scharbeutz",
      "details": "05.08.2025 (Bekanntmachungsdatum)\n\nSchleswig-Holstein Amtsgericht Lübeck HRB 14751\nRegisterbekanntmachung nach dem Umwandlungsgesetz 04.08.2025 (Eintragungsdatum)\n\nGrüner Wohnen GmbH\nGesellschaft mit beschränkter Haftung\nScharbeutz\n\nZu Eintragungsnummer 7 vom 04.08.2025 wird als nicht eingetragen veröffentlicht:  Den Gläubigern der an der Verschmelzung beteiligten Rechtsträger ist, wenn sie binnen sechs Monaten nach dem Tag, an dem die Eintragung der Verschmelzung in das Register des Sitzes desjenigen Rechtsträgers, dessen Gläubiger sie sind, als bekannt gemacht gilt, ihren Anspruch nach Grund und Höhe schriftlich anmelden, Sicherheit zu leisten, soweit sie nicht Befriedigung verlangen können. Dieses Recht steht den Gläubigern jedoch nur zu, wenn sie glaubhaft machen, dass durch die Verschmelzung die Erfüllung ihrer Forderung gefährdet wird."
    },
    {
      "date": "2025-08-05",
      "id": "119332",
      "original_text": "Registerbekanntmachung nach dem Umwandlungsgesetz\nBrandenburg Amtsgericht Cottbus HRB 9841\nDSG - Dienstleistungs- und Schulungsgesellschaft Beteiligungs-GmbH – Schönefeld",
      "type": "Registerbekanntmachung nach dem Umwandlungsgesetz",
      "state": "Brandenburg",
      "amtsgericht": "Amtsgericht Cottbus",
      "registernummer": "HRB 9841",
      "registerart": "HRB",
      "company_name": "DSG - Dienstleistungs- und Schulungsgesellschaft Beteiligungs-GmbH",
      "company_seat": "Schönefeld",
      "details": "05.08.2025 (Bekanntmachungsdatum)\n\nBrandenburg Amtsgericht Cottbus HRB 9841\nRegisterbekanntmachung nach dem Umwandlungsgesetz 05.08.2025 (Eintragungsdatum)\n\nDSG - Dienstleistungs- und Schulungsgesellschaft Beteiligungs-GmbH\nGesellschaft mit beschränkter Haftung\nSchönefeld\n\nDen Gläubigern der an der Verschmelzung beteiligten Rechtsträger ist, wenn sie binnen sechs Monaten nach dem Tag, an dem die Eintragung der Verschmelzung in das Register des Sitzes desjenigen Rechtsträgers, dessen Gläubiger sie sind, als bekannt gemacht gilt, ihren Anspruch nach Grund und Höhe schriftlich anmelden, Sicherheit zu leisten, soweit sie nicht Befriedigung verlangen können. Dieses Recht steht den Gläubigern jedoch nur zu, wenn sie glaubhaft machen, dass durch die Verschmelzung die Erfüllung ihrer Forderung gefährdet wird"
    },
    {
      "date": "2025-08-05",
      "id": "119333",
      "original_text": "Einreichung neuer Dokumente\nBaden-Württemberg Amtsgericht Stuttgart HRB 23122\nDIE CREW AG – Stuttgart",
      "type": "Einreichung neuer Dokumente",
      "state": "Baden-Württemberg",
      "amtsgericht": "Amtsgericht Stuttgart",
      "registernummer": "HRB 23122",
      "registerart": "HRB",
      "company_name": "DIE CREW AG",
      "company_seat": "Stuttgart",
      "details": "05.08.2025 (Bekanntmachungsdatum)\n\nBaden-Württemberg Amtsgericht Stuttgart HRB 23122\nEinreichung neuer Dokumente 05.08.2025 (Eintragungsdatum)\n\nDIE CREW AG\nAktiengesellschaft\nStuttgart\n\nDie Gesellschaft hat am 04.08.2025 die Liste über die Zusammensetzung des Aufsichtsrats zum Handelsregister eingereicht."
    },
    {
      "date": "2025-08-05",
      "id": "119334",
      "original_text": "Sonstige Registerbekanntmachung\nBrandenburg Amtsgericht Frankfurt/Oder HRB 9978\nSSGE Solarstrom GmbH, Eberswalde – Eberswalde",
      "type": "Sonstige Registerbekanntmachung",
      "state": "Brandenburg",
      "amtsgericht": "Amtsgericht Frankfurt/Oder",
      "registernummer": "HRB 9978",
      "registerart": "HRB",
      "company_name": "SSGE Solarstrom GmbH, Eberswalde",
      "company_seat": "Eberswalde",
      "details": "05.08.2025 (Bekanntmachungsdatum)\n\nBrandenburg Amtsgericht Frankfurt/Oder HRB 9978\nSonstige Registerbekanntmachung 03.08.2025 (Eintragungsdatum)\n\nSSGE Solarstrom GmbH, Eberswalde\nGesellschaft mit beschränkter Haftung\nEberswalde\n\nAls nicht eingetragen wird veröffentlicht:\nDen Gläubigern der an der Verschmelzung beteiligten Rechtsträger ist, wenn sie binnen sechs Monaten nach dem Tag, an dem die Eintragung der Verschmelzung in das Register des Sitzes desjenigen Rechtsträgers, dessen Gläubiger sie sind, als bekannt gemacht gilt, ihren Anspruch nach Grund und Höhe schriftlich anmelden, Sicherheit zu leisten, soweit sie nicht Befriedigung verlangen können. Dieses Recht steht den Gläubigern jedoch nur zu, wenn sie glaubhaft machen, dass durch die Verschmelzung die Erfüllung ihrer Forderung gefährdet wird"
    },
    {
      "date": "2025-08-05",
      "id": "119335",
      "original_text": "Sonstige Registerbekanntmachung\nBrandenburg Amtsgericht Frankfurt/Oder HRB 4458\nWHG Wohnungsbau- und Hausverwaltungs-GmbH – Eberswalde",
      "type": "Sonstige Registerbekanntmachung",
      "state": "Brandenburg",
      "amtsgericht": "Amtsgericht Frankfurt/Oder",
      "registernummer": "HRB 4458",
      "registerart": "HRB",
      "company_name": "WHG Wohnungsbau- und Hausverwaltungs-GmbH",
      "company_seat": "Eberswalde",
      "details": "05.08.2025 (Bekanntmachungsdatum)\n\nBrandenburg Amtsgericht Frankfurt/Oder HRB 4458\nSonstige Registerbekanntmachung 03.08.2025 (Eintragungsdatum)\n\nWHG Wohnungsbau- und Hausverwaltungs-GmbH\nGesellschaft mit beschränkter Haftung\nEberswalde\n\nAls nicht eingetragen wird veröffentlicht:\nDen Gläubigern der an der Verschmelzung beteiligten Rechtsträger ist, wenn sie binnen sechs Monaten nach dem Tag, an dem die Eintragung der Verschmelzung in das Register des Sitzes desjenigen Rechtsträgers, dessen Gläubiger sie sind, als bekannt gemacht gilt, ihren Anspruch nach Grund und Höhe schriftlich anmelden, Sicherheit zu leisten, soweit sie nicht Befriedigung verlangen können. Dieses Recht steht den Gläubigern jedoch nur zu, wenn sie glaubhaft machen, dass durch die Verschmelzung die Erfüllung ihrer Forderung gefährdet wird"
    },
    {
      "date": "2025-08-05",
      "id": "119336",
      "original_text": "Löschungsankündigung\nBaden-Württemberg Amtsgericht Stuttgart HRB 747692\nStifter Transport GmbH – Obersontheim",
      "type": "Löschungsankündigung",
      "state": "Baden-Württemberg",
      "amtsgericht": "Amtsgericht Stuttgart",
      "registernummer": "HRB 747692",
      "registerart": "HRB",
      "company_name": "Stifter Transport GmbH",
      "company_seat": "Obersontheim",
      "details": "05.08.2025 (Bekanntmachungsdatum)\n\nBaden-Württemberg Amtsgericht Stuttgart HRB 747692\nLöschungsankündigung\n\nStifter Transport GmbH\nGesellschaft mit beschränkter Haftung\nObersontheim\n\nDas Gericht beabsichtigt, die Gesellschaft wegen Vermögenslosigkeit im Handelsregister von Amts wegen nach § 394 FamFG zu löschen. Die Frist zur Geltendmachung eines Widerspruchs gegen die beabsichtigte Löschung ist auf zwei Monate ab Veröffentlichung bestimmt."
    },
    {
      "date": "2025-08-05",
      "id": "119337",
      "original_text": "Registerbekanntmachung nach dem Umwandlungsgesetz\nBaden-Württemberg Amtsgericht Mannheim HRB 701125\nKeminer Remmers Spiehs Kartonhandels GmbH – Gernsbach",
      "type": "Registerbekanntmachung nach dem Umwandlungsgesetz",
      "state": "Baden-Württemberg",
      "amtsgericht": "Amtsgericht Mannheim",
      "registernummer": "HRB 701125",
      "registerart": "HRB",
      "company_name": "Keminer Remmers Spiehs Kartonhandels GmbH",
      "company_seat": "Gernsbach",
      "details": "05.08.2025 (Bekanntmachungsdatum)\n\nBaden-Württemberg Amtsgericht Mannheim HRB 701125\nRegisterbekanntmachung nach dem Umwandlungsgesetz 05.08.2025 (Eintragungsdatum)\n\nKeminer Remmers Spiehs Kartonhandels GmbH\nGesellschaft mit beschränkter Haftung\nGernsbach\n\nAls nicht eingetragen wird bekanntgemacht:\nDen Gläubigern der an der Verschmelzung beteiligten Rechtsträger ist, wenn sie binnen sechs Monaten nach dem Tag, an dem die Eintragung der Verschmelzung in das Register des Sitzes desjenigen Rechtsträgers, dessen Gläubiger sie sind, nach § 19 Abs. 3 UmwG als bekanntgemacht gilt, ihren Anspruch nach Grund und Höhe schriftlich anmelden, Sicherheit zu leisten, soweit sie nicht Befriedigung verlangen können. Dieses Recht steht den Gläubigern jedoch nur zu, wenn sie glaubhaft machen, dass durch die Verschmelzung die Erfüllung ihrer Forderung gefährdet wird."
    },
    {
      "date": "2025-08-05",
      "id": "119338",
      "original_text": "Einreichung neuer Dokumente\nBaden-Württemberg Amtsgericht Stuttgart HRB 798399\nSüddeutsche-Sozial-Bau SSB AG – Korntal-Münchingen",
      "type": "Einreichung neuer Dokumente",
      "state": "Baden-Württemberg",
      "amtsgericht": "Amtsgericht Stuttgart",
      "registernummer": "HRB 798399",
      "registerart": "HRB",
      "company_name": "Süddeutsche-Sozial-Bau SSB AG",
      "company_seat": "Korntal-Münchingen",
      "details": "05.08.2025 (Bekanntmachungsdatum)\n\nBaden-Württemberg Amtsgericht Stuttgart HRB 798399\nEinreichung neuer Dokumente\n\nSüddeutsche-Sozial-Bau SSB AG\nAktiengesellschaft\nKorntal-Münchingen\n\nDie Gesellschaft hat am 05.08.2025 die Liste über die Zusammensetzung des Aufsichtsrats zum Handelsregister eingereicht."
    },
    {
      "date": "2025-08-05",
      "id": "119339",
      "original_text": "Registerbekanntmachung nach dem Umwandlungsgesetz\nSachsen Amtsgericht Chemnitz HRA 10210\nKrankenpflegedienst Sandra Vogel e. K. – Rosenbach/Vogtl.",
      "type": "Registerbekanntmachung nach dem Umwandlungsgesetz",
      "state": "Sachsen",
      "amtsgericht": "Amtsgericht Chemnitz",
      "registernummer": "HRA 10210",
      "registerart": "HRA",
      "company_name": "Krankenpflegedienst Sandra Vogel e. K.",
      "company_seat": "Rosenbach/Vogtl.",
      "details": "05.08.2025 (Bekanntmachungsdatum)\n\nSachsen Amtsgericht Chemnitz HRA 10210\nRegisterbekanntmachung nach dem Umwandlungsgesetz 05.08.2025 (Eintragungsdatum)\n\nKrankenpflegedienst Sandra Vogel e. K.\nEinzelkaufmann / Einzelkauffrau\nRosenbach/Vogtl.\n\nDen Gläubigern der an der Ausgliederung beteiligten Rechtsträger ist, wenn sie binnen sechs Monaten nach dem Tag, an dem die Eintragung der Ausgliederung in das Register des Sitzes desjenigen Rechtsträgers, dessen Gläubiger sie sind, nach § 19 Abs. 3 UmwG als bekannt gemacht gilt, ihren Anspruch nach Grund und Höhe in Textform anmelden, Sicherheit zu leisten, soweit sie nicht Befriedigung verlangen können. Dieses Recht steht den Gläubigern jedoch nur zu, wenn sie glaubhaft machen, dass durch die Ausgliederung die Erfüllung der Forderung gefährdet wird."
    },
    {
      "date": "2025-08-05",
      "id": "119340",
      "original_text": "Registerbekanntmachung nach dem Umwandlungsgesetz\nSachsen Amtsgericht Dresden HRB 29885\nAugen-MVZ Lausitz GmbH – Hoyerswerda",
      "type": "Registerbekanntmachung nach dem Umwandlungsgesetz",
      "state": "Sachsen",
      "amtsgericht": "Amtsgericht Dresden",
      "registernummer": "HRB 29885",
      "registerart": "HRB",
      "company_name": "Augen-MVZ Lausitz GmbH",
      "company_seat": "Hoyerswerda",
      "details": "05.08.2025 (Bekanntmachungsdatum)\n\nSachsen Amtsgericht Dresden HRB 29885\nRegisterbekanntmachung nach dem Umwandlungsgesetz 05.08.2025 (Eintragungsdatum)\n\nAugen-MVZ Lausitz GmbH\nGesellschaft mit beschränkter Haftung\nHoyerswerda\n\nDen Gläubigern der an der Verschmelzung beteiligten Rechtsträger ist, wenn sie binnen sechs Monaten nach dem Tag, an dem die Eintragung der Verschmelzung in das Register des Sitzes desjenigen Rechtsträgers, dessen Gläubiger sie sind, nach § 19 Abs. 3 UmwG als bekannt gemacht gilt, ihren Anspruch nach Grund und Höhe in Textform anmelden, Sicherheit zu leisten, soweit sie nicht Befriedigung verlangen können. Dieses Recht steht den Gläubigern jedoch nur zu, wenn sie glaubhaft machen, dass durch die Verschmelzung die Erfüllung der Forderung gefährdet wird."
    },
    {
      "date": "2025-08-05",
      "id": "119341",
      "original_text": "Registerbekanntmachung nach dem Umwandlungsgesetz\nSachsen Amtsgericht Dresden HRB 46940\nFranke Kommunaltechnik GmbH – Dohna",
      "type": "Registerbekanntmachung nach dem Umwandlungsgesetz",
      "state": "Sachsen",
      "amtsgericht": "Amtsgericht Dresden",
      "registernummer": "HRB 46940",
      "registerart": "HRB",
      "company_name": "Franke Kommunaltechnik GmbH",
      "company_seat": "Dohna",
      "details": "05.08.2025 (Bekanntmachungsdatum)\n\nSachsen Amtsgericht Dresden HRB 46940\nRegisterbekanntmachung nach dem Umwandlungsgesetz 05.08.2025 (Eintragungsdatum)\n\nFranke Kommunaltechnik GmbH\nGesellschaft mit beschränkter Haftung\nDohna\n\nDen Gläubigern der an der Ausgliederung beteiligten Rechtsträger ist, wenn sie binnen sechs Monaten nach dem Tag, an dem die Eintragung der Ausgliederung in das Register des Sitzes desjenigen Rechtsträgers, dessen Gläubiger sie sind, nach § 19 Abs. 3 UmwG als bekannt gemacht gilt, ihren Anspruch nach Grund und Höhe in Textform anmelden, Sicherheit zu leisten, soweit sie nicht Befriedigung verlangen können. Dieses Recht steht den Gläubigern jedoch nur zu, wenn sie glaubhaft machen, dass durch die Ausgliederung die Erfüllung der Forderung gefährdet wird."
    },
    {
      "date": "2025-08-05",
      "id": "119342",
      "original_text": "Löschungsankündigung\nSachsen Amtsgericht Dresden HRA 9516\nSchilling Transporte UG (haftungsbeschränkt) & Co. KG – Dresden",
      "type": "Löschungsankündigung",
      "state": "Sachsen",
      "amtsgericht": "Amtsgericht Dresden",
      "registernummer": "HRA 9516",
      "registerart": "HRA",
      "company_name": "Schilling Transporte UG (haftungsbeschränkt) & Co. KG",
      "company_seat": "Dresden",
      "details": "05.08.2025 (Bekanntmachungsdatum)\n\nSachsen Amtsgericht Dresden HRA 9516\nLöschungsankündigung\n\nSchilling Transporte UG (haftungsbeschränkt) & Co. KG\nKommanditgesellschaft\nDresden\n\nDas Registergericht beabsichtigt, die im Handelsregister eingetragene Gesellschaft von Amts wegen nach § 394 FamFG zu löschen. Die Frist zu Erhebung eines Widerspruchs gegen die beabsichtigte Löschung wird auf einen Monat festgesetzt."
    },
    {
      "date": "2025-08-05",
      "id": "119343",
      "original_text": "Registerbekanntmachung nach dem Umwandlungsgesetz\nSachsen Amtsgericht Leipzig HRB 15558\nmauermeisterhaus bau- und planungsgesellschaft mbH – Leipzig",
      "type": "Registerbekanntmachung nach dem Umwandlungsgesetz",
      "state": "Sachsen",
      "amtsgericht": "Amtsgericht Leipzig",
      "registernummer": "HRB 15558",
      "registerart": "HRB",
      "company_name": "mauermeisterhaus bau- und planungsgesellschaft mbH",
      "company_seat": "Leipzig",
      "details": "05.08.2025 (Bekanntmachungsdatum)\n\nSachsen Amtsgericht Leipzig HRB 15558\nRegisterbekanntmachung nach dem Umwandlungsgesetz 05.08.2025 (Eintragungsdatum)\n\nmauermeisterhaus bau- und planungsgesellschaft mbH\nGesellschaft mit beschränkter Haftung\nLeipzig\n\nDen Gläubigern der an der Verschmelzung beteiligten Rechtsträger ist, wenn sie binnen sechs Monaten nach dem Tag, an dem die Eintragung der Verschmelzung in das Register des Sitzes desjenigen Rechtsträgers, dessen Gläubiger sie sind, nach § 19 Abs. 3 UmwG als bekannt gemacht gilt, ihren Anspruch nach Grund und Höhe in Textform anmelden, Sicherheit zu leisten, soweit sie nicht Befriedigung verlangen können. Dieses Recht steht den Gläubigern jedoch nur zu, wenn sie glaubhaft machen, dass durch die Verschmelzung die Erfüllung der Forderung gefährdet wird."
    },
    {
      "date": "2025-08-05",
      "id": "119344",
      "original_text": "Registerbekanntmachung nach dem Umwandlungsgesetz\nSachsen Amtsgericht Dresden VR 12812\nWerbegemeinschaft Innenstadt Riesa e.V. – Riesa",
      "type": "Registerbekanntmachung nach dem Umwandlungsgesetz",
      "state": "Sachsen",
      "amtsgericht": "Amtsgericht Dresden",
      "registernummer": "VR 12812",
      "registerart": "VR",
      "company_name": "Werbegemeinschaft Innenstadt Riesa e.V.",
      "company_seat": "Riesa",
      "details": "05.08.2025 (Bekanntmachungsdatum)\n\nSachsen Amtsgericht Dresden VR 12812\nRegisterbekanntmachung nach dem Umwandlungsgesetz 05.08.2025 (Eintragungsdatum)\n\nWerbegemeinschaft  Innenstadt Riesa e.V.\neingetragener Verein\nRiesa\n\nDen Gläubigern der an der Verschmelzung beteiligten Rechtsträger ist, wenn sie binnen sechs Monaten nach dem Tag, an dem die Eintragung der Verschmelzung in das Register des Sitzes desjenigen Rechtsträgers, dessen Gläubiger sie sind, nach § 19 Abs. 3 UmwG als bekannt gemacht gilt, ihren Anspruch nach Grund und Höhe in Textform anmelden, Sicherheit zu leisten, soweit sie nicht Befriedigung verlangen können. Dieses Recht steht den Gläubigern jedoch nur zu, wenn sie glaubhaft machen, dass durch die Verschmelzung die Erfüllung der Forderung gefährdet wird."
    },
    {
      "date": "2025-08-05",
      "id": "119345",
      "original_text": "Registerbekanntmachung nach dem Umwandlungsgesetz\nSachsen Amtsgericht Dresden VR 12245\n\"Handels-, Gewerbe- und Verkehrsverein Riesa\" e.V. – Riesa",
      "type": "Registerbekanntmachung nach dem Umwandlungsgesetz",
      "state": "Sachsen",
      "amtsgericht": "Amtsgericht Dresden",
      "registernummer": "VR 12245",
      "registerart": "VR",
      "company_name": "\"Handels-, Gewerbe- und Verkehrsverein Riesa\" e.V.",
      "company_seat": "Riesa",
      "details": "05.08.2025 (Bekanntmachungsdatum)\n\nSachsen Amtsgericht Dresden VR 12245\nRegisterbekanntmachung nach dem Umwandlungsgesetz 05.08.2025 (Eintragungsdatum)\n\n\"Handels-, Gewerbe- und Verkehrsverein Riesa\" e.V.\neingetragener Verein\nRiesa\n\nDen Gläubigern der an der Verschmelzung beteiligten Rechtsträger ist, wenn sie binnen sechs Monaten nach dem Tag, an dem die Eintragung der Verschmelzung in das Register des Sitzes desjenigen Rechtsträgers, dessen Gläubiger sie sind, nach § 19 Abs. 3 UmwG als bekannt gemacht gilt, ihren Anspruch nach Grund und Höhe in Textform anmelden, Sicherheit zu leisten, soweit sie nicht Befriedigung verlangen können. Dieses Recht steht den Gläubigern jedoch nur zu, wenn sie glaubhaft machen, dass durch die Verschmelzung die Erfüllung der Forderung gefährdet wird."
    },
    {
      "date": "2025-08-05",
      "id": "119346",
      "original_text": "Registerbekanntmachung nach dem Umwandlungsgesetz\nSachsen Amtsgericht Dresden HRB 36407\nAugenklinik Lausitz GmbH – Hoyerswerda",
      "type": "Registerbekanntmachung nach dem Umwandlungsgesetz",
      "state": "Sachsen",
      "amtsgericht": "Amtsgericht Dresden",
      "registernummer": "HRB 36407",
      "registerart": "HRB",
      "company_name": "Augenklinik Lausitz GmbH",
      "company_seat": "Hoyerswerda",
      "details": "05.08.2025 (Bekanntmachungsdatum)\n\nSachsen Amtsgericht Dresden HRB 36407\nRegisterbekanntmachung nach dem Umwandlungsgesetz 05.08.2025 (Eintragungsdatum)\n\nAugenklinik Lausitz GmbH\nGesellschaft mit beschränkter Haftung\nHoyerswerda\n\nDen Gläubigern der an der Verschmelzung beteiligten Rechtsträger ist, wenn sie binnen sechs Monaten nach dem Tag, an dem die Eintragung der Verschmelzung in das Register des Sitzes desjenigen Rechtsträgers, dessen Gläubiger sie sind, nach § 19 Abs. 3 UmwG als bekannt gemacht gilt, ihren Anspruch nach Grund und Höhe in Textform anmelden, Sicherheit zu leisten, soweit sie nicht Befriedigung verlangen können. Dieses Recht steht den Gläubigern jedoch nur zu, wenn sie glaubhaft machen, dass durch die Verschmelzung die Erfüllung der Forderung gefährdet wird."
    },
    {
      "date": "2025-08-05",
      "id": "119347",
      "original_text": "Registerbekanntmachung nach dem Umwandlungsgesetz\nSachsen Amtsgericht Dresden HRA 12196\nFranke Kommunaltechnik Dietmar Franke e.K. – Dohna",
      "type": "Registerbekanntmachung nach dem Umwandlungsgesetz",
      "state": "Sachsen",
      "amtsgericht": "Amtsgericht Dresden",
      "registernummer": "HRA 12196",
      "registerart": "HRA",
      "company_name": "Franke Kommunaltechnik Dietmar Franke e.K.",
      "company_seat": "Dohna",
      "details": "05.08.2025 (Bekanntmachungsdatum)\n\nSachsen Amtsgericht Dresden HRA 12196\nRegisterbekanntmachung nach dem Umwandlungsgesetz 05.08.2025 (Eintragungsdatum)\n\nFranke Kommunaltechnik Dietmar Franke e.K.\nEinzelkaufmann / Einzelkauffrau\nDohna\n\nDen Gläubigern der an der Ausgliederung beteiligten Rechtsträger ist, wenn sie binnen sechs Monaten nach dem Tag, an dem die Eintragung der Ausgliederung in das Register des Sitzes desjenigen Rechtsträgers, dessen Gläubiger sie sind, nach § 19 Abs. 3 UmwG als bekannt gemacht gilt, ihren Anspruch nach Grund und Höhe in Textform anmelden, Sicherheit zu leisten, soweit sie nicht Befriedigung verlangen können. Dieses Recht steht den Gläubigern jedoch nur zu, wenn sie glaubhaft machen, dass durch die Ausgliederung die Erfüllung der Forderung gefährdet wird."
    },
    {
      "date": "2025-08-05",
      "id": "119348",
      "original_text": "Registerbekanntmachung nach dem Umwandlungsgesetz\nSachsen Amtsgericht Leipzig HRB 36397\nGfA Gesellschaft für Altbausanierung mbH – Leipzig",
      "type": "Registerbekanntmachung nach dem Umwandlungsgesetz",
      "state": "Sachsen",
      "amtsgericht": "Amtsgericht Leipzig",
      "registernummer": "HRB 36397",
      "registerart": "HRB",
      "company_name": "GfA Gesellschaft für Altbausanierung mbH",
      "company_seat": "Leipzig",
      "details": "05.08.2025 (Bekanntmachungsdatum)\n\nSachsen Amtsgericht Leipzig HRB 36397\nRegisterbekanntmachung nach dem Umwandlungsgesetz 05.08.2025 (Eintragungsdatum)\n\nGfA Gesellschaft für Altbausanierung mbH\nGesellschaft mit beschränkter Haftung\nLeipzig\n\nDen Gläubigern der an der Verschmelzung beteiligten Rechtsträger ist, wenn sie binnen sechs Monaten nach dem Tag, an dem die Eintragung der Verschmelzung in das Register des Sitzes desjenigen Rechtsträgers, dessen Gläubiger sie sind, nach § 19 Abs. 3 UmwG als bekannt gemacht gilt, ihren Anspruch nach Grund und Höhe in Textform anmelden, Sicherheit zu leisten, soweit sie nicht Befriedigung verlangen können. Dieses Recht steht den Gläubigern jedoch nur zu, wenn sie glaubhaft machen, dass durch die Verschmelzung die Erfüllung der Forderung gefährdet wird."
    },
    {
      "date": "2025-08-05",
      "id": "119349",
      "original_text": "Registerbekanntmachung nach dem Umwandlungsgesetz\nSachsen Amtsgericht Chemnitz HRB 37601\nKrankenpflegedienst Sandra Vogel GmbH – Rosenbach/Vogtl.",
      "type": "Registerbekanntmachung nach dem Umwandlungsgesetz",
      "state": "Sachsen",
      "amtsgericht": "Amtsgericht Chemnitz",
      "registernummer": "HRB 37601",
      "registerart": "HRB",
      "company_name": "Krankenpflegedienst Sandra Vogel GmbH",
      "company_seat": "Rosenbach/Vogtl.",
      "details": "05.08.2025 (Bekanntmachungsdatum)\n\nSachsen Amtsgericht Chemnitz HRB 37601\nRegisterbekanntmachung nach dem Umwandlungsgesetz 05.08.2025 (Eintragungsdatum)\n\nKrankenpflegedienst Sandra Vogel GmbH\nGesellschaft mit beschränkter Haftung\nRosenbach/Vogtl.\n\nDen Gläubigern der an der Ausgliederung beteiligten Rechtsträger ist, wenn sie binnen sechs Monaten nach dem Tag, an dem die Eintragung der Ausgliederung in das Register des Sitzes desjenigen Rechtsträgers, dessen Gläubiger sie sind, nach § 19 Abs. 3 UmwG als bekannt gemacht gilt, ihren Anspruch nach Grund und Höhe in Textform anmelden, Sicherheit zu leisten, soweit sie nicht Befriedigung verlangen können. Dieses Recht steht den Gläubigern jedoch nur zu, wenn sie glaubhaft machen, dass durch die Ausgliederung die Erfüllung der Forderung gefährdet wird."
    },
    {
      "date": "2025-08-05",
      "id": "119350",
      "original_text": "Registerbekanntmachung nach dem Umwandlungsgesetz\nSachsen Amtsgericht Chemnitz HRA 10201\nKälteservice Müller e.K., Ihn. Denny Hofmann – Zwickau",
      "type": "Registerbekanntmachung nach dem Umwandlungsgesetz",
      "state": "Sachsen",
      "amtsgericht": "Amtsgericht Chemnitz",
      "registernummer": "HRA 10201",
      "registerart": "HRA",
      "company_name": "Kälteservice Müller e.K., Ihn. Denny Hofmann",
      "company_seat": "Zwickau",
      "details": "05.08.2025 (Bekanntmachungsdatum)\n\nSachsen Amtsgericht Chemnitz HRA 10201\nRegisterbekanntmachung nach dem Umwandlungsgesetz 05.08.2025 (Eintragungsdatum)\n\nKälteservice Müller e.K., Ihn. Denny Hofmann\nEinzelkaufmann / Einzelkauffrau\nZwickau\n\nDen Gläubigern der an der Ausgliederung beteiligten Rechtsträger ist, wenn sie binnen sechs Monaten nach dem Tag, an dem die Eintragung der Ausgliederung in das Register des Sitzes desjenigen Rechtsträgers, dessen Gläubiger sie sind, nach § 19 Abs. 3 UmwG als bekannt gemacht gilt, ihren Anspruch nach Grund und Höhe in Textform anmelden, Sicherheit zu leisten, soweit sie nicht Befriedigung verlangen können. Dieses Recht steht den Gläubigern jedoch nur zu, wenn sie glaubhaft machen, dass durch die Ausgliederung die Erfüllung der Forderung gefährdet wird."
    },
    {
      "date": "2025-08-05",
      "id": "119351",
      "original_text": "Registerbekanntmachung nach dem Umwandlungsgesetz\nSachsen Amtsgericht Chemnitz HRB 37598\nKälteservice Müller GmbH – Zwickau",
      "type": "Registerbekanntmachung nach dem Umwandlungsgesetz",
      "state": "Sachsen",
      "amtsgericht": "Amtsgericht Chemnitz",
      "registernummer": "HRB 37598",
      "registerart": "HRB",
      "company_name": "Kälteservice Müller GmbH",
      "company_seat": "Zwickau",
      "details": "05.08.2025 (Bekanntmachungsdatum)\n\nSachsen Amtsgericht Chemnitz HRB 37598\nRegisterbekanntmachung nach dem Umwandlungsgesetz 05.08.2025 (Eintragungsdatum)\n\nKälteservice Müller GmbH\nGesellschaft mit beschränkter Haftung\nZwickau\n\nDen Gläubigern der an der Ausgliederung beteiligten Rechtsträger ist, wenn sie binnen sechs Monaten nach dem Tag, an dem die Eintragung der Ausgliederung in das Register des Sitzes desjenigen Rechtsträgers, dessen Gläubiger sie sind, nach § 19 Abs. 3 UmwG als bekannt gemacht gilt, ihren Anspruch nach Grund und Höhe in Textform anmelden, Sicherheit zu leisten, soweit sie nicht Befriedigung verlangen können. Dieses Recht steht den Gläubigern jedoch nur zu, wenn sie glaubhaft machen, dass durch die Ausgliederung die Erfüllung der Forderung gefährdet wird."
    },
    {
      "date": "2025-08-05",
      "id": "119352",
      "original_text": "Registerbekanntmachung nach dem Umwandlungsgesetz\nSachsen Amtsgericht Leipzig HRB 37355\nKaroM consulting GmbH – Leipzig",
      "type": "Registerbekanntmachung nach dem Umwandlungsgesetz",
      "state": "Sachsen",
      "amtsgericht": "Amtsgericht Leipzig",
      "registernummer": "HRB 37355",
      "registerart": "HRB",
      "company_name": "KaroM consulting GmbH",
      "company_seat": "Leipzig",
      "details": "05.08.2025 (Bekanntmachungsdatum)\n\nSachsen Amtsgericht Leipzig HRB 37355\nRegisterbekanntmachung nach dem Umwandlungsgesetz 05.08.2025 (Eintragungsdatum)\n\nKaroM consulting GmbH\nGesellschaft mit beschränkter Haftung\nLeipzig\n\nDen Gläubigern der an der Verschmelzung beteiligten Rechtsträger ist, wenn sie binnen sechs Monaten nach dem Tag, an dem die Eintragung der Verschmelzung in das Register des Sitzes desjenigen Rechtsträgers, dessen Gläubiger sie sind, nach § 19 Abs. 3 UmwG als bekannt gemacht gilt, ihren Anspruch nach Grund und Höhe in Textform anmelden, Sicherheit zu leisten, soweit sie nicht Befriedigung verlangen können. Dieses Recht steht den Gläubigern jedoch nur zu, wenn sie glaubhaft machen, dass durch die Verschmelzung die Erfüllung der Forderung gefährdet wird."
    },
    {
      "date": "2025-08-05",
      "id": "119353",
      "original_text": "Einreichung neuer Dokumente\nNiedersachsen Amtsgericht Braunschweig HRB 6316\nMagna International Stanztechnik GmbH – Salzgitter",
      "type": "Einreichung neuer Dokumente",
      "state": "Niedersachsen",
      "amtsgericht": "Amtsgericht Braunschweig",
      "registernummer": "HRB 6316",
      "registerart": "HRB",
      "company_name": "Magna International Stanztechnik GmbH",
      "company_seat": "Salzgitter",
      "details": "05.08.2025 (Bekanntmachungsdatum)\n\nNiedersachsen Amtsgericht Braunschweig HRB 6316\nEinreichung neuer Dokumente 05.08.2025 (Eintragungsdatum)\n\nMagna International Stanztechnik GmbH\nGesellschaft mit beschränkter Haftung\nSalzgitter\n\nDie Liste der Mitglieder des Aufsichtsrats wurde beim Registergericht eingereicht."
    },
    {
      "date": "2025-08-05",
      "id": "119354",
      "original_text": "Registerbekanntmachung nach dem Umwandlungsgesetz\nNiedersachsen Amtsgericht Hannover HRB 226728\nSeydlitz GmbH – Garbsen",
      "type": "Registerbekanntmachung nach dem Umwandlungsgesetz",
      "state": "Niedersachsen",
      "amtsgericht": "Amtsgericht Hannover",
      "registernummer": "HRB 226728",
      "registerart": "HRB",
      "company_name": "Seydlitz GmbH",
      "company_seat": "Garbsen",
      "details": "05.08.2025 (Bekanntmachungsdatum)\n\nNiedersachsen Amtsgericht Hannover HRB 226728\nRegisterbekanntmachung nach dem Umwandlungsgesetz 05.08.2025 (Eintragungsdatum)\n\nSeydlitz GmbH\nGesellschaft mit beschränkter Haftung\nGarbsen\n\nDen Gläubigern der an der Verschmelzung beteiligten Rechtsträger ist, wenn sie binnen sechs Monaten nach dem Tag, an dem die Eintragung der Verschmelzung in das Register des Sitzes desjenigen Rechtsträgers, dessen Gläubiger sie sind, nach § 19  Abs.  3 UmwG als bekannt gemacht gilt, ihren Anspruch nach Grund und Höhe schriftlich anmelden, Sicherheit zu leisten, soweit sie nicht Befriedigung verlangen können. Dieses Recht steht den Gläubigern jedoch nur zu, wenn sie glaubhaft machen, dass durch die Verschmelzung die Erfüllung der Forderung gefährdet wird."
    },
    {
      "date": "2025-08-05",
      "id": "119355",
      "original_text": "Löschungsankündigung\nNiedersachsen Amtsgericht Hannover HRB 219680\nWHITE Immobilien & Finanzierung UG (haftungsbeschränkt) – Barsinghausen",
      "type": "Löschungsankündigung",
      "state": "Niedersachsen",
      "amtsgericht": "Amtsgericht Hannover",
      "registernummer": "HRB 219680",
      "registerart": "HRB",
      "company_name": "WHITE Immobilien & Finanzierung UG (haftungsbeschränkt)",
      "company_seat": "Barsinghausen",
      "details": "05.08.2025 (Bekanntmachungsdatum)\n\nNiedersachsen Amtsgericht Hannover HRB 219680\nLöschungsankündigung\n\nWHITE Immobilien & Finanzierung UG (haftungsbeschränkt)\nGesellschaft mit beschränkter Haftung\nBarsinghausen\n\nDas Registergericht beabsichtigt, die Gesellschaft von Amts wegen nach § 394 FamFG zu löschen. Die Frist zur Erhebung eines Widerspruchs ist auf 1 Monat ab dieser Registerbekanntmachung festgesetzt."
    },
    {
      "date": "2025-08-05",
      "id": "119356",
      "original_text": "Registerbekanntmachung nach dem Umwandlungsgesetz\nNiedersachsen Amtsgericht Walsrode VR 115\nDeutsche Verkehrswacht, Verkehrswacht Walsrode e.V. – Walsrode",
      "type": "Registerbekanntmachung nach dem Umwandlungsgesetz",
      "state": "Niedersachsen",
      "amtsgericht": "Amtsgericht Walsrode",
      "registernummer": "VR 115",
      "registerart": "VR",
      "company_name": "Deutsche Verkehrswacht, Verkehrswacht Walsrode e.V.",
      "company_seat": "Walsrode",
      "details": "05.08.2025 (Bekanntmachungsdatum)\n\nNiedersachsen Amtsgericht Walsrode VR 115\nRegisterbekanntmachung nach dem Umwandlungsgesetz 05.08.2025 (Eintragungsdatum)\n\nDeutsche Verkehrswacht, Verkehrswacht Walsrode e.V.\neingetragener Verein\nWalsrode\n\nDen Gläubigern der an der Verschmelzung beteiligten Rechtsträger ist, wenn sie binnen sechs Monaten nach dem Tag, an dem die Eintragung der Verschmelzung in das Register des Sitzes desjenigen Rechtsträgers, dessen Gläubiger sie sind, nach § 19  Abs.  3 UmwG als bekannt gemacht gilt, ihren Anspruch nach Grund und Höhe schriftlich anmelden, Sicherheit zu leisten, soweit sie nicht Befriedigung verlangen können. Dieses Recht steht den Gläubigern jedoch nur zu, wenn sie glaubhaft machen, dass durch die Verschmelzung die Erfüllung der Forderung gefährdet wird."
    },
    {
      "date": "2025-08-05",
      "id": "119357",
      "original_text": "Registerbekanntmachung nach dem Umwandlungsgesetz\nNiedersachsen Amtsgericht Osnabrück HRB 100660 früher Amtsgericht Lingen (Ems)\nFelix Lethmate Beteiligungsgesellschaft mbH – Lingen",
      "type": "Registerbekanntmachung nach dem Umwandlungsgesetz",
      "state": "Niedersachsen",
      "amtsgericht": "Amtsgericht Osnabrück",
      "registernummer": "HRB 100660",
      "registerart": "HRB",
      "company_name": "Felix Lethmate Beteiligungsgesellschaft mbH",
      "company_seat": "Lingen",
      "former_amtsgericht": "Lingen (Ems)",
      "details": "05.08.2025 (Bekanntmachungsdatum)\n\nNiedersachsen Amtsgericht Osnabrück HRB 100660 früher Amtsgericht Lingen (Ems)\nRegisterbekanntmachung nach dem Umwandlungsgesetz 05.08.2025 (Eintragungsdatum)\n\nFelix Lethmate Beteiligungsgesellschaft mbH\nGesellschaft mit beschränkter Haftung\nLingen\n\nDen Gläubigern der an der Verschmelzung beteiligten Rechtsträger ist, wenn sie binnen sechs Monaten nach dem Tag, an dem die Eintragung der Verschmelzung in das Register des Sitzes desjenigen Rechtsträgers, dessen Gläubiger sie sind, nach § 19  Abs.  3 UmwG als bekannt gemacht gilt, ihren Anspruch nach Grund und Höhe schriftlich anmelden, Sicherheit zu leisten, soweit sie nicht Befriedigung verlangen können. Dieses Recht steht den Gläubigern jedoch nur zu, wenn sie glaubhaft machen, dass durch die Verschmelzung die Erfüllung der Forderung gefährdet wird."
    },
    {
      "date": "2025-08-05",
      "id": "119358",
      "original_text": "Registerbekanntmachung nach dem Umwandlungsgesetz\nNiedersachsen Amtsgericht Osnabrück HRB 220460\nNelli Dück UG (haftungsbeschränkt) – Osnabrück",
      "type": "Registerbekanntmachung nach dem Umwandlungsgesetz",
      "state": "Niedersachsen",
      "amtsgericht": "Amtsgericht Osnabrück",
      "registernummer": "HRB 220460",
      "registerart": "HRB",
      "company_name": "Nelli Dück UG (haftungsbeschränkt)",
      "company_seat": "Osnabrück",
      "details": "05.08.2025 (Bekanntmachungsdatum)\n\nNiedersachsen Amtsgericht Osnabrück HRB 220460\nRegisterbekanntmachung nach dem Umwandlungsgesetz 05.08.2025 (Eintragungsdatum)\n\nNelli Dück UG (haftungsbeschränkt)\nGesellschaft mit beschränkter Haftung\nOsnabrück\n\nDen Gläubigern der an der Verschmelzung beteiligten Rechtsträger ist, wenn sie binnen sechs Monaten nach dem Tag, an dem die Eintragung der Verschmelzung in das Register des Sitzes desjenigen Rechtsträgers, dessen Gläubiger sie sind, nach § 19  Abs.  3 UmwG als bekannt gemacht gilt, ihren Anspruch nach Grund und Höhe schriftlich anmelden, Sicherheit zu leisten, soweit sie nicht Befriedigung verlangen können. Dieses Recht steht den Gläubigern jedoch nur zu, wenn sie glaubhaft machen, dass durch die Verschmelzung die Erfüllung der Forderung gefährdet wird."
    },
    {
      "date": "2025-08-05",
      "id": "119359",
      "original_text": "Registerbekanntmachung nach dem Umwandlungsgesetz\nNiedersachsen Amtsgericht Hannover HRB 222613\nDeutsch Express Technologies GmbH – Hannover",
      "type": "Registerbekanntmachung nach dem Umwandlungsgesetz",
      "state": "Niedersachsen",
      "amtsgericht": "Amtsgericht Hannover",
      "registernummer": "HRB 222613",
      "registerart": "HRB",
      "company_name": "Deutsch Express Technologies GmbH",
      "company_seat": "Hannover",
      "details": "05.08.2025 (Bekanntmachungsdatum)\n\nNiedersachsen Amtsgericht Hannover HRB 222613\nRegisterbekanntmachung nach dem Umwandlungsgesetz 05.08.2025 (Eintragungsdatum)\n\nDeutsch Express Technologies GmbH\nGesellschaft mit beschränkter Haftung\nHannover\n\nDen Gläubigern der an der Verschmelzung beteiligten Rechtsträger ist, wenn sie binnen sechs Monaten nach dem Tag, an dem die Eintragung der Verschmelzung in das Register des Sitzes desjenigen Rechtsträgers, dessen Gläubiger sie sind, nach § 19  Abs.  3 UmwG als bekannt gemacht gilt, ihren Anspruch nach Grund und Höhe schriftlich anmelden, Sicherheit zu leisten, soweit sie nicht Befriedigung verlangen können. Dieses Recht steht den Gläubigern jedoch nur zu, wenn sie glaubhaft machen, dass durch die Verschmelzung die Erfüllung der Forderung gefährdet wird."
    },
    {
      "date": "2025-08-05",
      "id": "119360",
      "original_text": "Registerbekanntmachung nach dem Umwandlungsgesetz\nNiedersachsen Amtsgericht Tostedt HRB 207246\nC & H Industrieservice GmbH – Rosengarten",
      "type": "Registerbekanntmachung nach dem Umwandlungsgesetz",
      "state": "Niedersachsen",
      "amtsgericht": "Amtsgericht Tostedt",
      "registernummer": "HRB 207246",
      "registerart": "HRB",
      "company_name": "C & H Industrieservice GmbH",
      "company_seat": "Rosengarten",
      "details": "05.08.2025 (Bekanntmachungsdatum)\n\nNiedersachsen Amtsgericht Tostedt HRB 207246\nRegisterbekanntmachung nach dem Umwandlungsgesetz 05.08.2025 (Eintragungsdatum)\n\nC & H Industrieservice GmbH\nGesellschaft mit beschränkter Haftung\nRosengarten\n\nDen Gläubigern der an der Verschmelzung beteiligten Rechtsträger ist, wenn sie binnen sechs Monaten nach dem Tag, an dem die Eintragung der Verschmelzung in das Register des Sitzes desjenigen Rechtsträgers, dessen Gläubiger sie sind, nach § 19  Abs.  3 UmwG als bekannt gemacht gilt, ihren Anspruch nach Grund und Höhe schriftlich anmelden, Sicherheit zu leisten, soweit sie nicht Befriedigung verlangen können. Dieses Recht steht den Gläubigern jedoch nur zu, wenn sie glaubhaft machen, dass durch die Verschmelzung die Erfüllung der Forderung gefährdet wird."
    },
    {
      "date": "2025-08-05",
      "id": "119361",
      "original_text": "Registerbekanntmachung nach dem Umwandlungsgesetz\nNiedersachsen Amtsgericht Hildesheim HRB 1836\nBMV Baumaschinenvermietung Gesellschaft mit beschränkter Haftung – Diekholzen",
      "type": "Registerbekanntmachung nach dem Umwandlungsgesetz",
      "state": "Niedersachsen",
      "amtsgericht": "Amtsgericht Hildesheim",
      "registernummer": "HRB 1836",
      "registerart": "HRB",
      "company_name": "BMV Baumaschinenvermietung Gesellschaft mit beschränkter Haftung",
      "company_seat": "Diekholzen",
      "details": "05.08.2025 (Bekanntmachungsdatum)\n\nNiedersachsen Amtsgericht Hildesheim HRB 1836\nRegisterbekanntmachung nach dem Umwandlungsgesetz 05.08.2025 (Eintragungsdatum)\n\nBMV Baumaschinenvermietung Gesellschaft mit beschränkter Haftung\nGesellschaft mit beschränkter Haftung\nDiekholzen\n\nDen Gläubigern der an der Verschmelzung beteiligten Rechtsträger ist, wenn sie binnen sechs Monaten nach dem Tag, an dem die Eintragung der Verschmelzung in das Register des Sitzes desjenigen Rechtsträgers, dessen Gläubiger sie sind, nach § 19  Abs.  3 UmwG als bekannt gemacht gilt, ihren Anspruch nach Grund und Höhe schriftlich anmelden, Sicherheit zu leisten, soweit sie nicht Befriedigung verlangen können. Dieses Recht steht den Gläubigern jedoch nur zu, wenn sie glaubhaft machen, dass durch die Verschmelzung die Erfüllung der Forderung gefährdet wird."
    },
    {
      "date": "2025-08-05",
      "id": "119362",
      "original_text": "Registerbekanntmachung nach dem Umwandlungsgesetz\nNiedersachsen Amtsgericht Göttingen HRA 130814 früher Amtsgericht Northeim\nHeinrich Herbst, Holzhandlung, Sägewerk Inhaber: Klaus-Heinrich Herbst e.K. – Dassel",
      "type": "Registerbekanntmachung nach dem Umwandlungsgesetz",
      "state": "Niedersachsen",
      "amtsgericht": "Amtsgericht Göttingen",
      "registernummer": "HRA 130814",
      "registerart": "HRA",
      "company_name": "Heinrich Herbst, Holzhandlung, Sägewerk Inhaber: Klaus-Heinrich Herbst e.K.",
      "company_seat": "Dassel",
      "former_amtsgericht": "Northeim",
      "details": "05.08.2025 (Bekanntmachungsdatum)\n\nNiedersachsen Amtsgericht Göttingen HRA 130814 früher Amtsgericht Northeim\nRegisterbekanntmachung nach dem Umwandlungsgesetz 05.08.2025 (Eintragungsdatum)\n\nHeinrich Herbst, Holzhandlung, Sägewerk Inhaber: Klaus-Heinrich Herbst e.K.\nEinzelkaufmann / Einzelkauffrau\nDassel\n\nDen Gläubigern der an der Ausgliederung beteiligten Rechtsträger ist, wenn sie binnen sechs Monaten nach dem Tag, an dem die Eintragung der Ausgliederung in das Register des Sitzes desjenigen Rechtsträgers, dessen Gläubiger sie sind, nach § 19 Abs. 3 UmwG als bekannt gemacht gilt, ihren Anspruch nach Grund und Höhe schriftlich anmelden, Sicherheit zu leisten, soweit sie nicht Befriedigung verlangen können. Dieses Recht steht den Gläubigern jedoch nur zu, wenn sie glaubhaft machen, dass durch die Ausgliederung die Erfüllung der Forderung gefährdet wird."
    },
    {
      "date": "2025-08-05",
      "id": "119363",
      "original_text": "Registerbekanntmachung nach dem Umwandlungsgesetz\nNiedersachsen Amtsgericht Göttingen HRA 202340\nHeinrich Herbst Holzhandel GmbH & Co. KG – Dassel",
      "type": "Registerbekanntmachung nach dem Umwandlungsgesetz",
      "state": "Niedersachsen",
      "amtsgericht": "Amtsgericht Göttingen",
      "registernummer": "HRA 202340",
      "registerart": "HRA",
      "company_name": "Heinrich Herbst Holzhandel GmbH & Co. KG",
      "company_seat": "Dassel",
      "details": "05.08.2025 (Bekanntmachungsdatum)\n\nNiedersachsen Amtsgericht Göttingen HRA 202340\nRegisterbekanntmachung nach dem Umwandlungsgesetz 05.08.2025 (Eintragungsdatum)\n\nHeinrich Herbst Holzhandel GmbH & Co. KG\nKommanditgesellschaft\nDassel\n\nDen Gläubigern der an der Ausgliederung beteiligten Rechtsträger ist, wenn sie binnen sechs Monaten nach dem Tag, an dem die Eintragung der Ausgliederung in das Register des Sitzes desjenigen Rechtsträgers, dessen Gläubiger sie sind, nach § 19 Abs. 3 UmwG als bekannt gemacht gilt, ihren Anspruch nach Grund und Höhe schriftlich anmelden, Sicherheit zu leisten, soweit sie nicht Befriedigung verlangen können. Dieses Recht steht den Gläubigern jedoch nur zu, wenn sie glaubhaft machen, dass durch die Ausgliederung die Erfüllung der Forderung gefährdet wird."
    },
    {
      "date": "2025-08-05",
      "id": "119364",
      "original_text": "Registerbekanntmachung nach dem Umwandlungsgesetz\nNiedersachsen Amtsgericht Hildesheim HRA 202919\nSteinhäuser GmbH & Co. KG – Diekholzen",
      "type": "Registerbekanntmachung nach dem Umwandlungsgesetz",
      "state": "Niedersachsen",
      "amtsgericht": "Amtsgericht Hildesheim",
      "registernummer": "HRA 202919",
      "registerart": "HRA",
      "company_name": "Steinhäuser GmbH & Co. KG",
      "company_seat": "Diekholzen",
      "details": "05.08.2025 (Bekanntmachungsdatum)\n\nNiedersachsen Amtsgericht Hildesheim HRA 202919\nRegisterbekanntmachung nach dem Umwandlungsgesetz 05.08.2025 (Eintragungsdatum)\n\nSteinhäuser GmbH & Co. KG\nKommanditgesellschaft\nDiekholzen\n\nDen Gläubigern der an der Verschmelzung beteiligten Rechtsträger ist, wenn sie binnen sechs Monaten nach dem Tag, an dem die Eintragung der Verschmelzung in das Register des Sitzes desjenigen Rechtsträgers, dessen Gläubiger sie sind, nach § 19  Abs.  3 UmwG als bekannt gemacht gilt, ihren Anspruch nach Grund und Höhe schriftlich anmelden, Sicherheit zu leisten, soweit sie nicht Befriedigung verlangen können. Dieses Recht steht den Gläubigern jedoch nur zu, wenn sie glaubhaft machen, dass durch die Verschmelzung die Erfüllung der Forderung gefährdet wird."
    },
    {
      "date": "2025-08-05",
      "id": "119365",
      "original_text": "Registerbekanntmachung nach dem Umwandlungsgesetz\nRheinland-Pfalz Amtsgericht Landau HRB 2919\nGlobal Agrar & Wein Assekuranz GmbH – Herxheim bei Landau",
      "type": "Registerbekanntmachung nach dem Umwandlungsgesetz",
      "state": "Rheinland-Pfalz",
      "amtsgericht": "Amtsgericht Landau",
      "registernummer": "HRB 2919",
      "registerart": "HRB",
      "company_name": "Global Agrar & Wein Assekuranz GmbH",
      "company_seat": "Herxheim bei Landau",
      "details": "05.08.2025 (Bekanntmachungsdatum)\n\nRheinland-Pfalz Amtsgericht Landau HRB 2919\nRegisterbekanntmachung nach dem Umwandlungsgesetz 05.08.2025 (Eintragungsdatum)\n\nGlobal Agrar & Wein Assekuranz GmbH\nGesellschaft mit beschränkter Haftung\nHerxheim bei Landau\n\nAls nicht eingetragen wird veröffentlicht: Den Gläubigern der an der Verschmelzung beteiligten Rechtsträger ist, wenn sie binnen sechs Monaten nach dem Tag, an dem die Eintragung der Verschmelzung in das Register des Sitzes desjenigen Rechtsträgers, dessen Gläubiger sie sind, nach § 19 Abs. 3 UmwG als bekannt gemacht gilt, ihren Anspruch nach Grund und Höhe schriftlich anmelden, Sicherheit zu leisten, soweit sie nicht Befriedigung verlangen können. Dieses Recht steht den Gläubigern jedoch nur zu, wenn sie glaubhaft machen, dass durch die Verschmelzung die Erfüllung der Forderung gefährdet wird."
    },
    {
      "date": "2025-08-05",
      "id": "119366",
      "original_text": "Löschungsankündigung\nRheinland-Pfalz Amtsgericht Koblenz HRB 13556\nFUN-Spielstuben, Spielhallen und Gaststättenbetriebs GmbH – Bad Breisig",
      "type": "Löschungsankündigung",
      "state": "Rheinland-Pfalz",
      "amtsgericht": "Amtsgericht Koblenz",
      "registernummer": "HRB 13556",
      "registerart": "HRB",
      "company_name": "FUN-Spielstuben, Spielhallen und Gaststättenbetriebs GmbH",
      "company_seat": "Bad Breisig",
      "details": "05.08.2025 (Bekanntmachungsdatum)\n\nRheinland-Pfalz Amtsgericht Koblenz HRB 13556\nLöschungsankündigung\n\nFUN-Spielstuben, Spielhallen und Gaststättenbetriebs GmbH\nGesellschaft mit beschränkter Haftung\nBad Breisig\n\nDas Registergericht beabsichtigt die Gesellschaft von Amts wegen nach § 394 FamFG zu löschen. Die Frist zur Erhebung eines Widerspruchs ist auf einen Monat festgesetzt."
    },
    {
      "date": "2025-08-05",
      "id": "119367",
      "original_text": "Löschungsankündigung\nRheinland-Pfalz Amtsgericht Kaiserslautern HRB 33051\niventral 1 komma 5 UG (haftungsbeschränkt) – Kaiserslautern",
      "type": "Löschungsankündigung",
      "state": "Rheinland-Pfalz",
      "amtsgericht": "Amtsgericht Kaiserslautern",
      "registernummer": "HRB 33051",
      "registerart": "HRB",
      "company_name": "iventral 1 komma 5 UG (haftungsbeschränkt)",
      "company_seat": "Kaiserslautern",
      "details": "05.08.2025 (Bekanntmachungsdatum)\n\nRheinland-Pfalz Amtsgericht Kaiserslautern HRB 33051\nLöschungsankündigung 05.08.2025 (Eintragungsdatum)\n\niventral 1 komma 5 UG (haftungsbeschränkt)\nGesellschaft mit beschränkter Haftung\nKaiserslautern\n\nDas Registergericht beabsichtigt die vorgenannte Firma gemäß § 394 FamFG wegen Vermögenslosigkeit zu löschen. Widerspruch gegen die Löschung kann nur binnen 3 Monaten ab Veröffentlichung dieser Verfügung eingelegt werden."
    },
    {
      "date": "2025-08-05",
      "id": "119368",
      "original_text": "Registerbekanntmachung nach dem Umwandlungsgesetz\nRheinland-Pfalz Amtsgericht Kaiserslautern HRB 11362\nIMMORA Objektmanagement GmbH – Göllheim",
      "type": "Registerbekanntmachung nach dem Umwandlungsgesetz",
      "state": "Rheinland-Pfalz",
      "amtsgericht": "Amtsgericht Kaiserslautern",
      "registernummer": "HRB 11362",
      "registerart": "HRB",
      "company_name": "IMMORA Objektmanagement GmbH",
      "company_seat": "Göllheim",
      "details": "05.08.2025 (Bekanntmachungsdatum)\n\nRheinland-Pfalz Amtsgericht Kaiserslautern HRB 11362\nRegisterbekanntmachung nach dem Umwandlungsgesetz 05.08.2025 (Eintragungsdatum)\n\nIMMORA Objektmanagement GmbH\nGesellschaft mit beschränkter Haftung\nGöllheim\n\nAls nicht eingetragen wird veröffentlicht: Den Gläubigern der an der Verschmelzung beteiligten Rechtsträger ist, wenn sie binnen sechs Monaten nach dem Tag, an dem die Eintragung der Verschmelzung in das Register des Sitzes desjenigen Rechtsträgers,dessen Gläubiger sie sind, nach § 19 Abs. 3 UmwG als bekannt gemacht gilt, ihren Anspruch nach Grund und Höhe schriftlich anmelden, Sicherheit zu leisten, soweit sie nicht Befriedigung verlangen können. Dieses Recht steht den Gläubigern jedoch nur zu, wenn sie glaubhaft machen, dass durch die Verschmelzung die Erfüllung der Forderung gefährdet wird."
    },
    {
      "date": "2025-08-05",
      "id": "119369",
      "original_text": "Einreichung neuer Dokumente\nRheinland-Pfalz Amtsgericht Ludwigshafen a.Rhein (Ludwigshafen) HRB 52364\nTrinkwasserverbund Bründelsberg GmbH – Dudenhofen",
      "type": "Einreichung neuer Dokumente",
      "state": "Rheinland-Pfalz",
      "amtsgericht": "Amtsgericht Ludwigshafen a.Rhein (Ludwigshafen)",
      "registernummer": "HRB 52364",
      "registerart": "HRB",
      "company_name": "Trinkwasserverbund Bründelsberg GmbH",
      "company_seat": "Dudenhofen",
      "details": "05.08.2025 (Bekanntmachungsdatum)\n\nRheinland-Pfalz Amtsgericht Ludwigshafen a.Rhein (Ludwigshafen) HRB 52364\nEinreichung neuer Dokumente 01.08.2025 (Eintragungsdatum)\n\nTrinkwasserverbund Bründelsberg GmbH\nGesellschaft mit beschränkter Haftung\nDudenhofen\n\nDem Registergericht ist eine neue Liste der Mitglieder des Aufsichtsrates eingereicht worden."
    },
    {
      "date": "2025-08-05",
      "id": "119370",
      "original_text": "Löschungsankündigung\nRheinland-Pfalz Amtsgericht Ludwigshafen a.Rhein (Ludwigshafen) HRB 63646\nGKM Welding GmbH – Neustadt an der Weinstraße",
      "type": "Löschungsankündigung",
      "state": "Rheinland-Pfalz",
      "amtsgericht": "Amtsgericht Ludwigshafen a.Rhein (Ludwigshafen)",
      "registernummer": "HRB 63646",
      "registerart": "HRB",
      "company_name": "GKM Welding GmbH",
      "company_seat": "Neustadt an der Weinstraße",
      "details": "05.08.2025 (Bekanntmachungsdatum)\n\nRheinland-Pfalz Amtsgericht Ludwigshafen a.Rhein (Ludwigshafen) HRB 63646\nLöschungsankündigung\n\nGKM Welding GmbH\nGesellschaft mit beschränkter Haftung\nNeustadt an der Weinstraße\n\nDas Registergericht beabsichtigt die Gesellschaft von Amts wegen nach § 394 FamFG zu löschen. Die Frist zur Erhebung eines Widerspruchs ist auf einen Monat festgesetzt."
    },
    {
      "date": "2025-08-05",
      "id": "119371",
      "original_text": "Löschungsankündigung\nRheinland-Pfalz Amtsgericht Montabaur HRB 27417\nLuT-Neuwied GmbH – Neuwied",
      "type": "Löschungsankündigung",
      "state": "Rheinland-Pfalz",
      "amtsgericht": "Amtsgericht Montabaur",
      "registernummer": "HRB 27417",
      "registerart": "HRB",
      "company_name": "LuT-Neuwied GmbH",
      "company_seat": "Neuwied",
      "details": "05.08.2025 (Bekanntmachungsdatum)\n\nRheinland-Pfalz Amtsgericht Montabaur HRB 27417\nLöschungsankündigung\n\nLuT-Neuwied GmbH\nGesellschaft mit beschränkter Haftung\nNeuwied\n\nDas Registergericht beabsichtigt die Gesellschaft von Amts wegen nach § 394 FamFG zu löschen. Die Frist zur Erhebung eines Widerspruchs ist auf 1 Monat festgesetzt."
    },
    {
      "date": "2025-08-05",
      "id": "119372",
      "original_text": "Registerbekanntmachung nach dem Umwandlungsgesetz\nRheinland-Pfalz Amtsgericht Kaiserslautern HRB 11533\nPBW Planungsbüro Wengert GmbH – Dreisen",
      "type": "Registerbekanntmachung nach dem Umwandlungsgesetz",
      "state": "Rheinland-Pfalz",
      "amtsgericht": "Amtsgericht Kaiserslautern",
      "registernummer": "HRB 11533",
      "registerart": "HRB",
      "company_name": "PBW Planungsbüro Wengert GmbH",
      "company_seat": "Dreisen",
      "details": "05.08.2025 (Bekanntmachungsdatum)\n\nRheinland-Pfalz Amtsgericht Kaiserslautern HRB 11533\nRegisterbekanntmachung nach dem Umwandlungsgesetz 05.08.2025 (Eintragungsdatum)\n\nPBW Planungsbüro Wengert GmbH\nGesellschaft mit beschränkter Haftung\nDreisen\n\nAls nicht eingetragen wird veröffentlicht: Den Gläubigern der an der Verschmelzung beteiligten Rechtsträger ist, wenn sie binnen sechs Monaten nach dem Tag, an dem die Eintragung der Verschmelzung in das Register des Sitzes desjenigen Rechtsträgers,dessen Gläubiger sie sind, nach § 19 Abs. 3 UmwG als bekannt gemacht gilt, ihren Anspruch nach Grund und Höhe schriftlich anmelden, Sicherheit zu leisten, soweit sie nicht Befriedigung verlangen können. Dieses Recht steht den Gläubigern jedoch nur zu, wenn sie glaubhaft machen, dass durch die Verschmelzung die Erfüllung der Forderung gefährdet wird."
    },
    {
      "date": "2025-08-05",
      "id": "119373",
      "original_text": "Löschungsankündigung\nRheinland-Pfalz Amtsgericht Ludwigshafen a.Rhein (Ludwigshafen) HRB 68932\nEffekt Bau GmbH – Ludwigshafen am Rhein",
      "type": "Löschungsankündigung",
      "state": "Rheinland-Pfalz",
      "amtsgericht": "Amtsgericht Ludwigshafen a.Rhein (Ludwigshafen)",
      "registernummer": "HRB 68932",
      "registerart": "HRB",
      "company_name": "Effekt Bau GmbH",
      "company_seat": "Ludwigshafen am Rhein",
      "details": "05.08.2025 (Bekanntmachungsdatum)\n\nRheinland-Pfalz Amtsgericht Ludwigshafen a.Rhein (Ludwigshafen) HRB 68932\nLöschungsankündigung\n\nEffekt Bau GmbH\nGesellschaft mit beschränkter Haftung\nLudwigshafen am Rhein\n\nDas Registergericht beabsichtigt die Gesellschaft von Amts wegen nach § 394 FamFG zu löschen. Die Frist zur Erhebung eines Widerspruchs ist auf einen Monat festgesetzt."
    },
    {
      "date": "2025-08-05",
      "id": "119374",
      "original_text": "Löschungsankündigung\nBremen Amtsgericht Bremen HRB 34739\nYannik Koenen Holding GmbH – Bremerhaven",
      "type": "Löschungsankündigung",
      "state": "Bremen",
      "amtsgericht": "Amtsgericht Bremen",
      "registernummer": "HRB 34739",
      "registerart": "HRB",
      "company_name": "Yannik Koenen Holding GmbH",
      "company_seat": "Bremerhaven",
      "details": "05.08.2025 (Bekanntmachungsdatum)\n\nBremen Amtsgericht Bremen HRB 34739\nLöschungsankündigung\n\nYannik Koenen Holding GmbH\nGesellschaft mit beschränkter Haftung\nBremerhaven\n\nEs ist beabsichtigt die im Handelsregister eingetragene Gesellschaft von Amts wegen gemäß § 394 FamFG zu löschen. Gegen die Löschung kann beim AG Bremen schriftlich oder zu Protokoll der Geschäftsstelle Widerspruch eingelegt werden. Widerspruchsfrist 4 Wochen."
    },
    {
      "date": "2025-08-05",
      "id": "119375",
      "original_text": "Einreichung neuer Dokumente\nBremen Amtsgericht Bremen HRB 17148\nVerkehrsverbund Bremen/Niedersachsen GmbH (VBN) – Bremen",
      "type": "Einreichung neuer Dokumente",
      "state": "Bremen",
      "amtsgericht": "Amtsgericht Bremen",
      "registernummer": "HRB 17148",
      "registerart": "HRB",
      "company_name": "Verkehrsverbund Bremen/Niedersachsen GmbH (VBN)",
      "company_seat": "Bremen",
      "details": "05.08.2025 (Bekanntmachungsdatum)\n\nBremen Amtsgericht Bremen HRB 17148\nEinreichung neuer Dokumente\n\nVerkehrsverbund Bremen/Niedersachsen GmbH (VBN)\nGesellschaft mit beschränkter Haftung\nBremen\n\nAls nicht eingetragen wird bekannt gemacht: Liste des Aufsichtsrats wurde eingereicht."
    },
    {
      "date": "2025-08-05",
      "id": "119376",
      "original_text": "Löschungsankündigung\nBremen Amtsgericht Bremen HRB 39885\nSTAR TAXEN GmbH – Bremerhaven",
      "type": "Löschungsankündigung",
      "state": "Bremen",
      "amtsgericht": "Amtsgericht Bremen",
      "registernummer": "HRB 39885",
      "registerart": "HRB",
      "company_name": "STAR TAXEN GmbH",
      "company_seat": "Bremerhaven",
      "details": "05.08.2025 (Bekanntmachungsdatum)\n\nBremen Amtsgericht Bremen HRB 39885\nLöschungsankündigung\n\nSTAR TAXEN GmbH\nGesellschaft mit beschränkter Haftung\nBremerhaven\n\nEs ist beabsichtigt die im Handelsregister eingetragene Gesellschaft von Amts wegen gemäß § 394 FamFG zu löschen. Gegen die Löschung kann beim AG Bremen schriftlich oder zu Protokoll der Geschäftsstelle Widerspruch eingelegt werden. Widerspruchsfrist 4 Wochen."
    },
    {
      "date": "2025-08-05",
      "id": "119377",
      "original_text": "Löschungsankündigung\nNordrhein-Westfalen Amtsgericht Aachen HRB 26268\nIn Zeit Logistic GmbH – Aachen",
      "type": "Löschungsankündigung",
      "state": "Nordrhein-Westfalen",
      "amtsgericht": "Amtsgericht Aachen",
      "registernummer": "HRB 26268",
      "registerart": "HRB",
      "company_name": "In Zeit Logistic GmbH",
      "company_seat": "Aachen",
      "details": "05.08.2025 (Bekanntmachungsdatum)\n\nNordrhein-Westfalen Amtsgericht Aachen HRB 26268\nLöschungsankündigung\n\nIn Zeit Logistic GmbH\nGesellschaft mit beschränkter Haftung\nAachen\n\nDas Registergericht beabsichtigt, von Amts wegen die Gesellschaft wegen Vermögenslosigkeit nach § 394 FamFG zu löschen, weil das Insolvenzverfahren Amtsgericht Aachen (Az.: 91 IN 156/24 ) beendet und Vermögen der Gesellschaft nicht mehr erkennbar ist.\n\nZur Geltendmachung des Widerspruchs gegen die beabsichtigte Löschung wird hiermit eine Frist von einem Monat ab Veröffentlichung dieser Ankündigung bestimmt.\n\nRechtsbehelfsbelehrung:\n\nGegen diese Verfügung kann Widerspruch eingelegt werden. Zum Widerspruch ist jeder berechtigt, der an der Unterlassung der Löschung ein berechtigtes Interesse hat.\n\nDer Widerspruch ist bei dem Amtsgericht Aachen, Adalbertsteinweg 92, 52070 Aachen schriftlich in deutscher Sprache oder zur Niederschrift der Geschäftsstelle einzulegen. Der Widerspruch kann auch zur Niederschrift der Geschäftsstelle eines jeden Amtsgerichtes abgegeben werden.\n\nDer Widerspruch muss spätestens innerhalb der gesetzten Frist nach der Bekanntgabe der Verfügung bei dem Amtsgericht Aachen eingegangen sein. Dies gilt auch dann, wenn der Widerspruch zur Niederschrift der Geschäftsstelle eines anderen Amtsgerichtes abgegeben wurde. Die Frist beginnt mit der Bekanntgabe der Verfügung durch Veröffentlichung. Fällt das Ende der Frist auf einen Sonntag, einen allgemeinen Feiertag oder Sonnabend, so endet die Frist mit Ablauf des nächsten Werktages.\n\nDer Widerspruch muss die Bezeichnung der angefochtenen Verfügung sowie die Erklärung enthalten, dass Widerspruch gegen diese Verfügung eingelegt wird. Er ist zu unterzeichnen und soll begründet werden.\n\nDie Einlegung ist auch durch Übertragung eines elektronischen Dokuments an die elektronische Poststelle des Gerichts möglich. Das elektronische Dokument muss für die Bearbeitung durch das Gericht geeignet und mit einer qualifizierten elektronischen Signatur der verantwortenden Person versehen sein oder von der verantwortenden Person signiert und auf einem sicheren Übermittlungsweg gemäß § 130 a ZPO nach näherer Maßgabe der Verordnung über die technischen Rahmenbedingungen des elektronischen Rechtsverkehrs und über das besondere elektronische Behördenpostfach (BGBl. I, S. 3803) eingereicht werden. Weitere Informationen erhalten Sie auf der Internetseite www.justiz.de."
    },
    {
      "date": "2025-08-05",
      "id": "119378",
      "original_text": "Registerbekanntmachung nach dem Umwandlungsgesetz\nNordrhein-Westfalen Amtsgericht Düsseldorf HRB 61123\nUniper Global Commodities SE – Düsseldorf",
      "type": "Registerbekanntmachung nach dem Umwandlungsgesetz",
      "state": "Nordrhein-Westfalen",
      "amtsgericht": "Amtsgericht Düsseldorf",
      "registernummer": "HRB 61123",
      "registerart": "HRB",
      "company_name": "Uniper Global Commodities SE",
      "company_seat": "Düsseldorf",
      "details": "05.08.2025 (Bekanntmachungsdatum)\n\nNordrhein-Westfalen Amtsgericht Düsseldorf HRB 61123\nRegisterbekanntmachung nach dem Umwandlungsgesetz\n\nUniper Global Commodities SE\nEuropäische Aktiengesellschaft (SE)\nDüsseldorf\n\nDem Registergericht ist der Entwurf eines Vertrages über die geplante Verschmelzung der Uniper Ruhrgas GmbH mit Sitz in Essen mit der Uniper Global Commodities SE mit Sitz in Düsseldorf eingereicht worden."
    },
    {
      "date": "2025-08-05",
      "id": "119379",
      "original_text": "Registerbekanntmachung nach dem Umwandlungsgesetz\nNordrhein-Westfalen Amtsgericht Düsseldorf HRB 86638\nSana Prime GmbH – Düsseldorf",
      "type": "Registerbekanntmachung nach dem Umwandlungsgesetz",
      "state": "Nordrhein-Westfalen",
      "amtsgericht": "Amtsgericht Düsseldorf",
      "registernummer": "HRB 86638",
      "registerart": "HRB",
      "company_name": "Sana Prime GmbH",
      "company_seat": "Düsseldorf",
      "details": "05.08.2025 (Bekanntmachungsdatum)\n\nNordrhein-Westfalen Amtsgericht Düsseldorf HRB 86638\nRegisterbekanntmachung nach dem Umwandlungsgesetz 05.08.2025 (Eintragungsdatum)\n\nSana Prime GmbH\nGesellschaft mit beschränkter Haftung\nDüsseldorf\n\nDen Gläubigern der an der Verschmelzung beteiligten Rechtsträger ist, wenn sie binnen sechs Monaten nach dem Tag, an dem die Eintragung der Verschmelzung in das Register des Sitzes desjenigen Rechtsträgers, dessen Gläubiger sie sind, nach § 19 Absatz 3 UmwG als bekanntgemacht gilt, ihren Anspruch nach Grund und Höhe schriftlich anmelden, Sicherheit zu leisten, soweit sie nicht Befriedigung verlangen können. Dieses Recht steht den Gläubigern jedoch nur zu, wenn sie glaubhaft machen, dass durch die Verschmelzung die Erfüllung ihrer Forderung gefährdet wird."
    },
    {
      "date": "2025-08-05",
      "id": "119380",
      "original_text": "Löschungsankündigung\nNordrhein-Westfalen Amtsgericht Wuppertal HRA 21136\nBender Immobilien GmbH & Co. KG – Velbert",
      "type": "Löschungsankündigung",
      "state": "Nordrhein-Westfalen",
      "amtsgericht": "Amtsgericht Wuppertal",
      "registernummer": "HRA 21136",
      "registerart": "HRA",
      "company_name": "Bender Immobilien GmbH & Co. KG",
      "company_seat": "Velbert",
      "details": "05.08.2025 (Bekanntmachungsdatum)\n\nNordrhein-Westfalen Amtsgericht Wuppertal HRA 21136\nLöschungsankündigung 05.08.2025 (Eintragungsdatum)\n\nBender Immobilien GmbH & Co. KG\nKommanditgesellschaft\nVelbert\n\nDas Registergericht beabsichtigt die Firma von Amts wegen nach § 393 FamFG zu löschen. Die Frist zur Erhebung eines Widerspruchs ist auf drei Monate festgesetzt."
    },
    {
      "date": "2025-08-05",
      "id": "119381",
      "original_text": "Einreichung neuer Dokumente\nNordrhein-Westfalen Amtsgericht Essen HRB 13131\nEntsorgungsbetriebe Essen GmbH – Essen",
      "type": "Einreichung neuer Dokumente",
      "state": "Nordrhein-Westfalen",
      "amtsgericht": "Amtsgericht Essen",
      "registernummer": "HRB 13131",
      "registerart": "HRB",
      "company_name": "Entsorgungsbetriebe Essen GmbH",
      "company_seat": "Essen",
      "details": "05.08.2025 (Bekanntmachungsdatum)\n\nNordrhein-Westfalen Amtsgericht Essen HRB 13131\nEinreichung neuer Dokumente 05.08.2025 (Eintragungsdatum)\n\nEntsorgungsbetriebe Essen GmbH\nGesellschaft mit beschränkter Haftung\nEssen\n\nDem Registergericht ist eine neue Liste der Mitglieder des Aufsichtsrates eingereicht worden."
    },
    {
      "date": "2025-08-05",
      "id": "119382",
      "original_text": "Registerbekanntmachung nach dem Umwandlungsgesetz\nNordrhein-Westfalen Amtsgericht Essen HRB 25021\nHOCHTIEF Infrastructure GmbH – Essen",
      "type": "Registerbekanntmachung nach dem Umwandlungsgesetz",
      "state": "Nordrhein-Westfalen",
      "amtsgericht": "Amtsgericht Essen",
      "registernummer": "HRB 25021",
      "registerart": "HRB",
      "company_name": "HOCHTIEF Infrastructure GmbH",
      "company_seat": "Essen",
      "details": "05.08.2025 (Bekanntmachungsdatum)\n\nNordrhein-Westfalen Amtsgericht Essen HRB 25021\nRegisterbekanntmachung nach dem Umwandlungsgesetz 05.08.2025 (Eintragungsdatum)\n\nHOCHTIEF Infrastructure GmbH\nGesellschaft mit beschränkter Haftung\nEssen\n\nDen Gläubigern der an der Verschmelzung beteiligten Rechtsträger ist, wenn sie binnen sechs Monaten nach dem Tag, an dem die Eintragung der Verschmelzung in das Register des Sitzes derjenigen Rechtsträger deren Gläubiger sie sind, nach § 19 Absatz 3 UmwG als bekanntgemacht gilt, ihren Anspruch nach Grund und Höhe schriftlich anmelden, Sicherheit zu leisten, soweit sie nicht Befriedigung verlangen können. Dieses Recht steht den Gläubigern jedoch nur zu, wenn sie glaubhaft machen, dass durch die Verschmelzung die Erfüllung ihrer Forderung gefährdet wird."
    },
    {
      "date": "2025-08-05",
      "id": "119383",
      "original_text": "Einreichung neuer Dokumente\nNordrhein-Westfalen Amtsgericht Gütersloh HRB 11088\nHIRSCH Porozell GmbH – Rheda-Wiedenbrück",
      "type": "Einreichung neuer Dokumente",
      "state": "Nordrhein-Westfalen",
      "amtsgericht": "Amtsgericht Gütersloh",
      "registernummer": "HRB 11088",
      "registerart": "HRB",
      "company_name": "HIRSCH Porozell GmbH",
      "company_seat": "Rheda-Wiedenbrück",
      "details": "05.08.2025 (Bekanntmachungsdatum)\n\nNordrhein-Westfalen Amtsgericht Gütersloh HRB 11088\nEinreichung neuer Dokumente\n\nHIRSCH Porozell GmbH\nGesellschaft mit beschränkter Haftung\nRheda-Wiedenbrück\n\nDem Registergericht ist eine neue Liste der Mitglieder des Aufsichtsrates eingereicht worden."
    },
    {
      "date": "2025-08-05",
      "id": "119384",
      "original_text": "Registerbekanntmachung nach dem Umwandlungsgesetz\nNordrhein-Westfalen Amtsgericht Hamm HRB 10960\nMK Spielhallenbetriebs GmbH – Hamm",
      "type": "Registerbekanntmachung nach dem Umwandlungsgesetz",
      "state": "Nordrhein-Westfalen",
      "amtsgericht": "Amtsgericht Hamm",
      "registernummer": "HRB 10960",
      "registerart": "HRB",
      "company_name": "MK Spielhallenbetriebs GmbH",
      "company_seat": "Hamm",
      "details": "05.08.2025 (Bekanntmachungsdatum)\n\nNordrhein-Westfalen Amtsgericht Hamm HRB 10960\nRegisterbekanntmachung nach dem Umwandlungsgesetz 05.08.2025 (Eintragungsdatum)\n\nMK Spielhallenbetriebs GmbH\nGesellschaft mit beschränkter Haftung\nHamm\n\nDie Gesellschaft hat Gläubigern, deren Forderungen vor dieser Bekanntmachung begründet worden sind, Sicherheit zu leisten, soweit sie nicht Befriedigung verlangen können, wenn sie sich binnen sechs Monaten zu diesem Zweck melden.Den Gläubigern der an der Verschmelzung beteiligten Rechtsträger ist, wenn sie binnen sechs Monaten nach dem Tag, an dem die Eintragung der Verschmelzung in das Register des Sitzes desjenigen Rechtsträgers, dessen Gläubiger sie sind, nach § 19 Absatz 3 UmwG als bekanntgemacht gilt, ihren Anspruch nach Grund und Höhe schriftlich anmelden, Sicherheit zu leisten, soweit sie nicht Befriedigung verlangen können. Dieses Recht steht den Gläubigern jedoch nur zu, wenn sie glaubhaft machen, dass durch die Verschmelzung die Erfüllung ihrer Forderung gefährdet wird."
    },
    {
      "date": "2025-08-05",
      "id": "119385",
      "original_text": "Löschungsankündigung\nNordrhein-Westfalen Amtsgericht Gelsenkirchen HRB 16597\nProsopiko GmbH – Gelsenkirchen",
      "type": "Löschungsankündigung",
      "state": "Nordrhein-Westfalen",
      "amtsgericht": "Amtsgericht Gelsenkirchen",
      "registernummer": "HRB 16597",
      "registerart": "HRB",
      "company_name": "Prosopiko GmbH",
      "company_seat": "Gelsenkirchen",
      "details": "05.08.2025 (Bekanntmachungsdatum)\n\nNordrhein-Westfalen Amtsgericht Gelsenkirchen HRB 16597\nLöschungsankündigung\n\nProsopiko GmbH\nGesellschaft mit beschränkter Haftung\nGelsenkirchen\n\nDas Gericht beabsichtigt, die Gesellschaft Prosopiko GmbH mit Sitz in Gelsenkirchen, HRB 16597 Amtsgericht Gelsenkirchen, wegen Vermögenslosigkeit zu löschen.\n\nHiermit wird denjenigen, die an der Unterlassung der Löschung ein berechtigtes Interesse haben, gem. § 394 Abs. 2 FamFG Gelegenheit gegeben, gegen dieses Vorhaben binnen eines Monats nach dieser Bekanntmachung Widerspruch einzulegen. Der Widerspruch kann schriftlich oder zu Protokoll der Geschäftsstelle erhoben werden."
    },
    {
      "date": "2025-08-05",
      "id": "119386",
      "original_text": "Registerbekanntmachung nach dem Umwandlungsgesetz\nNordrhein-Westfalen Amtsgericht Aachen HRB 18178\nKempen Krause Ingenieure GmbH – Aachen",
      "type": "Registerbekanntmachung nach dem Umwandlungsgesetz",
      "state": "Nordrhein-Westfalen",
      "amtsgericht": "Amtsgericht Aachen",
      "registernummer": "HRB 18178",
      "registerart": "HRB",
      "company_name": "Kempen Krause Ingenieure GmbH",
      "company_seat": "Aachen",
      "details": "05.08.2025 (Bekanntmachungsdatum)\n\nNordrhein-Westfalen Amtsgericht Aachen HRB 18178\nRegisterbekanntmachung nach dem Umwandlungsgesetz 05.08.2025 (Eintragungsdatum)\n\nKempen Krause Ingenieure GmbH\nGesellschaft mit beschränkter Haftung\nAachen\n\nDen Gläubigern der an der #DV.UmF(Text=\"Bitte wählen Sie die zutreffende Art nach UmwG aus!\",Eingabe=\"Verschmelzung\",\"Aufspaltung\",\"Abspaltung\",\"Ausgliederung\",\"Vermögensübertragung\",\"formwechselnden Umwandlung\") beteiligten Rechtsträger ist, wenn sie binnen sechs Monaten nach dem Tag, an dem die Eintragung der #DV.UmF in das Register des Sitzes #DV.RTr(Text=\"Bitte wählen Sie aus, ob ein oder mehrere andere Rechtsträger betroffen sind!\",Eingabe=\"desjenigen Rechtsträgers, dessen Gläubiger\",\"derjenigen Rechtsträger deren Gläubiger\") sie sind, nach § 19 Absatz 3 UmwG als bekanntgemacht gilt, ihren Anspruch nach Grund und Höhe schriftlich anmelden, Sicherheit zu leisten, soweit sie nicht Befriedigung verlangen können. Dieses Recht steht den Gläubigern jedoch nur zu, wenn sie glaubhaft machen, dass durch die #DV.UmF die Erfüllung ihrer Forderung gefährdet wird."
    },
    {
      "date": "2025-08-05",
      "id": "119387",
      "original_text": "Registerbekanntmachung nach dem Umwandlungsgesetz\nNordrhein-Westfalen Amtsgericht Recklinghausen HRA 5024\nForstunternehmen Heinrich Breddemann e. K. – Waltrop",
      "type": "Registerbekanntmachung nach dem Umwandlungsgesetz",
      "state": "Nordrhein-Westfalen",
      "amtsgericht": "Amtsgericht Recklinghausen",
      "registernummer": "HRA 5024",
      "registerart": "HRA",
      "company_name": "Forstunternehmen Heinrich Breddemann e. K.",
      "company_seat": "Waltrop",
      "details": "05.08.2025 (Bekanntmachungsdatum)\n\nNordrhein-Westfalen Amtsgericht Recklinghausen HRA 5024\nRegisterbekanntmachung nach dem Umwandlungsgesetz 05.08.2025 (Eintragungsdatum)\n\nForstunternehmen Heinrich Breddemann e. K.\nEinzelkaufmann / Einzelkauffrau\nWaltrop\n\nDen Gläubigern der an der Ausgliederung beteiligten Rechtsträger ist, wenn sie binnen sechs Monaten nach dem Tag, an dem die Eintragung der Ausgliederung in das Register des Sitzes desjenigen Rechtsträgers, dessen Gläubiger sie sind, nach § 19 Absatz 3 UmwG als bekanntgemacht gilt, ihren Anspruch nach Grund und Höhe schriftlich anmelden, Sicherheit zu leisten, soweit sie nicht Befriedigung verlangen können. Dieses Recht steht den Gläubigern jedoch nur zu, wenn sie glaubhaft machen, dass durch die Ausgliederung die Erfüllung ihrer Forderung gefährdet wird."
    },
    {
      "date": "2025-08-05",
      "id": "119388",
      "original_text": "Löschungsankündigung\nNordrhein-Westfalen Amtsgericht Düsseldorf HRB 80874\nJB Ventures und Beratungs-GmbH – Düsseldorf",
      "type": "Löschungsankündigung",
      "state": "Nordrhein-Westfalen",
      "amtsgericht": "Amtsgericht Düsseldorf",
      "registernummer": "HRB 80874",
      "registerart": "HRB",
      "company_name": "JB Ventures und Beratungs-GmbH",
      "company_seat": "Düsseldorf",
      "details": "05.08.2025 (Bekanntmachungsdatum)\n\nNordrhein-Westfalen Amtsgericht Düsseldorf HRB 80874\nLöschungsankündigung\n\nJB Ventures und Beratungs-GmbH\nGesellschaft mit beschränkter Haftung\nDüsseldorf\n\nDas Registergericht beabsichtigt die Gesellschaft von Amts wegen nach § 394 FamFG zu löschen. Die Frist zur Erhebung eines Widerspruchs ist auf 3 Wochen festgesetzt.\n\nRechtsbehelfsbelehrung:\nDas Widerspruchsrecht steht jedem zu, der an der Unterlassung der Löschung ein berechtigtes Interesse hat. Der Widerspruch ist bei dem Amtsgericht Düsseldorf -Registergericht-, Werdener Straße 1, 40227 Düsseldorf schriftlich in deutscher Sprache oder zur Niederschrift der Geschäftsstelle einzulegen. Der Widerspruch kann auch zur Niederschrift der Geschäftsstelle eines jeden Amtsgerichtes abgegeben werden. Die Einlegung ist auch durch Übertragung eines elektronischen Dokuments an die elektronische Poststelle des Gerichts möglich. Das elektronische Dokument muss für die Bearbeitung durch das Gericht geeignet und mit einer qualifizierten elektronischen Signatur der verantwortenden Person versehen sein oder von der verantwortenden Person signiert und auf einem sicheren Übermittlungsweg gemäß § 130a ZPO nach näherer Maßgabe der Verordnung über die technischen Rahmenbedingungen des elektronischen Rechtsverkehrs und über das besondere elektronische Behördenpostfach (BGBl. I, S.3803) eingereicht werden. Weitere Informationen erhalten Sie auf der Internetseite www.justiz.de.\nDer Widerspruch muss spätestens innerhalb der gesetzten Frist nach dem Datum der Bekanntmachung der Löschungsankündigung bei dem Amtsgericht - Registergericht - Düsseldorf eingegangen sein.  Dies gilt auch dann, wenn der Widerspruch zur Niederschrift der Geschäftsstelle eines anderen Amtsgerichtes abgegeben wurde. Die Frist beginnt mit dem Tage der Bekanntmachung der Löschungsankündigung in dem für die Bekanntmachung der Eintragungen in das Handelsregister bestimmten elektronischen Informations- und Kommunikationssystem nach § 10 des Handelsgesetzbuches. Fällt das Ende der Frist auf einen Sonntag, einen allgemeinen Feiertag oder Sonnabend, so endet die Frist mit Ablauf des nächsten Werktages.\nDer Widerspruch muss die Bezeichnung der angefochtenen Löschungsankündigung sowie die Erklärung enthalten, dass Widerspruch gegen diese Löschungsankündigung eingelegt wird. Er ist zu unterzeichnen und soll begründet werden."
    },
    {
      "date": "2025-08-05",
      "id": "119389",
      "original_text": "Registerbekanntmachung nach dem Umwandlungsgesetz\nNordrhein-Westfalen Amtsgericht Düsseldorf HRB 56195\nMaxworker Verwaltungs GmbH – Düsseldorf",
      "type": "Registerbekanntmachung nach dem Umwandlungsgesetz",
      "state": "Nordrhein-Westfalen",
      "amtsgericht": "Amtsgericht Düsseldorf",
      "registernummer": "HRB 56195",
      "registerart": "HRB",
      "company_name": "Maxworker Verwaltungs GmbH",
      "company_seat": "Düsseldorf",
      "details": "05.08.2025 (Bekanntmachungsdatum)\n\nNordrhein-Westfalen Amtsgericht Düsseldorf HRB 56195\nRegisterbekanntmachung nach dem Umwandlungsgesetz 05.08.2025 (Eintragungsdatum)\n\nMaxworker Verwaltungs GmbH\nGesellschaft mit beschränkter Haftung\nDüsseldorf\n\nDen Gläubigern der an der Verschmelzung beteiligten Rechtsträger ist, wenn sie binnen sechs Monaten nach dem Tag, an dem die Eintragung der Verschmelzung in das Register des Sitzes desjenigen Rechtsträgers, dessen Gläubiger sie sind, nach § 19 Absatz 3 UmwG als bekanntgemacht gilt, ihren Anspruch nach Grund und Höhe schriftlich anmelden, Sicherheit zu leisten, soweit sie nicht Befriedigung verlangen können. Dieses Recht steht den Gläubigern jedoch nur zu, wenn sie glaubhaft machen, dass durch die Verschmelzung die Erfüllung ihrer Forderung gefährdet wird."
    },
    {
      "date": "2025-08-05",
      "id": "119390",
      "original_text": "Löschungsankündigung\nNordrhein-Westfalen Amtsgericht Duisburg HRA 8046\nConcordia Bau und Boden AG & Co. 5. Immobilien-Fonds-Gesellschaft KG – Oberhausen",
      "type": "Löschungsankündigung",
      "state": "Nordrhein-Westfalen",
      "amtsgericht": "Amtsgericht Duisburg",
      "registernummer": "HRA 8046",
      "registerart": "HRA",
      "company_name": "Concordia Bau und Boden AG & Co. 5. Immobilien-Fonds-Gesellschaft KG",
      "company_seat": "Oberhausen",
      "details": "05.08.2025 (Bekanntmachungsdatum)\n\nNordrhein-Westfalen Amtsgericht Duisburg HRA 8046\nLöschungsankündigung\n\nConcordia Bau und Boden AG & Co. 5. Immobilien-Fonds-Gesellschaft KG\nKommanditgesellschaft\nOberhausen\n\nAmtsgericht Duisburg\nHRA 8046\nConcordia Bau und Boden AG & Co. 5. Immobilien-Fonds-Gesellschaft KG\n\ndie bei dem Amtsgericht Duisburg unter eingetragene Firma soll von Amts wegen gemäß §§ 31 Absatz 2, 6 HGB, § 393 FamFG gelöscht werden.\n\nHiergegen ist der Widerspruch binnen drei Monaten seit Zustellung zulässig. Geht innerhalb dieser Frist kein Widerspruch ein, wird die Firma gelöscht werden.\n\nRechtsbehelfsbelehrung\n\nDer Widerspruch ist bei dem Amtsgericht Duisburg, Registergericht, Kardinal-Galen-Straße 124-132, 47058 Duisburg, schriftlich einzulegen. Der Widerspruch kann auch zur Niederschrift der Geschäftsstelle eines jeden Amtsgerichts abgegeben werden.\nDie Einlegung ist auch durch Übertragung eines elektronischen Dokuments an die elektronische Poststelle des Gerichts möglich. Das elektronische Dokument muss für die Bearbeitung durch das Gericht geeignet und mit einer qualifizierten elektronischen Signatur der verantwortenden Person versehen sein oder von der verantwortenden Person signiert und auf einem sicheren Übermittlungsweg gemäß § 130 a ZPO nach näherer Maßgabe der Verordnung über die technischen Rahmenbedingungen des elektronischen Rechtsverkehrs und über das besondere elektronische Behördenpostfach (BGBl. I, S. 3803) eingereicht werden. Weitere Informationen erhalten Sie auf der Internetseite www.justiz.de.\n\nDer Widerspruch muss spätestens innerhalb der gesetzten Frist, beginnend mit der Zustellung dieser Verfügung, bei dem Amtsgericht Duisburg, Registergericht, eingegangen sein. Dies gilt auch dann, wenn der Widerspruch zur Niederschrift der Geschäftsstelle eines anderen Amtsgerichtes abgegeben wurde. Fällt das Ende der Frist auf einen Sonntag, einen allgemeinen Feiertag oder einen Sonnabend, so endet die Frist mit Ablauf des nächsten Werktages.\n\nDer Widerspruch muss die Bezeichnung der angefochtenen Verfügung sowie die Erklärung enthalten, dass Widerspruch gegen diese Verfügung eingelegt wird. Er ist zu unterzeichnen und soll begründet werden."
    },
    {
      "date": "2025-08-05",
      "id": "119391",
      "original_text": "Registerbekanntmachung nach dem Umwandlungsgesetz\nNordrhein-Westfalen Amtsgericht Köln HRB 15656\nKepheus Beteiligungs- und Vermögenswerte GmbH – Köln",
      "type": "Registerbekanntmachung nach dem Umwandlungsgesetz",
      "state": "Nordrhein-Westfalen",
      "amtsgericht": "Amtsgericht Köln",
      "registernummer": "HRB 15656",
      "registerart": "HRB",
      "company_name": "Kepheus Beteiligungs- und Vermögenswerte GmbH",
      "company_seat": "Köln",
      "details": "05.08.2025 (Bekanntmachungsdatum)\n\nNordrhein-Westfalen Amtsgericht Köln HRB 15656\nRegisterbekanntmachung nach dem Umwandlungsgesetz 05.08.2025 (Eintragungsdatum)\n\nKepheus Beteiligungs- und Vermögenswerte GmbH\nGesellschaft mit beschränkter Haftung\nKöln\n\nDen Gläubigern der an der Verschmelzung beteiligten Rechtsträger ist, wenn sie binnen sechs Monaten nach dem Tag, an dem die Eintragung der Verschmelzung in das Register des Sitzes desjenigen Rechtsträgers, dessen Gläubiger sie sind, nach § 19 Absatz 3 UmwG als bekanntgemacht gilt, ihren Anspruch nach Grund und Höhe schriftlich anmelden, Sicherheit zu leisten, soweit sie nicht Befriedigung verlangen können. Dieses Recht steht den Gläubigern jedoch nur zu, wenn sie glaubhaft machen, dass durch die Verschmelzung die Erfüllung ihrer Forderung gefährdet wird."
    },
    {
      "date": "2025-08-05",
      "id": "119392",
      "original_text": "Registerbekanntmachung nach dem Umwandlungsgesetz\nNordrhein-Westfalen Amtsgericht Essen HRB 21988\nBITMARCK Vertriebs- und Projekt GmbH – Essen",
      "type": "Registerbekanntmachung nach dem Umwandlungsgesetz",
      "state": "Nordrhein-Westfalen",
      "amtsgericht": "Amtsgericht Essen",
      "registernummer": "HRB 21988",
      "registerart": "HRB",
      "company_name": "BITMARCK Vertriebs- und Projekt GmbH",
      "company_seat": "Essen",
      "details": "05.08.2025 (Bekanntmachungsdatum)\n\nNordrhein-Westfalen Amtsgericht Essen HRB 21988\nRegisterbekanntmachung nach dem Umwandlungsgesetz 05.08.2025 (Eintragungsdatum)\n\nBITMARCK Vertriebs- und Projekt GmbH\nGesellschaft mit beschränkter Haftung\nEssen\n\nDen Gläubigern der an der Verschmelzung beteiligten Rechtsträger ist, wenn sie binnen sechs Monaten nach dem Tag, an dem die Eintragung der Verschmelzung in das Register des Sitzes desjenigen Rechtsträgers, dessen Gläubiger sie sind, nach § 19 Absatz 3 UmwG als bekanntgemacht gilt, ihren Anspruch nach Grund und Höhe schriftlich anmelden, Sicherheit zu leisten, soweit sie nicht Befriedigung verlangen können. Dieses Recht steht den Gläubigern jedoch nur zu, wenn sie glaubhaft machen, dass durch die Verschmelzung die Erfüllung ihrer Forderung gefährdet wird."
    },
    {
      "date": "2025-08-05",
      "id": "119393",
      "original_text": "Registerbekanntmachung nach dem Umwandlungsgesetz\nNordrhein-Westfalen Amtsgericht Gelsenkirchen HRB 11183\nGfI - Verwaltungs UG (haftungsbeschränkt) – Gelsenkirchen",
      "type": "Registerbekanntmachung nach dem Umwandlungsgesetz",
      "state": "Nordrhein-Westfalen",
      "amtsgericht": "Amtsgericht Gelsenkirchen",
      "registernummer": "HRB 11183",
      "registerart": "HRB",
      "company_name": "GfI - Verwaltungs UG (haftungsbeschränkt)",
      "company_seat": "Gelsenkirchen",
      "details": "05.08.2025 (Bekanntmachungsdatum)\n\nNordrhein-Westfalen Amtsgericht Gelsenkirchen HRB 11183\nRegisterbekanntmachung nach dem Umwandlungsgesetz 05.08.2025 (Eintragungsdatum)\n\nGfI - Verwaltungs UG (haftungsbeschränkt)\nGesellschaft mit beschränkter Haftung\nGelsenkirchen\n\nDen Gläubigern der an der Verschmelzung beteiligten Rechtsträger ist, wenn sie binnen sechs Monaten nach dem Tag, an dem die Eintragung der Verschmelzung in das Register des Sitzes desjenigen Rechtsträgers, dessen Gläubiger sie sind, nach § 19 Absatz 3 UmwG als bekanntgemacht gilt, ihren Anspruch nach Grund und Höhe schriftlich anmelden, Sicherheit zu leisten, soweit sie nicht Befriedigung verlangen können. Dieses Recht steht den Gläubigern jedoch nur zu, wenn sie glaubhaft machen, dass durch die Verschmelzung die Erfüllung ihrer Forderung gefährdet wird."
    },
    {
      "date": "2025-08-05",
      "id": "119394",
      "original_text": "Löschungsankündigung\nNordrhein-Westfalen Amtsgericht Düsseldorf HRB 74549\nNOVUS Management GmbH – Langenfeld",
      "type": "Löschungsankündigung",
      "state": "Nordrhein-Westfalen",
      "amtsgericht": "Amtsgericht Düsseldorf",
      "registernummer": "HRB 74549",
      "registerart": "HRB",
      "company_name": "NOVUS Management GmbH",
      "company_seat": "Langenfeld",
      "details": "05.08.2025 (Bekanntmachungsdatum)\n\nNordrhein-Westfalen Amtsgericht Düsseldorf HRB 74549\nLöschungsankündigung\n\nNOVUS Management GmbH\nGesellschaft mit beschränkter Haftung\nLangenfeld\n\nDas Registergericht beabsichtigt die Gesellschaft von Amts wegen nach § 394 FamFG zu löschen. Die Frist zur Erhebung eines Widerspruchs ist auf 3 Wochen festgesetzt.\n\nRechtsbehelfsbelehrung:\nDas Widerspruchsrecht steht jedem zu, der an der Unterlassung der Löschung ein berechtigtes Interesse hat. Der Widerspruch ist bei dem Amtsgericht Düsseldorf -Registergericht-, Werdener Straße 1, 40227 Düsseldorf schriftlich in deutscher Sprache oder zur Niederschrift der Geschäftsstelle einzulegen. Der Widerspruch kann auch zur Niederschrift der Geschäftsstelle eines jeden Amtsgerichtes abgegeben werden. Die Einlegung ist auch durch Übertragung eines elektronischen Dokuments an die elektronische Poststelle des Gerichts möglich. Das elektronische Dokument muss für die Bearbeitung durch das Gericht geeignet und mit einer qualifizierten elektronischen Signatur der verantwortenden Person versehen sein oder von der verantwortenden Person signiert und auf einem sicheren Übermittlungsweg gemäß § 130a ZPO nach näherer Maßgabe der Verordnung über die technischen Rahmenbedingungen des elektronischen Rechtsverkehrs und über das besondere elektronische Behördenpostfach (BGBl. I, S.3803) eingereicht werden. Weitere Informationen erhalten Sie auf der Internetseite www.justiz.de.\nDer Widerspruch muss spätestens innerhalb der gesetzten Frist nach dem Datum der Bekanntmachung der Löschungsankündigung bei dem Amtsgericht - Registergericht - Düsseldorf eingegangen sein.  Dies gilt auch dann, wenn der Widerspruch zur Niederschrift der Geschäftsstelle eines anderen Amtsgerichtes abgegeben wurde. Die Frist beginnt mit dem Tage der Bekanntmachung der Löschungsankündigung in dem für die Bekanntmachung der Eintragungen in das Handelsregister bestimmten elektronischen Informations- und Kommunikationssystem nach § 10 des Handelsgesetzbuches. Fällt das Ende der Frist auf einen Sonntag, einen allgemeinen Feiertag oder Sonnabend, so endet die Frist mit Ablauf des nächsten Werktages.\nDer Widerspruch muss die Bezeichnung der angefochtenen Löschungsankündigung sowie die Erklärung enthalten, dass Widerspruch gegen diese Löschungsankündigung eingelegt wird. Er ist zu unterzeichnen und soll begründet werden."
    },
    {
      "date": "2025-08-05",
      "id": "119395",
      "original_text": "Registerbekanntmachung nach dem Umwandlungsgesetz\nNordrhein-Westfalen Amtsgericht Münster HRB 8976\nVBT Vermögens- Verwaltungs- und Beteiligungsgesellschaft mbH – Münster",
      "type": "Registerbekanntmachung nach dem Umwandlungsgesetz",
      "state": "Nordrhein-Westfalen",
      "amtsgericht": "Amtsgericht Münster",
      "registernummer": "HRB 8976",
      "registerart": "HRB",
      "company_name": "VBT Vermögens- Verwaltungs- und Beteiligungsgesellschaft mbH",
      "company_seat": "Münster",
      "details": "05.08.2025 (Bekanntmachungsdatum)\n\nNordrhein-Westfalen Amtsgericht Münster HRB 8976\nRegisterbekanntmachung nach dem Umwandlungsgesetz 05.08.2025 (Eintragungsdatum)\n\nVBT Vermögens- Verwaltungs- und Beteiligungsgesellschaft mbH\nGesellschaft mit beschränkter Haftung\nMünster\n\nDen Gläubigern der an der Verschmelzung beteiligten Rechtsträger ist, wenn sie binnen sechs Monaten nach dem Tag, an dem die Eintragung der Verschmelzung in das Register des Sitzes desjenigen Rechtsträgers, dessen Gläubiger sie sind, nach § 19 Absatz 3 UmwG als bekanntgemacht gilt, ihren Anspruch nach Grund und Höhe schriftlich anmelden, Sicherheit zu leisten, soweit sie nicht Befriedigung verlangen können. Dieses Recht steht den Gläubigern jedoch nur zu, wenn sie glaubhaft machen, dass durch die Verschmelzung die Erfüllung ihrer Forderung gefährdet wird."
    },
    {
      "date": "2025-08-05",
      "id": "119396",
      "original_text": "Registerbekanntmachung nach dem Umwandlungsgesetz\nNordrhein-Westfalen Amtsgericht Iserlohn HRB 1326\nHartmann Entsorgung Verwaltungs-GmbH – Iserlohn",
      "type": "Registerbekanntmachung nach dem Umwandlungsgesetz",
      "state": "Nordrhein-Westfalen",
      "amtsgericht": "Amtsgericht Iserlohn",
      "registernummer": "HRB 1326",
      "registerart": "HRB",
      "company_name": "Hartmann Entsorgung Verwaltungs-GmbH",
      "company_seat": "Iserlohn",
      "details": "05.08.2025 (Bekanntmachungsdatum)\n\nNordrhein-Westfalen Amtsgericht Iserlohn HRB 1326\nRegisterbekanntmachung nach dem Umwandlungsgesetz 01.08.2025 (Eintragungsdatum)\n\nHartmann Entsorgung Verwaltungs-GmbH\nGesellschaft mit beschränkter Haftung\nIserlohn\n\nDen Gläubigern der an der Verschmelzung beteiligten Rechtsträger ist, wenn sie binnen sechs Monaten nach dem Tag, an dem die Eintragung der Verschmelzung in das Register des Sitzes desjenigen Rechtsträgers, dessen Gläubiger sie sind, nach § 19 Absatz 3 UmwG als bekanntgemacht gilt, ihren Anspruch nach Grund und Höhe schriftlich anmelden, Sicherheit zu leisten, soweit sie nicht Befriedigung verlangen können. Dieses Recht steht den Gläubigern jedoch nur zu, wenn sie glaubhaft machen, dass durch die Verschmelzung die Erfüllung ihrer Forderung gefährdet wird."
    },
    {
      "date": "2025-08-05",
      "id": "119397",
      "original_text": "Registerbekanntmachung nach dem Umwandlungsgesetz\nNordrhein-Westfalen Amtsgericht Bochum HRB 7361\nWS GASTRO GmbH – Bochum",
      "type": "Registerbekanntmachung nach dem Umwandlungsgesetz",
      "state": "Nordrhein-Westfalen",
      "amtsgericht": "Amtsgericht Bochum",
      "registernummer": "HRB 7361",
      "registerart": "HRB",
      "company_name": "WS GASTRO GmbH",
      "company_seat": "Bochum",
      "details": "05.08.2025 (Bekanntmachungsdatum)\n\nNordrhein-Westfalen Amtsgericht Bochum HRB 7361\nRegisterbekanntmachung nach dem Umwandlungsgesetz 01.08.2025 (Eintragungsdatum)\n\nWS GASTRO GmbH\nGesellschaft mit beschränkter Haftung\nBochum\n\nDen Gläubigern der an der Verschmelzung beteiligten Rechtsträger ist, wenn sie binnen sechs Monaten nach dem Tag, an dem die Eintragung der Verschmelzung in das Register des Sitzes desjenigen Rechtsträgers, dessen Gläubiger sie sind, nach § 19 Absatz 3 UmwG als bekanntgemacht gilt, ihren Anspruch nach Grund und Höhe schriftlich anmelden, Sicherheit zu leisten, soweit sie nicht Befriedigung verlangen können. Dieses Recht steht den Gläubigern jedoch nur zu, wenn sie glaubhaft machen, dass durch die Verschmelzung die Erfüllung ihrer Forderung gefährdet wird."
    },
    {
      "date": "2025-08-05",
      "id": "119398",
      "original_text": "Löschungsankündigung\nNordrhein-Westfalen Amtsgericht Wuppertal HRB 32431\nDEINMONSTER GmbH – Heiligenhaus",
      "type": "Löschungsankündigung",
      "state": "Nordrhein-Westfalen",
      "amtsgericht": "Amtsgericht Wuppertal",
      "registernummer": "HRB 32431",
      "registerart": "HRB",
      "company_name": "DEINMONSTER GmbH",
      "company_seat": "Heiligenhaus",
      "details": "05.08.2025 (Bekanntmachungsdatum)\n\nNordrhein-Westfalen Amtsgericht Wuppertal HRB 32431\nLöschungsankündigung 01.08.2025 (Eintragungsdatum)\n\nDEINMONSTER GmbH\nGesellschaft mit beschränkter Haftung\nHeiligenhaus\n\nDas Registergericht beabsichtigt die Gesellschaft von Amts wegen nach § 394 FamFG zu löschen. Die Frist zur Erhebung eines Widerspruchs ist auf einen Monat festgesetzt."
    },
    {
      "date": "2025-08-05",
      "id": "119399",
      "original_text": "Einreichung neuer Dokumente\nNordrhein-Westfalen Amtsgericht Essen HRB 22565\nWestconnect GmbH – Essen",
      "type": "Einreichung neuer Dokumente",
      "state": "Nordrhein-Westfalen",
      "amtsgericht": "Amtsgericht Essen",
      "registernummer": "HRB 22565",
      "registerart": "HRB",
      "company_name": "Westconnect GmbH",
      "company_seat": "Essen",
      "details": "05.08.2025 (Bekanntmachungsdatum)\n\nNordrhein-Westfalen Amtsgericht Essen HRB 22565\nEinreichung neuer Dokumente 05.08.2025 (Eintragungsdatum)\n\nWestconnect GmbH\nGesellschaft mit beschränkter Haftung\nEssen\n\nDem Registergericht ist eine neue Liste der Mitglieder des Aufsichtsrates eingereicht worden."
    },
    {
      "date": "2025-08-05",
      "id": "119400",
      "original_text": "Löschungsankündigung\nNordrhein-Westfalen Amtsgericht Bochum HRB 20711\nBexbau GmbH – Bochum",
      "type": "Löschungsankündigung",
      "state": "Nordrhein-Westfalen",
      "amtsgericht": "Amtsgericht Bochum",
      "registernummer": "HRB 20711",
      "registerart": "HRB",
      "company_name": "Bexbau GmbH",
      "company_seat": "Bochum",
      "details": "05.08.2025 (Bekanntmachungsdatum)\n\nNordrhein-Westfalen Amtsgericht Bochum HRB 20711\nLöschungsankündigung\n\nBexbau GmbH\nGesellschaft mit beschränkter Haftung\nBochum\n\nDas Registergericht beabsichtigt die Gesellschaft von Amts wegen nach § 394 FamFG zu löschen. Die Frist zur Erhebung eines Widerspruchs ist auf drei Monate festgesetzt."
    },
    {
      "date": "2025-08-05",
      "id": "119401",
      "original_text": "Registerbekanntmachung nach dem Umwandlungsgesetz\nNordrhein-Westfalen Amtsgericht Hamm HRB 7041\nKUG Kruse Unternehmensberatung GmbH – Hamm",
      "type": "Registerbekanntmachung nach dem Umwandlungsgesetz",
      "state": "Nordrhein-Westfalen",
      "amtsgericht": "Amtsgericht Hamm",
      "registernummer": "HRB 7041",
      "registerart": "HRB",
      "company_name": "KUG Kruse Unternehmensberatung GmbH",
      "company_seat": "Hamm",
      "details": "05.08.2025 (Bekanntmachungsdatum)\n\nNordrhein-Westfalen Amtsgericht Hamm HRB 7041\nRegisterbekanntmachung nach dem Umwandlungsgesetz 05.08.2025 (Eintragungsdatum)\n\nKUG Kruse Unternehmensberatung GmbH\nGesellschaft mit beschränkter Haftung\nHamm\n\nDen Gläubigern der an der Verschmelzung beteiligten Rechtsträger ist, wenn sie binnen sechs Monaten nach dem Tag, an dem die Eintragung der Verschmelzung in das Register des Sitzes desjenigen Rechtsträgers, dessen Gläubiger sie sind, nach § 19 Absatz 3 UmwG als bekanntgemacht gilt, ihren Anspruch nach Grund und Höhe schriftlich anmelden, Sicherheit zu leisten, soweit sie nicht Befriedigung verlangen können. Dieses Recht steht den Gläubigern jedoch nur zu, wenn sie glaubhaft machen, dass durch die Verschmelzung die Erfüllung ihrer Forderung gefährdet wird."
    },
    {
      "date": "2025-08-05",
      "id": "119402",
      "original_text": "Registerbekanntmachung nach dem Umwandlungsgesetz\nNordrhein-Westfalen Amtsgericht Recklinghausen HRA 3900\nBreddemann Forstgesellschaft mbH & Co KG – Waltrop",
      "type": "Registerbekanntmachung nach dem Umwandlungsgesetz",
      "state": "Nordrhein-Westfalen",
      "amtsgericht": "Amtsgericht Recklinghausen",
      "registernummer": "HRA 3900",
      "registerart": "HRA",
      "company_name": "Breddemann Forstgesellschaft mbH & Co KG",
      "company_seat": "Waltrop",
      "details": "05.08.2025 (Bekanntmachungsdatum)\n\nNordrhein-Westfalen Amtsgericht Recklinghausen HRA 3900\nRegisterbekanntmachung nach dem Umwandlungsgesetz 05.08.2025 (Eintragungsdatum)\n\nBreddemann Forstgesellschaft mbH & Co KG\nKommanditgesellschaft\nWaltrop\n\nDen Gläubigern der an der Ausgliederung beteiligten Rechtsträger ist, wenn sie binnen sechs Monaten nach dem Tag, an dem die Eintragung der Ausgliederung in das Register des Sitzes desjenigen Rechtsträgers, dessen Gläubiger sie sind, nach § 19 Absatz 3 UmwG als bekanntgemacht gilt, ihren Anspruch nach Grund und Höhe schriftlich anmelden, Sicherheit zu leisten, soweit sie nicht Befriedigung verlangen können. Dieses Recht steht den Gläubigern jedoch nur zu, wenn sie glaubhaft machen, dass durch die Ausgliederung die Erfüllung ihrer Forderung gefährdet wird."
    },
    {
      "date": "2025-08-05",
      "id": "119403",
      "original_text": "Registerbekanntmachung nach dem Umwandlungsgesetz\nNordrhein-Westfalen Amtsgericht Neuss HRB 12194\nCreditreform AG – Neuss",
      "type": "Registerbekanntmachung nach dem Umwandlungsgesetz",
      "state": "Nordrhein-Westfalen",
      "amtsgericht": "Amtsgericht Neuss",
      "registernummer": "HRB 12194",
      "registerart": "HRB",
      "company_name": "Creditreform AG",
      "company_seat": "Neuss",
      "details": "05.08.2025 (Bekanntmachungsdatum)\n\nNordrhein-Westfalen Amtsgericht Neuss HRB 12194\nRegisterbekanntmachung nach dem Umwandlungsgesetz 05.08.2025 (Eintragungsdatum)\n\nCreditreform AG\nAktiengesellschaft\nNeuss\n\nDen Gläubigern der an der formwechselnden Umwandlung beteiligten Rechtsträger ist, wenn sie binnen sechs Monaten nach dem Tag, an dem die Eintragung der formwechselnden Umwandlung in das Register des Sitzes derjenigen Rechtsträger deren Gläubiger sie sind, nach § 19 Absatz 3 UmwG als bekanntgemacht gilt, ihren Anspruch nach Grund und Höhe schriftlich anmelden, Sicherheit zu leisten, soweit sie nicht Befriedigung verlangen können. Dieses Recht steht den Gläubigern jedoch nur zu, wenn sie glaubhaft machen, dass durch die formwechselnden Umwandlung die Erfüllung ihrer Forderung gefährdet wird."
    },
    {
      "date": "2025-08-05",
      "id": "119404",
      "original_text": "Registerbekanntmachung nach dem Umwandlungsgesetz\nNordrhein-Westfalen Amtsgericht Neuss HRB 10506\nLÜRAFLEX GmbH – Neuss",
      "type": "Registerbekanntmachung nach dem Umwandlungsgesetz",
      "state": "Nordrhein-Westfalen",
      "amtsgericht": "Amtsgericht Neuss",
      "registernummer": "HRB 10506",
      "registerart": "HRB",
      "company_name": "LÜRAFLEX GmbH",
      "company_seat": "Neuss",
      "details": "05.08.2025 (Bekanntmachungsdatum)\n\nNordrhein-Westfalen Amtsgericht Neuss HRB 10506\nRegisterbekanntmachung nach dem Umwandlungsgesetz 05.08.2025 (Eintragungsdatum)\n\nLÜRAFLEX GmbH\nGesellschaft mit beschränkter Haftung\nNeuss\n\nDen Gläubigern der an der Verschmelzung beteiligten Rechtsträger ist, wenn sie binnen sechs Monaten nach dem Tag, an dem die Eintragung der Verschmelzung in das Register des Sitzes derjenigen Rechtsträger deren Gläubiger sie sind, nach § 19 Absatz 3 UmwG als bekanntgemacht gilt, ihren Anspruch nach Grund und Höhe schriftlich anmelden, Sicherheit zu leisten, soweit sie nicht Befriedigung verlangen können. Dieses Recht steht den Gläubigern jedoch nur zu, wenn sie glaubhaft machen, dass durch die Verschmelzung die Erfüllung ihrer Forderung gefährdet wird."
    },
    {
      "date": "2025-08-05",
      "id": "119405",
      "original_text": "Registerbekanntmachung nach dem Umwandlungsgesetz\nNordrhein-Westfalen Amtsgericht Siegburg HRB 14735\n24h Pflegeteam Paech GmbH – Waldbröl",
      "type": "Registerbekanntmachung nach dem Umwandlungsgesetz",
      "state": "Nordrhein-Westfalen",
      "amtsgericht": "Amtsgericht Siegburg",
      "registernummer": "HRB 14735",
      "registerart": "HRB",
      "company_name": "24h Pflegeteam Paech GmbH",
      "company_seat": "Waldbröl",
      "details": "05.08.2025 (Bekanntmachungsdatum)\n\nNordrhein-Westfalen Amtsgericht Siegburg HRB 14735\nRegisterbekanntmachung nach dem Umwandlungsgesetz 05.08.2025 (Eintragungsdatum)\n\n24h Pflegeteam Paech GmbH\nGesellschaft mit beschränkter Haftung\nWaldbröl\n\nDen Gläubigern der an der Verschmelzung beteiligten Rechtsträger ist, wenn sie binnen sechs Monaten nach dem Tag, an dem die Eintragung der Verschmelzung in das Register des Sitzes desjenigen Rechtsträgers, dessen Gläubiger sie sind, nach § 19 Absatz 3 UmwG als bekanntgemacht gilt, ihren Anspruch nach Grund und Höhe schriftlich anmelden, Sicherheit zu leisten, soweit sie nicht Befriedigung verlangen können. Dieses Recht steht den Gläubigern jedoch nur zu, wenn sie glaubhaft machen, dass durch die Verschmelzung die Erfüllung ihrer Forderung gefährdet wird."
    },
    {
      "date": "2025-08-05",
      "id": "119406",
      "original_text": "Registerbekanntmachung nach dem Umwandlungsgesetz\nNordrhein-Westfalen Amtsgericht Düsseldorf HRB 97336\nAcciona Personnel Services GmbH – Düsseldorf",
      "type": "Registerbekanntmachung nach dem Umwandlungsgesetz",
      "state": "Nordrhein-Westfalen",
      "amtsgericht": "Amtsgericht Düsseldorf",
      "registernummer": "HRB 97336",
      "registerart": "HRB",
      "company_name": "Acciona Personnel Services GmbH",
      "company_seat": "Düsseldorf",
      "details": "05.08.2025 (Bekanntmachungsdatum)\n\nNordrhein-Westfalen Amtsgericht Düsseldorf HRB 97336\nRegisterbekanntmachung nach dem Umwandlungsgesetz 05.08.2025 (Eintragungsdatum)\n\nAcciona Personnel Services GmbH\nGesellschaft mit beschränkter Haftung\nDüsseldorf\n\nDen Gläubigern der an der Verschmelzung beteiligten Rechtsträger ist, wenn sie binnen sechs Monaten nach dem Tag, an dem die Eintragung der Verschmelzung in das Register des Sitzes desjenigen Rechtsträgers, dessen Gläubiger sie sind, nach § 19 Absatz 3 UmwG als bekanntgemacht gilt, ihren Anspruch nach Grund und Höhe schriftlich anmelden, Sicherheit zu leisten, soweit sie nicht Befriedigung verlangen können. Dieses Recht steht den Gläubigern jedoch nur zu, wenn sie glaubhaft machen, dass durch die Verschmelzung die Erfüllung ihrer Forderung gefährdet wird."
    },
    {
      "date": "2025-08-05",
      "id": "119407",
      "original_text": "Registerbekanntmachung nach dem Umwandlungsgesetz\nNordrhein-Westfalen Amtsgericht Essen HRB 1995\nopta data Finance GmbH – Essen",
      "type": "Registerbekanntmachung nach dem Umwandlungsgesetz",
      "state": "Nordrhein-Westfalen",
      "amtsgericht": "Amtsgericht Essen",
      "registernummer": "HRB 1995",
      "registerart": "HRB",
      "company_name": "opta data Finance GmbH",
      "company_seat": "Essen",
      "details": "05.08.2025 (Bekanntmachungsdatum)\n\nNordrhein-Westfalen Amtsgericht Essen HRB 1995\nRegisterbekanntmachung nach dem Umwandlungsgesetz 05.08.2025 (Eintragungsdatum)\n\nopta data Finance GmbH\nGesellschaft mit beschränkter Haftung\nEssen\n\nDen Gläubigern der an der Verschmelzung beteiligten Rechtsträger ist, wenn sie binnen sechs Monaten nach dem Tag, an dem die Eintragung der Verschmelzung in das Register des Sitzes desjenigen Rechtsträgers, dessen Gläubiger sie sind, nach § 19 Absatz 3 UmwG als bekanntgemacht gilt, ihren Anspruch nach Grund und Höhe schriftlich anmelden, Sicherheit zu leisten, soweit sie nicht Befriedigung verlangen können. Dieses Recht steht den Gläubigern jedoch nur zu, wenn sie glaubhaft machen, dass durch die Verschmelzung die Erfüllung ihrer Forderung gefährdet wird."
    },
    {
      "date": "2025-08-05",
      "id": "119408",
      "original_text": "Einreichung neuer Dokumente\nNordrhein-Westfalen Amtsgericht Kleve HRA 5444\nIngenieur- und Planungsbüro Lange GmbH & Co. KG – Moers",
      "type": "Einreichung neuer Dokumente",
      "state": "Nordrhein-Westfalen",
      "amtsgericht": "Amtsgericht Kleve",
      "registernummer": "HRA 5444",
      "registerart": "HRA",
      "company_name": "Ingenieur- und Planungsbüro Lange GmbH & Co. KG",
      "company_seat": "Moers",
      "details": "05.08.2025 (Bekanntmachungsdatum)\n\nNordrhein-Westfalen Amtsgericht Kleve HRA 5444\nEinreichung neuer Dokumente\n\nIngenieur- und Planungsbüro Lange GmbH & Co. KG\nKommanditgesellschaft\nMoers\n\nDem Registergericht ist eine Liste der Mitglieder des Aufsichtsrates eingereicht worden."
    },
    {
      "date": "2025-08-05",
      "id": "119409",
      "original_text": "Löschungsankündigung\nNordrhein-Westfalen Amtsgericht Arnsberg HRA 4061\nBruchhausener Skilift GmbH. & Co. Kommanditgesellschaft – Olsberg",
      "type": "Löschungsankündigung",
      "state": "Nordrhein-Westfalen",
      "amtsgericht": "Amtsgericht Arnsberg",
      "registernummer": "HRA 4061",
      "registerart": "HRA",
      "company_name": "Bruchhausener Skilift GmbH. & Co. Kommanditgesellschaft",
      "company_seat": "Olsberg",
      "details": "05.08.2025 (Bekanntmachungsdatum)\n\nNordrhein-Westfalen Amtsgericht Arnsberg HRA 4061\nLöschungsankündigung 08.07.2025 (Eintragungsdatum)\n\nBruchhausener Skilift GmbH. & Co. Kommanditgesellschaft\nKommanditgesellschaft\nOlsberg\n\nDas Registergericht beabsichtigt, die im Handelsregister eingetragene Firma von Amts wegen nach §§ 31 Abs. 2, 6 HGB, § 393 FamFG zu löschen.Gegen diese Verfügung kann Widerspruch eingelegt werden. Die Frist zur Erhebung eines Widerspruchs gegen die beabsichtigte Löschung von Amts wegen ist auf einen Monat festgesetzt. Rechtsbehelfsbelehrung: Gegen diese Verfügung können Sie Widerspruch einlegen. Der Widerspruch ist bei dem Amtsgericht Arnsberg, Eichholzstraße 4, 59821 Arnsberg schriftlich in deutscher Sprache oder zur Niederschrift der Geschäftsstelle einzulegen. Der Widerspruch kann auch zur Niederschrift der Geschäftsstelle eines jeden Amtsgerichtes abgegeben werden. Die Einlegung ist auch durch Übertragung eines elektronischen Dokuments an die elektronische Poststelle des Gerichts möglich. Das elektronische Dokument muss für die Bearbeitung durch das Gericht geeignet und mit einer qualifizierten elektronischen Signatur der verantwortenden Person versehen sein oder von der verantwortenden Person signiert und auf einem sicheren Übermittlungsweg gemäß § 130a ZPO nach näherer Maßgabe der Verordnung über die technischen Rahmenbedingungen des elektronischen Rechtsverkehrs und über das besondere elektronische Behördenpostfach (BGBl. I, S.3803) eingereicht werden. Weitere Informationen erhalten Sie auf der Internetseite www.justiz.de.Der Widerspruch muss spätestens innerhalb der gesetzten Frist bei dem Amtsgericht Arnsberg eingegangen sein. Dies gilt auch dann, wenn der Widerspruch zur Niederschrift der Geschäftsstelle eines anderen Amtsgerichtes abgegeben wurde. Die Frist beginnt mit der Veröffentlichung. Fällt das Ende der Frist auf einen Sonntag, einen allgemeinen Feiertag oder Sonnabend, so endet die Frist mit Ablauf des nächsten Werktages.Der Widerspruch muss die Bezeichnung der angefochtenen Verfügung sowie die Erklärung enthalten, dass Widerspruch gegen diese Verfügung eingelegt wird. Er ist zu unterzeichnen und soll begründet werden."
    },
    {
      "date": "2025-08-05",
      "id": "119410",
      "original_text": "Registerbekanntmachung nach dem Umwandlungsgesetz\nNordrhein-Westfalen Amtsgericht Düsseldorf HRB 90857\nVopak Germany Pension GmbH – Düsseldorf",
      "type": "Registerbekanntmachung nach dem Umwandlungsgesetz",
      "state": "Nordrhein-Westfalen",
      "amtsgericht": "Amtsgericht Düsseldorf",
      "registernummer": "HRB 90857",
      "registerart": "HRB",
      "company_name": "Vopak Germany Pension GmbH",
      "company_seat": "Düsseldorf",
      "details": "05.08.2025 (Bekanntmachungsdatum)\n\nNordrhein-Westfalen Amtsgericht Düsseldorf HRB 90857\nRegisterbekanntmachung nach dem Umwandlungsgesetz 05.08.2025 (Eintragungsdatum)\n\nVopak Germany Pension GmbH\nGesellschaft mit beschränkter Haftung\nDüsseldorf\n\nDen Gläubigern der an der Ausgliederung beteiligten Rechtsträger ist, wenn sie binnen sechs Monaten nach dem Tag, an dem die Eintragung der Ausgliederung in das Register des Sitzes desjenigen Rechtsträgers, dessen Gläubiger sie sind, nach § 19 Absatz 3 UmwG als bekanntgemacht gilt, ihren Anspruch nach Grund und Höhe schriftlich anmelden, Sicherheit zu leisten, soweit sie nicht Befriedigung verlangen können. Dieses Recht steht den Gläubigern jedoch nur zu, wenn sie glaubhaft machen, dass durch die Ausgliederung die Erfüllung ihrer Forderung gefährdet wird."
    },
    {
      "date": "2025-08-05",
      "id": "119411",
      "original_text": "Registerbekanntmachung nach dem Umwandlungsgesetz\nNordrhein-Westfalen Amtsgericht Düsseldorf HRB 47037\nControlExpert GmbH – Langenfeld",
      "type": "Registerbekanntmachung nach dem Umwandlungsgesetz",
      "state": "Nordrhein-Westfalen",
      "amtsgericht": "Amtsgericht Düsseldorf",
      "registernummer": "HRB 47037",
      "registerart": "HRB",
      "company_name": "ControlExpert GmbH",
      "company_seat": "Langenfeld",
      "details": "05.08.2025 (Bekanntmachungsdatum)\n\nNordrhein-Westfalen Amtsgericht Düsseldorf HRB 47037\nRegisterbekanntmachung nach dem Umwandlungsgesetz 05.08.2025 (Eintragungsdatum)\n\nControlExpert GmbH\nGesellschaft mit beschränkter Haftung\nLangenfeld\n\nDen Gläubigern der an der Verschmelzung beteiligten Rechtsträger ist, wenn sie binnen sechs Monaten nach dem Tag, an dem die Eintragung der Verschmelzung in das Register des Sitzes desjenigen Rechtsträgers, dessen Gläubiger sie sind, nach § 19 Absatz 3 UmwG als bekanntgemacht gilt, ihren Anspruch nach Grund und Höhe schriftlich anmelden, Sicherheit zu leisten, soweit sie nicht Befriedigung verlangen können. Dieses Recht steht den Gläubigern jedoch nur zu, wenn sie glaubhaft machen, dass durch die Verschmelzung die Erfüllung ihrer Forderung gefährdet wird."
    },
    {
      "date": "2025-08-05",
      "id": "119412",
      "original_text": "Registerbekanntmachung nach dem Umwandlungsgesetz\nNordrhein-Westfalen Amtsgericht Siegburg HRB 16880\nBaucon Immobilien Besitz GmbH – Much",
      "type": "Registerbekanntmachung nach dem Umwandlungsgesetz",
      "state": "Nordrhein-Westfalen",
      "amtsgericht": "Amtsgericht Siegburg",
      "registernummer": "HRB 16880",
      "registerart": "HRB",
      "company_name": "Baucon Immobilien Besitz GmbH",
      "company_seat": "Much",
      "details": "05.08.2025 (Bekanntmachungsdatum)\n\nNordrhein-Westfalen Amtsgericht Siegburg HRB 16880\nRegisterbekanntmachung nach dem Umwandlungsgesetz 05.08.2025 (Eintragungsdatum)\n\nBaucon Immobilien Besitz GmbH\nGesellschaft mit beschränkter Haftung\nMuch\n\nDen Gläubigern der an der Verschmelzung beteiligten Rechtsträger ist, wenn sie binnen sechs Monaten nach dem Tag, an dem die Eintragung der Verschmelzung in das Register des Sitzes desjenigen Rechtsträgers, dessen Gläubiger sie sind, nach § 19 Absatz 3 UmwG als bekanntgemacht gilt, ihren Anspruch nach Grund und Höhe schriftlich anmelden, Sicherheit zu leisten, soweit sie nicht Befriedigung verlangen können. Dieses Recht steht den Gläubigern jedoch nur zu, wenn sie glaubhaft machen, dass durch die Verschmelzung die Erfüllung ihrer Forderung gefährdet wird."
    },
    {
      "date": "2025-08-05",
      "id": "119413",
      "original_text": "Registerbekanntmachung nach dem Umwandlungsgesetz\nNordrhein-Westfalen Amtsgericht Düsseldorf HRB 84695\nPLUSPOINT Beratungsgesellschaft mbH – Düsseldorf",
      "type": "Registerbekanntmachung nach dem Umwandlungsgesetz",
      "state": "Nordrhein-Westfalen",
      "amtsgericht": "Amtsgericht Düsseldorf",
      "registernummer": "HRB 84695",
      "registerart": "HRB",
      "company_name": "PLUSPOINT Beratungsgesellschaft mbH",
      "company_seat": "Düsseldorf",
      "details": "05.08.2025 (Bekanntmachungsdatum)\n\nNordrhein-Westfalen Amtsgericht Düsseldorf HRB 84695\nRegisterbekanntmachung nach dem Umwandlungsgesetz 05.08.2025 (Eintragungsdatum)\n\nPLUSPOINT Beratungsgesellschaft mbH\nGesellschaft mit beschränkter Haftung\nDüsseldorf\n\nDen Gläubigern der an der Verschmelzung beteiligten Rechtsträger ist, wenn sie binnen sechs Monaten nach dem Tag, an dem die Eintragung der Verschmelzung in das Register des Sitzes desjenigen Rechtsträgers, dessen Gläubiger sie sind, nach § 19 Absatz 3 UmwG als bekanntgemacht gilt, ihren Anspruch nach Grund und Höhe schriftlich anmelden, Sicherheit zu leisten, soweit sie nicht Befriedigung verlangen können. Dieses Recht steht den Gläubigern jedoch nur zu, wenn sie glaubhaft machen, dass durch die Verschmelzung die Erfüllung ihrer Forderung gefährdet wird."
    },
    {
      "date": "2025-08-05",
      "id": "119414",
      "original_text": "Registerbekanntmachung nach dem Umwandlungsgesetz\nNordrhein-Westfalen Amtsgericht Köln HRB 16700\nLefac GmbH – Köln",
      "type": "Registerbekanntmachung nach dem Umwandlungsgesetz",
      "state": "Nordrhein-Westfalen",
      "amtsgericht": "Amtsgericht Köln",
      "registernummer": "HRB 16700",
      "registerart": "HRB",
      "company_name": "Lefac GmbH",
      "company_seat": "Köln",
      "details": "05.08.2025 (Bekanntmachungsdatum)\n\nNordrhein-Westfalen Amtsgericht Köln HRB 16700\nRegisterbekanntmachung nach dem Umwandlungsgesetz 05.08.2025 (Eintragungsdatum)\n\nLefac GmbH\nGesellschaft mit beschränkter Haftung\nKöln\n\nDen Gläubigern der an der Verschmelzung beteiligten Rechtsträger ist, wenn sie binnen sechs Monaten nach dem Tag, an dem die Eintragung der Verschmelzung in das Register des Sitzes desjenigen Rechtsträgers, dessen Gläubiger sie sind, nach § 19 Absatz 3 UmwG als bekanntgemacht gilt, ihren Anspruch nach Grund und Höhe schriftlich anmelden, Sicherheit zu leisten, soweit sie nicht Befriedigung verlangen können. Dieses Recht steht den Gläubigern jedoch nur zu, wenn sie glaubhaft machen, dass durch die Verschmelzung die Erfüllung ihrer Forderung gefährdet wird."
    },
    {
      "date": "2025-08-05",
      "id": "119415",
      "original_text": "Registerbekanntmachung nach dem Umwandlungsgesetz\nNordrhein-Westfalen Amtsgericht Bad Oeynhausen HRB 20275\nReSeT International GmbH – Minden",
      "type": "Registerbekanntmachung nach dem Umwandlungsgesetz",
      "state": "Nordrhein-Westfalen",
      "amtsgericht": "Amtsgericht Bad Oeynhausen",
      "registernummer": "HRB 20275",
      "registerart": "HRB",
      "company_name": "ReSeT International GmbH",
      "company_seat": "Minden",
      "details": "05.08.2025 (Bekanntmachungsdatum)\n\nNordrhein-Westfalen Amtsgericht Bad Oeynhausen HRB 20275\nRegisterbekanntmachung nach dem Umwandlungsgesetz 05.08.2025 (Eintragungsdatum)\n\nReSeT International GmbH\nGesellschaft mit beschränkter Haftung\nMinden\n\nDen Gläubigern der an der Verschmelzung beteiligten Rechtsträger ist, wenn sie binnen sechs Monaten nach dem Tag, an dem die Eintragung der Verschmelzung in das Register des Sitzes desjenigen Rechtsträgers, dessen Gläubiger sie sind, nach § 19 Absatz 3 UmwG als bekanntgemacht gilt, ihren Anspruch nach Grund und Höhe schriftlich anmelden, Sicherheit zu leisten, soweit sie nicht Befriedigung verlangen können. Dieses Recht steht den Gläubigern jedoch nur zu, wenn sie glaubhaft machen, dass durch die Verschmelzung die Erfüllung ihrer Forderung gefährdet wird."
    },
    {
      "date": "2025-08-05",
      "id": "119416",
      "original_text": "Löschungsankündigung\nNordrhein-Westfalen Amtsgericht Mönchengladbach HRB 19094\nPoetic Mansion UG (haftungsbeschränkt) – Viersen",
      "type": "Löschungsankündigung",
      "state": "Nordrhein-Westfalen",
      "amtsgericht": "Amtsgericht Mönchengladbach",
      "registernummer": "HRB 19094",
      "registerart": "HRB",
      "company_name": "Poetic Mansion UG (haftungsbeschränkt)",
      "company_seat": "Viersen",
      "details": "05.08.2025 (Bekanntmachungsdatum)\n\nNordrhein-Westfalen Amtsgericht Mönchengladbach HRB 19094\nLöschungsankündigung\n\nPoetic Mansion UG (haftungsbeschränkt)\nGesellschaft mit beschränkter Haftung\nViersen\n\nPoetic Mansion UG (Haftungsbeschränkt), Viersen (Amtsgericht Mönchengladbach, HRB 19094)\nDas Registergericht beabsichtigt, die im Handelsregister eingetragene Gesellschaft gemäß § 394 Absatz 1 FamFG wegen Vermögenslosigkeit von Amts wegen zu löschen. Gegen diese Verfügung kann Widerspruch eingelegt werden. Die Frist zur Erhebung eines Widerspruchs gegen die beabsichtigte Löschung von Amts wegen ist auf drei Monate festgesetzt."
    },
    {
      "date": "2025-08-05",
      "id": "119417",
      "original_text": "Registerbekanntmachung nach dem Umwandlungsgesetz\nNordrhein-Westfalen Amtsgericht Essen HRB 21128\nHOCHTIEF Offshore Crewing GmbH – Essen",
      "type": "Registerbekanntmachung nach dem Umwandlungsgesetz",
      "state": "Nordrhein-Westfalen",
      "amtsgericht": "Amtsgericht Essen",
      "registernummer": "HRB 21128",
      "registerart": "HRB",
      "company_name": "HOCHTIEF Offshore Crewing GmbH",
      "company_seat": "Essen",
      "details": "05.08.2025 (Bekanntmachungsdatum)\n\nNordrhein-Westfalen Amtsgericht Essen HRB 21128\nRegisterbekanntmachung nach dem Umwandlungsgesetz 05.08.2025 (Eintragungsdatum)\n\nHOCHTIEF Offshore Crewing GmbH\nGesellschaft mit beschränkter Haftung\nEssen\n\nDen Gläubigern der an der Verschmelzung beteiligten Rechtsträger ist, wenn sie binnen sechs Monaten nach dem Tag, an dem die Eintragung der Verschmelzung in das Register des Sitzes derjenigen Rechtsträger deren Gläubiger sie sind, nach § 19 Absatz 3 UmwG als bekanntgemacht gilt, ihren Anspruch nach Grund und Höhe schriftlich anmelden, Sicherheit zu leisten, soweit sie nicht Befriedigung verlangen können. Dieses Recht steht den Gläubigern jedoch nur zu, wenn sie glaubhaft machen, dass durch die Verschmelzung die Erfüllung ihrer Forderung gefährdet wird."
    },
    {
      "date": "2025-08-05",
      "id": "119418",
      "original_text": "Löschungsankündigung\nNordrhein-Westfalen Amtsgericht Kleve HRB 18695\nRs-cars UG (haftungsbeschränkt) – Kleve",
      "type": "Löschungsankündigung",
      "state": "Nordrhein-Westfalen",
      "amtsgericht": "Amtsgericht Kleve",
      "registernummer": "HRB 18695",
      "registerart": "HRB",
      "company_name": "Rs-cars UG (haftungsbeschränkt)",
      "company_seat": "Kleve",
      "details": "05.08.2025 (Bekanntmachungsdatum)\n\nNordrhein-Westfalen Amtsgericht Kleve HRB 18695\nLöschungsankündigung\n\nRs-cars UG (haftungsbeschränkt)\nGesellschaft mit beschränkter Haftung\nKleve\n\nDas Registergericht beabsichtigt die Gesellschaft von Amts wegen nach § 394 FamFG zu löschen. Die Frist zur Erhebung eines Widerspruchs ist auf einen Monat festgesetzt."
    },
    {
      "date": "2025-08-05",
      "id": "119419",
      "original_text": "Registerbekanntmachung nach dem Umwandlungsgesetz\nNordrhein-Westfalen Amtsgericht Bad Oeynhausen HRB 14223\nReSeT GmbH – Minden",
      "type": "Registerbekanntmachung nach dem Umwandlungsgesetz",
      "state": "Nordrhein-Westfalen",
      "amtsgericht": "Amtsgericht Bad Oeynhausen",
      "registernummer": "HRB 14223",
      "registerart": "HRB",
      "company_name": "ReSeT GmbH",
      "company_seat": "Minden",
      "details": "05.08.2025 (Bekanntmachungsdatum)\n\nNordrhein-Westfalen Amtsgericht Bad Oeynhausen HRB 14223\nRegisterbekanntmachung nach dem Umwandlungsgesetz 05.08.2025 (Eintragungsdatum)\n\nReSeT GmbH\nGesellschaft mit beschränkter Haftung\nMinden\n\nDen Gläubigern der an der Verschmelzung beteiligten Rechtsträger ist, wenn sie binnen sechs Monaten nach dem Tag, an dem die Eintragung der Verschmelzung in das Register des Sitzes desjenigen Rechtsträgers, dessen Gläubiger sie sind, nach § 19 Absatz 3 UmwG als bekanntgemacht gilt, ihren Anspruch nach Grund und Höhe schriftlich anmelden, Sicherheit zu leisten, soweit sie nicht Befriedigung verlangen können. Dieses Recht steht den Gläubigern jedoch nur zu, wenn sie glaubhaft machen, dass durch die Verschmelzung die Erfüllung ihrer Forderung gefährdet wird."
    },
    {
      "date": "2025-08-05",
      "id": "119420",
      "original_text": "Löschungsankündigung\nNordrhein-Westfalen Amtsgericht Mönchengladbach HRB 17912\nECV GmbH – Grevenbroich",
      "type": "Löschungsankündigung",
      "state": "Nordrhein-Westfalen",
      "amtsgericht": "Amtsgericht Mönchengladbach",
      "registernummer": "HRB 17912",
      "registerart": "HRB",
      "company_name": "ECV GmbH",
      "company_seat": "Grevenbroich",
      "details": "05.08.2025 (Bekanntmachungsdatum)\n\nNordrhein-Westfalen Amtsgericht Mönchengladbach HRB 17912\nLöschungsankündigung\n\nECV GmbH\nGesellschaft mit beschränkter Haftung\nGrevenbroich\n\nECV GmbH, Grevenbroich (Amtsgericht Mönchengladbach, HRB 17912)\nDas Registergericht beabsichtigt, die im Handelsregister eingetragene Gesellschaft gemäß § 394 Absatz 1 FamFG wegen Vermögenslosigkeit von Amts wegen zu löschen. Gegen diese Verfügung kann Widerspruch eingelegt werden. Die Frist zur Erhebung eines Widerspruchs gegen die beabsichtigte Löschung von Amts wegen ist auf drei Monate festgesetzt."
    },
    {
      "date": "2025-08-05",
      "id": "119421",
      "original_text": "Einreichung neuer Dokumente\nNordrhein-Westfalen Amtsgericht Hagen HRB 10\nMark-E Aktiengesellschaft – Hagen",
      "type": "Einreichung neuer Dokumente",
      "state": "Nordrhein-Westfalen",
      "amtsgericht": "Amtsgericht Hagen",
      "registernummer": "HRB 10",
      "registerart": "HRB",
      "company_name": "Mark-E Aktiengesellschaft",
      "company_seat": "Hagen",
      "details": "05.08.2025 (Bekanntmachungsdatum)\n\nNordrhein-Westfalen Amtsgericht Hagen HRB 10\nEinreichung neuer Dokumente\n\nMark-E Aktiengesellschaft\nAktiengesellschaft\nHagen\n\nDem Registergericht ist eine Liste der Mitglieder des Aufsichtsrates eingereicht worden."
    },
    {
      "date": "2025-08-05",
      "id": "119422",
      "original_text": "Registerbekanntmachung nach dem Umwandlungsgesetz\nNordrhein-Westfalen Amtsgericht Bielefeld HRB 31548\nARIMA International GmbH – Schloß Holte-Stukenbrock",
      "type": "Registerbekanntmachung nach dem Umwandlungsgesetz",
      "state": "Nordrhein-Westfalen",
      "amtsgericht": "Amtsgericht Bielefeld",
      "registernummer": "HRB 31548",
      "registerart": "HRB",
      "company_name": "ARIMA International GmbH",
      "company_seat": "Schloß Holte-Stukenbrock",
      "details": "05.08.2025 (Bekanntmachungsdatum)\n\nNordrhein-Westfalen Amtsgericht Bielefeld HRB 31548\nRegisterbekanntmachung nach dem Umwandlungsgesetz 05.08.2025 (Eintragungsdatum)\n\nARIMA International GmbH\nGesellschaft mit beschränkter Haftung\nSchloß Holte-Stukenbrock\n\nDen Gläubigern der an der Verschmelzung beteiligten Rechtsträger ist, wenn sie binnen sechs Monaten nach dem Tag, an dem die Eintragung der Verschmelzung in das Register des Sitzes desjenigen Rechtsträgers, dessen Gläubiger sie sind, nach § 19 Absatz 3 UmwG als bekanntgemacht gilt, ihren Anspruch nach Grund und Höhe schriftlich anmelden, Sicherheit zu leisten, soweit sie nicht Befriedigung verlangen können. Dieses Recht steht den Gläubigern jedoch nur zu, wenn sie glaubhaft machen, dass durch die Verschmelzung die Erfüllung ihrer Forderung gefährdet wird."
    },
    {
      "date": "2025-08-05",
      "id": "119423",
      "original_text": "Einreichung neuer Dokumente\nNordrhein-Westfalen Amtsgericht Köln HRB 73344\nAXA easy Versicherung AG – Köln",
      "type": "Einreichung neuer Dokumente",
      "state": "Nordrhein-Westfalen",
      "amtsgericht": "Amtsgericht Köln",
      "registernummer": "HRB 73344",
      "registerart": "HRB",
      "company_name": "AXA easy Versicherung AG",
      "company_seat": "Köln",
      "details": "05.08.2025 (Bekanntmachungsdatum)\n\nNordrhein-Westfalen Amtsgericht Köln HRB 73344\nEinreichung neuer Dokumente\n\nAXA easy Versicherung AG\nAktiengesellschaft\nKöln\n\nDem Registergericht ist eine neue Liste der Mitglieder des Aufsichtsrates eingereicht worden."
    },
    {
      "date": "2025-08-05",
      "id": "119424",
      "original_text": "Registerbekanntmachung nach dem Umwandlungsgesetz\nNordrhein-Westfalen Amtsgericht Münster HRB 14680\nAlfred Heiland Bau & Grund GmbH – Münster",
      "type": "Registerbekanntmachung nach dem Umwandlungsgesetz",
      "state": "Nordrhein-Westfalen",
      "amtsgericht": "Amtsgericht Münster",
      "registernummer": "HRB 14680",
      "registerart": "HRB",
      "company_name": "Alfred Heiland Bau & Grund GmbH",
      "company_seat": "Münster",
      "details": "05.08.2025 (Bekanntmachungsdatum)\n\nNordrhein-Westfalen Amtsgericht Münster HRB 14680\nRegisterbekanntmachung nach dem Umwandlungsgesetz 05.08.2025 (Eintragungsdatum)\n\nAlfred Heiland Bau & Grund GmbH\nGesellschaft mit beschränkter Haftung\nMünster\n\nDen Gläubigern der an der Verschmelzung beteiligten Rechtsträger ist, wenn sie binnen sechs Monaten nach dem Tag, an dem die Eintragung der Verschmelzung in das Register des Sitzes desjenigen Rechtsträgers, dessen Gläubiger sie sind, nach § 19 Absatz 3 UmwG als bekanntgemacht gilt, ihren Anspruch nach Grund und Höhe schriftlich anmelden, Sicherheit zu leisten, soweit sie nicht Befriedigung verlangen können. Dieses Recht steht den Gläubigern jedoch nur zu, wenn sie glaubhaft machen, dass durch die Verschmelzung die Erfüllung ihrer Forderung gefährdet wird."
    },
    {
      "date": "2025-08-05",
      "id": "119425",
      "original_text": "Einreichung neuer Dokumente\nNordrhein-Westfalen Amtsgericht Essen HRB 27613\nPCC Services GmbH der Deutschen Bank – Essen",
      "type": "Einreichung neuer Dokumente",
      "state": "Nordrhein-Westfalen",
      "amtsgericht": "Amtsgericht Essen",
      "registernummer": "HRB 27613",
      "registerart": "HRB",
      "company_name": "PCC Services GmbH der Deutschen Bank",
      "company_seat": "Essen",
      "details": "05.08.2025 (Bekanntmachungsdatum)\n\nNordrhein-Westfalen Amtsgericht Essen HRB 27613\nEinreichung neuer Dokumente\n\nPCC Services GmbH der Deutschen Bank\nGesellschaft mit beschränkter Haftung\nEssen\n\nDem Registergericht ist eine neue Liste der Mitglieder des Aufsichtsrates eingereicht worden."
    },
    {
      "date": "2025-08-05",
      "id": "119426",
      "original_text": "Einreichung neuer Dokumente\nNordrhein-Westfalen Amtsgericht Essen HRB 28361\nRuhrbahn GmbH – Essen",
      "type": "Einreichung neuer Dokumente",
      "state": "Nordrhein-Westfalen",
      "amtsgericht": "Amtsgericht Essen",
      "registernummer": "HRB 28361",
      "registerart": "HRB",
      "company_name": "Ruhrbahn GmbH",
      "company_seat": "Essen",
      "details": "05.08.2025 (Bekanntmachungsdatum)\n\nNordrhein-Westfalen Amtsgericht Essen HRB 28361\nEinreichung neuer Dokumente\n\nRuhrbahn GmbH\nGesellschaft mit beschränkter Haftung\nEssen\n\nDem Registergericht ist eine neue Liste der Mitglieder des Aufsichtsrates eingereicht worden."
    },
    {
      "date": "2025-08-05",
      "id": "119427",
      "original_text": "Registerbekanntmachung nach dem Umwandlungsgesetz\nBrandenburg Amtsgericht Cottbus HRA 4355\nThomas Richter Beauty e.K. – Bad Liebenwerda",
      "type": "Registerbekanntmachung nach dem Umwandlungsgesetz",
      "state": "Brandenburg",
      "amtsgericht": "Amtsgericht Cottbus",
      "registernummer": "HRA 4355",
      "registerart": "HRA",
      "company_name": "Thomas Richter Beauty e.K.",
      "company_seat": "Bad Liebenwerda",
      "details": "05.08.2025 (Bekanntmachungsdatum)\n\nBrandenburg Amtsgericht Cottbus HRA 4355\nRegisterbekanntmachung nach dem Umwandlungsgesetz 04.08.2025 (Eintragungsdatum)\n\nThomas Richter Beauty e.K.\nEinzelkaufmann / Einzelkauffrau\nBad Liebenwerda\n\nZu Eintragungsnummer 2 vom 04.08.2025 wird als nicht eingetragen veröffentlicht:\nDen Gläubigern der an der Ausgliederung beteiligten Rechtsträger ist, wenn sie binnen sechs Monaten nach dem Tag, an dem die Eintragung der Ausgliederung in das Register des Sitzes desjenigen Rechtsträgers, dessen Gläubiger sie sind, als bekannt gemacht gilt, ihren Anspruch nach Grund und Höhe schriftlich anmelden, Sicherheit zu leisten, soweit sie nicht Befriedigung verlangen können. Dieses Recht steht den Gläubigern jedoch nur zu, wenn sie glaubhaft machen, dass durch die Ausgliederung die Erfüllung ihrer Forderung gefährdet wird"
    },
    {
      "date": "2025-08-05",
      "id": "119428",
      "original_text": "Registerbekanntmachung nach dem Umwandlungsgesetz\nHessen Amtsgericht Frankfurt am Main HRB 110797\nLE Quartier 200 GmbH – Frankfurt am Main",
      "type": "Registerbekanntmachung nach dem Umwandlungsgesetz",
      "state": "Hessen",
      "amtsgericht": "Amtsgericht Frankfurt am Main",
      "registernummer": "HRB 110797",
      "registerart": "HRB",
      "company_name": "LE Quartier 200 GmbH",
      "company_seat": "Frankfurt am Main",
      "details": "05.08.2025 (Bekanntmachungsdatum)\n\nHessen Amtsgericht Frankfurt am Main HRB 110797\nRegisterbekanntmachung nach dem Umwandlungsgesetz 05.08.2025 (Eintragungsdatum)\n\nLE Quartier 200 GmbH\nGesellschaft mit beschränkter Haftung\nFrankfurt am Main\n\nDen Gläubigern der an der Verschmelzung beteiligten Rechtsträger ist, wenn sie binnen sechs Monaten nach dem Tag, an dem die Eintragung der Verschmelzung in das Register des Sitzes desjenigen Rechtsträgers, dessen Gläubiger sie sind, nach § 19 Absatz 3 UmwG bekannt gemacht worden ist, ihren Anspruch nach Grund und Höhe schriftlich anmelden, Sicherheit zu leisten, soweit sie nicht Befriedigung verlangen können. Dieses Recht steht den Gläubigern jedoch nur zu, wenn sie glaubhaft machen, dass durch die Verschmelzung die Erfüllung ihrer Forderung gefährdet wird."
    },
    {
      "date": "2025-08-05",
      "id": "119429",
      "original_text": "Registerbekanntmachung nach dem Umwandlungsgesetz\nHessen Amtsgericht Marburg HRB 3106\nREC Fastening GmbH – Breidenbach",
      "type": "Registerbekanntmachung nach dem Umwandlungsgesetz",
      "state": "Hessen",
      "amtsgericht": "Amtsgericht Marburg",
      "registernummer": "HRB 3106",
      "registerart": "HRB",
      "company_name": "REC Fastening GmbH",
      "company_seat": "Breidenbach",
      "details": "05.08.2025 (Bekanntmachungsdatum)\n\nHessen Amtsgericht Marburg HRB 3106\nRegisterbekanntmachung nach dem Umwandlungsgesetz 05.08.2025 (Eintragungsdatum)\n\nREC Fastening GmbH\nGesellschaft mit beschränkter Haftung\nBreidenbach\n\nDen Gläubigern der an der Verschmelzung beteiligten Rechtsträger ist, wenn sie binnen sechs Monaten nach dem Tag, an dem die Eintragung der Verschmelzung in das Register des Sitzes desjenigen Rechtsträgers, dessen Gläubiger sie sind, nach § 19 Absatz 3 UmwG bekannt gemacht worden ist, ihren Anspruch nach Grund und Höhe schriftlich anmelden, Sicherheit zu leisten, soweit sie nicht Befriedigung verlangen können. Dieses Recht steht den Gläubigern jedoch nur zu, wenn sie glaubhaft machen, dass durch die Verschmelzung die Erfüllung ihrer Forderung gefährdet wird."
    },
    {
      "date": "2025-08-05",
      "id": "119430",
      "original_text": "Löschungsankündigung\nHessen Amtsgericht Frankfurt am Main HRB 107820\nBOCA GmbH – Frankfurt am Main",
      "type": "Löschungsankündigung",
      "state": "Hessen",
      "amtsgericht": "Amtsgericht Frankfurt am Main",
      "registernummer": "HRB 107820",
      "registerart": "HRB",
      "company_name": "BOCA GmbH",
      "company_seat": "Frankfurt am Main",
      "details": "05.08.2025 (Bekanntmachungsdatum)\n\nHessen Amtsgericht Frankfurt am Main HRB 107820\nLöschungsankündigung 05.08.2025 (Eintragungsdatum)\n\nBOCA GmbH\nGesellschaft mit beschränkter Haftung\nFrankfurt am Main\n\nDas Registergericht beabsichtigt die im Handelsregister eingetragene Gesellschaft von Amts wegen nach § 394 FamFG zu löschen. Die Frist zur Erhebung eines Widerspruchs gegen die beabsichtigte Löschung wird auf 1 Monat festgesetzt."
    },
    {
      "date": "2025-08-05",
      "id": "119431",
      "original_text": "Registerbekanntmachung nach dem Umwandlungsgesetz\nHessen Amtsgericht Frankfurt am Main HRB 110797\nLE Quartier 200 GmbH – Frankfurt am Main",
      "type": "Registerbekanntmachung nach dem Umwandlungsgesetz",
      "state": "Hessen",
      "amtsgericht": "Amtsgericht Frankfurt am Main",
      "registernummer": "HRB 110797",
      "registerart": "HRB",
      "company_name": "LE Quartier 200 GmbH",
      "company_seat": "Frankfurt am Main",
      "details": "05.08.2025 (Bekanntmachungsdatum)\n\nHessen Amtsgericht Frankfurt am Main HRB 110797\nRegisterbekanntmachung nach dem Umwandlungsgesetz 05.08.2025 (Eintragungsdatum)\n\nLE Quartier 200 GmbH\nGesellschaft mit beschränkter Haftung\nFrankfurt am Main\n\nDen Gläubigern der an der Verschmelzung beteiligten Rechtsträger ist, wenn sie binnen sechs Monaten nach dem Tag, an dem die Eintragung der Verschmelzung in das Register des Sitzes desjenigen Rechtsträgers, dessen Gläubiger sie sind, nach § 19 Absatz 3 UmwG bekannt gemacht worden ist, ihren Anspruch nach Grund und Höhe schriftlich anmelden, Sicherheit zu leisten, soweit sie nicht Befriedigung verlangen können. Dieses Recht steht den Gläubigern jedoch nur zu, wenn sie glaubhaft machen, dass durch die Verschmelzung die Erfüllung ihrer Forderung gefährdet wird."
    },
    {
      "date": "2025-08-05",
      "id": "119432",
      "original_text": "Löschungsankündigung\nHessen Amtsgericht Darmstadt HRB 104320\nWestVision GmbH – Rüsselsheim",
      "type": "Löschungsankündigung",
      "state": "Hessen",
      "amtsgericht": "Amtsgericht Darmstadt",
      "registernummer": "HRB 104320",
      "registerart": "HRB",
      "company_name": "WestVision GmbH",
      "company_seat": "Rüsselsheim",
      "details": "05.08.2025 (Bekanntmachungsdatum)\n\nHessen Amtsgericht Darmstadt HRB 104320\nLöschungsankündigung\n\nWestVision GmbH\nGesellschaft mit beschränkter Haftung\nRüsselsheim\n\nDas Registergericht beabsichtigt die im Handelsregister eingetragene Gesellschaft von Amts wegen nach § 394 FamFG zu löschen. Die Frist zur Erhebung eines Widerspruchs gegen die beabsichtigte Löschung wird auf 3 Monate festgesetzt."
    },
    {
      "date": "2025-08-05",
      "id": "119433",
      "original_text": "Registerbekanntmachung nach dem Umwandlungsgesetz\nHessen Amtsgericht Marburg HRB 5453\nREC Engineering GmbH – Breidenbach",
      "type": "Registerbekanntmachung nach dem Umwandlungsgesetz",
      "state": "Hessen",
      "amtsgericht": "Amtsgericht Marburg",
      "registernummer": "HRB 5453",
      "registerart": "HRB",
      "company_name": "REC Engineering GmbH",
      "company_seat": "Breidenbach",
      "details": "05.08.2025 (Bekanntmachungsdatum)\n\nHessen Amtsgericht Marburg HRB 5453\nRegisterbekanntmachung nach dem Umwandlungsgesetz 05.08.2025 (Eintragungsdatum)\n\nREC Engineering GmbH\nGesellschaft mit beschränkter Haftung\nBreidenbach\n\nDen Gläubigern der an der Verschmelzung beteiligten Rechtsträger ist, wenn sie binnen sechs Monaten nach dem Tag, an dem die Eintragung der Verschmelzung in das Register des Sitzes desjenigen Rechtsträgers, dessen Gläubiger sie sind, nach § 19 Absatz 3 UmwG bekannt gemacht worden ist, ihren Anspruch nach Grund und Höhe schriftlich anmelden, Sicherheit zu leisten, soweit sie nicht Befriedigung verlangen können. Dieses Recht steht den Gläubigern jedoch nur zu, wenn sie glaubhaft machen, dass durch die Verschmelzung die Erfüllung ihrer Forderung gefährdet wird."
    },
    {
      "date": "2025-08-05",
      "id": "119434",
      "original_text": "Registerbekanntmachung nach dem Umwandlungsgesetz\nHessen Amtsgericht Bad Homburg v.d.H. HRB 14471\nECO Operations GmbH – Bad Homburg v. d. Höhe",
      "type": "Registerbekanntmachung nach dem Umwandlungsgesetz",
      "state": "Hessen",
      "amtsgericht": "Amtsgericht Bad Homburg v.d.H.",
      "registernummer": "HRB 14471",
      "registerart": "HRB",
      "company_name": "ECO Operations GmbH",
      "company_seat": "Bad Homburg v. d. Höhe",
      "details": "05.08.2025 (Bekanntmachungsdatum)\n\nHessen Amtsgericht Bad Homburg v.d.H. HRB 14471\nRegisterbekanntmachung nach dem Umwandlungsgesetz 05.08.2025 (Eintragungsdatum)\n\nECO Operations GmbH\nGesellschaft mit beschränkter Haftung\nBad Homburg v. d. Höhe\n\nDen Gläubigern der an der Verschmelzung beteiligten Rechtsträger ist, wenn sie binnen sechs Monaten nach dem Tag, an dem die Eintragung der Verschmelzung in das Register des Sitzes desjenigen Rechtsträgers, dessen Gläubiger sie sind, nach § 19 Absatz 3 UmwG bekannt gemacht worden ist, ihren Anspruch nach Grund und Höhe schriftlich anmelden, Sicherheit zu leisten, soweit sie nicht Befriedigung verlangen können. Dieses Recht steht den Gläubigern jedoch nur zu, wenn sie glaubhaft machen, dass durch die Verschmelzung die Erfüllung ihrer Forderung gefährdet wird."
    },
    {
      "date": "2025-08-05",
      "id": "119435",
      "original_text": "Registerbekanntmachung nach dem Umwandlungsgesetz\nHessen Amtsgericht Darmstadt HRB 52307\nRhenus SMG GmbH – Ginsheim-Gustavsburg",
      "type": "Registerbekanntmachung nach dem Umwandlungsgesetz",
      "state": "Hessen",
      "amtsgericht": "Amtsgericht Darmstadt",
      "registernummer": "HRB 52307",
      "registerart": "HRB",
      "company_name": "Rhenus SMG GmbH",
      "company_seat": "Ginsheim-Gustavsburg",
      "details": "05.08.2025 (Bekanntmachungsdatum)\n\nHessen Amtsgericht Darmstadt HRB 52307\nRegisterbekanntmachung nach dem Umwandlungsgesetz 05.08.2025 (Eintragungsdatum)\n\nRhenus SMG GmbH\nGesellschaft mit beschränkter Haftung\nGinsheim-Gustavsburg\n\nDen Gläubigern der an der Verschmelzung beteiligten Rechtsträger ist, wenn sie binnen sechs Monaten nach dem Tag, an dem die Eintragung der Verschmelzung in das Register des Sitzes derjenigen Rechtsträger deren Gläubiger sie sind, nach § 19 Absatz 3 UmwG bekannt gemacht worden ist, ihren Anspruch nach Grund und Höhe schriftlich anmelden, Sicherheit zu leisten, soweit sie nicht Befriedigung verlangen können. Dieses Recht steht den Gläubigern jedoch nur zu, wenn sie glaubhaft machen, dass durch die Verschmelzung die Erfüllung ihrer Forderung gefährdet wird."
    },
    {
      "date": "2025-08-05",
      "id": "119436",
      "original_text": "Registerbekanntmachung nach dem Umwandlungsgesetz\nHessen Amtsgericht Wiesbaden HRB 25755\nAdmiral Beteiligungs Verwaltungs Invest GmbH – Wiesbaden",
      "type": "Registerbekanntmachung nach dem Umwandlungsgesetz",
      "state": "Hessen",
      "amtsgericht": "Amtsgericht Wiesbaden",
      "registernummer": "HRB 25755",
      "registerart": "HRB",
      "company_name": "Admiral Beteiligungs Verwaltungs Invest GmbH",
      "company_seat": "Wiesbaden",
      "details": "05.08.2025 (Bekanntmachungsdatum)\n\nHessen Amtsgericht Wiesbaden HRB 25755\nRegisterbekanntmachung nach dem Umwandlungsgesetz 05.08.2025 (Eintragungsdatum)\n\nAdmiral Beteiligungs Verwaltungs Invest GmbH\nGesellschaft mit beschränkter Haftung\nWiesbaden\n\nDen Gläubigern der an der Verschmelzung beteiligten Rechtsträger ist, wenn sie binnen sechs Monaten nach dem Tag, an dem die Eintragung der Verschmelzung in das Register des Sitzes derjenigen Rechtsträger deren Gläubiger sie sind, nach § 19 Absatz 3 UmwG bekannt gemacht worden ist, ihren Anspruch nach Grund und Höhe schriftlich anmelden, Sicherheit zu leisten, soweit sie nicht Befriedigung verlangen können. Dieses Recht steht den Gläubigern jedoch nur zu, wenn sie glaubhaft machen, dass durch die Verschmelzung die Erfüllung ihrer Forderung gefährdet wird."
    },
    {
      "date": "2025-08-05",
      "id": "119437",
      "original_text": "Löschungsankündigung\nHessen Amtsgericht Frankfurt am Main HRB 84117\nGrüner Halbmond Pflege- und Sozialdienste gemeinnützige GmbH – Frankfurt am Main",
      "type": "Löschungsankündigung",
      "state": "Hessen",
      "amtsgericht": "Amtsgericht Frankfurt am Main",
      "registernummer": "HRB 84117",
      "registerart": "HRB",
      "company_name": "Grüner Halbmond Pflege- und Sozialdienste gemeinnützige GmbH",
      "company_seat": "Frankfurt am Main",
      "details": "05.08.2025 (Bekanntmachungsdatum)\n\nHessen Amtsgericht Frankfurt am Main HRB 84117\nLöschungsankündigung 05.08.2025 (Eintragungsdatum)\n\nGrüner Halbmond Pflege- und Sozialdienste gemeinnützige GmbH\nGesellschaft mit beschränkter Haftung\nFrankfurt am Main\n\nDas Registergericht beabsichtigt die im Handelsregister eingetragene Gesellschaft von Amts wegen nach § 394 FamFG zu löschen. Die Frist zur Erhebung eines Widerspruchs gegen die beabsichtigte Löschung wird auf 1 Monat festgesetzt."
    },
    {
      "date": "2025-08-05",
      "id": "119438",
      "original_text": "Registerbekanntmachung nach dem Umwandlungsgesetz\nHessen Amtsgericht Bad Homburg v.d.H. HRB 14728\nPharmaplan GmbH – Bad Homburg v. d. Höhe",
      "type": "Registerbekanntmachung nach dem Umwandlungsgesetz",
      "state": "Hessen",
      "amtsgericht": "Amtsgericht Bad Homburg v.d.H.",
      "registernummer": "HRB 14728",
      "registerart": "HRB",
      "company_name": "Pharmaplan GmbH",
      "company_seat": "Bad Homburg v. d. Höhe",
      "details": "05.08.2025 (Bekanntmachungsdatum)\n\nHessen Amtsgericht Bad Homburg v.d.H. HRB 14728\nRegisterbekanntmachung nach dem Umwandlungsgesetz 05.08.2025 (Eintragungsdatum)\n\nPharmaplan GmbH\nGesellschaft mit beschränkter Haftung\nBad Homburg v. d. Höhe\n\nDen Gläubigern der an der Verschmelzung beteiligten Rechtsträger ist, wenn sie binnen sechs Monaten nach dem Tag, an dem die Eintragung der Verschmelzung in das Register des Sitzes desjenigen Rechtsträgers, dessen Gläubiger sie sind, nach § 19 Absatz 3 UmwG bekannt gemacht worden ist, ihren Anspruch nach Grund und Höhe schriftlich anmelden, Sicherheit zu leisten, soweit sie nicht Befriedigung verlangen können. Dieses Recht steht den Gläubigern jedoch nur zu, wenn sie glaubhaft machen, dass durch die Verschmelzung die Erfüllung ihrer Forderung gefährdet wird."
    },
    {
      "date": "2025-08-05",
      "id": "119439",
      "original_text": "Registerbekanntmachung nach dem Umwandlungsgesetz\nHessen Amtsgericht Frankfurt am Main HRB 28098\nDLG Markets GmbH – Frankfurt am Main",
      "type": "Registerbekanntmachung nach dem Umwandlungsgesetz",
      "state": "Hessen",
      "amtsgericht": "Amtsgericht Frankfurt am Main",
      "registernummer": "HRB 28098",
      "registerart": "HRB",
      "company_name": "DLG Markets GmbH",
      "company_seat": "Frankfurt am Main",
      "details": "05.08.2025 (Bekanntmachungsdatum)\n\nHessen Amtsgericht Frankfurt am Main HRB 28098\nRegisterbekanntmachung nach dem Umwandlungsgesetz 05.08.2025 (Eintragungsdatum)\n\nDLG Markets GmbH\nGesellschaft mit beschränkter Haftung\nFrankfurt am Main\n\nDen Gläubigern der an der Verschmelzung beteiligten Rechtsträger ist, wenn sie binnen sechs Monaten nach dem Tag, an dem die Eintragung der Verschmelzung in das Register des Sitzes desjenigen Rechtsträgers, dessen Gläubiger sie sind, nach § 19 Absatz 3 UmwG bekannt gemacht worden ist, ihren Anspruch nach Grund und Höhe schriftlich anmelden, Sicherheit zu leisten, soweit sie nicht Befriedigung verlangen können. Dieses Recht steht den Gläubigern jedoch nur zu, wenn sie glaubhaft machen, dass durch die Verschmelzung die Erfüllung ihrer Forderung gefährdet wird."
    },
    {
      "date": "2025-08-05",
      "id": "119440",
      "original_text": "Registerbekanntmachung nach dem Umwandlungsgesetz\nHessen Amtsgericht Frankfurt am Main HRB 110797\nLE Quartier 200 GmbH – Frankfurt am Main",
      "type": "Registerbekanntmachung nach dem Umwandlungsgesetz",
      "state": "Hessen",
      "amtsgericht": "Amtsgericht Frankfurt am Main",
      "registernummer": "HRB 110797",
      "registerart": "HRB",
      "company_name": "LE Quartier 200 GmbH",
      "company_seat": "Frankfurt am Main",
      "details": "05.08.2025 (Bekanntmachungsdatum)\n\nHessen Amtsgericht Frankfurt am Main HRB 110797\nRegisterbekanntmachung nach dem Umwandlungsgesetz 05.08.2025 (Eintragungsdatum)\n\nLE Quartier 200 GmbH\nGesellschaft mit beschränkter Haftung\nFrankfurt am Main\n\nDen Gläubigern der an der Verschmelzung beteiligten Rechtsträger ist, wenn sie binnen sechs Monaten nach dem Tag, an dem die Eintragung der Verschmelzung in das Register des Sitzes desjenigen Rechtsträgers, dessen Gläubiger sie sind, nach § 19 Absatz 3 UmwG bekannt gemacht worden ist, ihren Anspruch nach Grund und Höhe schriftlich anmelden, Sicherheit zu leisten, soweit sie nicht Befriedigung verlangen können. Dieses Recht steht den Gläubigern jedoch nur zu, wenn sie glaubhaft machen, dass durch die Verschmelzung die Erfüllung ihrer Forderung gefährdet wird."
    },
    {
      "date": "2025-08-05",
      "id": "119441",
      "original_text": "Einreichung neuer Dokumente\nHessen Amtsgericht Hanau HRB 11054\nKreiswerke Main-Kinzig GmbH – Gelnhausen",
      "type": "Einreichung neuer Dokumente",
      "state": "Hessen",
      "amtsgericht": "Amtsgericht Hanau",
      "registernummer": "HRB 11054",
      "registerart": "HRB",
      "company_name": "Kreiswerke Main-Kinzig GmbH",
      "company_seat": "Gelnhausen",
      "details": "05.08.2025 (Bekanntmachungsdatum)\n\nHessen Amtsgericht Hanau HRB 11054\nEinreichung neuer Dokumente\n\nKreiswerke Main-Kinzig GmbH\nGesellschaft mit beschränkter Haftung\nGelnhausen\n\nDurch eine Änderung in den Personen der Aufsichtsratsmitglieder ist eine Liste der Mitglieder des Aufsichtsrates zum Handelsregister eingereicht worden."
    },
    {
      "date": "2025-08-05",
      "id": "119442",
      "original_text": "Registerbekanntmachung nach dem Umwandlungsgesetz\nHessen Amtsgericht Frankfurt am Main HRB 110798\nHalle Quartier 1 GmbH – Frankfurt am Main",
      "type": "Registerbekanntmachung nach dem Umwandlungsgesetz",
      "state": "Hessen",
      "amtsgericht": "Amtsgericht Frankfurt am Main",
      "registernummer": "HRB 110798",
      "registerart": "HRB",
      "company_name": "Halle Quartier 1 GmbH",
      "company_seat": "Frankfurt am Main",
      "details": "05.08.2025 (Bekanntmachungsdatum)\n\nHessen Amtsgericht Frankfurt am Main HRB 110798\nRegisterbekanntmachung nach dem Umwandlungsgesetz 05.08.2025 (Eintragungsdatum)\n\nHalle Quartier 1 GmbH\nGesellschaft mit beschränkter Haftung\nFrankfurt am Main\n\nDen Gläubigern der an der Verschmelzung beteiligten Rechtsträger ist, wenn sie binnen sechs Monaten nach dem Tag, an dem die Eintragung der Verschmelzung in das Register des Sitzes desjenigen Rechtsträgers, dessen Gläubiger sie sind, nach § 19 Absatz 3 UmwG bekannt gemacht worden ist, ihren Anspruch nach Grund und Höhe schriftlich anmelden, Sicherheit zu leisten, soweit sie nicht Befriedigung verlangen können. Dieses Recht steht den Gläubigern jedoch nur zu, wenn sie glaubhaft machen, dass durch die Verschmelzung die Erfüllung ihrer Forderung gefährdet wird."
    },
    {
      "date": "2025-08-05",
      "id": "119443",
      "original_text": "Registerbekanntmachung nach dem Umwandlungsgesetz\nHessen Amtsgericht Frankfurt am Main HRB 110797\nLE Quartier 200 GmbH – Frankfurt am Main",
      "type": "Registerbekanntmachung nach dem Umwandlungsgesetz",
      "state": "Hessen",
      "amtsgericht": "Amtsgericht Frankfurt am Main",
      "registernummer": "HRB 110797",
      "registerart": "HRB",
      "company_name": "LE Quartier 200 GmbH",
      "company_seat": "Frankfurt am Main",
      "details": "05.08.2025 (Bekanntmachungsdatum)\n\nHessen Amtsgericht Frankfurt am Main HRB 110797\nRegisterbekanntmachung nach dem Umwandlungsgesetz 05.08.2025 (Eintragungsdatum)\n\nLE Quartier 200 GmbH\nGesellschaft mit beschränkter Haftung\nFrankfurt am Main\n\nDen Gläubigern der an der Verschmelzung beteiligten Rechtsträger ist, wenn sie binnen sechs Monaten nach dem Tag, an dem die Eintragung der Verschmelzung in das Register des Sitzes desjenigen Rechtsträgers, dessen Gläubiger sie sind, nach § 19 Absatz 3 UmwG bekannt gemacht worden ist, ihren Anspruch nach Grund und Höhe schriftlich anmelden, Sicherheit zu leisten, soweit sie nicht Befriedigung verlangen können. Dieses Recht steht den Gläubigern jedoch nur zu, wenn sie glaubhaft machen, dass durch die Verschmelzung die Erfüllung ihrer Forderung gefährdet wird."
    },
    {
      "date": "2025-08-05",
      "id": "119444",
      "original_text": "Sonstige Registerbekanntmachung\nHessen Amtsgericht Frankfurt am Main HRB 106287\nMainlevel Consulting AG – Eschborn",
      "type": "Sonstige Registerbekanntmachung",
      "state": "Hessen",
      "amtsgericht": "Amtsgericht Frankfurt am Main",
      "registernummer": "HRB 106287",
      "registerart": "HRB",
      "company_name": "Mainlevel Consulting AG",
      "company_seat": "Eschborn",
      "details": "05.08.2025 (Bekanntmachungsdatum)\n\nHessen Amtsgericht Frankfurt am Main HRB 106287\nSonstige Registerbekanntmachung 05.08.2025 (Eintragungsdatum)\n\nMainlevel Consulting AG\nAktiengesellschaft\nEschborn\n\nDurch eine Änderung in den Personen der Aufsichtsratsmitglieder ist eine Liste der Mitglieder des Aufsichtsrates zum Handelsregister eingereicht worden."
    },
    {
      "date": "2025-08-05",
      "id": "119445",
      "original_text": "Registerbekanntmachung nach dem Umwandlungsgesetz\nHessen Amtsgericht Frankfurt am Main HRB 90872\nDLG Service GmbH – Frankfurt am Main",
      "type": "Registerbekanntmachung nach dem Umwandlungsgesetz",
      "state": "Hessen",
      "amtsgericht": "Amtsgericht Frankfurt am Main",
      "registernummer": "HRB 90872",
      "registerart": "HRB",
      "company_name": "DLG Service GmbH",
      "company_seat": "Frankfurt am Main",
      "details": "05.08.2025 (Bekanntmachungsdatum)\n\nHessen Amtsgericht Frankfurt am Main HRB 90872\nRegisterbekanntmachung nach dem Umwandlungsgesetz 05.08.2025 (Eintragungsdatum)\n\nDLG Service GmbH\nGesellschaft mit beschränkter Haftung\nFrankfurt am Main\n\nDen Gläubigern der an der Verschmelzung beteiligten Rechtsträger ist, wenn sie binnen sechs Monaten nach dem Tag, an dem die Eintragung der Verschmelzung in das Register des Sitzes desjenigen Rechtsträgers, dessen Gläubiger sie sind, nach § 19 Absatz 3 UmwG bekannt gemacht worden ist, ihren Anspruch nach Grund und Höhe schriftlich anmelden, Sicherheit zu leisten, soweit sie nicht Befriedigung verlangen können. Dieses Recht steht den Gläubigern jedoch nur zu, wenn sie glaubhaft machen, dass durch die Verschmelzung die Erfüllung ihrer Forderung gefährdet wird."
    },
    {
      "date": "2025-08-05",
      "id": "119446",
      "original_text": "Registerbekanntmachung nach dem Umwandlungsgesetz\nHessen Amtsgericht Frankfurt am Main HRB 110797\nLE Quartier 200 GmbH – Frankfurt am Main",
      "type": "Registerbekanntmachung nach dem Umwandlungsgesetz",
      "state": "Hessen",
      "amtsgericht": "Amtsgericht Frankfurt am Main",
      "registernummer": "HRB 110797",
      "registerart": "HRB",
      "company_name": "LE Quartier 200 GmbH",
      "company_seat": "Frankfurt am Main",
      "details": "05.08.2025 (Bekanntmachungsdatum)\n\nHessen Amtsgericht Frankfurt am Main HRB 110797\nRegisterbekanntmachung nach dem Umwandlungsgesetz 05.08.2025 (Eintragungsdatum)\n\nLE Quartier 200 GmbH\nGesellschaft mit beschränkter Haftung\nFrankfurt am Main\n\nDen Gläubigern der an der Verschmelzung beteiligten Rechtsträger ist, wenn sie binnen sechs Monaten nach dem Tag, an dem die Eintragung der Verschmelzung in das Register des Sitzes desjenigen Rechtsträgers, dessen Gläubiger sie sind, nach § 19 Absatz 3 UmwG bekannt gemacht worden ist, ihren Anspruch nach Grund und Höhe schriftlich anmelden, Sicherheit zu leisten, soweit sie nicht Befriedigung verlangen können. Dieses Recht steht den Gläubigern jedoch nur zu, wenn sie glaubhaft machen, dass durch die Verschmelzung die Erfüllung ihrer Forderung gefährdet wird."
    },
    {
      "date": "2025-08-05",
      "id": "119447",
      "original_text": "Registerbekanntmachung nach dem Umwandlungsgesetz\nHessen Amtsgericht Frankfurt am Main HRB 110797\nLE Quartier 200 GmbH – Frankfurt am Main",
      "type": "Registerbekanntmachung nach dem Umwandlungsgesetz",
      "state": "Hessen",
      "amtsgericht": "Amtsgericht Frankfurt am Main",
      "registernummer": "HRB 110797",
      "registerart": "HRB",
      "company_name": "LE Quartier 200 GmbH",
      "company_seat": "Frankfurt am Main",
      "details": "05.08.2025 (Bekanntmachungsdatum)\n\nHessen Amtsgericht Frankfurt am Main HRB 110797\nRegisterbekanntmachung nach dem Umwandlungsgesetz 05.08.2025 (Eintragungsdatum)\n\nLE Quartier 200 GmbH\nGesellschaft mit beschränkter Haftung\nFrankfurt am Main\n\nDen Gläubigern der an der Verschmelzung beteiligten Rechtsträger ist, wenn sie binnen sechs Monaten nach dem Tag, an dem die Eintragung der Verschmelzung in das Register des Sitzes desjenigen Rechtsträgers, dessen Gläubiger sie sind, nach § 19 Absatz 3 UmwG bekannt gemacht worden ist, ihren Anspruch nach Grund und Höhe schriftlich anmelden, Sicherheit zu leisten, soweit sie nicht Befriedigung verlangen können. Dieses Recht steht den Gläubigern jedoch nur zu, wenn sie glaubhaft machen, dass durch die Verschmelzung die Erfüllung ihrer Forderung gefährdet wird."
    },
    {
      "date": "2025-08-05",
      "id": "119448",
      "original_text": "Registerbekanntmachung nach dem Umwandlungsgesetz\nHessen Amtsgericht Frankfurt am Main HRB 110797\nLE Quartier 200 GmbH – Frankfurt am Main",
      "type": "Registerbekanntmachung nach dem Umwandlungsgesetz",
      "state": "Hessen",
      "amtsgericht": "Amtsgericht Frankfurt am Main",
      "registernummer": "HRB 110797",
      "registerart": "HRB",
      "company_name": "LE Quartier 200 GmbH",
      "company_seat": "Frankfurt am Main",
      "details": "05.08.2025 (Bekanntmachungsdatum)\n\nHessen Amtsgericht Frankfurt am Main HRB 110797\nRegisterbekanntmachung nach dem Umwandlungsgesetz 05.08.2025 (Eintragungsdatum)\n\nLE Quartier 200 GmbH\nGesellschaft mit beschränkter Haftung\nFrankfurt am Main\n\nDen Gläubigern der an der Verschmelzung beteiligten Rechtsträger ist, wenn sie binnen sechs Monaten nach dem Tag, an dem die Eintragung der Verschmelzung in das Register des Sitzes desjenigen Rechtsträgers, dessen Gläubiger sie sind, nach § 19 Absatz 3 UmwG bekannt gemacht worden ist, ihren Anspruch nach Grund und Höhe schriftlich anmelden, Sicherheit zu leisten, soweit sie nicht Befriedigung verlangen können. Dieses Recht steht den Gläubigern jedoch nur zu, wenn sie glaubhaft machen, dass durch die Verschmelzung die Erfüllung ihrer Forderung gefährdet wird."
    },
    {
      "date": "2025-08-05",
      "id": "119449",
      "original_text": "Sonstige Registerbekanntmachung\nHessen Amtsgericht Kassel VR 4884\nForum Solidarische Ökonomie e.V. – Kassel",
      "type": "Sonstige Registerbekanntmachung",
      "state": "Hessen",
      "amtsgericht": "Amtsgericht Kassel",
      "registernummer": "VR 4884",
      "registerart": "VR",
      "company_name": "Forum Solidarische Ökonomie e.V.",
      "company_seat": "Kassel",
      "details": "05.08.2025 (Bekanntmachungsdatum)\n\nHessen Amtsgericht Kassel VR 4884\nSonstige Registerbekanntmachung 05.08.2025 (Eintragungsdatum)\n\nForum Solidarische Ökonomie e.V.\neingetragener Verein\nKassel\n\nDer Verein ist aufgelöst."
    },
    {
      "date": "2025-08-05",
      "id": "119450",
      "original_text": "Registerbekanntmachung nach dem Umwandlungsgesetz\nHessen Amtsgericht Wiesbaden HRB 34073\nINKA Beteiligungsverwaltung GmbH – Wiesbaden",
      "type": "Registerbekanntmachung nach dem Umwandlungsgesetz",
      "state": "Hessen",
      "amtsgericht": "Amtsgericht Wiesbaden",
      "registernummer": "HRB 34073",
      "registerart": "HRB",
      "company_name": "INKA Beteiligungsverwaltung GmbH",
      "company_seat": "Wiesbaden",
      "details": "05.08.2025 (Bekanntmachungsdatum)\n\nHessen Amtsgericht Wiesbaden HRB 34073\nRegisterbekanntmachung nach dem Umwandlungsgesetz 05.08.2025 (Eintragungsdatum)\n\nINKA Beteiligungsverwaltung GmbH\nGesellschaft mit beschränkter Haftung\nWiesbaden\n\nDen Gläubigern der an der Verschmelzung beteiligten Rechtsträger ist, wenn sie binnen sechs Monaten nach dem Tag, an dem die Eintragung der Verschmelzung in das Register des Sitzes derjenigen Rechtsträger deren Gläubiger sie sind, nach § 19 Absatz 3 UmwG bekannt gemacht worden ist, ihren Anspruch nach Grund und Höhe schriftlich anmelden, Sicherheit zu leisten, soweit sie nicht Befriedigung verlangen können. Dieses Recht steht den Gläubigern jedoch nur zu, wenn sie glaubhaft machen, dass durch die Verschmelzung die Erfüllung ihrer Forderung gefährdet wird."
    }
  ]
}