{
  "date": "2025-08-12",
  "date_of_scrape": "2025-08-29T06:36:45.003Z",
  "tool_version": "0.2.0",
  "number_of_announcements": 232,
  "announcements": [
    {
      "date": "2025-08-12",
      "id": "120482",
      "original_text": "Registerbekanntmachung nach dem Umwandlungsgesetz\nBayern Amtsgericht München HRB 297144\nIgloo MidCo GmbH – München",
      "type": "Registerbekanntmachung nach dem Umwandlungsgesetz",
      "state": "Bayern",
      "amtsgericht": "Amtsgericht München",
      "registernummer": "HRB 297144",
      "registerart": "HRB",
      "company_name": "Igloo MidCo GmbH",
      "company_seat": "München",
      "details": "12.08.2025 (Bekanntmachungsdatum)\n\nBayern Amtsgericht München HRB 297144\nRegisterbekanntmachung nach dem Umwandlungsgesetz 11.08.2025 (Eintragungsdatum)\n\nIgloo MidCo GmbH\nGesellschaft mit beschränkter Haftung\nMünchen\n\nDen Gläubigern der an der Verschmelzung beteiligten Rechtsträger ist, wenn sie binnen sechs Monaten nach dem Tag, an dem die Eintragung der Verschmelzung in das Register des Sitzes desjenigen Rechtsträgers, dessen Gläubiger sie sind, nach § 19 Abs. 3 UmwG als bekannt gemacht gilt, ihren Anspruch nach Grund und Höhe in Textform anmelden, Sicherheit zu leisten, soweit sie nicht Befriedigung verlangen können. Dieses Recht steht den Gläubigern jedoch nur zu, wenn sie glaubhaft machen, dass durch die Verschmelzung die Erfüllung ihrer Forderung gefährdet wird."
    },
    {
      "date": "2025-08-12",
      "id": "120483",
      "original_text": "Registerbekanntmachung nach dem Umwandlungsgesetz\nBayern Amtsgericht München HRB 241230\nImmoBauConsult GmbH – München",
      "type": "Registerbekanntmachung nach dem Umwandlungsgesetz",
      "state": "Bayern",
      "amtsgericht": "Amtsgericht München",
      "registernummer": "HRB 241230",
      "registerart": "HRB",
      "company_name": "ImmoBauConsult GmbH",
      "company_seat": "München",
      "details": "12.08.2025 (Bekanntmachungsdatum)\n\nBayern Amtsgericht München HRB 241230\nRegisterbekanntmachung nach dem Umwandlungsgesetz 09.08.2025 (Eintragungsdatum)\n\nImmoBauConsult GmbH\nGesellschaft mit beschränkter Haftung\nMünchen\n\nDen Gläubigern der an der Verschmelzung beteiligten Rechtsträger ist, wenn sie binnen sechs Monaten nach dem Tag, an dem die Eintragung der Verschmelzung in das Register des Sitzes desjenigen Rechtsträgers, dessen Gläubiger sie sind, nach § 19 Abs. 3 UmwG als bekannt gemacht gilt, ihren Anspruch nach Grund und Höhe in Textform anmelden, Sicherheit zu leisten, soweit sie nicht Befriedigung verlangen können. Dieses Recht steht den Gläubigern jedoch nur zu, wenn sie glaubhaft machen, dass durch die Verschmelzung die Erfüllung ihrer Forderung gefährdet wird."
    },
    {
      "date": "2025-08-12",
      "id": "120484",
      "original_text": "Registerbekanntmachung nach dem Umwandlungsgesetz\nBayern Amtsgericht Fürth HRB 18562\nMR Immobilien GmbH – Seukendorf",
      "type": "Registerbekanntmachung nach dem Umwandlungsgesetz",
      "state": "Bayern",
      "amtsgericht": "Amtsgericht Fürth",
      "registernummer": "HRB 18562",
      "registerart": "HRB",
      "company_name": "MR Immobilien GmbH",
      "company_seat": "Seukendorf",
      "details": "12.08.2025 (Bekanntmachungsdatum)\n\nBayern Amtsgericht Fürth HRB 18562\nRegisterbekanntmachung nach dem Umwandlungsgesetz 11.08.2025 (Eintragungsdatum)\n\nMR Immobilien GmbH\nGesellschaft mit beschränkter Haftung\nSeukendorf\n\nDen Gläubigern der an der Verschmelzung beteiligten Rechtsträger ist, wenn sie binnen sechs Monaten nach dem Tag, an dem die Eintragung der Verschmelzung in das Register des Sitzes desjenigen Rechtsträgers, dessen Gläubiger sie sind, nach § 19 Abs. 3 UmwG als bekannt gemacht gilt, ihren Anspruch nach Grund und Höhe in Textform anmelden, Sicherheit zu leisten, soweit sie nicht Befriedigung verlangen können. Dieses Recht steht den Gläubigern jedoch nur zu, wenn sie glaubhaft machen, dass durch die Verschmelzung die Erfüllung ihrer Forderung gefährdet wird."
    },
    {
      "date": "2025-08-12",
      "id": "120485",
      "original_text": "Einreichung neuer Dokumente\nBayern Amtsgericht München HRB 154102\nMünchen Klinik gGmbH – München",
      "type": "Einreichung neuer Dokumente",
      "state": "Bayern",
      "amtsgericht": "Amtsgericht München",
      "registernummer": "HRB 154102",
      "registerart": "HRB",
      "company_name": "München Klinik gGmbH",
      "company_seat": "München",
      "details": "12.08.2025 (Bekanntmachungsdatum)\n\nBayern Amtsgericht München HRB 154102\nEinreichung neuer Dokumente 11.08.2025 (Eintragungsdatum)\n\nMünchen Klinik gGmbH\nGesellschaft mit beschränkter Haftung\nMünchen\n\nDem Amtsgericht München -Registergericht- ist eine Liste der Mitglieder des Aufsichtsrats eingereicht worden, § 52 Abs. 3 S. 2 GmbHG."
    },
    {
      "date": "2025-08-12",
      "id": "120486",
      "original_text": "Registerbekanntmachung nach dem Umwandlungsgesetz\nBayern Amtsgericht München HRB 153178\nZwergenträume Spielwaren Vertriebs GmbH – Baierbrunn",
      "type": "Registerbekanntmachung nach dem Umwandlungsgesetz",
      "state": "Bayern",
      "amtsgericht": "Amtsgericht München",
      "registernummer": "HRB 153178",
      "registerart": "HRB",
      "company_name": "Zwergenträume Spielwaren Vertriebs GmbH",
      "company_seat": "Baierbrunn",
      "details": "12.08.2025 (Bekanntmachungsdatum)\n\nBayern Amtsgericht München HRB 153178\nRegisterbekanntmachung nach dem Umwandlungsgesetz 11.08.2025 (Eintragungsdatum)\n\nZwergenträume Spielwaren Vertriebs GmbH\nGesellschaft mit beschränkter Haftung\nBaierbrunn\n\nDen Gläubigern der an der Verschmelzung beteiligten Rechtsträger ist, wenn sie binnen sechs Monaten nach dem Tag, an dem die Eintragung der Verschmelzung in das Register des Sitzes desjenigen Rechtsträgers, dessen Gläubiger sie sind, nach § 19 Abs. 3 UmwG als bekannt gemacht gilt, ihren Anspruch nach Grund und Höhe in Textform anmelden, Sicherheit zu leisten, soweit sie nicht Befriedigung verlangen können. Dieses Recht steht den Gläubigern jedoch nur zu, wenn sie glaubhaft machen, dass durch die Verschmelzung die Erfüllung ihrer Forderung gefährdet wird."
    },
    {
      "date": "2025-08-12",
      "id": "120487",
      "original_text": "Registerbekanntmachung nach dem Umwandlungsgesetz\nBayern Amtsgericht Aschaffenburg HRB 2380\nRenostar GmbH – Großwallstadt",
      "type": "Registerbekanntmachung nach dem Umwandlungsgesetz",
      "state": "Bayern",
      "amtsgericht": "Amtsgericht Aschaffenburg",
      "registernummer": "HRB 2380",
      "registerart": "HRB",
      "company_name": "Renostar GmbH",
      "company_seat": "Großwallstadt",
      "details": "12.08.2025 (Bekanntmachungsdatum)\n\nBayern Amtsgericht Aschaffenburg HRB 2380\nRegisterbekanntmachung nach dem Umwandlungsgesetz 11.08.2025 (Eintragungsdatum)\n\nRenostar GmbH\nGesellschaft mit beschränkter Haftung\nGroßwallstadt\n\nDen Gläubigern der an der Verschmelzung beteiligten Rechtsträger ist, wenn sie binnen sechs Monaten nach dem Tag, an dem die Eintragung der Verschmelzung in das Register des Sitzes desjenigen Rechtsträgers, dessen Gläubiger sie sind, nach § 19 Abs. 3 UmwG als bekannt gemacht gilt, ihren Anspruch nach Grund und Höhe in Textform anmelden, Sicherheit zu leisten, soweit sie nicht Befriedigung verlangen können. Dieses Recht steht den Gläubigern jedoch nur zu, wenn sie glaubhaft machen, dass durch die Verschmelzung die Erfüllung ihrer Forderung gefährdet wird."
    },
    {
      "date": "2025-08-12",
      "id": "120488",
      "original_text": "Registerbekanntmachung nach dem Umwandlungsgesetz\nBayern Amtsgericht Fürth HRB 20988\nD2J Immo GmbH – Erlangen",
      "type": "Registerbekanntmachung nach dem Umwandlungsgesetz",
      "state": "Bayern",
      "amtsgericht": "Amtsgericht Fürth",
      "registernummer": "HRB 20988",
      "registerart": "HRB",
      "company_name": "D2J Immo GmbH",
      "company_seat": "Erlangen",
      "details": "12.08.2025 (Bekanntmachungsdatum)\n\nBayern Amtsgericht Fürth HRB 20988\nRegisterbekanntmachung nach dem Umwandlungsgesetz 11.08.2025 (Eintragungsdatum)\n\nD2J Immo GmbH\nGesellschaft mit beschränkter Haftung\nErlangen\n\nDen Gläubigern der an der Verschmelzung beteiligten Rechtsträger ist, wenn sie binnen sechs Monaten nach dem Tag, an dem die Eintragung der Verschmelzung in das Register des Sitzes desjenigen Rechtsträgers, dessen Gläubiger sie sind, nach § 19 Abs. 3 UmwG als bekannt gemacht gilt, ihren Anspruch nach Grund und Höhe in Textform anmelden, Sicherheit zu leisten, soweit sie nicht Befriedigung verlangen können. Dieses Recht steht den Gläubigern jedoch nur zu, wenn sie glaubhaft machen, dass durch die Verschmelzung die Erfüllung ihrer Forderung gefährdet wird."
    },
    {
      "date": "2025-08-12",
      "id": "120489",
      "original_text": "Registerbekanntmachung nach dem Umwandlungsgesetz\nBayern Amtsgericht Kempten (Allgäu) HRB 8208\nKunststofftechnik Bernt GmbH – Kaufbeuren",
      "type": "Registerbekanntmachung nach dem Umwandlungsgesetz",
      "state": "Bayern",
      "amtsgericht": "Amtsgericht Kempten (Allgäu)",
      "registernummer": "HRB 8208",
      "registerart": "HRB",
      "company_name": "Kunststofftechnik Bernt GmbH",
      "company_seat": "Kaufbeuren",
      "details": "12.08.2025 (Bekanntmachungsdatum)\n\nBayern Amtsgericht Kempten (Allgäu) HRB 8208\nRegisterbekanntmachung nach dem Umwandlungsgesetz 11.08.2025 (Eintragungsdatum)\n\nKunststofftechnik Bernt GmbH\nGesellschaft mit beschränkter Haftung\nKaufbeuren\n\nDen Gläubigern der an der Verschmelzung beteiligten Rechtsträger ist, wenn sie binnen sechs Monaten nach dem Tag, an dem die Eintragung der Verschmelzung in das Register des Sitzes desjenigen Rechtsträgers, dessen Gläubiger sie sind, nach § 19 Abs. 3 UmwG als bekannt gemacht gilt, ihren Anspruch nach Grund und Höhe in Textform anmelden, Sicherheit zu leisten, soweit sie nicht Befriedigung verlangen können. Dieses Recht steht den Gläubigern jedoch nur zu, wenn sie glaubhaft machen, dass durch die Verschmelzung die Erfüllung ihrer Forderung gefährdet wird."
    },
    {
      "date": "2025-08-12",
      "id": "120490",
      "original_text": "Registerbekanntmachung nach dem Umwandlungsgesetz\nBayern Amtsgericht Fürth HRB 18953\nD2J GmbH – Erlangen",
      "type": "Registerbekanntmachung nach dem Umwandlungsgesetz",
      "state": "Bayern",
      "amtsgericht": "Amtsgericht Fürth",
      "registernummer": "HRB 18953",
      "registerart": "HRB",
      "company_name": "D2J GmbH",
      "company_seat": "Erlangen",
      "details": "12.08.2025 (Bekanntmachungsdatum)\n\nBayern Amtsgericht Fürth HRB 18953\nRegisterbekanntmachung nach dem Umwandlungsgesetz 11.08.2025 (Eintragungsdatum)\n\nD2J GmbH\nGesellschaft mit beschränkter Haftung\nErlangen\n\nDen Gläubigern der an der Verschmelzung beteiligten Rechtsträger ist, wenn sie binnen sechs Monaten nach dem Tag, an dem die Eintragung der Verschmelzung in das Register des Sitzes desjenigen Rechtsträgers, dessen Gläubiger sie sind, nach § 19 Abs. 3 UmwG als bekannt gemacht gilt, ihren Anspruch nach Grund und Höhe in Textform anmelden, Sicherheit zu leisten, soweit sie nicht Befriedigung verlangen können. Dieses Recht steht den Gläubigern jedoch nur zu, wenn sie glaubhaft machen, dass durch die Verschmelzung die Erfüllung ihrer Forderung gefährdet wird."
    },
    {
      "date": "2025-08-12",
      "id": "120491",
      "original_text": "Einreichung neuer Dokumente\nBayern Amtsgericht München HRB 254403\nsdm SE – München",
      "type": "Einreichung neuer Dokumente",
      "state": "Bayern",
      "amtsgericht": "Amtsgericht München",
      "registernummer": "HRB 254403",
      "registerart": "HRB",
      "company_name": "sdm SE",
      "company_seat": "München",
      "details": "12.08.2025 (Bekanntmachungsdatum)\n\nBayern Amtsgericht München HRB 254403\nEinreichung neuer Dokumente 04.08.2025 (Eintragungsdatum)\n\nsdm SE\nEuropäische Aktiengesellschaft (SE)\nMünchen\n\nDem Amtsgericht München -Registergericht- ist eine Liste der Mitglieder des Aufsichtsrats eingereicht worden, Art. 9 Abs. 1 Buchst. c (ii) SE-VO i.V.m. § 106 AktG."
    },
    {
      "date": "2025-08-12",
      "id": "120492",
      "original_text": "Registerbekanntmachung nach dem Umwandlungsgesetz\nBayern Amtsgericht Fürth HRB 1457\nAutohaus Konrad GmbH – Erlangen",
      "type": "Registerbekanntmachung nach dem Umwandlungsgesetz",
      "state": "Bayern",
      "amtsgericht": "Amtsgericht Fürth",
      "registernummer": "HRB 1457",
      "registerart": "HRB",
      "company_name": "Autohaus Konrad GmbH",
      "company_seat": "Erlangen",
      "details": "12.08.2025 (Bekanntmachungsdatum)\n\nBayern Amtsgericht Fürth HRB 1457\nRegisterbekanntmachung nach dem Umwandlungsgesetz 11.08.2025 (Eintragungsdatum)\n\nAutohaus Konrad GmbH\nGesellschaft mit beschränkter Haftung\nErlangen\n\nDen Gläubigern der an der Verschmelzung beteiligten Rechtsträger ist, wenn sie binnen sechs Monaten nach dem Tag, an dem die Eintragung der Verschmelzung in das Register des Sitzes desjenigen Rechtsträgers, dessen Gläubiger sie sind, nach § 19 Abs. 3 UmwG als bekannt gemacht gilt, ihren Anspruch nach Grund und Höhe in Textform anmelden, Sicherheit zu leisten, soweit sie nicht Befriedigung verlangen können. Dieses Recht steht den Gläubigern jedoch nur zu, wenn sie glaubhaft machen, dass durch die Verschmelzung die Erfüllung ihrer Forderung gefährdet wird."
    },
    {
      "date": "2025-08-12",
      "id": "120493",
      "original_text": "Registerbekanntmachung nach dem Umwandlungsgesetz\nBayern Amtsgericht München HRB 107753\nGENZEHOF Betriebs GmbH – Berg",
      "type": "Registerbekanntmachung nach dem Umwandlungsgesetz",
      "state": "Bayern",
      "amtsgericht": "Amtsgericht München",
      "registernummer": "HRB 107753",
      "registerart": "HRB",
      "company_name": "GENZEHOF Betriebs GmbH",
      "company_seat": "Berg",
      "details": "12.08.2025 (Bekanntmachungsdatum)\n\nBayern Amtsgericht München HRB 107753\nRegisterbekanntmachung nach dem Umwandlungsgesetz 11.08.2025 (Eintragungsdatum)\n\nGENZEHOF Betriebs GmbH\nGesellschaft mit beschränkter Haftung\nBerg\n\nDen Gläubigern der an der Verschmelzung beteiligten Rechtsträger ist, wenn sie binnen sechs Monaten nach dem Tag, an dem die Eintragung der Verschmelzung in das Register des Sitzes desjenigen Rechtsträgers, dessen Gläubiger sie sind, nach § 19 Abs. 3 UmwG als bekannt gemacht gilt, ihren Anspruch nach Grund und Höhe in Textform anmelden, Sicherheit zu leisten, soweit sie nicht Befriedigung verlangen können. Dieses Recht steht den Gläubigern jedoch nur zu, wenn sie glaubhaft machen, dass durch die Verschmelzung die Erfüllung ihrer Forderung gefährdet wird."
    },
    {
      "date": "2025-08-12",
      "id": "120494",
      "original_text": "Einreichung neuer Dokumente\nBayern Amtsgericht Hof HRB 3290\nSWW Wunsiedel GmbH – Wunsiedel",
      "type": "Einreichung neuer Dokumente",
      "state": "Bayern",
      "amtsgericht": "Amtsgericht Hof",
      "registernummer": "HRB 3290",
      "registerart": "HRB",
      "company_name": "SWW Wunsiedel GmbH",
      "company_seat": "Wunsiedel",
      "details": "12.08.2025 (Bekanntmachungsdatum)\n\nBayern Amtsgericht Hof HRB 3290\nEinreichung neuer Dokumente\n\nSWW Wunsiedel GmbH\nGesellschaft mit beschränkter Haftung\nWunsiedel\n\nDem Amtsgericht Hof -Registergericht- ist eine Liste der Mitglieder des Aufsichtsrats eingereicht worden, § 52 Abs. 3 S. 2 GmbHG."
    },
    {
      "date": "2025-08-12",
      "id": "120495",
      "original_text": "Registerbekanntmachung nach dem Umwandlungsgesetz\nBayern Amtsgericht München HRB 166404\neasy Abo GmbH – Starnberg",
      "type": "Registerbekanntmachung nach dem Umwandlungsgesetz",
      "state": "Bayern",
      "amtsgericht": "Amtsgericht München",
      "registernummer": "HRB 166404",
      "registerart": "HRB",
      "company_name": "easy Abo GmbH",
      "company_seat": "Starnberg",
      "details": "12.08.2025 (Bekanntmachungsdatum)\n\nBayern Amtsgericht München HRB 166404\nRegisterbekanntmachung nach dem Umwandlungsgesetz 11.08.2025 (Eintragungsdatum)\n\neasy Abo GmbH\nGesellschaft mit beschränkter Haftung\nStarnberg\n\nDen Gläubigern der an der Verschmelzung beteiligten Rechtsträger ist, wenn sie binnen sechs Monaten nach dem Tag, an dem die Eintragung der Verschmelzung in das Register des Sitzes desjenigen Rechtsträgers, dessen Gläubiger sie sind, nach § 19 Abs. 3 UmwG als bekannt gemacht gilt, ihren Anspruch nach Grund und Höhe in Textform anmelden, Sicherheit zu leisten, soweit sie nicht Befriedigung verlangen können. Dieses Recht steht den Gläubigern jedoch nur zu, wenn sie glaubhaft machen, dass durch die Verschmelzung die Erfüllung ihrer Forderung gefährdet wird."
    },
    {
      "date": "2025-08-12",
      "id": "120496",
      "original_text": "Registerbekanntmachung nach dem Umwandlungsgesetz\nBayern Amtsgericht Fürth HRB 19631\nMR Immobilienprojekte UG (haftungsbeschränkt) – Seukendorf",
      "type": "Registerbekanntmachung nach dem Umwandlungsgesetz",
      "state": "Bayern",
      "amtsgericht": "Amtsgericht Fürth",
      "registernummer": "HRB 19631",
      "registerart": "HRB",
      "company_name": "MR Immobilienprojekte UG (haftungsbeschränkt)",
      "company_seat": "Seukendorf",
      "details": "12.08.2025 (Bekanntmachungsdatum)\n\nBayern Amtsgericht Fürth HRB 19631\nRegisterbekanntmachung nach dem Umwandlungsgesetz 11.08.2025 (Eintragungsdatum)\n\nMR Immobilienprojekte UG (haftungsbeschränkt)\nGesellschaft mit beschränkter Haftung\nSeukendorf\n\nDen Gläubigern der an der Verschmelzung beteiligten Rechtsträger ist, wenn sie binnen sechs Monaten nach dem Tag, an dem die Eintragung der Verschmelzung in das Register des Sitzes desjenigen Rechtsträgers, dessen Gläubiger sie sind, nach § 19 Abs. 3 UmwG als bekannt gemacht gilt, ihren Anspruch nach Grund und Höhe in Textform anmelden, Sicherheit zu leisten, soweit sie nicht Befriedigung verlangen können. Dieses Recht steht den Gläubigern jedoch nur zu, wenn sie glaubhaft machen, dass durch die Verschmelzung die Erfüllung ihrer Forderung gefährdet wird."
    },
    {
      "date": "2025-08-12",
      "id": "120497",
      "original_text": "Registerbekanntmachung nach dem Umwandlungsgesetz\nBayern Amtsgericht Landshut HRB 5144\nWalter Hallschmid GmbH – Arnstorf",
      "type": "Registerbekanntmachung nach dem Umwandlungsgesetz",
      "state": "Bayern",
      "amtsgericht": "Amtsgericht Landshut",
      "registernummer": "HRB 5144",
      "registerart": "HRB",
      "company_name": "Walter Hallschmid GmbH",
      "company_seat": "Arnstorf",
      "details": "12.08.2025 (Bekanntmachungsdatum)\n\nBayern Amtsgericht Landshut HRB 5144\nRegisterbekanntmachung nach dem Umwandlungsgesetz 11.08.2025 (Eintragungsdatum)\n\nWalter Hallschmid GmbH\nGesellschaft mit beschränkter Haftung\nArnstorf\n\nDen Gläubigern der an der Verschmelzung beteiligten Rechtsträger ist, wenn sie binnen sechs Monaten nach dem Tag, an dem die Eintragung der Verschmelzung in das Register des Sitzes desjenigen Rechtsträgers, dessen Gläubiger sie sind, nach § 19 Abs. 3 UmwG als bekannt gemacht gilt, ihren Anspruch nach Grund und Höhe in Textform anmelden, Sicherheit zu leisten, soweit sie nicht Befriedigung verlangen können. Dieses Recht steht den Gläubigern jedoch nur zu, wenn sie glaubhaft machen, dass durch die Verschmelzung die Erfüllung ihrer Forderung gefährdet wird."
    },
    {
      "date": "2025-08-12",
      "id": "120498",
      "original_text": "Löschungsankündigung\nBayern Amtsgericht München HRB 278717\nHeir Investigation Munich GmbH – München",
      "type": "Löschungsankündigung",
      "state": "Bayern",
      "amtsgericht": "Amtsgericht München",
      "registernummer": "HRB 278717",
      "registerart": "HRB",
      "company_name": "Heir Investigation Munich GmbH",
      "company_seat": "München",
      "details": "12.08.2025 (Bekanntmachungsdatum)\n\nBayern Amtsgericht München HRB 278717\nDie Registerbekanntmachung ist nachträglich am 27.08.2025 um 02:00 Uhr gelöscht worden.\nWegen der Einzelheiten und näherer Auskünfte wenden Sie sich bitte an das Amtsgericht München ."
    },
    {
      "date": "2025-08-12",
      "id": "120499",
      "original_text": "Löschungsankündigung\nBayern Amtsgericht Würzburg HRB 15545\nWH Holding UG (haftungsbeschränkt) – Kitzingen",
      "type": "Löschungsankündigung",
      "state": "Bayern",
      "amtsgericht": "Amtsgericht Würzburg",
      "registernummer": "HRB 15545",
      "registerart": "HRB",
      "company_name": "WH Holding UG (haftungsbeschränkt)",
      "company_seat": "Kitzingen",
      "details": "12.08.2025 (Bekanntmachungsdatum)\n\nBayern Amtsgericht Würzburg HRB 15545\nLöschungsankündigung\n\nWH Holding UG (haftungsbeschränkt)\nGesellschaft mit beschränkter Haftung\nKitzingen\n\nDas Registergericht beabsichtigt, die im Handelsregister eingetragene Gesellschaft wegen Vermögenslosigkeit von Amts wegen nach § 394 FamFG zu löschen. Die Frist zur Erhebung eines Widerspruchs ist auf drei Monate festgesetzt."
    },
    {
      "date": "2025-08-12",
      "id": "120500",
      "original_text": "Einreichung neuer Dokumente\nBayern Amtsgericht Kempten (Allgäu) HRB 9903\nStremler AG – Lindau (B)",
      "type": "Einreichung neuer Dokumente",
      "state": "Bayern",
      "amtsgericht": "Amtsgericht Kempten (Allgäu)",
      "registernummer": "HRB 9903",
      "registerart": "HRB",
      "company_name": "Stremler AG",
      "company_seat": "Lindau (B)",
      "details": "12.08.2025 (Bekanntmachungsdatum)\n\nBayern Amtsgericht Kempten (Allgäu) HRB 9903\nEinreichung neuer Dokumente 11.08.2025 (Eintragungsdatum)\n\nStremler AG\nAktiengesellschaft\nLindau (B)\n\nDem Amtsgericht Kempten (Allgäu) -Registergericht- ist eine Liste der Mitglieder des Aufsichtsrats eingereicht worden, § 106 AktG."
    },
    {
      "date": "2025-08-12",
      "id": "120501",
      "original_text": "Löschungsankündigung\nBayern Amtsgericht München HRB 221183\nElectronX4U GmbH – München",
      "type": "Löschungsankündigung",
      "state": "Bayern",
      "amtsgericht": "Amtsgericht München",
      "registernummer": "HRB 221183",
      "registerart": "HRB",
      "company_name": "ElectronX4U GmbH",
      "company_seat": "München",
      "details": "12.08.2025 (Bekanntmachungsdatum)\n\nBayern Amtsgericht München HRB 221183\nLöschungsankündigung 11.08.2025 (Eintragungsdatum)\n\nElectronX4U GmbH\nGesellschaft mit beschränkter Haftung\nMünchen\n\nDas Registergericht beabsichtigt, die im Handelsregister eingetragene Gesellschaft wegen Vermögenslosigkeit von Amts wegen nach § 394 FamFG zu löschen. Die Frist zur Erhebung eines Widerspruchs ist auf drei Monate festgesetzt."
    },
    {
      "date": "2025-08-12",
      "id": "120502",
      "original_text": "Registerbekanntmachung nach dem Umwandlungsgesetz\nBayern Amtsgericht München HRB 196076\nWealthCap Fonds GmbH – München",
      "type": "Registerbekanntmachung nach dem Umwandlungsgesetz",
      "state": "Bayern",
      "amtsgericht": "Amtsgericht München",
      "registernummer": "HRB 196076",
      "registerart": "HRB",
      "company_name": "WealthCap Fonds GmbH",
      "company_seat": "München",
      "details": "12.08.2025 (Bekanntmachungsdatum)\n\nBayern Amtsgericht München HRB 196076\nRegisterbekanntmachung nach dem Umwandlungsgesetz 11.08.2025 (Eintragungsdatum)\n\nWealthCap Fonds GmbH\nGesellschaft mit beschränkter Haftung\nMünchen\n\nDen Gläubigern der an der Verschmelzung beteiligten Rechtsträger ist, wenn sie binnen sechs Monaten nach dem Tag, an dem die Eintragung der Verschmelzung in das Register des Sitzes desjenigen Rechtsträgers, dessen Gläubiger sie sind, nach § 19 Abs. 3 UmwG als bekannt gemacht gilt, ihren Anspruch nach Grund und Höhe in Textform anmelden, Sicherheit zu leisten, soweit sie nicht Befriedigung verlangen können. Dieses Recht steht den Gläubigern jedoch nur zu, wenn sie glaubhaft machen, dass durch die Verschmelzung die Erfüllung ihrer Forderung gefährdet wird."
    },
    {
      "date": "2025-08-12",
      "id": "120503",
      "original_text": "Registerbekanntmachung nach dem Umwandlungsgesetz\nBayern Amtsgericht Augsburg HRB 40896\nErnst & Kollegen Immobilien GmbH – Nördlingen",
      "type": "Registerbekanntmachung nach dem Umwandlungsgesetz",
      "state": "Bayern",
      "amtsgericht": "Amtsgericht Augsburg",
      "registernummer": "HRB 40896",
      "registerart": "HRB",
      "company_name": "Ernst & Kollegen Immobilien GmbH",
      "company_seat": "Nördlingen",
      "details": "12.08.2025 (Bekanntmachungsdatum)\n\nBayern Amtsgericht Augsburg HRB 40896\nRegisterbekanntmachung nach dem Umwandlungsgesetz 11.08.2025 (Eintragungsdatum)\n\nErnst & Kollegen Immobilien GmbH\nGesellschaft mit beschränkter Haftung\nNördlingen\n\nDen Gläubigern der an der Ausgliederung beteiligten Rechtsträger ist, wenn sie binnen sechs Monaten nach dem Tag, an dem die Eintragung der Ausgliederung in das Register des Sitzes desjenigen Rechtsträgers, dessen Gläubiger sie sind, nach §§ 125, 19 Abs. 3 UmwG als bekannt gemacht gilt, ihren Anspruch nach Grund und Höhe in Textform anmelden, Sicherheit zu leisten, soweit sie nicht Befriedigung verlangen können. Dieses Recht steht den Gläubigern jedoch nur zu, wenn sie glaubhaft machen, dass durch die Ausgliederung die Erfüllung ihrer Forderung gefährdet wird."
    },
    {
      "date": "2025-08-12",
      "id": "120504",
      "original_text": "Registerbekanntmachung nach dem Umwandlungsgesetz\nBayern Amtsgericht Bayreuth HRA 4961\nRöttgen Verwaltungs GmbH & Co. KG – Untersteinach",
      "type": "Registerbekanntmachung nach dem Umwandlungsgesetz",
      "state": "Bayern",
      "amtsgericht": "Amtsgericht Bayreuth",
      "registernummer": "HRA 4961",
      "registerart": "HRA",
      "company_name": "Röttgen Verwaltungs GmbH & Co. KG",
      "company_seat": "Untersteinach",
      "details": "12.08.2025 (Bekanntmachungsdatum)\n\nBayern Amtsgericht Bayreuth HRA 4961\nRegisterbekanntmachung nach dem Umwandlungsgesetz 11.08.2025 (Eintragungsdatum)\n\nRöttgen Verwaltungs GmbH & Co. KG\nKommanditgesellschaft\nUntersteinach\n\nDen Gläubigern der an der Ausgliederung beteiligten Rechtsträger ist, wenn sie binnen sechs Monaten nach dem Tag, an dem die Eintragung der Ausgliederung in das Register des Sitzes desjenigen Rechtsträgers, dessen Gläubiger sie sind, nach §§ 125, 19 Abs. 3 UmwG als bekannt gemacht gilt, ihren Anspruch nach Grund und Höhe in Textform anmelden, Sicherheit zu leisten, soweit sie nicht Befriedigung verlangen können. Dieses Recht steht den Gläubigern jedoch nur zu, wenn sie glaubhaft machen, dass durch die Ausgliederung die Erfüllung ihrer Forderung gefährdet wird."
    },
    {
      "date": "2025-08-12",
      "id": "120505",
      "original_text": "Registerbekanntmachung nach dem Umwandlungsgesetz\nBayern Amtsgericht Amberg VR 401\nJura-Wohnstätten e.V. – Amberg",
      "type": "Registerbekanntmachung nach dem Umwandlungsgesetz",
      "state": "Bayern",
      "amtsgericht": "Amtsgericht Amberg",
      "registernummer": "VR 401",
      "registerart": "VR",
      "company_name": "Jura-Wohnstätten e.V.",
      "company_seat": "Amberg",
      "details": "12.08.2025 (Bekanntmachungsdatum)\n\nBayern Amtsgericht Amberg VR 401\nRegisterbekanntmachung nach dem Umwandlungsgesetz 11.08.2025 (Eintragungsdatum)\n\nJura-Wohnstätten e.V.\neingetragener Verein\nAmberg\n\nDen Gläubigern des formwechselnden Rechtsträgers ist, wenn sie binnen sechs Monaten nach dem Tag, an dem die Eintragung des Formwechsels nach § 201 UmwG als bekannt gemacht gilt, ihren Anspruch nach Grund und Höhe in Textform anmelden, Sicherheit zu leisten, soweit sie nicht Befriedigung verlangen können. Dieses Recht steht den Gläubigern jedoch nur zu, wenn sie glaubhaft machen, dass durch den Formwechsel die Erfüllung ihrer Forderung gefährdet wird."
    },
    {
      "date": "2025-08-12",
      "id": "120506",
      "original_text": "Einreichung neuer Dokumente\nBayern Amtsgericht Fürth HRB 10257\nKennametal GmbH – Fürth",
      "type": "Einreichung neuer Dokumente",
      "state": "Bayern",
      "amtsgericht": "Amtsgericht Fürth",
      "registernummer": "HRB 10257",
      "registerart": "HRB",
      "company_name": "Kennametal GmbH",
      "company_seat": "Fürth",
      "details": "12.08.2025 (Bekanntmachungsdatum)\n\nBayern Amtsgericht Fürth HRB 10257\nEinreichung neuer Dokumente\n\nKennametal GmbH\nGesellschaft mit beschränkter Haftung\nFürth\n\nDem Amtsgericht Fürth -Registergericht- ist eine Liste der Mitglieder des Aufsichtsrats eingereicht worden, § 52 Abs. 3 S. 2 GmbHG."
    },
    {
      "date": "2025-08-12",
      "id": "120507",
      "original_text": "Registerbekanntmachung nach dem Umwandlungsgesetz\nBayern Amtsgericht Amberg HRA 4223\nFahrschule M & M e. K. – Amberg",
      "type": "Registerbekanntmachung nach dem Umwandlungsgesetz",
      "state": "Bayern",
      "amtsgericht": "Amtsgericht Amberg",
      "registernummer": "HRA 4223",
      "registerart": "HRA",
      "company_name": "Fahrschule M & M e. K.",
      "company_seat": "Amberg",
      "details": "12.08.2025 (Bekanntmachungsdatum)\n\nBayern Amtsgericht Amberg HRA 4223\nRegisterbekanntmachung nach dem Umwandlungsgesetz 11.08.2025 (Eintragungsdatum)\n\nFahrschule M & M e. K.\nEinzelkaufmann / Einzelkauffrau\nAmberg\n\nDen Gläubigern der an der Verschmelzung beteiligten Rechtsträger ist, wenn sie binnen sechs Monaten nach dem Tag, an dem die Eintragung der Verschmelzung in das Register des Sitzes desjenigen Rechtsträgers, dessen Gläubiger sie sind, nach § 19 Abs. 3 UmwG als bekannt gemacht gilt, ihren Anspruch nach Grund und Höhe in Textform anmelden, Sicherheit zu leisten, soweit sie nicht Befriedigung verlangen können. Dieses Recht steht den Gläubigern jedoch nur zu, wenn sie glaubhaft machen, dass durch die Verschmelzung die Erfüllung ihrer Forderung gefährdet wird."
    },
    {
      "date": "2025-08-12",
      "id": "120508",
      "original_text": "Registerbekanntmachung nach dem Umwandlungsgesetz\nBayern Amtsgericht München HRB 193691\nBBI Beteiligungs-, Beratungs- und Innovationsgesellschaft mbH – Iffeldorf",
      "type": "Registerbekanntmachung nach dem Umwandlungsgesetz",
      "state": "Bayern",
      "amtsgericht": "Amtsgericht München",
      "registernummer": "HRB 193691",
      "registerart": "HRB",
      "company_name": "BBI Beteiligungs-, Beratungs- und Innovationsgesellschaft mbH",
      "company_seat": "Iffeldorf",
      "details": "12.08.2025 (Bekanntmachungsdatum)\n\nBayern Amtsgericht München HRB 193691\nRegisterbekanntmachung nach dem Umwandlungsgesetz 11.08.2025 (Eintragungsdatum)\n\nBBI Beteiligungs-, Beratungs- und Innovationsgesellschaft mbH\nGesellschaft mit beschränkter Haftung\nIffeldorf\n\nDen Gläubigern der an der Verschmelzung beteiligten Rechtsträger ist, wenn sie binnen sechs Monaten nach dem Tag, an dem die Eintragung der Verschmelzung in das Register des Sitzes desjenigen Rechtsträgers, dessen Gläubiger sie sind, nach § 19 Abs. 3 UmwG als bekannt gemacht gilt, ihren Anspruch nach Grund und Höhe in Textform anmelden, Sicherheit zu leisten, soweit sie nicht Befriedigung verlangen können. Dieses Recht steht den Gläubigern jedoch nur zu, wenn sie glaubhaft machen, dass durch die Verschmelzung die Erfüllung ihrer Forderung gefährdet wird."
    },
    {
      "date": "2025-08-12",
      "id": "120509",
      "original_text": "Registerbekanntmachung nach dem Umwandlungsgesetz\nBayern Amtsgericht Aschaffenburg HRA 3589\nRenostar GmbH & Co.KG – Großwallstadt",
      "type": "Registerbekanntmachung nach dem Umwandlungsgesetz",
      "state": "Bayern",
      "amtsgericht": "Amtsgericht Aschaffenburg",
      "registernummer": "HRA 3589",
      "registerart": "HRA",
      "company_name": "Renostar GmbH & Co.KG",
      "company_seat": "Großwallstadt",
      "details": "12.08.2025 (Bekanntmachungsdatum)\n\nBayern Amtsgericht Aschaffenburg HRA 3589\nRegisterbekanntmachung nach dem Umwandlungsgesetz 11.08.2025 (Eintragungsdatum)\n\nRenostar GmbH & Co.KG\nKommanditgesellschaft\nGroßwallstadt\n\nDen Gläubigern der an der Verschmelzung beteiligten Rechtsträger ist, wenn sie binnen sechs Monaten nach dem Tag, an dem die Eintragung der Verschmelzung in das Register des Sitzes desjenigen Rechtsträgers, dessen Gläubiger sie sind, nach § 19 Abs. 3 UmwG als bekannt gemacht gilt, ihren Anspruch nach Grund und Höhe in Textform anmelden, Sicherheit zu leisten, soweit sie nicht Befriedigung verlangen können. Dieses Recht steht den Gläubigern jedoch nur zu, wenn sie glaubhaft machen, dass durch die Verschmelzung die Erfüllung ihrer Forderung gefährdet wird."
    },
    {
      "date": "2025-08-12",
      "id": "120510",
      "original_text": "Registerbekanntmachung nach dem Umwandlungsgesetz\nBayern Amtsgericht München HRB 296922\nProjektgesellschaft Sylt mbH – Hohenbrunn",
      "type": "Registerbekanntmachung nach dem Umwandlungsgesetz",
      "state": "Bayern",
      "amtsgericht": "Amtsgericht München",
      "registernummer": "HRB 296922",
      "registerart": "HRB",
      "company_name": "Projektgesellschaft Sylt mbH",
      "company_seat": "Hohenbrunn",
      "details": "12.08.2025 (Bekanntmachungsdatum)\n\nBayern Amtsgericht München HRB 296922\nRegisterbekanntmachung nach dem Umwandlungsgesetz 09.08.2025 (Eintragungsdatum)\n\nProjektgesellschaft Sylt mbH\nGesellschaft mit beschränkter Haftung\nHohenbrunn\n\nDen Gläubigern der an der Verschmelzung beteiligten Rechtsträger ist, wenn sie binnen sechs Monaten nach dem Tag, an dem die Eintragung der Verschmelzung in das Register des Sitzes desjenigen Rechtsträgers, dessen Gläubiger sie sind, nach § 19 Abs. 3 UmwG als bekannt gemacht gilt, ihren Anspruch nach Grund und Höhe in Textform anmelden, Sicherheit zu leisten, soweit sie nicht Befriedigung verlangen können. Dieses Recht steht den Gläubigern jedoch nur zu, wenn sie glaubhaft machen, dass durch die Verschmelzung die Erfüllung ihrer Forderung gefährdet wird."
    },
    {
      "date": "2025-08-12",
      "id": "120511",
      "original_text": "Registerbekanntmachung nach dem Umwandlungsgesetz\nBayern Amtsgericht Memmingen HRA 14235\nGünter Link Schreinerei Innenausbau GmbH & Co. KG – Neu-Ulm",
      "type": "Registerbekanntmachung nach dem Umwandlungsgesetz",
      "state": "Bayern",
      "amtsgericht": "Amtsgericht Memmingen",
      "registernummer": "HRA 14235",
      "registerart": "HRA",
      "company_name": "Günter Link Schreinerei Innenausbau GmbH & Co. KG",
      "company_seat": "Neu-Ulm",
      "details": "12.08.2025 (Bekanntmachungsdatum)\n\nBayern Amtsgericht Memmingen HRA 14235\nRegisterbekanntmachung nach dem Umwandlungsgesetz 11.08.2025 (Eintragungsdatum)\n\nGünter Link Schreinerei Innenausbau GmbH & Co. KG\nKommanditgesellschaft\nNeu-Ulm\n\nDen Gläubigern der an der Ausgliederung beteiligten Rechtsträger ist, wenn sie binnen sechs Monaten nach dem Tag, an dem die Eintragung der Ausgliederung in das Register des Sitzes desjenigen Rechtsträgers, dessen Gläubiger sie sind, nach §§ 125, 19 Abs. 3 UmwG als bekannt gemacht gilt, ihren Anspruch nach Grund und Höhe in Textform anmelden, Sicherheit zu leisten, soweit sie nicht Befriedigung verlangen können. Dieses Recht steht den Gläubigern jedoch nur zu, wenn sie glaubhaft machen, dass durch die Ausgliederung die Erfüllung ihrer Forderung gefährdet wird."
    },
    {
      "date": "2025-08-12",
      "id": "120512",
      "original_text": "Registerbekanntmachung nach dem Umwandlungsgesetz\nBayern Amtsgericht München HRB 168979\nInstitut für Softwaresysteme und Consulting (ISCons) GmbH – München",
      "type": "Registerbekanntmachung nach dem Umwandlungsgesetz",
      "state": "Bayern",
      "amtsgericht": "Amtsgericht München",
      "registernummer": "HRB 168979",
      "registerart": "HRB",
      "company_name": "Institut für Softwaresysteme und Consulting (ISCons) GmbH",
      "company_seat": "München",
      "details": "12.08.2025 (Bekanntmachungsdatum)\n\nBayern Amtsgericht München HRB 168979\nRegisterbekanntmachung nach dem Umwandlungsgesetz 11.08.2025 (Eintragungsdatum)\n\nInstitut für Softwaresysteme und Consulting (ISCons) GmbH\nGesellschaft mit beschränkter Haftung\nMünchen\n\nDen Gläubigern der an der Verschmelzung beteiligten Rechtsträger ist, wenn sie binnen sechs Monaten nach dem Tag, an dem die Eintragung der Verschmelzung in das Register des Sitzes desjenigen Rechtsträgers, dessen Gläubiger sie sind, nach § 19 Abs. 3 UmwG als bekannt gemacht gilt, ihren Anspruch nach Grund und Höhe in Textform anmelden, Sicherheit zu leisten, soweit sie nicht Befriedigung verlangen können. Dieses Recht steht den Gläubigern jedoch nur zu, wenn sie glaubhaft machen, dass durch die Verschmelzung die Erfüllung ihrer Forderung gefährdet wird."
    },
    {
      "date": "2025-08-12",
      "id": "120513",
      "original_text": "Registerbekanntmachung nach dem Umwandlungsgesetz\nBayern Amtsgericht Bayreuth HRA 4959\nMario Röttgen e.K. – Untersteinach",
      "type": "Registerbekanntmachung nach dem Umwandlungsgesetz",
      "state": "Bayern",
      "amtsgericht": "Amtsgericht Bayreuth",
      "registernummer": "HRA 4959",
      "registerart": "HRA",
      "company_name": "Mario Röttgen e.K.",
      "company_seat": "Untersteinach",
      "details": "12.08.2025 (Bekanntmachungsdatum)\n\nBayern Amtsgericht Bayreuth HRA 4959\nRegisterbekanntmachung nach dem Umwandlungsgesetz 11.08.2025 (Eintragungsdatum)\n\nMario Röttgen e.K.\nEinzelkaufmann / Einzelkauffrau\nUntersteinach\n\nDen Gläubigern der an der Ausgliederung beteiligten Rechtsträger ist, wenn sie binnen sechs Monaten nach dem Tag, an dem die Eintragung der Ausgliederung in das Register des Sitzes desjenigen Rechtsträgers, dessen Gläubiger sie sind, nach §§ 125, 19 Abs. 3 UmwG als bekannt gemacht gilt, ihren Anspruch nach Grund und Höhe in Textform anmelden, Sicherheit zu leisten, soweit sie nicht Befriedigung verlangen können. Dieses Recht steht den Gläubigern jedoch nur zu, wenn sie glaubhaft machen, dass durch die Ausgliederung die Erfüllung ihrer Forderung gefährdet wird."
    },
    {
      "date": "2025-08-12",
      "id": "120514",
      "original_text": "Registerbekanntmachung nach dem Umwandlungsgesetz\nBayern Amtsgericht Memmingen HRB 2250\nHonora Guntia GmbH – Burgau",
      "type": "Registerbekanntmachung nach dem Umwandlungsgesetz",
      "state": "Bayern",
      "amtsgericht": "Amtsgericht Memmingen",
      "registernummer": "HRB 2250",
      "registerart": "HRB",
      "company_name": "Honora Guntia GmbH",
      "company_seat": "Burgau",
      "details": "12.08.2025 (Bekanntmachungsdatum)\n\nBayern Amtsgericht Memmingen HRB 2250\nRegisterbekanntmachung nach dem Umwandlungsgesetz 07.08.2025 (Eintragungsdatum)\n\nHonora Guntia GmbH\nGesellschaft mit beschränkter Haftung\nBurgau\n\nDen Gläubigern der an der Verschmelzung beteiligten Rechtsträger ist, wenn sie binnen sechs Monaten nach dem Tag, an dem die Eintragung der Verschmelzung in das Register des Sitzes desjenigen Rechtsträgers, dessen Gläubiger sie sind, nach § 19 Abs. 3 UmwG als bekannt gemacht gilt, ihren Anspruch nach Grund und Höhe in Textform anmelden, Sicherheit zu leisten, soweit sie nicht Befriedigung verlangen können. Dieses Recht steht den Gläubigern jedoch nur zu, wenn sie glaubhaft machen, dass durch die Verschmelzung die Erfüllung ihrer Forderung gefährdet wird."
    },
    {
      "date": "2025-08-12",
      "id": "120515",
      "original_text": "Registerbekanntmachung nach dem Umwandlungsgesetz\nBayern Amtsgericht München HRB 191140\nCustodia Holding SE – München",
      "type": "Registerbekanntmachung nach dem Umwandlungsgesetz",
      "state": "Bayern",
      "amtsgericht": "Amtsgericht München",
      "registernummer": "HRB 191140",
      "registerart": "HRB",
      "company_name": "Custodia Holding SE",
      "company_seat": "München",
      "details": "12.08.2025 (Bekanntmachungsdatum)\n\nBayern Amtsgericht München HRB 191140\nRegisterbekanntmachung nach dem Umwandlungsgesetz 11.08.2025 (Eintragungsdatum)\n\nCustodia Holding SE\nEuropäische Aktiengesellschaft (SE)\nMünchen\n\nDen Gläubigern der an der Verschmelzung beteiligten Rechtsträger ist, wenn sie binnen sechs Monaten nach dem Tag, an dem die Eintragung der Verschmelzung in das Register des Sitzes desjenigen Rechtsträgers, dessen Gläubiger sie sind, nach § 19 Abs. 3 UmwG als bekannt gemacht gilt, ihren Anspruch nach Grund und Höhe in Textform anmelden, Sicherheit zu leisten, soweit sie nicht Befriedigung verlangen können. Dieses Recht steht den Gläubigern jedoch nur zu, wenn sie glaubhaft machen, dass durch die Verschmelzung die Erfüllung ihrer Forderung gefährdet wird."
    },
    {
      "date": "2025-08-12",
      "id": "120516",
      "original_text": "Löschungsankündigung\nBayern Amtsgericht Traunstein HRB 27342\nMedizinprodukte und Dentalservice GmbH – Freilassing",
      "type": "Löschungsankündigung",
      "state": "Bayern",
      "amtsgericht": "Amtsgericht Traunstein",
      "registernummer": "HRB 27342",
      "registerart": "HRB",
      "company_name": "Medizinprodukte und Dentalservice GmbH",
      "company_seat": "Freilassing",
      "details": "12.08.2025 (Bekanntmachungsdatum)\n\nBayern Amtsgericht Traunstein HRB 27342\nLöschungsankündigung\n\nMedizinprodukte und Dentalservice GmbH\nGesellschaft mit beschränkter Haftung\nFreilassing\n\nDas Registergericht beabsichtigt, die im Handelsregister eingetragene Gesellschaft wegen Vermögenslosigkeit von Amts wegen nach § 394 FamFG zu löschen. Die Frist zur Erhebung eines Widerspruchs ist auf einen Monat festgesetzt."
    },
    {
      "date": "2025-08-12",
      "id": "120517",
      "original_text": "Registerbekanntmachung nach dem Umwandlungsgesetz\nBayern Amtsgericht Augsburg HRA 19585\nImmobilien Judith Ernst e. K. – Nördlingen",
      "type": "Registerbekanntmachung nach dem Umwandlungsgesetz",
      "state": "Bayern",
      "amtsgericht": "Amtsgericht Augsburg",
      "registernummer": "HRA 19585",
      "registerart": "HRA",
      "company_name": "Immobilien Judith Ernst e. K.",
      "company_seat": "Nördlingen",
      "details": "12.08.2025 (Bekanntmachungsdatum)\n\nBayern Amtsgericht Augsburg HRA 19585\nRegisterbekanntmachung nach dem Umwandlungsgesetz 11.08.2025 (Eintragungsdatum)\n\nImmobilien Judith Ernst e. K.\nEinzelkaufmann / Einzelkauffrau\nNördlingen\n\nDen Gläubigern der an der Ausgliederung beteiligten Rechtsträger ist, wenn sie binnen sechs Monaten nach dem Tag, an dem die Eintragung der Ausgliederung in das Register des Sitzes desjenigen Rechtsträgers, dessen Gläubiger sie sind, nach §§ 125, 19 Abs. 3 UmwG als bekannt gemacht gilt, ihren Anspruch nach Grund und Höhe in Textform anmelden, Sicherheit zu leisten, soweit sie nicht Befriedigung verlangen können. Dieses Recht steht den Gläubigern jedoch nur zu, wenn sie glaubhaft machen, dass durch die Ausgliederung die Erfüllung ihrer Forderung gefährdet wird."
    },
    {
      "date": "2025-08-12",
      "id": "120518",
      "original_text": "Löschungsankündigung\nBayern Amtsgericht München HRB 191694\nResults UG (haftungsbeschränkt) – München",
      "type": "Löschungsankündigung",
      "state": "Bayern",
      "amtsgericht": "Amtsgericht München",
      "registernummer": "HRB 191694",
      "registerart": "HRB",
      "company_name": "Results UG (haftungsbeschränkt)",
      "company_seat": "München",
      "details": "12.08.2025 (Bekanntmachungsdatum)\n\nBayern Amtsgericht München HRB 191694\nLöschungsankündigung 11.08.2025 (Eintragungsdatum)\n\nResults UG (haftungsbeschränkt)\nGesellschaft mit beschränkter Haftung\nMünchen\n\nDas Registergericht beabsichtigt, die im Handelsregister eingetragene Gesellschaft wegen Vermögenslosigkeit von Amts wegen nach § 394 FamFG zu löschen. Die Frist zur Erhebung eines Widerspruchs ist auf drei Monate festgesetzt."
    },
    {
      "date": "2025-08-12",
      "id": "120519",
      "original_text": "Registerbekanntmachung nach dem Umwandlungsgesetz\nBayern Amtsgericht Regensburg HRB 1784\nPinsker Druck und Medien GmbH – Mainburg",
      "type": "Registerbekanntmachung nach dem Umwandlungsgesetz",
      "state": "Bayern",
      "amtsgericht": "Amtsgericht Regensburg",
      "registernummer": "HRB 1784",
      "registerart": "HRB",
      "company_name": "Pinsker Druck und Medien GmbH",
      "company_seat": "Mainburg",
      "details": "12.08.2025 (Bekanntmachungsdatum)\n\nBayern Amtsgericht Regensburg HRB 1784\nRegisterbekanntmachung nach dem Umwandlungsgesetz 11.08.2025 (Eintragungsdatum)\n\nPinsker Druck und Medien GmbH\nGesellschaft mit beschränkter Haftung\nMainburg\n\nDen Gläubigern der an der Verschmelzung beteiligten Rechtsträger ist, wenn sie binnen sechs Monaten nach dem Tag, an dem die Eintragung der Verschmelzung in das Register des Sitzes desjenigen Rechtsträgers, dessen Gläubiger sie sind, nach § 19 Abs. 3 UmwG als bekannt gemacht gilt, ihren Anspruch nach Grund und Höhe in Textform anmelden, Sicherheit zu leisten, soweit sie nicht Befriedigung verlangen können. Dieses Recht steht den Gläubigern jedoch nur zu, wenn sie glaubhaft machen, dass durch die Verschmelzung die Erfüllung ihrer Forderung gefährdet wird."
    },
    {
      "date": "2025-08-12",
      "id": "120520",
      "original_text": "Registerbekanntmachung nach dem Umwandlungsgesetz\nBayern Amtsgericht Regensburg HRB 18969\nPeschke Solutions GmbH – Mainburg",
      "type": "Registerbekanntmachung nach dem Umwandlungsgesetz",
      "state": "Bayern",
      "amtsgericht": "Amtsgericht Regensburg",
      "registernummer": "HRB 18969",
      "registerart": "HRB",
      "company_name": "Peschke Solutions GmbH",
      "company_seat": "Mainburg",
      "details": "12.08.2025 (Bekanntmachungsdatum)\n\nBayern Amtsgericht Regensburg HRB 18969\nRegisterbekanntmachung nach dem Umwandlungsgesetz 11.08.2025 (Eintragungsdatum)\n\nPeschke Solutions GmbH\nGesellschaft mit beschränkter Haftung\nMainburg\n\nDen Gläubigern der an der Verschmelzung beteiligten Rechtsträger ist, wenn sie binnen sechs Monaten nach dem Tag, an dem die Eintragung der Verschmelzung in das Register des Sitzes desjenigen Rechtsträgers, dessen Gläubiger sie sind, nach § 19 Abs. 3 UmwG als bekannt gemacht gilt, ihren Anspruch nach Grund und Höhe in Textform anmelden, Sicherheit zu leisten, soweit sie nicht Befriedigung verlangen können. Dieses Recht steht den Gläubigern jedoch nur zu, wenn sie glaubhaft machen, dass durch die Verschmelzung die Erfüllung ihrer Forderung gefährdet wird."
    },
    {
      "date": "2025-08-12",
      "id": "120521",
      "original_text": "Registerbekanntmachung nach dem Umwandlungsgesetz\nBayern Amtsgericht Regensburg HRB 12090\nBayernwerk Natur 1. Beteiligungs-GmbH – Regensburg",
      "type": "Registerbekanntmachung nach dem Umwandlungsgesetz",
      "state": "Bayern",
      "amtsgericht": "Amtsgericht Regensburg",
      "registernummer": "HRB 12090",
      "registerart": "HRB",
      "company_name": "Bayernwerk Natur 1. Beteiligungs-GmbH",
      "company_seat": "Regensburg",
      "details": "12.08.2025 (Bekanntmachungsdatum)\n\nBayern Amtsgericht Regensburg HRB 12090\nRegisterbekanntmachung nach dem Umwandlungsgesetz 11.08.2025 (Eintragungsdatum)\n\nBayernwerk Natur 1. Beteiligungs-GmbH\nGesellschaft mit beschränkter Haftung\nRegensburg\n\nDen Gläubigern der an der Verschmelzung beteiligten Rechtsträger ist, wenn sie binnen sechs Monaten nach dem Tag, an dem die Eintragung der Verschmelzung in das Register des Sitzes desjenigen Rechtsträgers, dessen Gläubiger sie sind, nach § 19 Abs. 3 UmwG als bekannt gemacht gilt, ihren Anspruch nach Grund und Höhe in Textform anmelden, Sicherheit zu leisten, soweit sie nicht Befriedigung verlangen können. Dieses Recht steht den Gläubigern jedoch nur zu, wenn sie glaubhaft machen, dass durch die Verschmelzung die Erfüllung ihrer Forderung gefährdet wird."
    },
    {
      "date": "2025-08-12",
      "id": "120522",
      "original_text": "Registerbekanntmachung nach dem Umwandlungsgesetz\nBayern Amtsgericht München HRB 151099\nMedia1 GmbH – München",
      "type": "Registerbekanntmachung nach dem Umwandlungsgesetz",
      "state": "Bayern",
      "amtsgericht": "Amtsgericht München",
      "registernummer": "HRB 151099",
      "registerart": "HRB",
      "company_name": "Media1 GmbH",
      "company_seat": "München",
      "details": "12.08.2025 (Bekanntmachungsdatum)\n\nBayern Amtsgericht München HRB 151099\nRegisterbekanntmachung nach dem Umwandlungsgesetz 11.08.2025 (Eintragungsdatum)\n\nMedia1 GmbH\nGesellschaft mit beschränkter Haftung\nMünchen\n\nDen Gläubigern der an der Verschmelzung beteiligten Rechtsträger ist, wenn sie binnen sechs Monaten nach dem Tag, an dem die Eintragung der Verschmelzung in das Register des Sitzes desjenigen Rechtsträgers, dessen Gläubiger sie sind, nach § 19 Abs. 3 UmwG als bekannt gemacht gilt, ihren Anspruch nach Grund und Höhe in Textform anmelden, Sicherheit zu leisten, soweit sie nicht Befriedigung verlangen können. Dieses Recht steht den Gläubigern jedoch nur zu, wenn sie glaubhaft machen, dass durch die Verschmelzung die Erfüllung ihrer Forderung gefährdet wird."
    },
    {
      "date": "2025-08-12",
      "id": "120523",
      "original_text": "Registerbekanntmachung nach dem Umwandlungsgesetz\nBayern Amtsgericht Kempten (Allgäu) HRA 11257\nD. Buhmann Grundbesitz e.K. – Weiler-Simmerberg",
      "type": "Registerbekanntmachung nach dem Umwandlungsgesetz",
      "state": "Bayern",
      "amtsgericht": "Amtsgericht Kempten (Allgäu)",
      "registernummer": "HRA 11257",
      "registerart": "HRA",
      "company_name": "D. Buhmann Grundbesitz e.K.",
      "company_seat": "Weiler-Simmerberg",
      "details": "12.08.2025 (Bekanntmachungsdatum)\n\nBayern Amtsgericht Kempten (Allgäu) HRA 11257\nRegisterbekanntmachung nach dem Umwandlungsgesetz 11.08.2025 (Eintragungsdatum)\n\nD. Buhmann Grundbesitz e.K.\nEinzelkaufmann / Einzelkauffrau\nWeiler-Simmerberg\n\nDen Gläubigern der an der Ausgliederung beteiligten Rechtsträger ist, wenn sie binnen sechs Monaten nach dem Tag, an dem die Eintragung der Ausgliederung in das Register des Sitzes desjenigen Rechtsträgers, dessen Gläubiger sie sind, nach §§ 125, 19 Abs. 3 UmwG als bekannt gemacht gilt, ihren Anspruch nach Grund und Höhe in Textform anmelden, Sicherheit zu leisten, soweit sie nicht Befriedigung verlangen können. Dieses Recht steht den Gläubigern jedoch nur zu, wenn sie glaubhaft machen, dass durch die Ausgliederung die Erfüllung ihrer Forderung gefährdet wird."
    },
    {
      "date": "2025-08-12",
      "id": "120524",
      "original_text": "Registerbekanntmachung nach dem Umwandlungsgesetz\nBayern Amtsgericht Kempten (Allgäu) HRB 15427\nKTB Paint GmbH – Kaufbeuren",
      "type": "Registerbekanntmachung nach dem Umwandlungsgesetz",
      "state": "Bayern",
      "amtsgericht": "Amtsgericht Kempten (Allgäu)",
      "registernummer": "HRB 15427",
      "registerart": "HRB",
      "company_name": "KTB Paint GmbH",
      "company_seat": "Kaufbeuren",
      "details": "12.08.2025 (Bekanntmachungsdatum)\n\nBayern Amtsgericht Kempten (Allgäu) HRB 15427\nRegisterbekanntmachung nach dem Umwandlungsgesetz 11.08.2025 (Eintragungsdatum)\n\nKTB Paint GmbH\nGesellschaft mit beschränkter Haftung\nKaufbeuren\n\nDen Gläubigern der an der Verschmelzung beteiligten Rechtsträger ist, wenn sie binnen sechs Monaten nach dem Tag, an dem die Eintragung der Verschmelzung in das Register des Sitzes desjenigen Rechtsträgers, dessen Gläubiger sie sind, nach § 19 Abs. 3 UmwG als bekannt gemacht gilt, ihren Anspruch nach Grund und Höhe in Textform anmelden, Sicherheit zu leisten, soweit sie nicht Befriedigung verlangen können. Dieses Recht steht den Gläubigern jedoch nur zu, wenn sie glaubhaft machen, dass durch die Verschmelzung die Erfüllung ihrer Forderung gefährdet wird."
    },
    {
      "date": "2025-08-12",
      "id": "120525",
      "original_text": "Registerbekanntmachung nach dem Umwandlungsgesetz\nBayern Amtsgericht München HRB 255944\nF24 Holding GmbH – München",
      "type": "Registerbekanntmachung nach dem Umwandlungsgesetz",
      "state": "Bayern",
      "amtsgericht": "Amtsgericht München",
      "registernummer": "HRB 255944",
      "registerart": "HRB",
      "company_name": "F24 Holding GmbH",
      "company_seat": "München",
      "details": "12.08.2025 (Bekanntmachungsdatum)\n\nBayern Amtsgericht München HRB 255944\nRegisterbekanntmachung nach dem Umwandlungsgesetz 11.08.2025 (Eintragungsdatum)\n\nF24 Holding GmbH\nGesellschaft mit beschränkter Haftung\nMünchen\n\nDen Gläubigern der an der Verschmelzung beteiligten Rechtsträger ist, wenn sie binnen sechs Monaten nach dem Tag, an dem die Eintragung der Verschmelzung in das Register des Sitzes desjenigen Rechtsträgers, dessen Gläubiger sie sind, nach § 19 Abs. 3 UmwG als bekannt gemacht gilt, ihren Anspruch nach Grund und Höhe in Textform anmelden, Sicherheit zu leisten, soweit sie nicht Befriedigung verlangen können. Dieses Recht steht den Gläubigern jedoch nur zu, wenn sie glaubhaft machen, dass durch die Verschmelzung die Erfüllung ihrer Forderung gefährdet wird."
    },
    {
      "date": "2025-08-12",
      "id": "120526",
      "original_text": "Registerbekanntmachung nach dem Umwandlungsgesetz\nBayern Amtsgericht Kempten (Allgäu) HRA 11258\nBuhmann Immobilienverwaltung GmbH & Co. KG – Weiler-Simmerberg",
      "type": "Registerbekanntmachung nach dem Umwandlungsgesetz",
      "state": "Bayern",
      "amtsgericht": "Amtsgericht Kempten (Allgäu)",
      "registernummer": "HRA 11258",
      "registerart": "HRA",
      "company_name": "Buhmann Immobilienverwaltung GmbH & Co. KG",
      "company_seat": "Weiler-Simmerberg",
      "details": "12.08.2025 (Bekanntmachungsdatum)\n\nBayern Amtsgericht Kempten (Allgäu) HRA 11258\nRegisterbekanntmachung nach dem Umwandlungsgesetz 11.08.2025 (Eintragungsdatum)\n\nBuhmann Immobilienverwaltung GmbH & Co. KG\nKommanditgesellschaft\nWeiler-Simmerberg\n\nDen Gläubigern der an der Ausgliederung beteiligten Rechtsträger ist, wenn sie binnen sechs Monaten nach dem Tag, an dem die Eintragung der Ausgliederung in das Register des Sitzes desjenigen Rechtsträgers, dessen Gläubiger sie sind, nach §§ 125, 19 Abs. 3 UmwG als bekannt gemacht gilt, ihren Anspruch nach Grund und Höhe in Textform anmelden, Sicherheit zu leisten, soweit sie nicht Befriedigung verlangen können. Dieses Recht steht den Gläubigern jedoch nur zu, wenn sie glaubhaft machen, dass durch die Ausgliederung die Erfüllung ihrer Forderung gefährdet wird."
    },
    {
      "date": "2025-08-12",
      "id": "120527",
      "original_text": "Löschungsankündigung\nBayern Amtsgericht München HRB 212754\nARKO European Business & Services GmbH – München",
      "type": "Löschungsankündigung",
      "state": "Bayern",
      "amtsgericht": "Amtsgericht München",
      "registernummer": "HRB 212754",
      "registerart": "HRB",
      "company_name": "ARKO European Business & Services GmbH",
      "company_seat": "München",
      "details": "12.08.2025 (Bekanntmachungsdatum)\n\nBayern Amtsgericht München HRB 212754\nLöschungsankündigung 11.08.2025 (Eintragungsdatum)\n\nARKO European Business & Services GmbH\nGesellschaft mit beschränkter Haftung\nMünchen\n\nDas Registergericht beabsichtigt, die im Handelsregister eingetragene Gesellschaft wegen Vermögenslosigkeit von Amts wegen nach § 394 FamFG zu löschen. Die Frist zur Erhebung eines Widerspruchs ist auf drei Monate festgesetzt."
    },
    {
      "date": "2025-08-12",
      "id": "120528",
      "original_text": "Registerbekanntmachung nach dem Umwandlungsgesetz\nBayern Amtsgericht München HRB 121375\nTHETIS Verwaltungsgesellschaft mbH – Pullach",
      "type": "Registerbekanntmachung nach dem Umwandlungsgesetz",
      "state": "Bayern",
      "amtsgericht": "Amtsgericht München",
      "registernummer": "HRB 121375",
      "registerart": "HRB",
      "company_name": "THETIS Verwaltungsgesellschaft mbH",
      "company_seat": "Pullach",
      "details": "12.08.2025 (Bekanntmachungsdatum)\n\nBayern Amtsgericht München HRB 121375\nRegisterbekanntmachung nach dem Umwandlungsgesetz 11.08.2025 (Eintragungsdatum)\n\nTHETIS Verwaltungsgesellschaft mbH\nGesellschaft mit beschränkter Haftung\nPullach\n\nDen Gläubigern der an der Verschmelzung beteiligten Rechtsträger ist, wenn sie binnen sechs Monaten nach dem Tag, an dem die Eintragung der Verschmelzung in das Register des Sitzes desjenigen Rechtsträgers, dessen Gläubiger sie sind, nach § 19 Abs. 3 UmwG als bekannt gemacht gilt, ihren Anspruch nach Grund und Höhe in Textform anmelden, Sicherheit zu leisten, soweit sie nicht Befriedigung verlangen können. Dieses Recht steht den Gläubigern jedoch nur zu, wenn sie glaubhaft machen, dass durch die Verschmelzung die Erfüllung ihrer Forderung gefährdet wird."
    },
    {
      "date": "2025-08-12",
      "id": "120529",
      "original_text": "Registerbekanntmachung nach dem Umwandlungsgesetz\nBayern Amtsgericht Amberg VR 169\nJura-Werkstätten Amberg-Sulzbach e.V. Werkstätten für Menschen mit Behinderung – Amberg",
      "type": "Registerbekanntmachung nach dem Umwandlungsgesetz",
      "state": "Bayern",
      "amtsgericht": "Amtsgericht Amberg",
      "registernummer": "VR 169",
      "registerart": "VR",
      "company_name": "Jura-Werkstätten Amberg-Sulzbach e.V. Werkstätten für Menschen mit Behinderung",
      "company_seat": "Amberg",
      "details": "12.08.2025 (Bekanntmachungsdatum)\n\nBayern Amtsgericht Amberg VR 169\nRegisterbekanntmachung nach dem Umwandlungsgesetz 11.08.2025 (Eintragungsdatum)\n\nJura-Werkstätten Amberg-Sulzbach e.V. Werkstätten für Menschen mit Behinderung\neingetragener Verein\nAmberg\n\nDen Gläubigern des formwechselnden Rechtsträgers ist, wenn sie binnen sechs Monaten nach dem Tag, an dem die Eintragung des Formwechsels nach § 201 UmwG als bekannt gemacht gilt, ihren Anspruch nach Grund und Höhe in Textform anmelden, Sicherheit zu leisten, soweit sie nicht Befriedigung verlangen können. Dieses Recht steht den Gläubigern jedoch nur zu, wenn sie glaubhaft machen, dass durch den Formwechsel die Erfüllung ihrer Forderung gefährdet wird."
    },
    {
      "date": "2025-08-12",
      "id": "120530",
      "original_text": "Registerbekanntmachung nach dem Umwandlungsgesetz\nBayern Amtsgericht Amberg HRB 5182\nFahrschule M & M GmbH – Amberg",
      "type": "Registerbekanntmachung nach dem Umwandlungsgesetz",
      "state": "Bayern",
      "amtsgericht": "Amtsgericht Amberg",
      "registernummer": "HRB 5182",
      "registerart": "HRB",
      "company_name": "Fahrschule M & M GmbH",
      "company_seat": "Amberg",
      "details": "12.08.2025 (Bekanntmachungsdatum)\n\nBayern Amtsgericht Amberg HRB 5182\nRegisterbekanntmachung nach dem Umwandlungsgesetz 11.08.2025 (Eintragungsdatum)\n\nFahrschule M & M GmbH\nGesellschaft mit beschränkter Haftung\nAmberg\n\nDen Gläubigern der an der Verschmelzung beteiligten Rechtsträger ist, wenn sie binnen sechs Monaten nach dem Tag, an dem die Eintragung der Verschmelzung in das Register des Sitzes desjenigen Rechtsträgers, dessen Gläubiger sie sind, nach § 19 Abs. 3 UmwG als bekannt gemacht gilt, ihren Anspruch nach Grund und Höhe in Textform anmelden, Sicherheit zu leisten, soweit sie nicht Befriedigung verlangen können. Dieses Recht steht den Gläubigern jedoch nur zu, wenn sie glaubhaft machen, dass durch die Verschmelzung die Erfüllung ihrer Forderung gefährdet wird."
    },
    {
      "date": "2025-08-12",
      "id": "120531",
      "original_text": "Registerbekanntmachung nach dem Umwandlungsgesetz\nBayern Amtsgericht München HRB 118490\nBayerische Landesbank Europa-Immobilien-Beteiligungs-GmbH – München",
      "type": "Registerbekanntmachung nach dem Umwandlungsgesetz",
      "state": "Bayern",
      "amtsgericht": "Amtsgericht München",
      "registernummer": "HRB 118490",
      "registerart": "HRB",
      "company_name": "Bayerische Landesbank Europa-Immobilien-Beteiligungs-GmbH",
      "company_seat": "München",
      "details": "12.08.2025 (Bekanntmachungsdatum)\n\nBayern Amtsgericht München HRB 118490\nRegisterbekanntmachung nach dem Umwandlungsgesetz 11.08.2025 (Eintragungsdatum)\n\nBayerische Landesbank Europa-Immobilien-Beteiligungs-GmbH\nGesellschaft mit beschränkter Haftung\nMünchen\n\nDen Gläubigern der an der Verschmelzung beteiligten Rechtsträger ist, wenn sie binnen sechs Monaten nach dem Tag, an dem die Eintragung der Verschmelzung in das Register des Sitzes desjenigen Rechtsträgers, dessen Gläubiger sie sind, nach § 19 Abs. 3 UmwG als bekannt gemacht gilt, ihren Anspruch nach Grund und Höhe in Textform anmelden, Sicherheit zu leisten, soweit sie nicht Befriedigung verlangen können. Dieses Recht steht den Gläubigern jedoch nur zu, wenn sie glaubhaft machen, dass durch die Verschmelzung die Erfüllung ihrer Forderung gefährdet wird."
    },
    {
      "date": "2025-08-12",
      "id": "120532",
      "original_text": "Registerbekanntmachung nach dem Umwandlungsgesetz\nBayern Amtsgericht München HRB 214445\nSCHUNCK GROUP Verwaltungs GmbH – München",
      "type": "Registerbekanntmachung nach dem Umwandlungsgesetz",
      "state": "Bayern",
      "amtsgericht": "Amtsgericht München",
      "registernummer": "HRB 214445",
      "registerart": "HRB",
      "company_name": "SCHUNCK GROUP Verwaltungs GmbH",
      "company_seat": "München",
      "details": "12.08.2025 (Bekanntmachungsdatum)\n\nBayern Amtsgericht München HRB 214445\nRegisterbekanntmachung nach dem Umwandlungsgesetz 11.08.2025 (Eintragungsdatum)\n\nSCHUNCK GROUP Verwaltungs GmbH\nGesellschaft mit beschränkter Haftung\nMünchen\n\nDen Gläubigern der an der Verschmelzung beteiligten Rechtsträger ist, wenn sie binnen sechs Monaten nach dem Tag, an dem die Eintragung der Verschmelzung in das Register des Sitzes desjenigen Rechtsträgers, dessen Gläubiger sie sind, nach § 19 Abs. 3 UmwG als bekannt gemacht gilt, ihren Anspruch nach Grund und Höhe in Textform anmelden, Sicherheit zu leisten, soweit sie nicht Befriedigung verlangen können. Dieses Recht steht den Gläubigern jedoch nur zu, wenn sie glaubhaft machen, dass durch die Verschmelzung die Erfüllung ihrer Forderung gefährdet wird."
    },
    {
      "date": "2025-08-12",
      "id": "120533",
      "original_text": "Registerbekanntmachung nach dem Umwandlungsgesetz\nBayern Amtsgericht Memmingen HRA 14234\nGünter Link Schreinerei Verwaltungs e.K. – Neu-Ulm",
      "type": "Registerbekanntmachung nach dem Umwandlungsgesetz",
      "state": "Bayern",
      "amtsgericht": "Amtsgericht Memmingen",
      "registernummer": "HRA 14234",
      "registerart": "HRA",
      "company_name": "Günter Link Schreinerei Verwaltungs e.K.",
      "company_seat": "Neu-Ulm",
      "details": "12.08.2025 (Bekanntmachungsdatum)\n\nBayern Amtsgericht Memmingen HRA 14234\nRegisterbekanntmachung nach dem Umwandlungsgesetz 11.08.2025 (Eintragungsdatum)\n\nGünter Link Schreinerei Verwaltungs e.K.\nEinzelkaufmann / Einzelkauffrau\nNeu-Ulm\n\nDen Gläubigern der an der Ausgliederung beteiligten Rechtsträger ist, wenn sie binnen sechs Monaten nach dem Tag, an dem die Eintragung der Ausgliederung in das Register des Sitzes desjenigen Rechtsträgers, dessen Gläubiger sie sind, nach §§ 125, 19 Abs. 3 UmwG als bekannt gemacht gilt, ihren Anspruch nach Grund und Höhe in Textform anmelden, Sicherheit zu leisten, soweit sie nicht Befriedigung verlangen können. Dieses Recht steht den Gläubigern jedoch nur zu, wenn sie glaubhaft machen, dass durch die Ausgliederung die Erfüllung ihrer Forderung gefährdet wird."
    },
    {
      "date": "2025-08-12",
      "id": "120534",
      "original_text": "Registerbekanntmachung nach dem Umwandlungsgesetz\nBaden-Württemberg Amtsgericht Mannheim HRB 755380\nCaritas Sozialstation Wiesloch gGmbH – Wiesloch",
      "type": "Registerbekanntmachung nach dem Umwandlungsgesetz",
      "state": "Baden-Württemberg",
      "amtsgericht": "Amtsgericht Mannheim",
      "registernummer": "HRB 755380",
      "registerart": "HRB",
      "company_name": "Caritas Sozialstation Wiesloch gGmbH",
      "company_seat": "Wiesloch",
      "details": "12.08.2025 (Bekanntmachungsdatum)\n\nBaden-Württemberg Amtsgericht Mannheim HRB 755380\nRegisterbekanntmachung nach dem Umwandlungsgesetz 12.08.2025 (Eintragungsdatum)\n\nCaritas Sozialstation Wiesloch gGmbH\nGesellschaft mit beschränkter Haftung\nWiesloch\n\nAls nicht eingetragen wird bekanntgemacht: Den Gläubigern des an dem Formwechsel beteiligten Rechtsträgers ist, wenn sie binnen sechs Monaten nach dem Tag, an dem die Eintragung des Formwechsels in das Register des Sitzes desjenigen Rechtsträgers, dessen Gläubiger sie sind, nach § 19 Abs. 3 UmwG als bekanntgemacht gilt, ihren Anspruch nach Grund und Höhe schriftlich anmelden, Sicherheit zu leisten, soweit sie nicht Befriedigung verlangen können. Dieses Recht steht den Gläubigern jedoch nur zu, wenn sie glaubhaft machen, dass durch den Formwechsel die Erfüllung ihrer Forderung gefährdet wird."
    },
    {
      "date": "2025-08-12",
      "id": "120535",
      "original_text": "Registerbekanntmachung nach dem Umwandlungsgesetz\nSchleswig-Holstein Amtsgericht Flensburg HRA 11562\nOliver Flindt e.K. – Schleswig",
      "type": "Registerbekanntmachung nach dem Umwandlungsgesetz",
      "state": "Schleswig-Holstein",
      "amtsgericht": "Amtsgericht Flensburg",
      "registernummer": "HRA 11562",
      "registerart": "HRA",
      "company_name": "Oliver Flindt e.K.",
      "company_seat": "Schleswig",
      "details": "12.08.2025 (Bekanntmachungsdatum)\n\nSchleswig-Holstein Amtsgericht Flensburg HRA 11562\nRegisterbekanntmachung nach dem Umwandlungsgesetz 11.08.2025 (Eintragungsdatum)\n\nOliver Flindt e.K.\nEinzelkaufmann / Einzelkauffrau\nSchleswig\n\nZu Eintragungsnummer 2 vom 11.08.2025 wird als nicht eingetragen veröffentlicht:\nDen Gläubigern der an der Spaltung beteiligten Rechtsträger ist, wenn sie binnen sechs Monaten nach dem Tag, an dem die Eintragung der Spaltung in das Register des Sitzes desjenigen Rechtsträgers, dessen Gläubiger sie sind, als bekannt gemacht gilt, ihren Anspruch nach Grund und Höhe in Textform anmelden, Sicherheit zu leisten, soweit sie nicht Befriedigung verlangen können. Dieses Recht steht den Gläubigern jedoch nur zu, wenn sie glaubhaft machen, dass durch die Spaltung die Erfüllung ihrer Forderung gefährdet wird."
    },
    {
      "date": "2025-08-12",
      "id": "120536",
      "original_text": "Einreichung neuer Dokumente\nSchleswig-Holstein Amtsgericht Flensburg HRB 5528\nHELIOS Fachklinik Schleswig GmbH – Schleswig",
      "type": "Einreichung neuer Dokumente",
      "state": "Schleswig-Holstein",
      "amtsgericht": "Amtsgericht Flensburg",
      "registernummer": "HRB 5528",
      "registerart": "HRB",
      "company_name": "HELIOS Fachklinik Schleswig GmbH",
      "company_seat": "Schleswig",
      "details": "12.08.2025 (Bekanntmachungsdatum)\n\nSchleswig-Holstein Amtsgericht Flensburg HRB 5528\nEinreichung neuer Dokumente\n\nHELIOS Fachklinik Schleswig GmbH\nGesellschaft mit beschränkter Haftung\nSchleswig\n\nAls nicht eingetragen wird veröffentlicht: Neue Aufsichtsratsliste nach Änderung eingereicht am 06.08.2025."
    },
    {
      "date": "2025-08-12",
      "id": "120537",
      "original_text": "Löschungsankündigung\nBrandenburg Amtsgericht Potsdam HRB 36977\nTerep Energieberatung UG (haftungsbeschränkt) – Borkheide",
      "type": "Löschungsankündigung",
      "state": "Brandenburg",
      "amtsgericht": "Amtsgericht Potsdam",
      "registernummer": "HRB 36977",
      "registerart": "HRB",
      "company_name": "Terep Energieberatung UG (haftungsbeschränkt)",
      "company_seat": "Borkheide",
      "details": "12.08.2025 (Bekanntmachungsdatum)\n\nBrandenburg Amtsgericht Potsdam HRB 36977\nLöschungsankündigung\n\nTerep Energieberatung UG (haftungsbeschränkt)\nGesellschaft mit beschränkter Haftung\nBorkheide\n\nBei der nachstehenden Gesellschaft wird das Amtslöschungsverfahren gemäß § 394 FamFG eingeleitet. Widerspruchsfrist: 8 Wochen."
    },
    {
      "date": "2025-08-12",
      "id": "120538",
      "original_text": "Registerbekanntmachung nach dem Umwandlungsgesetz\nBaden-Württemberg Amtsgericht Mannheim VR 350220\nKirchliche Sozialstation Wiesloch e.V. – Wiesloch",
      "type": "Registerbekanntmachung nach dem Umwandlungsgesetz",
      "state": "Baden-Württemberg",
      "amtsgericht": "Amtsgericht Mannheim",
      "registernummer": "VR 350220",
      "registerart": "VR",
      "company_name": "Kirchliche Sozialstation Wiesloch e.V.",
      "company_seat": "Wiesloch",
      "details": "12.08.2025 (Bekanntmachungsdatum)\n\nBaden-Württemberg Amtsgericht Mannheim VR 350220\nRegisterbekanntmachung nach dem Umwandlungsgesetz 12.08.2025 (Eintragungsdatum)\n\nKirchliche Sozialstation Wiesloch e.V.\neingetragener Verein\nWiesloch\n\nAls nicht eingetragen wird bekanntgemacht: Den Gläubigern des an dem Formwechsel beteiligten Rechtsträgers ist, wenn sie binnen sechs Monaten nach dem Tag, an dem die Eintragung des Formwechsels in das Register des Sitzes desjenigen Rechtsträgers, dessen Gläubiger sie sind, nach § 19 Abs. 3 UmwG als bekanntgemacht gilt, ihren Anspruch nach Grund und Höhe schriftlich anmelden, Sicherheit zu leisten, soweit sie nicht Befriedigung verlangen können. Dieses Recht steht den Gläubigern jedoch nur zu, wenn sie glaubhaft machen, dass durch den Formwechsel die Erfüllung ihrer Forderung gefährdet wird."
    },
    {
      "date": "2025-08-12",
      "id": "120539",
      "original_text": "Registerbekanntmachung nach dem Umwandlungsgesetz\nBerlin Amtsgericht Berlin (Charlottenburg) HRB 144329\nMedia1 PL GmbH – Berlin",
      "type": "Registerbekanntmachung nach dem Umwandlungsgesetz",
      "state": "Berlin",
      "amtsgericht": "Amtsgericht Berlin (Charlottenburg)",
      "registernummer": "HRB 144329",
      "registerart": "HRB",
      "company_name": "Media1 PL GmbH",
      "company_seat": "Berlin",
      "details": "12.08.2025 (Bekanntmachungsdatum)\n\nBerlin Amtsgericht Berlin (Charlottenburg) HRB 144329\nRegisterbekanntmachung nach dem Umwandlungsgesetz 11.08.2025 (Eintragungsdatum)\n\nMedia1 PL GmbH\nGesellschaft mit beschränkter Haftung\nBerlin\n\nZu Eintragungsnummer 18 vom 11.08.2025 wird als nicht eingetragen veröffentlicht: Den Gläubigern der an der Verschmelzung beteiligten Rechtsträger ist, wenn sie binnen sechs Monaten nach dem Tag, an dem die Eintragung der Verschmelzung in das Register des Sitzes desjenigen Rechtsträgers, dessen Gläubiger sie sind, als bekannt gemacht gilt, ihren Anspruch nach Grund und Höhe schriftlich anmelden, Sicherheit zu leisten, soweit sie nicht Befriedigung verlangen können. Dieses Recht steht den Gläubigern jedoch nur zu, wenn sie glaubhaft machen, dass durch die Verschmelzung die Erfüllung ihrer Forderung gefährdet wird. Das Recht, Sicherheitsleistung zu verlangen, steht Gläubigern nicht zu, die im Falle der Insolvenz ein Recht auf vorzugsweise Befriedigung aus einer Deckungsmasse haben, die nach gesetzlicher Vorschrift zu ihrem Schutz errichtet und staatlich überwacht ist."
    },
    {
      "date": "2025-08-12",
      "id": "120540",
      "original_text": "Registerbekanntmachung nach dem Umwandlungsgesetz\nBaden-Württemberg Amtsgericht Stuttgart HRB 755931\nBühner Werbemittel GmbH – Ostfildern",
      "type": "Registerbekanntmachung nach dem Umwandlungsgesetz",
      "state": "Baden-Württemberg",
      "amtsgericht": "Amtsgericht Stuttgart",
      "registernummer": "HRB 755931",
      "registerart": "HRB",
      "company_name": "Bühner Werbemittel GmbH",
      "company_seat": "Ostfildern",
      "details": "12.08.2025 (Bekanntmachungsdatum)\n\nBaden-Württemberg Amtsgericht Stuttgart HRB 755931\nRegisterbekanntmachung nach dem Umwandlungsgesetz 12.08.2025 (Eintragungsdatum)\n\nBühner Werbemittel GmbH\nGesellschaft mit beschränkter Haftung\nOstfildern\n\nDen Gläubigern der an der Verschmelzung beteiligten Rechtsträger ist, wenn sie binnen sechs Monaten nach dem Tag, an dem die Eintragung der Verschmelzung in das Register des Sitzes desjenigen Rechtsträgers, dessen Gläubiger sie sind, nach § 19 Abs. 3 UmwG als bekanntgemacht gilt, ihren Anspruch nach Grund und Höhe schriftlich anmelden, Sicherheit zu leisten, soweit sie nicht Befriedigung verlangen können. Dieses Recht steht den Gläubigern jedoch nur zu, wenn sie glaubhaft machen, dass durch die Verschmelzung die Erfüllung ihrer Forderung gefährdet wird."
    },
    {
      "date": "2025-08-12",
      "id": "120541",
      "original_text": "Registerbekanntmachung nach dem Umwandlungsgesetz\nBerlin Amtsgericht Berlin (Charlottenburg) HRB 38659\nVAMED Deutschland Holding GmbH – Berlin",
      "type": "Registerbekanntmachung nach dem Umwandlungsgesetz",
      "state": "Berlin",
      "amtsgericht": "Amtsgericht Berlin (Charlottenburg)",
      "registernummer": "HRB 38659",
      "registerart": "HRB",
      "company_name": "VAMED Deutschland Holding GmbH",
      "company_seat": "Berlin",
      "details": "12.08.2025 (Bekanntmachungsdatum)\n\nBerlin Amtsgericht Berlin (Charlottenburg) HRB 38659\nRegisterbekanntmachung nach dem Umwandlungsgesetz 11.08.2025 (Eintragungsdatum)\n\nVAMED Deutschland Holding GmbH\nGesellschaft mit beschränkter Haftung\nBerlin\n\nZu Eintragungsnummer 49 vom 11.08.2025 wird als nicht eingetragen veröffentlicht: Den Gläubigern der an der Verschmelzung beteiligten Rechtsträger ist, wenn sie binnen sechs Monaten nach dem Tag, an dem die Eintragung der Verschmelzung in das Register des Sitzes desjenigen Rechtsträgers, dessen Gläubiger sie sind, als bekannt gemacht gilt, ihren Anspruch nach Grund und Höhe schriftlich anmelden, Sicherheit zu leisten, soweit sie nicht Befriedigung verlangen können. Dieses Recht steht den Gläubigern jedoch nur zu, wenn sie glaubhaft machen, dass durch die Verschmelzung die Erfüllung ihrer Forderung gefährdet wird. Das Recht, Sicherheitsleistung zu verlangen, steht Gläubigern nicht zu, die im Falle der Insolvenz ein Recht auf vorzugsweise Befriedigung aus einer Deckungsmasse haben, die nach gesetzlicher Vorschrift zu ihrem Schutz errichtet und staatlich überwacht ist."
    },
    {
      "date": "2025-08-12",
      "id": "120542",
      "original_text": "Löschungsankündigung\nBerlin Amtsgericht Berlin (Charlottenburg) HRB 185364\nBau-Konstruktor BK GmbH – Berlin",
      "type": "Löschungsankündigung",
      "state": "Berlin",
      "amtsgericht": "Amtsgericht Berlin (Charlottenburg)",
      "registernummer": "HRB 185364",
      "registerart": "HRB",
      "company_name": "Bau-Konstruktor BK GmbH",
      "company_seat": "Berlin",
      "details": "12.08.2025 (Bekanntmachungsdatum)\n\nBerlin Amtsgericht Berlin (Charlottenburg) HRB 185364\nLöschungsankündigung\n\nBau-Konstruktor BK GmbH\nGesellschaft mit beschränkter Haftung\nBerlin\n\nBei der nachstehenden Gesellschaft wird das Amtslöschungsverfahren gemäß § 394 FamFG eingeleitet. Widerspruchsfrist 6 Wochen"
    },
    {
      "date": "2025-08-12",
      "id": "120543",
      "original_text": "Registerbekanntmachung nach dem Umwandlungsgesetz\nSaarland Amtsgericht Saarbrücken HRB 11391\nAssVerm Assekuranz-Vermittlungs- Aktiengesellschaft – Saarbrücken",
      "type": "Registerbekanntmachung nach dem Umwandlungsgesetz",
      "state": "Saarland",
      "amtsgericht": "Amtsgericht Saarbrücken",
      "registernummer": "HRB 11391",
      "registerart": "HRB",
      "company_name": "AssVerm Assekuranz-Vermittlungs- Aktiengesellschaft",
      "company_seat": "Saarbrücken",
      "details": "12.08.2025 (Bekanntmachungsdatum)\n\nSaarland Amtsgericht Saarbrücken HRB 11391\nRegisterbekanntmachung nach dem Umwandlungsgesetz 11.08.2025 (Eintragungsdatum)\n\nAssVerm Assekuranz-Vermittlungs- Aktiengesellschaft\nAktiengesellschaft\nSaarbrücken\n\nAls nicht eingetragen wird bekannt gemacht: Den Gläubigern der an der Verschmelzung beteiligten Gesellschaften ist, wenn sie binnen sechs Monaten nach dem Tag, an dem die Eintragung der Verschmelzung in das Register des Sitzes desjenigen Rechtsträgers, dessen Gläubiger sie sind, nach § 19 Absatz 3 UmwG bekannt gemacht worden ist, ihren Anspruch nach Grund und Höhe schriftlich anmelden, Sicherheit zu leisten, soweit sie nicht Befriedigung verlangen können. Dieses Recht steht den Gläubigern jedoch nur zu, wenn sie glaubhaft machen, dass durch die Verschmelzung die Erfüllung ihrer Forderung gefährdet wird."
    },
    {
      "date": "2025-08-12",
      "id": "120544",
      "original_text": "Registerbekanntmachung nach dem Umwandlungsgesetz\nBaden-Württemberg Amtsgericht Stuttgart HRB 225998\nUFG GmbH, Gesellschaft für Unternehmensberatung und Immobilienbesitz – Filderstadt",
      "type": "Registerbekanntmachung nach dem Umwandlungsgesetz",
      "state": "Baden-Württemberg",
      "amtsgericht": "Amtsgericht Stuttgart",
      "registernummer": "HRB 225998",
      "registerart": "HRB",
      "company_name": "UFG GmbH, Gesellschaft für Unternehmensberatung und Immobilienbesitz",
      "company_seat": "Filderstadt",
      "details": "12.08.2025 (Bekanntmachungsdatum)\n\nBaden-Württemberg Amtsgericht Stuttgart HRB 225998\nRegisterbekanntmachung nach dem Umwandlungsgesetz 12.08.2025 (Eintragungsdatum)\n\nUFG GmbH, Gesellschaft für Unternehmensberatung und Immobilienbesitz\nGesellschaft mit beschränkter Haftung\nFilderstadt\n\nAls nicht eingetragen wird bekanntgemacht:\nDen Gläubigern der an der Verschmelzung beteiligten Rechtsträger ist, wenn sie binnen sechs Monaten nach dem Tag, an dem die Eintragung der Verschmelzung in das Register des Sitzes desjenigen Rechtsträgers, dessen Gläubiger sie sind, nach § 19 Abs. 3 UmwG als bekanntgemacht gilt, ihren Anspruch nach Grund und Höhe schriftlich anmelden, Sicherheit zu leisten, soweit sie nicht Befriedigung verlangen können. Dieses Recht steht den Gläubigern jedoch nur zu, wenn sie glaubhaft machen, dass durch die Verschmelzung die Erfüllung ihrer Forderung gefährdet wird."
    },
    {
      "date": "2025-08-12",
      "id": "120545",
      "original_text": "Registerbekanntmachung nach dem Umwandlungsgesetz\nHamburg Amtsgericht Hamburg HRB 159217\nRF Secondary GmbH – Hamburg",
      "type": "Registerbekanntmachung nach dem Umwandlungsgesetz",
      "state": "Hamburg",
      "amtsgericht": "Amtsgericht Hamburg",
      "registernummer": "HRB 159217",
      "registerart": "HRB",
      "company_name": "RF Secondary GmbH",
      "company_seat": "Hamburg",
      "details": "12.08.2025 (Bekanntmachungsdatum)\n\nHamburg Amtsgericht Hamburg HRB 159217\nRegisterbekanntmachung nach dem Umwandlungsgesetz 12.08.2025 (Eintragungsdatum)\n\nRF Secondary GmbH\nGesellschaft mit beschränkter Haftung\nHamburg\n\nAls nicht eingetragen wird bekannt gemacht:\nDen Gläubigern der an der Verschmelzung beteiligten Gesellschaften ist, wenn sie binnen sechs Monaten nach dem Tag, an dem die Eintragung der Verschmelzung in das Register des Sitzes desjenigen Rechtsträgers, dessen Gläubiger sie sind, nach § 19 Absatz 3 UmwG als bekannt gemacht gilt, ihren Anspruch nach Grund und Höhe schriftlich anmelden, Sicherheit zu leisten, soweit sie nicht Befriedigung verlangen können. Dieses Recht steht den Gläubigern jedoch nur zu, wenn sie glaubhaft machen, dass durch die Verschmelzung die Erfüllung ihrer Forderung gefährdet wird."
    },
    {
      "date": "2025-08-12",
      "id": "120546",
      "original_text": "Registerbekanntmachung nach dem Umwandlungsgesetz\nHamburg Amtsgericht Hamburg HRB 159724\nN39 AkquiCo GmbH – Hamburg",
      "type": "Registerbekanntmachung nach dem Umwandlungsgesetz",
      "state": "Hamburg",
      "amtsgericht": "Amtsgericht Hamburg",
      "registernummer": "HRB 159724",
      "registerart": "HRB",
      "company_name": "N39 AkquiCo GmbH",
      "company_seat": "Hamburg",
      "details": "12.08.2025 (Bekanntmachungsdatum)\n\nHamburg Amtsgericht Hamburg HRB 159724\nRegisterbekanntmachung nach dem Umwandlungsgesetz 12.08.2025 (Eintragungsdatum)\n\nN39 AkquiCo GmbH\nGesellschaft mit beschränkter Haftung\nHamburg\n\nAls nicht eingetragen wird bekannt gemacht:\nDen Gläubigern der an der Verschmelzung beteiligten Gesellschaften ist, wenn sie binnen sechs Monaten nach dem Tag, an dem die Eintragung der Verschmelzung in das Register des Sitzes desjenigen Rechtsträgers, dessen Gläubiger sie sind, nach § 19 Absatz 3 UmwG als bekannt gemacht gilt, ihren Anspruch nach Grund und Höhe schriftlich anmelden, Sicherheit zu leisten, soweit sie nicht Befriedigung verlangen können. Dieses Recht steht den Gläubigern jedoch nur zu, wenn sie glaubhaft machen, dass durch die Verschmelzung die Erfüllung ihrer Forderung gefährdet wird."
    },
    {
      "date": "2025-08-12",
      "id": "120547",
      "original_text": "Registerbekanntmachung nach dem Umwandlungsgesetz\nBaden-Württemberg Amtsgericht Stuttgart HRB 748954\nHolzwarth Vermögensverwaltungs GmbH – Ludwigsburg",
      "type": "Registerbekanntmachung nach dem Umwandlungsgesetz",
      "state": "Baden-Württemberg",
      "amtsgericht": "Amtsgericht Stuttgart",
      "registernummer": "HRB 748954",
      "registerart": "HRB",
      "company_name": "Holzwarth Vermögensverwaltungs GmbH",
      "company_seat": "Ludwigsburg",
      "details": "12.08.2025 (Bekanntmachungsdatum)\n\nBaden-Württemberg Amtsgericht Stuttgart HRB 748954\nRegisterbekanntmachung nach dem Umwandlungsgesetz 12.08.2025 (Eintragungsdatum)\n\nHolzwarth Vermögensverwaltungs GmbH\nGesellschaft mit beschränkter Haftung\nLudwigsburg\n\nAls nicht eingetragen wird bekanntgemacht:\nDen Gläubigern der an der Verschmelzung beteiligten Rechtsträger ist, wenn sie binnen sechs Monaten nach dem Tag, an dem die Eintragung der Verschmelzung in das Register des Sitzes desjenigen Rechtsträgers, dessen Gläubiger sie sind, nach § 19 Abs. 3 UmwG als bekanntgemacht gilt, ihren Anspruch nach Grund und Höhe schriftlich anmelden, Sicherheit zu leisten, soweit sie nicht Befriedigung verlangen können. Dieses Recht steht den Gläubigern jedoch nur zu, wenn sie glaubhaft machen, dass durch die Verschmelzung die Erfüllung ihrer Forderung gefährdet wird."
    },
    {
      "date": "2025-08-12",
      "id": "120548",
      "original_text": "Löschungsankündigung\nBerlin Amtsgericht Berlin (Charlottenburg) HRB 129669\nTMZ Berlin Technologiezentrum für minimalinvasive Zahnheilkunde und Prothetik Handels UG (haftungsbeschränkt) – Berlin",
      "type": "Löschungsankündigung",
      "state": "Berlin",
      "amtsgericht": "Amtsgericht Berlin (Charlottenburg)",
      "registernummer": "HRB 129669",
      "registerart": "HRB",
      "company_name": "TMZ Berlin Technologiezentrum für minimalinvasive Zahnheilkunde und Prothetik Handels UG (haftungsbeschränkt)",
      "company_seat": "Berlin",
      "details": "12.08.2025 (Bekanntmachungsdatum)\n\nBerlin Amtsgericht Berlin (Charlottenburg) HRB 129669\nLöschungsankündigung\n\nTMZ Berlin Technologiezentrum für minimalinvasive Zahnheilkunde und Prothetik Handels UG (haftungsbeschränkt)\nGesellschaft mit beschränkter Haftung\nBerlin\n\nBei der nachstehenden Gesellschaft wird das Amtslöschungsverfahren gemäß § 394 FamFG eingeleitet. Widerspruchsfrist 6 Wochen"
    },
    {
      "date": "2025-08-12",
      "id": "120549",
      "original_text": "Löschungsankündigung\nBerlin Amtsgericht Berlin (Charlottenburg) HRB 151941\nS. C. Colini GmbH – Berlin",
      "type": "Löschungsankündigung",
      "state": "Berlin",
      "amtsgericht": "Amtsgericht Berlin (Charlottenburg)",
      "registernummer": "HRB 151941",
      "registerart": "HRB",
      "company_name": "S. C. Colini GmbH",
      "company_seat": "Berlin",
      "details": "12.08.2025 (Bekanntmachungsdatum)\n\nBerlin Amtsgericht Berlin (Charlottenburg) HRB 151941\nLöschungsankündigung\n\nS. C. Colini GmbH\nGesellschaft mit beschränkter Haftung\nBerlin\n\nBei der nachstehenden Gesellschaft wird das Amtslöschungsverfahren gemäß § 394 FamFG eingeleitet. Widerspruchsfrist 6 Wochen"
    },
    {
      "date": "2025-08-12",
      "id": "120550",
      "original_text": "Registerbekanntmachung nach dem Umwandlungsgesetz\nBaden-Württemberg Amtsgericht Stuttgart HRB 767677\nSBB Spezial-Baustoffe Beteiligungs GmbH – Möglingen",
      "type": "Registerbekanntmachung nach dem Umwandlungsgesetz",
      "state": "Baden-Württemberg",
      "amtsgericht": "Amtsgericht Stuttgart",
      "registernummer": "HRB 767677",
      "registerart": "HRB",
      "company_name": "SBB Spezial-Baustoffe Beteiligungs GmbH",
      "company_seat": "Möglingen",
      "details": "12.08.2025 (Bekanntmachungsdatum)\n\nBaden-Württemberg Amtsgericht Stuttgart HRB 767677\nRegisterbekanntmachung nach dem Umwandlungsgesetz 12.08.2025 (Eintragungsdatum)\n\nSBB Spezial-Baustoffe Beteiligungs GmbH\nGesellschaft mit beschränkter Haftung\nMöglingen\n\nDen Gläubigern der an der Verschmelzung beteiligten Rechtsträger ist, wenn sie binnen sechs Monaten nach dem Tag, an dem die Eintragung der Verschmelzung in das Register des Sitzes desjenigen Rechtsträgers, dessen Gläubiger sie sind, nach § 19 Abs. 3 UmwG als bekanntgemacht gilt, ihren Anspruch nach Grund und Höhe schriftlich anmelden, Sicherheit zu leisten, soweit sie nicht Befriedigung verlangen können. Dieses Recht steht den Gläubigern jedoch nur zu, wenn sie glaubhaft machen, dass durch die Verschmelzung die Erfüllung ihrer Forderung gefährdet wird."
    },
    {
      "date": "2025-08-12",
      "id": "120551",
      "original_text": "Registerbekanntmachung nach dem Umwandlungsgesetz\nBrandenburg Amtsgericht Potsdam HRB 17751\nFMP Forderungsmanagement Potsdam GmbH – Potsdam",
      "type": "Registerbekanntmachung nach dem Umwandlungsgesetz",
      "state": "Brandenburg",
      "amtsgericht": "Amtsgericht Potsdam",
      "registernummer": "HRB 17751",
      "registerart": "HRB",
      "company_name": "FMP Forderungsmanagement Potsdam GmbH",
      "company_seat": "Potsdam",
      "details": "12.08.2025 (Bekanntmachungsdatum)\n\nBrandenburg Amtsgericht Potsdam HRB 17751\nRegisterbekanntmachung nach dem Umwandlungsgesetz 11.08.2025 (Eintragungsdatum)\n\nFMP Forderungsmanagement Potsdam GmbH\nGesellschaft mit beschränkter Haftung\nPotsdam\n\nZu Eintragungsnummer 22 vom 11.08.2025 wird als nicht eingetragen veröffentlicht:\nDen Gläubigern der an der Spaltung beteiligten Rechtsträger ist, wenn sie binnen sechs Monaten nach dem Tag, an dem die Eintragung der Spaltung in das Register des Sitzes desjenigen Rechtsträgers, dessen Gläubiger sie sind, als bekannt gemacht gilt, ihren Anspruch nach Grund und Höhe schriftlich anmelden, Sicherheit zu leisten, soweit sie nicht Befriedigung verlangen können. Dieses Recht steht den Gläubigern jedoch nur zu, wenn sie glaubhaft machen, dass durch die Spaltung die Erfüllung ihrer Forderung gefährdet wird"
    },
    {
      "date": "2025-08-12",
      "id": "120552",
      "original_text": "Registerbekanntmachung nach dem Umwandlungsgesetz\nBaden-Württemberg Amtsgericht Stuttgart HRB 784933\nLeingang E-Commerce GmbH – Bietigheim-Bissingen",
      "type": "Registerbekanntmachung nach dem Umwandlungsgesetz",
      "state": "Baden-Württemberg",
      "amtsgericht": "Amtsgericht Stuttgart",
      "registernummer": "HRB 784933",
      "registerart": "HRB",
      "company_name": "Leingang E-Commerce GmbH",
      "company_seat": "Bietigheim-Bissingen",
      "details": "12.08.2025 (Bekanntmachungsdatum)\n\nBaden-Württemberg Amtsgericht Stuttgart HRB 784933\nRegisterbekanntmachung nach dem Umwandlungsgesetz 12.08.2025 (Eintragungsdatum)\n\nLeingang E-Commerce GmbH\nGesellschaft mit beschränkter Haftung\nBietigheim-Bissingen\n\nAls nicht eingetragen wird bekanntgemacht:\nDen Gläubigern der an der Verschmelzung beteiligten Rechtsträger ist, wenn sie binnen sechs Monaten nach dem Tag, an dem die Eintragung der Verschmelzung in das Register des Sitzes desjenigen Rechtsträgers, dessen Gläubiger sie sind, nach § 19 Abs. 3 UmwG als bekanntgemacht gilt, ihren Anspruch nach Grund und Höhe schriftlich anmelden, Sicherheit zu leisten, soweit sie nicht Befriedigung verlangen können. Dieses Recht steht den Gläubigern jedoch nur zu, wenn sie glaubhaft machen, dass durch die Verschmelzung die Erfüllung ihrer Forderung gefährdet wird."
    },
    {
      "date": "2025-08-12",
      "id": "120553",
      "original_text": "Registerbekanntmachung nach dem Umwandlungsgesetz\nNordrhein-Westfalen Amtsgericht Coesfeld HRB 19630\nWestBit GmbH – Dülmen",
      "type": "Registerbekanntmachung nach dem Umwandlungsgesetz",
      "state": "Nordrhein-Westfalen",
      "amtsgericht": "Amtsgericht Coesfeld",
      "registernummer": "HRB 19630",
      "registerart": "HRB",
      "company_name": "WestBit GmbH",
      "company_seat": "Dülmen",
      "details": "12.08.2025 (Bekanntmachungsdatum)\n\nNordrhein-Westfalen Amtsgericht Coesfeld HRB 19630\nRegisterbekanntmachung nach dem Umwandlungsgesetz 12.08.2025 (Eintragungsdatum)\n\nWestBit GmbH\nGesellschaft mit beschränkter Haftung\nDülmen\n\nDen Gläubigern der an der Verschmelzung beteiligten Rechtsträger ist, wenn sie binnen sechs Monaten nach dem Tag, an dem die Eintragung der Verschmelzung in das Register des Sitzes derjenigen Rechtsträger deren Gläubiger sie sind, nach § 19 Absatz 3 UmwG als bekanntgemacht gilt, ihren Anspruch nach Grund und Höhe schriftlich anmelden, Sicherheit zu leisten, soweit sie nicht Befriedigung verlangen können. Dieses Recht steht den Gläubigern jedoch nur zu, wenn sie glaubhaft machen, dass durch die Verschmelzung die Erfüllung ihrer Forderung gefährdet wird."
    },
    {
      "date": "2025-08-12",
      "id": "120554",
      "original_text": "Löschungsankündigung\nBaden-Württemberg Amtsgericht Stuttgart HRB 766055\nFix Transporte GmbH – Kirchheim unter Teck",
      "type": "Löschungsankündigung",
      "state": "Baden-Württemberg",
      "amtsgericht": "Amtsgericht Stuttgart",
      "registernummer": "HRB 766055",
      "registerart": "HRB",
      "company_name": "Fix Transporte GmbH",
      "company_seat": "Kirchheim unter Teck",
      "details": "12.08.2025 (Bekanntmachungsdatum)\n\nBaden-Württemberg Amtsgericht Stuttgart HRB 766055\nLöschungsankündigung\n\nFix Transporte GmbH\nGesellschaft mit beschränkter Haftung\nKirchheim unter Teck\n\nAls nicht eingetragen wird bekanntgemacht:\nDas Gericht beabsichtigt, die Gesellschaft wegen Vermögenslosigkeit im Handelsregister von Amts wegen nach § 394 FamFG zu löschen. Die Frist zur Geltendmachung eines Widerspruchs gegen die beabsichtigte Löschung ist auf zwei Monate ab Veröffentlichung bestimmt."
    },
    {
      "date": "2025-08-12",
      "id": "120555",
      "original_text": "Registerbekanntmachung nach dem Umwandlungsgesetz\nSchleswig-Holstein Amtsgericht Flensburg HRA 11424\nNorbert Mangelsen e. K. – Sylt",
      "type": "Registerbekanntmachung nach dem Umwandlungsgesetz",
      "state": "Schleswig-Holstein",
      "amtsgericht": "Amtsgericht Flensburg",
      "registernummer": "HRA 11424",
      "registerart": "HRA",
      "company_name": "Norbert Mangelsen e. K.",
      "company_seat": "Sylt",
      "details": "12.08.2025 (Bekanntmachungsdatum)\n\nSchleswig-Holstein Amtsgericht Flensburg HRA 11424\nRegisterbekanntmachung nach dem Umwandlungsgesetz 11.08.2025 (Eintragungsdatum)\n\nNorbert Mangelsen e. K.\nEinzelkaufmann / Einzelkauffrau\nSylt\n\nZu Eintragungsnummer 2 vom 11.08.2025 wird als nicht eingetragen veröffentlicht: Den Gläubigern der an der Spaltung beteiligten Rechtsträger ist, wenn sie binnen sechs Monaten nach dem Tag, an dem die Eintragung der Spaltung in das Register des Sitzes desjenigen Rechtsträgers, dessen Gläubiger sie sind, als bekannt gemacht gilt, ihren Anspruch nach Grund und Höhe schriftlich anmelden, Sicherheit zu leisten, soweit sie nicht Befriedigung verlangen können. Dieses Recht steht den Gläubigern jedoch nur zu, wenn sie glaubhaft machen, dass durch die Spaltung die Erfüllung ihrer Forderung gefährdet wird. Das Recht, Sicherheitsleistung zu verlangen, steht Gläubigern nicht zu, die im Falle der Insolvenz ein Recht auf vorzugsweise Befriedigung aus einer Deckungsmasse haben, die nach gesetzlicher Vorschrift zu ihrem Schutz errichtet und staatlich überwacht ist."
    },
    {
      "date": "2025-08-12",
      "id": "120556",
      "original_text": "Registerbekanntmachung nach dem Umwandlungsgesetz\nBaden-Württemberg Amtsgericht Freiburg HRB 733615\nHRp GmbH – Freiburg im Breisgau",
      "type": "Registerbekanntmachung nach dem Umwandlungsgesetz",
      "state": "Baden-Württemberg",
      "amtsgericht": "Amtsgericht Freiburg",
      "registernummer": "HRB 733615",
      "registerart": "HRB",
      "company_name": "HRp GmbH",
      "company_seat": "Freiburg im Breisgau",
      "details": "12.08.2025 (Bekanntmachungsdatum)\n\nBaden-Württemberg Amtsgericht Freiburg HRB 733615\nRegisterbekanntmachung nach dem Umwandlungsgesetz 12.08.2025 (Eintragungsdatum)\n\nHRp GmbH\nGesellschaft mit beschränkter Haftung\nFreiburg im Breisgau\n\nAls nicht eingetragen wird bekanntgemacht:\nDen Gläubigern der an der Verschmelzung beteiligten Rechtsträger ist, wenn sie binnen sechs Monaten nach dem Tag, an dem die Eintragung der Verschmelzung in das Register des Sitzes desjenigen Rechtsträgers, dessen Gläubiger sie sind, nach § 19 Abs. 3 UmwG als bekanntgemacht gilt, ihren Anspruch nach Grund und Höhe schriftlich anmelden, Sicherheit zu leisten, soweit sie nicht Befriedigung verlangen können. Dieses Recht steht den Gläubigern jedoch nur zu, wenn sie glaubhaft machen, dass durch die Verschmelzung die Erfüllung ihrer Forderung gefährdet wird."
    },
    {
      "date": "2025-08-12",
      "id": "120557",
      "original_text": "Registerbekanntmachung nach dem Umwandlungsgesetz\nBaden-Württemberg Amtsgericht Stuttgart HRB 743448\nJung's Telemarketing GmbH – Jagsthausen",
      "type": "Registerbekanntmachung nach dem Umwandlungsgesetz",
      "state": "Baden-Württemberg",
      "amtsgericht": "Amtsgericht Stuttgart",
      "registernummer": "HRB 743448",
      "registerart": "HRB",
      "company_name": "Jung's Telemarketing GmbH",
      "company_seat": "Jagsthausen",
      "details": "12.08.2025 (Bekanntmachungsdatum)\n\nBaden-Württemberg Amtsgericht Stuttgart HRB 743448\nRegisterbekanntmachung nach dem Umwandlungsgesetz 12.08.2025 (Eintragungsdatum)\n\nJung's Telemarketing GmbH\nGesellschaft mit beschränkter Haftung\nJagsthausen\n\nAls nicht eingetragen wird bekanntgemacht:\nDen Gläubigern der an der Verschmelzung beteiligten Rechtsträger ist, wenn sie binnen sechs Monaten nach dem Tag, an dem die Eintragung der Verschmelzung in das Register des Sitzes desjenigen Rechtsträgers, dessen Gläubiger sie sind, nach § 19 Abs. 3 UmwG als bekanntgemacht gilt, ihren Anspruch nach Grund und Höhe schriftlich anmelden, Sicherheit zu leisten, soweit sie nicht Befriedigung verlangen können. Dieses Recht steht den Gläubigern jedoch nur zu, wenn sie glaubhaft machen, dass durch die Verschmelzung die Erfüllung ihrer Forderung gefährdet wird."
    },
    {
      "date": "2025-08-12",
      "id": "120558",
      "original_text": "Registerbekanntmachung nach dem Umwandlungsgesetz\nBaden-Württemberg Amtsgericht Freiburg HRB 709579\nmotivation analytics UG (haftungsbeschränkt) – Freiburg im Breisgau",
      "type": "Registerbekanntmachung nach dem Umwandlungsgesetz",
      "state": "Baden-Württemberg",
      "amtsgericht": "Amtsgericht Freiburg",
      "registernummer": "HRB 709579",
      "registerart": "HRB",
      "company_name": "motivation analytics UG (haftungsbeschränkt)",
      "company_seat": "Freiburg im Breisgau",
      "details": "12.08.2025 (Bekanntmachungsdatum)\n\nBaden-Württemberg Amtsgericht Freiburg HRB 709579\nRegisterbekanntmachung nach dem Umwandlungsgesetz 12.08.2025 (Eintragungsdatum)\n\nmotivation analytics UG (haftungsbeschränkt)\nGesellschaft mit beschränkter Haftung\nFreiburg im Breisgau\n\nDen Gläubigern der an der Verschmelzung beteiligten Rechtsträger ist, wenn sie binnen sechs Monaten nach dem Tag, an dem die Eintragung der Verschmelzung in das Register des Sitzes desjenigen Rechtsträgers, dessen Gläubiger sie sind, nach § 19 Abs. 3 UmwG als bekanntgemacht gilt, ihren Anspruch nach Grund und Höhe schriftlich anmelden, Sicherheit zu leisten, soweit sie nicht Befriedigung verlangen können. Dieses Recht steht den Gläubigern jedoch nur zu, wenn sie glaubhaft machen, dass durch die Verschmelzung die Erfüllung ihrer Forderung gefährdet wird."
    },
    {
      "date": "2025-08-12",
      "id": "120559",
      "original_text": "Einreichung neuer Dokumente\nBaden-Württemberg Amtsgericht Stuttgart HRB 301046\nStädtische Holding Bietigheim-Bissingen GmbH – Bietigheim-Bissingen",
      "type": "Einreichung neuer Dokumente",
      "state": "Baden-Württemberg",
      "amtsgericht": "Amtsgericht Stuttgart",
      "registernummer": "HRB 301046",
      "registerart": "HRB",
      "company_name": "Städtische Holding Bietigheim-Bissingen GmbH",
      "company_seat": "Bietigheim-Bissingen",
      "details": "12.08.2025 (Bekanntmachungsdatum)\n\nBaden-Württemberg Amtsgericht Stuttgart HRB 301046\nEinreichung neuer Dokumente 12.08.2025 (Eintragungsdatum)\n\nStädtische Holding Bietigheim-Bissingen GmbH\nGesellschaft mit beschränkter Haftung\nBietigheim-Bissingen\n\nDie Gesellschaft hat am 08.08.2025 die Liste über die Zusammensetzung des Aufsichtsrats zum Handelsregister eingereicht."
    },
    {
      "date": "2025-08-12",
      "id": "120560",
      "original_text": "Registerbekanntmachung nach dem Umwandlungsgesetz\nBaden-Württemberg Amtsgericht Stuttgart HRB 798777\nAxiom Ventures GmbH – Tuttlingen",
      "type": "Registerbekanntmachung nach dem Umwandlungsgesetz",
      "state": "Baden-Württemberg",
      "amtsgericht": "Amtsgericht Stuttgart",
      "registernummer": "HRB 798777",
      "registerart": "HRB",
      "company_name": "Axiom Ventures GmbH",
      "company_seat": "Tuttlingen",
      "details": "12.08.2025 (Bekanntmachungsdatum)\n\nBaden-Württemberg Amtsgericht Stuttgart HRB 798777\nRegisterbekanntmachung nach dem Umwandlungsgesetz 12.08.2025 (Eintragungsdatum)\n\nAxiom Ventures GmbH\nGesellschaft mit beschränkter Haftung\nTuttlingen\n\nDen Gläubigern der an der Verschmelzung beteiligten Rechtsträger ist, wenn sie binnen sechs Monaten nach dem Tag, an dem die Eintragung der Verschmelzung in das Register des Sitzes desjenigen Rechtsträgers, dessen Gläubiger sie sind, nach § 19 Abs. 3 UmwG als bekanntgemacht gilt, ihren Anspruch nach Grund und Höhe schriftlich anmelden, Sicherheit zu leisten, soweit sie nicht Befriedigung verlangen können. Dieses Recht steht den Gläubigern jedoch nur zu, wenn sie glaubhaft machen, dass durch die Verschmelzung die Erfüllung ihrer Forderung gefährdet wird."
    },
    {
      "date": "2025-08-12",
      "id": "120561",
      "original_text": "Einreichung neuer Dokumente\nBaden-Württemberg Amtsgericht Stuttgart HRB 752094\nODYSYS AG – Mundelsheim",
      "type": "Einreichung neuer Dokumente",
      "state": "Baden-Württemberg",
      "amtsgericht": "Amtsgericht Stuttgart",
      "registernummer": "HRB 752094",
      "registerart": "HRB",
      "company_name": "ODYSYS AG",
      "company_seat": "Mundelsheim",
      "details": "12.08.2025 (Bekanntmachungsdatum)\n\nBaden-Württemberg Amtsgericht Stuttgart HRB 752094\nEinreichung neuer Dokumente 12.08.2025 (Eintragungsdatum)\n\nODYSYS AG\nAktiengesellschaft\nMundelsheim\n\nAls nicht eingetragen wird bekanntgemacht:\nDie Gesellschaft hat am 06.06.2025 die Liste über die Zusammensetzung des Aufsichtsrats zum Handelsregister eingereicht."
    },
    {
      "date": "2025-08-12",
      "id": "120562",
      "original_text": "Einreichung neuer Dokumente\nBaden-Württemberg Amtsgericht Stuttgart HRB 793446\nWohnen Weinsberg GmbH – Weinsberg",
      "type": "Einreichung neuer Dokumente",
      "state": "Baden-Württemberg",
      "amtsgericht": "Amtsgericht Stuttgart",
      "registernummer": "HRB 793446",
      "registerart": "HRB",
      "company_name": "Wohnen Weinsberg GmbH",
      "company_seat": "Weinsberg",
      "details": "12.08.2025 (Bekanntmachungsdatum)\n\nBaden-Württemberg Amtsgericht Stuttgart HRB 793446\nEinreichung neuer Dokumente\n\nWohnen Weinsberg GmbH\nGesellschaft mit beschränkter Haftung\nWeinsberg\n\nDie Gesellschaft hat am 12.08.2025 die Liste über die Zusammensetzung des Aufsichtsrats zum Handelsregister eingereicht."
    },
    {
      "date": "2025-08-12",
      "id": "120563",
      "original_text": "Registerbekanntmachung nach dem Umwandlungsgesetz\nHamburg Amtsgericht Hamburg HRB 90556\nTREBITSCH ENTERTAINMENT GmbH – Hamburg",
      "type": "Registerbekanntmachung nach dem Umwandlungsgesetz",
      "state": "Hamburg",
      "amtsgericht": "Amtsgericht Hamburg",
      "registernummer": "HRB 90556",
      "registerart": "HRB",
      "company_name": "TREBITSCH ENTERTAINMENT GmbH",
      "company_seat": "Hamburg",
      "details": "12.08.2025 (Bekanntmachungsdatum)\n\nHamburg Amtsgericht Hamburg HRB 90556\nRegisterbekanntmachung nach dem Umwandlungsgesetz 12.08.2025 (Eintragungsdatum)\n\nTREBITSCH ENTERTAINMENT GmbH\nGesellschaft mit beschränkter Haftung\nHamburg\n\nAls nicht eingetragen wird bekannt gemacht:\nDen Gläubigern der an der Verschmelzung beteiligten Gesellschaften ist, wenn sie binnen sechs Monaten nach dem Tag, an dem die Eintragung der Verschmelzung in das Register des Sitzes desjenigen Rechtsträgers, dessen Gläubiger sie sind, nach § 19 Absatz 3 UmwG als bekannt gemacht gilt, ihren Anspruch nach Grund und Höhe schriftlich anmelden, Sicherheit zu leisten, soweit sie nicht Befriedigung verlangen können. Dieses Recht steht den Gläubigern jedoch nur zu, wenn sie glaubhaft machen, dass durch die Verschmelzung die Erfüllung ihrer Forderung gefährdet wird."
    },
    {
      "date": "2025-08-12",
      "id": "120564",
      "original_text": "Registerbekanntmachung nach dem Umwandlungsgesetz\nSaarland Amtsgericht Saarbrücken HRB 106868\nRhenus Finance GmbH – St. Ingbert",
      "type": "Registerbekanntmachung nach dem Umwandlungsgesetz",
      "state": "Saarland",
      "amtsgericht": "Amtsgericht Saarbrücken",
      "registernummer": "HRB 106868",
      "registerart": "HRB",
      "company_name": "Rhenus Finance GmbH",
      "company_seat": "St. Ingbert",
      "details": "12.08.2025 (Bekanntmachungsdatum)\n\nSaarland Amtsgericht Saarbrücken HRB 106868\nRegisterbekanntmachung nach dem Umwandlungsgesetz 12.08.2025 (Eintragungsdatum)\n\nRhenus Finance GmbH\nGesellschaft mit beschränkter Haftung\nSt. Ingbert\n\nAls nicht eingetragen wird bekannt gemacht: Den Gläubigern der an der Verschmelzung beteiligten Gesellschaften ist, wenn sie binnen sechs Monaten nach dem Tag, an dem die Eintragung der Verschmelzung in das Register des Sitzes desjenigen Rechtsträgers, dessen Gläubiger sie sind, nach § 19 Absatz 3 UmwG bekannt gemacht worden ist, ihren Anspruch nach Grund und Höhe schriftlich anmelden, Sicherheit zu leisten, soweit sie nicht Befriedigung verlangen können. Dieses Recht steht den Gläubigern jedoch nur zu, wenn sie glaubhaft machen, dass durch die Verschmelzung die Erfüllung ihrer Forderung gefährdet wird."
    },
    {
      "date": "2025-08-12",
      "id": "120565",
      "original_text": "Registerbekanntmachung nach dem Umwandlungsgesetz\nBaden-Württemberg Amtsgericht Stuttgart HRB 108040\nSalat und Gemüse Express Beilstein GmbH – Beilstein",
      "type": "Registerbekanntmachung nach dem Umwandlungsgesetz",
      "state": "Baden-Württemberg",
      "amtsgericht": "Amtsgericht Stuttgart",
      "registernummer": "HRB 108040",
      "registerart": "HRB",
      "company_name": "Salat und Gemüse Express Beilstein GmbH",
      "company_seat": "Beilstein",
      "details": "12.08.2025 (Bekanntmachungsdatum)\n\nBaden-Württemberg Amtsgericht Stuttgart HRB 108040\nRegisterbekanntmachung nach dem Umwandlungsgesetz 12.08.2025 (Eintragungsdatum)\n\nSalat und Gemüse Express Beilstein GmbH\nGesellschaft mit beschränkter Haftung\nBeilstein\n\nAls nicht eingetragen wird bekanntgemacht:\nDen Gläubigern der an der Verschmelzung beteiligten Rechtsträger ist, wenn sie binnen sechs Monaten nach dem Tag, an dem die Eintragung der Verschmelzung in das Register des Sitzes desjenigen Rechtsträgers, dessen Gläubiger sie sind, nach § 19 Abs. 3 UmwG als bekanntgemacht gilt, ihren Anspruch nach Grund und Höhe schriftlich anmelden, Sicherheit zu leisten, soweit sie nicht Befriedigung verlangen können. Dieses Recht steht den Gläubigern jedoch nur zu, wenn sie glaubhaft machen, dass durch die Verschmelzung die Erfüllung ihrer Forderung gefährdet wird."
    },
    {
      "date": "2025-08-12",
      "id": "120566",
      "original_text": "Löschungsankündigung\nBerlin Amtsgericht Berlin (Charlottenburg) HRB 140184\nBaran Bau + Handel GmbH – Berlin",
      "type": "Löschungsankündigung",
      "state": "Berlin",
      "amtsgericht": "Amtsgericht Berlin (Charlottenburg)",
      "registernummer": "HRB 140184",
      "registerart": "HRB",
      "company_name": "Baran Bau + Handel GmbH",
      "company_seat": "Berlin",
      "details": "12.08.2025 (Bekanntmachungsdatum)\n\nBerlin Amtsgericht Berlin (Charlottenburg) HRB 140184\nLöschungsankündigung\n\nBaran Bau + Handel GmbH\nGesellschaft mit beschränkter Haftung\nBerlin\n\nBei der nachstehenden Gesellschaft wird das Amtslöschungsverfahren gemäß § 394 FamFG eingeleitet. Widerspruchsfrist 6 Wochen"
    },
    {
      "date": "2025-08-12",
      "id": "120567",
      "original_text": "Einreichung neuer Dokumente\nBaden-Württemberg Amtsgericht Mannheim HRB 47\nINTER Versicherungsverein aG – Mannheim",
      "type": "Einreichung neuer Dokumente",
      "state": "Baden-Württemberg",
      "amtsgericht": "Amtsgericht Mannheim",
      "registernummer": "HRB 47",
      "registerart": "HRB",
      "company_name": "INTER Versicherungsverein aG",
      "company_seat": "Mannheim",
      "details": "12.08.2025 (Bekanntmachungsdatum)\n\nBaden-Württemberg Amtsgericht Mannheim HRB 47\nEinreichung neuer Dokumente\n\nINTER Versicherungsverein aG\nVersicherungsverein auf Gegenseitigkeit\nMannheim\n\nDie Gesellschaft hat am 12.08.2025 die Liste über die Zusammensetzung des Aufsichtsrats zum Handelsregister eingereicht."
    },
    {
      "date": "2025-08-12",
      "id": "120568",
      "original_text": "Löschungsankündigung\nBerlin Amtsgericht Berlin (Charlottenburg) HRB 245232\nK & B GmbH – Berlin",
      "type": "Löschungsankündigung",
      "state": "Berlin",
      "amtsgericht": "Amtsgericht Berlin (Charlottenburg)",
      "registernummer": "HRB 245232",
      "registerart": "HRB",
      "company_name": "K & B GmbH",
      "company_seat": "Berlin",
      "details": "12.08.2025 (Bekanntmachungsdatum)\n\nBerlin Amtsgericht Berlin (Charlottenburg) HRB 245232\nLöschungsankündigung\n\nK & B GmbH\nGesellschaft mit beschränkter Haftung\nBerlin\n\nBei der nachstehenden Gesellschaft wird das Amtslöschungsverfahren gemäß § 394 FamFG eingeleitet. Widerspruchsfrist 6 Wochen"
    },
    {
      "date": "2025-08-12",
      "id": "120569",
      "original_text": "Registerbekanntmachung nach dem Umwandlungsgesetz\nBaden-Württemberg Amtsgericht Stuttgart HRB 765449\nEisenhut GmbH – Lenningen",
      "type": "Registerbekanntmachung nach dem Umwandlungsgesetz",
      "state": "Baden-Württemberg",
      "amtsgericht": "Amtsgericht Stuttgart",
      "registernummer": "HRB 765449",
      "registerart": "HRB",
      "company_name": "Eisenhut GmbH",
      "company_seat": "Lenningen",
      "details": "12.08.2025 (Bekanntmachungsdatum)\n\nBaden-Württemberg Amtsgericht Stuttgart HRB 765449\nRegisterbekanntmachung nach dem Umwandlungsgesetz 12.08.2025 (Eintragungsdatum)\n\nEisenhut GmbH\nGesellschaft mit beschränkter Haftung\nLenningen\n\nAls nicht eingetragen wird bekanntgemacht:\nDen Gläubigern der an der Verschmelzung beteiligten Rechtsträger ist, wenn sie binnen sechs Monaten nach dem Tag, an dem die Eintragung der Verschmelzung in das Register des Sitzes desjenigen Rechtsträgers, dessen Gläubiger sie sind, nach § 19 Abs. 3 UmwG als bekanntgemacht gilt, ihren Anspruch nach Grund und Höhe schriftlich anmelden, Sicherheit zu leisten, soweit sie nicht Befriedigung verlangen können. Dieses Recht steht den Gläubigern jedoch nur zu, wenn sie glaubhaft machen, dass durch die Verschmelzung die Erfüllung ihrer Forderung gefährdet wird."
    },
    {
      "date": "2025-08-12",
      "id": "120570",
      "original_text": "Registerbekanntmachung nach dem Umwandlungsgesetz\nBaden-Württemberg Amtsgericht Stuttgart HRB 211084\nBühner Verwaltungs GmbH – Ostfildern",
      "type": "Registerbekanntmachung nach dem Umwandlungsgesetz",
      "state": "Baden-Württemberg",
      "amtsgericht": "Amtsgericht Stuttgart",
      "registernummer": "HRB 211084",
      "registerart": "HRB",
      "company_name": "Bühner Verwaltungs GmbH",
      "company_seat": "Ostfildern",
      "details": "12.08.2025 (Bekanntmachungsdatum)\n\nBaden-Württemberg Amtsgericht Stuttgart HRB 211084\nRegisterbekanntmachung nach dem Umwandlungsgesetz 12.08.2025 (Eintragungsdatum)\n\nBühner Verwaltungs GmbH\nGesellschaft mit beschränkter Haftung\nOstfildern\n\nAls nicht eingetragen wird bekanntgemacht:\nDen Gläubigern der an der Verschmelzung beteiligten Rechtsträger ist, wenn sie binnen sechs Monaten nach dem Tag, an dem die Eintragung der Verschmelzung in das Register des Sitzes desjenigen Rechtsträgers, dessen Gläubiger sie sind, nach § 19 Abs. 3 UmwG als bekanntgemacht gilt, ihren Anspruch nach Grund und Höhe schriftlich anmelden, Sicherheit zu leisten, soweit sie nicht Befriedigung verlangen können. Dieses Recht steht den Gläubigern jedoch nur zu, wenn sie glaubhaft machen, dass durch die Verschmelzung die Erfüllung ihrer Forderung gefährdet wird."
    },
    {
      "date": "2025-08-12",
      "id": "120571",
      "original_text": "Registerbekanntmachung nach dem Umwandlungsgesetz\nHamburg Amtsgericht Hamburg HRA 132356\nAves Rail Equipment Holding GmbH & Co. KG – Hamburg",
      "type": "Registerbekanntmachung nach dem Umwandlungsgesetz",
      "state": "Hamburg",
      "amtsgericht": "Amtsgericht Hamburg",
      "registernummer": "HRA 132356",
      "registerart": "HRA",
      "company_name": "Aves Rail Equipment Holding GmbH & Co. KG",
      "company_seat": "Hamburg",
      "details": "12.08.2025 (Bekanntmachungsdatum)\n\nHamburg Amtsgericht Hamburg HRA 132356\nRegisterbekanntmachung nach dem Umwandlungsgesetz 12.08.2025 (Eintragungsdatum)\n\nAves Rail Equipment Holding GmbH & Co. KG\nKommanditgesellschaft\nHamburg\n\nAls nicht eingetragen wird bekannt gemacht:\nDen Gläubigern der an der Verschmelzung beteiligten Gesellschaften ist, wenn sie binnen sechs Monaten nach dem Tag, an dem die Eintragung der Verschmelzung in das Register des Sitzes desjenigen Rechtsträgers, dessen Gläubiger sie sind, nach § 19 Absatz 3 UmwG als bekannt gemacht gilt, ihren Anspruch nach Grund und Höhe schriftlich anmelden, Sicherheit zu leisten, soweit sie nicht Befriedigung verlangen können. Dieses Recht steht den Gläubigern jedoch nur zu, wenn sie glaubhaft machen, dass durch die Verschmelzung die Erfüllung ihrer Forderung gefährdet wird."
    },
    {
      "date": "2025-08-12",
      "id": "120572",
      "original_text": "Registerbekanntmachung nach dem Umwandlungsgesetz\nMecklenburg-Vorpommern Amtsgericht Neubrandenburg HRA 25\nNordkurier Mediengruppe GmbH & Co. KG – Neubrandenburg",
      "type": "Registerbekanntmachung nach dem Umwandlungsgesetz",
      "state": "Mecklenburg-Vorpommern",
      "amtsgericht": "Amtsgericht Neubrandenburg",
      "registernummer": "HRA 25",
      "registerart": "HRA",
      "company_name": "Nordkurier Mediengruppe GmbH & Co. KG",
      "company_seat": "Neubrandenburg",
      "details": "12.08.2025 (Bekanntmachungsdatum)\n\nMecklenburg-Vorpommern Amtsgericht Neubrandenburg HRA 25\nRegisterbekanntmachung nach dem Umwandlungsgesetz 12.08.2025 (Eintragungsdatum)\n\nNordkurier Mediengruppe GmbH & Co. KG\nKommanditgesellschaft\nNeubrandenburg\n\nAls nicht eingetragen wird veröffentlicht: Den Gläubigern der an der Verschmelzung beteiligten Rechtsträger ist, wenn sie binnen sechs Monaten nach dem Tag, an dem die Eintragung der Verschmelzung in das Register des Sitzes desjenigen Rechtsträgers, dessen Gläubiger sie sind, nach § 19 Abs. 3 UmwG als bekannt gemacht gilt,\nihren Anspruch nach Grund und Höhe in Textform anmelden, Sicherheit zu leisten, soweit sie nicht Befriedigung verlangen können. Dieses Recht steht den Gläubigern jedoch nur zu, wenn sie glaubhaft machen, dass durch die Verschmelzung die Erfüllung der Forderung gefährdet wird."
    },
    {
      "date": "2025-08-12",
      "id": "120573",
      "original_text": "Registerbekanntmachung nach dem Umwandlungsgesetz\nMecklenburg-Vorpommern Amtsgericht Schwerin HRA 8\nZeitungsverlag Schwerin GmbH & Co. KG – Schwerin",
      "type": "Registerbekanntmachung nach dem Umwandlungsgesetz",
      "state": "Mecklenburg-Vorpommern",
      "amtsgericht": "Amtsgericht Schwerin",
      "registernummer": "HRA 8",
      "registerart": "HRA",
      "company_name": "Zeitungsverlag Schwerin GmbH & Co. KG",
      "company_seat": "Schwerin",
      "details": "12.08.2025 (Bekanntmachungsdatum)\n\nMecklenburg-Vorpommern Amtsgericht Schwerin HRA 8\nRegisterbekanntmachung nach dem Umwandlungsgesetz 12.08.2025 (Eintragungsdatum)\n\nZeitungsverlag Schwerin GmbH & Co. KG\nKommanditgesellschaft\nSchwerin\n\nAls nicht eingetragen wird veröffentlicht: Den Gläubigern der an der Verschmelzung beteiligten Rechtsträger ist, wenn sie binnen sechs Monaten nach dem Tag, an dem die Eintragung der Verschmelzung in das Register des Sitzes desjenigen Rechtsträgers, dessen Gläubiger sie sind, nach § 19 Abs. 3 UmwG als bekannt gemacht gilt,\nihren Anspruch nach Grund und Höhe in Textform anmelden, Sicherheit zu leisten, soweit sie nicht Befriedigung verlangen können. Dieses Recht steht den Gläubigern jedoch nur zu, wenn sie glaubhaft machen, dass durch die Verschmelzung die Erfüllung der Forderung gefährdet wird."
    },
    {
      "date": "2025-08-12",
      "id": "120574",
      "original_text": "Registerbekanntmachung nach dem Umwandlungsgesetz\nBaden-Württemberg Amtsgericht Mannheim HRB 6817\nconfern Möbeltransportbetriebe GmbH – Mannheim",
      "type": "Registerbekanntmachung nach dem Umwandlungsgesetz",
      "state": "Baden-Württemberg",
      "amtsgericht": "Amtsgericht Mannheim",
      "registernummer": "HRB 6817",
      "registerart": "HRB",
      "company_name": "confern Möbeltransportbetriebe GmbH",
      "company_seat": "Mannheim",
      "details": "12.08.2025 (Bekanntmachungsdatum)\n\nBaden-Württemberg Amtsgericht Mannheim HRB 6817\nRegisterbekanntmachung nach dem Umwandlungsgesetz 12.08.2025 (Eintragungsdatum)\n\nconfern Möbeltransportbetriebe GmbH\nGesellschaft mit beschränkter Haftung\nMannheim\n\nDen Gläubigern der an der Verschmelzung beteiligten Rechtsträger ist, wenn sie binnen sechs Monaten nach dem Tag, an dem die Eintragung der Verschmelzung in das Register des Sitzes desjenigen Rechtsträgers, dessen Gläubiger sie sind, nach § 19 Abs. 3 UmwG als bekanntgemacht gilt, ihren Anspruch nach Grund und Höhe schriftlich anmelden, Sicherheit zu leisten, soweit sie nicht Befriedigung verlangen können. Dieses Recht steht den Gläubigern jedoch nur zu, wenn sie glaubhaft machen, dass durch die Verschmelzung die Erfüllung ihrer Forderung gefährdet wird."
    },
    {
      "date": "2025-08-12",
      "id": "120575",
      "original_text": "Löschungsankündigung\nSchleswig-Holstein Amtsgericht Kiel HRB 5690\nLHG LIBAU Handelsgesellschaft mbH – Kiel",
      "type": "Löschungsankündigung",
      "state": "Schleswig-Holstein",
      "amtsgericht": "Amtsgericht Kiel",
      "registernummer": "HRB 5690",
      "registerart": "HRB",
      "company_name": "LHG LIBAU Handelsgesellschaft mbH",
      "company_seat": "Kiel",
      "details": "12.08.2025 (Bekanntmachungsdatum)\n\nSchleswig-Holstein Amtsgericht Kiel HRB 5690\nLöschungsankündigung\n\nLHG LIBAU Handelsgesellschaft mbH\nGesellschaft mit beschränkter Haftung\nKiel\n\nEs ist die Löschung der nachstehenden Gesellschaft wegen Vermögenslosigkeit gemäß § 394 FamFG beabsichtigt. Widerspruchsfrist: 2 Monate."
    },
    {
      "date": "2025-08-12",
      "id": "120576",
      "original_text": "Registerbekanntmachung nach dem Umwandlungsgesetz\nBaden-Württemberg Amtsgericht Stuttgart HRB 757218\nQuadrex Creativ GmbH – Ammerbuch",
      "type": "Registerbekanntmachung nach dem Umwandlungsgesetz",
      "state": "Baden-Württemberg",
      "amtsgericht": "Amtsgericht Stuttgart",
      "registernummer": "HRB 757218",
      "registerart": "HRB",
      "company_name": "Quadrex Creativ GmbH",
      "company_seat": "Ammerbuch",
      "details": "12.08.2025 (Bekanntmachungsdatum)\n\nBaden-Württemberg Amtsgericht Stuttgart HRB 757218\nRegisterbekanntmachung nach dem Umwandlungsgesetz 12.08.2025 (Eintragungsdatum)\n\nQuadrex Creativ GmbH\nGesellschaft mit beschränkter Haftung\nAmmerbuch\n\nDen Gläubigern der an der Verschmelzung beteiligten Rechtsträger ist, wenn sie binnen sechs Monaten nach dem Tag, an dem die Eintragung der Verschmelzung in das Register des Sitzes desjenigen Rechtsträgers, dessen Gläubiger sie sind, nach § 19 Abs. 3 UmwG als bekanntgemacht gilt, ihren Anspruch nach Grund und Höhe schriftlich anmelden, Sicherheit zu leisten, soweit sie nicht Befriedigung verlangen können. Dieses Recht steht den Gläubigern jedoch nur zu, wenn sie glaubhaft machen, dass durch die Verschmelzung die Erfüllung ihrer Forderung gefährdet wird."
    },
    {
      "date": "2025-08-12",
      "id": "120577",
      "original_text": "Registerbekanntmachung nach dem Umwandlungsgesetz\nBaden-Württemberg Amtsgericht Freiburg HRB 733730\nAHH GmbH – Freiburg im Breisgau",
      "type": "Registerbekanntmachung nach dem Umwandlungsgesetz",
      "state": "Baden-Württemberg",
      "amtsgericht": "Amtsgericht Freiburg",
      "registernummer": "HRB 733730",
      "registerart": "HRB",
      "company_name": "AHH GmbH",
      "company_seat": "Freiburg im Breisgau",
      "details": "12.08.2025 (Bekanntmachungsdatum)\n\nBaden-Württemberg Amtsgericht Freiburg HRB 733730\nRegisterbekanntmachung nach dem Umwandlungsgesetz 12.08.2025 (Eintragungsdatum)\n\nAHH GmbH\nGesellschaft mit beschränkter Haftung\nFreiburg im Breisgau\n\nDen Gläubigern der an der Ausgliederung beteiligten Rechtsträger ist, wenn sie binnen sechs Monaten nach dem Tag, an dem die Eintragung der Ausgliederung in das Register des Sitzes desjenigen Rechtsträgers, dessen Gläubiger sie sind, nach § 19 Abs. 3 UmwG als bekanntgemacht gilt, ihren Anspruch nach Grund und Höhe schriftlich anmelden, Sicherheit zu leisten, soweit sie nicht Befriedigung verlangen können. Dieses Recht steht den Gläubigern jedoch nur zu, wenn sie glaubhaft machen, dass durch die Ausgliederung die Erfüllung ihrer Forderung gefährdet wird."
    },
    {
      "date": "2025-08-12",
      "id": "120578",
      "original_text": "Registerbekanntmachung nach dem Umwandlungsgesetz\nBaden-Württemberg Amtsgericht Freiburg HRA 709174\nAndreas Holz Hörakustik e.K. – Freiburg im Breisgau",
      "type": "Registerbekanntmachung nach dem Umwandlungsgesetz",
      "state": "Baden-Württemberg",
      "amtsgericht": "Amtsgericht Freiburg",
      "registernummer": "HRA 709174",
      "registerart": "HRA",
      "company_name": "Andreas Holz Hörakustik e.K.",
      "company_seat": "Freiburg im Breisgau",
      "details": "12.08.2025 (Bekanntmachungsdatum)\n\nBaden-Württemberg Amtsgericht Freiburg HRA 709174\nRegisterbekanntmachung nach dem Umwandlungsgesetz 12.08.2025 (Eintragungsdatum)\n\nAndreas Holz Hörakustik e.K.\nEinzelkaufmann / Einzelkauffrau\nFreiburg im Breisgau\n\nDen Gläubigern der an der Ausgliederung beteiligten Rechtsträger ist, wenn sie binnen sechs Monaten nach dem Tag, an dem die Eintragung der Ausgliederung in das Register des Sitzes desjenigen Rechtsträgers, dessen Gläubiger sie sind, nach § 19 Abs. 3 UmwG als bekanntgemacht gilt, ihren Anspruch nach Grund und Höhe schriftlich anmelden, Sicherheit zu leisten, soweit sie nicht Befriedigung verlangen können. Dieses Recht steht den Gläubigern jedoch nur zu, wenn sie glaubhaft machen, dass durch die Ausgliederung die Erfüllung ihrer Forderung gefährdet wird."
    },
    {
      "date": "2025-08-12",
      "id": "120579",
      "original_text": "Einreichung neuer Dokumente\nBerlin Amtsgericht Berlin (Charlottenburg) HRB 111483\nCBE DIGIDEN AG – Berlin",
      "type": "Einreichung neuer Dokumente",
      "state": "Berlin",
      "amtsgericht": "Amtsgericht Berlin (Charlottenburg)",
      "registernummer": "HRB 111483",
      "registerart": "HRB",
      "company_name": "CBE DIGIDEN AG",
      "company_seat": "Berlin",
      "details": "12.08.2025 (Bekanntmachungsdatum)\n\nBerlin Amtsgericht Berlin (Charlottenburg) HRB 111483\nEinreichung neuer Dokumente\n\nCBE DIGIDEN AG\nAktiengesellschaft\nBerlin\n\nAls nicht eingetragen wird veröffentlicht: Es wurde eine neue Liste der Aufsichtsratsmitglieder eingereicht (§ 106 AktG)."
    },
    {
      "date": "2025-08-12",
      "id": "120580",
      "original_text": "Registerbekanntmachung nach dem Umwandlungsgesetz\nSchleswig-Holstein Amtsgericht Flensburg HRA 11437\nNorbert Mangelsen Strandrestaurant Badezeit GmbH & Co. KG – Sylt",
      "type": "Registerbekanntmachung nach dem Umwandlungsgesetz",
      "state": "Schleswig-Holstein",
      "amtsgericht": "Amtsgericht Flensburg",
      "registernummer": "HRA 11437",
      "registerart": "HRA",
      "company_name": "Norbert Mangelsen Strandrestaurant Badezeit GmbH & Co. KG",
      "company_seat": "Sylt",
      "details": "12.08.2025 (Bekanntmachungsdatum)\n\nSchleswig-Holstein Amtsgericht Flensburg HRA 11437\nRegisterbekanntmachung nach dem Umwandlungsgesetz 11.08.2025 (Eintragungsdatum)\n\nNorbert Mangelsen Strandrestaurant Badezeit GmbH & Co. KG\nKommanditgesellschaft\nSylt\n\nZu Eintragungsnummer 2 vom 11.08.2025 wird als nicht eingetragen veröffentlicht: Den Gläubigern der an der Spaltung beteiligten Rechtsträger ist, wenn sie binnen sechs Monaten nach dem Tag, an dem die Eintragung der Spaltung in das Register des Sitzes desjenigen Rechtsträgers, dessen Gläubiger sie sind, als bekannt gemacht gilt, ihren Anspruch nach Grund und Höhe schriftlich anmelden, Sicherheit zu leisten, soweit sie nicht Befriedigung verlangen können. Dieses Recht steht den Gläubigern jedoch nur zu, wenn sie glaubhaft machen, dass durch die Spaltung die Erfüllung ihrer Forderung gefährdet wird. Das Recht, Sicherheitsleistung zu verlangen, steht Gläubigern nicht zu, die im Falle der Insolvenz ein Recht auf vorzugsweise Befriedigung aus einer Deckungsmasse haben, die nach gesetzlicher Vorschrift zu ihrem Schutz errichtet und staatlich überwacht ist."
    },
    {
      "date": "2025-08-12",
      "id": "120581",
      "original_text": "Löschungsankündigung\nBerlin Amtsgericht Berlin (Charlottenburg) HRB 101325\nSOBER GmbH – Berlin",
      "type": "Löschungsankündigung",
      "state": "Berlin",
      "amtsgericht": "Amtsgericht Berlin (Charlottenburg)",
      "registernummer": "HRB 101325",
      "registerart": "HRB",
      "company_name": "SOBER GmbH",
      "company_seat": "Berlin",
      "details": "12.08.2025 (Bekanntmachungsdatum)\n\nBerlin Amtsgericht Berlin (Charlottenburg) HRB 101325\nLöschungsankündigung\n\nSOBER GmbH\nGesellschaft mit beschränkter Haftung\nBerlin\n\nBei der nachstehenden Gesellschaft wird das Amtslöschungsverfahren gemäß § 394 FamFG eingeleitet. Widerspruchsfrist 6 Wochen"
    },
    {
      "date": "2025-08-12",
      "id": "120582",
      "original_text": "Registerbekanntmachung nach dem Umwandlungsgesetz\nHamburg Amtsgericht Hamburg HRB 94577\nPMS Perfect Media Solutions GmbH – Hamburg",
      "type": "Registerbekanntmachung nach dem Umwandlungsgesetz",
      "state": "Hamburg",
      "amtsgericht": "Amtsgericht Hamburg",
      "registernummer": "HRB 94577",
      "registerart": "HRB",
      "company_name": "PMS Perfect Media Solutions GmbH",
      "company_seat": "Hamburg",
      "details": "12.08.2025 (Bekanntmachungsdatum)\n\nHamburg Amtsgericht Hamburg HRB 94577\nRegisterbekanntmachung nach dem Umwandlungsgesetz 12.08.2025 (Eintragungsdatum)\n\nPMS Perfect Media Solutions GmbH\nGesellschaft mit beschränkter Haftung\nHamburg\n\nAls nicht eingetragen wird bekannt gemacht:\nDen Gläubigern der an der Verschmelzung beteiligten Gesellschaften ist, wenn sie binnen sechs Monaten nach dem Tag, an dem die Eintragung der Verschmelzung in das Register des Sitzes desjenigen Rechtsträgers, dessen Gläubiger sie sind, nach § 19 Absatz 3 UmwG als bekannt gemacht gilt, ihren Anspruch nach Grund und Höhe schriftlich anmelden, Sicherheit zu leisten, soweit sie nicht Befriedigung verlangen können. Dieses Recht steht den Gläubigern jedoch nur zu, wenn sie glaubhaft machen, dass durch die Verschmelzung die Erfüllung ihrer Forderung gefährdet wird."
    },
    {
      "date": "2025-08-12",
      "id": "120583",
      "original_text": "Registerbekanntmachung nach dem Umwandlungsgesetz\nHamburg Amtsgericht Hamburg HRB 139765\nPMS perfect media services GmbH – Hamburg",
      "type": "Registerbekanntmachung nach dem Umwandlungsgesetz",
      "state": "Hamburg",
      "amtsgericht": "Amtsgericht Hamburg",
      "registernummer": "HRB 139765",
      "registerart": "HRB",
      "company_name": "PMS perfect media services GmbH",
      "company_seat": "Hamburg",
      "details": "12.08.2025 (Bekanntmachungsdatum)\n\nHamburg Amtsgericht Hamburg HRB 139765\nRegisterbekanntmachung nach dem Umwandlungsgesetz 12.08.2025 (Eintragungsdatum)\n\nPMS perfect media services GmbH\nGesellschaft mit beschränkter Haftung\nHamburg\n\nAls nicht eingetragen wird bekannt gemacht:\nDen Gläubigern der an der Verschmelzung beteiligten Gesellschaften ist, wenn sie binnen sechs Monaten nach dem Tag, an dem die Eintragung der Verschmelzung in das Register des Sitzes desjenigen Rechtsträgers, dessen Gläubiger sie sind, nach § 19 Absatz 3 UmwG als bekannt gemacht gilt, ihren Anspruch nach Grund und Höhe schriftlich anmelden, Sicherheit zu leisten, soweit sie nicht Befriedigung verlangen können. Dieses Recht steht den Gläubigern jedoch nur zu, wenn sie glaubhaft machen, dass durch die Verschmelzung die Erfüllung ihrer Forderung gefährdet wird."
    },
    {
      "date": "2025-08-12",
      "id": "120584",
      "original_text": "Registerbekanntmachung nach dem Umwandlungsgesetz\nSaarland Amtsgericht Merzig VR 611\nTurn- und Sportverein Scheiden e. V. – Losheim",
      "type": "Registerbekanntmachung nach dem Umwandlungsgesetz",
      "state": "Saarland",
      "amtsgericht": "Amtsgericht Merzig",
      "registernummer": "VR 611",
      "registerart": "VR",
      "company_name": "Turn- und Sportverein Scheiden e. V.",
      "company_seat": "Losheim",
      "details": "12.08.2025 (Bekanntmachungsdatum)\n\nSaarland Amtsgericht Merzig VR 611\nRegisterbekanntmachung nach dem Umwandlungsgesetz 08.08.2025 (Eintragungsdatum)\n\nTurn- und  Sportverein Scheiden e. V.\neingetragener Verein\nLosheim\n\nAls nicht eingetragen wird bekannt gemacht: Den Gläubigern der an der Verschmelzung beteiligten Vereine ist, wenn sie binnen sechs Monaten nach dem Tag, an dem die Eintragung der Verschmelzung in das Register des Sitzes desjenigen Rechtsträgers, dessen Gläubiger sie sind, nach § 19 Absatz 3 UmwG bekannt gemacht worden ist, ihren Anspruch nach Grund und Höhe schriftlich anmelden, Sicherheit zu leisten, soweit sie nicht Befriedigung verlangen können. Dieses Recht steht den Gläubigern jedoch nur zu, wenn sie glaubhaft machen, dass durch die Verschmelzung die Erfüllung ihrer Forderung gefährdet wird."
    },
    {
      "date": "2025-08-12",
      "id": "120585",
      "original_text": "Registerbekanntmachung nach dem Umwandlungsgesetz\nSaarland Amtsgericht Merzig VR 1785\nSpVgg Scheiden-Mitlosheim e.V. – Losheim am See Ortsteil Mitlosheim",
      "type": "Registerbekanntmachung nach dem Umwandlungsgesetz",
      "state": "Saarland",
      "amtsgericht": "Amtsgericht Merzig",
      "registernummer": "VR 1785",
      "registerart": "VR",
      "company_name": "SpVgg Scheiden-Mitlosheim e.V.",
      "company_seat": "Losheim am See Ortsteil Mitlosheim",
      "details": "12.08.2025 (Bekanntmachungsdatum)\n\nSaarland Amtsgericht Merzig VR 1785\nRegisterbekanntmachung nach dem Umwandlungsgesetz 08.08.2025 (Eintragungsdatum)\n\nSpVgg Scheiden-Mitlosheim e.V.\neingetragener Verein\nLosheim am See Ortsteil Mitlosheim\n\nAls nicht eingetragen wird bekannt gemacht: Den Gläubigern der an der Verschmelzung beteiligten Vereine ist, wenn sie binnen sechs Monaten nach dem Tag, an dem die Eintragung der Verschmelzung in das Register des Sitzes desjenigen Rechtsträgers, dessen Gläubiger sie sind, nach § 19 Absatz 3 UmwG bekannt gemacht worden ist, ihren Anspruch nach Grund und Höhe schriftlich anmelden, Sicherheit zu leisten, soweit sie nicht Befriedigung verlangen können. Dieses Recht steht den Gläubigern jedoch nur zu, wenn sie glaubhaft machen, dass durch die Verschmelzung die Erfüllung ihrer Forderung gefährdet wird."
    },
    {
      "date": "2025-08-12",
      "id": "120586",
      "original_text": "Registerbekanntmachung nach dem Umwandlungsgesetz\nSaarland Amtsgericht Merzig VR 330\nSpielvereinigung Mitlosheim 1929 e. V. – Losheim",
      "type": "Registerbekanntmachung nach dem Umwandlungsgesetz",
      "state": "Saarland",
      "amtsgericht": "Amtsgericht Merzig",
      "registernummer": "VR 330",
      "registerart": "VR",
      "company_name": "Spielvereinigung Mitlosheim 1929 e. V.",
      "company_seat": "Losheim",
      "details": "12.08.2025 (Bekanntmachungsdatum)\n\nSaarland Amtsgericht Merzig VR 330\nRegisterbekanntmachung nach dem Umwandlungsgesetz 08.08.2025 (Eintragungsdatum)\n\nSpielvereinigung Mitlosheim 1929 e. V.\neingetragener Verein\nLosheim\n\nAls nicht eingetragen wird bekannt gemacht: Den Gläubigern der an der Verschmelzung beteiligten Vereine ist, wenn sie binnen sechs Monaten nach dem Tag, an dem die Eintragung der Verschmelzung in das Register des Sitzes desjenigen Rechtsträgers, dessen Gläubiger sie sind, nach § 19 Absatz 3 UmwG bekannt gemacht worden ist, ihren Anspruch nach Grund und Höhe schriftlich anmelden, Sicherheit zu leisten, soweit sie nicht Befriedigung verlangen können. Dieses Recht steht den Gläubigern jedoch nur zu, wenn sie glaubhaft machen, dass durch die Verschmelzung die Erfüllung ihrer Forderung gefährdet wird."
    },
    {
      "date": "2025-08-12",
      "id": "120587",
      "original_text": "Registerbekanntmachung nach dem Umwandlungsgesetz\nThüringen Amtsgericht Jena HRB 206304\nStra-We-Bau Verwaltungs GmbH – Caaschwitz",
      "type": "Registerbekanntmachung nach dem Umwandlungsgesetz",
      "state": "Thüringen",
      "amtsgericht": "Amtsgericht Jena",
      "registernummer": "HRB 206304",
      "registerart": "HRB",
      "company_name": "Stra-We-Bau Verwaltungs GmbH",
      "company_seat": "Caaschwitz",
      "details": "12.08.2025 (Bekanntmachungsdatum)\n\nThüringen Amtsgericht Jena HRB 206304\nRegisterbekanntmachung nach dem Umwandlungsgesetz 12.08.2025 (Eintragungsdatum)\n\nStra-We-Bau Verwaltungs GmbH\nGesellschaft mit beschränkter Haftung\nCaaschwitz\n\nNicht eingetragen: Den Gläubigern der an der Verschmelzung beteiligten Rechtsträger, ist wenn sie binnen sechs Monaten nach dem Tag, an dem die Eintragung der Verschmelzung in das Register des Sitzes desjenigen Rechtsträgers, dessen Gläubiger sie sind,  nach § 19 Abs. 3 UmwG als bekanntgemacht gilt, ihren Anspruch nach Grund und Höhe schriftlich anmelden, Sicherheit zu leisten, soweit sie nicht Befriedigung verlangen können. Dieses Recht steht ihnen jedoch nur zu, wenn sie glaubhaft machen, daß durch die Verschmelzung die Erfüllung ihrer Forderung gefährdet wird."
    },
    {
      "date": "2025-08-12",
      "id": "120588",
      "original_text": "Registerbekanntmachung nach dem Umwandlungsgesetz\nThüringen Amtsgericht Jena HRB 203348\nWünschendorfer Dolomitwerk GmbH – Berga-Wünschendorf",
      "type": "Registerbekanntmachung nach dem Umwandlungsgesetz",
      "state": "Thüringen",
      "amtsgericht": "Amtsgericht Jena",
      "registernummer": "HRB 203348",
      "registerart": "HRB",
      "company_name": "Wünschendorfer Dolomitwerk GmbH",
      "company_seat": "Berga-Wünschendorf",
      "details": "12.08.2025 (Bekanntmachungsdatum)\n\nThüringen Amtsgericht Jena HRB 203348\nRegisterbekanntmachung nach dem Umwandlungsgesetz 12.08.2025 (Eintragungsdatum)\n\nWünschendorfer Dolomitwerk GmbH\nGesellschaft mit beschränkter Haftung\nBerga-Wünschendorf\n\nNicht eingetragen: Den Gläubigern der an der Verschmelzung beteiligten Rechtsträger, ist wenn sie binnen sechs Monaten nach dem Tag, an dem die Eintragung der Verschmelzung in das Register des Sitzes desjenigen Rechtsträgers, dessen Gläubiger sie sind,  nach § 19 Abs. 3 UmwG als bekanntgemacht gilt, ihren Anspruch nach Grund und Höhe schriftlich anmelden, Sicherheit zu leisten, soweit sie nicht Befriedigung verlangen können. Dieses Recht steht ihnen jedoch nur zu, wenn sie glaubhaft machen, daß durch die Verschmelzung die Erfüllung ihrer Forderung gefährdet wird."
    },
    {
      "date": "2025-08-12",
      "id": "120589",
      "original_text": "Registerbekanntmachung nach dem Umwandlungsgesetz\nBaden-Württemberg Amtsgericht Stuttgart HRB 801135\nCuravida GmbH – Metzingen",
      "type": "Registerbekanntmachung nach dem Umwandlungsgesetz",
      "state": "Baden-Württemberg",
      "amtsgericht": "Amtsgericht Stuttgart",
      "registernummer": "HRB 801135",
      "registerart": "HRB",
      "company_name": "Curavida GmbH",
      "company_seat": "Metzingen",
      "details": "12.08.2025 (Bekanntmachungsdatum)\n\nBaden-Württemberg Amtsgericht Stuttgart HRB 801135\nRegisterbekanntmachung nach dem Umwandlungsgesetz 12.08.2025 (Eintragungsdatum)\n\nCuravida GmbH\nGesellschaft mit beschränkter Haftung\nMetzingen\n\nAls nicht eingetragen wird bekanntgemacht:\nDen Gläubigern des an dem Formwechsel beteiligten Rechtsträgers ist, wenn sie binnen sechs Monaten nach dem Tag, an dem die Eintragung des Formwechsels in das Register des Sitzes desjenigen Rechtsträgers, dessen Gläubiger sie sind, nach § 19 Abs. 3 UmwG als bekanntgemacht gilt, ihren Anspruch nach Grund und Höhe schriftlich anmelden, Sicherheit zu leisten, soweit sie nicht Befriedigung verlangen können. Dieses Recht steht den Gläubigern jedoch nur zu, wenn sie glaubhaft machen, dass durch den Formwechsel die Erfüllung ihrer Forderung gefährdet wird."
    },
    {
      "date": "2025-08-12",
      "id": "120590",
      "original_text": "Registerbekanntmachung nach dem Umwandlungsgesetz\nBaden-Württemberg Amtsgericht Stuttgart GnR 720180\nCuravida eG – Metzingen",
      "type": "Registerbekanntmachung nach dem Umwandlungsgesetz",
      "state": "Baden-Württemberg",
      "amtsgericht": "Amtsgericht Stuttgart",
      "registernummer": "GnR 720180",
      "registerart": "GnR",
      "company_name": "Curavida eG",
      "company_seat": "Metzingen",
      "details": "12.08.2025 (Bekanntmachungsdatum)\n\nBaden-Württemberg Amtsgericht Stuttgart GnR 720180\nRegisterbekanntmachung nach dem Umwandlungsgesetz 12.08.2025 (Eintragungsdatum)\n\nCuravida eG\neingetragene Genossenschaft\nMetzingen\n\nAls nicht eingetragen wird bekanntgemacht:\nDen Gläubigern des an dem Formwechsel beteiligten Rechtsträgers ist, wenn sie binnen sechs Monaten nach dem Tag, an dem die Eintragung des Formwechsels in das Register des Sitzes desjenigen Rechtsträgers, dessen Gläubiger sie sind, nach § 19 Abs. 3 UmwG als bekanntgemacht gilt, ihren Anspruch nach Grund und Höhe schriftlich anmelden, Sicherheit zu leisten, soweit sie nicht Befriedigung verlangen können. Dieses Recht steht den Gläubigern jedoch nur zu, wenn sie glaubhaft machen, dass durch den Formwechsel die Erfüllung ihrer Forderung gefährdet wird."
    },
    {
      "date": "2025-08-12",
      "id": "120591",
      "original_text": "Registerbekanntmachung nach dem Umwandlungsgesetz\nNordrhein-Westfalen Amtsgericht Coesfeld HRB 20518\nOfficery.io GmbH – Gronau",
      "type": "Registerbekanntmachung nach dem Umwandlungsgesetz",
      "state": "Nordrhein-Westfalen",
      "amtsgericht": "Amtsgericht Coesfeld",
      "registernummer": "HRB 20518",
      "registerart": "HRB",
      "company_name": "Officery.io GmbH",
      "company_seat": "Gronau",
      "details": "12.08.2025 (Bekanntmachungsdatum)\n\nNordrhein-Westfalen Amtsgericht Coesfeld HRB 20518\nRegisterbekanntmachung nach dem Umwandlungsgesetz 12.08.2025 (Eintragungsdatum)\n\nOfficery.io GmbH\nGesellschaft mit beschränkter Haftung\nGronau\n\nDen Gläubigern der an der Verschmelzung beteiligten Rechtsträger ist, wenn sie binnen sechs Monaten nach dem Tag, an dem die Eintragung der Verschmelzung in das Register des Sitzes derjenigen Rechtsträger deren Gläubiger sie sind, nach § 19 Absatz 3 UmwG als bekanntgemacht gilt, ihren Anspruch nach Grund und Höhe schriftlich anmelden, Sicherheit zu leisten, soweit sie nicht Befriedigung verlangen können. Dieses Recht steht den Gläubigern jedoch nur zu, wenn sie glaubhaft machen, dass durch die Verschmelzung die Erfüllung ihrer Forderung gefährdet wird."
    },
    {
      "date": "2025-08-12",
      "id": "120592",
      "original_text": "Registerbekanntmachung nach dem Umwandlungsgesetz\nNordrhein-Westfalen Amtsgericht Coesfeld HRB 20526\npascalscriba GmbH – Gronau",
      "type": "Registerbekanntmachung nach dem Umwandlungsgesetz",
      "state": "Nordrhein-Westfalen",
      "amtsgericht": "Amtsgericht Coesfeld",
      "registernummer": "HRB 20526",
      "registerart": "HRB",
      "company_name": "pascalscriba GmbH",
      "company_seat": "Gronau",
      "details": "12.08.2025 (Bekanntmachungsdatum)\n\nNordrhein-Westfalen Amtsgericht Coesfeld HRB 20526\nRegisterbekanntmachung nach dem Umwandlungsgesetz 12.08.2025 (Eintragungsdatum)\n\npascalscriba GmbH\nGesellschaft mit beschränkter Haftung\nGronau\n\nDen Gläubigern der an der Verschmelzung beteiligten Rechtsträger ist, wenn sie binnen sechs Monaten nach dem Tag, an dem die Eintragung der Verschmelzung in das Register des Sitzes derjenigen Rechtsträger deren Gläubiger sie sind, nach § 19 Absatz 3 UmwG als bekanntgemacht gilt, ihren Anspruch nach Grund und Höhe schriftlich anmelden, Sicherheit zu leisten, soweit sie nicht Befriedigung verlangen können. Dieses Recht steht den Gläubigern jedoch nur zu, wenn sie glaubhaft machen, dass durch die Verschmelzung die Erfüllung ihrer Forderung gefährdet wird."
    },
    {
      "date": "2025-08-12",
      "id": "120593",
      "original_text": "Registerbekanntmachung nach dem Umwandlungsgesetz\nBaden-Württemberg Amtsgericht Freiburg HRB 730235\nFischer Information Technology GmbH – Radolfzell am Bodensee",
      "type": "Registerbekanntmachung nach dem Umwandlungsgesetz",
      "state": "Baden-Württemberg",
      "amtsgericht": "Amtsgericht Freiburg",
      "registernummer": "HRB 730235",
      "registerart": "HRB",
      "company_name": "Fischer Information Technology GmbH",
      "company_seat": "Radolfzell am Bodensee",
      "details": "12.08.2025 (Bekanntmachungsdatum)\n\nBaden-Württemberg Amtsgericht Freiburg HRB 730235\nRegisterbekanntmachung nach dem Umwandlungsgesetz 12.08.2025 (Eintragungsdatum)\n\nFischer Information Technology GmbH\nGesellschaft mit beschränkter Haftung\nRadolfzell am Bodensee\n\nAls nicht eingetragen wird bekanntgemacht:\nDen Gläubigern der an der Verschmelzung beteiligten Rechtsträger ist, wenn sie binnen sechs Monaten nach dem Tag, an dem die Eintragung der Verschmelzung in das Register des Sitzes desjenigen Rechtsträgers, dessen Gläubiger sie sind, nach § 19 Abs. 3 UmwG als bekanntgemacht gilt, ihren Anspruch nach Grund und Höhe schriftlich anmelden, Sicherheit zu leisten, soweit sie nicht Befriedigung verlangen können. Dieses Recht steht den Gläubigern jedoch nur zu, wenn sie glaubhaft machen, dass durch die Verschmelzung die Erfüllung ihrer Forderung gefährdet wird."
    },
    {
      "date": "2025-08-12",
      "id": "120594",
      "original_text": "Sonstige Registerbekanntmachung\nSchleswig-Holstein Amtsgericht Kiel HRB 2412 RD\nDeutsche Industrie Video System Gesellschaft mbH – Bordesholm",
      "type": "Sonstige Registerbekanntmachung",
      "state": "Schleswig-Holstein",
      "amtsgericht": "Amtsgericht Kiel",
      "registernummer": "HRB 2412 RD",
      "registerart": "HRB",
      "company_name": "Deutsche Industrie Video System Gesellschaft mbH",
      "company_seat": "Bordesholm",
      "details": "12.08.2025 (Bekanntmachungsdatum)\n\nSchleswig-Holstein Amtsgericht Kiel HRB 2412 RD\nSonstige Registerbekanntmachung 07.08.2025 (Eintragungsdatum)\n\nDeutsche Industrie Video System Gesellschaft mbH\nGesellschaft mit beschränkter Haftung\nBordesholm\n\nZweigniederlassung im Ausland errichtet:\n1.\nDEUTSCHE INDUSTRIE VIDEO SYSTEM GMBH NUF Oslo/Norwegen (Register of Business Enterprises,\n998477050)\nEUID: NOFOR.998477050\nc/o CON TAX NOR Advokatfirma AS\nTvetenveien 32\n0666 OSLO\nVon Amts wegen eingetragen gem. § 13a HGB."
    },
    {
      "date": "2025-08-12",
      "id": "120595",
      "original_text": "Löschungsankündigung\nSchleswig-Holstein Amtsgericht Flensburg HRB 10409\nReederei Heinz-Georg Vöge Beteiligungsgesellschaft mbH – Sylt",
      "type": "Löschungsankündigung",
      "state": "Schleswig-Holstein",
      "amtsgericht": "Amtsgericht Flensburg",
      "registernummer": "HRB 10409",
      "registerart": "HRB",
      "company_name": "Reederei Heinz-Georg Vöge Beteiligungsgesellschaft mbH",
      "company_seat": "Sylt",
      "details": "12.08.2025 (Bekanntmachungsdatum)\n\nSchleswig-Holstein Amtsgericht Flensburg HRB 10409\nLöschungsankündigung\n\nReederei Heinz-Georg Vöge Beteiligungsgesellschaft mbH\nGesellschaft mit beschränkter Haftung\nSylt\n\nEs ist die Löschung der nachstehenden Gesellschaft wegen Vermögenslosigkeit gemäß § 394 FamFG beabsichtigt.\nWiderspruchsfrist: 2 Monate."
    },
    {
      "date": "2025-08-12",
      "id": "120596",
      "original_text": "Registerbekanntmachung nach dem Umwandlungsgesetz\nSachsen-Anhalt Amtsgericht Stendal HRB 31434\nPLJ Taubet GmbH – Sülzetal",
      "type": "Registerbekanntmachung nach dem Umwandlungsgesetz",
      "state": "Sachsen-Anhalt",
      "amtsgericht": "Amtsgericht Stendal",
      "registernummer": "HRB 31434",
      "registerart": "HRB",
      "company_name": "PLJ Taubet GmbH",
      "company_seat": "Sülzetal",
      "details": "12.08.2025 (Bekanntmachungsdatum)\n\nSachsen-Anhalt Amtsgericht Stendal HRB 31434\nRegisterbekanntmachung nach dem Umwandlungsgesetz 12.08.2025 (Eintragungsdatum)\n\nPLJ Taubet GmbH\nGesellschaft mit beschränkter Haftung\nSülzetal\n\nNicht eingetragen:\nDen Gläubigern der an der Verschmelzung beteiligten Rechtsträger ist, wenn sie binnen sechs Monaten nach dem Tag, an dem die Eintragung der Verschmelzung nach § 19 Abs. 3 UmwG als bekanntgemacht gilt, ihren Anspruch nach Grund und Höhe schriftlich anmelden, Sicherheit zu leisten, soweit sie nicht Befriedigung verlangen können. Dieses Recht steht ihnen jedoch nur zu, wenn sie glaubhaft machen, dass durch die Verschmelzung die Erfüllung ihrer Forderung gefährdet wird."
    },
    {
      "date": "2025-08-12",
      "id": "120597",
      "original_text": "Registerbekanntmachung nach dem Umwandlungsgesetz\nBaden-Württemberg Amtsgericht Freiburg HRB 391507\nSteBa-Tec GmbH – Lahr",
      "type": "Registerbekanntmachung nach dem Umwandlungsgesetz",
      "state": "Baden-Württemberg",
      "amtsgericht": "Amtsgericht Freiburg",
      "registernummer": "HRB 391507",
      "registerart": "HRB",
      "company_name": "SteBa-Tec GmbH",
      "company_seat": "Lahr",
      "details": "12.08.2025 (Bekanntmachungsdatum)\n\nBaden-Württemberg Amtsgericht Freiburg HRB 391507\nRegisterbekanntmachung nach dem Umwandlungsgesetz 12.08.2025 (Eintragungsdatum)\n\nSteBa-Tec GmbH\nGesellschaft mit beschränkter Haftung\nLahr\n\nAls nicht eingetragen wird bekanntgemacht:\nDen Gläubigern der an der Verschmelzung beteiligten Rechtsträger ist, wenn sie binnen sechs Monaten nach dem Tag, an dem die Eintragung der Verschmelzung in das Register des Sitzes desjenigen Rechtsträgers, dessen Gläubiger sie sind, nach § 19 Abs. 3 UmwG als bekanntgemacht gilt, ihren Anspruch nach Grund und Höhe schriftlich anmelden, Sicherheit zu leisten, soweit sie nicht Befriedigung verlangen können. Dieses Recht steht den Gläubigern jedoch nur zu, wenn sie glaubhaft machen, dass durch die Verschmelzung die Erfüllung ihrer Forderung gefährdet wird."
    },
    {
      "date": "2025-08-12",
      "id": "120598",
      "original_text": "Registerbekanntmachung nach dem Umwandlungsgesetz\nSachsen-Anhalt Amtsgericht Stendal HRA 8273\nHäusliche Kranken- und Altenpflege Marita Käppler e.K. – Lutherstadt Wittenberg",
      "type": "Registerbekanntmachung nach dem Umwandlungsgesetz",
      "state": "Sachsen-Anhalt",
      "amtsgericht": "Amtsgericht Stendal",
      "registernummer": "HRA 8273",
      "registerart": "HRA",
      "company_name": "Häusliche Kranken- und Altenpflege Marita Käppler e.K.",
      "company_seat": "Lutherstadt Wittenberg",
      "details": "12.08.2025 (Bekanntmachungsdatum)\n\nSachsen-Anhalt Amtsgericht Stendal HRA 8273\nRegisterbekanntmachung nach dem Umwandlungsgesetz 12.08.2025 (Eintragungsdatum)\n\nHäusliche Kranken- und Altenpflege Marita Käppler e.K.\nEinzelkaufmann / Einzelkauffrau\nLutherstadt Wittenberg\n\nNicht eingetragen:\nDen Gläubigern der an der Ausgliederung beteiligten Rechtsträger, ist wenn sie binnen sechs Monaten nach dem Tag, an dem die Eintragung der Ausgliederung nach §§125, 19 Abs. 3 UmwG als bekanntgemacht gilt, ihren Anspruch nach Grund und Höhe schriftlich anmelden, Sicherheit zu leisten, soweit sie nicht Befriedigung verlangen können. Diese Recht steht ihnen jedoch nur zu, wenn sie glaubhaft machen, dass durch die Ausgliederung die Erfüllung ihrer Forderung gefährdet wird."
    },
    {
      "date": "2025-08-12",
      "id": "120599",
      "original_text": "Löschungsankündigung\nBerlin Amtsgericht Berlin (Charlottenburg) HRB 148202\nSSK Management GmbH – Berlin",
      "type": "Löschungsankündigung",
      "state": "Berlin",
      "amtsgericht": "Amtsgericht Berlin (Charlottenburg)",
      "registernummer": "HRB 148202",
      "registerart": "HRB",
      "company_name": "SSK Management GmbH",
      "company_seat": "Berlin",
      "details": "12.08.2025 (Bekanntmachungsdatum)\n\nBerlin Amtsgericht Berlin (Charlottenburg) HRB 148202\nLöschungsankündigung\n\nSSK Management GmbH\nGesellschaft mit beschränkter Haftung\nBerlin\n\nBei der nachstehenden Gesellschaft wird das Amtslöschungsverfahren gemäß § 394 FamFG eingeleitet. Widerspruchsfrist 6 Wochen"
    },
    {
      "date": "2025-08-12",
      "id": "120600",
      "original_text": "Löschungsankündigung\nBerlin Amtsgericht Berlin (Charlottenburg) HRB 99279\nINNOVenture Business Consulting GmbH – Berlin",
      "type": "Löschungsankündigung",
      "state": "Berlin",
      "amtsgericht": "Amtsgericht Berlin (Charlottenburg)",
      "registernummer": "HRB 99279",
      "registerart": "HRB",
      "company_name": "INNOVenture Business Consulting GmbH",
      "company_seat": "Berlin",
      "details": "12.08.2025 (Bekanntmachungsdatum)\n\nBerlin Amtsgericht Berlin (Charlottenburg) HRB 99279\nLöschungsankündigung\n\nINNOVenture Business Consulting GmbH\nGesellschaft mit beschränkter Haftung\nBerlin\n\nBei der nachstehenden Gesellschaft wird das Amtslöschungsverfahren gemäß § 394 FamFG eingeleitet. Widerspruchsfrist 6 Wochen"
    },
    {
      "date": "2025-08-12",
      "id": "120601",
      "original_text": "Registerbekanntmachung nach dem Umwandlungsgesetz\nHamburg Amtsgericht Hamburg HRB 98252\nJOGU Holding GmbH – Hamburg",
      "type": "Registerbekanntmachung nach dem Umwandlungsgesetz",
      "state": "Hamburg",
      "amtsgericht": "Amtsgericht Hamburg",
      "registernummer": "HRB 98252",
      "registerart": "HRB",
      "company_name": "JOGU Holding GmbH",
      "company_seat": "Hamburg",
      "details": "12.08.2025 (Bekanntmachungsdatum)\n\nHamburg Amtsgericht Hamburg HRB 98252\nRegisterbekanntmachung nach dem Umwandlungsgesetz 12.08.2025 (Eintragungsdatum)\n\nJOGU Holding GmbH\nGesellschaft mit beschränkter Haftung\nHamburg\n\nAls nicht eingetragen wird bekannt gemacht:\nDen Gläubigern der an der Verschmelzung beteiligten Gesellschaften ist, wenn sie binnen sechs Monaten nach dem Tag, an dem die Eintragung der Verschmelzung in das Register des Sitzes desjenigen Rechtsträgers, dessen Gläubiger sie sind, nach § 19 Absatz 3 UmwG als bekannt gemacht gilt, ihren Anspruch nach Grund und Höhe schriftlich anmelden, Sicherheit zu leisten, soweit sie nicht Befriedigung verlangen können. Dieses Recht steht den Gläubigern jedoch nur zu, wenn sie glaubhaft machen, dass durch die Verschmelzung die Erfüllung ihrer Forderung gefährdet wird."
    },
    {
      "date": "2025-08-12",
      "id": "120602",
      "original_text": "Registerbekanntmachung nach dem Umwandlungsgesetz\nHamburg Amtsgericht Hamburg HRB 105906\nClaRa Verwaltungsgesellschaft mbH – Hamburg",
      "type": "Registerbekanntmachung nach dem Umwandlungsgesetz",
      "state": "Hamburg",
      "amtsgericht": "Amtsgericht Hamburg",
      "registernummer": "HRB 105906",
      "registerart": "HRB",
      "company_name": "ClaRa Verwaltungsgesellschaft mbH",
      "company_seat": "Hamburg",
      "details": "12.08.2025 (Bekanntmachungsdatum)\n\nHamburg Amtsgericht Hamburg HRB 105906\nRegisterbekanntmachung nach dem Umwandlungsgesetz 12.08.2025 (Eintragungsdatum)\n\nClaRa Verwaltungsgesellschaft mbH\nGesellschaft mit beschränkter Haftung\nHamburg\n\nAls nicht eingetragen wird bekannt gemacht:\nDen Gläubigern der an der Verschmelzung beteiligten Gesellschaften ist, wenn sie binnen sechs Monaten nach dem Tag, an dem die Eintragung der Verschmelzung in das Register des Sitzes desjenigen Rechtsträgers, dessen Gläubiger sie sind, nach § 19 Absatz 3 UmwG als bekannt gemacht gilt, ihren Anspruch nach Grund und Höhe schriftlich anmelden, Sicherheit zu leisten, soweit sie nicht Befriedigung verlangen können. Dieses Recht steht den Gläubigern jedoch nur zu, wenn sie glaubhaft machen, dass durch die Verschmelzung die Erfüllung ihrer Forderung gefährdet wird."
    },
    {
      "date": "2025-08-12",
      "id": "120603",
      "original_text": "Registerbekanntmachung nach dem Umwandlungsgesetz\nSachsen-Anhalt Amtsgericht Stendal HRA 8232\nForstbetrieb Roßlau e.K. – Dessau-Roßlau",
      "type": "Registerbekanntmachung nach dem Umwandlungsgesetz",
      "state": "Sachsen-Anhalt",
      "amtsgericht": "Amtsgericht Stendal",
      "registernummer": "HRA 8232",
      "registerart": "HRA",
      "company_name": "Forstbetrieb Roßlau e.K.",
      "company_seat": "Dessau-Roßlau",
      "details": "12.08.2025 (Bekanntmachungsdatum)\n\nSachsen-Anhalt Amtsgericht Stendal HRA 8232\nRegisterbekanntmachung nach dem Umwandlungsgesetz 12.08.2025 (Eintragungsdatum)\n\nForstbetrieb Roßlau e.K.\nEinzelkaufmann / Einzelkauffrau\nDessau-Roßlau\n\nNicht eingetragen:\nDen Gläubigern der an der Ausgliederung beteiligten Rechtsträger, ist wenn sie binnen sechs Monaten nach dem Tag, an dem die Eintragung der Ausgliederung nach §§125, 19 Abs. 3 UmwG als bekanntgemacht gilt, ihren Anspruch nach Grund und Höhe schriftlich anmelden, Sicherheit zu leisten, soweit sie nicht Befriedigung verlangen können. Diese Recht steht ihnen jedoch nur zu, wenn sie glaubhaft machen, dass durch die Ausgliederung die Erfüllung ihrer Forderung gefährdet wird."
    },
    {
      "date": "2025-08-12",
      "id": "120604",
      "original_text": "Sonstige Registerbekanntmachung\nBerlin Amtsgericht Berlin (Charlottenburg) HRB 252069\nLIVA Management GmbH – Berlin",
      "type": "Sonstige Registerbekanntmachung",
      "state": "Berlin",
      "amtsgericht": "Amtsgericht Berlin (Charlottenburg)",
      "registernummer": "HRB 252069",
      "registerart": "HRB",
      "company_name": "LIVA Management GmbH",
      "company_seat": "Berlin",
      "details": "12.08.2025 (Bekanntmachungsdatum)\n\nBerlin Amtsgericht Berlin (Charlottenburg) HRB 252069\nSonstige Registerbekanntmachung\n\nLIVA Management GmbH\nGesellschaft mit beschränkter Haftung\nBerlin\n\nAls nicht eingetragen wird veröffentlicht: Den Gläubigern der an der Verschmelzung beteiligten Rechtsträger ist, wenn sie binnen sechs Monaten nach dem Tag, an dem die Eintragung der Verschmelzung in das Register des Sitzes desjenigen Rechtsträgers, dessen Gläubiger sie sind, als bekannt gemacht gilt, ihren Anspruch nach Grund und Höhe schriftlich anmelden, Sicherheit zu leisten, soweit sie nicht Befriedigung verlangen können. Dieses Recht steht den Gläubigern jedoch nur zu, wenn sie glaubhaft machen, dass durch die Verschmelzung die Erfüllung ihrer Forderung gefährdet wird. Das Recht, Sicherheitsleistung zu verlangen, steht Gläubigern nicht zu, die im Falle der Insolvenz ein Recht auf vorzugsweise Befriedigung aus einer Deckungsmasse haben, die nach gesetzlicher Vorschrift zu ihrem Schutz errichtet und staatlich überwacht ist."
    },
    {
      "date": "2025-08-12",
      "id": "120605",
      "original_text": "Registerbekanntmachung nach dem Umwandlungsgesetz\nBaden-Württemberg Amtsgericht Ulm HRB 720459\nSchroth Verwaltungs-GmbH – Fichtenau",
      "type": "Registerbekanntmachung nach dem Umwandlungsgesetz",
      "state": "Baden-Württemberg",
      "amtsgericht": "Amtsgericht Ulm",
      "registernummer": "HRB 720459",
      "registerart": "HRB",
      "company_name": "Schroth Verwaltungs-GmbH",
      "company_seat": "Fichtenau",
      "details": "12.08.2025 (Bekanntmachungsdatum)\n\nBaden-Württemberg Amtsgericht Ulm HRB 720459\nRegisterbekanntmachung nach dem Umwandlungsgesetz 12.08.2025 (Eintragungsdatum)\n\nSchroth Verwaltungs-GmbH\nGesellschaft mit beschränkter Haftung\nFichtenau\n\nAls nicht eingetragen wird bekanntgemacht:\nDen Gläubigern des an dem Formwechsel beteiligten Rechtsträgers ist, wenn sie binnen sechs Monaten nach dem Tag, an dem die Eintragung des Formwechsels in das Register des Sitzes desjenigen Rechtsträgers, dessen Gläubiger sie sind, nach § 19 Abs. 3 UmwG als bekanntgemacht gilt, ihren Anspruch nach Grund und Höhe schriftlich anmelden, Sicherheit zu leisten, soweit sie nicht Befriedigung verlangen können. Dieses Recht steht den Gläubigern jedoch nur zu, wenn sie glaubhaft machen, dass durch den Formwechsel die Erfüllung ihrer Forderung gefährdet wird."
    },
    {
      "date": "2025-08-12",
      "id": "120606",
      "original_text": "Registerbekanntmachung nach dem Umwandlungsgesetz\nBaden-Württemberg Amtsgericht Ulm HRA 729713\nSchroth Holding GmbH & Co. KG – Fichtenau",
      "type": "Registerbekanntmachung nach dem Umwandlungsgesetz",
      "state": "Baden-Württemberg",
      "amtsgericht": "Amtsgericht Ulm",
      "registernummer": "HRA 729713",
      "registerart": "HRA",
      "company_name": "Schroth Holding GmbH & Co. KG",
      "company_seat": "Fichtenau",
      "details": "12.08.2025 (Bekanntmachungsdatum)\n\nBaden-Württemberg Amtsgericht Ulm HRA 729713\nRegisterbekanntmachung nach dem Umwandlungsgesetz 12.08.2025 (Eintragungsdatum)\n\nSchroth Holding GmbH & Co. KG\nKommanditgesellschaft\nFichtenau\n\nDen Gläubigern des an dem Formwechsel beteiligten Rechtsträgers ist, wenn sie binnen sechs Monaten nach dem Tag, an dem die Eintragung des Formwechsels in das Register des Sitzes desjenigen Rechtsträgers, dessen Gläubiger sie sind, nach § 19 Abs. 3 UmwG als bekanntgemacht gilt, ihren Anspruch nach Grund und Höhe schriftlich anmelden, Sicherheit zu leisten, soweit sie nicht Befriedigung verlangen können. Dieses Recht steht den Gläubigern jedoch nur zu, wenn sie glaubhaft machen, dass durch den Formwechsel die Erfüllung ihrer Forderung gefährdet wird."
    },
    {
      "date": "2025-08-12",
      "id": "120607",
      "original_text": "Registerbekanntmachung nach dem Umwandlungsgesetz\nSaarland Amtsgericht Saarbrücken HRB 107714\nREGLER Coffee GmbH – Dillingen",
      "type": "Registerbekanntmachung nach dem Umwandlungsgesetz",
      "state": "Saarland",
      "amtsgericht": "Amtsgericht Saarbrücken",
      "registernummer": "HRB 107714",
      "registerart": "HRB",
      "company_name": "REGLER Coffee GmbH",
      "company_seat": "Dillingen",
      "details": "12.08.2025 (Bekanntmachungsdatum)\n\nSaarland Amtsgericht Saarbrücken HRB 107714\nRegisterbekanntmachung nach dem Umwandlungsgesetz 12.08.2025 (Eintragungsdatum)\n\nREGLER Coffee GmbH\nGesellschaft mit beschränkter Haftung\nDillingen\n\nAls nicht eingetragen wird bekannt gemacht: Den Gläubigern der an der Verschmelzung beteiligten Gesellschaften ist, wenn sie binnen sechs Monaten nach dem Tag, an dem die Eintragung der Verschmelzung in das Register des Sitzes desjenigen Rechtsträgers, dessen Gläubiger sie sind, nach § 19 Absatz 3 UmwG bekannt gemacht worden ist, ihren Anspruch nach Grund und Höhe schriftlich anmelden, Sicherheit zu leisten, soweit sie nicht Befriedigung verlangen können. Dieses Recht steht den Gläubigern jedoch nur zu, wenn sie glaubhaft machen, dass durch die Verschmelzung die Erfüllung ihrer Forderung gefährdet wird."
    },
    {
      "date": "2025-08-12",
      "id": "120608",
      "original_text": "Registerbekanntmachung nach dem Umwandlungsgesetz\nSaarland Amtsgericht Saarbrücken HRB 15730\nREGLER Systems GmbH – Dillingen",
      "type": "Registerbekanntmachung nach dem Umwandlungsgesetz",
      "state": "Saarland",
      "amtsgericht": "Amtsgericht Saarbrücken",
      "registernummer": "HRB 15730",
      "registerart": "HRB",
      "company_name": "REGLER Systems GmbH",
      "company_seat": "Dillingen",
      "details": "12.08.2025 (Bekanntmachungsdatum)\n\nSaarland Amtsgericht Saarbrücken HRB 15730\nRegisterbekanntmachung nach dem Umwandlungsgesetz 12.08.2025 (Eintragungsdatum)\n\nREGLER Systems GmbH\nGesellschaft mit beschränkter Haftung\nDillingen\n\nAls nicht eingetragen wird bekannt gemacht: Den Gläubigern der an der Verschmelzung beteiligten Gesellschaften ist, wenn sie binnen sechs Monaten nach dem Tag, an dem die Eintragung der Verschmelzung in das Register des Sitzes desjenigen Rechtsträgers, dessen Gläubiger sie sind, nach § 19 Absatz 3 UmwG bekannt gemacht worden ist, ihren Anspruch nach Grund und Höhe schriftlich anmelden, Sicherheit zu leisten, soweit sie nicht Befriedigung verlangen können. Dieses Recht steht den Gläubigern jedoch nur zu, wenn sie glaubhaft machen, dass durch die Verschmelzung die Erfüllung ihrer Forderung gefährdet wird."
    },
    {
      "date": "2025-08-12",
      "id": "120609",
      "original_text": "Einreichung neuer Dokumente\nSchleswig-Holstein Amtsgericht Flensburg HRB 17785\nAPEX AG – Kropp",
      "type": "Einreichung neuer Dokumente",
      "state": "Schleswig-Holstein",
      "amtsgericht": "Amtsgericht Flensburg",
      "registernummer": "HRB 17785",
      "registerart": "HRB",
      "company_name": "APEX AG",
      "company_seat": "Kropp",
      "details": "12.08.2025 (Bekanntmachungsdatum)\n\nSchleswig-Holstein Amtsgericht Flensburg HRB 17785\nEinreichung neuer Dokumente\n\nAPEX AG\nAktiengesellschaft\nKropp\n\nAls nicht eingetragen wird veröffentlicht:  Aufsichtsratsliste eingereicht am 02.07.2025."
    },
    {
      "date": "2025-08-12",
      "id": "120610",
      "original_text": "Registerbekanntmachung nach dem Umwandlungsgesetz\nBerlin Amtsgericht Berlin (Charlottenburg) HRB 82253\ndbb digital und service GmbH – Berlin",
      "type": "Registerbekanntmachung nach dem Umwandlungsgesetz",
      "state": "Berlin",
      "amtsgericht": "Amtsgericht Berlin (Charlottenburg)",
      "registernummer": "HRB 82253",
      "registerart": "HRB",
      "company_name": "dbb digital und service GmbH",
      "company_seat": "Berlin",
      "details": "12.08.2025 (Bekanntmachungsdatum)\n\nBerlin Amtsgericht Berlin (Charlottenburg) HRB 82253\nRegisterbekanntmachung nach dem Umwandlungsgesetz 11.08.2025 (Eintragungsdatum)\n\ndbb digital und service GmbH\nGesellschaft mit beschränkter Haftung\nBerlin\n\nZu Eintragungsnummer 9 vom 11.08.2025 wird als nicht eingetragen veröffentlicht: Den Gläubigern der an der Verschmelzung beteiligten Rechtsträger ist, wenn sie binnen sechs Monaten nach dem Tag, an dem die Eintragung der Verschmelzung in das Register des Sitzes desjenigen Rechtsträgers, dessen Gläubiger sie sind, als bekannt gemacht gilt, ihren Anspruch nach Grund und Höhe schriftlich anmelden, Sicherheit zu leisten, soweit sie nicht Befriedigung verlangen können. Dieses Recht steht den Gläubigern jedoch nur zu, wenn sie glaubhaft machen, dass durch die Verschmelzung die Erfüllung ihrer Forderung gefährdet wird. Das Recht, Sicherheitsleistung zu verlangen, steht Gläubigern nicht zu, die im Falle der Insolvenz ein Recht auf vorzugsweise Befriedigung aus einer Deckungsmasse haben, die nach gesetzlicher Vorschrift zu ihrem Schutz errichtet und staatlich überwacht ist."
    },
    {
      "date": "2025-08-12",
      "id": "120611",
      "original_text": "Registerbekanntmachung nach dem Umwandlungsgesetz\nBaden-Württemberg Amtsgericht Freiburg HRA 207\nTee Peter Kaffee GmbH & Co. KG – Freiburg im Breisgau",
      "type": "Registerbekanntmachung nach dem Umwandlungsgesetz",
      "state": "Baden-Württemberg",
      "amtsgericht": "Amtsgericht Freiburg",
      "registernummer": "HRA 207",
      "registerart": "HRA",
      "company_name": "Tee Peter Kaffee GmbH & Co. KG",
      "company_seat": "Freiburg im Breisgau",
      "details": "12.08.2025 (Bekanntmachungsdatum)\n\nBaden-Württemberg Amtsgericht Freiburg HRA 207\nRegisterbekanntmachung nach dem Umwandlungsgesetz 12.08.2025 (Eintragungsdatum)\n\nTee Peter Kaffee GmbH & Co. KG\nKommanditgesellschaft\nFreiburg im Breisgau\n\nAls nicht eingetragen wird bekanntgemacht:\nDen Gläubigern der an der Verschmelzung beteiligten Rechtsträger ist, wenn sie binnen sechs Monaten nach dem Tag, an dem die Eintragung der Verschmelzung in das Register des Sitzes desjenigen Rechtsträgers, dessen Gläubiger sie sind, nach § 19 Abs. 3 UmwG als bekanntgemacht gilt, ihren Anspruch nach Grund und Höhe schriftlich anmelden, Sicherheit zu leisten, soweit sie nicht Befriedigung verlangen können. Dieses Recht steht den Gläubigern jedoch nur zu, wenn sie glaubhaft machen, dass durch die Verschmelzung die Erfüllung ihrer Forderung gefährdet wird."
    },
    {
      "date": "2025-08-12",
      "id": "120612",
      "original_text": "Registerbekanntmachung nach dem Umwandlungsgesetz\nBaden-Württemberg Amtsgericht Freiburg HRA 5118\nTee Peter Kaffee GmbH & Co. KG – Freiburg im Breisgau",
      "type": "Registerbekanntmachung nach dem Umwandlungsgesetz",
      "state": "Baden-Württemberg",
      "amtsgericht": "Amtsgericht Freiburg",
      "registernummer": "HRA 5118",
      "registerart": "HRA",
      "company_name": "Tee Peter Kaffee GmbH & Co. KG",
      "company_seat": "Freiburg im Breisgau",
      "details": "12.08.2025 (Bekanntmachungsdatum)\n\nBaden-Württemberg Amtsgericht Freiburg HRA 5118\nRegisterbekanntmachung nach dem Umwandlungsgesetz 12.08.2025 (Eintragungsdatum)\n\nTee Peter Kaffee GmbH & Co. KG\nKommanditgesellschaft\nFreiburg im Breisgau\n\nAls nicht eingetragen wird bekanntgemacht:\nDen Gläubigern der an der Verschmelzung beteiligten Rechtsträger ist, wenn sie binnen sechs Monaten nach dem Tag, an dem die Eintragung der Verschmelzung in das Register des Sitzes desjenigen Rechtsträgers, dessen Gläubiger sie sind, nach § 19 Abs. 3 UmwG als bekanntgemacht gilt, ihren Anspruch nach Grund und Höhe schriftlich anmelden, Sicherheit zu leisten, soweit sie nicht Befriedigung verlangen können. Dieses Recht steht den Gläubigern jedoch nur zu, wenn sie glaubhaft machen, dass durch die Verschmelzung die Erfüllung ihrer Forderung gefährdet wird."
    },
    {
      "date": "2025-08-12",
      "id": "120613",
      "original_text": "Registerbekanntmachung nach dem Umwandlungsgesetz\nBrandenburg Amtsgericht Neuruppin HRB 13696\nMunathera UG (haftungsbeschränkt) – Wittstock",
      "type": "Registerbekanntmachung nach dem Umwandlungsgesetz",
      "state": "Brandenburg",
      "amtsgericht": "Amtsgericht Neuruppin",
      "registernummer": "HRB 13696",
      "registerart": "HRB",
      "company_name": "Munathera UG (haftungsbeschränkt)",
      "company_seat": "Wittstock",
      "details": "12.08.2025 (Bekanntmachungsdatum)\n\nBrandenburg Amtsgericht Neuruppin HRB 13696\nRegisterbekanntmachung nach dem Umwandlungsgesetz 11.08.2025 (Eintragungsdatum)\n\nMunathera UG (haftungsbeschränkt)\nGesellschaft mit beschränkter Haftung\nWittstock\n\nZu Eintragungsnummer 3 vom 11.08.2025 wird als nicht eingetragen veröffentlicht:\nDen Gläubigern der an der Umwandlung beteiligten Rechtsträger ist, wenn sie binnen sechs Monaten nach dem Tag, an dem die Eintragung der Umwandlung in das Register des Sitzes desjenigen Rechtsträgers, dessen Gläubiger sie sind, als bekannt gemacht gilt, ihren Anspruch nach Grund und Höhe schriftlich anmelden, Sicherheit zu leisten, soweit sie nicht Befriedigung verlangen können. Dieses Recht steht den Gläubigern jedoch nur zu, wenn sie glaubhaft machen, dass durch die Umwandlung die Erfüllung ihrer Forderung gefährdet wird"
    },
    {
      "date": "2025-08-12",
      "id": "120614",
      "original_text": "Registerbekanntmachung nach dem Umwandlungsgesetz\nBerlin Amtsgericht Berlin (Charlottenburg) HRB 86503\ndbb Vorsorgewerk GmbH – Berlin",
      "type": "Registerbekanntmachung nach dem Umwandlungsgesetz",
      "state": "Berlin",
      "amtsgericht": "Amtsgericht Berlin (Charlottenburg)",
      "registernummer": "HRB 86503",
      "registerart": "HRB",
      "company_name": "dbb Vorsorgewerk GmbH",
      "company_seat": "Berlin",
      "details": "12.08.2025 (Bekanntmachungsdatum)\n\nBerlin Amtsgericht Berlin (Charlottenburg) HRB 86503\nRegisterbekanntmachung nach dem Umwandlungsgesetz 11.08.2025 (Eintragungsdatum)\n\ndbb Vorsorgewerk GmbH\nGesellschaft mit beschränkter Haftung\nBerlin\n\nZu Eintragungsnummer 13 vom 11.08.2025 wird als nicht eingetragen veröffentlicht: Den Gläubigern der an der Verschmelzung beteiligten Rechtsträger ist, wenn sie binnen sechs Monaten nach dem Tag, an dem die Eintragung der Verschmelzung in das Register des Sitzes desjenigen Rechtsträgers, dessen Gläubiger sie sind, als bekannt gemacht gilt, ihren Anspruch nach Grund und Höhe schriftlich anmelden, Sicherheit zu leisten, soweit sie nicht Befriedigung verlangen können. Dieses Recht steht den Gläubigern jedoch nur zu, wenn sie glaubhaft machen, dass durch die Verschmelzung die Erfüllung ihrer Forderung gefährdet wird. Das Recht, Sicherheitsleistung zu verlangen, steht Gläubigern nicht zu, die im Falle der Insolvenz ein Recht auf vorzugsweise Befriedigung aus einer Deckungsmasse haben, die nach gesetzlicher Vorschrift zu ihrem Schutz errichtet und staatlich überwacht ist."
    },
    {
      "date": "2025-08-12",
      "id": "120615",
      "original_text": "Registerbekanntmachung nach dem Umwandlungsgesetz\nBerlin Amtsgericht Berlin (Charlottenburg) HRB 29303\nSfG Servicegesellschaft für Grundbesitz mit beschränkter Haftung – Berlin",
      "type": "Registerbekanntmachung nach dem Umwandlungsgesetz",
      "state": "Berlin",
      "amtsgericht": "Amtsgericht Berlin (Charlottenburg)",
      "registernummer": "HRB 29303",
      "registerart": "HRB",
      "company_name": "SfG Servicegesellschaft für Grundbesitz mit beschränkter Haftung",
      "company_seat": "Berlin",
      "details": "12.08.2025 (Bekanntmachungsdatum)\n\nBerlin Amtsgericht Berlin (Charlottenburg) HRB 29303\nRegisterbekanntmachung nach dem Umwandlungsgesetz 12.08.2025 (Eintragungsdatum)\n\nSfG Servicegesellschaft für Grundbesitz mit beschränkter Haftung\nGesellschaft mit beschränkter Haftung\nBerlin\n\nZu Eintragungsnummer 9 vom 12.08.2025 wird als nicht eingetragen veröffentlicht: Den Gläubigern der an der Verschmelzung beteiligten Rechtsträger ist, wenn sie binnen sechs Monaten nach dem Tag, an dem die Eintragung der Verschmelzung in das Register des Sitzes desjenigen Rechtsträgers, dessen Gläubiger sie sind, als bekannt gemacht gilt, ihren Anspruch nach Grund und Höhe schriftlich anmelden, Sicherheit zu leisten, soweit sie nicht Befriedigung verlangen können. Dieses Recht steht den Gläubigern jedoch nur zu, wenn sie glaubhaft machen, dass durch die Verschmelzung die Erfüllung ihrer Forderung gefährdet wird. Das Recht, Sicherheitsleistung zu verlangen, steht Gläubigern nicht zu, die im Falle der Insolvenz ein Recht auf vorzugsweise Befriedigung aus einer Deckungsmasse haben, die nach gesetzlicher Vorschrift zu ihrem Schutz errichtet und staatlich überwacht ist."
    },
    {
      "date": "2025-08-12",
      "id": "120616",
      "original_text": "Registerbekanntmachung nach dem Umwandlungsgesetz\nSachsen-Anhalt Amtsgericht Stendal HRB 101939\nEKF-diagnostic GmbH – Barleben",
      "type": "Registerbekanntmachung nach dem Umwandlungsgesetz",
      "state": "Sachsen-Anhalt",
      "amtsgericht": "Amtsgericht Stendal",
      "registernummer": "HRB 101939",
      "registerart": "HRB",
      "company_name": "EKF-diagnostic GmbH",
      "company_seat": "Barleben",
      "details": "12.08.2025 (Bekanntmachungsdatum)\n\nSachsen-Anhalt Amtsgericht Stendal HRB 101939\nRegisterbekanntmachung nach dem Umwandlungsgesetz 12.08.2025 (Eintragungsdatum)\n\nEKF-diagnostic GmbH\nGesellschaft mit beschränkter Haftung\nBarleben\n\nNicht eingetragen:\nDen Gläubigern der an der Verschmelzung beteiligten Rechtsträger ist, wenn sie binnen sechs Monaten nach dem Tag, an dem die Eintragung der Verschmelzung nach § 19 Abs. 3 UmwG als bekanntgemacht gilt, ihren Anspruch nach Grund und Höhe schriftlich anmelden, Sicherheit zu leisten, soweit sie nicht Befriedigung verlangen können. Dieses Recht steht ihnen jedoch nur zu, wenn sie glaubhaft machen, dass durch die Verschmelzung die Erfüllung ihrer Forderung gefährdet wird."
    },
    {
      "date": "2025-08-12",
      "id": "120617",
      "original_text": "Registerbekanntmachung nach dem Umwandlungsgesetz\nBerlin Amtsgericht Berlin (Charlottenburg) HRB 22217\nSäntis Vermögensverwaltungs GmbH – Berlin",
      "type": "Registerbekanntmachung nach dem Umwandlungsgesetz",
      "state": "Berlin",
      "amtsgericht": "Amtsgericht Berlin (Charlottenburg)",
      "registernummer": "HRB 22217",
      "registerart": "HRB",
      "company_name": "Säntis Vermögensverwaltungs GmbH",
      "company_seat": "Berlin",
      "details": "12.08.2025 (Bekanntmachungsdatum)\n\nBerlin Amtsgericht Berlin (Charlottenburg) HRB 22217\nRegisterbekanntmachung nach dem Umwandlungsgesetz 12.08.2025 (Eintragungsdatum)\n\nSäntis Vermögensverwaltungs GmbH\nGesellschaft mit beschränkter Haftung\nBerlin\n\nZu Eintragungsnummer 5 vom 12.08.2025 wird als nicht eingetragen veröffentlicht: Den Gläubigern der an der Verschmelzung beteiligten Rechtsträger ist, wenn sie binnen sechs Monaten nach dem Tag, an dem die Eintragung der Verschmelzung in das Register des Sitzes desjenigen Rechtsträgers, dessen Gläubiger sie sind, als bekannt gemacht gilt, ihren Anspruch nach Grund und Höhe schriftlich anmelden, Sicherheit zu leisten, soweit sie nicht Befriedigung verlangen können. Dieses Recht steht den Gläubigern jedoch nur zu, wenn sie glaubhaft machen, dass durch die Verschmelzung die Erfüllung ihrer Forderung gefährdet wird. Das Recht, Sicherheitsleistung zu verlangen, steht Gläubigern nicht zu, die im Falle der Insolvenz ein Recht auf vorzugsweise Befriedigung aus einer Deckungsmasse haben, die nach gesetzlicher Vorschrift zu ihrem Schutz errichtet und staatlich überwacht ist."
    },
    {
      "date": "2025-08-12",
      "id": "120618",
      "original_text": "Einreichung neuer Dokumente\nBerlin Amtsgericht Berlin (Charlottenburg) HRB 202784\nNoxtua AG – Berlin",
      "type": "Einreichung neuer Dokumente",
      "state": "Berlin",
      "amtsgericht": "Amtsgericht Berlin (Charlottenburg)",
      "registernummer": "HRB 202784",
      "registerart": "HRB",
      "company_name": "Noxtua AG",
      "company_seat": "Berlin",
      "details": "12.08.2025 (Bekanntmachungsdatum)\n\nBerlin Amtsgericht Berlin (Charlottenburg) HRB 202784\nEinreichung neuer Dokumente\n\nNoxtua AG\nAktiengesellschaft\nBerlin\n\nAls nicht eingetragen wird veröffentlicht: Es wurde eine neue Liste der Aufsichtsratsmitglieder eingereicht (§ 106 AktG)"
    },
    {
      "date": "2025-08-12",
      "id": "120619",
      "original_text": "Registerbekanntmachung nach dem Umwandlungsgesetz\nSachsen-Anhalt Amtsgericht Stendal HRB 18509\nGerüstbau Block Bitterfeld GmbH – Bitterfeld-Wolfen",
      "type": "Registerbekanntmachung nach dem Umwandlungsgesetz",
      "state": "Sachsen-Anhalt",
      "amtsgericht": "Amtsgericht Stendal",
      "registernummer": "HRB 18509",
      "registerart": "HRB",
      "company_name": "Gerüstbau Block Bitterfeld GmbH",
      "company_seat": "Bitterfeld-Wolfen",
      "details": "12.08.2025 (Bekanntmachungsdatum)\n\nSachsen-Anhalt Amtsgericht Stendal HRB 18509\nRegisterbekanntmachung nach dem Umwandlungsgesetz 12.08.2025 (Eintragungsdatum)\n\nGerüstbau Block Bitterfeld GmbH\nGesellschaft mit beschränkter Haftung\nBitterfeld-Wolfen\n\nNicht eingetragen:\nDen Gläubigern der an der Verschmelzung beteiligten Rechtsträger ist, wenn sie binnen sechs Monaten nach dem Tag, an dem die Eintragung der Verschmelzung nach § 19 Abs. 3 UmwG als bekanntgemacht gilt, ihren Anspruch nach Grund und Höhe schriftlich anmelden, Sicherheit zu leisten, soweit sie nicht Befriedigung verlangen können. Dieses Recht steht ihnen jedoch nur zu, wenn sie glaubhaft machen, dass durch die Verschmelzung die Erfüllung ihrer Forderung gefährdet wird."
    },
    {
      "date": "2025-08-12",
      "id": "120620",
      "original_text": "Registerbekanntmachung nach dem Umwandlungsgesetz\nBaden-Württemberg Amtsgericht Stuttgart HRA 341052\nDingler GmbH & Co. Immobilienverwaltungs- und Handelsgesellschaft KG – Haiterbach",
      "type": "Registerbekanntmachung nach dem Umwandlungsgesetz",
      "state": "Baden-Württemberg",
      "amtsgericht": "Amtsgericht Stuttgart",
      "registernummer": "HRA 341052",
      "registerart": "HRA",
      "company_name": "Dingler GmbH & Co. Immobilienverwaltungs- und Handelsgesellschaft KG",
      "company_seat": "Haiterbach",
      "details": "12.08.2025 (Bekanntmachungsdatum)\n\nBaden-Württemberg Amtsgericht Stuttgart HRA 341052\nRegisterbekanntmachung nach dem Umwandlungsgesetz 12.08.2025 (Eintragungsdatum)\n\nDingler GmbH & Co. Immobilienverwaltungs- und Handelsgesellschaft KG\nKommanditgesellschaft\nHaiterbach\n\nDen Gläubigern des an dem Formwechsel beteiligten Rechtsträgers ist, wenn sie binnen sechs Monaten nach dem Tag, an dem die Eintragung des Formwechsels in das Register des Sitzes desjenigen Rechtsträgers, dessen Gläubiger sie sind, nach § 19 Abs. 3 UmwG als bekanntgemacht gilt, ihren Anspruch nach Grund und Höhe schriftlich anmelden, Sicherheit zu leisten, soweit sie nicht Befriedigung verlangen können. Dieses Recht steht den Gläubigern jedoch nur zu, wenn sie glaubhaft machen, dass durch den Formwechsel die Erfüllung ihrer Forderung gefährdet wird."
    },
    {
      "date": "2025-08-12",
      "id": "120621",
      "original_text": "Registerbekanntmachung nach dem Umwandlungsgesetz\nBaden-Württemberg Amtsgericht Ulm HRB 736313\nRalf Pagel GmbH – Göppingen",
      "type": "Registerbekanntmachung nach dem Umwandlungsgesetz",
      "state": "Baden-Württemberg",
      "amtsgericht": "Amtsgericht Ulm",
      "registernummer": "HRB 736313",
      "registerart": "HRB",
      "company_name": "Ralf Pagel GmbH",
      "company_seat": "Göppingen",
      "details": "12.08.2025 (Bekanntmachungsdatum)\n\nBaden-Württemberg Amtsgericht Ulm HRB 736313\nRegisterbekanntmachung nach dem Umwandlungsgesetz 12.08.2025 (Eintragungsdatum)\n\nRalf Pagel GmbH\nGesellschaft mit beschränkter Haftung\nGöppingen\n\nAls nicht eingetragen wird bekanntgemacht:\nDen Gläubigern der an der Verschmelzung beteiligten Rechtsträger ist, wenn sie binnen sechs Monaten nach dem Tag, an dem die Eintragung der Verschmelzung in das Register des Sitzes desjenigen Rechtsträgers, dessen Gläubiger sie sind, nach § 19 Abs. 3 UmwG als bekanntgemacht gilt, ihren Anspruch nach Grund und Höhe schriftlich anmelden, Sicherheit zu leisten, soweit sie nicht Befriedigung verlangen können. Dieses Recht steht den Gläubigern jedoch nur zu, wenn sie glaubhaft machen, dass durch die Verschmelzung die Erfüllung ihrer Forderung gefährdet wird."
    },
    {
      "date": "2025-08-12",
      "id": "120622",
      "original_text": "Registerbekanntmachung nach dem Umwandlungsgesetz\nHamburg Amtsgericht Hamburg HRB 176188\nKMZ Kassensysteme Nord AG – Hamburg",
      "type": "Registerbekanntmachung nach dem Umwandlungsgesetz",
      "state": "Hamburg",
      "amtsgericht": "Amtsgericht Hamburg",
      "registernummer": "HRB 176188",
      "registerart": "HRB",
      "company_name": "KMZ Kassensysteme Nord AG",
      "company_seat": "Hamburg",
      "details": "12.08.2025 (Bekanntmachungsdatum)\n\nHamburg Amtsgericht Hamburg HRB 176188\nRegisterbekanntmachung nach dem Umwandlungsgesetz 12.08.2025 (Eintragungsdatum)\n\nKMZ Kassensysteme Nord AG\nAktiengesellschaft\nHamburg\n\nAls nicht eingetragen wird bekannt gemacht:\nDen Gläubigern der an der formwechselnden Umwandlung beteiligten Gesellschaften ist, wenn sie binnen sechs Monaten nach dem Tag, an dem die Eintragung der formwechselnden Umwandlung in das Register des Sitzes desjenigen Rechtsträgers, dessen Gläubiger sie sind, nach § 19 Absatz 3 UmwG als bekannt gemacht gilt, ihren Anspruch nach Grund und Höhe schriftlich anmelden, Sicherheit zu leisten, soweit sie nicht Befriedigung verlangen können. Dieses Recht steht den Gläubigern jedoch nur zu, wenn sie glaubhaft machen, dass durch die formwechselnde Umwandlung die Erfüllung ihrer Forderung gefährdet wird."
    },
    {
      "date": "2025-08-12",
      "id": "120623",
      "original_text": "Registerbekanntmachung nach dem Umwandlungsgesetz\nSachsen Amtsgericht Leipzig HRB 38029\nKMT GmbH – Leipzig",
      "type": "Registerbekanntmachung nach dem Umwandlungsgesetz",
      "state": "Sachsen",
      "amtsgericht": "Amtsgericht Leipzig",
      "registernummer": "HRB 38029",
      "registerart": "HRB",
      "company_name": "KMT GmbH",
      "company_seat": "Leipzig",
      "details": "12.08.2025 (Bekanntmachungsdatum)\n\nSachsen Amtsgericht Leipzig HRB 38029\nRegisterbekanntmachung nach dem Umwandlungsgesetz 12.08.2025 (Eintragungsdatum)\n\nKMT GmbH\nGesellschaft mit beschränkter Haftung\nLeipzig\n\nDen Gläubigern der an der Verschmelzung beteiligten Rechtsträger ist, wenn sie binnen sechs Monaten nach dem Tag, an dem die Eintragung der Verschmelzung in das Register des Sitzes desjenigen Rechtsträgers, dessen Gläubiger sie sind, nach § 19 Abs. 3 UmwG als bekannt gemacht gilt, ihren Anspruch nach Grund und Höhe in Textform anmelden, Sicherheit zu leisten, soweit sie nicht Befriedigung verlangen können. Dieses Recht steht den Gläubigern jedoch nur zu, wenn sie glaubhaft machen, dass durch die Verschmelzung die Erfüllung der Forderung gefährdet wird."
    },
    {
      "date": "2025-08-12",
      "id": "120624",
      "original_text": "Registerbekanntmachung nach dem Umwandlungsgesetz\nSachsen Amtsgericht Chemnitz HRB 37620\njetlB GmbH – Chemnitz",
      "type": "Registerbekanntmachung nach dem Umwandlungsgesetz",
      "state": "Sachsen",
      "amtsgericht": "Amtsgericht Chemnitz",
      "registernummer": "HRB 37620",
      "registerart": "HRB",
      "company_name": "jetlB GmbH",
      "company_seat": "Chemnitz",
      "details": "12.08.2025 (Bekanntmachungsdatum)\n\nSachsen Amtsgericht Chemnitz HRB 37620\nRegisterbekanntmachung nach dem Umwandlungsgesetz 12.08.2025 (Eintragungsdatum)\n\njetlB GmbH\nGesellschaft mit beschränkter Haftung\nChemnitz\n\nDen Gläubigern der an der Ausgliederung beteiligten Rechtsträger ist, wenn sie binnen sechs Monaten nach dem Tag, an dem die Eintragung der Ausgliederung in das Register des Sitzes desjenigen Rechtsträgers, dessen Gläubiger sie sind, nach § 19 Abs. 3 UmwG als bekannt gemacht gilt, ihren Anspruch nach Grund und Höhe in Textform anmelden, Sicherheit zu leisten, soweit sie nicht Befriedigung verlangen können. Dieses Recht steht den Gläubigern jedoch nur zu, wenn sie glaubhaft machen, dass durch die Ausgliederung die Erfüllung der Forderung gefährdet wird."
    },
    {
      "date": "2025-08-12",
      "id": "120625",
      "original_text": "Registerbekanntmachung nach dem Umwandlungsgesetz\nSachsen Amtsgericht Chemnitz HRB 21453\nOptum Systemtechnik GmbH – Chemnitz",
      "type": "Registerbekanntmachung nach dem Umwandlungsgesetz",
      "state": "Sachsen",
      "amtsgericht": "Amtsgericht Chemnitz",
      "registernummer": "HRB 21453",
      "registerart": "HRB",
      "company_name": "Optum Systemtechnik GmbH",
      "company_seat": "Chemnitz",
      "details": "12.08.2025 (Bekanntmachungsdatum)\n\nSachsen Amtsgericht Chemnitz HRB 21453\nRegisterbekanntmachung nach dem Umwandlungsgesetz 12.08.2025 (Eintragungsdatum)\n\nOptum Systemtechnik GmbH\nGesellschaft mit beschränkter Haftung\nChemnitz\n\nDen Gläubigern der an der Verschmelzung beteiligten Rechtsträger ist, wenn sie binnen sechs Monaten nach dem Tag, an dem die Eintragung der Verschmelzung in das Register des Sitzes desjenigen Rechtsträgers, dessen Gläubiger sie sind, nach § 19 Abs. 3 UmwG als bekannt gemacht gilt, ihren Anspruch nach Grund und Höhe in Textform anmelden, Sicherheit zu leisten, soweit sie nicht Befriedigung verlangen können. Dieses Recht steht den Gläubigern jedoch nur zu, wenn sie glaubhaft machen, dass durch die Verschmelzung die Erfüllung der Forderung gefährdet wird."
    },
    {
      "date": "2025-08-12",
      "id": "120626",
      "original_text": "Registerbekanntmachung nach dem Umwandlungsgesetz\nSachsen Amtsgericht Chemnitz HRA 9498\nJens Trepte e.K. – Chemnitz",
      "type": "Registerbekanntmachung nach dem Umwandlungsgesetz",
      "state": "Sachsen",
      "amtsgericht": "Amtsgericht Chemnitz",
      "registernummer": "HRA 9498",
      "registerart": "HRA",
      "company_name": "Jens Trepte e.K.",
      "company_seat": "Chemnitz",
      "details": "12.08.2025 (Bekanntmachungsdatum)\n\nSachsen Amtsgericht Chemnitz HRA 9498\nRegisterbekanntmachung nach dem Umwandlungsgesetz 12.08.2025 (Eintragungsdatum)\n\nJens Trepte e.K.\nEinzelkaufmann / Einzelkauffrau\nChemnitz\n\nDen Gläubigern der an der Ausgliederung beteiligten Rechtsträger ist, wenn sie binnen sechs Monaten nach dem Tag, an dem die Eintragung der Ausgliederung in das Register des Sitzes desjenigen Rechtsträgers, dessen Gläubiger sie sind, nach § 19 Abs. 3 UmwG als bekannt gemacht gilt, ihren Anspruch nach Grund und Höhe in Textform anmelden, Sicherheit zu leisten, soweit sie nicht Befriedigung verlangen können. Dieses Recht steht den Gläubigern jedoch nur zu, wenn sie glaubhaft machen, dass durch die Ausgliederung die Erfüllung der Forderung gefährdet wird."
    },
    {
      "date": "2025-08-12",
      "id": "120627",
      "original_text": "Einreichung neuer Dokumente\nNiedersachsen Amtsgericht Hannover HRB 50972\nContiTech Elastomer-Beschichtungen GmbH – Hannover",
      "type": "Einreichung neuer Dokumente",
      "state": "Niedersachsen",
      "amtsgericht": "Amtsgericht Hannover",
      "registernummer": "HRB 50972",
      "registerart": "HRB",
      "company_name": "ContiTech Elastomer-Beschichtungen GmbH",
      "company_seat": "Hannover",
      "details": "12.08.2025 (Bekanntmachungsdatum)\n\nNiedersachsen Amtsgericht Hannover HRB 50972\nEinreichung neuer Dokumente 12.08.2025 (Eintragungsdatum)\n\nContiTech Elastomer-Beschichtungen GmbH\nGesellschaft mit beschränkter Haftung\nHannover\n\nDie Liste der Mitglieder des Aufsichtsrats wurde beim Registergericht eingereicht."
    },
    {
      "date": "2025-08-12",
      "id": "120628",
      "original_text": "Registerbekanntmachung nach dem Umwandlungsgesetz\nNiedersachsen Amtsgericht Walsrode HRB 38\nLandesschadenhilfe Versicherung VaG – Bad Fallingbostel",
      "type": "Registerbekanntmachung nach dem Umwandlungsgesetz",
      "state": "Niedersachsen",
      "amtsgericht": "Amtsgericht Walsrode",
      "registernummer": "HRB 38",
      "registerart": "HRB",
      "company_name": "Landesschadenhilfe Versicherung VaG",
      "company_seat": "Bad Fallingbostel",
      "details": "12.08.2025 (Bekanntmachungsdatum)\n\nNiedersachsen Amtsgericht Walsrode HRB 38\nRegisterbekanntmachung nach dem Umwandlungsgesetz 12.08.2025 (Eintragungsdatum)\n\nLandesschadenhilfe Versicherung VaG\nVersicherungsverein auf Gegenseitigkeit\nBad Fallingbostel\n\nDen Gläubigern der an der Verschmelzung beteiligten Rechtsträger ist, wenn sie binnen sechs Monaten nach dem Tag, an dem die Eintragung der Verschmelzung in das Register des Sitzes desjenigen Rechtsträgers, dessen Gläubiger sie sind, nach § 19  Abs.  3 UmwG als bekannt gemacht gilt, ihren Anspruch nach Grund und Höhe schriftlich anmelden, Sicherheit zu leisten, soweit sie nicht Befriedigung verlangen können. Dieses Recht steht den Gläubigern jedoch nur zu, wenn sie glaubhaft machen, dass durch die Verschmelzung die Erfüllung der Forderung gefährdet wird."
    },
    {
      "date": "2025-08-12",
      "id": "120629",
      "original_text": "Registerbekanntmachung nach dem Umwandlungsgesetz\nNiedersachsen Amtsgericht Walsrode HRA 203073\nWolfgang Quellhorst e.K. – Diepenau",
      "type": "Registerbekanntmachung nach dem Umwandlungsgesetz",
      "state": "Niedersachsen",
      "amtsgericht": "Amtsgericht Walsrode",
      "registernummer": "HRA 203073",
      "registerart": "HRA",
      "company_name": "Wolfgang Quellhorst e.K.",
      "company_seat": "Diepenau",
      "details": "12.08.2025 (Bekanntmachungsdatum)\n\nNiedersachsen Amtsgericht Walsrode HRA 203073\nRegisterbekanntmachung nach dem Umwandlungsgesetz 12.08.2025 (Eintragungsdatum)\n\nWolfgang Quellhorst e.K.\nKommanditgesellschaft\nDiepenau\n\nDen Gläubigern der an der formwechselnden Umwandlung beteiligten Rechtsträger ist, wenn sie binnen sechs Monaten nach dem Tag, an dem die Eintragung der Umwandlung in das Register des Sitzes desjenigen Rechtsträgers, dessen Gläubiger sie sind, nach § 19 Abs. 3 UmwG als bekannt gemacht gilt, ihren Anspruch nach Grund und Höhe schriftlich anmelden, Sicherheit zu leisten, soweit sie nicht Befriedigung verlangen können. Dieses Recht steht den Gläubigern jedoch nur zu, wenn sie glaubhaft machen, dass durch die formwechselnde Umwandlung die Erfüllung der Forderung gefährdet wird."
    },
    {
      "date": "2025-08-12",
      "id": "120630",
      "original_text": "Registerbekanntmachung nach dem Umwandlungsgesetz\nNiedersachsen Amtsgericht Tostedt HRB 211407\nKolibri Immobilien GmbH – Heeslingen",
      "type": "Registerbekanntmachung nach dem Umwandlungsgesetz",
      "state": "Niedersachsen",
      "amtsgericht": "Amtsgericht Tostedt",
      "registernummer": "HRB 211407",
      "registerart": "HRB",
      "company_name": "Kolibri Immobilien GmbH",
      "company_seat": "Heeslingen",
      "details": "12.08.2025 (Bekanntmachungsdatum)\n\nNiedersachsen Amtsgericht Tostedt HRB 211407\nRegisterbekanntmachung nach dem Umwandlungsgesetz 12.08.2025 (Eintragungsdatum)\n\nKolibri Immobilien GmbH\nGesellschaft mit beschränkter Haftung\nHeeslingen\n\nDen Gläubigern der an der Verschmelzung beteiligten Rechtsträger ist, wenn sie binnen sechs Monaten nach dem Tag, an dem die Eintragung der Verschmelzung in das Register des Sitzes desjenigen Rechtsträgers, dessen Gläubiger sie sind, nach § 19  Abs.  3 UmwG als bekannt gemacht gilt, ihren Anspruch nach Grund und Höhe schriftlich anmelden, Sicherheit zu leisten, soweit sie nicht Befriedigung verlangen können. Dieses Recht steht den Gläubigern jedoch nur zu, wenn sie glaubhaft machen, dass durch die Verschmelzung die Erfüllung der Forderung gefährdet wird."
    },
    {
      "date": "2025-08-12",
      "id": "120631",
      "original_text": "Registerbekanntmachung nach dem Umwandlungsgesetz\nNiedersachsen Amtsgericht Hannover HRB 220218\nIMEA Immobilien GmbH – Langenhagen",
      "type": "Registerbekanntmachung nach dem Umwandlungsgesetz",
      "state": "Niedersachsen",
      "amtsgericht": "Amtsgericht Hannover",
      "registernummer": "HRB 220218",
      "registerart": "HRB",
      "company_name": "IMEA Immobilien GmbH",
      "company_seat": "Langenhagen",
      "details": "12.08.2025 (Bekanntmachungsdatum)\n\nNiedersachsen Amtsgericht Hannover HRB 220218\nRegisterbekanntmachung nach dem Umwandlungsgesetz 12.08.2025 (Eintragungsdatum)\n\nIMEA Immobilien GmbH\nGesellschaft mit beschränkter Haftung\nLangenhagen\n\nDen Gläubigern der an der Verschmelzung beteiligten Rechtsträger ist, wenn sie binnen sechs Monaten nach dem Tag, an dem die Eintragung der Verschmelzung in das Register des Sitzes desjenigen Rechtsträgers, dessen Gläubiger sie sind, nach § 19  Abs.  3 UmwG als bekannt gemacht gilt, ihren Anspruch nach Grund und Höhe schriftlich anmelden, Sicherheit zu leisten, soweit sie nicht Befriedigung verlangen können. Dieses Recht steht den Gläubigern jedoch nur zu, wenn sie glaubhaft machen, dass durch die Verschmelzung die Erfüllung der Forderung gefährdet wird."
    },
    {
      "date": "2025-08-12",
      "id": "120632",
      "original_text": "Löschungsankündigung\nNiedersachsen Amtsgericht Göttingen HRA 101299\nFinanzprofil Frank Eckhardt, Finanz und Versicherungsmakler, e.K. – Gieboldehausen",
      "type": "Löschungsankündigung",
      "state": "Niedersachsen",
      "amtsgericht": "Amtsgericht Göttingen",
      "registernummer": "HRA 101299",
      "registerart": "HRA",
      "company_name": "Finanzprofil Frank Eckhardt, Finanz und Versicherungsmakler, e.K.",
      "company_seat": "Gieboldehausen",
      "details": "12.08.2025 (Bekanntmachungsdatum)\n\nNiedersachsen Amtsgericht Göttingen HRA 101299\nLöschungsankündigung\n\nFinanzprofil Frank Eckhardt, Finanz und Versicherungsmakler, e.K.\nEinzelkaufmann / Einzelkauffrau\nGieboldehausen\n\nDas Registergericht beabsichtigt, die Firma von Amts wegen nach § 395 FamFG zu löschen. Die Frist zur Erhebung eines Widerspruchs ist auf 1 Monat ab dieser Registerbekanntmachung festgesetzt."
    },
    {
      "date": "2025-08-12",
      "id": "120633",
      "original_text": "Löschungsankündigung\nNiedersachsen Amtsgericht Lüneburg HRB 210483\nGrundstücksgesellschaft Bollensen UG (haftungsbeschränkt) – Wrestedt",
      "type": "Löschungsankündigung",
      "state": "Niedersachsen",
      "amtsgericht": "Amtsgericht Lüneburg",
      "registernummer": "HRB 210483",
      "registerart": "HRB",
      "company_name": "Grundstücksgesellschaft Bollensen UG (haftungsbeschränkt)",
      "company_seat": "Wrestedt",
      "details": "12.08.2025 (Bekanntmachungsdatum)\n\nNiedersachsen Amtsgericht Lüneburg HRB 210483\nLöschungsankündigung\n\nGrundstücksgesellschaft Bollensen UG (haftungsbeschränkt)\nGesellschaft mit beschränkter Haftung\nWrestedt\n\nDas Registergericht beabsichtigt, vorstehende Gesellschaft von Amts wegen nach § 394 FamFG zu löschen. Die Frist zur Erhebung eines Widerspruchs ist auf 1 Monat ab Veröffentlichung festgesetzt."
    },
    {
      "date": "2025-08-12",
      "id": "120634",
      "original_text": "Löschungsankündigung\nNiedersachsen Amtsgericht Aurich HRB 206403\nHS Auto- und Ersatzteilhandel UG (haftungsbeschränkt) – Ostrhauderfehn",
      "type": "Löschungsankündigung",
      "state": "Niedersachsen",
      "amtsgericht": "Amtsgericht Aurich",
      "registernummer": "HRB 206403",
      "registerart": "HRB",
      "company_name": "HS Auto- und Ersatzteilhandel UG (haftungsbeschränkt)",
      "company_seat": "Ostrhauderfehn",
      "details": "12.08.2025 (Bekanntmachungsdatum)\n\nNiedersachsen Amtsgericht Aurich HRB 206403\nLöschungsankündigung\n\nHS Auto- und Ersatzteilhandel UG (haftungsbeschränkt)\nGesellschaft mit beschränkter Haftung\nOstrhauderfehn\n\nDas Registergericht beabsichtigt, die Gesellschaft von Amts wegen nach § 394 FamFG zu löschen. Die Frist zur Erhebung eines Widerspruchs ist auf 1 Monat ab dieser Registerbekanntmachung festgesetzt."
    },
    {
      "date": "2025-08-12",
      "id": "120635",
      "original_text": "Registerbekanntmachung nach dem Umwandlungsgesetz\nNiedersachsen Amtsgericht Aurich HRB 204222\nNLT Automation GmbH – Norden",
      "type": "Registerbekanntmachung nach dem Umwandlungsgesetz",
      "state": "Niedersachsen",
      "amtsgericht": "Amtsgericht Aurich",
      "registernummer": "HRB 204222",
      "registerart": "HRB",
      "company_name": "NLT Automation GmbH",
      "company_seat": "Norden",
      "details": "12.08.2025 (Bekanntmachungsdatum)\n\nNiedersachsen Amtsgericht Aurich HRB 204222\nRegisterbekanntmachung nach dem Umwandlungsgesetz\n\nNLT Automation GmbH\nGesellschaft mit beschränkter Haftung\nNorden\n\nEs wird darauf hingewiesen, dass ein Verschmelzungsplan oder sein Entwurf über eine grenzüberschreitende Verschmelzung zur Aufnahme mit der NLT Automation GmbH mit Sitz in Norden/Bundesrepublik Deutschland (Amtsgericht Aurich HRB 204222) (Gesellschaft mit beschränkter Haftung) beim Handelsregister eingereicht worden ist.\n\nDie Anteilsinhaber, die Gläubiger sowie die zuständigen Betriebsräte der an der grenzüberschreitenden Verschmelzung beteiligten Gesellschaften oder, soweit es keinen Betriebsrat gibt, die Arbeitnehmer der an der grenzüberschreitenden Verschmelzung beteiligten Gesellschaften, können der jeweiligen Gesellschaft spätestens fünf Arbeitstage vor dem Tag der Gesellschafterversammlung Bemerkungen zum Verschmelzungsplan übermitteln."
    },
    {
      "date": "2025-08-12",
      "id": "120636",
      "original_text": "Registerbekanntmachung nach dem Umwandlungsgesetz\nNiedersachsen Amtsgericht Walsrode HRB 210054\nHK20 GmbH – Stuhr",
      "type": "Registerbekanntmachung nach dem Umwandlungsgesetz",
      "state": "Niedersachsen",
      "amtsgericht": "Amtsgericht Walsrode",
      "registernummer": "HRB 210054",
      "registerart": "HRB",
      "company_name": "HK20 GmbH",
      "company_seat": "Stuhr",
      "details": "12.08.2025 (Bekanntmachungsdatum)\n\nNiedersachsen Amtsgericht Walsrode HRB 210054\nRegisterbekanntmachung nach dem Umwandlungsgesetz 12.08.2025 (Eintragungsdatum)\n\nHK20 GmbH\nGesellschaft mit beschränkter Haftung\nStuhr\n\nDen Gläubigern der an der Verschmelzung beteiligten Rechtsträger ist, wenn sie binnen sechs Monaten nach dem Tag, an dem die Eintragung der Verschmelzung in das Register des Sitzes desjenigen Rechtsträgers, dessen Gläubiger sie sind, nach § 19  Abs.  3 UmwG als bekannt gemacht gilt, ihren Anspruch nach Grund und Höhe schriftlich anmelden, Sicherheit zu leisten, soweit sie nicht Befriedigung verlangen können. Dieses Recht steht den Gläubigern jedoch nur zu, wenn sie glaubhaft machen, dass durch die Verschmelzung die Erfüllung der Forderung gefährdet wird."
    },
    {
      "date": "2025-08-12",
      "id": "120637",
      "original_text": "Registerbekanntmachung nach dem Umwandlungsgesetz\nNiedersachsen Amtsgericht Walsrode HRB 210046\nHK22 GmbH – Stuhr",
      "type": "Registerbekanntmachung nach dem Umwandlungsgesetz",
      "state": "Niedersachsen",
      "amtsgericht": "Amtsgericht Walsrode",
      "registernummer": "HRB 210046",
      "registerart": "HRB",
      "company_name": "HK22 GmbH",
      "company_seat": "Stuhr",
      "details": "12.08.2025 (Bekanntmachungsdatum)\n\nNiedersachsen Amtsgericht Walsrode HRB 210046\nRegisterbekanntmachung nach dem Umwandlungsgesetz 12.08.2025 (Eintragungsdatum)\n\nHK22 GmbH\nGesellschaft mit beschränkter Haftung\nStuhr\n\nDen Gläubigern der an der Verschmelzung beteiligten Rechtsträger ist, wenn sie binnen sechs Monaten nach dem Tag, an dem die Eintragung der Verschmelzung in das Register des Sitzes desjenigen Rechtsträgers, dessen Gläubiger sie sind, nach § 19  Abs.  3 UmwG als bekannt gemacht gilt, ihren Anspruch nach Grund und Höhe schriftlich anmelden, Sicherheit zu leisten, soweit sie nicht Befriedigung verlangen können. Dieses Recht steht den Gläubigern jedoch nur zu, wenn sie glaubhaft machen, dass durch die Verschmelzung die Erfüllung der Forderung gefährdet wird."
    },
    {
      "date": "2025-08-12",
      "id": "120638",
      "original_text": "Registerbekanntmachung nach dem Umwandlungsgesetz\nNiedersachsen Amtsgericht Walsrode HRB 209759\nHK11 GmbH – Stuhr",
      "type": "Registerbekanntmachung nach dem Umwandlungsgesetz",
      "state": "Niedersachsen",
      "amtsgericht": "Amtsgericht Walsrode",
      "registernummer": "HRB 209759",
      "registerart": "HRB",
      "company_name": "HK11 GmbH",
      "company_seat": "Stuhr",
      "details": "12.08.2025 (Bekanntmachungsdatum)\n\nNiedersachsen Amtsgericht Walsrode HRB 209759\nRegisterbekanntmachung nach dem Umwandlungsgesetz 12.08.2025 (Eintragungsdatum)\n\nHK11 GmbH\nGesellschaft mit beschränkter Haftung\nStuhr\n\nDen Gläubigern der an der Verschmelzung beteiligten Rechtsträger ist, wenn sie binnen sechs Monaten nach dem Tag, an dem die Eintragung der Verschmelzung in das Register des Sitzes desjenigen Rechtsträgers, dessen Gläubiger sie sind, nach § 19  Abs.  3 UmwG als bekannt gemacht gilt, ihren Anspruch nach Grund und Höhe schriftlich anmelden, Sicherheit zu leisten, soweit sie nicht Befriedigung verlangen können. Dieses Recht steht den Gläubigern jedoch nur zu, wenn sie glaubhaft machen, dass durch die Verschmelzung die Erfüllung der Forderung gefährdet wird."
    },
    {
      "date": "2025-08-12",
      "id": "120639",
      "original_text": "Registerbekanntmachung nach dem Umwandlungsgesetz\nNiedersachsen Amtsgericht Walsrode HRB 210049\nHK19 GmbH – Stuhr",
      "type": "Registerbekanntmachung nach dem Umwandlungsgesetz",
      "state": "Niedersachsen",
      "amtsgericht": "Amtsgericht Walsrode",
      "registernummer": "HRB 210049",
      "registerart": "HRB",
      "company_name": "HK19 GmbH",
      "company_seat": "Stuhr",
      "details": "12.08.2025 (Bekanntmachungsdatum)\n\nNiedersachsen Amtsgericht Walsrode HRB 210049\nRegisterbekanntmachung nach dem Umwandlungsgesetz 12.08.2025 (Eintragungsdatum)\n\nHK19 GmbH\nGesellschaft mit beschränkter Haftung\nStuhr\n\nDen Gläubigern der an der Verschmelzung beteiligten Rechtsträger ist, wenn sie binnen sechs Monaten nach dem Tag, an dem die Eintragung der Verschmelzung in das Register des Sitzes desjenigen Rechtsträgers, dessen Gläubiger sie sind, nach § 19  Abs.  3 UmwG als bekannt gemacht gilt, ihren Anspruch nach Grund und Höhe schriftlich anmelden, Sicherheit zu leisten, soweit sie nicht Befriedigung verlangen können. Dieses Recht steht den Gläubigern jedoch nur zu, wenn sie glaubhaft machen, dass durch die Verschmelzung die Erfüllung der Forderung gefährdet wird."
    },
    {
      "date": "2025-08-12",
      "id": "120640",
      "original_text": "Registerbekanntmachung nach dem Umwandlungsgesetz\nNiedersachsen Amtsgericht Walsrode HRB 209504\nHK4 GmbH – Stuhr",
      "type": "Registerbekanntmachung nach dem Umwandlungsgesetz",
      "state": "Niedersachsen",
      "amtsgericht": "Amtsgericht Walsrode",
      "registernummer": "HRB 209504",
      "registerart": "HRB",
      "company_name": "HK4 GmbH",
      "company_seat": "Stuhr",
      "details": "12.08.2025 (Bekanntmachungsdatum)\n\nNiedersachsen Amtsgericht Walsrode HRB 209504\nRegisterbekanntmachung nach dem Umwandlungsgesetz 12.08.2025 (Eintragungsdatum)\n\nHK4 GmbH\nGesellschaft mit beschränkter Haftung\nStuhr\n\nDen Gläubigern der an der Verschmelzung beteiligten Rechtsträger ist, wenn sie binnen sechs Monaten nach dem Tag, an dem die Eintragung der Verschmelzung in das Register des Sitzes desjenigen Rechtsträgers, dessen Gläubiger sie sind, nach § 19  Abs.  3 UmwG als bekannt gemacht gilt, ihren Anspruch nach Grund und Höhe schriftlich anmelden, Sicherheit zu leisten, soweit sie nicht Befriedigung verlangen können. Dieses Recht steht den Gläubigern jedoch nur zu, wenn sie glaubhaft machen, dass durch die Verschmelzung die Erfüllung der Forderung gefährdet wird."
    },
    {
      "date": "2025-08-12",
      "id": "120641",
      "original_text": "Registerbekanntmachung nach dem Umwandlungsgesetz\nNiedersachsen Amtsgericht Walsrode HRB 210021\nHK16 GmbH – Stuhr",
      "type": "Registerbekanntmachung nach dem Umwandlungsgesetz",
      "state": "Niedersachsen",
      "amtsgericht": "Amtsgericht Walsrode",
      "registernummer": "HRB 210021",
      "registerart": "HRB",
      "company_name": "HK16 GmbH",
      "company_seat": "Stuhr",
      "details": "12.08.2025 (Bekanntmachungsdatum)\n\nNiedersachsen Amtsgericht Walsrode HRB 210021\nRegisterbekanntmachung nach dem Umwandlungsgesetz 12.08.2025 (Eintragungsdatum)\n\nHK16 GmbH\nGesellschaft mit beschränkter Haftung\nStuhr\n\nDen Gläubigern der an der Verschmelzung beteiligten Rechtsträger ist, wenn sie binnen sechs Monaten nach dem Tag, an dem die Eintragung der Verschmelzung in das Register des Sitzes desjenigen Rechtsträgers, dessen Gläubiger sie sind, nach § 19  Abs.  3 UmwG als bekannt gemacht gilt, ihren Anspruch nach Grund und Höhe schriftlich anmelden, Sicherheit zu leisten, soweit sie nicht Befriedigung verlangen können. Dieses Recht steht den Gläubigern jedoch nur zu, wenn sie glaubhaft machen, dass durch die Verschmelzung die Erfüllung der Forderung gefährdet wird."
    },
    {
      "date": "2025-08-12",
      "id": "120642",
      "original_text": "Registerbekanntmachung nach dem Umwandlungsgesetz\nNiedersachsen Amtsgericht Walsrode HRB 210032\nHK15 GmbH – Stuhr",
      "type": "Registerbekanntmachung nach dem Umwandlungsgesetz",
      "state": "Niedersachsen",
      "amtsgericht": "Amtsgericht Walsrode",
      "registernummer": "HRB 210032",
      "registerart": "HRB",
      "company_name": "HK15 GmbH",
      "company_seat": "Stuhr",
      "details": "12.08.2025 (Bekanntmachungsdatum)\n\nNiedersachsen Amtsgericht Walsrode HRB 210032\nRegisterbekanntmachung nach dem Umwandlungsgesetz 12.08.2025 (Eintragungsdatum)\n\nHK15 GmbH\nGesellschaft mit beschränkter Haftung\nStuhr\n\nDen Gläubigern der an der Verschmelzung beteiligten Rechtsträger ist, wenn sie binnen sechs Monaten nach dem Tag, an dem die Eintragung der Verschmelzung in das Register des Sitzes desjenigen Rechtsträgers, dessen Gläubiger sie sind, nach § 19  Abs.  3 UmwG als bekannt gemacht gilt, ihren Anspruch nach Grund und Höhe schriftlich anmelden, Sicherheit zu leisten, soweit sie nicht Befriedigung verlangen können. Dieses Recht steht den Gläubigern jedoch nur zu, wenn sie glaubhaft machen, dass durch die Verschmelzung die Erfüllung der Forderung gefährdet wird."
    },
    {
      "date": "2025-08-12",
      "id": "120643",
      "original_text": "Registerbekanntmachung nach dem Umwandlungsgesetz\nNiedersachsen Amtsgericht Walsrode HRB 210065\nHK18 GmbH – Stuhr",
      "type": "Registerbekanntmachung nach dem Umwandlungsgesetz",
      "state": "Niedersachsen",
      "amtsgericht": "Amtsgericht Walsrode",
      "registernummer": "HRB 210065",
      "registerart": "HRB",
      "company_name": "HK18 GmbH",
      "company_seat": "Stuhr",
      "details": "12.08.2025 (Bekanntmachungsdatum)\n\nNiedersachsen Amtsgericht Walsrode HRB 210065\nRegisterbekanntmachung nach dem Umwandlungsgesetz 12.08.2025 (Eintragungsdatum)\n\nHK18 GmbH\nGesellschaft mit beschränkter Haftung\nStuhr\n\nDen Gläubigern der an der Verschmelzung beteiligten Rechtsträger ist, wenn sie binnen sechs Monaten nach dem Tag, an dem die Eintragung der Verschmelzung in das Register des Sitzes desjenigen Rechtsträgers, dessen Gläubiger sie sind, nach § 19  Abs.  3 UmwG als bekannt gemacht gilt, ihren Anspruch nach Grund und Höhe schriftlich anmelden, Sicherheit zu leisten, soweit sie nicht Befriedigung verlangen können. Dieses Recht steht den Gläubigern jedoch nur zu, wenn sie glaubhaft machen, dass durch die Verschmelzung die Erfüllung der Forderung gefährdet wird."
    },
    {
      "date": "2025-08-12",
      "id": "120644",
      "original_text": "Registerbekanntmachung nach dem Umwandlungsgesetz\nNiedersachsen Amtsgericht Walsrode HRB 210064\nHK17 GmbH – Stuhr",
      "type": "Registerbekanntmachung nach dem Umwandlungsgesetz",
      "state": "Niedersachsen",
      "amtsgericht": "Amtsgericht Walsrode",
      "registernummer": "HRB 210064",
      "registerart": "HRB",
      "company_name": "HK17 GmbH",
      "company_seat": "Stuhr",
      "details": "12.08.2025 (Bekanntmachungsdatum)\n\nNiedersachsen Amtsgericht Walsrode HRB 210064\nRegisterbekanntmachung nach dem Umwandlungsgesetz 12.08.2025 (Eintragungsdatum)\n\nHK17 GmbH\nGesellschaft mit beschränkter Haftung\nStuhr\n\nDen Gläubigern der an der Verschmelzung beteiligten Rechtsträger ist, wenn sie binnen sechs Monaten nach dem Tag, an dem die Eintragung der Verschmelzung in das Register des Sitzes desjenigen Rechtsträgers, dessen Gläubiger sie sind, nach § 19  Abs.  3 UmwG als bekannt gemacht gilt, ihren Anspruch nach Grund und Höhe schriftlich anmelden, Sicherheit zu leisten, soweit sie nicht Befriedigung verlangen können. Dieses Recht steht den Gläubigern jedoch nur zu, wenn sie glaubhaft machen, dass durch die Verschmelzung die Erfüllung der Forderung gefährdet wird."
    },
    {
      "date": "2025-08-12",
      "id": "120645",
      "original_text": "Registerbekanntmachung nach dem Umwandlungsgesetz\nNiedersachsen Amtsgericht Walsrode HRB 210208\nHK21 GmbH – Stuhr",
      "type": "Registerbekanntmachung nach dem Umwandlungsgesetz",
      "state": "Niedersachsen",
      "amtsgericht": "Amtsgericht Walsrode",
      "registernummer": "HRB 210208",
      "registerart": "HRB",
      "company_name": "HK21 GmbH",
      "company_seat": "Stuhr",
      "details": "12.08.2025 (Bekanntmachungsdatum)\n\nNiedersachsen Amtsgericht Walsrode HRB 210208\nRegisterbekanntmachung nach dem Umwandlungsgesetz 12.08.2025 (Eintragungsdatum)\n\nHK21 GmbH\nGesellschaft mit beschränkter Haftung\nStuhr\n\nDen Gläubigern der an der Verschmelzung beteiligten Rechtsträger ist, wenn sie binnen sechs Monaten nach dem Tag, an dem die Eintragung der Verschmelzung in das Register des Sitzes desjenigen Rechtsträgers, dessen Gläubiger sie sind, nach § 19  Abs.  3 UmwG als bekannt gemacht gilt, ihren Anspruch nach Grund und Höhe schriftlich anmelden, Sicherheit zu leisten, soweit sie nicht Befriedigung verlangen können. Dieses Recht steht den Gläubigern jedoch nur zu, wenn sie glaubhaft machen, dass durch die Verschmelzung die Erfüllung der Forderung gefährdet wird."
    },
    {
      "date": "2025-08-12",
      "id": "120646",
      "original_text": "Registerbekanntmachung nach dem Umwandlungsgesetz\nNiedersachsen Amtsgericht Hannover HRB 220225\nLindenallee 18 GmbH – Langenhagen",
      "type": "Registerbekanntmachung nach dem Umwandlungsgesetz",
      "state": "Niedersachsen",
      "amtsgericht": "Amtsgericht Hannover",
      "registernummer": "HRB 220225",
      "registerart": "HRB",
      "company_name": "Lindenallee 18 GmbH",
      "company_seat": "Langenhagen",
      "details": "12.08.2025 (Bekanntmachungsdatum)\n\nNiedersachsen Amtsgericht Hannover HRB 220225\nRegisterbekanntmachung nach dem Umwandlungsgesetz 12.08.2025 (Eintragungsdatum)\n\nLindenallee 18 GmbH\nGesellschaft mit beschränkter Haftung\nLangenhagen\n\nDen Gläubigern der an der Verschmelzung beteiligten Rechtsträger ist, wenn sie binnen sechs Monaten nach dem Tag, an dem die Eintragung der Verschmelzung in das Register des Sitzes desjenigen Rechtsträgers, dessen Gläubiger sie sind, nach § 19  Abs.  3 UmwG als bekannt gemacht gilt, ihren Anspruch nach Grund und Höhe schriftlich anmelden, Sicherheit zu leisten, soweit sie nicht Befriedigung verlangen können. Dieses Recht steht den Gläubigern jedoch nur zu, wenn sie glaubhaft machen, dass durch die Verschmelzung die Erfüllung der Forderung gefährdet wird."
    },
    {
      "date": "2025-08-12",
      "id": "120647",
      "original_text": "Registerbekanntmachung nach dem Umwandlungsgesetz\nNiedersachsen Amtsgericht Hannover HRB 220220\nAnderter Straße 129 B GmbH – Langenhagen",
      "type": "Registerbekanntmachung nach dem Umwandlungsgesetz",
      "state": "Niedersachsen",
      "amtsgericht": "Amtsgericht Hannover",
      "registernummer": "HRB 220220",
      "registerart": "HRB",
      "company_name": "Anderter Straße 129 B GmbH",
      "company_seat": "Langenhagen",
      "details": "12.08.2025 (Bekanntmachungsdatum)\n\nNiedersachsen Amtsgericht Hannover HRB 220220\nRegisterbekanntmachung nach dem Umwandlungsgesetz 12.08.2025 (Eintragungsdatum)\n\nAnderter Straße 129 B GmbH\nGesellschaft mit beschränkter Haftung\nLangenhagen\n\nDen Gläubigern der an der Verschmelzung beteiligten Rechtsträger ist, wenn sie binnen sechs Monaten nach dem Tag, an dem die Eintragung der Verschmelzung in das Register des Sitzes desjenigen Rechtsträgers, dessen Gläubiger sie sind, nach § 19  Abs.  3 UmwG als bekannt gemacht gilt, ihren Anspruch nach Grund und Höhe schriftlich anmelden, Sicherheit zu leisten, soweit sie nicht Befriedigung verlangen können. Dieses Recht steht den Gläubigern jedoch nur zu, wenn sie glaubhaft machen, dass durch die Verschmelzung die Erfüllung der Forderung gefährdet wird."
    },
    {
      "date": "2025-08-12",
      "id": "120648",
      "original_text": "Registerbekanntmachung nach dem Umwandlungsgesetz\nNiedersachsen Amtsgericht Osnabrück HRB 202451\nWiegmann Ingenieurbüro GmbH – Bersenbrück",
      "type": "Registerbekanntmachung nach dem Umwandlungsgesetz",
      "state": "Niedersachsen",
      "amtsgericht": "Amtsgericht Osnabrück",
      "registernummer": "HRB 202451",
      "registerart": "HRB",
      "company_name": "Wiegmann Ingenieurbüro GmbH",
      "company_seat": "Bersenbrück",
      "details": "12.08.2025 (Bekanntmachungsdatum)\n\nNiedersachsen Amtsgericht Osnabrück HRB 202451\nRegisterbekanntmachung nach dem Umwandlungsgesetz 12.08.2025 (Eintragungsdatum)\n\nWiegmann Ingenieurbüro GmbH\nGesellschaft mit beschränkter Haftung\nBersenbrück\n\nDen Gläubigern der an der Verschmelzung beteiligten Rechtsträger ist, wenn sie binnen sechs Monaten nach dem Tag, an dem die Eintragung der Verschmelzung in das Register des Sitzes desjenigen Rechtsträgers, dessen Gläubiger sie sind, nach § 19  Abs.  3 UmwG als bekannt gemacht gilt, ihren Anspruch nach Grund und Höhe schriftlich anmelden, Sicherheit zu leisten, soweit sie nicht Befriedigung verlangen können. Dieses Recht steht den Gläubigern jedoch nur zu, wenn sie glaubhaft machen, dass durch die Verschmelzung die Erfüllung der Forderung gefährdet wird."
    },
    {
      "date": "2025-08-12",
      "id": "120649",
      "original_text": "Sonstige Registerbekanntmachung\nNiedersachsen Amtsgericht Oldenburg (Oldenburg) HRB 215798\nSeniorenresidenz am Moorweg GmbH – Delmenhorst",
      "type": "Sonstige Registerbekanntmachung",
      "state": "Niedersachsen",
      "amtsgericht": "Amtsgericht Oldenburg (Oldenburg)",
      "registernummer": "HRB 215798",
      "registerart": "HRB",
      "company_name": "Seniorenresidenz am Moorweg GmbH",
      "company_seat": "Delmenhorst",
      "details": "12.08.2025 (Bekanntmachungsdatum)\n\nNiedersachsen Amtsgericht Oldenburg (Oldenburg) HRB 215798\nSonstige Registerbekanntmachung 12.08.2025 (Eintragungsdatum)\n\nSeniorenresidenz am Moorweg GmbH\nGesellschaft mit beschränkter Haftung\nDelmenhorst\n\nDen Gläubigern der Gesellschaft, deren Forderungen begründet worden sind, bevor die Eintragung der Beendigung des Vertrages in das Handelsregister nach § 10 HGB als bekanntgemacht gilt, ist vom anderen Vertragsteil Sicherheit zu leisten, wenn sie sich binnen sechs Monaten nach der Bekanntmachung zu diesem Zweck bei ihm melden."
    },
    {
      "date": "2025-08-12",
      "id": "120650",
      "original_text": "Registerbekanntmachung nach dem Umwandlungsgesetz\nNiedersachsen Amtsgericht Osnabrück HRA 200569\nWeber Baustoffe GmbH & Co. KG – Georgsmarienhütte",
      "type": "Registerbekanntmachung nach dem Umwandlungsgesetz",
      "state": "Niedersachsen",
      "amtsgericht": "Amtsgericht Osnabrück",
      "registernummer": "HRA 200569",
      "registerart": "HRA",
      "company_name": "Weber Baustoffe GmbH & Co. KG",
      "company_seat": "Georgsmarienhütte",
      "details": "12.08.2025 (Bekanntmachungsdatum)\n\nNiedersachsen Amtsgericht Osnabrück HRA 200569\nRegisterbekanntmachung nach dem Umwandlungsgesetz\n\nWeber Baustoffe GmbH & Co. KG\nKommanditgesellschaft\nGeorgsmarienhütte\n\nDen Gläubigern der an der Verschmelzung beteiligten Rechtsträger ist, wenn sie binnen sechs Monaten nach dem Tag, an dem die Eintragung der Verschmelzung in das Register des Sitzes desjenigen Rechtsträgers, dessen Gläubiger sie sind, nach § 19  Abs.  3 UmwG als bekannt gemacht gilt, ihren Anspruch nach Grund und Höhe schriftlich anmelden, Sicherheit zu leisten, soweit sie nicht Befriedigung verlangen können. Dieses Recht steht den Gläubigern jedoch nur zu, wenn sie glaubhaft machen, dass durch die Verschmelzung die Erfüllung der Forderung gefährdet wird."
    },
    {
      "date": "2025-08-12",
      "id": "120651",
      "original_text": "Registerbekanntmachung nach dem Umwandlungsgesetz\nNiedersachsen Amtsgericht Osnabrück HRA 209647\npreigu GmbH & Co. KG – Osnabrück",
      "type": "Registerbekanntmachung nach dem Umwandlungsgesetz",
      "state": "Niedersachsen",
      "amtsgericht": "Amtsgericht Osnabrück",
      "registernummer": "HRA 209647",
      "registerart": "HRA",
      "company_name": "preigu GmbH & Co. KG",
      "company_seat": "Osnabrück",
      "details": "12.08.2025 (Bekanntmachungsdatum)\n\nNiedersachsen Amtsgericht Osnabrück HRA 209647\nRegisterbekanntmachung nach dem Umwandlungsgesetz 12.08.2025 (Eintragungsdatum)\n\npreigu GmbH & Co. KG\nKommanditgesellschaft\nOsnabrück\n\nDen Gläubigern der an der Ausgliederung beteiligten Rechtsträger ist, wenn sie binnen sechs Monaten nach dem Tag, an dem die Eintragung der Ausgliederung in das Register des Sitzes desjenigen Rechtsträgers, dessen Gläubiger sie sind, nach § 19 Abs. 3 UmwG als bekannt gemacht gilt, ihren Anspruch nach Grund und Höhe schriftlich anmelden, Sicherheit zu leisten, soweit sie nicht Befriedigung verlangen können. Dieses Recht steht den Gläubigern jedoch nur zu, wenn sie glaubhaft machen, dass durch die Ausgliederung die Erfüllung der Forderung gefährdet wird."
    },
    {
      "date": "2025-08-12",
      "id": "120652",
      "original_text": "Registerbekanntmachung nach dem Umwandlungsgesetz\nNiedersachsen Amtsgericht Osnabrück HRB 210322\nViVa Fitness Ahlen GmbH – Quakenbrück",
      "type": "Registerbekanntmachung nach dem Umwandlungsgesetz",
      "state": "Niedersachsen",
      "amtsgericht": "Amtsgericht Osnabrück",
      "registernummer": "HRB 210322",
      "registerart": "HRB",
      "company_name": "ViVa Fitness Ahlen GmbH",
      "company_seat": "Quakenbrück",
      "details": "12.08.2025 (Bekanntmachungsdatum)\n\nNiedersachsen Amtsgericht Osnabrück HRB 210322\nRegisterbekanntmachung nach dem Umwandlungsgesetz 12.08.2025 (Eintragungsdatum)\n\nViVa Fitness Ahlen GmbH\nGesellschaft mit beschränkter Haftung\nQuakenbrück\n\nDen Gläubigern der an der Verschmelzung beteiligten Rechtsträger ist, wenn sie binnen sechs Monaten nach dem Tag, an dem die Eintragung der Verschmelzung in das Register des Sitzes desjenigen Rechtsträgers, dessen Gläubiger sie sind, nach § 19  Abs.  3 UmwG als bekannt gemacht gilt, ihren Anspruch nach Grund und Höhe schriftlich anmelden, Sicherheit zu leisten, soweit sie nicht Befriedigung verlangen können. Dieses Recht steht den Gläubigern jedoch nur zu, wenn sie glaubhaft machen, dass durch die Verschmelzung die Erfüllung der Forderung gefährdet wird."
    },
    {
      "date": "2025-08-12",
      "id": "120653",
      "original_text": "Löschungsankündigung\nRheinland-Pfalz Amtsgericht Mainz HRA 43345\nOthman e.K. – Ober-Olm",
      "type": "Löschungsankündigung",
      "state": "Rheinland-Pfalz",
      "amtsgericht": "Amtsgericht Mainz",
      "registernummer": "HRA 43345",
      "registerart": "HRA",
      "company_name": "Othman e.K.",
      "company_seat": "Ober-Olm",
      "details": "12.08.2025 (Bekanntmachungsdatum)\n\nRheinland-Pfalz Amtsgericht Mainz HRA 43345\nLöschungsankündigung\n\nOthman e.K.\nEinzelkaufmann / Einzelkauffrau\nOber-Olm\n\nDas Registergericht beabsichtigt die Firma von Amts wegen nach § 31 Abs. 2 HGB, § 393 FamFG zu löschen. Die Frist zur Erhebung eines Widerspruchs ist auf einen Monat festgesetzt."
    },
    {
      "date": "2025-08-12",
      "id": "120654",
      "original_text": "Registerbekanntmachung nach dem Umwandlungsgesetz\nRheinland-Pfalz Amtsgericht Montabaur HRB 21971\nNKV Werbemittel GmbH – Melsbach",
      "type": "Registerbekanntmachung nach dem Umwandlungsgesetz",
      "state": "Rheinland-Pfalz",
      "amtsgericht": "Amtsgericht Montabaur",
      "registernummer": "HRB 21971",
      "registerart": "HRB",
      "company_name": "NKV Werbemittel GmbH",
      "company_seat": "Melsbach",
      "details": "12.08.2025 (Bekanntmachungsdatum)\n\nRheinland-Pfalz Amtsgericht Montabaur HRB 21971\nRegisterbekanntmachung nach dem Umwandlungsgesetz 12.08.2025 (Eintragungsdatum)\n\nNKV Werbemittel GmbH\nGesellschaft mit beschränkter Haftung\nMelsbach\n\nAls nicht eingetragen wird veröffentlicht: Den Gläubigern der an der Verschmelzung beteiligten Rechtsträger ist, wenn sie binnen sechs Monaten nach dem Tag, an dem die Eintragung der Verschmelzung in das Register des Sitzes desjenigen Rechtsträgers, dessen Gläubiger sie sind, nach § 19 Abs. 3 UmwG als bekannt gemacht gilt, ihren Anspruch nach Grund und Höhe schriftlich anmelden, Sicherheit zu leisten, soweit sie nicht Befriedigung verlangen können. Dieses Recht steht den Gläubigern jedoch nur zu, wenn sie glaubhaft machen, dass durch die Verschmelzung die Erfüllung der Forderung gefährdet wird."
    },
    {
      "date": "2025-08-12",
      "id": "120655",
      "original_text": "Registerbekanntmachung nach dem Umwandlungsgesetz\nRheinland-Pfalz Amtsgericht Zweibrücken HRA 30755\nNeustädter Reformhaus GmbH & Co. KG – Pirmasens",
      "type": "Registerbekanntmachung nach dem Umwandlungsgesetz",
      "state": "Rheinland-Pfalz",
      "amtsgericht": "Amtsgericht Zweibrücken",
      "registernummer": "HRA 30755",
      "registerart": "HRA",
      "company_name": "Neustädter Reformhaus GmbH & Co. KG",
      "company_seat": "Pirmasens",
      "details": "12.08.2025 (Bekanntmachungsdatum)\n\nRheinland-Pfalz Amtsgericht Zweibrücken HRA 30755\nRegisterbekanntmachung nach dem Umwandlungsgesetz 11.08.2025 (Eintragungsdatum)\n\nNeustädter Reformhaus GmbH & Co. KG\nKommanditgesellschaft\nPirmasens\n\nAls nicht eingetragen wird veröffentlicht: Den Gläubigern der an der Verschmelzung beteiligten Rechtsträger ist, wenn sie binnen sechs Monaten nach dem Tag, an dem die Eintragung der Verschmelzung in das Register des Sitzes desjenigen Rechtsträgers,dessen Gläubiger sie sind, nach § 19 Abs. 3 UmwG als bekannt gemacht gilt, ihren Anspruch nach Grund und Höhe schriftlich anmelden, Sicherheit zu leisten, soweit sie nicht Befriedigung verlangen können. Dieses Recht steht den Gläubigern jedoch nur zu, wenn sie glaubhaft machen, dass durch die Verschmelzung die Erfüllungd er Forderung gefährdet wird."
    },
    {
      "date": "2025-08-12",
      "id": "120656",
      "original_text": "Registerbekanntmachung nach dem Umwandlungsgesetz\nRheinland-Pfalz Amtsgericht Zweibrücken HRB 32251\nKG Immobilien GmbH – Zweibrücken",
      "type": "Registerbekanntmachung nach dem Umwandlungsgesetz",
      "state": "Rheinland-Pfalz",
      "amtsgericht": "Amtsgericht Zweibrücken",
      "registernummer": "HRB 32251",
      "registerart": "HRB",
      "company_name": "KG Immobilien GmbH",
      "company_seat": "Zweibrücken",
      "details": "12.08.2025 (Bekanntmachungsdatum)\n\nRheinland-Pfalz Amtsgericht Zweibrücken HRB 32251\nRegisterbekanntmachung nach dem Umwandlungsgesetz 12.08.2025 (Eintragungsdatum)\n\nKG Immobilien GmbH\nGesellschaft mit beschränkter Haftung\nZweibrücken\n\nAls nicht eingetragen wird veröffentlicht: Den Gläubigern der an der Verschmelzung beteiligten Rechtsträger ist, wenn sie binnen sechs Monaten nach dem Tag, an dem die Eintragung der Verschmelzung in das Register des Sitzes desjenigen Rechtsträgers,dessen Gläubiger sie sind, nach § 19 Abs. 3 UmwG als bekannt gemacht gilt, ihren Anspruch nach Grund und Höhe schriftlich anmelden, Sicherheit zu leisten, soweit sie nicht Befriedigung verlangen können. Dieses Recht steht den Gläubigern jedoch nur zu, wenn sie glaubhaft machen, dass durch die Verschmelzung die Erfüllungd er Forderung gefährdet wird."
    },
    {
      "date": "2025-08-12",
      "id": "120657",
      "original_text": "Registerbekanntmachung nach dem Umwandlungsgesetz\nRheinland-Pfalz Amtsgericht Montabaur HRB 30626\nAIRTUNE GmbH – Elsoff",
      "type": "Registerbekanntmachung nach dem Umwandlungsgesetz",
      "state": "Rheinland-Pfalz",
      "amtsgericht": "Amtsgericht Montabaur",
      "registernummer": "HRB 30626",
      "registerart": "HRB",
      "company_name": "AIRTUNE GmbH",
      "company_seat": "Elsoff",
      "details": "12.08.2025 (Bekanntmachungsdatum)\n\nRheinland-Pfalz Amtsgericht Montabaur HRB 30626\nRegisterbekanntmachung nach dem Umwandlungsgesetz 12.08.2025 (Eintragungsdatum)\n\nAIRTUNE GmbH\nGesellschaft mit beschränkter Haftung\nElsoff\n\nAls nicht eingetragen wird veröffentlicht: Den Gläubigern der an der Ausgliederung beteiligten Rechtsträger ist, wenn sie binnen sechs Monaten nach dem Tag, an dem die Eintragung der Ausgliederung in das Register des Sitzes desjenigen Rechtsträgers,dessen Gläubiger sie sind, nach § 19 Abs. 3 UmwG als bekannt gemacht gilt, ihren Anspruch nach Grund und Höhe schriftlich anmelden, Sicherheit zu leisten, soweit sie nicht Befriedigung verlangen können. Dieses Recht steht den Gläubigern jedoch nur zu, wenn sie glaubhaft machen, dass durch die Ausgliederung die Erfüllung der Forderung gefährdet wird."
    },
    {
      "date": "2025-08-12",
      "id": "120658",
      "original_text": "Registerbekanntmachung nach dem Umwandlungsgesetz\nRheinland-Pfalz Amtsgericht Montabaur HRB 25031\nNKV Werbemittel GmbH – Melsbach",
      "type": "Registerbekanntmachung nach dem Umwandlungsgesetz",
      "state": "Rheinland-Pfalz",
      "amtsgericht": "Amtsgericht Montabaur",
      "registernummer": "HRB 25031",
      "registerart": "HRB",
      "company_name": "NKV Werbemittel GmbH",
      "company_seat": "Melsbach",
      "details": "12.08.2025 (Bekanntmachungsdatum)\n\nRheinland-Pfalz Amtsgericht Montabaur HRB 25031\nRegisterbekanntmachung nach dem Umwandlungsgesetz 12.08.2025 (Eintragungsdatum)\n\nNKV Werbemittel GmbH\nGesellschaft mit beschränkter Haftung\nMelsbach\n\nAls nicht eingetragen wird veröffentlicht: Den Gläubigern der an der Verschmelzung beteiligten Rechtsträger ist, wenn sie binnen sechs Monaten nach dem Tag, an dem die Eintragung der Verschmelzung in das Register des Sitzes desjenigen Rechtsträgers, dessen Gläubiger sie sind, nach § 19 Abs. 3 UmwG als bekannt gemacht gilt, ihren Anspruch nach Grund und Höhe schriftlich anmelden, Sicherheit zu leisten, soweit sie nicht Befriedigung verlangen können. Dieses Recht steht den Gläubigern jedoch nur zu, wenn sie glaubhaft machen, dass durch die Verschmelzung die Erfüllung der Forderung gefährdet wird."
    },
    {
      "date": "2025-08-12",
      "id": "120659",
      "original_text": "Registerbekanntmachung nach dem Umwandlungsgesetz\nRheinland-Pfalz Amtsgericht Zweibrücken HRA 30429\nReformhaus Escher GmbH & Co. KG – Pirmasens",
      "type": "Registerbekanntmachung nach dem Umwandlungsgesetz",
      "state": "Rheinland-Pfalz",
      "amtsgericht": "Amtsgericht Zweibrücken",
      "registernummer": "HRA 30429",
      "registerart": "HRA",
      "company_name": "Reformhaus Escher GmbH & Co. KG",
      "company_seat": "Pirmasens",
      "details": "12.08.2025 (Bekanntmachungsdatum)\n\nRheinland-Pfalz Amtsgericht Zweibrücken HRA 30429\nRegisterbekanntmachung nach dem Umwandlungsgesetz 11.08.2025 (Eintragungsdatum)\n\nReformhaus Escher GmbH & Co. KG\nKommanditgesellschaft\nPirmasens\n\nAls nicht eingetragen wird veröffentlicht: Den Gläubigern der an der Verschmelzung beteiligten Rechtsträger ist, wenn sie binnen sechs Monaten nach dem Tag, an dem die Eintragung der Verschmelzung in das Register des Sitzes desjenigen Rechtsträgers,dessen Gläubiger sie sind, nach § 19 Abs. 3 UmwG als bekannt gemacht gilt, ihren Anspruch nach Grund und Höhe schriftlich anmelden, Sicherheit zu leisten, soweit sie nicht Befriedigung verlangen können. Dieses Recht steht den Gläubigern jedoch nur zu, wenn sie glaubhaft machen, dass durch die Verschmelzung die Erfüllungd er Forderung gefährdet wird."
    },
    {
      "date": "2025-08-12",
      "id": "120660",
      "original_text": "Registerbekanntmachung nach dem Umwandlungsgesetz\nRheinland-Pfalz Amtsgericht Zweibrücken HRB 32123\nKOELSCH GROUP Holding GmbH – Zweibrücken",
      "type": "Registerbekanntmachung nach dem Umwandlungsgesetz",
      "state": "Rheinland-Pfalz",
      "amtsgericht": "Amtsgericht Zweibrücken",
      "registernummer": "HRB 32123",
      "registerart": "HRB",
      "company_name": "KOELSCH GROUP Holding GmbH",
      "company_seat": "Zweibrücken",
      "details": "12.08.2025 (Bekanntmachungsdatum)\n\nRheinland-Pfalz Amtsgericht Zweibrücken HRB 32123\nRegisterbekanntmachung nach dem Umwandlungsgesetz 12.08.2025 (Eintragungsdatum)\n\nKOELSCH GROUP Holding GmbH\nGesellschaft mit beschränkter Haftung\nZweibrücken\n\nAls nicht eingetragen wird veröffentlicht: Den Gläubigern der an der Verschmelzung beteiligten Rechtsträger ist, wenn sie binnen sechs Monaten nach dem Tag, an dem die Eintragung der Verschmelzung in das Register des Sitzes desjenigen Rechtsträgers,dessen Gläubiger sie sind, nach § 19 Abs. 3 UmwG als bekannt gemacht gilt, ihren Anspruch nach Grund und Höhe schriftlich anmelden, Sicherheit zu leisten, soweit sie nicht Befriedigung verlangen können. Dieses Recht steht den Gläubigern jedoch nur zu, wenn sie glaubhaft machen, dass durch die Verschmelzung die Erfüllungd er Forderung gefährdet wird."
    },
    {
      "date": "2025-08-12",
      "id": "120661",
      "original_text": "Löschungsankündigung\nNordrhein-Westfalen Amtsgericht Dortmund HRB 23737\nBonus-Scout UG (haftungsbeschränkt) – Rhauderfehn",
      "type": "Löschungsankündigung",
      "state": "Nordrhein-Westfalen",
      "amtsgericht": "Amtsgericht Dortmund",
      "registernummer": "HRB 23737",
      "registerart": "HRB",
      "company_name": "Bonus-Scout UG (haftungsbeschränkt)",
      "company_seat": "Rhauderfehn",
      "details": "12.08.2025 (Bekanntmachungsdatum)\n\nNordrhein-Westfalen Amtsgericht Dortmund HRB 23737\nLöschungsankündigung 12.08.2025 (Eintragungsdatum)\n\nBonus-Scout UG (haftungsbeschränkt)\nGesellschaft mit beschränkter Haftung\nRhauderfehn\n\nDas Registergericht beabsichtigt die Gesellschaft von Amts wegen nach § 394 FamFG zu löschen. Die Frist zur Erhebung eines Widerspruchs ist auf zwei Monate festgesetzt."
    },
    {
      "date": "2025-08-12",
      "id": "120662",
      "original_text": "Registerbekanntmachung nach dem Umwandlungsgesetz\nNordrhein-Westfalen Amtsgericht Arnsberg HRA 9328\nKRAMER-Eventmanagement e. K., Inhaber Frank Kramer – Arnsberg",
      "type": "Registerbekanntmachung nach dem Umwandlungsgesetz",
      "state": "Nordrhein-Westfalen",
      "amtsgericht": "Amtsgericht Arnsberg",
      "registernummer": "HRA 9328",
      "registerart": "HRA",
      "company_name": "KRAMER-Eventmanagement e. K., Inhaber Frank Kramer",
      "company_seat": "Arnsberg",
      "details": "12.08.2025 (Bekanntmachungsdatum)\n\nNordrhein-Westfalen Amtsgericht Arnsberg HRA 9328\nRegisterbekanntmachung nach dem Umwandlungsgesetz 12.08.2025 (Eintragungsdatum)\n\nKRAMER-Eventmanagement e. K., Inhaber Frank Kramer\nEinzelkaufmann / Einzelkauffrau\nArnsberg\n\nDen Gläubigern der an der Ausgliederung beteiligten Rechtsträger ist, wenn sie binnen sechs Monaten nach dem Tag, an dem die Eintragung der Ausgliederung in das Register des Sitzes desjenigen Rechtsträgers, dessen Gläubiger sie sind, nach § 19 Absatz 3 UmwG als bekanntgemacht gilt, ihren Anspruch nach Grund und Höhe schriftlich anmelden, Sicherheit zu leisten, soweit sie nicht Befriedigung verlangen können. Dieses Recht steht den Gläubigern jedoch nur zu, wenn sie glaubhaft machen, dass durch die Ausgliederung die Erfüllung ihrer Forderung gefährdet wird."
    },
    {
      "date": "2025-08-12",
      "id": "120663",
      "original_text": "Löschungsankündigung\nNordrhein-Westfalen Amtsgericht Köln HRB 110122\nCARAT UG (haftungsbeschränkt) – Köln",
      "type": "Löschungsankündigung",
      "state": "Nordrhein-Westfalen",
      "amtsgericht": "Amtsgericht Köln",
      "registernummer": "HRB 110122",
      "registerart": "HRB",
      "company_name": "CARAT UG (haftungsbeschränkt)",
      "company_seat": "Köln",
      "details": "12.08.2025 (Bekanntmachungsdatum)\n\nNordrhein-Westfalen Amtsgericht Köln HRB 110122\nLöschungsankündigung\n\nCARAT UG (haftungsbeschränkt)\nGesellschaft mit beschränkter Haftung\nKöln\n\nDas Registergericht beabsichtigt die Gesellschaft von Amts wegen nach § 394 FamFG zu löschen. Die Frist zur Erhebung eines Widerspruchs ist auf einen Monat festgesetzt."
    },
    {
      "date": "2025-08-12",
      "id": "120664",
      "original_text": "Registerbekanntmachung nach dem Umwandlungsgesetz\nNordrhein-Westfalen Amtsgericht Köln HRA 37980\nMarco Andrys e.K. – Kerpen",
      "type": "Registerbekanntmachung nach dem Umwandlungsgesetz",
      "state": "Nordrhein-Westfalen",
      "amtsgericht": "Amtsgericht Köln",
      "registernummer": "HRA 37980",
      "registerart": "HRA",
      "company_name": "Marco Andrys e.K.",
      "company_seat": "Kerpen",
      "details": "12.08.2025 (Bekanntmachungsdatum)\n\nNordrhein-Westfalen Amtsgericht Köln HRA 37980\nRegisterbekanntmachung nach dem Umwandlungsgesetz 12.08.2025 (Eintragungsdatum)\n\nMarco Andrys e.K.\nEinzelkaufmann / Einzelkauffrau\nKerpen\n\nDen Gläubigern der an der Ausgliederung beteiligten Rechtsträger ist, wenn sie binnen sechs Monaten nach dem Tag, an dem die Eintragung der Ausgliederung in das Register des Sitzes desjenigen Rechtsträgers, dessen Gläubiger sie sind, nach § 19 Absatz 3 UmwG als bekanntgemacht gilt, ihren Anspruch nach Grund und Höhe schriftlich anmelden, Sicherheit zu leisten, soweit sie nicht Befriedigung verlangen können. Dieses Recht steht den Gläubigern jedoch nur zu, wenn sie glaubhaft machen, dass durch die Ausgliederung die Erfüllung ihrer Forderung gefährdet wird."
    },
    {
      "date": "2025-08-12",
      "id": "120665",
      "original_text": "Registerbekanntmachung nach dem Umwandlungsgesetz\nNordrhein-Westfalen Amtsgericht Arnsberg HRB 15918\nKRAMER & STROBEL Eventmanagement GmbH – Arnsberg",
      "type": "Registerbekanntmachung nach dem Umwandlungsgesetz",
      "state": "Nordrhein-Westfalen",
      "amtsgericht": "Amtsgericht Arnsberg",
      "registernummer": "HRB 15918",
      "registerart": "HRB",
      "company_name": "KRAMER & STROBEL Eventmanagement GmbH",
      "company_seat": "Arnsberg",
      "details": "12.08.2025 (Bekanntmachungsdatum)\n\nNordrhein-Westfalen Amtsgericht Arnsberg HRB 15918\nRegisterbekanntmachung nach dem Umwandlungsgesetz 12.08.2025 (Eintragungsdatum)\n\nKRAMER & STROBEL Eventmanagement GmbH\nGesellschaft mit beschränkter Haftung\nArnsberg\n\nDen Gläubigern der an der Ausgliederung beteiligten Rechtsträger ist, wenn sie binnen sechs Monaten nach dem Tag, an dem die Eintragung der Ausgliederung in das Register des Sitzes desjenigen Rechtsträgers, dessen Gläubiger sie sind, nach § 19 Absatz 3 UmwG als bekanntgemacht gilt, ihren Anspruch nach Grund und Höhe schriftlich anmelden, Sicherheit zu leisten, soweit sie nicht Befriedigung verlangen können. Dieses Recht steht den Gläubigern jedoch nur zu, wenn sie glaubhaft machen, dass durch die Ausgliederung die Erfüllung ihrer Forderung gefährdet wird."
    },
    {
      "date": "2025-08-12",
      "id": "120666",
      "original_text": "Registerbekanntmachung nach dem Umwandlungsgesetz\nNordrhein-Westfalen Amtsgericht Köln HRB 86384\nAxians IT Service GmbH – Köln",
      "type": "Registerbekanntmachung nach dem Umwandlungsgesetz",
      "state": "Nordrhein-Westfalen",
      "amtsgericht": "Amtsgericht Köln",
      "registernummer": "HRB 86384",
      "registerart": "HRB",
      "company_name": "Axians IT Service GmbH",
      "company_seat": "Köln",
      "details": "12.08.2025 (Bekanntmachungsdatum)\n\nNordrhein-Westfalen Amtsgericht Köln HRB 86384\nRegisterbekanntmachung nach dem Umwandlungsgesetz 12.08.2025 (Eintragungsdatum)\n\nAxians IT Service GmbH\nGesellschaft mit beschränkter Haftung\nKöln\n\nDen Gläubigern der an der Verschmelzung beteiligten Rechtsträger ist, wenn sie binnen sechs Monaten nach dem Tag, an dem die Eintragung der Verschmelzung in das Register des Sitzes desjenigen Rechtsträgers, dessen Gläubiger sie sind, nach § 19 Absatz 3 UmwG als bekanntgemacht gilt, ihren Anspruch nach Grund und Höhe schriftlich anmelden, Sicherheit zu leisten, soweit sie nicht Befriedigung verlangen können. Dieses Recht steht den Gläubigern jedoch nur zu, wenn sie glaubhaft machen, dass durch die Verschmelzung die Erfüllung ihrer Forderung gefährdet wird."
    },
    {
      "date": "2025-08-12",
      "id": "120667",
      "original_text": "Löschungsankündigung\nNordrhein-Westfalen Amtsgericht Mönchengladbach HRB 12856\nKANES GmbH – Mönchengladbach",
      "type": "Löschungsankündigung",
      "state": "Nordrhein-Westfalen",
      "amtsgericht": "Amtsgericht Mönchengladbach",
      "registernummer": "HRB 12856",
      "registerart": "HRB",
      "company_name": "KANES GmbH",
      "company_seat": "Mönchengladbach",
      "details": "12.08.2025 (Bekanntmachungsdatum)\n\nNordrhein-Westfalen Amtsgericht Mönchengladbach HRB 12856\nLöschungsankündigung 12.08.2025 (Eintragungsdatum)\n\nKANES GmbH\nGesellschaft mit beschränkter Haftung\nMönchengladbach\n\nDas Registergericht beabsichtigt die Gesellschaft von Amts wegen nach § 394 FamFG zu löschen. Die Frist zur Erhebung eines Widerspruchs ist auf drei Monate festgesetzt."
    },
    {
      "date": "2025-08-12",
      "id": "120668",
      "original_text": "Registerbekanntmachung nach dem Umwandlungsgesetz\nNordrhein-Westfalen Amtsgericht Köln HRB 46511\nBARIS ELEKTRONIK GMBH – Kürten",
      "type": "Registerbekanntmachung nach dem Umwandlungsgesetz",
      "state": "Nordrhein-Westfalen",
      "amtsgericht": "Amtsgericht Köln",
      "registernummer": "HRB 46511",
      "registerart": "HRB",
      "company_name": "BARIS ELEKTRONIK GMBH",
      "company_seat": "Kürten",
      "details": "12.08.2025 (Bekanntmachungsdatum)\n\nNordrhein-Westfalen Amtsgericht Köln HRB 46511\nRegisterbekanntmachung nach dem Umwandlungsgesetz 12.08.2025 (Eintragungsdatum)\n\nBARIS ELEKTRONIK GMBH\nGesellschaft mit beschränkter Haftung\nKürten\n\nDen Gläubigern der an der Verschmelzung beteiligten Rechtsträger ist, wenn sie binnen sechs Monaten nach dem Tag, an dem die Eintragung der Verschmelzung in das Register des Sitzes desjenigen Rechtsträgers, dessen Gläubiger sie sind, nach § 19 Absatz 3 UmwG als bekanntgemacht gilt, ihren Anspruch nach Grund und Höhe schriftlich anmelden, Sicherheit zu leisten, soweit sie nicht Befriedigung verlangen können. Dieses Recht steht den Gläubigern jedoch nur zu, wenn sie glaubhaft machen, dass durch die Verschmelzung die Erfüllung ihrer Forderung gefährdet wird."
    },
    {
      "date": "2025-08-12",
      "id": "120669",
      "original_text": "Löschungsankündigung\nNordrhein-Westfalen Amtsgericht Gelsenkirchen VR 1646\nGalatasaray Sport & Fanclub Gelsenkirchen e.V. – Gelsenkirchen",
      "type": "Löschungsankündigung",
      "state": "Nordrhein-Westfalen",
      "amtsgericht": "Amtsgericht Gelsenkirchen",
      "registernummer": "VR 1646",
      "registerart": "VR",
      "company_name": "Galatasaray Sport & Fanclub Gelsenkirchen e.V.",
      "company_seat": "Gelsenkirchen",
      "details": "12.08.2025 (Bekanntmachungsdatum)\n\nNordrhein-Westfalen Amtsgericht Gelsenkirchen VR 1646\nLöschungsankündigung\n\nGalatasaray Sport & Fanclub Gelsenkirchen e.V.\neingetragener Verein\nGelsenkirchen\n\nDas Registergericht beabsichtigt, den im Vereinsregister eingetragenen Verein gemäß § 395 FamFG von Amts wegen zu löschen.\n\nGegen diese Verfügung kann Widerspruch eingelegt werden. Die Frist zur Erhebung eines Widerspruchs gegen die beabsichtigte Löschung von Amts wegen ist auf einen Monat festgesetzt.\n\nRechtsbehelfsbelehrung:\n\nGegen diese Verfügung können Sie Widerspruch einlegen.\n\nDer Widerspruch ist bei dem Amtsgericht Gelsenkirchen, Bochumer Straße 79, 45886 Gelsenkirchen schriftlich in deutscher Sprache oder zur Niederschrift der Geschäftsstelle einzulegen. Der Widerspruch kann auch zur Niederschrift der Geschäftsstelle eines jeden Amtsgerichtes abgegeben werden.\n\nDer Widerspruch muss spätestens innerhalb der gesetzten Frist bei dem Amtsgericht Gelsenkirchen eingegangen sein. Dies gilt auch dann, wenn der Widerspruch zur Niederschrift der Geschäftsstelle eines anderen Amtsgerichtes abgegeben wurde. Die Frist beginnt mit der Veröffentlichung. Fällt das Ende der Frist auf einen Sonntag, einen allgemeinen Feiertag oder Sonnabend, so endet die Frist mit Ablauf des nächsten Werktages.\n\nDer Widerspruch muss die Bezeichnung der angefochtenen Verfügung sowie die Erklärung enthalten, dass Widerspruch gegen diese Verfügung eingelegt wird. Er ist zu unterzeichnen und soll begründet werden.\n\nHinweis zum elektronischen Rechtsverkehr:\nDie Einlegung ist auch durch Übertragung eines elektronischen Dokuments an die elektronische Poststelle des Gerichts möglich. Das elektronische Dokument muss für die Bearbeitung durch das Gericht geeignet und mit einer qualifizierten elektronischen Signatur der verantwortenden Person versehen sein oder von der verantwortenden Person signiert und auf einem sicheren Übermittlungsweg gemäß § 130a ZPO nach näherer Maßgabe der Verordnung über die technischen Rahmenbedingungen des elektronischen Rechtsverkehrs und über das besondere elektronische Behördenpostfach (BGBl. 2017 I, S. 3803) eingereicht werden. Auf die Pflicht zur elektronischen Einreichung durch professionelle Einreicher/innen ab dem 01.01.2022 durch das Gesetz zum Ausbau des elektronischen Rechtsverkehrs mit den Gerichten vom 10. Oktober 2013, das Gesetz zur Einführung der elektronischen Akte in der Justiz und zur weiteren Förderung des elektronischen Rechtsverkehrs vom 5. Juli 2017 und das Gesetz zum Ausbau des elektronischen Rechtsverkehrs mit den Gerichten und zur Änderung weiterer Vorschriften vom 05.10.2021 wird hingewiesen.\nWeitere Informationen erhalten Sie auf der Internetseite www.justiz.de."
    },
    {
      "date": "2025-08-12",
      "id": "120670",
      "original_text": "Löschungsankündigung\nNordrhein-Westfalen Amtsgericht Dortmund HRB 34585\nPromotion Profi Unternehmergesellschaft (haftungsbeschränkt) – Dortmund",
      "type": "Löschungsankündigung",
      "state": "Nordrhein-Westfalen",
      "amtsgericht": "Amtsgericht Dortmund",
      "registernummer": "HRB 34585",
      "registerart": "HRB",
      "company_name": "Promotion Profi Unternehmergesellschaft (haftungsbeschränkt)",
      "company_seat": "Dortmund",
      "details": "12.08.2025 (Bekanntmachungsdatum)\n\nNordrhein-Westfalen Amtsgericht Dortmund HRB 34585\nLöschungsankündigung\n\nPromotion Profi Unternehmergesellschaft (haftungsbeschränkt)\nGesellschaft mit beschränkter Haftung\nDortmund\n\nDas Registergericht beabsichtigt die Gesellschaft von Amts wegen nach § 394 FamFG zu löschen. Die Frist zur Erhebung eines Widerspruchs ist auf zwei Monate festgesetzt."
    },
    {
      "date": "2025-08-12",
      "id": "120671",
      "original_text": "Einreichung neuer Dokumente\nNordrhein-Westfalen Amtsgericht Köln HRB 7864\nDEVK Deutsche Eisenbahn Versicherung Lebensversicherungsverein a.G. Betriebliche Sozialeinrichtung der Deutschen Bahn – Köln",
      "type": "Einreichung neuer Dokumente",
      "state": "Nordrhein-Westfalen",
      "amtsgericht": "Amtsgericht Köln",
      "registernummer": "HRB 7864",
      "registerart": "HRB",
      "company_name": "DEVK Deutsche Eisenbahn Versicherung Lebensversicherungsverein a.G. Betriebliche Sozialeinrichtung der Deutschen Bahn",
      "company_seat": "Köln",
      "details": "12.08.2025 (Bekanntmachungsdatum)\n\nNordrhein-Westfalen Amtsgericht Köln HRB 7864\nEinreichung neuer Dokumente\n\nDEVK Deutsche Eisenbahn Versicherung Lebensversicherungsverein a.G. Betriebliche Sozialeinrichtung der Deutschen Bahn\nVersicherungsverein auf Gegenseitigkeit\nKöln\n\nDem Registergericht ist eine neue Liste der Mitglieder des Aufsichtsrates eingereicht worden."
    },
    {
      "date": "2025-08-12",
      "id": "120672",
      "original_text": "Registerbekanntmachung nach dem Umwandlungsgesetz\nNordrhein-Westfalen Amtsgericht Hagen HRB 4206\nUwe Beuth Transporte GmbH – Hagen",
      "type": "Registerbekanntmachung nach dem Umwandlungsgesetz",
      "state": "Nordrhein-Westfalen",
      "amtsgericht": "Amtsgericht Hagen",
      "registernummer": "HRB 4206",
      "registerart": "HRB",
      "company_name": "Uwe Beuth Transporte GmbH",
      "company_seat": "Hagen",
      "details": "12.08.2025 (Bekanntmachungsdatum)\n\nNordrhein-Westfalen Amtsgericht Hagen HRB 4206\nRegisterbekanntmachung nach dem Umwandlungsgesetz 11.08.2025 (Eintragungsdatum)\n\nUwe Beuth Transporte GmbH\nGesellschaft mit beschränkter Haftung\nHagen\n\nDen Gläubigern der an der Verschmelzung beteiligten Rechtsträger ist, wenn sie binnen sechs Monaten nach dem Tag, an dem die Eintragung der Verschmelzung in das Register des Sitzes desjenigen Rechtsträgers, dessen Gläubiger sie sind, nach § 19 Absatz 3 UmwG als bekanntgemacht gilt, ihren Anspruch nach Grund und Höhe schriftlich anmelden, Sicherheit zu leisten, soweit sie nicht Befriedigung verlangen können. Dieses Recht steht den Gläubigern jedoch nur zu, wenn sie glaubhaft machen, dass durch die Verschmelzung die Erfüllung ihrer Forderung gefährdet wird."
    },
    {
      "date": "2025-08-12",
      "id": "120673",
      "original_text": "Löschungsankündigung\nNordrhein-Westfalen Amtsgericht Wuppertal HRB 29386\nVizo Bau GmbH – Wuppertal",
      "type": "Löschungsankündigung",
      "state": "Nordrhein-Westfalen",
      "amtsgericht": "Amtsgericht Wuppertal",
      "registernummer": "HRB 29386",
      "registerart": "HRB",
      "company_name": "Vizo Bau GmbH",
      "company_seat": "Wuppertal",
      "details": "12.08.2025 (Bekanntmachungsdatum)\n\nNordrhein-Westfalen Amtsgericht Wuppertal HRB 29386\nLöschungsankündigung\n\nVizo Bau GmbH\nGesellschaft mit beschränkter Haftung\nWuppertal\n\nDas Registergericht beabsichtigt die Gesellschaft von Amts wegen nach § 394 FamFG zu löschen. Die Frist zur Erhebung eines Widerspruchs ist auf einen Monat festgesetzt."
    },
    {
      "date": "2025-08-12",
      "id": "120674",
      "original_text": "Registerbekanntmachung nach dem Umwandlungsgesetz\nNordrhein-Westfalen Amtsgericht Essen HRB 21691\nAdacor Hosting GmbH – Essen",
      "type": "Registerbekanntmachung nach dem Umwandlungsgesetz",
      "state": "Nordrhein-Westfalen",
      "amtsgericht": "Amtsgericht Essen",
      "registernummer": "HRB 21691",
      "registerart": "HRB",
      "company_name": "Adacor Hosting GmbH",
      "company_seat": "Essen",
      "details": "12.08.2025 (Bekanntmachungsdatum)\n\nNordrhein-Westfalen Amtsgericht Essen HRB 21691\nRegisterbekanntmachung nach dem Umwandlungsgesetz 08.08.2025 (Eintragungsdatum)\n\nAdacor Hosting GmbH\nGesellschaft mit beschränkter Haftung\nEssen\n\nDen Gläubigern der an der Verschmelzung beteiligten Rechtsträger ist, wenn sie binnen sechs Monaten nach dem Tag, an dem die Eintragung der Verschmelzung in das Register des Sitzes desjenigen Rechtsträgers, dessen Gläubiger sie sind, nach § 19 Absatz 3 UmwG als bekanntgemacht gilt, ihren Anspruch nach Grund und Höhe schriftlich anmelden, Sicherheit zu leisten, soweit sie nicht Befriedigung verlangen können. Dieses Recht steht den Gläubigern jedoch nur zu, wenn sie glaubhaft machen, dass durch die Verschmelzung die Erfüllung ihrer Forderung gefährdet wird."
    },
    {
      "date": "2025-08-12",
      "id": "120675",
      "original_text": "Löschungsankündigung\nNordrhein-Westfalen Amtsgericht Duisburg HRA 12260\nReal Concept - Projekt Flingerstraße - GmbH & Co. KG – Duisburg",
      "type": "Löschungsankündigung",
      "state": "Nordrhein-Westfalen",
      "amtsgericht": "Amtsgericht Duisburg",
      "registernummer": "HRA 12260",
      "registerart": "HRA",
      "company_name": "Real Concept - Projekt Flingerstraße - GmbH & Co. KG",
      "company_seat": "Duisburg",
      "details": "12.08.2025 (Bekanntmachungsdatum)\n\nNordrhein-Westfalen Amtsgericht Duisburg HRA 12260\nLöschungsankündigung\n\nReal Concept - Projekt Flingerstraße - GmbH & Co. KG\nKommanditgesellschaft\nDuisburg\n\nHRA 12260, Real Concept - Projekt Flingerstraße - GmbH & Co. KG, soll von Amts wegen gemäß §§ 31 Abs. 2 HGB, 393 FamFG gelöscht werden.\nDie Frist zur Erhebung eines Widerspruchs gegen die beabsichtigte Löschung von Amts wegen ist auf drei Monate festgesetzt.\n\nRechtsbehelfsbelehrung\nGegen diese Verfügung können Sie Widerspruch einlegen.\nDer Widerspruch ist bei dem Amtsgericht -Registergericht- Duisburg, Kardinal-Galen-Str. 124-132, 47058 Duisburg, schriftlich in deutscher Sprache oder zur Niederschrift der Geschäftsstelle einzulegen. Der Widerspruch kann auch zur Niederschrift der Geschäftsstelle eines jeden Amtsgerichtes abgegeben werden.\n\nDer Widerspruch muss spätestens innerhalb der gesetzten Frist nach der schriftlichen Bekanntgabe der Verfügung bei dem Amtsgericht Duisburg eingegangen sein. Dies gilt auch dann, wenn der Widerspruch zur Niederschrift der Geschäftsstelle eines anderen Amtsgerichtes abgegeben wurde. Die Frist beginnt mit der schriftlichen Bekanntgabe der Verfügung.\n\nDer Widerspruch muss die Bezeichnung der angefochtenen Verfügung sowie die Erklärung enthalten, dass Widerspruch gegen diese Verfügung eingelegt wird. Er ist zu unterzeichnen und soll begründet werden.\n\nDie Einlegung ist auch durch Übertragung eines elektronischen Dokuments an die elektronische Poststelle des Gerichts möglich. Das elektronische Dokument muss für die Bearbeitung durch das Gericht geeignet und mit einer qualifizierten elektronischen Signatur der verantwortenden Person versehen sein oder von der verantwortenden Person signiert und auf einem sicheren Übermittlungsweg gemäß § 130 a ZPO nach näherer Maßgabe der Verordnung über die technischen Rahmenbedingungen des elektronischen Rechtsverkehrs und über das besondere elektronische Behördenpostfach (BGBl. 2017 I, S. 3803) eingereicht werden. Weitere Informationen erhalten Sie auf der Internetseite www.justiz.de."
    },
    {
      "date": "2025-08-12",
      "id": "120676",
      "original_text": "Registerbekanntmachung nach dem Umwandlungsgesetz\nNordrhein-Westfalen Amtsgericht Hagen HRA 6584\nUwe Beuth Vermietungen e.K. – Hagen",
      "type": "Registerbekanntmachung nach dem Umwandlungsgesetz",
      "state": "Nordrhein-Westfalen",
      "amtsgericht": "Amtsgericht Hagen",
      "registernummer": "HRA 6584",
      "registerart": "HRA",
      "company_name": "Uwe Beuth Vermietungen e.K.",
      "company_seat": "Hagen",
      "details": "12.08.2025 (Bekanntmachungsdatum)\n\nNordrhein-Westfalen Amtsgericht Hagen HRA 6584\nRegisterbekanntmachung nach dem Umwandlungsgesetz 12.08.2025 (Eintragungsdatum)\n\nUwe Beuth Vermietungen e.K.\nEinzelkaufmann / Einzelkauffrau\nHagen\n\nDen Gläubigern der an der Verschmelzung beteiligten Rechtsträger ist, wenn sie binnen sechs Monaten nach dem Tag, an dem die Eintragung der Verschmelzung in das Register des Sitzes derjenigen Rechtsträger deren Gläubiger sie sind, nach § 19 Absatz 3 UmwG als bekanntgemacht gilt, ihren Anspruch nach Grund und Höhe schriftlich anmelden, Sicherheit zu leisten, soweit sie nicht Befriedigung verlangen können. Dieses Recht steht den Gläubigern jedoch nur zu, wenn sie glaubhaft machen, dass durch die Verschmelzung die Erfüllung ihrer Forderung gefährdet wird."
    },
    {
      "date": "2025-08-12",
      "id": "120677",
      "original_text": "Registerbekanntmachung nach dem Umwandlungsgesetz\nNordrhein-Westfalen Amtsgericht Köln HRA 27775\nArt-Invest Real Estate GmbH & Co KG – Köln",
      "type": "Registerbekanntmachung nach dem Umwandlungsgesetz",
      "state": "Nordrhein-Westfalen",
      "amtsgericht": "Amtsgericht Köln",
      "registernummer": "HRA 27775",
      "registerart": "HRA",
      "company_name": "Art-Invest Real Estate GmbH & Co KG",
      "company_seat": "Köln",
      "details": "12.08.2025 (Bekanntmachungsdatum)\n\nNordrhein-Westfalen Amtsgericht Köln HRA 27775\nRegisterbekanntmachung nach dem Umwandlungsgesetz 12.08.2025 (Eintragungsdatum)\n\nArt-Invest Real Estate GmbH & Co KG\nKommanditgesellschaft\nKöln\n\nDen Gläubigern der an der Verschmelzung beteiligten Rechtsträger ist, wenn sie binnen sechs Monaten nach dem Tag, an dem die Eintragung der Verschmelzung in das Register des Sitzes desjenigen Rechtsträgers, dessen Gläubiger sie sind, nach § 19 Absatz 3 UmwG als bekanntgemacht gilt, ihren Anspruch nach Grund und Höhe schriftlich anmelden, Sicherheit zu leisten, soweit sie nicht Befriedigung verlangen können. Dieses Recht steht den Gläubigern jedoch nur zu, wenn sie glaubhaft machen, dass durch die Verschmelzung die Erfüllung ihrer Forderung gefährdet wird."
    },
    {
      "date": "2025-08-12",
      "id": "120678",
      "original_text": "Registerbekanntmachung nach dem Umwandlungsgesetz\nNordrhein-Westfalen Amtsgericht Münster HRB 22736\nHOLZ WERKSTATT DESIGN Martin Bantle GmbH – Münster",
      "type": "Registerbekanntmachung nach dem Umwandlungsgesetz",
      "state": "Nordrhein-Westfalen",
      "amtsgericht": "Amtsgericht Münster",
      "registernummer": "HRB 22736",
      "registerart": "HRB",
      "company_name": "HOLZ WERKSTATT DESIGN Martin Bantle GmbH",
      "company_seat": "Münster",
      "details": "12.08.2025 (Bekanntmachungsdatum)\n\nNordrhein-Westfalen Amtsgericht Münster HRB 22736\nRegisterbekanntmachung nach dem Umwandlungsgesetz 12.08.2025 (Eintragungsdatum)\n\nHOLZ WERKSTATT DESIGN Martin Bantle GmbH\nGesellschaft mit beschränkter Haftung\nMünster\n\nDen Gläubigern der an der Ausgliederung beteiligten Rechtsträger ist, wenn sie binnen sechs Monaten nach dem Tag, an dem die Eintragung der Ausgliederung in das Register des Sitzes desjenigen Rechtsträgers, dessen Gläubiger sie sind, nach § 19 Absatz 3 UmwG als bekanntgemacht gilt, ihren Anspruch nach Grund und Höhe schriftlich anmelden, Sicherheit zu leisten, soweit sie nicht Befriedigung verlangen können. Dieses Recht steht den Gläubigern jedoch nur zu, wenn sie glaubhaft machen, dass durch die Ausgliederung die Erfüllung ihrer Forderung gefährdet wird."
    },
    {
      "date": "2025-08-12",
      "id": "120679",
      "original_text": "Löschungsankündigung\nNordrhein-Westfalen Amtsgericht Dortmund HRB 23202\nCasino-Balve-GmbH – Dortmund",
      "type": "Löschungsankündigung",
      "state": "Nordrhein-Westfalen",
      "amtsgericht": "Amtsgericht Dortmund",
      "registernummer": "HRB 23202",
      "registerart": "HRB",
      "company_name": "Casino-Balve-GmbH",
      "company_seat": "Dortmund",
      "details": "12.08.2025 (Bekanntmachungsdatum)\n\nNordrhein-Westfalen Amtsgericht Dortmund HRB 23202\nLöschungsankündigung 12.08.2025 (Eintragungsdatum)\n\nCasino-Balve-GmbH\nGesellschaft mit beschränkter Haftung\nDortmund\n\nDas Registergericht beabsichtigt die Gesellschaft von Amts wegen nach § 394 FamFG zu löschen. Die Frist zur Erhebung eines Widerspruchs ist auf zwei Monate festgesetzt."
    },
    {
      "date": "2025-08-12",
      "id": "120680",
      "original_text": "Registerbekanntmachung nach dem Umwandlungsgesetz\nNordrhein-Westfalen Amtsgericht Köln HRB 100314\nISC Holding GmbH – Köln",
      "type": "Registerbekanntmachung nach dem Umwandlungsgesetz",
      "state": "Nordrhein-Westfalen",
      "amtsgericht": "Amtsgericht Köln",
      "registernummer": "HRB 100314",
      "registerart": "HRB",
      "company_name": "ISC Holding GmbH",
      "company_seat": "Köln",
      "details": "12.08.2025 (Bekanntmachungsdatum)\n\nNordrhein-Westfalen Amtsgericht Köln HRB 100314\nRegisterbekanntmachung nach dem Umwandlungsgesetz 12.08.2025 (Eintragungsdatum)\n\nISC Holding GmbH\nGesellschaft mit beschränkter Haftung\nKöln\n\nDen Gläubigern der an der Verschmelzung beteiligten Rechtsträger ist, wenn sie binnen sechs Monaten nach dem Tag, an dem die Eintragung der Verschmelzung in das Register des Sitzes desjenigen Rechtsträgers, dessen Gläubiger sie sind, nach § 19 Absatz 3 UmwG als bekanntgemacht gilt, ihren Anspruch nach Grund und Höhe schriftlich anmelden, Sicherheit zu leisten, soweit sie nicht Befriedigung verlangen können. Dieses Recht steht den Gläubigern jedoch nur zu, wenn sie glaubhaft machen, dass durch die Verschmelzung die Erfüllung ihrer Forderung gefährdet wird."
    },
    {
      "date": "2025-08-12",
      "id": "120681",
      "original_text": "Löschungsankündigung\nNordrhein-Westfalen Amtsgericht Essen HRB 33607\nHaus am See Essen GmbH – Essen",
      "type": "Löschungsankündigung",
      "state": "Nordrhein-Westfalen",
      "amtsgericht": "Amtsgericht Essen",
      "registernummer": "HRB 33607",
      "registerart": "HRB",
      "company_name": "Haus am See Essen GmbH",
      "company_seat": "Essen",
      "details": "12.08.2025 (Bekanntmachungsdatum)\n\nNordrhein-Westfalen Amtsgericht Essen HRB 33607\nLöschungsankündigung 12.08.2025 (Eintragungsdatum)\n\nHaus am See Essen GmbH\nGesellschaft mit beschränkter Haftung\nEssen\n\nDas Registergericht beabsichtigt die Gesellschaft von Amts wegen nach § 394 FamFG zu löschen. Die Frist zur Erhebung eines Widerspruchs ist auf einen Monat festgesetzt."
    },
    {
      "date": "2025-08-12",
      "id": "120682",
      "original_text": "Registerbekanntmachung nach dem Umwandlungsgesetz\nNordrhein-Westfalen Amtsgericht Essen HRB 25283\nBoehler Immobilien GmbH – Essen",
      "type": "Registerbekanntmachung nach dem Umwandlungsgesetz",
      "state": "Nordrhein-Westfalen",
      "amtsgericht": "Amtsgericht Essen",
      "registernummer": "HRB 25283",
      "registerart": "HRB",
      "company_name": "Boehler Immobilien GmbH",
      "company_seat": "Essen",
      "details": "12.08.2025 (Bekanntmachungsdatum)\n\nNordrhein-Westfalen Amtsgericht Essen HRB 25283\nRegisterbekanntmachung nach dem Umwandlungsgesetz 07.08.2025 (Eintragungsdatum)\n\nBoehler Immobilien GmbH\nGesellschaft mit beschränkter Haftung\nEssen\n\nDen Gläubigern der an der Verschmelzung beteiligten Rechtsträger ist, wenn sie binnen sechs Monaten nach dem Tag, an dem die Eintragung der Verschmelzung in das Register des Sitzes desjenigen Rechtsträgers, dessen Gläubiger sie sind, nach § 19 Absatz 3 UmwG als bekanntgemacht gilt, ihren Anspruch nach Grund und Höhe schriftlich anmelden, Sicherheit zu leisten, soweit sie nicht Befriedigung verlangen können. Dieses Recht steht den Gläubigern jedoch nur zu, wenn sie glaubhaft machen, dass durch die Verschmelzung die Erfüllung ihrer Forderung gefährdet wird."
    },
    {
      "date": "2025-08-12",
      "id": "120683",
      "original_text": "Registerbekanntmachung nach dem Umwandlungsgesetz\nNordrhein-Westfalen Amtsgericht Essen HRB 35767\nPauline Weinwerk GmbH – Essen",
      "type": "Registerbekanntmachung nach dem Umwandlungsgesetz",
      "state": "Nordrhein-Westfalen",
      "amtsgericht": "Amtsgericht Essen",
      "registernummer": "HRB 35767",
      "registerart": "HRB",
      "company_name": "Pauline Weinwerk GmbH",
      "company_seat": "Essen",
      "details": "12.08.2025 (Bekanntmachungsdatum)\n\nNordrhein-Westfalen Amtsgericht Essen HRB 35767\nRegisterbekanntmachung nach dem Umwandlungsgesetz 12.08.2025 (Eintragungsdatum)\n\nPauline Weinwerk GmbH\nGesellschaft mit beschränkter Haftung\nEssen\n\nDen Gläubigern der an der Verschmelzung beteiligten Rechtsträger ist, wenn sie binnen sechs Monaten nach dem Tag, an dem die Eintragung der Verschmelzung in das Register des Sitzes desjenigen Rechtsträgers, dessen Gläubiger sie sind, nach § 19 Absatz 3 UmwG als bekanntgemacht gilt, ihren Anspruch nach Grund und Höhe schriftlich anmelden, Sicherheit zu leisten, soweit sie nicht Befriedigung verlangen können. Dieses Recht steht den Gläubigern jedoch nur zu, wenn sie glaubhaft machen, dass durch die Verschmelzung die Erfüllung ihrer Forderung gefährdet wird."
    },
    {
      "date": "2025-08-12",
      "id": "120684",
      "original_text": "Registerbekanntmachung nach dem Umwandlungsgesetz\nNordrhein-Westfalen Amtsgericht Duisburg GsR 503\nHUKA Sparexpert 24-Nachfolge eGbR – Duisburg",
      "type": "Registerbekanntmachung nach dem Umwandlungsgesetz",
      "state": "Nordrhein-Westfalen",
      "amtsgericht": "Amtsgericht Duisburg",
      "registernummer": "GsR 503",
      "registerart": "GsR",
      "company_name": "HUKA Sparexpert 24-Nachfolge eGbR",
      "company_seat": "Duisburg",
      "details": "12.08.2025 (Bekanntmachungsdatum)\n\nNordrhein-Westfalen Amtsgericht Duisburg GsR 503\nRegisterbekanntmachung nach dem Umwandlungsgesetz 12.08.2025 (Eintragungsdatum)\n\nHUKA Sparexpert 24-Nachfolge eGbR\nGesellschaft bürgerlichen Rechts\nDuisburg\n\nDen Gläubigern der an der formwechselnden Umwandlung beteiligten Rechtsträger ist, wenn sie binnen sechs Monaten nach dem Tag, an dem die Eintragung der formwechselnden Umwandlung in das Register des Sitzes desjenigen Rechtsträgers, dessen Gläubiger sie sind, nach § 19 Absatz 3 UmwG als bekanntgemacht gilt, ihren Anspruch nach Grund und Höhe schriftlich anmelden, Sicherheit zu leisten, soweit sie nicht Befriedigung verlangen können. Dieses Recht steht den Gläubigern jedoch nur zu, wenn sie glaubhaft machen, dass durch die formwechselnden Umwandlung die Erfüllung ihrer Forderung gefährdet wird."
    },
    {
      "date": "2025-08-12",
      "id": "120685",
      "original_text": "Sonstige Registerbekanntmachung\nNordrhein-Westfalen Amtsgericht Köln HRB 105628\nreebate AG – Leverkusen",
      "type": "Sonstige Registerbekanntmachung",
      "state": "Nordrhein-Westfalen",
      "amtsgericht": "Amtsgericht Köln",
      "registernummer": "HRB 105628",
      "registerart": "HRB",
      "company_name": "reebate AG",
      "company_seat": "Leverkusen",
      "details": "12.08.2025 (Bekanntmachungsdatum)\n\nNordrhein-Westfalen Amtsgericht Köln HRB 105628\nSonstige Registerbekanntmachung\n\nreebate AG\nAktiengesellschaft\nLeverkusen\n\nDem Registergericht ist der Entwurf eines Vertrages über die geplante Verschmelzung der Monkey Businezz GmbH mit Sitz in Böhl-Iggelheim (Amtsgericht Ludwigshafen am Rhein, HRB 63690) als übertragende Gesellschaft auf die Gesellschaft als übernehmende Gesellschaft eingereicht worden."
    },
    {
      "date": "2025-08-12",
      "id": "120686",
      "original_text": "Registerbekanntmachung nach dem Umwandlungsgesetz\nNordrhein-Westfalen Amtsgericht Bielefeld HRB 33368\nG. L. Verwaltungs GmbH – Bielefeld",
      "type": "Registerbekanntmachung nach dem Umwandlungsgesetz",
      "state": "Nordrhein-Westfalen",
      "amtsgericht": "Amtsgericht Bielefeld",
      "registernummer": "HRB 33368",
      "registerart": "HRB",
      "company_name": "G. L. Verwaltungs GmbH",
      "company_seat": "Bielefeld",
      "details": "12.08.2025 (Bekanntmachungsdatum)\n\nNordrhein-Westfalen Amtsgericht Bielefeld HRB 33368\nRegisterbekanntmachung nach dem Umwandlungsgesetz 12.08.2025 (Eintragungsdatum)\n\nG. L. Verwaltungs GmbH\nGesellschaft mit beschränkter Haftung\nBielefeld\n\nDen Gläubigern der an der Verschmelzung beteiligten Rechtsträger ist, wenn sie binnen sechs Monaten nach dem Tag, an dem die Eintragung der Verschmelzung in das Register des Sitzes desjenigen Rechtsträgers, dessen Gläubiger sie sind, nach § 19 Absatz 3 UmwG als bekanntgemacht gilt, ihren Anspruch nach Grund und Höhe schriftlich anmelden, Sicherheit zu leisten, soweit sie nicht Befriedigung verlangen können. Dieses Recht steht den Gläubigern jedoch nur zu, wenn sie glaubhaft machen, dass durch die Verschmelzung die Erfüllung ihrer Forderung gefährdet wird."
    },
    {
      "date": "2025-08-12",
      "id": "120687",
      "original_text": "Registerbekanntmachung nach dem Umwandlungsgesetz\nNordrhein-Westfalen Amtsgericht Duisburg HRA 12271\nRhenus Forest Logistics GmbH & Co. KG – Duisburg",
      "type": "Registerbekanntmachung nach dem Umwandlungsgesetz",
      "state": "Nordrhein-Westfalen",
      "amtsgericht": "Amtsgericht Duisburg",
      "registernummer": "HRA 12271",
      "registerart": "HRA",
      "company_name": "Rhenus Forest Logistics GmbH & Co. KG",
      "company_seat": "Duisburg",
      "details": "12.08.2025 (Bekanntmachungsdatum)\n\nNordrhein-Westfalen Amtsgericht Duisburg HRA 12271\nRegisterbekanntmachung nach dem Umwandlungsgesetz 12.08.2025 (Eintragungsdatum)\n\nRhenus Forest Logistics GmbH & Co. KG\nKommanditgesellschaft\nDuisburg\n\nDen Gläubigern der an der Verschmelzung beteiligten Rechtsträger ist, wenn sie binnen sechs Monaten nach dem Tag, an dem die Eintragung der Verschmelzung in das Register des Sitzes desjenigen Rechtsträgers, dessen Gläubiger sie sind, nach § 19 Absatz 3 UmwG als bekanntgemacht gilt, ihren Anspruch nach Grund und Höhe schriftlich anmelden, Sicherheit zu leisten, soweit sie nicht Befriedigung verlangen können. Dieses Recht steht den Gläubigern jedoch nur zu, wenn sie glaubhaft machen, dass durch die Verschmelzung die Erfüllung ihrer Forderung gefährdet wird."
    },
    {
      "date": "2025-08-12",
      "id": "120688",
      "original_text": "Löschungsankündigung\nNordrhein-Westfalen Amtsgericht Köln HRB 104747\nVOLUMINO Bauträger GmbH – Köln",
      "type": "Löschungsankündigung",
      "state": "Nordrhein-Westfalen",
      "amtsgericht": "Amtsgericht Köln",
      "registernummer": "HRB 104747",
      "registerart": "HRB",
      "company_name": "VOLUMINO Bauträger GmbH",
      "company_seat": "Köln",
      "details": "12.08.2025 (Bekanntmachungsdatum)\n\nNordrhein-Westfalen Amtsgericht Köln HRB 104747\nLöschungsankündigung\n\nVOLUMINO Bauträger GmbH\nGesellschaft mit beschränkter Haftung\nKöln\n\nDas Registergericht beabsichtigt, die im Handelsregister eingetragene Gesellschaft gemäß § 394 Absatz 1 FamFG wegen Vermögenslosigkeit von Amts wegen zu löschen. Gegen diese Verfügung kann Widerspruch eingelegt werden. Die Frist zur Erhebung eines Widerspruchs gegen die beabsichtigte Löschung von Amts wegen ist auf einen Monat festgesetzt. Rechtsbehelfsbelehrung: Gegen diese Verfügung können Sie Widerspruch einlegen. Der Widerspruch ist bei dem Amtsgericht Köln, Reichenspergerplatz 1, 50670 Köln schriftlich in deutscher Sprache oder zur Niederschrift der Geschäftsstelle einzulegen. Der Widerspruch kann auch zur Niederschrift der Geschäftsstelle eines jeden Amtsgerichtes abgegeben werden. Die Einlegung ist auch durch Übertragung eines elektronischen Dokuments an die elektronische Poststelle des Gerichts möglich. Das elektronische Dokument muss für die Bearbeitung durch das Gericht geeignet und mit einer qualifizierten elektronischen Signatur der verantwortenden Person versehen sein oder von der verantwortenden Person signiert und auf einem sicheren Übermittlungsweg gemäß § 130a ZPO nach näherer Maßgabe der Verordnung über die technischen Rahmenbedingungen des elektronischen Rechtsverkehrs und über das besondere elektronische Behördenpostfach (BGBl. I, S.3803) eingereicht werden. Weitere Informationen erhalten Sie auf der Internetseite www.justiz.de.Der Widerspruch muss spätestens innerhalb der gesetzten Frist bei dem Amtsgericht Köln eingegangen sein. Dies gilt auch dann, wenn der Widerspruch zur Niederschrift der Geschäftsstelle eines anderen Amtsgerichtes abgegeben wurde. Die Frist beginnt mit der Veröffentlichung. Fällt das Ende der Frist auf einen Sonntag, einen allgemeinen Feiertag oder Sonnabend, so endet die Frist mit Ablauf des nächsten Werktages.\n\nDer Widerspruch muss die Bezeichnung der angefochtenen Verfügung sowie die Erklärung enthalten, dass Widerspruch gegen diese Verfügung eingelegt wird. Er ist zu unterzeichnen und soll begründet werden."
    },
    {
      "date": "2025-08-12",
      "id": "120689",
      "original_text": "Registerbekanntmachung nach dem Umwandlungsgesetz\nNordrhein-Westfalen Amtsgericht Duisburg HRB 37701\nHUKA Sparexpert 24 UG (haftungsbeschränkt) – Duisburg",
      "type": "Registerbekanntmachung nach dem Umwandlungsgesetz",
      "state": "Nordrhein-Westfalen",
      "amtsgericht": "Amtsgericht Duisburg",
      "registernummer": "HRB 37701",
      "registerart": "HRB",
      "company_name": "HUKA Sparexpert 24 UG (haftungsbeschränkt)",
      "company_seat": "Duisburg",
      "details": "12.08.2025 (Bekanntmachungsdatum)\n\nNordrhein-Westfalen Amtsgericht Duisburg HRB 37701\nRegisterbekanntmachung nach dem Umwandlungsgesetz 12.08.2025 (Eintragungsdatum)\n\nHUKA Sparexpert 24 UG (haftungsbeschränkt)\nGesellschaft mit beschränkter Haftung\nDuisburg\n\nDen Gläubigern der an der formwechselnden Umwandlung beteiligten Rechtsträger ist, wenn sie binnen sechs Monaten nach dem Tag, an dem die Eintragung der formwechselnden Umwandlung in das Register des Sitzes desjenigen Rechtsträgers, dessen Gläubiger sie sind, nach § 19 Absatz 3 UmwG als bekanntgemacht gilt, ihren Anspruch nach Grund und Höhe schriftlich anmelden, Sicherheit zu leisten, soweit sie nicht Befriedigung verlangen können. Dieses Recht steht den Gläubigern jedoch nur zu, wenn sie glaubhaft machen, dass durch die formwechselnden Umwandlung die Erfüllung ihrer Forderung gefährdet wird."
    },
    {
      "date": "2025-08-12",
      "id": "120690",
      "original_text": "Registerbekanntmachung nach dem Umwandlungsgesetz\nNordrhein-Westfalen Amtsgericht Münster HRB 11437\nPianissimo Musik GmbH – Münster",
      "type": "Registerbekanntmachung nach dem Umwandlungsgesetz",
      "state": "Nordrhein-Westfalen",
      "amtsgericht": "Amtsgericht Münster",
      "registernummer": "HRB 11437",
      "registerart": "HRB",
      "company_name": "Pianissimo Musik GmbH",
      "company_seat": "Münster",
      "details": "12.08.2025 (Bekanntmachungsdatum)\n\nNordrhein-Westfalen Amtsgericht Münster HRB 11437\nRegisterbekanntmachung nach dem Umwandlungsgesetz 12.08.2025 (Eintragungsdatum)\n\nPianissimo Musik GmbH\nGesellschaft mit beschränkter Haftung\nMünster\n\nDen Gläubigern der an der Verschmelzung beteiligten Rechtsträger ist, wenn sie binnen sechs Monaten nach dem Tag, an dem die Eintragung der Verschmelzung in das Register des Sitzes desjenigen Rechtsträgers, dessen Gläubiger sie sind, nach § 19 Absatz 3 UmwG als bekanntgemacht gilt, ihren Anspruch nach Grund und Höhe schriftlich anmelden, Sicherheit zu leisten, soweit sie nicht Befriedigung verlangen können. Dieses Recht steht den Gläubigern jedoch nur zu, wenn sie glaubhaft machen, dass durch die Verschmelzung die Erfüllung ihrer Forderung gefährdet wird."
    },
    {
      "date": "2025-08-12",
      "id": "120691",
      "original_text": "Registerbekanntmachung nach dem Umwandlungsgesetz\nNordrhein-Westfalen Amtsgericht Essen HRB 20680\nBITMARCK GmbH – Essen",
      "type": "Registerbekanntmachung nach dem Umwandlungsgesetz",
      "state": "Nordrhein-Westfalen",
      "amtsgericht": "Amtsgericht Essen",
      "registernummer": "HRB 20680",
      "registerart": "HRB",
      "company_name": "BITMARCK GmbH",
      "company_seat": "Essen",
      "details": "12.08.2025 (Bekanntmachungsdatum)\n\nNordrhein-Westfalen Amtsgericht Essen HRB 20680\nRegisterbekanntmachung nach dem Umwandlungsgesetz 04.08.2025 (Eintragungsdatum)\n\nBITMARCK GmbH\nGesellschaft mit beschränkter Haftung\nEssen\n\nDen Gläubigern der an der Verschmelzung beteiligten Rechtsträger ist, wenn sie binnen sechs Monaten nach dem Tag, an dem die Eintragung der Verschmelzung in das Register des Sitzes desjenigen Rechtsträgers, dessen Gläubiger sie sind, nach § 19 Absatz 3 UmwG als bekanntgemacht gilt, ihren Anspruch nach Grund und Höhe schriftlich anmelden, Sicherheit zu leisten, soweit sie nicht Befriedigung verlangen können. Dieses Recht steht den Gläubigern jedoch nur zu, wenn sie glaubhaft machen, dass durch die Verschmelzung die Erfüllung ihrer Forderung gefährdet wird."
    },
    {
      "date": "2025-08-12",
      "id": "120692",
      "original_text": "Registerbekanntmachung nach dem Umwandlungsgesetz\nNordrhein-Westfalen Amtsgericht Düsseldorf HRA 20118\nH + B Immobilien Consulting GmbH & Co. KG – Düsseldorf",
      "type": "Registerbekanntmachung nach dem Umwandlungsgesetz",
      "state": "Nordrhein-Westfalen",
      "amtsgericht": "Amtsgericht Düsseldorf",
      "registernummer": "HRA 20118",
      "registerart": "HRA",
      "company_name": "H + B Immobilien Consulting GmbH & Co. KG",
      "company_seat": "Düsseldorf",
      "details": "12.08.2025 (Bekanntmachungsdatum)\n\nNordrhein-Westfalen Amtsgericht Düsseldorf HRA 20118\nRegisterbekanntmachung nach dem Umwandlungsgesetz 12.08.2025 (Eintragungsdatum)\n\nH + B Immobilien Consulting GmbH & Co. KG\nKommanditgesellschaft\nDüsseldorf\n\nAls nicht eingetragen wird bekanntgemacht: Den Gläubigern der an der Verschmelzung beteiligten Rechtsträger ist, wenn sie binnen sechs Monaten nach dem Tag, an dem die Eintragung der Verschmelzung in das Register des Sitzes desjenigen Rechtsträgers, dessen Gläubiger sie sind, nach § 19 Absatz 3 UmwG als bekanntgemacht gilt, ihren Anspruch nach Grund und Höhe schriftlich anmelden, Sicherheit zu leisten, soweit sie nicht Befriedigung verlangen können. Dieses Recht steht den Gläubigern jedoch nur zu, wenn sie glaubhaft machen, dass durch die Verschmelzung die Erfüllung ihrer Forderung gefährdet wird."
    },
    {
      "date": "2025-08-12",
      "id": "120693",
      "original_text": "Registerbekanntmachung nach dem Umwandlungsgesetz\nNordrhein-Westfalen Amtsgericht Dortmund HRB 31996\nReiseTV24 GmbH – Dortmund",
      "type": "Registerbekanntmachung nach dem Umwandlungsgesetz",
      "state": "Nordrhein-Westfalen",
      "amtsgericht": "Amtsgericht Dortmund",
      "registernummer": "HRB 31996",
      "registerart": "HRB",
      "company_name": "ReiseTV24 GmbH",
      "company_seat": "Dortmund",
      "details": "12.08.2025 (Bekanntmachungsdatum)\n\nNordrhein-Westfalen Amtsgericht Dortmund HRB 31996\nRegisterbekanntmachung nach dem Umwandlungsgesetz 12.08.2025 (Eintragungsdatum)\n\nReiseTV24 GmbH\nGesellschaft mit beschränkter Haftung\nDortmund\n\nDen Gläubigern der an der Verschmelzung beteiligten Rechtsträger ist, wenn sie binnen sechs Monaten nach dem Tag, an dem die Eintragung der Verschmelzung in das Register des Sitzes desjenigen Rechtsträgers, dessen Gläubiger sie sind, nach § 19 Absatz 3 UmwG als bekanntgemacht gilt, ihren Anspruch nach Grund und Höhe schriftlich anmelden, Sicherheit zu leisten, soweit sie nicht Befriedigung verlangen können. Dieses Recht steht den Gläubigern jedoch nur zu, wenn sie glaubhaft machen, dass durch die Verschmelzung die Erfüllung ihrer Forderung gefährdet wird."
    },
    {
      "date": "2025-08-12",
      "id": "120694",
      "original_text": "Einreichung neuer Dokumente\nNordrhein-Westfalen Amtsgericht Köln HRB 8234\nDEVK Deutsche Eisenbahn Versicherung Sach- und HUK-Versicherungsverein a.G. Betriebliche Sozialeinrichtung der Deutschen Bahn – Köln",
      "type": "Einreichung neuer Dokumente",
      "state": "Nordrhein-Westfalen",
      "amtsgericht": "Amtsgericht Köln",
      "registernummer": "HRB 8234",
      "registerart": "HRB",
      "company_name": "DEVK Deutsche Eisenbahn Versicherung Sach- und HUK-Versicherungsverein a.G. Betriebliche Sozialeinrichtung der Deutschen Bahn",
      "company_seat": "Köln",
      "details": "12.08.2025 (Bekanntmachungsdatum)\n\nNordrhein-Westfalen Amtsgericht Köln HRB 8234\nEinreichung neuer Dokumente\n\nDEVK Deutsche Eisenbahn Versicherung Sach- und HUK-Versicherungsverein a.G. Betriebliche Sozialeinrichtung der Deutschen Bahn\nVersicherungsverein auf Gegenseitigkeit\nKöln\n\nDem Registergericht ist eine neue Liste der Mitglieder des Aufsichtsrates eingereicht worden."
    },
    {
      "date": "2025-08-12",
      "id": "120695",
      "original_text": "Registerbekanntmachung nach dem Umwandlungsgesetz\nHessen Amtsgericht Darmstadt HRB 94468\nSAG LVG mbH – Darmstadt",
      "type": "Registerbekanntmachung nach dem Umwandlungsgesetz",
      "state": "Hessen",
      "amtsgericht": "Amtsgericht Darmstadt",
      "registernummer": "HRB 94468",
      "registerart": "HRB",
      "company_name": "SAG LVG mbH",
      "company_seat": "Darmstadt",
      "details": "12.08.2025 (Bekanntmachungsdatum)\n\nHessen Amtsgericht Darmstadt HRB 94468\nRegisterbekanntmachung nach dem Umwandlungsgesetz 12.08.2025 (Eintragungsdatum)\n\nSAG LVG mbH\nGesellschaft mit beschränkter Haftung\nDarmstadt\n\nDen Gläubigern der an der Verschmelzung beteiligten Rechtsträger ist, wenn sie binnen sechs Monaten nach dem Tag, an dem die Eintragung der Verschmelzung in das Register des Sitzes derjenigen Rechtsträger deren Gläubiger sie sind, nach § 19 Absatz 3 UmwG bekannt gemacht worden ist, ihren Anspruch nach Grund und Höhe schriftlich anmelden, Sicherheit zu leisten, soweit sie nicht Befriedigung verlangen können. Dieses Recht steht den Gläubigern jedoch nur zu, wenn sie glaubhaft machen, dass durch die Verschmelzung die Erfüllung ihrer Forderung gefährdet wird."
    },
    {
      "date": "2025-08-12",
      "id": "120696",
      "original_text": "Einreichung neuer Dokumente\nHessen Amtsgericht Offenbach am Main HRB 51609\nViridium Rückversicherung AG – Neu-Isenburg",
      "type": "Einreichung neuer Dokumente",
      "state": "Hessen",
      "amtsgericht": "Amtsgericht Offenbach am Main",
      "registernummer": "HRB 51609",
      "registerart": "HRB",
      "company_name": "Viridium Rückversicherung AG",
      "company_seat": "Neu-Isenburg",
      "details": "12.08.2025 (Bekanntmachungsdatum)\n\nHessen Amtsgericht Offenbach am Main HRB 51609\nEinreichung neuer Dokumente 12.08.2025 (Eintragungsdatum)\n\nViridium Rückversicherung AG\nAktiengesellschaft\nNeu-Isenburg\n\nDurch eine Änderung in den Personen der Aufsichtsratsmitglieder ist eine Liste der Mitglieder des Aufsichtsrates zum Handelsregister eingereicht worden."
    },
    {
      "date": "2025-08-12",
      "id": "120697",
      "original_text": "Registerbekanntmachung nach dem Umwandlungsgesetz\nHessen Amtsgericht Fritzlar HRA 14008\nAutohaus Rietschle Inh. Andreas Rietschle e.K. – Felsberg",
      "type": "Registerbekanntmachung nach dem Umwandlungsgesetz",
      "state": "Hessen",
      "amtsgericht": "Amtsgericht Fritzlar",
      "registernummer": "HRA 14008",
      "registerart": "HRA",
      "company_name": "Autohaus Rietschle Inh. Andreas Rietschle e.K.",
      "company_seat": "Felsberg",
      "details": "12.08.2025 (Bekanntmachungsdatum)\n\nHessen Amtsgericht Fritzlar HRA 14008\nRegisterbekanntmachung nach dem Umwandlungsgesetz 12.08.2025 (Eintragungsdatum)\n\nAutohaus Rietschle Inh. Andreas Rietschle e.K.\nEinzelkaufmann / Einzelkauffrau\nFelsberg\n\nDen Gläubigern der an der Ausgliederung beteiligten Rechtsträger ist, wenn sie binnen sechs Monaten nach dem Tag, an dem die Eintragung der Ausgliederung in das Register des Sitzes derjenigen Rechtsträger deren Gläubiger sie sind, nach §§ 125, 19 Absatz 3 UmwG bekannt gemacht worden ist, ihren Anspruch nach Grund und Höhe schriftlich anmelden, Sicherheit zu leisten, soweit sie nicht Befriedigung verlangen können. Dieses Recht steht den Gläubigern jedoch nur zu, wenn sie glaubhaft machen, dass durch die Ausgliederung die Erfüllung ihrer Forderung gefährdet wird."
    },
    {
      "date": "2025-08-12",
      "id": "120698",
      "original_text": "Löschungsankündigung\nHessen Amtsgericht Darmstadt HRB 88346\nTRANSNATIONAL PRINT UG (haftungsbeschränkt) – Mörfelden-Walldorf",
      "type": "Löschungsankündigung",
      "state": "Hessen",
      "amtsgericht": "Amtsgericht Darmstadt",
      "registernummer": "HRB 88346",
      "registerart": "HRB",
      "company_name": "TRANSNATIONAL PRINT UG (haftungsbeschränkt)",
      "company_seat": "Mörfelden-Walldorf",
      "details": "12.08.2025 (Bekanntmachungsdatum)\n\nHessen Amtsgericht Darmstadt HRB 88346\nLöschungsankündigung 12.08.2025 (Eintragungsdatum)\n\nTRANSNATIONAL PRINT UG (haftungsbeschränkt)\nGesellschaft mit beschränkter Haftung\nMörfelden-Walldorf\n\nDas Registergericht beabsichtigt die im Handelsregister eingetragene Gesellschaft von Amts wegen nach § 394 FamFG zu löschen. Die Frist zur Erhebung eines Widerspruchs gegen die beabsichtigte Löschung wird auf 3 Monate festgesetzt."
    },
    {
      "date": "2025-08-12",
      "id": "120699",
      "original_text": "Registerbekanntmachung nach dem Umwandlungsgesetz\nHessen Amtsgericht Darmstadt HRB 95716\nFNL 1. Grundbesitz GmbH – Bensheim",
      "type": "Registerbekanntmachung nach dem Umwandlungsgesetz",
      "state": "Hessen",
      "amtsgericht": "Amtsgericht Darmstadt",
      "registernummer": "HRB 95716",
      "registerart": "HRB",
      "company_name": "FNL 1. Grundbesitz GmbH",
      "company_seat": "Bensheim",
      "details": "12.08.2025 (Bekanntmachungsdatum)\n\nHessen Amtsgericht Darmstadt HRB 95716\nRegisterbekanntmachung nach dem Umwandlungsgesetz 12.08.2025 (Eintragungsdatum)\n\nFNL 1. Grundbesitz GmbH\nGesellschaft mit beschränkter Haftung\nBensheim\n\nDen Gläubigern der an der Verschmelzung beteiligten Rechtsträger ist, wenn sie binnen sechs Monaten nach dem Tag, an dem die Eintragung der Verschmelzung in das Register des Sitzes derjenigen Rechtsträger deren Gläubiger sie sind, nach § 19 Absatz 3 UmwG bekannt gemacht worden ist, ihren Anspruch nach Grund und Höhe schriftlich anmelden, Sicherheit zu leisten, soweit sie nicht Befriedigung verlangen können. Dieses Recht steht den Gläubigern jedoch nur zu, wenn sie glaubhaft machen, dass durch die Verschmelzung die Erfüllung ihrer Forderung gefährdet wird."
    },
    {
      "date": "2025-08-12",
      "id": "120700",
      "original_text": "Registerbekanntmachung nach dem Umwandlungsgesetz\nHessen Amtsgericht Wiesbaden HRB 29407\nCONCEPTUM Beteiligungsgesellschaft mbH – Wiesbaden",
      "type": "Registerbekanntmachung nach dem Umwandlungsgesetz",
      "state": "Hessen",
      "amtsgericht": "Amtsgericht Wiesbaden",
      "registernummer": "HRB 29407",
      "registerart": "HRB",
      "company_name": "CONCEPTUM Beteiligungsgesellschaft mbH",
      "company_seat": "Wiesbaden",
      "details": "12.08.2025 (Bekanntmachungsdatum)\n\nHessen Amtsgericht Wiesbaden HRB 29407\nRegisterbekanntmachung nach dem Umwandlungsgesetz 12.08.2025 (Eintragungsdatum)\n\nCONCEPTUM Beteiligungsgesellschaft mbH\nGesellschaft mit beschränkter Haftung\nWiesbaden\n\nDen Gläubigern der an der Verschmelzung beteiligten Rechtsträger ist, wenn sie binnen sechs Monaten nach dem Tag, an dem die Eintragung der Verschmelzung in das Register des Sitzes derjenigen Rechtsträger deren Gläubiger sie sind, nach § 19 Absatz 3 UmwG bekannt gemacht worden ist, ihren Anspruch nach Grund und Höhe schriftlich anmelden, Sicherheit zu leisten, soweit sie nicht Befriedigung verlangen können. Dieses Recht steht den Gläubigern jedoch nur zu, wenn sie glaubhaft machen, dass durch die Verschmelzung die Erfüllung ihrer Forderung gefährdet wird."
    },
    {
      "date": "2025-08-12",
      "id": "120701",
      "original_text": "Registerbekanntmachung nach dem Umwandlungsgesetz\nHessen Amtsgericht Frankfurt am Main HRB 121325\nABG Capital Management GmbH – Frankfurt am Main",
      "type": "Registerbekanntmachung nach dem Umwandlungsgesetz",
      "state": "Hessen",
      "amtsgericht": "Amtsgericht Frankfurt am Main",
      "registernummer": "HRB 121325",
      "registerart": "HRB",
      "company_name": "ABG Capital Management GmbH",
      "company_seat": "Frankfurt am Main",
      "details": "12.08.2025 (Bekanntmachungsdatum)\n\nHessen Amtsgericht Frankfurt am Main HRB 121325\nRegisterbekanntmachung nach dem Umwandlungsgesetz 12.08.2025 (Eintragungsdatum)\n\nABG Capital Management GmbH\nGesellschaft mit beschränkter Haftung\nFrankfurt am Main\n\nDen Gläubigern der an der Verschmelzung beteiligten Rechtsträger ist, wenn sie binnen sechs Monaten nach dem Tag, an dem die Eintragung der Verschmelzung in das Register des Sitzes desjenigen Rechtsträgers, dessen Gläubiger sie sind, nach § 19 Absatz 3 UmwG bekannt gemacht worden ist, ihren Anspruch nach Grund und Höhe schriftlich anmelden, Sicherheit zu leisten, soweit sie nicht Befriedigung verlangen können. Dieses Recht steht den Gläubigern jedoch nur zu, wenn sie glaubhaft machen, dass durch die Verschmelzung die Erfüllung ihrer Forderung gefährdet wird."
    },
    {
      "date": "2025-08-12",
      "id": "120702",
      "original_text": "Registerbekanntmachung nach dem Umwandlungsgesetz\nHessen Amtsgericht Frankfurt am Main HRB 119969\nABG Capital GmbH – Frankfurt am Main",
      "type": "Registerbekanntmachung nach dem Umwandlungsgesetz",
      "state": "Hessen",
      "amtsgericht": "Amtsgericht Frankfurt am Main",
      "registernummer": "HRB 119969",
      "registerart": "HRB",
      "company_name": "ABG Capital GmbH",
      "company_seat": "Frankfurt am Main",
      "details": "12.08.2025 (Bekanntmachungsdatum)\n\nHessen Amtsgericht Frankfurt am Main HRB 119969\nRegisterbekanntmachung nach dem Umwandlungsgesetz 12.08.2025 (Eintragungsdatum)\n\nABG Capital GmbH\nGesellschaft mit beschränkter Haftung\nFrankfurt am Main\n\nDen Gläubigern der an der Verschmelzung beteiligten Rechtsträger ist, wenn sie binnen sechs Monaten nach dem Tag, an dem die Eintragung der Verschmelzung in das Register des Sitzes desjenigen Rechtsträgers, dessen Gläubiger sie sind, nach § 19 Absatz 3 UmwG bekannt gemacht worden ist, ihren Anspruch nach Grund und Höhe schriftlich anmelden, Sicherheit zu leisten, soweit sie nicht Befriedigung verlangen können. Dieses Recht steht den Gläubigern jedoch nur zu, wenn sie glaubhaft machen, dass durch die Verschmelzung die Erfüllung ihrer Forderung gefährdet wird."
    },
    {
      "date": "2025-08-12",
      "id": "120703",
      "original_text": "Registerbekanntmachung nach dem Umwandlungsgesetz\nHessen Amtsgericht Bad Homburg v.d.H. HRB 14728\nPharmaplan GmbH – Bad Homburg v. d. Höhe",
      "type": "Registerbekanntmachung nach dem Umwandlungsgesetz",
      "state": "Hessen",
      "amtsgericht": "Amtsgericht Bad Homburg v.d.H.",
      "registernummer": "HRB 14728",
      "registerart": "HRB",
      "company_name": "Pharmaplan GmbH",
      "company_seat": "Bad Homburg v. d. Höhe",
      "details": "12.08.2025 (Bekanntmachungsdatum)\n\nHessen Amtsgericht Bad Homburg v.d.H. HRB 14728\nRegisterbekanntmachung nach dem Umwandlungsgesetz 12.08.2025 (Eintragungsdatum)\n\nPharmaplan GmbH\nGesellschaft mit beschränkter Haftung\nBad Homburg v. d. Höhe\n\nDen Gläubigern der an der Verschmelzung beteiligten Rechtsträger ist, wenn sie binnen sechs Monaten nach dem Tag, an dem die Eintragung der Verschmelzung in das Register des Sitzes desjenigen Rechtsträgers, dessen Gläubiger sie sind, nach § 19 Absatz 3 UmwG bekannt gemacht worden ist, ihren Anspruch nach Grund und Höhe schriftlich anmelden, Sicherheit zu leisten, soweit sie nicht Befriedigung verlangen können. Dieses Recht steht den Gläubigern jedoch nur zu, wenn sie glaubhaft machen, dass durch die Verschmelzung die Erfüllung ihrer Forderung gefährdet wird."
    },
    {
      "date": "2025-08-12",
      "id": "120704",
      "original_text": "Löschungsankündigung\nHessen Amtsgericht Wiesbaden HRB 31353\nAsya Bau GmbH – Wiesbaden",
      "type": "Löschungsankündigung",
      "state": "Hessen",
      "amtsgericht": "Amtsgericht Wiesbaden",
      "registernummer": "HRB 31353",
      "registerart": "HRB",
      "company_name": "Asya Bau GmbH",
      "company_seat": "Wiesbaden",
      "details": "12.08.2025 (Bekanntmachungsdatum)\n\nHessen Amtsgericht Wiesbaden HRB 31353\nLöschungsankündigung\n\nAsya Bau GmbH\nGesellschaft mit beschränkter Haftung\nWiesbaden\n\nDas Registergericht beabsichtigt die im Handelsregister eingetragene Gesellschaft von Amts wegen nach § 394 FamFG zu löschen. Die Frist zur Erhebung eines Widerspruchs gegen die beabsichtigte Löschung wird auf 3 Monate festgesetzt."
    },
    {
      "date": "2025-08-12",
      "id": "120705",
      "original_text": "Löschungsankündigung\nHessen Amtsgericht Offenbach am Main HRB 46299\nPro Invest GmbH – Mühlheim am Main",
      "type": "Löschungsankündigung",
      "state": "Hessen",
      "amtsgericht": "Amtsgericht Offenbach am Main",
      "registernummer": "HRB 46299",
      "registerart": "HRB",
      "company_name": "Pro Invest GmbH",
      "company_seat": "Mühlheim am Main",
      "details": "12.08.2025 (Bekanntmachungsdatum)\n\nHessen Amtsgericht Offenbach am Main HRB 46299\nLöschungsankündigung\n\nPro Invest GmbH\nGesellschaft mit beschränkter Haftung\nMühlheim am Main\n\nDas Registergericht beabsichtigt die im Handelsregister eingetragene Gesellschaft von Amts wegen nach § 394 FamFG zu löschen. Die Frist zur Erhebung eines Widerspruchs gegen die beabsichtigte Löschung wird auf 3 Monate festgesetzt."
    },
    {
      "date": "2025-08-12",
      "id": "120706",
      "original_text": "Registerbekanntmachung nach dem Umwandlungsgesetz\nHessen Amtsgericht Hanau HRA 94382\nEduard Fitterer Heinzungsbau, Sanitär- Klimatechnik, Energieberatung e.K. – Gründau",
      "type": "Registerbekanntmachung nach dem Umwandlungsgesetz",
      "state": "Hessen",
      "amtsgericht": "Amtsgericht Hanau",
      "registernummer": "HRA 94382",
      "registerart": "HRA",
      "company_name": "Eduard Fitterer Heinzungsbau, Sanitär- Klimatechnik, Energieberatung e.K.",
      "company_seat": "Gründau",
      "details": "12.08.2025 (Bekanntmachungsdatum)\n\nHessen Amtsgericht Hanau HRA 94382\nRegisterbekanntmachung nach dem Umwandlungsgesetz 12.08.2025 (Eintragungsdatum)\n\nEduard Fitterer Heinzungsbau, Sanitär- Klimatechnik, Energieberatung e.K.\nEinzelkaufmann / Einzelkauffrau\nGründau\n\nDen Gläubigern der an der Ausgliederung beteiligten Rechtsträger ist, wenn sie binnen sechs Monaten nach dem Tag, an dem die Eintragung der Ausgliederung in das Register des Sitzes desjenigen Rechtsträgers, dessen Gläubiger sie sind, nach § 201 UmwG bekannt gemacht worden ist, ihren Anspruch nach Grund und Höhe schriftlich anmelden, Sicherheit zu leisten, soweit sie nicht Befriedigung verlangen können. Dieses Recht steht den Gläubigern jedoch nur zu, wenn sie glaubhaft machen, dass durch die Ausgliederung die Erfüllung ihrer Forderung gefährdet wird."
    },
    {
      "date": "2025-08-12",
      "id": "120707",
      "original_text": "Registerbekanntmachung nach dem Umwandlungsgesetz\nHessen Amtsgericht Frankfurt am Main HRB 104535\nResidenz-Gruppe Holding GmbH – Frankfurt am Main",
      "type": "Registerbekanntmachung nach dem Umwandlungsgesetz",
      "state": "Hessen",
      "amtsgericht": "Amtsgericht Frankfurt am Main",
      "registernummer": "HRB 104535",
      "registerart": "HRB",
      "company_name": "Residenz-Gruppe Holding GmbH",
      "company_seat": "Frankfurt am Main",
      "details": "12.08.2025 (Bekanntmachungsdatum)\n\nHessen Amtsgericht Frankfurt am Main HRB 104535\nRegisterbekanntmachung nach dem Umwandlungsgesetz 12.08.2025 (Eintragungsdatum)\n\nResidenz-Gruppe Holding GmbH\nGesellschaft mit beschränkter Haftung\nFrankfurt am Main\n\nDen Gläubigern der an der Verschmelzung beteiligten Rechtsträger ist, wenn sie binnen sechs Monaten nach dem Tag, an dem die Eintragung der Verschmelzung in das Register des Sitzes desjenigen Rechtsträgers, dessen Gläubiger sie sind, nach § 19 Absatz 3 UmwG bekannt gemacht worden ist, ihren Anspruch nach Grund und Höhe schriftlich anmelden, Sicherheit zu leisten, soweit sie nicht Befriedigung verlangen können. Dieses Recht steht den Gläubigern jedoch nur zu, wenn sie glaubhaft machen, dass durch die Verschmelzung die Erfüllung ihrer Forderung gefährdet wird."
    },
    {
      "date": "2025-08-12",
      "id": "120708",
      "original_text": "Registerbekanntmachung nach dem Umwandlungsgesetz\nHessen Amtsgericht Wiesbaden HRB 32095\nCONCEPTUM Holding GmbH – Wiesbaden",
      "type": "Registerbekanntmachung nach dem Umwandlungsgesetz",
      "state": "Hessen",
      "amtsgericht": "Amtsgericht Wiesbaden",
      "registernummer": "HRB 32095",
      "registerart": "HRB",
      "company_name": "CONCEPTUM Holding GmbH",
      "company_seat": "Wiesbaden",
      "details": "12.08.2025 (Bekanntmachungsdatum)\n\nHessen Amtsgericht Wiesbaden HRB 32095\nRegisterbekanntmachung nach dem Umwandlungsgesetz 12.08.2025 (Eintragungsdatum)\n\nCONCEPTUM Holding GmbH\nGesellschaft mit beschränkter Haftung\nWiesbaden\n\nDen Gläubigern der an der Verschmelzung beteiligten Rechtsträger ist, wenn sie binnen sechs Monaten nach dem Tag, an dem die Eintragung der Verschmelzung in das Register des Sitzes derjenigen Rechtsträger deren Gläubiger sie sind, nach § 19 Absatz 3 UmwG bekannt gemacht worden ist, ihren Anspruch nach Grund und Höhe schriftlich anmelden, Sicherheit zu leisten, soweit sie nicht Befriedigung verlangen können. Dieses Recht steht den Gläubigern jedoch nur zu, wenn sie glaubhaft machen, dass durch die Verschmelzung die Erfüllung ihrer Forderung gefährdet wird."
    },
    {
      "date": "2025-08-12",
      "id": "120709",
      "original_text": "Löschungsankündigung\nHessen Amtsgericht Frankfurt am Main HRB 95842\nComfort Immobilien- und Verwaltungs GmbH – Frankfurt am Main",
      "type": "Löschungsankündigung",
      "state": "Hessen",
      "amtsgericht": "Amtsgericht Frankfurt am Main",
      "registernummer": "HRB 95842",
      "registerart": "HRB",
      "company_name": "Comfort Immobilien- und Verwaltungs GmbH",
      "company_seat": "Frankfurt am Main",
      "details": "12.08.2025 (Bekanntmachungsdatum)\n\nHessen Amtsgericht Frankfurt am Main HRB 95842\nLöschungsankündigung 12.08.2025 (Eintragungsdatum)\n\nComfort Immobilien- und Verwaltungs GmbH\nGesellschaft mit beschränkter Haftung\nFrankfurt am Main\n\nDas Registergericht beabsichtigt die im Handelsregister eingetragene Gesellschaft von Amts wegen nach § 394 FamFG zu löschen. Die Frist zur Erhebung eines Widerspruchs gegen die beabsichtigte Löschung wird auf 1 Monat festgesetzt."
    },
    {
      "date": "2025-08-12",
      "id": "120710",
      "original_text": "Registerbekanntmachung nach dem Umwandlungsgesetz\nHessen Amtsgericht Fritzlar HRA 16618\nRietschle Automobile GmbH & Co. KG – Felsberg",
      "type": "Registerbekanntmachung nach dem Umwandlungsgesetz",
      "state": "Hessen",
      "amtsgericht": "Amtsgericht Fritzlar",
      "registernummer": "HRA 16618",
      "registerart": "HRA",
      "company_name": "Rietschle Automobile GmbH & Co. KG",
      "company_seat": "Felsberg",
      "details": "12.08.2025 (Bekanntmachungsdatum)\n\nHessen Amtsgericht Fritzlar HRA 16618\nRegisterbekanntmachung nach dem Umwandlungsgesetz 12.08.2025 (Eintragungsdatum)\n\nRietschle Automobile GmbH & Co. KG\nKommanditgesellschaft\nFelsberg\n\nDen Gläubigern der an der Ausgliederung beteiligten Rechtsträger ist, wenn sie binnen sechs Monaten nach dem Tag, an dem die Eintragung der Ausgliederung in das Register des Sitzes derjenigen Rechtsträger deren Gläubiger sie sind, nach §§ 125, 19 Absatz 3 UmwG bekannt gemacht worden ist, ihren Anspruch nach Grund und Höhe schriftlich anmelden, Sicherheit zu leisten, soweit sie nicht Befriedigung verlangen können. Dieses Recht steht den Gläubigern jedoch nur zu, wenn sie glaubhaft machen, dass durch die Ausgliederung die Erfüllung ihrer Forderung gefährdet wird."
    },
    {
      "date": "2025-08-12",
      "id": "120711",
      "original_text": "Löschungsankündigung\nHessen Amtsgericht Frankfurt am Main HRB 98447\nURBANCARS GmbH – Frankfurt am Main",
      "type": "Löschungsankündigung",
      "state": "Hessen",
      "amtsgericht": "Amtsgericht Frankfurt am Main",
      "registernummer": "HRB 98447",
      "registerart": "HRB",
      "company_name": "URBANCARS GmbH",
      "company_seat": "Frankfurt am Main",
      "details": "12.08.2025 (Bekanntmachungsdatum)\n\nHessen Amtsgericht Frankfurt am Main HRB 98447\nLöschungsankündigung 12.08.2025 (Eintragungsdatum)\n\nURBANCARS GmbH\nGesellschaft mit beschränkter Haftung\nFrankfurt am Main\n\nDas Registergericht beabsichtigt die im Handelsregister eingetragene Gesellschaft von Amts wegen nach § 394 FamFG zu löschen. Die Frist zur Erhebung eines Widerspruchs gegen die beabsichtigte Löschung wird auf  Monat festgesetzt."
    },
    {
      "date": "2025-08-12",
      "id": "120712",
      "original_text": "Löschungsankündigung\nHessen Amtsgericht Darmstadt HRB 103386\nCASS GmbH – Mörfelden-Walldorf",
      "type": "Löschungsankündigung",
      "state": "Hessen",
      "amtsgericht": "Amtsgericht Darmstadt",
      "registernummer": "HRB 103386",
      "registerart": "HRB",
      "company_name": "CASS GmbH",
      "company_seat": "Mörfelden-Walldorf",
      "details": "12.08.2025 (Bekanntmachungsdatum)\n\nHessen Amtsgericht Darmstadt HRB 103386\nLöschungsankündigung 12.08.2025 (Eintragungsdatum)\n\nCASS GmbH\nGesellschaft mit beschränkter Haftung\nMörfelden-Walldorf\n\nDas Registergericht beabsichtigt die im Handelsregister eingetragene Gesellschaft von Amts wegen nach § 394 FamFG zu löschen. Die Frist zur Erhebung eines Widerspruchs gegen die beabsichtigte Löschung wird auf 3 Monate festgesetzt."
    },
    {
      "date": "2025-08-12",
      "id": "90",
      "original_text": "Sonderregisterbekanntmachung OHNE Bezug zum elektr. Register\nSachsen-Anhalt Amtsgericht Stendal\nHRB 214654\nLaing Grundstücks- und Bauträger Gesellschaft mbH",
      "type": "Sonderregisterbekanntmachung OHNE Bezug zum elektr. Register",
      "state": "Sachsen-Anhalt",
      "amtsgericht": "Amtsgericht Stendal",
      "company_name": "Laing Grundstücks- und Bauträger Gesellschaft mbH",
      "sonderegister_referenz": "HRB 214654",
      "details": "12.08.2025 (Bekanntmachungsdatum)\n\nSachsen-Anhalt Amtsgericht Stendal\nHRB 214654\nSonderregisterbekanntmachung OHNE Bezug zum elektr. Register\n\nLaing Grundstücks- und Bauträger Gesellschaft mbH\n\nHinsichtlich der o.g. 09.05.2018 gelöschten Gesellschaft ist beabsichtigt, Herrn Ludwig Wreesmann, wh. Friesoythe OT Altenoythe zum Nachtragsliquidator mit  beschränktem Wirkungskreis zu bestellen.\nDer Antrag kann bei berechtigtem Interesse beim Registergericht Stendal eingesehen werden.\nDie Frist zu Einreichung etwaiger Stellungnahmen bzw. Erhebung eines Widerspruchs wird auf 2 Monate festgesetzt."
    }
  ]
}