{
  "date": "2025-08-04",
  "date_of_scrape": "2025-08-27T11:10:38.037Z",
  "tool_version": "0.2.0",
  "number_of_announcements": 215,
  "announcements": [
    {
      "date": "2025-08-04",
      "id": "118979",
      "original_text": "Löschungsankündigung\nBerlin Amtsgericht Berlin (Charlottenburg) HRB 238525\nCanBe Delivery GmbH – Berlin",
      "type": "Löschungsankündigung",
      "state": "Berlin",
      "amtsgericht": "Amtsgericht Berlin (Charlottenburg)",
      "registernummer": "HRB 238525",
      "registerart": "HRB",
      "company_name": "CanBe Delivery GmbH",
      "company_seat": "Berlin",
      "details": "04.08.2025 (Bekanntmachungsdatum)\n\nBerlin Amtsgericht Berlin (Charlottenburg) HRB 238525\nLöschungsankündigung\n\nCanBe Delivery GmbH\nGesellschaft mit beschränkter Haftung\nBerlin\n\nBei der nachstehenden Gesellschaft wird das Amtslöschungsverfahren gemäß § 394 FamFG eingeleitet. Widerspruchsfrist 6 Wochen"
    },
    {
      "date": "2025-08-04",
      "id": "118980",
      "original_text": "Einreichung neuer Dokumente\nSaarland Amtsgericht Saarbrücken HRB 11231\nSaarländische Wagnisfinanzierungsgesellschaft mbH – Saarbrücken",
      "type": "Einreichung neuer Dokumente",
      "state": "Saarland",
      "amtsgericht": "Amtsgericht Saarbrücken",
      "registernummer": "HRB 11231",
      "registerart": "HRB",
      "company_name": "Saarländische Wagnisfinanzierungsgesellschaft mbH",
      "company_seat": "Saarbrücken",
      "details": "04.08.2025 (Bekanntmachungsdatum)\n\nSaarland Amtsgericht Saarbrücken HRB 11231\nEinreichung neuer Dokumente\n\nSaarländische Wagnisfinanzierungsgesellschaft mbH\nGesellschaft mit beschränkter Haftung\nSaarbrücken\n\nDie Geschäftsführung der Gesellschaft hat eine Liste der Mitglieder des Aufsichtsrats zum Handelsregister eingereicht (§ 52 Abs. 3 Satz 2 GmbHG)."
    },
    {
      "date": "2025-08-04",
      "id": "118981",
      "original_text": "Registerbekanntmachung nach dem Umwandlungsgesetz\nSaarland Amtsgericht Saarbrücken HRA 13644\nLuigi Vitello Innenausbau GmbH & Co. KG – Sulzbach/Saar",
      "type": "Registerbekanntmachung nach dem Umwandlungsgesetz",
      "state": "Saarland",
      "amtsgericht": "Amtsgericht Saarbrücken",
      "registernummer": "HRA 13644",
      "registerart": "HRA",
      "company_name": "Luigi Vitello Innenausbau GmbH & Co. KG",
      "company_seat": "Sulzbach/Saar",
      "details": "04.08.2025 (Bekanntmachungsdatum)\n\nSaarland Amtsgericht Saarbrücken HRA 13644\nRegisterbekanntmachung nach dem Umwandlungsgesetz 04.08.2025 (Eintragungsdatum)\n\nLuigi Vitello Innenausbau GmbH & Co. KG\nKommanditgesellschaft\nSulzbach/Saar\n\nAls nicht eingetragen wird bekannt gemacht: Den Gläubigern der an der Verschmelzung beteiligten Gesellschaften ist, wenn sie binnen sechs Monaten nach dem Tag, an dem die Eintragung der Verschmelzung in das Register des Sitzes desjenigen Rechtsträgers, dessen Gläubiger sie sind, nach § 19 Absatz 3 UmwG bekannt gemacht worden ist, ihren Anspruch nach Grund und Höhe schriftlich anmelden, Sicherheit zu leisten, soweit sie nicht Befriedigung verlangen können. Dieses Recht steht den Gläubigern jedoch nur zu, wenn sie glaubhaft machen, dass durch die Verschmelzung die Erfüllung ihrer Forderung gefährdet wird."
    },
    {
      "date": "2025-08-04",
      "id": "118982",
      "original_text": "Registerbekanntmachung nach dem Umwandlungsgesetz\nBaden-Württemberg Amtsgericht Mannheim HRB 733642\nSolarwandel Stella GmbH – Heidelberg",
      "type": "Registerbekanntmachung nach dem Umwandlungsgesetz",
      "state": "Baden-Württemberg",
      "amtsgericht": "Amtsgericht Mannheim",
      "registernummer": "HRB 733642",
      "registerart": "HRB",
      "company_name": "Solarwandel Stella GmbH",
      "company_seat": "Heidelberg",
      "details": "04.08.2025 (Bekanntmachungsdatum)\n\nBaden-Württemberg Amtsgericht Mannheim HRB 733642\nRegisterbekanntmachung nach dem Umwandlungsgesetz 04.08.2025 (Eintragungsdatum)\n\nSolarwandel Stella GmbH\nGesellschaft mit beschränkter Haftung\nHeidelberg\n\nDen Gläubigern der an der Verschmelzung beteiligten Rechtsträger ist, wenn sie binnen sechs Monaten nach dem Tag, an dem die Eintragung der Verschmelzung in das Register des Sitzes desjenigen Rechtsträgers, dessen Gläubiger sie sind, nach § 19 Abs. 3 UmwG als bekanntgemacht gilt, ihren Anspruch nach Grund und Höhe schriftlich anmelden, Sicherheit zu leisten, soweit sie nicht Befriedigung verlangen können. Dieses Recht steht den Gläubigern jedoch nur zu, wenn sie glaubhaft machen, dass durch die Verschmelzung die Erfüllung ihrer Forderung gefährdet wird."
    },
    {
      "date": "2025-08-04",
      "id": "118983",
      "original_text": "Registerbekanntmachung nach dem Umwandlungsgesetz\nBrandenburg Amtsgericht Potsdam HRB 19718\nBlitz-Kurier GmbH – Rathenow",
      "type": "Registerbekanntmachung nach dem Umwandlungsgesetz",
      "state": "Brandenburg",
      "amtsgericht": "Amtsgericht Potsdam",
      "registernummer": "HRB 19718",
      "registerart": "HRB",
      "company_name": "Blitz-Kurier GmbH",
      "company_seat": "Rathenow",
      "details": "04.08.2025 (Bekanntmachungsdatum)\n\nBrandenburg Amtsgericht Potsdam HRB 19718\nRegisterbekanntmachung nach dem Umwandlungsgesetz 01.08.2025 (Eintragungsdatum)\n\nBlitz-Kurier GmbH\nGesellschaft mit beschränkter Haftung\nRathenow\n\nZu Eintragungsnummer 3 vom 01.08.2025 wird als nicht eingetragen veröffentlicht:\nDen Gläubigern der an der Verschmelzung beteiligten Rechtsträger ist, wenn sie binnen sechs Monaten nach dem Tag, an dem die Eintragung der Verschmelzung in das Register des Sitzes desjenigen Rechtsträgers, dessen Gläubiger sie sind, als bekannt gemacht gilt, ihren Anspruch nach Grund und Höhe schriftlich anmelden, Sicherheit zu leisten, soweit sie nicht Befriedigung verlangen können. Dieses Recht steht den Gläubigern jedoch nur zu, wenn sie glaubhaft machen, dass durch die Verschmelzung die Erfüllung ihrer Forderung gefährdet wird"
    },
    {
      "date": "2025-08-04",
      "id": "118984",
      "original_text": "Registerbekanntmachung nach dem Umwandlungsgesetz\nBaden-Württemberg Amtsgericht Freiburg HRB 726469\nHRpI Verwaltungs-GmbH – Freiburg im Breisgau",
      "type": "Registerbekanntmachung nach dem Umwandlungsgesetz",
      "state": "Baden-Württemberg",
      "amtsgericht": "Amtsgericht Freiburg",
      "registernummer": "HRB 726469",
      "registerart": "HRB",
      "company_name": "HRpI Verwaltungs-GmbH",
      "company_seat": "Freiburg im Breisgau",
      "details": "04.08.2025 (Bekanntmachungsdatum)\n\nBaden-Württemberg Amtsgericht Freiburg HRB 726469\nRegisterbekanntmachung nach dem Umwandlungsgesetz 04.08.2025 (Eintragungsdatum)\n\nHRpI Verwaltungs-GmbH\nGesellschaft mit beschränkter Haftung\nFreiburg im Breisgau\n\nAls nicht eingetragen wird bekanntgemacht:\nDen Gläubigern der an der Verschmelzung beteiligten Rechtsträger ist, wenn sie binnen sechs Monaten nach dem Tag, an dem die Eintragung der Verschmelzung in das Register des Sitzes desjenigen Rechtsträgers, dessen Gläubiger sie sind, nach § 19 Abs. 3 UmwG als bekanntgemacht gilt, ihren Anspruch nach Grund und Höhe schriftlich anmelden, Sicherheit zu leisten, soweit sie nicht Befriedigung verlangen können. Dieses Recht steht den Gläubigern jedoch nur zu, wenn sie glaubhaft machen, dass durch die Verschmelzung die Erfüllung ihrer Forderung gefährdet wird."
    },
    {
      "date": "2025-08-04",
      "id": "118985",
      "original_text": "Registerbekanntmachung nach dem Umwandlungsgesetz\nBaden-Württemberg Amtsgericht Mannheim HRB 724339\nEvO Energie vor Ort GmbH – Heidelberg",
      "type": "Registerbekanntmachung nach dem Umwandlungsgesetz",
      "state": "Baden-Württemberg",
      "amtsgericht": "Amtsgericht Mannheim",
      "registernummer": "HRB 724339",
      "registerart": "HRB",
      "company_name": "EvO Energie vor Ort GmbH",
      "company_seat": "Heidelberg",
      "details": "04.08.2025 (Bekanntmachungsdatum)\n\nBaden-Württemberg Amtsgericht Mannheim HRB 724339\nRegisterbekanntmachung nach dem Umwandlungsgesetz 04.08.2025 (Eintragungsdatum)\n\nEvO Energie vor Ort GmbH\nGesellschaft mit beschränkter Haftung\nHeidelberg\n\nDen Gläubigern der an der Verschmelzung beteiligten Rechtsträger ist, wenn sie binnen sechs Monaten nach dem Tag, an dem die Eintragung der Verschmelzung in das Register des Sitzes desjenigen Rechtsträgers, dessen Gläubiger sie sind, nach § 19 Abs. 3 UmwG als bekanntgemacht gilt, ihren Anspruch nach Grund und Höhe schriftlich anmelden, Sicherheit zu leisten, soweit sie nicht Befriedigung verlangen können. Dieses Recht steht den Gläubigern jedoch nur zu, wenn sie glaubhaft machen, dass durch die Verschmelzung die Erfüllung ihrer Forderung gefährdet wird."
    },
    {
      "date": "2025-08-04",
      "id": "118986",
      "original_text": "Registerbekanntmachung nach dem Umwandlungsgesetz\nSaarland Amtsgericht Saarbrücken HRA 13639\nLV Innenausbau e.K. – Sulzbach/Saar",
      "type": "Registerbekanntmachung nach dem Umwandlungsgesetz",
      "state": "Saarland",
      "amtsgericht": "Amtsgericht Saarbrücken",
      "registernummer": "HRA 13639",
      "registerart": "HRA",
      "company_name": "LV Innenausbau e.K.",
      "company_seat": "Sulzbach/Saar",
      "details": "04.08.2025 (Bekanntmachungsdatum)\n\nSaarland Amtsgericht Saarbrücken HRA 13639\nRegisterbekanntmachung nach dem Umwandlungsgesetz 04.08.2025 (Eintragungsdatum)\n\nLV Innenausbau e.K.\nEinzelkaufmann / Einzelkauffrau\nSulzbach/Saar\n\nAls nicht eingetragen wird bekannt gemacht: Den Gläubigern der an der Verschmelzung beteiligten Gesellschaften ist, wenn sie binnen sechs Monaten nach dem Tag, an dem die Eintragung der Verschmelzung in das Register des Sitzes desjenigen Rechtsträgers, dessen Gläubiger sie sind, nach § 19 Absatz 3 UmwG bekannt gemacht worden ist, ihren Anspruch nach Grund und Höhe schriftlich anmelden, Sicherheit zu leisten, soweit sie nicht Befriedigung verlangen können. Dieses Recht steht den Gläubigern jedoch nur zu, wenn sie glaubhaft machen, dass durch die Verschmelzung die Erfüllung ihrer Forderung gefährdet wird."
    },
    {
      "date": "2025-08-04",
      "id": "118987",
      "original_text": "Registerbekanntmachung nach dem Umwandlungsgesetz\nBaden-Württemberg Amtsgericht Freiburg HRB 733615\nHRp GmbH – Freiburg im Breisgau",
      "type": "Registerbekanntmachung nach dem Umwandlungsgesetz",
      "state": "Baden-Württemberg",
      "amtsgericht": "Amtsgericht Freiburg",
      "registernummer": "HRB 733615",
      "registerart": "HRB",
      "company_name": "HRp GmbH",
      "company_seat": "Freiburg im Breisgau",
      "details": "04.08.2025 (Bekanntmachungsdatum)\n\nBaden-Württemberg Amtsgericht Freiburg HRB 733615\nRegisterbekanntmachung nach dem Umwandlungsgesetz 04.08.2025 (Eintragungsdatum)\n\nHRp GmbH\nGesellschaft mit beschränkter Haftung\nFreiburg im Breisgau\n\nAls nicht eingetragen wird bekanntgemacht:\nDen Gläubigern der an der Verschmelzung beteiligten Rechtsträger ist, wenn sie binnen sechs Monaten nach dem Tag, an dem die Eintragung der Verschmelzung in das Register des Sitzes desjenigen Rechtsträgers, dessen Gläubiger sie sind, nach § 19 Abs. 3 UmwG als bekanntgemacht gilt, ihren Anspruch nach Grund und Höhe schriftlich anmelden, Sicherheit zu leisten, soweit sie nicht Befriedigung verlangen können. Dieses Recht steht den Gläubigern jedoch nur zu, wenn sie glaubhaft machen, dass durch die Verschmelzung die Erfüllung ihrer Forderung gefährdet wird."
    },
    {
      "date": "2025-08-04",
      "id": "118988",
      "original_text": "Sonstige Registerbekanntmachung\nBerlin Amtsgericht Berlin (Charlottenburg) HRB 56530\nLBBW Berlin Beteiligungs-AG – Berlin",
      "type": "Sonstige Registerbekanntmachung",
      "state": "Berlin",
      "amtsgericht": "Amtsgericht Berlin (Charlottenburg)",
      "registernummer": "HRB 56530",
      "registerart": "HRB",
      "company_name": "LBBW Berlin Beteiligungs-AG",
      "company_seat": "Berlin",
      "details": "04.08.2025 (Bekanntmachungsdatum)\n\nBerlin Amtsgericht Berlin (Charlottenburg) HRB 56530\nSonstige Registerbekanntmachung\n\nLBBW Berlin Beteiligungs-AG\nAktiengesellschaft\nBerlin\n\nAls nicht eingetragen wird veröffentlicht: Den Gläubigern der an der Spaltung beteiligten Rechtsträger ist, wenn sie binnen sechs Monaten nach dem Tag, an dem die Eintragung der Spaltung in das Register des Sitzes desjenigen Rechtsträgers, dessen Gläubiger sie sind, als bekannt gemacht gilt, ihren Anspruch nach Grund und Höhe schriftlich anmelden, Sicherheit zu leisten, soweit sie nicht Befriedigung verlangen können. Dieses Recht steht den Gläubigern jedoch nur zu, wenn sie glaubhaft machen, dass durch die Spaltung die Erfüllung ihrer Forderung gefährdet wird. Das Recht, Sicherheitsleistung zu verlangen, steht Gläubigern nicht zu, die im Falle der Insolvenz ein Recht auf vorzugsweise Befriedigung aus einer Deckungsmasse haben, die nach gesetzlicher Vorschrift zu ihrem Schutz errichtet und staatlich überwacht ist."
    },
    {
      "date": "2025-08-04",
      "id": "118989",
      "original_text": "Registerbekanntmachung nach dem Umwandlungsgesetz\nBaden-Württemberg Amtsgericht Freiburg HRB 726419\ne.perfect Holding GmbH – Offenburg",
      "type": "Registerbekanntmachung nach dem Umwandlungsgesetz",
      "state": "Baden-Württemberg",
      "amtsgericht": "Amtsgericht Freiburg",
      "registernummer": "HRB 726419",
      "registerart": "HRB",
      "company_name": "e.perfect Holding GmbH",
      "company_seat": "Offenburg",
      "details": "04.08.2025 (Bekanntmachungsdatum)\n\nBaden-Württemberg Amtsgericht Freiburg HRB 726419\nRegisterbekanntmachung nach dem Umwandlungsgesetz 04.08.2025 (Eintragungsdatum)\n\ne.perfect Holding GmbH\nGesellschaft mit beschränkter Haftung\nOffenburg\n\nAls nicht eingetragen wird bekanntgemacht:\nDen Gläubigern der an der Verschmelzung beteiligten Rechtsträger ist, wenn sie binnen sechs Monaten nach dem Tag, an dem die Eintragung der Verschmelzung in das Register des Sitzes desjenigen Rechtsträgers, dessen Gläubiger sie sind, nach § 19 Abs. 3 UmwG als bekanntgemacht gilt, ihren Anspruch nach Grund und Höhe schriftlich anmelden, Sicherheit zu leisten, soweit sie nicht Befriedigung verlangen können. Dieses Recht steht den Gläubigern jedoch nur zu, wenn sie glaubhaft machen, dass durch die Verschmelzung die Erfüllung ihrer Forderung gefährdet wird."
    },
    {
      "date": "2025-08-04",
      "id": "118990",
      "original_text": "Registerbekanntmachung nach dem Umwandlungsgesetz\nSchleswig-Holstein Amtsgericht Flensburg HRB 16578\nGP JOULE Service Engineering GmbH – Reußenköge",
      "type": "Registerbekanntmachung nach dem Umwandlungsgesetz",
      "state": "Schleswig-Holstein",
      "amtsgericht": "Amtsgericht Flensburg",
      "registernummer": "HRB 16578",
      "registerart": "HRB",
      "company_name": "GP JOULE Service Engineering GmbH",
      "company_seat": "Reußenköge",
      "details": "04.08.2025 (Bekanntmachungsdatum)\n\nSchleswig-Holstein Amtsgericht Flensburg HRB 16578\nRegisterbekanntmachung nach dem Umwandlungsgesetz 01.08.2025 (Eintragungsdatum)\n\nGP JOULE Service Engineering GmbH\nGesellschaft mit beschränkter Haftung\nReußenköge\n\nZu Eintragungsnummer 2 vom 01.08.2025 wird als nicht eingetragen veröffentlicht: Den Gläubigern der an der Verschmelzung beteiligten Rechtsträger ist, wenn sie binnen sechs Monaten nach dem Tag, an dem die Eintragung der Verschmelzung in das Register des Sitzes desjenigen Rechtsträgers, dessen Gläubiger sie sind, als bekannt gemacht gilt, ihren Anspruch nach Grund und Höhe schriftlich anmelden, Sicherheit zu leisten, soweit sie nicht Befriedigung verlangen können. Dieses Recht steht den Gläubigern jedoch nur zu, wenn sie glaubhaft machen, dass durch die Verschmelzung die Erfüllung ihrer Forderung gefährdet wird. Das Recht, Sicherheitsleistung zu verlangen, steht Gläubigern nicht zu, die im Falle der Insolvenz ein Recht auf vorzugsweise Befriedigung aus einer Deckungsmasse haben, die nach gesetzlicher Vorschrift zu ihrem Schutz errichtet und staatlich überwacht ist."
    },
    {
      "date": "2025-08-04",
      "id": "118991",
      "original_text": "Registerbekanntmachung nach dem Umwandlungsgesetz\nBrandenburg Amtsgericht Potsdam HRB 13066\nMärkische Postdienste GmbH – Brandenburg an der Havel",
      "type": "Registerbekanntmachung nach dem Umwandlungsgesetz",
      "state": "Brandenburg",
      "amtsgericht": "Amtsgericht Potsdam",
      "registernummer": "HRB 13066",
      "registerart": "HRB",
      "company_name": "Märkische Postdienste GmbH",
      "company_seat": "Brandenburg an der Havel",
      "details": "04.08.2025 (Bekanntmachungsdatum)\n\nBrandenburg Amtsgericht Potsdam HRB 13066\nRegisterbekanntmachung nach dem Umwandlungsgesetz 01.08.2025 (Eintragungsdatum)\n\nMärkische Postdienste GmbH\nGesellschaft mit beschränkter Haftung\nBrandenburg an der Havel\n\nZu Eintragungsnummer 4 vom 01.08.2025 wird als nicht eingetragen veröffentlicht:\nDen Gläubigern der an der Verschmelzung beteiligten Rechtsträger ist, wenn sie binnen sechs Monaten nach dem Tag, an dem die Eintragung der Verschmelzung in das Register des Sitzes desjenigen Rechtsträgers, dessen Gläubiger sie sind, als bekannt gemacht gilt, ihren Anspruch nach Grund und Höhe schriftlich anmelden, Sicherheit zu leisten, soweit sie nicht Befriedigung verlangen können. Dieses Recht steht den Gläubigern jedoch nur zu, wenn sie glaubhaft machen, dass durch die Verschmelzung die Erfüllung ihrer Forderung gefährdet wird"
    },
    {
      "date": "2025-08-04",
      "id": "118992",
      "original_text": "Löschungsankündigung\nBerlin Amtsgericht Berlin (Charlottenburg) HRB 155363\nFruitmatics UG (haftungsbeschränkt) – Berlin",
      "type": "Löschungsankündigung",
      "state": "Berlin",
      "amtsgericht": "Amtsgericht Berlin (Charlottenburg)",
      "registernummer": "HRB 155363",
      "registerart": "HRB",
      "company_name": "Fruitmatics UG (haftungsbeschränkt)",
      "company_seat": "Berlin",
      "details": "04.08.2025 (Bekanntmachungsdatum)\n\nBerlin Amtsgericht Berlin (Charlottenburg) HRB 155363\nLöschungsankündigung\n\nFruitmatics UG (haftungsbeschränkt)\nGesellschaft mit beschränkter Haftung\nBerlin\n\nBei der nachstehenden Gesellschaft wird das Amtslöschungsverfahren gemäß § 394 FamFG eingeleitet. Widerspruchsfrist 6 Wochen"
    },
    {
      "date": "2025-08-04",
      "id": "118993",
      "original_text": "Einreichung neuer Dokumente\nBaden-Württemberg Amtsgericht Mannheim HRB 724435\nGood Brands AG – Mannheim",
      "type": "Einreichung neuer Dokumente",
      "state": "Baden-Württemberg",
      "amtsgericht": "Amtsgericht Mannheim",
      "registernummer": "HRB 724435",
      "registerart": "HRB",
      "company_name": "Good Brands AG",
      "company_seat": "Mannheim",
      "details": "04.08.2025 (Bekanntmachungsdatum)\n\nBaden-Württemberg Amtsgericht Mannheim HRB 724435\nEinreichung neuer Dokumente 04.08.2025 (Eintragungsdatum)\n\nGood Brands AG\nAktiengesellschaft\nMannheim\n\nDie Gesellschaft hat am 29.07.2025 die Liste über die Zusammensetzung des Aufsichtsrats zum Handelsregister eingereicht."
    },
    {
      "date": "2025-08-04",
      "id": "118994",
      "original_text": "Einreichung neuer Dokumente\nBerlin Amtsgericht Berlin (Charlottenburg) HRB 161349\nTele Columbus AG – Berlin",
      "type": "Einreichung neuer Dokumente",
      "state": "Berlin",
      "amtsgericht": "Amtsgericht Berlin (Charlottenburg)",
      "registernummer": "HRB 161349",
      "registerart": "HRB",
      "company_name": "Tele Columbus AG",
      "company_seat": "Berlin",
      "details": "04.08.2025 (Bekanntmachungsdatum)\n\nBerlin Amtsgericht Berlin (Charlottenburg) HRB 161349\nEinreichung neuer Dokumente\n\nTele Columbus AG\nAktiengesellschaft\nBerlin\n\nAls nicht eingetragen wird veröffentlicht: Es wurde eine neue Liste der Aufsichtsratsmitglieder eingereicht (§ 106 AktG)."
    },
    {
      "date": "2025-08-04",
      "id": "118995",
      "original_text": "Registerbekanntmachung nach dem Umwandlungsgesetz\nBaden-Württemberg Amtsgericht Mannheim HRB 745369\nAdvocatus Holding GmbH – Karlsruhe",
      "type": "Registerbekanntmachung nach dem Umwandlungsgesetz",
      "state": "Baden-Württemberg",
      "amtsgericht": "Amtsgericht Mannheim",
      "registernummer": "HRB 745369",
      "registerart": "HRB",
      "company_name": "Advocatus Holding GmbH",
      "company_seat": "Karlsruhe",
      "details": "04.08.2025 (Bekanntmachungsdatum)\n\nBaden-Württemberg Amtsgericht Mannheim HRB 745369\nRegisterbekanntmachung nach dem Umwandlungsgesetz 04.08.2025 (Eintragungsdatum)\n\nAdvocatus Holding GmbH\nGesellschaft mit beschränkter Haftung\nKarlsruhe\n\nDen Gläubigern der an der Verschmelzung beteiligten Rechtsträger ist, wenn sie binnen sechs Monaten nach dem Tag, an dem die Eintragung der Verschmelzung in das Register des Sitzes desjenigen Rechtsträgers, dessen Gläubiger sie sind, nach § 19 Abs. 3 UmwG als bekanntgemacht gilt, ihren Anspruch nach Grund und Höhe schriftlich anmelden, Sicherheit zu leisten, soweit sie nicht Befriedigung verlangen können. Dieses Recht steht den Gläubigern jedoch nur zu, wenn sie glaubhaft machen, dass durch die Verschmelzung die Erfüllung ihrer Forderung gefährdet wird."
    },
    {
      "date": "2025-08-04",
      "id": "118996",
      "original_text": "Registerbekanntmachung nach dem Umwandlungsgesetz\nBaden-Württemberg Amtsgericht Freiburg HRB 725699\nFreie Energieberatung Deutschland GmbH – Offenburg",
      "type": "Registerbekanntmachung nach dem Umwandlungsgesetz",
      "state": "Baden-Württemberg",
      "amtsgericht": "Amtsgericht Freiburg",
      "registernummer": "HRB 725699",
      "registerart": "HRB",
      "company_name": "Freie Energieberatung Deutschland GmbH",
      "company_seat": "Offenburg",
      "details": "04.08.2025 (Bekanntmachungsdatum)\n\nBaden-Württemberg Amtsgericht Freiburg HRB 725699\nRegisterbekanntmachung nach dem Umwandlungsgesetz 04.08.2025 (Eintragungsdatum)\n\nFreie Energieberatung Deutschland GmbH\nGesellschaft mit beschränkter Haftung\nOffenburg\n\nDie \"e.perfect Holding GmbH\" (Amtsgericht Freiburg, HRB 726419) ist auf diese Gesellschaft zur Aufnahme verschmolzen. Den Gläubigern der an der Verschmelzung beteiligten Rechtsträger ist, wenn sie binnen sechs Monaten nach dem Tag, an dem die Eintragung der Verschmelzung in das Register des Sitzes desjenigen Rechtsträgers, dessen Gläubiger sie sind, nach § 19 Abs. 3 UmwG als bekanntgemacht gilt, ihren Anspruch nach Grund und Höhe schriftlich anmelden, Sicherheit zu leisten, soweit sie nicht Befriedigung verlangen können. Dieses Recht steht den Gläubigern jedoch nur zu, wenn sie glaubhaft machen, dass durch die Verschmelzung die Erfüllung ihrer Forderung gefährdet wird."
    },
    {
      "date": "2025-08-04",
      "id": "118997",
      "original_text": "Registerbekanntmachung nach dem Umwandlungsgesetz\nBerlin Amtsgericht Berlin (Charlottenburg) HRB 181353\nTH Capital GmbH – Berlin",
      "type": "Registerbekanntmachung nach dem Umwandlungsgesetz",
      "state": "Berlin",
      "amtsgericht": "Amtsgericht Berlin (Charlottenburg)",
      "registernummer": "HRB 181353",
      "registerart": "HRB",
      "company_name": "TH Capital GmbH",
      "company_seat": "Berlin",
      "details": "04.08.2025 (Bekanntmachungsdatum)\n\nBerlin Amtsgericht Berlin (Charlottenburg) HRB 181353\nRegisterbekanntmachung nach dem Umwandlungsgesetz 30.07.2025 (Eintragungsdatum)\n\nTH Capital GmbH\nGesellschaft mit beschränkter Haftung\nBerlin\n\nZu Eintragungsnummer 5 vom 30.07.2025 wird als nicht eingetragen veröffentlicht: Den Gläubigern der an der Verschmelzung beteiligten Rechtsträger ist, wenn sie binnen sechs Monaten nach dem Tag, an dem die Eintragung der Verschmelzung in das Register des Sitzes desjenigen Rechtsträgers, dessen Gläubiger sie sind, als bekannt gemacht gilt, ihren Anspruch nach Grund und Höhe schriftlich anmelden, Sicherheit zu leisten, soweit sie nicht Befriedigung verlangen können. Dieses Recht steht den Gläubigern jedoch nur zu, wenn sie glaubhaft machen, dass durch die Verschmelzung die Erfüllung ihrer Forderung gefährdet wird. Das Recht, Sicherheitsleistung zu verlangen, steht Gläubigern nicht zu, die im Falle der Insolvenz ein Recht auf vorzugsweise Befriedigung aus einer Deckungsmasse haben, die nach gesetzlicher Vorschrift zu ihrem Schutz errichtet und staatlich überwacht ist."
    },
    {
      "date": "2025-08-04",
      "id": "118998",
      "original_text": "Registerbekanntmachung nach dem Umwandlungsgesetz\nBerlin Amtsgericht Berlin (Charlottenburg) HRB 160458\nGadus Immobilien GmbH – Berlin",
      "type": "Registerbekanntmachung nach dem Umwandlungsgesetz",
      "state": "Berlin",
      "amtsgericht": "Amtsgericht Berlin (Charlottenburg)",
      "registernummer": "HRB 160458",
      "registerart": "HRB",
      "company_name": "Gadus Immobilien GmbH",
      "company_seat": "Berlin",
      "details": "04.08.2025 (Bekanntmachungsdatum)\n\nBerlin Amtsgericht Berlin (Charlottenburg) HRB 160458\nRegisterbekanntmachung nach dem Umwandlungsgesetz 30.07.2025 (Eintragungsdatum)\n\nGadus Immobilien GmbH\nGesellschaft mit beschränkter Haftung\nBerlin\n\nZu Eintragungsnummer 4 vom 30.07.2025 wird als nicht eingetragen veröffentlicht: Den Gläubigern der an der Verschmelzung beteiligten Rechtsträger ist, wenn sie binnen sechs Monaten nach dem Tag, an dem die Eintragung der Verschmelzung in das Register des Sitzes desjenigen Rechtsträgers, dessen Gläubiger sie sind, als bekannt gemacht gilt, ihren Anspruch nach Grund und Höhe schriftlich anmelden, Sicherheit zu leisten, soweit sie nicht Befriedigung verlangen können. Dieses Recht steht den Gläubigern jedoch nur zu, wenn sie glaubhaft machen, dass durch die Verschmelzung die Erfüllung ihrer Forderung gefährdet wird. Das Recht, Sicherheitsleistung zu verlangen, steht Gläubigern nicht zu, die im Falle der Insolvenz ein Recht auf vorzugsweise Befriedigung aus einer Deckungsmasse haben, die nach gesetzlicher Vorschrift zu ihrem Schutz errichtet und staatlich überwacht ist."
    },
    {
      "date": "2025-08-04",
      "id": "118999",
      "original_text": "Registerbekanntmachung nach dem Umwandlungsgesetz\nBrandenburg Amtsgericht Potsdam HRA 1030\nSibylle Weichert - Freie Tankstelle e.K. – Kloster Lehnin",
      "type": "Registerbekanntmachung nach dem Umwandlungsgesetz",
      "state": "Brandenburg",
      "amtsgericht": "Amtsgericht Potsdam",
      "registernummer": "HRA 1030",
      "registerart": "HRA",
      "company_name": "Sibylle Weichert - Freie Tankstelle e.K.",
      "company_seat": "Kloster Lehnin",
      "details": "04.08.2025 (Bekanntmachungsdatum)\n\nBrandenburg Amtsgericht Potsdam HRA 1030\nRegisterbekanntmachung nach dem Umwandlungsgesetz 01.08.2025 (Eintragungsdatum)\n\nSibylle Weichert - Freie Tankstelle e.K.\nEinzelkaufmann / Einzelkauffrau\nKloster Lehnin\n\nZu Eintragungsnummer 4 vom 01.08.2025 wird als nicht eingetragen veröffentlicht:\nDen Gläubigern der an der Ausgliederung beteiligten Rechtsträger ist, wenn sie binnen sechs Monaten nach dem Tag, an dem die Eintragung der Ausgliederung in das Register des Sitzes desjenigen Rechtsträgers, dessen Gläubiger sie sind, als bekannt gemacht gilt, ihren Anspruch nach Grund und Höhe schriftlich anmelden, Sicherheit zu leisten, soweit sie nicht Befriedigung verlangen können. Dieses Recht steht den Gläubigern jedoch nur zu, wenn sie glaubhaft machen, dass durch die Ausgliederung die Erfüllung ihrer Forderung gefährdet wird"
    },
    {
      "date": "2025-08-04",
      "id": "119000",
      "original_text": "Registerbekanntmachung nach dem Umwandlungsgesetz\nBrandenburg Amtsgericht Frankfurt/Oder HRB 21674\nTourismus Jägerbude GmbH – Gosen-Neu Zittau",
      "type": "Registerbekanntmachung nach dem Umwandlungsgesetz",
      "state": "Brandenburg",
      "amtsgericht": "Amtsgericht Frankfurt/Oder",
      "registernummer": "HRB 21674",
      "registerart": "HRB",
      "company_name": "Tourismus Jägerbude GmbH",
      "company_seat": "Gosen-Neu Zittau",
      "details": "04.08.2025 (Bekanntmachungsdatum)\n\nBrandenburg Amtsgericht Frankfurt/Oder HRB 21674\nRegisterbekanntmachung nach dem Umwandlungsgesetz 04.08.2025 (Eintragungsdatum)\n\nTourismus Jägerbude GmbH\nGesellschaft mit beschränkter Haftung\nGosen-Neu Zittau\n\nZu Eintragungsnummer 1 vom 04.08.2025 wird als nicht eingetragen veröffentlicht: Als nicht eingetragen wird veröffentlicht:\nDen Gläubigern der an der Umwandlung beteiligten Rechtsträger ist, wenn sie binnen sechs Monaten nach dem Tag, an dem die Eintragung der Umwandlung in das Register des Sitzes desjenigen Rechtsträgers, dessen Gläubiger sie sind, als bekannt gemacht gilt, ihren Anspruch nach Grund und Höhe schriftlich anmelden, Sicherheit zu leisten, soweit sie nicht Befriedigung verlangen können. Dieses Recht steht den Gläubigern jedoch nur zu, wenn sie glaubhaft machen, dass durch die Umwandlung die Erfüllung ihrer Forderung gefährdet wird."
    },
    {
      "date": "2025-08-04",
      "id": "119001",
      "original_text": "Löschungsankündigung\nSchleswig-Holstein Amtsgericht Flensburg HRB 7981\nJEMTEX GmbH – Tarp",
      "type": "Löschungsankündigung",
      "state": "Schleswig-Holstein",
      "amtsgericht": "Amtsgericht Flensburg",
      "registernummer": "HRB 7981",
      "registerart": "HRB",
      "company_name": "JEMTEX GmbH",
      "company_seat": "Tarp",
      "details": "04.08.2025 (Bekanntmachungsdatum)\n\nSchleswig-Holstein Amtsgericht Flensburg HRB 7981\nLöschungsankündigung\n\nJEMTEX GmbH\nGesellschaft mit beschränkter Haftung\nTarp\n\nEs ist die Löschung der nachstehenden Gesellschaft wegen Vermögenslosigkeit gemäß § 394 FamFG beabsichtigt.\nWiderspruchsfrist: 2 Monate."
    },
    {
      "date": "2025-08-04",
      "id": "119002",
      "original_text": "Registerbekanntmachung nach dem Umwandlungsgesetz\nBerlin Amtsgericht Berlin (Charlottenburg) HRB 186447\nProjektgesellschaft KraftWerkStadt Berlin GmbH – Berlin",
      "type": "Registerbekanntmachung nach dem Umwandlungsgesetz",
      "state": "Berlin",
      "amtsgericht": "Amtsgericht Berlin (Charlottenburg)",
      "registernummer": "HRB 186447",
      "registerart": "HRB",
      "company_name": "Projektgesellschaft KraftWerkStadt Berlin GmbH",
      "company_seat": "Berlin",
      "details": "04.08.2025 (Bekanntmachungsdatum)\n\nBerlin Amtsgericht Berlin (Charlottenburg) HRB 186447\nRegisterbekanntmachung nach dem Umwandlungsgesetz 30.07.2025 (Eintragungsdatum)\n\nProjektgesellschaft KraftWerkStadt Berlin GmbH\nGesellschaft mit beschränkter Haftung\nBerlin\n\nZu Eintragungsnummer 6 vom 30.07.2025 wird als nicht eingetragen veröffentlicht: Den Gläubigern der an der Verschmelzung beteiligten Rechtsträger ist, wenn sie binnen sechs Monaten nach dem Tag, an dem die Eintragung der Verschmelzung in das Register des Sitzes desjenigen Rechtsträgers, dessen Gläubiger sie sind, als bekannt gemacht gilt, ihren Anspruch nach Grund und Höhe schriftlich anmelden, Sicherheit zu leisten, soweit sie nicht Befriedigung verlangen können. Dieses Recht steht den Gläubigern jedoch nur zu, wenn sie glaubhaft machen, dass durch die Verschmelzung die Erfüllung ihrer Forderung gefährdet wird. Das Recht, Sicherheitsleistung zu verlangen, steht Gläubigern nicht zu, die im Falle der Insolvenz ein Recht auf vorzugsweise Befriedigung aus einer Deckungsmasse haben, die nach gesetzlicher Vorschrift zu ihrem Schutz errichtet und staatlich überwacht ist."
    },
    {
      "date": "2025-08-04",
      "id": "119003",
      "original_text": "Registerbekanntmachung nach dem Umwandlungsgesetz\nBaden-Württemberg Amtsgericht Stuttgart HRB 781291\nDER Reisebüro Südwest GmbH – Stuttgart",
      "type": "Registerbekanntmachung nach dem Umwandlungsgesetz",
      "state": "Baden-Württemberg",
      "amtsgericht": "Amtsgericht Stuttgart",
      "registernummer": "HRB 781291",
      "registerart": "HRB",
      "company_name": "DER Reisebüro Südwest GmbH",
      "company_seat": "Stuttgart",
      "details": "04.08.2025 (Bekanntmachungsdatum)\n\nBaden-Württemberg Amtsgericht Stuttgart HRB 781291\nRegisterbekanntmachung nach dem Umwandlungsgesetz 04.08.2025 (Eintragungsdatum)\n\nDER Reisebüro Südwest GmbH\nGesellschaft mit beschränkter Haftung\nStuttgart\n\nAls nicht eingetragen wird bekanntgemacht:\nDen Gläubigern der an der Verschmelzung beteiligten Rechtsträger ist, wenn sie binnen sechs Monaten nach dem Tag, an dem die Eintragung der Verschmelzung in das Register des Sitzes desjenigen Rechtsträgers, dessen Gläubiger sie sind, nach § 19 Abs. 3 UmwG als bekanntgemacht gilt, ihren Anspruch nach Grund und Höhe schriftlich anmelden, Sicherheit zu leisten, soweit sie nicht Befriedigung verlangen können. Dieses Recht steht den Gläubigern jedoch nur zu, wenn sie glaubhaft machen, dass durch die Verschmelzung die Erfüllung ihrer Forderung gefährdet wird."
    },
    {
      "date": "2025-08-04",
      "id": "119004",
      "original_text": "Registerbekanntmachung nach dem Umwandlungsgesetz\nSchleswig-Holstein Amtsgericht Kiel HRB 28403\nQubensys GmbH – Itzstedt",
      "type": "Registerbekanntmachung nach dem Umwandlungsgesetz",
      "state": "Schleswig-Holstein",
      "amtsgericht": "Amtsgericht Kiel",
      "registernummer": "HRB 28403",
      "registerart": "HRB",
      "company_name": "Qubensys GmbH",
      "company_seat": "Itzstedt",
      "details": "04.08.2025 (Bekanntmachungsdatum)\n\nSchleswig-Holstein Amtsgericht Kiel HRB 28403\nRegisterbekanntmachung nach dem Umwandlungsgesetz 31.07.2025 (Eintragungsdatum)\n\nQubensys GmbH\nGesellschaft mit beschränkter Haftung\nItzstedt\n\nZur Eintragungsnummer 1 vom 31.07.2025 wird als nicht eingetragen veröffentlicht: Den Gläubigern der an der Spaltung beteiligten Rechtsträger ist, wenn sie binnen sechs Monaten nach dem Tag, an dem die Eintragung der Spaltung in das Register des Sitzes desjenigen Rechtsträgers, dessen Gläubiger sie sind,  bekannt gemacht worden ist, ihren Anspruch nach Grund und Höhe schriftlich anmelden, Sicherheit zu leisten, soweit sie nicht Befriedigung verlangen können. Dieses Recht steht den Gläubigern jedoch nur zu, wenn sie glaubhaft machen, dass durch die Spaltung die Erfüllung ihrer Forderung gefährdet wird."
    },
    {
      "date": "2025-08-04",
      "id": "119005",
      "original_text": "Registerbekanntmachung nach dem Umwandlungsgesetz\nBerlin Amtsgericht Berlin (Charlottenburg) HRB 180358\nPIA Advertising BER GmbH – Berlin",
      "type": "Registerbekanntmachung nach dem Umwandlungsgesetz",
      "state": "Berlin",
      "amtsgericht": "Amtsgericht Berlin (Charlottenburg)",
      "registernummer": "HRB 180358",
      "registerart": "HRB",
      "company_name": "PIA Advertising BER GmbH",
      "company_seat": "Berlin",
      "details": "04.08.2025 (Bekanntmachungsdatum)\n\nBerlin Amtsgericht Berlin (Charlottenburg) HRB 180358\nRegisterbekanntmachung nach dem Umwandlungsgesetz 30.07.2025 (Eintragungsdatum)\n\nPIA Advertising BER GmbH\nGesellschaft mit beschränkter Haftung\nBerlin\n\nZu Eintragungsnummer 11 vom 30.07.2025 wird als nicht eingetragen veröffentlicht: Den Gläubigern der an der Verschmelzung beteiligten Rechtsträger ist, wenn sie binnen sechs Monaten nach dem Tag, an dem die Eintragung der Verschmelzung in das Register des Sitzes desjenigen Rechtsträgers, dessen Gläubiger sie sind, als bekannt gemacht gilt, ihren Anspruch nach Grund und Höhe schriftlich anmelden, Sicherheit zu leisten, soweit sie nicht Befriedigung verlangen können. Dieses Recht steht den Gläubigern jedoch nur zu, wenn sie glaubhaft machen, dass durch die Verschmelzung die Erfüllung ihrer Forderung gefährdet wird. Das Recht, Sicherheitsleistung zu verlangen, steht Gläubigern nicht zu, die im Falle der Insolvenz ein Recht auf vorzugsweise Befriedigung aus einer Deckungsmasse haben, die nach gesetzlicher Vorschrift zu ihrem Schutz errichtet und staatlich überwacht ist."
    },
    {
      "date": "2025-08-04",
      "id": "119006",
      "original_text": "Registerbekanntmachung nach dem Umwandlungsgesetz\nHamburg Amtsgericht Hamburg VR 20469\nMediationsZentraleHamburg e.V. – Hamburg",
      "type": "Registerbekanntmachung nach dem Umwandlungsgesetz",
      "state": "Hamburg",
      "amtsgericht": "Amtsgericht Hamburg",
      "registernummer": "VR 20469",
      "registerart": "VR",
      "company_name": "MediationsZentraleHamburg e.V.",
      "company_seat": "Hamburg",
      "details": "04.08.2025 (Bekanntmachungsdatum)\n\nHamburg Amtsgericht Hamburg VR 20469\nRegisterbekanntmachung nach dem Umwandlungsgesetz 31.07.2025 (Eintragungsdatum)\n\nMediationsZentraleHamburg e.V.\neingetragener Verein\nHamburg\n\nDer Verein ist als übertragender Rechtsträger nach Maßgabe des Verschmelzungsvertrages vom 18.02.2025 sowie der Zustimmungsbeschlüsse seiner Mitgliederversammlung vom 18.02.2025 und der Mitgliederversammlung des übernehmenden Rechtsträgers vom 18.02.2025 mit dem Hamburger Institut für Mediation e.V. mit Sitz in Hamburg (Amtsgericht Hamburg VR 14512) verschmolzen worden.\nAls nicht eingetragen wird bekannt gemacht:\nDen Gläubigern der an der Verschmelzung beteiligten Rechtsträger ist, wenn sie binnen sechs Monaten nach dem Tag, an dem die Eintragung der Verschmelzung in das Register des Sitzes desjenigen Rechtsträgers, dessen Gläubiger sie sind, nach § 19 Absatz 3 UmwG als bekannt gemacht gilt, ihren Anspruch nach Grund und Höhe schriftlich anmelden, Sicherheit zu leisten, soweit sie nicht Befriedigung verlangen können. Dieses Recht steht den Gläubigern jedoch nur zu, wenn sie glaubhaft machen, dass durch die Verschmelzung die Erfüllung ihrer Forderung gefährdet wird."
    },
    {
      "date": "2025-08-04",
      "id": "119007",
      "original_text": "Registerbekanntmachung nach dem Umwandlungsgesetz\nHamburg Amtsgericht Hamburg HRA 131514\nDüsseldorf, Schadowstraße 50/52 GmbH & Co.KG – Hamburg",
      "type": "Registerbekanntmachung nach dem Umwandlungsgesetz",
      "state": "Hamburg",
      "amtsgericht": "Amtsgericht Hamburg",
      "registernummer": "HRA 131514",
      "registerart": "HRA",
      "company_name": "Düsseldorf, Schadowstraße 50/52 GmbH & Co.KG",
      "company_seat": "Hamburg",
      "details": "04.08.2025 (Bekanntmachungsdatum)\n\nHamburg Amtsgericht Hamburg HRA 131514\nRegisterbekanntmachung nach dem Umwandlungsgesetz 04.08.2025 (Eintragungsdatum)\n\nDüsseldorf, Schadowstraße 50/52 GmbH & Co.KG\nKommanditgesellschaft\nHamburg\n\nAls nicht eingetragen wird bekannt gemacht:\nDen Gläubigern der an der Verschmelzung beteiligten Gesellschaften ist, wenn sie binnen sechs Monaten nach dem Tag, an dem die Eintragung der Verschmelzung in das Register des Sitzes desjenigen Rechtsträgers, dessen Gläubiger sie sind, nach § 19 Absatz 3 UmwG als bekannt gemacht gilt, ihren Anspruch nach Grund und Höhe schriftlich anmelden, Sicherheit zu leisten, soweit sie nicht Befriedigung verlangen können. Dieses Recht steht den Gläubigern jedoch nur zu, wenn sie glaubhaft machen, dass durch die Verschmelzung die Erfüllung ihrer Forderung gefährdet wird."
    },
    {
      "date": "2025-08-04",
      "id": "119008",
      "original_text": "Registerbekanntmachung nach dem Umwandlungsgesetz\nHamburg Amtsgericht Hamburg VR 14512\nHamburger Institut für Mediation e.V. – Hamburg",
      "type": "Registerbekanntmachung nach dem Umwandlungsgesetz",
      "state": "Hamburg",
      "amtsgericht": "Amtsgericht Hamburg",
      "registernummer": "VR 14512",
      "registerart": "VR",
      "company_name": "Hamburger Institut für Mediation e.V.",
      "company_seat": "Hamburg",
      "details": "04.08.2025 (Bekanntmachungsdatum)\n\nHamburg Amtsgericht Hamburg VR 14512\nRegisterbekanntmachung nach dem Umwandlungsgesetz 31.07.2025 (Eintragungsdatum)\n\nHamburger Institut für Mediation e.V.\neingetragener Verein\nHamburg\n\nDer Verein ist als übernehmender Rechtsträger nach Maßgabe des Verschmelzungsvertrages vom 18.02.2025 sowie der Zustimmungsbeschlüsse ihrer Mitgliederversammlung vom 18.02.2025 und der Mitgliederversammlung des übertragenden Rechtsträgers vom 18.02.2025 mit dem MediationsZentraleHamburg e.V. mit Sitz in Hamburg (Amtsgericht Hamburg VR 20469) verschmolzen worden.\nAls nicht eingetragen wird bekannt gemacht:\nDen Gläubigern der an der Verschmelzung beteiligten Gesellschaften ist, wenn sie binnen sechs Monaten nach dem Tag, an dem die Eintragung der Verschmelzung in das Register des Sitzes desjenigen Rechtsträgers, dessen Gläubiger sie sind, nach § 19 Absatz 3 UmwG als bekannt gemacht gilt, ihren Anspruch nach Grund und Höhe schriftlich anmelden, Sicherheit zu leisten, soweit sie nicht Befriedigung verlangen können. Dieses Recht steht den Gläubigern jedoch nur zu, wenn sie glaubhaft machen, dass durch die Verschmelzung die Erfüllung ihrer Forderung gefährdet wird."
    },
    {
      "date": "2025-08-04",
      "id": "119009",
      "original_text": "Registerbekanntmachung nach dem Umwandlungsgesetz\nBaden-Württemberg Amtsgericht Freiburg HRB 710821\nB+H Managementgesellschaft mbH – Lahr",
      "type": "Registerbekanntmachung nach dem Umwandlungsgesetz",
      "state": "Baden-Württemberg",
      "amtsgericht": "Amtsgericht Freiburg",
      "registernummer": "HRB 710821",
      "registerart": "HRB",
      "company_name": "B+H Managementgesellschaft mbH",
      "company_seat": "Lahr",
      "details": "04.08.2025 (Bekanntmachungsdatum)\n\nBaden-Württemberg Amtsgericht Freiburg HRB 710821\nRegisterbekanntmachung nach dem Umwandlungsgesetz 04.08.2025 (Eintragungsdatum)\n\nB+H Managementgesellschaft mbH\nGesellschaft mit beschränkter Haftung\nLahr\n\nAls nicht eingetragen wird bekanntgemacht:\nDen Gläubigern der an der Verschmelzung beteiligten Rechtsträger ist, wenn sie binnen sechs Monaten nach dem Tag, an dem die Eintragung der Verschmelzung in das Register des Sitzes desjenigen Rechtsträgers, dessen Gläubiger sie sind, nach § 19 Abs. 3 UmwG als bekanntgemacht gilt, ihren Anspruch nach Grund und Höhe schriftlich anmelden, Sicherheit zu leisten, soweit sie nicht Befriedigung verlangen können. Dieses Recht steht den Gläubigern jedoch nur zu, wenn sie glaubhaft machen, dass durch die Verschmelzung die Erfüllung ihrer Forderung gefährdet wird."
    },
    {
      "date": "2025-08-04",
      "id": "119010",
      "original_text": "Registerbekanntmachung nach dem Umwandlungsgesetz\nBaden-Württemberg Amtsgericht Stuttgart HRB 243021\nSchulte Verwaltungs GmbH – Holzgerlingen",
      "type": "Registerbekanntmachung nach dem Umwandlungsgesetz",
      "state": "Baden-Württemberg",
      "amtsgericht": "Amtsgericht Stuttgart",
      "registernummer": "HRB 243021",
      "registerart": "HRB",
      "company_name": "Schulte Verwaltungs GmbH",
      "company_seat": "Holzgerlingen",
      "details": "04.08.2025 (Bekanntmachungsdatum)\n\nBaden-Württemberg Amtsgericht Stuttgart HRB 243021\nRegisterbekanntmachung nach dem Umwandlungsgesetz 04.08.2025 (Eintragungsdatum)\n\nSchulte Verwaltungs GmbH\nGesellschaft mit beschränkter Haftung\nHolzgerlingen\n\nAls nicht eingetragen wird bekanntgemacht:\nDen Gläubigern der an der Verschmelzung beteiligten Rechtsträger ist, wenn sie binnen sechs Monaten nach dem Tag, an dem die Eintragung der Verschmelzung in das Register des Sitzes desjenigen Rechtsträgers, dessen Gläubiger sie sind, nach § 19 Abs. 3 UmwG als bekanntgemacht gilt, ihren Anspruch nach Grund und Höhe schriftlich anmelden, Sicherheit zu leisten, soweit sie nicht Befriedigung verlangen können. Dieses Recht steht den Gläubigern jedoch nur zu, wenn sie glaubhaft machen, dass durch die Verschmelzung die Erfüllung ihrer Forderung gefährdet wird."
    },
    {
      "date": "2025-08-04",
      "id": "119011",
      "original_text": "Löschungsankündigung\nBrandenburg Amtsgericht Potsdam HRB 40467\nTT Automotive Service GmbH – Nuthe-Urstromtal",
      "type": "Löschungsankündigung",
      "state": "Brandenburg",
      "amtsgericht": "Amtsgericht Potsdam",
      "registernummer": "HRB 40467",
      "registerart": "HRB",
      "company_name": "TT Automotive Service GmbH",
      "company_seat": "Nuthe-Urstromtal",
      "details": "04.08.2025 (Bekanntmachungsdatum)\n\nBrandenburg Amtsgericht Potsdam HRB 40467\nLöschungsankündigung\n\nTT Automotive Service GmbH\nGesellschaft mit beschränkter Haftung\nNuthe-Urstromtal\n\nBei der nachstehenden Gesellschaft wird das Amtslöschungsverfahren gemäß § 394 FamFG eingeleitet. Widerspruchsfrist: 8 Wochen."
    },
    {
      "date": "2025-08-04",
      "id": "119012",
      "original_text": "Registerbekanntmachung nach dem Umwandlungsgesetz\nBerlin Amtsgericht Berlin (Charlottenburg) HRB 136355\nBuschmann & Bretzel GmbH Steuerberatungsgesellschaft – Berlin",
      "type": "Registerbekanntmachung nach dem Umwandlungsgesetz",
      "state": "Berlin",
      "amtsgericht": "Amtsgericht Berlin (Charlottenburg)",
      "registernummer": "HRB 136355",
      "registerart": "HRB",
      "company_name": "Buschmann & Bretzel GmbH Steuerberatungsgesellschaft",
      "company_seat": "Berlin",
      "details": "04.08.2025 (Bekanntmachungsdatum)\n\nBerlin Amtsgericht Berlin (Charlottenburg) HRB 136355\nRegisterbekanntmachung nach dem Umwandlungsgesetz 01.08.2025 (Eintragungsdatum)\n\nBuschmann & Bretzel GmbH Steuerberatungsgesellschaft\nGesellschaft mit beschränkter Haftung\nBerlin\n\nZu Eintragungsnummer 4 vom 01.08.2025 wird als nicht eingetragen veröffentlicht: Den Gläubigern der an der Verschmelzung beteiligten Rechtsträger ist, wenn sie binnen sechs Monaten nach dem Tag, an dem die Eintragung der Verschmelzung in das Register des Sitzes desjenigen Rechtsträgers, dessen Gläubiger sie sind, als bekannt gemacht gilt, ihren Anspruch nach Grund und Höhe schriftlich anmelden, Sicherheit zu leisten, soweit sie nicht Befriedigung verlangen können. Dieses Recht steht den Gläubigern jedoch nur zu, wenn sie glaubhaft machen, dass durch die Verschmelzung die Erfüllung ihrer Forderung gefährdet wird. Das Recht, Sicherheitsleistung zu verlangen, steht Gläubigern nicht zu, die im Falle der Insolvenz ein Recht auf vorzugsweise Befriedigung aus einer Deckungsmasse haben, die nach gesetzlicher Vorschrift zu ihrem Schutz errichtet und staatlich überwacht ist."
    },
    {
      "date": "2025-08-04",
      "id": "119013",
      "original_text": "Registerbekanntmachung nach dem Umwandlungsgesetz\nBerlin Amtsgericht Berlin (Charlottenburg) HRB 136382\nBuschmann & Bretzel GmbH Wirtschaftsprüfungsgesellschaft – Berlin",
      "type": "Registerbekanntmachung nach dem Umwandlungsgesetz",
      "state": "Berlin",
      "amtsgericht": "Amtsgericht Berlin (Charlottenburg)",
      "registernummer": "HRB 136382",
      "registerart": "HRB",
      "company_name": "Buschmann & Bretzel GmbH Wirtschaftsprüfungsgesellschaft",
      "company_seat": "Berlin",
      "details": "04.08.2025 (Bekanntmachungsdatum)\n\nBerlin Amtsgericht Berlin (Charlottenburg) HRB 136382\nRegisterbekanntmachung nach dem Umwandlungsgesetz 01.08.2025 (Eintragungsdatum)\n\nBuschmann & Bretzel GmbH Wirtschaftsprüfungsgesellschaft\nGesellschaft mit beschränkter Haftung\nBerlin\n\nZu Eintragungsnummer 3 vom 01.08.2025 wird als nicht eingetragen veröffentlicht: Den Gläubigern der an der Verschmelzung beteiligten Rechtsträger ist, wenn sie binnen sechs Monaten nach dem Tag, an dem die Eintragung der Verschmelzung in das Register des Sitzes desjenigen Rechtsträgers, dessen Gläubiger sie sind, als bekannt gemacht gilt, ihren Anspruch nach Grund und Höhe schriftlich anmelden, Sicherheit zu leisten, soweit sie nicht Befriedigung verlangen können. Dieses Recht steht den Gläubigern jedoch nur zu, wenn sie glaubhaft machen, dass durch die Verschmelzung die Erfüllung ihrer Forderung gefährdet wird. Das Recht, Sicherheitsleistung zu verlangen, steht Gläubigern nicht zu, die im Falle der Insolvenz ein Recht auf vorzugsweise Befriedigung aus einer Deckungsmasse haben, die nach gesetzlicher Vorschrift zu ihrem Schutz errichtet und staatlich überwacht ist."
    },
    {
      "date": "2025-08-04",
      "id": "119014",
      "original_text": "Registerbekanntmachung nach dem Umwandlungsgesetz\nSaarland Amtsgericht Saarbrücken HRA 13702\nEuroflex Logistik e.K. – Oberthal",
      "type": "Registerbekanntmachung nach dem Umwandlungsgesetz",
      "state": "Saarland",
      "amtsgericht": "Amtsgericht Saarbrücken",
      "registernummer": "HRA 13702",
      "registerart": "HRA",
      "company_name": "Euroflex Logistik e.K.",
      "company_seat": "Oberthal",
      "details": "04.08.2025 (Bekanntmachungsdatum)\n\nSaarland Amtsgericht Saarbrücken HRA 13702\nRegisterbekanntmachung nach dem Umwandlungsgesetz 04.08.2025 (Eintragungsdatum)\n\nEuroflex Logistik e.K.\nEinzelkaufmann / Einzelkauffrau\nOberthal\n\nAls nicht eingetragen wird bekannt gemacht: Den Gläubigern der an der Verschmelzung beteiligten Gesellschaften ist, wenn sie binnen sechs Monaten nach dem Tag, an dem die Eintragung der Verschmelzung in das Register des Sitzes desjenigen Rechtsträgers, dessen Gläubiger sie sind, nach § 19 Absatz 3 UmwG bekannt gemacht worden ist, ihren Anspruch nach Grund und Höhe schriftlich anmelden, Sicherheit zu leisten, soweit sie nicht Befriedigung verlangen können. Dieses Recht steht den Gläubigern jedoch nur zu, wenn sie glaubhaft machen, dass durch die Verschmelzung die Erfüllung ihrer Forderung gefährdet wird."
    },
    {
      "date": "2025-08-04",
      "id": "119015",
      "original_text": "Registerbekanntmachung nach dem Umwandlungsgesetz\nHamburg Amtsgericht Hamburg HRB 132565\nEpilog Vermögensverwaltungs AG – Hamburg",
      "type": "Registerbekanntmachung nach dem Umwandlungsgesetz",
      "state": "Hamburg",
      "amtsgericht": "Amtsgericht Hamburg",
      "registernummer": "HRB 132565",
      "registerart": "HRB",
      "company_name": "Epilog Vermögensverwaltungs AG",
      "company_seat": "Hamburg",
      "details": "04.08.2025 (Bekanntmachungsdatum)\n\nHamburg Amtsgericht Hamburg HRB 132565\nRegisterbekanntmachung nach dem Umwandlungsgesetz 04.08.2025 (Eintragungsdatum)\n\nEpilog Vermögensverwaltungs AG\nAktiengesellschaft\nHamburg\n\nAls nicht eingetragen wird bekannt gemacht:\nDen Gläubigern der an der Verschmelzung beteiligten Gesellschaften ist, wenn sie binnen sechs Monaten nach dem Tag, an dem die Eintragung der Verschmelzung in das Register des Sitzes desjenigen Rechtsträgers, dessen Gläubiger sie sind, nach § 19 Absatz 3 UmwG als bekannt gemacht gilt, ihren Anspruch nach Grund und Höhe schriftlich anmelden, Sicherheit zu leisten, soweit sie nicht Befriedigung verlangen können. Dieses Recht steht den Gläubigern jedoch nur zu, wenn sie glaubhaft machen, dass durch die Verschmelzung die Erfüllung ihrer Forderung gefährdet wird."
    },
    {
      "date": "2025-08-04",
      "id": "119016",
      "original_text": "Registerbekanntmachung nach dem Umwandlungsgesetz\nHamburg Amtsgericht Hamburg HRB 189215\nProjektentwicklung Hofgartengarage in Düsseldorf GmbH – Hamburg",
      "type": "Registerbekanntmachung nach dem Umwandlungsgesetz",
      "state": "Hamburg",
      "amtsgericht": "Amtsgericht Hamburg",
      "registernummer": "HRB 189215",
      "registerart": "HRB",
      "company_name": "Projektentwicklung Hofgartengarage in Düsseldorf GmbH",
      "company_seat": "Hamburg",
      "details": "04.08.2025 (Bekanntmachungsdatum)\n\nHamburg Amtsgericht Hamburg HRB 189215\nRegisterbekanntmachung nach dem Umwandlungsgesetz 04.08.2025 (Eintragungsdatum)\n\nProjektentwicklung Hofgartengarage in Düsseldorf GmbH\nGesellschaft mit beschränkter Haftung\nHamburg\n\nAls nicht eingetragen wird bekannt gemacht:\nDen Gläubigern der an der Verschmelzung beteiligten Gesellschaften ist, wenn sie binnen sechs Monaten nach dem Tag, an dem die Eintragung der Verschmelzung in das Register des Sitzes desjenigen Rechtsträgers, dessen Gläubiger sie sind, nach § 19 Absatz 3 UmwG als bekannt gemacht gilt, ihren Anspruch nach Grund und Höhe schriftlich anmelden, Sicherheit zu leisten, soweit sie nicht Befriedigung verlangen können. Dieses Recht steht den Gläubigern jedoch nur zu, wenn sie glaubhaft machen, dass durch die Verschmelzung die Erfüllung ihrer Forderung gefährdet wird."
    },
    {
      "date": "2025-08-04",
      "id": "119017",
      "original_text": "Registerbekanntmachung nach dem Umwandlungsgesetz\nHamburg Amtsgericht Hamburg HRB 72462\nPinechip Capital GmbH – Hamburg",
      "type": "Registerbekanntmachung nach dem Umwandlungsgesetz",
      "state": "Hamburg",
      "amtsgericht": "Amtsgericht Hamburg",
      "registernummer": "HRB 72462",
      "registerart": "HRB",
      "company_name": "Pinechip Capital GmbH",
      "company_seat": "Hamburg",
      "details": "04.08.2025 (Bekanntmachungsdatum)\n\nHamburg Amtsgericht Hamburg HRB 72462\nRegisterbekanntmachung nach dem Umwandlungsgesetz 04.08.2025 (Eintragungsdatum)\n\nPinechip Capital GmbH\nGesellschaft mit beschränkter Haftung\nHamburg\n\nAls nicht eingetragen wird bekannt gemacht:\nDen Gläubigern der an der Verschmelzung beteiligten Gesellschaften ist, wenn sie binnen sechs Monaten nach dem Tag, an dem die Eintragung der Verschmelzung in das Register des Sitzes desjenigen Rechtsträgers, dessen Gläubiger sie sind, nach § 19 Absatz 3 UmwG als bekannt gemacht gilt, ihren Anspruch nach Grund und Höhe schriftlich anmelden, Sicherheit zu leisten, soweit sie nicht Befriedigung verlangen können. Dieses Recht steht den Gläubigern jedoch nur zu, wenn sie glaubhaft machen, dass durch die Verschmelzung die Erfüllung ihrer Forderung gefährdet wird."
    },
    {
      "date": "2025-08-04",
      "id": "119018",
      "original_text": "Registerbekanntmachung nach dem Umwandlungsgesetz\nBerlin Amtsgericht Berlin (Charlottenburg) HRB 146744\nDDB Germany Group of Companies GmbH – Berlin",
      "type": "Registerbekanntmachung nach dem Umwandlungsgesetz",
      "state": "Berlin",
      "amtsgericht": "Amtsgericht Berlin (Charlottenburg)",
      "registernummer": "HRB 146744",
      "registerart": "HRB",
      "company_name": "DDB Germany Group of Companies GmbH",
      "company_seat": "Berlin",
      "details": "04.08.2025 (Bekanntmachungsdatum)\n\nBerlin Amtsgericht Berlin (Charlottenburg) HRB 146744\nRegisterbekanntmachung nach dem Umwandlungsgesetz 01.08.2025 (Eintragungsdatum)\n\nDDB Germany Group of Companies GmbH\nGesellschaft mit beschränkter Haftung\nBerlin\n\nZu Eintragungsnummer 41 vom 01.08.2025 wird als nicht eingetragen veröffentlicht:\n\nDen Gläubigern der an der Verschmelzung beteiligten Rechtsträger ist, wenn sie binnen sechs Monaten nach dem Tag, an dem die Eintragung der Verschmelzung in das Register des Sitzes desjenigen Rechtsträgers, dessen Gläubiger sie sind, als bekannt gemacht gilt, ihren Anspruch nach Grund und Höhe schriftlich anmelden, Sicherheit zu leisten, soweit sie nicht Befriedigung verlangen können. Dieses Recht steht den Gläubigern jedoch nur zu, wenn sie glaubhaft machen, dass durch die Verschmelzung die Erfüllung ihrer Forderung gefährdet wird. Das Recht, Sicherheitsleistung zu verlangen, steht Gläubigern nicht zu, die im Falle der Insolvenz ein Recht auf vorzugsweise Befriedigung aus einer Deckungsmasse haben, die nach gesetzlicher Vorschrift zu ihrem Schutz errichtet und staatlich überwacht ist."
    },
    {
      "date": "2025-08-04",
      "id": "119019",
      "original_text": "Löschungsankündigung\nBaden-Württemberg Amtsgericht Stuttgart HRB 784333\n4EL UG (haftungsbeschränkt) – Esslingen am Neckar",
      "type": "Löschungsankündigung",
      "state": "Baden-Württemberg",
      "amtsgericht": "Amtsgericht Stuttgart",
      "registernummer": "HRB 784333",
      "registerart": "HRB",
      "company_name": "4EL UG (haftungsbeschränkt)",
      "company_seat": "Esslingen am Neckar",
      "details": "04.08.2025 (Bekanntmachungsdatum)\n\nBaden-Württemberg Amtsgericht Stuttgart HRB 784333\nLöschungsankündigung\n\n4EL UG (haftungsbeschränkt)\nGesellschaft mit beschränkter Haftung\nEsslingen am Neckar\n\nAls nicht eingetragen wird bekanntgemacht:\nDas Gericht beabsichtigt, die Gesellschaft wegen Vermögenslosigkeit im Handelsregister von Amts wegen nach § 394 FamFG zu löschen. Die Frist zur Geltendmachung eines Widerspruchs gegen die beabsichtigte Löschung ist auf zwei Monate ab Veröffentlichung bestimmt."
    },
    {
      "date": "2025-08-04",
      "id": "119020",
      "original_text": "Registerbekanntmachung nach dem Umwandlungsgesetz\nBaden-Württemberg Amtsgericht Mannheim HRB 742433\nJM Invest GmbH – Karlsruhe",
      "type": "Registerbekanntmachung nach dem Umwandlungsgesetz",
      "state": "Baden-Württemberg",
      "amtsgericht": "Amtsgericht Mannheim",
      "registernummer": "HRB 742433",
      "registerart": "HRB",
      "company_name": "JM Invest GmbH",
      "company_seat": "Karlsruhe",
      "details": "04.08.2025 (Bekanntmachungsdatum)\n\nBaden-Württemberg Amtsgericht Mannheim HRB 742433\nRegisterbekanntmachung nach dem Umwandlungsgesetz 04.08.2025 (Eintragungsdatum)\n\nJM Invest GmbH\nGesellschaft mit beschränkter Haftung\nKarlsruhe\n\nAls nicht eingetragen wird bekanntgemacht:\nDen Gläubigern der an der Verschmelzung beteiligten Rechtsträger ist, wenn sie binnen sechs Monaten nach dem Tag, an dem die Eintragung der Verschmelzung in das Register des Sitzes desjenigen Rechtsträgers, dessen Gläubiger sie sind, nach § 19 Abs. 3 UmwG als bekanntgemacht gilt, ihren Anspruch nach Grund und Höhe schriftlich anmelden, Sicherheit zu leisten, soweit sie nicht Befriedigung verlangen können. Dieses Recht steht den Gläubigern jedoch nur zu, wenn sie glaubhaft machen, dass durch die Verschmelzung die Erfüllung ihrer Forderung gefährdet wird."
    },
    {
      "date": "2025-08-04",
      "id": "119021",
      "original_text": "Registerbekanntmachung nach dem Umwandlungsgesetz\nSaarland Amtsgericht Saarbrücken HRB 111449\nEuroflex Logistik GmbH – Oberthal",
      "type": "Registerbekanntmachung nach dem Umwandlungsgesetz",
      "state": "Saarland",
      "amtsgericht": "Amtsgericht Saarbrücken",
      "registernummer": "HRB 111449",
      "registerart": "HRB",
      "company_name": "Euroflex Logistik GmbH",
      "company_seat": "Oberthal",
      "details": "04.08.2025 (Bekanntmachungsdatum)\n\nSaarland Amtsgericht Saarbrücken HRB 111449\nRegisterbekanntmachung nach dem Umwandlungsgesetz 04.08.2025 (Eintragungsdatum)\n\nEuroflex Logistik GmbH\nGesellschaft mit beschränkter Haftung\nOberthal\n\nAls nicht eingetragen wird bekannt gemacht: Den Gläubigern der an der Verschmelzung beteiligten Gesellschaften ist, wenn sie binnen sechs Monaten nach dem Tag, an dem die Eintragung der Verschmelzung in das Register des Sitzes desjenigen Rechtsträgers, dessen Gläubiger sie sind, nach § 19 Absatz 3 UmwG bekannt gemacht worden ist, ihren Anspruch nach Grund und Höhe schriftlich anmelden, Sicherheit zu leisten, soweit sie nicht Befriedigung verlangen können. Dieses Recht steht den Gläubigern jedoch nur zu, wenn sie glaubhaft machen, dass durch die Verschmelzung die Erfüllung ihrer Forderung gefährdet wird."
    },
    {
      "date": "2025-08-04",
      "id": "119022",
      "original_text": "Löschungsankündigung\nBrandenburg Amtsgericht Potsdam HRB 37296\nRW SUN Solartechnik GmbH – Zossen",
      "type": "Löschungsankündigung",
      "state": "Brandenburg",
      "amtsgericht": "Amtsgericht Potsdam",
      "registernummer": "HRB 37296",
      "registerart": "HRB",
      "company_name": "RW SUN Solartechnik GmbH",
      "company_seat": "Zossen",
      "details": "04.08.2025 (Bekanntmachungsdatum)\n\nBrandenburg Amtsgericht Potsdam HRB 37296\nLöschungsankündigung\n\nRW SUN Solartechnik GmbH\nGesellschaft mit beschränkter Haftung\nZossen\n\nBei der nachstehenden Gesellschaft wird das Amtslöschungsverfahren gemäß § 394 FamFG eingeleitet. Widerspruchsfrist: 8 Wochen."
    },
    {
      "date": "2025-08-04",
      "id": "119023",
      "original_text": "Registerbekanntmachung nach dem Umwandlungsgesetz\nBerlin Amtsgericht Berlin (Charlottenburg) HRB 91703\nDDB Group GmbH – Berlin",
      "type": "Registerbekanntmachung nach dem Umwandlungsgesetz",
      "state": "Berlin",
      "amtsgericht": "Amtsgericht Berlin (Charlottenburg)",
      "registernummer": "HRB 91703",
      "registerart": "HRB",
      "company_name": "DDB Group GmbH",
      "company_seat": "Berlin",
      "details": "04.08.2025 (Bekanntmachungsdatum)\n\nBerlin Amtsgericht Berlin (Charlottenburg) HRB 91703\nRegisterbekanntmachung nach dem Umwandlungsgesetz 01.08.2025 (Eintragungsdatum)\n\nDDB Group GmbH\nGesellschaft mit beschränkter Haftung\nBerlin\n\nZu Eintragungsnummer 52 vom 01.08.2025 wird als nicht eingetragen veröffentlicht:\n\nDen Gläubigern der an der Verschmelzung beteiligten Rechtsträger ist, wenn sie binnen sechs Monaten nach dem Tag, an dem die Eintragung der Verschmelzung in das Register des Sitzes desjenigen Rechtsträgers, dessen Gläubiger sie sind, als bekannt gemacht gilt, ihren Anspruch nach Grund und Höhe schriftlich anmelden, Sicherheit zu leisten, soweit sie nicht Befriedigung verlangen können. Dieses Recht steht den Gläubigern jedoch nur zu, wenn sie glaubhaft machen, dass durch die Verschmelzung die Erfüllung ihrer Forderung gefährdet wird. Das Recht, Sicherheitsleistung zu verlangen, steht Gläubigern nicht zu, die im Falle der Insolvenz ein Recht auf vorzugsweise Befriedigung aus einer Deckungsmasse haben, die nach gesetzlicher Vorschrift zu ihrem Schutz errichtet und staatlich überwacht ist."
    },
    {
      "date": "2025-08-04",
      "id": "119024",
      "original_text": "Registerbekanntmachung nach dem Umwandlungsgesetz\nBaden-Württemberg Amtsgericht Mannheim HRB 714217\nADWEKO Consulting GmbH – Walldorf",
      "type": "Registerbekanntmachung nach dem Umwandlungsgesetz",
      "state": "Baden-Württemberg",
      "amtsgericht": "Amtsgericht Mannheim",
      "registernummer": "HRB 714217",
      "registerart": "HRB",
      "company_name": "ADWEKO Consulting GmbH",
      "company_seat": "Walldorf",
      "details": "04.08.2025 (Bekanntmachungsdatum)\n\nBaden-Württemberg Amtsgericht Mannheim HRB 714217\nRegisterbekanntmachung nach dem Umwandlungsgesetz 04.08.2025 (Eintragungsdatum)\n\nADWEKO Consulting GmbH\nGesellschaft mit beschränkter Haftung\nWalldorf\n\nDen Gläubigern der an der Verschmelzung beteiligten Rechtsträger ist, wenn sie binnen sechs Monaten nach dem Tag, an dem die Eintragung der Verschmelzung in das Register des Sitzes desjenigen Rechtsträgers, dessen Gläubiger sie sind, nach § 19 Abs. 3 UmwG als bekanntgemacht gilt, ihren Anspruch nach Grund und Höhe schriftlich anmelden, Sicherheit zu leisten, soweit sie nicht Befriedigung verlangen können. Dieses Recht steht den Gläubigern jedoch nur zu, wenn sie glaubhaft machen, dass durch die Verschmelzung die Erfüllung ihrer Forderung gefährdet wird."
    },
    {
      "date": "2025-08-04",
      "id": "119025",
      "original_text": "Registerbekanntmachung nach dem Umwandlungsgesetz\nBerlin Amtsgericht Berlin (Charlottenburg) HRB 152396\nAERTiCKET Consolidator Holding GmbH – Berlin",
      "type": "Registerbekanntmachung nach dem Umwandlungsgesetz",
      "state": "Berlin",
      "amtsgericht": "Amtsgericht Berlin (Charlottenburg)",
      "registernummer": "HRB 152396",
      "registerart": "HRB",
      "company_name": "AERTiCKET Consolidator Holding GmbH",
      "company_seat": "Berlin",
      "details": "04.08.2025 (Bekanntmachungsdatum)\n\nBerlin Amtsgericht Berlin (Charlottenburg) HRB 152396\nRegisterbekanntmachung nach dem Umwandlungsgesetz 31.07.2025 (Eintragungsdatum)\n\nAERTiCKET Consolidator Holding GmbH\nGesellschaft mit beschränkter Haftung\nBerlin\n\nZu Eintragungsnummer 20 vom 31.07.2025 wird als nicht eingetragen veröffentlicht: Den Gläubigern der an der Verschmelzung beteiligten Rechtsträger ist, wenn sie binnen sechs Monaten nach dem Tag, an dem die Eintragung der Verschmelzung in das Register des Sitzes desjenigen Rechtsträgers, dessen Gläubiger sie sind, als bekannt gemacht gilt, ihren Anspruch nach Grund und Höhe schriftlich anmelden, Sicherheit zu leisten, soweit sie nicht Befriedigung verlangen können. Dieses Recht steht den Gläubigern jedoch nur zu, wenn sie glaubhaft machen, dass durch die Verschmelzung die Erfüllung ihrer Forderung gefährdet wird. Das Recht, Sicherheitsleistung zu verlangen, steht Gläubigern nicht zu, die im Falle der Insolvenz ein Recht auf vorzugsweise Befriedigung aus einer Deckungsmasse haben, die nach gesetzlicher Vorschrift zu ihrem Schutz errichtet und staatlich überwacht ist."
    },
    {
      "date": "2025-08-04",
      "id": "119026",
      "original_text": "Löschungsankündigung\nBerlin Amtsgericht Berlin (Charlottenburg) HRB 187383\nCellarius Europe UG (haftungsbeschränkt) – Berlin",
      "type": "Löschungsankündigung",
      "state": "Berlin",
      "amtsgericht": "Amtsgericht Berlin (Charlottenburg)",
      "registernummer": "HRB 187383",
      "registerart": "HRB",
      "company_name": "Cellarius Europe UG (haftungsbeschränkt)",
      "company_seat": "Berlin",
      "details": "04.08.2025 (Bekanntmachungsdatum)\n\nBerlin Amtsgericht Berlin (Charlottenburg) HRB 187383\nLöschungsankündigung\n\nCellarius Europe UG (haftungsbeschränkt)\nGesellschaft mit beschränkter Haftung\nBerlin\n\nBei der nachstehenden Gesellschaft wird das Amtslöschungsverfahren gemäß § 394 FamFG eingeleitet. Widerspruchsfrist 6 Wochen"
    },
    {
      "date": "2025-08-04",
      "id": "119027",
      "original_text": "Registerbekanntmachung nach dem Umwandlungsgesetz\nSchleswig-Holstein Amtsgericht Kiel HRA 12781\nGregor Prahl e.K. – Itzstedt",
      "type": "Registerbekanntmachung nach dem Umwandlungsgesetz",
      "state": "Schleswig-Holstein",
      "amtsgericht": "Amtsgericht Kiel",
      "registernummer": "HRA 12781",
      "registerart": "HRA",
      "company_name": "Gregor Prahl e.K.",
      "company_seat": "Itzstedt",
      "details": "04.08.2025 (Bekanntmachungsdatum)\n\nSchleswig-Holstein Amtsgericht Kiel HRA 12781\nRegisterbekanntmachung nach dem Umwandlungsgesetz 31.07.2025 (Eintragungsdatum)\n\nGregor Prahl e.K.\nEinzelkaufmann / Einzelkauffrau\nItzstedt\n\nZu Eintragungsnummer 2 vom 31.07.2025 wird als nicht eingetragen veröffentlicht:\nDen Gläubigern der an der Spaltung beteiligten Rechtsträger ist, wenn sie binnen sechs Monaten nach dem Tag, an dem die Eintragung der Spaltung in das Register des Sitzes desjenigen Rechtsträgers, dessen Gläubiger sie sind,  bekannt gemacht worden ist, ihren Anspruch nach Grund und Höhe schriftlich anmelden, Sicherheit zu leisten, soweit sie nicht Befriedigung verlangen können. Dieses Recht steht den Gläubigern jedoch nur zu, wenn sie glaubhaft machen, dass durch die Spaltung die Erfüllung ihrer Forderung gefährdet wird."
    },
    {
      "date": "2025-08-04",
      "id": "119028",
      "original_text": "Einreichung neuer Dokumente\nBaden-Württemberg Amtsgericht Freiburg HRB 708839\nFSM AG – Kirchzarten",
      "type": "Einreichung neuer Dokumente",
      "state": "Baden-Württemberg",
      "amtsgericht": "Amtsgericht Freiburg",
      "registernummer": "HRB 708839",
      "registerart": "HRB",
      "company_name": "FSM AG",
      "company_seat": "Kirchzarten",
      "details": "04.08.2025 (Bekanntmachungsdatum)\n\nBaden-Württemberg Amtsgericht Freiburg HRB 708839\nEinreichung neuer Dokumente\n\nFSM AG\nAktiengesellschaft\nKirchzarten\n\nDie Gesellschaft hat am 01.08.2025 zwei Listen über die Zusammensetzung des Aufsichtsrats zum Handelsregister eingereicht."
    },
    {
      "date": "2025-08-04",
      "id": "119029",
      "original_text": "Registerbekanntmachung nach dem Umwandlungsgesetz\nSchleswig-Holstein Amtsgericht Kiel HRB 1498 PL\nNordland Spedition GmbH – Preetz",
      "type": "Registerbekanntmachung nach dem Umwandlungsgesetz",
      "state": "Schleswig-Holstein",
      "amtsgericht": "Amtsgericht Kiel",
      "registernummer": "HRB 1498 PL",
      "registerart": "HRB",
      "company_name": "Nordland Spedition GmbH",
      "company_seat": "Preetz",
      "details": "04.08.2025 (Bekanntmachungsdatum)\n\nSchleswig-Holstein Amtsgericht Kiel HRB 1498 PL\nRegisterbekanntmachung nach dem Umwandlungsgesetz 01.08.2025 (Eintragungsdatum)\n\nNordland Spedition GmbH\nGesellschaft mit beschränkter Haftung\nPreetz\n\nZu Eintragungsnummer 25 vom 01.08.2025 wird als nicht eingetragen veröffentlicht: Den Gläubigern der an der Verschmelzung beteiligten Rechtsträger ist, wenn sie binnen sechs Monaten nach dem Tag, an dem die Eintragung der Verschmelzung in das Register des Sitzes desjenigen Rechtsträgers, dessen Gläubiger sie sind, nach § 19 Abs. 3 UmwG bekannt gemacht worden ist, ihren Anspruch nach Grund und Höhe schriftlich anmelden, Sicherheit zu leisten, soweit sie nicht Befriedigung verlangen können. Dieses Recht steht den Gläubigern jedoch nur zu, wenn sie glaubhaft machen, dass durch die Verschmelzung die Erfüllung ihrer Forderung gefährdet wird."
    },
    {
      "date": "2025-08-04",
      "id": "119030",
      "original_text": "Registerbekanntmachung nach dem Umwandlungsgesetz\nHamburg Amtsgericht Hamburg HRB 187617\nIT POP GmbH – Hamburg",
      "type": "Registerbekanntmachung nach dem Umwandlungsgesetz",
      "state": "Hamburg",
      "amtsgericht": "Amtsgericht Hamburg",
      "registernummer": "HRB 187617",
      "registerart": "HRB",
      "company_name": "IT POP GmbH",
      "company_seat": "Hamburg",
      "details": "04.08.2025 (Bekanntmachungsdatum)\n\nHamburg Amtsgericht Hamburg HRB 187617\nRegisterbekanntmachung nach dem Umwandlungsgesetz 04.08.2025 (Eintragungsdatum)\n\nIT POP GmbH\nGesellschaft mit beschränkter Haftung\nHamburg\n\nAls nicht eingetragen wird bekannt gemacht:\nDen Gläubigern der an der Verschmelzung beteiligten Gesellschaften ist, wenn sie binnen sechs Monaten nach dem Tag, an dem die Eintragung der Verschmelzung in das Register des Sitzes desjenigen Rechtsträgers, dessen Gläubiger sie sind, nach § 19 Absatz 3 UmwG als bekannt gemacht gilt, ihren Anspruch nach Grund und Höhe schriftlich anmelden, Sicherheit zu leisten, soweit sie nicht Befriedigung verlangen können. Dieses Recht steht den Gläubigern jedoch nur zu, wenn sie glaubhaft machen, dass durch die Verschmelzung die Erfüllung ihrer Forderung gefährdet wird."
    },
    {
      "date": "2025-08-04",
      "id": "119031",
      "original_text": "Registerbekanntmachung nach dem Umwandlungsgesetz\nHamburg Amtsgericht Hamburg HRB 186281\nSosna Companies GmbH – Hamburg",
      "type": "Registerbekanntmachung nach dem Umwandlungsgesetz",
      "state": "Hamburg",
      "amtsgericht": "Amtsgericht Hamburg",
      "registernummer": "HRB 186281",
      "registerart": "HRB",
      "company_name": "Sosna Companies GmbH",
      "company_seat": "Hamburg",
      "details": "04.08.2025 (Bekanntmachungsdatum)\n\nHamburg Amtsgericht Hamburg HRB 186281\nRegisterbekanntmachung nach dem Umwandlungsgesetz 04.08.2025 (Eintragungsdatum)\n\nSosna Companies GmbH\nGesellschaft mit beschränkter Haftung\nHamburg\n\nAls nicht eingetragen wird bekannt gemacht:\nDen Gläubigern der an der Verschmelzung beteiligten Gesellschaften ist, wenn sie binnen sechs Monaten nach dem Tag, an dem die Eintragung der Verschmelzung in das Register des Sitzes desjenigen Rechtsträgers, dessen Gläubiger sie sind, nach § 19 Absatz 3 UmwG als bekannt gemacht gilt, ihren Anspruch nach Grund und Höhe schriftlich anmelden, Sicherheit zu leisten, soweit sie nicht Befriedigung verlangen können. Dieses Recht steht den Gläubigern jedoch nur zu, wenn sie glaubhaft machen, dass durch die Verschmelzung die Erfüllung ihrer Forderung gefährdet wird."
    },
    {
      "date": "2025-08-04",
      "id": "119032",
      "original_text": "Registerbekanntmachung nach dem Umwandlungsgesetz\nBaden-Württemberg Amtsgericht Mannheim HRB 740233\nHPC Trading GmbH – Schwetzingen",
      "type": "Registerbekanntmachung nach dem Umwandlungsgesetz",
      "state": "Baden-Württemberg",
      "amtsgericht": "Amtsgericht Mannheim",
      "registernummer": "HRB 740233",
      "registerart": "HRB",
      "company_name": "HPC Trading GmbH",
      "company_seat": "Schwetzingen",
      "details": "04.08.2025 (Bekanntmachungsdatum)\n\nBaden-Württemberg Amtsgericht Mannheim HRB 740233\nRegisterbekanntmachung nach dem Umwandlungsgesetz 04.08.2025 (Eintragungsdatum)\n\nHPC Trading GmbH\nGesellschaft mit beschränkter Haftung\nSchwetzingen\n\nAls nicht eingetragen wird bekanntgemacht:\nDen Gläubigern der an der Verschmelzung beteiligten Rechtsträger ist, wenn sie binnen sechs Monaten nach dem Tag, an dem die Eintragung der Verschmelzung in das Register des Sitzes desjenigen Rechtsträgers, dessen Gläubiger sie sind, nach § 19 Abs. 3 UmwG als bekanntgemacht gilt, ihren Anspruch nach Grund und Höhe schriftlich anmelden, Sicherheit zu leisten, soweit sie nicht Befriedigung verlangen können. Dieses Recht steht den Gläubigern jedoch nur zu, wenn sie glaubhaft machen, dass durch die Verschmelzung die Erfüllung ihrer Forderung gefährdet wird."
    },
    {
      "date": "2025-08-04",
      "id": "119033",
      "original_text": "Registerbekanntmachung nach dem Umwandlungsgesetz\nHamburg Amtsgericht Hamburg HRA 84843\nDr. Detlef Strathmann Verwaltungs GmbH & Co. KG – Hamburg",
      "type": "Registerbekanntmachung nach dem Umwandlungsgesetz",
      "state": "Hamburg",
      "amtsgericht": "Amtsgericht Hamburg",
      "registernummer": "HRA 84843",
      "registerart": "HRA",
      "company_name": "Dr. Detlef Strathmann Verwaltungs GmbH & Co. KG",
      "company_seat": "Hamburg",
      "details": "04.08.2025 (Bekanntmachungsdatum)\n\nHamburg Amtsgericht Hamburg HRA 84843\nRegisterbekanntmachung nach dem Umwandlungsgesetz 04.08.2025 (Eintragungsdatum)\n\nDr. Detlef Strathmann Verwaltungs GmbH & Co. KG\nKommanditgesellschaft\nHamburg\n\nAls nicht eingetragen wird bekannt gemacht:\nDen Gläubigern der an der Verschmelzung beteiligten Gesellschaften ist, wenn sie binnen sechs Monaten nach dem Tag, an dem die Eintragung der Verschmelzung in das Register des Sitzes desjenigen Rechtsträgers, dessen Gläubiger sie sind, nach § 19 Absatz 3 UmwG als bekannt gemacht gilt, ihren Anspruch nach Grund und Höhe schriftlich anmelden, Sicherheit zu leisten, soweit sie nicht Befriedigung verlangen können. Dieses Recht steht den Gläubigern jedoch nur zu, wenn sie glaubhaft machen, dass durch die Verschmelzung die Erfüllung ihrer Forderung gefährdet wird."
    },
    {
      "date": "2025-08-04",
      "id": "119034",
      "original_text": "Registerbekanntmachung nach dem Umwandlungsgesetz\nHamburg Amtsgericht Hamburg HRB 176796\nStrathmann Verwaltungs GmbH – Hamburg",
      "type": "Registerbekanntmachung nach dem Umwandlungsgesetz",
      "state": "Hamburg",
      "amtsgericht": "Amtsgericht Hamburg",
      "registernummer": "HRB 176796",
      "registerart": "HRB",
      "company_name": "Strathmann Verwaltungs GmbH",
      "company_seat": "Hamburg",
      "details": "04.08.2025 (Bekanntmachungsdatum)\n\nHamburg Amtsgericht Hamburg HRB 176796\nRegisterbekanntmachung nach dem Umwandlungsgesetz 04.08.2025 (Eintragungsdatum)\n\nStrathmann Verwaltungs GmbH\nGesellschaft mit beschränkter Haftung\nHamburg\n\nAls nicht eingetragen wird bekannt gemacht:\nDen Gläubigern der an der Verschmelzung beteiligten Gesellschaften ist, wenn sie binnen sechs Monaten nach dem Tag, an dem die Eintragung der Verschmelzung in das Register des Sitzes desjenigen Rechtsträgers, dessen Gläubiger sie sind, nach § 19 Absatz 3 UmwG als bekannt gemacht gilt, ihren Anspruch nach Grund und Höhe schriftlich anmelden, Sicherheit zu leisten, soweit sie nicht Befriedigung verlangen können. Dieses Recht steht den Gläubigern jedoch nur zu, wenn sie glaubhaft machen, dass durch die Verschmelzung die Erfüllung ihrer Forderung gefährdet wird."
    },
    {
      "date": "2025-08-04",
      "id": "119035",
      "original_text": "Registerbekanntmachung nach dem Umwandlungsgesetz\nHamburg Amtsgericht Hamburg HRB 110466\nOMERGY GmbH – Hamburg",
      "type": "Registerbekanntmachung nach dem Umwandlungsgesetz",
      "state": "Hamburg",
      "amtsgericht": "Amtsgericht Hamburg",
      "registernummer": "HRB 110466",
      "registerart": "HRB",
      "company_name": "OMERGY GmbH",
      "company_seat": "Hamburg",
      "details": "04.08.2025 (Bekanntmachungsdatum)\n\nHamburg Amtsgericht Hamburg HRB 110466\nRegisterbekanntmachung nach dem Umwandlungsgesetz 31.07.2025 (Eintragungsdatum)\n\nOMERGY GmbH\nGesellschaft mit beschränkter Haftung\nHamburg\n\nAls nicht eingetragen wird bekannt gemacht:\nDen Gläubigern der an der Verschmelzung beteiligten Gesellschaften ist, wenn sie binnen sechs Monaten nach dem Tag, an dem die Eintragung der Verschmelzung in das Register des Sitzes desjenigen Rechtsträgers, dessen Gläubiger sie sind, nach § 19 Absatz 3 UmwG als bekannt gemacht gilt, ihren Anspruch nach Grund und Höhe schriftlich anmelden, Sicherheit zu leisten, soweit sie nicht Befriedigung verlangen können. Dieses Recht steht den Gläubigern jedoch nur zu, wenn sie glaubhaft machen, dass durch die Verschmelzung die Erfüllung ihrer Forderung gefährdet wird."
    },
    {
      "date": "2025-08-04",
      "id": "119036",
      "original_text": "Registerbekanntmachung nach dem Umwandlungsgesetz\nBaden-Württemberg Amtsgericht Ulm HRB 742525\nHERZBERG Genuss GmbH – Uhingen",
      "type": "Registerbekanntmachung nach dem Umwandlungsgesetz",
      "state": "Baden-Württemberg",
      "amtsgericht": "Amtsgericht Ulm",
      "registernummer": "HRB 742525",
      "registerart": "HRB",
      "company_name": "HERZBERG Genuss GmbH",
      "company_seat": "Uhingen",
      "details": "04.08.2025 (Bekanntmachungsdatum)\n\nBaden-Württemberg Amtsgericht Ulm HRB 742525\nRegisterbekanntmachung nach dem Umwandlungsgesetz 04.08.2025 (Eintragungsdatum)\n\nHERZBERG Genuss GmbH\nGesellschaft mit beschränkter Haftung\nUhingen\n\nAls nicht eingetragen wird bekanntgemacht:\nDen Gläubigern der an der Verschmelzung beteiligten Rechtsträger ist, wenn sie binnen sechs Monaten nach dem Tag, an dem die Eintragung der Verschmelzung in das Register des Sitzes desjenigen Rechtsträgers, dessen Gläubiger sie sind, nach § 19 Abs. 3 UmwG als bekanntgemacht gilt, ihren Anspruch nach Grund und Höhe schriftlich anmelden, Sicherheit zu leisten, soweit sie nicht Befriedigung verlangen können. Dieses Recht steht den Gläubigern jedoch nur zu, wenn sie glaubhaft machen, dass durch die Verschmelzung die Erfüllung ihrer Forderung gefährdet wird."
    },
    {
      "date": "2025-08-04",
      "id": "119037",
      "original_text": "Registerbekanntmachung nach dem Umwandlungsgesetz\nBaden-Württemberg Amtsgericht Ulm HRB 723015\nFit & Fun Fitness- und Freizeitcenter GmbH – Göppingen",
      "type": "Registerbekanntmachung nach dem Umwandlungsgesetz",
      "state": "Baden-Württemberg",
      "amtsgericht": "Amtsgericht Ulm",
      "registernummer": "HRB 723015",
      "registerart": "HRB",
      "company_name": "Fit & Fun Fitness- und Freizeitcenter GmbH",
      "company_seat": "Göppingen",
      "details": "04.08.2025 (Bekanntmachungsdatum)\n\nBaden-Württemberg Amtsgericht Ulm HRB 723015\nRegisterbekanntmachung nach dem Umwandlungsgesetz 04.08.2025 (Eintragungsdatum)\n\nFit & Fun Fitness- und Freizeitcenter GmbH\nGesellschaft mit beschränkter Haftung\nGöppingen\n\nAls nicht eingetragen wird bekanntgemacht:\nDen Gläubigern der an der Verschmelzung beteiligten Rechtsträger ist, wenn sie binnen sechs Monaten nach dem Tag, an dem die Eintragung der Verschmelzung in das Register des Sitzes desjenigen Rechtsträgers, dessen Gläubiger sie sind, nach § 19 Abs. 3 UmwG als bekanntgemacht gilt, ihren Anspruch nach Grund und Höhe schriftlich anmelden, Sicherheit zu leisten, soweit sie nicht Befriedigung verlangen können. Dieses Recht steht den Gläubigern jedoch nur zu, wenn sie glaubhaft machen, dass durch die Verschmelzung die Erfüllung ihrer Forderung gefährdet wird."
    },
    {
      "date": "2025-08-04",
      "id": "119038",
      "original_text": "Sonstige Registerbekanntmachung\nBaden-Württemberg Amtsgericht Ulm HRB 726246\nGesundheitszentren des Landkreises Göppingen GmbH – Göppingen",
      "type": "Sonstige Registerbekanntmachung",
      "state": "Baden-Württemberg",
      "amtsgericht": "Amtsgericht Ulm",
      "registernummer": "HRB 726246",
      "registerart": "HRB",
      "company_name": "Gesundheitszentren des Landkreises Göppingen GmbH",
      "company_seat": "Göppingen",
      "details": "04.08.2025 (Bekanntmachungsdatum)\n\nBaden-Württemberg Amtsgericht Ulm HRB 726246\nSonstige Registerbekanntmachung\n\nGesundheitszentren des Landkreises Göppingen GmbH\nGesellschaft mit beschränkter Haftung\nGöppingen\n\nDie Gesellschaft hat am 29.07.2025 die Liste über die Zusammensetzung des Aufsichtsrats zum Handelsregister eingereicht."
    },
    {
      "date": "2025-08-04",
      "id": "119039",
      "original_text": "Registerbekanntmachung nach dem Umwandlungsgesetz\nBaden-Württemberg Amtsgericht Stuttgart HRA 738677\nUlrich Wolber GmbH & Co. KG – Schiltach",
      "type": "Registerbekanntmachung nach dem Umwandlungsgesetz",
      "state": "Baden-Württemberg",
      "amtsgericht": "Amtsgericht Stuttgart",
      "registernummer": "HRA 738677",
      "registerart": "HRA",
      "company_name": "Ulrich Wolber GmbH & Co. KG",
      "company_seat": "Schiltach",
      "details": "04.08.2025 (Bekanntmachungsdatum)\n\nBaden-Württemberg Amtsgericht Stuttgart HRA 738677\nRegisterbekanntmachung nach dem Umwandlungsgesetz 04.08.2025 (Eintragungsdatum)\n\nUlrich Wolber GmbH & Co. KG\nKommanditgesellschaft\nSchiltach\n\nDen Gläubigern der an der Verschmelzung beteiligten Rechtsträger ist, wenn sie binnen sechs Monaten nach dem Tag, an dem die Eintragung der Verschmelzung in das Register des Sitzes desjenigen Rechtsträgers, dessen Gläubiger sie sind, nach § 19 Abs. 3 UmwG als bekanntgemacht gilt, ihren Anspruch nach Grund und Höhe schriftlich anmelden, Sicherheit zu leisten, soweit sie nicht Befriedigung verlangen können. Dieses Recht steht den Gläubigern jedoch nur zu, wenn sie glaubhaft machen, dass durch die Verschmelzung die Erfüllung ihrer Forderung gefährdet wird."
    },
    {
      "date": "2025-08-04",
      "id": "119040",
      "original_text": "Registerbekanntmachung nach dem Umwandlungsgesetz\nBaden-Württemberg Amtsgericht Stuttgart HRA 740545\nWolber Ulrich Energie & Vermietung e.K. – Schiltach",
      "type": "Registerbekanntmachung nach dem Umwandlungsgesetz",
      "state": "Baden-Württemberg",
      "amtsgericht": "Amtsgericht Stuttgart",
      "registernummer": "HRA 740545",
      "registerart": "HRA",
      "company_name": "Wolber Ulrich Energie & Vermietung e.K.",
      "company_seat": "Schiltach",
      "details": "04.08.2025 (Bekanntmachungsdatum)\n\nBaden-Württemberg Amtsgericht Stuttgart HRA 740545\nRegisterbekanntmachung nach dem Umwandlungsgesetz 04.08.2025 (Eintragungsdatum)\n\nWolber Ulrich Energie & Vermietung e.K.\nEinzelkaufmann / Einzelkauffrau\nSchiltach\n\nAls nicht eingetragen wird bekanntgemacht:\nDen Gläubigern der an der Ausgliederung beteiligten Rechtsträger ist, wenn sie binnen sechs Monaten nach dem Tag, an dem die Eintragung der Ausgliederung in das Register des Sitzes desjenigen Rechtsträgers, dessen Gläubiger sie sind, nach § 19 Abs. 3 UmwG als bekanntgemacht gilt, ihren Anspruch nach Grund und Höhe schriftlich anmelden, Sicherheit zu leisten, soweit sie nicht Befriedigung verlangen können. Dieses Recht steht den Gläubigern jedoch nur zu, wenn sie glaubhaft machen, dass durch die Ausgliederung die Erfüllung ihrer Forderung gefährdet wird."
    },
    {
      "date": "2025-08-04",
      "id": "119041",
      "original_text": "Registerbekanntmachung nach dem Umwandlungsgesetz\nHamburg Amtsgericht Hamburg HRB 82102\nSmurfit Westrock GmbH – Hamburg",
      "type": "Registerbekanntmachung nach dem Umwandlungsgesetz",
      "state": "Hamburg",
      "amtsgericht": "Amtsgericht Hamburg",
      "registernummer": "HRB 82102",
      "registerart": "HRB",
      "company_name": "Smurfit Westrock GmbH",
      "company_seat": "Hamburg",
      "details": "04.08.2025 (Bekanntmachungsdatum)\n\nHamburg Amtsgericht Hamburg HRB 82102\nRegisterbekanntmachung nach dem Umwandlungsgesetz 04.08.2025 (Eintragungsdatum)\n\nSmurfit Westrock GmbH\nGesellschaft mit beschränkter Haftung\nHamburg\n\nAls nicht eingetragen wird bekannt gemacht:\nDen Gläubigern der an der Verschmelzung beteiligten Gesellschaften ist, wenn sie binnen sechs Monaten nach dem Tag, an dem die Eintragung der Verschmelzung in das Register des Sitzes desjenigen Rechtsträgers, dessen Gläubiger sie sind, nach § 19 Absatz 3 UmwG als bekannt gemacht gilt, ihren Anspruch nach Grund und Höhe schriftlich anmelden, Sicherheit zu leisten, soweit sie nicht Befriedigung verlangen können. Dieses Recht steht den Gläubigern jedoch nur zu, wenn sie glaubhaft machen, dass durch die Verschmelzung die Erfüllung ihrer Forderung gefährdet wird."
    },
    {
      "date": "2025-08-04",
      "id": "119042",
      "original_text": "Registerbekanntmachung nach dem Umwandlungsgesetz\nBaden-Württemberg Amtsgericht Stuttgart HRB 4483\nHWP Planungsgesellschaft mbH Architektur, Betriebsplanung, Projektmanagement – Stuttgart",
      "type": "Registerbekanntmachung nach dem Umwandlungsgesetz",
      "state": "Baden-Württemberg",
      "amtsgericht": "Amtsgericht Stuttgart",
      "registernummer": "HRB 4483",
      "registerart": "HRB",
      "company_name": "HWP Planungsgesellschaft mbH Architektur, Betriebsplanung, Projektmanagement",
      "company_seat": "Stuttgart",
      "details": "04.08.2025 (Bekanntmachungsdatum)\n\nBaden-Württemberg Amtsgericht Stuttgart HRB 4483\nRegisterbekanntmachung nach dem Umwandlungsgesetz 04.08.2025 (Eintragungsdatum)\n\nHWP Planungsgesellschaft mbH Architektur, Betriebsplanung, Projektmanagement\nGesellschaft mit beschränkter Haftung\nStuttgart\n\nAls nicht eingetragen wird bekanntgemacht:\nDen Gläubigern der an der Verschmelzung beteiligten Rechtsträger ist, wenn sie binnen sechs Monaten nach dem Tag, an dem die Eintragung der Verschmelzung in das Register des Sitzes desjenigen Rechtsträgers, dessen Gläubiger sie sind, nach § 19 Abs. 3 UmwG als bekanntgemacht gilt, ihren Anspruch nach Grund und Höhe schriftlich anmelden, Sicherheit zu leisten, soweit sie nicht Befriedigung verlangen können. Dieses Recht steht den Gläubigern jedoch nur zu, wenn sie glaubhaft machen, dass durch die Verschmelzung die Erfüllung ihrer Forderung gefährdet wird."
    },
    {
      "date": "2025-08-04",
      "id": "119043",
      "original_text": "Löschungsankündigung\nBerlin Amtsgericht Berlin (Charlottenburg) HRB 214907\nSIBER GmbH – Berlin",
      "type": "Löschungsankündigung",
      "state": "Berlin",
      "amtsgericht": "Amtsgericht Berlin (Charlottenburg)",
      "registernummer": "HRB 214907",
      "registerart": "HRB",
      "company_name": "SIBER GmbH",
      "company_seat": "Berlin",
      "details": "04.08.2025 (Bekanntmachungsdatum)\n\nBerlin Amtsgericht Berlin (Charlottenburg) HRB 214907\nLöschungsankündigung\n\nSIBER GmbH\nGesellschaft mit beschränkter Haftung\nBerlin\n\nBei der nachstehenden Gesellschaft wird das Amtslöschungsverfahren gemäß § 394 FamFG eingeleitet. Widerspruchsfrist 6 Wochen"
    },
    {
      "date": "2025-08-04",
      "id": "119044",
      "original_text": "Einreichung neuer Dokumente\nBaden-Württemberg Amtsgericht Ulm HRB 500002\nWohnungsbau Aalen Gesellschaft mit beschränkter Haftung – Aalen",
      "type": "Einreichung neuer Dokumente",
      "state": "Baden-Württemberg",
      "amtsgericht": "Amtsgericht Ulm",
      "registernummer": "HRB 500002",
      "registerart": "HRB",
      "company_name": "Wohnungsbau Aalen Gesellschaft mit beschränkter Haftung",
      "company_seat": "Aalen",
      "details": "04.08.2025 (Bekanntmachungsdatum)\n\nBaden-Württemberg Amtsgericht Ulm HRB 500002\nEinreichung neuer Dokumente\n\nWohnungsbau Aalen Gesellschaft mit beschränkter Haftung\nGesellschaft mit beschränkter Haftung\nAalen\n\nDie Gesellschaft hat am 01.08.2025 die Liste über die Zusammensetzung des Aufsichtsrats zum Handelsregister eingereicht."
    },
    {
      "date": "2025-08-04",
      "id": "119045",
      "original_text": "Registerbekanntmachung nach dem Umwandlungsgesetz\nBaden-Württemberg Amtsgericht Stuttgart HRB 754280\nUlrich Karsch Holding GmbH – Bisingen",
      "type": "Registerbekanntmachung nach dem Umwandlungsgesetz",
      "state": "Baden-Württemberg",
      "amtsgericht": "Amtsgericht Stuttgart",
      "registernummer": "HRB 754280",
      "registerart": "HRB",
      "company_name": "Ulrich Karsch Holding GmbH",
      "company_seat": "Bisingen",
      "details": "04.08.2025 (Bekanntmachungsdatum)\n\nBaden-Württemberg Amtsgericht Stuttgart HRB 754280\nRegisterbekanntmachung nach dem Umwandlungsgesetz 04.08.2025 (Eintragungsdatum)\n\nUlrich Karsch Holding GmbH\nGesellschaft mit beschränkter Haftung\nBisingen\n\nAls nicht eingetragen wird bekanntgemacht:\nDen Gläubigern der an der Verschmelzung beteiligten Rechtsträger ist, wenn sie binnen sechs Monaten nach dem Tag, an dem die Eintragung der Verschmelzung in das Register des Sitzes desjenigen Rechtsträgers, dessen Gläubiger sie sind, nach § 19 Abs. 3 UmwG als bekanntgemacht gilt, ihren Anspruch nach Grund und Höhe schriftlich anmelden, Sicherheit zu leisten, soweit sie nicht Befriedigung verlangen können. Dieses Recht steht den Gläubigern jedoch nur zu, wenn sie glaubhaft machen, dass durch die Verschmelzung die Erfüllung ihrer Forderung gefährdet wird."
    },
    {
      "date": "2025-08-04",
      "id": "119046",
      "original_text": "Registerbekanntmachung nach dem Umwandlungsgesetz\nBaden-Württemberg Amtsgericht Ulm HRB 742426\nHERZBERG Genuss GmbH – Uhingen",
      "type": "Registerbekanntmachung nach dem Umwandlungsgesetz",
      "state": "Baden-Württemberg",
      "amtsgericht": "Amtsgericht Ulm",
      "registernummer": "HRB 742426",
      "registerart": "HRB",
      "company_name": "HERZBERG Genuss GmbH",
      "company_seat": "Uhingen",
      "details": "04.08.2025 (Bekanntmachungsdatum)\n\nBaden-Württemberg Amtsgericht Ulm HRB 742426\nRegisterbekanntmachung nach dem Umwandlungsgesetz 04.08.2025 (Eintragungsdatum)\n\nHERZBERG Genuss GmbH\nGesellschaft mit beschränkter Haftung\nUhingen\n\nAls nicht eingetragen wird bekanntgemacht:\nDen Gläubigern der an der Verschmelzung beteiligten Rechtsträger ist, wenn sie binnen sechs Monaten nach dem Tag, an dem die Eintragung der Verschmelzung in das Register des Sitzes desjenigen Rechtsträgers, dessen Gläubiger sie sind, nach § 19 Abs. 3 UmwG als bekanntgemacht gilt, ihren Anspruch nach Grund und Höhe schriftlich anmelden, Sicherheit zu leisten, soweit sie nicht Befriedigung verlangen können. Dieses Recht steht den Gläubigern jedoch nur zu, wenn sie glaubhaft machen, dass durch die Verschmelzung die Erfüllung ihrer Forderung gefährdet wird."
    },
    {
      "date": "2025-08-04",
      "id": "119047",
      "original_text": "Registerbekanntmachung nach dem Umwandlungsgesetz\nBaden-Württemberg Amtsgericht Stuttgart HRB 742183\nSVB Risk GmbH – Filderstadt",
      "type": "Registerbekanntmachung nach dem Umwandlungsgesetz",
      "state": "Baden-Württemberg",
      "amtsgericht": "Amtsgericht Stuttgart",
      "registernummer": "HRB 742183",
      "registerart": "HRB",
      "company_name": "SVB Risk GmbH",
      "company_seat": "Filderstadt",
      "details": "04.08.2025 (Bekanntmachungsdatum)\n\nBaden-Württemberg Amtsgericht Stuttgart HRB 742183\nRegisterbekanntmachung nach dem Umwandlungsgesetz 04.08.2025 (Eintragungsdatum)\n\nSVB Risk GmbH\nGesellschaft mit beschränkter Haftung\nFilderstadt\n\nAls nicht eingetragen wird bekanntgemacht:\nDen Gläubigern der an der Verschmelzung beteiligten Rechtsträger ist, wenn sie binnen sechs Monaten nach dem Tag, an dem die Eintragung der Verschmelzung in das Register des Sitzes desjenigen Rechtsträgers, dessen Gläubiger sie sind, nach § 19 Abs. 3 UmwG als bekanntgemacht gilt, ihren Anspruch nach Grund und Höhe schriftlich anmelden, Sicherheit zu leisten, soweit sie nicht Befriedigung verlangen können. Dieses Recht steht den Gläubigern jedoch nur zu, wenn sie glaubhaft machen, dass durch die Verschmelzung die Erfüllung ihrer Forderung gefährdet wird."
    },
    {
      "date": "2025-08-04",
      "id": "119048",
      "original_text": "Registerbekanntmachung nach dem Umwandlungsgesetz\nHamburg Amtsgericht Hamburg HRB 180935\nHBB Gewerbebau Objektgesellschaften mbH – Hamburg",
      "type": "Registerbekanntmachung nach dem Umwandlungsgesetz",
      "state": "Hamburg",
      "amtsgericht": "Amtsgericht Hamburg",
      "registernummer": "HRB 180935",
      "registerart": "HRB",
      "company_name": "HBB Gewerbebau Objektgesellschaften mbH",
      "company_seat": "Hamburg",
      "details": "04.08.2025 (Bekanntmachungsdatum)\n\nHamburg Amtsgericht Hamburg HRB 180935\nRegisterbekanntmachung nach dem Umwandlungsgesetz 04.08.2025 (Eintragungsdatum)\n\nHBB Gewerbebau Objektgesellschaften mbH\nGesellschaft mit beschränkter Haftung\nHamburg\n\nAls nicht eingetragen wird bekannt gemacht:\nDen Gläubigern der an der Verschmelzung beteiligten Gesellschaften ist, wenn sie binnen sechs Monaten nach dem Tag, an dem die Eintragung der Verschmelzung in das Register des Sitzes desjenigen Rechtsträgers, dessen Gläubiger sie sind, nach § 19 Absatz 3 UmwG als bekannt gemacht gilt, ihren Anspruch nach Grund und Höhe schriftlich anmelden, Sicherheit zu leisten, soweit sie nicht Befriedigung verlangen können. Dieses Recht steht den Gläubigern jedoch nur zu, wenn sie glaubhaft machen, dass durch die Verschmelzung die Erfüllung ihrer Forderung gefährdet wird."
    },
    {
      "date": "2025-08-04",
      "id": "119049",
      "original_text": "Registerbekanntmachung nach dem Umwandlungsgesetz\nNordrhein-Westfalen Amtsgericht Coesfeld HRA 3505\nGeorg Lensing GmbH & Co. KG – Reken",
      "type": "Registerbekanntmachung nach dem Umwandlungsgesetz",
      "state": "Nordrhein-Westfalen",
      "amtsgericht": "Amtsgericht Coesfeld",
      "registernummer": "HRA 3505",
      "registerart": "HRA",
      "company_name": "Georg Lensing GmbH & Co. KG",
      "company_seat": "Reken",
      "details": "04.08.2025 (Bekanntmachungsdatum)\n\nNordrhein-Westfalen Amtsgericht Coesfeld HRA 3505\nRegisterbekanntmachung nach dem Umwandlungsgesetz 04.08.2025 (Eintragungsdatum)\n\nGeorg Lensing GmbH & Co. KG\nKommanditgesellschaft\nReken\n\nDen Gläubigern der an der Ausgliederung beteiligten Rechtsträger ist, wenn sie binnen sechs Monaten nach dem Tag, an dem die Eintragung der Ausgliederung in das Register des Sitzes desjenigen Rechtsträgers, dessen Gläubiger sie sind, nach § 19 Absatz 3 UmwG als bekanntgemacht gilt, ihren Anspruch nach Grund und Höhe schriftlich anmelden, Sicherheit zu leisten, soweit sie nicht Befriedigung verlangen können. Dieses Recht steht den Gläubigern jedoch nur zu, wenn sie glaubhaft machen, dass durch die Ausgliederung die Erfüllung ihrer Forderung gefährdet wird."
    },
    {
      "date": "2025-08-04",
      "id": "119050",
      "original_text": "Registerbekanntmachung nach dem Umwandlungsgesetz\nBaden-Württemberg Amtsgericht Ulm HRB 745816\nPhysioFit GmbH – Göppingen",
      "type": "Registerbekanntmachung nach dem Umwandlungsgesetz",
      "state": "Baden-Württemberg",
      "amtsgericht": "Amtsgericht Ulm",
      "registernummer": "HRB 745816",
      "registerart": "HRB",
      "company_name": "PhysioFit GmbH",
      "company_seat": "Göppingen",
      "details": "04.08.2025 (Bekanntmachungsdatum)\n\nBaden-Württemberg Amtsgericht Ulm HRB 745816\nRegisterbekanntmachung nach dem Umwandlungsgesetz 04.08.2025 (Eintragungsdatum)\n\nPhysioFit GmbH\nGesellschaft mit beschränkter Haftung\nGöppingen\n\nAls nicht eingetragen wird bekanntgemacht:\nDen Gläubigern der an der Verschmelzung beteiligten Rechtsträger ist, wenn sie binnen sechs Monaten nach dem Tag, an dem die Eintragung der Verschmelzung in das Register des Sitzes desjenigen Rechtsträgers, dessen Gläubiger sie sind, nach § 19 Abs. 3 UmwG als bekanntgemacht gilt, ihren Anspruch nach Grund und Höhe schriftlich anmelden, Sicherheit zu leisten, soweit sie nicht Befriedigung verlangen können. Dieses Recht steht den Gläubigern jedoch nur zu, wenn sie glaubhaft machen, dass durch die Verschmelzung die Erfüllung ihrer Forderung gefährdet wird."
    },
    {
      "date": "2025-08-04",
      "id": "119051",
      "original_text": "Einreichung neuer Dokumente\nThüringen Amtsgericht Jena HRB 516643\nKreisrehaklinik Ronneburg GmbH – Ronneburg",
      "type": "Einreichung neuer Dokumente",
      "state": "Thüringen",
      "amtsgericht": "Amtsgericht Jena",
      "registernummer": "HRB 516643",
      "registerart": "HRB",
      "company_name": "Kreisrehaklinik Ronneburg GmbH",
      "company_seat": "Ronneburg",
      "details": "04.08.2025 (Bekanntmachungsdatum)\n\nThüringen Amtsgericht Jena HRB 516643\nEinreichung neuer Dokumente 04.08.2025 (Eintragungsdatum)\n\nKreisrehaklinik Ronneburg GmbH\nGesellschaft mit beschränkter Haftung\nRonneburg\n\nBekanntmachung gem. § 52 Abs. 3 Satz 2 GmbHG: Aufgrund einer Veränderung in den Personen der Aufsichtsratsmitglieder ist durch die Geschäftsführer eine neue Liste zum Handelsregister eingereicht worden."
    },
    {
      "date": "2025-08-04",
      "id": "119052",
      "original_text": "Registerbekanntmachung nach dem Umwandlungsgesetz\nThüringen Amtsgericht Jena HRB 202020\nMathys Orthopädie GmbH – Mörsdorf",
      "type": "Registerbekanntmachung nach dem Umwandlungsgesetz",
      "state": "Thüringen",
      "amtsgericht": "Amtsgericht Jena",
      "registernummer": "HRB 202020",
      "registerart": "HRB",
      "company_name": "Mathys Orthopädie GmbH",
      "company_seat": "Mörsdorf",
      "details": "04.08.2025 (Bekanntmachungsdatum)\n\nThüringen Amtsgericht Jena HRB 202020\nRegisterbekanntmachung nach dem Umwandlungsgesetz 04.08.2025 (Eintragungsdatum)\n\nMathys Orthopädie GmbH\nGesellschaft mit beschränkter Haftung\nMörsdorf\n\nNicht eingetragen: Den Gläubigern der an der Ausgliederung beteiligten Rechtsträger, ist wenn sie binnen sechs Monaten nach dem Tag, an dem die Eintragung der Ausgliederung in das Register des Sitzes desjenigen Rechtsträgers, dessen Gläubiger sie sind, nach §§125, 19 Abs. 3 UmwG als bekanntgemacht gilt, ihren Anspruch nach Grund und Höhe schriftlich anmelden, Sicherheit zu leisten, soweit sie nicht Befriedigung verlangen können. Dieses Recht steht ihnen jedoch nur zu, wenn sie glaubhaft machen, daß durch die Ausgliederung die Erfüllung ihrer Forderung gefährdet wird."
    },
    {
      "date": "2025-08-04",
      "id": "119053",
      "original_text": "Registerbekanntmachung nach dem Umwandlungsgesetz\nBrandenburg Amtsgericht Frankfurt/Oder HRB 9917\nClinton Großhandels-GmbH – Hoppegarten",
      "type": "Registerbekanntmachung nach dem Umwandlungsgesetz",
      "state": "Brandenburg",
      "amtsgericht": "Amtsgericht Frankfurt/Oder",
      "registernummer": "HRB 9917",
      "registerart": "HRB",
      "company_name": "Clinton Großhandels-GmbH",
      "company_seat": "Hoppegarten",
      "details": "04.08.2025 (Bekanntmachungsdatum)\n\nBrandenburg Amtsgericht Frankfurt/Oder HRB 9917\nRegisterbekanntmachung nach dem Umwandlungsgesetz 03.08.2025 (Eintragungsdatum)\n\nClinton Großhandels-GmbH\nGesellschaft mit beschränkter Haftung\nHoppegarten\n\nZu Eintragungsnummer 19 vom 03.08.2025 wird als nicht eingetragen veröffentlicht:\nDen Gläubigern der an der Verschmelzung beteiligten Rechtsträger ist, wenn sie binnen sechs Monaten nach dem Tag, an dem die Eintragung der Verschmelzung in das Register des Sitzes desjenigen Rechtsträgers, dessen Gläubiger sie sind, als bekannt gemacht gilt, ihren Anspruch nach Grund und Höhe schriftlich anmelden, Sicherheit zu leisten, soweit sie nicht Befriedigung verlangen können. Dieses Recht steht den Gläubigern jedoch nur zu, wenn sie glaubhaft machen, dass durch die Verschmelzung die Erfüllung ihrer Forderung gefährdet wird."
    },
    {
      "date": "2025-08-04",
      "id": "119054",
      "original_text": "Registerbekanntmachung nach dem Umwandlungsgesetz\nBerlin Amtsgericht Berlin (Charlottenburg) HRB 91703\nDDB Group GmbH – Berlin",
      "type": "Registerbekanntmachung nach dem Umwandlungsgesetz",
      "state": "Berlin",
      "amtsgericht": "Amtsgericht Berlin (Charlottenburg)",
      "registernummer": "HRB 91703",
      "registerart": "HRB",
      "company_name": "DDB Group GmbH",
      "company_seat": "Berlin",
      "details": "04.08.2025 (Bekanntmachungsdatum)\n\nBerlin Amtsgericht Berlin (Charlottenburg) HRB 91703\nRegisterbekanntmachung nach dem Umwandlungsgesetz 01.08.2025 (Eintragungsdatum)\n\nDDB Group GmbH\nGesellschaft mit beschränkter Haftung\nBerlin\n\nZu Eintragungsnummer 51 vom 01.08.2025 wird als nicht eingetragen veröffentlicht: Den Gläubigern der an der Verschmelzung beteiligten Rechtsträger ist, wenn sie binnen sechs Monaten nach dem Tag, an dem die Eintragung der Verschmelzung in das Register des Sitzes desjenigen Rechtsträgers, dessen Gläubiger sie sind, als bekannt gemacht gilt, ihren Anspruch nach Grund und Höhe schriftlich anmelden, Sicherheit zu leisten, soweit sie nicht Befriedigung verlangen können. Dieses Recht steht den Gläubigern jedoch nur zu, wenn sie glaubhaft machen, dass durch die Verschmelzung die Erfüllung ihrer Forderung gefährdet wird. Das Recht, Sicherheitsleistung zu verlangen, steht Gläubigern nicht zu, die im Falle der Insolvenz ein Recht auf vorzugsweise Befriedigung aus einer Deckungsmasse haben, die nach gesetzlicher Vorschrift zu ihrem Schutz errichtet und staatlich überwacht ist."
    },
    {
      "date": "2025-08-04",
      "id": "119055",
      "original_text": "Registerbekanntmachung nach dem Umwandlungsgesetz\nBaden-Württemberg Amtsgericht Stuttgart HRB 795560\neasyKaufmann Solutions GmbH – Schramberg",
      "type": "Registerbekanntmachung nach dem Umwandlungsgesetz",
      "state": "Baden-Württemberg",
      "amtsgericht": "Amtsgericht Stuttgart",
      "registernummer": "HRB 795560",
      "registerart": "HRB",
      "company_name": "easyKaufmann Solutions GmbH",
      "company_seat": "Schramberg",
      "details": "04.08.2025 (Bekanntmachungsdatum)\n\nBaden-Württemberg Amtsgericht Stuttgart HRB 795560\nRegisterbekanntmachung nach dem Umwandlungsgesetz 04.08.2025 (Eintragungsdatum)\n\neasyKaufmann Solutions GmbH\nGesellschaft mit beschränkter Haftung\nSchramberg\n\nAls nicht eingetragen wird bekanntgemacht:\nDen Gläubigern der an der Verschmelzung beteiligten Rechtsträger ist, wenn sie binnen sechs Monaten nach dem Tag, an dem die Eintragung der Verschmelzung in das Register des Sitzes desjenigen Rechtsträgers, dessen Gläubiger sie sind, nach § 19 Abs. 3 UmwG als bekanntgemacht gilt, ihren Anspruch nach Grund und Höhe schriftlich anmelden, Sicherheit zu leisten, soweit sie nicht Befriedigung verlangen können. Dieses Recht steht den Gläubigern jedoch nur zu, wenn sie glaubhaft machen, dass durch die Verschmelzung die Erfüllung ihrer Forderung gefährdet wird."
    },
    {
      "date": "2025-08-04",
      "id": "119056",
      "original_text": "Registerbekanntmachung nach dem Umwandlungsgesetz\nBaden-Württemberg Amtsgericht Ulm HRB 621058\nKodiak Markenkommunikation GmbH – Leutkirch im Allgäu",
      "type": "Registerbekanntmachung nach dem Umwandlungsgesetz",
      "state": "Baden-Württemberg",
      "amtsgericht": "Amtsgericht Ulm",
      "registernummer": "HRB 621058",
      "registerart": "HRB",
      "company_name": "Kodiak Markenkommunikation GmbH",
      "company_seat": "Leutkirch im Allgäu",
      "details": "04.08.2025 (Bekanntmachungsdatum)\n\nBaden-Württemberg Amtsgericht Ulm HRB 621058\nRegisterbekanntmachung nach dem Umwandlungsgesetz 04.08.2025 (Eintragungsdatum)\n\nKodiak Markenkommunikation GmbH\nGesellschaft mit beschränkter Haftung\nLeutkirch im Allgäu\n\nAls nicht eingetragen wird bekanntgemacht:\nDen Gläubigern der an der Verschmelzung beteiligten Rechtsträger ist, wenn sie binnen sechs Monaten nach dem Tag, an dem die Eintragung der Verschmelzung in das Register des Sitzes desjenigen Rechtsträgers, dessen Gläubiger sie sind, nach § 19 Abs. 3 UmwG als bekanntgemacht gilt, ihren Anspruch nach Grund und Höhe schriftlich anmelden, Sicherheit zu leisten, soweit sie nicht Befriedigung verlangen können. Dieses Recht steht den Gläubigern jedoch nur zu, wenn sie glaubhaft machen, dass durch die Verschmelzung die Erfüllung ihrer Forderung gefährdet wird."
    },
    {
      "date": "2025-08-04",
      "id": "119057",
      "original_text": "Registerbekanntmachung nach dem Umwandlungsgesetz\nBaden-Württemberg Amtsgericht Ulm HRB 610492\nin aller munde GmbH – Leutkirch im Allgäu",
      "type": "Registerbekanntmachung nach dem Umwandlungsgesetz",
      "state": "Baden-Württemberg",
      "amtsgericht": "Amtsgericht Ulm",
      "registernummer": "HRB 610492",
      "registerart": "HRB",
      "company_name": "in aller munde GmbH",
      "company_seat": "Leutkirch im Allgäu",
      "details": "04.08.2025 (Bekanntmachungsdatum)\n\nBaden-Württemberg Amtsgericht Ulm HRB 610492\nRegisterbekanntmachung nach dem Umwandlungsgesetz 04.08.2025 (Eintragungsdatum)\n\nin aller munde GmbH\nGesellschaft mit beschränkter Haftung\nLeutkirch im Allgäu\n\nAls nicht eingetragen wird bekanntgemacht:\nDen Gläubigern der an der Verschmelzung beteiligten Rechtsträger ist, wenn sie binnen sechs Monaten nach dem Tag, an dem die Eintragung der Verschmelzung in das Register des Sitzes desjenigen Rechtsträgers, dessen Gläubiger sie sind, nach § 19 Abs. 3 UmwG als bekanntgemacht gilt, ihren Anspruch nach Grund und Höhe schriftlich anmelden, Sicherheit zu leisten, soweit sie nicht Befriedigung verlangen können. Dieses Recht steht den Gläubigern jedoch nur zu, wenn sie glaubhaft machen, dass durch die Verschmelzung die Erfüllung ihrer Forderung gefährdet wird."
    },
    {
      "date": "2025-08-04",
      "id": "119058",
      "original_text": "Registerbekanntmachung nach dem Umwandlungsgesetz\nBerlin Amtsgericht Berlin (Charlottenburg) HRB 213175\nQUARTERBACK Premium 16 GmbH – Berlin",
      "type": "Registerbekanntmachung nach dem Umwandlungsgesetz",
      "state": "Berlin",
      "amtsgericht": "Amtsgericht Berlin (Charlottenburg)",
      "registernummer": "HRB 213175",
      "registerart": "HRB",
      "company_name": "QUARTERBACK Premium 16 GmbH",
      "company_seat": "Berlin",
      "details": "04.08.2025 (Bekanntmachungsdatum)\n\nBerlin Amtsgericht Berlin (Charlottenburg) HRB 213175\nRegisterbekanntmachung nach dem Umwandlungsgesetz 01.08.2025 (Eintragungsdatum)\n\nQUARTERBACK Premium 16 GmbH\nGesellschaft mit beschränkter Haftung\nBerlin\n\nZu Eintragungsnummer 6 vom 01.08.2025 wird als nicht eingetragen veröffentlicht:Den Gläubigern der an der Verschmelzung beteiligten Rechtsträger ist, wenn sie binnen sechs Monaten nach dem Tag, an dem die Eintragung der Verschmelzung in das Register des Sitzes desjenigen Rechtsträgers, dessen Gläubiger sie sind, als bekannt gemacht gilt, ihren Anspruch nach Grund und Höhe schriftlich anmelden, Sicherheit zu leisten, soweit sie nicht Befriedigung verlangen können. Dieses Recht steht den Gläubigern jedoch nur zu, wenn sie glaubhaft machen, dass durch die Verschmelzung die Erfüllung ihrer Forderung gefährdet wird. Das Recht, Sicherheitsleistung zu verlangen, steht Gläubigern nicht zu, die im Falle der Insolvenz ein Recht auf vorzugsweise Befriedigung aus einer Deckungsmasse haben, die nach gesetzlicher Vorschrift zu ihrem Schutz errichtet und staatlich überwacht ist."
    },
    {
      "date": "2025-08-04",
      "id": "119059",
      "original_text": "Registerbekanntmachung nach dem Umwandlungsgesetz\nBerlin Amtsgericht Berlin (Charlottenburg) HRB 52748\nKurt Wegscheider Versicherungsmakler GmbH – Berlin",
      "type": "Registerbekanntmachung nach dem Umwandlungsgesetz",
      "state": "Berlin",
      "amtsgericht": "Amtsgericht Berlin (Charlottenburg)",
      "registernummer": "HRB 52748",
      "registerart": "HRB",
      "company_name": "Kurt Wegscheider Versicherungsmakler GmbH",
      "company_seat": "Berlin",
      "details": "04.08.2025 (Bekanntmachungsdatum)\n\nBerlin Amtsgericht Berlin (Charlottenburg) HRB 52748\nRegisterbekanntmachung nach dem Umwandlungsgesetz 04.08.2025 (Eintragungsdatum)\n\nKurt Wegscheider Versicherungsmakler GmbH\nGesellschaft mit beschränkter Haftung\nBerlin\n\nZu Eintragungsnummer 9 vom 04.08.2025 wird als nicht eingetragen veröffentlicht:\n\nDen Gläubigern der an der Verschmelzung beteiligten Rechtsträger ist, wenn sie binnen sechs Monaten nach dem Tag, an dem die Eintragung der Verschmelzung in das Register des Sitzes desjenigen Rechtsträgers, dessen Gläubiger sie sind, als bekannt gemacht gilt, ihren Anspruch nach Grund und Höhe schriftlich anmelden, Sicherheit zu leisten, soweit sie nicht Befriedigung verlangen können. Dieses Recht steht den Gläubigern jedoch nur zu, wenn sie glaubhaft machen, dass durch die Verschmelzung die Erfüllung ihrer Forderung gefährdet wird. Das Recht, Sicherheitsleistung zu verlangen, steht Gläubigern nicht zu, die im Falle der Insolvenz ein Recht auf vorzugsweise Befriedigung aus einer Deckungsmasse haben, die nach gesetzlicher Vorschrift zu ihrem Schutz errichtet und staatlich überwacht ist."
    },
    {
      "date": "2025-08-04",
      "id": "119060",
      "original_text": "Sonstige Registerbekanntmachung\nBrandenburg Amtsgericht Frankfurt/Oder HRB 9016\nRetail Support GmbH – Hoppegarten",
      "type": "Sonstige Registerbekanntmachung",
      "state": "Brandenburg",
      "amtsgericht": "Amtsgericht Frankfurt/Oder",
      "registernummer": "HRB 9016",
      "registerart": "HRB",
      "company_name": "Retail Support GmbH",
      "company_seat": "Hoppegarten",
      "details": "04.08.2025 (Bekanntmachungsdatum)\n\nBrandenburg Amtsgericht Frankfurt/Oder HRB 9016\nSonstige Registerbekanntmachung 03.08.2025 (Eintragungsdatum)\n\nRetail Support GmbH\nGesellschaft mit beschränkter Haftung\nHoppegarten\n\nAls nicht eingetragen wird veröffentlicht:\nDen Gläubigern der an der Verschmelzung beteiligten Rechtsträger ist, wenn sie binnen sechs Monaten nach dem Tag, an dem die Eintragung der Verschmelzung in das Register des Sitzes desjenigen Rechtsträgers, dessen Gläubiger sie sind, als bekannt gemacht gilt, ihren Anspruch nach Grund und Höhe schriftlich anmelden, Sicherheit zu leisten, soweit sie nicht Befriedigung verlangen können. Dieses Recht steht den Gläubigern jedoch nur zu, wenn sie glaubhaft machen, dass durch die Verschmelzung die Erfüllung ihrer Forderung gefährdet wird"
    },
    {
      "date": "2025-08-04",
      "id": "119061",
      "original_text": "Registerbekanntmachung nach dem Umwandlungsgesetz\nBerlin Amtsgericht Berlin (Charlottenburg) HRA 44898\nB. u. M. Fode Grundstücks KG – Berlin",
      "type": "Registerbekanntmachung nach dem Umwandlungsgesetz",
      "state": "Berlin",
      "amtsgericht": "Amtsgericht Berlin (Charlottenburg)",
      "registernummer": "HRA 44898",
      "registerart": "HRA",
      "company_name": "B. u. M. Fode Grundstücks KG",
      "company_seat": "Berlin",
      "details": "04.08.2025 (Bekanntmachungsdatum)\n\nBerlin Amtsgericht Berlin (Charlottenburg) HRA 44898\nRegisterbekanntmachung nach dem Umwandlungsgesetz 01.08.2025 (Eintragungsdatum)\n\nB. u. M. Fode Grundstücks KG\nKommanditgesellschaft\nBerlin\n\nZu Eintragungsnummer 5 vom 01.08.2025 wird als nicht eingetragen veröffentlicht:\nDen Gläubigern der an der Verschmelzung beteiligten Rechtsträger ist, wenn sie binnen sechs Monaten nach dem Tag, an dem die Eintragung der Verschmelzung in das Register des Sitzes desjenigen Rechtsträgers, dessen Gläubiger sie sind, als bekannt gemacht gilt, ihren Anspruch nach Grund und Höhe schriftlich anmelden, Sicherheit zu leisten, soweit sie nicht Befriedigung verlangen können. Dieses Recht steht den Gläubigern jedoch nur zu, wenn sie glaubhaft machen, dass durch die Verschmelzung die Erfüllung ihrer Forderung gefährdet wird. Das Recht, Sicherheitsleistung zu verlangen, steht Gläubigern nicht zu, die im Falle der Insolvenz ein Recht auf vorzugsweise Befriedigung aus einer Deckungsmasse haben, die nach gesetzlicher Vorschrift zu ihrem Schutz errichtet und staatlich überwacht ist."
    },
    {
      "date": "2025-08-04",
      "id": "119062",
      "original_text": "Registerbekanntmachung nach dem Umwandlungsgesetz\nBerlin Amtsgericht Berlin (Charlottenburg) HRB 33174\nBruns-Ziehen Versicherungsmakler GmbH – Berlin",
      "type": "Registerbekanntmachung nach dem Umwandlungsgesetz",
      "state": "Berlin",
      "amtsgericht": "Amtsgericht Berlin (Charlottenburg)",
      "registernummer": "HRB 33174",
      "registerart": "HRB",
      "company_name": "Bruns-Ziehen Versicherungsmakler GmbH",
      "company_seat": "Berlin",
      "details": "04.08.2025 (Bekanntmachungsdatum)\n\nBerlin Amtsgericht Berlin (Charlottenburg) HRB 33174\nRegisterbekanntmachung nach dem Umwandlungsgesetz 04.08.2025 (Eintragungsdatum)\n\nBruns-Ziehen Versicherungsmakler GmbH\nGesellschaft mit beschränkter Haftung\nBerlin\n\nZu Eintragungsnummer 8 vom 04.08.2025 wird als nicht eingetragen veröffentlicht:\n\nDen Gläubigern der an der Verschmelzung beteiligten Rechtsträger ist, wenn sie binnen sechs Monaten nach dem Tag, an dem die Eintragung der Verschmelzung in das Register des Sitzes desjenigen Rechtsträgers, dessen Gläubiger sie sind, als bekannt gemacht gilt, ihren Anspruch nach Grund und Höhe schriftlich anmelden, Sicherheit zu leisten, soweit sie nicht Befriedigung verlangen können. Dieses Recht steht den Gläubigern jedoch nur zu, wenn sie glaubhaft machen, dass durch die Verschmelzung die Erfüllung ihrer Forderung gefährdet wird. Das Recht, Sicherheitsleistung zu verlangen, steht Gläubigern nicht zu, die im Falle der Insolvenz ein Recht auf vorzugsweise Befriedigung aus einer Deckungsmasse haben, die nach gesetzlicher Vorschrift zu ihrem Schutz errichtet und staatlich überwacht ist."
    },
    {
      "date": "2025-08-04",
      "id": "119063",
      "original_text": "Registerbekanntmachung nach dem Umwandlungsgesetz\nBrandenburg Amtsgericht Neuruppin HRB 1831\nNeudorfer Fleischerei GmbH – Neudorf",
      "type": "Registerbekanntmachung nach dem Umwandlungsgesetz",
      "state": "Brandenburg",
      "amtsgericht": "Amtsgericht Neuruppin",
      "registernummer": "HRB 1831",
      "registerart": "HRB",
      "company_name": "Neudorfer Fleischerei GmbH",
      "company_seat": "Neudorf",
      "details": "04.08.2025 (Bekanntmachungsdatum)\n\nBrandenburg Amtsgericht Neuruppin HRB 1831\nRegisterbekanntmachung nach dem Umwandlungsgesetz 31.07.2025 (Eintragungsdatum)\n\nNeudorfer Fleischerei GmbH\nGesellschaft mit beschränkter Haftung\nNeudorf\n\nZu Eintragungsnummer 13 vom 31.07.2025 wird als nicht eingetragen veröffentlicht:\nDen Gläubigern der beteiligten Rechtsträger ist, wenn sie binnen sechs Monaten nach dem Tag, an dem die Eintragung in das Register des Sitzes desjenigen Rechtsträgers, dessen Gläubiger sie sind, als bekannt gemacht gilt, ihren Anspruch nach Grund und Höhe schriftlich anmelden, Sicherheit zu leisten, soweit sie nicht Befriedigung verlangen können. Dieses Recht steht den Gläubigern jedoch nur zu, wenn sie glaubhaft machen, dass die Erfüllung ihrer Forderung gefährdet wird"
    },
    {
      "date": "2025-08-04",
      "id": "119064",
      "original_text": "Sonstige Registerbekanntmachung\nBaden-Württemberg Amtsgericht Mannheim HRB 740775\nHEDGEHOG Applications AG – Karlsruhe",
      "type": "Sonstige Registerbekanntmachung",
      "state": "Baden-Württemberg",
      "amtsgericht": "Amtsgericht Mannheim",
      "registernummer": "HRB 740775",
      "registerart": "HRB",
      "company_name": "HEDGEHOG Applications AG",
      "company_seat": "Karlsruhe",
      "details": "04.08.2025 (Bekanntmachungsdatum)\n\nBaden-Württemberg Amtsgericht Mannheim HRB 740775\nSonstige Registerbekanntmachung 04.08.2025 (Eintragungsdatum)\n\nHEDGEHOG Applications AG\nAktiengesellschaft\nKarlsruhe\n\nDie Gesellschaft hat am 01.08.2025 die Liste über die Zusammensetzung des Aufsichtsrats zum Handelsregister eingereicht."
    },
    {
      "date": "2025-08-04",
      "id": "119065",
      "original_text": "Registerbekanntmachung nach dem Umwandlungsgesetz\nBerlin Amtsgericht Berlin (Charlottenburg) HRB 276632\nQMMO Management Berlin GmbH – Berlin",
      "type": "Registerbekanntmachung nach dem Umwandlungsgesetz",
      "state": "Berlin",
      "amtsgericht": "Amtsgericht Berlin (Charlottenburg)",
      "registernummer": "HRB 276632",
      "registerart": "HRB",
      "company_name": "QMMO Management Berlin GmbH",
      "company_seat": "Berlin",
      "details": "04.08.2025 (Bekanntmachungsdatum)\n\nBerlin Amtsgericht Berlin (Charlottenburg) HRB 276632\nRegisterbekanntmachung nach dem Umwandlungsgesetz 02.08.2025 (Eintragungsdatum)\n\nQMMO Management Berlin GmbH\nGesellschaft mit beschränkter Haftung\nBerlin\n\nZu Eintragungsnummer 2 vom 02.08.2025 wird als nicht eingetragen veröffentlicht: Den Gläubigern der an der Verschmelzung beteiligten Rechtsträger ist, wenn sie binnen sechs Monaten nach dem Tag, an dem die Eintragung der Verschmelzung in das Register des Sitzes desjenigen Rechtsträgers, dessen Gläubiger sie sind, als bekannt gemacht gilt, ihren Anspruch nach Grund und Höhe schriftlich anmelden, Sicherheit zu leisten, soweit sie nicht Befriedigung verlangen können. Dieses Recht steht den Gläubigern jedoch nur zu, wenn sie glaubhaft machen, dass durch die Verschmelzung die Erfüllung ihrer Forderung gefährdet wird. Das Recht, Sicherheitsleistung zu verlangen, steht Gläubigern nicht zu, die im Falle der Insolvenz ein Recht auf vorzugsweise Befriedigung aus einer Deckungsmasse haben, die nach gesetzlicher Vorschrift zu ihrem Schutz errichtet und staatlich überwacht ist."
    },
    {
      "date": "2025-08-04",
      "id": "119066",
      "original_text": "Registerbekanntmachung nach dem Umwandlungsgesetz\nBerlin Amtsgericht Berlin (Charlottenburg) HRB 277016\nDeVos Capitalmanagement GmbH – Berlin",
      "type": "Registerbekanntmachung nach dem Umwandlungsgesetz",
      "state": "Berlin",
      "amtsgericht": "Amtsgericht Berlin (Charlottenburg)",
      "registernummer": "HRB 277016",
      "registerart": "HRB",
      "company_name": "DeVos Capitalmanagement GmbH",
      "company_seat": "Berlin",
      "details": "04.08.2025 (Bekanntmachungsdatum)\n\nBerlin Amtsgericht Berlin (Charlottenburg) HRB 277016\nRegisterbekanntmachung nach dem Umwandlungsgesetz 02.08.2025 (Eintragungsdatum)\n\nDeVos Capitalmanagement GmbH\nGesellschaft mit beschränkter Haftung\nBerlin\n\nZu Eintragungsnummer 2 vom 02.08.2025 wird als nicht eingetragen veröffentlicht: Den Gläubigern der an der Verschmelzung beteiligten Rechtsträger ist, wenn sie binnen sechs Monaten nach dem Tag, an dem die Eintragung der Verschmelzung in das Register des Sitzes desjenigen Rechtsträgers, dessen Gläubiger sie sind, als bekannt gemacht gilt, ihren Anspruch nach Grund und Höhe schriftlich anmelden, Sicherheit zu leisten, soweit sie nicht Befriedigung verlangen können. Dieses Recht steht den Gläubigern jedoch nur zu, wenn sie glaubhaft machen, dass durch die Verschmelzung die Erfüllung ihrer Forderung gefährdet wird. Das Recht, Sicherheitsleistung zu verlangen, steht Gläubigern nicht zu, die im Falle der Insolvenz ein Recht auf vorzugsweise Befriedigung aus einer Deckungsmasse haben, die nach gesetzlicher Vorschrift zu ihrem Schutz errichtet und staatlich überwacht ist."
    },
    {
      "date": "2025-08-04",
      "id": "119067",
      "original_text": "Registerbekanntmachung nach dem Umwandlungsgesetz\nBrandenburg Amtsgericht Frankfurt/Oder GsR 242\nTourismus - eGbR Jägerbude Lehmann / Schmohl – Gosen-Neu Zittau",
      "type": "Registerbekanntmachung nach dem Umwandlungsgesetz",
      "state": "Brandenburg",
      "amtsgericht": "Amtsgericht Frankfurt/Oder",
      "registernummer": "GsR 242",
      "registerart": "GsR",
      "company_name": "Tourismus - eGbR Jägerbude Lehmann / Schmohl",
      "company_seat": "Gosen-Neu Zittau",
      "details": "04.08.2025 (Bekanntmachungsdatum)\n\nBrandenburg Amtsgericht Frankfurt/Oder GsR 242\nRegisterbekanntmachung nach dem Umwandlungsgesetz 04.08.2025 (Eintragungsdatum)\n\nTourismus - eGbR Jägerbude Lehmann / Schmohl\nGesellschaft bürgerlichen Rechts\nGosen-Neu Zittau\n\nZu Eintragungsnummer 2 vom 04.08.2025 wird als nicht eingetragen veröffentlicht: Als nicht eingetragen wird veröffentlicht:\nDen Gläubigern der an der Umwandlung beteiligten Rechtsträger ist, wenn sie binnen sechs Monaten nach dem Tag, an dem die Eintragung der Umwandlung in das Register des Sitzes desjenigen Rechtsträgers, dessen Gläubiger sie sind, als bekannt gemacht gilt, ihren Anspruch nach Grund und Höhe schriftlich anmelden, Sicherheit zu leisten, soweit sie nicht Befriedigung verlangen können. Dieses Recht steht den Gläubigern jedoch nur zu, wenn sie glaubhaft machen, dass durch die Umwandlung die Erfüllung ihrer Forderung gefährdet wird"
    },
    {
      "date": "2025-08-04",
      "id": "119068",
      "original_text": "Registerbekanntmachung nach dem Umwandlungsgesetz\nBaden-Württemberg Amtsgericht Ulm HRB 532281\nMOTION MAKERS GmbH – Göppingen",
      "type": "Registerbekanntmachung nach dem Umwandlungsgesetz",
      "state": "Baden-Württemberg",
      "amtsgericht": "Amtsgericht Ulm",
      "registernummer": "HRB 532281",
      "registerart": "HRB",
      "company_name": "MOTION MAKERS GmbH",
      "company_seat": "Göppingen",
      "details": "04.08.2025 (Bekanntmachungsdatum)\n\nBaden-Württemberg Amtsgericht Ulm HRB 532281\nRegisterbekanntmachung nach dem Umwandlungsgesetz 04.08.2025 (Eintragungsdatum)\n\nMOTION MAKERS GmbH\nGesellschaft mit beschränkter Haftung\nGöppingen\n\nAls nicht eingetragen wird bekanntgemacht:\nDen Gläubigern der an der Verschmelzung beteiligten Rechtsträger ist, wenn sie binnen sechs Monaten nach dem Tag, an dem die Eintragung der Verschmelzung in das Register des Sitzes desjenigen Rechtsträgers, dessen Gläubiger sie sind, nach § 19 Abs. 3 UmwG als bekanntgemacht gilt, ihren Anspruch nach Grund und Höhe schriftlich anmelden, Sicherheit zu leisten, soweit sie nicht Befriedigung verlangen können. Dieses Recht steht den Gläubigern jedoch nur zu, wenn sie glaubhaft machen, dass durch die Verschmelzung die Erfüllung ihrer Forderung gefährdet wird."
    },
    {
      "date": "2025-08-04",
      "id": "119069",
      "original_text": "Löschungsankündigung\nBerlin Amtsgericht Berlin (Charlottenburg) HRB 204796\nBeMoSo GmbH – Berlin",
      "type": "Löschungsankündigung",
      "state": "Berlin",
      "amtsgericht": "Amtsgericht Berlin (Charlottenburg)",
      "registernummer": "HRB 204796",
      "registerart": "HRB",
      "company_name": "BeMoSo GmbH",
      "company_seat": "Berlin",
      "details": "04.08.2025 (Bekanntmachungsdatum)\n\nBerlin Amtsgericht Berlin (Charlottenburg) HRB 204796\nLöschungsankündigung\n\nBeMoSo GmbH\nGesellschaft mit beschränkter Haftung\nBerlin\n\nBei der nachstehenden Gesellschaft wird das Amtslöschungsverfahren gemäß § 394 FamFG eingeleitet. Widerspruchsfrist 6 Wochen"
    },
    {
      "date": "2025-08-04",
      "id": "119070",
      "original_text": "Registerbekanntmachung nach dem Umwandlungsgesetz\nBaden-Württemberg Amtsgericht Freiburg HRB 611810\nSchwarzwald-Baar Getränke Service Verwaltungs GmbH – Donaueschingen",
      "type": "Registerbekanntmachung nach dem Umwandlungsgesetz",
      "state": "Baden-Württemberg",
      "amtsgericht": "Amtsgericht Freiburg",
      "registernummer": "HRB 611810",
      "registerart": "HRB",
      "company_name": "Schwarzwald-Baar Getränke Service Verwaltungs GmbH",
      "company_seat": "Donaueschingen",
      "details": "04.08.2025 (Bekanntmachungsdatum)\n\nBaden-Württemberg Amtsgericht Freiburg HRB 611810\nRegisterbekanntmachung nach dem Umwandlungsgesetz 04.08.2025 (Eintragungsdatum)\n\nSchwarzwald-Baar Getränke Service Verwaltungs GmbH\nGesellschaft mit beschränkter Haftung\nDonaueschingen\n\nAls nicht eingetragen wird bekanntgemacht:\nDen Gläubigern der an der Verschmelzung beteiligten Rechtsträger ist, wenn sie binnen sechs Monaten nach dem Tag, an dem die Eintragung der Verschmelzung in das Register des Sitzes desjenigen Rechtsträgers, dessen Gläubiger sie sind, nach § 19 Abs. 3 UmwG als bekanntgemacht gilt, ihren Anspruch nach Grund und Höhe schriftlich anmelden, Sicherheit zu leisten, soweit sie nicht Befriedigung verlangen können. Dieses Recht steht den Gläubigern jedoch nur zu, wenn sie glaubhaft machen, dass durch die Verschmelzung die Erfüllung ihrer Forderung gefährdet wird."
    },
    {
      "date": "2025-08-04",
      "id": "119071",
      "original_text": "Registerbekanntmachung nach dem Umwandlungsgesetz\nHamburg Amtsgericht Hamburg HRA 63451\nHelmut Brede e.K., Inhaber Mike Brede – Hamburg",
      "type": "Registerbekanntmachung nach dem Umwandlungsgesetz",
      "state": "Hamburg",
      "amtsgericht": "Amtsgericht Hamburg",
      "registernummer": "HRA 63451",
      "registerart": "HRA",
      "company_name": "Helmut Brede e.K., Inhaber Mike Brede",
      "company_seat": "Hamburg",
      "details": "04.08.2025 (Bekanntmachungsdatum)\n\nHamburg Amtsgericht Hamburg HRA 63451\nRegisterbekanntmachung nach dem Umwandlungsgesetz 04.08.2025 (Eintragungsdatum)\n\nHelmut Brede e.K., Inhaber Mike Brede\nEinzelkaufmann\nHamburg\n\nAls nicht eingetragen wird bekannt gemacht:\nDen Gläubigern der an der Ausgliederung beteiligten Gesellschaften ist, wenn sie binnen sechs Monaten nach dem Tag, an dem die Eintragung der Ausgliederung in das Register des Sitzes desjenigen Rechtsträgers, dessen Gläubiger sie sind, nach § 19 Absatz 3 UmwG als bekannt gemacht gilt, ihren Anspruch nach Grund und Höhe schriftlich anmelden, Sicherheit zu leisten, soweit sie nicht Befriedigung verlangen können. Dieses Recht steht den Gläubigern jedoch nur zu, wenn sie glaubhaft machen, dass durch die Ausgliederung die Erfüllung ihrer Forderung gefährdet wird."
    },
    {
      "date": "2025-08-04",
      "id": "119072",
      "original_text": "Registerbekanntmachung nach dem Umwandlungsgesetz\nBerlin Amtsgericht Berlin (Charlottenburg) HRB 214952\nLGR Holding GmbH – Berlin",
      "type": "Registerbekanntmachung nach dem Umwandlungsgesetz",
      "state": "Berlin",
      "amtsgericht": "Amtsgericht Berlin (Charlottenburg)",
      "registernummer": "HRB 214952",
      "registerart": "HRB",
      "company_name": "LGR Holding GmbH",
      "company_seat": "Berlin",
      "details": "04.08.2025 (Bekanntmachungsdatum)\n\nBerlin Amtsgericht Berlin (Charlottenburg) HRB 214952\nRegisterbekanntmachung nach dem Umwandlungsgesetz 01.08.2025 (Eintragungsdatum)\n\nLGR Holding GmbH\nGesellschaft mit beschränkter Haftung\nBerlin\n\nZu Eintragungsnummer 2 vom 01.08.2025 wird als nicht eingetragen veröffentlicht: Den Gläubigern der an der Verschmelzung beteiligten Rechtsträger ist, wenn sie binnen sechs Monaten nach dem Tag, an dem die Eintragung der Verschmelzung in das Register des Sitzes desjenigen Rechtsträgers, dessen Gläubiger sie sind, als bekannt gemacht gilt, ihren Anspruch nach Grund und Höhe schriftlich anmelden, Sicherheit zu leisten, soweit sie nicht Befriedigung verlangen können. Dieses Recht steht den Gläubigern jedoch nur zu, wenn sie glaubhaft machen, dass durch die Verschmelzung die Erfüllung ihrer Forderung gefährdet wird. Das Recht, Sicherheitsleistung zu verlangen, steht Gläubigern nicht zu, die im Falle der Insolvenz ein Recht auf vorzugsweise Befriedigung aus einer Deckungsmasse haben, die nach gesetzlicher Vorschrift zu ihrem Schutz errichtet und staatlich überwacht ist."
    },
    {
      "date": "2025-08-04",
      "id": "119073",
      "original_text": "Registerbekanntmachung nach dem Umwandlungsgesetz\nBaden-Württemberg Amtsgericht Mannheim HRB 740615\nDakitec GmbH – Mannheim",
      "type": "Registerbekanntmachung nach dem Umwandlungsgesetz",
      "state": "Baden-Württemberg",
      "amtsgericht": "Amtsgericht Mannheim",
      "registernummer": "HRB 740615",
      "registerart": "HRB",
      "company_name": "Dakitec GmbH",
      "company_seat": "Mannheim",
      "details": "04.08.2025 (Bekanntmachungsdatum)\n\nBaden-Württemberg Amtsgericht Mannheim HRB 740615\nRegisterbekanntmachung nach dem Umwandlungsgesetz 04.08.2025 (Eintragungsdatum)\n\nDakitec GmbH\nGesellschaft mit beschränkter Haftung\nMannheim\n\nAls nicht eingetragen wird bekanntgemacht:\nDen Gläubigern der an der Verschmelzung beteiligten Rechtsträger ist, wenn sie binnen sechs Monaten nach dem Tag, an dem die Eintragung der Verschmelzung in das Register des Sitzes desjenigen Rechtsträgers, dessen Gläubiger sie sind, nach § 19 Abs. 3 UmwG als bekanntgemacht gilt, ihren Anspruch nach Grund und Höhe schriftlich anmelden, Sicherheit zu leisten, soweit sie nicht Befriedigung verlangen können. Dieses Recht steht den Gläubigern jedoch nur zu, wenn sie glaubhaft machen, dass durch die Verschmelzung die Erfüllung ihrer Forderung gefährdet wird."
    },
    {
      "date": "2025-08-04",
      "id": "119074",
      "original_text": "Löschungsankündigung\nMecklenburg-Vorpommern Amtsgericht Stralsund HRB 21311\nVilla Hänsch SPA & Hotel Resort UG (haftungsbeschränkt) – Korswandt",
      "type": "Löschungsankündigung",
      "state": "Mecklenburg-Vorpommern",
      "amtsgericht": "Amtsgericht Stralsund",
      "registernummer": "HRB 21311",
      "registerart": "HRB",
      "company_name": "Villa Hänsch SPA & Hotel Resort UG (haftungsbeschränkt)",
      "company_seat": "Korswandt",
      "details": "04.08.2025 (Bekanntmachungsdatum)\n\nMecklenburg-Vorpommern Amtsgericht Stralsund HRB 21311\nLöschungsankündigung\n\nVilla Hänsch SPA & Hotel Resort UG (haftungsbeschränkt)\nGesellschaft mit beschränkter Haftung\nKorswandt\n\nDas Registergericht beabsichtigt, die Firma von Amts wegen nach § 394 FamFG zu löschen. Die Frist zur Erhebung eines Widerspruchs ist auf 1 Monat festgesetzt."
    },
    {
      "date": "2025-08-04",
      "id": "119075",
      "original_text": "Registerbekanntmachung nach dem Umwandlungsgesetz\nBerlin Amtsgericht Berlin (Charlottenburg) HRB 214409\nLGR Service GmbH – Berlin",
      "type": "Registerbekanntmachung nach dem Umwandlungsgesetz",
      "state": "Berlin",
      "amtsgericht": "Amtsgericht Berlin (Charlottenburg)",
      "registernummer": "HRB 214409",
      "registerart": "HRB",
      "company_name": "LGR Service GmbH",
      "company_seat": "Berlin",
      "details": "04.08.2025 (Bekanntmachungsdatum)\n\nBerlin Amtsgericht Berlin (Charlottenburg) HRB 214409\nRegisterbekanntmachung nach dem Umwandlungsgesetz 01.08.2025 (Eintragungsdatum)\n\nLGR Service GmbH\nGesellschaft mit beschränkter Haftung\nBerlin\n\nZu Eintragungsnummer 5 vom 01.08.2025 wird als nicht eingetragen veröffentlicht: Den Gläubigern der an der Verschmelzung beteiligten Rechtsträger ist, wenn sie binnen sechs Monaten nach dem Tag, an dem die Eintragung der Verschmelzung in das Register des Sitzes desjenigen Rechtsträgers, dessen Gläubiger sie sind, als bekannt gemacht gilt, ihren Anspruch nach Grund und Höhe schriftlich anmelden, Sicherheit zu leisten, soweit sie nicht Befriedigung verlangen können. Dieses Recht steht den Gläubigern jedoch nur zu, wenn sie glaubhaft machen, dass durch die Verschmelzung die Erfüllung ihrer Forderung gefährdet wird. Das Recht, Sicherheitsleistung zu verlangen, steht Gläubigern nicht zu, die im Falle der Insolvenz ein Recht auf vorzugsweise Befriedigung aus einer Deckungsmasse haben, die nach gesetzlicher Vorschrift zu ihrem Schutz errichtet und staatlich überwacht ist."
    },
    {
      "date": "2025-08-04",
      "id": "119076",
      "original_text": "Registerbekanntmachung nach dem Umwandlungsgesetz\nBerlin Amtsgericht Berlin (Charlottenburg) HRB 66476\nAirfair Flugservice GmbH – Berlin",
      "type": "Registerbekanntmachung nach dem Umwandlungsgesetz",
      "state": "Berlin",
      "amtsgericht": "Amtsgericht Berlin (Charlottenburg)",
      "registernummer": "HRB 66476",
      "registerart": "HRB",
      "company_name": "Airfair Flugservice GmbH",
      "company_seat": "Berlin",
      "details": "04.08.2025 (Bekanntmachungsdatum)\n\nBerlin Amtsgericht Berlin (Charlottenburg) HRB 66476\nRegisterbekanntmachung nach dem Umwandlungsgesetz 31.07.2025 (Eintragungsdatum)\n\nAirfair Flugservice GmbH\nGesellschaft mit beschränkter Haftung\nBerlin\n\nZu Eintragungsnummer 20 vom 31.07.2025 wird als nicht eingetragen veröffentlicht: Den Gläubigern der an der Verschmelzung beteiligten Rechtsträger ist, wenn sie binnen sechs Monaten nach dem Tag, an dem die Eintragung der Verschmelzung in das Register des Sitzes desjenigen Rechtsträgers, dessen Gläubiger sie sind, als bekannt gemacht gilt, ihren Anspruch nach Grund und Höhe schriftlich anmelden, Sicherheit zu leisten, soweit sie nicht Befriedigung verlangen können. Dieses Recht steht den Gläubigern jedoch nur zu, wenn sie glaubhaft machen, dass durch die Verschmelzung die Erfüllung ihrer Forderung gefährdet wird. Das Recht, Sicherheitsleistung zu verlangen, steht Gläubigern nicht zu, die im Falle der Insolvenz ein Recht auf vorzugsweise Befriedigung aus einer Deckungsmasse haben, die nach gesetzlicher Vorschrift zu ihrem Schutz errichtet und staatlich überwacht ist."
    },
    {
      "date": "2025-08-04",
      "id": "119077",
      "original_text": "Registerbekanntmachung nach dem Umwandlungsgesetz\nBaden-Württemberg Amtsgericht Stuttgart HRA 739660\nBantle Grundstücks-KG – Rottweil",
      "type": "Registerbekanntmachung nach dem Umwandlungsgesetz",
      "state": "Baden-Württemberg",
      "amtsgericht": "Amtsgericht Stuttgart",
      "registernummer": "HRA 739660",
      "registerart": "HRA",
      "company_name": "Bantle Grundstücks-KG",
      "company_seat": "Rottweil",
      "details": "04.08.2025 (Bekanntmachungsdatum)\n\nBaden-Württemberg Amtsgericht Stuttgart HRA 739660\nRegisterbekanntmachung nach dem Umwandlungsgesetz 04.08.2025 (Eintragungsdatum)\n\nBantle Grundstücks-KG\nKommanditgesellschaft\nRottweil\n\nAls nicht eingetragen wird bekanntgemacht:\nDen Gläubigern der an der Verschmelzung beteiligten Rechtsträger ist, wenn sie binnen sechs Monaten nach dem Tag, an dem die Eintragung der Verschmelzung in das Register des Sitzes desjenigen Rechtsträgers, dessen Gläubiger sie sind, nach § 19 Abs. 3 UmwG als bekanntgemacht gilt, ihren Anspruch nach Grund und Höhe schriftlich anmelden, Sicherheit zu leisten, soweit sie nicht Befriedigung verlangen können. Dieses Recht steht den Gläubigern jedoch nur zu, wenn sie glaubhaft machen, dass durch die Verschmelzung die Erfüllung ihrer Forderung gefährdet wird."
    },
    {
      "date": "2025-08-04",
      "id": "119078",
      "original_text": "Registerbekanntmachung nach dem Umwandlungsgesetz\nBaden-Württemberg Amtsgericht Stuttgart HRA 471286\nGebrüder Bantle Verpachtungs-GmbH & Co. KG – Bösingen",
      "type": "Registerbekanntmachung nach dem Umwandlungsgesetz",
      "state": "Baden-Württemberg",
      "amtsgericht": "Amtsgericht Stuttgart",
      "registernummer": "HRA 471286",
      "registerart": "HRA",
      "company_name": "Gebrüder Bantle Verpachtungs-GmbH & Co. KG",
      "company_seat": "Bösingen",
      "details": "04.08.2025 (Bekanntmachungsdatum)\n\nBaden-Württemberg Amtsgericht Stuttgart HRA 471286\nRegisterbekanntmachung nach dem Umwandlungsgesetz 04.08.2025 (Eintragungsdatum)\n\nGebrüder Bantle Verpachtungs-GmbH & Co. KG\nKommanditgesellschaft\nBösingen\n\nAls nicht eingetragen wird bekanntgemacht:\nDen Gläubigern der an der Verschmelzung beteiligten Rechtsträger ist, wenn sie binnen sechs Monaten nach dem Tag, an dem die Eintragung der Verschmelzung in das Register des Sitzes desjenigen Rechtsträgers, dessen Gläubiger sie sind, nach § 19 Abs. 3 UmwG als bekanntgemacht gilt, ihren Anspruch nach Grund und Höhe schriftlich anmelden, Sicherheit zu leisten, soweit sie nicht Befriedigung verlangen können. Dieses Recht steht den Gläubigern jedoch nur zu, wenn sie glaubhaft machen, dass durch die Verschmelzung die Erfüllung ihrer Forderung gefährdet wird."
    },
    {
      "date": "2025-08-04",
      "id": "119079",
      "original_text": "Registerbekanntmachung nach dem Umwandlungsgesetz\nBaden-Württemberg Amtsgericht Stuttgart HRB 801040\nDOLI Elektronik GmbH – Münsingen",
      "type": "Registerbekanntmachung nach dem Umwandlungsgesetz",
      "state": "Baden-Württemberg",
      "amtsgericht": "Amtsgericht Stuttgart",
      "registernummer": "HRB 801040",
      "registerart": "HRB",
      "company_name": "DOLI Elektronik GmbH",
      "company_seat": "Münsingen",
      "details": "04.08.2025 (Bekanntmachungsdatum)\n\nBaden-Württemberg Amtsgericht Stuttgart HRB 801040\nRegisterbekanntmachung nach dem Umwandlungsgesetz 04.08.2025 (Eintragungsdatum)\n\nDOLI Elektronik GmbH\nGesellschaft mit beschränkter Haftung\nMünsingen\n\nDen Gläubigern der an der Verschmelzung beteiligten Rechtsträger ist, wenn sie binnen sechs Monaten nach dem Tag, an dem die Eintragung der Verschmelzung in das Register des Sitzes desjenigen Rechtsträgers, dessen Gläubiger sie sind, nach § 19 Abs. 3 UmwG als bekanntgemacht gilt, ihren Anspruch nach Grund und Höhe schriftlich anmelden, Sicherheit zu leisten, soweit sie nicht Befriedigung verlangen können. Dieses Recht steht den Gläubigern jedoch nur zu, wenn sie glaubhaft machen, dass durch die Verschmelzung die Erfüllung ihrer Forderung gefährdet wird."
    },
    {
      "date": "2025-08-04",
      "id": "119080",
      "original_text": "Einreichung neuer Dokumente\nHamburg Amtsgericht Hamburg HRB 178048\nBP MKA1 GmbH – Hamburg",
      "type": "Einreichung neuer Dokumente",
      "state": "Hamburg",
      "amtsgericht": "Amtsgericht Hamburg",
      "registernummer": "HRB 178048",
      "registerart": "HRB",
      "company_name": "BP MKA1 GmbH",
      "company_seat": "Hamburg",
      "details": "04.08.2025 (Bekanntmachungsdatum)\n\nHamburg Amtsgericht Hamburg HRB 178048\nEinreichung neuer Dokumente\n\nBP MKA1 GmbH\nGesellschaft mit beschränkter Haftung\nHamburg\n\nAls nicht eingetragen wird bekanntgemacht:\nEs wird darauf hingewiesen, dass ein Verschmelzungsplan oder sein Entwurf über eine grenzüberschreitende Verschmelzung zur Aufnahme mit der Helon Luxembourg S.à r.l. (übernehmende Gesellschaft) mit Sitz in Luxemburg/Luxemburg (Registre de commerce et des sociétés B249414) (société à responsabilité limitée - Gesellschaft mit beschränkter Haftung  nach luxemburgischem Recht) beim Handelsregister eingereicht worden ist.\nDie übertragende Gesellschaft ist die BP MKA1 GmbH, eine Gesellschaft mit beschränkter Haftung nach deutschem Recht, mit dem Sitz in Hamburg, eingetragen im Handelsregister des Amtsgerichts Hamburg unter HRB 178048.\nDie Anteilsinhaber, die Gläubiger sowie die zuständigen Betriebsräte der an der grenzüberschreitenden Verschmelzung beteiligten Gesellschaften oder, soweit es keinen Betriebsrat gibt, die Arbeitnehmer der an der grenzüberschreitenden Verschmelzung beteiligten Gesellschaften, können der jeweiligen Gesellschaft spätestens fünf Arbeitstage vor dem Tag der Beurkundung des Verschmelzungsplans, die für den 27.08.2025 geplant ist, Bemerkungen zum Verschmelzungsplan übermitteln."
    },
    {
      "date": "2025-08-04",
      "id": "119081",
      "original_text": "Registerbekanntmachung nach dem Umwandlungsgesetz\nHamburg Amtsgericht Hamburg HRB 98549\nBITMARCK Technik GmbH – Hamburg",
      "type": "Registerbekanntmachung nach dem Umwandlungsgesetz",
      "state": "Hamburg",
      "amtsgericht": "Amtsgericht Hamburg",
      "registernummer": "HRB 98549",
      "registerart": "HRB",
      "company_name": "BITMARCK Technik GmbH",
      "company_seat": "Hamburg",
      "details": "04.08.2025 (Bekanntmachungsdatum)\n\nHamburg Amtsgericht Hamburg HRB 98549\nRegisterbekanntmachung nach dem Umwandlungsgesetz 04.08.2025 (Eintragungsdatum)\n\nBITMARCK Technik GmbH\nGesellschaft mit beschränkter Haftung\nHamburg\n\nAls nicht eingetragen wird bekannt gemacht:\nDen Gläubigern der an der Verschmelzung beteiligten Gesellschaften ist, wenn sie binnen sechs Monaten nach dem Tag, an dem die Eintragung der Verschmelzung in das Register des Sitzes desjenigen Rechtsträgers, dessen Gläubiger sie sind, nach § 19 Absatz 3 UmwG als bekannt gemacht gilt, ihren Anspruch nach Grund und Höhe schriftlich anmelden, Sicherheit zu leisten, soweit sie nicht Befriedigung verlangen können. Dieses Recht steht den Gläubigern jedoch nur zu, wenn sie glaubhaft machen, dass durch die Verschmelzung die Erfüllung ihrer Forderung gefährdet wird."
    },
    {
      "date": "2025-08-04",
      "id": "119082",
      "original_text": "Registerbekanntmachung nach dem Umwandlungsgesetz\nBaden-Württemberg Amtsgericht Mannheim HRB 700971\nIn Form GmbH – Mannheim",
      "type": "Registerbekanntmachung nach dem Umwandlungsgesetz",
      "state": "Baden-Württemberg",
      "amtsgericht": "Amtsgericht Mannheim",
      "registernummer": "HRB 700971",
      "registerart": "HRB",
      "company_name": "In Form GmbH",
      "company_seat": "Mannheim",
      "details": "04.08.2025 (Bekanntmachungsdatum)\n\nBaden-Württemberg Amtsgericht Mannheim HRB 700971\nRegisterbekanntmachung nach dem Umwandlungsgesetz 04.08.2025 (Eintragungsdatum)\n\nIn Form GmbH\nGesellschaft mit beschränkter Haftung\nMannheim\n\nAls nicht eingetragen wird bekanntgemacht: Den Gläubigern der an der Verschmelzung beteiligten Rechtsträger ist, wenn sie binnen sechs Monaten nach dem Tag, an dem die Eintragung der Verschmelzung in das Register des Sitzes desjenigen Rechtsträgers, dessen Gläubiger sie sind, nach § 19 Abs. 3 UmwG als bekanntgemacht gilt, ihren Anspruch nach Grund und Höhe schriftlich anmelden, Sicherheit zu leisten, soweit sie nicht Befriedigung verlangen können. Dieses Recht steht den Gläubigern jedoch nur zu, wenn sie glaubhaft machen, dass durch die Verschmelzung die Erfüllung ihrer Forderung gefährdet wird."
    },
    {
      "date": "2025-08-04",
      "id": "119083",
      "original_text": "Registerbekanntmachung nach dem Umwandlungsgesetz\nBaden-Württemberg Amtsgericht Mannheim HRB 754364\nIn Form GmbH – Mannheim",
      "type": "Registerbekanntmachung nach dem Umwandlungsgesetz",
      "state": "Baden-Württemberg",
      "amtsgericht": "Amtsgericht Mannheim",
      "registernummer": "HRB 754364",
      "registerart": "HRB",
      "company_name": "In Form GmbH",
      "company_seat": "Mannheim",
      "details": "04.08.2025 (Bekanntmachungsdatum)\n\nBaden-Württemberg Amtsgericht Mannheim HRB 754364\nRegisterbekanntmachung nach dem Umwandlungsgesetz 04.08.2025 (Eintragungsdatum)\n\nIn Form GmbH\nGesellschaft mit beschränkter Haftung\nMannheim\n\nDen Gläubigern der an der Verschmelzung beteiligten Rechtsträger ist, wenn sie binnen sechs Monaten nach dem Tag, an dem die Eintragung der Verschmelzung in das Register des Sitzes desjenigen Rechtsträgers, dessen Gläubiger sie sind, nach § 19 Abs. 3 UmwG als bekanntgemacht gilt, ihren Anspruch nach Grund und Höhe schriftlich anmelden, Sicherheit zu leisten, soweit sie nicht Befriedigung verlangen können. Dieses Recht steht den Gläubigern jedoch nur zu, wenn sie glaubhaft machen, dass durch die Verschmelzung die Erfüllung ihrer Forderung gefährdet wird."
    },
    {
      "date": "2025-08-04",
      "id": "119084",
      "original_text": "Löschungsankündigung\nMecklenburg-Vorpommern Amtsgericht Rostock HRB 12200\nRF Invest GmbH – Rostock",
      "type": "Löschungsankündigung",
      "state": "Mecklenburg-Vorpommern",
      "amtsgericht": "Amtsgericht Rostock",
      "registernummer": "HRB 12200",
      "registerart": "HRB",
      "company_name": "RF Invest GmbH",
      "company_seat": "Rostock",
      "details": "04.08.2025 (Bekanntmachungsdatum)\n\nMecklenburg-Vorpommern Amtsgericht Rostock HRB 12200\nLöschungsankündigung\n\nRF Invest GmbH\nGesellschaft mit beschränkter Haftung\nRostock\n\nDas Registergericht beabsichtigt, die im Handelsregister eingetragene Gesellschaft von Amts wegen nach § 394 FamFG zu löschen. Die Frist zur Erhebung eines Widerspruchs gegen die beabsichtigte Löschung wird auf 1 Monat festgesetzt."
    },
    {
      "date": "2025-08-04",
      "id": "119085",
      "original_text": "Registerbekanntmachung nach dem Umwandlungsgesetz\nHamburg Amtsgericht Hamburg HRB 103633\nRichter BioTec Management GmbH – Hamburg",
      "type": "Registerbekanntmachung nach dem Umwandlungsgesetz",
      "state": "Hamburg",
      "amtsgericht": "Amtsgericht Hamburg",
      "registernummer": "HRB 103633",
      "registerart": "HRB",
      "company_name": "Richter BioTec Management GmbH",
      "company_seat": "Hamburg",
      "details": "04.08.2025 (Bekanntmachungsdatum)\n\nHamburg Amtsgericht Hamburg HRB 103633\nRegisterbekanntmachung nach dem Umwandlungsgesetz 04.08.2025 (Eintragungsdatum)\n\nRichter BioTec Management GmbH\nGesellschaft mit beschränkter Haftung\nHamburg\n\nAls nicht eingetragen wird bekannt gemacht:\nDen Gläubigern der an der Verschmelzung beteiligten Gesellschaften ist, wenn sie binnen sechs Monaten nach dem Tag, an dem die Eintragung der Verschmelzung in das Register des Sitzes desjenigen Rechtsträgers, dessen Gläubiger sie sind, nach § 19 Absatz 3 UmwG als bekannt gemacht gilt, ihren Anspruch nach Grund und Höhe schriftlich anmelden, Sicherheit zu leisten, soweit sie nicht Befriedigung verlangen können. Dieses Recht steht den Gläubigern jedoch nur zu, wenn sie glaubhaft machen, dass durch die Verschmelzung die Erfüllung ihrer Forderung gefährdet wird."
    },
    {
      "date": "2025-08-04",
      "id": "119086",
      "original_text": "Registerbekanntmachung nach dem Umwandlungsgesetz\nHamburg Amtsgericht Hamburg HRB 192356\nRichter BioTec GmbH – Hamburg",
      "type": "Registerbekanntmachung nach dem Umwandlungsgesetz",
      "state": "Hamburg",
      "amtsgericht": "Amtsgericht Hamburg",
      "registernummer": "HRB 192356",
      "registerart": "HRB",
      "company_name": "Richter BioTec GmbH",
      "company_seat": "Hamburg",
      "details": "04.08.2025 (Bekanntmachungsdatum)\n\nHamburg Amtsgericht Hamburg HRB 192356\nRegisterbekanntmachung nach dem Umwandlungsgesetz 04.08.2025 (Eintragungsdatum)\n\nRichter BioTec GmbH\nGesellschaft mit beschränkter Haftung\nHamburg\n\nAls nicht eingetragen wird bekannt gemacht:\nDen Gläubigern der an der Verschmelzung beteiligten Gesellschaften ist, wenn sie binnen sechs Monaten nach dem Tag, an dem die Eintragung der Verschmelzung in das Register des Sitzes desjenigen Rechtsträgers, dessen Gläubiger sie sind, nach § 19 Absatz 3 UmwG als bekannt gemacht gilt, ihren Anspruch nach Grund und Höhe schriftlich anmelden, Sicherheit zu leisten, soweit sie nicht Befriedigung verlangen können. Dieses Recht steht den Gläubigern jedoch nur zu, wenn sie glaubhaft machen, dass durch die Verschmelzung die Erfüllung ihrer Forderung gefährdet wird."
    },
    {
      "date": "2025-08-04",
      "id": "119087",
      "original_text": "Registerbekanntmachung nach dem Umwandlungsgesetz\nHamburg Amtsgericht Hamburg HRB 183500\nPrEQT Invest GmbH – Hamburg",
      "type": "Registerbekanntmachung nach dem Umwandlungsgesetz",
      "state": "Hamburg",
      "amtsgericht": "Amtsgericht Hamburg",
      "registernummer": "HRB 183500",
      "registerart": "HRB",
      "company_name": "PrEQT Invest GmbH",
      "company_seat": "Hamburg",
      "details": "04.08.2025 (Bekanntmachungsdatum)\n\nHamburg Amtsgericht Hamburg HRB 183500\nRegisterbekanntmachung nach dem Umwandlungsgesetz 04.08.2025 (Eintragungsdatum)\n\nPrEQT Invest GmbH\nGesellschaft mit beschränkter Haftung\nHamburg\n\nAls nicht eingetragen wird bekannt gemacht:\nDen Gläubigern der an der Verschmelzung beteiligten Gesellschaften ist, wenn sie binnen sechs Monaten nach dem Tag, an dem die Eintragung der Verschmelzung in das Register des Sitzes desjenigen Rechtsträgers, dessen Gläubiger sie sind, nach § 19 Absatz 3 UmwG als bekannt gemacht gilt, ihren Anspruch nach Grund und Höhe schriftlich anmelden, Sicherheit zu leisten, soweit sie nicht Befriedigung verlangen können. Dieses Recht steht den Gläubigern jedoch nur zu, wenn sie glaubhaft machen, dass durch die Verschmelzung die Erfüllung ihrer Forderung gefährdet wird."
    },
    {
      "date": "2025-08-04",
      "id": "119088",
      "original_text": "Löschungsankündigung\nBaden-Württemberg Amtsgericht Freiburg HRB 719277\nGehri Immobilien Konzepte GmbH – Emmendingen",
      "type": "Löschungsankündigung",
      "state": "Baden-Württemberg",
      "amtsgericht": "Amtsgericht Freiburg",
      "registernummer": "HRB 719277",
      "registerart": "HRB",
      "company_name": "Gehri Immobilien Konzepte GmbH",
      "company_seat": "Emmendingen",
      "details": "04.08.2025 (Bekanntmachungsdatum)\n\nBaden-Württemberg Amtsgericht Freiburg HRB 719277\nLöschungsankündigung 04.08.2025 (Eintragungsdatum)\n\nGehri Immobilien Konzepte GmbH\nGesellschaft mit beschränkter Haftung\nEmmendingen\n\nAls nicht eingetragen wird bekanntgemacht:\nDen Gläubigern der Gesellschaft, deren Forderungen begründet worden sind, bevor die Eintragung der Beendigung des Vertrages in das Handelsregister nach § 10 HGB als bekanntgemacht gilt, ist vom anderen Vertragsteil Sicherheit zu leisten, wenn sie sich binnen sechs Monaten nach der Bekanntmachung zu diesem Zweck bei ihm melden."
    },
    {
      "date": "2025-08-04",
      "id": "119089",
      "original_text": "Löschungsankündigung\nBrandenburg Amtsgericht Neuruppin VR 4303\n\"Wiesengrund\" e.V. – Schwedt/Oder",
      "type": "Löschungsankündigung",
      "state": "Brandenburg",
      "amtsgericht": "Amtsgericht Neuruppin",
      "registernummer": "VR 4303",
      "registerart": "VR",
      "company_name": "\"Wiesengrund\" e.V.",
      "company_seat": "Schwedt/Oder",
      "details": "04.08.2025 (Bekanntmachungsdatum)\n\nBrandenburg Amtsgericht Neuruppin VR 4303\nLöschungsankündigung\n\n\"Wiesengrund\" e.V.\neingetragener Verein\nSchwedt/Oder\n\nEs ist beabsichtigt, die Eintragung mangels einer wesentlichen Voraussetzung gemäß § 395 FamFG von Amts wegen zu löschen.\nWiderspruchsfrist: 1 Monat"
    },
    {
      "date": "2025-08-04",
      "id": "119090",
      "original_text": "Registerbekanntmachung nach dem Umwandlungsgesetz\nHamburg Amtsgericht Hamburg HRB 193867\nFISHROCK GmbH – Hamburg",
      "type": "Registerbekanntmachung nach dem Umwandlungsgesetz",
      "state": "Hamburg",
      "amtsgericht": "Amtsgericht Hamburg",
      "registernummer": "HRB 193867",
      "registerart": "HRB",
      "company_name": "FISHROCK GmbH",
      "company_seat": "Hamburg",
      "details": "04.08.2025 (Bekanntmachungsdatum)\n\nHamburg Amtsgericht Hamburg HRB 193867\nRegisterbekanntmachung nach dem Umwandlungsgesetz 04.08.2025 (Eintragungsdatum)\n\nFISHROCK GmbH\nGesellschaft mit beschränkter Haftung\nHamburg\n\nAls nicht eingetragen wird bekannt gemacht:\nDen Gläubigern der an der Ausgliederung beteiligten Gesellschaften ist, wenn sie binnen sechs Monaten nach dem Tag, an dem die Eintragung der Ausgliederung in das Register des Sitzes desjenigen Rechtsträgers, dessen Gläubiger sie sind, nach § 19 Absatz 3 UmwG als bekannt gemacht gilt, ihren Anspruch nach Grund und Höhe schriftlich anmelden, Sicherheit zu leisten, soweit sie nicht Befriedigung verlangen können. Dieses Recht steht den Gläubigern jedoch nur zu, wenn sie glaubhaft machen, dass durch die Ausgliederung die Erfüllung ihrer Forderung gefährdet wird."
    },
    {
      "date": "2025-08-04",
      "id": "119091",
      "original_text": "Registerbekanntmachung nach dem Umwandlungsgesetz\nHamburg Amtsgericht Hamburg HRB 188167\nFISHROCK Consulting GmbH – Hamburg",
      "type": "Registerbekanntmachung nach dem Umwandlungsgesetz",
      "state": "Hamburg",
      "amtsgericht": "Amtsgericht Hamburg",
      "registernummer": "HRB 188167",
      "registerart": "HRB",
      "company_name": "FISHROCK Consulting GmbH",
      "company_seat": "Hamburg",
      "details": "04.08.2025 (Bekanntmachungsdatum)\n\nHamburg Amtsgericht Hamburg HRB 188167\nRegisterbekanntmachung nach dem Umwandlungsgesetz 04.08.2025 (Eintragungsdatum)\n\nFISHROCK Consulting GmbH\nGesellschaft mit beschränkter Haftung\nHamburg\n\nAls nicht eingetragen wird bekannt gemacht:\nDen Gläubigern der an der Ausgliederung beteiligten Gesellschaften ist, wenn sie binnen sechs Monaten nach dem Tag, an dem die Eintragung der Ausgliederung in das Register des Sitzes desjenigen Rechtsträgers, dessen Gläubiger sie sind, nach § 19 Absatz 3 UmwG als bekannt gemacht gilt, ihren Anspruch nach Grund und Höhe schriftlich anmelden, Sicherheit zu leisten, soweit sie nicht Befriedigung verlangen können. Dieses Recht steht den Gläubigern jedoch nur zu, wenn sie glaubhaft machen, dass durch die Ausgliederung die Erfüllung ihrer Forderung gefährdet wird."
    },
    {
      "date": "2025-08-04",
      "id": "119092",
      "original_text": "Registerbekanntmachung nach dem Umwandlungsgesetz\nBaden-Württemberg Amtsgericht Mannheim HRB 460231\nWEISS GmbH – Buchen Odenwald",
      "type": "Registerbekanntmachung nach dem Umwandlungsgesetz",
      "state": "Baden-Württemberg",
      "amtsgericht": "Amtsgericht Mannheim",
      "registernummer": "HRB 460231",
      "registerart": "HRB",
      "company_name": "WEISS GmbH",
      "company_seat": "Buchen Odenwald",
      "details": "04.08.2025 (Bekanntmachungsdatum)\n\nBaden-Württemberg Amtsgericht Mannheim HRB 460231\nRegisterbekanntmachung nach dem Umwandlungsgesetz 04.08.2025 (Eintragungsdatum)\n\nWEISS GmbH\nGesellschaft mit beschränkter Haftung\nBuchen Odenwald\n\nDen Gläubigern der an der Verschmelzung beteiligten Rechtsträger ist, wenn sie binnen sechs Monaten nach dem Tag, an dem die Eintragung der Verschmelzung in das Register des Sitzes desjenigen Rechtsträgers, dessen Gläubiger sie sind, nach § 19 Abs. 3 UmwG als bekanntgemacht gilt, ihren Anspruch nach Grund und Höhe schriftlich anmelden, Sicherheit zu leisten, soweit sie nicht Befriedigung verlangen können. Dieses Recht steht den Gläubigern jedoch nur zu, wenn sie glaubhaft machen, dass durch die Verschmelzung die Erfüllung ihrer Forderung gefährdet wird."
    },
    {
      "date": "2025-08-04",
      "id": "119093",
      "original_text": "Registerbekanntmachung nach dem Umwandlungsgesetz\nHamburg Amtsgericht Hamburg HRB 98768\nVeolia Paper Germany GmbH – Hamburg",
      "type": "Registerbekanntmachung nach dem Umwandlungsgesetz",
      "state": "Hamburg",
      "amtsgericht": "Amtsgericht Hamburg",
      "registernummer": "HRB 98768",
      "registerart": "HRB",
      "company_name": "Veolia Paper Germany GmbH",
      "company_seat": "Hamburg",
      "details": "04.08.2025 (Bekanntmachungsdatum)\n\nHamburg Amtsgericht Hamburg HRB 98768\nRegisterbekanntmachung nach dem Umwandlungsgesetz 04.08.2025 (Eintragungsdatum)\n\nVeolia Paper Germany GmbH\nGesellschaft mit beschränkter Haftung\nHamburg\n\nAls nicht eingetragen wird bekannt gemacht:\nDen Gläubigern der an der Verschmelzung beteiligten Gesellschaften ist, wenn sie binnen sechs Monaten nach dem Tag, an dem die Eintragung der Verschmelzung in das Register des Sitzes desjenigen Rechtsträgers, dessen Gläubiger sie sind, nach § 19 Absatz 3 UmwG als bekannt gemacht gilt, ihren Anspruch nach Grund und Höhe schriftlich anmelden, Sicherheit zu leisten, soweit sie nicht Befriedigung verlangen können. Dieses Recht steht den Gläubigern jedoch nur zu, wenn sie glaubhaft machen, dass durch die Verschmelzung die Erfüllung ihrer Forderung gefährdet wird."
    },
    {
      "date": "2025-08-04",
      "id": "119094",
      "original_text": "Registerbekanntmachung nach dem Umwandlungsgesetz\nHamburg Amtsgericht Hamburg HRB 193736\nVeolia Paper Germany GmbH – Hamburg",
      "type": "Registerbekanntmachung nach dem Umwandlungsgesetz",
      "state": "Hamburg",
      "amtsgericht": "Amtsgericht Hamburg",
      "registernummer": "HRB 193736",
      "registerart": "HRB",
      "company_name": "Veolia Paper Germany GmbH",
      "company_seat": "Hamburg",
      "details": "04.08.2025 (Bekanntmachungsdatum)\n\nHamburg Amtsgericht Hamburg HRB 193736\nRegisterbekanntmachung nach dem Umwandlungsgesetz 04.08.2025 (Eintragungsdatum)\n\nVeolia Paper Germany GmbH\nGesellschaft mit beschränkter Haftung\nHamburg\n\nAls nicht eingetragen wird bekannt gemacht:\nDen Gläubigern der an der Verschmelzung beteiligten Gesellschaften ist, wenn sie binnen sechs Monaten nach dem Tag, an dem die Eintragung der Verschmelzung in das Register des Sitzes desjenigen Rechtsträgers, dessen Gläubiger sie sind, nach § 19 Absatz 3 UmwG als bekannt gemacht gilt, ihren Anspruch nach Grund und Höhe schriftlich anmelden, Sicherheit zu leisten, soweit sie nicht Befriedigung verlangen können. Dieses Recht steht den Gläubigern jedoch nur zu, wenn sie glaubhaft machen, dass durch die Verschmelzung die Erfüllung ihrer Forderung gefährdet wird."
    },
    {
      "date": "2025-08-04",
      "id": "119095",
      "original_text": "Registerbekanntmachung nach dem Umwandlungsgesetz\nHamburg Amtsgericht Hamburg HRB 133270\nEOLI Invest GmbH – Hamburg",
      "type": "Registerbekanntmachung nach dem Umwandlungsgesetz",
      "state": "Hamburg",
      "amtsgericht": "Amtsgericht Hamburg",
      "registernummer": "HRB 133270",
      "registerart": "HRB",
      "company_name": "EOLI Invest GmbH",
      "company_seat": "Hamburg",
      "details": "04.08.2025 (Bekanntmachungsdatum)\n\nHamburg Amtsgericht Hamburg HRB 133270\nRegisterbekanntmachung nach dem Umwandlungsgesetz\n\nEOLI Invest GmbH\nGesellschaft mit beschränkter Haftung\nHamburg\n\nAls nicht eingetragen wird bekanntgemacht:\nEs wird darauf hingewiesen, dass ein Verschmelzungsplan oder sein Entwurf über eine grenzüberschreitende Verschmelzung zur Aufnahme mit der EOLI Beteiligung GmbH mit Sitz in Wien/Österreich (Österreichisches Firmenbuch 418533s) (Gesellschaft mit beschränkter Haftung nach österreichischem Recht) beim Handelsregister eingereicht worden ist.\nDie Anteilsinhaber, die Gläubiger sowie die zuständigen Betriebsräte der an der grenzüberschreitenden Verschmelzung beteiligten Gesellschaften oder, soweit es keinen Betriebsrat gibt, die Arbeitnehmer der an der grenzüberschreitenden Verschmelzung beteiligten Gesellschaften, können der jeweiligen Gesellschaft spätestens fünf Arbeitstage vor dem Tag der Gesellschafterversammlung, die voraussichtlich am 28.08.2025 stattfinden wird, Bemerkungen zum Verschmelzungsplan übermitteln."
    },
    {
      "date": "2025-08-04",
      "id": "119096",
      "original_text": "Registerbekanntmachung nach dem Umwandlungsgesetz\nHamburg Amtsgericht Hamburg HRA 72599\nMACS Maritime Carrier Shipping GmbH & Co. – Hamburg",
      "type": "Registerbekanntmachung nach dem Umwandlungsgesetz",
      "state": "Hamburg",
      "amtsgericht": "Amtsgericht Hamburg",
      "registernummer": "HRA 72599",
      "registerart": "HRA",
      "company_name": "MACS Maritime Carrier Shipping GmbH & Co.",
      "company_seat": "Hamburg",
      "details": "04.08.2025 (Bekanntmachungsdatum)\n\nHamburg Amtsgericht Hamburg HRA 72599\nRegisterbekanntmachung nach dem Umwandlungsgesetz 01.08.2025 (Eintragungsdatum)\n\nMACS Maritime Carrier Shipping GmbH & Co.\nKommanditgesellschaft\nHamburg\n\nAls nicht eingetragen wird bekannt gemacht:\nDen Gläubigern der an der Verschmelzung beteiligten Gesellschaften ist, wenn sie binnen sechs Monaten nach dem Tag, an dem die Eintragung der Verschmelzung in das Register des Sitzes desjenigen Rechtsträgers, dessen Gläubiger sie sind, nach § 19 Absatz 3 UmwG als bekannt gemacht gilt, ihren Anspruch nach Grund und Höhe schriftlich anmelden, Sicherheit zu leisten, soweit sie nicht Befriedigung verlangen können. Dieses Recht steht den Gläubigern jedoch nur zu, wenn sie glaubhaft machen, dass durch die Verschmelzung die Erfüllung ihrer Forderung gefährdet wird."
    },
    {
      "date": "2025-08-04",
      "id": "119097",
      "original_text": "Einreichung neuer Dokumente\nHamburg Amtsgericht Hamburg HRB 126094\nLichtBlick SE – Hamburg",
      "type": "Einreichung neuer Dokumente",
      "state": "Hamburg",
      "amtsgericht": "Amtsgericht Hamburg",
      "registernummer": "HRB 126094",
      "registerart": "HRB",
      "company_name": "LichtBlick SE",
      "company_seat": "Hamburg",
      "details": "04.08.2025 (Bekanntmachungsdatum)\n\nHamburg Amtsgericht Hamburg HRB 126094\nEinreichung neuer Dokumente 04.08.2025 (Eintragungsdatum)\n\nLichtBlick SE\nEuropäische Aktiengesellschaft (SE)\nHamburg\n\nAls nicht eingetragen wird bekannt gemacht: Liste des Aufsichtsrats wurde eingereicht."
    },
    {
      "date": "2025-08-04",
      "id": "119098",
      "original_text": "Löschungsankündigung\nSachsen Amtsgericht Dresden HRB 25977\nNowatell GmbH – Dresden",
      "type": "Löschungsankündigung",
      "state": "Sachsen",
      "amtsgericht": "Amtsgericht Dresden",
      "registernummer": "HRB 25977",
      "registerart": "HRB",
      "company_name": "Nowatell GmbH",
      "company_seat": "Dresden",
      "details": "04.08.2025 (Bekanntmachungsdatum)\n\nSachsen Amtsgericht Dresden HRB 25977\nLöschungsankündigung\n\nNowatell GmbH\nGesellschaft mit beschränkter Haftung\nDresden\n\nDas Registergericht beabsichtigt, die im Handelsregister eingetragene Gesellschaft von Amts wegen nach § 394 FamFG zu löschen. Die Frist zu Erhebung eines Widerspruchs gegen die beabsichtigte Löschung wird auf einen Monat festgesetzt."
    },
    {
      "date": "2025-08-04",
      "id": "119099",
      "original_text": "Registerbekanntmachung nach dem Umwandlungsgesetz\nSachsen Amtsgericht Chemnitz HRB 5078\nUni-Hydraulik GmbH – Schwarzenberg/Erzgeb.",
      "type": "Registerbekanntmachung nach dem Umwandlungsgesetz",
      "state": "Sachsen",
      "amtsgericht": "Amtsgericht Chemnitz",
      "registernummer": "HRB 5078",
      "registerart": "HRB",
      "company_name": "Uni-Hydraulik GmbH",
      "company_seat": "Schwarzenberg/Erzgeb.",
      "details": "04.08.2025 (Bekanntmachungsdatum)\n\nSachsen Amtsgericht Chemnitz HRB 5078\nRegisterbekanntmachung nach dem Umwandlungsgesetz 04.08.2025 (Eintragungsdatum)\n\nUni-Hydraulik GmbH\nGesellschaft mit beschränkter Haftung\nSchwarzenberg/Erzgeb.\n\nDen Gläubigern der an der Verschmelzung beteiligten Rechtsträger ist, wenn sie binnen sechs Monaten nach dem Tag, an dem die Eintragung der Verschmelzung in das Register des Sitzes desjenigen Rechtsträgers, dessen Gläubiger sie sind, nach § 19 Abs. 3 UmwG als bekannt gemacht gilt, ihren Anspruch nach Grund und Höhe in Textform anmelden, Sicherheit zu leisten, soweit sie nicht Befriedigung verlangen können. Dieses Recht steht den Gläubigern jedoch nur zu, wenn sie glaubhaft machen, dass durch die Verschmelzung die Erfüllung der Forderung gefährdet wird."
    },
    {
      "date": "2025-08-04",
      "id": "119100",
      "original_text": "Registerbekanntmachung nach dem Umwandlungsgesetz\nSachsen Amtsgericht Chemnitz HRB 31149\nAHS GmbH Annaberger Hydraulik Service – Annaberg-Buchholz",
      "type": "Registerbekanntmachung nach dem Umwandlungsgesetz",
      "state": "Sachsen",
      "amtsgericht": "Amtsgericht Chemnitz",
      "registernummer": "HRB 31149",
      "registerart": "HRB",
      "company_name": "AHS GmbH Annaberger Hydraulik Service",
      "company_seat": "Annaberg-Buchholz",
      "details": "04.08.2025 (Bekanntmachungsdatum)\n\nSachsen Amtsgericht Chemnitz HRB 31149\nRegisterbekanntmachung nach dem Umwandlungsgesetz 04.08.2025 (Eintragungsdatum)\n\nAHS GmbH Annaberger Hydraulik Service\nGesellschaft mit beschränkter Haftung\nAnnaberg-Buchholz\n\nDen Gläubigern der an der Verschmelzung beteiligten Rechtsträger ist, wenn sie binnen sechs Monaten nach dem Tag, an dem die Eintragung der Verschmelzung in das Register des Sitzes desjenigen Rechtsträgers, dessen Gläubiger sie sind, nach § 19 Abs. 3 UmwG als bekannt gemacht gilt, ihren Anspruch nach Grund und Höhe in Textform anmelden, Sicherheit zu leisten, soweit sie nicht Befriedigung verlangen können. Dieses Recht steht den Gläubigern jedoch nur zu, wenn sie glaubhaft machen, dass durch die Verschmelzung die Erfüllung der Forderung gefährdet wird."
    },
    {
      "date": "2025-08-04",
      "id": "119101",
      "original_text": "Registerbekanntmachung nach dem Umwandlungsgesetz\nSachsen Amtsgericht Leipzig HRA 19716\nTeltscher Li Cars e.K. – Taucha",
      "type": "Registerbekanntmachung nach dem Umwandlungsgesetz",
      "state": "Sachsen",
      "amtsgericht": "Amtsgericht Leipzig",
      "registernummer": "HRA 19716",
      "registerart": "HRA",
      "company_name": "Teltscher Li Cars e.K.",
      "company_seat": "Taucha",
      "details": "04.08.2025 (Bekanntmachungsdatum)\n\nSachsen Amtsgericht Leipzig HRA 19716\nRegisterbekanntmachung nach dem Umwandlungsgesetz 04.08.2025 (Eintragungsdatum)\n\nTeltscher Li Cars e.K.\nEinzelkaufmann / Einzelkauffrau\nTaucha\n\nDen Gläubigern der an der Ausgliederung beteiligten Rechtsträger ist, wenn sie binnen sechs Monaten nach dem Tag, an dem die Eintragung der Ausgliederung in das Register des Sitzes desjenigen Rechtsträgers, dessen Gläubiger sie sind, nach § 19 Abs. 3 UmwG als bekannt gemacht gilt, ihren Anspruch nach Grund und Höhe in Textform anmelden, Sicherheit zu leisten, soweit sie nicht Befriedigung verlangen können. Dieses Recht steht den Gläubigern jedoch nur zu, wenn sie glaubhaft machen, dass durch die Ausgliederung die Erfüllung der Forderung gefährdet wird."
    },
    {
      "date": "2025-08-04",
      "id": "119102",
      "original_text": "Löschungsankündigung\nSachsen Amtsgericht Dresden HRB 36530\nSMC Agency UG (haftungsbeschränkt) – Bautzen",
      "type": "Löschungsankündigung",
      "state": "Sachsen",
      "amtsgericht": "Amtsgericht Dresden",
      "registernummer": "HRB 36530",
      "registerart": "HRB",
      "company_name": "SMC Agency UG (haftungsbeschränkt)",
      "company_seat": "Bautzen",
      "details": "04.08.2025 (Bekanntmachungsdatum)\n\nSachsen Amtsgericht Dresden HRB 36530\nLöschungsankündigung\n\nSMC Agency UG (haftungsbeschränkt)\nGesellschaft mit beschränkter Haftung\nBautzen\n\nDas Registergericht beabsichtigt, die im Handelsregister eingetragene Gesellschaft von Amts wegen nach § 394 FamFG zu löschen. Die Frist zu Erhebung eines Widerspruchs gegen die beabsichtigte Löschung wird auf einen Monat festgesetzt."
    },
    {
      "date": "2025-08-04",
      "id": "119103",
      "original_text": "Registerbekanntmachung nach dem Umwandlungsgesetz\nNiedersachsen Amtsgericht Oldenburg (Oldenburg) HRB 217705\nSBL Fulfillment GmbH – Oldenburg",
      "type": "Registerbekanntmachung nach dem Umwandlungsgesetz",
      "state": "Niedersachsen",
      "amtsgericht": "Amtsgericht Oldenburg (Oldenburg)",
      "registernummer": "HRB 217705",
      "registerart": "HRB",
      "company_name": "SBL Fulfillment GmbH",
      "company_seat": "Oldenburg",
      "details": "04.08.2025 (Bekanntmachungsdatum)\n\nNiedersachsen Amtsgericht Oldenburg (Oldenburg) HRB 217705\nRegisterbekanntmachung nach dem Umwandlungsgesetz 04.08.2025 (Eintragungsdatum)\n\nSBL Fulfillment GmbH\nGesellschaft mit beschränkter Haftung\nOldenburg\n\nDen Gläubigern der an der Verschmelzung beteiligten Rechtsträger ist, wenn sie binnen sechs Monaten nach dem Tag, an dem die Eintragung der Verschmelzung in das Register des Sitzes desjenigen Rechtsträgers, dessen Gläubiger sie sind, nach § 19  Abs.  3 UmwG als bekannt gemacht gilt, ihren Anspruch nach Grund und Höhe schriftlich anmelden, Sicherheit zu leisten, soweit sie nicht Befriedigung verlangen können. Dieses Recht steht den Gläubigern jedoch nur zu, wenn sie glaubhaft machen, dass durch die Verschmelzung die Erfüllung der Forderung gefährdet wird."
    },
    {
      "date": "2025-08-04",
      "id": "119104",
      "original_text": "Registerbekanntmachung nach dem Umwandlungsgesetz\nNiedersachsen Amtsgericht Aurich HRA 200424\nMatulla GmbH und Co. KG – Holtgast",
      "type": "Registerbekanntmachung nach dem Umwandlungsgesetz",
      "state": "Niedersachsen",
      "amtsgericht": "Amtsgericht Aurich",
      "registernummer": "HRA 200424",
      "registerart": "HRA",
      "company_name": "Matulla GmbH und Co. KG",
      "company_seat": "Holtgast",
      "details": "04.08.2025 (Bekanntmachungsdatum)\n\nNiedersachsen Amtsgericht Aurich HRA 200424\nRegisterbekanntmachung nach dem Umwandlungsgesetz 04.08.2025 (Eintragungsdatum)\n\nMatulla GmbH und Co. KG\nKommanditgesellschaft\nHoltgast\n\nDen Gläubigern der an der formwechselnden Umwandlung beteiligten Rechtsträger ist, wenn sie binnen sechs Monaten nach dem Tag, an dem die Eintragung der Umwandlung in das Register des Sitzes desjenigen Rechtsträgers, dessen Gläubiger sie sind, nach § 19 Abs. 3 UmwG als bekannt gemacht gilt, ihren Anspruch nach Grund und Höhe schriftlich anmelden, Sicherheit zu leisten, soweit sie nicht Befriedigung verlangen können. Dieses Recht steht den Gläubigern jedoch nur zu, wenn sie glaubhaft machen, dass durch die formwechselnde Umwandlung die Erfüllung der Forderung gefährdet wird."
    },
    {
      "date": "2025-08-04",
      "id": "119105",
      "original_text": "Löschungsankündigung\nNiedersachsen Amtsgericht Hildesheim HRB 208449\nJG Service UG (haftungsbeschränkt) – Alfeld (Leine)",
      "type": "Löschungsankündigung",
      "state": "Niedersachsen",
      "amtsgericht": "Amtsgericht Hildesheim",
      "registernummer": "HRB 208449",
      "registerart": "HRB",
      "company_name": "JG Service UG (haftungsbeschränkt)",
      "company_seat": "Alfeld (Leine)",
      "details": "04.08.2025 (Bekanntmachungsdatum)\n\nNiedersachsen Amtsgericht Hildesheim HRB 208449\nLöschungsankündigung\n\nJG Service UG (haftungsbeschränkt)\nGesellschaft mit beschränkter Haftung\nAlfeld (Leine)\n\nDas Registergericht beabsichtigt, die Gesellschaft von Amts wegen nach § 394 FamFG zu löschen. Die Frist zur Erhebung eines Widerspruchs ist auf 1 Monat ab dieser Registerbekanntmachung festgesetzt."
    },
    {
      "date": "2025-08-04",
      "id": "119106",
      "original_text": "Registerbekanntmachung nach dem Umwandlungsgesetz\nNiedersachsen Amtsgericht Osnabrück HRB 208117\nLethmate Immobilien GmbH – Lingen",
      "type": "Registerbekanntmachung nach dem Umwandlungsgesetz",
      "state": "Niedersachsen",
      "amtsgericht": "Amtsgericht Osnabrück",
      "registernummer": "HRB 208117",
      "registerart": "HRB",
      "company_name": "Lethmate Immobilien GmbH",
      "company_seat": "Lingen",
      "details": "04.08.2025 (Bekanntmachungsdatum)\n\nNiedersachsen Amtsgericht Osnabrück HRB 208117\nRegisterbekanntmachung nach dem Umwandlungsgesetz 04.08.2025 (Eintragungsdatum)\n\nLethmate Immobilien GmbH\nGesellschaft mit beschränkter Haftung\nLingen\n\nDen Gläubigern der an der Verschmelzung beteiligten Rechtsträger ist, wenn sie binnen sechs Monaten nach dem Tag, an dem die Eintragung der Verschmelzung in das Register des Sitzes desjenigen Rechtsträgers, dessen Gläubiger sie sind, nach § 19  Abs.  3 UmwG als bekannt gemacht gilt, ihren Anspruch nach Grund und Höhe schriftlich anmelden, Sicherheit zu leisten, soweit sie nicht Befriedigung verlangen können. Dieses Recht steht den Gläubigern jedoch nur zu, wenn sie glaubhaft machen, dass durch die Verschmelzung die Erfüllung der Forderung gefährdet wird."
    },
    {
      "date": "2025-08-04",
      "id": "119107",
      "original_text": "Registerbekanntmachung nach dem Umwandlungsgesetz\nNiedersachsen Amtsgericht Aurich HRB 207797\nMatulla GmbH – Holtgast",
      "type": "Registerbekanntmachung nach dem Umwandlungsgesetz",
      "state": "Niedersachsen",
      "amtsgericht": "Amtsgericht Aurich",
      "registernummer": "HRB 207797",
      "registerart": "HRB",
      "company_name": "Matulla GmbH",
      "company_seat": "Holtgast",
      "details": "04.08.2025 (Bekanntmachungsdatum)\n\nNiedersachsen Amtsgericht Aurich HRB 207797\nRegisterbekanntmachung nach dem Umwandlungsgesetz 04.08.2025 (Eintragungsdatum)\n\nMatulla GmbH\nGesellschaft mit beschränkter Haftung\nHoltgast\n\nDen Gläubigern der an der formwechselnden Umwandlung beteiligten Rechtsträger ist, wenn sie binnen sechs Monaten nach dem Tag, an dem die Eintragung der Umwandlung in das Register des Sitzes desjenigen Rechtsträgers, dessen Gläubiger sie sind, nach § 19 Abs. 3 UmwG als bekannt gemacht gilt, ihren Anspruch nach Grund und Höhe schriftlich anmelden, Sicherheit zu leisten, soweit sie nicht Befriedigung verlangen können. Dieses Recht steht den Gläubigern jedoch nur zu, wenn sie glaubhaft machen, dass durch die formwechselnde Umwandlung die Erfüllung der Forderung gefährdet wird."
    },
    {
      "date": "2025-08-04",
      "id": "119108",
      "original_text": "Registerbekanntmachung nach dem Umwandlungsgesetz\nNiedersachsen Amtsgericht Walsrode HRB 203637\nConcept Fahrzeuglogistik GmbH – Scheeßel",
      "type": "Registerbekanntmachung nach dem Umwandlungsgesetz",
      "state": "Niedersachsen",
      "amtsgericht": "Amtsgericht Walsrode",
      "registernummer": "HRB 203637",
      "registerart": "HRB",
      "company_name": "Concept Fahrzeuglogistik GmbH",
      "company_seat": "Scheeßel",
      "details": "04.08.2025 (Bekanntmachungsdatum)\n\nNiedersachsen Amtsgericht Walsrode HRB 203637\nRegisterbekanntmachung nach dem Umwandlungsgesetz 04.08.2025 (Eintragungsdatum)\n\nConcept Fahrzeuglogistik GmbH\nGesellschaft mit beschränkter Haftung\nScheeßel\n\nDen Gläubigern der an der Verschmelzung beteiligten Rechtsträger ist, wenn sie binnen sechs Monaten nach dem Tag, an dem die Eintragung der Verschmelzung in das Register des Sitzes desjenigen Rechtsträgers, dessen Gläubiger sie sind, nach § 19  Abs.  3 UmwG als bekannt gemacht gilt, ihren Anspruch nach Grund und Höhe schriftlich anmelden, Sicherheit zu leisten, soweit sie nicht Befriedigung verlangen können. Dieses Recht steht den Gläubigern jedoch nur zu, wenn sie glaubhaft machen, dass durch die Verschmelzung die Erfüllung der Forderung gefährdet wird."
    },
    {
      "date": "2025-08-04",
      "id": "119109",
      "original_text": "Registerbekanntmachung nach dem Umwandlungsgesetz\nNiedersachsen Amtsgericht Oldenburg (Oldenburg) HRB 217932\nSBL Schulbuchausleihe GmbH – Oldenburg",
      "type": "Registerbekanntmachung nach dem Umwandlungsgesetz",
      "state": "Niedersachsen",
      "amtsgericht": "Amtsgericht Oldenburg (Oldenburg)",
      "registernummer": "HRB 217932",
      "registerart": "HRB",
      "company_name": "SBL Schulbuchausleihe GmbH",
      "company_seat": "Oldenburg",
      "details": "04.08.2025 (Bekanntmachungsdatum)\n\nNiedersachsen Amtsgericht Oldenburg (Oldenburg) HRB 217932\nRegisterbekanntmachung nach dem Umwandlungsgesetz 04.08.2025 (Eintragungsdatum)\n\nSBL Schulbuchausleihe GmbH\nGesellschaft mit beschränkter Haftung\nOldenburg\n\nDen Gläubigern der an der Verschmelzung beteiligten Rechtsträger ist, wenn sie binnen sechs Monaten nach dem Tag, an dem die Eintragung der Verschmelzung in das Register des Sitzes desjenigen Rechtsträgers, dessen Gläubiger sie sind, nach § 19  Abs.  3 UmwG als bekannt gemacht gilt, ihren Anspruch nach Grund und Höhe schriftlich anmelden, Sicherheit zu leisten, soweit sie nicht Befriedigung verlangen können. Dieses Recht steht den Gläubigern jedoch nur zu, wenn sie glaubhaft machen, dass durch die Verschmelzung die Erfüllung der Forderung gefährdet wird."
    },
    {
      "date": "2025-08-04",
      "id": "119110",
      "original_text": "Löschungsankündigung\nNiedersachsen Amtsgericht Hildesheim HRB 206369\nBSS Trading GmbH – Giesen",
      "type": "Löschungsankündigung",
      "state": "Niedersachsen",
      "amtsgericht": "Amtsgericht Hildesheim",
      "registernummer": "HRB 206369",
      "registerart": "HRB",
      "company_name": "BSS Trading GmbH",
      "company_seat": "Giesen",
      "details": "04.08.2025 (Bekanntmachungsdatum)\n\nNiedersachsen Amtsgericht Hildesheim HRB 206369\nLöschungsankündigung\n\nBSS Trading GmbH\nGesellschaft mit beschränkter Haftung\nGiesen\n\nDas Registergericht beabsichtigt, die Gesellschaft von Amts wegen nach § 394 FamFG zu löschen. Die Frist zur Erhebung eines Widerspruchs ist auf 1 Monat ab dieser Registerbekanntmachung festgesetzt."
    },
    {
      "date": "2025-08-04",
      "id": "119111",
      "original_text": "Löschungsankündigung\nRheinland-Pfalz Amtsgericht Montabaur HRB 4360\nGräb Kunststofftechnik GmbH – Herdorf",
      "type": "Löschungsankündigung",
      "state": "Rheinland-Pfalz",
      "amtsgericht": "Amtsgericht Montabaur",
      "registernummer": "HRB 4360",
      "registerart": "HRB",
      "company_name": "Gräb Kunststofftechnik GmbH",
      "company_seat": "Herdorf",
      "details": "04.08.2025 (Bekanntmachungsdatum)\n\nRheinland-Pfalz Amtsgericht Montabaur HRB 4360\nLöschungsankündigung\n\nGräb Kunststofftechnik GmbH\nGesellschaft mit beschränkter Haftung\nHerdorf\n\nDas Registergericht beabsichtigt die Gesellschaft von Amts wegen nach § 394 FamFG zu löschen. Die Frist zur Erhebung eines Widerspruchs ist auf 1 Monat festgesetzt."
    },
    {
      "date": "2025-08-04",
      "id": "119112",
      "original_text": "Registerbekanntmachung nach dem Umwandlungsgesetz\nRheinland-Pfalz Amtsgericht Mainz HRB 51081\nAAREON GAP BETEILIGUNGSGESELLSCHAFT MBH – Mainz",
      "type": "Registerbekanntmachung nach dem Umwandlungsgesetz",
      "state": "Rheinland-Pfalz",
      "amtsgericht": "Amtsgericht Mainz",
      "registernummer": "HRB 51081",
      "registerart": "HRB",
      "company_name": "AAREON GAP BETEILIGUNGSGESELLSCHAFT MBH",
      "company_seat": "Mainz",
      "details": "04.08.2025 (Bekanntmachungsdatum)\n\nRheinland-Pfalz Amtsgericht Mainz HRB 51081\nRegisterbekanntmachung nach dem Umwandlungsgesetz 04.08.2025 (Eintragungsdatum)\n\nAAREON GAP BETEILIGUNGSGESELLSCHAFT MBH\nGesellschaft mit beschränkter Haftung\nMainz\n\nAls nicht eingetragen wird veröffentlicht:\nDen Gläubigern der an der Verschmelzung beteiligten Rechtsträger ist, wenn sie binnen sechs Monaten nach dem Tag, an dem die Eintragung der Verschmelzung in das Register des Sitzes desjenigen Rechtsträgers, dessen Gläubiger sie sind, nach § 19 Abs. 3 UmwG als bekannt gemacht gilt, ihren Anspruch nach Grund und Höhe schriftlich anmelden, Sicherheit zu leisten, soweit sie nicht Befriedigung verlangen können.\n\nDieses Recht steht den Gläubigern jedoch nur zu, wenn sie glaubhaft machen, dass durch die Verschmelzung die Erfüllung der Forderung gefährdet wird."
    },
    {
      "date": "2025-08-04",
      "id": "119113",
      "original_text": "Registerbekanntmachung nach dem Umwandlungsgesetz\nRheinland-Pfalz Amtsgericht Montabaur HRA 22143\nMALIX UG (haftungsbeschränkt) & Co.KG – Betzdorf",
      "type": "Registerbekanntmachung nach dem Umwandlungsgesetz",
      "state": "Rheinland-Pfalz",
      "amtsgericht": "Amtsgericht Montabaur",
      "registernummer": "HRA 22143",
      "registerart": "HRA",
      "company_name": "MALIX UG (haftungsbeschränkt) & Co.KG",
      "company_seat": "Betzdorf",
      "details": "04.08.2025 (Bekanntmachungsdatum)\n\nRheinland-Pfalz Amtsgericht Montabaur HRA 22143\nRegisterbekanntmachung nach dem Umwandlungsgesetz 04.08.2025 (Eintragungsdatum)\n\nMALIX UG (haftungsbeschränkt) & Co.KG\nKommanditgesellschaft\nBetzdorf\n\nAls nicht eingetragen wird veröffentlicht:\nDen Gläubigern des formwechselnden Rechtsträgers ist, wenn sie binnen sechs Monaten nach dem Tag, an dem die Eintragung des Formwechsels nach § 201 UmwG als bekannt gemacht gilt, ihren Anspruch nach Grund und Höhe schriftlich anmelden, Sicherheit zu leisten, soweit sie nicht Befriedigung verlangen können. Dieses Recht steht den Gläubigern jedoch nur zu, wenn sie glaubhaft machen, dass durch den Formwechsel die Erfüllung der Forderung gefährdet wird."
    },
    {
      "date": "2025-08-04",
      "id": "119114",
      "original_text": "Löschungsankündigung\nRheinland-Pfalz Amtsgericht Ludwigshafen a.Rhein (Ludwigshafen) HRA 62098\nSalih GmbH & Co. KG – Ludwigshafen",
      "type": "Löschungsankündigung",
      "state": "Rheinland-Pfalz",
      "amtsgericht": "Amtsgericht Ludwigshafen a.Rhein (Ludwigshafen)",
      "registernummer": "HRA 62098",
      "registerart": "HRA",
      "company_name": "Salih GmbH & Co. KG",
      "company_seat": "Ludwigshafen",
      "details": "04.08.2025 (Bekanntmachungsdatum)\n\nRheinland-Pfalz Amtsgericht Ludwigshafen a.Rhein (Ludwigshafen) HRA 62098\nLöschungsankündigung\n\nSalih GmbH & Co. KG\nKommanditgesellschaft\nLudwigshafen\n\nDas Registergericht beabsichtigt die Firma von Amts wegen nach § 31 Abs. 2 HGB, § 393 FamFG zu löschen. Die Frist zur Erhebung eines Widerspruchs ist auf  einen Monat festgesetzt."
    },
    {
      "date": "2025-08-04",
      "id": "119115",
      "original_text": "Sonstige Registerbekanntmachung\nRheinland-Pfalz Amtsgericht Montabaur HRB 28649\nS&K UG (haftungsbeschränkt) – Neuwied",
      "type": "Sonstige Registerbekanntmachung",
      "state": "Rheinland-Pfalz",
      "amtsgericht": "Amtsgericht Montabaur",
      "registernummer": "HRB 28649",
      "registerart": "HRB",
      "company_name": "S&K UG (haftungsbeschränkt)",
      "company_seat": "Neuwied",
      "details": "04.08.2025 (Bekanntmachungsdatum)\n\nRheinland-Pfalz Amtsgericht Montabaur HRB 28649\nSonstige Registerbekanntmachung 04.08.2025 (Eintragungsdatum)\n\nS&K UG (haftungsbeschränkt)\nGesellschaft mit beschränkter Haftung\nNeuwied\n\nDie Gesellschaft ist nach § 394 FamFG gelöscht.\nDas Registerblatt ist von Amts wegen geschlossen."
    },
    {
      "date": "2025-08-04",
      "id": "119116",
      "original_text": "Einreichung neuer Dokumente\nRheinland-Pfalz Amtsgericht Montabaur HRB 14022\nMobility AG The European Information Company – Oberhonnefeld-Gierend",
      "type": "Einreichung neuer Dokumente",
      "state": "Rheinland-Pfalz",
      "amtsgericht": "Amtsgericht Montabaur",
      "registernummer": "HRB 14022",
      "registerart": "HRB",
      "company_name": "Mobility AG The European Information Company",
      "company_seat": "Oberhonnefeld-Gierend",
      "details": "04.08.2025 (Bekanntmachungsdatum)\n\nRheinland-Pfalz Amtsgericht Montabaur HRB 14022\nEinreichung neuer Dokumente\n\nMobility AG The European Information Company\nAktiengesellschaft\nOberhonnefeld-Gierend\n\nDem Registergericht ist eine neue Liste der Mitglieder des Aufsichtsrates eingereicht worden."
    },
    {
      "date": "2025-08-04",
      "id": "119117",
      "original_text": "Registerbekanntmachung nach dem Umwandlungsgesetz\nRheinland-Pfalz Amtsgericht Koblenz HRA 20990\nSOL Kohlensäure Werk GmbH & Co. KG – Burgbrohl",
      "type": "Registerbekanntmachung nach dem Umwandlungsgesetz",
      "state": "Rheinland-Pfalz",
      "amtsgericht": "Amtsgericht Koblenz",
      "registernummer": "HRA 20990",
      "registerart": "HRA",
      "company_name": "SOL Kohlensäure Werk GmbH & Co. KG",
      "company_seat": "Burgbrohl",
      "details": "04.08.2025 (Bekanntmachungsdatum)\n\nRheinland-Pfalz Amtsgericht Koblenz HRA 20990\nRegisterbekanntmachung nach dem Umwandlungsgesetz 04.08.2025 (Eintragungsdatum)\n\nSOL Kohlensäure Werk GmbH & Co. KG\nKommanditgesellschaft\nBurgbrohl\n\nAls nicht eingetragen wird veröffentlicht: Den Gläubigern der an der Verschmelzung beteiligten Rechtsträger ist, wenn sie binnen sechs Monaten nach dem Tag, an dem die Eintragung der Verschmelzung in das Register des Sitzes desjenigen Rechtsträgers,dessen Gläubiger sie sind, nach § 19 Abs. 3 UmwG als bekannt gemacht gilt, ihren Anspruch nach Grund und Höhe schriftlich anmelden, Sicherheit zu leisten, soweit sie nicht Befriedigung verlangen können. Dieses Recht steht den Gläubigern jedoch nur zu, wenn sie glaubhaft machen, dass durch die Verschmelzung die Erfüllungd er Forderung gefährdet wird."
    },
    {
      "date": "2025-08-04",
      "id": "119118",
      "original_text": "Registerbekanntmachung nach dem Umwandlungsgesetz\nRheinland-Pfalz Amtsgericht Mainz HRB 52897\nAareon Holding GmbH – Mainz",
      "type": "Registerbekanntmachung nach dem Umwandlungsgesetz",
      "state": "Rheinland-Pfalz",
      "amtsgericht": "Amtsgericht Mainz",
      "registernummer": "HRB 52897",
      "registerart": "HRB",
      "company_name": "Aareon Holding GmbH",
      "company_seat": "Mainz",
      "details": "04.08.2025 (Bekanntmachungsdatum)\n\nRheinland-Pfalz Amtsgericht Mainz HRB 52897\nRegisterbekanntmachung nach dem Umwandlungsgesetz 04.08.2025 (Eintragungsdatum)\n\nAareon Holding GmbH\nGesellschaft mit beschränkter Haftung\nMainz\n\nAls nicht eingetragen wird veröffentlicht:\nDen Gläubigern der an der Verschmelzung beteiligten Rechtsträger ist, wenn sie binnen sechs Monaten nach dem Tag, an dem die Eintragung der Verschmelzung in das Register des Sitzes desjenigen Rechtsträgers, dessen Gläubiger sie sind, nach § 19 Abs. 3 UmwG als bekannt gemacht gilt, ihren Anspruch nach Grund und Höhe schriftlich anmelden, Sicherheit zu leisten, soweit sie nicht Befriedigung verlangen können.\n\nDieses Recht steht den Gläubigern jedoch nur zu, wenn sie glaubhaft machen, dass durch die Verschmelzung die Erfüllung der Forderung gefährdet wird."
    },
    {
      "date": "2025-08-04",
      "id": "119119",
      "original_text": "Löschungsankündigung\nBremen Amtsgericht Bremen HRB 38873\nBK Advertising UG (haftungsbeschränkt) – Bremen",
      "type": "Löschungsankündigung",
      "state": "Bremen",
      "amtsgericht": "Amtsgericht Bremen",
      "registernummer": "HRB 38873",
      "registerart": "HRB",
      "company_name": "BK Advertising UG (haftungsbeschränkt)",
      "company_seat": "Bremen",
      "details": "04.08.2025 (Bekanntmachungsdatum)\n\nBremen Amtsgericht Bremen HRB 38873\nLöschungsankündigung\n\nBK Advertising UG (haftungsbeschränkt)\nGesellschaft mit beschränkter Haftung\nBremen\n\nEs ist beabsichtigt die im Handelsregister eingetragene Gesellschaft von Amts wegen gemäß § 394 FamFG zu löschen. Gegen die Löschung kann beim AG Bremen schriftlich oder zu Protokoll der Geschäftsstelle Widerspruch eingelegt werden. Widerspruchsfrist 4 Wochen."
    },
    {
      "date": "2025-08-04",
      "id": "119120",
      "original_text": "Registerbekanntmachung nach dem Umwandlungsgesetz\nBremen Amtsgericht Bremen HRB 41722\nSikora Gesellschaft mit beschränkter Haftung – Bremen",
      "type": "Registerbekanntmachung nach dem Umwandlungsgesetz",
      "state": "Bremen",
      "amtsgericht": "Amtsgericht Bremen",
      "registernummer": "HRB 41722",
      "registerart": "HRB",
      "company_name": "Sikora Gesellschaft mit beschränkter Haftung",
      "company_seat": "Bremen",
      "details": "04.08.2025 (Bekanntmachungsdatum)\n\nBremen Amtsgericht Bremen HRB 41722\nRegisterbekanntmachung nach dem Umwandlungsgesetz 29.07.2025 (Eintragungsdatum)\n\nSikora Gesellschaft mit beschränkter Haftung\nGesellschaft mit beschränkter Haftung\nBremen\n\nZu Eintragungsnummer 1 vom 29.07.2025 wird als nicht eingetragen veröffentlicht: Den Gläubigern ist, wenn sie binnen sechs Monaten nach dem Tag, an dem die Eintragung der Umwandlung als bekannt gemacht gilt, ihren Anspruch nach Grund und Höhe schriftlich anmelden, Sicherheit zu leisten, soweit sie nicht Befriedigung verlangen können. Dieses Recht steht den Gläubigern jedoch nur zu, wenn sie glaubhaft machen, dass durch die Umwandlung die Erfüllung ihrer Forderung gefährdet wird. Das Recht, Sicherheitsleistung zu verlangen, steht Gläubigern nicht zu, die im Falle der Insolvenz ein Recht auf vorzugsweise Befriedigung aus einer Deckungsmasse haben, die nach gesetzlicher Vorschrift zu ihrem Schutz errichtet und staatlich überwacht ist."
    },
    {
      "date": "2025-08-04",
      "id": "119121",
      "original_text": "Löschungsankündigung\nBremen Amtsgericht Bremen HRB 34941\nCM-HB GmbH – Bremen",
      "type": "Löschungsankündigung",
      "state": "Bremen",
      "amtsgericht": "Amtsgericht Bremen",
      "registernummer": "HRB 34941",
      "registerart": "HRB",
      "company_name": "CM-HB GmbH",
      "company_seat": "Bremen",
      "details": "04.08.2025 (Bekanntmachungsdatum)\n\nBremen Amtsgericht Bremen HRB 34941\nLöschungsankündigung\n\nCM-HB GmbH\nGesellschaft mit beschränkter Haftung\nBremen\n\nEs ist beabsichtigt die im Handelsregister eingetragene Firma von Amts wegen gemäß § 31 Abs.2 HGB zu löschen. Gegen die Löschung kann beim AG Bremen schriftlich oder zu Protokoll der Geschäftsstelle Widerspruch eingelegt werden. Widerspruchsfrist 4 Wochen."
    },
    {
      "date": "2025-08-04",
      "id": "119122",
      "original_text": "Registerbekanntmachung nach dem Umwandlungsgesetz\nBremen Amtsgericht Bremen HRA 30756\nKasper Faber 1 GmbH & Co. KG – Bremen",
      "type": "Registerbekanntmachung nach dem Umwandlungsgesetz",
      "state": "Bremen",
      "amtsgericht": "Amtsgericht Bremen",
      "registernummer": "HRA 30756",
      "registerart": "HRA",
      "company_name": "Kasper Faber 1 GmbH & Co. KG",
      "company_seat": "Bremen",
      "details": "04.08.2025 (Bekanntmachungsdatum)\n\nBremen Amtsgericht Bremen HRA 30756\nRegisterbekanntmachung nach dem Umwandlungsgesetz 30.07.2025 (Eintragungsdatum)\n\nKasper Faber 1 GmbH & Co. KG\nKommanditgesellschaft\nBremen\n\nZu Eintragungsnummer 1 vom 30.07.2025 wird als nicht eingetragen veröffentlicht:\nDen Gläubigern ist, wenn sie binnen sechs Monaten nach dem Tag, an dem die Eintragung der formwechselnden Umwandlung als bekannt gemacht gilt, ihren Anspruch nach Grund und Höhe schriftlich anmelden, Sicherheit zu leisten, soweit sie nicht Befriedigung verlangen können. Dieses Recht steht den Gläubigern jedoch nur zu, wenn sie glaubhaft machen, dass durch die formwechselnde Umwandlung die Erfüllung ihrer Forderung gefährdet wird. Das Recht, Sicherheitsleistung zu verlangen, steht Gläubigern nicht zu, die im Falle der Insolvenz ein Recht auf vorzugsweise Befriedigung aus einer Deckungsmasse haben, die nach gesetzlicher Vorschrift zu ihrem Schutz errichtet und staatlich überwacht ist."
    },
    {
      "date": "2025-08-04",
      "id": "119123",
      "original_text": "Registerbekanntmachung nach dem Umwandlungsgesetz\nBremen Amtsgericht Bremen HRB 38464\nKaspar Faber 1 GmbH – Bremen",
      "type": "Registerbekanntmachung nach dem Umwandlungsgesetz",
      "state": "Bremen",
      "amtsgericht": "Amtsgericht Bremen",
      "registernummer": "HRB 38464",
      "registerart": "HRB",
      "company_name": "Kaspar Faber 1 GmbH",
      "company_seat": "Bremen",
      "details": "04.08.2025 (Bekanntmachungsdatum)\n\nBremen Amtsgericht Bremen HRB 38464\nRegisterbekanntmachung nach dem Umwandlungsgesetz 30.07.2025 (Eintragungsdatum)\n\nKaspar Faber 1 GmbH\nGesellschaft mit beschränkter Haftung\nBremen\n\nZu Eintragungsnummer 4 vom 30.07.2025 wird als nicht eingetragen veröffentlicht:\nDen Gläubigern ist, wenn sie binnen sechs Monaten nach dem Tag, an dem die Eintragung der formwechselnden Umwandlung als bekannt gemacht gilt, ihren Anspruch nach Grund und Höhe schriftlich anmelden, Sicherheit zu leisten, soweit sie nicht Befriedigung verlangen können. Dieses Recht steht den Gläubigern jedoch nur zu, wenn sie glaubhaft machen, dass durch die formwechselnden Umwandlung die Erfüllung ihrer Forderung gefährdet wird. Das Recht, Sicherheitsleistung zu verlangen, steht Gläubigern nicht zu, die im Falle der Insolvenz ein Recht auf vorzugsweise Befriedigung aus einer Deckungsmasse haben, die nach gesetzlicher Vorschrift zu ihrem Schutz errichtet und staatlich überwacht ist."
    },
    {
      "date": "2025-08-04",
      "id": "119124",
      "original_text": "Registerbekanntmachung nach dem Umwandlungsgesetz\nNordrhein-Westfalen Amtsgericht Essen PR 4249\nIBF Felling Beratende Ingenieure Partnerschaft mbB – Dülmen",
      "type": "Registerbekanntmachung nach dem Umwandlungsgesetz",
      "state": "Nordrhein-Westfalen",
      "amtsgericht": "Amtsgericht Essen",
      "registernummer": "PR 4249",
      "registerart": "PR",
      "company_name": "IBF Felling Beratende Ingenieure Partnerschaft mbB",
      "company_seat": "Dülmen",
      "details": "04.08.2025 (Bekanntmachungsdatum)\n\nNordrhein-Westfalen Amtsgericht Essen PR 4249\nRegisterbekanntmachung nach dem Umwandlungsgesetz 04.08.2025 (Eintragungsdatum)\n\nIBF Felling Beratende Ingenieure Partnerschaft mbB\nPartnerschaftsgesellschaft\nDülmen\n\nDen Gläubigern der an der formwechselnden Umwandlung beteiligten Rechtsträger ist, wenn sie binnen sechs Monaten nach dem Tag, an dem die Eintragung der formwechselnden Umwandlung in das Register des Sitzes desjenigen Rechtsträgers, dessen Gläubiger sie sind, nach § 201 UmwG als bekanntgemacht gilt, ihren Anspruch nach Grund und Höhe schriftlich anmelden, Sicherheit zu leisten, soweit sie nicht Befriedigung verlangen können. Dieses Recht steht den Gläubigern jedoch nur zu, wenn sie glaubhaft machen, dass durch die formwechselnden Umwandlung die Erfüllung ihrer Forderung gefährdet wird."
    },
    {
      "date": "2025-08-04",
      "id": "119125",
      "original_text": "Registerbekanntmachung nach dem Umwandlungsgesetz\nNordrhein-Westfalen Amtsgericht Köln HRB 107031\nIntersnack Deutschland SE – Köln",
      "type": "Registerbekanntmachung nach dem Umwandlungsgesetz",
      "state": "Nordrhein-Westfalen",
      "amtsgericht": "Amtsgericht Köln",
      "registernummer": "HRB 107031",
      "registerart": "HRB",
      "company_name": "Intersnack Deutschland SE",
      "company_seat": "Köln",
      "details": "04.08.2025 (Bekanntmachungsdatum)\n\nNordrhein-Westfalen Amtsgericht Köln HRB 107031\nRegisterbekanntmachung nach dem Umwandlungsgesetz 04.08.2025 (Eintragungsdatum)\n\nIntersnack Deutschland SE\nEuropäische Aktiengesellschaft (SE)\nKöln\n\nDen Gläubigern der an der Verschmelzung beteiligten Rechtsträger ist, wenn sie binnen sechs Monaten nach dem Tag, an dem die Eintragung der Verschmelzung in das Register des Sitzes desjenigen Rechtsträgers, dessen Gläubiger sie sind, nach § 19 Absatz 3 UmwG als bekanntgemacht gilt, ihren Anspruch nach Grund und Höhe schriftlich anmelden, Sicherheit zu leisten, soweit sie nicht Befriedigung verlangen können. Dieses Recht steht den Gläubigern jedoch nur zu, wenn sie glaubhaft machen, dass durch die Verschmelzung die Erfüllung ihrer Forderung gefährdet wird."
    },
    {
      "date": "2025-08-04",
      "id": "119126",
      "original_text": "Löschungsankündigung\nNordrhein-Westfalen Amtsgericht Düren HRB 8113\nPersEU Consulting GmbH – Düren",
      "type": "Löschungsankündigung",
      "state": "Nordrhein-Westfalen",
      "amtsgericht": "Amtsgericht Düren",
      "registernummer": "HRB 8113",
      "registerart": "HRB",
      "company_name": "PersEU Consulting GmbH",
      "company_seat": "Düren",
      "details": "04.08.2025 (Bekanntmachungsdatum)\n\nNordrhein-Westfalen Amtsgericht Düren HRB 8113\nLöschungsankündigung 01.08.2025 (Eintragungsdatum)\n\nPersEU Consulting GmbH\nGesellschaft mit beschränkter Haftung\nDüren\n\nDas Registergericht beabsichtigt die Gesellschaft von Amts wegen nach § 394 FamFG zu löschen. Die Frist zur Erhebung eines Widerspruchs ist auf drei Monate festgesetzt."
    },
    {
      "date": "2025-08-04",
      "id": "119127",
      "original_text": "Einreichung neuer Dokumente\nNordrhein-Westfalen Amtsgericht Gütersloh HRB 12929\nNagel-Group Invest SE – Versmold",
      "type": "Einreichung neuer Dokumente",
      "state": "Nordrhein-Westfalen",
      "amtsgericht": "Amtsgericht Gütersloh",
      "registernummer": "HRB 12929",
      "registerart": "HRB",
      "company_name": "Nagel-Group Invest SE",
      "company_seat": "Versmold",
      "details": "04.08.2025 (Bekanntmachungsdatum)\n\nNordrhein-Westfalen Amtsgericht Gütersloh HRB 12929\nEinreichung neuer Dokumente\n\nNagel-Group Invest SE\nEuropäische Aktiengesellschaft (SE)\nVersmold\n\nDem Registergericht ist eine neue Liste der Mitglieder des Aufsichtsrates eingereicht worden."
    },
    {
      "date": "2025-08-04",
      "id": "119128",
      "original_text": "Registerbekanntmachung nach dem Umwandlungsgesetz\nNordrhein-Westfalen Amtsgericht Köln HRB 80814\nSpreeback GmbH – Köln",
      "type": "Registerbekanntmachung nach dem Umwandlungsgesetz",
      "state": "Nordrhein-Westfalen",
      "amtsgericht": "Amtsgericht Köln",
      "registernummer": "HRB 80814",
      "registerart": "HRB",
      "company_name": "Spreeback GmbH",
      "company_seat": "Köln",
      "details": "04.08.2025 (Bekanntmachungsdatum)\n\nNordrhein-Westfalen Amtsgericht Köln HRB 80814\nRegisterbekanntmachung nach dem Umwandlungsgesetz 04.08.2025 (Eintragungsdatum)\n\nSpreeback GmbH\nGesellschaft mit beschränkter Haftung\nKöln\n\nDen Gläubigern der an der Verschmelzung beteiligten Rechtsträger ist, wenn sie binnen sechs Monaten nach dem Tag, an dem die Eintragung der Verschmelzung in das Register des Sitzes desjenigen Rechtsträgers, dessen Gläubiger sie sind, nach § 19 Absatz 3 UmwG als bekanntgemacht gilt, ihren Anspruch nach Grund und Höhe schriftlich anmelden, Sicherheit zu leisten, soweit sie nicht Befriedigung verlangen können. Dieses Recht steht den Gläubigern jedoch nur zu, wenn sie glaubhaft machen, dass durch die Verschmelzung die Erfüllung ihrer Forderung gefährdet wird."
    },
    {
      "date": "2025-08-04",
      "id": "119129",
      "original_text": "Registerbekanntmachung nach dem Umwandlungsgesetz\nNordrhein-Westfalen Amtsgericht Düsseldorf HRB 97395\nAcciona Customer Services Düsseldorf GmbH – Düsseldorf",
      "type": "Registerbekanntmachung nach dem Umwandlungsgesetz",
      "state": "Nordrhein-Westfalen",
      "amtsgericht": "Amtsgericht Düsseldorf",
      "registernummer": "HRB 97395",
      "registerart": "HRB",
      "company_name": "Acciona Customer Services Düsseldorf GmbH",
      "company_seat": "Düsseldorf",
      "details": "04.08.2025 (Bekanntmachungsdatum)\n\nNordrhein-Westfalen Amtsgericht Düsseldorf HRB 97395\nRegisterbekanntmachung nach dem Umwandlungsgesetz 04.08.2025 (Eintragungsdatum)\n\nAcciona Customer Services Düsseldorf GmbH\nGesellschaft mit beschränkter Haftung\nDüsseldorf\n\nDen Gläubigern der an der Verschmelzung beteiligten Rechtsträger ist, wenn sie binnen sechs Monaten nach dem Tag, an dem die Eintragung der Verschmelzung in das Register des Sitzes desjenigen Rechtsträgers, dessen Gläubiger sie sind, nach § 19 Absatz 3 UmwG als bekanntgemacht gilt, ihren Anspruch nach Grund und Höhe schriftlich anmelden, Sicherheit zu leisten, soweit sie nicht Befriedigung verlangen können. Dieses Recht steht den Gläubigern jedoch nur zu, wenn sie glaubhaft machen, dass durch die Verschmelzung die Erfüllung ihrer Forderung gefährdet wird."
    },
    {
      "date": "2025-08-04",
      "id": "119130",
      "original_text": "Sonstige Registerbekanntmachung\nNordrhein-Westfalen Amtsgericht Köln HRB 50609\nConVista Consulting AG – Köln",
      "type": "Sonstige Registerbekanntmachung",
      "state": "Nordrhein-Westfalen",
      "amtsgericht": "Amtsgericht Köln",
      "registernummer": "HRB 50609",
      "registerart": "HRB",
      "company_name": "ConVista Consulting AG",
      "company_seat": "Köln",
      "details": "04.08.2025 (Bekanntmachungsdatum)\n\nNordrhein-Westfalen Amtsgericht Köln HRB 50609\nSonstige Registerbekanntmachung 04.08.2025 (Eintragungsdatum)\n\nConVista Consulting AG\nAktiengesellschaft\nKöln\n\nDie Gesellschaft hat Gläubigern, deren Forderungen vor dieser Bekanntmachung begründet worden sind, Sicherheit zu leisten, soweit sie nicht Befriedigung verlangen können, wenn sie sich binnen sechs Monaten zu diesem Zweck melden. Das Recht steht ihnen jedoch nicht zu, wenn sie im Fall eines Insolvenzverfahrens ein Recht auf vorzugsweise Befriedigung aus einer Deckungsmasse haben, die nach gesetzlicher Vorschrift zu ihrem Schutz errichtet und staatlich überwacht ist."
    },
    {
      "date": "2025-08-04",
      "id": "119131",
      "original_text": "Einreichung neuer Dokumente\nNordrhein-Westfalen Amtsgericht Gütersloh HRB 10960\nNagel-Group Verwaltungs-SE – Versmold",
      "type": "Einreichung neuer Dokumente",
      "state": "Nordrhein-Westfalen",
      "amtsgericht": "Amtsgericht Gütersloh",
      "registernummer": "HRB 10960",
      "registerart": "HRB",
      "company_name": "Nagel-Group Verwaltungs-SE",
      "company_seat": "Versmold",
      "details": "04.08.2025 (Bekanntmachungsdatum)\n\nNordrhein-Westfalen Amtsgericht Gütersloh HRB 10960\nEinreichung neuer Dokumente\n\nNagel-Group Verwaltungs-SE\nEuropäische Aktiengesellschaft (SE)\nVersmold\n\nDem Registergericht ist eine neue Liste der Mitglieder des Verwaltungsrates eingereicht worden."
    },
    {
      "date": "2025-08-04",
      "id": "119132",
      "original_text": "Sonstige Registerbekanntmachung\nNordrhein-Westfalen Amtsgericht Essen HRA 6164\nVERITÜV Internationale Agentur für Beratungs- und Prüfdienstleistungen Europäische wirtschaftliche Interessenvereinigung (EWIV) zwischen RWTÜV Anlagentechnik GmbH (Deutschland) und Bureau Veritas (Frankreich) – Essen",
      "type": "Sonstige Registerbekanntmachung",
      "state": "Nordrhein-Westfalen",
      "amtsgericht": "Amtsgericht Essen",
      "registernummer": "HRA 6164",
      "registerart": "HRA",
      "company_name": "VERITÜV Internationale Agentur für Beratungs- und Prüfdienstleistungen Europäische wirtschaftliche Interessenvereinigung (EWIV) zwischen RWTÜV Anlagentechnik GmbH (Deutschland) und Bureau Veritas (Frankreich)",
      "company_seat": "Essen",
      "details": "04.08.2025 (Bekanntmachungsdatum)\n\nNordrhein-Westfalen Amtsgericht Essen HRA 6164\nSonstige Registerbekanntmachung 04.08.2025 (Eintragungsdatum)\n\nVERITÜV Internationale Agentur für Beratungs- und Prüfdienstleistungen Europäische wirtschaftliche Interessenvereinigung (EWIV) zwischen RWTÜV Anlagentechnik GmbH (Deutschland) und Bureau Veritas (Frankreich)\nEuropäische wirtschaftliche Interessenvereinigung\nEssen\n\nDie Liquidation ist beendet. Die Firma ist erloschen."
    },
    {
      "date": "2025-08-04",
      "id": "119133",
      "original_text": "Löschungsankündigung\nNordrhein-Westfalen Amtsgericht Düsseldorf HRB 78347\nDuma Industrie-Service GmbH – Düsseldorf",
      "type": "Löschungsankündigung",
      "state": "Nordrhein-Westfalen",
      "amtsgericht": "Amtsgericht Düsseldorf",
      "registernummer": "HRB 78347",
      "registerart": "HRB",
      "company_name": "Duma Industrie-Service GmbH",
      "company_seat": "Düsseldorf",
      "details": "04.08.2025 (Bekanntmachungsdatum)\n\nNordrhein-Westfalen Amtsgericht Düsseldorf HRB 78347\nLöschungsankündigung\n\nDuma Industrie-Service GmbH\nGesellschaft mit beschränkter Haftung\nDüsseldorf\n\nDas Registergericht beabsichtigt die Gesellschaft von Amts wegen nach § 394 FamFG zu löschen. Die Frist zur Erhebung eines Widerspruchs ist auf 3 Wochen festgesetzt.\n\nRechtsbehelfsbelehrung:\nDas Widerspruchsrecht steht jedem zu, der an der Unterlassung der Löschung ein berechtigtes Interesse hat. Der Widerspruch ist bei dem Amtsgericht Düsseldorf -Registergericht-, Werdener Straße 1, 40227 Düsseldorf schriftlich in deutscher Sprache oder zur Niederschrift der Geschäftsstelle einzulegen. Der Widerspruch kann auch zur Niederschrift der Geschäftsstelle eines jeden Amtsgerichtes abgegeben werden. Die Einlegung ist auch durch Übertragung eines elektronischen Dokuments an die elektronische Poststelle des Gerichts möglich. Das elektronische Dokument muss für die Bearbeitung durch das Gericht geeignet und mit einer qualifizierten elektronischen Signatur der verantwortenden Person versehen sein oder von der verantwortenden Person signiert und auf einem sicheren Übermittlungsweg gemäß § 130a ZPO nach näherer Maßgabe der Verordnung über die technischen Rahmenbedingungen des elektronischen Rechtsverkehrs und über das besondere elektronische Behördenpostfach (BGBl. I, S.3803) eingereicht werden. Weitere Informationen erhalten Sie auf der Internetseite www.justiz.de.\nDer Widerspruch muss spätestens innerhalb der gesetzten Frist nach dem Datum der Bekanntmachung der Löschungsankündigung bei dem Amtsgericht - Registergericht - Düsseldorf eingegangen sein.  Dies gilt auch dann, wenn der Widerspruch zur Niederschrift der Geschäftsstelle eines anderen Amtsgerichtes abgegeben wurde. Die Frist beginnt mit dem Tage der Bekanntmachung der Löschungsankündigung in dem für die Bekanntmachung der Eintragungen in das Handelsregister bestimmten elektronischen Informations- und Kommunikationssystem nach § 10 des Handelsgesetzbuches. Fällt das Ende der Frist auf einen Sonntag, einen allgemeinen Feiertag oder Sonnabend, so endet die Frist mit Ablauf des nächsten Werktages.\nDer Widerspruch muss die Bezeichnung der angefochtenen Löschungsankündigung sowie die Erklärung enthalten, dass Widerspruch gegen diese Löschungsankündigung eingelegt wird. Er ist zu unterzeichnen und soll begründet werden."
    },
    {
      "date": "2025-08-04",
      "id": "119134",
      "original_text": "Einreichung neuer Dokumente\nNordrhein-Westfalen Amtsgericht Köln HRB 7935\nDEVK Allgemeine Versicherungs-Aktiengesellschaft – Köln",
      "type": "Einreichung neuer Dokumente",
      "state": "Nordrhein-Westfalen",
      "amtsgericht": "Amtsgericht Köln",
      "registernummer": "HRB 7935",
      "registerart": "HRB",
      "company_name": "DEVK Allgemeine Versicherungs-Aktiengesellschaft",
      "company_seat": "Köln",
      "details": "04.08.2025 (Bekanntmachungsdatum)\n\nNordrhein-Westfalen Amtsgericht Köln HRB 7935\nEinreichung neuer Dokumente 04.08.2025 (Eintragungsdatum)\n\nDEVK Allgemeine Versicherungs-Aktiengesellschaft\nAktiengesellschaft\nKöln\n\nDem Registergericht ist eine neue Liste der Mitglieder des Aufsichtsrates eingereicht worden."
    },
    {
      "date": "2025-08-04",
      "id": "119135",
      "original_text": "Löschungsankündigung\nNordrhein-Westfalen Amtsgericht Gelsenkirchen HRB 9342\nBlock & Bäunker-Augustin GmbH – Gladbeck",
      "type": "Löschungsankündigung",
      "state": "Nordrhein-Westfalen",
      "amtsgericht": "Amtsgericht Gelsenkirchen",
      "registernummer": "HRB 9342",
      "registerart": "HRB",
      "company_name": "Block & Bäunker-Augustin GmbH",
      "company_seat": "Gladbeck",
      "details": "04.08.2025 (Bekanntmachungsdatum)\n\nNordrhein-Westfalen Amtsgericht Gelsenkirchen HRB 9342\nLöschungsankündigung\n\nBlock & Bäunker-Augustin GmbH\nGesellschaft mit beschränkter Haftung\nGladbeck\n\nDas Amtsgericht Gelsenkirchen als Registergericht beabsichtigt, die Gesellschaft\nBlock & Bäunker-Augustin GmbH mit Sitz in Gladbeck, HRB 9342 Amtsgericht Gelsenkirchen, wegen Vermögenslosigkeit zu löschen.\n\nHiermit wird denjenigen, die an der Unterlassung der Löschung ein berechtigtes Interesse haben, gem. § 394 Abs. 2 FamFG Gelegenheit gegeben, gegen dieses Vorhaben binnen eines Monats nach dieser Bekanntmachung Widerspruch einzulegen. Der Widerspruch kann schriftlich oder zu Protokoll der Geschäftsstelle erhoben werden."
    },
    {
      "date": "2025-08-04",
      "id": "119136",
      "original_text": "Registerbekanntmachung nach dem Umwandlungsgesetz\nNordrhein-Westfalen Amtsgericht Bielefeld HRB 35357\nKI GmbH DV-Lösungen – Bielefeld",
      "type": "Registerbekanntmachung nach dem Umwandlungsgesetz",
      "state": "Nordrhein-Westfalen",
      "amtsgericht": "Amtsgericht Bielefeld",
      "registernummer": "HRB 35357",
      "registerart": "HRB",
      "company_name": "KI GmbH DV-Lösungen",
      "company_seat": "Bielefeld",
      "details": "04.08.2025 (Bekanntmachungsdatum)\n\nNordrhein-Westfalen Amtsgericht Bielefeld HRB 35357\nRegisterbekanntmachung nach dem Umwandlungsgesetz 04.08.2025 (Eintragungsdatum)\n\nKI GmbH DV-Lösungen\nGesellschaft mit beschränkter Haftung\nBielefeld\n\nDen Gläubigern der an der Verschmelzung beteiligten Rechtsträger ist, wenn sie binnen sechs Monaten nach dem Tag, an dem die Eintragung der Verschmelzung in das Register des Sitzes desjenigen Rechtsträgers, dessen Gläubiger sie sind, nach § 19 Absatz 3 UmwG als bekanntgemacht gilt, ihren Anspruch nach Grund und Höhe schriftlich anmelden, Sicherheit zu leisten, soweit sie nicht Befriedigung verlangen können. Dieses Recht steht den Gläubigern jedoch nur zu, wenn sie glaubhaft machen, dass durch die Verschmelzung die Erfüllung ihrer Forderung gefährdet wird."
    },
    {
      "date": "2025-08-04",
      "id": "119137",
      "original_text": "Löschungsankündigung\nNordrhein-Westfalen Amtsgericht Duisburg HRB 34052\nBML234 GmbH – Oberhausen",
      "type": "Löschungsankündigung",
      "state": "Nordrhein-Westfalen",
      "amtsgericht": "Amtsgericht Duisburg",
      "registernummer": "HRB 34052",
      "registerart": "HRB",
      "company_name": "BML234 GmbH",
      "company_seat": "Oberhausen",
      "details": "04.08.2025 (Bekanntmachungsdatum)\n\nNordrhein-Westfalen Amtsgericht Duisburg HRB 34052\nLöschungsankündigung\n\nBML234 GmbH\nGesellschaft mit beschränkter Haftung\nOberhausen\n\nDas Registergericht beabsichtigt, die im Handelsregister unter HRB 34052  eingetragene Gesellschaft  BML234 GmbH gemäß § 394 FamFG wegen Vermögenslosigkeit von Amts wegen zu löschen. Gegen diese Verfügung kann Widerspruch eingelegt werden. Die Frist zur Erhebung eines Widerspruchs gegen die beabsichtigte Löschung von Amts wegen ist auf drei Monate festgesetzt. Rechtsbehelfsbelehrung Der Widerspruch ist bei dem Amtsgericht Duisburg, Kardinal-Galen-Str. 124-132, 47058 Duisburg schriftlich in deutscher Sprache oder zur Niederschrift der Geschäftsstelle einzulegen. Der Widerspruch kann auch zur Niederschrift der Geschäftsstelle eines jeden Amtsgerichtes abgegeben werden. Die Einlegung ist auch durch Übertragung eines elektronischen Dokuments an die elektronische Poststelle des Gerichts möglich. Das elektronische Dokument muss für die Bearbeitung durch das Gericht geeignet und mit einer qualifizierten elektronischen Signatur der verantwortenden Person versehen sein oder von der verantwortenden Person signiert und auf einem sicheren Übermittlungsweg gemäß § 130 a ZPO nach näherer Maßgabe der Verordnung über die technischen Rahmenbedingungen des elektronischen Rechtsverkehrs und über das besondere elektronische Behördenpostfach (BGBl. I, S. 3803) eingereicht werden. Weitere Informationen erhalten Sie auf der Internetseite www.justiz.de <http://www.justiz.de>. Der Widerspruch muss spätestens innerhalb der gesetzten Frist bei dem Amtsgericht Duisburg eingegangen sein. Dies gilt auch dann, wenn der Widerspruch zur Niederschrift der Geschäftsstelle eines anderen Amtsgerichtes abgegeben wurde. Die Frist beginnt mit der Veröffentlichung. Fällt das Ende der Frist auf einen Sonntag, einen allgemeinen Feiertag oder Sonnabend, so endet die Frist mit Ablauf des nächsten Werktages. Der Widerspruch muss die Bezeichnung der angefochtenen Verfügung sowie die Erklärung enthalten, dass Widerspruch gegen diese Verfügung eingelegt wird. Er ist zu unterzeichnen und soll begründet werden."
    },
    {
      "date": "2025-08-04",
      "id": "119138",
      "original_text": "Registerbekanntmachung nach dem Umwandlungsgesetz\nNordrhein-Westfalen Amtsgericht Essen PR 2839\nHRA - Partnerschaft Beratender Ingenieure im Bauwesen mbB – Bochum",
      "type": "Registerbekanntmachung nach dem Umwandlungsgesetz",
      "state": "Nordrhein-Westfalen",
      "amtsgericht": "Amtsgericht Essen",
      "registernummer": "PR 2839",
      "registerart": "PR",
      "company_name": "HRA - Partnerschaft Beratender Ingenieure im Bauwesen mbB",
      "company_seat": "Bochum",
      "details": "04.08.2025 (Bekanntmachungsdatum)\n\nNordrhein-Westfalen Amtsgericht Essen PR 2839\nRegisterbekanntmachung nach dem Umwandlungsgesetz 04.08.2025 (Eintragungsdatum)\n\nHRA - Partnerschaft Beratender Ingenieure im Bauwesen mbB\nPartnerschaftsgesellschaft\nBochum\n\nDen Gläubigern der an der Verschmelzung beteiligten Rechtsträger ist, wenn sie binnen sechs Monaten nach dem Tag, an dem die Eintragung der Verschmelzung in das Register des Sitzes desjenigen Rechtsträgers, dessen Gläubiger sie sind, nach § 19 Absatz 3 UmwG als bekanntgemacht gilt, ihren Anspruch nach Grund und Höhe schriftlich anmelden, Sicherheit zu leisten, soweit sie nicht Befriedigung verlangen können. Dieses Recht steht den Gläubigern jedoch nur zu, wenn sie glaubhaft machen, dass durch die Verschmelzung die Erfüllung ihrer Forderung gefährdet wird."
    },
    {
      "date": "2025-08-04",
      "id": "119139",
      "original_text": "Registerbekanntmachung nach dem Umwandlungsgesetz\nNordrhein-Westfalen Amtsgericht Paderborn HRB 9008\nHartmann Tresore AG – Paderborn",
      "type": "Registerbekanntmachung nach dem Umwandlungsgesetz",
      "state": "Nordrhein-Westfalen",
      "amtsgericht": "Amtsgericht Paderborn",
      "registernummer": "HRB 9008",
      "registerart": "HRB",
      "company_name": "Hartmann Tresore AG",
      "company_seat": "Paderborn",
      "details": "04.08.2025 (Bekanntmachungsdatum)\n\nNordrhein-Westfalen Amtsgericht Paderborn HRB 9008\nRegisterbekanntmachung nach dem Umwandlungsgesetz 04.08.2025 (Eintragungsdatum)\n\nHartmann Tresore AG\nAktiengesellschaft\nPaderborn\n\nDen Gläubigern der an der formwechselnden Umwandlung beteiligten Rechtsträger ist, wenn sie binnen sechs Monaten nach dem Tag, an dem die Eintragung der formwechselnden Umwandlung in das Register des Sitzes desjenigen Rechtsträgers, dessen Gläubiger sie sind, nach § 19 Absatz 3 UmwG als bekanntgemacht gilt, ihren Anspruch nach Grund und Höhe schriftlich anmelden, Sicherheit zu leisten, soweit sie nicht Befriedigung verlangen können. Dieses Recht steht den Gläubigern jedoch nur zu, wenn sie glaubhaft machen, dass durch die formwechselnden Umwandlung die Erfüllung ihrer Forderung gefährdet wird."
    },
    {
      "date": "2025-08-04",
      "id": "119140",
      "original_text": "Registerbekanntmachung nach dem Umwandlungsgesetz\nNordrhein-Westfalen Amtsgericht Bonn HRB 24934\nScout24 Beteiligungs SE – Bonn",
      "type": "Registerbekanntmachung nach dem Umwandlungsgesetz",
      "state": "Nordrhein-Westfalen",
      "amtsgericht": "Amtsgericht Bonn",
      "registernummer": "HRB 24934",
      "registerart": "HRB",
      "company_name": "Scout24 Beteiligungs SE",
      "company_seat": "Bonn",
      "details": "04.08.2025 (Bekanntmachungsdatum)\n\nNordrhein-Westfalen Amtsgericht Bonn HRB 24934\nRegisterbekanntmachung nach dem Umwandlungsgesetz 04.08.2025 (Eintragungsdatum)\n\nScout24 Beteiligungs SE\nEuropäische Aktiengesellschaft (SE)\nBonn\n\nDen Gläubigern der an der Verschmelzung beteiligten Rechtsträger ist, wenn sie binnen sechs Monaten nach dem Tag, an dem die Eintragung der Verschmelzung in das Register des Sitzes desjenigen Rechtsträgers, dessen Gläubiger sie sind, nach § 19 Absatz 3 UmwG als bekanntgemacht gilt, ihren Anspruch nach Grund und Höhe schriftlich anmelden, Sicherheit zu leisten, soweit sie nicht Befriedigung verlangen können. Dieses Recht steht den Gläubigern jedoch nur zu, wenn sie glaubhaft machen, dass durch die Verschmelzung die Erfüllung ihrer Forderung gefährdet wird."
    },
    {
      "date": "2025-08-04",
      "id": "119141",
      "original_text": "Einreichung neuer Dokumente\nNordrhein-Westfalen Amtsgericht Münster HRB 17424\nDZ HYP AG – Hamburg und Münster",
      "type": "Einreichung neuer Dokumente",
      "state": "Nordrhein-Westfalen",
      "amtsgericht": "Amtsgericht Münster",
      "registernummer": "HRB 17424",
      "registerart": "HRB",
      "company_name": "DZ HYP AG",
      "company_seat": "Hamburg und Münster",
      "details": "04.08.2025 (Bekanntmachungsdatum)\n\nNordrhein-Westfalen Amtsgericht Münster HRB 17424\nEinreichung neuer Dokumente\n\nDZ HYP AG\nAktiengesellschaft\nHamburg und Münster\n\nDem Registergericht ist eine neue Liste der Mitglieder des Aufsichtsrates eingereicht worden."
    },
    {
      "date": "2025-08-04",
      "id": "119142",
      "original_text": "Registerbekanntmachung nach dem Umwandlungsgesetz\nNordrhein-Westfalen Amtsgericht Köln HRB 53928\nDataFocus GmbH – Köln",
      "type": "Registerbekanntmachung nach dem Umwandlungsgesetz",
      "state": "Nordrhein-Westfalen",
      "amtsgericht": "Amtsgericht Köln",
      "registernummer": "HRB 53928",
      "registerart": "HRB",
      "company_name": "DataFocus GmbH",
      "company_seat": "Köln",
      "details": "04.08.2025 (Bekanntmachungsdatum)\n\nNordrhein-Westfalen Amtsgericht Köln HRB 53928\nRegisterbekanntmachung nach dem Umwandlungsgesetz 04.08.2025 (Eintragungsdatum)\n\nDataFocus GmbH\nGesellschaft mit beschränkter Haftung\nKöln\n\nDen Gläubigern der an der Verschmelzung beteiligten Rechtsträger ist, wenn sie binnen sechs Monaten nach dem Tag, an dem die Eintragung der Verschmelzung in das Register des Sitzes desjenigen Rechtsträgers, dessen Gläubiger sie sind, nach § 19 Absatz 3 UmwG als bekanntgemacht gilt, ihren Anspruch nach Grund und Höhe schriftlich anmelden, Sicherheit zu leisten, soweit sie nicht Befriedigung verlangen können. Dieses Recht steht den Gläubigern jedoch nur zu, wenn sie glaubhaft machen, dass durch die Verschmelzung die Erfüllung ihrer Forderung gefährdet wird."
    },
    {
      "date": "2025-08-04",
      "id": "119143",
      "original_text": "Registerbekanntmachung nach dem Umwandlungsgesetz\nNordrhein-Westfalen Amtsgericht Düsseldorf HRB 56405\nRampart Solutions GmbH – Düsseldorf",
      "type": "Registerbekanntmachung nach dem Umwandlungsgesetz",
      "state": "Nordrhein-Westfalen",
      "amtsgericht": "Amtsgericht Düsseldorf",
      "registernummer": "HRB 56405",
      "registerart": "HRB",
      "company_name": "Rampart Solutions GmbH",
      "company_seat": "Düsseldorf",
      "details": "04.08.2025 (Bekanntmachungsdatum)\n\nNordrhein-Westfalen Amtsgericht Düsseldorf HRB 56405\nRegisterbekanntmachung nach dem Umwandlungsgesetz 04.08.2025 (Eintragungsdatum)\n\nRampart Solutions GmbH\nGesellschaft mit beschränkter Haftung\nDüsseldorf\n\nDen Gläubigern der an der Verschmelzung beteiligten Rechtsträger ist, wenn sie binnen sechs Monaten nach dem Tag, an dem die Eintragung der Verschmelzung in das Register des Sitzes desjenigen Rechtsträgers, dessen Gläubiger sie sind, nach § 19 Absatz 3 UmwG als bekanntgemacht gilt, ihren Anspruch nach Grund und Höhe schriftlich anmelden, Sicherheit zu leisten, soweit sie nicht Befriedigung verlangen können. Dieses Recht steht den Gläubigern jedoch nur zu, wenn sie glaubhaft machen, dass durch die Verschmelzung die Erfüllung ihrer Forderung gefährdet wird."
    },
    {
      "date": "2025-08-04",
      "id": "119144",
      "original_text": "Löschungsankündigung\nNordrhein-Westfalen Amtsgericht Gütersloh HRB 13486\nKonzept Bau GmbH – Verl",
      "type": "Löschungsankündigung",
      "state": "Nordrhein-Westfalen",
      "amtsgericht": "Amtsgericht Gütersloh",
      "registernummer": "HRB 13486",
      "registerart": "HRB",
      "company_name": "Konzept Bau GmbH",
      "company_seat": "Verl",
      "details": "04.08.2025 (Bekanntmachungsdatum)\n\nNordrhein-Westfalen Amtsgericht Gütersloh HRB 13486\nLöschungsankündigung 04.08.2025 (Eintragungsdatum)\n\nKonzept Bau GmbH\nGesellschaft mit beschränkter Haftung\nVerl\n\nDas Registergericht beabsichtigt die Gesellschaft von Amts wegen nach § 394 FamFG zu löschen. Die Frist zur Erhebung eines Widerspruchs ist auf einen Monat festgesetzt."
    },
    {
      "date": "2025-08-04",
      "id": "119145",
      "original_text": "Einreichung neuer Dokumente\nNordrhein-Westfalen Amtsgericht Düsseldorf HRB 39473\nCECONOMY AG – Düsseldorf",
      "type": "Einreichung neuer Dokumente",
      "state": "Nordrhein-Westfalen",
      "amtsgericht": "Amtsgericht Düsseldorf",
      "registernummer": "HRB 39473",
      "registerart": "HRB",
      "company_name": "CECONOMY AG",
      "company_seat": "Düsseldorf",
      "details": "04.08.2025 (Bekanntmachungsdatum)\n\nNordrhein-Westfalen Amtsgericht Düsseldorf HRB 39473\nEinreichung neuer Dokumente\n\nCECONOMY AG\nAktiengesellschaft\nDüsseldorf\n\nDem Registergericht ist eine Liste der Mitglieder des Aufsichtsrates eingereicht worden."
    },
    {
      "date": "2025-08-04",
      "id": "119146",
      "original_text": "Löschungsankündigung\nNordrhein-Westfalen Amtsgericht Bochum HRB 21794\nVita Therme Heinrichsbad GmbH – Herne",
      "type": "Löschungsankündigung",
      "state": "Nordrhein-Westfalen",
      "amtsgericht": "Amtsgericht Bochum",
      "registernummer": "HRB 21794",
      "registerart": "HRB",
      "company_name": "Vita Therme Heinrichsbad GmbH",
      "company_seat": "Herne",
      "details": "04.08.2025 (Bekanntmachungsdatum)\n\nNordrhein-Westfalen Amtsgericht Bochum HRB 21794\nLöschungsankündigung 05.08.2025 (Eintragungsdatum)\n\nVita Therme Heinrichsbad GmbH\nGesellschaft mit beschränkter Haftung\nHerne\n\nDas Registergericht beabsichtigt die Gesellschaft von Amts wegen nach § 394 FamFG zu löschen. Die Frist zur Erhebung eines Widerspruchs ist auf drei Monate festgesetzt."
    },
    {
      "date": "2025-08-04",
      "id": "119147",
      "original_text": "Einreichung neuer Dokumente\nNordrhein-Westfalen Amtsgericht Münster HRB 22763\nRaiffeisen-NetWorld GmbH – Telgte",
      "type": "Einreichung neuer Dokumente",
      "state": "Nordrhein-Westfalen",
      "amtsgericht": "Amtsgericht Münster",
      "registernummer": "HRB 22763",
      "registerart": "HRB",
      "company_name": "Raiffeisen-NetWorld GmbH",
      "company_seat": "Telgte",
      "details": "04.08.2025 (Bekanntmachungsdatum)\n\nNordrhein-Westfalen Amtsgericht Münster HRB 22763\nEinreichung neuer Dokumente\n\nRaiffeisen-NetWorld GmbH\nGesellschaft mit beschränkter Haftung\nTelgte\n\nDem Registergericht ist eine neue Liste der Mitglieder des Aufsichtsrates eingereicht worden."
    },
    {
      "date": "2025-08-04",
      "id": "119148",
      "original_text": "Löschungsankündigung\nNordrhein-Westfalen Amtsgericht Aachen HRB 10830\nH.S.M. GmbH – Alsdorf",
      "type": "Löschungsankündigung",
      "state": "Nordrhein-Westfalen",
      "amtsgericht": "Amtsgericht Aachen",
      "registernummer": "HRB 10830",
      "registerart": "HRB",
      "company_name": "H.S.M. GmbH",
      "company_seat": "Alsdorf",
      "details": "04.08.2025 (Bekanntmachungsdatum)\n\nNordrhein-Westfalen Amtsgericht Aachen HRB 10830\nLöschungsankündigung\n\nH.S.M. GmbH\nGesellschaft mit beschränkter Haftung\nAlsdorf\n\nDas Registergericht beabsichtigt, von Amts wegen die Gesellschaft wegen Vermögenslosigkeit nach § 394 FamFG zu löschen, weil das Insolvenzverfahren Amtsgericht Aachen (91 IN 67/06) beendet und Vermögen der Gesellschaft nicht mehr erkennbar ist. Zur Geltendmachung des Widerspruchs gegen die beabsichtigte Löschung wird hiermit eine Frist von einem Monat ab Veröffentlichung dieser Ankündigung bestimmt.\nRechtsbehelfsbelehrung:\nGegen diese Verfügung kann Widerspruch eingelegt werden. Zum Widerspruch ist jeder berechtigt, der an der Unterlassung der Löschung ein berechtigtes Interesse hat.\nDer Widerspruch ist bei dem Amtsgericht Aachen, Adalbertsteinweg 92, 52070 Aachen schriftlich in deutscher Sprache oder zur Niederschrift der Geschäftsstelle einzulegen. Der Widerspruch kann auch zur Niederschrift der Geschäftsstelle eines jeden Amtsgerichtes abgegeben werden. Der Widerspruch muss spätestens innerhalb der gesetzten Frist nach der Bekanntgabe der Verfügung bei dem Amtsgericht Aachen eingegangen sein. Dies gilt auch dann, wenn der Widerspruch zur Niederschrift der Geschäftsstelle eines anderen Amtsgerichtes abgegeben wurde. Die Frist beginnt mit der Bekanntgabe der Verfügung durch Veröffentlichung. Fällt das Ende der Frist auf einen Sonntag, einen allgemeinen Feiertag oder Sonnabend, so endet die Frist mit Ablauf des nächsten Werktages.\nDer Widerspruch muss die Bezeichnung der angefochtenen Verfügung sowie die Erklärung enthalten, dass Widerspruch gegen diese Verfügung eingelegt wird. Er ist zu unterzeichnen und soll begründet werden.\nDie Einlegung ist auch durch Übertragung eines elektronischen Dokuments an die elektronische Poststelle des Gerichts möglich. Das elektronische Dokument muss für die Bearbeitung durch das Gericht geeignet und mit einer qualifizierten elektronischen Signatur der verantwortenden Person versehen sein oder von der verantwortenden Person signiert und auf einem sicheren Übermittlungsweg gemäß § 130 a ZPO nach näherer Maßgabe der Verordnung über die technischen Rahmenbedingungen des elektronischen Rechtsverkehrs und über das besondere elektronische Behördenpostfach (BGBl. I, S. 3803) eingereicht werden. Weitere Informationen erhalten Sie auf der Internetseite www.justiz.de."
    },
    {
      "date": "2025-08-04",
      "id": "119149",
      "original_text": "Löschungsankündigung\nNordrhein-Westfalen Amtsgericht Hagen HRB 11671\nKay Taxi GmbH – Hagen",
      "type": "Löschungsankündigung",
      "state": "Nordrhein-Westfalen",
      "amtsgericht": "Amtsgericht Hagen",
      "registernummer": "HRB 11671",
      "registerart": "HRB",
      "company_name": "Kay Taxi GmbH",
      "company_seat": "Hagen",
      "details": "04.08.2025 (Bekanntmachungsdatum)\n\nNordrhein-Westfalen Amtsgericht Hagen HRB 11671\nLöschungsankündigung\n\nKay Taxi GmbH\nGesellschaft mit beschränkter Haftung\nHagen\n\nDas Registergericht beabsichtigt, die im Handelsregister eingetragene Gesellschaft gemäß § 394 Absatz 1 FamFG wegen Vermögenslosigkeit von Amts wegen zu löschen.  Gegen diese Verfügung kann Widerspruch eingelegt werden. Die Frist zur Erhebung eines Widerspruchs gegen die beabsichtigte Löschung von Amts wegen ist auf drei Monate festgesetzt.\n\nRechtsbehelfsbelehrung:\nGegen diese Verfügung können Sie Widerspruch einlegen.\n\nDer Widerspruch ist bei dem Amtsgericht Hagen, Heinitzstraße 42, 58097 Hagen schriftlich in deutscher Sprache oder zur Niederschrift der Geschäftsstelle einzulegen. Der Widerspruch kann auch zur Niederschrift der Geschäftsstelle eines jeden Amtsgerichtes abgegeben werden.\n\nDer Widerspruch muss spätestens innerhalb der gesetzten Frist bei dem Amtsgericht Hagen eingegangen sein. Dies gilt auch dann, wenn der Widerspruch zur Niederschrift der Geschäftsstelle eines anderen Amtsgerichtes abgegeben wurde. Die Frist beginnt mit der Veröffentlichung. Fällt das Ende der Frist auf einen Sonntag, einen allgemeinen Feiertag oder Sonnabend, so endet die Frist mit Ablauf des nächsten Werktages.\n\nDer Widerspruch muss die Bezeichnung der angefochtenen Verfügung sowie die Erklärung enthalten, dass Widerspruch gegen diese Verfügung eingelegt wird. Er ist zu unterzeichnen und soll begründet werden."
    },
    {
      "date": "2025-08-04",
      "id": "119150",
      "original_text": "Registerbekanntmachung nach dem Umwandlungsgesetz\nNordrhein-Westfalen Amtsgericht Köln HRB 59181\nKempen Krause Beratende Ingenieure GmbH – Köln",
      "type": "Registerbekanntmachung nach dem Umwandlungsgesetz",
      "state": "Nordrhein-Westfalen",
      "amtsgericht": "Amtsgericht Köln",
      "registernummer": "HRB 59181",
      "registerart": "HRB",
      "company_name": "Kempen Krause Beratende Ingenieure GmbH",
      "company_seat": "Köln",
      "details": "04.08.2025 (Bekanntmachungsdatum)\n\nNordrhein-Westfalen Amtsgericht Köln HRB 59181\nRegisterbekanntmachung nach dem Umwandlungsgesetz 04.08.2025 (Eintragungsdatum)\n\nKempen Krause Beratende Ingenieure GmbH\nGesellschaft mit beschränkter Haftung\nKöln\n\nDen Gläubigern der an der Verschmelzung beteiligten Rechtsträger ist, wenn sie binnen sechs Monaten nach dem Tag, an dem die Eintragung der Verschmelzung in das Register des Sitzes desjenigen Rechtsträgers, dessen Gläubiger sie sind, nach § 19 Absatz 3 UmwG als bekanntgemacht gilt, ihren Anspruch nach Grund und Höhe schriftlich anmelden, Sicherheit zu leisten, soweit sie nicht Befriedigung verlangen können. Dieses Recht steht den Gläubigern jedoch nur zu, wenn sie glaubhaft machen, dass durch die Verschmelzung die Erfüllung ihrer Forderung gefährdet wird."
    },
    {
      "date": "2025-08-04",
      "id": "119151",
      "original_text": "Registerbekanntmachung nach dem Umwandlungsgesetz\nNordrhein-Westfalen Amtsgericht Düsseldorf HRB 30575\nBaker Tilly Holding GmbH Wirtschaftsprüfungsgesellschaft Steuerberatungsgesellschaft – Düsseldorf",
      "type": "Registerbekanntmachung nach dem Umwandlungsgesetz",
      "state": "Nordrhein-Westfalen",
      "amtsgericht": "Amtsgericht Düsseldorf",
      "registernummer": "HRB 30575",
      "registerart": "HRB",
      "company_name": "Baker Tilly Holding GmbH Wirtschaftsprüfungsgesellschaft Steuerberatungsgesellschaft",
      "company_seat": "Düsseldorf",
      "details": "04.08.2025 (Bekanntmachungsdatum)\n\nNordrhein-Westfalen Amtsgericht Düsseldorf HRB 30575\nRegisterbekanntmachung nach dem Umwandlungsgesetz 04.08.2025 (Eintragungsdatum)\n\nBaker Tilly Holding GmbH Wirtschaftsprüfungsgesellschaft Steuerberatungsgesellschaft\nGesellschaft mit beschränkter Haftung\nDüsseldorf\n\nDen Gläubigern der an der Verschmelzung beteiligten Rechtsträger ist, wenn sie binnen sechs Monaten nach dem Tag, an dem die Eintragung der Verschmelzung in das Register des Sitzes derjenigen Rechtsträger deren Gläubiger sie sind, nach § 19 Absatz 3 UmwG als bekanntgemacht gilt, ihren Anspruch nach Grund und Höhe schriftlich anmelden, Sicherheit zu leisten, soweit sie nicht Befriedigung verlangen können. Dieses Recht steht den Gläubigern jedoch nur zu, wenn sie glaubhaft machen, dass durch die Verschmelzung die Erfüllung ihrer Forderung gefährdet wird."
    },
    {
      "date": "2025-08-04",
      "id": "119152",
      "original_text": "Registerbekanntmachung nach dem Umwandlungsgesetz\nNordrhein-Westfalen Amtsgericht Köln HRB 35380\nAZ Augenchirurgische Zentren AG – Köln",
      "type": "Registerbekanntmachung nach dem Umwandlungsgesetz",
      "state": "Nordrhein-Westfalen",
      "amtsgericht": "Amtsgericht Köln",
      "registernummer": "HRB 35380",
      "registerart": "HRB",
      "company_name": "AZ Augenchirurgische Zentren AG",
      "company_seat": "Köln",
      "details": "04.08.2025 (Bekanntmachungsdatum)\n\nNordrhein-Westfalen Amtsgericht Köln HRB 35380\nRegisterbekanntmachung nach dem Umwandlungsgesetz 04.08.2025 (Eintragungsdatum)\n\nAZ Augenchirurgische Zentren AG\nAktiengesellschaft\nKöln\n\nDen Gläubigern der an der Verschmelzung beteiligten Rechtsträger ist, wenn sie binnen sechs Monaten nach dem Tag, an dem die Eintragung der Verschmelzung in das Register des Sitzes desjenigen Rechtsträgers, dessen Gläubiger sie sind, nach § 19 Absatz 3 UmwG als bekanntgemacht gilt, ihren Anspruch nach Grund und Höhe schriftlich anmelden, Sicherheit zu leisten, soweit sie nicht Befriedigung verlangen können. Dieses Recht steht den Gläubigern jedoch nur zu, wenn sie glaubhaft machen, dass durch die Verschmelzung die Erfüllung ihrer Forderung gefährdet wird."
    },
    {
      "date": "2025-08-04",
      "id": "119153",
      "original_text": "Einreichung neuer Dokumente\nNordrhein-Westfalen Amtsgericht Gütersloh HRB 12762\nNagel-Group Logistics SE – Versmold",
      "type": "Einreichung neuer Dokumente",
      "state": "Nordrhein-Westfalen",
      "amtsgericht": "Amtsgericht Gütersloh",
      "registernummer": "HRB 12762",
      "registerart": "HRB",
      "company_name": "Nagel-Group Logistics SE",
      "company_seat": "Versmold",
      "details": "04.08.2025 (Bekanntmachungsdatum)\n\nNordrhein-Westfalen Amtsgericht Gütersloh HRB 12762\nEinreichung neuer Dokumente\n\nNagel-Group Logistics SE\nEuropäische Aktiengesellschaft (SE)\nVersmold\n\nDem Registergericht ist eine neue Liste der Mitglieder des Verwaltungsrates eingereicht worden."
    },
    {
      "date": "2025-08-04",
      "id": "119154",
      "original_text": "Registerbekanntmachung nach dem Umwandlungsgesetz\nNordrhein-Westfalen Amtsgericht Aachen HRA 10177\nSiemons Ingenieure e.K. – Aachen",
      "type": "Registerbekanntmachung nach dem Umwandlungsgesetz",
      "state": "Nordrhein-Westfalen",
      "amtsgericht": "Amtsgericht Aachen",
      "registernummer": "HRA 10177",
      "registerart": "HRA",
      "company_name": "Siemons Ingenieure e.K.",
      "company_seat": "Aachen",
      "details": "04.08.2025 (Bekanntmachungsdatum)\n\nNordrhein-Westfalen Amtsgericht Aachen HRA 10177\nRegisterbekanntmachung nach dem Umwandlungsgesetz 04.08.2025 (Eintragungsdatum)\n\nSiemons Ingenieure e.K.\nEinzelkaufmann / Einzelkauffrau\nAachen\n\nDen Gläubigern der an der Ausgliederung beteiligten Rechtsträger ist, wenn sie binnen sechs Monaten nach dem Tag, an dem die Eintragung der Ausgliederung in das Register des Sitzes desjenigen Rechtsträgers, dessen Gläubiger sie sind, nach § 19 Absatz 3 UmwG als bekanntgemacht gilt, ihren Anspruch nach Grund und Höhe schriftlich anmelden, Sicherheit zu leisten, soweit sie nicht Befriedigung verlangen können. Dieses Recht steht den Gläubigern jedoch nur zu, wenn sie glaubhaft machen, dass durch die Ausgliederung die Erfüllung ihrer Forderung gefährdet wird."
    },
    {
      "date": "2025-08-04",
      "id": "119155",
      "original_text": "Registerbekanntmachung nach dem Umwandlungsgesetz\nNordrhein-Westfalen Amtsgericht Paderborn GnR 321\nVolksbank Westenholz eG – Delbrück-Wesenholz",
      "type": "Registerbekanntmachung nach dem Umwandlungsgesetz",
      "state": "Nordrhein-Westfalen",
      "amtsgericht": "Amtsgericht Paderborn",
      "registernummer": "GnR 321",
      "registerart": "GnR",
      "company_name": "Volksbank Westenholz eG",
      "company_seat": "Delbrück-Wesenholz",
      "details": "04.08.2025 (Bekanntmachungsdatum)\n\nNordrhein-Westfalen Amtsgericht Paderborn GnR 321\nRegisterbekanntmachung nach dem Umwandlungsgesetz 04.08.2025 (Eintragungsdatum)\n\nVolksbank Westenholz eG\neingetragene Genossenschaft\nDelbrück-Wesenholz\n\nDen Gläubigern der an der Verschmelzung beteiligten Rechtsträger ist, wenn sie binnen sechs Monaten nach dem Tag, an dem die Eintragung der Verschmelzung in das Register des Sitzes desjenigen Rechtsträgers, dessen Gläubiger sie sind, nach § 19 Absatz 3 UmwG als bekanntgemacht gilt, ihren Anspruch nach Grund und Höhe schriftlich anmelden, Sicherheit zu leisten, soweit sie nicht Befriedigung verlangen können. Dieses Recht steht den Gläubigern jedoch nur zu, wenn sie glaubhaft machen, dass durch die Verschmelzung die Erfüllung ihrer Forderung gefährdet wird."
    },
    {
      "date": "2025-08-04",
      "id": "119156",
      "original_text": "Registerbekanntmachung nach dem Umwandlungsgesetz\nNordrhein-Westfalen Amtsgericht Köln HRB 95592\nService & Solutions IT GmbH – Köln",
      "type": "Registerbekanntmachung nach dem Umwandlungsgesetz",
      "state": "Nordrhein-Westfalen",
      "amtsgericht": "Amtsgericht Köln",
      "registernummer": "HRB 95592",
      "registerart": "HRB",
      "company_name": "Service & Solutions IT GmbH",
      "company_seat": "Köln",
      "details": "04.08.2025 (Bekanntmachungsdatum)\n\nNordrhein-Westfalen Amtsgericht Köln HRB 95592\nRegisterbekanntmachung nach dem Umwandlungsgesetz 04.08.2025 (Eintragungsdatum)\n\nService & Solutions IT GmbH\nGesellschaft mit beschränkter Haftung\nKöln\n\nDen Gläubigern der an der Verschmelzung beteiligten Rechtsträger ist, wenn sie binnen sechs Monaten nach dem Tag, an dem die Eintragung der Verschmelzung in das Register des Sitzes desjenigen Rechtsträgers, dessen Gläubiger sie sind, nach § 19 Absatz 3 UmwG als bekanntgemacht gilt, ihren Anspruch nach Grund und Höhe schriftlich anmelden, Sicherheit zu leisten, soweit sie nicht Befriedigung verlangen können. Dieses Recht steht den Gläubigern jedoch nur zu, wenn sie glaubhaft machen, dass durch die Verschmelzung die Erfüllung ihrer Forderung gefährdet wird."
    },
    {
      "date": "2025-08-04",
      "id": "119157",
      "original_text": "Registerbekanntmachung nach dem Umwandlungsgesetz\nNordrhein-Westfalen Amtsgericht Düsseldorf HRA 27799\nD2X Studio GmbH & Co. KG – Düsseldorf",
      "type": "Registerbekanntmachung nach dem Umwandlungsgesetz",
      "state": "Nordrhein-Westfalen",
      "amtsgericht": "Amtsgericht Düsseldorf",
      "registernummer": "HRA 27799",
      "registerart": "HRA",
      "company_name": "D2X Studio GmbH & Co. KG",
      "company_seat": "Düsseldorf",
      "details": "04.08.2025 (Bekanntmachungsdatum)\n\nNordrhein-Westfalen Amtsgericht Düsseldorf HRA 27799\nRegisterbekanntmachung nach dem Umwandlungsgesetz 04.08.2025 (Eintragungsdatum)\n\nD2X Studio GmbH & Co. KG\nKommanditgesellschaft\nDüsseldorf\n\nDen Gläubigern der an der Verschmelzung beteiligten Rechtsträger ist, wenn sie binnen sechs Monaten nach dem Tag, an dem die Eintragung der Verschmelzung in das Register des Sitzes desjenigen Rechtsträgers, dessen Gläubiger sie sind, nach § 19 Absatz 3 UmwG als bekanntgemacht gilt, ihren Anspruch nach Grund und Höhe schriftlich anmelden, Sicherheit zu leisten, soweit sie nicht Befriedigung verlangen können. Dieses Recht steht den Gläubigern jedoch nur zu, wenn sie glaubhaft machen, dass durch die Verschmelzung die Erfüllung ihrer Forderung gefährdet wird."
    },
    {
      "date": "2025-08-04",
      "id": "119158",
      "original_text": "Registerbekanntmachung nach dem Umwandlungsgesetz\nNordrhein-Westfalen Amtsgericht Köln HRB 95953\nARTEMIS MVZ Köln GmbH – Köln",
      "type": "Registerbekanntmachung nach dem Umwandlungsgesetz",
      "state": "Nordrhein-Westfalen",
      "amtsgericht": "Amtsgericht Köln",
      "registernummer": "HRB 95953",
      "registerart": "HRB",
      "company_name": "ARTEMIS MVZ Köln GmbH",
      "company_seat": "Köln",
      "details": "04.08.2025 (Bekanntmachungsdatum)\n\nNordrhein-Westfalen Amtsgericht Köln HRB 95953\nRegisterbekanntmachung nach dem Umwandlungsgesetz 04.08.2025 (Eintragungsdatum)\n\nARTEMIS MVZ Köln GmbH\nGesellschaft mit beschränkter Haftung\nKöln\n\nDen Gläubigern der an der Verschmelzung beteiligten Rechtsträger ist, wenn sie binnen sechs Monaten nach dem Tag, an dem die Eintragung der Verschmelzung in das Register des Sitzes desjenigen Rechtsträgers, dessen Gläubiger sie sind, nach § 19 Absatz 3 UmwG als bekanntgemacht gilt, ihren Anspruch nach Grund und Höhe schriftlich anmelden, Sicherheit zu leisten, soweit sie nicht Befriedigung verlangen können. Dieses Recht steht den Gläubigern jedoch nur zu, wenn sie glaubhaft machen, dass durch die Verschmelzung die Erfüllung ihrer Forderung gefährdet wird."
    },
    {
      "date": "2025-08-04",
      "id": "119159",
      "original_text": "Registerbekanntmachung nach dem Umwandlungsgesetz\nNordrhein-Westfalen Amtsgericht Steinfurt HRA 6105\nAltmeppen Digital GmbH & Co. KG – Rheine",
      "type": "Registerbekanntmachung nach dem Umwandlungsgesetz",
      "state": "Nordrhein-Westfalen",
      "amtsgericht": "Amtsgericht Steinfurt",
      "registernummer": "HRA 6105",
      "registerart": "HRA",
      "company_name": "Altmeppen Digital GmbH & Co. KG",
      "company_seat": "Rheine",
      "details": "04.08.2025 (Bekanntmachungsdatum)\n\nNordrhein-Westfalen Amtsgericht Steinfurt HRA 6105\nRegisterbekanntmachung nach dem Umwandlungsgesetz 01.08.2025 (Eintragungsdatum)\n\nAltmeppen Digital GmbH & Co. KG\nKommanditgesellschaft\nRheine\n\nDen Gläubigern der an der Verschmelzung beteiligten Rechtsträger ist, wenn sie binnen sechs Monaten nach dem Tag, an dem die Eintragung der Verschmelzung in das Register des Sitzes desjenigen Rechtsträgers, dessen Gläubiger sie sind, nach § 19 Absatz 3 UmwG als bekanntgemacht gilt, ihren Anspruch nach Grund und Höhe schriftlich anmelden, Sicherheit zu leisten, soweit sie nicht Befriedigung verlangen können. Dieses Recht steht den Gläubigern jedoch nur zu, wenn sie glaubhaft machen, dass durch die Verschmelzung die Erfüllung ihrer Forderung gefährdet wird."
    },
    {
      "date": "2025-08-04",
      "id": "119160",
      "original_text": "Registerbekanntmachung nach dem Umwandlungsgesetz\nNordrhein-Westfalen Amtsgericht Aachen HRA 10407\nSiemons Ingenieure GmbH & Co. KG – Aachen",
      "type": "Registerbekanntmachung nach dem Umwandlungsgesetz",
      "state": "Nordrhein-Westfalen",
      "amtsgericht": "Amtsgericht Aachen",
      "registernummer": "HRA 10407",
      "registerart": "HRA",
      "company_name": "Siemons Ingenieure GmbH & Co. KG",
      "company_seat": "Aachen",
      "details": "04.08.2025 (Bekanntmachungsdatum)\n\nNordrhein-Westfalen Amtsgericht Aachen HRA 10407\nRegisterbekanntmachung nach dem Umwandlungsgesetz 04.08.2025 (Eintragungsdatum)\n\nSiemons Ingenieure GmbH & Co. KG\nKommanditgesellschaft\nAachen\n\nDen Gläubigern der an der Ausgliederung beteiligten Rechtsträger ist, wenn sie binnen sechs Monaten nach dem Tag, an dem die Eintragung der Ausgliederung in das Register des Sitzes desjenigen Rechtsträgers, dessen Gläubiger sie sind, nach § 19 Absatz 3 UmwG als bekanntgemacht gilt, ihren Anspruch nach Grund und Höhe schriftlich anmelden, Sicherheit zu leisten, soweit sie nicht Befriedigung verlangen können. Dieses Recht steht den Gläubigern jedoch nur zu, wenn sie glaubhaft machen, dass durch die Ausgliederung die Erfüllung ihrer Forderung gefährdet wird."
    },
    {
      "date": "2025-08-04",
      "id": "119161",
      "original_text": "Registerbekanntmachung nach dem Umwandlungsgesetz\nNordrhein-Westfalen Amtsgericht Münster HRA 6388\nBörger Rosery GmbH & Co. KG – Sendenhorst",
      "type": "Registerbekanntmachung nach dem Umwandlungsgesetz",
      "state": "Nordrhein-Westfalen",
      "amtsgericht": "Amtsgericht Münster",
      "registernummer": "HRA 6388",
      "registerart": "HRA",
      "company_name": "Börger Rosery GmbH & Co. KG",
      "company_seat": "Sendenhorst",
      "details": "04.08.2025 (Bekanntmachungsdatum)\n\nNordrhein-Westfalen Amtsgericht Münster HRA 6388\nRegisterbekanntmachung nach dem Umwandlungsgesetz 31.07.2025 (Eintragungsdatum)\n\nBörger Rosery GmbH & Co. KG\nKommanditgesellschaft\nSendenhorst\n\nDen Gläubigern der an der #DV.UmF(Text=\"Bitte wählen Sie die zutreffende Art nach UmwG aus!\",Eingabe=\"Verschmelzung\",\"Aufspaltung\",\"Abspaltung\",\"Ausgliederung\",\"Vermögensübertragung\",\"formwechselnden Umwandlung\") beteiligten Rechtsträger ist, wenn sie binnen sechs Monaten nach dem Tag, an dem die Eintragung der #DV.UmF in das Register des Sitzes #DV.RTr(Text=\"Bitte wählen Sie aus, ob ein oder mehrere andere Rechtsträger betroffen sind!\",Eingabe=\"desjenigen Rechtsträgers, dessen Gläubiger\",\"derjenigen Rechtsträger deren Gläubiger\") sie sind, nach § 19 Absatz 3 UmwG als bekanntgemacht gilt, ihren Anspruch nach Grund und Höhe schriftlich anmelden, Sicherheit zu leisten, soweit sie nicht Befriedigung verlangen können. Dieses Recht steht den Gläubigern jedoch nur zu, wenn sie glaubhaft machen, dass durch die #DV.UmF die Erfüllung ihrer Forderung gefährdet wird."
    },
    {
      "date": "2025-08-04",
      "id": "119162",
      "original_text": "Registerbekanntmachung nach dem Umwandlungsgesetz\nThüringen Amtsgericht Jena HRA 506909\nThomas Brendel Versicherungsmakler e.K. – Jena",
      "type": "Registerbekanntmachung nach dem Umwandlungsgesetz",
      "state": "Thüringen",
      "amtsgericht": "Amtsgericht Jena",
      "registernummer": "HRA 506909",
      "registerart": "HRA",
      "company_name": "Thomas Brendel Versicherungsmakler e.K.",
      "company_seat": "Jena",
      "details": "04.08.2025 (Bekanntmachungsdatum)\n\nThüringen Amtsgericht Jena HRA 506909\nRegisterbekanntmachung nach dem Umwandlungsgesetz 04.08.2025 (Eintragungsdatum)\n\nThomas Brendel Versicherungsmakler e.K.\nEinzelkaufmann / Einzelkauffrau\nJena\n\nNicht eingetragen: Den Gläubigern der an der Ausgliederung beteiligten Rechtsträger, ist wenn sie binnen sechs Monaten nach dem Tag, an dem die Eintragung der Ausgliederung in das Register des Sitzes desjenigen Rechtsträgers, dessen Gläubiger sie sind, nach §§125, 19 Abs. 3 UmwG als bekanntgemacht gilt, ihren Anspruch nach Grund und Höhe schriftlich anmelden, Sicherheit zu leisten, soweit sie nicht Befriedigung verlangen können. Dieses Recht steht ihnen jedoch nur zu, wenn sie glaubhaft machen, daß durch die Ausgliederung die Erfüllung ihrer Forderung gefährdet wird."
    },
    {
      "date": "2025-08-04",
      "id": "119163",
      "original_text": "Registerbekanntmachung nach dem Umwandlungsgesetz\nThüringen Amtsgericht Jena HRA 507053\nVersicherungsmakler Brendel GmbH & Co. KG – Jena",
      "type": "Registerbekanntmachung nach dem Umwandlungsgesetz",
      "state": "Thüringen",
      "amtsgericht": "Amtsgericht Jena",
      "registernummer": "HRA 507053",
      "registerart": "HRA",
      "company_name": "Versicherungsmakler Brendel GmbH & Co. KG",
      "company_seat": "Jena",
      "details": "04.08.2025 (Bekanntmachungsdatum)\n\nThüringen Amtsgericht Jena HRA 507053\nRegisterbekanntmachung nach dem Umwandlungsgesetz 04.08.2025 (Eintragungsdatum)\n\nVersicherungsmakler Brendel GmbH & Co. KG\nKommanditgesellschaft\nJena\n\nNicht eingetragen: Den Gläubigern der an der Ausgliederung beteiligten Rechtsträger, ist wenn sie binnen sechs Monaten nach dem Tag, an dem die Eintragung der Ausgliederung in das Register des Sitzes desjenigen Rechtsträgers, dessen Gläubiger sie sind, nach §§125, 19 Abs. 3 UmwG als bekanntgemacht gilt, ihren Anspruch nach Grund und Höhe schriftlich anmelden, Sicherheit zu leisten, soweit sie nicht Befriedigung verlangen können. Dieses Recht steht ihnen jedoch nur zu, wenn sie glaubhaft machen, daß durch die Ausgliederung die Erfüllung ihrer Forderung gefährdet wird."
    },
    {
      "date": "2025-08-04",
      "id": "119164",
      "original_text": "Löschungsankündigung\nHessen Amtsgericht Offenbach am Main HRB 53056\nADRIA Sicherheitsdienste & Reinigung GmbH – Offenbach am Main",
      "type": "Löschungsankündigung",
      "state": "Hessen",
      "amtsgericht": "Amtsgericht Offenbach am Main",
      "registernummer": "HRB 53056",
      "registerart": "HRB",
      "company_name": "ADRIA Sicherheitsdienste & Reinigung GmbH",
      "company_seat": "Offenbach am Main",
      "details": "04.08.2025 (Bekanntmachungsdatum)\n\nHessen Amtsgericht Offenbach am Main HRB 53056\nLöschungsankündigung\n\nADRIA Sicherheitsdienste & Reinigung GmbH\nGesellschaft mit beschränkter Haftung\nOffenbach am Main\n\nDas Registergericht beabsichtigt die im Handelsregister eingetragene Gesellschaft von Amts wegen nach § 394 FamFG zu löschen. Die Frist zur Erhebung eines Widerspruchs gegen die beabsichtigte Löschung wird auf 3 Monate festgesetzt."
    },
    {
      "date": "2025-08-04",
      "id": "119165",
      "original_text": "Löschungsankündigung\nHessen Amtsgericht Frankfurt am Main HRB 116209\nTWB Verwaltungsgesellschaft mbH – Frankfurt am Main",
      "type": "Löschungsankündigung",
      "state": "Hessen",
      "amtsgericht": "Amtsgericht Frankfurt am Main",
      "registernummer": "HRB 116209",
      "registerart": "HRB",
      "company_name": "TWB Verwaltungsgesellschaft mbH",
      "company_seat": "Frankfurt am Main",
      "details": "04.08.2025 (Bekanntmachungsdatum)\n\nHessen Amtsgericht Frankfurt am Main HRB 116209\nLöschungsankündigung 02.08.2025 (Eintragungsdatum)\n\nTWB Verwaltungsgesellschaft mbH\nGesellschaft mit beschränkter Haftung\nFrankfurt am Main\n\nEs ist beabsichtigt die Gesellschaft wegen Vermögenslosigkeit gemäß § 394 FamFG von Amts wegen zu löschen. Hiergegen kann innerhalb eines Monats nach dieser Veröffentlichung Widerspruch bei dem Amtsgericht Frankfurt am Main eingelegt werden."
    },
    {
      "date": "2025-08-04",
      "id": "119166",
      "original_text": "Registerbekanntmachung nach dem Umwandlungsgesetz\nHessen Amtsgericht Gießen HRB 1555\nBosch KWK Systeme GmbH – Lollar",
      "type": "Registerbekanntmachung nach dem Umwandlungsgesetz",
      "state": "Hessen",
      "amtsgericht": "Amtsgericht Gießen",
      "registernummer": "HRB 1555",
      "registerart": "HRB",
      "company_name": "Bosch KWK Systeme GmbH",
      "company_seat": "Lollar",
      "details": "04.08.2025 (Bekanntmachungsdatum)\n\nHessen Amtsgericht Gießen HRB 1555\nRegisterbekanntmachung nach dem Umwandlungsgesetz 04.08.2025 (Eintragungsdatum)\n\nBosch KWK Systeme GmbH\nGesellschaft mit beschränkter Haftung\nLollar\n\nDen Gläubigern der an der Verschmelzung beteiligten Rechtsträger ist, wenn sie binnen sechs Monaten nach dem Tag, an dem die Eintragung der Verschmelzung in das Register des Sitzes desjenigen Rechtsträgers, dessen Gläubiger sie sind, nach § 19 Absatz 3 UmwG bekannt gemacht worden ist, ihren Anspruch nach Grund und Höhe schriftlich anmelden, Sicherheit zu leisten, soweit sie nicht Befriedigung verlangen können. Dieses Recht steht den Gläubigern jedoch nur zu, wenn sie glaubhaft machen, dass durch die Verschmelzung die Erfüllung ihrer Forderung gefährdet wird."
    },
    {
      "date": "2025-08-04",
      "id": "119167",
      "original_text": "Sonstige Registerbekanntmachung\nHessen Amtsgericht Gießen HRB 1555\nBosch KWK Systeme GmbH – Lollar",
      "type": "Sonstige Registerbekanntmachung",
      "state": "Hessen",
      "amtsgericht": "Amtsgericht Gießen",
      "registernummer": "HRB 1555",
      "registerart": "HRB",
      "company_name": "Bosch KWK Systeme GmbH",
      "company_seat": "Lollar",
      "details": "04.08.2025 (Bekanntmachungsdatum)\n\nHessen Amtsgericht Gießen HRB 1555\nSonstige Registerbekanntmachung 04.08.2025 (Eintragungsdatum)\n\nBosch KWK Systeme GmbH\nGesellschaft mit beschränkter Haftung\nLollar\n\nDen Gläubigern der Gesellschaft, deren Forderungen begründet worden sind, bevor die Eintragung der Beendigung des Vertrags in das Handelsregister nach § 10 HGB bekannt gemacht worden ist, ist vom anderen Vertragsteil Sicherheit zu leisten, wenn sie sich binnen sechs Monaten nach dieser Bekanntmachung zu diesem Zweck bei ihm melden."
    },
    {
      "date": "2025-08-04",
      "id": "119168",
      "original_text": "Löschungsankündigung\nHessen Amtsgericht Frankfurt am Main HRB 131912\nÖZ-AL İNŞAAT TİCARET LİMİTED ŞİRKETİ – Frankfurt am Main",
      "type": "Löschungsankündigung",
      "state": "Hessen",
      "amtsgericht": "Amtsgericht Frankfurt am Main",
      "registernummer": "HRB 131912",
      "registerart": "HRB",
      "company_name": "ÖZ-AL İNŞAAT TİCARET LİMİTED ŞİRKETİ",
      "company_seat": "Frankfurt am Main",
      "details": "04.08.2025 (Bekanntmachungsdatum)\n\nHessen Amtsgericht Frankfurt am Main HRB 131912\nLöschungsankündigung 04.08.2023 (Eintragungsdatum)\n\nÖZ-AL İNŞAAT TİCARET LİMİTED ŞİRKETİ\nRechtsform ausländischen Rechts HRB\nFrankfurt am Main\n\nDas Registergericht beabsichtigt die im Handelsregister eingetragene Zweigniederlassung von Amts wegen nach § 395 FamFG zu löschen. Die Frist zur Erhebung eines Widerspruchs gegen die beabsichtigte Löschung wird auf 3 Monate festgesetzt."
    },
    {
      "date": "2025-08-04",
      "id": "119169",
      "original_text": "Einreichung neuer Dokumente\nHessen Amtsgericht Frankfurt am Main HRB 114190\nGoldman Sachs Bank Europe SE – Frankfurt am Main",
      "type": "Einreichung neuer Dokumente",
      "state": "Hessen",
      "amtsgericht": "Amtsgericht Frankfurt am Main",
      "registernummer": "HRB 114190",
      "registerart": "HRB",
      "company_name": "Goldman Sachs Bank Europe SE",
      "company_seat": "Frankfurt am Main",
      "details": "04.08.2025 (Bekanntmachungsdatum)\n\nHessen Amtsgericht Frankfurt am Main HRB 114190\nEinreichung neuer Dokumente\n\nGoldman Sachs Bank Europe SE\nEuropäische Aktiengesellschaft (SE)\nFrankfurt am Main\n\nDurch eine Änderung in den Personen der Aufsichtsratsmitglieder ist eine Liste der Mitglieder des Aufsichtsrates zum Handelsregister eingereicht worden."
    },
    {
      "date": "2025-08-04",
      "id": "119170",
      "original_text": "Sonstige Registerbekanntmachung\nHessen Amtsgericht Darmstadt VR 50801\nVerein der Köche Groß-Gerau im Verband der Köche Deutschland e.V. – Groß-Gerau",
      "type": "Sonstige Registerbekanntmachung",
      "state": "Hessen",
      "amtsgericht": "Amtsgericht Darmstadt",
      "registernummer": "VR 50801",
      "registerart": "VR",
      "company_name": "Verein der Köche Groß-Gerau im Verband der Köche Deutschland e.V.",
      "company_seat": "Groß-Gerau",
      "details": "04.08.2025 (Bekanntmachungsdatum)\n\nHessen Amtsgericht Darmstadt VR 50801\nSonstige Registerbekanntmachung 04.08.2025 (Eintragungsdatum)\n\nVerein der Köche Groß-Gerau im Verband der Köche Deutschland e.V.\neingetragener Verein\nGroß-Gerau\n\nDer Verein ist aufgelöst."
    },
    {
      "date": "2025-08-04",
      "id": "119171",
      "original_text": "Registerbekanntmachung nach dem Umwandlungsgesetz\nHessen Amtsgericht Frankfurt am Main HRB 52338\nInvestors Marketing AG – Frankfurt am Main",
      "type": "Registerbekanntmachung nach dem Umwandlungsgesetz",
      "state": "Hessen",
      "amtsgericht": "Amtsgericht Frankfurt am Main",
      "registernummer": "HRB 52338",
      "registerart": "HRB",
      "company_name": "Investors Marketing AG",
      "company_seat": "Frankfurt am Main",
      "details": "04.08.2025 (Bekanntmachungsdatum)\n\nHessen Amtsgericht Frankfurt am Main HRB 52338\nRegisterbekanntmachung nach dem Umwandlungsgesetz 04.08.2025 (Eintragungsdatum)\n\nInvestors Marketing AG\nAktiengesellschaft\nFrankfurt am Main\n\nDen Gläubigern der an der Verschmelzung beteiligten Rechtsträger ist, wenn sie binnen sechs Monaten nach dem Tag, an dem die Eintragung der Verschmelzung in das Register des Sitzes desjenigen Rechtsträgers, dessen Gläubiger sie sind, nach § 19 Absatz 3 UmwG bekannt gemacht worden ist, ihren Anspruch nach Grund und Höhe schriftlich anmelden, Sicherheit zu leisten, soweit sie nicht Befriedigung verlangen können. Dieses Recht steht den Gläubigern jedoch nur zu, wenn sie glaubhaft machen, dass durch die Verschmelzung die Erfüllung ihrer Forderung gefährdet wird."
    },
    {
      "date": "2025-08-04",
      "id": "119172",
      "original_text": "Registerbekanntmachung nach dem Umwandlungsgesetz\nHessen Amtsgericht Bad Homburg v.d.H. HRB 14851\nM5 BV Verwaltungs UG (haftungsbeschränkt) – Bad Homburg v. d. Höhe",
      "type": "Registerbekanntmachung nach dem Umwandlungsgesetz",
      "state": "Hessen",
      "amtsgericht": "Amtsgericht Bad Homburg v.d.H.",
      "registernummer": "HRB 14851",
      "registerart": "HRB",
      "company_name": "M5 BV Verwaltungs UG (haftungsbeschränkt)",
      "company_seat": "Bad Homburg v. d. Höhe",
      "details": "04.08.2025 (Bekanntmachungsdatum)\n\nHessen Amtsgericht Bad Homburg v.d.H. HRB 14851\nRegisterbekanntmachung nach dem Umwandlungsgesetz 04.08.2025 (Eintragungsdatum)\n\nM5 BV Verwaltungs UG (haftungsbeschränkt)\nGesellschaft mit beschränkter Haftung\nBad Homburg v. d. Höhe\n\nDen Gläubigern der an der Verschmelzung beteiligten Rechtsträger ist, wenn sie binnen sechs Monaten nach dem Tag, an dem die Eintragung der Verschmelzung in das Register des Sitzes desjenigen Rechtsträgers, dessen Gläubiger sie sind, nach § 19 Absatz 3 UmwG bekannt gemacht worden ist, ihren Anspruch nach Grund und Höhe schriftlich anmelden, Sicherheit zu leisten, soweit sie nicht Befriedigung verlangen können. Dieses Recht steht den Gläubigern jedoch nur zu, wenn sie glaubhaft machen, dass durch die Verschmelzung die Erfüllung ihrer Forderung gefährdet wird."
    },
    {
      "date": "2025-08-04",
      "id": "119173",
      "original_text": "Registerbekanntmachung nach dem Umwandlungsgesetz\nHessen Amtsgericht Frankfurt am Main HRB 57036\nNexi Germany GmbH – Eschborn",
      "type": "Registerbekanntmachung nach dem Umwandlungsgesetz",
      "state": "Hessen",
      "amtsgericht": "Amtsgericht Frankfurt am Main",
      "registernummer": "HRB 57036",
      "registerart": "HRB",
      "company_name": "Nexi Germany GmbH",
      "company_seat": "Eschborn",
      "details": "04.08.2025 (Bekanntmachungsdatum)\n\nHessen Amtsgericht Frankfurt am Main HRB 57036\nRegisterbekanntmachung nach dem Umwandlungsgesetz 03.08.2025 (Eintragungsdatum)\n\nNexi Germany GmbH\nGesellschaft mit beschränkter Haftung\nEschborn\n\nDen Gläubigern der an der Verschmelzung beteiligten Rechtsträger ist, wenn sie binnen sechs Monaten nach dem Tag, an dem die Eintragung der Verschmelzung in das Register des Sitzes desjenigen Rechtsträgers, dessen Gläubiger sie sind, nach § 19 Absatz 3 UmwG bekannt gemacht worden ist, ihren Anspruch nach Grund und Höhe schriftlich anmelden, Sicherheit zu leisten, soweit sie nicht Befriedigung verlangen können. Dieses Recht steht den Gläubigern jedoch nur zu, wenn sie glaubhaft machen, dass durch die Verschmelzung die Erfüllung ihrer Forderung gefährdet wird."
    },
    {
      "date": "2025-08-04",
      "id": "119174",
      "original_text": "Registerbekanntmachung nach dem Umwandlungsgesetz\nHessen Amtsgericht Frankfurt am Main HRB 107599\nKN Rhein-Neckar Immo GmbH – Eschborn",
      "type": "Registerbekanntmachung nach dem Umwandlungsgesetz",
      "state": "Hessen",
      "amtsgericht": "Amtsgericht Frankfurt am Main",
      "registernummer": "HRB 107599",
      "registerart": "HRB",
      "company_name": "KN Rhein-Neckar Immo GmbH",
      "company_seat": "Eschborn",
      "details": "04.08.2025 (Bekanntmachungsdatum)\n\nHessen Amtsgericht Frankfurt am Main HRB 107599\nRegisterbekanntmachung nach dem Umwandlungsgesetz 03.08.2025 (Eintragungsdatum)\n\nKN Rhein-Neckar Immo GmbH\nGesellschaft mit beschränkter Haftung\nEschborn\n\nDen Gläubigern der an der Verschmelzung beteiligten Rechtsträger ist, wenn sie binnen sechs Monaten nach dem Tag, an dem die Eintragung der Verschmelzung in das Register des Sitzes desjenigen Rechtsträgers, dessen Gläubiger sie sind, nach § 19 Absatz 3 UmwG bekannt gemacht worden ist, ihren Anspruch nach Grund und Höhe schriftlich anmelden, Sicherheit zu leisten, soweit sie nicht Befriedigung verlangen können. Dieses Recht steht den Gläubigern jedoch nur zu, wenn sie glaubhaft machen, dass durch die Verschmelzung die Erfüllung ihrer Forderung gefährdet wird."
    },
    {
      "date": "2025-08-04",
      "id": "119175",
      "original_text": "Registerbekanntmachung nach dem Umwandlungsgesetz\nHessen Amtsgericht Frankfurt am Main HRB 89377\nMerkantil Immo GmbH – Eschborn",
      "type": "Registerbekanntmachung nach dem Umwandlungsgesetz",
      "state": "Hessen",
      "amtsgericht": "Amtsgericht Frankfurt am Main",
      "registernummer": "HRB 89377",
      "registerart": "HRB",
      "company_name": "Merkantil Immo GmbH",
      "company_seat": "Eschborn",
      "details": "04.08.2025 (Bekanntmachungsdatum)\n\nHessen Amtsgericht Frankfurt am Main HRB 89377\nRegisterbekanntmachung nach dem Umwandlungsgesetz 03.08.2025 (Eintragungsdatum)\n\nMerkantil Immo GmbH\nGesellschaft mit beschränkter Haftung\nEschborn\n\nDen Gläubigern der an der Verschmelzung beteiligten Rechtsträger ist, wenn sie binnen sechs Monaten nach dem Tag, an dem die Eintragung der Verschmelzung in das Register des Sitzes desjenigen Rechtsträgers, dessen Gläubiger sie sind, nach § 19 Absatz 3 UmwG bekannt gemacht worden ist, ihren Anspruch nach Grund und Höhe schriftlich anmelden, Sicherheit zu leisten, soweit sie nicht Befriedigung verlangen können. Dieses Recht steht den Gläubigern jedoch nur zu, wenn sie glaubhaft machen, dass durch die Verschmelzung die Erfüllung ihrer Forderung gefährdet wird."
    },
    {
      "date": "2025-08-04",
      "id": "119176",
      "original_text": "Registerbekanntmachung nach dem Umwandlungsgesetz\nHessen Amtsgericht Wiesbaden HRB 20057\nInstitut für Private Wealth Management GmbH – Wiesbaden",
      "type": "Registerbekanntmachung nach dem Umwandlungsgesetz",
      "state": "Hessen",
      "amtsgericht": "Amtsgericht Wiesbaden",
      "registernummer": "HRB 20057",
      "registerart": "HRB",
      "company_name": "Institut für Private Wealth Management GmbH",
      "company_seat": "Wiesbaden",
      "details": "04.08.2025 (Bekanntmachungsdatum)\n\nHessen Amtsgericht Wiesbaden HRB 20057\nRegisterbekanntmachung nach dem Umwandlungsgesetz 04.08.2025 (Eintragungsdatum)\n\nInstitut für Private Wealth Management GmbH\nGesellschaft mit beschränkter Haftung\nWiesbaden\n\nDen Gläubigern der an der Verschmelzung beteiligten Rechtsträger ist, wenn sie binnen sechs Monaten nach dem Tag, an dem die Eintragung der Verschmelzung in das Register des Sitzes derjenigen Rechtsträger deren Gläubiger sie sind, nach § 19 Absatz 3 UmwG bekannt gemacht worden ist, ihren Anspruch nach Grund und Höhe schriftlich anmelden, Sicherheit zu leisten, soweit sie nicht Befriedigung verlangen können. Dieses Recht steht den Gläubigern jedoch nur zu, wenn sie glaubhaft machen, dass durch die Verschmelzung die Erfüllung ihrer Forderung gefährdet wird."
    },
    {
      "date": "2025-08-04",
      "id": "119177",
      "original_text": "Einreichung neuer Dokumente\nHessen Amtsgericht Frankfurt am Main HRB 114198\nVR Payment GmbH – Frankfurt am Main",
      "type": "Einreichung neuer Dokumente",
      "state": "Hessen",
      "amtsgericht": "Amtsgericht Frankfurt am Main",
      "registernummer": "HRB 114198",
      "registerart": "HRB",
      "company_name": "VR Payment GmbH",
      "company_seat": "Frankfurt am Main",
      "details": "04.08.2025 (Bekanntmachungsdatum)\n\nHessen Amtsgericht Frankfurt am Main HRB 114198\nEinreichung neuer Dokumente\n\nVR Payment GmbH\nGesellschaft mit beschränkter Haftung\nFrankfurt am Main\n\nDurch eine Änderung in den Personen der Aufsichtsratsmitglieder ist eine Liste der Mitglieder des Aufsichtsrates zum Handelsregister eingereicht worden."
    },
    {
      "date": "2025-08-04",
      "id": "119178",
      "original_text": "Registerbekanntmachung nach dem Umwandlungsgesetz\nHessen Amtsgericht Frankfurt am Main HRA 44798\nMeinhardt Asset GmbH & Co. KG – Hofheim-Wallau",
      "type": "Registerbekanntmachung nach dem Umwandlungsgesetz",
      "state": "Hessen",
      "amtsgericht": "Amtsgericht Frankfurt am Main",
      "registernummer": "HRA 44798",
      "registerart": "HRA",
      "company_name": "Meinhardt Asset GmbH & Co. KG",
      "company_seat": "Hofheim-Wallau",
      "details": "04.08.2025 (Bekanntmachungsdatum)\n\nHessen Amtsgericht Frankfurt am Main HRA 44798\nRegisterbekanntmachung nach dem Umwandlungsgesetz 04.08.2025 (Eintragungsdatum)\n\nMeinhardt Asset GmbH & Co. KG\nKommanditgesellschaft\nHofheim-Wallau\n\nDen Gläubigern der an der Verschmelzung beteiligten Rechtsträger ist, wenn sie binnen sechs Monaten nach dem Tag, an dem die Eintragung der Verschmelzung in das Register des Sitzes desjenigen Rechtsträgers, dessen Gläubiger sie sind, nach § 19 Absatz 3 UmwG bekannt gemacht worden ist, ihren Anspruch nach Grund und Höhe schriftlich anmelden, Sicherheit zu leisten, soweit sie nicht Befriedigung verlangen können. Dieses Recht steht den Gläubigern jedoch nur zu, wenn sie glaubhaft machen, dass durch die Verschmelzung die Erfüllung ihrer Forderung gefährdet wird."
    },
    {
      "date": "2025-08-04",
      "id": "119179",
      "original_text": "Registerbekanntmachung nach dem Umwandlungsgesetz\nHessen Amtsgericht Bad Homburg v.d.H. HRB 15872\nM5 BV Beteiligungs GmbH – Bad Homburg v. d. Höhe",
      "type": "Registerbekanntmachung nach dem Umwandlungsgesetz",
      "state": "Hessen",
      "amtsgericht": "Amtsgericht Bad Homburg v.d.H.",
      "registernummer": "HRB 15872",
      "registerart": "HRB",
      "company_name": "M5 BV Beteiligungs GmbH",
      "company_seat": "Bad Homburg v. d. Höhe",
      "details": "04.08.2025 (Bekanntmachungsdatum)\n\nHessen Amtsgericht Bad Homburg v.d.H. HRB 15872\nRegisterbekanntmachung nach dem Umwandlungsgesetz 04.08.2025 (Eintragungsdatum)\n\nM5 BV Beteiligungs GmbH\nGesellschaft mit beschränkter Haftung\nBad Homburg v. d. Höhe\n\nDen Gläubigern der an der Verschmelzung beteiligten Rechtsträger ist, wenn sie binnen sechs Monaten nach dem Tag, an dem die Eintragung der Verschmelzung in das Register des Sitzes desjenigen Rechtsträgers, dessen Gläubiger sie sind, nach § 19 Absatz 3 UmwG bekannt gemacht worden ist, ihren Anspruch nach Grund und Höhe schriftlich anmelden, Sicherheit zu leisten, soweit sie nicht Befriedigung verlangen können. Dieses Recht steht den Gläubigern jedoch nur zu, wenn sie glaubhaft machen, dass durch die Verschmelzung die Erfüllung ihrer Forderung gefährdet wird."
    },
    {
      "date": "2025-08-04",
      "id": "119180",
      "original_text": "Registerbekanntmachung nach dem Umwandlungsgesetz\nHessen Amtsgericht Darmstadt HRB 91284\nJUSCHDA Beteiligung GmbH – Darmstadt",
      "type": "Registerbekanntmachung nach dem Umwandlungsgesetz",
      "state": "Hessen",
      "amtsgericht": "Amtsgericht Darmstadt",
      "registernummer": "HRB 91284",
      "registerart": "HRB",
      "company_name": "JUSCHDA Beteiligung GmbH",
      "company_seat": "Darmstadt",
      "details": "04.08.2025 (Bekanntmachungsdatum)\n\nHessen Amtsgericht Darmstadt HRB 91284\nRegisterbekanntmachung nach dem Umwandlungsgesetz 04.08.2025 (Eintragungsdatum)\n\nJUSCHDA Beteiligung GmbH\nGesellschaft mit beschränkter Haftung\nDarmstadt\n\nDen Gläubigern der an der Verschmelzung beteiligten Rechtsträger ist, wenn sie binnen sechs Monaten nach dem Tag, an dem die Eintragung der Verschmelzung in das Register des Sitzes desjenigen Rechtsträgers, dessen Gläubiger sie sind, nach § 19 Absatz 3 UmwG bekannt gemacht worden ist, ihren Anspruch nach Grund und Höhe schriftlich anmelden, Sicherheit zu leisten, soweit sie nicht Befriedigung verlangen können. Dieses Recht steht den Gläubigern jedoch nur zu, wenn sie glaubhaft machen, dass durch die Verschmelzung die Erfüllung ihrer Forderung gefährdet wird."
    },
    {
      "date": "2025-08-04",
      "id": "119181",
      "original_text": "Registerbekanntmachung nach dem Umwandlungsgesetz\nHessen Amtsgericht Frankfurt am Main HRB 120851\nIM Digital Solutions GmbH – Frankfurt am Main",
      "type": "Registerbekanntmachung nach dem Umwandlungsgesetz",
      "state": "Hessen",
      "amtsgericht": "Amtsgericht Frankfurt am Main",
      "registernummer": "HRB 120851",
      "registerart": "HRB",
      "company_name": "IM Digital Solutions GmbH",
      "company_seat": "Frankfurt am Main",
      "details": "04.08.2025 (Bekanntmachungsdatum)\n\nHessen Amtsgericht Frankfurt am Main HRB 120851\nRegisterbekanntmachung nach dem Umwandlungsgesetz 04.08.2025 (Eintragungsdatum)\n\nIM Digital Solutions GmbH\nGesellschaft mit beschränkter Haftung\nFrankfurt am Main\n\nDen Gläubigern der an der Verschmelzung beteiligten Rechtsträger ist, wenn sie binnen sechs Monaten nach dem Tag, an dem die Eintragung der Verschmelzung in das Register des Sitzes desjenigen Rechtsträgers, dessen Gläubiger sie sind, nach § 19 Absatz 3 UmwG bekannt gemacht worden ist, ihren Anspruch nach Grund und Höhe schriftlich anmelden, Sicherheit zu leisten, soweit sie nicht Befriedigung verlangen können. Dieses Recht steht den Gläubigern jedoch nur zu, wenn sie glaubhaft machen, dass durch die Verschmelzung die Erfüllung ihrer Forderung gefährdet wird."
    },
    {
      "date": "2025-08-04",
      "id": "119182",
      "original_text": "Sonstige Registerbekanntmachung\nHessen Amtsgericht Frankfurt am Main VR 15451\nFörderverein zur Unterstützung bei Ausbildung und Krankheit – Frankfurt am Main",
      "type": "Sonstige Registerbekanntmachung",
      "state": "Hessen",
      "amtsgericht": "Amtsgericht Frankfurt am Main",
      "registernummer": "VR 15451",
      "registerart": "VR",
      "company_name": "Förderverein zur Unterstützung bei Ausbildung und Krankheit",
      "company_seat": "Frankfurt am Main",
      "details": "04.08.2025 (Bekanntmachungsdatum)\n\nHessen Amtsgericht Frankfurt am Main VR 15451\nSonstige Registerbekanntmachung 04.08.2025 (Eintragungsdatum)\n\nFörderverein zur Unterstützung bei Ausbildung und Krankheit\neingetragener Verein\nFrankfurt am Main\n\nDer Verein ist aufgelöst."
    },
    {
      "date": "2025-08-04",
      "id": "119183",
      "original_text": "Sonstige Registerbekanntmachung\nHessen Amtsgericht Darmstadt VR 83301\nSpaceDays e. V. – Darmstadt",
      "type": "Sonstige Registerbekanntmachung",
      "state": "Hessen",
      "amtsgericht": "Amtsgericht Darmstadt",
      "registernummer": "VR 83301",
      "registerart": "VR",
      "company_name": "SpaceDays e. V.",
      "company_seat": "Darmstadt",
      "details": "04.08.2025 (Bekanntmachungsdatum)\n\nHessen Amtsgericht Darmstadt VR 83301\nSonstige Registerbekanntmachung 04.08.2025 (Eintragungsdatum)\n\nSpaceDays e. V.\neingetragener Verein\nDarmstadt\n\nDer Verein ist aufgelöst."
    },
    {
      "date": "2025-08-04",
      "id": "119184",
      "original_text": "Löschungsankündigung\nHessen Amtsgericht Darmstadt HRB 89010\nAlpaka Casa GmbH – Rimbach",
      "type": "Löschungsankündigung",
      "state": "Hessen",
      "amtsgericht": "Amtsgericht Darmstadt",
      "registernummer": "HRB 89010",
      "registerart": "HRB",
      "company_name": "Alpaka Casa GmbH",
      "company_seat": "Rimbach",
      "details": "04.08.2025 (Bekanntmachungsdatum)\n\nHessen Amtsgericht Darmstadt HRB 89010\nLöschungsankündigung\n\nAlpaka Casa GmbH\nGesellschaft mit beschränkter Haftung\nRimbach\n\nDas Registergericht beabsichtigt die im Handelsregister eingetragene Gesellschaft von Amts wegen nach § 394 FamFG zu löschen. Die Frist zur Erhebung eines Widerspruchs gegen die beabsichtigte Löschung wird auf 3 Monate festgesetzt."
    },
    {
      "date": "2025-08-04",
      "id": "119185",
      "original_text": "Registerbekanntmachung nach dem Umwandlungsgesetz\nHessen Amtsgericht Frankfurt am Main HRB 126708\npaytec payment provider GmbH – Eschborn",
      "type": "Registerbekanntmachung nach dem Umwandlungsgesetz",
      "state": "Hessen",
      "amtsgericht": "Amtsgericht Frankfurt am Main",
      "registernummer": "HRB 126708",
      "registerart": "HRB",
      "company_name": "paytec payment provider GmbH",
      "company_seat": "Eschborn",
      "details": "04.08.2025 (Bekanntmachungsdatum)\n\nHessen Amtsgericht Frankfurt am Main HRB 126708\nRegisterbekanntmachung nach dem Umwandlungsgesetz 03.08.2025 (Eintragungsdatum)\n\npaytec payment provider GmbH\nGesellschaft mit beschränkter Haftung\nEschborn\n\nDen Gläubigern der an der Verschmelzung beteiligten Rechtsträger ist, wenn sie binnen sechs Monaten nach dem Tag, an dem die Eintragung der Verschmelzung in das Register des Sitzes desjenigen Rechtsträgers, dessen Gläubiger sie sind, nach § 19 Absatz 3 UmwG bekannt gemacht worden ist, ihren Anspruch nach Grund und Höhe schriftlich anmelden, Sicherheit zu leisten, soweit sie nicht Befriedigung verlangen können. Dieses Recht steht den Gläubigern jedoch nur zu, wenn sie glaubhaft machen, dass durch die Verschmelzung die Erfüllung ihrer Forderung gefährdet wird."
    },
    {
      "date": "2025-08-04",
      "id": "119186",
      "original_text": "Löschungsankündigung\nHessen Amtsgericht Darmstadt HRB 104291\nHYH Blitz GmbH – Rüsselsheim",
      "type": "Löschungsankündigung",
      "state": "Hessen",
      "amtsgericht": "Amtsgericht Darmstadt",
      "registernummer": "HRB 104291",
      "registerart": "HRB",
      "company_name": "HYH Blitz GmbH",
      "company_seat": "Rüsselsheim",
      "details": "04.08.2025 (Bekanntmachungsdatum)\n\nHessen Amtsgericht Darmstadt HRB 104291\nLöschungsankündigung 04.08.2025 (Eintragungsdatum)\n\nHYH Blitz GmbH\nGesellschaft mit beschränkter Haftung\nRüsselsheim\n\nDas Registergericht beabsichtigt die im Handelsregister eingetragene Gesellschaft von Amts wegen nach § 394 FamFG zu löschen. Die Frist zur Erhebung eines Widerspruchs gegen die beabsichtigte Löschung wird auf 3 Monate festgesetzt."
    },
    {
      "date": "2025-08-04",
      "id": "119187",
      "original_text": "Sonstige Registerbekanntmachung\nHessen Amtsgericht Frankfurt am Main VR 16364\nVereinigung für Wushu-Kampfkunst in Deutschland e.V. – Frankfurt am Main",
      "type": "Sonstige Registerbekanntmachung",
      "state": "Hessen",
      "amtsgericht": "Amtsgericht Frankfurt am Main",
      "registernummer": "VR 16364",
      "registerart": "VR",
      "company_name": "Vereinigung für Wushu-Kampfkunst in Deutschland e.V.",
      "company_seat": "Frankfurt am Main",
      "details": "04.08.2025 (Bekanntmachungsdatum)\n\nHessen Amtsgericht Frankfurt am Main VR 16364\nSonstige Registerbekanntmachung 04.08.2025 (Eintragungsdatum)\n\nVereinigung für Wushu-Kampfkunst in Deutschland e.V.\neingetragener Verein\nFrankfurt am Main\n\nDer Verein ist aufgelöst."
    },
    {
      "date": "2025-08-04",
      "id": "119188",
      "original_text": "Registerbekanntmachung nach dem Umwandlungsgesetz\nHessen Amtsgericht Darmstadt HRB 90583\nTEIRA Vermögensverwaltung GmbH – Darmstadt",
      "type": "Registerbekanntmachung nach dem Umwandlungsgesetz",
      "state": "Hessen",
      "amtsgericht": "Amtsgericht Darmstadt",
      "registernummer": "HRB 90583",
      "registerart": "HRB",
      "company_name": "TEIRA Vermögensverwaltung GmbH",
      "company_seat": "Darmstadt",
      "details": "04.08.2025 (Bekanntmachungsdatum)\n\nHessen Amtsgericht Darmstadt HRB 90583\nRegisterbekanntmachung nach dem Umwandlungsgesetz 04.08.2025 (Eintragungsdatum)\n\nTEIRA Vermögensverwaltung GmbH\nGesellschaft mit beschränkter Haftung\nDarmstadt\n\nDen Gläubigern der an der Verschmelzung beteiligten Rechtsträger ist, wenn sie binnen sechs Monaten nach dem Tag, an dem die Eintragung der Verschmelzung in das Register des Sitzes desjenigen Rechtsträgers, dessen Gläubiger sie sind, nach § 19 Absatz 3 UmwG bekannt gemacht worden ist, ihren Anspruch nach Grund und Höhe schriftlich anmelden, Sicherheit zu leisten, soweit sie nicht Befriedigung verlangen können. Dieses Recht steht den Gläubigern jedoch nur zu, wenn sie glaubhaft machen, dass durch die Verschmelzung die Erfüllung ihrer Forderung gefährdet wird."
    },
    {
      "date": "2025-08-04",
      "id": "119189",
      "original_text": "Registerbekanntmachung nach dem Umwandlungsgesetz\nHessen Amtsgericht Bad Homburg v.d.H. HRB 15061\nSpectral Engines GmbH – Steinbach (Taunus)",
      "type": "Registerbekanntmachung nach dem Umwandlungsgesetz",
      "state": "Hessen",
      "amtsgericht": "Amtsgericht Bad Homburg v.d.H.",
      "registernummer": "HRB 15061",
      "registerart": "HRB",
      "company_name": "Spectral Engines GmbH",
      "company_seat": "Steinbach (Taunus)",
      "details": "04.08.2025 (Bekanntmachungsdatum)\n\nHessen Amtsgericht Bad Homburg v.d.H. HRB 15061\nRegisterbekanntmachung nach dem Umwandlungsgesetz 04.08.2025 (Eintragungsdatum)\n\nSpectral Engines GmbH\nGesellschaft mit beschränkter Haftung\nSteinbach (Taunus)\n\nDen Gläubigern der an der Verschmelzung beteiligten Rechtsträger ist, wenn sie binnen sechs Monaten nach dem Tag, an dem die Eintragung der Verschmelzung in das Register des Sitzes desjenigen Rechtsträgers, dessen Gläubiger sie sind, nach § 19 Absatz 3 UmwG bekannt gemacht worden ist, ihren Anspruch nach Grund und Höhe schriftlich anmelden, Sicherheit zu leisten, soweit sie nicht Befriedigung verlangen können. Dieses Recht steht den Gläubigern jedoch nur zu, wenn sie glaubhaft machen, dass durch die Verschmelzung die Erfüllung ihrer Forderung gefährdet wird."
    },
    {
      "date": "2025-08-04",
      "id": "119190",
      "original_text": "Registerbekanntmachung nach dem Umwandlungsgesetz\nHessen Amtsgericht Wiesbaden HRB 31774\nInstitut für Private Wealth Management GmbH – Wiesbaden",
      "type": "Registerbekanntmachung nach dem Umwandlungsgesetz",
      "state": "Hessen",
      "amtsgericht": "Amtsgericht Wiesbaden",
      "registernummer": "HRB 31774",
      "registerart": "HRB",
      "company_name": "Institut für Private Wealth Management GmbH",
      "company_seat": "Wiesbaden",
      "details": "04.08.2025 (Bekanntmachungsdatum)\n\nHessen Amtsgericht Wiesbaden HRB 31774\nRegisterbekanntmachung nach dem Umwandlungsgesetz 04.08.2025 (Eintragungsdatum)\n\nInstitut für Private Wealth Management GmbH\nGesellschaft mit beschränkter Haftung\nWiesbaden\n\nDen Gläubigern der an der Verschmelzung beteiligten Rechtsträger ist, wenn sie binnen sechs Monaten nach dem Tag, an dem die Eintragung der Verschmelzung in das Register des Sitzes derjenigen Rechtsträger deren Gläubiger sie sind, nach § 19 Absatz 3 UmwG bekannt gemacht worden ist, ihren Anspruch nach Grund und Höhe schriftlich anmelden, Sicherheit zu leisten, soweit sie nicht Befriedigung verlangen können. Dieses Recht steht den Gläubigern jedoch nur zu, wenn sie glaubhaft machen, dass durch die Verschmelzung die Erfüllung ihrer Forderung gefährdet wird."
    },
    {
      "date": "2025-08-04",
      "id": "119191",
      "original_text": "Sonstige Registerbekanntmachung\nHessen Amtsgericht Wiesbaden HRB 8267\nBürgschaftsbank Hessen GmbH – Wiesbaden",
      "type": "Sonstige Registerbekanntmachung",
      "state": "Hessen",
      "amtsgericht": "Amtsgericht Wiesbaden",
      "registernummer": "HRB 8267",
      "registerart": "HRB",
      "company_name": "Bürgschaftsbank Hessen GmbH",
      "company_seat": "Wiesbaden",
      "details": "04.08.2025 (Bekanntmachungsdatum)\n\nHessen Amtsgericht Wiesbaden HRB 8267\nSonstige Registerbekanntmachung 04.08.2025 (Eintragungsdatum)\n\nBürgschaftsbank Hessen GmbH\nGesellschaft mit beschränkter Haftung\nWiesbaden\n\nDurch eine Änderung in den Personen der Aufsichtsratsmitglieder ist eine Liste der Mitglieder des Aufsichtsrates zum Handelsregister eingereicht worden."
    },
    {
      "date": "2025-08-04",
      "id": "119192",
      "original_text": "Registerbekanntmachung nach dem Umwandlungsgesetz\nHessen Amtsgericht Frankfurt am Main HRB 130879\nMeinhardt Asset+Service GmbH – Hofheim am Taunus",
      "type": "Registerbekanntmachung nach dem Umwandlungsgesetz",
      "state": "Hessen",
      "amtsgericht": "Amtsgericht Frankfurt am Main",
      "registernummer": "HRB 130879",
      "registerart": "HRB",
      "company_name": "Meinhardt Asset+Service GmbH",
      "company_seat": "Hofheim am Taunus",
      "details": "04.08.2025 (Bekanntmachungsdatum)\n\nHessen Amtsgericht Frankfurt am Main HRB 130879\nRegisterbekanntmachung nach dem Umwandlungsgesetz 04.08.2025 (Eintragungsdatum)\n\nMeinhardt Asset+Service GmbH\nGesellschaft mit beschränkter Haftung\nHofheim am Taunus\n\nDen Gläubigern der an der Verschmelzung beteiligten Rechtsträger ist, wenn sie binnen sechs Monaten nach dem Tag, an dem die Eintragung der Verschmelzung in das Register des Sitzes desjenigen Rechtsträgers, dessen Gläubiger sie sind, nach § 19 Absatz 3 UmwG bekannt gemacht worden ist, ihren Anspruch nach Grund und Höhe schriftlich anmelden, Sicherheit zu leisten, soweit sie nicht Befriedigung verlangen können. Dieses Recht steht den Gläubigern jedoch nur zu, wenn sie glaubhaft machen, dass durch die Verschmelzung die Erfüllung ihrer Forderung gefährdet wird."
    },
    {
      "date": "2025-08-04",
      "id": "119193",
      "original_text": "Registerbekanntmachung nach dem Umwandlungsgesetz\nHessen Amtsgericht Wiesbaden HRB 24559\nLieblingsshop GmbH – Wiesbaden",
      "type": "Registerbekanntmachung nach dem Umwandlungsgesetz",
      "state": "Hessen",
      "amtsgericht": "Amtsgericht Wiesbaden",
      "registernummer": "HRB 24559",
      "registerart": "HRB",
      "company_name": "Lieblingsshop GmbH",
      "company_seat": "Wiesbaden",
      "details": "04.08.2025 (Bekanntmachungsdatum)\n\nHessen Amtsgericht Wiesbaden HRB 24559\nRegisterbekanntmachung nach dem Umwandlungsgesetz 04.08.2025 (Eintragungsdatum)\n\nLieblingsshop GmbH\nGesellschaft mit beschränkter Haftung\nWiesbaden\n\nDen Gläubigern der an der Verschmelzung beteiligten Rechtsträger ist, wenn sie binnen sechs Monaten nach dem Tag, an dem die Eintragung der Verschmelzung in das Register des Sitzes desjenigen Rechtsträgers, dessen Gläubiger sie sind, nach § 19 Absatz 3 UmwG bekannt gemacht worden ist, ihren Anspruch nach Grund und Höhe schriftlich anmelden, Sicherheit zu leisten, soweit sie nicht Befriedigung verlangen können. Dieses Recht steht den Gläubigern jedoch nur zu, wenn sie glaubhaft machen, dass durch die Verschmelzung die Erfüllung ihrer Forderung gefährdet wird."
    }
  ]
}