{
  "date": "2025-08-16",
  "date_of_scrape": "2025-08-29T07:43:10.470Z",
  "tool_version": "0.2.0",
  "number_of_announcements": 9,
  "announcements": [
    {
      "date": "2025-08-16",
      "id": "121465",
      "original_text": "Registerbekanntmachung nach dem Umwandlungsgesetz\nBayern Amtsgericht Kempten (Allgäu) HRB 11607\nLEI Sachwert UG (haftungsbeschränkt) – Kempten (Allgäu)",
      "type": "Registerbekanntmachung nach dem Umwandlungsgesetz",
      "state": "Bayern",
      "amtsgericht": "Amtsgericht Kempten (Allgäu)",
      "registernummer": "HRB 11607",
      "registerart": "HRB",
      "company_name": "LEI Sachwert UG (haftungsbeschränkt)",
      "company_seat": "Kempten (Allgäu)",
      "details": "16.08.2025 (Bekanntmachungsdatum)\n\nBayern Amtsgericht Kempten (Allgäu) HRB 11607\nRegisterbekanntmachung nach dem Umwandlungsgesetz 15.08.2025 (Eintragungsdatum)\n\nLEI Sachwert UG (haftungsbeschränkt)\nGesellschaft mit beschränkter Haftung\nKempten (Allgäu)\n\nDen Gläubigern der an der Verschmelzung beteiligten Rechtsträger ist, wenn sie binnen sechs Monaten nach dem Tag, an dem die Eintragung der Verschmelzung in das Register des Sitzes desjenigen Rechtsträgers, dessen Gläubiger sie sind, nach § 19 Abs. 3 UmwG als bekannt gemacht gilt, ihren Anspruch nach Grund und Höhe in Textform anmelden, Sicherheit zu leisten, soweit sie nicht Befriedigung verlangen können. Dieses Recht steht den Gläubigern jedoch nur zu, wenn sie glaubhaft machen, dass durch die Verschmelzung die Erfüllung ihrer Forderung gefährdet wird."
    },
    {
      "date": "2025-08-16",
      "id": "121466",
      "original_text": "Registerbekanntmachung nach dem Umwandlungsgesetz\nBayern Amtsgericht Kempten (Allgäu) HRB 13465\nAnP Beteiligungsgesellschaft UG (haftungsbeschränkt) – Kempten (Allgäu)",
      "type": "Registerbekanntmachung nach dem Umwandlungsgesetz",
      "state": "Bayern",
      "amtsgericht": "Amtsgericht Kempten (Allgäu)",
      "registernummer": "HRB 13465",
      "registerart": "HRB",
      "company_name": "AnP Beteiligungsgesellschaft UG (haftungsbeschränkt)",
      "company_seat": "Kempten (Allgäu)",
      "details": "16.08.2025 (Bekanntmachungsdatum)\n\nBayern Amtsgericht Kempten (Allgäu) HRB 13465\nRegisterbekanntmachung nach dem Umwandlungsgesetz 15.08.2025 (Eintragungsdatum)\n\nAnP Beteiligungsgesellschaft UG (haftungsbeschränkt)\nGesellschaft mit beschränkter Haftung\nKempten (Allgäu)\n\nDen Gläubigern der an der Verschmelzung beteiligten Rechtsträger ist, wenn sie binnen sechs Monaten nach dem Tag, an dem die Eintragung der Verschmelzung in das Register des Sitzes desjenigen Rechtsträgers, dessen Gläubiger sie sind, nach § 19 Abs. 3 UmwG als bekannt gemacht gilt, ihren Anspruch nach Grund und Höhe in Textform anmelden, Sicherheit zu leisten, soweit sie nicht Befriedigung verlangen können. Dieses Recht steht den Gläubigern jedoch nur zu, wenn sie glaubhaft machen, dass durch die Verschmelzung die Erfüllung ihrer Forderung gefährdet wird."
    },
    {
      "date": "2025-08-16",
      "id": "121467",
      "original_text": "Registerbekanntmachung nach dem Umwandlungsgesetz\nBayern Amtsgericht Kempten (Allgäu) HRB 11991\nSankt Anna Kempten GmbH – Kempten (Allgäu)",
      "type": "Registerbekanntmachung nach dem Umwandlungsgesetz",
      "state": "Bayern",
      "amtsgericht": "Amtsgericht Kempten (Allgäu)",
      "registernummer": "HRB 11991",
      "registerart": "HRB",
      "company_name": "Sankt Anna Kempten GmbH",
      "company_seat": "Kempten (Allgäu)",
      "details": "16.08.2025 (Bekanntmachungsdatum)\n\nBayern Amtsgericht Kempten (Allgäu) HRB 11991\nRegisterbekanntmachung nach dem Umwandlungsgesetz 15.08.2025 (Eintragungsdatum)\n\nSankt Anna Kempten GmbH\nGesellschaft mit beschränkter Haftung\nKempten (Allgäu)\n\nDen Gläubigern der an der Verschmelzung beteiligten Rechtsträger ist, wenn sie binnen sechs Monaten nach dem Tag, an dem die Eintragung der Verschmelzung in das Register des Sitzes desjenigen Rechtsträgers, dessen Gläubiger sie sind, nach § 19 Abs. 3 UmwG als bekannt gemacht gilt, ihren Anspruch nach Grund und Höhe in Textform anmelden, Sicherheit zu leisten, soweit sie nicht Befriedigung verlangen können. Dieses Recht steht den Gläubigern jedoch nur zu, wenn sie glaubhaft machen, dass durch die Verschmelzung die Erfüllung ihrer Forderung gefährdet wird."
    },
    {
      "date": "2025-08-16",
      "id": "121468",
      "original_text": "Registerbekanntmachung nach dem Umwandlungsgesetz\nBayern Amtsgericht Kempten (Allgäu) HRB 11679\nS12 GmbH – Kempten (Allgäu)",
      "type": "Registerbekanntmachung nach dem Umwandlungsgesetz",
      "state": "Bayern",
      "amtsgericht": "Amtsgericht Kempten (Allgäu)",
      "registernummer": "HRB 11679",
      "registerart": "HRB",
      "company_name": "S12 GmbH",
      "company_seat": "Kempten (Allgäu)",
      "details": "16.08.2025 (Bekanntmachungsdatum)\n\nBayern Amtsgericht Kempten (Allgäu) HRB 11679\nRegisterbekanntmachung nach dem Umwandlungsgesetz 15.08.2025 (Eintragungsdatum)\n\nS12 GmbH\nGesellschaft mit beschränkter Haftung\nKempten (Allgäu)\n\nDen Gläubigern der an der Verschmelzung beteiligten Rechtsträger ist, wenn sie binnen sechs Monaten nach dem Tag, an dem die Eintragung der Verschmelzung in das Register des Sitzes desjenigen Rechtsträgers, dessen Gläubiger sie sind, nach § 19 Abs. 3 UmwG als bekannt gemacht gilt, ihren Anspruch nach Grund und Höhe in Textform anmelden, Sicherheit zu leisten, soweit sie nicht Befriedigung verlangen können. Dieses Recht steht den Gläubigern jedoch nur zu, wenn sie glaubhaft machen, dass durch die Verschmelzung die Erfüllung ihrer Forderung gefährdet wird."
    },
    {
      "date": "2025-08-16",
      "id": "121469",
      "original_text": "Registerbekanntmachung nach dem Umwandlungsgesetz\nBayern Amtsgericht Kempten (Allgäu) HRB 8880\nNägele PrePress GmbH – Kempten (Allgäu)",
      "type": "Registerbekanntmachung nach dem Umwandlungsgesetz",
      "state": "Bayern",
      "amtsgericht": "Amtsgericht Kempten (Allgäu)",
      "registernummer": "HRB 8880",
      "registerart": "HRB",
      "company_name": "Nägele PrePress GmbH",
      "company_seat": "Kempten (Allgäu)",
      "details": "16.08.2025 (Bekanntmachungsdatum)\n\nBayern Amtsgericht Kempten (Allgäu) HRB 8880\nRegisterbekanntmachung nach dem Umwandlungsgesetz 15.08.2025 (Eintragungsdatum)\n\nNägele PrePress GmbH\nGesellschaft mit beschränkter Haftung\nKempten (Allgäu)\n\nDen Gläubigern der an der Verschmelzung beteiligten Rechtsträger ist, wenn sie binnen sechs Monaten nach dem Tag, an dem die Eintragung der Verschmelzung in das Register des Sitzes desjenigen Rechtsträgers, dessen Gläubiger sie sind, nach § 19 Abs. 3 UmwG als bekannt gemacht gilt, ihren Anspruch nach Grund und Höhe in Textform anmelden, Sicherheit zu leisten, soweit sie nicht Befriedigung verlangen können. Dieses Recht steht den Gläubigern jedoch nur zu, wenn sie glaubhaft machen, dass durch die Verschmelzung die Erfüllung ihrer Forderung gefährdet wird."
    },
    {
      "date": "2025-08-16",
      "id": "121470",
      "original_text": "Löschungsankündigung\nBayern Amtsgericht Coburg HRB 5460\nM & M Verwaltungs GmbH – Seßlach",
      "type": "Löschungsankündigung",
      "state": "Bayern",
      "amtsgericht": "Amtsgericht Coburg",
      "registernummer": "HRB 5460",
      "registerart": "HRB",
      "company_name": "M & M Verwaltungs GmbH",
      "company_seat": "Seßlach",
      "details": "16.08.2025 (Bekanntmachungsdatum)\n\nBayern Amtsgericht Coburg HRB 5460\nLöschungsankündigung 14.08.2025 (Eintragungsdatum)\n\nM & M Verwaltungs GmbH\nGesellschaft mit beschränkter Haftung\nSeßlach\n\nDas Registergericht beabsichtigt, die im Handelsregister eingetragene Gesellschaft wegen Vermögenslosigkeit von Amts wegen nach § 394 FamFG zu löschen. Die Frist zur Erhebung eines Widerspruchs ist auf sechs Wochen festgesetzt."
    },
    {
      "date": "2025-08-16",
      "id": "121471",
      "original_text": "Registerbekanntmachung nach dem Umwandlungsgesetz\nBayern Amtsgericht Kempten (Allgäu) HRB 9582\nNägele PrePress GmbH – Kempten (Allgäu)",
      "type": "Registerbekanntmachung nach dem Umwandlungsgesetz",
      "state": "Bayern",
      "amtsgericht": "Amtsgericht Kempten (Allgäu)",
      "registernummer": "HRB 9582",
      "registerart": "HRB",
      "company_name": "Nägele PrePress GmbH",
      "company_seat": "Kempten (Allgäu)",
      "details": "16.08.2025 (Bekanntmachungsdatum)\n\nBayern Amtsgericht Kempten (Allgäu) HRB 9582\nRegisterbekanntmachung nach dem Umwandlungsgesetz 15.08.2025 (Eintragungsdatum)\n\nNägele PrePress GmbH\nGesellschaft mit beschränkter Haftung\nKempten (Allgäu)\n\nDen Gläubigern der an der Verschmelzung beteiligten Rechtsträger ist, wenn sie binnen sechs Monaten nach dem Tag, an dem die Eintragung der Verschmelzung in das Register des Sitzes desjenigen Rechtsträgers, dessen Gläubiger sie sind, nach § 19 Abs. 3 UmwG als bekannt gemacht gilt, ihren Anspruch nach Grund und Höhe in Textform anmelden, Sicherheit zu leisten, soweit sie nicht Befriedigung verlangen können. Dieses Recht steht den Gläubigern jedoch nur zu, wenn sie glaubhaft machen, dass durch die Verschmelzung die Erfüllung ihrer Forderung gefährdet wird."
    },
    {
      "date": "2025-08-16",
      "id": "121472",
      "original_text": "Registerbekanntmachung nach dem Umwandlungsgesetz\nBayern Amtsgericht Nürnberg HRB 37081\nBavaria Fahrzeugbau Holding GmbH – Wendelstein",
      "type": "Registerbekanntmachung nach dem Umwandlungsgesetz",
      "state": "Bayern",
      "amtsgericht": "Amtsgericht Nürnberg",
      "registernummer": "HRB 37081",
      "registerart": "HRB",
      "company_name": "Bavaria Fahrzeugbau Holding GmbH",
      "company_seat": "Wendelstein",
      "details": "16.08.2025 (Bekanntmachungsdatum)\n\nBayern Amtsgericht Nürnberg HRB 37081\nRegisterbekanntmachung nach dem Umwandlungsgesetz 15.08.2025 (Eintragungsdatum)\n\nBavaria Fahrzeugbau Holding GmbH\nGesellschaft mit beschränkter Haftung\nWendelstein\n\nDen Gläubigern der an der Verschmelzung beteiligten Rechtsträger ist, wenn sie binnen sechs Monaten nach dem Tag, an dem die Eintragung der Verschmelzung in das Register des Sitzes desjenigen Rechtsträgers, dessen Gläubiger sie sind, nach § 19 Abs. 3 UmwG als bekannt gemacht gilt, ihren Anspruch nach Grund und Höhe in Textform anmelden, Sicherheit zu leisten, soweit sie nicht Befriedigung verlangen können. Dieses Recht steht den Gläubigern jedoch nur zu, wenn sie glaubhaft machen, dass durch die Verschmelzung die Erfüllung ihrer Forderung gefährdet wird."
    },
    {
      "date": "2025-08-16",
      "id": "121473",
      "original_text": "Löschungsankündigung\nBaden-Württemberg Amtsgericht Freiburg HRB 732424\nLUMOLAVA UG (haftungsbeschränkt) – Freiburg im Breisgau",
      "type": "Löschungsankündigung",
      "state": "Baden-Württemberg",
      "amtsgericht": "Amtsgericht Freiburg",
      "registernummer": "HRB 732424",
      "registerart": "HRB",
      "company_name": "LUMOLAVA UG (haftungsbeschränkt)",
      "company_seat": "Freiburg im Breisgau",
      "details": "16.08.2025 (Bekanntmachungsdatum)\n\nBaden-Württemberg Amtsgericht Freiburg HRB 732424\nLöschungsankündigung\n\nLUMOLAVA UG (haftungsbeschränkt)\nGesellschaft mit beschränkter Haftung\nFreiburg im Breisgau\n\nAls nicht eingetragen wird bekanntgemacht:\nDas Gericht beabsichtigt, die Gesellschaft wegen Vermögenslosigkeit im Handelsregister von Amts wegen nach § 394 FamFG zu löschen. Die Frist zur Geltendmachung eines Widerspruchs gegen die beabsichtigte Löschung ist auf einen Monat ab Veröffentlichung bestimmt."
    }
  ]
}