{
  "date": "2025-08-09",
  "date_of_scrape": "2025-08-28T18:09:37.578Z",
  "tool_version": "0.2.0",
  "number_of_announcements": 45,
  "announcements": [
    {
      "date": "2025-08-09",
      "id": "120235",
      "original_text": "Registerbekanntmachung nach dem Umwandlungsgesetz\nBayern Amtsgericht Regensburg HRB 15947\nLacuna Finanz AG – Regensburg",
      "type": "Registerbekanntmachung nach dem Umwandlungsgesetz",
      "state": "Bayern",
      "amtsgericht": "Amtsgericht Regensburg",
      "registernummer": "HRB 15947",
      "registerart": "HRB",
      "company_name": "Lacuna Finanz AG",
      "company_seat": "Regensburg",
      "details": "09.08.2025 (Bekanntmachungsdatum)\n\nBayern Amtsgericht Regensburg HRB 15947\nRegisterbekanntmachung nach dem Umwandlungsgesetz 08.08.2025 (Eintragungsdatum)\n\nLacuna Finanz AG\nAktiengesellschaft\nRegensburg\n\nDen Gläubigern des formwechselnden Rechtsträgers ist, wenn sie binnen sechs Monaten nach dem Tag, an dem die Eintragung des Formwechsels nach § 201 UmwG als bekannt gemacht gilt, ihren Anspruch nach Grund und Höhe in Textform anmelden, Sicherheit zu leisten, soweit sie nicht Befriedigung verlangen können. Dieses Recht steht den Gläubigern jedoch nur zu, wenn sie glaubhaft machen, dass durch den Formwechsel die Erfüllung ihrer Forderung gefährdet wird."
    },
    {
      "date": "2025-08-09",
      "id": "120236",
      "original_text": "Registerbekanntmachung nach dem Umwandlungsgesetz\nBayern Amtsgericht Aschaffenburg HRB 5126\nDentallabor Arnaud & Heinbuch GmbH – Goldbach",
      "type": "Registerbekanntmachung nach dem Umwandlungsgesetz",
      "state": "Bayern",
      "amtsgericht": "Amtsgericht Aschaffenburg",
      "registernummer": "HRB 5126",
      "registerart": "HRB",
      "company_name": "Dentallabor Arnaud & Heinbuch GmbH",
      "company_seat": "Goldbach",
      "details": "09.08.2025 (Bekanntmachungsdatum)\n\nBayern Amtsgericht Aschaffenburg HRB 5126\nRegisterbekanntmachung nach dem Umwandlungsgesetz 08.08.2025 (Eintragungsdatum)\n\nDentallabor Arnaud & Heinbuch GmbH\nGesellschaft mit beschränkter Haftung\nGoldbach\n\nDen Gläubigern der an der Verschmelzung beteiligten Rechtsträger ist, wenn sie binnen sechs Monaten nach dem Tag, an dem die Eintragung der Verschmelzung in das Register des Sitzes desjenigen Rechtsträgers, dessen Gläubiger sie sind, nach § 19 Abs. 3 UmwG als bekannt gemacht gilt, ihren Anspruch nach Grund und Höhe in Textform anmelden, Sicherheit zu leisten, soweit sie nicht Befriedigung verlangen können. Dieses Recht steht den Gläubigern jedoch nur zu, wenn sie glaubhaft machen, dass durch die Verschmelzung die Erfüllung ihrer Forderung gefährdet wird."
    },
    {
      "date": "2025-08-09",
      "id": "120237",
      "original_text": "Registerbekanntmachung nach dem Umwandlungsgesetz\nBayern Amtsgericht Fürth HRB 21447\nKoch Immobilien GmbH – Herzogenaurach",
      "type": "Registerbekanntmachung nach dem Umwandlungsgesetz",
      "state": "Bayern",
      "amtsgericht": "Amtsgericht Fürth",
      "registernummer": "HRB 21447",
      "registerart": "HRB",
      "company_name": "Koch Immobilien GmbH",
      "company_seat": "Herzogenaurach",
      "details": "09.08.2025 (Bekanntmachungsdatum)\n\nBayern Amtsgericht Fürth HRB 21447\nRegisterbekanntmachung nach dem Umwandlungsgesetz 08.08.2025 (Eintragungsdatum)\n\nKoch Immobilien GmbH\nGesellschaft mit beschränkter Haftung\nHerzogenaurach\n\nDen Gläubigern der an der Verschmelzung beteiligten Rechtsträger ist, wenn sie binnen sechs Monaten nach dem Tag, an dem die Eintragung der Verschmelzung in das Register des Sitzes desjenigen Rechtsträgers, dessen Gläubiger sie sind, nach § 19 Abs. 3 UmwG als bekannt gemacht gilt, ihren Anspruch nach Grund und Höhe in Textform anmelden, Sicherheit zu leisten, soweit sie nicht Befriedigung verlangen können. Dieses Recht steht den Gläubigern jedoch nur zu, wenn sie glaubhaft machen, dass durch die Verschmelzung die Erfüllung ihrer Forderung gefährdet wird."
    },
    {
      "date": "2025-08-09",
      "id": "120238",
      "original_text": "Registerbekanntmachung nach dem Umwandlungsgesetz\nBayern Amtsgericht München HRB 149921\nTELLIMA Verwaltungsgesellschaft mbH – Pullach",
      "type": "Registerbekanntmachung nach dem Umwandlungsgesetz",
      "state": "Bayern",
      "amtsgericht": "Amtsgericht München",
      "registernummer": "HRB 149921",
      "registerart": "HRB",
      "company_name": "TELLIMA Verwaltungsgesellschaft mbH",
      "company_seat": "Pullach",
      "details": "09.08.2025 (Bekanntmachungsdatum)\n\nBayern Amtsgericht München HRB 149921\nRegisterbekanntmachung nach dem Umwandlungsgesetz 08.08.2025 (Eintragungsdatum)\n\nTELLIMA Verwaltungsgesellschaft mbH\nGesellschaft mit beschränkter Haftung\nPullach\n\nDen Gläubigern der an der Verschmelzung beteiligten Rechtsträger ist, wenn sie binnen sechs Monaten nach dem Tag, an dem die Eintragung der Verschmelzung in das Register des Sitzes desjenigen Rechtsträgers, dessen Gläubiger sie sind, nach § 19 Abs. 3 UmwG als bekannt gemacht gilt, ihren Anspruch nach Grund und Höhe in Textform anmelden, Sicherheit zu leisten, soweit sie nicht Befriedigung verlangen können. Dieses Recht steht den Gläubigern jedoch nur zu, wenn sie glaubhaft machen, dass durch die Verschmelzung die Erfüllung ihrer Forderung gefährdet wird."
    },
    {
      "date": "2025-08-09",
      "id": "120239",
      "original_text": "Registerbekanntmachung nach dem Umwandlungsgesetz\nBayern Amtsgericht München HRB 197153\nWealthCap Stiftungstreuhand GmbH – München",
      "type": "Registerbekanntmachung nach dem Umwandlungsgesetz",
      "state": "Bayern",
      "amtsgericht": "Amtsgericht München",
      "registernummer": "HRB 197153",
      "registerart": "HRB",
      "company_name": "WealthCap Stiftungstreuhand GmbH",
      "company_seat": "München",
      "details": "09.08.2025 (Bekanntmachungsdatum)\n\nBayern Amtsgericht München HRB 197153\nRegisterbekanntmachung nach dem Umwandlungsgesetz 08.08.2025 (Eintragungsdatum)\n\nWealthCap Stiftungstreuhand GmbH\nGesellschaft mit beschränkter Haftung\nMünchen\n\nDen Gläubigern der an der Verschmelzung beteiligten Rechtsträger ist, wenn sie binnen sechs Monaten nach dem Tag, an dem die Eintragung der Verschmelzung in das Register des Sitzes desjenigen Rechtsträgers, dessen Gläubiger sie sind, nach § 19 Abs. 3 UmwG als bekannt gemacht gilt, ihren Anspruch nach Grund und Höhe in Textform anmelden, Sicherheit zu leisten, soweit sie nicht Befriedigung verlangen können. Dieses Recht steht den Gläubigern jedoch nur zu, wenn sie glaubhaft machen, dass durch die Verschmelzung die Erfüllung ihrer Forderung gefährdet wird."
    },
    {
      "date": "2025-08-09",
      "id": "120240",
      "original_text": "Einreichung neuer Dokumente\nBayern Amtsgericht Aschaffenburg HRB 15646\nSAF-HOLLAND SE – Bessenbach",
      "type": "Einreichung neuer Dokumente",
      "state": "Bayern",
      "amtsgericht": "Amtsgericht Aschaffenburg",
      "registernummer": "HRB 15646",
      "registerart": "HRB",
      "company_name": "SAF-HOLLAND SE",
      "company_seat": "Bessenbach",
      "details": "09.08.2025 (Bekanntmachungsdatum)\n\nBayern Amtsgericht Aschaffenburg HRB 15646\nEinreichung neuer Dokumente 08.08.2025 (Eintragungsdatum)\n\nSAF-HOLLAND SE\nEuropäische Aktiengesellschaft (SE)\nBessenbach\n\nDem Amtsgericht Aschaffenburg -Registergericht- ist eine Liste der Mitglieder des Aufsichtsrats eingereicht worden, Art. 9 Abs. 1 Buchst. c (ii) SE-VO i.V.m. § 106 AktG."
    },
    {
      "date": "2025-08-09",
      "id": "120241",
      "original_text": "Einreichung neuer Dokumente\nBayern Amtsgericht München HRB 95802\nAllianz Direct Versicherungs-AG – München",
      "type": "Einreichung neuer Dokumente",
      "state": "Bayern",
      "amtsgericht": "Amtsgericht München",
      "registernummer": "HRB 95802",
      "registerart": "HRB",
      "company_name": "Allianz Direct Versicherungs-AG",
      "company_seat": "München",
      "details": "09.08.2025 (Bekanntmachungsdatum)\n\nBayern Amtsgericht München HRB 95802\nEinreichung neuer Dokumente 08.08.2025 (Eintragungsdatum)\n\nAllianz Direct Versicherungs-AG\nAktiengesellschaft\nMünchen\n\nEs wird darauf hingewiesen, dass ein Verschmelzungsplan betreffend die grenzüberschreitende Verschmelzung der iptiQ EMEA P&C S. A. mit Sitz in Senningerberg, Großherzogtum Luxemburg, eingetragen im luxemburgischen Handels und Gesellschaftsregister (Registre de Commerce et des Societes de Luxembourg) unter der Nummer B228763 als übertragende Gesellschaft auf die Allianz Direct Versicherungs-AG mit Sitz in München, Deutschland, eingetragen im Handelsregister des Amtsgerichts München unter der Registernummer HRB 95802 als übernehmende Gesellschaft, beim Handelsregister eingereicht worden ist.\nDie übertragende Gesellschaft mit der Firma \"iptiQ EMEA P&C S. A.\" ist eine Aktiengesellschaft (societe anonyme) nach dem Recht des Großherzogtums Luxemburg mit Sitz in Senningerberg und eingetragener Geschäftsanschrift 6D, Route de Treves, Senningerberg L-2633, Großherzogtum Luxemburg.\nDie übernehmende Gesellschaft mit der Firma \"Allianz Direct Versicherungs-AG\" ist eine Aktiengesellschaft nach dem Recht der Bundesrepublik Deutschland mit Sitz in München und eingetragener Geschäftsanschrift Königinstr. 28, 80802 München, Bundesrepublik Deutschland.\nDie Allianz Direct Versicherungs-AG ist im Handelsregister des Amtsgerichts München unter der Registernummer HRB 95802 eingetragen. Die iptiQ EMEA P&C S. A. ist im Handels- und Gesellschaftsregister von Luxemburg (registre de commerce et des societes) unter der Nummer B228763 eingetragen.\nDie Hauptversammlung der Allianz Direct Versicherungs-AG, in der über die Zustimmung zum gemeinsamen Verschmelzungsplan beschlossen werden soll, soll am 26. September 2025 stattfinden.\nDer Gesellschafter und die Gläubiger der Allianz Direct Versicherungs-AG und der iptiQ EMEA P&C S. A., die zuständigen Betriebsräte der Allianz DirectVersicherungs-AG, d. h., Gesamtbetriebsrat, Konzernbetriebsrat der Allianz-Gruppe, SE-Betriebsrat der Allianz SE, Betriebsrat in München, Betriebsrat in Halle, Betriebsrat in der französischen Zweigniederlassung, Betriebsrat in der niederländischen Zweigniederlassung, Betriebsrat in der spanischen Zweigniederlassung, die Arbeitnehmer der italienischen Zweigniederlassung der Allianz Direct Versicherungs-AG sowie - da die iptiQ EMEA P&C S. A. keinen Betriebsrat hat - die Arbeitnehmer der iptiQ EMEA P&C S. A. können der Allianz Direct Versicherungs-AG spätestens fünf Arbeitstage vor dem Tag der vorgenannten Hauptversammlung Bemerkungen zum gemeinsamen Verschmelzungsplan unter der folgenden Anschrift übermitteln: Allianz Direct Versicherungs-AG, Vorstand, Königinstr. 28, 80802 München, Bundesrepublik Deutschland."
    },
    {
      "date": "2025-08-09",
      "id": "120242",
      "original_text": "Löschungsankündigung\nBayern Amtsgericht München HRB 246577\nHGS GmbH – München",
      "type": "Löschungsankündigung",
      "state": "Bayern",
      "amtsgericht": "Amtsgericht München",
      "registernummer": "HRB 246577",
      "registerart": "HRB",
      "company_name": "HGS GmbH",
      "company_seat": "München",
      "details": "09.08.2025 (Bekanntmachungsdatum)\n\nBayern Amtsgericht München HRB 246577\nLöschungsankündigung\n\nHGS GmbH\nGesellschaft mit beschränkter Haftung\nMünchen\n\nDas Registergericht beabsichtigt, den im Handelsregister eingetragenen Geschäftsführer Sinisa Popadic, geb. 15.5.1963 wegen fehlender Eignung nach § 395 FamFG zu löschen. Die Frist zur Erhebung eines Widerspruchs ist auf drei Monate festgesetzt."
    },
    {
      "date": "2025-08-09",
      "id": "120243",
      "original_text": "Sonstige Registerbekanntmachung\nBayern Amtsgericht Bayreuth HRB 1394\nZeitform-Design GmbH – Mainleus",
      "type": "Sonstige Registerbekanntmachung",
      "state": "Bayern",
      "amtsgericht": "Amtsgericht Bayreuth",
      "registernummer": "HRB 1394",
      "registerart": "HRB",
      "company_name": "Zeitform-Design GmbH",
      "company_seat": "Mainleus",
      "details": "09.08.2025 (Bekanntmachungsdatum)\n\nBayern Amtsgericht Bayreuth HRB 1394\nSonstige Registerbekanntmachung 08.08.2025 (Eintragungsdatum)\n\nZeitform-Design GmbH\nGesellschaft mit beschränkter Haftung\nMainleus\n\nDen Gläubigern der an der Verschmelzung beteiligten Rechtsträger ist, wenn sie binnen sechs Monaten nach dem Tag, an dem die Eintragung der Verschmelzung in das Register des Sitzes desjenigen Rechtsträgers, dessen Gläubiger sie sind, nach § 19 Abs. 3 UmwG als bekannt gemacht gilt, ihren Anspruch nach Grund und Höhe in Textform anmelden, Sicherheit zu leisten, soweit sie nicht Befriedigung verlangen können. Dieses Recht steht den Gläubigern jedoch nur zu, wenn sie glaubhaft machen, dass durch die Verschmelzung die Erfüllung ihrer Forderung gefährdet wird."
    },
    {
      "date": "2025-08-09",
      "id": "120244",
      "original_text": "Registerbekanntmachung nach dem Umwandlungsgesetz\nBayern Amtsgericht Kempten (Allgäu) HRB 17233\nJakob Beteiligungs GmbH – Lengenwang",
      "type": "Registerbekanntmachung nach dem Umwandlungsgesetz",
      "state": "Bayern",
      "amtsgericht": "Amtsgericht Kempten (Allgäu)",
      "registernummer": "HRB 17233",
      "registerart": "HRB",
      "company_name": "Jakob Beteiligungs GmbH",
      "company_seat": "Lengenwang",
      "details": "09.08.2025 (Bekanntmachungsdatum)\n\nBayern Amtsgericht Kempten (Allgäu) HRB 17233\nRegisterbekanntmachung nach dem Umwandlungsgesetz 08.08.2025 (Eintragungsdatum)\n\nJakob Beteiligungs GmbH\nGesellschaft mit beschränkter Haftung\nLengenwang\n\nDen Gläubigern der an der Spaltung beteiligten Rechtsträger ist, wenn sie binnen sechs Monaten nach dem Tag, an dem die Eintragung der Spaltung in das Register des Sitzes desjenigen Rechtsträgers, dessen Gläubiger sie sind, nach §§ 125, 19 Abs. 3 UmwG als bekannt gemacht gilt, ihren Anspruch nach Grund und Höhe in Textform anmelden, Sicherheit zu leisten, soweit sie nicht Befriedigung verlangen können. Dieses Recht steht den Gläubigern jedoch nur zu, wenn sie glaubhaft machen, dass durch die Spaltung die Erfüllung ihrer Forderung gefährdet wird."
    },
    {
      "date": "2025-08-09",
      "id": "120245",
      "original_text": "Registerbekanntmachung nach dem Umwandlungsgesetz\nBayern Amtsgericht Würzburg HRB 13480\nDisedia UG (haftungsbeschränkt) – Kürnach",
      "type": "Registerbekanntmachung nach dem Umwandlungsgesetz",
      "state": "Bayern",
      "amtsgericht": "Amtsgericht Würzburg",
      "registernummer": "HRB 13480",
      "registerart": "HRB",
      "company_name": "Disedia UG (haftungsbeschränkt)",
      "company_seat": "Kürnach",
      "details": "09.08.2025 (Bekanntmachungsdatum)\n\nBayern Amtsgericht Würzburg HRB 13480\nRegisterbekanntmachung nach dem Umwandlungsgesetz 08.08.2025 (Eintragungsdatum)\n\nDisedia UG (haftungsbeschränkt)\nGesellschaft mit beschränkter Haftung\nKürnach\n\nDen Gläubigern der an der Verschmelzung beteiligten Rechtsträger ist, wenn sie binnen sechs Monaten nach dem Tag, an dem die Eintragung der Verschmelzung in das Register des Sitzes desjenigen Rechtsträgers, dessen Gläubiger sie sind, nach § 19 Abs. 3 UmwG als bekannt gemacht gilt, ihren Anspruch nach Grund und Höhe in Textform anmelden, Sicherheit zu leisten, soweit sie nicht Befriedigung verlangen können. Dieses Recht steht den Gläubigern jedoch nur zu, wenn sie glaubhaft machen, dass durch die Verschmelzung die Erfüllung ihrer Forderung gefährdet wird."
    },
    {
      "date": "2025-08-09",
      "id": "120246",
      "original_text": "Registerbekanntmachung nach dem Umwandlungsgesetz\nBayern Amtsgericht München HRB 121657\nTROIKA Verwaltungsgesellschaft mbH – Pullach",
      "type": "Registerbekanntmachung nach dem Umwandlungsgesetz",
      "state": "Bayern",
      "amtsgericht": "Amtsgericht München",
      "registernummer": "HRB 121657",
      "registerart": "HRB",
      "company_name": "TROIKA Verwaltungsgesellschaft mbH",
      "company_seat": "Pullach",
      "details": "09.08.2025 (Bekanntmachungsdatum)\n\nBayern Amtsgericht München HRB 121657\nRegisterbekanntmachung nach dem Umwandlungsgesetz 08.08.2025 (Eintragungsdatum)\n\nTROIKA Verwaltungsgesellschaft mbH\nGesellschaft mit beschränkter Haftung\nPullach\n\nDen Gläubigern der an der Verschmelzung beteiligten Rechtsträger ist, wenn sie binnen sechs Monaten nach dem Tag, an dem die Eintragung der Verschmelzung in das Register des Sitzes desjenigen Rechtsträgers, dessen Gläubiger sie sind, nach § 19 Abs. 3 UmwG als bekannt gemacht gilt, ihren Anspruch nach Grund und Höhe in Textform anmelden, Sicherheit zu leisten, soweit sie nicht Befriedigung verlangen können. Dieses Recht steht den Gläubigern jedoch nur zu, wenn sie glaubhaft machen, dass durch die Verschmelzung die Erfüllung ihrer Forderung gefährdet wird."
    },
    {
      "date": "2025-08-09",
      "id": "120247",
      "original_text": "Löschungsankündigung\nBayern Amtsgericht Bayreuth HRB 5554\nMR Bioenergie Bayreuth Verwaltungs UG (haftungsbeschränkt) – Bayreuth",
      "type": "Löschungsankündigung",
      "state": "Bayern",
      "amtsgericht": "Amtsgericht Bayreuth",
      "registernummer": "HRB 5554",
      "registerart": "HRB",
      "company_name": "MR Bioenergie Bayreuth Verwaltungs UG (haftungsbeschränkt)",
      "company_seat": "Bayreuth",
      "details": "09.08.2025 (Bekanntmachungsdatum)\n\nBayern Amtsgericht Bayreuth HRB 5554\nLöschungsankündigung\n\nMR Bioenergie Bayreuth Verwaltungs UG (haftungsbeschränkt)\nGesellschaft mit beschränkter Haftung\nBayreuth\n\nDas Registergericht beabsichtigt, die im Handelsregister eingetragene Gesellschaft wegen Vermögenslosigkeit von Amts wegen nach § 394 FamFG zu löschen. Die Frist zur Erhebung eines Widerspruchs ist auf einen Monat festgesetzt."
    },
    {
      "date": "2025-08-09",
      "id": "120248",
      "original_text": "Registerbekanntmachung nach dem Umwandlungsgesetz\nBayern Amtsgericht München HRB 289472\nUniCredit Bank GmbH – München",
      "type": "Registerbekanntmachung nach dem Umwandlungsgesetz",
      "state": "Bayern",
      "amtsgericht": "Amtsgericht München",
      "registernummer": "HRB 289472",
      "registerart": "HRB",
      "company_name": "UniCredit Bank GmbH",
      "company_seat": "München",
      "details": "09.08.2025 (Bekanntmachungsdatum)\n\nBayern Amtsgericht München HRB 289472\nRegisterbekanntmachung nach dem Umwandlungsgesetz 08.08.2025 (Eintragungsdatum)\n\nUniCredit Bank GmbH\nGesellschaft mit beschränkter Haftung\nMünchen\n\nDen Gläubigern der an der Verschmelzung beteiligten Rechtsträger ist, wenn sie binnen sechs Monaten nach dem Tag, an dem die Eintragung der Verschmelzung in das Register des Sitzes desjenigen Rechtsträgers, dessen Gläubiger sie sind, nach § 19 Abs. 3 UmwG als bekannt gemacht gilt, ihren Anspruch nach Grund und Höhe in Textform anmelden, Sicherheit zu leisten, soweit sie nicht Befriedigung verlangen können. Dieses Recht steht den Gläubigern jedoch nur zu, wenn sie glaubhaft machen, dass durch die Verschmelzung die Erfüllung ihrer Forderung gefährdet wird."
    },
    {
      "date": "2025-08-09",
      "id": "120249",
      "original_text": "Registerbekanntmachung nach dem Umwandlungsgesetz\nBayern Amtsgericht Bayreuth HRA 4921\nZEITFORM-DESIGN e.K., Inhaber Günter Weber – Mainleus",
      "type": "Registerbekanntmachung nach dem Umwandlungsgesetz",
      "state": "Bayern",
      "amtsgericht": "Amtsgericht Bayreuth",
      "registernummer": "HRA 4921",
      "registerart": "HRA",
      "company_name": "ZEITFORM-DESIGN e.K., Inhaber Günter Weber",
      "company_seat": "Mainleus",
      "details": "09.08.2025 (Bekanntmachungsdatum)\n\nBayern Amtsgericht Bayreuth HRA 4921\nRegisterbekanntmachung nach dem Umwandlungsgesetz 08.08.2025 (Eintragungsdatum)\n\nZEITFORM-DESIGN e.K., Inhaber Günter Weber\nEinzelkaufmann / Einzelkauffrau\nMainleus\n\nDen Gläubigern der an der Verschmelzung beteiligten Rechtsträger ist, wenn sie binnen sechs Monaten nach dem Tag, an dem die Eintragung der Verschmelzung in das Register des Sitzes desjenigen Rechtsträgers, dessen Gläubiger sie sind, nach § 19 Abs. 3 UmwG als bekannt gemacht gilt, ihren Anspruch nach Grund und Höhe in Textform anmelden, Sicherheit zu leisten, soweit sie nicht Befriedigung verlangen können. Dieses Recht steht den Gläubigern jedoch nur zu, wenn sie glaubhaft machen, dass durch die Verschmelzung die Erfüllung ihrer Forderung gefährdet wird."
    },
    {
      "date": "2025-08-09",
      "id": "120250",
      "original_text": "Registerbekanntmachung nach dem Umwandlungsgesetz\nBayern Amtsgericht Bayreuth HRA 4931\nOliver Ott PV e.K. – Kulmbach",
      "type": "Registerbekanntmachung nach dem Umwandlungsgesetz",
      "state": "Bayern",
      "amtsgericht": "Amtsgericht Bayreuth",
      "registernummer": "HRA 4931",
      "registerart": "HRA",
      "company_name": "Oliver Ott PV e.K.",
      "company_seat": "Kulmbach",
      "details": "09.08.2025 (Bekanntmachungsdatum)\n\nBayern Amtsgericht Bayreuth HRA 4931\nRegisterbekanntmachung nach dem Umwandlungsgesetz 08.08.2025 (Eintragungsdatum)\n\nOliver Ott PV e.K.\nEinzelkaufmann / Einzelkauffrau\nKulmbach\n\nDen Gläubigern der an der Ausgliederung beteiligten Rechtsträger ist, wenn sie binnen sechs Monaten nach dem Tag, an dem die Eintragung der Ausgliederung in das Register des Sitzes desjenigen Rechtsträgers, dessen Gläubiger sie sind, nach §§ 125, 19 Abs. 3 UmwG als bekannt gemacht gilt, ihren Anspruch nach Grund und Höhe in Textform anmelden, Sicherheit zu leisten, soweit sie nicht Befriedigung verlangen können. Dieses Recht steht den Gläubigern jedoch nur zu, wenn sie glaubhaft machen, dass durch die Ausgliederung die Erfüllung ihrer Forderung gefährdet wird."
    },
    {
      "date": "2025-08-09",
      "id": "120251",
      "original_text": "Registerbekanntmachung nach dem Umwandlungsgesetz\nBayern Amtsgericht Regensburg HRB 14800\nKRo Immobilien GmbH – Regensburg",
      "type": "Registerbekanntmachung nach dem Umwandlungsgesetz",
      "state": "Bayern",
      "amtsgericht": "Amtsgericht Regensburg",
      "registernummer": "HRB 14800",
      "registerart": "HRB",
      "company_name": "KRo Immobilien GmbH",
      "company_seat": "Regensburg",
      "details": "09.08.2025 (Bekanntmachungsdatum)\n\nBayern Amtsgericht Regensburg HRB 14800\nRegisterbekanntmachung nach dem Umwandlungsgesetz 08.08.2025 (Eintragungsdatum)\n\nKRo Immobilien GmbH\nGesellschaft mit beschränkter Haftung\nRegensburg\n\nDen Gläubigern der an der Verschmelzung beteiligten Rechtsträger ist, wenn sie binnen sechs Monaten nach dem Tag, an dem die Eintragung der Verschmelzung in das Register des Sitzes desjenigen Rechtsträgers, dessen Gläubiger sie sind, nach § 19 Abs. 3 UmwG als bekannt gemacht gilt, ihren Anspruch nach Grund und Höhe in Textform anmelden, Sicherheit zu leisten, soweit sie nicht Befriedigung verlangen können. Dieses Recht steht den Gläubigern jedoch nur zu, wenn sie glaubhaft machen, dass durch die Verschmelzung die Erfüllung ihrer Forderung gefährdet wird."
    },
    {
      "date": "2025-08-09",
      "id": "120252",
      "original_text": "Registerbekanntmachung nach dem Umwandlungsgesetz\nBayern Amtsgericht Regensburg HRB 15366\nBraWo GmbH – Regensburg",
      "type": "Registerbekanntmachung nach dem Umwandlungsgesetz",
      "state": "Bayern",
      "amtsgericht": "Amtsgericht Regensburg",
      "registernummer": "HRB 15366",
      "registerart": "HRB",
      "company_name": "BraWo GmbH",
      "company_seat": "Regensburg",
      "details": "09.08.2025 (Bekanntmachungsdatum)\n\nBayern Amtsgericht Regensburg HRB 15366\nRegisterbekanntmachung nach dem Umwandlungsgesetz 08.08.2025 (Eintragungsdatum)\n\nBraWo GmbH\nGesellschaft mit beschränkter Haftung\nRegensburg\n\nDen Gläubigern der an der Verschmelzung beteiligten Rechtsträger ist, wenn sie binnen sechs Monaten nach dem Tag, an dem die Eintragung der Verschmelzung in das Register des Sitzes desjenigen Rechtsträgers, dessen Gläubiger sie sind, nach § 19 Abs. 3 UmwG als bekannt gemacht gilt, ihren Anspruch nach Grund und Höhe in Textform anmelden, Sicherheit zu leisten, soweit sie nicht Befriedigung verlangen können. Dieses Recht steht den Gläubigern jedoch nur zu, wenn sie glaubhaft machen, dass durch die Verschmelzung die Erfüllung ihrer Forderung gefährdet wird."
    },
    {
      "date": "2025-08-09",
      "id": "120253",
      "original_text": "Registerbekanntmachung nach dem Umwandlungsgesetz\nBayern Amtsgericht Aschaffenburg HRA 6740\nJean-Yves Arnaud e.K. – Goldbach",
      "type": "Registerbekanntmachung nach dem Umwandlungsgesetz",
      "state": "Bayern",
      "amtsgericht": "Amtsgericht Aschaffenburg",
      "registernummer": "HRA 6740",
      "registerart": "HRA",
      "company_name": "Jean-Yves Arnaud e.K.",
      "company_seat": "Goldbach",
      "details": "09.08.2025 (Bekanntmachungsdatum)\n\nBayern Amtsgericht Aschaffenburg HRA 6740\nRegisterbekanntmachung nach dem Umwandlungsgesetz 08.08.2025 (Eintragungsdatum)\n\nJean-Yves Arnaud e.K.\nEinzelkaufmann / Einzelkauffrau\nGoldbach\n\nDen Gläubigern der an der Verschmelzung beteiligten Rechtsträger ist, wenn sie binnen sechs Monaten nach dem Tag, an dem die Eintragung der Verschmelzung in das Register des Sitzes desjenigen Rechtsträgers, dessen Gläubiger sie sind, nach § 19 Abs. 3 UmwG als bekannt gemacht gilt, ihren Anspruch nach Grund und Höhe in Textform anmelden, Sicherheit zu leisten, soweit sie nicht Befriedigung verlangen können. Dieses Recht steht den Gläubigern jedoch nur zu, wenn sie glaubhaft machen, dass durch die Verschmelzung die Erfüllung ihrer Forderung gefährdet wird."
    },
    {
      "date": "2025-08-09",
      "id": "120254",
      "original_text": "Registerbekanntmachung nach dem Umwandlungsgesetz\nBayern Amtsgericht Würzburg HRA 9002\nDisedia e.K. – Kürnach",
      "type": "Registerbekanntmachung nach dem Umwandlungsgesetz",
      "state": "Bayern",
      "amtsgericht": "Amtsgericht Würzburg",
      "registernummer": "HRA 9002",
      "registerart": "HRA",
      "company_name": "Disedia e.K.",
      "company_seat": "Kürnach",
      "details": "09.08.2025 (Bekanntmachungsdatum)\n\nBayern Amtsgericht Würzburg HRA 9002\nRegisterbekanntmachung nach dem Umwandlungsgesetz 08.08.2025 (Eintragungsdatum)\n\nDisedia e.K.\nEinzelkaufmann / Einzelkauffrau\nKürnach\n\nDen Gläubigern der an der Verschmelzung beteiligten Rechtsträger ist, wenn sie binnen sechs Monaten nach dem Tag, an dem die Eintragung der Verschmelzung in das Register des Sitzes desjenigen Rechtsträgers, dessen Gläubiger sie sind, nach § 19 Abs. 3 UmwG als bekannt gemacht gilt, ihren Anspruch nach Grund und Höhe in Textform anmelden, Sicherheit zu leisten, soweit sie nicht Befriedigung verlangen können. Dieses Recht steht den Gläubigern jedoch nur zu, wenn sie glaubhaft machen, dass durch die Verschmelzung die Erfüllung ihrer Forderung gefährdet wird."
    },
    {
      "date": "2025-08-09",
      "id": "120255",
      "original_text": "Einreichung neuer Dokumente\nBayern Amtsgericht München HRB 267003\nDRM Datenraum Mobilität GmbH – München",
      "type": "Einreichung neuer Dokumente",
      "state": "Bayern",
      "amtsgericht": "Amtsgericht München",
      "registernummer": "HRB 267003",
      "registerart": "HRB",
      "company_name": "DRM Datenraum Mobilität GmbH",
      "company_seat": "München",
      "details": "09.08.2025 (Bekanntmachungsdatum)\n\nBayern Amtsgericht München HRB 267003\nEinreichung neuer Dokumente 05.08.2025 (Eintragungsdatum)\n\nDRM Datenraum Mobilität GmbH\nGesellschaft mit beschränkter Haftung\nMünchen\n\nDem Amtsgericht München -Registergericht- ist eine Liste der Mitglieder des Aufsichtsrats eingereicht worden, § 52 Abs. 3 S. 2 GmbHG."
    },
    {
      "date": "2025-08-09",
      "id": "120256",
      "original_text": "Registerbekanntmachung nach dem Umwandlungsgesetz\nBayern Amtsgericht München HRB 118550\nFARUS Verwaltungsgesellschaft mbH – Pullach",
      "type": "Registerbekanntmachung nach dem Umwandlungsgesetz",
      "state": "Bayern",
      "amtsgericht": "Amtsgericht München",
      "registernummer": "HRB 118550",
      "registerart": "HRB",
      "company_name": "FARUS Verwaltungsgesellschaft mbH",
      "company_seat": "Pullach",
      "details": "09.08.2025 (Bekanntmachungsdatum)\n\nBayern Amtsgericht München HRB 118550\nRegisterbekanntmachung nach dem Umwandlungsgesetz 08.08.2025 (Eintragungsdatum)\n\nFARUS Verwaltungsgesellschaft mbH\nGesellschaft mit beschränkter Haftung\nPullach\n\nDen Gläubigern der an der Verschmelzung beteiligten Rechtsträger ist, wenn sie binnen sechs Monaten nach dem Tag, an dem die Eintragung der Verschmelzung in das Register des Sitzes desjenigen Rechtsträgers, dessen Gläubiger sie sind, nach § 19 Abs. 3 UmwG als bekannt gemacht gilt, ihren Anspruch nach Grund und Höhe in Textform anmelden, Sicherheit zu leisten, soweit sie nicht Befriedigung verlangen können. Dieses Recht steht den Gläubigern jedoch nur zu, wenn sie glaubhaft machen, dass durch die Verschmelzung die Erfüllung ihrer Forderung gefährdet wird."
    },
    {
      "date": "2025-08-09",
      "id": "120257",
      "original_text": "Einreichung neuer Dokumente\nBayern Amtsgericht Kempten (Allgäu) HRB 12323\nElektrizitätsnetze Allgäu GmbH – Lindenberg i. Allgäu",
      "type": "Einreichung neuer Dokumente",
      "state": "Bayern",
      "amtsgericht": "Amtsgericht Kempten (Allgäu)",
      "registernummer": "HRB 12323",
      "registerart": "HRB",
      "company_name": "Elektrizitätsnetze Allgäu GmbH",
      "company_seat": "Lindenberg i. Allgäu",
      "details": "09.08.2025 (Bekanntmachungsdatum)\n\nBayern Amtsgericht Kempten (Allgäu) HRB 12323\nEinreichung neuer Dokumente 08.08.2025 (Eintragungsdatum)\n\nElektrizitätsnetze Allgäu GmbH\nGesellschaft mit beschränkter Haftung\nLindenberg i. Allgäu\n\nDem Amtsgericht Kempten (Allgäu) -Registergericht- ist eine Liste der Mitglieder des Aufsichtsrats eingereicht worden, § 52 Abs. 3 S. 2 GmbHG."
    },
    {
      "date": "2025-08-09",
      "id": "120258",
      "original_text": "Registerbekanntmachung nach dem Umwandlungsgesetz\nBayern Amtsgericht München HRB 209366\nCELLS Property Investors GmbH – München",
      "type": "Registerbekanntmachung nach dem Umwandlungsgesetz",
      "state": "Bayern",
      "amtsgericht": "Amtsgericht München",
      "registernummer": "HRB 209366",
      "registerart": "HRB",
      "company_name": "CELLS Property Investors GmbH",
      "company_seat": "München",
      "details": "09.08.2025 (Bekanntmachungsdatum)\n\nBayern Amtsgericht München HRB 209366\nRegisterbekanntmachung nach dem Umwandlungsgesetz 08.08.2025 (Eintragungsdatum)\n\nCELLS Property Investors GmbH\nGesellschaft mit beschränkter Haftung\nMünchen\n\nDen Gläubigern der an der Verschmelzung beteiligten Rechtsträger ist, wenn sie binnen sechs Monaten nach dem Tag, an dem die Eintragung der Verschmelzung in das Register des Sitzes desjenigen Rechtsträgers, dessen Gläubiger sie sind, nach § 19 Abs. 3 UmwG als bekannt gemacht gilt, ihren Anspruch nach Grund und Höhe in Textform anmelden, Sicherheit zu leisten, soweit sie nicht Befriedigung verlangen können. Dieses Recht steht den Gläubigern jedoch nur zu, wenn sie glaubhaft machen, dass durch die Verschmelzung die Erfüllung ihrer Forderung gefährdet wird."
    },
    {
      "date": "2025-08-09",
      "id": "120259",
      "original_text": "Sonstige Registerbekanntmachung\nBayern Amtsgericht Bayreuth HRB 8230\nAMO Holding GmbH – Kulmbach",
      "type": "Sonstige Registerbekanntmachung",
      "state": "Bayern",
      "amtsgericht": "Amtsgericht Bayreuth",
      "registernummer": "HRB 8230",
      "registerart": "HRB",
      "company_name": "AMO Holding GmbH",
      "company_seat": "Kulmbach",
      "details": "09.08.2025 (Bekanntmachungsdatum)\n\nBayern Amtsgericht Bayreuth HRB 8230\nSonstige Registerbekanntmachung 08.08.2025 (Eintragungsdatum)\n\nAMO Holding GmbH\nGesellschaft mit beschränkter Haftung\nKulmbach\n\nDen Gläubigern der an der Ausgliederung beteiligten Rechtsträger ist, wenn sie binnen sechs Monaten nach dem Tag, an dem die Eintragung der Ausgliederung in das Register des Sitzes desjenigen Rechtsträgers, dessen Gläubiger sie sind, nach §§ 125, 19 Abs. 3 UmwG als bekannt gemacht gilt, ihren Anspruch nach Grund und Höhe in Textform anmelden, Sicherheit zu leisten, soweit sie nicht Befriedigung verlangen können. Dieses Recht steht den Gläubigern jedoch nur zu, wenn sie glaubhaft machen, dass durch die Ausgliederung die Erfüllung ihrer Forderung gefährdet wird."
    },
    {
      "date": "2025-08-09",
      "id": "120260",
      "original_text": "Löschungsankündigung\nBayern Amtsgericht München HRB 232474\nST Transport & Logistik GmbH – Freising",
      "type": "Löschungsankündigung",
      "state": "Bayern",
      "amtsgericht": "Amtsgericht München",
      "registernummer": "HRB 232474",
      "registerart": "HRB",
      "company_name": "ST Transport & Logistik GmbH",
      "company_seat": "Freising",
      "details": "09.08.2025 (Bekanntmachungsdatum)\n\nBayern Amtsgericht München HRB 232474\nLöschungsankündigung\n\nST Transport & Logistik GmbH\nGesellschaft mit beschränkter Haftung\nFreising\n\nDas Registergericht beabsichtigt, die im Handelsregister eingetragene Gesellschaft wegen Vermögenslosigkeit von Amts wegen nach § 394 FamFG zu löschen. Die Frist zur Erhebung eines Widerspruchs ist auf drei Monate festgesetzt."
    },
    {
      "date": "2025-08-09",
      "id": "120261",
      "original_text": "Registerbekanntmachung nach dem Umwandlungsgesetz\nBayern Amtsgericht München HRB 138302\nAigner Media GmbH – München",
      "type": "Registerbekanntmachung nach dem Umwandlungsgesetz",
      "state": "Bayern",
      "amtsgericht": "Amtsgericht München",
      "registernummer": "HRB 138302",
      "registerart": "HRB",
      "company_name": "Aigner Media GmbH",
      "company_seat": "München",
      "details": "09.08.2025 (Bekanntmachungsdatum)\n\nBayern Amtsgericht München HRB 138302\nRegisterbekanntmachung nach dem Umwandlungsgesetz 08.08.2025 (Eintragungsdatum)\n\nAigner Media GmbH\nGesellschaft mit beschränkter Haftung\nMünchen\n\nDen Gläubigern der an der Verschmelzung beteiligten Rechtsträger ist, wenn sie binnen sechs Monaten nach dem Tag, an dem die Eintragung der Verschmelzung in das Register des Sitzes desjenigen Rechtsträgers, dessen Gläubiger sie sind, nach § 19 Abs. 3 UmwG als bekannt gemacht gilt, ihren Anspruch nach Grund und Höhe in Textform anmelden, Sicherheit zu leisten, soweit sie nicht Befriedigung verlangen können. Dieses Recht steht den Gläubigern jedoch nur zu, wenn sie glaubhaft machen, dass durch die Verschmelzung die Erfüllung ihrer Forderung gefährdet wird."
    },
    {
      "date": "2025-08-09",
      "id": "120262",
      "original_text": "Registerbekanntmachung nach dem Umwandlungsgesetz\nBayern Amtsgericht München HRB 121652\nTRAVERSE Verwaltungsgesellschaft mbH – Pullach",
      "type": "Registerbekanntmachung nach dem Umwandlungsgesetz",
      "state": "Bayern",
      "amtsgericht": "Amtsgericht München",
      "registernummer": "HRB 121652",
      "registerart": "HRB",
      "company_name": "TRAVERSE Verwaltungsgesellschaft mbH",
      "company_seat": "Pullach",
      "details": "09.08.2025 (Bekanntmachungsdatum)\n\nBayern Amtsgericht München HRB 121652\nRegisterbekanntmachung nach dem Umwandlungsgesetz 08.08.2025 (Eintragungsdatum)\n\nTRAVERSE Verwaltungsgesellschaft mbH\nGesellschaft mit beschränkter Haftung\nPullach\n\nDen Gläubigern der an der Verschmelzung beteiligten Rechtsträger ist, wenn sie binnen sechs Monaten nach dem Tag, an dem die Eintragung der Verschmelzung in das Register des Sitzes desjenigen Rechtsträgers, dessen Gläubiger sie sind, nach § 19 Abs. 3 UmwG als bekannt gemacht gilt, ihren Anspruch nach Grund und Höhe in Textform anmelden, Sicherheit zu leisten, soweit sie nicht Befriedigung verlangen können. Dieses Recht steht den Gläubigern jedoch nur zu, wenn sie glaubhaft machen, dass durch die Verschmelzung die Erfüllung ihrer Forderung gefährdet wird."
    },
    {
      "date": "2025-08-09",
      "id": "120263",
      "original_text": "Registerbekanntmachung nach dem Umwandlungsgesetz\nBayern Amtsgericht München HRB 277087\nKarl Storz Venture One Germany GmbH – Garching b.München",
      "type": "Registerbekanntmachung nach dem Umwandlungsgesetz",
      "state": "Bayern",
      "amtsgericht": "Amtsgericht München",
      "registernummer": "HRB 277087",
      "registerart": "HRB",
      "company_name": "Karl Storz Venture One Germany GmbH",
      "company_seat": "Garching b.München",
      "details": "09.08.2025 (Bekanntmachungsdatum)\n\nBayern Amtsgericht München HRB 277087\nRegisterbekanntmachung nach dem Umwandlungsgesetz 08.08.2025 (Eintragungsdatum)\n\nKarl Storz Venture One Germany GmbH\nGesellschaft mit beschränkter Haftung\nGarching b.München\n\nDen Gläubigern der an der Verschmelzung beteiligten Rechtsträger ist, wenn sie binnen sechs Monaten nach dem Tag, an dem die Eintragung der Verschmelzung in das Register des Sitzes desjenigen Rechtsträgers, dessen Gläubiger sie sind, nach § 19 Abs. 3 UmwG als bekannt gemacht gilt, ihren Anspruch nach Grund und Höhe in Textform anmelden, Sicherheit zu leisten, soweit sie nicht Befriedigung verlangen können. Dieses Recht steht den Gläubigern jedoch nur zu, wenn sie glaubhaft machen, dass durch die Verschmelzung die Erfüllung ihrer Forderung gefährdet wird."
    },
    {
      "date": "2025-08-09",
      "id": "120264",
      "original_text": "Registerbekanntmachung nach dem Umwandlungsgesetz\nBayern Amtsgericht München HRB 266212\nElement Boulders München GmbH – München",
      "type": "Registerbekanntmachung nach dem Umwandlungsgesetz",
      "state": "Bayern",
      "amtsgericht": "Amtsgericht München",
      "registernummer": "HRB 266212",
      "registerart": "HRB",
      "company_name": "Element Boulders München GmbH",
      "company_seat": "München",
      "details": "09.08.2025 (Bekanntmachungsdatum)\n\nBayern Amtsgericht München HRB 266212\nRegisterbekanntmachung nach dem Umwandlungsgesetz 08.08.2025 (Eintragungsdatum)\n\nElement Boulders München GmbH\nGesellschaft mit beschränkter Haftung\nMünchen\n\nDen Gläubigern der an der Verschmelzung beteiligten Rechtsträger ist, wenn sie binnen sechs Monaten nach dem Tag, an dem die Eintragung der Verschmelzung in das Register des Sitzes desjenigen Rechtsträgers, dessen Gläubiger sie sind, nach § 19 Abs. 3 UmwG als bekannt gemacht gilt, ihren Anspruch nach Grund und Höhe in Textform anmelden, Sicherheit zu leisten, soweit sie nicht Befriedigung verlangen können. Dieses Recht steht den Gläubigern jedoch nur zu, wenn sie glaubhaft machen, dass durch die Verschmelzung die Erfüllung ihrer Forderung gefährdet wird."
    },
    {
      "date": "2025-08-09",
      "id": "120265",
      "original_text": "Registerbekanntmachung nach dem Umwandlungsgesetz\nBayern Amtsgericht Fürth HRB 20837\nKoch Holding GmbH – Herzogenaurach",
      "type": "Registerbekanntmachung nach dem Umwandlungsgesetz",
      "state": "Bayern",
      "amtsgericht": "Amtsgericht Fürth",
      "registernummer": "HRB 20837",
      "registerart": "HRB",
      "company_name": "Koch Holding GmbH",
      "company_seat": "Herzogenaurach",
      "details": "09.08.2025 (Bekanntmachungsdatum)\n\nBayern Amtsgericht Fürth HRB 20837\nRegisterbekanntmachung nach dem Umwandlungsgesetz 08.08.2025 (Eintragungsdatum)\n\nKoch Holding GmbH\nGesellschaft mit beschränkter Haftung\nHerzogenaurach\n\nDen Gläubigern der an der Verschmelzung beteiligten Rechtsträger ist, wenn sie binnen sechs Monaten nach dem Tag, an dem die Eintragung der Verschmelzung in das Register des Sitzes desjenigen Rechtsträgers, dessen Gläubiger sie sind, nach § 19 Abs. 3 UmwG als bekannt gemacht gilt, ihren Anspruch nach Grund und Höhe in Textform anmelden, Sicherheit zu leisten, soweit sie nicht Befriedigung verlangen können. Dieses Recht steht den Gläubigern jedoch nur zu, wenn sie glaubhaft machen, dass durch die Verschmelzung die Erfüllung ihrer Forderung gefährdet wird."
    },
    {
      "date": "2025-08-09",
      "id": "120266",
      "original_text": "Registerbekanntmachung nach dem Umwandlungsgesetz\nBayern Amtsgericht München HRB 216917\nBayWa Bau Projekt GmbH – München",
      "type": "Registerbekanntmachung nach dem Umwandlungsgesetz",
      "state": "Bayern",
      "amtsgericht": "Amtsgericht München",
      "registernummer": "HRB 216917",
      "registerart": "HRB",
      "company_name": "BayWa Bau Projekt GmbH",
      "company_seat": "München",
      "details": "09.08.2025 (Bekanntmachungsdatum)\n\nBayern Amtsgericht München HRB 216917\nRegisterbekanntmachung nach dem Umwandlungsgesetz 08.08.2025 (Eintragungsdatum)\n\nBayWa Bau Projekt GmbH\nGesellschaft mit beschränkter Haftung\nMünchen\n\nDen Gläubigern der an der Verschmelzung beteiligten Rechtsträger ist, wenn sie binnen sechs Monaten nach dem Tag, an dem die Eintragung der Verschmelzung in das Register des Sitzes desjenigen Rechtsträgers, dessen Gläubiger sie sind, nach § 19 Abs. 3 UmwG als bekannt gemacht gilt, ihren Anspruch nach Grund und Höhe in Textform anmelden, Sicherheit zu leisten, soweit sie nicht Befriedigung verlangen können. Dieses Recht steht den Gläubigern jedoch nur zu, wenn sie glaubhaft machen, dass durch die Verschmelzung die Erfüllung ihrer Forderung gefährdet wird."
    },
    {
      "date": "2025-08-09",
      "id": "120267",
      "original_text": "Registerbekanntmachung nach dem Umwandlungsgesetz\nBayern Amtsgericht München HRB 223076\nGQSystema AG – Grasbrunn",
      "type": "Registerbekanntmachung nach dem Umwandlungsgesetz",
      "state": "Bayern",
      "amtsgericht": "Amtsgericht München",
      "registernummer": "HRB 223076",
      "registerart": "HRB",
      "company_name": "GQSystema AG",
      "company_seat": "Grasbrunn",
      "details": "09.08.2025 (Bekanntmachungsdatum)\n\nBayern Amtsgericht München HRB 223076\nRegisterbekanntmachung nach dem Umwandlungsgesetz 08.08.2025 (Eintragungsdatum)\n\nGQSystema AG\nAktiengesellschaft\nGrasbrunn\n\nDen Gläubigern der an der Verschmelzung beteiligten Rechtsträger ist, wenn sie binnen sechs Monaten nach dem Tag, an dem die Eintragung der Verschmelzung in das Register des Sitzes desjenigen Rechtsträgers, dessen Gläubiger sie sind, nach § 19 Abs. 3 UmwG als bekannt gemacht gilt, ihren Anspruch nach Grund und Höhe in Textform anmelden, Sicherheit zu leisten, soweit sie nicht Befriedigung verlangen können. Dieses Recht steht den Gläubigern jedoch nur zu, wenn sie glaubhaft machen, dass durch die Verschmelzung die Erfüllung ihrer Forderung gefährdet wird."
    },
    {
      "date": "2025-08-09",
      "id": "120268",
      "original_text": "Löschungsankündigung\nBayern Amtsgericht Bayreuth HRB 7035\nKings on Horses Verwaltungs GmbH – Seybothenreuth",
      "type": "Löschungsankündigung",
      "state": "Bayern",
      "amtsgericht": "Amtsgericht Bayreuth",
      "registernummer": "HRB 7035",
      "registerart": "HRB",
      "company_name": "Kings on Horses Verwaltungs GmbH",
      "company_seat": "Seybothenreuth",
      "details": "09.08.2025 (Bekanntmachungsdatum)\n\nBayern Amtsgericht Bayreuth HRB 7035\nLöschungsankündigung\n\nKings on Horses Verwaltungs GmbH\nGesellschaft mit beschränkter Haftung\nSeybothenreuth\n\nDas Registergericht beabsichtigt, die im Handelsregister eingetragene Gesellschaft wegen Vermögenslosigkeit von Amts wegen nach § 394 FamFG zu löschen. Die Frist zur Erhebung eines Widerspruchs ist auf einen Monat festgesetzt."
    },
    {
      "date": "2025-08-09",
      "id": "120269",
      "original_text": "Löschungsankündigung\nBayern Amtsgericht München HRB 278423\nFier Räde UG (haftungsbeschränkt) – München",
      "type": "Löschungsankündigung",
      "state": "Bayern",
      "amtsgericht": "Amtsgericht München",
      "registernummer": "HRB 278423",
      "registerart": "HRB",
      "company_name": "Fier Räde UG (haftungsbeschränkt)",
      "company_seat": "München",
      "details": "09.08.2025 (Bekanntmachungsdatum)\n\nBayern Amtsgericht München HRB 278423\nLöschungsankündigung 08.08.2025 (Eintragungsdatum)\n\nFier Räde UG (haftungsbeschränkt)\nGesellschaft mit beschränkter Haftung\nMünchen\n\nDas Registergericht beabsichtigt, die im Handelsregister eingetragene Gesellschaft wegen Vermögenslosigkeit von Amts wegen nach § 394 FamFG zu löschen. Die Frist zur Erhebung eines Widerspruchs ist auf drei Monate festgesetzt."
    },
    {
      "date": "2025-08-09",
      "id": "120270",
      "original_text": "Einreichung neuer Dokumente\nBayern Amtsgericht Nürnberg HRB 202\nLEONI AG – Nürnberg",
      "type": "Einreichung neuer Dokumente",
      "state": "Bayern",
      "amtsgericht": "Amtsgericht Nürnberg",
      "registernummer": "HRB 202",
      "registerart": "HRB",
      "company_name": "LEONI AG",
      "company_seat": "Nürnberg",
      "details": "09.08.2025 (Bekanntmachungsdatum)\n\nBayern Amtsgericht Nürnberg HRB 202\nEinreichung neuer Dokumente 08.08.2025 (Eintragungsdatum)\n\nLEONI AG\nAktiengesellschaft\nNürnberg\n\nDem #Re.Name ist eine Liste der Mitglieder des Aufsichtsrats eingereicht worden, § 106 AktG."
    },
    {
      "date": "2025-08-09",
      "id": "120271",
      "original_text": "Sonstige Registerbekanntmachung\nBayern Amtsgericht Traunstein GnR 78\nRaiffeisenbank Haag-Gars-Maitenbeth eG – Haag i.OB",
      "type": "Sonstige Registerbekanntmachung",
      "state": "Bayern",
      "amtsgericht": "Amtsgericht Traunstein",
      "registernummer": "GnR 78",
      "registerart": "GnR",
      "company_name": "Raiffeisenbank Haag-Gars-Maitenbeth eG",
      "company_seat": "Haag i.OB",
      "details": "09.08.2025 (Bekanntmachungsdatum)\n\nBayern Amtsgericht Traunstein GnR 78\nSonstige Registerbekanntmachung 08.08.2025 (Eintragungsdatum)\n\nRaiffeisenbank Haag-Gars-Maitenbeth eG\neingetragene Genossenschaft\nHaag i.OB\n\nDie Generalversammlung vom 24.06.2025 hat die Änderung der Satzung beschlossen. Aufgrund der Änderung der Satzung ist die Nachschusspflicht entfallen. Den Gläubigern der Genossenschaft ist gemäß §§ 22a i.V.m. 22 GenG, wenn sie sich binnen sechs Monaten nach der Bekanntmachung bei der Genossenschaft zu diesem Zweck melden, Sicherheit zu leisten, soweit sie nicht Befriedigung verlangen können."
    },
    {
      "date": "2025-08-09",
      "id": "120272",
      "original_text": "Löschungsankündigung\nBayern Amtsgericht Nürnberg HRB 32595\nSk Mypower Industrieservice GmbH – Nürnberg",
      "type": "Löschungsankündigung",
      "state": "Bayern",
      "amtsgericht": "Amtsgericht Nürnberg",
      "registernummer": "HRB 32595",
      "registerart": "HRB",
      "company_name": "Sk Mypower Industrieservice GmbH",
      "company_seat": "Nürnberg",
      "details": "09.08.2025 (Bekanntmachungsdatum)\n\nBayern Amtsgericht Nürnberg HRB 32595\nLöschungsankündigung\n\nSk Mypower Industrieservice GmbH\nGesellschaft mit beschränkter Haftung\nNürnberg\n\nDas Registergericht beabsichtigt, die im Handelsregister eingetragene Gesellschaft wegen Vermögenslosigkeit von Amts wegen nach § 394 FamFG zu löschen. Die Frist zur Erhebung eines Widerspruchs ist auf einen Monat festgesetzt."
    },
    {
      "date": "2025-08-09",
      "id": "120273",
      "original_text": "Registerbekanntmachung nach dem Umwandlungsgesetz\nBayern Amtsgericht München HRA 121452\nMalereibetrieb Maier Inh. Willi Grimm e.K. – München",
      "type": "Registerbekanntmachung nach dem Umwandlungsgesetz",
      "state": "Bayern",
      "amtsgericht": "Amtsgericht München",
      "registernummer": "HRA 121452",
      "registerart": "HRA",
      "company_name": "Malereibetrieb Maier Inh. Willi Grimm e.K.",
      "company_seat": "München",
      "details": "09.08.2025 (Bekanntmachungsdatum)\n\nBayern Amtsgericht München HRA 121452\nRegisterbekanntmachung nach dem Umwandlungsgesetz 08.08.2025 (Eintragungsdatum)\n\nMalereibetrieb Maier Inh. Willi Grimm e.K.\nEinzelkaufmann / Einzelkauffrau\nMünchen\n\nDen Gläubigern der an der Verschmelzung beteiligten Rechtsträger ist, wenn sie binnen sechs Monaten nach dem Tag, an dem die Eintragung der Verschmelzung in das Register des Sitzes desjenigen Rechtsträgers, dessen Gläubiger sie sind, nach § 19 Abs. 3 UmwG als bekannt gemacht gilt, ihren Anspruch nach Grund und Höhe in Textform anmelden, Sicherheit zu leisten, soweit sie nicht Befriedigung verlangen können. Dieses Recht steht den Gläubigern jedoch nur zu, wenn sie glaubhaft machen, dass durch die Verschmelzung die Erfüllung ihrer Forderung gefährdet wird."
    },
    {
      "date": "2025-08-09",
      "id": "120274",
      "original_text": "Löschungsankündigung\nBayern Amtsgericht München HRB 232707\nN.N. INVESTMENT GmbH – München",
      "type": "Löschungsankündigung",
      "state": "Bayern",
      "amtsgericht": "Amtsgericht München",
      "registernummer": "HRB 232707",
      "registerart": "HRB",
      "company_name": "N.N. INVESTMENT GmbH",
      "company_seat": "München",
      "details": "09.08.2025 (Bekanntmachungsdatum)\n\nBayern Amtsgericht München HRB 232707\nLöschungsankündigung 08.08.2025 (Eintragungsdatum)\n\nN.N. INVESTMENT GmbH\nGesellschaft mit beschränkter Haftung\nMünchen\n\nDas Registergericht beabsichtigt, die im Handelsregister eingetragene Gesellschaft wegen Vermögenslosigkeit von Amts wegen nach § 394 FamFG zu löschen. Die Frist zur Erhebung eines Widerspruchs ist auf drei Monate festgesetzt."
    },
    {
      "date": "2025-08-09",
      "id": "120275",
      "original_text": "Registerbekanntmachung nach dem Umwandlungsgesetz\nBayern Amtsgericht München HRB 266718\nX1F Management & Technology Services GmbH – München",
      "type": "Registerbekanntmachung nach dem Umwandlungsgesetz",
      "state": "Bayern",
      "amtsgericht": "Amtsgericht München",
      "registernummer": "HRB 266718",
      "registerart": "HRB",
      "company_name": "X1F Management & Technology Services GmbH",
      "company_seat": "München",
      "details": "09.08.2025 (Bekanntmachungsdatum)\n\nBayern Amtsgericht München HRB 266718\nRegisterbekanntmachung nach dem Umwandlungsgesetz 08.08.2025 (Eintragungsdatum)\n\nX1F Management & Technology Services GmbH\nGesellschaft mit beschränkter Haftung\nMünchen\n\nDen Gläubigern der an den Verschmelzungen beteiligten Rechtsträger ist, wenn sie binnen sechs Monaten nach dem Tag, an dem die Eintragung der Verschmelzung in das Register des Sitzes desjenigen Rechtsträgers, dessen Gläubiger sie sind, nach § 19 Abs. 3 UmwG als bekannt gemacht gilt, ihren Anspruch nach Grund und Höhe in Textform anmelden, Sicherheit zu leisten, soweit sie nicht Befriedigung verlangen können. Dieses Recht steht den Gläubigern jedoch nur zu, wenn sie glaubhaft machen, dass durch die Verschmelzung die Erfüllung ihrer Forderung gefährdet wird."
    },
    {
      "date": "2025-08-09",
      "id": "120276",
      "original_text": "Registerbekanntmachung nach dem Umwandlungsgesetz\nBayern Amtsgericht München HRB 267398\nWild Cuisine UG (haftungsbeschränkt) – Fischbachau",
      "type": "Registerbekanntmachung nach dem Umwandlungsgesetz",
      "state": "Bayern",
      "amtsgericht": "Amtsgericht München",
      "registernummer": "HRB 267398",
      "registerart": "HRB",
      "company_name": "Wild Cuisine UG (haftungsbeschränkt)",
      "company_seat": "Fischbachau",
      "details": "09.08.2025 (Bekanntmachungsdatum)\n\nBayern Amtsgericht München HRB 267398\nRegisterbekanntmachung nach dem Umwandlungsgesetz 08.08.2025 (Eintragungsdatum)\n\nWild Cuisine UG (haftungsbeschränkt)\nGesellschaft mit beschränkter Haftung\nFischbachau\n\nDen Gläubigern der an der Verschmelzung beteiligten Rechtsträger ist, wenn sie binnen sechs Monaten nach dem Tag, an dem die Eintragung der Verschmelzung in das Register des Sitzes desjenigen Rechtsträgers, dessen Gläubiger sie sind, nach § 19 Abs. 3 UmwG als bekannt gemacht gilt, ihren Anspruch nach Grund und Höhe in Textform anmelden, Sicherheit zu leisten, soweit sie nicht Befriedigung verlangen können. Dieses Recht steht den Gläubigern jedoch nur zu, wenn sie glaubhaft machen, dass durch die Verschmelzung die Erfüllung ihrer Forderung gefährdet wird."
    },
    {
      "date": "2025-08-09",
      "id": "120277",
      "original_text": "Registerbekanntmachung nach dem Umwandlungsgesetz\nBayern Amtsgericht München HRB 228162\nAxel Gerstner GmbH – Forstern",
      "type": "Registerbekanntmachung nach dem Umwandlungsgesetz",
      "state": "Bayern",
      "amtsgericht": "Amtsgericht München",
      "registernummer": "HRB 228162",
      "registerart": "HRB",
      "company_name": "Axel Gerstner GmbH",
      "company_seat": "Forstern",
      "details": "09.08.2025 (Bekanntmachungsdatum)\n\nBayern Amtsgericht München HRB 228162\nRegisterbekanntmachung nach dem Umwandlungsgesetz 08.08.2025 (Eintragungsdatum)\n\nAxel Gerstner GmbH\nGesellschaft mit beschränkter Haftung\nForstern\n\nDen Gläubigern der an der Verschmelzung beteiligten Rechtsträger ist, wenn sie binnen sechs Monaten nach dem Tag, an dem die Eintragung der Verschmelzung in das Register des Sitzes desjenigen Rechtsträgers, dessen Gläubiger sie sind, nach § 19 Abs. 3 UmwG als bekannt gemacht gilt, ihren Anspruch nach Grund und Höhe in Textform anmelden, Sicherheit zu leisten, soweit sie nicht Befriedigung verlangen können. Dieses Recht steht den Gläubigern jedoch nur zu, wenn sie glaubhaft machen, dass durch die Verschmelzung die Erfüllung ihrer Forderung gefährdet wird."
    },
    {
      "date": "2025-08-09",
      "id": "120278",
      "original_text": "Registerbekanntmachung nach dem Umwandlungsgesetz\nBayern Amtsgericht Regensburg HRB 21580\nMAH Security GmbH – Zeitlarn",
      "type": "Registerbekanntmachung nach dem Umwandlungsgesetz",
      "state": "Bayern",
      "amtsgericht": "Amtsgericht Regensburg",
      "registernummer": "HRB 21580",
      "registerart": "HRB",
      "company_name": "MAH Security GmbH",
      "company_seat": "Zeitlarn",
      "details": "09.08.2025 (Bekanntmachungsdatum)\n\nBayern Amtsgericht Regensburg HRB 21580\nRegisterbekanntmachung nach dem Umwandlungsgesetz 08.08.2025 (Eintragungsdatum)\n\nMAH Security GmbH\nGesellschaft mit beschränkter Haftung\nZeitlarn\n\nDen Gläubigern der an der Ausgliederung beteiligten Rechtsträger ist, wenn sie binnen sechs Monaten nach dem Tag, an dem die Eintragung der Ausgliederung in das Register des Sitzes desjenigen Rechtsträgers, dessen Gläubiger sie sind, nach §§ 125, 19 Abs. 3 UmwG als bekannt gemacht gilt, ihren Anspruch nach Grund und Höhe in Textform anmelden, Sicherheit zu leisten, soweit sie nicht Befriedigung verlangen können. Dieses Recht steht den Gläubigern jedoch nur zu, wenn sie glaubhaft machen, dass durch die Ausgliederung die Erfüllung ihrer Forderung gefährdet wird."
    },
    {
      "date": "2025-08-09",
      "id": "120279",
      "original_text": "Registerbekanntmachung nach dem Umwandlungsgesetz\nBayern Amtsgericht Regensburg HRA 11144\nAl Halaki e. K. – Zeitlarn",
      "type": "Registerbekanntmachung nach dem Umwandlungsgesetz",
      "state": "Bayern",
      "amtsgericht": "Amtsgericht Regensburg",
      "registernummer": "HRA 11144",
      "registerart": "HRA",
      "company_name": "Al Halaki e. K.",
      "company_seat": "Zeitlarn",
      "details": "09.08.2025 (Bekanntmachungsdatum)\n\nBayern Amtsgericht Regensburg HRA 11144\nRegisterbekanntmachung nach dem Umwandlungsgesetz 08.08.2025 (Eintragungsdatum)\n\nAl Halaki e. K.\nEinzelkaufmann / Einzelkauffrau\nZeitlarn\n\nDen Gläubigern der an der Ausgliederung beteiligten Rechtsträger ist, wenn sie binnen sechs Monaten nach dem Tag, an dem die Eintragung der Ausgliederung in das Register des Sitzes desjenigen Rechtsträgers, dessen Gläubiger sie sind, nach §§ 125, 19 Abs. 3 UmwG als bekannt gemacht gilt, ihren Anspruch nach Grund und Höhe in Textform anmelden, Sicherheit zu leisten, soweit sie nicht Befriedigung verlangen können. Dieses Recht steht den Gläubigern jedoch nur zu, wenn sie glaubhaft machen, dass durch die Ausgliederung die Erfüllung ihrer Forderung gefährdet wird."
    }
  ]
}